Sheet: BOOK
A1: INDEX | B1: SUPER | C1: TYPE | D1: NAME | E1: _class | F1: DESCRIPTION | G1: REQUIRE | H1: ACTIVITYITEM | I1: ITEMDESCRIPTION | J1: SCORE | K1: ORDERS | L1: ART | M1: CODE
A2: 1 | C2: BOOK | D2: 人物宝典 | F2: 和英雄相关的东西 | K2: replenishlifeoff | L2: ReplaceableTextures\CommandButtons\BTNSorceressMaster.blp | M2: ="let _b"&RC[-12]&" = new Book("&RC[-12]&","""&RC[-9]&""")" -> let _b1 = new Book(1,"人物宝典")
A3: 2 | B3: 1 | C3: SUBBOOK | D3: 套装 | F3: 融合的套装属性! | K3: magicleash | L3: ="blp\book\"&RC[-11]&".blp" -> blp\book\2.blp | M3: ="let _s"&RC[-12]&" = new SubBook("&RC[-12]&",_b"&RC[-11]&")" -> let _s2 = new SubBook(2,_b1)
A4: 3 | B4: 1 | C4: SUBBOOK | D4: 炼体 | F4: 锻炼属性! | K4: restorationoff | L4: ="blp\book\"&RC[-11]&".blp" -> blp\book\3.blp | M4: ="let _s"&RC[-12]&" = new SubBook("&RC[-12]&",_b"&RC[-11]&")" -> let _s3 = new SubBook(3,_b1)
A5: 4 | B5: 1 | C5: SUBBOOK | D5: 轮回 | F5: 轮回中保留的轮回技能! | K5: replenishmanaoff | L5: ="blp\book\"&RC[-11]&".blp" -> blp\book\4.blp | M5: ="let _s"&RC[-12]&" = new SubBook("&RC[-12]&",_b"&RC[-11]&")" -> let _s4 = new SubBook(4,_b1)
A6: 5 | B6: 1 | C6: SUBBOOK | D6: 皮肤-未开放 | F6: 当前角色可激活的皮肤! | K6: replenishoff | L6: ="blp\book\"&RC[-11]&".blp" -> blp\book\5.blp | M6: ="let _s"&RC[-12]&" = new SubBook("&RC[-12]&",_b"&RC[-11]&")" -> let _s5 = new SubBook(5,_b1)
A7: 105 | B7: 3 | C7: PAGE | D7: =""&RC[1]&"次炼体" -> 0次炼体 | E7: 0 | F7: =VLOOKUP(RC[-2],Sheet3!R2C4:R90C6,3,0) -> |cFFFFFF99基础属性|r|n攻击:2000|n力量:500|n敏捷:500|n智力:500|n血量:50000|n护甲:3147 | G7: ="达到:"&RC[-3] -> 达到:0次炼体 | H7: ="[转生]"&""&RC[-4] -> [转生]0次炼体 | I7: 炼体,增加基础属性 | L7: blp\book\3.blp | M7: ="let _p"&RC[-12]&" = new Page("&RC[-12]&",_s"&RC[-11]&")" -> let _p105 = new Page(105,_s3)
A8: 106 | B8: 3 | C8: PAGE | D8: =""&RC[1]&"次炼体" -> 1次炼体 | E8: 1 | F8: =VLOOKUP(RC[-2],Sheet3!R2C4:R90C6,3,0) -> |cFFFFFF99基础属性|r|n护甲:3962|n|cFFFFFF55附加属性|r(%)|n伤害增幅:5|n附加伤害:5|n|cFFFFFF11核心属性|r|n升级属性:50|n杀敌属性:1|n每秒属性:2 | G8: ="达到:"&RC[-3] -> 达到:1次炼体 | H8: ="[转生]"&""&RC[-4] -> [转生]1次炼体 | I8: 炼体,增加基础属性 | L8: blp\book\3.blp | M8: ="let _p"&RC[-12]&" = new Page("&RC[-12]&",_s"&RC[-11]&")" -> let _p106 = new Page(106,_s3)
A9: 107 | B9: 3 | C9: PAGE | D9: =""&RC[1]&"次炼体" -> 2次炼体 | E9: 2 | F9: =VLOOKUP(RC[-2],Sheet3!R2C4:R90C6,3,0) -> |cFFFFFF99基础属性|r|n护甲:4988|n|cFFFFFF55附加属性|r(%)|n伤害增幅:10|n附加伤害:10|n|cFFFFFF11核心属性|r|n升级属性:100|n杀敌属性:2|n每秒属性:4 | G9: ="达到:"&RC[-3] -> 达到:2次炼体 | H9: ="[转生]"&""&RC[-4] -> [转生]2次炼体 | I9: 炼体,增加基础属性 | L9: blp\book\3.blp | M9: ="let _p"&RC[-12]&" = new Page("&RC[-12]&",_s"&RC[-11]&")" -> let _p107 = new Page(107,_s3)
A10: 108 | B10: 3 | C10: PAGE | D10: =""&RC[1]&"次炼体" -> 3次炼体 | E10: 3 | F10: =VLOOKUP(RC[-2],Sheet3!R2C4:R90C6,3,0) -> |cFFFFFF99基础属性|r|n护甲:6279|n|cFFFFFF55附加属性|r(%)|n伤害增幅:15|n附加伤害:15|n|cFFFFFF11核心属性|r|n升级属性:150|n杀敌属性:3|n每秒属性:6 | G10: ="达到:"&RC[-3] -> 达到:3次炼体 | H10: ="[转生]"&""&RC[-4] -> [转生]3次炼体 | I10: 炼体,增加基础属性 | L10: blp\book\3.blp | M10: ="let _p"&RC[-12]&" = new Page("&RC[-12]&",_s"&RC[-11]&")" -> let _p108 = new Page(108,_s3)
A11: 109 | B11: 3 | C11: PAGE | D11: =""&RC[1]&"次炼体" -> 4次炼体 | E11: 4 | F11: =VLOOKUP(RC[-2],Sheet3!R2C4:R90C6,3,0) -> |cFFFFFF99基础属性|r|n护甲:7905|n|cFFFFFF55附加属性|r(%)|n伤害增幅:20|n附加伤害:20|n|cFFFFFF11核心属性|r|n升级属性:200|n杀敌属性:4|n每秒属性:8 | G11: ="达到:"&RC[-3] -> 达到:4次炼体 | H11: ="[转生]"&""&RC[-4] -> [转生]4次炼体 | I11: 炼体,增加基础属性 | L11: blp\book\3.blp | M11: ="let _p"&RC[-12]&" = new Page("&RC[-12]&",_s"&RC[-11]&")" -> let _p109 = new Page(109,_s3)
A12: 110 | B12: 3 | C12: PAGE | D12: =""&RC[1]&"次炼体" -> 5次炼体 | E12: 5 | F12: =VLOOKUP(RC[-2],Sheet3!R2C4:R90C6,3,0) -> |cFFFFFF99基础属性|r|n护甲:9952|n|cFFFFFF55附加属性|r(%)|n伤害增幅:25|n附加伤害:25|n|cFFFFFF11核心属性|r|n升级属性:250|n杀敌属性:5|n每秒属性:10 | G12: ="达到:"&RC[-3] -> 达到:5次炼体 | H12: ="[转生]"&""&RC[-4] -> [转生]5次炼体 | I12: 炼体,增加基础属性 | L12: blp\book\3.blp | M12: ="let _p"&RC[-12]&" = new Page("&RC[-12]&",_s"&RC[-11]&")" -> let _p110 = new Page(110,_s3)
A13: 111 | B13: 3 | C13: PAGE | D13: =""&RC[1]&"次炼体" -> 6次炼体 | E13: 6 | F13: =VLOOKUP(RC[-2],Sheet3!R2C4:R90C6,3,0) -> |cFFFFFF99基础属性|r|n护甲:12529|n|cFFFFFF55附加属性|r(%)|n伤害增幅:30|n附加伤害:30|n|cFFFFFF11核心属性|r|n升级属性:300|n杀敌属性:6|n每秒属性:12 | G13: ="达到:"&RC[-3] -> 达到:6次炼体 | H13: ="[转生]"&""&RC[-4] -> [转生]6次炼体 | I13: 炼体,增加基础属性 | L13: blp\book\3.blp | M13: ="let _p"&RC[-12]&" = new Page("&RC[-12]&",_s"&RC[-11]&")" -> let _p111 = new Page(111,_s3)
A14: 112 | B14: 3 | C14: PAGE | D14: =""&RC[1]&"次炼体" -> 7次炼体 | E14: 7 | F14: =VLOOKUP(RC[-2],Sheet3!R2C4:R90C6,3,0) -> |cFFFFFF99基础属性|r|n护甲:15773|n|cFFFFFF55附加属性|r(%)|n伤害增幅:35|n附加伤害:35|n|cFFFFFF11核心属性|r|n升级属性:350|n杀敌属性:7|n每秒属性:14 | G14: ="达到:"&RC[-3] -> 达到:7次炼体 | H14: ="[转生]"&""&RC[-4] -> [转生]7次炼体 | I14: 炼体,增加基础属性 | L14: blp\book\3.blp | M14: ="let _p"&RC[-12]&" = new Page("&RC[-12]&",_s"&RC[-11]&")" -> let _p112 = new Page(112,_s3)
A15: 113 | B15: 3 | C15: PAGE | D15: =""&RC[1]&"次炼体" -> 8次炼体 | E15: 8 | F15: =VLOOKUP(RC[-2],Sheet3!R2C4:R90C6,3,0) -> |cFFFFFF99基础属性|r|n护甲:19858|n|cFFFFFF55附加属性|r(%)|n伤害增幅:40|n附加伤害:40|n|cFFFFFF11核心属性|r|n升级属性:400|n杀敌属性:8|n每秒属性:16 | G15: ="达到:"&RC[-3] -> 达到:8次炼体 | H15: ="[转生]"&""&RC[-4] -> [转生]8次炼体 | I15: 炼体,增加基础属性 | L15: blp\book\3.blp | M15: ="let _p"&RC[-12]&" = new Page("&RC[-12]&",_s"&RC[-11]&")" -> let _p113 = new Page(113,_s3)
A16: 114 | B16: 3 | C16: PAGE | D16: =""&RC[1]&"次炼体" -> 9次炼体 | E16: 9 | F16: =VLOOKUP(RC[-2],Sheet3!R2C4:R90C6,3,0) -> |cFFFFFF99基础属性|r|n护甲:25000|n|cFFFFFF55附加属性|r(%)|n伤害增幅:45|n附加伤害:45|n|cFFFFFF11核心属性|r|n升级属性:450|n杀敌属性:9|n每秒属性:18 | G16: ="达到:"&RC[-3] -> 达到:9次炼体 | H16: ="[转生]"&""&RC[-4] -> [转生]9次炼体 | I16: 炼体,增加基础属性 | L16: blp\book\3.blp | M16: ="let _p"&RC[-12]&" = new Page("&RC[-12]&",_s"&RC[-11]&")" -> let _p114 = new Page(114,_s3)
A17: 115 | B17: 3 | C17: PAGE | D17: =""&RC[1]&"次炼体" -> 10次炼体 | E17: 10 | F17: =VLOOKUP(RC[-2],Sheet3!R2C4:R90C6,3,0) -> |cFFFFFF99基础属性|r|n护甲:31473|n|cFFFFFF55附加属性|r(%)|n伤害增幅:50|n附加伤害:50|n|cFFFFFF11核心属性|r|n升级属性:500|n杀敌属性:10|n每秒属性:20 | G17: ="达到:"&RC[-3] -> 达到:10次炼体 | H17: ="[转生]"&""&RC[-4] -> [转生]10次炼体 | I17: 炼体,增加基础属性 | L17: blp\book\3.blp | M17: ="let _p"&RC[-12]&" = new Page("&RC[-12]&",_s"&RC[-11]&")" -> let _p115 = new Page(115,_s3)
A18: 9 | C18: BOOK | D18: 搜集图鉴 | F18: 世间流传的各种珍宝! | K18: healon | L18: ="blp\book\"&RC[-11]&".blp" -> blp\book\9.blp | M18: ="let _b"&RC[-12]&" = new Book("&RC[-12]&","""&RC[-9]&""")" -> let _b9 = new Book(9,"搜集图鉴")
A19: 10 | B19: 9 | C19: SUBBOOK | D19: 神器 | F19: [存档]|n世间流传的神器。每件神器需要吸收足够多的能量才能发挥它的作用。 | K19: barkskinoff | L19: ="blp\book\"&RC[-11]&".blp" -> blp\book\10.blp | M19: ="let _s"&RC[-12]&" = new SubBook("&RC[-12]&",_b"&RC[-11]&")" -> let _s10 = new SubBook(10,_b9)
A20: 11 | B20: 9 | C20: SUBBOOK | D20: 宝珠 | F20: [非存档]|n传说中的宝珠!合成之后显示在这里! | K20: barkskinon | L20: ="blp\book\"&RC[-11]&".blp" -> blp\book\11.blp | M20: ="let _s"&RC[-12]&" = new SubBook("&RC[-12]&",_b"&RC[-11]&")" -> let _s11 = new SubBook(11,_b9)
A21: 12 | B21: 9 | C21: SUBBOOK | D21: 传说-未开放 | F21: 传说中的道具，可以增强能力! | K21: blackarrowoff | L21: ="blp\book\"&RC[-11]&".blp" -> blp\book\12.blp | M21: ="let _s"&RC[-12]&" = new SubBook("&RC[-12]&",_b"&RC[-11]&")" -> let _s12 = new SubBook(12,_b9)
A22: 13 | B22: 9 | C22: SUBBOOK | D22: 圣魂 | F22: [信仰]|n神圣之魂!轮回完毕可以选择信仰,将基本装备合成圣魂! | K22: bloodlustoff | L22: ="blp\book\"&RC[-11]&".blp" -> blp\book\13.blp | M22: ="let _s"&RC[-12]&" = new SubBook("&RC[-12]&",_b"&RC[-11]&")" -> let _s13 = new SubBook(13,_b9)
A23: 14 | B23: 10 | C23: PAGE | D23: ="[神器]"&RC[1]&"" -> [神器]霜之哀伤 | E23: 霜之哀伤 | F23: 带着邪恶的强大力量，又带着哀伤的悲剧色彩的神器。|n能量值满足[]内数值时,激活后面的效果! | G23: ="激活:"&RC[-3] -> 激活:[神器]霜之哀伤 | H23: ="[激活]"&""&RC[-4] -> [激活][神器]霜之哀伤 | L23: ="blp\book\"&RC[-11]&".blp" -> blp\book\14.blp | M23: ="let _p"&RC[-12]&" = new Page("&RC[-12]&",_s"&RC[-11]&")" -> let _p14 = new Page(14,_s10)
A24: 15 | B24: 10 | C24: PAGE | D24: ="[神器]"&RC[1]&"" -> [神器]逐风之剑 | E24: 逐风之剑 | F24: 雷霆之怒-逐风者的祝福之剑。|n能量值满足[]内数值时,激活后面的效果! | G24: ="激活:"&RC[-3] -> 激活:[神器]逐风之剑 | H24: ="[激活]"&""&RC[-4] -> [激活][神器]逐风之剑 | L24: ="blp\book\"&RC[-11]&".blp" -> blp\book\15.blp | M24: ="let _p"&RC[-12]&" = new Page("&RC[-12]&",_s"&RC[-11]&")" -> let _p15 = new Page(15,_s10)
A25: 16 | B25: 10 | C25: PAGE | D25: ="[神器]"&RC[1]&"" -> [神器]炎魔之手 | E25: 炎魔之手 | F25: 萨弗拉斯-炎魔拉格纳罗斯之手。|n能量值满足[]内数值时,激活后面的效果! | G25: ="激活:"&RC[-3] -> 激活:[神器]炎魔之手 | H25: ="[激活]"&""&RC[-4] -> [激活][神器]炎魔之手 | L25: ="blp\book\"&RC[-11]&".blp" -> blp\book\16.blp | M25: ="let _p"&RC[-12]&" = new Page("&RC[-12]&",_s"&RC[-11]&")" -> let _p16 = new Page(16,_s10)
A26: 17 | B26: 10 | C26: PAGE | D26: ="[神器]"&RC[1]&" - 未开放" -> [神器]灰烬使者 - 未开放 | E26: 灰烬使者 | F26: 圣光信徒所净化所铸造，能够将亡灵化为灰烬。|n能量值满足[]内数值时,激活后面的效果! | G26: ="激活:"&RC[-3] -> 激活:[神器]灰烬使者 - 未开放 | H26: ="[激活]"&""&RC[-4] -> [激活][神器]灰烬使者 - 未开放 | L26: ="blp\book\"&RC[-11]&".blp" -> blp\book\17.blp | M26: ="let _p"&RC[-12]&" = new Page("&RC[-12]&",_s"&RC[-11]&")" -> let _p17 = new Page(17,_s10)
A27: 18 | B27: 10 | C27: PAGE | D27: ="[神器]"&RC[1]&" - 未开放" -> [神器]埃辛诺斯战刃 - 未开放 | E27: 埃辛诺斯战刃 | F27: 万年前的上古之战中，伊利丹从末日守卫军中缴获。|n能量值满足[]内数值时,激活后面的效果! | G27: ="激活:"&RC[-3] -> 激活:[神器]埃辛诺斯战刃 - 未开放 | H27: ="[激活]"&""&RC[-4] -> [激活][神器]埃辛诺斯战刃 - 未开放 | L27: ="blp\book\"&RC[-11]&".blp" -> blp\book\18.blp | M27: ="let _p"&RC[-12]&" = new Page("&RC[-12]&",_s"&RC[-11]&")" -> let _p18 = new Page(18,_s10)
A28: 19 | B28: 10 | C28: PAGE | D28: ="[神器]"&RC[1]&" - 未开放" -> [神器]群星之怒 - 未开放 | E28: 群星之怒 | F28: 索利达尔-群星之怒，一把传奇弓箭。|n能量值满足[]内数值时,激活后面的效果! | G28: ="激活:"&RC[-3] -> 激活:[神器]群星之怒 - 未开放 | H28: ="[激活]"&""&RC[-4] -> [激活][神器]群星之怒 - 未开放 | L28: ="blp\book\"&RC[-11]&".blp" -> blp\book\19.blp | M28: ="let _p"&RC[-12]&" = new Page("&RC[-12]&",_s"&RC[-11]&")" -> let _p19 = new Page(19,_s10)
A29: 20 | B29: 10 | C29: PAGE | D29: ="[神器]"&RC[1]&" - 未开放" -> [神器]毁灭之锤 - 未开放 | E29: 毁灭之锤 | F29: 用元素熔岩铸造而成，唯有能与元素沟通的人可以使用。|n能量值满足[]内数值时,激活后面的效果! | G29: ="激活:"&RC[-3] -> 激活:[神器]毁灭之锤 - 未开放 | H29: ="[激活]"&""&RC[-4] -> [激活][神器]毁灭之锤 - 未开放 | L29: ="blp\book\"&RC[-11]&".blp" -> blp\book\20.blp | M29: ="let _p"&RC[-12]&" = new Page("&RC[-12]&",_s"&RC[-11]&")" -> let _p20 = new Page(20,_s10)
A30: 21 | B30: 10 | C30: PAGE | D30: ="[神器]"&RC[1]&" - 未开放" -> [神器]龙父之牙 - 未开放 | E30: 龙父之牙 | F30: 用死亡之翼的牙齿打造的武器。|n能量值满足[]内数值时,激活后面的效果! | G30: ="激活:"&RC[-3] -> 激活:[神器]龙父之牙 - 未开放 | H30: ="[激活]"&""&RC[-4] -> [激活][神器]龙父之牙 - 未开放 | L30: ="blp\book\"&RC[-11]&".blp" -> blp\book\21.blp | M30: ="let _p"&RC[-12]&" = new Page("&RC[-12]&",_s"&RC[-11]&")" -> let _p21 = new Page(21,_s10)
A31: 22 | B31: 11 | C31: PAGE | D31: 永恒者时间宝珠 | E31: 时空石 | F31: =VLOOKUP(RC[-2],Sheet3!R2C4:R90C6,3,0) -> |cFFFFFF99基础属性|r|n力量:600000|n敏捷:600000|n智力:600000|n|cFFFFFF11核心属性|r|n每秒属性:2500|n|cFFCCCCCC本局有效|r | G31: ="获得:"&RC[-3] -> 获得:永恒者时间宝珠 | H31: ="[激活]"&"点击使用"&RC[-3]&"激活第一层效果!" -> [激活]点击使用时空石激活第一层效果! | L31: ="blp\book\"&RC[-11]&".blp" -> blp\book\22.blp | M31: ="let _p"&RC[-12]&" = new Page("&RC[-12]&",_s"&RC[-11]&")" -> let _p22 = new Page(22,_s11)
A32: 23 | B32: 11 | C32: PAGE | D32: 缚誓者生命宝珠 | E32: 生命石 | F32: =VLOOKUP(RC[-2],Sheet3!R2C4:R90C6,3,0) -> |cFFFFFF99基础属性|r|n血量:8000000|n|cFFFFFF11核心属性|r|n杀敌属性:500|n|cFFCCCCCC本局有效|r | G32: ="获得:"&RC[-3] -> 获得:缚誓者生命宝珠 | H32: ="[激活]"&"点击使用"&RC[-3]&"激活第一层效果!" -> [激活]点击使用生命石激活第一层效果! | L32: ="blp\book\"&RC[-11]&".blp" -> blp\book\23.blp | M32: ="let _p"&RC[-12]&" = new Page("&RC[-12]&",_s"&RC[-11]&")" -> let _p23 = new Page(23,_s11)
A33: 24 | B33: 11 | C33: PAGE | D33: 典法者魔法宝珠 | E33: 魔法石 | F33: =VLOOKUP(RC[-2],Sheet3!R2C4:R90C6,3,0) -> |cFFFFFF99基础属性|r|n力量:600000|n敏捷:600000|n智力:600000|n|cFFFFFF11核心属性|r|n升级属性:12000|n|cFFCCCCCC本局有效|r | G33: ="获得:"&RC[-3] -> 获得:典法者魔法宝珠 | H33: ="[激活]"&"点击使用"&RC[-3]&"激活第一层效果!" -> [激活]点击使用魔法石激活第一层效果! | L33: ="blp\book\"&RC[-11]&".blp" -> blp\book\24.blp | M33: ="let _p"&RC[-12]&" = new Page("&RC[-12]&",_s"&RC[-11]&")" -> let _p24 = new Page(24,_s11)
A34: 25 | B34: 11 | C34: PAGE | D34: 觉醒者梦境宝珠 | E34: 梦境石 | F34: =VLOOKUP(RC[-2],Sheet3!R2C4:R90C6,3,0) -> |n|cFFFFFF55附加属性|r(%)|n伤害减免:25|n|cFFCCCCCC本局有效|r | G34: ="获得:"&RC[-3] -> 获得:觉醒者梦境宝珠 | H34: ="[激活]"&"点击使用"&RC[-3]&"激活第一层效果!" -> [激活]点击使用梦境石激活第一层效果! | L34: ="blp\book\"&RC[-11]&".blp" -> blp\book\25.blp | M34: ="let _p"&RC[-12]&" = new Page("&RC[-12]&",_s"&RC[-11]&")" -> let _p25 = new Page(25,_s11)
A35: 26 | B35: 11 | C35: PAGE | D35: 灭世者大地宝珠 | E35: 大地石 | F35: =VLOOKUP(RC[-2],Sheet3!R2C4:R90C6,3,0) -> |cFFFFFF99基础属性|r|n护甲:50000|n|cFFFFFF55附加属性|r(%)|n附加伤害:80|n|cFFCCCCCC本局有效|r | G35: ="获得:"&RC[-3] -> 获得:灭世者大地宝珠 | H35: ="[激活]"&"点击使用"&RC[-3]&"激活第一层效果!" -> [激活]点击使用大地石激活第一层效果! | L35: ="blp\book\"&RC[-11]&".blp" -> blp\book\26.blp | M35: ="let _p"&RC[-12]&" = new Page("&RC[-12]&",_s"&RC[-11]&")" -> let _p26 = new Page(26,_s11)
A36: 27 | B36: 11 | C36: PAGE | D36: 守护者泰坦宝珠 | E36: 泰坦石 | F36: =VLOOKUP(RC[-2],Sheet3!R2C4:R90C6,3,0) -> |cFFFFFF99基础属性|r|n攻击:2000000|n|cFFFFFF55附加属性|r(%)|n攻速:60|n|cFFCCCCCC本局有效|r | G36: ="获得:"&RC[-3] -> 获得:守护者泰坦宝珠 | H36: ="[激活]"&"点击使用"&RC[-3]&"激活第一层效果!" -> [激活]点击使用泰坦石激活第一层效果! | L36: ="blp\book\"&RC[-11]&".blp" -> blp\book\27.blp | M36: ="let _p"&RC[-12]&" = new Page("&RC[-12]&",_s"&RC[-11]&")" -> let _p27 = new Page(27,_s11)
A37: 28 | B37: 11 | C37: PAGE | D37: 观察者监视宝珠 | E37: 枢纽石 | F37: =VLOOKUP(RC[-2],Sheet3!R2C4:R90C6,3,0) -> |n|cFFFFFF55附加属性|r(%)|n攻击吸血:25|n|cFFCCCCCC本局有效|r | G37: ="获得:"&RC[-3] -> 获得:观察者监视宝珠 | H37: ="[激活]"&"点击使用"&RC[-3]&"激活第一层效果!" -> [激活]点击使用枢纽石激活第一层效果! | L37: ="blp\book\"&RC[-11]&".blp" -> blp\book\28.blp | M37: ="let _p"&RC[-12]&" = new Page("&RC[-12]&",_s"&RC[-11]&")" -> let _p28 = new Page(28,_s11)
A38: 29 | B38: 11 | C38: PAGE | D38: 弑君者冰封宝珠 | E38: 灵魂石 | F38: =VLOOKUP(RC[-2],Sheet3!R2C4:R90C6,3,0) -> |n|cFFFFFF55附加属性|r(%)|n暴击概率:10|n暴击伤害:80|n|cFFCCCCCC本局有效|r | G38: ="获得:"&RC[-3] -> 获得:弑君者冰封宝珠 | H38: ="[激活]"&"点击使用"&RC[-3]&"激活第一层效果!" -> [激活]点击使用灵魂石激活第一层效果! | L38: ="blp\book\"&RC[-11]&".blp" -> blp\book\29.blp | M38: ="let _p"&RC[-12]&" = new Page("&RC[-12]&",_s"&RC[-11]&")" -> let _p29 = new Page(29,_s11)
A39: 30 | B39: 12 | C39: PAGE | D39: 阿曼苏尔的预见 | G39: ="获得:"&RC[-3] -> 获得:阿曼苏尔的预见 | H39: ="[激活]"&""&RC[-4] -> [激活]阿曼苏尔的预见 | L39: ="blp\book\"&RC[-11]&".blp" -> blp\book\30.blp | M39: ="let _p"&RC[-12]&" = new Page("&RC[-12]&",_s"&RC[-11]&")" -> let _p30 = new Page(30,_s12)
A40: 31 | B40: 12 | C40: PAGE | D40: 基尔加丹的炽燃决心 | G40: ="获得:"&RC[-3] -> 获得:基尔加丹的炽燃决心 | H40: ="[激活]"&""&RC[-4] -> [激活]基尔加丹的炽燃决心 | L40: ="blp\book\"&RC[-11]&".blp" -> blp\book\31.blp | M40: ="let _p"&RC[-12]&" = new Page("&RC[-12]&",_s"&RC[-11]&")" -> let _p31 = new Page(31,_s12)
A41: 32 | B41: 12 | C41: PAGE | D41: 维伦的未来预言 | G41: ="获得:"&RC[-3] -> 获得:维伦的未来预言 | H41: ="[激活]"&""&RC[-4] -> [激活]维伦的未来预言 | L41: ="blp\book\"&RC[-11]&".blp" -> blp\book\32.blp | M41: ="let _p"&RC[-12]&" = new Page("&RC[-12]&",_s"&RC[-11]&")" -> let _p32 = new Page(32,_s12)
A42: 33 | B42: 12 | C42: PAGE | D42: 阿克蒙德的重生之恨 | G42: ="获得:"&RC[-3] -> 获得:阿克蒙德的重生之恨 | H42: ="[激活]"&""&RC[-4] -> [激活]阿克蒙德的重生之恨 | L42: ="blp\book\"&RC[-11]&".blp" -> blp\book\33.blp | M42: ="let _p"&RC[-12]&" = new Page("&RC[-12]&",_s"&RC[-11]&")" -> let _p33 = new Page(33,_s12)
A43: 34 | B43: 12 | C43: PAGE | D43: 诺甘农的威能 | G43: ="获得:"&RC[-3] -> 获得:诺甘农的威能 | H43: ="[激活]"&""&RC[-4] -> [激活]诺甘农的威能 | L43: ="blp\book\"&RC[-11]&".blp" -> blp\book\34.blp | M43: ="let _p"&RC[-12]&" = new Page("&RC[-12]&",_s"&RC[-11]&")" -> let _p34 = new Page(34,_s12)
A44: 35 | B44: 12 | C44: PAGE | D44: 卡兹格罗斯的勇气 | G44: ="获得:"&RC[-3] -> 获得:卡兹格罗斯的勇气 | H44: ="[激活]"&""&RC[-4] -> [激活]卡兹格罗斯的勇气 | L44: ="blp\book\"&RC[-11]&".blp" -> blp\book\35.blp | M44: ="let _p"&RC[-12]&" = new Page("&RC[-12]&",_s"&RC[-11]&")" -> let _p35 = new Page(35,_s12)
A45: 36 | B45: 12 | C45: PAGE | D45: 艾欧娜尔的怜悯 | G45: ="获得:"&RC[-3] -> 获得:艾欧娜尔的怜悯 | H45: ="[激活]"&""&RC[-4] -> [激活]艾欧娜尔的怜悯 | L45: ="blp\book\"&RC[-11]&".blp" -> blp\book\36.blp | M45: ="let _p"&RC[-12]&" = new Page("&RC[-12]&",_s"&RC[-11]&")" -> let _p36 = new Page(36,_s12)
A46: 37 | B46: 12 | C46: PAGE | D46: 高戈奈斯的活力 | G46: ="获得:"&RC[-3] -> 获得:高戈奈斯的活力 | H46: ="[激活]"&""&RC[-4] -> [激活]高戈奈斯的活力 | L46: ="blp\book\"&RC[-11]&".blp" -> blp\book\37.blp | M46: ="let _p"&RC[-12]&" = new Page("&RC[-12]&",_s"&RC[-11]&")" -> let _p37 = new Page(37,_s12)
A47: 38 | B47: 13 | C47: PAGE | D47: 淡蓝之索拉 | F47: =VLOOKUP(RC[-2],Sheet3!R2C4:R90C6,3,0) -> |cFFFFFF99基础属性|r|n攻击:6000000|n力量:1500000|n敏捷:1500000|n智力:2500000|n血量:13000000|n护甲:50000|n|cFFFFFF55附加属性|r(%)|n攻速:60|n攻击吸血:20|n|cFFCCCCCC本局有效|r | G47: ="获得:"&RC[-3] -> 获得:淡蓝之索拉 | H47: ="[激活]"&""&RC[-4] -> [激活]淡蓝之索拉 | L47: ReplaceableTextures\CommandButtons\BTNOrbOfFrost.blp | M47: ="let _p"&RC[-12]&" = new Page("&RC[-12]&",_s"&RC[-11]&")" -> let _p38 = new Page(38,_s13)
A48: 39 | B48: 13 | C48: PAGE | D48: 赤炎之菲尼克斯 | F48: =VLOOKUP(RC[-2],Sheet3!R2C4:R90C6,3,0) -> |cFFFFFF99基础属性|r|n攻击:6000000|n力量:1500000|n敏捷:2500000|n智力:1500000|n血量:13000000|n护甲:50000|n|cFFFFFF55附加属性|r(%)|n攻速:60|n攻击吸血:20|n|cFFCCCCCC本局有效|r | G48: ="获得:"&RC[-3] -> 获得:赤炎之菲尼克斯 | H48: ="[激活]"&""&RC[-4] -> [激活]赤炎之菲尼克斯 | L48: ReplaceableTextures\CommandButtons\BTNOrbOfFire.blp | M48: ="let _p"&RC[-12]&" = new Page("&RC[-12]&",_s"&RC[-11]&")" -> let _p39 = new Page(39,_s13)
A49: 40 | B49: 13 | C49: PAGE | D49: 圣光之米歇尔 | F49: =VLOOKUP(RC[-2],Sheet3!R2C4:R90C6,3,0) -> |cFFFFFF99基础属性|r|n攻击:6000000|n力量:1500000|n敏捷:1500000|n智力:1500000|n血量:25000000|n护甲:50000|n|cFFFFFF55附加属性|r(%)|n攻速:60|n攻击吸血:20|n|cFFCCCCCC本局有效|r | G49: ="获得:"&RC[-3] -> 获得:圣光之米歇尔 | H49: ="[激活]"&""&RC[-4] -> [激活]圣光之米歇尔 | L49: ReplaceableTextures\CommandButtons\BTNHolyBolt.blp | M49: ="let _p"&RC[-12]&" = new Page("&RC[-12]&",_s"&RC[-11]&")" -> let _p40 = new Page(40,_s13)
A50: 41 | B50: 13 | C50: PAGE | D50: 暗黑之撒旦 | F50: =VLOOKUP(RC[-2],Sheet3!R2C4:R90C6,3,0) -> |cFFFFFF99基础属性|r|n攻击:10000000|n力量:1500000|n敏捷:1500000|n智力:1500000|n血量:13000000|n护甲:50000|n|cFFFFFF55附加属性|r(%)|n攻速:80|n攻击吸血:20|n暴击伤害:40|n|cFFCCCCCC本局有效|r | G50: ="获得:"&RC[-3] -> 获得:暗黑之撒旦 | H50: ="[激活]"&""&RC[-4] -> [激活]暗黑之撒旦 | L50: ReplaceableTextures\CommandButtons\BTNOrbOfDarkness.blp | M50: ="let _p"&RC[-12]&" = new Page("&RC[-12]&",_s"&RC[-11]&")" -> let _p41 = new Page(41,_s13)
A51: 42 | B51: 13 | C51: PAGE | D51: 纯白之雪 | F51: =VLOOKUP(RC[-2],Sheet3!R2C4:R90C6,3,0) -> |cFFFFFF99基础属性|r|n攻击:6000000|n力量:2500000|n敏捷:1500000|n智力:1500000|n血量:13000000|n护甲:50000|n|cFFFFFF55附加属性|r(%)|n攻速:60|n攻击吸血:20|n|cFFCCCCCC本局有效|r | G51: ="获得:"&RC[-3] -> 获得:纯白之雪 | H51: ="[激活]"&""&RC[-4] -> [激活]纯白之雪 | L51: ReplaceableTextures\CommandButtons\BTNOrbOfLightning.blp | M51: ="let _p"&RC[-12]&" = new Page("&RC[-12]&",_s"&RC[-11]&")" -> let _p42 = new Page(42,_s13)
A52: 43 | C52: BOOK | D52: 道具目录 | F52: 奖励道具和商城道具 | K52: unwindwalk | L52: ReplaceableTextures\CommandButtons\BTNStaffOfPurification.blp | M52: ="let _b"&RC[-12]&" = new Book("&RC[-12]&","""&RC[-9]&""")" -> let _b43 = new Book(43,"道具目录")
A53: 44 | B53: 43 | C53: SUBBOOK | D53: 光环 | F53: 可以将使用激活的光环! | K53: unimmolation | L53: ="blp\book\"&RC[-11]&".blp" -> blp\book\44.blp | M53: ="let _s"&RC[-12]&" = new SubBook("&RC[-12]&",_b"&RC[-11]&")" -> let _s44 = new SubBook(44,_b43)
A54: 45 | B54: 43 | C54: SUBBOOK | D54: 武器皮肤 | F54: 可以将使用激活的武器皮肤! | K54: spellstealoff | L54: ="blp\book\"&RC[-11]&".blp" -> blp\book\45.blp | M54: ="let _s"&RC[-12]&" = new SubBook("&RC[-12]&",_b"&RC[-11]&")" -> let _s45 = new SubBook(45,_b43)
A55: 46 | B55: 43 | C55: SUBBOOK | D55: 翅膀皮肤 | F55: 可以将使用激活的翅膀皮肤! | K55: spellstealon | L55: ="blp\book\"&RC[-11]&".blp" -> blp\book\46.blp | M55: ="let _s"&RC[-12]&" = new SubBook("&RC[-12]&",_b"&RC[-11]&")" -> let _s46 = new SubBook(46,_b43)
A56: 47 | B56: 43 | C56: SUBBOOK | D56: 等级称号 | F56: 可以将使用激活的称号! | K56: summongrizzly | L56: ="blp\book\"&RC[-11]&".blp" -> blp\book\47.blp | M56: ="let _s"&RC[-12]&" = new SubBook("&RC[-12]&",_b"&RC[-11]&")" -> let _s47 = new SubBook(47,_b43)
A57: 116 | B57: 43 | C57: SUBBOOK | D57: 其他称号 | F57: 可以将使用激活的称号! | K57: controlmagic | L57: ="blp\book\"&RC[-11]&".blp" -> blp\book\116.blp | M57: ="let _s"&RC[-12]&" = new SubBook("&RC[-12]&",_b"&RC[-11]&")" -> let _s116 = new SubBook(116,_b43)
A58: 48 | B58: 44 | C58: PAGE | D58: 日炎光环 | F58: =VLOOKUP(RC[-2],Sheet3!R2C4:R118C6,3,0) -> |cFFFFFF99基础属性|r|n力量:1000|n敏捷:1000|n智力:1000|n|cFFFFFF55附加属性|r(%)|n伤害增幅:5|n属性叠加!拥有多个时只能召唤一个!|n激活后输入'-gh1'切换皮肤! | G58: 通关难度1 | H58: ="[光环]"&RC[-4] -> [光环]日炎光环 | I58: 激活光环 | L58: ="blp\book\"&RC[-11]&".blp" -> blp\book\48.blp | M58: ="let _p"&RC[-12]&" = new Page("&RC[-12]&",_s"&RC[-11]&")" -> let _p48 = new Page(48,_s44)
A59: 49 | B59: 44 | C59: PAGE | D59: 森林光环 | F59: =VLOOKUP(RC[-2],Sheet3!R2C4:R118C6,3,0) -> |cFFFFFF99基础属性|r|n力量:2000|n敏捷:2000|n智力:2000|n|cFFFFFF55附加属性|r(%)|n伤害增幅:10|n属性叠加!拥有多个时只能召唤一个!|n激活后输入'-gh2'切换皮肤! | G59: 等级2且通关难度2 | H59: ="[光环]"&RC[-4] -> [光环]森林光环 | I59: 激活光环 | L59: ="blp\book\"&RC[-11]&".blp" -> blp\book\49.blp | M59: ="let _p"&RC[-12]&" = new Page("&RC[-12]&",_s"&RC[-11]&")" -> let _p49 = new Page(49,_s44)
A60: 50 | B60: 44 | C60: PAGE | D60: 炽焰光环 | F60: =VLOOKUP(RC[-2],Sheet3!R2C4:R118C6,3,0) -> |cFFFFFF99基础属性|r|n力量:3000|n敏捷:3000|n智力:3000|n|cFFFFFF55附加属性|r(%)|n伤害增幅:15|n属性叠加!拥有多个时只能召唤一个!|n激活后输入'-gh3'切换皮肤! | G60: 等级3且通关难度3 | H60: ="[光环]"&RC[-4] -> [光环]炽焰光环 | I60: 激活光环 | L60: ="blp\book\"&RC[-11]&".blp" -> blp\book\50.blp | M60: ="let _p"&RC[-12]&" = new Page("&RC[-12]&",_s"&RC[-11]&")" -> let _p50 = new Page(50,_s44)
A61: 51 | B61: 44 | C61: PAGE | D61: 时空光环 | F61: =VLOOKUP(RC[-2],Sheet3!R2C4:R118C6,3,0) -> |cFFFFFF99基础属性|r|n力量:4000|n敏捷:4000|n智力:4000|n|cFFFFFF55附加属性|r(%)|n伤害增幅:20|n属性叠加!拥有多个时只能召唤一个!|n激活后输入'-gh4'切换皮肤! | G61: 等级4且通关难度4 | H61: ="[光环]"&RC[-4] -> [光环]时空光环 | I61: 激活光环 | L61: ="blp\book\"&RC[-11]&".blp" -> blp\book\51.blp | M61: ="let _p"&RC[-12]&" = new Page("&RC[-12]&",_s"&RC[-11]&")" -> let _p51 = new Page(51,_s44)
A62: 52 | B62: 44 | C62: PAGE | D62: 死亡斗气 | F62: =VLOOKUP(RC[-2],Sheet3!R2C4:R118C6,3,0) -> |cFFFFFF99基础属性|r|n力量:5000|n敏捷:5000|n智力:5000|n|cFFFFFF55附加属性|r(%)|n伤害增幅:25|n属性叠加!拥有多个时只能召唤一个!|n激活后输入'-gh5'切换皮肤! | G62: 等级5且通关难度5 | H62: ="[光环]"&RC[-4] -> [光环]死亡斗气 | I62: 激活光环 | L62: ="blp\book\"&RC[-11]&".blp" -> blp\book\52.blp | M62: ="let _p"&RC[-12]&" = new Page("&RC[-12]&",_s"&RC[-11]&")" -> let _p52 = new Page(52,_s44)
A63: 53 | B63: 44 | C63: PAGE | D63: 寒冰斗气 | F63: =VLOOKUP(RC[-2],Sheet3!R2C4:R118C6,3,0) -> |cFFFFFF99基础属性|r|n力量:6000|n敏捷:6000|n智力:6000|n|cFFFFFF55附加属性|r(%)|n伤害增幅:30|n属性叠加!拥有多个时只能召唤一个!|n激活后输入'-gh6'切换皮肤! | G63: 未开放 | H63: ="[光环]"&RC[-4] -> [光环]寒冰斗气 | I63: 激活光环 | L63: ="blp\book\"&RC[-11]&".blp" -> blp\book\53.blp | M63: ="let _p"&RC[-12]&" = new Page("&RC[-12]&",_s"&RC[-11]&")" -> let _p53 = new Page(53,_s44)
A64: 54 | B64: 44 | C64: PAGE | D64: 雷电护体 | F64: =VLOOKUP(RC[-2],Sheet3!R2C4:R118C6,3,0) -> |cFFFFFF99基础属性|r|n力量:10000|n敏捷:10000|n智力:10000|n血量:50000|n护甲:10000|n|cFFFFFF55附加属性|r(%)|n伤害增幅:50|n最终伤害:10|n|cFFFFFF11核心属性|r|n每秒属性:40|n属性叠加!拥有多个时只能召唤一个!|n激活后输入'-gh7'切换皮肤! | G64: 商城购买 | H64: ="[光环]"&RC[-4] -> [光环]雷电护体 | I64: 激活光环 | L64: ="blp\book\"&RC[-11]&".blp" -> blp\book\54.blp | M64: ="let _p"&RC[-12]&" = new Page("&RC[-12]&",_s"&RC[-11]&")" -> let _p54 = new Page(54,_s44)
A65: 55 | B65: 44 | C65: PAGE | D65: 星光闪耀 | F65: =VLOOKUP(RC[-2],Sheet3!R2C4:R118C6,3,0) -> |cFFFFFF99基础属性|r|n攻击:50000|n力量:15000|n敏捷:15000|n智力:15000|n血量:100000|n护甲:20000|n|cFFFFFF55附加属性|r(%)|n伤害增幅:100|n最终伤害:20|n|cFFFFFF11核心属性|r|n每秒属性:80|n杀怪获得额外500金币|n属性叠加!拥有多个时只能召唤一个!|n激活后输入'-gh8'切换皮肤! | G65: 商城购买 | H65: ="[光环]"&RC[-4] -> [光环]星光闪耀 | I65: 激活光环 | L65: ="blp\book\"&RC[-11]&".blp" -> blp\book\55.blp | M65: ="let _p"&RC[-12]&" = new Page("&RC[-12]&",_s"&RC[-11]&")" -> let _p55 = new Page(55,_s44)
A66: 56 | B66: 45 | C66: PAGE | D66: 斩光之剑 | F66: =VLOOKUP(RC[-2],Sheet3!R2C4:R118C6,3,0) -> |cFFFFFF99基础属性|r|n攻击:2000|n|cFFFFFF55附加属性|r(%)|n暴击伤害:10|n属性叠加!拥有多个时只能使用一个!|n激活后输入'-wq1'切换皮肤! | G66: 单通难度1 | H66: ="[武器皮肤]"&RC[-4] -> [武器皮肤]斩光之剑 | I66: 激活武器皮肤 | L66: ="blp\book\"&RC[-11]&".blp" -> blp\book\56.blp | M66: ="let _p"&RC[-12]&" = new Page("&RC[-12]&",_s"&RC[-11]&")" -> let _p56 = new Page(56,_s45)
A67: 57 | B67: 45 | C67: PAGE | D67: 霜之哀伤 | F67: =VLOOKUP(RC[-2],Sheet3!R2C4:R118C6,3,0) -> |cFFFFFF99基础属性|r|n攻击:4000|n|cFFFFFF55附加属性|r(%)|n暴击伤害:15|n属性叠加!拥有多个时只能使用一个!|n激活后输入'-wq2'切换皮肤! | G67: 等级3且单通难度3 | H67: ="[武器皮肤]"&RC[-4] -> [武器皮肤]霜之哀伤 | I67: 激活武器皮肤 | L67: ="blp\book\"&RC[-11]&".blp" -> blp\book\57.blp | M67: ="let _p"&RC[-12]&" = new Page("&RC[-12]&",_s"&RC[-11]&")" -> let _p57 = new Page(57,_s45)
A68: 58 | B68: 45 | C68: PAGE | D68: 囚火之剑 | F68: =VLOOKUP(RC[-2],Sheet3!R2C4:R118C6,3,0) -> |cFFFFFF99基础属性|r|n攻击:6000|n|cFFFFFF55附加属性|r(%)|n暴击伤害:20|n属性叠加!拥有多个时只能使用一个!|n激活后输入'-wq3'切换皮肤! | G68: 等级5且单通难度5 | H68: ="[武器皮肤]"&RC[-4] -> [武器皮肤]囚火之剑 | I68: 激活武器皮肤 | L68: ="blp\book\"&RC[-11]&".blp" -> blp\book\58.blp | M68: ="let _p"&RC[-12]&" = new Page("&RC[-12]&",_s"&RC[-11]&")" -> let _p58 = new Page(58,_s45)
A69: 59 | B69: 45 | C69: PAGE | D69: 魔王邪剑 | F69: =VLOOKUP(RC[-2],Sheet3!R2C4:R118C6,3,0) -> |cFFFFFF99基础属性|r|n攻击:8000|n|cFFFFFF55附加属性|r(%)|n暴击伤害:25|n属性叠加!拥有多个时只能使用一个!|n激活后输入'-wq4'切换皮肤! | G69: 未开放 | H69: ="[武器皮肤]"&RC[-4] -> [武器皮肤]魔王邪剑 | I69: 激活武器皮肤 | L69: ="blp\book\"&RC[-11]&".blp" -> blp\book\59.blp | M69: ="let _p"&RC[-12]&" = new Page("&RC[-12]&",_s"&RC[-11]&")" -> let _p59 = new Page(59,_s45)
A70: 60 | B70: 45 | C70: PAGE | D70: 屠龙宝刀 | F70: =VLOOKUP(RC[-2],Sheet3!R2C4:R118C6,3,0) -> |cFFFFFF99基础属性|r|n攻击:10000|n|cFFFFFF55附加属性|r(%)|n暴击伤害:30|n属性叠加!拥有多个时只能使用一个!|n激活后输入'-wq5'切换皮肤! | G70: 未开放 | H70: ="[武器皮肤]"&RC[-4] -> [武器皮肤]屠龙宝刀 | I70: 激活武器皮肤 | L70: ="blp\book\"&RC[-11]&".blp" -> blp\book\60.blp | M70: ="let _p"&RC[-12]&" = new Page("&RC[-12]&",_s"&RC[-11]&")" -> let _p60 = new Page(60,_s45)
A71: 61 | B71: 45 | C71: PAGE | D71: 黄金圣剑 | F71: =VLOOKUP(RC[-2],Sheet3!R2C4:R118C6,3,0) -> |cFFFFFF99基础属性|r|n攻击:20000|n|cFFFFFF55附加属性|r(%)|n攻速:30|n攻击吸血:2|n暴击伤害:50|n最终伤害:3|n|cFFFFFF11核心属性|r|n杀敌属性:10|n属性叠加!拥有多个时只能使用一个!|n激活后输入'-wq6'切换皮肤! | G71: 商城购买 | H71: ="[武器皮肤]"&RC[-4] -> [武器皮肤]黄金圣剑 | I71: 激活武器皮肤 | L71: ="blp\book\"&RC[-11]&".blp" -> blp\book\61.blp | M71: ="let _p"&RC[-12]&" = new Page("&RC[-12]&",_s"&RC[-11]&")" -> let _p61 = new Page(61,_s45)
A72: 62 | B72: 45 | C72: PAGE | D72: 玄冰神剑 | F72: =VLOOKUP(RC[-2],Sheet3!R2C4:R118C6,3,0) -> |cFFFFFF99基础属性|r|n攻击:30000|n|cFFFFFF55附加属性|r(%)|n攻速:40|n攻击吸血:4|n暴击伤害:80|n最终伤害:6|n|cFFFFFF11核心属性|r|n杀敌属性:20|n属性叠加!拥有多个时只能使用一个!|n激活后输入'-wq7'切换皮肤! | G72: 商城购买 | H72: ="[武器皮肤]"&RC[-4] -> [武器皮肤]玄冰神剑 | I72: 激活武器皮肤 | L72: ="blp\book\"&RC[-11]&".blp" -> blp\book\62.blp | M72: ="let _p"&RC[-12]&" = new Page("&RC[-12]&",_s"&RC[-11]&")" -> let _p62 = new Page(62,_s45)
A73: 63 | B73: 45 | C73: PAGE | D73: 邪神魔剑 | F73: =VLOOKUP(RC[-2],Sheet3!R2C4:R118C6,3,0) -> |cFFFFFF99基础属性|r|n攻击:50000|n|cFFFFFF55附加属性|r(%)|n攻速:50|n攻击吸血:6|n暴击伤害:100|n伤害增幅:30|n最终伤害:10|n|cFFFFFF11核心属性|r|n杀敌属性:30|n获得20%额外杀敌积分|n属性叠加!拥有多个时只能使用一个!|n激活后输入'-wq8'切换皮肤! | G73: 商城购买 | H73: ="[武器皮肤]"&RC[-4] -> [武器皮肤]邪神魔剑 | I73: 激活武器皮肤 | L73: ="blp\book\"&RC[-11]&".blp" -> blp\book\63.blp | M73: ="let _p"&RC[-12]&" = new Page("&RC[-12]&",_s"&RC[-11]&")" -> let _p63 = new Page(63,_s45)
A74: 64 | B74: 46 | C74: PAGE | D74: 冰火翅膀 | F74: =VLOOKUP(RC[-2],Sheet3!R2C4:R118C6,3,0) -> |cFFFFFF99基础属性|r|n力量:2000|n敏捷:2000|n智力:2000|n|cFFFFFF55附加属性|r(%)|n附加伤害:5|n属性叠加!拥有多个时只能使用一个!|n激活后输入'-cb1'切换翅膀! | G74: 等级2且单通难度2 | H74: ="[翅膀皮肤]"&RC[-4] -> [翅膀皮肤]冰火翅膀 | I74: 激活翅膀皮肤 | L74: ="blp\book\"&RC[-11]&".blp" -> blp\book\64.blp | M74: ="let _p"&RC[-12]&" = new Page("&RC[-12]&",_s"&RC[-11]&")" -> let _p64 = new Page(64,_s46)
A75: 65 | B75: 46 | C75: PAGE | D75: 妖灵翅膀 | F75: =VLOOKUP(RC[-2],Sheet3!R2C4:R118C6,3,0) -> |cFFFFFF99基础属性|r|n力量:4000|n敏捷:4000|n智力:4000|n|cFFFFFF55附加属性|r(%)|n附加伤害:10|n属性叠加!拥有多个时只能使用一个!|n激活后输入'-cb2'切换翅膀! | G75: 等级4且单通难度4 | H75: ="[翅膀皮肤]"&RC[-4] -> [翅膀皮肤]妖灵翅膀 | I75: 激活翅膀皮肤 | L75: ="blp\book\"&RC[-11]&".blp" -> blp\book\65.blp | M75: ="let _p"&RC[-12]&" = new Page("&RC[-12]&",_s"&RC[-11]&")" -> let _p65 = new Page(65,_s46)
A76: 66 | B76: 46 | C76: PAGE | D76: 仙灵翅膀 | F76: =VLOOKUP(RC[-2],Sheet3!R2C4:R118C6,3,0) -> |cFFFFFF99基础属性|r|n力量:6000|n敏捷:6000|n智力:6000|n|cFFFFFF55附加属性|r(%)|n附加伤害:15|n属性叠加!拥有多个时只能使用一个!|n激活后输入'-cb3'切换翅膀! | G76: 未开放 | H76: ="[翅膀皮肤]"&RC[-4] -> [翅膀皮肤]仙灵翅膀 | I76: 激活翅膀皮肤 | L76: ="blp\book\"&RC[-11]&".blp" -> blp\book\66.blp | M76: ="let _p"&RC[-12]&" = new Page("&RC[-12]&",_s"&RC[-11]&")" -> let _p66 = new Page(66,_s46)
A77: 67 | B77: 46 | C77: PAGE | D77: 黄金翅膀 | F77: =VLOOKUP(RC[-2],Sheet3!R2C4:R118C6,3,0) -> |cFFFFFF99基础属性|r|n力量:10000|n敏捷:10000|n智力:10000|n|cFFFFFF55附加属性|r(%)|n暴击概率:5|n附加伤害:50|n最终伤害:3|n伤害减免:5|n|cFFFFFF11核心属性|r|n升级属性:800|n属性叠加!拥有多个时只能使用一个!|n激活后输入'-cb4'切换翅膀! | G77: 商城购买 | H77: ="[翅膀皮肤]"&RC[-4] -> [翅膀皮肤]黄金翅膀 | I77: 激活翅膀皮肤 | L77: ="blp\book\"&RC[-11]&".blp" -> blp\book\67.blp | M77: ="let _p"&RC[-12]&" = new Page("&RC[-12]&",_s"&RC[-11]&")" -> let _p67 = new Page(67,_s46)
A78: 68 | B78: 46 | C78: PAGE | D78: 真神翅膀 | F78: =VLOOKUP(RC[-2],Sheet3!R2C4:R118C6,3,0) -> |cFFFFFF99基础属性|r|n力量:15000|n敏捷:10000|n智力:10000|n|cFFFFFF55附加属性|r(%)|n暴击概率:10|n附加伤害:80|n最终伤害:6|n伤害减免:10|n|cFFFFFF11核心属性|r|n升级属性:1600|n属性叠加!拥有多个时只能使用一个!|n激活后输入'-cb5'切换翅膀! | G78: 商城购买 | H78: ="[翅膀皮肤]"&RC[-4] -> [翅膀皮肤]真神翅膀 | I78: 激活翅膀皮肤 | L78: ="blp\book\"&RC[-11]&".blp" -> blp\book\68.blp | M78: ="let _p"&RC[-12]&" = new Page("&RC[-12]&",_s"&RC[-11]&")" -> let _p68 = new Page(68,_s46)
A79: 69 | B79: 46 | C79: PAGE | D79: 圣羽翅膀 | F79: =VLOOKUP(RC[-2],Sheet3!R2C4:R118C6,3,0) -> |cFFFFFF99基础属性|r|n力量:20000|n敏捷:20000|n智力:20000|n|cFFFFFF55附加属性|r(%)|n暴击概率:15|n附加伤害:100|n最终伤害:10|n伤害减免:15|n|cFFFFFF11核心属性|r|n升级属性:3200|n冲锋CD降低为0|n属性叠加!拥有多个时只能使用一个!|n激活后输入'-cb6'切换翅膀! | G79: 商城购买 | H79: ="[翅膀皮肤]"&RC[-4] -> [翅膀皮肤]圣羽翅膀 | I79: 激活翅膀皮肤 | L79: ="blp\book\"&RC[-11]&".blp" -> blp\book\69.blp | M79: ="let _p"&RC[-12]&" = new Page("&RC[-12]&",_s"&RC[-11]&")" -> let _p69 = new Page(69,_s46)
A80: 70 | B80: 47 | C80: PAGE | D80: 黑铁 | F80: =VLOOKUP(RC[-2],Sheet3!R2C4:R118C6,3,0) -> |cFFFFFF99基础属性|r|n攻击:600|n力量:300|n敏捷:300|n智力:300|n|cFFFFFF55附加属性|r(%)|n附加伤害:5|n伤害减免:3|n属性叠加!拥有多个时只能使用一个!|n激活后输入'-ch1'切换称号! | G80: 五星好评赠送 | H80: ="[称号]"&RC[-4] -> [称号]黑铁 | I80: 激活称号 | L80: ="blp\book\"&RC[-11]&".blp" -> blp\book\70.blp | M80: ="let _p"&RC[-12]&" = new Page("&RC[-12]&",_s"&RC[-11]&")" -> let _p70 = new Page(70,_s47)
A81: 71 | B81: 47 | C81: PAGE | D81: 青铜 | F81: =VLOOKUP(RC[-2],Sheet3!R2C4:R118C6,3,0) -> |cFFFFFF99基础属性|r|n攻击:1500|n力量:600|n敏捷:600|n智力:600|n|cFFFFFF55附加属性|r(%)|n附加伤害:10|n伤害减免:1|n属性叠加!拥有多个时只能使用一个!|n激活后输入'-ch2'切换称号! | G81: 等级5 | H81: ="[称号]"&RC[-4] -> [称号]青铜 | I81: 激活称号 | L81: ="blp\book\"&RC[-11]&".blp" -> blp\book\71.blp | M81: ="let _p"&RC[-12]&" = new Page("&RC[-12]&",_s"&RC[-11]&")" -> let _p71 = new Page(71,_s47)
A82: 72 | B82: 47 | C82: PAGE | D82: 白银 | F82: =VLOOKUP(RC[-2],Sheet3!R2C4:R118C6,3,0) -> |cFFFFFF99基础属性|r|n攻击:2500|n力量:1000|n敏捷:1000|n智力:1000|n|cFFFFFF55附加属性|r(%)|n附加伤害:15|n伤害减免:1|n属性叠加!拥有多个时只能使用一个!|n激活后输入'-ch3'切换称号! | G82: 等级8 | H82: ="[称号]"&RC[-4] -> [称号]白银 | I82: 激活称号 | L82: ="blp\book\"&RC[-11]&".blp" -> blp\book\72.blp | M82: ="let _p"&RC[-12]&" = new Page("&RC[-12]&",_s"&RC[-11]&")" -> let _p72 = new Page(72,_s47)
A83: 73 | B83: 47 | C83: PAGE | D83: 黄金 | F83: =VLOOKUP(RC[-2],Sheet3!R2C4:R118C6,3,0) -> |cFFFFFF99基础属性|r|n攻击:3750|n力量:1500|n敏捷:1500|n智力:1500|n|cFFFFFF55附加属性|r(%)|n附加伤害:20|n伤害减免:1|n属性叠加!拥有多个时只能使用一个!|n激活后输入'-ch4'切换称号! | G83: 等级12 | H83: ="[称号]"&RC[-4] -> [称号]黄金 | I83: 激活称号 | L83: ="blp\book\"&RC[-11]&".blp" -> blp\book\73.blp | M83: ="let _p"&RC[-12]&" = new Page("&RC[-12]&",_s"&RC[-11]&")" -> let _p73 = new Page(73,_s47)
A84: 74 | B84: 47 | C84: PAGE | D84: 铂金 | F84: =VLOOKUP(RC[-2],Sheet3!R2C4:R118C6,3,0) -> |cFFFFFF99基础属性|r|n攻击:5500|n力量:2200|n敏捷:2200|n智力:2200|n|cFFFFFF55附加属性|r(%)|n附加伤害:25|n伤害减免:1|n属性叠加!拥有多个时只能使用一个!|n激活后输入'-ch5'切换称号! | G84: 等级16 | H84: ="[称号]"&RC[-4] -> [称号]铂金 | I84: 激活称号 | L84: ="blp\book\"&RC[-11]&".blp" -> blp\book\74.blp | M84: ="let _p"&RC[-12]&" = new Page("&RC[-12]&",_s"&RC[-11]&")" -> let _p74 = new Page(74,_s47)
A85: 75 | B85: 47 | C85: PAGE | D85: 钻石 | F85: =VLOOKUP(RC[-2],Sheet3!R2C4:R118C6,3,0) -> |cFFFFFF99基础属性|r|n攻击:7500|n力量:3000|n敏捷:3000|n智力:3000|n|cFFFFFF55附加属性|r(%)|n附加伤害:30|n伤害减免:1|n属性叠加!拥有多个时只能使用一个!|n激活后输入'-ch6'切换称号! | G85: 等级20 | H85: ="[称号]"&RC[-4] -> [称号]钻石 | I85: 激活称号 | L85: ="blp\book\"&RC[-11]&".blp" -> blp\book\75.blp | M85: ="let _p"&RC[-12]&" = new Page("&RC[-12]&",_s"&RC[-11]&")" -> let _p75 = new Page(75,_s47)
A86: 76 | B86: 47 | C86: PAGE | D86: 大师 | F86: =VLOOKUP(RC[-2],Sheet3!R2C4:R118C6,3,0) -> |cFFFFFF99基础属性|r|n攻击:10000|n力量:4000|n敏捷:4000|n智力:4000|n|cFFFFFF55附加属性|r(%)|n附加伤害:35|n伤害减免:1|n属性叠加!拥有多个时只能使用一个!|n激活后输入'-ch7'切换称号! | G86: 等级24 | H86: ="[称号]"&RC[-4] -> [称号]大师 | I86: 激活称号 | L86: ="blp\book\"&RC[-11]&".blp" -> blp\book\76.blp | M86: ="let _p"&RC[-12]&" = new Page("&RC[-12]&",_s"&RC[-11]&")" -> let _p76 = new Page(76,_s47)
A87: 77 | B87: 47 | C87: PAGE | D87: 宗师 | F87: =VLOOKUP(RC[-2],Sheet3!R2C4:R118C6,3,0) -> |cFFFFFF99基础属性|r|n攻击:13000|n力量:5200|n敏捷:5200|n智力:5200|n|cFFFFFF55附加属性|r(%)|n附加伤害:40|n伤害减免:1|n属性叠加!拥有多个时只能使用一个!|n激活后输入'-ch8'切换称号! | G87: 等级28 | H87: ="[称号]"&RC[-4] -> [称号]宗师 | I87: 激活称号 | L87: ="blp\book\"&RC[-11]&".blp" -> blp\book\77.blp | M87: ="let _p"&RC[-12]&" = new Page("&RC[-12]&",_s"&RC[-11]&")" -> let _p77 = new Page(77,_s47)
A88: 78 | B88: 47 | C88: PAGE | D88: 王者 | F88: =VLOOKUP(RC[-2],Sheet3!R2C4:R118C6,3,0) -> |cFFFFFF99基础属性|r|n攻击:16500|n力量:6600|n敏捷:6600|n智力:6600|n|cFFFFFF55附加属性|r(%)|n附加伤害:45|n伤害减免:1|n属性叠加!拥有多个时只能使用一个!|n激活后输入'-ch9'切换称号! | G88: 等级30 | H88: ="[称号]"&RC[-4] -> [称号]王者 | I88: 激活称号 | L88: ="blp\book\"&RC[-11]&".blp" -> blp\book\78.blp | M88: ="let _p"&RC[-12]&" = new Page("&RC[-12]&",_s"&RC[-11]&")" -> let _p78 = new Page(78,_s47)
A89: 79 | B89: 47 | C89: PAGE | D89: 皇者 | F89: =VLOOKUP(RC[-2],Sheet3!R2C4:R118C6,3,0) -> |cFFFFFF99基础属性|r|n攻击:21500|n力量:8600|n敏捷:8600|n智力:8600|n|cFFFFFF55附加属性|r(%)|n附加伤害:50|n伤害减免:1|n属性叠加!拥有多个时只能使用一个!|n激活后输入'-ch10'切换称号! | G89: 排行榜前100且等级30 | H89: ="[称号]"&RC[-4] -> [称号]皇者 | I89: 激活称号 | L89: ="blp\book\"&RC[-11]&".blp" -> blp\book\79.blp | M89: ="let _p"&RC[-12]&" = new Page("&RC[-12]&",_s"&RC[-11]&")" -> let _p79 = new Page(79,_s47)
A90: 117 | B90: 116 | C90: PAGE | D90: 星悦至尊 | F90: =VLOOKUP(RC[-2],Sheet3!R2C4:R118C6,3,0) -> |cFFFFFF99基础属性|r|n攻击:20000|n力量:10000|n敏捷:10000|n智力:10000|n|cFFFFFF55附加属性|r(%)|n攻击吸血:5|n暴击概率:10|n暴击伤害:20|n附加伤害:50|n最终伤害:5|n获得20%额外杀敌积分|n属性叠加!拥有多个时只能使用一个!|n激活后输入'-chxy'切换称号! | G90: 星悦会员俱乐部 | H90: ="[称号]"&RC[-4] -> [称号]星悦至尊 | I90: 激活称号 | L90: ="blp\book\"&RC[-11]&".blp" -> blp\book\117.blp | M90: ="let _p"&RC[-12]&" = new Page("&RC[-12]&",_s"&RC[-11]&")" -> let _p117 = new Page(117,_s116)
A91: 118 | B91: 116 | C91: PAGE | D91: 魔域主播 | F91: =VLOOKUP(RC[-2],Sheet3!R2C4:R118C6,3,0) -> |cFFFFFF99基础属性|r|n攻击:10000|n力量:5000|n敏捷:5000|n智力:5000|n|cFFFFFF55附加属性|r(%)|n暴击伤害:10|n附加伤害:50|n属性叠加!拥有多个时只能使用一个!|n激活后输入'-chzb'切换称号! | G91: 魔域主播工会 | H91: ="[称号]"&RC[-4] -> [称号]魔域主播 | I91: 激活称号 | L91: ="blp\book\"&RC[-11]&".blp" -> blp\book\118.blp | M91: ="let _p"&RC[-12]&" = new Page("&RC[-12]&",_s"&RC[-11]&")" -> let _p118 = new Page(118,_s116)
A92: 80 | B92: 1 | C92: SUBBOOK | D92: 一级精髓 | F92: 怪物精髓,吞噬所有一级怪物精髓可以进行一次轮回! | K92: selfdestructon | L92: ="blp\book\"&RC[-11]&".blp" -> blp\book\80.blp | M92: ="let _s"&RC[-12]&" = new SubBook("&RC[-12]&",_b"&RC[-11]&")" -> let _s80 = new SubBook(80,_b1)
A93: 81 | B93: 1 | C93: SUBBOOK | D93: 二级精髓 | F93: 怪物精髓,吞噬所有二级怪物精髓可以进行一次轮回! | K93: slowoff | L93: ="blp\book\"&RC[-11]&".blp" -> blp\book\81.blp | M93: ="let _s"&RC[-12]&" = new SubBook("&RC[-12]&",_b"&RC[-11]&")" -> let _s81 = new SubBook(81,_b1)
A94: 82 | B94: 1 | C94: SUBBOOK | D94: 三级精髓 | F94: 怪物精髓,吞噬所有三级怪物精髓可以进行一次轮回! | K94: spirittroll | L94: ="blp\book\"&RC[-11]&".blp" -> blp\book\82.blp | M94: ="let _s"&RC[-12]&" = new SubBook("&RC[-12]&",_b"&RC[-11]&")" -> let _s82 = new SubBook(82,_b1)
A95: 83 | B95: 1 | C95: SUBBOOK | D95: 四级精髓 | F95: 怪物精髓,吞噬所有四级怪物精髓可以进行一次轮回! | K95: townbelloff | L95: ="blp\book\"&RC[-11]&".blp" -> blp\book\83.blp | M95: ="let _s"&RC[-12]&" = new SubBook("&RC[-12]&",_b"&RC[-11]&")" -> let _s83 = new SubBook(83,_b1)
A96: 84 | B96: 1 | C96: SUBBOOK | D96: 五级精髓 | F96: 怪物精髓,吞噬所有五级怪物精髓可以进行一次轮回! | K96: unavengerform | L96: ="blp\book\"&RC[-11]&".blp" -> blp\book\84.blp | M96: ="let _s"&RC[-12]&" = new SubBook("&RC[-12]&",_b"&RC[-11]&")" -> let _s84 = new SubBook(84,_b1)
A97: 85 | B97: 80 | C97: PAGE | D97: [精髓]盗贼王 | F97: =VLOOKUP(RC[-2],Sheet3!R2C4:R118C6,3,0) -> |n怪物精髓。吞噬时选取属性！ | G97: ="吞噬:"&RC[-3] -> 吞噬:[精髓]盗贼王 | H97: =RC[-4] -> [精髓]盗贼王 | I97: 吞噬精髓 | L97: ="blp\book\"&RC[-11]&".blp" -> blp\book\85.blp | M97: ="let _p"&RC[-12]&" = new Page("&RC[-12]&",_s"&RC[-11]&")" -> let _p85 = new Page(85,_s80)
A98: 86 | B98: 80 | C98: PAGE | D98: [精髓]鱼人首领 | F98: =VLOOKUP(RC[-2],Sheet3!R2C4:R118C6,3,0) -> |n怪物精髓。吞噬时选取属性！ | G98: ="吞噬:"&RC[-3] -> 吞噬:[精髓]鱼人首领 | H98: =RC[-4] -> [精髓]鱼人首领 | I98: 吞噬精髓 | L98: ="blp\book\"&RC[-11]&".blp" -> blp\book\86.blp | M98: ="let _p"&RC[-12]&" = new Page("&RC[-12]&",_s"&RC[-11]&")" -> let _p86 = new Page(86,_s80)
A99: 87 | B99: 80 | C99: PAGE | D99: [精髓]森林狼王 | F99: =VLOOKUP(RC[-2],Sheet3!R2C4:R118C6,3,0) -> |n怪物精髓。吞噬时选取属性！ | G99: ="吞噬:"&RC[-3] -> 吞噬:[精髓]森林狼王 | H99: =RC[-4] -> [精髓]森林狼王 | I99: 吞噬精髓 | L99: ="blp\book\"&RC[-11]&".blp" -> blp\book\87.blp | M99: ="let _p"&RC[-12]&" = new Page("&RC[-12]&",_s"&RC[-11]&")" -> let _p87 = new Page(87,_s80)
A100: 88 | B100: 80 | C100: PAGE | D100: [精髓]豪猪王 | F100: =VLOOKUP(RC[-2],Sheet3!R2C4:R118C6,3,0) -> |n怪物精髓。吞噬时选取属性！ | G100: ="吞噬:"&RC[-3] -> 吞噬:[精髓]豪猪王 | H100: =RC[-4] -> [精髓]豪猪王 | I100: 吞噬精髓 | L100: ="blp\book\"&RC[-11]&".blp" -> blp\book\88.blp | M100: ="let _p"&RC[-12]&" = new Page("&RC[-12]&",_s"&RC[-11]&")" -> let _p88 = new Page(88,_s80)
A101: 89 | B101: 81 | C101: PAGE | D101: [精髓]达拉内尔主教 | F101: =VLOOKUP(RC[-2],Sheet3!R2C4:R118C6,3,0) -> |n怪物精髓。吞噬时选取属性！ | G101: ="吞噬:"&RC[-3] -> 吞噬:[精髓]达拉内尔主教 | H101: =RC[-4] -> [精髓]达拉内尔主教 | I101: 吞噬精髓 | L101: ="blp\book\"&RC[-11]&".blp" -> blp\book\89.blp | M101: ="let _p"&RC[-12]&" = new Page("&RC[-12]&",_s"&RC[-11]&")" -> let _p89 = new Page(89,_s81)
A102: 90 | B102: 81 | C102: PAGE | D102: [精髓]食人魔酋长 | F102: =VLOOKUP(RC[-2],Sheet3!R2C4:R118C6,3,0) -> |n怪物精髓。吞噬时选取属性！ | G102: ="吞噬:"&RC[-3] -> 吞噬:[精髓]食人魔酋长 | H102: =RC[-4] -> [精髓]食人魔酋长 | I102: 吞噬精髓 | L102: ="blp\book\"&RC[-11]&".blp" -> blp\book\90.blp | M102: ="let _p"&RC[-12]&" = new Page("&RC[-12]&",_s"&RC[-11]&")" -> let _p90 = new Page(90,_s81)
A103: 91 | B103: 81 | C103: PAGE | D103: [精髓]狗头人酋长 | F103: =VLOOKUP(RC[-2],Sheet3!R2C4:R118C6,3,0) -> |n怪物精髓。吞噬时选取属性！ | G103: ="吞噬:"&RC[-3] -> 吞噬:[精髓]狗头人酋长 | H103: =RC[-4] -> [精髓]狗头人酋长 | I103: 吞噬精髓 | L103: ="blp\book\"&RC[-11]&".blp" -> blp\book\91.blp | M103: ="let _p"&RC[-12]&" = new Page("&RC[-12]&",_s"&RC[-11]&")" -> let _p91 = new Page(91,_s81)
A104: 92 | B104: 81 | C104: PAGE | D104: [精髓]矿井魔蝎 | F104: =VLOOKUP(RC[-2],Sheet3!R2C4:R118C6,3,0) -> |n怪物精髓。吞噬时选取属性！ | G104: ="吞噬:"&RC[-3] -> 吞噬:[精髓]矿井魔蝎 | H104: =RC[-4] -> [精髓]矿井魔蝎 | I104: 吞噬精髓 | L104: ="blp\book\"&RC[-11]&".blp" -> blp\book\92.blp | M104: ="let _p"&RC[-12]&" = new Page("&RC[-12]&",_s"&RC[-11]&")" -> let _p92 = new Page(92,_s81)
A105: 93 | B105: 82 | C105: PAGE | D105: [精髓]炎魔 | F105: =VLOOKUP(RC[-2],Sheet3!R2C4:R118C6,3,0) -> |n怪物精髓。吞噬时选取属性！ | G105: ="吞噬:"&RC[-3] -> 吞噬:[精髓]炎魔 | H105: =RC[-4] -> [精髓]炎魔 | I105: 吞噬精髓 | L105: ="blp\book\"&RC[-11]&".blp" -> blp\book\93.blp | M105: ="let _p"&RC[-12]&" = new Page("&RC[-12]&",_s"&RC[-11]&")" -> let _p93 = new Page(93,_s82)
A106: 94 | B106: 82 | C106: PAGE | D106: [精髓]巨型蜥蜴 | F106: =VLOOKUP(RC[-2],Sheet3!R2C4:R118C6,3,0) -> |n怪物精髓。吞噬时选取属性！ | G106: ="吞噬:"&RC[-3] -> 吞噬:[精髓]巨型蜥蜴 | H106: =RC[-4] -> [精髓]巨型蜥蜴 | I106: 吞噬精髓 | L106: ="blp\book\"&RC[-11]&".blp" -> blp\book\94.blp | M106: ="let _p"&RC[-12]&" = new Page("&RC[-12]&",_s"&RC[-11]&")" -> let _p94 = new Page(94,_s82)
A107: 95 | B107: 82 | C107: PAGE | D107: [精髓]千年龙龟 | F107: =VLOOKUP(RC[-2],Sheet3!R2C4:R118C6,3,0) -> |n怪物精髓。吞噬时选取属性！ | G107: ="吞噬:"&RC[-3] -> 吞噬:[精髓]千年龙龟 | H107: =RC[-4] -> [精髓]千年龙龟 | I107: 吞噬精髓 | L107: ="blp\book\"&RC[-11]&".blp" -> blp\book\95.blp | M107: ="let _p"&RC[-12]&" = new Page("&RC[-12]&",_s"&RC[-11]&")" -> let _p95 = new Page(95,_s82)
A108: 96 | B108: 82 | C108: PAGE | D108: [精髓]成年巨龙 | F108: =VLOOKUP(RC[-2],Sheet3!R2C4:R118C6,3,0) -> |n怪物精髓。吞噬时选取属性！ | G108: ="吞噬:"&RC[-3] -> 吞噬:[精髓]成年巨龙 | H108: =RC[-4] -> [精髓]成年巨龙 | I108: 吞噬精髓 | L108: ="blp\book\"&RC[-11]&".blp" -> blp\book\96.blp | M108: ="let _p"&RC[-12]&" = new Page("&RC[-12]&",_s"&RC[-11]&")" -> let _p96 = new Page(96,_s82)
A109: 97 | B109: 83 | C109: PAGE | D109: [精髓]冰霜巨魔酋长 | F109: =VLOOKUP(RC[-2],Sheet3!R2C4:R118C6,3,0) -> |n怪物精髓。吞噬时选取属性！ | G109: ="吞噬:"&RC[-3] -> 吞噬:[精髓]冰霜巨魔酋长 | H109: =RC[-4] -> [精髓]冰霜巨魔酋长 | I109: 吞噬精髓 | L109: ="blp\book\"&RC[-11]&".blp" -> blp\book\97.blp | M109: ="let _p"&RC[-12]&" = new Page("&RC[-12]&",_s"&RC[-11]&")" -> let _p97 = new Page(97,_s83)
A110: 98 | B110: 83 | C110: PAGE | D110: [精髓]丛林巨魔酋长 | F110: =VLOOKUP(RC[-2],Sheet3!R2C4:R118C6,3,0) -> |n怪物精髓。吞噬时选取属性！ | G110: ="吞噬:"&RC[-3] -> 吞噬:[精髓]丛林巨魔酋长 | H110: =RC[-4] -> [精髓]丛林巨魔酋长 | I110: 吞噬精髓 | L110: ="blp\book\"&RC[-11]&".blp" -> blp\book\98.blp | M110: ="let _p"&RC[-12]&" = new Page("&RC[-12]&",_s"&RC[-11]&")" -> let _p98 = new Page(98,_s83)
A111: 99 | B111: 83 | C111: PAGE | D111: [精髓]娜迦暴君 | F111: =VLOOKUP(RC[-2],Sheet3!R2C4:R118C6,3,0) -> |n怪物精髓。吞噬时选取属性！ | G111: ="吞噬:"&RC[-3] -> 吞噬:[精髓]娜迦暴君 | H111: =RC[-4] -> [精髓]娜迦暴君 | I111: 吞噬精髓 | L111: ="blp\book\"&RC[-11]&".blp" -> blp\book\99.blp | M111: ="let _p"&RC[-12]&" = new Page("&RC[-12]&",_s"&RC[-11]&")" -> let _p99 = new Page(99,_s83)
A112: 100 | B112: 83 | C112: PAGE | D112: [精髓]黑暗巨魔酋长 | F112: =VLOOKUP(RC[-2],Sheet3!R2C4:R118C6,3,0) -> |n怪物精髓。吞噬时选取属性！ | G112: ="吞噬:"&RC[-3] -> 吞噬:[精髓]黑暗巨魔酋长 | H112: =RC[-4] -> [精髓]黑暗巨魔酋长 | I112: 吞噬精髓 | L112: ="blp\book\"&RC[-11]&".blp" -> blp\book\100.blp | M112: ="let _p"&RC[-12]&" = new Page("&RC[-12]&",_s"&RC[-11]&")" -> let _p100 = new Page(100,_s83)
A113: 101 | B113: 84 | C113: PAGE | D113: [精髓]火元素领主 | F113: =VLOOKUP(RC[-2],Sheet3!R2C4:R118C6,3,0) -> |n怪物精髓。吞噬时选取属性！ | G113: ="吞噬:"&RC[-3] -> 吞噬:[精髓]火元素领主 | H113: =RC[-4] -> [精髓]火元素领主 | I113: 吞噬精髓 | L113: ="blp\book\"&RC[-11]&".blp" -> blp\book\101.blp | M113: ="let _p"&RC[-12]&" = new Page("&RC[-12]&",_s"&RC[-11]&")" -> let _p101 = new Page(101,_s84)
A114: 102 | B114: 84 | C114: PAGE | D114: [精髓]风元素领主 | F114: =VLOOKUP(RC[-2],Sheet3!R2C4:R118C6,3,0) -> |n怪物精髓。吞噬时选取属性！ | G114: ="吞噬:"&RC[-3] -> 吞噬:[精髓]风元素领主 | H114: =RC[-4] -> [精髓]风元素领主 | I114: 吞噬精髓 | L114: ="blp\book\"&RC[-11]&".blp" -> blp\book\102.blp | M114: ="let _p"&RC[-12]&" = new Page("&RC[-12]&",_s"&RC[-11]&")" -> let _p102 = new Page(102,_s84)
A115: 103 | B115: 84 | C115: PAGE | D115: [精髓]水元素领主 | F115: =VLOOKUP(RC[-2],Sheet3!R2C4:R118C6,3,0) -> |n怪物精髓。吞噬时选取属性！ | G115: ="吞噬:"&RC[-3] -> 吞噬:[精髓]水元素领主 | H115: =RC[-4] -> [精髓]水元素领主 | I115: 吞噬精髓 | L115: ="blp\book\"&RC[-11]&".blp" -> blp\book\103.blp | M115: ="let _p"&RC[-12]&" = new Page("&RC[-12]&",_s"&RC[-11]&")" -> let _p103 = new Page(103,_s84)
A116: 104 | B116: 84 | C116: PAGE | D116: [精髓]土元素领主 | F116: =VLOOKUP(RC[-2],Sheet3!R2C4:R118C6,3,0) -> |n怪物精髓。吞噬时选取属性！ | G116: ="吞噬:"&RC[-3] -> 吞噬:[精髓]土元素领主 | H116: =RC[-4] -> [精髓]土元素领主 | I116: 吞噬精髓 | L116: ="blp\book\"&RC[-11]&".blp" -> blp\book\104.blp | M116: ="let _p"&RC[-12]&" = new Page("&RC[-12]&",_s"&RC[-11]&")" -> let _p104 = new Page(104,_s84)

Sheet: Sheet3
A1: 等级 | B1: 品级 | C1: 前缀 | D1: 名字 | E1: 后缀 | F1: 文本 | H1: |cFFFFFF99基础属性|r | I1: 攻击: | J1: 力量: | K1: 敏捷: | L1: 智力: | M1: 血量: | N1: 护甲: | O1: |cFFFFFF55附加属性|r(%) | P1: 攻速: | Q1: 攻击吸血: | R1: 暴击概率: | S1: 暴击伤害: | T1: 伤害增幅: | U1: 附加伤害: | V1: 最终伤害: | W1: 伤害抵抗: | X1: 伤害减免: | Y1: 伤害反弹: | Z1: 力量增幅: | AA1: 敏捷增幅: | AB1: 智力增幅: | AC1: |cFFFFFF11核心属性|r | AD1: 升级属性: | AE1: 杀敌属性: | AF1: 每秒属性: | AG1: = | AH1: 描述
D2: [神器]霜之哀伤 | F2: =IF(RC[3]&RC[4]&RC[5]&RC[6]&RC[7]&RC[8]="",,R1C8)&IF(RC[3]="",,"|n"&R1C9&RC[3])&IF(RC[4]="",,"|n"&R1C10&RC[4])&IF(RC[5]="",,"|n"&R1C11&RC[5])&IF(RC[6]="",,"|n"&R1C12&RC[6])&IF(RC[7]="",,"|n"&R1C13&RC[7])&IF(RC[8]="",,"|n"&R1C14&RC[8])&IF(RC[10]&RC[11]&RC[12]&RC[13]&RC[14]&RC[15]&RC[16]&RC[17]&RC[18]&RC[19]&RC[20]&RC[21]&RC[22]="",,"|n"&R1C15)&IF(RC[10]="",,"|n"&R1C16&RC[10])&IF(RC[11]="",,"|n"&R1C17&RC[11])&IF(RC[12]="",,"|n"&R1C18&RC[12])&IF(RC[13]="",,"|n"&R1C19&RC[13])&IF(RC[14]="",,"|n"&R1C20&RC[14])&IF(RC[15]="",,"|n"&R1C21&RC[15])&IF(RC[16]="",,"|n"&R1C22&RC[16])&IF(RC[17]="",,"|n"&R1C23&RC[17])&IF(RC[18]="",,"|n"&R1C24&RC[18])&IF(RC[19]="",,"|n"&R1C25&RC[19])&IF(RC[20]="",,"|n"&R1C26&RC[20])&IF(RC[21]="",,"|n"&R1C27&RC[21])&IF(RC[22]="",,"|n"&R1C28&RC[22])&IF(RC[24]&RC[25]&RC[26]="",,"|n"&R1C29)&IF(RC[24]="",,"|n"&R1C30&RC[24])&IF(RC[25]="",,"|n"&R1C31&RC[25])&IF(RC[26]="",,"|n"&R1C32&RC[26])&IF(RC[28]="",,"|n"&RC[28]) -> |n|cFFCCCCCC永久有效|r | G2: =IF(RC[3]&RC[4]&RC[5]&RC[6]&RC[7]&RC[8]="",,R1C8)&IF(RC[3]="",,"|n"&R1C9&RC[3])&IF(RC[4]="",,"|n"&R1C10&RC[4])&IF(RC[5]="",,"|n"&R1C11&RC[5])&IF(RC[6]="",,"|n"&R1C12&RC[6])&IF(RC[7]="",,"|n"&R1C13&RC[7])&IF(RC[8]="",,"|n"&R1C14&RC[8])&IF(RC[10]&RC[11]&RC[12]&RC[13]&RC[14]&RC[15]&RC[16]&RC[17]&RC[18]&RC[19]&RC[20]&RC[21]&RC[22]="",,"|n"&R1C15)&IF(RC[10]="",,"|n"&R1C16&RC[10])&IF(RC[11]="",,"|n"&R1C17&RC[11])&IF(RC[12]="",,"|n"&R1C18&RC[12])&IF(RC[13]="",,"|n"&R1C19&RC[13])&IF(RC[14]="",,"|n"&R1C20&RC[14])&IF(RC[15]="",,"|n"&R1C21&RC[15])&IF(RC[16]="",,"|n"&R1C22&RC[16])&IF(RC[17]="",,"|n"&R1C23&RC[17])&IF(RC[18]="",,"|n"&R1C24&RC[18])&IF(RC[19]="",,"|n"&R1C25&RC[19])&IF(RC[20]="",,"|n"&R1C26&RC[20])&IF(RC[21]="",,"|n"&R1C27&RC[21])&IF(RC[22]="",,"|n"&R1C28&RC[22])&IF(RC[24]&RC[25]&RC[26]="",,"|n"&R1C29)&IF(RC[24]="",,"|n"&R1C30&RC[24])&IF(RC[25]="",,"|n"&R1C31&RC[25])&IF(RC[26]="",,"|n"&R1C32&RC[26])&IF(RC[28]="",,"|n"&RC[28]) ->  | AH2: |cFFCCCCCC永久有效|r
D3: [神器]逐风之剑 | F3: =IF(RC[3]&RC[4]&RC[5]&RC[6]&RC[7]&RC[8]="",,R1C8)&IF(RC[3]="",,"|n"&R1C9&RC[3])&IF(RC[4]="",,"|n"&R1C10&RC[4])&IF(RC[5]="",,"|n"&R1C11&RC[5])&IF(RC[6]="",,"|n"&R1C12&RC[6])&IF(RC[7]="",,"|n"&R1C13&RC[7])&IF(RC[8]="",,"|n"&R1C14&RC[8])&IF(RC[10]&RC[11]&RC[12]&RC[13]&RC[14]&RC[15]&RC[16]&RC[17]&RC[18]&RC[19]&RC[20]&RC[21]&RC[22]="",,"|n"&R1C15)&IF(RC[10]="",,"|n"&R1C16&RC[10])&IF(RC[11]="",,"|n"&R1C17&RC[11])&IF(RC[12]="",,"|n"&R1C18&RC[12])&IF(RC[13]="",,"|n"&R1C19&RC[13])&IF(RC[14]="",,"|n"&R1C20&RC[14])&IF(RC[15]="",,"|n"&R1C21&RC[15])&IF(RC[16]="",,"|n"&R1C22&RC[16])&IF(RC[17]="",,"|n"&R1C23&RC[17])&IF(RC[18]="",,"|n"&R1C24&RC[18])&IF(RC[19]="",,"|n"&R1C25&RC[19])&IF(RC[20]="",,"|n"&R1C26&RC[20])&IF(RC[21]="",,"|n"&R1C27&RC[21])&IF(RC[22]="",,"|n"&R1C28&RC[22])&IF(RC[24]&RC[25]&RC[26]="",,"|n"&R1C29)&IF(RC[24]="",,"|n"&R1C30&RC[24])&IF(RC[25]="",,"|n"&R1C31&RC[25])&IF(RC[26]="",,"|n"&R1C32&RC[26])&IF(RC[28]="",,"|n"&RC[28]) -> |n|cFFCCCCCC永久有效|r | AH3: |cFFCCCCCC永久有效|r
D4: [神器]炎魔之手 | F4: =IF(RC[3]&RC[4]&RC[5]&RC[6]&RC[7]&RC[8]="",,R1C8)&IF(RC[3]="",,"|n"&R1C9&RC[3])&IF(RC[4]="",,"|n"&R1C10&RC[4])&IF(RC[5]="",,"|n"&R1C11&RC[5])&IF(RC[6]="",,"|n"&R1C12&RC[6])&IF(RC[7]="",,"|n"&R1C13&RC[7])&IF(RC[8]="",,"|n"&R1C14&RC[8])&IF(RC[10]&RC[11]&RC[12]&RC[13]&RC[14]&RC[15]&RC[16]&RC[17]&RC[18]&RC[19]&RC[20]&RC[21]&RC[22]="",,"|n"&R1C15)&IF(RC[10]="",,"|n"&R1C16&RC[10])&IF(RC[11]="",,"|n"&R1C17&RC[11])&IF(RC[12]="",,"|n"&R1C18&RC[12])&IF(RC[13]="",,"|n"&R1C19&RC[13])&IF(RC[14]="",,"|n"&R1C20&RC[14])&IF(RC[15]="",,"|n"&R1C21&RC[15])&IF(RC[16]="",,"|n"&R1C22&RC[16])&IF(RC[17]="",,"|n"&R1C23&RC[17])&IF(RC[18]="",,"|n"&R1C24&RC[18])&IF(RC[19]="",,"|n"&R1C25&RC[19])&IF(RC[20]="",,"|n"&R1C26&RC[20])&IF(RC[21]="",,"|n"&R1C27&RC[21])&IF(RC[22]="",,"|n"&R1C28&RC[22])&IF(RC[24]&RC[25]&RC[26]="",,"|n"&R1C29)&IF(RC[24]="",,"|n"&R1C30&RC[24])&IF(RC[25]="",,"|n"&R1C31&RC[25])&IF(RC[26]="",,"|n"&R1C32&RC[26])&IF(RC[28]="",,"|n"&RC[28]) -> |n|cFFCCCCCC永久有效|r | AH4: |cFFCCCCCC永久有效|r
D5: [神器]灰烬使者 | F5: =IF(RC[3]&RC[4]&RC[5]&RC[6]&RC[7]&RC[8]="",,R1C8)&IF(RC[3]="",,"|n"&R1C9&RC[3])&IF(RC[4]="",,"|n"&R1C10&RC[4])&IF(RC[5]="",,"|n"&R1C11&RC[5])&IF(RC[6]="",,"|n"&R1C12&RC[6])&IF(RC[7]="",,"|n"&R1C13&RC[7])&IF(RC[8]="",,"|n"&R1C14&RC[8])&IF(RC[10]&RC[11]&RC[12]&RC[13]&RC[14]&RC[15]&RC[16]&RC[17]&RC[18]&RC[19]&RC[20]&RC[21]&RC[22]="",,"|n"&R1C15)&IF(RC[10]="",,"|n"&R1C16&RC[10])&IF(RC[11]="",,"|n"&R1C17&RC[11])&IF(RC[12]="",,"|n"&R1C18&RC[12])&IF(RC[13]="",,"|n"&R1C19&RC[13])&IF(RC[14]="",,"|n"&R1C20&RC[14])&IF(RC[15]="",,"|n"&R1C21&RC[15])&IF(RC[16]="",,"|n"&R1C22&RC[16])&IF(RC[17]="",,"|n"&R1C23&RC[17])&IF(RC[18]="",,"|n"&R1C24&RC[18])&IF(RC[19]="",,"|n"&R1C25&RC[19])&IF(RC[20]="",,"|n"&R1C26&RC[20])&IF(RC[21]="",,"|n"&R1C27&RC[21])&IF(RC[22]="",,"|n"&R1C28&RC[22])&IF(RC[24]&RC[25]&RC[26]="",,"|n"&R1C29)&IF(RC[24]="",,"|n"&R1C30&RC[24])&IF(RC[25]="",,"|n"&R1C31&RC[25])&IF(RC[26]="",,"|n"&R1C32&RC[26])&IF(RC[28]="",,"|n"&RC[28]) -> |n|cFFCCCCCC永久有效|r | AH5: |cFFCCCCCC永久有效|r
D6: [神器]埃辛诺斯战刃 | F6: =IF(RC[3]&RC[4]&RC[5]&RC[6]&RC[7]&RC[8]="",,R1C8)&IF(RC[3]="",,"|n"&R1C9&RC[3])&IF(RC[4]="",,"|n"&R1C10&RC[4])&IF(RC[5]="",,"|n"&R1C11&RC[5])&IF(RC[6]="",,"|n"&R1C12&RC[6])&IF(RC[7]="",,"|n"&R1C13&RC[7])&IF(RC[8]="",,"|n"&R1C14&RC[8])&IF(RC[10]&RC[11]&RC[12]&RC[13]&RC[14]&RC[15]&RC[16]&RC[17]&RC[18]&RC[19]&RC[20]&RC[21]&RC[22]="",,"|n"&R1C15)&IF(RC[10]="",,"|n"&R1C16&RC[10])&IF(RC[11]="",,"|n"&R1C17&RC[11])&IF(RC[12]="",,"|n"&R1C18&RC[12])&IF(RC[13]="",,"|n"&R1C19&RC[13])&IF(RC[14]="",,"|n"&R1C20&RC[14])&IF(RC[15]="",,"|n"&R1C21&RC[15])&IF(RC[16]="",,"|n"&R1C22&RC[16])&IF(RC[17]="",,"|n"&R1C23&RC[17])&IF(RC[18]="",,"|n"&R1C24&RC[18])&IF(RC[19]="",,"|n"&R1C25&RC[19])&IF(RC[20]="",,"|n"&R1C26&RC[20])&IF(RC[21]="",,"|n"&R1C27&RC[21])&IF(RC[22]="",,"|n"&R1C28&RC[22])&IF(RC[24]&RC[25]&RC[26]="",,"|n"&R1C29)&IF(RC[24]="",,"|n"&R1C30&RC[24])&IF(RC[25]="",,"|n"&R1C31&RC[25])&IF(RC[26]="",,"|n"&R1C32&RC[26])&IF(RC[28]="",,"|n"&RC[28]) -> |n|cFFCCCCCC永久有效|r | AH6: |cFFCCCCCC永久有效|r
D7: [神器]群星之怒 | F7: =IF(RC[3]&RC[4]&RC[5]&RC[6]&RC[7]&RC[8]="",,R1C8)&IF(RC[3]="",,"|n"&R1C9&RC[3])&IF(RC[4]="",,"|n"&R1C10&RC[4])&IF(RC[5]="",,"|n"&R1C11&RC[5])&IF(RC[6]="",,"|n"&R1C12&RC[6])&IF(RC[7]="",,"|n"&R1C13&RC[7])&IF(RC[8]="",,"|n"&R1C14&RC[8])&IF(RC[10]&RC[11]&RC[12]&RC[13]&RC[14]&RC[15]&RC[16]&RC[17]&RC[18]&RC[19]&RC[20]&RC[21]&RC[22]="",,"|n"&R1C15)&IF(RC[10]="",,"|n"&R1C16&RC[10])&IF(RC[11]="",,"|n"&R1C17&RC[11])&IF(RC[12]="",,"|n"&R1C18&RC[12])&IF(RC[13]="",,"|n"&R1C19&RC[13])&IF(RC[14]="",,"|n"&R1C20&RC[14])&IF(RC[15]="",,"|n"&R1C21&RC[15])&IF(RC[16]="",,"|n"&R1C22&RC[16])&IF(RC[17]="",,"|n"&R1C23&RC[17])&IF(RC[18]="",,"|n"&R1C24&RC[18])&IF(RC[19]="",,"|n"&R1C25&RC[19])&IF(RC[20]="",,"|n"&R1C26&RC[20])&IF(RC[21]="",,"|n"&R1C27&RC[21])&IF(RC[22]="",,"|n"&R1C28&RC[22])&IF(RC[24]&RC[25]&RC[26]="",,"|n"&R1C29)&IF(RC[24]="",,"|n"&R1C30&RC[24])&IF(RC[25]="",,"|n"&R1C31&RC[25])&IF(RC[26]="",,"|n"&R1C32&RC[26])&IF(RC[28]="",,"|n"&RC[28]) -> |n|cFFCCCCCC永久有效|r | AH7: |cFFCCCCCC永久有效|r
D8: [神器]毁灭之锤 | F8: =IF(RC[3]&RC[4]&RC[5]&RC[6]&RC[7]&RC[8]="",,R1C8)&IF(RC[3]="",,"|n"&R1C9&RC[3])&IF(RC[4]="",,"|n"&R1C10&RC[4])&IF(RC[5]="",,"|n"&R1C11&RC[5])&IF(RC[6]="",,"|n"&R1C12&RC[6])&IF(RC[7]="",,"|n"&R1C13&RC[7])&IF(RC[8]="",,"|n"&R1C14&RC[8])&IF(RC[10]&RC[11]&RC[12]&RC[13]&RC[14]&RC[15]&RC[16]&RC[17]&RC[18]&RC[19]&RC[20]&RC[21]&RC[22]="",,"|n"&R1C15)&IF(RC[10]="",,"|n"&R1C16&RC[10])&IF(RC[11]="",,"|n"&R1C17&RC[11])&IF(RC[12]="",,"|n"&R1C18&RC[12])&IF(RC[13]="",,"|n"&R1C19&RC[13])&IF(RC[14]="",,"|n"&R1C20&RC[14])&IF(RC[15]="",,"|n"&R1C21&RC[15])&IF(RC[16]="",,"|n"&R1C22&RC[16])&IF(RC[17]="",,"|n"&R1C23&RC[17])&IF(RC[18]="",,"|n"&R1C24&RC[18])&IF(RC[19]="",,"|n"&R1C25&RC[19])&IF(RC[20]="",,"|n"&R1C26&RC[20])&IF(RC[21]="",,"|n"&R1C27&RC[21])&IF(RC[22]="",,"|n"&R1C28&RC[22])&IF(RC[24]&RC[25]&RC[26]="",,"|n"&R1C29)&IF(RC[24]="",,"|n"&R1C30&RC[24])&IF(RC[25]="",,"|n"&R1C31&RC[25])&IF(RC[26]="",,"|n"&R1C32&RC[26])&IF(RC[28]="",,"|n"&RC[28]) -> |n|cFFCCCCCC永久有效|r | AH8: |cFFCCCCCC永久有效|r
D9: [神器]龙父之牙 | F9: =IF(RC[3]&RC[4]&RC[5]&RC[6]&RC[7]&RC[8]="",,R1C8)&IF(RC[3]="",,"|n"&R1C9&RC[3])&IF(RC[4]="",,"|n"&R1C10&RC[4])&IF(RC[5]="",,"|n"&R1C11&RC[5])&IF(RC[6]="",,"|n"&R1C12&RC[6])&IF(RC[7]="",,"|n"&R1C13&RC[7])&IF(RC[8]="",,"|n"&R1C14&RC[8])&IF(RC[10]&RC[11]&RC[12]&RC[13]&RC[14]&RC[15]&RC[16]&RC[17]&RC[18]&RC[19]&RC[20]&RC[21]&RC[22]="",,"|n"&R1C15)&IF(RC[10]="",,"|n"&R1C16&RC[10])&IF(RC[11]="",,"|n"&R1C17&RC[11])&IF(RC[12]="",,"|n"&R1C18&RC[12])&IF(RC[13]="",,"|n"&R1C19&RC[13])&IF(RC[14]="",,"|n"&R1C20&RC[14])&IF(RC[15]="",,"|n"&R1C21&RC[15])&IF(RC[16]="",,"|n"&R1C22&RC[16])&IF(RC[17]="",,"|n"&R1C23&RC[17])&IF(RC[18]="",,"|n"&R1C24&RC[18])&IF(RC[19]="",,"|n"&R1C25&RC[19])&IF(RC[20]="",,"|n"&R1C26&RC[20])&IF(RC[21]="",,"|n"&R1C27&RC[21])&IF(RC[22]="",,"|n"&R1C28&RC[22])&IF(RC[24]&RC[25]&RC[26]="",,"|n"&R1C29)&IF(RC[24]="",,"|n"&R1C30&RC[24])&IF(RC[25]="",,"|n"&R1C31&RC[25])&IF(RC[26]="",,"|n"&R1C32&RC[26])&IF(RC[28]="",,"|n"&RC[28]) -> |n|cFFCCCCCC永久有效|r | AH9: |cFFCCCCCC永久有效|r
D11: 永恒者时间宝珠 | F11: =IF(RC[3]&RC[4]&RC[5]&RC[6]&RC[7]&RC[8]="",,R1C8)&IF(RC[3]="",,"|n"&R1C9&RC[3])&IF(RC[4]="",,"|n"&R1C10&RC[4])&IF(RC[5]="",,"|n"&R1C11&RC[5])&IF(RC[6]="",,"|n"&R1C12&RC[6])&IF(RC[7]="",,"|n"&R1C13&RC[7])&IF(RC[8]="",,"|n"&R1C14&RC[8])&IF(RC[10]&RC[11]&RC[12]&RC[13]&RC[14]&RC[15]&RC[16]&RC[17]&RC[18]&RC[19]&RC[20]&RC[21]&RC[22]="",,"|n"&R1C15)&IF(RC[10]="",,"|n"&R1C16&RC[10])&IF(RC[11]="",,"|n"&R1C17&RC[11])&IF(RC[12]="",,"|n"&R1C18&RC[12])&IF(RC[13]="",,"|n"&R1C19&RC[13])&IF(RC[14]="",,"|n"&R1C20&RC[14])&IF(RC[15]="",,"|n"&R1C21&RC[15])&IF(RC[16]="",,"|n"&R1C22&RC[16])&IF(RC[17]="",,"|n"&R1C23&RC[17])&IF(RC[18]="",,"|n"&R1C24&RC[18])&IF(RC[19]="",,"|n"&R1C25&RC[19])&IF(RC[20]="",,"|n"&R1C26&RC[20])&IF(RC[21]="",,"|n"&R1C27&RC[21])&IF(RC[22]="",,"|n"&R1C28&RC[22])&IF(RC[24]&RC[25]&RC[26]="",,"|n"&R1C29)&IF(RC[24]="",,"|n"&R1C30&RC[24])&IF(RC[25]="",,"|n"&R1C31&RC[25])&IF(RC[26]="",,"|n"&R1C32&RC[26])&IF(RC[28]="",,"|n"&RC[28]) -> |cFFFFFF99基础属性|r|n力量:600000|n敏捷:600000|n智力:600000|n|cFFFFFF11核心属性|r|n每秒属性:2500|n|cFFCCCCCC本局有效|r | J11: 600000 | K11: 600000 | L11: 600000 | AF11: 2500 | AH11: |cFFCCCCCC本局有效|r
D12: 缚誓者生命宝珠 | F12: =IF(RC[3]&RC[4]&RC[5]&RC[6]&RC[7]&RC[8]="",,R1C8)&IF(RC[3]="",,"|n"&R1C9&RC[3])&IF(RC[4]="",,"|n"&R1C10&RC[4])&IF(RC[5]="",,"|n"&R1C11&RC[5])&IF(RC[6]="",,"|n"&R1C12&RC[6])&IF(RC[7]="",,"|n"&R1C13&RC[7])&IF(RC[8]="",,"|n"&R1C14&RC[8])&IF(RC[10]&RC[11]&RC[12]&RC[13]&RC[14]&RC[15]&RC[16]&RC[17]&RC[18]&RC[19]&RC[20]&RC[21]&RC[22]="",,"|n"&R1C15)&IF(RC[10]="",,"|n"&R1C16&RC[10])&IF(RC[11]="",,"|n"&R1C17&RC[11])&IF(RC[12]="",,"|n"&R1C18&RC[12])&IF(RC[13]="",,"|n"&R1C19&RC[13])&IF(RC[14]="",,"|n"&R1C20&RC[14])&IF(RC[15]="",,"|n"&R1C21&RC[15])&IF(RC[16]="",,"|n"&R1C22&RC[16])&IF(RC[17]="",,"|n"&R1C23&RC[17])&IF(RC[18]="",,"|n"&R1C24&RC[18])&IF(RC[19]="",,"|n"&R1C25&RC[19])&IF(RC[20]="",,"|n"&R1C26&RC[20])&IF(RC[21]="",,"|n"&R1C27&RC[21])&IF(RC[22]="",,"|n"&R1C28&RC[22])&IF(RC[24]&RC[25]&RC[26]="",,"|n"&R1C29)&IF(RC[24]="",,"|n"&R1C30&RC[24])&IF(RC[25]="",,"|n"&R1C31&RC[25])&IF(RC[26]="",,"|n"&R1C32&RC[26])&IF(RC[28]="",,"|n"&RC[28]) -> |cFFFFFF99基础属性|r|n血量:8000000|n|cFFFFFF11核心属性|r|n杀敌属性:500|n|cFFCCCCCC本局有效|r | M12: 8000000 | AE12: 500 | AH12: |cFFCCCCCC本局有效|r
D13: 典法者魔法宝珠 | F13: =IF(RC[3]&RC[4]&RC[5]&RC[6]&RC[7]&RC[8]="",,R1C8)&IF(RC[3]="",,"|n"&R1C9&RC[3])&IF(RC[4]="",,"|n"&R1C10&RC[4])&IF(RC[5]="",,"|n"&R1C11&RC[5])&IF(RC[6]="",,"|n"&R1C12&RC[6])&IF(RC[7]="",,"|n"&R1C13&RC[7])&IF(RC[8]="",,"|n"&R1C14&RC[8])&IF(RC[10]&RC[11]&RC[12]&RC[13]&RC[14]&RC[15]&RC[16]&RC[17]&RC[18]&RC[19]&RC[20]&RC[21]&RC[22]="",,"|n"&R1C15)&IF(RC[10]="",,"|n"&R1C16&RC[10])&IF(RC[11]="",,"|n"&R1C17&RC[11])&IF(RC[12]="",,"|n"&R1C18&RC[12])&IF(RC[13]="",,"|n"&R1C19&RC[13])&IF(RC[14]="",,"|n"&R1C20&RC[14])&IF(RC[15]="",,"|n"&R1C21&RC[15])&IF(RC[16]="",,"|n"&R1C22&RC[16])&IF(RC[17]="",,"|n"&R1C23&RC[17])&IF(RC[18]="",,"|n"&R1C24&RC[18])&IF(RC[19]="",,"|n"&R1C25&RC[19])&IF(RC[20]="",,"|n"&R1C26&RC[20])&IF(RC[21]="",,"|n"&R1C27&RC[21])&IF(RC[22]="",,"|n"&R1C28&RC[22])&IF(RC[24]&RC[25]&RC[26]="",,"|n"&R1C29)&IF(RC[24]="",,"|n"&R1C30&RC[24])&IF(RC[25]="",,"|n"&R1C31&RC[25])&IF(RC[26]="",,"|n"&R1C32&RC[26])&IF(RC[28]="",,"|n"&RC[28]) -> |cFFFFFF99基础属性|r|n力量:600000|n敏捷:600000|n智力:600000|n|cFFFFFF11核心属性|r|n升级属性:12000|n|cFFCCCCCC本局有效|r | J13: 600000 | K13: 600000 | L13: 600000 | AD13: 12000 | AH13: |cFFCCCCCC本局有效|r
D14: 觉醒者梦境宝珠 | F14: =IF(RC[3]&RC[4]&RC[5]&RC[6]&RC[7]&RC[8]="",,R1C8)&IF(RC[3]="",,"|n"&R1C9&RC[3])&IF(RC[4]="",,"|n"&R1C10&RC[4])&IF(RC[5]="",,"|n"&R1C11&RC[5])&IF(RC[6]="",,"|n"&R1C12&RC[6])&IF(RC[7]="",,"|n"&R1C13&RC[7])&IF(RC[8]="",,"|n"&R1C14&RC[8])&IF(RC[10]&RC[11]&RC[12]&RC[13]&RC[14]&RC[15]&RC[16]&RC[17]&RC[18]&RC[19]&RC[20]&RC[21]&RC[22]="",,"|n"&R1C15)&IF(RC[10]="",,"|n"&R1C16&RC[10])&IF(RC[11]="",,"|n"&R1C17&RC[11])&IF(RC[12]="",,"|n"&R1C18&RC[12])&IF(RC[13]="",,"|n"&R1C19&RC[13])&IF(RC[14]="",,"|n"&R1C20&RC[14])&IF(RC[15]="",,"|n"&R1C21&RC[15])&IF(RC[16]="",,"|n"&R1C22&RC[16])&IF(RC[17]="",,"|n"&R1C23&RC[17])&IF(RC[18]="",,"|n"&R1C24&RC[18])&IF(RC[19]="",,"|n"&R1C25&RC[19])&IF(RC[20]="",,"|n"&R1C26&RC[20])&IF(RC[21]="",,"|n"&R1C27&RC[21])&IF(RC[22]="",,"|n"&R1C28&RC[22])&IF(RC[24]&RC[25]&RC[26]="",,"|n"&R1C29)&IF(RC[24]="",,"|n"&R1C30&RC[24])&IF(RC[25]="",,"|n"&R1C31&RC[25])&IF(RC[26]="",,"|n"&R1C32&RC[26])&IF(RC[28]="",,"|n"&RC[28]) -> |n|cFFFFFF55附加属性|r(%)|n伤害减免:25|n|cFFCCCCCC本局有效|r | X14: 25 | AH14: |cFFCCCCCC本局有效|r
D15: 灭世者大地宝珠 | F15: =IF(RC[3]&RC[4]&RC[5]&RC[6]&RC[7]&RC[8]="",,R1C8)&IF(RC[3]="",,"|n"&R1C9&RC[3])&IF(RC[4]="",,"|n"&R1C10&RC[4])&IF(RC[5]="",,"|n"&R1C11&RC[5])&IF(RC[6]="",,"|n"&R1C12&RC[6])&IF(RC[7]="",,"|n"&R1C13&RC[7])&IF(RC[8]="",,"|n"&R1C14&RC[8])&IF(RC[10]&RC[11]&RC[12]&RC[13]&RC[14]&RC[15]&RC[16]&RC[17]&RC[18]&RC[19]&RC[20]&RC[21]&RC[22]="",,"|n"&R1C15)&IF(RC[10]="",,"|n"&R1C16&RC[10])&IF(RC[11]="",,"|n"&R1C17&RC[11])&IF(RC[12]="",,"|n"&R1C18&RC[12])&IF(RC[13]="",,"|n"&R1C19&RC[13])&IF(RC[14]="",,"|n"&R1C20&RC[14])&IF(RC[15]="",,"|n"&R1C21&RC[15])&IF(RC[16]="",,"|n"&R1C22&RC[16])&IF(RC[17]="",,"|n"&R1C23&RC[17])&IF(RC[18]="",,"|n"&R1C24&RC[18])&IF(RC[19]="",,"|n"&R1C25&RC[19])&IF(RC[20]="",,"|n"&R1C26&RC[20])&IF(RC[21]="",,"|n"&R1C27&RC[21])&IF(RC[22]="",,"|n"&R1C28&RC[22])&IF(RC[24]&RC[25]&RC[26]="",,"|n"&R1C29)&IF(RC[24]="",,"|n"&R1C30&RC[24])&IF(RC[25]="",,"|n"&R1C31&RC[25])&IF(RC[26]="",,"|n"&R1C32&RC[26])&IF(RC[28]="",,"|n"&RC[28]) -> |cFFFFFF99基础属性|r|n护甲:50000|n|cFFFFFF55附加属性|r(%)|n附加伤害:80|n|cFFCCCCCC本局有效|r | N15: 50000 | U15: 80 | AH15: |cFFCCCCCC本局有效|r
D16: 守护者泰坦宝珠 | F16: =IF(RC[3]&RC[4]&RC[5]&RC[6]&RC[7]&RC[8]="",,R1C8)&IF(RC[3]="",,"|n"&R1C9&RC[3])&IF(RC[4]="",,"|n"&R1C10&RC[4])&IF(RC[5]="",,"|n"&R1C11&RC[5])&IF(RC[6]="",,"|n"&R1C12&RC[6])&IF(RC[7]="",,"|n"&R1C13&RC[7])&IF(RC[8]="",,"|n"&R1C14&RC[8])&IF(RC[10]&RC[11]&RC[12]&RC[13]&RC[14]&RC[15]&RC[16]&RC[17]&RC[18]&RC[19]&RC[20]&RC[21]&RC[22]="",,"|n"&R1C15)&IF(RC[10]="",,"|n"&R1C16&RC[10])&IF(RC[11]="",,"|n"&R1C17&RC[11])&IF(RC[12]="",,"|n"&R1C18&RC[12])&IF(RC[13]="",,"|n"&R1C19&RC[13])&IF(RC[14]="",,"|n"&R1C20&RC[14])&IF(RC[15]="",,"|n"&R1C21&RC[15])&IF(RC[16]="",,"|n"&R1C22&RC[16])&IF(RC[17]="",,"|n"&R1C23&RC[17])&IF(RC[18]="",,"|n"&R1C24&RC[18])&IF(RC[19]="",,"|n"&R1C25&RC[19])&IF(RC[20]="",,"|n"&R1C26&RC[20])&IF(RC[21]="",,"|n"&R1C27&RC[21])&IF(RC[22]="",,"|n"&R1C28&RC[22])&IF(RC[24]&RC[25]&RC[26]="",,"|n"&R1C29)&IF(RC[24]="",,"|n"&R1C30&RC[24])&IF(RC[25]="",,"|n"&R1C31&RC[25])&IF(RC[26]="",,"|n"&R1C32&RC[26])&IF(RC[28]="",,"|n"&RC[28]) -> |cFFFFFF99基础属性|r|n攻击:2000000|n|cFFFFFF55附加属性|r(%)|n攻速:60|n|cFFCCCCCC本局有效|r | I16: 2000000 | P16: 60 | AH16: |cFFCCCCCC本局有效|r
D17: 观察者监视宝珠 | F17: =IF(RC[3]&RC[4]&RC[5]&RC[6]&RC[7]&RC[8]="",,R1C8)&IF(RC[3]="",,"|n"&R1C9&RC[3])&IF(RC[4]="",,"|n"&R1C10&RC[4])&IF(RC[5]="",,"|n"&R1C11&RC[5])&IF(RC[6]="",,"|n"&R1C12&RC[6])&IF(RC[7]="",,"|n"&R1C13&RC[7])&IF(RC[8]="",,"|n"&R1C14&RC[8])&IF(RC[10]&RC[11]&RC[12]&RC[13]&RC[14]&RC[15]&RC[16]&RC[17]&RC[18]&RC[19]&RC[20]&RC[21]&RC[22]="",,"|n"&R1C15)&IF(RC[10]="",,"|n"&R1C16&RC[10])&IF(RC[11]="",,"|n"&R1C17&RC[11])&IF(RC[12]="",,"|n"&R1C18&RC[12])&IF(RC[13]="",,"|n"&R1C19&RC[13])&IF(RC[14]="",,"|n"&R1C20&RC[14])&IF(RC[15]="",,"|n"&R1C21&RC[15])&IF(RC[16]="",,"|n"&R1C22&RC[16])&IF(RC[17]="",,"|n"&R1C23&RC[17])&IF(RC[18]="",,"|n"&R1C24&RC[18])&IF(RC[19]="",,"|n"&R1C25&RC[19])&IF(RC[20]="",,"|n"&R1C26&RC[20])&IF(RC[21]="",,"|n"&R1C27&RC[21])&IF(RC[22]="",,"|n"&R1C28&RC[22])&IF(RC[24]&RC[25]&RC[26]="",,"|n"&R1C29)&IF(RC[24]="",,"|n"&R1C30&RC[24])&IF(RC[25]="",,"|n"&R1C31&RC[25])&IF(RC[26]="",,"|n"&R1C32&RC[26])&IF(RC[28]="",,"|n"&RC[28]) -> |n|cFFFFFF55附加属性|r(%)|n攻击吸血:25|n|cFFCCCCCC本局有效|r | Q17: 25 | AH17: |cFFCCCCCC本局有效|r
D18: 弑君者冰封宝珠 | F18: =IF(RC[3]&RC[4]&RC[5]&RC[6]&RC[7]&RC[8]="",,R1C8)&IF(RC[3]="",,"|n"&R1C9&RC[3])&IF(RC[4]="",,"|n"&R1C10&RC[4])&IF(RC[5]="",,"|n"&R1C11&RC[5])&IF(RC[6]="",,"|n"&R1C12&RC[6])&IF(RC[7]="",,"|n"&R1C13&RC[7])&IF(RC[8]="",,"|n"&R1C14&RC[8])&IF(RC[10]&RC[11]&RC[12]&RC[13]&RC[14]&RC[15]&RC[16]&RC[17]&RC[18]&RC[19]&RC[20]&RC[21]&RC[22]="",,"|n"&R1C15)&IF(RC[10]="",,"|n"&R1C16&RC[10])&IF(RC[11]="",,"|n"&R1C17&RC[11])&IF(RC[12]="",,"|n"&R1C18&RC[12])&IF(RC[13]="",,"|n"&R1C19&RC[13])&IF(RC[14]="",,"|n"&R1C20&RC[14])&IF(RC[15]="",,"|n"&R1C21&RC[15])&IF(RC[16]="",,"|n"&R1C22&RC[16])&IF(RC[17]="",,"|n"&R1C23&RC[17])&IF(RC[18]="",,"|n"&R1C24&RC[18])&IF(RC[19]="",,"|n"&R1C25&RC[19])&IF(RC[20]="",,"|n"&R1C26&RC[20])&IF(RC[21]="",,"|n"&R1C27&RC[21])&IF(RC[22]="",,"|n"&R1C28&RC[22])&IF(RC[24]&RC[25]&RC[26]="",,"|n"&R1C29)&IF(RC[24]="",,"|n"&R1C30&RC[24])&IF(RC[25]="",,"|n"&R1C31&RC[25])&IF(RC[26]="",,"|n"&R1C32&RC[26])&IF(RC[28]="",,"|n"&RC[28]) -> |n|cFFFFFF55附加属性|r(%)|n暴击概率:10|n暴击伤害:80|n|cFFCCCCCC本局有效|r | R18: 10 | S18: 80 | AH18: |cFFCCCCCC本局有效|r
D20: 阿曼苏尔的预见 | F20: =IF(RC[3]&RC[4]&RC[5]&RC[6]&RC[7]&RC[8]="",,R1C8)&IF(RC[3]="",,"|n"&R1C9&RC[3])&IF(RC[4]="",,"|n"&R1C10&RC[4])&IF(RC[5]="",,"|n"&R1C11&RC[5])&IF(RC[6]="",,"|n"&R1C12&RC[6])&IF(RC[7]="",,"|n"&R1C13&RC[7])&IF(RC[8]="",,"|n"&R1C14&RC[8])&IF(RC[10]&RC[11]&RC[12]&RC[13]&RC[14]&RC[15]&RC[16]&RC[17]&RC[18]&RC[19]&RC[20]&RC[21]&RC[22]="",,"|n"&R1C15)&IF(RC[10]="",,"|n"&R1C16&RC[10])&IF(RC[11]="",,"|n"&R1C17&RC[11])&IF(RC[12]="",,"|n"&R1C18&RC[12])&IF(RC[13]="",,"|n"&R1C19&RC[13])&IF(RC[14]="",,"|n"&R1C20&RC[14])&IF(RC[15]="",,"|n"&R1C21&RC[15])&IF(RC[16]="",,"|n"&R1C22&RC[16])&IF(RC[17]="",,"|n"&R1C23&RC[17])&IF(RC[18]="",,"|n"&R1C24&RC[18])&IF(RC[19]="",,"|n"&R1C25&RC[19])&IF(RC[20]="",,"|n"&R1C26&RC[20])&IF(RC[21]="",,"|n"&R1C27&RC[21])&IF(RC[22]="",,"|n"&R1C28&RC[22])&IF(RC[24]&RC[25]&RC[26]="",,"|n"&R1C29)&IF(RC[24]="",,"|n"&R1C30&RC[24])&IF(RC[25]="",,"|n"&R1C31&RC[25])&IF(RC[26]="",,"|n"&R1C32&RC[26])&IF(RC[28]="",,"|n"&RC[28]) -> |n|cFFCCCCCC永久有效|r | AH20: |cFFCCCCCC永久有效|r
D21: 基尔加丹的炽燃决心 | F21: =IF(RC[3]&RC[4]&RC[5]&RC[6]&RC[7]&RC[8]="",,R1C8)&IF(RC[3]="",,"|n"&R1C9&RC[3])&IF(RC[4]="",,"|n"&R1C10&RC[4])&IF(RC[5]="",,"|n"&R1C11&RC[5])&IF(RC[6]="",,"|n"&R1C12&RC[6])&IF(RC[7]="",,"|n"&R1C13&RC[7])&IF(RC[8]="",,"|n"&R1C14&RC[8])&IF(RC[10]&RC[11]&RC[12]&RC[13]&RC[14]&RC[15]&RC[16]&RC[17]&RC[18]&RC[19]&RC[20]&RC[21]&RC[22]="",,"|n"&R1C15)&IF(RC[10]="",,"|n"&R1C16&RC[10])&IF(RC[11]="",,"|n"&R1C17&RC[11])&IF(RC[12]="",,"|n"&R1C18&RC[12])&IF(RC[13]="",,"|n"&R1C19&RC[13])&IF(RC[14]="",,"|n"&R1C20&RC[14])&IF(RC[15]="",,"|n"&R1C21&RC[15])&IF(RC[16]="",,"|n"&R1C22&RC[16])&IF(RC[17]="",,"|n"&R1C23&RC[17])&IF(RC[18]="",,"|n"&R1C24&RC[18])&IF(RC[19]="",,"|n"&R1C25&RC[19])&IF(RC[20]="",,"|n"&R1C26&RC[20])&IF(RC[21]="",,"|n"&R1C27&RC[21])&IF(RC[22]="",,"|n"&R1C28&RC[22])&IF(RC[24]&RC[25]&RC[26]="",,"|n"&R1C29)&IF(RC[24]="",,"|n"&R1C30&RC[24])&IF(RC[25]="",,"|n"&R1C31&RC[25])&IF(RC[26]="",,"|n"&R1C32&RC[26])&IF(RC[28]="",,"|n"&RC[28]) -> |n|cFFCCCCCC永久有效|r | AH21: |cFFCCCCCC永久有效|r
D22: 维伦的未来预言 | F22: =IF(RC[3]&RC[4]&RC[5]&RC[6]&RC[7]&RC[8]="",,R1C8)&IF(RC[3]="",,"|n"&R1C9&RC[3])&IF(RC[4]="",,"|n"&R1C10&RC[4])&IF(RC[5]="",,"|n"&R1C11&RC[5])&IF(RC[6]="",,"|n"&R1C12&RC[6])&IF(RC[7]="",,"|n"&R1C13&RC[7])&IF(RC[8]="",,"|n"&R1C14&RC[8])&IF(RC[10]&RC[11]&RC[12]&RC[13]&RC[14]&RC[15]&RC[16]&RC[17]&RC[18]&RC[19]&RC[20]&RC[21]&RC[22]="",,"|n"&R1C15)&IF(RC[10]="",,"|n"&R1C16&RC[10])&IF(RC[11]="",,"|n"&R1C17&RC[11])&IF(RC[12]="",,"|n"&R1C18&RC[12])&IF(RC[13]="",,"|n"&R1C19&RC[13])&IF(RC[14]="",,"|n"&R1C20&RC[14])&IF(RC[15]="",,"|n"&R1C21&RC[15])&IF(RC[16]="",,"|n"&R1C22&RC[16])&IF(RC[17]="",,"|n"&R1C23&RC[17])&IF(RC[18]="",,"|n"&R1C24&RC[18])&IF(RC[19]="",,"|n"&R1C25&RC[19])&IF(RC[20]="",,"|n"&R1C26&RC[20])&IF(RC[21]="",,"|n"&R1C27&RC[21])&IF(RC[22]="",,"|n"&R1C28&RC[22])&IF(RC[24]&RC[25]&RC[26]="",,"|n"&R1C29)&IF(RC[24]="",,"|n"&R1C30&RC[24])&IF(RC[25]="",,"|n"&R1C31&RC[25])&IF(RC[26]="",,"|n"&R1C32&RC[26])&IF(RC[28]="",,"|n"&RC[28]) -> |n|cFFCCCCCC永久有效|r | AH22: |cFFCCCCCC永久有效|r
D23: 阿克蒙德的重生之恨 | F23: =IF(RC[3]&RC[4]&RC[5]&RC[6]&RC[7]&RC[8]="",,R1C8)&IF(RC[3]="",,"|n"&R1C9&RC[3])&IF(RC[4]="",,"|n"&R1C10&RC[4])&IF(RC[5]="",,"|n"&R1C11&RC[5])&IF(RC[6]="",,"|n"&R1C12&RC[6])&IF(RC[7]="",,"|n"&R1C13&RC[7])&IF(RC[8]="",,"|n"&R1C14&RC[8])&IF(RC[10]&RC[11]&RC[12]&RC[13]&RC[14]&RC[15]&RC[16]&RC[17]&RC[18]&RC[19]&RC[20]&RC[21]&RC[22]="",,"|n"&R1C15)&IF(RC[10]="",,"|n"&R1C16&RC[10])&IF(RC[11]="",,"|n"&R1C17&RC[11])&IF(RC[12]="",,"|n"&R1C18&RC[12])&IF(RC[13]="",,"|n"&R1C19&RC[13])&IF(RC[14]="",,"|n"&R1C20&RC[14])&IF(RC[15]="",,"|n"&R1C21&RC[15])&IF(RC[16]="",,"|n"&R1C22&RC[16])&IF(RC[17]="",,"|n"&R1C23&RC[17])&IF(RC[18]="",,"|n"&R1C24&RC[18])&IF(RC[19]="",,"|n"&R1C25&RC[19])&IF(RC[20]="",,"|n"&R1C26&RC[20])&IF(RC[21]="",,"|n"&R1C27&RC[21])&IF(RC[22]="",,"|n"&R1C28&RC[22])&IF(RC[24]&RC[25]&RC[26]="",,"|n"&R1C29)&IF(RC[24]="",,"|n"&R1C30&RC[24])&IF(RC[25]="",,"|n"&R1C31&RC[25])&IF(RC[26]="",,"|n"&R1C32&RC[26])&IF(RC[28]="",,"|n"&RC[28]) -> |n|cFFCCCCCC永久有效|r | AH23: |cFFCCCCCC永久有效|r
D24: 诺甘农的威能 | F24: =IF(RC[3]&RC[4]&RC[5]&RC[6]&RC[7]&RC[8]="",,R1C8)&IF(RC[3]="",,"|n"&R1C9&RC[3])&IF(RC[4]="",,"|n"&R1C10&RC[4])&IF(RC[5]="",,"|n"&R1C11&RC[5])&IF(RC[6]="",,"|n"&R1C12&RC[6])&IF(RC[7]="",,"|n"&R1C13&RC[7])&IF(RC[8]="",,"|n"&R1C14&RC[8])&IF(RC[10]&RC[11]&RC[12]&RC[13]&RC[14]&RC[15]&RC[16]&RC[17]&RC[18]&RC[19]&RC[20]&RC[21]&RC[22]="",,"|n"&R1C15)&IF(RC[10]="",,"|n"&R1C16&RC[10])&IF(RC[11]="",,"|n"&R1C17&RC[11])&IF(RC[12]="",,"|n"&R1C18&RC[12])&IF(RC[13]="",,"|n"&R1C19&RC[13])&IF(RC[14]="",,"|n"&R1C20&RC[14])&IF(RC[15]="",,"|n"&R1C21&RC[15])&IF(RC[16]="",,"|n"&R1C22&RC[16])&IF(RC[17]="",,"|n"&R1C23&RC[17])&IF(RC[18]="",,"|n"&R1C24&RC[18])&IF(RC[19]="",,"|n"&R1C25&RC[19])&IF(RC[20]="",,"|n"&R1C26&RC[20])&IF(RC[21]="",,"|n"&R1C27&RC[21])&IF(RC[22]="",,"|n"&R1C28&RC[22])&IF(RC[24]&RC[25]&RC[26]="",,"|n"&R1C29)&IF(RC[24]="",,"|n"&R1C30&RC[24])&IF(RC[25]="",,"|n"&R1C31&RC[25])&IF(RC[26]="",,"|n"&R1C32&RC[26])&IF(RC[28]="",,"|n"&RC[28]) -> |n|cFFCCCCCC永久有效|r | AH24: |cFFCCCCCC永久有效|r
D25: 卡兹格罗斯的勇气 | F25: =IF(RC[3]&RC[4]&RC[5]&RC[6]&RC[7]&RC[8]="",,R1C8)&IF(RC[3]="",,"|n"&R1C9&RC[3])&IF(RC[4]="",,"|n"&R1C10&RC[4])&IF(RC[5]="",,"|n"&R1C11&RC[5])&IF(RC[6]="",,"|n"&R1C12&RC[6])&IF(RC[7]="",,"|n"&R1C13&RC[7])&IF(RC[8]="",,"|n"&R1C14&RC[8])&IF(RC[10]&RC[11]&RC[12]&RC[13]&RC[14]&RC[15]&RC[16]&RC[17]&RC[18]&RC[19]&RC[20]&RC[21]&RC[22]="",,"|n"&R1C15)&IF(RC[10]="",,"|n"&R1C16&RC[10])&IF(RC[11]="",,"|n"&R1C17&RC[11])&IF(RC[12]="",,"|n"&R1C18&RC[12])&IF(RC[13]="",,"|n"&R1C19&RC[13])&IF(RC[14]="",,"|n"&R1C20&RC[14])&IF(RC[15]="",,"|n"&R1C21&RC[15])&IF(RC[16]="",,"|n"&R1C22&RC[16])&IF(RC[17]="",,"|n"&R1C23&RC[17])&IF(RC[18]="",,"|n"&R1C24&RC[18])&IF(RC[19]="",,"|n"&R1C25&RC[19])&IF(RC[20]="",,"|n"&R1C26&RC[20])&IF(RC[21]="",,"|n"&R1C27&RC[21])&IF(RC[22]="",,"|n"&R1C28&RC[22])&IF(RC[24]&RC[25]&RC[26]="",,"|n"&R1C29)&IF(RC[24]="",,"|n"&R1C30&RC[24])&IF(RC[25]="",,"|n"&R1C31&RC[25])&IF(RC[26]="",,"|n"&R1C32&RC[26])&IF(RC[28]="",,"|n"&RC[28]) -> |n|cFFCCCCCC永久有效|r | AH25: |cFFCCCCCC永久有效|r
D26: 艾欧娜尔的怜悯 | F26: =IF(RC[3]&RC[4]&RC[5]&RC[6]&RC[7]&RC[8]="",,R1C8)&IF(RC[3]="",,"|n"&R1C9&RC[3])&IF(RC[4]="",,"|n"&R1C10&RC[4])&IF(RC[5]="",,"|n"&R1C11&RC[5])&IF(RC[6]="",,"|n"&R1C12&RC[6])&IF(RC[7]="",,"|n"&R1C13&RC[7])&IF(RC[8]="",,"|n"&R1C14&RC[8])&IF(RC[10]&RC[11]&RC[12]&RC[13]&RC[14]&RC[15]&RC[16]&RC[17]&RC[18]&RC[19]&RC[20]&RC[21]&RC[22]="",,"|n"&R1C15)&IF(RC[10]="",,"|n"&R1C16&RC[10])&IF(RC[11]="",,"|n"&R1C17&RC[11])&IF(RC[12]="",,"|n"&R1C18&RC[12])&IF(RC[13]="",,"|n"&R1C19&RC[13])&IF(RC[14]="",,"|n"&R1C20&RC[14])&IF(RC[15]="",,"|n"&R1C21&RC[15])&IF(RC[16]="",,"|n"&R1C22&RC[16])&IF(RC[17]="",,"|n"&R1C23&RC[17])&IF(RC[18]="",,"|n"&R1C24&RC[18])&IF(RC[19]="",,"|n"&R1C25&RC[19])&IF(RC[20]="",,"|n"&R1C26&RC[20])&IF(RC[21]="",,"|n"&R1C27&RC[21])&IF(RC[22]="",,"|n"&R1C28&RC[22])&IF(RC[24]&RC[25]&RC[26]="",,"|n"&R1C29)&IF(RC[24]="",,"|n"&R1C30&RC[24])&IF(RC[25]="",,"|n"&R1C31&RC[25])&IF(RC[26]="",,"|n"&R1C32&RC[26])&IF(RC[28]="",,"|n"&RC[28]) -> |n|cFFCCCCCC永久有效|r | AH26: |cFFCCCCCC永久有效|r
D27: 高戈奈斯的活力 | F27: =IF(RC[3]&RC[4]&RC[5]&RC[6]&RC[7]&RC[8]="",,R1C8)&IF(RC[3]="",,"|n"&R1C9&RC[3])&IF(RC[4]="",,"|n"&R1C10&RC[4])&IF(RC[5]="",,"|n"&R1C11&RC[5])&IF(RC[6]="",,"|n"&R1C12&RC[6])&IF(RC[7]="",,"|n"&R1C13&RC[7])&IF(RC[8]="",,"|n"&R1C14&RC[8])&IF(RC[10]&RC[11]&RC[12]&RC[13]&RC[14]&RC[15]&RC[16]&RC[17]&RC[18]&RC[19]&RC[20]&RC[21]&RC[22]="",,"|n"&R1C15)&IF(RC[10]="",,"|n"&R1C16&RC[10])&IF(RC[11]="",,"|n"&R1C17&RC[11])&IF(RC[12]="",,"|n"&R1C18&RC[12])&IF(RC[13]="",,"|n"&R1C19&RC[13])&IF(RC[14]="",,"|n"&R1C20&RC[14])&IF(RC[15]="",,"|n"&R1C21&RC[15])&IF(RC[16]="",,"|n"&R1C22&RC[16])&IF(RC[17]="",,"|n"&R1C23&RC[17])&IF(RC[18]="",,"|n"&R1C24&RC[18])&IF(RC[19]="",,"|n"&R1C25&RC[19])&IF(RC[20]="",,"|n"&R1C26&RC[20])&IF(RC[21]="",,"|n"&R1C27&RC[21])&IF(RC[22]="",,"|n"&R1C28&RC[22])&IF(RC[24]&RC[25]&RC[26]="",,"|n"&R1C29)&IF(RC[24]="",,"|n"&R1C30&RC[24])&IF(RC[25]="",,"|n"&R1C31&RC[25])&IF(RC[26]="",,"|n"&R1C32&RC[26])&IF(RC[28]="",,"|n"&RC[28]) -> |n|cFFCCCCCC永久有效|r | AH27: |cFFCCCCCC永久有效|r
D29: 淡蓝之索拉 | F29: =IF(RC[3]&RC[4]&RC[5]&RC[6]&RC[7]&RC[8]="",,R1C8)&IF(RC[3]="",,"|n"&R1C9&RC[3])&IF(RC[4]="",,"|n"&R1C10&RC[4])&IF(RC[5]="",,"|n"&R1C11&RC[5])&IF(RC[6]="",,"|n"&R1C12&RC[6])&IF(RC[7]="",,"|n"&R1C13&RC[7])&IF(RC[8]="",,"|n"&R1C14&RC[8])&IF(RC[10]&RC[11]&RC[12]&RC[13]&RC[14]&RC[15]&RC[16]&RC[17]&RC[18]&RC[19]&RC[20]&RC[21]&RC[22]="",,"|n"&R1C15)&IF(RC[10]="",,"|n"&R1C16&RC[10])&IF(RC[11]="",,"|n"&R1C17&RC[11])&IF(RC[12]="",,"|n"&R1C18&RC[12])&IF(RC[13]="",,"|n"&R1C19&RC[13])&IF(RC[14]="",,"|n"&R1C20&RC[14])&IF(RC[15]="",,"|n"&R1C21&RC[15])&IF(RC[16]="",,"|n"&R1C22&RC[16])&IF(RC[17]="",,"|n"&R1C23&RC[17])&IF(RC[18]="",,"|n"&R1C24&RC[18])&IF(RC[19]="",,"|n"&R1C25&RC[19])&IF(RC[20]="",,"|n"&R1C26&RC[20])&IF(RC[21]="",,"|n"&R1C27&RC[21])&IF(RC[22]="",,"|n"&R1C28&RC[22])&IF(RC[24]&RC[25]&RC[26]="",,"|n"&R1C29)&IF(RC[24]="",,"|n"&R1C30&RC[24])&IF(RC[25]="",,"|n"&R1C31&RC[25])&IF(RC[26]="",,"|n"&R1C32&RC[26])&IF(RC[28]="",,"|n"&RC[28]) -> |cFFFFFF99基础属性|r|n攻击:6000000|n力量:1500000|n敏捷:1500000|n智力:2500000|n血量:13000000|n护甲:50000|n|cFFFFFF55附加属性|r(%)|n攻速:60|n攻击吸血:20|n|cFFCCCCCC本局有效|r | I29: 6000000 | J29: 1500000 | K29: 1500000 | L29: 2500000 | M29: 13000000 | N29: 50000 | P29: 60 | Q29: 20 | AH29: |cFFCCCCCC本局有效|r
D30: 赤炎之菲尼克斯 | F30: =IF(RC[3]&RC[4]&RC[5]&RC[6]&RC[7]&RC[8]="",,R1C8)&IF(RC[3]="",,"|n"&R1C9&RC[3])&IF(RC[4]="",,"|n"&R1C10&RC[4])&IF(RC[5]="",,"|n"&R1C11&RC[5])&IF(RC[6]="",,"|n"&R1C12&RC[6])&IF(RC[7]="",,"|n"&R1C13&RC[7])&IF(RC[8]="",,"|n"&R1C14&RC[8])&IF(RC[10]&RC[11]&RC[12]&RC[13]&RC[14]&RC[15]&RC[16]&RC[17]&RC[18]&RC[19]&RC[20]&RC[21]&RC[22]="",,"|n"&R1C15)&IF(RC[10]="",,"|n"&R1C16&RC[10])&IF(RC[11]="",,"|n"&R1C17&RC[11])&IF(RC[12]="",,"|n"&R1C18&RC[12])&IF(RC[13]="",,"|n"&R1C19&RC[13])&IF(RC[14]="",,"|n"&R1C20&RC[14])&IF(RC[15]="",,"|n"&R1C21&RC[15])&IF(RC[16]="",,"|n"&R1C22&RC[16])&IF(RC[17]="",,"|n"&R1C23&RC[17])&IF(RC[18]="",,"|n"&R1C24&RC[18])&IF(RC[19]="",,"|n"&R1C25&RC[19])&IF(RC[20]="",,"|n"&R1C26&RC[20])&IF(RC[21]="",,"|n"&R1C27&RC[21])&IF(RC[22]="",,"|n"&R1C28&RC[22])&IF(RC[24]&RC[25]&RC[26]="",,"|n"&R1C29)&IF(RC[24]="",,"|n"&R1C30&RC[24])&IF(RC[25]="",,"|n"&R1C31&RC[25])&IF(RC[26]="",,"|n"&R1C32&RC[26])&IF(RC[28]="",,"|n"&RC[28]) -> |cFFFFFF99基础属性|r|n攻击:6000000|n力量:1500000|n敏捷:2500000|n智力:1500000|n血量:13000000|n护甲:50000|n|cFFFFFF55附加属性|r(%)|n攻速:60|n攻击吸血:20|n|cFFCCCCCC本局有效|r | I30: 6000000 | J30: 1500000 | K30: 2500000 | L30: 1500000 | M30: 13000000 | N30: 50000 | P30: 60 | Q30: 20 | AH30: |cFFCCCCCC本局有效|r
D31: 圣光之米歇尔 | F31: =IF(RC[3]&RC[4]&RC[5]&RC[6]&RC[7]&RC[8]="",,R1C8)&IF(RC[3]="",,"|n"&R1C9&RC[3])&IF(RC[4]="",,"|n"&R1C10&RC[4])&IF(RC[5]="",,"|n"&R1C11&RC[5])&IF(RC[6]="",,"|n"&R1C12&RC[6])&IF(RC[7]="",,"|n"&R1C13&RC[7])&IF(RC[8]="",,"|n"&R1C14&RC[8])&IF(RC[10]&RC[11]&RC[12]&RC[13]&RC[14]&RC[15]&RC[16]&RC[17]&RC[18]&RC[19]&RC[20]&RC[21]&RC[22]="",,"|n"&R1C15)&IF(RC[10]="",,"|n"&R1C16&RC[10])&IF(RC[11]="",,"|n"&R1C17&RC[11])&IF(RC[12]="",,"|n"&R1C18&RC[12])&IF(RC[13]="",,"|n"&R1C19&RC[13])&IF(RC[14]="",,"|n"&R1C20&RC[14])&IF(RC[15]="",,"|n"&R1C21&RC[15])&IF(RC[16]="",,"|n"&R1C22&RC[16])&IF(RC[17]="",,"|n"&R1C23&RC[17])&IF(RC[18]="",,"|n"&R1C24&RC[18])&IF(RC[19]="",,"|n"&R1C25&RC[19])&IF(RC[20]="",,"|n"&R1C26&RC[20])&IF(RC[21]="",,"|n"&R1C27&RC[21])&IF(RC[22]="",,"|n"&R1C28&RC[22])&IF(RC[24]&RC[25]&RC[26]="",,"|n"&R1C29)&IF(RC[24]="",,"|n"&R1C30&RC[24])&IF(RC[25]="",,"|n"&R1C31&RC[25])&IF(RC[26]="",,"|n"&R1C32&RC[26])&IF(RC[28]="",,"|n"&RC[28]) -> |cFFFFFF99基础属性|r|n攻击:6000000|n力量:1500000|n敏捷:1500000|n智力:1500000|n血量:25000000|n护甲:50000|n|cFFFFFF55附加属性|r(%)|n攻速:60|n攻击吸血:20|n|cFFCCCCCC本局有效|r | I31: 6000000 | J31: 1500000 | K31: 1500000 | L31: 1500000 | M31: 25000000 | N31: 50000 | P31: 60 | Q31: 20 | AH31: |cFFCCCCCC本局有效|r
D32: 暗黑之撒旦 | F32: =IF(RC[3]&RC[4]&RC[5]&RC[6]&RC[7]&RC[8]="",,R1C8)&IF(RC[3]="",,"|n"&R1C9&RC[3])&IF(RC[4]="",,"|n"&R1C10&RC[4])&IF(RC[5]="",,"|n"&R1C11&RC[5])&IF(RC[6]="",,"|n"&R1C12&RC[6])&IF(RC[7]="",,"|n"&R1C13&RC[7])&IF(RC[8]="",,"|n"&R1C14&RC[8])&IF(RC[10]&RC[11]&RC[12]&RC[13]&RC[14]&RC[15]&RC[16]&RC[17]&RC[18]&RC[19]&RC[20]&RC[21]&RC[22]="",,"|n"&R1C15)&IF(RC[10]="",,"|n"&R1C16&RC[10])&IF(RC[11]="",,"|n"&R1C17&RC[11])&IF(RC[12]="",,"|n"&R1C18&RC[12])&IF(RC[13]="",,"|n"&R1C19&RC[13])&IF(RC[14]="",,"|n"&R1C20&RC[14])&IF(RC[15]="",,"|n"&R1C21&RC[15])&IF(RC[16]="",,"|n"&R1C22&RC[16])&IF(RC[17]="",,"|n"&R1C23&RC[17])&IF(RC[18]="",,"|n"&R1C24&RC[18])&IF(RC[19]="",,"|n"&R1C25&RC[19])&IF(RC[20]="",,"|n"&R1C26&RC[20])&IF(RC[21]="",,"|n"&R1C27&RC[21])&IF(RC[22]="",,"|n"&R1C28&RC[22])&IF(RC[24]&RC[25]&RC[26]="",,"|n"&R1C29)&IF(RC[24]="",,"|n"&R1C30&RC[24])&IF(RC[25]="",,"|n"&R1C31&RC[25])&IF(RC[26]="",,"|n"&R1C32&RC[26])&IF(RC[28]="",,"|n"&RC[28]) -> |cFFFFFF99基础属性|r|n攻击:10000000|n力量:1500000|n敏捷:1500000|n智力:1500000|n血量:13000000|n护甲:50000|n|cFFFFFF55附加属性|r(%)|n攻速:80|n攻击吸血:20|n暴击伤害:40|n|cFFCCCCCC本局有效|r | I32: 10000000 | J32: 1500000 | K32: 1500000 | L32: 1500000 | M32: 13000000 | N32: 50000 | P32: 80 | Q32: 20 | S32: 40 | AH32: |cFFCCCCCC本局有效|r
D33: 纯白之雪 | F33: =IF(RC[3]&RC[4]&RC[5]&RC[6]&RC[7]&RC[8]="",,R1C8)&IF(RC[3]="",,"|n"&R1C9&RC[3])&IF(RC[4]="",,"|n"&R1C10&RC[4])&IF(RC[5]="",,"|n"&R1C11&RC[5])&IF(RC[6]="",,"|n"&R1C12&RC[6])&IF(RC[7]="",,"|n"&R1C13&RC[7])&IF(RC[8]="",,"|n"&R1C14&RC[8])&IF(RC[10]&RC[11]&RC[12]&RC[13]&RC[14]&RC[15]&RC[16]&RC[17]&RC[18]&RC[19]&RC[20]&RC[21]&RC[22]="",,"|n"&R1C15)&IF(RC[10]="",,"|n"&R1C16&RC[10])&IF(RC[11]="",,"|n"&R1C17&RC[11])&IF(RC[12]="",,"|n"&R1C18&RC[12])&IF(RC[13]="",,"|n"&R1C19&RC[13])&IF(RC[14]="",,"|n"&R1C20&RC[14])&IF(RC[15]="",,"|n"&R1C21&RC[15])&IF(RC[16]="",,"|n"&R1C22&RC[16])&IF(RC[17]="",,"|n"&R1C23&RC[17])&IF(RC[18]="",,"|n"&R1C24&RC[18])&IF(RC[19]="",,"|n"&R1C25&RC[19])&IF(RC[20]="",,"|n"&R1C26&RC[20])&IF(RC[21]="",,"|n"&R1C27&RC[21])&IF(RC[22]="",,"|n"&R1C28&RC[22])&IF(RC[24]&RC[25]&RC[26]="",,"|n"&R1C29)&IF(RC[24]="",,"|n"&R1C30&RC[24])&IF(RC[25]="",,"|n"&R1C31&RC[25])&IF(RC[26]="",,"|n"&R1C32&RC[26])&IF(RC[28]="",,"|n"&RC[28]) -> |cFFFFFF99基础属性|r|n攻击:6000000|n力量:2500000|n敏捷:1500000|n智力:1500000|n血量:13000000|n护甲:50000|n|cFFFFFF55附加属性|r(%)|n攻速:60|n攻击吸血:20|n|cFFCCCCCC本局有效|r | I33: 6000000 | J33: 2500000 | K33: 1500000 | L33: 1500000 | M33: 13000000 | N33: 50000 | P33: 60 | Q33: 20 | AH33: |cFFCCCCCC本局有效|r
F34: =IF(RC[3]&RC[4]&RC[5]&RC[6]&RC[7]&RC[8]="",,R1C8)&IF(RC[3]="",,"|n"&R1C9&RC[3])&IF(RC[4]="",,"|n"&R1C10&RC[4])&IF(RC[5]="",,"|n"&R1C11&RC[5])&IF(RC[6]="",,"|n"&R1C12&RC[6])&IF(RC[7]="",,"|n"&R1C13&RC[7])&IF(RC[8]="",,"|n"&R1C14&RC[8])&IF(RC[10]&RC[11]&RC[12]&RC[13]&RC[14]&RC[15]&RC[16]&RC[17]&RC[18]&RC[19]&RC[20]&RC[21]&RC[22]="",,"|n"&R1C15)&IF(RC[10]="",,"|n"&R1C16&RC[10])&IF(RC[11]="",,"|n"&R1C17&RC[11])&IF(RC[12]="",,"|n"&R1C18&RC[12])&IF(RC[13]="",,"|n"&R1C19&RC[13])&IF(RC[14]="",,"|n"&R1C20&RC[14])&IF(RC[15]="",,"|n"&R1C21&RC[15])&IF(RC[16]="",,"|n"&R1C22&RC[16])&IF(RC[17]="",,"|n"&R1C23&RC[17])&IF(RC[18]="",,"|n"&R1C24&RC[18])&IF(RC[19]="",,"|n"&R1C25&RC[19])&IF(RC[20]="",,"|n"&R1C26&RC[20])&IF(RC[21]="",,"|n"&R1C27&RC[21])&IF(RC[22]="",,"|n"&R1C28&RC[22])&IF(RC[24]&RC[25]&RC[26]="",,"|n"&R1C29)&IF(RC[24]="",,"|n"&R1C30&RC[24])&IF(RC[25]="",,"|n"&R1C31&RC[25])&IF(RC[26]="",,"|n"&R1C32&RC[26])&IF(RC[28]="",,"|n"&RC[28]) -> 
D35: 0次炼体 | F35: =IF(RC[3]&RC[4]&RC[5]&RC[6]&RC[7]&RC[8]="",,R1C8)&IF(RC[3]="",,"|n"&R1C9&RC[3])&IF(RC[4]="",,"|n"&R1C10&RC[4])&IF(RC[5]="",,"|n"&R1C11&RC[5])&IF(RC[6]="",,"|n"&R1C12&RC[6])&IF(RC[7]="",,"|n"&R1C13&RC[7])&IF(RC[8]="",,"|n"&R1C14&RC[8])&IF(RC[10]&RC[11]&RC[12]&RC[13]&RC[14]&RC[15]&RC[16]&RC[17]&RC[18]&RC[19]&RC[20]&RC[21]&RC[22]="",,"|n"&R1C15)&IF(RC[10]="",,"|n"&R1C16&RC[10])&IF(RC[11]="",,"|n"&R1C17&RC[11])&IF(RC[12]="",,"|n"&R1C18&RC[12])&IF(RC[13]="",,"|n"&R1C19&RC[13])&IF(RC[14]="",,"|n"&R1C20&RC[14])&IF(RC[15]="",,"|n"&R1C21&RC[15])&IF(RC[16]="",,"|n"&R1C22&RC[16])&IF(RC[17]="",,"|n"&R1C23&RC[17])&IF(RC[18]="",,"|n"&R1C24&RC[18])&IF(RC[19]="",,"|n"&R1C25&RC[19])&IF(RC[20]="",,"|n"&R1C26&RC[20])&IF(RC[21]="",,"|n"&R1C27&RC[21])&IF(RC[22]="",,"|n"&R1C28&RC[22])&IF(RC[24]&RC[25]&RC[26]="",,"|n"&R1C29)&IF(RC[24]="",,"|n"&R1C30&RC[24])&IF(RC[25]="",,"|n"&R1C31&RC[25])&IF(RC[26]="",,"|n"&R1C32&RC[26])&IF(RC[28]="",,"|n"&RC[28]) -> |cFFFFFF99基础属性|r|n攻击:2000|n力量:500|n敏捷:500|n智力:500|n血量:50000|n护甲:3147 | G35: 1 | I35: 2000 | J35: 500 | K35: 500 | L35: 500 | M35: 50000 | N35: =INT(2500*POWER(10,0.1*RC[-7])) -> 3147
D36: 1次炼体 | F36: =IF(RC[3]&RC[4]&RC[5]&RC[6]&RC[7]&RC[8]="",,R1C8)&IF(RC[3]="",,"|n"&R1C9&RC[3])&IF(RC[4]="",,"|n"&R1C10&RC[4])&IF(RC[5]="",,"|n"&R1C11&RC[5])&IF(RC[6]="",,"|n"&R1C12&RC[6])&IF(RC[7]="",,"|n"&R1C13&RC[7])&IF(RC[8]="",,"|n"&R1C14&RC[8])&IF(RC[10]&RC[11]&RC[12]&RC[13]&RC[14]&RC[15]&RC[16]&RC[17]&RC[18]&RC[19]&RC[20]&RC[21]&RC[22]="",,"|n"&R1C15)&IF(RC[10]="",,"|n"&R1C16&RC[10])&IF(RC[11]="",,"|n"&R1C17&RC[11])&IF(RC[12]="",,"|n"&R1C18&RC[12])&IF(RC[13]="",,"|n"&R1C19&RC[13])&IF(RC[14]="",,"|n"&R1C20&RC[14])&IF(RC[15]="",,"|n"&R1C21&RC[15])&IF(RC[16]="",,"|n"&R1C22&RC[16])&IF(RC[17]="",,"|n"&R1C23&RC[17])&IF(RC[18]="",,"|n"&R1C24&RC[18])&IF(RC[19]="",,"|n"&R1C25&RC[19])&IF(RC[20]="",,"|n"&R1C26&RC[20])&IF(RC[21]="",,"|n"&R1C27&RC[21])&IF(RC[22]="",,"|n"&R1C28&RC[22])&IF(RC[24]&RC[25]&RC[26]="",,"|n"&R1C29)&IF(RC[24]="",,"|n"&R1C30&RC[24])&IF(RC[25]="",,"|n"&R1C31&RC[25])&IF(RC[26]="",,"|n"&R1C32&RC[26])&IF(RC[28]="",,"|n"&RC[28]) -> |cFFFFFF99基础属性|r|n护甲:3962|n|cFFFFFF55附加属性|r(%)|n伤害增幅:5|n附加伤害:5|n|cFFFFFF11核心属性|r|n升级属性:50|n杀敌属性:1|n每秒属性:2 | G36: 2 | N36: =INT(2500*POWER(10,0.1*RC[-7])) -> 3962 | T36: 5 | U36: 5 | AD36: 50 | AE36: 1 | AF36: 2
D37: 2次炼体 | F37: =IF(RC[3]&RC[4]&RC[5]&RC[6]&RC[7]&RC[8]="",,R1C8)&IF(RC[3]="",,"|n"&R1C9&RC[3])&IF(RC[4]="",,"|n"&R1C10&RC[4])&IF(RC[5]="",,"|n"&R1C11&RC[5])&IF(RC[6]="",,"|n"&R1C12&RC[6])&IF(RC[7]="",,"|n"&R1C13&RC[7])&IF(RC[8]="",,"|n"&R1C14&RC[8])&IF(RC[10]&RC[11]&RC[12]&RC[13]&RC[14]&RC[15]&RC[16]&RC[17]&RC[18]&RC[19]&RC[20]&RC[21]&RC[22]="",,"|n"&R1C15)&IF(RC[10]="",,"|n"&R1C16&RC[10])&IF(RC[11]="",,"|n"&R1C17&RC[11])&IF(RC[12]="",,"|n"&R1C18&RC[12])&IF(RC[13]="",,"|n"&R1C19&RC[13])&IF(RC[14]="",,"|n"&R1C20&RC[14])&IF(RC[15]="",,"|n"&R1C21&RC[15])&IF(RC[16]="",,"|n"&R1C22&RC[16])&IF(RC[17]="",,"|n"&R1C23&RC[17])&IF(RC[18]="",,"|n"&R1C24&RC[18])&IF(RC[19]="",,"|n"&R1C25&RC[19])&IF(RC[20]="",,"|n"&R1C26&RC[20])&IF(RC[21]="",,"|n"&R1C27&RC[21])&IF(RC[22]="",,"|n"&R1C28&RC[22])&IF(RC[24]&RC[25]&RC[26]="",,"|n"&R1C29)&IF(RC[24]="",,"|n"&R1C30&RC[24])&IF(RC[25]="",,"|n"&R1C31&RC[25])&IF(RC[26]="",,"|n"&R1C32&RC[26])&IF(RC[28]="",,"|n"&RC[28]) -> |cFFFFFF99基础属性|r|n护甲:4988|n|cFFFFFF55附加属性|r(%)|n伤害增幅:10|n附加伤害:10|n|cFFFFFF11核心属性|r|n升级属性:100|n杀敌属性:2|n每秒属性:4 | G37: 3 | N37: =INT(2500*POWER(10,0.1*RC[-7])) -> 4988 | T37: 10 | U37: 10 | AD37: 100 | AE37: 2 | AF37: 4
D38: 3次炼体 | F38: =IF(RC[3]&RC[4]&RC[5]&RC[6]&RC[7]&RC[8]="",,R1C8)&IF(RC[3]="",,"|n"&R1C9&RC[3])&IF(RC[4]="",,"|n"&R1C10&RC[4])&IF(RC[5]="",,"|n"&R1C11&RC[5])&IF(RC[6]="",,"|n"&R1C12&RC[6])&IF(RC[7]="",,"|n"&R1C13&RC[7])&IF(RC[8]="",,"|n"&R1C14&RC[8])&IF(RC[10]&RC[11]&RC[12]&RC[13]&RC[14]&RC[15]&RC[16]&RC[17]&RC[18]&RC[19]&RC[20]&RC[21]&RC[22]="",,"|n"&R1C15)&IF(RC[10]="",,"|n"&R1C16&RC[10])&IF(RC[11]="",,"|n"&R1C17&RC[11])&IF(RC[12]="",,"|n"&R1C18&RC[12])&IF(RC[13]="",,"|n"&R1C19&RC[13])&IF(RC[14]="",,"|n"&R1C20&RC[14])&IF(RC[15]="",,"|n"&R1C21&RC[15])&IF(RC[16]="",,"|n"&R1C22&RC[16])&IF(RC[17]="",,"|n"&R1C23&RC[17])&IF(RC[18]="",,"|n"&R1C24&RC[18])&IF(RC[19]="",,"|n"&R1C25&RC[19])&IF(RC[20]="",,"|n"&R1C26&RC[20])&IF(RC[21]="",,"|n"&R1C27&RC[21])&IF(RC[22]="",,"|n"&R1C28&RC[22])&IF(RC[24]&RC[25]&RC[26]="",,"|n"&R1C29)&IF(RC[24]="",,"|n"&R1C30&RC[24])&IF(RC[25]="",,"|n"&R1C31&RC[25])&IF(RC[26]="",,"|n"&R1C32&RC[26])&IF(RC[28]="",,"|n"&RC[28]) -> |cFFFFFF99基础属性|r|n护甲:6279|n|cFFFFFF55附加属性|r(%)|n伤害增幅:15|n附加伤害:15|n|cFFFFFF11核心属性|r|n升级属性:150|n杀敌属性:3|n每秒属性:6 | G38: 4 | N38: =INT(2500*POWER(10,0.1*RC[-7])) -> 6279 | T38: 15 | U38: 15 | AD38: 150 | AE38: 3 | AF38: 6
D39: 4次炼体 | F39: =IF(RC[3]&RC[4]&RC[5]&RC[6]&RC[7]&RC[8]="",,R1C8)&IF(RC[3]="",,"|n"&R1C9&RC[3])&IF(RC[4]="",,"|n"&R1C10&RC[4])&IF(RC[5]="",,"|n"&R1C11&RC[5])&IF(RC[6]="",,"|n"&R1C12&RC[6])&IF(RC[7]="",,"|n"&R1C13&RC[7])&IF(RC[8]="",,"|n"&R1C14&RC[8])&IF(RC[10]&RC[11]&RC[12]&RC[13]&RC[14]&RC[15]&RC[16]&RC[17]&RC[18]&RC[19]&RC[20]&RC[21]&RC[22]="",,"|n"&R1C15)&IF(RC[10]="",,"|n"&R1C16&RC[10])&IF(RC[11]="",,"|n"&R1C17&RC[11])&IF(RC[12]="",,"|n"&R1C18&RC[12])&IF(RC[13]="",,"|n"&R1C19&RC[13])&IF(RC[14]="",,"|n"&R1C20&RC[14])&IF(RC[15]="",,"|n"&R1C21&RC[15])&IF(RC[16]="",,"|n"&R1C22&RC[16])&IF(RC[17]="",,"|n"&R1C23&RC[17])&IF(RC[18]="",,"|n"&R1C24&RC[18])&IF(RC[19]="",,"|n"&R1C25&RC[19])&IF(RC[20]="",,"|n"&R1C26&RC[20])&IF(RC[21]="",,"|n"&R1C27&RC[21])&IF(RC[22]="",,"|n"&R1C28&RC[22])&IF(RC[24]&RC[25]&RC[26]="",,"|n"&R1C29)&IF(RC[24]="",,"|n"&R1C30&RC[24])&IF(RC[25]="",,"|n"&R1C31&RC[25])&IF(RC[26]="",,"|n"&R1C32&RC[26])&IF(RC[28]="",,"|n"&RC[28]) -> |cFFFFFF99基础属性|r|n护甲:7905|n|cFFFFFF55附加属性|r(%)|n伤害增幅:20|n附加伤害:20|n|cFFFFFF11核心属性|r|n升级属性:200|n杀敌属性:4|n每秒属性:8 | G39: 5 | N39: =INT(2500*POWER(10,0.1*RC[-7])) -> 7905 | T39: 20 | U39: 20 | AD39: 200 | AE39: 4 | AF39: 8
D40: 5次炼体 | F40: =IF(RC[3]&RC[4]&RC[5]&RC[6]&RC[7]&RC[8]="",,R1C8)&IF(RC[3]="",,"|n"&R1C9&RC[3])&IF(RC[4]="",,"|n"&R1C10&RC[4])&IF(RC[5]="",,"|n"&R1C11&RC[5])&IF(RC[6]="",,"|n"&R1C12&RC[6])&IF(RC[7]="",,"|n"&R1C13&RC[7])&IF(RC[8]="",,"|n"&R1C14&RC[8])&IF(RC[10]&RC[11]&RC[12]&RC[13]&RC[14]&RC[15]&RC[16]&RC[17]&RC[18]&RC[19]&RC[20]&RC[21]&RC[22]="",,"|n"&R1C15)&IF(RC[10]="",,"|n"&R1C16&RC[10])&IF(RC[11]="",,"|n"&R1C17&RC[11])&IF(RC[12]="",,"|n"&R1C18&RC[12])&IF(RC[13]="",,"|n"&R1C19&RC[13])&IF(RC[14]="",,"|n"&R1C20&RC[14])&IF(RC[15]="",,"|n"&R1C21&RC[15])&IF(RC[16]="",,"|n"&R1C22&RC[16])&IF(RC[17]="",,"|n"&R1C23&RC[17])&IF(RC[18]="",,"|n"&R1C24&RC[18])&IF(RC[19]="",,"|n"&R1C25&RC[19])&IF(RC[20]="",,"|n"&R1C26&RC[20])&IF(RC[21]="",,"|n"&R1C27&RC[21])&IF(RC[22]="",,"|n"&R1C28&RC[22])&IF(RC[24]&RC[25]&RC[26]="",,"|n"&R1C29)&IF(RC[24]="",,"|n"&R1C30&RC[24])&IF(RC[25]="",,"|n"&R1C31&RC[25])&IF(RC[26]="",,"|n"&R1C32&RC[26])&IF(RC[28]="",,"|n"&RC[28]) -> |cFFFFFF99基础属性|r|n护甲:9952|n|cFFFFFF55附加属性|r(%)|n伤害增幅:25|n附加伤害:25|n|cFFFFFF11核心属性|r|n升级属性:250|n杀敌属性:5|n每秒属性:10 | G40: 6 | N40: =INT(2500*POWER(10,0.1*RC[-7])) -> 9952 | T40: 25 | U40: 25 | AD40: 250 | AE40: 5 | AF40: 10
D41: 6次炼体 | F41: =IF(RC[3]&RC[4]&RC[5]&RC[6]&RC[7]&RC[8]="",,R1C8)&IF(RC[3]="",,"|n"&R1C9&RC[3])&IF(RC[4]="",,"|n"&R1C10&RC[4])&IF(RC[5]="",,"|n"&R1C11&RC[5])&IF(RC[6]="",,"|n"&R1C12&RC[6])&IF(RC[7]="",,"|n"&R1C13&RC[7])&IF(RC[8]="",,"|n"&R1C14&RC[8])&IF(RC[10]&RC[11]&RC[12]&RC[13]&RC[14]&RC[15]&RC[16]&RC[17]&RC[18]&RC[19]&RC[20]&RC[21]&RC[22]="",,"|n"&R1C15)&IF(RC[10]="",,"|n"&R1C16&RC[10])&IF(RC[11]="",,"|n"&R1C17&RC[11])&IF(RC[12]="",,"|n"&R1C18&RC[12])&IF(RC[13]="",,"|n"&R1C19&RC[13])&IF(RC[14]="",,"|n"&R1C20&RC[14])&IF(RC[15]="",,"|n"&R1C21&RC[15])&IF(RC[16]="",,"|n"&R1C22&RC[16])&IF(RC[17]="",,"|n"&R1C23&RC[17])&IF(RC[18]="",,"|n"&R1C24&RC[18])&IF(RC[19]="",,"|n"&R1C25&RC[19])&IF(RC[20]="",,"|n"&R1C26&RC[20])&IF(RC[21]="",,"|n"&R1C27&RC[21])&IF(RC[22]="",,"|n"&R1C28&RC[22])&IF(RC[24]&RC[25]&RC[26]="",,"|n"&R1C29)&IF(RC[24]="",,"|n"&R1C30&RC[24])&IF(RC[25]="",,"|n"&R1C31&RC[25])&IF(RC[26]="",,"|n"&R1C32&RC[26])&IF(RC[28]="",,"|n"&RC[28]) -> |cFFFFFF99基础属性|r|n护甲:12529|n|cFFFFFF55附加属性|r(%)|n伤害增幅:30|n附加伤害:30|n|cFFFFFF11核心属性|r|n升级属性:300|n杀敌属性:6|n每秒属性:12 | G41: 7 | N41: =INT(2500*POWER(10,0.1*RC[-7])) -> 12529 | T41: 30 | U41: 30 | AD41: 300 | AE41: 6 | AF41: 12
D42: 7次炼体 | F42: =IF(RC[3]&RC[4]&RC[5]&RC[6]&RC[7]&RC[8]="",,R1C8)&IF(RC[3]="",,"|n"&R1C9&RC[3])&IF(RC[4]="",,"|n"&R1C10&RC[4])&IF(RC[5]="",,"|n"&R1C11&RC[5])&IF(RC[6]="",,"|n"&R1C12&RC[6])&IF(RC[7]="",,"|n"&R1C13&RC[7])&IF(RC[8]="",,"|n"&R1C14&RC[8])&IF(RC[10]&RC[11]&RC[12]&RC[13]&RC[14]&RC[15]&RC[16]&RC[17]&RC[18]&RC[19]&RC[20]&RC[21]&RC[22]="",,"|n"&R1C15)&IF(RC[10]="",,"|n"&R1C16&RC[10])&IF(RC[11]="",,"|n"&R1C17&RC[11])&IF(RC[12]="",,"|n"&R1C18&RC[12])&IF(RC[13]="",,"|n"&R1C19&RC[13])&IF(RC[14]="",,"|n"&R1C20&RC[14])&IF(RC[15]="",,"|n"&R1C21&RC[15])&IF(RC[16]="",,"|n"&R1C22&RC[16])&IF(RC[17]="",,"|n"&R1C23&RC[17])&IF(RC[18]="",,"|n"&R1C24&RC[18])&IF(RC[19]="",,"|n"&R1C25&RC[19])&IF(RC[20]="",,"|n"&R1C26&RC[20])&IF(RC[21]="",,"|n"&R1C27&RC[21])&IF(RC[22]="",,"|n"&R1C28&RC[22])&IF(RC[24]&RC[25]&RC[26]="",,"|n"&R1C29)&IF(RC[24]="",,"|n"&R1C30&RC[24])&IF(RC[25]="",,"|n"&R1C31&RC[25])&IF(RC[26]="",,"|n"&R1C32&RC[26])&IF(RC[28]="",,"|n"&RC[28]) -> |cFFFFFF99基础属性|r|n护甲:15773|n|cFFFFFF55附加属性|r(%)|n伤害增幅:35|n附加伤害:35|n|cFFFFFF11核心属性|r|n升级属性:350|n杀敌属性:7|n每秒属性:14 | G42: 8 | N42: =INT(2500*POWER(10,0.1*RC[-7])) -> 15773 | T42: 35 | U42: 35 | AD42: 350 | AE42: 7 | AF42: 14
D43: 8次炼体 | F43: =IF(RC[3]&RC[4]&RC[5]&RC[6]&RC[7]&RC[8]="",,R1C8)&IF(RC[3]="",,"|n"&R1C9&RC[3])&IF(RC[4]="",,"|n"&R1C10&RC[4])&IF(RC[5]="",,"|n"&R1C11&RC[5])&IF(RC[6]="",,"|n"&R1C12&RC[6])&IF(RC[7]="",,"|n"&R1C13&RC[7])&IF(RC[8]="",,"|n"&R1C14&RC[8])&IF(RC[10]&RC[11]&RC[12]&RC[13]&RC[14]&RC[15]&RC[16]&RC[17]&RC[18]&RC[19]&RC[20]&RC[21]&RC[22]="",,"|n"&R1C15)&IF(RC[10]="",,"|n"&R1C16&RC[10])&IF(RC[11]="",,"|n"&R1C17&RC[11])&IF(RC[12]="",,"|n"&R1C18&RC[12])&IF(RC[13]="",,"|n"&R1C19&RC[13])&IF(RC[14]="",,"|n"&R1C20&RC[14])&IF(RC[15]="",,"|n"&R1C21&RC[15])&IF(RC[16]="",,"|n"&R1C22&RC[16])&IF(RC[17]="",,"|n"&R1C23&RC[17])&IF(RC[18]="",,"|n"&R1C24&RC[18])&IF(RC[19]="",,"|n"&R1C25&RC[19])&IF(RC[20]="",,"|n"&R1C26&RC[20])&IF(RC[21]="",,"|n"&R1C27&RC[21])&IF(RC[22]="",,"|n"&R1C28&RC[22])&IF(RC[24]&RC[25]&RC[26]="",,"|n"&R1C29)&IF(RC[24]="",,"|n"&R1C30&RC[24])&IF(RC[25]="",,"|n"&R1C31&RC[25])&IF(RC[26]="",,"|n"&R1C32&RC[26])&IF(RC[28]="",,"|n"&RC[28]) -> |cFFFFFF99基础属性|r|n护甲:19858|n|cFFFFFF55附加属性|r(%)|n伤害增幅:40|n附加伤害:40|n|cFFFFFF11核心属性|r|n升级属性:400|n杀敌属性:8|n每秒属性:16 | G43: 9 | N43: =INT(2500*POWER(10,0.1*RC[-7])) -> 19858 | T43: 40 | U43: 40 | AD43: 400 | AE43: 8 | AF43: 16
D44: 9次炼体 | F44: =IF(RC[3]&RC[4]&RC[5]&RC[6]&RC[7]&RC[8]="",,R1C8)&IF(RC[3]="",,"|n"&R1C9&RC[3])&IF(RC[4]="",,"|n"&R1C10&RC[4])&IF(RC[5]="",,"|n"&R1C11&RC[5])&IF(RC[6]="",,"|n"&R1C12&RC[6])&IF(RC[7]="",,"|n"&R1C13&RC[7])&IF(RC[8]="",,"|n"&R1C14&RC[8])&IF(RC[10]&RC[11]&RC[12]&RC[13]&RC[14]&RC[15]&RC[16]&RC[17]&RC[18]&RC[19]&RC[20]&RC[21]&RC[22]="",,"|n"&R1C15)&IF(RC[10]="",,"|n"&R1C16&RC[10])&IF(RC[11]="",,"|n"&R1C17&RC[11])&IF(RC[12]="",,"|n"&R1C18&RC[12])&IF(RC[13]="",,"|n"&R1C19&RC[13])&IF(RC[14]="",,"|n"&R1C20&RC[14])&IF(RC[15]="",,"|n"&R1C21&RC[15])&IF(RC[16]="",,"|n"&R1C22&RC[16])&IF(RC[17]="",,"|n"&R1C23&RC[17])&IF(RC[18]="",,"|n"&R1C24&RC[18])&IF(RC[19]="",,"|n"&R1C25&RC[19])&IF(RC[20]="",,"|n"&R1C26&RC[20])&IF(RC[21]="",,"|n"&R1C27&RC[21])&IF(RC[22]="",,"|n"&R1C28&RC[22])&IF(RC[24]&RC[25]&RC[26]="",,"|n"&R1C29)&IF(RC[24]="",,"|n"&R1C30&RC[24])&IF(RC[25]="",,"|n"&R1C31&RC[25])&IF(RC[26]="",,"|n"&R1C32&RC[26])&IF(RC[28]="",,"|n"&RC[28]) -> |cFFFFFF99基础属性|r|n护甲:25000|n|cFFFFFF55附加属性|r(%)|n伤害增幅:45|n附加伤害:45|n|cFFFFFF11核心属性|r|n升级属性:450|n杀敌属性:9|n每秒属性:18 | G44: 10 | N44: =INT(2500*POWER(10,0.1*RC[-7])) -> 25000 | T44: 45 | U44: 45 | AD44: 450 | AE44: 9 | AF44: 18
D45: 10次炼体 | F45: =IF(RC[3]&RC[4]&RC[5]&RC[6]&RC[7]&RC[8]="",,R1C8)&IF(RC[3]="",,"|n"&R1C9&RC[3])&IF(RC[4]="",,"|n"&R1C10&RC[4])&IF(RC[5]="",,"|n"&R1C11&RC[5])&IF(RC[6]="",,"|n"&R1C12&RC[6])&IF(RC[7]="",,"|n"&R1C13&RC[7])&IF(RC[8]="",,"|n"&R1C14&RC[8])&IF(RC[10]&RC[11]&RC[12]&RC[13]&RC[14]&RC[15]&RC[16]&RC[17]&RC[18]&RC[19]&RC[20]&RC[21]&RC[22]="",,"|n"&R1C15)&IF(RC[10]="",,"|n"&R1C16&RC[10])&IF(RC[11]="",,"|n"&R1C17&RC[11])&IF(RC[12]="",,"|n"&R1C18&RC[12])&IF(RC[13]="",,"|n"&R1C19&RC[13])&IF(RC[14]="",,"|n"&R1C20&RC[14])&IF(RC[15]="",,"|n"&R1C21&RC[15])&IF(RC[16]="",,"|n"&R1C22&RC[16])&IF(RC[17]="",,"|n"&R1C23&RC[17])&IF(RC[18]="",,"|n"&R1C24&RC[18])&IF(RC[19]="",,"|n"&R1C25&RC[19])&IF(RC[20]="",,"|n"&R1C26&RC[20])&IF(RC[21]="",,"|n"&R1C27&RC[21])&IF(RC[22]="",,"|n"&R1C28&RC[22])&IF(RC[24]&RC[25]&RC[26]="",,"|n"&R1C29)&IF(RC[24]="",,"|n"&R1C30&RC[24])&IF(RC[25]="",,"|n"&R1C31&RC[25])&IF(RC[26]="",,"|n"&R1C32&RC[26])&IF(RC[28]="",,"|n"&RC[28]) -> |cFFFFFF99基础属性|r|n护甲:31473|n|cFFFFFF55附加属性|r(%)|n伤害增幅:50|n附加伤害:50|n|cFFFFFF11核心属性|r|n升级属性:500|n杀敌属性:10|n每秒属性:20 | G45: 11 | N45: =INT(2500*POWER(10,0.1*RC[-7])) -> 31473 | T45: 50 | U45: 50 | AD45: 500 | AE45: 10 | AF45: 20
F46: =IF(RC[3]&RC[4]&RC[5]&RC[6]&RC[7]&RC[8]="",,R1C8)&IF(RC[3]="",,"|n"&R1C9&RC[3])&IF(RC[4]="",,"|n"&R1C10&RC[4])&IF(RC[5]="",,"|n"&R1C11&RC[5])&IF(RC[6]="",,"|n"&R1C12&RC[6])&IF(RC[7]="",,"|n"&R1C13&RC[7])&IF(RC[8]="",,"|n"&R1C14&RC[8])&IF(RC[10]&RC[11]&RC[12]&RC[13]&RC[14]&RC[15]&RC[16]&RC[17]&RC[18]&RC[19]&RC[20]&RC[21]&RC[22]="",,"|n"&R1C15)&IF(RC[10]="",,"|n"&R1C16&RC[10])&IF(RC[11]="",,"|n"&R1C17&RC[11])&IF(RC[12]="",,"|n"&R1C18&RC[12])&IF(RC[13]="",,"|n"&R1C19&RC[13])&IF(RC[14]="",,"|n"&R1C20&RC[14])&IF(RC[15]="",,"|n"&R1C21&RC[15])&IF(RC[16]="",,"|n"&R1C22&RC[16])&IF(RC[17]="",,"|n"&R1C23&RC[17])&IF(RC[18]="",,"|n"&R1C24&RC[18])&IF(RC[19]="",,"|n"&R1C25&RC[19])&IF(RC[20]="",,"|n"&R1C26&RC[20])&IF(RC[21]="",,"|n"&R1C27&RC[21])&IF(RC[22]="",,"|n"&R1C28&RC[22])&IF(RC[24]&RC[25]&RC[26]="",,"|n"&R1C29)&IF(RC[24]="",,"|n"&R1C30&RC[24])&IF(RC[25]="",,"|n"&R1C31&RC[25])&IF(RC[26]="",,"|n"&R1C32&RC[26])&IF(RC[28]="",,"|n"&RC[28]) -> 
D47: 日炎光环 | F47: =IF(RC[3]&RC[4]&RC[5]&RC[6]&RC[7]&RC[8]="",,R1C8)&IF(RC[3]="",,"|n"&R1C9&RC[3])&IF(RC[4]="",,"|n"&R1C10&RC[4])&IF(RC[5]="",,"|n"&R1C11&RC[5])&IF(RC[6]="",,"|n"&R1C12&RC[6])&IF(RC[7]="",,"|n"&R1C13&RC[7])&IF(RC[8]="",,"|n"&R1C14&RC[8])&IF(RC[10]&RC[11]&RC[12]&RC[13]&RC[14]&RC[15]&RC[16]&RC[17]&RC[18]&RC[19]&RC[20]&RC[21]&RC[22]="",,"|n"&R1C15)&IF(RC[10]="",,"|n"&R1C16&RC[10])&IF(RC[11]="",,"|n"&R1C17&RC[11])&IF(RC[12]="",,"|n"&R1C18&RC[12])&IF(RC[13]="",,"|n"&R1C19&RC[13])&IF(RC[14]="",,"|n"&R1C20&RC[14])&IF(RC[15]="",,"|n"&R1C21&RC[15])&IF(RC[16]="",,"|n"&R1C22&RC[16])&IF(RC[17]="",,"|n"&R1C23&RC[17])&IF(RC[18]="",,"|n"&R1C24&RC[18])&IF(RC[19]="",,"|n"&R1C25&RC[19])&IF(RC[20]="",,"|n"&R1C26&RC[20])&IF(RC[21]="",,"|n"&R1C27&RC[21])&IF(RC[22]="",,"|n"&R1C28&RC[22])&IF(RC[24]&RC[25]&RC[26]="",,"|n"&R1C29)&IF(RC[24]="",,"|n"&R1C30&RC[24])&IF(RC[25]="",,"|n"&R1C31&RC[25])&IF(RC[26]="",,"|n"&R1C32&RC[26])&IF(RC[28]="",,"|n"&RC[28]) -> |cFFFFFF99基础属性|r|n力量:1000|n敏捷:1000|n智力:1000|n|cFFFFFF55附加属性|r(%)|n伤害增幅:5|n属性叠加!拥有多个时只能召唤一个!|n激活后输入'-gh1'切换皮肤! | G47: 1 | J47: 1000 | K47: =RC[-1] -> 1000 | L47: =RC[-1] -> 1000 | T47: 5 | AH47: ="属性叠加!拥有多个时只能召唤一个!|n激活后输入'-gh"&RC[-27]&"'切换皮肤!" -> 属性叠加!拥有多个时只能召唤一个!|n激活后输入'-gh1'切换皮肤!
D48: 森林光环 | F48: =IF(RC[3]&RC[4]&RC[5]&RC[6]&RC[7]&RC[8]="",,R1C8)&IF(RC[3]="",,"|n"&R1C9&RC[3])&IF(RC[4]="",,"|n"&R1C10&RC[4])&IF(RC[5]="",,"|n"&R1C11&RC[5])&IF(RC[6]="",,"|n"&R1C12&RC[6])&IF(RC[7]="",,"|n"&R1C13&RC[7])&IF(RC[8]="",,"|n"&R1C14&RC[8])&IF(RC[10]&RC[11]&RC[12]&RC[13]&RC[14]&RC[15]&RC[16]&RC[17]&RC[18]&RC[19]&RC[20]&RC[21]&RC[22]="",,"|n"&R1C15)&IF(RC[10]="",,"|n"&R1C16&RC[10])&IF(RC[11]="",,"|n"&R1C17&RC[11])&IF(RC[12]="",,"|n"&R1C18&RC[12])&IF(RC[13]="",,"|n"&R1C19&RC[13])&IF(RC[14]="",,"|n"&R1C20&RC[14])&IF(RC[15]="",,"|n"&R1C21&RC[15])&IF(RC[16]="",,"|n"&R1C22&RC[16])&IF(RC[17]="",,"|n"&R1C23&RC[17])&IF(RC[18]="",,"|n"&R1C24&RC[18])&IF(RC[19]="",,"|n"&R1C25&RC[19])&IF(RC[20]="",,"|n"&R1C26&RC[20])&IF(RC[21]="",,"|n"&R1C27&RC[21])&IF(RC[22]="",,"|n"&R1C28&RC[22])&IF(RC[24]&RC[25]&RC[26]="",,"|n"&R1C29)&IF(RC[24]="",,"|n"&R1C30&RC[24])&IF(RC[25]="",,"|n"&R1C31&RC[25])&IF(RC[26]="",,"|n"&R1C32&RC[26])&IF(RC[28]="",,"|n"&RC[28]) -> |cFFFFFF99基础属性|r|n力量:2000|n敏捷:2000|n智力:2000|n|cFFFFFF55附加属性|r(%)|n伤害增幅:10|n属性叠加!拥有多个时只能召唤一个!|n激活后输入'-gh2'切换皮肤! | G48: 2 | J48: 2000 | K48: =RC[-1] -> 2000 | L48: =RC[-1] -> 2000 | T48: 10 | AH48: ="属性叠加!拥有多个时只能召唤一个!|n激活后输入'-gh"&RC[-27]&"'切换皮肤!" -> 属性叠加!拥有多个时只能召唤一个!|n激活后输入'-gh2'切换皮肤!
D49: 炽焰光环 | F49: =IF(RC[3]&RC[4]&RC[5]&RC[6]&RC[7]&RC[8]="",,R1C8)&IF(RC[3]="",,"|n"&R1C9&RC[3])&IF(RC[4]="",,"|n"&R1C10&RC[4])&IF(RC[5]="",,"|n"&R1C11&RC[5])&IF(RC[6]="",,"|n"&R1C12&RC[6])&IF(RC[7]="",,"|n"&R1C13&RC[7])&IF(RC[8]="",,"|n"&R1C14&RC[8])&IF(RC[10]&RC[11]&RC[12]&RC[13]&RC[14]&RC[15]&RC[16]&RC[17]&RC[18]&RC[19]&RC[20]&RC[21]&RC[22]="",,"|n"&R1C15)&IF(RC[10]="",,"|n"&R1C16&RC[10])&IF(RC[11]="",,"|n"&R1C17&RC[11])&IF(RC[12]="",,"|n"&R1C18&RC[12])&IF(RC[13]="",,"|n"&R1C19&RC[13])&IF(RC[14]="",,"|n"&R1C20&RC[14])&IF(RC[15]="",,"|n"&R1C21&RC[15])&IF(RC[16]="",,"|n"&R1C22&RC[16])&IF(RC[17]="",,"|n"&R1C23&RC[17])&IF(RC[18]="",,"|n"&R1C24&RC[18])&IF(RC[19]="",,"|n"&R1C25&RC[19])&IF(RC[20]="",,"|n"&R1C26&RC[20])&IF(RC[21]="",,"|n"&R1C27&RC[21])&IF(RC[22]="",,"|n"&R1C28&RC[22])&IF(RC[24]&RC[25]&RC[26]="",,"|n"&R1C29)&IF(RC[24]="",,"|n"&R1C30&RC[24])&IF(RC[25]="",,"|n"&R1C31&RC[25])&IF(RC[26]="",,"|n"&R1C32&RC[26])&IF(RC[28]="",,"|n"&RC[28]) -> |cFFFFFF99基础属性|r|n力量:3000|n敏捷:3000|n智力:3000|n|cFFFFFF55附加属性|r(%)|n伤害增幅:15|n属性叠加!拥有多个时只能召唤一个!|n激活后输入'-gh3'切换皮肤! | G49: 3 | J49: 3000 | K49: =RC[-1] -> 3000 | L49: =RC[-1] -> 3000 | T49: 15 | AH49: ="属性叠加!拥有多个时只能召唤一个!|n激活后输入'-gh"&RC[-27]&"'切换皮肤!" -> 属性叠加!拥有多个时只能召唤一个!|n激活后输入'-gh3'切换皮肤!
D50: 时空光环 | F50: =IF(RC[3]&RC[4]&RC[5]&RC[6]&RC[7]&RC[8]="",,R1C8)&IF(RC[3]="",,"|n"&R1C9&RC[3])&IF(RC[4]="",,"|n"&R1C10&RC[4])&IF(RC[5]="",,"|n"&R1C11&RC[5])&IF(RC[6]="",,"|n"&R1C12&RC[6])&IF(RC[7]="",,"|n"&R1C13&RC[7])&IF(RC[8]="",,"|n"&R1C14&RC[8])&IF(RC[10]&RC[11]&RC[12]&RC[13]&RC[14]&RC[15]&RC[16]&RC[17]&RC[18]&RC[19]&RC[20]&RC[21]&RC[22]="",,"|n"&R1C15)&IF(RC[10]="",,"|n"&R1C16&RC[10])&IF(RC[11]="",,"|n"&R1C17&RC[11])&IF(RC[12]="",,"|n"&R1C18&RC[12])&IF(RC[13]="",,"|n"&R1C19&RC[13])&IF(RC[14]="",,"|n"&R1C20&RC[14])&IF(RC[15]="",,"|n"&R1C21&RC[15])&IF(RC[16]="",,"|n"&R1C22&RC[16])&IF(RC[17]="",,"|n"&R1C23&RC[17])&IF(RC[18]="",,"|n"&R1C24&RC[18])&IF(RC[19]="",,"|n"&R1C25&RC[19])&IF(RC[20]="",,"|n"&R1C26&RC[20])&IF(RC[21]="",,"|n"&R1C27&RC[21])&IF(RC[22]="",,"|n"&R1C28&RC[22])&IF(RC[24]&RC[25]&RC[26]="",,"|n"&R1C29)&IF(RC[24]="",,"|n"&R1C30&RC[24])&IF(RC[25]="",,"|n"&R1C31&RC[25])&IF(RC[26]="",,"|n"&R1C32&RC[26])&IF(RC[28]="",,"|n"&RC[28]) -> |cFFFFFF99基础属性|r|n力量:4000|n敏捷:4000|n智力:4000|n|cFFFFFF55附加属性|r(%)|n伤害增幅:20|n属性叠加!拥有多个时只能召唤一个!|n激活后输入'-gh4'切换皮肤! | G50: 4 | J50: 4000 | K50: =RC[-1] -> 4000 | L50: =RC[-1] -> 4000 | T50: 20 | AH50: ="属性叠加!拥有多个时只能召唤一个!|n激活后输入'-gh"&RC[-27]&"'切换皮肤!" -> 属性叠加!拥有多个时只能召唤一个!|n激活后输入'-gh4'切换皮肤!
D51: 死亡斗气 | F51: =IF(RC[3]&RC[4]&RC[5]&RC[6]&RC[7]&RC[8]="",,R1C8)&IF(RC[3]="",,"|n"&R1C9&RC[3])&IF(RC[4]="",,"|n"&R1C10&RC[4])&IF(RC[5]="",,"|n"&R1C11&RC[5])&IF(RC[6]="",,"|n"&R1C12&RC[6])&IF(RC[7]="",,"|n"&R1C13&RC[7])&IF(RC[8]="",,"|n"&R1C14&RC[8])&IF(RC[10]&RC[11]&RC[12]&RC[13]&RC[14]&RC[15]&RC[16]&RC[17]&RC[18]&RC[19]&RC[20]&RC[21]&RC[22]="",,"|n"&R1C15)&IF(RC[10]="",,"|n"&R1C16&RC[10])&IF(RC[11]="",,"|n"&R1C17&RC[11])&IF(RC[12]="",,"|n"&R1C18&RC[12])&IF(RC[13]="",,"|n"&R1C19&RC[13])&IF(RC[14]="",,"|n"&R1C20&RC[14])&IF(RC[15]="",,"|n"&R1C21&RC[15])&IF(RC[16]="",,"|n"&R1C22&RC[16])&IF(RC[17]="",,"|n"&R1C23&RC[17])&IF(RC[18]="",,"|n"&R1C24&RC[18])&IF(RC[19]="",,"|n"&R1C25&RC[19])&IF(RC[20]="",,"|n"&R1C26&RC[20])&IF(RC[21]="",,"|n"&R1C27&RC[21])&IF(RC[22]="",,"|n"&R1C28&RC[22])&IF(RC[24]&RC[25]&RC[26]="",,"|n"&R1C29)&IF(RC[24]="",,"|n"&R1C30&RC[24])&IF(RC[25]="",,"|n"&R1C31&RC[25])&IF(RC[26]="",,"|n"&R1C32&RC[26])&IF(RC[28]="",,"|n"&RC[28]) -> |cFFFFFF99基础属性|r|n力量:5000|n敏捷:5000|n智力:5000|n|cFFFFFF55附加属性|r(%)|n伤害增幅:25|n属性叠加!拥有多个时只能召唤一个!|n激活后输入'-gh5'切换皮肤! | G51: 5 | J51: 5000 | K51: =RC[-1] -> 5000 | L51: =RC[-1] -> 5000 | T51: 25 | AH51: ="属性叠加!拥有多个时只能召唤一个!|n激活后输入'-gh"&RC[-27]&"'切换皮肤!" -> 属性叠加!拥有多个时只能召唤一个!|n激活后输入'-gh5'切换皮肤!
D52: 寒冰斗气 | F52: =IF(RC[3]&RC[4]&RC[5]&RC[6]&RC[7]&RC[8]="",,R1C8)&IF(RC[3]="",,"|n"&R1C9&RC[3])&IF(RC[4]="",,"|n"&R1C10&RC[4])&IF(RC[5]="",,"|n"&R1C11&RC[5])&IF(RC[6]="",,"|n"&R1C12&RC[6])&IF(RC[7]="",,"|n"&R1C13&RC[7])&IF(RC[8]="",,"|n"&R1C14&RC[8])&IF(RC[10]&RC[11]&RC[12]&RC[13]&RC[14]&RC[15]&RC[16]&RC[17]&RC[18]&RC[19]&RC[20]&RC[21]&RC[22]="",,"|n"&R1C15)&IF(RC[10]="",,"|n"&R1C16&RC[10])&IF(RC[11]="",,"|n"&R1C17&RC[11])&IF(RC[12]="",,"|n"&R1C18&RC[12])&IF(RC[13]="",,"|n"&R1C19&RC[13])&IF(RC[14]="",,"|n"&R1C20&RC[14])&IF(RC[15]="",,"|n"&R1C21&RC[15])&IF(RC[16]="",,"|n"&R1C22&RC[16])&IF(RC[17]="",,"|n"&R1C23&RC[17])&IF(RC[18]="",,"|n"&R1C24&RC[18])&IF(RC[19]="",,"|n"&R1C25&RC[19])&IF(RC[20]="",,"|n"&R1C26&RC[20])&IF(RC[21]="",,"|n"&R1C27&RC[21])&IF(RC[22]="",,"|n"&R1C28&RC[22])&IF(RC[24]&RC[25]&RC[26]="",,"|n"&R1C29)&IF(RC[24]="",,"|n"&R1C30&RC[24])&IF(RC[25]="",,"|n"&R1C31&RC[25])&IF(RC[26]="",,"|n"&R1C32&RC[26])&IF(RC[28]="",,"|n"&RC[28]) -> |cFFFFFF99基础属性|r|n力量:6000|n敏捷:6000|n智力:6000|n|cFFFFFF55附加属性|r(%)|n伤害增幅:30|n属性叠加!拥有多个时只能召唤一个!|n激活后输入'-gh6'切换皮肤! | G52: 6 | J52: 6000 | K52: =RC[-1] -> 6000 | L52: =RC[-1] -> 6000 | T52: 30 | AH52: ="属性叠加!拥有多个时只能召唤一个!|n激活后输入'-gh"&RC[-27]&"'切换皮肤!" -> 属性叠加!拥有多个时只能召唤一个!|n激活后输入'-gh6'切换皮肤!
D53: 雷电护体 | F53: =IF(RC[3]&RC[4]&RC[5]&RC[6]&RC[7]&RC[8]="",,R1C8)&IF(RC[3]="",,"|n"&R1C9&RC[3])&IF(RC[4]="",,"|n"&R1C10&RC[4])&IF(RC[5]="",,"|n"&R1C11&RC[5])&IF(RC[6]="",,"|n"&R1C12&RC[6])&IF(RC[7]="",,"|n"&R1C13&RC[7])&IF(RC[8]="",,"|n"&R1C14&RC[8])&IF(RC[10]&RC[11]&RC[12]&RC[13]&RC[14]&RC[15]&RC[16]&RC[17]&RC[18]&RC[19]&RC[20]&RC[21]&RC[22]="",,"|n"&R1C15)&IF(RC[10]="",,"|n"&R1C16&RC[10])&IF(RC[11]="",,"|n"&R1C17&RC[11])&IF(RC[12]="",,"|n"&R1C18&RC[12])&IF(RC[13]="",,"|n"&R1C19&RC[13])&IF(RC[14]="",,"|n"&R1C20&RC[14])&IF(RC[15]="",,"|n"&R1C21&RC[15])&IF(RC[16]="",,"|n"&R1C22&RC[16])&IF(RC[17]="",,"|n"&R1C23&RC[17])&IF(RC[18]="",,"|n"&R1C24&RC[18])&IF(RC[19]="",,"|n"&R1C25&RC[19])&IF(RC[20]="",,"|n"&R1C26&RC[20])&IF(RC[21]="",,"|n"&R1C27&RC[21])&IF(RC[22]="",,"|n"&R1C28&RC[22])&IF(RC[24]&RC[25]&RC[26]="",,"|n"&R1C29)&IF(RC[24]="",,"|n"&R1C30&RC[24])&IF(RC[25]="",,"|n"&R1C31&RC[25])&IF(RC[26]="",,"|n"&R1C32&RC[26])&IF(RC[28]="",,"|n"&RC[28]) -> |cFFFFFF99基础属性|r|n力量:10000|n敏捷:10000|n智力:10000|n血量:50000|n护甲:10000|n|cFFFFFF55附加属性|r(%)|n伤害增幅:50|n最终伤害:10|n|cFFFFFF11核心属性|r|n每秒属性:40|n属性叠加!拥有多个时只能召唤一个!|n激活后输入'-gh7'切换皮肤! | G53: 7 | J53: 10000 | K53: =RC[-1] -> 10000 | L53: =RC[-1] -> 10000 | M53: 50000 | N53: 10000 | T53: 50 | V53: 10 | AF53: 40 | AH53: ="属性叠加!拥有多个时只能召唤一个!|n激活后输入'-gh"&RC[-27]&"'切换皮肤!" -> 属性叠加!拥有多个时只能召唤一个!|n激活后输入'-gh7'切换皮肤!
D54: 星光闪耀 | F54: =IF(RC[3]&RC[4]&RC[5]&RC[6]&RC[7]&RC[8]="",,R1C8)&IF(RC[3]="",,"|n"&R1C9&RC[3])&IF(RC[4]="",,"|n"&R1C10&RC[4])&IF(RC[5]="",,"|n"&R1C11&RC[5])&IF(RC[6]="",,"|n"&R1C12&RC[6])&IF(RC[7]="",,"|n"&R1C13&RC[7])&IF(RC[8]="",,"|n"&R1C14&RC[8])&IF(RC[10]&RC[11]&RC[12]&RC[13]&RC[14]&RC[15]&RC[16]&RC[17]&RC[18]&RC[19]&RC[20]&RC[21]&RC[22]="",,"|n"&R1C15)&IF(RC[10]="",,"|n"&R1C16&RC[10])&IF(RC[11]="",,"|n"&R1C17&RC[11])&IF(RC[12]="",,"|n"&R1C18&RC[12])&IF(RC[13]="",,"|n"&R1C19&RC[13])&IF(RC[14]="",,"|n"&R1C20&RC[14])&IF(RC[15]="",,"|n"&R1C21&RC[15])&IF(RC[16]="",,"|n"&R1C22&RC[16])&IF(RC[17]="",,"|n"&R1C23&RC[17])&IF(RC[18]="",,"|n"&R1C24&RC[18])&IF(RC[19]="",,"|n"&R1C25&RC[19])&IF(RC[20]="",,"|n"&R1C26&RC[20])&IF(RC[21]="",,"|n"&R1C27&RC[21])&IF(RC[22]="",,"|n"&R1C28&RC[22])&IF(RC[24]&RC[25]&RC[26]="",,"|n"&R1C29)&IF(RC[24]="",,"|n"&R1C30&RC[24])&IF(RC[25]="",,"|n"&R1C31&RC[25])&IF(RC[26]="",,"|n"&R1C32&RC[26])&IF(RC[28]="",,"|n"&RC[28]) -> |cFFFFFF99基础属性|r|n攻击:50000|n力量:15000|n敏捷:15000|n智力:15000|n血量:100000|n护甲:20000|n|cFFFFFF55附加属性|r(%)|n伤害增幅:100|n最终伤害:20|n|cFFFFFF11核心属性|r|n每秒属性:80|n杀怪获得额外500金币|n属性叠加!拥有多个时只能召唤一个!|n激活后输入'-gh8'切换皮肤! | G54: 8 | I54: 50000 | J54: 15000 | K54: =RC[-1] -> 15000 | L54: =RC[-1] -> 15000 | M54: 100000 | N54: 20000 | T54: 100 | V54: 20 | AF54: 80 | AH54: ="杀怪获得额外500金币|n属性叠加!拥有多个时只能召唤一个!|n激活后输入'-gh"&RC[-27]&"'切换皮肤!" -> 杀怪获得额外500金币|n属性叠加!拥有多个时只能召唤一个!|n激活后输入'-gh8'切换皮肤!
F55: =IF(RC[3]&RC[4]&RC[5]&RC[6]&RC[7]&RC[8]="",,R1C8)&IF(RC[3]="",,"|n"&R1C9&RC[3])&IF(RC[4]="",,"|n"&R1C10&RC[4])&IF(RC[5]="",,"|n"&R1C11&RC[5])&IF(RC[6]="",,"|n"&R1C12&RC[6])&IF(RC[7]="",,"|n"&R1C13&RC[7])&IF(RC[8]="",,"|n"&R1C14&RC[8])&IF(RC[10]&RC[11]&RC[12]&RC[13]&RC[14]&RC[15]&RC[16]&RC[17]&RC[18]&RC[19]&RC[20]&RC[21]&RC[22]="",,"|n"&R1C15)&IF(RC[10]="",,"|n"&R1C16&RC[10])&IF(RC[11]="",,"|n"&R1C17&RC[11])&IF(RC[12]="",,"|n"&R1C18&RC[12])&IF(RC[13]="",,"|n"&R1C19&RC[13])&IF(RC[14]="",,"|n"&R1C20&RC[14])&IF(RC[15]="",,"|n"&R1C21&RC[15])&IF(RC[16]="",,"|n"&R1C22&RC[16])&IF(RC[17]="",,"|n"&R1C23&RC[17])&IF(RC[18]="",,"|n"&R1C24&RC[18])&IF(RC[19]="",,"|n"&R1C25&RC[19])&IF(RC[20]="",,"|n"&R1C26&RC[20])&IF(RC[21]="",,"|n"&R1C27&RC[21])&IF(RC[22]="",,"|n"&R1C28&RC[22])&IF(RC[24]&RC[25]&RC[26]="",,"|n"&R1C29)&IF(RC[24]="",,"|n"&R1C30&RC[24])&IF(RC[25]="",,"|n"&R1C31&RC[25])&IF(RC[26]="",,"|n"&R1C32&RC[26])&IF(RC[28]="",,"|n"&RC[28]) -> 
D56: 斩光之剑 | F56: =IF(RC[3]&RC[4]&RC[5]&RC[6]&RC[7]&RC[8]="",,R1C8)&IF(RC[3]="",,"|n"&R1C9&RC[3])&IF(RC[4]="",,"|n"&R1C10&RC[4])&IF(RC[5]="",,"|n"&R1C11&RC[5])&IF(RC[6]="",,"|n"&R1C12&RC[6])&IF(RC[7]="",,"|n"&R1C13&RC[7])&IF(RC[8]="",,"|n"&R1C14&RC[8])&IF(RC[10]&RC[11]&RC[12]&RC[13]&RC[14]&RC[15]&RC[16]&RC[17]&RC[18]&RC[19]&RC[20]&RC[21]&RC[22]="",,"|n"&R1C15)&IF(RC[10]="",,"|n"&R1C16&RC[10])&IF(RC[11]="",,"|n"&R1C17&RC[11])&IF(RC[12]="",,"|n"&R1C18&RC[12])&IF(RC[13]="",,"|n"&R1C19&RC[13])&IF(RC[14]="",,"|n"&R1C20&RC[14])&IF(RC[15]="",,"|n"&R1C21&RC[15])&IF(RC[16]="",,"|n"&R1C22&RC[16])&IF(RC[17]="",,"|n"&R1C23&RC[17])&IF(RC[18]="",,"|n"&R1C24&RC[18])&IF(RC[19]="",,"|n"&R1C25&RC[19])&IF(RC[20]="",,"|n"&R1C26&RC[20])&IF(RC[21]="",,"|n"&R1C27&RC[21])&IF(RC[22]="",,"|n"&R1C28&RC[22])&IF(RC[24]&RC[25]&RC[26]="",,"|n"&R1C29)&IF(RC[24]="",,"|n"&R1C30&RC[24])&IF(RC[25]="",,"|n"&R1C31&RC[25])&IF(RC[26]="",,"|n"&R1C32&RC[26])&IF(RC[28]="",,"|n"&RC[28]) -> |cFFFFFF99基础属性|r|n攻击:2000|n|cFFFFFF55附加属性|r(%)|n暴击伤害:10|n属性叠加!拥有多个时只能使用一个!|n激活后输入'-wq1'切换皮肤! | G56: 1 | I56: 2000 | S56: 10 | AH56: ="属性叠加!拥有多个时只能使用一个!|n激活后输入'-wq"&RC[-27]&"'切换皮肤!" -> 属性叠加!拥有多个时只能使用一个!|n激活后输入'-wq1'切换皮肤!
D57: 霜之哀伤 | F57: =IF(RC[3]&RC[4]&RC[5]&RC[6]&RC[7]&RC[8]="",,R1C8)&IF(RC[3]="",,"|n"&R1C9&RC[3])&IF(RC[4]="",,"|n"&R1C10&RC[4])&IF(RC[5]="",,"|n"&R1C11&RC[5])&IF(RC[6]="",,"|n"&R1C12&RC[6])&IF(RC[7]="",,"|n"&R1C13&RC[7])&IF(RC[8]="",,"|n"&R1C14&RC[8])&IF(RC[10]&RC[11]&RC[12]&RC[13]&RC[14]&RC[15]&RC[16]&RC[17]&RC[18]&RC[19]&RC[20]&RC[21]&RC[22]="",,"|n"&R1C15)&IF(RC[10]="",,"|n"&R1C16&RC[10])&IF(RC[11]="",,"|n"&R1C17&RC[11])&IF(RC[12]="",,"|n"&R1C18&RC[12])&IF(RC[13]="",,"|n"&R1C19&RC[13])&IF(RC[14]="",,"|n"&R1C20&RC[14])&IF(RC[15]="",,"|n"&R1C21&RC[15])&IF(RC[16]="",,"|n"&R1C22&RC[16])&IF(RC[17]="",,"|n"&R1C23&RC[17])&IF(RC[18]="",,"|n"&R1C24&RC[18])&IF(RC[19]="",,"|n"&R1C25&RC[19])&IF(RC[20]="",,"|n"&R1C26&RC[20])&IF(RC[21]="",,"|n"&R1C27&RC[21])&IF(RC[22]="",,"|n"&R1C28&RC[22])&IF(RC[24]&RC[25]&RC[26]="",,"|n"&R1C29)&IF(RC[24]="",,"|n"&R1C30&RC[24])&IF(RC[25]="",,"|n"&R1C31&RC[25])&IF(RC[26]="",,"|n"&R1C32&RC[26])&IF(RC[28]="",,"|n"&RC[28]) -> |cFFFFFF99基础属性|r|n攻击:4000|n|cFFFFFF55附加属性|r(%)|n暴击伤害:15|n属性叠加!拥有多个时只能使用一个!|n激活后输入'-wq2'切换皮肤! | G57: 2 | I57: 4000 | S57: 15 | AH57: ="属性叠加!拥有多个时只能使用一个!|n激活后输入'-wq"&RC[-27]&"'切换皮肤!" -> 属性叠加!拥有多个时只能使用一个!|n激活后输入'-wq2'切换皮肤!
D58: 囚火之剑 | F58: =IF(RC[3]&RC[4]&RC[5]&RC[6]&RC[7]&RC[8]="",,R1C8)&IF(RC[3]="",,"|n"&R1C9&RC[3])&IF(RC[4]="",,"|n"&R1C10&RC[4])&IF(RC[5]="",,"|n"&R1C11&RC[5])&IF(RC[6]="",,"|n"&R1C12&RC[6])&IF(RC[7]="",,"|n"&R1C13&RC[7])&IF(RC[8]="",,"|n"&R1C14&RC[8])&IF(RC[10]&RC[11]&RC[12]&RC[13]&RC[14]&RC[15]&RC[16]&RC[17]&RC[18]&RC[19]&RC[20]&RC[21]&RC[22]="",,"|n"&R1C15)&IF(RC[10]="",,"|n"&R1C16&RC[10])&IF(RC[11]="",,"|n"&R1C17&RC[11])&IF(RC[12]="",,"|n"&R1C18&RC[12])&IF(RC[13]="",,"|n"&R1C19&RC[13])&IF(RC[14]="",,"|n"&R1C20&RC[14])&IF(RC[15]="",,"|n"&R1C21&RC[15])&IF(RC[16]="",,"|n"&R1C22&RC[16])&IF(RC[17]="",,"|n"&R1C23&RC[17])&IF(RC[18]="",,"|n"&R1C24&RC[18])&IF(RC[19]="",,"|n"&R1C25&RC[19])&IF(RC[20]="",,"|n"&R1C26&RC[20])&IF(RC[21]="",,"|n"&R1C27&RC[21])&IF(RC[22]="",,"|n"&R1C28&RC[22])&IF(RC[24]&RC[25]&RC[26]="",,"|n"&R1C29)&IF(RC[24]="",,"|n"&R1C30&RC[24])&IF(RC[25]="",,"|n"&R1C31&RC[25])&IF(RC[26]="",,"|n"&R1C32&RC[26])&IF(RC[28]="",,"|n"&RC[28]) -> |cFFFFFF99基础属性|r|n攻击:6000|n|cFFFFFF55附加属性|r(%)|n暴击伤害:20|n属性叠加!拥有多个时只能使用一个!|n激活后输入'-wq3'切换皮肤! | G58: 3 | I58: 6000 | S58: 20 | AH58: ="属性叠加!拥有多个时只能使用一个!|n激活后输入'-wq"&RC[-27]&"'切换皮肤!" -> 属性叠加!拥有多个时只能使用一个!|n激活后输入'-wq3'切换皮肤!
D59: 魔王邪剑 | F59: =IF(RC[3]&RC[4]&RC[5]&RC[6]&RC[7]&RC[8]="",,R1C8)&IF(RC[3]="",,"|n"&R1C9&RC[3])&IF(RC[4]="",,"|n"&R1C10&RC[4])&IF(RC[5]="",,"|n"&R1C11&RC[5])&IF(RC[6]="",,"|n"&R1C12&RC[6])&IF(RC[7]="",,"|n"&R1C13&RC[7])&IF(RC[8]="",,"|n"&R1C14&RC[8])&IF(RC[10]&RC[11]&RC[12]&RC[13]&RC[14]&RC[15]&RC[16]&RC[17]&RC[18]&RC[19]&RC[20]&RC[21]&RC[22]="",,"|n"&R1C15)&IF(RC[10]="",,"|n"&R1C16&RC[10])&IF(RC[11]="",,"|n"&R1C17&RC[11])&IF(RC[12]="",,"|n"&R1C18&RC[12])&IF(RC[13]="",,"|n"&R1C19&RC[13])&IF(RC[14]="",,"|n"&R1C20&RC[14])&IF(RC[15]="",,"|n"&R1C21&RC[15])&IF(RC[16]="",,"|n"&R1C22&RC[16])&IF(RC[17]="",,"|n"&R1C23&RC[17])&IF(RC[18]="",,"|n"&R1C24&RC[18])&IF(RC[19]="",,"|n"&R1C25&RC[19])&IF(RC[20]="",,"|n"&R1C26&RC[20])&IF(RC[21]="",,"|n"&R1C27&RC[21])&IF(RC[22]="",,"|n"&R1C28&RC[22])&IF(RC[24]&RC[25]&RC[26]="",,"|n"&R1C29)&IF(RC[24]="",,"|n"&R1C30&RC[24])&IF(RC[25]="",,"|n"&R1C31&RC[25])&IF(RC[26]="",,"|n"&R1C32&RC[26])&IF(RC[28]="",,"|n"&RC[28]) -> |cFFFFFF99基础属性|r|n攻击:8000|n|cFFFFFF55附加属性|r(%)|n暴击伤害:25|n属性叠加!拥有多个时只能使用一个!|n激活后输入'-wq4'切换皮肤! | G59: 4 | I59: 8000 | S59: 25 | AH59: ="属性叠加!拥有多个时只能使用一个!|n激活后输入'-wq"&RC[-27]&"'切换皮肤!" -> 属性叠加!拥有多个时只能使用一个!|n激活后输入'-wq4'切换皮肤!
D60: 屠龙宝刀 | F60: =IF(RC[3]&RC[4]&RC[5]&RC[6]&RC[7]&RC[8]="",,R1C8)&IF(RC[3]="",,"|n"&R1C9&RC[3])&IF(RC[4]="",,"|n"&R1C10&RC[4])&IF(RC[5]="",,"|n"&R1C11&RC[5])&IF(RC[6]="",,"|n"&R1C12&RC[6])&IF(RC[7]="",,"|n"&R1C13&RC[7])&IF(RC[8]="",,"|n"&R1C14&RC[8])&IF(RC[10]&RC[11]&RC[12]&RC[13]&RC[14]&RC[15]&RC[16]&RC[17]&RC[18]&RC[19]&RC[20]&RC[21]&RC[22]="",,"|n"&R1C15)&IF(RC[10]="",,"|n"&R1C16&RC[10])&IF(RC[11]="",,"|n"&R1C17&RC[11])&IF(RC[12]="",,"|n"&R1C18&RC[12])&IF(RC[13]="",,"|n"&R1C19&RC[13])&IF(RC[14]="",,"|n"&R1C20&RC[14])&IF(RC[15]="",,"|n"&R1C21&RC[15])&IF(RC[16]="",,"|n"&R1C22&RC[16])&IF(RC[17]="",,"|n"&R1C23&RC[17])&IF(RC[18]="",,"|n"&R1C24&RC[18])&IF(RC[19]="",,"|n"&R1C25&RC[19])&IF(RC[20]="",,"|n"&R1C26&RC[20])&IF(RC[21]="",,"|n"&R1C27&RC[21])&IF(RC[22]="",,"|n"&R1C28&RC[22])&IF(RC[24]&RC[25]&RC[26]="",,"|n"&R1C29)&IF(RC[24]="",,"|n"&R1C30&RC[24])&IF(RC[25]="",,"|n"&R1C31&RC[25])&IF(RC[26]="",,"|n"&R1C32&RC[26])&IF(RC[28]="",,"|n"&RC[28]) -> |cFFFFFF99基础属性|r|n攻击:10000|n|cFFFFFF55附加属性|r(%)|n暴击伤害:30|n属性叠加!拥有多个时只能使用一个!|n激活后输入'-wq5'切换皮肤! | G60: 5 | I60: 10000 | S60: 30 | AH60: ="属性叠加!拥有多个时只能使用一个!|n激活后输入'-wq"&RC[-27]&"'切换皮肤!" -> 属性叠加!拥有多个时只能使用一个!|n激活后输入'-wq5'切换皮肤!
D61: 黄金圣剑 | F61: =IF(RC[3]&RC[4]&RC[5]&RC[6]&RC[7]&RC[8]="",,R1C8)&IF(RC[3]="",,"|n"&R1C9&RC[3])&IF(RC[4]="",,"|n"&R1C10&RC[4])&IF(RC[5]="",,"|n"&R1C11&RC[5])&IF(RC[6]="",,"|n"&R1C12&RC[6])&IF(RC[7]="",,"|n"&R1C13&RC[7])&IF(RC[8]="",,"|n"&R1C14&RC[8])&IF(RC[10]&RC[11]&RC[12]&RC[13]&RC[14]&RC[15]&RC[16]&RC[17]&RC[18]&RC[19]&RC[20]&RC[21]&RC[22]="",,"|n"&R1C15)&IF(RC[10]="",,"|n"&R1C16&RC[10])&IF(RC[11]="",,"|n"&R1C17&RC[11])&IF(RC[12]="",,"|n"&R1C18&RC[12])&IF(RC[13]="",,"|n"&R1C19&RC[13])&IF(RC[14]="",,"|n"&R1C20&RC[14])&IF(RC[15]="",,"|n"&R1C21&RC[15])&IF(RC[16]="",,"|n"&R1C22&RC[16])&IF(RC[17]="",,"|n"&R1C23&RC[17])&IF(RC[18]="",,"|n"&R1C24&RC[18])&IF(RC[19]="",,"|n"&R1C25&RC[19])&IF(RC[20]="",,"|n"&R1C26&RC[20])&IF(RC[21]="",,"|n"&R1C27&RC[21])&IF(RC[22]="",,"|n"&R1C28&RC[22])&IF(RC[24]&RC[25]&RC[26]="",,"|n"&R1C29)&IF(RC[24]="",,"|n"&R1C30&RC[24])&IF(RC[25]="",,"|n"&R1C31&RC[25])&IF(RC[26]="",,"|n"&R1C32&RC[26])&IF(RC[28]="",,"|n"&RC[28]) -> |cFFFFFF99基础属性|r|n攻击:20000|n|cFFFFFF55附加属性|r(%)|n攻速:30|n攻击吸血:2|n暴击伤害:50|n最终伤害:3|n|cFFFFFF11核心属性|r|n杀敌属性:10|n属性叠加!拥有多个时只能使用一个!|n激活后输入'-wq6'切换皮肤! | G61: 6 | I61: 20000 | P61: 30 | Q61: 2 | S61: 50 | V61: 3 | AE61: 10 | AH61: ="属性叠加!拥有多个时只能使用一个!|n激活后输入'-wq"&RC[-27]&"'切换皮肤!" -> 属性叠加!拥有多个时只能使用一个!|n激活后输入'-wq6'切换皮肤!
D62: 玄冰神剑 | F62: =IF(RC[3]&RC[4]&RC[5]&RC[6]&RC[7]&RC[8]="",,R1C8)&IF(RC[3]="",,"|n"&R1C9&RC[3])&IF(RC[4]="",,"|n"&R1C10&RC[4])&IF(RC[5]="",,"|n"&R1C11&RC[5])&IF(RC[6]="",,"|n"&R1C12&RC[6])&IF(RC[7]="",,"|n"&R1C13&RC[7])&IF(RC[8]="",,"|n"&R1C14&RC[8])&IF(RC[10]&RC[11]&RC[12]&RC[13]&RC[14]&RC[15]&RC[16]&RC[17]&RC[18]&RC[19]&RC[20]&RC[21]&RC[22]="",,"|n"&R1C15)&IF(RC[10]="",,"|n"&R1C16&RC[10])&IF(RC[11]="",,"|n"&R1C17&RC[11])&IF(RC[12]="",,"|n"&R1C18&RC[12])&IF(RC[13]="",,"|n"&R1C19&RC[13])&IF(RC[14]="",,"|n"&R1C20&RC[14])&IF(RC[15]="",,"|n"&R1C21&RC[15])&IF(RC[16]="",,"|n"&R1C22&RC[16])&IF(RC[17]="",,"|n"&R1C23&RC[17])&IF(RC[18]="",,"|n"&R1C24&RC[18])&IF(RC[19]="",,"|n"&R1C25&RC[19])&IF(RC[20]="",,"|n"&R1C26&RC[20])&IF(RC[21]="",,"|n"&R1C27&RC[21])&IF(RC[22]="",,"|n"&R1C28&RC[22])&IF(RC[24]&RC[25]&RC[26]="",,"|n"&R1C29)&IF(RC[24]="",,"|n"&R1C30&RC[24])&IF(RC[25]="",,"|n"&R1C31&RC[25])&IF(RC[26]="",,"|n"&R1C32&RC[26])&IF(RC[28]="",,"|n"&RC[28]) -> |cFFFFFF99基础属性|r|n攻击:30000|n|cFFFFFF55附加属性|r(%)|n攻速:40|n攻击吸血:4|n暴击伤害:80|n最终伤害:6|n|cFFFFFF11核心属性|r|n杀敌属性:20|n属性叠加!拥有多个时只能使用一个!|n激活后输入'-wq7'切换皮肤! | G62: 7 | I62: 30000 | P62: 40 | Q62: 4 | S62: 80 | V62: 6 | AE62: 20 | AH62: ="属性叠加!拥有多个时只能使用一个!|n激活后输入'-wq"&RC[-27]&"'切换皮肤!" -> 属性叠加!拥有多个时只能使用一个!|n激活后输入'-wq7'切换皮肤!
D63: 邪神魔剑 | F63: =IF(RC[3]&RC[4]&RC[5]&RC[6]&RC[7]&RC[8]="",,R1C8)&IF(RC[3]="",,"|n"&R1C9&RC[3])&IF(RC[4]="",,"|n"&R1C10&RC[4])&IF(RC[5]="",,"|n"&R1C11&RC[5])&IF(RC[6]="",,"|n"&R1C12&RC[6])&IF(RC[7]="",,"|n"&R1C13&RC[7])&IF(RC[8]="",,"|n"&R1C14&RC[8])&IF(RC[10]&RC[11]&RC[12]&RC[13]&RC[14]&RC[15]&RC[16]&RC[17]&RC[18]&RC[19]&RC[20]&RC[21]&RC[22]="",,"|n"&R1C15)&IF(RC[10]="",,"|n"&R1C16&RC[10])&IF(RC[11]="",,"|n"&R1C17&RC[11])&IF(RC[12]="",,"|n"&R1C18&RC[12])&IF(RC[13]="",,"|n"&R1C19&RC[13])&IF(RC[14]="",,"|n"&R1C20&RC[14])&IF(RC[15]="",,"|n"&R1C21&RC[15])&IF(RC[16]="",,"|n"&R1C22&RC[16])&IF(RC[17]="",,"|n"&R1C23&RC[17])&IF(RC[18]="",,"|n"&R1C24&RC[18])&IF(RC[19]="",,"|n"&R1C25&RC[19])&IF(RC[20]="",,"|n"&R1C26&RC[20])&IF(RC[21]="",,"|n"&R1C27&RC[21])&IF(RC[22]="",,"|n"&R1C28&RC[22])&IF(RC[24]&RC[25]&RC[26]="",,"|n"&R1C29)&IF(RC[24]="",,"|n"&R1C30&RC[24])&IF(RC[25]="",,"|n"&R1C31&RC[25])&IF(RC[26]="",,"|n"&R1C32&RC[26])&IF(RC[28]="",,"|n"&RC[28]) -> |cFFFFFF99基础属性|r|n攻击:50000|n|cFFFFFF55附加属性|r(%)|n攻速:50|n攻击吸血:6|n暴击伤害:100|n伤害增幅:30|n最终伤害:10|n|cFFFFFF11核心属性|r|n杀敌属性:30|n获得20%额外杀敌积分|n属性叠加!拥有多个时只能使用一个!|n激活后输入'-wq8'切换皮肤! | G63: 8 | I63: 50000 | P63: 50 | Q63: 6 | S63: 100 | T63: 30 | V63: 10 | AE63: 30 | AH63: ="获得20%额外杀敌积分|n属性叠加!拥有多个时只能使用一个!|n激活后输入'-wq"&RC[-27]&"'切换皮肤!" -> 获得20%额外杀敌积分|n属性叠加!拥有多个时只能使用一个!|n激活后输入'-wq8'切换皮肤!
F64: =IF(RC[3]&RC[4]&RC[5]&RC[6]&RC[7]&RC[8]="",,R1C8)&IF(RC[3]="",,"|n"&R1C9&RC[3])&IF(RC[4]="",,"|n"&R1C10&RC[4])&IF(RC[5]="",,"|n"&R1C11&RC[5])&IF(RC[6]="",,"|n"&R1C12&RC[6])&IF(RC[7]="",,"|n"&R1C13&RC[7])&IF(RC[8]="",,"|n"&R1C14&RC[8])&IF(RC[10]&RC[11]&RC[12]&RC[13]&RC[14]&RC[15]&RC[16]&RC[17]&RC[18]&RC[19]&RC[20]&RC[21]&RC[22]="",,"|n"&R1C15)&IF(RC[10]="",,"|n"&R1C16&RC[10])&IF(RC[11]="",,"|n"&R1C17&RC[11])&IF(RC[12]="",,"|n"&R1C18&RC[12])&IF(RC[13]="",,"|n"&R1C19&RC[13])&IF(RC[14]="",,"|n"&R1C20&RC[14])&IF(RC[15]="",,"|n"&R1C21&RC[15])&IF(RC[16]="",,"|n"&R1C22&RC[16])&IF(RC[17]="",,"|n"&R1C23&RC[17])&IF(RC[18]="",,"|n"&R1C24&RC[18])&IF(RC[19]="",,"|n"&R1C25&RC[19])&IF(RC[20]="",,"|n"&R1C26&RC[20])&IF(RC[21]="",,"|n"&R1C27&RC[21])&IF(RC[22]="",,"|n"&R1C28&RC[22])&IF(RC[24]&RC[25]&RC[26]="",,"|n"&R1C29)&IF(RC[24]="",,"|n"&R1C30&RC[24])&IF(RC[25]="",,"|n"&R1C31&RC[25])&IF(RC[26]="",,"|n"&R1C32&RC[26])&IF(RC[28]="",,"|n"&RC[28]) -> 
D65: 冰火翅膀 | F65: =IF(RC[3]&RC[4]&RC[5]&RC[6]&RC[7]&RC[8]="",,R1C8)&IF(RC[3]="",,"|n"&R1C9&RC[3])&IF(RC[4]="",,"|n"&R1C10&RC[4])&IF(RC[5]="",,"|n"&R1C11&RC[5])&IF(RC[6]="",,"|n"&R1C12&RC[6])&IF(RC[7]="",,"|n"&R1C13&RC[7])&IF(RC[8]="",,"|n"&R1C14&RC[8])&IF(RC[10]&RC[11]&RC[12]&RC[13]&RC[14]&RC[15]&RC[16]&RC[17]&RC[18]&RC[19]&RC[20]&RC[21]&RC[22]="",,"|n"&R1C15)&IF(RC[10]="",,"|n"&R1C16&RC[10])&IF(RC[11]="",,"|n"&R1C17&RC[11])&IF(RC[12]="",,"|n"&R1C18&RC[12])&IF(RC[13]="",,"|n"&R1C19&RC[13])&IF(RC[14]="",,"|n"&R1C20&RC[14])&IF(RC[15]="",,"|n"&R1C21&RC[15])&IF(RC[16]="",,"|n"&R1C22&RC[16])&IF(RC[17]="",,"|n"&R1C23&RC[17])&IF(RC[18]="",,"|n"&R1C24&RC[18])&IF(RC[19]="",,"|n"&R1C25&RC[19])&IF(RC[20]="",,"|n"&R1C26&RC[20])&IF(RC[21]="",,"|n"&R1C27&RC[21])&IF(RC[22]="",,"|n"&R1C28&RC[22])&IF(RC[24]&RC[25]&RC[26]="",,"|n"&R1C29)&IF(RC[24]="",,"|n"&R1C30&RC[24])&IF(RC[25]="",,"|n"&R1C31&RC[25])&IF(RC[26]="",,"|n"&R1C32&RC[26])&IF(RC[28]="",,"|n"&RC[28]) -> |cFFFFFF99基础属性|r|n力量:2000|n敏捷:2000|n智力:2000|n|cFFFFFF55附加属性|r(%)|n附加伤害:5|n属性叠加!拥有多个时只能使用一个!|n激活后输入'-cb1'切换翅膀! | G65: 1 | J65: 2000 | K65: =RC[-1] -> 2000 | L65: =RC[-1] -> 2000 | U65: 5 | AH65: ="属性叠加!拥有多个时只能使用一个!|n激活后输入'-cb"&RC[-27]&"'切换翅膀!" -> 属性叠加!拥有多个时只能使用一个!|n激活后输入'-cb1'切换翅膀!
D66: 妖灵翅膀 | F66: =IF(RC[3]&RC[4]&RC[5]&RC[6]&RC[7]&RC[8]="",,R1C8)&IF(RC[3]="",,"|n"&R1C9&RC[3])&IF(RC[4]="",,"|n"&R1C10&RC[4])&IF(RC[5]="",,"|n"&R1C11&RC[5])&IF(RC[6]="",,"|n"&R1C12&RC[6])&IF(RC[7]="",,"|n"&R1C13&RC[7])&IF(RC[8]="",,"|n"&R1C14&RC[8])&IF(RC[10]&RC[11]&RC[12]&RC[13]&RC[14]&RC[15]&RC[16]&RC[17]&RC[18]&RC[19]&RC[20]&RC[21]&RC[22]="",,"|n"&R1C15)&IF(RC[10]="",,"|n"&R1C16&RC[10])&IF(RC[11]="",,"|n"&R1C17&RC[11])&IF(RC[12]="",,"|n"&R1C18&RC[12])&IF(RC[13]="",,"|n"&R1C19&RC[13])&IF(RC[14]="",,"|n"&R1C20&RC[14])&IF(RC[15]="",,"|n"&R1C21&RC[15])&IF(RC[16]="",,"|n"&R1C22&RC[16])&IF(RC[17]="",,"|n"&R1C23&RC[17])&IF(RC[18]="",,"|n"&R1C24&RC[18])&IF(RC[19]="",,"|n"&R1C25&RC[19])&IF(RC[20]="",,"|n"&R1C26&RC[20])&IF(RC[21]="",,"|n"&R1C27&RC[21])&IF(RC[22]="",,"|n"&R1C28&RC[22])&IF(RC[24]&RC[25]&RC[26]="",,"|n"&R1C29)&IF(RC[24]="",,"|n"&R1C30&RC[24])&IF(RC[25]="",,"|n"&R1C31&RC[25])&IF(RC[26]="",,"|n"&R1C32&RC[26])&IF(RC[28]="",,"|n"&RC[28]) -> |cFFFFFF99基础属性|r|n力量:4000|n敏捷:4000|n智力:4000|n|cFFFFFF55附加属性|r(%)|n附加伤害:10|n属性叠加!拥有多个时只能使用一个!|n激活后输入'-cb2'切换翅膀! | G66: 2 | J66: 4000 | K66: =RC[-1] -> 4000 | L66: =RC[-1] -> 4000 | U66: 10 | AH66: ="属性叠加!拥有多个时只能使用一个!|n激活后输入'-cb"&RC[-27]&"'切换翅膀!" -> 属性叠加!拥有多个时只能使用一个!|n激活后输入'-cb2'切换翅膀!
D67: 仙灵翅膀 | F67: =IF(RC[3]&RC[4]&RC[5]&RC[6]&RC[7]&RC[8]="",,R1C8)&IF(RC[3]="",,"|n"&R1C9&RC[3])&IF(RC[4]="",,"|n"&R1C10&RC[4])&IF(RC[5]="",,"|n"&R1C11&RC[5])&IF(RC[6]="",,"|n"&R1C12&RC[6])&IF(RC[7]="",,"|n"&R1C13&RC[7])&IF(RC[8]="",,"|n"&R1C14&RC[8])&IF(RC[10]&RC[11]&RC[12]&RC[13]&RC[14]&RC[15]&RC[16]&RC[17]&RC[18]&RC[19]&RC[20]&RC[21]&RC[22]="",,"|n"&R1C15)&IF(RC[10]="",,"|n"&R1C16&RC[10])&IF(RC[11]="",,"|n"&R1C17&RC[11])&IF(RC[12]="",,"|n"&R1C18&RC[12])&IF(RC[13]="",,"|n"&R1C19&RC[13])&IF(RC[14]="",,"|n"&R1C20&RC[14])&IF(RC[15]="",,"|n"&R1C21&RC[15])&IF(RC[16]="",,"|n"&R1C22&RC[16])&IF(RC[17]="",,"|n"&R1C23&RC[17])&IF(RC[18]="",,"|n"&R1C24&RC[18])&IF(RC[19]="",,"|n"&R1C25&RC[19])&IF(RC[20]="",,"|n"&R1C26&RC[20])&IF(RC[21]="",,"|n"&R1C27&RC[21])&IF(RC[22]="",,"|n"&R1C28&RC[22])&IF(RC[24]&RC[25]&RC[26]="",,"|n"&R1C29)&IF(RC[24]="",,"|n"&R1C30&RC[24])&IF(RC[25]="",,"|n"&R1C31&RC[25])&IF(RC[26]="",,"|n"&R1C32&RC[26])&IF(RC[28]="",,"|n"&RC[28]) -> |cFFFFFF99基础属性|r|n力量:6000|n敏捷:6000|n智力:6000|n|cFFFFFF55附加属性|r(%)|n附加伤害:15|n属性叠加!拥有多个时只能使用一个!|n激活后输入'-cb3'切换翅膀! | G67: 3 | J67: 6000 | K67: =RC[-1] -> 6000 | L67: =RC[-1] -> 6000 | U67: 15 | AH67: ="属性叠加!拥有多个时只能使用一个!|n激活后输入'-cb"&RC[-27]&"'切换翅膀!" -> 属性叠加!拥有多个时只能使用一个!|n激活后输入'-cb3'切换翅膀!
D68: 黄金翅膀 | F68: =IF(RC[3]&RC[4]&RC[5]&RC[6]&RC[7]&RC[8]="",,R1C8)&IF(RC[3]="",,"|n"&R1C9&RC[3])&IF(RC[4]="",,"|n"&R1C10&RC[4])&IF(RC[5]="",,"|n"&R1C11&RC[5])&IF(RC[6]="",,"|n"&R1C12&RC[6])&IF(RC[7]="",,"|n"&R1C13&RC[7])&IF(RC[8]="",,"|n"&R1C14&RC[8])&IF(RC[10]&RC[11]&RC[12]&RC[13]&RC[14]&RC[15]&RC[16]&RC[17]&RC[18]&RC[19]&RC[20]&RC[21]&RC[22]="",,"|n"&R1C15)&IF(RC[10]="",,"|n"&R1C16&RC[10])&IF(RC[11]="",,"|n"&R1C17&RC[11])&IF(RC[12]="",,"|n"&R1C18&RC[12])&IF(RC[13]="",,"|n"&R1C19&RC[13])&IF(RC[14]="",,"|n"&R1C20&RC[14])&IF(RC[15]="",,"|n"&R1C21&RC[15])&IF(RC[16]="",,"|n"&R1C22&RC[16])&IF(RC[17]="",,"|n"&R1C23&RC[17])&IF(RC[18]="",,"|n"&R1C24&RC[18])&IF(RC[19]="",,"|n"&R1C25&RC[19])&IF(RC[20]="",,"|n"&R1C26&RC[20])&IF(RC[21]="",,"|n"&R1C27&RC[21])&IF(RC[22]="",,"|n"&R1C28&RC[22])&IF(RC[24]&RC[25]&RC[26]="",,"|n"&R1C29)&IF(RC[24]="",,"|n"&R1C30&RC[24])&IF(RC[25]="",,"|n"&R1C31&RC[25])&IF(RC[26]="",,"|n"&R1C32&RC[26])&IF(RC[28]="",,"|n"&RC[28]) -> |cFFFFFF99基础属性|r|n力量:10000|n敏捷:10000|n智力:10000|n|cFFFFFF55附加属性|r(%)|n暴击概率:5|n附加伤害:50|n最终伤害:3|n伤害减免:5|n|cFFFFFF11核心属性|r|n升级属性:800|n属性叠加!拥有多个时只能使用一个!|n激活后输入'-cb4'切换翅膀! | G68: 4 | J68: 10000 | K68: 10000 | L68: 10000 | R68: 5 | U68: 50 | V68: 3 | X68: 5 | AD68: 800 | AH68: ="属性叠加!拥有多个时只能使用一个!|n激活后输入'-cb"&RC[-27]&"'切换翅膀!" -> 属性叠加!拥有多个时只能使用一个!|n激活后输入'-cb4'切换翅膀!
D69: 真神翅膀 | F69: =IF(RC[3]&RC[4]&RC[5]&RC[6]&RC[7]&RC[8]="",,R1C8)&IF(RC[3]="",,"|n"&R1C9&RC[3])&IF(RC[4]="",,"|n"&R1C10&RC[4])&IF(RC[5]="",,"|n"&R1C11&RC[5])&IF(RC[6]="",,"|n"&R1C12&RC[6])&IF(RC[7]="",,"|n"&R1C13&RC[7])&IF(RC[8]="",,"|n"&R1C14&RC[8])&IF(RC[10]&RC[11]&RC[12]&RC[13]&RC[14]&RC[15]&RC[16]&RC[17]&RC[18]&RC[19]&RC[20]&RC[21]&RC[22]="",,"|n"&R1C15)&IF(RC[10]="",,"|n"&R1C16&RC[10])&IF(RC[11]="",,"|n"&R1C17&RC[11])&IF(RC[12]="",,"|n"&R1C18&RC[12])&IF(RC[13]="",,"|n"&R1C19&RC[13])&IF(RC[14]="",,"|n"&R1C20&RC[14])&IF(RC[15]="",,"|n"&R1C21&RC[15])&IF(RC[16]="",,"|n"&R1C22&RC[16])&IF(RC[17]="",,"|n"&R1C23&RC[17])&IF(RC[18]="",,"|n"&R1C24&RC[18])&IF(RC[19]="",,"|n"&R1C25&RC[19])&IF(RC[20]="",,"|n"&R1C26&RC[20])&IF(RC[21]="",,"|n"&R1C27&RC[21])&IF(RC[22]="",,"|n"&R1C28&RC[22])&IF(RC[24]&RC[25]&RC[26]="",,"|n"&R1C29)&IF(RC[24]="",,"|n"&R1C30&RC[24])&IF(RC[25]="",,"|n"&R1C31&RC[25])&IF(RC[26]="",,"|n"&R1C32&RC[26])&IF(RC[28]="",,"|n"&RC[28]) -> |cFFFFFF99基础属性|r|n力量:15000|n敏捷:10000|n智力:10000|n|cFFFFFF55附加属性|r(%)|n暴击概率:10|n附加伤害:80|n最终伤害:6|n伤害减免:10|n|cFFFFFF11核心属性|r|n升级属性:1600|n属性叠加!拥有多个时只能使用一个!|n激活后输入'-cb5'切换翅膀! | G69: 5 | J69: 15000 | K69: 10000 | L69: =RC[-1] -> 10000 | R69: 10 | U69: 80 | V69: 6 | X69: 10 | AD69: 1600 | AH69: ="属性叠加!拥有多个时只能使用一个!|n激活后输入'-cb"&RC[-27]&"'切换翅膀!" -> 属性叠加!拥有多个时只能使用一个!|n激活后输入'-cb5'切换翅膀!
D70: 圣羽翅膀 | F70: =IF(RC[3]&RC[4]&RC[5]&RC[6]&RC[7]&RC[8]="",,R1C8)&IF(RC[3]="",,"|n"&R1C9&RC[3])&IF(RC[4]="",,"|n"&R1C10&RC[4])&IF(RC[5]="",,"|n"&R1C11&RC[5])&IF(RC[6]="",,"|n"&R1C12&RC[6])&IF(RC[7]="",,"|n"&R1C13&RC[7])&IF(RC[8]="",,"|n"&R1C14&RC[8])&IF(RC[10]&RC[11]&RC[12]&RC[13]&RC[14]&RC[15]&RC[16]&RC[17]&RC[18]&RC[19]&RC[20]&RC[21]&RC[22]="",,"|n"&R1C15)&IF(RC[10]="",,"|n"&R1C16&RC[10])&IF(RC[11]="",,"|n"&R1C17&RC[11])&IF(RC[12]="",,"|n"&R1C18&RC[12])&IF(RC[13]="",,"|n"&R1C19&RC[13])&IF(RC[14]="",,"|n"&R1C20&RC[14])&IF(RC[15]="",,"|n"&R1C21&RC[15])&IF(RC[16]="",,"|n"&R1C22&RC[16])&IF(RC[17]="",,"|n"&R1C23&RC[17])&IF(RC[18]="",,"|n"&R1C24&RC[18])&IF(RC[19]="",,"|n"&R1C25&RC[19])&IF(RC[20]="",,"|n"&R1C26&RC[20])&IF(RC[21]="",,"|n"&R1C27&RC[21])&IF(RC[22]="",,"|n"&R1C28&RC[22])&IF(RC[24]&RC[25]&RC[26]="",,"|n"&R1C29)&IF(RC[24]="",,"|n"&R1C30&RC[24])&IF(RC[25]="",,"|n"&R1C31&RC[25])&IF(RC[26]="",,"|n"&R1C32&RC[26])&IF(RC[28]="",,"|n"&RC[28]) -> |cFFFFFF99基础属性|r|n力量:20000|n敏捷:20000|n智力:20000|n|cFFFFFF55附加属性|r(%)|n暴击概率:15|n附加伤害:100|n最终伤害:10|n伤害减免:15|n|cFFFFFF11核心属性|r|n升级属性:3200|n冲锋CD降低为0|n属性叠加!拥有多个时只能使用一个!|n激活后输入'-cb6'切换翅膀! | G70: 6 | J70: 20000 | K70: =RC[-1] -> 20000 | L70: =RC[-1] -> 20000 | R70: 15 | U70: 100 | V70: 10 | X70: 15 | AD70: 3200 | AH70: ="冲锋CD降低为0|n属性叠加!拥有多个时只能使用一个!|n激活后输入'-cb"&RC[-27]&"'切换翅膀!" -> 冲锋CD降低为0|n属性叠加!拥有多个时只能使用一个!|n激活后输入'-cb6'切换翅膀!
F71: =IF(RC[3]&RC[4]&RC[5]&RC[6]&RC[7]&RC[8]="",,R1C8)&IF(RC[3]="",,"|n"&R1C9&RC[3])&IF(RC[4]="",,"|n"&R1C10&RC[4])&IF(RC[5]="",,"|n"&R1C11&RC[5])&IF(RC[6]="",,"|n"&R1C12&RC[6])&IF(RC[7]="",,"|n"&R1C13&RC[7])&IF(RC[8]="",,"|n"&R1C14&RC[8])&IF(RC[10]&RC[11]&RC[12]&RC[13]&RC[14]&RC[15]&RC[16]&RC[17]&RC[18]&RC[19]&RC[20]&RC[21]&RC[22]="",,"|n"&R1C15)&IF(RC[10]="",,"|n"&R1C16&RC[10])&IF(RC[11]="",,"|n"&R1C17&RC[11])&IF(RC[12]="",,"|n"&R1C18&RC[12])&IF(RC[13]="",,"|n"&R1C19&RC[13])&IF(RC[14]="",,"|n"&R1C20&RC[14])&IF(RC[15]="",,"|n"&R1C21&RC[15])&IF(RC[16]="",,"|n"&R1C22&RC[16])&IF(RC[17]="",,"|n"&R1C23&RC[17])&IF(RC[18]="",,"|n"&R1C24&RC[18])&IF(RC[19]="",,"|n"&R1C25&RC[19])&IF(RC[20]="",,"|n"&R1C26&RC[20])&IF(RC[21]="",,"|n"&R1C27&RC[21])&IF(RC[22]="",,"|n"&R1C28&RC[22])&IF(RC[24]&RC[25]&RC[26]="",,"|n"&R1C29)&IF(RC[24]="",,"|n"&R1C30&RC[24])&IF(RC[25]="",,"|n"&R1C31&RC[25])&IF(RC[26]="",,"|n"&R1C32&RC[26])&IF(RC[28]="",,"|n"&RC[28]) -> 
D72: 黑铁 | F72: =IF(RC[3]&RC[4]&RC[5]&RC[6]&RC[7]&RC[8]="",,R1C8)&IF(RC[3]="",,"|n"&R1C9&RC[3])&IF(RC[4]="",,"|n"&R1C10&RC[4])&IF(RC[5]="",,"|n"&R1C11&RC[5])&IF(RC[6]="",,"|n"&R1C12&RC[6])&IF(RC[7]="",,"|n"&R1C13&RC[7])&IF(RC[8]="",,"|n"&R1C14&RC[8])&IF(RC[10]&RC[11]&RC[12]&RC[13]&RC[14]&RC[15]&RC[16]&RC[17]&RC[18]&RC[19]&RC[20]&RC[21]&RC[22]="",,"|n"&R1C15)&IF(RC[10]="",,"|n"&R1C16&RC[10])&IF(RC[11]="",,"|n"&R1C17&RC[11])&IF(RC[12]="",,"|n"&R1C18&RC[12])&IF(RC[13]="",,"|n"&R1C19&RC[13])&IF(RC[14]="",,"|n"&R1C20&RC[14])&IF(RC[15]="",,"|n"&R1C21&RC[15])&IF(RC[16]="",,"|n"&R1C22&RC[16])&IF(RC[17]="",,"|n"&R1C23&RC[17])&IF(RC[18]="",,"|n"&R1C24&RC[18])&IF(RC[19]="",,"|n"&R1C25&RC[19])&IF(RC[20]="",,"|n"&R1C26&RC[20])&IF(RC[21]="",,"|n"&R1C27&RC[21])&IF(RC[22]="",,"|n"&R1C28&RC[22])&IF(RC[24]&RC[25]&RC[26]="",,"|n"&R1C29)&IF(RC[24]="",,"|n"&R1C30&RC[24])&IF(RC[25]="",,"|n"&R1C31&RC[25])&IF(RC[26]="",,"|n"&R1C32&RC[26])&IF(RC[28]="",,"|n"&RC[28]) -> |cFFFFFF99基础属性|r|n攻击:600|n力量:300|n敏捷:300|n智力:300|n|cFFFFFF55附加属性|r(%)|n附加伤害:5|n伤害减免:3|n属性叠加!拥有多个时只能使用一个!|n激活后输入'-ch1'切换称号! | G72: 1 | I72: =RC[1]*2 -> 600 | J72: 300 | K72: =RC[-1] -> 300 | L72: =RC[-1] -> 300 | U72: 5 | X72: 3 | AH72: ="属性叠加!拥有多个时只能使用一个!|n激活后输入'-ch"&RC[-27]&"'切换称号!" -> 属性叠加!拥有多个时只能使用一个!|n激活后输入'-ch1'切换称号!
D73: 青铜 | F73: =IF(RC[3]&RC[4]&RC[5]&RC[6]&RC[7]&RC[8]="",,R1C8)&IF(RC[3]="",,"|n"&R1C9&RC[3])&IF(RC[4]="",,"|n"&R1C10&RC[4])&IF(RC[5]="",,"|n"&R1C11&RC[5])&IF(RC[6]="",,"|n"&R1C12&RC[6])&IF(RC[7]="",,"|n"&R1C13&RC[7])&IF(RC[8]="",,"|n"&R1C14&RC[8])&IF(RC[10]&RC[11]&RC[12]&RC[13]&RC[14]&RC[15]&RC[16]&RC[17]&RC[18]&RC[19]&RC[20]&RC[21]&RC[22]="",,"|n"&R1C15)&IF(RC[10]="",,"|n"&R1C16&RC[10])&IF(RC[11]="",,"|n"&R1C17&RC[11])&IF(RC[12]="",,"|n"&R1C18&RC[12])&IF(RC[13]="",,"|n"&R1C19&RC[13])&IF(RC[14]="",,"|n"&R1C20&RC[14])&IF(RC[15]="",,"|n"&R1C21&RC[15])&IF(RC[16]="",,"|n"&R1C22&RC[16])&IF(RC[17]="",,"|n"&R1C23&RC[17])&IF(RC[18]="",,"|n"&R1C24&RC[18])&IF(RC[19]="",,"|n"&R1C25&RC[19])&IF(RC[20]="",,"|n"&R1C26&RC[20])&IF(RC[21]="",,"|n"&R1C27&RC[21])&IF(RC[22]="",,"|n"&R1C28&RC[22])&IF(RC[24]&RC[25]&RC[26]="",,"|n"&R1C29)&IF(RC[24]="",,"|n"&R1C30&RC[24])&IF(RC[25]="",,"|n"&R1C31&RC[25])&IF(RC[26]="",,"|n"&R1C32&RC[26])&IF(RC[28]="",,"|n"&RC[28]) -> |cFFFFFF99基础属性|r|n攻击:1500|n力量:600|n敏捷:600|n智力:600|n|cFFFFFF55附加属性|r(%)|n附加伤害:10|n伤害减免:1|n属性叠加!拥有多个时只能使用一个!|n激活后输入'-ch2'切换称号! | G73: 2 | I73: =RC[1]*2.5 -> 1500 | J73: 600 | K73: =RC[-1] -> 600 | L73: =RC[-1] -> 600 | U73: 10 | X73: 1 | AH73: ="属性叠加!拥有多个时只能使用一个!|n激活后输入'-ch"&RC[-27]&"'切换称号!" -> 属性叠加!拥有多个时只能使用一个!|n激活后输入'-ch2'切换称号!
D74: 白银 | F74: =IF(RC[3]&RC[4]&RC[5]&RC[6]&RC[7]&RC[8]="",,R1C8)&IF(RC[3]="",,"|n"&R1C9&RC[3])&IF(RC[4]="",,"|n"&R1C10&RC[4])&IF(RC[5]="",,"|n"&R1C11&RC[5])&IF(RC[6]="",,"|n"&R1C12&RC[6])&IF(RC[7]="",,"|n"&R1C13&RC[7])&IF(RC[8]="",,"|n"&R1C14&RC[8])&IF(RC[10]&RC[11]&RC[12]&RC[13]&RC[14]&RC[15]&RC[16]&RC[17]&RC[18]&RC[19]&RC[20]&RC[21]&RC[22]="",,"|n"&R1C15)&IF(RC[10]="",,"|n"&R1C16&RC[10])&IF(RC[11]="",,"|n"&R1C17&RC[11])&IF(RC[12]="",,"|n"&R1C18&RC[12])&IF(RC[13]="",,"|n"&R1C19&RC[13])&IF(RC[14]="",,"|n"&R1C20&RC[14])&IF(RC[15]="",,"|n"&R1C21&RC[15])&IF(RC[16]="",,"|n"&R1C22&RC[16])&IF(RC[17]="",,"|n"&R1C23&RC[17])&IF(RC[18]="",,"|n"&R1C24&RC[18])&IF(RC[19]="",,"|n"&R1C25&RC[19])&IF(RC[20]="",,"|n"&R1C26&RC[20])&IF(RC[21]="",,"|n"&R1C27&RC[21])&IF(RC[22]="",,"|n"&R1C28&RC[22])&IF(RC[24]&RC[25]&RC[26]="",,"|n"&R1C29)&IF(RC[24]="",,"|n"&R1C30&RC[24])&IF(RC[25]="",,"|n"&R1C31&RC[25])&IF(RC[26]="",,"|n"&R1C32&RC[26])&IF(RC[28]="",,"|n"&RC[28]) -> |cFFFFFF99基础属性|r|n攻击:2500|n力量:1000|n敏捷:1000|n智力:1000|n|cFFFFFF55附加属性|r(%)|n附加伤害:15|n伤害减免:1|n属性叠加!拥有多个时只能使用一个!|n激活后输入'-ch3'切换称号! | G74: 3 | I74: =RC[1]*2.5 -> 2500 | J74: 1000 | K74: =RC[-1] -> 1000 | L74: =RC[-1] -> 1000 | U74: 15 | X74: 1 | AH74: ="属性叠加!拥有多个时只能使用一个!|n激活后输入'-ch"&RC[-27]&"'切换称号!" -> 属性叠加!拥有多个时只能使用一个!|n激活后输入'-ch3'切换称号!
D75: 黄金 | F75: =IF(RC[3]&RC[4]&RC[5]&RC[6]&RC[7]&RC[8]="",,R1C8)&IF(RC[3]="",,"|n"&R1C9&RC[3])&IF(RC[4]="",,"|n"&R1C10&RC[4])&IF(RC[5]="",,"|n"&R1C11&RC[5])&IF(RC[6]="",,"|n"&R1C12&RC[6])&IF(RC[7]="",,"|n"&R1C13&RC[7])&IF(RC[8]="",,"|n"&R1C14&RC[8])&IF(RC[10]&RC[11]&RC[12]&RC[13]&RC[14]&RC[15]&RC[16]&RC[17]&RC[18]&RC[19]&RC[20]&RC[21]&RC[22]="",,"|n"&R1C15)&IF(RC[10]="",,"|n"&R1C16&RC[10])&IF(RC[11]="",,"|n"&R1C17&RC[11])&IF(RC[12]="",,"|n"&R1C18&RC[12])&IF(RC[13]="",,"|n"&R1C19&RC[13])&IF(RC[14]="",,"|n"&R1C20&RC[14])&IF(RC[15]="",,"|n"&R1C21&RC[15])&IF(RC[16]="",,"|n"&R1C22&RC[16])&IF(RC[17]="",,"|n"&R1C23&RC[17])&IF(RC[18]="",,"|n"&R1C24&RC[18])&IF(RC[19]="",,"|n"&R1C25&RC[19])&IF(RC[20]="",,"|n"&R1C26&RC[20])&IF(RC[21]="",,"|n"&R1C27&RC[21])&IF(RC[22]="",,"|n"&R1C28&RC[22])&IF(RC[24]&RC[25]&RC[26]="",,"|n"&R1C29)&IF(RC[24]="",,"|n"&R1C30&RC[24])&IF(RC[25]="",,"|n"&R1C31&RC[25])&IF(RC[26]="",,"|n"&R1C32&RC[26])&IF(RC[28]="",,"|n"&RC[28]) -> |cFFFFFF99基础属性|r|n攻击:3750|n力量:1500|n敏捷:1500|n智力:1500|n|cFFFFFF55附加属性|r(%)|n附加伤害:20|n伤害减免:1|n属性叠加!拥有多个时只能使用一个!|n激活后输入'-ch4'切换称号! | G75: 4 | I75: =RC[1]*2.5 -> 3750 | J75: 1500 | K75: =RC[-1] -> 1500 | L75: =RC[-1] -> 1500 | U75: 20 | X75: 1 | AH75: ="属性叠加!拥有多个时只能使用一个!|n激活后输入'-ch"&RC[-27]&"'切换称号!" -> 属性叠加!拥有多个时只能使用一个!|n激活后输入'-ch4'切换称号!
D76: 铂金 | F76: =IF(RC[3]&RC[4]&RC[5]&RC[6]&RC[7]&RC[8]="",,R1C8)&IF(RC[3]="",,"|n"&R1C9&RC[3])&IF(RC[4]="",,"|n"&R1C10&RC[4])&IF(RC[5]="",,"|n"&R1C11&RC[5])&IF(RC[6]="",,"|n"&R1C12&RC[6])&IF(RC[7]="",,"|n"&R1C13&RC[7])&IF(RC[8]="",,"|n"&R1C14&RC[8])&IF(RC[10]&RC[11]&RC[12]&RC[13]&RC[14]&RC[15]&RC[16]&RC[17]&RC[18]&RC[19]&RC[20]&RC[21]&RC[22]="",,"|n"&R1C15)&IF(RC[10]="",,"|n"&R1C16&RC[10])&IF(RC[11]="",,"|n"&R1C17&RC[11])&IF(RC[12]="",,"|n"&R1C18&RC[12])&IF(RC[13]="",,"|n"&R1C19&RC[13])&IF(RC[14]="",,"|n"&R1C20&RC[14])&IF(RC[15]="",,"|n"&R1C21&RC[15])&IF(RC[16]="",,"|n"&R1C22&RC[16])&IF(RC[17]="",,"|n"&R1C23&RC[17])&IF(RC[18]="",,"|n"&R1C24&RC[18])&IF(RC[19]="",,"|n"&R1C25&RC[19])&IF(RC[20]="",,"|n"&R1C26&RC[20])&IF(RC[21]="",,"|n"&R1C27&RC[21])&IF(RC[22]="",,"|n"&R1C28&RC[22])&IF(RC[24]&RC[25]&RC[26]="",,"|n"&R1C29)&IF(RC[24]="",,"|n"&R1C30&RC[24])&IF(RC[25]="",,"|n"&R1C31&RC[25])&IF(RC[26]="",,"|n"&R1C32&RC[26])&IF(RC[28]="",,"|n"&RC[28]) -> |cFFFFFF99基础属性|r|n攻击:5500|n力量:2200|n敏捷:2200|n智力:2200|n|cFFFFFF55附加属性|r(%)|n附加伤害:25|n伤害减免:1|n属性叠加!拥有多个时只能使用一个!|n激活后输入'-ch5'切换称号! | G76: 5 | I76: =RC[1]*2.5 -> 5500 | J76: 2200 | K76: =RC[-1] -> 2200 | L76: =RC[-1] -> 2200 | U76: 25 | X76: 1 | AH76: ="属性叠加!拥有多个时只能使用一个!|n激活后输入'-ch"&RC[-27]&"'切换称号!" -> 属性叠加!拥有多个时只能使用一个!|n激活后输入'-ch5'切换称号!
D77: 钻石 | F77: =IF(RC[3]&RC[4]&RC[5]&RC[6]&RC[7]&RC[8]="",,R1C8)&IF(RC[3]="",,"|n"&R1C9&RC[3])&IF(RC[4]="",,"|n"&R1C10&RC[4])&IF(RC[5]="",,"|n"&R1C11&RC[5])&IF(RC[6]="",,"|n"&R1C12&RC[6])&IF(RC[7]="",,"|n"&R1C13&RC[7])&IF(RC[8]="",,"|n"&R1C14&RC[8])&IF(RC[10]&RC[11]&RC[12]&RC[13]&RC[14]&RC[15]&RC[16]&RC[17]&RC[18]&RC[19]&RC[20]&RC[21]&RC[22]="",,"|n"&R1C15)&IF(RC[10]="",,"|n"&R1C16&RC[10])&IF(RC[11]="",,"|n"&R1C17&RC[11])&IF(RC[12]="",,"|n"&R1C18&RC[12])&IF(RC[13]="",,"|n"&R1C19&RC[13])&IF(RC[14]="",,"|n"&R1C20&RC[14])&IF(RC[15]="",,"|n"&R1C21&RC[15])&IF(RC[16]="",,"|n"&R1C22&RC[16])&IF(RC[17]="",,"|n"&R1C23&RC[17])&IF(RC[18]="",,"|n"&R1C24&RC[18])&IF(RC[19]="",,"|n"&R1C25&RC[19])&IF(RC[20]="",,"|n"&R1C26&RC[20])&IF(RC[21]="",,"|n"&R1C27&RC[21])&IF(RC[22]="",,"|n"&R1C28&RC[22])&IF(RC[24]&RC[25]&RC[26]="",,"|n"&R1C29)&IF(RC[24]="",,"|n"&R1C30&RC[24])&IF(RC[25]="",,"|n"&R1C31&RC[25])&IF(RC[26]="",,"|n"&R1C32&RC[26])&IF(RC[28]="",,"|n"&RC[28]) -> |cFFFFFF99基础属性|r|n攻击:7500|n力量:3000|n敏捷:3000|n智力:3000|n|cFFFFFF55附加属性|r(%)|n附加伤害:30|n伤害减免:1|n属性叠加!拥有多个时只能使用一个!|n激活后输入'-ch6'切换称号! | G77: 6 | I77: =RC[1]*2.5 -> 7500 | J77: 3000 | K77: =RC[-1] -> 3000 | L77: =RC[-1] -> 3000 | U77: 30 | X77: 1 | AH77: ="属性叠加!拥有多个时只能使用一个!|n激活后输入'-ch"&RC[-27]&"'切换称号!" -> 属性叠加!拥有多个时只能使用一个!|n激活后输入'-ch6'切换称号!
D78: 大师 | F78: =IF(RC[3]&RC[4]&RC[5]&RC[6]&RC[7]&RC[8]="",,R1C8)&IF(RC[3]="",,"|n"&R1C9&RC[3])&IF(RC[4]="",,"|n"&R1C10&RC[4])&IF(RC[5]="",,"|n"&R1C11&RC[5])&IF(RC[6]="",,"|n"&R1C12&RC[6])&IF(RC[7]="",,"|n"&R1C13&RC[7])&IF(RC[8]="",,"|n"&R1C14&RC[8])&IF(RC[10]&RC[11]&RC[12]&RC[13]&RC[14]&RC[15]&RC[16]&RC[17]&RC[18]&RC[19]&RC[20]&RC[21]&RC[22]="",,"|n"&R1C15)&IF(RC[10]="",,"|n"&R1C16&RC[10])&IF(RC[11]="",,"|n"&R1C17&RC[11])&IF(RC[12]="",,"|n"&R1C18&RC[12])&IF(RC[13]="",,"|n"&R1C19&RC[13])&IF(RC[14]="",,"|n"&R1C20&RC[14])&IF(RC[15]="",,"|n"&R1C21&RC[15])&IF(RC[16]="",,"|n"&R1C22&RC[16])&IF(RC[17]="",,"|n"&R1C23&RC[17])&IF(RC[18]="",,"|n"&R1C24&RC[18])&IF(RC[19]="",,"|n"&R1C25&RC[19])&IF(RC[20]="",,"|n"&R1C26&RC[20])&IF(RC[21]="",,"|n"&R1C27&RC[21])&IF(RC[22]="",,"|n"&R1C28&RC[22])&IF(RC[24]&RC[25]&RC[26]="",,"|n"&R1C29)&IF(RC[24]="",,"|n"&R1C30&RC[24])&IF(RC[25]="",,"|n"&R1C31&RC[25])&IF(RC[26]="",,"|n"&R1C32&RC[26])&IF(RC[28]="",,"|n"&RC[28]) -> |cFFFFFF99基础属性|r|n攻击:10000|n力量:4000|n敏捷:4000|n智力:4000|n|cFFFFFF55附加属性|r(%)|n附加伤害:35|n伤害减免:1|n属性叠加!拥有多个时只能使用一个!|n激活后输入'-ch7'切换称号! | G78: 7 | I78: =RC[1]*2.5 -> 10000 | J78: 4000 | K78: =RC[-1] -> 4000 | L78: =RC[-1] -> 4000 | U78: 35 | X78: 1 | AH78: ="属性叠加!拥有多个时只能使用一个!|n激活后输入'-ch"&RC[-27]&"'切换称号!" -> 属性叠加!拥有多个时只能使用一个!|n激活后输入'-ch7'切换称号!
D79: 宗师 | F79: =IF(RC[3]&RC[4]&RC[5]&RC[6]&RC[7]&RC[8]="",,R1C8)&IF(RC[3]="",,"|n"&R1C9&RC[3])&IF(RC[4]="",,"|n"&R1C10&RC[4])&IF(RC[5]="",,"|n"&R1C11&RC[5])&IF(RC[6]="",,"|n"&R1C12&RC[6])&IF(RC[7]="",,"|n"&R1C13&RC[7])&IF(RC[8]="",,"|n"&R1C14&RC[8])&IF(RC[10]&RC[11]&RC[12]&RC[13]&RC[14]&RC[15]&RC[16]&RC[17]&RC[18]&RC[19]&RC[20]&RC[21]&RC[22]="",,"|n"&R1C15)&IF(RC[10]="",,"|n"&R1C16&RC[10])&IF(RC[11]="",,"|n"&R1C17&RC[11])&IF(RC[12]="",,"|n"&R1C18&RC[12])&IF(RC[13]="",,"|n"&R1C19&RC[13])&IF(RC[14]="",,"|n"&R1C20&RC[14])&IF(RC[15]="",,"|n"&R1C21&RC[15])&IF(RC[16]="",,"|n"&R1C22&RC[16])&IF(RC[17]="",,"|n"&R1C23&RC[17])&IF(RC[18]="",,"|n"&R1C24&RC[18])&IF(RC[19]="",,"|n"&R1C25&RC[19])&IF(RC[20]="",,"|n"&R1C26&RC[20])&IF(RC[21]="",,"|n"&R1C27&RC[21])&IF(RC[22]="",,"|n"&R1C28&RC[22])&IF(RC[24]&RC[25]&RC[26]="",,"|n"&R1C29)&IF(RC[24]="",,"|n"&R1C30&RC[24])&IF(RC[25]="",,"|n"&R1C31&RC[25])&IF(RC[26]="",,"|n"&R1C32&RC[26])&IF(RC[28]="",,"|n"&RC[28]) -> |cFFFFFF99基础属性|r|n攻击:13000|n力量:5200|n敏捷:5200|n智力:5200|n|cFFFFFF55附加属性|r(%)|n附加伤害:40|n伤害减免:1|n属性叠加!拥有多个时只能使用一个!|n激活后输入'-ch8'切换称号! | G79: 8 | I79: =RC[1]*2.5 -> 13000 | J79: 5200 | K79: =RC[-1] -> 5200 | L79: =RC[-1] -> 5200 | U79: 40 | X79: 1 | AH79: ="属性叠加!拥有多个时只能使用一个!|n激活后输入'-ch"&RC[-27]&"'切换称号!" -> 属性叠加!拥有多个时只能使用一个!|n激活后输入'-ch8'切换称号!
D80: 王者 | F80: =IF(RC[3]&RC[4]&RC[5]&RC[6]&RC[7]&RC[8]="",,R1C8)&IF(RC[3]="",,"|n"&R1C9&RC[3])&IF(RC[4]="",,"|n"&R1C10&RC[4])&IF(RC[5]="",,"|n"&R1C11&RC[5])&IF(RC[6]="",,"|n"&R1C12&RC[6])&IF(RC[7]="",,"|n"&R1C13&RC[7])&IF(RC[8]="",,"|n"&R1C14&RC[8])&IF(RC[10]&RC[11]&RC[12]&RC[13]&RC[14]&RC[15]&RC[16]&RC[17]&RC[18]&RC[19]&RC[20]&RC[21]&RC[22]="",,"|n"&R1C15)&IF(RC[10]="",,"|n"&R1C16&RC[10])&IF(RC[11]="",,"|n"&R1C17&RC[11])&IF(RC[12]="",,"|n"&R1C18&RC[12])&IF(RC[13]="",,"|n"&R1C19&RC[13])&IF(RC[14]="",,"|n"&R1C20&RC[14])&IF(RC[15]="",,"|n"&R1C21&RC[15])&IF(RC[16]="",,"|n"&R1C22&RC[16])&IF(RC[17]="",,"|n"&R1C23&RC[17])&IF(RC[18]="",,"|n"&R1C24&RC[18])&IF(RC[19]="",,"|n"&R1C25&RC[19])&IF(RC[20]="",,"|n"&R1C26&RC[20])&IF(RC[21]="",,"|n"&R1C27&RC[21])&IF(RC[22]="",,"|n"&R1C28&RC[22])&IF(RC[24]&RC[25]&RC[26]="",,"|n"&R1C29)&IF(RC[24]="",,"|n"&R1C30&RC[24])&IF(RC[25]="",,"|n"&R1C31&RC[25])&IF(RC[26]="",,"|n"&R1C32&RC[26])&IF(RC[28]="",,"|n"&RC[28]) -> |cFFFFFF99基础属性|r|n攻击:16500|n力量:6600|n敏捷:6600|n智力:6600|n|cFFFFFF55附加属性|r(%)|n附加伤害:45|n伤害减免:1|n属性叠加!拥有多个时只能使用一个!|n激活后输入'-ch9'切换称号! | G80: 9 | I80: =RC[1]*2.5 -> 16500 | J80: 6600 | K80: =RC[-1] -> 6600 | L80: =RC[-1] -> 6600 | U80: 45 | X80: 1 | AH80: ="属性叠加!拥有多个时只能使用一个!|n激活后输入'-ch"&RC[-27]&"'切换称号!" -> 属性叠加!拥有多个时只能使用一个!|n激活后输入'-ch9'切换称号!
D81: 皇者 | F81: =IF(RC[3]&RC[4]&RC[5]&RC[6]&RC[7]&RC[8]="",,R1C8)&IF(RC[3]="",,"|n"&R1C9&RC[3])&IF(RC[4]="",,"|n"&R1C10&RC[4])&IF(RC[5]="",,"|n"&R1C11&RC[5])&IF(RC[6]="",,"|n"&R1C12&RC[6])&IF(RC[7]="",,"|n"&R1C13&RC[7])&IF(RC[8]="",,"|n"&R1C14&RC[8])&IF(RC[10]&RC[11]&RC[12]&RC[13]&RC[14]&RC[15]&RC[16]&RC[17]&RC[18]&RC[19]&RC[20]&RC[21]&RC[22]="",,"|n"&R1C15)&IF(RC[10]="",,"|n"&R1C16&RC[10])&IF(RC[11]="",,"|n"&R1C17&RC[11])&IF(RC[12]="",,"|n"&R1C18&RC[12])&IF(RC[13]="",,"|n"&R1C19&RC[13])&IF(RC[14]="",,"|n"&R1C20&RC[14])&IF(RC[15]="",,"|n"&R1C21&RC[15])&IF(RC[16]="",,"|n"&R1C22&RC[16])&IF(RC[17]="",,"|n"&R1C23&RC[17])&IF(RC[18]="",,"|n"&R1C24&RC[18])&IF(RC[19]="",,"|n"&R1C25&RC[19])&IF(RC[20]="",,"|n"&R1C26&RC[20])&IF(RC[21]="",,"|n"&R1C27&RC[21])&IF(RC[22]="",,"|n"&R1C28&RC[22])&IF(RC[24]&RC[25]&RC[26]="",,"|n"&R1C29)&IF(RC[24]="",,"|n"&R1C30&RC[24])&IF(RC[25]="",,"|n"&R1C31&RC[25])&IF(RC[26]="",,"|n"&R1C32&RC[26])&IF(RC[28]="",,"|n"&RC[28]) -> |cFFFFFF99基础属性|r|n攻击:21500|n力量:8600|n敏捷:8600|n智力:8600|n|cFFFFFF55附加属性|r(%)|n附加伤害:50|n伤害减免:1|n属性叠加!拥有多个时只能使用一个!|n激活后输入'-ch10'切换称号! | G81: 10 | I81: =RC[1]*2.5 -> 21500 | J81: 8600 | K81: =RC[-1] -> 8600 | L81: =RC[-1] -> 8600 | U81: 50 | X81: 1 | AH81: ="属性叠加!拥有多个时只能使用一个!|n激活后输入'-ch"&RC[-27]&"'切换称号!" -> 属性叠加!拥有多个时只能使用一个!|n激活后输入'-ch10'切换称号!
D82: 星悦至尊 | F82: =IF(RC[3]&RC[4]&RC[5]&RC[6]&RC[7]&RC[8]="",,R1C8)&IF(RC[3]="",,"|n"&R1C9&RC[3])&IF(RC[4]="",,"|n"&R1C10&RC[4])&IF(RC[5]="",,"|n"&R1C11&RC[5])&IF(RC[6]="",,"|n"&R1C12&RC[6])&IF(RC[7]="",,"|n"&R1C13&RC[7])&IF(RC[8]="",,"|n"&R1C14&RC[8])&IF(RC[10]&RC[11]&RC[12]&RC[13]&RC[14]&RC[15]&RC[16]&RC[17]&RC[18]&RC[19]&RC[20]&RC[21]&RC[22]="",,"|n"&R1C15)&IF(RC[10]="",,"|n"&R1C16&RC[10])&IF(RC[11]="",,"|n"&R1C17&RC[11])&IF(RC[12]="",,"|n"&R1C18&RC[12])&IF(RC[13]="",,"|n"&R1C19&RC[13])&IF(RC[14]="",,"|n"&R1C20&RC[14])&IF(RC[15]="",,"|n"&R1C21&RC[15])&IF(RC[16]="",,"|n"&R1C22&RC[16])&IF(RC[17]="",,"|n"&R1C23&RC[17])&IF(RC[18]="",,"|n"&R1C24&RC[18])&IF(RC[19]="",,"|n"&R1C25&RC[19])&IF(RC[20]="",,"|n"&R1C26&RC[20])&IF(RC[21]="",,"|n"&R1C27&RC[21])&IF(RC[22]="",,"|n"&R1C28&RC[22])&IF(RC[24]&RC[25]&RC[26]="",,"|n"&R1C29)&IF(RC[24]="",,"|n"&R1C30&RC[24])&IF(RC[25]="",,"|n"&R1C31&RC[25])&IF(RC[26]="",,"|n"&R1C32&RC[26])&IF(RC[28]="",,"|n"&RC[28]) -> |cFFFFFF99基础属性|r|n攻击:20000|n力量:10000|n敏捷:10000|n智力:10000|n|cFFFFFF55附加属性|r(%)|n攻击吸血:5|n暴击概率:10|n暴击伤害:20|n附加伤害:50|n最终伤害:5|n获得20%额外杀敌积分|n属性叠加!拥有多个时只能使用一个!|n激活后输入'-chxy'切换称号! | G82: 10 | I82: 20000 | J82: 10000 | K82: =RC[-1] -> 10000 | L82: =RC[-1] -> 10000 | Q82: 5 | R82: 10 | S82: 20 | U82: 50 | V82: 5 | AH82: ="获得20%额外杀敌积分|n属性叠加!拥有多个时只能使用一个!|n激活后输入'-chxy'切换称号!" -> 获得20%额外杀敌积分|n属性叠加!拥有多个时只能使用一个!|n激活后输入'-chxy'切换称号!
D83: 魔域主播 | F83: =IF(RC[3]&RC[4]&RC[5]&RC[6]&RC[7]&RC[8]="",,R1C8)&IF(RC[3]="",,"|n"&R1C9&RC[3])&IF(RC[4]="",,"|n"&R1C10&RC[4])&IF(RC[5]="",,"|n"&R1C11&RC[5])&IF(RC[6]="",,"|n"&R1C12&RC[6])&IF(RC[7]="",,"|n"&R1C13&RC[7])&IF(RC[8]="",,"|n"&R1C14&RC[8])&IF(RC[10]&RC[11]&RC[12]&RC[13]&RC[14]&RC[15]&RC[16]&RC[17]&RC[18]&RC[19]&RC[20]&RC[21]&RC[22]="",,"|n"&R1C15)&IF(RC[10]="",,"|n"&R1C16&RC[10])&IF(RC[11]="",,"|n"&R1C17&RC[11])&IF(RC[12]="",,"|n"&R1C18&RC[12])&IF(RC[13]="",,"|n"&R1C19&RC[13])&IF(RC[14]="",,"|n"&R1C20&RC[14])&IF(RC[15]="",,"|n"&R1C21&RC[15])&IF(RC[16]="",,"|n"&R1C22&RC[16])&IF(RC[17]="",,"|n"&R1C23&RC[17])&IF(RC[18]="",,"|n"&R1C24&RC[18])&IF(RC[19]="",,"|n"&R1C25&RC[19])&IF(RC[20]="",,"|n"&R1C26&RC[20])&IF(RC[21]="",,"|n"&R1C27&RC[21])&IF(RC[22]="",,"|n"&R1C28&RC[22])&IF(RC[24]&RC[25]&RC[26]="",,"|n"&R1C29)&IF(RC[24]="",,"|n"&R1C30&RC[24])&IF(RC[25]="",,"|n"&R1C31&RC[25])&IF(RC[26]="",,"|n"&R1C32&RC[26])&IF(RC[28]="",,"|n"&RC[28]) -> |cFFFFFF99基础属性|r|n攻击:10000|n力量:5000|n敏捷:5000|n智力:5000|n|cFFFFFF55附加属性|r(%)|n暴击伤害:10|n附加伤害:50|n属性叠加!拥有多个时只能使用一个!|n激活后输入'-chzb'切换称号! | G83: 10 | I83: 10000 | J83: 5000 | K83: =RC[-1] -> 5000 | L83: =RC[-1] -> 5000 | S83: 10 | U83: 50 | AH83: ="属性叠加!拥有多个时只能使用一个!|n激活后输入'-chzb'切换称号!" -> 属性叠加!拥有多个时只能使用一个!|n激活后输入'-chzb'切换称号!
F84: =IF(RC[3]&RC[4]&RC[5]&RC[6]&RC[7]&RC[8]="",,R1C8)&IF(RC[3]="",,"|n"&R1C9&RC[3])&IF(RC[4]="",,"|n"&R1C10&RC[4])&IF(RC[5]="",,"|n"&R1C11&RC[5])&IF(RC[6]="",,"|n"&R1C12&RC[6])&IF(RC[7]="",,"|n"&R1C13&RC[7])&IF(RC[8]="",,"|n"&R1C14&RC[8])&IF(RC[10]&RC[11]&RC[12]&RC[13]&RC[14]&RC[15]&RC[16]&RC[17]&RC[18]&RC[19]&RC[20]&RC[21]&RC[22]="",,"|n"&R1C15)&IF(RC[10]="",,"|n"&R1C16&RC[10])&IF(RC[11]="",,"|n"&R1C17&RC[11])&IF(RC[12]="",,"|n"&R1C18&RC[12])&IF(RC[13]="",,"|n"&R1C19&RC[13])&IF(RC[14]="",,"|n"&R1C20&RC[14])&IF(RC[15]="",,"|n"&R1C21&RC[15])&IF(RC[16]="",,"|n"&R1C22&RC[16])&IF(RC[17]="",,"|n"&R1C23&RC[17])&IF(RC[18]="",,"|n"&R1C24&RC[18])&IF(RC[19]="",,"|n"&R1C25&RC[19])&IF(RC[20]="",,"|n"&R1C26&RC[20])&IF(RC[21]="",,"|n"&R1C27&RC[21])&IF(RC[22]="",,"|n"&R1C28&RC[22])&IF(RC[24]&RC[25]&RC[26]="",,"|n"&R1C29)&IF(RC[24]="",,"|n"&R1C30&RC[24])&IF(RC[25]="",,"|n"&R1C31&RC[25])&IF(RC[26]="",,"|n"&R1C32&RC[26])&IF(RC[28]="",,"|n"&RC[28]) -> 
D85: [精髓]盗贼王 | F85: =IF(RC[3]&RC[4]&RC[5]&RC[6]&RC[7]&RC[8]="",,R1C8)&IF(RC[3]="",,"|n"&R1C9&RC[3])&IF(RC[4]="",,"|n"&R1C10&RC[4])&IF(RC[5]="",,"|n"&R1C11&RC[5])&IF(RC[6]="",,"|n"&R1C12&RC[6])&IF(RC[7]="",,"|n"&R1C13&RC[7])&IF(RC[8]="",,"|n"&R1C14&RC[8])&IF(RC[10]&RC[11]&RC[12]&RC[13]&RC[14]&RC[15]&RC[16]&RC[17]&RC[18]&RC[19]&RC[20]&RC[21]&RC[22]="",,"|n"&R1C15)&IF(RC[10]="",,"|n"&R1C16&RC[10])&IF(RC[11]="",,"|n"&R1C17&RC[11])&IF(RC[12]="",,"|n"&R1C18&RC[12])&IF(RC[13]="",,"|n"&R1C19&RC[13])&IF(RC[14]="",,"|n"&R1C20&RC[14])&IF(RC[15]="",,"|n"&R1C21&RC[15])&IF(RC[16]="",,"|n"&R1C22&RC[16])&IF(RC[17]="",,"|n"&R1C23&RC[17])&IF(RC[18]="",,"|n"&R1C24&RC[18])&IF(RC[19]="",,"|n"&R1C25&RC[19])&IF(RC[20]="",,"|n"&R1C26&RC[20])&IF(RC[21]="",,"|n"&R1C27&RC[21])&IF(RC[22]="",,"|n"&R1C28&RC[22])&IF(RC[24]&RC[25]&RC[26]="",,"|n"&R1C29)&IF(RC[24]="",,"|n"&R1C30&RC[24])&IF(RC[25]="",,"|n"&R1C31&RC[25])&IF(RC[26]="",,"|n"&R1C32&RC[26])&IF(RC[28]="",,"|n"&RC[28]) -> |n怪物精髓。吞噬时选取属性！ | AH85: 怪物精髓。吞噬时选取属性！
D86: [精髓]鱼人首领 | F86: =IF(RC[3]&RC[4]&RC[5]&RC[6]&RC[7]&RC[8]="",,R1C8)&IF(RC[3]="",,"|n"&R1C9&RC[3])&IF(RC[4]="",,"|n"&R1C10&RC[4])&IF(RC[5]="",,"|n"&R1C11&RC[5])&IF(RC[6]="",,"|n"&R1C12&RC[6])&IF(RC[7]="",,"|n"&R1C13&RC[7])&IF(RC[8]="",,"|n"&R1C14&RC[8])&IF(RC[10]&RC[11]&RC[12]&RC[13]&RC[14]&RC[15]&RC[16]&RC[17]&RC[18]&RC[19]&RC[20]&RC[21]&RC[22]="",,"|n"&R1C15)&IF(RC[10]="",,"|n"&R1C16&RC[10])&IF(RC[11]="",,"|n"&R1C17&RC[11])&IF(RC[12]="",,"|n"&R1C18&RC[12])&IF(RC[13]="",,"|n"&R1C19&RC[13])&IF(RC[14]="",,"|n"&R1C20&RC[14])&IF(RC[15]="",,"|n"&R1C21&RC[15])&IF(RC[16]="",,"|n"&R1C22&RC[16])&IF(RC[17]="",,"|n"&R1C23&RC[17])&IF(RC[18]="",,"|n"&R1C24&RC[18])&IF(RC[19]="",,"|n"&R1C25&RC[19])&IF(RC[20]="",,"|n"&R1C26&RC[20])&IF(RC[21]="",,"|n"&R1C27&RC[21])&IF(RC[22]="",,"|n"&R1C28&RC[22])&IF(RC[24]&RC[25]&RC[26]="",,"|n"&R1C29)&IF(RC[24]="",,"|n"&R1C30&RC[24])&IF(RC[25]="",,"|n"&R1C31&RC[25])&IF(RC[26]="",,"|n"&R1C32&RC[26])&IF(RC[28]="",,"|n"&RC[28]) -> |n怪物精髓。吞噬时选取属性！ | AH86: 怪物精髓。吞噬时选取属性！
D87: [精髓]森林狼王 | F87: =IF(RC[3]&RC[4]&RC[5]&RC[6]&RC[7]&RC[8]="",,R1C8)&IF(RC[3]="",,"|n"&R1C9&RC[3])&IF(RC[4]="",,"|n"&R1C10&RC[4])&IF(RC[5]="",,"|n"&R1C11&RC[5])&IF(RC[6]="",,"|n"&R1C12&RC[6])&IF(RC[7]="",,"|n"&R1C13&RC[7])&IF(RC[8]="",,"|n"&R1C14&RC[8])&IF(RC[10]&RC[11]&RC[12]&RC[13]&RC[14]&RC[15]&RC[16]&RC[17]&RC[18]&RC[19]&RC[20]&RC[21]&RC[22]="",,"|n"&R1C15)&IF(RC[10]="",,"|n"&R1C16&RC[10])&IF(RC[11]="",,"|n"&R1C17&RC[11])&IF(RC[12]="",,"|n"&R1C18&RC[12])&IF(RC[13]="",,"|n"&R1C19&RC[13])&IF(RC[14]="",,"|n"&R1C20&RC[14])&IF(RC[15]="",,"|n"&R1C21&RC[15])&IF(RC[16]="",,"|n"&R1C22&RC[16])&IF(RC[17]="",,"|n"&R1C23&RC[17])&IF(RC[18]="",,"|n"&R1C24&RC[18])&IF(RC[19]="",,"|n"&R1C25&RC[19])&IF(RC[20]="",,"|n"&R1C26&RC[20])&IF(RC[21]="",,"|n"&R1C27&RC[21])&IF(RC[22]="",,"|n"&R1C28&RC[22])&IF(RC[24]&RC[25]&RC[26]="",,"|n"&R1C29)&IF(RC[24]="",,"|n"&R1C30&RC[24])&IF(RC[25]="",,"|n"&R1C31&RC[25])&IF(RC[26]="",,"|n"&R1C32&RC[26])&IF(RC[28]="",,"|n"&RC[28]) -> |n怪物精髓。吞噬时选取属性！ | AH87: 怪物精髓。吞噬时选取属性！
D88: [精髓]豪猪王 | F88: =IF(RC[3]&RC[4]&RC[5]&RC[6]&RC[7]&RC[8]="",,R1C8)&IF(RC[3]="",,"|n"&R1C9&RC[3])&IF(RC[4]="",,"|n"&R1C10&RC[4])&IF(RC[5]="",,"|n"&R1C11&RC[5])&IF(RC[6]="",,"|n"&R1C12&RC[6])&IF(RC[7]="",,"|n"&R1C13&RC[7])&IF(RC[8]="",,"|n"&R1C14&RC[8])&IF(RC[10]&RC[11]&RC[12]&RC[13]&RC[14]&RC[15]&RC[16]&RC[17]&RC[18]&RC[19]&RC[20]&RC[21]&RC[22]="",,"|n"&R1C15)&IF(RC[10]="",,"|n"&R1C16&RC[10])&IF(RC[11]="",,"|n"&R1C17&RC[11])&IF(RC[12]="",,"|n"&R1C18&RC[12])&IF(RC[13]="",,"|n"&R1C19&RC[13])&IF(RC[14]="",,"|n"&R1C20&RC[14])&IF(RC[15]="",,"|n"&R1C21&RC[15])&IF(RC[16]="",,"|n"&R1C22&RC[16])&IF(RC[17]="",,"|n"&R1C23&RC[17])&IF(RC[18]="",,"|n"&R1C24&RC[18])&IF(RC[19]="",,"|n"&R1C25&RC[19])&IF(RC[20]="",,"|n"&R1C26&RC[20])&IF(RC[21]="",,"|n"&R1C27&RC[21])&IF(RC[22]="",,"|n"&R1C28&RC[22])&IF(RC[24]&RC[25]&RC[26]="",,"|n"&R1C29)&IF(RC[24]="",,"|n"&R1C30&RC[24])&IF(RC[25]="",,"|n"&R1C31&RC[25])&IF(RC[26]="",,"|n"&R1C32&RC[26])&IF(RC[28]="",,"|n"&RC[28]) -> |n怪物精髓。吞噬时选取属性！ | AH88: 怪物精髓。吞噬时选取属性！
D89: [精髓]达拉内尔主教 | F89: =IF(RC[3]&RC[4]&RC[5]&RC[6]&RC[7]&RC[8]="",,R1C8)&IF(RC[3]="",,"|n"&R1C9&RC[3])&IF(RC[4]="",,"|n"&R1C10&RC[4])&IF(RC[5]="",,"|n"&R1C11&RC[5])&IF(RC[6]="",,"|n"&R1C12&RC[6])&IF(RC[7]="",,"|n"&R1C13&RC[7])&IF(RC[8]="",,"|n"&R1C14&RC[8])&IF(RC[10]&RC[11]&RC[12]&RC[13]&RC[14]&RC[15]&RC[16]&RC[17]&RC[18]&RC[19]&RC[20]&RC[21]&RC[22]="",,"|n"&R1C15)&IF(RC[10]="",,"|n"&R1C16&RC[10])&IF(RC[11]="",,"|n"&R1C17&RC[11])&IF(RC[12]="",,"|n"&R1C18&RC[12])&IF(RC[13]="",,"|n"&R1C19&RC[13])&IF(RC[14]="",,"|n"&R1C20&RC[14])&IF(RC[15]="",,"|n"&R1C21&RC[15])&IF(RC[16]="",,"|n"&R1C22&RC[16])&IF(RC[17]="",,"|n"&R1C23&RC[17])&IF(RC[18]="",,"|n"&R1C24&RC[18])&IF(RC[19]="",,"|n"&R1C25&RC[19])&IF(RC[20]="",,"|n"&R1C26&RC[20])&IF(RC[21]="",,"|n"&R1C27&RC[21])&IF(RC[22]="",,"|n"&R1C28&RC[22])&IF(RC[24]&RC[25]&RC[26]="",,"|n"&R1C29)&IF(RC[24]="",,"|n"&R1C30&RC[24])&IF(RC[25]="",,"|n"&R1C31&RC[25])&IF(RC[26]="",,"|n"&R1C32&RC[26])&IF(RC[28]="",,"|n"&RC[28]) -> |n怪物精髓。吞噬时选取属性！ | AH89: 怪物精髓。吞噬时选取属性！
D90: [精髓]食人魔酋长 | F90: =IF(RC[3]&RC[4]&RC[5]&RC[6]&RC[7]&RC[8]="",,R1C8)&IF(RC[3]="",,"|n"&R1C9&RC[3])&IF(RC[4]="",,"|n"&R1C10&RC[4])&IF(RC[5]="",,"|n"&R1C11&RC[5])&IF(RC[6]="",,"|n"&R1C12&RC[6])&IF(RC[7]="",,"|n"&R1C13&RC[7])&IF(RC[8]="",,"|n"&R1C14&RC[8])&IF(RC[10]&RC[11]&RC[12]&RC[13]&RC[14]&RC[15]&RC[16]&RC[17]&RC[18]&RC[19]&RC[20]&RC[21]&RC[22]="",,"|n"&R1C15)&IF(RC[10]="",,"|n"&R1C16&RC[10])&IF(RC[11]="",,"|n"&R1C17&RC[11])&IF(RC[12]="",,"|n"&R1C18&RC[12])&IF(RC[13]="",,"|n"&R1C19&RC[13])&IF(RC[14]="",,"|n"&R1C20&RC[14])&IF(RC[15]="",,"|n"&R1C21&RC[15])&IF(RC[16]="",,"|n"&R1C22&RC[16])&IF(RC[17]="",,"|n"&R1C23&RC[17])&IF(RC[18]="",,"|n"&R1C24&RC[18])&IF(RC[19]="",,"|n"&R1C25&RC[19])&IF(RC[20]="",,"|n"&R1C26&RC[20])&IF(RC[21]="",,"|n"&R1C27&RC[21])&IF(RC[22]="",,"|n"&R1C28&RC[22])&IF(RC[24]&RC[25]&RC[26]="",,"|n"&R1C29)&IF(RC[24]="",,"|n"&R1C30&RC[24])&IF(RC[25]="",,"|n"&R1C31&RC[25])&IF(RC[26]="",,"|n"&R1C32&RC[26])&IF(RC[28]="",,"|n"&RC[28]) -> |n怪物精髓。吞噬时选取属性！ | AH90: 怪物精髓。吞噬时选取属性！
D91: [精髓]狗头人酋长 | F91: =IF(RC[3]&RC[4]&RC[5]&RC[6]&RC[7]&RC[8]="",,R1C8)&IF(RC[3]="",,"|n"&R1C9&RC[3])&IF(RC[4]="",,"|n"&R1C10&RC[4])&IF(RC[5]="",,"|n"&R1C11&RC[5])&IF(RC[6]="",,"|n"&R1C12&RC[6])&IF(RC[7]="",,"|n"&R1C13&RC[7])&IF(RC[8]="",,"|n"&R1C14&RC[8])&IF(RC[10]&RC[11]&RC[12]&RC[13]&RC[14]&RC[15]&RC[16]&RC[17]&RC[18]&RC[19]&RC[20]&RC[21]&RC[22]="",,"|n"&R1C15)&IF(RC[10]="",,"|n"&R1C16&RC[10])&IF(RC[11]="",,"|n"&R1C17&RC[11])&IF(RC[12]="",,"|n"&R1C18&RC[12])&IF(RC[13]="",,"|n"&R1C19&RC[13])&IF(RC[14]="",,"|n"&R1C20&RC[14])&IF(RC[15]="",,"|n"&R1C21&RC[15])&IF(RC[16]="",,"|n"&R1C22&RC[16])&IF(RC[17]="",,"|n"&R1C23&RC[17])&IF(RC[18]="",,"|n"&R1C24&RC[18])&IF(RC[19]="",,"|n"&R1C25&RC[19])&IF(RC[20]="",,"|n"&R1C26&RC[20])&IF(RC[21]="",,"|n"&R1C27&RC[21])&IF(RC[22]="",,"|n"&R1C28&RC[22])&IF(RC[24]&RC[25]&RC[26]="",,"|n"&R1C29)&IF(RC[24]="",,"|n"&R1C30&RC[24])&IF(RC[25]="",,"|n"&R1C31&RC[25])&IF(RC[26]="",,"|n"&R1C32&RC[26])&IF(RC[28]="",,"|n"&RC[28]) -> |n怪物精髓。吞噬时选取属性！ | AH91: 怪物精髓。吞噬时选取属性！
D92: [精髓]矿井魔蝎 | F92: =IF(RC[3]&RC[4]&RC[5]&RC[6]&RC[7]&RC[8]="",,R1C8)&IF(RC[3]="",,"|n"&R1C9&RC[3])&IF(RC[4]="",,"|n"&R1C10&RC[4])&IF(RC[5]="",,"|n"&R1C11&RC[5])&IF(RC[6]="",,"|n"&R1C12&RC[6])&IF(RC[7]="",,"|n"&R1C13&RC[7])&IF(RC[8]="",,"|n"&R1C14&RC[8])&IF(RC[10]&RC[11]&RC[12]&RC[13]&RC[14]&RC[15]&RC[16]&RC[17]&RC[18]&RC[19]&RC[20]&RC[21]&RC[22]="",,"|n"&R1C15)&IF(RC[10]="",,"|n"&R1C16&RC[10])&IF(RC[11]="",,"|n"&R1C17&RC[11])&IF(RC[12]="",,"|n"&R1C18&RC[12])&IF(RC[13]="",,"|n"&R1C19&RC[13])&IF(RC[14]="",,"|n"&R1C20&RC[14])&IF(RC[15]="",,"|n"&R1C21&RC[15])&IF(RC[16]="",,"|n"&R1C22&RC[16])&IF(RC[17]="",,"|n"&R1C23&RC[17])&IF(RC[18]="",,"|n"&R1C24&RC[18])&IF(RC[19]="",,"|n"&R1C25&RC[19])&IF(RC[20]="",,"|n"&R1C26&RC[20])&IF(RC[21]="",,"|n"&R1C27&RC[21])&IF(RC[22]="",,"|n"&R1C28&RC[22])&IF(RC[24]&RC[25]&RC[26]="",,"|n"&R1C29)&IF(RC[24]="",,"|n"&R1C30&RC[24])&IF(RC[25]="",,"|n"&R1C31&RC[25])&IF(RC[26]="",,"|n"&R1C32&RC[26])&IF(RC[28]="",,"|n"&RC[28]) -> |n怪物精髓。吞噬时选取属性！ | AH92: 怪物精髓。吞噬时选取属性！
D93: [精髓]炎魔 | F93: =IF(RC[3]&RC[4]&RC[5]&RC[6]&RC[7]&RC[8]="",,R1C8)&IF(RC[3]="",,"|n"&R1C9&RC[3])&IF(RC[4]="",,"|n"&R1C10&RC[4])&IF(RC[5]="",,"|n"&R1C11&RC[5])&IF(RC[6]="",,"|n"&R1C12&RC[6])&IF(RC[7]="",,"|n"&R1C13&RC[7])&IF(RC[8]="",,"|n"&R1C14&RC[8])&IF(RC[10]&RC[11]&RC[12]&RC[13]&RC[14]&RC[15]&RC[16]&RC[17]&RC[18]&RC[19]&RC[20]&RC[21]&RC[22]="",,"|n"&R1C15)&IF(RC[10]="",,"|n"&R1C16&RC[10])&IF(RC[11]="",,"|n"&R1C17&RC[11])&IF(RC[12]="",,"|n"&R1C18&RC[12])&IF(RC[13]="",,"|n"&R1C19&RC[13])&IF(RC[14]="",,"|n"&R1C20&RC[14])&IF(RC[15]="",,"|n"&R1C21&RC[15])&IF(RC[16]="",,"|n"&R1C22&RC[16])&IF(RC[17]="",,"|n"&R1C23&RC[17])&IF(RC[18]="",,"|n"&R1C24&RC[18])&IF(RC[19]="",,"|n"&R1C25&RC[19])&IF(RC[20]="",,"|n"&R1C26&RC[20])&IF(RC[21]="",,"|n"&R1C27&RC[21])&IF(RC[22]="",,"|n"&R1C28&RC[22])&IF(RC[24]&RC[25]&RC[26]="",,"|n"&R1C29)&IF(RC[24]="",,"|n"&R1C30&RC[24])&IF(RC[25]="",,"|n"&R1C31&RC[25])&IF(RC[26]="",,"|n"&R1C32&RC[26])&IF(RC[28]="",,"|n"&RC[28]) -> |n怪物精髓。吞噬时选取属性！ | AH93: 怪物精髓。吞噬时选取属性！
D94: [精髓]巨型蜥蜴 | F94: =IF(RC[3]&RC[4]&RC[5]&RC[6]&RC[7]&RC[8]="",,R1C8)&IF(RC[3]="",,"|n"&R1C9&RC[3])&IF(RC[4]="",,"|n"&R1C10&RC[4])&IF(RC[5]="",,"|n"&R1C11&RC[5])&IF(RC[6]="",,"|n"&R1C12&RC[6])&IF(RC[7]="",,"|n"&R1C13&RC[7])&IF(RC[8]="",,"|n"&R1C14&RC[8])&IF(RC[10]&RC[11]&RC[12]&RC[13]&RC[14]&RC[15]&RC[16]&RC[17]&RC[18]&RC[19]&RC[20]&RC[21]&RC[22]="",,"|n"&R1C15)&IF(RC[10]="",,"|n"&R1C16&RC[10])&IF(RC[11]="",,"|n"&R1C17&RC[11])&IF(RC[12]="",,"|n"&R1C18&RC[12])&IF(RC[13]="",,"|n"&R1C19&RC[13])&IF(RC[14]="",,"|n"&R1C20&RC[14])&IF(RC[15]="",,"|n"&R1C21&RC[15])&IF(RC[16]="",,"|n"&R1C22&RC[16])&IF(RC[17]="",,"|n"&R1C23&RC[17])&IF(RC[18]="",,"|n"&R1C24&RC[18])&IF(RC[19]="",,"|n"&R1C25&RC[19])&IF(RC[20]="",,"|n"&R1C26&RC[20])&IF(RC[21]="",,"|n"&R1C27&RC[21])&IF(RC[22]="",,"|n"&R1C28&RC[22])&IF(RC[24]&RC[25]&RC[26]="",,"|n"&R1C29)&IF(RC[24]="",,"|n"&R1C30&RC[24])&IF(RC[25]="",,"|n"&R1C31&RC[25])&IF(RC[26]="",,"|n"&R1C32&RC[26])&IF(RC[28]="",,"|n"&RC[28]) -> |n怪物精髓。吞噬时选取属性！ | AH94: 怪物精髓。吞噬时选取属性！
D95: [精髓]千年龙龟 | F95: =IF(RC[3]&RC[4]&RC[5]&RC[6]&RC[7]&RC[8]="",,R1C8)&IF(RC[3]="",,"|n"&R1C9&RC[3])&IF(RC[4]="",,"|n"&R1C10&RC[4])&IF(RC[5]="",,"|n"&R1C11&RC[5])&IF(RC[6]="",,"|n"&R1C12&RC[6])&IF(RC[7]="",,"|n"&R1C13&RC[7])&IF(RC[8]="",,"|n"&R1C14&RC[8])&IF(RC[10]&RC[11]&RC[12]&RC[13]&RC[14]&RC[15]&RC[16]&RC[17]&RC[18]&RC[19]&RC[20]&RC[21]&RC[22]="",,"|n"&R1C15)&IF(RC[10]="",,"|n"&R1C16&RC[10])&IF(RC[11]="",,"|n"&R1C17&RC[11])&IF(RC[12]="",,"|n"&R1C18&RC[12])&IF(RC[13]="",,"|n"&R1C19&RC[13])&IF(RC[14]="",,"|n"&R1C20&RC[14])&IF(RC[15]="",,"|n"&R1C21&RC[15])&IF(RC[16]="",,"|n"&R1C22&RC[16])&IF(RC[17]="",,"|n"&R1C23&RC[17])&IF(RC[18]="",,"|n"&R1C24&RC[18])&IF(RC[19]="",,"|n"&R1C25&RC[19])&IF(RC[20]="",,"|n"&R1C26&RC[20])&IF(RC[21]="",,"|n"&R1C27&RC[21])&IF(RC[22]="",,"|n"&R1C28&RC[22])&IF(RC[24]&RC[25]&RC[26]="",,"|n"&R1C29)&IF(RC[24]="",,"|n"&R1C30&RC[24])&IF(RC[25]="",,"|n"&R1C31&RC[25])&IF(RC[26]="",,"|n"&R1C32&RC[26])&IF(RC[28]="",,"|n"&RC[28]) -> |n怪物精髓。吞噬时选取属性！ | AH95: 怪物精髓。吞噬时选取属性！
D96: [精髓]成年巨龙 | F96: =IF(RC[3]&RC[4]&RC[5]&RC[6]&RC[7]&RC[8]="",,R1C8)&IF(RC[3]="",,"|n"&R1C9&RC[3])&IF(RC[4]="",,"|n"&R1C10&RC[4])&IF(RC[5]="",,"|n"&R1C11&RC[5])&IF(RC[6]="",,"|n"&R1C12&RC[6])&IF(RC[7]="",,"|n"&R1C13&RC[7])&IF(RC[8]="",,"|n"&R1C14&RC[8])&IF(RC[10]&RC[11]&RC[12]&RC[13]&RC[14]&RC[15]&RC[16]&RC[17]&RC[18]&RC[19]&RC[20]&RC[21]&RC[22]="",,"|n"&R1C15)&IF(RC[10]="",,"|n"&R1C16&RC[10])&IF(RC[11]="",,"|n"&R1C17&RC[11])&IF(RC[12]="",,"|n"&R1C18&RC[12])&IF(RC[13]="",,"|n"&R1C19&RC[13])&IF(RC[14]="",,"|n"&R1C20&RC[14])&IF(RC[15]="",,"|n"&R1C21&RC[15])&IF(RC[16]="",,"|n"&R1C22&RC[16])&IF(RC[17]="",,"|n"&R1C23&RC[17])&IF(RC[18]="",,"|n"&R1C24&RC[18])&IF(RC[19]="",,"|n"&R1C25&RC[19])&IF(RC[20]="",,"|n"&R1C26&RC[20])&IF(RC[21]="",,"|n"&R1C27&RC[21])&IF(RC[22]="",,"|n"&R1C28&RC[22])&IF(RC[24]&RC[25]&RC[26]="",,"|n"&R1C29)&IF(RC[24]="",,"|n"&R1C30&RC[24])&IF(RC[25]="",,"|n"&R1C31&RC[25])&IF(RC[26]="",,"|n"&R1C32&RC[26])&IF(RC[28]="",,"|n"&RC[28]) -> |n怪物精髓。吞噬时选取属性！ | AH96: 怪物精髓。吞噬时选取属性！
D97: [精髓]冰霜巨魔酋长 | F97: =IF(RC[3]&RC[4]&RC[5]&RC[6]&RC[7]&RC[8]="",,R1C8)&IF(RC[3]="",,"|n"&R1C9&RC[3])&IF(RC[4]="",,"|n"&R1C10&RC[4])&IF(RC[5]="",,"|n"&R1C11&RC[5])&IF(RC[6]="",,"|n"&R1C12&RC[6])&IF(RC[7]="",,"|n"&R1C13&RC[7])&IF(RC[8]="",,"|n"&R1C14&RC[8])&IF(RC[10]&RC[11]&RC[12]&RC[13]&RC[14]&RC[15]&RC[16]&RC[17]&RC[18]&RC[19]&RC[20]&RC[21]&RC[22]="",,"|n"&R1C15)&IF(RC[10]="",,"|n"&R1C16&RC[10])&IF(RC[11]="",,"|n"&R1C17&RC[11])&IF(RC[12]="",,"|n"&R1C18&RC[12])&IF(RC[13]="",,"|n"&R1C19&RC[13])&IF(RC[14]="",,"|n"&R1C20&RC[14])&IF(RC[15]="",,"|n"&R1C21&RC[15])&IF(RC[16]="",,"|n"&R1C22&RC[16])&IF(RC[17]="",,"|n"&R1C23&RC[17])&IF(RC[18]="",,"|n"&R1C24&RC[18])&IF(RC[19]="",,"|n"&R1C25&RC[19])&IF(RC[20]="",,"|n"&R1C26&RC[20])&IF(RC[21]="",,"|n"&R1C27&RC[21])&IF(RC[22]="",,"|n"&R1C28&RC[22])&IF(RC[24]&RC[25]&RC[26]="",,"|n"&R1C29)&IF(RC[24]="",,"|n"&R1C30&RC[24])&IF(RC[25]="",,"|n"&R1C31&RC[25])&IF(RC[26]="",,"|n"&R1C32&RC[26])&IF(RC[28]="",,"|n"&RC[28]) -> |n怪物精髓。吞噬时选取属性！ | AH97: 怪物精髓。吞噬时选取属性！
D98: [精髓]丛林巨魔酋长 | F98: =IF(RC[3]&RC[4]&RC[5]&RC[6]&RC[7]&RC[8]="",,R1C8)&IF(RC[3]="",,"|n"&R1C9&RC[3])&IF(RC[4]="",,"|n"&R1C10&RC[4])&IF(RC[5]="",,"|n"&R1C11&RC[5])&IF(RC[6]="",,"|n"&R1C12&RC[6])&IF(RC[7]="",,"|n"&R1C13&RC[7])&IF(RC[8]="",,"|n"&R1C14&RC[8])&IF(RC[10]&RC[11]&RC[12]&RC[13]&RC[14]&RC[15]&RC[16]&RC[17]&RC[18]&RC[19]&RC[20]&RC[21]&RC[22]="",,"|n"&R1C15)&IF(RC[10]="",,"|n"&R1C16&RC[10])&IF(RC[11]="",,"|n"&R1C17&RC[11])&IF(RC[12]="",,"|n"&R1C18&RC[12])&IF(RC[13]="",,"|n"&R1C19&RC[13])&IF(RC[14]="",,"|n"&R1C20&RC[14])&IF(RC[15]="",,"|n"&R1C21&RC[15])&IF(RC[16]="",,"|n"&R1C22&RC[16])&IF(RC[17]="",,"|n"&R1C23&RC[17])&IF(RC[18]="",,"|n"&R1C24&RC[18])&IF(RC[19]="",,"|n"&R1C25&RC[19])&IF(RC[20]="",,"|n"&R1C26&RC[20])&IF(RC[21]="",,"|n"&R1C27&RC[21])&IF(RC[22]="",,"|n"&R1C28&RC[22])&IF(RC[24]&RC[25]&RC[26]="",,"|n"&R1C29)&IF(RC[24]="",,"|n"&R1C30&RC[24])&IF(RC[25]="",,"|n"&R1C31&RC[25])&IF(RC[26]="",,"|n"&R1C32&RC[26])&IF(RC[28]="",,"|n"&RC[28]) -> |n怪物精髓。吞噬时选取属性！ | AH98: 怪物精髓。吞噬时选取属性！
D99: [精髓]娜迦暴君 | F99: =IF(RC[3]&RC[4]&RC[5]&RC[6]&RC[7]&RC[8]="",,R1C8)&IF(RC[3]="",,"|n"&R1C9&RC[3])&IF(RC[4]="",,"|n"&R1C10&RC[4])&IF(RC[5]="",,"|n"&R1C11&RC[5])&IF(RC[6]="",,"|n"&R1C12&RC[6])&IF(RC[7]="",,"|n"&R1C13&RC[7])&IF(RC[8]="",,"|n"&R1C14&RC[8])&IF(RC[10]&RC[11]&RC[12]&RC[13]&RC[14]&RC[15]&RC[16]&RC[17]&RC[18]&RC[19]&RC[20]&RC[21]&RC[22]="",,"|n"&R1C15)&IF(RC[10]="",,"|n"&R1C16&RC[10])&IF(RC[11]="",,"|n"&R1C17&RC[11])&IF(RC[12]="",,"|n"&R1C18&RC[12])&IF(RC[13]="",,"|n"&R1C19&RC[13])&IF(RC[14]="",,"|n"&R1C20&RC[14])&IF(RC[15]="",,"|n"&R1C21&RC[15])&IF(RC[16]="",,"|n"&R1C22&RC[16])&IF(RC[17]="",,"|n"&R1C23&RC[17])&IF(RC[18]="",,"|n"&R1C24&RC[18])&IF(RC[19]="",,"|n"&R1C25&RC[19])&IF(RC[20]="",,"|n"&R1C26&RC[20])&IF(RC[21]="",,"|n"&R1C27&RC[21])&IF(RC[22]="",,"|n"&R1C28&RC[22])&IF(RC[24]&RC[25]&RC[26]="",,"|n"&R1C29)&IF(RC[24]="",,"|n"&R1C30&RC[24])&IF(RC[25]="",,"|n"&R1C31&RC[25])&IF(RC[26]="",,"|n"&R1C32&RC[26])&IF(RC[28]="",,"|n"&RC[28]) -> |n怪物精髓。吞噬时选取属性！ | AH99: 怪物精髓。吞噬时选取属性！
D100: [精髓]黑暗巨魔酋长 | F100: =IF(RC[3]&RC[4]&RC[5]&RC[6]&RC[7]&RC[8]="",,R1C8)&IF(RC[3]="",,"|n"&R1C9&RC[3])&IF(RC[4]="",,"|n"&R1C10&RC[4])&IF(RC[5]="",,"|n"&R1C11&RC[5])&IF(RC[6]="",,"|n"&R1C12&RC[6])&IF(RC[7]="",,"|n"&R1C13&RC[7])&IF(RC[8]="",,"|n"&R1C14&RC[8])&IF(RC[10]&RC[11]&RC[12]&RC[13]&RC[14]&RC[15]&RC[16]&RC[17]&RC[18]&RC[19]&RC[20]&RC[21]&RC[22]="",,"|n"&R1C15)&IF(RC[10]="",,"|n"&R1C16&RC[10])&IF(RC[11]="",,"|n"&R1C17&RC[11])&IF(RC[12]="",,"|n"&R1C18&RC[12])&IF(RC[13]="",,"|n"&R1C19&RC[13])&IF(RC[14]="",,"|n"&R1C20&RC[14])&IF(RC[15]="",,"|n"&R1C21&RC[15])&IF(RC[16]="",,"|n"&R1C22&RC[16])&IF(RC[17]="",,"|n"&R1C23&RC[17])&IF(RC[18]="",,"|n"&R1C24&RC[18])&IF(RC[19]="",,"|n"&R1C25&RC[19])&IF(RC[20]="",,"|n"&R1C26&RC[20])&IF(RC[21]="",,"|n"&R1C27&RC[21])&IF(RC[22]="",,"|n"&R1C28&RC[22])&IF(RC[24]&RC[25]&RC[26]="",,"|n"&R1C29)&IF(RC[24]="",,"|n"&R1C30&RC[24])&IF(RC[25]="",,"|n"&R1C31&RC[25])&IF(RC[26]="",,"|n"&R1C32&RC[26])&IF(RC[28]="",,"|n"&RC[28]) -> |n怪物精髓。吞噬时选取属性！ | AH100: 怪物精髓。吞噬时选取属性！
D101: [精髓]火元素领主 | F101: =IF(RC[3]&RC[4]&RC[5]&RC[6]&RC[7]&RC[8]="",,R1C8)&IF(RC[3]="",,"|n"&R1C9&RC[3])&IF(RC[4]="",,"|n"&R1C10&RC[4])&IF(RC[5]="",,"|n"&R1C11&RC[5])&IF(RC[6]="",,"|n"&R1C12&RC[6])&IF(RC[7]="",,"|n"&R1C13&RC[7])&IF(RC[8]="",,"|n"&R1C14&RC[8])&IF(RC[10]&RC[11]&RC[12]&RC[13]&RC[14]&RC[15]&RC[16]&RC[17]&RC[18]&RC[19]&RC[20]&RC[21]&RC[22]="",,"|n"&R1C15)&IF(RC[10]="",,"|n"&R1C16&RC[10])&IF(RC[11]="",,"|n"&R1C17&RC[11])&IF(RC[12]="",,"|n"&R1C18&RC[12])&IF(RC[13]="",,"|n"&R1C19&RC[13])&IF(RC[14]="",,"|n"&R1C20&RC[14])&IF(RC[15]="",,"|n"&R1C21&RC[15])&IF(RC[16]="",,"|n"&R1C22&RC[16])&IF(RC[17]="",,"|n"&R1C23&RC[17])&IF(RC[18]="",,"|n"&R1C24&RC[18])&IF(RC[19]="",,"|n"&R1C25&RC[19])&IF(RC[20]="",,"|n"&R1C26&RC[20])&IF(RC[21]="",,"|n"&R1C27&RC[21])&IF(RC[22]="",,"|n"&R1C28&RC[22])&IF(RC[24]&RC[25]&RC[26]="",,"|n"&R1C29)&IF(RC[24]="",,"|n"&R1C30&RC[24])&IF(RC[25]="",,"|n"&R1C31&RC[25])&IF(RC[26]="",,"|n"&R1C32&RC[26])&IF(RC[28]="",,"|n"&RC[28]) -> |n怪物精髓。吞噬时选取属性！ | AH101: 怪物精髓。吞噬时选取属性！
D102: [精髓]风元素领主 | F102: =IF(RC[3]&RC[4]&RC[5]&RC[6]&RC[7]&RC[8]="",,R1C8)&IF(RC[3]="",,"|n"&R1C9&RC[3])&IF(RC[4]="",,"|n"&R1C10&RC[4])&IF(RC[5]="",,"|n"&R1C11&RC[5])&IF(RC[6]="",,"|n"&R1C12&RC[6])&IF(RC[7]="",,"|n"&R1C13&RC[7])&IF(RC[8]="",,"|n"&R1C14&RC[8])&IF(RC[10]&RC[11]&RC[12]&RC[13]&RC[14]&RC[15]&RC[16]&RC[17]&RC[18]&RC[19]&RC[20]&RC[21]&RC[22]="",,"|n"&R1C15)&IF(RC[10]="",,"|n"&R1C16&RC[10])&IF(RC[11]="",,"|n"&R1C17&RC[11])&IF(RC[12]="",,"|n"&R1C18&RC[12])&IF(RC[13]="",,"|n"&R1C19&RC[13])&IF(RC[14]="",,"|n"&R1C20&RC[14])&IF(RC[15]="",,"|n"&R1C21&RC[15])&IF(RC[16]="",,"|n"&R1C22&RC[16])&IF(RC[17]="",,"|n"&R1C23&RC[17])&IF(RC[18]="",,"|n"&R1C24&RC[18])&IF(RC[19]="",,"|n"&R1C25&RC[19])&IF(RC[20]="",,"|n"&R1C26&RC[20])&IF(RC[21]="",,"|n"&R1C27&RC[21])&IF(RC[22]="",,"|n"&R1C28&RC[22])&IF(RC[24]&RC[25]&RC[26]="",,"|n"&R1C29)&IF(RC[24]="",,"|n"&R1C30&RC[24])&IF(RC[25]="",,"|n"&R1C31&RC[25])&IF(RC[26]="",,"|n"&R1C32&RC[26])&IF(RC[28]="",,"|n"&RC[28]) -> |n怪物精髓。吞噬时选取属性！ | AH102: 怪物精髓。吞噬时选取属性！
D103: [精髓]水元素领主 | F103: =IF(RC[3]&RC[4]&RC[5]&RC[6]&RC[7]&RC[8]="",,R1C8)&IF(RC[3]="",,"|n"&R1C9&RC[3])&IF(RC[4]="",,"|n"&R1C10&RC[4])&IF(RC[5]="",,"|n"&R1C11&RC[5])&IF(RC[6]="",,"|n"&R1C12&RC[6])&IF(RC[7]="",,"|n"&R1C13&RC[7])&IF(RC[8]="",,"|n"&R1C14&RC[8])&IF(RC[10]&RC[11]&RC[12]&RC[13]&RC[14]&RC[15]&RC[16]&RC[17]&RC[18]&RC[19]&RC[20]&RC[21]&RC[22]="",,"|n"&R1C15)&IF(RC[10]="",,"|n"&R1C16&RC[10])&IF(RC[11]="",,"|n"&R1C17&RC[11])&IF(RC[12]="",,"|n"&R1C18&RC[12])&IF(RC[13]="",,"|n"&R1C19&RC[13])&IF(RC[14]="",,"|n"&R1C20&RC[14])&IF(RC[15]="",,"|n"&R1C21&RC[15])&IF(RC[16]="",,"|n"&R1C22&RC[16])&IF(RC[17]="",,"|n"&R1C23&RC[17])&IF(RC[18]="",,"|n"&R1C24&RC[18])&IF(RC[19]="",,"|n"&R1C25&RC[19])&IF(RC[20]="",,"|n"&R1C26&RC[20])&IF(RC[21]="",,"|n"&R1C27&RC[21])&IF(RC[22]="",,"|n"&R1C28&RC[22])&IF(RC[24]&RC[25]&RC[26]="",,"|n"&R1C29)&IF(RC[24]="",,"|n"&R1C30&RC[24])&IF(RC[25]="",,"|n"&R1C31&RC[25])&IF(RC[26]="",,"|n"&R1C32&RC[26])&IF(RC[28]="",,"|n"&RC[28]) -> |n怪物精髓。吞噬时选取属性！ | AH103: 怪物精髓。吞噬时选取属性！
D104: [精髓]土元素领主 | F104: =IF(RC[3]&RC[4]&RC[5]&RC[6]&RC[7]&RC[8]="",,R1C8)&IF(RC[3]="",,"|n"&R1C9&RC[3])&IF(RC[4]="",,"|n"&R1C10&RC[4])&IF(RC[5]="",,"|n"&R1C11&RC[5])&IF(RC[6]="",,"|n"&R1C12&RC[6])&IF(RC[7]="",,"|n"&R1C13&RC[7])&IF(RC[8]="",,"|n"&R1C14&RC[8])&IF(RC[10]&RC[11]&RC[12]&RC[13]&RC[14]&RC[15]&RC[16]&RC[17]&RC[18]&RC[19]&RC[20]&RC[21]&RC[22]="",,"|n"&R1C15)&IF(RC[10]="",,"|n"&R1C16&RC[10])&IF(RC[11]="",,"|n"&R1C17&RC[11])&IF(RC[12]="",,"|n"&R1C18&RC[12])&IF(RC[13]="",,"|n"&R1C19&RC[13])&IF(RC[14]="",,"|n"&R1C20&RC[14])&IF(RC[15]="",,"|n"&R1C21&RC[15])&IF(RC[16]="",,"|n"&R1C22&RC[16])&IF(RC[17]="",,"|n"&R1C23&RC[17])&IF(RC[18]="",,"|n"&R1C24&RC[18])&IF(RC[19]="",,"|n"&R1C25&RC[19])&IF(RC[20]="",,"|n"&R1C26&RC[20])&IF(RC[21]="",,"|n"&R1C27&RC[21])&IF(RC[22]="",,"|n"&R1C28&RC[22])&IF(RC[24]&RC[25]&RC[26]="",,"|n"&R1C29)&IF(RC[24]="",,"|n"&R1C30&RC[24])&IF(RC[25]="",,"|n"&R1C31&RC[25])&IF(RC[26]="",,"|n"&R1C32&RC[26])&IF(RC[28]="",,"|n"&RC[28]) -> |n怪物精髓。吞噬时选取属性！ | AH104: 怪物精髓。吞噬时选取属性！