Sheet: Sheet1
A1: TYPE | B1: id | C1: oid | D1: u_index | E1: _name | F1: unam | G1: upro | H1: unsf | I1: ua1c | J1: udef | K1: ua1b | L1: ubba | M1: ulba | N1: uhpm | O1: ustr | P1: uagi | Q1: uint | R1: usca | S1: umdl | T1: uabi | U1: uclr | V1: uclb | W1: uclg | X1: u_code | Y1: udty | Z1: ua1t | AA1: ugol | AB1: ustp | AC1: uagp | AD1: uinp | AE1: uico | AF1: ua1s | AG1: ua1d | AH1: util | AI1: uspe | AJ1: ucam | AK1: uine | AL1: udro | AM1: uhos | AN1: uuch | AO1: utss | AP1: udaa | AQ1: uhab | AR1: urqc | AS1: urq1 | AT1: urq2 | AU1: urq3 | AV1: urq4 | AW1: urq5 | AX1: urq6 | AY1: urq7 | AZ1: urq8 | BA1: ureq | BB1: urqa | BC1: udep | BD1: urva | BE1: urev | BF1: ures | BG1: upgr | BH1: usei | BI1: useu | BJ1: utra | BK1: umki | BL1: uupt | BM1: ubui | BN1: upar | BO1: upap | BP1: upaw | BQ1: uabr | BR1: uabt | BS1: upat | BT1: ucol | BU1: usnd | BV1: ubsl | BW1: ursl | BX1: umsl | BY1: ulfo | BZ1: ulfi | CA1: upru | CB1: ides | CC1: uawt | CD1: utpr | CE1: utip | CF1: utub | CG1: ucun | CH1: ucut | CI1: uhot | CJ1: uscb | CK1: ussc | CL1: uslz | CM1: usew | CN1: uocc | CO1: umxp | CP1: umxr | CQ1: uisz | CR1: uimz | CS1: ulpx | CT1: ulpy | CU1: ulsz | CV1: ulpz | CW1: ushu | CX1: ushb | CY1: uver | CZ1: ushh | DA1: ushw | DB1: ushx | DC1: ushy | DD1: ushr | DE1: uubs | DF1: ubpx | DG1: ubpy | DH1: ucua | DI1: ussi | DJ1: utaa | DK1: udtm | DL1: uspa | DM1: uaap | DN1: uani | DO1: ualp | DP1: ubpr | DQ1: ucpt | DR1: ucbs | DS1: uwal | DT1: uble | DU1: urun | DV1: uprw | DW1: uori | DX1: utcc | DY1: utco | DZ1: uept | EA1: uerd | EB1: ufrd | EC1: ulos | ED1: umvt | EE1: umvh | EF1: umvs | EG1: umvr | EH1: umas | EI1: umis | EJ1: umvf | EK1: urpr | EL1: urpp | EM1: urpo | EN1: urpg | EO1: uacq | EP1: uamn | EQ1: udup | ER1: udea | ES1: uarm | ET1: utar | EU1: ua1m | EV1: ua1z | EW1: ua1t | EX1: uma1 | EY1: umh1 | EZ1: ua1w | FA1: ua1g | FB1: ucs1 | FC1: usr1 | FD1: usd1 | FE1: udl1 | FF1: uwu1 | FG1: ubs1 | FH1: udp1 | FI1: ua1r | FJ1: urb1 | FK1: udu1 | FL1: ua1p | FM1: ua1f | FN1: utc1 | FO1: uqd1 | FP1: ua1q | FQ1: uhd1 | FR1: ua1h | FS1: ua2m | FT1: ua2z | FU1: ua2t | FV1: uma2 | FW1: umh2 | FX1: ua2w | FY1: ua2g | FZ1: ucs2 | GA1: usr2 | GB1: usd2 | GC1: udl2 | GD1: uwu2 | GE1: ubs2 | GF1: udp2 | GG1: ua2r | GH1: urb2 | GI1: ua2b | GJ1: ua2s | GK1: ua2d | GL1: udu2 | GM1: ua2p | GN1: ua2c | GO1: ua2f | GP1: utc2 | GQ1: uqd2 | GR1: ua2q | GS1: uhd2 | GT1: ua2h | GU1: uaen | GV1: ulev | GW1: urac | GX1: utyp | GY1: ubdg | GZ1: ulum | HA1: ubld | HB1: ubsi | HC1: ubdi | HD1: ugor | HE1: ulur | HF1: urtm | HG1: ulbs | HH1: ulbd | HI1: umpm | HJ1: umpr | HK1: umpi | HL1: uhpr | HM1: uhrt | HN1: ufma | HO1: ufoo | HP1: usst | HQ1: usrg | HR1: usid | HS1: usin | HT1: ucar | HU1: usma | HV1: uhom | HW1: uhhm | HX1: uhhb | HY1: uhhd | HZ1: upra | IA1: unbr | IB1: unbm | IC1: upoi | ID1: upri | IE1: ufor | IF1: ufle | IG1: ucbo | IH1: uibo | II1: usle
A2: COMMENT | B2: 单位ID | C2: 单位模板ID | D2: index | F2: 文本 - 名字 | G2: 文本 - 称谓 | H2: 文本 - 名字 - 编辑器后缀 | I2: 战斗 - 攻击 1 - 攻击间隔 | J2: 战斗 - 基础护甲 | K2: 战斗 - 攻击 1 - 基础伤害 | L2: 状态 - 黄金奖励 - 基础值 | M2: 状态 - 木材奖励 - 基础值 | N2: 状态 - 生命最大值 | O2: 状态 - 英雄 - 初始力量 | P2: 状态 - 英雄 - 初始敏捷 | Q2: 状态 - 英雄 - 初始智力 | R2: 显示 - 模型缩放 | S2: 显示 - 模型文件 | T2: 技能 - 普通 | U2: 显示 - 颜色值(红) | V2: 显示 - 颜色值(蓝) | W2: 显示 - 颜色值(绿) | X2: code | Y2: 战斗 - 护甲类型 | Z2: 战斗 - 攻击 1 - 攻击类型 | AA2: 状态 - 黄金消耗 | AB2: 状态 - 英雄 - 每等级提升力量 | AC2: 状态 - 英雄 - 每等级提升敏捷 | AD2: 状态 - 英雄 - 每等级提升智力 | AE2: 显示 - 图标 - 游戏界面 | AF2: 战斗 - 攻击 1 - 伤害骰子面数 | AG2: 战斗 - 攻击 1 - 伤害骰子数量 | AH2: 编辑器 - 地形设置 | AI2: 编辑器 - 分类 - 特殊 | AJ2: 编辑器 - 分类 - 战役 | AK2: 编辑器 - 可在编辑器中放置 | AL2: 编辑器 - 可设置死亡掉落物品 | AM2: 编辑器 - 可作为中立敌对显示 | AN2: 编辑器 - 使用点击帮助 | AO2: 编辑器 - 有地形指定数据 | AP2: 技能 - 默认主动技能 | AQ2: 技能 - 英雄 | AR2: 科技树 - 需求 - 使用等级数 | AS2: 科技树 - 需求 - 等级 2 | AT2: 科技树 - 需求 - 等级 3 | AU2: 科技树 - 需求 - 等级 4 | AV2: 科技树 - 需求 - 等级 5 | AW2: 科技树 - 需求 - 等级 6 | AX2: 科技树 - 需求 - 等级 7 | AY2: 科技树 - 需求 - 等级 8 | AZ2: 科技树 - 需求 - 等级 9 | BA2: 科技树 - 需求 | BB2: 科技树 - 需求值 | BC2: 科技树 - 从属等价物 | BD2: 科技树 - 指定复活点 | BE2: 科技树 - 可重生阵亡英雄 | BF2: 科技树 - 可研究项目 | BG2: 科技树 - 使用科技 | BH2: 科技树 - 售出物品 | BI2: 科技树 - 售出单位 | BJ2: 科技树 - 训练单位 | BK2: 科技树 - 制造物品 | BL2: 科技树 - 建筑升级 | BM2: 科技树 - 可建造建筑 | BN2: 路径 - 放置不允许 | BO2: 路径 - 放置要求 | BP2: 路径 - 放置要求距离水的范围 | BQ2: 路径 - AI放置范围 | BR2: 路径 - AI放置类型 | BS2: 路径 - 路径纹理 | BT2: 路径 - 碰撞体积 | BU2: 声音 - 单位声音设置 | BV2: 声音 - 建筑 | BW2: 声音 - 随机 | BX2: 声音 - 移动 | BY2: 声音 - 循环淡出率 | BZ2: 声音 - 循环淡入率 | CA2: 文本 - 称谓数量 | CB2: 文本 - 说明 | CC2: 文本 - 提示工具 - 唤醒 | CD2: 文本 - 提示工具 - 重生 | CE2: 文本 - 提示工具 - 基础 | CF2: 文本 - 提示工具 - 扩展 | CG2: 文本 - 魔法升级名字 | CH2: 文本 - 魔法升级说明 | CI2: 文本 - 热键 | CJ2: 显示 - 缩放投射物 | CK2: 显示 - 选择缩放 | CL2: 显示 - 选择圈高度 | CM2: 显示 - 选择圈在水面上 | CN2: 显示 - 闭塞高度 | CO2: 显示 - X轴最大旋转角度(弧度) | CP2: 显示 - Y轴最大旋转角度(弧度) | CQ2: 显示 - 弹射碰撞偏移 - Z (深水) | CR2: 显示 - 弹射碰撞偏移 - Z | CS2: 显示 - 弹射偏移 - X | CT2: 显示 - 弹射偏移 - Y | CU2: 显示 - 弹射偏移 - Z (深水) | CV2: 显示 - 弹射偏移 - Z | CW2: 显示 - 阴影图像(单位) | CX2: 显示 - 阴影图像(建筑) | CY2: 显示 - 模型文件 - 版本 | CZ2: 显示 - 阴影图像 - 高度 | DA2: 显示 - 阴影图像 - 宽度 | DB2: 显示 - 阴影图像 - X轴偏移 | DC2: 显示 - 阴影图像 - Y轴偏移 | DD2: 显示 - 深水区有阴影 | DE2: 显示 - 建筑地面纹理 | DF2: 显示 - 按钮位置(X) | DG2: 显示 - 按钮位置(Y) | DH2: 显示 - 魔法升级图标 | DI2: 显示 - 图标 - 计分屏 | DJ2: 显示 - 目标效果 | DK2: 显示 - 死亡时间(秒) | DL2: 显示 - 特殊效果 | DM2: 显示 - 要求动画名 - 附加动画 | DN2: 显示 - 要求动画名 | DO2: 显示 - 要求附加动画链接名 | DP2: 显示 - 要求骨骼名 | DQ2: 显示 - 动画 - 魔法施放点 | DR2: 显示 - 动画 - 魔法施放回复 | DS2: 显示 - 动画 - 行走速度 | DT2: 显示 - 动画 - 混合时间(秒) | DU2: 显示 - 动画 - 跑步速度 | DV2: 显示 - 动画 - 转向角度 | DW2: 显示 - 动画 - 转向补正 | DX2: 显示 - 队伍颜色 - 允许自定义 | DY2: 显示 - 队伍颜色 | DZ2: 显示 - 高度变化 - 采样点数量 | EA2: 显示 - 高度变化 - 采样范围 | EB2: 显示 - 战争迷雾 - 采样范围 | EC2: 显示 - 不可见区域显示单位 | ED2: 移动 - 类型 | EE2: 移动 - 高度 | EF2: 移动 - 基础速度 | EG2: 移动 - 转身速度 | EH2: 移动 - 最大速度 | EI2: 移动 - 最小速度 | EJ2: 移动 - 最小高度 | EK2: 移动 - 组群分离 - 优先权 | EL2: 移动 - 组群分离 - 参数 | EM2: 移动 - 组群分离 - 允许 | EN2: 移动 - 组群分离 - 组号 | EO2: 战斗 - 主动攻击范围 | EP2: 战斗 - 最小攻击范围 | EQ2: 战斗 - 防御升级奖励 | ER2: 战斗 - 死亡类型 | ES2: 战斗 - 装甲类型 | ET2: 战斗 - 作为目标类型 | EU2: 战斗 - 攻击 1 - 投射物图像 | EV2: 战斗 - 攻击 1 - 弹射速率 | EW2: 战斗 - 攻击 1 - 攻击类型 | EX2: 战斗 - 攻击 1 - 射弹弧度 | EY2: 战斗 - 攻击 1 - 射弹自导允许 | EZ2: 战斗 - 攻击 1 - 武器类型 | FA2: 战斗 - 攻击 1 - 目标允许 | FB2: 战斗 - 攻击 1 - 武器声音 | FC2: 战斗 - 攻击 1 - 穿透伤害范围 | FD2: 战斗 - 攻击 1 - 穿透伤害距离 | FE2: 战斗 - 攻击 1 - 伤害衰减参数 | FF2: 战斗 - 攻击 1 - 显示UI | FG2: 战斗 - 攻击 1 - 动画回复点 | FH2: 战斗 - 攻击 1 - 动画伤害点 | FI2: 战斗 - 攻击 1 - 攻击范围 | FJ2: 战斗 - 攻击 1 - 攻击范围缓冲 | FK2: 战斗 - 攻击 1 - 伤害升级奖励 | FL2: 战斗 - 攻击 1 - 范围影响目标 | FM2: 战斗 - 攻击 1 - 全伤害范围 | FN2: 战斗 - 攻击 1 - 最大目标数 | FO2: 战斗 - 攻击 1 - 小伤害参数 | FP2: 战斗 - 攻击 1 - 小伤害范围 | FQ2: 战斗 - 攻击 1 - 中伤害参数 | FR2: 战斗 - 攻击 1 - 中伤害范围 | FS2: 战斗 - 攻击 2 - 投射物图像 | FT2: 战斗 - 攻击 2 - 弹射速率 | FU2: 战斗 - 攻击 2 - 攻击类型 | FV2: 战斗 - 攻击 2 - 射弹弧度 | FW2: 战斗 - 攻击 2 - 射弹自导允许 | FX2: 战斗 - 攻击 2 - 武器类型 | FY2: 战斗 - 攻击 2 - 目标允许 | FZ2: 战斗 - 攻击 2 - 武器声音 | GA2: 战斗 - 攻击 2 - 穿透伤害范围 | GB2: 战斗 - 攻击 2 - 穿透伤害距离 | GC2: 战斗 - 攻击 2 - 伤害衰减参数 | GD2: 战斗 - 攻击 2 - 显示UI | GE2: 战斗 - 攻击 2 - 动画回复点 | GF2: 战斗 - 攻击 2 - 动画伤害点 | GG2: 战斗 - 攻击 2 - 攻击范围 | GH2: 战斗 - 攻击 2 - 攻击范围缓冲 | GI2: 战斗 - 攻击 2 - 基础伤害 | GJ2: 战斗 - 攻击 2 - 伤害骰子面数 | GK2: 战斗 - 攻击 2 - 伤害骰子数量 | GL2: 战斗 - 攻击 2 - 伤害升级奖励 | GM2: 战斗 - 攻击 2 - 范围影响目标 | GN2: 战斗 - 攻击 2 - 攻击间隔 | GO2: 战斗 - 攻击 2 - 全伤害范围 | GP2: 战斗 - 攻击 2 - 最大目标数 | GQ2: 战斗 - 攻击 2 - 小伤害参数 | GR2: 战斗 - 攻击 2 - 小伤害范围 | GS2: 战斗 - 攻击 2 - 中伤害参数 | GT2: 战斗 - 攻击 2 - 中伤害范围 | GU2: 战斗 - 允许攻击模式 | GV2: 状态 - 等级 | GW2: 状态 - 种族 | GX2: 状态 - 单位类别 | GY2: 状态 - 是一个建筑 | GZ2: 状态 - 木材消耗 | HA2: 状态 - 建造时间 | HB2: 状态 - 黄金奖励 - 骰子面数 | HC2: 状态 - 黄金奖励 - 骰子数量 | HD2: 状态 - 修理黄金消耗 | HE2: 状态 - 修理木材消耗 | HF2: 状态 - 修理时间 | HG2: 状态 - 木材奖励 - 骰子面数 | HH2: 状态 - 木材奖励 - 骰子数量 | HI2: 状态 - 魔法最大值 | HJ2: 状态 - 魔法回复 | HK2: 状态 - 魔法初始数量 | HL2: 状态 - 生命回复 | HM2: 状态 - 生命回复类型 | HN2: 状态 - 提供人口 | HO2: 状态 - 占用人口 | HP2: 状态 - 雇佣开始时间 | HQ2: 状态 - 雇佣时间间隔 | HR2: 状态 - 视野范围(白天) | HS2: 状态 - 视野范围(夜晚) | HT2: 状态 - 运输尺寸 | HU2: 状态 - 最大库存量 | HV2: 状态 - 隐藏小地图显示 | HW2: 状态 - 英雄 - 隐藏小地图英雄显示 | HX2: 状态 - 英雄 - 隐藏英雄栏图标 | HY2: 状态 - 英雄 - 隐藏英雄死亡信息 | HZ2: 状态 - 英雄 - 主要属性 | IA2: 状态 - 中立建筑 - 可作为随机建筑 | IB2: 状态 - 中立建筑 - 显示小地图标记 | IC2: 状态 - 单位附加值 | ID2: 状态 - 编队优先权 | IE2: 状态 - 队形排列 | IF2: 状态 - 可以逃跑 | IG2: 状态 - 能被其他建筑建造 | IH2: 状态 - 能建造在其他建筑上 | II2: 状态 - 允许睡眠
A3: OBJECT | B3: h50A | C3: hfoo | D3: 1 | E3: ="[副本 - "&RC[3]&"] " -> [副本 - 阿拉希盆地] | F3: 盗贼 | H3: 阿拉希盆地 | I3: 0.5 | J3: =INT(RC[4]/50) -> 1581 | K3: =INT(RC[3]/12) -> 6588 | L3: 0 | M3: 0 | N3: = INT(25000*RC[-10]*POWER(10,0.5*RC[-10])) -> 79056 | R3: 0.8 | S3: units\creeps\Bandit\Bandit | X3: ="let _hx"&RC[-20]&" = new Challenge('L30"&RC[-20]&"','h30"&RC[-20]&"',20)" -> let _hx1 = new Challenge('L301','h301',20) | Y3: normal | AA3: 2 | BT3: 32 | BU3: Rifleman | CI3: null | CK3: 1 | DF3: 0 | DG3: 0 | DK3: 1 | DT3: 0.1 | DV3: 1 | DW3: 1 | EF3: 390 | EG3: 2.8 | FA3: ground,air | FB3: null | FG3: 0.2 | FH3: 0.1 | FK3: 0 | GW3: nightelf | GZ3: 0 | HA3: 0 | HB3: 0 | HC3: 0 | HD3: 0 | HE3: 0 | HF3: 0 | HJ3: 0 | HL3: 0 | HM3: null | HO3: 0 | HP3: 0 | HQ3: 0 | HS3: 1800 | HT3: 0 | HU3: 0 | HV3: 1 | IF3: 0
A4: OBJECT | B4: h50B | C4: hfoo | D4: 1 | E4: ="[副本 - "&RC[3]&"] " -> [副本 - 阿拉希盆地] | F4: 鱼人 | H4: 阿拉希盆地 | I4: 0.5 | J4: =INT(RC[4]/50) -> 1818 | K4: =INT(RC[3]/12) -> 7576 | L4: 0 | M4: 0 | N4: =INT(R[-1]C*1.15) -> 90914 | R4: 0.8 | S4: units\creeps\MurlocMutant\MurlocMutant | X4: ="let _hx"&RC[-20]&" = new Challenge('L30"&RC[-20]&"','h30"&RC[-20]&"',20)" -> let _hx1 = new Challenge('L301','h301',20) | Y4: normal | AA4: 2 | BT4: 32 | BU4: Rifleman | CI4: null | CK4: 1 | DF4: 0 | DG4: 0 | DK4: 1 | DT4: 0.1 | DV4: 1 | DW4: 1 | EF4: 390 | EG4: 2.8 | FA4: ground,air | FB4: null | FG4: 0.2 | FH4: 0.1 | FK4: 0 | GW4: nightelf | GZ4: 0 | HA4: 0 | HB4: 0 | HC4: 0 | HD4: 0 | HE4: 0 | HF4: 0 | HJ4: 0 | HL4: 0 | HM4: null | HO4: 0 | HP4: 0 | HQ4: 0 | HS4: 1800 | HT4: 0 | HU4: 0 | HV4: 1 | IF4: 0
A5: OBJECT | B5: h50C | C5: hfoo | D5: 1 | E5: ="[副本 - "&RC[3]&"] " -> [副本 - 阿拉希盆地] | F5: 森林狼 | H5: 阿拉希盆地 | I5: 0.5 | J5: =INT(RC[4]/50) -> 2091 | K5: =INT(RC[3]/12) -> 8712 | L5: 0 | M5: 0 | N5: =INT(R[-1]C*1.15) -> 104551 | R5: 1 | S5: units\creeps\TimberWolf\TimberWolf | X5: ="let _hx"&RC[-20]&" = new Challenge('L30"&RC[-20]&"','h30"&RC[-20]&"',20)" -> let _hx1 = new Challenge('L301','h301',20) | Y5: normal | AA5: 2 | BT5: 32 | BU5: Rifleman | CI5: null | CK5: 1 | DF5: 0 | DG5: 0 | DK5: 1 | DT5: 0.1 | DV5: 1 | DW5: 1 | EF5: 390 | EG5: 2.8 | FA5: ground,air | FB5: null | FG5: 0.2 | FH5: 0.1 | FK5: 0 | GW5: nightelf | GZ5: 0 | HA5: 0 | HB5: 0 | HC5: 0 | HD5: 0 | HE5: 0 | HF5: 0 | HJ5: 0 | HL5: 0 | HM5: null | HO5: 0 | HP5: 0 | HQ5: 0 | HS5: 1800 | HT5: 0 | HU5: 0 | HV5: 1 | IF5: 0
A6: OBJECT | B6: h50D | C6: hfoo | D6: 1 | E6: ="[副本 - "&RC[3]&"] " -> [副本 - 阿拉希盆地] | F6: 豪猪 | H6: 阿拉希盆地 | I6: 0.5 | J6: =INT(RC[4]/50) -> 2404 | K6: =INT(RC[3]/12) -> 10019 | L6: 0 | M6: 0 | N6: =INT(R[-1]C*1.15) -> 120233 | R6: 1 | S6: units\creeps\Bristleback\Bristleback | X6: ="let _hx"&RC[-20]&" = new Challenge('L30"&RC[-20]&"','h30"&RC[-20]&"',20)" -> let _hx1 = new Challenge('L301','h301',20) | Y6: normal | AA6: 2 | BT6: 32 | BU6: Rifleman | CI6: null | CK6: 1 | DF6: 0 | DG6: 0 | DK6: 1 | DT6: 0.1 | DV6: 1 | DW6: 1 | EF6: 390 | EG6: 2.8 | FA6: ground,air | FB6: null | FG6: 0.2 | FH6: 0.1 | FK6: 0 | GW6: nightelf | GZ6: 0 | HA6: 0 | HB6: 0 | HC6: 0 | HD6: 0 | HE6: 0 | HF6: 0 | HJ6: 0 | HL6: 0 | HM6: null | HO6: 0 | HP6: 0 | HQ6: 0 | HS6: 1800 | HT6: 0 | HU6: 0 | HV6: 1 | IF6: 0
A7: OBJECT | B7: h50E | C7: hfoo | D7: 2 | E7: ="[副本 - "&RC[3]&"] " -> [副本 - 死亡矿井] | F7: 达拉内尔信徒 | H7: 死亡矿井 | I7: 0.45 | J7: =INT(RC[4]/45) -> 11111 | K7: =INT(RC[3]/12) -> 41666 | L7: 0 | M7: 0 | N7: = INT(25000*RC[-10]*POWER(10,0.5*RC[-10])) -> 500000 | R7: 1 | S7: units\other\DranaiWhite\DranaiWhite | X7: ="let _hx"&RC[-20]&" = new Challenge('L30"&RC[-20]&"','h30"&RC[-20]&"',20)" -> let _hx2 = new Challenge('L302','h302',20) | Y7: normal | AA7: 4 | BT7: 32 | BU7: Rifleman | CI7: null | CK7: 1 | DF7: 0 | DG7: 0 | DK7: 1 | DT7: 0.1 | DV7: 1 | DW7: 1 | EF7: 390 | EG7: 2.8 | FA7: ground,air | FB7: null | FG7: 0.2 | FH7: 0.1 | FK7: 0 | GW7: nightelf | GZ7: 0 | HA7: 0 | HB7: 0 | HC7: 0 | HD7: 0 | HE7: 0 | HF7: 0 | HJ7: 0 | HL7: 0 | HM7: null | HO7: 0 | HP7: 0 | HQ7: 0 | HS7: 1800 | HT7: 0 | HU7: 0 | HV7: 1 | IF7: 0
A8: OBJECT | B8: h50F | C8: hfoo | D8: 2 | E8: ="[副本 - "&RC[3]&"] " -> [副本 - 死亡矿井] | F8: 食人魔 | H8: 死亡矿井 | I8: 0.45 | J8: =INT(RC[4]/30) -> 20000 | K8: =INT(RC[3]/12) -> 50000 | L8: 0 | M8: 0 | N8: =INT(R[-1]C*1.2) -> 600000 | R8: 0.8 | S8: units\creeps\Ogre\Ogre | X8: ="let _hx"&RC[-20]&" = new Challenge('L30"&RC[-20]&"','h30"&RC[-20]&"',20)" -> let _hx2 = new Challenge('L302','h302',20) | Y8: normal | AA8: 4 | BT8: 32 | BU8: Rifleman | CI8: null | CK8: 1 | DF8: 0 | DG8: 0 | DK8: 1 | DT8: 0.1 | DV8: 1 | DW8: 1 | EF8: 390 | EG8: 2.8 | FA8: ground,air | FB8: null | FG8: 0.2 | FH8: 0.1 | FK8: 0 | GW8: nightelf | GZ8: 0 | HA8: 0 | HB8: 0 | HC8: 0 | HD8: 0 | HE8: 0 | HF8: 0 | HJ8: 0 | HL8: 0 | HM8: null | HO8: 0 | HP8: 0 | HQ8: 0 | HS8: 1800 | HT8: 0 | HU8: 0 | HV8: 1 | IF8: 0
A9: OBJECT | B9: h50G | C9: hfoo | D9: 2 | E9: ="[副本 - "&RC[3]&"] " -> [副本 - 死亡矿井] | F9: 狗头人 | H9: 死亡矿井 | I9: 0.45 | J9: =INT(RC[4]/30) -> 24000 | K9: =INT(RC[3]/12) -> 60000 | L9: 0 | M9: 0 | N9: =INT(R[-1]C*1.2) -> 720000 | S9: units\creeps\Kobold\Kobold | X9: ="let _hx"&RC[-20]&" = new Challenge('L30"&RC[-20]&"','h30"&RC[-20]&"',20)" -> let _hx2 = new Challenge('L302','h302',20) | Y9: normal | AA9: 4 | BT9: 32 | BU9: Rifleman | CI9: null | CK9: 1 | DF9: 0 | DG9: 0 | DK9: 1 | DT9: 0.1 | DV9: 1 | DW9: 1 | EF9: 390 | EG9: 2.8 | FA9: ground,air | FB9: null | FG9: 0.2 | FH9: 0.1 | FK9: 0 | GW9: nightelf | GZ9: 0 | HA9: 0 | HB9: 0 | HC9: 0 | HD9: 0 | HE9: 0 | HF9: 0 | HJ9: 0 | HL9: 0 | HM9: null | HO9: 0 | HP9: 0 | HQ9: 0 | HS9: 1800 | HT9: 0 | HU9: 0 | HV9: 1 | IF9: 0
A10: OBJECT | B10: h50H | C10: hfoo | D10: 2 | E10: ="[副本 - "&RC[3]&"] " -> [副本 - 死亡矿井] | F10: 矿井蝎子 | H10: 死亡矿井 | I10: 0.45 | J10: =INT(RC[4]/30) -> 28800 | K10: =INT(RC[3]/12) -> 72000 | L10: 0 | M10: 0 | N10: =INT(R[-1]C*1.2) -> 864000 | S10: Units\Creeps\ArchnathidGreen\ArchnathidGreen | X10: ="let _hx"&RC[-20]&" = new Challenge('L30"&RC[-20]&"','h30"&RC[-20]&"',20)" -> let _hx2 = new Challenge('L302','h302',20) | Y10: normal | AA10: 4 | BT10: 32 | BU10: Rifleman | CI10: null | CK10: 1 | DF10: 0 | DG10: 0 | DK10: 1 | DT10: 0.1 | DV10: 1 | DW10: 1 | EF10: 390 | EG10: 2.8 | FA10: ground,air | FB10: null | FG10: 0.2 | FH10: 0.1 | FK10: 0 | GW10: nightelf | GZ10: 0 | HA10: 0 | HB10: 0 | HC10: 0 | HD10: 0 | HE10: 0 | HF10: 0 | HJ10: 0 | HL10: 0 | HM10: null | HO10: 0 | HP10: 0 | HQ10: 0 | HS10: 1800 | HT10: 0 | HU10: 0 | HV10: 1 | IF10: 0
A11: OBJECT | B11: h50I | C11: hfoo | D11: 3 | E11: ="[副本 - "&RC[3]&"] " -> [副本 - 熔火之心] | F11: 熔岩怪物 | H11: 熔火之心 | I11: 0.4 | J11: =INT(RC[4]/30) -> 79056 | K11: =INT(RC[3]/12) -> 197642 | L11: 0 | M11: 0 | N11: = INT(25000*RC[-10]*POWER(10,0.5*RC[-10])) -> 2371708 | S11: Units\Creeps\LavaSpawn\LavaSpawn | X11: ="let _hx"&RC[-20]&" = new Challenge('L30"&RC[-20]&"','h30"&RC[-20]&"',20)" -> let _hx3 = new Challenge('L303','h303',20) | Y11: normal | AA11: 6 | BT11: 32 | BU11: Rifleman | CI11: null | CK11: 1 | DF11: 0 | DG11: 0 | DK11: 1 | DT11: 0.1 | DV11: 1 | DW11: 1 | EF11: 390 | EG11: 2.8 | FA11: ground,air | FB11: null | FG11: 0.2 | FH11: 0.1 | FK11: 0 | GW11: nightelf | GZ11: 0 | HA11: 0 | HB11: 0 | HC11: 0 | HD11: 0 | HE11: 0 | HF11: 0 | HJ11: 0 | HL11: 0 | HM11: null | HO11: 0 | HP11: 0 | HQ11: 0 | HS11: 1800 | HT11: 0 | HU11: 0 | HV11: 1 | IF11: 0
A12: OBJECT | B12: h50J | C12: hfoo | D12: 3 | E12: ="[副本 - "&RC[3]&"] " -> [副本 - 熔火之心] | F12: 火焰蜥蜴 | H12: 熔火之心 | I12: 0.4 | J12: =INT(RC[4]/30) -> 97240 | K12: =INT(RC[3]/12) -> 243100 | L12: 0 | M12: 0 | N12: =INT(R[-1]C*1.23) -> 2917200 | S12: units\creeps\ThunderLizardSalamander\ThunderLizardSalamander | X12: ="let _hx"&RC[-20]&" = new Challenge('L30"&RC[-20]&"','h30"&RC[-20]&"',20)" -> let _hx3 = new Challenge('L303','h303',20) | Y12: normal | AA12: 6 | BT12: 32 | BU12: Rifleman | CI12: null | CK12: 1 | DF12: 0 | DG12: 0 | DK12: 1 | DT12: 0.1 | DV12: 1 | DW12: 1 | EF12: 390 | EG12: 2.8 | FA12: ground,air | FB12: null | FG12: 0.2 | FH12: 0.1 | FK12: 0 | GW12: nightelf | GZ12: 0 | HA12: 0 | HB12: 0 | HC12: 0 | HD12: 0 | HE12: 0 | HF12: 0 | HJ12: 0 | HL12: 0 | HM12: null | HO12: 0 | HP12: 0 | HQ12: 0 | HS12: 1800 | HT12: 0 | HU12: 0 | HV12: 1 | IF12: 0
A13: OBJECT | B13: h50K | C13: hfoo | D13: 3 | E13: ="[副本 - "&RC[3]&"] " -> [副本 - 熔火之心] | F13: 烈焰龙龟 | H13: 熔火之心 | I13: 0.4 | J13: =INT(RC[4]/30) -> 119605 | K13: =INT(RC[3]/12) -> 299013 | L13: 0 | M13: 0 | N13: =INT(R[-1]C*1.23) -> 3588156 | S13: Units\Creeps\DragonSeaTurtle\DragonSeaTurtle | X13: ="let _hx"&RC[-20]&" = new Challenge('L30"&RC[-20]&"','h30"&RC[-20]&"',20)" -> let _hx3 = new Challenge('L303','h303',20) | Y13: normal | AA13: 6 | BT13: 32 | BU13: Rifleman | CI13: null | CK13: 1 | DF13: 0 | DG13: 0 | DK13: 1 | DT13: 0.1 | DV13: 1 | DW13: 1 | EF13: 390 | EG13: 2.8 | FA13: ground,air | FB13: null | FG13: 0.2 | FH13: 0.1 | FK13: 0 | GW13: nightelf | GZ13: 0 | HA13: 0 | HB13: 0 | HC13: 0 | HD13: 0 | HE13: 0 | HF13: 0 | HJ13: 0 | HL13: 0 | HM13: null | HO13: 0 | HP13: 0 | HQ13: 0 | HS13: 1800 | HT13: 0 | HU13: 0 | HV13: 1 | IF13: 0
A14: OBJECT | B14: h50L | C14: hfoo | D14: 3 | E14: ="[副本 - "&RC[3]&"] " -> [副本 - 熔火之心] | F14: 幼龙 | H14: 熔火之心 | I14: 0.4 | J14: =INT(RC[4]/30) -> 147114 | K14: =INT(RC[3]/12) -> 367785 | L14: 0 | M14: 0 | N14: =INT(R[-1]C*1.23) -> 4413431 | S14: Units\Creeps\DragonSpawnGreen\DragonSpawnGreen | V14: 0 | W14: 0 | X14: ="let _hx"&RC[-20]&" = new Challenge('L30"&RC[-20]&"','h30"&RC[-20]&"',20)" -> let _hx3 = new Challenge('L303','h303',20) | Y14: normal | AA14: 6 | BT14: 32 | BU14: Rifleman | CI14: null | CK14: 1 | DF14: 0 | DG14: 0 | DK14: 1 | DT14: 0.1 | DV14: 1 | DW14: 1 | EF14: 390 | EG14: 2.8 | FA14: ground,air | FB14: null | FG14: 0.2 | FH14: 0.1 | FK14: 0 | GW14: nightelf | GZ14: 0 | HA14: 0 | HB14: 0 | HC14: 0 | HD14: 0 | HE14: 0 | HF14: 0 | HJ14: 0 | HL14: 0 | HM14: null | HO14: 0 | HP14: 0 | HQ14: 0 | HS14: 1800 | HT14: 0 | HU14: 0 | HV14: 1 | IF14: 0
A15: OBJECT | B15: h50M | C15: hfoo | D15: 4 | E15: ="[副本 - "&RC[3]&"] " -> [副本 - 祖阿曼岛] | F15: 冰霜巨魔 | H15: 祖阿曼岛 | I15: 0.35 | J15: =INT(RC[4]/30) -> 333333 | K15: =INT(RC[3]/12) -> 833333 | L15: 0 | M15: 0 | N15: = INT(25000*RC[-10]*POWER(10,0.5*RC[-10])) -> 10000000 | R15: 1.5 | S15: units\creeps\IceTroll\IceTroll | X15: let _hx6 = new Challenge('L306','h306',20) | Y15: normal | AA15: 8 | BT15: 32 | BU15: Rifleman | CI15: null | CK15: 1 | DF15: 0 | DG15: 0 | DK15: 1 | DT15: 0.1 | DV15: 1 | DW15: 1 | EF15: 390 | EG15: 2.8 | FA15: ground,air | FB15: null | FG15: 0.2 | FH15: 0.1 | FK15: 0 | GW15: nightelf | GZ15: 0 | HA15: 0 | HB15: 0 | HC15: 0 | HD15: 0 | HE15: 0 | HF15: 0 | HJ15: 0 | HL15: 0 | HM15: null | HO15: 0 | HP15: 0 | HQ15: 0 | HS15: 1800 | HT15: 0 | HU15: 0 | HV15: 1 | IF15: 0
A16: OBJECT | B16: h50N | C16: hfoo | D16: 4 | E16: ="[副本 - "&RC[3]&"] " -> [副本 - 祖阿曼岛] | F16: 丛林巨魔 | H16: 祖阿曼岛 | I16: 0.35 | J16: =INT(RC[4]/30) -> 416666 | K16: =INT(RC[3]/12) -> 1041666 | L16: 0 | M16: 0 | N16: =INT(R[-1]C*1.25) -> 12500000 | R16: 1.2 | S16: units\creeps\ForestTroll\ForestTroll | X16: let _hx6 = new Challenge('L306','h306',20) | Y16: normal | AA16: 8 | BT16: 32 | BU16: Rifleman | CI16: null | CK16: 1 | DF16: 0 | DG16: 0 | DK16: 1 | DT16: 0.1 | DV16: 1 | DW16: 1 | EF16: 390 | EG16: 2.8 | FA16: ground,air | FB16: null | FG16: 0.2 | FH16: 0.1 | FK16: 0 | GW16: nightelf | GZ16: 0 | HA16: 0 | HB16: 0 | HC16: 0 | HD16: 0 | HE16: 0 | HF16: 0 | HJ16: 0 | HL16: 0 | HM16: null | HO16: 0 | HP16: 0 | HQ16: 0 | HS16: 1800 | HT16: 0 | HU16: 0 | HV16: 1 | IF16: 0
A17: OBJECT | B17: h50O | C17: hfoo | D17: 4 | E17: ="[副本 - "&RC[3]&"] " -> [副本 - 祖阿曼岛] | F17: 娜迦护卫 | H17: 祖阿曼岛 | I17: 0.35 | J17: =INT(RC[4]/30) -> 520833 | K17: =INT(RC[3]/12) -> 1302083 | L17: 0 | M17: 0 | N17: =INT(R[-1]C*1.25) -> 15625000 | R17: 1.1000000000000001 | S17: units\naga\NagaMyrmidon\NagaMyrmidon | X17: let _hx6 = new Challenge('L306','h306',20) | Y17: normal | AA17: 8 | BT17: 32 | BU17: Rifleman | CI17: null | CK17: 1 | DF17: 0 | DG17: 0 | DK17: 1 | DT17: 0.1 | DV17: 1 | DW17: 1 | EF17: 390 | EG17: 2.8 | FA17: ground,air | FB17: null | FG17: 0.2 | FH17: 0.1 | FK17: 0 | GW17: nightelf | GZ17: 0 | HA17: 0 | HB17: 0 | HC17: 0 | HD17: 0 | HE17: 0 | HF17: 0 | HJ17: 0 | HL17: 0 | HM17: null | HO17: 0 | HP17: 0 | HQ17: 0 | HS17: 1800 | HT17: 0 | HU17: 0 | HV17: 1 | IF17: 0
A18: OBJECT | B18: h50P | C18: hfoo | D18: 4 | E18: ="[副本 - "&RC[3]&"] " -> [副本 - 祖阿曼岛] | F18: 黑暗巨魔 | H18: 祖阿曼岛 | I18: 0.35 | J18: =INT(RC[4]/30) -> 651041 | K18: =INT(RC[3]/12) -> 1627604 | L18: 0 | M18: 0 | N18: =INT(R[-1]C*1.25) -> 19531250 | R18: 1.1000000000000001 | S18: units\creeps\DarkTroll\DarkTroll | X18: let _hx6 = new Challenge('L306','h306',20) | Y18: normal | AA18: 8 | BT18: 32 | BU18: Rifleman | CI18: null | CK18: 1 | DF18: 0 | DG18: 0 | DK18: 1 | DT18: 0.1 | DV18: 1 | DW18: 1 | EF18: 390 | EG18: 2.8 | FA18: ground,air | FB18: null | FG18: 0.2 | FH18: 0.1 | FK18: 0 | GW18: nightelf | GZ18: 0 | HA18: 0 | HB18: 0 | HC18: 0 | HD18: 0 | HE18: 0 | HF18: 0 | HJ18: 0 | HL18: 0 | HM18: null | HO18: 0 | HP18: 0 | HQ18: 0 | HS18: 1800 | HT18: 0 | HU18: 0 | HV18: 1 | IF18: 0
A19: OBJECT | B19: h50Q | C19: hfoo | D19: 5 | E19: ="[副本 - "&RC[3]&"] " -> [副本 - 达拉然奥术秘境] | F19: 火元素 | H19: 达拉然奥术秘境 | I19: 0.3 | J19: =INT(RC[4]/30) -> 1317615 | K19: =INT(RC[3]/12) -> 3294039 | L19: 0 | M19: 0 | N19: = INT(25000*RC[-10]*POWER(10,0.5*RC[-10])) -> 39528470 | R19: 1.5 | S19: units\demon\Infernal\Infernal | X19: let _hx6 = new Challenge('L306','h306',20) | Y19: normal | AA19: 10 | BT19: 32 | BU19: Rifleman | CI19: null | CK19: 1 | DF19: 0 | DG19: 0 | DK19: 1 | DT19: 0.1 | DV19: 1 | DW19: 1 | EF19: 390 | EG19: 2.8 | FA19: ground,air | FB19: null | FG19: 0.2 | FH19: 0.1 | FK19: 0 | GW19: nightelf | GZ19: 0 | HA19: 0 | HB19: 0 | HC19: 0 | HD19: 0 | HE19: 0 | HF19: 0 | HJ19: 0 | HL19: 0 | HM19: null | HO19: 0 | HP19: 0 | HQ19: 0 | HS19: 1800 | HT19: 0 | HU19: 0 | HV19: 1 | IF19: 0
A20: OBJECT | B20: h50R | C20: hfoo | D20: 5 | E20: ="[副本 - "&RC[3]&"] " -> [副本 - 达拉然奥术秘境] | F20: 风元素 | H20: 达拉然奥术秘境 | I20: 0.3 | J20: =INT(RC[4]/30) -> 1686548 | K20: =INT(RC[3]/12) -> 4216370 | L20: 0 | M20: 0 | N20: =INT(R[-1]C*1.28) -> 50596441 | R20: 0.8 | S20: Abilities\Spells\NightElf\Cyclone\CycloneTarget.mdl | X20: let _hx6 = new Challenge('L306','h306',20) | Y20: normal | AA20: 10 | BT20: 32 | BU20: Rifleman | CI20: null | CK20: 1 | DF20: 0 | DG20: 0 | DK20: 1 | DT20: 0.1 | DV20: 1 | DW20: 1 | EF20: 390 | EG20: 2.8 | FA20: ground,air | FB20: null | FG20: 0.2 | FH20: 0.1 | FK20: 0 | GW20: nightelf | GZ20: 0 | HA20: 0 | HB20: 0 | HC20: 0 | HD20: 0 | HE20: 0 | HF20: 0 | HJ20: 0 | HL20: 0 | HM20: null | HO20: 0 | HP20: 0 | HQ20: 0 | HS20: 1800 | HT20: 0 | HU20: 0 | HV20: 1 | IF20: 0
A21: OBJECT | B21: h50S | C21: hfoo | D21: 5 | E21: ="[副本 - "&RC[3]&"] " -> [副本 - 达拉然奥术秘境] | F21: 水元素 | H21: 达拉然奥术秘境 | I21: 0.3 | J21: =INT(RC[4]/30) -> 2158781 | K21: =INT(RC[3]/12) -> 5396953 | L21: 0 | M21: 0 | N21: =INT(R[-1]C*1.28) -> 64763444 | R21: 2.2000000000000002 | S21: units\human\WaterElemental\WaterElemental | X21: let _hx6 = new Challenge('L306','h306',20) | Y21: normal | AA21: 10 | BT21: 32 | BU21: Rifleman | CI21: null | CK21: 1 | DF21: 0 | DG21: 0 | DK21: 1 | DT21: 0.1 | DV21: 1 | DW21: 1 | EF21: 390 | EG21: 2.8 | FA21: ground,air | FB21: null | FG21: 0.2 | FH21: 0.1 | FK21: 0 | GW21: nightelf | GZ21: 0 | HA21: 0 | HB21: 0 | HC21: 0 | HD21: 0 | HE21: 0 | HF21: 0 | HJ21: 0 | HL21: 0 | HM21: null | HO21: 0 | HP21: 0 | HQ21: 0 | HS21: 1800 | HT21: 0 | HU21: 0 | HV21: 1 | IF21: 0
A22: OBJECT | B22: h50T | C22: hfoo | D22: 5 | E22: ="[副本 - "&RC[3]&"] " -> [副本 - 达拉然奥术秘境] | F22: 土元素 | H22: 达拉然奥术秘境 | I22: 0.3 | J22: =INT(RC[4]/30) -> 2763240 | K22: =INT(RC[3]/12) -> 6908100 | L22: 0 | M22: 0 | N22: =INT(R[-1]C*1.28) -> 82897208 | R22: 2.2000000000000002 | S22: units\creeps\RockGolem\RockGolem | X22: let _hx6 = new Challenge('L306','h306',20) | Y22: normal | AA22: 10 | BT22: 32 | BU22: Rifleman | CI22: null | CK22: 1 | DF22: 0 | DG22: 0 | DK22: 1 | DT22: 0.1 | DV22: 1 | DW22: 1 | EF22: 390 | EG22: 2.8 | FA22: ground,air | FB22: null | FG22: 0.2 | FH22: 0.1 | FK22: 0 | GW22: nightelf | GZ22: 0 | HA22: 0 | HB22: 0 | HC22: 0 | HD22: 0 | HE22: 0 | HF22: 0 | HJ22: 0 | HL22: 0 | HM22: null | HO22: 0 | HP22: 0 | HQ22: 0 | HS22: 1800 | HT22: 0 | HU22: 0 | HV22: 1 | IF22: 0
A23: OBJECT | B23: H60A | C23: Obla | D23: 1 | E23: ="[副本 - "&RC[3]&"] " -> [副本 - 阿拉希盆地] | F23: 盗贼王 | G23: =RC[-2] -> [副本 - 阿拉希盆地] | H23: 阿拉希盆地 | I23: 0.5 | J23: =INT(RC[4]/80) -> 3557 | K23: =INT(RC[3]/15) -> 18973 | L23: 0 | M23: 0 | N23: = INT(90000*RC[-10]*POWER(10,0.5*RC[-10])) -> 284604 | O23: =RC[-5] -> 3557 | P23: =RC[-1] -> 3557 | Q23: =RC[-2] -> 3557 | R23: 2.4 | S23: units\creeps\BanditLord\BanditLord | X23: ="let _hb"&RC[-20]&" = new Challenge('L40"&RC[-20]&"','H40"&RC[-20]&"',1)" -> let _hb1 = new Challenge('L401','H401',1) | Y23: normal | AA23: 10 | AQ23: null | AS23: null | AT23: null | BG23: null | BT23: 32 | BU23: Rifleman | CC23: null | CD23: null | CE23: null | CF23: null | CI23: null | CK23: 1 | DF23: 0 | DG23: 0 | DK23: 1 | DT23: 0.1 | DV23: 1 | DW23: 1 | EF23: 390 | EG23: 2.8 | FA23: ground,air | FB23: null | FG23: 0.2 | FH23: 0.1 | FK23: 0 | GW23: nightelf | GZ23: 0 | HA23: 0 | HB23: 0 | HC23: 0 | HD23: 0 | HE23: 0 | HF23: 0 | HJ23: 0 | HL23: 0 | HM23: null | HO23: 0 | HP23: 0 | HQ23: 0 | HS23: 1800 | HT23: 0 | HU23: 0 | HV23: 0 | IF23: 0
A24: OBJECT | B24: H60B | C24: Obla | D24: 1 | E24: ="[副本 - "&RC[3]&"] " -> [副本 - 阿拉希盆地] | F24: 鱼人首领 | G24: =RC[-2] -> [副本 - 阿拉希盆地] | H24: 阿拉希盆地 | I24: 0.5 | J24: =INT(RC[4]/80) -> 4091 | K24: =INT(RC[3]/15) -> 21819 | L24: 0 | M24: 0 | N24: =INT(R[-1]C*1.15) -> 327294 | O24: =RC[-5] -> 4091 | P24: =RC[-1] -> 4091 | Q24: =RC[-2] -> 4091 | R24: 2.8 | S24: units\creeps\MurlocNightcrawler\MurlocNightcrawler | X24: ="let _hb"&RC[-20]&" = new Challenge('L40"&RC[-20]&"','H40"&RC[-20]&"',1)" -> let _hb1 = new Challenge('L401','H401',1) | Y24: normal | AA24: 10 | AQ24: null | AS24: null | AT24: null | BG24: null | BT24: 32 | BU24: Rifleman | CC24: null | CD24: null | CE24: null | CF24: null | CI24: null | CK24: 1 | DF24: 0 | DG24: 0 | DK24: 1 | DT24: 0.1 | DV24: 1 | DW24: 1 | EF24: 390 | EG24: 2.8 | FA24: ground,air | FB24: null | FG24: 0.2 | FH24: 0.1 | FK24: 0 | GW24: nightelf | GZ24: 0 | HA24: 0 | HB24: 0 | HC24: 0 | HD24: 0 | HE24: 0 | HF24: 0 | HJ24: 0 | HL24: 0 | HM24: null | HO24: 0 | HP24: 0 | HQ24: 0 | HS24: 1800 | HT24: 0 | HU24: 0 | HV24: 0 | IF24: 0
A25: OBJECT | B25: H60C | C25: Obla | D25: 1 | E25: ="[副本 - "&RC[3]&"] " -> [副本 - 阿拉希盆地] | F25: 森林狼王 | G25: =RC[-2] -> [副本 - 阿拉希盆地] | H25: 阿拉希盆地 | I25: 0.5 | J25: =INT(RC[4]/80) -> 4704 | K25: =INT(RC[3]/15) -> 25092 | L25: 0 | M25: 0 | N25: =INT(R[-1]C*1.15) -> 376388 | O25: =RC[-5] -> 4704 | P25: =RC[-1] -> 4704 | Q25: =RC[-2] -> 4704 | R25: 2.4 | S25: units\creeps\DireWolf\DireWolf | X25: ="let _hb"&RC[-20]&" = new Challenge('L40"&RC[-20]&"','H40"&RC[-20]&"',1)" -> let _hb1 = new Challenge('L401','H401',1) | Y25: normal | AA25: 10 | AQ25: null | AS25: null | AT25: null | BG25: null | BT25: 32 | BU25: Rifleman | CC25: null | CD25: null | CE25: null | CF25: null | CI25: null | CK25: 1 | DF25: 0 | DG25: 0 | DK25: 1 | DT25: 0.1 | DV25: 1 | DW25: 1 | EF25: 390 | EG25: 2.8 | FA25: ground,air | FB25: null | FG25: 0.2 | FH25: 0.1 | FK25: 0 | GW25: nightelf | GZ25: 0 | HA25: 0 | HB25: 0 | HC25: 0 | HD25: 0 | HE25: 0 | HF25: 0 | HJ25: 0 | HL25: 0 | HM25: null | HO25: 0 | HP25: 0 | HQ25: 0 | HS25: 1800 | HT25: 0 | HU25: 0 | HV25: 0 | IF25: 0
A26: OBJECT | B26: H60D | C26: Obla | D26: 1 | E26: ="[副本 - "&RC[3]&"] " -> [副本 - 阿拉希盆地] | F26: 豪猪王 | G26: =RC[-2] -> [副本 - 阿拉希盆地] | H26: 阿拉希盆地 | I26: 0.5 | J26: =INT(RC[4]/80) -> 5410 | K26: =INT(RC[3]/15) -> 28856 | L26: 0 | M26: 0 | N26: =INT(R[-1]C*1.15) -> 432846 | O26: =RC[-5] -> 5410 | P26: =RC[-1] -> 5410 | Q26: =RC[-2] -> 5410 | R26: 2.8 | S26: units\creeps\RazorManeChief\RazorManeChief | X26: ="let _hb"&RC[-20]&" = new Challenge('L40"&RC[-20]&"','H40"&RC[-20]&"',1)" -> let _hb1 = new Challenge('L401','H401',1) | Y26: normal | AA26: 10 | AQ26: null | AS26: null | AT26: null | BG26: null | BT26: 32 | BU26: Rifleman | CC26: null | CD26: null | CE26: null | CF26: null | CI26: null | CK26: 1 | DF26: 0 | DG26: 0 | DK26: 1 | DT26: 0.1 | DV26: 1 | DW26: 1 | EF26: 390 | EG26: 2.8 | FA26: ground,air | FB26: null | FG26: 0.2 | FH26: 0.1 | FK26: 0 | GW26: nightelf | GZ26: 0 | HA26: 0 | HB26: 0 | HC26: 0 | HD26: 0 | HE26: 0 | HF26: 0 | HJ26: 0 | HL26: 0 | HM26: null | HO26: 0 | HP26: 0 | HQ26: 0 | HS26: 1800 | HT26: 0 | HU26: 0 | HV26: 0 | IF26: 0
A27: OBJECT | B27: H60E | C27: Obla | D27: 2 | E27: ="[副本 - "&RC[3]&"] " -> [副本 - 死亡矿井] | F27: 达拉内尔主教 | G27: =RC[-2] -> [副本 - 死亡矿井] | H27: 死亡矿井 | I27: 0.45 | J27: =INT(RC[4]/75) -> 24000 | K27: =INT(RC[3]/15) -> 120000 | L27: 0 | M27: 0 | N27: = INT(90000*RC[-10]*POWER(10,0.5*RC[-10])) -> 1800000 | O27: =RC[-5] -> 24000 | P27: =RC[-1] -> 24000 | Q27: =RC[-2] -> 24000 | R27: 2.4 | S27: units\other\DranaiAkama\DranaiAkama | X27: ="let _hb"&RC[-20]&" = new Challenge('L40"&RC[-20]&"','H40"&RC[-20]&"',1)" -> let _hb2 = new Challenge('L402','H402',1) | Y27: normal | AA27: 20 | AQ27: null | AS27: null | AT27: null | BG27: null | BT27: 32 | BU27: Rifleman | CC27: null | CD27: null | CE27: null | CF27: null | CI27: null | CK27: 1 | DF27: 0 | DG27: 0 | DK27: 1 | DT27: 0.1 | DV27: 1 | DW27: 1 | EF27: 390 | EG27: 2.8 | FA27: ground,air | FB27: null | FG27: 0.2 | FH27: 0.1 | FK27: 0 | GW27: nightelf | GZ27: 0 | HA27: 0 | HB27: 0 | HC27: 0 | HD27: 0 | HE27: 0 | HF27: 0 | HJ27: 0 | HL27: 0 | HM27: null | HO27: 0 | HP27: 0 | HQ27: 0 | HS27: 1800 | HT27: 0 | HU27: 0 | HV27: 0 | IF27: 0
A28: OBJECT | B28: H60F | C28: Obla | D28: 2 | E28: ="[副本 - "&RC[3]&"] " -> [副本 - 死亡矿井] | F28: 食人魔酋长 | G28: =RC[-2] -> [副本 - 死亡矿井] | H28: 死亡矿井 | I28: 0.45 | J28: =INT(RC[4]/75) -> 28800 | K28: =INT(RC[3]/15) -> 144000 | L28: 0 | M28: 0 | N28: =INT(R[-1]C*1.2) -> 2160000 | O28: =RC[-5] -> 28800 | P28: =RC[-1] -> 28800 | Q28: =RC[-2] -> 28800 | R28: 2.8 | S28: units\creeps\OgreLord\OgreLord | X28: ="let _hb"&RC[-20]&" = new Challenge('L40"&RC[-20]&"','H40"&RC[-20]&"',1)" -> let _hb2 = new Challenge('L402','H402',1) | Y28: normal | AA28: 20 | AQ28: null | AS28: null | AT28: null | BG28: null | BT28: 32 | BU28: Rifleman | CC28: null | CD28: null | CE28: null | CF28: null | CI28: null | CK28: 1 | DF28: 0 | DG28: 0 | DK28: 1 | DT28: 0.1 | DV28: 1 | DW28: 1 | EF28: 390 | EG28: 2.8 | FA28: ground,air | FB28: null | FG28: 0.2 | FH28: 0.1 | FK28: 0 | GW28: nightelf | GZ28: 0 | HA28: 0 | HB28: 0 | HC28: 0 | HD28: 0 | HE28: 0 | HF28: 0 | HJ28: 0 | HL28: 0 | HM28: null | HO28: 0 | HP28: 0 | HQ28: 0 | HS28: 1800 | HT28: 0 | HU28: 0 | HV28: 0 | IF28: 0
A29: OBJECT | B29: H60G | C29: Obla | D29: 2 | E29: ="[副本 - "&RC[3]&"] " -> [副本 - 死亡矿井] | F29: 狗头人酋长 | G29: =RC[-2] -> [副本 - 死亡矿井] | H29: 死亡矿井 | I29: 0.45 | J29: =INT(RC[4]/75) -> 34560 | K29: =INT(RC[3]/15) -> 172800 | L29: 0 | M29: 0 | N29: =INT(R[-1]C*1.2) -> 2592000 | O29: =RC[-5] -> 34560 | P29: =RC[-1] -> 34560 | Q29: =RC[-2] -> 34560 | R29: 2.4 | S29: units\creeps\Kobold\Kobold | X29: ="let _hb"&RC[-20]&" = new Challenge('L40"&RC[-20]&"','H40"&RC[-20]&"',1)" -> let _hb2 = new Challenge('L402','H402',1) | Y29: normal | AA29: 20 | AQ29: null | AS29: null | AT29: null | BG29: null | BT29: 32 | BU29: Rifleman | CC29: null | CD29: null | CE29: null | CF29: null | CI29: null | CK29: 1 | DF29: 0 | DG29: 0 | DK29: 1 | DT29: 0.1 | DV29: 1 | DW29: 1 | EF29: 390 | EG29: 2.8 | FA29: ground,air | FB29: null | FG29: 0.2 | FH29: 0.1 | FK29: 0 | GW29: nightelf | GZ29: 0 | HA29: 0 | HB29: 0 | HC29: 0 | HD29: 0 | HE29: 0 | HF29: 0 | HJ29: 0 | HL29: 0 | HM29: null | HO29: 0 | HP29: 0 | HQ29: 0 | HS29: 1800 | HT29: 0 | HU29: 0 | HV29: 0 | IF29: 0
A30: OBJECT | B30: H60H | C30: Obla | D30: 2 | E30: ="[副本 - "&RC[3]&"] " -> [副本 - 死亡矿井] | F30: 矿井魔蝎 | G30: =RC[-2] -> [副本 - 死亡矿井] | H30: 死亡矿井 | I30: 0.45 | J30: =INT(RC[4]/75) -> 41472 | K30: =INT(RC[3]/15) -> 207360 | L30: 0 | M30: 0 | N30: =INT(R[-1]C*1.2) -> 3110400 | O30: =RC[-5] -> 41472 | P30: =RC[-1] -> 41472 | Q30: =RC[-2] -> 41472 | R30: 2.8 | S30: Units\Creeps\Archnathidpurple\Archnathidpurple | X30: ="let _hb"&RC[-20]&" = new Challenge('L40"&RC[-20]&"','H40"&RC[-20]&"',1)" -> let _hb2 = new Challenge('L402','H402',1) | Y30: normal | AA30: 20 | AQ30: null | AS30: null | AT30: null | BG30: null | BT30: 32 | BU30: Rifleman | CC30: null | CD30: null | CE30: null | CF30: null | CI30: null | CK30: 1 | DF30: 0 | DG30: 0 | DK30: 1 | DT30: 0.1 | DV30: 1 | DW30: 1 | EF30: 390 | EG30: 2.8 | FA30: ground,air | FB30: null | FG30: 0.2 | FH30: 0.1 | FK30: 0 | GW30: nightelf | GZ30: 0 | HA30: 0 | HB30: 0 | HC30: 0 | HD30: 0 | HE30: 0 | HF30: 0 | HJ30: 0 | HL30: 0 | HM30: null | HO30: 0 | HP30: 0 | HQ30: 0 | HS30: 1800 | HT30: 0 | HU30: 0 | HV30: 0 | IF30: 0
A31: OBJECT | B31: H60I | C31: Obla | D31: 3 | E31: ="[副本 - "&RC[3]&"] " -> [副本 - 熔火之心] | F31: 炎魔 | G31: =RC[-2] -> [副本 - 熔火之心] | H31: 熔火之心 | I31: 0.4 | J31: =INT(RC[4]/70) -> 121973 | K31: =INT(RC[3]/15) -> 569209 | L31: 0 | M31: 0 | N31: = INT(90000*RC[-10]*POWER(10,0.5*RC[-10])) -> 8538149 | O31: =RC[-5] -> 121973 | P31: =RC[-1] -> 121973 | Q31: =RC[-2] -> 121973 | R31: 2.5 | S31: Units\Creeps\HeroFlameLord\HeroFlameLord | X31: ="let _hb"&RC[-20]&" = new Challenge('L40"&RC[-20]&"','H40"&RC[-20]&"',1)" -> let _hb3 = new Challenge('L403','H403',1) | Y31: normal | AA31: 40 | AQ31: null | AS31: null | AT31: null | BG31: null | BT31: 32 | BU31: Rifleman | CC31: null | CD31: null | CE31: null | CF31: null | CI31: null | CK31: 1 | DF31: 0 | DG31: 0 | DK31: 1 | DT31: 0.1 | DV31: 1 | DW31: 1 | EF31: 390 | EG31: 2.8 | FA31: ground,air | FB31: null | FG31: 0.2 | FH31: 0.1 | FK31: 0 | GW31: nightelf | GZ31: 0 | HA31: 0 | HB31: 0 | HC31: 0 | HD31: 0 | HE31: 0 | HF31: 0 | HJ31: 0 | HL31: 0 | HM31: null | HO31: 0 | HP31: 0 | HQ31: 0 | HS31: 1800 | HT31: 0 | HU31: 0 | HV31: 0 | IF31: 0
A32: OBJECT | B32: H60J | C32: Obla | D32: 3 | E32: ="[副本 - "&RC[3]&"] " -> [副本 - 熔火之心] | F32: 巨型蜥蜴 | G32: =RC[-2] -> [副本 - 熔火之心] | H32: 熔火之心 | I32: 0.4 | J32: =INT(RC[4]/70) -> 150027 | K32: =INT(RC[3]/15) -> 700128 | L32: 0 | M32: 0 | N32: =INT(R[-1]C*1.23) -> 10501923 | O32: =RC[-5] -> 150027 | P32: =RC[-1] -> 150027 | Q32: =RC[-2] -> 150027 | R32: 2.6 | S32: units\creeps\ThunderLizardSalamander\ThunderLizardSalamander | X32: ="let _hb"&RC[-20]&" = new Challenge('L40"&RC[-20]&"','H40"&RC[-20]&"',1)" -> let _hb3 = new Challenge('L403','H403',1) | Y32: normal | AA32: 40 | AQ32: null | AS32: null | AT32: null | BG32: null | BT32: 32 | BU32: Rifleman | CC32: null | CD32: null | CE32: null | CF32: null | CI32: null | CK32: 1 | DF32: 0 | DG32: 0 | DK32: 1 | DT32: 0.1 | DV32: 1 | DW32: 1 | EF32: 390 | EG32: 2.8 | FA32: ground,air | FB32: null | FG32: 0.2 | FH32: 0.1 | FK32: 0 | GW32: nightelf | GZ32: 0 | HA32: 0 | HB32: 0 | HC32: 0 | HD32: 0 | HE32: 0 | HF32: 0 | HJ32: 0 | HL32: 0 | HM32: null | HO32: 0 | HP32: 0 | HQ32: 0 | HS32: 1800 | HT32: 0 | HU32: 0 | HV32: 0 | IF32: 0
A33: OBJECT | B33: H60K | C33: Obla | D33: 3 | E33: ="[副本 - "&RC[3]&"] " -> [副本 - 熔火之心] | F33: 千年龙龟 | G33: =RC[-2] -> [副本 - 熔火之心] | H33: 熔火之心 | I33: 0.4 | J33: =INT(RC[4]/70) -> 184533 | K33: =INT(RC[3]/15) -> 861157 | L33: 0 | M33: 0 | N33: =INT(R[-1]C*1.23) -> 12917365 | O33: =RC[-5] -> 184533 | P33: =RC[-1] -> 184533 | Q33: =RC[-2] -> 184533 | R33: 2.5 | S33: Units\Creeps\DragonSeaTurtle\DragonSeaTurtle | X33: ="let _hb"&RC[-20]&" = new Challenge('L40"&RC[-20]&"','H40"&RC[-20]&"',1)" -> let _hb3 = new Challenge('L403','H403',1) | Y33: normal | AA33: 40 | AQ33: null | AS33: null | AT33: null | BG33: null | BT33: 32 | BU33: Rifleman | CC33: null | CD33: null | CE33: null | CF33: null | CI33: null | CK33: 1 | DF33: 0 | DG33: 0 | DK33: 1 | DT33: 0.1 | DV33: 1 | DW33: 1 | EF33: 390 | EG33: 2.8 | FA33: ground,air | FB33: null | FG33: 0.2 | FH33: 0.1 | FK33: 0 | GW33: nightelf | GZ33: 0 | HA33: 0 | HB33: 0 | HC33: 0 | HD33: 0 | HE33: 0 | HF33: 0 | HJ33: 0 | HL33: 0 | HM33: null | HO33: 0 | HP33: 0 | HQ33: 0 | HS33: 1800 | HT33: 0 | HU33: 0 | HV33: 0 | IF33: 0
A34: OBJECT | B34: H60L | C34: Obla | D34: 3 | E34: ="[副本 - "&RC[3]&"] " -> [副本 - 熔火之心] | F34: 成年巨龙 | G34: =RC[-2] -> [副本 - 熔火之心] | H34: 熔火之心 | I34: 0.4 | J34: =INT(RC[4]/70) -> 226976 | K34: =INT(RC[3]/15) -> 1059223 | L34: 0 | M34: 0 | N34: =INT(R[-1]C*1.23) -> 15888358 | O34: =RC[-5] -> 226976 | P34: =RC[-1] -> 226976 | Q34: =RC[-2] -> 226976 | R34: 2.6 | S34: Units\Creeps\DragonSpawnBlue\DragonSpawnBlue | V34: 0 | W34: 0 | X34: ="let _hb"&RC[-20]&" = new Challenge('L40"&RC[-20]&"','H40"&RC[-20]&"',1)" -> let _hb3 = new Challenge('L403','H403',1) | Y34: normal | AA34: 40 | AQ34: null | AS34: null | AT34: null | BG34: null | BT34: 32 | BU34: Rifleman | CC34: null | CD34: null | CE34: null | CF34: null | CI34: null | CK34: 1 | DF34: 0 | DG34: 0 | DK34: 1 | DT34: 0.1 | DV34: 1 | DW34: 1 | EF34: 390 | EG34: 2.8 | FA34: ground,air | FB34: null | FG34: 0.2 | FH34: 0.1 | FK34: 0 | GW34: nightelf | GZ34: 0 | HA34: 0 | HB34: 0 | HC34: 0 | HD34: 0 | HE34: 0 | HF34: 0 | HJ34: 0 | HL34: 0 | HM34: null | HO34: 0 | HP34: 0 | HQ34: 0 | HS34: 1800 | HT34: 0 | HU34: 0 | HV34: 0 | IF34: 0
A35: OBJECT | B35: H60M | C35: Obla | D35: 4 | E35: ="[副本 - "&RC[3]&"] " -> [副本 - 祖阿曼岛] | F35: 冰霜巨魔酋长 | G35: =RC[-2] -> [副本 - 祖阿曼岛] | H35: 祖阿曼岛 | I35: 0.35 | J35: =INT(RC[4]/65) -> 553846 | K35: =INT(RC[3]/15) -> 2400000 | L35: 0 | M35: 0 | N35: = INT(90000*RC[-10]*POWER(10,0.5*RC[-10])) -> 36000000 | O35: =RC[-5] -> 553846 | P35: =RC[-1] -> 553846 | Q35: =RC[-2] -> 553846 | R35: 2.4 | S35: units\creeps\IceTroll\IceTroll | X35: let _hb3 = new Challenge('L403','H403',1) | Y35: normal | AA35: 60 | AQ35: null | AS35: null | AT35: null | BG35: null | BT35: 32 | BU35: Rifleman | CC35: null | CD35: null | CE35: null | CF35: null | CI35: null | CK35: 1 | DF35: 0 | DG35: 0 | DK35: 1 | DT35: 0.1 | DV35: 1 | DW35: 1 | EF35: 390 | EG35: 2.8 | FA35: ground,air | FB35: null | FG35: 0.2 | FH35: 0.1 | FK35: 0 | GW35: nightelf | GZ35: 0 | HA35: 0 | HB35: 0 | HC35: 0 | HD35: 0 | HE35: 0 | HF35: 0 | HJ35: 0 | HL35: 0 | HM35: null | HO35: 0 | HP35: 0 | HQ35: 0 | HS35: 1800 | HT35: 0 | HU35: 0 | HV35: 0 | IF35: 0
A36: OBJECT | B36: H60N | C36: Obla | D36: 4 | E36: ="[副本 - "&RC[3]&"] " -> [副本 - 祖阿曼岛] | F36: 丛林巨魔酋长 | G36: =RC[-2] -> [副本 - 祖阿曼岛] | H36: 祖阿曼岛 | I36: 0.35 | J36: =INT(RC[4]/65) -> 692307 | K36: =INT(RC[3]/15) -> 3000000 | L36: 0 | M36: 0 | N36: =INT(R[-1]C*1.25) -> 45000000 | O36: =RC[-5] -> 692307 | P36: =RC[-1] -> 692307 | Q36: =RC[-2] -> 692307 | R36: 3 | S36: units\creeps\ForestTrollTrapper\ForestTrollTrapper | X36: let _hb4 = new Challenge('L404','H404',1) | Y36: normal | AA36: 60 | AQ36: null | AS36: null | AT36: null | BG36: null | BT36: 32 | BU36: Rifleman | CC36: null | CD36: null | CE36: null | CF36: null | CI36: null | CK36: 1 | DF36: 0 | DG36: 0 | DK36: 1 | DT36: 0.1 | DV36: 1 | DW36: 1 | EF36: 390 | EG36: 2.8 | FA36: ground,air | FB36: null | FG36: 0.2 | FH36: 0.1 | FK36: 0 | GW36: nightelf | GZ36: 0 | HA36: 0 | HB36: 0 | HC36: 0 | HD36: 0 | HE36: 0 | HF36: 0 | HJ36: 0 | HL36: 0 | HM36: null | HO36: 0 | HP36: 0 | HQ36: 0 | HS36: 1800 | HT36: 0 | HU36: 0 | HV36: 0 | IF36: 0
A37: OBJECT | B37: H60O | C37: Obla | D37: 4 | E37: ="[副本 - "&RC[3]&"] " -> [副本 - 祖阿曼岛] | F37: 娜迦暴君 | G37: =RC[-2] -> [副本 - 祖阿曼岛] | H37: 祖阿曼岛 | I37: 0.35 | J37: =INT(RC[4]/65) -> 865384 | K37: =INT(RC[3]/15) -> 3750000 | L37: 0 | M37: 0 | N37: =INT(R[-1]C*1.25) -> 56250000 | O37: =RC[-5] -> 865384 | P37: =RC[-1] -> 865384 | Q37: =RC[-2] -> 865384 | R37: 2.4 | S37: units\naga\NagaRoyalGuard\NagaRoyalGuard | X37: let _hb3 = new Challenge('L403','H403',1) | Y37: normal | AA37: 60 | AQ37: null | AS37: null | AT37: null | BG37: null | BT37: 32 | BU37: Rifleman | CC37: null | CD37: null | CE37: null | CF37: null | CI37: null | CK37: 1 | DF37: 0 | DG37: 0 | DK37: 1 | DT37: 0.1 | DV37: 1 | DW37: 1 | EF37: 390 | EG37: 2.8 | FA37: ground,air | FB37: null | FG37: 0.2 | FH37: 0.1 | FK37: 0 | GW37: nightelf | GZ37: 0 | HA37: 0 | HB37: 0 | HC37: 0 | HD37: 0 | HE37: 0 | HF37: 0 | HJ37: 0 | HL37: 0 | HM37: null | HO37: 0 | HP37: 0 | HQ37: 0 | HS37: 1800 | HT37: 0 | HU37: 0 | HV37: 0 | IF37: 0
A38: OBJECT | B38: H60P | C38: Obla | D38: 4 | E38: ="[副本 - "&RC[3]&"] " -> [副本 - 祖阿曼岛] | F38: 黑暗巨魔酋长 | G38: =RC[-2] -> [副本 - 祖阿曼岛] | H38: 祖阿曼岛 | I38: 0.35 | J38: =INT(RC[4]/65) -> 1081730 | K38: =INT(RC[3]/15) -> 4687500 | L38: 0 | M38: 0 | N38: =INT(R[-1]C*1.25) -> 70312500 | O38: =RC[-5] -> 1081730 | P38: =RC[-1] -> 1081730 | Q38: =RC[-2] -> 1081730 | R38: 3 | S38: units\creeps\DarkTrollTrapper\DarkTrollTrapper | X38: let _hb4 = new Challenge('L404','H404',1) | Y38: normal | AA38: 60 | AQ38: null | AS38: null | AT38: null | BG38: null | BT38: 32 | BU38: Rifleman | CC38: null | CD38: null | CE38: null | CF38: null | CI38: null | CK38: 1 | DF38: 0 | DG38: 0 | DK38: 1 | DT38: 0.1 | DV38: 1 | DW38: 1 | EF38: 390 | EG38: 2.8 | FA38: ground,air | FB38: null | FG38: 0.2 | FH38: 0.1 | FK38: 0 | GW38: nightelf | GZ38: 0 | HA38: 0 | HB38: 0 | HC38: 0 | HD38: 0 | HE38: 0 | HF38: 0 | HJ38: 0 | HL38: 0 | HM38: null | HO38: 0 | HP38: 0 | HQ38: 0 | HS38: 1800 | HT38: 0 | HU38: 0 | HV38: 0 | IF38: 0
A39: OBJECT | B39: H60Q | C39: Obla | D39: 5 | E39: ="[副本 - "&RC[3]&"] " -> [副本 - 达拉然奥术秘境] | F39: 火元素领主 | G39: =RC[-2] -> [副本 - 达拉然奥术秘境] | H39: 达拉然奥术秘境 | I39: 0.3 | J39: =INT(RC[4]/60) -> 2371708 | K39: =INT(RC[3]/15) -> 9486832 | L39: 0 | M39: 0 | N39: = INT(90000*RC[-10]*POWER(10,0.5*RC[-10])) -> 142302494 | O39: =RC[-5] -> 2371708 | P39: =RC[-1] -> 2371708 | Q39: =RC[-2] -> 2371708 | R39: 3 | S39: units\demon\Infernal\Infernal | X39: let _hb3 = new Challenge('L403','H403',1) | Y39: normal | AA39: 80 | AQ39: null | AS39: null | AT39: null | BG39: null | BT39: 32 | BU39: Rifleman | CC39: null | CD39: null | CE39: null | CF39: null | CI39: null | CK39: 1 | DF39: 0 | DG39: 0 | DK39: 1 | DT39: 0.1 | DV39: 1 | DW39: 1 | EF39: 390 | EG39: 2.8 | FA39: ground,air | FB39: null | FG39: 0.2 | FH39: 0.1 | FK39: 0 | GW39: nightelf | GZ39: 0 | HA39: 0 | HB39: 0 | HC39: 0 | HD39: 0 | HE39: 0 | HF39: 0 | HJ39: 0 | HL39: 0 | HM39: null | HO39: 0 | HP39: 0 | HQ39: 0 | HS39: 1800 | HT39: 0 | HU39: 0 | HV39: 0 | IF39: 0
A40: OBJECT | B40: H60R | C40: Obla | D40: 5 | E40: ="[副本 - "&RC[3]&"] " -> [副本 - 达拉然奥术秘境] | F40: 风元素领主 | G40: =RC[-2] -> [副本 - 达拉然奥术秘境] | H40: 达拉然奥术秘境 | I40: 0.3 | J40: =INT(RC[4]/60) -> 3035786 | K40: =INT(RC[3]/15) -> 12143146 | L40: 0 | M40: 0 | N40: =INT(R[-1]C*1.28) -> 182147192 | O40: =RC[-5] -> 3035786 | P40: =RC[-1] -> 3035786 | Q40: =RC[-2] -> 3035786 | R40: 3.5 | S40: Abilities\Spells\NightElf\Cyclone\CycloneTarget.mdl | X40: let _hb4 = new Challenge('L404','H404',1) | Y40: normal | AA40: 80 | AQ40: null | AS40: null | AT40: null | BG40: null | BT40: 32 | BU40: Rifleman | CC40: null | CD40: null | CE40: null | CF40: null | CI40: null | CK40: 1 | DF40: 0 | DG40: 0 | DK40: 1 | DT40: 0.1 | DV40: 1 | DW40: 1 | EF40: 390 | EG40: 2.8 | FA40: ground,air | FB40: null | FG40: 0.2 | FH40: 0.1 | FK40: 0 | GW40: nightelf | GZ40: 0 | HA40: 0 | HB40: 0 | HC40: 0 | HD40: 0 | HE40: 0 | HF40: 0 | HJ40: 0 | HL40: 0 | HM40: null | HO40: 0 | HP40: 0 | HQ40: 0 | HS40: 1800 | HT40: 0 | HU40: 0 | HV40: 0 | IF40: 0
A41: OBJECT | B41: H60S | C41: Obla | D41: 5 | E41: ="[副本 - "&RC[3]&"] " -> [副本 - 达拉然奥术秘境] | F41: 水元素领主 | G41: =RC[-2] -> [副本 - 达拉然奥术秘境] | H41: 达拉然奥术秘境 | I41: 0.3 | J41: =INT(RC[4]/60) -> 3885806 | K41: =INT(RC[3]/15) -> 15543227 | L41: 0 | M41: 0 | N41: =INT(R[-1]C*1.28) -> 233148405 | O41: =RC[-5] -> 3885806 | P41: =RC[-1] -> 3885806 | Q41: =RC[-2] -> 3885806 | R41: 3 | S41: Units\Creeps\SeaElemental\SeaElemental | X41: let _hb3 = new Challenge('L403','H403',1) | Y41: normal | AA41: 80 | AQ41: null | AS41: null | AT41: null | BG41: null | BT41: 32 | BU41: Rifleman | CC41: null | CD41: null | CE41: null | CF41: null | CI41: null | CK41: 1 | DF41: 0 | DG41: 0 | DK41: 1 | DT41: 0.1 | DV41: 1 | DW41: 1 | EF41: 390 | EG41: 2.8 | FA41: ground,air | FB41: null | FG41: 0.2 | FH41: 0.1 | FK41: 0 | GW41: nightelf | GZ41: 0 | HA41: 0 | HB41: 0 | HC41: 0 | HD41: 0 | HE41: 0 | HF41: 0 | HJ41: 0 | HL41: 0 | HM41: null | HO41: 0 | HP41: 0 | HQ41: 0 | HS41: 1800 | HT41: 0 | HU41: 0 | HV41: 0 | IF41: 0
A42: OBJECT | B42: H60T | C42: Obla | D42: 5 | E42: ="[副本 - "&RC[3]&"] " -> [副本 - 达拉然奥术秘境] | F42: 土元素领主 | G42: =RC[-2] -> [副本 - 达拉然奥术秘境] | H42: 达拉然奥术秘境 | I42: 0.3 | J42: =INT(RC[4]/60) -> 4973832 | K42: =INT(RC[3]/15) -> 19895330 | L42: 0 | M42: 0 | N42: =INT(R[-1]C*1.28) -> 298429958 | O42: =RC[-5] -> 4973832 | P42: =RC[-1] -> 4973832 | Q42: =RC[-2] -> 4973832 | R42: 3.5 | S42: units\creeps\RockGolem\RockGolem | X42: let _hb4 = new Challenge('L404','H404',1) | Y42: normal | AA42: 80 | AQ42: null | AS42: null | AT42: null | BG42: null | BT42: 32 | BU42: Rifleman | CC42: null | CD42: null | CE42: null | CF42: null | CI42: null | CK42: 1 | DF42: 0 | DG42: 0 | DK42: 1 | DT42: 0.1 | DV42: 1 | DW42: 1 | EF42: 390 | EG42: 2.8 | FA42: ground,air | FB42: null | FG42: 0.2 | FH42: 0.1 | FK42: 0 | GW42: nightelf | GZ42: 0 | HA42: 0 | HB42: 0 | HC42: 0 | HD42: 0 | HE42: 0 | HF42: 0 | HJ42: 0 | HL42: 0 | HM42: null | HO42: 0 | HP42: 0 | HQ42: 0 | HS42: 1800 | HT42: 0 | HU42: 0 | HV42: 0 | IF42: 0

Sheet: Sheet2
A1: 副本 | G1: 阿拉希盆地
B2: 阿拉希盆地 | G2: 死亡矿井
C3: 怪1: | G3: 熔火之心
C4: 怪2: | G4: 祖阿曼岛
C5: 怪3: | G5: 达拉然奥术秘境
C6: 怪4:
C7: boss1:
C8: boss2:
C9: boss3:
C10: boss4:
B11: 死亡矿井
C12: 怪1:
C13: 怪2:
C14: 怪3:
C15: 怪4:
C16: boss1:
C17: boss2:
C18: boss3:
C19: boss4:
B20: 熔火之心
C21: 怪1:
C22: 怪2:
C23: 怪3:
C24: 怪4:
C25: boss1:
C26: boss2:
C27: boss3:
C28: boss4:
B29: 祖阿曼岛
C30: 怪1:
C31: 怪2:
C32: 怪3:
C33: 怪4:
C34: boss1:
C35: boss2:
C36: boss3:
C37: boss4:
B38: 达拉然奥术秘境
C39: 怪1:
C40: 怪2:
C41: 怪3:
C42: 怪4:
C43: boss1:
C44: boss2:
C45: boss3:
C46: boss4: