Sheet: ITEM
A1: TYPE | B1: id | C1: _ind | D1: _cls | E1: oid | F1: iabi | G1: unam | H1: ides | I1: utip | J1: utub | K1: uhot | L1: iico | M1: isca | N1: ifil | O1: ubpx | P1: ubpy | Q1: issc | R1: iclr | S1: iclb | T1: iclg | U1: iarm | V1: ilvo | W1: ilev | X1: icla | Y1: igol | Z1: ihtp | AA1: isst | AB1: istr | AC1: ilum | AD1: isto | AE1: ipri | AF1: icid | AG1: iicd | AH1: imor | AI1: idrp | AJ1: ipow | AK1: isel | AL1: ipaw | AM1: idro | AN1: iprn | AO1: iuse | AP1: iper | AQ1: iusa | AR1: ureq | AS1: urqa
A2: COMMENT | B2: 物品ID | C2: 等级 | D2: 品级 | E2: 物品模板ID | F2: 技能 - 技能 | G2: 文本 - 名字 | H2: 文本 - 说明 | I2: 文本 - 提示工具 - 基础 | J2: 文本 - 提示工具 - 扩展 | K2: 文本 - 热键 | L2: 显示 - 界面图标 | M2: 显示 - 模型缩放 | N2: 显示 - 使用模型 | O2: 显示 - 按钮位置(X) | P2: 显示 - 按钮位置(Y) | Q2: 显示 - 选择圈大小(编辑器) | R2: 显示 - 颜色值(红) | S2: 显示 - 颜色值(蓝) | T2: 显示 - 颜色值(绿) | U2: 战斗 - 装甲类型 | V2: 状态 - 等级(旧版) | W2: 状态 - 等级 | X2: 状态 - 物品分类 | Y2: 状态 - 黄金消耗 | Z2: 状态 - 生命值 | AA2: 状态 - 购买开始时间 | AB2: 状态 - 购买时间间隔 | AC2: 状态 - 木材消耗 | AD2: 状态 - 最大库存量 | AE2: 状态 - 优先权 | AF2: 状态 - CD间隔组 | AG2: 状态 - 无视CD间隔 | AH2: 状态 - 有效的物品转换目标 | AI2: 状态 - 持有者死亡时掉落 | AJ2: 状态 - 捡取时自动使用 | AK2: 状态 - 可被市场出售 | AL2: 状态 - 可以被抵押 | AM2: 状态 - 可以丢弃 | AN2: 状态 - 可作为随机物品 | AO2: 状态 - 使用次数 | AP2: 状态 - 使用完会消失 | AQ2: 状态 - 主动使用 | AR2: 科技树 - 需求 | AS2: 科技树 - 需求值
A3: COMMENT | B3: F100 | C3: 1 | D3: D | E3: srbd | F3: ZZZY | G3: =Sheet1!R[-1]C[25] -> 一.丁|cFF999999[宝石]硬骨|r | H3: =Sheet1!R[-1]C[25] -> |n|n用于镶嵌到[剑,衣]上.|n镶嵌后不可取下!|n不需要的宝石可以在宠物处熔炼,用于宝石抽奖. | I3: =RC[-2] -> 一.丁|cFF999999[宝石]硬骨|r | J3: =RC[-2] -> |n|n用于镶嵌到[剑,衣]上.|n镶嵌后不可取下!|n不需要的宝石可以在宠物处熔炼,用于宝石抽奖. | L3: ="ReplaceableTextures\CommandButtons\BTN_gem_"&RC[-9]&".blp" -> ReplaceableTextures\CommandButtons\BTN_gem_1.blp | N3: =VLOOKUP(RC[-10],Sheet2!R7C1:R12C5,5,0) -> model\item\texiao_dijiguangzhu.mdx | W3: 3 | X3: Campaign | Y3: =1000*POWER(2,RC[-22]) -> 2000 | Z3: 235 | AA3: 0 | AB3: =VLOOKUP(RC[-25],Sheet2!R13C1:R18C4,4,0)*VLOOKUP(RC[-24],Sheet2!R7C1:R11C4,4,0) -> 1 | AC3: 0 | AQ3: 1
A4: COMMENT | B4: F101 | C4: 1 | D4: D | E4: srbd | F4: ZZZY | G4: =Sheet1!R[-1]C[25] -> 一.丁|cFF999999[宝石]寒梅|r | H4: =Sheet1!R[-1]C[25] -> |n|n用于镶嵌到[剑,衣]上.|n镶嵌后不可取下!|n不需要的宝石可以在宠物处熔炼,用于宝石抽奖. | I4: =RC[-2] -> 一.丁|cFF999999[宝石]寒梅|r | J4: =RC[-2] -> |n|n用于镶嵌到[剑,衣]上.|n镶嵌后不可取下!|n不需要的宝石可以在宠物处熔炼,用于宝石抽奖. | L4: ="ReplaceableTextures\CommandButtons\BTN_gem_"&RC[-9]&".blp" -> ReplaceableTextures\CommandButtons\BTN_gem_1.blp | N4: =VLOOKUP(RC[-10],Sheet2!R7C1:R12C5,5,0) -> model\item\texiao_dijiguangzhu.mdx | W4: 3 | X4: Campaign | Y4: =1000*POWER(2,RC[-22]) -> 2000 | Z4: 235 | AA4: 0 | AB4: =VLOOKUP(RC[-25],Sheet2!R13C1:R19C4,4,0)*VLOOKUP(RC[-24],Sheet2!R7C1:R12C4,4,0) -> 1 | AC4: 0 | AQ4: 1
A5: COMMENT | B5: F102 | C5: 1 | D5: D | E5: srbd | F5: ZZZY | G5: =Sheet1!R[-1]C[25] -> 一.丁|cFF999999[宝石]五岳|r | H5: =Sheet1!R[-1]C[25] -> |n|n用于镶嵌到[剑,衣]上.|n镶嵌后不可取下!|n不需要的宝石可以在宠物处熔炼,用于宝石抽奖. | I5: =RC[-2] -> 一.丁|cFF999999[宝石]五岳|r | J5: =RC[-2] -> |n|n用于镶嵌到[剑,衣]上.|n镶嵌后不可取下!|n不需要的宝石可以在宠物处熔炼,用于宝石抽奖. | L5: ="ReplaceableTextures\CommandButtons\BTN_gem_"&RC[-9]&".blp" -> ReplaceableTextures\CommandButtons\BTN_gem_1.blp | N5: =VLOOKUP(RC[-10],Sheet2!R7C1:R12C5,5,0) -> model\item\texiao_dijiguangzhu.mdx | W5: 3 | X5: Campaign | Y5: =1000*POWER(2,RC[-22]) -> 2000 | Z5: 235 | AA5: 0 | AB5: =VLOOKUP(RC[-25],Sheet2!R13C1:R19C4,4,0)*VLOOKUP(RC[-24],Sheet2!R7C1:R12C4,4,0) -> 1 | AC5: 0 | AQ5: 1
A6: COMMENT | B6: F103 | C6: 1 | D6: D | E6: srbd | F6: ZZZY | G6: =Sheet1!R[-1]C[25] -> 一.丁|cFF999999[宝石]天龙|r | H6: =Sheet1!R[-1]C[25] -> |n|n用于镶嵌到[剑,衣]上.|n镶嵌后不可取下!|n不需要的宝石可以在宠物处熔炼,用于宝石抽奖. | I6: =RC[-2] -> 一.丁|cFF999999[宝石]天龙|r | J6: =RC[-2] -> |n|n用于镶嵌到[剑,衣]上.|n镶嵌后不可取下!|n不需要的宝石可以在宠物处熔炼,用于宝石抽奖. | L6: ="ReplaceableTextures\CommandButtons\BTN_gem_"&RC[-9]&".blp" -> ReplaceableTextures\CommandButtons\BTN_gem_1.blp | N6: =VLOOKUP(RC[-10],Sheet2!R7C1:R12C5,5,0) -> model\item\texiao_dijiguangzhu.mdx | W6: 3 | X6: Campaign | Y6: =1000*POWER(2,RC[-22]) -> 2000 | Z6: 235 | AA6: 0 | AB6: =VLOOKUP(RC[-25],Sheet2!R13C1:R19C4,4,0)*VLOOKUP(RC[-24],Sheet2!R7C1:R12C4,4,0) -> 1 | AC6: 0 | AQ6: 1
A7: COMMENT | B7: F104 | C7: 1 | D7: D | E7: srbd | F7: ZZZY | G7: =Sheet1!R[-1]C[25] -> 一.丁|cFF999999[宝石]玉蟾|r | H7: =Sheet1!R[-1]C[25] -> |n|n用于镶嵌到[剑,衣]上.|n镶嵌后不可取下!|n不需要的宝石可以在宠物处熔炼,用于宝石抽奖. | I7: =RC[-2] -> 一.丁|cFF999999[宝石]玉蟾|r | J7: =RC[-2] -> |n|n用于镶嵌到[剑,衣]上.|n镶嵌后不可取下!|n不需要的宝石可以在宠物处熔炼,用于宝石抽奖. | L7: ="ReplaceableTextures\CommandButtons\BTN_gem_"&RC[-9]&".blp" -> ReplaceableTextures\CommandButtons\BTN_gem_1.blp | N7: =VLOOKUP(RC[-10],Sheet2!R7C1:R12C5,5,0) -> model\item\texiao_dijiguangzhu.mdx | W7: 3 | X7: Campaign | Y7: =1000*POWER(2,RC[-22]) -> 2000 | Z7: 235 | AA7: 0 | AB7: =VLOOKUP(RC[-25],Sheet2!R13C1:R19C4,4,0)*VLOOKUP(RC[-24],Sheet2!R7C1:R12C4,4,0) -> 1 | AC7: 0 | AQ7: 1
A8: COMMENT | B8: F105 | C8: 1 | D8: D | E8: srbd | F8: ZZZY | G8: =Sheet1!R[-1]C[25] -> 一.丁|cFF999999[宝石]混元|r | H8: =Sheet1!R[-1]C[25] -> |n|n用于镶嵌到[剑,衣]上.|n镶嵌后不可取下!|n不需要的宝石可以在宠物处熔炼,用于宝石抽奖. | I8: =RC[-2] -> 一.丁|cFF999999[宝石]混元|r | J8: =RC[-2] -> |n|n用于镶嵌到[剑,衣]上.|n镶嵌后不可取下!|n不需要的宝石可以在宠物处熔炼,用于宝石抽奖. | L8: ="ReplaceableTextures\CommandButtons\BTN_gem_"&RC[-9]&".blp" -> ReplaceableTextures\CommandButtons\BTN_gem_1.blp | N8: =VLOOKUP(RC[-10],Sheet2!R7C1:R12C5,5,0) -> model\item\texiao_dijiguangzhu.mdx | W8: 3 | X8: Campaign | Y8: =1000*POWER(2,RC[-22]) -> 2000 | Z8: 235 | AA8: 0 | AB8: =VLOOKUP(RC[-25],Sheet2!R13C1:R19C4,4,0)*VLOOKUP(RC[-24],Sheet2!R7C1:R12C4,4,0) -> 1 | AC8: 0 | AQ8: 1
A9: COMMENT | B9: F106 | C9: 1 | D9: D | E9: srbd | F9: ZZZY | G9: =Sheet1!R[-1]C[25] -> 一.丁|cFF999999[宝石]金凤|r | H9: =Sheet1!R[-1]C[25] -> |n|n用于镶嵌到[剑,衣]上.|n镶嵌后不可取下!|n不需要的宝石可以在宠物处熔炼,用于宝石抽奖. | I9: =RC[-2] -> 一.丁|cFF999999[宝石]金凤|r | J9: =RC[-2] -> |n|n用于镶嵌到[剑,衣]上.|n镶嵌后不可取下!|n不需要的宝石可以在宠物处熔炼,用于宝石抽奖. | L9: ="ReplaceableTextures\CommandButtons\BTN_gem_"&RC[-9]&".blp" -> ReplaceableTextures\CommandButtons\BTN_gem_1.blp | N9: =VLOOKUP(RC[-10],Sheet2!R7C1:R12C5,5,0) -> model\item\texiao_dijiguangzhu.mdx | W9: 3 | X9: Campaign | Y9: =1000*POWER(2,RC[-22]) -> 2000 | Z9: 235 | AA9: 0 | AB9: =VLOOKUP(RC[-25],Sheet2!R13C1:R19C4,4,0)*VLOOKUP(RC[-24],Sheet2!R7C1:R12C4,4,0) -> 1 | AC9: 0 | AQ9: 1
A10: COMMENT | B10: F107 | C10: 1 | D10: D | E10: srbd | F10: ZZZY | G10: =Sheet1!R[-1]C[25] -> 一.丁|cFF999999[宝石]碧霞|r | H10: =Sheet1!R[-1]C[25] -> |n|n用于镶嵌到[剑,衣]上.|n镶嵌后不可取下!|n不需要的宝石可以在宠物处熔炼,用于宝石抽奖. | I10: =RC[-2] -> 一.丁|cFF999999[宝石]碧霞|r | J10: =RC[-2] -> |n|n用于镶嵌到[剑,衣]上.|n镶嵌后不可取下!|n不需要的宝石可以在宠物处熔炼,用于宝石抽奖. | L10: ="ReplaceableTextures\CommandButtons\BTN_gem_"&RC[-9]&".blp" -> ReplaceableTextures\CommandButtons\BTN_gem_1.blp | N10: =VLOOKUP(RC[-10],Sheet2!R7C1:R12C5,5,0) -> model\item\texiao_dijiguangzhu.mdx | W10: 3 | X10: Campaign | Y10: =1000*POWER(2,RC[-22]) -> 2000 | Z10: 235 | AA10: 0 | AB10: =VLOOKUP(RC[-25],Sheet2!R13C1:R19C4,4,0)*VLOOKUP(RC[-24],Sheet2!R7C1:R12C4,4,0) -> 1 | AC10: 0 | AQ10: 1
A11: COMMENT | B11: F108 | C11: 1 | D11: D | E11: srbd | F11: ZZZY | G11: =Sheet1!R[-1]C[25] -> 一.丁|cFF999999[宝石]问道|r | H11: =Sheet1!R[-1]C[25] -> |n|n用于镶嵌到[剑,衣]上.|n镶嵌后不可取下!|n不需要的宝石可以在宠物处熔炼,用于宝石抽奖. | I11: =RC[-2] -> 一.丁|cFF999999[宝石]问道|r | J11: =RC[-2] -> |n|n用于镶嵌到[剑,衣]上.|n镶嵌后不可取下!|n不需要的宝石可以在宠物处熔炼,用于宝石抽奖. | L11: ="ReplaceableTextures\CommandButtons\BTN_gem_"&RC[-9]&".blp" -> ReplaceableTextures\CommandButtons\BTN_gem_1.blp | N11: =VLOOKUP(RC[-10],Sheet2!R7C1:R12C5,5,0) -> model\item\texiao_dijiguangzhu.mdx | W11: 3 | X11: Campaign | Y11: =1000*POWER(2,RC[-22]) -> 2000 | Z11: 235 | AA11: 0 | AB11: =VLOOKUP(RC[-25],Sheet2!R13C1:R19C4,4,0)*VLOOKUP(RC[-24],Sheet2!R7C1:R12C4,4,0) -> 1 | AC11: 0 | AQ11: 1
A12: COMMENT | B12: F109 | C12: 1 | D12: D | E12: srbd | F12: ZZZY | G12: =Sheet1!R[-1]C[25] -> 一.丁|cFF999999[宝石]狐绒|r | H12: =Sheet1!R[-1]C[25] -> |n|n用于镶嵌到[剑,衣]上.|n镶嵌后不可取下!|n不需要的宝石可以在宠物处熔炼,用于宝石抽奖. | I12: =RC[-2] -> 一.丁|cFF999999[宝石]狐绒|r | J12: =RC[-2] -> |n|n用于镶嵌到[剑,衣]上.|n镶嵌后不可取下!|n不需要的宝石可以在宠物处熔炼,用于宝石抽奖. | L12: ="ReplaceableTextures\CommandButtons\BTN_gem_"&RC[-9]&".blp" -> ReplaceableTextures\CommandButtons\BTN_gem_1.blp | N12: =VLOOKUP(RC[-10],Sheet2!R7C1:R12C5,5,0) -> model\item\texiao_dijiguangzhu.mdx | W12: 3 | X12: Campaign | Y12: =1000*POWER(2,RC[-22]) -> 2000 | Z12: 235 | AA12: 0 | AB12: =VLOOKUP(RC[-25],Sheet2!R13C1:R19C4,4,0)*VLOOKUP(RC[-24],Sheet2!R7C1:R12C4,4,0) -> 1 | AC12: 0 | AQ12: 1
A13: COMMENT | B13: F10A | C13: 1 | D13: D | E13: srbd | F13: ZZZY | G13: =Sheet1!R[-1]C[25] -> 一.丁|cFF999999[宝石]焚城|r | H13: =Sheet1!R[-1]C[25] -> |n|n用于镶嵌到[剑,衣]上.|n镶嵌后不可取下!|n不需要的宝石可以在宠物处熔炼,用于宝石抽奖. | I13: =RC[-2] -> 一.丁|cFF999999[宝石]焚城|r | J13: =RC[-2] -> |n|n用于镶嵌到[剑,衣]上.|n镶嵌后不可取下!|n不需要的宝石可以在宠物处熔炼,用于宝石抽奖. | L13: ="ReplaceableTextures\CommandButtons\BTN_gem_"&RC[-9]&".blp" -> ReplaceableTextures\CommandButtons\BTN_gem_1.blp | N13: =VLOOKUP(RC[-10],Sheet2!R7C1:R12C5,5,0) -> model\item\texiao_dijiguangzhu.mdx | W13: 3 | X13: Campaign | Y13: =1000*POWER(2,RC[-22]) -> 2000 | Z13: 235 | AA13: 0 | AB13: =VLOOKUP(RC[-25],Sheet2!R13C1:R19C4,4,0)*VLOOKUP(RC[-24],Sheet2!R7C1:R12C4,4,0) -> 1 | AC13: 0 | AQ13: 1
A14: COMMENT | B14: F10B | C14: 1 | D14: D | E14: srbd | F14: ZZZY | G14: =Sheet1!R[-1]C[25] -> 一.丁|cFF999999[宝石]擎雷|r | H14: =Sheet1!R[-1]C[25] -> |n|n用于镶嵌到[剑,衣]上.|n镶嵌后不可取下!|n不需要的宝石可以在宠物处熔炼,用于宝石抽奖. | I14: =RC[-2] -> 一.丁|cFF999999[宝石]擎雷|r | J14: =RC[-2] -> |n|n用于镶嵌到[剑,衣]上.|n镶嵌后不可取下!|n不需要的宝石可以在宠物处熔炼,用于宝石抽奖. | L14: ="ReplaceableTextures\CommandButtons\BTN_gem_"&RC[-9]&".blp" -> ReplaceableTextures\CommandButtons\BTN_gem_1.blp | N14: =VLOOKUP(RC[-10],Sheet2!R7C1:R12C5,5,0) -> model\item\texiao_dijiguangzhu.mdx | W14: 3 | X14: Campaign | Y14: =1000*POWER(2,RC[-22]) -> 2000 | Z14: 235 | AA14: 0 | AB14: =VLOOKUP(RC[-25],Sheet2!R13C1:R19C4,4,0)*VLOOKUP(RC[-24],Sheet2!R7C1:R12C4,4,0) -> 1 | AC14: 0 | AQ14: 1
A15: COMMENT | B15: F10C | C15: 1 | D15: D | E15: srbd | F15: ZZZY | G15: =Sheet1!R[-1]C[25] -> 一.丁|cFF999999[宝石]炼心|r | H15: =Sheet1!R[-1]C[25] -> |n|n用于镶嵌到[剑,衣]上.|n镶嵌后不可取下!|n不需要的宝石可以在宠物处熔炼,用于宝石抽奖. | I15: =RC[-2] -> 一.丁|cFF999999[宝石]炼心|r | J15: =RC[-2] -> |n|n用于镶嵌到[剑,衣]上.|n镶嵌后不可取下!|n不需要的宝石可以在宠物处熔炼,用于宝石抽奖. | L15: ="ReplaceableTextures\CommandButtons\BTN_gem_"&RC[-9]&".blp" -> ReplaceableTextures\CommandButtons\BTN_gem_1.blp | N15: =VLOOKUP(RC[-10],Sheet2!R7C1:R12C5,5,0) -> model\item\texiao_dijiguangzhu.mdx | W15: 3 | X15: Campaign | Y15: =1000*POWER(2,RC[-22]) -> 2000 | Z15: 235 | AA15: 0 | AB15: =VLOOKUP(RC[-25],Sheet2!R13C1:R19C4,4,0)*VLOOKUP(RC[-24],Sheet2!R7C1:R12C4,4,0) -> 1 | AC15: 0 | AQ15: 1
A16: COMMENT | B16: F10D | C16: 1 | D16: D | E16: srbd | F16: ZZZY | G16: =Sheet1!R[-1]C[25] -> 一.丁|cFF999999[宝石]开山|r | H16: =Sheet1!R[-1]C[25] -> |n|n用于镶嵌到[剑,衣]上.|n镶嵌后不可取下!|n不需要的宝石可以在宠物处熔炼,用于宝石抽奖. | I16: =RC[-2] -> 一.丁|cFF999999[宝石]开山|r | J16: =RC[-2] -> |n|n用于镶嵌到[剑,衣]上.|n镶嵌后不可取下!|n不需要的宝石可以在宠物处熔炼,用于宝石抽奖. | L16: ="ReplaceableTextures\CommandButtons\BTN_gem_"&RC[-9]&".blp" -> ReplaceableTextures\CommandButtons\BTN_gem_1.blp | N16: =VLOOKUP(RC[-10],Sheet2!R7C1:R12C5,5,0) -> model\item\texiao_dijiguangzhu.mdx | W16: 3 | X16: Campaign | Y16: =1000*POWER(2,RC[-22]) -> 2000 | Z16: 235 | AA16: 0 | AB16: =VLOOKUP(RC[-25],Sheet2!R13C1:R19C4,4,0)*VLOOKUP(RC[-24],Sheet2!R7C1:R12C4,4,0) -> 1 | AC16: 0 | AQ16: 1
A17: COMMENT | B17: F10E | C17: 1 | D17: D | E17: srbd | F17: ZZZY | G17: =Sheet1!R[-1]C[25] -> 一.丁|cFF999999[宝石]方士|r | H17: =Sheet1!R[-1]C[25] -> |n|n用于镶嵌到[剑,衣]上.|n镶嵌后不可取下!|n不需要的宝石可以在宠物处熔炼,用于宝石抽奖. | I17: =RC[-2] -> 一.丁|cFF999999[宝石]方士|r | J17: =RC[-2] -> |n|n用于镶嵌到[剑,衣]上.|n镶嵌后不可取下!|n不需要的宝石可以在宠物处熔炼,用于宝石抽奖. | L17: ="ReplaceableTextures\CommandButtons\BTN_gem_"&RC[-9]&".blp" -> ReplaceableTextures\CommandButtons\BTN_gem_1.blp | N17: =VLOOKUP(RC[-10],Sheet2!R7C1:R12C5,5,0) -> model\item\texiao_dijiguangzhu.mdx | W17: 3 | X17: Campaign | Y17: =1000*POWER(2,RC[-22]) -> 2000 | Z17: 235 | AA17: 0 | AB17: =VLOOKUP(RC[-25],Sheet2!R13C1:R19C4,4,0)*VLOOKUP(RC[-24],Sheet2!R7C1:R12C4,4,0) -> 1 | AC17: 0 | AQ17: 1
A18: COMMENT | B18: F10F | C18: 1 | D18: D | E18: srbd | F18: ZZZY | G18: =Sheet1!R[-1]C[25] -> 一.丁|cFF999999[宝石]北寒|r | H18: =Sheet1!R[-1]C[25] -> |n|n用于镶嵌到[剑,衣]上.|n镶嵌后不可取下!|n不需要的宝石可以在宠物处熔炼,用于宝石抽奖. | I18: =RC[-2] -> 一.丁|cFF999999[宝石]北寒|r | J18: =RC[-2] -> |n|n用于镶嵌到[剑,衣]上.|n镶嵌后不可取下!|n不需要的宝石可以在宠物处熔炼,用于宝石抽奖. | L18: ="ReplaceableTextures\CommandButtons\BTN_gem_"&RC[-9]&".blp" -> ReplaceableTextures\CommandButtons\BTN_gem_1.blp | N18: =VLOOKUP(RC[-10],Sheet2!R7C1:R12C5,5,0) -> model\item\texiao_dijiguangzhu.mdx | W18: 3 | X18: Campaign | Y18: =1000*POWER(2,RC[-22]) -> 2000 | Z18: 235 | AA18: 0 | AB18: =VLOOKUP(RC[-25],Sheet2!R13C1:R19C4,4,0)*VLOOKUP(RC[-24],Sheet2!R7C1:R12C4,4,0) -> 1 | AC18: 0 | AQ18: 1
A19: OBJECT | B19: F10G | C19: 1 | D19: C | E19: srbd | F19: ZZZY | G19: =Sheet1!R[-1]C[25] -> 一.丙|cFF99FF66[宝石]混元石|r | H19: =Sheet1!R[-1]C[25] -> |cFFFFFF99基础属性|r|n力量:1500|n敏捷:1500|n智力:1500|n|n用于镶嵌到[剑,衣]上.|n镶嵌后不可取下!|n不需要的宝石可以在宠物处熔炼,用于宝石抽奖. | I19: =RC[-2] -> 一.丙|cFF99FF66[宝石]混元石|r | J19: =RC[-2] -> |cFFFFFF99基础属性|r|n力量:1500|n敏捷:1500|n智力:1500|n|n用于镶嵌到[剑,衣]上.|n镶嵌后不可取下!|n不需要的宝石可以在宠物处熔炼,用于宝石抽奖. | L19: ="ReplaceableTextures\CommandButtons\BTN_gem_"&RC[-9]&".blp" -> ReplaceableTextures\CommandButtons\BTN_gem_1.blp | N19: =VLOOKUP(RC[-10],Sheet2!R7C1:R12C5,5,0) -> model\item\texiao_dijiguangzhu.mdx | W19: 3 | X19: Campaign | Y19: =1000*POWER(2,RC[-22]) -> 2000 | Z19: 235 | AA19: 0 | AB19: =VLOOKUP(RC[-25],Sheet2!R13C1:R19C4,4,0)*VLOOKUP(RC[-24],Sheet2!R7C1:R12C4,4,0) -> 2 | AC19: 0 | AQ19: 1
A20: OBJECT | B20: F10H | C20: 1 | D20: C | E20: srbd | F20: ZZZY | G20: =Sheet1!R[-1]C[25] -> 一.丙|cFF99FF66[宝石]金胎石|r | H20: =Sheet1!R[-1]C[25] -> |cFFFFFF99基础属性|r|n攻击:5000|n|n用于镶嵌到[剑,衣]上.|n镶嵌后不可取下!|n不需要的宝石可以在宠物处熔炼,用于宝石抽奖. | I20: =RC[-2] -> 一.丙|cFF99FF66[宝石]金胎石|r | J20: =RC[-2] -> |cFFFFFF99基础属性|r|n攻击:5000|n|n用于镶嵌到[剑,衣]上.|n镶嵌后不可取下!|n不需要的宝石可以在宠物处熔炼,用于宝石抽奖. | L20: ="ReplaceableTextures\CommandButtons\BTN_gem_"&RC[-9]&".blp" -> ReplaceableTextures\CommandButtons\BTN_gem_1.blp | N20: =VLOOKUP(RC[-10],Sheet2!R7C1:R12C5,5,0) -> model\item\texiao_dijiguangzhu.mdx | W20: 3 | X20: Campaign | Y20: =1000*POWER(2,RC[-22]) -> 2000 | Z20: 235 | AA20: 0 | AB20: =VLOOKUP(RC[-25],Sheet2!R13C1:R19C4,4,0)*VLOOKUP(RC[-24],Sheet2!R7C1:R12C4,4,0) -> 2 | AC20: 0 | AQ20: 1
A21: OBJECT | B21: F10I | C21: 1 | D21: C | E21: srbd | F21: ZZZY | G21: =Sheet1!R[-1]C[25] -> 一.丙|cFF99FF66[宝石]碧云石|r | H21: =Sheet1!R[-1]C[25] -> |n|n|cFFFFFF55附加属性|r(%)|n攻击吸血:2|n|n用于镶嵌到[剑,衣]上.|n镶嵌后不可取下!|n不需要的宝石可以在宠物处熔炼,用于宝石抽奖. | I21: =RC[-2] -> 一.丙|cFF99FF66[宝石]碧云石|r | J21: =RC[-2] -> |n|n|cFFFFFF55附加属性|r(%)|n攻击吸血:2|n|n用于镶嵌到[剑,衣]上.|n镶嵌后不可取下!|n不需要的宝石可以在宠物处熔炼,用于宝石抽奖. | L21: ="ReplaceableTextures\CommandButtons\BTN_gem_"&RC[-9]&".blp" -> ReplaceableTextures\CommandButtons\BTN_gem_1.blp | N21: =VLOOKUP(RC[-10],Sheet2!R7C1:R12C5,5,0) -> model\item\texiao_dijiguangzhu.mdx | W21: 3 | X21: Campaign | Y21: =1000*POWER(2,RC[-22]) -> 2000 | Z21: 235 | AA21: 0 | AB21: =VLOOKUP(RC[-25],Sheet2!R13C1:R19C4,4,0)*VLOOKUP(RC[-24],Sheet2!R7C1:R12C4,4,0) -> 2 | AC21: 0 | AQ21: 1
A22: OBJECT | B22: F10J | C22: 1 | D22: C | E22: srbd | F22: ZZZY | G22: =Sheet1!R[-1]C[25] -> 一.丙|cFF99FF66[宝石]仙源石|r | H22: =Sheet1!R[-1]C[25] -> |cFFFFFF99基础属性|r|n血量:25000|n护甲:100|n|n用于镶嵌到[剑,衣]上.|n镶嵌后不可取下!|n不需要的宝石可以在宠物处熔炼,用于宝石抽奖. | I22: =RC[-2] -> 一.丙|cFF99FF66[宝石]仙源石|r | J22: =RC[-2] -> |cFFFFFF99基础属性|r|n血量:25000|n护甲:100|n|n用于镶嵌到[剑,衣]上.|n镶嵌后不可取下!|n不需要的宝石可以在宠物处熔炼,用于宝石抽奖. | L22: ="ReplaceableTextures\CommandButtons\BTN_gem_"&RC[-9]&".blp" -> ReplaceableTextures\CommandButtons\BTN_gem_1.blp | N22: =VLOOKUP(RC[-10],Sheet2!R7C1:R12C5,5,0) -> model\item\texiao_dijiguangzhu.mdx | W22: 3 | X22: Campaign | Y22: =1000*POWER(2,RC[-22]) -> 2000 | Z22: 235 | AA22: 0 | AB22: =VLOOKUP(RC[-25],Sheet2!R13C1:R19C4,4,0)*VLOOKUP(RC[-24],Sheet2!R7C1:R12C4,4,0) -> 2 | AC22: 0 | AQ22: 1
A23: OBJECT | B23: F10K | C23: 1 | D23: C | E23: srbd | F23: ZZZY | G23: =Sheet1!R[-1]C[25] -> 一.丙|cFF99FF66[宝石]法性石|r | H23: =Sheet1!R[-1]C[25] -> |cFFFFFF99基础属性|r|n力量:2000|n敏捷:500|n智力:500|n|n用于镶嵌到[剑,衣]上.|n镶嵌后不可取下!|n不需要的宝石可以在宠物处熔炼,用于宝石抽奖. | I23: =RC[-2] -> 一.丙|cFF99FF66[宝石]法性石|r | J23: =RC[-2] -> |cFFFFFF99基础属性|r|n力量:2000|n敏捷:500|n智力:500|n|n用于镶嵌到[剑,衣]上.|n镶嵌后不可取下!|n不需要的宝石可以在宠物处熔炼,用于宝石抽奖. | L23: ="ReplaceableTextures\CommandButtons\BTN_gem_"&RC[-9]&".blp" -> ReplaceableTextures\CommandButtons\BTN_gem_1.blp | N23: =VLOOKUP(RC[-10],Sheet2!R7C1:R12C5,5,0) -> model\item\texiao_dijiguangzhu.mdx | W23: 3 | X23: Campaign | Y23: =1000*POWER(2,RC[-22]) -> 2000 | Z23: 235 | AA23: 0 | AB23: =VLOOKUP(RC[-25],Sheet2!R13C1:R19C4,4,0)*VLOOKUP(RC[-24],Sheet2!R7C1:R12C4,4,0) -> 2 | AC23: 0 | AQ23: 1
A24: OBJECT | B24: F10L | C24: 1 | D24: C | E24: srbd | F24: ZZZY | G24: =Sheet1!R[-1]C[25] -> 一.丙|cFF99FF66[宝石]昱暝石|r | H24: =Sheet1!R[-1]C[25] -> |cFFFFFF99基础属性|r|n力量:500|n敏捷:2000|n智力:500|n|n用于镶嵌到[剑,衣]上.|n镶嵌后不可取下!|n不需要的宝石可以在宠物处熔炼,用于宝石抽奖. | I24: =RC[-2] -> 一.丙|cFF99FF66[宝石]昱暝石|r | J24: =RC[-2] -> |cFFFFFF99基础属性|r|n力量:500|n敏捷:2000|n智力:500|n|n用于镶嵌到[剑,衣]上.|n镶嵌后不可取下!|n不需要的宝石可以在宠物处熔炼,用于宝石抽奖. | L24: ="ReplaceableTextures\CommandButtons\BTN_gem_"&RC[-9]&".blp" -> ReplaceableTextures\CommandButtons\BTN_gem_1.blp | N24: =VLOOKUP(RC[-10],Sheet2!R7C1:R12C5,5,0) -> model\item\texiao_dijiguangzhu.mdx | W24: 3 | X24: Campaign | Y24: =1000*POWER(2,RC[-22]) -> 2000 | Z24: 235 | AA24: 0 | AB24: =VLOOKUP(RC[-25],Sheet2!R13C1:R19C4,4,0)*VLOOKUP(RC[-24],Sheet2!R7C1:R12C4,4,0) -> 2 | AC24: 0 | AQ24: 1
A25: OBJECT | B25: F10M | C25: 1 | D25: C | E25: srbd | F25: ZZZY | G25: =Sheet1!R[-1]C[25] -> 一.丙|cFF99FF66[宝石]流涂石|r | H25: =Sheet1!R[-1]C[25] -> |cFFFFFF99基础属性|r|n力量:500|n敏捷:500|n智力:2000|n|n用于镶嵌到[剑,衣]上.|n镶嵌后不可取下!|n不需要的宝石可以在宠物处熔炼,用于宝石抽奖. | I25: =RC[-2] -> 一.丙|cFF99FF66[宝石]流涂石|r | J25: =RC[-2] -> |cFFFFFF99基础属性|r|n力量:500|n敏捷:500|n智力:2000|n|n用于镶嵌到[剑,衣]上.|n镶嵌后不可取下!|n不需要的宝石可以在宠物处熔炼,用于宝石抽奖. | L25: ="ReplaceableTextures\CommandButtons\BTN_gem_"&RC[-9]&".blp" -> ReplaceableTextures\CommandButtons\BTN_gem_1.blp | N25: =VLOOKUP(RC[-10],Sheet2!R7C1:R12C5,5,0) -> model\item\texiao_dijiguangzhu.mdx | W25: 3 | X25: Campaign | Y25: =1000*POWER(2,RC[-22]) -> 2000 | Z25: 235 | AA25: 0 | AB25: =VLOOKUP(RC[-25],Sheet2!R13C1:R19C4,4,0)*VLOOKUP(RC[-24],Sheet2!R7C1:R12C4,4,0) -> 2 | AC25: 0 | AQ25: 1
A26: OBJECT | B26: F10N | C26: 1 | D26: C | E26: srbd | F26: ZZZY | G26: =Sheet1!R[-1]C[25] -> 一.丙|cFF99FF66[宝石]天浪石|r | H26: =Sheet1!R[-1]C[25] -> |n|n|cFFFFFF55附加属性|r(%)|n攻速:15|n|n用于镶嵌到[剑,衣]上.|n镶嵌后不可取下!|n不需要的宝石可以在宠物处熔炼,用于宝石抽奖. | I26: =RC[-2] -> 一.丙|cFF99FF66[宝石]天浪石|r | J26: =RC[-2] -> |n|n|cFFFFFF55附加属性|r(%)|n攻速:15|n|n用于镶嵌到[剑,衣]上.|n镶嵌后不可取下!|n不需要的宝石可以在宠物处熔炼,用于宝石抽奖. | L26: ="ReplaceableTextures\CommandButtons\BTN_gem_"&RC[-9]&".blp" -> ReplaceableTextures\CommandButtons\BTN_gem_1.blp | N26: =VLOOKUP(RC[-10],Sheet2!R7C1:R12C5,5,0) -> model\item\texiao_dijiguangzhu.mdx | W26: 3 | X26: Campaign | Y26: =1000*POWER(2,RC[-22]) -> 2000 | Z26: 235 | AA26: 0 | AB26: =VLOOKUP(RC[-25],Sheet2!R13C1:R19C4,4,0)*VLOOKUP(RC[-24],Sheet2!R7C1:R12C4,4,0) -> 2 | AC26: 0 | AQ26: 1
A27: OBJECT | B27: F10O | C27: 1 | D27: B | E27: srbd | F27: ZZZY | G27: =Sheet1!R[-1]C[25] -> 一.乙|cFF1BE6B8[宝石]玄月妖石|r | H27: =Sheet1!R[-1]C[25] -> |cFFFFFF99基础属性|r|n力量:2500|n护甲:25|n伤害增幅:2|n|n用于镶嵌到[剑,衣]上.|n镶嵌后不可取下!|n不需要的宝石可以在宠物处熔炼,用于宝石抽奖. | I27: =RC[-2] -> 一.乙|cFF1BE6B8[宝石]玄月妖石|r | J27: =RC[-2] -> |cFFFFFF99基础属性|r|n力量:2500|n护甲:25|n伤害增幅:2|n|n用于镶嵌到[剑,衣]上.|n镶嵌后不可取下!|n不需要的宝石可以在宠物处熔炼,用于宝石抽奖. | L27: ="ReplaceableTextures\CommandButtons\BTN_gem_"&RC[-9]&".blp" -> ReplaceableTextures\CommandButtons\BTN_gem_1.blp | N27: =VLOOKUP(RC[-10],Sheet2!R7C1:R12C5,5,0) -> model\item\texiao_zhongjiguangzhu.mdx | W27: 3 | X27: Campaign | Y27: =1000*POWER(2,RC[-22]) -> 2000 | Z27: 235 | AA27: 0 | AB27: =VLOOKUP(RC[-25],Sheet2!R13C1:R19C4,4,0)*VLOOKUP(RC[-24],Sheet2!R7C1:R12C4,4,0) -> 3 | AC27: 0 | AQ27: 1
A28: OBJECT | B28: F10P | C28: 1 | D28: B | E28: srbd | F28: ZZZY | G28: =Sheet1!R[-1]C[25] -> 一.乙|cFF1BE6B8[宝石]断肠毒石|r | H28: =Sheet1!R[-1]C[25] -> |cFFFFFF99基础属性|r|n攻击:6000|n护甲:25|n伤害增幅:2|n|n用于镶嵌到[剑,衣]上.|n镶嵌后不可取下!|n不需要的宝石可以在宠物处熔炼,用于宝石抽奖. | I28: =RC[-2] -> 一.乙|cFF1BE6B8[宝石]断肠毒石|r | J28: =RC[-2] -> |cFFFFFF99基础属性|r|n攻击:6000|n护甲:25|n伤害增幅:2|n|n用于镶嵌到[剑,衣]上.|n镶嵌后不可取下!|n不需要的宝石可以在宠物处熔炼,用于宝石抽奖. | L28: ="ReplaceableTextures\CommandButtons\BTN_gem_"&RC[-9]&".blp" -> ReplaceableTextures\CommandButtons\BTN_gem_1.blp | N28: =VLOOKUP(RC[-10],Sheet2!R7C1:R12C5,5,0) -> model\item\texiao_zhongjiguangzhu.mdx | W28: 3 | X28: Campaign | Y28: =1000*POWER(2,RC[-22]) -> 2000 | Z28: 235 | AA28: 0 | AB28: =VLOOKUP(RC[-25],Sheet2!R13C1:R19C4,4,0)*VLOOKUP(RC[-24],Sheet2!R7C1:R12C4,4,0) -> 3 | AC28: 0 | AQ28: 1
A29: OBJECT | B29: F10Q | C29: 1 | D29: B | E29: srbd | F29: ZZZY | G29: =Sheet1!R[-1]C[25] -> 一.乙|cFF1BE6B8[宝石]绫罗魔石|r | H29: =Sheet1!R[-1]C[25] -> |cFFFFFF99基础属性|r|n智力:2500|n护甲:25|n伤害增幅:2|n|n用于镶嵌到[剑,衣]上.|n镶嵌后不可取下!|n不需要的宝石可以在宠物处熔炼,用于宝石抽奖. | I29: =RC[-2] -> 一.乙|cFF1BE6B8[宝石]绫罗魔石|r | J29: =RC[-2] -> |cFFFFFF99基础属性|r|n智力:2500|n护甲:25|n伤害增幅:2|n|n用于镶嵌到[剑,衣]上.|n镶嵌后不可取下!|n不需要的宝石可以在宠物处熔炼,用于宝石抽奖. | L29: ="ReplaceableTextures\CommandButtons\BTN_gem_"&RC[-9]&".blp" -> ReplaceableTextures\CommandButtons\BTN_gem_1.blp | N29: =VLOOKUP(RC[-10],Sheet2!R7C1:R12C5,5,0) -> model\item\texiao_zhongjiguangzhu.mdx | W29: 3 | X29: Campaign | Y29: =1000*POWER(2,RC[-22]) -> 2000 | Z29: 235 | AA29: 0 | AB29: =VLOOKUP(RC[-25],Sheet2!R13C1:R19C4,4,0)*VLOOKUP(RC[-24],Sheet2!R7C1:R12C4,4,0) -> 3 | AC29: 0 | AQ29: 1
A30: OBJECT | B30: F10R | C30: 1 | D30: B | E30: srbd | F30: ZZZY | G30: =Sheet1!R[-1]C[25] -> 一.乙|cFF1BE6B8[宝石]飞云古石|r | H30: =Sheet1!R[-1]C[25] -> |cFFFFFF99基础属性|r|n敏捷:2500|n护甲:25|n伤害增幅:2|n|n用于镶嵌到[剑,衣]上.|n镶嵌后不可取下!|n不需要的宝石可以在宠物处熔炼,用于宝石抽奖. | I30: =RC[-2] -> 一.乙|cFF1BE6B8[宝石]飞云古石|r | J30: =RC[-2] -> |cFFFFFF99基础属性|r|n敏捷:2500|n护甲:25|n伤害增幅:2|n|n用于镶嵌到[剑,衣]上.|n镶嵌后不可取下!|n不需要的宝石可以在宠物处熔炼,用于宝石抽奖. | L30: ="ReplaceableTextures\CommandButtons\BTN_gem_"&RC[-9]&".blp" -> ReplaceableTextures\CommandButtons\BTN_gem_1.blp | N30: =VLOOKUP(RC[-10],Sheet2!R7C1:R12C5,5,0) -> model\item\texiao_zhongjiguangzhu.mdx | W30: 3 | X30: Campaign | Y30: =1000*POWER(2,RC[-22]) -> 2000 | Z30: 235 | AA30: 0 | AB30: =VLOOKUP(RC[-25],Sheet2!R13C1:R19C4,4,0)*VLOOKUP(RC[-24],Sheet2!R7C1:R12C4,4,0) -> 3 | AC30: 0 | AQ30: 1
A31: OBJECT | B31: F10S | C31: 1 | D31: A | E31: srbd | F31: ZZZY | G31: =Sheet1!R[-1]C[25] -> 一.甲|cFF33FF00[宝石]风华绝世|r | H31: =Sheet1!R[-1]C[25] -> |cFFFFFF99基础属性|r|n力量:1200|n敏捷:1200|n智力:1200|n|n|cFFFFFF55附加属性|r(%)|n攻速:6|n伤害增幅:4|n|n用于镶嵌到[剑,衣]上.|n镶嵌后不可取下!|n不需要的宝石可以在宠物处熔炼,用于宝石抽奖. | I31: =RC[-2] -> 一.甲|cFF33FF00[宝石]风华绝世|r | J31: =RC[-2] -> |cFFFFFF99基础属性|r|n力量:1200|n敏捷:1200|n智力:1200|n|n|cFFFFFF55附加属性|r(%)|n攻速:6|n伤害增幅:4|n|n用于镶嵌到[剑,衣]上.|n镶嵌后不可取下!|n不需要的宝石可以在宠物处熔炼,用于宝石抽奖. | L31: ="ReplaceableTextures\CommandButtons\BTN_gem_"&RC[-9]&".blp" -> ReplaceableTextures\CommandButtons\BTN_gem_1.blp | N31: =VLOOKUP(RC[-10],Sheet2!R7C1:R12C5,5,0) -> model\item\texiao_zhongjiguangzhu2.mdx | W31: 3 | X31: Campaign | Y31: =1000*POWER(2,RC[-22]) -> 2000 | Z31: 235 | AA31: 0 | AB31: =VLOOKUP(RC[-25],Sheet2!R13C1:R19C4,4,0)*VLOOKUP(RC[-24],Sheet2!R7C1:R12C4,4,0) -> 4 | AC31: 0 | AQ31: 1
A32: OBJECT | B32: F10T | C32: 1 | D32: A | E32: srbd | F32: ZZZY | G32: =Sheet1!R[-1]C[25] -> 一.甲|cFF33FF00[宝石]金镶玉翠|r | H32: =Sheet1!R[-1]C[25] -> |cFFFFFF99基础属性|r|n攻击:8000|n|n|cFFFFFF55附加属性|r(%)|n攻速:6|n伤害增幅:4|n|n用于镶嵌到[剑,衣]上.|n镶嵌后不可取下!|n不需要的宝石可以在宠物处熔炼,用于宝石抽奖. | I32: =RC[-2] -> 一.甲|cFF33FF00[宝石]金镶玉翠|r | J32: =RC[-2] -> |cFFFFFF99基础属性|r|n攻击:8000|n|n|cFFFFFF55附加属性|r(%)|n攻速:6|n伤害增幅:4|n|n用于镶嵌到[剑,衣]上.|n镶嵌后不可取下!|n不需要的宝石可以在宠物处熔炼,用于宝石抽奖. | L32: ="ReplaceableTextures\CommandButtons\BTN_gem_"&RC[-9]&".blp" -> ReplaceableTextures\CommandButtons\BTN_gem_1.blp | N32: =VLOOKUP(RC[-10],Sheet2!R7C1:R12C5,5,0) -> model\item\texiao_zhongjiguangzhu2.mdx | W32: 3 | X32: Campaign | Y32: =1000*POWER(2,RC[-22]) -> 2000 | Z32: 235 | AA32: 0 | AB32: =VLOOKUP(RC[-25],Sheet2!R13C1:R19C4,4,0)*VLOOKUP(RC[-24],Sheet2!R7C1:R12C4,4,0) -> 4 | AC32: 0 | AQ32: 1
A33: OBJECT | B33: F10U | C33: 1 | D33: S | E33: srbd | F33: ZZZY | G33: =Sheet1!R[-1]C[25] -> 一.绝|cFFFF9933[宝石]释灵渊 - 黑暮|r | H33: =Sheet1!R[-1]C[25] -> |cFFFFFF99基础属性|r|n血量:30000|n护甲:150|n|n|cFFFFFF55附加属性|r(%)|n攻击吸血:1|n伤害增幅:4|n|n用于镶嵌到[剑,衣]上.|n镶嵌后不可取下!|n不需要的宝石可以在宠物处熔炼,用于宝石抽奖. | I33: =RC[-2] -> 一.绝|cFFFF9933[宝石]释灵渊 - 黑暮|r | J33: =RC[-2] -> |cFFFFFF99基础属性|r|n血量:30000|n护甲:150|n|n|cFFFFFF55附加属性|r(%)|n攻击吸血:1|n伤害增幅:4|n|n用于镶嵌到[剑,衣]上.|n镶嵌后不可取下!|n不需要的宝石可以在宠物处熔炼,用于宝石抽奖. | L33: ="ReplaceableTextures\CommandButtons\BTN_gem_"&RC[-9]&".blp" -> ReplaceableTextures\CommandButtons\BTN_gem_1.blp | N33: =VLOOKUP(RC[-10],Sheet2!R7C1:R12C5,5,0) -> model\item\texiao_gaojiguangzhu.mdx | W33: 3 | X33: Campaign | Y33: =1000*POWER(2,RC[-22]) -> 2000 | Z33: 235 | AA33: 0 | AB33: =VLOOKUP(RC[-25],Sheet2!R13C1:R19C4,4,0)*VLOOKUP(RC[-24],Sheet2!R7C1:R12C4,4,0) -> 5 | AC33: 0 | AQ33: 1
A34: OBJECT | B34: F10V | C34: 1 | D34: S | E34: srbd | F34: ZZZY | G34: =Sheet1!R[-1]C[25] -> 一.绝|cFFFF9933[宝石]释灵渊 - 雷光|r | H34: =Sheet1!R[-1]C[25] -> |cFFFFFF99基础属性|r|n攻击:2500|n|n|cFFFFFF55附加属性|r(%)|n暴击概率:5|n暴击伤害:20|n伤害增幅:4|n|n用于镶嵌到[剑,衣]上.|n镶嵌后不可取下!|n不需要的宝石可以在宠物处熔炼,用于宝石抽奖. | I34: =RC[-2] -> 一.绝|cFFFF9933[宝石]释灵渊 - 雷光|r | J34: =RC[-2] -> |cFFFFFF99基础属性|r|n攻击:2500|n|n|cFFFFFF55附加属性|r(%)|n暴击概率:5|n暴击伤害:20|n伤害增幅:4|n|n用于镶嵌到[剑,衣]上.|n镶嵌后不可取下!|n不需要的宝石可以在宠物处熔炼,用于宝石抽奖. | L34: ="ReplaceableTextures\CommandButtons\BTN_gem_"&RC[-9]&".blp" -> ReplaceableTextures\CommandButtons\BTN_gem_1.blp | N34: =VLOOKUP(RC[-10],Sheet2!R7C1:R12C5,5,0) -> model\item\texiao_gaojiguangzhu.mdx | W34: 3 | X34: Campaign | Y34: =1000*POWER(2,RC[-22]) -> 2000 | Z34: 235 | AA34: 0 | AB34: =VLOOKUP(RC[-25],Sheet2!R13C1:R19C4,4,0)*VLOOKUP(RC[-24],Sheet2!R7C1:R12C4,4,0) -> 5 | AC34: 0 | AQ34: 1
A35: OBJECT | B35: F10W | C35: 1 | D35: X | E35: srbd | F35: ZZZY | G35: =Sheet1!R[-1]C[25] -> 一.神|Cffff0000[宝石]上古遗物-无光|r | H35: =Sheet1!R[-1]C[25] -> |cFFFFFF99基础属性|r|n血量:60000|n护甲:200|n|n|cFFFFFF55附加属性|r(%)|n暴击伤害:20|n伤害增幅:8|n|n用于镶嵌到[剑,衣]上.|n镶嵌后不可取下!|n不需要的宝石可以在宠物处熔炼,用于宝石抽奖. | I35: =RC[-2] -> 一.神|Cffff0000[宝石]上古遗物-无光|r | J35: =RC[-2] -> |cFFFFFF99基础属性|r|n血量:60000|n护甲:200|n|n|cFFFFFF55附加属性|r(%)|n暴击伤害:20|n伤害增幅:8|n|n用于镶嵌到[剑,衣]上.|n镶嵌后不可取下!|n不需要的宝石可以在宠物处熔炼,用于宝石抽奖. | L35: ="ReplaceableTextures\CommandButtons\BTN_gem_"&RC[-9]&".blp" -> ReplaceableTextures\CommandButtons\BTN_gem_1.blp | N35: =VLOOKUP(RC[-10],Sheet2!R7C1:R12C5,5,0) -> model\item\texiao_gaojiguangzhu.mdx | W35: 3 | X35: Campaign | Y35: =1000*POWER(2,RC[-22]) -> 2000 | Z35: 235 | AA35: 0 | AB35: =VLOOKUP(RC[-25],Sheet2!R13C1:R19C4,4,0)*VLOOKUP(RC[-24],Sheet2!R7C1:R12C4,4,0) -> 6 | AC35: 0 | AQ35: 1
A36: COMMENT | B36: F200 | C36: 2 | D36: D | E36: srbd | F36: ZZZY | G36: =Sheet1!R[-1]C[25] -> 二.丁|cFF999999[宝石]焚海|r | H36: =Sheet1!R[-1]C[25] -> |n|n用于镶嵌到[剑,衣]上.|n镶嵌后不可取下!|n不需要的宝石可以在宠物处熔炼,用于宝石抽奖. | I36: =RC[-2] -> 二.丁|cFF999999[宝石]焚海|r | J36: =RC[-2] -> |n|n用于镶嵌到[剑,衣]上.|n镶嵌后不可取下!|n不需要的宝石可以在宠物处熔炼,用于宝石抽奖. | L36: ="ReplaceableTextures\CommandButtons\BTN_gem_"&RC[-9]&".blp" -> ReplaceableTextures\CommandButtons\BTN_gem_2.blp | N36: =VLOOKUP(RC[-10],Sheet2!R7C1:R12C5,5,0) -> model\item\texiao_dijiguangzhu.mdx | W36: 3 | X36: Campaign | Y36: =1000*POWER(2,RC[-22]) -> 4000 | Z36: 235 | AA36: 0 | AB36: =VLOOKUP(RC[-25],Sheet2!R13C1:R19C4,4,0)*VLOOKUP(RC[-24],Sheet2!R7C1:R12C4,4,0) -> 3 | AC36: 0 | AQ36: 1
A37: COMMENT | B37: F201 | C37: 2 | D37: D | E37: srbd | F37: ZZZY | G37: =Sheet1!R[-1]C[25] -> 二.丁|cFF999999[宝石]玄冥|r | H37: =Sheet1!R[-1]C[25] -> |n|n用于镶嵌到[剑,衣]上.|n镶嵌后不可取下!|n不需要的宝石可以在宠物处熔炼,用于宝石抽奖. | I37: =RC[-2] -> 二.丁|cFF999999[宝石]玄冥|r | J37: =RC[-2] -> |n|n用于镶嵌到[剑,衣]上.|n镶嵌后不可取下!|n不需要的宝石可以在宠物处熔炼,用于宝石抽奖. | L37: ="ReplaceableTextures\CommandButtons\BTN_gem_"&RC[-9]&".blp" -> ReplaceableTextures\CommandButtons\BTN_gem_2.blp | N37: =VLOOKUP(RC[-10],Sheet2!R7C1:R12C5,5,0) -> model\item\texiao_dijiguangzhu.mdx | W37: 3 | X37: Campaign | Y37: =1000*POWER(2,RC[-22]) -> 4000 | Z37: 235 | AA37: 0 | AB37: =VLOOKUP(RC[-25],Sheet2!R13C1:R19C4,4,0)*VLOOKUP(RC[-24],Sheet2!R7C1:R12C4,4,0) -> 3 | AC37: 0 | AQ37: 1
A38: COMMENT | B38: F202 | C38: 2 | D38: D | E38: srbd | F38: ZZZY | G38: =Sheet1!R[-1]C[25] -> 二.丁|cFF999999[宝石]风雷|r | H38: =Sheet1!R[-1]C[25] -> |n|n用于镶嵌到[剑,衣]上.|n镶嵌后不可取下!|n不需要的宝石可以在宠物处熔炼,用于宝石抽奖. | I38: =RC[-2] -> 二.丁|cFF999999[宝石]风雷|r | J38: =RC[-2] -> |n|n用于镶嵌到[剑,衣]上.|n镶嵌后不可取下!|n不需要的宝石可以在宠物处熔炼,用于宝石抽奖. | L38: ="ReplaceableTextures\CommandButtons\BTN_gem_"&RC[-9]&".blp" -> ReplaceableTextures\CommandButtons\BTN_gem_2.blp | N38: =VLOOKUP(RC[-10],Sheet2!R7C1:R12C5,5,0) -> model\item\texiao_dijiguangzhu.mdx | W38: 3 | X38: Campaign | Y38: =1000*POWER(2,RC[-22]) -> 4000 | Z38: 235 | AA38: 0 | AB38: =VLOOKUP(RC[-25],Sheet2!R13C1:R19C4,4,0)*VLOOKUP(RC[-24],Sheet2!R7C1:R12C4,4,0) -> 3 | AC38: 0 | AQ38: 1
A39: COMMENT | B39: F203 | C39: 2 | D39: D | E39: srbd | F39: ZZZY | G39: =Sheet1!R[-1]C[25] -> 二.丁|cFF999999[宝石]乾坤|r | H39: =Sheet1!R[-1]C[25] -> |n|n用于镶嵌到[剑,衣]上.|n镶嵌后不可取下!|n不需要的宝石可以在宠物处熔炼,用于宝石抽奖. | I39: =RC[-2] -> 二.丁|cFF999999[宝石]乾坤|r | J39: =RC[-2] -> |n|n用于镶嵌到[剑,衣]上.|n镶嵌后不可取下!|n不需要的宝石可以在宠物处熔炼,用于宝石抽奖. | L39: ="ReplaceableTextures\CommandButtons\BTN_gem_"&RC[-9]&".blp" -> ReplaceableTextures\CommandButtons\BTN_gem_2.blp | N39: =VLOOKUP(RC[-10],Sheet2!R7C1:R12C5,5,0) -> model\item\texiao_dijiguangzhu.mdx | W39: 3 | X39: Campaign | Y39: =1000*POWER(2,RC[-22]) -> 4000 | Z39: 235 | AA39: 0 | AB39: =VLOOKUP(RC[-25],Sheet2!R13C1:R19C4,4,0)*VLOOKUP(RC[-24],Sheet2!R7C1:R12C4,4,0) -> 3 | AC39: 0 | AQ39: 1
A40: COMMENT | B40: F204 | C40: 2 | D40: D | E40: srbd | F40: ZZZY | G40: =Sheet1!R[-1]C[25] -> 二.丁|cFF999999[宝石]白骨|r | H40: =Sheet1!R[-1]C[25] -> |n|n用于镶嵌到[剑,衣]上.|n镶嵌后不可取下!|n不需要的宝石可以在宠物处熔炼,用于宝石抽奖. | I40: =RC[-2] -> 二.丁|cFF999999[宝石]白骨|r | J40: =RC[-2] -> |n|n用于镶嵌到[剑,衣]上.|n镶嵌后不可取下!|n不需要的宝石可以在宠物处熔炼,用于宝石抽奖. | L40: ="ReplaceableTextures\CommandButtons\BTN_gem_"&RC[-9]&".blp" -> ReplaceableTextures\CommandButtons\BTN_gem_2.blp | N40: =VLOOKUP(RC[-10],Sheet2!R7C1:R12C5,5,0) -> model\item\texiao_dijiguangzhu.mdx | W40: 3 | X40: Campaign | Y40: =1000*POWER(2,RC[-22]) -> 4000 | Z40: 235 | AA40: 0 | AB40: =VLOOKUP(RC[-25],Sheet2!R13C1:R19C4,4,0)*VLOOKUP(RC[-24],Sheet2!R7C1:R12C4,4,0) -> 3 | AC40: 0 | AQ40: 1
A41: COMMENT | B41: F205 | C41: 2 | D41: D | E41: srbd | F41: ZZZY | G41: =Sheet1!R[-1]C[25] -> 二.丁|cFF999999[宝石]凝霜|r | H41: =Sheet1!R[-1]C[25] -> |n|n用于镶嵌到[剑,衣]上.|n镶嵌后不可取下!|n不需要的宝石可以在宠物处熔炼,用于宝石抽奖. | I41: =RC[-2] -> 二.丁|cFF999999[宝石]凝霜|r | J41: =RC[-2] -> |n|n用于镶嵌到[剑,衣]上.|n镶嵌后不可取下!|n不需要的宝石可以在宠物处熔炼,用于宝石抽奖. | L41: ="ReplaceableTextures\CommandButtons\BTN_gem_"&RC[-9]&".blp" -> ReplaceableTextures\CommandButtons\BTN_gem_2.blp | N41: =VLOOKUP(RC[-10],Sheet2!R7C1:R12C5,5,0) -> model\item\texiao_dijiguangzhu.mdx | W41: 3 | X41: Campaign | Y41: =1000*POWER(2,RC[-22]) -> 4000 | Z41: 235 | AA41: 0 | AB41: =VLOOKUP(RC[-25],Sheet2!R13C1:R19C4,4,0)*VLOOKUP(RC[-24],Sheet2!R7C1:R12C4,4,0) -> 3 | AC41: 0 | AQ41: 1
A42: COMMENT | B42: F206 | C42: 2 | D42: D | E42: srbd | F42: ZZZY | G42: =Sheet1!R[-1]C[25] -> 二.丁|cFF999999[宝石]狂龙|r | H42: =Sheet1!R[-1]C[25] -> |n|n用于镶嵌到[剑,衣]上.|n镶嵌后不可取下!|n不需要的宝石可以在宠物处熔炼,用于宝石抽奖. | I42: =RC[-2] -> 二.丁|cFF999999[宝石]狂龙|r | J42: =RC[-2] -> |n|n用于镶嵌到[剑,衣]上.|n镶嵌后不可取下!|n不需要的宝石可以在宠物处熔炼,用于宝石抽奖. | L42: ="ReplaceableTextures\CommandButtons\BTN_gem_"&RC[-9]&".blp" -> ReplaceableTextures\CommandButtons\BTN_gem_2.blp | N42: =VLOOKUP(RC[-10],Sheet2!R7C1:R12C5,5,0) -> model\item\texiao_dijiguangzhu.mdx | W42: 3 | X42: Campaign | Y42: =1000*POWER(2,RC[-22]) -> 4000 | Z42: 235 | AA42: 0 | AB42: =VLOOKUP(RC[-25],Sheet2!R13C1:R19C4,4,0)*VLOOKUP(RC[-24],Sheet2!R7C1:R12C4,4,0) -> 3 | AC42: 0 | AQ42: 1
A43: COMMENT | B43: F207 | C43: 2 | D43: D | E43: srbd | F43: ZZZY | G43: =Sheet1!R[-1]C[25] -> 二.丁|cFF999999[宝石]龙林|r | H43: =Sheet1!R[-1]C[25] -> |n|n用于镶嵌到[剑,衣]上.|n镶嵌后不可取下!|n不需要的宝石可以在宠物处熔炼,用于宝石抽奖. | I43: =RC[-2] -> 二.丁|cFF999999[宝石]龙林|r | J43: =RC[-2] -> |n|n用于镶嵌到[剑,衣]上.|n镶嵌后不可取下!|n不需要的宝石可以在宠物处熔炼,用于宝石抽奖. | L43: ="ReplaceableTextures\CommandButtons\BTN_gem_"&RC[-9]&".blp" -> ReplaceableTextures\CommandButtons\BTN_gem_2.blp | N43: =VLOOKUP(RC[-10],Sheet2!R7C1:R12C5,5,0) -> model\item\texiao_dijiguangzhu.mdx | W43: 3 | X43: Campaign | Y43: =1000*POWER(2,RC[-22]) -> 4000 | Z43: 235 | AA43: 0 | AB43: =VLOOKUP(RC[-25],Sheet2!R13C1:R19C4,4,0)*VLOOKUP(RC[-24],Sheet2!R7C1:R12C4,4,0) -> 3 | AC43: 0 | AQ43: 1
A44: COMMENT | B44: F208 | C44: 2 | D44: D | E44: srbd | F44: ZZZY | G44: =Sheet1!R[-1]C[25] -> 二.丁|cFF999999[宝石]闇黑|r | H44: =Sheet1!R[-1]C[25] -> |n|n用于镶嵌到[剑,衣]上.|n镶嵌后不可取下!|n不需要的宝石可以在宠物处熔炼,用于宝石抽奖. | I44: =RC[-2] -> 二.丁|cFF999999[宝石]闇黑|r | J44: =RC[-2] -> |n|n用于镶嵌到[剑,衣]上.|n镶嵌后不可取下!|n不需要的宝石可以在宠物处熔炼,用于宝石抽奖. | L44: ="ReplaceableTextures\CommandButtons\BTN_gem_"&RC[-9]&".blp" -> ReplaceableTextures\CommandButtons\BTN_gem_2.blp | N44: =VLOOKUP(RC[-10],Sheet2!R7C1:R12C5,5,0) -> model\item\texiao_dijiguangzhu.mdx | W44: 3 | X44: Campaign | Y44: =1000*POWER(2,RC[-22]) -> 4000 | Z44: 235 | AA44: 0 | AB44: =VLOOKUP(RC[-25],Sheet2!R13C1:R19C4,4,0)*VLOOKUP(RC[-24],Sheet2!R7C1:R12C4,4,0) -> 3 | AC44: 0 | AQ44: 1
A45: COMMENT | B45: F209 | C45: 2 | D45: D | E45: srbd | F45: ZZZY | G45: =Sheet1!R[-1]C[25] -> 二.丁|cFF999999[宝石]儒风|r | H45: =Sheet1!R[-1]C[25] -> |n|n用于镶嵌到[剑,衣]上.|n镶嵌后不可取下!|n不需要的宝石可以在宠物处熔炼,用于宝石抽奖. | I45: =RC[-2] -> 二.丁|cFF999999[宝石]儒风|r | J45: =RC[-2] -> |n|n用于镶嵌到[剑,衣]上.|n镶嵌后不可取下!|n不需要的宝石可以在宠物处熔炼,用于宝石抽奖. | L45: ="ReplaceableTextures\CommandButtons\BTN_gem_"&RC[-9]&".blp" -> ReplaceableTextures\CommandButtons\BTN_gem_2.blp | N45: =VLOOKUP(RC[-10],Sheet2!R7C1:R12C5,5,0) -> model\item\texiao_dijiguangzhu.mdx | W45: 3 | X45: Campaign | Y45: =1000*POWER(2,RC[-22]) -> 4000 | Z45: 235 | AA45: 0 | AB45: =VLOOKUP(RC[-25],Sheet2!R13C1:R19C4,4,0)*VLOOKUP(RC[-24],Sheet2!R7C1:R12C4,4,0) -> 3 | AC45: 0 | AQ45: 1
A46: COMMENT | B46: F20A | C46: 2 | D46: D | E46: srbd | F46: ZZZY | G46: =Sheet1!R[-1]C[25] -> 二.丁|cFF999999[宝石]风雨|r | H46: =Sheet1!R[-1]C[25] -> |n|n用于镶嵌到[剑,衣]上.|n镶嵌后不可取下!|n不需要的宝石可以在宠物处熔炼,用于宝石抽奖. | I46: =RC[-2] -> 二.丁|cFF999999[宝石]风雨|r | J46: =RC[-2] -> |n|n用于镶嵌到[剑,衣]上.|n镶嵌后不可取下!|n不需要的宝石可以在宠物处熔炼,用于宝石抽奖. | L46: ="ReplaceableTextures\CommandButtons\BTN_gem_"&RC[-9]&".blp" -> ReplaceableTextures\CommandButtons\BTN_gem_2.blp | N46: =VLOOKUP(RC[-10],Sheet2!R7C1:R12C5,5,0) -> model\item\texiao_dijiguangzhu.mdx | W46: 3 | X46: Campaign | Y46: =1000*POWER(2,RC[-22]) -> 4000 | Z46: 235 | AA46: 0 | AB46: =VLOOKUP(RC[-25],Sheet2!R13C1:R19C4,4,0)*VLOOKUP(RC[-24],Sheet2!R7C1:R12C4,4,0) -> 3 | AC46: 0 | AQ46: 1
A47: COMMENT | B47: F20B | C47: 2 | D47: D | E47: srbd | F47: ZZZY | G47: =Sheet1!R[-1]C[25] -> 二.丁|cFF999999[宝石]花雨|r | H47: =Sheet1!R[-1]C[25] -> |n|n用于镶嵌到[剑,衣]上.|n镶嵌后不可取下!|n不需要的宝石可以在宠物处熔炼,用于宝石抽奖. | I47: =RC[-2] -> 二.丁|cFF999999[宝石]花雨|r | J47: =RC[-2] -> |n|n用于镶嵌到[剑,衣]上.|n镶嵌后不可取下!|n不需要的宝石可以在宠物处熔炼,用于宝石抽奖. | L47: ="ReplaceableTextures\CommandButtons\BTN_gem_"&RC[-9]&".blp" -> ReplaceableTextures\CommandButtons\BTN_gem_2.blp | N47: =VLOOKUP(RC[-10],Sheet2!R7C1:R12C5,5,0) -> model\item\texiao_dijiguangzhu.mdx | W47: 3 | X47: Campaign | Y47: =1000*POWER(2,RC[-22]) -> 4000 | Z47: 235 | AA47: 0 | AB47: =VLOOKUP(RC[-25],Sheet2!R13C1:R19C4,4,0)*VLOOKUP(RC[-24],Sheet2!R7C1:R12C4,4,0) -> 3 | AC47: 0 | AQ47: 1
A48: COMMENT | B48: F20C | C48: 2 | D48: D | E48: srbd | F48: ZZZY | G48: =Sheet1!R[-1]C[25] -> 二.丁|cFF999999[宝石]断空|r | H48: =Sheet1!R[-1]C[25] -> |n|n用于镶嵌到[剑,衣]上.|n镶嵌后不可取下!|n不需要的宝石可以在宠物处熔炼,用于宝石抽奖. | I48: =RC[-2] -> 二.丁|cFF999999[宝石]断空|r | J48: =RC[-2] -> |n|n用于镶嵌到[剑,衣]上.|n镶嵌后不可取下!|n不需要的宝石可以在宠物处熔炼,用于宝石抽奖. | L48: ="ReplaceableTextures\CommandButtons\BTN_gem_"&RC[-9]&".blp" -> ReplaceableTextures\CommandButtons\BTN_gem_2.blp | N48: =VLOOKUP(RC[-10],Sheet2!R7C1:R12C5,5,0) -> model\item\texiao_dijiguangzhu.mdx | W48: 3 | X48: Campaign | Y48: =1000*POWER(2,RC[-22]) -> 4000 | Z48: 235 | AA48: 0 | AB48: =VLOOKUP(RC[-25],Sheet2!R13C1:R19C4,4,0)*VLOOKUP(RC[-24],Sheet2!R7C1:R12C4,4,0) -> 3 | AC48: 0 | AQ48: 1
A49: COMMENT | B49: F20D | C49: 2 | D49: D | E49: srbd | F49: ZZZY | G49: =Sheet1!R[-1]C[25] -> 二.丁|cFF999999[宝石]浑天|r | H49: =Sheet1!R[-1]C[25] -> |n|n用于镶嵌到[剑,衣]上.|n镶嵌后不可取下!|n不需要的宝石可以在宠物处熔炼,用于宝石抽奖. | I49: =RC[-2] -> 二.丁|cFF999999[宝石]浑天|r | J49: =RC[-2] -> |n|n用于镶嵌到[剑,衣]上.|n镶嵌后不可取下!|n不需要的宝石可以在宠物处熔炼,用于宝石抽奖. | L49: ="ReplaceableTextures\CommandButtons\BTN_gem_"&RC[-9]&".blp" -> ReplaceableTextures\CommandButtons\BTN_gem_2.blp | N49: =VLOOKUP(RC[-10],Sheet2!R7C1:R12C5,5,0) -> model\item\texiao_dijiguangzhu.mdx | W49: 3 | X49: Campaign | Y49: =1000*POWER(2,RC[-22]) -> 4000 | Z49: 235 | AA49: 0 | AB49: =VLOOKUP(RC[-25],Sheet2!R13C1:R19C4,4,0)*VLOOKUP(RC[-24],Sheet2!R7C1:R12C4,4,0) -> 3 | AC49: 0 | AQ49: 1
A50: COMMENT | B50: F20E | C50: 2 | D50: D | E50: srbd | F50: ZZZY | G50: =Sheet1!R[-1]C[25] -> 二.丁|cFF999999[宝石]风舞|r | H50: =Sheet1!R[-1]C[25] -> |n|n用于镶嵌到[剑,衣]上.|n镶嵌后不可取下!|n不需要的宝石可以在宠物处熔炼,用于宝石抽奖. | I50: =RC[-2] -> 二.丁|cFF999999[宝石]风舞|r | J50: =RC[-2] -> |n|n用于镶嵌到[剑,衣]上.|n镶嵌后不可取下!|n不需要的宝石可以在宠物处熔炼,用于宝石抽奖. | L50: ="ReplaceableTextures\CommandButtons\BTN_gem_"&RC[-9]&".blp" -> ReplaceableTextures\CommandButtons\BTN_gem_2.blp | N50: =VLOOKUP(RC[-10],Sheet2!R7C1:R12C5,5,0) -> model\item\texiao_dijiguangzhu.mdx | W50: 3 | X50: Campaign | Y50: =1000*POWER(2,RC[-22]) -> 4000 | Z50: 235 | AA50: 0 | AB50: =VLOOKUP(RC[-25],Sheet2!R13C1:R19C4,4,0)*VLOOKUP(RC[-24],Sheet2!R7C1:R12C4,4,0) -> 3 | AC50: 0 | AQ50: 1
A51: COMMENT | B51: F20F | C51: 2 | D51: D | E51: srbd | F51: ZZZY | G51: =Sheet1!R[-1]C[25] -> 二.丁|cFF999999[宝石]无双|r | H51: =Sheet1!R[-1]C[25] -> |n|n用于镶嵌到[剑,衣]上.|n镶嵌后不可取下!|n不需要的宝石可以在宠物处熔炼,用于宝石抽奖. | I51: =RC[-2] -> 二.丁|cFF999999[宝石]无双|r | J51: =RC[-2] -> |n|n用于镶嵌到[剑,衣]上.|n镶嵌后不可取下!|n不需要的宝石可以在宠物处熔炼,用于宝石抽奖. | L51: ="ReplaceableTextures\CommandButtons\BTN_gem_"&RC[-9]&".blp" -> ReplaceableTextures\CommandButtons\BTN_gem_2.blp | N51: =VLOOKUP(RC[-10],Sheet2!R7C1:R12C5,5,0) -> model\item\texiao_dijiguangzhu.mdx | W51: 3 | X51: Campaign | Y51: =1000*POWER(2,RC[-22]) -> 4000 | Z51: 235 | AA51: 0 | AB51: =VLOOKUP(RC[-25],Sheet2!R13C1:R19C4,4,0)*VLOOKUP(RC[-24],Sheet2!R7C1:R12C4,4,0) -> 3 | AC51: 0 | AQ51: 1
A52: OBJECT | B52: F20G | C52: 2 | D52: C | E52: srbd | F52: ZZZY | G52: =Sheet1!R[-1]C[25] -> 二.丙|cFF99FF66[宝石]天钧石|r | H52: =Sheet1!R[-1]C[25] -> |cFFFFFF99基础属性|r|n力量:4500|n敏捷:4500|n智力:4500|n|n用于镶嵌到[剑,衣]上.|n镶嵌后不可取下!|n不需要的宝石可以在宠物处熔炼,用于宝石抽奖. | I52: =RC[-2] -> 二.丙|cFF99FF66[宝石]天钧石|r | J52: =RC[-2] -> |cFFFFFF99基础属性|r|n力量:4500|n敏捷:4500|n智力:4500|n|n用于镶嵌到[剑,衣]上.|n镶嵌后不可取下!|n不需要的宝石可以在宠物处熔炼,用于宝石抽奖. | L52: ="ReplaceableTextures\CommandButtons\BTN_gem_"&RC[-9]&".blp" -> ReplaceableTextures\CommandButtons\BTN_gem_2.blp | N52: =VLOOKUP(RC[-10],Sheet2!R7C1:R12C5,5,0) -> model\item\texiao_dijiguangzhu.mdx | W52: 3 | X52: Campaign | Y52: =1000*POWER(2,RC[-22]) -> 4000 | Z52: 235 | AA52: 0 | AB52: =VLOOKUP(RC[-25],Sheet2!R13C1:R19C4,4,0)*VLOOKUP(RC[-24],Sheet2!R7C1:R12C4,4,0) -> 6 | AC52: 0 | AQ52: 1
A53: OBJECT | B53: F20H | C53: 2 | D53: C | E53: srbd | F53: ZZZY | G53: =Sheet1!R[-1]C[25] -> 二.丙|cFF99FF66[宝石]天回石|r | H53: =Sheet1!R[-1]C[25] -> |cFFFFFF99基础属性|r|n攻击:15000|n|n用于镶嵌到[剑,衣]上.|n镶嵌后不可取下!|n不需要的宝石可以在宠物处熔炼,用于宝石抽奖. | I53: =RC[-2] -> 二.丙|cFF99FF66[宝石]天回石|r | J53: =RC[-2] -> |cFFFFFF99基础属性|r|n攻击:15000|n|n用于镶嵌到[剑,衣]上.|n镶嵌后不可取下!|n不需要的宝石可以在宠物处熔炼,用于宝石抽奖. | L53: ="ReplaceableTextures\CommandButtons\BTN_gem_"&RC[-9]&".blp" -> ReplaceableTextures\CommandButtons\BTN_gem_2.blp | N53: =VLOOKUP(RC[-10],Sheet2!R7C1:R12C5,5,0) -> model\item\texiao_dijiguangzhu.mdx | W53: 3 | X53: Campaign | Y53: =1000*POWER(2,RC[-22]) -> 4000 | Z53: 235 | AA53: 0 | AB53: =VLOOKUP(RC[-25],Sheet2!R13C1:R19C4,4,0)*VLOOKUP(RC[-24],Sheet2!R7C1:R12C4,4,0) -> 6 | AC53: 0 | AQ53: 1
A54: OBJECT | B54: F20I | C54: 2 | D54: C | E54: srbd | F54: ZZZY | G54: =Sheet1!R[-1]C[25] -> 二.丙|cFF99FF66[宝石]破天石|r | H54: =Sheet1!R[-1]C[25] -> |n|n|cFFFFFF55附加属性|r(%)|n攻击吸血:2|n|n用于镶嵌到[剑,衣]上.|n镶嵌后不可取下!|n不需要的宝石可以在宠物处熔炼,用于宝石抽奖. | I54: =RC[-2] -> 二.丙|cFF99FF66[宝石]破天石|r | J54: =RC[-2] -> |n|n|cFFFFFF55附加属性|r(%)|n攻击吸血:2|n|n用于镶嵌到[剑,衣]上.|n镶嵌后不可取下!|n不需要的宝石可以在宠物处熔炼,用于宝石抽奖. | L54: ="ReplaceableTextures\CommandButtons\BTN_gem_"&RC[-9]&".blp" -> ReplaceableTextures\CommandButtons\BTN_gem_2.blp | N54: =VLOOKUP(RC[-10],Sheet2!R7C1:R12C5,5,0) -> model\item\texiao_dijiguangzhu.mdx | W54: 3 | X54: Campaign | Y54: =1000*POWER(2,RC[-22]) -> 4000 | Z54: 235 | AA54: 0 | AB54: =VLOOKUP(RC[-25],Sheet2!R13C1:R19C4,4,0)*VLOOKUP(RC[-24],Sheet2!R7C1:R12C4,4,0) -> 6 | AC54: 0 | AQ54: 1
A55: OBJECT | B55: F20J | C55: 2 | D55: C | E55: srbd | F55: ZZZY | G55: =Sheet1!R[-1]C[25] -> 二.丙|cFF99FF66[宝石]风雷石|r | H55: =Sheet1!R[-1]C[25] -> |cFFFFFF99基础属性|r|n血量:75000|n护甲:150|n|n用于镶嵌到[剑,衣]上.|n镶嵌后不可取下!|n不需要的宝石可以在宠物处熔炼,用于宝石抽奖. | I55: =RC[-2] -> 二.丙|cFF99FF66[宝石]风雷石|r | J55: =RC[-2] -> |cFFFFFF99基础属性|r|n血量:75000|n护甲:150|n|n用于镶嵌到[剑,衣]上.|n镶嵌后不可取下!|n不需要的宝石可以在宠物处熔炼,用于宝石抽奖. | L55: ="ReplaceableTextures\CommandButtons\BTN_gem_"&RC[-9]&".blp" -> ReplaceableTextures\CommandButtons\BTN_gem_2.blp | N55: =VLOOKUP(RC[-10],Sheet2!R7C1:R12C5,5,0) -> model\item\texiao_dijiguangzhu.mdx | W55: 3 | X55: Campaign | Y55: =1000*POWER(2,RC[-22]) -> 4000 | Z55: 235 | AA55: 0 | AB55: =VLOOKUP(RC[-25],Sheet2!R13C1:R19C4,4,0)*VLOOKUP(RC[-24],Sheet2!R7C1:R12C4,4,0) -> 6 | AC55: 0 | AQ55: 1
A56: OBJECT | B56: F20K | C56: 2 | D56: C | E56: srbd | F56: ZZZY | G56: =Sheet1!R[-1]C[25] -> 二.丙|cFF99FF66[宝石]孤风石|r | H56: =Sheet1!R[-1]C[25] -> |cFFFFFF99基础属性|r|n力量:6000|n敏捷:1500|n智力:1500|n|n用于镶嵌到[剑,衣]上.|n镶嵌后不可取下!|n不需要的宝石可以在宠物处熔炼,用于宝石抽奖. | I56: =RC[-2] -> 二.丙|cFF99FF66[宝石]孤风石|r | J56: =RC[-2] -> |cFFFFFF99基础属性|r|n力量:6000|n敏捷:1500|n智力:1500|n|n用于镶嵌到[剑,衣]上.|n镶嵌后不可取下!|n不需要的宝石可以在宠物处熔炼,用于宝石抽奖. | L56: ="ReplaceableTextures\CommandButtons\BTN_gem_"&RC[-9]&".blp" -> ReplaceableTextures\CommandButtons\BTN_gem_2.blp | N56: =VLOOKUP(RC[-10],Sheet2!R7C1:R12C5,5,0) -> model\item\texiao_dijiguangzhu.mdx | W56: 3 | X56: Campaign | Y56: =1000*POWER(2,RC[-22]) -> 4000 | Z56: 235 | AA56: 0 | AB56: =VLOOKUP(RC[-25],Sheet2!R13C1:R19C4,4,0)*VLOOKUP(RC[-24],Sheet2!R7C1:R12C4,4,0) -> 6 | AC56: 0 | AQ56: 1
A57: OBJECT | B57: F20L | C57: 2 | D57: C | E57: srbd | F57: ZZZY | G57: =Sheet1!R[-1]C[25] -> 二.丙|cFF99FF66[宝石]红锦石|r | H57: =Sheet1!R[-1]C[25] -> |cFFFFFF99基础属性|r|n力量:1500|n敏捷:6000|n智力:1500|n|n用于镶嵌到[剑,衣]上.|n镶嵌后不可取下!|n不需要的宝石可以在宠物处熔炼,用于宝石抽奖. | I57: =RC[-2] -> 二.丙|cFF99FF66[宝石]红锦石|r | J57: =RC[-2] -> |cFFFFFF99基础属性|r|n力量:1500|n敏捷:6000|n智力:1500|n|n用于镶嵌到[剑,衣]上.|n镶嵌后不可取下!|n不需要的宝石可以在宠物处熔炼,用于宝石抽奖. | L57: ="ReplaceableTextures\CommandButtons\BTN_gem_"&RC[-9]&".blp" -> ReplaceableTextures\CommandButtons\BTN_gem_2.blp | N57: =VLOOKUP(RC[-10],Sheet2!R7C1:R12C5,5,0) -> model\item\texiao_dijiguangzhu.mdx | W57: 3 | X57: Campaign | Y57: =1000*POWER(2,RC[-22]) -> 4000 | Z57: 235 | AA57: 0 | AB57: =VLOOKUP(RC[-25],Sheet2!R13C1:R19C4,4,0)*VLOOKUP(RC[-24],Sheet2!R7C1:R12C4,4,0) -> 6 | AC57: 0 | AQ57: 1
A58: OBJECT | B58: F20M | C58: 2 | D58: C | E58: srbd | F58: ZZZY | G58: =Sheet1!R[-1]C[25] -> 二.丙|cFF99FF66[宝石]黄鹤石|r | H58: =Sheet1!R[-1]C[25] -> |cFFFFFF99基础属性|r|n力量:1500|n敏捷:1500|n智力:6000|n|n用于镶嵌到[剑,衣]上.|n镶嵌后不可取下!|n不需要的宝石可以在宠物处熔炼,用于宝石抽奖. | I58: =RC[-2] -> 二.丙|cFF99FF66[宝石]黄鹤石|r | J58: =RC[-2] -> |cFFFFFF99基础属性|r|n力量:1500|n敏捷:1500|n智力:6000|n|n用于镶嵌到[剑,衣]上.|n镶嵌后不可取下!|n不需要的宝石可以在宠物处熔炼,用于宝石抽奖. | L58: ="ReplaceableTextures\CommandButtons\BTN_gem_"&RC[-9]&".blp" -> ReplaceableTextures\CommandButtons\BTN_gem_2.blp | N58: =VLOOKUP(RC[-10],Sheet2!R7C1:R12C5,5,0) -> model\item\texiao_dijiguangzhu.mdx | W58: 3 | X58: Campaign | Y58: =1000*POWER(2,RC[-22]) -> 4000 | Z58: 235 | AA58: 0 | AB58: =VLOOKUP(RC[-25],Sheet2!R13C1:R19C4,4,0)*VLOOKUP(RC[-24],Sheet2!R7C1:R12C4,4,0) -> 6 | AC58: 0 | AQ58: 1
A59: OBJECT | B59: F20N | C59: 2 | D59: C | E59: srbd | F59: ZZZY | G59: =Sheet1!R[-1]C[25] -> 二.丙|cFF99FF66[宝石]星象石|r | H59: =Sheet1!R[-1]C[25] -> |n|n|cFFFFFF55附加属性|r(%)|n攻速:18|n|n用于镶嵌到[剑,衣]上.|n镶嵌后不可取下!|n不需要的宝石可以在宠物处熔炼,用于宝石抽奖. | I59: =RC[-2] -> 二.丙|cFF99FF66[宝石]星象石|r | J59: =RC[-2] -> |n|n|cFFFFFF55附加属性|r(%)|n攻速:18|n|n用于镶嵌到[剑,衣]上.|n镶嵌后不可取下!|n不需要的宝石可以在宠物处熔炼,用于宝石抽奖. | L59: ="ReplaceableTextures\CommandButtons\BTN_gem_"&RC[-9]&".blp" -> ReplaceableTextures\CommandButtons\BTN_gem_2.blp | N59: =VLOOKUP(RC[-10],Sheet2!R7C1:R12C5,5,0) -> model\item\texiao_dijiguangzhu.mdx | W59: 3 | X59: Campaign | Y59: =1000*POWER(2,RC[-22]) -> 4000 | Z59: 235 | AA59: 0 | AB59: =VLOOKUP(RC[-25],Sheet2!R13C1:R19C4,4,0)*VLOOKUP(RC[-24],Sheet2!R7C1:R12C4,4,0) -> 6 | AC59: 0 | AQ59: 1
A60: OBJECT | B60: F20O | C60: 2 | D60: B | E60: srbd | F60: ZZZY | G60: =Sheet1!R[-1]C[25] -> 二.乙|cFF1BE6B8[宝石]鸿蒙窄木|r | H60: =Sheet1!R[-1]C[25] -> |cFFFFFF99基础属性|r|n力量:7500|n护甲:37|n伤害增幅:2|n|n用于镶嵌到[剑,衣]上.|n镶嵌后不可取下!|n不需要的宝石可以在宠物处熔炼,用于宝石抽奖. | I60: =RC[-2] -> 二.乙|cFF1BE6B8[宝石]鸿蒙窄木|r | J60: =RC[-2] -> |cFFFFFF99基础属性|r|n力量:7500|n护甲:37|n伤害增幅:2|n|n用于镶嵌到[剑,衣]上.|n镶嵌后不可取下!|n不需要的宝石可以在宠物处熔炼,用于宝石抽奖. | L60: ="ReplaceableTextures\CommandButtons\BTN_gem_"&RC[-9]&".blp" -> ReplaceableTextures\CommandButtons\BTN_gem_2.blp | N60: =VLOOKUP(RC[-10],Sheet2!R7C1:R12C5,5,0) -> model\item\texiao_zhongjiguangzhu.mdx | W60: 3 | X60: Campaign | Y60: =1000*POWER(2,RC[-22]) -> 4000 | Z60: 235 | AA60: 0 | AB60: =VLOOKUP(RC[-25],Sheet2!R13C1:R19C4,4,0)*VLOOKUP(RC[-24],Sheet2!R7C1:R12C4,4,0) -> 9 | AC60: 0 | AQ60: 1
A61: OBJECT | B61: F20P | C61: 2 | D61: B | E61: srbd | F61: ZZZY | G61: =Sheet1!R[-1]C[25] -> 二.乙|cFF1BE6B8[宝石]修灭邪金|r | H61: =Sheet1!R[-1]C[25] -> |cFFFFFF99基础属性|r|n攻击:18000|n护甲:37|n伤害增幅:2|n|n用于镶嵌到[剑,衣]上.|n镶嵌后不可取下!|n不需要的宝石可以在宠物处熔炼,用于宝石抽奖. | I61: =RC[-2] -> 二.乙|cFF1BE6B8[宝石]修灭邪金|r | J61: =RC[-2] -> |cFFFFFF99基础属性|r|n攻击:18000|n护甲:37|n伤害增幅:2|n|n用于镶嵌到[剑,衣]上.|n镶嵌后不可取下!|n不需要的宝石可以在宠物处熔炼,用于宝石抽奖. | L61: ="ReplaceableTextures\CommandButtons\BTN_gem_"&RC[-9]&".blp" -> ReplaceableTextures\CommandButtons\BTN_gem_2.blp | N61: =VLOOKUP(RC[-10],Sheet2!R7C1:R12C5,5,0) -> model\item\texiao_zhongjiguangzhu.mdx | W61: 3 | X61: Campaign | Y61: =1000*POWER(2,RC[-22]) -> 4000 | Z61: 235 | AA61: 0 | AB61: =VLOOKUP(RC[-25],Sheet2!R13C1:R19C4,4,0)*VLOOKUP(RC[-24],Sheet2!R7C1:R12C4,4,0) -> 9 | AC61: 0 | AQ61: 1
A62: OBJECT | B62: F20Q | C62: 2 | D62: B | E62: srbd | F62: ZZZY | G62: =Sheet1!R[-1]C[25] -> 二.乙|cFF1BE6B8[宝石]幽神奇石|r | H62: =Sheet1!R[-1]C[25] -> |cFFFFFF99基础属性|r|n智力:7500|n护甲:37|n伤害增幅:2|n|n用于镶嵌到[剑,衣]上.|n镶嵌后不可取下!|n不需要的宝石可以在宠物处熔炼,用于宝石抽奖. | I62: =RC[-2] -> 二.乙|cFF1BE6B8[宝石]幽神奇石|r | J62: =RC[-2] -> |cFFFFFF99基础属性|r|n智力:7500|n护甲:37|n伤害增幅:2|n|n用于镶嵌到[剑,衣]上.|n镶嵌后不可取下!|n不需要的宝石可以在宠物处熔炼,用于宝石抽奖. | L62: ="ReplaceableTextures\CommandButtons\BTN_gem_"&RC[-9]&".blp" -> ReplaceableTextures\CommandButtons\BTN_gem_2.blp | N62: =VLOOKUP(RC[-10],Sheet2!R7C1:R12C5,5,0) -> model\item\texiao_zhongjiguangzhu.mdx | W62: 3 | X62: Campaign | Y62: =1000*POWER(2,RC[-22]) -> 4000 | Z62: 235 | AA62: 0 | AB62: =VLOOKUP(RC[-25],Sheet2!R13C1:R19C4,4,0)*VLOOKUP(RC[-24],Sheet2!R7C1:R12C4,4,0) -> 9 | AC62: 0 | AQ62: 1
A63: OBJECT | B63: F20R | C63: 2 | D63: B | E63: srbd | F63: ZZZY | G63: =Sheet1!R[-1]C[25] -> 二.乙|cFF1BE6B8[宝石]望月直玉|r | H63: =Sheet1!R[-1]C[25] -> |cFFFFFF99基础属性|r|n敏捷:7500|n护甲:37|n伤害增幅:2|n|n用于镶嵌到[剑,衣]上.|n镶嵌后不可取下!|n不需要的宝石可以在宠物处熔炼,用于宝石抽奖. | I63: =RC[-2] -> 二.乙|cFF1BE6B8[宝石]望月直玉|r | J63: =RC[-2] -> |cFFFFFF99基础属性|r|n敏捷:7500|n护甲:37|n伤害增幅:2|n|n用于镶嵌到[剑,衣]上.|n镶嵌后不可取下!|n不需要的宝石可以在宠物处熔炼,用于宝石抽奖. | L63: ="ReplaceableTextures\CommandButtons\BTN_gem_"&RC[-9]&".blp" -> ReplaceableTextures\CommandButtons\BTN_gem_2.blp | N63: =VLOOKUP(RC[-10],Sheet2!R7C1:R12C5,5,0) -> model\item\texiao_zhongjiguangzhu.mdx | W63: 3 | X63: Campaign | Y63: =1000*POWER(2,RC[-22]) -> 4000 | Z63: 235 | AA63: 0 | AB63: =VLOOKUP(RC[-25],Sheet2!R13C1:R19C4,4,0)*VLOOKUP(RC[-24],Sheet2!R7C1:R12C4,4,0) -> 9 | AC63: 0 | AQ63: 1
A64: OBJECT | B64: F20S | C64: 2 | D64: A | E64: srbd | F64: ZZZY | G64: =Sheet1!R[-1]C[25] -> 二.甲|cFF33FF00[宝石]武动之魂|r | H64: =Sheet1!R[-1]C[25] -> |cFFFFFF99基础属性|r|n力量:3600|n敏捷:3600|n智力:3600|n|n|cFFFFFF55附加属性|r(%)|n攻速:7|n伤害增幅:4|n|n用于镶嵌到[剑,衣]上.|n镶嵌后不可取下!|n不需要的宝石可以在宠物处熔炼,用于宝石抽奖. | I64: =RC[-2] -> 二.甲|cFF33FF00[宝石]武动之魂|r | J64: =RC[-2] -> |cFFFFFF99基础属性|r|n力量:3600|n敏捷:3600|n智力:3600|n|n|cFFFFFF55附加属性|r(%)|n攻速:7|n伤害增幅:4|n|n用于镶嵌到[剑,衣]上.|n镶嵌后不可取下!|n不需要的宝石可以在宠物处熔炼,用于宝石抽奖. | L64: ="ReplaceableTextures\CommandButtons\BTN_gem_"&RC[-9]&".blp" -> ReplaceableTextures\CommandButtons\BTN_gem_2.blp | N64: =VLOOKUP(RC[-10],Sheet2!R7C1:R12C5,5,0) -> model\item\texiao_zhongjiguangzhu2.mdx | W64: 3 | X64: Campaign | Y64: =1000*POWER(2,RC[-22]) -> 4000 | Z64: 235 | AA64: 0 | AB64: =VLOOKUP(RC[-25],Sheet2!R13C1:R19C4,4,0)*VLOOKUP(RC[-24],Sheet2!R7C1:R12C4,4,0) -> 12 | AC64: 0 | AQ64: 1
A65: OBJECT | B65: F20T | C65: 2 | D65: A | E65: srbd | F65: ZZZY | G65: =Sheet1!R[-1]C[25] -> 二.甲|cFF33FF00[宝石]瘟疫之源|r | H65: =Sheet1!R[-1]C[25] -> |cFFFFFF99基础属性|r|n攻击:24000|n|n|cFFFFFF55附加属性|r(%)|n攻速:7|n伤害增幅:4|n|n用于镶嵌到[剑,衣]上.|n镶嵌后不可取下!|n不需要的宝石可以在宠物处熔炼,用于宝石抽奖. | I65: =RC[-2] -> 二.甲|cFF33FF00[宝石]瘟疫之源|r | J65: =RC[-2] -> |cFFFFFF99基础属性|r|n攻击:24000|n|n|cFFFFFF55附加属性|r(%)|n攻速:7|n伤害增幅:4|n|n用于镶嵌到[剑,衣]上.|n镶嵌后不可取下!|n不需要的宝石可以在宠物处熔炼,用于宝石抽奖. | L65: ="ReplaceableTextures\CommandButtons\BTN_gem_"&RC[-9]&".blp" -> ReplaceableTextures\CommandButtons\BTN_gem_2.blp | N65: =VLOOKUP(RC[-10],Sheet2!R7C1:R12C5,5,0) -> model\item\texiao_zhongjiguangzhu2.mdx | W65: 3 | X65: Campaign | Y65: =1000*POWER(2,RC[-22]) -> 4000 | Z65: 235 | AA65: 0 | AB65: =VLOOKUP(RC[-25],Sheet2!R13C1:R19C4,4,0)*VLOOKUP(RC[-24],Sheet2!R7C1:R12C4,4,0) -> 12 | AC65: 0 | AQ65: 1
A66: OBJECT | B66: F20U | C66: 2 | D66: S | E66: srbd | F66: ZZZY | G66: =Sheet1!R[-1]C[25] -> 二.绝|cFFFF9933[宝石]龙战 - 怒心|r | H66: =Sheet1!R[-1]C[25] -> |cFFFFFF99基础属性|r|n血量:90000|n护甲:225|n|n|cFFFFFF55附加属性|r(%)|n攻击吸血:1|n伤害增幅:4|n|n用于镶嵌到[剑,衣]上.|n镶嵌后不可取下!|n不需要的宝石可以在宠物处熔炼,用于宝石抽奖. | I66: =RC[-2] -> 二.绝|cFFFF9933[宝石]龙战 - 怒心|r | J66: =RC[-2] -> |cFFFFFF99基础属性|r|n血量:90000|n护甲:225|n|n|cFFFFFF55附加属性|r(%)|n攻击吸血:1|n伤害增幅:4|n|n用于镶嵌到[剑,衣]上.|n镶嵌后不可取下!|n不需要的宝石可以在宠物处熔炼,用于宝石抽奖. | L66: ="ReplaceableTextures\CommandButtons\BTN_gem_"&RC[-9]&".blp" -> ReplaceableTextures\CommandButtons\BTN_gem_2.blp | N66: =VLOOKUP(RC[-10],Sheet2!R7C1:R12C5,5,0) -> model\item\texiao_gaojiguangzhu.mdx | W66: 3 | X66: Campaign | Y66: =1000*POWER(2,RC[-22]) -> 4000 | Z66: 235 | AA66: 0 | AB66: =VLOOKUP(RC[-25],Sheet2!R13C1:R19C4,4,0)*VLOOKUP(RC[-24],Sheet2!R7C1:R12C4,4,0) -> 15 | AC66: 0 | AQ66: 1
A67: OBJECT | B67: F20V | C67: 2 | D67: S | E67: srbd | F67: ZZZY | G67: =Sheet1!R[-1]C[25] -> 二.绝|cFFFF9933[宝石]龙战 - 激魂|r | H67: =Sheet1!R[-1]C[25] -> |cFFFFFF99基础属性|r|n攻击:7500|n|n|cFFFFFF55附加属性|r(%)|n暴击概率:6|n暴击伤害:24|n伤害增幅:4|n|n用于镶嵌到[剑,衣]上.|n镶嵌后不可取下!|n不需要的宝石可以在宠物处熔炼,用于宝石抽奖. | I67: =RC[-2] -> 二.绝|cFFFF9933[宝石]龙战 - 激魂|r | J67: =RC[-2] -> |cFFFFFF99基础属性|r|n攻击:7500|n|n|cFFFFFF55附加属性|r(%)|n暴击概率:6|n暴击伤害:24|n伤害增幅:4|n|n用于镶嵌到[剑,衣]上.|n镶嵌后不可取下!|n不需要的宝石可以在宠物处熔炼,用于宝石抽奖. | L67: ="ReplaceableTextures\CommandButtons\BTN_gem_"&RC[-9]&".blp" -> ReplaceableTextures\CommandButtons\BTN_gem_2.blp | N67: =VLOOKUP(RC[-10],Sheet2!R7C1:R12C5,5,0) -> model\item\texiao_gaojiguangzhu.mdx | W67: 3 | X67: Campaign | Y67: =1000*POWER(2,RC[-22]) -> 4000 | Z67: 235 | AA67: 0 | AB67: =VLOOKUP(RC[-25],Sheet2!R13C1:R19C4,4,0)*VLOOKUP(RC[-24],Sheet2!R7C1:R12C4,4,0) -> 15 | AC67: 0 | AQ67: 1
A68: OBJECT | B68: F20W | C68: 2 | D68: X | E68: srbd | F68: ZZZY | G68: =Sheet1!R[-1]C[25] -> 二.神|Cffff0000[宝石]上古遗物-无魂|r | H68: =Sheet1!R[-1]C[25] -> |cFFFFFF99基础属性|r|n血量:180000|n护甲:300|n|n|cFFFFFF55附加属性|r(%)|n暴击伤害:24|n伤害增幅:9|n伤害减免:10|n|n用于镶嵌到[剑,衣]上.|n镶嵌后不可取下!|n不需要的宝石可以在宠物处熔炼,用于宝石抽奖. | I68: =RC[-2] -> 二.神|Cffff0000[宝石]上古遗物-无魂|r | J68: =RC[-2] -> |cFFFFFF99基础属性|r|n血量:180000|n护甲:300|n|n|cFFFFFF55附加属性|r(%)|n暴击伤害:24|n伤害增幅:9|n伤害减免:10|n|n用于镶嵌到[剑,衣]上.|n镶嵌后不可取下!|n不需要的宝石可以在宠物处熔炼,用于宝石抽奖. | L68: ="ReplaceableTextures\CommandButtons\BTN_gem_"&RC[-9]&".blp" -> ReplaceableTextures\CommandButtons\BTN_gem_2.blp | N68: =VLOOKUP(RC[-10],Sheet2!R7C1:R12C5,5,0) -> model\item\texiao_gaojiguangzhu.mdx | W68: 3 | X68: Campaign | Y68: =1000*POWER(2,RC[-22]) -> 4000 | Z68: 235 | AA68: 0 | AB68: =VLOOKUP(RC[-25],Sheet2!R13C1:R19C4,4,0)*VLOOKUP(RC[-24],Sheet2!R7C1:R12C4,4,0) -> 18 | AC68: 0 | AQ68: 1
A69: COMMENT | B69: F300 | C69: 3 | D69: D | E69: srbd | F69: ZZZY | G69: =Sheet1!R[-1]C[25] -> 三.丁|cFF999999[宝石]蚀肉|r | H69: =Sheet1!R[-1]C[25] -> |n|n用于镶嵌到[剑,衣]上.|n镶嵌后不可取下!|n不需要的宝石可以在宠物处熔炼,用于宝石抽奖. | I69: =RC[-2] -> 三.丁|cFF999999[宝石]蚀肉|r | J69: =RC[-2] -> |n|n用于镶嵌到[剑,衣]上.|n镶嵌后不可取下!|n不需要的宝石可以在宠物处熔炼,用于宝石抽奖. | L69: ="ReplaceableTextures\CommandButtons\BTN_gem_"&RC[-9]&".blp" -> ReplaceableTextures\CommandButtons\BTN_gem_3.blp | N69: =VLOOKUP(RC[-10],Sheet2!R7C1:R12C5,5,0) -> model\item\texiao_dijiguangzhu.mdx | W69: 3 | X69: Campaign | Y69: =1000*POWER(2,RC[-22]) -> 8000 | Z69: 235 | AA69: 0 | AB69: =VLOOKUP(RC[-25],Sheet2!R13C1:R19C4,4,0)*VLOOKUP(RC[-24],Sheet2!R7C1:R12C4,4,0) -> 8 | AC69: 0 | AQ69: 1
A70: COMMENT | B70: F301 | C70: 3 | D70: D | E70: srbd | F70: ZZZY | G70: =Sheet1!R[-1]C[25] -> 三.丁|cFF999999[宝石]镏金|r | H70: =Sheet1!R[-1]C[25] -> |n|n用于镶嵌到[剑,衣]上.|n镶嵌后不可取下!|n不需要的宝石可以在宠物处熔炼,用于宝石抽奖. | I70: =RC[-2] -> 三.丁|cFF999999[宝石]镏金|r | J70: =RC[-2] -> |n|n用于镶嵌到[剑,衣]上.|n镶嵌后不可取下!|n不需要的宝石可以在宠物处熔炼,用于宝石抽奖. | L70: ="ReplaceableTextures\CommandButtons\BTN_gem_"&RC[-9]&".blp" -> ReplaceableTextures\CommandButtons\BTN_gem_3.blp | N70: =VLOOKUP(RC[-10],Sheet2!R7C1:R12C5,5,0) -> model\item\texiao_dijiguangzhu.mdx | W70: 3 | X70: Campaign | Y70: =1000*POWER(2,RC[-22]) -> 8000 | Z70: 235 | AA70: 0 | AB70: =VLOOKUP(RC[-25],Sheet2!R13C1:R19C4,4,0)*VLOOKUP(RC[-24],Sheet2!R7C1:R12C4,4,0) -> 8 | AC70: 0 | AQ70: 1
A71: COMMENT | B71: F302 | C71: 3 | D71: D | E71: srbd | F71: ZZZY | G71: =Sheet1!R[-1]C[25] -> 三.丁|cFF999999[宝石]豹爪|r | H71: =Sheet1!R[-1]C[25] -> |n|n用于镶嵌到[剑,衣]上.|n镶嵌后不可取下!|n不需要的宝石可以在宠物处熔炼,用于宝石抽奖. | I71: =RC[-2] -> 三.丁|cFF999999[宝石]豹爪|r | J71: =RC[-2] -> |n|n用于镶嵌到[剑,衣]上.|n镶嵌后不可取下!|n不需要的宝石可以在宠物处熔炼,用于宝石抽奖. | L71: ="ReplaceableTextures\CommandButtons\BTN_gem_"&RC[-9]&".blp" -> ReplaceableTextures\CommandButtons\BTN_gem_3.blp | N71: =VLOOKUP(RC[-10],Sheet2!R7C1:R12C5,5,0) -> model\item\texiao_dijiguangzhu.mdx | W71: 3 | X71: Campaign | Y71: =1000*POWER(2,RC[-22]) -> 8000 | Z71: 235 | AA71: 0 | AB71: =VLOOKUP(RC[-25],Sheet2!R13C1:R19C4,4,0)*VLOOKUP(RC[-24],Sheet2!R7C1:R12C4,4,0) -> 8 | AC71: 0 | AQ71: 1
A72: COMMENT | B72: F303 | C72: 3 | D72: D | E72: srbd | F72: ZZZY | G72: =Sheet1!R[-1]C[25] -> 三.丁|cFF999999[宝石]影游|r | H72: =Sheet1!R[-1]C[25] -> |n|n用于镶嵌到[剑,衣]上.|n镶嵌后不可取下!|n不需要的宝石可以在宠物处熔炼,用于宝石抽奖. | I72: =RC[-2] -> 三.丁|cFF999999[宝石]影游|r | J72: =RC[-2] -> |n|n用于镶嵌到[剑,衣]上.|n镶嵌后不可取下!|n不需要的宝石可以在宠物处熔炼,用于宝石抽奖. | L72: ="ReplaceableTextures\CommandButtons\BTN_gem_"&RC[-9]&".blp" -> ReplaceableTextures\CommandButtons\BTN_gem_3.blp | N72: =VLOOKUP(RC[-10],Sheet2!R7C1:R12C5,5,0) -> model\item\texiao_dijiguangzhu.mdx | W72: 3 | X72: Campaign | Y72: =1000*POWER(2,RC[-22]) -> 8000 | Z72: 235 | AA72: 0 | AB72: =VLOOKUP(RC[-25],Sheet2!R13C1:R19C4,4,0)*VLOOKUP(RC[-24],Sheet2!R7C1:R12C4,4,0) -> 8 | AC72: 0 | AQ72: 1
A73: COMMENT | B73: F304 | C73: 3 | D73: D | E73: srbd | F73: ZZZY | G73: =Sheet1!R[-1]C[25] -> 三.丁|cFF999999[宝石]凤王|r | H73: =Sheet1!R[-1]C[25] -> |n|n用于镶嵌到[剑,衣]上.|n镶嵌后不可取下!|n不需要的宝石可以在宠物处熔炼,用于宝石抽奖. | I73: =RC[-2] -> 三.丁|cFF999999[宝石]凤王|r | J73: =RC[-2] -> |n|n用于镶嵌到[剑,衣]上.|n镶嵌后不可取下!|n不需要的宝石可以在宠物处熔炼,用于宝石抽奖. | L73: ="ReplaceableTextures\CommandButtons\BTN_gem_"&RC[-9]&".blp" -> ReplaceableTextures\CommandButtons\BTN_gem_3.blp | N73: =VLOOKUP(RC[-10],Sheet2!R7C1:R12C5,5,0) -> model\item\texiao_dijiguangzhu.mdx | W73: 3 | X73: Campaign | Y73: =1000*POWER(2,RC[-22]) -> 8000 | Z73: 235 | AA73: 0 | AB73: =VLOOKUP(RC[-25],Sheet2!R13C1:R19C4,4,0)*VLOOKUP(RC[-24],Sheet2!R7C1:R12C4,4,0) -> 8 | AC73: 0 | AQ73: 1
A74: COMMENT | B74: F305 | C74: 3 | D74: D | E74: srbd | F74: ZZZY | G74: =Sheet1!R[-1]C[25] -> 三.丁|cFF999999[宝石]龙鳞|r | H74: =Sheet1!R[-1]C[25] -> |n|n用于镶嵌到[剑,衣]上.|n镶嵌后不可取下!|n不需要的宝石可以在宠物处熔炼,用于宝石抽奖. | I74: =RC[-2] -> 三.丁|cFF999999[宝石]龙鳞|r | J74: =RC[-2] -> |n|n用于镶嵌到[剑,衣]上.|n镶嵌后不可取下!|n不需要的宝石可以在宠物处熔炼,用于宝石抽奖. | L74: ="ReplaceableTextures\CommandButtons\BTN_gem_"&RC[-9]&".blp" -> ReplaceableTextures\CommandButtons\BTN_gem_3.blp | N74: =VLOOKUP(RC[-10],Sheet2!R7C1:R12C5,5,0) -> model\item\texiao_dijiguangzhu.mdx | W74: 3 | X74: Campaign | Y74: =1000*POWER(2,RC[-22]) -> 8000 | Z74: 235 | AA74: 0 | AB74: =VLOOKUP(RC[-25],Sheet2!R13C1:R19C4,4,0)*VLOOKUP(RC[-24],Sheet2!R7C1:R12C4,4,0) -> 8 | AC74: 0 | AQ74: 1
A75: COMMENT | B75: F306 | C75: 3 | D75: D | E75: srbd | F75: ZZZY | G75: =Sheet1!R[-1]C[25] -> 三.丁|cFF999999[宝石]佛光|r | H75: =Sheet1!R[-1]C[25] -> |n|n用于镶嵌到[剑,衣]上.|n镶嵌后不可取下!|n不需要的宝石可以在宠物处熔炼,用于宝石抽奖. | I75: =RC[-2] -> 三.丁|cFF999999[宝石]佛光|r | J75: =RC[-2] -> |n|n用于镶嵌到[剑,衣]上.|n镶嵌后不可取下!|n不需要的宝石可以在宠物处熔炼,用于宝石抽奖. | L75: ="ReplaceableTextures\CommandButtons\BTN_gem_"&RC[-9]&".blp" -> ReplaceableTextures\CommandButtons\BTN_gem_3.blp | N75: =VLOOKUP(RC[-10],Sheet2!R7C1:R12C5,5,0) -> model\item\texiao_dijiguangzhu.mdx | W75: 3 | X75: Campaign | Y75: =1000*POWER(2,RC[-22]) -> 8000 | Z75: 235 | AA75: 0 | AB75: =VLOOKUP(RC[-25],Sheet2!R13C1:R19C4,4,0)*VLOOKUP(RC[-24],Sheet2!R7C1:R12C4,4,0) -> 8 | AC75: 0 | AQ75: 1
A76: COMMENT | B76: F307 | C76: 3 | D76: D | E76: srbd | F76: ZZZY | G76: =Sheet1!R[-1]C[25] -> 三.丁|cFF999999[宝石]非影|r | H76: =Sheet1!R[-1]C[25] -> |n|n用于镶嵌到[剑,衣]上.|n镶嵌后不可取下!|n不需要的宝石可以在宠物处熔炼,用于宝石抽奖. | I76: =RC[-2] -> 三.丁|cFF999999[宝石]非影|r | J76: =RC[-2] -> |n|n用于镶嵌到[剑,衣]上.|n镶嵌后不可取下!|n不需要的宝石可以在宠物处熔炼,用于宝石抽奖. | L76: ="ReplaceableTextures\CommandButtons\BTN_gem_"&RC[-9]&".blp" -> ReplaceableTextures\CommandButtons\BTN_gem_3.blp | N76: =VLOOKUP(RC[-10],Sheet2!R7C1:R12C5,5,0) -> model\item\texiao_dijiguangzhu.mdx | W76: 3 | X76: Campaign | Y76: =1000*POWER(2,RC[-22]) -> 8000 | Z76: 235 | AA76: 0 | AB76: =VLOOKUP(RC[-25],Sheet2!R13C1:R19C4,4,0)*VLOOKUP(RC[-24],Sheet2!R7C1:R12C4,4,0) -> 8 | AC76: 0 | AQ76: 1
A77: COMMENT | B77: F308 | C77: 3 | D77: D | E77: srbd | F77: ZZZY | G77: =Sheet1!R[-1]C[25] -> 三.丁|cFF999999[宝石]万仞|r | H77: =Sheet1!R[-1]C[25] -> |n|n用于镶嵌到[剑,衣]上.|n镶嵌后不可取下!|n不需要的宝石可以在宠物处熔炼,用于宝石抽奖. | I77: =RC[-2] -> 三.丁|cFF999999[宝石]万仞|r | J77: =RC[-2] -> |n|n用于镶嵌到[剑,衣]上.|n镶嵌后不可取下!|n不需要的宝石可以在宠物处熔炼,用于宝石抽奖. | L77: ="ReplaceableTextures\CommandButtons\BTN_gem_"&RC[-9]&".blp" -> ReplaceableTextures\CommandButtons\BTN_gem_3.blp | N77: =VLOOKUP(RC[-10],Sheet2!R7C1:R12C5,5,0) -> model\item\texiao_dijiguangzhu.mdx | W77: 3 | X77: Campaign | Y77: =1000*POWER(2,RC[-22]) -> 8000 | Z77: 235 | AA77: 0 | AB77: =VLOOKUP(RC[-25],Sheet2!R13C1:R19C4,4,0)*VLOOKUP(RC[-24],Sheet2!R7C1:R12C4,4,0) -> 8 | AC77: 0 | AQ77: 1
A78: COMMENT | B78: F309 | C78: 3 | D78: D | E78: srbd | F78: ZZZY | G78: =Sheet1!R[-1]C[25] -> 三.丁|cFF999999[宝石]绣云|r | H78: =Sheet1!R[-1]C[25] -> |n|n用于镶嵌到[剑,衣]上.|n镶嵌后不可取下!|n不需要的宝石可以在宠物处熔炼,用于宝石抽奖. | I78: =RC[-2] -> 三.丁|cFF999999[宝石]绣云|r | J78: =RC[-2] -> |n|n用于镶嵌到[剑,衣]上.|n镶嵌后不可取下!|n不需要的宝石可以在宠物处熔炼,用于宝石抽奖. | L78: ="ReplaceableTextures\CommandButtons\BTN_gem_"&RC[-9]&".blp" -> ReplaceableTextures\CommandButtons\BTN_gem_3.blp | N78: =VLOOKUP(RC[-10],Sheet2!R7C1:R12C5,5,0) -> model\item\texiao_dijiguangzhu.mdx | W78: 3 | X78: Campaign | Y78: =1000*POWER(2,RC[-22]) -> 8000 | Z78: 235 | AA78: 0 | AB78: =VLOOKUP(RC[-25],Sheet2!R13C1:R19C4,4,0)*VLOOKUP(RC[-24],Sheet2!R7C1:R12C4,4,0) -> 8 | AC78: 0 | AQ78: 1
A79: COMMENT | B79: F30A | C79: 3 | D79: D | E79: srbd | F79: ZZZY | G79: =Sheet1!R[-1]C[25] -> 三.丁|cFF999999[宝石]黑鸦|r | H79: =Sheet1!R[-1]C[25] -> |n|n用于镶嵌到[剑,衣]上.|n镶嵌后不可取下!|n不需要的宝石可以在宠物处熔炼,用于宝石抽奖. | I79: =RC[-2] -> 三.丁|cFF999999[宝石]黑鸦|r | J79: =RC[-2] -> |n|n用于镶嵌到[剑,衣]上.|n镶嵌后不可取下!|n不需要的宝石可以在宠物处熔炼,用于宝石抽奖. | L79: ="ReplaceableTextures\CommandButtons\BTN_gem_"&RC[-9]&".blp" -> ReplaceableTextures\CommandButtons\BTN_gem_3.blp | N79: =VLOOKUP(RC[-10],Sheet2!R7C1:R12C5,5,0) -> model\item\texiao_dijiguangzhu.mdx | W79: 3 | X79: Campaign | Y79: =1000*POWER(2,RC[-22]) -> 8000 | Z79: 235 | AA79: 0 | AB79: =VLOOKUP(RC[-25],Sheet2!R13C1:R19C4,4,0)*VLOOKUP(RC[-24],Sheet2!R7C1:R12C4,4,0) -> 8 | AC79: 0 | AQ79: 1
A80: COMMENT | B80: F30B | C80: 3 | D80: D | E80: srbd | F80: ZZZY | G80: =Sheet1!R[-1]C[25] -> 三.丁|cFF999999[宝石]封焰|r | H80: =Sheet1!R[-1]C[25] -> |n|n用于镶嵌到[剑,衣]上.|n镶嵌后不可取下!|n不需要的宝石可以在宠物处熔炼,用于宝石抽奖. | I80: =RC[-2] -> 三.丁|cFF999999[宝石]封焰|r | J80: =RC[-2] -> |n|n用于镶嵌到[剑,衣]上.|n镶嵌后不可取下!|n不需要的宝石可以在宠物处熔炼,用于宝石抽奖. | L80: ="ReplaceableTextures\CommandButtons\BTN_gem_"&RC[-9]&".blp" -> ReplaceableTextures\CommandButtons\BTN_gem_3.blp | N80: =VLOOKUP(RC[-10],Sheet2!R7C1:R12C5,5,0) -> model\item\texiao_dijiguangzhu.mdx | W80: 3 | X80: Campaign | Y80: =1000*POWER(2,RC[-22]) -> 8000 | Z80: 235 | AA80: 0 | AB80: =VLOOKUP(RC[-25],Sheet2!R13C1:R19C4,4,0)*VLOOKUP(RC[-24],Sheet2!R7C1:R12C4,4,0) -> 8 | AC80: 0 | AQ80: 1
A81: COMMENT | B81: F30C | C81: 3 | D81: D | E81: srbd | F81: ZZZY | G81: =Sheet1!R[-1]C[25] -> 三.丁|cFF999999[宝石]布锦|r | H81: =Sheet1!R[-1]C[25] -> |n|n用于镶嵌到[剑,衣]上.|n镶嵌后不可取下!|n不需要的宝石可以在宠物处熔炼,用于宝石抽奖. | I81: =RC[-2] -> 三.丁|cFF999999[宝石]布锦|r | J81: =RC[-2] -> |n|n用于镶嵌到[剑,衣]上.|n镶嵌后不可取下!|n不需要的宝石可以在宠物处熔炼,用于宝石抽奖. | L81: ="ReplaceableTextures\CommandButtons\BTN_gem_"&RC[-9]&".blp" -> ReplaceableTextures\CommandButtons\BTN_gem_3.blp | N81: =VLOOKUP(RC[-10],Sheet2!R7C1:R12C5,5,0) -> model\item\texiao_dijiguangzhu.mdx | W81: 3 | X81: Campaign | Y81: =1000*POWER(2,RC[-22]) -> 8000 | Z81: 235 | AA81: 0 | AB81: =VLOOKUP(RC[-25],Sheet2!R13C1:R19C4,4,0)*VLOOKUP(RC[-24],Sheet2!R7C1:R12C4,4,0) -> 8 | AC81: 0 | AQ81: 1
A82: COMMENT | B82: F30D | C82: 3 | D82: D | E82: srbd | F82: ZZZY | G82: =Sheet1!R[-1]C[25] -> 三.丁|cFF999999[宝石]孤星|r | H82: =Sheet1!R[-1]C[25] -> |n|n用于镶嵌到[剑,衣]上.|n镶嵌后不可取下!|n不需要的宝石可以在宠物处熔炼,用于宝石抽奖. | I82: =RC[-2] -> 三.丁|cFF999999[宝石]孤星|r | J82: =RC[-2] -> |n|n用于镶嵌到[剑,衣]上.|n镶嵌后不可取下!|n不需要的宝石可以在宠物处熔炼,用于宝石抽奖. | L82: ="ReplaceableTextures\CommandButtons\BTN_gem_"&RC[-9]&".blp" -> ReplaceableTextures\CommandButtons\BTN_gem_3.blp | N82: =VLOOKUP(RC[-10],Sheet2!R7C1:R12C5,5,0) -> model\item\texiao_dijiguangzhu.mdx | W82: 3 | X82: Campaign | Y82: =1000*POWER(2,RC[-22]) -> 8000 | Z82: 235 | AA82: 0 | AB82: =VLOOKUP(RC[-25],Sheet2!R13C1:R19C4,4,0)*VLOOKUP(RC[-24],Sheet2!R7C1:R12C4,4,0) -> 8 | AC82: 0 | AQ82: 1
A83: COMMENT | B83: F30E | C83: 3 | D83: D | E83: srbd | F83: ZZZY | G83: =Sheet1!R[-1]C[25] -> 三.丁|cFF999999[宝石]龙爪|r | H83: =Sheet1!R[-1]C[25] -> |n|n用于镶嵌到[剑,衣]上.|n镶嵌后不可取下!|n不需要的宝石可以在宠物处熔炼,用于宝石抽奖. | I83: =RC[-2] -> 三.丁|cFF999999[宝石]龙爪|r | J83: =RC[-2] -> |n|n用于镶嵌到[剑,衣]上.|n镶嵌后不可取下!|n不需要的宝石可以在宠物处熔炼,用于宝石抽奖. | L83: ="ReplaceableTextures\CommandButtons\BTN_gem_"&RC[-9]&".blp" -> ReplaceableTextures\CommandButtons\BTN_gem_3.blp | N83: =VLOOKUP(RC[-10],Sheet2!R7C1:R12C5,5,0) -> model\item\texiao_dijiguangzhu.mdx | W83: 3 | X83: Campaign | Y83: =1000*POWER(2,RC[-22]) -> 8000 | Z83: 235 | AA83: 0 | AB83: =VLOOKUP(RC[-25],Sheet2!R13C1:R19C4,4,0)*VLOOKUP(RC[-24],Sheet2!R7C1:R12C4,4,0) -> 8 | AC83: 0 | AQ83: 1
A84: COMMENT | B84: F30F | C84: 3 | D84: D | E84: srbd | F84: ZZZY | G84: =Sheet1!R[-1]C[25] -> 三.丁|cFF999999[宝石]螺旋|r | H84: =Sheet1!R[-1]C[25] -> |n|n用于镶嵌到[剑,衣]上.|n镶嵌后不可取下!|n不需要的宝石可以在宠物处熔炼,用于宝石抽奖. | I84: =RC[-2] -> 三.丁|cFF999999[宝石]螺旋|r | J84: =RC[-2] -> |n|n用于镶嵌到[剑,衣]上.|n镶嵌后不可取下!|n不需要的宝石可以在宠物处熔炼,用于宝石抽奖. | L84: ="ReplaceableTextures\CommandButtons\BTN_gem_"&RC[-9]&".blp" -> ReplaceableTextures\CommandButtons\BTN_gem_3.blp | N84: =VLOOKUP(RC[-10],Sheet2!R7C1:R12C5,5,0) -> model\item\texiao_dijiguangzhu.mdx | W84: 3 | X84: Campaign | Y84: =1000*POWER(2,RC[-22]) -> 8000 | Z84: 235 | AA84: 0 | AB84: =VLOOKUP(RC[-25],Sheet2!R13C1:R19C4,4,0)*VLOOKUP(RC[-24],Sheet2!R7C1:R12C4,4,0) -> 8 | AC84: 0 | AQ84: 1
A85: OBJECT | B85: F30G | C85: 3 | D85: C | E85: srbd | F85: ZZZY | G85: =Sheet1!R[-1]C[25] -> 三.丙|cFF99FF66[宝石]断魂石|r | H85: =Sheet1!R[-1]C[25] -> |cFFFFFF99基础属性|r|n力量:13500|n敏捷:13500|n智力:13500|n|n用于镶嵌到[剑,衣]上.|n镶嵌后不可取下!|n不需要的宝石可以在宠物处熔炼,用于宝石抽奖. | I85: =RC[-2] -> 三.丙|cFF99FF66[宝石]断魂石|r | J85: =RC[-2] -> |cFFFFFF99基础属性|r|n力量:13500|n敏捷:13500|n智力:13500|n|n用于镶嵌到[剑,衣]上.|n镶嵌后不可取下!|n不需要的宝石可以在宠物处熔炼,用于宝石抽奖. | L85: ="ReplaceableTextures\CommandButtons\BTN_gem_"&RC[-9]&".blp" -> ReplaceableTextures\CommandButtons\BTN_gem_3.blp | N85: =VLOOKUP(RC[-10],Sheet2!R7C1:R12C5,5,0) -> model\item\texiao_dijiguangzhu.mdx | W85: 3 | X85: Campaign | Y85: =1000*POWER(2,RC[-22]) -> 8000 | Z85: 235 | AA85: 0 | AB85: =VLOOKUP(RC[-25],Sheet2!R13C1:R19C4,4,0)*VLOOKUP(RC[-24],Sheet2!R7C1:R12C4,4,0) -> 16 | AC85: 0 | AQ85: 1
A86: OBJECT | B86: F30H | C86: 3 | D86: C | E86: srbd | F86: ZZZY | G86: =Sheet1!R[-1]C[25] -> 三.丙|cFF99FF66[宝石]神鸩石|r | H86: =Sheet1!R[-1]C[25] -> |cFFFFFF99基础属性|r|n攻击:45000|n|n用于镶嵌到[剑,衣]上.|n镶嵌后不可取下!|n不需要的宝石可以在宠物处熔炼,用于宝石抽奖. | I86: =RC[-2] -> 三.丙|cFF99FF66[宝石]神鸩石|r | J86: =RC[-2] -> |cFFFFFF99基础属性|r|n攻击:45000|n|n用于镶嵌到[剑,衣]上.|n镶嵌后不可取下!|n不需要的宝石可以在宠物处熔炼,用于宝石抽奖. | L86: ="ReplaceableTextures\CommandButtons\BTN_gem_"&RC[-9]&".blp" -> ReplaceableTextures\CommandButtons\BTN_gem_3.blp | N86: =VLOOKUP(RC[-10],Sheet2!R7C1:R12C5,5,0) -> model\item\texiao_dijiguangzhu.mdx | W86: 3 | X86: Campaign | Y86: =1000*POWER(2,RC[-22]) -> 8000 | Z86: 235 | AA86: 0 | AB86: =VLOOKUP(RC[-25],Sheet2!R13C1:R19C4,4,0)*VLOOKUP(RC[-24],Sheet2!R7C1:R12C4,4,0) -> 16 | AC86: 0 | AQ86: 1
A87: OBJECT | B87: F30I | C87: 3 | D87: C | E87: srbd | F87: ZZZY | G87: =Sheet1!R[-1]C[25] -> 三.丙|cFF99FF66[宝石]影游石|r | H87: =Sheet1!R[-1]C[25] -> |n|n|cFFFFFF55附加属性|r(%)|n攻击吸血:2|n|n用于镶嵌到[剑,衣]上.|n镶嵌后不可取下!|n不需要的宝石可以在宠物处熔炼,用于宝石抽奖. | I87: =RC[-2] -> 三.丙|cFF99FF66[宝石]影游石|r | J87: =RC[-2] -> |n|n|cFFFFFF55附加属性|r(%)|n攻击吸血:2|n|n用于镶嵌到[剑,衣]上.|n镶嵌后不可取下!|n不需要的宝石可以在宠物处熔炼,用于宝石抽奖. | L87: ="ReplaceableTextures\CommandButtons\BTN_gem_"&RC[-9]&".blp" -> ReplaceableTextures\CommandButtons\BTN_gem_3.blp | N87: =VLOOKUP(RC[-10],Sheet2!R7C1:R12C5,5,0) -> model\item\texiao_dijiguangzhu.mdx | W87: 3 | X87: Campaign | Y87: =1000*POWER(2,RC[-22]) -> 8000 | Z87: 235 | AA87: 0 | AB87: =VLOOKUP(RC[-25],Sheet2!R13C1:R19C4,4,0)*VLOOKUP(RC[-24],Sheet2!R7C1:R12C4,4,0) -> 16 | AC87: 0 | AQ87: 1
A88: OBJECT | B88: F30J | C88: 3 | D88: C | E88: srbd | F88: ZZZY | G88: =Sheet1!R[-1]C[25] -> 三.丙|cFF99FF66[宝石]邪光石|r | H88: =Sheet1!R[-1]C[25] -> |cFFFFFF99基础属性|r|n血量:225000|n护甲:250|n|n用于镶嵌到[剑,衣]上.|n镶嵌后不可取下!|n不需要的宝石可以在宠物处熔炼,用于宝石抽奖. | I88: =RC[-2] -> 三.丙|cFF99FF66[宝石]邪光石|r | J88: =RC[-2] -> |cFFFFFF99基础属性|r|n血量:225000|n护甲:250|n|n用于镶嵌到[剑,衣]上.|n镶嵌后不可取下!|n不需要的宝石可以在宠物处熔炼,用于宝石抽奖. | L88: ="ReplaceableTextures\CommandButtons\BTN_gem_"&RC[-9]&".blp" -> ReplaceableTextures\CommandButtons\BTN_gem_3.blp | N88: =VLOOKUP(RC[-10],Sheet2!R7C1:R12C5,5,0) -> model\item\texiao_dijiguangzhu.mdx | W88: 3 | X88: Campaign | Y88: =1000*POWER(2,RC[-22]) -> 8000 | Z88: 235 | AA88: 0 | AB88: =VLOOKUP(RC[-25],Sheet2!R13C1:R19C4,4,0)*VLOOKUP(RC[-24],Sheet2!R7C1:R12C4,4,0) -> 16 | AC88: 0 | AQ88: 1
A89: OBJECT | B89: F30K | C89: 3 | D89: C | E89: srbd | F89: ZZZY | G89: =Sheet1!R[-1]C[25] -> 三.丙|cFF99FF66[宝石]青丝石|r | H89: =Sheet1!R[-1]C[25] -> |cFFFFFF99基础属性|r|n力量:18000|n敏捷:4500|n智力:4500|n|n用于镶嵌到[剑,衣]上.|n镶嵌后不可取下!|n不需要的宝石可以在宠物处熔炼,用于宝石抽奖. | I89: =RC[-2] -> 三.丙|cFF99FF66[宝石]青丝石|r | J89: =RC[-2] -> |cFFFFFF99基础属性|r|n力量:18000|n敏捷:4500|n智力:4500|n|n用于镶嵌到[剑,衣]上.|n镶嵌后不可取下!|n不需要的宝石可以在宠物处熔炼,用于宝石抽奖. | L89: ="ReplaceableTextures\CommandButtons\BTN_gem_"&RC[-9]&".blp" -> ReplaceableTextures\CommandButtons\BTN_gem_3.blp | N89: =VLOOKUP(RC[-10],Sheet2!R7C1:R12C5,5,0) -> model\item\texiao_dijiguangzhu.mdx | W89: 3 | X89: Campaign | Y89: =1000*POWER(2,RC[-22]) -> 8000 | Z89: 235 | AA89: 0 | AB89: =VLOOKUP(RC[-25],Sheet2!R13C1:R19C4,4,0)*VLOOKUP(RC[-24],Sheet2!R7C1:R12C4,4,0) -> 16 | AC89: 0 | AQ89: 1
A90: OBJECT | B90: F30L | C90: 3 | D90: C | E90: srbd | F90: ZZZY | G90: =Sheet1!R[-1]C[25] -> 三.丙|cFF99FF66[宝石]照影石|r | H90: =Sheet1!R[-1]C[25] -> |cFFFFFF99基础属性|r|n力量:4500|n敏捷:18000|n智力:4500|n|n用于镶嵌到[剑,衣]上.|n镶嵌后不可取下!|n不需要的宝石可以在宠物处熔炼,用于宝石抽奖. | I90: =RC[-2] -> 三.丙|cFF99FF66[宝石]照影石|r | J90: =RC[-2] -> |cFFFFFF99基础属性|r|n力量:4500|n敏捷:18000|n智力:4500|n|n用于镶嵌到[剑,衣]上.|n镶嵌后不可取下!|n不需要的宝石可以在宠物处熔炼,用于宝石抽奖. | L90: ="ReplaceableTextures\CommandButtons\BTN_gem_"&RC[-9]&".blp" -> ReplaceableTextures\CommandButtons\BTN_gem_3.blp | N90: =VLOOKUP(RC[-10],Sheet2!R7C1:R12C5,5,0) -> model\item\texiao_dijiguangzhu.mdx | W90: 3 | X90: Campaign | Y90: =1000*POWER(2,RC[-22]) -> 8000 | Z90: 235 | AA90: 0 | AB90: =VLOOKUP(RC[-25],Sheet2!R13C1:R19C4,4,0)*VLOOKUP(RC[-24],Sheet2!R7C1:R12C4,4,0) -> 16 | AC90: 0 | AQ90: 1
A91: OBJECT | B91: F30M | C91: 3 | D91: C | E91: srbd | F91: ZZZY | G91: =Sheet1!R[-1]C[25] -> 三.丙|cFF99FF66[宝石]棂兰石|r | H91: =Sheet1!R[-1]C[25] -> |cFFFFFF99基础属性|r|n力量:4500|n敏捷:4500|n智力:18000|n|n用于镶嵌到[剑,衣]上.|n镶嵌后不可取下!|n不需要的宝石可以在宠物处熔炼,用于宝石抽奖. | I91: =RC[-2] -> 三.丙|cFF99FF66[宝石]棂兰石|r | J91: =RC[-2] -> |cFFFFFF99基础属性|r|n力量:4500|n敏捷:4500|n智力:18000|n|n用于镶嵌到[剑,衣]上.|n镶嵌后不可取下!|n不需要的宝石可以在宠物处熔炼,用于宝石抽奖. | L91: ="ReplaceableTextures\CommandButtons\BTN_gem_"&RC[-9]&".blp" -> ReplaceableTextures\CommandButtons\BTN_gem_3.blp | N91: =VLOOKUP(RC[-10],Sheet2!R7C1:R12C5,5,0) -> model\item\texiao_dijiguangzhu.mdx | W91: 3 | X91: Campaign | Y91: =1000*POWER(2,RC[-22]) -> 8000 | Z91: 235 | AA91: 0 | AB91: =VLOOKUP(RC[-25],Sheet2!R13C1:R19C4,4,0)*VLOOKUP(RC[-24],Sheet2!R7C1:R12C4,4,0) -> 16 | AC91: 0 | AQ91: 1
A92: OBJECT | B92: F30N | C92: 3 | D92: C | E92: srbd | F92: ZZZY | G92: =Sheet1!R[-1]C[25] -> 三.丙|cFF99FF66[宝石]战豹石|r | H92: =Sheet1!R[-1]C[25] -> |n|n|cFFFFFF55附加属性|r(%)|n攻速:21|n|n用于镶嵌到[剑,衣]上.|n镶嵌后不可取下!|n不需要的宝石可以在宠物处熔炼,用于宝石抽奖. | I92: =RC[-2] -> 三.丙|cFF99FF66[宝石]战豹石|r | J92: =RC[-2] -> |n|n|cFFFFFF55附加属性|r(%)|n攻速:21|n|n用于镶嵌到[剑,衣]上.|n镶嵌后不可取下!|n不需要的宝石可以在宠物处熔炼,用于宝石抽奖. | L92: ="ReplaceableTextures\CommandButtons\BTN_gem_"&RC[-9]&".blp" -> ReplaceableTextures\CommandButtons\BTN_gem_3.blp | N92: =VLOOKUP(RC[-10],Sheet2!R7C1:R12C5,5,0) -> model\item\texiao_dijiguangzhu.mdx | W92: 3 | X92: Campaign | Y92: =1000*POWER(2,RC[-22]) -> 8000 | Z92: 235 | AA92: 0 | AB92: =VLOOKUP(RC[-25],Sheet2!R13C1:R19C4,4,0)*VLOOKUP(RC[-24],Sheet2!R7C1:R12C4,4,0) -> 16 | AC92: 0 | AQ92: 1
A93: OBJECT | B93: F30O | C93: 3 | D93: B | E93: srbd | F93: ZZZY | G93: =Sheet1!R[-1]C[25] -> 三.乙|cFF1BE6B8[宝石]金鼎细晶|r | H93: =Sheet1!R[-1]C[25] -> |cFFFFFF99基础属性|r|n力量:22500|n护甲:62|n伤害增幅:2|n|n用于镶嵌到[剑,衣]上.|n镶嵌后不可取下!|n不需要的宝石可以在宠物处熔炼,用于宝石抽奖. | I93: =RC[-2] -> 三.乙|cFF1BE6B8[宝石]金鼎细晶|r | J93: =RC[-2] -> |cFFFFFF99基础属性|r|n力量:22500|n护甲:62|n伤害增幅:2|n|n用于镶嵌到[剑,衣]上.|n镶嵌后不可取下!|n不需要的宝石可以在宠物处熔炼,用于宝石抽奖. | L93: ="ReplaceableTextures\CommandButtons\BTN_gem_"&RC[-9]&".blp" -> ReplaceableTextures\CommandButtons\BTN_gem_3.blp | N93: =VLOOKUP(RC[-10],Sheet2!R7C1:R12C5,5,0) -> model\item\texiao_zhongjiguangzhu.mdx | W93: 3 | X93: Campaign | Y93: =1000*POWER(2,RC[-22]) -> 8000 | Z93: 235 | AA93: 0 | AB93: =VLOOKUP(RC[-25],Sheet2!R13C1:R19C4,4,0)*VLOOKUP(RC[-24],Sheet2!R7C1:R12C4,4,0) -> 24 | AC93: 0 | AQ93: 1
A94: OBJECT | B94: F30P | C94: 3 | D94: B | E94: srbd | F94: ZZZY | G94: =Sheet1!R[-1]C[25] -> 三.乙|cFF1BE6B8[宝石]噬魂魔石|r | H94: =Sheet1!R[-1]C[25] -> |cFFFFFF99基础属性|r|n攻击:54000|n护甲:62|n伤害增幅:2|n|n用于镶嵌到[剑,衣]上.|n镶嵌后不可取下!|n不需要的宝石可以在宠物处熔炼,用于宝石抽奖. | I94: =RC[-2] -> 三.乙|cFF1BE6B8[宝石]噬魂魔石|r | J94: =RC[-2] -> |cFFFFFF99基础属性|r|n攻击:54000|n护甲:62|n伤害增幅:2|n|n用于镶嵌到[剑,衣]上.|n镶嵌后不可取下!|n不需要的宝石可以在宠物处熔炼,用于宝石抽奖. | L94: ="ReplaceableTextures\CommandButtons\BTN_gem_"&RC[-9]&".blp" -> ReplaceableTextures\CommandButtons\BTN_gem_3.blp | N94: =VLOOKUP(RC[-10],Sheet2!R7C1:R12C5,5,0) -> model\item\texiao_zhongjiguangzhu.mdx | W94: 3 | X94: Campaign | Y94: =1000*POWER(2,RC[-22]) -> 8000 | Z94: 235 | AA94: 0 | AB94: =VLOOKUP(RC[-25],Sheet2!R13C1:R19C4,4,0)*VLOOKUP(RC[-24],Sheet2!R7C1:R12C4,4,0) -> 24 | AC94: 0 | AQ94: 1
A95: OBJECT | B95: F30Q | C95: 3 | D95: B | E95: srbd | F95: ZZZY | G95: =Sheet1!R[-1]C[25] -> 三.乙|cFF1BE6B8[宝石]赤霞纯土|r | H95: =Sheet1!R[-1]C[25] -> |cFFFFFF99基础属性|r|n智力:22500|n护甲:62|n伤害增幅:2|n|n用于镶嵌到[剑,衣]上.|n镶嵌后不可取下!|n不需要的宝石可以在宠物处熔炼,用于宝石抽奖. | I95: =RC[-2] -> 三.乙|cFF1BE6B8[宝石]赤霞纯土|r | J95: =RC[-2] -> |cFFFFFF99基础属性|r|n智力:22500|n护甲:62|n伤害增幅:2|n|n用于镶嵌到[剑,衣]上.|n镶嵌后不可取下!|n不需要的宝石可以在宠物处熔炼,用于宝石抽奖. | L95: ="ReplaceableTextures\CommandButtons\BTN_gem_"&RC[-9]&".blp" -> ReplaceableTextures\CommandButtons\BTN_gem_3.blp | N95: =VLOOKUP(RC[-10],Sheet2!R7C1:R12C5,5,0) -> model\item\texiao_zhongjiguangzhu.mdx | W95: 3 | X95: Campaign | Y95: =1000*POWER(2,RC[-22]) -> 8000 | Z95: 235 | AA95: 0 | AB95: =VLOOKUP(RC[-25],Sheet2!R13C1:R19C4,4,0)*VLOOKUP(RC[-24],Sheet2!R7C1:R12C4,4,0) -> 24 | AC95: 0 | AQ95: 1
A96: OBJECT | B96: F30R | C96: 3 | D96: B | E96: srbd | F96: ZZZY | G96: =Sheet1!R[-1]C[25] -> 三.乙|cFF1BE6B8[宝石]洗髓幻木|r | H96: =Sheet1!R[-1]C[25] -> |cFFFFFF99基础属性|r|n敏捷:22500|n护甲:62|n伤害增幅:2|n|n用于镶嵌到[剑,衣]上.|n镶嵌后不可取下!|n不需要的宝石可以在宠物处熔炼,用于宝石抽奖. | I96: =RC[-2] -> 三.乙|cFF1BE6B8[宝石]洗髓幻木|r | J96: =RC[-2] -> |cFFFFFF99基础属性|r|n敏捷:22500|n护甲:62|n伤害增幅:2|n|n用于镶嵌到[剑,衣]上.|n镶嵌后不可取下!|n不需要的宝石可以在宠物处熔炼,用于宝石抽奖. | L96: ="ReplaceableTextures\CommandButtons\BTN_gem_"&RC[-9]&".blp" -> ReplaceableTextures\CommandButtons\BTN_gem_3.blp | N96: =VLOOKUP(RC[-10],Sheet2!R7C1:R12C5,5,0) -> model\item\texiao_zhongjiguangzhu.mdx | W96: 3 | X96: Campaign | Y96: =1000*POWER(2,RC[-22]) -> 8000 | Z96: 235 | AA96: 0 | AB96: =VLOOKUP(RC[-25],Sheet2!R13C1:R19C4,4,0)*VLOOKUP(RC[-24],Sheet2!R7C1:R12C4,4,0) -> 24 | AC96: 0 | AQ96: 1
A97: OBJECT | B97: F30S | C97: 3 | D97: A | E97: srbd | F97: ZZZY | G97: =Sheet1!R[-1]C[25] -> 三.甲|cFF33FF00[宝石]黑月之潮|r | H97: =Sheet1!R[-1]C[25] -> |cFFFFFF99基础属性|r|n力量:10800|n敏捷:10800|n智力:10800|n|n|cFFFFFF55附加属性|r(%)|n攻速:8|n伤害增幅:5|n|n用于镶嵌到[剑,衣]上.|n镶嵌后不可取下!|n不需要的宝石可以在宠物处熔炼,用于宝石抽奖. | I97: =RC[-2] -> 三.甲|cFF33FF00[宝石]黑月之潮|r | J97: =RC[-2] -> |cFFFFFF99基础属性|r|n力量:10800|n敏捷:10800|n智力:10800|n|n|cFFFFFF55附加属性|r(%)|n攻速:8|n伤害增幅:5|n|n用于镶嵌到[剑,衣]上.|n镶嵌后不可取下!|n不需要的宝石可以在宠物处熔炼,用于宝石抽奖. | L97: ="ReplaceableTextures\CommandButtons\BTN_gem_"&RC[-9]&".blp" -> ReplaceableTextures\CommandButtons\BTN_gem_3.blp | N97: =VLOOKUP(RC[-10],Sheet2!R7C1:R12C5,5,0) -> model\item\texiao_zhongjiguangzhu2.mdx | W97: 3 | X97: Campaign | Y97: =1000*POWER(2,RC[-22]) -> 8000 | Z97: 235 | AA97: 0 | AB97: =VLOOKUP(RC[-25],Sheet2!R13C1:R19C4,4,0)*VLOOKUP(RC[-24],Sheet2!R7C1:R12C4,4,0) -> 32 | AC97: 0 | AQ97: 1
A98: OBJECT | B98: F30T | C98: 3 | D98: A | E98: srbd | F98: ZZZY | G98: =Sheet1!R[-1]C[25] -> 三.甲|cFF33FF00[宝石]成王之志|r | H98: =Sheet1!R[-1]C[25] -> |cFFFFFF99基础属性|r|n攻击:72000|n|n|cFFFFFF55附加属性|r(%)|n攻速:8|n伤害增幅:5|n|n用于镶嵌到[剑,衣]上.|n镶嵌后不可取下!|n不需要的宝石可以在宠物处熔炼,用于宝石抽奖. | I98: =RC[-2] -> 三.甲|cFF33FF00[宝石]成王之志|r | J98: =RC[-2] -> |cFFFFFF99基础属性|r|n攻击:72000|n|n|cFFFFFF55附加属性|r(%)|n攻速:8|n伤害增幅:5|n|n用于镶嵌到[剑,衣]上.|n镶嵌后不可取下!|n不需要的宝石可以在宠物处熔炼,用于宝石抽奖. | L98: ="ReplaceableTextures\CommandButtons\BTN_gem_"&RC[-9]&".blp" -> ReplaceableTextures\CommandButtons\BTN_gem_3.blp | N98: =VLOOKUP(RC[-10],Sheet2!R7C1:R12C5,5,0) -> model\item\texiao_zhongjiguangzhu2.mdx | W98: 3 | X98: Campaign | Y98: =1000*POWER(2,RC[-22]) -> 8000 | Z98: 235 | AA98: 0 | AB98: =VLOOKUP(RC[-25],Sheet2!R13C1:R19C4,4,0)*VLOOKUP(RC[-24],Sheet2!R7C1:R12C4,4,0) -> 32 | AC98: 0 | AQ98: 1
A99: OBJECT | B99: F30U | C99: 3 | D99: S | E99: srbd | F99: ZZZY | G99: =Sheet1!R[-1]C[25] -> 三.绝|cFFFF9933[宝石]道禅 - 静心|r | H99: =Sheet1!R[-1]C[25] -> |cFFFFFF99基础属性|r|n血量:270000|n护甲:375|n|n|cFFFFFF55附加属性|r(%)|n攻击吸血:1|n伤害增幅:5|n|n用于镶嵌到[剑,衣]上.|n镶嵌后不可取下!|n不需要的宝石可以在宠物处熔炼,用于宝石抽奖. | I99: =RC[-2] -> 三.绝|cFFFF9933[宝石]道禅 - 静心|r | J99: =RC[-2] -> |cFFFFFF99基础属性|r|n血量:270000|n护甲:375|n|n|cFFFFFF55附加属性|r(%)|n攻击吸血:1|n伤害增幅:5|n|n用于镶嵌到[剑,衣]上.|n镶嵌后不可取下!|n不需要的宝石可以在宠物处熔炼,用于宝石抽奖. | L99: ="ReplaceableTextures\CommandButtons\BTN_gem_"&RC[-9]&".blp" -> ReplaceableTextures\CommandButtons\BTN_gem_3.blp | N99: =VLOOKUP(RC[-10],Sheet2!R7C1:R12C5,5,0) -> model\item\texiao_gaojiguangzhu.mdx | W99: 3 | X99: Campaign | Y99: =1000*POWER(2,RC[-22]) -> 8000 | Z99: 235 | AA99: 0 | AB99: =VLOOKUP(RC[-25],Sheet2!R13C1:R19C4,4,0)*VLOOKUP(RC[-24],Sheet2!R7C1:R12C4,4,0) -> 40 | AC99: 0 | AQ99: 1
A100: OBJECT | B100: F30V | C100: 3 | D100: S | E100: srbd | F100: ZZZY | G100: =Sheet1!R[-1]C[25] -> 三.绝|cFFFF9933[宝石]道禅 - 制怒|r | H100: =Sheet1!R[-1]C[25] -> |cFFFFFF99基础属性|r|n攻击:22500|n|n|cFFFFFF55附加属性|r(%)|n暴击概率:7|n暴击伤害:28|n伤害增幅:5|n|n用于镶嵌到[剑,衣]上.|n镶嵌后不可取下!|n不需要的宝石可以在宠物处熔炼,用于宝石抽奖. | I100: =RC[-2] -> 三.绝|cFFFF9933[宝石]道禅 - 制怒|r | J100: =RC[-2] -> |cFFFFFF99基础属性|r|n攻击:22500|n|n|cFFFFFF55附加属性|r(%)|n暴击概率:7|n暴击伤害:28|n伤害增幅:5|n|n用于镶嵌到[剑,衣]上.|n镶嵌后不可取下!|n不需要的宝石可以在宠物处熔炼,用于宝石抽奖. | L100: ="ReplaceableTextures\CommandButtons\BTN_gem_"&RC[-9]&".blp" -> ReplaceableTextures\CommandButtons\BTN_gem_3.blp | N100: =VLOOKUP(RC[-10],Sheet2!R7C1:R12C5,5,0) -> model\item\texiao_gaojiguangzhu.mdx | W100: 3 | X100: Campaign | Y100: =1000*POWER(2,RC[-22]) -> 8000 | Z100: 235 | AA100: 0 | AB100: =VLOOKUP(RC[-25],Sheet2!R13C1:R19C4,4,0)*VLOOKUP(RC[-24],Sheet2!R7C1:R12C4,4,0) -> 40 | AC100: 0 | AQ100: 1
A101: OBJECT | B101: F30W | C101: 3 | D101: X | E101: srbd | F101: ZZZY | G101: =Sheet1!R[-1]C[25] -> 三.神|Cffff0000[宝石]上古遗物-无心|r | H101: =Sheet1!R[-1]C[25] -> |cFFFFFF99基础属性|r|n血量:540000|n护甲:500|n|n|cFFFFFF55附加属性|r(%)|n暴击伤害:28|n伤害增幅:11|n伤害减免:10|n|n用于镶嵌到[剑,衣]上.|n镶嵌后不可取下!|n不需要的宝石可以在宠物处熔炼,用于宝石抽奖. | I101: =RC[-2] -> 三.神|Cffff0000[宝石]上古遗物-无心|r | J101: =RC[-2] -> |cFFFFFF99基础属性|r|n血量:540000|n护甲:500|n|n|cFFFFFF55附加属性|r(%)|n暴击伤害:28|n伤害增幅:11|n伤害减免:10|n|n用于镶嵌到[剑,衣]上.|n镶嵌后不可取下!|n不需要的宝石可以在宠物处熔炼,用于宝石抽奖. | L101: ="ReplaceableTextures\CommandButtons\BTN_gem_"&RC[-9]&".blp" -> ReplaceableTextures\CommandButtons\BTN_gem_3.blp | N101: =VLOOKUP(RC[-10],Sheet2!R7C1:R12C5,5,0) -> model\item\texiao_gaojiguangzhu.mdx | W101: 3 | X101: Campaign | Y101: =1000*POWER(2,RC[-22]) -> 8000 | Z101: 235 | AA101: 0 | AB101: =VLOOKUP(RC[-25],Sheet2!R13C1:R19C4,4,0)*VLOOKUP(RC[-24],Sheet2!R7C1:R12C4,4,0) -> 48 | AC101: 0 | AQ101: 1
A102: COMMENT | B102: F400 | C102: 4 | D102: D | E102: srbd | F102: ZZZY | G102: =Sheet1!R[-1]C[25] -> 四.丁|cFF999999[宝石]星罗|r | H102: =Sheet1!R[-1]C[25] -> |n|n用于镶嵌到[剑,衣]上.|n镶嵌后不可取下!|n不需要的宝石可以在宠物处熔炼,用于宝石抽奖. | I102: =RC[-2] -> 四.丁|cFF999999[宝石]星罗|r | J102: =RC[-2] -> |n|n用于镶嵌到[剑,衣]上.|n镶嵌后不可取下!|n不需要的宝石可以在宠物处熔炼,用于宝石抽奖. | L102: ="ReplaceableTextures\CommandButtons\BTN_gem_"&RC[-9]&".blp" -> ReplaceableTextures\CommandButtons\BTN_gem_4.blp | N102: =VLOOKUP(RC[-10],Sheet2!R7C1:R12C5,5,0) -> model\item\texiao_dijiguangzhu.mdx | W102: 3 | X102: Campaign | Y102: =1000*POWER(2,RC[-22]) -> 16000 | Z102: 235 | AA102: 0 | AB102: =VLOOKUP(RC[-25],Sheet2!R13C1:R19C4,4,0)*VLOOKUP(RC[-24],Sheet2!R7C1:R12C4,4,0) -> 10 | AC102: 0 | AQ102: 1
A103: COMMENT | B103: F401 | C103: 4 | D103: D | E103: srbd | F103: ZZZY | G103: =Sheet1!R[-1]C[25] -> 四.丁|cFF999999[宝石]临枫|r | H103: =Sheet1!R[-1]C[25] -> |n|n用于镶嵌到[剑,衣]上.|n镶嵌后不可取下!|n不需要的宝石可以在宠物处熔炼,用于宝石抽奖. | I103: =RC[-2] -> 四.丁|cFF999999[宝石]临枫|r | J103: =RC[-2] -> |n|n用于镶嵌到[剑,衣]上.|n镶嵌后不可取下!|n不需要的宝石可以在宠物处熔炼,用于宝石抽奖. | L103: ="ReplaceableTextures\CommandButtons\BTN_gem_"&RC[-9]&".blp" -> ReplaceableTextures\CommandButtons\BTN_gem_4.blp | N103: =VLOOKUP(RC[-10],Sheet2!R7C1:R12C5,5,0) -> model\item\texiao_dijiguangzhu.mdx | W103: 3 | X103: Campaign | Y103: =1000*POWER(2,RC[-22]) -> 16000 | Z103: 235 | AA103: 0 | AB103: =VLOOKUP(RC[-25],Sheet2!R13C1:R19C4,4,0)*VLOOKUP(RC[-24],Sheet2!R7C1:R12C4,4,0) -> 10 | AC103: 0 | AQ103: 1
A104: COMMENT | B104: F402 | C104: 4 | D104: D | E104: srbd | F104: ZZZY | G104: =Sheet1!R[-1]C[25] -> 四.丁|cFF999999[宝石]兽鳞|r | H104: =Sheet1!R[-1]C[25] -> |n|n用于镶嵌到[剑,衣]上.|n镶嵌后不可取下!|n不需要的宝石可以在宠物处熔炼,用于宝石抽奖. | I104: =RC[-2] -> 四.丁|cFF999999[宝石]兽鳞|r | J104: =RC[-2] -> |n|n用于镶嵌到[剑,衣]上.|n镶嵌后不可取下!|n不需要的宝石可以在宠物处熔炼,用于宝石抽奖. | L104: ="ReplaceableTextures\CommandButtons\BTN_gem_"&RC[-9]&".blp" -> ReplaceableTextures\CommandButtons\BTN_gem_4.blp | N104: =VLOOKUP(RC[-10],Sheet2!R7C1:R12C5,5,0) -> model\item\texiao_dijiguangzhu.mdx | W104: 3 | X104: Campaign | Y104: =1000*POWER(2,RC[-22]) -> 16000 | Z104: 235 | AA104: 0 | AB104: =VLOOKUP(RC[-25],Sheet2!R13C1:R19C4,4,0)*VLOOKUP(RC[-24],Sheet2!R7C1:R12C4,4,0) -> 10 | AC104: 0 | AQ104: 1
A105: COMMENT | B105: F403 | C105: 4 | D105: D | E105: srbd | F105: ZZZY | G105: =Sheet1!R[-1]C[25] -> 四.丁|cFF999999[宝石]帝恨|r | H105: =Sheet1!R[-1]C[25] -> |n|n用于镶嵌到[剑,衣]上.|n镶嵌后不可取下!|n不需要的宝石可以在宠物处熔炼,用于宝石抽奖. | I105: =RC[-2] -> 四.丁|cFF999999[宝石]帝恨|r | J105: =RC[-2] -> |n|n用于镶嵌到[剑,衣]上.|n镶嵌后不可取下!|n不需要的宝石可以在宠物处熔炼,用于宝石抽奖. | L105: ="ReplaceableTextures\CommandButtons\BTN_gem_"&RC[-9]&".blp" -> ReplaceableTextures\CommandButtons\BTN_gem_4.blp | N105: =VLOOKUP(RC[-10],Sheet2!R7C1:R12C5,5,0) -> model\item\texiao_dijiguangzhu.mdx | W105: 3 | X105: Campaign | Y105: =1000*POWER(2,RC[-22]) -> 16000 | Z105: 235 | AA105: 0 | AB105: =VLOOKUP(RC[-25],Sheet2!R13C1:R19C4,4,0)*VLOOKUP(RC[-24],Sheet2!R7C1:R12C4,4,0) -> 10 | AC105: 0 | AQ105: 1
A106: COMMENT | B106: F404 | C106: 4 | D106: D | E106: srbd | F106: ZZZY | G106: =Sheet1!R[-1]C[25] -> 四.丁|cFF999999[宝石]紫雷|r | H106: =Sheet1!R[-1]C[25] -> |n|n用于镶嵌到[剑,衣]上.|n镶嵌后不可取下!|n不需要的宝石可以在宠物处熔炼,用于宝石抽奖. | I106: =RC[-2] -> 四.丁|cFF999999[宝石]紫雷|r | J106: =RC[-2] -> |n|n用于镶嵌到[剑,衣]上.|n镶嵌后不可取下!|n不需要的宝石可以在宠物处熔炼,用于宝石抽奖. | L106: ="ReplaceableTextures\CommandButtons\BTN_gem_"&RC[-9]&".blp" -> ReplaceableTextures\CommandButtons\BTN_gem_4.blp | N106: =VLOOKUP(RC[-10],Sheet2!R7C1:R12C5,5,0) -> model\item\texiao_dijiguangzhu.mdx | W106: 3 | X106: Campaign | Y106: =1000*POWER(2,RC[-22]) -> 16000 | Z106: 235 | AA106: 0 | AB106: =VLOOKUP(RC[-25],Sheet2!R13C1:R19C4,4,0)*VLOOKUP(RC[-24],Sheet2!R7C1:R12C4,4,0) -> 10 | AC106: 0 | AQ106: 1
A107: COMMENT | B107: F405 | C107: 4 | D107: D | E107: srbd | F107: ZZZY | G107: =Sheet1!R[-1]C[25] -> 四.丁|cFF999999[宝石]灵角|r | H107: =Sheet1!R[-1]C[25] -> |n|n用于镶嵌到[剑,衣]上.|n镶嵌后不可取下!|n不需要的宝石可以在宠物处熔炼,用于宝石抽奖. | I107: =RC[-2] -> 四.丁|cFF999999[宝石]灵角|r | J107: =RC[-2] -> |n|n用于镶嵌到[剑,衣]上.|n镶嵌后不可取下!|n不需要的宝石可以在宠物处熔炼,用于宝石抽奖. | L107: ="ReplaceableTextures\CommandButtons\BTN_gem_"&RC[-9]&".blp" -> ReplaceableTextures\CommandButtons\BTN_gem_4.blp | N107: =VLOOKUP(RC[-10],Sheet2!R7C1:R12C5,5,0) -> model\item\texiao_dijiguangzhu.mdx | W107: 3 | X107: Campaign | Y107: =1000*POWER(2,RC[-22]) -> 16000 | Z107: 235 | AA107: 0 | AB107: =VLOOKUP(RC[-25],Sheet2!R13C1:R19C4,4,0)*VLOOKUP(RC[-24],Sheet2!R7C1:R12C4,4,0) -> 10 | AC107: 0 | AQ107: 1
A108: COMMENT | B108: F406 | C108: 4 | D108: D | E108: srbd | F108: ZZZY | G108: =Sheet1!R[-1]C[25] -> 四.丁|cFF999999[宝石]紫清|r | H108: =Sheet1!R[-1]C[25] -> |n|n用于镶嵌到[剑,衣]上.|n镶嵌后不可取下!|n不需要的宝石可以在宠物处熔炼,用于宝石抽奖. | I108: =RC[-2] -> 四.丁|cFF999999[宝石]紫清|r | J108: =RC[-2] -> |n|n用于镶嵌到[剑,衣]上.|n镶嵌后不可取下!|n不需要的宝石可以在宠物处熔炼,用于宝石抽奖. | L108: ="ReplaceableTextures\CommandButtons\BTN_gem_"&RC[-9]&".blp" -> ReplaceableTextures\CommandButtons\BTN_gem_4.blp | N108: =VLOOKUP(RC[-10],Sheet2!R7C1:R12C5,5,0) -> model\item\texiao_dijiguangzhu.mdx | W108: 3 | X108: Campaign | Y108: =1000*POWER(2,RC[-22]) -> 16000 | Z108: 235 | AA108: 0 | AB108: =VLOOKUP(RC[-25],Sheet2!R13C1:R19C4,4,0)*VLOOKUP(RC[-24],Sheet2!R7C1:R12C4,4,0) -> 10 | AC108: 0 | AQ108: 1
A109: COMMENT | B109: F407 | C109: 4 | D109: D | E109: srbd | F109: ZZZY | G109: =Sheet1!R[-1]C[25] -> 四.丁|cFF999999[宝石]怀云|r | H109: =Sheet1!R[-1]C[25] -> |n|n用于镶嵌到[剑,衣]上.|n镶嵌后不可取下!|n不需要的宝石可以在宠物处熔炼,用于宝石抽奖. | I109: =RC[-2] -> 四.丁|cFF999999[宝石]怀云|r | J109: =RC[-2] -> |n|n用于镶嵌到[剑,衣]上.|n镶嵌后不可取下!|n不需要的宝石可以在宠物处熔炼,用于宝石抽奖. | L109: ="ReplaceableTextures\CommandButtons\BTN_gem_"&RC[-9]&".blp" -> ReplaceableTextures\CommandButtons\BTN_gem_4.blp | N109: =VLOOKUP(RC[-10],Sheet2!R7C1:R12C5,5,0) -> model\item\texiao_dijiguangzhu.mdx | W109: 3 | X109: Campaign | Y109: =1000*POWER(2,RC[-22]) -> 16000 | Z109: 235 | AA109: 0 | AB109: =VLOOKUP(RC[-25],Sheet2!R13C1:R19C4,4,0)*VLOOKUP(RC[-24],Sheet2!R7C1:R12C4,4,0) -> 10 | AC109: 0 | AQ109: 1
A110: COMMENT | B110: F408 | C110: 4 | D110: D | E110: srbd | F110: ZZZY | G110: =Sheet1!R[-1]C[25] -> 四.丁|cFF999999[宝石]武斗|r | H110: =Sheet1!R[-1]C[25] -> |n|n用于镶嵌到[剑,衣]上.|n镶嵌后不可取下!|n不需要的宝石可以在宠物处熔炼,用于宝石抽奖. | I110: =RC[-2] -> 四.丁|cFF999999[宝石]武斗|r | J110: =RC[-2] -> |n|n用于镶嵌到[剑,衣]上.|n镶嵌后不可取下!|n不需要的宝石可以在宠物处熔炼,用于宝石抽奖. | L110: ="ReplaceableTextures\CommandButtons\BTN_gem_"&RC[-9]&".blp" -> ReplaceableTextures\CommandButtons\BTN_gem_4.blp | N110: =VLOOKUP(RC[-10],Sheet2!R7C1:R12C5,5,0) -> model\item\texiao_dijiguangzhu.mdx | W110: 3 | X110: Campaign | Y110: =1000*POWER(2,RC[-22]) -> 16000 | Z110: 235 | AA110: 0 | AB110: =VLOOKUP(RC[-25],Sheet2!R13C1:R19C4,4,0)*VLOOKUP(RC[-24],Sheet2!R7C1:R12C4,4,0) -> 10 | AC110: 0 | AQ110: 1
A111: COMMENT | B111: F409 | C111: 4 | D111: D | E111: srbd | F111: ZZZY | G111: =Sheet1!R[-1]C[25] -> 四.丁|cFF999999[宝石]龙凰|r | H111: =Sheet1!R[-1]C[25] -> |n|n用于镶嵌到[剑,衣]上.|n镶嵌后不可取下!|n不需要的宝石可以在宠物处熔炼,用于宝石抽奖. | I111: =RC[-2] -> 四.丁|cFF999999[宝石]龙凰|r | J111: =RC[-2] -> |n|n用于镶嵌到[剑,衣]上.|n镶嵌后不可取下!|n不需要的宝石可以在宠物处熔炼,用于宝石抽奖. | L111: ="ReplaceableTextures\CommandButtons\BTN_gem_"&RC[-9]&".blp" -> ReplaceableTextures\CommandButtons\BTN_gem_4.blp | N111: =VLOOKUP(RC[-10],Sheet2!R7C1:R12C5,5,0) -> model\item\texiao_dijiguangzhu.mdx | W111: 3 | X111: Campaign | Y111: =1000*POWER(2,RC[-22]) -> 16000 | Z111: 235 | AA111: 0 | AB111: =VLOOKUP(RC[-25],Sheet2!R13C1:R19C4,4,0)*VLOOKUP(RC[-24],Sheet2!R7C1:R12C4,4,0) -> 10 | AC111: 0 | AQ111: 1
A112: COMMENT | B112: F40A | C112: 4 | D112: D | E112: srbd | F112: ZZZY | G112: =Sheet1!R[-1]C[25] -> 四.丁|cFF999999[宝石]天厉|r | H112: =Sheet1!R[-1]C[25] -> |n|n用于镶嵌到[剑,衣]上.|n镶嵌后不可取下!|n不需要的宝石可以在宠物处熔炼,用于宝石抽奖. | I112: =RC[-2] -> 四.丁|cFF999999[宝石]天厉|r | J112: =RC[-2] -> |n|n用于镶嵌到[剑,衣]上.|n镶嵌后不可取下!|n不需要的宝石可以在宠物处熔炼,用于宝石抽奖. | L112: ="ReplaceableTextures\CommandButtons\BTN_gem_"&RC[-9]&".blp" -> ReplaceableTextures\CommandButtons\BTN_gem_4.blp | N112: =VLOOKUP(RC[-10],Sheet2!R7C1:R12C5,5,0) -> model\item\texiao_dijiguangzhu.mdx | W112: 3 | X112: Campaign | Y112: =1000*POWER(2,RC[-22]) -> 16000 | Z112: 235 | AA112: 0 | AB112: =VLOOKUP(RC[-25],Sheet2!R13C1:R19C4,4,0)*VLOOKUP(RC[-24],Sheet2!R7C1:R12C4,4,0) -> 10 | AC112: 0 | AQ112: 1
A113: COMMENT | B113: F40B | C113: 4 | D113: D | E113: srbd | F113: ZZZY | G113: =Sheet1!R[-1]C[25] -> 四.丁|cFF999999[宝石]天恋|r | H113: =Sheet1!R[-1]C[25] -> |n|n用于镶嵌到[剑,衣]上.|n镶嵌后不可取下!|n不需要的宝石可以在宠物处熔炼,用于宝石抽奖. | I113: =RC[-2] -> 四.丁|cFF999999[宝石]天恋|r | J113: =RC[-2] -> |n|n用于镶嵌到[剑,衣]上.|n镶嵌后不可取下!|n不需要的宝石可以在宠物处熔炼,用于宝石抽奖. | L113: ="ReplaceableTextures\CommandButtons\BTN_gem_"&RC[-9]&".blp" -> ReplaceableTextures\CommandButtons\BTN_gem_4.blp | N113: =VLOOKUP(RC[-10],Sheet2!R7C1:R12C5,5,0) -> model\item\texiao_dijiguangzhu.mdx | W113: 3 | X113: Campaign | Y113: =1000*POWER(2,RC[-22]) -> 16000 | Z113: 235 | AA113: 0 | AB113: =VLOOKUP(RC[-25],Sheet2!R13C1:R19C4,4,0)*VLOOKUP(RC[-24],Sheet2!R7C1:R12C4,4,0) -> 10 | AC113: 0 | AQ113: 1
A114: COMMENT | B114: F40C | C114: 4 | D114: D | E114: srbd | F114: ZZZY | G114: =Sheet1!R[-1]C[25] -> 四.丁|cFF999999[宝石]逍遥|r | H114: =Sheet1!R[-1]C[25] -> |n|n用于镶嵌到[剑,衣]上.|n镶嵌后不可取下!|n不需要的宝石可以在宠物处熔炼,用于宝石抽奖. | I114: =RC[-2] -> 四.丁|cFF999999[宝石]逍遥|r | J114: =RC[-2] -> |n|n用于镶嵌到[剑,衣]上.|n镶嵌后不可取下!|n不需要的宝石可以在宠物处熔炼,用于宝石抽奖. | L114: ="ReplaceableTextures\CommandButtons\BTN_gem_"&RC[-9]&".blp" -> ReplaceableTextures\CommandButtons\BTN_gem_4.blp | N114: =VLOOKUP(RC[-10],Sheet2!R7C1:R12C5,5,0) -> model\item\texiao_dijiguangzhu.mdx | W114: 3 | X114: Campaign | Y114: =1000*POWER(2,RC[-22]) -> 16000 | Z114: 235 | AA114: 0 | AB114: =VLOOKUP(RC[-25],Sheet2!R13C1:R19C4,4,0)*VLOOKUP(RC[-24],Sheet2!R7C1:R12C4,4,0) -> 10 | AC114: 0 | AQ114: 1
A115: COMMENT | B115: F40D | C115: 4 | D115: D | E115: srbd | F115: ZZZY | G115: =Sheet1!R[-1]C[25] -> 四.丁|cFF999999[宝石]惊天|r | H115: =Sheet1!R[-1]C[25] -> |n|n用于镶嵌到[剑,衣]上.|n镶嵌后不可取下!|n不需要的宝石可以在宠物处熔炼,用于宝石抽奖. | I115: =RC[-2] -> 四.丁|cFF999999[宝石]惊天|r | J115: =RC[-2] -> |n|n用于镶嵌到[剑,衣]上.|n镶嵌后不可取下!|n不需要的宝石可以在宠物处熔炼,用于宝石抽奖. | L115: ="ReplaceableTextures\CommandButtons\BTN_gem_"&RC[-9]&".blp" -> ReplaceableTextures\CommandButtons\BTN_gem_4.blp | N115: =VLOOKUP(RC[-10],Sheet2!R7C1:R12C5,5,0) -> model\item\texiao_dijiguangzhu.mdx | W115: 3 | X115: Campaign | Y115: =1000*POWER(2,RC[-22]) -> 16000 | Z115: 235 | AA115: 0 | AB115: =VLOOKUP(RC[-25],Sheet2!R13C1:R19C4,4,0)*VLOOKUP(RC[-24],Sheet2!R7C1:R12C4,4,0) -> 10 | AC115: 0 | AQ115: 1
A116: COMMENT | B116: F40E | C116: 4 | D116: D | E116: srbd | F116: ZZZY | G116: =Sheet1!R[-1]C[25] -> 四.丁|cFF999999[宝石]烟涛|r | H116: =Sheet1!R[-1]C[25] -> |n|n用于镶嵌到[剑,衣]上.|n镶嵌后不可取下!|n不需要的宝石可以在宠物处熔炼,用于宝石抽奖. | I116: =RC[-2] -> 四.丁|cFF999999[宝石]烟涛|r | J116: =RC[-2] -> |n|n用于镶嵌到[剑,衣]上.|n镶嵌后不可取下!|n不需要的宝石可以在宠物处熔炼,用于宝石抽奖. | L116: ="ReplaceableTextures\CommandButtons\BTN_gem_"&RC[-9]&".blp" -> ReplaceableTextures\CommandButtons\BTN_gem_4.blp | N116: =VLOOKUP(RC[-10],Sheet2!R7C1:R12C5,5,0) -> model\item\texiao_dijiguangzhu.mdx | W116: 3 | X116: Campaign | Y116: =1000*POWER(2,RC[-22]) -> 16000 | Z116: 235 | AA116: 0 | AB116: =VLOOKUP(RC[-25],Sheet2!R13C1:R19C4,4,0)*VLOOKUP(RC[-24],Sheet2!R7C1:R12C4,4,0) -> 10 | AC116: 0 | AQ116: 1
A117: COMMENT | B117: F40F | C117: 4 | D117: D | E117: srbd | F117: ZZZY | G117: =Sheet1!R[-1]C[25] -> 四.丁|cFF999999[宝石]巫谢|r | H117: =Sheet1!R[-1]C[25] -> |n|n用于镶嵌到[剑,衣]上.|n镶嵌后不可取下!|n不需要的宝石可以在宠物处熔炼,用于宝石抽奖. | I117: =RC[-2] -> 四.丁|cFF999999[宝石]巫谢|r | J117: =RC[-2] -> |n|n用于镶嵌到[剑,衣]上.|n镶嵌后不可取下!|n不需要的宝石可以在宠物处熔炼,用于宝石抽奖. | L117: ="ReplaceableTextures\CommandButtons\BTN_gem_"&RC[-9]&".blp" -> ReplaceableTextures\CommandButtons\BTN_gem_4.blp | N117: =VLOOKUP(RC[-10],Sheet2!R7C1:R12C5,5,0) -> model\item\texiao_dijiguangzhu.mdx | W117: 3 | X117: Campaign | Y117: =1000*POWER(2,RC[-22]) -> 16000 | Z117: 235 | AA117: 0 | AB117: =VLOOKUP(RC[-25],Sheet2!R13C1:R19C4,4,0)*VLOOKUP(RC[-24],Sheet2!R7C1:R12C4,4,0) -> 10 | AC117: 0 | AQ117: 1
A118: OBJECT | B118: F40G | C118: 4 | D118: C | E118: srbd | F118: ZZZY | G118: =Sheet1!R[-1]C[25] -> 四.丙|cFF99FF66[宝石]罗候石|r | H118: =Sheet1!R[-1]C[25] -> |cFFFFFF99基础属性|r|n力量:37500|n敏捷:37500|n智力:37500|n|n用于镶嵌到[剑,衣]上.|n镶嵌后不可取下!|n不需要的宝石可以在宠物处熔炼,用于宝石抽奖. | I118: =RC[-2] -> 四.丙|cFF99FF66[宝石]罗候石|r | J118: =RC[-2] -> |cFFFFFF99基础属性|r|n力量:37500|n敏捷:37500|n智力:37500|n|n用于镶嵌到[剑,衣]上.|n镶嵌后不可取下!|n不需要的宝石可以在宠物处熔炼,用于宝石抽奖. | L118: ="ReplaceableTextures\CommandButtons\BTN_gem_"&RC[-9]&".blp" -> ReplaceableTextures\CommandButtons\BTN_gem_4.blp | N118: =VLOOKUP(RC[-10],Sheet2!R7C1:R12C5,5,0) -> model\item\texiao_dijiguangzhu.mdx | W118: 3 | X118: Campaign | Y118: =1000*POWER(2,RC[-22]) -> 16000 | Z118: 235 | AA118: 0 | AB118: =VLOOKUP(RC[-25],Sheet2!R13C1:R19C4,4,0)*VLOOKUP(RC[-24],Sheet2!R7C1:R12C4,4,0) -> 20 | AC118: 0 | AQ118: 1
A119: OBJECT | B119: F40H | C119: 4 | D119: C | E119: srbd | F119: ZZZY | G119: =Sheet1!R[-1]C[25] -> 四.丙|cFF99FF66[宝石]寒天石|r | H119: =Sheet1!R[-1]C[25] -> |cFFFFFF99基础属性|r|n攻击:125000|n|n用于镶嵌到[剑,衣]上.|n镶嵌后不可取下!|n不需要的宝石可以在宠物处熔炼,用于宝石抽奖. | I119: =RC[-2] -> 四.丙|cFF99FF66[宝石]寒天石|r | J119: =RC[-2] -> |cFFFFFF99基础属性|r|n攻击:125000|n|n用于镶嵌到[剑,衣]上.|n镶嵌后不可取下!|n不需要的宝石可以在宠物处熔炼,用于宝石抽奖. | L119: ="ReplaceableTextures\CommandButtons\BTN_gem_"&RC[-9]&".blp" -> ReplaceableTextures\CommandButtons\BTN_gem_4.blp | N119: =VLOOKUP(RC[-10],Sheet2!R7C1:R12C5,5,0) -> model\item\texiao_dijiguangzhu.mdx | W119: 3 | X119: Campaign | Y119: =1000*POWER(2,RC[-22]) -> 16000 | Z119: 235 | AA119: 0 | AB119: =VLOOKUP(RC[-25],Sheet2!R13C1:R19C4,4,0)*VLOOKUP(RC[-24],Sheet2!R7C1:R12C4,4,0) -> 20 | AC119: 0 | AQ119: 1
A120: OBJECT | B120: F40I | C120: 4 | D120: C | E120: srbd | F120: ZZZY | G120: =Sheet1!R[-1]C[25] -> 四.丙|cFF99FF66[宝石]曜仙石|r | H120: =Sheet1!R[-1]C[25] -> |n|n|cFFFFFF55附加属性|r(%)|n攻击吸血:3|n|n用于镶嵌到[剑,衣]上.|n镶嵌后不可取下!|n不需要的宝石可以在宠物处熔炼,用于宝石抽奖. | I120: =RC[-2] -> 四.丙|cFF99FF66[宝石]曜仙石|r | J120: =RC[-2] -> |n|n|cFFFFFF55附加属性|r(%)|n攻击吸血:3|n|n用于镶嵌到[剑,衣]上.|n镶嵌后不可取下!|n不需要的宝石可以在宠物处熔炼,用于宝石抽奖. | L120: ="ReplaceableTextures\CommandButtons\BTN_gem_"&RC[-9]&".blp" -> ReplaceableTextures\CommandButtons\BTN_gem_4.blp | N120: =VLOOKUP(RC[-10],Sheet2!R7C1:R12C5,5,0) -> model\item\texiao_dijiguangzhu.mdx | W120: 3 | X120: Campaign | Y120: =1000*POWER(2,RC[-22]) -> 16000 | Z120: 235 | AA120: 0 | AB120: =VLOOKUP(RC[-25],Sheet2!R13C1:R19C4,4,0)*VLOOKUP(RC[-24],Sheet2!R7C1:R12C4,4,0) -> 20 | AC120: 0 | AQ120: 1
A121: OBJECT | B121: F40J | C121: 4 | D121: C | E121: srbd | F121: ZZZY | G121: =Sheet1!R[-1]C[25] -> 四.丙|cFF99FF66[宝石]链铠石|r | H121: =Sheet1!R[-1]C[25] -> |cFFFFFF99基础属性|r|n血量:625000|n护甲:400|n|n用于镶嵌到[剑,衣]上.|n镶嵌后不可取下!|n不需要的宝石可以在宠物处熔炼,用于宝石抽奖. | I121: =RC[-2] -> 四.丙|cFF99FF66[宝石]链铠石|r | J121: =RC[-2] -> |cFFFFFF99基础属性|r|n血量:625000|n护甲:400|n|n用于镶嵌到[剑,衣]上.|n镶嵌后不可取下!|n不需要的宝石可以在宠物处熔炼,用于宝石抽奖. | L121: ="ReplaceableTextures\CommandButtons\BTN_gem_"&RC[-9]&".blp" -> ReplaceableTextures\CommandButtons\BTN_gem_4.blp | N121: =VLOOKUP(RC[-10],Sheet2!R7C1:R12C5,5,0) -> model\item\texiao_dijiguangzhu.mdx | W121: 3 | X121: Campaign | Y121: =1000*POWER(2,RC[-22]) -> 16000 | Z121: 235 | AA121: 0 | AB121: =VLOOKUP(RC[-25],Sheet2!R13C1:R19C4,4,0)*VLOOKUP(RC[-24],Sheet2!R7C1:R12C4,4,0) -> 20 | AC121: 0 | AQ121: 1
A122: OBJECT | B122: F40K | C122: 4 | D122: C | E122: srbd | F122: ZZZY | G122: =Sheet1!R[-1]C[25] -> 四.丙|cFF99FF66[宝石]银月石|r | H122: =Sheet1!R[-1]C[25] -> |cFFFFFF99基础属性|r|n力量:50000|n敏捷:12500|n智力:12500|n|n用于镶嵌到[剑,衣]上.|n镶嵌后不可取下!|n不需要的宝石可以在宠物处熔炼,用于宝石抽奖. | I122: =RC[-2] -> 四.丙|cFF99FF66[宝石]银月石|r | J122: =RC[-2] -> |cFFFFFF99基础属性|r|n力量:50000|n敏捷:12500|n智力:12500|n|n用于镶嵌到[剑,衣]上.|n镶嵌后不可取下!|n不需要的宝石可以在宠物处熔炼,用于宝石抽奖. | L122: ="ReplaceableTextures\CommandButtons\BTN_gem_"&RC[-9]&".blp" -> ReplaceableTextures\CommandButtons\BTN_gem_4.blp | N122: =VLOOKUP(RC[-10],Sheet2!R7C1:R12C5,5,0) -> model\item\texiao_dijiguangzhu.mdx | W122: 3 | X122: Campaign | Y122: =1000*POWER(2,RC[-22]) -> 16000 | Z122: 235 | AA122: 0 | AB122: =VLOOKUP(RC[-25],Sheet2!R13C1:R19C4,4,0)*VLOOKUP(RC[-24],Sheet2!R7C1:R12C4,4,0) -> 20 | AC122: 0 | AQ122: 1
A123: OBJECT | B123: F40L | C123: 4 | D123: C | E123: srbd | F123: ZZZY | G123: =Sheet1!R[-1]C[25] -> 四.丙|cFF99FF66[宝石]战狼石|r | H123: =Sheet1!R[-1]C[25] -> |cFFFFFF99基础属性|r|n力量:12500|n敏捷:50000|n智力:12500|n|n用于镶嵌到[剑,衣]上.|n镶嵌后不可取下!|n不需要的宝石可以在宠物处熔炼,用于宝石抽奖. | I123: =RC[-2] -> 四.丙|cFF99FF66[宝石]战狼石|r | J123: =RC[-2] -> |cFFFFFF99基础属性|r|n力量:12500|n敏捷:50000|n智力:12500|n|n用于镶嵌到[剑,衣]上.|n镶嵌后不可取下!|n不需要的宝石可以在宠物处熔炼,用于宝石抽奖. | L123: ="ReplaceableTextures\CommandButtons\BTN_gem_"&RC[-9]&".blp" -> ReplaceableTextures\CommandButtons\BTN_gem_4.blp | N123: =VLOOKUP(RC[-10],Sheet2!R7C1:R12C5,5,0) -> model\item\texiao_dijiguangzhu.mdx | W123: 3 | X123: Campaign | Y123: =1000*POWER(2,RC[-22]) -> 16000 | Z123: 235 | AA123: 0 | AB123: =VLOOKUP(RC[-25],Sheet2!R13C1:R19C4,4,0)*VLOOKUP(RC[-24],Sheet2!R7C1:R12C4,4,0) -> 20 | AC123: 0 | AQ123: 1
A124: OBJECT | B124: F40M | C124: 4 | D124: C | E124: srbd | F124: ZZZY | G124: =Sheet1!R[-1]C[25] -> 四.丙|cFF99FF66[宝石]轮炎石|r | H124: =Sheet1!R[-1]C[25] -> |cFFFFFF99基础属性|r|n力量:12500|n敏捷:12500|n智力:50000|n|n用于镶嵌到[剑,衣]上.|n镶嵌后不可取下!|n不需要的宝石可以在宠物处熔炼,用于宝石抽奖. | I124: =RC[-2] -> 四.丙|cFF99FF66[宝石]轮炎石|r | J124: =RC[-2] -> |cFFFFFF99基础属性|r|n力量:12500|n敏捷:12500|n智力:50000|n|n用于镶嵌到[剑,衣]上.|n镶嵌后不可取下!|n不需要的宝石可以在宠物处熔炼,用于宝石抽奖. | L124: ="ReplaceableTextures\CommandButtons\BTN_gem_"&RC[-9]&".blp" -> ReplaceableTextures\CommandButtons\BTN_gem_4.blp | N124: =VLOOKUP(RC[-10],Sheet2!R7C1:R12C5,5,0) -> model\item\texiao_dijiguangzhu.mdx | W124: 3 | X124: Campaign | Y124: =1000*POWER(2,RC[-22]) -> 16000 | Z124: 235 | AA124: 0 | AB124: =VLOOKUP(RC[-25],Sheet2!R13C1:R19C4,4,0)*VLOOKUP(RC[-24],Sheet2!R7C1:R12C4,4,0) -> 20 | AC124: 0 | AQ124: 1
A125: OBJECT | B125: F40N | C125: 4 | D125: C | E125: srbd | F125: ZZZY | G125: =Sheet1!R[-1]C[25] -> 四.丙|cFF99FF66[宝石]蚀魂石|r | H125: =Sheet1!R[-1]C[25] -> |n|n|cFFFFFF55附加属性|r(%)|n攻速:27|n|n用于镶嵌到[剑,衣]上.|n镶嵌后不可取下!|n不需要的宝石可以在宠物处熔炼,用于宝石抽奖. | I125: =RC[-2] -> 四.丙|cFF99FF66[宝石]蚀魂石|r | J125: =RC[-2] -> |n|n|cFFFFFF55附加属性|r(%)|n攻速:27|n|n用于镶嵌到[剑,衣]上.|n镶嵌后不可取下!|n不需要的宝石可以在宠物处熔炼,用于宝石抽奖. | L125: ="ReplaceableTextures\CommandButtons\BTN_gem_"&RC[-9]&".blp" -> ReplaceableTextures\CommandButtons\BTN_gem_4.blp | N125: =VLOOKUP(RC[-10],Sheet2!R7C1:R12C5,5,0) -> model\item\texiao_dijiguangzhu.mdx | W125: 3 | X125: Campaign | Y125: =1000*POWER(2,RC[-22]) -> 16000 | Z125: 235 | AA125: 0 | AB125: =VLOOKUP(RC[-25],Sheet2!R13C1:R19C4,4,0)*VLOOKUP(RC[-24],Sheet2!R7C1:R12C4,4,0) -> 20 | AC125: 0 | AQ125: 1
A126: OBJECT | B126: F40O | C126: 4 | D126: B | E126: srbd | F126: ZZZY | G126: =Sheet1!R[-1]C[25] -> 四.乙|cFF1BE6B8[宝石]双龙魔石|r | H126: =Sheet1!R[-1]C[25] -> |cFFFFFF99基础属性|r|n力量:62500|n护甲:100|n伤害增幅:3|n|n用于镶嵌到[剑,衣]上.|n镶嵌后不可取下!|n不需要的宝石可以在宠物处熔炼,用于宝石抽奖. | I126: =RC[-2] -> 四.乙|cFF1BE6B8[宝石]双龙魔石|r | J126: =RC[-2] -> |cFFFFFF99基础属性|r|n力量:62500|n护甲:100|n伤害增幅:3|n|n用于镶嵌到[剑,衣]上.|n镶嵌后不可取下!|n不需要的宝石可以在宠物处熔炼,用于宝石抽奖. | L126: ="ReplaceableTextures\CommandButtons\BTN_gem_"&RC[-9]&".blp" -> ReplaceableTextures\CommandButtons\BTN_gem_4.blp | N126: =VLOOKUP(RC[-10],Sheet2!R7C1:R12C5,5,0) -> model\item\texiao_zhongjiguangzhu.mdx | W126: 3 | X126: Campaign | Y126: =1000*POWER(2,RC[-22]) -> 16000 | Z126: 235 | AA126: 0 | AB126: =VLOOKUP(RC[-25],Sheet2!R13C1:R19C4,4,0)*VLOOKUP(RC[-24],Sheet2!R7C1:R12C4,4,0) -> 30 | AC126: 0 | AQ126: 1
A127: OBJECT | B127: F40P | C127: 4 | D127: B | E127: srbd | F127: ZZZY | G127: =Sheet1!R[-1]C[25] -> 四.乙|cFF1BE6B8[宝石]兽王宝玉|r | H127: =Sheet1!R[-1]C[25] -> |cFFFFFF99基础属性|r|n攻击:150000|n护甲:100|n伤害增幅:3|n|n用于镶嵌到[剑,衣]上.|n镶嵌后不可取下!|n不需要的宝石可以在宠物处熔炼,用于宝石抽奖. | I127: =RC[-2] -> 四.乙|cFF1BE6B8[宝石]兽王宝玉|r | J127: =RC[-2] -> |cFFFFFF99基础属性|r|n攻击:150000|n护甲:100|n伤害增幅:3|n|n用于镶嵌到[剑,衣]上.|n镶嵌后不可取下!|n不需要的宝石可以在宠物处熔炼,用于宝石抽奖. | L127: ="ReplaceableTextures\CommandButtons\BTN_gem_"&RC[-9]&".blp" -> ReplaceableTextures\CommandButtons\BTN_gem_4.blp | N127: =VLOOKUP(RC[-10],Sheet2!R7C1:R12C5,5,0) -> model\item\texiao_zhongjiguangzhu.mdx | W127: 3 | X127: Campaign | Y127: =1000*POWER(2,RC[-22]) -> 16000 | Z127: 235 | AA127: 0 | AB127: =VLOOKUP(RC[-25],Sheet2!R13C1:R19C4,4,0)*VLOOKUP(RC[-24],Sheet2!R7C1:R12C4,4,0) -> 30 | AC127: 0 | AQ127: 1
A128: OBJECT | B128: F40Q | C128: 4 | D128: B | E128: srbd | F128: ZZZY | G128: =Sheet1!R[-1]C[25] -> 四.乙|cFF1BE6B8[宝石]雷音粗木|r | H128: =Sheet1!R[-1]C[25] -> |cFFFFFF99基础属性|r|n智力:62500|n护甲:100|n伤害增幅:3|n|n用于镶嵌到[剑,衣]上.|n镶嵌后不可取下!|n不需要的宝石可以在宠物处熔炼,用于宝石抽奖. | I128: =RC[-2] -> 四.乙|cFF1BE6B8[宝石]雷音粗木|r | J128: =RC[-2] -> |cFFFFFF99基础属性|r|n智力:62500|n护甲:100|n伤害增幅:3|n|n用于镶嵌到[剑,衣]上.|n镶嵌后不可取下!|n不需要的宝石可以在宠物处熔炼,用于宝石抽奖. | L128: ="ReplaceableTextures\CommandButtons\BTN_gem_"&RC[-9]&".blp" -> ReplaceableTextures\CommandButtons\BTN_gem_4.blp | N128: =VLOOKUP(RC[-10],Sheet2!R7C1:R12C5,5,0) -> model\item\texiao_zhongjiguangzhu.mdx | W128: 3 | X128: Campaign | Y128: =1000*POWER(2,RC[-22]) -> 16000 | Z128: 235 | AA128: 0 | AB128: =VLOOKUP(RC[-25],Sheet2!R13C1:R19C4,4,0)*VLOOKUP(RC[-24],Sheet2!R7C1:R12C4,4,0) -> 30 | AC128: 0 | AQ128: 1
A129: OBJECT | B129: F40R | C129: 4 | D129: B | E129: srbd | F129: ZZZY | G129: =Sheet1!R[-1]C[25] -> 四.乙|cFF1BE6B8[宝石]勾陈灵丝|r | H129: =Sheet1!R[-1]C[25] -> |cFFFFFF99基础属性|r|n敏捷:62500|n护甲:100|n伤害增幅:3|n|n用于镶嵌到[剑,衣]上.|n镶嵌后不可取下!|n不需要的宝石可以在宠物处熔炼,用于宝石抽奖. | I129: =RC[-2] -> 四.乙|cFF1BE6B8[宝石]勾陈灵丝|r | J129: =RC[-2] -> |cFFFFFF99基础属性|r|n敏捷:62500|n护甲:100|n伤害增幅:3|n|n用于镶嵌到[剑,衣]上.|n镶嵌后不可取下!|n不需要的宝石可以在宠物处熔炼,用于宝石抽奖. | L129: ="ReplaceableTextures\CommandButtons\BTN_gem_"&RC[-9]&".blp" -> ReplaceableTextures\CommandButtons\BTN_gem_4.blp | N129: =VLOOKUP(RC[-10],Sheet2!R7C1:R12C5,5,0) -> model\item\texiao_zhongjiguangzhu.mdx | W129: 3 | X129: Campaign | Y129: =1000*POWER(2,RC[-22]) -> 16000 | Z129: 235 | AA129: 0 | AB129: =VLOOKUP(RC[-25],Sheet2!R13C1:R19C4,4,0)*VLOOKUP(RC[-24],Sheet2!R7C1:R12C4,4,0) -> 30 | AC129: 0 | AQ129: 1
A130: OBJECT | B130: F40S | C130: 4 | D130: A | E130: srbd | F130: ZZZY | G130: =Sheet1!R[-1]C[25] -> 四.甲|cFF33FF00[宝石]灼灼其华|r | H130: =Sheet1!R[-1]C[25] -> |cFFFFFF99基础属性|r|n力量:30000|n敏捷:30000|n智力:30000|n伤害增幅:7|n|n用于镶嵌到[剑,衣]上.|n镶嵌后不可取下!|n不需要的宝石可以在宠物处熔炼,用于宝石抽奖. | I130: =RC[-2] -> 四.甲|cFF33FF00[宝石]灼灼其华|r | J130: =RC[-2] -> |cFFFFFF99基础属性|r|n力量:30000|n敏捷:30000|n智力:30000|n伤害增幅:7|n|n用于镶嵌到[剑,衣]上.|n镶嵌后不可取下!|n不需要的宝石可以在宠物处熔炼,用于宝石抽奖. | L130: ="ReplaceableTextures\CommandButtons\BTN_gem_"&RC[-9]&".blp" -> ReplaceableTextures\CommandButtons\BTN_gem_4.blp | N130: =VLOOKUP(RC[-10],Sheet2!R7C1:R12C5,5,0) -> model\item\texiao_zhongjiguangzhu2.mdx | W130: 3 | X130: Campaign | Y130: =1000*POWER(2,RC[-22]) -> 16000 | Z130: 235 | AA130: 0 | AB130: =VLOOKUP(RC[-25],Sheet2!R13C1:R19C4,4,0)*VLOOKUP(RC[-24],Sheet2!R7C1:R12C4,4,0) -> 40 | AC130: 0 | AQ130: 1
A131: OBJECT | B131: F40T | C131: 4 | D131: A | E131: srbd | F131: ZZZY | G131: =Sheet1!R[-1]C[25] -> 四.甲|cFF33FF00[宝石]耀武锋芒|r | H131: =Sheet1!R[-1]C[25] -> |cFFFFFF99基础属性|r|n攻击:200000|n伤害增幅:7|n|n用于镶嵌到[剑,衣]上.|n镶嵌后不可取下!|n不需要的宝石可以在宠物处熔炼,用于宝石抽奖. | I131: =RC[-2] -> 四.甲|cFF33FF00[宝石]耀武锋芒|r | J131: =RC[-2] -> |cFFFFFF99基础属性|r|n攻击:200000|n伤害增幅:7|n|n用于镶嵌到[剑,衣]上.|n镶嵌后不可取下!|n不需要的宝石可以在宠物处熔炼,用于宝石抽奖. | L131: ="ReplaceableTextures\CommandButtons\BTN_gem_"&RC[-9]&".blp" -> ReplaceableTextures\CommandButtons\BTN_gem_4.blp | N131: =VLOOKUP(RC[-10],Sheet2!R7C1:R12C5,5,0) -> model\item\texiao_zhongjiguangzhu2.mdx | W131: 3 | X131: Campaign | Y131: =1000*POWER(2,RC[-22]) -> 16000 | Z131: 235 | AA131: 0 | AB131: =VLOOKUP(RC[-25],Sheet2!R13C1:R19C4,4,0)*VLOOKUP(RC[-24],Sheet2!R7C1:R12C4,4,0) -> 40 | AC131: 0 | AQ131: 1
A132: OBJECT | B132: F40U | C132: 4 | D132: S | E132: srbd | F132: ZZZY | G132: =Sheet1!R[-1]C[25] -> 四.绝|cFFFF9933[宝石]空城泪 - 旧王愁|r | H132: =Sheet1!R[-1]C[25] -> |cFFFFFF99基础属性|r|n血量:750000|n护甲:600|n|n|cFFFFFF55附加属性|r(%)|n攻击吸血:1|n伤害增幅:7|n|n用于镶嵌到[剑,衣]上.|n镶嵌后不可取下!|n不需要的宝石可以在宠物处熔炼,用于宝石抽奖. | I132: =RC[-2] -> 四.绝|cFFFF9933[宝石]空城泪 - 旧王愁|r | J132: =RC[-2] -> |cFFFFFF99基础属性|r|n血量:750000|n护甲:600|n|n|cFFFFFF55附加属性|r(%)|n攻击吸血:1|n伤害增幅:7|n|n用于镶嵌到[剑,衣]上.|n镶嵌后不可取下!|n不需要的宝石可以在宠物处熔炼,用于宝石抽奖. | L132: ="ReplaceableTextures\CommandButtons\BTN_gem_"&RC[-9]&".blp" -> ReplaceableTextures\CommandButtons\BTN_gem_4.blp | N132: =VLOOKUP(RC[-10],Sheet2!R7C1:R12C5,5,0) -> model\item\texiao_gaojiguangzhu.mdx | W132: 3 | X132: Campaign | Y132: =1000*POWER(2,RC[-22]) -> 16000 | Z132: 235 | AA132: 0 | AB132: =VLOOKUP(RC[-25],Sheet2!R13C1:R19C4,4,0)*VLOOKUP(RC[-24],Sheet2!R7C1:R12C4,4,0) -> 50 | AC132: 0 | AQ132: 1
A133: OBJECT | B133: F40V | C133: 4 | D133: S | E133: srbd | F133: ZZZY | G133: =Sheet1!R[-1]C[25] -> 四.绝|cFFFF9933[宝石]空城泪 - 故国恨|r | H133: =Sheet1!R[-1]C[25] -> |cFFFFFF99基础属性|r|n攻击:62500|n|n|cFFFFFF55附加属性|r(%)|n暴击概率:9|n暴击伤害:36|n伤害增幅:7|n|n用于镶嵌到[剑,衣]上.|n镶嵌后不可取下!|n不需要的宝石可以在宠物处熔炼,用于宝石抽奖. | I133: =RC[-2] -> 四.绝|cFFFF9933[宝石]空城泪 - 故国恨|r | J133: =RC[-2] -> |cFFFFFF99基础属性|r|n攻击:62500|n|n|cFFFFFF55附加属性|r(%)|n暴击概率:9|n暴击伤害:36|n伤害增幅:7|n|n用于镶嵌到[剑,衣]上.|n镶嵌后不可取下!|n不需要的宝石可以在宠物处熔炼,用于宝石抽奖. | L133: ="ReplaceableTextures\CommandButtons\BTN_gem_"&RC[-9]&".blp" -> ReplaceableTextures\CommandButtons\BTN_gem_4.blp | N133: =VLOOKUP(RC[-10],Sheet2!R7C1:R12C5,5,0) -> model\item\texiao_gaojiguangzhu.mdx | W133: 3 | X133: Campaign | Y133: =1000*POWER(2,RC[-22]) -> 16000 | Z133: 235 | AA133: 0 | AB133: =VLOOKUP(RC[-25],Sheet2!R13C1:R19C4,4,0)*VLOOKUP(RC[-24],Sheet2!R7C1:R12C4,4,0) -> 50 | AC133: 0 | AQ133: 1
A134: OBJECT | B134: F40W | C134: 4 | D134: X | E134: srbd | F134: ZZZY | G134: =Sheet1!R[-1]C[25] -> 四.神|Cffff0000[宝石]上古遗物 - 御世|r | H134: =Sheet1!R[-1]C[25] -> |cFFFFFF99基础属性|r|n血量:1500000|n护甲:800|n|n|cFFFFFF55附加属性|r(%)|n暴击伤害:36|n伤害增幅:14|n|n用于镶嵌到[剑,衣]上.|n镶嵌后不可取下!|n不需要的宝石可以在宠物处熔炼,用于宝石抽奖. | I134: =RC[-2] -> 四.神|Cffff0000[宝石]上古遗物 - 御世|r | J134: =RC[-2] -> |cFFFFFF99基础属性|r|n血量:1500000|n护甲:800|n|n|cFFFFFF55附加属性|r(%)|n暴击伤害:36|n伤害增幅:14|n|n用于镶嵌到[剑,衣]上.|n镶嵌后不可取下!|n不需要的宝石可以在宠物处熔炼,用于宝石抽奖. | L134: ="ReplaceableTextures\CommandButtons\BTN_gem_"&RC[-9]&".blp" -> ReplaceableTextures\CommandButtons\BTN_gem_4.blp | N134: =VLOOKUP(RC[-10],Sheet2!R7C1:R12C5,5,0) -> model\item\texiao_gaojiguangzhu.mdx | W134: 3 | X134: Campaign | Y134: =1000*POWER(2,RC[-22]) -> 16000 | Z134: 235 | AA134: 0 | AB134: =VLOOKUP(RC[-25],Sheet2!R13C1:R19C4,4,0)*VLOOKUP(RC[-24],Sheet2!R7C1:R12C4,4,0) -> 60 | AC134: 0 | AQ134: 1
A135: COMMENT | B135: F500 | C135: 5 | D135: D | E135: srbd | F135: ZZZY | G135: =Sheet1!R[-1]C[25] -> 五.丁|cFF999999[宝石]幽冥|r | H135: =Sheet1!R[-1]C[25] -> |n|n用于镶嵌到[剑,衣]上.|n镶嵌后不可取下!|n不需要的宝石可以在宠物处熔炼,用于宝石抽奖. | I135: =RC[-2] -> 五.丁|cFF999999[宝石]幽冥|r | J135: =RC[-2] -> |n|n用于镶嵌到[剑,衣]上.|n镶嵌后不可取下!|n不需要的宝石可以在宠物处熔炼,用于宝石抽奖. | L135: ="ReplaceableTextures\CommandButtons\BTN_gem_"&RC[-9]&".blp" -> ReplaceableTextures\CommandButtons\BTN_gem_5.blp | N135: =VLOOKUP(RC[-10],Sheet2!R7C1:R12C5,5,0) -> model\item\texiao_dijiguangzhu.mdx | W135: 3 | X135: Campaign | Y135: =1000*POWER(2,RC[-22]) -> 32000 | Z135: 235 | AA135: 0 | AB135: =VLOOKUP(RC[-25],Sheet2!R13C1:R19C4,4,0)*VLOOKUP(RC[-24],Sheet2!R7C1:R12C4,4,0) -> 16 | AC135: 0 | AQ135: 1
A136: COMMENT | B136: F501 | C136: 5 | D136: D | E136: srbd | F136: ZZZY | G136: =Sheet1!R[-1]C[25] -> 五.丁|cFF999999[宝石]天翔|r | H136: =Sheet1!R[-1]C[25] -> |n|n用于镶嵌到[剑,衣]上.|n镶嵌后不可取下!|n不需要的宝石可以在宠物处熔炼,用于宝石抽奖. | I136: =RC[-2] -> 五.丁|cFF999999[宝石]天翔|r | J136: =RC[-2] -> |n|n用于镶嵌到[剑,衣]上.|n镶嵌后不可取下!|n不需要的宝石可以在宠物处熔炼,用于宝石抽奖. | L136: ="ReplaceableTextures\CommandButtons\BTN_gem_"&RC[-9]&".blp" -> ReplaceableTextures\CommandButtons\BTN_gem_5.blp | N136: =VLOOKUP(RC[-10],Sheet2!R7C1:R12C5,5,0) -> model\item\texiao_dijiguangzhu.mdx | W136: 3 | X136: Campaign | Y136: =1000*POWER(2,RC[-22]) -> 32000 | Z136: 235 | AA136: 0 | AB136: =VLOOKUP(RC[-25],Sheet2!R13C1:R19C4,4,0)*VLOOKUP(RC[-24],Sheet2!R7C1:R12C4,4,0) -> 16 | AC136: 0 | AQ136: 1
A137: COMMENT | B137: F502 | C137: 5 | D137: D | E137: srbd | F137: ZZZY | G137: =Sheet1!R[-1]C[25] -> 五.丁|cFF999999[宝石]白焰|r | H137: =Sheet1!R[-1]C[25] -> |n|n用于镶嵌到[剑,衣]上.|n镶嵌后不可取下!|n不需要的宝石可以在宠物处熔炼,用于宝石抽奖. | I137: =RC[-2] -> 五.丁|cFF999999[宝石]白焰|r | J137: =RC[-2] -> |n|n用于镶嵌到[剑,衣]上.|n镶嵌后不可取下!|n不需要的宝石可以在宠物处熔炼,用于宝石抽奖. | L137: ="ReplaceableTextures\CommandButtons\BTN_gem_"&RC[-9]&".blp" -> ReplaceableTextures\CommandButtons\BTN_gem_5.blp | N137: =VLOOKUP(RC[-10],Sheet2!R7C1:R12C5,5,0) -> model\item\texiao_dijiguangzhu.mdx | W137: 3 | X137: Campaign | Y137: =1000*POWER(2,RC[-22]) -> 32000 | Z137: 235 | AA137: 0 | AB137: =VLOOKUP(RC[-25],Sheet2!R13C1:R19C4,4,0)*VLOOKUP(RC[-24],Sheet2!R7C1:R12C4,4,0) -> 16 | AC137: 0 | AQ137: 1
A138: COMMENT | B138: F503 | C138: 5 | D138: D | E138: srbd | F138: ZZZY | G138: =Sheet1!R[-1]C[25] -> 五.丁|cFF999999[宝石]血龙|r | H138: =Sheet1!R[-1]C[25] -> |n|n用于镶嵌到[剑,衣]上.|n镶嵌后不可取下!|n不需要的宝石可以在宠物处熔炼,用于宝石抽奖. | I138: =RC[-2] -> 五.丁|cFF999999[宝石]血龙|r | J138: =RC[-2] -> |n|n用于镶嵌到[剑,衣]上.|n镶嵌后不可取下!|n不需要的宝石可以在宠物处熔炼,用于宝石抽奖. | L138: ="ReplaceableTextures\CommandButtons\BTN_gem_"&RC[-9]&".blp" -> ReplaceableTextures\CommandButtons\BTN_gem_5.blp | N138: =VLOOKUP(RC[-10],Sheet2!R7C1:R12C5,5,0) -> model\item\texiao_dijiguangzhu.mdx | W138: 3 | X138: Campaign | Y138: =1000*POWER(2,RC[-22]) -> 32000 | Z138: 235 | AA138: 0 | AB138: =VLOOKUP(RC[-25],Sheet2!R13C1:R19C4,4,0)*VLOOKUP(RC[-24],Sheet2!R7C1:R12C4,4,0) -> 16 | AC138: 0 | AQ138: 1
A139: COMMENT | B139: F504 | C139: 5 | D139: D | E139: srbd | F139: ZZZY | G139: =Sheet1!R[-1]C[25] -> 五.丁|cFF999999[宝石]暗影|r | H139: =Sheet1!R[-1]C[25] -> |n|n用于镶嵌到[剑,衣]上.|n镶嵌后不可取下!|n不需要的宝石可以在宠物处熔炼,用于宝石抽奖. | I139: =RC[-2] -> 五.丁|cFF999999[宝石]暗影|r | J139: =RC[-2] -> |n|n用于镶嵌到[剑,衣]上.|n镶嵌后不可取下!|n不需要的宝石可以在宠物处熔炼,用于宝石抽奖. | L139: ="ReplaceableTextures\CommandButtons\BTN_gem_"&RC[-9]&".blp" -> ReplaceableTextures\CommandButtons\BTN_gem_5.blp | N139: =VLOOKUP(RC[-10],Sheet2!R7C1:R12C5,5,0) -> model\item\texiao_dijiguangzhu.mdx | W139: 3 | X139: Campaign | Y139: =1000*POWER(2,RC[-22]) -> 32000 | Z139: 235 | AA139: 0 | AB139: =VLOOKUP(RC[-25],Sheet2!R13C1:R19C4,4,0)*VLOOKUP(RC[-24],Sheet2!R7C1:R12C4,4,0) -> 16 | AC139: 0 | AQ139: 1
A140: COMMENT | B140: F505 | C140: 5 | D140: D | E140: srbd | F140: ZZZY | G140: =Sheet1!R[-1]C[25] -> 五.丁|cFF999999[宝石]罡风|r | H140: =Sheet1!R[-1]C[25] -> |n|n用于镶嵌到[剑,衣]上.|n镶嵌后不可取下!|n不需要的宝石可以在宠物处熔炼,用于宝石抽奖. | I140: =RC[-2] -> 五.丁|cFF999999[宝石]罡风|r | J140: =RC[-2] -> |n|n用于镶嵌到[剑,衣]上.|n镶嵌后不可取下!|n不需要的宝石可以在宠物处熔炼,用于宝石抽奖. | L140: ="ReplaceableTextures\CommandButtons\BTN_gem_"&RC[-9]&".blp" -> ReplaceableTextures\CommandButtons\BTN_gem_5.blp | N140: =VLOOKUP(RC[-10],Sheet2!R7C1:R12C5,5,0) -> model\item\texiao_dijiguangzhu.mdx | W140: 3 | X140: Campaign | Y140: =1000*POWER(2,RC[-22]) -> 32000 | Z140: 235 | AA140: 0 | AB140: =VLOOKUP(RC[-25],Sheet2!R13C1:R19C4,4,0)*VLOOKUP(RC[-24],Sheet2!R7C1:R12C4,4,0) -> 16 | AC140: 0 | AQ140: 1
A141: COMMENT | B141: F506 | C141: 5 | D141: D | E141: srbd | F141: ZZZY | G141: =Sheet1!R[-1]C[25] -> 五.丁|cFF999999[宝石]穿心|r | H141: =Sheet1!R[-1]C[25] -> |n|n用于镶嵌到[剑,衣]上.|n镶嵌后不可取下!|n不需要的宝石可以在宠物处熔炼,用于宝石抽奖. | I141: =RC[-2] -> 五.丁|cFF999999[宝石]穿心|r | J141: =RC[-2] -> |n|n用于镶嵌到[剑,衣]上.|n镶嵌后不可取下!|n不需要的宝石可以在宠物处熔炼,用于宝石抽奖. | L141: ="ReplaceableTextures\CommandButtons\BTN_gem_"&RC[-9]&".blp" -> ReplaceableTextures\CommandButtons\BTN_gem_5.blp | N141: =VLOOKUP(RC[-10],Sheet2!R7C1:R12C5,5,0) -> model\item\texiao_dijiguangzhu.mdx | W141: 3 | X141: Campaign | Y141: =1000*POWER(2,RC[-22]) -> 32000 | Z141: 235 | AA141: 0 | AB141: =VLOOKUP(RC[-25],Sheet2!R13C1:R19C4,4,0)*VLOOKUP(RC[-24],Sheet2!R7C1:R12C4,4,0) -> 16 | AC141: 0 | AQ141: 1
A142: COMMENT | B142: F507 | C142: 5 | D142: D | E142: srbd | F142: ZZZY | G142: =Sheet1!R[-1]C[25] -> 五.丁|cFF999999[宝石]青涛|r | H142: =Sheet1!R[-1]C[25] -> |n|n用于镶嵌到[剑,衣]上.|n镶嵌后不可取下!|n不需要的宝石可以在宠物处熔炼,用于宝石抽奖. | I142: =RC[-2] -> 五.丁|cFF999999[宝石]青涛|r | J142: =RC[-2] -> |n|n用于镶嵌到[剑,衣]上.|n镶嵌后不可取下!|n不需要的宝石可以在宠物处熔炼,用于宝石抽奖. | L142: ="ReplaceableTextures\CommandButtons\BTN_gem_"&RC[-9]&".blp" -> ReplaceableTextures\CommandButtons\BTN_gem_5.blp | N142: =VLOOKUP(RC[-10],Sheet2!R7C1:R12C5,5,0) -> model\item\texiao_dijiguangzhu.mdx | W142: 3 | X142: Campaign | Y142: =1000*POWER(2,RC[-22]) -> 32000 | Z142: 235 | AA142: 0 | AB142: =VLOOKUP(RC[-25],Sheet2!R13C1:R19C4,4,0)*VLOOKUP(RC[-24],Sheet2!R7C1:R12C4,4,0) -> 16 | AC142: 0 | AQ142: 1
A143: COMMENT | B143: F508 | C143: 5 | D143: D | E143: srbd | F143: ZZZY | G143: =Sheet1!R[-1]C[25] -> 五.丁|cFF999999[宝石]遮那|r | H143: =Sheet1!R[-1]C[25] -> |n|n用于镶嵌到[剑,衣]上.|n镶嵌后不可取下!|n不需要的宝石可以在宠物处熔炼,用于宝石抽奖. | I143: =RC[-2] -> 五.丁|cFF999999[宝石]遮那|r | J143: =RC[-2] -> |n|n用于镶嵌到[剑,衣]上.|n镶嵌后不可取下!|n不需要的宝石可以在宠物处熔炼,用于宝石抽奖. | L143: ="ReplaceableTextures\CommandButtons\BTN_gem_"&RC[-9]&".blp" -> ReplaceableTextures\CommandButtons\BTN_gem_5.blp | N143: =VLOOKUP(RC[-10],Sheet2!R7C1:R12C5,5,0) -> model\item\texiao_dijiguangzhu.mdx | W143: 3 | X143: Campaign | Y143: =1000*POWER(2,RC[-22]) -> 32000 | Z143: 235 | AA143: 0 | AB143: =VLOOKUP(RC[-25],Sheet2!R13C1:R19C4,4,0)*VLOOKUP(RC[-24],Sheet2!R7C1:R12C4,4,0) -> 16 | AC143: 0 | AQ143: 1
A144: COMMENT | B144: F509 | C144: 5 | D144: D | E144: srbd | F144: ZZZY | G144: =Sheet1!R[-1]C[25] -> 五.丁|cFF999999[宝石]通神|r | H144: =Sheet1!R[-1]C[25] -> |n|n用于镶嵌到[剑,衣]上.|n镶嵌后不可取下!|n不需要的宝石可以在宠物处熔炼,用于宝石抽奖. | I144: =RC[-2] -> 五.丁|cFF999999[宝石]通神|r | J144: =RC[-2] -> |n|n用于镶嵌到[剑,衣]上.|n镶嵌后不可取下!|n不需要的宝石可以在宠物处熔炼,用于宝石抽奖. | L144: ="ReplaceableTextures\CommandButtons\BTN_gem_"&RC[-9]&".blp" -> ReplaceableTextures\CommandButtons\BTN_gem_5.blp | N144: =VLOOKUP(RC[-10],Sheet2!R7C1:R12C5,5,0) -> model\item\texiao_dijiguangzhu.mdx | W144: 3 | X144: Campaign | Y144: =1000*POWER(2,RC[-22]) -> 32000 | Z144: 235 | AA144: 0 | AB144: =VLOOKUP(RC[-25],Sheet2!R13C1:R19C4,4,0)*VLOOKUP(RC[-24],Sheet2!R7C1:R12C4,4,0) -> 16 | AC144: 0 | AQ144: 1
A145: COMMENT | B145: F50A | C145: 5 | D145: D | E145: srbd | F145: ZZZY | G145: =Sheet1!R[-1]C[25] -> 五.丁|cFF999999[宝石]神鹰|r | H145: =Sheet1!R[-1]C[25] -> |n|n用于镶嵌到[剑,衣]上.|n镶嵌后不可取下!|n不需要的宝石可以在宠物处熔炼,用于宝石抽奖. | I145: =RC[-2] -> 五.丁|cFF999999[宝石]神鹰|r | J145: =RC[-2] -> |n|n用于镶嵌到[剑,衣]上.|n镶嵌后不可取下!|n不需要的宝石可以在宠物处熔炼,用于宝石抽奖. | L145: ="ReplaceableTextures\CommandButtons\BTN_gem_"&RC[-9]&".blp" -> ReplaceableTextures\CommandButtons\BTN_gem_5.blp | N145: =VLOOKUP(RC[-10],Sheet2!R7C1:R12C5,5,0) -> model\item\texiao_dijiguangzhu.mdx | W145: 3 | X145: Campaign | Y145: =1000*POWER(2,RC[-22]) -> 32000 | Z145: 235 | AA145: 0 | AB145: =VLOOKUP(RC[-25],Sheet2!R13C1:R19C4,4,0)*VLOOKUP(RC[-24],Sheet2!R7C1:R12C4,4,0) -> 16 | AC145: 0 | AQ145: 1
A146: COMMENT | B146: F50B | C146: 5 | D146: D | E146: srbd | F146: ZZZY | G146: =Sheet1!R[-1]C[25] -> 五.丁|cFF999999[宝石]蓝布|r | H146: =Sheet1!R[-1]C[25] -> |n|n用于镶嵌到[剑,衣]上.|n镶嵌后不可取下!|n不需要的宝石可以在宠物处熔炼,用于宝石抽奖. | I146: =RC[-2] -> 五.丁|cFF999999[宝石]蓝布|r | J146: =RC[-2] -> |n|n用于镶嵌到[剑,衣]上.|n镶嵌后不可取下!|n不需要的宝石可以在宠物处熔炼,用于宝石抽奖. | L146: ="ReplaceableTextures\CommandButtons\BTN_gem_"&RC[-9]&".blp" -> ReplaceableTextures\CommandButtons\BTN_gem_5.blp | N146: =VLOOKUP(RC[-10],Sheet2!R7C1:R12C5,5,0) -> model\item\texiao_dijiguangzhu.mdx | W146: 3 | X146: Campaign | Y146: =1000*POWER(2,RC[-22]) -> 32000 | Z146: 235 | AA146: 0 | AB146: =VLOOKUP(RC[-25],Sheet2!R13C1:R19C4,4,0)*VLOOKUP(RC[-24],Sheet2!R7C1:R12C4,4,0) -> 16 | AC146: 0 | AQ146: 1
A147: COMMENT | B147: F50C | C147: 5 | D147: D | E147: srbd | F147: ZZZY | G147: =Sheet1!R[-1]C[25] -> 五.丁|cFF999999[宝石]紫云|r | H147: =Sheet1!R[-1]C[25] -> |n|n用于镶嵌到[剑,衣]上.|n镶嵌后不可取下!|n不需要的宝石可以在宠物处熔炼,用于宝石抽奖. | I147: =RC[-2] -> 五.丁|cFF999999[宝石]紫云|r | J147: =RC[-2] -> |n|n用于镶嵌到[剑,衣]上.|n镶嵌后不可取下!|n不需要的宝石可以在宠物处熔炼,用于宝石抽奖. | L147: ="ReplaceableTextures\CommandButtons\BTN_gem_"&RC[-9]&".blp" -> ReplaceableTextures\CommandButtons\BTN_gem_5.blp | N147: =VLOOKUP(RC[-10],Sheet2!R7C1:R12C5,5,0) -> model\item\texiao_dijiguangzhu.mdx | W147: 3 | X147: Campaign | Y147: =1000*POWER(2,RC[-22]) -> 32000 | Z147: 235 | AA147: 0 | AB147: =VLOOKUP(RC[-25],Sheet2!R13C1:R19C4,4,0)*VLOOKUP(RC[-24],Sheet2!R7C1:R12C4,4,0) -> 16 | AC147: 0 | AQ147: 1
A148: COMMENT | B148: F50D | C148: 5 | D148: D | E148: srbd | F148: ZZZY | G148: =Sheet1!R[-1]C[25] -> 五.丁|cFF999999[宝石]沥泉|r | H148: =Sheet1!R[-1]C[25] -> |n|n用于镶嵌到[剑,衣]上.|n镶嵌后不可取下!|n不需要的宝石可以在宠物处熔炼,用于宝石抽奖. | I148: =RC[-2] -> 五.丁|cFF999999[宝石]沥泉|r | J148: =RC[-2] -> |n|n用于镶嵌到[剑,衣]上.|n镶嵌后不可取下!|n不需要的宝石可以在宠物处熔炼,用于宝石抽奖. | L148: ="ReplaceableTextures\CommandButtons\BTN_gem_"&RC[-9]&".blp" -> ReplaceableTextures\CommandButtons\BTN_gem_5.blp | N148: =VLOOKUP(RC[-10],Sheet2!R7C1:R12C5,5,0) -> model\item\texiao_dijiguangzhu.mdx | W148: 3 | X148: Campaign | Y148: =1000*POWER(2,RC[-22]) -> 32000 | Z148: 235 | AA148: 0 | AB148: =VLOOKUP(RC[-25],Sheet2!R13C1:R19C4,4,0)*VLOOKUP(RC[-24],Sheet2!R7C1:R12C4,4,0) -> 16 | AC148: 0 | AQ148: 1
A149: COMMENT | B149: F50E | C149: 5 | D149: D | E149: srbd | F149: ZZZY | G149: =Sheet1!R[-1]C[25] -> 五.丁|cFF999999[宝石]销魂|r | H149: =Sheet1!R[-1]C[25] -> |n|n用于镶嵌到[剑,衣]上.|n镶嵌后不可取下!|n不需要的宝石可以在宠物处熔炼,用于宝石抽奖. | I149: =RC[-2] -> 五.丁|cFF999999[宝石]销魂|r | J149: =RC[-2] -> |n|n用于镶嵌到[剑,衣]上.|n镶嵌后不可取下!|n不需要的宝石可以在宠物处熔炼,用于宝石抽奖. | L149: ="ReplaceableTextures\CommandButtons\BTN_gem_"&RC[-9]&".blp" -> ReplaceableTextures\CommandButtons\BTN_gem_5.blp | N149: =VLOOKUP(RC[-10],Sheet2!R7C1:R12C5,5,0) -> model\item\texiao_dijiguangzhu.mdx | W149: 3 | X149: Campaign | Y149: =1000*POWER(2,RC[-22]) -> 32000 | Z149: 235 | AA149: 0 | AB149: =VLOOKUP(RC[-25],Sheet2!R13C1:R19C4,4,0)*VLOOKUP(RC[-24],Sheet2!R7C1:R12C4,4,0) -> 16 | AC149: 0 | AQ149: 1
A150: COMMENT | B150: F50F | C150: 5 | D150: D | E150: srbd | F150: ZZZY | G150: =Sheet1!R[-1]C[25] -> 五.丁|cFF999999[宝石]焚魂|r | H150: =Sheet1!R[-1]C[25] -> |n|n用于镶嵌到[剑,衣]上.|n镶嵌后不可取下!|n不需要的宝石可以在宠物处熔炼,用于宝石抽奖. | I150: =RC[-2] -> 五.丁|cFF999999[宝石]焚魂|r | J150: =RC[-2] -> |n|n用于镶嵌到[剑,衣]上.|n镶嵌后不可取下!|n不需要的宝石可以在宠物处熔炼,用于宝石抽奖. | L150: ="ReplaceableTextures\CommandButtons\BTN_gem_"&RC[-9]&".blp" -> ReplaceableTextures\CommandButtons\BTN_gem_5.blp | N150: =VLOOKUP(RC[-10],Sheet2!R7C1:R12C5,5,0) -> model\item\texiao_dijiguangzhu.mdx | W150: 3 | X150: Campaign | Y150: =1000*POWER(2,RC[-22]) -> 32000 | Z150: 235 | AA150: 0 | AB150: =VLOOKUP(RC[-25],Sheet2!R13C1:R19C4,4,0)*VLOOKUP(RC[-24],Sheet2!R7C1:R12C4,4,0) -> 16 | AC150: 0 | AQ150: 1
A151: OBJECT | B151: F50G | C151: 5 | D151: C | E151: srbd | F151: ZZZY | G151: =Sheet1!R[-1]C[25] -> 五.丙|cFF99FF66[宝石]闇影石|r | H151: =Sheet1!R[-1]C[25] -> |cFFFFFF99基础属性|r|n力量:75000|n敏捷:75000|n智力:75000|n|n用于镶嵌到[剑,衣]上.|n镶嵌后不可取下!|n不需要的宝石可以在宠物处熔炼,用于宝石抽奖. | I151: =RC[-2] -> 五.丙|cFF99FF66[宝石]闇影石|r | J151: =RC[-2] -> |cFFFFFF99基础属性|r|n力量:75000|n敏捷:75000|n智力:75000|n|n用于镶嵌到[剑,衣]上.|n镶嵌后不可取下!|n不需要的宝石可以在宠物处熔炼,用于宝石抽奖. | L151: ="ReplaceableTextures\CommandButtons\BTN_gem_"&RC[-9]&".blp" -> ReplaceableTextures\CommandButtons\BTN_gem_5.blp | N151: =VLOOKUP(RC[-10],Sheet2!R7C1:R12C5,5,0) -> model\item\texiao_dijiguangzhu.mdx | W151: 3 | X151: Campaign | Y151: =1000*POWER(2,RC[-22]) -> 32000 | Z151: 235 | AA151: 0 | AB151: =VLOOKUP(RC[-25],Sheet2!R13C1:R19C4,4,0)*VLOOKUP(RC[-24],Sheet2!R7C1:R12C4,4,0) -> 32 | AC151: 0 | AQ151: 1
A152: OBJECT | B152: F50H | C152: 5 | D152: C | E152: srbd | F152: ZZZY | G152: =Sheet1!R[-1]C[25] -> 五.丙|cFF99FF66[宝石]点星石|r | H152: =Sheet1!R[-1]C[25] -> |cFFFFFF99基础属性|r|n攻击:250000|n|n用于镶嵌到[剑,衣]上.|n镶嵌后不可取下!|n不需要的宝石可以在宠物处熔炼,用于宝石抽奖. | I152: =RC[-2] -> 五.丙|cFF99FF66[宝石]点星石|r | J152: =RC[-2] -> |cFFFFFF99基础属性|r|n攻击:250000|n|n用于镶嵌到[剑,衣]上.|n镶嵌后不可取下!|n不需要的宝石可以在宠物处熔炼,用于宝石抽奖. | L152: ="ReplaceableTextures\CommandButtons\BTN_gem_"&RC[-9]&".blp" -> ReplaceableTextures\CommandButtons\BTN_gem_5.blp | N152: =VLOOKUP(RC[-10],Sheet2!R7C1:R12C5,5,0) -> model\item\texiao_dijiguangzhu.mdx | W152: 3 | X152: Campaign | Y152: =1000*POWER(2,RC[-22]) -> 32000 | Z152: 235 | AA152: 0 | AB152: =VLOOKUP(RC[-25],Sheet2!R13C1:R19C4,4,0)*VLOOKUP(RC[-24],Sheet2!R7C1:R12C4,4,0) -> 32 | AC152: 0 | AQ152: 1
A153: OBJECT | B153: F50I | C153: 5 | D153: C | E153: srbd | F153: ZZZY | G153: =Sheet1!R[-1]C[25] -> 五.丙|cFF99FF66[宝石]雨霖石|r | H153: =Sheet1!R[-1]C[25] -> |n|n|cFFFFFF55附加属性|r(%)|n攻击吸血:4|n|n用于镶嵌到[剑,衣]上.|n镶嵌后不可取下!|n不需要的宝石可以在宠物处熔炼,用于宝石抽奖. | I153: =RC[-2] -> 五.丙|cFF99FF66[宝石]雨霖石|r | J153: =RC[-2] -> |n|n|cFFFFFF55附加属性|r(%)|n攻击吸血:4|n|n用于镶嵌到[剑,衣]上.|n镶嵌后不可取下!|n不需要的宝石可以在宠物处熔炼,用于宝石抽奖. | L153: ="ReplaceableTextures\CommandButtons\BTN_gem_"&RC[-9]&".blp" -> ReplaceableTextures\CommandButtons\BTN_gem_5.blp | N153: =VLOOKUP(RC[-10],Sheet2!R7C1:R12C5,5,0) -> model\item\texiao_dijiguangzhu.mdx | W153: 3 | X153: Campaign | Y153: =1000*POWER(2,RC[-22]) -> 32000 | Z153: 235 | AA153: 0 | AB153: =VLOOKUP(RC[-25],Sheet2!R13C1:R19C4,4,0)*VLOOKUP(RC[-24],Sheet2!R7C1:R12C4,4,0) -> 32 | AC153: 0 | AQ153: 1
A154: OBJECT | B154: F50J | C154: 5 | D154: C | E154: srbd | F154: ZZZY | G154: =Sheet1!R[-1]C[25] -> 五.丙|cFF99FF66[宝石]孤妖石|r | H154: =Sheet1!R[-1]C[25] -> |cFFFFFF99基础属性|r|n血量:1250000|n护甲:600|n|n用于镶嵌到[剑,衣]上.|n镶嵌后不可取下!|n不需要的宝石可以在宠物处熔炼,用于宝石抽奖. | I154: =RC[-2] -> 五.丙|cFF99FF66[宝石]孤妖石|r | J154: =RC[-2] -> |cFFFFFF99基础属性|r|n血量:1250000|n护甲:600|n|n用于镶嵌到[剑,衣]上.|n镶嵌后不可取下!|n不需要的宝石可以在宠物处熔炼,用于宝石抽奖. | L154: ="ReplaceableTextures\CommandButtons\BTN_gem_"&RC[-9]&".blp" -> ReplaceableTextures\CommandButtons\BTN_gem_5.blp | N154: =VLOOKUP(RC[-10],Sheet2!R7C1:R12C5,5,0) -> model\item\texiao_dijiguangzhu.mdx | W154: 3 | X154: Campaign | Y154: =1000*POWER(2,RC[-22]) -> 32000 | Z154: 235 | AA154: 0 | AB154: =VLOOKUP(RC[-25],Sheet2!R13C1:R19C4,4,0)*VLOOKUP(RC[-24],Sheet2!R7C1:R12C4,4,0) -> 32 | AC154: 0 | AQ154: 1
A155: OBJECT | B155: F50K | C155: 5 | D155: C | E155: srbd | F155: ZZZY | G155: =Sheet1!R[-1]C[25] -> 五.丙|cFF99FF66[宝石]闪光石|r | H155: =Sheet1!R[-1]C[25] -> |cFFFFFF99基础属性|r|n力量:100000|n敏捷:25000|n智力:25000|n|n用于镶嵌到[剑,衣]上.|n镶嵌后不可取下!|n不需要的宝石可以在宠物处熔炼,用于宝石抽奖. | I155: =RC[-2] -> 五.丙|cFF99FF66[宝石]闪光石|r | J155: =RC[-2] -> |cFFFFFF99基础属性|r|n力量:100000|n敏捷:25000|n智力:25000|n|n用于镶嵌到[剑,衣]上.|n镶嵌后不可取下!|n不需要的宝石可以在宠物处熔炼,用于宝石抽奖. | L155: ="ReplaceableTextures\CommandButtons\BTN_gem_"&RC[-9]&".blp" -> ReplaceableTextures\CommandButtons\BTN_gem_5.blp | N155: =VLOOKUP(RC[-10],Sheet2!R7C1:R12C5,5,0) -> model\item\texiao_dijiguangzhu.mdx | W155: 3 | X155: Campaign | Y155: =1000*POWER(2,RC[-22]) -> 32000 | Z155: 235 | AA155: 0 | AB155: =VLOOKUP(RC[-25],Sheet2!R13C1:R19C4,4,0)*VLOOKUP(RC[-24],Sheet2!R7C1:R12C4,4,0) -> 32 | AC155: 0 | AQ155: 1
A156: OBJECT | B156: F50L | C156: 5 | D156: C | E156: srbd | F156: ZZZY | G156: =Sheet1!R[-1]C[25] -> 五.丙|cFF99FF66[宝石]灵蛇石|r | H156: =Sheet1!R[-1]C[25] -> |cFFFFFF99基础属性|r|n力量:25000|n敏捷:100000|n智力:25000|n|n用于镶嵌到[剑,衣]上.|n镶嵌后不可取下!|n不需要的宝石可以在宠物处熔炼,用于宝石抽奖. | I156: =RC[-2] -> 五.丙|cFF99FF66[宝石]灵蛇石|r | J156: =RC[-2] -> |cFFFFFF99基础属性|r|n力量:25000|n敏捷:100000|n智力:25000|n|n用于镶嵌到[剑,衣]上.|n镶嵌后不可取下!|n不需要的宝石可以在宠物处熔炼,用于宝石抽奖. | L156: ="ReplaceableTextures\CommandButtons\BTN_gem_"&RC[-9]&".blp" -> ReplaceableTextures\CommandButtons\BTN_gem_5.blp | N156: =VLOOKUP(RC[-10],Sheet2!R7C1:R12C5,5,0) -> model\item\texiao_dijiguangzhu.mdx | W156: 3 | X156: Campaign | Y156: =1000*POWER(2,RC[-22]) -> 32000 | Z156: 235 | AA156: 0 | AB156: =VLOOKUP(RC[-25],Sheet2!R13C1:R19C4,4,0)*VLOOKUP(RC[-24],Sheet2!R7C1:R12C4,4,0) -> 32 | AC156: 0 | AQ156: 1
A157: OBJECT | B157: F50M | C157: 5 | D157: C | E157: srbd | F157: ZZZY | G157: =Sheet1!R[-1]C[25] -> 五.丙|cFF99FF66[宝石]摧心石|r | H157: =Sheet1!R[-1]C[25] -> |cFFFFFF99基础属性|r|n力量:25000|n敏捷:25000|n智力:100000|n|n用于镶嵌到[剑,衣]上.|n镶嵌后不可取下!|n不需要的宝石可以在宠物处熔炼,用于宝石抽奖. | I157: =RC[-2] -> 五.丙|cFF99FF66[宝石]摧心石|r | J157: =RC[-2] -> |cFFFFFF99基础属性|r|n力量:25000|n敏捷:25000|n智力:100000|n|n用于镶嵌到[剑,衣]上.|n镶嵌后不可取下!|n不需要的宝石可以在宠物处熔炼,用于宝石抽奖. | L157: ="ReplaceableTextures\CommandButtons\BTN_gem_"&RC[-9]&".blp" -> ReplaceableTextures\CommandButtons\BTN_gem_5.blp | N157: =VLOOKUP(RC[-10],Sheet2!R7C1:R12C5,5,0) -> model\item\texiao_dijiguangzhu.mdx | W157: 3 | X157: Campaign | Y157: =1000*POWER(2,RC[-22]) -> 32000 | Z157: 235 | AA157: 0 | AB157: =VLOOKUP(RC[-25],Sheet2!R13C1:R19C4,4,0)*VLOOKUP(RC[-24],Sheet2!R7C1:R12C4,4,0) -> 32 | AC157: 0 | AQ157: 1
A158: OBJECT | B158: F50N | C158: 5 | D158: C | E158: srbd | F158: ZZZY | G158: =Sheet1!R[-1]C[25] -> 五.丙|cFF99FF66[宝石]金凤石|r | H158: =Sheet1!R[-1]C[25] -> |n|n|cFFFFFF55附加属性|r(%)|n攻速:30|n|n用于镶嵌到[剑,衣]上.|n镶嵌后不可取下!|n不需要的宝石可以在宠物处熔炼,用于宝石抽奖. | I158: =RC[-2] -> 五.丙|cFF99FF66[宝石]金凤石|r | J158: =RC[-2] -> |n|n|cFFFFFF55附加属性|r(%)|n攻速:30|n|n用于镶嵌到[剑,衣]上.|n镶嵌后不可取下!|n不需要的宝石可以在宠物处熔炼,用于宝石抽奖. | L158: ="ReplaceableTextures\CommandButtons\BTN_gem_"&RC[-9]&".blp" -> ReplaceableTextures\CommandButtons\BTN_gem_5.blp | N158: =VLOOKUP(RC[-10],Sheet2!R7C1:R12C5,5,0) -> model\item\texiao_dijiguangzhu.mdx | W158: 3 | X158: Campaign | Y158: =1000*POWER(2,RC[-22]) -> 32000 | Z158: 235 | AA158: 0 | AB158: =VLOOKUP(RC[-25],Sheet2!R13C1:R19C4,4,0)*VLOOKUP(RC[-24],Sheet2!R7C1:R12C4,4,0) -> 32 | AC158: 0 | AQ158: 1
A159: OBJECT | B159: F50O | C159: 5 | D159: B | E159: srbd | F159: ZZZY | G159: =Sheet1!R[-1]C[25] -> 五.乙|cFF1BE6B8[宝石]量天神木|r | H159: =Sheet1!R[-1]C[25] -> |cFFFFFF99基础属性|r|n力量:125000|n护甲:150|n伤害增幅:4|n|n用于镶嵌到[剑,衣]上.|n镶嵌后不可取下!|n不需要的宝石可以在宠物处熔炼,用于宝石抽奖. | I159: =RC[-2] -> 五.乙|cFF1BE6B8[宝石]量天神木|r | J159: =RC[-2] -> |cFFFFFF99基础属性|r|n力量:125000|n护甲:150|n伤害增幅:4|n|n用于镶嵌到[剑,衣]上.|n镶嵌后不可取下!|n不需要的宝石可以在宠物处熔炼,用于宝石抽奖. | L159: ="ReplaceableTextures\CommandButtons\BTN_gem_"&RC[-9]&".blp" -> ReplaceableTextures\CommandButtons\BTN_gem_5.blp | N159: =VLOOKUP(RC[-10],Sheet2!R7C1:R12C5,5,0) -> model\item\texiao_zhongjiguangzhu.mdx | W159: 3 | X159: Campaign | Y159: =1000*POWER(2,RC[-22]) -> 32000 | Z159: 235 | AA159: 0 | AB159: =VLOOKUP(RC[-25],Sheet2!R13C1:R19C4,4,0)*VLOOKUP(RC[-24],Sheet2!R7C1:R12C4,4,0) -> 48 | AC159: 0 | AQ159: 1
A160: OBJECT | B160: F50P | C160: 5 | D160: B | E160: srbd | F160: ZZZY | G160: =Sheet1!R[-1]C[25] -> 五.乙|cFF1BE6B8[宝石]霓光软玉|r | H160: =Sheet1!R[-1]C[25] -> |cFFFFFF99基础属性|r|n攻击:300000|n护甲:150|n伤害增幅:4|n|n用于镶嵌到[剑,衣]上.|n镶嵌后不可取下!|n不需要的宝石可以在宠物处熔炼,用于宝石抽奖. | I160: =RC[-2] -> 五.乙|cFF1BE6B8[宝石]霓光软玉|r | J160: =RC[-2] -> |cFFFFFF99基础属性|r|n攻击:300000|n护甲:150|n伤害增幅:4|n|n用于镶嵌到[剑,衣]上.|n镶嵌后不可取下!|n不需要的宝石可以在宠物处熔炼,用于宝石抽奖. | L160: ="ReplaceableTextures\CommandButtons\BTN_gem_"&RC[-9]&".blp" -> ReplaceableTextures\CommandButtons\BTN_gem_5.blp | N160: =VLOOKUP(RC[-10],Sheet2!R7C1:R12C5,5,0) -> model\item\texiao_zhongjiguangzhu.mdx | W160: 3 | X160: Campaign | Y160: =1000*POWER(2,RC[-22]) -> 32000 | Z160: 235 | AA160: 0 | AB160: =VLOOKUP(RC[-25],Sheet2!R13C1:R19C4,4,0)*VLOOKUP(RC[-24],Sheet2!R7C1:R12C4,4,0) -> 48 | AC160: 0 | AQ160: 1
A161: OBJECT | B161: F50Q | C161: 5 | D161: B | E161: srbd | F161: ZZZY | G161: =Sheet1!R[-1]C[25] -> 五.乙|cFF1BE6B8[宝石]七绝佛沙|r | H161: =Sheet1!R[-1]C[25] -> |cFFFFFF99基础属性|r|n智力:125000|n护甲:150|n伤害增幅:4|n|n用于镶嵌到[剑,衣]上.|n镶嵌后不可取下!|n不需要的宝石可以在宠物处熔炼,用于宝石抽奖. | I161: =RC[-2] -> 五.乙|cFF1BE6B8[宝石]七绝佛沙|r | J161: =RC[-2] -> |cFFFFFF99基础属性|r|n智力:125000|n护甲:150|n伤害增幅:4|n|n用于镶嵌到[剑,衣]上.|n镶嵌后不可取下!|n不需要的宝石可以在宠物处熔炼,用于宝石抽奖. | L161: ="ReplaceableTextures\CommandButtons\BTN_gem_"&RC[-9]&".blp" -> ReplaceableTextures\CommandButtons\BTN_gem_5.blp | N161: =VLOOKUP(RC[-10],Sheet2!R7C1:R12C5,5,0) -> model\item\texiao_zhongjiguangzhu.mdx | W161: 3 | X161: Campaign | Y161: =1000*POWER(2,RC[-22]) -> 32000 | Z161: 235 | AA161: 0 | AB161: =VLOOKUP(RC[-25],Sheet2!R13C1:R19C4,4,0)*VLOOKUP(RC[-24],Sheet2!R7C1:R12C4,4,0) -> 48 | AC161: 0 | AQ161: 1
A162: OBJECT | B162: F50R | C162: 5 | D162: B | E162: srbd | F162: ZZZY | G162: =Sheet1!R[-1]C[25] -> 五.乙|cFF1BE6B8[宝石]虚空神石|r | H162: =Sheet1!R[-1]C[25] -> |cFFFFFF99基础属性|r|n敏捷:125000|n护甲:150|n伤害增幅:4|n|n用于镶嵌到[剑,衣]上.|n镶嵌后不可取下!|n不需要的宝石可以在宠物处熔炼,用于宝石抽奖. | I162: =RC[-2] -> 五.乙|cFF1BE6B8[宝石]虚空神石|r | J162: =RC[-2] -> |cFFFFFF99基础属性|r|n敏捷:125000|n护甲:150|n伤害增幅:4|n|n用于镶嵌到[剑,衣]上.|n镶嵌后不可取下!|n不需要的宝石可以在宠物处熔炼,用于宝石抽奖. | L162: ="ReplaceableTextures\CommandButtons\BTN_gem_"&RC[-9]&".blp" -> ReplaceableTextures\CommandButtons\BTN_gem_5.blp | N162: =VLOOKUP(RC[-10],Sheet2!R7C1:R12C5,5,0) -> model\item\texiao_zhongjiguangzhu.mdx | W162: 3 | X162: Campaign | Y162: =1000*POWER(2,RC[-22]) -> 32000 | Z162: 235 | AA162: 0 | AB162: =VLOOKUP(RC[-25],Sheet2!R13C1:R19C4,4,0)*VLOOKUP(RC[-24],Sheet2!R7C1:R12C4,4,0) -> 48 | AC162: 0 | AQ162: 1
A163: OBJECT | B163: F50S | C163: 5 | D163: A | E163: srbd | F163: ZZZY | G163: =Sheet1!R[-1]C[25] -> 五.甲|cFF33FF00[宝石]清泉流响|r | H163: =Sheet1!R[-1]C[25] -> |cFFFFFF99基础属性|r|n力量:60000|n敏捷:60000|n智力:60000|n|n|cFFFFFF55附加属性|r(%)|n攻速:12|n伤害增幅:8|n|n用于镶嵌到[剑,衣]上.|n镶嵌后不可取下!|n不需要的宝石可以在宠物处熔炼,用于宝石抽奖. | I163: =RC[-2] -> 五.甲|cFF33FF00[宝石]清泉流响|r | J163: =RC[-2] -> |cFFFFFF99基础属性|r|n力量:60000|n敏捷:60000|n智力:60000|n|n|cFFFFFF55附加属性|r(%)|n攻速:12|n伤害增幅:8|n|n用于镶嵌到[剑,衣]上.|n镶嵌后不可取下!|n不需要的宝石可以在宠物处熔炼,用于宝石抽奖. | L163: ="ReplaceableTextures\CommandButtons\BTN_gem_"&RC[-9]&".blp" -> ReplaceableTextures\CommandButtons\BTN_gem_5.blp | N163: =VLOOKUP(RC[-10],Sheet2!R7C1:R12C5,5,0) -> model\item\texiao_zhongjiguangzhu2.mdx | W163: 3 | X163: Campaign | Y163: =1000*POWER(2,RC[-22]) -> 32000 | Z163: 235 | AA163: 0 | AB163: =VLOOKUP(RC[-25],Sheet2!R13C1:R19C4,4,0)*VLOOKUP(RC[-24],Sheet2!R7C1:R12C4,4,0) -> 64 | AC163: 0 | AQ163: 1
A164: OBJECT | B164: F50T | C164: 5 | D164: A | E164: srbd | F164: ZZZY | G164: =Sheet1!R[-1]C[25] -> 五.甲|cFF33FF00[宝石]氤氲之息|r | H164: =Sheet1!R[-1]C[25] -> |cFFFFFF99基础属性|r|n攻击:400000|n|n|cFFFFFF55附加属性|r(%)|n攻速:12|n伤害增幅:8|n|n用于镶嵌到[剑,衣]上.|n镶嵌后不可取下!|n不需要的宝石可以在宠物处熔炼,用于宝石抽奖. | I164: =RC[-2] -> 五.甲|cFF33FF00[宝石]氤氲之息|r | J164: =RC[-2] -> |cFFFFFF99基础属性|r|n攻击:400000|n|n|cFFFFFF55附加属性|r(%)|n攻速:12|n伤害增幅:8|n|n用于镶嵌到[剑,衣]上.|n镶嵌后不可取下!|n不需要的宝石可以在宠物处熔炼,用于宝石抽奖. | L164: ="ReplaceableTextures\CommandButtons\BTN_gem_"&RC[-9]&".blp" -> ReplaceableTextures\CommandButtons\BTN_gem_5.blp | N164: =VLOOKUP(RC[-10],Sheet2!R7C1:R12C5,5,0) -> model\item\texiao_zhongjiguangzhu2.mdx | W164: 3 | X164: Campaign | Y164: =1000*POWER(2,RC[-22]) -> 32000 | Z164: 235 | AA164: 0 | AB164: =VLOOKUP(RC[-25],Sheet2!R13C1:R19C4,4,0)*VLOOKUP(RC[-24],Sheet2!R7C1:R12C4,4,0) -> 64 | AC164: 0 | AQ164: 1
A165: OBJECT | B165: F50U | C165: 5 | D165: S | E165: srbd | F165: ZZZY | G165: =Sheet1!R[-1]C[25] -> 五.绝|cFFFF9933[宝石]忆古昔 - 守心|r | H165: =Sheet1!R[-1]C[25] -> |cFFFFFF99基础属性|r|n血量:1500000|n护甲:900|n|n|cFFFFFF55附加属性|r(%)|n攻击吸血:2|n伤害增幅:8|n|n用于镶嵌到[剑,衣]上.|n镶嵌后不可取下!|n不需要的宝石可以在宠物处熔炼,用于宝石抽奖. | I165: =RC[-2] -> 五.绝|cFFFF9933[宝石]忆古昔 - 守心|r | J165: =RC[-2] -> |cFFFFFF99基础属性|r|n血量:1500000|n护甲:900|n|n|cFFFFFF55附加属性|r(%)|n攻击吸血:2|n伤害增幅:8|n|n用于镶嵌到[剑,衣]上.|n镶嵌后不可取下!|n不需要的宝石可以在宠物处熔炼,用于宝石抽奖. | L165: ="ReplaceableTextures\CommandButtons\BTN_gem_"&RC[-9]&".blp" -> ReplaceableTextures\CommandButtons\BTN_gem_5.blp | N165: =VLOOKUP(RC[-10],Sheet2!R7C1:R12C5,5,0) -> model\item\texiao_gaojiguangzhu.mdx | W165: 3 | X165: Campaign | Y165: =1000*POWER(2,RC[-22]) -> 32000 | Z165: 235 | AA165: 0 | AB165: =VLOOKUP(RC[-25],Sheet2!R13C1:R19C4,4,0)*VLOOKUP(RC[-24],Sheet2!R7C1:R12C4,4,0) -> 80 | AC165: 0 | AQ165: 1
A166: OBJECT | B166: F50V | C166: 5 | D166: S | E166: srbd | F166: ZZZY | G166: =Sheet1!R[-1]C[25] -> 五.绝|cFFFF9933[宝石]忆古昔 - 克己|r | H166: =Sheet1!R[-1]C[25] -> |cFFFFFF99基础属性|r|n攻击:125000|n|n|cFFFFFF55附加属性|r(%)|n暴击概率:10|n暴击伤害:40|n伤害增幅:8|n|n用于镶嵌到[剑,衣]上.|n镶嵌后不可取下!|n不需要的宝石可以在宠物处熔炼,用于宝石抽奖. | I166: =RC[-2] -> 五.绝|cFFFF9933[宝石]忆古昔 - 克己|r | J166: =RC[-2] -> |cFFFFFF99基础属性|r|n攻击:125000|n|n|cFFFFFF55附加属性|r(%)|n暴击概率:10|n暴击伤害:40|n伤害增幅:8|n|n用于镶嵌到[剑,衣]上.|n镶嵌后不可取下!|n不需要的宝石可以在宠物处熔炼,用于宝石抽奖. | L166: ="ReplaceableTextures\CommandButtons\BTN_gem_"&RC[-9]&".blp" -> ReplaceableTextures\CommandButtons\BTN_gem_5.blp | N166: =VLOOKUP(RC[-10],Sheet2!R7C1:R12C5,5,0) -> model\item\texiao_gaojiguangzhu.mdx | W166: 3 | X166: Campaign | Y166: =1000*POWER(2,RC[-22]) -> 32000 | Z166: 235 | AA166: 0 | AB166: =VLOOKUP(RC[-25],Sheet2!R13C1:R19C4,4,0)*VLOOKUP(RC[-24],Sheet2!R7C1:R12C4,4,0) -> 80 | AC166: 0 | AQ166: 1
A167: OBJECT | B167: F50W | C167: 5 | D167: X | E167: srbd | F167: ZZZY | G167: =Sheet1!R[-1]C[25] -> 五.神|Cffff0000[宝石]上古遗物 - 制人|r | H167: =Sheet1!R[-1]C[25] -> |cFFFFFF99基础属性|r|n血量:3000000|n护甲:1200|n|n|cFFFFFF55附加属性|r(%)|n暴击伤害:40|n伤害增幅:16|n|n用于镶嵌到[剑,衣]上.|n镶嵌后不可取下!|n不需要的宝石可以在宠物处熔炼,用于宝石抽奖. | I167: =RC[-2] -> 五.神|Cffff0000[宝石]上古遗物 - 制人|r | J167: =RC[-2] -> |cFFFFFF99基础属性|r|n血量:3000000|n护甲:1200|n|n|cFFFFFF55附加属性|r(%)|n暴击伤害:40|n伤害增幅:16|n|n用于镶嵌到[剑,衣]上.|n镶嵌后不可取下!|n不需要的宝石可以在宠物处熔炼,用于宝石抽奖. | L167: ="ReplaceableTextures\CommandButtons\BTN_gem_"&RC[-9]&".blp" -> ReplaceableTextures\CommandButtons\BTN_gem_5.blp | N167: =VLOOKUP(RC[-10],Sheet2!R7C1:R12C5,5,0) -> model\item\texiao_gaojiguangzhu.mdx | W167: 3 | X167: Campaign | Y167: =1000*POWER(2,RC[-22]) -> 32000 | Z167: 235 | AA167: 0 | AB167: =VLOOKUP(RC[-25],Sheet2!R13C1:R19C4,4,0)*VLOOKUP(RC[-24],Sheet2!R7C1:R12C4,4,0) -> 96 | AC167: 0 | AQ167: 1
A168: COMMENT | B168: F600 | C168: 6 | D168: D | E168: srbd | F168: ZZZY | G168: =Sheet1!R[-1]C[25] -> 六.丁|cFF999999[宝石]五灵|r | H168: =Sheet1!R[-1]C[25] -> |n|n用于镶嵌到[剑,衣]上.|n镶嵌后不可取下!|n不需要的宝石可以在宠物处熔炼,用于宝石抽奖. | I168: =RC[-2] -> 六.丁|cFF999999[宝石]五灵|r | J168: =RC[-2] -> |n|n用于镶嵌到[剑,衣]上.|n镶嵌后不可取下!|n不需要的宝石可以在宠物处熔炼,用于宝石抽奖. | L168: ="ReplaceableTextures\CommandButtons\BTN_gem_"&RC[-9]&".blp" -> ReplaceableTextures\CommandButtons\BTN_gem_6.blp | N168: =VLOOKUP(RC[-10],Sheet2!R7C1:R12C5,5,0) -> model\item\texiao_dijiguangzhu.mdx | W168: 3 | X168: Campaign | Y168: =1000*POWER(2,RC[-22]) -> 64000 | Z168: 235 | AA168: 0 | AB168: =VLOOKUP(RC[-25],Sheet2!R13C1:R19C4,4,0)*VLOOKUP(RC[-24],Sheet2!R7C1:R12C4,4,0) -> 22 | AC168: 0 | AQ168: 1
A169: COMMENT | B169: F601 | C169: 6 | D169: D | E169: srbd | F169: ZZZY | G169: =Sheet1!R[-1]C[25] -> 六.丁|cFF999999[宝石]邪月|r | H169: =Sheet1!R[-1]C[25] -> |n|n用于镶嵌到[剑,衣]上.|n镶嵌后不可取下!|n不需要的宝石可以在宠物处熔炼,用于宝石抽奖. | I169: =RC[-2] -> 六.丁|cFF999999[宝石]邪月|r | J169: =RC[-2] -> |n|n用于镶嵌到[剑,衣]上.|n镶嵌后不可取下!|n不需要的宝石可以在宠物处熔炼,用于宝石抽奖. | L169: ="ReplaceableTextures\CommandButtons\BTN_gem_"&RC[-9]&".blp" -> ReplaceableTextures\CommandButtons\BTN_gem_6.blp | N169: =VLOOKUP(RC[-10],Sheet2!R7C1:R12C5,5,0) -> model\item\texiao_dijiguangzhu.mdx | W169: 3 | X169: Campaign | Y169: =1000*POWER(2,RC[-22]) -> 64000 | Z169: 235 | AA169: 0 | AB169: =VLOOKUP(RC[-25],Sheet2!R13C1:R19C4,4,0)*VLOOKUP(RC[-24],Sheet2!R7C1:R12C4,4,0) -> 22 | AC169: 0 | AQ169: 1
A170: COMMENT | B170: F602 | C170: 6 | D170: D | E170: srbd | F170: ZZZY | G170: =Sheet1!R[-1]C[25] -> 六.丁|cFF999999[宝石]枯禅|r | H170: =Sheet1!R[-1]C[25] -> |n|n用于镶嵌到[剑,衣]上.|n镶嵌后不可取下!|n不需要的宝石可以在宠物处熔炼,用于宝石抽奖. | I170: =RC[-2] -> 六.丁|cFF999999[宝石]枯禅|r | J170: =RC[-2] -> |n|n用于镶嵌到[剑,衣]上.|n镶嵌后不可取下!|n不需要的宝石可以在宠物处熔炼,用于宝石抽奖. | L170: ="ReplaceableTextures\CommandButtons\BTN_gem_"&RC[-9]&".blp" -> ReplaceableTextures\CommandButtons\BTN_gem_6.blp | N170: =VLOOKUP(RC[-10],Sheet2!R7C1:R12C5,5,0) -> model\item\texiao_dijiguangzhu.mdx | W170: 3 | X170: Campaign | Y170: =1000*POWER(2,RC[-22]) -> 64000 | Z170: 235 | AA170: 0 | AB170: =VLOOKUP(RC[-25],Sheet2!R13C1:R19C4,4,0)*VLOOKUP(RC[-24],Sheet2!R7C1:R12C4,4,0) -> 22 | AC170: 0 | AQ170: 1
A171: COMMENT | B171: F603 | C171: 6 | D171: D | E171: srbd | F171: ZZZY | G171: =Sheet1!R[-1]C[25] -> 六.丁|cFF999999[宝石]千红|r | H171: =Sheet1!R[-1]C[25] -> |n|n用于镶嵌到[剑,衣]上.|n镶嵌后不可取下!|n不需要的宝石可以在宠物处熔炼,用于宝石抽奖. | I171: =RC[-2] -> 六.丁|cFF999999[宝石]千红|r | J171: =RC[-2] -> |n|n用于镶嵌到[剑,衣]上.|n镶嵌后不可取下!|n不需要的宝石可以在宠物处熔炼,用于宝石抽奖. | L171: ="ReplaceableTextures\CommandButtons\BTN_gem_"&RC[-9]&".blp" -> ReplaceableTextures\CommandButtons\BTN_gem_6.blp | N171: =VLOOKUP(RC[-10],Sheet2!R7C1:R12C5,5,0) -> model\item\texiao_dijiguangzhu.mdx | W171: 3 | X171: Campaign | Y171: =1000*POWER(2,RC[-22]) -> 64000 | Z171: 235 | AA171: 0 | AB171: =VLOOKUP(RC[-25],Sheet2!R13C1:R19C4,4,0)*VLOOKUP(RC[-24],Sheet2!R7C1:R12C4,4,0) -> 22 | AC171: 0 | AQ171: 1
A172: COMMENT | B172: F604 | C172: 6 | D172: D | E172: srbd | F172: ZZZY | G172: =Sheet1!R[-1]C[25] -> 六.丁|cFF999999[宝石]照影|r | H172: =Sheet1!R[-1]C[25] -> |n|n用于镶嵌到[剑,衣]上.|n镶嵌后不可取下!|n不需要的宝石可以在宠物处熔炼,用于宝石抽奖. | I172: =RC[-2] -> 六.丁|cFF999999[宝石]照影|r | J172: =RC[-2] -> |n|n用于镶嵌到[剑,衣]上.|n镶嵌后不可取下!|n不需要的宝石可以在宠物处熔炼,用于宝石抽奖. | L172: ="ReplaceableTextures\CommandButtons\BTN_gem_"&RC[-9]&".blp" -> ReplaceableTextures\CommandButtons\BTN_gem_6.blp | N172: =VLOOKUP(RC[-10],Sheet2!R7C1:R12C5,5,0) -> model\item\texiao_dijiguangzhu.mdx | W172: 3 | X172: Campaign | Y172: =1000*POWER(2,RC[-22]) -> 64000 | Z172: 235 | AA172: 0 | AB172: =VLOOKUP(RC[-25],Sheet2!R13C1:R19C4,4,0)*VLOOKUP(RC[-24],Sheet2!R7C1:R12C4,4,0) -> 22 | AC172: 0 | AQ172: 1
A173: COMMENT | B173: F605 | C173: 6 | D173: D | E173: srbd | F173: ZZZY | G173: =Sheet1!R[-1]C[25] -> 六.丁|cFF999999[宝石]追魂|r | H173: =Sheet1!R[-1]C[25] -> |n|n用于镶嵌到[剑,衣]上.|n镶嵌后不可取下!|n不需要的宝石可以在宠物处熔炼,用于宝石抽奖. | I173: =RC[-2] -> 六.丁|cFF999999[宝石]追魂|r | J173: =RC[-2] -> |n|n用于镶嵌到[剑,衣]上.|n镶嵌后不可取下!|n不需要的宝石可以在宠物处熔炼,用于宝石抽奖. | L173: ="ReplaceableTextures\CommandButtons\BTN_gem_"&RC[-9]&".blp" -> ReplaceableTextures\CommandButtons\BTN_gem_6.blp | N173: =VLOOKUP(RC[-10],Sheet2!R7C1:R12C5,5,0) -> model\item\texiao_dijiguangzhu.mdx | W173: 3 | X173: Campaign | Y173: =1000*POWER(2,RC[-22]) -> 64000 | Z173: 235 | AA173: 0 | AB173: =VLOOKUP(RC[-25],Sheet2!R13C1:R19C4,4,0)*VLOOKUP(RC[-24],Sheet2!R7C1:R12C4,4,0) -> 22 | AC173: 0 | AQ173: 1
A174: COMMENT | B174: F606 | C174: 6 | D174: D | E174: srbd | F174: ZZZY | G174: =Sheet1!R[-1]C[25] -> 六.丁|cFF999999[宝石]极光|r | H174: =Sheet1!R[-1]C[25] -> |n|n用于镶嵌到[剑,衣]上.|n镶嵌后不可取下!|n不需要的宝石可以在宠物处熔炼,用于宝石抽奖. | I174: =RC[-2] -> 六.丁|cFF999999[宝石]极光|r | J174: =RC[-2] -> |n|n用于镶嵌到[剑,衣]上.|n镶嵌后不可取下!|n不需要的宝石可以在宠物处熔炼,用于宝石抽奖. | L174: ="ReplaceableTextures\CommandButtons\BTN_gem_"&RC[-9]&".blp" -> ReplaceableTextures\CommandButtons\BTN_gem_6.blp | N174: =VLOOKUP(RC[-10],Sheet2!R7C1:R12C5,5,0) -> model\item\texiao_dijiguangzhu.mdx | W174: 3 | X174: Campaign | Y174: =1000*POWER(2,RC[-22]) -> 64000 | Z174: 235 | AA174: 0 | AB174: =VLOOKUP(RC[-25],Sheet2!R13C1:R19C4,4,0)*VLOOKUP(RC[-24],Sheet2!R7C1:R12C4,4,0) -> 22 | AC174: 0 | AQ174: 1
A175: COMMENT | B175: F607 | C175: 6 | D175: D | E175: srbd | F175: ZZZY | G175: =Sheet1!R[-1]C[25] -> 六.丁|cFF999999[宝石]断情|r | H175: =Sheet1!R[-1]C[25] -> |n|n用于镶嵌到[剑,衣]上.|n镶嵌后不可取下!|n不需要的宝石可以在宠物处熔炼,用于宝石抽奖. | I175: =RC[-2] -> 六.丁|cFF999999[宝石]断情|r | J175: =RC[-2] -> |n|n用于镶嵌到[剑,衣]上.|n镶嵌后不可取下!|n不需要的宝石可以在宠物处熔炼,用于宝石抽奖. | L175: ="ReplaceableTextures\CommandButtons\BTN_gem_"&RC[-9]&".blp" -> ReplaceableTextures\CommandButtons\BTN_gem_6.blp | N175: =VLOOKUP(RC[-10],Sheet2!R7C1:R12C5,5,0) -> model\item\texiao_dijiguangzhu.mdx | W175: 3 | X175: Campaign | Y175: =1000*POWER(2,RC[-22]) -> 64000 | Z175: 235 | AA175: 0 | AB175: =VLOOKUP(RC[-25],Sheet2!R13C1:R19C4,4,0)*VLOOKUP(RC[-24],Sheet2!R7C1:R12C4,4,0) -> 22 | AC175: 0 | AQ175: 1
A176: COMMENT | B176: F608 | C176: 6 | D176: D | E176: srbd | F176: ZZZY | G176: =Sheet1!R[-1]C[25] -> 六.丁|cFF999999[宝石]碎骨|r | H176: =Sheet1!R[-1]C[25] -> |n|n用于镶嵌到[剑,衣]上.|n镶嵌后不可取下!|n不需要的宝石可以在宠物处熔炼,用于宝石抽奖. | I176: =RC[-2] -> 六.丁|cFF999999[宝石]碎骨|r | J176: =RC[-2] -> |n|n用于镶嵌到[剑,衣]上.|n镶嵌后不可取下!|n不需要的宝石可以在宠物处熔炼,用于宝石抽奖. | L176: ="ReplaceableTextures\CommandButtons\BTN_gem_"&RC[-9]&".blp" -> ReplaceableTextures\CommandButtons\BTN_gem_6.blp | N176: =VLOOKUP(RC[-10],Sheet2!R7C1:R12C5,5,0) -> model\item\texiao_dijiguangzhu.mdx | W176: 3 | X176: Campaign | Y176: =1000*POWER(2,RC[-22]) -> 64000 | Z176: 235 | AA176: 0 | AB176: =VLOOKUP(RC[-25],Sheet2!R13C1:R19C4,4,0)*VLOOKUP(RC[-24],Sheet2!R7C1:R12C4,4,0) -> 22 | AC176: 0 | AQ176: 1
A177: COMMENT | B177: F609 | C177: 6 | D177: D | E177: srbd | F177: ZZZY | G177: =Sheet1!R[-1]C[25] -> 六.丁|cFF999999[宝石]鬼哭|r | H177: =Sheet1!R[-1]C[25] -> |n|n用于镶嵌到[剑,衣]上.|n镶嵌后不可取下!|n不需要的宝石可以在宠物处熔炼,用于宝石抽奖. | I177: =RC[-2] -> 六.丁|cFF999999[宝石]鬼哭|r | J177: =RC[-2] -> |n|n用于镶嵌到[剑,衣]上.|n镶嵌后不可取下!|n不需要的宝石可以在宠物处熔炼,用于宝石抽奖. | L177: ="ReplaceableTextures\CommandButtons\BTN_gem_"&RC[-9]&".blp" -> ReplaceableTextures\CommandButtons\BTN_gem_6.blp | N177: =VLOOKUP(RC[-10],Sheet2!R7C1:R12C5,5,0) -> model\item\texiao_dijiguangzhu.mdx | W177: 3 | X177: Campaign | Y177: =1000*POWER(2,RC[-22]) -> 64000 | Z177: 235 | AA177: 0 | AB177: =VLOOKUP(RC[-25],Sheet2!R13C1:R19C4,4,0)*VLOOKUP(RC[-24],Sheet2!R7C1:R12C4,4,0) -> 22 | AC177: 0 | AQ177: 1
A178: COMMENT | B178: F60A | C178: 6 | D178: D | E178: srbd | F178: ZZZY | G178: =Sheet1!R[-1]C[25] -> 六.丁|cFF999999[宝石]丹心|r | H178: =Sheet1!R[-1]C[25] -> |n|n用于镶嵌到[剑,衣]上.|n镶嵌后不可取下!|n不需要的宝石可以在宠物处熔炼,用于宝石抽奖. | I178: =RC[-2] -> 六.丁|cFF999999[宝石]丹心|r | J178: =RC[-2] -> |n|n用于镶嵌到[剑,衣]上.|n镶嵌后不可取下!|n不需要的宝石可以在宠物处熔炼,用于宝石抽奖. | L178: ="ReplaceableTextures\CommandButtons\BTN_gem_"&RC[-9]&".blp" -> ReplaceableTextures\CommandButtons\BTN_gem_6.blp | N178: =VLOOKUP(RC[-10],Sheet2!R7C1:R12C5,5,0) -> model\item\texiao_dijiguangzhu.mdx | W178: 3 | X178: Campaign | Y178: =1000*POWER(2,RC[-22]) -> 64000 | Z178: 235 | AA178: 0 | AB178: =VLOOKUP(RC[-25],Sheet2!R13C1:R19C4,4,0)*VLOOKUP(RC[-24],Sheet2!R7C1:R12C4,4,0) -> 22 | AC178: 0 | AQ178: 1
A179: COMMENT | B179: F60B | C179: 6 | D179: D | E179: srbd | F179: ZZZY | G179: =Sheet1!R[-1]C[25] -> 六.丁|cFF999999[宝石]血鸦|r | H179: =Sheet1!R[-1]C[25] -> |n|n用于镶嵌到[剑,衣]上.|n镶嵌后不可取下!|n不需要的宝石可以在宠物处熔炼,用于宝石抽奖. | I179: =RC[-2] -> 六.丁|cFF999999[宝石]血鸦|r | J179: =RC[-2] -> |n|n用于镶嵌到[剑,衣]上.|n镶嵌后不可取下!|n不需要的宝石可以在宠物处熔炼,用于宝石抽奖. | L179: ="ReplaceableTextures\CommandButtons\BTN_gem_"&RC[-9]&".blp" -> ReplaceableTextures\CommandButtons\BTN_gem_6.blp | N179: =VLOOKUP(RC[-10],Sheet2!R7C1:R12C5,5,0) -> model\item\texiao_dijiguangzhu.mdx | W179: 3 | X179: Campaign | Y179: =1000*POWER(2,RC[-22]) -> 64000 | Z179: 235 | AA179: 0 | AB179: =VLOOKUP(RC[-25],Sheet2!R13C1:R19C4,4,0)*VLOOKUP(RC[-24],Sheet2!R7C1:R12C4,4,0) -> 22 | AC179: 0 | AQ179: 1
A180: COMMENT | B180: F60C | C180: 6 | D180: D | E180: srbd | F180: ZZZY | G180: =Sheet1!R[-1]C[25] -> 六.丁|cFF999999[宝石]荡旋|r | H180: =Sheet1!R[-1]C[25] -> |n|n用于镶嵌到[剑,衣]上.|n镶嵌后不可取下!|n不需要的宝石可以在宠物处熔炼,用于宝石抽奖. | I180: =RC[-2] -> 六.丁|cFF999999[宝石]荡旋|r | J180: =RC[-2] -> |n|n用于镶嵌到[剑,衣]上.|n镶嵌后不可取下!|n不需要的宝石可以在宠物处熔炼,用于宝石抽奖. | L180: ="ReplaceableTextures\CommandButtons\BTN_gem_"&RC[-9]&".blp" -> ReplaceableTextures\CommandButtons\BTN_gem_6.blp | N180: =VLOOKUP(RC[-10],Sheet2!R7C1:R12C5,5,0) -> model\item\texiao_dijiguangzhu.mdx | W180: 3 | X180: Campaign | Y180: =1000*POWER(2,RC[-22]) -> 64000 | Z180: 235 | AA180: 0 | AB180: =VLOOKUP(RC[-25],Sheet2!R13C1:R19C4,4,0)*VLOOKUP(RC[-24],Sheet2!R7C1:R12C4,4,0) -> 22 | AC180: 0 | AQ180: 1
A181: COMMENT | B181: F60D | C181: 6 | D181: D | E181: srbd | F181: ZZZY | G181: =Sheet1!R[-1]C[25] -> 六.丁|cFF999999[宝石]极意|r | H181: =Sheet1!R[-1]C[25] -> |n|n用于镶嵌到[剑,衣]上.|n镶嵌后不可取下!|n不需要的宝石可以在宠物处熔炼,用于宝石抽奖. | I181: =RC[-2] -> 六.丁|cFF999999[宝石]极意|r | J181: =RC[-2] -> |n|n用于镶嵌到[剑,衣]上.|n镶嵌后不可取下!|n不需要的宝石可以在宠物处熔炼,用于宝石抽奖. | L181: ="ReplaceableTextures\CommandButtons\BTN_gem_"&RC[-9]&".blp" -> ReplaceableTextures\CommandButtons\BTN_gem_6.blp | N181: =VLOOKUP(RC[-10],Sheet2!R7C1:R12C5,5,0) -> model\item\texiao_dijiguangzhu.mdx | W181: 3 | X181: Campaign | Y181: =1000*POWER(2,RC[-22]) -> 64000 | Z181: 235 | AA181: 0 | AB181: =VLOOKUP(RC[-25],Sheet2!R13C1:R19C4,4,0)*VLOOKUP(RC[-24],Sheet2!R7C1:R12C4,4,0) -> 22 | AC181: 0 | AQ181: 1
A182: COMMENT | B182: F60E | C182: 6 | D182: D | E182: srbd | F182: ZZZY | G182: =Sheet1!R[-1]C[25] -> 六.丁|cFF999999[宝石]迦蓝|r | H182: =Sheet1!R[-1]C[25] -> |n|n用于镶嵌到[剑,衣]上.|n镶嵌后不可取下!|n不需要的宝石可以在宠物处熔炼,用于宝石抽奖. | I182: =RC[-2] -> 六.丁|cFF999999[宝石]迦蓝|r | J182: =RC[-2] -> |n|n用于镶嵌到[剑,衣]上.|n镶嵌后不可取下!|n不需要的宝石可以在宠物处熔炼,用于宝石抽奖. | L182: ="ReplaceableTextures\CommandButtons\BTN_gem_"&RC[-9]&".blp" -> ReplaceableTextures\CommandButtons\BTN_gem_6.blp | N182: =VLOOKUP(RC[-10],Sheet2!R7C1:R12C5,5,0) -> model\item\texiao_dijiguangzhu.mdx | W182: 3 | X182: Campaign | Y182: =1000*POWER(2,RC[-22]) -> 64000 | Z182: 235 | AA182: 0 | AB182: =VLOOKUP(RC[-25],Sheet2!R13C1:R19C4,4,0)*VLOOKUP(RC[-24],Sheet2!R7C1:R12C4,4,0) -> 22 | AC182: 0 | AQ182: 1
A183: COMMENT | B183: F60F | C183: 6 | D183: D | E183: srbd | F183: ZZZY | G183: =Sheet1!R[-1]C[25] -> 六.丁|cFF999999[宝石]灵鹤|r | H183: =Sheet1!R[-1]C[25] -> |n|n用于镶嵌到[剑,衣]上.|n镶嵌后不可取下!|n不需要的宝石可以在宠物处熔炼,用于宝石抽奖. | I183: =RC[-2] -> 六.丁|cFF999999[宝石]灵鹤|r | J183: =RC[-2] -> |n|n用于镶嵌到[剑,衣]上.|n镶嵌后不可取下!|n不需要的宝石可以在宠物处熔炼,用于宝石抽奖. | L183: ="ReplaceableTextures\CommandButtons\BTN_gem_"&RC[-9]&".blp" -> ReplaceableTextures\CommandButtons\BTN_gem_6.blp | N183: =VLOOKUP(RC[-10],Sheet2!R7C1:R12C5,5,0) -> model\item\texiao_dijiguangzhu.mdx | W183: 3 | X183: Campaign | Y183: =1000*POWER(2,RC[-22]) -> 64000 | Z183: 235 | AA183: 0 | AB183: =VLOOKUP(RC[-25],Sheet2!R13C1:R19C4,4,0)*VLOOKUP(RC[-24],Sheet2!R7C1:R12C4,4,0) -> 22 | AC183: 0 | AQ183: 1
A184: OBJECT | B184: F60G | C184: 6 | D184: C | E184: srbd | F184: ZZZY | G184: =Sheet1!R[-1]C[25] -> 六.丙|cFF99FF66[宝石]流云石|r | H184: =Sheet1!R[-1]C[25] -> |cFFFFFF99基础属性|r|n力量:135000|n敏捷:135000|n智力:135000|n|n用于镶嵌到[剑,衣]上.|n镶嵌后不可取下!|n不需要的宝石可以在宠物处熔炼,用于宝石抽奖. | I184: =RC[-2] -> 六.丙|cFF99FF66[宝石]流云石|r | J184: =RC[-2] -> |cFFFFFF99基础属性|r|n力量:135000|n敏捷:135000|n智力:135000|n|n用于镶嵌到[剑,衣]上.|n镶嵌后不可取下!|n不需要的宝石可以在宠物处熔炼,用于宝石抽奖. | L184: ="ReplaceableTextures\CommandButtons\BTN_gem_"&RC[-9]&".blp" -> ReplaceableTextures\CommandButtons\BTN_gem_6.blp | N184: =VLOOKUP(RC[-10],Sheet2!R7C1:R12C5,5,0) -> model\item\texiao_dijiguangzhu.mdx | W184: 3 | X184: Campaign | Y184: =1000*POWER(2,RC[-22]) -> 64000 | Z184: 235 | AA184: 0 | AB184: =VLOOKUP(RC[-25],Sheet2!R13C1:R19C4,4,0)*VLOOKUP(RC[-24],Sheet2!R7C1:R12C4,4,0) -> 44 | AC184: 0 | AQ184: 1
A185: OBJECT | B185: F60H | C185: 6 | D185: C | E185: srbd | F185: ZZZY | G185: =Sheet1!R[-1]C[25] -> 六.丙|cFF99FF66[宝石]苍炎石|r | H185: =Sheet1!R[-1]C[25] -> |cFFFFFF99基础属性|r|n攻击:450000|n|n用于镶嵌到[剑,衣]上.|n镶嵌后不可取下!|n不需要的宝石可以在宠物处熔炼,用于宝石抽奖. | I185: =RC[-2] -> 六.丙|cFF99FF66[宝石]苍炎石|r | J185: =RC[-2] -> |cFFFFFF99基础属性|r|n攻击:450000|n|n用于镶嵌到[剑,衣]上.|n镶嵌后不可取下!|n不需要的宝石可以在宠物处熔炼,用于宝石抽奖. | L185: ="ReplaceableTextures\CommandButtons\BTN_gem_"&RC[-9]&".blp" -> ReplaceableTextures\CommandButtons\BTN_gem_6.blp | N185: =VLOOKUP(RC[-10],Sheet2!R7C1:R12C5,5,0) -> model\item\texiao_dijiguangzhu.mdx | W185: 3 | X185: Campaign | Y185: =1000*POWER(2,RC[-22]) -> 64000 | Z185: 235 | AA185: 0 | AB185: =VLOOKUP(RC[-25],Sheet2!R13C1:R19C4,4,0)*VLOOKUP(RC[-24],Sheet2!R7C1:R12C4,4,0) -> 44 | AC185: 0 | AQ185: 1
A186: OBJECT | B186: F60I | C186: 6 | D186: C | E186: srbd | F186: ZZZY | G186: =Sheet1!R[-1]C[25] -> 六.丙|cFF99FF66[宝石]龙虎石|r | H186: =Sheet1!R[-1]C[25] -> |n|n|cFFFFFF55附加属性|r(%)|n攻击吸血:4|n|n用于镶嵌到[剑,衣]上.|n镶嵌后不可取下!|n不需要的宝石可以在宠物处熔炼,用于宝石抽奖. | I186: =RC[-2] -> 六.丙|cFF99FF66[宝石]龙虎石|r | J186: =RC[-2] -> |n|n|cFFFFFF55附加属性|r(%)|n攻击吸血:4|n|n用于镶嵌到[剑,衣]上.|n镶嵌后不可取下!|n不需要的宝石可以在宠物处熔炼,用于宝石抽奖. | L186: ="ReplaceableTextures\CommandButtons\BTN_gem_"&RC[-9]&".blp" -> ReplaceableTextures\CommandButtons\BTN_gem_6.blp | N186: =VLOOKUP(RC[-10],Sheet2!R7C1:R12C5,5,0) -> model\item\texiao_dijiguangzhu.mdx | W186: 3 | X186: Campaign | Y186: =1000*POWER(2,RC[-22]) -> 64000 | Z186: 235 | AA186: 0 | AB186: =VLOOKUP(RC[-25],Sheet2!R13C1:R19C4,4,0)*VLOOKUP(RC[-24],Sheet2!R7C1:R12C4,4,0) -> 44 | AC186: 0 | AQ186: 1
A187: OBJECT | B187: F60J | C187: 6 | D187: C | E187: srbd | F187: ZZZY | G187: =Sheet1!R[-1]C[25] -> 六.丙|cFF99FF66[宝石]万仞石|r | H187: =Sheet1!R[-1]C[25] -> |cFFFFFF99基础属性|r|n血量:2250000|n护甲:800|n|n用于镶嵌到[剑,衣]上.|n镶嵌后不可取下!|n不需要的宝石可以在宠物处熔炼,用于宝石抽奖. | I187: =RC[-2] -> 六.丙|cFF99FF66[宝石]万仞石|r | J187: =RC[-2] -> |cFFFFFF99基础属性|r|n血量:2250000|n护甲:800|n|n用于镶嵌到[剑,衣]上.|n镶嵌后不可取下!|n不需要的宝石可以在宠物处熔炼,用于宝石抽奖. | L187: ="ReplaceableTextures\CommandButtons\BTN_gem_"&RC[-9]&".blp" -> ReplaceableTextures\CommandButtons\BTN_gem_6.blp | N187: =VLOOKUP(RC[-10],Sheet2!R7C1:R12C5,5,0) -> model\item\texiao_dijiguangzhu.mdx | W187: 3 | X187: Campaign | Y187: =1000*POWER(2,RC[-22]) -> 64000 | Z187: 235 | AA187: 0 | AB187: =VLOOKUP(RC[-25],Sheet2!R13C1:R19C4,4,0)*VLOOKUP(RC[-24],Sheet2!R7C1:R12C4,4,0) -> 44 | AC187: 0 | AQ187: 1
A188: OBJECT | B188: F60K | C188: 6 | D188: C | E188: srbd | F188: ZZZY | G188: =Sheet1!R[-1]C[25] -> 六.丙|cFF99FF66[宝石]无量石|r | H188: =Sheet1!R[-1]C[25] -> |cFFFFFF99基础属性|r|n力量:180000|n敏捷:45000|n智力:45000|n|n用于镶嵌到[剑,衣]上.|n镶嵌后不可取下!|n不需要的宝石可以在宠物处熔炼,用于宝石抽奖. | I188: =RC[-2] -> 六.丙|cFF99FF66[宝石]无量石|r | J188: =RC[-2] -> |cFFFFFF99基础属性|r|n力量:180000|n敏捷:45000|n智力:45000|n|n用于镶嵌到[剑,衣]上.|n镶嵌后不可取下!|n不需要的宝石可以在宠物处熔炼,用于宝石抽奖. | L188: ="ReplaceableTextures\CommandButtons\BTN_gem_"&RC[-9]&".blp" -> ReplaceableTextures\CommandButtons\BTN_gem_6.blp | N188: =VLOOKUP(RC[-10],Sheet2!R7C1:R12C5,5,0) -> model\item\texiao_dijiguangzhu.mdx | W188: 3 | X188: Campaign | Y188: =1000*POWER(2,RC[-22]) -> 64000 | Z188: 235 | AA188: 0 | AB188: =VLOOKUP(RC[-25],Sheet2!R13C1:R19C4,4,0)*VLOOKUP(RC[-24],Sheet2!R7C1:R12C4,4,0) -> 44 | AC188: 0 | AQ188: 1
A189: OBJECT | B189: F60L | C189: 6 | D189: C | E189: srbd | F189: ZZZY | G189: =Sheet1!R[-1]C[25] -> 六.丙|cFF99FF66[宝石]雄狮石|r | H189: =Sheet1!R[-1]C[25] -> |cFFFFFF99基础属性|r|n力量:45000|n敏捷:180000|n智力:45000|n|n用于镶嵌到[剑,衣]上.|n镶嵌后不可取下!|n不需要的宝石可以在宠物处熔炼,用于宝石抽奖. | I189: =RC[-2] -> 六.丙|cFF99FF66[宝石]雄狮石|r | J189: =RC[-2] -> |cFFFFFF99基础属性|r|n力量:45000|n敏捷:180000|n智力:45000|n|n用于镶嵌到[剑,衣]上.|n镶嵌后不可取下!|n不需要的宝石可以在宠物处熔炼,用于宝石抽奖. | L189: ="ReplaceableTextures\CommandButtons\BTN_gem_"&RC[-9]&".blp" -> ReplaceableTextures\CommandButtons\BTN_gem_6.blp | N189: =VLOOKUP(RC[-10],Sheet2!R7C1:R12C5,5,0) -> model\item\texiao_dijiguangzhu.mdx | W189: 3 | X189: Campaign | Y189: =1000*POWER(2,RC[-22]) -> 64000 | Z189: 235 | AA189: 0 | AB189: =VLOOKUP(RC[-25],Sheet2!R13C1:R19C4,4,0)*VLOOKUP(RC[-24],Sheet2!R7C1:R12C4,4,0) -> 44 | AC189: 0 | AQ189: 1
A190: OBJECT | B190: F60M | C190: 6 | D190: C | E190: srbd | F190: ZZZY | G190: =Sheet1!R[-1]C[25] -> 六.丙|cFF99FF66[宝石]孤问石|r | H190: =Sheet1!R[-1]C[25] -> |cFFFFFF99基础属性|r|n力量:45000|n敏捷:45000|n智力:180000|n|n用于镶嵌到[剑,衣]上.|n镶嵌后不可取下!|n不需要的宝石可以在宠物处熔炼,用于宝石抽奖. | I190: =RC[-2] -> 六.丙|cFF99FF66[宝石]孤问石|r | J190: =RC[-2] -> |cFFFFFF99基础属性|r|n力量:45000|n敏捷:45000|n智力:180000|n|n用于镶嵌到[剑,衣]上.|n镶嵌后不可取下!|n不需要的宝石可以在宠物处熔炼,用于宝石抽奖. | L190: ="ReplaceableTextures\CommandButtons\BTN_gem_"&RC[-9]&".blp" -> ReplaceableTextures\CommandButtons\BTN_gem_6.blp | N190: =VLOOKUP(RC[-10],Sheet2!R7C1:R12C5,5,0) -> model\item\texiao_dijiguangzhu.mdx | W190: 3 | X190: Campaign | Y190: =1000*POWER(2,RC[-22]) -> 64000 | Z190: 235 | AA190: 0 | AB190: =VLOOKUP(RC[-25],Sheet2!R13C1:R19C4,4,0)*VLOOKUP(RC[-24],Sheet2!R7C1:R12C4,4,0) -> 44 | AC190: 0 | AQ190: 1
A191: OBJECT | B191: F60N | C191: 6 | D191: C | E191: srbd | F191: ZZZY | G191: =Sheet1!R[-1]C[25] -> 六.丙|cFF99FF66[宝石]罡风石|r | H191: =Sheet1!R[-1]C[25] -> |n|n|cFFFFFF55附加属性|r(%)|n攻速:36|n|n用于镶嵌到[剑,衣]上.|n镶嵌后不可取下!|n不需要的宝石可以在宠物处熔炼,用于宝石抽奖. | I191: =RC[-2] -> 六.丙|cFF99FF66[宝石]罡风石|r | J191: =RC[-2] -> |n|n|cFFFFFF55附加属性|r(%)|n攻速:36|n|n用于镶嵌到[剑,衣]上.|n镶嵌后不可取下!|n不需要的宝石可以在宠物处熔炼,用于宝石抽奖. | L191: ="ReplaceableTextures\CommandButtons\BTN_gem_"&RC[-9]&".blp" -> ReplaceableTextures\CommandButtons\BTN_gem_6.blp | N191: =VLOOKUP(RC[-10],Sheet2!R7C1:R12C5,5,0) -> model\item\texiao_dijiguangzhu.mdx | W191: 3 | X191: Campaign | Y191: =1000*POWER(2,RC[-22]) -> 64000 | Z191: 235 | AA191: 0 | AB191: =VLOOKUP(RC[-25],Sheet2!R13C1:R19C4,4,0)*VLOOKUP(RC[-24],Sheet2!R7C1:R12C4,4,0) -> 44 | AC191: 0 | AQ191: 1
A192: OBJECT | B192: F60O | C192: 6 | D192: B | E192: srbd | F192: ZZZY | G192: =Sheet1!R[-1]C[25] -> 六.乙|cFF1BE6B8[宝石]日月之石|r | H192: =Sheet1!R[-1]C[25] -> |cFFFFFF99基础属性|r|n力量:225000|n护甲:200|n伤害增幅:4|n|n用于镶嵌到[剑,衣]上.|n镶嵌后不可取下!|n不需要的宝石可以在宠物处熔炼,用于宝石抽奖. | I192: =RC[-2] -> 六.乙|cFF1BE6B8[宝石]日月之石|r | J192: =RC[-2] -> |cFFFFFF99基础属性|r|n力量:225000|n护甲:200|n伤害增幅:4|n|n用于镶嵌到[剑,衣]上.|n镶嵌后不可取下!|n不需要的宝石可以在宠物处熔炼,用于宝石抽奖. | L192: ="ReplaceableTextures\CommandButtons\BTN_gem_"&RC[-9]&".blp" -> ReplaceableTextures\CommandButtons\BTN_gem_6.blp | N192: =VLOOKUP(RC[-10],Sheet2!R7C1:R12C5,5,0) -> model\item\texiao_zhongjiguangzhu.mdx | W192: 3 | X192: Campaign | Y192: =1000*POWER(2,RC[-22]) -> 64000 | Z192: 235 | AA192: 0 | AB192: =VLOOKUP(RC[-25],Sheet2!R13C1:R19C4,4,0)*VLOOKUP(RC[-24],Sheet2!R7C1:R12C4,4,0) -> 66 | AC192: 0 | AQ192: 1
A193: OBJECT | B193: F60P | C193: 6 | D193: B | E193: srbd | F193: ZZZY | G193: =Sheet1!R[-1]C[25] -> 六.乙|cFF1BE6B8[宝石]幻光神石|r | H193: =Sheet1!R[-1]C[25] -> |cFFFFFF99基础属性|r|n攻击:540000|n护甲:200|n伤害增幅:4|n|n用于镶嵌到[剑,衣]上.|n镶嵌后不可取下!|n不需要的宝石可以在宠物处熔炼,用于宝石抽奖. | I193: =RC[-2] -> 六.乙|cFF1BE6B8[宝石]幻光神石|r | J193: =RC[-2] -> |cFFFFFF99基础属性|r|n攻击:540000|n护甲:200|n伤害增幅:4|n|n用于镶嵌到[剑,衣]上.|n镶嵌后不可取下!|n不需要的宝石可以在宠物处熔炼,用于宝石抽奖. | L193: ="ReplaceableTextures\CommandButtons\BTN_gem_"&RC[-9]&".blp" -> ReplaceableTextures\CommandButtons\BTN_gem_6.blp | N193: =VLOOKUP(RC[-10],Sheet2!R7C1:R12C5,5,0) -> model\item\texiao_zhongjiguangzhu.mdx | W193: 3 | X193: Campaign | Y193: =1000*POWER(2,RC[-22]) -> 64000 | Z193: 235 | AA193: 0 | AB193: =VLOOKUP(RC[-25],Sheet2!R13C1:R19C4,4,0)*VLOOKUP(RC[-24],Sheet2!R7C1:R12C4,4,0) -> 66 | AC193: 0 | AQ193: 1
A194: OBJECT | B194: F60Q | C194: 6 | D194: B | E194: srbd | F194: ZZZY | G194: =Sheet1!R[-1]C[25] -> 六.乙|cFF1BE6B8[宝石]星尘神石|r | H194: =Sheet1!R[-1]C[25] -> |cFFFFFF99基础属性|r|n智力:225000|n护甲:200|n伤害增幅:4|n|n用于镶嵌到[剑,衣]上.|n镶嵌后不可取下!|n不需要的宝石可以在宠物处熔炼,用于宝石抽奖. | I194: =RC[-2] -> 六.乙|cFF1BE6B8[宝石]星尘神石|r | J194: =RC[-2] -> |cFFFFFF99基础属性|r|n智力:225000|n护甲:200|n伤害增幅:4|n|n用于镶嵌到[剑,衣]上.|n镶嵌后不可取下!|n不需要的宝石可以在宠物处熔炼,用于宝石抽奖. | L194: ="ReplaceableTextures\CommandButtons\BTN_gem_"&RC[-9]&".blp" -> ReplaceableTextures\CommandButtons\BTN_gem_6.blp | N194: =VLOOKUP(RC[-10],Sheet2!R7C1:R12C5,5,0) -> model\item\texiao_zhongjiguangzhu.mdx | W194: 3 | X194: Campaign | Y194: =1000*POWER(2,RC[-22]) -> 64000 | Z194: 235 | AA194: 0 | AB194: =VLOOKUP(RC[-25],Sheet2!R13C1:R19C4,4,0)*VLOOKUP(RC[-24],Sheet2!R7C1:R12C4,4,0) -> 66 | AC194: 0 | AQ194: 1
A195: OBJECT | B195: F60R | C195: 6 | D195: B | E195: srbd | F195: ZZZY | G195: =Sheet1!R[-1]C[25] -> 六.乙|cFF1BE6B8[宝石]玄灵魔石|r | H195: =Sheet1!R[-1]C[25] -> |cFFFFFF99基础属性|r|n敏捷:225000|n护甲:200|n伤害增幅:4|n|n用于镶嵌到[剑,衣]上.|n镶嵌后不可取下!|n不需要的宝石可以在宠物处熔炼,用于宝石抽奖. | I195: =RC[-2] -> 六.乙|cFF1BE6B8[宝石]玄灵魔石|r | J195: =RC[-2] -> |cFFFFFF99基础属性|r|n敏捷:225000|n护甲:200|n伤害增幅:4|n|n用于镶嵌到[剑,衣]上.|n镶嵌后不可取下!|n不需要的宝石可以在宠物处熔炼,用于宝石抽奖. | L195: ="ReplaceableTextures\CommandButtons\BTN_gem_"&RC[-9]&".blp" -> ReplaceableTextures\CommandButtons\BTN_gem_6.blp | N195: =VLOOKUP(RC[-10],Sheet2!R7C1:R12C5,5,0) -> model\item\texiao_zhongjiguangzhu.mdx | W195: 3 | X195: Campaign | Y195: =1000*POWER(2,RC[-22]) -> 64000 | Z195: 235 | AA195: 0 | AB195: =VLOOKUP(RC[-25],Sheet2!R13C1:R19C4,4,0)*VLOOKUP(RC[-24],Sheet2!R7C1:R12C4,4,0) -> 66 | AC195: 0 | AQ195: 1
A196: OBJECT | B196: F60S | C196: 6 | D196: A | E196: srbd | F196: ZZZY | G196: =Sheet1!R[-1]C[25] -> 六.甲|cFF33FF00[宝石]无限之光|r | H196: =Sheet1!R[-1]C[25] -> |cFFFFFF99基础属性|r|n力量:108000|n敏捷:108000|n智力:108000|n|n|cFFFFFF55附加属性|r(%)|n攻速:14|n伤害增幅:9|n|n用于镶嵌到[剑,衣]上.|n镶嵌后不可取下!|n不需要的宝石可以在宠物处熔炼,用于宝石抽奖. | I196: =RC[-2] -> 六.甲|cFF33FF00[宝石]无限之光|r | J196: =RC[-2] -> |cFFFFFF99基础属性|r|n力量:108000|n敏捷:108000|n智力:108000|n|n|cFFFFFF55附加属性|r(%)|n攻速:14|n伤害增幅:9|n|n用于镶嵌到[剑,衣]上.|n镶嵌后不可取下!|n不需要的宝石可以在宠物处熔炼,用于宝石抽奖. | L196: ="ReplaceableTextures\CommandButtons\BTN_gem_"&RC[-9]&".blp" -> ReplaceableTextures\CommandButtons\BTN_gem_6.blp | N196: =VLOOKUP(RC[-10],Sheet2!R7C1:R12C5,5,0) -> model\item\texiao_zhongjiguangzhu2.mdx | W196: 3 | X196: Campaign | Y196: =1000*POWER(2,RC[-22]) -> 64000 | Z196: 235 | AA196: 0 | AB196: =VLOOKUP(RC[-25],Sheet2!R13C1:R19C4,4,0)*VLOOKUP(RC[-24],Sheet2!R7C1:R12C4,4,0) -> 88 | AC196: 0 | AQ196: 1
A197: OBJECT | B197: F60T | C197: 6 | D197: A | E197: srbd | F197: ZZZY | G197: =Sheet1!R[-1]C[25] -> 六.甲|cFF33FF00[宝石]无瑕纯白|r | H197: =Sheet1!R[-1]C[25] -> |cFFFFFF99基础属性|r|n攻击:720000|n|n|cFFFFFF55附加属性|r(%)|n攻速:14|n伤害增幅:9|n|n用于镶嵌到[剑,衣]上.|n镶嵌后不可取下!|n不需要的宝石可以在宠物处熔炼,用于宝石抽奖. | I197: =RC[-2] -> 六.甲|cFF33FF00[宝石]无瑕纯白|r | J197: =RC[-2] -> |cFFFFFF99基础属性|r|n攻击:720000|n|n|cFFFFFF55附加属性|r(%)|n攻速:14|n伤害增幅:9|n|n用于镶嵌到[剑,衣]上.|n镶嵌后不可取下!|n不需要的宝石可以在宠物处熔炼,用于宝石抽奖. | L197: ="ReplaceableTextures\CommandButtons\BTN_gem_"&RC[-9]&".blp" -> ReplaceableTextures\CommandButtons\BTN_gem_6.blp | N197: =VLOOKUP(RC[-10],Sheet2!R7C1:R12C5,5,0) -> model\item\texiao_zhongjiguangzhu2.mdx | W197: 3 | X197: Campaign | Y197: =1000*POWER(2,RC[-22]) -> 64000 | Z197: 235 | AA197: 0 | AB197: =VLOOKUP(RC[-25],Sheet2!R13C1:R19C4,4,0)*VLOOKUP(RC[-24],Sheet2!R7C1:R12C4,4,0) -> 88 | AC197: 0 | AQ197: 1
A198: OBJECT | B198: F60U | C198: 6 | D198: S | E198: srbd | F198: ZZZY | G198: =Sheet1!R[-1]C[25] -> 六.绝|cFFFF9933[宝石]仙道 - 至鸿|r | H198: =Sheet1!R[-1]C[25] -> |cFFFFFF99基础属性|r|n血量:2700000|n护甲:1200|n|n|cFFFFFF55附加属性|r(%)|n攻击吸血:2|n伤害增幅:9|n|n用于镶嵌到[剑,衣]上.|n镶嵌后不可取下!|n不需要的宝石可以在宠物处熔炼,用于宝石抽奖. | I198: =RC[-2] -> 六.绝|cFFFF9933[宝石]仙道 - 至鸿|r | J198: =RC[-2] -> |cFFFFFF99基础属性|r|n血量:2700000|n护甲:1200|n|n|cFFFFFF55附加属性|r(%)|n攻击吸血:2|n伤害增幅:9|n|n用于镶嵌到[剑,衣]上.|n镶嵌后不可取下!|n不需要的宝石可以在宠物处熔炼,用于宝石抽奖. | L198: ="ReplaceableTextures\CommandButtons\BTN_gem_"&RC[-9]&".blp" -> ReplaceableTextures\CommandButtons\BTN_gem_6.blp | N198: =VLOOKUP(RC[-10],Sheet2!R7C1:R12C5,5,0) -> model\item\texiao_gaojiguangzhu.mdx | W198: 3 | X198: Campaign | Y198: =1000*POWER(2,RC[-22]) -> 64000 | Z198: 235 | AA198: 0 | AB198: =VLOOKUP(RC[-25],Sheet2!R13C1:R19C4,4,0)*VLOOKUP(RC[-24],Sheet2!R7C1:R12C4,4,0) -> 110 | AC198: 0 | AQ198: 1
A199: OBJECT | B199: F60V | C199: 6 | D199: S | E199: srbd | F199: ZZZY | G199: =Sheet1!R[-1]C[25] -> 六.绝|cFFFF9933[宝石]仙道 - 永恒|r | H199: =Sheet1!R[-1]C[25] -> |cFFFFFF99基础属性|r|n攻击:225000|n|n|cFFFFFF55附加属性|r(%)|n暴击概率:12|n暴击伤害:48|n伤害增幅:9|n|n用于镶嵌到[剑,衣]上.|n镶嵌后不可取下!|n不需要的宝石可以在宠物处熔炼,用于宝石抽奖. | I199: =RC[-2] -> 六.绝|cFFFF9933[宝石]仙道 - 永恒|r | J199: =RC[-2] -> |cFFFFFF99基础属性|r|n攻击:225000|n|n|cFFFFFF55附加属性|r(%)|n暴击概率:12|n暴击伤害:48|n伤害增幅:9|n|n用于镶嵌到[剑,衣]上.|n镶嵌后不可取下!|n不需要的宝石可以在宠物处熔炼,用于宝石抽奖. | L199: ="ReplaceableTextures\CommandButtons\BTN_gem_"&RC[-9]&".blp" -> ReplaceableTextures\CommandButtons\BTN_gem_6.blp | N199: =VLOOKUP(RC[-10],Sheet2!R7C1:R12C5,5,0) -> model\item\texiao_gaojiguangzhu.mdx | W199: 3 | X199: Campaign | Y199: =1000*POWER(2,RC[-22]) -> 64000 | Z199: 235 | AA199: 0 | AB199: =VLOOKUP(RC[-25],Sheet2!R13C1:R19C4,4,0)*VLOOKUP(RC[-24],Sheet2!R7C1:R12C4,4,0) -> 110 | AC199: 0 | AQ199: 1
A200: OBJECT | B200: F60W | C200: 6 | D200: X | E200: srbd | F200: ZZZY | G200: =Sheet1!R[-1]C[25] -> 六.神|Cffff0000[宝石]上古遗物 - 纵横|r | H200: =Sheet1!R[-1]C[25] -> |cFFFFFF99基础属性|r|n血量:5400000|n护甲:1600|n|n|cFFFFFF55附加属性|r(%)|n暴击伤害:48|n伤害增幅:19|n|n用于镶嵌到[剑,衣]上.|n镶嵌后不可取下!|n不需要的宝石可以在宠物处熔炼,用于宝石抽奖. | I200: =RC[-2] -> 六.神|Cffff0000[宝石]上古遗物 - 纵横|r | J200: =RC[-2] -> |cFFFFFF99基础属性|r|n血量:5400000|n护甲:1600|n|n|cFFFFFF55附加属性|r(%)|n暴击伤害:48|n伤害增幅:19|n|n用于镶嵌到[剑,衣]上.|n镶嵌后不可取下!|n不需要的宝石可以在宠物处熔炼,用于宝石抽奖. | L200: ="ReplaceableTextures\CommandButtons\BTN_gem_"&RC[-9]&".blp" -> ReplaceableTextures\CommandButtons\BTN_gem_6.blp | N200: =VLOOKUP(RC[-10],Sheet2!R7C1:R12C5,5,0) -> model\item\texiao_gaojiguangzhu.mdx | W200: 3 | X200: Campaign | Y200: =1000*POWER(2,RC[-22]) -> 64000 | Z200: 235 | AA200: 0 | AB200: =VLOOKUP(RC[-25],Sheet2!R13C1:R19C4,4,0)*VLOOKUP(RC[-24],Sheet2!R7C1:R12C4,4,0) -> 132 | AC200: 0 | AQ200: 1

Sheet: Sheet1
A1: 等级 | B1: 品级 | C1: 前缀 | D1: 名字 | E1: 后缀 | F1: |cFFFFFF99基础属性|r | G1: 攻击: | H1: 力量: | I1: 敏捷: | J1: 智力: | K1: 血量: | L1: 护甲: | M1: |cFFFFFF55附加属性|r(%) | N1: 攻速: | O1: 攻击吸血: | P1: 暴击概率: | Q1: 暴击伤害: | R1: 伤害增幅: | S1: 附加伤害: | T1: 最终伤害: | U1: 伤害抵抗: | V1: 伤害减免: | W1: 伤害反弹: | X1: 全属性抗性: | Y1: 火属性抗性: | Z1: 水属性抗性: | AA1: 风属性抗性: | AB1: 土属性抗性: | AD1: = | AE1: 描述 | AF1: 名字 | AG1: 文本
A2: 1 | B2: D | C2: [宝石] | D2: 硬骨 | AE2: 用于镶嵌到[剑,衣]上.|n镶嵌后不可取下!|n不需要的宝石可以在宠物处熔炼,用于宝石抽奖. | AF2: =VLOOKUP(RC[-31],Sheet2!R13C1:R19C2,2,0)&"."&VLOOKUP(RC[-30],Sheet2!R7C1:R12C2,2,0)&VLOOKUP(RC[-30],Sheet2!R1C1:R6C2,2,0)&RC[-29]&RC[-28]&RC[-27]&Sheet2!R1C3 -> 一.丁|cFF999999[宝石]硬骨|r | AG2: =IF(RC[-26]&RC[-25]&RC[-24]&RC[-23]&RC[-22]&RC[-21]="",,R1C6)&IF(RC[-26]="",,"|n"&R1C7&RC[-26])&IF(RC[-25]="",,"|n"&R1C8&RC[-25])&IF(RC[-24]="",,"|n"&R1C9&RC[-24])&IF(RC[-23]="",,"|n"&R1C10&RC[-23])&IF(RC[-22]="",,"|n"&R1C11&RC[-22])&IF(RC[-21]="",,"|n"&R1C12&RC[-21])&IF(RC[-19]&RC[-18]&RC[-17]&RC[-16]="",,"|n|n"&R1C13)&IF(RC[-19]="",,"|n"&R1C14&RC[-19])&IF(RC[-18]="",,"|n"&R1C15&RC[-18])&IF(RC[-17]="",,"|n"&R1C16&RC[-17])&IF(RC[-16]="",,"|n"&R1C17&RC[-16])&IF(RC[-15]="",,"|n"&R1C18&RC[-15])&IF(RC[-14]="",,"|n"&R1C19&RC[-14])&IF(RC[-13]="",,"|n"&R1C20&RC[-13])&IF(RC[-12]="",,"|n"&R1C21&RC[-12])&IF(RC[-11]="",,"|n"&R1C22&RC[-11])&IF(RC[-10]="",,"|n"&R1C23&RC[-10])&IF(RC[-9]="",,"|n"&R1C24&RC[-9])&IF(RC[-8]="",,"|n"&R1C25&RC[-8])&IF(RC[-7]="",,"|n"&R1C26&RC[-7])&IF(RC[-6]="",,"|n"&R1C27&RC[-6])&IF(RC[-5]="",,"|n"&R1C28&RC[-5])&IF(RC[-2]="",,"|n|n"&RC[-2]) -> |n|n用于镶嵌到[剑,衣]上.|n镶嵌后不可取下!|n不需要的宝石可以在宠物处熔炼,用于宝石抽奖.
A3: 1 | B3: D | C3: [宝石] | D3: 寒梅 | AE3: 用于镶嵌到[剑,衣]上.|n镶嵌后不可取下!|n不需要的宝石可以在宠物处熔炼,用于宝石抽奖. | AF3: =VLOOKUP(RC[-31],Sheet2!R13C1:R19C2,2,0)&"."&VLOOKUP(RC[-30],Sheet2!R7C1:R12C2,2,0)&VLOOKUP(RC[-30],Sheet2!R1C1:R6C2,2,0)&RC[-29]&RC[-28]&RC[-27]&Sheet2!R1C3 -> 一.丁|cFF999999[宝石]寒梅|r | AG3: =IF(RC[-26]&RC[-25]&RC[-24]&RC[-23]&RC[-22]&RC[-21]="",,R1C6)&IF(RC[-26]="",,"|n"&R1C7&RC[-26])&IF(RC[-25]="",,"|n"&R1C8&RC[-25])&IF(RC[-24]="",,"|n"&R1C9&RC[-24])&IF(RC[-23]="",,"|n"&R1C10&RC[-23])&IF(RC[-22]="",,"|n"&R1C11&RC[-22])&IF(RC[-21]="",,"|n"&R1C12&RC[-21])&IF(RC[-19]&RC[-18]&RC[-17]&RC[-16]="",,"|n|n"&R1C13)&IF(RC[-19]="",,"|n"&R1C14&RC[-19])&IF(RC[-18]="",,"|n"&R1C15&RC[-18])&IF(RC[-17]="",,"|n"&R1C16&RC[-17])&IF(RC[-16]="",,"|n"&R1C17&RC[-16])&IF(RC[-15]="",,"|n"&R1C18&RC[-15])&IF(RC[-14]="",,"|n"&R1C19&RC[-14])&IF(RC[-13]="",,"|n"&R1C20&RC[-13])&IF(RC[-12]="",,"|n"&R1C21&RC[-12])&IF(RC[-11]="",,"|n"&R1C22&RC[-11])&IF(RC[-10]="",,"|n"&R1C23&RC[-10])&IF(RC[-9]="",,"|n"&R1C24&RC[-9])&IF(RC[-8]="",,"|n"&R1C25&RC[-8])&IF(RC[-7]="",,"|n"&R1C26&RC[-7])&IF(RC[-6]="",,"|n"&R1C27&RC[-6])&IF(RC[-5]="",,"|n"&R1C28&RC[-5])&IF(RC[-2]="",,"|n|n"&RC[-2]) -> |n|n用于镶嵌到[剑,衣]上.|n镶嵌后不可取下!|n不需要的宝石可以在宠物处熔炼,用于宝石抽奖.
A4: 1 | B4: D | C4: [宝石] | D4: 五岳 | AE4: 用于镶嵌到[剑,衣]上.|n镶嵌后不可取下!|n不需要的宝石可以在宠物处熔炼,用于宝石抽奖. | AF4: =VLOOKUP(RC[-31],Sheet2!R13C1:R19C2,2,0)&"."&VLOOKUP(RC[-30],Sheet2!R7C1:R12C2,2,0)&VLOOKUP(RC[-30],Sheet2!R1C1:R6C2,2,0)&RC[-29]&RC[-28]&RC[-27]&Sheet2!R1C3 -> 一.丁|cFF999999[宝石]五岳|r | AG4: =IF(RC[-26]&RC[-25]&RC[-24]&RC[-23]&RC[-22]&RC[-21]="",,R1C6)&IF(RC[-26]="",,"|n"&R1C7&RC[-26])&IF(RC[-25]="",,"|n"&R1C8&RC[-25])&IF(RC[-24]="",,"|n"&R1C9&RC[-24])&IF(RC[-23]="",,"|n"&R1C10&RC[-23])&IF(RC[-22]="",,"|n"&R1C11&RC[-22])&IF(RC[-21]="",,"|n"&R1C12&RC[-21])&IF(RC[-19]&RC[-18]&RC[-17]&RC[-16]="",,"|n|n"&R1C13)&IF(RC[-19]="",,"|n"&R1C14&RC[-19])&IF(RC[-18]="",,"|n"&R1C15&RC[-18])&IF(RC[-17]="",,"|n"&R1C16&RC[-17])&IF(RC[-16]="",,"|n"&R1C17&RC[-16])&IF(RC[-15]="",,"|n"&R1C18&RC[-15])&IF(RC[-14]="",,"|n"&R1C19&RC[-14])&IF(RC[-13]="",,"|n"&R1C20&RC[-13])&IF(RC[-12]="",,"|n"&R1C21&RC[-12])&IF(RC[-11]="",,"|n"&R1C22&RC[-11])&IF(RC[-10]="",,"|n"&R1C23&RC[-10])&IF(RC[-9]="",,"|n"&R1C24&RC[-9])&IF(RC[-8]="",,"|n"&R1C25&RC[-8])&IF(RC[-7]="",,"|n"&R1C26&RC[-7])&IF(RC[-6]="",,"|n"&R1C27&RC[-6])&IF(RC[-5]="",,"|n"&R1C28&RC[-5])&IF(RC[-2]="",,"|n|n"&RC[-2]) -> |n|n用于镶嵌到[剑,衣]上.|n镶嵌后不可取下!|n不需要的宝石可以在宠物处熔炼,用于宝石抽奖.
A5: 1 | B5: D | C5: [宝石] | D5: 天龙 | AE5: 用于镶嵌到[剑,衣]上.|n镶嵌后不可取下!|n不需要的宝石可以在宠物处熔炼,用于宝石抽奖. | AF5: =VLOOKUP(RC[-31],Sheet2!R13C1:R19C2,2,0)&"."&VLOOKUP(RC[-30],Sheet2!R7C1:R12C2,2,0)&VLOOKUP(RC[-30],Sheet2!R1C1:R6C2,2,0)&RC[-29]&RC[-28]&RC[-27]&Sheet2!R1C3 -> 一.丁|cFF999999[宝石]天龙|r | AG5: =IF(RC[-26]&RC[-25]&RC[-24]&RC[-23]&RC[-22]&RC[-21]="",,R1C6)&IF(RC[-26]="",,"|n"&R1C7&RC[-26])&IF(RC[-25]="",,"|n"&R1C8&RC[-25])&IF(RC[-24]="",,"|n"&R1C9&RC[-24])&IF(RC[-23]="",,"|n"&R1C10&RC[-23])&IF(RC[-22]="",,"|n"&R1C11&RC[-22])&IF(RC[-21]="",,"|n"&R1C12&RC[-21])&IF(RC[-19]&RC[-18]&RC[-17]&RC[-16]="",,"|n|n"&R1C13)&IF(RC[-19]="",,"|n"&R1C14&RC[-19])&IF(RC[-18]="",,"|n"&R1C15&RC[-18])&IF(RC[-17]="",,"|n"&R1C16&RC[-17])&IF(RC[-16]="",,"|n"&R1C17&RC[-16])&IF(RC[-15]="",,"|n"&R1C18&RC[-15])&IF(RC[-14]="",,"|n"&R1C19&RC[-14])&IF(RC[-13]="",,"|n"&R1C20&RC[-13])&IF(RC[-12]="",,"|n"&R1C21&RC[-12])&IF(RC[-11]="",,"|n"&R1C22&RC[-11])&IF(RC[-10]="",,"|n"&R1C23&RC[-10])&IF(RC[-9]="",,"|n"&R1C24&RC[-9])&IF(RC[-8]="",,"|n"&R1C25&RC[-8])&IF(RC[-7]="",,"|n"&R1C26&RC[-7])&IF(RC[-6]="",,"|n"&R1C27&RC[-6])&IF(RC[-5]="",,"|n"&R1C28&RC[-5])&IF(RC[-2]="",,"|n|n"&RC[-2]) -> |n|n用于镶嵌到[剑,衣]上.|n镶嵌后不可取下!|n不需要的宝石可以在宠物处熔炼,用于宝石抽奖.
A6: 1 | B6: D | C6: [宝石] | D6: 玉蟾 | AE6: 用于镶嵌到[剑,衣]上.|n镶嵌后不可取下!|n不需要的宝石可以在宠物处熔炼,用于宝石抽奖. | AF6: =VLOOKUP(RC[-31],Sheet2!R13C1:R19C2,2,0)&"."&VLOOKUP(RC[-30],Sheet2!R7C1:R12C2,2,0)&VLOOKUP(RC[-30],Sheet2!R1C1:R6C2,2,0)&RC[-29]&RC[-28]&RC[-27]&Sheet2!R1C3 -> 一.丁|cFF999999[宝石]玉蟾|r | AG6: =IF(RC[-26]&RC[-25]&RC[-24]&RC[-23]&RC[-22]&RC[-21]="",,R1C6)&IF(RC[-26]="",,"|n"&R1C7&RC[-26])&IF(RC[-25]="",,"|n"&R1C8&RC[-25])&IF(RC[-24]="",,"|n"&R1C9&RC[-24])&IF(RC[-23]="",,"|n"&R1C10&RC[-23])&IF(RC[-22]="",,"|n"&R1C11&RC[-22])&IF(RC[-21]="",,"|n"&R1C12&RC[-21])&IF(RC[-19]&RC[-18]&RC[-17]&RC[-16]="",,"|n|n"&R1C13)&IF(RC[-19]="",,"|n"&R1C14&RC[-19])&IF(RC[-18]="",,"|n"&R1C15&RC[-18])&IF(RC[-17]="",,"|n"&R1C16&RC[-17])&IF(RC[-16]="",,"|n"&R1C17&RC[-16])&IF(RC[-15]="",,"|n"&R1C18&RC[-15])&IF(RC[-14]="",,"|n"&R1C19&RC[-14])&IF(RC[-13]="",,"|n"&R1C20&RC[-13])&IF(RC[-12]="",,"|n"&R1C21&RC[-12])&IF(RC[-11]="",,"|n"&R1C22&RC[-11])&IF(RC[-10]="",,"|n"&R1C23&RC[-10])&IF(RC[-9]="",,"|n"&R1C24&RC[-9])&IF(RC[-8]="",,"|n"&R1C25&RC[-8])&IF(RC[-7]="",,"|n"&R1C26&RC[-7])&IF(RC[-6]="",,"|n"&R1C27&RC[-6])&IF(RC[-5]="",,"|n"&R1C28&RC[-5])&IF(RC[-2]="",,"|n|n"&RC[-2]) -> |n|n用于镶嵌到[剑,衣]上.|n镶嵌后不可取下!|n不需要的宝石可以在宠物处熔炼,用于宝石抽奖.
A7: 1 | B7: D | C7: [宝石] | D7: 混元 | AE7: 用于镶嵌到[剑,衣]上.|n镶嵌后不可取下!|n不需要的宝石可以在宠物处熔炼,用于宝石抽奖. | AF7: =VLOOKUP(RC[-31],Sheet2!R13C1:R19C2,2,0)&"."&VLOOKUP(RC[-30],Sheet2!R7C1:R12C2,2,0)&VLOOKUP(RC[-30],Sheet2!R1C1:R6C2,2,0)&RC[-29]&RC[-28]&RC[-27]&Sheet2!R1C3 -> 一.丁|cFF999999[宝石]混元|r | AG7: =IF(RC[-26]&RC[-25]&RC[-24]&RC[-23]&RC[-22]&RC[-21]="",,R1C6)&IF(RC[-26]="",,"|n"&R1C7&RC[-26])&IF(RC[-25]="",,"|n"&R1C8&RC[-25])&IF(RC[-24]="",,"|n"&R1C9&RC[-24])&IF(RC[-23]="",,"|n"&R1C10&RC[-23])&IF(RC[-22]="",,"|n"&R1C11&RC[-22])&IF(RC[-21]="",,"|n"&R1C12&RC[-21])&IF(RC[-19]&RC[-18]&RC[-17]&RC[-16]="",,"|n|n"&R1C13)&IF(RC[-19]="",,"|n"&R1C14&RC[-19])&IF(RC[-18]="",,"|n"&R1C15&RC[-18])&IF(RC[-17]="",,"|n"&R1C16&RC[-17])&IF(RC[-16]="",,"|n"&R1C17&RC[-16])&IF(RC[-15]="",,"|n"&R1C18&RC[-15])&IF(RC[-14]="",,"|n"&R1C19&RC[-14])&IF(RC[-13]="",,"|n"&R1C20&RC[-13])&IF(RC[-12]="",,"|n"&R1C21&RC[-12])&IF(RC[-11]="",,"|n"&R1C22&RC[-11])&IF(RC[-10]="",,"|n"&R1C23&RC[-10])&IF(RC[-9]="",,"|n"&R1C24&RC[-9])&IF(RC[-8]="",,"|n"&R1C25&RC[-8])&IF(RC[-7]="",,"|n"&R1C26&RC[-7])&IF(RC[-6]="",,"|n"&R1C27&RC[-6])&IF(RC[-5]="",,"|n"&R1C28&RC[-5])&IF(RC[-2]="",,"|n|n"&RC[-2]) -> |n|n用于镶嵌到[剑,衣]上.|n镶嵌后不可取下!|n不需要的宝石可以在宠物处熔炼,用于宝石抽奖.
A8: 1 | B8: D | C8: [宝石] | D8: 金凤 | AE8: 用于镶嵌到[剑,衣]上.|n镶嵌后不可取下!|n不需要的宝石可以在宠物处熔炼,用于宝石抽奖. | AF8: =VLOOKUP(RC[-31],Sheet2!R13C1:R19C2,2,0)&"."&VLOOKUP(RC[-30],Sheet2!R7C1:R12C2,2,0)&VLOOKUP(RC[-30],Sheet2!R1C1:R6C2,2,0)&RC[-29]&RC[-28]&RC[-27]&Sheet2!R1C3 -> 一.丁|cFF999999[宝石]金凤|r | AG8: =IF(RC[-26]&RC[-25]&RC[-24]&RC[-23]&RC[-22]&RC[-21]="",,R1C6)&IF(RC[-26]="",,"|n"&R1C7&RC[-26])&IF(RC[-25]="",,"|n"&R1C8&RC[-25])&IF(RC[-24]="",,"|n"&R1C9&RC[-24])&IF(RC[-23]="",,"|n"&R1C10&RC[-23])&IF(RC[-22]="",,"|n"&R1C11&RC[-22])&IF(RC[-21]="",,"|n"&R1C12&RC[-21])&IF(RC[-19]&RC[-18]&RC[-17]&RC[-16]="",,"|n|n"&R1C13)&IF(RC[-19]="",,"|n"&R1C14&RC[-19])&IF(RC[-18]="",,"|n"&R1C15&RC[-18])&IF(RC[-17]="",,"|n"&R1C16&RC[-17])&IF(RC[-16]="",,"|n"&R1C17&RC[-16])&IF(RC[-15]="",,"|n"&R1C18&RC[-15])&IF(RC[-14]="",,"|n"&R1C19&RC[-14])&IF(RC[-13]="",,"|n"&R1C20&RC[-13])&IF(RC[-12]="",,"|n"&R1C21&RC[-12])&IF(RC[-11]="",,"|n"&R1C22&RC[-11])&IF(RC[-10]="",,"|n"&R1C23&RC[-10])&IF(RC[-9]="",,"|n"&R1C24&RC[-9])&IF(RC[-8]="",,"|n"&R1C25&RC[-8])&IF(RC[-7]="",,"|n"&R1C26&RC[-7])&IF(RC[-6]="",,"|n"&R1C27&RC[-6])&IF(RC[-5]="",,"|n"&R1C28&RC[-5])&IF(RC[-2]="",,"|n|n"&RC[-2]) -> |n|n用于镶嵌到[剑,衣]上.|n镶嵌后不可取下!|n不需要的宝石可以在宠物处熔炼,用于宝石抽奖.
A9: 1 | B9: D | C9: [宝石] | D9: 碧霞 | AE9: 用于镶嵌到[剑,衣]上.|n镶嵌后不可取下!|n不需要的宝石可以在宠物处熔炼,用于宝石抽奖. | AF9: =VLOOKUP(RC[-31],Sheet2!R13C1:R19C2,2,0)&"."&VLOOKUP(RC[-30],Sheet2!R7C1:R12C2,2,0)&VLOOKUP(RC[-30],Sheet2!R1C1:R6C2,2,0)&RC[-29]&RC[-28]&RC[-27]&Sheet2!R1C3 -> 一.丁|cFF999999[宝石]碧霞|r | AG9: =IF(RC[-26]&RC[-25]&RC[-24]&RC[-23]&RC[-22]&RC[-21]="",,R1C6)&IF(RC[-26]="",,"|n"&R1C7&RC[-26])&IF(RC[-25]="",,"|n"&R1C8&RC[-25])&IF(RC[-24]="",,"|n"&R1C9&RC[-24])&IF(RC[-23]="",,"|n"&R1C10&RC[-23])&IF(RC[-22]="",,"|n"&R1C11&RC[-22])&IF(RC[-21]="",,"|n"&R1C12&RC[-21])&IF(RC[-19]&RC[-18]&RC[-17]&RC[-16]="",,"|n|n"&R1C13)&IF(RC[-19]="",,"|n"&R1C14&RC[-19])&IF(RC[-18]="",,"|n"&R1C15&RC[-18])&IF(RC[-17]="",,"|n"&R1C16&RC[-17])&IF(RC[-16]="",,"|n"&R1C17&RC[-16])&IF(RC[-15]="",,"|n"&R1C18&RC[-15])&IF(RC[-14]="",,"|n"&R1C19&RC[-14])&IF(RC[-13]="",,"|n"&R1C20&RC[-13])&IF(RC[-12]="",,"|n"&R1C21&RC[-12])&IF(RC[-11]="",,"|n"&R1C22&RC[-11])&IF(RC[-10]="",,"|n"&R1C23&RC[-10])&IF(RC[-9]="",,"|n"&R1C24&RC[-9])&IF(RC[-8]="",,"|n"&R1C25&RC[-8])&IF(RC[-7]="",,"|n"&R1C26&RC[-7])&IF(RC[-6]="",,"|n"&R1C27&RC[-6])&IF(RC[-5]="",,"|n"&R1C28&RC[-5])&IF(RC[-2]="",,"|n|n"&RC[-2]) -> |n|n用于镶嵌到[剑,衣]上.|n镶嵌后不可取下!|n不需要的宝石可以在宠物处熔炼,用于宝石抽奖.
A10: 1 | B10: D | C10: [宝石] | D10: 问道 | AE10: 用于镶嵌到[剑,衣]上.|n镶嵌后不可取下!|n不需要的宝石可以在宠物处熔炼,用于宝石抽奖. | AF10: =VLOOKUP(RC[-31],Sheet2!R13C1:R19C2,2,0)&"."&VLOOKUP(RC[-30],Sheet2!R7C1:R12C2,2,0)&VLOOKUP(RC[-30],Sheet2!R1C1:R6C2,2,0)&RC[-29]&RC[-28]&RC[-27]&Sheet2!R1C3 -> 一.丁|cFF999999[宝石]问道|r | AG10: =IF(RC[-26]&RC[-25]&RC[-24]&RC[-23]&RC[-22]&RC[-21]="",,R1C6)&IF(RC[-26]="",,"|n"&R1C7&RC[-26])&IF(RC[-25]="",,"|n"&R1C8&RC[-25])&IF(RC[-24]="",,"|n"&R1C9&RC[-24])&IF(RC[-23]="",,"|n"&R1C10&RC[-23])&IF(RC[-22]="",,"|n"&R1C11&RC[-22])&IF(RC[-21]="",,"|n"&R1C12&RC[-21])&IF(RC[-19]&RC[-18]&RC[-17]&RC[-16]="",,"|n|n"&R1C13)&IF(RC[-19]="",,"|n"&R1C14&RC[-19])&IF(RC[-18]="",,"|n"&R1C15&RC[-18])&IF(RC[-17]="",,"|n"&R1C16&RC[-17])&IF(RC[-16]="",,"|n"&R1C17&RC[-16])&IF(RC[-15]="",,"|n"&R1C18&RC[-15])&IF(RC[-14]="",,"|n"&R1C19&RC[-14])&IF(RC[-13]="",,"|n"&R1C20&RC[-13])&IF(RC[-12]="",,"|n"&R1C21&RC[-12])&IF(RC[-11]="",,"|n"&R1C22&RC[-11])&IF(RC[-10]="",,"|n"&R1C23&RC[-10])&IF(RC[-9]="",,"|n"&R1C24&RC[-9])&IF(RC[-8]="",,"|n"&R1C25&RC[-8])&IF(RC[-7]="",,"|n"&R1C26&RC[-7])&IF(RC[-6]="",,"|n"&R1C27&RC[-6])&IF(RC[-5]="",,"|n"&R1C28&RC[-5])&IF(RC[-2]="",,"|n|n"&RC[-2]) -> |n|n用于镶嵌到[剑,衣]上.|n镶嵌后不可取下!|n不需要的宝石可以在宠物处熔炼,用于宝石抽奖.
A11: 1 | B11: D | C11: [宝石] | D11: 狐绒 | AE11: 用于镶嵌到[剑,衣]上.|n镶嵌后不可取下!|n不需要的宝石可以在宠物处熔炼,用于宝石抽奖. | AF11: =VLOOKUP(RC[-31],Sheet2!R13C1:R19C2,2,0)&"."&VLOOKUP(RC[-30],Sheet2!R7C1:R12C2,2,0)&VLOOKUP(RC[-30],Sheet2!R1C1:R6C2,2,0)&RC[-29]&RC[-28]&RC[-27]&Sheet2!R1C3 -> 一.丁|cFF999999[宝石]狐绒|r | AG11: =IF(RC[-26]&RC[-25]&RC[-24]&RC[-23]&RC[-22]&RC[-21]="",,R1C6)&IF(RC[-26]="",,"|n"&R1C7&RC[-26])&IF(RC[-25]="",,"|n"&R1C8&RC[-25])&IF(RC[-24]="",,"|n"&R1C9&RC[-24])&IF(RC[-23]="",,"|n"&R1C10&RC[-23])&IF(RC[-22]="",,"|n"&R1C11&RC[-22])&IF(RC[-21]="",,"|n"&R1C12&RC[-21])&IF(RC[-19]&RC[-18]&RC[-17]&RC[-16]="",,"|n|n"&R1C13)&IF(RC[-19]="",,"|n"&R1C14&RC[-19])&IF(RC[-18]="",,"|n"&R1C15&RC[-18])&IF(RC[-17]="",,"|n"&R1C16&RC[-17])&IF(RC[-16]="",,"|n"&R1C17&RC[-16])&IF(RC[-15]="",,"|n"&R1C18&RC[-15])&IF(RC[-14]="",,"|n"&R1C19&RC[-14])&IF(RC[-13]="",,"|n"&R1C20&RC[-13])&IF(RC[-12]="",,"|n"&R1C21&RC[-12])&IF(RC[-11]="",,"|n"&R1C22&RC[-11])&IF(RC[-10]="",,"|n"&R1C23&RC[-10])&IF(RC[-9]="",,"|n"&R1C24&RC[-9])&IF(RC[-8]="",,"|n"&R1C25&RC[-8])&IF(RC[-7]="",,"|n"&R1C26&RC[-7])&IF(RC[-6]="",,"|n"&R1C27&RC[-6])&IF(RC[-5]="",,"|n"&R1C28&RC[-5])&IF(RC[-2]="",,"|n|n"&RC[-2]) -> |n|n用于镶嵌到[剑,衣]上.|n镶嵌后不可取下!|n不需要的宝石可以在宠物处熔炼,用于宝石抽奖.
A12: 1 | B12: D | C12: [宝石] | D12: 焚城 | AE12: 用于镶嵌到[剑,衣]上.|n镶嵌后不可取下!|n不需要的宝石可以在宠物处熔炼,用于宝石抽奖. | AF12: =VLOOKUP(RC[-31],Sheet2!R13C1:R19C2,2,0)&"."&VLOOKUP(RC[-30],Sheet2!R7C1:R12C2,2,0)&VLOOKUP(RC[-30],Sheet2!R1C1:R6C2,2,0)&RC[-29]&RC[-28]&RC[-27]&Sheet2!R1C3 -> 一.丁|cFF999999[宝石]焚城|r | AG12: =IF(RC[-26]&RC[-25]&RC[-24]&RC[-23]&RC[-22]&RC[-21]="",,R1C6)&IF(RC[-26]="",,"|n"&R1C7&RC[-26])&IF(RC[-25]="",,"|n"&R1C8&RC[-25])&IF(RC[-24]="",,"|n"&R1C9&RC[-24])&IF(RC[-23]="",,"|n"&R1C10&RC[-23])&IF(RC[-22]="",,"|n"&R1C11&RC[-22])&IF(RC[-21]="",,"|n"&R1C12&RC[-21])&IF(RC[-19]&RC[-18]&RC[-17]&RC[-16]="",,"|n|n"&R1C13)&IF(RC[-19]="",,"|n"&R1C14&RC[-19])&IF(RC[-18]="",,"|n"&R1C15&RC[-18])&IF(RC[-17]="",,"|n"&R1C16&RC[-17])&IF(RC[-16]="",,"|n"&R1C17&RC[-16])&IF(RC[-15]="",,"|n"&R1C18&RC[-15])&IF(RC[-14]="",,"|n"&R1C19&RC[-14])&IF(RC[-13]="",,"|n"&R1C20&RC[-13])&IF(RC[-12]="",,"|n"&R1C21&RC[-12])&IF(RC[-11]="",,"|n"&R1C22&RC[-11])&IF(RC[-10]="",,"|n"&R1C23&RC[-10])&IF(RC[-9]="",,"|n"&R1C24&RC[-9])&IF(RC[-8]="",,"|n"&R1C25&RC[-8])&IF(RC[-7]="",,"|n"&R1C26&RC[-7])&IF(RC[-6]="",,"|n"&R1C27&RC[-6])&IF(RC[-5]="",,"|n"&R1C28&RC[-5])&IF(RC[-2]="",,"|n|n"&RC[-2]) -> |n|n用于镶嵌到[剑,衣]上.|n镶嵌后不可取下!|n不需要的宝石可以在宠物处熔炼,用于宝石抽奖.
A13: 1 | B13: D | C13: [宝石] | D13: 擎雷 | AE13: 用于镶嵌到[剑,衣]上.|n镶嵌后不可取下!|n不需要的宝石可以在宠物处熔炼,用于宝石抽奖. | AF13: =VLOOKUP(RC[-31],Sheet2!R13C1:R19C2,2,0)&"."&VLOOKUP(RC[-30],Sheet2!R7C1:R12C2,2,0)&VLOOKUP(RC[-30],Sheet2!R1C1:R6C2,2,0)&RC[-29]&RC[-28]&RC[-27]&Sheet2!R1C3 -> 一.丁|cFF999999[宝石]擎雷|r | AG13: =IF(RC[-26]&RC[-25]&RC[-24]&RC[-23]&RC[-22]&RC[-21]="",,R1C6)&IF(RC[-26]="",,"|n"&R1C7&RC[-26])&IF(RC[-25]="",,"|n"&R1C8&RC[-25])&IF(RC[-24]="",,"|n"&R1C9&RC[-24])&IF(RC[-23]="",,"|n"&R1C10&RC[-23])&IF(RC[-22]="",,"|n"&R1C11&RC[-22])&IF(RC[-21]="",,"|n"&R1C12&RC[-21])&IF(RC[-19]&RC[-18]&RC[-17]&RC[-16]="",,"|n|n"&R1C13)&IF(RC[-19]="",,"|n"&R1C14&RC[-19])&IF(RC[-18]="",,"|n"&R1C15&RC[-18])&IF(RC[-17]="",,"|n"&R1C16&RC[-17])&IF(RC[-16]="",,"|n"&R1C17&RC[-16])&IF(RC[-15]="",,"|n"&R1C18&RC[-15])&IF(RC[-14]="",,"|n"&R1C19&RC[-14])&IF(RC[-13]="",,"|n"&R1C20&RC[-13])&IF(RC[-12]="",,"|n"&R1C21&RC[-12])&IF(RC[-11]="",,"|n"&R1C22&RC[-11])&IF(RC[-10]="",,"|n"&R1C23&RC[-10])&IF(RC[-9]="",,"|n"&R1C24&RC[-9])&IF(RC[-8]="",,"|n"&R1C25&RC[-8])&IF(RC[-7]="",,"|n"&R1C26&RC[-7])&IF(RC[-6]="",,"|n"&R1C27&RC[-6])&IF(RC[-5]="",,"|n"&R1C28&RC[-5])&IF(RC[-2]="",,"|n|n"&RC[-2]) -> |n|n用于镶嵌到[剑,衣]上.|n镶嵌后不可取下!|n不需要的宝石可以在宠物处熔炼,用于宝石抽奖.
A14: 1 | B14: D | C14: [宝石] | D14: 炼心 | AE14: 用于镶嵌到[剑,衣]上.|n镶嵌后不可取下!|n不需要的宝石可以在宠物处熔炼,用于宝石抽奖. | AF14: =VLOOKUP(RC[-31],Sheet2!R13C1:R19C2,2,0)&"."&VLOOKUP(RC[-30],Sheet2!R7C1:R12C2,2,0)&VLOOKUP(RC[-30],Sheet2!R1C1:R6C2,2,0)&RC[-29]&RC[-28]&RC[-27]&Sheet2!R1C3 -> 一.丁|cFF999999[宝石]炼心|r | AG14: =IF(RC[-26]&RC[-25]&RC[-24]&RC[-23]&RC[-22]&RC[-21]="",,R1C6)&IF(RC[-26]="",,"|n"&R1C7&RC[-26])&IF(RC[-25]="",,"|n"&R1C8&RC[-25])&IF(RC[-24]="",,"|n"&R1C9&RC[-24])&IF(RC[-23]="",,"|n"&R1C10&RC[-23])&IF(RC[-22]="",,"|n"&R1C11&RC[-22])&IF(RC[-21]="",,"|n"&R1C12&RC[-21])&IF(RC[-19]&RC[-18]&RC[-17]&RC[-16]="",,"|n|n"&R1C13)&IF(RC[-19]="",,"|n"&R1C14&RC[-19])&IF(RC[-18]="",,"|n"&R1C15&RC[-18])&IF(RC[-17]="",,"|n"&R1C16&RC[-17])&IF(RC[-16]="",,"|n"&R1C17&RC[-16])&IF(RC[-15]="",,"|n"&R1C18&RC[-15])&IF(RC[-14]="",,"|n"&R1C19&RC[-14])&IF(RC[-13]="",,"|n"&R1C20&RC[-13])&IF(RC[-12]="",,"|n"&R1C21&RC[-12])&IF(RC[-11]="",,"|n"&R1C22&RC[-11])&IF(RC[-10]="",,"|n"&R1C23&RC[-10])&IF(RC[-9]="",,"|n"&R1C24&RC[-9])&IF(RC[-8]="",,"|n"&R1C25&RC[-8])&IF(RC[-7]="",,"|n"&R1C26&RC[-7])&IF(RC[-6]="",,"|n"&R1C27&RC[-6])&IF(RC[-5]="",,"|n"&R1C28&RC[-5])&IF(RC[-2]="",,"|n|n"&RC[-2]) -> |n|n用于镶嵌到[剑,衣]上.|n镶嵌后不可取下!|n不需要的宝石可以在宠物处熔炼,用于宝石抽奖.
A15: 1 | B15: D | C15: [宝石] | D15: 开山 | AE15: 用于镶嵌到[剑,衣]上.|n镶嵌后不可取下!|n不需要的宝石可以在宠物处熔炼,用于宝石抽奖. | AF15: =VLOOKUP(RC[-31],Sheet2!R13C1:R19C2,2,0)&"."&VLOOKUP(RC[-30],Sheet2!R7C1:R12C2,2,0)&VLOOKUP(RC[-30],Sheet2!R1C1:R6C2,2,0)&RC[-29]&RC[-28]&RC[-27]&Sheet2!R1C3 -> 一.丁|cFF999999[宝石]开山|r | AG15: =IF(RC[-26]&RC[-25]&RC[-24]&RC[-23]&RC[-22]&RC[-21]="",,R1C6)&IF(RC[-26]="",,"|n"&R1C7&RC[-26])&IF(RC[-25]="",,"|n"&R1C8&RC[-25])&IF(RC[-24]="",,"|n"&R1C9&RC[-24])&IF(RC[-23]="",,"|n"&R1C10&RC[-23])&IF(RC[-22]="",,"|n"&R1C11&RC[-22])&IF(RC[-21]="",,"|n"&R1C12&RC[-21])&IF(RC[-19]&RC[-18]&RC[-17]&RC[-16]="",,"|n|n"&R1C13)&IF(RC[-19]="",,"|n"&R1C14&RC[-19])&IF(RC[-18]="",,"|n"&R1C15&RC[-18])&IF(RC[-17]="",,"|n"&R1C16&RC[-17])&IF(RC[-16]="",,"|n"&R1C17&RC[-16])&IF(RC[-15]="",,"|n"&R1C18&RC[-15])&IF(RC[-14]="",,"|n"&R1C19&RC[-14])&IF(RC[-13]="",,"|n"&R1C20&RC[-13])&IF(RC[-12]="",,"|n"&R1C21&RC[-12])&IF(RC[-11]="",,"|n"&R1C22&RC[-11])&IF(RC[-10]="",,"|n"&R1C23&RC[-10])&IF(RC[-9]="",,"|n"&R1C24&RC[-9])&IF(RC[-8]="",,"|n"&R1C25&RC[-8])&IF(RC[-7]="",,"|n"&R1C26&RC[-7])&IF(RC[-6]="",,"|n"&R1C27&RC[-6])&IF(RC[-5]="",,"|n"&R1C28&RC[-5])&IF(RC[-2]="",,"|n|n"&RC[-2]) -> |n|n用于镶嵌到[剑,衣]上.|n镶嵌后不可取下!|n不需要的宝石可以在宠物处熔炼,用于宝石抽奖.
A16: 1 | B16: D | C16: [宝石] | D16: 方士 | AE16: 用于镶嵌到[剑,衣]上.|n镶嵌后不可取下!|n不需要的宝石可以在宠物处熔炼,用于宝石抽奖. | AF16: =VLOOKUP(RC[-31],Sheet2!R13C1:R19C2,2,0)&"."&VLOOKUP(RC[-30],Sheet2!R7C1:R12C2,2,0)&VLOOKUP(RC[-30],Sheet2!R1C1:R6C2,2,0)&RC[-29]&RC[-28]&RC[-27]&Sheet2!R1C3 -> 一.丁|cFF999999[宝石]方士|r | AG16: =IF(RC[-26]&RC[-25]&RC[-24]&RC[-23]&RC[-22]&RC[-21]="",,R1C6)&IF(RC[-26]="",,"|n"&R1C7&RC[-26])&IF(RC[-25]="",,"|n"&R1C8&RC[-25])&IF(RC[-24]="",,"|n"&R1C9&RC[-24])&IF(RC[-23]="",,"|n"&R1C10&RC[-23])&IF(RC[-22]="",,"|n"&R1C11&RC[-22])&IF(RC[-21]="",,"|n"&R1C12&RC[-21])&IF(RC[-19]&RC[-18]&RC[-17]&RC[-16]="",,"|n|n"&R1C13)&IF(RC[-19]="",,"|n"&R1C14&RC[-19])&IF(RC[-18]="",,"|n"&R1C15&RC[-18])&IF(RC[-17]="",,"|n"&R1C16&RC[-17])&IF(RC[-16]="",,"|n"&R1C17&RC[-16])&IF(RC[-15]="",,"|n"&R1C18&RC[-15])&IF(RC[-14]="",,"|n"&R1C19&RC[-14])&IF(RC[-13]="",,"|n"&R1C20&RC[-13])&IF(RC[-12]="",,"|n"&R1C21&RC[-12])&IF(RC[-11]="",,"|n"&R1C22&RC[-11])&IF(RC[-10]="",,"|n"&R1C23&RC[-10])&IF(RC[-9]="",,"|n"&R1C24&RC[-9])&IF(RC[-8]="",,"|n"&R1C25&RC[-8])&IF(RC[-7]="",,"|n"&R1C26&RC[-7])&IF(RC[-6]="",,"|n"&R1C27&RC[-6])&IF(RC[-5]="",,"|n"&R1C28&RC[-5])&IF(RC[-2]="",,"|n|n"&RC[-2]) -> |n|n用于镶嵌到[剑,衣]上.|n镶嵌后不可取下!|n不需要的宝石可以在宠物处熔炼,用于宝石抽奖.
A17: 1 | B17: D | C17: [宝石] | D17: 北寒 | AE17: 用于镶嵌到[剑,衣]上.|n镶嵌后不可取下!|n不需要的宝石可以在宠物处熔炼,用于宝石抽奖. | AF17: =VLOOKUP(RC[-31],Sheet2!R13C1:R19C2,2,0)&"."&VLOOKUP(RC[-30],Sheet2!R7C1:R12C2,2,0)&VLOOKUP(RC[-30],Sheet2!R1C1:R6C2,2,0)&RC[-29]&RC[-28]&RC[-27]&Sheet2!R1C3 -> 一.丁|cFF999999[宝石]北寒|r | AG17: =IF(RC[-26]&RC[-25]&RC[-24]&RC[-23]&RC[-22]&RC[-21]="",,R1C6)&IF(RC[-26]="",,"|n"&R1C7&RC[-26])&IF(RC[-25]="",,"|n"&R1C8&RC[-25])&IF(RC[-24]="",,"|n"&R1C9&RC[-24])&IF(RC[-23]="",,"|n"&R1C10&RC[-23])&IF(RC[-22]="",,"|n"&R1C11&RC[-22])&IF(RC[-21]="",,"|n"&R1C12&RC[-21])&IF(RC[-19]&RC[-18]&RC[-17]&RC[-16]="",,"|n|n"&R1C13)&IF(RC[-19]="",,"|n"&R1C14&RC[-19])&IF(RC[-18]="",,"|n"&R1C15&RC[-18])&IF(RC[-17]="",,"|n"&R1C16&RC[-17])&IF(RC[-16]="",,"|n"&R1C17&RC[-16])&IF(RC[-15]="",,"|n"&R1C18&RC[-15])&IF(RC[-14]="",,"|n"&R1C19&RC[-14])&IF(RC[-13]="",,"|n"&R1C20&RC[-13])&IF(RC[-12]="",,"|n"&R1C21&RC[-12])&IF(RC[-11]="",,"|n"&R1C22&RC[-11])&IF(RC[-10]="",,"|n"&R1C23&RC[-10])&IF(RC[-9]="",,"|n"&R1C24&RC[-9])&IF(RC[-8]="",,"|n"&R1C25&RC[-8])&IF(RC[-7]="",,"|n"&R1C26&RC[-7])&IF(RC[-6]="",,"|n"&R1C27&RC[-6])&IF(RC[-5]="",,"|n"&R1C28&RC[-5])&IF(RC[-2]="",,"|n|n"&RC[-2]) -> |n|n用于镶嵌到[剑,衣]上.|n镶嵌后不可取下!|n不需要的宝石可以在宠物处熔炼,用于宝石抽奖.
A18: 1 | B18: C | C18: [宝石] | D18: 混元石 | H18: 1500 | I18: 1500 | J18: 1500 | AE18: 用于镶嵌到[剑,衣]上.|n镶嵌后不可取下!|n不需要的宝石可以在宠物处熔炼,用于宝石抽奖. | AF18: =VLOOKUP(RC[-31],Sheet2!R13C1:R19C2,2,0)&"."&VLOOKUP(RC[-30],Sheet2!R7C1:R12C2,2,0)&VLOOKUP(RC[-30],Sheet2!R1C1:R6C2,2,0)&RC[-29]&RC[-28]&RC[-27]&Sheet2!R1C3 -> 一.丙|cFF99FF66[宝石]混元石|r | AG18: =IF(RC[-26]&RC[-25]&RC[-24]&RC[-23]&RC[-22]&RC[-21]="",,R1C6)&IF(RC[-26]="",,"|n"&R1C7&RC[-26])&IF(RC[-25]="",,"|n"&R1C8&RC[-25])&IF(RC[-24]="",,"|n"&R1C9&RC[-24])&IF(RC[-23]="",,"|n"&R1C10&RC[-23])&IF(RC[-22]="",,"|n"&R1C11&RC[-22])&IF(RC[-21]="",,"|n"&R1C12&RC[-21])&IF(RC[-19]&RC[-18]&RC[-17]&RC[-16]="",,"|n|n"&R1C13)&IF(RC[-19]="",,"|n"&R1C14&RC[-19])&IF(RC[-18]="",,"|n"&R1C15&RC[-18])&IF(RC[-17]="",,"|n"&R1C16&RC[-17])&IF(RC[-16]="",,"|n"&R1C17&RC[-16])&IF(RC[-15]="",,"|n"&R1C18&RC[-15])&IF(RC[-14]="",,"|n"&R1C19&RC[-14])&IF(RC[-13]="",,"|n"&R1C20&RC[-13])&IF(RC[-12]="",,"|n"&R1C21&RC[-12])&IF(RC[-11]="",,"|n"&R1C22&RC[-11])&IF(RC[-10]="",,"|n"&R1C23&RC[-10])&IF(RC[-9]="",,"|n"&R1C24&RC[-9])&IF(RC[-8]="",,"|n"&R1C25&RC[-8])&IF(RC[-7]="",,"|n"&R1C26&RC[-7])&IF(RC[-6]="",,"|n"&R1C27&RC[-6])&IF(RC[-5]="",,"|n"&R1C28&RC[-5])&IF(RC[-2]="",,"|n|n"&RC[-2]) -> |cFFFFFF99基础属性|r|n力量:1500|n敏捷:1500|n智力:1500|n|n用于镶嵌到[剑,衣]上.|n镶嵌后不可取下!|n不需要的宝石可以在宠物处熔炼,用于宝石抽奖.
A19: 1 | B19: C | C19: [宝石] | D19: 金胎石 | G19: 5000 | AE19: 用于镶嵌到[剑,衣]上.|n镶嵌后不可取下!|n不需要的宝石可以在宠物处熔炼,用于宝石抽奖. | AF19: =VLOOKUP(RC[-31],Sheet2!R13C1:R19C2,2,0)&"."&VLOOKUP(RC[-30],Sheet2!R7C1:R12C2,2,0)&VLOOKUP(RC[-30],Sheet2!R1C1:R6C2,2,0)&RC[-29]&RC[-28]&RC[-27]&Sheet2!R1C3 -> 一.丙|cFF99FF66[宝石]金胎石|r | AG19: =IF(RC[-26]&RC[-25]&RC[-24]&RC[-23]&RC[-22]&RC[-21]="",,R1C6)&IF(RC[-26]="",,"|n"&R1C7&RC[-26])&IF(RC[-25]="",,"|n"&R1C8&RC[-25])&IF(RC[-24]="",,"|n"&R1C9&RC[-24])&IF(RC[-23]="",,"|n"&R1C10&RC[-23])&IF(RC[-22]="",,"|n"&R1C11&RC[-22])&IF(RC[-21]="",,"|n"&R1C12&RC[-21])&IF(RC[-19]&RC[-18]&RC[-17]&RC[-16]="",,"|n|n"&R1C13)&IF(RC[-19]="",,"|n"&R1C14&RC[-19])&IF(RC[-18]="",,"|n"&R1C15&RC[-18])&IF(RC[-17]="",,"|n"&R1C16&RC[-17])&IF(RC[-16]="",,"|n"&R1C17&RC[-16])&IF(RC[-15]="",,"|n"&R1C18&RC[-15])&IF(RC[-14]="",,"|n"&R1C19&RC[-14])&IF(RC[-13]="",,"|n"&R1C20&RC[-13])&IF(RC[-12]="",,"|n"&R1C21&RC[-12])&IF(RC[-11]="",,"|n"&R1C22&RC[-11])&IF(RC[-10]="",,"|n"&R1C23&RC[-10])&IF(RC[-9]="",,"|n"&R1C24&RC[-9])&IF(RC[-8]="",,"|n"&R1C25&RC[-8])&IF(RC[-7]="",,"|n"&R1C26&RC[-7])&IF(RC[-6]="",,"|n"&R1C27&RC[-6])&IF(RC[-5]="",,"|n"&R1C28&RC[-5])&IF(RC[-2]="",,"|n|n"&RC[-2]) -> |cFFFFFF99基础属性|r|n攻击:5000|n|n用于镶嵌到[剑,衣]上.|n镶嵌后不可取下!|n不需要的宝石可以在宠物处熔炼,用于宝石抽奖.
A20: 1 | B20: C | C20: [宝石] | D20: 碧云石 | O20: 2 | AE20: 用于镶嵌到[剑,衣]上.|n镶嵌后不可取下!|n不需要的宝石可以在宠物处熔炼,用于宝石抽奖. | AF20: =VLOOKUP(RC[-31],Sheet2!R13C1:R19C2,2,0)&"."&VLOOKUP(RC[-30],Sheet2!R7C1:R12C2,2,0)&VLOOKUP(RC[-30],Sheet2!R1C1:R6C2,2,0)&RC[-29]&RC[-28]&RC[-27]&Sheet2!R1C3 -> 一.丙|cFF99FF66[宝石]碧云石|r | AG20: =IF(RC[-26]&RC[-25]&RC[-24]&RC[-23]&RC[-22]&RC[-21]="",,R1C6)&IF(RC[-26]="",,"|n"&R1C7&RC[-26])&IF(RC[-25]="",,"|n"&R1C8&RC[-25])&IF(RC[-24]="",,"|n"&R1C9&RC[-24])&IF(RC[-23]="",,"|n"&R1C10&RC[-23])&IF(RC[-22]="",,"|n"&R1C11&RC[-22])&IF(RC[-21]="",,"|n"&R1C12&RC[-21])&IF(RC[-19]&RC[-18]&RC[-17]&RC[-16]="",,"|n|n"&R1C13)&IF(RC[-19]="",,"|n"&R1C14&RC[-19])&IF(RC[-18]="",,"|n"&R1C15&RC[-18])&IF(RC[-17]="",,"|n"&R1C16&RC[-17])&IF(RC[-16]="",,"|n"&R1C17&RC[-16])&IF(RC[-15]="",,"|n"&R1C18&RC[-15])&IF(RC[-14]="",,"|n"&R1C19&RC[-14])&IF(RC[-13]="",,"|n"&R1C20&RC[-13])&IF(RC[-12]="",,"|n"&R1C21&RC[-12])&IF(RC[-11]="",,"|n"&R1C22&RC[-11])&IF(RC[-10]="",,"|n"&R1C23&RC[-10])&IF(RC[-9]="",,"|n"&R1C24&RC[-9])&IF(RC[-8]="",,"|n"&R1C25&RC[-8])&IF(RC[-7]="",,"|n"&R1C26&RC[-7])&IF(RC[-6]="",,"|n"&R1C27&RC[-6])&IF(RC[-5]="",,"|n"&R1C28&RC[-5])&IF(RC[-2]="",,"|n|n"&RC[-2]) -> |n|n|cFFFFFF55附加属性|r(%)|n攻击吸血:2|n|n用于镶嵌到[剑,衣]上.|n镶嵌后不可取下!|n不需要的宝石可以在宠物处熔炼,用于宝石抽奖.
A21: 1 | B21: C | C21: [宝石] | D21: 仙源石 | K21: 25000 | L21: 100 | AE21: 用于镶嵌到[剑,衣]上.|n镶嵌后不可取下!|n不需要的宝石可以在宠物处熔炼,用于宝石抽奖. | AF21: =VLOOKUP(RC[-31],Sheet2!R13C1:R19C2,2,0)&"."&VLOOKUP(RC[-30],Sheet2!R7C1:R12C2,2,0)&VLOOKUP(RC[-30],Sheet2!R1C1:R6C2,2,0)&RC[-29]&RC[-28]&RC[-27]&Sheet2!R1C3 -> 一.丙|cFF99FF66[宝石]仙源石|r | AG21: =IF(RC[-26]&RC[-25]&RC[-24]&RC[-23]&RC[-22]&RC[-21]="",,R1C6)&IF(RC[-26]="",,"|n"&R1C7&RC[-26])&IF(RC[-25]="",,"|n"&R1C8&RC[-25])&IF(RC[-24]="",,"|n"&R1C9&RC[-24])&IF(RC[-23]="",,"|n"&R1C10&RC[-23])&IF(RC[-22]="",,"|n"&R1C11&RC[-22])&IF(RC[-21]="",,"|n"&R1C12&RC[-21])&IF(RC[-19]&RC[-18]&RC[-17]&RC[-16]="",,"|n|n"&R1C13)&IF(RC[-19]="",,"|n"&R1C14&RC[-19])&IF(RC[-18]="",,"|n"&R1C15&RC[-18])&IF(RC[-17]="",,"|n"&R1C16&RC[-17])&IF(RC[-16]="",,"|n"&R1C17&RC[-16])&IF(RC[-15]="",,"|n"&R1C18&RC[-15])&IF(RC[-14]="",,"|n"&R1C19&RC[-14])&IF(RC[-13]="",,"|n"&R1C20&RC[-13])&IF(RC[-12]="",,"|n"&R1C21&RC[-12])&IF(RC[-11]="",,"|n"&R1C22&RC[-11])&IF(RC[-10]="",,"|n"&R1C23&RC[-10])&IF(RC[-9]="",,"|n"&R1C24&RC[-9])&IF(RC[-8]="",,"|n"&R1C25&RC[-8])&IF(RC[-7]="",,"|n"&R1C26&RC[-7])&IF(RC[-6]="",,"|n"&R1C27&RC[-6])&IF(RC[-5]="",,"|n"&R1C28&RC[-5])&IF(RC[-2]="",,"|n|n"&RC[-2]) -> |cFFFFFF99基础属性|r|n血量:25000|n护甲:100|n|n用于镶嵌到[剑,衣]上.|n镶嵌后不可取下!|n不需要的宝石可以在宠物处熔炼,用于宝石抽奖.
A22: 1 | B22: C | C22: [宝石] | D22: 法性石 | H22: 2000 | I22: 500 | J22: 500 | AE22: 用于镶嵌到[剑,衣]上.|n镶嵌后不可取下!|n不需要的宝石可以在宠物处熔炼,用于宝石抽奖. | AF22: =VLOOKUP(RC[-31],Sheet2!R13C1:R19C2,2,0)&"."&VLOOKUP(RC[-30],Sheet2!R7C1:R12C2,2,0)&VLOOKUP(RC[-30],Sheet2!R1C1:R6C2,2,0)&RC[-29]&RC[-28]&RC[-27]&Sheet2!R1C3 -> 一.丙|cFF99FF66[宝石]法性石|r | AG22: =IF(RC[-26]&RC[-25]&RC[-24]&RC[-23]&RC[-22]&RC[-21]="",,R1C6)&IF(RC[-26]="",,"|n"&R1C7&RC[-26])&IF(RC[-25]="",,"|n"&R1C8&RC[-25])&IF(RC[-24]="",,"|n"&R1C9&RC[-24])&IF(RC[-23]="",,"|n"&R1C10&RC[-23])&IF(RC[-22]="",,"|n"&R1C11&RC[-22])&IF(RC[-21]="",,"|n"&R1C12&RC[-21])&IF(RC[-19]&RC[-18]&RC[-17]&RC[-16]="",,"|n|n"&R1C13)&IF(RC[-19]="",,"|n"&R1C14&RC[-19])&IF(RC[-18]="",,"|n"&R1C15&RC[-18])&IF(RC[-17]="",,"|n"&R1C16&RC[-17])&IF(RC[-16]="",,"|n"&R1C17&RC[-16])&IF(RC[-15]="",,"|n"&R1C18&RC[-15])&IF(RC[-14]="",,"|n"&R1C19&RC[-14])&IF(RC[-13]="",,"|n"&R1C20&RC[-13])&IF(RC[-12]="",,"|n"&R1C21&RC[-12])&IF(RC[-11]="",,"|n"&R1C22&RC[-11])&IF(RC[-10]="",,"|n"&R1C23&RC[-10])&IF(RC[-9]="",,"|n"&R1C24&RC[-9])&IF(RC[-8]="",,"|n"&R1C25&RC[-8])&IF(RC[-7]="",,"|n"&R1C26&RC[-7])&IF(RC[-6]="",,"|n"&R1C27&RC[-6])&IF(RC[-5]="",,"|n"&R1C28&RC[-5])&IF(RC[-2]="",,"|n|n"&RC[-2]) -> |cFFFFFF99基础属性|r|n力量:2000|n敏捷:500|n智力:500|n|n用于镶嵌到[剑,衣]上.|n镶嵌后不可取下!|n不需要的宝石可以在宠物处熔炼,用于宝石抽奖.
A23: 1 | B23: C | C23: [宝石] | D23: 昱暝石 | H23: 500 | I23: 2000 | J23: 500 | AE23: 用于镶嵌到[剑,衣]上.|n镶嵌后不可取下!|n不需要的宝石可以在宠物处熔炼,用于宝石抽奖. | AF23: =VLOOKUP(RC[-31],Sheet2!R13C1:R19C2,2,0)&"."&VLOOKUP(RC[-30],Sheet2!R7C1:R12C2,2,0)&VLOOKUP(RC[-30],Sheet2!R1C1:R6C2,2,0)&RC[-29]&RC[-28]&RC[-27]&Sheet2!R1C3 -> 一.丙|cFF99FF66[宝石]昱暝石|r | AG23: =IF(RC[-26]&RC[-25]&RC[-24]&RC[-23]&RC[-22]&RC[-21]="",,R1C6)&IF(RC[-26]="",,"|n"&R1C7&RC[-26])&IF(RC[-25]="",,"|n"&R1C8&RC[-25])&IF(RC[-24]="",,"|n"&R1C9&RC[-24])&IF(RC[-23]="",,"|n"&R1C10&RC[-23])&IF(RC[-22]="",,"|n"&R1C11&RC[-22])&IF(RC[-21]="",,"|n"&R1C12&RC[-21])&IF(RC[-19]&RC[-18]&RC[-17]&RC[-16]="",,"|n|n"&R1C13)&IF(RC[-19]="",,"|n"&R1C14&RC[-19])&IF(RC[-18]="",,"|n"&R1C15&RC[-18])&IF(RC[-17]="",,"|n"&R1C16&RC[-17])&IF(RC[-16]="",,"|n"&R1C17&RC[-16])&IF(RC[-15]="",,"|n"&R1C18&RC[-15])&IF(RC[-14]="",,"|n"&R1C19&RC[-14])&IF(RC[-13]="",,"|n"&R1C20&RC[-13])&IF(RC[-12]="",,"|n"&R1C21&RC[-12])&IF(RC[-11]="",,"|n"&R1C22&RC[-11])&IF(RC[-10]="",,"|n"&R1C23&RC[-10])&IF(RC[-9]="",,"|n"&R1C24&RC[-9])&IF(RC[-8]="",,"|n"&R1C25&RC[-8])&IF(RC[-7]="",,"|n"&R1C26&RC[-7])&IF(RC[-6]="",,"|n"&R1C27&RC[-6])&IF(RC[-5]="",,"|n"&R1C28&RC[-5])&IF(RC[-2]="",,"|n|n"&RC[-2]) -> |cFFFFFF99基础属性|r|n力量:500|n敏捷:2000|n智力:500|n|n用于镶嵌到[剑,衣]上.|n镶嵌后不可取下!|n不需要的宝石可以在宠物处熔炼,用于宝石抽奖.
A24: 1 | B24: C | C24: [宝石] | D24: 流涂石 | H24: 500 | I24: 500 | J24: 2000 | AE24: 用于镶嵌到[剑,衣]上.|n镶嵌后不可取下!|n不需要的宝石可以在宠物处熔炼,用于宝石抽奖. | AF24: =VLOOKUP(RC[-31],Sheet2!R13C1:R19C2,2,0)&"."&VLOOKUP(RC[-30],Sheet2!R7C1:R12C2,2,0)&VLOOKUP(RC[-30],Sheet2!R1C1:R6C2,2,0)&RC[-29]&RC[-28]&RC[-27]&Sheet2!R1C3 -> 一.丙|cFF99FF66[宝石]流涂石|r | AG24: =IF(RC[-26]&RC[-25]&RC[-24]&RC[-23]&RC[-22]&RC[-21]="",,R1C6)&IF(RC[-26]="",,"|n"&R1C7&RC[-26])&IF(RC[-25]="",,"|n"&R1C8&RC[-25])&IF(RC[-24]="",,"|n"&R1C9&RC[-24])&IF(RC[-23]="",,"|n"&R1C10&RC[-23])&IF(RC[-22]="",,"|n"&R1C11&RC[-22])&IF(RC[-21]="",,"|n"&R1C12&RC[-21])&IF(RC[-19]&RC[-18]&RC[-17]&RC[-16]="",,"|n|n"&R1C13)&IF(RC[-19]="",,"|n"&R1C14&RC[-19])&IF(RC[-18]="",,"|n"&R1C15&RC[-18])&IF(RC[-17]="",,"|n"&R1C16&RC[-17])&IF(RC[-16]="",,"|n"&R1C17&RC[-16])&IF(RC[-15]="",,"|n"&R1C18&RC[-15])&IF(RC[-14]="",,"|n"&R1C19&RC[-14])&IF(RC[-13]="",,"|n"&R1C20&RC[-13])&IF(RC[-12]="",,"|n"&R1C21&RC[-12])&IF(RC[-11]="",,"|n"&R1C22&RC[-11])&IF(RC[-10]="",,"|n"&R1C23&RC[-10])&IF(RC[-9]="",,"|n"&R1C24&RC[-9])&IF(RC[-8]="",,"|n"&R1C25&RC[-8])&IF(RC[-7]="",,"|n"&R1C26&RC[-7])&IF(RC[-6]="",,"|n"&R1C27&RC[-6])&IF(RC[-5]="",,"|n"&R1C28&RC[-5])&IF(RC[-2]="",,"|n|n"&RC[-2]) -> |cFFFFFF99基础属性|r|n力量:500|n敏捷:500|n智力:2000|n|n用于镶嵌到[剑,衣]上.|n镶嵌后不可取下!|n不需要的宝石可以在宠物处熔炼,用于宝石抽奖.
A25: 1 | B25: C | C25: [宝石] | D25: 天浪石 | N25: 15 | AE25: 用于镶嵌到[剑,衣]上.|n镶嵌后不可取下!|n不需要的宝石可以在宠物处熔炼,用于宝石抽奖. | AF25: =VLOOKUP(RC[-31],Sheet2!R13C1:R19C2,2,0)&"."&VLOOKUP(RC[-30],Sheet2!R7C1:R12C2,2,0)&VLOOKUP(RC[-30],Sheet2!R1C1:R6C2,2,0)&RC[-29]&RC[-28]&RC[-27]&Sheet2!R1C3 -> 一.丙|cFF99FF66[宝石]天浪石|r | AG25: =IF(RC[-26]&RC[-25]&RC[-24]&RC[-23]&RC[-22]&RC[-21]="",,R1C6)&IF(RC[-26]="",,"|n"&R1C7&RC[-26])&IF(RC[-25]="",,"|n"&R1C8&RC[-25])&IF(RC[-24]="",,"|n"&R1C9&RC[-24])&IF(RC[-23]="",,"|n"&R1C10&RC[-23])&IF(RC[-22]="",,"|n"&R1C11&RC[-22])&IF(RC[-21]="",,"|n"&R1C12&RC[-21])&IF(RC[-19]&RC[-18]&RC[-17]&RC[-16]="",,"|n|n"&R1C13)&IF(RC[-19]="",,"|n"&R1C14&RC[-19])&IF(RC[-18]="",,"|n"&R1C15&RC[-18])&IF(RC[-17]="",,"|n"&R1C16&RC[-17])&IF(RC[-16]="",,"|n"&R1C17&RC[-16])&IF(RC[-15]="",,"|n"&R1C18&RC[-15])&IF(RC[-14]="",,"|n"&R1C19&RC[-14])&IF(RC[-13]="",,"|n"&R1C20&RC[-13])&IF(RC[-12]="",,"|n"&R1C21&RC[-12])&IF(RC[-11]="",,"|n"&R1C22&RC[-11])&IF(RC[-10]="",,"|n"&R1C23&RC[-10])&IF(RC[-9]="",,"|n"&R1C24&RC[-9])&IF(RC[-8]="",,"|n"&R1C25&RC[-8])&IF(RC[-7]="",,"|n"&R1C26&RC[-7])&IF(RC[-6]="",,"|n"&R1C27&RC[-6])&IF(RC[-5]="",,"|n"&R1C28&RC[-5])&IF(RC[-2]="",,"|n|n"&RC[-2]) -> |n|n|cFFFFFF55附加属性|r(%)|n攻速:15|n|n用于镶嵌到[剑,衣]上.|n镶嵌后不可取下!|n不需要的宝石可以在宠物处熔炼,用于宝石抽奖.
A26: 1 | B26: B | C26: [宝石] | D26: 玄月妖石 | H26: 2500 | L26: 25 | R26: 2 | AE26: 用于镶嵌到[剑,衣]上.|n镶嵌后不可取下!|n不需要的宝石可以在宠物处熔炼,用于宝石抽奖. | AF26: =VLOOKUP(RC[-31],Sheet2!R13C1:R19C2,2,0)&"."&VLOOKUP(RC[-30],Sheet2!R7C1:R12C2,2,0)&VLOOKUP(RC[-30],Sheet2!R1C1:R6C2,2,0)&RC[-29]&RC[-28]&RC[-27]&Sheet2!R1C3 -> 一.乙|cFF1BE6B8[宝石]玄月妖石|r | AG26: =IF(RC[-26]&RC[-25]&RC[-24]&RC[-23]&RC[-22]&RC[-21]="",,R1C6)&IF(RC[-26]="",,"|n"&R1C7&RC[-26])&IF(RC[-25]="",,"|n"&R1C8&RC[-25])&IF(RC[-24]="",,"|n"&R1C9&RC[-24])&IF(RC[-23]="",,"|n"&R1C10&RC[-23])&IF(RC[-22]="",,"|n"&R1C11&RC[-22])&IF(RC[-21]="",,"|n"&R1C12&RC[-21])&IF(RC[-19]&RC[-18]&RC[-17]&RC[-16]="",,"|n|n"&R1C13)&IF(RC[-19]="",,"|n"&R1C14&RC[-19])&IF(RC[-18]="",,"|n"&R1C15&RC[-18])&IF(RC[-17]="",,"|n"&R1C16&RC[-17])&IF(RC[-16]="",,"|n"&R1C17&RC[-16])&IF(RC[-15]="",,"|n"&R1C18&RC[-15])&IF(RC[-14]="",,"|n"&R1C19&RC[-14])&IF(RC[-13]="",,"|n"&R1C20&RC[-13])&IF(RC[-12]="",,"|n"&R1C21&RC[-12])&IF(RC[-11]="",,"|n"&R1C22&RC[-11])&IF(RC[-10]="",,"|n"&R1C23&RC[-10])&IF(RC[-9]="",,"|n"&R1C24&RC[-9])&IF(RC[-8]="",,"|n"&R1C25&RC[-8])&IF(RC[-7]="",,"|n"&R1C26&RC[-7])&IF(RC[-6]="",,"|n"&R1C27&RC[-6])&IF(RC[-5]="",,"|n"&R1C28&RC[-5])&IF(RC[-2]="",,"|n|n"&RC[-2]) -> |cFFFFFF99基础属性|r|n力量:2500|n护甲:25|n伤害增幅:2|n|n用于镶嵌到[剑,衣]上.|n镶嵌后不可取下!|n不需要的宝石可以在宠物处熔炼,用于宝石抽奖.
A27: 1 | B27: B | C27: [宝石] | D27: 断肠毒石 | G27: 6000 | L27: 25 | R27: 2 | AE27: 用于镶嵌到[剑,衣]上.|n镶嵌后不可取下!|n不需要的宝石可以在宠物处熔炼,用于宝石抽奖. | AF27: =VLOOKUP(RC[-31],Sheet2!R13C1:R19C2,2,0)&"."&VLOOKUP(RC[-30],Sheet2!R7C1:R12C2,2,0)&VLOOKUP(RC[-30],Sheet2!R1C1:R6C2,2,0)&RC[-29]&RC[-28]&RC[-27]&Sheet2!R1C3 -> 一.乙|cFF1BE6B8[宝石]断肠毒石|r | AG27: =IF(RC[-26]&RC[-25]&RC[-24]&RC[-23]&RC[-22]&RC[-21]="",,R1C6)&IF(RC[-26]="",,"|n"&R1C7&RC[-26])&IF(RC[-25]="",,"|n"&R1C8&RC[-25])&IF(RC[-24]="",,"|n"&R1C9&RC[-24])&IF(RC[-23]="",,"|n"&R1C10&RC[-23])&IF(RC[-22]="",,"|n"&R1C11&RC[-22])&IF(RC[-21]="",,"|n"&R1C12&RC[-21])&IF(RC[-19]&RC[-18]&RC[-17]&RC[-16]="",,"|n|n"&R1C13)&IF(RC[-19]="",,"|n"&R1C14&RC[-19])&IF(RC[-18]="",,"|n"&R1C15&RC[-18])&IF(RC[-17]="",,"|n"&R1C16&RC[-17])&IF(RC[-16]="",,"|n"&R1C17&RC[-16])&IF(RC[-15]="",,"|n"&R1C18&RC[-15])&IF(RC[-14]="",,"|n"&R1C19&RC[-14])&IF(RC[-13]="",,"|n"&R1C20&RC[-13])&IF(RC[-12]="",,"|n"&R1C21&RC[-12])&IF(RC[-11]="",,"|n"&R1C22&RC[-11])&IF(RC[-10]="",,"|n"&R1C23&RC[-10])&IF(RC[-9]="",,"|n"&R1C24&RC[-9])&IF(RC[-8]="",,"|n"&R1C25&RC[-8])&IF(RC[-7]="",,"|n"&R1C26&RC[-7])&IF(RC[-6]="",,"|n"&R1C27&RC[-6])&IF(RC[-5]="",,"|n"&R1C28&RC[-5])&IF(RC[-2]="",,"|n|n"&RC[-2]) -> |cFFFFFF99基础属性|r|n攻击:6000|n护甲:25|n伤害增幅:2|n|n用于镶嵌到[剑,衣]上.|n镶嵌后不可取下!|n不需要的宝石可以在宠物处熔炼,用于宝石抽奖.
A28: 1 | B28: B | C28: [宝石] | D28: 绫罗魔石 | J28: 2500 | L28: 25 | R28: 2 | AE28: 用于镶嵌到[剑,衣]上.|n镶嵌后不可取下!|n不需要的宝石可以在宠物处熔炼,用于宝石抽奖. | AF28: =VLOOKUP(RC[-31],Sheet2!R13C1:R19C2,2,0)&"."&VLOOKUP(RC[-30],Sheet2!R7C1:R12C2,2,0)&VLOOKUP(RC[-30],Sheet2!R1C1:R6C2,2,0)&RC[-29]&RC[-28]&RC[-27]&Sheet2!R1C3 -> 一.乙|cFF1BE6B8[宝石]绫罗魔石|r | AG28: =IF(RC[-26]&RC[-25]&RC[-24]&RC[-23]&RC[-22]&RC[-21]="",,R1C6)&IF(RC[-26]="",,"|n"&R1C7&RC[-26])&IF(RC[-25]="",,"|n"&R1C8&RC[-25])&IF(RC[-24]="",,"|n"&R1C9&RC[-24])&IF(RC[-23]="",,"|n"&R1C10&RC[-23])&IF(RC[-22]="",,"|n"&R1C11&RC[-22])&IF(RC[-21]="",,"|n"&R1C12&RC[-21])&IF(RC[-19]&RC[-18]&RC[-17]&RC[-16]="",,"|n|n"&R1C13)&IF(RC[-19]="",,"|n"&R1C14&RC[-19])&IF(RC[-18]="",,"|n"&R1C15&RC[-18])&IF(RC[-17]="",,"|n"&R1C16&RC[-17])&IF(RC[-16]="",,"|n"&R1C17&RC[-16])&IF(RC[-15]="",,"|n"&R1C18&RC[-15])&IF(RC[-14]="",,"|n"&R1C19&RC[-14])&IF(RC[-13]="",,"|n"&R1C20&RC[-13])&IF(RC[-12]="",,"|n"&R1C21&RC[-12])&IF(RC[-11]="",,"|n"&R1C22&RC[-11])&IF(RC[-10]="",,"|n"&R1C23&RC[-10])&IF(RC[-9]="",,"|n"&R1C24&RC[-9])&IF(RC[-8]="",,"|n"&R1C25&RC[-8])&IF(RC[-7]="",,"|n"&R1C26&RC[-7])&IF(RC[-6]="",,"|n"&R1C27&RC[-6])&IF(RC[-5]="",,"|n"&R1C28&RC[-5])&IF(RC[-2]="",,"|n|n"&RC[-2]) -> |cFFFFFF99基础属性|r|n智力:2500|n护甲:25|n伤害增幅:2|n|n用于镶嵌到[剑,衣]上.|n镶嵌后不可取下!|n不需要的宝石可以在宠物处熔炼,用于宝石抽奖.
A29: 1 | B29: B | C29: [宝石] | D29: 飞云古石 | I29: 2500 | L29: 25 | R29: 2 | AE29: 用于镶嵌到[剑,衣]上.|n镶嵌后不可取下!|n不需要的宝石可以在宠物处熔炼,用于宝石抽奖. | AF29: =VLOOKUP(RC[-31],Sheet2!R13C1:R19C2,2,0)&"."&VLOOKUP(RC[-30],Sheet2!R7C1:R12C2,2,0)&VLOOKUP(RC[-30],Sheet2!R1C1:R6C2,2,0)&RC[-29]&RC[-28]&RC[-27]&Sheet2!R1C3 -> 一.乙|cFF1BE6B8[宝石]飞云古石|r | AG29: =IF(RC[-26]&RC[-25]&RC[-24]&RC[-23]&RC[-22]&RC[-21]="",,R1C6)&IF(RC[-26]="",,"|n"&R1C7&RC[-26])&IF(RC[-25]="",,"|n"&R1C8&RC[-25])&IF(RC[-24]="",,"|n"&R1C9&RC[-24])&IF(RC[-23]="",,"|n"&R1C10&RC[-23])&IF(RC[-22]="",,"|n"&R1C11&RC[-22])&IF(RC[-21]="",,"|n"&R1C12&RC[-21])&IF(RC[-19]&RC[-18]&RC[-17]&RC[-16]="",,"|n|n"&R1C13)&IF(RC[-19]="",,"|n"&R1C14&RC[-19])&IF(RC[-18]="",,"|n"&R1C15&RC[-18])&IF(RC[-17]="",,"|n"&R1C16&RC[-17])&IF(RC[-16]="",,"|n"&R1C17&RC[-16])&IF(RC[-15]="",,"|n"&R1C18&RC[-15])&IF(RC[-14]="",,"|n"&R1C19&RC[-14])&IF(RC[-13]="",,"|n"&R1C20&RC[-13])&IF(RC[-12]="",,"|n"&R1C21&RC[-12])&IF(RC[-11]="",,"|n"&R1C22&RC[-11])&IF(RC[-10]="",,"|n"&R1C23&RC[-10])&IF(RC[-9]="",,"|n"&R1C24&RC[-9])&IF(RC[-8]="",,"|n"&R1C25&RC[-8])&IF(RC[-7]="",,"|n"&R1C26&RC[-7])&IF(RC[-6]="",,"|n"&R1C27&RC[-6])&IF(RC[-5]="",,"|n"&R1C28&RC[-5])&IF(RC[-2]="",,"|n|n"&RC[-2]) -> |cFFFFFF99基础属性|r|n敏捷:2500|n护甲:25|n伤害增幅:2|n|n用于镶嵌到[剑,衣]上.|n镶嵌后不可取下!|n不需要的宝石可以在宠物处熔炼,用于宝石抽奖.
A30: 1 | B30: A | C30: [宝石] | D30: 风华绝世 | H30: 1200 | I30: 1200 | J30: 1200 | N30: 6 | R30: 4 | AE30: 用于镶嵌到[剑,衣]上.|n镶嵌后不可取下!|n不需要的宝石可以在宠物处熔炼,用于宝石抽奖. | AF30: =VLOOKUP(RC[-31],Sheet2!R13C1:R19C2,2,0)&"."&VLOOKUP(RC[-30],Sheet2!R7C1:R12C2,2,0)&VLOOKUP(RC[-30],Sheet2!R1C1:R6C2,2,0)&RC[-29]&RC[-28]&RC[-27]&Sheet2!R1C3 -> 一.甲|cFF33FF00[宝石]风华绝世|r | AG30: =IF(RC[-26]&RC[-25]&RC[-24]&RC[-23]&RC[-22]&RC[-21]="",,R1C6)&IF(RC[-26]="",,"|n"&R1C7&RC[-26])&IF(RC[-25]="",,"|n"&R1C8&RC[-25])&IF(RC[-24]="",,"|n"&R1C9&RC[-24])&IF(RC[-23]="",,"|n"&R1C10&RC[-23])&IF(RC[-22]="",,"|n"&R1C11&RC[-22])&IF(RC[-21]="",,"|n"&R1C12&RC[-21])&IF(RC[-19]&RC[-18]&RC[-17]&RC[-16]="",,"|n|n"&R1C13)&IF(RC[-19]="",,"|n"&R1C14&RC[-19])&IF(RC[-18]="",,"|n"&R1C15&RC[-18])&IF(RC[-17]="",,"|n"&R1C16&RC[-17])&IF(RC[-16]="",,"|n"&R1C17&RC[-16])&IF(RC[-15]="",,"|n"&R1C18&RC[-15])&IF(RC[-14]="",,"|n"&R1C19&RC[-14])&IF(RC[-13]="",,"|n"&R1C20&RC[-13])&IF(RC[-12]="",,"|n"&R1C21&RC[-12])&IF(RC[-11]="",,"|n"&R1C22&RC[-11])&IF(RC[-10]="",,"|n"&R1C23&RC[-10])&IF(RC[-9]="",,"|n"&R1C24&RC[-9])&IF(RC[-8]="",,"|n"&R1C25&RC[-8])&IF(RC[-7]="",,"|n"&R1C26&RC[-7])&IF(RC[-6]="",,"|n"&R1C27&RC[-6])&IF(RC[-5]="",,"|n"&R1C28&RC[-5])&IF(RC[-2]="",,"|n|n"&RC[-2]) -> |cFFFFFF99基础属性|r|n力量:1200|n敏捷:1200|n智力:1200|n|n|cFFFFFF55附加属性|r(%)|n攻速:6|n伤害增幅:4|n|n用于镶嵌到[剑,衣]上.|n镶嵌后不可取下!|n不需要的宝石可以在宠物处熔炼,用于宝石抽奖.
A31: 1 | B31: A | C31: [宝石] | D31: 金镶玉翠 | G31: 8000 | N31: 6 | R31: 4 | AE31: 用于镶嵌到[剑,衣]上.|n镶嵌后不可取下!|n不需要的宝石可以在宠物处熔炼,用于宝石抽奖. | AF31: =VLOOKUP(RC[-31],Sheet2!R13C1:R19C2,2,0)&"."&VLOOKUP(RC[-30],Sheet2!R7C1:R12C2,2,0)&VLOOKUP(RC[-30],Sheet2!R1C1:R6C2,2,0)&RC[-29]&RC[-28]&RC[-27]&Sheet2!R1C3 -> 一.甲|cFF33FF00[宝石]金镶玉翠|r | AG31: =IF(RC[-26]&RC[-25]&RC[-24]&RC[-23]&RC[-22]&RC[-21]="",,R1C6)&IF(RC[-26]="",,"|n"&R1C7&RC[-26])&IF(RC[-25]="",,"|n"&R1C8&RC[-25])&IF(RC[-24]="",,"|n"&R1C9&RC[-24])&IF(RC[-23]="",,"|n"&R1C10&RC[-23])&IF(RC[-22]="",,"|n"&R1C11&RC[-22])&IF(RC[-21]="",,"|n"&R1C12&RC[-21])&IF(RC[-19]&RC[-18]&RC[-17]&RC[-16]="",,"|n|n"&R1C13)&IF(RC[-19]="",,"|n"&R1C14&RC[-19])&IF(RC[-18]="",,"|n"&R1C15&RC[-18])&IF(RC[-17]="",,"|n"&R1C16&RC[-17])&IF(RC[-16]="",,"|n"&R1C17&RC[-16])&IF(RC[-15]="",,"|n"&R1C18&RC[-15])&IF(RC[-14]="",,"|n"&R1C19&RC[-14])&IF(RC[-13]="",,"|n"&R1C20&RC[-13])&IF(RC[-12]="",,"|n"&R1C21&RC[-12])&IF(RC[-11]="",,"|n"&R1C22&RC[-11])&IF(RC[-10]="",,"|n"&R1C23&RC[-10])&IF(RC[-9]="",,"|n"&R1C24&RC[-9])&IF(RC[-8]="",,"|n"&R1C25&RC[-8])&IF(RC[-7]="",,"|n"&R1C26&RC[-7])&IF(RC[-6]="",,"|n"&R1C27&RC[-6])&IF(RC[-5]="",,"|n"&R1C28&RC[-5])&IF(RC[-2]="",,"|n|n"&RC[-2]) -> |cFFFFFF99基础属性|r|n攻击:8000|n|n|cFFFFFF55附加属性|r(%)|n攻速:6|n伤害增幅:4|n|n用于镶嵌到[剑,衣]上.|n镶嵌后不可取下!|n不需要的宝石可以在宠物处熔炼,用于宝石抽奖.
A32: 1 | B32: S | C32: [宝石] | D32: 释灵渊 - 黑暮 | G32: =IF(R[-2]C<>"",INT(R[-2]C*1.5),"") ->  | K32: 30000 | L32: 150 | M32: =IF(R[-2]C<>"",INT(R[-2]C*1.5),"") ->  | O32: 1 | Q32: =IF(R[-2]C<>"",INT(R[-2]C*1.5),"") ->  | R32: 4 | AE32: 用于镶嵌到[剑,衣]上.|n镶嵌后不可取下!|n不需要的宝石可以在宠物处熔炼,用于宝石抽奖. | AF32: =VLOOKUP(RC[-31],Sheet2!R13C1:R19C2,2,0)&"."&VLOOKUP(RC[-30],Sheet2!R7C1:R12C2,2,0)&VLOOKUP(RC[-30],Sheet2!R1C1:R6C2,2,0)&RC[-29]&RC[-28]&RC[-27]&Sheet2!R1C3 -> 一.绝|cFFFF9933[宝石]释灵渊 - 黑暮|r | AG32: =IF(RC[-26]&RC[-25]&RC[-24]&RC[-23]&RC[-22]&RC[-21]="",,R1C6)&IF(RC[-26]="",,"|n"&R1C7&RC[-26])&IF(RC[-25]="",,"|n"&R1C8&RC[-25])&IF(RC[-24]="",,"|n"&R1C9&RC[-24])&IF(RC[-23]="",,"|n"&R1C10&RC[-23])&IF(RC[-22]="",,"|n"&R1C11&RC[-22])&IF(RC[-21]="",,"|n"&R1C12&RC[-21])&IF(RC[-19]&RC[-18]&RC[-17]&RC[-16]="",,"|n|n"&R1C13)&IF(RC[-19]="",,"|n"&R1C14&RC[-19])&IF(RC[-18]="",,"|n"&R1C15&RC[-18])&IF(RC[-17]="",,"|n"&R1C16&RC[-17])&IF(RC[-16]="",,"|n"&R1C17&RC[-16])&IF(RC[-15]="",,"|n"&R1C18&RC[-15])&IF(RC[-14]="",,"|n"&R1C19&RC[-14])&IF(RC[-13]="",,"|n"&R1C20&RC[-13])&IF(RC[-12]="",,"|n"&R1C21&RC[-12])&IF(RC[-11]="",,"|n"&R1C22&RC[-11])&IF(RC[-10]="",,"|n"&R1C23&RC[-10])&IF(RC[-9]="",,"|n"&R1C24&RC[-9])&IF(RC[-8]="",,"|n"&R1C25&RC[-8])&IF(RC[-7]="",,"|n"&R1C26&RC[-7])&IF(RC[-6]="",,"|n"&R1C27&RC[-6])&IF(RC[-5]="",,"|n"&R1C28&RC[-5])&IF(RC[-2]="",,"|n|n"&RC[-2]) -> |cFFFFFF99基础属性|r|n血量:30000|n护甲:150|n|n|cFFFFFF55附加属性|r(%)|n攻击吸血:1|n伤害增幅:4|n|n用于镶嵌到[剑,衣]上.|n镶嵌后不可取下!|n不需要的宝石可以在宠物处熔炼,用于宝石抽奖.
A33: 1 | B33: S | C33: [宝石] | D33: 释灵渊 - 雷光 | G33: 2500 | M33: =IF(R[-2]C<>"",INT(R[-2]C*1.5),"") ->  | P33: 5 | Q33: 20 | R33: 4 | S33: =IF(R[-2]C<>"",INT(R[-2]C*1.5),"") ->  | AE33: 用于镶嵌到[剑,衣]上.|n镶嵌后不可取下!|n不需要的宝石可以在宠物处熔炼,用于宝石抽奖. | AF33: =VLOOKUP(RC[-31],Sheet2!R13C1:R19C2,2,0)&"."&VLOOKUP(RC[-30],Sheet2!R7C1:R12C2,2,0)&VLOOKUP(RC[-30],Sheet2!R1C1:R6C2,2,0)&RC[-29]&RC[-28]&RC[-27]&Sheet2!R1C3 -> 一.绝|cFFFF9933[宝石]释灵渊 - 雷光|r | AG33: =IF(RC[-26]&RC[-25]&RC[-24]&RC[-23]&RC[-22]&RC[-21]="",,R1C6)&IF(RC[-26]="",,"|n"&R1C7&RC[-26])&IF(RC[-25]="",,"|n"&R1C8&RC[-25])&IF(RC[-24]="",,"|n"&R1C9&RC[-24])&IF(RC[-23]="",,"|n"&R1C10&RC[-23])&IF(RC[-22]="",,"|n"&R1C11&RC[-22])&IF(RC[-21]="",,"|n"&R1C12&RC[-21])&IF(RC[-19]&RC[-18]&RC[-17]&RC[-16]="",,"|n|n"&R1C13)&IF(RC[-19]="",,"|n"&R1C14&RC[-19])&IF(RC[-18]="",,"|n"&R1C15&RC[-18])&IF(RC[-17]="",,"|n"&R1C16&RC[-17])&IF(RC[-16]="",,"|n"&R1C17&RC[-16])&IF(RC[-15]="",,"|n"&R1C18&RC[-15])&IF(RC[-14]="",,"|n"&R1C19&RC[-14])&IF(RC[-13]="",,"|n"&R1C20&RC[-13])&IF(RC[-12]="",,"|n"&R1C21&RC[-12])&IF(RC[-11]="",,"|n"&R1C22&RC[-11])&IF(RC[-10]="",,"|n"&R1C23&RC[-10])&IF(RC[-9]="",,"|n"&R1C24&RC[-9])&IF(RC[-8]="",,"|n"&R1C25&RC[-8])&IF(RC[-7]="",,"|n"&R1C26&RC[-7])&IF(RC[-6]="",,"|n"&R1C27&RC[-6])&IF(RC[-5]="",,"|n"&R1C28&RC[-5])&IF(RC[-2]="",,"|n|n"&RC[-2]) -> |cFFFFFF99基础属性|r|n攻击:2500|n|n|cFFFFFF55附加属性|r(%)|n暴击概率:5|n暴击伤害:20|n伤害增幅:4|n|n用于镶嵌到[剑,衣]上.|n镶嵌后不可取下!|n不需要的宝石可以在宠物处熔炼,用于宝石抽奖.
A34: 1 | B34: X | C34: [宝石] | D34: 上古遗物-无光 | K34: 60000 | L34: 200 | Q34: 20 | R34: 8 | AE34: 用于镶嵌到[剑,衣]上.|n镶嵌后不可取下!|n不需要的宝石可以在宠物处熔炼,用于宝石抽奖. | AF34: =VLOOKUP(RC[-31],Sheet2!R13C1:R19C2,2,0)&"."&VLOOKUP(RC[-30],Sheet2!R7C1:R12C2,2,0)&VLOOKUP(RC[-30],Sheet2!R1C1:R6C2,2,0)&RC[-29]&RC[-28]&RC[-27]&Sheet2!R1C3 -> 一.神|Cffff0000[宝石]上古遗物-无光|r | AG34: =IF(RC[-26]&RC[-25]&RC[-24]&RC[-23]&RC[-22]&RC[-21]="",,R1C6)&IF(RC[-26]="",,"|n"&R1C7&RC[-26])&IF(RC[-25]="",,"|n"&R1C8&RC[-25])&IF(RC[-24]="",,"|n"&R1C9&RC[-24])&IF(RC[-23]="",,"|n"&R1C10&RC[-23])&IF(RC[-22]="",,"|n"&R1C11&RC[-22])&IF(RC[-21]="",,"|n"&R1C12&RC[-21])&IF(RC[-19]&RC[-18]&RC[-17]&RC[-16]="",,"|n|n"&R1C13)&IF(RC[-19]="",,"|n"&R1C14&RC[-19])&IF(RC[-18]="",,"|n"&R1C15&RC[-18])&IF(RC[-17]="",,"|n"&R1C16&RC[-17])&IF(RC[-16]="",,"|n"&R1C17&RC[-16])&IF(RC[-15]="",,"|n"&R1C18&RC[-15])&IF(RC[-14]="",,"|n"&R1C19&RC[-14])&IF(RC[-13]="",,"|n"&R1C20&RC[-13])&IF(RC[-12]="",,"|n"&R1C21&RC[-12])&IF(RC[-11]="",,"|n"&R1C22&RC[-11])&IF(RC[-10]="",,"|n"&R1C23&RC[-10])&IF(RC[-9]="",,"|n"&R1C24&RC[-9])&IF(RC[-8]="",,"|n"&R1C25&RC[-8])&IF(RC[-7]="",,"|n"&R1C26&RC[-7])&IF(RC[-6]="",,"|n"&R1C27&RC[-6])&IF(RC[-5]="",,"|n"&R1C28&RC[-5])&IF(RC[-2]="",,"|n|n"&RC[-2]) -> |cFFFFFF99基础属性|r|n血量:60000|n护甲:200|n|n|cFFFFFF55附加属性|r(%)|n暴击伤害:20|n伤害增幅:8|n|n用于镶嵌到[剑,衣]上.|n镶嵌后不可取下!|n不需要的宝石可以在宠物处熔炼,用于宝石抽奖.
A35: 2 | B35: D | C35: [宝石] | D35: 焚海 | G35: =IF(R[-33]C<>"",R[-33]C*4,"") ->  | H35: =IF(R[-33]C<>"",R[-33]C*4,"") ->  | I35: =IF(R[-33]C<>"",R[-33]C*4,"") ->  | J35: =IF(R[-33]C<>"",R[-33]C*4,"") ->  | K35: =IF(R[-33]C<>"",R[-33]C*4,"") ->  | L35: =IF(R[-33]C<>"",INT(R[-33]C*1.5),"") ->  | M35: =IF(R[-33]C<>"",R[-33]C*2,"") ->  | N35: =IF(R[-33]C<>"",INT(R[-33]C*1.2),"") ->  | O35: =IF(R[-33]C<>"",INT(R[-33]C*1.2),"") ->  | AE35: 用于镶嵌到[剑,衣]上.|n镶嵌后不可取下!|n不需要的宝石可以在宠物处熔炼,用于宝石抽奖. | AF35: =VLOOKUP(RC[-31],Sheet2!R13C1:R19C2,2,0)&"."&VLOOKUP(RC[-30],Sheet2!R7C1:R12C2,2,0)&VLOOKUP(RC[-30],Sheet2!R1C1:R6C2,2,0)&RC[-29]&RC[-28]&RC[-27]&Sheet2!R1C3 -> 二.丁|cFF999999[宝石]焚海|r | AG35: =IF(RC[-26]&RC[-25]&RC[-24]&RC[-23]&RC[-22]&RC[-21]="",,R1C6)&IF(RC[-26]="",,"|n"&R1C7&RC[-26])&IF(RC[-25]="",,"|n"&R1C8&RC[-25])&IF(RC[-24]="",,"|n"&R1C9&RC[-24])&IF(RC[-23]="",,"|n"&R1C10&RC[-23])&IF(RC[-22]="",,"|n"&R1C11&RC[-22])&IF(RC[-21]="",,"|n"&R1C12&RC[-21])&IF(RC[-19]&RC[-18]&RC[-17]&RC[-16]="",,"|n|n"&R1C13)&IF(RC[-19]="",,"|n"&R1C14&RC[-19])&IF(RC[-18]="",,"|n"&R1C15&RC[-18])&IF(RC[-17]="",,"|n"&R1C16&RC[-17])&IF(RC[-16]="",,"|n"&R1C17&RC[-16])&IF(RC[-15]="",,"|n"&R1C18&RC[-15])&IF(RC[-14]="",,"|n"&R1C19&RC[-14])&IF(RC[-13]="",,"|n"&R1C20&RC[-13])&IF(RC[-12]="",,"|n"&R1C21&RC[-12])&IF(RC[-11]="",,"|n"&R1C22&RC[-11])&IF(RC[-10]="",,"|n"&R1C23&RC[-10])&IF(RC[-9]="",,"|n"&R1C24&RC[-9])&IF(RC[-8]="",,"|n"&R1C25&RC[-8])&IF(RC[-7]="",,"|n"&R1C26&RC[-7])&IF(RC[-6]="",,"|n"&R1C27&RC[-6])&IF(RC[-5]="",,"|n"&R1C28&RC[-5])&IF(RC[-2]="",,"|n|n"&RC[-2]) -> |n|n用于镶嵌到[剑,衣]上.|n镶嵌后不可取下!|n不需要的宝石可以在宠物处熔炼,用于宝石抽奖.
A36: 2 | B36: D | C36: [宝石] | D36: 玄冥 | G36: =IF(R[-33]C<>"",R[-33]C*4,"") ->  | H36: =IF(R[-33]C<>"",R[-33]C*4,"") ->  | I36: =IF(R[-33]C<>"",R[-33]C*4,"") ->  | J36: =IF(R[-33]C<>"",R[-33]C*4,"") ->  | K36: =IF(R[-33]C<>"",R[-33]C*4,"") ->  | L36: =IF(R[-33]C<>"",INT(R[-33]C*1.5),"") ->  | M36: =IF(R[-33]C<>"",R[-33]C*2,"") ->  | N36: =IF(R[-33]C<>"",INT(R[-33]C*1.2),"") ->  | O36: =IF(R[-33]C<>"",INT(R[-33]C*1.2),"") ->  | AE36: 用于镶嵌到[剑,衣]上.|n镶嵌后不可取下!|n不需要的宝石可以在宠物处熔炼,用于宝石抽奖. | AF36: =VLOOKUP(RC[-31],Sheet2!R13C1:R19C2,2,0)&"."&VLOOKUP(RC[-30],Sheet2!R7C1:R12C2,2,0)&VLOOKUP(RC[-30],Sheet2!R1C1:R6C2,2,0)&RC[-29]&RC[-28]&RC[-27]&Sheet2!R1C3 -> 二.丁|cFF999999[宝石]玄冥|r | AG36: =IF(RC[-26]&RC[-25]&RC[-24]&RC[-23]&RC[-22]&RC[-21]="",,R1C6)&IF(RC[-26]="",,"|n"&R1C7&RC[-26])&IF(RC[-25]="",,"|n"&R1C8&RC[-25])&IF(RC[-24]="",,"|n"&R1C9&RC[-24])&IF(RC[-23]="",,"|n"&R1C10&RC[-23])&IF(RC[-22]="",,"|n"&R1C11&RC[-22])&IF(RC[-21]="",,"|n"&R1C12&RC[-21])&IF(RC[-19]&RC[-18]&RC[-17]&RC[-16]="",,"|n|n"&R1C13)&IF(RC[-19]="",,"|n"&R1C14&RC[-19])&IF(RC[-18]="",,"|n"&R1C15&RC[-18])&IF(RC[-17]="",,"|n"&R1C16&RC[-17])&IF(RC[-16]="",,"|n"&R1C17&RC[-16])&IF(RC[-15]="",,"|n"&R1C18&RC[-15])&IF(RC[-14]="",,"|n"&R1C19&RC[-14])&IF(RC[-13]="",,"|n"&R1C20&RC[-13])&IF(RC[-12]="",,"|n"&R1C21&RC[-12])&IF(RC[-11]="",,"|n"&R1C22&RC[-11])&IF(RC[-10]="",,"|n"&R1C23&RC[-10])&IF(RC[-9]="",,"|n"&R1C24&RC[-9])&IF(RC[-8]="",,"|n"&R1C25&RC[-8])&IF(RC[-7]="",,"|n"&R1C26&RC[-7])&IF(RC[-6]="",,"|n"&R1C27&RC[-6])&IF(RC[-5]="",,"|n"&R1C28&RC[-5])&IF(RC[-2]="",,"|n|n"&RC[-2]) -> |n|n用于镶嵌到[剑,衣]上.|n镶嵌后不可取下!|n不需要的宝石可以在宠物处熔炼,用于宝石抽奖.
A37: 2 | B37: D | C37: [宝石] | D37: 风雷 | G37: =IF(R[-33]C<>"",R[-33]C*4,"") ->  | H37: =IF(R[-33]C<>"",R[-33]C*4,"") ->  | I37: =IF(R[-33]C<>"",R[-33]C*4,"") ->  | J37: =IF(R[-33]C<>"",R[-33]C*4,"") ->  | K37: =IF(R[-33]C<>"",R[-33]C*4,"") ->  | L37: =IF(R[-33]C<>"",INT(R[-33]C*1.5),"") ->  | M37: =IF(R[-33]C<>"",R[-33]C*2,"") ->  | N37: =IF(R[-33]C<>"",INT(R[-33]C*1.2),"") ->  | O37: =IF(R[-33]C<>"",INT(R[-33]C*1.2),"") ->  | AE37: 用于镶嵌到[剑,衣]上.|n镶嵌后不可取下!|n不需要的宝石可以在宠物处熔炼,用于宝石抽奖. | AF37: =VLOOKUP(RC[-31],Sheet2!R13C1:R19C2,2,0)&"."&VLOOKUP(RC[-30],Sheet2!R7C1:R12C2,2,0)&VLOOKUP(RC[-30],Sheet2!R1C1:R6C2,2,0)&RC[-29]&RC[-28]&RC[-27]&Sheet2!R1C3 -> 二.丁|cFF999999[宝石]风雷|r | AG37: =IF(RC[-26]&RC[-25]&RC[-24]&RC[-23]&RC[-22]&RC[-21]="",,R1C6)&IF(RC[-26]="",,"|n"&R1C7&RC[-26])&IF(RC[-25]="",,"|n"&R1C8&RC[-25])&IF(RC[-24]="",,"|n"&R1C9&RC[-24])&IF(RC[-23]="",,"|n"&R1C10&RC[-23])&IF(RC[-22]="",,"|n"&R1C11&RC[-22])&IF(RC[-21]="",,"|n"&R1C12&RC[-21])&IF(RC[-19]&RC[-18]&RC[-17]&RC[-16]="",,"|n|n"&R1C13)&IF(RC[-19]="",,"|n"&R1C14&RC[-19])&IF(RC[-18]="",,"|n"&R1C15&RC[-18])&IF(RC[-17]="",,"|n"&R1C16&RC[-17])&IF(RC[-16]="",,"|n"&R1C17&RC[-16])&IF(RC[-15]="",,"|n"&R1C18&RC[-15])&IF(RC[-14]="",,"|n"&R1C19&RC[-14])&IF(RC[-13]="",,"|n"&R1C20&RC[-13])&IF(RC[-12]="",,"|n"&R1C21&RC[-12])&IF(RC[-11]="",,"|n"&R1C22&RC[-11])&IF(RC[-10]="",,"|n"&R1C23&RC[-10])&IF(RC[-9]="",,"|n"&R1C24&RC[-9])&IF(RC[-8]="",,"|n"&R1C25&RC[-8])&IF(RC[-7]="",,"|n"&R1C26&RC[-7])&IF(RC[-6]="",,"|n"&R1C27&RC[-6])&IF(RC[-5]="",,"|n"&R1C28&RC[-5])&IF(RC[-2]="",,"|n|n"&RC[-2]) -> |n|n用于镶嵌到[剑,衣]上.|n镶嵌后不可取下!|n不需要的宝石可以在宠物处熔炼,用于宝石抽奖.
A38: 2 | B38: D | C38: [宝石] | D38: 乾坤 | G38: =IF(R[-33]C<>"",R[-33]C*4,"") ->  | H38: =IF(R[-33]C<>"",R[-33]C*4,"") ->  | I38: =IF(R[-33]C<>"",R[-33]C*4,"") ->  | J38: =IF(R[-33]C<>"",R[-33]C*4,"") ->  | K38: =IF(R[-33]C<>"",R[-33]C*4,"") ->  | L38: =IF(R[-33]C<>"",INT(R[-33]C*1.5),"") ->  | M38: =IF(R[-33]C<>"",R[-33]C*2,"") ->  | N38: =IF(R[-33]C<>"",INT(R[-33]C*1.2),"") ->  | O38: =IF(R[-33]C<>"",INT(R[-33]C*1.2),"") ->  | AE38: 用于镶嵌到[剑,衣]上.|n镶嵌后不可取下!|n不需要的宝石可以在宠物处熔炼,用于宝石抽奖. | AF38: =VLOOKUP(RC[-31],Sheet2!R13C1:R19C2,2,0)&"."&VLOOKUP(RC[-30],Sheet2!R7C1:R12C2,2,0)&VLOOKUP(RC[-30],Sheet2!R1C1:R6C2,2,0)&RC[-29]&RC[-28]&RC[-27]&Sheet2!R1C3 -> 二.丁|cFF999999[宝石]乾坤|r | AG38: =IF(RC[-26]&RC[-25]&RC[-24]&RC[-23]&RC[-22]&RC[-21]="",,R1C6)&IF(RC[-26]="",,"|n"&R1C7&RC[-26])&IF(RC[-25]="",,"|n"&R1C8&RC[-25])&IF(RC[-24]="",,"|n"&R1C9&RC[-24])&IF(RC[-23]="",,"|n"&R1C10&RC[-23])&IF(RC[-22]="",,"|n"&R1C11&RC[-22])&IF(RC[-21]="",,"|n"&R1C12&RC[-21])&IF(RC[-19]&RC[-18]&RC[-17]&RC[-16]="",,"|n|n"&R1C13)&IF(RC[-19]="",,"|n"&R1C14&RC[-19])&IF(RC[-18]="",,"|n"&R1C15&RC[-18])&IF(RC[-17]="",,"|n"&R1C16&RC[-17])&IF(RC[-16]="",,"|n"&R1C17&RC[-16])&IF(RC[-15]="",,"|n"&R1C18&RC[-15])&IF(RC[-14]="",,"|n"&R1C19&RC[-14])&IF(RC[-13]="",,"|n"&R1C20&RC[-13])&IF(RC[-12]="",,"|n"&R1C21&RC[-12])&IF(RC[-11]="",,"|n"&R1C22&RC[-11])&IF(RC[-10]="",,"|n"&R1C23&RC[-10])&IF(RC[-9]="",,"|n"&R1C24&RC[-9])&IF(RC[-8]="",,"|n"&R1C25&RC[-8])&IF(RC[-7]="",,"|n"&R1C26&RC[-7])&IF(RC[-6]="",,"|n"&R1C27&RC[-6])&IF(RC[-5]="",,"|n"&R1C28&RC[-5])&IF(RC[-2]="",,"|n|n"&RC[-2]) -> |n|n用于镶嵌到[剑,衣]上.|n镶嵌后不可取下!|n不需要的宝石可以在宠物处熔炼,用于宝石抽奖.
A39: 2 | B39: D | C39: [宝石] | D39: 白骨 | G39: =IF(R[-33]C<>"",R[-33]C*4,"") ->  | H39: =IF(R[-33]C<>"",R[-33]C*4,"") ->  | I39: =IF(R[-33]C<>"",R[-33]C*4,"") ->  | J39: =IF(R[-33]C<>"",R[-33]C*4,"") ->  | K39: =IF(R[-33]C<>"",R[-33]C*4,"") ->  | L39: =IF(R[-33]C<>"",INT(R[-33]C*1.5),"") ->  | M39: =IF(R[-33]C<>"",R[-33]C*2,"") ->  | N39: =IF(R[-33]C<>"",INT(R[-33]C*1.2),"") ->  | O39: =IF(R[-33]C<>"",INT(R[-33]C*1.2),"") ->  | AE39: 用于镶嵌到[剑,衣]上.|n镶嵌后不可取下!|n不需要的宝石可以在宠物处熔炼,用于宝石抽奖. | AF39: =VLOOKUP(RC[-31],Sheet2!R13C1:R19C2,2,0)&"."&VLOOKUP(RC[-30],Sheet2!R7C1:R12C2,2,0)&VLOOKUP(RC[-30],Sheet2!R1C1:R6C2,2,0)&RC[-29]&RC[-28]&RC[-27]&Sheet2!R1C3 -> 二.丁|cFF999999[宝石]白骨|r | AG39: =IF(RC[-26]&RC[-25]&RC[-24]&RC[-23]&RC[-22]&RC[-21]="",,R1C6)&IF(RC[-26]="",,"|n"&R1C7&RC[-26])&IF(RC[-25]="",,"|n"&R1C8&RC[-25])&IF(RC[-24]="",,"|n"&R1C9&RC[-24])&IF(RC[-23]="",,"|n"&R1C10&RC[-23])&IF(RC[-22]="",,"|n"&R1C11&RC[-22])&IF(RC[-21]="",,"|n"&R1C12&RC[-21])&IF(RC[-19]&RC[-18]&RC[-17]&RC[-16]="",,"|n|n"&R1C13)&IF(RC[-19]="",,"|n"&R1C14&RC[-19])&IF(RC[-18]="",,"|n"&R1C15&RC[-18])&IF(RC[-17]="",,"|n"&R1C16&RC[-17])&IF(RC[-16]="",,"|n"&R1C17&RC[-16])&IF(RC[-15]="",,"|n"&R1C18&RC[-15])&IF(RC[-14]="",,"|n"&R1C19&RC[-14])&IF(RC[-13]="",,"|n"&R1C20&RC[-13])&IF(RC[-12]="",,"|n"&R1C21&RC[-12])&IF(RC[-11]="",,"|n"&R1C22&RC[-11])&IF(RC[-10]="",,"|n"&R1C23&RC[-10])&IF(RC[-9]="",,"|n"&R1C24&RC[-9])&IF(RC[-8]="",,"|n"&R1C25&RC[-8])&IF(RC[-7]="",,"|n"&R1C26&RC[-7])&IF(RC[-6]="",,"|n"&R1C27&RC[-6])&IF(RC[-5]="",,"|n"&R1C28&RC[-5])&IF(RC[-2]="",,"|n|n"&RC[-2]) -> |n|n用于镶嵌到[剑,衣]上.|n镶嵌后不可取下!|n不需要的宝石可以在宠物处熔炼,用于宝石抽奖.
A40: 2 | B40: D | C40: [宝石] | D40: 凝霜 | G40: =IF(R[-33]C<>"",R[-33]C*4,"") ->  | H40: =IF(R[-33]C<>"",R[-33]C*4,"") ->  | I40: =IF(R[-33]C<>"",R[-33]C*4,"") ->  | J40: =IF(R[-33]C<>"",R[-33]C*4,"") ->  | K40: =IF(R[-33]C<>"",R[-33]C*4,"") ->  | L40: =IF(R[-33]C<>"",INT(R[-33]C*1.5),"") ->  | M40: =IF(R[-33]C<>"",R[-33]C*2,"") ->  | N40: =IF(R[-33]C<>"",INT(R[-33]C*1.2),"") ->  | O40: =IF(R[-33]C<>"",INT(R[-33]C*1.2),"") ->  | AE40: 用于镶嵌到[剑,衣]上.|n镶嵌后不可取下!|n不需要的宝石可以在宠物处熔炼,用于宝石抽奖. | AF40: =VLOOKUP(RC[-31],Sheet2!R13C1:R19C2,2,0)&"."&VLOOKUP(RC[-30],Sheet2!R7C1:R12C2,2,0)&VLOOKUP(RC[-30],Sheet2!R1C1:R6C2,2,0)&RC[-29]&RC[-28]&RC[-27]&Sheet2!R1C3 -> 二.丁|cFF999999[宝石]凝霜|r | AG40: =IF(RC[-26]&RC[-25]&RC[-24]&RC[-23]&RC[-22]&RC[-21]="",,R1C6)&IF(RC[-26]="",,"|n"&R1C7&RC[-26])&IF(RC[-25]="",,"|n"&R1C8&RC[-25])&IF(RC[-24]="",,"|n"&R1C9&RC[-24])&IF(RC[-23]="",,"|n"&R1C10&RC[-23])&IF(RC[-22]="",,"|n"&R1C11&RC[-22])&IF(RC[-21]="",,"|n"&R1C12&RC[-21])&IF(RC[-19]&RC[-18]&RC[-17]&RC[-16]="",,"|n|n"&R1C13)&IF(RC[-19]="",,"|n"&R1C14&RC[-19])&IF(RC[-18]="",,"|n"&R1C15&RC[-18])&IF(RC[-17]="",,"|n"&R1C16&RC[-17])&IF(RC[-16]="",,"|n"&R1C17&RC[-16])&IF(RC[-15]="",,"|n"&R1C18&RC[-15])&IF(RC[-14]="",,"|n"&R1C19&RC[-14])&IF(RC[-13]="",,"|n"&R1C20&RC[-13])&IF(RC[-12]="",,"|n"&R1C21&RC[-12])&IF(RC[-11]="",,"|n"&R1C22&RC[-11])&IF(RC[-10]="",,"|n"&R1C23&RC[-10])&IF(RC[-9]="",,"|n"&R1C24&RC[-9])&IF(RC[-8]="",,"|n"&R1C25&RC[-8])&IF(RC[-7]="",,"|n"&R1C26&RC[-7])&IF(RC[-6]="",,"|n"&R1C27&RC[-6])&IF(RC[-5]="",,"|n"&R1C28&RC[-5])&IF(RC[-2]="",,"|n|n"&RC[-2]) -> |n|n用于镶嵌到[剑,衣]上.|n镶嵌后不可取下!|n不需要的宝石可以在宠物处熔炼,用于宝石抽奖.
A41: 2 | B41: D | C41: [宝石] | D41: 狂龙 | G41: =IF(R[-33]C<>"",R[-33]C*4,"") ->  | H41: =IF(R[-33]C<>"",R[-33]C*4,"") ->  | I41: =IF(R[-33]C<>"",R[-33]C*4,"") ->  | J41: =IF(R[-33]C<>"",R[-33]C*4,"") ->  | K41: =IF(R[-33]C<>"",R[-33]C*4,"") ->  | L41: =IF(R[-33]C<>"",INT(R[-33]C*1.5),"") ->  | M41: =IF(R[-33]C<>"",R[-33]C*2,"") ->  | N41: =IF(R[-33]C<>"",INT(R[-33]C*1.2),"") ->  | O41: =IF(R[-33]C<>"",INT(R[-33]C*1.2),"") ->  | AE41: 用于镶嵌到[剑,衣]上.|n镶嵌后不可取下!|n不需要的宝石可以在宠物处熔炼,用于宝石抽奖. | AF41: =VLOOKUP(RC[-31],Sheet2!R13C1:R19C2,2,0)&"."&VLOOKUP(RC[-30],Sheet2!R7C1:R12C2,2,0)&VLOOKUP(RC[-30],Sheet2!R1C1:R6C2,2,0)&RC[-29]&RC[-28]&RC[-27]&Sheet2!R1C3 -> 二.丁|cFF999999[宝石]狂龙|r | AG41: =IF(RC[-26]&RC[-25]&RC[-24]&RC[-23]&RC[-22]&RC[-21]="",,R1C6)&IF(RC[-26]="",,"|n"&R1C7&RC[-26])&IF(RC[-25]="",,"|n"&R1C8&RC[-25])&IF(RC[-24]="",,"|n"&R1C9&RC[-24])&IF(RC[-23]="",,"|n"&R1C10&RC[-23])&IF(RC[-22]="",,"|n"&R1C11&RC[-22])&IF(RC[-21]="",,"|n"&R1C12&RC[-21])&IF(RC[-19]&RC[-18]&RC[-17]&RC[-16]="",,"|n|n"&R1C13)&IF(RC[-19]="",,"|n"&R1C14&RC[-19])&IF(RC[-18]="",,"|n"&R1C15&RC[-18])&IF(RC[-17]="",,"|n"&R1C16&RC[-17])&IF(RC[-16]="",,"|n"&R1C17&RC[-16])&IF(RC[-15]="",,"|n"&R1C18&RC[-15])&IF(RC[-14]="",,"|n"&R1C19&RC[-14])&IF(RC[-13]="",,"|n"&R1C20&RC[-13])&IF(RC[-12]="",,"|n"&R1C21&RC[-12])&IF(RC[-11]="",,"|n"&R1C22&RC[-11])&IF(RC[-10]="",,"|n"&R1C23&RC[-10])&IF(RC[-9]="",,"|n"&R1C24&RC[-9])&IF(RC[-8]="",,"|n"&R1C25&RC[-8])&IF(RC[-7]="",,"|n"&R1C26&RC[-7])&IF(RC[-6]="",,"|n"&R1C27&RC[-6])&IF(RC[-5]="",,"|n"&R1C28&RC[-5])&IF(RC[-2]="",,"|n|n"&RC[-2]) -> |n|n用于镶嵌到[剑,衣]上.|n镶嵌后不可取下!|n不需要的宝石可以在宠物处熔炼,用于宝石抽奖.
A42: 2 | B42: D | C42: [宝石] | D42: 龙林 | G42: =IF(R[-33]C<>"",R[-33]C*4,"") ->  | H42: =IF(R[-33]C<>"",R[-33]C*4,"") ->  | I42: =IF(R[-33]C<>"",R[-33]C*4,"") ->  | J42: =IF(R[-33]C<>"",R[-33]C*4,"") ->  | K42: =IF(R[-33]C<>"",R[-33]C*4,"") ->  | L42: =IF(R[-33]C<>"",INT(R[-33]C*1.5),"") ->  | M42: =IF(R[-33]C<>"",R[-33]C*2,"") ->  | N42: =IF(R[-33]C<>"",INT(R[-33]C*1.2),"") ->  | O42: =IF(R[-33]C<>"",INT(R[-33]C*1.2),"") ->  | AE42: 用于镶嵌到[剑,衣]上.|n镶嵌后不可取下!|n不需要的宝石可以在宠物处熔炼,用于宝石抽奖. | AF42: =VLOOKUP(RC[-31],Sheet2!R13C1:R19C2,2,0)&"."&VLOOKUP(RC[-30],Sheet2!R7C1:R12C2,2,0)&VLOOKUP(RC[-30],Sheet2!R1C1:R6C2,2,0)&RC[-29]&RC[-28]&RC[-27]&Sheet2!R1C3 -> 二.丁|cFF999999[宝石]龙林|r | AG42: =IF(RC[-26]&RC[-25]&RC[-24]&RC[-23]&RC[-22]&RC[-21]="",,R1C6)&IF(RC[-26]="",,"|n"&R1C7&RC[-26])&IF(RC[-25]="",,"|n"&R1C8&RC[-25])&IF(RC[-24]="",,"|n"&R1C9&RC[-24])&IF(RC[-23]="",,"|n"&R1C10&RC[-23])&IF(RC[-22]="",,"|n"&R1C11&RC[-22])&IF(RC[-21]="",,"|n"&R1C12&RC[-21])&IF(RC[-19]&RC[-18]&RC[-17]&RC[-16]="",,"|n|n"&R1C13)&IF(RC[-19]="",,"|n"&R1C14&RC[-19])&IF(RC[-18]="",,"|n"&R1C15&RC[-18])&IF(RC[-17]="",,"|n"&R1C16&RC[-17])&IF(RC[-16]="",,"|n"&R1C17&RC[-16])&IF(RC[-15]="",,"|n"&R1C18&RC[-15])&IF(RC[-14]="",,"|n"&R1C19&RC[-14])&IF(RC[-13]="",,"|n"&R1C20&RC[-13])&IF(RC[-12]="",,"|n"&R1C21&RC[-12])&IF(RC[-11]="",,"|n"&R1C22&RC[-11])&IF(RC[-10]="",,"|n"&R1C23&RC[-10])&IF(RC[-9]="",,"|n"&R1C24&RC[-9])&IF(RC[-8]="",,"|n"&R1C25&RC[-8])&IF(RC[-7]="",,"|n"&R1C26&RC[-7])&IF(RC[-6]="",,"|n"&R1C27&RC[-6])&IF(RC[-5]="",,"|n"&R1C28&RC[-5])&IF(RC[-2]="",,"|n|n"&RC[-2]) -> |n|n用于镶嵌到[剑,衣]上.|n镶嵌后不可取下!|n不需要的宝石可以在宠物处熔炼,用于宝石抽奖.
A43: 2 | B43: D | C43: [宝石] | D43: 闇黑 | G43: =IF(R[-33]C<>"",R[-33]C*4,"") ->  | H43: =IF(R[-33]C<>"",R[-33]C*4,"") ->  | I43: =IF(R[-33]C<>"",R[-33]C*4,"") ->  | J43: =IF(R[-33]C<>"",R[-33]C*4,"") ->  | K43: =IF(R[-33]C<>"",R[-33]C*4,"") ->  | L43: =IF(R[-33]C<>"",INT(R[-33]C*1.5),"") ->  | M43: =IF(R[-33]C<>"",R[-33]C*2,"") ->  | N43: =IF(R[-33]C<>"",INT(R[-33]C*1.2),"") ->  | O43: =IF(R[-33]C<>"",INT(R[-33]C*1.2),"") ->  | AE43: 用于镶嵌到[剑,衣]上.|n镶嵌后不可取下!|n不需要的宝石可以在宠物处熔炼,用于宝石抽奖. | AF43: =VLOOKUP(RC[-31],Sheet2!R13C1:R19C2,2,0)&"."&VLOOKUP(RC[-30],Sheet2!R7C1:R12C2,2,0)&VLOOKUP(RC[-30],Sheet2!R1C1:R6C2,2,0)&RC[-29]&RC[-28]&RC[-27]&Sheet2!R1C3 -> 二.丁|cFF999999[宝石]闇黑|r | AG43: =IF(RC[-26]&RC[-25]&RC[-24]&RC[-23]&RC[-22]&RC[-21]="",,R1C6)&IF(RC[-26]="",,"|n"&R1C7&RC[-26])&IF(RC[-25]="",,"|n"&R1C8&RC[-25])&IF(RC[-24]="",,"|n"&R1C9&RC[-24])&IF(RC[-23]="",,"|n"&R1C10&RC[-23])&IF(RC[-22]="",,"|n"&R1C11&RC[-22])&IF(RC[-21]="",,"|n"&R1C12&RC[-21])&IF(RC[-19]&RC[-18]&RC[-17]&RC[-16]="",,"|n|n"&R1C13)&IF(RC[-19]="",,"|n"&R1C14&RC[-19])&IF(RC[-18]="",,"|n"&R1C15&RC[-18])&IF(RC[-17]="",,"|n"&R1C16&RC[-17])&IF(RC[-16]="",,"|n"&R1C17&RC[-16])&IF(RC[-15]="",,"|n"&R1C18&RC[-15])&IF(RC[-14]="",,"|n"&R1C19&RC[-14])&IF(RC[-13]="",,"|n"&R1C20&RC[-13])&IF(RC[-12]="",,"|n"&R1C21&RC[-12])&IF(RC[-11]="",,"|n"&R1C22&RC[-11])&IF(RC[-10]="",,"|n"&R1C23&RC[-10])&IF(RC[-9]="",,"|n"&R1C24&RC[-9])&IF(RC[-8]="",,"|n"&R1C25&RC[-8])&IF(RC[-7]="",,"|n"&R1C26&RC[-7])&IF(RC[-6]="",,"|n"&R1C27&RC[-6])&IF(RC[-5]="",,"|n"&R1C28&RC[-5])&IF(RC[-2]="",,"|n|n"&RC[-2]) -> |n|n用于镶嵌到[剑,衣]上.|n镶嵌后不可取下!|n不需要的宝石可以在宠物处熔炼,用于宝石抽奖.
A44: 2 | B44: D | C44: [宝石] | D44: 儒风 | G44: =IF(R[-33]C<>"",R[-33]C*4,"") ->  | H44: =IF(R[-33]C<>"",R[-33]C*4,"") ->  | I44: =IF(R[-33]C<>"",R[-33]C*4,"") ->  | J44: =IF(R[-33]C<>"",R[-33]C*4,"") ->  | K44: =IF(R[-33]C<>"",R[-33]C*4,"") ->  | L44: =IF(R[-33]C<>"",INT(R[-33]C*1.5),"") ->  | M44: =IF(R[-33]C<>"",R[-33]C*2,"") ->  | N44: =IF(R[-33]C<>"",INT(R[-33]C*1.2),"") ->  | O44: =IF(R[-33]C<>"",INT(R[-33]C*1.2),"") ->  | AE44: 用于镶嵌到[剑,衣]上.|n镶嵌后不可取下!|n不需要的宝石可以在宠物处熔炼,用于宝石抽奖. | AF44: =VLOOKUP(RC[-31],Sheet2!R13C1:R19C2,2,0)&"."&VLOOKUP(RC[-30],Sheet2!R7C1:R12C2,2,0)&VLOOKUP(RC[-30],Sheet2!R1C1:R6C2,2,0)&RC[-29]&RC[-28]&RC[-27]&Sheet2!R1C3 -> 二.丁|cFF999999[宝石]儒风|r | AG44: =IF(RC[-26]&RC[-25]&RC[-24]&RC[-23]&RC[-22]&RC[-21]="",,R1C6)&IF(RC[-26]="",,"|n"&R1C7&RC[-26])&IF(RC[-25]="",,"|n"&R1C8&RC[-25])&IF(RC[-24]="",,"|n"&R1C9&RC[-24])&IF(RC[-23]="",,"|n"&R1C10&RC[-23])&IF(RC[-22]="",,"|n"&R1C11&RC[-22])&IF(RC[-21]="",,"|n"&R1C12&RC[-21])&IF(RC[-19]&RC[-18]&RC[-17]&RC[-16]="",,"|n|n"&R1C13)&IF(RC[-19]="",,"|n"&R1C14&RC[-19])&IF(RC[-18]="",,"|n"&R1C15&RC[-18])&IF(RC[-17]="",,"|n"&R1C16&RC[-17])&IF(RC[-16]="",,"|n"&R1C17&RC[-16])&IF(RC[-15]="",,"|n"&R1C18&RC[-15])&IF(RC[-14]="",,"|n"&R1C19&RC[-14])&IF(RC[-13]="",,"|n"&R1C20&RC[-13])&IF(RC[-12]="",,"|n"&R1C21&RC[-12])&IF(RC[-11]="",,"|n"&R1C22&RC[-11])&IF(RC[-10]="",,"|n"&R1C23&RC[-10])&IF(RC[-9]="",,"|n"&R1C24&RC[-9])&IF(RC[-8]="",,"|n"&R1C25&RC[-8])&IF(RC[-7]="",,"|n"&R1C26&RC[-7])&IF(RC[-6]="",,"|n"&R1C27&RC[-6])&IF(RC[-5]="",,"|n"&R1C28&RC[-5])&IF(RC[-2]="",,"|n|n"&RC[-2]) -> |n|n用于镶嵌到[剑,衣]上.|n镶嵌后不可取下!|n不需要的宝石可以在宠物处熔炼,用于宝石抽奖.
A45: 2 | B45: D | C45: [宝石] | D45: 风雨 | G45: =IF(R[-33]C<>"",R[-33]C*4,"") ->  | H45: =IF(R[-33]C<>"",R[-33]C*4,"") ->  | I45: =IF(R[-33]C<>"",R[-33]C*4,"") ->  | J45: =IF(R[-33]C<>"",R[-33]C*4,"") ->  | K45: =IF(R[-33]C<>"",R[-33]C*4,"") ->  | L45: =IF(R[-33]C<>"",INT(R[-33]C*1.5),"") ->  | M45: =IF(R[-33]C<>"",R[-33]C*2,"") ->  | N45: =IF(R[-33]C<>"",INT(R[-33]C*1.2),"") ->  | O45: =IF(R[-33]C<>"",INT(R[-33]C*1.2),"") ->  | AE45: 用于镶嵌到[剑,衣]上.|n镶嵌后不可取下!|n不需要的宝石可以在宠物处熔炼,用于宝石抽奖. | AF45: =VLOOKUP(RC[-31],Sheet2!R13C1:R19C2,2,0)&"."&VLOOKUP(RC[-30],Sheet2!R7C1:R12C2,2,0)&VLOOKUP(RC[-30],Sheet2!R1C1:R6C2,2,0)&RC[-29]&RC[-28]&RC[-27]&Sheet2!R1C3 -> 二.丁|cFF999999[宝石]风雨|r | AG45: =IF(RC[-26]&RC[-25]&RC[-24]&RC[-23]&RC[-22]&RC[-21]="",,R1C6)&IF(RC[-26]="",,"|n"&R1C7&RC[-26])&IF(RC[-25]="",,"|n"&R1C8&RC[-25])&IF(RC[-24]="",,"|n"&R1C9&RC[-24])&IF(RC[-23]="",,"|n"&R1C10&RC[-23])&IF(RC[-22]="",,"|n"&R1C11&RC[-22])&IF(RC[-21]="",,"|n"&R1C12&RC[-21])&IF(RC[-19]&RC[-18]&RC[-17]&RC[-16]="",,"|n|n"&R1C13)&IF(RC[-19]="",,"|n"&R1C14&RC[-19])&IF(RC[-18]="",,"|n"&R1C15&RC[-18])&IF(RC[-17]="",,"|n"&R1C16&RC[-17])&IF(RC[-16]="",,"|n"&R1C17&RC[-16])&IF(RC[-15]="",,"|n"&R1C18&RC[-15])&IF(RC[-14]="",,"|n"&R1C19&RC[-14])&IF(RC[-13]="",,"|n"&R1C20&RC[-13])&IF(RC[-12]="",,"|n"&R1C21&RC[-12])&IF(RC[-11]="",,"|n"&R1C22&RC[-11])&IF(RC[-10]="",,"|n"&R1C23&RC[-10])&IF(RC[-9]="",,"|n"&R1C24&RC[-9])&IF(RC[-8]="",,"|n"&R1C25&RC[-8])&IF(RC[-7]="",,"|n"&R1C26&RC[-7])&IF(RC[-6]="",,"|n"&R1C27&RC[-6])&IF(RC[-5]="",,"|n"&R1C28&RC[-5])&IF(RC[-2]="",,"|n|n"&RC[-2]) -> |n|n用于镶嵌到[剑,衣]上.|n镶嵌后不可取下!|n不需要的宝石可以在宠物处熔炼,用于宝石抽奖.
A46: 2 | B46: D | C46: [宝石] | D46: 花雨 | G46: =IF(R[-33]C<>"",R[-33]C*4,"") ->  | H46: =IF(R[-33]C<>"",R[-33]C*4,"") ->  | I46: =IF(R[-33]C<>"",R[-33]C*4,"") ->  | J46: =IF(R[-33]C<>"",R[-33]C*4,"") ->  | K46: =IF(R[-33]C<>"",R[-33]C*4,"") ->  | L46: =IF(R[-33]C<>"",INT(R[-33]C*1.5),"") ->  | M46: =IF(R[-33]C<>"",R[-33]C*2,"") ->  | N46: =IF(R[-33]C<>"",INT(R[-33]C*1.2),"") ->  | O46: =IF(R[-33]C<>"",INT(R[-33]C*1.2),"") ->  | AE46: 用于镶嵌到[剑,衣]上.|n镶嵌后不可取下!|n不需要的宝石可以在宠物处熔炼,用于宝石抽奖. | AF46: =VLOOKUP(RC[-31],Sheet2!R13C1:R19C2,2,0)&"."&VLOOKUP(RC[-30],Sheet2!R7C1:R12C2,2,0)&VLOOKUP(RC[-30],Sheet2!R1C1:R6C2,2,0)&RC[-29]&RC[-28]&RC[-27]&Sheet2!R1C3 -> 二.丁|cFF999999[宝石]花雨|r | AG46: =IF(RC[-26]&RC[-25]&RC[-24]&RC[-23]&RC[-22]&RC[-21]="",,R1C6)&IF(RC[-26]="",,"|n"&R1C7&RC[-26])&IF(RC[-25]="",,"|n"&R1C8&RC[-25])&IF(RC[-24]="",,"|n"&R1C9&RC[-24])&IF(RC[-23]="",,"|n"&R1C10&RC[-23])&IF(RC[-22]="",,"|n"&R1C11&RC[-22])&IF(RC[-21]="",,"|n"&R1C12&RC[-21])&IF(RC[-19]&RC[-18]&RC[-17]&RC[-16]="",,"|n|n"&R1C13)&IF(RC[-19]="",,"|n"&R1C14&RC[-19])&IF(RC[-18]="",,"|n"&R1C15&RC[-18])&IF(RC[-17]="",,"|n"&R1C16&RC[-17])&IF(RC[-16]="",,"|n"&R1C17&RC[-16])&IF(RC[-15]="",,"|n"&R1C18&RC[-15])&IF(RC[-14]="",,"|n"&R1C19&RC[-14])&IF(RC[-13]="",,"|n"&R1C20&RC[-13])&IF(RC[-12]="",,"|n"&R1C21&RC[-12])&IF(RC[-11]="",,"|n"&R1C22&RC[-11])&IF(RC[-10]="",,"|n"&R1C23&RC[-10])&IF(RC[-9]="",,"|n"&R1C24&RC[-9])&IF(RC[-8]="",,"|n"&R1C25&RC[-8])&IF(RC[-7]="",,"|n"&R1C26&RC[-7])&IF(RC[-6]="",,"|n"&R1C27&RC[-6])&IF(RC[-5]="",,"|n"&R1C28&RC[-5])&IF(RC[-2]="",,"|n|n"&RC[-2]) -> |n|n用于镶嵌到[剑,衣]上.|n镶嵌后不可取下!|n不需要的宝石可以在宠物处熔炼,用于宝石抽奖.
A47: 2 | B47: D | C47: [宝石] | D47: 断空 | G47: =IF(R[-33]C<>"",R[-33]C*4,"") ->  | H47: =IF(R[-33]C<>"",R[-33]C*4,"") ->  | I47: =IF(R[-33]C<>"",R[-33]C*4,"") ->  | J47: =IF(R[-33]C<>"",R[-33]C*4,"") ->  | K47: =IF(R[-33]C<>"",R[-33]C*4,"") ->  | L47: =IF(R[-33]C<>"",INT(R[-33]C*1.5),"") ->  | M47: =IF(R[-33]C<>"",R[-33]C*2,"") ->  | N47: =IF(R[-33]C<>"",INT(R[-33]C*1.2),"") ->  | O47: =IF(R[-33]C<>"",INT(R[-33]C*1.2),"") ->  | AE47: 用于镶嵌到[剑,衣]上.|n镶嵌后不可取下!|n不需要的宝石可以在宠物处熔炼,用于宝石抽奖. | AF47: =VLOOKUP(RC[-31],Sheet2!R13C1:R19C2,2,0)&"."&VLOOKUP(RC[-30],Sheet2!R7C1:R12C2,2,0)&VLOOKUP(RC[-30],Sheet2!R1C1:R6C2,2,0)&RC[-29]&RC[-28]&RC[-27]&Sheet2!R1C3 -> 二.丁|cFF999999[宝石]断空|r | AG47: =IF(RC[-26]&RC[-25]&RC[-24]&RC[-23]&RC[-22]&RC[-21]="",,R1C6)&IF(RC[-26]="",,"|n"&R1C7&RC[-26])&IF(RC[-25]="",,"|n"&R1C8&RC[-25])&IF(RC[-24]="",,"|n"&R1C9&RC[-24])&IF(RC[-23]="",,"|n"&R1C10&RC[-23])&IF(RC[-22]="",,"|n"&R1C11&RC[-22])&IF(RC[-21]="",,"|n"&R1C12&RC[-21])&IF(RC[-19]&RC[-18]&RC[-17]&RC[-16]="",,"|n|n"&R1C13)&IF(RC[-19]="",,"|n"&R1C14&RC[-19])&IF(RC[-18]="",,"|n"&R1C15&RC[-18])&IF(RC[-17]="",,"|n"&R1C16&RC[-17])&IF(RC[-16]="",,"|n"&R1C17&RC[-16])&IF(RC[-15]="",,"|n"&R1C18&RC[-15])&IF(RC[-14]="",,"|n"&R1C19&RC[-14])&IF(RC[-13]="",,"|n"&R1C20&RC[-13])&IF(RC[-12]="",,"|n"&R1C21&RC[-12])&IF(RC[-11]="",,"|n"&R1C22&RC[-11])&IF(RC[-10]="",,"|n"&R1C23&RC[-10])&IF(RC[-9]="",,"|n"&R1C24&RC[-9])&IF(RC[-8]="",,"|n"&R1C25&RC[-8])&IF(RC[-7]="",,"|n"&R1C26&RC[-7])&IF(RC[-6]="",,"|n"&R1C27&RC[-6])&IF(RC[-5]="",,"|n"&R1C28&RC[-5])&IF(RC[-2]="",,"|n|n"&RC[-2]) -> |n|n用于镶嵌到[剑,衣]上.|n镶嵌后不可取下!|n不需要的宝石可以在宠物处熔炼,用于宝石抽奖.
A48: 2 | B48: D | C48: [宝石] | D48: 浑天 | G48: =IF(R[-33]C<>"",R[-33]C*4,"") ->  | H48: =IF(R[-33]C<>"",R[-33]C*4,"") ->  | I48: =IF(R[-33]C<>"",R[-33]C*4,"") ->  | J48: =IF(R[-33]C<>"",R[-33]C*4,"") ->  | K48: =IF(R[-33]C<>"",R[-33]C*4,"") ->  | L48: =IF(R[-33]C<>"",INT(R[-33]C*1.5),"") ->  | M48: =IF(R[-33]C<>"",R[-33]C*2,"") ->  | N48: =IF(R[-33]C<>"",INT(R[-33]C*1.2),"") ->  | O48: =IF(R[-33]C<>"",INT(R[-33]C*1.2),"") ->  | AE48: 用于镶嵌到[剑,衣]上.|n镶嵌后不可取下!|n不需要的宝石可以在宠物处熔炼,用于宝石抽奖. | AF48: =VLOOKUP(RC[-31],Sheet2!R13C1:R19C2,2,0)&"."&VLOOKUP(RC[-30],Sheet2!R7C1:R12C2,2,0)&VLOOKUP(RC[-30],Sheet2!R1C1:R6C2,2,0)&RC[-29]&RC[-28]&RC[-27]&Sheet2!R1C3 -> 二.丁|cFF999999[宝石]浑天|r | AG48: =IF(RC[-26]&RC[-25]&RC[-24]&RC[-23]&RC[-22]&RC[-21]="",,R1C6)&IF(RC[-26]="",,"|n"&R1C7&RC[-26])&IF(RC[-25]="",,"|n"&R1C8&RC[-25])&IF(RC[-24]="",,"|n"&R1C9&RC[-24])&IF(RC[-23]="",,"|n"&R1C10&RC[-23])&IF(RC[-22]="",,"|n"&R1C11&RC[-22])&IF(RC[-21]="",,"|n"&R1C12&RC[-21])&IF(RC[-19]&RC[-18]&RC[-17]&RC[-16]="",,"|n|n"&R1C13)&IF(RC[-19]="",,"|n"&R1C14&RC[-19])&IF(RC[-18]="",,"|n"&R1C15&RC[-18])&IF(RC[-17]="",,"|n"&R1C16&RC[-17])&IF(RC[-16]="",,"|n"&R1C17&RC[-16])&IF(RC[-15]="",,"|n"&R1C18&RC[-15])&IF(RC[-14]="",,"|n"&R1C19&RC[-14])&IF(RC[-13]="",,"|n"&R1C20&RC[-13])&IF(RC[-12]="",,"|n"&R1C21&RC[-12])&IF(RC[-11]="",,"|n"&R1C22&RC[-11])&IF(RC[-10]="",,"|n"&R1C23&RC[-10])&IF(RC[-9]="",,"|n"&R1C24&RC[-9])&IF(RC[-8]="",,"|n"&R1C25&RC[-8])&IF(RC[-7]="",,"|n"&R1C26&RC[-7])&IF(RC[-6]="",,"|n"&R1C27&RC[-6])&IF(RC[-5]="",,"|n"&R1C28&RC[-5])&IF(RC[-2]="",,"|n|n"&RC[-2]) -> |n|n用于镶嵌到[剑,衣]上.|n镶嵌后不可取下!|n不需要的宝石可以在宠物处熔炼,用于宝石抽奖.
A49: 2 | B49: D | C49: [宝石] | D49: 风舞 | G49: =IF(R[-33]C<>"",R[-33]C*4,"") ->  | H49: =IF(R[-33]C<>"",R[-33]C*4,"") ->  | I49: =IF(R[-33]C<>"",R[-33]C*4,"") ->  | J49: =IF(R[-33]C<>"",R[-33]C*4,"") ->  | K49: =IF(R[-33]C<>"",R[-33]C*4,"") ->  | L49: =IF(R[-33]C<>"",INT(R[-33]C*1.5),"") ->  | M49: =IF(R[-33]C<>"",R[-33]C*2,"") ->  | N49: =IF(R[-33]C<>"",INT(R[-33]C*1.2),"") ->  | O49: =IF(R[-33]C<>"",INT(R[-33]C*1.2),"") ->  | AE49: 用于镶嵌到[剑,衣]上.|n镶嵌后不可取下!|n不需要的宝石可以在宠物处熔炼,用于宝石抽奖. | AF49: =VLOOKUP(RC[-31],Sheet2!R13C1:R19C2,2,0)&"."&VLOOKUP(RC[-30],Sheet2!R7C1:R12C2,2,0)&VLOOKUP(RC[-30],Sheet2!R1C1:R6C2,2,0)&RC[-29]&RC[-28]&RC[-27]&Sheet2!R1C3 -> 二.丁|cFF999999[宝石]风舞|r | AG49: =IF(RC[-26]&RC[-25]&RC[-24]&RC[-23]&RC[-22]&RC[-21]="",,R1C6)&IF(RC[-26]="",,"|n"&R1C7&RC[-26])&IF(RC[-25]="",,"|n"&R1C8&RC[-25])&IF(RC[-24]="",,"|n"&R1C9&RC[-24])&IF(RC[-23]="",,"|n"&R1C10&RC[-23])&IF(RC[-22]="",,"|n"&R1C11&RC[-22])&IF(RC[-21]="",,"|n"&R1C12&RC[-21])&IF(RC[-19]&RC[-18]&RC[-17]&RC[-16]="",,"|n|n"&R1C13)&IF(RC[-19]="",,"|n"&R1C14&RC[-19])&IF(RC[-18]="",,"|n"&R1C15&RC[-18])&IF(RC[-17]="",,"|n"&R1C16&RC[-17])&IF(RC[-16]="",,"|n"&R1C17&RC[-16])&IF(RC[-15]="",,"|n"&R1C18&RC[-15])&IF(RC[-14]="",,"|n"&R1C19&RC[-14])&IF(RC[-13]="",,"|n"&R1C20&RC[-13])&IF(RC[-12]="",,"|n"&R1C21&RC[-12])&IF(RC[-11]="",,"|n"&R1C22&RC[-11])&IF(RC[-10]="",,"|n"&R1C23&RC[-10])&IF(RC[-9]="",,"|n"&R1C24&RC[-9])&IF(RC[-8]="",,"|n"&R1C25&RC[-8])&IF(RC[-7]="",,"|n"&R1C26&RC[-7])&IF(RC[-6]="",,"|n"&R1C27&RC[-6])&IF(RC[-5]="",,"|n"&R1C28&RC[-5])&IF(RC[-2]="",,"|n|n"&RC[-2]) -> |n|n用于镶嵌到[剑,衣]上.|n镶嵌后不可取下!|n不需要的宝石可以在宠物处熔炼,用于宝石抽奖.
A50: 2 | B50: D | C50: [宝石] | D50: 无双 | G50: =IF(R[-33]C<>"",R[-33]C*4,"") ->  | H50: =IF(R[-33]C<>"",R[-33]C*4,"") ->  | I50: =IF(R[-33]C<>"",R[-33]C*4,"") ->  | J50: =IF(R[-33]C<>"",R[-33]C*4,"") ->  | K50: =IF(R[-33]C<>"",R[-33]C*4,"") ->  | L50: =IF(R[-33]C<>"",INT(R[-33]C*1.5),"") ->  | M50: =IF(R[-33]C<>"",R[-33]C*2,"") ->  | N50: =IF(R[-33]C<>"",INT(R[-33]C*1.2),"") ->  | O50: =IF(R[-33]C<>"",INT(R[-33]C*1.2),"") ->  | P50: =IF(R[-33]C<>"",INT(R[-33]C*1.2),"") ->  | Q50: =IF(R[-33]C<>"",INT(R[-33]C*1.2),"") ->  | AE50: 用于镶嵌到[剑,衣]上.|n镶嵌后不可取下!|n不需要的宝石可以在宠物处熔炼,用于宝石抽奖. | AF50: =VLOOKUP(RC[-31],Sheet2!R13C1:R19C2,2,0)&"."&VLOOKUP(RC[-30],Sheet2!R7C1:R12C2,2,0)&VLOOKUP(RC[-30],Sheet2!R1C1:R6C2,2,0)&RC[-29]&RC[-28]&RC[-27]&Sheet2!R1C3 -> 二.丁|cFF999999[宝石]无双|r | AG50: =IF(RC[-26]&RC[-25]&RC[-24]&RC[-23]&RC[-22]&RC[-21]="",,R1C6)&IF(RC[-26]="",,"|n"&R1C7&RC[-26])&IF(RC[-25]="",,"|n"&R1C8&RC[-25])&IF(RC[-24]="",,"|n"&R1C9&RC[-24])&IF(RC[-23]="",,"|n"&R1C10&RC[-23])&IF(RC[-22]="",,"|n"&R1C11&RC[-22])&IF(RC[-21]="",,"|n"&R1C12&RC[-21])&IF(RC[-19]&RC[-18]&RC[-17]&RC[-16]="",,"|n|n"&R1C13)&IF(RC[-19]="",,"|n"&R1C14&RC[-19])&IF(RC[-18]="",,"|n"&R1C15&RC[-18])&IF(RC[-17]="",,"|n"&R1C16&RC[-17])&IF(RC[-16]="",,"|n"&R1C17&RC[-16])&IF(RC[-15]="",,"|n"&R1C18&RC[-15])&IF(RC[-14]="",,"|n"&R1C19&RC[-14])&IF(RC[-13]="",,"|n"&R1C20&RC[-13])&IF(RC[-12]="",,"|n"&R1C21&RC[-12])&IF(RC[-11]="",,"|n"&R1C22&RC[-11])&IF(RC[-10]="",,"|n"&R1C23&RC[-10])&IF(RC[-9]="",,"|n"&R1C24&RC[-9])&IF(RC[-8]="",,"|n"&R1C25&RC[-8])&IF(RC[-7]="",,"|n"&R1C26&RC[-7])&IF(RC[-6]="",,"|n"&R1C27&RC[-6])&IF(RC[-5]="",,"|n"&R1C28&RC[-5])&IF(RC[-2]="",,"|n|n"&RC[-2]) -> |n|n用于镶嵌到[剑,衣]上.|n镶嵌后不可取下!|n不需要的宝石可以在宠物处熔炼,用于宝石抽奖.
A51: 2 | B51: C | C51: [宝石] | D51: 天钧石 | G51: =IF(R[-33]C<>"",R[-33]C*3,"") ->  | H51: =IF(R[-33]C<>"",R[-33]C*3,"") -> 4500 | I51: =IF(R[-33]C<>"",R[-33]C*3,"") -> 4500 | J51: =IF(R[-33]C<>"",R[-33]C*3,"") -> 4500 | K51: =IF(R[-33]C<>"",R[-33]C*3,"") ->  | L51: =IF(R[-33]C<>"",INT(R[-33]C*1.5),"") ->  | M51: =IF(R[-33]C<>"",R[-33]C*2,"") ->  | N51: =IF(R[-33]C<>"",INT(R[-33]C*1.2),"") ->  | O51: =IF(R[-33]C<>"",INT(R[-33]C*1.2),"") ->  | P51: =IF(R[-33]C<>"",INT(R[-33]C*1.2),"") ->  | Q51: =IF(R[-33]C<>"",INT(R[-33]C*1.2),"") ->  | AE51: 用于镶嵌到[剑,衣]上.|n镶嵌后不可取下!|n不需要的宝石可以在宠物处熔炼,用于宝石抽奖. | AF51: =VLOOKUP(RC[-31],Sheet2!R13C1:R19C2,2,0)&"."&VLOOKUP(RC[-30],Sheet2!R7C1:R12C2,2,0)&VLOOKUP(RC[-30],Sheet2!R1C1:R6C2,2,0)&RC[-29]&RC[-28]&RC[-27]&Sheet2!R1C3 -> 二.丙|cFF99FF66[宝石]天钧石|r | AG51: =IF(RC[-26]&RC[-25]&RC[-24]&RC[-23]&RC[-22]&RC[-21]="",,R1C6)&IF(RC[-26]="",,"|n"&R1C7&RC[-26])&IF(RC[-25]="",,"|n"&R1C8&RC[-25])&IF(RC[-24]="",,"|n"&R1C9&RC[-24])&IF(RC[-23]="",,"|n"&R1C10&RC[-23])&IF(RC[-22]="",,"|n"&R1C11&RC[-22])&IF(RC[-21]="",,"|n"&R1C12&RC[-21])&IF(RC[-19]&RC[-18]&RC[-17]&RC[-16]="",,"|n|n"&R1C13)&IF(RC[-19]="",,"|n"&R1C14&RC[-19])&IF(RC[-18]="",,"|n"&R1C15&RC[-18])&IF(RC[-17]="",,"|n"&R1C16&RC[-17])&IF(RC[-16]="",,"|n"&R1C17&RC[-16])&IF(RC[-15]="",,"|n"&R1C18&RC[-15])&IF(RC[-14]="",,"|n"&R1C19&RC[-14])&IF(RC[-13]="",,"|n"&R1C20&RC[-13])&IF(RC[-12]="",,"|n"&R1C21&RC[-12])&IF(RC[-11]="",,"|n"&R1C22&RC[-11])&IF(RC[-10]="",,"|n"&R1C23&RC[-10])&IF(RC[-9]="",,"|n"&R1C24&RC[-9])&IF(RC[-8]="",,"|n"&R1C25&RC[-8])&IF(RC[-7]="",,"|n"&R1C26&RC[-7])&IF(RC[-6]="",,"|n"&R1C27&RC[-6])&IF(RC[-5]="",,"|n"&R1C28&RC[-5])&IF(RC[-2]="",,"|n|n"&RC[-2]) -> |cFFFFFF99基础属性|r|n力量:4500|n敏捷:4500|n智力:4500|n|n用于镶嵌到[剑,衣]上.|n镶嵌后不可取下!|n不需要的宝石可以在宠物处熔炼,用于宝石抽奖.
A52: 2 | B52: C | C52: [宝石] | D52: 天回石 | G52: =IF(R[-33]C<>"",R[-33]C*3,"") -> 15000 | H52: =IF(R[-33]C<>"",R[-33]C*3,"") ->  | I52: =IF(R[-33]C<>"",R[-33]C*3,"") ->  | J52: =IF(R[-33]C<>"",R[-33]C*3,"") ->  | K52: =IF(R[-33]C<>"",R[-33]C*3,"") ->  | L52: =IF(R[-33]C<>"",INT(R[-33]C*1.5),"") ->  | M52: =IF(R[-33]C<>"",R[-33]C*2,"") ->  | N52: =IF(R[-33]C<>"",INT(R[-33]C*1.2),"") ->  | O52: =IF(R[-33]C<>"",INT(R[-33]C*1.2),"") ->  | P52: =IF(R[-33]C<>"",INT(R[-33]C*1.2),"") ->  | Q52: =IF(R[-33]C<>"",INT(R[-33]C*1.2),"") ->  | AE52: 用于镶嵌到[剑,衣]上.|n镶嵌后不可取下!|n不需要的宝石可以在宠物处熔炼,用于宝石抽奖. | AF52: =VLOOKUP(RC[-31],Sheet2!R13C1:R19C2,2,0)&"."&VLOOKUP(RC[-30],Sheet2!R7C1:R12C2,2,0)&VLOOKUP(RC[-30],Sheet2!R1C1:R6C2,2,0)&RC[-29]&RC[-28]&RC[-27]&Sheet2!R1C3 -> 二.丙|cFF99FF66[宝石]天回石|r | AG52: =IF(RC[-26]&RC[-25]&RC[-24]&RC[-23]&RC[-22]&RC[-21]="",,R1C6)&IF(RC[-26]="",,"|n"&R1C7&RC[-26])&IF(RC[-25]="",,"|n"&R1C8&RC[-25])&IF(RC[-24]="",,"|n"&R1C9&RC[-24])&IF(RC[-23]="",,"|n"&R1C10&RC[-23])&IF(RC[-22]="",,"|n"&R1C11&RC[-22])&IF(RC[-21]="",,"|n"&R1C12&RC[-21])&IF(RC[-19]&RC[-18]&RC[-17]&RC[-16]="",,"|n|n"&R1C13)&IF(RC[-19]="",,"|n"&R1C14&RC[-19])&IF(RC[-18]="",,"|n"&R1C15&RC[-18])&IF(RC[-17]="",,"|n"&R1C16&RC[-17])&IF(RC[-16]="",,"|n"&R1C17&RC[-16])&IF(RC[-15]="",,"|n"&R1C18&RC[-15])&IF(RC[-14]="",,"|n"&R1C19&RC[-14])&IF(RC[-13]="",,"|n"&R1C20&RC[-13])&IF(RC[-12]="",,"|n"&R1C21&RC[-12])&IF(RC[-11]="",,"|n"&R1C22&RC[-11])&IF(RC[-10]="",,"|n"&R1C23&RC[-10])&IF(RC[-9]="",,"|n"&R1C24&RC[-9])&IF(RC[-8]="",,"|n"&R1C25&RC[-8])&IF(RC[-7]="",,"|n"&R1C26&RC[-7])&IF(RC[-6]="",,"|n"&R1C27&RC[-6])&IF(RC[-5]="",,"|n"&R1C28&RC[-5])&IF(RC[-2]="",,"|n|n"&RC[-2]) -> |cFFFFFF99基础属性|r|n攻击:15000|n|n用于镶嵌到[剑,衣]上.|n镶嵌后不可取下!|n不需要的宝石可以在宠物处熔炼,用于宝石抽奖.
A53: 2 | B53: C | C53: [宝石] | D53: 破天石 | G53: =IF(R[-33]C<>"",R[-33]C*3,"") ->  | H53: =IF(R[-33]C<>"",R[-33]C*3,"") ->  | I53: =IF(R[-33]C<>"",R[-33]C*3,"") ->  | J53: =IF(R[-33]C<>"",R[-33]C*3,"") ->  | K53: =IF(R[-33]C<>"",R[-33]C*3,"") ->  | L53: =IF(R[-33]C<>"",INT(R[-33]C*1.5),"") ->  | M53: =IF(R[-33]C<>"",R[-33]C*2,"") ->  | N53: =IF(R[-33]C<>"",INT(R[-33]C*1.2),"") ->  | O53: =IF(R[-33]C<>"",INT(R[-33]C*1.2),"") -> 2 | P53: =IF(R[-33]C<>"",INT(R[-33]C*1.2),"") ->  | Q53: =IF(R[-33]C<>"",INT(R[-33]C*1.2),"") ->  | AE53: 用于镶嵌到[剑,衣]上.|n镶嵌后不可取下!|n不需要的宝石可以在宠物处熔炼,用于宝石抽奖. | AF53: =VLOOKUP(RC[-31],Sheet2!R13C1:R19C2,2,0)&"."&VLOOKUP(RC[-30],Sheet2!R7C1:R12C2,2,0)&VLOOKUP(RC[-30],Sheet2!R1C1:R6C2,2,0)&RC[-29]&RC[-28]&RC[-27]&Sheet2!R1C3 -> 二.丙|cFF99FF66[宝石]破天石|r | AG53: =IF(RC[-26]&RC[-25]&RC[-24]&RC[-23]&RC[-22]&RC[-21]="",,R1C6)&IF(RC[-26]="",,"|n"&R1C7&RC[-26])&IF(RC[-25]="",,"|n"&R1C8&RC[-25])&IF(RC[-24]="",,"|n"&R1C9&RC[-24])&IF(RC[-23]="",,"|n"&R1C10&RC[-23])&IF(RC[-22]="",,"|n"&R1C11&RC[-22])&IF(RC[-21]="",,"|n"&R1C12&RC[-21])&IF(RC[-19]&RC[-18]&RC[-17]&RC[-16]="",,"|n|n"&R1C13)&IF(RC[-19]="",,"|n"&R1C14&RC[-19])&IF(RC[-18]="",,"|n"&R1C15&RC[-18])&IF(RC[-17]="",,"|n"&R1C16&RC[-17])&IF(RC[-16]="",,"|n"&R1C17&RC[-16])&IF(RC[-15]="",,"|n"&R1C18&RC[-15])&IF(RC[-14]="",,"|n"&R1C19&RC[-14])&IF(RC[-13]="",,"|n"&R1C20&RC[-13])&IF(RC[-12]="",,"|n"&R1C21&RC[-12])&IF(RC[-11]="",,"|n"&R1C22&RC[-11])&IF(RC[-10]="",,"|n"&R1C23&RC[-10])&IF(RC[-9]="",,"|n"&R1C24&RC[-9])&IF(RC[-8]="",,"|n"&R1C25&RC[-8])&IF(RC[-7]="",,"|n"&R1C26&RC[-7])&IF(RC[-6]="",,"|n"&R1C27&RC[-6])&IF(RC[-5]="",,"|n"&R1C28&RC[-5])&IF(RC[-2]="",,"|n|n"&RC[-2]) -> |n|n|cFFFFFF55附加属性|r(%)|n攻击吸血:2|n|n用于镶嵌到[剑,衣]上.|n镶嵌后不可取下!|n不需要的宝石可以在宠物处熔炼,用于宝石抽奖.
A54: 2 | B54: C | C54: [宝石] | D54: 风雷石 | G54: =IF(R[-33]C<>"",R[-33]C*3,"") ->  | H54: =IF(R[-33]C<>"",R[-33]C*3,"") ->  | I54: =IF(R[-33]C<>"",R[-33]C*3,"") ->  | J54: =IF(R[-33]C<>"",R[-33]C*3,"") ->  | K54: =IF(R[-33]C<>"",R[-33]C*3,"") -> 75000 | L54: =IF(R[-33]C<>"",INT(R[-33]C*1.5),"") -> 150 | M54: =IF(R[-33]C<>"",R[-33]C*2,"") ->  | N54: =IF(R[-33]C<>"",INT(R[-33]C*1.2),"") ->  | O54: =IF(R[-33]C<>"",INT(R[-33]C*1.2),"") ->  | P54: =IF(R[-33]C<>"",INT(R[-33]C*1.2),"") ->  | Q54: =IF(R[-33]C<>"",INT(R[-33]C*1.2),"") ->  | AE54: 用于镶嵌到[剑,衣]上.|n镶嵌后不可取下!|n不需要的宝石可以在宠物处熔炼,用于宝石抽奖. | AF54: =VLOOKUP(RC[-31],Sheet2!R13C1:R19C2,2,0)&"."&VLOOKUP(RC[-30],Sheet2!R7C1:R12C2,2,0)&VLOOKUP(RC[-30],Sheet2!R1C1:R6C2,2,0)&RC[-29]&RC[-28]&RC[-27]&Sheet2!R1C3 -> 二.丙|cFF99FF66[宝石]风雷石|r | AG54: =IF(RC[-26]&RC[-25]&RC[-24]&RC[-23]&RC[-22]&RC[-21]="",,R1C6)&IF(RC[-26]="",,"|n"&R1C7&RC[-26])&IF(RC[-25]="",,"|n"&R1C8&RC[-25])&IF(RC[-24]="",,"|n"&R1C9&RC[-24])&IF(RC[-23]="",,"|n"&R1C10&RC[-23])&IF(RC[-22]="",,"|n"&R1C11&RC[-22])&IF(RC[-21]="",,"|n"&R1C12&RC[-21])&IF(RC[-19]&RC[-18]&RC[-17]&RC[-16]="",,"|n|n"&R1C13)&IF(RC[-19]="",,"|n"&R1C14&RC[-19])&IF(RC[-18]="",,"|n"&R1C15&RC[-18])&IF(RC[-17]="",,"|n"&R1C16&RC[-17])&IF(RC[-16]="",,"|n"&R1C17&RC[-16])&IF(RC[-15]="",,"|n"&R1C18&RC[-15])&IF(RC[-14]="",,"|n"&R1C19&RC[-14])&IF(RC[-13]="",,"|n"&R1C20&RC[-13])&IF(RC[-12]="",,"|n"&R1C21&RC[-12])&IF(RC[-11]="",,"|n"&R1C22&RC[-11])&IF(RC[-10]="",,"|n"&R1C23&RC[-10])&IF(RC[-9]="",,"|n"&R1C24&RC[-9])&IF(RC[-8]="",,"|n"&R1C25&RC[-8])&IF(RC[-7]="",,"|n"&R1C26&RC[-7])&IF(RC[-6]="",,"|n"&R1C27&RC[-6])&IF(RC[-5]="",,"|n"&R1C28&RC[-5])&IF(RC[-2]="",,"|n|n"&RC[-2]) -> |cFFFFFF99基础属性|r|n血量:75000|n护甲:150|n|n用于镶嵌到[剑,衣]上.|n镶嵌后不可取下!|n不需要的宝石可以在宠物处熔炼,用于宝石抽奖.
A55: 2 | B55: C | C55: [宝石] | D55: 孤风石 | G55: =IF(R[-33]C<>"",R[-33]C*3,"") ->  | H55: =IF(R[-33]C<>"",R[-33]C*3,"") -> 6000 | I55: =IF(R[-33]C<>"",R[-33]C*3,"") -> 1500 | J55: =IF(R[-33]C<>"",R[-33]C*3,"") -> 1500 | K55: =IF(R[-33]C<>"",R[-33]C*3,"") ->  | L55: =IF(R[-33]C<>"",INT(R[-33]C*1.5),"") ->  | M55: =IF(R[-33]C<>"",R[-33]C*2,"") ->  | N55: =IF(R[-33]C<>"",INT(R[-33]C*1.2),"") ->  | O55: =IF(R[-33]C<>"",INT(R[-33]C*1.2),"") ->  | P55: =IF(R[-33]C<>"",INT(R[-33]C*1.2),"") ->  | Q55: =IF(R[-33]C<>"",INT(R[-33]C*1.2),"") ->  | AE55: 用于镶嵌到[剑,衣]上.|n镶嵌后不可取下!|n不需要的宝石可以在宠物处熔炼,用于宝石抽奖. | AF55: =VLOOKUP(RC[-31],Sheet2!R13C1:R19C2,2,0)&"."&VLOOKUP(RC[-30],Sheet2!R7C1:R12C2,2,0)&VLOOKUP(RC[-30],Sheet2!R1C1:R6C2,2,0)&RC[-29]&RC[-28]&RC[-27]&Sheet2!R1C3 -> 二.丙|cFF99FF66[宝石]孤风石|r | AG55: =IF(RC[-26]&RC[-25]&RC[-24]&RC[-23]&RC[-22]&RC[-21]="",,R1C6)&IF(RC[-26]="",,"|n"&R1C7&RC[-26])&IF(RC[-25]="",,"|n"&R1C8&RC[-25])&IF(RC[-24]="",,"|n"&R1C9&RC[-24])&IF(RC[-23]="",,"|n"&R1C10&RC[-23])&IF(RC[-22]="",,"|n"&R1C11&RC[-22])&IF(RC[-21]="",,"|n"&R1C12&RC[-21])&IF(RC[-19]&RC[-18]&RC[-17]&RC[-16]="",,"|n|n"&R1C13)&IF(RC[-19]="",,"|n"&R1C14&RC[-19])&IF(RC[-18]="",,"|n"&R1C15&RC[-18])&IF(RC[-17]="",,"|n"&R1C16&RC[-17])&IF(RC[-16]="",,"|n"&R1C17&RC[-16])&IF(RC[-15]="",,"|n"&R1C18&RC[-15])&IF(RC[-14]="",,"|n"&R1C19&RC[-14])&IF(RC[-13]="",,"|n"&R1C20&RC[-13])&IF(RC[-12]="",,"|n"&R1C21&RC[-12])&IF(RC[-11]="",,"|n"&R1C22&RC[-11])&IF(RC[-10]="",,"|n"&R1C23&RC[-10])&IF(RC[-9]="",,"|n"&R1C24&RC[-9])&IF(RC[-8]="",,"|n"&R1C25&RC[-8])&IF(RC[-7]="",,"|n"&R1C26&RC[-7])&IF(RC[-6]="",,"|n"&R1C27&RC[-6])&IF(RC[-5]="",,"|n"&R1C28&RC[-5])&IF(RC[-2]="",,"|n|n"&RC[-2]) -> |cFFFFFF99基础属性|r|n力量:6000|n敏捷:1500|n智力:1500|n|n用于镶嵌到[剑,衣]上.|n镶嵌后不可取下!|n不需要的宝石可以在宠物处熔炼,用于宝石抽奖.
A56: 2 | B56: C | C56: [宝石] | D56: 红锦石 | G56: =IF(R[-33]C<>"",R[-33]C*3,"") ->  | H56: =IF(R[-33]C<>"",R[-33]C*3,"") -> 1500 | I56: =IF(R[-33]C<>"",R[-33]C*3,"") -> 6000 | J56: =IF(R[-33]C<>"",R[-33]C*3,"") -> 1500 | K56: =IF(R[-33]C<>"",R[-33]C*3,"") ->  | L56: =IF(R[-33]C<>"",INT(R[-33]C*1.5),"") ->  | M56: =IF(R[-33]C<>"",R[-33]C*2,"") ->  | N56: =IF(R[-33]C<>"",INT(R[-33]C*1.2),"") ->  | O56: =IF(R[-33]C<>"",INT(R[-33]C*1.2),"") ->  | P56: =IF(R[-33]C<>"",INT(R[-33]C*1.2),"") ->  | Q56: =IF(R[-33]C<>"",INT(R[-33]C*1.2),"") ->  | AE56: 用于镶嵌到[剑,衣]上.|n镶嵌后不可取下!|n不需要的宝石可以在宠物处熔炼,用于宝石抽奖. | AF56: =VLOOKUP(RC[-31],Sheet2!R13C1:R19C2,2,0)&"."&VLOOKUP(RC[-30],Sheet2!R7C1:R12C2,2,0)&VLOOKUP(RC[-30],Sheet2!R1C1:R6C2,2,0)&RC[-29]&RC[-28]&RC[-27]&Sheet2!R1C3 -> 二.丙|cFF99FF66[宝石]红锦石|r | AG56: =IF(RC[-26]&RC[-25]&RC[-24]&RC[-23]&RC[-22]&RC[-21]="",,R1C6)&IF(RC[-26]="",,"|n"&R1C7&RC[-26])&IF(RC[-25]="",,"|n"&R1C8&RC[-25])&IF(RC[-24]="",,"|n"&R1C9&RC[-24])&IF(RC[-23]="",,"|n"&R1C10&RC[-23])&IF(RC[-22]="",,"|n"&R1C11&RC[-22])&IF(RC[-21]="",,"|n"&R1C12&RC[-21])&IF(RC[-19]&RC[-18]&RC[-17]&RC[-16]="",,"|n|n"&R1C13)&IF(RC[-19]="",,"|n"&R1C14&RC[-19])&IF(RC[-18]="",,"|n"&R1C15&RC[-18])&IF(RC[-17]="",,"|n"&R1C16&RC[-17])&IF(RC[-16]="",,"|n"&R1C17&RC[-16])&IF(RC[-15]="",,"|n"&R1C18&RC[-15])&IF(RC[-14]="",,"|n"&R1C19&RC[-14])&IF(RC[-13]="",,"|n"&R1C20&RC[-13])&IF(RC[-12]="",,"|n"&R1C21&RC[-12])&IF(RC[-11]="",,"|n"&R1C22&RC[-11])&IF(RC[-10]="",,"|n"&R1C23&RC[-10])&IF(RC[-9]="",,"|n"&R1C24&RC[-9])&IF(RC[-8]="",,"|n"&R1C25&RC[-8])&IF(RC[-7]="",,"|n"&R1C26&RC[-7])&IF(RC[-6]="",,"|n"&R1C27&RC[-6])&IF(RC[-5]="",,"|n"&R1C28&RC[-5])&IF(RC[-2]="",,"|n|n"&RC[-2]) -> |cFFFFFF99基础属性|r|n力量:1500|n敏捷:6000|n智力:1500|n|n用于镶嵌到[剑,衣]上.|n镶嵌后不可取下!|n不需要的宝石可以在宠物处熔炼,用于宝石抽奖.
A57: 2 | B57: C | C57: [宝石] | D57: 黄鹤石 | G57: =IF(R[-33]C<>"",R[-33]C*3,"") ->  | H57: =IF(R[-33]C<>"",R[-33]C*3,"") -> 1500 | I57: =IF(R[-33]C<>"",R[-33]C*3,"") -> 1500 | J57: =IF(R[-33]C<>"",R[-33]C*3,"") -> 6000 | K57: =IF(R[-33]C<>"",R[-33]C*3,"") ->  | L57: =IF(R[-33]C<>"",INT(R[-33]C*1.5),"") ->  | M57: =IF(R[-33]C<>"",R[-33]C*2,"") ->  | N57: =IF(R[-33]C<>"",INT(R[-33]C*1.2),"") ->  | O57: =IF(R[-33]C<>"",INT(R[-33]C*1.2),"") ->  | P57: =IF(R[-33]C<>"",INT(R[-33]C*1.2),"") ->  | Q57: =IF(R[-33]C<>"",INT(R[-33]C*1.2),"") ->  | AE57: 用于镶嵌到[剑,衣]上.|n镶嵌后不可取下!|n不需要的宝石可以在宠物处熔炼,用于宝石抽奖. | AF57: =VLOOKUP(RC[-31],Sheet2!R13C1:R19C2,2,0)&"."&VLOOKUP(RC[-30],Sheet2!R7C1:R12C2,2,0)&VLOOKUP(RC[-30],Sheet2!R1C1:R6C2,2,0)&RC[-29]&RC[-28]&RC[-27]&Sheet2!R1C3 -> 二.丙|cFF99FF66[宝石]黄鹤石|r | AG57: =IF(RC[-26]&RC[-25]&RC[-24]&RC[-23]&RC[-22]&RC[-21]="",,R1C6)&IF(RC[-26]="",,"|n"&R1C7&RC[-26])&IF(RC[-25]="",,"|n"&R1C8&RC[-25])&IF(RC[-24]="",,"|n"&R1C9&RC[-24])&IF(RC[-23]="",,"|n"&R1C10&RC[-23])&IF(RC[-22]="",,"|n"&R1C11&RC[-22])&IF(RC[-21]="",,"|n"&R1C12&RC[-21])&IF(RC[-19]&RC[-18]&RC[-17]&RC[-16]="",,"|n|n"&R1C13)&IF(RC[-19]="",,"|n"&R1C14&RC[-19])&IF(RC[-18]="",,"|n"&R1C15&RC[-18])&IF(RC[-17]="",,"|n"&R1C16&RC[-17])&IF(RC[-16]="",,"|n"&R1C17&RC[-16])&IF(RC[-15]="",,"|n"&R1C18&RC[-15])&IF(RC[-14]="",,"|n"&R1C19&RC[-14])&IF(RC[-13]="",,"|n"&R1C20&RC[-13])&IF(RC[-12]="",,"|n"&R1C21&RC[-12])&IF(RC[-11]="",,"|n"&R1C22&RC[-11])&IF(RC[-10]="",,"|n"&R1C23&RC[-10])&IF(RC[-9]="",,"|n"&R1C24&RC[-9])&IF(RC[-8]="",,"|n"&R1C25&RC[-8])&IF(RC[-7]="",,"|n"&R1C26&RC[-7])&IF(RC[-6]="",,"|n"&R1C27&RC[-6])&IF(RC[-5]="",,"|n"&R1C28&RC[-5])&IF(RC[-2]="",,"|n|n"&RC[-2]) -> |cFFFFFF99基础属性|r|n力量:1500|n敏捷:1500|n智力:6000|n|n用于镶嵌到[剑,衣]上.|n镶嵌后不可取下!|n不需要的宝石可以在宠物处熔炼,用于宝石抽奖.
A58: 2 | B58: C | C58: [宝石] | D58: 星象石 | G58: =IF(R[-33]C<>"",R[-33]C*3,"") ->  | H58: =IF(R[-33]C<>"",R[-33]C*3,"") ->  | I58: =IF(R[-33]C<>"",R[-33]C*3,"") ->  | J58: =IF(R[-33]C<>"",R[-33]C*3,"") ->  | K58: =IF(R[-33]C<>"",R[-33]C*3,"") ->  | L58: =IF(R[-33]C<>"",INT(R[-33]C*1.5),"") ->  | M58: =IF(R[-33]C<>"",R[-33]C*2,"") ->  | N58: =IF(R[-33]C<>"",INT(R[-33]C*1.2),"") -> 18 | O58: =IF(R[-33]C<>"",INT(R[-33]C*1.2),"") ->  | P58: =IF(R[-33]C<>"",INT(R[-33]C*1.2),"") ->  | Q58: =IF(R[-33]C<>"",INT(R[-33]C*1.2),"") ->  | AE58: 用于镶嵌到[剑,衣]上.|n镶嵌后不可取下!|n不需要的宝石可以在宠物处熔炼,用于宝石抽奖. | AF58: =VLOOKUP(RC[-31],Sheet2!R13C1:R19C2,2,0)&"."&VLOOKUP(RC[-30],Sheet2!R7C1:R12C2,2,0)&VLOOKUP(RC[-30],Sheet2!R1C1:R6C2,2,0)&RC[-29]&RC[-28]&RC[-27]&Sheet2!R1C3 -> 二.丙|cFF99FF66[宝石]星象石|r | AG58: =IF(RC[-26]&RC[-25]&RC[-24]&RC[-23]&RC[-22]&RC[-21]="",,R1C6)&IF(RC[-26]="",,"|n"&R1C7&RC[-26])&IF(RC[-25]="",,"|n"&R1C8&RC[-25])&IF(RC[-24]="",,"|n"&R1C9&RC[-24])&IF(RC[-23]="",,"|n"&R1C10&RC[-23])&IF(RC[-22]="",,"|n"&R1C11&RC[-22])&IF(RC[-21]="",,"|n"&R1C12&RC[-21])&IF(RC[-19]&RC[-18]&RC[-17]&RC[-16]="",,"|n|n"&R1C13)&IF(RC[-19]="",,"|n"&R1C14&RC[-19])&IF(RC[-18]="",,"|n"&R1C15&RC[-18])&IF(RC[-17]="",,"|n"&R1C16&RC[-17])&IF(RC[-16]="",,"|n"&R1C17&RC[-16])&IF(RC[-15]="",,"|n"&R1C18&RC[-15])&IF(RC[-14]="",,"|n"&R1C19&RC[-14])&IF(RC[-13]="",,"|n"&R1C20&RC[-13])&IF(RC[-12]="",,"|n"&R1C21&RC[-12])&IF(RC[-11]="",,"|n"&R1C22&RC[-11])&IF(RC[-10]="",,"|n"&R1C23&RC[-10])&IF(RC[-9]="",,"|n"&R1C24&RC[-9])&IF(RC[-8]="",,"|n"&R1C25&RC[-8])&IF(RC[-7]="",,"|n"&R1C26&RC[-7])&IF(RC[-6]="",,"|n"&R1C27&RC[-6])&IF(RC[-5]="",,"|n"&R1C28&RC[-5])&IF(RC[-2]="",,"|n|n"&RC[-2]) -> |n|n|cFFFFFF55附加属性|r(%)|n攻速:18|n|n用于镶嵌到[剑,衣]上.|n镶嵌后不可取下!|n不需要的宝石可以在宠物处熔炼,用于宝石抽奖.
A59: 2 | B59: B | C59: [宝石] | D59: 鸿蒙窄木 | G59: =IF(R[-33]C<>"",R[-33]C*3,"") ->  | H59: =IF(R[-33]C<>"",R[-33]C*3,"") -> 7500 | I59: =IF(R[-33]C<>"",R[-33]C*3,"") ->  | J59: =IF(R[-33]C<>"",R[-33]C*3,"") ->  | K59: =IF(R[-33]C<>"",R[-33]C*3,"") ->  | L59: =IF(R[-33]C<>"",INT(R[-33]C*1.5),"") -> 37 | M59: =IF(R[-33]C<>"",R[-33]C*2,"") ->  | N59: =IF(R[-33]C<>"",INT(R[-33]C*1.2),"") ->  | O59: =IF(R[-33]C<>"",INT(R[-33]C*1.2),"") ->  | P59: =IF(R[-33]C<>"",INT(R[-33]C*1.2),"") ->  | Q59: =IF(R[-33]C<>"",INT(R[-33]C*1.2),"") ->  | R59: =IF(R[-33]C<>"",INT(R[-33]C*1.2),"") -> 2 | AE59: 用于镶嵌到[剑,衣]上.|n镶嵌后不可取下!|n不需要的宝石可以在宠物处熔炼,用于宝石抽奖. | AF59: =VLOOKUP(RC[-31],Sheet2!R13C1:R19C2,2,0)&"."&VLOOKUP(RC[-30],Sheet2!R7C1:R12C2,2,0)&VLOOKUP(RC[-30],Sheet2!R1C1:R6C2,2,0)&RC[-29]&RC[-28]&RC[-27]&Sheet2!R1C3 -> 二.乙|cFF1BE6B8[宝石]鸿蒙窄木|r | AG59: =IF(RC[-26]&RC[-25]&RC[-24]&RC[-23]&RC[-22]&RC[-21]="",,R1C6)&IF(RC[-26]="",,"|n"&R1C7&RC[-26])&IF(RC[-25]="",,"|n"&R1C8&RC[-25])&IF(RC[-24]="",,"|n"&R1C9&RC[-24])&IF(RC[-23]="",,"|n"&R1C10&RC[-23])&IF(RC[-22]="",,"|n"&R1C11&RC[-22])&IF(RC[-21]="",,"|n"&R1C12&RC[-21])&IF(RC[-19]&RC[-18]&RC[-17]&RC[-16]="",,"|n|n"&R1C13)&IF(RC[-19]="",,"|n"&R1C14&RC[-19])&IF(RC[-18]="",,"|n"&R1C15&RC[-18])&IF(RC[-17]="",,"|n"&R1C16&RC[-17])&IF(RC[-16]="",,"|n"&R1C17&RC[-16])&IF(RC[-15]="",,"|n"&R1C18&RC[-15])&IF(RC[-14]="",,"|n"&R1C19&RC[-14])&IF(RC[-13]="",,"|n"&R1C20&RC[-13])&IF(RC[-12]="",,"|n"&R1C21&RC[-12])&IF(RC[-11]="",,"|n"&R1C22&RC[-11])&IF(RC[-10]="",,"|n"&R1C23&RC[-10])&IF(RC[-9]="",,"|n"&R1C24&RC[-9])&IF(RC[-8]="",,"|n"&R1C25&RC[-8])&IF(RC[-7]="",,"|n"&R1C26&RC[-7])&IF(RC[-6]="",,"|n"&R1C27&RC[-6])&IF(RC[-5]="",,"|n"&R1C28&RC[-5])&IF(RC[-2]="",,"|n|n"&RC[-2]) -> |cFFFFFF99基础属性|r|n力量:7500|n护甲:37|n伤害增幅:2|n|n用于镶嵌到[剑,衣]上.|n镶嵌后不可取下!|n不需要的宝石可以在宠物处熔炼,用于宝石抽奖.
A60: 2 | B60: B | C60: [宝石] | D60: 修灭邪金 | G60: =IF(R[-33]C<>"",R[-33]C*3,"") -> 18000 | H60: =IF(R[-33]C<>"",R[-33]C*3,"") ->  | I60: =IF(R[-33]C<>"",R[-33]C*3,"") ->  | J60: =IF(R[-33]C<>"",R[-33]C*3,"") ->  | K60: =IF(R[-33]C<>"",R[-33]C*3,"") ->  | L60: =IF(R[-33]C<>"",INT(R[-33]C*1.5),"") -> 37 | M60: =IF(R[-33]C<>"",R[-33]C*2,"") ->  | N60: =IF(R[-33]C<>"",INT(R[-33]C*1.2),"") ->  | O60: =IF(R[-33]C<>"",INT(R[-33]C*1.2),"") ->  | P60: =IF(R[-33]C<>"",INT(R[-33]C*1.2),"") ->  | Q60: =IF(R[-33]C<>"",INT(R[-33]C*1.2),"") ->  | R60: =IF(R[-33]C<>"",INT(R[-33]C*1.2),"") -> 2 | AE60: 用于镶嵌到[剑,衣]上.|n镶嵌后不可取下!|n不需要的宝石可以在宠物处熔炼,用于宝石抽奖. | AF60: =VLOOKUP(RC[-31],Sheet2!R13C1:R19C2,2,0)&"."&VLOOKUP(RC[-30],Sheet2!R7C1:R12C2,2,0)&VLOOKUP(RC[-30],Sheet2!R1C1:R6C2,2,0)&RC[-29]&RC[-28]&RC[-27]&Sheet2!R1C3 -> 二.乙|cFF1BE6B8[宝石]修灭邪金|r | AG60: =IF(RC[-26]&RC[-25]&RC[-24]&RC[-23]&RC[-22]&RC[-21]="",,R1C6)&IF(RC[-26]="",,"|n"&R1C7&RC[-26])&IF(RC[-25]="",,"|n"&R1C8&RC[-25])&IF(RC[-24]="",,"|n"&R1C9&RC[-24])&IF(RC[-23]="",,"|n"&R1C10&RC[-23])&IF(RC[-22]="",,"|n"&R1C11&RC[-22])&IF(RC[-21]="",,"|n"&R1C12&RC[-21])&IF(RC[-19]&RC[-18]&RC[-17]&RC[-16]="",,"|n|n"&R1C13)&IF(RC[-19]="",,"|n"&R1C14&RC[-19])&IF(RC[-18]="",,"|n"&R1C15&RC[-18])&IF(RC[-17]="",,"|n"&R1C16&RC[-17])&IF(RC[-16]="",,"|n"&R1C17&RC[-16])&IF(RC[-15]="",,"|n"&R1C18&RC[-15])&IF(RC[-14]="",,"|n"&R1C19&RC[-14])&IF(RC[-13]="",,"|n"&R1C20&RC[-13])&IF(RC[-12]="",,"|n"&R1C21&RC[-12])&IF(RC[-11]="",,"|n"&R1C22&RC[-11])&IF(RC[-10]="",,"|n"&R1C23&RC[-10])&IF(RC[-9]="",,"|n"&R1C24&RC[-9])&IF(RC[-8]="",,"|n"&R1C25&RC[-8])&IF(RC[-7]="",,"|n"&R1C26&RC[-7])&IF(RC[-6]="",,"|n"&R1C27&RC[-6])&IF(RC[-5]="",,"|n"&R1C28&RC[-5])&IF(RC[-2]="",,"|n|n"&RC[-2]) -> |cFFFFFF99基础属性|r|n攻击:18000|n护甲:37|n伤害增幅:2|n|n用于镶嵌到[剑,衣]上.|n镶嵌后不可取下!|n不需要的宝石可以在宠物处熔炼,用于宝石抽奖.
A61: 2 | B61: B | C61: [宝石] | D61: 幽神奇石 | G61: =IF(R[-33]C<>"",R[-33]C*3,"") ->  | H61: =IF(R[-33]C<>"",R[-33]C*3,"") ->  | I61: =IF(R[-33]C<>"",R[-33]C*3,"") ->  | J61: =IF(R[-33]C<>"",R[-33]C*3,"") -> 7500 | K61: =IF(R[-33]C<>"",R[-33]C*3,"") ->  | L61: =IF(R[-33]C<>"",INT(R[-33]C*1.5),"") -> 37 | M61: =IF(R[-33]C<>"",R[-33]C*2,"") ->  | N61: =IF(R[-33]C<>"",INT(R[-33]C*1.2),"") ->  | O61: =IF(R[-33]C<>"",INT(R[-33]C*1.2),"") ->  | P61: =IF(R[-33]C<>"",INT(R[-33]C*1.2),"") ->  | Q61: =IF(R[-33]C<>"",INT(R[-33]C*1.2),"") ->  | R61: =IF(R[-33]C<>"",INT(R[-33]C*1.2),"") -> 2 | AE61: 用于镶嵌到[剑,衣]上.|n镶嵌后不可取下!|n不需要的宝石可以在宠物处熔炼,用于宝石抽奖. | AF61: =VLOOKUP(RC[-31],Sheet2!R13C1:R19C2,2,0)&"."&VLOOKUP(RC[-30],Sheet2!R7C1:R12C2,2,0)&VLOOKUP(RC[-30],Sheet2!R1C1:R6C2,2,0)&RC[-29]&RC[-28]&RC[-27]&Sheet2!R1C3 -> 二.乙|cFF1BE6B8[宝石]幽神奇石|r | AG61: =IF(RC[-26]&RC[-25]&RC[-24]&RC[-23]&RC[-22]&RC[-21]="",,R1C6)&IF(RC[-26]="",,"|n"&R1C7&RC[-26])&IF(RC[-25]="",,"|n"&R1C8&RC[-25])&IF(RC[-24]="",,"|n"&R1C9&RC[-24])&IF(RC[-23]="",,"|n"&R1C10&RC[-23])&IF(RC[-22]="",,"|n"&R1C11&RC[-22])&IF(RC[-21]="",,"|n"&R1C12&RC[-21])&IF(RC[-19]&RC[-18]&RC[-17]&RC[-16]="",,"|n|n"&R1C13)&IF(RC[-19]="",,"|n"&R1C14&RC[-19])&IF(RC[-18]="",,"|n"&R1C15&RC[-18])&IF(RC[-17]="",,"|n"&R1C16&RC[-17])&IF(RC[-16]="",,"|n"&R1C17&RC[-16])&IF(RC[-15]="",,"|n"&R1C18&RC[-15])&IF(RC[-14]="",,"|n"&R1C19&RC[-14])&IF(RC[-13]="",,"|n"&R1C20&RC[-13])&IF(RC[-12]="",,"|n"&R1C21&RC[-12])&IF(RC[-11]="",,"|n"&R1C22&RC[-11])&IF(RC[-10]="",,"|n"&R1C23&RC[-10])&IF(RC[-9]="",,"|n"&R1C24&RC[-9])&IF(RC[-8]="",,"|n"&R1C25&RC[-8])&IF(RC[-7]="",,"|n"&R1C26&RC[-7])&IF(RC[-6]="",,"|n"&R1C27&RC[-6])&IF(RC[-5]="",,"|n"&R1C28&RC[-5])&IF(RC[-2]="",,"|n|n"&RC[-2]) -> |cFFFFFF99基础属性|r|n智力:7500|n护甲:37|n伤害增幅:2|n|n用于镶嵌到[剑,衣]上.|n镶嵌后不可取下!|n不需要的宝石可以在宠物处熔炼,用于宝石抽奖.
A62: 2 | B62: B | C62: [宝石] | D62: 望月直玉 | G62: =IF(R[-33]C<>"",R[-33]C*3,"") ->  | H62: =IF(R[-33]C<>"",R[-33]C*3,"") ->  | I62: =IF(R[-33]C<>"",R[-33]C*3,"") -> 7500 | J62: =IF(R[-33]C<>"",R[-33]C*3,"") ->  | K62: =IF(R[-33]C<>"",R[-33]C*3,"") ->  | L62: =IF(R[-33]C<>"",INT(R[-33]C*1.5),"") -> 37 | M62: =IF(R[-33]C<>"",R[-33]C*2,"") ->  | N62: =IF(R[-33]C<>"",INT(R[-33]C*1.2),"") ->  | O62: =IF(R[-33]C<>"",INT(R[-33]C*1.2),"") ->  | P62: =IF(R[-33]C<>"",INT(R[-33]C*1.2),"") ->  | Q62: =IF(R[-33]C<>"",INT(R[-33]C*1.2),"") ->  | R62: =IF(R[-33]C<>"",INT(R[-33]C*1.2),"") -> 2 | AE62: 用于镶嵌到[剑,衣]上.|n镶嵌后不可取下!|n不需要的宝石可以在宠物处熔炼,用于宝石抽奖. | AF62: =VLOOKUP(RC[-31],Sheet2!R13C1:R19C2,2,0)&"."&VLOOKUP(RC[-30],Sheet2!R7C1:R12C2,2,0)&VLOOKUP(RC[-30],Sheet2!R1C1:R6C2,2,0)&RC[-29]&RC[-28]&RC[-27]&Sheet2!R1C3 -> 二.乙|cFF1BE6B8[宝石]望月直玉|r | AG62: =IF(RC[-26]&RC[-25]&RC[-24]&RC[-23]&RC[-22]&RC[-21]="",,R1C6)&IF(RC[-26]="",,"|n"&R1C7&RC[-26])&IF(RC[-25]="",,"|n"&R1C8&RC[-25])&IF(RC[-24]="",,"|n"&R1C9&RC[-24])&IF(RC[-23]="",,"|n"&R1C10&RC[-23])&IF(RC[-22]="",,"|n"&R1C11&RC[-22])&IF(RC[-21]="",,"|n"&R1C12&RC[-21])&IF(RC[-19]&RC[-18]&RC[-17]&RC[-16]="",,"|n|n"&R1C13)&IF(RC[-19]="",,"|n"&R1C14&RC[-19])&IF(RC[-18]="",,"|n"&R1C15&RC[-18])&IF(RC[-17]="",,"|n"&R1C16&RC[-17])&IF(RC[-16]="",,"|n"&R1C17&RC[-16])&IF(RC[-15]="",,"|n"&R1C18&RC[-15])&IF(RC[-14]="",,"|n"&R1C19&RC[-14])&IF(RC[-13]="",,"|n"&R1C20&RC[-13])&IF(RC[-12]="",,"|n"&R1C21&RC[-12])&IF(RC[-11]="",,"|n"&R1C22&RC[-11])&IF(RC[-10]="",,"|n"&R1C23&RC[-10])&IF(RC[-9]="",,"|n"&R1C24&RC[-9])&IF(RC[-8]="",,"|n"&R1C25&RC[-8])&IF(RC[-7]="",,"|n"&R1C26&RC[-7])&IF(RC[-6]="",,"|n"&R1C27&RC[-6])&IF(RC[-5]="",,"|n"&R1C28&RC[-5])&IF(RC[-2]="",,"|n|n"&RC[-2]) -> |cFFFFFF99基础属性|r|n敏捷:7500|n护甲:37|n伤害增幅:2|n|n用于镶嵌到[剑,衣]上.|n镶嵌后不可取下!|n不需要的宝石可以在宠物处熔炼,用于宝石抽奖.
A63: 2 | B63: A | C63: [宝石] | D63: 武动之魂 | G63: =IF(R[-33]C<>"",R[-33]C*3,"") ->  | H63: =IF(R[-33]C<>"",R[-33]C*3,"") -> 3600 | I63: =IF(R[-33]C<>"",R[-33]C*3,"") -> 3600 | J63: =IF(R[-33]C<>"",R[-33]C*3,"") -> 3600 | K63: =IF(R[-33]C<>"",R[-33]C*3,"") ->  | L63: =IF(R[-33]C<>"",INT(R[-33]C*1.5),"") ->  | M63: =IF(R[-33]C<>"",R[-33]C*2,"") ->  | N63: =IF(R[-33]C<>"",INT(R[-33]C*1.2),"") -> 7 | O63: =IF(R[-33]C<>"",INT(R[-33]C*1.2),"") ->  | P63: =IF(R[-33]C<>"",INT(R[-33]C*1.2),"") ->  | Q63: =IF(R[-33]C<>"",INT(R[-33]C*1.2),"") ->  | R63: =IF(R[-33]C<>"",INT(R[-33]C*1.2),"") -> 4 | S63: =IF(R[-33]C<>"",INT(R[-33]C*1.2),"") ->  | T63: =IF(R[-33]C<>"",INT(R[-33]C*1.2),"") ->  | AE63: 用于镶嵌到[剑,衣]上.|n镶嵌后不可取下!|n不需要的宝石可以在宠物处熔炼,用于宝石抽奖. | AF63: =VLOOKUP(RC[-31],Sheet2!R13C1:R19C2,2,0)&"."&VLOOKUP(RC[-30],Sheet2!R7C1:R12C2,2,0)&VLOOKUP(RC[-30],Sheet2!R1C1:R6C2,2,0)&RC[-29]&RC[-28]&RC[-27]&Sheet2!R1C3 -> 二.甲|cFF33FF00[宝石]武动之魂|r | AG63: =IF(RC[-26]&RC[-25]&RC[-24]&RC[-23]&RC[-22]&RC[-21]="",,R1C6)&IF(RC[-26]="",,"|n"&R1C7&RC[-26])&IF(RC[-25]="",,"|n"&R1C8&RC[-25])&IF(RC[-24]="",,"|n"&R1C9&RC[-24])&IF(RC[-23]="",,"|n"&R1C10&RC[-23])&IF(RC[-22]="",,"|n"&R1C11&RC[-22])&IF(RC[-21]="",,"|n"&R1C12&RC[-21])&IF(RC[-19]&RC[-18]&RC[-17]&RC[-16]="",,"|n|n"&R1C13)&IF(RC[-19]="",,"|n"&R1C14&RC[-19])&IF(RC[-18]="",,"|n"&R1C15&RC[-18])&IF(RC[-17]="",,"|n"&R1C16&RC[-17])&IF(RC[-16]="",,"|n"&R1C17&RC[-16])&IF(RC[-15]="",,"|n"&R1C18&RC[-15])&IF(RC[-14]="",,"|n"&R1C19&RC[-14])&IF(RC[-13]="",,"|n"&R1C20&RC[-13])&IF(RC[-12]="",,"|n"&R1C21&RC[-12])&IF(RC[-11]="",,"|n"&R1C22&RC[-11])&IF(RC[-10]="",,"|n"&R1C23&RC[-10])&IF(RC[-9]="",,"|n"&R1C24&RC[-9])&IF(RC[-8]="",,"|n"&R1C25&RC[-8])&IF(RC[-7]="",,"|n"&R1C26&RC[-7])&IF(RC[-6]="",,"|n"&R1C27&RC[-6])&IF(RC[-5]="",,"|n"&R1C28&RC[-5])&IF(RC[-2]="",,"|n|n"&RC[-2]) -> |cFFFFFF99基础属性|r|n力量:3600|n敏捷:3600|n智力:3600|n|n|cFFFFFF55附加属性|r(%)|n攻速:7|n伤害增幅:4|n|n用于镶嵌到[剑,衣]上.|n镶嵌后不可取下!|n不需要的宝石可以在宠物处熔炼,用于宝石抽奖.
A64: 2 | B64: A | C64: [宝石] | D64: 瘟疫之源 | G64: =IF(R[-33]C<>"",R[-33]C*3,"") -> 24000 | H64: =IF(R[-33]C<>"",R[-33]C*3,"") ->  | I64: =IF(R[-33]C<>"",R[-33]C*3,"") ->  | J64: =IF(R[-33]C<>"",R[-33]C*3,"") ->  | K64: =IF(R[-33]C<>"",R[-33]C*3,"") ->  | L64: =IF(R[-33]C<>"",INT(R[-33]C*1.5),"") ->  | M64: =IF(R[-33]C<>"",R[-33]C*2,"") ->  | N64: =IF(R[-33]C<>"",INT(R[-33]C*1.2),"") -> 7 | O64: =IF(R[-33]C<>"",INT(R[-33]C*1.2),"") ->  | P64: =IF(R[-33]C<>"",INT(R[-33]C*1.2),"") ->  | Q64: =IF(R[-33]C<>"",INT(R[-33]C*1.2),"") ->  | R64: =IF(R[-33]C<>"",INT(R[-33]C*1.2),"") -> 4 | S64: =IF(R[-33]C<>"",INT(R[-33]C*1.2),"") ->  | T64: =IF(R[-33]C<>"",INT(R[-33]C*1.2),"") ->  | AE64: 用于镶嵌到[剑,衣]上.|n镶嵌后不可取下!|n不需要的宝石可以在宠物处熔炼,用于宝石抽奖. | AF64: =VLOOKUP(RC[-31],Sheet2!R13C1:R19C2,2,0)&"."&VLOOKUP(RC[-30],Sheet2!R7C1:R12C2,2,0)&VLOOKUP(RC[-30],Sheet2!R1C1:R6C2,2,0)&RC[-29]&RC[-28]&RC[-27]&Sheet2!R1C3 -> 二.甲|cFF33FF00[宝石]瘟疫之源|r | AG64: =IF(RC[-26]&RC[-25]&RC[-24]&RC[-23]&RC[-22]&RC[-21]="",,R1C6)&IF(RC[-26]="",,"|n"&R1C7&RC[-26])&IF(RC[-25]="",,"|n"&R1C8&RC[-25])&IF(RC[-24]="",,"|n"&R1C9&RC[-24])&IF(RC[-23]="",,"|n"&R1C10&RC[-23])&IF(RC[-22]="",,"|n"&R1C11&RC[-22])&IF(RC[-21]="",,"|n"&R1C12&RC[-21])&IF(RC[-19]&RC[-18]&RC[-17]&RC[-16]="",,"|n|n"&R1C13)&IF(RC[-19]="",,"|n"&R1C14&RC[-19])&IF(RC[-18]="",,"|n"&R1C15&RC[-18])&IF(RC[-17]="",,"|n"&R1C16&RC[-17])&IF(RC[-16]="",,"|n"&R1C17&RC[-16])&IF(RC[-15]="",,"|n"&R1C18&RC[-15])&IF(RC[-14]="",,"|n"&R1C19&RC[-14])&IF(RC[-13]="",,"|n"&R1C20&RC[-13])&IF(RC[-12]="",,"|n"&R1C21&RC[-12])&IF(RC[-11]="",,"|n"&R1C22&RC[-11])&IF(RC[-10]="",,"|n"&R1C23&RC[-10])&IF(RC[-9]="",,"|n"&R1C24&RC[-9])&IF(RC[-8]="",,"|n"&R1C25&RC[-8])&IF(RC[-7]="",,"|n"&R1C26&RC[-7])&IF(RC[-6]="",,"|n"&R1C27&RC[-6])&IF(RC[-5]="",,"|n"&R1C28&RC[-5])&IF(RC[-2]="",,"|n|n"&RC[-2]) -> |cFFFFFF99基础属性|r|n攻击:24000|n|n|cFFFFFF55附加属性|r(%)|n攻速:7|n伤害增幅:4|n|n用于镶嵌到[剑,衣]上.|n镶嵌后不可取下!|n不需要的宝石可以在宠物处熔炼,用于宝石抽奖.
A65: 2 | B65: S | C65: [宝石] | D65: 龙战 - 怒心 | G65: =IF(R[-33]C<>"",R[-33]C*3,"") ->  | H65: =IF(R[-33]C<>"",R[-33]C*3,"") ->  | I65: =IF(R[-33]C<>"",R[-33]C*3,"") ->  | J65: =IF(R[-33]C<>"",R[-33]C*3,"") ->  | K65: =IF(R[-33]C<>"",R[-33]C*3,"") -> 90000 | L65: =IF(R[-33]C<>"",INT(R[-33]C*1.5),"") -> 225 | M65: =IF(R[-33]C<>"",R[-33]C*2,"") ->  | N65: =IF(R[-33]C<>"",INT(R[-33]C*1.2),"") ->  | O65: =IF(R[-33]C<>"",INT(R[-33]C*1.2),"") -> 1 | P65: =IF(R[-33]C<>"",INT(R[-33]C*1.2),"") ->  | Q65: =IF(R[-33]C<>"",INT(R[-33]C*1.2),"") ->  | R65: =IF(R[-33]C<>"",INT(R[-33]C*1.2),"") -> 4 | S65: =IF(R[-33]C<>"",INT(R[-33]C*1.2),"") ->  | T65: =IF(R[-33]C<>"",INT(R[-33]C*1.2),"") ->  | AE65: 用于镶嵌到[剑,衣]上.|n镶嵌后不可取下!|n不需要的宝石可以在宠物处熔炼,用于宝石抽奖. | AF65: =VLOOKUP(RC[-31],Sheet2!R13C1:R19C2,2,0)&"."&VLOOKUP(RC[-30],Sheet2!R7C1:R12C2,2,0)&VLOOKUP(RC[-30],Sheet2!R1C1:R6C2,2,0)&RC[-29]&RC[-28]&RC[-27]&Sheet2!R1C3 -> 二.绝|cFFFF9933[宝石]龙战 - 怒心|r | AG65: =IF(RC[-26]&RC[-25]&RC[-24]&RC[-23]&RC[-22]&RC[-21]="",,R1C6)&IF(RC[-26]="",,"|n"&R1C7&RC[-26])&IF(RC[-25]="",,"|n"&R1C8&RC[-25])&IF(RC[-24]="",,"|n"&R1C9&RC[-24])&IF(RC[-23]="",,"|n"&R1C10&RC[-23])&IF(RC[-22]="",,"|n"&R1C11&RC[-22])&IF(RC[-21]="",,"|n"&R1C12&RC[-21])&IF(RC[-19]&RC[-18]&RC[-17]&RC[-16]="",,"|n|n"&R1C13)&IF(RC[-19]="",,"|n"&R1C14&RC[-19])&IF(RC[-18]="",,"|n"&R1C15&RC[-18])&IF(RC[-17]="",,"|n"&R1C16&RC[-17])&IF(RC[-16]="",,"|n"&R1C17&RC[-16])&IF(RC[-15]="",,"|n"&R1C18&RC[-15])&IF(RC[-14]="",,"|n"&R1C19&RC[-14])&IF(RC[-13]="",,"|n"&R1C20&RC[-13])&IF(RC[-12]="",,"|n"&R1C21&RC[-12])&IF(RC[-11]="",,"|n"&R1C22&RC[-11])&IF(RC[-10]="",,"|n"&R1C23&RC[-10])&IF(RC[-9]="",,"|n"&R1C24&RC[-9])&IF(RC[-8]="",,"|n"&R1C25&RC[-8])&IF(RC[-7]="",,"|n"&R1C26&RC[-7])&IF(RC[-6]="",,"|n"&R1C27&RC[-6])&IF(RC[-5]="",,"|n"&R1C28&RC[-5])&IF(RC[-2]="",,"|n|n"&RC[-2]) -> |cFFFFFF99基础属性|r|n血量:90000|n护甲:225|n|n|cFFFFFF55附加属性|r(%)|n攻击吸血:1|n伤害增幅:4|n|n用于镶嵌到[剑,衣]上.|n镶嵌后不可取下!|n不需要的宝石可以在宠物处熔炼,用于宝石抽奖.
A66: 2 | B66: S | C66: [宝石] | D66: 龙战 - 激魂 | G66: =IF(R[-33]C<>"",R[-33]C*3,"") -> 7500 | H66: =IF(R[-33]C<>"",R[-33]C*3,"") ->  | I66: =IF(R[-33]C<>"",R[-33]C*3,"") ->  | J66: =IF(R[-33]C<>"",R[-33]C*3,"") ->  | K66: =IF(R[-33]C<>"",R[-33]C*3,"") ->  | L66: =IF(R[-33]C<>"",INT(R[-33]C*1.5),"") ->  | M66: =IF(R[-33]C<>"",R[-33]C*4,"") ->  | N66: =IF(R[-33]C<>"",INT(R[-33]C*1.2),"") ->  | O66: =IF(R[-33]C<>"",INT(R[-33]C*1.2),"") ->  | P66: =IF(R[-33]C<>"",INT(R[-33]C*1.2),"") -> 6 | Q66: =IF(R[-33]C<>"",INT(R[-33]C*1.2),"") -> 24 | R66: =IF(R[-33]C<>"",INT(R[-33]C*1.2),"") -> 4 | S66: =IF(R[-33]C<>"",INT(R[-33]C*1.2),"") ->  | T66: =IF(R[-33]C<>"",INT(R[-33]C*1.2),"") ->  | AE66: 用于镶嵌到[剑,衣]上.|n镶嵌后不可取下!|n不需要的宝石可以在宠物处熔炼,用于宝石抽奖. | AF66: =VLOOKUP(RC[-31],Sheet2!R13C1:R19C2,2,0)&"."&VLOOKUP(RC[-30],Sheet2!R7C1:R12C2,2,0)&VLOOKUP(RC[-30],Sheet2!R1C1:R6C2,2,0)&RC[-29]&RC[-28]&RC[-27]&Sheet2!R1C3 -> 二.绝|cFFFF9933[宝石]龙战 - 激魂|r | AG66: =IF(RC[-26]&RC[-25]&RC[-24]&RC[-23]&RC[-22]&RC[-21]="",,R1C6)&IF(RC[-26]="",,"|n"&R1C7&RC[-26])&IF(RC[-25]="",,"|n"&R1C8&RC[-25])&IF(RC[-24]="",,"|n"&R1C9&RC[-24])&IF(RC[-23]="",,"|n"&R1C10&RC[-23])&IF(RC[-22]="",,"|n"&R1C11&RC[-22])&IF(RC[-21]="",,"|n"&R1C12&RC[-21])&IF(RC[-19]&RC[-18]&RC[-17]&RC[-16]="",,"|n|n"&R1C13)&IF(RC[-19]="",,"|n"&R1C14&RC[-19])&IF(RC[-18]="",,"|n"&R1C15&RC[-18])&IF(RC[-17]="",,"|n"&R1C16&RC[-17])&IF(RC[-16]="",,"|n"&R1C17&RC[-16])&IF(RC[-15]="",,"|n"&R1C18&RC[-15])&IF(RC[-14]="",,"|n"&R1C19&RC[-14])&IF(RC[-13]="",,"|n"&R1C20&RC[-13])&IF(RC[-12]="",,"|n"&R1C21&RC[-12])&IF(RC[-11]="",,"|n"&R1C22&RC[-11])&IF(RC[-10]="",,"|n"&R1C23&RC[-10])&IF(RC[-9]="",,"|n"&R1C24&RC[-9])&IF(RC[-8]="",,"|n"&R1C25&RC[-8])&IF(RC[-7]="",,"|n"&R1C26&RC[-7])&IF(RC[-6]="",,"|n"&R1C27&RC[-6])&IF(RC[-5]="",,"|n"&R1C28&RC[-5])&IF(RC[-2]="",,"|n|n"&RC[-2]) -> |cFFFFFF99基础属性|r|n攻击:7500|n|n|cFFFFFF55附加属性|r(%)|n暴击概率:6|n暴击伤害:24|n伤害增幅:4|n|n用于镶嵌到[剑,衣]上.|n镶嵌后不可取下!|n不需要的宝石可以在宠物处熔炼,用于宝石抽奖.
A67: 2 | B67: X | C67: [宝石] | D67: 上古遗物-无魂 | G67: =IF(R[-33]C<>"",R[-33]C*3,"") ->  | H67: =IF(R[-33]C<>"",R[-33]C*3,"") ->  | I67: =IF(R[-33]C<>"",R[-33]C*3,"") ->  | J67: =IF(R[-33]C<>"",R[-33]C*3,"") ->  | K67: =IF(R[-33]C<>"",R[-33]C*3,"") -> 180000 | L67: =IF(R[-33]C<>"",INT(R[-33]C*1.5),"") -> 300 | M67: =IF(R[-33]C<>"",R[-33]C*4,"") ->  | N67: =IF(R[-33]C<>"",INT(R[-33]C*1.2),"") ->  | O67: =IF(R[-33]C<>"",INT(R[-33]C*1.2),"") ->  | P67: =IF(R[-33]C<>"",INT(R[-33]C*1.2),"") ->  | Q67: =IF(R[-33]C<>"",INT(R[-33]C*1.2),"") -> 24 | R67: =IF(R[-33]C<>"",INT(R[-33]C*1.2),"") -> 9 | S67: =IF(R[-33]C<>"",INT(R[-33]C*1.2),"") ->  | T67: =IF(R[-33]C<>"",INT(R[-33]C*1.2),"") ->  | V67: 10 | AE67: 用于镶嵌到[剑,衣]上.|n镶嵌后不可取下!|n不需要的宝石可以在宠物处熔炼,用于宝石抽奖. | AF67: =VLOOKUP(RC[-31],Sheet2!R13C1:R19C2,2,0)&"."&VLOOKUP(RC[-30],Sheet2!R7C1:R12C2,2,0)&VLOOKUP(RC[-30],Sheet2!R1C1:R6C2,2,0)&RC[-29]&RC[-28]&RC[-27]&Sheet2!R1C3 -> 二.神|Cffff0000[宝石]上古遗物-无魂|r | AG67: =IF(RC[-26]&RC[-25]&RC[-24]&RC[-23]&RC[-22]&RC[-21]="",,R1C6)&IF(RC[-26]="",,"|n"&R1C7&RC[-26])&IF(RC[-25]="",,"|n"&R1C8&RC[-25])&IF(RC[-24]="",,"|n"&R1C9&RC[-24])&IF(RC[-23]="",,"|n"&R1C10&RC[-23])&IF(RC[-22]="",,"|n"&R1C11&RC[-22])&IF(RC[-21]="",,"|n"&R1C12&RC[-21])&IF(RC[-19]&RC[-18]&RC[-17]&RC[-16]="",,"|n|n"&R1C13)&IF(RC[-19]="",,"|n"&R1C14&RC[-19])&IF(RC[-18]="",,"|n"&R1C15&RC[-18])&IF(RC[-17]="",,"|n"&R1C16&RC[-17])&IF(RC[-16]="",,"|n"&R1C17&RC[-16])&IF(RC[-15]="",,"|n"&R1C18&RC[-15])&IF(RC[-14]="",,"|n"&R1C19&RC[-14])&IF(RC[-13]="",,"|n"&R1C20&RC[-13])&IF(RC[-12]="",,"|n"&R1C21&RC[-12])&IF(RC[-11]="",,"|n"&R1C22&RC[-11])&IF(RC[-10]="",,"|n"&R1C23&RC[-10])&IF(RC[-9]="",,"|n"&R1C24&RC[-9])&IF(RC[-8]="",,"|n"&R1C25&RC[-8])&IF(RC[-7]="",,"|n"&R1C26&RC[-7])&IF(RC[-6]="",,"|n"&R1C27&RC[-6])&IF(RC[-5]="",,"|n"&R1C28&RC[-5])&IF(RC[-2]="",,"|n|n"&RC[-2]) -> |cFFFFFF99基础属性|r|n血量:180000|n护甲:300|n|n|cFFFFFF55附加属性|r(%)|n暴击伤害:24|n伤害增幅:9|n伤害减免:10|n|n用于镶嵌到[剑,衣]上.|n镶嵌后不可取下!|n不需要的宝石可以在宠物处熔炼,用于宝石抽奖.
A68: 3 | B68: D | C68: [宝石] | D68: 蚀肉 | G68: =IF(R[-66]C<>"",R[-66]C*12,"") ->  | H68: =IF(R[-66]C<>"",R[-66]C*12,"") ->  | I68: =IF(R[-66]C<>"",R[-66]C*12,"") ->  | J68: =IF(R[-66]C<>"",R[-66]C*12,"") ->  | K68: =IF(R[-66]C<>"",R[-66]C*12,"") ->  | L68: =IF(R[-66]C<>"",INT(R[-66]C*2.5),"") ->  | M68: =IF(R[-66]C<>"",R[-66]C*6,"") ->  | N68: =IF(R[-66]C<>"",INT(R[-66]C*1.4),"") ->  | O68: =IF(R[-66]C<>"",INT(R[-66]C*1.4),"") ->  | AE68: 用于镶嵌到[剑,衣]上.|n镶嵌后不可取下!|n不需要的宝石可以在宠物处熔炼,用于宝石抽奖. | AF68: =VLOOKUP(RC[-31],Sheet2!R13C1:R19C2,2,0)&"."&VLOOKUP(RC[-30],Sheet2!R7C1:R12C2,2,0)&VLOOKUP(RC[-30],Sheet2!R1C1:R6C2,2,0)&RC[-29]&RC[-28]&RC[-27]&Sheet2!R1C3 -> 三.丁|cFF999999[宝石]蚀肉|r | AG68: =IF(RC[-26]&RC[-25]&RC[-24]&RC[-23]&RC[-22]&RC[-21]="",,R1C6)&IF(RC[-26]="",,"|n"&R1C7&RC[-26])&IF(RC[-25]="",,"|n"&R1C8&RC[-25])&IF(RC[-24]="",,"|n"&R1C9&RC[-24])&IF(RC[-23]="",,"|n"&R1C10&RC[-23])&IF(RC[-22]="",,"|n"&R1C11&RC[-22])&IF(RC[-21]="",,"|n"&R1C12&RC[-21])&IF(RC[-19]&RC[-18]&RC[-17]&RC[-16]="",,"|n|n"&R1C13)&IF(RC[-19]="",,"|n"&R1C14&RC[-19])&IF(RC[-18]="",,"|n"&R1C15&RC[-18])&IF(RC[-17]="",,"|n"&R1C16&RC[-17])&IF(RC[-16]="",,"|n"&R1C17&RC[-16])&IF(RC[-15]="",,"|n"&R1C18&RC[-15])&IF(RC[-14]="",,"|n"&R1C19&RC[-14])&IF(RC[-13]="",,"|n"&R1C20&RC[-13])&IF(RC[-12]="",,"|n"&R1C21&RC[-12])&IF(RC[-11]="",,"|n"&R1C22&RC[-11])&IF(RC[-10]="",,"|n"&R1C23&RC[-10])&IF(RC[-9]="",,"|n"&R1C24&RC[-9])&IF(RC[-8]="",,"|n"&R1C25&RC[-8])&IF(RC[-7]="",,"|n"&R1C26&RC[-7])&IF(RC[-6]="",,"|n"&R1C27&RC[-6])&IF(RC[-5]="",,"|n"&R1C28&RC[-5])&IF(RC[-2]="",,"|n|n"&RC[-2]) -> |n|n用于镶嵌到[剑,衣]上.|n镶嵌后不可取下!|n不需要的宝石可以在宠物处熔炼,用于宝石抽奖.
A69: 3 | B69: D | C69: [宝石] | D69: 镏金 | G69: =IF(R[-66]C<>"",R[-66]C*12,"") ->  | H69: =IF(R[-66]C<>"",R[-66]C*12,"") ->  | I69: =IF(R[-66]C<>"",R[-66]C*12,"") ->  | J69: =IF(R[-66]C<>"",R[-66]C*12,"") ->  | K69: =IF(R[-66]C<>"",R[-66]C*12,"") ->  | L69: =IF(R[-66]C<>"",INT(R[-66]C*2.5),"") ->  | M69: =IF(R[-66]C<>"",R[-66]C*6,"") ->  | N69: =IF(R[-66]C<>"",INT(R[-66]C*1.4),"") ->  | O69: =IF(R[-66]C<>"",INT(R[-66]C*1.4),"") ->  | AE69: 用于镶嵌到[剑,衣]上.|n镶嵌后不可取下!|n不需要的宝石可以在宠物处熔炼,用于宝石抽奖. | AF69: =VLOOKUP(RC[-31],Sheet2!R13C1:R19C2,2,0)&"."&VLOOKUP(RC[-30],Sheet2!R7C1:R12C2,2,0)&VLOOKUP(RC[-30],Sheet2!R1C1:R6C2,2,0)&RC[-29]&RC[-28]&RC[-27]&Sheet2!R1C3 -> 三.丁|cFF999999[宝石]镏金|r | AG69: =IF(RC[-26]&RC[-25]&RC[-24]&RC[-23]&RC[-22]&RC[-21]="",,R1C6)&IF(RC[-26]="",,"|n"&R1C7&RC[-26])&IF(RC[-25]="",,"|n"&R1C8&RC[-25])&IF(RC[-24]="",,"|n"&R1C9&RC[-24])&IF(RC[-23]="",,"|n"&R1C10&RC[-23])&IF(RC[-22]="",,"|n"&R1C11&RC[-22])&IF(RC[-21]="",,"|n"&R1C12&RC[-21])&IF(RC[-19]&RC[-18]&RC[-17]&RC[-16]="",,"|n|n"&R1C13)&IF(RC[-19]="",,"|n"&R1C14&RC[-19])&IF(RC[-18]="",,"|n"&R1C15&RC[-18])&IF(RC[-17]="",,"|n"&R1C16&RC[-17])&IF(RC[-16]="",,"|n"&R1C17&RC[-16])&IF(RC[-15]="",,"|n"&R1C18&RC[-15])&IF(RC[-14]="",,"|n"&R1C19&RC[-14])&IF(RC[-13]="",,"|n"&R1C20&RC[-13])&IF(RC[-12]="",,"|n"&R1C21&RC[-12])&IF(RC[-11]="",,"|n"&R1C22&RC[-11])&IF(RC[-10]="",,"|n"&R1C23&RC[-10])&IF(RC[-9]="",,"|n"&R1C24&RC[-9])&IF(RC[-8]="",,"|n"&R1C25&RC[-8])&IF(RC[-7]="",,"|n"&R1C26&RC[-7])&IF(RC[-6]="",,"|n"&R1C27&RC[-6])&IF(RC[-5]="",,"|n"&R1C28&RC[-5])&IF(RC[-2]="",,"|n|n"&RC[-2]) -> |n|n用于镶嵌到[剑,衣]上.|n镶嵌后不可取下!|n不需要的宝石可以在宠物处熔炼,用于宝石抽奖.
A70: 3 | B70: D | C70: [宝石] | D70: 豹爪 | G70: =IF(R[-66]C<>"",R[-66]C*12,"") ->  | H70: =IF(R[-66]C<>"",R[-66]C*12,"") ->  | I70: =IF(R[-66]C<>"",R[-66]C*12,"") ->  | J70: =IF(R[-66]C<>"",R[-66]C*12,"") ->  | K70: =IF(R[-66]C<>"",R[-66]C*12,"") ->  | L70: =IF(R[-66]C<>"",INT(R[-66]C*2.5),"") ->  | M70: =IF(R[-66]C<>"",R[-66]C*6,"") ->  | N70: =IF(R[-66]C<>"",INT(R[-66]C*1.4),"") ->  | O70: =IF(R[-66]C<>"",INT(R[-66]C*1.4),"") ->  | AE70: 用于镶嵌到[剑,衣]上.|n镶嵌后不可取下!|n不需要的宝石可以在宠物处熔炼,用于宝石抽奖. | AF70: =VLOOKUP(RC[-31],Sheet2!R13C1:R19C2,2,0)&"."&VLOOKUP(RC[-30],Sheet2!R7C1:R12C2,2,0)&VLOOKUP(RC[-30],Sheet2!R1C1:R6C2,2,0)&RC[-29]&RC[-28]&RC[-27]&Sheet2!R1C3 -> 三.丁|cFF999999[宝石]豹爪|r | AG70: =IF(RC[-26]&RC[-25]&RC[-24]&RC[-23]&RC[-22]&RC[-21]="",,R1C6)&IF(RC[-26]="",,"|n"&R1C7&RC[-26])&IF(RC[-25]="",,"|n"&R1C8&RC[-25])&IF(RC[-24]="",,"|n"&R1C9&RC[-24])&IF(RC[-23]="",,"|n"&R1C10&RC[-23])&IF(RC[-22]="",,"|n"&R1C11&RC[-22])&IF(RC[-21]="",,"|n"&R1C12&RC[-21])&IF(RC[-19]&RC[-18]&RC[-17]&RC[-16]="",,"|n|n"&R1C13)&IF(RC[-19]="",,"|n"&R1C14&RC[-19])&IF(RC[-18]="",,"|n"&R1C15&RC[-18])&IF(RC[-17]="",,"|n"&R1C16&RC[-17])&IF(RC[-16]="",,"|n"&R1C17&RC[-16])&IF(RC[-15]="",,"|n"&R1C18&RC[-15])&IF(RC[-14]="",,"|n"&R1C19&RC[-14])&IF(RC[-13]="",,"|n"&R1C20&RC[-13])&IF(RC[-12]="",,"|n"&R1C21&RC[-12])&IF(RC[-11]="",,"|n"&R1C22&RC[-11])&IF(RC[-10]="",,"|n"&R1C23&RC[-10])&IF(RC[-9]="",,"|n"&R1C24&RC[-9])&IF(RC[-8]="",,"|n"&R1C25&RC[-8])&IF(RC[-7]="",,"|n"&R1C26&RC[-7])&IF(RC[-6]="",,"|n"&R1C27&RC[-6])&IF(RC[-5]="",,"|n"&R1C28&RC[-5])&IF(RC[-2]="",,"|n|n"&RC[-2]) -> |n|n用于镶嵌到[剑,衣]上.|n镶嵌后不可取下!|n不需要的宝石可以在宠物处熔炼,用于宝石抽奖.
A71: 3 | B71: D | C71: [宝石] | D71: 影游 | G71: =IF(R[-66]C<>"",R[-66]C*12,"") ->  | H71: =IF(R[-66]C<>"",R[-66]C*12,"") ->  | I71: =IF(R[-66]C<>"",R[-66]C*12,"") ->  | J71: =IF(R[-66]C<>"",R[-66]C*12,"") ->  | K71: =IF(R[-66]C<>"",R[-66]C*12,"") ->  | L71: =IF(R[-66]C<>"",INT(R[-66]C*2.5),"") ->  | M71: =IF(R[-66]C<>"",R[-66]C*6,"") ->  | N71: =IF(R[-66]C<>"",INT(R[-66]C*1.4),"") ->  | O71: =IF(R[-66]C<>"",INT(R[-66]C*1.4),"") ->  | AE71: 用于镶嵌到[剑,衣]上.|n镶嵌后不可取下!|n不需要的宝石可以在宠物处熔炼,用于宝石抽奖. | AF71: =VLOOKUP(RC[-31],Sheet2!R13C1:R19C2,2,0)&"."&VLOOKUP(RC[-30],Sheet2!R7C1:R12C2,2,0)&VLOOKUP(RC[-30],Sheet2!R1C1:R6C2,2,0)&RC[-29]&RC[-28]&RC[-27]&Sheet2!R1C3 -> 三.丁|cFF999999[宝石]影游|r | AG71: =IF(RC[-26]&RC[-25]&RC[-24]&RC[-23]&RC[-22]&RC[-21]="",,R1C6)&IF(RC[-26]="",,"|n"&R1C7&RC[-26])&IF(RC[-25]="",,"|n"&R1C8&RC[-25])&IF(RC[-24]="",,"|n"&R1C9&RC[-24])&IF(RC[-23]="",,"|n"&R1C10&RC[-23])&IF(RC[-22]="",,"|n"&R1C11&RC[-22])&IF(RC[-21]="",,"|n"&R1C12&RC[-21])&IF(RC[-19]&RC[-18]&RC[-17]&RC[-16]="",,"|n|n"&R1C13)&IF(RC[-19]="",,"|n"&R1C14&RC[-19])&IF(RC[-18]="",,"|n"&R1C15&RC[-18])&IF(RC[-17]="",,"|n"&R1C16&RC[-17])&IF(RC[-16]="",,"|n"&R1C17&RC[-16])&IF(RC[-15]="",,"|n"&R1C18&RC[-15])&IF(RC[-14]="",,"|n"&R1C19&RC[-14])&IF(RC[-13]="",,"|n"&R1C20&RC[-13])&IF(RC[-12]="",,"|n"&R1C21&RC[-12])&IF(RC[-11]="",,"|n"&R1C22&RC[-11])&IF(RC[-10]="",,"|n"&R1C23&RC[-10])&IF(RC[-9]="",,"|n"&R1C24&RC[-9])&IF(RC[-8]="",,"|n"&R1C25&RC[-8])&IF(RC[-7]="",,"|n"&R1C26&RC[-7])&IF(RC[-6]="",,"|n"&R1C27&RC[-6])&IF(RC[-5]="",,"|n"&R1C28&RC[-5])&IF(RC[-2]="",,"|n|n"&RC[-2]) -> |n|n用于镶嵌到[剑,衣]上.|n镶嵌后不可取下!|n不需要的宝石可以在宠物处熔炼,用于宝石抽奖.
A72: 3 | B72: D | C72: [宝石] | D72: 凤王 | G72: =IF(R[-66]C<>"",R[-66]C*12,"") ->  | H72: =IF(R[-66]C<>"",R[-66]C*12,"") ->  | I72: =IF(R[-66]C<>"",R[-66]C*12,"") ->  | J72: =IF(R[-66]C<>"",R[-66]C*12,"") ->  | K72: =IF(R[-66]C<>"",R[-66]C*12,"") ->  | L72: =IF(R[-66]C<>"",INT(R[-66]C*2.5),"") ->  | M72: =IF(R[-66]C<>"",R[-66]C*6,"") ->  | N72: =IF(R[-66]C<>"",INT(R[-66]C*1.4),"") ->  | O72: =IF(R[-66]C<>"",INT(R[-66]C*1.4),"") ->  | AE72: 用于镶嵌到[剑,衣]上.|n镶嵌后不可取下!|n不需要的宝石可以在宠物处熔炼,用于宝石抽奖. | AF72: =VLOOKUP(RC[-31],Sheet2!R13C1:R19C2,2,0)&"."&VLOOKUP(RC[-30],Sheet2!R7C1:R12C2,2,0)&VLOOKUP(RC[-30],Sheet2!R1C1:R6C2,2,0)&RC[-29]&RC[-28]&RC[-27]&Sheet2!R1C3 -> 三.丁|cFF999999[宝石]凤王|r | AG72: =IF(RC[-26]&RC[-25]&RC[-24]&RC[-23]&RC[-22]&RC[-21]="",,R1C6)&IF(RC[-26]="",,"|n"&R1C7&RC[-26])&IF(RC[-25]="",,"|n"&R1C8&RC[-25])&IF(RC[-24]="",,"|n"&R1C9&RC[-24])&IF(RC[-23]="",,"|n"&R1C10&RC[-23])&IF(RC[-22]="",,"|n"&R1C11&RC[-22])&IF(RC[-21]="",,"|n"&R1C12&RC[-21])&IF(RC[-19]&RC[-18]&RC[-17]&RC[-16]="",,"|n|n"&R1C13)&IF(RC[-19]="",,"|n"&R1C14&RC[-19])&IF(RC[-18]="",,"|n"&R1C15&RC[-18])&IF(RC[-17]="",,"|n"&R1C16&RC[-17])&IF(RC[-16]="",,"|n"&R1C17&RC[-16])&IF(RC[-15]="",,"|n"&R1C18&RC[-15])&IF(RC[-14]="",,"|n"&R1C19&RC[-14])&IF(RC[-13]="",,"|n"&R1C20&RC[-13])&IF(RC[-12]="",,"|n"&R1C21&RC[-12])&IF(RC[-11]="",,"|n"&R1C22&RC[-11])&IF(RC[-10]="",,"|n"&R1C23&RC[-10])&IF(RC[-9]="",,"|n"&R1C24&RC[-9])&IF(RC[-8]="",,"|n"&R1C25&RC[-8])&IF(RC[-7]="",,"|n"&R1C26&RC[-7])&IF(RC[-6]="",,"|n"&R1C27&RC[-6])&IF(RC[-5]="",,"|n"&R1C28&RC[-5])&IF(RC[-2]="",,"|n|n"&RC[-2]) -> |n|n用于镶嵌到[剑,衣]上.|n镶嵌后不可取下!|n不需要的宝石可以在宠物处熔炼,用于宝石抽奖.
A73: 3 | B73: D | C73: [宝石] | D73: 龙鳞 | G73: =IF(R[-66]C<>"",R[-66]C*12,"") ->  | H73: =IF(R[-66]C<>"",R[-66]C*12,"") ->  | I73: =IF(R[-66]C<>"",R[-66]C*12,"") ->  | J73: =IF(R[-66]C<>"",R[-66]C*12,"") ->  | K73: =IF(R[-66]C<>"",R[-66]C*12,"") ->  | L73: =IF(R[-66]C<>"",INT(R[-66]C*2.5),"") ->  | M73: =IF(R[-66]C<>"",R[-66]C*6,"") ->  | N73: =IF(R[-66]C<>"",INT(R[-66]C*1.4),"") ->  | O73: =IF(R[-66]C<>"",INT(R[-66]C*1.4),"") ->  | AE73: 用于镶嵌到[剑,衣]上.|n镶嵌后不可取下!|n不需要的宝石可以在宠物处熔炼,用于宝石抽奖. | AF73: =VLOOKUP(RC[-31],Sheet2!R13C1:R19C2,2,0)&"."&VLOOKUP(RC[-30],Sheet2!R7C1:R12C2,2,0)&VLOOKUP(RC[-30],Sheet2!R1C1:R6C2,2,0)&RC[-29]&RC[-28]&RC[-27]&Sheet2!R1C3 -> 三.丁|cFF999999[宝石]龙鳞|r | AG73: =IF(RC[-26]&RC[-25]&RC[-24]&RC[-23]&RC[-22]&RC[-21]="",,R1C6)&IF(RC[-26]="",,"|n"&R1C7&RC[-26])&IF(RC[-25]="",,"|n"&R1C8&RC[-25])&IF(RC[-24]="",,"|n"&R1C9&RC[-24])&IF(RC[-23]="",,"|n"&R1C10&RC[-23])&IF(RC[-22]="",,"|n"&R1C11&RC[-22])&IF(RC[-21]="",,"|n"&R1C12&RC[-21])&IF(RC[-19]&RC[-18]&RC[-17]&RC[-16]="",,"|n|n"&R1C13)&IF(RC[-19]="",,"|n"&R1C14&RC[-19])&IF(RC[-18]="",,"|n"&R1C15&RC[-18])&IF(RC[-17]="",,"|n"&R1C16&RC[-17])&IF(RC[-16]="",,"|n"&R1C17&RC[-16])&IF(RC[-15]="",,"|n"&R1C18&RC[-15])&IF(RC[-14]="",,"|n"&R1C19&RC[-14])&IF(RC[-13]="",,"|n"&R1C20&RC[-13])&IF(RC[-12]="",,"|n"&R1C21&RC[-12])&IF(RC[-11]="",,"|n"&R1C22&RC[-11])&IF(RC[-10]="",,"|n"&R1C23&RC[-10])&IF(RC[-9]="",,"|n"&R1C24&RC[-9])&IF(RC[-8]="",,"|n"&R1C25&RC[-8])&IF(RC[-7]="",,"|n"&R1C26&RC[-7])&IF(RC[-6]="",,"|n"&R1C27&RC[-6])&IF(RC[-5]="",,"|n"&R1C28&RC[-5])&IF(RC[-2]="",,"|n|n"&RC[-2]) -> |n|n用于镶嵌到[剑,衣]上.|n镶嵌后不可取下!|n不需要的宝石可以在宠物处熔炼,用于宝石抽奖.
A74: 3 | B74: D | C74: [宝石] | D74: 佛光 | G74: =IF(R[-66]C<>"",R[-66]C*12,"") ->  | H74: =IF(R[-66]C<>"",R[-66]C*12,"") ->  | I74: =IF(R[-66]C<>"",R[-66]C*12,"") ->  | J74: =IF(R[-66]C<>"",R[-66]C*12,"") ->  | K74: =IF(R[-66]C<>"",R[-66]C*12,"") ->  | L74: =IF(R[-66]C<>"",INT(R[-66]C*2.5),"") ->  | M74: =IF(R[-66]C<>"",R[-66]C*6,"") ->  | N74: =IF(R[-66]C<>"",INT(R[-66]C*1.4),"") ->  | O74: =IF(R[-66]C<>"",INT(R[-66]C*1.4),"") ->  | AE74: 用于镶嵌到[剑,衣]上.|n镶嵌后不可取下!|n不需要的宝石可以在宠物处熔炼,用于宝石抽奖. | AF74: =VLOOKUP(RC[-31],Sheet2!R13C1:R19C2,2,0)&"."&VLOOKUP(RC[-30],Sheet2!R7C1:R12C2,2,0)&VLOOKUP(RC[-30],Sheet2!R1C1:R6C2,2,0)&RC[-29]&RC[-28]&RC[-27]&Sheet2!R1C3 -> 三.丁|cFF999999[宝石]佛光|r | AG74: =IF(RC[-26]&RC[-25]&RC[-24]&RC[-23]&RC[-22]&RC[-21]="",,R1C6)&IF(RC[-26]="",,"|n"&R1C7&RC[-26])&IF(RC[-25]="",,"|n"&R1C8&RC[-25])&IF(RC[-24]="",,"|n"&R1C9&RC[-24])&IF(RC[-23]="",,"|n"&R1C10&RC[-23])&IF(RC[-22]="",,"|n"&R1C11&RC[-22])&IF(RC[-21]="",,"|n"&R1C12&RC[-21])&IF(RC[-19]&RC[-18]&RC[-17]&RC[-16]="",,"|n|n"&R1C13)&IF(RC[-19]="",,"|n"&R1C14&RC[-19])&IF(RC[-18]="",,"|n"&R1C15&RC[-18])&IF(RC[-17]="",,"|n"&R1C16&RC[-17])&IF(RC[-16]="",,"|n"&R1C17&RC[-16])&IF(RC[-15]="",,"|n"&R1C18&RC[-15])&IF(RC[-14]="",,"|n"&R1C19&RC[-14])&IF(RC[-13]="",,"|n"&R1C20&RC[-13])&IF(RC[-12]="",,"|n"&R1C21&RC[-12])&IF(RC[-11]="",,"|n"&R1C22&RC[-11])&IF(RC[-10]="",,"|n"&R1C23&RC[-10])&IF(RC[-9]="",,"|n"&R1C24&RC[-9])&IF(RC[-8]="",,"|n"&R1C25&RC[-8])&IF(RC[-7]="",,"|n"&R1C26&RC[-7])&IF(RC[-6]="",,"|n"&R1C27&RC[-6])&IF(RC[-5]="",,"|n"&R1C28&RC[-5])&IF(RC[-2]="",,"|n|n"&RC[-2]) -> |n|n用于镶嵌到[剑,衣]上.|n镶嵌后不可取下!|n不需要的宝石可以在宠物处熔炼,用于宝石抽奖.
A75: 3 | B75: D | C75: [宝石] | D75: 非影 | G75: =IF(R[-66]C<>"",R[-66]C*12,"") ->  | H75: =IF(R[-66]C<>"",R[-66]C*12,"") ->  | I75: =IF(R[-66]C<>"",R[-66]C*12,"") ->  | J75: =IF(R[-66]C<>"",R[-66]C*12,"") ->  | K75: =IF(R[-66]C<>"",R[-66]C*12,"") ->  | L75: =IF(R[-66]C<>"",INT(R[-66]C*2.5),"") ->  | M75: =IF(R[-66]C<>"",R[-66]C*6,"") ->  | N75: =IF(R[-66]C<>"",INT(R[-66]C*1.4),"") ->  | O75: =IF(R[-66]C<>"",INT(R[-66]C*1.4),"") ->  | AE75: 用于镶嵌到[剑,衣]上.|n镶嵌后不可取下!|n不需要的宝石可以在宠物处熔炼,用于宝石抽奖. | AF75: =VLOOKUP(RC[-31],Sheet2!R13C1:R19C2,2,0)&"."&VLOOKUP(RC[-30],Sheet2!R7C1:R12C2,2,0)&VLOOKUP(RC[-30],Sheet2!R1C1:R6C2,2,0)&RC[-29]&RC[-28]&RC[-27]&Sheet2!R1C3 -> 三.丁|cFF999999[宝石]非影|r | AG75: =IF(RC[-26]&RC[-25]&RC[-24]&RC[-23]&RC[-22]&RC[-21]="",,R1C6)&IF(RC[-26]="",,"|n"&R1C7&RC[-26])&IF(RC[-25]="",,"|n"&R1C8&RC[-25])&IF(RC[-24]="",,"|n"&R1C9&RC[-24])&IF(RC[-23]="",,"|n"&R1C10&RC[-23])&IF(RC[-22]="",,"|n"&R1C11&RC[-22])&IF(RC[-21]="",,"|n"&R1C12&RC[-21])&IF(RC[-19]&RC[-18]&RC[-17]&RC[-16]="",,"|n|n"&R1C13)&IF(RC[-19]="",,"|n"&R1C14&RC[-19])&IF(RC[-18]="",,"|n"&R1C15&RC[-18])&IF(RC[-17]="",,"|n"&R1C16&RC[-17])&IF(RC[-16]="",,"|n"&R1C17&RC[-16])&IF(RC[-15]="",,"|n"&R1C18&RC[-15])&IF(RC[-14]="",,"|n"&R1C19&RC[-14])&IF(RC[-13]="",,"|n"&R1C20&RC[-13])&IF(RC[-12]="",,"|n"&R1C21&RC[-12])&IF(RC[-11]="",,"|n"&R1C22&RC[-11])&IF(RC[-10]="",,"|n"&R1C23&RC[-10])&IF(RC[-9]="",,"|n"&R1C24&RC[-9])&IF(RC[-8]="",,"|n"&R1C25&RC[-8])&IF(RC[-7]="",,"|n"&R1C26&RC[-7])&IF(RC[-6]="",,"|n"&R1C27&RC[-6])&IF(RC[-5]="",,"|n"&R1C28&RC[-5])&IF(RC[-2]="",,"|n|n"&RC[-2]) -> |n|n用于镶嵌到[剑,衣]上.|n镶嵌后不可取下!|n不需要的宝石可以在宠物处熔炼,用于宝石抽奖.
A76: 3 | B76: D | C76: [宝石] | D76: 万仞 | G76: =IF(R[-66]C<>"",R[-66]C*12,"") ->  | H76: =IF(R[-66]C<>"",R[-66]C*12,"") ->  | I76: =IF(R[-66]C<>"",R[-66]C*12,"") ->  | J76: =IF(R[-66]C<>"",R[-66]C*12,"") ->  | K76: =IF(R[-66]C<>"",R[-66]C*12,"") ->  | L76: =IF(R[-66]C<>"",INT(R[-66]C*2.5),"") ->  | M76: =IF(R[-66]C<>"",R[-66]C*6,"") ->  | N76: =IF(R[-66]C<>"",INT(R[-66]C*1.4),"") ->  | O76: =IF(R[-66]C<>"",INT(R[-66]C*1.4),"") ->  | AE76: 用于镶嵌到[剑,衣]上.|n镶嵌后不可取下!|n不需要的宝石可以在宠物处熔炼,用于宝石抽奖. | AF76: =VLOOKUP(RC[-31],Sheet2!R13C1:R19C2,2,0)&"."&VLOOKUP(RC[-30],Sheet2!R7C1:R12C2,2,0)&VLOOKUP(RC[-30],Sheet2!R1C1:R6C2,2,0)&RC[-29]&RC[-28]&RC[-27]&Sheet2!R1C3 -> 三.丁|cFF999999[宝石]万仞|r | AG76: =IF(RC[-26]&RC[-25]&RC[-24]&RC[-23]&RC[-22]&RC[-21]="",,R1C6)&IF(RC[-26]="",,"|n"&R1C7&RC[-26])&IF(RC[-25]="",,"|n"&R1C8&RC[-25])&IF(RC[-24]="",,"|n"&R1C9&RC[-24])&IF(RC[-23]="",,"|n"&R1C10&RC[-23])&IF(RC[-22]="",,"|n"&R1C11&RC[-22])&IF(RC[-21]="",,"|n"&R1C12&RC[-21])&IF(RC[-19]&RC[-18]&RC[-17]&RC[-16]="",,"|n|n"&R1C13)&IF(RC[-19]="",,"|n"&R1C14&RC[-19])&IF(RC[-18]="",,"|n"&R1C15&RC[-18])&IF(RC[-17]="",,"|n"&R1C16&RC[-17])&IF(RC[-16]="",,"|n"&R1C17&RC[-16])&IF(RC[-15]="",,"|n"&R1C18&RC[-15])&IF(RC[-14]="",,"|n"&R1C19&RC[-14])&IF(RC[-13]="",,"|n"&R1C20&RC[-13])&IF(RC[-12]="",,"|n"&R1C21&RC[-12])&IF(RC[-11]="",,"|n"&R1C22&RC[-11])&IF(RC[-10]="",,"|n"&R1C23&RC[-10])&IF(RC[-9]="",,"|n"&R1C24&RC[-9])&IF(RC[-8]="",,"|n"&R1C25&RC[-8])&IF(RC[-7]="",,"|n"&R1C26&RC[-7])&IF(RC[-6]="",,"|n"&R1C27&RC[-6])&IF(RC[-5]="",,"|n"&R1C28&RC[-5])&IF(RC[-2]="",,"|n|n"&RC[-2]) -> |n|n用于镶嵌到[剑,衣]上.|n镶嵌后不可取下!|n不需要的宝石可以在宠物处熔炼,用于宝石抽奖.
A77: 3 | B77: D | C77: [宝石] | D77: 绣云 | G77: =IF(R[-66]C<>"",R[-66]C*12,"") ->  | H77: =IF(R[-66]C<>"",R[-66]C*12,"") ->  | I77: =IF(R[-66]C<>"",R[-66]C*12,"") ->  | J77: =IF(R[-66]C<>"",R[-66]C*12,"") ->  | K77: =IF(R[-66]C<>"",R[-66]C*12,"") ->  | L77: =IF(R[-66]C<>"",INT(R[-66]C*2.5),"") ->  | M77: =IF(R[-66]C<>"",R[-66]C*6,"") ->  | N77: =IF(R[-66]C<>"",INT(R[-66]C*1.4),"") ->  | O77: =IF(R[-66]C<>"",INT(R[-66]C*1.4),"") ->  | AE77: 用于镶嵌到[剑,衣]上.|n镶嵌后不可取下!|n不需要的宝石可以在宠物处熔炼,用于宝石抽奖. | AF77: =VLOOKUP(RC[-31],Sheet2!R13C1:R19C2,2,0)&"."&VLOOKUP(RC[-30],Sheet2!R7C1:R12C2,2,0)&VLOOKUP(RC[-30],Sheet2!R1C1:R6C2,2,0)&RC[-29]&RC[-28]&RC[-27]&Sheet2!R1C3 -> 三.丁|cFF999999[宝石]绣云|r | AG77: =IF(RC[-26]&RC[-25]&RC[-24]&RC[-23]&RC[-22]&RC[-21]="",,R1C6)&IF(RC[-26]="",,"|n"&R1C7&RC[-26])&IF(RC[-25]="",,"|n"&R1C8&RC[-25])&IF(RC[-24]="",,"|n"&R1C9&RC[-24])&IF(RC[-23]="",,"|n"&R1C10&RC[-23])&IF(RC[-22]="",,"|n"&R1C11&RC[-22])&IF(RC[-21]="",,"|n"&R1C12&RC[-21])&IF(RC[-19]&RC[-18]&RC[-17]&RC[-16]="",,"|n|n"&R1C13)&IF(RC[-19]="",,"|n"&R1C14&RC[-19])&IF(RC[-18]="",,"|n"&R1C15&RC[-18])&IF(RC[-17]="",,"|n"&R1C16&RC[-17])&IF(RC[-16]="",,"|n"&R1C17&RC[-16])&IF(RC[-15]="",,"|n"&R1C18&RC[-15])&IF(RC[-14]="",,"|n"&R1C19&RC[-14])&IF(RC[-13]="",,"|n"&R1C20&RC[-13])&IF(RC[-12]="",,"|n"&R1C21&RC[-12])&IF(RC[-11]="",,"|n"&R1C22&RC[-11])&IF(RC[-10]="",,"|n"&R1C23&RC[-10])&IF(RC[-9]="",,"|n"&R1C24&RC[-9])&IF(RC[-8]="",,"|n"&R1C25&RC[-8])&IF(RC[-7]="",,"|n"&R1C26&RC[-7])&IF(RC[-6]="",,"|n"&R1C27&RC[-6])&IF(RC[-5]="",,"|n"&R1C28&RC[-5])&IF(RC[-2]="",,"|n|n"&RC[-2]) -> |n|n用于镶嵌到[剑,衣]上.|n镶嵌后不可取下!|n不需要的宝石可以在宠物处熔炼,用于宝石抽奖.
A78: 3 | B78: D | C78: [宝石] | D78: 黑鸦 | G78: =IF(R[-66]C<>"",R[-66]C*12,"") ->  | H78: =IF(R[-66]C<>"",R[-66]C*12,"") ->  | I78: =IF(R[-66]C<>"",R[-66]C*12,"") ->  | J78: =IF(R[-66]C<>"",R[-66]C*12,"") ->  | K78: =IF(R[-66]C<>"",R[-66]C*12,"") ->  | L78: =IF(R[-66]C<>"",INT(R[-66]C*2.5),"") ->  | M78: =IF(R[-66]C<>"",R[-66]C*6,"") ->  | N78: =IF(R[-66]C<>"",INT(R[-66]C*1.4),"") ->  | O78: =IF(R[-66]C<>"",INT(R[-66]C*1.4),"") ->  | AE78: 用于镶嵌到[剑,衣]上.|n镶嵌后不可取下!|n不需要的宝石可以在宠物处熔炼,用于宝石抽奖. | AF78: =VLOOKUP(RC[-31],Sheet2!R13C1:R19C2,2,0)&"."&VLOOKUP(RC[-30],Sheet2!R7C1:R12C2,2,0)&VLOOKUP(RC[-30],Sheet2!R1C1:R6C2,2,0)&RC[-29]&RC[-28]&RC[-27]&Sheet2!R1C3 -> 三.丁|cFF999999[宝石]黑鸦|r | AG78: =IF(RC[-26]&RC[-25]&RC[-24]&RC[-23]&RC[-22]&RC[-21]="",,R1C6)&IF(RC[-26]="",,"|n"&R1C7&RC[-26])&IF(RC[-25]="",,"|n"&R1C8&RC[-25])&IF(RC[-24]="",,"|n"&R1C9&RC[-24])&IF(RC[-23]="",,"|n"&R1C10&RC[-23])&IF(RC[-22]="",,"|n"&R1C11&RC[-22])&IF(RC[-21]="",,"|n"&R1C12&RC[-21])&IF(RC[-19]&RC[-18]&RC[-17]&RC[-16]="",,"|n|n"&R1C13)&IF(RC[-19]="",,"|n"&R1C14&RC[-19])&IF(RC[-18]="",,"|n"&R1C15&RC[-18])&IF(RC[-17]="",,"|n"&R1C16&RC[-17])&IF(RC[-16]="",,"|n"&R1C17&RC[-16])&IF(RC[-15]="",,"|n"&R1C18&RC[-15])&IF(RC[-14]="",,"|n"&R1C19&RC[-14])&IF(RC[-13]="",,"|n"&R1C20&RC[-13])&IF(RC[-12]="",,"|n"&R1C21&RC[-12])&IF(RC[-11]="",,"|n"&R1C22&RC[-11])&IF(RC[-10]="",,"|n"&R1C23&RC[-10])&IF(RC[-9]="",,"|n"&R1C24&RC[-9])&IF(RC[-8]="",,"|n"&R1C25&RC[-8])&IF(RC[-7]="",,"|n"&R1C26&RC[-7])&IF(RC[-6]="",,"|n"&R1C27&RC[-6])&IF(RC[-5]="",,"|n"&R1C28&RC[-5])&IF(RC[-2]="",,"|n|n"&RC[-2]) -> |n|n用于镶嵌到[剑,衣]上.|n镶嵌后不可取下!|n不需要的宝石可以在宠物处熔炼,用于宝石抽奖.
A79: 3 | B79: D | C79: [宝石] | D79: 封焰 | G79: =IF(R[-66]C<>"",R[-66]C*12,"") ->  | H79: =IF(R[-66]C<>"",R[-66]C*12,"") ->  | I79: =IF(R[-66]C<>"",R[-66]C*12,"") ->  | J79: =IF(R[-66]C<>"",R[-66]C*12,"") ->  | K79: =IF(R[-66]C<>"",R[-66]C*12,"") ->  | L79: =IF(R[-66]C<>"",INT(R[-66]C*2.5),"") ->  | M79: =IF(R[-66]C<>"",R[-66]C*6,"") ->  | N79: =IF(R[-66]C<>"",INT(R[-66]C*1.4),"") ->  | O79: =IF(R[-66]C<>"",INT(R[-66]C*1.4),"") ->  | AE79: 用于镶嵌到[剑,衣]上.|n镶嵌后不可取下!|n不需要的宝石可以在宠物处熔炼,用于宝石抽奖. | AF79: =VLOOKUP(RC[-31],Sheet2!R13C1:R19C2,2,0)&"."&VLOOKUP(RC[-30],Sheet2!R7C1:R12C2,2,0)&VLOOKUP(RC[-30],Sheet2!R1C1:R6C2,2,0)&RC[-29]&RC[-28]&RC[-27]&Sheet2!R1C3 -> 三.丁|cFF999999[宝石]封焰|r | AG79: =IF(RC[-26]&RC[-25]&RC[-24]&RC[-23]&RC[-22]&RC[-21]="",,R1C6)&IF(RC[-26]="",,"|n"&R1C7&RC[-26])&IF(RC[-25]="",,"|n"&R1C8&RC[-25])&IF(RC[-24]="",,"|n"&R1C9&RC[-24])&IF(RC[-23]="",,"|n"&R1C10&RC[-23])&IF(RC[-22]="",,"|n"&R1C11&RC[-22])&IF(RC[-21]="",,"|n"&R1C12&RC[-21])&IF(RC[-19]&RC[-18]&RC[-17]&RC[-16]="",,"|n|n"&R1C13)&IF(RC[-19]="",,"|n"&R1C14&RC[-19])&IF(RC[-18]="",,"|n"&R1C15&RC[-18])&IF(RC[-17]="",,"|n"&R1C16&RC[-17])&IF(RC[-16]="",,"|n"&R1C17&RC[-16])&IF(RC[-15]="",,"|n"&R1C18&RC[-15])&IF(RC[-14]="",,"|n"&R1C19&RC[-14])&IF(RC[-13]="",,"|n"&R1C20&RC[-13])&IF(RC[-12]="",,"|n"&R1C21&RC[-12])&IF(RC[-11]="",,"|n"&R1C22&RC[-11])&IF(RC[-10]="",,"|n"&R1C23&RC[-10])&IF(RC[-9]="",,"|n"&R1C24&RC[-9])&IF(RC[-8]="",,"|n"&R1C25&RC[-8])&IF(RC[-7]="",,"|n"&R1C26&RC[-7])&IF(RC[-6]="",,"|n"&R1C27&RC[-6])&IF(RC[-5]="",,"|n"&R1C28&RC[-5])&IF(RC[-2]="",,"|n|n"&RC[-2]) -> |n|n用于镶嵌到[剑,衣]上.|n镶嵌后不可取下!|n不需要的宝石可以在宠物处熔炼,用于宝石抽奖.
A80: 3 | B80: D | C80: [宝石] | D80: 布锦 | G80: =IF(R[-66]C<>"",R[-66]C*12,"") ->  | H80: =IF(R[-66]C<>"",R[-66]C*12,"") ->  | I80: =IF(R[-66]C<>"",R[-66]C*12,"") ->  | J80: =IF(R[-66]C<>"",R[-66]C*12,"") ->  | K80: =IF(R[-66]C<>"",R[-66]C*12,"") ->  | L80: =IF(R[-66]C<>"",INT(R[-66]C*2.5),"") ->  | M80: =IF(R[-66]C<>"",R[-66]C*6,"") ->  | N80: =IF(R[-66]C<>"",INT(R[-66]C*1.4),"") ->  | O80: =IF(R[-66]C<>"",INT(R[-66]C*1.4),"") ->  | AE80: 用于镶嵌到[剑,衣]上.|n镶嵌后不可取下!|n不需要的宝石可以在宠物处熔炼,用于宝石抽奖. | AF80: =VLOOKUP(RC[-31],Sheet2!R13C1:R19C2,2,0)&"."&VLOOKUP(RC[-30],Sheet2!R7C1:R12C2,2,0)&VLOOKUP(RC[-30],Sheet2!R1C1:R6C2,2,0)&RC[-29]&RC[-28]&RC[-27]&Sheet2!R1C3 -> 三.丁|cFF999999[宝石]布锦|r | AG80: =IF(RC[-26]&RC[-25]&RC[-24]&RC[-23]&RC[-22]&RC[-21]="",,R1C6)&IF(RC[-26]="",,"|n"&R1C7&RC[-26])&IF(RC[-25]="",,"|n"&R1C8&RC[-25])&IF(RC[-24]="",,"|n"&R1C9&RC[-24])&IF(RC[-23]="",,"|n"&R1C10&RC[-23])&IF(RC[-22]="",,"|n"&R1C11&RC[-22])&IF(RC[-21]="",,"|n"&R1C12&RC[-21])&IF(RC[-19]&RC[-18]&RC[-17]&RC[-16]="",,"|n|n"&R1C13)&IF(RC[-19]="",,"|n"&R1C14&RC[-19])&IF(RC[-18]="",,"|n"&R1C15&RC[-18])&IF(RC[-17]="",,"|n"&R1C16&RC[-17])&IF(RC[-16]="",,"|n"&R1C17&RC[-16])&IF(RC[-15]="",,"|n"&R1C18&RC[-15])&IF(RC[-14]="",,"|n"&R1C19&RC[-14])&IF(RC[-13]="",,"|n"&R1C20&RC[-13])&IF(RC[-12]="",,"|n"&R1C21&RC[-12])&IF(RC[-11]="",,"|n"&R1C22&RC[-11])&IF(RC[-10]="",,"|n"&R1C23&RC[-10])&IF(RC[-9]="",,"|n"&R1C24&RC[-9])&IF(RC[-8]="",,"|n"&R1C25&RC[-8])&IF(RC[-7]="",,"|n"&R1C26&RC[-7])&IF(RC[-6]="",,"|n"&R1C27&RC[-6])&IF(RC[-5]="",,"|n"&R1C28&RC[-5])&IF(RC[-2]="",,"|n|n"&RC[-2]) -> |n|n用于镶嵌到[剑,衣]上.|n镶嵌后不可取下!|n不需要的宝石可以在宠物处熔炼,用于宝石抽奖.
A81: 3 | B81: D | C81: [宝石] | D81: 孤星 | G81: =IF(R[-66]C<>"",R[-66]C*12,"") ->  | H81: =IF(R[-66]C<>"",R[-66]C*12,"") ->  | I81: =IF(R[-66]C<>"",R[-66]C*12,"") ->  | J81: =IF(R[-66]C<>"",R[-66]C*12,"") ->  | K81: =IF(R[-66]C<>"",R[-66]C*12,"") ->  | L81: =IF(R[-66]C<>"",INT(R[-66]C*2.5),"") ->  | M81: =IF(R[-66]C<>"",R[-66]C*6,"") ->  | N81: =IF(R[-66]C<>"",INT(R[-66]C*1.4),"") ->  | O81: =IF(R[-66]C<>"",INT(R[-66]C*1.4),"") ->  | AE81: 用于镶嵌到[剑,衣]上.|n镶嵌后不可取下!|n不需要的宝石可以在宠物处熔炼,用于宝石抽奖. | AF81: =VLOOKUP(RC[-31],Sheet2!R13C1:R19C2,2,0)&"."&VLOOKUP(RC[-30],Sheet2!R7C1:R12C2,2,0)&VLOOKUP(RC[-30],Sheet2!R1C1:R6C2,2,0)&RC[-29]&RC[-28]&RC[-27]&Sheet2!R1C3 -> 三.丁|cFF999999[宝石]孤星|r | AG81: =IF(RC[-26]&RC[-25]&RC[-24]&RC[-23]&RC[-22]&RC[-21]="",,R1C6)&IF(RC[-26]="",,"|n"&R1C7&RC[-26])&IF(RC[-25]="",,"|n"&R1C8&RC[-25])&IF(RC[-24]="",,"|n"&R1C9&RC[-24])&IF(RC[-23]="",,"|n"&R1C10&RC[-23])&IF(RC[-22]="",,"|n"&R1C11&RC[-22])&IF(RC[-21]="",,"|n"&R1C12&RC[-21])&IF(RC[-19]&RC[-18]&RC[-17]&RC[-16]="",,"|n|n"&R1C13)&IF(RC[-19]="",,"|n"&R1C14&RC[-19])&IF(RC[-18]="",,"|n"&R1C15&RC[-18])&IF(RC[-17]="",,"|n"&R1C16&RC[-17])&IF(RC[-16]="",,"|n"&R1C17&RC[-16])&IF(RC[-15]="",,"|n"&R1C18&RC[-15])&IF(RC[-14]="",,"|n"&R1C19&RC[-14])&IF(RC[-13]="",,"|n"&R1C20&RC[-13])&IF(RC[-12]="",,"|n"&R1C21&RC[-12])&IF(RC[-11]="",,"|n"&R1C22&RC[-11])&IF(RC[-10]="",,"|n"&R1C23&RC[-10])&IF(RC[-9]="",,"|n"&R1C24&RC[-9])&IF(RC[-8]="",,"|n"&R1C25&RC[-8])&IF(RC[-7]="",,"|n"&R1C26&RC[-7])&IF(RC[-6]="",,"|n"&R1C27&RC[-6])&IF(RC[-5]="",,"|n"&R1C28&RC[-5])&IF(RC[-2]="",,"|n|n"&RC[-2]) -> |n|n用于镶嵌到[剑,衣]上.|n镶嵌后不可取下!|n不需要的宝石可以在宠物处熔炼,用于宝石抽奖.
A82: 3 | B82: D | C82: [宝石] | D82: 龙爪 | G82: =IF(R[-66]C<>"",R[-66]C*12,"") ->  | H82: =IF(R[-66]C<>"",R[-66]C*12,"") ->  | I82: =IF(R[-66]C<>"",R[-66]C*12,"") ->  | J82: =IF(R[-66]C<>"",R[-66]C*12,"") ->  | K82: =IF(R[-66]C<>"",R[-66]C*12,"") ->  | L82: =IF(R[-66]C<>"",INT(R[-66]C*2.5),"") ->  | M82: =IF(R[-66]C<>"",R[-66]C*6,"") ->  | N82: =IF(R[-66]C<>"",INT(R[-66]C*1.4),"") ->  | O82: =IF(R[-66]C<>"",INT(R[-66]C*1.4),"") ->  | AE82: 用于镶嵌到[剑,衣]上.|n镶嵌后不可取下!|n不需要的宝石可以在宠物处熔炼,用于宝石抽奖. | AF82: =VLOOKUP(RC[-31],Sheet2!R13C1:R19C2,2,0)&"."&VLOOKUP(RC[-30],Sheet2!R7C1:R12C2,2,0)&VLOOKUP(RC[-30],Sheet2!R1C1:R6C2,2,0)&RC[-29]&RC[-28]&RC[-27]&Sheet2!R1C3 -> 三.丁|cFF999999[宝石]龙爪|r | AG82: =IF(RC[-26]&RC[-25]&RC[-24]&RC[-23]&RC[-22]&RC[-21]="",,R1C6)&IF(RC[-26]="",,"|n"&R1C7&RC[-26])&IF(RC[-25]="",,"|n"&R1C8&RC[-25])&IF(RC[-24]="",,"|n"&R1C9&RC[-24])&IF(RC[-23]="",,"|n"&R1C10&RC[-23])&IF(RC[-22]="",,"|n"&R1C11&RC[-22])&IF(RC[-21]="",,"|n"&R1C12&RC[-21])&IF(RC[-19]&RC[-18]&RC[-17]&RC[-16]="",,"|n|n"&R1C13)&IF(RC[-19]="",,"|n"&R1C14&RC[-19])&IF(RC[-18]="",,"|n"&R1C15&RC[-18])&IF(RC[-17]="",,"|n"&R1C16&RC[-17])&IF(RC[-16]="",,"|n"&R1C17&RC[-16])&IF(RC[-15]="",,"|n"&R1C18&RC[-15])&IF(RC[-14]="",,"|n"&R1C19&RC[-14])&IF(RC[-13]="",,"|n"&R1C20&RC[-13])&IF(RC[-12]="",,"|n"&R1C21&RC[-12])&IF(RC[-11]="",,"|n"&R1C22&RC[-11])&IF(RC[-10]="",,"|n"&R1C23&RC[-10])&IF(RC[-9]="",,"|n"&R1C24&RC[-9])&IF(RC[-8]="",,"|n"&R1C25&RC[-8])&IF(RC[-7]="",,"|n"&R1C26&RC[-7])&IF(RC[-6]="",,"|n"&R1C27&RC[-6])&IF(RC[-5]="",,"|n"&R1C28&RC[-5])&IF(RC[-2]="",,"|n|n"&RC[-2]) -> |n|n用于镶嵌到[剑,衣]上.|n镶嵌后不可取下!|n不需要的宝石可以在宠物处熔炼,用于宝石抽奖.
A83: 3 | B83: D | C83: [宝石] | D83: 螺旋 | G83: =IF(R[-66]C<>"",R[-66]C*12,"") ->  | H83: =IF(R[-66]C<>"",R[-66]C*12,"") ->  | I83: =IF(R[-66]C<>"",R[-66]C*12,"") ->  | J83: =IF(R[-66]C<>"",R[-66]C*12,"") ->  | K83: =IF(R[-66]C<>"",R[-66]C*12,"") ->  | L83: =IF(R[-66]C<>"",INT(R[-66]C*2.5),"") ->  | M83: =IF(R[-66]C<>"",R[-66]C*6,"") ->  | N83: =IF(R[-66]C<>"",INT(R[-66]C*1.4),"") ->  | O83: =IF(R[-66]C<>"",INT(R[-66]C*1.4),"") ->  | AE83: 用于镶嵌到[剑,衣]上.|n镶嵌后不可取下!|n不需要的宝石可以在宠物处熔炼,用于宝石抽奖. | AF83: =VLOOKUP(RC[-31],Sheet2!R13C1:R19C2,2,0)&"."&VLOOKUP(RC[-30],Sheet2!R7C1:R12C2,2,0)&VLOOKUP(RC[-30],Sheet2!R1C1:R6C2,2,0)&RC[-29]&RC[-28]&RC[-27]&Sheet2!R1C3 -> 三.丁|cFF999999[宝石]螺旋|r | AG83: =IF(RC[-26]&RC[-25]&RC[-24]&RC[-23]&RC[-22]&RC[-21]="",,R1C6)&IF(RC[-26]="",,"|n"&R1C7&RC[-26])&IF(RC[-25]="",,"|n"&R1C8&RC[-25])&IF(RC[-24]="",,"|n"&R1C9&RC[-24])&IF(RC[-23]="",,"|n"&R1C10&RC[-23])&IF(RC[-22]="",,"|n"&R1C11&RC[-22])&IF(RC[-21]="",,"|n"&R1C12&RC[-21])&IF(RC[-19]&RC[-18]&RC[-17]&RC[-16]="",,"|n|n"&R1C13)&IF(RC[-19]="",,"|n"&R1C14&RC[-19])&IF(RC[-18]="",,"|n"&R1C15&RC[-18])&IF(RC[-17]="",,"|n"&R1C16&RC[-17])&IF(RC[-16]="",,"|n"&R1C17&RC[-16])&IF(RC[-15]="",,"|n"&R1C18&RC[-15])&IF(RC[-14]="",,"|n"&R1C19&RC[-14])&IF(RC[-13]="",,"|n"&R1C20&RC[-13])&IF(RC[-12]="",,"|n"&R1C21&RC[-12])&IF(RC[-11]="",,"|n"&R1C22&RC[-11])&IF(RC[-10]="",,"|n"&R1C23&RC[-10])&IF(RC[-9]="",,"|n"&R1C24&RC[-9])&IF(RC[-8]="",,"|n"&R1C25&RC[-8])&IF(RC[-7]="",,"|n"&R1C26&RC[-7])&IF(RC[-6]="",,"|n"&R1C27&RC[-6])&IF(RC[-5]="",,"|n"&R1C28&RC[-5])&IF(RC[-2]="",,"|n|n"&RC[-2]) -> |n|n用于镶嵌到[剑,衣]上.|n镶嵌后不可取下!|n不需要的宝石可以在宠物处熔炼,用于宝石抽奖.
A84: 3 | B84: C | C84: [宝石] | D84: 断魂石 | G84: =IF(R[-66]C<>"",R[-66]C*9,"") ->  | H84: =IF(R[-66]C<>"",R[-66]C*9,"") -> 13500 | I84: =IF(R[-66]C<>"",R[-66]C*9,"") -> 13500 | J84: =IF(R[-66]C<>"",R[-66]C*9,"") -> 13500 | K84: =IF(R[-66]C<>"",R[-66]C*9,"") ->  | L84: =IF(R[-66]C<>"",INT(R[-66]C*2.5),"") ->  | M84: =IF(R[-66]C<>"",R[-66]C*6,"") ->  | N84: =IF(R[-66]C<>"",INT(R[-66]C*1.4),"") ->  | O84: =IF(R[-66]C<>"",INT(R[-66]C*1.4),"") ->  | P84: =IF(R[-66]C<>"",INT(R[-66]C*1.4),"") ->  | Q84: =IF(R[-66]C<>"",INT(R[-66]C*1.4),"") ->  | AE84: 用于镶嵌到[剑,衣]上.|n镶嵌后不可取下!|n不需要的宝石可以在宠物处熔炼,用于宝石抽奖. | AF84: =VLOOKUP(RC[-31],Sheet2!R13C1:R19C2,2,0)&"."&VLOOKUP(RC[-30],Sheet2!R7C1:R12C2,2,0)&VLOOKUP(RC[-30],Sheet2!R1C1:R6C2,2,0)&RC[-29]&RC[-28]&RC[-27]&Sheet2!R1C3 -> 三.丙|cFF99FF66[宝石]断魂石|r | AG84: =IF(RC[-26]&RC[-25]&RC[-24]&RC[-23]&RC[-22]&RC[-21]="",,R1C6)&IF(RC[-26]="",,"|n"&R1C7&RC[-26])&IF(RC[-25]="",,"|n"&R1C8&RC[-25])&IF(RC[-24]="",,"|n"&R1C9&RC[-24])&IF(RC[-23]="",,"|n"&R1C10&RC[-23])&IF(RC[-22]="",,"|n"&R1C11&RC[-22])&IF(RC[-21]="",,"|n"&R1C12&RC[-21])&IF(RC[-19]&RC[-18]&RC[-17]&RC[-16]="",,"|n|n"&R1C13)&IF(RC[-19]="",,"|n"&R1C14&RC[-19])&IF(RC[-18]="",,"|n"&R1C15&RC[-18])&IF(RC[-17]="",,"|n"&R1C16&RC[-17])&IF(RC[-16]="",,"|n"&R1C17&RC[-16])&IF(RC[-15]="",,"|n"&R1C18&RC[-15])&IF(RC[-14]="",,"|n"&R1C19&RC[-14])&IF(RC[-13]="",,"|n"&R1C20&RC[-13])&IF(RC[-12]="",,"|n"&R1C21&RC[-12])&IF(RC[-11]="",,"|n"&R1C22&RC[-11])&IF(RC[-10]="",,"|n"&R1C23&RC[-10])&IF(RC[-9]="",,"|n"&R1C24&RC[-9])&IF(RC[-8]="",,"|n"&R1C25&RC[-8])&IF(RC[-7]="",,"|n"&R1C26&RC[-7])&IF(RC[-6]="",,"|n"&R1C27&RC[-6])&IF(RC[-5]="",,"|n"&R1C28&RC[-5])&IF(RC[-2]="",,"|n|n"&RC[-2]) -> |cFFFFFF99基础属性|r|n力量:13500|n敏捷:13500|n智力:13500|n|n用于镶嵌到[剑,衣]上.|n镶嵌后不可取下!|n不需要的宝石可以在宠物处熔炼,用于宝石抽奖.
A85: 3 | B85: C | C85: [宝石] | D85: 神鸩石 | G85: =IF(R[-66]C<>"",R[-66]C*9,"") -> 45000 | H85: =IF(R[-66]C<>"",R[-66]C*9,"") ->  | I85: =IF(R[-66]C<>"",R[-66]C*9,"") ->  | J85: =IF(R[-66]C<>"",R[-66]C*9,"") ->  | K85: =IF(R[-66]C<>"",R[-66]C*9,"") ->  | L85: =IF(R[-66]C<>"",INT(R[-66]C*2.5),"") ->  | M85: =IF(R[-66]C<>"",R[-66]C*6,"") ->  | N85: =IF(R[-66]C<>"",INT(R[-66]C*1.4),"") ->  | O85: =IF(R[-66]C<>"",INT(R[-66]C*1.4),"") ->  | P85: =IF(R[-66]C<>"",INT(R[-66]C*1.4),"") ->  | Q85: =IF(R[-66]C<>"",INT(R[-66]C*1.4),"") ->  | AE85: 用于镶嵌到[剑,衣]上.|n镶嵌后不可取下!|n不需要的宝石可以在宠物处熔炼,用于宝石抽奖. | AF85: =VLOOKUP(RC[-31],Sheet2!R13C1:R19C2,2,0)&"."&VLOOKUP(RC[-30],Sheet2!R7C1:R12C2,2,0)&VLOOKUP(RC[-30],Sheet2!R1C1:R6C2,2,0)&RC[-29]&RC[-28]&RC[-27]&Sheet2!R1C3 -> 三.丙|cFF99FF66[宝石]神鸩石|r | AG85: =IF(RC[-26]&RC[-25]&RC[-24]&RC[-23]&RC[-22]&RC[-21]="",,R1C6)&IF(RC[-26]="",,"|n"&R1C7&RC[-26])&IF(RC[-25]="",,"|n"&R1C8&RC[-25])&IF(RC[-24]="",,"|n"&R1C9&RC[-24])&IF(RC[-23]="",,"|n"&R1C10&RC[-23])&IF(RC[-22]="",,"|n"&R1C11&RC[-22])&IF(RC[-21]="",,"|n"&R1C12&RC[-21])&IF(RC[-19]&RC[-18]&RC[-17]&RC[-16]="",,"|n|n"&R1C13)&IF(RC[-19]="",,"|n"&R1C14&RC[-19])&IF(RC[-18]="",,"|n"&R1C15&RC[-18])&IF(RC[-17]="",,"|n"&R1C16&RC[-17])&IF(RC[-16]="",,"|n"&R1C17&RC[-16])&IF(RC[-15]="",,"|n"&R1C18&RC[-15])&IF(RC[-14]="",,"|n"&R1C19&RC[-14])&IF(RC[-13]="",,"|n"&R1C20&RC[-13])&IF(RC[-12]="",,"|n"&R1C21&RC[-12])&IF(RC[-11]="",,"|n"&R1C22&RC[-11])&IF(RC[-10]="",,"|n"&R1C23&RC[-10])&IF(RC[-9]="",,"|n"&R1C24&RC[-9])&IF(RC[-8]="",,"|n"&R1C25&RC[-8])&IF(RC[-7]="",,"|n"&R1C26&RC[-7])&IF(RC[-6]="",,"|n"&R1C27&RC[-6])&IF(RC[-5]="",,"|n"&R1C28&RC[-5])&IF(RC[-2]="",,"|n|n"&RC[-2]) -> |cFFFFFF99基础属性|r|n攻击:45000|n|n用于镶嵌到[剑,衣]上.|n镶嵌后不可取下!|n不需要的宝石可以在宠物处熔炼,用于宝石抽奖.
A86: 3 | B86: C | C86: [宝石] | D86: 影游石 | G86: =IF(R[-66]C<>"",R[-66]C*9,"") ->  | H86: =IF(R[-66]C<>"",R[-66]C*9,"") ->  | I86: =IF(R[-66]C<>"",R[-66]C*9,"") ->  | J86: =IF(R[-66]C<>"",R[-66]C*9,"") ->  | K86: =IF(R[-66]C<>"",R[-66]C*9,"") ->  | L86: =IF(R[-66]C<>"",INT(R[-66]C*2.5),"") ->  | M86: =IF(R[-66]C<>"",R[-66]C*6,"") ->  | N86: =IF(R[-66]C<>"",INT(R[-66]C*1.4),"") ->  | O86: =IF(R[-66]C<>"",INT(R[-66]C*1.4),"") -> 2 | P86: =IF(R[-66]C<>"",INT(R[-66]C*1.4),"") ->  | Q86: =IF(R[-66]C<>"",INT(R[-66]C*1.4),"") ->  | AE86: 用于镶嵌到[剑,衣]上.|n镶嵌后不可取下!|n不需要的宝石可以在宠物处熔炼,用于宝石抽奖. | AF86: =VLOOKUP(RC[-31],Sheet2!R13C1:R19C2,2,0)&"."&VLOOKUP(RC[-30],Sheet2!R7C1:R12C2,2,0)&VLOOKUP(RC[-30],Sheet2!R1C1:R6C2,2,0)&RC[-29]&RC[-28]&RC[-27]&Sheet2!R1C3 -> 三.丙|cFF99FF66[宝石]影游石|r | AG86: =IF(RC[-26]&RC[-25]&RC[-24]&RC[-23]&RC[-22]&RC[-21]="",,R1C6)&IF(RC[-26]="",,"|n"&R1C7&RC[-26])&IF(RC[-25]="",,"|n"&R1C8&RC[-25])&IF(RC[-24]="",,"|n"&R1C9&RC[-24])&IF(RC[-23]="",,"|n"&R1C10&RC[-23])&IF(RC[-22]="",,"|n"&R1C11&RC[-22])&IF(RC[-21]="",,"|n"&R1C12&RC[-21])&IF(RC[-19]&RC[-18]&RC[-17]&RC[-16]="",,"|n|n"&R1C13)&IF(RC[-19]="",,"|n"&R1C14&RC[-19])&IF(RC[-18]="",,"|n"&R1C15&RC[-18])&IF(RC[-17]="",,"|n"&R1C16&RC[-17])&IF(RC[-16]="",,"|n"&R1C17&RC[-16])&IF(RC[-15]="",,"|n"&R1C18&RC[-15])&IF(RC[-14]="",,"|n"&R1C19&RC[-14])&IF(RC[-13]="",,"|n"&R1C20&RC[-13])&IF(RC[-12]="",,"|n"&R1C21&RC[-12])&IF(RC[-11]="",,"|n"&R1C22&RC[-11])&IF(RC[-10]="",,"|n"&R1C23&RC[-10])&IF(RC[-9]="",,"|n"&R1C24&RC[-9])&IF(RC[-8]="",,"|n"&R1C25&RC[-8])&IF(RC[-7]="",,"|n"&R1C26&RC[-7])&IF(RC[-6]="",,"|n"&R1C27&RC[-6])&IF(RC[-5]="",,"|n"&R1C28&RC[-5])&IF(RC[-2]="",,"|n|n"&RC[-2]) -> |n|n|cFFFFFF55附加属性|r(%)|n攻击吸血:2|n|n用于镶嵌到[剑,衣]上.|n镶嵌后不可取下!|n不需要的宝石可以在宠物处熔炼,用于宝石抽奖.
A87: 3 | B87: C | C87: [宝石] | D87: 邪光石 | G87: =IF(R[-66]C<>"",R[-66]C*9,"") ->  | H87: =IF(R[-66]C<>"",R[-66]C*9,"") ->  | I87: =IF(R[-66]C<>"",R[-66]C*9,"") ->  | J87: =IF(R[-66]C<>"",R[-66]C*9,"") ->  | K87: =IF(R[-66]C<>"",R[-66]C*9,"") -> 225000 | L87: =IF(R[-66]C<>"",INT(R[-66]C*2.5),"") -> 250 | M87: =IF(R[-66]C<>"",R[-66]C*6,"") ->  | N87: =IF(R[-66]C<>"",INT(R[-66]C*1.4),"") ->  | O87: =IF(R[-66]C<>"",INT(R[-66]C*1.4),"") ->  | P87: =IF(R[-66]C<>"",INT(R[-66]C*1.4),"") ->  | Q87: =IF(R[-66]C<>"",INT(R[-66]C*1.4),"") ->  | AE87: 用于镶嵌到[剑,衣]上.|n镶嵌后不可取下!|n不需要的宝石可以在宠物处熔炼,用于宝石抽奖. | AF87: =VLOOKUP(RC[-31],Sheet2!R13C1:R19C2,2,0)&"."&VLOOKUP(RC[-30],Sheet2!R7C1:R12C2,2,0)&VLOOKUP(RC[-30],Sheet2!R1C1:R6C2,2,0)&RC[-29]&RC[-28]&RC[-27]&Sheet2!R1C3 -> 三.丙|cFF99FF66[宝石]邪光石|r | AG87: =IF(RC[-26]&RC[-25]&RC[-24]&RC[-23]&RC[-22]&RC[-21]="",,R1C6)&IF(RC[-26]="",,"|n"&R1C7&RC[-26])&IF(RC[-25]="",,"|n"&R1C8&RC[-25])&IF(RC[-24]="",,"|n"&R1C9&RC[-24])&IF(RC[-23]="",,"|n"&R1C10&RC[-23])&IF(RC[-22]="",,"|n"&R1C11&RC[-22])&IF(RC[-21]="",,"|n"&R1C12&RC[-21])&IF(RC[-19]&RC[-18]&RC[-17]&RC[-16]="",,"|n|n"&R1C13)&IF(RC[-19]="",,"|n"&R1C14&RC[-19])&IF(RC[-18]="",,"|n"&R1C15&RC[-18])&IF(RC[-17]="",,"|n"&R1C16&RC[-17])&IF(RC[-16]="",,"|n"&R1C17&RC[-16])&IF(RC[-15]="",,"|n"&R1C18&RC[-15])&IF(RC[-14]="",,"|n"&R1C19&RC[-14])&IF(RC[-13]="",,"|n"&R1C20&RC[-13])&IF(RC[-12]="",,"|n"&R1C21&RC[-12])&IF(RC[-11]="",,"|n"&R1C22&RC[-11])&IF(RC[-10]="",,"|n"&R1C23&RC[-10])&IF(RC[-9]="",,"|n"&R1C24&RC[-9])&IF(RC[-8]="",,"|n"&R1C25&RC[-8])&IF(RC[-7]="",,"|n"&R1C26&RC[-7])&IF(RC[-6]="",,"|n"&R1C27&RC[-6])&IF(RC[-5]="",,"|n"&R1C28&RC[-5])&IF(RC[-2]="",,"|n|n"&RC[-2]) -> |cFFFFFF99基础属性|r|n血量:225000|n护甲:250|n|n用于镶嵌到[剑,衣]上.|n镶嵌后不可取下!|n不需要的宝石可以在宠物处熔炼,用于宝石抽奖.
A88: 3 | B88: C | C88: [宝石] | D88: 青丝石 | G88: =IF(R[-66]C<>"",R[-66]C*9,"") ->  | H88: =IF(R[-66]C<>"",R[-66]C*9,"") -> 18000 | I88: =IF(R[-66]C<>"",R[-66]C*9,"") -> 4500 | J88: =IF(R[-66]C<>"",R[-66]C*9,"") -> 4500 | K88: =IF(R[-66]C<>"",R[-66]C*9,"") ->  | L88: =IF(R[-66]C<>"",INT(R[-66]C*2.5),"") ->  | M88: =IF(R[-66]C<>"",R[-66]C*6,"") ->  | N88: =IF(R[-66]C<>"",INT(R[-66]C*1.4),"") ->  | O88: =IF(R[-66]C<>"",INT(R[-66]C*1.4),"") ->  | P88: =IF(R[-66]C<>"",INT(R[-66]C*1.4),"") ->  | Q88: =IF(R[-66]C<>"",INT(R[-66]C*1.4),"") ->  | AE88: 用于镶嵌到[剑,衣]上.|n镶嵌后不可取下!|n不需要的宝石可以在宠物处熔炼,用于宝石抽奖. | AF88: =VLOOKUP(RC[-31],Sheet2!R13C1:R19C2,2,0)&"."&VLOOKUP(RC[-30],Sheet2!R7C1:R12C2,2,0)&VLOOKUP(RC[-30],Sheet2!R1C1:R6C2,2,0)&RC[-29]&RC[-28]&RC[-27]&Sheet2!R1C3 -> 三.丙|cFF99FF66[宝石]青丝石|r | AG88: =IF(RC[-26]&RC[-25]&RC[-24]&RC[-23]&RC[-22]&RC[-21]="",,R1C6)&IF(RC[-26]="",,"|n"&R1C7&RC[-26])&IF(RC[-25]="",,"|n"&R1C8&RC[-25])&IF(RC[-24]="",,"|n"&R1C9&RC[-24])&IF(RC[-23]="",,"|n"&R1C10&RC[-23])&IF(RC[-22]="",,"|n"&R1C11&RC[-22])&IF(RC[-21]="",,"|n"&R1C12&RC[-21])&IF(RC[-19]&RC[-18]&RC[-17]&RC[-16]="",,"|n|n"&R1C13)&IF(RC[-19]="",,"|n"&R1C14&RC[-19])&IF(RC[-18]="",,"|n"&R1C15&RC[-18])&IF(RC[-17]="",,"|n"&R1C16&RC[-17])&IF(RC[-16]="",,"|n"&R1C17&RC[-16])&IF(RC[-15]="",,"|n"&R1C18&RC[-15])&IF(RC[-14]="",,"|n"&R1C19&RC[-14])&IF(RC[-13]="",,"|n"&R1C20&RC[-13])&IF(RC[-12]="",,"|n"&R1C21&RC[-12])&IF(RC[-11]="",,"|n"&R1C22&RC[-11])&IF(RC[-10]="",,"|n"&R1C23&RC[-10])&IF(RC[-9]="",,"|n"&R1C24&RC[-9])&IF(RC[-8]="",,"|n"&R1C25&RC[-8])&IF(RC[-7]="",,"|n"&R1C26&RC[-7])&IF(RC[-6]="",,"|n"&R1C27&RC[-6])&IF(RC[-5]="",,"|n"&R1C28&RC[-5])&IF(RC[-2]="",,"|n|n"&RC[-2]) -> |cFFFFFF99基础属性|r|n力量:18000|n敏捷:4500|n智力:4500|n|n用于镶嵌到[剑,衣]上.|n镶嵌后不可取下!|n不需要的宝石可以在宠物处熔炼,用于宝石抽奖.
A89: 3 | B89: C | C89: [宝石] | D89: 照影石 | G89: =IF(R[-66]C<>"",R[-66]C*9,"") ->  | H89: =IF(R[-66]C<>"",R[-66]C*9,"") -> 4500 | I89: =IF(R[-66]C<>"",R[-66]C*9,"") -> 18000 | J89: =IF(R[-66]C<>"",R[-66]C*9,"") -> 4500 | K89: =IF(R[-66]C<>"",R[-66]C*9,"") ->  | L89: =IF(R[-66]C<>"",INT(R[-66]C*2.5),"") ->  | M89: =IF(R[-66]C<>"",R[-66]C*6,"") ->  | N89: =IF(R[-66]C<>"",INT(R[-66]C*1.4),"") ->  | O89: =IF(R[-66]C<>"",INT(R[-66]C*1.4),"") ->  | P89: =IF(R[-66]C<>"",INT(R[-66]C*1.4),"") ->  | Q89: =IF(R[-66]C<>"",INT(R[-66]C*1.4),"") ->  | AE89: 用于镶嵌到[剑,衣]上.|n镶嵌后不可取下!|n不需要的宝石可以在宠物处熔炼,用于宝石抽奖. | AF89: =VLOOKUP(RC[-31],Sheet2!R13C1:R19C2,2,0)&"."&VLOOKUP(RC[-30],Sheet2!R7C1:R12C2,2,0)&VLOOKUP(RC[-30],Sheet2!R1C1:R6C2,2,0)&RC[-29]&RC[-28]&RC[-27]&Sheet2!R1C3 -> 三.丙|cFF99FF66[宝石]照影石|r | AG89: =IF(RC[-26]&RC[-25]&RC[-24]&RC[-23]&RC[-22]&RC[-21]="",,R1C6)&IF(RC[-26]="",,"|n"&R1C7&RC[-26])&IF(RC[-25]="",,"|n"&R1C8&RC[-25])&IF(RC[-24]="",,"|n"&R1C9&RC[-24])&IF(RC[-23]="",,"|n"&R1C10&RC[-23])&IF(RC[-22]="",,"|n"&R1C11&RC[-22])&IF(RC[-21]="",,"|n"&R1C12&RC[-21])&IF(RC[-19]&RC[-18]&RC[-17]&RC[-16]="",,"|n|n"&R1C13)&IF(RC[-19]="",,"|n"&R1C14&RC[-19])&IF(RC[-18]="",,"|n"&R1C15&RC[-18])&IF(RC[-17]="",,"|n"&R1C16&RC[-17])&IF(RC[-16]="",,"|n"&R1C17&RC[-16])&IF(RC[-15]="",,"|n"&R1C18&RC[-15])&IF(RC[-14]="",,"|n"&R1C19&RC[-14])&IF(RC[-13]="",,"|n"&R1C20&RC[-13])&IF(RC[-12]="",,"|n"&R1C21&RC[-12])&IF(RC[-11]="",,"|n"&R1C22&RC[-11])&IF(RC[-10]="",,"|n"&R1C23&RC[-10])&IF(RC[-9]="",,"|n"&R1C24&RC[-9])&IF(RC[-8]="",,"|n"&R1C25&RC[-8])&IF(RC[-7]="",,"|n"&R1C26&RC[-7])&IF(RC[-6]="",,"|n"&R1C27&RC[-6])&IF(RC[-5]="",,"|n"&R1C28&RC[-5])&IF(RC[-2]="",,"|n|n"&RC[-2]) -> |cFFFFFF99基础属性|r|n力量:4500|n敏捷:18000|n智力:4500|n|n用于镶嵌到[剑,衣]上.|n镶嵌后不可取下!|n不需要的宝石可以在宠物处熔炼,用于宝石抽奖.
A90: 3 | B90: C | C90: [宝石] | D90: 棂兰石 | G90: =IF(R[-66]C<>"",R[-66]C*9,"") ->  | H90: =IF(R[-66]C<>"",R[-66]C*9,"") -> 4500 | I90: =IF(R[-66]C<>"",R[-66]C*9,"") -> 4500 | J90: =IF(R[-66]C<>"",R[-66]C*9,"") -> 18000 | K90: =IF(R[-66]C<>"",R[-66]C*9,"") ->  | L90: =IF(R[-66]C<>"",INT(R[-66]C*2.5),"") ->  | M90: =IF(R[-66]C<>"",R[-66]C*6,"") ->  | N90: =IF(R[-66]C<>"",INT(R[-66]C*1.4),"") ->  | O90: =IF(R[-66]C<>"",INT(R[-66]C*1.4),"") ->  | P90: =IF(R[-66]C<>"",INT(R[-66]C*1.4),"") ->  | Q90: =IF(R[-66]C<>"",INT(R[-66]C*1.4),"") ->  | AE90: 用于镶嵌到[剑,衣]上.|n镶嵌后不可取下!|n不需要的宝石可以在宠物处熔炼,用于宝石抽奖. | AF90: =VLOOKUP(RC[-31],Sheet2!R13C1:R19C2,2,0)&"."&VLOOKUP(RC[-30],Sheet2!R7C1:R12C2,2,0)&VLOOKUP(RC[-30],Sheet2!R1C1:R6C2,2,0)&RC[-29]&RC[-28]&RC[-27]&Sheet2!R1C3 -> 三.丙|cFF99FF66[宝石]棂兰石|r | AG90: =IF(RC[-26]&RC[-25]&RC[-24]&RC[-23]&RC[-22]&RC[-21]="",,R1C6)&IF(RC[-26]="",,"|n"&R1C7&RC[-26])&IF(RC[-25]="",,"|n"&R1C8&RC[-25])&IF(RC[-24]="",,"|n"&R1C9&RC[-24])&IF(RC[-23]="",,"|n"&R1C10&RC[-23])&IF(RC[-22]="",,"|n"&R1C11&RC[-22])&IF(RC[-21]="",,"|n"&R1C12&RC[-21])&IF(RC[-19]&RC[-18]&RC[-17]&RC[-16]="",,"|n|n"&R1C13)&IF(RC[-19]="",,"|n"&R1C14&RC[-19])&IF(RC[-18]="",,"|n"&R1C15&RC[-18])&IF(RC[-17]="",,"|n"&R1C16&RC[-17])&IF(RC[-16]="",,"|n"&R1C17&RC[-16])&IF(RC[-15]="",,"|n"&R1C18&RC[-15])&IF(RC[-14]="",,"|n"&R1C19&RC[-14])&IF(RC[-13]="",,"|n"&R1C20&RC[-13])&IF(RC[-12]="",,"|n"&R1C21&RC[-12])&IF(RC[-11]="",,"|n"&R1C22&RC[-11])&IF(RC[-10]="",,"|n"&R1C23&RC[-10])&IF(RC[-9]="",,"|n"&R1C24&RC[-9])&IF(RC[-8]="",,"|n"&R1C25&RC[-8])&IF(RC[-7]="",,"|n"&R1C26&RC[-7])&IF(RC[-6]="",,"|n"&R1C27&RC[-6])&IF(RC[-5]="",,"|n"&R1C28&RC[-5])&IF(RC[-2]="",,"|n|n"&RC[-2]) -> |cFFFFFF99基础属性|r|n力量:4500|n敏捷:4500|n智力:18000|n|n用于镶嵌到[剑,衣]上.|n镶嵌后不可取下!|n不需要的宝石可以在宠物处熔炼,用于宝石抽奖.
A91: 3 | B91: C | C91: [宝石] | D91: 战豹石 | G91: =IF(R[-66]C<>"",R[-66]C*9,"") ->  | H91: =IF(R[-66]C<>"",R[-66]C*9,"") ->  | I91: =IF(R[-66]C<>"",R[-66]C*9,"") ->  | J91: =IF(R[-66]C<>"",R[-66]C*9,"") ->  | K91: =IF(R[-66]C<>"",R[-66]C*9,"") ->  | L91: =IF(R[-66]C<>"",INT(R[-66]C*2.5),"") ->  | M91: =IF(R[-66]C<>"",R[-66]C*6,"") ->  | N91: =IF(R[-66]C<>"",INT(R[-66]C*1.4),"") -> 21 | O91: =IF(R[-66]C<>"",INT(R[-66]C*1.4),"") ->  | P91: =IF(R[-66]C<>"",INT(R[-66]C*1.4),"") ->  | Q91: =IF(R[-66]C<>"",INT(R[-66]C*1.4),"") ->  | AE91: 用于镶嵌到[剑,衣]上.|n镶嵌后不可取下!|n不需要的宝石可以在宠物处熔炼,用于宝石抽奖. | AF91: =VLOOKUP(RC[-31],Sheet2!R13C1:R19C2,2,0)&"."&VLOOKUP(RC[-30],Sheet2!R7C1:R12C2,2,0)&VLOOKUP(RC[-30],Sheet2!R1C1:R6C2,2,0)&RC[-29]&RC[-28]&RC[-27]&Sheet2!R1C3 -> 三.丙|cFF99FF66[宝石]战豹石|r | AG91: =IF(RC[-26]&RC[-25]&RC[-24]&RC[-23]&RC[-22]&RC[-21]="",,R1C6)&IF(RC[-26]="",,"|n"&R1C7&RC[-26])&IF(RC[-25]="",,"|n"&R1C8&RC[-25])&IF(RC[-24]="",,"|n"&R1C9&RC[-24])&IF(RC[-23]="",,"|n"&R1C10&RC[-23])&IF(RC[-22]="",,"|n"&R1C11&RC[-22])&IF(RC[-21]="",,"|n"&R1C12&RC[-21])&IF(RC[-19]&RC[-18]&RC[-17]&RC[-16]="",,"|n|n"&R1C13)&IF(RC[-19]="",,"|n"&R1C14&RC[-19])&IF(RC[-18]="",,"|n"&R1C15&RC[-18])&IF(RC[-17]="",,"|n"&R1C16&RC[-17])&IF(RC[-16]="",,"|n"&R1C17&RC[-16])&IF(RC[-15]="",,"|n"&R1C18&RC[-15])&IF(RC[-14]="",,"|n"&R1C19&RC[-14])&IF(RC[-13]="",,"|n"&R1C20&RC[-13])&IF(RC[-12]="",,"|n"&R1C21&RC[-12])&IF(RC[-11]="",,"|n"&R1C22&RC[-11])&IF(RC[-10]="",,"|n"&R1C23&RC[-10])&IF(RC[-9]="",,"|n"&R1C24&RC[-9])&IF(RC[-8]="",,"|n"&R1C25&RC[-8])&IF(RC[-7]="",,"|n"&R1C26&RC[-7])&IF(RC[-6]="",,"|n"&R1C27&RC[-6])&IF(RC[-5]="",,"|n"&R1C28&RC[-5])&IF(RC[-2]="",,"|n|n"&RC[-2]) -> |n|n|cFFFFFF55附加属性|r(%)|n攻速:21|n|n用于镶嵌到[剑,衣]上.|n镶嵌后不可取下!|n不需要的宝石可以在宠物处熔炼,用于宝石抽奖.
A92: 3 | B92: B | C92: [宝石] | D92: 金鼎细晶 | G92: =IF(R[-66]C<>"",R[-66]C*9,"") ->  | H92: =IF(R[-66]C<>"",R[-66]C*9,"") -> 22500 | I92: =IF(R[-66]C<>"",R[-66]C*9,"") ->  | J92: =IF(R[-66]C<>"",R[-66]C*9,"") ->  | K92: =IF(R[-66]C<>"",R[-66]C*9,"") ->  | L92: =IF(R[-66]C<>"",INT(R[-66]C*2.5),"") -> 62 | N92: =IF(R[-66]C<>"",INT(R[-66]C*1.4),"") ->  | O92: =IF(R[-66]C<>"",INT(R[-66]C*1.4),"") ->  | P92: =IF(R[-66]C<>"",INT(R[-66]C*1.4),"") ->  | Q92: =IF(R[-66]C<>"",INT(R[-66]C*1.4),"") ->  | R92: =IF(R[-66]C<>"",INT(R[-66]C*1.4),"") -> 2 | AE92: 用于镶嵌到[剑,衣]上.|n镶嵌后不可取下!|n不需要的宝石可以在宠物处熔炼,用于宝石抽奖. | AF92: =VLOOKUP(RC[-31],Sheet2!R13C1:R19C2,2,0)&"."&VLOOKUP(RC[-30],Sheet2!R7C1:R12C2,2,0)&VLOOKUP(RC[-30],Sheet2!R1C1:R6C2,2,0)&RC[-29]&RC[-28]&RC[-27]&Sheet2!R1C3 -> 三.乙|cFF1BE6B8[宝石]金鼎细晶|r | AG92: =IF(RC[-26]&RC[-25]&RC[-24]&RC[-23]&RC[-22]&RC[-21]="",,R1C6)&IF(RC[-26]="",,"|n"&R1C7&RC[-26])&IF(RC[-25]="",,"|n"&R1C8&RC[-25])&IF(RC[-24]="",,"|n"&R1C9&RC[-24])&IF(RC[-23]="",,"|n"&R1C10&RC[-23])&IF(RC[-22]="",,"|n"&R1C11&RC[-22])&IF(RC[-21]="",,"|n"&R1C12&RC[-21])&IF(RC[-19]&RC[-18]&RC[-17]&RC[-16]="",,"|n|n"&R1C13)&IF(RC[-19]="",,"|n"&R1C14&RC[-19])&IF(RC[-18]="",,"|n"&R1C15&RC[-18])&IF(RC[-17]="",,"|n"&R1C16&RC[-17])&IF(RC[-16]="",,"|n"&R1C17&RC[-16])&IF(RC[-15]="",,"|n"&R1C18&RC[-15])&IF(RC[-14]="",,"|n"&R1C19&RC[-14])&IF(RC[-13]="",,"|n"&R1C20&RC[-13])&IF(RC[-12]="",,"|n"&R1C21&RC[-12])&IF(RC[-11]="",,"|n"&R1C22&RC[-11])&IF(RC[-10]="",,"|n"&R1C23&RC[-10])&IF(RC[-9]="",,"|n"&R1C24&RC[-9])&IF(RC[-8]="",,"|n"&R1C25&RC[-8])&IF(RC[-7]="",,"|n"&R1C26&RC[-7])&IF(RC[-6]="",,"|n"&R1C27&RC[-6])&IF(RC[-5]="",,"|n"&R1C28&RC[-5])&IF(RC[-2]="",,"|n|n"&RC[-2]) -> |cFFFFFF99基础属性|r|n力量:22500|n护甲:62|n伤害增幅:2|n|n用于镶嵌到[剑,衣]上.|n镶嵌后不可取下!|n不需要的宝石可以在宠物处熔炼,用于宝石抽奖.
A93: 3 | B93: B | C93: [宝石] | D93: 噬魂魔石 | G93: =IF(R[-66]C<>"",R[-66]C*9,"") -> 54000 | H93: =IF(R[-66]C<>"",R[-66]C*9,"") ->  | I93: =IF(R[-66]C<>"",R[-66]C*9,"") ->  | J93: =IF(R[-66]C<>"",R[-66]C*9,"") ->  | K93: =IF(R[-66]C<>"",R[-66]C*9,"") ->  | L93: =IF(R[-66]C<>"",INT(R[-66]C*2.5),"") -> 62 | N93: =IF(R[-66]C<>"",INT(R[-66]C*1.4),"") ->  | O93: =IF(R[-66]C<>"",INT(R[-66]C*1.4),"") ->  | P93: =IF(R[-66]C<>"",INT(R[-66]C*1.4),"") ->  | Q93: =IF(R[-66]C<>"",INT(R[-66]C*1.4),"") ->  | R93: =IF(R[-66]C<>"",INT(R[-66]C*1.4),"") -> 2 | AE93: 用于镶嵌到[剑,衣]上.|n镶嵌后不可取下!|n不需要的宝石可以在宠物处熔炼,用于宝石抽奖. | AF93: =VLOOKUP(RC[-31],Sheet2!R13C1:R19C2,2,0)&"."&VLOOKUP(RC[-30],Sheet2!R7C1:R12C2,2,0)&VLOOKUP(RC[-30],Sheet2!R1C1:R6C2,2,0)&RC[-29]&RC[-28]&RC[-27]&Sheet2!R1C3 -> 三.乙|cFF1BE6B8[宝石]噬魂魔石|r | AG93: =IF(RC[-26]&RC[-25]&RC[-24]&RC[-23]&RC[-22]&RC[-21]="",,R1C6)&IF(RC[-26]="",,"|n"&R1C7&RC[-26])&IF(RC[-25]="",,"|n"&R1C8&RC[-25])&IF(RC[-24]="",,"|n"&R1C9&RC[-24])&IF(RC[-23]="",,"|n"&R1C10&RC[-23])&IF(RC[-22]="",,"|n"&R1C11&RC[-22])&IF(RC[-21]="",,"|n"&R1C12&RC[-21])&IF(RC[-19]&RC[-18]&RC[-17]&RC[-16]="",,"|n|n"&R1C13)&IF(RC[-19]="",,"|n"&R1C14&RC[-19])&IF(RC[-18]="",,"|n"&R1C15&RC[-18])&IF(RC[-17]="",,"|n"&R1C16&RC[-17])&IF(RC[-16]="",,"|n"&R1C17&RC[-16])&IF(RC[-15]="",,"|n"&R1C18&RC[-15])&IF(RC[-14]="",,"|n"&R1C19&RC[-14])&IF(RC[-13]="",,"|n"&R1C20&RC[-13])&IF(RC[-12]="",,"|n"&R1C21&RC[-12])&IF(RC[-11]="",,"|n"&R1C22&RC[-11])&IF(RC[-10]="",,"|n"&R1C23&RC[-10])&IF(RC[-9]="",,"|n"&R1C24&RC[-9])&IF(RC[-8]="",,"|n"&R1C25&RC[-8])&IF(RC[-7]="",,"|n"&R1C26&RC[-7])&IF(RC[-6]="",,"|n"&R1C27&RC[-6])&IF(RC[-5]="",,"|n"&R1C28&RC[-5])&IF(RC[-2]="",,"|n|n"&RC[-2]) -> |cFFFFFF99基础属性|r|n攻击:54000|n护甲:62|n伤害增幅:2|n|n用于镶嵌到[剑,衣]上.|n镶嵌后不可取下!|n不需要的宝石可以在宠物处熔炼,用于宝石抽奖.
A94: 3 | B94: B | C94: [宝石] | D94: 赤霞纯土 | G94: =IF(R[-66]C<>"",R[-66]C*9,"") ->  | H94: =IF(R[-66]C<>"",R[-66]C*9,"") ->  | I94: =IF(R[-66]C<>"",R[-66]C*9,"") ->  | J94: =IF(R[-66]C<>"",R[-66]C*9,"") -> 22500 | K94: =IF(R[-66]C<>"",R[-66]C*9,"") ->  | L94: =IF(R[-66]C<>"",INT(R[-66]C*2.5),"") -> 62 | N94: =IF(R[-66]C<>"",INT(R[-66]C*1.4),"") ->  | O94: =IF(R[-66]C<>"",INT(R[-66]C*1.4),"") ->  | P94: =IF(R[-66]C<>"",INT(R[-66]C*1.4),"") ->  | Q94: =IF(R[-66]C<>"",INT(R[-66]C*1.4),"") ->  | R94: =IF(R[-66]C<>"",INT(R[-66]C*1.4),"") -> 2 | AE94: 用于镶嵌到[剑,衣]上.|n镶嵌后不可取下!|n不需要的宝石可以在宠物处熔炼,用于宝石抽奖. | AF94: =VLOOKUP(RC[-31],Sheet2!R13C1:R19C2,2,0)&"."&VLOOKUP(RC[-30],Sheet2!R7C1:R12C2,2,0)&VLOOKUP(RC[-30],Sheet2!R1C1:R6C2,2,0)&RC[-29]&RC[-28]&RC[-27]&Sheet2!R1C3 -> 三.乙|cFF1BE6B8[宝石]赤霞纯土|r | AG94: =IF(RC[-26]&RC[-25]&RC[-24]&RC[-23]&RC[-22]&RC[-21]="",,R1C6)&IF(RC[-26]="",,"|n"&R1C7&RC[-26])&IF(RC[-25]="",,"|n"&R1C8&RC[-25])&IF(RC[-24]="",,"|n"&R1C9&RC[-24])&IF(RC[-23]="",,"|n"&R1C10&RC[-23])&IF(RC[-22]="",,"|n"&R1C11&RC[-22])&IF(RC[-21]="",,"|n"&R1C12&RC[-21])&IF(RC[-19]&RC[-18]&RC[-17]&RC[-16]="",,"|n|n"&R1C13)&IF(RC[-19]="",,"|n"&R1C14&RC[-19])&IF(RC[-18]="",,"|n"&R1C15&RC[-18])&IF(RC[-17]="",,"|n"&R1C16&RC[-17])&IF(RC[-16]="",,"|n"&R1C17&RC[-16])&IF(RC[-15]="",,"|n"&R1C18&RC[-15])&IF(RC[-14]="",,"|n"&R1C19&RC[-14])&IF(RC[-13]="",,"|n"&R1C20&RC[-13])&IF(RC[-12]="",,"|n"&R1C21&RC[-12])&IF(RC[-11]="",,"|n"&R1C22&RC[-11])&IF(RC[-10]="",,"|n"&R1C23&RC[-10])&IF(RC[-9]="",,"|n"&R1C24&RC[-9])&IF(RC[-8]="",,"|n"&R1C25&RC[-8])&IF(RC[-7]="",,"|n"&R1C26&RC[-7])&IF(RC[-6]="",,"|n"&R1C27&RC[-6])&IF(RC[-5]="",,"|n"&R1C28&RC[-5])&IF(RC[-2]="",,"|n|n"&RC[-2]) -> |cFFFFFF99基础属性|r|n智力:22500|n护甲:62|n伤害增幅:2|n|n用于镶嵌到[剑,衣]上.|n镶嵌后不可取下!|n不需要的宝石可以在宠物处熔炼,用于宝石抽奖.
A95: 3 | B95: B | C95: [宝石] | D95: 洗髓幻木 | G95: =IF(R[-66]C<>"",R[-66]C*9,"") ->  | H95: =IF(R[-66]C<>"",R[-66]C*9,"") ->  | I95: =IF(R[-66]C<>"",R[-66]C*9,"") -> 22500 | J95: =IF(R[-66]C<>"",R[-66]C*9,"") ->  | K95: =IF(R[-66]C<>"",R[-66]C*9,"") ->  | L95: =IF(R[-66]C<>"",INT(R[-66]C*2.5),"") -> 62 | N95: =IF(R[-66]C<>"",INT(R[-66]C*1.4),"") ->  | O95: =IF(R[-66]C<>"",INT(R[-66]C*1.4),"") ->  | P95: =IF(R[-66]C<>"",INT(R[-66]C*1.4),"") ->  | Q95: =IF(R[-66]C<>"",INT(R[-66]C*1.4),"") ->  | R95: =IF(R[-66]C<>"",INT(R[-66]C*1.4),"") -> 2 | AE95: 用于镶嵌到[剑,衣]上.|n镶嵌后不可取下!|n不需要的宝石可以在宠物处熔炼,用于宝石抽奖. | AF95: =VLOOKUP(RC[-31],Sheet2!R13C1:R19C2,2,0)&"."&VLOOKUP(RC[-30],Sheet2!R7C1:R12C2,2,0)&VLOOKUP(RC[-30],Sheet2!R1C1:R6C2,2,0)&RC[-29]&RC[-28]&RC[-27]&Sheet2!R1C3 -> 三.乙|cFF1BE6B8[宝石]洗髓幻木|r | AG95: =IF(RC[-26]&RC[-25]&RC[-24]&RC[-23]&RC[-22]&RC[-21]="",,R1C6)&IF(RC[-26]="",,"|n"&R1C7&RC[-26])&IF(RC[-25]="",,"|n"&R1C8&RC[-25])&IF(RC[-24]="",,"|n"&R1C9&RC[-24])&IF(RC[-23]="",,"|n"&R1C10&RC[-23])&IF(RC[-22]="",,"|n"&R1C11&RC[-22])&IF(RC[-21]="",,"|n"&R1C12&RC[-21])&IF(RC[-19]&RC[-18]&RC[-17]&RC[-16]="",,"|n|n"&R1C13)&IF(RC[-19]="",,"|n"&R1C14&RC[-19])&IF(RC[-18]="",,"|n"&R1C15&RC[-18])&IF(RC[-17]="",,"|n"&R1C16&RC[-17])&IF(RC[-16]="",,"|n"&R1C17&RC[-16])&IF(RC[-15]="",,"|n"&R1C18&RC[-15])&IF(RC[-14]="",,"|n"&R1C19&RC[-14])&IF(RC[-13]="",,"|n"&R1C20&RC[-13])&IF(RC[-12]="",,"|n"&R1C21&RC[-12])&IF(RC[-11]="",,"|n"&R1C22&RC[-11])&IF(RC[-10]="",,"|n"&R1C23&RC[-10])&IF(RC[-9]="",,"|n"&R1C24&RC[-9])&IF(RC[-8]="",,"|n"&R1C25&RC[-8])&IF(RC[-7]="",,"|n"&R1C26&RC[-7])&IF(RC[-6]="",,"|n"&R1C27&RC[-6])&IF(RC[-5]="",,"|n"&R1C28&RC[-5])&IF(RC[-2]="",,"|n|n"&RC[-2]) -> |cFFFFFF99基础属性|r|n敏捷:22500|n护甲:62|n伤害增幅:2|n|n用于镶嵌到[剑,衣]上.|n镶嵌后不可取下!|n不需要的宝石可以在宠物处熔炼,用于宝石抽奖.
A96: 3 | B96: A | C96: [宝石] | D96: 黑月之潮 | G96: =IF(R[-66]C<>"",R[-66]C*9,"") ->  | H96: =IF(R[-66]C<>"",R[-66]C*9,"") -> 10800 | I96: =IF(R[-66]C<>"",R[-66]C*9,"") -> 10800 | J96: =IF(R[-66]C<>"",R[-66]C*9,"") -> 10800 | K96: =IF(R[-66]C<>"",R[-66]C*9,"") ->  | L96: =IF(R[-66]C<>"",INT(R[-66]C*2.5),"") ->  | N96: =IF(R[-66]C<>"",INT(R[-66]C*1.4),"") -> 8 | O96: =IF(R[-66]C<>"",INT(R[-66]C*1.4),"") ->  | P96: =IF(R[-66]C<>"",INT(R[-66]C*1.4),"") ->  | Q96: =IF(R[-66]C<>"",INT(R[-66]C*1.4),"") ->  | R96: =IF(R[-66]C<>"",INT(R[-66]C*1.4),"") -> 5 | S96: =IF(R[-66]C<>"",INT(R[-66]C*1.4),"") ->  | T96: =IF(R[-66]C<>"",INT(R[-66]C*1.4),"") ->  | AE96: 用于镶嵌到[剑,衣]上.|n镶嵌后不可取下!|n不需要的宝石可以在宠物处熔炼,用于宝石抽奖. | AF96: =VLOOKUP(RC[-31],Sheet2!R13C1:R19C2,2,0)&"."&VLOOKUP(RC[-30],Sheet2!R7C1:R12C2,2,0)&VLOOKUP(RC[-30],Sheet2!R1C1:R6C2,2,0)&RC[-29]&RC[-28]&RC[-27]&Sheet2!R1C3 -> 三.甲|cFF33FF00[宝石]黑月之潮|r | AG96: =IF(RC[-26]&RC[-25]&RC[-24]&RC[-23]&RC[-22]&RC[-21]="",,R1C6)&IF(RC[-26]="",,"|n"&R1C7&RC[-26])&IF(RC[-25]="",,"|n"&R1C8&RC[-25])&IF(RC[-24]="",,"|n"&R1C9&RC[-24])&IF(RC[-23]="",,"|n"&R1C10&RC[-23])&IF(RC[-22]="",,"|n"&R1C11&RC[-22])&IF(RC[-21]="",,"|n"&R1C12&RC[-21])&IF(RC[-19]&RC[-18]&RC[-17]&RC[-16]="",,"|n|n"&R1C13)&IF(RC[-19]="",,"|n"&R1C14&RC[-19])&IF(RC[-18]="",,"|n"&R1C15&RC[-18])&IF(RC[-17]="",,"|n"&R1C16&RC[-17])&IF(RC[-16]="",,"|n"&R1C17&RC[-16])&IF(RC[-15]="",,"|n"&R1C18&RC[-15])&IF(RC[-14]="",,"|n"&R1C19&RC[-14])&IF(RC[-13]="",,"|n"&R1C20&RC[-13])&IF(RC[-12]="",,"|n"&R1C21&RC[-12])&IF(RC[-11]="",,"|n"&R1C22&RC[-11])&IF(RC[-10]="",,"|n"&R1C23&RC[-10])&IF(RC[-9]="",,"|n"&R1C24&RC[-9])&IF(RC[-8]="",,"|n"&R1C25&RC[-8])&IF(RC[-7]="",,"|n"&R1C26&RC[-7])&IF(RC[-6]="",,"|n"&R1C27&RC[-6])&IF(RC[-5]="",,"|n"&R1C28&RC[-5])&IF(RC[-2]="",,"|n|n"&RC[-2]) -> |cFFFFFF99基础属性|r|n力量:10800|n敏捷:10800|n智力:10800|n|n|cFFFFFF55附加属性|r(%)|n攻速:8|n伤害增幅:5|n|n用于镶嵌到[剑,衣]上.|n镶嵌后不可取下!|n不需要的宝石可以在宠物处熔炼,用于宝石抽奖.
A97: 3 | B97: A | C97: [宝石] | D97: 成王之志 | G97: =IF(R[-66]C<>"",R[-66]C*9,"") -> 72000 | H97: =IF(R[-66]C<>"",R[-66]C*9,"") ->  | I97: =IF(R[-66]C<>"",R[-66]C*9,"") ->  | J97: =IF(R[-66]C<>"",R[-66]C*9,"") ->  | K97: =IF(R[-66]C<>"",R[-66]C*9,"") ->  | L97: =IF(R[-66]C<>"",INT(R[-66]C*2.5),"") ->  | N97: =IF(R[-66]C<>"",INT(R[-66]C*1.4),"") -> 8 | O97: =IF(R[-66]C<>"",INT(R[-66]C*1.4),"") ->  | P97: =IF(R[-66]C<>"",INT(R[-66]C*1.4),"") ->  | Q97: =IF(R[-66]C<>"",INT(R[-66]C*1.4),"") ->  | R97: =IF(R[-66]C<>"",INT(R[-66]C*1.4),"") -> 5 | S97: =IF(R[-66]C<>"",INT(R[-66]C*1.4),"") ->  | T97: =IF(R[-66]C<>"",INT(R[-66]C*1.4),"") ->  | AE97: 用于镶嵌到[剑,衣]上.|n镶嵌后不可取下!|n不需要的宝石可以在宠物处熔炼,用于宝石抽奖. | AF97: =VLOOKUP(RC[-31],Sheet2!R13C1:R19C2,2,0)&"."&VLOOKUP(RC[-30],Sheet2!R7C1:R12C2,2,0)&VLOOKUP(RC[-30],Sheet2!R1C1:R6C2,2,0)&RC[-29]&RC[-28]&RC[-27]&Sheet2!R1C3 -> 三.甲|cFF33FF00[宝石]成王之志|r | AG97: =IF(RC[-26]&RC[-25]&RC[-24]&RC[-23]&RC[-22]&RC[-21]="",,R1C6)&IF(RC[-26]="",,"|n"&R1C7&RC[-26])&IF(RC[-25]="",,"|n"&R1C8&RC[-25])&IF(RC[-24]="",,"|n"&R1C9&RC[-24])&IF(RC[-23]="",,"|n"&R1C10&RC[-23])&IF(RC[-22]="",,"|n"&R1C11&RC[-22])&IF(RC[-21]="",,"|n"&R1C12&RC[-21])&IF(RC[-19]&RC[-18]&RC[-17]&RC[-16]="",,"|n|n"&R1C13)&IF(RC[-19]="",,"|n"&R1C14&RC[-19])&IF(RC[-18]="",,"|n"&R1C15&RC[-18])&IF(RC[-17]="",,"|n"&R1C16&RC[-17])&IF(RC[-16]="",,"|n"&R1C17&RC[-16])&IF(RC[-15]="",,"|n"&R1C18&RC[-15])&IF(RC[-14]="",,"|n"&R1C19&RC[-14])&IF(RC[-13]="",,"|n"&R1C20&RC[-13])&IF(RC[-12]="",,"|n"&R1C21&RC[-12])&IF(RC[-11]="",,"|n"&R1C22&RC[-11])&IF(RC[-10]="",,"|n"&R1C23&RC[-10])&IF(RC[-9]="",,"|n"&R1C24&RC[-9])&IF(RC[-8]="",,"|n"&R1C25&RC[-8])&IF(RC[-7]="",,"|n"&R1C26&RC[-7])&IF(RC[-6]="",,"|n"&R1C27&RC[-6])&IF(RC[-5]="",,"|n"&R1C28&RC[-5])&IF(RC[-2]="",,"|n|n"&RC[-2]) -> |cFFFFFF99基础属性|r|n攻击:72000|n|n|cFFFFFF55附加属性|r(%)|n攻速:8|n伤害增幅:5|n|n用于镶嵌到[剑,衣]上.|n镶嵌后不可取下!|n不需要的宝石可以在宠物处熔炼,用于宝石抽奖.
A98: 3 | B98: S | C98: [宝石] | D98: 道禅 - 静心 | G98: =IF(R[-66]C<>"",R[-66]C*9,"") ->  | H98: =IF(R[-66]C<>"",R[-66]C*9,"") ->  | I98: =IF(R[-66]C<>"",R[-66]C*9,"") ->  | J98: =IF(R[-66]C<>"",R[-66]C*9,"") ->  | K98: =IF(R[-66]C<>"",R[-66]C*9,"") -> 270000 | L98: =IF(R[-66]C<>"",INT(R[-66]C*2.5),"") -> 375 | N98: =IF(R[-66]C<>"",INT(R[-66]C*1.4),"") ->  | O98: =IF(R[-66]C<>"",INT(R[-66]C*1.4),"") -> 1 | P98: =IF(R[-66]C<>"",INT(R[-66]C*1.4),"") ->  | Q98: =IF(R[-66]C<>"",INT(R[-66]C*1.4),"") ->  | R98: =IF(R[-66]C<>"",INT(R[-66]C*1.4),"") -> 5 | S98: =IF(R[-66]C<>"",INT(R[-66]C*1.4),"") ->  | T98: =IF(R[-66]C<>"",INT(R[-66]C*1.4),"") ->  | AE98: 用于镶嵌到[剑,衣]上.|n镶嵌后不可取下!|n不需要的宝石可以在宠物处熔炼,用于宝石抽奖. | AF98: =VLOOKUP(RC[-31],Sheet2!R13C1:R19C2,2,0)&"."&VLOOKUP(RC[-30],Sheet2!R7C1:R12C2,2,0)&VLOOKUP(RC[-30],Sheet2!R1C1:R6C2,2,0)&RC[-29]&RC[-28]&RC[-27]&Sheet2!R1C3 -> 三.绝|cFFFF9933[宝石]道禅 - 静心|r | AG98: =IF(RC[-26]&RC[-25]&RC[-24]&RC[-23]&RC[-22]&RC[-21]="",,R1C6)&IF(RC[-26]="",,"|n"&R1C7&RC[-26])&IF(RC[-25]="",,"|n"&R1C8&RC[-25])&IF(RC[-24]="",,"|n"&R1C9&RC[-24])&IF(RC[-23]="",,"|n"&R1C10&RC[-23])&IF(RC[-22]="",,"|n"&R1C11&RC[-22])&IF(RC[-21]="",,"|n"&R1C12&RC[-21])&IF(RC[-19]&RC[-18]&RC[-17]&RC[-16]="",,"|n|n"&R1C13)&IF(RC[-19]="",,"|n"&R1C14&RC[-19])&IF(RC[-18]="",,"|n"&R1C15&RC[-18])&IF(RC[-17]="",,"|n"&R1C16&RC[-17])&IF(RC[-16]="",,"|n"&R1C17&RC[-16])&IF(RC[-15]="",,"|n"&R1C18&RC[-15])&IF(RC[-14]="",,"|n"&R1C19&RC[-14])&IF(RC[-13]="",,"|n"&R1C20&RC[-13])&IF(RC[-12]="",,"|n"&R1C21&RC[-12])&IF(RC[-11]="",,"|n"&R1C22&RC[-11])&IF(RC[-10]="",,"|n"&R1C23&RC[-10])&IF(RC[-9]="",,"|n"&R1C24&RC[-9])&IF(RC[-8]="",,"|n"&R1C25&RC[-8])&IF(RC[-7]="",,"|n"&R1C26&RC[-7])&IF(RC[-6]="",,"|n"&R1C27&RC[-6])&IF(RC[-5]="",,"|n"&R1C28&RC[-5])&IF(RC[-2]="",,"|n|n"&RC[-2]) -> |cFFFFFF99基础属性|r|n血量:270000|n护甲:375|n|n|cFFFFFF55附加属性|r(%)|n攻击吸血:1|n伤害增幅:5|n|n用于镶嵌到[剑,衣]上.|n镶嵌后不可取下!|n不需要的宝石可以在宠物处熔炼,用于宝石抽奖.
A99: 3 | B99: S | C99: [宝石] | D99: 道禅 - 制怒 | G99: =IF(R[-66]C<>"",R[-66]C*9,"") -> 22500 | H99: =IF(R[-66]C<>"",R[-66]C*9,"") ->  | I99: =IF(R[-66]C<>"",R[-66]C*9,"") ->  | J99: =IF(R[-66]C<>"",R[-66]C*9,"") ->  | K99: =IF(R[-66]C<>"",R[-66]C*9,"") ->  | L99: =IF(R[-66]C<>"",INT(R[-66]C*2.5),"") ->  | N99: =IF(R[-66]C<>"",INT(R[-66]C*1.4),"") ->  | O99: =IF(R[-66]C<>"",INT(R[-66]C*1.4),"") ->  | P99: =IF(R[-66]C<>"",INT(R[-66]C*1.4),"") -> 7 | Q99: =IF(R[-66]C<>"",INT(R[-66]C*1.4),"") -> 28 | R99: =IF(R[-66]C<>"",INT(R[-66]C*1.4),"") -> 5 | S99: =IF(R[-66]C<>"",INT(R[-66]C*1.4),"") ->  | T99: =IF(R[-66]C<>"",INT(R[-66]C*1.4),"") ->  | AE99: 用于镶嵌到[剑,衣]上.|n镶嵌后不可取下!|n不需要的宝石可以在宠物处熔炼,用于宝石抽奖. | AF99: =VLOOKUP(RC[-31],Sheet2!R13C1:R19C2,2,0)&"."&VLOOKUP(RC[-30],Sheet2!R7C1:R12C2,2,0)&VLOOKUP(RC[-30],Sheet2!R1C1:R6C2,2,0)&RC[-29]&RC[-28]&RC[-27]&Sheet2!R1C3 -> 三.绝|cFFFF9933[宝石]道禅 - 制怒|r | AG99: =IF(RC[-26]&RC[-25]&RC[-24]&RC[-23]&RC[-22]&RC[-21]="",,R1C6)&IF(RC[-26]="",,"|n"&R1C7&RC[-26])&IF(RC[-25]="",,"|n"&R1C8&RC[-25])&IF(RC[-24]="",,"|n"&R1C9&RC[-24])&IF(RC[-23]="",,"|n"&R1C10&RC[-23])&IF(RC[-22]="",,"|n"&R1C11&RC[-22])&IF(RC[-21]="",,"|n"&R1C12&RC[-21])&IF(RC[-19]&RC[-18]&RC[-17]&RC[-16]="",,"|n|n"&R1C13)&IF(RC[-19]="",,"|n"&R1C14&RC[-19])&IF(RC[-18]="",,"|n"&R1C15&RC[-18])&IF(RC[-17]="",,"|n"&R1C16&RC[-17])&IF(RC[-16]="",,"|n"&R1C17&RC[-16])&IF(RC[-15]="",,"|n"&R1C18&RC[-15])&IF(RC[-14]="",,"|n"&R1C19&RC[-14])&IF(RC[-13]="",,"|n"&R1C20&RC[-13])&IF(RC[-12]="",,"|n"&R1C21&RC[-12])&IF(RC[-11]="",,"|n"&R1C22&RC[-11])&IF(RC[-10]="",,"|n"&R1C23&RC[-10])&IF(RC[-9]="",,"|n"&R1C24&RC[-9])&IF(RC[-8]="",,"|n"&R1C25&RC[-8])&IF(RC[-7]="",,"|n"&R1C26&RC[-7])&IF(RC[-6]="",,"|n"&R1C27&RC[-6])&IF(RC[-5]="",,"|n"&R1C28&RC[-5])&IF(RC[-2]="",,"|n|n"&RC[-2]) -> |cFFFFFF99基础属性|r|n攻击:22500|n|n|cFFFFFF55附加属性|r(%)|n暴击概率:7|n暴击伤害:28|n伤害增幅:5|n|n用于镶嵌到[剑,衣]上.|n镶嵌后不可取下!|n不需要的宝石可以在宠物处熔炼,用于宝石抽奖.
A100: 3 | B100: X | C100: [宝石] | D100: 上古遗物-无心 | G100: =IF(R[-66]C<>"",R[-66]C*9,"") ->  | H100: =IF(R[-66]C<>"",R[-66]C*9,"") ->  | I100: =IF(R[-66]C<>"",R[-66]C*9,"") ->  | J100: =IF(R[-66]C<>"",R[-66]C*9,"") ->  | K100: =IF(R[-66]C<>"",R[-66]C*9,"") -> 540000 | L100: =IF(R[-66]C<>"",INT(R[-66]C*2.5),"") -> 500 | N100: =IF(R[-66]C<>"",INT(R[-66]C*1.4),"") ->  | O100: =IF(R[-66]C<>"",INT(R[-66]C*1.4),"") ->  | P100: =IF(R[-66]C<>"",INT(R[-66]C*1.4),"") ->  | Q100: =IF(R[-66]C<>"",INT(R[-66]C*1.4),"") -> 28 | R100: =IF(R[-66]C<>"",INT(R[-66]C*1.4),"") -> 11 | S100: =IF(R[-66]C<>"",INT(R[-66]C*1.4),"") ->  | T100: =IF(R[-66]C<>"",INT(R[-66]C*1.4),"") ->  | V100: 10 | AE100: 用于镶嵌到[剑,衣]上.|n镶嵌后不可取下!|n不需要的宝石可以在宠物处熔炼,用于宝石抽奖. | AF100: =VLOOKUP(RC[-31],Sheet2!R13C1:R19C2,2,0)&"."&VLOOKUP(RC[-30],Sheet2!R7C1:R12C2,2,0)&VLOOKUP(RC[-30],Sheet2!R1C1:R6C2,2,0)&RC[-29]&RC[-28]&RC[-27]&Sheet2!R1C3 -> 三.神|Cffff0000[宝石]上古遗物-无心|r | AG100: =IF(RC[-26]&RC[-25]&RC[-24]&RC[-23]&RC[-22]&RC[-21]="",,R1C6)&IF(RC[-26]="",,"|n"&R1C7&RC[-26])&IF(RC[-25]="",,"|n"&R1C8&RC[-25])&IF(RC[-24]="",,"|n"&R1C9&RC[-24])&IF(RC[-23]="",,"|n"&R1C10&RC[-23])&IF(RC[-22]="",,"|n"&R1C11&RC[-22])&IF(RC[-21]="",,"|n"&R1C12&RC[-21])&IF(RC[-19]&RC[-18]&RC[-17]&RC[-16]="",,"|n|n"&R1C13)&IF(RC[-19]="",,"|n"&R1C14&RC[-19])&IF(RC[-18]="",,"|n"&R1C15&RC[-18])&IF(RC[-17]="",,"|n"&R1C16&RC[-17])&IF(RC[-16]="",,"|n"&R1C17&RC[-16])&IF(RC[-15]="",,"|n"&R1C18&RC[-15])&IF(RC[-14]="",,"|n"&R1C19&RC[-14])&IF(RC[-13]="",,"|n"&R1C20&RC[-13])&IF(RC[-12]="",,"|n"&R1C21&RC[-12])&IF(RC[-11]="",,"|n"&R1C22&RC[-11])&IF(RC[-10]="",,"|n"&R1C23&RC[-10])&IF(RC[-9]="",,"|n"&R1C24&RC[-9])&IF(RC[-8]="",,"|n"&R1C25&RC[-8])&IF(RC[-7]="",,"|n"&R1C26&RC[-7])&IF(RC[-6]="",,"|n"&R1C27&RC[-6])&IF(RC[-5]="",,"|n"&R1C28&RC[-5])&IF(RC[-2]="",,"|n|n"&RC[-2]) -> |cFFFFFF99基础属性|r|n血量:540000|n护甲:500|n|n|cFFFFFF55附加属性|r(%)|n暴击伤害:28|n伤害增幅:11|n伤害减免:10|n|n用于镶嵌到[剑,衣]上.|n镶嵌后不可取下!|n不需要的宝石可以在宠物处熔炼,用于宝石抽奖.
A101: 4 | B101: D | C101: [宝石] | D101: 星罗 | G101: =IF(R[-99]C<>"",R[-99]C*30,"") ->  | H101: =IF(R[-99]C<>"",R[-99]C*30,"") ->  | I101: =IF(R[-99]C<>"",R[-99]C*30,"") ->  | J101: =IF(R[-99]C<>"",R[-99]C*30,"") ->  | K101: =IF(R[-99]C<>"",R[-99]C*30,"") ->  | L101: =IF(R[-99]C<>"",INT(R[-99]C*4),"") ->  | M101: =IF(R[-99]C<>"",R[-99]C*16,"") ->  | N101: =IF(R[-99]C<>"",INT(R[-99]C*1.6),"") ->  | O101: =IF(R[-99]C<>"",INT(R[-99]C*1.6),"") ->  | AE101: 用于镶嵌到[剑,衣]上.|n镶嵌后不可取下!|n不需要的宝石可以在宠物处熔炼,用于宝石抽奖. | AF101: =VLOOKUP(RC[-31],Sheet2!R13C1:R19C2,2,0)&"."&VLOOKUP(RC[-30],Sheet2!R7C1:R12C2,2,0)&VLOOKUP(RC[-30],Sheet2!R1C1:R6C2,2,0)&RC[-29]&RC[-28]&RC[-27]&Sheet2!R1C3 -> 四.丁|cFF999999[宝石]星罗|r | AG101: =IF(RC[-26]&RC[-25]&RC[-24]&RC[-23]&RC[-22]&RC[-21]="",,R1C6)&IF(RC[-26]="",,"|n"&R1C7&RC[-26])&IF(RC[-25]="",,"|n"&R1C8&RC[-25])&IF(RC[-24]="",,"|n"&R1C9&RC[-24])&IF(RC[-23]="",,"|n"&R1C10&RC[-23])&IF(RC[-22]="",,"|n"&R1C11&RC[-22])&IF(RC[-21]="",,"|n"&R1C12&RC[-21])&IF(RC[-19]&RC[-18]&RC[-17]&RC[-16]="",,"|n|n"&R1C13)&IF(RC[-19]="",,"|n"&R1C14&RC[-19])&IF(RC[-18]="",,"|n"&R1C15&RC[-18])&IF(RC[-17]="",,"|n"&R1C16&RC[-17])&IF(RC[-16]="",,"|n"&R1C17&RC[-16])&IF(RC[-15]="",,"|n"&R1C18&RC[-15])&IF(RC[-14]="",,"|n"&R1C19&RC[-14])&IF(RC[-13]="",,"|n"&R1C20&RC[-13])&IF(RC[-12]="",,"|n"&R1C21&RC[-12])&IF(RC[-11]="",,"|n"&R1C22&RC[-11])&IF(RC[-10]="",,"|n"&R1C23&RC[-10])&IF(RC[-9]="",,"|n"&R1C24&RC[-9])&IF(RC[-8]="",,"|n"&R1C25&RC[-8])&IF(RC[-7]="",,"|n"&R1C26&RC[-7])&IF(RC[-6]="",,"|n"&R1C27&RC[-6])&IF(RC[-5]="",,"|n"&R1C28&RC[-5])&IF(RC[-2]="",,"|n|n"&RC[-2]) -> |n|n用于镶嵌到[剑,衣]上.|n镶嵌后不可取下!|n不需要的宝石可以在宠物处熔炼,用于宝石抽奖.
A102: 4 | B102: D | C102: [宝石] | D102: 临枫 | G102: =IF(R[-99]C<>"",R[-99]C*30,"") ->  | H102: =IF(R[-99]C<>"",R[-99]C*30,"") ->  | I102: =IF(R[-99]C<>"",R[-99]C*30,"") ->  | J102: =IF(R[-99]C<>"",R[-99]C*30,"") ->  | K102: =IF(R[-99]C<>"",R[-99]C*30,"") ->  | L102: =IF(R[-99]C<>"",INT(R[-99]C*4),"") ->  | M102: =IF(R[-99]C<>"",R[-99]C*16,"") ->  | N102: =IF(R[-99]C<>"",INT(R[-99]C*1.6),"") ->  | O102: =IF(R[-99]C<>"",INT(R[-99]C*1.6),"") ->  | AE102: 用于镶嵌到[剑,衣]上.|n镶嵌后不可取下!|n不需要的宝石可以在宠物处熔炼,用于宝石抽奖. | AF102: =VLOOKUP(RC[-31],Sheet2!R13C1:R19C2,2,0)&"."&VLOOKUP(RC[-30],Sheet2!R7C1:R12C2,2,0)&VLOOKUP(RC[-30],Sheet2!R1C1:R6C2,2,0)&RC[-29]&RC[-28]&RC[-27]&Sheet2!R1C3 -> 四.丁|cFF999999[宝石]临枫|r | AG102: =IF(RC[-26]&RC[-25]&RC[-24]&RC[-23]&RC[-22]&RC[-21]="",,R1C6)&IF(RC[-26]="",,"|n"&R1C7&RC[-26])&IF(RC[-25]="",,"|n"&R1C8&RC[-25])&IF(RC[-24]="",,"|n"&R1C9&RC[-24])&IF(RC[-23]="",,"|n"&R1C10&RC[-23])&IF(RC[-22]="",,"|n"&R1C11&RC[-22])&IF(RC[-21]="",,"|n"&R1C12&RC[-21])&IF(RC[-19]&RC[-18]&RC[-17]&RC[-16]="",,"|n|n"&R1C13)&IF(RC[-19]="",,"|n"&R1C14&RC[-19])&IF(RC[-18]="",,"|n"&R1C15&RC[-18])&IF(RC[-17]="",,"|n"&R1C16&RC[-17])&IF(RC[-16]="",,"|n"&R1C17&RC[-16])&IF(RC[-15]="",,"|n"&R1C18&RC[-15])&IF(RC[-14]="",,"|n"&R1C19&RC[-14])&IF(RC[-13]="",,"|n"&R1C20&RC[-13])&IF(RC[-12]="",,"|n"&R1C21&RC[-12])&IF(RC[-11]="",,"|n"&R1C22&RC[-11])&IF(RC[-10]="",,"|n"&R1C23&RC[-10])&IF(RC[-9]="",,"|n"&R1C24&RC[-9])&IF(RC[-8]="",,"|n"&R1C25&RC[-8])&IF(RC[-7]="",,"|n"&R1C26&RC[-7])&IF(RC[-6]="",,"|n"&R1C27&RC[-6])&IF(RC[-5]="",,"|n"&R1C28&RC[-5])&IF(RC[-2]="",,"|n|n"&RC[-2]) -> |n|n用于镶嵌到[剑,衣]上.|n镶嵌后不可取下!|n不需要的宝石可以在宠物处熔炼,用于宝石抽奖.
A103: 4 | B103: D | C103: [宝石] | D103: 兽鳞 | G103: =IF(R[-99]C<>"",R[-99]C*30,"") ->  | H103: =IF(R[-99]C<>"",R[-99]C*30,"") ->  | I103: =IF(R[-99]C<>"",R[-99]C*30,"") ->  | J103: =IF(R[-99]C<>"",R[-99]C*30,"") ->  | K103: =IF(R[-99]C<>"",R[-99]C*30,"") ->  | L103: =IF(R[-99]C<>"",INT(R[-99]C*4),"") ->  | M103: =IF(R[-99]C<>"",R[-99]C*16,"") ->  | N103: =IF(R[-99]C<>"",INT(R[-99]C*1.6),"") ->  | O103: =IF(R[-99]C<>"",INT(R[-99]C*1.6),"") ->  | AE103: 用于镶嵌到[剑,衣]上.|n镶嵌后不可取下!|n不需要的宝石可以在宠物处熔炼,用于宝石抽奖. | AF103: =VLOOKUP(RC[-31],Sheet2!R13C1:R19C2,2,0)&"."&VLOOKUP(RC[-30],Sheet2!R7C1:R12C2,2,0)&VLOOKUP(RC[-30],Sheet2!R1C1:R6C2,2,0)&RC[-29]&RC[-28]&RC[-27]&Sheet2!R1C3 -> 四.丁|cFF999999[宝石]兽鳞|r | AG103: =IF(RC[-26]&RC[-25]&RC[-24]&RC[-23]&RC[-22]&RC[-21]="",,R1C6)&IF(RC[-26]="",,"|n"&R1C7&RC[-26])&IF(RC[-25]="",,"|n"&R1C8&RC[-25])&IF(RC[-24]="",,"|n"&R1C9&RC[-24])&IF(RC[-23]="",,"|n"&R1C10&RC[-23])&IF(RC[-22]="",,"|n"&R1C11&RC[-22])&IF(RC[-21]="",,"|n"&R1C12&RC[-21])&IF(RC[-19]&RC[-18]&RC[-17]&RC[-16]="",,"|n|n"&R1C13)&IF(RC[-19]="",,"|n"&R1C14&RC[-19])&IF(RC[-18]="",,"|n"&R1C15&RC[-18])&IF(RC[-17]="",,"|n"&R1C16&RC[-17])&IF(RC[-16]="",,"|n"&R1C17&RC[-16])&IF(RC[-15]="",,"|n"&R1C18&RC[-15])&IF(RC[-14]="",,"|n"&R1C19&RC[-14])&IF(RC[-13]="",,"|n"&R1C20&RC[-13])&IF(RC[-12]="",,"|n"&R1C21&RC[-12])&IF(RC[-11]="",,"|n"&R1C22&RC[-11])&IF(RC[-10]="",,"|n"&R1C23&RC[-10])&IF(RC[-9]="",,"|n"&R1C24&RC[-9])&IF(RC[-8]="",,"|n"&R1C25&RC[-8])&IF(RC[-7]="",,"|n"&R1C26&RC[-7])&IF(RC[-6]="",,"|n"&R1C27&RC[-6])&IF(RC[-5]="",,"|n"&R1C28&RC[-5])&IF(RC[-2]="",,"|n|n"&RC[-2]) -> |n|n用于镶嵌到[剑,衣]上.|n镶嵌后不可取下!|n不需要的宝石可以在宠物处熔炼,用于宝石抽奖.
A104: 4 | B104: D | C104: [宝石] | D104: 帝恨 | G104: =IF(R[-99]C<>"",R[-99]C*30,"") ->  | H104: =IF(R[-99]C<>"",R[-99]C*30,"") ->  | I104: =IF(R[-99]C<>"",R[-99]C*30,"") ->  | J104: =IF(R[-99]C<>"",R[-99]C*30,"") ->  | K104: =IF(R[-99]C<>"",R[-99]C*30,"") ->  | L104: =IF(R[-99]C<>"",INT(R[-99]C*4),"") ->  | M104: =IF(R[-99]C<>"",R[-99]C*16,"") ->  | N104: =IF(R[-99]C<>"",INT(R[-99]C*1.6),"") ->  | O104: =IF(R[-99]C<>"",INT(R[-99]C*1.6),"") ->  | AE104: 用于镶嵌到[剑,衣]上.|n镶嵌后不可取下!|n不需要的宝石可以在宠物处熔炼,用于宝石抽奖. | AF104: =VLOOKUP(RC[-31],Sheet2!R13C1:R19C2,2,0)&"."&VLOOKUP(RC[-30],Sheet2!R7C1:R12C2,2,0)&VLOOKUP(RC[-30],Sheet2!R1C1:R6C2,2,0)&RC[-29]&RC[-28]&RC[-27]&Sheet2!R1C3 -> 四.丁|cFF999999[宝石]帝恨|r | AG104: =IF(RC[-26]&RC[-25]&RC[-24]&RC[-23]&RC[-22]&RC[-21]="",,R1C6)&IF(RC[-26]="",,"|n"&R1C7&RC[-26])&IF(RC[-25]="",,"|n"&R1C8&RC[-25])&IF(RC[-24]="",,"|n"&R1C9&RC[-24])&IF(RC[-23]="",,"|n"&R1C10&RC[-23])&IF(RC[-22]="",,"|n"&R1C11&RC[-22])&IF(RC[-21]="",,"|n"&R1C12&RC[-21])&IF(RC[-19]&RC[-18]&RC[-17]&RC[-16]="",,"|n|n"&R1C13)&IF(RC[-19]="",,"|n"&R1C14&RC[-19])&IF(RC[-18]="",,"|n"&R1C15&RC[-18])&IF(RC[-17]="",,"|n"&R1C16&RC[-17])&IF(RC[-16]="",,"|n"&R1C17&RC[-16])&IF(RC[-15]="",,"|n"&R1C18&RC[-15])&IF(RC[-14]="",,"|n"&R1C19&RC[-14])&IF(RC[-13]="",,"|n"&R1C20&RC[-13])&IF(RC[-12]="",,"|n"&R1C21&RC[-12])&IF(RC[-11]="",,"|n"&R1C22&RC[-11])&IF(RC[-10]="",,"|n"&R1C23&RC[-10])&IF(RC[-9]="",,"|n"&R1C24&RC[-9])&IF(RC[-8]="",,"|n"&R1C25&RC[-8])&IF(RC[-7]="",,"|n"&R1C26&RC[-7])&IF(RC[-6]="",,"|n"&R1C27&RC[-6])&IF(RC[-5]="",,"|n"&R1C28&RC[-5])&IF(RC[-2]="",,"|n|n"&RC[-2]) -> |n|n用于镶嵌到[剑,衣]上.|n镶嵌后不可取下!|n不需要的宝石可以在宠物处熔炼,用于宝石抽奖.
A105: 4 | B105: D | C105: [宝石] | D105: 紫雷 | G105: =IF(R[-99]C<>"",R[-99]C*30,"") ->  | H105: =IF(R[-99]C<>"",R[-99]C*30,"") ->  | I105: =IF(R[-99]C<>"",R[-99]C*30,"") ->  | J105: =IF(R[-99]C<>"",R[-99]C*30,"") ->  | K105: =IF(R[-99]C<>"",R[-99]C*30,"") ->  | L105: =IF(R[-99]C<>"",INT(R[-99]C*4),"") ->  | M105: =IF(R[-99]C<>"",R[-99]C*16,"") ->  | N105: =IF(R[-99]C<>"",INT(R[-99]C*1.6),"") ->  | O105: =IF(R[-99]C<>"",INT(R[-99]C*1.6),"") ->  | AE105: 用于镶嵌到[剑,衣]上.|n镶嵌后不可取下!|n不需要的宝石可以在宠物处熔炼,用于宝石抽奖. | AF105: =VLOOKUP(RC[-31],Sheet2!R13C1:R19C2,2,0)&"."&VLOOKUP(RC[-30],Sheet2!R7C1:R12C2,2,0)&VLOOKUP(RC[-30],Sheet2!R1C1:R6C2,2,0)&RC[-29]&RC[-28]&RC[-27]&Sheet2!R1C3 -> 四.丁|cFF999999[宝石]紫雷|r | AG105: =IF(RC[-26]&RC[-25]&RC[-24]&RC[-23]&RC[-22]&RC[-21]="",,R1C6)&IF(RC[-26]="",,"|n"&R1C7&RC[-26])&IF(RC[-25]="",,"|n"&R1C8&RC[-25])&IF(RC[-24]="",,"|n"&R1C9&RC[-24])&IF(RC[-23]="",,"|n"&R1C10&RC[-23])&IF(RC[-22]="",,"|n"&R1C11&RC[-22])&IF(RC[-21]="",,"|n"&R1C12&RC[-21])&IF(RC[-19]&RC[-18]&RC[-17]&RC[-16]="",,"|n|n"&R1C13)&IF(RC[-19]="",,"|n"&R1C14&RC[-19])&IF(RC[-18]="",,"|n"&R1C15&RC[-18])&IF(RC[-17]="",,"|n"&R1C16&RC[-17])&IF(RC[-16]="",,"|n"&R1C17&RC[-16])&IF(RC[-15]="",,"|n"&R1C18&RC[-15])&IF(RC[-14]="",,"|n"&R1C19&RC[-14])&IF(RC[-13]="",,"|n"&R1C20&RC[-13])&IF(RC[-12]="",,"|n"&R1C21&RC[-12])&IF(RC[-11]="",,"|n"&R1C22&RC[-11])&IF(RC[-10]="",,"|n"&R1C23&RC[-10])&IF(RC[-9]="",,"|n"&R1C24&RC[-9])&IF(RC[-8]="",,"|n"&R1C25&RC[-8])&IF(RC[-7]="",,"|n"&R1C26&RC[-7])&IF(RC[-6]="",,"|n"&R1C27&RC[-6])&IF(RC[-5]="",,"|n"&R1C28&RC[-5])&IF(RC[-2]="",,"|n|n"&RC[-2]) -> |n|n用于镶嵌到[剑,衣]上.|n镶嵌后不可取下!|n不需要的宝石可以在宠物处熔炼,用于宝石抽奖.
A106: 4 | B106: D | C106: [宝石] | D106: 灵角 | G106: =IF(R[-99]C<>"",R[-99]C*30,"") ->  | H106: =IF(R[-99]C<>"",R[-99]C*30,"") ->  | I106: =IF(R[-99]C<>"",R[-99]C*30,"") ->  | J106: =IF(R[-99]C<>"",R[-99]C*30,"") ->  | K106: =IF(R[-99]C<>"",R[-99]C*30,"") ->  | L106: =IF(R[-99]C<>"",INT(R[-99]C*4),"") ->  | M106: =IF(R[-99]C<>"",R[-99]C*16,"") ->  | N106: =IF(R[-99]C<>"",INT(R[-99]C*1.6),"") ->  | O106: =IF(R[-99]C<>"",INT(R[-99]C*1.6),"") ->  | AE106: 用于镶嵌到[剑,衣]上.|n镶嵌后不可取下!|n不需要的宝石可以在宠物处熔炼,用于宝石抽奖. | AF106: =VLOOKUP(RC[-31],Sheet2!R13C1:R19C2,2,0)&"."&VLOOKUP(RC[-30],Sheet2!R7C1:R12C2,2,0)&VLOOKUP(RC[-30],Sheet2!R1C1:R6C2,2,0)&RC[-29]&RC[-28]&RC[-27]&Sheet2!R1C3 -> 四.丁|cFF999999[宝石]灵角|r | AG106: =IF(RC[-26]&RC[-25]&RC[-24]&RC[-23]&RC[-22]&RC[-21]="",,R1C6)&IF(RC[-26]="",,"|n"&R1C7&RC[-26])&IF(RC[-25]="",,"|n"&R1C8&RC[-25])&IF(RC[-24]="",,"|n"&R1C9&RC[-24])&IF(RC[-23]="",,"|n"&R1C10&RC[-23])&IF(RC[-22]="",,"|n"&R1C11&RC[-22])&IF(RC[-21]="",,"|n"&R1C12&RC[-21])&IF(RC[-19]&RC[-18]&RC[-17]&RC[-16]="",,"|n|n"&R1C13)&IF(RC[-19]="",,"|n"&R1C14&RC[-19])&IF(RC[-18]="",,"|n"&R1C15&RC[-18])&IF(RC[-17]="",,"|n"&R1C16&RC[-17])&IF(RC[-16]="",,"|n"&R1C17&RC[-16])&IF(RC[-15]="",,"|n"&R1C18&RC[-15])&IF(RC[-14]="",,"|n"&R1C19&RC[-14])&IF(RC[-13]="",,"|n"&R1C20&RC[-13])&IF(RC[-12]="",,"|n"&R1C21&RC[-12])&IF(RC[-11]="",,"|n"&R1C22&RC[-11])&IF(RC[-10]="",,"|n"&R1C23&RC[-10])&IF(RC[-9]="",,"|n"&R1C24&RC[-9])&IF(RC[-8]="",,"|n"&R1C25&RC[-8])&IF(RC[-7]="",,"|n"&R1C26&RC[-7])&IF(RC[-6]="",,"|n"&R1C27&RC[-6])&IF(RC[-5]="",,"|n"&R1C28&RC[-5])&IF(RC[-2]="",,"|n|n"&RC[-2]) -> |n|n用于镶嵌到[剑,衣]上.|n镶嵌后不可取下!|n不需要的宝石可以在宠物处熔炼,用于宝石抽奖.
A107: 4 | B107: D | C107: [宝石] | D107: 紫清 | G107: =IF(R[-99]C<>"",R[-99]C*30,"") ->  | H107: =IF(R[-99]C<>"",R[-99]C*30,"") ->  | I107: =IF(R[-99]C<>"",R[-99]C*30,"") ->  | J107: =IF(R[-99]C<>"",R[-99]C*30,"") ->  | K107: =IF(R[-99]C<>"",R[-99]C*30,"") ->  | L107: =IF(R[-99]C<>"",INT(R[-99]C*4),"") ->  | M107: =IF(R[-99]C<>"",R[-99]C*16,"") ->  | N107: =IF(R[-99]C<>"",INT(R[-99]C*1.6),"") ->  | O107: =IF(R[-99]C<>"",INT(R[-99]C*1.6),"") ->  | AE107: 用于镶嵌到[剑,衣]上.|n镶嵌后不可取下!|n不需要的宝石可以在宠物处熔炼,用于宝石抽奖. | AF107: =VLOOKUP(RC[-31],Sheet2!R13C1:R19C2,2,0)&"."&VLOOKUP(RC[-30],Sheet2!R7C1:R12C2,2,0)&VLOOKUP(RC[-30],Sheet2!R1C1:R6C2,2,0)&RC[-29]&RC[-28]&RC[-27]&Sheet2!R1C3 -> 四.丁|cFF999999[宝石]紫清|r | AG107: =IF(RC[-26]&RC[-25]&RC[-24]&RC[-23]&RC[-22]&RC[-21]="",,R1C6)&IF(RC[-26]="",,"|n"&R1C7&RC[-26])&IF(RC[-25]="",,"|n"&R1C8&RC[-25])&IF(RC[-24]="",,"|n"&R1C9&RC[-24])&IF(RC[-23]="",,"|n"&R1C10&RC[-23])&IF(RC[-22]="",,"|n"&R1C11&RC[-22])&IF(RC[-21]="",,"|n"&R1C12&RC[-21])&IF(RC[-19]&RC[-18]&RC[-17]&RC[-16]="",,"|n|n"&R1C13)&IF(RC[-19]="",,"|n"&R1C14&RC[-19])&IF(RC[-18]="",,"|n"&R1C15&RC[-18])&IF(RC[-17]="",,"|n"&R1C16&RC[-17])&IF(RC[-16]="",,"|n"&R1C17&RC[-16])&IF(RC[-15]="",,"|n"&R1C18&RC[-15])&IF(RC[-14]="",,"|n"&R1C19&RC[-14])&IF(RC[-13]="",,"|n"&R1C20&RC[-13])&IF(RC[-12]="",,"|n"&R1C21&RC[-12])&IF(RC[-11]="",,"|n"&R1C22&RC[-11])&IF(RC[-10]="",,"|n"&R1C23&RC[-10])&IF(RC[-9]="",,"|n"&R1C24&RC[-9])&IF(RC[-8]="",,"|n"&R1C25&RC[-8])&IF(RC[-7]="",,"|n"&R1C26&RC[-7])&IF(RC[-6]="",,"|n"&R1C27&RC[-6])&IF(RC[-5]="",,"|n"&R1C28&RC[-5])&IF(RC[-2]="",,"|n|n"&RC[-2]) -> |n|n用于镶嵌到[剑,衣]上.|n镶嵌后不可取下!|n不需要的宝石可以在宠物处熔炼,用于宝石抽奖.
A108: 4 | B108: D | C108: [宝石] | D108: 怀云 | G108: =IF(R[-99]C<>"",R[-99]C*30,"") ->  | H108: =IF(R[-99]C<>"",R[-99]C*30,"") ->  | I108: =IF(R[-99]C<>"",R[-99]C*30,"") ->  | J108: =IF(R[-99]C<>"",R[-99]C*30,"") ->  | K108: =IF(R[-99]C<>"",R[-99]C*30,"") ->  | L108: =IF(R[-99]C<>"",INT(R[-99]C*4),"") ->  | M108: =IF(R[-99]C<>"",R[-99]C*16,"") ->  | N108: =IF(R[-99]C<>"",INT(R[-99]C*1.6),"") ->  | O108: =IF(R[-99]C<>"",INT(R[-99]C*1.6),"") ->  | AE108: 用于镶嵌到[剑,衣]上.|n镶嵌后不可取下!|n不需要的宝石可以在宠物处熔炼,用于宝石抽奖. | AF108: =VLOOKUP(RC[-31],Sheet2!R13C1:R19C2,2,0)&"."&VLOOKUP(RC[-30],Sheet2!R7C1:R12C2,2,0)&VLOOKUP(RC[-30],Sheet2!R1C1:R6C2,2,0)&RC[-29]&RC[-28]&RC[-27]&Sheet2!R1C3 -> 四.丁|cFF999999[宝石]怀云|r | AG108: =IF(RC[-26]&RC[-25]&RC[-24]&RC[-23]&RC[-22]&RC[-21]="",,R1C6)&IF(RC[-26]="",,"|n"&R1C7&RC[-26])&IF(RC[-25]="",,"|n"&R1C8&RC[-25])&IF(RC[-24]="",,"|n"&R1C9&RC[-24])&IF(RC[-23]="",,"|n"&R1C10&RC[-23])&IF(RC[-22]="",,"|n"&R1C11&RC[-22])&IF(RC[-21]="",,"|n"&R1C12&RC[-21])&IF(RC[-19]&RC[-18]&RC[-17]&RC[-16]="",,"|n|n"&R1C13)&IF(RC[-19]="",,"|n"&R1C14&RC[-19])&IF(RC[-18]="",,"|n"&R1C15&RC[-18])&IF(RC[-17]="",,"|n"&R1C16&RC[-17])&IF(RC[-16]="",,"|n"&R1C17&RC[-16])&IF(RC[-15]="",,"|n"&R1C18&RC[-15])&IF(RC[-14]="",,"|n"&R1C19&RC[-14])&IF(RC[-13]="",,"|n"&R1C20&RC[-13])&IF(RC[-12]="",,"|n"&R1C21&RC[-12])&IF(RC[-11]="",,"|n"&R1C22&RC[-11])&IF(RC[-10]="",,"|n"&R1C23&RC[-10])&IF(RC[-9]="",,"|n"&R1C24&RC[-9])&IF(RC[-8]="",,"|n"&R1C25&RC[-8])&IF(RC[-7]="",,"|n"&R1C26&RC[-7])&IF(RC[-6]="",,"|n"&R1C27&RC[-6])&IF(RC[-5]="",,"|n"&R1C28&RC[-5])&IF(RC[-2]="",,"|n|n"&RC[-2]) -> |n|n用于镶嵌到[剑,衣]上.|n镶嵌后不可取下!|n不需要的宝石可以在宠物处熔炼,用于宝石抽奖.
A109: 4 | B109: D | C109: [宝石] | D109: 武斗 | G109: =IF(R[-99]C<>"",R[-99]C*30,"") ->  | H109: =IF(R[-99]C<>"",R[-99]C*30,"") ->  | I109: =IF(R[-99]C<>"",R[-99]C*30,"") ->  | J109: =IF(R[-99]C<>"",R[-99]C*30,"") ->  | K109: =IF(R[-99]C<>"",R[-99]C*30,"") ->  | L109: =IF(R[-99]C<>"",INT(R[-99]C*4),"") ->  | M109: =IF(R[-99]C<>"",R[-99]C*16,"") ->  | N109: =IF(R[-99]C<>"",INT(R[-99]C*1.6),"") ->  | O109: =IF(R[-99]C<>"",INT(R[-99]C*1.6),"") ->  | AE109: 用于镶嵌到[剑,衣]上.|n镶嵌后不可取下!|n不需要的宝石可以在宠物处熔炼,用于宝石抽奖. | AF109: =VLOOKUP(RC[-31],Sheet2!R13C1:R19C2,2,0)&"."&VLOOKUP(RC[-30],Sheet2!R7C1:R12C2,2,0)&VLOOKUP(RC[-30],Sheet2!R1C1:R6C2,2,0)&RC[-29]&RC[-28]&RC[-27]&Sheet2!R1C3 -> 四.丁|cFF999999[宝石]武斗|r | AG109: =IF(RC[-26]&RC[-25]&RC[-24]&RC[-23]&RC[-22]&RC[-21]="",,R1C6)&IF(RC[-26]="",,"|n"&R1C7&RC[-26])&IF(RC[-25]="",,"|n"&R1C8&RC[-25])&IF(RC[-24]="",,"|n"&R1C9&RC[-24])&IF(RC[-23]="",,"|n"&R1C10&RC[-23])&IF(RC[-22]="",,"|n"&R1C11&RC[-22])&IF(RC[-21]="",,"|n"&R1C12&RC[-21])&IF(RC[-19]&RC[-18]&RC[-17]&RC[-16]="",,"|n|n"&R1C13)&IF(RC[-19]="",,"|n"&R1C14&RC[-19])&IF(RC[-18]="",,"|n"&R1C15&RC[-18])&IF(RC[-17]="",,"|n"&R1C16&RC[-17])&IF(RC[-16]="",,"|n"&R1C17&RC[-16])&IF(RC[-15]="",,"|n"&R1C18&RC[-15])&IF(RC[-14]="",,"|n"&R1C19&RC[-14])&IF(RC[-13]="",,"|n"&R1C20&RC[-13])&IF(RC[-12]="",,"|n"&R1C21&RC[-12])&IF(RC[-11]="",,"|n"&R1C22&RC[-11])&IF(RC[-10]="",,"|n"&R1C23&RC[-10])&IF(RC[-9]="",,"|n"&R1C24&RC[-9])&IF(RC[-8]="",,"|n"&R1C25&RC[-8])&IF(RC[-7]="",,"|n"&R1C26&RC[-7])&IF(RC[-6]="",,"|n"&R1C27&RC[-6])&IF(RC[-5]="",,"|n"&R1C28&RC[-5])&IF(RC[-2]="",,"|n|n"&RC[-2]) -> |n|n用于镶嵌到[剑,衣]上.|n镶嵌后不可取下!|n不需要的宝石可以在宠物处熔炼,用于宝石抽奖.
A110: 4 | B110: D | C110: [宝石] | D110: 龙凰 | G110: =IF(R[-99]C<>"",R[-99]C*30,"") ->  | H110: =IF(R[-99]C<>"",R[-99]C*30,"") ->  | I110: =IF(R[-99]C<>"",R[-99]C*30,"") ->  | J110: =IF(R[-99]C<>"",R[-99]C*30,"") ->  | K110: =IF(R[-99]C<>"",R[-99]C*30,"") ->  | L110: =IF(R[-99]C<>"",INT(R[-99]C*4),"") ->  | M110: =IF(R[-99]C<>"",R[-99]C*16,"") ->  | N110: =IF(R[-99]C<>"",INT(R[-99]C*1.6),"") ->  | O110: =IF(R[-99]C<>"",INT(R[-99]C*1.6),"") ->  | AE110: 用于镶嵌到[剑,衣]上.|n镶嵌后不可取下!|n不需要的宝石可以在宠物处熔炼,用于宝石抽奖. | AF110: =VLOOKUP(RC[-31],Sheet2!R13C1:R19C2,2,0)&"."&VLOOKUP(RC[-30],Sheet2!R7C1:R12C2,2,0)&VLOOKUP(RC[-30],Sheet2!R1C1:R6C2,2,0)&RC[-29]&RC[-28]&RC[-27]&Sheet2!R1C3 -> 四.丁|cFF999999[宝石]龙凰|r | AG110: =IF(RC[-26]&RC[-25]&RC[-24]&RC[-23]&RC[-22]&RC[-21]="",,R1C6)&IF(RC[-26]="",,"|n"&R1C7&RC[-26])&IF(RC[-25]="",,"|n"&R1C8&RC[-25])&IF(RC[-24]="",,"|n"&R1C9&RC[-24])&IF(RC[-23]="",,"|n"&R1C10&RC[-23])&IF(RC[-22]="",,"|n"&R1C11&RC[-22])&IF(RC[-21]="",,"|n"&R1C12&RC[-21])&IF(RC[-19]&RC[-18]&RC[-17]&RC[-16]="",,"|n|n"&R1C13)&IF(RC[-19]="",,"|n"&R1C14&RC[-19])&IF(RC[-18]="",,"|n"&R1C15&RC[-18])&IF(RC[-17]="",,"|n"&R1C16&RC[-17])&IF(RC[-16]="",,"|n"&R1C17&RC[-16])&IF(RC[-15]="",,"|n"&R1C18&RC[-15])&IF(RC[-14]="",,"|n"&R1C19&RC[-14])&IF(RC[-13]="",,"|n"&R1C20&RC[-13])&IF(RC[-12]="",,"|n"&R1C21&RC[-12])&IF(RC[-11]="",,"|n"&R1C22&RC[-11])&IF(RC[-10]="",,"|n"&R1C23&RC[-10])&IF(RC[-9]="",,"|n"&R1C24&RC[-9])&IF(RC[-8]="",,"|n"&R1C25&RC[-8])&IF(RC[-7]="",,"|n"&R1C26&RC[-7])&IF(RC[-6]="",,"|n"&R1C27&RC[-6])&IF(RC[-5]="",,"|n"&R1C28&RC[-5])&IF(RC[-2]="",,"|n|n"&RC[-2]) -> |n|n用于镶嵌到[剑,衣]上.|n镶嵌后不可取下!|n不需要的宝石可以在宠物处熔炼,用于宝石抽奖.
A111: 4 | B111: D | C111: [宝石] | D111: 天厉 | G111: =IF(R[-99]C<>"",R[-99]C*30,"") ->  | H111: =IF(R[-99]C<>"",R[-99]C*30,"") ->  | I111: =IF(R[-99]C<>"",R[-99]C*30,"") ->  | J111: =IF(R[-99]C<>"",R[-99]C*30,"") ->  | K111: =IF(R[-99]C<>"",R[-99]C*30,"") ->  | L111: =IF(R[-99]C<>"",INT(R[-99]C*4),"") ->  | M111: =IF(R[-99]C<>"",R[-99]C*16,"") ->  | N111: =IF(R[-99]C<>"",INT(R[-99]C*1.6),"") ->  | O111: =IF(R[-99]C<>"",INT(R[-99]C*1.6),"") ->  | AE111: 用于镶嵌到[剑,衣]上.|n镶嵌后不可取下!|n不需要的宝石可以在宠物处熔炼,用于宝石抽奖. | AF111: =VLOOKUP(RC[-31],Sheet2!R13C1:R19C2,2,0)&"."&VLOOKUP(RC[-30],Sheet2!R7C1:R12C2,2,0)&VLOOKUP(RC[-30],Sheet2!R1C1:R6C2,2,0)&RC[-29]&RC[-28]&RC[-27]&Sheet2!R1C3 -> 四.丁|cFF999999[宝石]天厉|r | AG111: =IF(RC[-26]&RC[-25]&RC[-24]&RC[-23]&RC[-22]&RC[-21]="",,R1C6)&IF(RC[-26]="",,"|n"&R1C7&RC[-26])&IF(RC[-25]="",,"|n"&R1C8&RC[-25])&IF(RC[-24]="",,"|n"&R1C9&RC[-24])&IF(RC[-23]="",,"|n"&R1C10&RC[-23])&IF(RC[-22]="",,"|n"&R1C11&RC[-22])&IF(RC[-21]="",,"|n"&R1C12&RC[-21])&IF(RC[-19]&RC[-18]&RC[-17]&RC[-16]="",,"|n|n"&R1C13)&IF(RC[-19]="",,"|n"&R1C14&RC[-19])&IF(RC[-18]="",,"|n"&R1C15&RC[-18])&IF(RC[-17]="",,"|n"&R1C16&RC[-17])&IF(RC[-16]="",,"|n"&R1C17&RC[-16])&IF(RC[-15]="",,"|n"&R1C18&RC[-15])&IF(RC[-14]="",,"|n"&R1C19&RC[-14])&IF(RC[-13]="",,"|n"&R1C20&RC[-13])&IF(RC[-12]="",,"|n"&R1C21&RC[-12])&IF(RC[-11]="",,"|n"&R1C22&RC[-11])&IF(RC[-10]="",,"|n"&R1C23&RC[-10])&IF(RC[-9]="",,"|n"&R1C24&RC[-9])&IF(RC[-8]="",,"|n"&R1C25&RC[-8])&IF(RC[-7]="",,"|n"&R1C26&RC[-7])&IF(RC[-6]="",,"|n"&R1C27&RC[-6])&IF(RC[-5]="",,"|n"&R1C28&RC[-5])&IF(RC[-2]="",,"|n|n"&RC[-2]) -> |n|n用于镶嵌到[剑,衣]上.|n镶嵌后不可取下!|n不需要的宝石可以在宠物处熔炼,用于宝石抽奖.
A112: 4 | B112: D | C112: [宝石] | D112: 天恋 | G112: =IF(R[-99]C<>"",R[-99]C*30,"") ->  | H112: =IF(R[-99]C<>"",R[-99]C*30,"") ->  | I112: =IF(R[-99]C<>"",R[-99]C*30,"") ->  | J112: =IF(R[-99]C<>"",R[-99]C*30,"") ->  | K112: =IF(R[-99]C<>"",R[-99]C*30,"") ->  | L112: =IF(R[-99]C<>"",INT(R[-99]C*4),"") ->  | M112: =IF(R[-99]C<>"",R[-99]C*16,"") ->  | N112: =IF(R[-99]C<>"",INT(R[-99]C*1.6),"") ->  | O112: =IF(R[-99]C<>"",INT(R[-99]C*1.6),"") ->  | AE112: 用于镶嵌到[剑,衣]上.|n镶嵌后不可取下!|n不需要的宝石可以在宠物处熔炼,用于宝石抽奖. | AF112: =VLOOKUP(RC[-31],Sheet2!R13C1:R19C2,2,0)&"."&VLOOKUP(RC[-30],Sheet2!R7C1:R12C2,2,0)&VLOOKUP(RC[-30],Sheet2!R1C1:R6C2,2,0)&RC[-29]&RC[-28]&RC[-27]&Sheet2!R1C3 -> 四.丁|cFF999999[宝石]天恋|r | AG112: =IF(RC[-26]&RC[-25]&RC[-24]&RC[-23]&RC[-22]&RC[-21]="",,R1C6)&IF(RC[-26]="",,"|n"&R1C7&RC[-26])&IF(RC[-25]="",,"|n"&R1C8&RC[-25])&IF(RC[-24]="",,"|n"&R1C9&RC[-24])&IF(RC[-23]="",,"|n"&R1C10&RC[-23])&IF(RC[-22]="",,"|n"&R1C11&RC[-22])&IF(RC[-21]="",,"|n"&R1C12&RC[-21])&IF(RC[-19]&RC[-18]&RC[-17]&RC[-16]="",,"|n|n"&R1C13)&IF(RC[-19]="",,"|n"&R1C14&RC[-19])&IF(RC[-18]="",,"|n"&R1C15&RC[-18])&IF(RC[-17]="",,"|n"&R1C16&RC[-17])&IF(RC[-16]="",,"|n"&R1C17&RC[-16])&IF(RC[-15]="",,"|n"&R1C18&RC[-15])&IF(RC[-14]="",,"|n"&R1C19&RC[-14])&IF(RC[-13]="",,"|n"&R1C20&RC[-13])&IF(RC[-12]="",,"|n"&R1C21&RC[-12])&IF(RC[-11]="",,"|n"&R1C22&RC[-11])&IF(RC[-10]="",,"|n"&R1C23&RC[-10])&IF(RC[-9]="",,"|n"&R1C24&RC[-9])&IF(RC[-8]="",,"|n"&R1C25&RC[-8])&IF(RC[-7]="",,"|n"&R1C26&RC[-7])&IF(RC[-6]="",,"|n"&R1C27&RC[-6])&IF(RC[-5]="",,"|n"&R1C28&RC[-5])&IF(RC[-2]="",,"|n|n"&RC[-2]) -> |n|n用于镶嵌到[剑,衣]上.|n镶嵌后不可取下!|n不需要的宝石可以在宠物处熔炼,用于宝石抽奖.
A113: 4 | B113: D | C113: [宝石] | D113: 逍遥 | G113: =IF(R[-99]C<>"",R[-99]C*30,"") ->  | H113: =IF(R[-99]C<>"",R[-99]C*30,"") ->  | I113: =IF(R[-99]C<>"",R[-99]C*30,"") ->  | J113: =IF(R[-99]C<>"",R[-99]C*30,"") ->  | K113: =IF(R[-99]C<>"",R[-99]C*30,"") ->  | L113: =IF(R[-99]C<>"",INT(R[-99]C*4),"") ->  | M113: =IF(R[-99]C<>"",R[-99]C*16,"") ->  | N113: =IF(R[-99]C<>"",INT(R[-99]C*1.6),"") ->  | O113: =IF(R[-99]C<>"",INT(R[-99]C*1.6),"") ->  | AE113: 用于镶嵌到[剑,衣]上.|n镶嵌后不可取下!|n不需要的宝石可以在宠物处熔炼,用于宝石抽奖. | AF113: =VLOOKUP(RC[-31],Sheet2!R13C1:R19C2,2,0)&"."&VLOOKUP(RC[-30],Sheet2!R7C1:R12C2,2,0)&VLOOKUP(RC[-30],Sheet2!R1C1:R6C2,2,0)&RC[-29]&RC[-28]&RC[-27]&Sheet2!R1C3 -> 四.丁|cFF999999[宝石]逍遥|r | AG113: =IF(RC[-26]&RC[-25]&RC[-24]&RC[-23]&RC[-22]&RC[-21]="",,R1C6)&IF(RC[-26]="",,"|n"&R1C7&RC[-26])&IF(RC[-25]="",,"|n"&R1C8&RC[-25])&IF(RC[-24]="",,"|n"&R1C9&RC[-24])&IF(RC[-23]="",,"|n"&R1C10&RC[-23])&IF(RC[-22]="",,"|n"&R1C11&RC[-22])&IF(RC[-21]="",,"|n"&R1C12&RC[-21])&IF(RC[-19]&RC[-18]&RC[-17]&RC[-16]="",,"|n|n"&R1C13)&IF(RC[-19]="",,"|n"&R1C14&RC[-19])&IF(RC[-18]="",,"|n"&R1C15&RC[-18])&IF(RC[-17]="",,"|n"&R1C16&RC[-17])&IF(RC[-16]="",,"|n"&R1C17&RC[-16])&IF(RC[-15]="",,"|n"&R1C18&RC[-15])&IF(RC[-14]="",,"|n"&R1C19&RC[-14])&IF(RC[-13]="",,"|n"&R1C20&RC[-13])&IF(RC[-12]="",,"|n"&R1C21&RC[-12])&IF(RC[-11]="",,"|n"&R1C22&RC[-11])&IF(RC[-10]="",,"|n"&R1C23&RC[-10])&IF(RC[-9]="",,"|n"&R1C24&RC[-9])&IF(RC[-8]="",,"|n"&R1C25&RC[-8])&IF(RC[-7]="",,"|n"&R1C26&RC[-7])&IF(RC[-6]="",,"|n"&R1C27&RC[-6])&IF(RC[-5]="",,"|n"&R1C28&RC[-5])&IF(RC[-2]="",,"|n|n"&RC[-2]) -> |n|n用于镶嵌到[剑,衣]上.|n镶嵌后不可取下!|n不需要的宝石可以在宠物处熔炼,用于宝石抽奖.
A114: 4 | B114: D | C114: [宝石] | D114: 惊天 | G114: =IF(R[-99]C<>"",R[-99]C*30,"") ->  | H114: =IF(R[-99]C<>"",R[-99]C*30,"") ->  | I114: =IF(R[-99]C<>"",R[-99]C*30,"") ->  | J114: =IF(R[-99]C<>"",R[-99]C*30,"") ->  | K114: =IF(R[-99]C<>"",R[-99]C*30,"") ->  | L114: =IF(R[-99]C<>"",INT(R[-99]C*4),"") ->  | M114: =IF(R[-99]C<>"",R[-99]C*16,"") ->  | N114: =IF(R[-99]C<>"",INT(R[-99]C*1.6),"") ->  | O114: =IF(R[-99]C<>"",INT(R[-99]C*1.6),"") ->  | AE114: 用于镶嵌到[剑,衣]上.|n镶嵌后不可取下!|n不需要的宝石可以在宠物处熔炼,用于宝石抽奖. | AF114: =VLOOKUP(RC[-31],Sheet2!R13C1:R19C2,2,0)&"."&VLOOKUP(RC[-30],Sheet2!R7C1:R12C2,2,0)&VLOOKUP(RC[-30],Sheet2!R1C1:R6C2,2,0)&RC[-29]&RC[-28]&RC[-27]&Sheet2!R1C3 -> 四.丁|cFF999999[宝石]惊天|r | AG114: =IF(RC[-26]&RC[-25]&RC[-24]&RC[-23]&RC[-22]&RC[-21]="",,R1C6)&IF(RC[-26]="",,"|n"&R1C7&RC[-26])&IF(RC[-25]="",,"|n"&R1C8&RC[-25])&IF(RC[-24]="",,"|n"&R1C9&RC[-24])&IF(RC[-23]="",,"|n"&R1C10&RC[-23])&IF(RC[-22]="",,"|n"&R1C11&RC[-22])&IF(RC[-21]="",,"|n"&R1C12&RC[-21])&IF(RC[-19]&RC[-18]&RC[-17]&RC[-16]="",,"|n|n"&R1C13)&IF(RC[-19]="",,"|n"&R1C14&RC[-19])&IF(RC[-18]="",,"|n"&R1C15&RC[-18])&IF(RC[-17]="",,"|n"&R1C16&RC[-17])&IF(RC[-16]="",,"|n"&R1C17&RC[-16])&IF(RC[-15]="",,"|n"&R1C18&RC[-15])&IF(RC[-14]="",,"|n"&R1C19&RC[-14])&IF(RC[-13]="",,"|n"&R1C20&RC[-13])&IF(RC[-12]="",,"|n"&R1C21&RC[-12])&IF(RC[-11]="",,"|n"&R1C22&RC[-11])&IF(RC[-10]="",,"|n"&R1C23&RC[-10])&IF(RC[-9]="",,"|n"&R1C24&RC[-9])&IF(RC[-8]="",,"|n"&R1C25&RC[-8])&IF(RC[-7]="",,"|n"&R1C26&RC[-7])&IF(RC[-6]="",,"|n"&R1C27&RC[-6])&IF(RC[-5]="",,"|n"&R1C28&RC[-5])&IF(RC[-2]="",,"|n|n"&RC[-2]) -> |n|n用于镶嵌到[剑,衣]上.|n镶嵌后不可取下!|n不需要的宝石可以在宠物处熔炼,用于宝石抽奖.
A115: 4 | B115: D | C115: [宝石] | D115: 烟涛 | G115: =IF(R[-99]C<>"",R[-99]C*30,"") ->  | H115: =IF(R[-99]C<>"",R[-99]C*30,"") ->  | I115: =IF(R[-99]C<>"",R[-99]C*30,"") ->  | J115: =IF(R[-99]C<>"",R[-99]C*30,"") ->  | K115: =IF(R[-99]C<>"",R[-99]C*30,"") ->  | L115: =IF(R[-99]C<>"",INT(R[-99]C*4),"") ->  | M115: =IF(R[-99]C<>"",R[-99]C*16,"") ->  | N115: =IF(R[-99]C<>"",INT(R[-99]C*1.6),"") ->  | O115: =IF(R[-99]C<>"",INT(R[-99]C*1.6),"") ->  | AE115: 用于镶嵌到[剑,衣]上.|n镶嵌后不可取下!|n不需要的宝石可以在宠物处熔炼,用于宝石抽奖. | AF115: =VLOOKUP(RC[-31],Sheet2!R13C1:R19C2,2,0)&"."&VLOOKUP(RC[-30],Sheet2!R7C1:R12C2,2,0)&VLOOKUP(RC[-30],Sheet2!R1C1:R6C2,2,0)&RC[-29]&RC[-28]&RC[-27]&Sheet2!R1C3 -> 四.丁|cFF999999[宝石]烟涛|r | AG115: =IF(RC[-26]&RC[-25]&RC[-24]&RC[-23]&RC[-22]&RC[-21]="",,R1C6)&IF(RC[-26]="",,"|n"&R1C7&RC[-26])&IF(RC[-25]="",,"|n"&R1C8&RC[-25])&IF(RC[-24]="",,"|n"&R1C9&RC[-24])&IF(RC[-23]="",,"|n"&R1C10&RC[-23])&IF(RC[-22]="",,"|n"&R1C11&RC[-22])&IF(RC[-21]="",,"|n"&R1C12&RC[-21])&IF(RC[-19]&RC[-18]&RC[-17]&RC[-16]="",,"|n|n"&R1C13)&IF(RC[-19]="",,"|n"&R1C14&RC[-19])&IF(RC[-18]="",,"|n"&R1C15&RC[-18])&IF(RC[-17]="",,"|n"&R1C16&RC[-17])&IF(RC[-16]="",,"|n"&R1C17&RC[-16])&IF(RC[-15]="",,"|n"&R1C18&RC[-15])&IF(RC[-14]="",,"|n"&R1C19&RC[-14])&IF(RC[-13]="",,"|n"&R1C20&RC[-13])&IF(RC[-12]="",,"|n"&R1C21&RC[-12])&IF(RC[-11]="",,"|n"&R1C22&RC[-11])&IF(RC[-10]="",,"|n"&R1C23&RC[-10])&IF(RC[-9]="",,"|n"&R1C24&RC[-9])&IF(RC[-8]="",,"|n"&R1C25&RC[-8])&IF(RC[-7]="",,"|n"&R1C26&RC[-7])&IF(RC[-6]="",,"|n"&R1C27&RC[-6])&IF(RC[-5]="",,"|n"&R1C28&RC[-5])&IF(RC[-2]="",,"|n|n"&RC[-2]) -> |n|n用于镶嵌到[剑,衣]上.|n镶嵌后不可取下!|n不需要的宝石可以在宠物处熔炼,用于宝石抽奖.
A116: 4 | B116: D | C116: [宝石] | D116: 巫谢 | G116: =IF(R[-99]C<>"",R[-99]C*30,"") ->  | H116: =IF(R[-99]C<>"",R[-99]C*30,"") ->  | I116: =IF(R[-99]C<>"",R[-99]C*30,"") ->  | J116: =IF(R[-99]C<>"",R[-99]C*30,"") ->  | K116: =IF(R[-99]C<>"",R[-99]C*30,"") ->  | L116: =IF(R[-99]C<>"",INT(R[-99]C*4),"") ->  | M116: =IF(R[-99]C<>"",R[-99]C*16,"") ->  | N116: =IF(R[-99]C<>"",INT(R[-99]C*1.6),"") ->  | O116: =IF(R[-99]C<>"",INT(R[-99]C*1.6),"") ->  | AE116: 用于镶嵌到[剑,衣]上.|n镶嵌后不可取下!|n不需要的宝石可以在宠物处熔炼,用于宝石抽奖. | AF116: =VLOOKUP(RC[-31],Sheet2!R13C1:R19C2,2,0)&"."&VLOOKUP(RC[-30],Sheet2!R7C1:R12C2,2,0)&VLOOKUP(RC[-30],Sheet2!R1C1:R6C2,2,0)&RC[-29]&RC[-28]&RC[-27]&Sheet2!R1C3 -> 四.丁|cFF999999[宝石]巫谢|r | AG116: =IF(RC[-26]&RC[-25]&RC[-24]&RC[-23]&RC[-22]&RC[-21]="",,R1C6)&IF(RC[-26]="",,"|n"&R1C7&RC[-26])&IF(RC[-25]="",,"|n"&R1C8&RC[-25])&IF(RC[-24]="",,"|n"&R1C9&RC[-24])&IF(RC[-23]="",,"|n"&R1C10&RC[-23])&IF(RC[-22]="",,"|n"&R1C11&RC[-22])&IF(RC[-21]="",,"|n"&R1C12&RC[-21])&IF(RC[-19]&RC[-18]&RC[-17]&RC[-16]="",,"|n|n"&R1C13)&IF(RC[-19]="",,"|n"&R1C14&RC[-19])&IF(RC[-18]="",,"|n"&R1C15&RC[-18])&IF(RC[-17]="",,"|n"&R1C16&RC[-17])&IF(RC[-16]="",,"|n"&R1C17&RC[-16])&IF(RC[-15]="",,"|n"&R1C18&RC[-15])&IF(RC[-14]="",,"|n"&R1C19&RC[-14])&IF(RC[-13]="",,"|n"&R1C20&RC[-13])&IF(RC[-12]="",,"|n"&R1C21&RC[-12])&IF(RC[-11]="",,"|n"&R1C22&RC[-11])&IF(RC[-10]="",,"|n"&R1C23&RC[-10])&IF(RC[-9]="",,"|n"&R1C24&RC[-9])&IF(RC[-8]="",,"|n"&R1C25&RC[-8])&IF(RC[-7]="",,"|n"&R1C26&RC[-7])&IF(RC[-6]="",,"|n"&R1C27&RC[-6])&IF(RC[-5]="",,"|n"&R1C28&RC[-5])&IF(RC[-2]="",,"|n|n"&RC[-2]) -> |n|n用于镶嵌到[剑,衣]上.|n镶嵌后不可取下!|n不需要的宝石可以在宠物处熔炼,用于宝石抽奖.
A117: 4 | B117: C | C117: [宝石] | D117: 罗候石 | G117: =IF(R[-99]C<>"",R[-99]C*25,"") ->  | H117: =IF(R[-99]C<>"",R[-99]C*25,"") -> 37500 | I117: =IF(R[-99]C<>"",R[-99]C*25,"") -> 37500 | J117: =IF(R[-99]C<>"",R[-99]C*25,"") -> 37500 | K117: =IF(R[-99]C<>"",R[-99]C*25,"") ->  | L117: =IF(R[-99]C<>"",INT(R[-99]C*4),"") ->  | M117: =IF(R[-99]C<>"",R[-99]C*16,"") ->  | N117: =IF(R[-99]C<>"",INT(R[-99]C*1.8),"") ->  | O117: =IF(R[-99]C<>"",INT(R[-99]C*1.8),"") ->  | P117: =IF(R[-99]C<>"",INT(R[-99]C*1.8),"") ->  | Q117: =IF(R[-99]C<>"",INT(R[-99]C*1.8),"") ->  | AE117: 用于镶嵌到[剑,衣]上.|n镶嵌后不可取下!|n不需要的宝石可以在宠物处熔炼,用于宝石抽奖. | AF117: =VLOOKUP(RC[-31],Sheet2!R13C1:R19C2,2,0)&"."&VLOOKUP(RC[-30],Sheet2!R7C1:R12C2,2,0)&VLOOKUP(RC[-30],Sheet2!R1C1:R6C2,2,0)&RC[-29]&RC[-28]&RC[-27]&Sheet2!R1C3 -> 四.丙|cFF99FF66[宝石]罗候石|r | AG117: =IF(RC[-26]&RC[-25]&RC[-24]&RC[-23]&RC[-22]&RC[-21]="",,R1C6)&IF(RC[-26]="",,"|n"&R1C7&RC[-26])&IF(RC[-25]="",,"|n"&R1C8&RC[-25])&IF(RC[-24]="",,"|n"&R1C9&RC[-24])&IF(RC[-23]="",,"|n"&R1C10&RC[-23])&IF(RC[-22]="",,"|n"&R1C11&RC[-22])&IF(RC[-21]="",,"|n"&R1C12&RC[-21])&IF(RC[-19]&RC[-18]&RC[-17]&RC[-16]="",,"|n|n"&R1C13)&IF(RC[-19]="",,"|n"&R1C14&RC[-19])&IF(RC[-18]="",,"|n"&R1C15&RC[-18])&IF(RC[-17]="",,"|n"&R1C16&RC[-17])&IF(RC[-16]="",,"|n"&R1C17&RC[-16])&IF(RC[-15]="",,"|n"&R1C18&RC[-15])&IF(RC[-14]="",,"|n"&R1C19&RC[-14])&IF(RC[-13]="",,"|n"&R1C20&RC[-13])&IF(RC[-12]="",,"|n"&R1C21&RC[-12])&IF(RC[-11]="",,"|n"&R1C22&RC[-11])&IF(RC[-10]="",,"|n"&R1C23&RC[-10])&IF(RC[-9]="",,"|n"&R1C24&RC[-9])&IF(RC[-8]="",,"|n"&R1C25&RC[-8])&IF(RC[-7]="",,"|n"&R1C26&RC[-7])&IF(RC[-6]="",,"|n"&R1C27&RC[-6])&IF(RC[-5]="",,"|n"&R1C28&RC[-5])&IF(RC[-2]="",,"|n|n"&RC[-2]) -> |cFFFFFF99基础属性|r|n力量:37500|n敏捷:37500|n智力:37500|n|n用于镶嵌到[剑,衣]上.|n镶嵌后不可取下!|n不需要的宝石可以在宠物处熔炼,用于宝石抽奖.
A118: 4 | B118: C | C118: [宝石] | D118: 寒天石 | G118: =IF(R[-99]C<>"",R[-99]C*25,"") -> 125000 | H118: =IF(R[-99]C<>"",R[-99]C*25,"") ->  | I118: =IF(R[-99]C<>"",R[-99]C*25,"") ->  | J118: =IF(R[-99]C<>"",R[-99]C*25,"") ->  | K118: =IF(R[-99]C<>"",R[-99]C*25,"") ->  | L118: =IF(R[-99]C<>"",INT(R[-99]C*4),"") ->  | M118: =IF(R[-99]C<>"",R[-99]C*16,"") ->  | N118: =IF(R[-99]C<>"",INT(R[-99]C*1.8),"") ->  | O118: =IF(R[-99]C<>"",INT(R[-99]C*1.8),"") ->  | P118: =IF(R[-99]C<>"",INT(R[-99]C*1.8),"") ->  | Q118: =IF(R[-99]C<>"",INT(R[-99]C*1.8),"") ->  | AE118: 用于镶嵌到[剑,衣]上.|n镶嵌后不可取下!|n不需要的宝石可以在宠物处熔炼,用于宝石抽奖. | AF118: =VLOOKUP(RC[-31],Sheet2!R13C1:R19C2,2,0)&"."&VLOOKUP(RC[-30],Sheet2!R7C1:R12C2,2,0)&VLOOKUP(RC[-30],Sheet2!R1C1:R6C2,2,0)&RC[-29]&RC[-28]&RC[-27]&Sheet2!R1C3 -> 四.丙|cFF99FF66[宝石]寒天石|r | AG118: =IF(RC[-26]&RC[-25]&RC[-24]&RC[-23]&RC[-22]&RC[-21]="",,R1C6)&IF(RC[-26]="",,"|n"&R1C7&RC[-26])&IF(RC[-25]="",,"|n"&R1C8&RC[-25])&IF(RC[-24]="",,"|n"&R1C9&RC[-24])&IF(RC[-23]="",,"|n"&R1C10&RC[-23])&IF(RC[-22]="",,"|n"&R1C11&RC[-22])&IF(RC[-21]="",,"|n"&R1C12&RC[-21])&IF(RC[-19]&RC[-18]&RC[-17]&RC[-16]="",,"|n|n"&R1C13)&IF(RC[-19]="",,"|n"&R1C14&RC[-19])&IF(RC[-18]="",,"|n"&R1C15&RC[-18])&IF(RC[-17]="",,"|n"&R1C16&RC[-17])&IF(RC[-16]="",,"|n"&R1C17&RC[-16])&IF(RC[-15]="",,"|n"&R1C18&RC[-15])&IF(RC[-14]="",,"|n"&R1C19&RC[-14])&IF(RC[-13]="",,"|n"&R1C20&RC[-13])&IF(RC[-12]="",,"|n"&R1C21&RC[-12])&IF(RC[-11]="",,"|n"&R1C22&RC[-11])&IF(RC[-10]="",,"|n"&R1C23&RC[-10])&IF(RC[-9]="",,"|n"&R1C24&RC[-9])&IF(RC[-8]="",,"|n"&R1C25&RC[-8])&IF(RC[-7]="",,"|n"&R1C26&RC[-7])&IF(RC[-6]="",,"|n"&R1C27&RC[-6])&IF(RC[-5]="",,"|n"&R1C28&RC[-5])&IF(RC[-2]="",,"|n|n"&RC[-2]) -> |cFFFFFF99基础属性|r|n攻击:125000|n|n用于镶嵌到[剑,衣]上.|n镶嵌后不可取下!|n不需要的宝石可以在宠物处熔炼,用于宝石抽奖.
A119: 4 | B119: C | C119: [宝石] | D119: 曜仙石 | G119: =IF(R[-99]C<>"",R[-99]C*25,"") ->  | H119: =IF(R[-99]C<>"",R[-99]C*25,"") ->  | I119: =IF(R[-99]C<>"",R[-99]C*25,"") ->  | J119: =IF(R[-99]C<>"",R[-99]C*25,"") ->  | K119: =IF(R[-99]C<>"",R[-99]C*25,"") ->  | L119: =IF(R[-99]C<>"",INT(R[-99]C*4),"") ->  | M119: =IF(R[-99]C<>"",R[-99]C*16,"") ->  | N119: =IF(R[-99]C<>"",INT(R[-99]C*1.8),"") ->  | O119: =IF(R[-99]C<>"",INT(R[-99]C*1.8),"") -> 3 | P119: =IF(R[-99]C<>"",INT(R[-99]C*1.8),"") ->  | Q119: =IF(R[-99]C<>"",INT(R[-99]C*1.8),"") ->  | AE119: 用于镶嵌到[剑,衣]上.|n镶嵌后不可取下!|n不需要的宝石可以在宠物处熔炼,用于宝石抽奖. | AF119: =VLOOKUP(RC[-31],Sheet2!R13C1:R19C2,2,0)&"."&VLOOKUP(RC[-30],Sheet2!R7C1:R12C2,2,0)&VLOOKUP(RC[-30],Sheet2!R1C1:R6C2,2,0)&RC[-29]&RC[-28]&RC[-27]&Sheet2!R1C3 -> 四.丙|cFF99FF66[宝石]曜仙石|r | AG119: =IF(RC[-26]&RC[-25]&RC[-24]&RC[-23]&RC[-22]&RC[-21]="",,R1C6)&IF(RC[-26]="",,"|n"&R1C7&RC[-26])&IF(RC[-25]="",,"|n"&R1C8&RC[-25])&IF(RC[-24]="",,"|n"&R1C9&RC[-24])&IF(RC[-23]="",,"|n"&R1C10&RC[-23])&IF(RC[-22]="",,"|n"&R1C11&RC[-22])&IF(RC[-21]="",,"|n"&R1C12&RC[-21])&IF(RC[-19]&RC[-18]&RC[-17]&RC[-16]="",,"|n|n"&R1C13)&IF(RC[-19]="",,"|n"&R1C14&RC[-19])&IF(RC[-18]="",,"|n"&R1C15&RC[-18])&IF(RC[-17]="",,"|n"&R1C16&RC[-17])&IF(RC[-16]="",,"|n"&R1C17&RC[-16])&IF(RC[-15]="",,"|n"&R1C18&RC[-15])&IF(RC[-14]="",,"|n"&R1C19&RC[-14])&IF(RC[-13]="",,"|n"&R1C20&RC[-13])&IF(RC[-12]="",,"|n"&R1C21&RC[-12])&IF(RC[-11]="",,"|n"&R1C22&RC[-11])&IF(RC[-10]="",,"|n"&R1C23&RC[-10])&IF(RC[-9]="",,"|n"&R1C24&RC[-9])&IF(RC[-8]="",,"|n"&R1C25&RC[-8])&IF(RC[-7]="",,"|n"&R1C26&RC[-7])&IF(RC[-6]="",,"|n"&R1C27&RC[-6])&IF(RC[-5]="",,"|n"&R1C28&RC[-5])&IF(RC[-2]="",,"|n|n"&RC[-2]) -> |n|n|cFFFFFF55附加属性|r(%)|n攻击吸血:3|n|n用于镶嵌到[剑,衣]上.|n镶嵌后不可取下!|n不需要的宝石可以在宠物处熔炼,用于宝石抽奖.
A120: 4 | B120: C | C120: [宝石] | D120: 链铠石 | G120: =IF(R[-99]C<>"",R[-99]C*25,"") ->  | H120: =IF(R[-99]C<>"",R[-99]C*25,"") ->  | I120: =IF(R[-99]C<>"",R[-99]C*25,"") ->  | J120: =IF(R[-99]C<>"",R[-99]C*25,"") ->  | K120: =IF(R[-99]C<>"",R[-99]C*25,"") -> 625000 | L120: =IF(R[-99]C<>"",INT(R[-99]C*4),"") -> 400 | M120: =IF(R[-99]C<>"",R[-99]C*16,"") ->  | N120: =IF(R[-99]C<>"",INT(R[-99]C*1.8),"") ->  | O120: =IF(R[-99]C<>"",INT(R[-99]C*1.8),"") ->  | P120: =IF(R[-99]C<>"",INT(R[-99]C*1.8),"") ->  | Q120: =IF(R[-99]C<>"",INT(R[-99]C*1.8),"") ->  | AE120: 用于镶嵌到[剑,衣]上.|n镶嵌后不可取下!|n不需要的宝石可以在宠物处熔炼,用于宝石抽奖. | AF120: =VLOOKUP(RC[-31],Sheet2!R13C1:R19C2,2,0)&"."&VLOOKUP(RC[-30],Sheet2!R7C1:R12C2,2,0)&VLOOKUP(RC[-30],Sheet2!R1C1:R6C2,2,0)&RC[-29]&RC[-28]&RC[-27]&Sheet2!R1C3 -> 四.丙|cFF99FF66[宝石]链铠石|r | AG120: =IF(RC[-26]&RC[-25]&RC[-24]&RC[-23]&RC[-22]&RC[-21]="",,R1C6)&IF(RC[-26]="",,"|n"&R1C7&RC[-26])&IF(RC[-25]="",,"|n"&R1C8&RC[-25])&IF(RC[-24]="",,"|n"&R1C9&RC[-24])&IF(RC[-23]="",,"|n"&R1C10&RC[-23])&IF(RC[-22]="",,"|n"&R1C11&RC[-22])&IF(RC[-21]="",,"|n"&R1C12&RC[-21])&IF(RC[-19]&RC[-18]&RC[-17]&RC[-16]="",,"|n|n"&R1C13)&IF(RC[-19]="",,"|n"&R1C14&RC[-19])&IF(RC[-18]="",,"|n"&R1C15&RC[-18])&IF(RC[-17]="",,"|n"&R1C16&RC[-17])&IF(RC[-16]="",,"|n"&R1C17&RC[-16])&IF(RC[-15]="",,"|n"&R1C18&RC[-15])&IF(RC[-14]="",,"|n"&R1C19&RC[-14])&IF(RC[-13]="",,"|n"&R1C20&RC[-13])&IF(RC[-12]="",,"|n"&R1C21&RC[-12])&IF(RC[-11]="",,"|n"&R1C22&RC[-11])&IF(RC[-10]="",,"|n"&R1C23&RC[-10])&IF(RC[-9]="",,"|n"&R1C24&RC[-9])&IF(RC[-8]="",,"|n"&R1C25&RC[-8])&IF(RC[-7]="",,"|n"&R1C26&RC[-7])&IF(RC[-6]="",,"|n"&R1C27&RC[-6])&IF(RC[-5]="",,"|n"&R1C28&RC[-5])&IF(RC[-2]="",,"|n|n"&RC[-2]) -> |cFFFFFF99基础属性|r|n血量:625000|n护甲:400|n|n用于镶嵌到[剑,衣]上.|n镶嵌后不可取下!|n不需要的宝石可以在宠物处熔炼,用于宝石抽奖.
A121: 4 | B121: C | C121: [宝石] | D121: 银月石 | G121: =IF(R[-99]C<>"",R[-99]C*25,"") ->  | H121: =IF(R[-99]C<>"",R[-99]C*25,"") -> 50000 | I121: =IF(R[-99]C<>"",R[-99]C*25,"") -> 12500 | J121: =IF(R[-99]C<>"",R[-99]C*25,"") -> 12500 | K121: =IF(R[-99]C<>"",R[-99]C*25,"") ->  | L121: =IF(R[-99]C<>"",INT(R[-99]C*4),"") ->  | M121: =IF(R[-99]C<>"",R[-99]C*16,"") ->  | N121: =IF(R[-99]C<>"",INT(R[-99]C*1.8),"") ->  | O121: =IF(R[-99]C<>"",INT(R[-99]C*1.8),"") ->  | P121: =IF(R[-99]C<>"",INT(R[-99]C*1.8),"") ->  | Q121: =IF(R[-99]C<>"",INT(R[-99]C*1.8),"") ->  | AE121: 用于镶嵌到[剑,衣]上.|n镶嵌后不可取下!|n不需要的宝石可以在宠物处熔炼,用于宝石抽奖. | AF121: =VLOOKUP(RC[-31],Sheet2!R13C1:R19C2,2,0)&"."&VLOOKUP(RC[-30],Sheet2!R7C1:R12C2,2,0)&VLOOKUP(RC[-30],Sheet2!R1C1:R6C2,2,0)&RC[-29]&RC[-28]&RC[-27]&Sheet2!R1C3 -> 四.丙|cFF99FF66[宝石]银月石|r | AG121: =IF(RC[-26]&RC[-25]&RC[-24]&RC[-23]&RC[-22]&RC[-21]="",,R1C6)&IF(RC[-26]="",,"|n"&R1C7&RC[-26])&IF(RC[-25]="",,"|n"&R1C8&RC[-25])&IF(RC[-24]="",,"|n"&R1C9&RC[-24])&IF(RC[-23]="",,"|n"&R1C10&RC[-23])&IF(RC[-22]="",,"|n"&R1C11&RC[-22])&IF(RC[-21]="",,"|n"&R1C12&RC[-21])&IF(RC[-19]&RC[-18]&RC[-17]&RC[-16]="",,"|n|n"&R1C13)&IF(RC[-19]="",,"|n"&R1C14&RC[-19])&IF(RC[-18]="",,"|n"&R1C15&RC[-18])&IF(RC[-17]="",,"|n"&R1C16&RC[-17])&IF(RC[-16]="",,"|n"&R1C17&RC[-16])&IF(RC[-15]="",,"|n"&R1C18&RC[-15])&IF(RC[-14]="",,"|n"&R1C19&RC[-14])&IF(RC[-13]="",,"|n"&R1C20&RC[-13])&IF(RC[-12]="",,"|n"&R1C21&RC[-12])&IF(RC[-11]="",,"|n"&R1C22&RC[-11])&IF(RC[-10]="",,"|n"&R1C23&RC[-10])&IF(RC[-9]="",,"|n"&R1C24&RC[-9])&IF(RC[-8]="",,"|n"&R1C25&RC[-8])&IF(RC[-7]="",,"|n"&R1C26&RC[-7])&IF(RC[-6]="",,"|n"&R1C27&RC[-6])&IF(RC[-5]="",,"|n"&R1C28&RC[-5])&IF(RC[-2]="",,"|n|n"&RC[-2]) -> |cFFFFFF99基础属性|r|n力量:50000|n敏捷:12500|n智力:12500|n|n用于镶嵌到[剑,衣]上.|n镶嵌后不可取下!|n不需要的宝石可以在宠物处熔炼,用于宝石抽奖.
A122: 4 | B122: C | C122: [宝石] | D122: 战狼石 | G122: =IF(R[-99]C<>"",R[-99]C*25,"") ->  | H122: =IF(R[-99]C<>"",R[-99]C*25,"") -> 12500 | I122: =IF(R[-99]C<>"",R[-99]C*25,"") -> 50000 | J122: =IF(R[-99]C<>"",R[-99]C*25,"") -> 12500 | K122: =IF(R[-99]C<>"",R[-99]C*25,"") ->  | L122: =IF(R[-99]C<>"",INT(R[-99]C*4),"") ->  | M122: =IF(R[-99]C<>"",R[-99]C*16,"") ->  | N122: =IF(R[-99]C<>"",INT(R[-99]C*1.8),"") ->  | O122: =IF(R[-99]C<>"",INT(R[-99]C*1.8),"") ->  | P122: =IF(R[-99]C<>"",INT(R[-99]C*1.8),"") ->  | Q122: =IF(R[-99]C<>"",INT(R[-99]C*1.8),"") ->  | AE122: 用于镶嵌到[剑,衣]上.|n镶嵌后不可取下!|n不需要的宝石可以在宠物处熔炼,用于宝石抽奖. | AF122: =VLOOKUP(RC[-31],Sheet2!R13C1:R19C2,2,0)&"."&VLOOKUP(RC[-30],Sheet2!R7C1:R12C2,2,0)&VLOOKUP(RC[-30],Sheet2!R1C1:R6C2,2,0)&RC[-29]&RC[-28]&RC[-27]&Sheet2!R1C3 -> 四.丙|cFF99FF66[宝石]战狼石|r | AG122: =IF(RC[-26]&RC[-25]&RC[-24]&RC[-23]&RC[-22]&RC[-21]="",,R1C6)&IF(RC[-26]="",,"|n"&R1C7&RC[-26])&IF(RC[-25]="",,"|n"&R1C8&RC[-25])&IF(RC[-24]="",,"|n"&R1C9&RC[-24])&IF(RC[-23]="",,"|n"&R1C10&RC[-23])&IF(RC[-22]="",,"|n"&R1C11&RC[-22])&IF(RC[-21]="",,"|n"&R1C12&RC[-21])&IF(RC[-19]&RC[-18]&RC[-17]&RC[-16]="",,"|n|n"&R1C13)&IF(RC[-19]="",,"|n"&R1C14&RC[-19])&IF(RC[-18]="",,"|n"&R1C15&RC[-18])&IF(RC[-17]="",,"|n"&R1C16&RC[-17])&IF(RC[-16]="",,"|n"&R1C17&RC[-16])&IF(RC[-15]="",,"|n"&R1C18&RC[-15])&IF(RC[-14]="",,"|n"&R1C19&RC[-14])&IF(RC[-13]="",,"|n"&R1C20&RC[-13])&IF(RC[-12]="",,"|n"&R1C21&RC[-12])&IF(RC[-11]="",,"|n"&R1C22&RC[-11])&IF(RC[-10]="",,"|n"&R1C23&RC[-10])&IF(RC[-9]="",,"|n"&R1C24&RC[-9])&IF(RC[-8]="",,"|n"&R1C25&RC[-8])&IF(RC[-7]="",,"|n"&R1C26&RC[-7])&IF(RC[-6]="",,"|n"&R1C27&RC[-6])&IF(RC[-5]="",,"|n"&R1C28&RC[-5])&IF(RC[-2]="",,"|n|n"&RC[-2]) -> |cFFFFFF99基础属性|r|n力量:12500|n敏捷:50000|n智力:12500|n|n用于镶嵌到[剑,衣]上.|n镶嵌后不可取下!|n不需要的宝石可以在宠物处熔炼,用于宝石抽奖.
A123: 4 | B123: C | C123: [宝石] | D123: 轮炎石 | G123: =IF(R[-99]C<>"",R[-99]C*25,"") ->  | H123: =IF(R[-99]C<>"",R[-99]C*25,"") -> 12500 | I123: =IF(R[-99]C<>"",R[-99]C*25,"") -> 12500 | J123: =IF(R[-99]C<>"",R[-99]C*25,"") -> 50000 | K123: =IF(R[-99]C<>"",R[-99]C*25,"") ->  | L123: =IF(R[-99]C<>"",INT(R[-99]C*4),"") ->  | M123: =IF(R[-99]C<>"",R[-99]C*16,"") ->  | N123: =IF(R[-99]C<>"",INT(R[-99]C*1.8),"") ->  | O123: =IF(R[-99]C<>"",INT(R[-99]C*1.8),"") ->  | P123: =IF(R[-99]C<>"",INT(R[-99]C*1.8),"") ->  | Q123: =IF(R[-99]C<>"",INT(R[-99]C*1.8),"") ->  | AE123: 用于镶嵌到[剑,衣]上.|n镶嵌后不可取下!|n不需要的宝石可以在宠物处熔炼,用于宝石抽奖. | AF123: =VLOOKUP(RC[-31],Sheet2!R13C1:R19C2,2,0)&"."&VLOOKUP(RC[-30],Sheet2!R7C1:R12C2,2,0)&VLOOKUP(RC[-30],Sheet2!R1C1:R6C2,2,0)&RC[-29]&RC[-28]&RC[-27]&Sheet2!R1C3 -> 四.丙|cFF99FF66[宝石]轮炎石|r | AG123: =IF(RC[-26]&RC[-25]&RC[-24]&RC[-23]&RC[-22]&RC[-21]="",,R1C6)&IF(RC[-26]="",,"|n"&R1C7&RC[-26])&IF(RC[-25]="",,"|n"&R1C8&RC[-25])&IF(RC[-24]="",,"|n"&R1C9&RC[-24])&IF(RC[-23]="",,"|n"&R1C10&RC[-23])&IF(RC[-22]="",,"|n"&R1C11&RC[-22])&IF(RC[-21]="",,"|n"&R1C12&RC[-21])&IF(RC[-19]&RC[-18]&RC[-17]&RC[-16]="",,"|n|n"&R1C13)&IF(RC[-19]="",,"|n"&R1C14&RC[-19])&IF(RC[-18]="",,"|n"&R1C15&RC[-18])&IF(RC[-17]="",,"|n"&R1C16&RC[-17])&IF(RC[-16]="",,"|n"&R1C17&RC[-16])&IF(RC[-15]="",,"|n"&R1C18&RC[-15])&IF(RC[-14]="",,"|n"&R1C19&RC[-14])&IF(RC[-13]="",,"|n"&R1C20&RC[-13])&IF(RC[-12]="",,"|n"&R1C21&RC[-12])&IF(RC[-11]="",,"|n"&R1C22&RC[-11])&IF(RC[-10]="",,"|n"&R1C23&RC[-10])&IF(RC[-9]="",,"|n"&R1C24&RC[-9])&IF(RC[-8]="",,"|n"&R1C25&RC[-8])&IF(RC[-7]="",,"|n"&R1C26&RC[-7])&IF(RC[-6]="",,"|n"&R1C27&RC[-6])&IF(RC[-5]="",,"|n"&R1C28&RC[-5])&IF(RC[-2]="",,"|n|n"&RC[-2]) -> |cFFFFFF99基础属性|r|n力量:12500|n敏捷:12500|n智力:50000|n|n用于镶嵌到[剑,衣]上.|n镶嵌后不可取下!|n不需要的宝石可以在宠物处熔炼,用于宝石抽奖.
A124: 4 | B124: C | C124: [宝石] | D124: 蚀魂石 | G124: =IF(R[-99]C<>"",R[-99]C*25,"") ->  | H124: =IF(R[-99]C<>"",R[-99]C*25,"") ->  | I124: =IF(R[-99]C<>"",R[-99]C*25,"") ->  | J124: =IF(R[-99]C<>"",R[-99]C*25,"") ->  | K124: =IF(R[-99]C<>"",R[-99]C*25,"") ->  | L124: =IF(R[-99]C<>"",INT(R[-99]C*4),"") ->  | M124: =IF(R[-99]C<>"",R[-99]C*16,"") ->  | N124: =IF(R[-99]C<>"",INT(R[-99]C*1.8),"") -> 27 | O124: =IF(R[-99]C<>"",INT(R[-99]C*1.8),"") ->  | P124: =IF(R[-99]C<>"",INT(R[-99]C*1.8),"") ->  | Q124: =IF(R[-99]C<>"",INT(R[-99]C*1.8),"") ->  | AE124: 用于镶嵌到[剑,衣]上.|n镶嵌后不可取下!|n不需要的宝石可以在宠物处熔炼,用于宝石抽奖. | AF124: =VLOOKUP(RC[-31],Sheet2!R13C1:R19C2,2,0)&"."&VLOOKUP(RC[-30],Sheet2!R7C1:R12C2,2,0)&VLOOKUP(RC[-30],Sheet2!R1C1:R6C2,2,0)&RC[-29]&RC[-28]&RC[-27]&Sheet2!R1C3 -> 四.丙|cFF99FF66[宝石]蚀魂石|r | AG124: =IF(RC[-26]&RC[-25]&RC[-24]&RC[-23]&RC[-22]&RC[-21]="",,R1C6)&IF(RC[-26]="",,"|n"&R1C7&RC[-26])&IF(RC[-25]="",,"|n"&R1C8&RC[-25])&IF(RC[-24]="",,"|n"&R1C9&RC[-24])&IF(RC[-23]="",,"|n"&R1C10&RC[-23])&IF(RC[-22]="",,"|n"&R1C11&RC[-22])&IF(RC[-21]="",,"|n"&R1C12&RC[-21])&IF(RC[-19]&RC[-18]&RC[-17]&RC[-16]="",,"|n|n"&R1C13)&IF(RC[-19]="",,"|n"&R1C14&RC[-19])&IF(RC[-18]="",,"|n"&R1C15&RC[-18])&IF(RC[-17]="",,"|n"&R1C16&RC[-17])&IF(RC[-16]="",,"|n"&R1C17&RC[-16])&IF(RC[-15]="",,"|n"&R1C18&RC[-15])&IF(RC[-14]="",,"|n"&R1C19&RC[-14])&IF(RC[-13]="",,"|n"&R1C20&RC[-13])&IF(RC[-12]="",,"|n"&R1C21&RC[-12])&IF(RC[-11]="",,"|n"&R1C22&RC[-11])&IF(RC[-10]="",,"|n"&R1C23&RC[-10])&IF(RC[-9]="",,"|n"&R1C24&RC[-9])&IF(RC[-8]="",,"|n"&R1C25&RC[-8])&IF(RC[-7]="",,"|n"&R1C26&RC[-7])&IF(RC[-6]="",,"|n"&R1C27&RC[-6])&IF(RC[-5]="",,"|n"&R1C28&RC[-5])&IF(RC[-2]="",,"|n|n"&RC[-2]) -> |n|n|cFFFFFF55附加属性|r(%)|n攻速:27|n|n用于镶嵌到[剑,衣]上.|n镶嵌后不可取下!|n不需要的宝石可以在宠物处熔炼,用于宝石抽奖.
A125: 4 | B125: B | C125: [宝石] | D125: 双龙魔石 | G125: =IF(R[-99]C<>"",R[-99]C*25,"") ->  | H125: =IF(R[-99]C<>"",R[-99]C*25,"") -> 62500 | I125: =IF(R[-99]C<>"",R[-99]C*25,"") ->  | J125: =IF(R[-99]C<>"",R[-99]C*25,"") ->  | K125: =IF(R[-99]C<>"",R[-99]C*25,"") ->  | L125: =IF(R[-99]C<>"",INT(R[-99]C*4),"") -> 100 | M125: =IF(R[-99]C<>"",R[-99]C*16,"") ->  | O125: =IF(R[-99]C<>"",INT(R[-99]C*1.8),"") ->  | P125: =IF(R[-99]C<>"",INT(R[-99]C*1.8),"") ->  | Q125: =IF(R[-99]C<>"",INT(R[-99]C*1.8),"") ->  | R125: =IF(R[-99]C<>"",INT(R[-99]C*1.8),"") -> 3 | AE125: 用于镶嵌到[剑,衣]上.|n镶嵌后不可取下!|n不需要的宝石可以在宠物处熔炼,用于宝石抽奖. | AF125: =VLOOKUP(RC[-31],Sheet2!R13C1:R19C2,2,0)&"."&VLOOKUP(RC[-30],Sheet2!R7C1:R12C2,2,0)&VLOOKUP(RC[-30],Sheet2!R1C1:R6C2,2,0)&RC[-29]&RC[-28]&RC[-27]&Sheet2!R1C3 -> 四.乙|cFF1BE6B8[宝石]双龙魔石|r | AG125: =IF(RC[-26]&RC[-25]&RC[-24]&RC[-23]&RC[-22]&RC[-21]="",,R1C6)&IF(RC[-26]="",,"|n"&R1C7&RC[-26])&IF(RC[-25]="",,"|n"&R1C8&RC[-25])&IF(RC[-24]="",,"|n"&R1C9&RC[-24])&IF(RC[-23]="",,"|n"&R1C10&RC[-23])&IF(RC[-22]="",,"|n"&R1C11&RC[-22])&IF(RC[-21]="",,"|n"&R1C12&RC[-21])&IF(RC[-19]&RC[-18]&RC[-17]&RC[-16]="",,"|n|n"&R1C13)&IF(RC[-19]="",,"|n"&R1C14&RC[-19])&IF(RC[-18]="",,"|n"&R1C15&RC[-18])&IF(RC[-17]="",,"|n"&R1C16&RC[-17])&IF(RC[-16]="",,"|n"&R1C17&RC[-16])&IF(RC[-15]="",,"|n"&R1C18&RC[-15])&IF(RC[-14]="",,"|n"&R1C19&RC[-14])&IF(RC[-13]="",,"|n"&R1C20&RC[-13])&IF(RC[-12]="",,"|n"&R1C21&RC[-12])&IF(RC[-11]="",,"|n"&R1C22&RC[-11])&IF(RC[-10]="",,"|n"&R1C23&RC[-10])&IF(RC[-9]="",,"|n"&R1C24&RC[-9])&IF(RC[-8]="",,"|n"&R1C25&RC[-8])&IF(RC[-7]="",,"|n"&R1C26&RC[-7])&IF(RC[-6]="",,"|n"&R1C27&RC[-6])&IF(RC[-5]="",,"|n"&R1C28&RC[-5])&IF(RC[-2]="",,"|n|n"&RC[-2]) -> |cFFFFFF99基础属性|r|n力量:62500|n护甲:100|n伤害增幅:3|n|n用于镶嵌到[剑,衣]上.|n镶嵌后不可取下!|n不需要的宝石可以在宠物处熔炼,用于宝石抽奖.
A126: 4 | B126: B | C126: [宝石] | D126: 兽王宝玉 | G126: =IF(R[-99]C<>"",R[-99]C*25,"") -> 150000 | H126: =IF(R[-99]C<>"",R[-99]C*25,"") ->  | I126: =IF(R[-99]C<>"",R[-99]C*25,"") ->  | J126: =IF(R[-99]C<>"",R[-99]C*25,"") ->  | K126: =IF(R[-99]C<>"",R[-99]C*25,"") ->  | L126: =IF(R[-99]C<>"",INT(R[-99]C*4),"") -> 100 | M126: =IF(R[-99]C<>"",R[-99]C*16,"") ->  | O126: =IF(R[-99]C<>"",INT(R[-99]C*1.8),"") ->  | P126: =IF(R[-99]C<>"",INT(R[-99]C*1.8),"") ->  | Q126: =IF(R[-99]C<>"",INT(R[-99]C*1.8),"") ->  | R126: =IF(R[-99]C<>"",INT(R[-99]C*1.8),"") -> 3 | AE126: 用于镶嵌到[剑,衣]上.|n镶嵌后不可取下!|n不需要的宝石可以在宠物处熔炼,用于宝石抽奖. | AF126: =VLOOKUP(RC[-31],Sheet2!R13C1:R19C2,2,0)&"."&VLOOKUP(RC[-30],Sheet2!R7C1:R12C2,2,0)&VLOOKUP(RC[-30],Sheet2!R1C1:R6C2,2,0)&RC[-29]&RC[-28]&RC[-27]&Sheet2!R1C3 -> 四.乙|cFF1BE6B8[宝石]兽王宝玉|r | AG126: =IF(RC[-26]&RC[-25]&RC[-24]&RC[-23]&RC[-22]&RC[-21]="",,R1C6)&IF(RC[-26]="",,"|n"&R1C7&RC[-26])&IF(RC[-25]="",,"|n"&R1C8&RC[-25])&IF(RC[-24]="",,"|n"&R1C9&RC[-24])&IF(RC[-23]="",,"|n"&R1C10&RC[-23])&IF(RC[-22]="",,"|n"&R1C11&RC[-22])&IF(RC[-21]="",,"|n"&R1C12&RC[-21])&IF(RC[-19]&RC[-18]&RC[-17]&RC[-16]="",,"|n|n"&R1C13)&IF(RC[-19]="",,"|n"&R1C14&RC[-19])&IF(RC[-18]="",,"|n"&R1C15&RC[-18])&IF(RC[-17]="",,"|n"&R1C16&RC[-17])&IF(RC[-16]="",,"|n"&R1C17&RC[-16])&IF(RC[-15]="",,"|n"&R1C18&RC[-15])&IF(RC[-14]="",,"|n"&R1C19&RC[-14])&IF(RC[-13]="",,"|n"&R1C20&RC[-13])&IF(RC[-12]="",,"|n"&R1C21&RC[-12])&IF(RC[-11]="",,"|n"&R1C22&RC[-11])&IF(RC[-10]="",,"|n"&R1C23&RC[-10])&IF(RC[-9]="",,"|n"&R1C24&RC[-9])&IF(RC[-8]="",,"|n"&R1C25&RC[-8])&IF(RC[-7]="",,"|n"&R1C26&RC[-7])&IF(RC[-6]="",,"|n"&R1C27&RC[-6])&IF(RC[-5]="",,"|n"&R1C28&RC[-5])&IF(RC[-2]="",,"|n|n"&RC[-2]) -> |cFFFFFF99基础属性|r|n攻击:150000|n护甲:100|n伤害增幅:3|n|n用于镶嵌到[剑,衣]上.|n镶嵌后不可取下!|n不需要的宝石可以在宠物处熔炼,用于宝石抽奖.
A127: 4 | B127: B | C127: [宝石] | D127: 雷音粗木 | G127: =IF(R[-99]C<>"",R[-99]C*25,"") ->  | H127: =IF(R[-99]C<>"",R[-99]C*25,"") ->  | I127: =IF(R[-99]C<>"",R[-99]C*25,"") ->  | J127: =IF(R[-99]C<>"",R[-99]C*25,"") -> 62500 | K127: =IF(R[-99]C<>"",R[-99]C*25,"") ->  | L127: =IF(R[-99]C<>"",INT(R[-99]C*4),"") -> 100 | M127: =IF(R[-99]C<>"",R[-99]C*16,"") ->  | O127: =IF(R[-99]C<>"",INT(R[-99]C*1.8),"") ->  | P127: =IF(R[-99]C<>"",INT(R[-99]C*1.8),"") ->  | Q127: =IF(R[-99]C<>"",INT(R[-99]C*1.8),"") ->  | R127: =IF(R[-99]C<>"",INT(R[-99]C*1.8),"") -> 3 | AE127: 用于镶嵌到[剑,衣]上.|n镶嵌后不可取下!|n不需要的宝石可以在宠物处熔炼,用于宝石抽奖. | AF127: =VLOOKUP(RC[-31],Sheet2!R13C1:R19C2,2,0)&"."&VLOOKUP(RC[-30],Sheet2!R7C1:R12C2,2,0)&VLOOKUP(RC[-30],Sheet2!R1C1:R6C2,2,0)&RC[-29]&RC[-28]&RC[-27]&Sheet2!R1C3 -> 四.乙|cFF1BE6B8[宝石]雷音粗木|r | AG127: =IF(RC[-26]&RC[-25]&RC[-24]&RC[-23]&RC[-22]&RC[-21]="",,R1C6)&IF(RC[-26]="",,"|n"&R1C7&RC[-26])&IF(RC[-25]="",,"|n"&R1C8&RC[-25])&IF(RC[-24]="",,"|n"&R1C9&RC[-24])&IF(RC[-23]="",,"|n"&R1C10&RC[-23])&IF(RC[-22]="",,"|n"&R1C11&RC[-22])&IF(RC[-21]="",,"|n"&R1C12&RC[-21])&IF(RC[-19]&RC[-18]&RC[-17]&RC[-16]="",,"|n|n"&R1C13)&IF(RC[-19]="",,"|n"&R1C14&RC[-19])&IF(RC[-18]="",,"|n"&R1C15&RC[-18])&IF(RC[-17]="",,"|n"&R1C16&RC[-17])&IF(RC[-16]="",,"|n"&R1C17&RC[-16])&IF(RC[-15]="",,"|n"&R1C18&RC[-15])&IF(RC[-14]="",,"|n"&R1C19&RC[-14])&IF(RC[-13]="",,"|n"&R1C20&RC[-13])&IF(RC[-12]="",,"|n"&R1C21&RC[-12])&IF(RC[-11]="",,"|n"&R1C22&RC[-11])&IF(RC[-10]="",,"|n"&R1C23&RC[-10])&IF(RC[-9]="",,"|n"&R1C24&RC[-9])&IF(RC[-8]="",,"|n"&R1C25&RC[-8])&IF(RC[-7]="",,"|n"&R1C26&RC[-7])&IF(RC[-6]="",,"|n"&R1C27&RC[-6])&IF(RC[-5]="",,"|n"&R1C28&RC[-5])&IF(RC[-2]="",,"|n|n"&RC[-2]) -> |cFFFFFF99基础属性|r|n智力:62500|n护甲:100|n伤害增幅:3|n|n用于镶嵌到[剑,衣]上.|n镶嵌后不可取下!|n不需要的宝石可以在宠物处熔炼,用于宝石抽奖.
A128: 4 | B128: B | C128: [宝石] | D128: 勾陈灵丝 | G128: =IF(R[-99]C<>"",R[-99]C*25,"") ->  | H128: =IF(R[-99]C<>"",R[-99]C*25,"") ->  | I128: =IF(R[-99]C<>"",R[-99]C*25,"") -> 62500 | J128: =IF(R[-99]C<>"",R[-99]C*25,"") ->  | K128: =IF(R[-99]C<>"",R[-99]C*25,"") ->  | L128: =IF(R[-99]C<>"",INT(R[-99]C*4),"") -> 100 | M128: =IF(R[-99]C<>"",R[-99]C*16,"") ->  | O128: =IF(R[-99]C<>"",INT(R[-99]C*1.8),"") ->  | P128: =IF(R[-99]C<>"",INT(R[-99]C*1.8),"") ->  | Q128: =IF(R[-99]C<>"",INT(R[-99]C*1.8),"") ->  | R128: =IF(R[-99]C<>"",INT(R[-99]C*1.8),"") -> 3 | AE128: 用于镶嵌到[剑,衣]上.|n镶嵌后不可取下!|n不需要的宝石可以在宠物处熔炼,用于宝石抽奖. | AF128: =VLOOKUP(RC[-31],Sheet2!R13C1:R19C2,2,0)&"."&VLOOKUP(RC[-30],Sheet2!R7C1:R12C2,2,0)&VLOOKUP(RC[-30],Sheet2!R1C1:R6C2,2,0)&RC[-29]&RC[-28]&RC[-27]&Sheet2!R1C3 -> 四.乙|cFF1BE6B8[宝石]勾陈灵丝|r | AG128: =IF(RC[-26]&RC[-25]&RC[-24]&RC[-23]&RC[-22]&RC[-21]="",,R1C6)&IF(RC[-26]="",,"|n"&R1C7&RC[-26])&IF(RC[-25]="",,"|n"&R1C8&RC[-25])&IF(RC[-24]="",,"|n"&R1C9&RC[-24])&IF(RC[-23]="",,"|n"&R1C10&RC[-23])&IF(RC[-22]="",,"|n"&R1C11&RC[-22])&IF(RC[-21]="",,"|n"&R1C12&RC[-21])&IF(RC[-19]&RC[-18]&RC[-17]&RC[-16]="",,"|n|n"&R1C13)&IF(RC[-19]="",,"|n"&R1C14&RC[-19])&IF(RC[-18]="",,"|n"&R1C15&RC[-18])&IF(RC[-17]="",,"|n"&R1C16&RC[-17])&IF(RC[-16]="",,"|n"&R1C17&RC[-16])&IF(RC[-15]="",,"|n"&R1C18&RC[-15])&IF(RC[-14]="",,"|n"&R1C19&RC[-14])&IF(RC[-13]="",,"|n"&R1C20&RC[-13])&IF(RC[-12]="",,"|n"&R1C21&RC[-12])&IF(RC[-11]="",,"|n"&R1C22&RC[-11])&IF(RC[-10]="",,"|n"&R1C23&RC[-10])&IF(RC[-9]="",,"|n"&R1C24&RC[-9])&IF(RC[-8]="",,"|n"&R1C25&RC[-8])&IF(RC[-7]="",,"|n"&R1C26&RC[-7])&IF(RC[-6]="",,"|n"&R1C27&RC[-6])&IF(RC[-5]="",,"|n"&R1C28&RC[-5])&IF(RC[-2]="",,"|n|n"&RC[-2]) -> |cFFFFFF99基础属性|r|n敏捷:62500|n护甲:100|n伤害增幅:3|n|n用于镶嵌到[剑,衣]上.|n镶嵌后不可取下!|n不需要的宝石可以在宠物处熔炼,用于宝石抽奖.
A129: 4 | B129: A | C129: [宝石] | D129: 灼灼其华 | G129: =IF(R[-99]C<>"",R[-99]C*25,"") ->  | H129: =IF(R[-99]C<>"",R[-99]C*25,"") -> 30000 | I129: =IF(R[-99]C<>"",R[-99]C*25,"") -> 30000 | J129: =IF(R[-99]C<>"",R[-99]C*25,"") -> 30000 | K129: =IF(R[-99]C<>"",R[-99]C*25,"") ->  | L129: =IF(R[-99]C<>"",INT(R[-99]C*4),"") ->  | M129: =IF(R[-99]C<>"",R[-99]C*16,"") ->  | O129: =IF(R[-99]C<>"",INT(R[-99]C*1.8),"") ->  | P129: =IF(R[-99]C<>"",INT(R[-99]C*1.8),"") ->  | Q129: =IF(R[-99]C<>"",INT(R[-99]C*1.8),"") ->  | R129: =IF(R[-99]C<>"",INT(R[-99]C*1.8),"") -> 7 | S129: =IF(R[-99]C<>"",INT(R[-99]C*1.8),"") ->  | T129: =IF(R[-99]C<>"",INT(R[-99]C*1.8),"") ->  | AE129: 用于镶嵌到[剑,衣]上.|n镶嵌后不可取下!|n不需要的宝石可以在宠物处熔炼,用于宝石抽奖. | AF129: =VLOOKUP(RC[-31],Sheet2!R13C1:R19C2,2,0)&"."&VLOOKUP(RC[-30],Sheet2!R7C1:R12C2,2,0)&VLOOKUP(RC[-30],Sheet2!R1C1:R6C2,2,0)&RC[-29]&RC[-28]&RC[-27]&Sheet2!R1C3 -> 四.甲|cFF33FF00[宝石]灼灼其华|r | AG129: =IF(RC[-26]&RC[-25]&RC[-24]&RC[-23]&RC[-22]&RC[-21]="",,R1C6)&IF(RC[-26]="",,"|n"&R1C7&RC[-26])&IF(RC[-25]="",,"|n"&R1C8&RC[-25])&IF(RC[-24]="",,"|n"&R1C9&RC[-24])&IF(RC[-23]="",,"|n"&R1C10&RC[-23])&IF(RC[-22]="",,"|n"&R1C11&RC[-22])&IF(RC[-21]="",,"|n"&R1C12&RC[-21])&IF(RC[-19]&RC[-18]&RC[-17]&RC[-16]="",,"|n|n"&R1C13)&IF(RC[-19]="",,"|n"&R1C14&RC[-19])&IF(RC[-18]="",,"|n"&R1C15&RC[-18])&IF(RC[-17]="",,"|n"&R1C16&RC[-17])&IF(RC[-16]="",,"|n"&R1C17&RC[-16])&IF(RC[-15]="",,"|n"&R1C18&RC[-15])&IF(RC[-14]="",,"|n"&R1C19&RC[-14])&IF(RC[-13]="",,"|n"&R1C20&RC[-13])&IF(RC[-12]="",,"|n"&R1C21&RC[-12])&IF(RC[-11]="",,"|n"&R1C22&RC[-11])&IF(RC[-10]="",,"|n"&R1C23&RC[-10])&IF(RC[-9]="",,"|n"&R1C24&RC[-9])&IF(RC[-8]="",,"|n"&R1C25&RC[-8])&IF(RC[-7]="",,"|n"&R1C26&RC[-7])&IF(RC[-6]="",,"|n"&R1C27&RC[-6])&IF(RC[-5]="",,"|n"&R1C28&RC[-5])&IF(RC[-2]="",,"|n|n"&RC[-2]) -> |cFFFFFF99基础属性|r|n力量:30000|n敏捷:30000|n智力:30000|n伤害增幅:7|n|n用于镶嵌到[剑,衣]上.|n镶嵌后不可取下!|n不需要的宝石可以在宠物处熔炼,用于宝石抽奖.
A130: 4 | B130: A | C130: [宝石] | D130: 耀武锋芒 | G130: =IF(R[-99]C<>"",R[-99]C*25,"") -> 200000 | H130: =IF(R[-99]C<>"",R[-99]C*25,"") ->  | I130: =IF(R[-99]C<>"",R[-99]C*25,"") ->  | J130: =IF(R[-99]C<>"",R[-99]C*25,"") ->  | K130: =IF(R[-99]C<>"",R[-99]C*25,"") ->  | L130: =IF(R[-99]C<>"",INT(R[-99]C*4),"") ->  | M130: =IF(R[-99]C<>"",R[-99]C*16,"") ->  | O130: =IF(R[-99]C<>"",INT(R[-99]C*1.8),"") ->  | P130: =IF(R[-99]C<>"",INT(R[-99]C*1.8),"") ->  | Q130: =IF(R[-99]C<>"",INT(R[-99]C*1.8),"") ->  | R130: =IF(R[-99]C<>"",INT(R[-99]C*1.8),"") -> 7 | S130: =IF(R[-99]C<>"",INT(R[-99]C*1.8),"") ->  | T130: =IF(R[-99]C<>"",INT(R[-99]C*1.8),"") ->  | AE130: 用于镶嵌到[剑,衣]上.|n镶嵌后不可取下!|n不需要的宝石可以在宠物处熔炼,用于宝石抽奖. | AF130: =VLOOKUP(RC[-31],Sheet2!R13C1:R19C2,2,0)&"."&VLOOKUP(RC[-30],Sheet2!R7C1:R12C2,2,0)&VLOOKUP(RC[-30],Sheet2!R1C1:R6C2,2,0)&RC[-29]&RC[-28]&RC[-27]&Sheet2!R1C3 -> 四.甲|cFF33FF00[宝石]耀武锋芒|r | AG130: =IF(RC[-26]&RC[-25]&RC[-24]&RC[-23]&RC[-22]&RC[-21]="",,R1C6)&IF(RC[-26]="",,"|n"&R1C7&RC[-26])&IF(RC[-25]="",,"|n"&R1C8&RC[-25])&IF(RC[-24]="",,"|n"&R1C9&RC[-24])&IF(RC[-23]="",,"|n"&R1C10&RC[-23])&IF(RC[-22]="",,"|n"&R1C11&RC[-22])&IF(RC[-21]="",,"|n"&R1C12&RC[-21])&IF(RC[-19]&RC[-18]&RC[-17]&RC[-16]="",,"|n|n"&R1C13)&IF(RC[-19]="",,"|n"&R1C14&RC[-19])&IF(RC[-18]="",,"|n"&R1C15&RC[-18])&IF(RC[-17]="",,"|n"&R1C16&RC[-17])&IF(RC[-16]="",,"|n"&R1C17&RC[-16])&IF(RC[-15]="",,"|n"&R1C18&RC[-15])&IF(RC[-14]="",,"|n"&R1C19&RC[-14])&IF(RC[-13]="",,"|n"&R1C20&RC[-13])&IF(RC[-12]="",,"|n"&R1C21&RC[-12])&IF(RC[-11]="",,"|n"&R1C22&RC[-11])&IF(RC[-10]="",,"|n"&R1C23&RC[-10])&IF(RC[-9]="",,"|n"&R1C24&RC[-9])&IF(RC[-8]="",,"|n"&R1C25&RC[-8])&IF(RC[-7]="",,"|n"&R1C26&RC[-7])&IF(RC[-6]="",,"|n"&R1C27&RC[-6])&IF(RC[-5]="",,"|n"&R1C28&RC[-5])&IF(RC[-2]="",,"|n|n"&RC[-2]) -> |cFFFFFF99基础属性|r|n攻击:200000|n伤害增幅:7|n|n用于镶嵌到[剑,衣]上.|n镶嵌后不可取下!|n不需要的宝石可以在宠物处熔炼,用于宝石抽奖.
A131: 4 | B131: S | C131: [宝石] | D131: 空城泪 - 旧王愁 | G131: =IF(R[-99]C<>"",R[-99]C*25,"") ->  | H131: =IF(R[-99]C<>"",R[-99]C*25,"") ->  | I131: =IF(R[-99]C<>"",R[-99]C*25,"") ->  | J131: =IF(R[-99]C<>"",R[-99]C*25,"") ->  | K131: =IF(R[-99]C<>"",R[-99]C*25,"") -> 750000 | L131: =IF(R[-99]C<>"",INT(R[-99]C*4),"") -> 600 | M131: =IF(R[-99]C<>"",R[-99]C*16,"") ->  | O131: =IF(R[-99]C<>"",INT(R[-99]C*1.8),"") -> 1 | P131: =IF(R[-99]C<>"",INT(R[-99]C*1.8),"") ->  | Q131: =IF(R[-99]C<>"",INT(R[-99]C*1.8),"") ->  | R131: =IF(R[-99]C<>"",INT(R[-99]C*1.8),"") -> 7 | S131: =IF(R[-99]C<>"",INT(R[-99]C*1.8),"") ->  | T131: =IF(R[-99]C<>"",INT(R[-99]C*1.8),"") ->  | AE131: 用于镶嵌到[剑,衣]上.|n镶嵌后不可取下!|n不需要的宝石可以在宠物处熔炼,用于宝石抽奖. | AF131: =VLOOKUP(RC[-31],Sheet2!R13C1:R19C2,2,0)&"."&VLOOKUP(RC[-30],Sheet2!R7C1:R12C2,2,0)&VLOOKUP(RC[-30],Sheet2!R1C1:R6C2,2,0)&RC[-29]&RC[-28]&RC[-27]&Sheet2!R1C3 -> 四.绝|cFFFF9933[宝石]空城泪 - 旧王愁|r | AG131: =IF(RC[-26]&RC[-25]&RC[-24]&RC[-23]&RC[-22]&RC[-21]="",,R1C6)&IF(RC[-26]="",,"|n"&R1C7&RC[-26])&IF(RC[-25]="",,"|n"&R1C8&RC[-25])&IF(RC[-24]="",,"|n"&R1C9&RC[-24])&IF(RC[-23]="",,"|n"&R1C10&RC[-23])&IF(RC[-22]="",,"|n"&R1C11&RC[-22])&IF(RC[-21]="",,"|n"&R1C12&RC[-21])&IF(RC[-19]&RC[-18]&RC[-17]&RC[-16]="",,"|n|n"&R1C13)&IF(RC[-19]="",,"|n"&R1C14&RC[-19])&IF(RC[-18]="",,"|n"&R1C15&RC[-18])&IF(RC[-17]="",,"|n"&R1C16&RC[-17])&IF(RC[-16]="",,"|n"&R1C17&RC[-16])&IF(RC[-15]="",,"|n"&R1C18&RC[-15])&IF(RC[-14]="",,"|n"&R1C19&RC[-14])&IF(RC[-13]="",,"|n"&R1C20&RC[-13])&IF(RC[-12]="",,"|n"&R1C21&RC[-12])&IF(RC[-11]="",,"|n"&R1C22&RC[-11])&IF(RC[-10]="",,"|n"&R1C23&RC[-10])&IF(RC[-9]="",,"|n"&R1C24&RC[-9])&IF(RC[-8]="",,"|n"&R1C25&RC[-8])&IF(RC[-7]="",,"|n"&R1C26&RC[-7])&IF(RC[-6]="",,"|n"&R1C27&RC[-6])&IF(RC[-5]="",,"|n"&R1C28&RC[-5])&IF(RC[-2]="",,"|n|n"&RC[-2]) -> |cFFFFFF99基础属性|r|n血量:750000|n护甲:600|n|n|cFFFFFF55附加属性|r(%)|n攻击吸血:1|n伤害增幅:7|n|n用于镶嵌到[剑,衣]上.|n镶嵌后不可取下!|n不需要的宝石可以在宠物处熔炼,用于宝石抽奖.
A132: 4 | B132: S | C132: [宝石] | D132: 空城泪 - 故国恨 | G132: =IF(R[-99]C<>"",R[-99]C*25,"") -> 62500 | H132: =IF(R[-99]C<>"",R[-99]C*25,"") ->  | I132: =IF(R[-99]C<>"",R[-99]C*25,"") ->  | J132: =IF(R[-99]C<>"",R[-99]C*25,"") ->  | K132: =IF(R[-99]C<>"",R[-99]C*25,"") ->  | L132: =IF(R[-99]C<>"",INT(R[-99]C*4),"") ->  | M132: =IF(R[-99]C<>"",R[-99]C*16,"") ->  | O132: =IF(R[-99]C<>"",INT(R[-99]C*1.8),"") ->  | P132: =IF(R[-99]C<>"",INT(R[-99]C*1.8),"") -> 9 | Q132: =IF(R[-99]C<>"",INT(R[-99]C*1.8),"") -> 36 | R132: =IF(R[-99]C<>"",INT(R[-99]C*1.8),"") -> 7 | S132: =IF(R[-99]C<>"",INT(R[-99]C*1.8),"") ->  | T132: =IF(R[-99]C<>"",INT(R[-99]C*1.8),"") ->  | AE132: 用于镶嵌到[剑,衣]上.|n镶嵌后不可取下!|n不需要的宝石可以在宠物处熔炼,用于宝石抽奖. | AF132: =VLOOKUP(RC[-31],Sheet2!R13C1:R19C2,2,0)&"."&VLOOKUP(RC[-30],Sheet2!R7C1:R12C2,2,0)&VLOOKUP(RC[-30],Sheet2!R1C1:R6C2,2,0)&RC[-29]&RC[-28]&RC[-27]&Sheet2!R1C3 -> 四.绝|cFFFF9933[宝石]空城泪 - 故国恨|r | AG132: =IF(RC[-26]&RC[-25]&RC[-24]&RC[-23]&RC[-22]&RC[-21]="",,R1C6)&IF(RC[-26]="",,"|n"&R1C7&RC[-26])&IF(RC[-25]="",,"|n"&R1C8&RC[-25])&IF(RC[-24]="",,"|n"&R1C9&RC[-24])&IF(RC[-23]="",,"|n"&R1C10&RC[-23])&IF(RC[-22]="",,"|n"&R1C11&RC[-22])&IF(RC[-21]="",,"|n"&R1C12&RC[-21])&IF(RC[-19]&RC[-18]&RC[-17]&RC[-16]="",,"|n|n"&R1C13)&IF(RC[-19]="",,"|n"&R1C14&RC[-19])&IF(RC[-18]="",,"|n"&R1C15&RC[-18])&IF(RC[-17]="",,"|n"&R1C16&RC[-17])&IF(RC[-16]="",,"|n"&R1C17&RC[-16])&IF(RC[-15]="",,"|n"&R1C18&RC[-15])&IF(RC[-14]="",,"|n"&R1C19&RC[-14])&IF(RC[-13]="",,"|n"&R1C20&RC[-13])&IF(RC[-12]="",,"|n"&R1C21&RC[-12])&IF(RC[-11]="",,"|n"&R1C22&RC[-11])&IF(RC[-10]="",,"|n"&R1C23&RC[-10])&IF(RC[-9]="",,"|n"&R1C24&RC[-9])&IF(RC[-8]="",,"|n"&R1C25&RC[-8])&IF(RC[-7]="",,"|n"&R1C26&RC[-7])&IF(RC[-6]="",,"|n"&R1C27&RC[-6])&IF(RC[-5]="",,"|n"&R1C28&RC[-5])&IF(RC[-2]="",,"|n|n"&RC[-2]) -> |cFFFFFF99基础属性|r|n攻击:62500|n|n|cFFFFFF55附加属性|r(%)|n暴击概率:9|n暴击伤害:36|n伤害增幅:7|n|n用于镶嵌到[剑,衣]上.|n镶嵌后不可取下!|n不需要的宝石可以在宠物处熔炼,用于宝石抽奖.
A133: 4 | B133: X | C133: [宝石] | D133: 上古遗物 - 御世 | G133: =IF(R[-99]C<>"",R[-99]C*25,"") ->  | H133: =IF(R[-99]C<>"",R[-99]C*25,"") ->  | I133: =IF(R[-99]C<>"",R[-99]C*25,"") ->  | J133: =IF(R[-99]C<>"",R[-99]C*25,"") ->  | K133: =IF(R[-99]C<>"",R[-99]C*25,"") -> 1500000 | L133: =IF(R[-99]C<>"",INT(R[-99]C*4),"") -> 800 | M133: =IF(R[-99]C<>"",R[-99]C*16,"") ->  | O133: =IF(R[-99]C<>"",INT(R[-99]C*1.8),"") ->  | P133: =IF(R[-99]C<>"",INT(R[-99]C*1.8),"") ->  | Q133: =IF(R[-99]C<>"",INT(R[-99]C*1.8),"") -> 36 | R133: =IF(R[-99]C<>"",INT(R[-99]C*1.8),"") -> 14 | S133: =IF(R[-99]C<>"",INT(R[-99]C*1.8),"") ->  | T133: =IF(R[-99]C<>"",INT(R[-99]C*1.8),"") ->  | AE133: 用于镶嵌到[剑,衣]上.|n镶嵌后不可取下!|n不需要的宝石可以在宠物处熔炼,用于宝石抽奖. | AF133: =VLOOKUP(RC[-31],Sheet2!R13C1:R19C2,2,0)&"."&VLOOKUP(RC[-30],Sheet2!R7C1:R12C2,2,0)&VLOOKUP(RC[-30],Sheet2!R1C1:R6C2,2,0)&RC[-29]&RC[-28]&RC[-27]&Sheet2!R1C3 -> 四.神|Cffff0000[宝石]上古遗物 - 御世|r | AG133: =IF(RC[-26]&RC[-25]&RC[-24]&RC[-23]&RC[-22]&RC[-21]="",,R1C6)&IF(RC[-26]="",,"|n"&R1C7&RC[-26])&IF(RC[-25]="",,"|n"&R1C8&RC[-25])&IF(RC[-24]="",,"|n"&R1C9&RC[-24])&IF(RC[-23]="",,"|n"&R1C10&RC[-23])&IF(RC[-22]="",,"|n"&R1C11&RC[-22])&IF(RC[-21]="",,"|n"&R1C12&RC[-21])&IF(RC[-19]&RC[-18]&RC[-17]&RC[-16]="",,"|n|n"&R1C13)&IF(RC[-19]="",,"|n"&R1C14&RC[-19])&IF(RC[-18]="",,"|n"&R1C15&RC[-18])&IF(RC[-17]="",,"|n"&R1C16&RC[-17])&IF(RC[-16]="",,"|n"&R1C17&RC[-16])&IF(RC[-15]="",,"|n"&R1C18&RC[-15])&IF(RC[-14]="",,"|n"&R1C19&RC[-14])&IF(RC[-13]="",,"|n"&R1C20&RC[-13])&IF(RC[-12]="",,"|n"&R1C21&RC[-12])&IF(RC[-11]="",,"|n"&R1C22&RC[-11])&IF(RC[-10]="",,"|n"&R1C23&RC[-10])&IF(RC[-9]="",,"|n"&R1C24&RC[-9])&IF(RC[-8]="",,"|n"&R1C25&RC[-8])&IF(RC[-7]="",,"|n"&R1C26&RC[-7])&IF(RC[-6]="",,"|n"&R1C27&RC[-6])&IF(RC[-5]="",,"|n"&R1C28&RC[-5])&IF(RC[-2]="",,"|n|n"&RC[-2]) -> |cFFFFFF99基础属性|r|n血量:1500000|n护甲:800|n|n|cFFFFFF55附加属性|r(%)|n暴击伤害:36|n伤害增幅:14|n|n用于镶嵌到[剑,衣]上.|n镶嵌后不可取下!|n不需要的宝石可以在宠物处熔炼,用于宝石抽奖.
A134: 5 | B134: D | C134: [宝石] | D134: 幽冥 | G134: =IF(R[-132]C<>"",R[-132]C*60,"") ->  | H134: =IF(R[-132]C<>"",R[-132]C*60,"") ->  | I134: =IF(R[-132]C<>"",R[-132]C*60,"") ->  | J134: =IF(R[-132]C<>"",R[-132]C*60,"") ->  | K134: =IF(R[-132]C<>"",R[-132]C*60,"") ->  | L134: =IF(R[-132]C<>"",INT(R[-132]C*6),"") ->  | M134: =IF(R[-132]C<>"",R[-132]C*54,"") ->  | N134: =IF(R[-132]C<>"",INT(R[-132]C*2),"") ->  | O134: =IF(R[-132]C<>"",INT(R[-132]C*2),"") ->  | AE134: 用于镶嵌到[剑,衣]上.|n镶嵌后不可取下!|n不需要的宝石可以在宠物处熔炼,用于宝石抽奖. | AF134: =VLOOKUP(RC[-31],Sheet2!R13C1:R19C2,2,0)&"."&VLOOKUP(RC[-30],Sheet2!R7C1:R12C2,2,0)&VLOOKUP(RC[-30],Sheet2!R1C1:R6C2,2,0)&RC[-29]&RC[-28]&RC[-27]&Sheet2!R1C3 -> 五.丁|cFF999999[宝石]幽冥|r | AG134: =IF(RC[-26]&RC[-25]&RC[-24]&RC[-23]&RC[-22]&RC[-21]="",,R1C6)&IF(RC[-26]="",,"|n"&R1C7&RC[-26])&IF(RC[-25]="",,"|n"&R1C8&RC[-25])&IF(RC[-24]="",,"|n"&R1C9&RC[-24])&IF(RC[-23]="",,"|n"&R1C10&RC[-23])&IF(RC[-22]="",,"|n"&R1C11&RC[-22])&IF(RC[-21]="",,"|n"&R1C12&RC[-21])&IF(RC[-19]&RC[-18]&RC[-17]&RC[-16]="",,"|n|n"&R1C13)&IF(RC[-19]="",,"|n"&R1C14&RC[-19])&IF(RC[-18]="",,"|n"&R1C15&RC[-18])&IF(RC[-17]="",,"|n"&R1C16&RC[-17])&IF(RC[-16]="",,"|n"&R1C17&RC[-16])&IF(RC[-15]="",,"|n"&R1C18&RC[-15])&IF(RC[-14]="",,"|n"&R1C19&RC[-14])&IF(RC[-13]="",,"|n"&R1C20&RC[-13])&IF(RC[-12]="",,"|n"&R1C21&RC[-12])&IF(RC[-11]="",,"|n"&R1C22&RC[-11])&IF(RC[-10]="",,"|n"&R1C23&RC[-10])&IF(RC[-9]="",,"|n"&R1C24&RC[-9])&IF(RC[-8]="",,"|n"&R1C25&RC[-8])&IF(RC[-7]="",,"|n"&R1C26&RC[-7])&IF(RC[-6]="",,"|n"&R1C27&RC[-6])&IF(RC[-5]="",,"|n"&R1C28&RC[-5])&IF(RC[-2]="",,"|n|n"&RC[-2]) -> |n|n用于镶嵌到[剑,衣]上.|n镶嵌后不可取下!|n不需要的宝石可以在宠物处熔炼,用于宝石抽奖.
A135: 5 | B135: D | C135: [宝石] | D135: 天翔 | G135: =IF(R[-132]C<>"",R[-132]C*60,"") ->  | H135: =IF(R[-132]C<>"",R[-132]C*60,"") ->  | I135: =IF(R[-132]C<>"",R[-132]C*60,"") ->  | J135: =IF(R[-132]C<>"",R[-132]C*60,"") ->  | K135: =IF(R[-132]C<>"",R[-132]C*60,"") ->  | L135: =IF(R[-132]C<>"",INT(R[-132]C*6),"") ->  | M135: =IF(R[-132]C<>"",R[-132]C*54,"") ->  | N135: =IF(R[-132]C<>"",INT(R[-132]C*2),"") ->  | O135: =IF(R[-132]C<>"",INT(R[-132]C*2),"") ->  | AE135: 用于镶嵌到[剑,衣]上.|n镶嵌后不可取下!|n不需要的宝石可以在宠物处熔炼,用于宝石抽奖. | AF135: =VLOOKUP(RC[-31],Sheet2!R13C1:R19C2,2,0)&"."&VLOOKUP(RC[-30],Sheet2!R7C1:R12C2,2,0)&VLOOKUP(RC[-30],Sheet2!R1C1:R6C2,2,0)&RC[-29]&RC[-28]&RC[-27]&Sheet2!R1C3 -> 五.丁|cFF999999[宝石]天翔|r | AG135: =IF(RC[-26]&RC[-25]&RC[-24]&RC[-23]&RC[-22]&RC[-21]="",,R1C6)&IF(RC[-26]="",,"|n"&R1C7&RC[-26])&IF(RC[-25]="",,"|n"&R1C8&RC[-25])&IF(RC[-24]="",,"|n"&R1C9&RC[-24])&IF(RC[-23]="",,"|n"&R1C10&RC[-23])&IF(RC[-22]="",,"|n"&R1C11&RC[-22])&IF(RC[-21]="",,"|n"&R1C12&RC[-21])&IF(RC[-19]&RC[-18]&RC[-17]&RC[-16]="",,"|n|n"&R1C13)&IF(RC[-19]="",,"|n"&R1C14&RC[-19])&IF(RC[-18]="",,"|n"&R1C15&RC[-18])&IF(RC[-17]="",,"|n"&R1C16&RC[-17])&IF(RC[-16]="",,"|n"&R1C17&RC[-16])&IF(RC[-15]="",,"|n"&R1C18&RC[-15])&IF(RC[-14]="",,"|n"&R1C19&RC[-14])&IF(RC[-13]="",,"|n"&R1C20&RC[-13])&IF(RC[-12]="",,"|n"&R1C21&RC[-12])&IF(RC[-11]="",,"|n"&R1C22&RC[-11])&IF(RC[-10]="",,"|n"&R1C23&RC[-10])&IF(RC[-9]="",,"|n"&R1C24&RC[-9])&IF(RC[-8]="",,"|n"&R1C25&RC[-8])&IF(RC[-7]="",,"|n"&R1C26&RC[-7])&IF(RC[-6]="",,"|n"&R1C27&RC[-6])&IF(RC[-5]="",,"|n"&R1C28&RC[-5])&IF(RC[-2]="",,"|n|n"&RC[-2]) -> |n|n用于镶嵌到[剑,衣]上.|n镶嵌后不可取下!|n不需要的宝石可以在宠物处熔炼,用于宝石抽奖.
A136: 5 | B136: D | C136: [宝石] | D136: 白焰 | G136: =IF(R[-132]C<>"",R[-132]C*60,"") ->  | H136: =IF(R[-132]C<>"",R[-132]C*60,"") ->  | I136: =IF(R[-132]C<>"",R[-132]C*60,"") ->  | J136: =IF(R[-132]C<>"",R[-132]C*60,"") ->  | K136: =IF(R[-132]C<>"",R[-132]C*60,"") ->  | L136: =IF(R[-132]C<>"",INT(R[-132]C*6),"") ->  | M136: =IF(R[-132]C<>"",R[-132]C*54,"") ->  | N136: =IF(R[-132]C<>"",INT(R[-132]C*2),"") ->  | O136: =IF(R[-132]C<>"",INT(R[-132]C*2),"") ->  | AE136: 用于镶嵌到[剑,衣]上.|n镶嵌后不可取下!|n不需要的宝石可以在宠物处熔炼,用于宝石抽奖. | AF136: =VLOOKUP(RC[-31],Sheet2!R13C1:R19C2,2,0)&"."&VLOOKUP(RC[-30],Sheet2!R7C1:R12C2,2,0)&VLOOKUP(RC[-30],Sheet2!R1C1:R6C2,2,0)&RC[-29]&RC[-28]&RC[-27]&Sheet2!R1C3 -> 五.丁|cFF999999[宝石]白焰|r | AG136: =IF(RC[-26]&RC[-25]&RC[-24]&RC[-23]&RC[-22]&RC[-21]="",,R1C6)&IF(RC[-26]="",,"|n"&R1C7&RC[-26])&IF(RC[-25]="",,"|n"&R1C8&RC[-25])&IF(RC[-24]="",,"|n"&R1C9&RC[-24])&IF(RC[-23]="",,"|n"&R1C10&RC[-23])&IF(RC[-22]="",,"|n"&R1C11&RC[-22])&IF(RC[-21]="",,"|n"&R1C12&RC[-21])&IF(RC[-19]&RC[-18]&RC[-17]&RC[-16]="",,"|n|n"&R1C13)&IF(RC[-19]="",,"|n"&R1C14&RC[-19])&IF(RC[-18]="",,"|n"&R1C15&RC[-18])&IF(RC[-17]="",,"|n"&R1C16&RC[-17])&IF(RC[-16]="",,"|n"&R1C17&RC[-16])&IF(RC[-15]="",,"|n"&R1C18&RC[-15])&IF(RC[-14]="",,"|n"&R1C19&RC[-14])&IF(RC[-13]="",,"|n"&R1C20&RC[-13])&IF(RC[-12]="",,"|n"&R1C21&RC[-12])&IF(RC[-11]="",,"|n"&R1C22&RC[-11])&IF(RC[-10]="",,"|n"&R1C23&RC[-10])&IF(RC[-9]="",,"|n"&R1C24&RC[-9])&IF(RC[-8]="",,"|n"&R1C25&RC[-8])&IF(RC[-7]="",,"|n"&R1C26&RC[-7])&IF(RC[-6]="",,"|n"&R1C27&RC[-6])&IF(RC[-5]="",,"|n"&R1C28&RC[-5])&IF(RC[-2]="",,"|n|n"&RC[-2]) -> |n|n用于镶嵌到[剑,衣]上.|n镶嵌后不可取下!|n不需要的宝石可以在宠物处熔炼,用于宝石抽奖.
A137: 5 | B137: D | C137: [宝石] | D137: 血龙 | G137: =IF(R[-132]C<>"",R[-132]C*60,"") ->  | H137: =IF(R[-132]C<>"",R[-132]C*60,"") ->  | I137: =IF(R[-132]C<>"",R[-132]C*60,"") ->  | J137: =IF(R[-132]C<>"",R[-132]C*60,"") ->  | K137: =IF(R[-132]C<>"",R[-132]C*60,"") ->  | L137: =IF(R[-132]C<>"",INT(R[-132]C*6),"") ->  | M137: =IF(R[-132]C<>"",R[-132]C*54,"") ->  | N137: =IF(R[-132]C<>"",INT(R[-132]C*2),"") ->  | O137: =IF(R[-132]C<>"",INT(R[-132]C*2),"") ->  | AE137: 用于镶嵌到[剑,衣]上.|n镶嵌后不可取下!|n不需要的宝石可以在宠物处熔炼,用于宝石抽奖. | AF137: =VLOOKUP(RC[-31],Sheet2!R13C1:R19C2,2,0)&"."&VLOOKUP(RC[-30],Sheet2!R7C1:R12C2,2,0)&VLOOKUP(RC[-30],Sheet2!R1C1:R6C2,2,0)&RC[-29]&RC[-28]&RC[-27]&Sheet2!R1C3 -> 五.丁|cFF999999[宝石]血龙|r | AG137: =IF(RC[-26]&RC[-25]&RC[-24]&RC[-23]&RC[-22]&RC[-21]="",,R1C6)&IF(RC[-26]="",,"|n"&R1C7&RC[-26])&IF(RC[-25]="",,"|n"&R1C8&RC[-25])&IF(RC[-24]="",,"|n"&R1C9&RC[-24])&IF(RC[-23]="",,"|n"&R1C10&RC[-23])&IF(RC[-22]="",,"|n"&R1C11&RC[-22])&IF(RC[-21]="",,"|n"&R1C12&RC[-21])&IF(RC[-19]&RC[-18]&RC[-17]&RC[-16]="",,"|n|n"&R1C13)&IF(RC[-19]="",,"|n"&R1C14&RC[-19])&IF(RC[-18]="",,"|n"&R1C15&RC[-18])&IF(RC[-17]="",,"|n"&R1C16&RC[-17])&IF(RC[-16]="",,"|n"&R1C17&RC[-16])&IF(RC[-15]="",,"|n"&R1C18&RC[-15])&IF(RC[-14]="",,"|n"&R1C19&RC[-14])&IF(RC[-13]="",,"|n"&R1C20&RC[-13])&IF(RC[-12]="",,"|n"&R1C21&RC[-12])&IF(RC[-11]="",,"|n"&R1C22&RC[-11])&IF(RC[-10]="",,"|n"&R1C23&RC[-10])&IF(RC[-9]="",,"|n"&R1C24&RC[-9])&IF(RC[-8]="",,"|n"&R1C25&RC[-8])&IF(RC[-7]="",,"|n"&R1C26&RC[-7])&IF(RC[-6]="",,"|n"&R1C27&RC[-6])&IF(RC[-5]="",,"|n"&R1C28&RC[-5])&IF(RC[-2]="",,"|n|n"&RC[-2]) -> |n|n用于镶嵌到[剑,衣]上.|n镶嵌后不可取下!|n不需要的宝石可以在宠物处熔炼,用于宝石抽奖.
A138: 5 | B138: D | C138: [宝石] | D138: 暗影 | G138: =IF(R[-132]C<>"",R[-132]C*60,"") ->  | H138: =IF(R[-132]C<>"",R[-132]C*60,"") ->  | I138: =IF(R[-132]C<>"",R[-132]C*60,"") ->  | J138: =IF(R[-132]C<>"",R[-132]C*60,"") ->  | K138: =IF(R[-132]C<>"",R[-132]C*60,"") ->  | L138: =IF(R[-132]C<>"",INT(R[-132]C*6),"") ->  | M138: =IF(R[-132]C<>"",R[-132]C*54,"") ->  | N138: =IF(R[-132]C<>"",INT(R[-132]C*2),"") ->  | O138: =IF(R[-132]C<>"",INT(R[-132]C*2),"") ->  | AE138: 用于镶嵌到[剑,衣]上.|n镶嵌后不可取下!|n不需要的宝石可以在宠物处熔炼,用于宝石抽奖. | AF138: =VLOOKUP(RC[-31],Sheet2!R13C1:R19C2,2,0)&"."&VLOOKUP(RC[-30],Sheet2!R7C1:R12C2,2,0)&VLOOKUP(RC[-30],Sheet2!R1C1:R6C2,2,0)&RC[-29]&RC[-28]&RC[-27]&Sheet2!R1C3 -> 五.丁|cFF999999[宝石]暗影|r | AG138: =IF(RC[-26]&RC[-25]&RC[-24]&RC[-23]&RC[-22]&RC[-21]="",,R1C6)&IF(RC[-26]="",,"|n"&R1C7&RC[-26])&IF(RC[-25]="",,"|n"&R1C8&RC[-25])&IF(RC[-24]="",,"|n"&R1C9&RC[-24])&IF(RC[-23]="",,"|n"&R1C10&RC[-23])&IF(RC[-22]="",,"|n"&R1C11&RC[-22])&IF(RC[-21]="",,"|n"&R1C12&RC[-21])&IF(RC[-19]&RC[-18]&RC[-17]&RC[-16]="",,"|n|n"&R1C13)&IF(RC[-19]="",,"|n"&R1C14&RC[-19])&IF(RC[-18]="",,"|n"&R1C15&RC[-18])&IF(RC[-17]="",,"|n"&R1C16&RC[-17])&IF(RC[-16]="",,"|n"&R1C17&RC[-16])&IF(RC[-15]="",,"|n"&R1C18&RC[-15])&IF(RC[-14]="",,"|n"&R1C19&RC[-14])&IF(RC[-13]="",,"|n"&R1C20&RC[-13])&IF(RC[-12]="",,"|n"&R1C21&RC[-12])&IF(RC[-11]="",,"|n"&R1C22&RC[-11])&IF(RC[-10]="",,"|n"&R1C23&RC[-10])&IF(RC[-9]="",,"|n"&R1C24&RC[-9])&IF(RC[-8]="",,"|n"&R1C25&RC[-8])&IF(RC[-7]="",,"|n"&R1C26&RC[-7])&IF(RC[-6]="",,"|n"&R1C27&RC[-6])&IF(RC[-5]="",,"|n"&R1C28&RC[-5])&IF(RC[-2]="",,"|n|n"&RC[-2]) -> |n|n用于镶嵌到[剑,衣]上.|n镶嵌后不可取下!|n不需要的宝石可以在宠物处熔炼,用于宝石抽奖.
A139: 5 | B139: D | C139: [宝石] | D139: 罡风 | G139: =IF(R[-132]C<>"",R[-132]C*60,"") ->  | H139: =IF(R[-132]C<>"",R[-132]C*60,"") ->  | I139: =IF(R[-132]C<>"",R[-132]C*60,"") ->  | J139: =IF(R[-132]C<>"",R[-132]C*60,"") ->  | K139: =IF(R[-132]C<>"",R[-132]C*60,"") ->  | L139: =IF(R[-132]C<>"",INT(R[-132]C*6),"") ->  | M139: =IF(R[-132]C<>"",R[-132]C*54,"") ->  | N139: =IF(R[-132]C<>"",INT(R[-132]C*2),"") ->  | O139: =IF(R[-132]C<>"",INT(R[-132]C*2),"") ->  | AE139: 用于镶嵌到[剑,衣]上.|n镶嵌后不可取下!|n不需要的宝石可以在宠物处熔炼,用于宝石抽奖. | AF139: =VLOOKUP(RC[-31],Sheet2!R13C1:R19C2,2,0)&"."&VLOOKUP(RC[-30],Sheet2!R7C1:R12C2,2,0)&VLOOKUP(RC[-30],Sheet2!R1C1:R6C2,2,0)&RC[-29]&RC[-28]&RC[-27]&Sheet2!R1C3 -> 五.丁|cFF999999[宝石]罡风|r | AG139: =IF(RC[-26]&RC[-25]&RC[-24]&RC[-23]&RC[-22]&RC[-21]="",,R1C6)&IF(RC[-26]="",,"|n"&R1C7&RC[-26])&IF(RC[-25]="",,"|n"&R1C8&RC[-25])&IF(RC[-24]="",,"|n"&R1C9&RC[-24])&IF(RC[-23]="",,"|n"&R1C10&RC[-23])&IF(RC[-22]="",,"|n"&R1C11&RC[-22])&IF(RC[-21]="",,"|n"&R1C12&RC[-21])&IF(RC[-19]&RC[-18]&RC[-17]&RC[-16]="",,"|n|n"&R1C13)&IF(RC[-19]="",,"|n"&R1C14&RC[-19])&IF(RC[-18]="",,"|n"&R1C15&RC[-18])&IF(RC[-17]="",,"|n"&R1C16&RC[-17])&IF(RC[-16]="",,"|n"&R1C17&RC[-16])&IF(RC[-15]="",,"|n"&R1C18&RC[-15])&IF(RC[-14]="",,"|n"&R1C19&RC[-14])&IF(RC[-13]="",,"|n"&R1C20&RC[-13])&IF(RC[-12]="",,"|n"&R1C21&RC[-12])&IF(RC[-11]="",,"|n"&R1C22&RC[-11])&IF(RC[-10]="",,"|n"&R1C23&RC[-10])&IF(RC[-9]="",,"|n"&R1C24&RC[-9])&IF(RC[-8]="",,"|n"&R1C25&RC[-8])&IF(RC[-7]="",,"|n"&R1C26&RC[-7])&IF(RC[-6]="",,"|n"&R1C27&RC[-6])&IF(RC[-5]="",,"|n"&R1C28&RC[-5])&IF(RC[-2]="",,"|n|n"&RC[-2]) -> |n|n用于镶嵌到[剑,衣]上.|n镶嵌后不可取下!|n不需要的宝石可以在宠物处熔炼,用于宝石抽奖.
A140: 5 | B140: D | C140: [宝石] | D140: 穿心 | G140: =IF(R[-132]C<>"",R[-132]C*60,"") ->  | H140: =IF(R[-132]C<>"",R[-132]C*60,"") ->  | I140: =IF(R[-132]C<>"",R[-132]C*60,"") ->  | J140: =IF(R[-132]C<>"",R[-132]C*60,"") ->  | K140: =IF(R[-132]C<>"",R[-132]C*60,"") ->  | L140: =IF(R[-132]C<>"",INT(R[-132]C*6),"") ->  | M140: =IF(R[-132]C<>"",R[-132]C*54,"") ->  | N140: =IF(R[-132]C<>"",INT(R[-132]C*2),"") ->  | O140: =IF(R[-132]C<>"",INT(R[-132]C*2),"") ->  | AE140: 用于镶嵌到[剑,衣]上.|n镶嵌后不可取下!|n不需要的宝石可以在宠物处熔炼,用于宝石抽奖. | AF140: =VLOOKUP(RC[-31],Sheet2!R13C1:R19C2,2,0)&"."&VLOOKUP(RC[-30],Sheet2!R7C1:R12C2,2,0)&VLOOKUP(RC[-30],Sheet2!R1C1:R6C2,2,0)&RC[-29]&RC[-28]&RC[-27]&Sheet2!R1C3 -> 五.丁|cFF999999[宝石]穿心|r | AG140: =IF(RC[-26]&RC[-25]&RC[-24]&RC[-23]&RC[-22]&RC[-21]="",,R1C6)&IF(RC[-26]="",,"|n"&R1C7&RC[-26])&IF(RC[-25]="",,"|n"&R1C8&RC[-25])&IF(RC[-24]="",,"|n"&R1C9&RC[-24])&IF(RC[-23]="",,"|n"&R1C10&RC[-23])&IF(RC[-22]="",,"|n"&R1C11&RC[-22])&IF(RC[-21]="",,"|n"&R1C12&RC[-21])&IF(RC[-19]&RC[-18]&RC[-17]&RC[-16]="",,"|n|n"&R1C13)&IF(RC[-19]="",,"|n"&R1C14&RC[-19])&IF(RC[-18]="",,"|n"&R1C15&RC[-18])&IF(RC[-17]="",,"|n"&R1C16&RC[-17])&IF(RC[-16]="",,"|n"&R1C17&RC[-16])&IF(RC[-15]="",,"|n"&R1C18&RC[-15])&IF(RC[-14]="",,"|n"&R1C19&RC[-14])&IF(RC[-13]="",,"|n"&R1C20&RC[-13])&IF(RC[-12]="",,"|n"&R1C21&RC[-12])&IF(RC[-11]="",,"|n"&R1C22&RC[-11])&IF(RC[-10]="",,"|n"&R1C23&RC[-10])&IF(RC[-9]="",,"|n"&R1C24&RC[-9])&IF(RC[-8]="",,"|n"&R1C25&RC[-8])&IF(RC[-7]="",,"|n"&R1C26&RC[-7])&IF(RC[-6]="",,"|n"&R1C27&RC[-6])&IF(RC[-5]="",,"|n"&R1C28&RC[-5])&IF(RC[-2]="",,"|n|n"&RC[-2]) -> |n|n用于镶嵌到[剑,衣]上.|n镶嵌后不可取下!|n不需要的宝石可以在宠物处熔炼,用于宝石抽奖.
A141: 5 | B141: D | C141: [宝石] | D141: 青涛 | G141: =IF(R[-132]C<>"",R[-132]C*60,"") ->  | H141: =IF(R[-132]C<>"",R[-132]C*60,"") ->  | I141: =IF(R[-132]C<>"",R[-132]C*60,"") ->  | J141: =IF(R[-132]C<>"",R[-132]C*60,"") ->  | K141: =IF(R[-132]C<>"",R[-132]C*60,"") ->  | L141: =IF(R[-132]C<>"",INT(R[-132]C*6),"") ->  | M141: =IF(R[-132]C<>"",R[-132]C*54,"") ->  | N141: =IF(R[-132]C<>"",INT(R[-132]C*2),"") ->  | O141: =IF(R[-132]C<>"",INT(R[-132]C*2),"") ->  | AE141: 用于镶嵌到[剑,衣]上.|n镶嵌后不可取下!|n不需要的宝石可以在宠物处熔炼,用于宝石抽奖. | AF141: =VLOOKUP(RC[-31],Sheet2!R13C1:R19C2,2,0)&"."&VLOOKUP(RC[-30],Sheet2!R7C1:R12C2,2,0)&VLOOKUP(RC[-30],Sheet2!R1C1:R6C2,2,0)&RC[-29]&RC[-28]&RC[-27]&Sheet2!R1C3 -> 五.丁|cFF999999[宝石]青涛|r | AG141: =IF(RC[-26]&RC[-25]&RC[-24]&RC[-23]&RC[-22]&RC[-21]="",,R1C6)&IF(RC[-26]="",,"|n"&R1C7&RC[-26])&IF(RC[-25]="",,"|n"&R1C8&RC[-25])&IF(RC[-24]="",,"|n"&R1C9&RC[-24])&IF(RC[-23]="",,"|n"&R1C10&RC[-23])&IF(RC[-22]="",,"|n"&R1C11&RC[-22])&IF(RC[-21]="",,"|n"&R1C12&RC[-21])&IF(RC[-19]&RC[-18]&RC[-17]&RC[-16]="",,"|n|n"&R1C13)&IF(RC[-19]="",,"|n"&R1C14&RC[-19])&IF(RC[-18]="",,"|n"&R1C15&RC[-18])&IF(RC[-17]="",,"|n"&R1C16&RC[-17])&IF(RC[-16]="",,"|n"&R1C17&RC[-16])&IF(RC[-15]="",,"|n"&R1C18&RC[-15])&IF(RC[-14]="",,"|n"&R1C19&RC[-14])&IF(RC[-13]="",,"|n"&R1C20&RC[-13])&IF(RC[-12]="",,"|n"&R1C21&RC[-12])&IF(RC[-11]="",,"|n"&R1C22&RC[-11])&IF(RC[-10]="",,"|n"&R1C23&RC[-10])&IF(RC[-9]="",,"|n"&R1C24&RC[-9])&IF(RC[-8]="",,"|n"&R1C25&RC[-8])&IF(RC[-7]="",,"|n"&R1C26&RC[-7])&IF(RC[-6]="",,"|n"&R1C27&RC[-6])&IF(RC[-5]="",,"|n"&R1C28&RC[-5])&IF(RC[-2]="",,"|n|n"&RC[-2]) -> |n|n用于镶嵌到[剑,衣]上.|n镶嵌后不可取下!|n不需要的宝石可以在宠物处熔炼,用于宝石抽奖.
A142: 5 | B142: D | C142: [宝石] | D142: 遮那 | G142: =IF(R[-132]C<>"",R[-132]C*60,"") ->  | H142: =IF(R[-132]C<>"",R[-132]C*60,"") ->  | I142: =IF(R[-132]C<>"",R[-132]C*60,"") ->  | J142: =IF(R[-132]C<>"",R[-132]C*60,"") ->  | K142: =IF(R[-132]C<>"",R[-132]C*60,"") ->  | L142: =IF(R[-132]C<>"",INT(R[-132]C*6),"") ->  | M142: =IF(R[-132]C<>"",R[-132]C*54,"") ->  | N142: =IF(R[-132]C<>"",INT(R[-132]C*2),"") ->  | O142: =IF(R[-132]C<>"",INT(R[-132]C*2),"") ->  | AE142: 用于镶嵌到[剑,衣]上.|n镶嵌后不可取下!|n不需要的宝石可以在宠物处熔炼,用于宝石抽奖. | AF142: =VLOOKUP(RC[-31],Sheet2!R13C1:R19C2,2,0)&"."&VLOOKUP(RC[-30],Sheet2!R7C1:R12C2,2,0)&VLOOKUP(RC[-30],Sheet2!R1C1:R6C2,2,0)&RC[-29]&RC[-28]&RC[-27]&Sheet2!R1C3 -> 五.丁|cFF999999[宝石]遮那|r | AG142: =IF(RC[-26]&RC[-25]&RC[-24]&RC[-23]&RC[-22]&RC[-21]="",,R1C6)&IF(RC[-26]="",,"|n"&R1C7&RC[-26])&IF(RC[-25]="",,"|n"&R1C8&RC[-25])&IF(RC[-24]="",,"|n"&R1C9&RC[-24])&IF(RC[-23]="",,"|n"&R1C10&RC[-23])&IF(RC[-22]="",,"|n"&R1C11&RC[-22])&IF(RC[-21]="",,"|n"&R1C12&RC[-21])&IF(RC[-19]&RC[-18]&RC[-17]&RC[-16]="",,"|n|n"&R1C13)&IF(RC[-19]="",,"|n"&R1C14&RC[-19])&IF(RC[-18]="",,"|n"&R1C15&RC[-18])&IF(RC[-17]="",,"|n"&R1C16&RC[-17])&IF(RC[-16]="",,"|n"&R1C17&RC[-16])&IF(RC[-15]="",,"|n"&R1C18&RC[-15])&IF(RC[-14]="",,"|n"&R1C19&RC[-14])&IF(RC[-13]="",,"|n"&R1C20&RC[-13])&IF(RC[-12]="",,"|n"&R1C21&RC[-12])&IF(RC[-11]="",,"|n"&R1C22&RC[-11])&IF(RC[-10]="",,"|n"&R1C23&RC[-10])&IF(RC[-9]="",,"|n"&R1C24&RC[-9])&IF(RC[-8]="",,"|n"&R1C25&RC[-8])&IF(RC[-7]="",,"|n"&R1C26&RC[-7])&IF(RC[-6]="",,"|n"&R1C27&RC[-6])&IF(RC[-5]="",,"|n"&R1C28&RC[-5])&IF(RC[-2]="",,"|n|n"&RC[-2]) -> |n|n用于镶嵌到[剑,衣]上.|n镶嵌后不可取下!|n不需要的宝石可以在宠物处熔炼,用于宝石抽奖.
A143: 5 | B143: D | C143: [宝石] | D143: 通神 | G143: =IF(R[-132]C<>"",R[-132]C*60,"") ->  | H143: =IF(R[-132]C<>"",R[-132]C*60,"") ->  | I143: =IF(R[-132]C<>"",R[-132]C*60,"") ->  | J143: =IF(R[-132]C<>"",R[-132]C*60,"") ->  | K143: =IF(R[-132]C<>"",R[-132]C*60,"") ->  | L143: =IF(R[-132]C<>"",INT(R[-132]C*6),"") ->  | M143: =IF(R[-132]C<>"",R[-132]C*54,"") ->  | N143: =IF(R[-132]C<>"",INT(R[-132]C*2),"") ->  | O143: =IF(R[-132]C<>"",INT(R[-132]C*2),"") ->  | AE143: 用于镶嵌到[剑,衣]上.|n镶嵌后不可取下!|n不需要的宝石可以在宠物处熔炼,用于宝石抽奖. | AF143: =VLOOKUP(RC[-31],Sheet2!R13C1:R19C2,2,0)&"."&VLOOKUP(RC[-30],Sheet2!R7C1:R12C2,2,0)&VLOOKUP(RC[-30],Sheet2!R1C1:R6C2,2,0)&RC[-29]&RC[-28]&RC[-27]&Sheet2!R1C3 -> 五.丁|cFF999999[宝石]通神|r | AG143: =IF(RC[-26]&RC[-25]&RC[-24]&RC[-23]&RC[-22]&RC[-21]="",,R1C6)&IF(RC[-26]="",,"|n"&R1C7&RC[-26])&IF(RC[-25]="",,"|n"&R1C8&RC[-25])&IF(RC[-24]="",,"|n"&R1C9&RC[-24])&IF(RC[-23]="",,"|n"&R1C10&RC[-23])&IF(RC[-22]="",,"|n"&R1C11&RC[-22])&IF(RC[-21]="",,"|n"&R1C12&RC[-21])&IF(RC[-19]&RC[-18]&RC[-17]&RC[-16]="",,"|n|n"&R1C13)&IF(RC[-19]="",,"|n"&R1C14&RC[-19])&IF(RC[-18]="",,"|n"&R1C15&RC[-18])&IF(RC[-17]="",,"|n"&R1C16&RC[-17])&IF(RC[-16]="",,"|n"&R1C17&RC[-16])&IF(RC[-15]="",,"|n"&R1C18&RC[-15])&IF(RC[-14]="",,"|n"&R1C19&RC[-14])&IF(RC[-13]="",,"|n"&R1C20&RC[-13])&IF(RC[-12]="",,"|n"&R1C21&RC[-12])&IF(RC[-11]="",,"|n"&R1C22&RC[-11])&IF(RC[-10]="",,"|n"&R1C23&RC[-10])&IF(RC[-9]="",,"|n"&R1C24&RC[-9])&IF(RC[-8]="",,"|n"&R1C25&RC[-8])&IF(RC[-7]="",,"|n"&R1C26&RC[-7])&IF(RC[-6]="",,"|n"&R1C27&RC[-6])&IF(RC[-5]="",,"|n"&R1C28&RC[-5])&IF(RC[-2]="",,"|n|n"&RC[-2]) -> |n|n用于镶嵌到[剑,衣]上.|n镶嵌后不可取下!|n不需要的宝石可以在宠物处熔炼,用于宝石抽奖.
A144: 5 | B144: D | C144: [宝石] | D144: 神鹰 | G144: =IF(R[-132]C<>"",R[-132]C*60,"") ->  | H144: =IF(R[-132]C<>"",R[-132]C*60,"") ->  | I144: =IF(R[-132]C<>"",R[-132]C*60,"") ->  | J144: =IF(R[-132]C<>"",R[-132]C*60,"") ->  | K144: =IF(R[-132]C<>"",R[-132]C*60,"") ->  | L144: =IF(R[-132]C<>"",INT(R[-132]C*6),"") ->  | M144: =IF(R[-132]C<>"",R[-132]C*54,"") ->  | N144: =IF(R[-132]C<>"",INT(R[-132]C*2),"") ->  | O144: =IF(R[-132]C<>"",INT(R[-132]C*2),"") ->  | AE144: 用于镶嵌到[剑,衣]上.|n镶嵌后不可取下!|n不需要的宝石可以在宠物处熔炼,用于宝石抽奖. | AF144: =VLOOKUP(RC[-31],Sheet2!R13C1:R19C2,2,0)&"."&VLOOKUP(RC[-30],Sheet2!R7C1:R12C2,2,0)&VLOOKUP(RC[-30],Sheet2!R1C1:R6C2,2,0)&RC[-29]&RC[-28]&RC[-27]&Sheet2!R1C3 -> 五.丁|cFF999999[宝石]神鹰|r | AG144: =IF(RC[-26]&RC[-25]&RC[-24]&RC[-23]&RC[-22]&RC[-21]="",,R1C6)&IF(RC[-26]="",,"|n"&R1C7&RC[-26])&IF(RC[-25]="",,"|n"&R1C8&RC[-25])&IF(RC[-24]="",,"|n"&R1C9&RC[-24])&IF(RC[-23]="",,"|n"&R1C10&RC[-23])&IF(RC[-22]="",,"|n"&R1C11&RC[-22])&IF(RC[-21]="",,"|n"&R1C12&RC[-21])&IF(RC[-19]&RC[-18]&RC[-17]&RC[-16]="",,"|n|n"&R1C13)&IF(RC[-19]="",,"|n"&R1C14&RC[-19])&IF(RC[-18]="",,"|n"&R1C15&RC[-18])&IF(RC[-17]="",,"|n"&R1C16&RC[-17])&IF(RC[-16]="",,"|n"&R1C17&RC[-16])&IF(RC[-15]="",,"|n"&R1C18&RC[-15])&IF(RC[-14]="",,"|n"&R1C19&RC[-14])&IF(RC[-13]="",,"|n"&R1C20&RC[-13])&IF(RC[-12]="",,"|n"&R1C21&RC[-12])&IF(RC[-11]="",,"|n"&R1C22&RC[-11])&IF(RC[-10]="",,"|n"&R1C23&RC[-10])&IF(RC[-9]="",,"|n"&R1C24&RC[-9])&IF(RC[-8]="",,"|n"&R1C25&RC[-8])&IF(RC[-7]="",,"|n"&R1C26&RC[-7])&IF(RC[-6]="",,"|n"&R1C27&RC[-6])&IF(RC[-5]="",,"|n"&R1C28&RC[-5])&IF(RC[-2]="",,"|n|n"&RC[-2]) -> |n|n用于镶嵌到[剑,衣]上.|n镶嵌后不可取下!|n不需要的宝石可以在宠物处熔炼,用于宝石抽奖.
A145: 5 | B145: D | C145: [宝石] | D145: 蓝布 | G145: =IF(R[-132]C<>"",R[-132]C*60,"") ->  | H145: =IF(R[-132]C<>"",R[-132]C*60,"") ->  | I145: =IF(R[-132]C<>"",R[-132]C*60,"") ->  | J145: =IF(R[-132]C<>"",R[-132]C*60,"") ->  | K145: =IF(R[-132]C<>"",R[-132]C*60,"") ->  | L145: =IF(R[-132]C<>"",INT(R[-132]C*6),"") ->  | M145: =IF(R[-132]C<>"",R[-132]C*54,"") ->  | N145: =IF(R[-132]C<>"",INT(R[-132]C*2),"") ->  | O145: =IF(R[-132]C<>"",INT(R[-132]C*2),"") ->  | AE145: 用于镶嵌到[剑,衣]上.|n镶嵌后不可取下!|n不需要的宝石可以在宠物处熔炼,用于宝石抽奖. | AF145: =VLOOKUP(RC[-31],Sheet2!R13C1:R19C2,2,0)&"."&VLOOKUP(RC[-30],Sheet2!R7C1:R12C2,2,0)&VLOOKUP(RC[-30],Sheet2!R1C1:R6C2,2,0)&RC[-29]&RC[-28]&RC[-27]&Sheet2!R1C3 -> 五.丁|cFF999999[宝石]蓝布|r | AG145: =IF(RC[-26]&RC[-25]&RC[-24]&RC[-23]&RC[-22]&RC[-21]="",,R1C6)&IF(RC[-26]="",,"|n"&R1C7&RC[-26])&IF(RC[-25]="",,"|n"&R1C8&RC[-25])&IF(RC[-24]="",,"|n"&R1C9&RC[-24])&IF(RC[-23]="",,"|n"&R1C10&RC[-23])&IF(RC[-22]="",,"|n"&R1C11&RC[-22])&IF(RC[-21]="",,"|n"&R1C12&RC[-21])&IF(RC[-19]&RC[-18]&RC[-17]&RC[-16]="",,"|n|n"&R1C13)&IF(RC[-19]="",,"|n"&R1C14&RC[-19])&IF(RC[-18]="",,"|n"&R1C15&RC[-18])&IF(RC[-17]="",,"|n"&R1C16&RC[-17])&IF(RC[-16]="",,"|n"&R1C17&RC[-16])&IF(RC[-15]="",,"|n"&R1C18&RC[-15])&IF(RC[-14]="",,"|n"&R1C19&RC[-14])&IF(RC[-13]="",,"|n"&R1C20&RC[-13])&IF(RC[-12]="",,"|n"&R1C21&RC[-12])&IF(RC[-11]="",,"|n"&R1C22&RC[-11])&IF(RC[-10]="",,"|n"&R1C23&RC[-10])&IF(RC[-9]="",,"|n"&R1C24&RC[-9])&IF(RC[-8]="",,"|n"&R1C25&RC[-8])&IF(RC[-7]="",,"|n"&R1C26&RC[-7])&IF(RC[-6]="",,"|n"&R1C27&RC[-6])&IF(RC[-5]="",,"|n"&R1C28&RC[-5])&IF(RC[-2]="",,"|n|n"&RC[-2]) -> |n|n用于镶嵌到[剑,衣]上.|n镶嵌后不可取下!|n不需要的宝石可以在宠物处熔炼,用于宝石抽奖.
A146: 5 | B146: D | C146: [宝石] | D146: 紫云 | G146: =IF(R[-132]C<>"",R[-132]C*60,"") ->  | H146: =IF(R[-132]C<>"",R[-132]C*60,"") ->  | I146: =IF(R[-132]C<>"",R[-132]C*60,"") ->  | J146: =IF(R[-132]C<>"",R[-132]C*60,"") ->  | K146: =IF(R[-132]C<>"",R[-132]C*60,"") ->  | L146: =IF(R[-132]C<>"",INT(R[-132]C*6),"") ->  | M146: =IF(R[-132]C<>"",R[-132]C*54,"") ->  | N146: =IF(R[-132]C<>"",INT(R[-132]C*2),"") ->  | O146: =IF(R[-132]C<>"",INT(R[-132]C*2),"") ->  | AE146: 用于镶嵌到[剑,衣]上.|n镶嵌后不可取下!|n不需要的宝石可以在宠物处熔炼,用于宝石抽奖. | AF146: =VLOOKUP(RC[-31],Sheet2!R13C1:R19C2,2,0)&"."&VLOOKUP(RC[-30],Sheet2!R7C1:R12C2,2,0)&VLOOKUP(RC[-30],Sheet2!R1C1:R6C2,2,0)&RC[-29]&RC[-28]&RC[-27]&Sheet2!R1C3 -> 五.丁|cFF999999[宝石]紫云|r | AG146: =IF(RC[-26]&RC[-25]&RC[-24]&RC[-23]&RC[-22]&RC[-21]="",,R1C6)&IF(RC[-26]="",,"|n"&R1C7&RC[-26])&IF(RC[-25]="",,"|n"&R1C8&RC[-25])&IF(RC[-24]="",,"|n"&R1C9&RC[-24])&IF(RC[-23]="",,"|n"&R1C10&RC[-23])&IF(RC[-22]="",,"|n"&R1C11&RC[-22])&IF(RC[-21]="",,"|n"&R1C12&RC[-21])&IF(RC[-19]&RC[-18]&RC[-17]&RC[-16]="",,"|n|n"&R1C13)&IF(RC[-19]="",,"|n"&R1C14&RC[-19])&IF(RC[-18]="",,"|n"&R1C15&RC[-18])&IF(RC[-17]="",,"|n"&R1C16&RC[-17])&IF(RC[-16]="",,"|n"&R1C17&RC[-16])&IF(RC[-15]="",,"|n"&R1C18&RC[-15])&IF(RC[-14]="",,"|n"&R1C19&RC[-14])&IF(RC[-13]="",,"|n"&R1C20&RC[-13])&IF(RC[-12]="",,"|n"&R1C21&RC[-12])&IF(RC[-11]="",,"|n"&R1C22&RC[-11])&IF(RC[-10]="",,"|n"&R1C23&RC[-10])&IF(RC[-9]="",,"|n"&R1C24&RC[-9])&IF(RC[-8]="",,"|n"&R1C25&RC[-8])&IF(RC[-7]="",,"|n"&R1C26&RC[-7])&IF(RC[-6]="",,"|n"&R1C27&RC[-6])&IF(RC[-5]="",,"|n"&R1C28&RC[-5])&IF(RC[-2]="",,"|n|n"&RC[-2]) -> |n|n用于镶嵌到[剑,衣]上.|n镶嵌后不可取下!|n不需要的宝石可以在宠物处熔炼,用于宝石抽奖.
A147: 5 | B147: D | C147: [宝石] | D147: 沥泉 | G147: =IF(R[-132]C<>"",R[-132]C*60,"") ->  | H147: =IF(R[-132]C<>"",R[-132]C*60,"") ->  | I147: =IF(R[-132]C<>"",R[-132]C*60,"") ->  | J147: =IF(R[-132]C<>"",R[-132]C*60,"") ->  | K147: =IF(R[-132]C<>"",R[-132]C*60,"") ->  | L147: =IF(R[-132]C<>"",INT(R[-132]C*6),"") ->  | M147: =IF(R[-132]C<>"",R[-132]C*54,"") ->  | N147: =IF(R[-132]C<>"",INT(R[-132]C*2),"") ->  | O147: =IF(R[-132]C<>"",INT(R[-132]C*2),"") ->  | AE147: 用于镶嵌到[剑,衣]上.|n镶嵌后不可取下!|n不需要的宝石可以在宠物处熔炼,用于宝石抽奖. | AF147: =VLOOKUP(RC[-31],Sheet2!R13C1:R19C2,2,0)&"."&VLOOKUP(RC[-30],Sheet2!R7C1:R12C2,2,0)&VLOOKUP(RC[-30],Sheet2!R1C1:R6C2,2,0)&RC[-29]&RC[-28]&RC[-27]&Sheet2!R1C3 -> 五.丁|cFF999999[宝石]沥泉|r | AG147: =IF(RC[-26]&RC[-25]&RC[-24]&RC[-23]&RC[-22]&RC[-21]="",,R1C6)&IF(RC[-26]="",,"|n"&R1C7&RC[-26])&IF(RC[-25]="",,"|n"&R1C8&RC[-25])&IF(RC[-24]="",,"|n"&R1C9&RC[-24])&IF(RC[-23]="",,"|n"&R1C10&RC[-23])&IF(RC[-22]="",,"|n"&R1C11&RC[-22])&IF(RC[-21]="",,"|n"&R1C12&RC[-21])&IF(RC[-19]&RC[-18]&RC[-17]&RC[-16]="",,"|n|n"&R1C13)&IF(RC[-19]="",,"|n"&R1C14&RC[-19])&IF(RC[-18]="",,"|n"&R1C15&RC[-18])&IF(RC[-17]="",,"|n"&R1C16&RC[-17])&IF(RC[-16]="",,"|n"&R1C17&RC[-16])&IF(RC[-15]="",,"|n"&R1C18&RC[-15])&IF(RC[-14]="",,"|n"&R1C19&RC[-14])&IF(RC[-13]="",,"|n"&R1C20&RC[-13])&IF(RC[-12]="",,"|n"&R1C21&RC[-12])&IF(RC[-11]="",,"|n"&R1C22&RC[-11])&IF(RC[-10]="",,"|n"&R1C23&RC[-10])&IF(RC[-9]="",,"|n"&R1C24&RC[-9])&IF(RC[-8]="",,"|n"&R1C25&RC[-8])&IF(RC[-7]="",,"|n"&R1C26&RC[-7])&IF(RC[-6]="",,"|n"&R1C27&RC[-6])&IF(RC[-5]="",,"|n"&R1C28&RC[-5])&IF(RC[-2]="",,"|n|n"&RC[-2]) -> |n|n用于镶嵌到[剑,衣]上.|n镶嵌后不可取下!|n不需要的宝石可以在宠物处熔炼,用于宝石抽奖.
A148: 5 | B148: D | C148: [宝石] | D148: 销魂 | G148: =IF(R[-132]C<>"",R[-132]C*60,"") ->  | H148: =IF(R[-132]C<>"",R[-132]C*60,"") ->  | I148: =IF(R[-132]C<>"",R[-132]C*60,"") ->  | J148: =IF(R[-132]C<>"",R[-132]C*60,"") ->  | K148: =IF(R[-132]C<>"",R[-132]C*60,"") ->  | L148: =IF(R[-132]C<>"",INT(R[-132]C*6),"") ->  | M148: =IF(R[-132]C<>"",R[-132]C*54,"") ->  | N148: =IF(R[-132]C<>"",INT(R[-132]C*2),"") ->  | O148: =IF(R[-132]C<>"",INT(R[-132]C*2),"") ->  | AE148: 用于镶嵌到[剑,衣]上.|n镶嵌后不可取下!|n不需要的宝石可以在宠物处熔炼,用于宝石抽奖. | AF148: =VLOOKUP(RC[-31],Sheet2!R13C1:R19C2,2,0)&"."&VLOOKUP(RC[-30],Sheet2!R7C1:R12C2,2,0)&VLOOKUP(RC[-30],Sheet2!R1C1:R6C2,2,0)&RC[-29]&RC[-28]&RC[-27]&Sheet2!R1C3 -> 五.丁|cFF999999[宝石]销魂|r | AG148: =IF(RC[-26]&RC[-25]&RC[-24]&RC[-23]&RC[-22]&RC[-21]="",,R1C6)&IF(RC[-26]="",,"|n"&R1C7&RC[-26])&IF(RC[-25]="",,"|n"&R1C8&RC[-25])&IF(RC[-24]="",,"|n"&R1C9&RC[-24])&IF(RC[-23]="",,"|n"&R1C10&RC[-23])&IF(RC[-22]="",,"|n"&R1C11&RC[-22])&IF(RC[-21]="",,"|n"&R1C12&RC[-21])&IF(RC[-19]&RC[-18]&RC[-17]&RC[-16]="",,"|n|n"&R1C13)&IF(RC[-19]="",,"|n"&R1C14&RC[-19])&IF(RC[-18]="",,"|n"&R1C15&RC[-18])&IF(RC[-17]="",,"|n"&R1C16&RC[-17])&IF(RC[-16]="",,"|n"&R1C17&RC[-16])&IF(RC[-15]="",,"|n"&R1C18&RC[-15])&IF(RC[-14]="",,"|n"&R1C19&RC[-14])&IF(RC[-13]="",,"|n"&R1C20&RC[-13])&IF(RC[-12]="",,"|n"&R1C21&RC[-12])&IF(RC[-11]="",,"|n"&R1C22&RC[-11])&IF(RC[-10]="",,"|n"&R1C23&RC[-10])&IF(RC[-9]="",,"|n"&R1C24&RC[-9])&IF(RC[-8]="",,"|n"&R1C25&RC[-8])&IF(RC[-7]="",,"|n"&R1C26&RC[-7])&IF(RC[-6]="",,"|n"&R1C27&RC[-6])&IF(RC[-5]="",,"|n"&R1C28&RC[-5])&IF(RC[-2]="",,"|n|n"&RC[-2]) -> |n|n用于镶嵌到[剑,衣]上.|n镶嵌后不可取下!|n不需要的宝石可以在宠物处熔炼,用于宝石抽奖.
A149: 5 | B149: D | C149: [宝石] | D149: 焚魂 | G149: =IF(R[-132]C<>"",R[-132]C*60,"") ->  | H149: =IF(R[-132]C<>"",R[-132]C*60,"") ->  | I149: =IF(R[-132]C<>"",R[-132]C*60,"") ->  | J149: =IF(R[-132]C<>"",R[-132]C*60,"") ->  | K149: =IF(R[-132]C<>"",R[-132]C*60,"") ->  | L149: =IF(R[-132]C<>"",INT(R[-132]C*6),"") ->  | M149: =IF(R[-132]C<>"",R[-132]C*54,"") ->  | N149: =IF(R[-132]C<>"",INT(R[-132]C*2),"") ->  | O149: =IF(R[-132]C<>"",INT(R[-132]C*2),"") ->  | AE149: 用于镶嵌到[剑,衣]上.|n镶嵌后不可取下!|n不需要的宝石可以在宠物处熔炼,用于宝石抽奖. | AF149: =VLOOKUP(RC[-31],Sheet2!R13C1:R19C2,2,0)&"."&VLOOKUP(RC[-30],Sheet2!R7C1:R12C2,2,0)&VLOOKUP(RC[-30],Sheet2!R1C1:R6C2,2,0)&RC[-29]&RC[-28]&RC[-27]&Sheet2!R1C3 -> 五.丁|cFF999999[宝石]焚魂|r | AG149: =IF(RC[-26]&RC[-25]&RC[-24]&RC[-23]&RC[-22]&RC[-21]="",,R1C6)&IF(RC[-26]="",,"|n"&R1C7&RC[-26])&IF(RC[-25]="",,"|n"&R1C8&RC[-25])&IF(RC[-24]="",,"|n"&R1C9&RC[-24])&IF(RC[-23]="",,"|n"&R1C10&RC[-23])&IF(RC[-22]="",,"|n"&R1C11&RC[-22])&IF(RC[-21]="",,"|n"&R1C12&RC[-21])&IF(RC[-19]&RC[-18]&RC[-17]&RC[-16]="",,"|n|n"&R1C13)&IF(RC[-19]="",,"|n"&R1C14&RC[-19])&IF(RC[-18]="",,"|n"&R1C15&RC[-18])&IF(RC[-17]="",,"|n"&R1C16&RC[-17])&IF(RC[-16]="",,"|n"&R1C17&RC[-16])&IF(RC[-15]="",,"|n"&R1C18&RC[-15])&IF(RC[-14]="",,"|n"&R1C19&RC[-14])&IF(RC[-13]="",,"|n"&R1C20&RC[-13])&IF(RC[-12]="",,"|n"&R1C21&RC[-12])&IF(RC[-11]="",,"|n"&R1C22&RC[-11])&IF(RC[-10]="",,"|n"&R1C23&RC[-10])&IF(RC[-9]="",,"|n"&R1C24&RC[-9])&IF(RC[-8]="",,"|n"&R1C25&RC[-8])&IF(RC[-7]="",,"|n"&R1C26&RC[-7])&IF(RC[-6]="",,"|n"&R1C27&RC[-6])&IF(RC[-5]="",,"|n"&R1C28&RC[-5])&IF(RC[-2]="",,"|n|n"&RC[-2]) -> |n|n用于镶嵌到[剑,衣]上.|n镶嵌后不可取下!|n不需要的宝石可以在宠物处熔炼,用于宝石抽奖.
A150: 5 | B150: C | C150: [宝石] | D150: 闇影石 | G150: =IF(R[-132]C<>"",R[-132]C*50,"") ->  | H150: =IF(R[-132]C<>"",R[-132]C*50,"") -> 75000 | I150: =IF(R[-132]C<>"",R[-132]C*50,"") -> 75000 | J150: =IF(R[-132]C<>"",R[-132]C*50,"") -> 75000 | K150: =IF(R[-132]C<>"",R[-132]C*50,"") ->  | L150: =IF(R[-132]C<>"",INT(R[-132]C*6),"") ->  | M150: =IF(R[-132]C<>"",R[-132]C*54,"") ->  | N150: =IF(R[-132]C<>"",INT(R[-132]C*2),"") ->  | O150: =IF(R[-132]C<>"",INT(R[-132]C*2),"") ->  | P150: =IF(R[-132]C<>"",INT(R[-132]C*2),"") ->  | Q150: =IF(R[-132]C<>"",INT(R[-132]C*2),"") ->  | AE150: 用于镶嵌到[剑,衣]上.|n镶嵌后不可取下!|n不需要的宝石可以在宠物处熔炼,用于宝石抽奖. | AF150: =VLOOKUP(RC[-31],Sheet2!R13C1:R19C2,2,0)&"."&VLOOKUP(RC[-30],Sheet2!R7C1:R12C2,2,0)&VLOOKUP(RC[-30],Sheet2!R1C1:R6C2,2,0)&RC[-29]&RC[-28]&RC[-27]&Sheet2!R1C3 -> 五.丙|cFF99FF66[宝石]闇影石|r | AG150: =IF(RC[-26]&RC[-25]&RC[-24]&RC[-23]&RC[-22]&RC[-21]="",,R1C6)&IF(RC[-26]="",,"|n"&R1C7&RC[-26])&IF(RC[-25]="",,"|n"&R1C8&RC[-25])&IF(RC[-24]="",,"|n"&R1C9&RC[-24])&IF(RC[-23]="",,"|n"&R1C10&RC[-23])&IF(RC[-22]="",,"|n"&R1C11&RC[-22])&IF(RC[-21]="",,"|n"&R1C12&RC[-21])&IF(RC[-19]&RC[-18]&RC[-17]&RC[-16]="",,"|n|n"&R1C13)&IF(RC[-19]="",,"|n"&R1C14&RC[-19])&IF(RC[-18]="",,"|n"&R1C15&RC[-18])&IF(RC[-17]="",,"|n"&R1C16&RC[-17])&IF(RC[-16]="",,"|n"&R1C17&RC[-16])&IF(RC[-15]="",,"|n"&R1C18&RC[-15])&IF(RC[-14]="",,"|n"&R1C19&RC[-14])&IF(RC[-13]="",,"|n"&R1C20&RC[-13])&IF(RC[-12]="",,"|n"&R1C21&RC[-12])&IF(RC[-11]="",,"|n"&R1C22&RC[-11])&IF(RC[-10]="",,"|n"&R1C23&RC[-10])&IF(RC[-9]="",,"|n"&R1C24&RC[-9])&IF(RC[-8]="",,"|n"&R1C25&RC[-8])&IF(RC[-7]="",,"|n"&R1C26&RC[-7])&IF(RC[-6]="",,"|n"&R1C27&RC[-6])&IF(RC[-5]="",,"|n"&R1C28&RC[-5])&IF(RC[-2]="",,"|n|n"&RC[-2]) -> |cFFFFFF99基础属性|r|n力量:75000|n敏捷:75000|n智力:75000|n|n用于镶嵌到[剑,衣]上.|n镶嵌后不可取下!|n不需要的宝石可以在宠物处熔炼,用于宝石抽奖.
A151: 5 | B151: C | C151: [宝石] | D151: 点星石 | G151: =IF(R[-132]C<>"",R[-132]C*50,"") -> 250000 | H151: =IF(R[-132]C<>"",R[-132]C*50,"") ->  | I151: =IF(R[-132]C<>"",R[-132]C*50,"") ->  | J151: =IF(R[-132]C<>"",R[-132]C*50,"") ->  | K151: =IF(R[-132]C<>"",R[-132]C*50,"") ->  | L151: =IF(R[-132]C<>"",INT(R[-132]C*6),"") ->  | M151: =IF(R[-132]C<>"",R[-132]C*54,"") ->  | N151: =IF(R[-132]C<>"",INT(R[-132]C*2),"") ->  | O151: =IF(R[-132]C<>"",INT(R[-132]C*2),"") ->  | P151: =IF(R[-132]C<>"",INT(R[-132]C*2),"") ->  | Q151: =IF(R[-132]C<>"",INT(R[-132]C*2),"") ->  | AE151: 用于镶嵌到[剑,衣]上.|n镶嵌后不可取下!|n不需要的宝石可以在宠物处熔炼,用于宝石抽奖. | AF151: =VLOOKUP(RC[-31],Sheet2!R13C1:R19C2,2,0)&"."&VLOOKUP(RC[-30],Sheet2!R7C1:R12C2,2,0)&VLOOKUP(RC[-30],Sheet2!R1C1:R6C2,2,0)&RC[-29]&RC[-28]&RC[-27]&Sheet2!R1C3 -> 五.丙|cFF99FF66[宝石]点星石|r | AG151: =IF(RC[-26]&RC[-25]&RC[-24]&RC[-23]&RC[-22]&RC[-21]="",,R1C6)&IF(RC[-26]="",,"|n"&R1C7&RC[-26])&IF(RC[-25]="",,"|n"&R1C8&RC[-25])&IF(RC[-24]="",,"|n"&R1C9&RC[-24])&IF(RC[-23]="",,"|n"&R1C10&RC[-23])&IF(RC[-22]="",,"|n"&R1C11&RC[-22])&IF(RC[-21]="",,"|n"&R1C12&RC[-21])&IF(RC[-19]&RC[-18]&RC[-17]&RC[-16]="",,"|n|n"&R1C13)&IF(RC[-19]="",,"|n"&R1C14&RC[-19])&IF(RC[-18]="",,"|n"&R1C15&RC[-18])&IF(RC[-17]="",,"|n"&R1C16&RC[-17])&IF(RC[-16]="",,"|n"&R1C17&RC[-16])&IF(RC[-15]="",,"|n"&R1C18&RC[-15])&IF(RC[-14]="",,"|n"&R1C19&RC[-14])&IF(RC[-13]="",,"|n"&R1C20&RC[-13])&IF(RC[-12]="",,"|n"&R1C21&RC[-12])&IF(RC[-11]="",,"|n"&R1C22&RC[-11])&IF(RC[-10]="",,"|n"&R1C23&RC[-10])&IF(RC[-9]="",,"|n"&R1C24&RC[-9])&IF(RC[-8]="",,"|n"&R1C25&RC[-8])&IF(RC[-7]="",,"|n"&R1C26&RC[-7])&IF(RC[-6]="",,"|n"&R1C27&RC[-6])&IF(RC[-5]="",,"|n"&R1C28&RC[-5])&IF(RC[-2]="",,"|n|n"&RC[-2]) -> |cFFFFFF99基础属性|r|n攻击:250000|n|n用于镶嵌到[剑,衣]上.|n镶嵌后不可取下!|n不需要的宝石可以在宠物处熔炼,用于宝石抽奖.
A152: 5 | B152: C | C152: [宝石] | D152: 雨霖石 | G152: =IF(R[-132]C<>"",R[-132]C*50,"") ->  | H152: =IF(R[-132]C<>"",R[-132]C*50,"") ->  | I152: =IF(R[-132]C<>"",R[-132]C*50,"") ->  | J152: =IF(R[-132]C<>"",R[-132]C*50,"") ->  | K152: =IF(R[-132]C<>"",R[-132]C*50,"") ->  | L152: =IF(R[-132]C<>"",INT(R[-132]C*6),"") ->  | M152: =IF(R[-132]C<>"",R[-132]C*54,"") ->  | N152: =IF(R[-132]C<>"",INT(R[-132]C*2),"") ->  | O152: =IF(R[-132]C<>"",INT(R[-132]C*2),"") -> 4 | P152: =IF(R[-132]C<>"",INT(R[-132]C*2),"") ->  | Q152: =IF(R[-132]C<>"",INT(R[-132]C*2),"") ->  | AE152: 用于镶嵌到[剑,衣]上.|n镶嵌后不可取下!|n不需要的宝石可以在宠物处熔炼,用于宝石抽奖. | AF152: =VLOOKUP(RC[-31],Sheet2!R13C1:R19C2,2,0)&"."&VLOOKUP(RC[-30],Sheet2!R7C1:R12C2,2,0)&VLOOKUP(RC[-30],Sheet2!R1C1:R6C2,2,0)&RC[-29]&RC[-28]&RC[-27]&Sheet2!R1C3 -> 五.丙|cFF99FF66[宝石]雨霖石|r | AG152: =IF(RC[-26]&RC[-25]&RC[-24]&RC[-23]&RC[-22]&RC[-21]="",,R1C6)&IF(RC[-26]="",,"|n"&R1C7&RC[-26])&IF(RC[-25]="",,"|n"&R1C8&RC[-25])&IF(RC[-24]="",,"|n"&R1C9&RC[-24])&IF(RC[-23]="",,"|n"&R1C10&RC[-23])&IF(RC[-22]="",,"|n"&R1C11&RC[-22])&IF(RC[-21]="",,"|n"&R1C12&RC[-21])&IF(RC[-19]&RC[-18]&RC[-17]&RC[-16]="",,"|n|n"&R1C13)&IF(RC[-19]="",,"|n"&R1C14&RC[-19])&IF(RC[-18]="",,"|n"&R1C15&RC[-18])&IF(RC[-17]="",,"|n"&R1C16&RC[-17])&IF(RC[-16]="",,"|n"&R1C17&RC[-16])&IF(RC[-15]="",,"|n"&R1C18&RC[-15])&IF(RC[-14]="",,"|n"&R1C19&RC[-14])&IF(RC[-13]="",,"|n"&R1C20&RC[-13])&IF(RC[-12]="",,"|n"&R1C21&RC[-12])&IF(RC[-11]="",,"|n"&R1C22&RC[-11])&IF(RC[-10]="",,"|n"&R1C23&RC[-10])&IF(RC[-9]="",,"|n"&R1C24&RC[-9])&IF(RC[-8]="",,"|n"&R1C25&RC[-8])&IF(RC[-7]="",,"|n"&R1C26&RC[-7])&IF(RC[-6]="",,"|n"&R1C27&RC[-6])&IF(RC[-5]="",,"|n"&R1C28&RC[-5])&IF(RC[-2]="",,"|n|n"&RC[-2]) -> |n|n|cFFFFFF55附加属性|r(%)|n攻击吸血:4|n|n用于镶嵌到[剑,衣]上.|n镶嵌后不可取下!|n不需要的宝石可以在宠物处熔炼,用于宝石抽奖.
A153: 5 | B153: C | C153: [宝石] | D153: 孤妖石 | G153: =IF(R[-132]C<>"",R[-132]C*50,"") ->  | H153: =IF(R[-132]C<>"",R[-132]C*50,"") ->  | I153: =IF(R[-132]C<>"",R[-132]C*50,"") ->  | J153: =IF(R[-132]C<>"",R[-132]C*50,"") ->  | K153: =IF(R[-132]C<>"",R[-132]C*50,"") -> 1250000 | L153: =IF(R[-132]C<>"",INT(R[-132]C*6),"") -> 600 | M153: =IF(R[-132]C<>"",R[-132]C*54,"") ->  | N153: =IF(R[-132]C<>"",INT(R[-132]C*2),"") ->  | O153: =IF(R[-132]C<>"",INT(R[-132]C*2),"") ->  | P153: =IF(R[-132]C<>"",INT(R[-132]C*2),"") ->  | Q153: =IF(R[-132]C<>"",INT(R[-132]C*2),"") ->  | AE153: 用于镶嵌到[剑,衣]上.|n镶嵌后不可取下!|n不需要的宝石可以在宠物处熔炼,用于宝石抽奖. | AF153: =VLOOKUP(RC[-31],Sheet2!R13C1:R19C2,2,0)&"."&VLOOKUP(RC[-30],Sheet2!R7C1:R12C2,2,0)&VLOOKUP(RC[-30],Sheet2!R1C1:R6C2,2,0)&RC[-29]&RC[-28]&RC[-27]&Sheet2!R1C3 -> 五.丙|cFF99FF66[宝石]孤妖石|r | AG153: =IF(RC[-26]&RC[-25]&RC[-24]&RC[-23]&RC[-22]&RC[-21]="",,R1C6)&IF(RC[-26]="",,"|n"&R1C7&RC[-26])&IF(RC[-25]="",,"|n"&R1C8&RC[-25])&IF(RC[-24]="",,"|n"&R1C9&RC[-24])&IF(RC[-23]="",,"|n"&R1C10&RC[-23])&IF(RC[-22]="",,"|n"&R1C11&RC[-22])&IF(RC[-21]="",,"|n"&R1C12&RC[-21])&IF(RC[-19]&RC[-18]&RC[-17]&RC[-16]="",,"|n|n"&R1C13)&IF(RC[-19]="",,"|n"&R1C14&RC[-19])&IF(RC[-18]="",,"|n"&R1C15&RC[-18])&IF(RC[-17]="",,"|n"&R1C16&RC[-17])&IF(RC[-16]="",,"|n"&R1C17&RC[-16])&IF(RC[-15]="",,"|n"&R1C18&RC[-15])&IF(RC[-14]="",,"|n"&R1C19&RC[-14])&IF(RC[-13]="",,"|n"&R1C20&RC[-13])&IF(RC[-12]="",,"|n"&R1C21&RC[-12])&IF(RC[-11]="",,"|n"&R1C22&RC[-11])&IF(RC[-10]="",,"|n"&R1C23&RC[-10])&IF(RC[-9]="",,"|n"&R1C24&RC[-9])&IF(RC[-8]="",,"|n"&R1C25&RC[-8])&IF(RC[-7]="",,"|n"&R1C26&RC[-7])&IF(RC[-6]="",,"|n"&R1C27&RC[-6])&IF(RC[-5]="",,"|n"&R1C28&RC[-5])&IF(RC[-2]="",,"|n|n"&RC[-2]) -> |cFFFFFF99基础属性|r|n血量:1250000|n护甲:600|n|n用于镶嵌到[剑,衣]上.|n镶嵌后不可取下!|n不需要的宝石可以在宠物处熔炼,用于宝石抽奖.
A154: 5 | B154: C | C154: [宝石] | D154: 闪光石 | G154: =IF(R[-132]C<>"",R[-132]C*50,"") ->  | H154: =IF(R[-132]C<>"",R[-132]C*50,"") -> 100000 | I154: =IF(R[-132]C<>"",R[-132]C*50,"") -> 25000 | J154: =IF(R[-132]C<>"",R[-132]C*50,"") -> 25000 | K154: =IF(R[-132]C<>"",R[-132]C*50,"") ->  | L154: =IF(R[-132]C<>"",INT(R[-132]C*6),"") ->  | M154: =IF(R[-132]C<>"",R[-132]C*54,"") ->  | N154: =IF(R[-132]C<>"",INT(R[-132]C*2),"") ->  | O154: =IF(R[-132]C<>"",INT(R[-132]C*2),"") ->  | P154: =IF(R[-132]C<>"",INT(R[-132]C*2),"") ->  | Q154: =IF(R[-132]C<>"",INT(R[-132]C*2),"") ->  | AE154: 用于镶嵌到[剑,衣]上.|n镶嵌后不可取下!|n不需要的宝石可以在宠物处熔炼,用于宝石抽奖. | AF154: =VLOOKUP(RC[-31],Sheet2!R13C1:R19C2,2,0)&"."&VLOOKUP(RC[-30],Sheet2!R7C1:R12C2,2,0)&VLOOKUP(RC[-30],Sheet2!R1C1:R6C2,2,0)&RC[-29]&RC[-28]&RC[-27]&Sheet2!R1C3 -> 五.丙|cFF99FF66[宝石]闪光石|r | AG154: =IF(RC[-26]&RC[-25]&RC[-24]&RC[-23]&RC[-22]&RC[-21]="",,R1C6)&IF(RC[-26]="",,"|n"&R1C7&RC[-26])&IF(RC[-25]="",,"|n"&R1C8&RC[-25])&IF(RC[-24]="",,"|n"&R1C9&RC[-24])&IF(RC[-23]="",,"|n"&R1C10&RC[-23])&IF(RC[-22]="",,"|n"&R1C11&RC[-22])&IF(RC[-21]="",,"|n"&R1C12&RC[-21])&IF(RC[-19]&RC[-18]&RC[-17]&RC[-16]="",,"|n|n"&R1C13)&IF(RC[-19]="",,"|n"&R1C14&RC[-19])&IF(RC[-18]="",,"|n"&R1C15&RC[-18])&IF(RC[-17]="",,"|n"&R1C16&RC[-17])&IF(RC[-16]="",,"|n"&R1C17&RC[-16])&IF(RC[-15]="",,"|n"&R1C18&RC[-15])&IF(RC[-14]="",,"|n"&R1C19&RC[-14])&IF(RC[-13]="",,"|n"&R1C20&RC[-13])&IF(RC[-12]="",,"|n"&R1C21&RC[-12])&IF(RC[-11]="",,"|n"&R1C22&RC[-11])&IF(RC[-10]="",,"|n"&R1C23&RC[-10])&IF(RC[-9]="",,"|n"&R1C24&RC[-9])&IF(RC[-8]="",,"|n"&R1C25&RC[-8])&IF(RC[-7]="",,"|n"&R1C26&RC[-7])&IF(RC[-6]="",,"|n"&R1C27&RC[-6])&IF(RC[-5]="",,"|n"&R1C28&RC[-5])&IF(RC[-2]="",,"|n|n"&RC[-2]) -> |cFFFFFF99基础属性|r|n力量:100000|n敏捷:25000|n智力:25000|n|n用于镶嵌到[剑,衣]上.|n镶嵌后不可取下!|n不需要的宝石可以在宠物处熔炼,用于宝石抽奖.
A155: 5 | B155: C | C155: [宝石] | D155: 灵蛇石 | G155: =IF(R[-132]C<>"",R[-132]C*50,"") ->  | H155: =IF(R[-132]C<>"",R[-132]C*50,"") -> 25000 | I155: =IF(R[-132]C<>"",R[-132]C*50,"") -> 100000 | J155: =IF(R[-132]C<>"",R[-132]C*50,"") -> 25000 | K155: =IF(R[-132]C<>"",R[-132]C*50,"") ->  | L155: =IF(R[-132]C<>"",INT(R[-132]C*6),"") ->  | M155: =IF(R[-132]C<>"",R[-132]C*54,"") ->  | N155: =IF(R[-132]C<>"",INT(R[-132]C*2),"") ->  | O155: =IF(R[-132]C<>"",INT(R[-132]C*2),"") ->  | P155: =IF(R[-132]C<>"",INT(R[-132]C*2),"") ->  | Q155: =IF(R[-132]C<>"",INT(R[-132]C*2),"") ->  | AE155: 用于镶嵌到[剑,衣]上.|n镶嵌后不可取下!|n不需要的宝石可以在宠物处熔炼,用于宝石抽奖. | AF155: =VLOOKUP(RC[-31],Sheet2!R13C1:R19C2,2,0)&"."&VLOOKUP(RC[-30],Sheet2!R7C1:R12C2,2,0)&VLOOKUP(RC[-30],Sheet2!R1C1:R6C2,2,0)&RC[-29]&RC[-28]&RC[-27]&Sheet2!R1C3 -> 五.丙|cFF99FF66[宝石]灵蛇石|r | AG155: =IF(RC[-26]&RC[-25]&RC[-24]&RC[-23]&RC[-22]&RC[-21]="",,R1C6)&IF(RC[-26]="",,"|n"&R1C7&RC[-26])&IF(RC[-25]="",,"|n"&R1C8&RC[-25])&IF(RC[-24]="",,"|n"&R1C9&RC[-24])&IF(RC[-23]="",,"|n"&R1C10&RC[-23])&IF(RC[-22]="",,"|n"&R1C11&RC[-22])&IF(RC[-21]="",,"|n"&R1C12&RC[-21])&IF(RC[-19]&RC[-18]&RC[-17]&RC[-16]="",,"|n|n"&R1C13)&IF(RC[-19]="",,"|n"&R1C14&RC[-19])&IF(RC[-18]="",,"|n"&R1C15&RC[-18])&IF(RC[-17]="",,"|n"&R1C16&RC[-17])&IF(RC[-16]="",,"|n"&R1C17&RC[-16])&IF(RC[-15]="",,"|n"&R1C18&RC[-15])&IF(RC[-14]="",,"|n"&R1C19&RC[-14])&IF(RC[-13]="",,"|n"&R1C20&RC[-13])&IF(RC[-12]="",,"|n"&R1C21&RC[-12])&IF(RC[-11]="",,"|n"&R1C22&RC[-11])&IF(RC[-10]="",,"|n"&R1C23&RC[-10])&IF(RC[-9]="",,"|n"&R1C24&RC[-9])&IF(RC[-8]="",,"|n"&R1C25&RC[-8])&IF(RC[-7]="",,"|n"&R1C26&RC[-7])&IF(RC[-6]="",,"|n"&R1C27&RC[-6])&IF(RC[-5]="",,"|n"&R1C28&RC[-5])&IF(RC[-2]="",,"|n|n"&RC[-2]) -> |cFFFFFF99基础属性|r|n力量:25000|n敏捷:100000|n智力:25000|n|n用于镶嵌到[剑,衣]上.|n镶嵌后不可取下!|n不需要的宝石可以在宠物处熔炼,用于宝石抽奖.
A156: 5 | B156: C | C156: [宝石] | D156: 摧心石 | G156: =IF(R[-132]C<>"",R[-132]C*50,"") ->  | H156: =IF(R[-132]C<>"",R[-132]C*50,"") -> 25000 | I156: =IF(R[-132]C<>"",R[-132]C*50,"") -> 25000 | J156: =IF(R[-132]C<>"",R[-132]C*50,"") -> 100000 | K156: =IF(R[-132]C<>"",R[-132]C*50,"") ->  | L156: =IF(R[-132]C<>"",INT(R[-132]C*6),"") ->  | M156: =IF(R[-132]C<>"",R[-132]C*54,"") ->  | N156: =IF(R[-132]C<>"",INT(R[-132]C*2),"") ->  | O156: =IF(R[-132]C<>"",INT(R[-132]C*2),"") ->  | P156: =IF(R[-132]C<>"",INT(R[-132]C*2),"") ->  | Q156: =IF(R[-132]C<>"",INT(R[-132]C*2),"") ->  | AE156: 用于镶嵌到[剑,衣]上.|n镶嵌后不可取下!|n不需要的宝石可以在宠物处熔炼,用于宝石抽奖. | AF156: =VLOOKUP(RC[-31],Sheet2!R13C1:R19C2,2,0)&"."&VLOOKUP(RC[-30],Sheet2!R7C1:R12C2,2,0)&VLOOKUP(RC[-30],Sheet2!R1C1:R6C2,2,0)&RC[-29]&RC[-28]&RC[-27]&Sheet2!R1C3 -> 五.丙|cFF99FF66[宝石]摧心石|r | AG156: =IF(RC[-26]&RC[-25]&RC[-24]&RC[-23]&RC[-22]&RC[-21]="",,R1C6)&IF(RC[-26]="",,"|n"&R1C7&RC[-26])&IF(RC[-25]="",,"|n"&R1C8&RC[-25])&IF(RC[-24]="",,"|n"&R1C9&RC[-24])&IF(RC[-23]="",,"|n"&R1C10&RC[-23])&IF(RC[-22]="",,"|n"&R1C11&RC[-22])&IF(RC[-21]="",,"|n"&R1C12&RC[-21])&IF(RC[-19]&RC[-18]&RC[-17]&RC[-16]="",,"|n|n"&R1C13)&IF(RC[-19]="",,"|n"&R1C14&RC[-19])&IF(RC[-18]="",,"|n"&R1C15&RC[-18])&IF(RC[-17]="",,"|n"&R1C16&RC[-17])&IF(RC[-16]="",,"|n"&R1C17&RC[-16])&IF(RC[-15]="",,"|n"&R1C18&RC[-15])&IF(RC[-14]="",,"|n"&R1C19&RC[-14])&IF(RC[-13]="",,"|n"&R1C20&RC[-13])&IF(RC[-12]="",,"|n"&R1C21&RC[-12])&IF(RC[-11]="",,"|n"&R1C22&RC[-11])&IF(RC[-10]="",,"|n"&R1C23&RC[-10])&IF(RC[-9]="",,"|n"&R1C24&RC[-9])&IF(RC[-8]="",,"|n"&R1C25&RC[-8])&IF(RC[-7]="",,"|n"&R1C26&RC[-7])&IF(RC[-6]="",,"|n"&R1C27&RC[-6])&IF(RC[-5]="",,"|n"&R1C28&RC[-5])&IF(RC[-2]="",,"|n|n"&RC[-2]) -> |cFFFFFF99基础属性|r|n力量:25000|n敏捷:25000|n智力:100000|n|n用于镶嵌到[剑,衣]上.|n镶嵌后不可取下!|n不需要的宝石可以在宠物处熔炼,用于宝石抽奖.
A157: 5 | B157: C | C157: [宝石] | D157: 金凤石 | G157: =IF(R[-132]C<>"",R[-132]C*50,"") ->  | H157: =IF(R[-132]C<>"",R[-132]C*50,"") ->  | I157: =IF(R[-132]C<>"",R[-132]C*50,"") ->  | J157: =IF(R[-132]C<>"",R[-132]C*50,"") ->  | K157: =IF(R[-132]C<>"",R[-132]C*50,"") ->  | L157: =IF(R[-132]C<>"",INT(R[-132]C*6),"") ->  | M157: =IF(R[-132]C<>"",R[-132]C*54,"") ->  | N157: =IF(R[-132]C<>"",INT(R[-132]C*2),"") -> 30 | O157: =IF(R[-132]C<>"",INT(R[-132]C*2),"") ->  | P157: =IF(R[-132]C<>"",INT(R[-132]C*2),"") ->  | Q157: =IF(R[-132]C<>"",INT(R[-132]C*2),"") ->  | AE157: 用于镶嵌到[剑,衣]上.|n镶嵌后不可取下!|n不需要的宝石可以在宠物处熔炼,用于宝石抽奖. | AF157: =VLOOKUP(RC[-31],Sheet2!R13C1:R19C2,2,0)&"."&VLOOKUP(RC[-30],Sheet2!R7C1:R12C2,2,0)&VLOOKUP(RC[-30],Sheet2!R1C1:R6C2,2,0)&RC[-29]&RC[-28]&RC[-27]&Sheet2!R1C3 -> 五.丙|cFF99FF66[宝石]金凤石|r | AG157: =IF(RC[-26]&RC[-25]&RC[-24]&RC[-23]&RC[-22]&RC[-21]="",,R1C6)&IF(RC[-26]="",,"|n"&R1C7&RC[-26])&IF(RC[-25]="",,"|n"&R1C8&RC[-25])&IF(RC[-24]="",,"|n"&R1C9&RC[-24])&IF(RC[-23]="",,"|n"&R1C10&RC[-23])&IF(RC[-22]="",,"|n"&R1C11&RC[-22])&IF(RC[-21]="",,"|n"&R1C12&RC[-21])&IF(RC[-19]&RC[-18]&RC[-17]&RC[-16]="",,"|n|n"&R1C13)&IF(RC[-19]="",,"|n"&R1C14&RC[-19])&IF(RC[-18]="",,"|n"&R1C15&RC[-18])&IF(RC[-17]="",,"|n"&R1C16&RC[-17])&IF(RC[-16]="",,"|n"&R1C17&RC[-16])&IF(RC[-15]="",,"|n"&R1C18&RC[-15])&IF(RC[-14]="",,"|n"&R1C19&RC[-14])&IF(RC[-13]="",,"|n"&R1C20&RC[-13])&IF(RC[-12]="",,"|n"&R1C21&RC[-12])&IF(RC[-11]="",,"|n"&R1C22&RC[-11])&IF(RC[-10]="",,"|n"&R1C23&RC[-10])&IF(RC[-9]="",,"|n"&R1C24&RC[-9])&IF(RC[-8]="",,"|n"&R1C25&RC[-8])&IF(RC[-7]="",,"|n"&R1C26&RC[-7])&IF(RC[-6]="",,"|n"&R1C27&RC[-6])&IF(RC[-5]="",,"|n"&R1C28&RC[-5])&IF(RC[-2]="",,"|n|n"&RC[-2]) -> |n|n|cFFFFFF55附加属性|r(%)|n攻速:30|n|n用于镶嵌到[剑,衣]上.|n镶嵌后不可取下!|n不需要的宝石可以在宠物处熔炼,用于宝石抽奖.
A158: 5 | B158: B | C158: [宝石] | D158: 量天神木 | G158: =IF(R[-132]C<>"",R[-132]C*50,"") ->  | H158: =IF(R[-132]C<>"",R[-132]C*50,"") -> 125000 | I158: =IF(R[-132]C<>"",R[-132]C*50,"") ->  | J158: =IF(R[-132]C<>"",R[-132]C*50,"") ->  | K158: =IF(R[-132]C<>"",R[-132]C*50,"") ->  | L158: =IF(R[-132]C<>"",INT(R[-132]C*6),"") -> 150 | M158: =IF(R[-132]C<>"",R[-132]C*54,"") ->  | N158: =IF(R[-132]C<>"",INT(R[-132]C*2),"") ->  | O158: =IF(R[-132]C<>"",INT(R[-132]C*2),"") ->  | P158: =IF(R[-132]C<>"",INT(R[-132]C*2),"") ->  | Q158: =IF(R[-132]C<>"",INT(R[-132]C*2),"") ->  | R158: =IF(R[-132]C<>"",INT(R[-132]C*2),"") -> 4 | AE158: 用于镶嵌到[剑,衣]上.|n镶嵌后不可取下!|n不需要的宝石可以在宠物处熔炼,用于宝石抽奖. | AF158: =VLOOKUP(RC[-31],Sheet2!R13C1:R19C2,2,0)&"."&VLOOKUP(RC[-30],Sheet2!R7C1:R12C2,2,0)&VLOOKUP(RC[-30],Sheet2!R1C1:R6C2,2,0)&RC[-29]&RC[-28]&RC[-27]&Sheet2!R1C3 -> 五.乙|cFF1BE6B8[宝石]量天神木|r | AG158: =IF(RC[-26]&RC[-25]&RC[-24]&RC[-23]&RC[-22]&RC[-21]="",,R1C6)&IF(RC[-26]="",,"|n"&R1C7&RC[-26])&IF(RC[-25]="",,"|n"&R1C8&RC[-25])&IF(RC[-24]="",,"|n"&R1C9&RC[-24])&IF(RC[-23]="",,"|n"&R1C10&RC[-23])&IF(RC[-22]="",,"|n"&R1C11&RC[-22])&IF(RC[-21]="",,"|n"&R1C12&RC[-21])&IF(RC[-19]&RC[-18]&RC[-17]&RC[-16]="",,"|n|n"&R1C13)&IF(RC[-19]="",,"|n"&R1C14&RC[-19])&IF(RC[-18]="",,"|n"&R1C15&RC[-18])&IF(RC[-17]="",,"|n"&R1C16&RC[-17])&IF(RC[-16]="",,"|n"&R1C17&RC[-16])&IF(RC[-15]="",,"|n"&R1C18&RC[-15])&IF(RC[-14]="",,"|n"&R1C19&RC[-14])&IF(RC[-13]="",,"|n"&R1C20&RC[-13])&IF(RC[-12]="",,"|n"&R1C21&RC[-12])&IF(RC[-11]="",,"|n"&R1C22&RC[-11])&IF(RC[-10]="",,"|n"&R1C23&RC[-10])&IF(RC[-9]="",,"|n"&R1C24&RC[-9])&IF(RC[-8]="",,"|n"&R1C25&RC[-8])&IF(RC[-7]="",,"|n"&R1C26&RC[-7])&IF(RC[-6]="",,"|n"&R1C27&RC[-6])&IF(RC[-5]="",,"|n"&R1C28&RC[-5])&IF(RC[-2]="",,"|n|n"&RC[-2]) -> |cFFFFFF99基础属性|r|n力量:125000|n护甲:150|n伤害增幅:4|n|n用于镶嵌到[剑,衣]上.|n镶嵌后不可取下!|n不需要的宝石可以在宠物处熔炼,用于宝石抽奖.
A159: 5 | B159: B | C159: [宝石] | D159: 霓光软玉 | G159: =IF(R[-132]C<>"",R[-132]C*50,"") -> 300000 | H159: =IF(R[-132]C<>"",R[-132]C*50,"") ->  | I159: =IF(R[-132]C<>"",R[-132]C*50,"") ->  | J159: =IF(R[-132]C<>"",R[-132]C*50,"") ->  | K159: =IF(R[-132]C<>"",R[-132]C*50,"") ->  | L159: =IF(R[-132]C<>"",INT(R[-132]C*6),"") -> 150 | M159: =IF(R[-132]C<>"",R[-132]C*54,"") ->  | N159: =IF(R[-132]C<>"",INT(R[-132]C*2),"") ->  | O159: =IF(R[-132]C<>"",INT(R[-132]C*2),"") ->  | P159: =IF(R[-132]C<>"",INT(R[-132]C*2),"") ->  | Q159: =IF(R[-132]C<>"",INT(R[-132]C*2),"") ->  | R159: =IF(R[-132]C<>"",INT(R[-132]C*2),"") -> 4 | AE159: 用于镶嵌到[剑,衣]上.|n镶嵌后不可取下!|n不需要的宝石可以在宠物处熔炼,用于宝石抽奖. | AF159: =VLOOKUP(RC[-31],Sheet2!R13C1:R19C2,2,0)&"."&VLOOKUP(RC[-30],Sheet2!R7C1:R12C2,2,0)&VLOOKUP(RC[-30],Sheet2!R1C1:R6C2,2,0)&RC[-29]&RC[-28]&RC[-27]&Sheet2!R1C3 -> 五.乙|cFF1BE6B8[宝石]霓光软玉|r | AG159: =IF(RC[-26]&RC[-25]&RC[-24]&RC[-23]&RC[-22]&RC[-21]="",,R1C6)&IF(RC[-26]="",,"|n"&R1C7&RC[-26])&IF(RC[-25]="",,"|n"&R1C8&RC[-25])&IF(RC[-24]="",,"|n"&R1C9&RC[-24])&IF(RC[-23]="",,"|n"&R1C10&RC[-23])&IF(RC[-22]="",,"|n"&R1C11&RC[-22])&IF(RC[-21]="",,"|n"&R1C12&RC[-21])&IF(RC[-19]&RC[-18]&RC[-17]&RC[-16]="",,"|n|n"&R1C13)&IF(RC[-19]="",,"|n"&R1C14&RC[-19])&IF(RC[-18]="",,"|n"&R1C15&RC[-18])&IF(RC[-17]="",,"|n"&R1C16&RC[-17])&IF(RC[-16]="",,"|n"&R1C17&RC[-16])&IF(RC[-15]="",,"|n"&R1C18&RC[-15])&IF(RC[-14]="",,"|n"&R1C19&RC[-14])&IF(RC[-13]="",,"|n"&R1C20&RC[-13])&IF(RC[-12]="",,"|n"&R1C21&RC[-12])&IF(RC[-11]="",,"|n"&R1C22&RC[-11])&IF(RC[-10]="",,"|n"&R1C23&RC[-10])&IF(RC[-9]="",,"|n"&R1C24&RC[-9])&IF(RC[-8]="",,"|n"&R1C25&RC[-8])&IF(RC[-7]="",,"|n"&R1C26&RC[-7])&IF(RC[-6]="",,"|n"&R1C27&RC[-6])&IF(RC[-5]="",,"|n"&R1C28&RC[-5])&IF(RC[-2]="",,"|n|n"&RC[-2]) -> |cFFFFFF99基础属性|r|n攻击:300000|n护甲:150|n伤害增幅:4|n|n用于镶嵌到[剑,衣]上.|n镶嵌后不可取下!|n不需要的宝石可以在宠物处熔炼,用于宝石抽奖.
A160: 5 | B160: B | C160: [宝石] | D160: 七绝佛沙 | G160: =IF(R[-132]C<>"",R[-132]C*50,"") ->  | H160: =IF(R[-132]C<>"",R[-132]C*50,"") ->  | I160: =IF(R[-132]C<>"",R[-132]C*50,"") ->  | J160: =IF(R[-132]C<>"",R[-132]C*50,"") -> 125000 | K160: =IF(R[-132]C<>"",R[-132]C*50,"") ->  | L160: =IF(R[-132]C<>"",INT(R[-132]C*6),"") -> 150 | M160: =IF(R[-132]C<>"",R[-132]C*54,"") ->  | N160: =IF(R[-132]C<>"",INT(R[-132]C*2),"") ->  | O160: =IF(R[-132]C<>"",INT(R[-132]C*2),"") ->  | P160: =IF(R[-132]C<>"",INT(R[-132]C*2),"") ->  | Q160: =IF(R[-132]C<>"",INT(R[-132]C*2),"") ->  | R160: =IF(R[-132]C<>"",INT(R[-132]C*2),"") -> 4 | AE160: 用于镶嵌到[剑,衣]上.|n镶嵌后不可取下!|n不需要的宝石可以在宠物处熔炼,用于宝石抽奖. | AF160: =VLOOKUP(RC[-31],Sheet2!R13C1:R19C2,2,0)&"."&VLOOKUP(RC[-30],Sheet2!R7C1:R12C2,2,0)&VLOOKUP(RC[-30],Sheet2!R1C1:R6C2,2,0)&RC[-29]&RC[-28]&RC[-27]&Sheet2!R1C3 -> 五.乙|cFF1BE6B8[宝石]七绝佛沙|r | AG160: =IF(RC[-26]&RC[-25]&RC[-24]&RC[-23]&RC[-22]&RC[-21]="",,R1C6)&IF(RC[-26]="",,"|n"&R1C7&RC[-26])&IF(RC[-25]="",,"|n"&R1C8&RC[-25])&IF(RC[-24]="",,"|n"&R1C9&RC[-24])&IF(RC[-23]="",,"|n"&R1C10&RC[-23])&IF(RC[-22]="",,"|n"&R1C11&RC[-22])&IF(RC[-21]="",,"|n"&R1C12&RC[-21])&IF(RC[-19]&RC[-18]&RC[-17]&RC[-16]="",,"|n|n"&R1C13)&IF(RC[-19]="",,"|n"&R1C14&RC[-19])&IF(RC[-18]="",,"|n"&R1C15&RC[-18])&IF(RC[-17]="",,"|n"&R1C16&RC[-17])&IF(RC[-16]="",,"|n"&R1C17&RC[-16])&IF(RC[-15]="",,"|n"&R1C18&RC[-15])&IF(RC[-14]="",,"|n"&R1C19&RC[-14])&IF(RC[-13]="",,"|n"&R1C20&RC[-13])&IF(RC[-12]="",,"|n"&R1C21&RC[-12])&IF(RC[-11]="",,"|n"&R1C22&RC[-11])&IF(RC[-10]="",,"|n"&R1C23&RC[-10])&IF(RC[-9]="",,"|n"&R1C24&RC[-9])&IF(RC[-8]="",,"|n"&R1C25&RC[-8])&IF(RC[-7]="",,"|n"&R1C26&RC[-7])&IF(RC[-6]="",,"|n"&R1C27&RC[-6])&IF(RC[-5]="",,"|n"&R1C28&RC[-5])&IF(RC[-2]="",,"|n|n"&RC[-2]) -> |cFFFFFF99基础属性|r|n智力:125000|n护甲:150|n伤害增幅:4|n|n用于镶嵌到[剑,衣]上.|n镶嵌后不可取下!|n不需要的宝石可以在宠物处熔炼,用于宝石抽奖.
A161: 5 | B161: B | C161: [宝石] | D161: 虚空神石 | G161: =IF(R[-132]C<>"",R[-132]C*50,"") ->  | H161: =IF(R[-132]C<>"",R[-132]C*50,"") ->  | I161: =IF(R[-132]C<>"",R[-132]C*50,"") -> 125000 | J161: =IF(R[-132]C<>"",R[-132]C*50,"") ->  | K161: =IF(R[-132]C<>"",R[-132]C*50,"") ->  | L161: =IF(R[-132]C<>"",INT(R[-132]C*6),"") -> 150 | M161: =IF(R[-132]C<>"",R[-132]C*54,"") ->  | N161: =IF(R[-132]C<>"",INT(R[-132]C*2),"") ->  | O161: =IF(R[-132]C<>"",INT(R[-132]C*2),"") ->  | P161: =IF(R[-132]C<>"",INT(R[-132]C*2),"") ->  | Q161: =IF(R[-132]C<>"",INT(R[-132]C*2),"") ->  | R161: =IF(R[-132]C<>"",INT(R[-132]C*2),"") -> 4 | AE161: 用于镶嵌到[剑,衣]上.|n镶嵌后不可取下!|n不需要的宝石可以在宠物处熔炼,用于宝石抽奖. | AF161: =VLOOKUP(RC[-31],Sheet2!R13C1:R19C2,2,0)&"."&VLOOKUP(RC[-30],Sheet2!R7C1:R12C2,2,0)&VLOOKUP(RC[-30],Sheet2!R1C1:R6C2,2,0)&RC[-29]&RC[-28]&RC[-27]&Sheet2!R1C3 -> 五.乙|cFF1BE6B8[宝石]虚空神石|r | AG161: =IF(RC[-26]&RC[-25]&RC[-24]&RC[-23]&RC[-22]&RC[-21]="",,R1C6)&IF(RC[-26]="",,"|n"&R1C7&RC[-26])&IF(RC[-25]="",,"|n"&R1C8&RC[-25])&IF(RC[-24]="",,"|n"&R1C9&RC[-24])&IF(RC[-23]="",,"|n"&R1C10&RC[-23])&IF(RC[-22]="",,"|n"&R1C11&RC[-22])&IF(RC[-21]="",,"|n"&R1C12&RC[-21])&IF(RC[-19]&RC[-18]&RC[-17]&RC[-16]="",,"|n|n"&R1C13)&IF(RC[-19]="",,"|n"&R1C14&RC[-19])&IF(RC[-18]="",,"|n"&R1C15&RC[-18])&IF(RC[-17]="",,"|n"&R1C16&RC[-17])&IF(RC[-16]="",,"|n"&R1C17&RC[-16])&IF(RC[-15]="",,"|n"&R1C18&RC[-15])&IF(RC[-14]="",,"|n"&R1C19&RC[-14])&IF(RC[-13]="",,"|n"&R1C20&RC[-13])&IF(RC[-12]="",,"|n"&R1C21&RC[-12])&IF(RC[-11]="",,"|n"&R1C22&RC[-11])&IF(RC[-10]="",,"|n"&R1C23&RC[-10])&IF(RC[-9]="",,"|n"&R1C24&RC[-9])&IF(RC[-8]="",,"|n"&R1C25&RC[-8])&IF(RC[-7]="",,"|n"&R1C26&RC[-7])&IF(RC[-6]="",,"|n"&R1C27&RC[-6])&IF(RC[-5]="",,"|n"&R1C28&RC[-5])&IF(RC[-2]="",,"|n|n"&RC[-2]) -> |cFFFFFF99基础属性|r|n敏捷:125000|n护甲:150|n伤害增幅:4|n|n用于镶嵌到[剑,衣]上.|n镶嵌后不可取下!|n不需要的宝石可以在宠物处熔炼,用于宝石抽奖.
A162: 5 | B162: A | C162: [宝石] | D162: 清泉流响 | G162: =IF(R[-132]C<>"",R[-132]C*50,"") ->  | H162: =IF(R[-132]C<>"",R[-132]C*50,"") -> 60000 | I162: =IF(R[-132]C<>"",R[-132]C*50,"") -> 60000 | J162: =IF(R[-132]C<>"",R[-132]C*50,"") -> 60000 | K162: =IF(R[-132]C<>"",R[-132]C*50,"") ->  | L162: =IF(R[-132]C<>"",INT(R[-132]C*6),"") ->  | M162: =IF(R[-132]C<>"",R[-132]C*54,"") ->  | N162: =IF(R[-132]C<>"",INT(R[-132]C*2),"") -> 12 | O162: =IF(R[-132]C<>"",INT(R[-132]C*2),"") ->  | P162: =IF(R[-132]C<>"",INT(R[-132]C*2),"") ->  | Q162: =IF(R[-132]C<>"",INT(R[-132]C*2),"") ->  | R162: =IF(R[-132]C<>"",INT(R[-132]C*2),"") -> 8 | S162: =IF(R[-132]C<>"",INT(R[-132]C*2),"") ->  | T162: =IF(R[-132]C<>"",INT(R[-132]C*2),"") ->  | AE162: 用于镶嵌到[剑,衣]上.|n镶嵌后不可取下!|n不需要的宝石可以在宠物处熔炼,用于宝石抽奖. | AF162: =VLOOKUP(RC[-31],Sheet2!R13C1:R19C2,2,0)&"."&VLOOKUP(RC[-30],Sheet2!R7C1:R12C2,2,0)&VLOOKUP(RC[-30],Sheet2!R1C1:R6C2,2,0)&RC[-29]&RC[-28]&RC[-27]&Sheet2!R1C3 -> 五.甲|cFF33FF00[宝石]清泉流响|r | AG162: =IF(RC[-26]&RC[-25]&RC[-24]&RC[-23]&RC[-22]&RC[-21]="",,R1C6)&IF(RC[-26]="",,"|n"&R1C7&RC[-26])&IF(RC[-25]="",,"|n"&R1C8&RC[-25])&IF(RC[-24]="",,"|n"&R1C9&RC[-24])&IF(RC[-23]="",,"|n"&R1C10&RC[-23])&IF(RC[-22]="",,"|n"&R1C11&RC[-22])&IF(RC[-21]="",,"|n"&R1C12&RC[-21])&IF(RC[-19]&RC[-18]&RC[-17]&RC[-16]="",,"|n|n"&R1C13)&IF(RC[-19]="",,"|n"&R1C14&RC[-19])&IF(RC[-18]="",,"|n"&R1C15&RC[-18])&IF(RC[-17]="",,"|n"&R1C16&RC[-17])&IF(RC[-16]="",,"|n"&R1C17&RC[-16])&IF(RC[-15]="",,"|n"&R1C18&RC[-15])&IF(RC[-14]="",,"|n"&R1C19&RC[-14])&IF(RC[-13]="",,"|n"&R1C20&RC[-13])&IF(RC[-12]="",,"|n"&R1C21&RC[-12])&IF(RC[-11]="",,"|n"&R1C22&RC[-11])&IF(RC[-10]="",,"|n"&R1C23&RC[-10])&IF(RC[-9]="",,"|n"&R1C24&RC[-9])&IF(RC[-8]="",,"|n"&R1C25&RC[-8])&IF(RC[-7]="",,"|n"&R1C26&RC[-7])&IF(RC[-6]="",,"|n"&R1C27&RC[-6])&IF(RC[-5]="",,"|n"&R1C28&RC[-5])&IF(RC[-2]="",,"|n|n"&RC[-2]) -> |cFFFFFF99基础属性|r|n力量:60000|n敏捷:60000|n智力:60000|n|n|cFFFFFF55附加属性|r(%)|n攻速:12|n伤害增幅:8|n|n用于镶嵌到[剑,衣]上.|n镶嵌后不可取下!|n不需要的宝石可以在宠物处熔炼,用于宝石抽奖.
A163: 5 | B163: A | C163: [宝石] | D163: 氤氲之息 | G163: =IF(R[-132]C<>"",R[-132]C*50,"") -> 400000 | H163: =IF(R[-132]C<>"",R[-132]C*50,"") ->  | I163: =IF(R[-132]C<>"",R[-132]C*50,"") ->  | J163: =IF(R[-132]C<>"",R[-132]C*50,"") ->  | K163: =IF(R[-132]C<>"",R[-132]C*50,"") ->  | L163: =IF(R[-132]C<>"",INT(R[-132]C*6),"") ->  | M163: =IF(R[-132]C<>"",R[-132]C*54,"") ->  | N163: =IF(R[-132]C<>"",INT(R[-132]C*2),"") -> 12 | O163: =IF(R[-132]C<>"",INT(R[-132]C*2),"") ->  | P163: =IF(R[-132]C<>"",INT(R[-132]C*2),"") ->  | Q163: =IF(R[-132]C<>"",INT(R[-132]C*2),"") ->  | R163: =IF(R[-132]C<>"",INT(R[-132]C*2),"") -> 8 | S163: =IF(R[-132]C<>"",INT(R[-132]C*2),"") ->  | T163: =IF(R[-132]C<>"",INT(R[-132]C*2),"") ->  | AE163: 用于镶嵌到[剑,衣]上.|n镶嵌后不可取下!|n不需要的宝石可以在宠物处熔炼,用于宝石抽奖. | AF163: =VLOOKUP(RC[-31],Sheet2!R13C1:R19C2,2,0)&"."&VLOOKUP(RC[-30],Sheet2!R7C1:R12C2,2,0)&VLOOKUP(RC[-30],Sheet2!R1C1:R6C2,2,0)&RC[-29]&RC[-28]&RC[-27]&Sheet2!R1C3 -> 五.甲|cFF33FF00[宝石]氤氲之息|r | AG163: =IF(RC[-26]&RC[-25]&RC[-24]&RC[-23]&RC[-22]&RC[-21]="",,R1C6)&IF(RC[-26]="",,"|n"&R1C7&RC[-26])&IF(RC[-25]="",,"|n"&R1C8&RC[-25])&IF(RC[-24]="",,"|n"&R1C9&RC[-24])&IF(RC[-23]="",,"|n"&R1C10&RC[-23])&IF(RC[-22]="",,"|n"&R1C11&RC[-22])&IF(RC[-21]="",,"|n"&R1C12&RC[-21])&IF(RC[-19]&RC[-18]&RC[-17]&RC[-16]="",,"|n|n"&R1C13)&IF(RC[-19]="",,"|n"&R1C14&RC[-19])&IF(RC[-18]="",,"|n"&R1C15&RC[-18])&IF(RC[-17]="",,"|n"&R1C16&RC[-17])&IF(RC[-16]="",,"|n"&R1C17&RC[-16])&IF(RC[-15]="",,"|n"&R1C18&RC[-15])&IF(RC[-14]="",,"|n"&R1C19&RC[-14])&IF(RC[-13]="",,"|n"&R1C20&RC[-13])&IF(RC[-12]="",,"|n"&R1C21&RC[-12])&IF(RC[-11]="",,"|n"&R1C22&RC[-11])&IF(RC[-10]="",,"|n"&R1C23&RC[-10])&IF(RC[-9]="",,"|n"&R1C24&RC[-9])&IF(RC[-8]="",,"|n"&R1C25&RC[-8])&IF(RC[-7]="",,"|n"&R1C26&RC[-7])&IF(RC[-6]="",,"|n"&R1C27&RC[-6])&IF(RC[-5]="",,"|n"&R1C28&RC[-5])&IF(RC[-2]="",,"|n|n"&RC[-2]) -> |cFFFFFF99基础属性|r|n攻击:400000|n|n|cFFFFFF55附加属性|r(%)|n攻速:12|n伤害增幅:8|n|n用于镶嵌到[剑,衣]上.|n镶嵌后不可取下!|n不需要的宝石可以在宠物处熔炼,用于宝石抽奖.
A164: 5 | B164: S | C164: [宝石] | D164: 忆古昔 - 守心 | G164: =IF(R[-132]C<>"",R[-132]C*50,"") ->  | H164: =IF(R[-132]C<>"",R[-132]C*50,"") ->  | I164: =IF(R[-132]C<>"",R[-132]C*50,"") ->  | J164: =IF(R[-132]C<>"",R[-132]C*50,"") ->  | K164: =IF(R[-132]C<>"",R[-132]C*50,"") -> 1500000 | L164: =IF(R[-132]C<>"",INT(R[-132]C*6),"") -> 900 | M164: =IF(R[-132]C<>"",R[-132]C*54,"") ->  | N164: =IF(R[-132]C<>"",INT(R[-132]C*2),"") ->  | O164: =IF(R[-132]C<>"",INT(R[-132]C*2),"") -> 2 | P164: =IF(R[-132]C<>"",INT(R[-132]C*2),"") ->  | Q164: =IF(R[-132]C<>"",INT(R[-132]C*2),"") ->  | R164: =IF(R[-132]C<>"",INT(R[-132]C*2),"") -> 8 | S164: =IF(R[-132]C<>"",INT(R[-132]C*2),"") ->  | T164: =IF(R[-132]C<>"",INT(R[-132]C*2),"") ->  | AE164: 用于镶嵌到[剑,衣]上.|n镶嵌后不可取下!|n不需要的宝石可以在宠物处熔炼,用于宝石抽奖. | AF164: =VLOOKUP(RC[-31],Sheet2!R13C1:R19C2,2,0)&"."&VLOOKUP(RC[-30],Sheet2!R7C1:R12C2,2,0)&VLOOKUP(RC[-30],Sheet2!R1C1:R6C2,2,0)&RC[-29]&RC[-28]&RC[-27]&Sheet2!R1C3 -> 五.绝|cFFFF9933[宝石]忆古昔 - 守心|r | AG164: =IF(RC[-26]&RC[-25]&RC[-24]&RC[-23]&RC[-22]&RC[-21]="",,R1C6)&IF(RC[-26]="",,"|n"&R1C7&RC[-26])&IF(RC[-25]="",,"|n"&R1C8&RC[-25])&IF(RC[-24]="",,"|n"&R1C9&RC[-24])&IF(RC[-23]="",,"|n"&R1C10&RC[-23])&IF(RC[-22]="",,"|n"&R1C11&RC[-22])&IF(RC[-21]="",,"|n"&R1C12&RC[-21])&IF(RC[-19]&RC[-18]&RC[-17]&RC[-16]="",,"|n|n"&R1C13)&IF(RC[-19]="",,"|n"&R1C14&RC[-19])&IF(RC[-18]="",,"|n"&R1C15&RC[-18])&IF(RC[-17]="",,"|n"&R1C16&RC[-17])&IF(RC[-16]="",,"|n"&R1C17&RC[-16])&IF(RC[-15]="",,"|n"&R1C18&RC[-15])&IF(RC[-14]="",,"|n"&R1C19&RC[-14])&IF(RC[-13]="",,"|n"&R1C20&RC[-13])&IF(RC[-12]="",,"|n"&R1C21&RC[-12])&IF(RC[-11]="",,"|n"&R1C22&RC[-11])&IF(RC[-10]="",,"|n"&R1C23&RC[-10])&IF(RC[-9]="",,"|n"&R1C24&RC[-9])&IF(RC[-8]="",,"|n"&R1C25&RC[-8])&IF(RC[-7]="",,"|n"&R1C26&RC[-7])&IF(RC[-6]="",,"|n"&R1C27&RC[-6])&IF(RC[-5]="",,"|n"&R1C28&RC[-5])&IF(RC[-2]="",,"|n|n"&RC[-2]) -> |cFFFFFF99基础属性|r|n血量:1500000|n护甲:900|n|n|cFFFFFF55附加属性|r(%)|n攻击吸血:2|n伤害增幅:8|n|n用于镶嵌到[剑,衣]上.|n镶嵌后不可取下!|n不需要的宝石可以在宠物处熔炼,用于宝石抽奖.
A165: 5 | B165: S | C165: [宝石] | D165: 忆古昔 - 克己 | G165: =IF(R[-132]C<>"",R[-132]C*50,"") -> 125000 | H165: =IF(R[-132]C<>"",R[-132]C*50,"") ->  | I165: =IF(R[-132]C<>"",R[-132]C*50,"") ->  | J165: =IF(R[-132]C<>"",R[-132]C*50,"") ->  | K165: =IF(R[-132]C<>"",R[-132]C*50,"") ->  | L165: =IF(R[-132]C<>"",INT(R[-132]C*6),"") ->  | M165: =IF(R[-132]C<>"",R[-132]C*54,"") ->  | N165: =IF(R[-132]C<>"",INT(R[-132]C*2),"") ->  | O165: =IF(R[-132]C<>"",INT(R[-132]C*2),"") ->  | P165: =IF(R[-132]C<>"",INT(R[-132]C*2),"") -> 10 | Q165: =IF(R[-132]C<>"",INT(R[-132]C*2),"") -> 40 | R165: =IF(R[-132]C<>"",INT(R[-132]C*2),"") -> 8 | S165: =IF(R[-132]C<>"",INT(R[-132]C*2),"") ->  | T165: =IF(R[-132]C<>"",INT(R[-132]C*2),"") ->  | AE165: 用于镶嵌到[剑,衣]上.|n镶嵌后不可取下!|n不需要的宝石可以在宠物处熔炼,用于宝石抽奖. | AF165: =VLOOKUP(RC[-31],Sheet2!R13C1:R19C2,2,0)&"."&VLOOKUP(RC[-30],Sheet2!R7C1:R12C2,2,0)&VLOOKUP(RC[-30],Sheet2!R1C1:R6C2,2,0)&RC[-29]&RC[-28]&RC[-27]&Sheet2!R1C3 -> 五.绝|cFFFF9933[宝石]忆古昔 - 克己|r | AG165: =IF(RC[-26]&RC[-25]&RC[-24]&RC[-23]&RC[-22]&RC[-21]="",,R1C6)&IF(RC[-26]="",,"|n"&R1C7&RC[-26])&IF(RC[-25]="",,"|n"&R1C8&RC[-25])&IF(RC[-24]="",,"|n"&R1C9&RC[-24])&IF(RC[-23]="",,"|n"&R1C10&RC[-23])&IF(RC[-22]="",,"|n"&R1C11&RC[-22])&IF(RC[-21]="",,"|n"&R1C12&RC[-21])&IF(RC[-19]&RC[-18]&RC[-17]&RC[-16]="",,"|n|n"&R1C13)&IF(RC[-19]="",,"|n"&R1C14&RC[-19])&IF(RC[-18]="",,"|n"&R1C15&RC[-18])&IF(RC[-17]="",,"|n"&R1C16&RC[-17])&IF(RC[-16]="",,"|n"&R1C17&RC[-16])&IF(RC[-15]="",,"|n"&R1C18&RC[-15])&IF(RC[-14]="",,"|n"&R1C19&RC[-14])&IF(RC[-13]="",,"|n"&R1C20&RC[-13])&IF(RC[-12]="",,"|n"&R1C21&RC[-12])&IF(RC[-11]="",,"|n"&R1C22&RC[-11])&IF(RC[-10]="",,"|n"&R1C23&RC[-10])&IF(RC[-9]="",,"|n"&R1C24&RC[-9])&IF(RC[-8]="",,"|n"&R1C25&RC[-8])&IF(RC[-7]="",,"|n"&R1C26&RC[-7])&IF(RC[-6]="",,"|n"&R1C27&RC[-6])&IF(RC[-5]="",,"|n"&R1C28&RC[-5])&IF(RC[-2]="",,"|n|n"&RC[-2]) -> |cFFFFFF99基础属性|r|n攻击:125000|n|n|cFFFFFF55附加属性|r(%)|n暴击概率:10|n暴击伤害:40|n伤害增幅:8|n|n用于镶嵌到[剑,衣]上.|n镶嵌后不可取下!|n不需要的宝石可以在宠物处熔炼,用于宝石抽奖.
A166: 5 | B166: X | C166: [宝石] | D166: 上古遗物 - 制人 | G166: =IF(R[-132]C<>"",R[-132]C*50,"") ->  | H166: =IF(R[-132]C<>"",R[-132]C*50,"") ->  | I166: =IF(R[-132]C<>"",R[-132]C*50,"") ->  | J166: =IF(R[-132]C<>"",R[-132]C*50,"") ->  | K166: =IF(R[-132]C<>"",R[-132]C*50,"") -> 3000000 | L166: =IF(R[-132]C<>"",INT(R[-132]C*6),"") -> 1200 | M166: =IF(R[-132]C<>"",R[-132]C*54,"") ->  | N166: =IF(R[-132]C<>"",INT(R[-132]C*2),"") ->  | O166: =IF(R[-132]C<>"",INT(R[-132]C*2),"") ->  | P166: =IF(R[-132]C<>"",INT(R[-132]C*2),"") ->  | Q166: =IF(R[-132]C<>"",INT(R[-132]C*2),"") -> 40 | R166: =IF(R[-132]C<>"",INT(R[-132]C*2),"") -> 16 | S166: =IF(R[-132]C<>"",INT(R[-132]C*2),"") ->  | T166: =IF(R[-132]C<>"",INT(R[-132]C*2),"") ->  | AE166: 用于镶嵌到[剑,衣]上.|n镶嵌后不可取下!|n不需要的宝石可以在宠物处熔炼,用于宝石抽奖. | AF166: =VLOOKUP(RC[-31],Sheet2!R13C1:R19C2,2,0)&"."&VLOOKUP(RC[-30],Sheet2!R7C1:R12C2,2,0)&VLOOKUP(RC[-30],Sheet2!R1C1:R6C2,2,0)&RC[-29]&RC[-28]&RC[-27]&Sheet2!R1C3 -> 五.神|Cffff0000[宝石]上古遗物 - 制人|r | AG166: =IF(RC[-26]&RC[-25]&RC[-24]&RC[-23]&RC[-22]&RC[-21]="",,R1C6)&IF(RC[-26]="",,"|n"&R1C7&RC[-26])&IF(RC[-25]="",,"|n"&R1C8&RC[-25])&IF(RC[-24]="",,"|n"&R1C9&RC[-24])&IF(RC[-23]="",,"|n"&R1C10&RC[-23])&IF(RC[-22]="",,"|n"&R1C11&RC[-22])&IF(RC[-21]="",,"|n"&R1C12&RC[-21])&IF(RC[-19]&RC[-18]&RC[-17]&RC[-16]="",,"|n|n"&R1C13)&IF(RC[-19]="",,"|n"&R1C14&RC[-19])&IF(RC[-18]="",,"|n"&R1C15&RC[-18])&IF(RC[-17]="",,"|n"&R1C16&RC[-17])&IF(RC[-16]="",,"|n"&R1C17&RC[-16])&IF(RC[-15]="",,"|n"&R1C18&RC[-15])&IF(RC[-14]="",,"|n"&R1C19&RC[-14])&IF(RC[-13]="",,"|n"&R1C20&RC[-13])&IF(RC[-12]="",,"|n"&R1C21&RC[-12])&IF(RC[-11]="",,"|n"&R1C22&RC[-11])&IF(RC[-10]="",,"|n"&R1C23&RC[-10])&IF(RC[-9]="",,"|n"&R1C24&RC[-9])&IF(RC[-8]="",,"|n"&R1C25&RC[-8])&IF(RC[-7]="",,"|n"&R1C26&RC[-7])&IF(RC[-6]="",,"|n"&R1C27&RC[-6])&IF(RC[-5]="",,"|n"&R1C28&RC[-5])&IF(RC[-2]="",,"|n|n"&RC[-2]) -> |cFFFFFF99基础属性|r|n血量:3000000|n护甲:1200|n|n|cFFFFFF55附加属性|r(%)|n暴击伤害:40|n伤害增幅:16|n|n用于镶嵌到[剑,衣]上.|n镶嵌后不可取下!|n不需要的宝石可以在宠物处熔炼,用于宝石抽奖.
A167: 6 | B167: D | C167: [宝石] | D167: 五灵 | G167: =IF(R[-165]C<>"",R[-165]C*120,"") ->  | H167: =IF(R[-165]C<>"",R[-165]C*120,"") ->  | I167: =IF(R[-165]C<>"",R[-165]C*120,"") ->  | J167: =IF(R[-165]C<>"",R[-165]C*120,"") ->  | K167: =IF(R[-165]C<>"",R[-165]C*120,"") ->  | L167: =IF(R[-165]C<>"",INT(R[-165]C*8),"") ->  | M167: =IF(R[-165]C<>"",R[-165]C*120,"") ->  | N167: =IF(R[-165]C<>"",INT(R[-165]C*2.5),"") ->  | O167: =IF(R[-165]C<>"",INT(R[-165]C*2.5),"") ->  | AE167: 用于镶嵌到[剑,衣]上.|n镶嵌后不可取下!|n不需要的宝石可以在宠物处熔炼,用于宝石抽奖. | AF167: =VLOOKUP(RC[-31],Sheet2!R13C1:R19C2,2,0)&"."&VLOOKUP(RC[-30],Sheet2!R7C1:R12C2,2,0)&VLOOKUP(RC[-30],Sheet2!R1C1:R6C2,2,0)&RC[-29]&RC[-28]&RC[-27]&Sheet2!R1C3 -> 六.丁|cFF999999[宝石]五灵|r | AG167: =IF(RC[-26]&RC[-25]&RC[-24]&RC[-23]&RC[-22]&RC[-21]="",,R1C6)&IF(RC[-26]="",,"|n"&R1C7&RC[-26])&IF(RC[-25]="",,"|n"&R1C8&RC[-25])&IF(RC[-24]="",,"|n"&R1C9&RC[-24])&IF(RC[-23]="",,"|n"&R1C10&RC[-23])&IF(RC[-22]="",,"|n"&R1C11&RC[-22])&IF(RC[-21]="",,"|n"&R1C12&RC[-21])&IF(RC[-19]&RC[-18]&RC[-17]&RC[-16]="",,"|n|n"&R1C13)&IF(RC[-19]="",,"|n"&R1C14&RC[-19])&IF(RC[-18]="",,"|n"&R1C15&RC[-18])&IF(RC[-17]="",,"|n"&R1C16&RC[-17])&IF(RC[-16]="",,"|n"&R1C17&RC[-16])&IF(RC[-15]="",,"|n"&R1C18&RC[-15])&IF(RC[-14]="",,"|n"&R1C19&RC[-14])&IF(RC[-13]="",,"|n"&R1C20&RC[-13])&IF(RC[-12]="",,"|n"&R1C21&RC[-12])&IF(RC[-11]="",,"|n"&R1C22&RC[-11])&IF(RC[-10]="",,"|n"&R1C23&RC[-10])&IF(RC[-9]="",,"|n"&R1C24&RC[-9])&IF(RC[-8]="",,"|n"&R1C25&RC[-8])&IF(RC[-7]="",,"|n"&R1C26&RC[-7])&IF(RC[-6]="",,"|n"&R1C27&RC[-6])&IF(RC[-5]="",,"|n"&R1C28&RC[-5])&IF(RC[-2]="",,"|n|n"&RC[-2]) -> |n|n用于镶嵌到[剑,衣]上.|n镶嵌后不可取下!|n不需要的宝石可以在宠物处熔炼,用于宝石抽奖.
A168: 6 | B168: D | C168: [宝石] | D168: 邪月 | G168: =IF(R[-165]C<>"",R[-165]C*120,"") ->  | H168: =IF(R[-165]C<>"",R[-165]C*120,"") ->  | I168: =IF(R[-165]C<>"",R[-165]C*120,"") ->  | J168: =IF(R[-165]C<>"",R[-165]C*120,"") ->  | K168: =IF(R[-165]C<>"",R[-165]C*120,"") ->  | L168: =IF(R[-165]C<>"",INT(R[-165]C*8),"") ->  | M168: =IF(R[-165]C<>"",R[-165]C*120,"") ->  | N168: =IF(R[-165]C<>"",INT(R[-165]C*2.5),"") ->  | O168: =IF(R[-165]C<>"",INT(R[-165]C*2.5),"") ->  | AE168: 用于镶嵌到[剑,衣]上.|n镶嵌后不可取下!|n不需要的宝石可以在宠物处熔炼,用于宝石抽奖. | AF168: =VLOOKUP(RC[-31],Sheet2!R13C1:R19C2,2,0)&"."&VLOOKUP(RC[-30],Sheet2!R7C1:R12C2,2,0)&VLOOKUP(RC[-30],Sheet2!R1C1:R6C2,2,0)&RC[-29]&RC[-28]&RC[-27]&Sheet2!R1C3 -> 六.丁|cFF999999[宝石]邪月|r | AG168: =IF(RC[-26]&RC[-25]&RC[-24]&RC[-23]&RC[-22]&RC[-21]="",,R1C6)&IF(RC[-26]="",,"|n"&R1C7&RC[-26])&IF(RC[-25]="",,"|n"&R1C8&RC[-25])&IF(RC[-24]="",,"|n"&R1C9&RC[-24])&IF(RC[-23]="",,"|n"&R1C10&RC[-23])&IF(RC[-22]="",,"|n"&R1C11&RC[-22])&IF(RC[-21]="",,"|n"&R1C12&RC[-21])&IF(RC[-19]&RC[-18]&RC[-17]&RC[-16]="",,"|n|n"&R1C13)&IF(RC[-19]="",,"|n"&R1C14&RC[-19])&IF(RC[-18]="",,"|n"&R1C15&RC[-18])&IF(RC[-17]="",,"|n"&R1C16&RC[-17])&IF(RC[-16]="",,"|n"&R1C17&RC[-16])&IF(RC[-15]="",,"|n"&R1C18&RC[-15])&IF(RC[-14]="",,"|n"&R1C19&RC[-14])&IF(RC[-13]="",,"|n"&R1C20&RC[-13])&IF(RC[-12]="",,"|n"&R1C21&RC[-12])&IF(RC[-11]="",,"|n"&R1C22&RC[-11])&IF(RC[-10]="",,"|n"&R1C23&RC[-10])&IF(RC[-9]="",,"|n"&R1C24&RC[-9])&IF(RC[-8]="",,"|n"&R1C25&RC[-8])&IF(RC[-7]="",,"|n"&R1C26&RC[-7])&IF(RC[-6]="",,"|n"&R1C27&RC[-6])&IF(RC[-5]="",,"|n"&R1C28&RC[-5])&IF(RC[-2]="",,"|n|n"&RC[-2]) -> |n|n用于镶嵌到[剑,衣]上.|n镶嵌后不可取下!|n不需要的宝石可以在宠物处熔炼,用于宝石抽奖.
A169: 6 | B169: D | C169: [宝石] | D169: 枯禅 | G169: =IF(R[-165]C<>"",R[-165]C*120,"") ->  | H169: =IF(R[-165]C<>"",R[-165]C*120,"") ->  | I169: =IF(R[-165]C<>"",R[-165]C*120,"") ->  | J169: =IF(R[-165]C<>"",R[-165]C*120,"") ->  | K169: =IF(R[-165]C<>"",R[-165]C*120,"") ->  | L169: =IF(R[-165]C<>"",INT(R[-165]C*8),"") ->  | M169: =IF(R[-165]C<>"",R[-165]C*120,"") ->  | N169: =IF(R[-165]C<>"",INT(R[-165]C*2.5),"") ->  | O169: =IF(R[-165]C<>"",INT(R[-165]C*2.5),"") ->  | AE169: 用于镶嵌到[剑,衣]上.|n镶嵌后不可取下!|n不需要的宝石可以在宠物处熔炼,用于宝石抽奖. | AF169: =VLOOKUP(RC[-31],Sheet2!R13C1:R19C2,2,0)&"."&VLOOKUP(RC[-30],Sheet2!R7C1:R12C2,2,0)&VLOOKUP(RC[-30],Sheet2!R1C1:R6C2,2,0)&RC[-29]&RC[-28]&RC[-27]&Sheet2!R1C3 -> 六.丁|cFF999999[宝石]枯禅|r | AG169: =IF(RC[-26]&RC[-25]&RC[-24]&RC[-23]&RC[-22]&RC[-21]="",,R1C6)&IF(RC[-26]="",,"|n"&R1C7&RC[-26])&IF(RC[-25]="",,"|n"&R1C8&RC[-25])&IF(RC[-24]="",,"|n"&R1C9&RC[-24])&IF(RC[-23]="",,"|n"&R1C10&RC[-23])&IF(RC[-22]="",,"|n"&R1C11&RC[-22])&IF(RC[-21]="",,"|n"&R1C12&RC[-21])&IF(RC[-19]&RC[-18]&RC[-17]&RC[-16]="",,"|n|n"&R1C13)&IF(RC[-19]="",,"|n"&R1C14&RC[-19])&IF(RC[-18]="",,"|n"&R1C15&RC[-18])&IF(RC[-17]="",,"|n"&R1C16&RC[-17])&IF(RC[-16]="",,"|n"&R1C17&RC[-16])&IF(RC[-15]="",,"|n"&R1C18&RC[-15])&IF(RC[-14]="",,"|n"&R1C19&RC[-14])&IF(RC[-13]="",,"|n"&R1C20&RC[-13])&IF(RC[-12]="",,"|n"&R1C21&RC[-12])&IF(RC[-11]="",,"|n"&R1C22&RC[-11])&IF(RC[-10]="",,"|n"&R1C23&RC[-10])&IF(RC[-9]="",,"|n"&R1C24&RC[-9])&IF(RC[-8]="",,"|n"&R1C25&RC[-8])&IF(RC[-7]="",,"|n"&R1C26&RC[-7])&IF(RC[-6]="",,"|n"&R1C27&RC[-6])&IF(RC[-5]="",,"|n"&R1C28&RC[-5])&IF(RC[-2]="",,"|n|n"&RC[-2]) -> |n|n用于镶嵌到[剑,衣]上.|n镶嵌后不可取下!|n不需要的宝石可以在宠物处熔炼,用于宝石抽奖.
A170: 6 | B170: D | C170: [宝石] | D170: 千红 | G170: =IF(R[-165]C<>"",R[-165]C*120,"") ->  | H170: =IF(R[-165]C<>"",R[-165]C*120,"") ->  | I170: =IF(R[-165]C<>"",R[-165]C*120,"") ->  | J170: =IF(R[-165]C<>"",R[-165]C*120,"") ->  | K170: =IF(R[-165]C<>"",R[-165]C*120,"") ->  | L170: =IF(R[-165]C<>"",INT(R[-165]C*8),"") ->  | M170: =IF(R[-165]C<>"",R[-165]C*120,"") ->  | N170: =IF(R[-165]C<>"",INT(R[-165]C*2.5),"") ->  | O170: =IF(R[-165]C<>"",INT(R[-165]C*2.5),"") ->  | AE170: 用于镶嵌到[剑,衣]上.|n镶嵌后不可取下!|n不需要的宝石可以在宠物处熔炼,用于宝石抽奖. | AF170: =VLOOKUP(RC[-31],Sheet2!R13C1:R19C2,2,0)&"."&VLOOKUP(RC[-30],Sheet2!R7C1:R12C2,2,0)&VLOOKUP(RC[-30],Sheet2!R1C1:R6C2,2,0)&RC[-29]&RC[-28]&RC[-27]&Sheet2!R1C3 -> 六.丁|cFF999999[宝石]千红|r | AG170: =IF(RC[-26]&RC[-25]&RC[-24]&RC[-23]&RC[-22]&RC[-21]="",,R1C6)&IF(RC[-26]="",,"|n"&R1C7&RC[-26])&IF(RC[-25]="",,"|n"&R1C8&RC[-25])&IF(RC[-24]="",,"|n"&R1C9&RC[-24])&IF(RC[-23]="",,"|n"&R1C10&RC[-23])&IF(RC[-22]="",,"|n"&R1C11&RC[-22])&IF(RC[-21]="",,"|n"&R1C12&RC[-21])&IF(RC[-19]&RC[-18]&RC[-17]&RC[-16]="",,"|n|n"&R1C13)&IF(RC[-19]="",,"|n"&R1C14&RC[-19])&IF(RC[-18]="",,"|n"&R1C15&RC[-18])&IF(RC[-17]="",,"|n"&R1C16&RC[-17])&IF(RC[-16]="",,"|n"&R1C17&RC[-16])&IF(RC[-15]="",,"|n"&R1C18&RC[-15])&IF(RC[-14]="",,"|n"&R1C19&RC[-14])&IF(RC[-13]="",,"|n"&R1C20&RC[-13])&IF(RC[-12]="",,"|n"&R1C21&RC[-12])&IF(RC[-11]="",,"|n"&R1C22&RC[-11])&IF(RC[-10]="",,"|n"&R1C23&RC[-10])&IF(RC[-9]="",,"|n"&R1C24&RC[-9])&IF(RC[-8]="",,"|n"&R1C25&RC[-8])&IF(RC[-7]="",,"|n"&R1C26&RC[-7])&IF(RC[-6]="",,"|n"&R1C27&RC[-6])&IF(RC[-5]="",,"|n"&R1C28&RC[-5])&IF(RC[-2]="",,"|n|n"&RC[-2]) -> |n|n用于镶嵌到[剑,衣]上.|n镶嵌后不可取下!|n不需要的宝石可以在宠物处熔炼,用于宝石抽奖.
A171: 6 | B171: D | C171: [宝石] | D171: 照影 | G171: =IF(R[-165]C<>"",R[-165]C*120,"") ->  | H171: =IF(R[-165]C<>"",R[-165]C*120,"") ->  | I171: =IF(R[-165]C<>"",R[-165]C*120,"") ->  | J171: =IF(R[-165]C<>"",R[-165]C*120,"") ->  | K171: =IF(R[-165]C<>"",R[-165]C*120,"") ->  | L171: =IF(R[-165]C<>"",INT(R[-165]C*8),"") ->  | M171: =IF(R[-165]C<>"",R[-165]C*120,"") ->  | N171: =IF(R[-165]C<>"",INT(R[-165]C*2.5),"") ->  | O171: =IF(R[-165]C<>"",INT(R[-165]C*2.5),"") ->  | AE171: 用于镶嵌到[剑,衣]上.|n镶嵌后不可取下!|n不需要的宝石可以在宠物处熔炼,用于宝石抽奖. | AF171: =VLOOKUP(RC[-31],Sheet2!R13C1:R19C2,2,0)&"."&VLOOKUP(RC[-30],Sheet2!R7C1:R12C2,2,0)&VLOOKUP(RC[-30],Sheet2!R1C1:R6C2,2,0)&RC[-29]&RC[-28]&RC[-27]&Sheet2!R1C3 -> 六.丁|cFF999999[宝石]照影|r | AG171: =IF(RC[-26]&RC[-25]&RC[-24]&RC[-23]&RC[-22]&RC[-21]="",,R1C6)&IF(RC[-26]="",,"|n"&R1C7&RC[-26])&IF(RC[-25]="",,"|n"&R1C8&RC[-25])&IF(RC[-24]="",,"|n"&R1C9&RC[-24])&IF(RC[-23]="",,"|n"&R1C10&RC[-23])&IF(RC[-22]="",,"|n"&R1C11&RC[-22])&IF(RC[-21]="",,"|n"&R1C12&RC[-21])&IF(RC[-19]&RC[-18]&RC[-17]&RC[-16]="",,"|n|n"&R1C13)&IF(RC[-19]="",,"|n"&R1C14&RC[-19])&IF(RC[-18]="",,"|n"&R1C15&RC[-18])&IF(RC[-17]="",,"|n"&R1C16&RC[-17])&IF(RC[-16]="",,"|n"&R1C17&RC[-16])&IF(RC[-15]="",,"|n"&R1C18&RC[-15])&IF(RC[-14]="",,"|n"&R1C19&RC[-14])&IF(RC[-13]="",,"|n"&R1C20&RC[-13])&IF(RC[-12]="",,"|n"&R1C21&RC[-12])&IF(RC[-11]="",,"|n"&R1C22&RC[-11])&IF(RC[-10]="",,"|n"&R1C23&RC[-10])&IF(RC[-9]="",,"|n"&R1C24&RC[-9])&IF(RC[-8]="",,"|n"&R1C25&RC[-8])&IF(RC[-7]="",,"|n"&R1C26&RC[-7])&IF(RC[-6]="",,"|n"&R1C27&RC[-6])&IF(RC[-5]="",,"|n"&R1C28&RC[-5])&IF(RC[-2]="",,"|n|n"&RC[-2]) -> |n|n用于镶嵌到[剑,衣]上.|n镶嵌后不可取下!|n不需要的宝石可以在宠物处熔炼,用于宝石抽奖.
A172: 6 | B172: D | C172: [宝石] | D172: 追魂 | G172: =IF(R[-165]C<>"",R[-165]C*120,"") ->  | H172: =IF(R[-165]C<>"",R[-165]C*120,"") ->  | I172: =IF(R[-165]C<>"",R[-165]C*120,"") ->  | J172: =IF(R[-165]C<>"",R[-165]C*120,"") ->  | K172: =IF(R[-165]C<>"",R[-165]C*120,"") ->  | L172: =IF(R[-165]C<>"",INT(R[-165]C*8),"") ->  | M172: =IF(R[-165]C<>"",R[-165]C*120,"") ->  | N172: =IF(R[-165]C<>"",INT(R[-165]C*2.5),"") ->  | O172: =IF(R[-165]C<>"",INT(R[-165]C*2.5),"") ->  | AE172: 用于镶嵌到[剑,衣]上.|n镶嵌后不可取下!|n不需要的宝石可以在宠物处熔炼,用于宝石抽奖. | AF172: =VLOOKUP(RC[-31],Sheet2!R13C1:R19C2,2,0)&"."&VLOOKUP(RC[-30],Sheet2!R7C1:R12C2,2,0)&VLOOKUP(RC[-30],Sheet2!R1C1:R6C2,2,0)&RC[-29]&RC[-28]&RC[-27]&Sheet2!R1C3 -> 六.丁|cFF999999[宝石]追魂|r | AG172: =IF(RC[-26]&RC[-25]&RC[-24]&RC[-23]&RC[-22]&RC[-21]="",,R1C6)&IF(RC[-26]="",,"|n"&R1C7&RC[-26])&IF(RC[-25]="",,"|n"&R1C8&RC[-25])&IF(RC[-24]="",,"|n"&R1C9&RC[-24])&IF(RC[-23]="",,"|n"&R1C10&RC[-23])&IF(RC[-22]="",,"|n"&R1C11&RC[-22])&IF(RC[-21]="",,"|n"&R1C12&RC[-21])&IF(RC[-19]&RC[-18]&RC[-17]&RC[-16]="",,"|n|n"&R1C13)&IF(RC[-19]="",,"|n"&R1C14&RC[-19])&IF(RC[-18]="",,"|n"&R1C15&RC[-18])&IF(RC[-17]="",,"|n"&R1C16&RC[-17])&IF(RC[-16]="",,"|n"&R1C17&RC[-16])&IF(RC[-15]="",,"|n"&R1C18&RC[-15])&IF(RC[-14]="",,"|n"&R1C19&RC[-14])&IF(RC[-13]="",,"|n"&R1C20&RC[-13])&IF(RC[-12]="",,"|n"&R1C21&RC[-12])&IF(RC[-11]="",,"|n"&R1C22&RC[-11])&IF(RC[-10]="",,"|n"&R1C23&RC[-10])&IF(RC[-9]="",,"|n"&R1C24&RC[-9])&IF(RC[-8]="",,"|n"&R1C25&RC[-8])&IF(RC[-7]="",,"|n"&R1C26&RC[-7])&IF(RC[-6]="",,"|n"&R1C27&RC[-6])&IF(RC[-5]="",,"|n"&R1C28&RC[-5])&IF(RC[-2]="",,"|n|n"&RC[-2]) -> |n|n用于镶嵌到[剑,衣]上.|n镶嵌后不可取下!|n不需要的宝石可以在宠物处熔炼,用于宝石抽奖.
A173: 6 | B173: D | C173: [宝石] | D173: 极光 | G173: =IF(R[-165]C<>"",R[-165]C*120,"") ->  | H173: =IF(R[-165]C<>"",R[-165]C*120,"") ->  | I173: =IF(R[-165]C<>"",R[-165]C*120,"") ->  | J173: =IF(R[-165]C<>"",R[-165]C*120,"") ->  | K173: =IF(R[-165]C<>"",R[-165]C*120,"") ->  | L173: =IF(R[-165]C<>"",INT(R[-165]C*8),"") ->  | M173: =IF(R[-165]C<>"",R[-165]C*120,"") ->  | N173: =IF(R[-165]C<>"",INT(R[-165]C*2.5),"") ->  | O173: =IF(R[-165]C<>"",INT(R[-165]C*2.5),"") ->  | AE173: 用于镶嵌到[剑,衣]上.|n镶嵌后不可取下!|n不需要的宝石可以在宠物处熔炼,用于宝石抽奖. | AF173: =VLOOKUP(RC[-31],Sheet2!R13C1:R19C2,2,0)&"."&VLOOKUP(RC[-30],Sheet2!R7C1:R12C2,2,0)&VLOOKUP(RC[-30],Sheet2!R1C1:R6C2,2,0)&RC[-29]&RC[-28]&RC[-27]&Sheet2!R1C3 -> 六.丁|cFF999999[宝石]极光|r | AG173: =IF(RC[-26]&RC[-25]&RC[-24]&RC[-23]&RC[-22]&RC[-21]="",,R1C6)&IF(RC[-26]="",,"|n"&R1C7&RC[-26])&IF(RC[-25]="",,"|n"&R1C8&RC[-25])&IF(RC[-24]="",,"|n"&R1C9&RC[-24])&IF(RC[-23]="",,"|n"&R1C10&RC[-23])&IF(RC[-22]="",,"|n"&R1C11&RC[-22])&IF(RC[-21]="",,"|n"&R1C12&RC[-21])&IF(RC[-19]&RC[-18]&RC[-17]&RC[-16]="",,"|n|n"&R1C13)&IF(RC[-19]="",,"|n"&R1C14&RC[-19])&IF(RC[-18]="",,"|n"&R1C15&RC[-18])&IF(RC[-17]="",,"|n"&R1C16&RC[-17])&IF(RC[-16]="",,"|n"&R1C17&RC[-16])&IF(RC[-15]="",,"|n"&R1C18&RC[-15])&IF(RC[-14]="",,"|n"&R1C19&RC[-14])&IF(RC[-13]="",,"|n"&R1C20&RC[-13])&IF(RC[-12]="",,"|n"&R1C21&RC[-12])&IF(RC[-11]="",,"|n"&R1C22&RC[-11])&IF(RC[-10]="",,"|n"&R1C23&RC[-10])&IF(RC[-9]="",,"|n"&R1C24&RC[-9])&IF(RC[-8]="",,"|n"&R1C25&RC[-8])&IF(RC[-7]="",,"|n"&R1C26&RC[-7])&IF(RC[-6]="",,"|n"&R1C27&RC[-6])&IF(RC[-5]="",,"|n"&R1C28&RC[-5])&IF(RC[-2]="",,"|n|n"&RC[-2]) -> |n|n用于镶嵌到[剑,衣]上.|n镶嵌后不可取下!|n不需要的宝石可以在宠物处熔炼,用于宝石抽奖.
A174: 6 | B174: D | C174: [宝石] | D174: 断情 | G174: =IF(R[-165]C<>"",R[-165]C*120,"") ->  | H174: =IF(R[-165]C<>"",R[-165]C*120,"") ->  | I174: =IF(R[-165]C<>"",R[-165]C*120,"") ->  | J174: =IF(R[-165]C<>"",R[-165]C*120,"") ->  | K174: =IF(R[-165]C<>"",R[-165]C*120,"") ->  | L174: =IF(R[-165]C<>"",INT(R[-165]C*8),"") ->  | M174: =IF(R[-165]C<>"",R[-165]C*120,"") ->  | N174: =IF(R[-165]C<>"",INT(R[-165]C*2.5),"") ->  | O174: =IF(R[-165]C<>"",INT(R[-165]C*2.5),"") ->  | AE174: 用于镶嵌到[剑,衣]上.|n镶嵌后不可取下!|n不需要的宝石可以在宠物处熔炼,用于宝石抽奖. | AF174: =VLOOKUP(RC[-31],Sheet2!R13C1:R19C2,2,0)&"."&VLOOKUP(RC[-30],Sheet2!R7C1:R12C2,2,0)&VLOOKUP(RC[-30],Sheet2!R1C1:R6C2,2,0)&RC[-29]&RC[-28]&RC[-27]&Sheet2!R1C3 -> 六.丁|cFF999999[宝石]断情|r | AG174: =IF(RC[-26]&RC[-25]&RC[-24]&RC[-23]&RC[-22]&RC[-21]="",,R1C6)&IF(RC[-26]="",,"|n"&R1C7&RC[-26])&IF(RC[-25]="",,"|n"&R1C8&RC[-25])&IF(RC[-24]="",,"|n"&R1C9&RC[-24])&IF(RC[-23]="",,"|n"&R1C10&RC[-23])&IF(RC[-22]="",,"|n"&R1C11&RC[-22])&IF(RC[-21]="",,"|n"&R1C12&RC[-21])&IF(RC[-19]&RC[-18]&RC[-17]&RC[-16]="",,"|n|n"&R1C13)&IF(RC[-19]="",,"|n"&R1C14&RC[-19])&IF(RC[-18]="",,"|n"&R1C15&RC[-18])&IF(RC[-17]="",,"|n"&R1C16&RC[-17])&IF(RC[-16]="",,"|n"&R1C17&RC[-16])&IF(RC[-15]="",,"|n"&R1C18&RC[-15])&IF(RC[-14]="",,"|n"&R1C19&RC[-14])&IF(RC[-13]="",,"|n"&R1C20&RC[-13])&IF(RC[-12]="",,"|n"&R1C21&RC[-12])&IF(RC[-11]="",,"|n"&R1C22&RC[-11])&IF(RC[-10]="",,"|n"&R1C23&RC[-10])&IF(RC[-9]="",,"|n"&R1C24&RC[-9])&IF(RC[-8]="",,"|n"&R1C25&RC[-8])&IF(RC[-7]="",,"|n"&R1C26&RC[-7])&IF(RC[-6]="",,"|n"&R1C27&RC[-6])&IF(RC[-5]="",,"|n"&R1C28&RC[-5])&IF(RC[-2]="",,"|n|n"&RC[-2]) -> |n|n用于镶嵌到[剑,衣]上.|n镶嵌后不可取下!|n不需要的宝石可以在宠物处熔炼,用于宝石抽奖.
A175: 6 | B175: D | C175: [宝石] | D175: 碎骨 | G175: =IF(R[-165]C<>"",R[-165]C*120,"") ->  | H175: =IF(R[-165]C<>"",R[-165]C*120,"") ->  | I175: =IF(R[-165]C<>"",R[-165]C*120,"") ->  | J175: =IF(R[-165]C<>"",R[-165]C*120,"") ->  | K175: =IF(R[-165]C<>"",R[-165]C*120,"") ->  | L175: =IF(R[-165]C<>"",INT(R[-165]C*8),"") ->  | M175: =IF(R[-165]C<>"",R[-165]C*120,"") ->  | N175: =IF(R[-165]C<>"",INT(R[-165]C*2.5),"") ->  | O175: =IF(R[-165]C<>"",INT(R[-165]C*2.5),"") ->  | AE175: 用于镶嵌到[剑,衣]上.|n镶嵌后不可取下!|n不需要的宝石可以在宠物处熔炼,用于宝石抽奖. | AF175: =VLOOKUP(RC[-31],Sheet2!R13C1:R19C2,2,0)&"."&VLOOKUP(RC[-30],Sheet2!R7C1:R12C2,2,0)&VLOOKUP(RC[-30],Sheet2!R1C1:R6C2,2,0)&RC[-29]&RC[-28]&RC[-27]&Sheet2!R1C3 -> 六.丁|cFF999999[宝石]碎骨|r | AG175: =IF(RC[-26]&RC[-25]&RC[-24]&RC[-23]&RC[-22]&RC[-21]="",,R1C6)&IF(RC[-26]="",,"|n"&R1C7&RC[-26])&IF(RC[-25]="",,"|n"&R1C8&RC[-25])&IF(RC[-24]="",,"|n"&R1C9&RC[-24])&IF(RC[-23]="",,"|n"&R1C10&RC[-23])&IF(RC[-22]="",,"|n"&R1C11&RC[-22])&IF(RC[-21]="",,"|n"&R1C12&RC[-21])&IF(RC[-19]&RC[-18]&RC[-17]&RC[-16]="",,"|n|n"&R1C13)&IF(RC[-19]="",,"|n"&R1C14&RC[-19])&IF(RC[-18]="",,"|n"&R1C15&RC[-18])&IF(RC[-17]="",,"|n"&R1C16&RC[-17])&IF(RC[-16]="",,"|n"&R1C17&RC[-16])&IF(RC[-15]="",,"|n"&R1C18&RC[-15])&IF(RC[-14]="",,"|n"&R1C19&RC[-14])&IF(RC[-13]="",,"|n"&R1C20&RC[-13])&IF(RC[-12]="",,"|n"&R1C21&RC[-12])&IF(RC[-11]="",,"|n"&R1C22&RC[-11])&IF(RC[-10]="",,"|n"&R1C23&RC[-10])&IF(RC[-9]="",,"|n"&R1C24&RC[-9])&IF(RC[-8]="",,"|n"&R1C25&RC[-8])&IF(RC[-7]="",,"|n"&R1C26&RC[-7])&IF(RC[-6]="",,"|n"&R1C27&RC[-6])&IF(RC[-5]="",,"|n"&R1C28&RC[-5])&IF(RC[-2]="",,"|n|n"&RC[-2]) -> |n|n用于镶嵌到[剑,衣]上.|n镶嵌后不可取下!|n不需要的宝石可以在宠物处熔炼,用于宝石抽奖.
A176: 6 | B176: D | C176: [宝石] | D176: 鬼哭 | G176: =IF(R[-165]C<>"",R[-165]C*120,"") ->  | H176: =IF(R[-165]C<>"",R[-165]C*120,"") ->  | I176: =IF(R[-165]C<>"",R[-165]C*120,"") ->  | J176: =IF(R[-165]C<>"",R[-165]C*120,"") ->  | K176: =IF(R[-165]C<>"",R[-165]C*120,"") ->  | L176: =IF(R[-165]C<>"",INT(R[-165]C*8),"") ->  | M176: =IF(R[-165]C<>"",R[-165]C*120,"") ->  | N176: =IF(R[-165]C<>"",INT(R[-165]C*2.5),"") ->  | O176: =IF(R[-165]C<>"",INT(R[-165]C*2.5),"") ->  | AE176: 用于镶嵌到[剑,衣]上.|n镶嵌后不可取下!|n不需要的宝石可以在宠物处熔炼,用于宝石抽奖. | AF176: =VLOOKUP(RC[-31],Sheet2!R13C1:R19C2,2,0)&"."&VLOOKUP(RC[-30],Sheet2!R7C1:R12C2,2,0)&VLOOKUP(RC[-30],Sheet2!R1C1:R6C2,2,0)&RC[-29]&RC[-28]&RC[-27]&Sheet2!R1C3 -> 六.丁|cFF999999[宝石]鬼哭|r | AG176: =IF(RC[-26]&RC[-25]&RC[-24]&RC[-23]&RC[-22]&RC[-21]="",,R1C6)&IF(RC[-26]="",,"|n"&R1C7&RC[-26])&IF(RC[-25]="",,"|n"&R1C8&RC[-25])&IF(RC[-24]="",,"|n"&R1C9&RC[-24])&IF(RC[-23]="",,"|n"&R1C10&RC[-23])&IF(RC[-22]="",,"|n"&R1C11&RC[-22])&IF(RC[-21]="",,"|n"&R1C12&RC[-21])&IF(RC[-19]&RC[-18]&RC[-17]&RC[-16]="",,"|n|n"&R1C13)&IF(RC[-19]="",,"|n"&R1C14&RC[-19])&IF(RC[-18]="",,"|n"&R1C15&RC[-18])&IF(RC[-17]="",,"|n"&R1C16&RC[-17])&IF(RC[-16]="",,"|n"&R1C17&RC[-16])&IF(RC[-15]="",,"|n"&R1C18&RC[-15])&IF(RC[-14]="",,"|n"&R1C19&RC[-14])&IF(RC[-13]="",,"|n"&R1C20&RC[-13])&IF(RC[-12]="",,"|n"&R1C21&RC[-12])&IF(RC[-11]="",,"|n"&R1C22&RC[-11])&IF(RC[-10]="",,"|n"&R1C23&RC[-10])&IF(RC[-9]="",,"|n"&R1C24&RC[-9])&IF(RC[-8]="",,"|n"&R1C25&RC[-8])&IF(RC[-7]="",,"|n"&R1C26&RC[-7])&IF(RC[-6]="",,"|n"&R1C27&RC[-6])&IF(RC[-5]="",,"|n"&R1C28&RC[-5])&IF(RC[-2]="",,"|n|n"&RC[-2]) -> |n|n用于镶嵌到[剑,衣]上.|n镶嵌后不可取下!|n不需要的宝石可以在宠物处熔炼,用于宝石抽奖.
A177: 6 | B177: D | C177: [宝石] | D177: 丹心 | G177: =IF(R[-165]C<>"",R[-165]C*120,"") ->  | H177: =IF(R[-165]C<>"",R[-165]C*120,"") ->  | I177: =IF(R[-165]C<>"",R[-165]C*120,"") ->  | J177: =IF(R[-165]C<>"",R[-165]C*120,"") ->  | K177: =IF(R[-165]C<>"",R[-165]C*120,"") ->  | L177: =IF(R[-165]C<>"",INT(R[-165]C*8),"") ->  | M177: =IF(R[-165]C<>"",R[-165]C*120,"") ->  | N177: =IF(R[-165]C<>"",INT(R[-165]C*2.5),"") ->  | O177: =IF(R[-165]C<>"",INT(R[-165]C*2.5),"") ->  | AE177: 用于镶嵌到[剑,衣]上.|n镶嵌后不可取下!|n不需要的宝石可以在宠物处熔炼,用于宝石抽奖. | AF177: =VLOOKUP(RC[-31],Sheet2!R13C1:R19C2,2,0)&"."&VLOOKUP(RC[-30],Sheet2!R7C1:R12C2,2,0)&VLOOKUP(RC[-30],Sheet2!R1C1:R6C2,2,0)&RC[-29]&RC[-28]&RC[-27]&Sheet2!R1C3 -> 六.丁|cFF999999[宝石]丹心|r | AG177: =IF(RC[-26]&RC[-25]&RC[-24]&RC[-23]&RC[-22]&RC[-21]="",,R1C6)&IF(RC[-26]="",,"|n"&R1C7&RC[-26])&IF(RC[-25]="",,"|n"&R1C8&RC[-25])&IF(RC[-24]="",,"|n"&R1C9&RC[-24])&IF(RC[-23]="",,"|n"&R1C10&RC[-23])&IF(RC[-22]="",,"|n"&R1C11&RC[-22])&IF(RC[-21]="",,"|n"&R1C12&RC[-21])&IF(RC[-19]&RC[-18]&RC[-17]&RC[-16]="",,"|n|n"&R1C13)&IF(RC[-19]="",,"|n"&R1C14&RC[-19])&IF(RC[-18]="",,"|n"&R1C15&RC[-18])&IF(RC[-17]="",,"|n"&R1C16&RC[-17])&IF(RC[-16]="",,"|n"&R1C17&RC[-16])&IF(RC[-15]="",,"|n"&R1C18&RC[-15])&IF(RC[-14]="",,"|n"&R1C19&RC[-14])&IF(RC[-13]="",,"|n"&R1C20&RC[-13])&IF(RC[-12]="",,"|n"&R1C21&RC[-12])&IF(RC[-11]="",,"|n"&R1C22&RC[-11])&IF(RC[-10]="",,"|n"&R1C23&RC[-10])&IF(RC[-9]="",,"|n"&R1C24&RC[-9])&IF(RC[-8]="",,"|n"&R1C25&RC[-8])&IF(RC[-7]="",,"|n"&R1C26&RC[-7])&IF(RC[-6]="",,"|n"&R1C27&RC[-6])&IF(RC[-5]="",,"|n"&R1C28&RC[-5])&IF(RC[-2]="",,"|n|n"&RC[-2]) -> |n|n用于镶嵌到[剑,衣]上.|n镶嵌后不可取下!|n不需要的宝石可以在宠物处熔炼,用于宝石抽奖.
A178: 6 | B178: D | C178: [宝石] | D178: 血鸦 | G178: =IF(R[-165]C<>"",R[-165]C*120,"") ->  | H178: =IF(R[-165]C<>"",R[-165]C*120,"") ->  | I178: =IF(R[-165]C<>"",R[-165]C*120,"") ->  | J178: =IF(R[-165]C<>"",R[-165]C*120,"") ->  | K178: =IF(R[-165]C<>"",R[-165]C*120,"") ->  | L178: =IF(R[-165]C<>"",INT(R[-165]C*8),"") ->  | M178: =IF(R[-165]C<>"",R[-165]C*120,"") ->  | N178: =IF(R[-165]C<>"",INT(R[-165]C*2.5),"") ->  | O178: =IF(R[-165]C<>"",INT(R[-165]C*2.5),"") ->  | AE178: 用于镶嵌到[剑,衣]上.|n镶嵌后不可取下!|n不需要的宝石可以在宠物处熔炼,用于宝石抽奖. | AF178: =VLOOKUP(RC[-31],Sheet2!R13C1:R19C2,2,0)&"."&VLOOKUP(RC[-30],Sheet2!R7C1:R12C2,2,0)&VLOOKUP(RC[-30],Sheet2!R1C1:R6C2,2,0)&RC[-29]&RC[-28]&RC[-27]&Sheet2!R1C3 -> 六.丁|cFF999999[宝石]血鸦|r | AG178: =IF(RC[-26]&RC[-25]&RC[-24]&RC[-23]&RC[-22]&RC[-21]="",,R1C6)&IF(RC[-26]="",,"|n"&R1C7&RC[-26])&IF(RC[-25]="",,"|n"&R1C8&RC[-25])&IF(RC[-24]="",,"|n"&R1C9&RC[-24])&IF(RC[-23]="",,"|n"&R1C10&RC[-23])&IF(RC[-22]="",,"|n"&R1C11&RC[-22])&IF(RC[-21]="",,"|n"&R1C12&RC[-21])&IF(RC[-19]&RC[-18]&RC[-17]&RC[-16]="",,"|n|n"&R1C13)&IF(RC[-19]="",,"|n"&R1C14&RC[-19])&IF(RC[-18]="",,"|n"&R1C15&RC[-18])&IF(RC[-17]="",,"|n"&R1C16&RC[-17])&IF(RC[-16]="",,"|n"&R1C17&RC[-16])&IF(RC[-15]="",,"|n"&R1C18&RC[-15])&IF(RC[-14]="",,"|n"&R1C19&RC[-14])&IF(RC[-13]="",,"|n"&R1C20&RC[-13])&IF(RC[-12]="",,"|n"&R1C21&RC[-12])&IF(RC[-11]="",,"|n"&R1C22&RC[-11])&IF(RC[-10]="",,"|n"&R1C23&RC[-10])&IF(RC[-9]="",,"|n"&R1C24&RC[-9])&IF(RC[-8]="",,"|n"&R1C25&RC[-8])&IF(RC[-7]="",,"|n"&R1C26&RC[-7])&IF(RC[-6]="",,"|n"&R1C27&RC[-6])&IF(RC[-5]="",,"|n"&R1C28&RC[-5])&IF(RC[-2]="",,"|n|n"&RC[-2]) -> |n|n用于镶嵌到[剑,衣]上.|n镶嵌后不可取下!|n不需要的宝石可以在宠物处熔炼,用于宝石抽奖.
A179: 6 | B179: D | C179: [宝石] | D179: 荡旋 | G179: =IF(R[-165]C<>"",R[-165]C*120,"") ->  | H179: =IF(R[-165]C<>"",R[-165]C*120,"") ->  | I179: =IF(R[-165]C<>"",R[-165]C*120,"") ->  | J179: =IF(R[-165]C<>"",R[-165]C*120,"") ->  | K179: =IF(R[-165]C<>"",R[-165]C*120,"") ->  | L179: =IF(R[-165]C<>"",INT(R[-165]C*8),"") ->  | M179: =IF(R[-165]C<>"",R[-165]C*120,"") ->  | N179: =IF(R[-165]C<>"",INT(R[-165]C*2.5),"") ->  | O179: =IF(R[-165]C<>"",INT(R[-165]C*2.5),"") ->  | AE179: 用于镶嵌到[剑,衣]上.|n镶嵌后不可取下!|n不需要的宝石可以在宠物处熔炼,用于宝石抽奖. | AF179: =VLOOKUP(RC[-31],Sheet2!R13C1:R19C2,2,0)&"."&VLOOKUP(RC[-30],Sheet2!R7C1:R12C2,2,0)&VLOOKUP(RC[-30],Sheet2!R1C1:R6C2,2,0)&RC[-29]&RC[-28]&RC[-27]&Sheet2!R1C3 -> 六.丁|cFF999999[宝石]荡旋|r | AG179: =IF(RC[-26]&RC[-25]&RC[-24]&RC[-23]&RC[-22]&RC[-21]="",,R1C6)&IF(RC[-26]="",,"|n"&R1C7&RC[-26])&IF(RC[-25]="",,"|n"&R1C8&RC[-25])&IF(RC[-24]="",,"|n"&R1C9&RC[-24])&IF(RC[-23]="",,"|n"&R1C10&RC[-23])&IF(RC[-22]="",,"|n"&R1C11&RC[-22])&IF(RC[-21]="",,"|n"&R1C12&RC[-21])&IF(RC[-19]&RC[-18]&RC[-17]&RC[-16]="",,"|n|n"&R1C13)&IF(RC[-19]="",,"|n"&R1C14&RC[-19])&IF(RC[-18]="",,"|n"&R1C15&RC[-18])&IF(RC[-17]="",,"|n"&R1C16&RC[-17])&IF(RC[-16]="",,"|n"&R1C17&RC[-16])&IF(RC[-15]="",,"|n"&R1C18&RC[-15])&IF(RC[-14]="",,"|n"&R1C19&RC[-14])&IF(RC[-13]="",,"|n"&R1C20&RC[-13])&IF(RC[-12]="",,"|n"&R1C21&RC[-12])&IF(RC[-11]="",,"|n"&R1C22&RC[-11])&IF(RC[-10]="",,"|n"&R1C23&RC[-10])&IF(RC[-9]="",,"|n"&R1C24&RC[-9])&IF(RC[-8]="",,"|n"&R1C25&RC[-8])&IF(RC[-7]="",,"|n"&R1C26&RC[-7])&IF(RC[-6]="",,"|n"&R1C27&RC[-6])&IF(RC[-5]="",,"|n"&R1C28&RC[-5])&IF(RC[-2]="",,"|n|n"&RC[-2]) -> |n|n用于镶嵌到[剑,衣]上.|n镶嵌后不可取下!|n不需要的宝石可以在宠物处熔炼,用于宝石抽奖.
A180: 6 | B180: D | C180: [宝石] | D180: 极意 | G180: =IF(R[-165]C<>"",R[-165]C*120,"") ->  | H180: =IF(R[-165]C<>"",R[-165]C*120,"") ->  | I180: =IF(R[-165]C<>"",R[-165]C*120,"") ->  | J180: =IF(R[-165]C<>"",R[-165]C*120,"") ->  | K180: =IF(R[-165]C<>"",R[-165]C*120,"") ->  | L180: =IF(R[-165]C<>"",INT(R[-165]C*8),"") ->  | M180: =IF(R[-165]C<>"",R[-165]C*120,"") ->  | N180: =IF(R[-165]C<>"",INT(R[-165]C*2.5),"") ->  | O180: =IF(R[-165]C<>"",INT(R[-165]C*2.5),"") ->  | AE180: 用于镶嵌到[剑,衣]上.|n镶嵌后不可取下!|n不需要的宝石可以在宠物处熔炼,用于宝石抽奖. | AF180: =VLOOKUP(RC[-31],Sheet2!R13C1:R19C2,2,0)&"."&VLOOKUP(RC[-30],Sheet2!R7C1:R12C2,2,0)&VLOOKUP(RC[-30],Sheet2!R1C1:R6C2,2,0)&RC[-29]&RC[-28]&RC[-27]&Sheet2!R1C3 -> 六.丁|cFF999999[宝石]极意|r | AG180: =IF(RC[-26]&RC[-25]&RC[-24]&RC[-23]&RC[-22]&RC[-21]="",,R1C6)&IF(RC[-26]="",,"|n"&R1C7&RC[-26])&IF(RC[-25]="",,"|n"&R1C8&RC[-25])&IF(RC[-24]="",,"|n"&R1C9&RC[-24])&IF(RC[-23]="",,"|n"&R1C10&RC[-23])&IF(RC[-22]="",,"|n"&R1C11&RC[-22])&IF(RC[-21]="",,"|n"&R1C12&RC[-21])&IF(RC[-19]&RC[-18]&RC[-17]&RC[-16]="",,"|n|n"&R1C13)&IF(RC[-19]="",,"|n"&R1C14&RC[-19])&IF(RC[-18]="",,"|n"&R1C15&RC[-18])&IF(RC[-17]="",,"|n"&R1C16&RC[-17])&IF(RC[-16]="",,"|n"&R1C17&RC[-16])&IF(RC[-15]="",,"|n"&R1C18&RC[-15])&IF(RC[-14]="",,"|n"&R1C19&RC[-14])&IF(RC[-13]="",,"|n"&R1C20&RC[-13])&IF(RC[-12]="",,"|n"&R1C21&RC[-12])&IF(RC[-11]="",,"|n"&R1C22&RC[-11])&IF(RC[-10]="",,"|n"&R1C23&RC[-10])&IF(RC[-9]="",,"|n"&R1C24&RC[-9])&IF(RC[-8]="",,"|n"&R1C25&RC[-8])&IF(RC[-7]="",,"|n"&R1C26&RC[-7])&IF(RC[-6]="",,"|n"&R1C27&RC[-6])&IF(RC[-5]="",,"|n"&R1C28&RC[-5])&IF(RC[-2]="",,"|n|n"&RC[-2]) -> |n|n用于镶嵌到[剑,衣]上.|n镶嵌后不可取下!|n不需要的宝石可以在宠物处熔炼,用于宝石抽奖.
A181: 6 | B181: D | C181: [宝石] | D181: 迦蓝 | G181: =IF(R[-165]C<>"",R[-165]C*120,"") ->  | H181: =IF(R[-165]C<>"",R[-165]C*120,"") ->  | I181: =IF(R[-165]C<>"",R[-165]C*120,"") ->  | J181: =IF(R[-165]C<>"",R[-165]C*120,"") ->  | K181: =IF(R[-165]C<>"",R[-165]C*120,"") ->  | L181: =IF(R[-165]C<>"",INT(R[-165]C*8),"") ->  | M181: =IF(R[-165]C<>"",R[-165]C*120,"") ->  | N181: =IF(R[-165]C<>"",INT(R[-165]C*2.5),"") ->  | O181: =IF(R[-165]C<>"",INT(R[-165]C*2.5),"") ->  | AE181: 用于镶嵌到[剑,衣]上.|n镶嵌后不可取下!|n不需要的宝石可以在宠物处熔炼,用于宝石抽奖. | AF181: =VLOOKUP(RC[-31],Sheet2!R13C1:R19C2,2,0)&"."&VLOOKUP(RC[-30],Sheet2!R7C1:R12C2,2,0)&VLOOKUP(RC[-30],Sheet2!R1C1:R6C2,2,0)&RC[-29]&RC[-28]&RC[-27]&Sheet2!R1C3 -> 六.丁|cFF999999[宝石]迦蓝|r | AG181: =IF(RC[-26]&RC[-25]&RC[-24]&RC[-23]&RC[-22]&RC[-21]="",,R1C6)&IF(RC[-26]="",,"|n"&R1C7&RC[-26])&IF(RC[-25]="",,"|n"&R1C8&RC[-25])&IF(RC[-24]="",,"|n"&R1C9&RC[-24])&IF(RC[-23]="",,"|n"&R1C10&RC[-23])&IF(RC[-22]="",,"|n"&R1C11&RC[-22])&IF(RC[-21]="",,"|n"&R1C12&RC[-21])&IF(RC[-19]&RC[-18]&RC[-17]&RC[-16]="",,"|n|n"&R1C13)&IF(RC[-19]="",,"|n"&R1C14&RC[-19])&IF(RC[-18]="",,"|n"&R1C15&RC[-18])&IF(RC[-17]="",,"|n"&R1C16&RC[-17])&IF(RC[-16]="",,"|n"&R1C17&RC[-16])&IF(RC[-15]="",,"|n"&R1C18&RC[-15])&IF(RC[-14]="",,"|n"&R1C19&RC[-14])&IF(RC[-13]="",,"|n"&R1C20&RC[-13])&IF(RC[-12]="",,"|n"&R1C21&RC[-12])&IF(RC[-11]="",,"|n"&R1C22&RC[-11])&IF(RC[-10]="",,"|n"&R1C23&RC[-10])&IF(RC[-9]="",,"|n"&R1C24&RC[-9])&IF(RC[-8]="",,"|n"&R1C25&RC[-8])&IF(RC[-7]="",,"|n"&R1C26&RC[-7])&IF(RC[-6]="",,"|n"&R1C27&RC[-6])&IF(RC[-5]="",,"|n"&R1C28&RC[-5])&IF(RC[-2]="",,"|n|n"&RC[-2]) -> |n|n用于镶嵌到[剑,衣]上.|n镶嵌后不可取下!|n不需要的宝石可以在宠物处熔炼,用于宝石抽奖.
A182: 6 | B182: D | C182: [宝石] | D182: 灵鹤 | G182: =IF(R[-165]C<>"",R[-165]C*120,"") ->  | H182: =IF(R[-165]C<>"",R[-165]C*120,"") ->  | I182: =IF(R[-165]C<>"",R[-165]C*120,"") ->  | J182: =IF(R[-165]C<>"",R[-165]C*120,"") ->  | K182: =IF(R[-165]C<>"",R[-165]C*120,"") ->  | L182: =IF(R[-165]C<>"",INT(R[-165]C*8),"") ->  | M182: =IF(R[-165]C<>"",R[-165]C*120,"") ->  | N182: =IF(R[-165]C<>"",INT(R[-165]C*2.5),"") ->  | O182: =IF(R[-165]C<>"",INT(R[-165]C*2.5),"") ->  | AE182: 用于镶嵌到[剑,衣]上.|n镶嵌后不可取下!|n不需要的宝石可以在宠物处熔炼,用于宝石抽奖. | AF182: =VLOOKUP(RC[-31],Sheet2!R13C1:R19C2,2,0)&"."&VLOOKUP(RC[-30],Sheet2!R7C1:R12C2,2,0)&VLOOKUP(RC[-30],Sheet2!R1C1:R6C2,2,0)&RC[-29]&RC[-28]&RC[-27]&Sheet2!R1C3 -> 六.丁|cFF999999[宝石]灵鹤|r | AG182: =IF(RC[-26]&RC[-25]&RC[-24]&RC[-23]&RC[-22]&RC[-21]="",,R1C6)&IF(RC[-26]="",,"|n"&R1C7&RC[-26])&IF(RC[-25]="",,"|n"&R1C8&RC[-25])&IF(RC[-24]="",,"|n"&R1C9&RC[-24])&IF(RC[-23]="",,"|n"&R1C10&RC[-23])&IF(RC[-22]="",,"|n"&R1C11&RC[-22])&IF(RC[-21]="",,"|n"&R1C12&RC[-21])&IF(RC[-19]&RC[-18]&RC[-17]&RC[-16]="",,"|n|n"&R1C13)&IF(RC[-19]="",,"|n"&R1C14&RC[-19])&IF(RC[-18]="",,"|n"&R1C15&RC[-18])&IF(RC[-17]="",,"|n"&R1C16&RC[-17])&IF(RC[-16]="",,"|n"&R1C17&RC[-16])&IF(RC[-15]="",,"|n"&R1C18&RC[-15])&IF(RC[-14]="",,"|n"&R1C19&RC[-14])&IF(RC[-13]="",,"|n"&R1C20&RC[-13])&IF(RC[-12]="",,"|n"&R1C21&RC[-12])&IF(RC[-11]="",,"|n"&R1C22&RC[-11])&IF(RC[-10]="",,"|n"&R1C23&RC[-10])&IF(RC[-9]="",,"|n"&R1C24&RC[-9])&IF(RC[-8]="",,"|n"&R1C25&RC[-8])&IF(RC[-7]="",,"|n"&R1C26&RC[-7])&IF(RC[-6]="",,"|n"&R1C27&RC[-6])&IF(RC[-5]="",,"|n"&R1C28&RC[-5])&IF(RC[-2]="",,"|n|n"&RC[-2]) -> |n|n用于镶嵌到[剑,衣]上.|n镶嵌后不可取下!|n不需要的宝石可以在宠物处熔炼,用于宝石抽奖.
A183: 6 | B183: C | C183: [宝石] | D183: 流云石 | G183: =IF(R[-165]C<>"",R[-165]C*90,"") ->  | H183: =IF(R[-165]C<>"",R[-165]C*90,"") -> 135000 | I183: =IF(R[-165]C<>"",R[-165]C*90,"") -> 135000 | J183: =IF(R[-165]C<>"",R[-165]C*90,"") -> 135000 | K183: =IF(R[-165]C<>"",R[-165]C*90,"") ->  | L183: =IF(R[-165]C<>"",INT(R[-165]C*8),"") ->  | M183: =IF(R[-165]C<>"",R[-165]C*120,"") ->  | N183: =IF(R[-165]C<>"",INT(R[-165]C*2.4),"") ->  | O183: =IF(R[-165]C<>"",INT(R[-165]C*2.4),"") ->  | P183: =IF(R[-165]C<>"",INT(R[-165]C*2.4),"") ->  | Q183: =IF(R[-165]C<>"",INT(R[-165]C*2.4),"") ->  | AE183: 用于镶嵌到[剑,衣]上.|n镶嵌后不可取下!|n不需要的宝石可以在宠物处熔炼,用于宝石抽奖. | AF183: =VLOOKUP(RC[-31],Sheet2!R13C1:R19C2,2,0)&"."&VLOOKUP(RC[-30],Sheet2!R7C1:R12C2,2,0)&VLOOKUP(RC[-30],Sheet2!R1C1:R6C2,2,0)&RC[-29]&RC[-28]&RC[-27]&Sheet2!R1C3 -> 六.丙|cFF99FF66[宝石]流云石|r | AG183: =IF(RC[-26]&RC[-25]&RC[-24]&RC[-23]&RC[-22]&RC[-21]="",,R1C6)&IF(RC[-26]="",,"|n"&R1C7&RC[-26])&IF(RC[-25]="",,"|n"&R1C8&RC[-25])&IF(RC[-24]="",,"|n"&R1C9&RC[-24])&IF(RC[-23]="",,"|n"&R1C10&RC[-23])&IF(RC[-22]="",,"|n"&R1C11&RC[-22])&IF(RC[-21]="",,"|n"&R1C12&RC[-21])&IF(RC[-19]&RC[-18]&RC[-17]&RC[-16]="",,"|n|n"&R1C13)&IF(RC[-19]="",,"|n"&R1C14&RC[-19])&IF(RC[-18]="",,"|n"&R1C15&RC[-18])&IF(RC[-17]="",,"|n"&R1C16&RC[-17])&IF(RC[-16]="",,"|n"&R1C17&RC[-16])&IF(RC[-15]="",,"|n"&R1C18&RC[-15])&IF(RC[-14]="",,"|n"&R1C19&RC[-14])&IF(RC[-13]="",,"|n"&R1C20&RC[-13])&IF(RC[-12]="",,"|n"&R1C21&RC[-12])&IF(RC[-11]="",,"|n"&R1C22&RC[-11])&IF(RC[-10]="",,"|n"&R1C23&RC[-10])&IF(RC[-9]="",,"|n"&R1C24&RC[-9])&IF(RC[-8]="",,"|n"&R1C25&RC[-8])&IF(RC[-7]="",,"|n"&R1C26&RC[-7])&IF(RC[-6]="",,"|n"&R1C27&RC[-6])&IF(RC[-5]="",,"|n"&R1C28&RC[-5])&IF(RC[-2]="",,"|n|n"&RC[-2]) -> |cFFFFFF99基础属性|r|n力量:135000|n敏捷:135000|n智力:135000|n|n用于镶嵌到[剑,衣]上.|n镶嵌后不可取下!|n不需要的宝石可以在宠物处熔炼,用于宝石抽奖.
A184: 6 | B184: C | C184: [宝石] | D184: 苍炎石 | G184: =IF(R[-165]C<>"",R[-165]C*90,"") -> 450000 | H184: =IF(R[-165]C<>"",R[-165]C*90,"") ->  | I184: =IF(R[-165]C<>"",R[-165]C*90,"") ->  | J184: =IF(R[-165]C<>"",R[-165]C*90,"") ->  | K184: =IF(R[-165]C<>"",R[-165]C*90,"") ->  | L184: =IF(R[-165]C<>"",INT(R[-165]C*8),"") ->  | M184: =IF(R[-165]C<>"",R[-165]C*120,"") ->  | N184: =IF(R[-165]C<>"",INT(R[-165]C*2.4),"") ->  | O184: =IF(R[-165]C<>"",INT(R[-165]C*2.4),"") ->  | P184: =IF(R[-165]C<>"",INT(R[-165]C*2.4),"") ->  | Q184: =IF(R[-165]C<>"",INT(R[-165]C*2.4),"") ->  | AE184: 用于镶嵌到[剑,衣]上.|n镶嵌后不可取下!|n不需要的宝石可以在宠物处熔炼,用于宝石抽奖. | AF184: =VLOOKUP(RC[-31],Sheet2!R13C1:R19C2,2,0)&"."&VLOOKUP(RC[-30],Sheet2!R7C1:R12C2,2,0)&VLOOKUP(RC[-30],Sheet2!R1C1:R6C2,2,0)&RC[-29]&RC[-28]&RC[-27]&Sheet2!R1C3 -> 六.丙|cFF99FF66[宝石]苍炎石|r | AG184: =IF(RC[-26]&RC[-25]&RC[-24]&RC[-23]&RC[-22]&RC[-21]="",,R1C6)&IF(RC[-26]="",,"|n"&R1C7&RC[-26])&IF(RC[-25]="",,"|n"&R1C8&RC[-25])&IF(RC[-24]="",,"|n"&R1C9&RC[-24])&IF(RC[-23]="",,"|n"&R1C10&RC[-23])&IF(RC[-22]="",,"|n"&R1C11&RC[-22])&IF(RC[-21]="",,"|n"&R1C12&RC[-21])&IF(RC[-19]&RC[-18]&RC[-17]&RC[-16]="",,"|n|n"&R1C13)&IF(RC[-19]="",,"|n"&R1C14&RC[-19])&IF(RC[-18]="",,"|n"&R1C15&RC[-18])&IF(RC[-17]="",,"|n"&R1C16&RC[-17])&IF(RC[-16]="",,"|n"&R1C17&RC[-16])&IF(RC[-15]="",,"|n"&R1C18&RC[-15])&IF(RC[-14]="",,"|n"&R1C19&RC[-14])&IF(RC[-13]="",,"|n"&R1C20&RC[-13])&IF(RC[-12]="",,"|n"&R1C21&RC[-12])&IF(RC[-11]="",,"|n"&R1C22&RC[-11])&IF(RC[-10]="",,"|n"&R1C23&RC[-10])&IF(RC[-9]="",,"|n"&R1C24&RC[-9])&IF(RC[-8]="",,"|n"&R1C25&RC[-8])&IF(RC[-7]="",,"|n"&R1C26&RC[-7])&IF(RC[-6]="",,"|n"&R1C27&RC[-6])&IF(RC[-5]="",,"|n"&R1C28&RC[-5])&IF(RC[-2]="",,"|n|n"&RC[-2]) -> |cFFFFFF99基础属性|r|n攻击:450000|n|n用于镶嵌到[剑,衣]上.|n镶嵌后不可取下!|n不需要的宝石可以在宠物处熔炼,用于宝石抽奖.
A185: 6 | B185: C | C185: [宝石] | D185: 龙虎石 | G185: =IF(R[-165]C<>"",R[-165]C*90,"") ->  | H185: =IF(R[-165]C<>"",R[-165]C*90,"") ->  | I185: =IF(R[-165]C<>"",R[-165]C*90,"") ->  | J185: =IF(R[-165]C<>"",R[-165]C*90,"") ->  | K185: =IF(R[-165]C<>"",R[-165]C*90,"") ->  | L185: =IF(R[-165]C<>"",INT(R[-165]C*8),"") ->  | M185: =IF(R[-165]C<>"",R[-165]C*120,"") ->  | N185: =IF(R[-165]C<>"",INT(R[-165]C*2.4),"") ->  | O185: =IF(R[-165]C<>"",INT(R[-165]C*2.4),"") -> 4 | P185: =IF(R[-165]C<>"",INT(R[-165]C*2.4),"") ->  | Q185: =IF(R[-165]C<>"",INT(R[-165]C*2.4),"") ->  | AE185: 用于镶嵌到[剑,衣]上.|n镶嵌后不可取下!|n不需要的宝石可以在宠物处熔炼,用于宝石抽奖. | AF185: =VLOOKUP(RC[-31],Sheet2!R13C1:R19C2,2,0)&"."&VLOOKUP(RC[-30],Sheet2!R7C1:R12C2,2,0)&VLOOKUP(RC[-30],Sheet2!R1C1:R6C2,2,0)&RC[-29]&RC[-28]&RC[-27]&Sheet2!R1C3 -> 六.丙|cFF99FF66[宝石]龙虎石|r | AG185: =IF(RC[-26]&RC[-25]&RC[-24]&RC[-23]&RC[-22]&RC[-21]="",,R1C6)&IF(RC[-26]="",,"|n"&R1C7&RC[-26])&IF(RC[-25]="",,"|n"&R1C8&RC[-25])&IF(RC[-24]="",,"|n"&R1C9&RC[-24])&IF(RC[-23]="",,"|n"&R1C10&RC[-23])&IF(RC[-22]="",,"|n"&R1C11&RC[-22])&IF(RC[-21]="",,"|n"&R1C12&RC[-21])&IF(RC[-19]&RC[-18]&RC[-17]&RC[-16]="",,"|n|n"&R1C13)&IF(RC[-19]="",,"|n"&R1C14&RC[-19])&IF(RC[-18]="",,"|n"&R1C15&RC[-18])&IF(RC[-17]="",,"|n"&R1C16&RC[-17])&IF(RC[-16]="",,"|n"&R1C17&RC[-16])&IF(RC[-15]="",,"|n"&R1C18&RC[-15])&IF(RC[-14]="",,"|n"&R1C19&RC[-14])&IF(RC[-13]="",,"|n"&R1C20&RC[-13])&IF(RC[-12]="",,"|n"&R1C21&RC[-12])&IF(RC[-11]="",,"|n"&R1C22&RC[-11])&IF(RC[-10]="",,"|n"&R1C23&RC[-10])&IF(RC[-9]="",,"|n"&R1C24&RC[-9])&IF(RC[-8]="",,"|n"&R1C25&RC[-8])&IF(RC[-7]="",,"|n"&R1C26&RC[-7])&IF(RC[-6]="",,"|n"&R1C27&RC[-6])&IF(RC[-5]="",,"|n"&R1C28&RC[-5])&IF(RC[-2]="",,"|n|n"&RC[-2]) -> |n|n|cFFFFFF55附加属性|r(%)|n攻击吸血:4|n|n用于镶嵌到[剑,衣]上.|n镶嵌后不可取下!|n不需要的宝石可以在宠物处熔炼,用于宝石抽奖.
A186: 6 | B186: C | C186: [宝石] | D186: 万仞石 | G186: =IF(R[-165]C<>"",R[-165]C*90,"") ->  | H186: =IF(R[-165]C<>"",R[-165]C*90,"") ->  | I186: =IF(R[-165]C<>"",R[-165]C*90,"") ->  | J186: =IF(R[-165]C<>"",R[-165]C*90,"") ->  | K186: =IF(R[-165]C<>"",R[-165]C*90,"") -> 2250000 | L186: =IF(R[-165]C<>"",INT(R[-165]C*8),"") -> 800 | M186: =IF(R[-165]C<>"",R[-165]C*120,"") ->  | N186: =IF(R[-165]C<>"",INT(R[-165]C*2.4),"") ->  | O186: =IF(R[-165]C<>"",INT(R[-165]C*2.4),"") ->  | P186: =IF(R[-165]C<>"",INT(R[-165]C*2.4),"") ->  | Q186: =IF(R[-165]C<>"",INT(R[-165]C*2.4),"") ->  | AE186: 用于镶嵌到[剑,衣]上.|n镶嵌后不可取下!|n不需要的宝石可以在宠物处熔炼,用于宝石抽奖. | AF186: =VLOOKUP(RC[-31],Sheet2!R13C1:R19C2,2,0)&"."&VLOOKUP(RC[-30],Sheet2!R7C1:R12C2,2,0)&VLOOKUP(RC[-30],Sheet2!R1C1:R6C2,2,0)&RC[-29]&RC[-28]&RC[-27]&Sheet2!R1C3 -> 六.丙|cFF99FF66[宝石]万仞石|r | AG186: =IF(RC[-26]&RC[-25]&RC[-24]&RC[-23]&RC[-22]&RC[-21]="",,R1C6)&IF(RC[-26]="",,"|n"&R1C7&RC[-26])&IF(RC[-25]="",,"|n"&R1C8&RC[-25])&IF(RC[-24]="",,"|n"&R1C9&RC[-24])&IF(RC[-23]="",,"|n"&R1C10&RC[-23])&IF(RC[-22]="",,"|n"&R1C11&RC[-22])&IF(RC[-21]="",,"|n"&R1C12&RC[-21])&IF(RC[-19]&RC[-18]&RC[-17]&RC[-16]="",,"|n|n"&R1C13)&IF(RC[-19]="",,"|n"&R1C14&RC[-19])&IF(RC[-18]="",,"|n"&R1C15&RC[-18])&IF(RC[-17]="",,"|n"&R1C16&RC[-17])&IF(RC[-16]="",,"|n"&R1C17&RC[-16])&IF(RC[-15]="",,"|n"&R1C18&RC[-15])&IF(RC[-14]="",,"|n"&R1C19&RC[-14])&IF(RC[-13]="",,"|n"&R1C20&RC[-13])&IF(RC[-12]="",,"|n"&R1C21&RC[-12])&IF(RC[-11]="",,"|n"&R1C22&RC[-11])&IF(RC[-10]="",,"|n"&R1C23&RC[-10])&IF(RC[-9]="",,"|n"&R1C24&RC[-9])&IF(RC[-8]="",,"|n"&R1C25&RC[-8])&IF(RC[-7]="",,"|n"&R1C26&RC[-7])&IF(RC[-6]="",,"|n"&R1C27&RC[-6])&IF(RC[-5]="",,"|n"&R1C28&RC[-5])&IF(RC[-2]="",,"|n|n"&RC[-2]) -> |cFFFFFF99基础属性|r|n血量:2250000|n护甲:800|n|n用于镶嵌到[剑,衣]上.|n镶嵌后不可取下!|n不需要的宝石可以在宠物处熔炼,用于宝石抽奖.
A187: 6 | B187: C | C187: [宝石] | D187: 无量石 | G187: =IF(R[-165]C<>"",R[-165]C*90,"") ->  | H187: =IF(R[-165]C<>"",R[-165]C*90,"") -> 180000 | I187: =IF(R[-165]C<>"",R[-165]C*90,"") -> 45000 | J187: =IF(R[-165]C<>"",R[-165]C*90,"") -> 45000 | K187: =IF(R[-165]C<>"",R[-165]C*90,"") ->  | L187: =IF(R[-165]C<>"",INT(R[-165]C*8),"") ->  | M187: =IF(R[-165]C<>"",R[-165]C*120,"") ->  | N187: =IF(R[-165]C<>"",INT(R[-165]C*2.4),"") ->  | O187: =IF(R[-165]C<>"",INT(R[-165]C*2.4),"") ->  | P187: =IF(R[-165]C<>"",INT(R[-165]C*2.4),"") ->  | Q187: =IF(R[-165]C<>"",INT(R[-165]C*2.4),"") ->  | AE187: 用于镶嵌到[剑,衣]上.|n镶嵌后不可取下!|n不需要的宝石可以在宠物处熔炼,用于宝石抽奖. | AF187: =VLOOKUP(RC[-31],Sheet2!R13C1:R19C2,2,0)&"."&VLOOKUP(RC[-30],Sheet2!R7C1:R12C2,2,0)&VLOOKUP(RC[-30],Sheet2!R1C1:R6C2,2,0)&RC[-29]&RC[-28]&RC[-27]&Sheet2!R1C3 -> 六.丙|cFF99FF66[宝石]无量石|r | AG187: =IF(RC[-26]&RC[-25]&RC[-24]&RC[-23]&RC[-22]&RC[-21]="",,R1C6)&IF(RC[-26]="",,"|n"&R1C7&RC[-26])&IF(RC[-25]="",,"|n"&R1C8&RC[-25])&IF(RC[-24]="",,"|n"&R1C9&RC[-24])&IF(RC[-23]="",,"|n"&R1C10&RC[-23])&IF(RC[-22]="",,"|n"&R1C11&RC[-22])&IF(RC[-21]="",,"|n"&R1C12&RC[-21])&IF(RC[-19]&RC[-18]&RC[-17]&RC[-16]="",,"|n|n"&R1C13)&IF(RC[-19]="",,"|n"&R1C14&RC[-19])&IF(RC[-18]="",,"|n"&R1C15&RC[-18])&IF(RC[-17]="",,"|n"&R1C16&RC[-17])&IF(RC[-16]="",,"|n"&R1C17&RC[-16])&IF(RC[-15]="",,"|n"&R1C18&RC[-15])&IF(RC[-14]="",,"|n"&R1C19&RC[-14])&IF(RC[-13]="",,"|n"&R1C20&RC[-13])&IF(RC[-12]="",,"|n"&R1C21&RC[-12])&IF(RC[-11]="",,"|n"&R1C22&RC[-11])&IF(RC[-10]="",,"|n"&R1C23&RC[-10])&IF(RC[-9]="",,"|n"&R1C24&RC[-9])&IF(RC[-8]="",,"|n"&R1C25&RC[-8])&IF(RC[-7]="",,"|n"&R1C26&RC[-7])&IF(RC[-6]="",,"|n"&R1C27&RC[-6])&IF(RC[-5]="",,"|n"&R1C28&RC[-5])&IF(RC[-2]="",,"|n|n"&RC[-2]) -> |cFFFFFF99基础属性|r|n力量:180000|n敏捷:45000|n智力:45000|n|n用于镶嵌到[剑,衣]上.|n镶嵌后不可取下!|n不需要的宝石可以在宠物处熔炼,用于宝石抽奖.
A188: 6 | B188: C | C188: [宝石] | D188: 雄狮石 | G188: =IF(R[-165]C<>"",R[-165]C*90,"") ->  | H188: =IF(R[-165]C<>"",R[-165]C*90,"") -> 45000 | I188: =IF(R[-165]C<>"",R[-165]C*90,"") -> 180000 | J188: =IF(R[-165]C<>"",R[-165]C*90,"") -> 45000 | K188: =IF(R[-165]C<>"",R[-165]C*90,"") ->  | L188: =IF(R[-165]C<>"",INT(R[-165]C*8),"") ->  | M188: =IF(R[-165]C<>"",R[-165]C*120,"") ->  | N188: =IF(R[-165]C<>"",INT(R[-165]C*2.4),"") ->  | O188: =IF(R[-165]C<>"",INT(R[-165]C*2.4),"") ->  | P188: =IF(R[-165]C<>"",INT(R[-165]C*2.4),"") ->  | Q188: =IF(R[-165]C<>"",INT(R[-165]C*2.4),"") ->  | AE188: 用于镶嵌到[剑,衣]上.|n镶嵌后不可取下!|n不需要的宝石可以在宠物处熔炼,用于宝石抽奖. | AF188: =VLOOKUP(RC[-31],Sheet2!R13C1:R19C2,2,0)&"."&VLOOKUP(RC[-30],Sheet2!R7C1:R12C2,2,0)&VLOOKUP(RC[-30],Sheet2!R1C1:R6C2,2,0)&RC[-29]&RC[-28]&RC[-27]&Sheet2!R1C3 -> 六.丙|cFF99FF66[宝石]雄狮石|r | AG188: =IF(RC[-26]&RC[-25]&RC[-24]&RC[-23]&RC[-22]&RC[-21]="",,R1C6)&IF(RC[-26]="",,"|n"&R1C7&RC[-26])&IF(RC[-25]="",,"|n"&R1C8&RC[-25])&IF(RC[-24]="",,"|n"&R1C9&RC[-24])&IF(RC[-23]="",,"|n"&R1C10&RC[-23])&IF(RC[-22]="",,"|n"&R1C11&RC[-22])&IF(RC[-21]="",,"|n"&R1C12&RC[-21])&IF(RC[-19]&RC[-18]&RC[-17]&RC[-16]="",,"|n|n"&R1C13)&IF(RC[-19]="",,"|n"&R1C14&RC[-19])&IF(RC[-18]="",,"|n"&R1C15&RC[-18])&IF(RC[-17]="",,"|n"&R1C16&RC[-17])&IF(RC[-16]="",,"|n"&R1C17&RC[-16])&IF(RC[-15]="",,"|n"&R1C18&RC[-15])&IF(RC[-14]="",,"|n"&R1C19&RC[-14])&IF(RC[-13]="",,"|n"&R1C20&RC[-13])&IF(RC[-12]="",,"|n"&R1C21&RC[-12])&IF(RC[-11]="",,"|n"&R1C22&RC[-11])&IF(RC[-10]="",,"|n"&R1C23&RC[-10])&IF(RC[-9]="",,"|n"&R1C24&RC[-9])&IF(RC[-8]="",,"|n"&R1C25&RC[-8])&IF(RC[-7]="",,"|n"&R1C26&RC[-7])&IF(RC[-6]="",,"|n"&R1C27&RC[-6])&IF(RC[-5]="",,"|n"&R1C28&RC[-5])&IF(RC[-2]="",,"|n|n"&RC[-2]) -> |cFFFFFF99基础属性|r|n力量:45000|n敏捷:180000|n智力:45000|n|n用于镶嵌到[剑,衣]上.|n镶嵌后不可取下!|n不需要的宝石可以在宠物处熔炼,用于宝石抽奖.
A189: 6 | B189: C | C189: [宝石] | D189: 孤问石 | G189: =IF(R[-165]C<>"",R[-165]C*90,"") ->  | H189: =IF(R[-165]C<>"",R[-165]C*90,"") -> 45000 | I189: =IF(R[-165]C<>"",R[-165]C*90,"") -> 45000 | J189: =IF(R[-165]C<>"",R[-165]C*90,"") -> 180000 | K189: =IF(R[-165]C<>"",R[-165]C*90,"") ->  | L189: =IF(R[-165]C<>"",INT(R[-165]C*8),"") ->  | M189: =IF(R[-165]C<>"",R[-165]C*120,"") ->  | N189: =IF(R[-165]C<>"",INT(R[-165]C*2.4),"") ->  | O189: =IF(R[-165]C<>"",INT(R[-165]C*2.4),"") ->  | P189: =IF(R[-165]C<>"",INT(R[-165]C*2.4),"") ->  | Q189: =IF(R[-165]C<>"",INT(R[-165]C*2.4),"") ->  | AE189: 用于镶嵌到[剑,衣]上.|n镶嵌后不可取下!|n不需要的宝石可以在宠物处熔炼,用于宝石抽奖. | AF189: =VLOOKUP(RC[-31],Sheet2!R13C1:R19C2,2,0)&"."&VLOOKUP(RC[-30],Sheet2!R7C1:R12C2,2,0)&VLOOKUP(RC[-30],Sheet2!R1C1:R6C2,2,0)&RC[-29]&RC[-28]&RC[-27]&Sheet2!R1C3 -> 六.丙|cFF99FF66[宝石]孤问石|r | AG189: =IF(RC[-26]&RC[-25]&RC[-24]&RC[-23]&RC[-22]&RC[-21]="",,R1C6)&IF(RC[-26]="",,"|n"&R1C7&RC[-26])&IF(RC[-25]="",,"|n"&R1C8&RC[-25])&IF(RC[-24]="",,"|n"&R1C9&RC[-24])&IF(RC[-23]="",,"|n"&R1C10&RC[-23])&IF(RC[-22]="",,"|n"&R1C11&RC[-22])&IF(RC[-21]="",,"|n"&R1C12&RC[-21])&IF(RC[-19]&RC[-18]&RC[-17]&RC[-16]="",,"|n|n"&R1C13)&IF(RC[-19]="",,"|n"&R1C14&RC[-19])&IF(RC[-18]="",,"|n"&R1C15&RC[-18])&IF(RC[-17]="",,"|n"&R1C16&RC[-17])&IF(RC[-16]="",,"|n"&R1C17&RC[-16])&IF(RC[-15]="",,"|n"&R1C18&RC[-15])&IF(RC[-14]="",,"|n"&R1C19&RC[-14])&IF(RC[-13]="",,"|n"&R1C20&RC[-13])&IF(RC[-12]="",,"|n"&R1C21&RC[-12])&IF(RC[-11]="",,"|n"&R1C22&RC[-11])&IF(RC[-10]="",,"|n"&R1C23&RC[-10])&IF(RC[-9]="",,"|n"&R1C24&RC[-9])&IF(RC[-8]="",,"|n"&R1C25&RC[-8])&IF(RC[-7]="",,"|n"&R1C26&RC[-7])&IF(RC[-6]="",,"|n"&R1C27&RC[-6])&IF(RC[-5]="",,"|n"&R1C28&RC[-5])&IF(RC[-2]="",,"|n|n"&RC[-2]) -> |cFFFFFF99基础属性|r|n力量:45000|n敏捷:45000|n智力:180000|n|n用于镶嵌到[剑,衣]上.|n镶嵌后不可取下!|n不需要的宝石可以在宠物处熔炼,用于宝石抽奖.
A190: 6 | B190: C | C190: [宝石] | D190: 罡风石 | G190: =IF(R[-165]C<>"",R[-165]C*90,"") ->  | H190: =IF(R[-165]C<>"",R[-165]C*90,"") ->  | I190: =IF(R[-165]C<>"",R[-165]C*90,"") ->  | J190: =IF(R[-165]C<>"",R[-165]C*90,"") ->  | K190: =IF(R[-165]C<>"",R[-165]C*90,"") ->  | L190: =IF(R[-165]C<>"",INT(R[-165]C*8),"") ->  | M190: =IF(R[-165]C<>"",R[-165]C*120,"") ->  | N190: =IF(R[-165]C<>"",INT(R[-165]C*2.4),"") -> 36 | O190: =IF(R[-165]C<>"",INT(R[-165]C*2.4),"") ->  | P190: =IF(R[-165]C<>"",INT(R[-165]C*2.4),"") ->  | Q190: =IF(R[-165]C<>"",INT(R[-165]C*2.4),"") ->  | AE190: 用于镶嵌到[剑,衣]上.|n镶嵌后不可取下!|n不需要的宝石可以在宠物处熔炼,用于宝石抽奖. | AF190: =VLOOKUP(RC[-31],Sheet2!R13C1:R19C2,2,0)&"."&VLOOKUP(RC[-30],Sheet2!R7C1:R12C2,2,0)&VLOOKUP(RC[-30],Sheet2!R1C1:R6C2,2,0)&RC[-29]&RC[-28]&RC[-27]&Sheet2!R1C3 -> 六.丙|cFF99FF66[宝石]罡风石|r | AG190: =IF(RC[-26]&RC[-25]&RC[-24]&RC[-23]&RC[-22]&RC[-21]="",,R1C6)&IF(RC[-26]="",,"|n"&R1C7&RC[-26])&IF(RC[-25]="",,"|n"&R1C8&RC[-25])&IF(RC[-24]="",,"|n"&R1C9&RC[-24])&IF(RC[-23]="",,"|n"&R1C10&RC[-23])&IF(RC[-22]="",,"|n"&R1C11&RC[-22])&IF(RC[-21]="",,"|n"&R1C12&RC[-21])&IF(RC[-19]&RC[-18]&RC[-17]&RC[-16]="",,"|n|n"&R1C13)&IF(RC[-19]="",,"|n"&R1C14&RC[-19])&IF(RC[-18]="",,"|n"&R1C15&RC[-18])&IF(RC[-17]="",,"|n"&R1C16&RC[-17])&IF(RC[-16]="",,"|n"&R1C17&RC[-16])&IF(RC[-15]="",,"|n"&R1C18&RC[-15])&IF(RC[-14]="",,"|n"&R1C19&RC[-14])&IF(RC[-13]="",,"|n"&R1C20&RC[-13])&IF(RC[-12]="",,"|n"&R1C21&RC[-12])&IF(RC[-11]="",,"|n"&R1C22&RC[-11])&IF(RC[-10]="",,"|n"&R1C23&RC[-10])&IF(RC[-9]="",,"|n"&R1C24&RC[-9])&IF(RC[-8]="",,"|n"&R1C25&RC[-8])&IF(RC[-7]="",,"|n"&R1C26&RC[-7])&IF(RC[-6]="",,"|n"&R1C27&RC[-6])&IF(RC[-5]="",,"|n"&R1C28&RC[-5])&IF(RC[-2]="",,"|n|n"&RC[-2]) -> |n|n|cFFFFFF55附加属性|r(%)|n攻速:36|n|n用于镶嵌到[剑,衣]上.|n镶嵌后不可取下!|n不需要的宝石可以在宠物处熔炼,用于宝石抽奖.
A191: 6 | B191: B | C191: [宝石] | D191: 日月之石 | G191: =IF(R[-165]C<>"",R[-165]C*90,"") ->  | H191: =IF(R[-165]C<>"",R[-165]C*90,"") -> 225000 | I191: =IF(R[-165]C<>"",R[-165]C*90,"") ->  | J191: =IF(R[-165]C<>"",R[-165]C*90,"") ->  | K191: =IF(R[-165]C<>"",R[-165]C*90,"") ->  | L191: =IF(R[-165]C<>"",INT(R[-165]C*8),"") -> 200 | N191: =IF(R[-165]C<>"",INT(R[-165]C*2.4),"") ->  | O191: =IF(R[-165]C<>"",INT(R[-165]C*2.4),"") ->  | P191: =IF(R[-165]C<>"",INT(R[-165]C*2.4),"") ->  | Q191: =IF(R[-165]C<>"",INT(R[-165]C*2.4),"") ->  | R191: =IF(R[-165]C<>"",INT(R[-165]C*2.4),"") -> 4 | AE191: 用于镶嵌到[剑,衣]上.|n镶嵌后不可取下!|n不需要的宝石可以在宠物处熔炼,用于宝石抽奖. | AF191: =VLOOKUP(RC[-31],Sheet2!R13C1:R19C2,2,0)&"."&VLOOKUP(RC[-30],Sheet2!R7C1:R12C2,2,0)&VLOOKUP(RC[-30],Sheet2!R1C1:R6C2,2,0)&RC[-29]&RC[-28]&RC[-27]&Sheet2!R1C3 -> 六.乙|cFF1BE6B8[宝石]日月之石|r | AG191: =IF(RC[-26]&RC[-25]&RC[-24]&RC[-23]&RC[-22]&RC[-21]="",,R1C6)&IF(RC[-26]="",,"|n"&R1C7&RC[-26])&IF(RC[-25]="",,"|n"&R1C8&RC[-25])&IF(RC[-24]="",,"|n"&R1C9&RC[-24])&IF(RC[-23]="",,"|n"&R1C10&RC[-23])&IF(RC[-22]="",,"|n"&R1C11&RC[-22])&IF(RC[-21]="",,"|n"&R1C12&RC[-21])&IF(RC[-19]&RC[-18]&RC[-17]&RC[-16]="",,"|n|n"&R1C13)&IF(RC[-19]="",,"|n"&R1C14&RC[-19])&IF(RC[-18]="",,"|n"&R1C15&RC[-18])&IF(RC[-17]="",,"|n"&R1C16&RC[-17])&IF(RC[-16]="",,"|n"&R1C17&RC[-16])&IF(RC[-15]="",,"|n"&R1C18&RC[-15])&IF(RC[-14]="",,"|n"&R1C19&RC[-14])&IF(RC[-13]="",,"|n"&R1C20&RC[-13])&IF(RC[-12]="",,"|n"&R1C21&RC[-12])&IF(RC[-11]="",,"|n"&R1C22&RC[-11])&IF(RC[-10]="",,"|n"&R1C23&RC[-10])&IF(RC[-9]="",,"|n"&R1C24&RC[-9])&IF(RC[-8]="",,"|n"&R1C25&RC[-8])&IF(RC[-7]="",,"|n"&R1C26&RC[-7])&IF(RC[-6]="",,"|n"&R1C27&RC[-6])&IF(RC[-5]="",,"|n"&R1C28&RC[-5])&IF(RC[-2]="",,"|n|n"&RC[-2]) -> |cFFFFFF99基础属性|r|n力量:225000|n护甲:200|n伤害增幅:4|n|n用于镶嵌到[剑,衣]上.|n镶嵌后不可取下!|n不需要的宝石可以在宠物处熔炼,用于宝石抽奖.
A192: 6 | B192: B | C192: [宝石] | D192: 幻光神石 | G192: =IF(R[-165]C<>"",R[-165]C*90,"") -> 540000 | H192: =IF(R[-165]C<>"",R[-165]C*90,"") ->  | I192: =IF(R[-165]C<>"",R[-165]C*90,"") ->  | J192: =IF(R[-165]C<>"",R[-165]C*90,"") ->  | K192: =IF(R[-165]C<>"",R[-165]C*90,"") ->  | L192: =IF(R[-165]C<>"",INT(R[-165]C*8),"") -> 200 | N192: =IF(R[-165]C<>"",INT(R[-165]C*2.4),"") ->  | O192: =IF(R[-165]C<>"",INT(R[-165]C*2.4),"") ->  | P192: =IF(R[-165]C<>"",INT(R[-165]C*2.4),"") ->  | Q192: =IF(R[-165]C<>"",INT(R[-165]C*2.4),"") ->  | R192: =IF(R[-165]C<>"",INT(R[-165]C*2.4),"") -> 4 | AE192: 用于镶嵌到[剑,衣]上.|n镶嵌后不可取下!|n不需要的宝石可以在宠物处熔炼,用于宝石抽奖. | AF192: =VLOOKUP(RC[-31],Sheet2!R13C1:R19C2,2,0)&"."&VLOOKUP(RC[-30],Sheet2!R7C1:R12C2,2,0)&VLOOKUP(RC[-30],Sheet2!R1C1:R6C2,2,0)&RC[-29]&RC[-28]&RC[-27]&Sheet2!R1C3 -> 六.乙|cFF1BE6B8[宝石]幻光神石|r | AG192: =IF(RC[-26]&RC[-25]&RC[-24]&RC[-23]&RC[-22]&RC[-21]="",,R1C6)&IF(RC[-26]="",,"|n"&R1C7&RC[-26])&IF(RC[-25]="",,"|n"&R1C8&RC[-25])&IF(RC[-24]="",,"|n"&R1C9&RC[-24])&IF(RC[-23]="",,"|n"&R1C10&RC[-23])&IF(RC[-22]="",,"|n"&R1C11&RC[-22])&IF(RC[-21]="",,"|n"&R1C12&RC[-21])&IF(RC[-19]&RC[-18]&RC[-17]&RC[-16]="",,"|n|n"&R1C13)&IF(RC[-19]="",,"|n"&R1C14&RC[-19])&IF(RC[-18]="",,"|n"&R1C15&RC[-18])&IF(RC[-17]="",,"|n"&R1C16&RC[-17])&IF(RC[-16]="",,"|n"&R1C17&RC[-16])&IF(RC[-15]="",,"|n"&R1C18&RC[-15])&IF(RC[-14]="",,"|n"&R1C19&RC[-14])&IF(RC[-13]="",,"|n"&R1C20&RC[-13])&IF(RC[-12]="",,"|n"&R1C21&RC[-12])&IF(RC[-11]="",,"|n"&R1C22&RC[-11])&IF(RC[-10]="",,"|n"&R1C23&RC[-10])&IF(RC[-9]="",,"|n"&R1C24&RC[-9])&IF(RC[-8]="",,"|n"&R1C25&RC[-8])&IF(RC[-7]="",,"|n"&R1C26&RC[-7])&IF(RC[-6]="",,"|n"&R1C27&RC[-6])&IF(RC[-5]="",,"|n"&R1C28&RC[-5])&IF(RC[-2]="",,"|n|n"&RC[-2]) -> |cFFFFFF99基础属性|r|n攻击:540000|n护甲:200|n伤害增幅:4|n|n用于镶嵌到[剑,衣]上.|n镶嵌后不可取下!|n不需要的宝石可以在宠物处熔炼,用于宝石抽奖.
A193: 6 | B193: B | C193: [宝石] | D193: 星尘神石 | G193: =IF(R[-165]C<>"",R[-165]C*90,"") ->  | H193: =IF(R[-165]C<>"",R[-165]C*90,"") ->  | I193: =IF(R[-165]C<>"",R[-165]C*90,"") ->  | J193: =IF(R[-165]C<>"",R[-165]C*90,"") -> 225000 | K193: =IF(R[-165]C<>"",R[-165]C*90,"") ->  | L193: =IF(R[-165]C<>"",INT(R[-165]C*8),"") -> 200 | N193: =IF(R[-165]C<>"",INT(R[-165]C*2.4),"") ->  | O193: =IF(R[-165]C<>"",INT(R[-165]C*2.4),"") ->  | P193: =IF(R[-165]C<>"",INT(R[-165]C*2.4),"") ->  | Q193: =IF(R[-165]C<>"",INT(R[-165]C*2.4),"") ->  | R193: =IF(R[-165]C<>"",INT(R[-165]C*2.4),"") -> 4 | AE193: 用于镶嵌到[剑,衣]上.|n镶嵌后不可取下!|n不需要的宝石可以在宠物处熔炼,用于宝石抽奖. | AF193: =VLOOKUP(RC[-31],Sheet2!R13C1:R19C2,2,0)&"."&VLOOKUP(RC[-30],Sheet2!R7C1:R12C2,2,0)&VLOOKUP(RC[-30],Sheet2!R1C1:R6C2,2,0)&RC[-29]&RC[-28]&RC[-27]&Sheet2!R1C3 -> 六.乙|cFF1BE6B8[宝石]星尘神石|r | AG193: =IF(RC[-26]&RC[-25]&RC[-24]&RC[-23]&RC[-22]&RC[-21]="",,R1C6)&IF(RC[-26]="",,"|n"&R1C7&RC[-26])&IF(RC[-25]="",,"|n"&R1C8&RC[-25])&IF(RC[-24]="",,"|n"&R1C9&RC[-24])&IF(RC[-23]="",,"|n"&R1C10&RC[-23])&IF(RC[-22]="",,"|n"&R1C11&RC[-22])&IF(RC[-21]="",,"|n"&R1C12&RC[-21])&IF(RC[-19]&RC[-18]&RC[-17]&RC[-16]="",,"|n|n"&R1C13)&IF(RC[-19]="",,"|n"&R1C14&RC[-19])&IF(RC[-18]="",,"|n"&R1C15&RC[-18])&IF(RC[-17]="",,"|n"&R1C16&RC[-17])&IF(RC[-16]="",,"|n"&R1C17&RC[-16])&IF(RC[-15]="",,"|n"&R1C18&RC[-15])&IF(RC[-14]="",,"|n"&R1C19&RC[-14])&IF(RC[-13]="",,"|n"&R1C20&RC[-13])&IF(RC[-12]="",,"|n"&R1C21&RC[-12])&IF(RC[-11]="",,"|n"&R1C22&RC[-11])&IF(RC[-10]="",,"|n"&R1C23&RC[-10])&IF(RC[-9]="",,"|n"&R1C24&RC[-9])&IF(RC[-8]="",,"|n"&R1C25&RC[-8])&IF(RC[-7]="",,"|n"&R1C26&RC[-7])&IF(RC[-6]="",,"|n"&R1C27&RC[-6])&IF(RC[-5]="",,"|n"&R1C28&RC[-5])&IF(RC[-2]="",,"|n|n"&RC[-2]) -> |cFFFFFF99基础属性|r|n智力:225000|n护甲:200|n伤害增幅:4|n|n用于镶嵌到[剑,衣]上.|n镶嵌后不可取下!|n不需要的宝石可以在宠物处熔炼,用于宝石抽奖.
A194: 6 | B194: B | C194: [宝石] | D194: 玄灵魔石 | G194: =IF(R[-165]C<>"",R[-165]C*90,"") ->  | H194: =IF(R[-165]C<>"",R[-165]C*90,"") ->  | I194: =IF(R[-165]C<>"",R[-165]C*90,"") -> 225000 | J194: =IF(R[-165]C<>"",R[-165]C*90,"") ->  | K194: =IF(R[-165]C<>"",R[-165]C*90,"") ->  | L194: =IF(R[-165]C<>"",INT(R[-165]C*8),"") -> 200 | N194: =IF(R[-165]C<>"",INT(R[-165]C*2.4),"") ->  | O194: =IF(R[-165]C<>"",INT(R[-165]C*2.4),"") ->  | P194: =IF(R[-165]C<>"",INT(R[-165]C*2.4),"") ->  | Q194: =IF(R[-165]C<>"",INT(R[-165]C*2.4),"") ->  | R194: =IF(R[-165]C<>"",INT(R[-165]C*2.4),"") -> 4 | AE194: 用于镶嵌到[剑,衣]上.|n镶嵌后不可取下!|n不需要的宝石可以在宠物处熔炼,用于宝石抽奖. | AF194: =VLOOKUP(RC[-31],Sheet2!R13C1:R19C2,2,0)&"."&VLOOKUP(RC[-30],Sheet2!R7C1:R12C2,2,0)&VLOOKUP(RC[-30],Sheet2!R1C1:R6C2,2,0)&RC[-29]&RC[-28]&RC[-27]&Sheet2!R1C3 -> 六.乙|cFF1BE6B8[宝石]玄灵魔石|r | AG194: =IF(RC[-26]&RC[-25]&RC[-24]&RC[-23]&RC[-22]&RC[-21]="",,R1C6)&IF(RC[-26]="",,"|n"&R1C7&RC[-26])&IF(RC[-25]="",,"|n"&R1C8&RC[-25])&IF(RC[-24]="",,"|n"&R1C9&RC[-24])&IF(RC[-23]="",,"|n"&R1C10&RC[-23])&IF(RC[-22]="",,"|n"&R1C11&RC[-22])&IF(RC[-21]="",,"|n"&R1C12&RC[-21])&IF(RC[-19]&RC[-18]&RC[-17]&RC[-16]="",,"|n|n"&R1C13)&IF(RC[-19]="",,"|n"&R1C14&RC[-19])&IF(RC[-18]="",,"|n"&R1C15&RC[-18])&IF(RC[-17]="",,"|n"&R1C16&RC[-17])&IF(RC[-16]="",,"|n"&R1C17&RC[-16])&IF(RC[-15]="",,"|n"&R1C18&RC[-15])&IF(RC[-14]="",,"|n"&R1C19&RC[-14])&IF(RC[-13]="",,"|n"&R1C20&RC[-13])&IF(RC[-12]="",,"|n"&R1C21&RC[-12])&IF(RC[-11]="",,"|n"&R1C22&RC[-11])&IF(RC[-10]="",,"|n"&R1C23&RC[-10])&IF(RC[-9]="",,"|n"&R1C24&RC[-9])&IF(RC[-8]="",,"|n"&R1C25&RC[-8])&IF(RC[-7]="",,"|n"&R1C26&RC[-7])&IF(RC[-6]="",,"|n"&R1C27&RC[-6])&IF(RC[-5]="",,"|n"&R1C28&RC[-5])&IF(RC[-2]="",,"|n|n"&RC[-2]) -> |cFFFFFF99基础属性|r|n敏捷:225000|n护甲:200|n伤害增幅:4|n|n用于镶嵌到[剑,衣]上.|n镶嵌后不可取下!|n不需要的宝石可以在宠物处熔炼,用于宝石抽奖.
A195: 6 | B195: A | C195: [宝石] | D195: 无限之光 | G195: =IF(R[-165]C<>"",R[-165]C*90,"") ->  | H195: =IF(R[-165]C<>"",R[-165]C*90,"") -> 108000 | I195: =IF(R[-165]C<>"",R[-165]C*90,"") -> 108000 | J195: =IF(R[-165]C<>"",R[-165]C*90,"") -> 108000 | K195: =IF(R[-165]C<>"",R[-165]C*90,"") ->  | L195: =IF(R[-165]C<>"",INT(R[-165]C*8),"") ->  | N195: =IF(R[-165]C<>"",INT(R[-165]C*2.4),"") -> 14 | O195: =IF(R[-165]C<>"",INT(R[-165]C*2.4),"") ->  | P195: =IF(R[-165]C<>"",INT(R[-165]C*2.4),"") ->  | Q195: =IF(R[-165]C<>"",INT(R[-165]C*2.4),"") ->  | R195: =IF(R[-165]C<>"",INT(R[-165]C*2.4),"") -> 9 | S195: =IF(R[-165]C<>"",INT(R[-165]C*2.4),"") ->  | T195: =IF(R[-165]C<>"",INT(R[-165]C*2.4),"") ->  | AE195: 用于镶嵌到[剑,衣]上.|n镶嵌后不可取下!|n不需要的宝石可以在宠物处熔炼,用于宝石抽奖. | AF195: =VLOOKUP(RC[-31],Sheet2!R13C1:R19C2,2,0)&"."&VLOOKUP(RC[-30],Sheet2!R7C1:R12C2,2,0)&VLOOKUP(RC[-30],Sheet2!R1C1:R6C2,2,0)&RC[-29]&RC[-28]&RC[-27]&Sheet2!R1C3 -> 六.甲|cFF33FF00[宝石]无限之光|r | AG195: =IF(RC[-26]&RC[-25]&RC[-24]&RC[-23]&RC[-22]&RC[-21]="",,R1C6)&IF(RC[-26]="",,"|n"&R1C7&RC[-26])&IF(RC[-25]="",,"|n"&R1C8&RC[-25])&IF(RC[-24]="",,"|n"&R1C9&RC[-24])&IF(RC[-23]="",,"|n"&R1C10&RC[-23])&IF(RC[-22]="",,"|n"&R1C11&RC[-22])&IF(RC[-21]="",,"|n"&R1C12&RC[-21])&IF(RC[-19]&RC[-18]&RC[-17]&RC[-16]="",,"|n|n"&R1C13)&IF(RC[-19]="",,"|n"&R1C14&RC[-19])&IF(RC[-18]="",,"|n"&R1C15&RC[-18])&IF(RC[-17]="",,"|n"&R1C16&RC[-17])&IF(RC[-16]="",,"|n"&R1C17&RC[-16])&IF(RC[-15]="",,"|n"&R1C18&RC[-15])&IF(RC[-14]="",,"|n"&R1C19&RC[-14])&IF(RC[-13]="",,"|n"&R1C20&RC[-13])&IF(RC[-12]="",,"|n"&R1C21&RC[-12])&IF(RC[-11]="",,"|n"&R1C22&RC[-11])&IF(RC[-10]="",,"|n"&R1C23&RC[-10])&IF(RC[-9]="",,"|n"&R1C24&RC[-9])&IF(RC[-8]="",,"|n"&R1C25&RC[-8])&IF(RC[-7]="",,"|n"&R1C26&RC[-7])&IF(RC[-6]="",,"|n"&R1C27&RC[-6])&IF(RC[-5]="",,"|n"&R1C28&RC[-5])&IF(RC[-2]="",,"|n|n"&RC[-2]) -> |cFFFFFF99基础属性|r|n力量:108000|n敏捷:108000|n智力:108000|n|n|cFFFFFF55附加属性|r(%)|n攻速:14|n伤害增幅:9|n|n用于镶嵌到[剑,衣]上.|n镶嵌后不可取下!|n不需要的宝石可以在宠物处熔炼,用于宝石抽奖.
A196: 6 | B196: A | C196: [宝石] | D196: 无瑕纯白 | G196: =IF(R[-165]C<>"",R[-165]C*90,"") -> 720000 | H196: =IF(R[-165]C<>"",R[-165]C*90,"") ->  | I196: =IF(R[-165]C<>"",R[-165]C*90,"") ->  | J196: =IF(R[-165]C<>"",R[-165]C*90,"") ->  | K196: =IF(R[-165]C<>"",R[-165]C*90,"") ->  | L196: =IF(R[-165]C<>"",INT(R[-165]C*8),"") ->  | N196: =IF(R[-165]C<>"",INT(R[-165]C*2.4),"") -> 14 | O196: =IF(R[-165]C<>"",INT(R[-165]C*2.4),"") ->  | P196: =IF(R[-165]C<>"",INT(R[-165]C*2.4),"") ->  | Q196: =IF(R[-165]C<>"",INT(R[-165]C*2.4),"") ->  | R196: =IF(R[-165]C<>"",INT(R[-165]C*2.4),"") -> 9 | S196: =IF(R[-165]C<>"",INT(R[-165]C*2.4),"") ->  | T196: =IF(R[-165]C<>"",INT(R[-165]C*2.4),"") ->  | AE196: 用于镶嵌到[剑,衣]上.|n镶嵌后不可取下!|n不需要的宝石可以在宠物处熔炼,用于宝石抽奖. | AF196: =VLOOKUP(RC[-31],Sheet2!R13C1:R19C2,2,0)&"."&VLOOKUP(RC[-30],Sheet2!R7C1:R12C2,2,0)&VLOOKUP(RC[-30],Sheet2!R1C1:R6C2,2,0)&RC[-29]&RC[-28]&RC[-27]&Sheet2!R1C3 -> 六.甲|cFF33FF00[宝石]无瑕纯白|r | AG196: =IF(RC[-26]&RC[-25]&RC[-24]&RC[-23]&RC[-22]&RC[-21]="",,R1C6)&IF(RC[-26]="",,"|n"&R1C7&RC[-26])&IF(RC[-25]="",,"|n"&R1C8&RC[-25])&IF(RC[-24]="",,"|n"&R1C9&RC[-24])&IF(RC[-23]="",,"|n"&R1C10&RC[-23])&IF(RC[-22]="",,"|n"&R1C11&RC[-22])&IF(RC[-21]="",,"|n"&R1C12&RC[-21])&IF(RC[-19]&RC[-18]&RC[-17]&RC[-16]="",,"|n|n"&R1C13)&IF(RC[-19]="",,"|n"&R1C14&RC[-19])&IF(RC[-18]="",,"|n"&R1C15&RC[-18])&IF(RC[-17]="",,"|n"&R1C16&RC[-17])&IF(RC[-16]="",,"|n"&R1C17&RC[-16])&IF(RC[-15]="",,"|n"&R1C18&RC[-15])&IF(RC[-14]="",,"|n"&R1C19&RC[-14])&IF(RC[-13]="",,"|n"&R1C20&RC[-13])&IF(RC[-12]="",,"|n"&R1C21&RC[-12])&IF(RC[-11]="",,"|n"&R1C22&RC[-11])&IF(RC[-10]="",,"|n"&R1C23&RC[-10])&IF(RC[-9]="",,"|n"&R1C24&RC[-9])&IF(RC[-8]="",,"|n"&R1C25&RC[-8])&IF(RC[-7]="",,"|n"&R1C26&RC[-7])&IF(RC[-6]="",,"|n"&R1C27&RC[-6])&IF(RC[-5]="",,"|n"&R1C28&RC[-5])&IF(RC[-2]="",,"|n|n"&RC[-2]) -> |cFFFFFF99基础属性|r|n攻击:720000|n|n|cFFFFFF55附加属性|r(%)|n攻速:14|n伤害增幅:9|n|n用于镶嵌到[剑,衣]上.|n镶嵌后不可取下!|n不需要的宝石可以在宠物处熔炼,用于宝石抽奖.
A197: 6 | B197: S | C197: [宝石] | D197: 仙道 - 至鸿 | G197: =IF(R[-165]C<>"",R[-165]C*90,"") ->  | H197: =IF(R[-165]C<>"",R[-165]C*90,"") ->  | I197: =IF(R[-165]C<>"",R[-165]C*90,"") ->  | J197: =IF(R[-165]C<>"",R[-165]C*90,"") ->  | K197: =IF(R[-165]C<>"",R[-165]C*90,"") -> 2700000 | L197: =IF(R[-165]C<>"",INT(R[-165]C*8),"") -> 1200 | N197: =IF(R[-165]C<>"",INT(R[-165]C*2.4),"") ->  | O197: =IF(R[-165]C<>"",INT(R[-165]C*2.4),"") -> 2 | P197: =IF(R[-165]C<>"",INT(R[-165]C*2.4),"") ->  | Q197: =IF(R[-165]C<>"",INT(R[-165]C*2.4),"") ->  | R197: =IF(R[-165]C<>"",INT(R[-165]C*2.4),"") -> 9 | S197: =IF(R[-165]C<>"",INT(R[-165]C*2.4),"") ->  | T197: =IF(R[-165]C<>"",INT(R[-165]C*2.4),"") ->  | AE197: 用于镶嵌到[剑,衣]上.|n镶嵌后不可取下!|n不需要的宝石可以在宠物处熔炼,用于宝石抽奖. | AF197: =VLOOKUP(RC[-31],Sheet2!R13C1:R19C2,2,0)&"."&VLOOKUP(RC[-30],Sheet2!R7C1:R12C2,2,0)&VLOOKUP(RC[-30],Sheet2!R1C1:R6C2,2,0)&RC[-29]&RC[-28]&RC[-27]&Sheet2!R1C3 -> 六.绝|cFFFF9933[宝石]仙道 - 至鸿|r | AG197: =IF(RC[-26]&RC[-25]&RC[-24]&RC[-23]&RC[-22]&RC[-21]="",,R1C6)&IF(RC[-26]="",,"|n"&R1C7&RC[-26])&IF(RC[-25]="",,"|n"&R1C8&RC[-25])&IF(RC[-24]="",,"|n"&R1C9&RC[-24])&IF(RC[-23]="",,"|n"&R1C10&RC[-23])&IF(RC[-22]="",,"|n"&R1C11&RC[-22])&IF(RC[-21]="",,"|n"&R1C12&RC[-21])&IF(RC[-19]&RC[-18]&RC[-17]&RC[-16]="",,"|n|n"&R1C13)&IF(RC[-19]="",,"|n"&R1C14&RC[-19])&IF(RC[-18]="",,"|n"&R1C15&RC[-18])&IF(RC[-17]="",,"|n"&R1C16&RC[-17])&IF(RC[-16]="",,"|n"&R1C17&RC[-16])&IF(RC[-15]="",,"|n"&R1C18&RC[-15])&IF(RC[-14]="",,"|n"&R1C19&RC[-14])&IF(RC[-13]="",,"|n"&R1C20&RC[-13])&IF(RC[-12]="",,"|n"&R1C21&RC[-12])&IF(RC[-11]="",,"|n"&R1C22&RC[-11])&IF(RC[-10]="",,"|n"&R1C23&RC[-10])&IF(RC[-9]="",,"|n"&R1C24&RC[-9])&IF(RC[-8]="",,"|n"&R1C25&RC[-8])&IF(RC[-7]="",,"|n"&R1C26&RC[-7])&IF(RC[-6]="",,"|n"&R1C27&RC[-6])&IF(RC[-5]="",,"|n"&R1C28&RC[-5])&IF(RC[-2]="",,"|n|n"&RC[-2]) -> |cFFFFFF99基础属性|r|n血量:2700000|n护甲:1200|n|n|cFFFFFF55附加属性|r(%)|n攻击吸血:2|n伤害增幅:9|n|n用于镶嵌到[剑,衣]上.|n镶嵌后不可取下!|n不需要的宝石可以在宠物处熔炼,用于宝石抽奖.
A198: 6 | B198: S | C198: [宝石] | D198: 仙道 - 永恒 | G198: =IF(R[-165]C<>"",R[-165]C*90,"") -> 225000 | H198: =IF(R[-165]C<>"",R[-165]C*90,"") ->  | I198: =IF(R[-165]C<>"",R[-165]C*90,"") ->  | J198: =IF(R[-165]C<>"",R[-165]C*90,"") ->  | K198: =IF(R[-165]C<>"",R[-165]C*90,"") ->  | L198: =IF(R[-165]C<>"",INT(R[-165]C*8),"") ->  | N198: =IF(R[-165]C<>"",INT(R[-165]C*2.4),"") ->  | O198: =IF(R[-165]C<>"",INT(R[-165]C*2.4),"") ->  | P198: =IF(R[-165]C<>"",INT(R[-165]C*2.4),"") -> 12 | Q198: =IF(R[-165]C<>"",INT(R[-165]C*2.4),"") -> 48 | R198: =IF(R[-165]C<>"",INT(R[-165]C*2.4),"") -> 9 | S198: =IF(R[-165]C<>"",INT(R[-165]C*2.4),"") ->  | T198: =IF(R[-165]C<>"",INT(R[-165]C*2.4),"") ->  | AE198: 用于镶嵌到[剑,衣]上.|n镶嵌后不可取下!|n不需要的宝石可以在宠物处熔炼,用于宝石抽奖. | AF198: =VLOOKUP(RC[-31],Sheet2!R13C1:R19C2,2,0)&"."&VLOOKUP(RC[-30],Sheet2!R7C1:R12C2,2,0)&VLOOKUP(RC[-30],Sheet2!R1C1:R6C2,2,0)&RC[-29]&RC[-28]&RC[-27]&Sheet2!R1C3 -> 六.绝|cFFFF9933[宝石]仙道 - 永恒|r | AG198: =IF(RC[-26]&RC[-25]&RC[-24]&RC[-23]&RC[-22]&RC[-21]="",,R1C6)&IF(RC[-26]="",,"|n"&R1C7&RC[-26])&IF(RC[-25]="",,"|n"&R1C8&RC[-25])&IF(RC[-24]="",,"|n"&R1C9&RC[-24])&IF(RC[-23]="",,"|n"&R1C10&RC[-23])&IF(RC[-22]="",,"|n"&R1C11&RC[-22])&IF(RC[-21]="",,"|n"&R1C12&RC[-21])&IF(RC[-19]&RC[-18]&RC[-17]&RC[-16]="",,"|n|n"&R1C13)&IF(RC[-19]="",,"|n"&R1C14&RC[-19])&IF(RC[-18]="",,"|n"&R1C15&RC[-18])&IF(RC[-17]="",,"|n"&R1C16&RC[-17])&IF(RC[-16]="",,"|n"&R1C17&RC[-16])&IF(RC[-15]="",,"|n"&R1C18&RC[-15])&IF(RC[-14]="",,"|n"&R1C19&RC[-14])&IF(RC[-13]="",,"|n"&R1C20&RC[-13])&IF(RC[-12]="",,"|n"&R1C21&RC[-12])&IF(RC[-11]="",,"|n"&R1C22&RC[-11])&IF(RC[-10]="",,"|n"&R1C23&RC[-10])&IF(RC[-9]="",,"|n"&R1C24&RC[-9])&IF(RC[-8]="",,"|n"&R1C25&RC[-8])&IF(RC[-7]="",,"|n"&R1C26&RC[-7])&IF(RC[-6]="",,"|n"&R1C27&RC[-6])&IF(RC[-5]="",,"|n"&R1C28&RC[-5])&IF(RC[-2]="",,"|n|n"&RC[-2]) -> |cFFFFFF99基础属性|r|n攻击:225000|n|n|cFFFFFF55附加属性|r(%)|n暴击概率:12|n暴击伤害:48|n伤害增幅:9|n|n用于镶嵌到[剑,衣]上.|n镶嵌后不可取下!|n不需要的宝石可以在宠物处熔炼,用于宝石抽奖.
A199: 6 | B199: X | C199: [宝石] | D199: 上古遗物 - 纵横 | G199: =IF(R[-165]C<>"",R[-165]C*90,"") ->  | H199: =IF(R[-165]C<>"",R[-165]C*90,"") ->  | I199: =IF(R[-165]C<>"",R[-165]C*90,"") ->  | J199: =IF(R[-165]C<>"",R[-165]C*90,"") ->  | K199: =IF(R[-165]C<>"",R[-165]C*90,"") -> 5400000 | L199: =IF(R[-165]C<>"",INT(R[-165]C*8),"") -> 1600 | N199: =IF(R[-165]C<>"",INT(R[-165]C*2.4),"") ->  | O199: =IF(R[-165]C<>"",INT(R[-165]C*2.4),"") ->  | P199: =IF(R[-165]C<>"",INT(R[-165]C*2.4),"") ->  | Q199: =IF(R[-165]C<>"",INT(R[-165]C*2.4),"") -> 48 | R199: =IF(R[-165]C<>"",INT(R[-165]C*2.4),"") -> 19 | S199: =IF(R[-165]C<>"",INT(R[-165]C*2.4),"") ->  | T199: =IF(R[-165]C<>"",INT(R[-165]C*2.4),"") ->  | AE199: 用于镶嵌到[剑,衣]上.|n镶嵌后不可取下!|n不需要的宝石可以在宠物处熔炼,用于宝石抽奖. | AF199: =VLOOKUP(RC[-31],Sheet2!R13C1:R19C2,2,0)&"."&VLOOKUP(RC[-30],Sheet2!R7C1:R12C2,2,0)&VLOOKUP(RC[-30],Sheet2!R1C1:R6C2,2,0)&RC[-29]&RC[-28]&RC[-27]&Sheet2!R1C3 -> 六.神|Cffff0000[宝石]上古遗物 - 纵横|r | AG199: =IF(RC[-26]&RC[-25]&RC[-24]&RC[-23]&RC[-22]&RC[-21]="",,R1C6)&IF(RC[-26]="",,"|n"&R1C7&RC[-26])&IF(RC[-25]="",,"|n"&R1C8&RC[-25])&IF(RC[-24]="",,"|n"&R1C9&RC[-24])&IF(RC[-23]="",,"|n"&R1C10&RC[-23])&IF(RC[-22]="",,"|n"&R1C11&RC[-22])&IF(RC[-21]="",,"|n"&R1C12&RC[-21])&IF(RC[-19]&RC[-18]&RC[-17]&RC[-16]="",,"|n|n"&R1C13)&IF(RC[-19]="",,"|n"&R1C14&RC[-19])&IF(RC[-18]="",,"|n"&R1C15&RC[-18])&IF(RC[-17]="",,"|n"&R1C16&RC[-17])&IF(RC[-16]="",,"|n"&R1C17&RC[-16])&IF(RC[-15]="",,"|n"&R1C18&RC[-15])&IF(RC[-14]="",,"|n"&R1C19&RC[-14])&IF(RC[-13]="",,"|n"&R1C20&RC[-13])&IF(RC[-12]="",,"|n"&R1C21&RC[-12])&IF(RC[-11]="",,"|n"&R1C22&RC[-11])&IF(RC[-10]="",,"|n"&R1C23&RC[-10])&IF(RC[-9]="",,"|n"&R1C24&RC[-9])&IF(RC[-8]="",,"|n"&R1C25&RC[-8])&IF(RC[-7]="",,"|n"&R1C26&RC[-7])&IF(RC[-6]="",,"|n"&R1C27&RC[-6])&IF(RC[-5]="",,"|n"&R1C28&RC[-5])&IF(RC[-2]="",,"|n|n"&RC[-2]) -> |cFFFFFF99基础属性|r|n血量:5400000|n护甲:1600|n|n|cFFFFFF55附加属性|r(%)|n暴击伤害:48|n伤害增幅:19|n|n用于镶嵌到[剑,衣]上.|n镶嵌后不可取下!|n不需要的宝石可以在宠物处熔炼,用于宝石抽奖.
AF200: =VLOOKUP(RC[-31],Sheet2!R13C1:R18C2,2,0)&"."&VLOOKUP(RC[-30],Sheet2!R7C1:R11C2,2,0)&VLOOKUP(RC[-30],Sheet2!R1C1:R5C2,2,0)&RC[-29]&RC[-28]&RC[-27]&Sheet2!R1C3 -> #N/A | AG200: =IF(RC[-26]&RC[-25]&RC[-24]&RC[-23]&RC[-22]&RC[-21]="",,R1C6)&IF(RC[-26]="",,"|n"&R1C7&RC[-26])&IF(RC[-25]="",,"|n"&R1C8&RC[-25])&IF(RC[-24]="",,"|n"&R1C9&RC[-24])&IF(RC[-23]="",,"|n"&R1C10&RC[-23])&IF(RC[-22]="",,"|n"&R1C11&RC[-22])&IF(RC[-21]="",,"|n"&R1C12&RC[-21])&IF(RC[-19]&RC[-18]&RC[-17]&RC[-16]="",,"|n"&R1C13)&IF(RC[-19]="",,"|n"&R1C14&RC[-19])&IF(RC[-18]="",,"|n"&R1C15&RC[-18])&IF(RC[-17]="",,"|n"&R1C16&RC[-17])&IF(RC[-16]="",,"|n"&R1C17&RC[-16])&IF(RC[-15]="",,"|n"&R1C18&RC[-15])&IF(RC[-14]="",,"|n"&R1C19&RC[-14])&IF(RC[-13]="",,"|n"&R1C20&RC[-13])&IF(RC[-12]="",,"|n"&R1C21&RC[-12])&IF(RC[-11]="",,"|n"&R1C22&RC[-11])&IF(RC[-10]="",,"|n"&R1C23&RC[-10])&IF(RC[-9]="",,"|n"&R1C24&RC[-9])&IF(RC[-8]="",,"|n"&R1C25&RC[-8])&IF(RC[-7]="",,"|n"&R1C26&RC[-7])&IF(RC[-6]="",,"|n"&R1C27&RC[-6])&IF(RC[-5]="",,"|n"&R1C28&RC[-5])&IF(RC[-2]="",,"|n"&RC[-2]) -> 
AF201: =VLOOKUP(RC[-31],Sheet2!R13C1:R18C2,2,0)&"."&VLOOKUP(RC[-30],Sheet2!R7C1:R11C2,2,0)&VLOOKUP(RC[-30],Sheet2!R1C1:R5C2,2,0)&RC[-29]&RC[-28]&RC[-27]&Sheet2!R1C3 -> #N/A | AG201: =IF(RC[-26]&RC[-25]&RC[-24]&RC[-23]&RC[-22]&RC[-21]="",,R1C6)&IF(RC[-26]="",,"|n"&R1C7&RC[-26])&IF(RC[-25]="",,"|n"&R1C8&RC[-25])&IF(RC[-24]="",,"|n"&R1C9&RC[-24])&IF(RC[-23]="",,"|n"&R1C10&RC[-23])&IF(RC[-22]="",,"|n"&R1C11&RC[-22])&IF(RC[-21]="",,"|n"&R1C12&RC[-21])&IF(RC[-19]&RC[-18]&RC[-17]&RC[-16]="",,"|n"&R1C13)&IF(RC[-19]="",,"|n"&R1C14&RC[-19])&IF(RC[-18]="",,"|n"&R1C15&RC[-18])&IF(RC[-17]="",,"|n"&R1C16&RC[-17])&IF(RC[-16]="",,"|n"&R1C17&RC[-16])&IF(RC[-15]="",,"|n"&R1C18&RC[-15])&IF(RC[-14]="",,"|n"&R1C19&RC[-14])&IF(RC[-13]="",,"|n"&R1C20&RC[-13])&IF(RC[-12]="",,"|n"&R1C21&RC[-12])&IF(RC[-11]="",,"|n"&R1C22&RC[-11])&IF(RC[-10]="",,"|n"&R1C23&RC[-10])&IF(RC[-9]="",,"|n"&R1C24&RC[-9])&IF(RC[-8]="",,"|n"&R1C25&RC[-8])&IF(RC[-7]="",,"|n"&R1C26&RC[-7])&IF(RC[-6]="",,"|n"&R1C27&RC[-6])&IF(RC[-5]="",,"|n"&R1C28&RC[-5])&IF(RC[-2]="",,"|n"&RC[-2]) -> 
AF202: =VLOOKUP(RC[-31],Sheet2!R13C1:R18C2,2,0)&"."&VLOOKUP(RC[-30],Sheet2!R7C1:R11C2,2,0)&VLOOKUP(RC[-30],Sheet2!R1C1:R5C2,2,0)&RC[-29]&RC[-28]&RC[-27]&Sheet2!R1C3 -> #N/A | AG202: =IF(RC[-26]&RC[-25]&RC[-24]&RC[-23]&RC[-22]&RC[-21]="",,R1C6)&IF(RC[-26]="",,"|n"&R1C7&RC[-26])&IF(RC[-25]="",,"|n"&R1C8&RC[-25])&IF(RC[-24]="",,"|n"&R1C9&RC[-24])&IF(RC[-23]="",,"|n"&R1C10&RC[-23])&IF(RC[-22]="",,"|n"&R1C11&RC[-22])&IF(RC[-21]="",,"|n"&R1C12&RC[-21])&IF(RC[-19]&RC[-18]&RC[-17]&RC[-16]="",,"|n"&R1C13)&IF(RC[-19]="",,"|n"&R1C14&RC[-19])&IF(RC[-18]="",,"|n"&R1C15&RC[-18])&IF(RC[-17]="",,"|n"&R1C16&RC[-17])&IF(RC[-16]="",,"|n"&R1C17&RC[-16])&IF(RC[-15]="",,"|n"&R1C18&RC[-15])&IF(RC[-14]="",,"|n"&R1C19&RC[-14])&IF(RC[-13]="",,"|n"&R1C20&RC[-13])&IF(RC[-12]="",,"|n"&R1C21&RC[-12])&IF(RC[-11]="",,"|n"&R1C22&RC[-11])&IF(RC[-10]="",,"|n"&R1C23&RC[-10])&IF(RC[-9]="",,"|n"&R1C24&RC[-9])&IF(RC[-8]="",,"|n"&R1C25&RC[-8])&IF(RC[-7]="",,"|n"&R1C26&RC[-7])&IF(RC[-6]="",,"|n"&R1C27&RC[-6])&IF(RC[-5]="",,"|n"&R1C28&RC[-5])&IF(RC[-2]="",,"|n"&RC[-2]) -> 
AF203: =VLOOKUP(RC[-31],Sheet2!R13C1:R18C2,2,0)&"."&VLOOKUP(RC[-30],Sheet2!R7C1:R11C2,2,0)&VLOOKUP(RC[-30],Sheet2!R1C1:R5C2,2,0)&RC[-29]&RC[-28]&RC[-27]&Sheet2!R1C3 -> #N/A | AG203: =IF(RC[-26]&RC[-25]&RC[-24]&RC[-23]&RC[-22]&RC[-21]="",,R1C6)&IF(RC[-26]="",,"|n"&R1C7&RC[-26])&IF(RC[-25]="",,"|n"&R1C8&RC[-25])&IF(RC[-24]="",,"|n"&R1C9&RC[-24])&IF(RC[-23]="",,"|n"&R1C10&RC[-23])&IF(RC[-22]="",,"|n"&R1C11&RC[-22])&IF(RC[-21]="",,"|n"&R1C12&RC[-21])&IF(RC[-19]&RC[-18]&RC[-17]&RC[-16]="",,"|n"&R1C13)&IF(RC[-19]="",,"|n"&R1C14&RC[-19])&IF(RC[-18]="",,"|n"&R1C15&RC[-18])&IF(RC[-17]="",,"|n"&R1C16&RC[-17])&IF(RC[-16]="",,"|n"&R1C17&RC[-16])&IF(RC[-15]="",,"|n"&R1C18&RC[-15])&IF(RC[-14]="",,"|n"&R1C19&RC[-14])&IF(RC[-13]="",,"|n"&R1C20&RC[-13])&IF(RC[-12]="",,"|n"&R1C21&RC[-12])&IF(RC[-11]="",,"|n"&R1C22&RC[-11])&IF(RC[-10]="",,"|n"&R1C23&RC[-10])&IF(RC[-9]="",,"|n"&R1C24&RC[-9])&IF(RC[-8]="",,"|n"&R1C25&RC[-8])&IF(RC[-7]="",,"|n"&R1C26&RC[-7])&IF(RC[-6]="",,"|n"&R1C27&RC[-6])&IF(RC[-5]="",,"|n"&R1C28&RC[-5])&IF(RC[-2]="",,"|n"&RC[-2]) -> 
AF204: =VLOOKUP(RC[-31],Sheet2!R13C1:R18C2,2,0)&"."&VLOOKUP(RC[-30],Sheet2!R7C1:R11C2,2,0)&VLOOKUP(RC[-30],Sheet2!R1C1:R5C2,2,0)&RC[-29]&RC[-28]&RC[-27]&Sheet2!R1C3 -> #N/A | AG204: =IF(RC[-26]&RC[-25]&RC[-24]&RC[-23]&RC[-22]&RC[-21]="",,R1C6)&IF(RC[-26]="",,"|n"&R1C7&RC[-26])&IF(RC[-25]="",,"|n"&R1C8&RC[-25])&IF(RC[-24]="",,"|n"&R1C9&RC[-24])&IF(RC[-23]="",,"|n"&R1C10&RC[-23])&IF(RC[-22]="",,"|n"&R1C11&RC[-22])&IF(RC[-21]="",,"|n"&R1C12&RC[-21])&IF(RC[-19]&RC[-18]&RC[-17]&RC[-16]="",,"|n"&R1C13)&IF(RC[-19]="",,"|n"&R1C14&RC[-19])&IF(RC[-18]="",,"|n"&R1C15&RC[-18])&IF(RC[-17]="",,"|n"&R1C16&RC[-17])&IF(RC[-16]="",,"|n"&R1C17&RC[-16])&IF(RC[-15]="",,"|n"&R1C18&RC[-15])&IF(RC[-14]="",,"|n"&R1C19&RC[-14])&IF(RC[-13]="",,"|n"&R1C20&RC[-13])&IF(RC[-12]="",,"|n"&R1C21&RC[-12])&IF(RC[-11]="",,"|n"&R1C22&RC[-11])&IF(RC[-10]="",,"|n"&R1C23&RC[-10])&IF(RC[-9]="",,"|n"&R1C24&RC[-9])&IF(RC[-8]="",,"|n"&R1C25&RC[-8])&IF(RC[-7]="",,"|n"&R1C26&RC[-7])&IF(RC[-6]="",,"|n"&R1C27&RC[-6])&IF(RC[-5]="",,"|n"&R1C28&RC[-5])&IF(RC[-2]="",,"|n"&RC[-2]) -> 
AF205: =VLOOKUP(RC[-31],Sheet2!R13C1:R18C2,2,0)&"."&VLOOKUP(RC[-30],Sheet2!R7C1:R11C2,2,0)&VLOOKUP(RC[-30],Sheet2!R1C1:R5C2,2,0)&RC[-29]&RC[-28]&RC[-27]&Sheet2!R1C3 -> #N/A | AG205: =IF(RC[-26]&RC[-25]&RC[-24]&RC[-23]&RC[-22]&RC[-21]="",,R1C6)&IF(RC[-26]="",,"|n"&R1C7&RC[-26])&IF(RC[-25]="",,"|n"&R1C8&RC[-25])&IF(RC[-24]="",,"|n"&R1C9&RC[-24])&IF(RC[-23]="",,"|n"&R1C10&RC[-23])&IF(RC[-22]="",,"|n"&R1C11&RC[-22])&IF(RC[-21]="",,"|n"&R1C12&RC[-21])&IF(RC[-19]&RC[-18]&RC[-17]&RC[-16]="",,"|n"&R1C13)&IF(RC[-19]="",,"|n"&R1C14&RC[-19])&IF(RC[-18]="",,"|n"&R1C15&RC[-18])&IF(RC[-17]="",,"|n"&R1C16&RC[-17])&IF(RC[-16]="",,"|n"&R1C17&RC[-16])&IF(RC[-15]="",,"|n"&R1C18&RC[-15])&IF(RC[-14]="",,"|n"&R1C19&RC[-14])&IF(RC[-13]="",,"|n"&R1C20&RC[-13])&IF(RC[-12]="",,"|n"&R1C21&RC[-12])&IF(RC[-11]="",,"|n"&R1C22&RC[-11])&IF(RC[-10]="",,"|n"&R1C23&RC[-10])&IF(RC[-9]="",,"|n"&R1C24&RC[-9])&IF(RC[-8]="",,"|n"&R1C25&RC[-8])&IF(RC[-7]="",,"|n"&R1C26&RC[-7])&IF(RC[-6]="",,"|n"&R1C27&RC[-6])&IF(RC[-5]="",,"|n"&R1C28&RC[-5])&IF(RC[-2]="",,"|n"&RC[-2]) -> 
AF206: =VLOOKUP(RC[-31],Sheet2!R13C1:R18C2,2,0)&"."&VLOOKUP(RC[-30],Sheet2!R7C1:R11C2,2,0)&VLOOKUP(RC[-30],Sheet2!R1C1:R5C2,2,0)&RC[-29]&RC[-28]&RC[-27]&Sheet2!R1C3 -> #N/A | AG206: =IF(RC[-26]&RC[-25]&RC[-24]&RC[-23]&RC[-22]&RC[-21]="",,R1C6)&IF(RC[-26]="",,"|n"&R1C7&RC[-26])&IF(RC[-25]="",,"|n"&R1C8&RC[-25])&IF(RC[-24]="",,"|n"&R1C9&RC[-24])&IF(RC[-23]="",,"|n"&R1C10&RC[-23])&IF(RC[-22]="",,"|n"&R1C11&RC[-22])&IF(RC[-21]="",,"|n"&R1C12&RC[-21])&IF(RC[-19]&RC[-18]&RC[-17]&RC[-16]="",,"|n"&R1C13)&IF(RC[-19]="",,"|n"&R1C14&RC[-19])&IF(RC[-18]="",,"|n"&R1C15&RC[-18])&IF(RC[-17]="",,"|n"&R1C16&RC[-17])&IF(RC[-16]="",,"|n"&R1C17&RC[-16])&IF(RC[-15]="",,"|n"&R1C18&RC[-15])&IF(RC[-14]="",,"|n"&R1C19&RC[-14])&IF(RC[-13]="",,"|n"&R1C20&RC[-13])&IF(RC[-12]="",,"|n"&R1C21&RC[-12])&IF(RC[-11]="",,"|n"&R1C22&RC[-11])&IF(RC[-10]="",,"|n"&R1C23&RC[-10])&IF(RC[-9]="",,"|n"&R1C24&RC[-9])&IF(RC[-8]="",,"|n"&R1C25&RC[-8])&IF(RC[-7]="",,"|n"&R1C26&RC[-7])&IF(RC[-6]="",,"|n"&R1C27&RC[-6])&IF(RC[-5]="",,"|n"&R1C28&RC[-5])&IF(RC[-2]="",,"|n"&RC[-2]) -> 
AF207: =VLOOKUP(RC[-31],Sheet2!R13C1:R18C2,2,0)&"."&VLOOKUP(RC[-30],Sheet2!R7C1:R11C2,2,0)&VLOOKUP(RC[-30],Sheet2!R1C1:R5C2,2,0)&RC[-29]&RC[-28]&RC[-27]&Sheet2!R1C3 -> #N/A | AG207: =IF(RC[-26]&RC[-25]&RC[-24]&RC[-23]&RC[-22]&RC[-21]="",,R1C6)&IF(RC[-26]="",,"|n"&R1C7&RC[-26])&IF(RC[-25]="",,"|n"&R1C8&RC[-25])&IF(RC[-24]="",,"|n"&R1C9&RC[-24])&IF(RC[-23]="",,"|n"&R1C10&RC[-23])&IF(RC[-22]="",,"|n"&R1C11&RC[-22])&IF(RC[-21]="",,"|n"&R1C12&RC[-21])&IF(RC[-19]&RC[-18]&RC[-17]&RC[-16]="",,"|n"&R1C13)&IF(RC[-19]="",,"|n"&R1C14&RC[-19])&IF(RC[-18]="",,"|n"&R1C15&RC[-18])&IF(RC[-17]="",,"|n"&R1C16&RC[-17])&IF(RC[-16]="",,"|n"&R1C17&RC[-16])&IF(RC[-15]="",,"|n"&R1C18&RC[-15])&IF(RC[-14]="",,"|n"&R1C19&RC[-14])&IF(RC[-13]="",,"|n"&R1C20&RC[-13])&IF(RC[-12]="",,"|n"&R1C21&RC[-12])&IF(RC[-11]="",,"|n"&R1C22&RC[-11])&IF(RC[-10]="",,"|n"&R1C23&RC[-10])&IF(RC[-9]="",,"|n"&R1C24&RC[-9])&IF(RC[-8]="",,"|n"&R1C25&RC[-8])&IF(RC[-7]="",,"|n"&R1C26&RC[-7])&IF(RC[-6]="",,"|n"&R1C27&RC[-6])&IF(RC[-5]="",,"|n"&R1C28&RC[-5])&IF(RC[-2]="",,"|n"&RC[-2]) -> 
AF208: =VLOOKUP(RC[-31],Sheet2!R13C1:R18C2,2,0)&"."&VLOOKUP(RC[-30],Sheet2!R7C1:R11C2,2,0)&VLOOKUP(RC[-30],Sheet2!R1C1:R5C2,2,0)&RC[-29]&RC[-28]&RC[-27]&Sheet2!R1C3 -> #N/A | AG208: =IF(RC[-26]&RC[-25]&RC[-24]&RC[-23]&RC[-22]&RC[-21]="",,R1C6)&IF(RC[-26]="",,"|n"&R1C7&RC[-26])&IF(RC[-25]="",,"|n"&R1C8&RC[-25])&IF(RC[-24]="",,"|n"&R1C9&RC[-24])&IF(RC[-23]="",,"|n"&R1C10&RC[-23])&IF(RC[-22]="",,"|n"&R1C11&RC[-22])&IF(RC[-21]="",,"|n"&R1C12&RC[-21])&IF(RC[-19]&RC[-18]&RC[-17]&RC[-16]="",,"|n"&R1C13)&IF(RC[-19]="",,"|n"&R1C14&RC[-19])&IF(RC[-18]="",,"|n"&R1C15&RC[-18])&IF(RC[-17]="",,"|n"&R1C16&RC[-17])&IF(RC[-16]="",,"|n"&R1C17&RC[-16])&IF(RC[-15]="",,"|n"&R1C18&RC[-15])&IF(RC[-14]="",,"|n"&R1C19&RC[-14])&IF(RC[-13]="",,"|n"&R1C20&RC[-13])&IF(RC[-12]="",,"|n"&R1C21&RC[-12])&IF(RC[-11]="",,"|n"&R1C22&RC[-11])&IF(RC[-10]="",,"|n"&R1C23&RC[-10])&IF(RC[-9]="",,"|n"&R1C24&RC[-9])&IF(RC[-8]="",,"|n"&R1C25&RC[-8])&IF(RC[-7]="",,"|n"&R1C26&RC[-7])&IF(RC[-6]="",,"|n"&R1C27&RC[-6])&IF(RC[-5]="",,"|n"&R1C28&RC[-5])&IF(RC[-2]="",,"|n"&RC[-2]) -> 
AF209: =VLOOKUP(RC[-31],Sheet2!R13C1:R18C2,2,0)&"."&VLOOKUP(RC[-30],Sheet2!R7C1:R11C2,2,0)&VLOOKUP(RC[-30],Sheet2!R1C1:R5C2,2,0)&RC[-29]&RC[-28]&RC[-27]&Sheet2!R1C3 -> #N/A | AG209: =IF(RC[-26]&RC[-25]&RC[-24]&RC[-23]&RC[-22]&RC[-21]="",,R1C6)&IF(RC[-26]="",,"|n"&R1C7&RC[-26])&IF(RC[-25]="",,"|n"&R1C8&RC[-25])&IF(RC[-24]="",,"|n"&R1C9&RC[-24])&IF(RC[-23]="",,"|n"&R1C10&RC[-23])&IF(RC[-22]="",,"|n"&R1C11&RC[-22])&IF(RC[-21]="",,"|n"&R1C12&RC[-21])&IF(RC[-19]&RC[-18]&RC[-17]&RC[-16]="",,"|n"&R1C13)&IF(RC[-19]="",,"|n"&R1C14&RC[-19])&IF(RC[-18]="",,"|n"&R1C15&RC[-18])&IF(RC[-17]="",,"|n"&R1C16&RC[-17])&IF(RC[-16]="",,"|n"&R1C17&RC[-16])&IF(RC[-15]="",,"|n"&R1C18&RC[-15])&IF(RC[-14]="",,"|n"&R1C19&RC[-14])&IF(RC[-13]="",,"|n"&R1C20&RC[-13])&IF(RC[-12]="",,"|n"&R1C21&RC[-12])&IF(RC[-11]="",,"|n"&R1C22&RC[-11])&IF(RC[-10]="",,"|n"&R1C23&RC[-10])&IF(RC[-9]="",,"|n"&R1C24&RC[-9])&IF(RC[-8]="",,"|n"&R1C25&RC[-8])&IF(RC[-7]="",,"|n"&R1C26&RC[-7])&IF(RC[-6]="",,"|n"&R1C27&RC[-6])&IF(RC[-5]="",,"|n"&R1C28&RC[-5])&IF(RC[-2]="",,"|n"&RC[-2]) -> 
AF210: =VLOOKUP(RC[-31],Sheet2!R13C1:R18C2,2,0)&"."&VLOOKUP(RC[-30],Sheet2!R7C1:R11C2,2,0)&VLOOKUP(RC[-30],Sheet2!R1C1:R5C2,2,0)&RC[-29]&RC[-28]&RC[-27]&Sheet2!R1C3 -> #N/A | AG210: =IF(RC[-26]&RC[-25]&RC[-24]&RC[-23]&RC[-22]&RC[-21]="",,R1C6)&IF(RC[-26]="",,"|n"&R1C7&RC[-26])&IF(RC[-25]="",,"|n"&R1C8&RC[-25])&IF(RC[-24]="",,"|n"&R1C9&RC[-24])&IF(RC[-23]="",,"|n"&R1C10&RC[-23])&IF(RC[-22]="",,"|n"&R1C11&RC[-22])&IF(RC[-21]="",,"|n"&R1C12&RC[-21])&IF(RC[-19]&RC[-18]&RC[-17]&RC[-16]="",,"|n"&R1C13)&IF(RC[-19]="",,"|n"&R1C14&RC[-19])&IF(RC[-18]="",,"|n"&R1C15&RC[-18])&IF(RC[-17]="",,"|n"&R1C16&RC[-17])&IF(RC[-16]="",,"|n"&R1C17&RC[-16])&IF(RC[-15]="",,"|n"&R1C18&RC[-15])&IF(RC[-14]="",,"|n"&R1C19&RC[-14])&IF(RC[-13]="",,"|n"&R1C20&RC[-13])&IF(RC[-12]="",,"|n"&R1C21&RC[-12])&IF(RC[-11]="",,"|n"&R1C22&RC[-11])&IF(RC[-10]="",,"|n"&R1C23&RC[-10])&IF(RC[-9]="",,"|n"&R1C24&RC[-9])&IF(RC[-8]="",,"|n"&R1C25&RC[-8])&IF(RC[-7]="",,"|n"&R1C26&RC[-7])&IF(RC[-6]="",,"|n"&R1C27&RC[-6])&IF(RC[-5]="",,"|n"&R1C28&RC[-5])&IF(RC[-2]="",,"|n"&RC[-2]) -> 
AF211: =VLOOKUP(RC[-31],Sheet2!R13C1:R18C2,2,0)&"."&VLOOKUP(RC[-30],Sheet2!R7C1:R11C2,2,0)&VLOOKUP(RC[-30],Sheet2!R1C1:R5C2,2,0)&RC[-29]&RC[-28]&RC[-27]&Sheet2!R1C3 -> #N/A | AG211: =IF(RC[-26]&RC[-25]&RC[-24]&RC[-23]&RC[-22]&RC[-21]="",,R1C6)&IF(RC[-26]="",,"|n"&R1C7&RC[-26])&IF(RC[-25]="",,"|n"&R1C8&RC[-25])&IF(RC[-24]="",,"|n"&R1C9&RC[-24])&IF(RC[-23]="",,"|n"&R1C10&RC[-23])&IF(RC[-22]="",,"|n"&R1C11&RC[-22])&IF(RC[-21]="",,"|n"&R1C12&RC[-21])&IF(RC[-19]&RC[-18]&RC[-17]&RC[-16]="",,"|n"&R1C13)&IF(RC[-19]="",,"|n"&R1C14&RC[-19])&IF(RC[-18]="",,"|n"&R1C15&RC[-18])&IF(RC[-17]="",,"|n"&R1C16&RC[-17])&IF(RC[-16]="",,"|n"&R1C17&RC[-16])&IF(RC[-15]="",,"|n"&R1C18&RC[-15])&IF(RC[-14]="",,"|n"&R1C19&RC[-14])&IF(RC[-13]="",,"|n"&R1C20&RC[-13])&IF(RC[-12]="",,"|n"&R1C21&RC[-12])&IF(RC[-11]="",,"|n"&R1C22&RC[-11])&IF(RC[-10]="",,"|n"&R1C23&RC[-10])&IF(RC[-9]="",,"|n"&R1C24&RC[-9])&IF(RC[-8]="",,"|n"&R1C25&RC[-8])&IF(RC[-7]="",,"|n"&R1C26&RC[-7])&IF(RC[-6]="",,"|n"&R1C27&RC[-6])&IF(RC[-5]="",,"|n"&R1C28&RC[-5])&IF(RC[-2]="",,"|n"&RC[-2]) -> 
AF212: =VLOOKUP(RC[-31],Sheet2!R13C1:R18C2,2,0)&"."&VLOOKUP(RC[-30],Sheet2!R7C1:R11C2,2,0)&VLOOKUP(RC[-30],Sheet2!R1C1:R5C2,2,0)&RC[-29]&RC[-28]&RC[-27]&Sheet2!R1C3 -> #N/A | AG212: =IF(RC[-26]&RC[-25]&RC[-24]&RC[-23]&RC[-22]&RC[-21]="",,R1C6)&IF(RC[-26]="",,"|n"&R1C7&RC[-26])&IF(RC[-25]="",,"|n"&R1C8&RC[-25])&IF(RC[-24]="",,"|n"&R1C9&RC[-24])&IF(RC[-23]="",,"|n"&R1C10&RC[-23])&IF(RC[-22]="",,"|n"&R1C11&RC[-22])&IF(RC[-21]="",,"|n"&R1C12&RC[-21])&IF(RC[-19]&RC[-18]&RC[-17]&RC[-16]="",,"|n"&R1C13)&IF(RC[-19]="",,"|n"&R1C14&RC[-19])&IF(RC[-18]="",,"|n"&R1C15&RC[-18])&IF(RC[-17]="",,"|n"&R1C16&RC[-17])&IF(RC[-16]="",,"|n"&R1C17&RC[-16])&IF(RC[-15]="",,"|n"&R1C18&RC[-15])&IF(RC[-14]="",,"|n"&R1C19&RC[-14])&IF(RC[-13]="",,"|n"&R1C20&RC[-13])&IF(RC[-12]="",,"|n"&R1C21&RC[-12])&IF(RC[-11]="",,"|n"&R1C22&RC[-11])&IF(RC[-10]="",,"|n"&R1C23&RC[-10])&IF(RC[-9]="",,"|n"&R1C24&RC[-9])&IF(RC[-8]="",,"|n"&R1C25&RC[-8])&IF(RC[-7]="",,"|n"&R1C26&RC[-7])&IF(RC[-6]="",,"|n"&R1C27&RC[-6])&IF(RC[-5]="",,"|n"&R1C28&RC[-5])&IF(RC[-2]="",,"|n"&RC[-2]) -> 
AF213: =VLOOKUP(RC[-31],Sheet2!R13C1:R18C2,2,0)&"."&VLOOKUP(RC[-30],Sheet2!R7C1:R11C2,2,0)&VLOOKUP(RC[-30],Sheet2!R1C1:R5C2,2,0)&RC[-29]&RC[-28]&RC[-27]&Sheet2!R1C3 -> #N/A | AG213: =IF(RC[-26]&RC[-25]&RC[-24]&RC[-23]&RC[-22]&RC[-21]="",,R1C6)&IF(RC[-26]="",,"|n"&R1C7&RC[-26])&IF(RC[-25]="",,"|n"&R1C8&RC[-25])&IF(RC[-24]="",,"|n"&R1C9&RC[-24])&IF(RC[-23]="",,"|n"&R1C10&RC[-23])&IF(RC[-22]="",,"|n"&R1C11&RC[-22])&IF(RC[-21]="",,"|n"&R1C12&RC[-21])&IF(RC[-19]&RC[-18]&RC[-17]&RC[-16]="",,"|n"&R1C13)&IF(RC[-19]="",,"|n"&R1C14&RC[-19])&IF(RC[-18]="",,"|n"&R1C15&RC[-18])&IF(RC[-17]="",,"|n"&R1C16&RC[-17])&IF(RC[-16]="",,"|n"&R1C17&RC[-16])&IF(RC[-15]="",,"|n"&R1C18&RC[-15])&IF(RC[-14]="",,"|n"&R1C19&RC[-14])&IF(RC[-13]="",,"|n"&R1C20&RC[-13])&IF(RC[-12]="",,"|n"&R1C21&RC[-12])&IF(RC[-11]="",,"|n"&R1C22&RC[-11])&IF(RC[-10]="",,"|n"&R1C23&RC[-10])&IF(RC[-9]="",,"|n"&R1C24&RC[-9])&IF(RC[-8]="",,"|n"&R1C25&RC[-8])&IF(RC[-7]="",,"|n"&R1C26&RC[-7])&IF(RC[-6]="",,"|n"&R1C27&RC[-6])&IF(RC[-5]="",,"|n"&R1C28&RC[-5])&IF(RC[-2]="",,"|n"&RC[-2]) -> 
AF214: =VLOOKUP(RC[-31],Sheet2!R13C1:R18C2,2,0)&"."&VLOOKUP(RC[-30],Sheet2!R7C1:R11C2,2,0)&VLOOKUP(RC[-30],Sheet2!R1C1:R5C2,2,0)&RC[-29]&RC[-28]&RC[-27]&Sheet2!R1C3 -> #N/A | AG214: =IF(RC[-26]&RC[-25]&RC[-24]&RC[-23]&RC[-22]&RC[-21]="",,R1C6)&IF(RC[-26]="",,"|n"&R1C7&RC[-26])&IF(RC[-25]="",,"|n"&R1C8&RC[-25])&IF(RC[-24]="",,"|n"&R1C9&RC[-24])&IF(RC[-23]="",,"|n"&R1C10&RC[-23])&IF(RC[-22]="",,"|n"&R1C11&RC[-22])&IF(RC[-21]="",,"|n"&R1C12&RC[-21])&IF(RC[-19]&RC[-18]&RC[-17]&RC[-16]="",,"|n"&R1C13)&IF(RC[-19]="",,"|n"&R1C14&RC[-19])&IF(RC[-18]="",,"|n"&R1C15&RC[-18])&IF(RC[-17]="",,"|n"&R1C16&RC[-17])&IF(RC[-16]="",,"|n"&R1C17&RC[-16])&IF(RC[-15]="",,"|n"&R1C18&RC[-15])&IF(RC[-14]="",,"|n"&R1C19&RC[-14])&IF(RC[-13]="",,"|n"&R1C20&RC[-13])&IF(RC[-12]="",,"|n"&R1C21&RC[-12])&IF(RC[-11]="",,"|n"&R1C22&RC[-11])&IF(RC[-10]="",,"|n"&R1C23&RC[-10])&IF(RC[-9]="",,"|n"&R1C24&RC[-9])&IF(RC[-8]="",,"|n"&R1C25&RC[-8])&IF(RC[-7]="",,"|n"&R1C26&RC[-7])&IF(RC[-6]="",,"|n"&R1C27&RC[-6])&IF(RC[-5]="",,"|n"&R1C28&RC[-5])&IF(RC[-2]="",,"|n"&RC[-2]) -> 
AF215: =VLOOKUP(RC[-31],Sheet2!R13C1:R18C2,2,0)&"."&VLOOKUP(RC[-30],Sheet2!R7C1:R11C2,2,0)&VLOOKUP(RC[-30],Sheet2!R1C1:R5C2,2,0)&RC[-29]&RC[-28]&RC[-27]&Sheet2!R1C3 -> #N/A | AG215: =IF(RC[-26]&RC[-25]&RC[-24]&RC[-23]&RC[-22]&RC[-21]="",,R1C6)&IF(RC[-26]="",,"|n"&R1C7&RC[-26])&IF(RC[-25]="",,"|n"&R1C8&RC[-25])&IF(RC[-24]="",,"|n"&R1C9&RC[-24])&IF(RC[-23]="",,"|n"&R1C10&RC[-23])&IF(RC[-22]="",,"|n"&R1C11&RC[-22])&IF(RC[-21]="",,"|n"&R1C12&RC[-21])&IF(RC[-19]&RC[-18]&RC[-17]&RC[-16]="",,"|n"&R1C13)&IF(RC[-19]="",,"|n"&R1C14&RC[-19])&IF(RC[-18]="",,"|n"&R1C15&RC[-18])&IF(RC[-17]="",,"|n"&R1C16&RC[-17])&IF(RC[-16]="",,"|n"&R1C17&RC[-16])&IF(RC[-15]="",,"|n"&R1C18&RC[-15])&IF(RC[-14]="",,"|n"&R1C19&RC[-14])&IF(RC[-13]="",,"|n"&R1C20&RC[-13])&IF(RC[-12]="",,"|n"&R1C21&RC[-12])&IF(RC[-11]="",,"|n"&R1C22&RC[-11])&IF(RC[-10]="",,"|n"&R1C23&RC[-10])&IF(RC[-9]="",,"|n"&R1C24&RC[-9])&IF(RC[-8]="",,"|n"&R1C25&RC[-8])&IF(RC[-7]="",,"|n"&R1C26&RC[-7])&IF(RC[-6]="",,"|n"&R1C27&RC[-6])&IF(RC[-5]="",,"|n"&R1C28&RC[-5])&IF(RC[-2]="",,"|n"&RC[-2]) -> 
AF216: =VLOOKUP(RC[-31],Sheet2!R13C1:R18C2,2,0)&"."&VLOOKUP(RC[-30],Sheet2!R7C1:R11C2,2,0)&VLOOKUP(RC[-30],Sheet2!R1C1:R5C2,2,0)&RC[-29]&RC[-28]&RC[-27]&Sheet2!R1C3 -> #N/A | AG216: =IF(RC[-26]&RC[-25]&RC[-24]&RC[-23]&RC[-22]&RC[-21]="",,R1C6)&IF(RC[-26]="",,"|n"&R1C7&RC[-26])&IF(RC[-25]="",,"|n"&R1C8&RC[-25])&IF(RC[-24]="",,"|n"&R1C9&RC[-24])&IF(RC[-23]="",,"|n"&R1C10&RC[-23])&IF(RC[-22]="",,"|n"&R1C11&RC[-22])&IF(RC[-21]="",,"|n"&R1C12&RC[-21])&IF(RC[-19]&RC[-18]&RC[-17]&RC[-16]="",,"|n"&R1C13)&IF(RC[-19]="",,"|n"&R1C14&RC[-19])&IF(RC[-18]="",,"|n"&R1C15&RC[-18])&IF(RC[-17]="",,"|n"&R1C16&RC[-17])&IF(RC[-16]="",,"|n"&R1C17&RC[-16])&IF(RC[-15]="",,"|n"&R1C18&RC[-15])&IF(RC[-14]="",,"|n"&R1C19&RC[-14])&IF(RC[-13]="",,"|n"&R1C20&RC[-13])&IF(RC[-12]="",,"|n"&R1C21&RC[-12])&IF(RC[-11]="",,"|n"&R1C22&RC[-11])&IF(RC[-10]="",,"|n"&R1C23&RC[-10])&IF(RC[-9]="",,"|n"&R1C24&RC[-9])&IF(RC[-8]="",,"|n"&R1C25&RC[-8])&IF(RC[-7]="",,"|n"&R1C26&RC[-7])&IF(RC[-6]="",,"|n"&R1C27&RC[-6])&IF(RC[-5]="",,"|n"&R1C28&RC[-5])&IF(RC[-2]="",,"|n"&RC[-2]) -> 
AF217: =VLOOKUP(RC[-31],Sheet2!R13C1:R18C2,2,0)&"."&VLOOKUP(RC[-30],Sheet2!R7C1:R11C2,2,0)&VLOOKUP(RC[-30],Sheet2!R1C1:R5C2,2,0)&RC[-29]&RC[-28]&RC[-27]&Sheet2!R1C3 -> #N/A | AG217: =IF(RC[-26]&RC[-25]&RC[-24]&RC[-23]&RC[-22]&RC[-21]="",,R1C6)&IF(RC[-26]="",,"|n"&R1C7&RC[-26])&IF(RC[-25]="",,"|n"&R1C8&RC[-25])&IF(RC[-24]="",,"|n"&R1C9&RC[-24])&IF(RC[-23]="",,"|n"&R1C10&RC[-23])&IF(RC[-22]="",,"|n"&R1C11&RC[-22])&IF(RC[-21]="",,"|n"&R1C12&RC[-21])&IF(RC[-19]&RC[-18]&RC[-17]&RC[-16]="",,"|n"&R1C13)&IF(RC[-19]="",,"|n"&R1C14&RC[-19])&IF(RC[-18]="",,"|n"&R1C15&RC[-18])&IF(RC[-17]="",,"|n"&R1C16&RC[-17])&IF(RC[-16]="",,"|n"&R1C17&RC[-16])&IF(RC[-15]="",,"|n"&R1C18&RC[-15])&IF(RC[-14]="",,"|n"&R1C19&RC[-14])&IF(RC[-13]="",,"|n"&R1C20&RC[-13])&IF(RC[-12]="",,"|n"&R1C21&RC[-12])&IF(RC[-11]="",,"|n"&R1C22&RC[-11])&IF(RC[-10]="",,"|n"&R1C23&RC[-10])&IF(RC[-9]="",,"|n"&R1C24&RC[-9])&IF(RC[-8]="",,"|n"&R1C25&RC[-8])&IF(RC[-7]="",,"|n"&R1C26&RC[-7])&IF(RC[-6]="",,"|n"&R1C27&RC[-6])&IF(RC[-5]="",,"|n"&R1C28&RC[-5])&IF(RC[-2]="",,"|n"&RC[-2]) -> 
AF218: =VLOOKUP(RC[-31],Sheet2!R13C1:R18C2,2,0)&"."&VLOOKUP(RC[-30],Sheet2!R7C1:R11C2,2,0)&VLOOKUP(RC[-30],Sheet2!R1C1:R5C2,2,0)&RC[-29]&RC[-28]&RC[-27]&Sheet2!R1C3 -> #N/A | AG218: =IF(RC[-26]&RC[-25]&RC[-24]&RC[-23]&RC[-22]&RC[-21]="",,R1C6)&IF(RC[-26]="",,"|n"&R1C7&RC[-26])&IF(RC[-25]="",,"|n"&R1C8&RC[-25])&IF(RC[-24]="",,"|n"&R1C9&RC[-24])&IF(RC[-23]="",,"|n"&R1C10&RC[-23])&IF(RC[-22]="",,"|n"&R1C11&RC[-22])&IF(RC[-21]="",,"|n"&R1C12&RC[-21])&IF(RC[-19]&RC[-18]&RC[-17]&RC[-16]="",,"|n"&R1C13)&IF(RC[-19]="",,"|n"&R1C14&RC[-19])&IF(RC[-18]="",,"|n"&R1C15&RC[-18])&IF(RC[-17]="",,"|n"&R1C16&RC[-17])&IF(RC[-16]="",,"|n"&R1C17&RC[-16])&IF(RC[-15]="",,"|n"&R1C18&RC[-15])&IF(RC[-14]="",,"|n"&R1C19&RC[-14])&IF(RC[-13]="",,"|n"&R1C20&RC[-13])&IF(RC[-12]="",,"|n"&R1C21&RC[-12])&IF(RC[-11]="",,"|n"&R1C22&RC[-11])&IF(RC[-10]="",,"|n"&R1C23&RC[-10])&IF(RC[-9]="",,"|n"&R1C24&RC[-9])&IF(RC[-8]="",,"|n"&R1C25&RC[-8])&IF(RC[-7]="",,"|n"&R1C26&RC[-7])&IF(RC[-6]="",,"|n"&R1C27&RC[-6])&IF(RC[-5]="",,"|n"&R1C28&RC[-5])&IF(RC[-2]="",,"|n"&RC[-2]) -> 
AF219: =VLOOKUP(RC[-31],Sheet2!R13C1:R18C2,2,0)&"."&VLOOKUP(RC[-30],Sheet2!R7C1:R11C2,2,0)&VLOOKUP(RC[-30],Sheet2!R1C1:R5C2,2,0)&RC[-29]&RC[-28]&RC[-27]&Sheet2!R1C3 -> #N/A | AG219: =IF(RC[-26]&RC[-25]&RC[-24]&RC[-23]&RC[-22]&RC[-21]="",,R1C6)&IF(RC[-26]="",,"|n"&R1C7&RC[-26])&IF(RC[-25]="",,"|n"&R1C8&RC[-25])&IF(RC[-24]="",,"|n"&R1C9&RC[-24])&IF(RC[-23]="",,"|n"&R1C10&RC[-23])&IF(RC[-22]="",,"|n"&R1C11&RC[-22])&IF(RC[-21]="",,"|n"&R1C12&RC[-21])&IF(RC[-19]&RC[-18]&RC[-17]&RC[-16]="",,"|n"&R1C13)&IF(RC[-19]="",,"|n"&R1C14&RC[-19])&IF(RC[-18]="",,"|n"&R1C15&RC[-18])&IF(RC[-17]="",,"|n"&R1C16&RC[-17])&IF(RC[-16]="",,"|n"&R1C17&RC[-16])&IF(RC[-15]="",,"|n"&R1C18&RC[-15])&IF(RC[-14]="",,"|n"&R1C19&RC[-14])&IF(RC[-13]="",,"|n"&R1C20&RC[-13])&IF(RC[-12]="",,"|n"&R1C21&RC[-12])&IF(RC[-11]="",,"|n"&R1C22&RC[-11])&IF(RC[-10]="",,"|n"&R1C23&RC[-10])&IF(RC[-9]="",,"|n"&R1C24&RC[-9])&IF(RC[-8]="",,"|n"&R1C25&RC[-8])&IF(RC[-7]="",,"|n"&R1C26&RC[-7])&IF(RC[-6]="",,"|n"&R1C27&RC[-6])&IF(RC[-5]="",,"|n"&R1C28&RC[-5])&IF(RC[-2]="",,"|n"&RC[-2]) -> 
AF220: =VLOOKUP(RC[-31],Sheet2!R13C1:R18C2,2,0)&"."&VLOOKUP(RC[-30],Sheet2!R7C1:R11C2,2,0)&VLOOKUP(RC[-30],Sheet2!R1C1:R5C2,2,0)&RC[-29]&RC[-28]&RC[-27]&Sheet2!R1C3 -> #N/A | AG220: =IF(RC[-26]&RC[-25]&RC[-24]&RC[-23]&RC[-22]&RC[-21]="",,R1C6)&IF(RC[-26]="",,"|n"&R1C7&RC[-26])&IF(RC[-25]="",,"|n"&R1C8&RC[-25])&IF(RC[-24]="",,"|n"&R1C9&RC[-24])&IF(RC[-23]="",,"|n"&R1C10&RC[-23])&IF(RC[-22]="",,"|n"&R1C11&RC[-22])&IF(RC[-21]="",,"|n"&R1C12&RC[-21])&IF(RC[-19]&RC[-18]&RC[-17]&RC[-16]="",,"|n"&R1C13)&IF(RC[-19]="",,"|n"&R1C14&RC[-19])&IF(RC[-18]="",,"|n"&R1C15&RC[-18])&IF(RC[-17]="",,"|n"&R1C16&RC[-17])&IF(RC[-16]="",,"|n"&R1C17&RC[-16])&IF(RC[-15]="",,"|n"&R1C18&RC[-15])&IF(RC[-14]="",,"|n"&R1C19&RC[-14])&IF(RC[-13]="",,"|n"&R1C20&RC[-13])&IF(RC[-12]="",,"|n"&R1C21&RC[-12])&IF(RC[-11]="",,"|n"&R1C22&RC[-11])&IF(RC[-10]="",,"|n"&R1C23&RC[-10])&IF(RC[-9]="",,"|n"&R1C24&RC[-9])&IF(RC[-8]="",,"|n"&R1C25&RC[-8])&IF(RC[-7]="",,"|n"&R1C26&RC[-7])&IF(RC[-6]="",,"|n"&R1C27&RC[-6])&IF(RC[-5]="",,"|n"&R1C28&RC[-5])&IF(RC[-2]="",,"|n"&RC[-2]) -> 
AF221: =VLOOKUP(RC[-31],Sheet2!R13C1:R18C2,2,0)&"."&VLOOKUP(RC[-30],Sheet2!R7C1:R11C2,2,0)&VLOOKUP(RC[-30],Sheet2!R1C1:R5C2,2,0)&RC[-29]&RC[-28]&RC[-27]&Sheet2!R1C3 -> #N/A | AG221: =IF(RC[-26]&RC[-25]&RC[-24]&RC[-23]&RC[-22]&RC[-21]="",,R1C6)&IF(RC[-26]="",,"|n"&R1C7&RC[-26])&IF(RC[-25]="",,"|n"&R1C8&RC[-25])&IF(RC[-24]="",,"|n"&R1C9&RC[-24])&IF(RC[-23]="",,"|n"&R1C10&RC[-23])&IF(RC[-22]="",,"|n"&R1C11&RC[-22])&IF(RC[-21]="",,"|n"&R1C12&RC[-21])&IF(RC[-19]&RC[-18]&RC[-17]&RC[-16]="",,"|n"&R1C13)&IF(RC[-19]="",,"|n"&R1C14&RC[-19])&IF(RC[-18]="",,"|n"&R1C15&RC[-18])&IF(RC[-17]="",,"|n"&R1C16&RC[-17])&IF(RC[-16]="",,"|n"&R1C17&RC[-16])&IF(RC[-15]="",,"|n"&R1C18&RC[-15])&IF(RC[-14]="",,"|n"&R1C19&RC[-14])&IF(RC[-13]="",,"|n"&R1C20&RC[-13])&IF(RC[-12]="",,"|n"&R1C21&RC[-12])&IF(RC[-11]="",,"|n"&R1C22&RC[-11])&IF(RC[-10]="",,"|n"&R1C23&RC[-10])&IF(RC[-9]="",,"|n"&R1C24&RC[-9])&IF(RC[-8]="",,"|n"&R1C25&RC[-8])&IF(RC[-7]="",,"|n"&R1C26&RC[-7])&IF(RC[-6]="",,"|n"&R1C27&RC[-6])&IF(RC[-5]="",,"|n"&R1C28&RC[-5])&IF(RC[-2]="",,"|n"&RC[-2]) -> 
AF222: =VLOOKUP(RC[-31],Sheet2!R13C1:R18C2,2,0)&"."&VLOOKUP(RC[-30],Sheet2!R7C1:R11C2,2,0)&VLOOKUP(RC[-30],Sheet2!R1C1:R5C2,2,0)&RC[-29]&RC[-28]&RC[-27]&Sheet2!R1C3 -> #N/A | AG222: =IF(RC[-26]&RC[-25]&RC[-24]&RC[-23]&RC[-22]&RC[-21]="",,R1C6)&IF(RC[-26]="",,"|n"&R1C7&RC[-26])&IF(RC[-25]="",,"|n"&R1C8&RC[-25])&IF(RC[-24]="",,"|n"&R1C9&RC[-24])&IF(RC[-23]="",,"|n"&R1C10&RC[-23])&IF(RC[-22]="",,"|n"&R1C11&RC[-22])&IF(RC[-21]="",,"|n"&R1C12&RC[-21])&IF(RC[-19]&RC[-18]&RC[-17]&RC[-16]="",,"|n"&R1C13)&IF(RC[-19]="",,"|n"&R1C14&RC[-19])&IF(RC[-18]="",,"|n"&R1C15&RC[-18])&IF(RC[-17]="",,"|n"&R1C16&RC[-17])&IF(RC[-16]="",,"|n"&R1C17&RC[-16])&IF(RC[-15]="",,"|n"&R1C18&RC[-15])&IF(RC[-14]="",,"|n"&R1C19&RC[-14])&IF(RC[-13]="",,"|n"&R1C20&RC[-13])&IF(RC[-12]="",,"|n"&R1C21&RC[-12])&IF(RC[-11]="",,"|n"&R1C22&RC[-11])&IF(RC[-10]="",,"|n"&R1C23&RC[-10])&IF(RC[-9]="",,"|n"&R1C24&RC[-9])&IF(RC[-8]="",,"|n"&R1C25&RC[-8])&IF(RC[-7]="",,"|n"&R1C26&RC[-7])&IF(RC[-6]="",,"|n"&R1C27&RC[-6])&IF(RC[-5]="",,"|n"&R1C28&RC[-5])&IF(RC[-2]="",,"|n"&RC[-2]) -> 
AF223: =VLOOKUP(RC[-31],Sheet2!R13C1:R18C2,2,0)&"."&VLOOKUP(RC[-30],Sheet2!R7C1:R11C2,2,0)&VLOOKUP(RC[-30],Sheet2!R1C1:R5C2,2,0)&RC[-29]&RC[-28]&RC[-27]&Sheet2!R1C3 -> #N/A | AG223: =IF(RC[-26]&RC[-25]&RC[-24]&RC[-23]&RC[-22]&RC[-21]="",,R1C6)&IF(RC[-26]="",,"|n"&R1C7&RC[-26])&IF(RC[-25]="",,"|n"&R1C8&RC[-25])&IF(RC[-24]="",,"|n"&R1C9&RC[-24])&IF(RC[-23]="",,"|n"&R1C10&RC[-23])&IF(RC[-22]="",,"|n"&R1C11&RC[-22])&IF(RC[-21]="",,"|n"&R1C12&RC[-21])&IF(RC[-19]&RC[-18]&RC[-17]&RC[-16]="",,"|n"&R1C13)&IF(RC[-19]="",,"|n"&R1C14&RC[-19])&IF(RC[-18]="",,"|n"&R1C15&RC[-18])&IF(RC[-17]="",,"|n"&R1C16&RC[-17])&IF(RC[-16]="",,"|n"&R1C17&RC[-16])&IF(RC[-15]="",,"|n"&R1C18&RC[-15])&IF(RC[-14]="",,"|n"&R1C19&RC[-14])&IF(RC[-13]="",,"|n"&R1C20&RC[-13])&IF(RC[-12]="",,"|n"&R1C21&RC[-12])&IF(RC[-11]="",,"|n"&R1C22&RC[-11])&IF(RC[-10]="",,"|n"&R1C23&RC[-10])&IF(RC[-9]="",,"|n"&R1C24&RC[-9])&IF(RC[-8]="",,"|n"&R1C25&RC[-8])&IF(RC[-7]="",,"|n"&R1C26&RC[-7])&IF(RC[-6]="",,"|n"&R1C27&RC[-6])&IF(RC[-5]="",,"|n"&R1C28&RC[-5])&IF(RC[-2]="",,"|n"&RC[-2]) -> 
AF224: =VLOOKUP(RC[-31],Sheet2!R13C1:R18C2,2,0)&"."&VLOOKUP(RC[-30],Sheet2!R7C1:R11C2,2,0)&VLOOKUP(RC[-30],Sheet2!R1C1:R5C2,2,0)&RC[-29]&RC[-28]&RC[-27]&Sheet2!R1C3 -> #N/A | AG224: =IF(RC[-26]&RC[-25]&RC[-24]&RC[-23]&RC[-22]&RC[-21]="",,R1C6)&IF(RC[-26]="",,"|n"&R1C7&RC[-26])&IF(RC[-25]="",,"|n"&R1C8&RC[-25])&IF(RC[-24]="",,"|n"&R1C9&RC[-24])&IF(RC[-23]="",,"|n"&R1C10&RC[-23])&IF(RC[-22]="",,"|n"&R1C11&RC[-22])&IF(RC[-21]="",,"|n"&R1C12&RC[-21])&IF(RC[-19]&RC[-18]&RC[-17]&RC[-16]="",,"|n"&R1C13)&IF(RC[-19]="",,"|n"&R1C14&RC[-19])&IF(RC[-18]="",,"|n"&R1C15&RC[-18])&IF(RC[-17]="",,"|n"&R1C16&RC[-17])&IF(RC[-16]="",,"|n"&R1C17&RC[-16])&IF(RC[-15]="",,"|n"&R1C18&RC[-15])&IF(RC[-14]="",,"|n"&R1C19&RC[-14])&IF(RC[-13]="",,"|n"&R1C20&RC[-13])&IF(RC[-12]="",,"|n"&R1C21&RC[-12])&IF(RC[-11]="",,"|n"&R1C22&RC[-11])&IF(RC[-10]="",,"|n"&R1C23&RC[-10])&IF(RC[-9]="",,"|n"&R1C24&RC[-9])&IF(RC[-8]="",,"|n"&R1C25&RC[-8])&IF(RC[-7]="",,"|n"&R1C26&RC[-7])&IF(RC[-6]="",,"|n"&R1C27&RC[-6])&IF(RC[-5]="",,"|n"&R1C28&RC[-5])&IF(RC[-2]="",,"|n"&RC[-2]) -> 
AF225: =VLOOKUP(RC[-31],Sheet2!R13C1:R18C2,2,0)&"."&VLOOKUP(RC[-30],Sheet2!R7C1:R11C2,2,0)&VLOOKUP(RC[-30],Sheet2!R1C1:R5C2,2,0)&RC[-29]&RC[-28]&RC[-27]&Sheet2!R1C3 -> #N/A | AG225: =IF(RC[-26]&RC[-25]&RC[-24]&RC[-23]&RC[-22]&RC[-21]="",,R1C6)&IF(RC[-26]="",,"|n"&R1C7&RC[-26])&IF(RC[-25]="",,"|n"&R1C8&RC[-25])&IF(RC[-24]="",,"|n"&R1C9&RC[-24])&IF(RC[-23]="",,"|n"&R1C10&RC[-23])&IF(RC[-22]="",,"|n"&R1C11&RC[-22])&IF(RC[-21]="",,"|n"&R1C12&RC[-21])&IF(RC[-19]&RC[-18]&RC[-17]&RC[-16]="",,"|n"&R1C13)&IF(RC[-19]="",,"|n"&R1C14&RC[-19])&IF(RC[-18]="",,"|n"&R1C15&RC[-18])&IF(RC[-17]="",,"|n"&R1C16&RC[-17])&IF(RC[-16]="",,"|n"&R1C17&RC[-16])&IF(RC[-15]="",,"|n"&R1C18&RC[-15])&IF(RC[-14]="",,"|n"&R1C19&RC[-14])&IF(RC[-13]="",,"|n"&R1C20&RC[-13])&IF(RC[-12]="",,"|n"&R1C21&RC[-12])&IF(RC[-11]="",,"|n"&R1C22&RC[-11])&IF(RC[-10]="",,"|n"&R1C23&RC[-10])&IF(RC[-9]="",,"|n"&R1C24&RC[-9])&IF(RC[-8]="",,"|n"&R1C25&RC[-8])&IF(RC[-7]="",,"|n"&R1C26&RC[-7])&IF(RC[-6]="",,"|n"&R1C27&RC[-6])&IF(RC[-5]="",,"|n"&R1C28&RC[-5])&IF(RC[-2]="",,"|n"&RC[-2]) -> 
AF226: =VLOOKUP(RC[-31],Sheet2!R13C1:R18C2,2,0)&"."&VLOOKUP(RC[-30],Sheet2!R7C1:R11C2,2,0)&VLOOKUP(RC[-30],Sheet2!R1C1:R5C2,2,0)&RC[-29]&RC[-28]&RC[-27]&Sheet2!R1C3 -> #N/A | AG226: =IF(RC[-26]&RC[-25]&RC[-24]&RC[-23]&RC[-22]&RC[-21]="",,R1C6)&IF(RC[-26]="",,"|n"&R1C7&RC[-26])&IF(RC[-25]="",,"|n"&R1C8&RC[-25])&IF(RC[-24]="",,"|n"&R1C9&RC[-24])&IF(RC[-23]="",,"|n"&R1C10&RC[-23])&IF(RC[-22]="",,"|n"&R1C11&RC[-22])&IF(RC[-21]="",,"|n"&R1C12&RC[-21])&IF(RC[-19]&RC[-18]&RC[-17]&RC[-16]="",,"|n"&R1C13)&IF(RC[-19]="",,"|n"&R1C14&RC[-19])&IF(RC[-18]="",,"|n"&R1C15&RC[-18])&IF(RC[-17]="",,"|n"&R1C16&RC[-17])&IF(RC[-16]="",,"|n"&R1C17&RC[-16])&IF(RC[-15]="",,"|n"&R1C18&RC[-15])&IF(RC[-14]="",,"|n"&R1C19&RC[-14])&IF(RC[-13]="",,"|n"&R1C20&RC[-13])&IF(RC[-12]="",,"|n"&R1C21&RC[-12])&IF(RC[-11]="",,"|n"&R1C22&RC[-11])&IF(RC[-10]="",,"|n"&R1C23&RC[-10])&IF(RC[-9]="",,"|n"&R1C24&RC[-9])&IF(RC[-8]="",,"|n"&R1C25&RC[-8])&IF(RC[-7]="",,"|n"&R1C26&RC[-7])&IF(RC[-6]="",,"|n"&R1C27&RC[-6])&IF(RC[-5]="",,"|n"&R1C28&RC[-5])&IF(RC[-2]="",,"|n"&RC[-2]) -> 
AF227: =VLOOKUP(RC[-31],Sheet2!R13C1:R18C2,2,0)&"."&VLOOKUP(RC[-30],Sheet2!R7C1:R11C2,2,0)&VLOOKUP(RC[-30],Sheet2!R1C1:R5C2,2,0)&RC[-29]&RC[-28]&RC[-27]&Sheet2!R1C3 -> #N/A | AG227: =IF(RC[-26]&RC[-25]&RC[-24]&RC[-23]&RC[-22]&RC[-21]="",,R1C6)&IF(RC[-26]="",,"|n"&R1C7&RC[-26])&IF(RC[-25]="",,"|n"&R1C8&RC[-25])&IF(RC[-24]="",,"|n"&R1C9&RC[-24])&IF(RC[-23]="",,"|n"&R1C10&RC[-23])&IF(RC[-22]="",,"|n"&R1C11&RC[-22])&IF(RC[-21]="",,"|n"&R1C12&RC[-21])&IF(RC[-19]&RC[-18]&RC[-17]&RC[-16]="",,"|n"&R1C13)&IF(RC[-19]="",,"|n"&R1C14&RC[-19])&IF(RC[-18]="",,"|n"&R1C15&RC[-18])&IF(RC[-17]="",,"|n"&R1C16&RC[-17])&IF(RC[-16]="",,"|n"&R1C17&RC[-16])&IF(RC[-15]="",,"|n"&R1C18&RC[-15])&IF(RC[-14]="",,"|n"&R1C19&RC[-14])&IF(RC[-13]="",,"|n"&R1C20&RC[-13])&IF(RC[-12]="",,"|n"&R1C21&RC[-12])&IF(RC[-11]="",,"|n"&R1C22&RC[-11])&IF(RC[-10]="",,"|n"&R1C23&RC[-10])&IF(RC[-9]="",,"|n"&R1C24&RC[-9])&IF(RC[-8]="",,"|n"&R1C25&RC[-8])&IF(RC[-7]="",,"|n"&R1C26&RC[-7])&IF(RC[-6]="",,"|n"&R1C27&RC[-6])&IF(RC[-5]="",,"|n"&R1C28&RC[-5])&IF(RC[-2]="",,"|n"&RC[-2]) -> 
AF228: =VLOOKUP(RC[-31],Sheet2!R13C1:R18C2,2,0)&"."&VLOOKUP(RC[-30],Sheet2!R7C1:R11C2,2,0)&VLOOKUP(RC[-30],Sheet2!R1C1:R5C2,2,0)&RC[-29]&RC[-28]&RC[-27]&Sheet2!R1C3 -> #N/A | AG228: =IF(RC[-26]&RC[-25]&RC[-24]&RC[-23]&RC[-22]&RC[-21]="",,R1C6)&IF(RC[-26]="",,"|n"&R1C7&RC[-26])&IF(RC[-25]="",,"|n"&R1C8&RC[-25])&IF(RC[-24]="",,"|n"&R1C9&RC[-24])&IF(RC[-23]="",,"|n"&R1C10&RC[-23])&IF(RC[-22]="",,"|n"&R1C11&RC[-22])&IF(RC[-21]="",,"|n"&R1C12&RC[-21])&IF(RC[-19]&RC[-18]&RC[-17]&RC[-16]="",,"|n"&R1C13)&IF(RC[-19]="",,"|n"&R1C14&RC[-19])&IF(RC[-18]="",,"|n"&R1C15&RC[-18])&IF(RC[-17]="",,"|n"&R1C16&RC[-17])&IF(RC[-16]="",,"|n"&R1C17&RC[-16])&IF(RC[-15]="",,"|n"&R1C18&RC[-15])&IF(RC[-14]="",,"|n"&R1C19&RC[-14])&IF(RC[-13]="",,"|n"&R1C20&RC[-13])&IF(RC[-12]="",,"|n"&R1C21&RC[-12])&IF(RC[-11]="",,"|n"&R1C22&RC[-11])&IF(RC[-10]="",,"|n"&R1C23&RC[-10])&IF(RC[-9]="",,"|n"&R1C24&RC[-9])&IF(RC[-8]="",,"|n"&R1C25&RC[-8])&IF(RC[-7]="",,"|n"&R1C26&RC[-7])&IF(RC[-6]="",,"|n"&R1C27&RC[-6])&IF(RC[-5]="",,"|n"&R1C28&RC[-5])&IF(RC[-2]="",,"|n"&RC[-2]) -> 
AF229: =VLOOKUP(RC[-31],Sheet2!R13C1:R18C2,2,0)&"."&VLOOKUP(RC[-30],Sheet2!R7C1:R11C2,2,0)&VLOOKUP(RC[-30],Sheet2!R1C1:R5C2,2,0)&RC[-29]&RC[-28]&RC[-27]&Sheet2!R1C3 -> #N/A | AG229: =IF(RC[-26]&RC[-25]&RC[-24]&RC[-23]&RC[-22]&RC[-21]="",,R1C6)&IF(RC[-26]="",,"|n"&R1C7&RC[-26])&IF(RC[-25]="",,"|n"&R1C8&RC[-25])&IF(RC[-24]="",,"|n"&R1C9&RC[-24])&IF(RC[-23]="",,"|n"&R1C10&RC[-23])&IF(RC[-22]="",,"|n"&R1C11&RC[-22])&IF(RC[-21]="",,"|n"&R1C12&RC[-21])&IF(RC[-19]&RC[-18]&RC[-17]&RC[-16]="",,"|n"&R1C13)&IF(RC[-19]="",,"|n"&R1C14&RC[-19])&IF(RC[-18]="",,"|n"&R1C15&RC[-18])&IF(RC[-17]="",,"|n"&R1C16&RC[-17])&IF(RC[-16]="",,"|n"&R1C17&RC[-16])&IF(RC[-15]="",,"|n"&R1C18&RC[-15])&IF(RC[-14]="",,"|n"&R1C19&RC[-14])&IF(RC[-13]="",,"|n"&R1C20&RC[-13])&IF(RC[-12]="",,"|n"&R1C21&RC[-12])&IF(RC[-11]="",,"|n"&R1C22&RC[-11])&IF(RC[-10]="",,"|n"&R1C23&RC[-10])&IF(RC[-9]="",,"|n"&R1C24&RC[-9])&IF(RC[-8]="",,"|n"&R1C25&RC[-8])&IF(RC[-7]="",,"|n"&R1C26&RC[-7])&IF(RC[-6]="",,"|n"&R1C27&RC[-6])&IF(RC[-5]="",,"|n"&R1C28&RC[-5])&IF(RC[-2]="",,"|n"&RC[-2]) -> 
AF230: =VLOOKUP(RC[-31],Sheet2!R13C1:R18C2,2,0)&"."&VLOOKUP(RC[-30],Sheet2!R7C1:R11C2,2,0)&VLOOKUP(RC[-30],Sheet2!R1C1:R5C2,2,0)&RC[-29]&RC[-28]&RC[-27]&Sheet2!R1C3 -> #N/A | AG230: =IF(RC[-26]&RC[-25]&RC[-24]&RC[-23]&RC[-22]&RC[-21]="",,R1C6)&IF(RC[-26]="",,"|n"&R1C7&RC[-26])&IF(RC[-25]="",,"|n"&R1C8&RC[-25])&IF(RC[-24]="",,"|n"&R1C9&RC[-24])&IF(RC[-23]="",,"|n"&R1C10&RC[-23])&IF(RC[-22]="",,"|n"&R1C11&RC[-22])&IF(RC[-21]="",,"|n"&R1C12&RC[-21])&IF(RC[-19]&RC[-18]&RC[-17]&RC[-16]="",,"|n"&R1C13)&IF(RC[-19]="",,"|n"&R1C14&RC[-19])&IF(RC[-18]="",,"|n"&R1C15&RC[-18])&IF(RC[-17]="",,"|n"&R1C16&RC[-17])&IF(RC[-16]="",,"|n"&R1C17&RC[-16])&IF(RC[-15]="",,"|n"&R1C18&RC[-15])&IF(RC[-14]="",,"|n"&R1C19&RC[-14])&IF(RC[-13]="",,"|n"&R1C20&RC[-13])&IF(RC[-12]="",,"|n"&R1C21&RC[-12])&IF(RC[-11]="",,"|n"&R1C22&RC[-11])&IF(RC[-10]="",,"|n"&R1C23&RC[-10])&IF(RC[-9]="",,"|n"&R1C24&RC[-9])&IF(RC[-8]="",,"|n"&R1C25&RC[-8])&IF(RC[-7]="",,"|n"&R1C26&RC[-7])&IF(RC[-6]="",,"|n"&R1C27&RC[-6])&IF(RC[-5]="",,"|n"&R1C28&RC[-5])&IF(RC[-2]="",,"|n"&RC[-2]) -> 
AF231: =VLOOKUP(RC[-31],Sheet2!R13C1:R18C2,2,0)&"."&VLOOKUP(RC[-30],Sheet2!R7C1:R11C2,2,0)&VLOOKUP(RC[-30],Sheet2!R1C1:R5C2,2,0)&RC[-29]&RC[-28]&RC[-27]&Sheet2!R1C3 -> #N/A | AG231: =IF(RC[-26]&RC[-25]&RC[-24]&RC[-23]&RC[-22]&RC[-21]="",,R1C6)&IF(RC[-26]="",,"|n"&R1C7&RC[-26])&IF(RC[-25]="",,"|n"&R1C8&RC[-25])&IF(RC[-24]="",,"|n"&R1C9&RC[-24])&IF(RC[-23]="",,"|n"&R1C10&RC[-23])&IF(RC[-22]="",,"|n"&R1C11&RC[-22])&IF(RC[-21]="",,"|n"&R1C12&RC[-21])&IF(RC[-19]&RC[-18]&RC[-17]&RC[-16]="",,"|n"&R1C13)&IF(RC[-19]="",,"|n"&R1C14&RC[-19])&IF(RC[-18]="",,"|n"&R1C15&RC[-18])&IF(RC[-17]="",,"|n"&R1C16&RC[-17])&IF(RC[-16]="",,"|n"&R1C17&RC[-16])&IF(RC[-15]="",,"|n"&R1C18&RC[-15])&IF(RC[-14]="",,"|n"&R1C19&RC[-14])&IF(RC[-13]="",,"|n"&R1C20&RC[-13])&IF(RC[-12]="",,"|n"&R1C21&RC[-12])&IF(RC[-11]="",,"|n"&R1C22&RC[-11])&IF(RC[-10]="",,"|n"&R1C23&RC[-10])&IF(RC[-9]="",,"|n"&R1C24&RC[-9])&IF(RC[-8]="",,"|n"&R1C25&RC[-8])&IF(RC[-7]="",,"|n"&R1C26&RC[-7])&IF(RC[-6]="",,"|n"&R1C27&RC[-6])&IF(RC[-5]="",,"|n"&R1C28&RC[-5])&IF(RC[-2]="",,"|n"&RC[-2]) -> 
AF232: =VLOOKUP(RC[-31],Sheet2!R13C1:R18C2,2,0)&"."&VLOOKUP(RC[-30],Sheet2!R7C1:R11C2,2,0)&VLOOKUP(RC[-30],Sheet2!R1C1:R5C2,2,0)&RC[-29]&RC[-28]&RC[-27]&Sheet2!R1C3 -> #N/A | AG232: =IF(RC[-26]&RC[-25]&RC[-24]&RC[-23]&RC[-22]&RC[-21]="",,R1C6)&IF(RC[-26]="",,"|n"&R1C7&RC[-26])&IF(RC[-25]="",,"|n"&R1C8&RC[-25])&IF(RC[-24]="",,"|n"&R1C9&RC[-24])&IF(RC[-23]="",,"|n"&R1C10&RC[-23])&IF(RC[-22]="",,"|n"&R1C11&RC[-22])&IF(RC[-21]="",,"|n"&R1C12&RC[-21])&IF(RC[-19]&RC[-18]&RC[-17]&RC[-16]="",,"|n"&R1C13)&IF(RC[-19]="",,"|n"&R1C14&RC[-19])&IF(RC[-18]="",,"|n"&R1C15&RC[-18])&IF(RC[-17]="",,"|n"&R1C16&RC[-17])&IF(RC[-16]="",,"|n"&R1C17&RC[-16])&IF(RC[-15]="",,"|n"&R1C18&RC[-15])&IF(RC[-14]="",,"|n"&R1C19&RC[-14])&IF(RC[-13]="",,"|n"&R1C20&RC[-13])&IF(RC[-12]="",,"|n"&R1C21&RC[-12])&IF(RC[-11]="",,"|n"&R1C22&RC[-11])&IF(RC[-10]="",,"|n"&R1C23&RC[-10])&IF(RC[-9]="",,"|n"&R1C24&RC[-9])&IF(RC[-8]="",,"|n"&R1C25&RC[-8])&IF(RC[-7]="",,"|n"&R1C26&RC[-7])&IF(RC[-6]="",,"|n"&R1C27&RC[-6])&IF(RC[-5]="",,"|n"&R1C28&RC[-5])&IF(RC[-2]="",,"|n"&RC[-2]) -> 
AF233: =VLOOKUP(RC[-31],Sheet2!R13C1:R18C2,2,0)&"."&VLOOKUP(RC[-30],Sheet2!R7C1:R11C2,2,0)&VLOOKUP(RC[-30],Sheet2!R1C1:R5C2,2,0)&RC[-29]&RC[-28]&RC[-27]&Sheet2!R1C3 -> #N/A | AG233: =IF(RC[-26]&RC[-25]&RC[-24]&RC[-23]&RC[-22]&RC[-21]="",,R1C6)&IF(RC[-26]="",,"|n"&R1C7&RC[-26])&IF(RC[-25]="",,"|n"&R1C8&RC[-25])&IF(RC[-24]="",,"|n"&R1C9&RC[-24])&IF(RC[-23]="",,"|n"&R1C10&RC[-23])&IF(RC[-22]="",,"|n"&R1C11&RC[-22])&IF(RC[-21]="",,"|n"&R1C12&RC[-21])&IF(RC[-19]&RC[-18]&RC[-17]&RC[-16]="",,"|n"&R1C13)&IF(RC[-19]="",,"|n"&R1C14&RC[-19])&IF(RC[-18]="",,"|n"&R1C15&RC[-18])&IF(RC[-17]="",,"|n"&R1C16&RC[-17])&IF(RC[-16]="",,"|n"&R1C17&RC[-16])&IF(RC[-15]="",,"|n"&R1C18&RC[-15])&IF(RC[-14]="",,"|n"&R1C19&RC[-14])&IF(RC[-13]="",,"|n"&R1C20&RC[-13])&IF(RC[-12]="",,"|n"&R1C21&RC[-12])&IF(RC[-11]="",,"|n"&R1C22&RC[-11])&IF(RC[-10]="",,"|n"&R1C23&RC[-10])&IF(RC[-9]="",,"|n"&R1C24&RC[-9])&IF(RC[-8]="",,"|n"&R1C25&RC[-8])&IF(RC[-7]="",,"|n"&R1C26&RC[-7])&IF(RC[-6]="",,"|n"&R1C27&RC[-6])&IF(RC[-5]="",,"|n"&R1C28&RC[-5])&IF(RC[-2]="",,"|n"&RC[-2]) -> 
AF234: =VLOOKUP(RC[-31],Sheet2!R13C1:R18C2,2,0)&"."&VLOOKUP(RC[-30],Sheet2!R7C1:R11C2,2,0)&VLOOKUP(RC[-30],Sheet2!R1C1:R5C2,2,0)&RC[-29]&RC[-28]&RC[-27]&Sheet2!R1C3 -> #N/A | AG234: =IF(RC[-26]&RC[-25]&RC[-24]&RC[-23]&RC[-22]&RC[-21]="",,R1C6)&IF(RC[-26]="",,"|n"&R1C7&RC[-26])&IF(RC[-25]="",,"|n"&R1C8&RC[-25])&IF(RC[-24]="",,"|n"&R1C9&RC[-24])&IF(RC[-23]="",,"|n"&R1C10&RC[-23])&IF(RC[-22]="",,"|n"&R1C11&RC[-22])&IF(RC[-21]="",,"|n"&R1C12&RC[-21])&IF(RC[-19]&RC[-18]&RC[-17]&RC[-16]="",,"|n"&R1C13)&IF(RC[-19]="",,"|n"&R1C14&RC[-19])&IF(RC[-18]="",,"|n"&R1C15&RC[-18])&IF(RC[-17]="",,"|n"&R1C16&RC[-17])&IF(RC[-16]="",,"|n"&R1C17&RC[-16])&IF(RC[-15]="",,"|n"&R1C18&RC[-15])&IF(RC[-14]="",,"|n"&R1C19&RC[-14])&IF(RC[-13]="",,"|n"&R1C20&RC[-13])&IF(RC[-12]="",,"|n"&R1C21&RC[-12])&IF(RC[-11]="",,"|n"&R1C22&RC[-11])&IF(RC[-10]="",,"|n"&R1C23&RC[-10])&IF(RC[-9]="",,"|n"&R1C24&RC[-9])&IF(RC[-8]="",,"|n"&R1C25&RC[-8])&IF(RC[-7]="",,"|n"&R1C26&RC[-7])&IF(RC[-6]="",,"|n"&R1C27&RC[-6])&IF(RC[-5]="",,"|n"&R1C28&RC[-5])&IF(RC[-2]="",,"|n"&RC[-2]) -> 
AF235: =VLOOKUP(RC[-31],Sheet2!R13C1:R18C2,2,0)&"."&VLOOKUP(RC[-30],Sheet2!R7C1:R11C2,2,0)&VLOOKUP(RC[-30],Sheet2!R1C1:R5C2,2,0)&RC[-29]&RC[-28]&RC[-27]&Sheet2!R1C3 -> #N/A | AG235: =IF(RC[-26]&RC[-25]&RC[-24]&RC[-23]&RC[-22]&RC[-21]="",,R1C6)&IF(RC[-26]="",,"|n"&R1C7&RC[-26])&IF(RC[-25]="",,"|n"&R1C8&RC[-25])&IF(RC[-24]="",,"|n"&R1C9&RC[-24])&IF(RC[-23]="",,"|n"&R1C10&RC[-23])&IF(RC[-22]="",,"|n"&R1C11&RC[-22])&IF(RC[-21]="",,"|n"&R1C12&RC[-21])&IF(RC[-19]&RC[-18]&RC[-17]&RC[-16]="",,"|n"&R1C13)&IF(RC[-19]="",,"|n"&R1C14&RC[-19])&IF(RC[-18]="",,"|n"&R1C15&RC[-18])&IF(RC[-17]="",,"|n"&R1C16&RC[-17])&IF(RC[-16]="",,"|n"&R1C17&RC[-16])&IF(RC[-15]="",,"|n"&R1C18&RC[-15])&IF(RC[-14]="",,"|n"&R1C19&RC[-14])&IF(RC[-13]="",,"|n"&R1C20&RC[-13])&IF(RC[-12]="",,"|n"&R1C21&RC[-12])&IF(RC[-11]="",,"|n"&R1C22&RC[-11])&IF(RC[-10]="",,"|n"&R1C23&RC[-10])&IF(RC[-9]="",,"|n"&R1C24&RC[-9])&IF(RC[-8]="",,"|n"&R1C25&RC[-8])&IF(RC[-7]="",,"|n"&R1C26&RC[-7])&IF(RC[-6]="",,"|n"&R1C27&RC[-6])&IF(RC[-5]="",,"|n"&R1C28&RC[-5])&IF(RC[-2]="",,"|n"&RC[-2]) -> 
AF236: =VLOOKUP(RC[-31],Sheet2!R13C1:R18C2,2,0)&"."&VLOOKUP(RC[-30],Sheet2!R7C1:R11C2,2,0)&VLOOKUP(RC[-30],Sheet2!R1C1:R5C2,2,0)&RC[-29]&RC[-28]&RC[-27]&Sheet2!R1C3 -> #N/A | AG236: =IF(RC[-26]&RC[-25]&RC[-24]&RC[-23]&RC[-22]&RC[-21]="",,R1C6)&IF(RC[-26]="",,"|n"&R1C7&RC[-26])&IF(RC[-25]="",,"|n"&R1C8&RC[-25])&IF(RC[-24]="",,"|n"&R1C9&RC[-24])&IF(RC[-23]="",,"|n"&R1C10&RC[-23])&IF(RC[-22]="",,"|n"&R1C11&RC[-22])&IF(RC[-21]="",,"|n"&R1C12&RC[-21])&IF(RC[-19]&RC[-18]&RC[-17]&RC[-16]="",,"|n"&R1C13)&IF(RC[-19]="",,"|n"&R1C14&RC[-19])&IF(RC[-18]="",,"|n"&R1C15&RC[-18])&IF(RC[-17]="",,"|n"&R1C16&RC[-17])&IF(RC[-16]="",,"|n"&R1C17&RC[-16])&IF(RC[-15]="",,"|n"&R1C18&RC[-15])&IF(RC[-14]="",,"|n"&R1C19&RC[-14])&IF(RC[-13]="",,"|n"&R1C20&RC[-13])&IF(RC[-12]="",,"|n"&R1C21&RC[-12])&IF(RC[-11]="",,"|n"&R1C22&RC[-11])&IF(RC[-10]="",,"|n"&R1C23&RC[-10])&IF(RC[-9]="",,"|n"&R1C24&RC[-9])&IF(RC[-8]="",,"|n"&R1C25&RC[-8])&IF(RC[-7]="",,"|n"&R1C26&RC[-7])&IF(RC[-6]="",,"|n"&R1C27&RC[-6])&IF(RC[-5]="",,"|n"&R1C28&RC[-5])&IF(RC[-2]="",,"|n"&RC[-2]) -> 
AF237: =VLOOKUP(RC[-31],Sheet2!R13C1:R18C2,2,0)&"."&VLOOKUP(RC[-30],Sheet2!R7C1:R11C2,2,0)&VLOOKUP(RC[-30],Sheet2!R1C1:R5C2,2,0)&RC[-29]&RC[-28]&RC[-27]&Sheet2!R1C3 -> #N/A | AG237: =IF(RC[-26]&RC[-25]&RC[-24]&RC[-23]&RC[-22]&RC[-21]="",,R1C6)&IF(RC[-26]="",,"|n"&R1C7&RC[-26])&IF(RC[-25]="",,"|n"&R1C8&RC[-25])&IF(RC[-24]="",,"|n"&R1C9&RC[-24])&IF(RC[-23]="",,"|n"&R1C10&RC[-23])&IF(RC[-22]="",,"|n"&R1C11&RC[-22])&IF(RC[-21]="",,"|n"&R1C12&RC[-21])&IF(RC[-19]&RC[-18]&RC[-17]&RC[-16]="",,"|n"&R1C13)&IF(RC[-19]="",,"|n"&R1C14&RC[-19])&IF(RC[-18]="",,"|n"&R1C15&RC[-18])&IF(RC[-17]="",,"|n"&R1C16&RC[-17])&IF(RC[-16]="",,"|n"&R1C17&RC[-16])&IF(RC[-15]="",,"|n"&R1C18&RC[-15])&IF(RC[-14]="",,"|n"&R1C19&RC[-14])&IF(RC[-13]="",,"|n"&R1C20&RC[-13])&IF(RC[-12]="",,"|n"&R1C21&RC[-12])&IF(RC[-11]="",,"|n"&R1C22&RC[-11])&IF(RC[-10]="",,"|n"&R1C23&RC[-10])&IF(RC[-9]="",,"|n"&R1C24&RC[-9])&IF(RC[-8]="",,"|n"&R1C25&RC[-8])&IF(RC[-7]="",,"|n"&R1C26&RC[-7])&IF(RC[-6]="",,"|n"&R1C27&RC[-6])&IF(RC[-5]="",,"|n"&R1C28&RC[-5])&IF(RC[-2]="",,"|n"&RC[-2]) -> 
AF238: =VLOOKUP(RC[-31],Sheet2!R13C1:R18C2,2,0)&"."&VLOOKUP(RC[-30],Sheet2!R7C1:R11C2,2,0)&VLOOKUP(RC[-30],Sheet2!R1C1:R5C2,2,0)&RC[-29]&RC[-28]&RC[-27]&Sheet2!R1C3 -> #N/A | AG238: =IF(RC[-26]&RC[-25]&RC[-24]&RC[-23]&RC[-22]&RC[-21]="",,R1C6)&IF(RC[-26]="",,"|n"&R1C7&RC[-26])&IF(RC[-25]="",,"|n"&R1C8&RC[-25])&IF(RC[-24]="",,"|n"&R1C9&RC[-24])&IF(RC[-23]="",,"|n"&R1C10&RC[-23])&IF(RC[-22]="",,"|n"&R1C11&RC[-22])&IF(RC[-21]="",,"|n"&R1C12&RC[-21])&IF(RC[-19]&RC[-18]&RC[-17]&RC[-16]="",,"|n"&R1C13)&IF(RC[-19]="",,"|n"&R1C14&RC[-19])&IF(RC[-18]="",,"|n"&R1C15&RC[-18])&IF(RC[-17]="",,"|n"&R1C16&RC[-17])&IF(RC[-16]="",,"|n"&R1C17&RC[-16])&IF(RC[-15]="",,"|n"&R1C18&RC[-15])&IF(RC[-14]="",,"|n"&R1C19&RC[-14])&IF(RC[-13]="",,"|n"&R1C20&RC[-13])&IF(RC[-12]="",,"|n"&R1C21&RC[-12])&IF(RC[-11]="",,"|n"&R1C22&RC[-11])&IF(RC[-10]="",,"|n"&R1C23&RC[-10])&IF(RC[-9]="",,"|n"&R1C24&RC[-9])&IF(RC[-8]="",,"|n"&R1C25&RC[-8])&IF(RC[-7]="",,"|n"&R1C26&RC[-7])&IF(RC[-6]="",,"|n"&R1C27&RC[-6])&IF(RC[-5]="",,"|n"&R1C28&RC[-5])&IF(RC[-2]="",,"|n"&RC[-2]) -> 
AF239: =VLOOKUP(RC[-31],Sheet2!R13C1:R18C2,2,0)&"."&VLOOKUP(RC[-30],Sheet2!R7C1:R11C2,2,0)&VLOOKUP(RC[-30],Sheet2!R1C1:R5C2,2,0)&RC[-29]&RC[-28]&RC[-27]&Sheet2!R1C3 -> #N/A | AG239: =IF(RC[-26]&RC[-25]&RC[-24]&RC[-23]&RC[-22]&RC[-21]="",,R1C6)&IF(RC[-26]="",,"|n"&R1C7&RC[-26])&IF(RC[-25]="",,"|n"&R1C8&RC[-25])&IF(RC[-24]="",,"|n"&R1C9&RC[-24])&IF(RC[-23]="",,"|n"&R1C10&RC[-23])&IF(RC[-22]="",,"|n"&R1C11&RC[-22])&IF(RC[-21]="",,"|n"&R1C12&RC[-21])&IF(RC[-19]&RC[-18]&RC[-17]&RC[-16]="",,"|n"&R1C13)&IF(RC[-19]="",,"|n"&R1C14&RC[-19])&IF(RC[-18]="",,"|n"&R1C15&RC[-18])&IF(RC[-17]="",,"|n"&R1C16&RC[-17])&IF(RC[-16]="",,"|n"&R1C17&RC[-16])&IF(RC[-15]="",,"|n"&R1C18&RC[-15])&IF(RC[-14]="",,"|n"&R1C19&RC[-14])&IF(RC[-13]="",,"|n"&R1C20&RC[-13])&IF(RC[-12]="",,"|n"&R1C21&RC[-12])&IF(RC[-11]="",,"|n"&R1C22&RC[-11])&IF(RC[-10]="",,"|n"&R1C23&RC[-10])&IF(RC[-9]="",,"|n"&R1C24&RC[-9])&IF(RC[-8]="",,"|n"&R1C25&RC[-8])&IF(RC[-7]="",,"|n"&R1C26&RC[-7])&IF(RC[-6]="",,"|n"&R1C27&RC[-6])&IF(RC[-5]="",,"|n"&R1C28&RC[-5])&IF(RC[-2]="",,"|n"&RC[-2]) -> 
AF240: =VLOOKUP(RC[-31],Sheet2!R13C1:R18C2,2,0)&"."&VLOOKUP(RC[-30],Sheet2!R7C1:R11C2,2,0)&VLOOKUP(RC[-30],Sheet2!R1C1:R5C2,2,0)&RC[-29]&RC[-28]&RC[-27]&Sheet2!R1C3 -> #N/A | AG240: =IF(RC[-26]&RC[-25]&RC[-24]&RC[-23]&RC[-22]&RC[-21]="",,R1C6)&IF(RC[-26]="",,"|n"&R1C7&RC[-26])&IF(RC[-25]="",,"|n"&R1C8&RC[-25])&IF(RC[-24]="",,"|n"&R1C9&RC[-24])&IF(RC[-23]="",,"|n"&R1C10&RC[-23])&IF(RC[-22]="",,"|n"&R1C11&RC[-22])&IF(RC[-21]="",,"|n"&R1C12&RC[-21])&IF(RC[-19]&RC[-18]&RC[-17]&RC[-16]="",,"|n"&R1C13)&IF(RC[-19]="",,"|n"&R1C14&RC[-19])&IF(RC[-18]="",,"|n"&R1C15&RC[-18])&IF(RC[-17]="",,"|n"&R1C16&RC[-17])&IF(RC[-16]="",,"|n"&R1C17&RC[-16])&IF(RC[-15]="",,"|n"&R1C18&RC[-15])&IF(RC[-14]="",,"|n"&R1C19&RC[-14])&IF(RC[-13]="",,"|n"&R1C20&RC[-13])&IF(RC[-12]="",,"|n"&R1C21&RC[-12])&IF(RC[-11]="",,"|n"&R1C22&RC[-11])&IF(RC[-10]="",,"|n"&R1C23&RC[-10])&IF(RC[-9]="",,"|n"&R1C24&RC[-9])&IF(RC[-8]="",,"|n"&R1C25&RC[-8])&IF(RC[-7]="",,"|n"&R1C26&RC[-7])&IF(RC[-6]="",,"|n"&R1C27&RC[-6])&IF(RC[-5]="",,"|n"&R1C28&RC[-5])&IF(RC[-2]="",,"|n"&RC[-2]) -> 
AF241: =VLOOKUP(RC[-31],Sheet2!R13C1:R18C2,2,0)&"."&VLOOKUP(RC[-30],Sheet2!R7C1:R11C2,2,0)&VLOOKUP(RC[-30],Sheet2!R1C1:R5C2,2,0)&RC[-29]&RC[-28]&RC[-27]&Sheet2!R1C3 -> #N/A | AG241: =IF(RC[-26]&RC[-25]&RC[-24]&RC[-23]&RC[-22]&RC[-21]="",,R1C6)&IF(RC[-26]="",,"|n"&R1C7&RC[-26])&IF(RC[-25]="",,"|n"&R1C8&RC[-25])&IF(RC[-24]="",,"|n"&R1C9&RC[-24])&IF(RC[-23]="",,"|n"&R1C10&RC[-23])&IF(RC[-22]="",,"|n"&R1C11&RC[-22])&IF(RC[-21]="",,"|n"&R1C12&RC[-21])&IF(RC[-19]&RC[-18]&RC[-17]&RC[-16]="",,"|n"&R1C13)&IF(RC[-19]="",,"|n"&R1C14&RC[-19])&IF(RC[-18]="",,"|n"&R1C15&RC[-18])&IF(RC[-17]="",,"|n"&R1C16&RC[-17])&IF(RC[-16]="",,"|n"&R1C17&RC[-16])&IF(RC[-15]="",,"|n"&R1C18&RC[-15])&IF(RC[-14]="",,"|n"&R1C19&RC[-14])&IF(RC[-13]="",,"|n"&R1C20&RC[-13])&IF(RC[-12]="",,"|n"&R1C21&RC[-12])&IF(RC[-11]="",,"|n"&R1C22&RC[-11])&IF(RC[-10]="",,"|n"&R1C23&RC[-10])&IF(RC[-9]="",,"|n"&R1C24&RC[-9])&IF(RC[-8]="",,"|n"&R1C25&RC[-8])&IF(RC[-7]="",,"|n"&R1C26&RC[-7])&IF(RC[-6]="",,"|n"&R1C27&RC[-6])&IF(RC[-5]="",,"|n"&R1C28&RC[-5])&IF(RC[-2]="",,"|n"&RC[-2]) -> 
AF242: =VLOOKUP(RC[-31],Sheet2!R13C1:R18C2,2,0)&"."&VLOOKUP(RC[-30],Sheet2!R7C1:R11C2,2,0)&VLOOKUP(RC[-30],Sheet2!R1C1:R5C2,2,0)&RC[-29]&RC[-28]&RC[-27]&Sheet2!R1C3 -> #N/A | AG242: =IF(RC[-26]&RC[-25]&RC[-24]&RC[-23]&RC[-22]&RC[-21]="",,R1C6)&IF(RC[-26]="",,"|n"&R1C7&RC[-26])&IF(RC[-25]="",,"|n"&R1C8&RC[-25])&IF(RC[-24]="",,"|n"&R1C9&RC[-24])&IF(RC[-23]="",,"|n"&R1C10&RC[-23])&IF(RC[-22]="",,"|n"&R1C11&RC[-22])&IF(RC[-21]="",,"|n"&R1C12&RC[-21])&IF(RC[-19]&RC[-18]&RC[-17]&RC[-16]="",,"|n"&R1C13)&IF(RC[-19]="",,"|n"&R1C14&RC[-19])&IF(RC[-18]="",,"|n"&R1C15&RC[-18])&IF(RC[-17]="",,"|n"&R1C16&RC[-17])&IF(RC[-16]="",,"|n"&R1C17&RC[-16])&IF(RC[-15]="",,"|n"&R1C18&RC[-15])&IF(RC[-14]="",,"|n"&R1C19&RC[-14])&IF(RC[-13]="",,"|n"&R1C20&RC[-13])&IF(RC[-12]="",,"|n"&R1C21&RC[-12])&IF(RC[-11]="",,"|n"&R1C22&RC[-11])&IF(RC[-10]="",,"|n"&R1C23&RC[-10])&IF(RC[-9]="",,"|n"&R1C24&RC[-9])&IF(RC[-8]="",,"|n"&R1C25&RC[-8])&IF(RC[-7]="",,"|n"&R1C26&RC[-7])&IF(RC[-6]="",,"|n"&R1C27&RC[-6])&IF(RC[-5]="",,"|n"&R1C28&RC[-5])&IF(RC[-2]="",,"|n"&RC[-2]) -> 
AF243: =VLOOKUP(RC[-31],Sheet2!R13C1:R18C2,2,0)&"."&VLOOKUP(RC[-30],Sheet2!R7C1:R11C2,2,0)&VLOOKUP(RC[-30],Sheet2!R1C1:R5C2,2,0)&RC[-29]&RC[-28]&RC[-27]&Sheet2!R1C3 -> #N/A | AG243: =IF(RC[-26]&RC[-25]&RC[-24]&RC[-23]&RC[-22]&RC[-21]="",,R1C6)&IF(RC[-26]="",,"|n"&R1C7&RC[-26])&IF(RC[-25]="",,"|n"&R1C8&RC[-25])&IF(RC[-24]="",,"|n"&R1C9&RC[-24])&IF(RC[-23]="",,"|n"&R1C10&RC[-23])&IF(RC[-22]="",,"|n"&R1C11&RC[-22])&IF(RC[-21]="",,"|n"&R1C12&RC[-21])&IF(RC[-19]&RC[-18]&RC[-17]&RC[-16]="",,"|n"&R1C13)&IF(RC[-19]="",,"|n"&R1C14&RC[-19])&IF(RC[-18]="",,"|n"&R1C15&RC[-18])&IF(RC[-17]="",,"|n"&R1C16&RC[-17])&IF(RC[-16]="",,"|n"&R1C17&RC[-16])&IF(RC[-15]="",,"|n"&R1C18&RC[-15])&IF(RC[-14]="",,"|n"&R1C19&RC[-14])&IF(RC[-13]="",,"|n"&R1C20&RC[-13])&IF(RC[-12]="",,"|n"&R1C21&RC[-12])&IF(RC[-11]="",,"|n"&R1C22&RC[-11])&IF(RC[-10]="",,"|n"&R1C23&RC[-10])&IF(RC[-9]="",,"|n"&R1C24&RC[-9])&IF(RC[-8]="",,"|n"&R1C25&RC[-8])&IF(RC[-7]="",,"|n"&R1C26&RC[-7])&IF(RC[-6]="",,"|n"&R1C27&RC[-6])&IF(RC[-5]="",,"|n"&R1C28&RC[-5])&IF(RC[-2]="",,"|n"&RC[-2]) -> 
AF244: =VLOOKUP(RC[-31],Sheet2!R13C1:R18C2,2,0)&"."&VLOOKUP(RC[-30],Sheet2!R7C1:R11C2,2,0)&VLOOKUP(RC[-30],Sheet2!R1C1:R5C2,2,0)&RC[-29]&RC[-28]&RC[-27]&Sheet2!R1C3 -> #N/A | AG244: =IF(RC[-26]&RC[-25]&RC[-24]&RC[-23]&RC[-22]&RC[-21]="",,R1C6)&IF(RC[-26]="",,"|n"&R1C7&RC[-26])&IF(RC[-25]="",,"|n"&R1C8&RC[-25])&IF(RC[-24]="",,"|n"&R1C9&RC[-24])&IF(RC[-23]="",,"|n"&R1C10&RC[-23])&IF(RC[-22]="",,"|n"&R1C11&RC[-22])&IF(RC[-21]="",,"|n"&R1C12&RC[-21])&IF(RC[-19]&RC[-18]&RC[-17]&RC[-16]="",,"|n"&R1C13)&IF(RC[-19]="",,"|n"&R1C14&RC[-19])&IF(RC[-18]="",,"|n"&R1C15&RC[-18])&IF(RC[-17]="",,"|n"&R1C16&RC[-17])&IF(RC[-16]="",,"|n"&R1C17&RC[-16])&IF(RC[-15]="",,"|n"&R1C18&RC[-15])&IF(RC[-14]="",,"|n"&R1C19&RC[-14])&IF(RC[-13]="",,"|n"&R1C20&RC[-13])&IF(RC[-12]="",,"|n"&R1C21&RC[-12])&IF(RC[-11]="",,"|n"&R1C22&RC[-11])&IF(RC[-10]="",,"|n"&R1C23&RC[-10])&IF(RC[-9]="",,"|n"&R1C24&RC[-9])&IF(RC[-8]="",,"|n"&R1C25&RC[-8])&IF(RC[-7]="",,"|n"&R1C26&RC[-7])&IF(RC[-6]="",,"|n"&R1C27&RC[-6])&IF(RC[-5]="",,"|n"&R1C28&RC[-5])&IF(RC[-2]="",,"|n"&RC[-2]) -> 
AF245: =VLOOKUP(RC[-31],Sheet2!R13C1:R18C2,2,0)&"."&VLOOKUP(RC[-30],Sheet2!R7C1:R11C2,2,0)&VLOOKUP(RC[-30],Sheet2!R1C1:R5C2,2,0)&RC[-29]&RC[-28]&RC[-27]&Sheet2!R1C3 -> #N/A | AG245: =IF(RC[-26]&RC[-25]&RC[-24]&RC[-23]&RC[-22]&RC[-21]="",,R1C6)&IF(RC[-26]="",,"|n"&R1C7&RC[-26])&IF(RC[-25]="",,"|n"&R1C8&RC[-25])&IF(RC[-24]="",,"|n"&R1C9&RC[-24])&IF(RC[-23]="",,"|n"&R1C10&RC[-23])&IF(RC[-22]="",,"|n"&R1C11&RC[-22])&IF(RC[-21]="",,"|n"&R1C12&RC[-21])&IF(RC[-19]&RC[-18]&RC[-17]&RC[-16]="",,"|n"&R1C13)&IF(RC[-19]="",,"|n"&R1C14&RC[-19])&IF(RC[-18]="",,"|n"&R1C15&RC[-18])&IF(RC[-17]="",,"|n"&R1C16&RC[-17])&IF(RC[-16]="",,"|n"&R1C17&RC[-16])&IF(RC[-15]="",,"|n"&R1C18&RC[-15])&IF(RC[-14]="",,"|n"&R1C19&RC[-14])&IF(RC[-13]="",,"|n"&R1C20&RC[-13])&IF(RC[-12]="",,"|n"&R1C21&RC[-12])&IF(RC[-11]="",,"|n"&R1C22&RC[-11])&IF(RC[-10]="",,"|n"&R1C23&RC[-10])&IF(RC[-9]="",,"|n"&R1C24&RC[-9])&IF(RC[-8]="",,"|n"&R1C25&RC[-8])&IF(RC[-7]="",,"|n"&R1C26&RC[-7])&IF(RC[-6]="",,"|n"&R1C27&RC[-6])&IF(RC[-5]="",,"|n"&R1C28&RC[-5])&IF(RC[-2]="",,"|n"&RC[-2]) -> 
AF246: =VLOOKUP(RC[-31],Sheet2!R13C1:R18C2,2,0)&"."&VLOOKUP(RC[-30],Sheet2!R7C1:R11C2,2,0)&VLOOKUP(RC[-30],Sheet2!R1C1:R5C2,2,0)&RC[-29]&RC[-28]&RC[-27]&Sheet2!R1C3 -> #N/A | AG246: =IF(RC[-26]&RC[-25]&RC[-24]&RC[-23]&RC[-22]&RC[-21]="",,R1C6)&IF(RC[-26]="",,"|n"&R1C7&RC[-26])&IF(RC[-25]="",,"|n"&R1C8&RC[-25])&IF(RC[-24]="",,"|n"&R1C9&RC[-24])&IF(RC[-23]="",,"|n"&R1C10&RC[-23])&IF(RC[-22]="",,"|n"&R1C11&RC[-22])&IF(RC[-21]="",,"|n"&R1C12&RC[-21])&IF(RC[-19]&RC[-18]&RC[-17]&RC[-16]="",,"|n"&R1C13)&IF(RC[-19]="",,"|n"&R1C14&RC[-19])&IF(RC[-18]="",,"|n"&R1C15&RC[-18])&IF(RC[-17]="",,"|n"&R1C16&RC[-17])&IF(RC[-16]="",,"|n"&R1C17&RC[-16])&IF(RC[-15]="",,"|n"&R1C18&RC[-15])&IF(RC[-14]="",,"|n"&R1C19&RC[-14])&IF(RC[-13]="",,"|n"&R1C20&RC[-13])&IF(RC[-12]="",,"|n"&R1C21&RC[-12])&IF(RC[-11]="",,"|n"&R1C22&RC[-11])&IF(RC[-10]="",,"|n"&R1C23&RC[-10])&IF(RC[-9]="",,"|n"&R1C24&RC[-9])&IF(RC[-8]="",,"|n"&R1C25&RC[-8])&IF(RC[-7]="",,"|n"&R1C26&RC[-7])&IF(RC[-6]="",,"|n"&R1C27&RC[-6])&IF(RC[-5]="",,"|n"&R1C28&RC[-5])&IF(RC[-2]="",,"|n"&RC[-2]) -> 
AF247: =VLOOKUP(RC[-31],Sheet2!R13C1:R18C2,2,0)&"."&VLOOKUP(RC[-30],Sheet2!R7C1:R11C2,2,0)&VLOOKUP(RC[-30],Sheet2!R1C1:R5C2,2,0)&RC[-29]&RC[-28]&RC[-27]&Sheet2!R1C3 -> #N/A | AG247: =IF(RC[-26]&RC[-25]&RC[-24]&RC[-23]&RC[-22]&RC[-21]="",,R1C6)&IF(RC[-26]="",,"|n"&R1C7&RC[-26])&IF(RC[-25]="",,"|n"&R1C8&RC[-25])&IF(RC[-24]="",,"|n"&R1C9&RC[-24])&IF(RC[-23]="",,"|n"&R1C10&RC[-23])&IF(RC[-22]="",,"|n"&R1C11&RC[-22])&IF(RC[-21]="",,"|n"&R1C12&RC[-21])&IF(RC[-19]&RC[-18]&RC[-17]&RC[-16]="",,"|n"&R1C13)&IF(RC[-19]="",,"|n"&R1C14&RC[-19])&IF(RC[-18]="",,"|n"&R1C15&RC[-18])&IF(RC[-17]="",,"|n"&R1C16&RC[-17])&IF(RC[-16]="",,"|n"&R1C17&RC[-16])&IF(RC[-15]="",,"|n"&R1C18&RC[-15])&IF(RC[-14]="",,"|n"&R1C19&RC[-14])&IF(RC[-13]="",,"|n"&R1C20&RC[-13])&IF(RC[-12]="",,"|n"&R1C21&RC[-12])&IF(RC[-11]="",,"|n"&R1C22&RC[-11])&IF(RC[-10]="",,"|n"&R1C23&RC[-10])&IF(RC[-9]="",,"|n"&R1C24&RC[-9])&IF(RC[-8]="",,"|n"&R1C25&RC[-8])&IF(RC[-7]="",,"|n"&R1C26&RC[-7])&IF(RC[-6]="",,"|n"&R1C27&RC[-6])&IF(RC[-5]="",,"|n"&R1C28&RC[-5])&IF(RC[-2]="",,"|n"&RC[-2]) -> 
AF248: =VLOOKUP(RC[-31],Sheet2!R13C1:R18C2,2,0)&"."&VLOOKUP(RC[-30],Sheet2!R7C1:R11C2,2,0)&VLOOKUP(RC[-30],Sheet2!R1C1:R5C2,2,0)&RC[-29]&RC[-28]&RC[-27]&Sheet2!R1C3 -> #N/A | AG248: =IF(RC[-26]&RC[-25]&RC[-24]&RC[-23]&RC[-22]&RC[-21]="",,R1C6)&IF(RC[-26]="",,"|n"&R1C7&RC[-26])&IF(RC[-25]="",,"|n"&R1C8&RC[-25])&IF(RC[-24]="",,"|n"&R1C9&RC[-24])&IF(RC[-23]="",,"|n"&R1C10&RC[-23])&IF(RC[-22]="",,"|n"&R1C11&RC[-22])&IF(RC[-21]="",,"|n"&R1C12&RC[-21])&IF(RC[-19]&RC[-18]&RC[-17]&RC[-16]="",,"|n"&R1C13)&IF(RC[-19]="",,"|n"&R1C14&RC[-19])&IF(RC[-18]="",,"|n"&R1C15&RC[-18])&IF(RC[-17]="",,"|n"&R1C16&RC[-17])&IF(RC[-16]="",,"|n"&R1C17&RC[-16])&IF(RC[-15]="",,"|n"&R1C18&RC[-15])&IF(RC[-14]="",,"|n"&R1C19&RC[-14])&IF(RC[-13]="",,"|n"&R1C20&RC[-13])&IF(RC[-12]="",,"|n"&R1C21&RC[-12])&IF(RC[-11]="",,"|n"&R1C22&RC[-11])&IF(RC[-10]="",,"|n"&R1C23&RC[-10])&IF(RC[-9]="",,"|n"&R1C24&RC[-9])&IF(RC[-8]="",,"|n"&R1C25&RC[-8])&IF(RC[-7]="",,"|n"&R1C26&RC[-7])&IF(RC[-6]="",,"|n"&R1C27&RC[-6])&IF(RC[-5]="",,"|n"&R1C28&RC[-5])&IF(RC[-2]="",,"|n"&RC[-2]) -> 
AF249: =VLOOKUP(RC[-31],Sheet2!R13C1:R18C2,2,0)&"."&VLOOKUP(RC[-30],Sheet2!R7C1:R11C2,2,0)&VLOOKUP(RC[-30],Sheet2!R1C1:R5C2,2,0)&RC[-29]&RC[-28]&RC[-27]&Sheet2!R1C3 -> #N/A | AG249: =IF(RC[-26]&RC[-25]&RC[-24]&RC[-23]&RC[-22]&RC[-21]="",,R1C6)&IF(RC[-26]="",,"|n"&R1C7&RC[-26])&IF(RC[-25]="",,"|n"&R1C8&RC[-25])&IF(RC[-24]="",,"|n"&R1C9&RC[-24])&IF(RC[-23]="",,"|n"&R1C10&RC[-23])&IF(RC[-22]="",,"|n"&R1C11&RC[-22])&IF(RC[-21]="",,"|n"&R1C12&RC[-21])&IF(RC[-19]&RC[-18]&RC[-17]&RC[-16]="",,"|n"&R1C13)&IF(RC[-19]="",,"|n"&R1C14&RC[-19])&IF(RC[-18]="",,"|n"&R1C15&RC[-18])&IF(RC[-17]="",,"|n"&R1C16&RC[-17])&IF(RC[-16]="",,"|n"&R1C17&RC[-16])&IF(RC[-15]="",,"|n"&R1C18&RC[-15])&IF(RC[-14]="",,"|n"&R1C19&RC[-14])&IF(RC[-13]="",,"|n"&R1C20&RC[-13])&IF(RC[-12]="",,"|n"&R1C21&RC[-12])&IF(RC[-11]="",,"|n"&R1C22&RC[-11])&IF(RC[-10]="",,"|n"&R1C23&RC[-10])&IF(RC[-9]="",,"|n"&R1C24&RC[-9])&IF(RC[-8]="",,"|n"&R1C25&RC[-8])&IF(RC[-7]="",,"|n"&R1C26&RC[-7])&IF(RC[-6]="",,"|n"&R1C27&RC[-6])&IF(RC[-5]="",,"|n"&R1C28&RC[-5])&IF(RC[-2]="",,"|n"&RC[-2]) -> 
AF250: =VLOOKUP(RC[-31],Sheet2!R13C1:R18C2,2,0)&"."&VLOOKUP(RC[-30],Sheet2!R7C1:R11C2,2,0)&VLOOKUP(RC[-30],Sheet2!R1C1:R5C2,2,0)&RC[-29]&RC[-28]&RC[-27]&Sheet2!R1C3 -> #N/A | AG250: =IF(RC[-26]&RC[-25]&RC[-24]&RC[-23]&RC[-22]&RC[-21]="",,R1C6)&IF(RC[-26]="",,"|n"&R1C7&RC[-26])&IF(RC[-25]="",,"|n"&R1C8&RC[-25])&IF(RC[-24]="",,"|n"&R1C9&RC[-24])&IF(RC[-23]="",,"|n"&R1C10&RC[-23])&IF(RC[-22]="",,"|n"&R1C11&RC[-22])&IF(RC[-21]="",,"|n"&R1C12&RC[-21])&IF(RC[-19]&RC[-18]&RC[-17]&RC[-16]="",,"|n"&R1C13)&IF(RC[-19]="",,"|n"&R1C14&RC[-19])&IF(RC[-18]="",,"|n"&R1C15&RC[-18])&IF(RC[-17]="",,"|n"&R1C16&RC[-17])&IF(RC[-16]="",,"|n"&R1C17&RC[-16])&IF(RC[-15]="",,"|n"&R1C18&RC[-15])&IF(RC[-14]="",,"|n"&R1C19&RC[-14])&IF(RC[-13]="",,"|n"&R1C20&RC[-13])&IF(RC[-12]="",,"|n"&R1C21&RC[-12])&IF(RC[-11]="",,"|n"&R1C22&RC[-11])&IF(RC[-10]="",,"|n"&R1C23&RC[-10])&IF(RC[-9]="",,"|n"&R1C24&RC[-9])&IF(RC[-8]="",,"|n"&R1C25&RC[-8])&IF(RC[-7]="",,"|n"&R1C26&RC[-7])&IF(RC[-6]="",,"|n"&R1C27&RC[-6])&IF(RC[-5]="",,"|n"&R1C28&RC[-5])&IF(RC[-2]="",,"|n"&RC[-2]) -> 
AF251: =VLOOKUP(RC[-31],Sheet2!R13C1:R18C2,2,0)&"."&VLOOKUP(RC[-30],Sheet2!R7C1:R11C2,2,0)&VLOOKUP(RC[-30],Sheet2!R1C1:R5C2,2,0)&RC[-29]&RC[-28]&RC[-27]&Sheet2!R1C3 -> #N/A | AG251: =IF(RC[-26]&RC[-25]&RC[-24]&RC[-23]&RC[-22]&RC[-21]="",,R1C6)&IF(RC[-26]="",,"|n"&R1C7&RC[-26])&IF(RC[-25]="",,"|n"&R1C8&RC[-25])&IF(RC[-24]="",,"|n"&R1C9&RC[-24])&IF(RC[-23]="",,"|n"&R1C10&RC[-23])&IF(RC[-22]="",,"|n"&R1C11&RC[-22])&IF(RC[-21]="",,"|n"&R1C12&RC[-21])&IF(RC[-19]&RC[-18]&RC[-17]&RC[-16]="",,"|n"&R1C13)&IF(RC[-19]="",,"|n"&R1C14&RC[-19])&IF(RC[-18]="",,"|n"&R1C15&RC[-18])&IF(RC[-17]="",,"|n"&R1C16&RC[-17])&IF(RC[-16]="",,"|n"&R1C17&RC[-16])&IF(RC[-15]="",,"|n"&R1C18&RC[-15])&IF(RC[-14]="",,"|n"&R1C19&RC[-14])&IF(RC[-13]="",,"|n"&R1C20&RC[-13])&IF(RC[-12]="",,"|n"&R1C21&RC[-12])&IF(RC[-11]="",,"|n"&R1C22&RC[-11])&IF(RC[-10]="",,"|n"&R1C23&RC[-10])&IF(RC[-9]="",,"|n"&R1C24&RC[-9])&IF(RC[-8]="",,"|n"&R1C25&RC[-8])&IF(RC[-7]="",,"|n"&R1C26&RC[-7])&IF(RC[-6]="",,"|n"&R1C27&RC[-6])&IF(RC[-5]="",,"|n"&R1C28&RC[-5])&IF(RC[-2]="",,"|n"&RC[-2]) -> 
AF252: =VLOOKUP(RC[-31],Sheet2!R13C1:R18C2,2,0)&"."&VLOOKUP(RC[-30],Sheet2!R7C1:R11C2,2,0)&VLOOKUP(RC[-30],Sheet2!R1C1:R5C2,2,0)&RC[-29]&RC[-28]&RC[-27]&Sheet2!R1C3 -> #N/A | AG252: =IF(RC[-26]&RC[-25]&RC[-24]&RC[-23]&RC[-22]&RC[-21]="",,R1C6)&IF(RC[-26]="",,"|n"&R1C7&RC[-26])&IF(RC[-25]="",,"|n"&R1C8&RC[-25])&IF(RC[-24]="",,"|n"&R1C9&RC[-24])&IF(RC[-23]="",,"|n"&R1C10&RC[-23])&IF(RC[-22]="",,"|n"&R1C11&RC[-22])&IF(RC[-21]="",,"|n"&R1C12&RC[-21])&IF(RC[-19]&RC[-18]&RC[-17]&RC[-16]="",,"|n"&R1C13)&IF(RC[-19]="",,"|n"&R1C14&RC[-19])&IF(RC[-18]="",,"|n"&R1C15&RC[-18])&IF(RC[-17]="",,"|n"&R1C16&RC[-17])&IF(RC[-16]="",,"|n"&R1C17&RC[-16])&IF(RC[-15]="",,"|n"&R1C18&RC[-15])&IF(RC[-14]="",,"|n"&R1C19&RC[-14])&IF(RC[-13]="",,"|n"&R1C20&RC[-13])&IF(RC[-12]="",,"|n"&R1C21&RC[-12])&IF(RC[-11]="",,"|n"&R1C22&RC[-11])&IF(RC[-10]="",,"|n"&R1C23&RC[-10])&IF(RC[-9]="",,"|n"&R1C24&RC[-9])&IF(RC[-8]="",,"|n"&R1C25&RC[-8])&IF(RC[-7]="",,"|n"&R1C26&RC[-7])&IF(RC[-6]="",,"|n"&R1C27&RC[-6])&IF(RC[-5]="",,"|n"&R1C28&RC[-5])&IF(RC[-2]="",,"|n"&RC[-2]) -> 
AF253: =VLOOKUP(RC[-31],Sheet2!R13C1:R18C2,2,0)&"."&VLOOKUP(RC[-30],Sheet2!R7C1:R11C2,2,0)&VLOOKUP(RC[-30],Sheet2!R1C1:R5C2,2,0)&RC[-29]&RC[-28]&RC[-27]&Sheet2!R1C3 -> #N/A | AG253: =IF(RC[-26]&RC[-25]&RC[-24]&RC[-23]&RC[-22]&RC[-21]="",,R1C6)&IF(RC[-26]="",,"|n"&R1C7&RC[-26])&IF(RC[-25]="",,"|n"&R1C8&RC[-25])&IF(RC[-24]="",,"|n"&R1C9&RC[-24])&IF(RC[-23]="",,"|n"&R1C10&RC[-23])&IF(RC[-22]="",,"|n"&R1C11&RC[-22])&IF(RC[-21]="",,"|n"&R1C12&RC[-21])&IF(RC[-19]&RC[-18]&RC[-17]&RC[-16]="",,"|n"&R1C13)&IF(RC[-19]="",,"|n"&R1C14&RC[-19])&IF(RC[-18]="",,"|n"&R1C15&RC[-18])&IF(RC[-17]="",,"|n"&R1C16&RC[-17])&IF(RC[-16]="",,"|n"&R1C17&RC[-16])&IF(RC[-15]="",,"|n"&R1C18&RC[-15])&IF(RC[-14]="",,"|n"&R1C19&RC[-14])&IF(RC[-13]="",,"|n"&R1C20&RC[-13])&IF(RC[-12]="",,"|n"&R1C21&RC[-12])&IF(RC[-11]="",,"|n"&R1C22&RC[-11])&IF(RC[-10]="",,"|n"&R1C23&RC[-10])&IF(RC[-9]="",,"|n"&R1C24&RC[-9])&IF(RC[-8]="",,"|n"&R1C25&RC[-8])&IF(RC[-7]="",,"|n"&R1C26&RC[-7])&IF(RC[-6]="",,"|n"&R1C27&RC[-6])&IF(RC[-5]="",,"|n"&R1C28&RC[-5])&IF(RC[-2]="",,"|n"&RC[-2]) -> 
AF254: =VLOOKUP(RC[-31],Sheet2!R13C1:R18C2,2,0)&"."&VLOOKUP(RC[-30],Sheet2!R7C1:R11C2,2,0)&VLOOKUP(RC[-30],Sheet2!R1C1:R5C2,2,0)&RC[-29]&RC[-28]&RC[-27]&Sheet2!R1C3 -> #N/A | AG254: =IF(RC[-26]&RC[-25]&RC[-24]&RC[-23]&RC[-22]&RC[-21]="",,R1C6)&IF(RC[-26]="",,"|n"&R1C7&RC[-26])&IF(RC[-25]="",,"|n"&R1C8&RC[-25])&IF(RC[-24]="",,"|n"&R1C9&RC[-24])&IF(RC[-23]="",,"|n"&R1C10&RC[-23])&IF(RC[-22]="",,"|n"&R1C11&RC[-22])&IF(RC[-21]="",,"|n"&R1C12&RC[-21])&IF(RC[-19]&RC[-18]&RC[-17]&RC[-16]="",,"|n"&R1C13)&IF(RC[-19]="",,"|n"&R1C14&RC[-19])&IF(RC[-18]="",,"|n"&R1C15&RC[-18])&IF(RC[-17]="",,"|n"&R1C16&RC[-17])&IF(RC[-16]="",,"|n"&R1C17&RC[-16])&IF(RC[-15]="",,"|n"&R1C18&RC[-15])&IF(RC[-14]="",,"|n"&R1C19&RC[-14])&IF(RC[-13]="",,"|n"&R1C20&RC[-13])&IF(RC[-12]="",,"|n"&R1C21&RC[-12])&IF(RC[-11]="",,"|n"&R1C22&RC[-11])&IF(RC[-10]="",,"|n"&R1C23&RC[-10])&IF(RC[-9]="",,"|n"&R1C24&RC[-9])&IF(RC[-8]="",,"|n"&R1C25&RC[-8])&IF(RC[-7]="",,"|n"&R1C26&RC[-7])&IF(RC[-6]="",,"|n"&R1C27&RC[-6])&IF(RC[-5]="",,"|n"&R1C28&RC[-5])&IF(RC[-2]="",,"|n"&RC[-2]) -> 
AF255: =VLOOKUP(RC[-31],Sheet2!R13C1:R18C2,2,0)&"."&VLOOKUP(RC[-30],Sheet2!R7C1:R11C2,2,0)&VLOOKUP(RC[-30],Sheet2!R1C1:R5C2,2,0)&RC[-29]&RC[-28]&RC[-27]&Sheet2!R1C3 -> #N/A | AG255: =IF(RC[-26]&RC[-25]&RC[-24]&RC[-23]&RC[-22]&RC[-21]="",,R1C6)&IF(RC[-26]="",,"|n"&R1C7&RC[-26])&IF(RC[-25]="",,"|n"&R1C8&RC[-25])&IF(RC[-24]="",,"|n"&R1C9&RC[-24])&IF(RC[-23]="",,"|n"&R1C10&RC[-23])&IF(RC[-22]="",,"|n"&R1C11&RC[-22])&IF(RC[-21]="",,"|n"&R1C12&RC[-21])&IF(RC[-19]&RC[-18]&RC[-17]&RC[-16]="",,"|n"&R1C13)&IF(RC[-19]="",,"|n"&R1C14&RC[-19])&IF(RC[-18]="",,"|n"&R1C15&RC[-18])&IF(RC[-17]="",,"|n"&R1C16&RC[-17])&IF(RC[-16]="",,"|n"&R1C17&RC[-16])&IF(RC[-15]="",,"|n"&R1C18&RC[-15])&IF(RC[-14]="",,"|n"&R1C19&RC[-14])&IF(RC[-13]="",,"|n"&R1C20&RC[-13])&IF(RC[-12]="",,"|n"&R1C21&RC[-12])&IF(RC[-11]="",,"|n"&R1C22&RC[-11])&IF(RC[-10]="",,"|n"&R1C23&RC[-10])&IF(RC[-9]="",,"|n"&R1C24&RC[-9])&IF(RC[-8]="",,"|n"&R1C25&RC[-8])&IF(RC[-7]="",,"|n"&R1C26&RC[-7])&IF(RC[-6]="",,"|n"&R1C27&RC[-6])&IF(RC[-5]="",,"|n"&R1C28&RC[-5])&IF(RC[-2]="",,"|n"&RC[-2]) -> 
AF256: =VLOOKUP(RC[-31],Sheet2!R13C1:R18C2,2,0)&"."&VLOOKUP(RC[-30],Sheet2!R7C1:R11C2,2,0)&VLOOKUP(RC[-30],Sheet2!R1C1:R5C2,2,0)&RC[-29]&RC[-28]&RC[-27]&Sheet2!R1C3 -> #N/A | AG256: =IF(RC[-26]&RC[-25]&RC[-24]&RC[-23]&RC[-22]&RC[-21]="",,R1C6)&IF(RC[-26]="",,"|n"&R1C7&RC[-26])&IF(RC[-25]="",,"|n"&R1C8&RC[-25])&IF(RC[-24]="",,"|n"&R1C9&RC[-24])&IF(RC[-23]="",,"|n"&R1C10&RC[-23])&IF(RC[-22]="",,"|n"&R1C11&RC[-22])&IF(RC[-21]="",,"|n"&R1C12&RC[-21])&IF(RC[-19]&RC[-18]&RC[-17]&RC[-16]="",,"|n"&R1C13)&IF(RC[-19]="",,"|n"&R1C14&RC[-19])&IF(RC[-18]="",,"|n"&R1C15&RC[-18])&IF(RC[-17]="",,"|n"&R1C16&RC[-17])&IF(RC[-16]="",,"|n"&R1C17&RC[-16])&IF(RC[-15]="",,"|n"&R1C18&RC[-15])&IF(RC[-14]="",,"|n"&R1C19&RC[-14])&IF(RC[-13]="",,"|n"&R1C20&RC[-13])&IF(RC[-12]="",,"|n"&R1C21&RC[-12])&IF(RC[-11]="",,"|n"&R1C22&RC[-11])&IF(RC[-10]="",,"|n"&R1C23&RC[-10])&IF(RC[-9]="",,"|n"&R1C24&RC[-9])&IF(RC[-8]="",,"|n"&R1C25&RC[-8])&IF(RC[-7]="",,"|n"&R1C26&RC[-7])&IF(RC[-6]="",,"|n"&R1C27&RC[-6])&IF(RC[-5]="",,"|n"&R1C28&RC[-5])&IF(RC[-2]="",,"|n"&RC[-2]) -> 
AF257: =VLOOKUP(RC[-31],Sheet2!R13C1:R18C2,2,0)&"."&VLOOKUP(RC[-30],Sheet2!R7C1:R11C2,2,0)&VLOOKUP(RC[-30],Sheet2!R1C1:R5C2,2,0)&RC[-29]&RC[-28]&RC[-27]&Sheet2!R1C3 -> #N/A | AG257: =IF(RC[-26]&RC[-25]&RC[-24]&RC[-23]&RC[-22]&RC[-21]="",,R1C6)&IF(RC[-26]="",,"|n"&R1C7&RC[-26])&IF(RC[-25]="",,"|n"&R1C8&RC[-25])&IF(RC[-24]="",,"|n"&R1C9&RC[-24])&IF(RC[-23]="",,"|n"&R1C10&RC[-23])&IF(RC[-22]="",,"|n"&R1C11&RC[-22])&IF(RC[-21]="",,"|n"&R1C12&RC[-21])&IF(RC[-19]&RC[-18]&RC[-17]&RC[-16]="",,"|n"&R1C13)&IF(RC[-19]="",,"|n"&R1C14&RC[-19])&IF(RC[-18]="",,"|n"&R1C15&RC[-18])&IF(RC[-17]="",,"|n"&R1C16&RC[-17])&IF(RC[-16]="",,"|n"&R1C17&RC[-16])&IF(RC[-15]="",,"|n"&R1C18&RC[-15])&IF(RC[-14]="",,"|n"&R1C19&RC[-14])&IF(RC[-13]="",,"|n"&R1C20&RC[-13])&IF(RC[-12]="",,"|n"&R1C21&RC[-12])&IF(RC[-11]="",,"|n"&R1C22&RC[-11])&IF(RC[-10]="",,"|n"&R1C23&RC[-10])&IF(RC[-9]="",,"|n"&R1C24&RC[-9])&IF(RC[-8]="",,"|n"&R1C25&RC[-8])&IF(RC[-7]="",,"|n"&R1C26&RC[-7])&IF(RC[-6]="",,"|n"&R1C27&RC[-6])&IF(RC[-5]="",,"|n"&R1C28&RC[-5])&IF(RC[-2]="",,"|n"&RC[-2]) -> 
AF258: =VLOOKUP(RC[-31],Sheet2!R13C1:R18C2,2,0)&"."&VLOOKUP(RC[-30],Sheet2!R7C1:R11C2,2,0)&VLOOKUP(RC[-30],Sheet2!R1C1:R5C2,2,0)&RC[-29]&RC[-28]&RC[-27]&Sheet2!R1C3 -> #N/A | AG258: =IF(RC[-26]&RC[-25]&RC[-24]&RC[-23]&RC[-22]&RC[-21]="",,R1C6)&IF(RC[-26]="",,"|n"&R1C7&RC[-26])&IF(RC[-25]="",,"|n"&R1C8&RC[-25])&IF(RC[-24]="",,"|n"&R1C9&RC[-24])&IF(RC[-23]="",,"|n"&R1C10&RC[-23])&IF(RC[-22]="",,"|n"&R1C11&RC[-22])&IF(RC[-21]="",,"|n"&R1C12&RC[-21])&IF(RC[-19]&RC[-18]&RC[-17]&RC[-16]="",,"|n"&R1C13)&IF(RC[-19]="",,"|n"&R1C14&RC[-19])&IF(RC[-18]="",,"|n"&R1C15&RC[-18])&IF(RC[-17]="",,"|n"&R1C16&RC[-17])&IF(RC[-16]="",,"|n"&R1C17&RC[-16])&IF(RC[-15]="",,"|n"&R1C18&RC[-15])&IF(RC[-14]="",,"|n"&R1C19&RC[-14])&IF(RC[-13]="",,"|n"&R1C20&RC[-13])&IF(RC[-12]="",,"|n"&R1C21&RC[-12])&IF(RC[-11]="",,"|n"&R1C22&RC[-11])&IF(RC[-10]="",,"|n"&R1C23&RC[-10])&IF(RC[-9]="",,"|n"&R1C24&RC[-9])&IF(RC[-8]="",,"|n"&R1C25&RC[-8])&IF(RC[-7]="",,"|n"&R1C26&RC[-7])&IF(RC[-6]="",,"|n"&R1C27&RC[-6])&IF(RC[-5]="",,"|n"&R1C28&RC[-5])&IF(RC[-2]="",,"|n"&RC[-2]) -> 
AF259: =VLOOKUP(RC[-31],Sheet2!R13C1:R18C2,2,0)&"."&VLOOKUP(RC[-30],Sheet2!R7C1:R11C2,2,0)&VLOOKUP(RC[-30],Sheet2!R1C1:R5C2,2,0)&RC[-29]&RC[-28]&RC[-27]&Sheet2!R1C3 -> #N/A | AG259: =IF(RC[-26]&RC[-25]&RC[-24]&RC[-23]&RC[-22]&RC[-21]="",,R1C6)&IF(RC[-26]="",,"|n"&R1C7&RC[-26])&IF(RC[-25]="",,"|n"&R1C8&RC[-25])&IF(RC[-24]="",,"|n"&R1C9&RC[-24])&IF(RC[-23]="",,"|n"&R1C10&RC[-23])&IF(RC[-22]="",,"|n"&R1C11&RC[-22])&IF(RC[-21]="",,"|n"&R1C12&RC[-21])&IF(RC[-19]&RC[-18]&RC[-17]&RC[-16]="",,"|n"&R1C13)&IF(RC[-19]="",,"|n"&R1C14&RC[-19])&IF(RC[-18]="",,"|n"&R1C15&RC[-18])&IF(RC[-17]="",,"|n"&R1C16&RC[-17])&IF(RC[-16]="",,"|n"&R1C17&RC[-16])&IF(RC[-15]="",,"|n"&R1C18&RC[-15])&IF(RC[-14]="",,"|n"&R1C19&RC[-14])&IF(RC[-13]="",,"|n"&R1C20&RC[-13])&IF(RC[-12]="",,"|n"&R1C21&RC[-12])&IF(RC[-11]="",,"|n"&R1C22&RC[-11])&IF(RC[-10]="",,"|n"&R1C23&RC[-10])&IF(RC[-9]="",,"|n"&R1C24&RC[-9])&IF(RC[-8]="",,"|n"&R1C25&RC[-8])&IF(RC[-7]="",,"|n"&R1C26&RC[-7])&IF(RC[-6]="",,"|n"&R1C27&RC[-6])&IF(RC[-5]="",,"|n"&R1C28&RC[-5])&IF(RC[-2]="",,"|n"&RC[-2]) -> 
AF260: =VLOOKUP(RC[-31],Sheet2!R13C1:R18C2,2,0)&"."&VLOOKUP(RC[-30],Sheet2!R7C1:R11C2,2,0)&VLOOKUP(RC[-30],Sheet2!R1C1:R5C2,2,0)&RC[-29]&RC[-28]&RC[-27]&Sheet2!R1C3 -> #N/A | AG260: =IF(RC[-26]&RC[-25]&RC[-24]&RC[-23]&RC[-22]&RC[-21]="",,R1C6)&IF(RC[-26]="",,"|n"&R1C7&RC[-26])&IF(RC[-25]="",,"|n"&R1C8&RC[-25])&IF(RC[-24]="",,"|n"&R1C9&RC[-24])&IF(RC[-23]="",,"|n"&R1C10&RC[-23])&IF(RC[-22]="",,"|n"&R1C11&RC[-22])&IF(RC[-21]="",,"|n"&R1C12&RC[-21])&IF(RC[-19]&RC[-18]&RC[-17]&RC[-16]="",,"|n"&R1C13)&IF(RC[-19]="",,"|n"&R1C14&RC[-19])&IF(RC[-18]="",,"|n"&R1C15&RC[-18])&IF(RC[-17]="",,"|n"&R1C16&RC[-17])&IF(RC[-16]="",,"|n"&R1C17&RC[-16])&IF(RC[-15]="",,"|n"&R1C18&RC[-15])&IF(RC[-14]="",,"|n"&R1C19&RC[-14])&IF(RC[-13]="",,"|n"&R1C20&RC[-13])&IF(RC[-12]="",,"|n"&R1C21&RC[-12])&IF(RC[-11]="",,"|n"&R1C22&RC[-11])&IF(RC[-10]="",,"|n"&R1C23&RC[-10])&IF(RC[-9]="",,"|n"&R1C24&RC[-9])&IF(RC[-8]="",,"|n"&R1C25&RC[-8])&IF(RC[-7]="",,"|n"&R1C26&RC[-7])&IF(RC[-6]="",,"|n"&R1C27&RC[-6])&IF(RC[-5]="",,"|n"&R1C28&RC[-5])&IF(RC[-2]="",,"|n"&RC[-2]) -> 
AF261: =VLOOKUP(RC[-31],Sheet2!R13C1:R18C2,2,0)&"."&VLOOKUP(RC[-30],Sheet2!R7C1:R11C2,2,0)&VLOOKUP(RC[-30],Sheet2!R1C1:R5C2,2,0)&RC[-29]&RC[-28]&RC[-27]&Sheet2!R1C3 -> #N/A | AG261: =IF(RC[-26]&RC[-25]&RC[-24]&RC[-23]&RC[-22]&RC[-21]="",,R1C6)&IF(RC[-26]="",,"|n"&R1C7&RC[-26])&IF(RC[-25]="",,"|n"&R1C8&RC[-25])&IF(RC[-24]="",,"|n"&R1C9&RC[-24])&IF(RC[-23]="",,"|n"&R1C10&RC[-23])&IF(RC[-22]="",,"|n"&R1C11&RC[-22])&IF(RC[-21]="",,"|n"&R1C12&RC[-21])&IF(RC[-19]&RC[-18]&RC[-17]&RC[-16]="",,"|n"&R1C13)&IF(RC[-19]="",,"|n"&R1C14&RC[-19])&IF(RC[-18]="",,"|n"&R1C15&RC[-18])&IF(RC[-17]="",,"|n"&R1C16&RC[-17])&IF(RC[-16]="",,"|n"&R1C17&RC[-16])&IF(RC[-15]="",,"|n"&R1C18&RC[-15])&IF(RC[-14]="",,"|n"&R1C19&RC[-14])&IF(RC[-13]="",,"|n"&R1C20&RC[-13])&IF(RC[-12]="",,"|n"&R1C21&RC[-12])&IF(RC[-11]="",,"|n"&R1C22&RC[-11])&IF(RC[-10]="",,"|n"&R1C23&RC[-10])&IF(RC[-9]="",,"|n"&R1C24&RC[-9])&IF(RC[-8]="",,"|n"&R1C25&RC[-8])&IF(RC[-7]="",,"|n"&R1C26&RC[-7])&IF(RC[-6]="",,"|n"&R1C27&RC[-6])&IF(RC[-5]="",,"|n"&R1C28&RC[-5])&IF(RC[-2]="",,"|n"&RC[-2]) -> 
AF262: =VLOOKUP(RC[-31],Sheet2!R13C1:R18C2,2,0)&"."&VLOOKUP(RC[-30],Sheet2!R7C1:R11C2,2,0)&VLOOKUP(RC[-30],Sheet2!R1C1:R5C2,2,0)&RC[-29]&RC[-28]&RC[-27]&Sheet2!R1C3 -> #N/A | AG262: =IF(RC[-26]&RC[-25]&RC[-24]&RC[-23]&RC[-22]&RC[-21]="",,R1C6)&IF(RC[-26]="",,"|n"&R1C7&RC[-26])&IF(RC[-25]="",,"|n"&R1C8&RC[-25])&IF(RC[-24]="",,"|n"&R1C9&RC[-24])&IF(RC[-23]="",,"|n"&R1C10&RC[-23])&IF(RC[-22]="",,"|n"&R1C11&RC[-22])&IF(RC[-21]="",,"|n"&R1C12&RC[-21])&IF(RC[-19]&RC[-18]&RC[-17]&RC[-16]="",,"|n"&R1C13)&IF(RC[-19]="",,"|n"&R1C14&RC[-19])&IF(RC[-18]="",,"|n"&R1C15&RC[-18])&IF(RC[-17]="",,"|n"&R1C16&RC[-17])&IF(RC[-16]="",,"|n"&R1C17&RC[-16])&IF(RC[-15]="",,"|n"&R1C18&RC[-15])&IF(RC[-14]="",,"|n"&R1C19&RC[-14])&IF(RC[-13]="",,"|n"&R1C20&RC[-13])&IF(RC[-12]="",,"|n"&R1C21&RC[-12])&IF(RC[-11]="",,"|n"&R1C22&RC[-11])&IF(RC[-10]="",,"|n"&R1C23&RC[-10])&IF(RC[-9]="",,"|n"&R1C24&RC[-9])&IF(RC[-8]="",,"|n"&R1C25&RC[-8])&IF(RC[-7]="",,"|n"&R1C26&RC[-7])&IF(RC[-6]="",,"|n"&R1C27&RC[-6])&IF(RC[-5]="",,"|n"&R1C28&RC[-5])&IF(RC[-2]="",,"|n"&RC[-2]) -> 
AF263: =VLOOKUP(RC[-31],Sheet2!R13C1:R18C2,2,0)&"."&VLOOKUP(RC[-30],Sheet2!R7C1:R11C2,2,0)&VLOOKUP(RC[-30],Sheet2!R1C1:R5C2,2,0)&RC[-29]&RC[-28]&RC[-27]&Sheet2!R1C3 -> #N/A | AG263: =IF(RC[-26]&RC[-25]&RC[-24]&RC[-23]&RC[-22]&RC[-21]="",,R1C6)&IF(RC[-26]="",,"|n"&R1C7&RC[-26])&IF(RC[-25]="",,"|n"&R1C8&RC[-25])&IF(RC[-24]="",,"|n"&R1C9&RC[-24])&IF(RC[-23]="",,"|n"&R1C10&RC[-23])&IF(RC[-22]="",,"|n"&R1C11&RC[-22])&IF(RC[-21]="",,"|n"&R1C12&RC[-21])&IF(RC[-19]&RC[-18]&RC[-17]&RC[-16]="",,"|n"&R1C13)&IF(RC[-19]="",,"|n"&R1C14&RC[-19])&IF(RC[-18]="",,"|n"&R1C15&RC[-18])&IF(RC[-17]="",,"|n"&R1C16&RC[-17])&IF(RC[-16]="",,"|n"&R1C17&RC[-16])&IF(RC[-15]="",,"|n"&R1C18&RC[-15])&IF(RC[-14]="",,"|n"&R1C19&RC[-14])&IF(RC[-13]="",,"|n"&R1C20&RC[-13])&IF(RC[-12]="",,"|n"&R1C21&RC[-12])&IF(RC[-11]="",,"|n"&R1C22&RC[-11])&IF(RC[-10]="",,"|n"&R1C23&RC[-10])&IF(RC[-9]="",,"|n"&R1C24&RC[-9])&IF(RC[-8]="",,"|n"&R1C25&RC[-8])&IF(RC[-7]="",,"|n"&R1C26&RC[-7])&IF(RC[-6]="",,"|n"&R1C27&RC[-6])&IF(RC[-5]="",,"|n"&R1C28&RC[-5])&IF(RC[-2]="",,"|n"&RC[-2]) -> 
AF264: =VLOOKUP(RC[-31],Sheet2!R13C1:R18C2,2,0)&"."&VLOOKUP(RC[-30],Sheet2!R7C1:R11C2,2,0)&VLOOKUP(RC[-30],Sheet2!R1C1:R5C2,2,0)&RC[-29]&RC[-28]&RC[-27]&Sheet2!R1C3 -> #N/A | AG264: =IF(RC[-26]&RC[-25]&RC[-24]&RC[-23]&RC[-22]&RC[-21]="",,R1C6)&IF(RC[-26]="",,"|n"&R1C7&RC[-26])&IF(RC[-25]="",,"|n"&R1C8&RC[-25])&IF(RC[-24]="",,"|n"&R1C9&RC[-24])&IF(RC[-23]="",,"|n"&R1C10&RC[-23])&IF(RC[-22]="",,"|n"&R1C11&RC[-22])&IF(RC[-21]="",,"|n"&R1C12&RC[-21])&IF(RC[-19]&RC[-18]&RC[-17]&RC[-16]="",,"|n"&R1C13)&IF(RC[-19]="",,"|n"&R1C14&RC[-19])&IF(RC[-18]="",,"|n"&R1C15&RC[-18])&IF(RC[-17]="",,"|n"&R1C16&RC[-17])&IF(RC[-16]="",,"|n"&R1C17&RC[-16])&IF(RC[-15]="",,"|n"&R1C18&RC[-15])&IF(RC[-14]="",,"|n"&R1C19&RC[-14])&IF(RC[-13]="",,"|n"&R1C20&RC[-13])&IF(RC[-12]="",,"|n"&R1C21&RC[-12])&IF(RC[-11]="",,"|n"&R1C22&RC[-11])&IF(RC[-10]="",,"|n"&R1C23&RC[-10])&IF(RC[-9]="",,"|n"&R1C24&RC[-9])&IF(RC[-8]="",,"|n"&R1C25&RC[-8])&IF(RC[-7]="",,"|n"&R1C26&RC[-7])&IF(RC[-6]="",,"|n"&R1C27&RC[-6])&IF(RC[-5]="",,"|n"&R1C28&RC[-5])&IF(RC[-2]="",,"|n"&RC[-2]) -> 
AF265: =VLOOKUP(RC[-31],Sheet2!R13C1:R18C2,2,0)&"."&VLOOKUP(RC[-30],Sheet2!R7C1:R11C2,2,0)&VLOOKUP(RC[-30],Sheet2!R1C1:R5C2,2,0)&RC[-29]&RC[-28]&RC[-27]&Sheet2!R1C3 -> #N/A | AG265: =IF(RC[-26]&RC[-25]&RC[-24]&RC[-23]&RC[-22]&RC[-21]="",,R1C6)&IF(RC[-26]="",,"|n"&R1C7&RC[-26])&IF(RC[-25]="",,"|n"&R1C8&RC[-25])&IF(RC[-24]="",,"|n"&R1C9&RC[-24])&IF(RC[-23]="",,"|n"&R1C10&RC[-23])&IF(RC[-22]="",,"|n"&R1C11&RC[-22])&IF(RC[-21]="",,"|n"&R1C12&RC[-21])&IF(RC[-19]&RC[-18]&RC[-17]&RC[-16]="",,"|n"&R1C13)&IF(RC[-19]="",,"|n"&R1C14&RC[-19])&IF(RC[-18]="",,"|n"&R1C15&RC[-18])&IF(RC[-17]="",,"|n"&R1C16&RC[-17])&IF(RC[-16]="",,"|n"&R1C17&RC[-16])&IF(RC[-15]="",,"|n"&R1C18&RC[-15])&IF(RC[-14]="",,"|n"&R1C19&RC[-14])&IF(RC[-13]="",,"|n"&R1C20&RC[-13])&IF(RC[-12]="",,"|n"&R1C21&RC[-12])&IF(RC[-11]="",,"|n"&R1C22&RC[-11])&IF(RC[-10]="",,"|n"&R1C23&RC[-10])&IF(RC[-9]="",,"|n"&R1C24&RC[-9])&IF(RC[-8]="",,"|n"&R1C25&RC[-8])&IF(RC[-7]="",,"|n"&R1C26&RC[-7])&IF(RC[-6]="",,"|n"&R1C27&RC[-6])&IF(RC[-5]="",,"|n"&R1C28&RC[-5])&IF(RC[-2]="",,"|n"&RC[-2]) -> 
AF266: =VLOOKUP(RC[-31],Sheet2!R13C1:R18C2,2,0)&"."&VLOOKUP(RC[-30],Sheet2!R7C1:R11C2,2,0)&VLOOKUP(RC[-30],Sheet2!R1C1:R5C2,2,0)&RC[-29]&RC[-28]&RC[-27]&Sheet2!R1C3 -> #N/A | AG266: =IF(RC[-26]&RC[-25]&RC[-24]&RC[-23]&RC[-22]&RC[-21]="",,R1C6)&IF(RC[-26]="",,"|n"&R1C7&RC[-26])&IF(RC[-25]="",,"|n"&R1C8&RC[-25])&IF(RC[-24]="",,"|n"&R1C9&RC[-24])&IF(RC[-23]="",,"|n"&R1C10&RC[-23])&IF(RC[-22]="",,"|n"&R1C11&RC[-22])&IF(RC[-21]="",,"|n"&R1C12&RC[-21])&IF(RC[-19]&RC[-18]&RC[-17]&RC[-16]="",,"|n"&R1C13)&IF(RC[-19]="",,"|n"&R1C14&RC[-19])&IF(RC[-18]="",,"|n"&R1C15&RC[-18])&IF(RC[-17]="",,"|n"&R1C16&RC[-17])&IF(RC[-16]="",,"|n"&R1C17&RC[-16])&IF(RC[-15]="",,"|n"&R1C18&RC[-15])&IF(RC[-14]="",,"|n"&R1C19&RC[-14])&IF(RC[-13]="",,"|n"&R1C20&RC[-13])&IF(RC[-12]="",,"|n"&R1C21&RC[-12])&IF(RC[-11]="",,"|n"&R1C22&RC[-11])&IF(RC[-10]="",,"|n"&R1C23&RC[-10])&IF(RC[-9]="",,"|n"&R1C24&RC[-9])&IF(RC[-8]="",,"|n"&R1C25&RC[-8])&IF(RC[-7]="",,"|n"&R1C26&RC[-7])&IF(RC[-6]="",,"|n"&R1C27&RC[-6])&IF(RC[-5]="",,"|n"&R1C28&RC[-5])&IF(RC[-2]="",,"|n"&RC[-2]) -> 
AF267: =VLOOKUP(RC[-31],Sheet2!R13C1:R18C2,2,0)&"."&VLOOKUP(RC[-30],Sheet2!R7C1:R11C2,2,0)&VLOOKUP(RC[-30],Sheet2!R1C1:R5C2,2,0)&RC[-29]&RC[-28]&RC[-27]&Sheet2!R1C3 -> #N/A | AG267: =IF(RC[-26]&RC[-25]&RC[-24]&RC[-23]&RC[-22]&RC[-21]="",,R1C6)&IF(RC[-26]="",,"|n"&R1C7&RC[-26])&IF(RC[-25]="",,"|n"&R1C8&RC[-25])&IF(RC[-24]="",,"|n"&R1C9&RC[-24])&IF(RC[-23]="",,"|n"&R1C10&RC[-23])&IF(RC[-22]="",,"|n"&R1C11&RC[-22])&IF(RC[-21]="",,"|n"&R1C12&RC[-21])&IF(RC[-19]&RC[-18]&RC[-17]&RC[-16]="",,"|n"&R1C13)&IF(RC[-19]="",,"|n"&R1C14&RC[-19])&IF(RC[-18]="",,"|n"&R1C15&RC[-18])&IF(RC[-17]="",,"|n"&R1C16&RC[-17])&IF(RC[-16]="",,"|n"&R1C17&RC[-16])&IF(RC[-15]="",,"|n"&R1C18&RC[-15])&IF(RC[-14]="",,"|n"&R1C19&RC[-14])&IF(RC[-13]="",,"|n"&R1C20&RC[-13])&IF(RC[-12]="",,"|n"&R1C21&RC[-12])&IF(RC[-11]="",,"|n"&R1C22&RC[-11])&IF(RC[-10]="",,"|n"&R1C23&RC[-10])&IF(RC[-9]="",,"|n"&R1C24&RC[-9])&IF(RC[-8]="",,"|n"&R1C25&RC[-8])&IF(RC[-7]="",,"|n"&R1C26&RC[-7])&IF(RC[-6]="",,"|n"&R1C27&RC[-6])&IF(RC[-5]="",,"|n"&R1C28&RC[-5])&IF(RC[-2]="",,"|n"&RC[-2]) -> 
AF268: =VLOOKUP(RC[-31],Sheet2!R13C1:R18C2,2,0)&"."&VLOOKUP(RC[-30],Sheet2!R7C1:R11C2,2,0)&VLOOKUP(RC[-30],Sheet2!R1C1:R5C2,2,0)&RC[-29]&RC[-28]&RC[-27]&Sheet2!R1C3 -> #N/A | AG268: =IF(RC[-26]&RC[-25]&RC[-24]&RC[-23]&RC[-22]&RC[-21]="",,R1C6)&IF(RC[-26]="",,"|n"&R1C7&RC[-26])&IF(RC[-25]="",,"|n"&R1C8&RC[-25])&IF(RC[-24]="",,"|n"&R1C9&RC[-24])&IF(RC[-23]="",,"|n"&R1C10&RC[-23])&IF(RC[-22]="",,"|n"&R1C11&RC[-22])&IF(RC[-21]="",,"|n"&R1C12&RC[-21])&IF(RC[-19]&RC[-18]&RC[-17]&RC[-16]="",,"|n"&R1C13)&IF(RC[-19]="",,"|n"&R1C14&RC[-19])&IF(RC[-18]="",,"|n"&R1C15&RC[-18])&IF(RC[-17]="",,"|n"&R1C16&RC[-17])&IF(RC[-16]="",,"|n"&R1C17&RC[-16])&IF(RC[-15]="",,"|n"&R1C18&RC[-15])&IF(RC[-14]="",,"|n"&R1C19&RC[-14])&IF(RC[-13]="",,"|n"&R1C20&RC[-13])&IF(RC[-12]="",,"|n"&R1C21&RC[-12])&IF(RC[-11]="",,"|n"&R1C22&RC[-11])&IF(RC[-10]="",,"|n"&R1C23&RC[-10])&IF(RC[-9]="",,"|n"&R1C24&RC[-9])&IF(RC[-8]="",,"|n"&R1C25&RC[-8])&IF(RC[-7]="",,"|n"&R1C26&RC[-7])&IF(RC[-6]="",,"|n"&R1C27&RC[-6])&IF(RC[-5]="",,"|n"&R1C28&RC[-5])&IF(RC[-2]="",,"|n"&RC[-2]) -> 
AF269: =VLOOKUP(RC[-31],Sheet2!R13C1:R18C2,2,0)&"."&VLOOKUP(RC[-30],Sheet2!R7C1:R11C2,2,0)&VLOOKUP(RC[-30],Sheet2!R1C1:R5C2,2,0)&RC[-29]&RC[-28]&RC[-27]&Sheet2!R1C3 -> #N/A | AG269: =IF(RC[-26]&RC[-25]&RC[-24]&RC[-23]&RC[-22]&RC[-21]="",,R1C6)&IF(RC[-26]="",,"|n"&R1C7&RC[-26])&IF(RC[-25]="",,"|n"&R1C8&RC[-25])&IF(RC[-24]="",,"|n"&R1C9&RC[-24])&IF(RC[-23]="",,"|n"&R1C10&RC[-23])&IF(RC[-22]="",,"|n"&R1C11&RC[-22])&IF(RC[-21]="",,"|n"&R1C12&RC[-21])&IF(RC[-19]&RC[-18]&RC[-17]&RC[-16]="",,"|n"&R1C13)&IF(RC[-19]="",,"|n"&R1C14&RC[-19])&IF(RC[-18]="",,"|n"&R1C15&RC[-18])&IF(RC[-17]="",,"|n"&R1C16&RC[-17])&IF(RC[-16]="",,"|n"&R1C17&RC[-16])&IF(RC[-15]="",,"|n"&R1C18&RC[-15])&IF(RC[-14]="",,"|n"&R1C19&RC[-14])&IF(RC[-13]="",,"|n"&R1C20&RC[-13])&IF(RC[-12]="",,"|n"&R1C21&RC[-12])&IF(RC[-11]="",,"|n"&R1C22&RC[-11])&IF(RC[-10]="",,"|n"&R1C23&RC[-10])&IF(RC[-9]="",,"|n"&R1C24&RC[-9])&IF(RC[-8]="",,"|n"&R1C25&RC[-8])&IF(RC[-7]="",,"|n"&R1C26&RC[-7])&IF(RC[-6]="",,"|n"&R1C27&RC[-6])&IF(RC[-5]="",,"|n"&R1C28&RC[-5])&IF(RC[-2]="",,"|n"&RC[-2]) -> 
AF270: =VLOOKUP(RC[-31],Sheet2!R13C1:R18C2,2,0)&"."&VLOOKUP(RC[-30],Sheet2!R7C1:R11C2,2,0)&VLOOKUP(RC[-30],Sheet2!R1C1:R5C2,2,0)&RC[-29]&RC[-28]&RC[-27]&Sheet2!R1C3 -> #N/A | AG270: =IF(RC[-26]&RC[-25]&RC[-24]&RC[-23]&RC[-22]&RC[-21]="",,R1C6)&IF(RC[-26]="",,"|n"&R1C7&RC[-26])&IF(RC[-25]="",,"|n"&R1C8&RC[-25])&IF(RC[-24]="",,"|n"&R1C9&RC[-24])&IF(RC[-23]="",,"|n"&R1C10&RC[-23])&IF(RC[-22]="",,"|n"&R1C11&RC[-22])&IF(RC[-21]="",,"|n"&R1C12&RC[-21])&IF(RC[-19]&RC[-18]&RC[-17]&RC[-16]="",,"|n"&R1C13)&IF(RC[-19]="",,"|n"&R1C14&RC[-19])&IF(RC[-18]="",,"|n"&R1C15&RC[-18])&IF(RC[-17]="",,"|n"&R1C16&RC[-17])&IF(RC[-16]="",,"|n"&R1C17&RC[-16])&IF(RC[-15]="",,"|n"&R1C18&RC[-15])&IF(RC[-14]="",,"|n"&R1C19&RC[-14])&IF(RC[-13]="",,"|n"&R1C20&RC[-13])&IF(RC[-12]="",,"|n"&R1C21&RC[-12])&IF(RC[-11]="",,"|n"&R1C22&RC[-11])&IF(RC[-10]="",,"|n"&R1C23&RC[-10])&IF(RC[-9]="",,"|n"&R1C24&RC[-9])&IF(RC[-8]="",,"|n"&R1C25&RC[-8])&IF(RC[-7]="",,"|n"&R1C26&RC[-7])&IF(RC[-6]="",,"|n"&R1C27&RC[-6])&IF(RC[-5]="",,"|n"&R1C28&RC[-5])&IF(RC[-2]="",,"|n"&RC[-2]) -> 
AF271: =VLOOKUP(RC[-31],Sheet2!R13C1:R18C2,2,0)&"."&VLOOKUP(RC[-30],Sheet2!R7C1:R11C2,2,0)&VLOOKUP(RC[-30],Sheet2!R1C1:R5C2,2,0)&RC[-29]&RC[-28]&RC[-27]&Sheet2!R1C3 -> #N/A | AG271: =IF(RC[-26]&RC[-25]&RC[-24]&RC[-23]&RC[-22]&RC[-21]="",,R1C6)&IF(RC[-26]="",,"|n"&R1C7&RC[-26])&IF(RC[-25]="",,"|n"&R1C8&RC[-25])&IF(RC[-24]="",,"|n"&R1C9&RC[-24])&IF(RC[-23]="",,"|n"&R1C10&RC[-23])&IF(RC[-22]="",,"|n"&R1C11&RC[-22])&IF(RC[-21]="",,"|n"&R1C12&RC[-21])&IF(RC[-19]&RC[-18]&RC[-17]&RC[-16]="",,"|n"&R1C13)&IF(RC[-19]="",,"|n"&R1C14&RC[-19])&IF(RC[-18]="",,"|n"&R1C15&RC[-18])&IF(RC[-17]="",,"|n"&R1C16&RC[-17])&IF(RC[-16]="",,"|n"&R1C17&RC[-16])&IF(RC[-15]="",,"|n"&R1C18&RC[-15])&IF(RC[-14]="",,"|n"&R1C19&RC[-14])&IF(RC[-13]="",,"|n"&R1C20&RC[-13])&IF(RC[-12]="",,"|n"&R1C21&RC[-12])&IF(RC[-11]="",,"|n"&R1C22&RC[-11])&IF(RC[-10]="",,"|n"&R1C23&RC[-10])&IF(RC[-9]="",,"|n"&R1C24&RC[-9])&IF(RC[-8]="",,"|n"&R1C25&RC[-8])&IF(RC[-7]="",,"|n"&R1C26&RC[-7])&IF(RC[-6]="",,"|n"&R1C27&RC[-6])&IF(RC[-5]="",,"|n"&R1C28&RC[-5])&IF(RC[-2]="",,"|n"&RC[-2]) -> 
AF272: =VLOOKUP(RC[-31],Sheet2!R13C1:R18C2,2,0)&"."&VLOOKUP(RC[-30],Sheet2!R7C1:R11C2,2,0)&VLOOKUP(RC[-30],Sheet2!R1C1:R5C2,2,0)&RC[-29]&RC[-28]&RC[-27]&Sheet2!R1C3 -> #N/A | AG272: =IF(RC[-26]&RC[-25]&RC[-24]&RC[-23]&RC[-22]&RC[-21]="",,R1C6)&IF(RC[-26]="",,"|n"&R1C7&RC[-26])&IF(RC[-25]="",,"|n"&R1C8&RC[-25])&IF(RC[-24]="",,"|n"&R1C9&RC[-24])&IF(RC[-23]="",,"|n"&R1C10&RC[-23])&IF(RC[-22]="",,"|n"&R1C11&RC[-22])&IF(RC[-21]="",,"|n"&R1C12&RC[-21])&IF(RC[-19]&RC[-18]&RC[-17]&RC[-16]="",,"|n"&R1C13)&IF(RC[-19]="",,"|n"&R1C14&RC[-19])&IF(RC[-18]="",,"|n"&R1C15&RC[-18])&IF(RC[-17]="",,"|n"&R1C16&RC[-17])&IF(RC[-16]="",,"|n"&R1C17&RC[-16])&IF(RC[-15]="",,"|n"&R1C18&RC[-15])&IF(RC[-14]="",,"|n"&R1C19&RC[-14])&IF(RC[-13]="",,"|n"&R1C20&RC[-13])&IF(RC[-12]="",,"|n"&R1C21&RC[-12])&IF(RC[-11]="",,"|n"&R1C22&RC[-11])&IF(RC[-10]="",,"|n"&R1C23&RC[-10])&IF(RC[-9]="",,"|n"&R1C24&RC[-9])&IF(RC[-8]="",,"|n"&R1C25&RC[-8])&IF(RC[-7]="",,"|n"&R1C26&RC[-7])&IF(RC[-6]="",,"|n"&R1C27&RC[-6])&IF(RC[-5]="",,"|n"&R1C28&RC[-5])&IF(RC[-2]="",,"|n"&RC[-2]) -> 
AF273: =VLOOKUP(RC[-31],Sheet2!R13C1:R18C2,2,0)&"."&VLOOKUP(RC[-30],Sheet2!R7C1:R11C2,2,0)&VLOOKUP(RC[-30],Sheet2!R1C1:R5C2,2,0)&RC[-29]&RC[-28]&RC[-27]&Sheet2!R1C3 -> #N/A | AG273: =IF(RC[-26]&RC[-25]&RC[-24]&RC[-23]&RC[-22]&RC[-21]="",,R1C6)&IF(RC[-26]="",,"|n"&R1C7&RC[-26])&IF(RC[-25]="",,"|n"&R1C8&RC[-25])&IF(RC[-24]="",,"|n"&R1C9&RC[-24])&IF(RC[-23]="",,"|n"&R1C10&RC[-23])&IF(RC[-22]="",,"|n"&R1C11&RC[-22])&IF(RC[-21]="",,"|n"&R1C12&RC[-21])&IF(RC[-19]&RC[-18]&RC[-17]&RC[-16]="",,"|n"&R1C13)&IF(RC[-19]="",,"|n"&R1C14&RC[-19])&IF(RC[-18]="",,"|n"&R1C15&RC[-18])&IF(RC[-17]="",,"|n"&R1C16&RC[-17])&IF(RC[-16]="",,"|n"&R1C17&RC[-16])&IF(RC[-15]="",,"|n"&R1C18&RC[-15])&IF(RC[-14]="",,"|n"&R1C19&RC[-14])&IF(RC[-13]="",,"|n"&R1C20&RC[-13])&IF(RC[-12]="",,"|n"&R1C21&RC[-12])&IF(RC[-11]="",,"|n"&R1C22&RC[-11])&IF(RC[-10]="",,"|n"&R1C23&RC[-10])&IF(RC[-9]="",,"|n"&R1C24&RC[-9])&IF(RC[-8]="",,"|n"&R1C25&RC[-8])&IF(RC[-7]="",,"|n"&R1C26&RC[-7])&IF(RC[-6]="",,"|n"&R1C27&RC[-6])&IF(RC[-5]="",,"|n"&R1C28&RC[-5])&IF(RC[-2]="",,"|n"&RC[-2]) -> 
AF274: =VLOOKUP(RC[-31],Sheet2!R13C1:R18C2,2,0)&"."&VLOOKUP(RC[-30],Sheet2!R7C1:R11C2,2,0)&VLOOKUP(RC[-30],Sheet2!R1C1:R5C2,2,0)&RC[-29]&RC[-28]&RC[-27]&Sheet2!R1C3 -> #N/A | AG274: =IF(RC[-26]&RC[-25]&RC[-24]&RC[-23]&RC[-22]&RC[-21]="",,R1C6)&IF(RC[-26]="",,"|n"&R1C7&RC[-26])&IF(RC[-25]="",,"|n"&R1C8&RC[-25])&IF(RC[-24]="",,"|n"&R1C9&RC[-24])&IF(RC[-23]="",,"|n"&R1C10&RC[-23])&IF(RC[-22]="",,"|n"&R1C11&RC[-22])&IF(RC[-21]="",,"|n"&R1C12&RC[-21])&IF(RC[-19]&RC[-18]&RC[-17]&RC[-16]="",,"|n"&R1C13)&IF(RC[-19]="",,"|n"&R1C14&RC[-19])&IF(RC[-18]="",,"|n"&R1C15&RC[-18])&IF(RC[-17]="",,"|n"&R1C16&RC[-17])&IF(RC[-16]="",,"|n"&R1C17&RC[-16])&IF(RC[-15]="",,"|n"&R1C18&RC[-15])&IF(RC[-14]="",,"|n"&R1C19&RC[-14])&IF(RC[-13]="",,"|n"&R1C20&RC[-13])&IF(RC[-12]="",,"|n"&R1C21&RC[-12])&IF(RC[-11]="",,"|n"&R1C22&RC[-11])&IF(RC[-10]="",,"|n"&R1C23&RC[-10])&IF(RC[-9]="",,"|n"&R1C24&RC[-9])&IF(RC[-8]="",,"|n"&R1C25&RC[-8])&IF(RC[-7]="",,"|n"&R1C26&RC[-7])&IF(RC[-6]="",,"|n"&R1C27&RC[-6])&IF(RC[-5]="",,"|n"&R1C28&RC[-5])&IF(RC[-2]="",,"|n"&RC[-2]) -> 
AF275: =VLOOKUP(RC[-31],Sheet2!R13C1:R18C2,2,0)&"."&VLOOKUP(RC[-30],Sheet2!R7C1:R11C2,2,0)&VLOOKUP(RC[-30],Sheet2!R1C1:R5C2,2,0)&RC[-29]&RC[-28]&RC[-27]&Sheet2!R1C3 -> #N/A | AG275: =IF(RC[-26]&RC[-25]&RC[-24]&RC[-23]&RC[-22]&RC[-21]="",,R1C6)&IF(RC[-26]="",,"|n"&R1C7&RC[-26])&IF(RC[-25]="",,"|n"&R1C8&RC[-25])&IF(RC[-24]="",,"|n"&R1C9&RC[-24])&IF(RC[-23]="",,"|n"&R1C10&RC[-23])&IF(RC[-22]="",,"|n"&R1C11&RC[-22])&IF(RC[-21]="",,"|n"&R1C12&RC[-21])&IF(RC[-19]&RC[-18]&RC[-17]&RC[-16]="",,"|n"&R1C13)&IF(RC[-19]="",,"|n"&R1C14&RC[-19])&IF(RC[-18]="",,"|n"&R1C15&RC[-18])&IF(RC[-17]="",,"|n"&R1C16&RC[-17])&IF(RC[-16]="",,"|n"&R1C17&RC[-16])&IF(RC[-15]="",,"|n"&R1C18&RC[-15])&IF(RC[-14]="",,"|n"&R1C19&RC[-14])&IF(RC[-13]="",,"|n"&R1C20&RC[-13])&IF(RC[-12]="",,"|n"&R1C21&RC[-12])&IF(RC[-11]="",,"|n"&R1C22&RC[-11])&IF(RC[-10]="",,"|n"&R1C23&RC[-10])&IF(RC[-9]="",,"|n"&R1C24&RC[-9])&IF(RC[-8]="",,"|n"&R1C25&RC[-8])&IF(RC[-7]="",,"|n"&R1C26&RC[-7])&IF(RC[-6]="",,"|n"&R1C27&RC[-6])&IF(RC[-5]="",,"|n"&R1C28&RC[-5])&IF(RC[-2]="",,"|n"&RC[-2]) -> 
AF276: =VLOOKUP(RC[-31],Sheet2!R13C1:R18C2,2,0)&"."&VLOOKUP(RC[-30],Sheet2!R7C1:R11C2,2,0)&VLOOKUP(RC[-30],Sheet2!R1C1:R5C2,2,0)&RC[-29]&RC[-28]&RC[-27]&Sheet2!R1C3 -> #N/A | AG276: =IF(RC[-26]&RC[-25]&RC[-24]&RC[-23]&RC[-22]&RC[-21]="",,R1C6)&IF(RC[-26]="",,"|n"&R1C7&RC[-26])&IF(RC[-25]="",,"|n"&R1C8&RC[-25])&IF(RC[-24]="",,"|n"&R1C9&RC[-24])&IF(RC[-23]="",,"|n"&R1C10&RC[-23])&IF(RC[-22]="",,"|n"&R1C11&RC[-22])&IF(RC[-21]="",,"|n"&R1C12&RC[-21])&IF(RC[-19]&RC[-18]&RC[-17]&RC[-16]="",,"|n"&R1C13)&IF(RC[-19]="",,"|n"&R1C14&RC[-19])&IF(RC[-18]="",,"|n"&R1C15&RC[-18])&IF(RC[-17]="",,"|n"&R1C16&RC[-17])&IF(RC[-16]="",,"|n"&R1C17&RC[-16])&IF(RC[-15]="",,"|n"&R1C18&RC[-15])&IF(RC[-14]="",,"|n"&R1C19&RC[-14])&IF(RC[-13]="",,"|n"&R1C20&RC[-13])&IF(RC[-12]="",,"|n"&R1C21&RC[-12])&IF(RC[-11]="",,"|n"&R1C22&RC[-11])&IF(RC[-10]="",,"|n"&R1C23&RC[-10])&IF(RC[-9]="",,"|n"&R1C24&RC[-9])&IF(RC[-8]="",,"|n"&R1C25&RC[-8])&IF(RC[-7]="",,"|n"&R1C26&RC[-7])&IF(RC[-6]="",,"|n"&R1C27&RC[-6])&IF(RC[-5]="",,"|n"&R1C28&RC[-5])&IF(RC[-2]="",,"|n"&RC[-2]) -> 
AF277: =VLOOKUP(RC[-31],Sheet2!R13C1:R18C2,2,0)&"."&VLOOKUP(RC[-30],Sheet2!R7C1:R11C2,2,0)&VLOOKUP(RC[-30],Sheet2!R1C1:R5C2,2,0)&RC[-29]&RC[-28]&RC[-27]&Sheet2!R1C3 -> #N/A | AG277: =IF(RC[-26]&RC[-25]&RC[-24]&RC[-23]&RC[-22]&RC[-21]="",,R1C6)&IF(RC[-26]="",,"|n"&R1C7&RC[-26])&IF(RC[-25]="",,"|n"&R1C8&RC[-25])&IF(RC[-24]="",,"|n"&R1C9&RC[-24])&IF(RC[-23]="",,"|n"&R1C10&RC[-23])&IF(RC[-22]="",,"|n"&R1C11&RC[-22])&IF(RC[-21]="",,"|n"&R1C12&RC[-21])&IF(RC[-19]&RC[-18]&RC[-17]&RC[-16]="",,"|n"&R1C13)&IF(RC[-19]="",,"|n"&R1C14&RC[-19])&IF(RC[-18]="",,"|n"&R1C15&RC[-18])&IF(RC[-17]="",,"|n"&R1C16&RC[-17])&IF(RC[-16]="",,"|n"&R1C17&RC[-16])&IF(RC[-15]="",,"|n"&R1C18&RC[-15])&IF(RC[-14]="",,"|n"&R1C19&RC[-14])&IF(RC[-13]="",,"|n"&R1C20&RC[-13])&IF(RC[-12]="",,"|n"&R1C21&RC[-12])&IF(RC[-11]="",,"|n"&R1C22&RC[-11])&IF(RC[-10]="",,"|n"&R1C23&RC[-10])&IF(RC[-9]="",,"|n"&R1C24&RC[-9])&IF(RC[-8]="",,"|n"&R1C25&RC[-8])&IF(RC[-7]="",,"|n"&R1C26&RC[-7])&IF(RC[-6]="",,"|n"&R1C27&RC[-6])&IF(RC[-5]="",,"|n"&R1C28&RC[-5])&IF(RC[-2]="",,"|n"&RC[-2]) -> 
AF278: =VLOOKUP(RC[-31],Sheet2!R13C1:R18C2,2,0)&"."&VLOOKUP(RC[-30],Sheet2!R7C1:R11C2,2,0)&VLOOKUP(RC[-30],Sheet2!R1C1:R5C2,2,0)&RC[-29]&RC[-28]&RC[-27]&Sheet2!R1C3 -> #N/A | AG278: =IF(RC[-26]&RC[-25]&RC[-24]&RC[-23]&RC[-22]&RC[-21]="",,R1C6)&IF(RC[-26]="",,"|n"&R1C7&RC[-26])&IF(RC[-25]="",,"|n"&R1C8&RC[-25])&IF(RC[-24]="",,"|n"&R1C9&RC[-24])&IF(RC[-23]="",,"|n"&R1C10&RC[-23])&IF(RC[-22]="",,"|n"&R1C11&RC[-22])&IF(RC[-21]="",,"|n"&R1C12&RC[-21])&IF(RC[-19]&RC[-18]&RC[-17]&RC[-16]="",,"|n"&R1C13)&IF(RC[-19]="",,"|n"&R1C14&RC[-19])&IF(RC[-18]="",,"|n"&R1C15&RC[-18])&IF(RC[-17]="",,"|n"&R1C16&RC[-17])&IF(RC[-16]="",,"|n"&R1C17&RC[-16])&IF(RC[-15]="",,"|n"&R1C18&RC[-15])&IF(RC[-14]="",,"|n"&R1C19&RC[-14])&IF(RC[-13]="",,"|n"&R1C20&RC[-13])&IF(RC[-12]="",,"|n"&R1C21&RC[-12])&IF(RC[-11]="",,"|n"&R1C22&RC[-11])&IF(RC[-10]="",,"|n"&R1C23&RC[-10])&IF(RC[-9]="",,"|n"&R1C24&RC[-9])&IF(RC[-8]="",,"|n"&R1C25&RC[-8])&IF(RC[-7]="",,"|n"&R1C26&RC[-7])&IF(RC[-6]="",,"|n"&R1C27&RC[-6])&IF(RC[-5]="",,"|n"&R1C28&RC[-5])&IF(RC[-2]="",,"|n"&RC[-2]) -> 
AF279: =VLOOKUP(RC[-31],Sheet2!R13C1:R18C2,2,0)&"."&VLOOKUP(RC[-30],Sheet2!R7C1:R11C2,2,0)&VLOOKUP(RC[-30],Sheet2!R1C1:R5C2,2,0)&RC[-29]&RC[-28]&RC[-27]&Sheet2!R1C3 -> #N/A | AG279: =IF(RC[-26]&RC[-25]&RC[-24]&RC[-23]&RC[-22]&RC[-21]="",,R1C6)&IF(RC[-26]="",,"|n"&R1C7&RC[-26])&IF(RC[-25]="",,"|n"&R1C8&RC[-25])&IF(RC[-24]="",,"|n"&R1C9&RC[-24])&IF(RC[-23]="",,"|n"&R1C10&RC[-23])&IF(RC[-22]="",,"|n"&R1C11&RC[-22])&IF(RC[-21]="",,"|n"&R1C12&RC[-21])&IF(RC[-19]&RC[-18]&RC[-17]&RC[-16]="",,"|n"&R1C13)&IF(RC[-19]="",,"|n"&R1C14&RC[-19])&IF(RC[-18]="",,"|n"&R1C15&RC[-18])&IF(RC[-17]="",,"|n"&R1C16&RC[-17])&IF(RC[-16]="",,"|n"&R1C17&RC[-16])&IF(RC[-15]="",,"|n"&R1C18&RC[-15])&IF(RC[-14]="",,"|n"&R1C19&RC[-14])&IF(RC[-13]="",,"|n"&R1C20&RC[-13])&IF(RC[-12]="",,"|n"&R1C21&RC[-12])&IF(RC[-11]="",,"|n"&R1C22&RC[-11])&IF(RC[-10]="",,"|n"&R1C23&RC[-10])&IF(RC[-9]="",,"|n"&R1C24&RC[-9])&IF(RC[-8]="",,"|n"&R1C25&RC[-8])&IF(RC[-7]="",,"|n"&R1C26&RC[-7])&IF(RC[-6]="",,"|n"&R1C27&RC[-6])&IF(RC[-5]="",,"|n"&R1C28&RC[-5])&IF(RC[-2]="",,"|n"&RC[-2]) -> 
AF280: =VLOOKUP(RC[-31],Sheet2!R13C1:R18C2,2,0)&"."&VLOOKUP(RC[-30],Sheet2!R7C1:R11C2,2,0)&VLOOKUP(RC[-30],Sheet2!R1C1:R5C2,2,0)&RC[-29]&RC[-28]&RC[-27]&Sheet2!R1C3 -> #N/A | AG280: =IF(RC[-26]&RC[-25]&RC[-24]&RC[-23]&RC[-22]&RC[-21]="",,R1C6)&IF(RC[-26]="",,"|n"&R1C7&RC[-26])&IF(RC[-25]="",,"|n"&R1C8&RC[-25])&IF(RC[-24]="",,"|n"&R1C9&RC[-24])&IF(RC[-23]="",,"|n"&R1C10&RC[-23])&IF(RC[-22]="",,"|n"&R1C11&RC[-22])&IF(RC[-21]="",,"|n"&R1C12&RC[-21])&IF(RC[-19]&RC[-18]&RC[-17]&RC[-16]="",,"|n"&R1C13)&IF(RC[-19]="",,"|n"&R1C14&RC[-19])&IF(RC[-18]="",,"|n"&R1C15&RC[-18])&IF(RC[-17]="",,"|n"&R1C16&RC[-17])&IF(RC[-16]="",,"|n"&R1C17&RC[-16])&IF(RC[-15]="",,"|n"&R1C18&RC[-15])&IF(RC[-14]="",,"|n"&R1C19&RC[-14])&IF(RC[-13]="",,"|n"&R1C20&RC[-13])&IF(RC[-12]="",,"|n"&R1C21&RC[-12])&IF(RC[-11]="",,"|n"&R1C22&RC[-11])&IF(RC[-10]="",,"|n"&R1C23&RC[-10])&IF(RC[-9]="",,"|n"&R1C24&RC[-9])&IF(RC[-8]="",,"|n"&R1C25&RC[-8])&IF(RC[-7]="",,"|n"&R1C26&RC[-7])&IF(RC[-6]="",,"|n"&R1C27&RC[-6])&IF(RC[-5]="",,"|n"&R1C28&RC[-5])&IF(RC[-2]="",,"|n"&RC[-2]) -> 
AF281: =VLOOKUP(RC[-31],Sheet2!R13C1:R18C2,2,0)&"."&VLOOKUP(RC[-30],Sheet2!R7C1:R11C2,2,0)&VLOOKUP(RC[-30],Sheet2!R1C1:R5C2,2,0)&RC[-29]&RC[-28]&RC[-27]&Sheet2!R1C3 -> #N/A | AG281: =IF(RC[-26]&RC[-25]&RC[-24]&RC[-23]&RC[-22]&RC[-21]="",,R1C6)&IF(RC[-26]="",,"|n"&R1C7&RC[-26])&IF(RC[-25]="",,"|n"&R1C8&RC[-25])&IF(RC[-24]="",,"|n"&R1C9&RC[-24])&IF(RC[-23]="",,"|n"&R1C10&RC[-23])&IF(RC[-22]="",,"|n"&R1C11&RC[-22])&IF(RC[-21]="",,"|n"&R1C12&RC[-21])&IF(RC[-19]&RC[-18]&RC[-17]&RC[-16]="",,"|n"&R1C13)&IF(RC[-19]="",,"|n"&R1C14&RC[-19])&IF(RC[-18]="",,"|n"&R1C15&RC[-18])&IF(RC[-17]="",,"|n"&R1C16&RC[-17])&IF(RC[-16]="",,"|n"&R1C17&RC[-16])&IF(RC[-15]="",,"|n"&R1C18&RC[-15])&IF(RC[-14]="",,"|n"&R1C19&RC[-14])&IF(RC[-13]="",,"|n"&R1C20&RC[-13])&IF(RC[-12]="",,"|n"&R1C21&RC[-12])&IF(RC[-11]="",,"|n"&R1C22&RC[-11])&IF(RC[-10]="",,"|n"&R1C23&RC[-10])&IF(RC[-9]="",,"|n"&R1C24&RC[-9])&IF(RC[-8]="",,"|n"&R1C25&RC[-8])&IF(RC[-7]="",,"|n"&R1C26&RC[-7])&IF(RC[-6]="",,"|n"&R1C27&RC[-6])&IF(RC[-5]="",,"|n"&R1C28&RC[-5])&IF(RC[-2]="",,"|n"&RC[-2]) -> 
AF282: =VLOOKUP(RC[-31],Sheet2!R13C1:R18C2,2,0)&"."&VLOOKUP(RC[-30],Sheet2!R7C1:R11C2,2,0)&VLOOKUP(RC[-30],Sheet2!R1C1:R5C2,2,0)&RC[-29]&RC[-28]&RC[-27]&Sheet2!R1C3 -> #N/A | AG282: =IF(RC[-26]&RC[-25]&RC[-24]&RC[-23]&RC[-22]&RC[-21]="",,R1C6)&IF(RC[-26]="",,"|n"&R1C7&RC[-26])&IF(RC[-25]="",,"|n"&R1C8&RC[-25])&IF(RC[-24]="",,"|n"&R1C9&RC[-24])&IF(RC[-23]="",,"|n"&R1C10&RC[-23])&IF(RC[-22]="",,"|n"&R1C11&RC[-22])&IF(RC[-21]="",,"|n"&R1C12&RC[-21])&IF(RC[-19]&RC[-18]&RC[-17]&RC[-16]="",,"|n"&R1C13)&IF(RC[-19]="",,"|n"&R1C14&RC[-19])&IF(RC[-18]="",,"|n"&R1C15&RC[-18])&IF(RC[-17]="",,"|n"&R1C16&RC[-17])&IF(RC[-16]="",,"|n"&R1C17&RC[-16])&IF(RC[-15]="",,"|n"&R1C18&RC[-15])&IF(RC[-14]="",,"|n"&R1C19&RC[-14])&IF(RC[-13]="",,"|n"&R1C20&RC[-13])&IF(RC[-12]="",,"|n"&R1C21&RC[-12])&IF(RC[-11]="",,"|n"&R1C22&RC[-11])&IF(RC[-10]="",,"|n"&R1C23&RC[-10])&IF(RC[-9]="",,"|n"&R1C24&RC[-9])&IF(RC[-8]="",,"|n"&R1C25&RC[-8])&IF(RC[-7]="",,"|n"&R1C26&RC[-7])&IF(RC[-6]="",,"|n"&R1C27&RC[-6])&IF(RC[-5]="",,"|n"&R1C28&RC[-5])&IF(RC[-2]="",,"|n"&RC[-2]) -> 
AF283: =VLOOKUP(RC[-31],Sheet2!R13C1:R18C2,2,0)&"."&VLOOKUP(RC[-30],Sheet2!R7C1:R11C2,2,0)&VLOOKUP(RC[-30],Sheet2!R1C1:R5C2,2,0)&RC[-29]&RC[-28]&RC[-27]&Sheet2!R1C3 -> #N/A | AG283: =IF(RC[-26]&RC[-25]&RC[-24]&RC[-23]&RC[-22]&RC[-21]="",,R1C6)&IF(RC[-26]="",,"|n"&R1C7&RC[-26])&IF(RC[-25]="",,"|n"&R1C8&RC[-25])&IF(RC[-24]="",,"|n"&R1C9&RC[-24])&IF(RC[-23]="",,"|n"&R1C10&RC[-23])&IF(RC[-22]="",,"|n"&R1C11&RC[-22])&IF(RC[-21]="",,"|n"&R1C12&RC[-21])&IF(RC[-19]&RC[-18]&RC[-17]&RC[-16]="",,"|n"&R1C13)&IF(RC[-19]="",,"|n"&R1C14&RC[-19])&IF(RC[-18]="",,"|n"&R1C15&RC[-18])&IF(RC[-17]="",,"|n"&R1C16&RC[-17])&IF(RC[-16]="",,"|n"&R1C17&RC[-16])&IF(RC[-15]="",,"|n"&R1C18&RC[-15])&IF(RC[-14]="",,"|n"&R1C19&RC[-14])&IF(RC[-13]="",,"|n"&R1C20&RC[-13])&IF(RC[-12]="",,"|n"&R1C21&RC[-12])&IF(RC[-11]="",,"|n"&R1C22&RC[-11])&IF(RC[-10]="",,"|n"&R1C23&RC[-10])&IF(RC[-9]="",,"|n"&R1C24&RC[-9])&IF(RC[-8]="",,"|n"&R1C25&RC[-8])&IF(RC[-7]="",,"|n"&R1C26&RC[-7])&IF(RC[-6]="",,"|n"&R1C27&RC[-6])&IF(RC[-5]="",,"|n"&R1C28&RC[-5])&IF(RC[-2]="",,"|n"&RC[-2]) -> 
AF284: =VLOOKUP(RC[-31],Sheet2!R13C1:R18C2,2,0)&"."&VLOOKUP(RC[-30],Sheet2!R7C1:R11C2,2,0)&VLOOKUP(RC[-30],Sheet2!R1C1:R5C2,2,0)&RC[-29]&RC[-28]&RC[-27]&Sheet2!R1C3 -> #N/A | AG284: =IF(RC[-26]&RC[-25]&RC[-24]&RC[-23]&RC[-22]&RC[-21]="",,R1C6)&IF(RC[-26]="",,"|n"&R1C7&RC[-26])&IF(RC[-25]="",,"|n"&R1C8&RC[-25])&IF(RC[-24]="",,"|n"&R1C9&RC[-24])&IF(RC[-23]="",,"|n"&R1C10&RC[-23])&IF(RC[-22]="",,"|n"&R1C11&RC[-22])&IF(RC[-21]="",,"|n"&R1C12&RC[-21])&IF(RC[-19]&RC[-18]&RC[-17]&RC[-16]="",,"|n"&R1C13)&IF(RC[-19]="",,"|n"&R1C14&RC[-19])&IF(RC[-18]="",,"|n"&R1C15&RC[-18])&IF(RC[-17]="",,"|n"&R1C16&RC[-17])&IF(RC[-16]="",,"|n"&R1C17&RC[-16])&IF(RC[-15]="",,"|n"&R1C18&RC[-15])&IF(RC[-14]="",,"|n"&R1C19&RC[-14])&IF(RC[-13]="",,"|n"&R1C20&RC[-13])&IF(RC[-12]="",,"|n"&R1C21&RC[-12])&IF(RC[-11]="",,"|n"&R1C22&RC[-11])&IF(RC[-10]="",,"|n"&R1C23&RC[-10])&IF(RC[-9]="",,"|n"&R1C24&RC[-9])&IF(RC[-8]="",,"|n"&R1C25&RC[-8])&IF(RC[-7]="",,"|n"&R1C26&RC[-7])&IF(RC[-6]="",,"|n"&R1C27&RC[-6])&IF(RC[-5]="",,"|n"&R1C28&RC[-5])&IF(RC[-2]="",,"|n"&RC[-2]) -> 
AF285: =VLOOKUP(RC[-31],Sheet2!R13C1:R18C2,2,0)&"."&VLOOKUP(RC[-30],Sheet2!R7C1:R11C2,2,0)&VLOOKUP(RC[-30],Sheet2!R1C1:R5C2,2,0)&RC[-29]&RC[-28]&RC[-27]&Sheet2!R1C3 -> #N/A | AG285: =IF(RC[-26]&RC[-25]&RC[-24]&RC[-23]&RC[-22]&RC[-21]="",,R1C6)&IF(RC[-26]="",,"|n"&R1C7&RC[-26])&IF(RC[-25]="",,"|n"&R1C8&RC[-25])&IF(RC[-24]="",,"|n"&R1C9&RC[-24])&IF(RC[-23]="",,"|n"&R1C10&RC[-23])&IF(RC[-22]="",,"|n"&R1C11&RC[-22])&IF(RC[-21]="",,"|n"&R1C12&RC[-21])&IF(RC[-19]&RC[-18]&RC[-17]&RC[-16]="",,"|n"&R1C13)&IF(RC[-19]="",,"|n"&R1C14&RC[-19])&IF(RC[-18]="",,"|n"&R1C15&RC[-18])&IF(RC[-17]="",,"|n"&R1C16&RC[-17])&IF(RC[-16]="",,"|n"&R1C17&RC[-16])&IF(RC[-15]="",,"|n"&R1C18&RC[-15])&IF(RC[-14]="",,"|n"&R1C19&RC[-14])&IF(RC[-13]="",,"|n"&R1C20&RC[-13])&IF(RC[-12]="",,"|n"&R1C21&RC[-12])&IF(RC[-11]="",,"|n"&R1C22&RC[-11])&IF(RC[-10]="",,"|n"&R1C23&RC[-10])&IF(RC[-9]="",,"|n"&R1C24&RC[-9])&IF(RC[-8]="",,"|n"&R1C25&RC[-8])&IF(RC[-7]="",,"|n"&R1C26&RC[-7])&IF(RC[-6]="",,"|n"&R1C27&RC[-6])&IF(RC[-5]="",,"|n"&R1C28&RC[-5])&IF(RC[-2]="",,"|n"&RC[-2]) -> 
AF286: =VLOOKUP(RC[-31],Sheet2!R13C1:R18C2,2,0)&"."&VLOOKUP(RC[-30],Sheet2!R7C1:R11C2,2,0)&VLOOKUP(RC[-30],Sheet2!R1C1:R5C2,2,0)&RC[-29]&RC[-28]&RC[-27]&Sheet2!R1C3 -> #N/A | AG286: =IF(RC[-26]&RC[-25]&RC[-24]&RC[-23]&RC[-22]&RC[-21]="",,R1C6)&IF(RC[-26]="",,"|n"&R1C7&RC[-26])&IF(RC[-25]="",,"|n"&R1C8&RC[-25])&IF(RC[-24]="",,"|n"&R1C9&RC[-24])&IF(RC[-23]="",,"|n"&R1C10&RC[-23])&IF(RC[-22]="",,"|n"&R1C11&RC[-22])&IF(RC[-21]="",,"|n"&R1C12&RC[-21])&IF(RC[-19]&RC[-18]&RC[-17]&RC[-16]="",,"|n"&R1C13)&IF(RC[-19]="",,"|n"&R1C14&RC[-19])&IF(RC[-18]="",,"|n"&R1C15&RC[-18])&IF(RC[-17]="",,"|n"&R1C16&RC[-17])&IF(RC[-16]="",,"|n"&R1C17&RC[-16])&IF(RC[-15]="",,"|n"&R1C18&RC[-15])&IF(RC[-14]="",,"|n"&R1C19&RC[-14])&IF(RC[-13]="",,"|n"&R1C20&RC[-13])&IF(RC[-12]="",,"|n"&R1C21&RC[-12])&IF(RC[-11]="",,"|n"&R1C22&RC[-11])&IF(RC[-10]="",,"|n"&R1C23&RC[-10])&IF(RC[-9]="",,"|n"&R1C24&RC[-9])&IF(RC[-8]="",,"|n"&R1C25&RC[-8])&IF(RC[-7]="",,"|n"&R1C26&RC[-7])&IF(RC[-6]="",,"|n"&R1C27&RC[-6])&IF(RC[-5]="",,"|n"&R1C28&RC[-5])&IF(RC[-2]="",,"|n"&RC[-2]) -> 
AF287: =VLOOKUP(RC[-31],Sheet2!R13C1:R18C2,2,0)&"."&VLOOKUP(RC[-30],Sheet2!R7C1:R11C2,2,0)&VLOOKUP(RC[-30],Sheet2!R1C1:R5C2,2,0)&RC[-29]&RC[-28]&RC[-27]&Sheet2!R1C3 -> #N/A | AG287: =IF(RC[-26]&RC[-25]&RC[-24]&RC[-23]&RC[-22]&RC[-21]="",,R1C6)&IF(RC[-26]="",,"|n"&R1C7&RC[-26])&IF(RC[-25]="",,"|n"&R1C8&RC[-25])&IF(RC[-24]="",,"|n"&R1C9&RC[-24])&IF(RC[-23]="",,"|n"&R1C10&RC[-23])&IF(RC[-22]="",,"|n"&R1C11&RC[-22])&IF(RC[-21]="",,"|n"&R1C12&RC[-21])&IF(RC[-19]&RC[-18]&RC[-17]&RC[-16]="",,"|n"&R1C13)&IF(RC[-19]="",,"|n"&R1C14&RC[-19])&IF(RC[-18]="",,"|n"&R1C15&RC[-18])&IF(RC[-17]="",,"|n"&R1C16&RC[-17])&IF(RC[-16]="",,"|n"&R1C17&RC[-16])&IF(RC[-15]="",,"|n"&R1C18&RC[-15])&IF(RC[-14]="",,"|n"&R1C19&RC[-14])&IF(RC[-13]="",,"|n"&R1C20&RC[-13])&IF(RC[-12]="",,"|n"&R1C21&RC[-12])&IF(RC[-11]="",,"|n"&R1C22&RC[-11])&IF(RC[-10]="",,"|n"&R1C23&RC[-10])&IF(RC[-9]="",,"|n"&R1C24&RC[-9])&IF(RC[-8]="",,"|n"&R1C25&RC[-8])&IF(RC[-7]="",,"|n"&R1C26&RC[-7])&IF(RC[-6]="",,"|n"&R1C27&RC[-6])&IF(RC[-5]="",,"|n"&R1C28&RC[-5])&IF(RC[-2]="",,"|n"&RC[-2]) -> 
AF288: =VLOOKUP(RC[-31],Sheet2!R13C1:R18C2,2,0)&"."&VLOOKUP(RC[-30],Sheet2!R7C1:R11C2,2,0)&VLOOKUP(RC[-30],Sheet2!R1C1:R5C2,2,0)&RC[-29]&RC[-28]&RC[-27]&Sheet2!R1C3 -> #N/A | AG288: =IF(RC[-26]&RC[-25]&RC[-24]&RC[-23]&RC[-22]&RC[-21]="",,R1C6)&IF(RC[-26]="",,"|n"&R1C7&RC[-26])&IF(RC[-25]="",,"|n"&R1C8&RC[-25])&IF(RC[-24]="",,"|n"&R1C9&RC[-24])&IF(RC[-23]="",,"|n"&R1C10&RC[-23])&IF(RC[-22]="",,"|n"&R1C11&RC[-22])&IF(RC[-21]="",,"|n"&R1C12&RC[-21])&IF(RC[-19]&RC[-18]&RC[-17]&RC[-16]="",,"|n"&R1C13)&IF(RC[-19]="",,"|n"&R1C14&RC[-19])&IF(RC[-18]="",,"|n"&R1C15&RC[-18])&IF(RC[-17]="",,"|n"&R1C16&RC[-17])&IF(RC[-16]="",,"|n"&R1C17&RC[-16])&IF(RC[-15]="",,"|n"&R1C18&RC[-15])&IF(RC[-14]="",,"|n"&R1C19&RC[-14])&IF(RC[-13]="",,"|n"&R1C20&RC[-13])&IF(RC[-12]="",,"|n"&R1C21&RC[-12])&IF(RC[-11]="",,"|n"&R1C22&RC[-11])&IF(RC[-10]="",,"|n"&R1C23&RC[-10])&IF(RC[-9]="",,"|n"&R1C24&RC[-9])&IF(RC[-8]="",,"|n"&R1C25&RC[-8])&IF(RC[-7]="",,"|n"&R1C26&RC[-7])&IF(RC[-6]="",,"|n"&R1C27&RC[-6])&IF(RC[-5]="",,"|n"&R1C28&RC[-5])&IF(RC[-2]="",,"|n"&RC[-2]) -> 
AF289: =VLOOKUP(RC[-31],Sheet2!R13C1:R18C2,2,0)&"."&VLOOKUP(RC[-30],Sheet2!R7C1:R11C2,2,0)&VLOOKUP(RC[-30],Sheet2!R1C1:R5C2,2,0)&RC[-29]&RC[-28]&RC[-27]&Sheet2!R1C3 -> #N/A | AG289: =IF(RC[-26]&RC[-25]&RC[-24]&RC[-23]&RC[-22]&RC[-21]="",,R1C6)&IF(RC[-26]="",,"|n"&R1C7&RC[-26])&IF(RC[-25]="",,"|n"&R1C8&RC[-25])&IF(RC[-24]="",,"|n"&R1C9&RC[-24])&IF(RC[-23]="",,"|n"&R1C10&RC[-23])&IF(RC[-22]="",,"|n"&R1C11&RC[-22])&IF(RC[-21]="",,"|n"&R1C12&RC[-21])&IF(RC[-19]&RC[-18]&RC[-17]&RC[-16]="",,"|n"&R1C13)&IF(RC[-19]="",,"|n"&R1C14&RC[-19])&IF(RC[-18]="",,"|n"&R1C15&RC[-18])&IF(RC[-17]="",,"|n"&R1C16&RC[-17])&IF(RC[-16]="",,"|n"&R1C17&RC[-16])&IF(RC[-15]="",,"|n"&R1C18&RC[-15])&IF(RC[-14]="",,"|n"&R1C19&RC[-14])&IF(RC[-13]="",,"|n"&R1C20&RC[-13])&IF(RC[-12]="",,"|n"&R1C21&RC[-12])&IF(RC[-11]="",,"|n"&R1C22&RC[-11])&IF(RC[-10]="",,"|n"&R1C23&RC[-10])&IF(RC[-9]="",,"|n"&R1C24&RC[-9])&IF(RC[-8]="",,"|n"&R1C25&RC[-8])&IF(RC[-7]="",,"|n"&R1C26&RC[-7])&IF(RC[-6]="",,"|n"&R1C27&RC[-6])&IF(RC[-5]="",,"|n"&R1C28&RC[-5])&IF(RC[-2]="",,"|n"&RC[-2]) -> 
AF290: =VLOOKUP(RC[-31],Sheet2!R13C1:R18C2,2,0)&"."&VLOOKUP(RC[-30],Sheet2!R7C1:R11C2,2,0)&VLOOKUP(RC[-30],Sheet2!R1C1:R5C2,2,0)&RC[-29]&RC[-28]&RC[-27]&Sheet2!R1C3 -> #N/A | AG290: =IF(RC[-26]&RC[-25]&RC[-24]&RC[-23]&RC[-22]&RC[-21]="",,R1C6)&IF(RC[-26]="",,"|n"&R1C7&RC[-26])&IF(RC[-25]="",,"|n"&R1C8&RC[-25])&IF(RC[-24]="",,"|n"&R1C9&RC[-24])&IF(RC[-23]="",,"|n"&R1C10&RC[-23])&IF(RC[-22]="",,"|n"&R1C11&RC[-22])&IF(RC[-21]="",,"|n"&R1C12&RC[-21])&IF(RC[-19]&RC[-18]&RC[-17]&RC[-16]="",,"|n"&R1C13)&IF(RC[-19]="",,"|n"&R1C14&RC[-19])&IF(RC[-18]="",,"|n"&R1C15&RC[-18])&IF(RC[-17]="",,"|n"&R1C16&RC[-17])&IF(RC[-16]="",,"|n"&R1C17&RC[-16])&IF(RC[-15]="",,"|n"&R1C18&RC[-15])&IF(RC[-14]="",,"|n"&R1C19&RC[-14])&IF(RC[-13]="",,"|n"&R1C20&RC[-13])&IF(RC[-12]="",,"|n"&R1C21&RC[-12])&IF(RC[-11]="",,"|n"&R1C22&RC[-11])&IF(RC[-10]="",,"|n"&R1C23&RC[-10])&IF(RC[-9]="",,"|n"&R1C24&RC[-9])&IF(RC[-8]="",,"|n"&R1C25&RC[-8])&IF(RC[-7]="",,"|n"&R1C26&RC[-7])&IF(RC[-6]="",,"|n"&R1C27&RC[-6])&IF(RC[-5]="",,"|n"&R1C28&RC[-5])&IF(RC[-2]="",,"|n"&RC[-2]) -> 
AF291: =VLOOKUP(RC[-31],Sheet2!R13C1:R18C2,2,0)&"."&VLOOKUP(RC[-30],Sheet2!R7C1:R11C2,2,0)&VLOOKUP(RC[-30],Sheet2!R1C1:R5C2,2,0)&RC[-29]&RC[-28]&RC[-27]&Sheet2!R1C3 -> #N/A | AG291: =IF(RC[-26]&RC[-25]&RC[-24]&RC[-23]&RC[-22]&RC[-21]="",,R1C6)&IF(RC[-26]="",,"|n"&R1C7&RC[-26])&IF(RC[-25]="",,"|n"&R1C8&RC[-25])&IF(RC[-24]="",,"|n"&R1C9&RC[-24])&IF(RC[-23]="",,"|n"&R1C10&RC[-23])&IF(RC[-22]="",,"|n"&R1C11&RC[-22])&IF(RC[-21]="",,"|n"&R1C12&RC[-21])&IF(RC[-19]&RC[-18]&RC[-17]&RC[-16]="",,"|n"&R1C13)&IF(RC[-19]="",,"|n"&R1C14&RC[-19])&IF(RC[-18]="",,"|n"&R1C15&RC[-18])&IF(RC[-17]="",,"|n"&R1C16&RC[-17])&IF(RC[-16]="",,"|n"&R1C17&RC[-16])&IF(RC[-15]="",,"|n"&R1C18&RC[-15])&IF(RC[-14]="",,"|n"&R1C19&RC[-14])&IF(RC[-13]="",,"|n"&R1C20&RC[-13])&IF(RC[-12]="",,"|n"&R1C21&RC[-12])&IF(RC[-11]="",,"|n"&R1C22&RC[-11])&IF(RC[-10]="",,"|n"&R1C23&RC[-10])&IF(RC[-9]="",,"|n"&R1C24&RC[-9])&IF(RC[-8]="",,"|n"&R1C25&RC[-8])&IF(RC[-7]="",,"|n"&R1C26&RC[-7])&IF(RC[-6]="",,"|n"&R1C27&RC[-6])&IF(RC[-5]="",,"|n"&R1C28&RC[-5])&IF(RC[-2]="",,"|n"&RC[-2]) -> 
AF292: =VLOOKUP(RC[-31],Sheet2!R13C1:R18C2,2,0)&"."&VLOOKUP(RC[-30],Sheet2!R7C1:R11C2,2,0)&VLOOKUP(RC[-30],Sheet2!R1C1:R5C2,2,0)&RC[-29]&RC[-28]&RC[-27]&Sheet2!R1C3 -> #N/A | AG292: =IF(RC[-26]&RC[-25]&RC[-24]&RC[-23]&RC[-22]&RC[-21]="",,R1C6)&IF(RC[-26]="",,"|n"&R1C7&RC[-26])&IF(RC[-25]="",,"|n"&R1C8&RC[-25])&IF(RC[-24]="",,"|n"&R1C9&RC[-24])&IF(RC[-23]="",,"|n"&R1C10&RC[-23])&IF(RC[-22]="",,"|n"&R1C11&RC[-22])&IF(RC[-21]="",,"|n"&R1C12&RC[-21])&IF(RC[-19]&RC[-18]&RC[-17]&RC[-16]="",,"|n"&R1C13)&IF(RC[-19]="",,"|n"&R1C14&RC[-19])&IF(RC[-18]="",,"|n"&R1C15&RC[-18])&IF(RC[-17]="",,"|n"&R1C16&RC[-17])&IF(RC[-16]="",,"|n"&R1C17&RC[-16])&IF(RC[-15]="",,"|n"&R1C18&RC[-15])&IF(RC[-14]="",,"|n"&R1C19&RC[-14])&IF(RC[-13]="",,"|n"&R1C20&RC[-13])&IF(RC[-12]="",,"|n"&R1C21&RC[-12])&IF(RC[-11]="",,"|n"&R1C22&RC[-11])&IF(RC[-10]="",,"|n"&R1C23&RC[-10])&IF(RC[-9]="",,"|n"&R1C24&RC[-9])&IF(RC[-8]="",,"|n"&R1C25&RC[-8])&IF(RC[-7]="",,"|n"&R1C26&RC[-7])&IF(RC[-6]="",,"|n"&R1C27&RC[-6])&IF(RC[-5]="",,"|n"&R1C28&RC[-5])&IF(RC[-2]="",,"|n"&RC[-2]) -> 
AF293: =VLOOKUP(RC[-31],Sheet2!R13C1:R18C2,2,0)&"."&VLOOKUP(RC[-30],Sheet2!R7C1:R11C2,2,0)&VLOOKUP(RC[-30],Sheet2!R1C1:R5C2,2,0)&RC[-29]&RC[-28]&RC[-27]&Sheet2!R1C3 -> #N/A | AG293: =IF(RC[-26]&RC[-25]&RC[-24]&RC[-23]&RC[-22]&RC[-21]="",,R1C6)&IF(RC[-26]="",,"|n"&R1C7&RC[-26])&IF(RC[-25]="",,"|n"&R1C8&RC[-25])&IF(RC[-24]="",,"|n"&R1C9&RC[-24])&IF(RC[-23]="",,"|n"&R1C10&RC[-23])&IF(RC[-22]="",,"|n"&R1C11&RC[-22])&IF(RC[-21]="",,"|n"&R1C12&RC[-21])&IF(RC[-19]&RC[-18]&RC[-17]&RC[-16]="",,"|n"&R1C13)&IF(RC[-19]="",,"|n"&R1C14&RC[-19])&IF(RC[-18]="",,"|n"&R1C15&RC[-18])&IF(RC[-17]="",,"|n"&R1C16&RC[-17])&IF(RC[-16]="",,"|n"&R1C17&RC[-16])&IF(RC[-15]="",,"|n"&R1C18&RC[-15])&IF(RC[-14]="",,"|n"&R1C19&RC[-14])&IF(RC[-13]="",,"|n"&R1C20&RC[-13])&IF(RC[-12]="",,"|n"&R1C21&RC[-12])&IF(RC[-11]="",,"|n"&R1C22&RC[-11])&IF(RC[-10]="",,"|n"&R1C23&RC[-10])&IF(RC[-9]="",,"|n"&R1C24&RC[-9])&IF(RC[-8]="",,"|n"&R1C25&RC[-8])&IF(RC[-7]="",,"|n"&R1C26&RC[-7])&IF(RC[-6]="",,"|n"&R1C27&RC[-6])&IF(RC[-5]="",,"|n"&R1C28&RC[-5])&IF(RC[-2]="",,"|n"&RC[-2]) -> 
AF294: =VLOOKUP(RC[-31],Sheet2!R13C1:R18C2,2,0)&"."&VLOOKUP(RC[-30],Sheet2!R7C1:R11C2,2,0)&VLOOKUP(RC[-30],Sheet2!R1C1:R5C2,2,0)&RC[-29]&RC[-28]&RC[-27]&Sheet2!R1C3 -> #N/A | AG294: =IF(RC[-26]&RC[-25]&RC[-24]&RC[-23]&RC[-22]&RC[-21]="",,R1C6)&IF(RC[-26]="",,"|n"&R1C7&RC[-26])&IF(RC[-25]="",,"|n"&R1C8&RC[-25])&IF(RC[-24]="",,"|n"&R1C9&RC[-24])&IF(RC[-23]="",,"|n"&R1C10&RC[-23])&IF(RC[-22]="",,"|n"&R1C11&RC[-22])&IF(RC[-21]="",,"|n"&R1C12&RC[-21])&IF(RC[-19]&RC[-18]&RC[-17]&RC[-16]="",,"|n"&R1C13)&IF(RC[-19]="",,"|n"&R1C14&RC[-19])&IF(RC[-18]="",,"|n"&R1C15&RC[-18])&IF(RC[-17]="",,"|n"&R1C16&RC[-17])&IF(RC[-16]="",,"|n"&R1C17&RC[-16])&IF(RC[-15]="",,"|n"&R1C18&RC[-15])&IF(RC[-14]="",,"|n"&R1C19&RC[-14])&IF(RC[-13]="",,"|n"&R1C20&RC[-13])&IF(RC[-12]="",,"|n"&R1C21&RC[-12])&IF(RC[-11]="",,"|n"&R1C22&RC[-11])&IF(RC[-10]="",,"|n"&R1C23&RC[-10])&IF(RC[-9]="",,"|n"&R1C24&RC[-9])&IF(RC[-8]="",,"|n"&R1C25&RC[-8])&IF(RC[-7]="",,"|n"&R1C26&RC[-7])&IF(RC[-6]="",,"|n"&R1C27&RC[-6])&IF(RC[-5]="",,"|n"&R1C28&RC[-5])&IF(RC[-2]="",,"|n"&RC[-2]) -> 
AF295: =VLOOKUP(RC[-31],Sheet2!R13C1:R18C2,2,0)&"."&VLOOKUP(RC[-30],Sheet2!R7C1:R11C2,2,0)&VLOOKUP(RC[-30],Sheet2!R1C1:R5C2,2,0)&RC[-29]&RC[-28]&RC[-27]&Sheet2!R1C3 -> #N/A | AG295: =IF(RC[-26]&RC[-25]&RC[-24]&RC[-23]&RC[-22]&RC[-21]="",,R1C6)&IF(RC[-26]="",,"|n"&R1C7&RC[-26])&IF(RC[-25]="",,"|n"&R1C8&RC[-25])&IF(RC[-24]="",,"|n"&R1C9&RC[-24])&IF(RC[-23]="",,"|n"&R1C10&RC[-23])&IF(RC[-22]="",,"|n"&R1C11&RC[-22])&IF(RC[-21]="",,"|n"&R1C12&RC[-21])&IF(RC[-19]&RC[-18]&RC[-17]&RC[-16]="",,"|n"&R1C13)&IF(RC[-19]="",,"|n"&R1C14&RC[-19])&IF(RC[-18]="",,"|n"&R1C15&RC[-18])&IF(RC[-17]="",,"|n"&R1C16&RC[-17])&IF(RC[-16]="",,"|n"&R1C17&RC[-16])&IF(RC[-15]="",,"|n"&R1C18&RC[-15])&IF(RC[-14]="",,"|n"&R1C19&RC[-14])&IF(RC[-13]="",,"|n"&R1C20&RC[-13])&IF(RC[-12]="",,"|n"&R1C21&RC[-12])&IF(RC[-11]="",,"|n"&R1C22&RC[-11])&IF(RC[-10]="",,"|n"&R1C23&RC[-10])&IF(RC[-9]="",,"|n"&R1C24&RC[-9])&IF(RC[-8]="",,"|n"&R1C25&RC[-8])&IF(RC[-7]="",,"|n"&R1C26&RC[-7])&IF(RC[-6]="",,"|n"&R1C27&RC[-6])&IF(RC[-5]="",,"|n"&R1C28&RC[-5])&IF(RC[-2]="",,"|n"&RC[-2]) -> 
AF296: =VLOOKUP(RC[-31],Sheet2!R13C1:R18C2,2,0)&"."&VLOOKUP(RC[-30],Sheet2!R7C1:R11C2,2,0)&VLOOKUP(RC[-30],Sheet2!R1C1:R5C2,2,0)&RC[-29]&RC[-28]&RC[-27]&Sheet2!R1C3 -> #N/A | AG296: =IF(RC[-26]&RC[-25]&RC[-24]&RC[-23]&RC[-22]&RC[-21]="",,R1C6)&IF(RC[-26]="",,"|n"&R1C7&RC[-26])&IF(RC[-25]="",,"|n"&R1C8&RC[-25])&IF(RC[-24]="",,"|n"&R1C9&RC[-24])&IF(RC[-23]="",,"|n"&R1C10&RC[-23])&IF(RC[-22]="",,"|n"&R1C11&RC[-22])&IF(RC[-21]="",,"|n"&R1C12&RC[-21])&IF(RC[-19]&RC[-18]&RC[-17]&RC[-16]="",,"|n"&R1C13)&IF(RC[-19]="",,"|n"&R1C14&RC[-19])&IF(RC[-18]="",,"|n"&R1C15&RC[-18])&IF(RC[-17]="",,"|n"&R1C16&RC[-17])&IF(RC[-16]="",,"|n"&R1C17&RC[-16])&IF(RC[-15]="",,"|n"&R1C18&RC[-15])&IF(RC[-14]="",,"|n"&R1C19&RC[-14])&IF(RC[-13]="",,"|n"&R1C20&RC[-13])&IF(RC[-12]="",,"|n"&R1C21&RC[-12])&IF(RC[-11]="",,"|n"&R1C22&RC[-11])&IF(RC[-10]="",,"|n"&R1C23&RC[-10])&IF(RC[-9]="",,"|n"&R1C24&RC[-9])&IF(RC[-8]="",,"|n"&R1C25&RC[-8])&IF(RC[-7]="",,"|n"&R1C26&RC[-7])&IF(RC[-6]="",,"|n"&R1C27&RC[-6])&IF(RC[-5]="",,"|n"&R1C28&RC[-5])&IF(RC[-2]="",,"|n"&RC[-2]) -> 
AF297: =VLOOKUP(RC[-31],Sheet2!R13C1:R18C2,2,0)&"."&VLOOKUP(RC[-30],Sheet2!R7C1:R11C2,2,0)&VLOOKUP(RC[-30],Sheet2!R1C1:R5C2,2,0)&RC[-29]&RC[-28]&RC[-27]&Sheet2!R1C3 -> #N/A | AG297: =IF(RC[-26]&RC[-25]&RC[-24]&RC[-23]&RC[-22]&RC[-21]="",,R1C6)&IF(RC[-26]="",,"|n"&R1C7&RC[-26])&IF(RC[-25]="",,"|n"&R1C8&RC[-25])&IF(RC[-24]="",,"|n"&R1C9&RC[-24])&IF(RC[-23]="",,"|n"&R1C10&RC[-23])&IF(RC[-22]="",,"|n"&R1C11&RC[-22])&IF(RC[-21]="",,"|n"&R1C12&RC[-21])&IF(RC[-19]&RC[-18]&RC[-17]&RC[-16]="",,"|n"&R1C13)&IF(RC[-19]="",,"|n"&R1C14&RC[-19])&IF(RC[-18]="",,"|n"&R1C15&RC[-18])&IF(RC[-17]="",,"|n"&R1C16&RC[-17])&IF(RC[-16]="",,"|n"&R1C17&RC[-16])&IF(RC[-15]="",,"|n"&R1C18&RC[-15])&IF(RC[-14]="",,"|n"&R1C19&RC[-14])&IF(RC[-13]="",,"|n"&R1C20&RC[-13])&IF(RC[-12]="",,"|n"&R1C21&RC[-12])&IF(RC[-11]="",,"|n"&R1C22&RC[-11])&IF(RC[-10]="",,"|n"&R1C23&RC[-10])&IF(RC[-9]="",,"|n"&R1C24&RC[-9])&IF(RC[-8]="",,"|n"&R1C25&RC[-8])&IF(RC[-7]="",,"|n"&R1C26&RC[-7])&IF(RC[-6]="",,"|n"&R1C27&RC[-6])&IF(RC[-5]="",,"|n"&R1C28&RC[-5])&IF(RC[-2]="",,"|n"&RC[-2]) -> 
AF298: =VLOOKUP(RC[-31],Sheet2!R13C1:R18C2,2,0)&"."&VLOOKUP(RC[-30],Sheet2!R7C1:R11C2,2,0)&VLOOKUP(RC[-30],Sheet2!R1C1:R5C2,2,0)&RC[-29]&RC[-28]&RC[-27]&Sheet2!R1C3 -> #N/A | AG298: =IF(RC[-26]&RC[-25]&RC[-24]&RC[-23]&RC[-22]&RC[-21]="",,R1C6)&IF(RC[-26]="",,"|n"&R1C7&RC[-26])&IF(RC[-25]="",,"|n"&R1C8&RC[-25])&IF(RC[-24]="",,"|n"&R1C9&RC[-24])&IF(RC[-23]="",,"|n"&R1C10&RC[-23])&IF(RC[-22]="",,"|n"&R1C11&RC[-22])&IF(RC[-21]="",,"|n"&R1C12&RC[-21])&IF(RC[-19]&RC[-18]&RC[-17]&RC[-16]="",,"|n"&R1C13)&IF(RC[-19]="",,"|n"&R1C14&RC[-19])&IF(RC[-18]="",,"|n"&R1C15&RC[-18])&IF(RC[-17]="",,"|n"&R1C16&RC[-17])&IF(RC[-16]="",,"|n"&R1C17&RC[-16])&IF(RC[-15]="",,"|n"&R1C18&RC[-15])&IF(RC[-14]="",,"|n"&R1C19&RC[-14])&IF(RC[-13]="",,"|n"&R1C20&RC[-13])&IF(RC[-12]="",,"|n"&R1C21&RC[-12])&IF(RC[-11]="",,"|n"&R1C22&RC[-11])&IF(RC[-10]="",,"|n"&R1C23&RC[-10])&IF(RC[-9]="",,"|n"&R1C24&RC[-9])&IF(RC[-8]="",,"|n"&R1C25&RC[-8])&IF(RC[-7]="",,"|n"&R1C26&RC[-7])&IF(RC[-6]="",,"|n"&R1C27&RC[-6])&IF(RC[-5]="",,"|n"&R1C28&RC[-5])&IF(RC[-2]="",,"|n"&RC[-2]) -> 
AF299: =VLOOKUP(RC[-31],Sheet2!R13C1:R18C2,2,0)&"."&VLOOKUP(RC[-30],Sheet2!R7C1:R11C2,2,0)&VLOOKUP(RC[-30],Sheet2!R1C1:R5C2,2,0)&RC[-29]&RC[-28]&RC[-27]&Sheet2!R1C3 -> #N/A | AG299: =IF(RC[-26]&RC[-25]&RC[-24]&RC[-23]&RC[-22]&RC[-21]="",,R1C6)&IF(RC[-26]="",,"|n"&R1C7&RC[-26])&IF(RC[-25]="",,"|n"&R1C8&RC[-25])&IF(RC[-24]="",,"|n"&R1C9&RC[-24])&IF(RC[-23]="",,"|n"&R1C10&RC[-23])&IF(RC[-22]="",,"|n"&R1C11&RC[-22])&IF(RC[-21]="",,"|n"&R1C12&RC[-21])&IF(RC[-19]&RC[-18]&RC[-17]&RC[-16]="",,"|n"&R1C13)&IF(RC[-19]="",,"|n"&R1C14&RC[-19])&IF(RC[-18]="",,"|n"&R1C15&RC[-18])&IF(RC[-17]="",,"|n"&R1C16&RC[-17])&IF(RC[-16]="",,"|n"&R1C17&RC[-16])&IF(RC[-15]="",,"|n"&R1C18&RC[-15])&IF(RC[-14]="",,"|n"&R1C19&RC[-14])&IF(RC[-13]="",,"|n"&R1C20&RC[-13])&IF(RC[-12]="",,"|n"&R1C21&RC[-12])&IF(RC[-11]="",,"|n"&R1C22&RC[-11])&IF(RC[-10]="",,"|n"&R1C23&RC[-10])&IF(RC[-9]="",,"|n"&R1C24&RC[-9])&IF(RC[-8]="",,"|n"&R1C25&RC[-8])&IF(RC[-7]="",,"|n"&R1C26&RC[-7])&IF(RC[-6]="",,"|n"&R1C27&RC[-6])&IF(RC[-5]="",,"|n"&R1C28&RC[-5])&IF(RC[-2]="",,"|n"&RC[-2]) -> 
AF300: =VLOOKUP(RC[-31],Sheet2!R13C1:R18C2,2,0)&"."&VLOOKUP(RC[-30],Sheet2!R7C1:R11C2,2,0)&VLOOKUP(RC[-30],Sheet2!R1C1:R5C2,2,0)&RC[-29]&RC[-28]&RC[-27]&Sheet2!R1C3 -> #N/A | AG300: =IF(RC[-26]&RC[-25]&RC[-24]&RC[-23]&RC[-22]&RC[-21]="",,R1C6)&IF(RC[-26]="",,"|n"&R1C7&RC[-26])&IF(RC[-25]="",,"|n"&R1C8&RC[-25])&IF(RC[-24]="",,"|n"&R1C9&RC[-24])&IF(RC[-23]="",,"|n"&R1C10&RC[-23])&IF(RC[-22]="",,"|n"&R1C11&RC[-22])&IF(RC[-21]="",,"|n"&R1C12&RC[-21])&IF(RC[-19]&RC[-18]&RC[-17]&RC[-16]="",,"|n"&R1C13)&IF(RC[-19]="",,"|n"&R1C14&RC[-19])&IF(RC[-18]="",,"|n"&R1C15&RC[-18])&IF(RC[-17]="",,"|n"&R1C16&RC[-17])&IF(RC[-16]="",,"|n"&R1C17&RC[-16])&IF(RC[-15]="",,"|n"&R1C18&RC[-15])&IF(RC[-14]="",,"|n"&R1C19&RC[-14])&IF(RC[-13]="",,"|n"&R1C20&RC[-13])&IF(RC[-12]="",,"|n"&R1C21&RC[-12])&IF(RC[-11]="",,"|n"&R1C22&RC[-11])&IF(RC[-10]="",,"|n"&R1C23&RC[-10])&IF(RC[-9]="",,"|n"&R1C24&RC[-9])&IF(RC[-8]="",,"|n"&R1C25&RC[-8])&IF(RC[-7]="",,"|n"&R1C26&RC[-7])&IF(RC[-6]="",,"|n"&R1C27&RC[-6])&IF(RC[-5]="",,"|n"&R1C28&RC[-5])&IF(RC[-2]="",,"|n"&RC[-2]) -> 
AF301: =VLOOKUP(RC[-31],Sheet2!R13C1:R18C2,2,0)&"."&VLOOKUP(RC[-30],Sheet2!R7C1:R11C2,2,0)&VLOOKUP(RC[-30],Sheet2!R1C1:R5C2,2,0)&RC[-29]&RC[-28]&RC[-27]&Sheet2!R1C3 -> #N/A | AG301: =IF(RC[-26]&RC[-25]&RC[-24]&RC[-23]&RC[-22]&RC[-21]="",,R1C6)&IF(RC[-26]="",,"|n"&R1C7&RC[-26])&IF(RC[-25]="",,"|n"&R1C8&RC[-25])&IF(RC[-24]="",,"|n"&R1C9&RC[-24])&IF(RC[-23]="",,"|n"&R1C10&RC[-23])&IF(RC[-22]="",,"|n"&R1C11&RC[-22])&IF(RC[-21]="",,"|n"&R1C12&RC[-21])&IF(RC[-19]&RC[-18]&RC[-17]&RC[-16]="",,"|n"&R1C13)&IF(RC[-19]="",,"|n"&R1C14&RC[-19])&IF(RC[-18]="",,"|n"&R1C15&RC[-18])&IF(RC[-17]="",,"|n"&R1C16&RC[-17])&IF(RC[-16]="",,"|n"&R1C17&RC[-16])&IF(RC[-15]="",,"|n"&R1C18&RC[-15])&IF(RC[-14]="",,"|n"&R1C19&RC[-14])&IF(RC[-13]="",,"|n"&R1C20&RC[-13])&IF(RC[-12]="",,"|n"&R1C21&RC[-12])&IF(RC[-11]="",,"|n"&R1C22&RC[-11])&IF(RC[-10]="",,"|n"&R1C23&RC[-10])&IF(RC[-9]="",,"|n"&R1C24&RC[-9])&IF(RC[-8]="",,"|n"&R1C25&RC[-8])&IF(RC[-7]="",,"|n"&R1C26&RC[-7])&IF(RC[-6]="",,"|n"&R1C27&RC[-6])&IF(RC[-5]="",,"|n"&R1C28&RC[-5])&IF(RC[-2]="",,"|n"&RC[-2]) -> 
AF302: =VLOOKUP(RC[-31],Sheet2!R13C1:R18C2,2,0)&"."&VLOOKUP(RC[-30],Sheet2!R7C1:R11C2,2,0)&VLOOKUP(RC[-30],Sheet2!R1C1:R5C2,2,0)&RC[-29]&RC[-28]&RC[-27]&Sheet2!R1C3 -> #N/A | AG302: =IF(RC[-26]&RC[-25]&RC[-24]&RC[-23]&RC[-22]&RC[-21]="",,R1C6)&IF(RC[-26]="",,"|n"&R1C7&RC[-26])&IF(RC[-25]="",,"|n"&R1C8&RC[-25])&IF(RC[-24]="",,"|n"&R1C9&RC[-24])&IF(RC[-23]="",,"|n"&R1C10&RC[-23])&IF(RC[-22]="",,"|n"&R1C11&RC[-22])&IF(RC[-21]="",,"|n"&R1C12&RC[-21])&IF(RC[-19]&RC[-18]&RC[-17]&RC[-16]="",,"|n"&R1C13)&IF(RC[-19]="",,"|n"&R1C14&RC[-19])&IF(RC[-18]="",,"|n"&R1C15&RC[-18])&IF(RC[-17]="",,"|n"&R1C16&RC[-17])&IF(RC[-16]="",,"|n"&R1C17&RC[-16])&IF(RC[-15]="",,"|n"&R1C18&RC[-15])&IF(RC[-14]="",,"|n"&R1C19&RC[-14])&IF(RC[-13]="",,"|n"&R1C20&RC[-13])&IF(RC[-12]="",,"|n"&R1C21&RC[-12])&IF(RC[-11]="",,"|n"&R1C22&RC[-11])&IF(RC[-10]="",,"|n"&R1C23&RC[-10])&IF(RC[-9]="",,"|n"&R1C24&RC[-9])&IF(RC[-8]="",,"|n"&R1C25&RC[-8])&IF(RC[-7]="",,"|n"&R1C26&RC[-7])&IF(RC[-6]="",,"|n"&R1C27&RC[-6])&IF(RC[-5]="",,"|n"&R1C28&RC[-5])&IF(RC[-2]="",,"|n"&RC[-2]) -> 
AF303: =VLOOKUP(RC[-31],Sheet2!R13C1:R18C2,2,0)&"."&VLOOKUP(RC[-30],Sheet2!R7C1:R11C2,2,0)&VLOOKUP(RC[-30],Sheet2!R1C1:R5C2,2,0)&RC[-29]&RC[-28]&RC[-27]&Sheet2!R1C3 -> #N/A | AG303: =IF(RC[-26]&RC[-25]&RC[-24]&RC[-23]&RC[-22]&RC[-21]="",,R1C6)&IF(RC[-26]="",,"|n"&R1C7&RC[-26])&IF(RC[-25]="",,"|n"&R1C8&RC[-25])&IF(RC[-24]="",,"|n"&R1C9&RC[-24])&IF(RC[-23]="",,"|n"&R1C10&RC[-23])&IF(RC[-22]="",,"|n"&R1C11&RC[-22])&IF(RC[-21]="",,"|n"&R1C12&RC[-21])&IF(RC[-19]&RC[-18]&RC[-17]&RC[-16]="",,"|n"&R1C13)&IF(RC[-19]="",,"|n"&R1C14&RC[-19])&IF(RC[-18]="",,"|n"&R1C15&RC[-18])&IF(RC[-17]="",,"|n"&R1C16&RC[-17])&IF(RC[-16]="",,"|n"&R1C17&RC[-16])&IF(RC[-15]="",,"|n"&R1C18&RC[-15])&IF(RC[-14]="",,"|n"&R1C19&RC[-14])&IF(RC[-13]="",,"|n"&R1C20&RC[-13])&IF(RC[-12]="",,"|n"&R1C21&RC[-12])&IF(RC[-11]="",,"|n"&R1C22&RC[-11])&IF(RC[-10]="",,"|n"&R1C23&RC[-10])&IF(RC[-9]="",,"|n"&R1C24&RC[-9])&IF(RC[-8]="",,"|n"&R1C25&RC[-8])&IF(RC[-7]="",,"|n"&R1C26&RC[-7])&IF(RC[-6]="",,"|n"&R1C27&RC[-6])&IF(RC[-5]="",,"|n"&R1C28&RC[-5])&IF(RC[-2]="",,"|n"&RC[-2]) -> 
AF304: =VLOOKUP(RC[-31],Sheet2!R13C1:R18C2,2,0)&"."&VLOOKUP(RC[-30],Sheet2!R7C1:R11C2,2,0)&VLOOKUP(RC[-30],Sheet2!R1C1:R5C2,2,0)&RC[-29]&RC[-28]&RC[-27]&Sheet2!R1C3 -> #N/A | AG304: =IF(RC[-26]&RC[-25]&RC[-24]&RC[-23]&RC[-22]&RC[-21]="",,R1C6)&IF(RC[-26]="",,"|n"&R1C7&RC[-26])&IF(RC[-25]="",,"|n"&R1C8&RC[-25])&IF(RC[-24]="",,"|n"&R1C9&RC[-24])&IF(RC[-23]="",,"|n"&R1C10&RC[-23])&IF(RC[-22]="",,"|n"&R1C11&RC[-22])&IF(RC[-21]="",,"|n"&R1C12&RC[-21])&IF(RC[-19]&RC[-18]&RC[-17]&RC[-16]="",,"|n"&R1C13)&IF(RC[-19]="",,"|n"&R1C14&RC[-19])&IF(RC[-18]="",,"|n"&R1C15&RC[-18])&IF(RC[-17]="",,"|n"&R1C16&RC[-17])&IF(RC[-16]="",,"|n"&R1C17&RC[-16])&IF(RC[-15]="",,"|n"&R1C18&RC[-15])&IF(RC[-14]="",,"|n"&R1C19&RC[-14])&IF(RC[-13]="",,"|n"&R1C20&RC[-13])&IF(RC[-12]="",,"|n"&R1C21&RC[-12])&IF(RC[-11]="",,"|n"&R1C22&RC[-11])&IF(RC[-10]="",,"|n"&R1C23&RC[-10])&IF(RC[-9]="",,"|n"&R1C24&RC[-9])&IF(RC[-8]="",,"|n"&R1C25&RC[-8])&IF(RC[-7]="",,"|n"&R1C26&RC[-7])&IF(RC[-6]="",,"|n"&R1C27&RC[-6])&IF(RC[-5]="",,"|n"&R1C28&RC[-5])&IF(RC[-2]="",,"|n"&RC[-2]) -> 
AF305: =VLOOKUP(RC[-31],Sheet2!R13C1:R18C2,2,0)&"."&VLOOKUP(RC[-30],Sheet2!R7C1:R11C2,2,0)&VLOOKUP(RC[-30],Sheet2!R1C1:R5C2,2,0)&RC[-29]&RC[-28]&RC[-27]&Sheet2!R1C3 -> #N/A | AG305: =IF(RC[-26]&RC[-25]&RC[-24]&RC[-23]&RC[-22]&RC[-21]="",,R1C6)&IF(RC[-26]="",,"|n"&R1C7&RC[-26])&IF(RC[-25]="",,"|n"&R1C8&RC[-25])&IF(RC[-24]="",,"|n"&R1C9&RC[-24])&IF(RC[-23]="",,"|n"&R1C10&RC[-23])&IF(RC[-22]="",,"|n"&R1C11&RC[-22])&IF(RC[-21]="",,"|n"&R1C12&RC[-21])&IF(RC[-19]&RC[-18]&RC[-17]&RC[-16]="",,"|n"&R1C13)&IF(RC[-19]="",,"|n"&R1C14&RC[-19])&IF(RC[-18]="",,"|n"&R1C15&RC[-18])&IF(RC[-17]="",,"|n"&R1C16&RC[-17])&IF(RC[-16]="",,"|n"&R1C17&RC[-16])&IF(RC[-15]="",,"|n"&R1C18&RC[-15])&IF(RC[-14]="",,"|n"&R1C19&RC[-14])&IF(RC[-13]="",,"|n"&R1C20&RC[-13])&IF(RC[-12]="",,"|n"&R1C21&RC[-12])&IF(RC[-10]="",,"|n"&R1C23&RC[-10])&IF(RC[-9]="",,"|n"&R1C24&RC[-9])&IF(RC[-8]="",,"|n"&R1C25&RC[-8])&IF(RC[-7]="",,"|n"&R1C26&RC[-7])&IF(RC[-6]="",,"|n"&R1C27&RC[-6])&IF(RC[-5]="",,"|n"&R1C28&RC[-5])&IF(RC[-2]="",,"|n"&RC[-2]) -> 
AF306: =VLOOKUP(RC[-31],Sheet2!R13C1:R18C2,2,0)&"."&VLOOKUP(RC[-30],Sheet2!R7C1:R11C2,2,0)&VLOOKUP(RC[-30],Sheet2!R1C1:R5C2,2,0)&RC[-29]&RC[-28]&RC[-27]&Sheet2!R1C3 -> #N/A | AG306: =IF(RC[-26]&RC[-25]&RC[-24]&RC[-23]&RC[-22]&RC[-21]="",,R1C6)&IF(RC[-26]="",,"|n"&R1C7&RC[-26])&IF(RC[-25]="",,"|n"&R1C8&RC[-25])&IF(RC[-24]="",,"|n"&R1C9&RC[-24])&IF(RC[-23]="",,"|n"&R1C10&RC[-23])&IF(RC[-22]="",,"|n"&R1C11&RC[-22])&IF(RC[-21]="",,"|n"&R1C12&RC[-21])&IF(RC[-19]&RC[-18]&RC[-17]&RC[-16]="",,"|n"&R1C13)&IF(RC[-19]="",,"|n"&R1C14&RC[-19])&IF(RC[-18]="",,"|n"&R1C15&RC[-18])&IF(RC[-17]="",,"|n"&R1C16&RC[-17])&IF(RC[-16]="",,"|n"&R1C17&RC[-16])&IF(RC[-15]="",,"|n"&R1C18&RC[-15])&IF(RC[-14]="",,"|n"&R1C19&RC[-14])&IF(RC[-13]="",,"|n"&R1C20&RC[-13])&IF(RC[-12]="",,"|n"&R1C21&RC[-12])&IF(RC[-10]="",,"|n"&R1C23&RC[-10])&IF(RC[-9]="",,"|n"&R1C24&RC[-9])&IF(RC[-8]="",,"|n"&R1C25&RC[-8])&IF(RC[-7]="",,"|n"&R1C26&RC[-7])&IF(RC[-6]="",,"|n"&R1C27&RC[-6])&IF(RC[-5]="",,"|n"&R1C28&RC[-5])&IF(RC[-2]="",,"|n"&RC[-2]) -> 
AF307: =VLOOKUP(RC[-31],Sheet2!R13C1:R18C2,2,0)&"."&VLOOKUP(RC[-30],Sheet2!R7C1:R11C2,2,0)&VLOOKUP(RC[-30],Sheet2!R1C1:R5C2,2,0)&RC[-29]&RC[-28]&RC[-27]&Sheet2!R1C3 -> #N/A | AG307: =IF(RC[-26]&RC[-25]&RC[-24]&RC[-23]&RC[-22]&RC[-21]="",,R1C6)&IF(RC[-26]="",,"|n"&R1C7&RC[-26])&IF(RC[-25]="",,"|n"&R1C8&RC[-25])&IF(RC[-24]="",,"|n"&R1C9&RC[-24])&IF(RC[-23]="",,"|n"&R1C10&RC[-23])&IF(RC[-22]="",,"|n"&R1C11&RC[-22])&IF(RC[-21]="",,"|n"&R1C12&RC[-21])&IF(RC[-19]&RC[-18]&RC[-17]&RC[-16]="",,"|n"&R1C13)&IF(RC[-19]="",,"|n"&R1C14&RC[-19])&IF(RC[-18]="",,"|n"&R1C15&RC[-18])&IF(RC[-17]="",,"|n"&R1C16&RC[-17])&IF(RC[-16]="",,"|n"&R1C17&RC[-16])&IF(RC[-15]="",,"|n"&R1C18&RC[-15])&IF(RC[-14]="",,"|n"&R1C19&RC[-14])&IF(RC[-13]="",,"|n"&R1C20&RC[-13])&IF(RC[-12]="",,"|n"&R1C21&RC[-12])&IF(RC[-10]="",,"|n"&R1C23&RC[-10])&IF(RC[-9]="",,"|n"&R1C24&RC[-9])&IF(RC[-8]="",,"|n"&R1C25&RC[-8])&IF(RC[-7]="",,"|n"&R1C26&RC[-7])&IF(RC[-6]="",,"|n"&R1C27&RC[-6])&IF(RC[-5]="",,"|n"&R1C28&RC[-5])&IF(RC[-2]="",,"|n"&RC[-2]) -> 
AF308: =VLOOKUP(RC[-31],Sheet2!R13C1:R18C2,2,0)&"."&VLOOKUP(RC[-30],Sheet2!R7C1:R11C2,2,0)&VLOOKUP(RC[-30],Sheet2!R1C1:R5C2,2,0)&RC[-29]&RC[-28]&RC[-27]&Sheet2!R1C3 -> #N/A | AG308: =IF(RC[-26]&RC[-25]&RC[-24]&RC[-23]&RC[-22]&RC[-21]="",,R1C6)&IF(RC[-26]="",,"|n"&R1C7&RC[-26])&IF(RC[-25]="",,"|n"&R1C8&RC[-25])&IF(RC[-24]="",,"|n"&R1C9&RC[-24])&IF(RC[-23]="",,"|n"&R1C10&RC[-23])&IF(RC[-22]="",,"|n"&R1C11&RC[-22])&IF(RC[-21]="",,"|n"&R1C12&RC[-21])&IF(RC[-19]&RC[-18]&RC[-17]&RC[-16]="",,"|n"&R1C13)&IF(RC[-19]="",,"|n"&R1C14&RC[-19])&IF(RC[-18]="",,"|n"&R1C15&RC[-18])&IF(RC[-17]="",,"|n"&R1C16&RC[-17])&IF(RC[-16]="",,"|n"&R1C17&RC[-16])&IF(RC[-15]="",,"|n"&R1C18&RC[-15])&IF(RC[-14]="",,"|n"&R1C19&RC[-14])&IF(RC[-13]="",,"|n"&R1C20&RC[-13])&IF(RC[-12]="",,"|n"&R1C21&RC[-12])&IF(RC[-10]="",,"|n"&R1C23&RC[-10])&IF(RC[-9]="",,"|n"&R1C24&RC[-9])&IF(RC[-8]="",,"|n"&R1C25&RC[-8])&IF(RC[-7]="",,"|n"&R1C26&RC[-7])&IF(RC[-6]="",,"|n"&R1C27&RC[-6])&IF(RC[-5]="",,"|n"&R1C28&RC[-5])&IF(RC[-2]="",,"|n"&RC[-2]) -> 
AF309: =VLOOKUP(RC[-31],Sheet2!R13C1:R18C2,2,0)&"."&VLOOKUP(RC[-30],Sheet2!R7C1:R11C2,2,0)&VLOOKUP(RC[-30],Sheet2!R1C1:R5C2,2,0)&RC[-29]&RC[-28]&RC[-27]&Sheet2!R1C3 -> #N/A | AG309: =IF(RC[-26]&RC[-25]&RC[-24]&RC[-23]&RC[-22]&RC[-21]="",,R1C6)&IF(RC[-26]="",,"|n"&R1C7&RC[-26])&IF(RC[-25]="",,"|n"&R1C8&RC[-25])&IF(RC[-24]="",,"|n"&R1C9&RC[-24])&IF(RC[-23]="",,"|n"&R1C10&RC[-23])&IF(RC[-22]="",,"|n"&R1C11&RC[-22])&IF(RC[-21]="",,"|n"&R1C12&RC[-21])&IF(RC[-19]&RC[-18]&RC[-17]&RC[-16]="",,"|n"&R1C13)&IF(RC[-19]="",,"|n"&R1C14&RC[-19])&IF(RC[-18]="",,"|n"&R1C15&RC[-18])&IF(RC[-17]="",,"|n"&R1C16&RC[-17])&IF(RC[-16]="",,"|n"&R1C17&RC[-16])&IF(RC[-15]="",,"|n"&R1C18&RC[-15])&IF(RC[-14]="",,"|n"&R1C19&RC[-14])&IF(RC[-13]="",,"|n"&R1C20&RC[-13])&IF(RC[-12]="",,"|n"&R1C21&RC[-12])&IF(RC[-10]="",,"|n"&R1C23&RC[-10])&IF(RC[-9]="",,"|n"&R1C24&RC[-9])&IF(RC[-8]="",,"|n"&R1C25&RC[-8])&IF(RC[-7]="",,"|n"&R1C26&RC[-7])&IF(RC[-6]="",,"|n"&R1C27&RC[-6])&IF(RC[-5]="",,"|n"&R1C28&RC[-5])&IF(RC[-2]="",,"|n"&RC[-2]) -> 
AF310: =VLOOKUP(RC[-31],Sheet2!R13C1:R18C2,2,0)&"."&VLOOKUP(RC[-30],Sheet2!R7C1:R11C2,2,0)&VLOOKUP(RC[-30],Sheet2!R1C1:R5C2,2,0)&RC[-29]&RC[-28]&RC[-27]&Sheet2!R1C3 -> #N/A | AG310: =IF(RC[-26]&RC[-25]&RC[-24]&RC[-23]&RC[-22]&RC[-21]="",,R1C6)&IF(RC[-26]="",,"|n"&R1C7&RC[-26])&IF(RC[-25]="",,"|n"&R1C8&RC[-25])&IF(RC[-24]="",,"|n"&R1C9&RC[-24])&IF(RC[-23]="",,"|n"&R1C10&RC[-23])&IF(RC[-22]="",,"|n"&R1C11&RC[-22])&IF(RC[-21]="",,"|n"&R1C12&RC[-21])&IF(RC[-19]&RC[-18]&RC[-17]&RC[-16]="",,"|n"&R1C13)&IF(RC[-19]="",,"|n"&R1C14&RC[-19])&IF(RC[-18]="",,"|n"&R1C15&RC[-18])&IF(RC[-17]="",,"|n"&R1C16&RC[-17])&IF(RC[-16]="",,"|n"&R1C17&RC[-16])&IF(RC[-15]="",,"|n"&R1C18&RC[-15])&IF(RC[-14]="",,"|n"&R1C19&RC[-14])&IF(RC[-13]="",,"|n"&R1C20&RC[-13])&IF(RC[-12]="",,"|n"&R1C21&RC[-12])&IF(RC[-10]="",,"|n"&R1C23&RC[-10])&IF(RC[-9]="",,"|n"&R1C24&RC[-9])&IF(RC[-8]="",,"|n"&R1C25&RC[-8])&IF(RC[-7]="",,"|n"&R1C26&RC[-7])&IF(RC[-6]="",,"|n"&R1C27&RC[-6])&IF(RC[-5]="",,"|n"&R1C28&RC[-5])&IF(RC[-2]="",,"|n"&RC[-2]) -> 
AF311: =VLOOKUP(RC[-31],Sheet2!R13C1:R18C2,2,0)&"."&VLOOKUP(RC[-30],Sheet2!R7C1:R11C2,2,0)&VLOOKUP(RC[-30],Sheet2!R1C1:R5C2,2,0)&RC[-29]&RC[-28]&RC[-27]&Sheet2!R1C3 -> #N/A | AG311: =IF(RC[-26]&RC[-25]&RC[-24]&RC[-23]&RC[-22]&RC[-21]="",,R1C6)&IF(RC[-26]="",,"|n"&R1C7&RC[-26])&IF(RC[-25]="",,"|n"&R1C8&RC[-25])&IF(RC[-24]="",,"|n"&R1C9&RC[-24])&IF(RC[-23]="",,"|n"&R1C10&RC[-23])&IF(RC[-22]="",,"|n"&R1C11&RC[-22])&IF(RC[-21]="",,"|n"&R1C12&RC[-21])&IF(RC[-19]&RC[-18]&RC[-17]&RC[-16]="",,"|n"&R1C13)&IF(RC[-19]="",,"|n"&R1C14&RC[-19])&IF(RC[-18]="",,"|n"&R1C15&RC[-18])&IF(RC[-17]="",,"|n"&R1C16&RC[-17])&IF(RC[-16]="",,"|n"&R1C17&RC[-16])&IF(RC[-15]="",,"|n"&R1C18&RC[-15])&IF(RC[-14]="",,"|n"&R1C19&RC[-14])&IF(RC[-13]="",,"|n"&R1C20&RC[-13])&IF(RC[-12]="",,"|n"&R1C21&RC[-12])&IF(RC[-10]="",,"|n"&R1C23&RC[-10])&IF(RC[-9]="",,"|n"&R1C24&RC[-9])&IF(RC[-8]="",,"|n"&R1C25&RC[-8])&IF(RC[-7]="",,"|n"&R1C26&RC[-7])&IF(RC[-6]="",,"|n"&R1C27&RC[-6])&IF(RC[-5]="",,"|n"&R1C28&RC[-5])&IF(RC[-2]="",,"|n"&RC[-2]) -> 
AF312: =VLOOKUP(RC[-31],Sheet2!R13C1:R18C2,2,0)&"."&VLOOKUP(RC[-30],Sheet2!R7C1:R11C2,2,0)&VLOOKUP(RC[-30],Sheet2!R1C1:R5C2,2,0)&RC[-29]&RC[-28]&RC[-27]&Sheet2!R1C3 -> #N/A | AG312: =IF(RC[-26]&RC[-25]&RC[-24]&RC[-23]&RC[-22]&RC[-21]="",,R1C6)&IF(RC[-26]="",,"|n"&R1C7&RC[-26])&IF(RC[-25]="",,"|n"&R1C8&RC[-25])&IF(RC[-24]="",,"|n"&R1C9&RC[-24])&IF(RC[-23]="",,"|n"&R1C10&RC[-23])&IF(RC[-22]="",,"|n"&R1C11&RC[-22])&IF(RC[-21]="",,"|n"&R1C12&RC[-21])&IF(RC[-19]&RC[-18]&RC[-17]&RC[-16]="",,"|n"&R1C13)&IF(RC[-19]="",,"|n"&R1C14&RC[-19])&IF(RC[-18]="",,"|n"&R1C15&RC[-18])&IF(RC[-17]="",,"|n"&R1C16&RC[-17])&IF(RC[-16]="",,"|n"&R1C17&RC[-16])&IF(RC[-15]="",,"|n"&R1C18&RC[-15])&IF(RC[-14]="",,"|n"&R1C19&RC[-14])&IF(RC[-13]="",,"|n"&R1C20&RC[-13])&IF(RC[-12]="",,"|n"&R1C21&RC[-12])&IF(RC[-10]="",,"|n"&R1C23&RC[-10])&IF(RC[-9]="",,"|n"&R1C24&RC[-9])&IF(RC[-8]="",,"|n"&R1C25&RC[-8])&IF(RC[-7]="",,"|n"&R1C26&RC[-7])&IF(RC[-6]="",,"|n"&R1C27&RC[-6])&IF(RC[-5]="",,"|n"&R1C28&RC[-5])&IF(RC[-2]="",,"|n"&RC[-2]) -> 
AF313: =VLOOKUP(RC[-31],Sheet2!R13C1:R18C2,2,0)&"."&VLOOKUP(RC[-30],Sheet2!R7C1:R11C2,2,0)&VLOOKUP(RC[-30],Sheet2!R1C1:R5C2,2,0)&RC[-29]&RC[-28]&RC[-27]&Sheet2!R1C3 -> #N/A | AG313: =IF(RC[-26]&RC[-25]&RC[-24]&RC[-23]&RC[-22]&RC[-21]="",,R1C6)&IF(RC[-26]="",,"|n"&R1C7&RC[-26])&IF(RC[-25]="",,"|n"&R1C8&RC[-25])&IF(RC[-24]="",,"|n"&R1C9&RC[-24])&IF(RC[-23]="",,"|n"&R1C10&RC[-23])&IF(RC[-22]="",,"|n"&R1C11&RC[-22])&IF(RC[-21]="",,"|n"&R1C12&RC[-21])&IF(RC[-19]&RC[-18]&RC[-17]&RC[-16]="",,"|n"&R1C13)&IF(RC[-19]="",,"|n"&R1C14&RC[-19])&IF(RC[-18]="",,"|n"&R1C15&RC[-18])&IF(RC[-17]="",,"|n"&R1C16&RC[-17])&IF(RC[-16]="",,"|n"&R1C17&RC[-16])&IF(RC[-15]="",,"|n"&R1C18&RC[-15])&IF(RC[-14]="",,"|n"&R1C19&RC[-14])&IF(RC[-13]="",,"|n"&R1C20&RC[-13])&IF(RC[-12]="",,"|n"&R1C21&RC[-12])&IF(RC[-10]="",,"|n"&R1C23&RC[-10])&IF(RC[-9]="",,"|n"&R1C24&RC[-9])&IF(RC[-8]="",,"|n"&R1C25&RC[-8])&IF(RC[-7]="",,"|n"&R1C26&RC[-7])&IF(RC[-6]="",,"|n"&R1C27&RC[-6])&IF(RC[-5]="",,"|n"&R1C28&RC[-5])&IF(RC[-2]="",,"|n"&RC[-2]) -> 
AF314: =VLOOKUP(RC[-31],Sheet2!R13C1:R18C2,2,0)&"."&VLOOKUP(RC[-30],Sheet2!R7C1:R11C2,2,0)&VLOOKUP(RC[-30],Sheet2!R1C1:R5C2,2,0)&RC[-29]&RC[-28]&RC[-27]&Sheet2!R1C3 -> #N/A | AG314: =IF(RC[-26]&RC[-25]&RC[-24]&RC[-23]&RC[-22]&RC[-21]="",,R1C6)&IF(RC[-26]="",,"|n"&R1C7&RC[-26])&IF(RC[-25]="",,"|n"&R1C8&RC[-25])&IF(RC[-24]="",,"|n"&R1C9&RC[-24])&IF(RC[-23]="",,"|n"&R1C10&RC[-23])&IF(RC[-22]="",,"|n"&R1C11&RC[-22])&IF(RC[-21]="",,"|n"&R1C12&RC[-21])&IF(RC[-19]&RC[-18]&RC[-17]&RC[-16]="",,"|n"&R1C13)&IF(RC[-19]="",,"|n"&R1C14&RC[-19])&IF(RC[-18]="",,"|n"&R1C15&RC[-18])&IF(RC[-17]="",,"|n"&R1C16&RC[-17])&IF(RC[-16]="",,"|n"&R1C17&RC[-16])&IF(RC[-15]="",,"|n"&R1C18&RC[-15])&IF(RC[-14]="",,"|n"&R1C19&RC[-14])&IF(RC[-13]="",,"|n"&R1C20&RC[-13])&IF(RC[-12]="",,"|n"&R1C21&RC[-12])&IF(RC[-10]="",,"|n"&R1C23&RC[-10])&IF(RC[-9]="",,"|n"&R1C24&RC[-9])&IF(RC[-8]="",,"|n"&R1C25&RC[-8])&IF(RC[-7]="",,"|n"&R1C26&RC[-7])&IF(RC[-6]="",,"|n"&R1C27&RC[-6])&IF(RC[-5]="",,"|n"&R1C28&RC[-5])&IF(RC[-2]="",,"|n"&RC[-2]) -> 
AF315: =VLOOKUP(RC[-31],Sheet2!R13C1:R18C2,2,0)&"."&VLOOKUP(RC[-30],Sheet2!R7C1:R11C2,2,0)&VLOOKUP(RC[-30],Sheet2!R1C1:R5C2,2,0)&RC[-29]&RC[-28]&RC[-27]&Sheet2!R1C3 -> #N/A | AG315: =IF(RC[-26]&RC[-25]&RC[-24]&RC[-23]&RC[-22]&RC[-21]="",,R1C6)&IF(RC[-26]="",,"|n"&R1C7&RC[-26])&IF(RC[-25]="",,"|n"&R1C8&RC[-25])&IF(RC[-24]="",,"|n"&R1C9&RC[-24])&IF(RC[-23]="",,"|n"&R1C10&RC[-23])&IF(RC[-22]="",,"|n"&R1C11&RC[-22])&IF(RC[-21]="",,"|n"&R1C12&RC[-21])&IF(RC[-19]&RC[-18]&RC[-17]&RC[-16]="",,"|n"&R1C13)&IF(RC[-19]="",,"|n"&R1C14&RC[-19])&IF(RC[-18]="",,"|n"&R1C15&RC[-18])&IF(RC[-17]="",,"|n"&R1C16&RC[-17])&IF(RC[-16]="",,"|n"&R1C17&RC[-16])&IF(RC[-15]="",,"|n"&R1C18&RC[-15])&IF(RC[-14]="",,"|n"&R1C19&RC[-14])&IF(RC[-13]="",,"|n"&R1C20&RC[-13])&IF(RC[-12]="",,"|n"&R1C21&RC[-12])&IF(RC[-10]="",,"|n"&R1C23&RC[-10])&IF(RC[-9]="",,"|n"&R1C24&RC[-9])&IF(RC[-8]="",,"|n"&R1C25&RC[-8])&IF(RC[-7]="",,"|n"&R1C26&RC[-7])&IF(RC[-6]="",,"|n"&R1C27&RC[-6])&IF(RC[-5]="",,"|n"&R1C28&RC[-5])&IF(RC[-2]="",,"|n"&RC[-2]) -> 
AF316: =VLOOKUP(RC[-31],Sheet2!R13C1:R18C2,2,0)&"."&VLOOKUP(RC[-30],Sheet2!R7C1:R11C2,2,0)&VLOOKUP(RC[-30],Sheet2!R1C1:R5C2,2,0)&RC[-29]&RC[-28]&RC[-27]&Sheet2!R1C3 -> #N/A | AG316: =IF(RC[-26]&RC[-25]&RC[-24]&RC[-23]&RC[-22]&RC[-21]="",,R1C6)&IF(RC[-26]="",,"|n"&R1C7&RC[-26])&IF(RC[-25]="",,"|n"&R1C8&RC[-25])&IF(RC[-24]="",,"|n"&R1C9&RC[-24])&IF(RC[-23]="",,"|n"&R1C10&RC[-23])&IF(RC[-22]="",,"|n"&R1C11&RC[-22])&IF(RC[-21]="",,"|n"&R1C12&RC[-21])&IF(RC[-19]&RC[-18]&RC[-17]&RC[-16]="",,"|n"&R1C13)&IF(RC[-19]="",,"|n"&R1C14&RC[-19])&IF(RC[-18]="",,"|n"&R1C15&RC[-18])&IF(RC[-17]="",,"|n"&R1C16&RC[-17])&IF(RC[-16]="",,"|n"&R1C17&RC[-16])&IF(RC[-15]="",,"|n"&R1C18&RC[-15])&IF(RC[-14]="",,"|n"&R1C19&RC[-14])&IF(RC[-13]="",,"|n"&R1C20&RC[-13])&IF(RC[-12]="",,"|n"&R1C21&RC[-12])&IF(RC[-10]="",,"|n"&R1C23&RC[-10])&IF(RC[-9]="",,"|n"&R1C24&RC[-9])&IF(RC[-8]="",,"|n"&R1C25&RC[-8])&IF(RC[-7]="",,"|n"&R1C26&RC[-7])&IF(RC[-6]="",,"|n"&R1C27&RC[-6])&IF(RC[-5]="",,"|n"&R1C28&RC[-5])&IF(RC[-2]="",,"|n"&RC[-2]) -> 
AF317: =VLOOKUP(RC[-31],Sheet2!R13C1:R18C2,2,0)&"."&VLOOKUP(RC[-30],Sheet2!R7C1:R11C2,2,0)&VLOOKUP(RC[-30],Sheet2!R1C1:R5C2,2,0)&RC[-29]&RC[-28]&RC[-27]&Sheet2!R1C3 -> #N/A | AG317: =IF(RC[-26]&RC[-25]&RC[-24]&RC[-23]&RC[-22]&RC[-21]="",,R1C6)&IF(RC[-26]="",,"|n"&R1C7&RC[-26])&IF(RC[-25]="",,"|n"&R1C8&RC[-25])&IF(RC[-24]="",,"|n"&R1C9&RC[-24])&IF(RC[-23]="",,"|n"&R1C10&RC[-23])&IF(RC[-22]="",,"|n"&R1C11&RC[-22])&IF(RC[-21]="",,"|n"&R1C12&RC[-21])&IF(RC[-19]&RC[-18]&RC[-17]&RC[-16]="",,"|n"&R1C13)&IF(RC[-19]="",,"|n"&R1C14&RC[-19])&IF(RC[-18]="",,"|n"&R1C15&RC[-18])&IF(RC[-17]="",,"|n"&R1C16&RC[-17])&IF(RC[-16]="",,"|n"&R1C17&RC[-16])&IF(RC[-15]="",,"|n"&R1C18&RC[-15])&IF(RC[-14]="",,"|n"&R1C19&RC[-14])&IF(RC[-13]="",,"|n"&R1C20&RC[-13])&IF(RC[-12]="",,"|n"&R1C21&RC[-12])&IF(RC[-10]="",,"|n"&R1C23&RC[-10])&IF(RC[-9]="",,"|n"&R1C24&RC[-9])&IF(RC[-8]="",,"|n"&R1C25&RC[-8])&IF(RC[-7]="",,"|n"&R1C26&RC[-7])&IF(RC[-6]="",,"|n"&R1C27&RC[-6])&IF(RC[-5]="",,"|n"&R1C28&RC[-5])&IF(RC[-2]="",,"|n"&RC[-2]) -> 
AF318: =VLOOKUP(RC[-31],Sheet2!R13C1:R18C2,2,0)&"."&VLOOKUP(RC[-30],Sheet2!R7C1:R11C2,2,0)&VLOOKUP(RC[-30],Sheet2!R1C1:R5C2,2,0)&RC[-29]&RC[-28]&RC[-27]&Sheet2!R1C3 -> #N/A | AG318: =IF(RC[-26]&RC[-25]&RC[-24]&RC[-23]&RC[-22]&RC[-21]="",,R1C6)&IF(RC[-26]="",,"|n"&R1C7&RC[-26])&IF(RC[-25]="",,"|n"&R1C8&RC[-25])&IF(RC[-24]="",,"|n"&R1C9&RC[-24])&IF(RC[-23]="",,"|n"&R1C10&RC[-23])&IF(RC[-22]="",,"|n"&R1C11&RC[-22])&IF(RC[-21]="",,"|n"&R1C12&RC[-21])&IF(RC[-19]&RC[-18]&RC[-17]&RC[-16]="",,"|n"&R1C13)&IF(RC[-19]="",,"|n"&R1C14&RC[-19])&IF(RC[-18]="",,"|n"&R1C15&RC[-18])&IF(RC[-17]="",,"|n"&R1C16&RC[-17])&IF(RC[-16]="",,"|n"&R1C17&RC[-16])&IF(RC[-15]="",,"|n"&R1C18&RC[-15])&IF(RC[-14]="",,"|n"&R1C19&RC[-14])&IF(RC[-13]="",,"|n"&R1C20&RC[-13])&IF(RC[-12]="",,"|n"&R1C21&RC[-12])&IF(RC[-10]="",,"|n"&R1C23&RC[-10])&IF(RC[-9]="",,"|n"&R1C24&RC[-9])&IF(RC[-8]="",,"|n"&R1C25&RC[-8])&IF(RC[-7]="",,"|n"&R1C26&RC[-7])&IF(RC[-6]="",,"|n"&R1C27&RC[-6])&IF(RC[-5]="",,"|n"&R1C28&RC[-5])&IF(RC[-2]="",,"|n"&RC[-2]) -> 
AF319: =VLOOKUP(RC[-31],Sheet2!R13C1:R18C2,2,0)&"."&VLOOKUP(RC[-30],Sheet2!R7C1:R11C2,2,0)&VLOOKUP(RC[-30],Sheet2!R1C1:R5C2,2,0)&RC[-29]&RC[-28]&RC[-27]&Sheet2!R1C3 -> #N/A | AG319: =IF(RC[-26]&RC[-25]&RC[-24]&RC[-23]&RC[-22]&RC[-21]="",,R1C6)&IF(RC[-26]="",,"|n"&R1C7&RC[-26])&IF(RC[-25]="",,"|n"&R1C8&RC[-25])&IF(RC[-24]="",,"|n"&R1C9&RC[-24])&IF(RC[-23]="",,"|n"&R1C10&RC[-23])&IF(RC[-22]="",,"|n"&R1C11&RC[-22])&IF(RC[-21]="",,"|n"&R1C12&RC[-21])&IF(RC[-19]&RC[-18]&RC[-17]&RC[-16]="",,"|n"&R1C13)&IF(RC[-19]="",,"|n"&R1C14&RC[-19])&IF(RC[-18]="",,"|n"&R1C15&RC[-18])&IF(RC[-17]="",,"|n"&R1C16&RC[-17])&IF(RC[-16]="",,"|n"&R1C17&RC[-16])&IF(RC[-15]="",,"|n"&R1C18&RC[-15])&IF(RC[-14]="",,"|n"&R1C19&RC[-14])&IF(RC[-13]="",,"|n"&R1C20&RC[-13])&IF(RC[-12]="",,"|n"&R1C21&RC[-12])&IF(RC[-10]="",,"|n"&R1C23&RC[-10])&IF(RC[-9]="",,"|n"&R1C24&RC[-9])&IF(RC[-8]="",,"|n"&R1C25&RC[-8])&IF(RC[-7]="",,"|n"&R1C26&RC[-7])&IF(RC[-6]="",,"|n"&R1C27&RC[-6])&IF(RC[-5]="",,"|n"&R1C28&RC[-5])&IF(RC[-2]="",,"|n"&RC[-2]) -> 
AF320: =VLOOKUP(RC[-31],Sheet2!R13C1:R18C2,2,0)&"."&VLOOKUP(RC[-30],Sheet2!R7C1:R11C2,2,0)&VLOOKUP(RC[-30],Sheet2!R1C1:R5C2,2,0)&RC[-29]&RC[-28]&RC[-27]&Sheet2!R1C3 -> #N/A | AG320: =IF(RC[-26]&RC[-25]&RC[-24]&RC[-23]&RC[-22]&RC[-21]="",,R1C6)&IF(RC[-26]="",,"|n"&R1C7&RC[-26])&IF(RC[-25]="",,"|n"&R1C8&RC[-25])&IF(RC[-24]="",,"|n"&R1C9&RC[-24])&IF(RC[-23]="",,"|n"&R1C10&RC[-23])&IF(RC[-22]="",,"|n"&R1C11&RC[-22])&IF(RC[-21]="",,"|n"&R1C12&RC[-21])&IF(RC[-19]&RC[-18]&RC[-17]&RC[-16]="",,"|n"&R1C13)&IF(RC[-19]="",,"|n"&R1C14&RC[-19])&IF(RC[-18]="",,"|n"&R1C15&RC[-18])&IF(RC[-17]="",,"|n"&R1C16&RC[-17])&IF(RC[-16]="",,"|n"&R1C17&RC[-16])&IF(RC[-15]="",,"|n"&R1C18&RC[-15])&IF(RC[-14]="",,"|n"&R1C19&RC[-14])&IF(RC[-13]="",,"|n"&R1C20&RC[-13])&IF(RC[-12]="",,"|n"&R1C21&RC[-12])&IF(RC[-10]="",,"|n"&R1C23&RC[-10])&IF(RC[-9]="",,"|n"&R1C24&RC[-9])&IF(RC[-8]="",,"|n"&R1C25&RC[-8])&IF(RC[-7]="",,"|n"&R1C26&RC[-7])&IF(RC[-6]="",,"|n"&R1C27&RC[-6])&IF(RC[-5]="",,"|n"&R1C28&RC[-5])&IF(RC[-2]="",,"|n"&RC[-2]) -> 
AF321: =VLOOKUP(RC[-31],Sheet2!R13C1:R18C2,2,0)&"."&VLOOKUP(RC[-30],Sheet2!R7C1:R11C2,2,0)&VLOOKUP(RC[-30],Sheet2!R1C1:R5C2,2,0)&RC[-29]&RC[-28]&RC[-27]&Sheet2!R1C3 -> #N/A | AG321: =IF(RC[-26]&RC[-25]&RC[-24]&RC[-23]&RC[-22]&RC[-21]="",,R1C6)&IF(RC[-26]="",,"|n"&R1C7&RC[-26])&IF(RC[-25]="",,"|n"&R1C8&RC[-25])&IF(RC[-24]="",,"|n"&R1C9&RC[-24])&IF(RC[-23]="",,"|n"&R1C10&RC[-23])&IF(RC[-22]="",,"|n"&R1C11&RC[-22])&IF(RC[-21]="",,"|n"&R1C12&RC[-21])&IF(RC[-19]&RC[-18]&RC[-17]&RC[-16]="",,"|n"&R1C13)&IF(RC[-19]="",,"|n"&R1C14&RC[-19])&IF(RC[-18]="",,"|n"&R1C15&RC[-18])&IF(RC[-17]="",,"|n"&R1C16&RC[-17])&IF(RC[-16]="",,"|n"&R1C17&RC[-16])&IF(RC[-15]="",,"|n"&R1C18&RC[-15])&IF(RC[-14]="",,"|n"&R1C19&RC[-14])&IF(RC[-13]="",,"|n"&R1C20&RC[-13])&IF(RC[-12]="",,"|n"&R1C21&RC[-12])&IF(RC[-10]="",,"|n"&R1C23&RC[-10])&IF(RC[-9]="",,"|n"&R1C24&RC[-9])&IF(RC[-8]="",,"|n"&R1C25&RC[-8])&IF(RC[-7]="",,"|n"&R1C26&RC[-7])&IF(RC[-6]="",,"|n"&R1C27&RC[-6])&IF(RC[-5]="",,"|n"&R1C28&RC[-5])&IF(RC[-2]="",,"|n"&RC[-2]) -> 
AF322: =VLOOKUP(RC[-31],Sheet2!R13C1:R18C2,2,0)&"."&VLOOKUP(RC[-30],Sheet2!R7C1:R11C2,2,0)&VLOOKUP(RC[-30],Sheet2!R1C1:R5C2,2,0)&RC[-29]&RC[-28]&RC[-27]&Sheet2!R1C3 -> #N/A | AG322: =IF(RC[-26]&RC[-25]&RC[-24]&RC[-23]&RC[-22]&RC[-21]="",,R1C6)&IF(RC[-26]="",,"|n"&R1C7&RC[-26])&IF(RC[-25]="",,"|n"&R1C8&RC[-25])&IF(RC[-24]="",,"|n"&R1C9&RC[-24])&IF(RC[-23]="",,"|n"&R1C10&RC[-23])&IF(RC[-22]="",,"|n"&R1C11&RC[-22])&IF(RC[-21]="",,"|n"&R1C12&RC[-21])&IF(RC[-19]&RC[-18]&RC[-17]&RC[-16]="",,"|n"&R1C13)&IF(RC[-19]="",,"|n"&R1C14&RC[-19])&IF(RC[-18]="",,"|n"&R1C15&RC[-18])&IF(RC[-17]="",,"|n"&R1C16&RC[-17])&IF(RC[-16]="",,"|n"&R1C17&RC[-16])&IF(RC[-15]="",,"|n"&R1C18&RC[-15])&IF(RC[-14]="",,"|n"&R1C19&RC[-14])&IF(RC[-13]="",,"|n"&R1C20&RC[-13])&IF(RC[-12]="",,"|n"&R1C21&RC[-12])&IF(RC[-10]="",,"|n"&R1C23&RC[-10])&IF(RC[-9]="",,"|n"&R1C24&RC[-9])&IF(RC[-8]="",,"|n"&R1C25&RC[-8])&IF(RC[-7]="",,"|n"&R1C26&RC[-7])&IF(RC[-6]="",,"|n"&R1C27&RC[-6])&IF(RC[-5]="",,"|n"&R1C28&RC[-5])&IF(RC[-2]="",,"|n"&RC[-2]) -> 
AF323: =VLOOKUP(RC[-31],Sheet2!R13C1:R18C2,2,0)&"."&VLOOKUP(RC[-30],Sheet2!R7C1:R11C2,2,0)&VLOOKUP(RC[-30],Sheet2!R1C1:R5C2,2,0)&RC[-29]&RC[-28]&RC[-27]&Sheet2!R1C3 -> #N/A | AG323: =IF(RC[-26]&RC[-25]&RC[-24]&RC[-23]&RC[-22]&RC[-21]="",,R1C6)&IF(RC[-26]="",,"|n"&R1C7&RC[-26])&IF(RC[-25]="",,"|n"&R1C8&RC[-25])&IF(RC[-24]="",,"|n"&R1C9&RC[-24])&IF(RC[-23]="",,"|n"&R1C10&RC[-23])&IF(RC[-22]="",,"|n"&R1C11&RC[-22])&IF(RC[-21]="",,"|n"&R1C12&RC[-21])&IF(RC[-19]&RC[-18]&RC[-17]&RC[-16]="",,"|n"&R1C13)&IF(RC[-19]="",,"|n"&R1C14&RC[-19])&IF(RC[-18]="",,"|n"&R1C15&RC[-18])&IF(RC[-17]="",,"|n"&R1C16&RC[-17])&IF(RC[-16]="",,"|n"&R1C17&RC[-16])&IF(RC[-15]="",,"|n"&R1C18&RC[-15])&IF(RC[-14]="",,"|n"&R1C19&RC[-14])&IF(RC[-13]="",,"|n"&R1C20&RC[-13])&IF(RC[-12]="",,"|n"&R1C21&RC[-12])&IF(RC[-10]="",,"|n"&R1C23&RC[-10])&IF(RC[-9]="",,"|n"&R1C24&RC[-9])&IF(RC[-8]="",,"|n"&R1C25&RC[-8])&IF(RC[-7]="",,"|n"&R1C26&RC[-7])&IF(RC[-6]="",,"|n"&R1C27&RC[-6])&IF(RC[-5]="",,"|n"&R1C28&RC[-5])&IF(RC[-2]="",,"|n"&RC[-2]) -> 
AF324: =VLOOKUP(RC[-31],Sheet2!R13C1:R18C2,2,0)&"."&VLOOKUP(RC[-30],Sheet2!R7C1:R11C2,2,0)&VLOOKUP(RC[-30],Sheet2!R1C1:R5C2,2,0)&RC[-29]&RC[-28]&RC[-27]&Sheet2!R1C3 -> #N/A | AG324: =IF(RC[-26]&RC[-25]&RC[-24]&RC[-23]&RC[-22]&RC[-21]="",,R1C6)&IF(RC[-26]="",,"|n"&R1C7&RC[-26])&IF(RC[-25]="",,"|n"&R1C8&RC[-25])&IF(RC[-24]="",,"|n"&R1C9&RC[-24])&IF(RC[-23]="",,"|n"&R1C10&RC[-23])&IF(RC[-22]="",,"|n"&R1C11&RC[-22])&IF(RC[-21]="",,"|n"&R1C12&RC[-21])&IF(RC[-19]&RC[-18]&RC[-17]&RC[-16]="",,"|n"&R1C13)&IF(RC[-19]="",,"|n"&R1C14&RC[-19])&IF(RC[-18]="",,"|n"&R1C15&RC[-18])&IF(RC[-17]="",,"|n"&R1C16&RC[-17])&IF(RC[-16]="",,"|n"&R1C17&RC[-16])&IF(RC[-15]="",,"|n"&R1C18&RC[-15])&IF(RC[-14]="",,"|n"&R1C19&RC[-14])&IF(RC[-13]="",,"|n"&R1C20&RC[-13])&IF(RC[-12]="",,"|n"&R1C21&RC[-12])&IF(RC[-10]="",,"|n"&R1C23&RC[-10])&IF(RC[-9]="",,"|n"&R1C24&RC[-9])&IF(RC[-8]="",,"|n"&R1C25&RC[-8])&IF(RC[-7]="",,"|n"&R1C26&RC[-7])&IF(RC[-6]="",,"|n"&R1C27&RC[-6])&IF(RC[-5]="",,"|n"&R1C28&RC[-5])&IF(RC[-2]="",,"|n"&RC[-2]) -> 
AF325: =VLOOKUP(RC[-31],Sheet2!R13C1:R18C2,2,0)&"."&VLOOKUP(RC[-30],Sheet2!R7C1:R11C2,2,0)&VLOOKUP(RC[-30],Sheet2!R1C1:R5C2,2,0)&RC[-29]&RC[-28]&RC[-27]&Sheet2!R1C3 -> #N/A | AG325: =IF(RC[-26]&RC[-25]&RC[-24]&RC[-23]&RC[-22]&RC[-21]="",,R1C6)&IF(RC[-26]="",,"|n"&R1C7&RC[-26])&IF(RC[-25]="",,"|n"&R1C8&RC[-25])&IF(RC[-24]="",,"|n"&R1C9&RC[-24])&IF(RC[-23]="",,"|n"&R1C10&RC[-23])&IF(RC[-22]="",,"|n"&R1C11&RC[-22])&IF(RC[-21]="",,"|n"&R1C12&RC[-21])&IF(RC[-19]&RC[-18]&RC[-17]&RC[-16]="",,"|n"&R1C13)&IF(RC[-19]="",,"|n"&R1C14&RC[-19])&IF(RC[-18]="",,"|n"&R1C15&RC[-18])&IF(RC[-17]="",,"|n"&R1C16&RC[-17])&IF(RC[-16]="",,"|n"&R1C17&RC[-16])&IF(RC[-15]="",,"|n"&R1C18&RC[-15])&IF(RC[-14]="",,"|n"&R1C19&RC[-14])&IF(RC[-13]="",,"|n"&R1C20&RC[-13])&IF(RC[-12]="",,"|n"&R1C21&RC[-12])&IF(RC[-10]="",,"|n"&R1C23&RC[-10])&IF(RC[-9]="",,"|n"&R1C24&RC[-9])&IF(RC[-8]="",,"|n"&R1C25&RC[-8])&IF(RC[-7]="",,"|n"&R1C26&RC[-7])&IF(RC[-6]="",,"|n"&R1C27&RC[-6])&IF(RC[-5]="",,"|n"&R1C28&RC[-5])&IF(RC[-2]="",,"|n"&RC[-2]) -> 
AF326: =VLOOKUP(RC[-31],Sheet2!R13C1:R18C2,2,0)&"."&VLOOKUP(RC[-30],Sheet2!R7C1:R11C2,2,0)&VLOOKUP(RC[-30],Sheet2!R1C1:R5C2,2,0)&RC[-29]&RC[-28]&RC[-27]&Sheet2!R1C3 -> #N/A | AG326: =IF(RC[-26]&RC[-25]&RC[-24]&RC[-23]&RC[-22]&RC[-21]="",,R1C6)&IF(RC[-26]="",,"|n"&R1C7&RC[-26])&IF(RC[-25]="",,"|n"&R1C8&RC[-25])&IF(RC[-24]="",,"|n"&R1C9&RC[-24])&IF(RC[-23]="",,"|n"&R1C10&RC[-23])&IF(RC[-22]="",,"|n"&R1C11&RC[-22])&IF(RC[-21]="",,"|n"&R1C12&RC[-21])&IF(RC[-19]&RC[-18]&RC[-17]&RC[-16]="",,"|n"&R1C13)&IF(RC[-19]="",,"|n"&R1C14&RC[-19])&IF(RC[-18]="",,"|n"&R1C15&RC[-18])&IF(RC[-17]="",,"|n"&R1C16&RC[-17])&IF(RC[-16]="",,"|n"&R1C17&RC[-16])&IF(RC[-15]="",,"|n"&R1C18&RC[-15])&IF(RC[-14]="",,"|n"&R1C19&RC[-14])&IF(RC[-13]="",,"|n"&R1C20&RC[-13])&IF(RC[-12]="",,"|n"&R1C21&RC[-12])&IF(RC[-10]="",,"|n"&R1C23&RC[-10])&IF(RC[-9]="",,"|n"&R1C24&RC[-9])&IF(RC[-8]="",,"|n"&R1C25&RC[-8])&IF(RC[-7]="",,"|n"&R1C26&RC[-7])&IF(RC[-6]="",,"|n"&R1C27&RC[-6])&IF(RC[-5]="",,"|n"&R1C28&RC[-5])&IF(RC[-2]="",,"|n"&RC[-2]) -> 
AF327: =VLOOKUP(RC[-31],Sheet2!R13C1:R18C2,2,0)&"."&VLOOKUP(RC[-30],Sheet2!R7C1:R11C2,2,0)&VLOOKUP(RC[-30],Sheet2!R1C1:R5C2,2,0)&RC[-29]&RC[-28]&RC[-27]&Sheet2!R1C3 -> #N/A | AG327: =IF(RC[-26]&RC[-25]&RC[-24]&RC[-23]&RC[-22]&RC[-21]="",,R1C6)&IF(RC[-26]="",,"|n"&R1C7&RC[-26])&IF(RC[-25]="",,"|n"&R1C8&RC[-25])&IF(RC[-24]="",,"|n"&R1C9&RC[-24])&IF(RC[-23]="",,"|n"&R1C10&RC[-23])&IF(RC[-22]="",,"|n"&R1C11&RC[-22])&IF(RC[-21]="",,"|n"&R1C12&RC[-21])&IF(RC[-19]&RC[-18]&RC[-17]&RC[-16]="",,"|n"&R1C13)&IF(RC[-19]="",,"|n"&R1C14&RC[-19])&IF(RC[-18]="",,"|n"&R1C15&RC[-18])&IF(RC[-17]="",,"|n"&R1C16&RC[-17])&IF(RC[-16]="",,"|n"&R1C17&RC[-16])&IF(RC[-15]="",,"|n"&R1C18&RC[-15])&IF(RC[-14]="",,"|n"&R1C19&RC[-14])&IF(RC[-13]="",,"|n"&R1C20&RC[-13])&IF(RC[-12]="",,"|n"&R1C21&RC[-12])&IF(RC[-10]="",,"|n"&R1C23&RC[-10])&IF(RC[-9]="",,"|n"&R1C24&RC[-9])&IF(RC[-8]="",,"|n"&R1C25&RC[-8])&IF(RC[-7]="",,"|n"&R1C26&RC[-7])&IF(RC[-6]="",,"|n"&R1C27&RC[-6])&IF(RC[-5]="",,"|n"&R1C28&RC[-5])&IF(RC[-2]="",,"|n"&RC[-2]) -> 
AF328: =VLOOKUP(RC[-31],Sheet2!R13C1:R18C2,2,0)&"."&VLOOKUP(RC[-30],Sheet2!R7C1:R11C2,2,0)&VLOOKUP(RC[-30],Sheet2!R1C1:R5C2,2,0)&RC[-29]&RC[-28]&RC[-27]&Sheet2!R1C3 -> #N/A | AG328: =IF(RC[-26]&RC[-25]&RC[-24]&RC[-23]&RC[-22]&RC[-21]="",,R1C6)&IF(RC[-26]="",,"|n"&R1C7&RC[-26])&IF(RC[-25]="",,"|n"&R1C8&RC[-25])&IF(RC[-24]="",,"|n"&R1C9&RC[-24])&IF(RC[-23]="",,"|n"&R1C10&RC[-23])&IF(RC[-22]="",,"|n"&R1C11&RC[-22])&IF(RC[-21]="",,"|n"&R1C12&RC[-21])&IF(RC[-19]&RC[-18]&RC[-17]&RC[-16]="",,"|n"&R1C13)&IF(RC[-19]="",,"|n"&R1C14&RC[-19])&IF(RC[-18]="",,"|n"&R1C15&RC[-18])&IF(RC[-17]="",,"|n"&R1C16&RC[-17])&IF(RC[-16]="",,"|n"&R1C17&RC[-16])&IF(RC[-15]="",,"|n"&R1C18&RC[-15])&IF(RC[-14]="",,"|n"&R1C19&RC[-14])&IF(RC[-13]="",,"|n"&R1C20&RC[-13])&IF(RC[-12]="",,"|n"&R1C21&RC[-12])&IF(RC[-10]="",,"|n"&R1C23&RC[-10])&IF(RC[-9]="",,"|n"&R1C24&RC[-9])&IF(RC[-8]="",,"|n"&R1C25&RC[-8])&IF(RC[-7]="",,"|n"&R1C26&RC[-7])&IF(RC[-6]="",,"|n"&R1C27&RC[-6])&IF(RC[-5]="",,"|n"&R1C28&RC[-5])&IF(RC[-2]="",,"|n"&RC[-2]) -> 
AF329: =VLOOKUP(RC[-31],Sheet2!R13C1:R18C2,2,0)&"."&VLOOKUP(RC[-30],Sheet2!R7C1:R11C2,2,0)&VLOOKUP(RC[-30],Sheet2!R1C1:R5C2,2,0)&RC[-29]&RC[-28]&RC[-27]&Sheet2!R1C3 -> #N/A | AG329: =IF(RC[-26]&RC[-25]&RC[-24]&RC[-23]&RC[-22]&RC[-21]="",,R1C6)&IF(RC[-26]="",,"|n"&R1C7&RC[-26])&IF(RC[-25]="",,"|n"&R1C8&RC[-25])&IF(RC[-24]="",,"|n"&R1C9&RC[-24])&IF(RC[-23]="",,"|n"&R1C10&RC[-23])&IF(RC[-22]="",,"|n"&R1C11&RC[-22])&IF(RC[-21]="",,"|n"&R1C12&RC[-21])&IF(RC[-19]&RC[-18]&RC[-17]&RC[-16]="",,"|n"&R1C13)&IF(RC[-19]="",,"|n"&R1C14&RC[-19])&IF(RC[-18]="",,"|n"&R1C15&RC[-18])&IF(RC[-17]="",,"|n"&R1C16&RC[-17])&IF(RC[-16]="",,"|n"&R1C17&RC[-16])&IF(RC[-15]="",,"|n"&R1C18&RC[-15])&IF(RC[-14]="",,"|n"&R1C19&RC[-14])&IF(RC[-13]="",,"|n"&R1C20&RC[-13])&IF(RC[-12]="",,"|n"&R1C21&RC[-12])&IF(RC[-10]="",,"|n"&R1C23&RC[-10])&IF(RC[-9]="",,"|n"&R1C24&RC[-9])&IF(RC[-8]="",,"|n"&R1C25&RC[-8])&IF(RC[-7]="",,"|n"&R1C26&RC[-7])&IF(RC[-6]="",,"|n"&R1C27&RC[-6])&IF(RC[-5]="",,"|n"&R1C28&RC[-5])&IF(RC[-2]="",,"|n"&RC[-2]) -> 
AF330: =VLOOKUP(RC[-31],Sheet2!R13C1:R18C2,2,0)&"."&VLOOKUP(RC[-30],Sheet2!R7C1:R11C2,2,0)&VLOOKUP(RC[-30],Sheet2!R1C1:R5C2,2,0)&RC[-29]&RC[-28]&RC[-27]&Sheet2!R1C3 -> #N/A | AG330: =IF(RC[-26]&RC[-25]&RC[-24]&RC[-23]&RC[-22]&RC[-21]="",,R1C6)&IF(RC[-26]="",,"|n"&R1C7&RC[-26])&IF(RC[-25]="",,"|n"&R1C8&RC[-25])&IF(RC[-24]="",,"|n"&R1C9&RC[-24])&IF(RC[-23]="",,"|n"&R1C10&RC[-23])&IF(RC[-22]="",,"|n"&R1C11&RC[-22])&IF(RC[-21]="",,"|n"&R1C12&RC[-21])&IF(RC[-19]&RC[-18]&RC[-17]&RC[-16]="",,"|n"&R1C13)&IF(RC[-19]="",,"|n"&R1C14&RC[-19])&IF(RC[-18]="",,"|n"&R1C15&RC[-18])&IF(RC[-17]="",,"|n"&R1C16&RC[-17])&IF(RC[-16]="",,"|n"&R1C17&RC[-16])&IF(RC[-15]="",,"|n"&R1C18&RC[-15])&IF(RC[-14]="",,"|n"&R1C19&RC[-14])&IF(RC[-13]="",,"|n"&R1C20&RC[-13])&IF(RC[-12]="",,"|n"&R1C21&RC[-12])&IF(RC[-10]="",,"|n"&R1C23&RC[-10])&IF(RC[-9]="",,"|n"&R1C24&RC[-9])&IF(RC[-8]="",,"|n"&R1C25&RC[-8])&IF(RC[-7]="",,"|n"&R1C26&RC[-7])&IF(RC[-6]="",,"|n"&R1C27&RC[-6])&IF(RC[-5]="",,"|n"&R1C28&RC[-5])&IF(RC[-2]="",,"|n"&RC[-2]) -> 
AF331: =VLOOKUP(RC[-31],Sheet2!R13C1:R18C2,2,0)&"."&VLOOKUP(RC[-30],Sheet2!R7C1:R11C2,2,0)&VLOOKUP(RC[-30],Sheet2!R1C1:R5C2,2,0)&RC[-29]&RC[-28]&RC[-27]&Sheet2!R1C3 -> #N/A | AG331: =IF(RC[-26]&RC[-25]&RC[-24]&RC[-23]&RC[-22]&RC[-21]="",,R1C6)&IF(RC[-26]="",,"|n"&R1C7&RC[-26])&IF(RC[-25]="",,"|n"&R1C8&RC[-25])&IF(RC[-24]="",,"|n"&R1C9&RC[-24])&IF(RC[-23]="",,"|n"&R1C10&RC[-23])&IF(RC[-22]="",,"|n"&R1C11&RC[-22])&IF(RC[-21]="",,"|n"&R1C12&RC[-21])&IF(RC[-19]&RC[-18]&RC[-17]&RC[-16]="",,"|n"&R1C13)&IF(RC[-19]="",,"|n"&R1C14&RC[-19])&IF(RC[-18]="",,"|n"&R1C15&RC[-18])&IF(RC[-17]="",,"|n"&R1C16&RC[-17])&IF(RC[-16]="",,"|n"&R1C17&RC[-16])&IF(RC[-15]="",,"|n"&R1C18&RC[-15])&IF(RC[-14]="",,"|n"&R1C19&RC[-14])&IF(RC[-13]="",,"|n"&R1C20&RC[-13])&IF(RC[-12]="",,"|n"&R1C21&RC[-12])&IF(RC[-10]="",,"|n"&R1C23&RC[-10])&IF(RC[-9]="",,"|n"&R1C24&RC[-9])&IF(RC[-8]="",,"|n"&R1C25&RC[-8])&IF(RC[-7]="",,"|n"&R1C26&RC[-7])&IF(RC[-6]="",,"|n"&R1C27&RC[-6])&IF(RC[-5]="",,"|n"&R1C28&RC[-5])&IF(RC[-2]="",,"|n"&RC[-2]) -> 
AF332: =VLOOKUP(RC[-31],Sheet2!R13C1:R18C2,2,0)&"."&VLOOKUP(RC[-30],Sheet2!R7C1:R11C2,2,0)&VLOOKUP(RC[-30],Sheet2!R1C1:R5C2,2,0)&RC[-29]&RC[-28]&RC[-27]&Sheet2!R1C3 -> #N/A | AG332: =IF(RC[-26]&RC[-25]&RC[-24]&RC[-23]&RC[-22]&RC[-21]="",,R1C6)&IF(RC[-26]="",,"|n"&R1C7&RC[-26])&IF(RC[-25]="",,"|n"&R1C8&RC[-25])&IF(RC[-24]="",,"|n"&R1C9&RC[-24])&IF(RC[-23]="",,"|n"&R1C10&RC[-23])&IF(RC[-22]="",,"|n"&R1C11&RC[-22])&IF(RC[-21]="",,"|n"&R1C12&RC[-21])&IF(RC[-19]&RC[-18]&RC[-17]&RC[-16]="",,"|n"&R1C13)&IF(RC[-19]="",,"|n"&R1C14&RC[-19])&IF(RC[-18]="",,"|n"&R1C15&RC[-18])&IF(RC[-17]="",,"|n"&R1C16&RC[-17])&IF(RC[-16]="",,"|n"&R1C17&RC[-16])&IF(RC[-15]="",,"|n"&R1C18&RC[-15])&IF(RC[-14]="",,"|n"&R1C19&RC[-14])&IF(RC[-13]="",,"|n"&R1C20&RC[-13])&IF(RC[-12]="",,"|n"&R1C21&RC[-12])&IF(RC[-10]="",,"|n"&R1C23&RC[-10])&IF(RC[-9]="",,"|n"&R1C24&RC[-9])&IF(RC[-8]="",,"|n"&R1C25&RC[-8])&IF(RC[-7]="",,"|n"&R1C26&RC[-7])&IF(RC[-6]="",,"|n"&R1C27&RC[-6])&IF(RC[-5]="",,"|n"&R1C28&RC[-5])&IF(RC[-2]="",,"|n"&RC[-2]) -> 
AF333: =VLOOKUP(RC[-31],Sheet2!R13C1:R18C2,2,0)&"."&VLOOKUP(RC[-30],Sheet2!R7C1:R11C2,2,0)&VLOOKUP(RC[-30],Sheet2!R1C1:R5C2,2,0)&RC[-29]&RC[-28]&RC[-27]&Sheet2!R1C3 -> #N/A | AG333: =IF(RC[-26]&RC[-25]&RC[-24]&RC[-23]&RC[-22]&RC[-21]="",,R1C6)&IF(RC[-26]="",,"|n"&R1C7&RC[-26])&IF(RC[-25]="",,"|n"&R1C8&RC[-25])&IF(RC[-24]="",,"|n"&R1C9&RC[-24])&IF(RC[-23]="",,"|n"&R1C10&RC[-23])&IF(RC[-22]="",,"|n"&R1C11&RC[-22])&IF(RC[-21]="",,"|n"&R1C12&RC[-21])&IF(RC[-19]&RC[-18]&RC[-17]&RC[-16]="",,"|n"&R1C13)&IF(RC[-19]="",,"|n"&R1C14&RC[-19])&IF(RC[-18]="",,"|n"&R1C15&RC[-18])&IF(RC[-17]="",,"|n"&R1C16&RC[-17])&IF(RC[-16]="",,"|n"&R1C17&RC[-16])&IF(RC[-15]="",,"|n"&R1C18&RC[-15])&IF(RC[-14]="",,"|n"&R1C19&RC[-14])&IF(RC[-13]="",,"|n"&R1C20&RC[-13])&IF(RC[-12]="",,"|n"&R1C21&RC[-12])&IF(RC[-10]="",,"|n"&R1C23&RC[-10])&IF(RC[-9]="",,"|n"&R1C24&RC[-9])&IF(RC[-8]="",,"|n"&R1C25&RC[-8])&IF(RC[-7]="",,"|n"&R1C26&RC[-7])&IF(RC[-6]="",,"|n"&R1C27&RC[-6])&IF(RC[-5]="",,"|n"&R1C28&RC[-5])&IF(RC[-2]="",,"|n"&RC[-2]) -> 
AF334: =VLOOKUP(RC[-31],Sheet2!R13C1:R18C2,2,0)&"."&VLOOKUP(RC[-30],Sheet2!R7C1:R11C2,2,0)&VLOOKUP(RC[-30],Sheet2!R1C1:R5C2,2,0)&RC[-29]&RC[-28]&RC[-27]&Sheet2!R1C3 -> #N/A | AG334: =IF(RC[-26]&RC[-25]&RC[-24]&RC[-23]&RC[-22]&RC[-21]="",,R1C6)&IF(RC[-26]="",,"|n"&R1C7&RC[-26])&IF(RC[-25]="",,"|n"&R1C8&RC[-25])&IF(RC[-24]="",,"|n"&R1C9&RC[-24])&IF(RC[-23]="",,"|n"&R1C10&RC[-23])&IF(RC[-22]="",,"|n"&R1C11&RC[-22])&IF(RC[-21]="",,"|n"&R1C12&RC[-21])&IF(RC[-19]&RC[-18]&RC[-17]&RC[-16]="",,"|n"&R1C13)&IF(RC[-19]="",,"|n"&R1C14&RC[-19])&IF(RC[-18]="",,"|n"&R1C15&RC[-18])&IF(RC[-17]="",,"|n"&R1C16&RC[-17])&IF(RC[-16]="",,"|n"&R1C17&RC[-16])&IF(RC[-15]="",,"|n"&R1C18&RC[-15])&IF(RC[-14]="",,"|n"&R1C19&RC[-14])&IF(RC[-13]="",,"|n"&R1C20&RC[-13])&IF(RC[-12]="",,"|n"&R1C21&RC[-12])&IF(RC[-10]="",,"|n"&R1C23&RC[-10])&IF(RC[-9]="",,"|n"&R1C24&RC[-9])&IF(RC[-8]="",,"|n"&R1C25&RC[-8])&IF(RC[-7]="",,"|n"&R1C26&RC[-7])&IF(RC[-6]="",,"|n"&R1C27&RC[-6])&IF(RC[-5]="",,"|n"&R1C28&RC[-5])&IF(RC[-2]="",,"|n"&RC[-2]) -> 
AF335: =VLOOKUP(RC[-31],Sheet2!R13C1:R18C2,2,0)&"."&VLOOKUP(RC[-30],Sheet2!R7C1:R11C2,2,0)&VLOOKUP(RC[-30],Sheet2!R1C1:R5C2,2,0)&RC[-29]&RC[-28]&RC[-27]&Sheet2!R1C3 -> #N/A | AG335: =IF(RC[-26]&RC[-25]&RC[-24]&RC[-23]&RC[-22]&RC[-21]="",,R1C6)&IF(RC[-26]="",,"|n"&R1C7&RC[-26])&IF(RC[-25]="",,"|n"&R1C8&RC[-25])&IF(RC[-24]="",,"|n"&R1C9&RC[-24])&IF(RC[-23]="",,"|n"&R1C10&RC[-23])&IF(RC[-22]="",,"|n"&R1C11&RC[-22])&IF(RC[-21]="",,"|n"&R1C12&RC[-21])&IF(RC[-19]&RC[-18]&RC[-17]&RC[-16]="",,"|n"&R1C13)&IF(RC[-19]="",,"|n"&R1C14&RC[-19])&IF(RC[-18]="",,"|n"&R1C15&RC[-18])&IF(RC[-17]="",,"|n"&R1C16&RC[-17])&IF(RC[-16]="",,"|n"&R1C17&RC[-16])&IF(RC[-15]="",,"|n"&R1C18&RC[-15])&IF(RC[-14]="",,"|n"&R1C19&RC[-14])&IF(RC[-13]="",,"|n"&R1C20&RC[-13])&IF(RC[-12]="",,"|n"&R1C21&RC[-12])&IF(RC[-10]="",,"|n"&R1C23&RC[-10])&IF(RC[-9]="",,"|n"&R1C24&RC[-9])&IF(RC[-8]="",,"|n"&R1C25&RC[-8])&IF(RC[-7]="",,"|n"&R1C26&RC[-7])&IF(RC[-6]="",,"|n"&R1C27&RC[-6])&IF(RC[-5]="",,"|n"&R1C28&RC[-5])&IF(RC[-2]="",,"|n"&RC[-2]) -> 
AF336: =VLOOKUP(RC[-31],Sheet2!R13C1:R18C2,2,0)&"."&VLOOKUP(RC[-30],Sheet2!R7C1:R11C2,2,0)&VLOOKUP(RC[-30],Sheet2!R1C1:R5C2,2,0)&RC[-29]&RC[-28]&RC[-27]&Sheet2!R1C3 -> #N/A | AG336: =IF(RC[-26]&RC[-25]&RC[-24]&RC[-23]&RC[-22]&RC[-21]="",,R1C6)&IF(RC[-26]="",,"|n"&R1C7&RC[-26])&IF(RC[-25]="",,"|n"&R1C8&RC[-25])&IF(RC[-24]="",,"|n"&R1C9&RC[-24])&IF(RC[-23]="",,"|n"&R1C10&RC[-23])&IF(RC[-22]="",,"|n"&R1C11&RC[-22])&IF(RC[-21]="",,"|n"&R1C12&RC[-21])&IF(RC[-19]&RC[-18]&RC[-17]&RC[-16]="",,"|n"&R1C13)&IF(RC[-19]="",,"|n"&R1C14&RC[-19])&IF(RC[-18]="",,"|n"&R1C15&RC[-18])&IF(RC[-17]="",,"|n"&R1C16&RC[-17])&IF(RC[-16]="",,"|n"&R1C17&RC[-16])&IF(RC[-15]="",,"|n"&R1C18&RC[-15])&IF(RC[-14]="",,"|n"&R1C19&RC[-14])&IF(RC[-13]="",,"|n"&R1C20&RC[-13])&IF(RC[-12]="",,"|n"&R1C21&RC[-12])&IF(RC[-10]="",,"|n"&R1C23&RC[-10])&IF(RC[-9]="",,"|n"&R1C24&RC[-9])&IF(RC[-8]="",,"|n"&R1C25&RC[-8])&IF(RC[-7]="",,"|n"&R1C26&RC[-7])&IF(RC[-6]="",,"|n"&R1C27&RC[-6])&IF(RC[-5]="",,"|n"&R1C28&RC[-5])&IF(RC[-2]="",,"|n"&RC[-2]) -> 
AF337: =VLOOKUP(RC[-31],Sheet2!R13C1:R18C2,2,0)&"."&VLOOKUP(RC[-30],Sheet2!R7C1:R11C2,2,0)&VLOOKUP(RC[-30],Sheet2!R1C1:R5C2,2,0)&RC[-29]&RC[-28]&RC[-27]&Sheet2!R1C3 -> #N/A | AG337: =IF(RC[-26]&RC[-25]&RC[-24]&RC[-23]&RC[-22]&RC[-21]="",,R1C6)&IF(RC[-26]="",,"|n"&R1C7&RC[-26])&IF(RC[-25]="",,"|n"&R1C8&RC[-25])&IF(RC[-24]="",,"|n"&R1C9&RC[-24])&IF(RC[-23]="",,"|n"&R1C10&RC[-23])&IF(RC[-22]="",,"|n"&R1C11&RC[-22])&IF(RC[-21]="",,"|n"&R1C12&RC[-21])&IF(RC[-19]&RC[-18]&RC[-17]&RC[-16]="",,"|n"&R1C13)&IF(RC[-19]="",,"|n"&R1C14&RC[-19])&IF(RC[-18]="",,"|n"&R1C15&RC[-18])&IF(RC[-17]="",,"|n"&R1C16&RC[-17])&IF(RC[-16]="",,"|n"&R1C17&RC[-16])&IF(RC[-15]="",,"|n"&R1C18&RC[-15])&IF(RC[-14]="",,"|n"&R1C19&RC[-14])&IF(RC[-13]="",,"|n"&R1C20&RC[-13])&IF(RC[-12]="",,"|n"&R1C21&RC[-12])&IF(RC[-10]="",,"|n"&R1C23&RC[-10])&IF(RC[-9]="",,"|n"&R1C24&RC[-9])&IF(RC[-8]="",,"|n"&R1C25&RC[-8])&IF(RC[-7]="",,"|n"&R1C26&RC[-7])&IF(RC[-6]="",,"|n"&R1C27&RC[-6])&IF(RC[-5]="",,"|n"&R1C28&RC[-5])&IF(RC[-2]="",,"|n"&RC[-2]) -> 
AF338: =VLOOKUP(RC[-31],Sheet2!R13C1:R18C2,2,0)&"."&VLOOKUP(RC[-30],Sheet2!R7C1:R11C2,2,0)&VLOOKUP(RC[-30],Sheet2!R1C1:R5C2,2,0)&RC[-29]&RC[-28]&RC[-27]&Sheet2!R1C3 -> #N/A | AG338: =IF(RC[-26]&RC[-25]&RC[-24]&RC[-23]&RC[-22]&RC[-21]="",,R1C6)&IF(RC[-26]="",,"|n"&R1C7&RC[-26])&IF(RC[-25]="",,"|n"&R1C8&RC[-25])&IF(RC[-24]="",,"|n"&R1C9&RC[-24])&IF(RC[-23]="",,"|n"&R1C10&RC[-23])&IF(RC[-22]="",,"|n"&R1C11&RC[-22])&IF(RC[-21]="",,"|n"&R1C12&RC[-21])&IF(RC[-19]&RC[-18]&RC[-17]&RC[-16]="",,"|n"&R1C13)&IF(RC[-19]="",,"|n"&R1C14&RC[-19])&IF(RC[-18]="",,"|n"&R1C15&RC[-18])&IF(RC[-17]="",,"|n"&R1C16&RC[-17])&IF(RC[-16]="",,"|n"&R1C17&RC[-16])&IF(RC[-15]="",,"|n"&R1C18&RC[-15])&IF(RC[-14]="",,"|n"&R1C19&RC[-14])&IF(RC[-13]="",,"|n"&R1C20&RC[-13])&IF(RC[-12]="",,"|n"&R1C21&RC[-12])&IF(RC[-10]="",,"|n"&R1C23&RC[-10])&IF(RC[-9]="",,"|n"&R1C24&RC[-9])&IF(RC[-8]="",,"|n"&R1C25&RC[-8])&IF(RC[-7]="",,"|n"&R1C26&RC[-7])&IF(RC[-6]="",,"|n"&R1C27&RC[-6])&IF(RC[-5]="",,"|n"&R1C28&RC[-5])&IF(RC[-2]="",,"|n"&RC[-2]) -> 
AF339: =VLOOKUP(RC[-31],Sheet2!R13C1:R18C2,2,0)&"."&VLOOKUP(RC[-30],Sheet2!R7C1:R11C2,2,0)&VLOOKUP(RC[-30],Sheet2!R1C1:R5C2,2,0)&RC[-29]&RC[-28]&RC[-27]&Sheet2!R1C3 -> #N/A | AG339: =IF(RC[-26]&RC[-25]&RC[-24]&RC[-23]&RC[-22]&RC[-21]="",,R1C6)&IF(RC[-26]="",,"|n"&R1C7&RC[-26])&IF(RC[-25]="",,"|n"&R1C8&RC[-25])&IF(RC[-24]="",,"|n"&R1C9&RC[-24])&IF(RC[-23]="",,"|n"&R1C10&RC[-23])&IF(RC[-22]="",,"|n"&R1C11&RC[-22])&IF(RC[-21]="",,"|n"&R1C12&RC[-21])&IF(RC[-19]&RC[-18]&RC[-17]&RC[-16]="",,"|n"&R1C13)&IF(RC[-19]="",,"|n"&R1C14&RC[-19])&IF(RC[-18]="",,"|n"&R1C15&RC[-18])&IF(RC[-17]="",,"|n"&R1C16&RC[-17])&IF(RC[-16]="",,"|n"&R1C17&RC[-16])&IF(RC[-15]="",,"|n"&R1C18&RC[-15])&IF(RC[-14]="",,"|n"&R1C19&RC[-14])&IF(RC[-13]="",,"|n"&R1C20&RC[-13])&IF(RC[-12]="",,"|n"&R1C21&RC[-12])&IF(RC[-10]="",,"|n"&R1C23&RC[-10])&IF(RC[-9]="",,"|n"&R1C24&RC[-9])&IF(RC[-8]="",,"|n"&R1C25&RC[-8])&IF(RC[-7]="",,"|n"&R1C26&RC[-7])&IF(RC[-6]="",,"|n"&R1C27&RC[-6])&IF(RC[-5]="",,"|n"&R1C28&RC[-5])&IF(RC[-2]="",,"|n"&RC[-2]) -> 
AF340: =VLOOKUP(RC[-31],Sheet2!R13C1:R18C2,2,0)&"."&VLOOKUP(RC[-30],Sheet2!R7C1:R11C2,2,0)&VLOOKUP(RC[-30],Sheet2!R1C1:R5C2,2,0)&RC[-29]&RC[-28]&RC[-27]&Sheet2!R1C3 -> #N/A | AG340: =IF(RC[-26]&RC[-25]&RC[-24]&RC[-23]&RC[-22]&RC[-21]="",,R1C6)&IF(RC[-26]="",,"|n"&R1C7&RC[-26])&IF(RC[-25]="",,"|n"&R1C8&RC[-25])&IF(RC[-24]="",,"|n"&R1C9&RC[-24])&IF(RC[-23]="",,"|n"&R1C10&RC[-23])&IF(RC[-22]="",,"|n"&R1C11&RC[-22])&IF(RC[-21]="",,"|n"&R1C12&RC[-21])&IF(RC[-19]&RC[-18]&RC[-17]&RC[-16]="",,"|n"&R1C13)&IF(RC[-19]="",,"|n"&R1C14&RC[-19])&IF(RC[-18]="",,"|n"&R1C15&RC[-18])&IF(RC[-17]="",,"|n"&R1C16&RC[-17])&IF(RC[-16]="",,"|n"&R1C17&RC[-16])&IF(RC[-15]="",,"|n"&R1C18&RC[-15])&IF(RC[-14]="",,"|n"&R1C19&RC[-14])&IF(RC[-13]="",,"|n"&R1C20&RC[-13])&IF(RC[-12]="",,"|n"&R1C21&RC[-12])&IF(RC[-10]="",,"|n"&R1C23&RC[-10])&IF(RC[-9]="",,"|n"&R1C24&RC[-9])&IF(RC[-8]="",,"|n"&R1C25&RC[-8])&IF(RC[-7]="",,"|n"&R1C26&RC[-7])&IF(RC[-6]="",,"|n"&R1C27&RC[-6])&IF(RC[-5]="",,"|n"&R1C28&RC[-5])&IF(RC[-2]="",,"|n"&RC[-2]) -> 
AF341: =VLOOKUP(RC[-31],Sheet2!R13C1:R18C2,2,0)&"."&VLOOKUP(RC[-30],Sheet2!R7C1:R11C2,2,0)&VLOOKUP(RC[-30],Sheet2!R1C1:R5C2,2,0)&RC[-29]&RC[-28]&RC[-27]&Sheet2!R1C3 -> #N/A | AG341: =IF(RC[-26]&RC[-25]&RC[-24]&RC[-23]&RC[-22]&RC[-21]="",,R1C6)&IF(RC[-26]="",,"|n"&R1C7&RC[-26])&IF(RC[-25]="",,"|n"&R1C8&RC[-25])&IF(RC[-24]="",,"|n"&R1C9&RC[-24])&IF(RC[-23]="",,"|n"&R1C10&RC[-23])&IF(RC[-22]="",,"|n"&R1C11&RC[-22])&IF(RC[-21]="",,"|n"&R1C12&RC[-21])&IF(RC[-19]&RC[-18]&RC[-17]&RC[-16]="",,"|n"&R1C13)&IF(RC[-19]="",,"|n"&R1C14&RC[-19])&IF(RC[-18]="",,"|n"&R1C15&RC[-18])&IF(RC[-17]="",,"|n"&R1C16&RC[-17])&IF(RC[-16]="",,"|n"&R1C17&RC[-16])&IF(RC[-15]="",,"|n"&R1C18&RC[-15])&IF(RC[-14]="",,"|n"&R1C19&RC[-14])&IF(RC[-13]="",,"|n"&R1C20&RC[-13])&IF(RC[-12]="",,"|n"&R1C21&RC[-12])&IF(RC[-10]="",,"|n"&R1C23&RC[-10])&IF(RC[-9]="",,"|n"&R1C24&RC[-9])&IF(RC[-8]="",,"|n"&R1C25&RC[-8])&IF(RC[-7]="",,"|n"&R1C26&RC[-7])&IF(RC[-6]="",,"|n"&R1C27&RC[-6])&IF(RC[-5]="",,"|n"&R1C28&RC[-5])&IF(RC[-2]="",,"|n"&RC[-2]) -> 
AF342: =VLOOKUP(RC[-31],Sheet2!R13C1:R18C2,2,0)&"."&VLOOKUP(RC[-30],Sheet2!R7C1:R11C2,2,0)&VLOOKUP(RC[-30],Sheet2!R1C1:R5C2,2,0)&RC[-29]&RC[-28]&RC[-27]&Sheet2!R1C3 -> #N/A | AG342: =IF(RC[-26]&RC[-25]&RC[-24]&RC[-23]&RC[-22]&RC[-21]="",,R1C6)&IF(RC[-26]="",,"|n"&R1C7&RC[-26])&IF(RC[-25]="",,"|n"&R1C8&RC[-25])&IF(RC[-24]="",,"|n"&R1C9&RC[-24])&IF(RC[-23]="",,"|n"&R1C10&RC[-23])&IF(RC[-22]="",,"|n"&R1C11&RC[-22])&IF(RC[-21]="",,"|n"&R1C12&RC[-21])&IF(RC[-19]&RC[-18]&RC[-17]&RC[-16]="",,"|n"&R1C13)&IF(RC[-19]="",,"|n"&R1C14&RC[-19])&IF(RC[-18]="",,"|n"&R1C15&RC[-18])&IF(RC[-17]="",,"|n"&R1C16&RC[-17])&IF(RC[-16]="",,"|n"&R1C17&RC[-16])&IF(RC[-15]="",,"|n"&R1C18&RC[-15])&IF(RC[-14]="",,"|n"&R1C19&RC[-14])&IF(RC[-13]="",,"|n"&R1C20&RC[-13])&IF(RC[-12]="",,"|n"&R1C21&RC[-12])&IF(RC[-10]="",,"|n"&R1C23&RC[-10])&IF(RC[-9]="",,"|n"&R1C24&RC[-9])&IF(RC[-8]="",,"|n"&R1C25&RC[-8])&IF(RC[-7]="",,"|n"&R1C26&RC[-7])&IF(RC[-6]="",,"|n"&R1C27&RC[-6])&IF(RC[-5]="",,"|n"&R1C28&RC[-5])&IF(RC[-2]="",,"|n"&RC[-2]) -> 
AF343: =VLOOKUP(RC[-31],Sheet2!R13C1:R18C2,2,0)&"."&VLOOKUP(RC[-30],Sheet2!R7C1:R11C2,2,0)&VLOOKUP(RC[-30],Sheet2!R1C1:R5C2,2,0)&RC[-29]&RC[-28]&RC[-27]&Sheet2!R1C3 -> #N/A | AG343: =IF(RC[-26]&RC[-25]&RC[-24]&RC[-23]&RC[-22]&RC[-21]="",,R1C6)&IF(RC[-26]="",,"|n"&R1C7&RC[-26])&IF(RC[-25]="",,"|n"&R1C8&RC[-25])&IF(RC[-24]="",,"|n"&R1C9&RC[-24])&IF(RC[-23]="",,"|n"&R1C10&RC[-23])&IF(RC[-22]="",,"|n"&R1C11&RC[-22])&IF(RC[-21]="",,"|n"&R1C12&RC[-21])&IF(RC[-19]&RC[-18]&RC[-17]&RC[-16]="",,"|n"&R1C13)&IF(RC[-19]="",,"|n"&R1C14&RC[-19])&IF(RC[-18]="",,"|n"&R1C15&RC[-18])&IF(RC[-17]="",,"|n"&R1C16&RC[-17])&IF(RC[-16]="",,"|n"&R1C17&RC[-16])&IF(RC[-15]="",,"|n"&R1C18&RC[-15])&IF(RC[-14]="",,"|n"&R1C19&RC[-14])&IF(RC[-13]="",,"|n"&R1C20&RC[-13])&IF(RC[-12]="",,"|n"&R1C21&RC[-12])&IF(RC[-10]="",,"|n"&R1C23&RC[-10])&IF(RC[-9]="",,"|n"&R1C24&RC[-9])&IF(RC[-8]="",,"|n"&R1C25&RC[-8])&IF(RC[-7]="",,"|n"&R1C26&RC[-7])&IF(RC[-6]="",,"|n"&R1C27&RC[-6])&IF(RC[-5]="",,"|n"&R1C28&RC[-5])&IF(RC[-2]="",,"|n"&RC[-2]) -> 
AF344: =VLOOKUP(RC[-31],Sheet2!R13C1:R18C2,2,0)&"."&VLOOKUP(RC[-30],Sheet2!R7C1:R11C2,2,0)&VLOOKUP(RC[-30],Sheet2!R1C1:R5C2,2,0)&RC[-29]&RC[-28]&RC[-27]&Sheet2!R1C3 -> #N/A | AG344: =IF(RC[-26]&RC[-25]&RC[-24]&RC[-23]&RC[-22]&RC[-21]="",,R1C6)&IF(RC[-26]="",,"|n"&R1C7&RC[-26])&IF(RC[-25]="",,"|n"&R1C8&RC[-25])&IF(RC[-24]="",,"|n"&R1C9&RC[-24])&IF(RC[-23]="",,"|n"&R1C10&RC[-23])&IF(RC[-22]="",,"|n"&R1C11&RC[-22])&IF(RC[-21]="",,"|n"&R1C12&RC[-21])&IF(RC[-19]&RC[-18]&RC[-17]&RC[-16]="",,"|n"&R1C13)&IF(RC[-19]="",,"|n"&R1C14&RC[-19])&IF(RC[-18]="",,"|n"&R1C15&RC[-18])&IF(RC[-17]="",,"|n"&R1C16&RC[-17])&IF(RC[-16]="",,"|n"&R1C17&RC[-16])&IF(RC[-15]="",,"|n"&R1C18&RC[-15])&IF(RC[-14]="",,"|n"&R1C19&RC[-14])&IF(RC[-13]="",,"|n"&R1C20&RC[-13])&IF(RC[-12]="",,"|n"&R1C21&RC[-12])&IF(RC[-10]="",,"|n"&R1C23&RC[-10])&IF(RC[-9]="",,"|n"&R1C24&RC[-9])&IF(RC[-8]="",,"|n"&R1C25&RC[-8])&IF(RC[-7]="",,"|n"&R1C26&RC[-7])&IF(RC[-6]="",,"|n"&R1C27&RC[-6])&IF(RC[-5]="",,"|n"&R1C28&RC[-5])&IF(RC[-2]="",,"|n"&RC[-2]) -> 
AF345: =VLOOKUP(RC[-31],Sheet2!R13C1:R18C2,2,0)&"."&VLOOKUP(RC[-30],Sheet2!R7C1:R11C2,2,0)&VLOOKUP(RC[-30],Sheet2!R1C1:R5C2,2,0)&RC[-29]&RC[-28]&RC[-27]&Sheet2!R1C3 -> #N/A | AG345: =IF(RC[-26]&RC[-25]&RC[-24]&RC[-23]&RC[-22]&RC[-21]="",,R1C6)&IF(RC[-26]="",,"|n"&R1C7&RC[-26])&IF(RC[-25]="",,"|n"&R1C8&RC[-25])&IF(RC[-24]="",,"|n"&R1C9&RC[-24])&IF(RC[-23]="",,"|n"&R1C10&RC[-23])&IF(RC[-22]="",,"|n"&R1C11&RC[-22])&IF(RC[-21]="",,"|n"&R1C12&RC[-21])&IF(RC[-19]&RC[-18]&RC[-17]&RC[-16]="",,"|n"&R1C13)&IF(RC[-19]="",,"|n"&R1C14&RC[-19])&IF(RC[-18]="",,"|n"&R1C15&RC[-18])&IF(RC[-17]="",,"|n"&R1C16&RC[-17])&IF(RC[-16]="",,"|n"&R1C17&RC[-16])&IF(RC[-15]="",,"|n"&R1C18&RC[-15])&IF(RC[-14]="",,"|n"&R1C19&RC[-14])&IF(RC[-13]="",,"|n"&R1C20&RC[-13])&IF(RC[-12]="",,"|n"&R1C21&RC[-12])&IF(RC[-10]="",,"|n"&R1C23&RC[-10])&IF(RC[-9]="",,"|n"&R1C24&RC[-9])&IF(RC[-8]="",,"|n"&R1C25&RC[-8])&IF(RC[-7]="",,"|n"&R1C26&RC[-7])&IF(RC[-6]="",,"|n"&R1C27&RC[-6])&IF(RC[-5]="",,"|n"&R1C28&RC[-5])&IF(RC[-2]="",,"|n"&RC[-2]) -> 
AF346: =VLOOKUP(RC[-31],Sheet2!R13C1:R18C2,2,0)&"."&VLOOKUP(RC[-30],Sheet2!R7C1:R11C2,2,0)&VLOOKUP(RC[-30],Sheet2!R1C1:R5C2,2,0)&RC[-29]&RC[-28]&RC[-27]&Sheet2!R1C3 -> #N/A | AG346: =IF(RC[-26]&RC[-25]&RC[-24]&RC[-23]&RC[-22]&RC[-21]="",,R1C6)&IF(RC[-26]="",,"|n"&R1C7&RC[-26])&IF(RC[-25]="",,"|n"&R1C8&RC[-25])&IF(RC[-24]="",,"|n"&R1C9&RC[-24])&IF(RC[-23]="",,"|n"&R1C10&RC[-23])&IF(RC[-22]="",,"|n"&R1C11&RC[-22])&IF(RC[-21]="",,"|n"&R1C12&RC[-21])&IF(RC[-19]&RC[-18]&RC[-17]&RC[-16]="",,"|n"&R1C13)&IF(RC[-19]="",,"|n"&R1C14&RC[-19])&IF(RC[-18]="",,"|n"&R1C15&RC[-18])&IF(RC[-17]="",,"|n"&R1C16&RC[-17])&IF(RC[-16]="",,"|n"&R1C17&RC[-16])&IF(RC[-15]="",,"|n"&R1C18&RC[-15])&IF(RC[-14]="",,"|n"&R1C19&RC[-14])&IF(RC[-13]="",,"|n"&R1C20&RC[-13])&IF(RC[-12]="",,"|n"&R1C21&RC[-12])&IF(RC[-10]="",,"|n"&R1C23&RC[-10])&IF(RC[-9]="",,"|n"&R1C24&RC[-9])&IF(RC[-8]="",,"|n"&R1C25&RC[-8])&IF(RC[-7]="",,"|n"&R1C26&RC[-7])&IF(RC[-6]="",,"|n"&R1C27&RC[-6])&IF(RC[-5]="",,"|n"&R1C28&RC[-5])&IF(RC[-2]="",,"|n"&RC[-2]) -> 
AF347: =VLOOKUP(RC[-31],Sheet2!R13C1:R18C2,2,0)&"."&VLOOKUP(RC[-30],Sheet2!R7C1:R11C2,2,0)&VLOOKUP(RC[-30],Sheet2!R1C1:R5C2,2,0)&RC[-29]&RC[-28]&RC[-27]&Sheet2!R1C3 -> #N/A | AG347: =IF(RC[-26]&RC[-25]&RC[-24]&RC[-23]&RC[-22]&RC[-21]="",,R1C6)&IF(RC[-26]="",,"|n"&R1C7&RC[-26])&IF(RC[-25]="",,"|n"&R1C8&RC[-25])&IF(RC[-24]="",,"|n"&R1C9&RC[-24])&IF(RC[-23]="",,"|n"&R1C10&RC[-23])&IF(RC[-22]="",,"|n"&R1C11&RC[-22])&IF(RC[-21]="",,"|n"&R1C12&RC[-21])&IF(RC[-19]&RC[-18]&RC[-17]&RC[-16]="",,"|n"&R1C13)&IF(RC[-19]="",,"|n"&R1C14&RC[-19])&IF(RC[-18]="",,"|n"&R1C15&RC[-18])&IF(RC[-17]="",,"|n"&R1C16&RC[-17])&IF(RC[-16]="",,"|n"&R1C17&RC[-16])&IF(RC[-15]="",,"|n"&R1C18&RC[-15])&IF(RC[-14]="",,"|n"&R1C19&RC[-14])&IF(RC[-13]="",,"|n"&R1C20&RC[-13])&IF(RC[-12]="",,"|n"&R1C21&RC[-12])&IF(RC[-10]="",,"|n"&R1C23&RC[-10])&IF(RC[-9]="",,"|n"&R1C24&RC[-9])&IF(RC[-8]="",,"|n"&R1C25&RC[-8])&IF(RC[-7]="",,"|n"&R1C26&RC[-7])&IF(RC[-6]="",,"|n"&R1C27&RC[-6])&IF(RC[-5]="",,"|n"&R1C28&RC[-5])&IF(RC[-2]="",,"|n"&RC[-2]) -> 
AF348: =VLOOKUP(RC[-31],Sheet2!R13C1:R18C2,2,0)&"."&VLOOKUP(RC[-30],Sheet2!R7C1:R11C2,2,0)&VLOOKUP(RC[-30],Sheet2!R1C1:R5C2,2,0)&RC[-29]&RC[-28]&RC[-27]&Sheet2!R1C3 -> #N/A | AG348: =IF(RC[-26]&RC[-25]&RC[-24]&RC[-23]&RC[-22]&RC[-21]="",,R1C6)&IF(RC[-26]="",,"|n"&R1C7&RC[-26])&IF(RC[-25]="",,"|n"&R1C8&RC[-25])&IF(RC[-24]="",,"|n"&R1C9&RC[-24])&IF(RC[-23]="",,"|n"&R1C10&RC[-23])&IF(RC[-22]="",,"|n"&R1C11&RC[-22])&IF(RC[-21]="",,"|n"&R1C12&RC[-21])&IF(RC[-19]&RC[-18]&RC[-17]&RC[-16]="",,"|n"&R1C13)&IF(RC[-19]="",,"|n"&R1C14&RC[-19])&IF(RC[-18]="",,"|n"&R1C15&RC[-18])&IF(RC[-17]="",,"|n"&R1C16&RC[-17])&IF(RC[-16]="",,"|n"&R1C17&RC[-16])&IF(RC[-15]="",,"|n"&R1C18&RC[-15])&IF(RC[-14]="",,"|n"&R1C19&RC[-14])&IF(RC[-13]="",,"|n"&R1C20&RC[-13])&IF(RC[-12]="",,"|n"&R1C21&RC[-12])&IF(RC[-10]="",,"|n"&R1C23&RC[-10])&IF(RC[-9]="",,"|n"&R1C24&RC[-9])&IF(RC[-8]="",,"|n"&R1C25&RC[-8])&IF(RC[-7]="",,"|n"&R1C26&RC[-7])&IF(RC[-6]="",,"|n"&R1C27&RC[-6])&IF(RC[-5]="",,"|n"&R1C28&RC[-5])&IF(RC[-2]="",,"|n"&RC[-2]) -> 
AF349: =VLOOKUP(RC[-31],Sheet2!R13C1:R18C2,2,0)&"."&VLOOKUP(RC[-30],Sheet2!R7C1:R11C2,2,0)&VLOOKUP(RC[-30],Sheet2!R1C1:R5C2,2,0)&RC[-29]&RC[-28]&RC[-27]&Sheet2!R1C3 -> #N/A | AG349: =IF(RC[-26]&RC[-25]&RC[-24]&RC[-23]&RC[-22]&RC[-21]="",,R1C6)&IF(RC[-26]="",,"|n"&R1C7&RC[-26])&IF(RC[-25]="",,"|n"&R1C8&RC[-25])&IF(RC[-24]="",,"|n"&R1C9&RC[-24])&IF(RC[-23]="",,"|n"&R1C10&RC[-23])&IF(RC[-22]="",,"|n"&R1C11&RC[-22])&IF(RC[-21]="",,"|n"&R1C12&RC[-21])&IF(RC[-19]&RC[-18]&RC[-17]&RC[-16]="",,"|n"&R1C13)&IF(RC[-19]="",,"|n"&R1C14&RC[-19])&IF(RC[-18]="",,"|n"&R1C15&RC[-18])&IF(RC[-17]="",,"|n"&R1C16&RC[-17])&IF(RC[-16]="",,"|n"&R1C17&RC[-16])&IF(RC[-15]="",,"|n"&R1C18&RC[-15])&IF(RC[-14]="",,"|n"&R1C19&RC[-14])&IF(RC[-13]="",,"|n"&R1C20&RC[-13])&IF(RC[-12]="",,"|n"&R1C21&RC[-12])&IF(RC[-10]="",,"|n"&R1C23&RC[-10])&IF(RC[-9]="",,"|n"&R1C24&RC[-9])&IF(RC[-8]="",,"|n"&R1C25&RC[-8])&IF(RC[-7]="",,"|n"&R1C26&RC[-7])&IF(RC[-6]="",,"|n"&R1C27&RC[-6])&IF(RC[-5]="",,"|n"&R1C28&RC[-5])&IF(RC[-2]="",,"|n"&RC[-2]) -> 
AF350: =VLOOKUP(RC[-31],Sheet2!R13C1:R18C2,2,0)&"."&VLOOKUP(RC[-30],Sheet2!R7C1:R11C2,2,0)&VLOOKUP(RC[-30],Sheet2!R1C1:R5C2,2,0)&RC[-29]&RC[-28]&RC[-27]&Sheet2!R1C3 -> #N/A | AG350: =IF(RC[-26]&RC[-25]&RC[-24]&RC[-23]&RC[-22]&RC[-21]="",,R1C6)&IF(RC[-26]="",,"|n"&R1C7&RC[-26])&IF(RC[-25]="",,"|n"&R1C8&RC[-25])&IF(RC[-24]="",,"|n"&R1C9&RC[-24])&IF(RC[-23]="",,"|n"&R1C10&RC[-23])&IF(RC[-22]="",,"|n"&R1C11&RC[-22])&IF(RC[-21]="",,"|n"&R1C12&RC[-21])&IF(RC[-19]&RC[-18]&RC[-17]&RC[-16]="",,"|n"&R1C13)&IF(RC[-19]="",,"|n"&R1C14&RC[-19])&IF(RC[-18]="",,"|n"&R1C15&RC[-18])&IF(RC[-17]="",,"|n"&R1C16&RC[-17])&IF(RC[-16]="",,"|n"&R1C17&RC[-16])&IF(RC[-15]="",,"|n"&R1C18&RC[-15])&IF(RC[-14]="",,"|n"&R1C19&RC[-14])&IF(RC[-13]="",,"|n"&R1C20&RC[-13])&IF(RC[-12]="",,"|n"&R1C21&RC[-12])&IF(RC[-10]="",,"|n"&R1C23&RC[-10])&IF(RC[-9]="",,"|n"&R1C24&RC[-9])&IF(RC[-8]="",,"|n"&R1C25&RC[-8])&IF(RC[-7]="",,"|n"&R1C26&RC[-7])&IF(RC[-6]="",,"|n"&R1C27&RC[-6])&IF(RC[-5]="",,"|n"&R1C28&RC[-5])&IF(RC[-2]="",,"|n"&RC[-2]) -> 
AF351: =VLOOKUP(RC[-31],Sheet2!R13C1:R18C2,2,0)&"."&VLOOKUP(RC[-30],Sheet2!R7C1:R11C2,2,0)&VLOOKUP(RC[-30],Sheet2!R1C1:R5C2,2,0)&RC[-29]&RC[-28]&RC[-27]&Sheet2!R1C3 -> #N/A | AG351: =IF(RC[-26]&RC[-25]&RC[-24]&RC[-23]&RC[-22]&RC[-21]="",,R1C6)&IF(RC[-26]="",,"|n"&R1C7&RC[-26])&IF(RC[-25]="",,"|n"&R1C8&RC[-25])&IF(RC[-24]="",,"|n"&R1C9&RC[-24])&IF(RC[-23]="",,"|n"&R1C10&RC[-23])&IF(RC[-22]="",,"|n"&R1C11&RC[-22])&IF(RC[-21]="",,"|n"&R1C12&RC[-21])&IF(RC[-19]&RC[-18]&RC[-17]&RC[-16]="",,"|n"&R1C13)&IF(RC[-19]="",,"|n"&R1C14&RC[-19])&IF(RC[-18]="",,"|n"&R1C15&RC[-18])&IF(RC[-17]="",,"|n"&R1C16&RC[-17])&IF(RC[-16]="",,"|n"&R1C17&RC[-16])&IF(RC[-15]="",,"|n"&R1C18&RC[-15])&IF(RC[-14]="",,"|n"&R1C19&RC[-14])&IF(RC[-13]="",,"|n"&R1C20&RC[-13])&IF(RC[-12]="",,"|n"&R1C21&RC[-12])&IF(RC[-10]="",,"|n"&R1C23&RC[-10])&IF(RC[-9]="",,"|n"&R1C24&RC[-9])&IF(RC[-8]="",,"|n"&R1C25&RC[-8])&IF(RC[-7]="",,"|n"&R1C26&RC[-7])&IF(RC[-6]="",,"|n"&R1C27&RC[-6])&IF(RC[-5]="",,"|n"&R1C28&RC[-5])&IF(RC[-2]="",,"|n"&RC[-2]) -> 
AF352: =VLOOKUP(RC[-31],Sheet2!R13C1:R18C2,2,0)&"."&VLOOKUP(RC[-30],Sheet2!R7C1:R11C2,2,0)&VLOOKUP(RC[-30],Sheet2!R1C1:R5C2,2,0)&RC[-29]&RC[-28]&RC[-27]&Sheet2!R1C3 -> #N/A | AG352: =IF(RC[-26]&RC[-25]&RC[-24]&RC[-23]&RC[-22]&RC[-21]="",,R1C6)&IF(RC[-26]="",,"|n"&R1C7&RC[-26])&IF(RC[-25]="",,"|n"&R1C8&RC[-25])&IF(RC[-24]="",,"|n"&R1C9&RC[-24])&IF(RC[-23]="",,"|n"&R1C10&RC[-23])&IF(RC[-22]="",,"|n"&R1C11&RC[-22])&IF(RC[-21]="",,"|n"&R1C12&RC[-21])&IF(RC[-19]&RC[-18]&RC[-17]&RC[-16]="",,"|n"&R1C13)&IF(RC[-19]="",,"|n"&R1C14&RC[-19])&IF(RC[-18]="",,"|n"&R1C15&RC[-18])&IF(RC[-17]="",,"|n"&R1C16&RC[-17])&IF(RC[-16]="",,"|n"&R1C17&RC[-16])&IF(RC[-15]="",,"|n"&R1C18&RC[-15])&IF(RC[-14]="",,"|n"&R1C19&RC[-14])&IF(RC[-13]="",,"|n"&R1C20&RC[-13])&IF(RC[-12]="",,"|n"&R1C21&RC[-12])&IF(RC[-10]="",,"|n"&R1C23&RC[-10])&IF(RC[-9]="",,"|n"&R1C24&RC[-9])&IF(RC[-8]="",,"|n"&R1C25&RC[-8])&IF(RC[-7]="",,"|n"&R1C26&RC[-7])&IF(RC[-6]="",,"|n"&R1C27&RC[-6])&IF(RC[-5]="",,"|n"&R1C28&RC[-5])&IF(RC[-2]="",,"|n"&RC[-2]) -> 
AF353: =VLOOKUP(RC[-31],Sheet2!R13C1:R18C2,2,0)&"."&VLOOKUP(RC[-30],Sheet2!R7C1:R11C2,2,0)&VLOOKUP(RC[-30],Sheet2!R1C1:R5C2,2,0)&RC[-29]&RC[-28]&RC[-27]&Sheet2!R1C3 -> #N/A | AG353: =IF(RC[-26]&RC[-25]&RC[-24]&RC[-23]&RC[-22]&RC[-21]="",,R1C6)&IF(RC[-26]="",,"|n"&R1C7&RC[-26])&IF(RC[-25]="",,"|n"&R1C8&RC[-25])&IF(RC[-24]="",,"|n"&R1C9&RC[-24])&IF(RC[-23]="",,"|n"&R1C10&RC[-23])&IF(RC[-22]="",,"|n"&R1C11&RC[-22])&IF(RC[-21]="",,"|n"&R1C12&RC[-21])&IF(RC[-19]&RC[-18]&RC[-17]&RC[-16]="",,"|n"&R1C13)&IF(RC[-19]="",,"|n"&R1C14&RC[-19])&IF(RC[-18]="",,"|n"&R1C15&RC[-18])&IF(RC[-17]="",,"|n"&R1C16&RC[-17])&IF(RC[-16]="",,"|n"&R1C17&RC[-16])&IF(RC[-15]="",,"|n"&R1C18&RC[-15])&IF(RC[-14]="",,"|n"&R1C19&RC[-14])&IF(RC[-13]="",,"|n"&R1C20&RC[-13])&IF(RC[-12]="",,"|n"&R1C21&RC[-12])&IF(RC[-10]="",,"|n"&R1C23&RC[-10])&IF(RC[-9]="",,"|n"&R1C24&RC[-9])&IF(RC[-8]="",,"|n"&R1C25&RC[-8])&IF(RC[-7]="",,"|n"&R1C26&RC[-7])&IF(RC[-6]="",,"|n"&R1C27&RC[-6])&IF(RC[-5]="",,"|n"&R1C28&RC[-5])&IF(RC[-2]="",,"|n"&RC[-2]) -> 
AF354: =VLOOKUP(RC[-31],Sheet2!R13C1:R18C2,2,0)&"."&VLOOKUP(RC[-30],Sheet2!R7C1:R11C2,2,0)&VLOOKUP(RC[-30],Sheet2!R1C1:R5C2,2,0)&RC[-29]&RC[-28]&RC[-27]&Sheet2!R1C3 -> #N/A | AG354: =IF(RC[-26]&RC[-25]&RC[-24]&RC[-23]&RC[-22]&RC[-21]="",,R1C6)&IF(RC[-26]="",,"|n"&R1C7&RC[-26])&IF(RC[-25]="",,"|n"&R1C8&RC[-25])&IF(RC[-24]="",,"|n"&R1C9&RC[-24])&IF(RC[-23]="",,"|n"&R1C10&RC[-23])&IF(RC[-22]="",,"|n"&R1C11&RC[-22])&IF(RC[-21]="",,"|n"&R1C12&RC[-21])&IF(RC[-19]&RC[-18]&RC[-17]&RC[-16]="",,"|n"&R1C13)&IF(RC[-19]="",,"|n"&R1C14&RC[-19])&IF(RC[-18]="",,"|n"&R1C15&RC[-18])&IF(RC[-17]="",,"|n"&R1C16&RC[-17])&IF(RC[-16]="",,"|n"&R1C17&RC[-16])&IF(RC[-15]="",,"|n"&R1C18&RC[-15])&IF(RC[-14]="",,"|n"&R1C19&RC[-14])&IF(RC[-13]="",,"|n"&R1C20&RC[-13])&IF(RC[-12]="",,"|n"&R1C21&RC[-12])&IF(RC[-10]="",,"|n"&R1C23&RC[-10])&IF(RC[-9]="",,"|n"&R1C24&RC[-9])&IF(RC[-8]="",,"|n"&R1C25&RC[-8])&IF(RC[-7]="",,"|n"&R1C26&RC[-7])&IF(RC[-6]="",,"|n"&R1C27&RC[-6])&IF(RC[-5]="",,"|n"&R1C28&RC[-5])&IF(RC[-2]="",,"|n"&RC[-2]) -> 
AF355: =VLOOKUP(RC[-31],Sheet2!R13C1:R18C2,2,0)&"."&VLOOKUP(RC[-30],Sheet2!R7C1:R11C2,2,0)&VLOOKUP(RC[-30],Sheet2!R1C1:R5C2,2,0)&RC[-29]&RC[-28]&RC[-27]&Sheet2!R1C3 -> #N/A | AG355: =IF(RC[-26]&RC[-25]&RC[-24]&RC[-23]&RC[-22]&RC[-21]="",,R1C6)&IF(RC[-26]="",,"|n"&R1C7&RC[-26])&IF(RC[-25]="",,"|n"&R1C8&RC[-25])&IF(RC[-24]="",,"|n"&R1C9&RC[-24])&IF(RC[-23]="",,"|n"&R1C10&RC[-23])&IF(RC[-22]="",,"|n"&R1C11&RC[-22])&IF(RC[-21]="",,"|n"&R1C12&RC[-21])&IF(RC[-19]&RC[-18]&RC[-17]&RC[-16]="",,"|n"&R1C13)&IF(RC[-19]="",,"|n"&R1C14&RC[-19])&IF(RC[-18]="",,"|n"&R1C15&RC[-18])&IF(RC[-17]="",,"|n"&R1C16&RC[-17])&IF(RC[-16]="",,"|n"&R1C17&RC[-16])&IF(RC[-15]="",,"|n"&R1C18&RC[-15])&IF(RC[-14]="",,"|n"&R1C19&RC[-14])&IF(RC[-13]="",,"|n"&R1C20&RC[-13])&IF(RC[-12]="",,"|n"&R1C21&RC[-12])&IF(RC[-10]="",,"|n"&R1C23&RC[-10])&IF(RC[-9]="",,"|n"&R1C24&RC[-9])&IF(RC[-8]="",,"|n"&R1C25&RC[-8])&IF(RC[-7]="",,"|n"&R1C26&RC[-7])&IF(RC[-6]="",,"|n"&R1C27&RC[-6])&IF(RC[-5]="",,"|n"&R1C28&RC[-5])&IF(RC[-2]="",,"|n"&RC[-2]) -> 
AF356: =VLOOKUP(RC[-31],Sheet2!R13C1:R18C2,2,0)&"."&VLOOKUP(RC[-30],Sheet2!R7C1:R11C2,2,0)&VLOOKUP(RC[-30],Sheet2!R1C1:R5C2,2,0)&RC[-29]&RC[-28]&RC[-27]&Sheet2!R1C3 -> #N/A | AG356: =IF(RC[-26]&RC[-25]&RC[-24]&RC[-23]&RC[-22]&RC[-21]="",,R1C6)&IF(RC[-26]="",,"|n"&R1C7&RC[-26])&IF(RC[-25]="",,"|n"&R1C8&RC[-25])&IF(RC[-24]="",,"|n"&R1C9&RC[-24])&IF(RC[-23]="",,"|n"&R1C10&RC[-23])&IF(RC[-22]="",,"|n"&R1C11&RC[-22])&IF(RC[-21]="",,"|n"&R1C12&RC[-21])&IF(RC[-19]&RC[-18]&RC[-17]&RC[-16]="",,"|n"&R1C13)&IF(RC[-19]="",,"|n"&R1C14&RC[-19])&IF(RC[-18]="",,"|n"&R1C15&RC[-18])&IF(RC[-17]="",,"|n"&R1C16&RC[-17])&IF(RC[-16]="",,"|n"&R1C17&RC[-16])&IF(RC[-15]="",,"|n"&R1C18&RC[-15])&IF(RC[-14]="",,"|n"&R1C19&RC[-14])&IF(RC[-13]="",,"|n"&R1C20&RC[-13])&IF(RC[-12]="",,"|n"&R1C21&RC[-12])&IF(RC[-10]="",,"|n"&R1C23&RC[-10])&IF(RC[-9]="",,"|n"&R1C24&RC[-9])&IF(RC[-8]="",,"|n"&R1C25&RC[-8])&IF(RC[-7]="",,"|n"&R1C26&RC[-7])&IF(RC[-6]="",,"|n"&R1C27&RC[-6])&IF(RC[-5]="",,"|n"&R1C28&RC[-5])&IF(RC[-2]="",,"|n"&RC[-2]) -> 
AF357: =VLOOKUP(RC[-31],Sheet2!R13C1:R18C2,2,0)&"."&VLOOKUP(RC[-30],Sheet2!R7C1:R11C2,2,0)&VLOOKUP(RC[-30],Sheet2!R1C1:R5C2,2,0)&RC[-29]&RC[-28]&RC[-27]&Sheet2!R1C3 -> #N/A | AG357: =IF(RC[-26]&RC[-25]&RC[-24]&RC[-23]&RC[-22]&RC[-21]="",,R1C6)&IF(RC[-26]="",,"|n"&R1C7&RC[-26])&IF(RC[-25]="",,"|n"&R1C8&RC[-25])&IF(RC[-24]="",,"|n"&R1C9&RC[-24])&IF(RC[-23]="",,"|n"&R1C10&RC[-23])&IF(RC[-22]="",,"|n"&R1C11&RC[-22])&IF(RC[-21]="",,"|n"&R1C12&RC[-21])&IF(RC[-19]&RC[-18]&RC[-17]&RC[-16]="",,"|n"&R1C13)&IF(RC[-19]="",,"|n"&R1C14&RC[-19])&IF(RC[-18]="",,"|n"&R1C15&RC[-18])&IF(RC[-17]="",,"|n"&R1C16&RC[-17])&IF(RC[-16]="",,"|n"&R1C17&RC[-16])&IF(RC[-15]="",,"|n"&R1C18&RC[-15])&IF(RC[-14]="",,"|n"&R1C19&RC[-14])&IF(RC[-13]="",,"|n"&R1C20&RC[-13])&IF(RC[-12]="",,"|n"&R1C21&RC[-12])&IF(RC[-10]="",,"|n"&R1C23&RC[-10])&IF(RC[-9]="",,"|n"&R1C24&RC[-9])&IF(RC[-8]="",,"|n"&R1C25&RC[-8])&IF(RC[-7]="",,"|n"&R1C26&RC[-7])&IF(RC[-6]="",,"|n"&R1C27&RC[-6])&IF(RC[-5]="",,"|n"&R1C28&RC[-5])&IF(RC[-2]="",,"|n"&RC[-2]) -> 
AF358: =VLOOKUP(RC[-31],Sheet2!R13C1:R18C2,2,0)&"."&VLOOKUP(RC[-30],Sheet2!R7C1:R11C2,2,0)&VLOOKUP(RC[-30],Sheet2!R1C1:R5C2,2,0)&RC[-29]&RC[-28]&RC[-27]&Sheet2!R1C3 -> #N/A | AG358: =IF(RC[-26]&RC[-25]&RC[-24]&RC[-23]&RC[-22]&RC[-21]="",,R1C6)&IF(RC[-26]="",,"|n"&R1C7&RC[-26])&IF(RC[-25]="",,"|n"&R1C8&RC[-25])&IF(RC[-24]="",,"|n"&R1C9&RC[-24])&IF(RC[-23]="",,"|n"&R1C10&RC[-23])&IF(RC[-22]="",,"|n"&R1C11&RC[-22])&IF(RC[-21]="",,"|n"&R1C12&RC[-21])&IF(RC[-19]&RC[-18]&RC[-17]&RC[-16]="",,"|n"&R1C13)&IF(RC[-19]="",,"|n"&R1C14&RC[-19])&IF(RC[-18]="",,"|n"&R1C15&RC[-18])&IF(RC[-17]="",,"|n"&R1C16&RC[-17])&IF(RC[-16]="",,"|n"&R1C17&RC[-16])&IF(RC[-15]="",,"|n"&R1C18&RC[-15])&IF(RC[-14]="",,"|n"&R1C19&RC[-14])&IF(RC[-13]="",,"|n"&R1C20&RC[-13])&IF(RC[-12]="",,"|n"&R1C21&RC[-12])&IF(RC[-10]="",,"|n"&R1C23&RC[-10])&IF(RC[-9]="",,"|n"&R1C24&RC[-9])&IF(RC[-8]="",,"|n"&R1C25&RC[-8])&IF(RC[-7]="",,"|n"&R1C26&RC[-7])&IF(RC[-6]="",,"|n"&R1C27&RC[-6])&IF(RC[-5]="",,"|n"&R1C28&RC[-5])&IF(RC[-2]="",,"|n"&RC[-2]) -> 
AF359: =VLOOKUP(RC[-31],Sheet2!R13C1:R18C2,2,0)&"."&VLOOKUP(RC[-30],Sheet2!R7C1:R11C2,2,0)&VLOOKUP(RC[-30],Sheet2!R1C1:R5C2,2,0)&RC[-29]&RC[-28]&RC[-27]&Sheet2!R1C3 -> #N/A | AG359: =IF(RC[-26]&RC[-25]&RC[-24]&RC[-23]&RC[-22]&RC[-21]="",,R1C6)&IF(RC[-26]="",,"|n"&R1C7&RC[-26])&IF(RC[-25]="",,"|n"&R1C8&RC[-25])&IF(RC[-24]="",,"|n"&R1C9&RC[-24])&IF(RC[-23]="",,"|n"&R1C10&RC[-23])&IF(RC[-22]="",,"|n"&R1C11&RC[-22])&IF(RC[-21]="",,"|n"&R1C12&RC[-21])&IF(RC[-19]&RC[-18]&RC[-17]&RC[-16]="",,"|n"&R1C13)&IF(RC[-19]="",,"|n"&R1C14&RC[-19])&IF(RC[-18]="",,"|n"&R1C15&RC[-18])&IF(RC[-17]="",,"|n"&R1C16&RC[-17])&IF(RC[-16]="",,"|n"&R1C17&RC[-16])&IF(RC[-15]="",,"|n"&R1C18&RC[-15])&IF(RC[-14]="",,"|n"&R1C19&RC[-14])&IF(RC[-13]="",,"|n"&R1C20&RC[-13])&IF(RC[-12]="",,"|n"&R1C21&RC[-12])&IF(RC[-10]="",,"|n"&R1C23&RC[-10])&IF(RC[-9]="",,"|n"&R1C24&RC[-9])&IF(RC[-8]="",,"|n"&R1C25&RC[-8])&IF(RC[-7]="",,"|n"&R1C26&RC[-7])&IF(RC[-6]="",,"|n"&R1C27&RC[-6])&IF(RC[-5]="",,"|n"&R1C28&RC[-5])&IF(RC[-2]="",,"|n"&RC[-2]) -> 
AF360: =VLOOKUP(RC[-31],Sheet2!R13C1:R18C2,2,0)&"."&VLOOKUP(RC[-30],Sheet2!R7C1:R11C2,2,0)&VLOOKUP(RC[-30],Sheet2!R1C1:R5C2,2,0)&RC[-29]&RC[-28]&RC[-27]&Sheet2!R1C3 -> #N/A | AG360: =IF(RC[-26]&RC[-25]&RC[-24]&RC[-23]&RC[-22]&RC[-21]="",,R1C6)&IF(RC[-26]="",,"|n"&R1C7&RC[-26])&IF(RC[-25]="",,"|n"&R1C8&RC[-25])&IF(RC[-24]="",,"|n"&R1C9&RC[-24])&IF(RC[-23]="",,"|n"&R1C10&RC[-23])&IF(RC[-22]="",,"|n"&R1C11&RC[-22])&IF(RC[-21]="",,"|n"&R1C12&RC[-21])&IF(RC[-19]&RC[-18]&RC[-17]&RC[-16]="",,"|n"&R1C13)&IF(RC[-19]="",,"|n"&R1C14&RC[-19])&IF(RC[-18]="",,"|n"&R1C15&RC[-18])&IF(RC[-17]="",,"|n"&R1C16&RC[-17])&IF(RC[-16]="",,"|n"&R1C17&RC[-16])&IF(RC[-15]="",,"|n"&R1C18&RC[-15])&IF(RC[-14]="",,"|n"&R1C19&RC[-14])&IF(RC[-13]="",,"|n"&R1C20&RC[-13])&IF(RC[-12]="",,"|n"&R1C21&RC[-12])&IF(RC[-10]="",,"|n"&R1C23&RC[-10])&IF(RC[-9]="",,"|n"&R1C24&RC[-9])&IF(RC[-8]="",,"|n"&R1C25&RC[-8])&IF(RC[-7]="",,"|n"&R1C26&RC[-7])&IF(RC[-6]="",,"|n"&R1C27&RC[-6])&IF(RC[-5]="",,"|n"&R1C28&RC[-5])&IF(RC[-2]="",,"|n"&RC[-2]) -> 
AF361: =VLOOKUP(RC[-31],Sheet2!R13C1:R18C2,2,0)&"."&VLOOKUP(RC[-30],Sheet2!R7C1:R11C2,2,0)&VLOOKUP(RC[-30],Sheet2!R1C1:R5C2,2,0)&RC[-29]&RC[-28]&RC[-27]&Sheet2!R1C3 -> #N/A | AG361: =IF(RC[-26]&RC[-25]&RC[-24]&RC[-23]&RC[-22]&RC[-21]="",,R1C6)&IF(RC[-26]="",,"|n"&R1C7&RC[-26])&IF(RC[-25]="",,"|n"&R1C8&RC[-25])&IF(RC[-24]="",,"|n"&R1C9&RC[-24])&IF(RC[-23]="",,"|n"&R1C10&RC[-23])&IF(RC[-22]="",,"|n"&R1C11&RC[-22])&IF(RC[-21]="",,"|n"&R1C12&RC[-21])&IF(RC[-19]&RC[-18]&RC[-17]&RC[-16]="",,"|n"&R1C13)&IF(RC[-19]="",,"|n"&R1C14&RC[-19])&IF(RC[-18]="",,"|n"&R1C15&RC[-18])&IF(RC[-17]="",,"|n"&R1C16&RC[-17])&IF(RC[-16]="",,"|n"&R1C17&RC[-16])&IF(RC[-15]="",,"|n"&R1C18&RC[-15])&IF(RC[-14]="",,"|n"&R1C19&RC[-14])&IF(RC[-13]="",,"|n"&R1C20&RC[-13])&IF(RC[-12]="",,"|n"&R1C21&RC[-12])&IF(RC[-10]="",,"|n"&R1C23&RC[-10])&IF(RC[-9]="",,"|n"&R1C24&RC[-9])&IF(RC[-8]="",,"|n"&R1C25&RC[-8])&IF(RC[-7]="",,"|n"&R1C26&RC[-7])&IF(RC[-6]="",,"|n"&R1C27&RC[-6])&IF(RC[-5]="",,"|n"&R1C28&RC[-5])&IF(RC[-2]="",,"|n"&RC[-2]) -> 
AF362: =VLOOKUP(RC[-31],Sheet2!R13C1:R18C2,2,0)&"."&VLOOKUP(RC[-30],Sheet2!R7C1:R11C2,2,0)&VLOOKUP(RC[-30],Sheet2!R1C1:R5C2,2,0)&RC[-29]&RC[-28]&RC[-27]&Sheet2!R1C3 -> #N/A | AG362: =IF(RC[-26]&RC[-25]&RC[-24]&RC[-23]&RC[-22]&RC[-21]="",,R1C6)&IF(RC[-26]="",,"|n"&R1C7&RC[-26])&IF(RC[-25]="",,"|n"&R1C8&RC[-25])&IF(RC[-24]="",,"|n"&R1C9&RC[-24])&IF(RC[-23]="",,"|n"&R1C10&RC[-23])&IF(RC[-22]="",,"|n"&R1C11&RC[-22])&IF(RC[-21]="",,"|n"&R1C12&RC[-21])&IF(RC[-19]&RC[-18]&RC[-17]&RC[-16]="",,"|n"&R1C13)&IF(RC[-19]="",,"|n"&R1C14&RC[-19])&IF(RC[-18]="",,"|n"&R1C15&RC[-18])&IF(RC[-17]="",,"|n"&R1C16&RC[-17])&IF(RC[-16]="",,"|n"&R1C17&RC[-16])&IF(RC[-15]="",,"|n"&R1C18&RC[-15])&IF(RC[-14]="",,"|n"&R1C19&RC[-14])&IF(RC[-13]="",,"|n"&R1C20&RC[-13])&IF(RC[-12]="",,"|n"&R1C21&RC[-12])&IF(RC[-10]="",,"|n"&R1C23&RC[-10])&IF(RC[-9]="",,"|n"&R1C24&RC[-9])&IF(RC[-8]="",,"|n"&R1C25&RC[-8])&IF(RC[-7]="",,"|n"&R1C26&RC[-7])&IF(RC[-6]="",,"|n"&R1C27&RC[-6])&IF(RC[-5]="",,"|n"&R1C28&RC[-5])&IF(RC[-2]="",,"|n"&RC[-2]) -> 
AF363: =VLOOKUP(RC[-31],Sheet2!R13C1:R18C2,2,0)&"."&VLOOKUP(RC[-30],Sheet2!R7C1:R11C2,2,0)&VLOOKUP(RC[-30],Sheet2!R1C1:R5C2,2,0)&RC[-29]&RC[-28]&RC[-27]&Sheet2!R1C3 -> #N/A | AG363: =IF(RC[-26]&RC[-25]&RC[-24]&RC[-23]&RC[-22]&RC[-21]="",,R1C6)&IF(RC[-26]="",,"|n"&R1C7&RC[-26])&IF(RC[-25]="",,"|n"&R1C8&RC[-25])&IF(RC[-24]="",,"|n"&R1C9&RC[-24])&IF(RC[-23]="",,"|n"&R1C10&RC[-23])&IF(RC[-22]="",,"|n"&R1C11&RC[-22])&IF(RC[-21]="",,"|n"&R1C12&RC[-21])&IF(RC[-19]&RC[-18]&RC[-17]&RC[-16]="",,"|n"&R1C13)&IF(RC[-19]="",,"|n"&R1C14&RC[-19])&IF(RC[-18]="",,"|n"&R1C15&RC[-18])&IF(RC[-17]="",,"|n"&R1C16&RC[-17])&IF(RC[-16]="",,"|n"&R1C17&RC[-16])&IF(RC[-15]="",,"|n"&R1C18&RC[-15])&IF(RC[-14]="",,"|n"&R1C19&RC[-14])&IF(RC[-13]="",,"|n"&R1C20&RC[-13])&IF(RC[-12]="",,"|n"&R1C21&RC[-12])&IF(RC[-10]="",,"|n"&R1C23&RC[-10])&IF(RC[-9]="",,"|n"&R1C24&RC[-9])&IF(RC[-8]="",,"|n"&R1C25&RC[-8])&IF(RC[-7]="",,"|n"&R1C26&RC[-7])&IF(RC[-6]="",,"|n"&R1C27&RC[-6])&IF(RC[-5]="",,"|n"&R1C28&RC[-5])&IF(RC[-2]="",,"|n"&RC[-2]) -> 
AF364: =VLOOKUP(RC[-31],Sheet2!R13C1:R18C2,2,0)&"."&VLOOKUP(RC[-30],Sheet2!R7C1:R11C2,2,0)&VLOOKUP(RC[-30],Sheet2!R1C1:R5C2,2,0)&RC[-29]&RC[-28]&RC[-27]&Sheet2!R1C3 -> #N/A | AG364: =IF(RC[-26]&RC[-25]&RC[-24]&RC[-23]&RC[-22]&RC[-21]="",,R1C6)&IF(RC[-26]="",,"|n"&R1C7&RC[-26])&IF(RC[-25]="",,"|n"&R1C8&RC[-25])&IF(RC[-24]="",,"|n"&R1C9&RC[-24])&IF(RC[-23]="",,"|n"&R1C10&RC[-23])&IF(RC[-22]="",,"|n"&R1C11&RC[-22])&IF(RC[-21]="",,"|n"&R1C12&RC[-21])&IF(RC[-19]&RC[-18]&RC[-17]&RC[-16]="",,"|n"&R1C13)&IF(RC[-19]="",,"|n"&R1C14&RC[-19])&IF(RC[-18]="",,"|n"&R1C15&RC[-18])&IF(RC[-17]="",,"|n"&R1C16&RC[-17])&IF(RC[-16]="",,"|n"&R1C17&RC[-16])&IF(RC[-15]="",,"|n"&R1C18&RC[-15])&IF(RC[-14]="",,"|n"&R1C19&RC[-14])&IF(RC[-13]="",,"|n"&R1C20&RC[-13])&IF(RC[-12]="",,"|n"&R1C21&RC[-12])&IF(RC[-10]="",,"|n"&R1C23&RC[-10])&IF(RC[-9]="",,"|n"&R1C24&RC[-9])&IF(RC[-8]="",,"|n"&R1C25&RC[-8])&IF(RC[-7]="",,"|n"&R1C26&RC[-7])&IF(RC[-6]="",,"|n"&R1C27&RC[-6])&IF(RC[-5]="",,"|n"&R1C28&RC[-5])&IF(RC[-2]="",,"|n"&RC[-2]) -> 
AF365: =VLOOKUP(RC[-31],Sheet2!R13C1:R18C2,2,0)&"."&VLOOKUP(RC[-30],Sheet2!R7C1:R11C2,2,0)&VLOOKUP(RC[-30],Sheet2!R1C1:R5C2,2,0)&RC[-29]&RC[-28]&RC[-27]&Sheet2!R1C3 -> #N/A | AG365: =IF(RC[-26]&RC[-25]&RC[-24]&RC[-23]&RC[-22]&RC[-21]="",,R1C6)&IF(RC[-26]="",,"|n"&R1C7&RC[-26])&IF(RC[-25]="",,"|n"&R1C8&RC[-25])&IF(RC[-24]="",,"|n"&R1C9&RC[-24])&IF(RC[-23]="",,"|n"&R1C10&RC[-23])&IF(RC[-22]="",,"|n"&R1C11&RC[-22])&IF(RC[-21]="",,"|n"&R1C12&RC[-21])&IF(RC[-19]&RC[-18]&RC[-17]&RC[-16]="",,"|n"&R1C13)&IF(RC[-19]="",,"|n"&R1C14&RC[-19])&IF(RC[-18]="",,"|n"&R1C15&RC[-18])&IF(RC[-17]="",,"|n"&R1C16&RC[-17])&IF(RC[-16]="",,"|n"&R1C17&RC[-16])&IF(RC[-15]="",,"|n"&R1C18&RC[-15])&IF(RC[-14]="",,"|n"&R1C19&RC[-14])&IF(RC[-13]="",,"|n"&R1C20&RC[-13])&IF(RC[-12]="",,"|n"&R1C21&RC[-12])&IF(RC[-10]="",,"|n"&R1C23&RC[-10])&IF(RC[-9]="",,"|n"&R1C24&RC[-9])&IF(RC[-8]="",,"|n"&R1C25&RC[-8])&IF(RC[-7]="",,"|n"&R1C26&RC[-7])&IF(RC[-6]="",,"|n"&R1C27&RC[-6])&IF(RC[-5]="",,"|n"&R1C28&RC[-5])&IF(RC[-2]="",,"|n"&RC[-2]) -> 
AF366: =VLOOKUP(RC[-31],Sheet2!R13C1:R18C2,2,0)&"."&VLOOKUP(RC[-30],Sheet2!R7C1:R11C2,2,0)&VLOOKUP(RC[-30],Sheet2!R1C1:R5C2,2,0)&RC[-29]&RC[-28]&RC[-27]&Sheet2!R1C3 -> #N/A | AG366: =IF(RC[-26]&RC[-25]&RC[-24]&RC[-23]&RC[-22]&RC[-21]="",,R1C6)&IF(RC[-26]="",,"|n"&R1C7&RC[-26])&IF(RC[-25]="",,"|n"&R1C8&RC[-25])&IF(RC[-24]="",,"|n"&R1C9&RC[-24])&IF(RC[-23]="",,"|n"&R1C10&RC[-23])&IF(RC[-22]="",,"|n"&R1C11&RC[-22])&IF(RC[-21]="",,"|n"&R1C12&RC[-21])&IF(RC[-19]&RC[-18]&RC[-17]&RC[-16]="",,"|n"&R1C13)&IF(RC[-19]="",,"|n"&R1C14&RC[-19])&IF(RC[-18]="",,"|n"&R1C15&RC[-18])&IF(RC[-17]="",,"|n"&R1C16&RC[-17])&IF(RC[-16]="",,"|n"&R1C17&RC[-16])&IF(RC[-15]="",,"|n"&R1C18&RC[-15])&IF(RC[-14]="",,"|n"&R1C19&RC[-14])&IF(RC[-13]="",,"|n"&R1C20&RC[-13])&IF(RC[-12]="",,"|n"&R1C21&RC[-12])&IF(RC[-10]="",,"|n"&R1C23&RC[-10])&IF(RC[-9]="",,"|n"&R1C24&RC[-9])&IF(RC[-8]="",,"|n"&R1C25&RC[-8])&IF(RC[-7]="",,"|n"&R1C26&RC[-7])&IF(RC[-6]="",,"|n"&R1C27&RC[-6])&IF(RC[-5]="",,"|n"&R1C28&RC[-5])&IF(RC[-2]="",,"|n"&RC[-2]) -> 
AF367: =VLOOKUP(RC[-31],Sheet2!R13C1:R18C2,2,0)&"."&VLOOKUP(RC[-30],Sheet2!R7C1:R11C2,2,0)&VLOOKUP(RC[-30],Sheet2!R1C1:R5C2,2,0)&RC[-29]&RC[-28]&RC[-27]&Sheet2!R1C3 -> #N/A | AG367: =IF(RC[-26]&RC[-25]&RC[-24]&RC[-23]&RC[-22]&RC[-21]="",,R1C6)&IF(RC[-26]="",,"|n"&R1C7&RC[-26])&IF(RC[-25]="",,"|n"&R1C8&RC[-25])&IF(RC[-24]="",,"|n"&R1C9&RC[-24])&IF(RC[-23]="",,"|n"&R1C10&RC[-23])&IF(RC[-22]="",,"|n"&R1C11&RC[-22])&IF(RC[-21]="",,"|n"&R1C12&RC[-21])&IF(RC[-19]&RC[-18]&RC[-17]&RC[-16]="",,"|n"&R1C13)&IF(RC[-19]="",,"|n"&R1C14&RC[-19])&IF(RC[-18]="",,"|n"&R1C15&RC[-18])&IF(RC[-17]="",,"|n"&R1C16&RC[-17])&IF(RC[-16]="",,"|n"&R1C17&RC[-16])&IF(RC[-15]="",,"|n"&R1C18&RC[-15])&IF(RC[-14]="",,"|n"&R1C19&RC[-14])&IF(RC[-13]="",,"|n"&R1C20&RC[-13])&IF(RC[-12]="",,"|n"&R1C21&RC[-12])&IF(RC[-10]="",,"|n"&R1C23&RC[-10])&IF(RC[-9]="",,"|n"&R1C24&RC[-9])&IF(RC[-8]="",,"|n"&R1C25&RC[-8])&IF(RC[-7]="",,"|n"&R1C26&RC[-7])&IF(RC[-6]="",,"|n"&R1C27&RC[-6])&IF(RC[-5]="",,"|n"&R1C28&RC[-5])&IF(RC[-2]="",,"|n"&RC[-2]) -> 
AF368: =VLOOKUP(RC[-31],Sheet2!R13C1:R18C2,2,0)&"."&VLOOKUP(RC[-30],Sheet2!R7C1:R11C2,2,0)&VLOOKUP(RC[-30],Sheet2!R1C1:R5C2,2,0)&RC[-29]&RC[-28]&RC[-27]&Sheet2!R1C3 -> #N/A | AG368: =IF(RC[-26]&RC[-25]&RC[-24]&RC[-23]&RC[-22]&RC[-21]="",,R1C6)&IF(RC[-26]="",,"|n"&R1C7&RC[-26])&IF(RC[-25]="",,"|n"&R1C8&RC[-25])&IF(RC[-24]="",,"|n"&R1C9&RC[-24])&IF(RC[-23]="",,"|n"&R1C10&RC[-23])&IF(RC[-22]="",,"|n"&R1C11&RC[-22])&IF(RC[-21]="",,"|n"&R1C12&RC[-21])&IF(RC[-19]&RC[-18]&RC[-17]&RC[-16]="",,"|n"&R1C13)&IF(RC[-19]="",,"|n"&R1C14&RC[-19])&IF(RC[-18]="",,"|n"&R1C15&RC[-18])&IF(RC[-17]="",,"|n"&R1C16&RC[-17])&IF(RC[-16]="",,"|n"&R1C17&RC[-16])&IF(RC[-15]="",,"|n"&R1C18&RC[-15])&IF(RC[-14]="",,"|n"&R1C19&RC[-14])&IF(RC[-13]="",,"|n"&R1C20&RC[-13])&IF(RC[-12]="",,"|n"&R1C21&RC[-12])&IF(RC[-10]="",,"|n"&R1C23&RC[-10])&IF(RC[-9]="",,"|n"&R1C24&RC[-9])&IF(RC[-8]="",,"|n"&R1C25&RC[-8])&IF(RC[-7]="",,"|n"&R1C26&RC[-7])&IF(RC[-6]="",,"|n"&R1C27&RC[-6])&IF(RC[-5]="",,"|n"&R1C28&RC[-5])&IF(RC[-2]="",,"|n"&RC[-2]) -> 
AF369: =VLOOKUP(RC[-31],Sheet2!R13C1:R18C2,2,0)&"."&VLOOKUP(RC[-30],Sheet2!R7C1:R11C2,2,0)&VLOOKUP(RC[-30],Sheet2!R1C1:R5C2,2,0)&RC[-29]&RC[-28]&RC[-27]&Sheet2!R1C3 -> #N/A | AG369: =IF(RC[-26]&RC[-25]&RC[-24]&RC[-23]&RC[-22]&RC[-21]="",,R1C6)&IF(RC[-26]="",,"|n"&R1C7&RC[-26])&IF(RC[-25]="",,"|n"&R1C8&RC[-25])&IF(RC[-24]="",,"|n"&R1C9&RC[-24])&IF(RC[-23]="",,"|n"&R1C10&RC[-23])&IF(RC[-22]="",,"|n"&R1C11&RC[-22])&IF(RC[-21]="",,"|n"&R1C12&RC[-21])&IF(RC[-19]&RC[-18]&RC[-17]&RC[-16]="",,"|n"&R1C13)&IF(RC[-19]="",,"|n"&R1C14&RC[-19])&IF(RC[-18]="",,"|n"&R1C15&RC[-18])&IF(RC[-17]="",,"|n"&R1C16&RC[-17])&IF(RC[-16]="",,"|n"&R1C17&RC[-16])&IF(RC[-15]="",,"|n"&R1C18&RC[-15])&IF(RC[-14]="",,"|n"&R1C19&RC[-14])&IF(RC[-13]="",,"|n"&R1C20&RC[-13])&IF(RC[-12]="",,"|n"&R1C21&RC[-12])&IF(RC[-10]="",,"|n"&R1C23&RC[-10])&IF(RC[-9]="",,"|n"&R1C24&RC[-9])&IF(RC[-8]="",,"|n"&R1C25&RC[-8])&IF(RC[-7]="",,"|n"&R1C26&RC[-7])&IF(RC[-6]="",,"|n"&R1C27&RC[-6])&IF(RC[-5]="",,"|n"&R1C28&RC[-5])&IF(RC[-2]="",,"|n"&RC[-2]) -> 
AF370: =VLOOKUP(RC[-31],Sheet2!R13C1:R18C2,2,0)&"."&VLOOKUP(RC[-30],Sheet2!R7C1:R11C2,2,0)&VLOOKUP(RC[-30],Sheet2!R1C1:R5C2,2,0)&RC[-29]&RC[-28]&RC[-27]&Sheet2!R1C3 -> #N/A | AG370: =IF(RC[-26]&RC[-25]&RC[-24]&RC[-23]&RC[-22]&RC[-21]="",,R1C6)&IF(RC[-26]="",,"|n"&R1C7&RC[-26])&IF(RC[-25]="",,"|n"&R1C8&RC[-25])&IF(RC[-24]="",,"|n"&R1C9&RC[-24])&IF(RC[-23]="",,"|n"&R1C10&RC[-23])&IF(RC[-22]="",,"|n"&R1C11&RC[-22])&IF(RC[-21]="",,"|n"&R1C12&RC[-21])&IF(RC[-19]&RC[-18]&RC[-17]&RC[-16]="",,"|n"&R1C13)&IF(RC[-19]="",,"|n"&R1C14&RC[-19])&IF(RC[-18]="",,"|n"&R1C15&RC[-18])&IF(RC[-17]="",,"|n"&R1C16&RC[-17])&IF(RC[-16]="",,"|n"&R1C17&RC[-16])&IF(RC[-15]="",,"|n"&R1C18&RC[-15])&IF(RC[-14]="",,"|n"&R1C19&RC[-14])&IF(RC[-13]="",,"|n"&R1C20&RC[-13])&IF(RC[-12]="",,"|n"&R1C21&RC[-12])&IF(RC[-10]="",,"|n"&R1C23&RC[-10])&IF(RC[-9]="",,"|n"&R1C24&RC[-9])&IF(RC[-8]="",,"|n"&R1C25&RC[-8])&IF(RC[-7]="",,"|n"&R1C26&RC[-7])&IF(RC[-6]="",,"|n"&R1C27&RC[-6])&IF(RC[-5]="",,"|n"&R1C28&RC[-5])&IF(RC[-2]="",,"|n"&RC[-2]) -> 
AF371: =VLOOKUP(RC[-31],Sheet2!R13C1:R18C2,2,0)&"."&VLOOKUP(RC[-30],Sheet2!R7C1:R11C2,2,0)&VLOOKUP(RC[-30],Sheet2!R1C1:R5C2,2,0)&RC[-29]&RC[-28]&RC[-27]&Sheet2!R1C3 -> #N/A | AG371: =IF(RC[-26]&RC[-25]&RC[-24]&RC[-23]&RC[-22]&RC[-21]="",,R1C6)&IF(RC[-26]="",,"|n"&R1C7&RC[-26])&IF(RC[-25]="",,"|n"&R1C8&RC[-25])&IF(RC[-24]="",,"|n"&R1C9&RC[-24])&IF(RC[-23]="",,"|n"&R1C10&RC[-23])&IF(RC[-22]="",,"|n"&R1C11&RC[-22])&IF(RC[-21]="",,"|n"&R1C12&RC[-21])&IF(RC[-19]&RC[-18]&RC[-17]&RC[-16]="",,"|n"&R1C13)&IF(RC[-19]="",,"|n"&R1C14&RC[-19])&IF(RC[-18]="",,"|n"&R1C15&RC[-18])&IF(RC[-17]="",,"|n"&R1C16&RC[-17])&IF(RC[-16]="",,"|n"&R1C17&RC[-16])&IF(RC[-15]="",,"|n"&R1C18&RC[-15])&IF(RC[-14]="",,"|n"&R1C19&RC[-14])&IF(RC[-13]="",,"|n"&R1C20&RC[-13])&IF(RC[-12]="",,"|n"&R1C21&RC[-12])&IF(RC[-10]="",,"|n"&R1C23&RC[-10])&IF(RC[-9]="",,"|n"&R1C24&RC[-9])&IF(RC[-8]="",,"|n"&R1C25&RC[-8])&IF(RC[-7]="",,"|n"&R1C26&RC[-7])&IF(RC[-6]="",,"|n"&R1C27&RC[-6])&IF(RC[-5]="",,"|n"&R1C28&RC[-5])&IF(RC[-2]="",,"|n"&RC[-2]) -> 
AF372: =VLOOKUP(RC[-31],Sheet2!R13C1:R18C2,2,0)&"."&VLOOKUP(RC[-30],Sheet2!R7C1:R11C2,2,0)&VLOOKUP(RC[-30],Sheet2!R1C1:R5C2,2,0)&RC[-29]&RC[-28]&RC[-27]&Sheet2!R1C3 -> #N/A | AG372: =IF(RC[-26]&RC[-25]&RC[-24]&RC[-23]&RC[-22]&RC[-21]="",,R1C6)&IF(RC[-26]="",,"|n"&R1C7&RC[-26])&IF(RC[-25]="",,"|n"&R1C8&RC[-25])&IF(RC[-24]="",,"|n"&R1C9&RC[-24])&IF(RC[-23]="",,"|n"&R1C10&RC[-23])&IF(RC[-22]="",,"|n"&R1C11&RC[-22])&IF(RC[-21]="",,"|n"&R1C12&RC[-21])&IF(RC[-19]&RC[-18]&RC[-17]&RC[-16]="",,"|n"&R1C13)&IF(RC[-19]="",,"|n"&R1C14&RC[-19])&IF(RC[-18]="",,"|n"&R1C15&RC[-18])&IF(RC[-17]="",,"|n"&R1C16&RC[-17])&IF(RC[-16]="",,"|n"&R1C17&RC[-16])&IF(RC[-15]="",,"|n"&R1C18&RC[-15])&IF(RC[-14]="",,"|n"&R1C19&RC[-14])&IF(RC[-13]="",,"|n"&R1C20&RC[-13])&IF(RC[-12]="",,"|n"&R1C21&RC[-12])&IF(RC[-10]="",,"|n"&R1C23&RC[-10])&IF(RC[-9]="",,"|n"&R1C24&RC[-9])&IF(RC[-8]="",,"|n"&R1C25&RC[-8])&IF(RC[-7]="",,"|n"&R1C26&RC[-7])&IF(RC[-6]="",,"|n"&R1C27&RC[-6])&IF(RC[-5]="",,"|n"&R1C28&RC[-5])&IF(RC[-2]="",,"|n"&RC[-2]) -> 
AF373: =VLOOKUP(RC[-31],Sheet2!R13C1:R18C2,2,0)&"."&VLOOKUP(RC[-30],Sheet2!R7C1:R11C2,2,0)&VLOOKUP(RC[-30],Sheet2!R1C1:R5C2,2,0)&RC[-29]&RC[-28]&RC[-27]&Sheet2!R1C3 -> #N/A | AG373: =IF(RC[-26]&RC[-25]&RC[-24]&RC[-23]&RC[-22]&RC[-21]="",,R1C6)&IF(RC[-26]="",,"|n"&R1C7&RC[-26])&IF(RC[-25]="",,"|n"&R1C8&RC[-25])&IF(RC[-24]="",,"|n"&R1C9&RC[-24])&IF(RC[-23]="",,"|n"&R1C10&RC[-23])&IF(RC[-22]="",,"|n"&R1C11&RC[-22])&IF(RC[-21]="",,"|n"&R1C12&RC[-21])&IF(RC[-19]&RC[-18]&RC[-17]&RC[-16]="",,"|n"&R1C13)&IF(RC[-19]="",,"|n"&R1C14&RC[-19])&IF(RC[-18]="",,"|n"&R1C15&RC[-18])&IF(RC[-17]="",,"|n"&R1C16&RC[-17])&IF(RC[-16]="",,"|n"&R1C17&RC[-16])&IF(RC[-15]="",,"|n"&R1C18&RC[-15])&IF(RC[-14]="",,"|n"&R1C19&RC[-14])&IF(RC[-13]="",,"|n"&R1C20&RC[-13])&IF(RC[-12]="",,"|n"&R1C21&RC[-12])&IF(RC[-10]="",,"|n"&R1C23&RC[-10])&IF(RC[-9]="",,"|n"&R1C24&RC[-9])&IF(RC[-8]="",,"|n"&R1C25&RC[-8])&IF(RC[-7]="",,"|n"&R1C26&RC[-7])&IF(RC[-6]="",,"|n"&R1C27&RC[-6])&IF(RC[-5]="",,"|n"&R1C28&RC[-5])&IF(RC[-2]="",,"|n"&RC[-2]) -> 
AF374: =VLOOKUP(RC[-31],Sheet2!R13C1:R18C2,2,0)&"."&VLOOKUP(RC[-30],Sheet2!R7C1:R11C2,2,0)&VLOOKUP(RC[-30],Sheet2!R1C1:R5C2,2,0)&RC[-29]&RC[-28]&RC[-27]&Sheet2!R1C3 -> #N/A | AG374: =IF(RC[-26]&RC[-25]&RC[-24]&RC[-23]&RC[-22]&RC[-21]="",,R1C6)&IF(RC[-26]="",,"|n"&R1C7&RC[-26])&IF(RC[-25]="",,"|n"&R1C8&RC[-25])&IF(RC[-24]="",,"|n"&R1C9&RC[-24])&IF(RC[-23]="",,"|n"&R1C10&RC[-23])&IF(RC[-22]="",,"|n"&R1C11&RC[-22])&IF(RC[-21]="",,"|n"&R1C12&RC[-21])&IF(RC[-19]&RC[-18]&RC[-17]&RC[-16]="",,"|n"&R1C13)&IF(RC[-19]="",,"|n"&R1C14&RC[-19])&IF(RC[-18]="",,"|n"&R1C15&RC[-18])&IF(RC[-17]="",,"|n"&R1C16&RC[-17])&IF(RC[-16]="",,"|n"&R1C17&RC[-16])&IF(RC[-15]="",,"|n"&R1C18&RC[-15])&IF(RC[-14]="",,"|n"&R1C19&RC[-14])&IF(RC[-13]="",,"|n"&R1C20&RC[-13])&IF(RC[-12]="",,"|n"&R1C21&RC[-12])&IF(RC[-10]="",,"|n"&R1C23&RC[-10])&IF(RC[-9]="",,"|n"&R1C24&RC[-9])&IF(RC[-8]="",,"|n"&R1C25&RC[-8])&IF(RC[-7]="",,"|n"&R1C26&RC[-7])&IF(RC[-6]="",,"|n"&R1C27&RC[-6])&IF(RC[-5]="",,"|n"&R1C28&RC[-5])&IF(RC[-2]="",,"|n"&RC[-2]) -> 
AF375: =VLOOKUP(RC[-31],Sheet2!R13C1:R18C2,2,0)&"."&VLOOKUP(RC[-30],Sheet2!R7C1:R11C2,2,0)&VLOOKUP(RC[-30],Sheet2!R1C1:R5C2,2,0)&RC[-29]&RC[-28]&RC[-27]&Sheet2!R1C3 -> #N/A | AG375: =IF(RC[-26]&RC[-25]&RC[-24]&RC[-23]&RC[-22]&RC[-21]="",,R1C6)&IF(RC[-26]="",,"|n"&R1C7&RC[-26])&IF(RC[-25]="",,"|n"&R1C8&RC[-25])&IF(RC[-24]="",,"|n"&R1C9&RC[-24])&IF(RC[-23]="",,"|n"&R1C10&RC[-23])&IF(RC[-22]="",,"|n"&R1C11&RC[-22])&IF(RC[-21]="",,"|n"&R1C12&RC[-21])&IF(RC[-19]&RC[-18]&RC[-17]&RC[-16]="",,"|n"&R1C13)&IF(RC[-19]="",,"|n"&R1C14&RC[-19])&IF(RC[-18]="",,"|n"&R1C15&RC[-18])&IF(RC[-17]="",,"|n"&R1C16&RC[-17])&IF(RC[-16]="",,"|n"&R1C17&RC[-16])&IF(RC[-15]="",,"|n"&R1C18&RC[-15])&IF(RC[-14]="",,"|n"&R1C19&RC[-14])&IF(RC[-13]="",,"|n"&R1C20&RC[-13])&IF(RC[-12]="",,"|n"&R1C21&RC[-12])&IF(RC[-10]="",,"|n"&R1C23&RC[-10])&IF(RC[-9]="",,"|n"&R1C24&RC[-9])&IF(RC[-8]="",,"|n"&R1C25&RC[-8])&IF(RC[-7]="",,"|n"&R1C26&RC[-7])&IF(RC[-6]="",,"|n"&R1C27&RC[-6])&IF(RC[-5]="",,"|n"&R1C28&RC[-5])&IF(RC[-2]="",,"|n"&RC[-2]) -> 
AF376: =VLOOKUP(RC[-31],Sheet2!R13C1:R18C2,2,0)&"."&VLOOKUP(RC[-30],Sheet2!R7C1:R11C2,2,0)&VLOOKUP(RC[-30],Sheet2!R1C1:R5C2,2,0)&RC[-29]&RC[-28]&RC[-27]&Sheet2!R1C3 -> #N/A | AG376: =IF(RC[-26]&RC[-25]&RC[-24]&RC[-23]&RC[-22]&RC[-21]="",,R1C6)&IF(RC[-26]="",,"|n"&R1C7&RC[-26])&IF(RC[-25]="",,"|n"&R1C8&RC[-25])&IF(RC[-24]="",,"|n"&R1C9&RC[-24])&IF(RC[-23]="",,"|n"&R1C10&RC[-23])&IF(RC[-22]="",,"|n"&R1C11&RC[-22])&IF(RC[-21]="",,"|n"&R1C12&RC[-21])&IF(RC[-19]&RC[-18]&RC[-17]&RC[-16]="",,"|n"&R1C13)&IF(RC[-19]="",,"|n"&R1C14&RC[-19])&IF(RC[-18]="",,"|n"&R1C15&RC[-18])&IF(RC[-17]="",,"|n"&R1C16&RC[-17])&IF(RC[-16]="",,"|n"&R1C17&RC[-16])&IF(RC[-15]="",,"|n"&R1C18&RC[-15])&IF(RC[-14]="",,"|n"&R1C19&RC[-14])&IF(RC[-13]="",,"|n"&R1C20&RC[-13])&IF(RC[-12]="",,"|n"&R1C21&RC[-12])&IF(RC[-10]="",,"|n"&R1C23&RC[-10])&IF(RC[-9]="",,"|n"&R1C24&RC[-9])&IF(RC[-8]="",,"|n"&R1C25&RC[-8])&IF(RC[-7]="",,"|n"&R1C26&RC[-7])&IF(RC[-6]="",,"|n"&R1C27&RC[-6])&IF(RC[-5]="",,"|n"&R1C28&RC[-5])&IF(RC[-2]="",,"|n"&RC[-2]) -> 
AF377: =VLOOKUP(RC[-31],Sheet2!R13C1:R18C2,2,0)&"."&VLOOKUP(RC[-30],Sheet2!R7C1:R11C2,2,0)&VLOOKUP(RC[-30],Sheet2!R1C1:R5C2,2,0)&RC[-29]&RC[-28]&RC[-27]&Sheet2!R1C3 -> #N/A | AG377: =IF(RC[-26]&RC[-25]&RC[-24]&RC[-23]&RC[-22]&RC[-21]="",,R1C6)&IF(RC[-26]="",,"|n"&R1C7&RC[-26])&IF(RC[-25]="",,"|n"&R1C8&RC[-25])&IF(RC[-24]="",,"|n"&R1C9&RC[-24])&IF(RC[-23]="",,"|n"&R1C10&RC[-23])&IF(RC[-22]="",,"|n"&R1C11&RC[-22])&IF(RC[-21]="",,"|n"&R1C12&RC[-21])&IF(RC[-19]&RC[-18]&RC[-17]&RC[-16]="",,"|n"&R1C13)&IF(RC[-19]="",,"|n"&R1C14&RC[-19])&IF(RC[-18]="",,"|n"&R1C15&RC[-18])&IF(RC[-17]="",,"|n"&R1C16&RC[-17])&IF(RC[-16]="",,"|n"&R1C17&RC[-16])&IF(RC[-15]="",,"|n"&R1C18&RC[-15])&IF(RC[-14]="",,"|n"&R1C19&RC[-14])&IF(RC[-13]="",,"|n"&R1C20&RC[-13])&IF(RC[-12]="",,"|n"&R1C21&RC[-12])&IF(RC[-10]="",,"|n"&R1C23&RC[-10])&IF(RC[-9]="",,"|n"&R1C24&RC[-9])&IF(RC[-8]="",,"|n"&R1C25&RC[-8])&IF(RC[-7]="",,"|n"&R1C26&RC[-7])&IF(RC[-6]="",,"|n"&R1C27&RC[-6])&IF(RC[-5]="",,"|n"&R1C28&RC[-5])&IF(RC[-2]="",,"|n"&RC[-2]) -> 
AF378: =VLOOKUP(RC[-31],Sheet2!R13C1:R18C2,2,0)&"."&VLOOKUP(RC[-30],Sheet2!R7C1:R11C2,2,0)&VLOOKUP(RC[-30],Sheet2!R1C1:R5C2,2,0)&RC[-29]&RC[-28]&RC[-27]&Sheet2!R1C3 -> #N/A | AG378: =IF(RC[-26]&RC[-25]&RC[-24]&RC[-23]&RC[-22]&RC[-21]="",,R1C6)&IF(RC[-26]="",,"|n"&R1C7&RC[-26])&IF(RC[-25]="",,"|n"&R1C8&RC[-25])&IF(RC[-24]="",,"|n"&R1C9&RC[-24])&IF(RC[-23]="",,"|n"&R1C10&RC[-23])&IF(RC[-22]="",,"|n"&R1C11&RC[-22])&IF(RC[-21]="",,"|n"&R1C12&RC[-21])&IF(RC[-19]&RC[-18]&RC[-17]&RC[-16]="",,"|n"&R1C13)&IF(RC[-19]="",,"|n"&R1C14&RC[-19])&IF(RC[-18]="",,"|n"&R1C15&RC[-18])&IF(RC[-17]="",,"|n"&R1C16&RC[-17])&IF(RC[-16]="",,"|n"&R1C17&RC[-16])&IF(RC[-15]="",,"|n"&R1C18&RC[-15])&IF(RC[-14]="",,"|n"&R1C19&RC[-14])&IF(RC[-13]="",,"|n"&R1C20&RC[-13])&IF(RC[-12]="",,"|n"&R1C21&RC[-12])&IF(RC[-10]="",,"|n"&R1C23&RC[-10])&IF(RC[-9]="",,"|n"&R1C24&RC[-9])&IF(RC[-8]="",,"|n"&R1C25&RC[-8])&IF(RC[-7]="",,"|n"&R1C26&RC[-7])&IF(RC[-6]="",,"|n"&R1C27&RC[-6])&IF(RC[-5]="",,"|n"&R1C28&RC[-5])&IF(RC[-2]="",,"|n"&RC[-2]) -> 
AF379: =VLOOKUP(RC[-31],Sheet2!R13C1:R18C2,2,0)&"."&VLOOKUP(RC[-30],Sheet2!R7C1:R11C2,2,0)&VLOOKUP(RC[-30],Sheet2!R1C1:R5C2,2,0)&RC[-29]&RC[-28]&RC[-27]&Sheet2!R1C3 -> #N/A | AG379: =IF(RC[-26]&RC[-25]&RC[-24]&RC[-23]&RC[-22]&RC[-21]="",,R1C6)&IF(RC[-26]="",,"|n"&R1C7&RC[-26])&IF(RC[-25]="",,"|n"&R1C8&RC[-25])&IF(RC[-24]="",,"|n"&R1C9&RC[-24])&IF(RC[-23]="",,"|n"&R1C10&RC[-23])&IF(RC[-22]="",,"|n"&R1C11&RC[-22])&IF(RC[-21]="",,"|n"&R1C12&RC[-21])&IF(RC[-19]&RC[-18]&RC[-17]&RC[-16]="",,"|n"&R1C13)&IF(RC[-19]="",,"|n"&R1C14&RC[-19])&IF(RC[-18]="",,"|n"&R1C15&RC[-18])&IF(RC[-17]="",,"|n"&R1C16&RC[-17])&IF(RC[-16]="",,"|n"&R1C17&RC[-16])&IF(RC[-15]="",,"|n"&R1C18&RC[-15])&IF(RC[-14]="",,"|n"&R1C19&RC[-14])&IF(RC[-13]="",,"|n"&R1C20&RC[-13])&IF(RC[-12]="",,"|n"&R1C21&RC[-12])&IF(RC[-10]="",,"|n"&R1C23&RC[-10])&IF(RC[-9]="",,"|n"&R1C24&RC[-9])&IF(RC[-8]="",,"|n"&R1C25&RC[-8])&IF(RC[-7]="",,"|n"&R1C26&RC[-7])&IF(RC[-6]="",,"|n"&R1C27&RC[-6])&IF(RC[-5]="",,"|n"&R1C28&RC[-5])&IF(RC[-2]="",,"|n"&RC[-2]) -> 
AF380: =VLOOKUP(RC[-31],Sheet2!R13C1:R18C2,2,0)&"."&VLOOKUP(RC[-30],Sheet2!R7C1:R11C2,2,0)&VLOOKUP(RC[-30],Sheet2!R1C1:R5C2,2,0)&RC[-29]&RC[-28]&RC[-27]&Sheet2!R1C3 -> #N/A | AG380: =IF(RC[-26]&RC[-25]&RC[-24]&RC[-23]&RC[-22]&RC[-21]="",,R1C6)&IF(RC[-26]="",,"|n"&R1C7&RC[-26])&IF(RC[-25]="",,"|n"&R1C8&RC[-25])&IF(RC[-24]="",,"|n"&R1C9&RC[-24])&IF(RC[-23]="",,"|n"&R1C10&RC[-23])&IF(RC[-22]="",,"|n"&R1C11&RC[-22])&IF(RC[-21]="",,"|n"&R1C12&RC[-21])&IF(RC[-19]&RC[-18]&RC[-17]&RC[-16]="",,"|n"&R1C13)&IF(RC[-19]="",,"|n"&R1C14&RC[-19])&IF(RC[-18]="",,"|n"&R1C15&RC[-18])&IF(RC[-17]="",,"|n"&R1C16&RC[-17])&IF(RC[-16]="",,"|n"&R1C17&RC[-16])&IF(RC[-15]="",,"|n"&R1C18&RC[-15])&IF(RC[-14]="",,"|n"&R1C19&RC[-14])&IF(RC[-13]="",,"|n"&R1C20&RC[-13])&IF(RC[-12]="",,"|n"&R1C21&RC[-12])&IF(RC[-10]="",,"|n"&R1C23&RC[-10])&IF(RC[-9]="",,"|n"&R1C24&RC[-9])&IF(RC[-8]="",,"|n"&R1C25&RC[-8])&IF(RC[-7]="",,"|n"&R1C26&RC[-7])&IF(RC[-6]="",,"|n"&R1C27&RC[-6])&IF(RC[-5]="",,"|n"&R1C28&RC[-5])&IF(RC[-2]="",,"|n"&RC[-2]) -> 
AF381: =VLOOKUP(RC[-31],Sheet2!R13C1:R18C2,2,0)&"."&VLOOKUP(RC[-30],Sheet2!R7C1:R11C2,2,0)&VLOOKUP(RC[-30],Sheet2!R1C1:R5C2,2,0)&RC[-29]&RC[-28]&RC[-27]&Sheet2!R1C3 -> #N/A | AG381: =IF(RC[-26]&RC[-25]&RC[-24]&RC[-23]&RC[-22]&RC[-21]="",,R1C6)&IF(RC[-26]="",,"|n"&R1C7&RC[-26])&IF(RC[-25]="",,"|n"&R1C8&RC[-25])&IF(RC[-24]="",,"|n"&R1C9&RC[-24])&IF(RC[-23]="",,"|n"&R1C10&RC[-23])&IF(RC[-22]="",,"|n"&R1C11&RC[-22])&IF(RC[-21]="",,"|n"&R1C12&RC[-21])&IF(RC[-19]&RC[-18]&RC[-17]&RC[-16]="",,"|n"&R1C13)&IF(RC[-19]="",,"|n"&R1C14&RC[-19])&IF(RC[-18]="",,"|n"&R1C15&RC[-18])&IF(RC[-17]="",,"|n"&R1C16&RC[-17])&IF(RC[-16]="",,"|n"&R1C17&RC[-16])&IF(RC[-15]="",,"|n"&R1C18&RC[-15])&IF(RC[-14]="",,"|n"&R1C19&RC[-14])&IF(RC[-13]="",,"|n"&R1C20&RC[-13])&IF(RC[-12]="",,"|n"&R1C21&RC[-12])&IF(RC[-10]="",,"|n"&R1C23&RC[-10])&IF(RC[-9]="",,"|n"&R1C24&RC[-9])&IF(RC[-8]="",,"|n"&R1C25&RC[-8])&IF(RC[-7]="",,"|n"&R1C26&RC[-7])&IF(RC[-6]="",,"|n"&R1C27&RC[-6])&IF(RC[-5]="",,"|n"&R1C28&RC[-5])&IF(RC[-2]="",,"|n"&RC[-2]) -> 
AF382: =VLOOKUP(RC[-31],Sheet2!R13C1:R18C2,2,0)&"."&VLOOKUP(RC[-30],Sheet2!R7C1:R11C2,2,0)&VLOOKUP(RC[-30],Sheet2!R1C1:R5C2,2,0)&RC[-29]&RC[-28]&RC[-27]&Sheet2!R1C3 -> #N/A | AG382: =IF(RC[-26]&RC[-25]&RC[-24]&RC[-23]&RC[-22]&RC[-21]="",,R1C6)&IF(RC[-26]="",,"|n"&R1C7&RC[-26])&IF(RC[-25]="",,"|n"&R1C8&RC[-25])&IF(RC[-24]="",,"|n"&R1C9&RC[-24])&IF(RC[-23]="",,"|n"&R1C10&RC[-23])&IF(RC[-22]="",,"|n"&R1C11&RC[-22])&IF(RC[-21]="",,"|n"&R1C12&RC[-21])&IF(RC[-19]&RC[-18]&RC[-17]&RC[-16]="",,"|n"&R1C13)&IF(RC[-19]="",,"|n"&R1C14&RC[-19])&IF(RC[-18]="",,"|n"&R1C15&RC[-18])&IF(RC[-17]="",,"|n"&R1C16&RC[-17])&IF(RC[-16]="",,"|n"&R1C17&RC[-16])&IF(RC[-15]="",,"|n"&R1C18&RC[-15])&IF(RC[-14]="",,"|n"&R1C19&RC[-14])&IF(RC[-13]="",,"|n"&R1C20&RC[-13])&IF(RC[-12]="",,"|n"&R1C21&RC[-12])&IF(RC[-10]="",,"|n"&R1C23&RC[-10])&IF(RC[-9]="",,"|n"&R1C24&RC[-9])&IF(RC[-8]="",,"|n"&R1C25&RC[-8])&IF(RC[-7]="",,"|n"&R1C26&RC[-7])&IF(RC[-6]="",,"|n"&R1C27&RC[-6])&IF(RC[-5]="",,"|n"&R1C28&RC[-5])&IF(RC[-2]="",,"|n"&RC[-2]) -> 
AF383: =VLOOKUP(RC[-31],Sheet2!R13C1:R18C2,2,0)&"."&VLOOKUP(RC[-30],Sheet2!R7C1:R11C2,2,0)&VLOOKUP(RC[-30],Sheet2!R1C1:R5C2,2,0)&RC[-29]&RC[-28]&RC[-27]&Sheet2!R1C3 -> #N/A | AG383: =IF(RC[-26]&RC[-25]&RC[-24]&RC[-23]&RC[-22]&RC[-21]="",,R1C6)&IF(RC[-26]="",,"|n"&R1C7&RC[-26])&IF(RC[-25]="",,"|n"&R1C8&RC[-25])&IF(RC[-24]="",,"|n"&R1C9&RC[-24])&IF(RC[-23]="",,"|n"&R1C10&RC[-23])&IF(RC[-22]="",,"|n"&R1C11&RC[-22])&IF(RC[-21]="",,"|n"&R1C12&RC[-21])&IF(RC[-19]&RC[-18]&RC[-17]&RC[-16]="",,"|n"&R1C13)&IF(RC[-19]="",,"|n"&R1C14&RC[-19])&IF(RC[-18]="",,"|n"&R1C15&RC[-18])&IF(RC[-17]="",,"|n"&R1C16&RC[-17])&IF(RC[-16]="",,"|n"&R1C17&RC[-16])&IF(RC[-15]="",,"|n"&R1C18&RC[-15])&IF(RC[-14]="",,"|n"&R1C19&RC[-14])&IF(RC[-13]="",,"|n"&R1C20&RC[-13])&IF(RC[-12]="",,"|n"&R1C21&RC[-12])&IF(RC[-10]="",,"|n"&R1C23&RC[-10])&IF(RC[-9]="",,"|n"&R1C24&RC[-9])&IF(RC[-8]="",,"|n"&R1C25&RC[-8])&IF(RC[-7]="",,"|n"&R1C26&RC[-7])&IF(RC[-6]="",,"|n"&R1C27&RC[-6])&IF(RC[-5]="",,"|n"&R1C28&RC[-5])&IF(RC[-2]="",,"|n"&RC[-2]) -> 
AF384: =VLOOKUP(RC[-31],Sheet2!R13C1:R18C2,2,0)&"."&VLOOKUP(RC[-30],Sheet2!R7C1:R11C2,2,0)&VLOOKUP(RC[-30],Sheet2!R1C1:R5C2,2,0)&RC[-29]&RC[-28]&RC[-27]&Sheet2!R1C3 -> #N/A | AG384: =IF(RC[-26]&RC[-25]&RC[-24]&RC[-23]&RC[-22]&RC[-21]="",,R1C6)&IF(RC[-26]="",,"|n"&R1C7&RC[-26])&IF(RC[-25]="",,"|n"&R1C8&RC[-25])&IF(RC[-24]="",,"|n"&R1C9&RC[-24])&IF(RC[-23]="",,"|n"&R1C10&RC[-23])&IF(RC[-22]="",,"|n"&R1C11&RC[-22])&IF(RC[-21]="",,"|n"&R1C12&RC[-21])&IF(RC[-19]&RC[-18]&RC[-17]&RC[-16]="",,"|n"&R1C13)&IF(RC[-19]="",,"|n"&R1C14&RC[-19])&IF(RC[-18]="",,"|n"&R1C15&RC[-18])&IF(RC[-17]="",,"|n"&R1C16&RC[-17])&IF(RC[-16]="",,"|n"&R1C17&RC[-16])&IF(RC[-15]="",,"|n"&R1C18&RC[-15])&IF(RC[-14]="",,"|n"&R1C19&RC[-14])&IF(RC[-13]="",,"|n"&R1C20&RC[-13])&IF(RC[-12]="",,"|n"&R1C21&RC[-12])&IF(RC[-10]="",,"|n"&R1C23&RC[-10])&IF(RC[-9]="",,"|n"&R1C24&RC[-9])&IF(RC[-8]="",,"|n"&R1C25&RC[-8])&IF(RC[-7]="",,"|n"&R1C26&RC[-7])&IF(RC[-6]="",,"|n"&R1C27&RC[-6])&IF(RC[-5]="",,"|n"&R1C28&RC[-5])&IF(RC[-2]="",,"|n"&RC[-2]) -> 
AF385: =VLOOKUP(RC[-31],Sheet2!R13C1:R18C2,2,0)&"."&VLOOKUP(RC[-30],Sheet2!R7C1:R11C2,2,0)&VLOOKUP(RC[-30],Sheet2!R1C1:R5C2,2,0)&RC[-29]&RC[-28]&RC[-27]&Sheet2!R1C3 -> #N/A | AG385: =IF(RC[-26]&RC[-25]&RC[-24]&RC[-23]&RC[-22]&RC[-21]="",,R1C6)&IF(RC[-26]="",,"|n"&R1C7&RC[-26])&IF(RC[-25]="",,"|n"&R1C8&RC[-25])&IF(RC[-24]="",,"|n"&R1C9&RC[-24])&IF(RC[-23]="",,"|n"&R1C10&RC[-23])&IF(RC[-22]="",,"|n"&R1C11&RC[-22])&IF(RC[-21]="",,"|n"&R1C12&RC[-21])&IF(RC[-19]&RC[-18]&RC[-17]&RC[-16]="",,"|n"&R1C13)&IF(RC[-19]="",,"|n"&R1C14&RC[-19])&IF(RC[-18]="",,"|n"&R1C15&RC[-18])&IF(RC[-17]="",,"|n"&R1C16&RC[-17])&IF(RC[-16]="",,"|n"&R1C17&RC[-16])&IF(RC[-15]="",,"|n"&R1C18&RC[-15])&IF(RC[-14]="",,"|n"&R1C19&RC[-14])&IF(RC[-13]="",,"|n"&R1C20&RC[-13])&IF(RC[-12]="",,"|n"&R1C21&RC[-12])&IF(RC[-10]="",,"|n"&R1C23&RC[-10])&IF(RC[-9]="",,"|n"&R1C24&RC[-9])&IF(RC[-8]="",,"|n"&R1C25&RC[-8])&IF(RC[-7]="",,"|n"&R1C26&RC[-7])&IF(RC[-6]="",,"|n"&R1C27&RC[-6])&IF(RC[-5]="",,"|n"&R1C28&RC[-5])&IF(RC[-2]="",,"|n"&RC[-2]) -> 
AF386: =VLOOKUP(RC[-31],Sheet2!R13C1:R18C2,2,0)&"."&VLOOKUP(RC[-30],Sheet2!R7C1:R11C2,2,0)&VLOOKUP(RC[-30],Sheet2!R1C1:R5C2,2,0)&RC[-29]&RC[-28]&RC[-27]&Sheet2!R1C3 -> #N/A | AG386: =IF(RC[-26]&RC[-25]&RC[-24]&RC[-23]&RC[-22]&RC[-21]="",,R1C6)&IF(RC[-26]="",,"|n"&R1C7&RC[-26])&IF(RC[-25]="",,"|n"&R1C8&RC[-25])&IF(RC[-24]="",,"|n"&R1C9&RC[-24])&IF(RC[-23]="",,"|n"&R1C10&RC[-23])&IF(RC[-22]="",,"|n"&R1C11&RC[-22])&IF(RC[-21]="",,"|n"&R1C12&RC[-21])&IF(RC[-19]&RC[-18]&RC[-17]&RC[-16]="",,"|n"&R1C13)&IF(RC[-19]="",,"|n"&R1C14&RC[-19])&IF(RC[-18]="",,"|n"&R1C15&RC[-18])&IF(RC[-17]="",,"|n"&R1C16&RC[-17])&IF(RC[-16]="",,"|n"&R1C17&RC[-16])&IF(RC[-15]="",,"|n"&R1C18&RC[-15])&IF(RC[-14]="",,"|n"&R1C19&RC[-14])&IF(RC[-13]="",,"|n"&R1C20&RC[-13])&IF(RC[-12]="",,"|n"&R1C21&RC[-12])&IF(RC[-10]="",,"|n"&R1C23&RC[-10])&IF(RC[-9]="",,"|n"&R1C24&RC[-9])&IF(RC[-8]="",,"|n"&R1C25&RC[-8])&IF(RC[-7]="",,"|n"&R1C26&RC[-7])&IF(RC[-6]="",,"|n"&R1C27&RC[-6])&IF(RC[-5]="",,"|n"&R1C28&RC[-5])&IF(RC[-2]="",,"|n"&RC[-2]) -> 
AF387: =VLOOKUP(RC[-31],Sheet2!R13C1:R18C2,2,0)&"."&VLOOKUP(RC[-30],Sheet2!R7C1:R11C2,2,0)&VLOOKUP(RC[-30],Sheet2!R1C1:R5C2,2,0)&RC[-29]&RC[-28]&RC[-27]&Sheet2!R1C3 -> #N/A | AG387: =IF(RC[-26]&RC[-25]&RC[-24]&RC[-23]&RC[-22]&RC[-21]="",,R1C6)&IF(RC[-26]="",,"|n"&R1C7&RC[-26])&IF(RC[-25]="",,"|n"&R1C8&RC[-25])&IF(RC[-24]="",,"|n"&R1C9&RC[-24])&IF(RC[-23]="",,"|n"&R1C10&RC[-23])&IF(RC[-22]="",,"|n"&R1C11&RC[-22])&IF(RC[-21]="",,"|n"&R1C12&RC[-21])&IF(RC[-19]&RC[-18]&RC[-17]&RC[-16]="",,"|n"&R1C13)&IF(RC[-19]="",,"|n"&R1C14&RC[-19])&IF(RC[-18]="",,"|n"&R1C15&RC[-18])&IF(RC[-17]="",,"|n"&R1C16&RC[-17])&IF(RC[-16]="",,"|n"&R1C17&RC[-16])&IF(RC[-15]="",,"|n"&R1C18&RC[-15])&IF(RC[-14]="",,"|n"&R1C19&RC[-14])&IF(RC[-13]="",,"|n"&R1C20&RC[-13])&IF(RC[-12]="",,"|n"&R1C21&RC[-12])&IF(RC[-10]="",,"|n"&R1C23&RC[-10])&IF(RC[-9]="",,"|n"&R1C24&RC[-9])&IF(RC[-8]="",,"|n"&R1C25&RC[-8])&IF(RC[-7]="",,"|n"&R1C26&RC[-7])&IF(RC[-6]="",,"|n"&R1C27&RC[-6])&IF(RC[-5]="",,"|n"&R1C28&RC[-5])&IF(RC[-2]="",,"|n"&RC[-2]) -> 
AF388: =VLOOKUP(RC[-31],Sheet2!R13C1:R18C2,2,0)&"."&VLOOKUP(RC[-30],Sheet2!R7C1:R11C2,2,0)&VLOOKUP(RC[-30],Sheet2!R1C1:R5C2,2,0)&RC[-29]&RC[-28]&RC[-27]&Sheet2!R1C3 -> #N/A | AG388: =IF(RC[-26]&RC[-25]&RC[-24]&RC[-23]&RC[-22]&RC[-21]="",,R1C6)&IF(RC[-26]="",,"|n"&R1C7&RC[-26])&IF(RC[-25]="",,"|n"&R1C8&RC[-25])&IF(RC[-24]="",,"|n"&R1C9&RC[-24])&IF(RC[-23]="",,"|n"&R1C10&RC[-23])&IF(RC[-22]="",,"|n"&R1C11&RC[-22])&IF(RC[-21]="",,"|n"&R1C12&RC[-21])&IF(RC[-19]&RC[-18]&RC[-17]&RC[-16]="",,"|n"&R1C13)&IF(RC[-19]="",,"|n"&R1C14&RC[-19])&IF(RC[-18]="",,"|n"&R1C15&RC[-18])&IF(RC[-17]="",,"|n"&R1C16&RC[-17])&IF(RC[-16]="",,"|n"&R1C17&RC[-16])&IF(RC[-15]="",,"|n"&R1C18&RC[-15])&IF(RC[-14]="",,"|n"&R1C19&RC[-14])&IF(RC[-13]="",,"|n"&R1C20&RC[-13])&IF(RC[-12]="",,"|n"&R1C21&RC[-12])&IF(RC[-10]="",,"|n"&R1C23&RC[-10])&IF(RC[-9]="",,"|n"&R1C24&RC[-9])&IF(RC[-8]="",,"|n"&R1C25&RC[-8])&IF(RC[-7]="",,"|n"&R1C26&RC[-7])&IF(RC[-6]="",,"|n"&R1C27&RC[-6])&IF(RC[-5]="",,"|n"&R1C28&RC[-5])&IF(RC[-2]="",,"|n"&RC[-2]) -> 
AF389: =VLOOKUP(RC[-31],Sheet2!R13C1:R18C2,2,0)&"."&VLOOKUP(RC[-30],Sheet2!R7C1:R11C2,2,0)&VLOOKUP(RC[-30],Sheet2!R1C1:R5C2,2,0)&RC[-29]&RC[-28]&RC[-27]&Sheet2!R1C3 -> #N/A | AG389: =IF(RC[-26]&RC[-25]&RC[-24]&RC[-23]&RC[-22]&RC[-21]="",,R1C6)&IF(RC[-26]="",,"|n"&R1C7&RC[-26])&IF(RC[-25]="",,"|n"&R1C8&RC[-25])&IF(RC[-24]="",,"|n"&R1C9&RC[-24])&IF(RC[-23]="",,"|n"&R1C10&RC[-23])&IF(RC[-22]="",,"|n"&R1C11&RC[-22])&IF(RC[-21]="",,"|n"&R1C12&RC[-21])&IF(RC[-19]&RC[-18]&RC[-17]&RC[-16]="",,"|n"&R1C13)&IF(RC[-19]="",,"|n"&R1C14&RC[-19])&IF(RC[-18]="",,"|n"&R1C15&RC[-18])&IF(RC[-17]="",,"|n"&R1C16&RC[-17])&IF(RC[-16]="",,"|n"&R1C17&RC[-16])&IF(RC[-15]="",,"|n"&R1C18&RC[-15])&IF(RC[-14]="",,"|n"&R1C19&RC[-14])&IF(RC[-13]="",,"|n"&R1C20&RC[-13])&IF(RC[-12]="",,"|n"&R1C21&RC[-12])&IF(RC[-10]="",,"|n"&R1C23&RC[-10])&IF(RC[-9]="",,"|n"&R1C24&RC[-9])&IF(RC[-8]="",,"|n"&R1C25&RC[-8])&IF(RC[-7]="",,"|n"&R1C26&RC[-7])&IF(RC[-6]="",,"|n"&R1C27&RC[-6])&IF(RC[-5]="",,"|n"&R1C28&RC[-5])&IF(RC[-2]="",,"|n"&RC[-2]) -> 
AF390: =VLOOKUP(RC[-31],Sheet2!R13C1:R18C2,2,0)&"."&VLOOKUP(RC[-30],Sheet2!R7C1:R11C2,2,0)&VLOOKUP(RC[-30],Sheet2!R1C1:R5C2,2,0)&RC[-29]&RC[-28]&RC[-27]&Sheet2!R1C3 -> #N/A | AG390: =IF(RC[-26]&RC[-25]&RC[-24]&RC[-23]&RC[-22]&RC[-21]="",,R1C6)&IF(RC[-26]="",,"|n"&R1C7&RC[-26])&IF(RC[-25]="",,"|n"&R1C8&RC[-25])&IF(RC[-24]="",,"|n"&R1C9&RC[-24])&IF(RC[-23]="",,"|n"&R1C10&RC[-23])&IF(RC[-22]="",,"|n"&R1C11&RC[-22])&IF(RC[-21]="",,"|n"&R1C12&RC[-21])&IF(RC[-19]&RC[-18]&RC[-17]&RC[-16]="",,"|n"&R1C13)&IF(RC[-19]="",,"|n"&R1C14&RC[-19])&IF(RC[-18]="",,"|n"&R1C15&RC[-18])&IF(RC[-17]="",,"|n"&R1C16&RC[-17])&IF(RC[-16]="",,"|n"&R1C17&RC[-16])&IF(RC[-15]="",,"|n"&R1C18&RC[-15])&IF(RC[-14]="",,"|n"&R1C19&RC[-14])&IF(RC[-13]="",,"|n"&R1C20&RC[-13])&IF(RC[-12]="",,"|n"&R1C21&RC[-12])&IF(RC[-10]="",,"|n"&R1C23&RC[-10])&IF(RC[-9]="",,"|n"&R1C24&RC[-9])&IF(RC[-8]="",,"|n"&R1C25&RC[-8])&IF(RC[-7]="",,"|n"&R1C26&RC[-7])&IF(RC[-6]="",,"|n"&R1C27&RC[-6])&IF(RC[-5]="",,"|n"&R1C28&RC[-5])&IF(RC[-2]="",,"|n"&RC[-2]) -> 
AF391: =VLOOKUP(RC[-31],Sheet2!R13C1:R18C2,2,0)&"."&VLOOKUP(RC[-30],Sheet2!R7C1:R11C2,2,0)&VLOOKUP(RC[-30],Sheet2!R1C1:R5C2,2,0)&RC[-29]&RC[-28]&RC[-27]&Sheet2!R1C3 -> #N/A | AG391: =IF(RC[-26]&RC[-25]&RC[-24]&RC[-23]&RC[-22]&RC[-21]="",,R1C6)&IF(RC[-26]="",,"|n"&R1C7&RC[-26])&IF(RC[-25]="",,"|n"&R1C8&RC[-25])&IF(RC[-24]="",,"|n"&R1C9&RC[-24])&IF(RC[-23]="",,"|n"&R1C10&RC[-23])&IF(RC[-22]="",,"|n"&R1C11&RC[-22])&IF(RC[-21]="",,"|n"&R1C12&RC[-21])&IF(RC[-19]&RC[-18]&RC[-17]&RC[-16]="",,"|n"&R1C13)&IF(RC[-19]="",,"|n"&R1C14&RC[-19])&IF(RC[-18]="",,"|n"&R1C15&RC[-18])&IF(RC[-17]="",,"|n"&R1C16&RC[-17])&IF(RC[-16]="",,"|n"&R1C17&RC[-16])&IF(RC[-15]="",,"|n"&R1C18&RC[-15])&IF(RC[-14]="",,"|n"&R1C19&RC[-14])&IF(RC[-13]="",,"|n"&R1C20&RC[-13])&IF(RC[-12]="",,"|n"&R1C21&RC[-12])&IF(RC[-10]="",,"|n"&R1C23&RC[-10])&IF(RC[-9]="",,"|n"&R1C24&RC[-9])&IF(RC[-8]="",,"|n"&R1C25&RC[-8])&IF(RC[-7]="",,"|n"&R1C26&RC[-7])&IF(RC[-6]="",,"|n"&R1C27&RC[-6])&IF(RC[-5]="",,"|n"&R1C28&RC[-5])&IF(RC[-2]="",,"|n"&RC[-2]) -> 
AF392: =VLOOKUP(RC[-31],Sheet2!R13C1:R18C2,2,0)&"."&VLOOKUP(RC[-30],Sheet2!R7C1:R11C2,2,0)&VLOOKUP(RC[-30],Sheet2!R1C1:R5C2,2,0)&RC[-29]&RC[-28]&RC[-27]&Sheet2!R1C3 -> #N/A | AG392: =IF(RC[-26]&RC[-25]&RC[-24]&RC[-23]&RC[-22]&RC[-21]="",,R1C6)&IF(RC[-26]="",,"|n"&R1C7&RC[-26])&IF(RC[-25]="",,"|n"&R1C8&RC[-25])&IF(RC[-24]="",,"|n"&R1C9&RC[-24])&IF(RC[-23]="",,"|n"&R1C10&RC[-23])&IF(RC[-22]="",,"|n"&R1C11&RC[-22])&IF(RC[-21]="",,"|n"&R1C12&RC[-21])&IF(RC[-19]&RC[-18]&RC[-17]&RC[-16]="",,"|n"&R1C13)&IF(RC[-19]="",,"|n"&R1C14&RC[-19])&IF(RC[-18]="",,"|n"&R1C15&RC[-18])&IF(RC[-17]="",,"|n"&R1C16&RC[-17])&IF(RC[-16]="",,"|n"&R1C17&RC[-16])&IF(RC[-15]="",,"|n"&R1C18&RC[-15])&IF(RC[-14]="",,"|n"&R1C19&RC[-14])&IF(RC[-13]="",,"|n"&R1C20&RC[-13])&IF(RC[-12]="",,"|n"&R1C21&RC[-12])&IF(RC[-10]="",,"|n"&R1C23&RC[-10])&IF(RC[-9]="",,"|n"&R1C24&RC[-9])&IF(RC[-8]="",,"|n"&R1C25&RC[-8])&IF(RC[-7]="",,"|n"&R1C26&RC[-7])&IF(RC[-6]="",,"|n"&R1C27&RC[-6])&IF(RC[-5]="",,"|n"&R1C28&RC[-5])&IF(RC[-2]="",,"|n"&RC[-2]) -> 
AF393: =VLOOKUP(RC[-31],Sheet2!R13C1:R18C2,2,0)&"."&VLOOKUP(RC[-30],Sheet2!R7C1:R11C2,2,0)&VLOOKUP(RC[-30],Sheet2!R1C1:R5C2,2,0)&RC[-29]&RC[-28]&RC[-27]&Sheet2!R1C3 -> #N/A | AG393: =IF(RC[-26]&RC[-25]&RC[-24]&RC[-23]&RC[-22]&RC[-21]="",,R1C6)&IF(RC[-26]="",,"|n"&R1C7&RC[-26])&IF(RC[-25]="",,"|n"&R1C8&RC[-25])&IF(RC[-24]="",,"|n"&R1C9&RC[-24])&IF(RC[-23]="",,"|n"&R1C10&RC[-23])&IF(RC[-22]="",,"|n"&R1C11&RC[-22])&IF(RC[-21]="",,"|n"&R1C12&RC[-21])&IF(RC[-19]&RC[-18]&RC[-17]&RC[-16]="",,"|n"&R1C13)&IF(RC[-19]="",,"|n"&R1C14&RC[-19])&IF(RC[-18]="",,"|n"&R1C15&RC[-18])&IF(RC[-17]="",,"|n"&R1C16&RC[-17])&IF(RC[-16]="",,"|n"&R1C17&RC[-16])&IF(RC[-15]="",,"|n"&R1C18&RC[-15])&IF(RC[-14]="",,"|n"&R1C19&RC[-14])&IF(RC[-13]="",,"|n"&R1C20&RC[-13])&IF(RC[-12]="",,"|n"&R1C21&RC[-12])&IF(RC[-10]="",,"|n"&R1C23&RC[-10])&IF(RC[-9]="",,"|n"&R1C24&RC[-9])&IF(RC[-8]="",,"|n"&R1C25&RC[-8])&IF(RC[-7]="",,"|n"&R1C26&RC[-7])&IF(RC[-6]="",,"|n"&R1C27&RC[-6])&IF(RC[-5]="",,"|n"&R1C28&RC[-5])&IF(RC[-2]="",,"|n"&RC[-2]) -> 
AF394: =VLOOKUP(RC[-31],Sheet2!R13C1:R18C2,2,0)&"."&VLOOKUP(RC[-30],Sheet2!R7C1:R11C2,2,0)&VLOOKUP(RC[-30],Sheet2!R1C1:R5C2,2,0)&RC[-29]&RC[-28]&RC[-27]&Sheet2!R1C3 -> #N/A | AG394: =IF(RC[-26]&RC[-25]&RC[-24]&RC[-23]&RC[-22]&RC[-21]="",,R1C6)&IF(RC[-26]="",,"|n"&R1C7&RC[-26])&IF(RC[-25]="",,"|n"&R1C8&RC[-25])&IF(RC[-24]="",,"|n"&R1C9&RC[-24])&IF(RC[-23]="",,"|n"&R1C10&RC[-23])&IF(RC[-22]="",,"|n"&R1C11&RC[-22])&IF(RC[-21]="",,"|n"&R1C12&RC[-21])&IF(RC[-19]&RC[-18]&RC[-17]&RC[-16]="",,"|n"&R1C13)&IF(RC[-19]="",,"|n"&R1C14&RC[-19])&IF(RC[-18]="",,"|n"&R1C15&RC[-18])&IF(RC[-17]="",,"|n"&R1C16&RC[-17])&IF(RC[-16]="",,"|n"&R1C17&RC[-16])&IF(RC[-15]="",,"|n"&R1C18&RC[-15])&IF(RC[-14]="",,"|n"&R1C19&RC[-14])&IF(RC[-13]="",,"|n"&R1C20&RC[-13])&IF(RC[-12]="",,"|n"&R1C21&RC[-12])&IF(RC[-10]="",,"|n"&R1C23&RC[-10])&IF(RC[-9]="",,"|n"&R1C24&RC[-9])&IF(RC[-8]="",,"|n"&R1C25&RC[-8])&IF(RC[-7]="",,"|n"&R1C26&RC[-7])&IF(RC[-6]="",,"|n"&R1C27&RC[-6])&IF(RC[-5]="",,"|n"&R1C28&RC[-5])&IF(RC[-2]="",,"|n"&RC[-2]) -> 
AF395: =VLOOKUP(RC[-31],Sheet2!R13C1:R18C2,2,0)&"."&VLOOKUP(RC[-30],Sheet2!R7C1:R11C2,2,0)&VLOOKUP(RC[-30],Sheet2!R1C1:R5C2,2,0)&RC[-29]&RC[-28]&RC[-27]&Sheet2!R1C3 -> #N/A | AG395: =IF(RC[-26]&RC[-25]&RC[-24]&RC[-23]&RC[-22]&RC[-21]="",,R1C6)&IF(RC[-26]="",,"|n"&R1C7&RC[-26])&IF(RC[-25]="",,"|n"&R1C8&RC[-25])&IF(RC[-24]="",,"|n"&R1C9&RC[-24])&IF(RC[-23]="",,"|n"&R1C10&RC[-23])&IF(RC[-22]="",,"|n"&R1C11&RC[-22])&IF(RC[-21]="",,"|n"&R1C12&RC[-21])&IF(RC[-19]&RC[-18]&RC[-17]&RC[-16]="",,"|n"&R1C13)&IF(RC[-19]="",,"|n"&R1C14&RC[-19])&IF(RC[-18]="",,"|n"&R1C15&RC[-18])&IF(RC[-17]="",,"|n"&R1C16&RC[-17])&IF(RC[-16]="",,"|n"&R1C17&RC[-16])&IF(RC[-15]="",,"|n"&R1C18&RC[-15])&IF(RC[-14]="",,"|n"&R1C19&RC[-14])&IF(RC[-13]="",,"|n"&R1C20&RC[-13])&IF(RC[-12]="",,"|n"&R1C21&RC[-12])&IF(RC[-10]="",,"|n"&R1C23&RC[-10])&IF(RC[-9]="",,"|n"&R1C24&RC[-9])&IF(RC[-8]="",,"|n"&R1C25&RC[-8])&IF(RC[-7]="",,"|n"&R1C26&RC[-7])&IF(RC[-6]="",,"|n"&R1C27&RC[-6])&IF(RC[-5]="",,"|n"&R1C28&RC[-5])&IF(RC[-2]="",,"|n"&RC[-2]) -> 
AF396: =VLOOKUP(RC[-31],Sheet2!R13C1:R18C2,2,0)&"."&VLOOKUP(RC[-30],Sheet2!R7C1:R11C2,2,0)&VLOOKUP(RC[-30],Sheet2!R1C1:R5C2,2,0)&RC[-29]&RC[-28]&RC[-27]&Sheet2!R1C3 -> #N/A | AG396: =IF(RC[-26]&RC[-25]&RC[-24]&RC[-23]&RC[-22]&RC[-21]="",,R1C6)&IF(RC[-26]="",,"|n"&R1C7&RC[-26])&IF(RC[-25]="",,"|n"&R1C8&RC[-25])&IF(RC[-24]="",,"|n"&R1C9&RC[-24])&IF(RC[-23]="",,"|n"&R1C10&RC[-23])&IF(RC[-22]="",,"|n"&R1C11&RC[-22])&IF(RC[-21]="",,"|n"&R1C12&RC[-21])&IF(RC[-19]&RC[-18]&RC[-17]&RC[-16]="",,"|n"&R1C13)&IF(RC[-19]="",,"|n"&R1C14&RC[-19])&IF(RC[-18]="",,"|n"&R1C15&RC[-18])&IF(RC[-17]="",,"|n"&R1C16&RC[-17])&IF(RC[-16]="",,"|n"&R1C17&RC[-16])&IF(RC[-15]="",,"|n"&R1C18&RC[-15])&IF(RC[-14]="",,"|n"&R1C19&RC[-14])&IF(RC[-13]="",,"|n"&R1C20&RC[-13])&IF(RC[-12]="",,"|n"&R1C21&RC[-12])&IF(RC[-10]="",,"|n"&R1C23&RC[-10])&IF(RC[-9]="",,"|n"&R1C24&RC[-9])&IF(RC[-8]="",,"|n"&R1C25&RC[-8])&IF(RC[-7]="",,"|n"&R1C26&RC[-7])&IF(RC[-6]="",,"|n"&R1C27&RC[-6])&IF(RC[-5]="",,"|n"&R1C28&RC[-5])&IF(RC[-2]="",,"|n"&RC[-2]) -> 
AF397: =VLOOKUP(RC[-31],Sheet2!R13C1:R18C2,2,0)&"."&VLOOKUP(RC[-30],Sheet2!R7C1:R11C2,2,0)&VLOOKUP(RC[-30],Sheet2!R1C1:R5C2,2,0)&RC[-29]&RC[-28]&RC[-27]&Sheet2!R1C3 -> #N/A | AG397: =IF(RC[-26]&RC[-25]&RC[-24]&RC[-23]&RC[-22]&RC[-21]="",,R1C6)&IF(RC[-26]="",,"|n"&R1C7&RC[-26])&IF(RC[-25]="",,"|n"&R1C8&RC[-25])&IF(RC[-24]="",,"|n"&R1C9&RC[-24])&IF(RC[-23]="",,"|n"&R1C10&RC[-23])&IF(RC[-22]="",,"|n"&R1C11&RC[-22])&IF(RC[-21]="",,"|n"&R1C12&RC[-21])&IF(RC[-19]&RC[-18]&RC[-17]&RC[-16]="",,"|n"&R1C13)&IF(RC[-19]="",,"|n"&R1C14&RC[-19])&IF(RC[-18]="",,"|n"&R1C15&RC[-18])&IF(RC[-17]="",,"|n"&R1C16&RC[-17])&IF(RC[-16]="",,"|n"&R1C17&RC[-16])&IF(RC[-15]="",,"|n"&R1C18&RC[-15])&IF(RC[-14]="",,"|n"&R1C19&RC[-14])&IF(RC[-13]="",,"|n"&R1C20&RC[-13])&IF(RC[-12]="",,"|n"&R1C21&RC[-12])&IF(RC[-10]="",,"|n"&R1C23&RC[-10])&IF(RC[-9]="",,"|n"&R1C24&RC[-9])&IF(RC[-8]="",,"|n"&R1C25&RC[-8])&IF(RC[-7]="",,"|n"&R1C26&RC[-7])&IF(RC[-6]="",,"|n"&R1C27&RC[-6])&IF(RC[-5]="",,"|n"&R1C28&RC[-5])&IF(RC[-2]="",,"|n"&RC[-2]) -> 
AF398: =VLOOKUP(RC[-31],Sheet2!R13C1:R18C2,2,0)&"."&VLOOKUP(RC[-30],Sheet2!R7C1:R11C2,2,0)&VLOOKUP(RC[-30],Sheet2!R1C1:R5C2,2,0)&RC[-29]&RC[-28]&RC[-27]&Sheet2!R1C3 -> #N/A | AG398: =IF(RC[-26]&RC[-25]&RC[-24]&RC[-23]&RC[-22]&RC[-21]="",,R1C6)&IF(RC[-26]="",,"|n"&R1C7&RC[-26])&IF(RC[-25]="",,"|n"&R1C8&RC[-25])&IF(RC[-24]="",,"|n"&R1C9&RC[-24])&IF(RC[-23]="",,"|n"&R1C10&RC[-23])&IF(RC[-22]="",,"|n"&R1C11&RC[-22])&IF(RC[-21]="",,"|n"&R1C12&RC[-21])&IF(RC[-19]&RC[-18]&RC[-17]&RC[-16]="",,"|n"&R1C13)&IF(RC[-19]="",,"|n"&R1C14&RC[-19])&IF(RC[-18]="",,"|n"&R1C15&RC[-18])&IF(RC[-17]="",,"|n"&R1C16&RC[-17])&IF(RC[-16]="",,"|n"&R1C17&RC[-16])&IF(RC[-15]="",,"|n"&R1C18&RC[-15])&IF(RC[-14]="",,"|n"&R1C19&RC[-14])&IF(RC[-13]="",,"|n"&R1C20&RC[-13])&IF(RC[-12]="",,"|n"&R1C21&RC[-12])&IF(RC[-10]="",,"|n"&R1C23&RC[-10])&IF(RC[-9]="",,"|n"&R1C24&RC[-9])&IF(RC[-8]="",,"|n"&R1C25&RC[-8])&IF(RC[-7]="",,"|n"&R1C26&RC[-7])&IF(RC[-6]="",,"|n"&R1C27&RC[-6])&IF(RC[-5]="",,"|n"&R1C28&RC[-5])&IF(RC[-2]="",,"|n"&RC[-2]) -> 
AF399: =VLOOKUP(RC[-31],Sheet2!R13C1:R18C2,2,0)&"."&VLOOKUP(RC[-30],Sheet2!R7C1:R11C2,2,0)&VLOOKUP(RC[-30],Sheet2!R1C1:R5C2,2,0)&RC[-29]&RC[-28]&RC[-27]&Sheet2!R1C3 -> #N/A | AG399: =IF(RC[-26]&RC[-25]&RC[-24]&RC[-23]&RC[-22]&RC[-21]="",,R1C6)&IF(RC[-26]="",,"|n"&R1C7&RC[-26])&IF(RC[-25]="",,"|n"&R1C8&RC[-25])&IF(RC[-24]="",,"|n"&R1C9&RC[-24])&IF(RC[-23]="",,"|n"&R1C10&RC[-23])&IF(RC[-22]="",,"|n"&R1C11&RC[-22])&IF(RC[-21]="",,"|n"&R1C12&RC[-21])&IF(RC[-19]&RC[-18]&RC[-17]&RC[-16]="",,"|n"&R1C13)&IF(RC[-19]="",,"|n"&R1C14&RC[-19])&IF(RC[-18]="",,"|n"&R1C15&RC[-18])&IF(RC[-17]="",,"|n"&R1C16&RC[-17])&IF(RC[-16]="",,"|n"&R1C17&RC[-16])&IF(RC[-15]="",,"|n"&R1C18&RC[-15])&IF(RC[-14]="",,"|n"&R1C19&RC[-14])&IF(RC[-13]="",,"|n"&R1C20&RC[-13])&IF(RC[-12]="",,"|n"&R1C21&RC[-12])&IF(RC[-10]="",,"|n"&R1C23&RC[-10])&IF(RC[-9]="",,"|n"&R1C24&RC[-9])&IF(RC[-8]="",,"|n"&R1C25&RC[-8])&IF(RC[-7]="",,"|n"&R1C26&RC[-7])&IF(RC[-6]="",,"|n"&R1C27&RC[-6])&IF(RC[-5]="",,"|n"&R1C28&RC[-5])&IF(RC[-2]="",,"|n"&RC[-2]) -> 
AF400: =VLOOKUP(RC[-31],Sheet2!R13C1:R18C2,2,0)&"."&VLOOKUP(RC[-30],Sheet2!R7C1:R11C2,2,0)&VLOOKUP(RC[-30],Sheet2!R1C1:R5C2,2,0)&RC[-29]&RC[-28]&RC[-27]&Sheet2!R1C3 -> #N/A | AG400: =IF(RC[-26]&RC[-25]&RC[-24]&RC[-23]&RC[-22]&RC[-21]="",,R1C6)&IF(RC[-26]="",,"|n"&R1C7&RC[-26])&IF(RC[-25]="",,"|n"&R1C8&RC[-25])&IF(RC[-24]="",,"|n"&R1C9&RC[-24])&IF(RC[-23]="",,"|n"&R1C10&RC[-23])&IF(RC[-22]="",,"|n"&R1C11&RC[-22])&IF(RC[-21]="",,"|n"&R1C12&RC[-21])&IF(RC[-19]&RC[-18]&RC[-17]&RC[-16]="",,"|n"&R1C13)&IF(RC[-19]="",,"|n"&R1C14&RC[-19])&IF(RC[-18]="",,"|n"&R1C15&RC[-18])&IF(RC[-17]="",,"|n"&R1C16&RC[-17])&IF(RC[-16]="",,"|n"&R1C17&RC[-16])&IF(RC[-15]="",,"|n"&R1C18&RC[-15])&IF(RC[-14]="",,"|n"&R1C19&RC[-14])&IF(RC[-13]="",,"|n"&R1C20&RC[-13])&IF(RC[-12]="",,"|n"&R1C21&RC[-12])&IF(RC[-10]="",,"|n"&R1C23&RC[-10])&IF(RC[-9]="",,"|n"&R1C24&RC[-9])&IF(RC[-8]="",,"|n"&R1C25&RC[-8])&IF(RC[-7]="",,"|n"&R1C26&RC[-7])&IF(RC[-6]="",,"|n"&R1C27&RC[-6])&IF(RC[-5]="",,"|n"&R1C28&RC[-5])&IF(RC[-2]="",,"|n"&RC[-2]) -> 
AF401: =VLOOKUP(RC[-31],Sheet2!R13C1:R18C2,2,0)&"."&VLOOKUP(RC[-30],Sheet2!R7C1:R11C2,2,0)&VLOOKUP(RC[-30],Sheet2!R1C1:R5C2,2,0)&RC[-29]&RC[-28]&RC[-27]&Sheet2!R1C3 -> #N/A | AG401: =IF(RC[-26]&RC[-25]&RC[-24]&RC[-23]&RC[-22]&RC[-21]="",,R1C6)&IF(RC[-26]="",,"|n"&R1C7&RC[-26])&IF(RC[-25]="",,"|n"&R1C8&RC[-25])&IF(RC[-24]="",,"|n"&R1C9&RC[-24])&IF(RC[-23]="",,"|n"&R1C10&RC[-23])&IF(RC[-22]="",,"|n"&R1C11&RC[-22])&IF(RC[-21]="",,"|n"&R1C12&RC[-21])&IF(RC[-19]&RC[-18]&RC[-17]&RC[-16]="",,"|n"&R1C13)&IF(RC[-19]="",,"|n"&R1C14&RC[-19])&IF(RC[-18]="",,"|n"&R1C15&RC[-18])&IF(RC[-17]="",,"|n"&R1C16&RC[-17])&IF(RC[-16]="",,"|n"&R1C17&RC[-16])&IF(RC[-15]="",,"|n"&R1C18&RC[-15])&IF(RC[-14]="",,"|n"&R1C19&RC[-14])&IF(RC[-13]="",,"|n"&R1C20&RC[-13])&IF(RC[-12]="",,"|n"&R1C21&RC[-12])&IF(RC[-10]="",,"|n"&R1C23&RC[-10])&IF(RC[-9]="",,"|n"&R1C24&RC[-9])&IF(RC[-8]="",,"|n"&R1C25&RC[-8])&IF(RC[-7]="",,"|n"&R1C26&RC[-7])&IF(RC[-6]="",,"|n"&R1C27&RC[-6])&IF(RC[-5]="",,"|n"&R1C28&RC[-5])&IF(RC[-2]="",,"|n"&RC[-2]) -> 
AF402: =VLOOKUP(RC[-31],Sheet2!R13C1:R18C2,2,0)&"."&VLOOKUP(RC[-30],Sheet2!R7C1:R11C2,2,0)&VLOOKUP(RC[-30],Sheet2!R1C1:R5C2,2,0)&RC[-29]&RC[-28]&RC[-27]&Sheet2!R1C3 -> #N/A | AG402: =IF(RC[-26]&RC[-25]&RC[-24]&RC[-23]&RC[-22]&RC[-21]="",,R1C6)&IF(RC[-26]="",,"|n"&R1C7&RC[-26])&IF(RC[-25]="",,"|n"&R1C8&RC[-25])&IF(RC[-24]="",,"|n"&R1C9&RC[-24])&IF(RC[-23]="",,"|n"&R1C10&RC[-23])&IF(RC[-22]="",,"|n"&R1C11&RC[-22])&IF(RC[-21]="",,"|n"&R1C12&RC[-21])&IF(RC[-19]&RC[-18]&RC[-17]&RC[-16]="",,"|n"&R1C13)&IF(RC[-19]="",,"|n"&R1C14&RC[-19])&IF(RC[-18]="",,"|n"&R1C15&RC[-18])&IF(RC[-17]="",,"|n"&R1C16&RC[-17])&IF(RC[-16]="",,"|n"&R1C17&RC[-16])&IF(RC[-15]="",,"|n"&R1C18&RC[-15])&IF(RC[-14]="",,"|n"&R1C19&RC[-14])&IF(RC[-13]="",,"|n"&R1C20&RC[-13])&IF(RC[-12]="",,"|n"&R1C21&RC[-12])&IF(RC[-10]="",,"|n"&R1C23&RC[-10])&IF(RC[-9]="",,"|n"&R1C24&RC[-9])&IF(RC[-8]="",,"|n"&R1C25&RC[-8])&IF(RC[-7]="",,"|n"&R1C26&RC[-7])&IF(RC[-6]="",,"|n"&R1C27&RC[-6])&IF(RC[-5]="",,"|n"&R1C28&RC[-5])&IF(RC[-2]="",,"|n"&RC[-2]) -> 
AF403: =VLOOKUP(RC[-31],Sheet2!R13C1:R18C2,2,0)&"."&VLOOKUP(RC[-30],Sheet2!R7C1:R11C2,2,0)&VLOOKUP(RC[-30],Sheet2!R1C1:R5C2,2,0)&RC[-29]&RC[-28]&RC[-27]&Sheet2!R1C3 -> #N/A | AG403: =IF(RC[-26]&RC[-25]&RC[-24]&RC[-23]&RC[-22]&RC[-21]="",,R1C6)&IF(RC[-26]="",,"|n"&R1C7&RC[-26])&IF(RC[-25]="",,"|n"&R1C8&RC[-25])&IF(RC[-24]="",,"|n"&R1C9&RC[-24])&IF(RC[-23]="",,"|n"&R1C10&RC[-23])&IF(RC[-22]="",,"|n"&R1C11&RC[-22])&IF(RC[-21]="",,"|n"&R1C12&RC[-21])&IF(RC[-19]&RC[-18]&RC[-17]&RC[-16]="",,"|n"&R1C13)&IF(RC[-19]="",,"|n"&R1C14&RC[-19])&IF(RC[-18]="",,"|n"&R1C15&RC[-18])&IF(RC[-17]="",,"|n"&R1C16&RC[-17])&IF(RC[-16]="",,"|n"&R1C17&RC[-16])&IF(RC[-15]="",,"|n"&R1C18&RC[-15])&IF(RC[-14]="",,"|n"&R1C19&RC[-14])&IF(RC[-13]="",,"|n"&R1C20&RC[-13])&IF(RC[-12]="",,"|n"&R1C21&RC[-12])&IF(RC[-10]="",,"|n"&R1C23&RC[-10])&IF(RC[-9]="",,"|n"&R1C24&RC[-9])&IF(RC[-8]="",,"|n"&R1C25&RC[-8])&IF(RC[-7]="",,"|n"&R1C26&RC[-7])&IF(RC[-6]="",,"|n"&R1C27&RC[-6])&IF(RC[-5]="",,"|n"&R1C28&RC[-5])&IF(RC[-2]="",,"|n"&RC[-2]) -> 
AF404: =VLOOKUP(RC[-31],Sheet2!R13C1:R18C2,2,0)&"."&VLOOKUP(RC[-30],Sheet2!R7C1:R11C2,2,0)&VLOOKUP(RC[-30],Sheet2!R1C1:R5C2,2,0)&RC[-29]&RC[-28]&RC[-27]&Sheet2!R1C3 -> #N/A | AG404: =IF(RC[-26]&RC[-25]&RC[-24]&RC[-23]&RC[-22]&RC[-21]="",,R1C6)&IF(RC[-26]="",,"|n"&R1C7&RC[-26])&IF(RC[-25]="",,"|n"&R1C8&RC[-25])&IF(RC[-24]="",,"|n"&R1C9&RC[-24])&IF(RC[-23]="",,"|n"&R1C10&RC[-23])&IF(RC[-22]="",,"|n"&R1C11&RC[-22])&IF(RC[-21]="",,"|n"&R1C12&RC[-21])&IF(RC[-19]&RC[-18]&RC[-17]&RC[-16]="",,"|n"&R1C13)&IF(RC[-19]="",,"|n"&R1C14&RC[-19])&IF(RC[-18]="",,"|n"&R1C15&RC[-18])&IF(RC[-17]="",,"|n"&R1C16&RC[-17])&IF(RC[-16]="",,"|n"&R1C17&RC[-16])&IF(RC[-15]="",,"|n"&R1C18&RC[-15])&IF(RC[-14]="",,"|n"&R1C19&RC[-14])&IF(RC[-13]="",,"|n"&R1C20&RC[-13])&IF(RC[-12]="",,"|n"&R1C21&RC[-12])&IF(RC[-10]="",,"|n"&R1C23&RC[-10])&IF(RC[-9]="",,"|n"&R1C24&RC[-9])&IF(RC[-8]="",,"|n"&R1C25&RC[-8])&IF(RC[-7]="",,"|n"&R1C26&RC[-7])&IF(RC[-6]="",,"|n"&R1C27&RC[-6])&IF(RC[-5]="",,"|n"&R1C28&RC[-5])&IF(RC[-2]="",,"|n"&RC[-2]) -> 
AF405: =VLOOKUP(RC[-31],Sheet2!R13C1:R18C2,2,0)&"."&VLOOKUP(RC[-30],Sheet2!R7C1:R11C2,2,0)&VLOOKUP(RC[-30],Sheet2!R1C1:R5C2,2,0)&RC[-29]&RC[-28]&RC[-27]&Sheet2!R1C3 -> #N/A | AG405: =IF(RC[-26]&RC[-25]&RC[-24]&RC[-23]&RC[-22]&RC[-21]="",,R1C6)&IF(RC[-26]="",,"|n"&R1C7&RC[-26])&IF(RC[-25]="",,"|n"&R1C8&RC[-25])&IF(RC[-24]="",,"|n"&R1C9&RC[-24])&IF(RC[-23]="",,"|n"&R1C10&RC[-23])&IF(RC[-22]="",,"|n"&R1C11&RC[-22])&IF(RC[-21]="",,"|n"&R1C12&RC[-21])&IF(RC[-19]&RC[-18]&RC[-17]&RC[-16]="",,"|n"&R1C13)&IF(RC[-19]="",,"|n"&R1C14&RC[-19])&IF(RC[-18]="",,"|n"&R1C15&RC[-18])&IF(RC[-17]="",,"|n"&R1C16&RC[-17])&IF(RC[-16]="",,"|n"&R1C17&RC[-16])&IF(RC[-15]="",,"|n"&R1C18&RC[-15])&IF(RC[-14]="",,"|n"&R1C19&RC[-14])&IF(RC[-13]="",,"|n"&R1C20&RC[-13])&IF(RC[-12]="",,"|n"&R1C21&RC[-12])&IF(RC[-10]="",,"|n"&R1C23&RC[-10])&IF(RC[-9]="",,"|n"&R1C24&RC[-9])&IF(RC[-8]="",,"|n"&R1C25&RC[-8])&IF(RC[-7]="",,"|n"&R1C26&RC[-7])&IF(RC[-6]="",,"|n"&R1C27&RC[-6])&IF(RC[-5]="",,"|n"&R1C28&RC[-5])&IF(RC[-2]="",,"|n"&RC[-2]) -> 
AF406: =VLOOKUP(RC[-31],Sheet2!R13C1:R18C2,2,0)&"."&VLOOKUP(RC[-30],Sheet2!R7C1:R11C2,2,0)&VLOOKUP(RC[-30],Sheet2!R1C1:R5C2,2,0)&RC[-29]&RC[-28]&RC[-27]&Sheet2!R1C3 -> #N/A | AG406: =IF(RC[-26]&RC[-25]&RC[-24]&RC[-23]&RC[-22]&RC[-21]="",,R1C6)&IF(RC[-26]="",,"|n"&R1C7&RC[-26])&IF(RC[-25]="",,"|n"&R1C8&RC[-25])&IF(RC[-24]="",,"|n"&R1C9&RC[-24])&IF(RC[-23]="",,"|n"&R1C10&RC[-23])&IF(RC[-22]="",,"|n"&R1C11&RC[-22])&IF(RC[-21]="",,"|n"&R1C12&RC[-21])&IF(RC[-19]&RC[-18]&RC[-17]&RC[-16]="",,"|n"&R1C13)&IF(RC[-19]="",,"|n"&R1C14&RC[-19])&IF(RC[-18]="",,"|n"&R1C15&RC[-18])&IF(RC[-17]="",,"|n"&R1C16&RC[-17])&IF(RC[-16]="",,"|n"&R1C17&RC[-16])&IF(RC[-15]="",,"|n"&R1C18&RC[-15])&IF(RC[-14]="",,"|n"&R1C19&RC[-14])&IF(RC[-13]="",,"|n"&R1C20&RC[-13])&IF(RC[-12]="",,"|n"&R1C21&RC[-12])&IF(RC[-10]="",,"|n"&R1C23&RC[-10])&IF(RC[-9]="",,"|n"&R1C24&RC[-9])&IF(RC[-8]="",,"|n"&R1C25&RC[-8])&IF(RC[-7]="",,"|n"&R1C26&RC[-7])&IF(RC[-6]="",,"|n"&R1C27&RC[-6])&IF(RC[-5]="",,"|n"&R1C28&RC[-5])&IF(RC[-2]="",,"|n"&RC[-2]) -> 
AF407: =VLOOKUP(RC[-31],Sheet2!R13C1:R18C2,2,0)&"."&VLOOKUP(RC[-30],Sheet2!R7C1:R11C2,2,0)&VLOOKUP(RC[-30],Sheet2!R1C1:R5C2,2,0)&RC[-29]&RC[-28]&RC[-27]&Sheet2!R1C3 -> #N/A | AG407: =IF(RC[-26]&RC[-25]&RC[-24]&RC[-23]&RC[-22]&RC[-21]="",,R1C6)&IF(RC[-26]="",,"|n"&R1C7&RC[-26])&IF(RC[-25]="",,"|n"&R1C8&RC[-25])&IF(RC[-24]="",,"|n"&R1C9&RC[-24])&IF(RC[-23]="",,"|n"&R1C10&RC[-23])&IF(RC[-22]="",,"|n"&R1C11&RC[-22])&IF(RC[-21]="",,"|n"&R1C12&RC[-21])&IF(RC[-19]&RC[-18]&RC[-17]&RC[-16]="",,"|n"&R1C13)&IF(RC[-19]="",,"|n"&R1C14&RC[-19])&IF(RC[-18]="",,"|n"&R1C15&RC[-18])&IF(RC[-17]="",,"|n"&R1C16&RC[-17])&IF(RC[-16]="",,"|n"&R1C17&RC[-16])&IF(RC[-15]="",,"|n"&R1C18&RC[-15])&IF(RC[-14]="",,"|n"&R1C19&RC[-14])&IF(RC[-13]="",,"|n"&R1C20&RC[-13])&IF(RC[-12]="",,"|n"&R1C21&RC[-12])&IF(RC[-10]="",,"|n"&R1C23&RC[-10])&IF(RC[-9]="",,"|n"&R1C24&RC[-9])&IF(RC[-8]="",,"|n"&R1C25&RC[-8])&IF(RC[-7]="",,"|n"&R1C26&RC[-7])&IF(RC[-6]="",,"|n"&R1C27&RC[-6])&IF(RC[-5]="",,"|n"&R1C28&RC[-5])&IF(RC[-2]="",,"|n"&RC[-2]) -> 
AF408: =VLOOKUP(RC[-31],Sheet2!R13C1:R18C2,2,0)&"."&VLOOKUP(RC[-30],Sheet2!R7C1:R11C2,2,0)&VLOOKUP(RC[-30],Sheet2!R1C1:R5C2,2,0)&RC[-29]&RC[-28]&RC[-27]&Sheet2!R1C3 -> #N/A | AG408: =IF(RC[-26]&RC[-25]&RC[-24]&RC[-23]&RC[-22]&RC[-21]="",,R1C6)&IF(RC[-26]="",,"|n"&R1C7&RC[-26])&IF(RC[-25]="",,"|n"&R1C8&RC[-25])&IF(RC[-24]="",,"|n"&R1C9&RC[-24])&IF(RC[-23]="",,"|n"&R1C10&RC[-23])&IF(RC[-22]="",,"|n"&R1C11&RC[-22])&IF(RC[-21]="",,"|n"&R1C12&RC[-21])&IF(RC[-19]&RC[-18]&RC[-17]&RC[-16]="",,"|n"&R1C13)&IF(RC[-19]="",,"|n"&R1C14&RC[-19])&IF(RC[-18]="",,"|n"&R1C15&RC[-18])&IF(RC[-17]="",,"|n"&R1C16&RC[-17])&IF(RC[-16]="",,"|n"&R1C17&RC[-16])&IF(RC[-15]="",,"|n"&R1C18&RC[-15])&IF(RC[-14]="",,"|n"&R1C19&RC[-14])&IF(RC[-13]="",,"|n"&R1C20&RC[-13])&IF(RC[-12]="",,"|n"&R1C21&RC[-12])&IF(RC[-10]="",,"|n"&R1C23&RC[-10])&IF(RC[-9]="",,"|n"&R1C24&RC[-9])&IF(RC[-8]="",,"|n"&R1C25&RC[-8])&IF(RC[-7]="",,"|n"&R1C26&RC[-7])&IF(RC[-6]="",,"|n"&R1C27&RC[-6])&IF(RC[-5]="",,"|n"&R1C28&RC[-5])&IF(RC[-2]="",,"|n"&RC[-2]) -> 
AF409: =VLOOKUP(RC[-31],Sheet2!R13C1:R18C2,2,0)&"."&VLOOKUP(RC[-30],Sheet2!R7C1:R11C2,2,0)&VLOOKUP(RC[-30],Sheet2!R1C1:R5C2,2,0)&RC[-29]&RC[-28]&RC[-27]&Sheet2!R1C3 -> #N/A | AG409: =IF(RC[-26]&RC[-25]&RC[-24]&RC[-23]&RC[-22]&RC[-21]="",,R1C6)&IF(RC[-26]="",,"|n"&R1C7&RC[-26])&IF(RC[-25]="",,"|n"&R1C8&RC[-25])&IF(RC[-24]="",,"|n"&R1C9&RC[-24])&IF(RC[-23]="",,"|n"&R1C10&RC[-23])&IF(RC[-22]="",,"|n"&R1C11&RC[-22])&IF(RC[-21]="",,"|n"&R1C12&RC[-21])&IF(RC[-19]&RC[-18]&RC[-17]&RC[-16]="",,"|n"&R1C13)&IF(RC[-19]="",,"|n"&R1C14&RC[-19])&IF(RC[-18]="",,"|n"&R1C15&RC[-18])&IF(RC[-17]="",,"|n"&R1C16&RC[-17])&IF(RC[-16]="",,"|n"&R1C17&RC[-16])&IF(RC[-15]="",,"|n"&R1C18&RC[-15])&IF(RC[-14]="",,"|n"&R1C19&RC[-14])&IF(RC[-13]="",,"|n"&R1C20&RC[-13])&IF(RC[-12]="",,"|n"&R1C21&RC[-12])&IF(RC[-10]="",,"|n"&R1C23&RC[-10])&IF(RC[-9]="",,"|n"&R1C24&RC[-9])&IF(RC[-8]="",,"|n"&R1C25&RC[-8])&IF(RC[-7]="",,"|n"&R1C26&RC[-7])&IF(RC[-6]="",,"|n"&R1C27&RC[-6])&IF(RC[-5]="",,"|n"&R1C28&RC[-5])&IF(RC[-2]="",,"|n"&RC[-2]) -> 
AF410: =VLOOKUP(RC[-31],Sheet2!R13C1:R18C2,2,0)&"."&VLOOKUP(RC[-30],Sheet2!R7C1:R11C2,2,0)&VLOOKUP(RC[-30],Sheet2!R1C1:R5C2,2,0)&RC[-29]&RC[-28]&RC[-27]&Sheet2!R1C3 -> #N/A | AG410: =IF(RC[-26]&RC[-25]&RC[-24]&RC[-23]&RC[-22]&RC[-21]="",,R1C6)&IF(RC[-26]="",,"|n"&R1C7&RC[-26])&IF(RC[-25]="",,"|n"&R1C8&RC[-25])&IF(RC[-24]="",,"|n"&R1C9&RC[-24])&IF(RC[-23]="",,"|n"&R1C10&RC[-23])&IF(RC[-22]="",,"|n"&R1C11&RC[-22])&IF(RC[-21]="",,"|n"&R1C12&RC[-21])&IF(RC[-19]&RC[-18]&RC[-17]&RC[-16]="",,"|n"&R1C13)&IF(RC[-19]="",,"|n"&R1C14&RC[-19])&IF(RC[-18]="",,"|n"&R1C15&RC[-18])&IF(RC[-17]="",,"|n"&R1C16&RC[-17])&IF(RC[-16]="",,"|n"&R1C17&RC[-16])&IF(RC[-15]="",,"|n"&R1C18&RC[-15])&IF(RC[-14]="",,"|n"&R1C19&RC[-14])&IF(RC[-13]="",,"|n"&R1C20&RC[-13])&IF(RC[-12]="",,"|n"&R1C21&RC[-12])&IF(RC[-10]="",,"|n"&R1C23&RC[-10])&IF(RC[-9]="",,"|n"&R1C24&RC[-9])&IF(RC[-8]="",,"|n"&R1C25&RC[-8])&IF(RC[-7]="",,"|n"&R1C26&RC[-7])&IF(RC[-6]="",,"|n"&R1C27&RC[-6])&IF(RC[-5]="",,"|n"&R1C28&RC[-5])&IF(RC[-2]="",,"|n"&RC[-2]) -> 
AF411: =VLOOKUP(RC[-31],Sheet2!R13C1:R18C2,2,0)&"."&VLOOKUP(RC[-30],Sheet2!R7C1:R11C2,2,0)&VLOOKUP(RC[-30],Sheet2!R1C1:R5C2,2,0)&RC[-29]&RC[-28]&RC[-27]&Sheet2!R1C3 -> #N/A | AG411: =IF(RC[-26]&RC[-25]&RC[-24]&RC[-23]&RC[-22]&RC[-21]="",,R1C6)&IF(RC[-26]="",,"|n"&R1C7&RC[-26])&IF(RC[-25]="",,"|n"&R1C8&RC[-25])&IF(RC[-24]="",,"|n"&R1C9&RC[-24])&IF(RC[-23]="",,"|n"&R1C10&RC[-23])&IF(RC[-22]="",,"|n"&R1C11&RC[-22])&IF(RC[-21]="",,"|n"&R1C12&RC[-21])&IF(RC[-19]&RC[-18]&RC[-17]&RC[-16]="",,"|n"&R1C13)&IF(RC[-19]="",,"|n"&R1C14&RC[-19])&IF(RC[-18]="",,"|n"&R1C15&RC[-18])&IF(RC[-17]="",,"|n"&R1C16&RC[-17])&IF(RC[-16]="",,"|n"&R1C17&RC[-16])&IF(RC[-15]="",,"|n"&R1C18&RC[-15])&IF(RC[-14]="",,"|n"&R1C19&RC[-14])&IF(RC[-13]="",,"|n"&R1C20&RC[-13])&IF(RC[-12]="",,"|n"&R1C21&RC[-12])&IF(RC[-10]="",,"|n"&R1C23&RC[-10])&IF(RC[-9]="",,"|n"&R1C24&RC[-9])&IF(RC[-8]="",,"|n"&R1C25&RC[-8])&IF(RC[-7]="",,"|n"&R1C26&RC[-7])&IF(RC[-6]="",,"|n"&R1C27&RC[-6])&IF(RC[-5]="",,"|n"&R1C28&RC[-5])&IF(RC[-2]="",,"|n"&RC[-2]) -> 
AF412: =VLOOKUP(RC[-31],Sheet2!R13C1:R18C2,2,0)&"."&VLOOKUP(RC[-30],Sheet2!R7C1:R11C2,2,0)&VLOOKUP(RC[-30],Sheet2!R1C1:R5C2,2,0)&RC[-29]&RC[-28]&RC[-27]&Sheet2!R1C3 -> #N/A | AG412: =IF(RC[-26]&RC[-25]&RC[-24]&RC[-23]&RC[-22]&RC[-21]="",,R1C6)&IF(RC[-26]="",,"|n"&R1C7&RC[-26])&IF(RC[-25]="",,"|n"&R1C8&RC[-25])&IF(RC[-24]="",,"|n"&R1C9&RC[-24])&IF(RC[-23]="",,"|n"&R1C10&RC[-23])&IF(RC[-22]="",,"|n"&R1C11&RC[-22])&IF(RC[-21]="",,"|n"&R1C12&RC[-21])&IF(RC[-19]&RC[-18]&RC[-17]&RC[-16]="",,"|n"&R1C13)&IF(RC[-19]="",,"|n"&R1C14&RC[-19])&IF(RC[-18]="",,"|n"&R1C15&RC[-18])&IF(RC[-17]="",,"|n"&R1C16&RC[-17])&IF(RC[-16]="",,"|n"&R1C17&RC[-16])&IF(RC[-15]="",,"|n"&R1C18&RC[-15])&IF(RC[-14]="",,"|n"&R1C19&RC[-14])&IF(RC[-13]="",,"|n"&R1C20&RC[-13])&IF(RC[-12]="",,"|n"&R1C21&RC[-12])&IF(RC[-10]="",,"|n"&R1C23&RC[-10])&IF(RC[-9]="",,"|n"&R1C24&RC[-9])&IF(RC[-8]="",,"|n"&R1C25&RC[-8])&IF(RC[-7]="",,"|n"&R1C26&RC[-7])&IF(RC[-6]="",,"|n"&R1C27&RC[-6])&IF(RC[-5]="",,"|n"&R1C28&RC[-5])&IF(RC[-2]="",,"|n"&RC[-2]) -> 
AF413: =VLOOKUP(RC[-31],Sheet2!R13C1:R18C2,2,0)&"."&VLOOKUP(RC[-30],Sheet2!R7C1:R11C2,2,0)&VLOOKUP(RC[-30],Sheet2!R1C1:R5C2,2,0)&RC[-29]&RC[-28]&RC[-27]&Sheet2!R1C3 -> #N/A | AG413: =IF(RC[-26]&RC[-25]&RC[-24]&RC[-23]&RC[-22]&RC[-21]="",,R1C6)&IF(RC[-26]="",,"|n"&R1C7&RC[-26])&IF(RC[-25]="",,"|n"&R1C8&RC[-25])&IF(RC[-24]="",,"|n"&R1C9&RC[-24])&IF(RC[-23]="",,"|n"&R1C10&RC[-23])&IF(RC[-22]="",,"|n"&R1C11&RC[-22])&IF(RC[-21]="",,"|n"&R1C12&RC[-21])&IF(RC[-19]&RC[-18]&RC[-17]&RC[-16]="",,"|n"&R1C13)&IF(RC[-19]="",,"|n"&R1C14&RC[-19])&IF(RC[-18]="",,"|n"&R1C15&RC[-18])&IF(RC[-17]="",,"|n"&R1C16&RC[-17])&IF(RC[-16]="",,"|n"&R1C17&RC[-16])&IF(RC[-15]="",,"|n"&R1C18&RC[-15])&IF(RC[-14]="",,"|n"&R1C19&RC[-14])&IF(RC[-13]="",,"|n"&R1C20&RC[-13])&IF(RC[-12]="",,"|n"&R1C21&RC[-12])&IF(RC[-10]="",,"|n"&R1C23&RC[-10])&IF(RC[-9]="",,"|n"&R1C24&RC[-9])&IF(RC[-8]="",,"|n"&R1C25&RC[-8])&IF(RC[-7]="",,"|n"&R1C26&RC[-7])&IF(RC[-6]="",,"|n"&R1C27&RC[-6])&IF(RC[-5]="",,"|n"&R1C28&RC[-5])&IF(RC[-2]="",,"|n"&RC[-2]) -> 
AF414: =VLOOKUP(RC[-31],Sheet2!R13C1:R18C2,2,0)&"."&VLOOKUP(RC[-30],Sheet2!R7C1:R11C2,2,0)&VLOOKUP(RC[-30],Sheet2!R1C1:R5C2,2,0)&RC[-29]&RC[-28]&RC[-27]&Sheet2!R1C3 -> #N/A | AG414: =IF(RC[-26]&RC[-25]&RC[-24]&RC[-23]&RC[-22]&RC[-21]="",,R1C6)&IF(RC[-26]="",,"|n"&R1C7&RC[-26])&IF(RC[-25]="",,"|n"&R1C8&RC[-25])&IF(RC[-24]="",,"|n"&R1C9&RC[-24])&IF(RC[-23]="",,"|n"&R1C10&RC[-23])&IF(RC[-22]="",,"|n"&R1C11&RC[-22])&IF(RC[-21]="",,"|n"&R1C12&RC[-21])&IF(RC[-19]&RC[-18]&RC[-17]&RC[-16]="",,"|n"&R1C13)&IF(RC[-19]="",,"|n"&R1C14&RC[-19])&IF(RC[-18]="",,"|n"&R1C15&RC[-18])&IF(RC[-17]="",,"|n"&R1C16&RC[-17])&IF(RC[-16]="",,"|n"&R1C17&RC[-16])&IF(RC[-15]="",,"|n"&R1C18&RC[-15])&IF(RC[-14]="",,"|n"&R1C19&RC[-14])&IF(RC[-13]="",,"|n"&R1C20&RC[-13])&IF(RC[-12]="",,"|n"&R1C21&RC[-12])&IF(RC[-10]="",,"|n"&R1C23&RC[-10])&IF(RC[-9]="",,"|n"&R1C24&RC[-9])&IF(RC[-8]="",,"|n"&R1C25&RC[-8])&IF(RC[-7]="",,"|n"&R1C26&RC[-7])&IF(RC[-6]="",,"|n"&R1C27&RC[-6])&IF(RC[-5]="",,"|n"&R1C28&RC[-5])&IF(RC[-2]="",,"|n"&RC[-2]) -> 
AF415: =VLOOKUP(RC[-31],Sheet2!R13C1:R18C2,2,0)&"."&VLOOKUP(RC[-30],Sheet2!R7C1:R11C2,2,0)&VLOOKUP(RC[-30],Sheet2!R1C1:R5C2,2,0)&RC[-29]&RC[-28]&RC[-27]&Sheet2!R1C3 -> #N/A | AG415: =IF(RC[-26]&RC[-25]&RC[-24]&RC[-23]&RC[-22]&RC[-21]="",,R1C6)&IF(RC[-26]="",,"|n"&R1C7&RC[-26])&IF(RC[-25]="",,"|n"&R1C8&RC[-25])&IF(RC[-24]="",,"|n"&R1C9&RC[-24])&IF(RC[-23]="",,"|n"&R1C10&RC[-23])&IF(RC[-22]="",,"|n"&R1C11&RC[-22])&IF(RC[-21]="",,"|n"&R1C12&RC[-21])&IF(RC[-19]&RC[-18]&RC[-17]&RC[-16]="",,"|n"&R1C13)&IF(RC[-19]="",,"|n"&R1C14&RC[-19])&IF(RC[-18]="",,"|n"&R1C15&RC[-18])&IF(RC[-17]="",,"|n"&R1C16&RC[-17])&IF(RC[-16]="",,"|n"&R1C17&RC[-16])&IF(RC[-15]="",,"|n"&R1C18&RC[-15])&IF(RC[-14]="",,"|n"&R1C19&RC[-14])&IF(RC[-13]="",,"|n"&R1C20&RC[-13])&IF(RC[-12]="",,"|n"&R1C21&RC[-12])&IF(RC[-10]="",,"|n"&R1C23&RC[-10])&IF(RC[-9]="",,"|n"&R1C24&RC[-9])&IF(RC[-8]="",,"|n"&R1C25&RC[-8])&IF(RC[-7]="",,"|n"&R1C26&RC[-7])&IF(RC[-6]="",,"|n"&R1C27&RC[-6])&IF(RC[-5]="",,"|n"&R1C28&RC[-5])&IF(RC[-2]="",,"|n"&RC[-2]) -> 
AF416: =VLOOKUP(RC[-31],Sheet2!R13C1:R18C2,2,0)&"."&VLOOKUP(RC[-30],Sheet2!R7C1:R11C2,2,0)&VLOOKUP(RC[-30],Sheet2!R1C1:R5C2,2,0)&RC[-29]&RC[-28]&RC[-27]&Sheet2!R1C3 -> #N/A | AG416: =IF(RC[-26]&RC[-25]&RC[-24]&RC[-23]&RC[-22]&RC[-21]="",,R1C6)&IF(RC[-26]="",,"|n"&R1C7&RC[-26])&IF(RC[-25]="",,"|n"&R1C8&RC[-25])&IF(RC[-24]="",,"|n"&R1C9&RC[-24])&IF(RC[-23]="",,"|n"&R1C10&RC[-23])&IF(RC[-22]="",,"|n"&R1C11&RC[-22])&IF(RC[-21]="",,"|n"&R1C12&RC[-21])&IF(RC[-19]&RC[-18]&RC[-17]&RC[-16]="",,"|n"&R1C13)&IF(RC[-19]="",,"|n"&R1C14&RC[-19])&IF(RC[-18]="",,"|n"&R1C15&RC[-18])&IF(RC[-17]="",,"|n"&R1C16&RC[-17])&IF(RC[-16]="",,"|n"&R1C17&RC[-16])&IF(RC[-15]="",,"|n"&R1C18&RC[-15])&IF(RC[-14]="",,"|n"&R1C19&RC[-14])&IF(RC[-13]="",,"|n"&R1C20&RC[-13])&IF(RC[-12]="",,"|n"&R1C21&RC[-12])&IF(RC[-10]="",,"|n"&R1C23&RC[-10])&IF(RC[-9]="",,"|n"&R1C24&RC[-9])&IF(RC[-8]="",,"|n"&R1C25&RC[-8])&IF(RC[-7]="",,"|n"&R1C26&RC[-7])&IF(RC[-6]="",,"|n"&R1C27&RC[-6])&IF(RC[-5]="",,"|n"&R1C28&RC[-5])&IF(RC[-2]="",,"|n"&RC[-2]) -> 
AF417: =VLOOKUP(RC[-31],Sheet2!R13C1:R18C2,2,0)&"."&VLOOKUP(RC[-30],Sheet2!R7C1:R11C2,2,0)&VLOOKUP(RC[-30],Sheet2!R1C1:R5C2,2,0)&RC[-29]&RC[-28]&RC[-27]&Sheet2!R1C3 -> #N/A | AG417: =IF(RC[-26]&RC[-25]&RC[-24]&RC[-23]&RC[-22]&RC[-21]="",,R1C6)&IF(RC[-26]="",,"|n"&R1C7&RC[-26])&IF(RC[-25]="",,"|n"&R1C8&RC[-25])&IF(RC[-24]="",,"|n"&R1C9&RC[-24])&IF(RC[-23]="",,"|n"&R1C10&RC[-23])&IF(RC[-22]="",,"|n"&R1C11&RC[-22])&IF(RC[-21]="",,"|n"&R1C12&RC[-21])&IF(RC[-19]&RC[-18]&RC[-17]&RC[-16]="",,"|n"&R1C13)&IF(RC[-19]="",,"|n"&R1C14&RC[-19])&IF(RC[-18]="",,"|n"&R1C15&RC[-18])&IF(RC[-17]="",,"|n"&R1C16&RC[-17])&IF(RC[-16]="",,"|n"&R1C17&RC[-16])&IF(RC[-15]="",,"|n"&R1C18&RC[-15])&IF(RC[-14]="",,"|n"&R1C19&RC[-14])&IF(RC[-13]="",,"|n"&R1C20&RC[-13])&IF(RC[-12]="",,"|n"&R1C21&RC[-12])&IF(RC[-10]="",,"|n"&R1C23&RC[-10])&IF(RC[-9]="",,"|n"&R1C24&RC[-9])&IF(RC[-8]="",,"|n"&R1C25&RC[-8])&IF(RC[-7]="",,"|n"&R1C26&RC[-7])&IF(RC[-6]="",,"|n"&R1C27&RC[-6])&IF(RC[-5]="",,"|n"&R1C28&RC[-5])&IF(RC[-2]="",,"|n"&RC[-2]) -> 
AF418: =VLOOKUP(RC[-31],Sheet2!R13C1:R18C2,2,0)&"."&VLOOKUP(RC[-30],Sheet2!R7C1:R11C2,2,0)&VLOOKUP(RC[-30],Sheet2!R1C1:R5C2,2,0)&RC[-29]&RC[-28]&RC[-27]&Sheet2!R1C3 -> #N/A | AG418: =IF(RC[-26]&RC[-25]&RC[-24]&RC[-23]&RC[-22]&RC[-21]="",,R1C6)&IF(RC[-26]="",,"|n"&R1C7&RC[-26])&IF(RC[-25]="",,"|n"&R1C8&RC[-25])&IF(RC[-24]="",,"|n"&R1C9&RC[-24])&IF(RC[-23]="",,"|n"&R1C10&RC[-23])&IF(RC[-22]="",,"|n"&R1C11&RC[-22])&IF(RC[-21]="",,"|n"&R1C12&RC[-21])&IF(RC[-19]&RC[-18]&RC[-17]&RC[-16]="",,"|n"&R1C13)&IF(RC[-19]="",,"|n"&R1C14&RC[-19])&IF(RC[-18]="",,"|n"&R1C15&RC[-18])&IF(RC[-17]="",,"|n"&R1C16&RC[-17])&IF(RC[-16]="",,"|n"&R1C17&RC[-16])&IF(RC[-15]="",,"|n"&R1C18&RC[-15])&IF(RC[-14]="",,"|n"&R1C19&RC[-14])&IF(RC[-13]="",,"|n"&R1C20&RC[-13])&IF(RC[-12]="",,"|n"&R1C21&RC[-12])&IF(RC[-10]="",,"|n"&R1C23&RC[-10])&IF(RC[-9]="",,"|n"&R1C24&RC[-9])&IF(RC[-8]="",,"|n"&R1C25&RC[-8])&IF(RC[-7]="",,"|n"&R1C26&RC[-7])&IF(RC[-6]="",,"|n"&R1C27&RC[-6])&IF(RC[-5]="",,"|n"&R1C28&RC[-5])&IF(RC[-2]="",,"|n"&RC[-2]) -> 
AF419: =VLOOKUP(RC[-31],Sheet2!R13C1:R18C2,2,0)&"."&VLOOKUP(RC[-30],Sheet2!R7C1:R11C2,2,0)&VLOOKUP(RC[-30],Sheet2!R1C1:R5C2,2,0)&RC[-29]&RC[-28]&RC[-27]&Sheet2!R1C3 -> #N/A | AG419: =IF(RC[-26]&RC[-25]&RC[-24]&RC[-23]&RC[-22]&RC[-21]="",,R1C6)&IF(RC[-26]="",,"|n"&R1C7&RC[-26])&IF(RC[-25]="",,"|n"&R1C8&RC[-25])&IF(RC[-24]="",,"|n"&R1C9&RC[-24])&IF(RC[-23]="",,"|n"&R1C10&RC[-23])&IF(RC[-22]="",,"|n"&R1C11&RC[-22])&IF(RC[-21]="",,"|n"&R1C12&RC[-21])&IF(RC[-19]&RC[-18]&RC[-17]&RC[-16]="",,"|n"&R1C13)&IF(RC[-19]="",,"|n"&R1C14&RC[-19])&IF(RC[-18]="",,"|n"&R1C15&RC[-18])&IF(RC[-17]="",,"|n"&R1C16&RC[-17])&IF(RC[-16]="",,"|n"&R1C17&RC[-16])&IF(RC[-15]="",,"|n"&R1C18&RC[-15])&IF(RC[-14]="",,"|n"&R1C19&RC[-14])&IF(RC[-13]="",,"|n"&R1C20&RC[-13])&IF(RC[-12]="",,"|n"&R1C21&RC[-12])&IF(RC[-10]="",,"|n"&R1C23&RC[-10])&IF(RC[-9]="",,"|n"&R1C24&RC[-9])&IF(RC[-8]="",,"|n"&R1C25&RC[-8])&IF(RC[-7]="",,"|n"&R1C26&RC[-7])&IF(RC[-6]="",,"|n"&R1C27&RC[-6])&IF(RC[-5]="",,"|n"&R1C28&RC[-5])&IF(RC[-2]="",,"|n"&RC[-2]) -> 
AF420: =VLOOKUP(RC[-31],Sheet2!R13C1:R18C2,2,0)&"."&VLOOKUP(RC[-30],Sheet2!R7C1:R11C2,2,0)&VLOOKUP(RC[-30],Sheet2!R1C1:R5C2,2,0)&RC[-29]&RC[-28]&RC[-27]&Sheet2!R1C3 -> #N/A | AG420: =IF(RC[-26]&RC[-25]&RC[-24]&RC[-23]&RC[-22]&RC[-21]="",,R1C6)&IF(RC[-26]="",,"|n"&R1C7&RC[-26])&IF(RC[-25]="",,"|n"&R1C8&RC[-25])&IF(RC[-24]="",,"|n"&R1C9&RC[-24])&IF(RC[-23]="",,"|n"&R1C10&RC[-23])&IF(RC[-22]="",,"|n"&R1C11&RC[-22])&IF(RC[-21]="",,"|n"&R1C12&RC[-21])&IF(RC[-19]&RC[-18]&RC[-17]&RC[-16]="",,"|n"&R1C13)&IF(RC[-19]="",,"|n"&R1C14&RC[-19])&IF(RC[-18]="",,"|n"&R1C15&RC[-18])&IF(RC[-17]="",,"|n"&R1C16&RC[-17])&IF(RC[-16]="",,"|n"&R1C17&RC[-16])&IF(RC[-15]="",,"|n"&R1C18&RC[-15])&IF(RC[-14]="",,"|n"&R1C19&RC[-14])&IF(RC[-13]="",,"|n"&R1C20&RC[-13])&IF(RC[-12]="",,"|n"&R1C21&RC[-12])&IF(RC[-10]="",,"|n"&R1C23&RC[-10])&IF(RC[-9]="",,"|n"&R1C24&RC[-9])&IF(RC[-8]="",,"|n"&R1C25&RC[-8])&IF(RC[-7]="",,"|n"&R1C26&RC[-7])&IF(RC[-6]="",,"|n"&R1C27&RC[-6])&IF(RC[-5]="",,"|n"&R1C28&RC[-5])&IF(RC[-2]="",,"|n"&RC[-2]) -> 
AF421: =VLOOKUP(RC[-31],Sheet2!R13C1:R18C2,2,0)&"."&VLOOKUP(RC[-30],Sheet2!R7C1:R11C2,2,0)&VLOOKUP(RC[-30],Sheet2!R1C1:R5C2,2,0)&RC[-29]&RC[-28]&RC[-27]&Sheet2!R1C3 -> #N/A | AG421: =IF(RC[-26]&RC[-25]&RC[-24]&RC[-23]&RC[-22]&RC[-21]="",,R1C6)&IF(RC[-26]="",,"|n"&R1C7&RC[-26])&IF(RC[-25]="",,"|n"&R1C8&RC[-25])&IF(RC[-24]="",,"|n"&R1C9&RC[-24])&IF(RC[-23]="",,"|n"&R1C10&RC[-23])&IF(RC[-22]="",,"|n"&R1C11&RC[-22])&IF(RC[-21]="",,"|n"&R1C12&RC[-21])&IF(RC[-19]&RC[-18]&RC[-17]&RC[-16]="",,"|n"&R1C13)&IF(RC[-19]="",,"|n"&R1C14&RC[-19])&IF(RC[-18]="",,"|n"&R1C15&RC[-18])&IF(RC[-17]="",,"|n"&R1C16&RC[-17])&IF(RC[-16]="",,"|n"&R1C17&RC[-16])&IF(RC[-15]="",,"|n"&R1C18&RC[-15])&IF(RC[-14]="",,"|n"&R1C19&RC[-14])&IF(RC[-13]="",,"|n"&R1C20&RC[-13])&IF(RC[-12]="",,"|n"&R1C21&RC[-12])&IF(RC[-10]="",,"|n"&R1C23&RC[-10])&IF(RC[-9]="",,"|n"&R1C24&RC[-9])&IF(RC[-8]="",,"|n"&R1C25&RC[-8])&IF(RC[-7]="",,"|n"&R1C26&RC[-7])&IF(RC[-6]="",,"|n"&R1C27&RC[-6])&IF(RC[-5]="",,"|n"&R1C28&RC[-5])&IF(RC[-2]="",,"|n"&RC[-2]) -> 
AF422: =VLOOKUP(RC[-31],Sheet2!R13C1:R18C2,2,0)&"."&VLOOKUP(RC[-30],Sheet2!R7C1:R11C2,2,0)&VLOOKUP(RC[-30],Sheet2!R1C1:R5C2,2,0)&RC[-29]&RC[-28]&RC[-27]&Sheet2!R1C3 -> #N/A | AG422: =IF(RC[-26]&RC[-25]&RC[-24]&RC[-23]&RC[-22]&RC[-21]="",,R1C6)&IF(RC[-26]="",,"|n"&R1C7&RC[-26])&IF(RC[-25]="",,"|n"&R1C8&RC[-25])&IF(RC[-24]="",,"|n"&R1C9&RC[-24])&IF(RC[-23]="",,"|n"&R1C10&RC[-23])&IF(RC[-22]="",,"|n"&R1C11&RC[-22])&IF(RC[-21]="",,"|n"&R1C12&RC[-21])&IF(RC[-19]&RC[-18]&RC[-17]&RC[-16]="",,"|n"&R1C13)&IF(RC[-19]="",,"|n"&R1C14&RC[-19])&IF(RC[-18]="",,"|n"&R1C15&RC[-18])&IF(RC[-17]="",,"|n"&R1C16&RC[-17])&IF(RC[-16]="",,"|n"&R1C17&RC[-16])&IF(RC[-15]="",,"|n"&R1C18&RC[-15])&IF(RC[-14]="",,"|n"&R1C19&RC[-14])&IF(RC[-13]="",,"|n"&R1C20&RC[-13])&IF(RC[-12]="",,"|n"&R1C21&RC[-12])&IF(RC[-10]="",,"|n"&R1C23&RC[-10])&IF(RC[-9]="",,"|n"&R1C24&RC[-9])&IF(RC[-8]="",,"|n"&R1C25&RC[-8])&IF(RC[-7]="",,"|n"&R1C26&RC[-7])&IF(RC[-6]="",,"|n"&R1C27&RC[-6])&IF(RC[-5]="",,"|n"&R1C28&RC[-5])&IF(RC[-2]="",,"|n"&RC[-2]) -> 
AF423: =VLOOKUP(RC[-31],Sheet2!R13C1:R18C2,2,0)&"."&VLOOKUP(RC[-30],Sheet2!R7C1:R11C2,2,0)&VLOOKUP(RC[-30],Sheet2!R1C1:R5C2,2,0)&RC[-29]&RC[-28]&RC[-27]&Sheet2!R1C3 -> #N/A | AG423: =IF(RC[-26]&RC[-25]&RC[-24]&RC[-23]&RC[-22]&RC[-21]="",,R1C6)&IF(RC[-26]="",,"|n"&R1C7&RC[-26])&IF(RC[-25]="",,"|n"&R1C8&RC[-25])&IF(RC[-24]="",,"|n"&R1C9&RC[-24])&IF(RC[-23]="",,"|n"&R1C10&RC[-23])&IF(RC[-22]="",,"|n"&R1C11&RC[-22])&IF(RC[-21]="",,"|n"&R1C12&RC[-21])&IF(RC[-19]&RC[-18]&RC[-17]&RC[-16]="",,"|n"&R1C13)&IF(RC[-19]="",,"|n"&R1C14&RC[-19])&IF(RC[-18]="",,"|n"&R1C15&RC[-18])&IF(RC[-17]="",,"|n"&R1C16&RC[-17])&IF(RC[-16]="",,"|n"&R1C17&RC[-16])&IF(RC[-15]="",,"|n"&R1C18&RC[-15])&IF(RC[-14]="",,"|n"&R1C19&RC[-14])&IF(RC[-13]="",,"|n"&R1C20&RC[-13])&IF(RC[-12]="",,"|n"&R1C21&RC[-12])&IF(RC[-10]="",,"|n"&R1C23&RC[-10])&IF(RC[-9]="",,"|n"&R1C24&RC[-9])&IF(RC[-8]="",,"|n"&R1C25&RC[-8])&IF(RC[-7]="",,"|n"&R1C26&RC[-7])&IF(RC[-6]="",,"|n"&R1C27&RC[-6])&IF(RC[-5]="",,"|n"&R1C28&RC[-5])&IF(RC[-2]="",,"|n"&RC[-2]) -> 
AF424: =VLOOKUP(RC[-31],Sheet2!R13C1:R18C2,2,0)&"."&VLOOKUP(RC[-30],Sheet2!R7C1:R11C2,2,0)&VLOOKUP(RC[-30],Sheet2!R1C1:R5C2,2,0)&RC[-29]&RC[-28]&RC[-27]&Sheet2!R1C3 -> #N/A | AG424: =IF(RC[-26]&RC[-25]&RC[-24]&RC[-23]&RC[-22]&RC[-21]="",,R1C6)&IF(RC[-26]="",,"|n"&R1C7&RC[-26])&IF(RC[-25]="",,"|n"&R1C8&RC[-25])&IF(RC[-24]="",,"|n"&R1C9&RC[-24])&IF(RC[-23]="",,"|n"&R1C10&RC[-23])&IF(RC[-22]="",,"|n"&R1C11&RC[-22])&IF(RC[-21]="",,"|n"&R1C12&RC[-21])&IF(RC[-19]&RC[-18]&RC[-17]&RC[-16]="",,"|n"&R1C13)&IF(RC[-19]="",,"|n"&R1C14&RC[-19])&IF(RC[-18]="",,"|n"&R1C15&RC[-18])&IF(RC[-17]="",,"|n"&R1C16&RC[-17])&IF(RC[-16]="",,"|n"&R1C17&RC[-16])&IF(RC[-15]="",,"|n"&R1C18&RC[-15])&IF(RC[-14]="",,"|n"&R1C19&RC[-14])&IF(RC[-13]="",,"|n"&R1C20&RC[-13])&IF(RC[-12]="",,"|n"&R1C21&RC[-12])&IF(RC[-10]="",,"|n"&R1C23&RC[-10])&IF(RC[-9]="",,"|n"&R1C24&RC[-9])&IF(RC[-8]="",,"|n"&R1C25&RC[-8])&IF(RC[-7]="",,"|n"&R1C26&RC[-7])&IF(RC[-6]="",,"|n"&R1C27&RC[-6])&IF(RC[-5]="",,"|n"&R1C28&RC[-5])&IF(RC[-2]="",,"|n"&RC[-2]) -> 
AF425: =VLOOKUP(RC[-31],Sheet2!R13C1:R18C2,2,0)&"."&VLOOKUP(RC[-30],Sheet2!R7C1:R11C2,2,0)&VLOOKUP(RC[-30],Sheet2!R1C1:R5C2,2,0)&RC[-29]&RC[-28]&RC[-27]&Sheet2!R1C3 -> #N/A | AG425: =IF(RC[-26]&RC[-25]&RC[-24]&RC[-23]&RC[-22]&RC[-21]="",,R1C6)&IF(RC[-26]="",,"|n"&R1C7&RC[-26])&IF(RC[-25]="",,"|n"&R1C8&RC[-25])&IF(RC[-24]="",,"|n"&R1C9&RC[-24])&IF(RC[-23]="",,"|n"&R1C10&RC[-23])&IF(RC[-22]="",,"|n"&R1C11&RC[-22])&IF(RC[-21]="",,"|n"&R1C12&RC[-21])&IF(RC[-19]&RC[-18]&RC[-17]&RC[-16]="",,"|n"&R1C13)&IF(RC[-19]="",,"|n"&R1C14&RC[-19])&IF(RC[-18]="",,"|n"&R1C15&RC[-18])&IF(RC[-17]="",,"|n"&R1C16&RC[-17])&IF(RC[-16]="",,"|n"&R1C17&RC[-16])&IF(RC[-15]="",,"|n"&R1C18&RC[-15])&IF(RC[-14]="",,"|n"&R1C19&RC[-14])&IF(RC[-13]="",,"|n"&R1C20&RC[-13])&IF(RC[-12]="",,"|n"&R1C21&RC[-12])&IF(RC[-10]="",,"|n"&R1C23&RC[-10])&IF(RC[-9]="",,"|n"&R1C24&RC[-9])&IF(RC[-8]="",,"|n"&R1C25&RC[-8])&IF(RC[-7]="",,"|n"&R1C26&RC[-7])&IF(RC[-6]="",,"|n"&R1C27&RC[-6])&IF(RC[-5]="",,"|n"&R1C28&RC[-5])&IF(RC[-2]="",,"|n"&RC[-2]) -> 
AF426: =VLOOKUP(RC[-31],Sheet2!R13C1:R18C2,2,0)&"."&VLOOKUP(RC[-30],Sheet2!R7C1:R11C2,2,0)&VLOOKUP(RC[-30],Sheet2!R1C1:R5C2,2,0)&RC[-29]&RC[-28]&RC[-27]&Sheet2!R1C3 -> #N/A | AG426: =IF(RC[-26]&RC[-25]&RC[-24]&RC[-23]&RC[-22]&RC[-21]="",,R1C6)&IF(RC[-26]="",,"|n"&R1C7&RC[-26])&IF(RC[-25]="",,"|n"&R1C8&RC[-25])&IF(RC[-24]="",,"|n"&R1C9&RC[-24])&IF(RC[-23]="",,"|n"&R1C10&RC[-23])&IF(RC[-22]="",,"|n"&R1C11&RC[-22])&IF(RC[-21]="",,"|n"&R1C12&RC[-21])&IF(RC[-19]&RC[-18]&RC[-17]&RC[-16]="",,"|n"&R1C13)&IF(RC[-19]="",,"|n"&R1C14&RC[-19])&IF(RC[-18]="",,"|n"&R1C15&RC[-18])&IF(RC[-17]="",,"|n"&R1C16&RC[-17])&IF(RC[-16]="",,"|n"&R1C17&RC[-16])&IF(RC[-15]="",,"|n"&R1C18&RC[-15])&IF(RC[-14]="",,"|n"&R1C19&RC[-14])&IF(RC[-13]="",,"|n"&R1C20&RC[-13])&IF(RC[-12]="",,"|n"&R1C21&RC[-12])&IF(RC[-10]="",,"|n"&R1C23&RC[-10])&IF(RC[-9]="",,"|n"&R1C24&RC[-9])&IF(RC[-8]="",,"|n"&R1C25&RC[-8])&IF(RC[-7]="",,"|n"&R1C26&RC[-7])&IF(RC[-6]="",,"|n"&R1C27&RC[-6])&IF(RC[-5]="",,"|n"&R1C28&RC[-5])&IF(RC[-2]="",,"|n"&RC[-2]) -> 
AF427: =VLOOKUP(RC[-31],Sheet2!R13C1:R18C2,2,0)&"."&VLOOKUP(RC[-30],Sheet2!R7C1:R11C2,2,0)&VLOOKUP(RC[-30],Sheet2!R1C1:R5C2,2,0)&RC[-29]&RC[-28]&RC[-27]&Sheet2!R1C3 -> #N/A | AG427: =IF(RC[-26]&RC[-25]&RC[-24]&RC[-23]&RC[-22]&RC[-21]="",,R1C6)&IF(RC[-26]="",,"|n"&R1C7&RC[-26])&IF(RC[-25]="",,"|n"&R1C8&RC[-25])&IF(RC[-24]="",,"|n"&R1C9&RC[-24])&IF(RC[-23]="",,"|n"&R1C10&RC[-23])&IF(RC[-22]="",,"|n"&R1C11&RC[-22])&IF(RC[-21]="",,"|n"&R1C12&RC[-21])&IF(RC[-19]&RC[-18]&RC[-17]&RC[-16]="",,"|n"&R1C13)&IF(RC[-19]="",,"|n"&R1C14&RC[-19])&IF(RC[-18]="",,"|n"&R1C15&RC[-18])&IF(RC[-17]="",,"|n"&R1C16&RC[-17])&IF(RC[-16]="",,"|n"&R1C17&RC[-16])&IF(RC[-15]="",,"|n"&R1C18&RC[-15])&IF(RC[-14]="",,"|n"&R1C19&RC[-14])&IF(RC[-13]="",,"|n"&R1C20&RC[-13])&IF(RC[-12]="",,"|n"&R1C21&RC[-12])&IF(RC[-10]="",,"|n"&R1C23&RC[-10])&IF(RC[-9]="",,"|n"&R1C24&RC[-9])&IF(RC[-8]="",,"|n"&R1C25&RC[-8])&IF(RC[-7]="",,"|n"&R1C26&RC[-7])&IF(RC[-6]="",,"|n"&R1C27&RC[-6])&IF(RC[-5]="",,"|n"&R1C28&RC[-5])&IF(RC[-2]="",,"|n"&RC[-2]) -> 
AF428: =VLOOKUP(RC[-31],Sheet2!R13C1:R18C2,2,0)&"."&VLOOKUP(RC[-30],Sheet2!R7C1:R11C2,2,0)&VLOOKUP(RC[-30],Sheet2!R1C1:R5C2,2,0)&RC[-29]&RC[-28]&RC[-27]&Sheet2!R1C3 -> #N/A | AG428: =IF(RC[-26]&RC[-25]&RC[-24]&RC[-23]&RC[-22]&RC[-21]="",,R1C6)&IF(RC[-26]="",,"|n"&R1C7&RC[-26])&IF(RC[-25]="",,"|n"&R1C8&RC[-25])&IF(RC[-24]="",,"|n"&R1C9&RC[-24])&IF(RC[-23]="",,"|n"&R1C10&RC[-23])&IF(RC[-22]="",,"|n"&R1C11&RC[-22])&IF(RC[-21]="",,"|n"&R1C12&RC[-21])&IF(RC[-19]&RC[-18]&RC[-17]&RC[-16]="",,"|n"&R1C13)&IF(RC[-19]="",,"|n"&R1C14&RC[-19])&IF(RC[-18]="",,"|n"&R1C15&RC[-18])&IF(RC[-17]="",,"|n"&R1C16&RC[-17])&IF(RC[-16]="",,"|n"&R1C17&RC[-16])&IF(RC[-15]="",,"|n"&R1C18&RC[-15])&IF(RC[-14]="",,"|n"&R1C19&RC[-14])&IF(RC[-13]="",,"|n"&R1C20&RC[-13])&IF(RC[-12]="",,"|n"&R1C21&RC[-12])&IF(RC[-10]="",,"|n"&R1C23&RC[-10])&IF(RC[-9]="",,"|n"&R1C24&RC[-9])&IF(RC[-8]="",,"|n"&R1C25&RC[-8])&IF(RC[-7]="",,"|n"&R1C26&RC[-7])&IF(RC[-6]="",,"|n"&R1C27&RC[-6])&IF(RC[-5]="",,"|n"&R1C28&RC[-5])&IF(RC[-2]="",,"|n"&RC[-2]) -> 
AF429: =VLOOKUP(RC[-31],Sheet2!R13C1:R18C2,2,0)&"."&VLOOKUP(RC[-30],Sheet2!R7C1:R11C2,2,0)&VLOOKUP(RC[-30],Sheet2!R1C1:R5C2,2,0)&RC[-29]&RC[-28]&RC[-27]&Sheet2!R1C3 -> #N/A | AG429: =IF(RC[-26]&RC[-25]&RC[-24]&RC[-23]&RC[-22]&RC[-21]="",,R1C6)&IF(RC[-26]="",,"|n"&R1C7&RC[-26])&IF(RC[-25]="",,"|n"&R1C8&RC[-25])&IF(RC[-24]="",,"|n"&R1C9&RC[-24])&IF(RC[-23]="",,"|n"&R1C10&RC[-23])&IF(RC[-22]="",,"|n"&R1C11&RC[-22])&IF(RC[-21]="",,"|n"&R1C12&RC[-21])&IF(RC[-19]&RC[-18]&RC[-17]&RC[-16]="",,"|n"&R1C13)&IF(RC[-19]="",,"|n"&R1C14&RC[-19])&IF(RC[-18]="",,"|n"&R1C15&RC[-18])&IF(RC[-17]="",,"|n"&R1C16&RC[-17])&IF(RC[-16]="",,"|n"&R1C17&RC[-16])&IF(RC[-15]="",,"|n"&R1C18&RC[-15])&IF(RC[-14]="",,"|n"&R1C19&RC[-14])&IF(RC[-13]="",,"|n"&R1C20&RC[-13])&IF(RC[-12]="",,"|n"&R1C21&RC[-12])&IF(RC[-10]="",,"|n"&R1C23&RC[-10])&IF(RC[-9]="",,"|n"&R1C24&RC[-9])&IF(RC[-8]="",,"|n"&R1C25&RC[-8])&IF(RC[-7]="",,"|n"&R1C26&RC[-7])&IF(RC[-6]="",,"|n"&R1C27&RC[-6])&IF(RC[-5]="",,"|n"&R1C28&RC[-5])&IF(RC[-2]="",,"|n"&RC[-2]) -> 
AF430: =VLOOKUP(RC[-31],Sheet2!R13C1:R18C2,2,0)&"."&VLOOKUP(RC[-30],Sheet2!R7C1:R11C2,2,0)&VLOOKUP(RC[-30],Sheet2!R1C1:R5C2,2,0)&RC[-29]&RC[-28]&RC[-27]&Sheet2!R1C3 -> #N/A | AG430: =IF(RC[-26]&RC[-25]&RC[-24]&RC[-23]&RC[-22]&RC[-21]="",,R1C6)&IF(RC[-26]="",,"|n"&R1C7&RC[-26])&IF(RC[-25]="",,"|n"&R1C8&RC[-25])&IF(RC[-24]="",,"|n"&R1C9&RC[-24])&IF(RC[-23]="",,"|n"&R1C10&RC[-23])&IF(RC[-22]="",,"|n"&R1C11&RC[-22])&IF(RC[-21]="",,"|n"&R1C12&RC[-21])&IF(RC[-19]&RC[-18]&RC[-17]&RC[-16]="",,"|n"&R1C13)&IF(RC[-19]="",,"|n"&R1C14&RC[-19])&IF(RC[-18]="",,"|n"&R1C15&RC[-18])&IF(RC[-17]="",,"|n"&R1C16&RC[-17])&IF(RC[-16]="",,"|n"&R1C17&RC[-16])&IF(RC[-15]="",,"|n"&R1C18&RC[-15])&IF(RC[-14]="",,"|n"&R1C19&RC[-14])&IF(RC[-13]="",,"|n"&R1C20&RC[-13])&IF(RC[-12]="",,"|n"&R1C21&RC[-12])&IF(RC[-10]="",,"|n"&R1C23&RC[-10])&IF(RC[-9]="",,"|n"&R1C24&RC[-9])&IF(RC[-8]="",,"|n"&R1C25&RC[-8])&IF(RC[-7]="",,"|n"&R1C26&RC[-7])&IF(RC[-6]="",,"|n"&R1C27&RC[-6])&IF(RC[-5]="",,"|n"&R1C28&RC[-5])&IF(RC[-2]="",,"|n"&RC[-2]) -> 
AF431: =VLOOKUP(RC[-31],Sheet2!R13C1:R18C2,2,0)&"."&VLOOKUP(RC[-30],Sheet2!R7C1:R11C2,2,0)&VLOOKUP(RC[-30],Sheet2!R1C1:R5C2,2,0)&RC[-29]&RC[-28]&RC[-27]&Sheet2!R1C3 -> #N/A | AG431: =IF(RC[-26]&RC[-25]&RC[-24]&RC[-23]&RC[-22]&RC[-21]="",,R1C6)&IF(RC[-26]="",,"|n"&R1C7&RC[-26])&IF(RC[-25]="",,"|n"&R1C8&RC[-25])&IF(RC[-24]="",,"|n"&R1C9&RC[-24])&IF(RC[-23]="",,"|n"&R1C10&RC[-23])&IF(RC[-22]="",,"|n"&R1C11&RC[-22])&IF(RC[-21]="",,"|n"&R1C12&RC[-21])&IF(RC[-19]&RC[-18]&RC[-17]&RC[-16]="",,"|n"&R1C13)&IF(RC[-19]="",,"|n"&R1C14&RC[-19])&IF(RC[-18]="",,"|n"&R1C15&RC[-18])&IF(RC[-17]="",,"|n"&R1C16&RC[-17])&IF(RC[-16]="",,"|n"&R1C17&RC[-16])&IF(RC[-15]="",,"|n"&R1C18&RC[-15])&IF(RC[-14]="",,"|n"&R1C19&RC[-14])&IF(RC[-13]="",,"|n"&R1C20&RC[-13])&IF(RC[-12]="",,"|n"&R1C21&RC[-12])&IF(RC[-10]="",,"|n"&R1C23&RC[-10])&IF(RC[-9]="",,"|n"&R1C24&RC[-9])&IF(RC[-8]="",,"|n"&R1C25&RC[-8])&IF(RC[-7]="",,"|n"&R1C26&RC[-7])&IF(RC[-6]="",,"|n"&R1C27&RC[-6])&IF(RC[-5]="",,"|n"&R1C28&RC[-5])&IF(RC[-2]="",,"|n"&RC[-2]) -> 
AF432: =VLOOKUP(RC[-31],Sheet2!R13C1:R18C2,2,0)&"."&VLOOKUP(RC[-30],Sheet2!R7C1:R11C2,2,0)&VLOOKUP(RC[-30],Sheet2!R1C1:R5C2,2,0)&RC[-29]&RC[-28]&RC[-27]&Sheet2!R1C3 -> #N/A | AG432: =IF(RC[-26]&RC[-25]&RC[-24]&RC[-23]&RC[-22]&RC[-21]="",,R1C6)&IF(RC[-26]="",,"|n"&R1C7&RC[-26])&IF(RC[-25]="",,"|n"&R1C8&RC[-25])&IF(RC[-24]="",,"|n"&R1C9&RC[-24])&IF(RC[-23]="",,"|n"&R1C10&RC[-23])&IF(RC[-22]="",,"|n"&R1C11&RC[-22])&IF(RC[-21]="",,"|n"&R1C12&RC[-21])&IF(RC[-19]&RC[-18]&RC[-17]&RC[-16]="",,"|n"&R1C13)&IF(RC[-19]="",,"|n"&R1C14&RC[-19])&IF(RC[-18]="",,"|n"&R1C15&RC[-18])&IF(RC[-17]="",,"|n"&R1C16&RC[-17])&IF(RC[-16]="",,"|n"&R1C17&RC[-16])&IF(RC[-15]="",,"|n"&R1C18&RC[-15])&IF(RC[-14]="",,"|n"&R1C19&RC[-14])&IF(RC[-13]="",,"|n"&R1C20&RC[-13])&IF(RC[-12]="",,"|n"&R1C21&RC[-12])&IF(RC[-10]="",,"|n"&R1C23&RC[-10])&IF(RC[-9]="",,"|n"&R1C24&RC[-9])&IF(RC[-8]="",,"|n"&R1C25&RC[-8])&IF(RC[-7]="",,"|n"&R1C26&RC[-7])&IF(RC[-6]="",,"|n"&R1C27&RC[-6])&IF(RC[-5]="",,"|n"&R1C28&RC[-5])&IF(RC[-2]="",,"|n"&RC[-2]) -> 
AF433: =VLOOKUP(RC[-31],Sheet2!R13C1:R18C2,2,0)&"."&VLOOKUP(RC[-30],Sheet2!R7C1:R11C2,2,0)&VLOOKUP(RC[-30],Sheet2!R1C1:R5C2,2,0)&RC[-29]&RC[-28]&RC[-27]&Sheet2!R1C3 -> #N/A | AG433: =IF(RC[-26]&RC[-25]&RC[-24]&RC[-23]&RC[-22]&RC[-21]="",,R1C6)&IF(RC[-26]="",,"|n"&R1C7&RC[-26])&IF(RC[-25]="",,"|n"&R1C8&RC[-25])&IF(RC[-24]="",,"|n"&R1C9&RC[-24])&IF(RC[-23]="",,"|n"&R1C10&RC[-23])&IF(RC[-22]="",,"|n"&R1C11&RC[-22])&IF(RC[-21]="",,"|n"&R1C12&RC[-21])&IF(RC[-19]&RC[-18]&RC[-17]&RC[-16]="",,"|n"&R1C13)&IF(RC[-19]="",,"|n"&R1C14&RC[-19])&IF(RC[-18]="",,"|n"&R1C15&RC[-18])&IF(RC[-17]="",,"|n"&R1C16&RC[-17])&IF(RC[-16]="",,"|n"&R1C17&RC[-16])&IF(RC[-15]="",,"|n"&R1C18&RC[-15])&IF(RC[-14]="",,"|n"&R1C19&RC[-14])&IF(RC[-13]="",,"|n"&R1C20&RC[-13])&IF(RC[-12]="",,"|n"&R1C21&RC[-12])&IF(RC[-10]="",,"|n"&R1C23&RC[-10])&IF(RC[-9]="",,"|n"&R1C24&RC[-9])&IF(RC[-8]="",,"|n"&R1C25&RC[-8])&IF(RC[-7]="",,"|n"&R1C26&RC[-7])&IF(RC[-6]="",,"|n"&R1C27&RC[-6])&IF(RC[-5]="",,"|n"&R1C28&RC[-5])&IF(RC[-2]="",,"|n"&RC[-2]) -> 
AF434: =VLOOKUP(RC[-31],Sheet2!R13C1:R18C2,2,0)&"."&VLOOKUP(RC[-30],Sheet2!R7C1:R11C2,2,0)&VLOOKUP(RC[-30],Sheet2!R1C1:R5C2,2,0)&RC[-29]&RC[-28]&RC[-27]&Sheet2!R1C3 -> #N/A | AG434: =IF(RC[-26]&RC[-25]&RC[-24]&RC[-23]&RC[-22]&RC[-21]="",,R1C6)&IF(RC[-26]="",,"|n"&R1C7&RC[-26])&IF(RC[-25]="",,"|n"&R1C8&RC[-25])&IF(RC[-24]="",,"|n"&R1C9&RC[-24])&IF(RC[-23]="",,"|n"&R1C10&RC[-23])&IF(RC[-22]="",,"|n"&R1C11&RC[-22])&IF(RC[-21]="",,"|n"&R1C12&RC[-21])&IF(RC[-19]&RC[-18]&RC[-17]&RC[-16]="",,"|n"&R1C13)&IF(RC[-19]="",,"|n"&R1C14&RC[-19])&IF(RC[-18]="",,"|n"&R1C15&RC[-18])&IF(RC[-17]="",,"|n"&R1C16&RC[-17])&IF(RC[-16]="",,"|n"&R1C17&RC[-16])&IF(RC[-15]="",,"|n"&R1C18&RC[-15])&IF(RC[-14]="",,"|n"&R1C19&RC[-14])&IF(RC[-13]="",,"|n"&R1C20&RC[-13])&IF(RC[-12]="",,"|n"&R1C21&RC[-12])&IF(RC[-10]="",,"|n"&R1C23&RC[-10])&IF(RC[-9]="",,"|n"&R1C24&RC[-9])&IF(RC[-8]="",,"|n"&R1C25&RC[-8])&IF(RC[-7]="",,"|n"&R1C26&RC[-7])&IF(RC[-6]="",,"|n"&R1C27&RC[-6])&IF(RC[-5]="",,"|n"&R1C28&RC[-5])&IF(RC[-2]="",,"|n"&RC[-2]) -> 
AF435: =VLOOKUP(RC[-31],Sheet2!R13C1:R18C2,2,0)&"."&VLOOKUP(RC[-30],Sheet2!R7C1:R11C2,2,0)&VLOOKUP(RC[-30],Sheet2!R1C1:R5C2,2,0)&RC[-29]&RC[-28]&RC[-27]&Sheet2!R1C3 -> #N/A | AG435: =IF(RC[-26]&RC[-25]&RC[-24]&RC[-23]&RC[-22]&RC[-21]="",,R1C6)&IF(RC[-26]="",,"|n"&R1C7&RC[-26])&IF(RC[-25]="",,"|n"&R1C8&RC[-25])&IF(RC[-24]="",,"|n"&R1C9&RC[-24])&IF(RC[-23]="",,"|n"&R1C10&RC[-23])&IF(RC[-22]="",,"|n"&R1C11&RC[-22])&IF(RC[-21]="",,"|n"&R1C12&RC[-21])&IF(RC[-19]&RC[-18]&RC[-17]&RC[-16]="",,"|n"&R1C13)&IF(RC[-19]="",,"|n"&R1C14&RC[-19])&IF(RC[-18]="",,"|n"&R1C15&RC[-18])&IF(RC[-17]="",,"|n"&R1C16&RC[-17])&IF(RC[-16]="",,"|n"&R1C17&RC[-16])&IF(RC[-15]="",,"|n"&R1C18&RC[-15])&IF(RC[-14]="",,"|n"&R1C19&RC[-14])&IF(RC[-13]="",,"|n"&R1C20&RC[-13])&IF(RC[-12]="",,"|n"&R1C21&RC[-12])&IF(RC[-10]="",,"|n"&R1C23&RC[-10])&IF(RC[-9]="",,"|n"&R1C24&RC[-9])&IF(RC[-8]="",,"|n"&R1C25&RC[-8])&IF(RC[-7]="",,"|n"&R1C26&RC[-7])&IF(RC[-6]="",,"|n"&R1C27&RC[-6])&IF(RC[-5]="",,"|n"&R1C28&RC[-5])&IF(RC[-2]="",,"|n"&RC[-2]) -> 
AF436: =VLOOKUP(RC[-31],Sheet2!R13C1:R18C2,2,0)&"."&VLOOKUP(RC[-30],Sheet2!R7C1:R11C2,2,0)&VLOOKUP(RC[-30],Sheet2!R1C1:R5C2,2,0)&RC[-29]&RC[-28]&RC[-27]&Sheet2!R1C3 -> #N/A | AG436: =IF(RC[-26]&RC[-25]&RC[-24]&RC[-23]&RC[-22]&RC[-21]="",,R1C6)&IF(RC[-26]="",,"|n"&R1C7&RC[-26])&IF(RC[-25]="",,"|n"&R1C8&RC[-25])&IF(RC[-24]="",,"|n"&R1C9&RC[-24])&IF(RC[-23]="",,"|n"&R1C10&RC[-23])&IF(RC[-22]="",,"|n"&R1C11&RC[-22])&IF(RC[-21]="",,"|n"&R1C12&RC[-21])&IF(RC[-19]&RC[-18]&RC[-17]&RC[-16]="",,"|n"&R1C13)&IF(RC[-19]="",,"|n"&R1C14&RC[-19])&IF(RC[-18]="",,"|n"&R1C15&RC[-18])&IF(RC[-17]="",,"|n"&R1C16&RC[-17])&IF(RC[-16]="",,"|n"&R1C17&RC[-16])&IF(RC[-15]="",,"|n"&R1C18&RC[-15])&IF(RC[-14]="",,"|n"&R1C19&RC[-14])&IF(RC[-13]="",,"|n"&R1C20&RC[-13])&IF(RC[-12]="",,"|n"&R1C21&RC[-12])&IF(RC[-10]="",,"|n"&R1C23&RC[-10])&IF(RC[-9]="",,"|n"&R1C24&RC[-9])&IF(RC[-8]="",,"|n"&R1C25&RC[-8])&IF(RC[-7]="",,"|n"&R1C26&RC[-7])&IF(RC[-6]="",,"|n"&R1C27&RC[-6])&IF(RC[-5]="",,"|n"&R1C28&RC[-5])&IF(RC[-2]="",,"|n"&RC[-2]) -> 
AF437: =VLOOKUP(RC[-31],Sheet2!R13C1:R18C2,2,0)&"."&VLOOKUP(RC[-30],Sheet2!R7C1:R11C2,2,0)&VLOOKUP(RC[-30],Sheet2!R1C1:R5C2,2,0)&RC[-29]&RC[-28]&RC[-27]&Sheet2!R1C3 -> #N/A | AG437: =IF(RC[-26]&RC[-25]&RC[-24]&RC[-23]&RC[-22]&RC[-21]="",,R1C6)&IF(RC[-26]="",,"|n"&R1C7&RC[-26])&IF(RC[-25]="",,"|n"&R1C8&RC[-25])&IF(RC[-24]="",,"|n"&R1C9&RC[-24])&IF(RC[-23]="",,"|n"&R1C10&RC[-23])&IF(RC[-22]="",,"|n"&R1C11&RC[-22])&IF(RC[-21]="",,"|n"&R1C12&RC[-21])&IF(RC[-19]&RC[-18]&RC[-17]&RC[-16]="",,"|n"&R1C13)&IF(RC[-19]="",,"|n"&R1C14&RC[-19])&IF(RC[-18]="",,"|n"&R1C15&RC[-18])&IF(RC[-17]="",,"|n"&R1C16&RC[-17])&IF(RC[-16]="",,"|n"&R1C17&RC[-16])&IF(RC[-15]="",,"|n"&R1C18&RC[-15])&IF(RC[-14]="",,"|n"&R1C19&RC[-14])&IF(RC[-13]="",,"|n"&R1C20&RC[-13])&IF(RC[-12]="",,"|n"&R1C21&RC[-12])&IF(RC[-10]="",,"|n"&R1C23&RC[-10])&IF(RC[-9]="",,"|n"&R1C24&RC[-9])&IF(RC[-8]="",,"|n"&R1C25&RC[-8])&IF(RC[-7]="",,"|n"&R1C26&RC[-7])&IF(RC[-6]="",,"|n"&R1C27&RC[-6])&IF(RC[-5]="",,"|n"&R1C28&RC[-5])&IF(RC[-2]="",,"|n"&RC[-2]) -> 
AF438: =VLOOKUP(RC[-31],Sheet2!R13C1:R18C2,2,0)&"."&VLOOKUP(RC[-30],Sheet2!R7C1:R11C2,2,0)&VLOOKUP(RC[-30],Sheet2!R1C1:R5C2,2,0)&RC[-29]&RC[-28]&RC[-27]&Sheet2!R1C3 -> #N/A | AG438: =IF(RC[-26]&RC[-25]&RC[-24]&RC[-23]&RC[-22]&RC[-21]="",,R1C6)&IF(RC[-26]="",,"|n"&R1C7&RC[-26])&IF(RC[-25]="",,"|n"&R1C8&RC[-25])&IF(RC[-24]="",,"|n"&R1C9&RC[-24])&IF(RC[-23]="",,"|n"&R1C10&RC[-23])&IF(RC[-22]="",,"|n"&R1C11&RC[-22])&IF(RC[-21]="",,"|n"&R1C12&RC[-21])&IF(RC[-19]&RC[-18]&RC[-17]&RC[-16]="",,"|n"&R1C13)&IF(RC[-19]="",,"|n"&R1C14&RC[-19])&IF(RC[-18]="",,"|n"&R1C15&RC[-18])&IF(RC[-17]="",,"|n"&R1C16&RC[-17])&IF(RC[-16]="",,"|n"&R1C17&RC[-16])&IF(RC[-15]="",,"|n"&R1C18&RC[-15])&IF(RC[-14]="",,"|n"&R1C19&RC[-14])&IF(RC[-13]="",,"|n"&R1C20&RC[-13])&IF(RC[-12]="",,"|n"&R1C21&RC[-12])&IF(RC[-10]="",,"|n"&R1C23&RC[-10])&IF(RC[-9]="",,"|n"&R1C24&RC[-9])&IF(RC[-8]="",,"|n"&R1C25&RC[-8])&IF(RC[-7]="",,"|n"&R1C26&RC[-7])&IF(RC[-6]="",,"|n"&R1C27&RC[-6])&IF(RC[-5]="",,"|n"&R1C28&RC[-5])&IF(RC[-2]="",,"|n"&RC[-2]) -> 
AF439: =VLOOKUP(RC[-31],Sheet2!R13C1:R18C2,2,0)&"."&VLOOKUP(RC[-30],Sheet2!R7C1:R11C2,2,0)&VLOOKUP(RC[-30],Sheet2!R1C1:R5C2,2,0)&RC[-29]&RC[-28]&RC[-27]&Sheet2!R1C3 -> #N/A | AG439: =IF(RC[-26]&RC[-25]&RC[-24]&RC[-23]&RC[-22]&RC[-21]="",,R1C6)&IF(RC[-26]="",,"|n"&R1C7&RC[-26])&IF(RC[-25]="",,"|n"&R1C8&RC[-25])&IF(RC[-24]="",,"|n"&R1C9&RC[-24])&IF(RC[-23]="",,"|n"&R1C10&RC[-23])&IF(RC[-22]="",,"|n"&R1C11&RC[-22])&IF(RC[-21]="",,"|n"&R1C12&RC[-21])&IF(RC[-19]&RC[-18]&RC[-17]&RC[-16]="",,"|n"&R1C13)&IF(RC[-19]="",,"|n"&R1C14&RC[-19])&IF(RC[-18]="",,"|n"&R1C15&RC[-18])&IF(RC[-17]="",,"|n"&R1C16&RC[-17])&IF(RC[-16]="",,"|n"&R1C17&RC[-16])&IF(RC[-15]="",,"|n"&R1C18&RC[-15])&IF(RC[-14]="",,"|n"&R1C19&RC[-14])&IF(RC[-13]="",,"|n"&R1C20&RC[-13])&IF(RC[-12]="",,"|n"&R1C21&RC[-12])&IF(RC[-10]="",,"|n"&R1C23&RC[-10])&IF(RC[-9]="",,"|n"&R1C24&RC[-9])&IF(RC[-8]="",,"|n"&R1C25&RC[-8])&IF(RC[-7]="",,"|n"&R1C26&RC[-7])&IF(RC[-6]="",,"|n"&R1C27&RC[-6])&IF(RC[-5]="",,"|n"&R1C28&RC[-5])&IF(RC[-2]="",,"|n"&RC[-2]) -> 
AF440: =VLOOKUP(RC[-31],Sheet2!R13C1:R18C2,2,0)&"."&VLOOKUP(RC[-30],Sheet2!R7C1:R11C2,2,0)&VLOOKUP(RC[-30],Sheet2!R1C1:R5C2,2,0)&RC[-29]&RC[-28]&RC[-27]&Sheet2!R1C3 -> #N/A | AG440: =IF(RC[-26]&RC[-25]&RC[-24]&RC[-23]&RC[-22]&RC[-21]="",,R1C6)&IF(RC[-26]="",,"|n"&R1C7&RC[-26])&IF(RC[-25]="",,"|n"&R1C8&RC[-25])&IF(RC[-24]="",,"|n"&R1C9&RC[-24])&IF(RC[-23]="",,"|n"&R1C10&RC[-23])&IF(RC[-22]="",,"|n"&R1C11&RC[-22])&IF(RC[-21]="",,"|n"&R1C12&RC[-21])&IF(RC[-19]&RC[-18]&RC[-17]&RC[-16]="",,"|n"&R1C13)&IF(RC[-19]="",,"|n"&R1C14&RC[-19])&IF(RC[-18]="",,"|n"&R1C15&RC[-18])&IF(RC[-17]="",,"|n"&R1C16&RC[-17])&IF(RC[-16]="",,"|n"&R1C17&RC[-16])&IF(RC[-15]="",,"|n"&R1C18&RC[-15])&IF(RC[-14]="",,"|n"&R1C19&RC[-14])&IF(RC[-13]="",,"|n"&R1C20&RC[-13])&IF(RC[-12]="",,"|n"&R1C21&RC[-12])&IF(RC[-10]="",,"|n"&R1C23&RC[-10])&IF(RC[-9]="",,"|n"&R1C24&RC[-9])&IF(RC[-8]="",,"|n"&R1C25&RC[-8])&IF(RC[-7]="",,"|n"&R1C26&RC[-7])&IF(RC[-6]="",,"|n"&R1C27&RC[-6])&IF(RC[-5]="",,"|n"&R1C28&RC[-5])&IF(RC[-2]="",,"|n"&RC[-2]) -> 
AF441: =VLOOKUP(RC[-31],Sheet2!R13C1:R18C2,2,0)&"."&VLOOKUP(RC[-30],Sheet2!R7C1:R11C2,2,0)&VLOOKUP(RC[-30],Sheet2!R1C1:R5C2,2,0)&RC[-29]&RC[-28]&RC[-27]&Sheet2!R1C3 -> #N/A | AG441: =IF(RC[-26]&RC[-25]&RC[-24]&RC[-23]&RC[-22]&RC[-21]="",,R1C6)&IF(RC[-26]="",,"|n"&R1C7&RC[-26])&IF(RC[-25]="",,"|n"&R1C8&RC[-25])&IF(RC[-24]="",,"|n"&R1C9&RC[-24])&IF(RC[-23]="",,"|n"&R1C10&RC[-23])&IF(RC[-22]="",,"|n"&R1C11&RC[-22])&IF(RC[-21]="",,"|n"&R1C12&RC[-21])&IF(RC[-19]&RC[-18]&RC[-17]&RC[-16]="",,"|n"&R1C13)&IF(RC[-19]="",,"|n"&R1C14&RC[-19])&IF(RC[-18]="",,"|n"&R1C15&RC[-18])&IF(RC[-17]="",,"|n"&R1C16&RC[-17])&IF(RC[-16]="",,"|n"&R1C17&RC[-16])&IF(RC[-15]="",,"|n"&R1C18&RC[-15])&IF(RC[-14]="",,"|n"&R1C19&RC[-14])&IF(RC[-13]="",,"|n"&R1C20&RC[-13])&IF(RC[-12]="",,"|n"&R1C21&RC[-12])&IF(RC[-10]="",,"|n"&R1C23&RC[-10])&IF(RC[-9]="",,"|n"&R1C24&RC[-9])&IF(RC[-8]="",,"|n"&R1C25&RC[-8])&IF(RC[-7]="",,"|n"&R1C26&RC[-7])&IF(RC[-6]="",,"|n"&R1C27&RC[-6])&IF(RC[-5]="",,"|n"&R1C28&RC[-5])&IF(RC[-2]="",,"|n"&RC[-2]) -> 
AF442: =VLOOKUP(RC[-31],Sheet2!R13C1:R18C2,2,0)&"."&VLOOKUP(RC[-30],Sheet2!R7C1:R11C2,2,0)&VLOOKUP(RC[-30],Sheet2!R1C1:R5C2,2,0)&RC[-29]&RC[-28]&RC[-27]&Sheet2!R1C3 -> #N/A | AG442: =IF(RC[-26]&RC[-25]&RC[-24]&RC[-23]&RC[-22]&RC[-21]="",,R1C6)&IF(RC[-26]="",,"|n"&R1C7&RC[-26])&IF(RC[-25]="",,"|n"&R1C8&RC[-25])&IF(RC[-24]="",,"|n"&R1C9&RC[-24])&IF(RC[-23]="",,"|n"&R1C10&RC[-23])&IF(RC[-22]="",,"|n"&R1C11&RC[-22])&IF(RC[-21]="",,"|n"&R1C12&RC[-21])&IF(RC[-19]&RC[-18]&RC[-17]&RC[-16]="",,"|n"&R1C13)&IF(RC[-19]="",,"|n"&R1C14&RC[-19])&IF(RC[-18]="",,"|n"&R1C15&RC[-18])&IF(RC[-17]="",,"|n"&R1C16&RC[-17])&IF(RC[-16]="",,"|n"&R1C17&RC[-16])&IF(RC[-15]="",,"|n"&R1C18&RC[-15])&IF(RC[-14]="",,"|n"&R1C19&RC[-14])&IF(RC[-13]="",,"|n"&R1C20&RC[-13])&IF(RC[-12]="",,"|n"&R1C21&RC[-12])&IF(RC[-10]="",,"|n"&R1C23&RC[-10])&IF(RC[-9]="",,"|n"&R1C24&RC[-9])&IF(RC[-8]="",,"|n"&R1C25&RC[-8])&IF(RC[-7]="",,"|n"&R1C26&RC[-7])&IF(RC[-6]="",,"|n"&R1C27&RC[-6])&IF(RC[-5]="",,"|n"&R1C28&RC[-5])&IF(RC[-2]="",,"|n"&RC[-2]) -> 
AF443: =VLOOKUP(RC[-31],Sheet2!R13C1:R18C2,2,0)&"."&VLOOKUP(RC[-30],Sheet2!R7C1:R11C2,2,0)&VLOOKUP(RC[-30],Sheet2!R1C1:R5C2,2,0)&RC[-29]&RC[-28]&RC[-27]&Sheet2!R1C3 -> #N/A | AG443: =IF(RC[-26]&RC[-25]&RC[-24]&RC[-23]&RC[-22]&RC[-21]="",,R1C6)&IF(RC[-26]="",,"|n"&R1C7&RC[-26])&IF(RC[-25]="",,"|n"&R1C8&RC[-25])&IF(RC[-24]="",,"|n"&R1C9&RC[-24])&IF(RC[-23]="",,"|n"&R1C10&RC[-23])&IF(RC[-22]="",,"|n"&R1C11&RC[-22])&IF(RC[-21]="",,"|n"&R1C12&RC[-21])&IF(RC[-19]&RC[-18]&RC[-17]&RC[-16]="",,"|n"&R1C13)&IF(RC[-19]="",,"|n"&R1C14&RC[-19])&IF(RC[-18]="",,"|n"&R1C15&RC[-18])&IF(RC[-17]="",,"|n"&R1C16&RC[-17])&IF(RC[-16]="",,"|n"&R1C17&RC[-16])&IF(RC[-15]="",,"|n"&R1C18&RC[-15])&IF(RC[-14]="",,"|n"&R1C19&RC[-14])&IF(RC[-13]="",,"|n"&R1C20&RC[-13])&IF(RC[-12]="",,"|n"&R1C21&RC[-12])&IF(RC[-10]="",,"|n"&R1C23&RC[-10])&IF(RC[-9]="",,"|n"&R1C24&RC[-9])&IF(RC[-8]="",,"|n"&R1C25&RC[-8])&IF(RC[-7]="",,"|n"&R1C26&RC[-7])&IF(RC[-6]="",,"|n"&R1C27&RC[-6])&IF(RC[-5]="",,"|n"&R1C28&RC[-5])&IF(RC[-2]="",,"|n"&RC[-2]) -> 
AF444: =VLOOKUP(RC[-31],Sheet2!R13C1:R18C2,2,0)&"."&VLOOKUP(RC[-30],Sheet2!R7C1:R11C2,2,0)&VLOOKUP(RC[-30],Sheet2!R1C1:R5C2,2,0)&RC[-29]&RC[-28]&RC[-27]&Sheet2!R1C3 -> #N/A | AG444: =IF(RC[-26]&RC[-25]&RC[-24]&RC[-23]&RC[-22]&RC[-21]="",,R1C6)&IF(RC[-26]="",,"|n"&R1C7&RC[-26])&IF(RC[-25]="",,"|n"&R1C8&RC[-25])&IF(RC[-24]="",,"|n"&R1C9&RC[-24])&IF(RC[-23]="",,"|n"&R1C10&RC[-23])&IF(RC[-22]="",,"|n"&R1C11&RC[-22])&IF(RC[-21]="",,"|n"&R1C12&RC[-21])&IF(RC[-19]&RC[-18]&RC[-17]&RC[-16]="",,"|n"&R1C13)&IF(RC[-19]="",,"|n"&R1C14&RC[-19])&IF(RC[-18]="",,"|n"&R1C15&RC[-18])&IF(RC[-17]="",,"|n"&R1C16&RC[-17])&IF(RC[-16]="",,"|n"&R1C17&RC[-16])&IF(RC[-15]="",,"|n"&R1C18&RC[-15])&IF(RC[-14]="",,"|n"&R1C19&RC[-14])&IF(RC[-13]="",,"|n"&R1C20&RC[-13])&IF(RC[-12]="",,"|n"&R1C21&RC[-12])&IF(RC[-10]="",,"|n"&R1C23&RC[-10])&IF(RC[-9]="",,"|n"&R1C24&RC[-9])&IF(RC[-8]="",,"|n"&R1C25&RC[-8])&IF(RC[-7]="",,"|n"&R1C26&RC[-7])&IF(RC[-6]="",,"|n"&R1C27&RC[-6])&IF(RC[-5]="",,"|n"&R1C28&RC[-5])&IF(RC[-2]="",,"|n"&RC[-2]) -> 
AF445: =VLOOKUP(RC[-31],Sheet2!R13C1:R18C2,2,0)&"."&VLOOKUP(RC[-30],Sheet2!R7C1:R11C2,2,0)&VLOOKUP(RC[-30],Sheet2!R1C1:R5C2,2,0)&RC[-29]&RC[-28]&RC[-27]&Sheet2!R1C3 -> #N/A | AG445: =IF(RC[-26]&RC[-25]&RC[-24]&RC[-23]&RC[-22]&RC[-21]="",,R1C6)&IF(RC[-26]="",,"|n"&R1C7&RC[-26])&IF(RC[-25]="",,"|n"&R1C8&RC[-25])&IF(RC[-24]="",,"|n"&R1C9&RC[-24])&IF(RC[-23]="",,"|n"&R1C10&RC[-23])&IF(RC[-22]="",,"|n"&R1C11&RC[-22])&IF(RC[-21]="",,"|n"&R1C12&RC[-21])&IF(RC[-19]&RC[-18]&RC[-17]&RC[-16]="",,"|n"&R1C13)&IF(RC[-19]="",,"|n"&R1C14&RC[-19])&IF(RC[-18]="",,"|n"&R1C15&RC[-18])&IF(RC[-17]="",,"|n"&R1C16&RC[-17])&IF(RC[-16]="",,"|n"&R1C17&RC[-16])&IF(RC[-15]="",,"|n"&R1C18&RC[-15])&IF(RC[-14]="",,"|n"&R1C19&RC[-14])&IF(RC[-13]="",,"|n"&R1C20&RC[-13])&IF(RC[-12]="",,"|n"&R1C21&RC[-12])&IF(RC[-10]="",,"|n"&R1C23&RC[-10])&IF(RC[-9]="",,"|n"&R1C24&RC[-9])&IF(RC[-8]="",,"|n"&R1C25&RC[-8])&IF(RC[-7]="",,"|n"&R1C26&RC[-7])&IF(RC[-6]="",,"|n"&R1C27&RC[-6])&IF(RC[-5]="",,"|n"&R1C28&RC[-5])&IF(RC[-2]="",,"|n"&RC[-2]) -> 
AF446: =VLOOKUP(RC[-31],Sheet2!R13C1:R18C2,2,0)&"."&VLOOKUP(RC[-30],Sheet2!R7C1:R11C2,2,0)&VLOOKUP(RC[-30],Sheet2!R1C1:R5C2,2,0)&RC[-29]&RC[-28]&RC[-27]&Sheet2!R1C3 -> #N/A | AG446: =IF(RC[-26]&RC[-25]&RC[-24]&RC[-23]&RC[-22]&RC[-21]="",,R1C6)&IF(RC[-26]="",,"|n"&R1C7&RC[-26])&IF(RC[-25]="",,"|n"&R1C8&RC[-25])&IF(RC[-24]="",,"|n"&R1C9&RC[-24])&IF(RC[-23]="",,"|n"&R1C10&RC[-23])&IF(RC[-22]="",,"|n"&R1C11&RC[-22])&IF(RC[-21]="",,"|n"&R1C12&RC[-21])&IF(RC[-19]&RC[-18]&RC[-17]&RC[-16]="",,"|n"&R1C13)&IF(RC[-19]="",,"|n"&R1C14&RC[-19])&IF(RC[-18]="",,"|n"&R1C15&RC[-18])&IF(RC[-17]="",,"|n"&R1C16&RC[-17])&IF(RC[-16]="",,"|n"&R1C17&RC[-16])&IF(RC[-15]="",,"|n"&R1C18&RC[-15])&IF(RC[-14]="",,"|n"&R1C19&RC[-14])&IF(RC[-13]="",,"|n"&R1C20&RC[-13])&IF(RC[-12]="",,"|n"&R1C21&RC[-12])&IF(RC[-10]="",,"|n"&R1C23&RC[-10])&IF(RC[-9]="",,"|n"&R1C24&RC[-9])&IF(RC[-8]="",,"|n"&R1C25&RC[-8])&IF(RC[-7]="",,"|n"&R1C26&RC[-7])&IF(RC[-6]="",,"|n"&R1C27&RC[-6])&IF(RC[-5]="",,"|n"&R1C28&RC[-5])&IF(RC[-2]="",,"|n"&RC[-2]) -> 
AF447: =VLOOKUP(RC[-31],Sheet2!R13C1:R18C2,2,0)&"."&VLOOKUP(RC[-30],Sheet2!R7C1:R11C2,2,0)&VLOOKUP(RC[-30],Sheet2!R1C1:R5C2,2,0)&RC[-29]&RC[-28]&RC[-27]&Sheet2!R1C3 -> #N/A | AG447: =IF(RC[-26]&RC[-25]&RC[-24]&RC[-23]&RC[-22]&RC[-21]="",,R1C6)&IF(RC[-26]="",,"|n"&R1C7&RC[-26])&IF(RC[-25]="",,"|n"&R1C8&RC[-25])&IF(RC[-24]="",,"|n"&R1C9&RC[-24])&IF(RC[-23]="",,"|n"&R1C10&RC[-23])&IF(RC[-22]="",,"|n"&R1C11&RC[-22])&IF(RC[-21]="",,"|n"&R1C12&RC[-21])&IF(RC[-19]&RC[-18]&RC[-17]&RC[-16]="",,"|n"&R1C13)&IF(RC[-19]="",,"|n"&R1C14&RC[-19])&IF(RC[-18]="",,"|n"&R1C15&RC[-18])&IF(RC[-17]="",,"|n"&R1C16&RC[-17])&IF(RC[-16]="",,"|n"&R1C17&RC[-16])&IF(RC[-15]="",,"|n"&R1C18&RC[-15])&IF(RC[-14]="",,"|n"&R1C19&RC[-14])&IF(RC[-13]="",,"|n"&R1C20&RC[-13])&IF(RC[-12]="",,"|n"&R1C21&RC[-12])&IF(RC[-10]="",,"|n"&R1C23&RC[-10])&IF(RC[-9]="",,"|n"&R1C24&RC[-9])&IF(RC[-8]="",,"|n"&R1C25&RC[-8])&IF(RC[-7]="",,"|n"&R1C26&RC[-7])&IF(RC[-6]="",,"|n"&R1C27&RC[-6])&IF(RC[-5]="",,"|n"&R1C28&RC[-5])&IF(RC[-2]="",,"|n"&RC[-2]) -> 
AF448: =VLOOKUP(RC[-31],Sheet2!R13C1:R18C2,2,0)&"."&VLOOKUP(RC[-30],Sheet2!R7C1:R11C2,2,0)&VLOOKUP(RC[-30],Sheet2!R1C1:R5C2,2,0)&RC[-29]&RC[-28]&RC[-27]&Sheet2!R1C3 -> #N/A | AG448: =IF(RC[-26]&RC[-25]&RC[-24]&RC[-23]&RC[-22]&RC[-21]="",,R1C6)&IF(RC[-26]="",,"|n"&R1C7&RC[-26])&IF(RC[-25]="",,"|n"&R1C8&RC[-25])&IF(RC[-24]="",,"|n"&R1C9&RC[-24])&IF(RC[-23]="",,"|n"&R1C10&RC[-23])&IF(RC[-22]="",,"|n"&R1C11&RC[-22])&IF(RC[-21]="",,"|n"&R1C12&RC[-21])&IF(RC[-19]&RC[-18]&RC[-17]&RC[-16]="",,"|n"&R1C13)&IF(RC[-19]="",,"|n"&R1C14&RC[-19])&IF(RC[-18]="",,"|n"&R1C15&RC[-18])&IF(RC[-17]="",,"|n"&R1C16&RC[-17])&IF(RC[-16]="",,"|n"&R1C17&RC[-16])&IF(RC[-15]="",,"|n"&R1C18&RC[-15])&IF(RC[-14]="",,"|n"&R1C19&RC[-14])&IF(RC[-13]="",,"|n"&R1C20&RC[-13])&IF(RC[-12]="",,"|n"&R1C21&RC[-12])&IF(RC[-10]="",,"|n"&R1C23&RC[-10])&IF(RC[-9]="",,"|n"&R1C24&RC[-9])&IF(RC[-8]="",,"|n"&R1C25&RC[-8])&IF(RC[-7]="",,"|n"&R1C26&RC[-7])&IF(RC[-6]="",,"|n"&R1C27&RC[-6])&IF(RC[-5]="",,"|n"&R1C28&RC[-5])&IF(RC[-2]="",,"|n"&RC[-2]) -> 
AF449: =VLOOKUP(RC[-31],Sheet2!R13C1:R18C2,2,0)&"."&VLOOKUP(RC[-30],Sheet2!R7C1:R11C2,2,0)&VLOOKUP(RC[-30],Sheet2!R1C1:R5C2,2,0)&RC[-29]&RC[-28]&RC[-27]&Sheet2!R1C3 -> #N/A | AG449: =IF(RC[-26]&RC[-25]&RC[-24]&RC[-23]&RC[-22]&RC[-21]="",,R1C6)&IF(RC[-26]="",,"|n"&R1C7&RC[-26])&IF(RC[-25]="",,"|n"&R1C8&RC[-25])&IF(RC[-24]="",,"|n"&R1C9&RC[-24])&IF(RC[-23]="",,"|n"&R1C10&RC[-23])&IF(RC[-22]="",,"|n"&R1C11&RC[-22])&IF(RC[-21]="",,"|n"&R1C12&RC[-21])&IF(RC[-19]&RC[-18]&RC[-17]&RC[-16]="",,"|n"&R1C13)&IF(RC[-19]="",,"|n"&R1C14&RC[-19])&IF(RC[-18]="",,"|n"&R1C15&RC[-18])&IF(RC[-17]="",,"|n"&R1C16&RC[-17])&IF(RC[-16]="",,"|n"&R1C17&RC[-16])&IF(RC[-15]="",,"|n"&R1C18&RC[-15])&IF(RC[-14]="",,"|n"&R1C19&RC[-14])&IF(RC[-13]="",,"|n"&R1C20&RC[-13])&IF(RC[-12]="",,"|n"&R1C21&RC[-12])&IF(RC[-10]="",,"|n"&R1C23&RC[-10])&IF(RC[-9]="",,"|n"&R1C24&RC[-9])&IF(RC[-8]="",,"|n"&R1C25&RC[-8])&IF(RC[-7]="",,"|n"&R1C26&RC[-7])&IF(RC[-6]="",,"|n"&R1C27&RC[-6])&IF(RC[-5]="",,"|n"&R1C28&RC[-5])&IF(RC[-2]="",,"|n"&RC[-2]) -> 
AF450: =VLOOKUP(RC[-31],Sheet2!R13C1:R18C2,2,0)&"."&VLOOKUP(RC[-30],Sheet2!R7C1:R11C2,2,0)&VLOOKUP(RC[-30],Sheet2!R1C1:R5C2,2,0)&RC[-29]&RC[-28]&RC[-27]&Sheet2!R1C3 -> #N/A | AG450: =IF(RC[-26]&RC[-25]&RC[-24]&RC[-23]&RC[-22]&RC[-21]="",,R1C6)&IF(RC[-26]="",,"|n"&R1C7&RC[-26])&IF(RC[-25]="",,"|n"&R1C8&RC[-25])&IF(RC[-24]="",,"|n"&R1C9&RC[-24])&IF(RC[-23]="",,"|n"&R1C10&RC[-23])&IF(RC[-22]="",,"|n"&R1C11&RC[-22])&IF(RC[-21]="",,"|n"&R1C12&RC[-21])&IF(RC[-19]&RC[-18]&RC[-17]&RC[-16]="",,"|n"&R1C13)&IF(RC[-19]="",,"|n"&R1C14&RC[-19])&IF(RC[-18]="",,"|n"&R1C15&RC[-18])&IF(RC[-17]="",,"|n"&R1C16&RC[-17])&IF(RC[-16]="",,"|n"&R1C17&RC[-16])&IF(RC[-15]="",,"|n"&R1C18&RC[-15])&IF(RC[-14]="",,"|n"&R1C19&RC[-14])&IF(RC[-13]="",,"|n"&R1C20&RC[-13])&IF(RC[-12]="",,"|n"&R1C21&RC[-12])&IF(RC[-10]="",,"|n"&R1C23&RC[-10])&IF(RC[-9]="",,"|n"&R1C24&RC[-9])&IF(RC[-8]="",,"|n"&R1C25&RC[-8])&IF(RC[-7]="",,"|n"&R1C26&RC[-7])&IF(RC[-6]="",,"|n"&R1C27&RC[-6])&IF(RC[-5]="",,"|n"&R1C28&RC[-5])&IF(RC[-2]="",,"|n"&RC[-2]) -> 
AF451: =VLOOKUP(RC[-31],Sheet2!R13C1:R18C2,2,0)&"."&VLOOKUP(RC[-30],Sheet2!R7C1:R11C2,2,0)&VLOOKUP(RC[-30],Sheet2!R1C1:R5C2,2,0)&RC[-29]&RC[-28]&RC[-27]&Sheet2!R1C3 -> #N/A | AG451: =IF(RC[-26]&RC[-25]&RC[-24]&RC[-23]&RC[-22]&RC[-21]="",,R1C6)&IF(RC[-26]="",,"|n"&R1C7&RC[-26])&IF(RC[-25]="",,"|n"&R1C8&RC[-25])&IF(RC[-24]="",,"|n"&R1C9&RC[-24])&IF(RC[-23]="",,"|n"&R1C10&RC[-23])&IF(RC[-22]="",,"|n"&R1C11&RC[-22])&IF(RC[-21]="",,"|n"&R1C12&RC[-21])&IF(RC[-19]&RC[-18]&RC[-17]&RC[-16]="",,"|n"&R1C13)&IF(RC[-19]="",,"|n"&R1C14&RC[-19])&IF(RC[-18]="",,"|n"&R1C15&RC[-18])&IF(RC[-17]="",,"|n"&R1C16&RC[-17])&IF(RC[-16]="",,"|n"&R1C17&RC[-16])&IF(RC[-15]="",,"|n"&R1C18&RC[-15])&IF(RC[-14]="",,"|n"&R1C19&RC[-14])&IF(RC[-13]="",,"|n"&R1C20&RC[-13])&IF(RC[-12]="",,"|n"&R1C21&RC[-12])&IF(RC[-10]="",,"|n"&R1C23&RC[-10])&IF(RC[-9]="",,"|n"&R1C24&RC[-9])&IF(RC[-8]="",,"|n"&R1C25&RC[-8])&IF(RC[-7]="",,"|n"&R1C26&RC[-7])&IF(RC[-6]="",,"|n"&R1C27&RC[-6])&IF(RC[-5]="",,"|n"&R1C28&RC[-5])&IF(RC[-2]="",,"|n"&RC[-2]) -> 
AF452: =VLOOKUP(RC[-31],Sheet2!R13C1:R18C2,2,0)&"."&VLOOKUP(RC[-30],Sheet2!R7C1:R11C2,2,0)&VLOOKUP(RC[-30],Sheet2!R1C1:R5C2,2,0)&RC[-29]&RC[-28]&RC[-27]&Sheet2!R1C3 -> #N/A | AG452: =IF(RC[-26]&RC[-25]&RC[-24]&RC[-23]&RC[-22]&RC[-21]="",,R1C6)&IF(RC[-26]="",,"|n"&R1C7&RC[-26])&IF(RC[-25]="",,"|n"&R1C8&RC[-25])&IF(RC[-24]="",,"|n"&R1C9&RC[-24])&IF(RC[-23]="",,"|n"&R1C10&RC[-23])&IF(RC[-22]="",,"|n"&R1C11&RC[-22])&IF(RC[-21]="",,"|n"&R1C12&RC[-21])&IF(RC[-19]&RC[-18]&RC[-17]&RC[-16]="",,"|n"&R1C13)&IF(RC[-19]="",,"|n"&R1C14&RC[-19])&IF(RC[-18]="",,"|n"&R1C15&RC[-18])&IF(RC[-17]="",,"|n"&R1C16&RC[-17])&IF(RC[-16]="",,"|n"&R1C17&RC[-16])&IF(RC[-15]="",,"|n"&R1C18&RC[-15])&IF(RC[-14]="",,"|n"&R1C19&RC[-14])&IF(RC[-13]="",,"|n"&R1C20&RC[-13])&IF(RC[-12]="",,"|n"&R1C21&RC[-12])&IF(RC[-10]="",,"|n"&R1C23&RC[-10])&IF(RC[-9]="",,"|n"&R1C24&RC[-9])&IF(RC[-8]="",,"|n"&R1C25&RC[-8])&IF(RC[-7]="",,"|n"&R1C26&RC[-7])&IF(RC[-6]="",,"|n"&R1C27&RC[-6])&IF(RC[-5]="",,"|n"&R1C28&RC[-5])&IF(RC[-2]="",,"|n"&RC[-2]) -> 
AF453: =VLOOKUP(RC[-31],Sheet2!R13C1:R18C2,2,0)&"."&VLOOKUP(RC[-30],Sheet2!R7C1:R11C2,2,0)&VLOOKUP(RC[-30],Sheet2!R1C1:R5C2,2,0)&RC[-29]&RC[-28]&RC[-27]&Sheet2!R1C3 -> #N/A | AG453: =IF(RC[-26]&RC[-25]&RC[-24]&RC[-23]&RC[-22]&RC[-21]="",,R1C6)&IF(RC[-26]="",,"|n"&R1C7&RC[-26])&IF(RC[-25]="",,"|n"&R1C8&RC[-25])&IF(RC[-24]="",,"|n"&R1C9&RC[-24])&IF(RC[-23]="",,"|n"&R1C10&RC[-23])&IF(RC[-22]="",,"|n"&R1C11&RC[-22])&IF(RC[-21]="",,"|n"&R1C12&RC[-21])&IF(RC[-19]&RC[-18]&RC[-17]&RC[-16]="",,"|n"&R1C13)&IF(RC[-19]="",,"|n"&R1C14&RC[-19])&IF(RC[-18]="",,"|n"&R1C15&RC[-18])&IF(RC[-17]="",,"|n"&R1C16&RC[-17])&IF(RC[-16]="",,"|n"&R1C17&RC[-16])&IF(RC[-15]="",,"|n"&R1C18&RC[-15])&IF(RC[-14]="",,"|n"&R1C19&RC[-14])&IF(RC[-13]="",,"|n"&R1C20&RC[-13])&IF(RC[-12]="",,"|n"&R1C21&RC[-12])&IF(RC[-10]="",,"|n"&R1C23&RC[-10])&IF(RC[-9]="",,"|n"&R1C24&RC[-9])&IF(RC[-8]="",,"|n"&R1C25&RC[-8])&IF(RC[-7]="",,"|n"&R1C26&RC[-7])&IF(RC[-6]="",,"|n"&R1C27&RC[-6])&IF(RC[-5]="",,"|n"&R1C28&RC[-5])&IF(RC[-2]="",,"|n"&RC[-2]) -> 
AF454: =VLOOKUP(RC[-31],Sheet2!R13C1:R18C2,2,0)&"."&VLOOKUP(RC[-30],Sheet2!R7C1:R11C2,2,0)&VLOOKUP(RC[-30],Sheet2!R1C1:R5C2,2,0)&RC[-29]&RC[-28]&RC[-27]&Sheet2!R1C3 -> #N/A | AG454: =IF(RC[-26]&RC[-25]&RC[-24]&RC[-23]&RC[-22]&RC[-21]="",,R1C6)&IF(RC[-26]="",,"|n"&R1C7&RC[-26])&IF(RC[-25]="",,"|n"&R1C8&RC[-25])&IF(RC[-24]="",,"|n"&R1C9&RC[-24])&IF(RC[-23]="",,"|n"&R1C10&RC[-23])&IF(RC[-22]="",,"|n"&R1C11&RC[-22])&IF(RC[-21]="",,"|n"&R1C12&RC[-21])&IF(RC[-19]&RC[-18]&RC[-17]&RC[-16]="",,"|n"&R1C13)&IF(RC[-19]="",,"|n"&R1C14&RC[-19])&IF(RC[-18]="",,"|n"&R1C15&RC[-18])&IF(RC[-17]="",,"|n"&R1C16&RC[-17])&IF(RC[-16]="",,"|n"&R1C17&RC[-16])&IF(RC[-15]="",,"|n"&R1C18&RC[-15])&IF(RC[-14]="",,"|n"&R1C19&RC[-14])&IF(RC[-13]="",,"|n"&R1C20&RC[-13])&IF(RC[-12]="",,"|n"&R1C21&RC[-12])&IF(RC[-10]="",,"|n"&R1C23&RC[-10])&IF(RC[-9]="",,"|n"&R1C24&RC[-9])&IF(RC[-8]="",,"|n"&R1C25&RC[-8])&IF(RC[-7]="",,"|n"&R1C26&RC[-7])&IF(RC[-6]="",,"|n"&R1C27&RC[-6])&IF(RC[-5]="",,"|n"&R1C28&RC[-5])&IF(RC[-2]="",,"|n"&RC[-2]) -> 
AF455: =VLOOKUP(RC[-31],Sheet2!R13C1:R18C2,2,0)&"."&VLOOKUP(RC[-30],Sheet2!R7C1:R11C2,2,0)&VLOOKUP(RC[-30],Sheet2!R1C1:R5C2,2,0)&RC[-29]&RC[-28]&RC[-27]&Sheet2!R1C3 -> #N/A | AG455: =IF(RC[-26]&RC[-25]&RC[-24]&RC[-23]&RC[-22]&RC[-21]="",,R1C6)&IF(RC[-26]="",,"|n"&R1C7&RC[-26])&IF(RC[-25]="",,"|n"&R1C8&RC[-25])&IF(RC[-24]="",,"|n"&R1C9&RC[-24])&IF(RC[-23]="",,"|n"&R1C10&RC[-23])&IF(RC[-22]="",,"|n"&R1C11&RC[-22])&IF(RC[-21]="",,"|n"&R1C12&RC[-21])&IF(RC[-19]&RC[-18]&RC[-17]&RC[-16]="",,"|n"&R1C13)&IF(RC[-19]="",,"|n"&R1C14&RC[-19])&IF(RC[-18]="",,"|n"&R1C15&RC[-18])&IF(RC[-17]="",,"|n"&R1C16&RC[-17])&IF(RC[-16]="",,"|n"&R1C17&RC[-16])&IF(RC[-15]="",,"|n"&R1C18&RC[-15])&IF(RC[-14]="",,"|n"&R1C19&RC[-14])&IF(RC[-13]="",,"|n"&R1C20&RC[-13])&IF(RC[-12]="",,"|n"&R1C21&RC[-12])&IF(RC[-10]="",,"|n"&R1C23&RC[-10])&IF(RC[-9]="",,"|n"&R1C24&RC[-9])&IF(RC[-8]="",,"|n"&R1C25&RC[-8])&IF(RC[-7]="",,"|n"&R1C26&RC[-7])&IF(RC[-6]="",,"|n"&R1C27&RC[-6])&IF(RC[-5]="",,"|n"&R1C28&RC[-5])&IF(RC[-2]="",,"|n"&RC[-2]) -> 
AF456: =VLOOKUP(RC[-31],Sheet2!R13C1:R18C2,2,0)&"."&VLOOKUP(RC[-30],Sheet2!R7C1:R11C2,2,0)&VLOOKUP(RC[-30],Sheet2!R1C1:R5C2,2,0)&RC[-29]&RC[-28]&RC[-27]&Sheet2!R1C3 -> #N/A | AG456: =IF(RC[-26]&RC[-25]&RC[-24]&RC[-23]&RC[-22]&RC[-21]="",,R1C6)&IF(RC[-26]="",,"|n"&R1C7&RC[-26])&IF(RC[-25]="",,"|n"&R1C8&RC[-25])&IF(RC[-24]="",,"|n"&R1C9&RC[-24])&IF(RC[-23]="",,"|n"&R1C10&RC[-23])&IF(RC[-22]="",,"|n"&R1C11&RC[-22])&IF(RC[-21]="",,"|n"&R1C12&RC[-21])&IF(RC[-19]&RC[-18]&RC[-17]&RC[-16]="",,"|n"&R1C13)&IF(RC[-19]="",,"|n"&R1C14&RC[-19])&IF(RC[-18]="",,"|n"&R1C15&RC[-18])&IF(RC[-17]="",,"|n"&R1C16&RC[-17])&IF(RC[-16]="",,"|n"&R1C17&RC[-16])&IF(RC[-15]="",,"|n"&R1C18&RC[-15])&IF(RC[-14]="",,"|n"&R1C19&RC[-14])&IF(RC[-13]="",,"|n"&R1C20&RC[-13])&IF(RC[-12]="",,"|n"&R1C21&RC[-12])&IF(RC[-10]="",,"|n"&R1C23&RC[-10])&IF(RC[-9]="",,"|n"&R1C24&RC[-9])&IF(RC[-8]="",,"|n"&R1C25&RC[-8])&IF(RC[-7]="",,"|n"&R1C26&RC[-7])&IF(RC[-6]="",,"|n"&R1C27&RC[-6])&IF(RC[-5]="",,"|n"&R1C28&RC[-5])&IF(RC[-2]="",,"|n"&RC[-2]) -> 
AF457: =VLOOKUP(RC[-31],Sheet2!R13C1:R18C2,2,0)&"."&VLOOKUP(RC[-30],Sheet2!R7C1:R11C2,2,0)&VLOOKUP(RC[-30],Sheet2!R1C1:R5C2,2,0)&RC[-29]&RC[-28]&RC[-27]&Sheet2!R1C3 -> #N/A | AG457: =IF(RC[-26]&RC[-25]&RC[-24]&RC[-23]&RC[-22]&RC[-21]="",,R1C6)&IF(RC[-26]="",,"|n"&R1C7&RC[-26])&IF(RC[-25]="",,"|n"&R1C8&RC[-25])&IF(RC[-24]="",,"|n"&R1C9&RC[-24])&IF(RC[-23]="",,"|n"&R1C10&RC[-23])&IF(RC[-22]="",,"|n"&R1C11&RC[-22])&IF(RC[-21]="",,"|n"&R1C12&RC[-21])&IF(RC[-19]&RC[-18]&RC[-17]&RC[-16]="",,"|n"&R1C13)&IF(RC[-19]="",,"|n"&R1C14&RC[-19])&IF(RC[-18]="",,"|n"&R1C15&RC[-18])&IF(RC[-17]="",,"|n"&R1C16&RC[-17])&IF(RC[-16]="",,"|n"&R1C17&RC[-16])&IF(RC[-15]="",,"|n"&R1C18&RC[-15])&IF(RC[-14]="",,"|n"&R1C19&RC[-14])&IF(RC[-13]="",,"|n"&R1C20&RC[-13])&IF(RC[-12]="",,"|n"&R1C21&RC[-12])&IF(RC[-10]="",,"|n"&R1C23&RC[-10])&IF(RC[-9]="",,"|n"&R1C24&RC[-9])&IF(RC[-8]="",,"|n"&R1C25&RC[-8])&IF(RC[-7]="",,"|n"&R1C26&RC[-7])&IF(RC[-6]="",,"|n"&R1C27&RC[-6])&IF(RC[-5]="",,"|n"&R1C28&RC[-5])&IF(RC[-2]="",,"|n"&RC[-2]) -> 
AF458: =VLOOKUP(RC[-31],Sheet2!R13C1:R18C2,2,0)&"."&VLOOKUP(RC[-30],Sheet2!R7C1:R11C2,2,0)&VLOOKUP(RC[-30],Sheet2!R1C1:R5C2,2,0)&RC[-29]&RC[-28]&RC[-27]&Sheet2!R1C3 -> #N/A | AG458: =IF(RC[-26]&RC[-25]&RC[-24]&RC[-23]&RC[-22]&RC[-21]="",,R1C6)&IF(RC[-26]="",,"|n"&R1C7&RC[-26])&IF(RC[-25]="",,"|n"&R1C8&RC[-25])&IF(RC[-24]="",,"|n"&R1C9&RC[-24])&IF(RC[-23]="",,"|n"&R1C10&RC[-23])&IF(RC[-22]="",,"|n"&R1C11&RC[-22])&IF(RC[-21]="",,"|n"&R1C12&RC[-21])&IF(RC[-19]&RC[-18]&RC[-17]&RC[-16]="",,"|n"&R1C13)&IF(RC[-19]="",,"|n"&R1C14&RC[-19])&IF(RC[-18]="",,"|n"&R1C15&RC[-18])&IF(RC[-17]="",,"|n"&R1C16&RC[-17])&IF(RC[-16]="",,"|n"&R1C17&RC[-16])&IF(RC[-15]="",,"|n"&R1C18&RC[-15])&IF(RC[-14]="",,"|n"&R1C19&RC[-14])&IF(RC[-13]="",,"|n"&R1C20&RC[-13])&IF(RC[-12]="",,"|n"&R1C21&RC[-12])&IF(RC[-10]="",,"|n"&R1C23&RC[-10])&IF(RC[-9]="",,"|n"&R1C24&RC[-9])&IF(RC[-8]="",,"|n"&R1C25&RC[-8])&IF(RC[-7]="",,"|n"&R1C26&RC[-7])&IF(RC[-6]="",,"|n"&R1C27&RC[-6])&IF(RC[-5]="",,"|n"&R1C28&RC[-5])&IF(RC[-2]="",,"|n"&RC[-2]) -> 
AF459: =VLOOKUP(RC[-31],Sheet2!R13C1:R18C2,2,0)&"."&VLOOKUP(RC[-30],Sheet2!R7C1:R11C2,2,0)&VLOOKUP(RC[-30],Sheet2!R1C1:R5C2,2,0)&RC[-29]&RC[-28]&RC[-27]&Sheet2!R1C3 -> #N/A | AG459: =IF(RC[-26]&RC[-25]&RC[-24]&RC[-23]&RC[-22]&RC[-21]="",,R1C6)&IF(RC[-26]="",,"|n"&R1C7&RC[-26])&IF(RC[-25]="",,"|n"&R1C8&RC[-25])&IF(RC[-24]="",,"|n"&R1C9&RC[-24])&IF(RC[-23]="",,"|n"&R1C10&RC[-23])&IF(RC[-22]="",,"|n"&R1C11&RC[-22])&IF(RC[-21]="",,"|n"&R1C12&RC[-21])&IF(RC[-19]&RC[-18]&RC[-17]&RC[-16]="",,"|n"&R1C13)&IF(RC[-19]="",,"|n"&R1C14&RC[-19])&IF(RC[-18]="",,"|n"&R1C15&RC[-18])&IF(RC[-17]="",,"|n"&R1C16&RC[-17])&IF(RC[-16]="",,"|n"&R1C17&RC[-16])&IF(RC[-15]="",,"|n"&R1C18&RC[-15])&IF(RC[-14]="",,"|n"&R1C19&RC[-14])&IF(RC[-13]="",,"|n"&R1C20&RC[-13])&IF(RC[-12]="",,"|n"&R1C21&RC[-12])&IF(RC[-10]="",,"|n"&R1C23&RC[-10])&IF(RC[-9]="",,"|n"&R1C24&RC[-9])&IF(RC[-8]="",,"|n"&R1C25&RC[-8])&IF(RC[-7]="",,"|n"&R1C26&RC[-7])&IF(RC[-6]="",,"|n"&R1C27&RC[-6])&IF(RC[-5]="",,"|n"&R1C28&RC[-5])&IF(RC[-2]="",,"|n"&RC[-2]) -> 
AF460: =VLOOKUP(RC[-31],Sheet2!R13C1:R18C2,2,0)&"."&VLOOKUP(RC[-30],Sheet2!R7C1:R11C2,2,0)&VLOOKUP(RC[-30],Sheet2!R1C1:R5C2,2,0)&RC[-29]&RC[-28]&RC[-27]&Sheet2!R1C3 -> #N/A | AG460: =IF(RC[-26]&RC[-25]&RC[-24]&RC[-23]&RC[-22]&RC[-21]="",,R1C6)&IF(RC[-26]="",,"|n"&R1C7&RC[-26])&IF(RC[-25]="",,"|n"&R1C8&RC[-25])&IF(RC[-24]="",,"|n"&R1C9&RC[-24])&IF(RC[-23]="",,"|n"&R1C10&RC[-23])&IF(RC[-22]="",,"|n"&R1C11&RC[-22])&IF(RC[-21]="",,"|n"&R1C12&RC[-21])&IF(RC[-19]&RC[-18]&RC[-17]&RC[-16]="",,"|n"&R1C13)&IF(RC[-19]="",,"|n"&R1C14&RC[-19])&IF(RC[-18]="",,"|n"&R1C15&RC[-18])&IF(RC[-17]="",,"|n"&R1C16&RC[-17])&IF(RC[-16]="",,"|n"&R1C17&RC[-16])&IF(RC[-15]="",,"|n"&R1C18&RC[-15])&IF(RC[-14]="",,"|n"&R1C19&RC[-14])&IF(RC[-13]="",,"|n"&R1C20&RC[-13])&IF(RC[-12]="",,"|n"&R1C21&RC[-12])&IF(RC[-10]="",,"|n"&R1C23&RC[-10])&IF(RC[-9]="",,"|n"&R1C24&RC[-9])&IF(RC[-8]="",,"|n"&R1C25&RC[-8])&IF(RC[-7]="",,"|n"&R1C26&RC[-7])&IF(RC[-6]="",,"|n"&R1C27&RC[-6])&IF(RC[-5]="",,"|n"&R1C28&RC[-5])&IF(RC[-2]="",,"|n"&RC[-2]) -> 
AF461: =VLOOKUP(RC[-31],Sheet2!R13C1:R18C2,2,0)&"."&VLOOKUP(RC[-30],Sheet2!R7C1:R11C2,2,0)&VLOOKUP(RC[-30],Sheet2!R1C1:R5C2,2,0)&RC[-29]&RC[-28]&RC[-27]&Sheet2!R1C3 -> #N/A | AG461: =IF(RC[-26]&RC[-25]&RC[-24]&RC[-23]&RC[-22]&RC[-21]="",,R1C6)&IF(RC[-26]="",,"|n"&R1C7&RC[-26])&IF(RC[-25]="",,"|n"&R1C8&RC[-25])&IF(RC[-24]="",,"|n"&R1C9&RC[-24])&IF(RC[-23]="",,"|n"&R1C10&RC[-23])&IF(RC[-22]="",,"|n"&R1C11&RC[-22])&IF(RC[-21]="",,"|n"&R1C12&RC[-21])&IF(RC[-19]&RC[-18]&RC[-17]&RC[-16]="",,"|n"&R1C13)&IF(RC[-19]="",,"|n"&R1C14&RC[-19])&IF(RC[-18]="",,"|n"&R1C15&RC[-18])&IF(RC[-17]="",,"|n"&R1C16&RC[-17])&IF(RC[-16]="",,"|n"&R1C17&RC[-16])&IF(RC[-15]="",,"|n"&R1C18&RC[-15])&IF(RC[-14]="",,"|n"&R1C19&RC[-14])&IF(RC[-13]="",,"|n"&R1C20&RC[-13])&IF(RC[-12]="",,"|n"&R1C21&RC[-12])&IF(RC[-10]="",,"|n"&R1C23&RC[-10])&IF(RC[-9]="",,"|n"&R1C24&RC[-9])&IF(RC[-8]="",,"|n"&R1C25&RC[-8])&IF(RC[-7]="",,"|n"&R1C26&RC[-7])&IF(RC[-6]="",,"|n"&R1C27&RC[-6])&IF(RC[-5]="",,"|n"&R1C28&RC[-5])&IF(RC[-2]="",,"|n"&RC[-2]) -> 
AF462: =VLOOKUP(RC[-31],Sheet2!R13C1:R18C2,2,0)&"."&VLOOKUP(RC[-30],Sheet2!R7C1:R11C2,2,0)&VLOOKUP(RC[-30],Sheet2!R1C1:R5C2,2,0)&RC[-29]&RC[-28]&RC[-27]&Sheet2!R1C3 -> #N/A | AG462: =IF(RC[-26]&RC[-25]&RC[-24]&RC[-23]&RC[-22]&RC[-21]="",,R1C6)&IF(RC[-26]="",,"|n"&R1C7&RC[-26])&IF(RC[-25]="",,"|n"&R1C8&RC[-25])&IF(RC[-24]="",,"|n"&R1C9&RC[-24])&IF(RC[-23]="",,"|n"&R1C10&RC[-23])&IF(RC[-22]="",,"|n"&R1C11&RC[-22])&IF(RC[-21]="",,"|n"&R1C12&RC[-21])&IF(RC[-19]&RC[-18]&RC[-17]&RC[-16]="",,"|n"&R1C13)&IF(RC[-19]="",,"|n"&R1C14&RC[-19])&IF(RC[-18]="",,"|n"&R1C15&RC[-18])&IF(RC[-17]="",,"|n"&R1C16&RC[-17])&IF(RC[-16]="",,"|n"&R1C17&RC[-16])&IF(RC[-15]="",,"|n"&R1C18&RC[-15])&IF(RC[-14]="",,"|n"&R1C19&RC[-14])&IF(RC[-13]="",,"|n"&R1C20&RC[-13])&IF(RC[-12]="",,"|n"&R1C21&RC[-12])&IF(RC[-10]="",,"|n"&R1C23&RC[-10])&IF(RC[-9]="",,"|n"&R1C24&RC[-9])&IF(RC[-8]="",,"|n"&R1C25&RC[-8])&IF(RC[-7]="",,"|n"&R1C26&RC[-7])&IF(RC[-6]="",,"|n"&R1C27&RC[-6])&IF(RC[-5]="",,"|n"&R1C28&RC[-5])&IF(RC[-2]="",,"|n"&RC[-2]) -> 
AF463: =VLOOKUP(RC[-31],Sheet2!R13C1:R18C2,2,0)&"."&VLOOKUP(RC[-30],Sheet2!R7C1:R11C2,2,0)&VLOOKUP(RC[-30],Sheet2!R1C1:R5C2,2,0)&RC[-29]&RC[-28]&RC[-27]&Sheet2!R1C3 -> #N/A | AG463: =IF(RC[-26]&RC[-25]&RC[-24]&RC[-23]&RC[-22]&RC[-21]="",,R1C6)&IF(RC[-26]="",,"|n"&R1C7&RC[-26])&IF(RC[-25]="",,"|n"&R1C8&RC[-25])&IF(RC[-24]="",,"|n"&R1C9&RC[-24])&IF(RC[-23]="",,"|n"&R1C10&RC[-23])&IF(RC[-22]="",,"|n"&R1C11&RC[-22])&IF(RC[-21]="",,"|n"&R1C12&RC[-21])&IF(RC[-19]&RC[-18]&RC[-17]&RC[-16]="",,"|n"&R1C13)&IF(RC[-19]="",,"|n"&R1C14&RC[-19])&IF(RC[-18]="",,"|n"&R1C15&RC[-18])&IF(RC[-17]="",,"|n"&R1C16&RC[-17])&IF(RC[-16]="",,"|n"&R1C17&RC[-16])&IF(RC[-15]="",,"|n"&R1C18&RC[-15])&IF(RC[-14]="",,"|n"&R1C19&RC[-14])&IF(RC[-13]="",,"|n"&R1C20&RC[-13])&IF(RC[-12]="",,"|n"&R1C21&RC[-12])&IF(RC[-10]="",,"|n"&R1C23&RC[-10])&IF(RC[-9]="",,"|n"&R1C24&RC[-9])&IF(RC[-8]="",,"|n"&R1C25&RC[-8])&IF(RC[-7]="",,"|n"&R1C26&RC[-7])&IF(RC[-6]="",,"|n"&R1C27&RC[-6])&IF(RC[-5]="",,"|n"&R1C28&RC[-5])&IF(RC[-2]="",,"|n"&RC[-2]) -> 
AF464: =VLOOKUP(RC[-31],Sheet2!R13C1:R18C2,2,0)&"."&VLOOKUP(RC[-30],Sheet2!R7C1:R11C2,2,0)&VLOOKUP(RC[-30],Sheet2!R1C1:R5C2,2,0)&RC[-29]&RC[-28]&RC[-27]&Sheet2!R1C3 -> #N/A | AG464: =IF(RC[-26]&RC[-25]&RC[-24]&RC[-23]&RC[-22]&RC[-21]="",,R1C6)&IF(RC[-26]="",,"|n"&R1C7&RC[-26])&IF(RC[-25]="",,"|n"&R1C8&RC[-25])&IF(RC[-24]="",,"|n"&R1C9&RC[-24])&IF(RC[-23]="",,"|n"&R1C10&RC[-23])&IF(RC[-22]="",,"|n"&R1C11&RC[-22])&IF(RC[-21]="",,"|n"&R1C12&RC[-21])&IF(RC[-19]&RC[-18]&RC[-17]&RC[-16]="",,"|n"&R1C13)&IF(RC[-19]="",,"|n"&R1C14&RC[-19])&IF(RC[-18]="",,"|n"&R1C15&RC[-18])&IF(RC[-17]="",,"|n"&R1C16&RC[-17])&IF(RC[-16]="",,"|n"&R1C17&RC[-16])&IF(RC[-15]="",,"|n"&R1C18&RC[-15])&IF(RC[-14]="",,"|n"&R1C19&RC[-14])&IF(RC[-13]="",,"|n"&R1C20&RC[-13])&IF(RC[-12]="",,"|n"&R1C21&RC[-12])&IF(RC[-10]="",,"|n"&R1C23&RC[-10])&IF(RC[-9]="",,"|n"&R1C24&RC[-9])&IF(RC[-8]="",,"|n"&R1C25&RC[-8])&IF(RC[-7]="",,"|n"&R1C26&RC[-7])&IF(RC[-6]="",,"|n"&R1C27&RC[-6])&IF(RC[-5]="",,"|n"&R1C28&RC[-5])&IF(RC[-2]="",,"|n"&RC[-2]) -> 
AF465: =VLOOKUP(RC[-31],Sheet2!R13C1:R18C2,2,0)&"."&VLOOKUP(RC[-30],Sheet2!R7C1:R11C2,2,0)&VLOOKUP(RC[-30],Sheet2!R1C1:R5C2,2,0)&RC[-29]&RC[-28]&RC[-27]&Sheet2!R1C3 -> #N/A | AG465: =IF(RC[-26]&RC[-25]&RC[-24]&RC[-23]&RC[-22]&RC[-21]="",,R1C6)&IF(RC[-26]="",,"|n"&R1C7&RC[-26])&IF(RC[-25]="",,"|n"&R1C8&RC[-25])&IF(RC[-24]="",,"|n"&R1C9&RC[-24])&IF(RC[-23]="",,"|n"&R1C10&RC[-23])&IF(RC[-22]="",,"|n"&R1C11&RC[-22])&IF(RC[-21]="",,"|n"&R1C12&RC[-21])&IF(RC[-19]&RC[-18]&RC[-17]&RC[-16]="",,"|n"&R1C13)&IF(RC[-19]="",,"|n"&R1C14&RC[-19])&IF(RC[-18]="",,"|n"&R1C15&RC[-18])&IF(RC[-17]="",,"|n"&R1C16&RC[-17])&IF(RC[-16]="",,"|n"&R1C17&RC[-16])&IF(RC[-15]="",,"|n"&R1C18&RC[-15])&IF(RC[-14]="",,"|n"&R1C19&RC[-14])&IF(RC[-13]="",,"|n"&R1C20&RC[-13])&IF(RC[-12]="",,"|n"&R1C21&RC[-12])&IF(RC[-10]="",,"|n"&R1C23&RC[-10])&IF(RC[-9]="",,"|n"&R1C24&RC[-9])&IF(RC[-8]="",,"|n"&R1C25&RC[-8])&IF(RC[-7]="",,"|n"&R1C26&RC[-7])&IF(RC[-6]="",,"|n"&R1C27&RC[-6])&IF(RC[-5]="",,"|n"&R1C28&RC[-5])&IF(RC[-2]="",,"|n"&RC[-2]) -> 
AF466: =VLOOKUP(RC[-31],Sheet2!R13C1:R18C2,2,0)&"."&VLOOKUP(RC[-30],Sheet2!R7C1:R11C2,2,0)&VLOOKUP(RC[-30],Sheet2!R1C1:R5C2,2,0)&RC[-29]&RC[-28]&RC[-27]&Sheet2!R1C3 -> #N/A | AG466: =IF(RC[-26]&RC[-25]&RC[-24]&RC[-23]&RC[-22]&RC[-21]="",,R1C6)&IF(RC[-26]="",,"|n"&R1C7&RC[-26])&IF(RC[-25]="",,"|n"&R1C8&RC[-25])&IF(RC[-24]="",,"|n"&R1C9&RC[-24])&IF(RC[-23]="",,"|n"&R1C10&RC[-23])&IF(RC[-22]="",,"|n"&R1C11&RC[-22])&IF(RC[-21]="",,"|n"&R1C12&RC[-21])&IF(RC[-19]&RC[-18]&RC[-17]&RC[-16]="",,"|n"&R1C13)&IF(RC[-19]="",,"|n"&R1C14&RC[-19])&IF(RC[-18]="",,"|n"&R1C15&RC[-18])&IF(RC[-17]="",,"|n"&R1C16&RC[-17])&IF(RC[-16]="",,"|n"&R1C17&RC[-16])&IF(RC[-15]="",,"|n"&R1C18&RC[-15])&IF(RC[-14]="",,"|n"&R1C19&RC[-14])&IF(RC[-13]="",,"|n"&R1C20&RC[-13])&IF(RC[-12]="",,"|n"&R1C21&RC[-12])&IF(RC[-10]="",,"|n"&R1C23&RC[-10])&IF(RC[-9]="",,"|n"&R1C24&RC[-9])&IF(RC[-8]="",,"|n"&R1C25&RC[-8])&IF(RC[-7]="",,"|n"&R1C26&RC[-7])&IF(RC[-6]="",,"|n"&R1C27&RC[-6])&IF(RC[-5]="",,"|n"&R1C28&RC[-5])&IF(RC[-2]="",,"|n"&RC[-2]) -> 
AF467: =VLOOKUP(RC[-31],Sheet2!R13C1:R18C2,2,0)&"."&VLOOKUP(RC[-30],Sheet2!R7C1:R11C2,2,0)&VLOOKUP(RC[-30],Sheet2!R1C1:R5C2,2,0)&RC[-29]&RC[-28]&RC[-27]&Sheet2!R1C3 -> #N/A | AG467: =IF(RC[-26]&RC[-25]&RC[-24]&RC[-23]&RC[-22]&RC[-21]="",,R1C6)&IF(RC[-26]="",,"|n"&R1C7&RC[-26])&IF(RC[-25]="",,"|n"&R1C8&RC[-25])&IF(RC[-24]="",,"|n"&R1C9&RC[-24])&IF(RC[-23]="",,"|n"&R1C10&RC[-23])&IF(RC[-22]="",,"|n"&R1C11&RC[-22])&IF(RC[-21]="",,"|n"&R1C12&RC[-21])&IF(RC[-19]&RC[-18]&RC[-17]&RC[-16]="",,"|n"&R1C13)&IF(RC[-19]="",,"|n"&R1C14&RC[-19])&IF(RC[-18]="",,"|n"&R1C15&RC[-18])&IF(RC[-17]="",,"|n"&R1C16&RC[-17])&IF(RC[-16]="",,"|n"&R1C17&RC[-16])&IF(RC[-15]="",,"|n"&R1C18&RC[-15])&IF(RC[-14]="",,"|n"&R1C19&RC[-14])&IF(RC[-13]="",,"|n"&R1C20&RC[-13])&IF(RC[-12]="",,"|n"&R1C21&RC[-12])&IF(RC[-10]="",,"|n"&R1C23&RC[-10])&IF(RC[-9]="",,"|n"&R1C24&RC[-9])&IF(RC[-8]="",,"|n"&R1C25&RC[-8])&IF(RC[-7]="",,"|n"&R1C26&RC[-7])&IF(RC[-6]="",,"|n"&R1C27&RC[-6])&IF(RC[-5]="",,"|n"&R1C28&RC[-5])&IF(RC[-2]="",,"|n"&RC[-2]) -> 
AF468: =VLOOKUP(RC[-31],Sheet2!R13C1:R18C2,2,0)&"."&VLOOKUP(RC[-30],Sheet2!R7C1:R11C2,2,0)&VLOOKUP(RC[-30],Sheet2!R1C1:R5C2,2,0)&RC[-29]&RC[-28]&RC[-27]&Sheet2!R1C3 -> #N/A | AG468: =IF(RC[-26]&RC[-25]&RC[-24]&RC[-23]&RC[-22]&RC[-21]="",,R1C6)&IF(RC[-26]="",,"|n"&R1C7&RC[-26])&IF(RC[-25]="",,"|n"&R1C8&RC[-25])&IF(RC[-24]="",,"|n"&R1C9&RC[-24])&IF(RC[-23]="",,"|n"&R1C10&RC[-23])&IF(RC[-22]="",,"|n"&R1C11&RC[-22])&IF(RC[-21]="",,"|n"&R1C12&RC[-21])&IF(RC[-19]&RC[-18]&RC[-17]&RC[-16]="",,"|n"&R1C13)&IF(RC[-19]="",,"|n"&R1C14&RC[-19])&IF(RC[-18]="",,"|n"&R1C15&RC[-18])&IF(RC[-17]="",,"|n"&R1C16&RC[-17])&IF(RC[-16]="",,"|n"&R1C17&RC[-16])&IF(RC[-15]="",,"|n"&R1C18&RC[-15])&IF(RC[-14]="",,"|n"&R1C19&RC[-14])&IF(RC[-13]="",,"|n"&R1C20&RC[-13])&IF(RC[-12]="",,"|n"&R1C21&RC[-12])&IF(RC[-10]="",,"|n"&R1C23&RC[-10])&IF(RC[-9]="",,"|n"&R1C24&RC[-9])&IF(RC[-8]="",,"|n"&R1C25&RC[-8])&IF(RC[-7]="",,"|n"&R1C26&RC[-7])&IF(RC[-6]="",,"|n"&R1C27&RC[-6])&IF(RC[-5]="",,"|n"&R1C28&RC[-5])&IF(RC[-2]="",,"|n"&RC[-2]) -> 
AF469: =VLOOKUP(RC[-31],Sheet2!R13C1:R18C2,2,0)&"."&VLOOKUP(RC[-30],Sheet2!R7C1:R11C2,2,0)&VLOOKUP(RC[-30],Sheet2!R1C1:R5C2,2,0)&RC[-29]&RC[-28]&RC[-27]&Sheet2!R1C3 -> #N/A | AG469: =IF(RC[-26]&RC[-25]&RC[-24]&RC[-23]&RC[-22]&RC[-21]="",,R1C6)&IF(RC[-26]="",,"|n"&R1C7&RC[-26])&IF(RC[-25]="",,"|n"&R1C8&RC[-25])&IF(RC[-24]="",,"|n"&R1C9&RC[-24])&IF(RC[-23]="",,"|n"&R1C10&RC[-23])&IF(RC[-22]="",,"|n"&R1C11&RC[-22])&IF(RC[-21]="",,"|n"&R1C12&RC[-21])&IF(RC[-19]&RC[-18]&RC[-17]&RC[-16]="",,"|n"&R1C13)&IF(RC[-19]="",,"|n"&R1C14&RC[-19])&IF(RC[-18]="",,"|n"&R1C15&RC[-18])&IF(RC[-17]="",,"|n"&R1C16&RC[-17])&IF(RC[-16]="",,"|n"&R1C17&RC[-16])&IF(RC[-15]="",,"|n"&R1C18&RC[-15])&IF(RC[-14]="",,"|n"&R1C19&RC[-14])&IF(RC[-13]="",,"|n"&R1C20&RC[-13])&IF(RC[-12]="",,"|n"&R1C21&RC[-12])&IF(RC[-10]="",,"|n"&R1C23&RC[-10])&IF(RC[-9]="",,"|n"&R1C24&RC[-9])&IF(RC[-8]="",,"|n"&R1C25&RC[-8])&IF(RC[-7]="",,"|n"&R1C26&RC[-7])&IF(RC[-6]="",,"|n"&R1C27&RC[-6])&IF(RC[-5]="",,"|n"&R1C28&RC[-5])&IF(RC[-2]="",,"|n"&RC[-2]) -> 
AF470: =VLOOKUP(RC[-31],Sheet2!R13C1:R18C2,2,0)&"."&VLOOKUP(RC[-30],Sheet2!R7C1:R11C2,2,0)&VLOOKUP(RC[-30],Sheet2!R1C1:R5C2,2,0)&RC[-29]&RC[-28]&RC[-27]&Sheet2!R1C3 -> #N/A | AG470: =IF(RC[-26]&RC[-25]&RC[-24]&RC[-23]&RC[-22]&RC[-21]="",,R1C6)&IF(RC[-26]="",,"|n"&R1C7&RC[-26])&IF(RC[-25]="",,"|n"&R1C8&RC[-25])&IF(RC[-24]="",,"|n"&R1C9&RC[-24])&IF(RC[-23]="",,"|n"&R1C10&RC[-23])&IF(RC[-22]="",,"|n"&R1C11&RC[-22])&IF(RC[-21]="",,"|n"&R1C12&RC[-21])&IF(RC[-19]&RC[-18]&RC[-17]&RC[-16]="",,"|n"&R1C13)&IF(RC[-19]="",,"|n"&R1C14&RC[-19])&IF(RC[-18]="",,"|n"&R1C15&RC[-18])&IF(RC[-17]="",,"|n"&R1C16&RC[-17])&IF(RC[-16]="",,"|n"&R1C17&RC[-16])&IF(RC[-15]="",,"|n"&R1C18&RC[-15])&IF(RC[-14]="",,"|n"&R1C19&RC[-14])&IF(RC[-13]="",,"|n"&R1C20&RC[-13])&IF(RC[-12]="",,"|n"&R1C21&RC[-12])&IF(RC[-10]="",,"|n"&R1C23&RC[-10])&IF(RC[-9]="",,"|n"&R1C24&RC[-9])&IF(RC[-8]="",,"|n"&R1C25&RC[-8])&IF(RC[-7]="",,"|n"&R1C26&RC[-7])&IF(RC[-6]="",,"|n"&R1C27&RC[-6])&IF(RC[-5]="",,"|n"&R1C28&RC[-5])&IF(RC[-2]="",,"|n"&RC[-2]) -> 
AF471: =VLOOKUP(RC[-31],Sheet2!R13C1:R18C2,2,0)&"."&VLOOKUP(RC[-30],Sheet2!R7C1:R11C2,2,0)&VLOOKUP(RC[-30],Sheet2!R1C1:R5C2,2,0)&RC[-29]&RC[-28]&RC[-27]&Sheet2!R1C3 -> #N/A | AG471: =IF(RC[-26]&RC[-25]&RC[-24]&RC[-23]&RC[-22]&RC[-21]="",,R1C6)&IF(RC[-26]="",,"|n"&R1C7&RC[-26])&IF(RC[-25]="",,"|n"&R1C8&RC[-25])&IF(RC[-24]="",,"|n"&R1C9&RC[-24])&IF(RC[-23]="",,"|n"&R1C10&RC[-23])&IF(RC[-22]="",,"|n"&R1C11&RC[-22])&IF(RC[-21]="",,"|n"&R1C12&RC[-21])&IF(RC[-19]&RC[-18]&RC[-17]&RC[-16]="",,"|n"&R1C13)&IF(RC[-19]="",,"|n"&R1C14&RC[-19])&IF(RC[-18]="",,"|n"&R1C15&RC[-18])&IF(RC[-17]="",,"|n"&R1C16&RC[-17])&IF(RC[-16]="",,"|n"&R1C17&RC[-16])&IF(RC[-15]="",,"|n"&R1C18&RC[-15])&IF(RC[-14]="",,"|n"&R1C19&RC[-14])&IF(RC[-13]="",,"|n"&R1C20&RC[-13])&IF(RC[-12]="",,"|n"&R1C21&RC[-12])&IF(RC[-10]="",,"|n"&R1C23&RC[-10])&IF(RC[-9]="",,"|n"&R1C24&RC[-9])&IF(RC[-8]="",,"|n"&R1C25&RC[-8])&IF(RC[-7]="",,"|n"&R1C26&RC[-7])&IF(RC[-6]="",,"|n"&R1C27&RC[-6])&IF(RC[-5]="",,"|n"&R1C28&RC[-5])&IF(RC[-2]="",,"|n"&RC[-2]) -> 
AF472: =VLOOKUP(RC[-31],Sheet2!R13C1:R18C2,2,0)&"."&VLOOKUP(RC[-30],Sheet2!R7C1:R11C2,2,0)&VLOOKUP(RC[-30],Sheet2!R1C1:R5C2,2,0)&RC[-29]&RC[-28]&RC[-27]&Sheet2!R1C3 -> #N/A | AG472: =IF(RC[-26]&RC[-25]&RC[-24]&RC[-23]&RC[-22]&RC[-21]="",,R1C6)&IF(RC[-26]="",,"|n"&R1C7&RC[-26])&IF(RC[-25]="",,"|n"&R1C8&RC[-25])&IF(RC[-24]="",,"|n"&R1C9&RC[-24])&IF(RC[-23]="",,"|n"&R1C10&RC[-23])&IF(RC[-22]="",,"|n"&R1C11&RC[-22])&IF(RC[-21]="",,"|n"&R1C12&RC[-21])&IF(RC[-19]&RC[-18]&RC[-17]&RC[-16]="",,"|n"&R1C13)&IF(RC[-19]="",,"|n"&R1C14&RC[-19])&IF(RC[-18]="",,"|n"&R1C15&RC[-18])&IF(RC[-17]="",,"|n"&R1C16&RC[-17])&IF(RC[-16]="",,"|n"&R1C17&RC[-16])&IF(RC[-15]="",,"|n"&R1C18&RC[-15])&IF(RC[-14]="",,"|n"&R1C19&RC[-14])&IF(RC[-13]="",,"|n"&R1C20&RC[-13])&IF(RC[-12]="",,"|n"&R1C21&RC[-12])&IF(RC[-10]="",,"|n"&R1C23&RC[-10])&IF(RC[-9]="",,"|n"&R1C24&RC[-9])&IF(RC[-8]="",,"|n"&R1C25&RC[-8])&IF(RC[-7]="",,"|n"&R1C26&RC[-7])&IF(RC[-6]="",,"|n"&R1C27&RC[-6])&IF(RC[-5]="",,"|n"&R1C28&RC[-5])&IF(RC[-2]="",,"|n"&RC[-2]) -> 
AF473: =VLOOKUP(RC[-31],Sheet2!R13C1:R18C2,2,0)&"."&VLOOKUP(RC[-30],Sheet2!R7C1:R11C2,2,0)&VLOOKUP(RC[-30],Sheet2!R1C1:R5C2,2,0)&RC[-29]&RC[-28]&RC[-27]&Sheet2!R1C3 -> #N/A | AG473: =IF(RC[-26]&RC[-25]&RC[-24]&RC[-23]&RC[-22]&RC[-21]="",,R1C6)&IF(RC[-26]="",,"|n"&R1C7&RC[-26])&IF(RC[-25]="",,"|n"&R1C8&RC[-25])&IF(RC[-24]="",,"|n"&R1C9&RC[-24])&IF(RC[-23]="",,"|n"&R1C10&RC[-23])&IF(RC[-22]="",,"|n"&R1C11&RC[-22])&IF(RC[-21]="",,"|n"&R1C12&RC[-21])&IF(RC[-19]&RC[-18]&RC[-17]&RC[-16]="",,"|n"&R1C13)&IF(RC[-19]="",,"|n"&R1C14&RC[-19])&IF(RC[-18]="",,"|n"&R1C15&RC[-18])&IF(RC[-17]="",,"|n"&R1C16&RC[-17])&IF(RC[-16]="",,"|n"&R1C17&RC[-16])&IF(RC[-15]="",,"|n"&R1C18&RC[-15])&IF(RC[-14]="",,"|n"&R1C19&RC[-14])&IF(RC[-13]="",,"|n"&R1C20&RC[-13])&IF(RC[-12]="",,"|n"&R1C21&RC[-12])&IF(RC[-10]="",,"|n"&R1C23&RC[-10])&IF(RC[-9]="",,"|n"&R1C24&RC[-9])&IF(RC[-8]="",,"|n"&R1C25&RC[-8])&IF(RC[-7]="",,"|n"&R1C26&RC[-7])&IF(RC[-6]="",,"|n"&R1C27&RC[-6])&IF(RC[-5]="",,"|n"&R1C28&RC[-5])&IF(RC[-2]="",,"|n"&RC[-2]) -> 
AF474: =VLOOKUP(RC[-31],Sheet2!R13C1:R18C2,2,0)&"."&VLOOKUP(RC[-30],Sheet2!R7C1:R11C2,2,0)&VLOOKUP(RC[-30],Sheet2!R1C1:R5C2,2,0)&RC[-29]&RC[-28]&RC[-27]&Sheet2!R1C3 -> #N/A | AG474: =IF(RC[-26]&RC[-25]&RC[-24]&RC[-23]&RC[-22]&RC[-21]="",,R1C6)&IF(RC[-26]="",,"|n"&R1C7&RC[-26])&IF(RC[-25]="",,"|n"&R1C8&RC[-25])&IF(RC[-24]="",,"|n"&R1C9&RC[-24])&IF(RC[-23]="",,"|n"&R1C10&RC[-23])&IF(RC[-22]="",,"|n"&R1C11&RC[-22])&IF(RC[-21]="",,"|n"&R1C12&RC[-21])&IF(RC[-19]&RC[-18]&RC[-17]&RC[-16]="",,"|n"&R1C13)&IF(RC[-19]="",,"|n"&R1C14&RC[-19])&IF(RC[-18]="",,"|n"&R1C15&RC[-18])&IF(RC[-17]="",,"|n"&R1C16&RC[-17])&IF(RC[-16]="",,"|n"&R1C17&RC[-16])&IF(RC[-15]="",,"|n"&R1C18&RC[-15])&IF(RC[-14]="",,"|n"&R1C19&RC[-14])&IF(RC[-13]="",,"|n"&R1C20&RC[-13])&IF(RC[-12]="",,"|n"&R1C21&RC[-12])&IF(RC[-10]="",,"|n"&R1C23&RC[-10])&IF(RC[-9]="",,"|n"&R1C24&RC[-9])&IF(RC[-8]="",,"|n"&R1C25&RC[-8])&IF(RC[-7]="",,"|n"&R1C26&RC[-7])&IF(RC[-6]="",,"|n"&R1C27&RC[-6])&IF(RC[-5]="",,"|n"&R1C28&RC[-5])&IF(RC[-2]="",,"|n"&RC[-2]) -> 
AF475: =VLOOKUP(RC[-31],Sheet2!R13C1:R18C2,2,0)&"."&VLOOKUP(RC[-30],Sheet2!R7C1:R11C2,2,0)&VLOOKUP(RC[-30],Sheet2!R1C1:R5C2,2,0)&RC[-29]&RC[-28]&RC[-27]&Sheet2!R1C3 -> #N/A | AG475: =IF(RC[-26]&RC[-25]&RC[-24]&RC[-23]&RC[-22]&RC[-21]="",,R1C6)&IF(RC[-26]="",,"|n"&R1C7&RC[-26])&IF(RC[-25]="",,"|n"&R1C8&RC[-25])&IF(RC[-24]="",,"|n"&R1C9&RC[-24])&IF(RC[-23]="",,"|n"&R1C10&RC[-23])&IF(RC[-22]="",,"|n"&R1C11&RC[-22])&IF(RC[-21]="",,"|n"&R1C12&RC[-21])&IF(RC[-19]&RC[-18]&RC[-17]&RC[-16]="",,"|n"&R1C13)&IF(RC[-19]="",,"|n"&R1C14&RC[-19])&IF(RC[-18]="",,"|n"&R1C15&RC[-18])&IF(RC[-17]="",,"|n"&R1C16&RC[-17])&IF(RC[-16]="",,"|n"&R1C17&RC[-16])&IF(RC[-15]="",,"|n"&R1C18&RC[-15])&IF(RC[-14]="",,"|n"&R1C19&RC[-14])&IF(RC[-13]="",,"|n"&R1C20&RC[-13])&IF(RC[-12]="",,"|n"&R1C21&RC[-12])&IF(RC[-10]="",,"|n"&R1C23&RC[-10])&IF(RC[-9]="",,"|n"&R1C24&RC[-9])&IF(RC[-8]="",,"|n"&R1C25&RC[-8])&IF(RC[-7]="",,"|n"&R1C26&RC[-7])&IF(RC[-6]="",,"|n"&R1C27&RC[-6])&IF(RC[-5]="",,"|n"&R1C28&RC[-5])&IF(RC[-2]="",,"|n"&RC[-2]) -> 
AF476: =VLOOKUP(RC[-31],Sheet2!R13C1:R18C2,2,0)&"."&VLOOKUP(RC[-30],Sheet2!R7C1:R11C2,2,0)&VLOOKUP(RC[-30],Sheet2!R1C1:R5C2,2,0)&RC[-29]&RC[-28]&RC[-27]&Sheet2!R1C3 -> #N/A | AG476: =IF(RC[-26]&RC[-25]&RC[-24]&RC[-23]&RC[-22]&RC[-21]="",,R1C6)&IF(RC[-26]="",,"|n"&R1C7&RC[-26])&IF(RC[-25]="",,"|n"&R1C8&RC[-25])&IF(RC[-24]="",,"|n"&R1C9&RC[-24])&IF(RC[-23]="",,"|n"&R1C10&RC[-23])&IF(RC[-22]="",,"|n"&R1C11&RC[-22])&IF(RC[-21]="",,"|n"&R1C12&RC[-21])&IF(RC[-19]&RC[-18]&RC[-17]&RC[-16]="",,"|n"&R1C13)&IF(RC[-19]="",,"|n"&R1C14&RC[-19])&IF(RC[-18]="",,"|n"&R1C15&RC[-18])&IF(RC[-17]="",,"|n"&R1C16&RC[-17])&IF(RC[-16]="",,"|n"&R1C17&RC[-16])&IF(RC[-15]="",,"|n"&R1C18&RC[-15])&IF(RC[-14]="",,"|n"&R1C19&RC[-14])&IF(RC[-13]="",,"|n"&R1C20&RC[-13])&IF(RC[-12]="",,"|n"&R1C21&RC[-12])&IF(RC[-10]="",,"|n"&R1C23&RC[-10])&IF(RC[-9]="",,"|n"&R1C24&RC[-9])&IF(RC[-8]="",,"|n"&R1C25&RC[-8])&IF(RC[-7]="",,"|n"&R1C26&RC[-7])&IF(RC[-6]="",,"|n"&R1C27&RC[-6])&IF(RC[-5]="",,"|n"&R1C28&RC[-5])&IF(RC[-2]="",,"|n"&RC[-2]) -> 
AF477: =VLOOKUP(RC[-31],Sheet2!R13C1:R18C2,2,0)&"."&VLOOKUP(RC[-30],Sheet2!R7C1:R11C2,2,0)&VLOOKUP(RC[-30],Sheet2!R1C1:R5C2,2,0)&RC[-29]&RC[-28]&RC[-27]&Sheet2!R1C3 -> #N/A | AG477: =IF(RC[-26]&RC[-25]&RC[-24]&RC[-23]&RC[-22]&RC[-21]="",,R1C6)&IF(RC[-26]="",,"|n"&R1C7&RC[-26])&IF(RC[-25]="",,"|n"&R1C8&RC[-25])&IF(RC[-24]="",,"|n"&R1C9&RC[-24])&IF(RC[-23]="",,"|n"&R1C10&RC[-23])&IF(RC[-22]="",,"|n"&R1C11&RC[-22])&IF(RC[-21]="",,"|n"&R1C12&RC[-21])&IF(RC[-19]&RC[-18]&RC[-17]&RC[-16]="",,"|n"&R1C13)&IF(RC[-19]="",,"|n"&R1C14&RC[-19])&IF(RC[-18]="",,"|n"&R1C15&RC[-18])&IF(RC[-17]="",,"|n"&R1C16&RC[-17])&IF(RC[-16]="",,"|n"&R1C17&RC[-16])&IF(RC[-15]="",,"|n"&R1C18&RC[-15])&IF(RC[-14]="",,"|n"&R1C19&RC[-14])&IF(RC[-13]="",,"|n"&R1C20&RC[-13])&IF(RC[-12]="",,"|n"&R1C21&RC[-12])&IF(RC[-10]="",,"|n"&R1C23&RC[-10])&IF(RC[-9]="",,"|n"&R1C24&RC[-9])&IF(RC[-8]="",,"|n"&R1C25&RC[-8])&IF(RC[-7]="",,"|n"&R1C26&RC[-7])&IF(RC[-6]="",,"|n"&R1C27&RC[-6])&IF(RC[-5]="",,"|n"&R1C28&RC[-5])&IF(RC[-2]="",,"|n"&RC[-2]) -> 
AF478: =VLOOKUP(RC[-31],Sheet2!R13C1:R18C2,2,0)&"."&VLOOKUP(RC[-30],Sheet2!R7C1:R11C2,2,0)&VLOOKUP(RC[-30],Sheet2!R1C1:R5C2,2,0)&RC[-29]&RC[-28]&RC[-27]&Sheet2!R1C3 -> #N/A | AG478: =IF(RC[-26]&RC[-25]&RC[-24]&RC[-23]&RC[-22]&RC[-21]="",,R1C6)&IF(RC[-26]="",,"|n"&R1C7&RC[-26])&IF(RC[-25]="",,"|n"&R1C8&RC[-25])&IF(RC[-24]="",,"|n"&R1C9&RC[-24])&IF(RC[-23]="",,"|n"&R1C10&RC[-23])&IF(RC[-22]="",,"|n"&R1C11&RC[-22])&IF(RC[-21]="",,"|n"&R1C12&RC[-21])&IF(RC[-19]&RC[-18]&RC[-17]&RC[-16]="",,"|n"&R1C13)&IF(RC[-19]="",,"|n"&R1C14&RC[-19])&IF(RC[-18]="",,"|n"&R1C15&RC[-18])&IF(RC[-17]="",,"|n"&R1C16&RC[-17])&IF(RC[-16]="",,"|n"&R1C17&RC[-16])&IF(RC[-15]="",,"|n"&R1C18&RC[-15])&IF(RC[-14]="",,"|n"&R1C19&RC[-14])&IF(RC[-13]="",,"|n"&R1C20&RC[-13])&IF(RC[-12]="",,"|n"&R1C21&RC[-12])&IF(RC[-10]="",,"|n"&R1C23&RC[-10])&IF(RC[-9]="",,"|n"&R1C24&RC[-9])&IF(RC[-8]="",,"|n"&R1C25&RC[-8])&IF(RC[-7]="",,"|n"&R1C26&RC[-7])&IF(RC[-6]="",,"|n"&R1C27&RC[-6])&IF(RC[-5]="",,"|n"&R1C28&RC[-5])&IF(RC[-2]="",,"|n"&RC[-2]) -> 
AF479: =VLOOKUP(RC[-31],Sheet2!R13C1:R18C2,2,0)&"."&VLOOKUP(RC[-30],Sheet2!R7C1:R11C2,2,0)&VLOOKUP(RC[-30],Sheet2!R1C1:R5C2,2,0)&RC[-29]&RC[-28]&RC[-27]&Sheet2!R1C3 -> #N/A | AG479: =IF(RC[-26]&RC[-25]&RC[-24]&RC[-23]&RC[-22]&RC[-21]="",,R1C6)&IF(RC[-26]="",,"|n"&R1C7&RC[-26])&IF(RC[-25]="",,"|n"&R1C8&RC[-25])&IF(RC[-24]="",,"|n"&R1C9&RC[-24])&IF(RC[-23]="",,"|n"&R1C10&RC[-23])&IF(RC[-22]="",,"|n"&R1C11&RC[-22])&IF(RC[-21]="",,"|n"&R1C12&RC[-21])&IF(RC[-19]&RC[-18]&RC[-17]&RC[-16]="",,"|n"&R1C13)&IF(RC[-19]="",,"|n"&R1C14&RC[-19])&IF(RC[-18]="",,"|n"&R1C15&RC[-18])&IF(RC[-17]="",,"|n"&R1C16&RC[-17])&IF(RC[-16]="",,"|n"&R1C17&RC[-16])&IF(RC[-15]="",,"|n"&R1C18&RC[-15])&IF(RC[-14]="",,"|n"&R1C19&RC[-14])&IF(RC[-13]="",,"|n"&R1C20&RC[-13])&IF(RC[-12]="",,"|n"&R1C21&RC[-12])&IF(RC[-10]="",,"|n"&R1C23&RC[-10])&IF(RC[-9]="",,"|n"&R1C24&RC[-9])&IF(RC[-8]="",,"|n"&R1C25&RC[-8])&IF(RC[-7]="",,"|n"&R1C26&RC[-7])&IF(RC[-6]="",,"|n"&R1C27&RC[-6])&IF(RC[-5]="",,"|n"&R1C28&RC[-5])&IF(RC[-2]="",,"|n"&RC[-2]) -> 
AF480: =VLOOKUP(RC[-31],Sheet2!R13C1:R18C2,2,0)&"."&VLOOKUP(RC[-30],Sheet2!R7C1:R11C2,2,0)&VLOOKUP(RC[-30],Sheet2!R1C1:R5C2,2,0)&RC[-29]&RC[-28]&RC[-27]&Sheet2!R1C3 -> #N/A | AG480: =IF(RC[-26]&RC[-25]&RC[-24]&RC[-23]&RC[-22]&RC[-21]="",,R1C6)&IF(RC[-26]="",,"|n"&R1C7&RC[-26])&IF(RC[-25]="",,"|n"&R1C8&RC[-25])&IF(RC[-24]="",,"|n"&R1C9&RC[-24])&IF(RC[-23]="",,"|n"&R1C10&RC[-23])&IF(RC[-22]="",,"|n"&R1C11&RC[-22])&IF(RC[-21]="",,"|n"&R1C12&RC[-21])&IF(RC[-19]&RC[-18]&RC[-17]&RC[-16]="",,"|n"&R1C13)&IF(RC[-19]="",,"|n"&R1C14&RC[-19])&IF(RC[-18]="",,"|n"&R1C15&RC[-18])&IF(RC[-17]="",,"|n"&R1C16&RC[-17])&IF(RC[-16]="",,"|n"&R1C17&RC[-16])&IF(RC[-15]="",,"|n"&R1C18&RC[-15])&IF(RC[-14]="",,"|n"&R1C19&RC[-14])&IF(RC[-13]="",,"|n"&R1C20&RC[-13])&IF(RC[-12]="",,"|n"&R1C21&RC[-12])&IF(RC[-10]="",,"|n"&R1C23&RC[-10])&IF(RC[-9]="",,"|n"&R1C24&RC[-9])&IF(RC[-8]="",,"|n"&R1C25&RC[-8])&IF(RC[-7]="",,"|n"&R1C26&RC[-7])&IF(RC[-6]="",,"|n"&R1C27&RC[-6])&IF(RC[-5]="",,"|n"&R1C28&RC[-5])&IF(RC[-2]="",,"|n"&RC[-2]) -> 
AF481: =VLOOKUP(RC[-31],Sheet2!R13C1:R18C2,2,0)&"."&VLOOKUP(RC[-30],Sheet2!R7C1:R11C2,2,0)&VLOOKUP(RC[-30],Sheet2!R1C1:R5C2,2,0)&RC[-29]&RC[-28]&RC[-27]&Sheet2!R1C3 -> #N/A | AG481: =IF(RC[-26]&RC[-25]&RC[-24]&RC[-23]&RC[-22]&RC[-21]="",,R1C6)&IF(RC[-26]="",,"|n"&R1C7&RC[-26])&IF(RC[-25]="",,"|n"&R1C8&RC[-25])&IF(RC[-24]="",,"|n"&R1C9&RC[-24])&IF(RC[-23]="",,"|n"&R1C10&RC[-23])&IF(RC[-22]="",,"|n"&R1C11&RC[-22])&IF(RC[-21]="",,"|n"&R1C12&RC[-21])&IF(RC[-19]&RC[-18]&RC[-17]&RC[-16]="",,"|n"&R1C13)&IF(RC[-19]="",,"|n"&R1C14&RC[-19])&IF(RC[-18]="",,"|n"&R1C15&RC[-18])&IF(RC[-17]="",,"|n"&R1C16&RC[-17])&IF(RC[-16]="",,"|n"&R1C17&RC[-16])&IF(RC[-15]="",,"|n"&R1C18&RC[-15])&IF(RC[-14]="",,"|n"&R1C19&RC[-14])&IF(RC[-13]="",,"|n"&R1C20&RC[-13])&IF(RC[-12]="",,"|n"&R1C21&RC[-12])&IF(RC[-10]="",,"|n"&R1C23&RC[-10])&IF(RC[-9]="",,"|n"&R1C24&RC[-9])&IF(RC[-8]="",,"|n"&R1C25&RC[-8])&IF(RC[-7]="",,"|n"&R1C26&RC[-7])&IF(RC[-6]="",,"|n"&R1C27&RC[-6])&IF(RC[-5]="",,"|n"&R1C28&RC[-5])&IF(RC[-2]="",,"|n"&RC[-2]) -> 
AF482: =VLOOKUP(RC[-31],Sheet2!R13C1:R18C2,2,0)&"."&VLOOKUP(RC[-30],Sheet2!R7C1:R11C2,2,0)&VLOOKUP(RC[-30],Sheet2!R1C1:R5C2,2,0)&RC[-29]&RC[-28]&RC[-27]&Sheet2!R1C3 -> #N/A | AG482: =IF(RC[-26]&RC[-25]&RC[-24]&RC[-23]&RC[-22]&RC[-21]="",,R1C6)&IF(RC[-26]="",,"|n"&R1C7&RC[-26])&IF(RC[-25]="",,"|n"&R1C8&RC[-25])&IF(RC[-24]="",,"|n"&R1C9&RC[-24])&IF(RC[-23]="",,"|n"&R1C10&RC[-23])&IF(RC[-22]="",,"|n"&R1C11&RC[-22])&IF(RC[-21]="",,"|n"&R1C12&RC[-21])&IF(RC[-19]&RC[-18]&RC[-17]&RC[-16]="",,"|n"&R1C13)&IF(RC[-19]="",,"|n"&R1C14&RC[-19])&IF(RC[-18]="",,"|n"&R1C15&RC[-18])&IF(RC[-17]="",,"|n"&R1C16&RC[-17])&IF(RC[-16]="",,"|n"&R1C17&RC[-16])&IF(RC[-15]="",,"|n"&R1C18&RC[-15])&IF(RC[-14]="",,"|n"&R1C19&RC[-14])&IF(RC[-13]="",,"|n"&R1C20&RC[-13])&IF(RC[-12]="",,"|n"&R1C21&RC[-12])&IF(RC[-10]="",,"|n"&R1C23&RC[-10])&IF(RC[-9]="",,"|n"&R1C24&RC[-9])&IF(RC[-8]="",,"|n"&R1C25&RC[-8])&IF(RC[-7]="",,"|n"&R1C26&RC[-7])&IF(RC[-6]="",,"|n"&R1C27&RC[-6])&IF(RC[-5]="",,"|n"&R1C28&RC[-5])&IF(RC[-2]="",,"|n"&RC[-2]) -> 
AF483: =VLOOKUP(RC[-31],Sheet2!R13C1:R18C2,2,0)&"."&VLOOKUP(RC[-30],Sheet2!R7C1:R11C2,2,0)&VLOOKUP(RC[-30],Sheet2!R1C1:R5C2,2,0)&RC[-29]&RC[-28]&RC[-27]&Sheet2!R1C3 -> #N/A | AG483: =IF(RC[-26]&RC[-25]&RC[-24]&RC[-23]&RC[-22]&RC[-21]="",,R1C6)&IF(RC[-26]="",,"|n"&R1C7&RC[-26])&IF(RC[-25]="",,"|n"&R1C8&RC[-25])&IF(RC[-24]="",,"|n"&R1C9&RC[-24])&IF(RC[-23]="",,"|n"&R1C10&RC[-23])&IF(RC[-22]="",,"|n"&R1C11&RC[-22])&IF(RC[-21]="",,"|n"&R1C12&RC[-21])&IF(RC[-19]&RC[-18]&RC[-17]&RC[-16]="",,"|n"&R1C13)&IF(RC[-19]="",,"|n"&R1C14&RC[-19])&IF(RC[-18]="",,"|n"&R1C15&RC[-18])&IF(RC[-17]="",,"|n"&R1C16&RC[-17])&IF(RC[-16]="",,"|n"&R1C17&RC[-16])&IF(RC[-15]="",,"|n"&R1C18&RC[-15])&IF(RC[-14]="",,"|n"&R1C19&RC[-14])&IF(RC[-13]="",,"|n"&R1C20&RC[-13])&IF(RC[-12]="",,"|n"&R1C21&RC[-12])&IF(RC[-10]="",,"|n"&R1C23&RC[-10])&IF(RC[-9]="",,"|n"&R1C24&RC[-9])&IF(RC[-8]="",,"|n"&R1C25&RC[-8])&IF(RC[-7]="",,"|n"&R1C26&RC[-7])&IF(RC[-6]="",,"|n"&R1C27&RC[-6])&IF(RC[-5]="",,"|n"&R1C28&RC[-5])&IF(RC[-2]="",,"|n"&RC[-2]) -> 
AF484: =VLOOKUP(RC[-31],Sheet2!R13C1:R18C2,2,0)&"."&VLOOKUP(RC[-30],Sheet2!R7C1:R11C2,2,0)&VLOOKUP(RC[-30],Sheet2!R1C1:R5C2,2,0)&RC[-29]&RC[-28]&RC[-27]&Sheet2!R1C3 -> #N/A | AG484: =IF(RC[-26]&RC[-25]&RC[-24]&RC[-23]&RC[-22]&RC[-21]="",,R1C6)&IF(RC[-26]="",,"|n"&R1C7&RC[-26])&IF(RC[-25]="",,"|n"&R1C8&RC[-25])&IF(RC[-24]="",,"|n"&R1C9&RC[-24])&IF(RC[-23]="",,"|n"&R1C10&RC[-23])&IF(RC[-22]="",,"|n"&R1C11&RC[-22])&IF(RC[-21]="",,"|n"&R1C12&RC[-21])&IF(RC[-19]&RC[-18]&RC[-17]&RC[-16]="",,"|n"&R1C13)&IF(RC[-19]="",,"|n"&R1C14&RC[-19])&IF(RC[-18]="",,"|n"&R1C15&RC[-18])&IF(RC[-17]="",,"|n"&R1C16&RC[-17])&IF(RC[-16]="",,"|n"&R1C17&RC[-16])&IF(RC[-15]="",,"|n"&R1C18&RC[-15])&IF(RC[-14]="",,"|n"&R1C19&RC[-14])&IF(RC[-13]="",,"|n"&R1C20&RC[-13])&IF(RC[-12]="",,"|n"&R1C21&RC[-12])&IF(RC[-10]="",,"|n"&R1C23&RC[-10])&IF(RC[-9]="",,"|n"&R1C24&RC[-9])&IF(RC[-8]="",,"|n"&R1C25&RC[-8])&IF(RC[-7]="",,"|n"&R1C26&RC[-7])&IF(RC[-6]="",,"|n"&R1C27&RC[-6])&IF(RC[-5]="",,"|n"&R1C28&RC[-5])&IF(RC[-2]="",,"|n"&RC[-2]) -> 
AF485: =VLOOKUP(RC[-31],Sheet2!R13C1:R18C2,2,0)&"."&VLOOKUP(RC[-30],Sheet2!R7C1:R11C2,2,0)&VLOOKUP(RC[-30],Sheet2!R1C1:R5C2,2,0)&RC[-29]&RC[-28]&RC[-27]&Sheet2!R1C3 -> #N/A | AG485: =IF(RC[-26]&RC[-25]&RC[-24]&RC[-23]&RC[-22]&RC[-21]="",,R1C6)&IF(RC[-26]="",,"|n"&R1C7&RC[-26])&IF(RC[-25]="",,"|n"&R1C8&RC[-25])&IF(RC[-24]="",,"|n"&R1C9&RC[-24])&IF(RC[-23]="",,"|n"&R1C10&RC[-23])&IF(RC[-22]="",,"|n"&R1C11&RC[-22])&IF(RC[-21]="",,"|n"&R1C12&RC[-21])&IF(RC[-19]&RC[-18]&RC[-17]&RC[-16]="",,"|n"&R1C13)&IF(RC[-19]="",,"|n"&R1C14&RC[-19])&IF(RC[-18]="",,"|n"&R1C15&RC[-18])&IF(RC[-17]="",,"|n"&R1C16&RC[-17])&IF(RC[-16]="",,"|n"&R1C17&RC[-16])&IF(RC[-15]="",,"|n"&R1C18&RC[-15])&IF(RC[-14]="",,"|n"&R1C19&RC[-14])&IF(RC[-13]="",,"|n"&R1C20&RC[-13])&IF(RC[-12]="",,"|n"&R1C21&RC[-12])&IF(RC[-10]="",,"|n"&R1C23&RC[-10])&IF(RC[-9]="",,"|n"&R1C24&RC[-9])&IF(RC[-8]="",,"|n"&R1C25&RC[-8])&IF(RC[-7]="",,"|n"&R1C26&RC[-7])&IF(RC[-6]="",,"|n"&R1C27&RC[-6])&IF(RC[-5]="",,"|n"&R1C28&RC[-5])&IF(RC[-2]="",,"|n"&RC[-2]) -> 
AF486: =VLOOKUP(RC[-31],Sheet2!R13C1:R18C2,2,0)&"."&VLOOKUP(RC[-30],Sheet2!R7C1:R11C2,2,0)&VLOOKUP(RC[-30],Sheet2!R1C1:R5C2,2,0)&RC[-29]&RC[-28]&RC[-27]&Sheet2!R1C3 -> #N/A | AG486: =IF(RC[-26]&RC[-25]&RC[-24]&RC[-23]&RC[-22]&RC[-21]="",,R1C6)&IF(RC[-26]="",,"|n"&R1C7&RC[-26])&IF(RC[-25]="",,"|n"&R1C8&RC[-25])&IF(RC[-24]="",,"|n"&R1C9&RC[-24])&IF(RC[-23]="",,"|n"&R1C10&RC[-23])&IF(RC[-22]="",,"|n"&R1C11&RC[-22])&IF(RC[-21]="",,"|n"&R1C12&RC[-21])&IF(RC[-19]&RC[-18]&RC[-17]&RC[-16]="",,"|n"&R1C13)&IF(RC[-19]="",,"|n"&R1C14&RC[-19])&IF(RC[-18]="",,"|n"&R1C15&RC[-18])&IF(RC[-17]="",,"|n"&R1C16&RC[-17])&IF(RC[-16]="",,"|n"&R1C17&RC[-16])&IF(RC[-15]="",,"|n"&R1C18&RC[-15])&IF(RC[-14]="",,"|n"&R1C19&RC[-14])&IF(RC[-13]="",,"|n"&R1C20&RC[-13])&IF(RC[-12]="",,"|n"&R1C21&RC[-12])&IF(RC[-10]="",,"|n"&R1C23&RC[-10])&IF(RC[-9]="",,"|n"&R1C24&RC[-9])&IF(RC[-8]="",,"|n"&R1C25&RC[-8])&IF(RC[-7]="",,"|n"&R1C26&RC[-7])&IF(RC[-6]="",,"|n"&R1C27&RC[-6])&IF(RC[-5]="",,"|n"&R1C28&RC[-5])&IF(RC[-2]="",,"|n"&RC[-2]) -> 
AF487: =VLOOKUP(RC[-31],Sheet2!R13C1:R18C2,2,0)&"."&VLOOKUP(RC[-30],Sheet2!R7C1:R11C2,2,0)&VLOOKUP(RC[-30],Sheet2!R1C1:R5C2,2,0)&RC[-29]&RC[-28]&RC[-27]&Sheet2!R1C3 -> #N/A | AG487: =IF(RC[-26]&RC[-25]&RC[-24]&RC[-23]&RC[-22]&RC[-21]="",,R1C6)&IF(RC[-26]="",,"|n"&R1C7&RC[-26])&IF(RC[-25]="",,"|n"&R1C8&RC[-25])&IF(RC[-24]="",,"|n"&R1C9&RC[-24])&IF(RC[-23]="",,"|n"&R1C10&RC[-23])&IF(RC[-22]="",,"|n"&R1C11&RC[-22])&IF(RC[-21]="",,"|n"&R1C12&RC[-21])&IF(RC[-19]&RC[-18]&RC[-17]&RC[-16]="",,"|n"&R1C13)&IF(RC[-19]="",,"|n"&R1C14&RC[-19])&IF(RC[-18]="",,"|n"&R1C15&RC[-18])&IF(RC[-17]="",,"|n"&R1C16&RC[-17])&IF(RC[-16]="",,"|n"&R1C17&RC[-16])&IF(RC[-15]="",,"|n"&R1C18&RC[-15])&IF(RC[-14]="",,"|n"&R1C19&RC[-14])&IF(RC[-13]="",,"|n"&R1C20&RC[-13])&IF(RC[-12]="",,"|n"&R1C21&RC[-12])&IF(RC[-10]="",,"|n"&R1C23&RC[-10])&IF(RC[-9]="",,"|n"&R1C24&RC[-9])&IF(RC[-8]="",,"|n"&R1C25&RC[-8])&IF(RC[-7]="",,"|n"&R1C26&RC[-7])&IF(RC[-6]="",,"|n"&R1C27&RC[-6])&IF(RC[-5]="",,"|n"&R1C28&RC[-5])&IF(RC[-2]="",,"|n"&RC[-2]) -> 
AF488: =VLOOKUP(RC[-31],Sheet2!R13C1:R18C2,2,0)&"."&VLOOKUP(RC[-30],Sheet2!R7C1:R11C2,2,0)&VLOOKUP(RC[-30],Sheet2!R1C1:R5C2,2,0)&RC[-29]&RC[-28]&RC[-27]&Sheet2!R1C3 -> #N/A | AG488: =IF(RC[-26]&RC[-25]&RC[-24]&RC[-23]&RC[-22]&RC[-21]="",,R1C6)&IF(RC[-26]="",,"|n"&R1C7&RC[-26])&IF(RC[-25]="",,"|n"&R1C8&RC[-25])&IF(RC[-24]="",,"|n"&R1C9&RC[-24])&IF(RC[-23]="",,"|n"&R1C10&RC[-23])&IF(RC[-22]="",,"|n"&R1C11&RC[-22])&IF(RC[-21]="",,"|n"&R1C12&RC[-21])&IF(RC[-19]&RC[-18]&RC[-17]&RC[-16]="",,"|n"&R1C13)&IF(RC[-19]="",,"|n"&R1C14&RC[-19])&IF(RC[-18]="",,"|n"&R1C15&RC[-18])&IF(RC[-17]="",,"|n"&R1C16&RC[-17])&IF(RC[-16]="",,"|n"&R1C17&RC[-16])&IF(RC[-15]="",,"|n"&R1C18&RC[-15])&IF(RC[-14]="",,"|n"&R1C19&RC[-14])&IF(RC[-13]="",,"|n"&R1C20&RC[-13])&IF(RC[-12]="",,"|n"&R1C21&RC[-12])&IF(RC[-10]="",,"|n"&R1C23&RC[-10])&IF(RC[-9]="",,"|n"&R1C24&RC[-9])&IF(RC[-8]="",,"|n"&R1C25&RC[-8])&IF(RC[-7]="",,"|n"&R1C26&RC[-7])&IF(RC[-6]="",,"|n"&R1C27&RC[-6])&IF(RC[-5]="",,"|n"&R1C28&RC[-5])&IF(RC[-2]="",,"|n"&RC[-2]) -> 
AF489: =VLOOKUP(RC[-31],Sheet2!R13C1:R18C2,2,0)&"."&VLOOKUP(RC[-30],Sheet2!R7C1:R11C2,2,0)&VLOOKUP(RC[-30],Sheet2!R1C1:R5C2,2,0)&RC[-29]&RC[-28]&RC[-27]&Sheet2!R1C3 -> #N/A | AG489: =IF(RC[-26]&RC[-25]&RC[-24]&RC[-23]&RC[-22]&RC[-21]="",,R1C6)&IF(RC[-26]="",,"|n"&R1C7&RC[-26])&IF(RC[-25]="",,"|n"&R1C8&RC[-25])&IF(RC[-24]="",,"|n"&R1C9&RC[-24])&IF(RC[-23]="",,"|n"&R1C10&RC[-23])&IF(RC[-22]="",,"|n"&R1C11&RC[-22])&IF(RC[-21]="",,"|n"&R1C12&RC[-21])&IF(RC[-19]&RC[-18]&RC[-17]&RC[-16]="",,"|n"&R1C13)&IF(RC[-19]="",,"|n"&R1C14&RC[-19])&IF(RC[-18]="",,"|n"&R1C15&RC[-18])&IF(RC[-17]="",,"|n"&R1C16&RC[-17])&IF(RC[-16]="",,"|n"&R1C17&RC[-16])&IF(RC[-15]="",,"|n"&R1C18&RC[-15])&IF(RC[-14]="",,"|n"&R1C19&RC[-14])&IF(RC[-13]="",,"|n"&R1C20&RC[-13])&IF(RC[-12]="",,"|n"&R1C21&RC[-12])&IF(RC[-10]="",,"|n"&R1C23&RC[-10])&IF(RC[-9]="",,"|n"&R1C24&RC[-9])&IF(RC[-8]="",,"|n"&R1C25&RC[-8])&IF(RC[-7]="",,"|n"&R1C26&RC[-7])&IF(RC[-6]="",,"|n"&R1C27&RC[-6])&IF(RC[-5]="",,"|n"&R1C28&RC[-5])&IF(RC[-2]="",,"|n"&RC[-2]) -> 
AF490: =VLOOKUP(RC[-31],Sheet2!R13C1:R18C2,2,0)&"."&VLOOKUP(RC[-30],Sheet2!R7C1:R11C2,2,0)&VLOOKUP(RC[-30],Sheet2!R1C1:R5C2,2,0)&RC[-29]&RC[-28]&RC[-27]&Sheet2!R1C3 -> #N/A | AG490: =IF(RC[-26]&RC[-25]&RC[-24]&RC[-23]&RC[-22]&RC[-21]="",,R1C6)&IF(RC[-26]="",,"|n"&R1C7&RC[-26])&IF(RC[-25]="",,"|n"&R1C8&RC[-25])&IF(RC[-24]="",,"|n"&R1C9&RC[-24])&IF(RC[-23]="",,"|n"&R1C10&RC[-23])&IF(RC[-22]="",,"|n"&R1C11&RC[-22])&IF(RC[-21]="",,"|n"&R1C12&RC[-21])&IF(RC[-19]&RC[-18]&RC[-17]&RC[-16]="",,"|n"&R1C13)&IF(RC[-19]="",,"|n"&R1C14&RC[-19])&IF(RC[-18]="",,"|n"&R1C15&RC[-18])&IF(RC[-17]="",,"|n"&R1C16&RC[-17])&IF(RC[-16]="",,"|n"&R1C17&RC[-16])&IF(RC[-15]="",,"|n"&R1C18&RC[-15])&IF(RC[-14]="",,"|n"&R1C19&RC[-14])&IF(RC[-13]="",,"|n"&R1C20&RC[-13])&IF(RC[-12]="",,"|n"&R1C21&RC[-12])&IF(RC[-10]="",,"|n"&R1C23&RC[-10])&IF(RC[-9]="",,"|n"&R1C24&RC[-9])&IF(RC[-8]="",,"|n"&R1C25&RC[-8])&IF(RC[-7]="",,"|n"&R1C26&RC[-7])&IF(RC[-6]="",,"|n"&R1C27&RC[-6])&IF(RC[-5]="",,"|n"&R1C28&RC[-5])&IF(RC[-2]="",,"|n"&RC[-2]) -> 
AF491: =VLOOKUP(RC[-31],Sheet2!R13C1:R18C2,2,0)&"."&VLOOKUP(RC[-30],Sheet2!R7C1:R11C2,2,0)&VLOOKUP(RC[-30],Sheet2!R1C1:R5C2,2,0)&RC[-29]&RC[-28]&RC[-27]&Sheet2!R1C3 -> #N/A | AG491: =IF(RC[-26]&RC[-25]&RC[-24]&RC[-23]&RC[-22]&RC[-21]="",,R1C6)&IF(RC[-26]="",,"|n"&R1C7&RC[-26])&IF(RC[-25]="",,"|n"&R1C8&RC[-25])&IF(RC[-24]="",,"|n"&R1C9&RC[-24])&IF(RC[-23]="",,"|n"&R1C10&RC[-23])&IF(RC[-22]="",,"|n"&R1C11&RC[-22])&IF(RC[-21]="",,"|n"&R1C12&RC[-21])&IF(RC[-19]&RC[-18]&RC[-17]&RC[-16]="",,"|n"&R1C13)&IF(RC[-19]="",,"|n"&R1C14&RC[-19])&IF(RC[-18]="",,"|n"&R1C15&RC[-18])&IF(RC[-17]="",,"|n"&R1C16&RC[-17])&IF(RC[-16]="",,"|n"&R1C17&RC[-16])&IF(RC[-15]="",,"|n"&R1C18&RC[-15])&IF(RC[-14]="",,"|n"&R1C19&RC[-14])&IF(RC[-13]="",,"|n"&R1C20&RC[-13])&IF(RC[-12]="",,"|n"&R1C21&RC[-12])&IF(RC[-10]="",,"|n"&R1C23&RC[-10])&IF(RC[-9]="",,"|n"&R1C24&RC[-9])&IF(RC[-8]="",,"|n"&R1C25&RC[-8])&IF(RC[-7]="",,"|n"&R1C26&RC[-7])&IF(RC[-6]="",,"|n"&R1C27&RC[-6])&IF(RC[-5]="",,"|n"&R1C28&RC[-5])&IF(RC[-2]="",,"|n"&RC[-2]) -> 
AF492: =VLOOKUP(RC[-31],Sheet2!R13C1:R18C2,2,0)&"."&VLOOKUP(RC[-30],Sheet2!R7C1:R11C2,2,0)&VLOOKUP(RC[-30],Sheet2!R1C1:R5C2,2,0)&RC[-29]&RC[-28]&RC[-27]&Sheet2!R1C3 -> #N/A | AG492: =IF(RC[-26]&RC[-25]&RC[-24]&RC[-23]&RC[-22]&RC[-21]="",,R1C6)&IF(RC[-26]="",,"|n"&R1C7&RC[-26])&IF(RC[-25]="",,"|n"&R1C8&RC[-25])&IF(RC[-24]="",,"|n"&R1C9&RC[-24])&IF(RC[-23]="",,"|n"&R1C10&RC[-23])&IF(RC[-22]="",,"|n"&R1C11&RC[-22])&IF(RC[-21]="",,"|n"&R1C12&RC[-21])&IF(RC[-19]&RC[-18]&RC[-17]&RC[-16]="",,"|n"&R1C13)&IF(RC[-19]="",,"|n"&R1C14&RC[-19])&IF(RC[-18]="",,"|n"&R1C15&RC[-18])&IF(RC[-17]="",,"|n"&R1C16&RC[-17])&IF(RC[-16]="",,"|n"&R1C17&RC[-16])&IF(RC[-15]="",,"|n"&R1C18&RC[-15])&IF(RC[-14]="",,"|n"&R1C19&RC[-14])&IF(RC[-13]="",,"|n"&R1C20&RC[-13])&IF(RC[-12]="",,"|n"&R1C21&RC[-12])&IF(RC[-10]="",,"|n"&R1C23&RC[-10])&IF(RC[-9]="",,"|n"&R1C24&RC[-9])&IF(RC[-8]="",,"|n"&R1C25&RC[-8])&IF(RC[-7]="",,"|n"&R1C26&RC[-7])&IF(RC[-6]="",,"|n"&R1C27&RC[-6])&IF(RC[-5]="",,"|n"&R1C28&RC[-5])&IF(RC[-2]="",,"|n"&RC[-2]) -> 
AF493: =VLOOKUP(RC[-31],Sheet2!R13C1:R18C2,2,0)&"."&VLOOKUP(RC[-30],Sheet2!R7C1:R11C2,2,0)&VLOOKUP(RC[-30],Sheet2!R1C1:R5C2,2,0)&RC[-29]&RC[-28]&RC[-27]&Sheet2!R1C3 -> #N/A | AG493: =IF(RC[-26]&RC[-25]&RC[-24]&RC[-23]&RC[-22]&RC[-21]="",,R1C6)&IF(RC[-26]="",,"|n"&R1C7&RC[-26])&IF(RC[-25]="",,"|n"&R1C8&RC[-25])&IF(RC[-24]="",,"|n"&R1C9&RC[-24])&IF(RC[-23]="",,"|n"&R1C10&RC[-23])&IF(RC[-22]="",,"|n"&R1C11&RC[-22])&IF(RC[-21]="",,"|n"&R1C12&RC[-21])&IF(RC[-19]&RC[-18]&RC[-17]&RC[-16]="",,"|n"&R1C13)&IF(RC[-19]="",,"|n"&R1C14&RC[-19])&IF(RC[-18]="",,"|n"&R1C15&RC[-18])&IF(RC[-17]="",,"|n"&R1C16&RC[-17])&IF(RC[-16]="",,"|n"&R1C17&RC[-16])&IF(RC[-15]="",,"|n"&R1C18&RC[-15])&IF(RC[-14]="",,"|n"&R1C19&RC[-14])&IF(RC[-13]="",,"|n"&R1C20&RC[-13])&IF(RC[-12]="",,"|n"&R1C21&RC[-12])&IF(RC[-10]="",,"|n"&R1C23&RC[-10])&IF(RC[-9]="",,"|n"&R1C24&RC[-9])&IF(RC[-8]="",,"|n"&R1C25&RC[-8])&IF(RC[-7]="",,"|n"&R1C26&RC[-7])&IF(RC[-6]="",,"|n"&R1C27&RC[-6])&IF(RC[-5]="",,"|n"&R1C28&RC[-5])&IF(RC[-2]="",,"|n"&RC[-2]) -> 
AF494: =VLOOKUP(RC[-31],Sheet2!R13C1:R18C2,2,0)&"."&VLOOKUP(RC[-30],Sheet2!R7C1:R11C2,2,0)&VLOOKUP(RC[-30],Sheet2!R1C1:R5C2,2,0)&RC[-29]&RC[-28]&RC[-27]&Sheet2!R1C3 -> #N/A | AG494: =IF(RC[-26]&RC[-25]&RC[-24]&RC[-23]&RC[-22]&RC[-21]="",,R1C6)&IF(RC[-26]="",,"|n"&R1C7&RC[-26])&IF(RC[-25]="",,"|n"&R1C8&RC[-25])&IF(RC[-24]="",,"|n"&R1C9&RC[-24])&IF(RC[-23]="",,"|n"&R1C10&RC[-23])&IF(RC[-22]="",,"|n"&R1C11&RC[-22])&IF(RC[-21]="",,"|n"&R1C12&RC[-21])&IF(RC[-19]&RC[-18]&RC[-17]&RC[-16]="",,"|n"&R1C13)&IF(RC[-19]="",,"|n"&R1C14&RC[-19])&IF(RC[-18]="",,"|n"&R1C15&RC[-18])&IF(RC[-17]="",,"|n"&R1C16&RC[-17])&IF(RC[-16]="",,"|n"&R1C17&RC[-16])&IF(RC[-15]="",,"|n"&R1C18&RC[-15])&IF(RC[-14]="",,"|n"&R1C19&RC[-14])&IF(RC[-13]="",,"|n"&R1C20&RC[-13])&IF(RC[-12]="",,"|n"&R1C21&RC[-12])&IF(RC[-10]="",,"|n"&R1C23&RC[-10])&IF(RC[-9]="",,"|n"&R1C24&RC[-9])&IF(RC[-8]="",,"|n"&R1C25&RC[-8])&IF(RC[-7]="",,"|n"&R1C26&RC[-7])&IF(RC[-6]="",,"|n"&R1C27&RC[-6])&IF(RC[-5]="",,"|n"&R1C28&RC[-5])&IF(RC[-2]="",,"|n"&RC[-2]) -> 
AF495: =VLOOKUP(RC[-31],Sheet2!R13C1:R18C2,2,0)&"."&VLOOKUP(RC[-30],Sheet2!R7C1:R11C2,2,0)&VLOOKUP(RC[-30],Sheet2!R1C1:R5C2,2,0)&RC[-29]&RC[-28]&RC[-27]&Sheet2!R1C3 -> #N/A | AG495: =IF(RC[-26]&RC[-25]&RC[-24]&RC[-23]&RC[-22]&RC[-21]="",,R1C6)&IF(RC[-26]="",,"|n"&R1C7&RC[-26])&IF(RC[-25]="",,"|n"&R1C8&RC[-25])&IF(RC[-24]="",,"|n"&R1C9&RC[-24])&IF(RC[-23]="",,"|n"&R1C10&RC[-23])&IF(RC[-22]="",,"|n"&R1C11&RC[-22])&IF(RC[-21]="",,"|n"&R1C12&RC[-21])&IF(RC[-19]&RC[-18]&RC[-17]&RC[-16]="",,"|n"&R1C13)&IF(RC[-19]="",,"|n"&R1C14&RC[-19])&IF(RC[-18]="",,"|n"&R1C15&RC[-18])&IF(RC[-17]="",,"|n"&R1C16&RC[-17])&IF(RC[-16]="",,"|n"&R1C17&RC[-16])&IF(RC[-15]="",,"|n"&R1C18&RC[-15])&IF(RC[-14]="",,"|n"&R1C19&RC[-14])&IF(RC[-13]="",,"|n"&R1C20&RC[-13])&IF(RC[-12]="",,"|n"&R1C21&RC[-12])&IF(RC[-10]="",,"|n"&R1C23&RC[-10])&IF(RC[-9]="",,"|n"&R1C24&RC[-9])&IF(RC[-8]="",,"|n"&R1C25&RC[-8])&IF(RC[-7]="",,"|n"&R1C26&RC[-7])&IF(RC[-6]="",,"|n"&R1C27&RC[-6])&IF(RC[-5]="",,"|n"&R1C28&RC[-5])&IF(RC[-2]="",,"|n"&RC[-2]) -> 
AF496: =VLOOKUP(RC[-31],Sheet2!R13C1:R18C2,2,0)&"."&VLOOKUP(RC[-30],Sheet2!R7C1:R11C2,2,0)&VLOOKUP(RC[-30],Sheet2!R1C1:R5C2,2,0)&RC[-29]&RC[-28]&RC[-27]&Sheet2!R1C3 -> #N/A | AG496: =IF(RC[-26]&RC[-25]&RC[-24]&RC[-23]&RC[-22]&RC[-21]="",,R1C6)&IF(RC[-26]="",,"|n"&R1C7&RC[-26])&IF(RC[-25]="",,"|n"&R1C8&RC[-25])&IF(RC[-24]="",,"|n"&R1C9&RC[-24])&IF(RC[-23]="",,"|n"&R1C10&RC[-23])&IF(RC[-22]="",,"|n"&R1C11&RC[-22])&IF(RC[-21]="",,"|n"&R1C12&RC[-21])&IF(RC[-19]&RC[-18]&RC[-17]&RC[-16]="",,"|n"&R1C13)&IF(RC[-19]="",,"|n"&R1C14&RC[-19])&IF(RC[-18]="",,"|n"&R1C15&RC[-18])&IF(RC[-17]="",,"|n"&R1C16&RC[-17])&IF(RC[-16]="",,"|n"&R1C17&RC[-16])&IF(RC[-15]="",,"|n"&R1C18&RC[-15])&IF(RC[-14]="",,"|n"&R1C19&RC[-14])&IF(RC[-13]="",,"|n"&R1C20&RC[-13])&IF(RC[-12]="",,"|n"&R1C21&RC[-12])&IF(RC[-10]="",,"|n"&R1C23&RC[-10])&IF(RC[-9]="",,"|n"&R1C24&RC[-9])&IF(RC[-8]="",,"|n"&R1C25&RC[-8])&IF(RC[-7]="",,"|n"&R1C26&RC[-7])&IF(RC[-6]="",,"|n"&R1C27&RC[-6])&IF(RC[-5]="",,"|n"&R1C28&RC[-5])&IF(RC[-2]="",,"|n"&RC[-2]) -> 
AF497: =VLOOKUP(RC[-31],Sheet2!R13C1:R18C2,2,0)&"."&VLOOKUP(RC[-30],Sheet2!R7C1:R11C2,2,0)&VLOOKUP(RC[-30],Sheet2!R1C1:R5C2,2,0)&RC[-29]&RC[-28]&RC[-27]&Sheet2!R1C3 -> #N/A | AG497: =IF(RC[-26]&RC[-25]&RC[-24]&RC[-23]&RC[-22]&RC[-21]="",,R1C6)&IF(RC[-26]="",,"|n"&R1C7&RC[-26])&IF(RC[-25]="",,"|n"&R1C8&RC[-25])&IF(RC[-24]="",,"|n"&R1C9&RC[-24])&IF(RC[-23]="",,"|n"&R1C10&RC[-23])&IF(RC[-22]="",,"|n"&R1C11&RC[-22])&IF(RC[-21]="",,"|n"&R1C12&RC[-21])&IF(RC[-19]&RC[-18]&RC[-17]&RC[-16]="",,"|n"&R1C13)&IF(RC[-19]="",,"|n"&R1C14&RC[-19])&IF(RC[-18]="",,"|n"&R1C15&RC[-18])&IF(RC[-17]="",,"|n"&R1C16&RC[-17])&IF(RC[-16]="",,"|n"&R1C17&RC[-16])&IF(RC[-15]="",,"|n"&R1C18&RC[-15])&IF(RC[-14]="",,"|n"&R1C19&RC[-14])&IF(RC[-13]="",,"|n"&R1C20&RC[-13])&IF(RC[-12]="",,"|n"&R1C21&RC[-12])&IF(RC[-10]="",,"|n"&R1C23&RC[-10])&IF(RC[-9]="",,"|n"&R1C24&RC[-9])&IF(RC[-8]="",,"|n"&R1C25&RC[-8])&IF(RC[-7]="",,"|n"&R1C26&RC[-7])&IF(RC[-6]="",,"|n"&R1C27&RC[-6])&IF(RC[-5]="",,"|n"&R1C28&RC[-5])&IF(RC[-2]="",,"|n"&RC[-2]) -> 
AF498: =VLOOKUP(RC[-31],Sheet2!R13C1:R18C2,2,0)&"."&VLOOKUP(RC[-30],Sheet2!R7C1:R11C2,2,0)&VLOOKUP(RC[-30],Sheet2!R1C1:R5C2,2,0)&RC[-29]&RC[-28]&RC[-27]&Sheet2!R1C3 -> #N/A | AG498: =IF(RC[-26]&RC[-25]&RC[-24]&RC[-23]&RC[-22]&RC[-21]="",,R1C6)&IF(RC[-26]="",,"|n"&R1C7&RC[-26])&IF(RC[-25]="",,"|n"&R1C8&RC[-25])&IF(RC[-24]="",,"|n"&R1C9&RC[-24])&IF(RC[-23]="",,"|n"&R1C10&RC[-23])&IF(RC[-22]="",,"|n"&R1C11&RC[-22])&IF(RC[-21]="",,"|n"&R1C12&RC[-21])&IF(RC[-19]&RC[-18]&RC[-17]&RC[-16]="",,"|n"&R1C13)&IF(RC[-19]="",,"|n"&R1C14&RC[-19])&IF(RC[-18]="",,"|n"&R1C15&RC[-18])&IF(RC[-17]="",,"|n"&R1C16&RC[-17])&IF(RC[-16]="",,"|n"&R1C17&RC[-16])&IF(RC[-15]="",,"|n"&R1C18&RC[-15])&IF(RC[-14]="",,"|n"&R1C19&RC[-14])&IF(RC[-13]="",,"|n"&R1C20&RC[-13])&IF(RC[-12]="",,"|n"&R1C21&RC[-12])&IF(RC[-10]="",,"|n"&R1C23&RC[-10])&IF(RC[-9]="",,"|n"&R1C24&RC[-9])&IF(RC[-8]="",,"|n"&R1C25&RC[-8])&IF(RC[-7]="",,"|n"&R1C26&RC[-7])&IF(RC[-6]="",,"|n"&R1C27&RC[-6])&IF(RC[-5]="",,"|n"&R1C28&RC[-5])&IF(RC[-2]="",,"|n"&RC[-2]) -> 
AF499: =VLOOKUP(RC[-31],Sheet2!R13C1:R18C2,2,0)&"."&VLOOKUP(RC[-30],Sheet2!R7C1:R11C2,2,0)&VLOOKUP(RC[-30],Sheet2!R1C1:R5C2,2,0)&RC[-29]&RC[-28]&RC[-27]&Sheet2!R1C3 -> #N/A | AG499: =IF(RC[-26]&RC[-25]&RC[-24]&RC[-23]&RC[-22]&RC[-21]="",,R1C6)&IF(RC[-26]="",,"|n"&R1C7&RC[-26])&IF(RC[-25]="",,"|n"&R1C8&RC[-25])&IF(RC[-24]="",,"|n"&R1C9&RC[-24])&IF(RC[-23]="",,"|n"&R1C10&RC[-23])&IF(RC[-22]="",,"|n"&R1C11&RC[-22])&IF(RC[-21]="",,"|n"&R1C12&RC[-21])&IF(RC[-19]&RC[-18]&RC[-17]&RC[-16]="",,"|n"&R1C13)&IF(RC[-19]="",,"|n"&R1C14&RC[-19])&IF(RC[-18]="",,"|n"&R1C15&RC[-18])&IF(RC[-17]="",,"|n"&R1C16&RC[-17])&IF(RC[-16]="",,"|n"&R1C17&RC[-16])&IF(RC[-15]="",,"|n"&R1C18&RC[-15])&IF(RC[-14]="",,"|n"&R1C19&RC[-14])&IF(RC[-13]="",,"|n"&R1C20&RC[-13])&IF(RC[-12]="",,"|n"&R1C21&RC[-12])&IF(RC[-10]="",,"|n"&R1C23&RC[-10])&IF(RC[-9]="",,"|n"&R1C24&RC[-9])&IF(RC[-8]="",,"|n"&R1C25&RC[-8])&IF(RC[-7]="",,"|n"&R1C26&RC[-7])&IF(RC[-6]="",,"|n"&R1C27&RC[-6])&IF(RC[-5]="",,"|n"&R1C28&RC[-5])&IF(RC[-2]="",,"|n"&RC[-2]) -> 
AF500: =VLOOKUP(RC[-31],Sheet2!R13C1:R18C2,2,0)&"."&VLOOKUP(RC[-30],Sheet2!R7C1:R11C2,2,0)&VLOOKUP(RC[-30],Sheet2!R1C1:R5C2,2,0)&RC[-29]&RC[-28]&RC[-27]&Sheet2!R1C3 -> #N/A | AG500: =IF(RC[-26]&RC[-25]&RC[-24]&RC[-23]&RC[-22]&RC[-21]="",,R1C6)&IF(RC[-26]="",,"|n"&R1C7&RC[-26])&IF(RC[-25]="",,"|n"&R1C8&RC[-25])&IF(RC[-24]="",,"|n"&R1C9&RC[-24])&IF(RC[-23]="",,"|n"&R1C10&RC[-23])&IF(RC[-22]="",,"|n"&R1C11&RC[-22])&IF(RC[-21]="",,"|n"&R1C12&RC[-21])&IF(RC[-19]&RC[-18]&RC[-17]&RC[-16]="",,"|n"&R1C13)&IF(RC[-19]="",,"|n"&R1C14&RC[-19])&IF(RC[-18]="",,"|n"&R1C15&RC[-18])&IF(RC[-17]="",,"|n"&R1C16&RC[-17])&IF(RC[-16]="",,"|n"&R1C17&RC[-16])&IF(RC[-15]="",,"|n"&R1C18&RC[-15])&IF(RC[-14]="",,"|n"&R1C19&RC[-14])&IF(RC[-13]="",,"|n"&R1C20&RC[-13])&IF(RC[-12]="",,"|n"&R1C21&RC[-12])&IF(RC[-10]="",,"|n"&R1C23&RC[-10])&IF(RC[-9]="",,"|n"&R1C24&RC[-9])&IF(RC[-8]="",,"|n"&R1C25&RC[-8])&IF(RC[-7]="",,"|n"&R1C26&RC[-7])&IF(RC[-6]="",,"|n"&R1C27&RC[-6])&IF(RC[-5]="",,"|n"&R1C28&RC[-5])&IF(RC[-2]="",,"|n"&RC[-2]) -> 
AF501: =VLOOKUP(RC[-31],Sheet2!R13C1:R18C2,2,0)&"."&VLOOKUP(RC[-30],Sheet2!R7C1:R11C2,2,0)&VLOOKUP(RC[-30],Sheet2!R1C1:R5C2,2,0)&RC[-29]&RC[-28]&RC[-27]&Sheet2!R1C3 -> #N/A | AG501: =IF(RC[-26]&RC[-25]&RC[-24]&RC[-23]&RC[-22]&RC[-21]="",,R1C6)&IF(RC[-26]="",,"|n"&R1C7&RC[-26])&IF(RC[-25]="",,"|n"&R1C8&RC[-25])&IF(RC[-24]="",,"|n"&R1C9&RC[-24])&IF(RC[-23]="",,"|n"&R1C10&RC[-23])&IF(RC[-22]="",,"|n"&R1C11&RC[-22])&IF(RC[-21]="",,"|n"&R1C12&RC[-21])&IF(RC[-19]&RC[-18]&RC[-17]&RC[-16]="",,"|n"&R1C13)&IF(RC[-19]="",,"|n"&R1C14&RC[-19])&IF(RC[-18]="",,"|n"&R1C15&RC[-18])&IF(RC[-17]="",,"|n"&R1C16&RC[-17])&IF(RC[-16]="",,"|n"&R1C17&RC[-16])&IF(RC[-15]="",,"|n"&R1C18&RC[-15])&IF(RC[-14]="",,"|n"&R1C19&RC[-14])&IF(RC[-13]="",,"|n"&R1C20&RC[-13])&IF(RC[-12]="",,"|n"&R1C21&RC[-12])&IF(RC[-10]="",,"|n"&R1C23&RC[-10])&IF(RC[-9]="",,"|n"&R1C24&RC[-9])&IF(RC[-8]="",,"|n"&R1C25&RC[-8])&IF(RC[-7]="",,"|n"&R1C26&RC[-7])&IF(RC[-6]="",,"|n"&R1C27&RC[-6])&IF(RC[-5]="",,"|n"&R1C28&RC[-5])&IF(RC[-2]="",,"|n"&RC[-2]) -> 
AF502: =VLOOKUP(RC[-31],Sheet2!R13C1:R18C2,2,0)&"."&VLOOKUP(RC[-30],Sheet2!R7C1:R11C2,2,0)&VLOOKUP(RC[-30],Sheet2!R1C1:R5C2,2,0)&RC[-29]&RC[-28]&RC[-27]&Sheet2!R1C3 -> #N/A | AG502: =IF(RC[-26]&RC[-25]&RC[-24]&RC[-23]&RC[-22]&RC[-21]="",,R1C6)&IF(RC[-26]="",,"|n"&R1C7&RC[-26])&IF(RC[-25]="",,"|n"&R1C8&RC[-25])&IF(RC[-24]="",,"|n"&R1C9&RC[-24])&IF(RC[-23]="",,"|n"&R1C10&RC[-23])&IF(RC[-22]="",,"|n"&R1C11&RC[-22])&IF(RC[-21]="",,"|n"&R1C12&RC[-21])&IF(RC[-19]&RC[-18]&RC[-17]&RC[-16]="",,"|n"&R1C13)&IF(RC[-19]="",,"|n"&R1C14&RC[-19])&IF(RC[-18]="",,"|n"&R1C15&RC[-18])&IF(RC[-17]="",,"|n"&R1C16&RC[-17])&IF(RC[-16]="",,"|n"&R1C17&RC[-16])&IF(RC[-15]="",,"|n"&R1C18&RC[-15])&IF(RC[-14]="",,"|n"&R1C19&RC[-14])&IF(RC[-13]="",,"|n"&R1C20&RC[-13])&IF(RC[-12]="",,"|n"&R1C21&RC[-12])&IF(RC[-10]="",,"|n"&R1C23&RC[-10])&IF(RC[-9]="",,"|n"&R1C24&RC[-9])&IF(RC[-8]="",,"|n"&R1C25&RC[-8])&IF(RC[-7]="",,"|n"&R1C26&RC[-7])&IF(RC[-6]="",,"|n"&R1C27&RC[-6])&IF(RC[-5]="",,"|n"&R1C28&RC[-5])&IF(RC[-2]="",,"|n"&RC[-2]) -> 
AF503: =VLOOKUP(RC[-31],Sheet2!R13C1:R18C2,2,0)&"."&VLOOKUP(RC[-30],Sheet2!R7C1:R11C2,2,0)&VLOOKUP(RC[-30],Sheet2!R1C1:R5C2,2,0)&RC[-29]&RC[-28]&RC[-27]&Sheet2!R1C3 -> #N/A | AG503: =IF(RC[-26]&RC[-25]&RC[-24]&RC[-23]&RC[-22]&RC[-21]="",,R1C6)&IF(RC[-26]="",,"|n"&R1C7&RC[-26])&IF(RC[-25]="",,"|n"&R1C8&RC[-25])&IF(RC[-24]="",,"|n"&R1C9&RC[-24])&IF(RC[-23]="",,"|n"&R1C10&RC[-23])&IF(RC[-22]="",,"|n"&R1C11&RC[-22])&IF(RC[-21]="",,"|n"&R1C12&RC[-21])&IF(RC[-19]&RC[-18]&RC[-17]&RC[-16]="",,"|n"&R1C13)&IF(RC[-19]="",,"|n"&R1C14&RC[-19])&IF(RC[-18]="",,"|n"&R1C15&RC[-18])&IF(RC[-17]="",,"|n"&R1C16&RC[-17])&IF(RC[-16]="",,"|n"&R1C17&RC[-16])&IF(RC[-15]="",,"|n"&R1C18&RC[-15])&IF(RC[-14]="",,"|n"&R1C19&RC[-14])&IF(RC[-13]="",,"|n"&R1C20&RC[-13])&IF(RC[-12]="",,"|n"&R1C21&RC[-12])&IF(RC[-10]="",,"|n"&R1C23&RC[-10])&IF(RC[-9]="",,"|n"&R1C24&RC[-9])&IF(RC[-8]="",,"|n"&R1C25&RC[-8])&IF(RC[-7]="",,"|n"&R1C26&RC[-7])&IF(RC[-6]="",,"|n"&R1C27&RC[-6])&IF(RC[-5]="",,"|n"&R1C28&RC[-5])&IF(RC[-2]="",,"|n"&RC[-2]) -> 
AF504: =VLOOKUP(RC[-31],Sheet2!R13C1:R18C2,2,0)&"."&VLOOKUP(RC[-30],Sheet2!R7C1:R11C2,2,0)&VLOOKUP(RC[-30],Sheet2!R1C1:R5C2,2,0)&RC[-29]&RC[-28]&RC[-27]&Sheet2!R1C3 -> #N/A | AG504: =IF(RC[-26]&RC[-25]&RC[-24]&RC[-23]&RC[-22]&RC[-21]="",,R1C6)&IF(RC[-26]="",,"|n"&R1C7&RC[-26])&IF(RC[-25]="",,"|n"&R1C8&RC[-25])&IF(RC[-24]="",,"|n"&R1C9&RC[-24])&IF(RC[-23]="",,"|n"&R1C10&RC[-23])&IF(RC[-22]="",,"|n"&R1C11&RC[-22])&IF(RC[-21]="",,"|n"&R1C12&RC[-21])&IF(RC[-19]&RC[-18]&RC[-17]&RC[-16]="",,"|n"&R1C13)&IF(RC[-19]="",,"|n"&R1C14&RC[-19])&IF(RC[-18]="",,"|n"&R1C15&RC[-18])&IF(RC[-17]="",,"|n"&R1C16&RC[-17])&IF(RC[-16]="",,"|n"&R1C17&RC[-16])&IF(RC[-15]="",,"|n"&R1C18&RC[-15])&IF(RC[-14]="",,"|n"&R1C19&RC[-14])&IF(RC[-13]="",,"|n"&R1C20&RC[-13])&IF(RC[-12]="",,"|n"&R1C21&RC[-12])&IF(RC[-10]="",,"|n"&R1C23&RC[-10])&IF(RC[-9]="",,"|n"&R1C24&RC[-9])&IF(RC[-8]="",,"|n"&R1C25&RC[-8])&IF(RC[-7]="",,"|n"&R1C26&RC[-7])&IF(RC[-6]="",,"|n"&R1C27&RC[-6])&IF(RC[-5]="",,"|n"&R1C28&RC[-5])&IF(RC[-2]="",,"|n"&RC[-2]) -> 
AF505: =VLOOKUP(RC[-31],Sheet2!R13C1:R18C2,2,0)&"."&VLOOKUP(RC[-30],Sheet2!R7C1:R11C2,2,0)&VLOOKUP(RC[-30],Sheet2!R1C1:R5C2,2,0)&RC[-29]&RC[-28]&RC[-27]&Sheet2!R1C3 -> #N/A | AG505: =IF(RC[-26]&RC[-25]&RC[-24]&RC[-23]&RC[-22]&RC[-21]="",,R1C6)&IF(RC[-26]="",,"|n"&R1C7&RC[-26])&IF(RC[-25]="",,"|n"&R1C8&RC[-25])&IF(RC[-24]="",,"|n"&R1C9&RC[-24])&IF(RC[-23]="",,"|n"&R1C10&RC[-23])&IF(RC[-22]="",,"|n"&R1C11&RC[-22])&IF(RC[-21]="",,"|n"&R1C12&RC[-21])&IF(RC[-19]&RC[-18]&RC[-17]&RC[-16]="",,"|n"&R1C13)&IF(RC[-19]="",,"|n"&R1C14&RC[-19])&IF(RC[-18]="",,"|n"&R1C15&RC[-18])&IF(RC[-17]="",,"|n"&R1C16&RC[-17])&IF(RC[-16]="",,"|n"&R1C17&RC[-16])&IF(RC[-15]="",,"|n"&R1C18&RC[-15])&IF(RC[-14]="",,"|n"&R1C19&RC[-14])&IF(RC[-13]="",,"|n"&R1C20&RC[-13])&IF(RC[-12]="",,"|n"&R1C21&RC[-12])&IF(RC[-10]="",,"|n"&R1C23&RC[-10])&IF(RC[-9]="",,"|n"&R1C24&RC[-9])&IF(RC[-8]="",,"|n"&R1C25&RC[-8])&IF(RC[-7]="",,"|n"&R1C26&RC[-7])&IF(RC[-6]="",,"|n"&R1C27&RC[-6])&IF(RC[-5]="",,"|n"&R1C28&RC[-5])&IF(RC[-2]="",,"|n"&RC[-2]) -> 
AF506: =VLOOKUP(RC[-31],Sheet2!R13C1:R18C2,2,0)&"."&VLOOKUP(RC[-30],Sheet2!R7C1:R11C2,2,0)&VLOOKUP(RC[-30],Sheet2!R1C1:R5C2,2,0)&RC[-29]&RC[-28]&RC[-27]&Sheet2!R1C3 -> #N/A | AG506: =IF(RC[-26]&RC[-25]&RC[-24]&RC[-23]&RC[-22]&RC[-21]="",,R1C6)&IF(RC[-26]="",,"|n"&R1C7&RC[-26])&IF(RC[-25]="",,"|n"&R1C8&RC[-25])&IF(RC[-24]="",,"|n"&R1C9&RC[-24])&IF(RC[-23]="",,"|n"&R1C10&RC[-23])&IF(RC[-22]="",,"|n"&R1C11&RC[-22])&IF(RC[-21]="",,"|n"&R1C12&RC[-21])&IF(RC[-19]&RC[-18]&RC[-17]&RC[-16]="",,"|n"&R1C13)&IF(RC[-19]="",,"|n"&R1C14&RC[-19])&IF(RC[-18]="",,"|n"&R1C15&RC[-18])&IF(RC[-17]="",,"|n"&R1C16&RC[-17])&IF(RC[-16]="",,"|n"&R1C17&RC[-16])&IF(RC[-15]="",,"|n"&R1C18&RC[-15])&IF(RC[-14]="",,"|n"&R1C19&RC[-14])&IF(RC[-13]="",,"|n"&R1C20&RC[-13])&IF(RC[-12]="",,"|n"&R1C21&RC[-12])&IF(RC[-10]="",,"|n"&R1C23&RC[-10])&IF(RC[-9]="",,"|n"&R1C24&RC[-9])&IF(RC[-8]="",,"|n"&R1C25&RC[-8])&IF(RC[-7]="",,"|n"&R1C26&RC[-7])&IF(RC[-6]="",,"|n"&R1C27&RC[-6])&IF(RC[-5]="",,"|n"&R1C28&RC[-5])&IF(RC[-2]="",,"|n"&RC[-2]) -> 
AF507: =VLOOKUP(RC[-31],Sheet2!R13C1:R18C2,2,0)&"."&VLOOKUP(RC[-30],Sheet2!R7C1:R11C2,2,0)&VLOOKUP(RC[-30],Sheet2!R1C1:R5C2,2,0)&RC[-29]&RC[-28]&RC[-27]&Sheet2!R1C3 -> #N/A | AG507: =IF(RC[-26]&RC[-25]&RC[-24]&RC[-23]&RC[-22]&RC[-21]="",,R1C6)&IF(RC[-26]="",,"|n"&R1C7&RC[-26])&IF(RC[-25]="",,"|n"&R1C8&RC[-25])&IF(RC[-24]="",,"|n"&R1C9&RC[-24])&IF(RC[-23]="",,"|n"&R1C10&RC[-23])&IF(RC[-22]="",,"|n"&R1C11&RC[-22])&IF(RC[-21]="",,"|n"&R1C12&RC[-21])&IF(RC[-19]&RC[-18]&RC[-17]&RC[-16]="",,"|n"&R1C13)&IF(RC[-19]="",,"|n"&R1C14&RC[-19])&IF(RC[-18]="",,"|n"&R1C15&RC[-18])&IF(RC[-17]="",,"|n"&R1C16&RC[-17])&IF(RC[-16]="",,"|n"&R1C17&RC[-16])&IF(RC[-15]="",,"|n"&R1C18&RC[-15])&IF(RC[-14]="",,"|n"&R1C19&RC[-14])&IF(RC[-13]="",,"|n"&R1C20&RC[-13])&IF(RC[-12]="",,"|n"&R1C21&RC[-12])&IF(RC[-10]="",,"|n"&R1C23&RC[-10])&IF(RC[-9]="",,"|n"&R1C24&RC[-9])&IF(RC[-8]="",,"|n"&R1C25&RC[-8])&IF(RC[-7]="",,"|n"&R1C26&RC[-7])&IF(RC[-6]="",,"|n"&R1C27&RC[-6])&IF(RC[-5]="",,"|n"&R1C28&RC[-5])&IF(RC[-2]="",,"|n"&RC[-2]) -> 
AF508: =VLOOKUP(RC[-31],Sheet2!R13C1:R18C2,2,0)&"."&VLOOKUP(RC[-30],Sheet2!R7C1:R11C2,2,0)&VLOOKUP(RC[-30],Sheet2!R1C1:R5C2,2,0)&RC[-29]&RC[-28]&RC[-27]&Sheet2!R1C3 -> #N/A | AG508: =IF(RC[-26]&RC[-25]&RC[-24]&RC[-23]&RC[-22]&RC[-21]="",,R1C6)&IF(RC[-26]="",,"|n"&R1C7&RC[-26])&IF(RC[-25]="",,"|n"&R1C8&RC[-25])&IF(RC[-24]="",,"|n"&R1C9&RC[-24])&IF(RC[-23]="",,"|n"&R1C10&RC[-23])&IF(RC[-22]="",,"|n"&R1C11&RC[-22])&IF(RC[-21]="",,"|n"&R1C12&RC[-21])&IF(RC[-19]&RC[-18]&RC[-17]&RC[-16]="",,"|n"&R1C13)&IF(RC[-19]="",,"|n"&R1C14&RC[-19])&IF(RC[-18]="",,"|n"&R1C15&RC[-18])&IF(RC[-17]="",,"|n"&R1C16&RC[-17])&IF(RC[-16]="",,"|n"&R1C17&RC[-16])&IF(RC[-15]="",,"|n"&R1C18&RC[-15])&IF(RC[-14]="",,"|n"&R1C19&RC[-14])&IF(RC[-13]="",,"|n"&R1C20&RC[-13])&IF(RC[-12]="",,"|n"&R1C21&RC[-12])&IF(RC[-10]="",,"|n"&R1C23&RC[-10])&IF(RC[-9]="",,"|n"&R1C24&RC[-9])&IF(RC[-8]="",,"|n"&R1C25&RC[-8])&IF(RC[-7]="",,"|n"&R1C26&RC[-7])&IF(RC[-6]="",,"|n"&R1C27&RC[-6])&IF(RC[-5]="",,"|n"&R1C28&RC[-5])&IF(RC[-2]="",,"|n"&RC[-2]) -> 
AF509: =VLOOKUP(RC[-31],Sheet2!R13C1:R18C2,2,0)&"."&VLOOKUP(RC[-30],Sheet2!R7C1:R11C2,2,0)&VLOOKUP(RC[-30],Sheet2!R1C1:R5C2,2,0)&RC[-29]&RC[-28]&RC[-27]&Sheet2!R1C3 -> #N/A | AG509: =IF(RC[-26]&RC[-25]&RC[-24]&RC[-23]&RC[-22]&RC[-21]="",,R1C6)&IF(RC[-26]="",,"|n"&R1C7&RC[-26])&IF(RC[-25]="",,"|n"&R1C8&RC[-25])&IF(RC[-24]="",,"|n"&R1C9&RC[-24])&IF(RC[-23]="",,"|n"&R1C10&RC[-23])&IF(RC[-22]="",,"|n"&R1C11&RC[-22])&IF(RC[-21]="",,"|n"&R1C12&RC[-21])&IF(RC[-19]&RC[-18]&RC[-17]&RC[-16]="",,"|n"&R1C13)&IF(RC[-19]="",,"|n"&R1C14&RC[-19])&IF(RC[-18]="",,"|n"&R1C15&RC[-18])&IF(RC[-17]="",,"|n"&R1C16&RC[-17])&IF(RC[-16]="",,"|n"&R1C17&RC[-16])&IF(RC[-15]="",,"|n"&R1C18&RC[-15])&IF(RC[-14]="",,"|n"&R1C19&RC[-14])&IF(RC[-13]="",,"|n"&R1C20&RC[-13])&IF(RC[-12]="",,"|n"&R1C21&RC[-12])&IF(RC[-10]="",,"|n"&R1C23&RC[-10])&IF(RC[-9]="",,"|n"&R1C24&RC[-9])&IF(RC[-8]="",,"|n"&R1C25&RC[-8])&IF(RC[-7]="",,"|n"&R1C26&RC[-7])&IF(RC[-6]="",,"|n"&R1C27&RC[-6])&IF(RC[-5]="",,"|n"&R1C28&RC[-5])&IF(RC[-2]="",,"|n"&RC[-2]) -> 
AF510: =VLOOKUP(RC[-31],Sheet2!R13C1:R18C2,2,0)&"."&VLOOKUP(RC[-30],Sheet2!R7C1:R11C2,2,0)&VLOOKUP(RC[-30],Sheet2!R1C1:R5C2,2,0)&RC[-29]&RC[-28]&RC[-27]&Sheet2!R1C3 -> #N/A | AG510: =IF(RC[-26]&RC[-25]&RC[-24]&RC[-23]&RC[-22]&RC[-21]="",,R1C6)&IF(RC[-26]="",,"|n"&R1C7&RC[-26])&IF(RC[-25]="",,"|n"&R1C8&RC[-25])&IF(RC[-24]="",,"|n"&R1C9&RC[-24])&IF(RC[-23]="",,"|n"&R1C10&RC[-23])&IF(RC[-22]="",,"|n"&R1C11&RC[-22])&IF(RC[-21]="",,"|n"&R1C12&RC[-21])&IF(RC[-19]&RC[-18]&RC[-17]&RC[-16]="",,"|n"&R1C13)&IF(RC[-19]="",,"|n"&R1C14&RC[-19])&IF(RC[-18]="",,"|n"&R1C15&RC[-18])&IF(RC[-17]="",,"|n"&R1C16&RC[-17])&IF(RC[-16]="",,"|n"&R1C17&RC[-16])&IF(RC[-15]="",,"|n"&R1C18&RC[-15])&IF(RC[-14]="",,"|n"&R1C19&RC[-14])&IF(RC[-13]="",,"|n"&R1C20&RC[-13])&IF(RC[-12]="",,"|n"&R1C21&RC[-12])&IF(RC[-10]="",,"|n"&R1C23&RC[-10])&IF(RC[-9]="",,"|n"&R1C24&RC[-9])&IF(RC[-8]="",,"|n"&R1C25&RC[-8])&IF(RC[-7]="",,"|n"&R1C26&RC[-7])&IF(RC[-6]="",,"|n"&R1C27&RC[-6])&IF(RC[-5]="",,"|n"&R1C28&RC[-5])&IF(RC[-2]="",,"|n"&RC[-2]) -> 
AF511: =VLOOKUP(RC[-31],Sheet2!R13C1:R18C2,2,0)&"."&VLOOKUP(RC[-30],Sheet2!R7C1:R11C2,2,0)&VLOOKUP(RC[-30],Sheet2!R1C1:R5C2,2,0)&RC[-29]&RC[-28]&RC[-27]&Sheet2!R1C3 -> #N/A | AG511: =IF(RC[-26]&RC[-25]&RC[-24]&RC[-23]&RC[-22]&RC[-21]="",,R1C6)&IF(RC[-26]="",,"|n"&R1C7&RC[-26])&IF(RC[-25]="",,"|n"&R1C8&RC[-25])&IF(RC[-24]="",,"|n"&R1C9&RC[-24])&IF(RC[-23]="",,"|n"&R1C10&RC[-23])&IF(RC[-22]="",,"|n"&R1C11&RC[-22])&IF(RC[-21]="",,"|n"&R1C12&RC[-21])&IF(RC[-19]&RC[-18]&RC[-17]&RC[-16]="",,"|n"&R1C13)&IF(RC[-19]="",,"|n"&R1C14&RC[-19])&IF(RC[-18]="",,"|n"&R1C15&RC[-18])&IF(RC[-17]="",,"|n"&R1C16&RC[-17])&IF(RC[-16]="",,"|n"&R1C17&RC[-16])&IF(RC[-15]="",,"|n"&R1C18&RC[-15])&IF(RC[-14]="",,"|n"&R1C19&RC[-14])&IF(RC[-13]="",,"|n"&R1C20&RC[-13])&IF(RC[-12]="",,"|n"&R1C21&RC[-12])&IF(RC[-10]="",,"|n"&R1C23&RC[-10])&IF(RC[-9]="",,"|n"&R1C24&RC[-9])&IF(RC[-8]="",,"|n"&R1C25&RC[-8])&IF(RC[-7]="",,"|n"&R1C26&RC[-7])&IF(RC[-6]="",,"|n"&R1C27&RC[-6])&IF(RC[-5]="",,"|n"&R1C28&RC[-5])&IF(RC[-2]="",,"|n"&RC[-2]) -> 
AF512: =VLOOKUP(RC[-31],Sheet2!R13C1:R18C2,2,0)&"."&VLOOKUP(RC[-30],Sheet2!R7C1:R11C2,2,0)&VLOOKUP(RC[-30],Sheet2!R1C1:R5C2,2,0)&RC[-29]&RC[-28]&RC[-27]&Sheet2!R1C3 -> #N/A | AG512: =IF(RC[-26]&RC[-25]&RC[-24]&RC[-23]&RC[-22]&RC[-21]="",,R1C6)&IF(RC[-26]="",,"|n"&R1C7&RC[-26])&IF(RC[-25]="",,"|n"&R1C8&RC[-25])&IF(RC[-24]="",,"|n"&R1C9&RC[-24])&IF(RC[-23]="",,"|n"&R1C10&RC[-23])&IF(RC[-22]="",,"|n"&R1C11&RC[-22])&IF(RC[-21]="",,"|n"&R1C12&RC[-21])&IF(RC[-19]&RC[-18]&RC[-17]&RC[-16]="",,"|n"&R1C13)&IF(RC[-19]="",,"|n"&R1C14&RC[-19])&IF(RC[-18]="",,"|n"&R1C15&RC[-18])&IF(RC[-17]="",,"|n"&R1C16&RC[-17])&IF(RC[-16]="",,"|n"&R1C17&RC[-16])&IF(RC[-15]="",,"|n"&R1C18&RC[-15])&IF(RC[-14]="",,"|n"&R1C19&RC[-14])&IF(RC[-13]="",,"|n"&R1C20&RC[-13])&IF(RC[-12]="",,"|n"&R1C21&RC[-12])&IF(RC[-10]="",,"|n"&R1C23&RC[-10])&IF(RC[-9]="",,"|n"&R1C24&RC[-9])&IF(RC[-8]="",,"|n"&R1C25&RC[-8])&IF(RC[-7]="",,"|n"&R1C26&RC[-7])&IF(RC[-6]="",,"|n"&R1C27&RC[-6])&IF(RC[-5]="",,"|n"&R1C28&RC[-5])&IF(RC[-2]="",,"|n"&RC[-2]) -> 
AF513: =VLOOKUP(RC[-31],Sheet2!R13C1:R18C2,2,0)&"."&VLOOKUP(RC[-30],Sheet2!R7C1:R11C2,2,0)&VLOOKUP(RC[-30],Sheet2!R1C1:R5C2,2,0)&RC[-29]&RC[-28]&RC[-27]&Sheet2!R1C3 -> #N/A | AG513: =IF(RC[-26]&RC[-25]&RC[-24]&RC[-23]&RC[-22]&RC[-21]="",,R1C6)&IF(RC[-26]="",,"|n"&R1C7&RC[-26])&IF(RC[-25]="",,"|n"&R1C8&RC[-25])&IF(RC[-24]="",,"|n"&R1C9&RC[-24])&IF(RC[-23]="",,"|n"&R1C10&RC[-23])&IF(RC[-22]="",,"|n"&R1C11&RC[-22])&IF(RC[-21]="",,"|n"&R1C12&RC[-21])&IF(RC[-19]&RC[-18]&RC[-17]&RC[-16]="",,"|n"&R1C13)&IF(RC[-19]="",,"|n"&R1C14&RC[-19])&IF(RC[-18]="",,"|n"&R1C15&RC[-18])&IF(RC[-17]="",,"|n"&R1C16&RC[-17])&IF(RC[-16]="",,"|n"&R1C17&RC[-16])&IF(RC[-15]="",,"|n"&R1C18&RC[-15])&IF(RC[-14]="",,"|n"&R1C19&RC[-14])&IF(RC[-13]="",,"|n"&R1C20&RC[-13])&IF(RC[-12]="",,"|n"&R1C21&RC[-12])&IF(RC[-10]="",,"|n"&R1C23&RC[-10])&IF(RC[-9]="",,"|n"&R1C24&RC[-9])&IF(RC[-8]="",,"|n"&R1C25&RC[-8])&IF(RC[-7]="",,"|n"&R1C26&RC[-7])&IF(RC[-6]="",,"|n"&R1C27&RC[-6])&IF(RC[-5]="",,"|n"&R1C28&RC[-5])&IF(RC[-2]="",,"|n"&RC[-2]) -> 
AF514: =VLOOKUP(RC[-31],Sheet2!R13C1:R18C2,2,0)&"."&VLOOKUP(RC[-30],Sheet2!R7C1:R11C2,2,0)&VLOOKUP(RC[-30],Sheet2!R1C1:R5C2,2,0)&RC[-29]&RC[-28]&RC[-27]&Sheet2!R1C3 -> #N/A | AG514: =IF(RC[-26]&RC[-25]&RC[-24]&RC[-23]&RC[-22]&RC[-21]="",,R1C6)&IF(RC[-26]="",,"|n"&R1C7&RC[-26])&IF(RC[-25]="",,"|n"&R1C8&RC[-25])&IF(RC[-24]="",,"|n"&R1C9&RC[-24])&IF(RC[-23]="",,"|n"&R1C10&RC[-23])&IF(RC[-22]="",,"|n"&R1C11&RC[-22])&IF(RC[-21]="",,"|n"&R1C12&RC[-21])&IF(RC[-19]&RC[-18]&RC[-17]&RC[-16]="",,"|n"&R1C13)&IF(RC[-19]="",,"|n"&R1C14&RC[-19])&IF(RC[-18]="",,"|n"&R1C15&RC[-18])&IF(RC[-17]="",,"|n"&R1C16&RC[-17])&IF(RC[-16]="",,"|n"&R1C17&RC[-16])&IF(RC[-15]="",,"|n"&R1C18&RC[-15])&IF(RC[-14]="",,"|n"&R1C19&RC[-14])&IF(RC[-13]="",,"|n"&R1C20&RC[-13])&IF(RC[-12]="",,"|n"&R1C21&RC[-12])&IF(RC[-10]="",,"|n"&R1C23&RC[-10])&IF(RC[-9]="",,"|n"&R1C24&RC[-9])&IF(RC[-8]="",,"|n"&R1C25&RC[-8])&IF(RC[-7]="",,"|n"&R1C26&RC[-7])&IF(RC[-6]="",,"|n"&R1C27&RC[-6])&IF(RC[-5]="",,"|n"&R1C28&RC[-5])&IF(RC[-2]="",,"|n"&RC[-2]) -> 
AG515: =IF(RC[-26]&RC[-25]&RC[-24]&RC[-23]&RC[-22]&RC[-21]="",,R1C6)&IF(RC[-26]="",,"|n"&R1C7&RC[-26])&IF(RC[-25]="",,"|n"&R1C8&RC[-25])&IF(RC[-24]="",,"|n"&R1C9&RC[-24])&IF(RC[-23]="",,"|n"&R1C10&RC[-23])&IF(RC[-22]="",,"|n"&R1C11&RC[-22])&IF(RC[-21]="",,"|n"&R1C12&RC[-21])&IF(RC[-19]&RC[-18]&RC[-17]&RC[-16]="",,"|n"&R1C13)&IF(RC[-19]="",,"|n"&R1C14&RC[-19])&IF(RC[-18]="",,"|n"&R1C15&RC[-18])&IF(RC[-17]="",,"|n"&R1C16&RC[-17])&IF(RC[-16]="",,"|n"&R1C17&RC[-16])&IF(RC[-15]="",,"|n"&R1C18&RC[-15])&IF(RC[-14]="",,"|n"&R1C19&RC[-14])&IF(RC[-13]="",,"|n"&R1C20&RC[-13])&IF(RC[-12]="",,"|n"&R1C21&RC[-12])&IF(RC[-10]="",,"|n"&R1C23&RC[-10])&IF(RC[-9]="",,"|n"&R1C24&RC[-9])&IF(RC[-8]="",,"|n"&R1C25&RC[-8])&IF(RC[-7]="",,"|n"&R1C26&RC[-7])&IF(RC[-6]="",,"|n"&R1C27&RC[-6])&IF(RC[-5]="",,"|n"&R1C28&RC[-5])&IF(RC[-2]="",,"|n"&RC[-2]) -> 
AG516: =IF(RC[-26]&RC[-25]&RC[-24]&RC[-23]&RC[-22]&RC[-21]="",,R1C6)&IF(RC[-26]="",,"|n"&R1C7&RC[-26])&IF(RC[-25]="",,"|n"&R1C8&RC[-25])&IF(RC[-24]="",,"|n"&R1C9&RC[-24])&IF(RC[-23]="",,"|n"&R1C10&RC[-23])&IF(RC[-22]="",,"|n"&R1C11&RC[-22])&IF(RC[-21]="",,"|n"&R1C12&RC[-21])&IF(RC[-19]&RC[-18]&RC[-17]&RC[-16]="",,"|n"&R1C13)&IF(RC[-19]="",,"|n"&R1C14&RC[-19])&IF(RC[-18]="",,"|n"&R1C15&RC[-18])&IF(RC[-17]="",,"|n"&R1C16&RC[-17])&IF(RC[-16]="",,"|n"&R1C17&RC[-16])&IF(RC[-15]="",,"|n"&R1C18&RC[-15])&IF(RC[-14]="",,"|n"&R1C19&RC[-14])&IF(RC[-13]="",,"|n"&R1C20&RC[-13])&IF(RC[-12]="",,"|n"&R1C21&RC[-12])&IF(RC[-10]="",,"|n"&R1C23&RC[-10])&IF(RC[-9]="",,"|n"&R1C24&RC[-9])&IF(RC[-8]="",,"|n"&R1C25&RC[-8])&IF(RC[-7]="",,"|n"&R1C26&RC[-7])&IF(RC[-6]="",,"|n"&R1C27&RC[-6])&IF(RC[-5]="",,"|n"&R1C28&RC[-5])&IF(RC[-2]="",,"|n"&RC[-2]) -> 
AG517: =IF(RC[-26]&RC[-25]&RC[-24]&RC[-23]&RC[-22]&RC[-21]="",,R1C6)&IF(RC[-26]="",,"|n"&R1C7&RC[-26])&IF(RC[-25]="",,"|n"&R1C8&RC[-25])&IF(RC[-24]="",,"|n"&R1C9&RC[-24])&IF(RC[-23]="",,"|n"&R1C10&RC[-23])&IF(RC[-22]="",,"|n"&R1C11&RC[-22])&IF(RC[-21]="",,"|n"&R1C12&RC[-21])&IF(RC[-19]&RC[-18]&RC[-17]&RC[-16]="",,"|n"&R1C13)&IF(RC[-19]="",,"|n"&R1C14&RC[-19])&IF(RC[-18]="",,"|n"&R1C15&RC[-18])&IF(RC[-17]="",,"|n"&R1C16&RC[-17])&IF(RC[-16]="",,"|n"&R1C17&RC[-16])&IF(RC[-15]="",,"|n"&R1C18&RC[-15])&IF(RC[-14]="",,"|n"&R1C19&RC[-14])&IF(RC[-13]="",,"|n"&R1C20&RC[-13])&IF(RC[-12]="",,"|n"&R1C21&RC[-12])&IF(RC[-10]="",,"|n"&R1C23&RC[-10])&IF(RC[-9]="",,"|n"&R1C24&RC[-9])&IF(RC[-8]="",,"|n"&R1C25&RC[-8])&IF(RC[-7]="",,"|n"&R1C26&RC[-7])&IF(RC[-6]="",,"|n"&R1C27&RC[-6])&IF(RC[-5]="",,"|n"&R1C28&RC[-5])&IF(RC[-2]="",,"|n"&RC[-2]) -> 
AG518: =IF(RC[-26]&RC[-25]&RC[-24]&RC[-23]&RC[-22]&RC[-21]="",,R1C6)&IF(RC[-26]="",,"|n"&R1C7&RC[-26])&IF(RC[-25]="",,"|n"&R1C8&RC[-25])&IF(RC[-24]="",,"|n"&R1C9&RC[-24])&IF(RC[-23]="",,"|n"&R1C10&RC[-23])&IF(RC[-22]="",,"|n"&R1C11&RC[-22])&IF(RC[-21]="",,"|n"&R1C12&RC[-21])&IF(RC[-19]&RC[-18]&RC[-17]&RC[-16]="",,"|n"&R1C13)&IF(RC[-19]="",,"|n"&R1C14&RC[-19])&IF(RC[-18]="",,"|n"&R1C15&RC[-18])&IF(RC[-17]="",,"|n"&R1C16&RC[-17])&IF(RC[-16]="",,"|n"&R1C17&RC[-16])&IF(RC[-15]="",,"|n"&R1C18&RC[-15])&IF(RC[-14]="",,"|n"&R1C19&RC[-14])&IF(RC[-13]="",,"|n"&R1C20&RC[-13])&IF(RC[-12]="",,"|n"&R1C21&RC[-12])&IF(RC[-10]="",,"|n"&R1C23&RC[-10])&IF(RC[-9]="",,"|n"&R1C24&RC[-9])&IF(RC[-8]="",,"|n"&R1C25&RC[-8])&IF(RC[-7]="",,"|n"&R1C26&RC[-7])&IF(RC[-6]="",,"|n"&R1C27&RC[-6])&IF(RC[-5]="",,"|n"&R1C28&RC[-5])&IF(RC[-2]="",,"|n"&RC[-2]) -> 
AG519: =IF(RC[-26]&RC[-25]&RC[-24]&RC[-23]&RC[-22]&RC[-21]="",,R1C6)&IF(RC[-26]="",,"|n"&R1C7&RC[-26])&IF(RC[-25]="",,"|n"&R1C8&RC[-25])&IF(RC[-24]="",,"|n"&R1C9&RC[-24])&IF(RC[-23]="",,"|n"&R1C10&RC[-23])&IF(RC[-22]="",,"|n"&R1C11&RC[-22])&IF(RC[-21]="",,"|n"&R1C12&RC[-21])&IF(RC[-19]&RC[-18]&RC[-17]&RC[-16]="",,"|n"&R1C13)&IF(RC[-19]="",,"|n"&R1C14&RC[-19])&IF(RC[-18]="",,"|n"&R1C15&RC[-18])&IF(RC[-17]="",,"|n"&R1C16&RC[-17])&IF(RC[-16]="",,"|n"&R1C17&RC[-16])&IF(RC[-15]="",,"|n"&R1C18&RC[-15])&IF(RC[-14]="",,"|n"&R1C19&RC[-14])&IF(RC[-13]="",,"|n"&R1C20&RC[-13])&IF(RC[-12]="",,"|n"&R1C21&RC[-12])&IF(RC[-10]="",,"|n"&R1C23&RC[-10])&IF(RC[-9]="",,"|n"&R1C24&RC[-9])&IF(RC[-8]="",,"|n"&R1C25&RC[-8])&IF(RC[-7]="",,"|n"&R1C26&RC[-7])&IF(RC[-6]="",,"|n"&R1C27&RC[-6])&IF(RC[-5]="",,"|n"&R1C28&RC[-5])&IF(RC[-2]="",,"|n"&RC[-2]) -> 
AG520: =IF(RC[-26]&RC[-25]&RC[-24]&RC[-23]&RC[-22]&RC[-21]="",,R1C6)&IF(RC[-26]="",,"|n"&R1C7&RC[-26])&IF(RC[-25]="",,"|n"&R1C8&RC[-25])&IF(RC[-24]="",,"|n"&R1C9&RC[-24])&IF(RC[-23]="",,"|n"&R1C10&RC[-23])&IF(RC[-22]="",,"|n"&R1C11&RC[-22])&IF(RC[-21]="",,"|n"&R1C12&RC[-21])&IF(RC[-19]&RC[-18]&RC[-17]&RC[-16]="",,"|n"&R1C13)&IF(RC[-19]="",,"|n"&R1C14&RC[-19])&IF(RC[-18]="",,"|n"&R1C15&RC[-18])&IF(RC[-17]="",,"|n"&R1C16&RC[-17])&IF(RC[-16]="",,"|n"&R1C17&RC[-16])&IF(RC[-15]="",,"|n"&R1C18&RC[-15])&IF(RC[-14]="",,"|n"&R1C19&RC[-14])&IF(RC[-13]="",,"|n"&R1C20&RC[-13])&IF(RC[-12]="",,"|n"&R1C21&RC[-12])&IF(RC[-10]="",,"|n"&R1C23&RC[-10])&IF(RC[-9]="",,"|n"&R1C24&RC[-9])&IF(RC[-8]="",,"|n"&R1C25&RC[-8])&IF(RC[-7]="",,"|n"&R1C26&RC[-7])&IF(RC[-6]="",,"|n"&R1C27&RC[-6])&IF(RC[-5]="",,"|n"&R1C28&RC[-5])&IF(RC[-2]="",,"|n"&RC[-2]) -> 
AG521: =IF(RC[-26]&RC[-25]&RC[-24]&RC[-23]&RC[-22]&RC[-21]="",,R1C6)&IF(RC[-26]="",,"|n"&R1C7&RC[-26])&IF(RC[-25]="",,"|n"&R1C8&RC[-25])&IF(RC[-24]="",,"|n"&R1C9&RC[-24])&IF(RC[-23]="",,"|n"&R1C10&RC[-23])&IF(RC[-22]="",,"|n"&R1C11&RC[-22])&IF(RC[-21]="",,"|n"&R1C12&RC[-21])&IF(RC[-19]&RC[-18]&RC[-17]&RC[-16]="",,"|n"&R1C13)&IF(RC[-19]="",,"|n"&R1C14&RC[-19])&IF(RC[-18]="",,"|n"&R1C15&RC[-18])&IF(RC[-17]="",,"|n"&R1C16&RC[-17])&IF(RC[-16]="",,"|n"&R1C17&RC[-16])&IF(RC[-15]="",,"|n"&R1C18&RC[-15])&IF(RC[-14]="",,"|n"&R1C19&RC[-14])&IF(RC[-13]="",,"|n"&R1C20&RC[-13])&IF(RC[-12]="",,"|n"&R1C21&RC[-12])&IF(RC[-10]="",,"|n"&R1C23&RC[-10])&IF(RC[-9]="",,"|n"&R1C24&RC[-9])&IF(RC[-8]="",,"|n"&R1C25&RC[-8])&IF(RC[-7]="",,"|n"&R1C26&RC[-7])&IF(RC[-6]="",,"|n"&R1C27&RC[-6])&IF(RC[-5]="",,"|n"&R1C28&RC[-5])&IF(RC[-2]="",,"|n"&RC[-2]) -> 
AG522: =IF(RC[-26]&RC[-25]&RC[-24]&RC[-23]&RC[-22]&RC[-21]="",,R1C6)&IF(RC[-26]="",,"|n"&R1C7&RC[-26])&IF(RC[-25]="",,"|n"&R1C8&RC[-25])&IF(RC[-24]="",,"|n"&R1C9&RC[-24])&IF(RC[-23]="",,"|n"&R1C10&RC[-23])&IF(RC[-22]="",,"|n"&R1C11&RC[-22])&IF(RC[-21]="",,"|n"&R1C12&RC[-21])&IF(RC[-19]&RC[-18]&RC[-17]&RC[-16]="",,"|n"&R1C13)&IF(RC[-19]="",,"|n"&R1C14&RC[-19])&IF(RC[-18]="",,"|n"&R1C15&RC[-18])&IF(RC[-17]="",,"|n"&R1C16&RC[-17])&IF(RC[-16]="",,"|n"&R1C17&RC[-16])&IF(RC[-15]="",,"|n"&R1C18&RC[-15])&IF(RC[-14]="",,"|n"&R1C19&RC[-14])&IF(RC[-13]="",,"|n"&R1C20&RC[-13])&IF(RC[-12]="",,"|n"&R1C21&RC[-12])&IF(RC[-10]="",,"|n"&R1C23&RC[-10])&IF(RC[-9]="",,"|n"&R1C24&RC[-9])&IF(RC[-8]="",,"|n"&R1C25&RC[-8])&IF(RC[-7]="",,"|n"&R1C26&RC[-7])&IF(RC[-6]="",,"|n"&R1C27&RC[-6])&IF(RC[-5]="",,"|n"&R1C28&RC[-5])&IF(RC[-2]="",,"|n"&RC[-2]) -> 
AG523: =IF(RC[-26]&RC[-25]&RC[-24]&RC[-23]&RC[-22]&RC[-21]="",,R1C6)&IF(RC[-26]="",,"|n"&R1C7&RC[-26])&IF(RC[-25]="",,"|n"&R1C8&RC[-25])&IF(RC[-24]="",,"|n"&R1C9&RC[-24])&IF(RC[-23]="",,"|n"&R1C10&RC[-23])&IF(RC[-22]="",,"|n"&R1C11&RC[-22])&IF(RC[-21]="",,"|n"&R1C12&RC[-21])&IF(RC[-19]&RC[-18]&RC[-17]&RC[-16]="",,"|n"&R1C13)&IF(RC[-19]="",,"|n"&R1C14&RC[-19])&IF(RC[-18]="",,"|n"&R1C15&RC[-18])&IF(RC[-17]="",,"|n"&R1C16&RC[-17])&IF(RC[-16]="",,"|n"&R1C17&RC[-16])&IF(RC[-15]="",,"|n"&R1C18&RC[-15])&IF(RC[-14]="",,"|n"&R1C19&RC[-14])&IF(RC[-13]="",,"|n"&R1C20&RC[-13])&IF(RC[-12]="",,"|n"&R1C21&RC[-12])&IF(RC[-10]="",,"|n"&R1C23&RC[-10])&IF(RC[-9]="",,"|n"&R1C24&RC[-9])&IF(RC[-8]="",,"|n"&R1C25&RC[-8])&IF(RC[-7]="",,"|n"&R1C26&RC[-7])&IF(RC[-6]="",,"|n"&R1C27&RC[-6])&IF(RC[-5]="",,"|n"&R1C28&RC[-5])&IF(RC[-2]="",,"|n"&RC[-2]) -> 
AG524: =IF(RC[-26]&RC[-25]&RC[-24]&RC[-23]&RC[-22]&RC[-21]="",,R1C6)&IF(RC[-26]="",,"|n"&R1C7&RC[-26])&IF(RC[-25]="",,"|n"&R1C8&RC[-25])&IF(RC[-24]="",,"|n"&R1C9&RC[-24])&IF(RC[-23]="",,"|n"&R1C10&RC[-23])&IF(RC[-22]="",,"|n"&R1C11&RC[-22])&IF(RC[-21]="",,"|n"&R1C12&RC[-21])&IF(RC[-19]&RC[-18]&RC[-17]&RC[-16]="",,"|n"&R1C13)&IF(RC[-19]="",,"|n"&R1C14&RC[-19])&IF(RC[-18]="",,"|n"&R1C15&RC[-18])&IF(RC[-17]="",,"|n"&R1C16&RC[-17])&IF(RC[-16]="",,"|n"&R1C17&RC[-16])&IF(RC[-15]="",,"|n"&R1C18&RC[-15])&IF(RC[-14]="",,"|n"&R1C19&RC[-14])&IF(RC[-13]="",,"|n"&R1C20&RC[-13])&IF(RC[-12]="",,"|n"&R1C21&RC[-12])&IF(RC[-10]="",,"|n"&R1C23&RC[-10])&IF(RC[-9]="",,"|n"&R1C24&RC[-9])&IF(RC[-8]="",,"|n"&R1C25&RC[-8])&IF(RC[-7]="",,"|n"&R1C26&RC[-7])&IF(RC[-6]="",,"|n"&R1C27&RC[-6])&IF(RC[-5]="",,"|n"&R1C28&RC[-5])&IF(RC[-2]="",,"|n"&RC[-2]) -> 
AG525: =IF(RC[-26]&RC[-25]&RC[-24]&RC[-23]&RC[-22]&RC[-21]="",,R1C6)&IF(RC[-26]="",,"|n"&R1C7&RC[-26])&IF(RC[-25]="",,"|n"&R1C8&RC[-25])&IF(RC[-24]="",,"|n"&R1C9&RC[-24])&IF(RC[-23]="",,"|n"&R1C10&RC[-23])&IF(RC[-22]="",,"|n"&R1C11&RC[-22])&IF(RC[-21]="",,"|n"&R1C12&RC[-21])&IF(RC[-19]&RC[-18]&RC[-17]&RC[-16]="",,"|n"&R1C13)&IF(RC[-19]="",,"|n"&R1C14&RC[-19])&IF(RC[-18]="",,"|n"&R1C15&RC[-18])&IF(RC[-17]="",,"|n"&R1C16&RC[-17])&IF(RC[-16]="",,"|n"&R1C17&RC[-16])&IF(RC[-15]="",,"|n"&R1C18&RC[-15])&IF(RC[-14]="",,"|n"&R1C19&RC[-14])&IF(RC[-13]="",,"|n"&R1C20&RC[-13])&IF(RC[-12]="",,"|n"&R1C21&RC[-12])&IF(RC[-10]="",,"|n"&R1C23&RC[-10])&IF(RC[-9]="",,"|n"&R1C24&RC[-9])&IF(RC[-8]="",,"|n"&R1C25&RC[-8])&IF(RC[-7]="",,"|n"&R1C26&RC[-7])&IF(RC[-6]="",,"|n"&R1C27&RC[-6])&IF(RC[-5]="",,"|n"&R1C28&RC[-5])&IF(RC[-2]="",,"|n"&RC[-2]) -> 
AG526: =IF(RC[-26]&RC[-25]&RC[-24]&RC[-23]&RC[-22]&RC[-21]="",,R1C6)&IF(RC[-26]="",,"|n"&R1C7&RC[-26])&IF(RC[-25]="",,"|n"&R1C8&RC[-25])&IF(RC[-24]="",,"|n"&R1C9&RC[-24])&IF(RC[-23]="",,"|n"&R1C10&RC[-23])&IF(RC[-22]="",,"|n"&R1C11&RC[-22])&IF(RC[-21]="",,"|n"&R1C12&RC[-21])&IF(RC[-19]&RC[-18]&RC[-17]&RC[-16]="",,"|n"&R1C13)&IF(RC[-19]="",,"|n"&R1C14&RC[-19])&IF(RC[-18]="",,"|n"&R1C15&RC[-18])&IF(RC[-17]="",,"|n"&R1C16&RC[-17])&IF(RC[-16]="",,"|n"&R1C17&RC[-16])&IF(RC[-15]="",,"|n"&R1C18&RC[-15])&IF(RC[-14]="",,"|n"&R1C19&RC[-14])&IF(RC[-13]="",,"|n"&R1C20&RC[-13])&IF(RC[-12]="",,"|n"&R1C21&RC[-12])&IF(RC[-10]="",,"|n"&R1C23&RC[-10])&IF(RC[-9]="",,"|n"&R1C24&RC[-9])&IF(RC[-8]="",,"|n"&R1C25&RC[-8])&IF(RC[-7]="",,"|n"&R1C26&RC[-7])&IF(RC[-6]="",,"|n"&R1C27&RC[-6])&IF(RC[-5]="",,"|n"&R1C28&RC[-5])&IF(RC[-2]="",,"|n"&RC[-2]) -> 
AG527: =IF(RC[-26]&RC[-25]&RC[-24]&RC[-23]&RC[-22]&RC[-21]="",,R1C6)&IF(RC[-26]="",,"|n"&R1C7&RC[-26])&IF(RC[-25]="",,"|n"&R1C8&RC[-25])&IF(RC[-24]="",,"|n"&R1C9&RC[-24])&IF(RC[-23]="",,"|n"&R1C10&RC[-23])&IF(RC[-22]="",,"|n"&R1C11&RC[-22])&IF(RC[-21]="",,"|n"&R1C12&RC[-21])&IF(RC[-19]&RC[-18]&RC[-17]&RC[-16]="",,"|n"&R1C13)&IF(RC[-19]="",,"|n"&R1C14&RC[-19])&IF(RC[-18]="",,"|n"&R1C15&RC[-18])&IF(RC[-17]="",,"|n"&R1C16&RC[-17])&IF(RC[-16]="",,"|n"&R1C17&RC[-16])&IF(RC[-15]="",,"|n"&R1C18&RC[-15])&IF(RC[-14]="",,"|n"&R1C19&RC[-14])&IF(RC[-13]="",,"|n"&R1C20&RC[-13])&IF(RC[-12]="",,"|n"&R1C21&RC[-12])&IF(RC[-10]="",,"|n"&R1C23&RC[-10])&IF(RC[-9]="",,"|n"&R1C24&RC[-9])&IF(RC[-8]="",,"|n"&R1C25&RC[-8])&IF(RC[-7]="",,"|n"&R1C26&RC[-7])&IF(RC[-6]="",,"|n"&R1C27&RC[-6])&IF(RC[-5]="",,"|n"&R1C28&RC[-5])&IF(RC[-2]="",,"|n"&RC[-2]) -> 
AG528: =IF(RC[-26]&RC[-25]&RC[-24]&RC[-23]&RC[-22]&RC[-21]="",,R1C6)&IF(RC[-26]="",,"|n"&R1C7&RC[-26])&IF(RC[-25]="",,"|n"&R1C8&RC[-25])&IF(RC[-24]="",,"|n"&R1C9&RC[-24])&IF(RC[-23]="",,"|n"&R1C10&RC[-23])&IF(RC[-22]="",,"|n"&R1C11&RC[-22])&IF(RC[-21]="",,"|n"&R1C12&RC[-21])&IF(RC[-19]&RC[-18]&RC[-17]&RC[-16]="",,"|n"&R1C13)&IF(RC[-19]="",,"|n"&R1C14&RC[-19])&IF(RC[-18]="",,"|n"&R1C15&RC[-18])&IF(RC[-17]="",,"|n"&R1C16&RC[-17])&IF(RC[-16]="",,"|n"&R1C17&RC[-16])&IF(RC[-15]="",,"|n"&R1C18&RC[-15])&IF(RC[-14]="",,"|n"&R1C19&RC[-14])&IF(RC[-13]="",,"|n"&R1C20&RC[-13])&IF(RC[-12]="",,"|n"&R1C21&RC[-12])&IF(RC[-10]="",,"|n"&R1C23&RC[-10])&IF(RC[-9]="",,"|n"&R1C24&RC[-9])&IF(RC[-8]="",,"|n"&R1C25&RC[-8])&IF(RC[-7]="",,"|n"&R1C26&RC[-7])&IF(RC[-6]="",,"|n"&R1C27&RC[-6])&IF(RC[-5]="",,"|n"&R1C28&RC[-5])&IF(RC[-2]="",,"|n"&RC[-2]) -> 
AG529: =IF(RC[-26]&RC[-25]&RC[-24]&RC[-23]&RC[-22]&RC[-21]="",,R1C6)&IF(RC[-26]="",,"|n"&R1C7&RC[-26])&IF(RC[-25]="",,"|n"&R1C8&RC[-25])&IF(RC[-24]="",,"|n"&R1C9&RC[-24])&IF(RC[-23]="",,"|n"&R1C10&RC[-23])&IF(RC[-22]="",,"|n"&R1C11&RC[-22])&IF(RC[-21]="",,"|n"&R1C12&RC[-21])&IF(RC[-19]&RC[-18]&RC[-17]&RC[-16]="",,"|n"&R1C13)&IF(RC[-19]="",,"|n"&R1C14&RC[-19])&IF(RC[-18]="",,"|n"&R1C15&RC[-18])&IF(RC[-17]="",,"|n"&R1C16&RC[-17])&IF(RC[-16]="",,"|n"&R1C17&RC[-16])&IF(RC[-15]="",,"|n"&R1C18&RC[-15])&IF(RC[-14]="",,"|n"&R1C19&RC[-14])&IF(RC[-13]="",,"|n"&R1C20&RC[-13])&IF(RC[-12]="",,"|n"&R1C21&RC[-12])&IF(RC[-10]="",,"|n"&R1C23&RC[-10])&IF(RC[-9]="",,"|n"&R1C24&RC[-9])&IF(RC[-8]="",,"|n"&R1C25&RC[-8])&IF(RC[-7]="",,"|n"&R1C26&RC[-7])&IF(RC[-6]="",,"|n"&R1C27&RC[-6])&IF(RC[-5]="",,"|n"&R1C28&RC[-5])&IF(RC[-2]="",,"|n"&RC[-2]) -> 
AG530: =IF(RC[-26]&RC[-25]&RC[-24]&RC[-23]&RC[-22]&RC[-21]="",,R1C6)&IF(RC[-26]="",,"|n"&R1C7&RC[-26])&IF(RC[-25]="",,"|n"&R1C8&RC[-25])&IF(RC[-24]="",,"|n"&R1C9&RC[-24])&IF(RC[-23]="",,"|n"&R1C10&RC[-23])&IF(RC[-22]="",,"|n"&R1C11&RC[-22])&IF(RC[-21]="",,"|n"&R1C12&RC[-21])&IF(RC[-19]&RC[-18]&RC[-17]&RC[-16]="",,"|n"&R1C13)&IF(RC[-19]="",,"|n"&R1C14&RC[-19])&IF(RC[-18]="",,"|n"&R1C15&RC[-18])&IF(RC[-17]="",,"|n"&R1C16&RC[-17])&IF(RC[-16]="",,"|n"&R1C17&RC[-16])&IF(RC[-15]="",,"|n"&R1C18&RC[-15])&IF(RC[-14]="",,"|n"&R1C19&RC[-14])&IF(RC[-13]="",,"|n"&R1C20&RC[-13])&IF(RC[-12]="",,"|n"&R1C21&RC[-12])&IF(RC[-10]="",,"|n"&R1C23&RC[-10])&IF(RC[-9]="",,"|n"&R1C24&RC[-9])&IF(RC[-8]="",,"|n"&R1C25&RC[-8])&IF(RC[-7]="",,"|n"&R1C26&RC[-7])&IF(RC[-6]="",,"|n"&R1C27&RC[-6])&IF(RC[-5]="",,"|n"&R1C28&RC[-5])&IF(RC[-2]="",,"|n"&RC[-2]) -> 
AG531: =IF(RC[-26]&RC[-25]&RC[-24]&RC[-23]&RC[-22]&RC[-21]="",,R1C6)&IF(RC[-26]="",,"|n"&R1C7&RC[-26])&IF(RC[-25]="",,"|n"&R1C8&RC[-25])&IF(RC[-24]="",,"|n"&R1C9&RC[-24])&IF(RC[-23]="",,"|n"&R1C10&RC[-23])&IF(RC[-22]="",,"|n"&R1C11&RC[-22])&IF(RC[-21]="",,"|n"&R1C12&RC[-21])&IF(RC[-19]&RC[-18]&RC[-17]&RC[-16]="",,"|n"&R1C13)&IF(RC[-19]="",,"|n"&R1C14&RC[-19])&IF(RC[-18]="",,"|n"&R1C15&RC[-18])&IF(RC[-17]="",,"|n"&R1C16&RC[-17])&IF(RC[-16]="",,"|n"&R1C17&RC[-16])&IF(RC[-15]="",,"|n"&R1C18&RC[-15])&IF(RC[-14]="",,"|n"&R1C19&RC[-14])&IF(RC[-13]="",,"|n"&R1C20&RC[-13])&IF(RC[-12]="",,"|n"&R1C21&RC[-12])&IF(RC[-10]="",,"|n"&R1C23&RC[-10])&IF(RC[-9]="",,"|n"&R1C24&RC[-9])&IF(RC[-8]="",,"|n"&R1C25&RC[-8])&IF(RC[-7]="",,"|n"&R1C26&RC[-7])&IF(RC[-6]="",,"|n"&R1C27&RC[-6])&IF(RC[-5]="",,"|n"&R1C28&RC[-5])&IF(RC[-2]="",,"|n"&RC[-2]) -> 
AG532: =IF(RC[-26]&RC[-25]&RC[-24]&RC[-23]&RC[-22]&RC[-21]="",,R1C6)&IF(RC[-26]="",,"|n"&R1C7&RC[-26])&IF(RC[-25]="",,"|n"&R1C8&RC[-25])&IF(RC[-24]="",,"|n"&R1C9&RC[-24])&IF(RC[-23]="",,"|n"&R1C10&RC[-23])&IF(RC[-22]="",,"|n"&R1C11&RC[-22])&IF(RC[-21]="",,"|n"&R1C12&RC[-21])&IF(RC[-19]&RC[-18]&RC[-17]&RC[-16]="",,"|n"&R1C13)&IF(RC[-19]="",,"|n"&R1C14&RC[-19])&IF(RC[-18]="",,"|n"&R1C15&RC[-18])&IF(RC[-17]="",,"|n"&R1C16&RC[-17])&IF(RC[-16]="",,"|n"&R1C17&RC[-16])&IF(RC[-15]="",,"|n"&R1C18&RC[-15])&IF(RC[-14]="",,"|n"&R1C19&RC[-14])&IF(RC[-13]="",,"|n"&R1C20&RC[-13])&IF(RC[-12]="",,"|n"&R1C21&RC[-12])&IF(RC[-10]="",,"|n"&R1C23&RC[-10])&IF(RC[-9]="",,"|n"&R1C24&RC[-9])&IF(RC[-8]="",,"|n"&R1C25&RC[-8])&IF(RC[-7]="",,"|n"&R1C26&RC[-7])&IF(RC[-6]="",,"|n"&R1C27&RC[-6])&IF(RC[-5]="",,"|n"&R1C28&RC[-5])&IF(RC[-2]="",,"|n"&RC[-2]) -> 
AG533: =IF(RC[-26]&RC[-25]&RC[-24]&RC[-23]&RC[-22]&RC[-21]="",,R1C6)&IF(RC[-26]="",,"|n"&R1C7&RC[-26])&IF(RC[-25]="",,"|n"&R1C8&RC[-25])&IF(RC[-24]="",,"|n"&R1C9&RC[-24])&IF(RC[-23]="",,"|n"&R1C10&RC[-23])&IF(RC[-22]="",,"|n"&R1C11&RC[-22])&IF(RC[-21]="",,"|n"&R1C12&RC[-21])&IF(RC[-19]&RC[-18]&RC[-17]&RC[-16]="",,"|n"&R1C13)&IF(RC[-19]="",,"|n"&R1C14&RC[-19])&IF(RC[-18]="",,"|n"&R1C15&RC[-18])&IF(RC[-17]="",,"|n"&R1C16&RC[-17])&IF(RC[-16]="",,"|n"&R1C17&RC[-16])&IF(RC[-15]="",,"|n"&R1C18&RC[-15])&IF(RC[-14]="",,"|n"&R1C19&RC[-14])&IF(RC[-13]="",,"|n"&R1C20&RC[-13])&IF(RC[-12]="",,"|n"&R1C21&RC[-12])&IF(RC[-10]="",,"|n"&R1C23&RC[-10])&IF(RC[-9]="",,"|n"&R1C24&RC[-9])&IF(RC[-8]="",,"|n"&R1C25&RC[-8])&IF(RC[-7]="",,"|n"&R1C26&RC[-7])&IF(RC[-6]="",,"|n"&R1C27&RC[-6])&IF(RC[-5]="",,"|n"&R1C28&RC[-5])&IF(RC[-2]="",,"|n"&RC[-2]) -> 
AG534: =IF(RC[-26]&RC[-25]&RC[-24]&RC[-23]&RC[-22]&RC[-21]="",,R1C6)&IF(RC[-26]="",,"|n"&R1C7&RC[-26])&IF(RC[-25]="",,"|n"&R1C8&RC[-25])&IF(RC[-24]="",,"|n"&R1C9&RC[-24])&IF(RC[-23]="",,"|n"&R1C10&RC[-23])&IF(RC[-22]="",,"|n"&R1C11&RC[-22])&IF(RC[-21]="",,"|n"&R1C12&RC[-21])&IF(RC[-19]&RC[-18]&RC[-17]&RC[-16]="",,"|n"&R1C13)&IF(RC[-19]="",,"|n"&R1C14&RC[-19])&IF(RC[-18]="",,"|n"&R1C15&RC[-18])&IF(RC[-17]="",,"|n"&R1C16&RC[-17])&IF(RC[-16]="",,"|n"&R1C17&RC[-16])&IF(RC[-15]="",,"|n"&R1C18&RC[-15])&IF(RC[-14]="",,"|n"&R1C19&RC[-14])&IF(RC[-13]="",,"|n"&R1C20&RC[-13])&IF(RC[-12]="",,"|n"&R1C21&RC[-12])&IF(RC[-10]="",,"|n"&R1C23&RC[-10])&IF(RC[-9]="",,"|n"&R1C24&RC[-9])&IF(RC[-8]="",,"|n"&R1C25&RC[-8])&IF(RC[-7]="",,"|n"&R1C26&RC[-7])&IF(RC[-6]="",,"|n"&R1C27&RC[-6])&IF(RC[-5]="",,"|n"&R1C28&RC[-5])&IF(RC[-2]="",,"|n"&RC[-2]) -> 
AG535: =IF(RC[-26]&RC[-25]&RC[-24]&RC[-23]&RC[-22]&RC[-21]="",,R1C6)&IF(RC[-26]="",,"|n"&R1C7&RC[-26])&IF(RC[-25]="",,"|n"&R1C8&RC[-25])&IF(RC[-24]="",,"|n"&R1C9&RC[-24])&IF(RC[-23]="",,"|n"&R1C10&RC[-23])&IF(RC[-22]="",,"|n"&R1C11&RC[-22])&IF(RC[-21]="",,"|n"&R1C12&RC[-21])&IF(RC[-19]&RC[-18]&RC[-17]&RC[-16]="",,"|n"&R1C13)&IF(RC[-19]="",,"|n"&R1C14&RC[-19])&IF(RC[-18]="",,"|n"&R1C15&RC[-18])&IF(RC[-17]="",,"|n"&R1C16&RC[-17])&IF(RC[-16]="",,"|n"&R1C17&RC[-16])&IF(RC[-15]="",,"|n"&R1C18&RC[-15])&IF(RC[-14]="",,"|n"&R1C19&RC[-14])&IF(RC[-13]="",,"|n"&R1C20&RC[-13])&IF(RC[-12]="",,"|n"&R1C21&RC[-12])&IF(RC[-10]="",,"|n"&R1C23&RC[-10])&IF(RC[-9]="",,"|n"&R1C24&RC[-9])&IF(RC[-8]="",,"|n"&R1C25&RC[-8])&IF(RC[-7]="",,"|n"&R1C26&RC[-7])&IF(RC[-6]="",,"|n"&R1C27&RC[-6])&IF(RC[-5]="",,"|n"&R1C28&RC[-5])&IF(RC[-2]="",,"|n"&RC[-2]) -> 
AG536: =IF(RC[-26]&RC[-25]&RC[-24]&RC[-23]&RC[-22]&RC[-21]="",,R1C6)&IF(RC[-26]="",,"|n"&R1C7&RC[-26])&IF(RC[-25]="",,"|n"&R1C8&RC[-25])&IF(RC[-24]="",,"|n"&R1C9&RC[-24])&IF(RC[-23]="",,"|n"&R1C10&RC[-23])&IF(RC[-22]="",,"|n"&R1C11&RC[-22])&IF(RC[-21]="",,"|n"&R1C12&RC[-21])&IF(RC[-19]&RC[-18]&RC[-17]&RC[-16]="",,"|n"&R1C13)&IF(RC[-19]="",,"|n"&R1C14&RC[-19])&IF(RC[-18]="",,"|n"&R1C15&RC[-18])&IF(RC[-17]="",,"|n"&R1C16&RC[-17])&IF(RC[-16]="",,"|n"&R1C17&RC[-16])&IF(RC[-15]="",,"|n"&R1C18&RC[-15])&IF(RC[-14]="",,"|n"&R1C19&RC[-14])&IF(RC[-13]="",,"|n"&R1C20&RC[-13])&IF(RC[-12]="",,"|n"&R1C21&RC[-12])&IF(RC[-10]="",,"|n"&R1C23&RC[-10])&IF(RC[-9]="",,"|n"&R1C24&RC[-9])&IF(RC[-8]="",,"|n"&R1C25&RC[-8])&IF(RC[-7]="",,"|n"&R1C26&RC[-7])&IF(RC[-6]="",,"|n"&R1C27&RC[-6])&IF(RC[-5]="",,"|n"&R1C28&RC[-5])&IF(RC[-2]="",,"|n"&RC[-2]) -> 
AG537: =IF(RC[-26]&RC[-25]&RC[-24]&RC[-23]&RC[-22]&RC[-21]="",,R1C6)&IF(RC[-26]="",,"|n"&R1C7&RC[-26])&IF(RC[-25]="",,"|n"&R1C8&RC[-25])&IF(RC[-24]="",,"|n"&R1C9&RC[-24])&IF(RC[-23]="",,"|n"&R1C10&RC[-23])&IF(RC[-22]="",,"|n"&R1C11&RC[-22])&IF(RC[-21]="",,"|n"&R1C12&RC[-21])&IF(RC[-19]&RC[-18]&RC[-17]&RC[-16]="",,"|n"&R1C13)&IF(RC[-19]="",,"|n"&R1C14&RC[-19])&IF(RC[-18]="",,"|n"&R1C15&RC[-18])&IF(RC[-17]="",,"|n"&R1C16&RC[-17])&IF(RC[-16]="",,"|n"&R1C17&RC[-16])&IF(RC[-15]="",,"|n"&R1C18&RC[-15])&IF(RC[-14]="",,"|n"&R1C19&RC[-14])&IF(RC[-13]="",,"|n"&R1C20&RC[-13])&IF(RC[-12]="",,"|n"&R1C21&RC[-12])&IF(RC[-10]="",,"|n"&R1C23&RC[-10])&IF(RC[-9]="",,"|n"&R1C24&RC[-9])&IF(RC[-8]="",,"|n"&R1C25&RC[-8])&IF(RC[-7]="",,"|n"&R1C26&RC[-7])&IF(RC[-6]="",,"|n"&R1C27&RC[-6])&IF(RC[-5]="",,"|n"&R1C28&RC[-5])&IF(RC[-2]="",,"|n"&RC[-2]) -> 
AG538: =IF(RC[-26]&RC[-25]&RC[-24]&RC[-23]&RC[-22]&RC[-21]="",,R1C6)&IF(RC[-26]="",,"|n"&R1C7&RC[-26])&IF(RC[-25]="",,"|n"&R1C8&RC[-25])&IF(RC[-24]="",,"|n"&R1C9&RC[-24])&IF(RC[-23]="",,"|n"&R1C10&RC[-23])&IF(RC[-22]="",,"|n"&R1C11&RC[-22])&IF(RC[-21]="",,"|n"&R1C12&RC[-21])&IF(RC[-19]&RC[-18]&RC[-17]&RC[-16]="",,"|n"&R1C13)&IF(RC[-19]="",,"|n"&R1C14&RC[-19])&IF(RC[-18]="",,"|n"&R1C15&RC[-18])&IF(RC[-17]="",,"|n"&R1C16&RC[-17])&IF(RC[-16]="",,"|n"&R1C17&RC[-16])&IF(RC[-15]="",,"|n"&R1C18&RC[-15])&IF(RC[-14]="",,"|n"&R1C19&RC[-14])&IF(RC[-13]="",,"|n"&R1C20&RC[-13])&IF(RC[-12]="",,"|n"&R1C21&RC[-12])&IF(RC[-10]="",,"|n"&R1C23&RC[-10])&IF(RC[-9]="",,"|n"&R1C24&RC[-9])&IF(RC[-8]="",,"|n"&R1C25&RC[-8])&IF(RC[-7]="",,"|n"&R1C26&RC[-7])&IF(RC[-6]="",,"|n"&R1C27&RC[-6])&IF(RC[-5]="",,"|n"&R1C28&RC[-5])&IF(RC[-2]="",,"|n"&RC[-2]) -> 
AG539: =IF(RC[-26]&RC[-25]&RC[-24]&RC[-23]&RC[-22]&RC[-21]="",,R1C6)&IF(RC[-26]="",,"|n"&R1C7&RC[-26])&IF(RC[-25]="",,"|n"&R1C8&RC[-25])&IF(RC[-24]="",,"|n"&R1C9&RC[-24])&IF(RC[-23]="",,"|n"&R1C10&RC[-23])&IF(RC[-22]="",,"|n"&R1C11&RC[-22])&IF(RC[-21]="",,"|n"&R1C12&RC[-21])&IF(RC[-19]&RC[-18]&RC[-17]&RC[-16]="",,"|n"&R1C13)&IF(RC[-19]="",,"|n"&R1C14&RC[-19])&IF(RC[-18]="",,"|n"&R1C15&RC[-18])&IF(RC[-17]="",,"|n"&R1C16&RC[-17])&IF(RC[-16]="",,"|n"&R1C17&RC[-16])&IF(RC[-15]="",,"|n"&R1C18&RC[-15])&IF(RC[-14]="",,"|n"&R1C19&RC[-14])&IF(RC[-13]="",,"|n"&R1C20&RC[-13])&IF(RC[-12]="",,"|n"&R1C21&RC[-12])&IF(RC[-10]="",,"|n"&R1C23&RC[-10])&IF(RC[-9]="",,"|n"&R1C24&RC[-9])&IF(RC[-8]="",,"|n"&R1C25&RC[-8])&IF(RC[-7]="",,"|n"&R1C26&RC[-7])&IF(RC[-6]="",,"|n"&R1C27&RC[-6])&IF(RC[-5]="",,"|n"&R1C28&RC[-5])&IF(RC[-2]="",,"|n"&RC[-2]) -> 
AG540: =IF(RC[-26]&RC[-25]&RC[-24]&RC[-23]&RC[-22]&RC[-21]="",,R1C6)&IF(RC[-26]="",,"|n"&R1C7&RC[-26])&IF(RC[-25]="",,"|n"&R1C8&RC[-25])&IF(RC[-24]="",,"|n"&R1C9&RC[-24])&IF(RC[-23]="",,"|n"&R1C10&RC[-23])&IF(RC[-22]="",,"|n"&R1C11&RC[-22])&IF(RC[-21]="",,"|n"&R1C12&RC[-21])&IF(RC[-19]&RC[-18]&RC[-17]&RC[-16]="",,"|n"&R1C13)&IF(RC[-19]="",,"|n"&R1C14&RC[-19])&IF(RC[-18]="",,"|n"&R1C15&RC[-18])&IF(RC[-17]="",,"|n"&R1C16&RC[-17])&IF(RC[-16]="",,"|n"&R1C17&RC[-16])&IF(RC[-15]="",,"|n"&R1C18&RC[-15])&IF(RC[-14]="",,"|n"&R1C19&RC[-14])&IF(RC[-13]="",,"|n"&R1C20&RC[-13])&IF(RC[-12]="",,"|n"&R1C21&RC[-12])&IF(RC[-10]="",,"|n"&R1C23&RC[-10])&IF(RC[-9]="",,"|n"&R1C24&RC[-9])&IF(RC[-8]="",,"|n"&R1C25&RC[-8])&IF(RC[-7]="",,"|n"&R1C26&RC[-7])&IF(RC[-6]="",,"|n"&R1C27&RC[-6])&IF(RC[-5]="",,"|n"&R1C28&RC[-5])&IF(RC[-2]="",,"|n"&RC[-2]) -> 
AG541: =IF(RC[-26]&RC[-25]&RC[-24]&RC[-23]&RC[-22]&RC[-21]="",,R1C6)&IF(RC[-26]="",,"|n"&R1C7&RC[-26])&IF(RC[-25]="",,"|n"&R1C8&RC[-25])&IF(RC[-24]="",,"|n"&R1C9&RC[-24])&IF(RC[-23]="",,"|n"&R1C10&RC[-23])&IF(RC[-22]="",,"|n"&R1C11&RC[-22])&IF(RC[-21]="",,"|n"&R1C12&RC[-21])&IF(RC[-19]&RC[-18]&RC[-17]&RC[-16]="",,"|n"&R1C13)&IF(RC[-19]="",,"|n"&R1C14&RC[-19])&IF(RC[-18]="",,"|n"&R1C15&RC[-18])&IF(RC[-17]="",,"|n"&R1C16&RC[-17])&IF(RC[-16]="",,"|n"&R1C17&RC[-16])&IF(RC[-15]="",,"|n"&R1C18&RC[-15])&IF(RC[-14]="",,"|n"&R1C19&RC[-14])&IF(RC[-13]="",,"|n"&R1C20&RC[-13])&IF(RC[-12]="",,"|n"&R1C21&RC[-12])&IF(RC[-10]="",,"|n"&R1C23&RC[-10])&IF(RC[-9]="",,"|n"&R1C24&RC[-9])&IF(RC[-8]="",,"|n"&R1C25&RC[-8])&IF(RC[-7]="",,"|n"&R1C26&RC[-7])&IF(RC[-6]="",,"|n"&R1C27&RC[-6])&IF(RC[-5]="",,"|n"&R1C28&RC[-5])&IF(RC[-2]="",,"|n"&RC[-2]) -> 
AG542: =IF(RC[-26]&RC[-25]&RC[-24]&RC[-23]&RC[-22]&RC[-21]="",,R1C6)&IF(RC[-26]="",,"|n"&R1C7&RC[-26])&IF(RC[-25]="",,"|n"&R1C8&RC[-25])&IF(RC[-24]="",,"|n"&R1C9&RC[-24])&IF(RC[-23]="",,"|n"&R1C10&RC[-23])&IF(RC[-22]="",,"|n"&R1C11&RC[-22])&IF(RC[-21]="",,"|n"&R1C12&RC[-21])&IF(RC[-19]&RC[-18]&RC[-17]&RC[-16]="",,"|n"&R1C13)&IF(RC[-19]="",,"|n"&R1C14&RC[-19])&IF(RC[-18]="",,"|n"&R1C15&RC[-18])&IF(RC[-17]="",,"|n"&R1C16&RC[-17])&IF(RC[-16]="",,"|n"&R1C17&RC[-16])&IF(RC[-15]="",,"|n"&R1C18&RC[-15])&IF(RC[-14]="",,"|n"&R1C19&RC[-14])&IF(RC[-13]="",,"|n"&R1C20&RC[-13])&IF(RC[-12]="",,"|n"&R1C21&RC[-12])&IF(RC[-10]="",,"|n"&R1C23&RC[-10])&IF(RC[-9]="",,"|n"&R1C24&RC[-9])&IF(RC[-8]="",,"|n"&R1C25&RC[-8])&IF(RC[-7]="",,"|n"&R1C26&RC[-7])&IF(RC[-6]="",,"|n"&R1C27&RC[-6])&IF(RC[-5]="",,"|n"&R1C28&RC[-5])&IF(RC[-2]="",,"|n"&RC[-2]) -> 
AG543: =IF(RC[-26]&RC[-25]&RC[-24]&RC[-23]&RC[-22]&RC[-21]="",,R1C6)&IF(RC[-26]="",,"|n"&R1C7&RC[-26])&IF(RC[-25]="",,"|n"&R1C8&RC[-25])&IF(RC[-24]="",,"|n"&R1C9&RC[-24])&IF(RC[-23]="",,"|n"&R1C10&RC[-23])&IF(RC[-22]="",,"|n"&R1C11&RC[-22])&IF(RC[-21]="",,"|n"&R1C12&RC[-21])&IF(RC[-19]&RC[-18]&RC[-17]&RC[-16]="",,"|n"&R1C13)&IF(RC[-19]="",,"|n"&R1C14&RC[-19])&IF(RC[-18]="",,"|n"&R1C15&RC[-18])&IF(RC[-17]="",,"|n"&R1C16&RC[-17])&IF(RC[-16]="",,"|n"&R1C17&RC[-16])&IF(RC[-15]="",,"|n"&R1C18&RC[-15])&IF(RC[-14]="",,"|n"&R1C19&RC[-14])&IF(RC[-13]="",,"|n"&R1C20&RC[-13])&IF(RC[-12]="",,"|n"&R1C21&RC[-12])&IF(RC[-10]="",,"|n"&R1C23&RC[-10])&IF(RC[-9]="",,"|n"&R1C24&RC[-9])&IF(RC[-8]="",,"|n"&R1C25&RC[-8])&IF(RC[-7]="",,"|n"&R1C26&RC[-7])&IF(RC[-6]="",,"|n"&R1C27&RC[-6])&IF(RC[-5]="",,"|n"&R1C28&RC[-5])&IF(RC[-2]="",,"|n"&RC[-2]) -> 
AG544: =IF(RC[-26]&RC[-25]&RC[-24]&RC[-23]&RC[-22]&RC[-21]="",,R1C6)&IF(RC[-26]="",,"|n"&R1C7&RC[-26])&IF(RC[-25]="",,"|n"&R1C8&RC[-25])&IF(RC[-24]="",,"|n"&R1C9&RC[-24])&IF(RC[-23]="",,"|n"&R1C10&RC[-23])&IF(RC[-22]="",,"|n"&R1C11&RC[-22])&IF(RC[-21]="",,"|n"&R1C12&RC[-21])&IF(RC[-19]&RC[-18]&RC[-17]&RC[-16]="",,"|n"&R1C13)&IF(RC[-19]="",,"|n"&R1C14&RC[-19])&IF(RC[-18]="",,"|n"&R1C15&RC[-18])&IF(RC[-17]="",,"|n"&R1C16&RC[-17])&IF(RC[-16]="",,"|n"&R1C17&RC[-16])&IF(RC[-15]="",,"|n"&R1C18&RC[-15])&IF(RC[-14]="",,"|n"&R1C19&RC[-14])&IF(RC[-13]="",,"|n"&R1C20&RC[-13])&IF(RC[-12]="",,"|n"&R1C21&RC[-12])&IF(RC[-10]="",,"|n"&R1C23&RC[-10])&IF(RC[-9]="",,"|n"&R1C24&RC[-9])&IF(RC[-8]="",,"|n"&R1C25&RC[-8])&IF(RC[-7]="",,"|n"&R1C26&RC[-7])&IF(RC[-6]="",,"|n"&R1C27&RC[-6])&IF(RC[-5]="",,"|n"&R1C28&RC[-5])&IF(RC[-2]="",,"|n"&RC[-2]) -> 
AG545: =IF(RC[-26]&RC[-25]&RC[-24]&RC[-23]&RC[-22]&RC[-21]="",,R1C6)&IF(RC[-26]="",,"|n"&R1C7&RC[-26])&IF(RC[-25]="",,"|n"&R1C8&RC[-25])&IF(RC[-24]="",,"|n"&R1C9&RC[-24])&IF(RC[-23]="",,"|n"&R1C10&RC[-23])&IF(RC[-22]="",,"|n"&R1C11&RC[-22])&IF(RC[-21]="",,"|n"&R1C12&RC[-21])&IF(RC[-19]&RC[-18]&RC[-17]&RC[-16]="",,"|n"&R1C13)&IF(RC[-19]="",,"|n"&R1C14&RC[-19])&IF(RC[-18]="",,"|n"&R1C15&RC[-18])&IF(RC[-17]="",,"|n"&R1C16&RC[-17])&IF(RC[-16]="",,"|n"&R1C17&RC[-16])&IF(RC[-15]="",,"|n"&R1C18&RC[-15])&IF(RC[-14]="",,"|n"&R1C19&RC[-14])&IF(RC[-13]="",,"|n"&R1C20&RC[-13])&IF(RC[-12]="",,"|n"&R1C21&RC[-12])&IF(RC[-10]="",,"|n"&R1C23&RC[-10])&IF(RC[-9]="",,"|n"&R1C24&RC[-9])&IF(RC[-8]="",,"|n"&R1C25&RC[-8])&IF(RC[-7]="",,"|n"&R1C26&RC[-7])&IF(RC[-6]="",,"|n"&R1C27&RC[-6])&IF(RC[-5]="",,"|n"&R1C28&RC[-5])&IF(RC[-2]="",,"|n"&RC[-2]) -> 
AG546: =IF(RC[-26]&RC[-25]&RC[-24]&RC[-23]&RC[-22]&RC[-21]="",,R1C6)&IF(RC[-26]="",,"|n"&R1C7&RC[-26])&IF(RC[-25]="",,"|n"&R1C8&RC[-25])&IF(RC[-24]="",,"|n"&R1C9&RC[-24])&IF(RC[-23]="",,"|n"&R1C10&RC[-23])&IF(RC[-22]="",,"|n"&R1C11&RC[-22])&IF(RC[-21]="",,"|n"&R1C12&RC[-21])&IF(RC[-19]&RC[-18]&RC[-17]&RC[-16]="",,"|n"&R1C13)&IF(RC[-19]="",,"|n"&R1C14&RC[-19])&IF(RC[-18]="",,"|n"&R1C15&RC[-18])&IF(RC[-17]="",,"|n"&R1C16&RC[-17])&IF(RC[-16]="",,"|n"&R1C17&RC[-16])&IF(RC[-15]="",,"|n"&R1C18&RC[-15])&IF(RC[-14]="",,"|n"&R1C19&RC[-14])&IF(RC[-13]="",,"|n"&R1C20&RC[-13])&IF(RC[-12]="",,"|n"&R1C21&RC[-12])&IF(RC[-10]="",,"|n"&R1C23&RC[-10])&IF(RC[-9]="",,"|n"&R1C24&RC[-9])&IF(RC[-8]="",,"|n"&R1C25&RC[-8])&IF(RC[-7]="",,"|n"&R1C26&RC[-7])&IF(RC[-6]="",,"|n"&R1C27&RC[-6])&IF(RC[-5]="",,"|n"&R1C28&RC[-5])&IF(RC[-2]="",,"|n"&RC[-2]) -> 
AG547: =IF(RC[-26]&RC[-25]&RC[-24]&RC[-23]&RC[-22]&RC[-21]="",,R1C6)&IF(RC[-26]="",,"|n"&R1C7&RC[-26])&IF(RC[-25]="",,"|n"&R1C8&RC[-25])&IF(RC[-24]="",,"|n"&R1C9&RC[-24])&IF(RC[-23]="",,"|n"&R1C10&RC[-23])&IF(RC[-22]="",,"|n"&R1C11&RC[-22])&IF(RC[-21]="",,"|n"&R1C12&RC[-21])&IF(RC[-19]&RC[-18]&RC[-17]&RC[-16]="",,"|n"&R1C13)&IF(RC[-19]="",,"|n"&R1C14&RC[-19])&IF(RC[-18]="",,"|n"&R1C15&RC[-18])&IF(RC[-17]="",,"|n"&R1C16&RC[-17])&IF(RC[-16]="",,"|n"&R1C17&RC[-16])&IF(RC[-15]="",,"|n"&R1C18&RC[-15])&IF(RC[-14]="",,"|n"&R1C19&RC[-14])&IF(RC[-13]="",,"|n"&R1C20&RC[-13])&IF(RC[-12]="",,"|n"&R1C21&RC[-12])&IF(RC[-10]="",,"|n"&R1C23&RC[-10])&IF(RC[-9]="",,"|n"&R1C24&RC[-9])&IF(RC[-8]="",,"|n"&R1C25&RC[-8])&IF(RC[-7]="",,"|n"&R1C26&RC[-7])&IF(RC[-6]="",,"|n"&R1C27&RC[-6])&IF(RC[-5]="",,"|n"&R1C28&RC[-5])&IF(RC[-2]="",,"|n"&RC[-2]) -> 
AG548: =IF(RC[-26]&RC[-25]&RC[-24]&RC[-23]&RC[-22]&RC[-21]="",,R1C6)&IF(RC[-26]="",,"|n"&R1C7&RC[-26])&IF(RC[-25]="",,"|n"&R1C8&RC[-25])&IF(RC[-24]="",,"|n"&R1C9&RC[-24])&IF(RC[-23]="",,"|n"&R1C10&RC[-23])&IF(RC[-22]="",,"|n"&R1C11&RC[-22])&IF(RC[-21]="",,"|n"&R1C12&RC[-21])&IF(RC[-19]&RC[-18]&RC[-17]&RC[-16]="",,"|n"&R1C13)&IF(RC[-19]="",,"|n"&R1C14&RC[-19])&IF(RC[-18]="",,"|n"&R1C15&RC[-18])&IF(RC[-17]="",,"|n"&R1C16&RC[-17])&IF(RC[-16]="",,"|n"&R1C17&RC[-16])&IF(RC[-15]="",,"|n"&R1C18&RC[-15])&IF(RC[-14]="",,"|n"&R1C19&RC[-14])&IF(RC[-13]="",,"|n"&R1C20&RC[-13])&IF(RC[-12]="",,"|n"&R1C21&RC[-12])&IF(RC[-10]="",,"|n"&R1C23&RC[-10])&IF(RC[-9]="",,"|n"&R1C24&RC[-9])&IF(RC[-8]="",,"|n"&R1C25&RC[-8])&IF(RC[-7]="",,"|n"&R1C26&RC[-7])&IF(RC[-6]="",,"|n"&R1C27&RC[-6])&IF(RC[-5]="",,"|n"&R1C28&RC[-5])&IF(RC[-2]="",,"|n"&RC[-2]) -> 
AG549: =IF(RC[-26]&RC[-25]&RC[-24]&RC[-23]&RC[-22]&RC[-21]="",,R1C6)&IF(RC[-26]="",,"|n"&R1C7&RC[-26])&IF(RC[-25]="",,"|n"&R1C8&RC[-25])&IF(RC[-24]="",,"|n"&R1C9&RC[-24])&IF(RC[-23]="",,"|n"&R1C10&RC[-23])&IF(RC[-22]="",,"|n"&R1C11&RC[-22])&IF(RC[-21]="",,"|n"&R1C12&RC[-21])&IF(RC[-19]&RC[-18]&RC[-17]&RC[-16]="",,"|n"&R1C13)&IF(RC[-19]="",,"|n"&R1C14&RC[-19])&IF(RC[-18]="",,"|n"&R1C15&RC[-18])&IF(RC[-17]="",,"|n"&R1C16&RC[-17])&IF(RC[-16]="",,"|n"&R1C17&RC[-16])&IF(RC[-15]="",,"|n"&R1C18&RC[-15])&IF(RC[-14]="",,"|n"&R1C19&RC[-14])&IF(RC[-13]="",,"|n"&R1C20&RC[-13])&IF(RC[-12]="",,"|n"&R1C21&RC[-12])&IF(RC[-10]="",,"|n"&R1C23&RC[-10])&IF(RC[-9]="",,"|n"&R1C24&RC[-9])&IF(RC[-8]="",,"|n"&R1C25&RC[-8])&IF(RC[-7]="",,"|n"&R1C26&RC[-7])&IF(RC[-6]="",,"|n"&R1C27&RC[-6])&IF(RC[-5]="",,"|n"&R1C28&RC[-5])&IF(RC[-2]="",,"|n"&RC[-2]) -> 
AG550: =IF(RC[-26]&RC[-25]&RC[-24]&RC[-23]&RC[-22]&RC[-21]="",,R1C6)&IF(RC[-26]="",,"|n"&R1C7&RC[-26])&IF(RC[-25]="",,"|n"&R1C8&RC[-25])&IF(RC[-24]="",,"|n"&R1C9&RC[-24])&IF(RC[-23]="",,"|n"&R1C10&RC[-23])&IF(RC[-22]="",,"|n"&R1C11&RC[-22])&IF(RC[-21]="",,"|n"&R1C12&RC[-21])&IF(RC[-19]&RC[-18]&RC[-17]&RC[-16]="",,"|n"&R1C13)&IF(RC[-19]="",,"|n"&R1C14&RC[-19])&IF(RC[-18]="",,"|n"&R1C15&RC[-18])&IF(RC[-17]="",,"|n"&R1C16&RC[-17])&IF(RC[-16]="",,"|n"&R1C17&RC[-16])&IF(RC[-15]="",,"|n"&R1C18&RC[-15])&IF(RC[-14]="",,"|n"&R1C19&RC[-14])&IF(RC[-13]="",,"|n"&R1C20&RC[-13])&IF(RC[-12]="",,"|n"&R1C21&RC[-12])&IF(RC[-10]="",,"|n"&R1C23&RC[-10])&IF(RC[-9]="",,"|n"&R1C24&RC[-9])&IF(RC[-8]="",,"|n"&R1C25&RC[-8])&IF(RC[-7]="",,"|n"&R1C26&RC[-7])&IF(RC[-6]="",,"|n"&R1C27&RC[-6])&IF(RC[-5]="",,"|n"&R1C28&RC[-5])&IF(RC[-2]="",,"|n"&RC[-2]) -> 
AG551: =IF(RC[-26]&RC[-25]&RC[-24]&RC[-23]&RC[-22]&RC[-21]="",,R1C6)&IF(RC[-26]="",,"|n"&R1C7&RC[-26])&IF(RC[-25]="",,"|n"&R1C8&RC[-25])&IF(RC[-24]="",,"|n"&R1C9&RC[-24])&IF(RC[-23]="",,"|n"&R1C10&RC[-23])&IF(RC[-22]="",,"|n"&R1C11&RC[-22])&IF(RC[-21]="",,"|n"&R1C12&RC[-21])&IF(RC[-19]&RC[-18]&RC[-17]&RC[-16]="",,"|n"&R1C13)&IF(RC[-19]="",,"|n"&R1C14&RC[-19])&IF(RC[-18]="",,"|n"&R1C15&RC[-18])&IF(RC[-17]="",,"|n"&R1C16&RC[-17])&IF(RC[-16]="",,"|n"&R1C17&RC[-16])&IF(RC[-15]="",,"|n"&R1C18&RC[-15])&IF(RC[-14]="",,"|n"&R1C19&RC[-14])&IF(RC[-13]="",,"|n"&R1C20&RC[-13])&IF(RC[-12]="",,"|n"&R1C21&RC[-12])&IF(RC[-10]="",,"|n"&R1C23&RC[-10])&IF(RC[-9]="",,"|n"&R1C24&RC[-9])&IF(RC[-8]="",,"|n"&R1C25&RC[-8])&IF(RC[-7]="",,"|n"&R1C26&RC[-7])&IF(RC[-6]="",,"|n"&R1C27&RC[-6])&IF(RC[-5]="",,"|n"&R1C28&RC[-5])&IF(RC[-2]="",,"|n"&RC[-2]) -> 
AG552: =IF(RC[-26]&RC[-25]&RC[-24]&RC[-23]&RC[-22]&RC[-21]="",,R1C6)&IF(RC[-26]="",,"|n"&R1C7&RC[-26])&IF(RC[-25]="",,"|n"&R1C8&RC[-25])&IF(RC[-24]="",,"|n"&R1C9&RC[-24])&IF(RC[-23]="",,"|n"&R1C10&RC[-23])&IF(RC[-22]="",,"|n"&R1C11&RC[-22])&IF(RC[-21]="",,"|n"&R1C12&RC[-21])&IF(RC[-19]&RC[-18]&RC[-17]&RC[-16]="",,"|n"&R1C13)&IF(RC[-19]="",,"|n"&R1C14&RC[-19])&IF(RC[-18]="",,"|n"&R1C15&RC[-18])&IF(RC[-17]="",,"|n"&R1C16&RC[-17])&IF(RC[-16]="",,"|n"&R1C17&RC[-16])&IF(RC[-15]="",,"|n"&R1C18&RC[-15])&IF(RC[-14]="",,"|n"&R1C19&RC[-14])&IF(RC[-13]="",,"|n"&R1C20&RC[-13])&IF(RC[-12]="",,"|n"&R1C21&RC[-12])&IF(RC[-10]="",,"|n"&R1C23&RC[-10])&IF(RC[-9]="",,"|n"&R1C24&RC[-9])&IF(RC[-8]="",,"|n"&R1C25&RC[-8])&IF(RC[-7]="",,"|n"&R1C26&RC[-7])&IF(RC[-6]="",,"|n"&R1C27&RC[-6])&IF(RC[-5]="",,"|n"&R1C28&RC[-5])&IF(RC[-2]="",,"|n"&RC[-2]) -> 
AG553: =IF(RC[-26]&RC[-25]&RC[-24]&RC[-23]&RC[-22]&RC[-21]="",,R1C6)&IF(RC[-26]="",,"|n"&R1C7&RC[-26])&IF(RC[-25]="",,"|n"&R1C8&RC[-25])&IF(RC[-24]="",,"|n"&R1C9&RC[-24])&IF(RC[-23]="",,"|n"&R1C10&RC[-23])&IF(RC[-22]="",,"|n"&R1C11&RC[-22])&IF(RC[-21]="",,"|n"&R1C12&RC[-21])&IF(RC[-19]&RC[-18]&RC[-17]&RC[-16]="",,"|n"&R1C13)&IF(RC[-19]="",,"|n"&R1C14&RC[-19])&IF(RC[-18]="",,"|n"&R1C15&RC[-18])&IF(RC[-17]="",,"|n"&R1C16&RC[-17])&IF(RC[-16]="",,"|n"&R1C17&RC[-16])&IF(RC[-15]="",,"|n"&R1C18&RC[-15])&IF(RC[-14]="",,"|n"&R1C19&RC[-14])&IF(RC[-13]="",,"|n"&R1C20&RC[-13])&IF(RC[-12]="",,"|n"&R1C21&RC[-12])&IF(RC[-10]="",,"|n"&R1C23&RC[-10])&IF(RC[-9]="",,"|n"&R1C24&RC[-9])&IF(RC[-8]="",,"|n"&R1C25&RC[-8])&IF(RC[-7]="",,"|n"&R1C26&RC[-7])&IF(RC[-6]="",,"|n"&R1C27&RC[-6])&IF(RC[-5]="",,"|n"&R1C28&RC[-5])&IF(RC[-2]="",,"|n"&RC[-2]) -> 
AG554: =IF(RC[-26]&RC[-25]&RC[-24]&RC[-23]&RC[-22]&RC[-21]="",,R1C6)&IF(RC[-26]="",,"|n"&R1C7&RC[-26])&IF(RC[-25]="",,"|n"&R1C8&RC[-25])&IF(RC[-24]="",,"|n"&R1C9&RC[-24])&IF(RC[-23]="",,"|n"&R1C10&RC[-23])&IF(RC[-22]="",,"|n"&R1C11&RC[-22])&IF(RC[-21]="",,"|n"&R1C12&RC[-21])&IF(RC[-19]&RC[-18]&RC[-17]&RC[-16]="",,"|n"&R1C13)&IF(RC[-19]="",,"|n"&R1C14&RC[-19])&IF(RC[-18]="",,"|n"&R1C15&RC[-18])&IF(RC[-17]="",,"|n"&R1C16&RC[-17])&IF(RC[-16]="",,"|n"&R1C17&RC[-16])&IF(RC[-15]="",,"|n"&R1C18&RC[-15])&IF(RC[-14]="",,"|n"&R1C19&RC[-14])&IF(RC[-13]="",,"|n"&R1C20&RC[-13])&IF(RC[-12]="",,"|n"&R1C21&RC[-12])&IF(RC[-10]="",,"|n"&R1C23&RC[-10])&IF(RC[-9]="",,"|n"&R1C24&RC[-9])&IF(RC[-8]="",,"|n"&R1C25&RC[-8])&IF(RC[-7]="",,"|n"&R1C26&RC[-7])&IF(RC[-6]="",,"|n"&R1C27&RC[-6])&IF(RC[-5]="",,"|n"&R1C28&RC[-5])&IF(RC[-2]="",,"|n"&RC[-2]) -> 
AG555: =IF(RC[-26]&RC[-25]&RC[-24]&RC[-23]&RC[-22]&RC[-21]="",,R1C6)&IF(RC[-26]="",,"|n"&R1C7&RC[-26])&IF(RC[-25]="",,"|n"&R1C8&RC[-25])&IF(RC[-24]="",,"|n"&R1C9&RC[-24])&IF(RC[-23]="",,"|n"&R1C10&RC[-23])&IF(RC[-22]="",,"|n"&R1C11&RC[-22])&IF(RC[-21]="",,"|n"&R1C12&RC[-21])&IF(RC[-19]&RC[-18]&RC[-17]&RC[-16]="",,"|n"&R1C13)&IF(RC[-19]="",,"|n"&R1C14&RC[-19])&IF(RC[-18]="",,"|n"&R1C15&RC[-18])&IF(RC[-17]="",,"|n"&R1C16&RC[-17])&IF(RC[-16]="",,"|n"&R1C17&RC[-16])&IF(RC[-15]="",,"|n"&R1C18&RC[-15])&IF(RC[-14]="",,"|n"&R1C19&RC[-14])&IF(RC[-13]="",,"|n"&R1C20&RC[-13])&IF(RC[-12]="",,"|n"&R1C21&RC[-12])&IF(RC[-10]="",,"|n"&R1C23&RC[-10])&IF(RC[-9]="",,"|n"&R1C24&RC[-9])&IF(RC[-8]="",,"|n"&R1C25&RC[-8])&IF(RC[-7]="",,"|n"&R1C26&RC[-7])&IF(RC[-6]="",,"|n"&R1C27&RC[-6])&IF(RC[-5]="",,"|n"&R1C28&RC[-5])&IF(RC[-2]="",,"|n"&RC[-2]) -> 
AG556: =IF(RC[-26]&RC[-25]&RC[-24]&RC[-23]&RC[-22]&RC[-21]="",,R1C6)&IF(RC[-26]="",,"|n"&R1C7&RC[-26])&IF(RC[-25]="",,"|n"&R1C8&RC[-25])&IF(RC[-24]="",,"|n"&R1C9&RC[-24])&IF(RC[-23]="",,"|n"&R1C10&RC[-23])&IF(RC[-22]="",,"|n"&R1C11&RC[-22])&IF(RC[-21]="",,"|n"&R1C12&RC[-21])&IF(RC[-19]&RC[-18]&RC[-17]&RC[-16]="",,"|n"&R1C13)&IF(RC[-19]="",,"|n"&R1C14&RC[-19])&IF(RC[-18]="",,"|n"&R1C15&RC[-18])&IF(RC[-17]="",,"|n"&R1C16&RC[-17])&IF(RC[-16]="",,"|n"&R1C17&RC[-16])&IF(RC[-15]="",,"|n"&R1C18&RC[-15])&IF(RC[-14]="",,"|n"&R1C19&RC[-14])&IF(RC[-13]="",,"|n"&R1C20&RC[-13])&IF(RC[-12]="",,"|n"&R1C21&RC[-12])&IF(RC[-10]="",,"|n"&R1C23&RC[-10])&IF(RC[-9]="",,"|n"&R1C24&RC[-9])&IF(RC[-8]="",,"|n"&R1C25&RC[-8])&IF(RC[-7]="",,"|n"&R1C26&RC[-7])&IF(RC[-6]="",,"|n"&R1C27&RC[-6])&IF(RC[-5]="",,"|n"&R1C28&RC[-5])&IF(RC[-2]="",,"|n"&RC[-2]) -> 
AG557: =IF(RC[-26]&RC[-25]&RC[-24]&RC[-23]&RC[-22]&RC[-21]="",,R1C6)&IF(RC[-26]="",,"|n"&R1C7&RC[-26])&IF(RC[-25]="",,"|n"&R1C8&RC[-25])&IF(RC[-24]="",,"|n"&R1C9&RC[-24])&IF(RC[-23]="",,"|n"&R1C10&RC[-23])&IF(RC[-22]="",,"|n"&R1C11&RC[-22])&IF(RC[-21]="",,"|n"&R1C12&RC[-21])&IF(RC[-19]&RC[-18]&RC[-17]&RC[-16]="",,"|n"&R1C13)&IF(RC[-19]="",,"|n"&R1C14&RC[-19])&IF(RC[-18]="",,"|n"&R1C15&RC[-18])&IF(RC[-17]="",,"|n"&R1C16&RC[-17])&IF(RC[-16]="",,"|n"&R1C17&RC[-16])&IF(RC[-15]="",,"|n"&R1C18&RC[-15])&IF(RC[-14]="",,"|n"&R1C19&RC[-14])&IF(RC[-13]="",,"|n"&R1C20&RC[-13])&IF(RC[-12]="",,"|n"&R1C21&RC[-12])&IF(RC[-10]="",,"|n"&R1C23&RC[-10])&IF(RC[-9]="",,"|n"&R1C24&RC[-9])&IF(RC[-8]="",,"|n"&R1C25&RC[-8])&IF(RC[-7]="",,"|n"&R1C26&RC[-7])&IF(RC[-6]="",,"|n"&R1C27&RC[-6])&IF(RC[-5]="",,"|n"&R1C28&RC[-5])&IF(RC[-2]="",,"|n"&RC[-2]) -> 
AG558: =IF(RC[-26]&RC[-25]&RC[-24]&RC[-23]&RC[-22]&RC[-21]="",,R1C6)&IF(RC[-26]="",,"|n"&R1C7&RC[-26])&IF(RC[-25]="",,"|n"&R1C8&RC[-25])&IF(RC[-24]="",,"|n"&R1C9&RC[-24])&IF(RC[-23]="",,"|n"&R1C10&RC[-23])&IF(RC[-22]="",,"|n"&R1C11&RC[-22])&IF(RC[-21]="",,"|n"&R1C12&RC[-21])&IF(RC[-19]&RC[-18]&RC[-17]&RC[-16]="",,"|n"&R1C13)&IF(RC[-19]="",,"|n"&R1C14&RC[-19])&IF(RC[-18]="",,"|n"&R1C15&RC[-18])&IF(RC[-17]="",,"|n"&R1C16&RC[-17])&IF(RC[-16]="",,"|n"&R1C17&RC[-16])&IF(RC[-15]="",,"|n"&R1C18&RC[-15])&IF(RC[-14]="",,"|n"&R1C19&RC[-14])&IF(RC[-13]="",,"|n"&R1C20&RC[-13])&IF(RC[-12]="",,"|n"&R1C21&RC[-12])&IF(RC[-10]="",,"|n"&R1C23&RC[-10])&IF(RC[-9]="",,"|n"&R1C24&RC[-9])&IF(RC[-8]="",,"|n"&R1C25&RC[-8])&IF(RC[-7]="",,"|n"&R1C26&RC[-7])&IF(RC[-6]="",,"|n"&R1C27&RC[-6])&IF(RC[-5]="",,"|n"&R1C28&RC[-5])&IF(RC[-2]="",,"|n"&RC[-2]) -> 
AG559: =IF(RC[-26]&RC[-25]&RC[-24]&RC[-23]&RC[-22]&RC[-21]="",,R1C6)&IF(RC[-26]="",,"|n"&R1C7&RC[-26])&IF(RC[-25]="",,"|n"&R1C8&RC[-25])&IF(RC[-24]="",,"|n"&R1C9&RC[-24])&IF(RC[-23]="",,"|n"&R1C10&RC[-23])&IF(RC[-22]="",,"|n"&R1C11&RC[-22])&IF(RC[-21]="",,"|n"&R1C12&RC[-21])&IF(RC[-19]&RC[-18]&RC[-17]&RC[-16]="",,"|n"&R1C13)&IF(RC[-19]="",,"|n"&R1C14&RC[-19])&IF(RC[-18]="",,"|n"&R1C15&RC[-18])&IF(RC[-17]="",,"|n"&R1C16&RC[-17])&IF(RC[-16]="",,"|n"&R1C17&RC[-16])&IF(RC[-15]="",,"|n"&R1C18&RC[-15])&IF(RC[-14]="",,"|n"&R1C19&RC[-14])&IF(RC[-13]="",,"|n"&R1C20&RC[-13])&IF(RC[-12]="",,"|n"&R1C21&RC[-12])&IF(RC[-10]="",,"|n"&R1C23&RC[-10])&IF(RC[-9]="",,"|n"&R1C24&RC[-9])&IF(RC[-8]="",,"|n"&R1C25&RC[-8])&IF(RC[-7]="",,"|n"&R1C26&RC[-7])&IF(RC[-6]="",,"|n"&R1C27&RC[-6])&IF(RC[-5]="",,"|n"&R1C28&RC[-5])&IF(RC[-2]="",,"|n"&RC[-2]) -> 
AG560: =IF(RC[-26]&RC[-25]&RC[-24]&RC[-23]&RC[-22]&RC[-21]="",,R1C6)&IF(RC[-26]="",,"|n"&R1C7&RC[-26])&IF(RC[-25]="",,"|n"&R1C8&RC[-25])&IF(RC[-24]="",,"|n"&R1C9&RC[-24])&IF(RC[-23]="",,"|n"&R1C10&RC[-23])&IF(RC[-22]="",,"|n"&R1C11&RC[-22])&IF(RC[-21]="",,"|n"&R1C12&RC[-21])&IF(RC[-19]&RC[-18]&RC[-17]&RC[-16]="",,"|n"&R1C13)&IF(RC[-19]="",,"|n"&R1C14&RC[-19])&IF(RC[-18]="",,"|n"&R1C15&RC[-18])&IF(RC[-17]="",,"|n"&R1C16&RC[-17])&IF(RC[-16]="",,"|n"&R1C17&RC[-16])&IF(RC[-15]="",,"|n"&R1C18&RC[-15])&IF(RC[-14]="",,"|n"&R1C19&RC[-14])&IF(RC[-13]="",,"|n"&R1C20&RC[-13])&IF(RC[-12]="",,"|n"&R1C21&RC[-12])&IF(RC[-10]="",,"|n"&R1C23&RC[-10])&IF(RC[-9]="",,"|n"&R1C24&RC[-9])&IF(RC[-8]="",,"|n"&R1C25&RC[-8])&IF(RC[-7]="",,"|n"&R1C26&RC[-7])&IF(RC[-6]="",,"|n"&R1C27&RC[-6])&IF(RC[-5]="",,"|n"&R1C28&RC[-5])&IF(RC[-2]="",,"|n"&RC[-2]) -> 
AG561: =IF(RC[-26]&RC[-25]&RC[-24]&RC[-23]&RC[-22]&RC[-21]="",,R1C6)&IF(RC[-26]="",,"|n"&R1C7&RC[-26])&IF(RC[-25]="",,"|n"&R1C8&RC[-25])&IF(RC[-24]="",,"|n"&R1C9&RC[-24])&IF(RC[-23]="",,"|n"&R1C10&RC[-23])&IF(RC[-22]="",,"|n"&R1C11&RC[-22])&IF(RC[-21]="",,"|n"&R1C12&RC[-21])&IF(RC[-19]&RC[-18]&RC[-17]&RC[-16]="",,"|n"&R1C13)&IF(RC[-19]="",,"|n"&R1C14&RC[-19])&IF(RC[-18]="",,"|n"&R1C15&RC[-18])&IF(RC[-17]="",,"|n"&R1C16&RC[-17])&IF(RC[-16]="",,"|n"&R1C17&RC[-16])&IF(RC[-15]="",,"|n"&R1C18&RC[-15])&IF(RC[-14]="",,"|n"&R1C19&RC[-14])&IF(RC[-13]="",,"|n"&R1C20&RC[-13])&IF(RC[-12]="",,"|n"&R1C21&RC[-12])&IF(RC[-10]="",,"|n"&R1C23&RC[-10])&IF(RC[-9]="",,"|n"&R1C24&RC[-9])&IF(RC[-8]="",,"|n"&R1C25&RC[-8])&IF(RC[-7]="",,"|n"&R1C26&RC[-7])&IF(RC[-6]="",,"|n"&R1C27&RC[-6])&IF(RC[-5]="",,"|n"&R1C28&RC[-5])&IF(RC[-2]="",,"|n"&RC[-2]) -> 
AG562: =IF(RC[-26]&RC[-25]&RC[-24]&RC[-23]&RC[-22]&RC[-21]="",,R1C6)&IF(RC[-26]="",,"|n"&R1C7&RC[-26])&IF(RC[-25]="",,"|n"&R1C8&RC[-25])&IF(RC[-24]="",,"|n"&R1C9&RC[-24])&IF(RC[-23]="",,"|n"&R1C10&RC[-23])&IF(RC[-22]="",,"|n"&R1C11&RC[-22])&IF(RC[-21]="",,"|n"&R1C12&RC[-21])&IF(RC[-19]&RC[-18]&RC[-17]&RC[-16]="",,"|n"&R1C13)&IF(RC[-19]="",,"|n"&R1C14&RC[-19])&IF(RC[-18]="",,"|n"&R1C15&RC[-18])&IF(RC[-17]="",,"|n"&R1C16&RC[-17])&IF(RC[-16]="",,"|n"&R1C17&RC[-16])&IF(RC[-15]="",,"|n"&R1C18&RC[-15])&IF(RC[-14]="",,"|n"&R1C19&RC[-14])&IF(RC[-13]="",,"|n"&R1C20&RC[-13])&IF(RC[-12]="",,"|n"&R1C21&RC[-12])&IF(RC[-10]="",,"|n"&R1C23&RC[-10])&IF(RC[-9]="",,"|n"&R1C24&RC[-9])&IF(RC[-8]="",,"|n"&R1C25&RC[-8])&IF(RC[-7]="",,"|n"&R1C26&RC[-7])&IF(RC[-6]="",,"|n"&R1C27&RC[-6])&IF(RC[-5]="",,"|n"&R1C28&RC[-5])&IF(RC[-2]="",,"|n"&RC[-2]) -> 
AG563: =IF(RC[-26]&RC[-25]&RC[-24]&RC[-23]&RC[-22]&RC[-21]="",,R1C6)&IF(RC[-26]="",,"|n"&R1C7&RC[-26])&IF(RC[-25]="",,"|n"&R1C8&RC[-25])&IF(RC[-24]="",,"|n"&R1C9&RC[-24])&IF(RC[-23]="",,"|n"&R1C10&RC[-23])&IF(RC[-22]="",,"|n"&R1C11&RC[-22])&IF(RC[-21]="",,"|n"&R1C12&RC[-21])&IF(RC[-19]&RC[-18]&RC[-17]&RC[-16]="",,"|n"&R1C13)&IF(RC[-19]="",,"|n"&R1C14&RC[-19])&IF(RC[-18]="",,"|n"&R1C15&RC[-18])&IF(RC[-17]="",,"|n"&R1C16&RC[-17])&IF(RC[-16]="",,"|n"&R1C17&RC[-16])&IF(RC[-15]="",,"|n"&R1C18&RC[-15])&IF(RC[-14]="",,"|n"&R1C19&RC[-14])&IF(RC[-13]="",,"|n"&R1C20&RC[-13])&IF(RC[-12]="",,"|n"&R1C21&RC[-12])&IF(RC[-10]="",,"|n"&R1C23&RC[-10])&IF(RC[-9]="",,"|n"&R1C24&RC[-9])&IF(RC[-8]="",,"|n"&R1C25&RC[-8])&IF(RC[-7]="",,"|n"&R1C26&RC[-7])&IF(RC[-6]="",,"|n"&R1C27&RC[-6])&IF(RC[-5]="",,"|n"&R1C28&RC[-5])&IF(RC[-2]="",,"|n"&RC[-2]) -> 
AG564: =IF(RC[-26]&RC[-25]&RC[-24]&RC[-23]&RC[-22]&RC[-21]="",,R1C6)&IF(RC[-26]="",,"|n"&R1C7&RC[-26])&IF(RC[-25]="",,"|n"&R1C8&RC[-25])&IF(RC[-24]="",,"|n"&R1C9&RC[-24])&IF(RC[-23]="",,"|n"&R1C10&RC[-23])&IF(RC[-22]="",,"|n"&R1C11&RC[-22])&IF(RC[-21]="",,"|n"&R1C12&RC[-21])&IF(RC[-19]&RC[-18]&RC[-17]&RC[-16]="",,"|n"&R1C13)&IF(RC[-19]="",,"|n"&R1C14&RC[-19])&IF(RC[-18]="",,"|n"&R1C15&RC[-18])&IF(RC[-17]="",,"|n"&R1C16&RC[-17])&IF(RC[-16]="",,"|n"&R1C17&RC[-16])&IF(RC[-15]="",,"|n"&R1C18&RC[-15])&IF(RC[-14]="",,"|n"&R1C19&RC[-14])&IF(RC[-13]="",,"|n"&R1C20&RC[-13])&IF(RC[-12]="",,"|n"&R1C21&RC[-12])&IF(RC[-10]="",,"|n"&R1C23&RC[-10])&IF(RC[-9]="",,"|n"&R1C24&RC[-9])&IF(RC[-8]="",,"|n"&R1C25&RC[-8])&IF(RC[-7]="",,"|n"&R1C26&RC[-7])&IF(RC[-6]="",,"|n"&R1C27&RC[-6])&IF(RC[-5]="",,"|n"&R1C28&RC[-5])&IF(RC[-2]="",,"|n"&RC[-2]) -> 
AG565: =IF(RC[-26]&RC[-25]&RC[-24]&RC[-23]&RC[-22]&RC[-21]="",,R1C6)&IF(RC[-26]="",,"|n"&R1C7&RC[-26])&IF(RC[-25]="",,"|n"&R1C8&RC[-25])&IF(RC[-24]="",,"|n"&R1C9&RC[-24])&IF(RC[-23]="",,"|n"&R1C10&RC[-23])&IF(RC[-22]="",,"|n"&R1C11&RC[-22])&IF(RC[-21]="",,"|n"&R1C12&RC[-21])&IF(RC[-19]&RC[-18]&RC[-17]&RC[-16]="",,"|n"&R1C13)&IF(RC[-19]="",,"|n"&R1C14&RC[-19])&IF(RC[-18]="",,"|n"&R1C15&RC[-18])&IF(RC[-17]="",,"|n"&R1C16&RC[-17])&IF(RC[-16]="",,"|n"&R1C17&RC[-16])&IF(RC[-15]="",,"|n"&R1C18&RC[-15])&IF(RC[-14]="",,"|n"&R1C19&RC[-14])&IF(RC[-13]="",,"|n"&R1C20&RC[-13])&IF(RC[-12]="",,"|n"&R1C21&RC[-12])&IF(RC[-10]="",,"|n"&R1C23&RC[-10])&IF(RC[-9]="",,"|n"&R1C24&RC[-9])&IF(RC[-8]="",,"|n"&R1C25&RC[-8])&IF(RC[-7]="",,"|n"&R1C26&RC[-7])&IF(RC[-6]="",,"|n"&R1C27&RC[-6])&IF(RC[-5]="",,"|n"&R1C28&RC[-5])&IF(RC[-2]="",,"|n"&RC[-2]) -> 
AG566: =IF(RC[-26]&RC[-25]&RC[-24]&RC[-23]&RC[-22]&RC[-21]="",,R1C6)&IF(RC[-26]="",,"|n"&R1C7&RC[-26])&IF(RC[-25]="",,"|n"&R1C8&RC[-25])&IF(RC[-24]="",,"|n"&R1C9&RC[-24])&IF(RC[-23]="",,"|n"&R1C10&RC[-23])&IF(RC[-22]="",,"|n"&R1C11&RC[-22])&IF(RC[-21]="",,"|n"&R1C12&RC[-21])&IF(RC[-19]&RC[-18]&RC[-17]&RC[-16]="",,"|n"&R1C13)&IF(RC[-19]="",,"|n"&R1C14&RC[-19])&IF(RC[-18]="",,"|n"&R1C15&RC[-18])&IF(RC[-17]="",,"|n"&R1C16&RC[-17])&IF(RC[-16]="",,"|n"&R1C17&RC[-16])&IF(RC[-15]="",,"|n"&R1C18&RC[-15])&IF(RC[-14]="",,"|n"&R1C19&RC[-14])&IF(RC[-13]="",,"|n"&R1C20&RC[-13])&IF(RC[-12]="",,"|n"&R1C21&RC[-12])&IF(RC[-10]="",,"|n"&R1C23&RC[-10])&IF(RC[-9]="",,"|n"&R1C24&RC[-9])&IF(RC[-8]="",,"|n"&R1C25&RC[-8])&IF(RC[-7]="",,"|n"&R1C26&RC[-7])&IF(RC[-6]="",,"|n"&R1C27&RC[-6])&IF(RC[-5]="",,"|n"&R1C28&RC[-5])&IF(RC[-2]="",,"|n"&RC[-2]) -> 
AG567: =IF(RC[-26]&RC[-25]&RC[-24]&RC[-23]&RC[-22]&RC[-21]="",,R1C6)&IF(RC[-26]="",,"|n"&R1C7&RC[-26])&IF(RC[-25]="",,"|n"&R1C8&RC[-25])&IF(RC[-24]="",,"|n"&R1C9&RC[-24])&IF(RC[-23]="",,"|n"&R1C10&RC[-23])&IF(RC[-22]="",,"|n"&R1C11&RC[-22])&IF(RC[-21]="",,"|n"&R1C12&RC[-21])&IF(RC[-19]&RC[-18]&RC[-17]&RC[-16]="",,"|n"&R1C13)&IF(RC[-19]="",,"|n"&R1C14&RC[-19])&IF(RC[-18]="",,"|n"&R1C15&RC[-18])&IF(RC[-17]="",,"|n"&R1C16&RC[-17])&IF(RC[-16]="",,"|n"&R1C17&RC[-16])&IF(RC[-15]="",,"|n"&R1C18&RC[-15])&IF(RC[-14]="",,"|n"&R1C19&RC[-14])&IF(RC[-13]="",,"|n"&R1C20&RC[-13])&IF(RC[-12]="",,"|n"&R1C21&RC[-12])&IF(RC[-10]="",,"|n"&R1C23&RC[-10])&IF(RC[-9]="",,"|n"&R1C24&RC[-9])&IF(RC[-8]="",,"|n"&R1C25&RC[-8])&IF(RC[-7]="",,"|n"&R1C26&RC[-7])&IF(RC[-6]="",,"|n"&R1C27&RC[-6])&IF(RC[-5]="",,"|n"&R1C28&RC[-5])&IF(RC[-2]="",,"|n"&RC[-2]) -> 
AG568: =IF(RC[-26]&RC[-25]&RC[-24]&RC[-23]&RC[-22]&RC[-21]="",,R1C6)&IF(RC[-26]="",,"|n"&R1C7&RC[-26])&IF(RC[-25]="",,"|n"&R1C8&RC[-25])&IF(RC[-24]="",,"|n"&R1C9&RC[-24])&IF(RC[-23]="",,"|n"&R1C10&RC[-23])&IF(RC[-22]="",,"|n"&R1C11&RC[-22])&IF(RC[-21]="",,"|n"&R1C12&RC[-21])&IF(RC[-19]&RC[-18]&RC[-17]&RC[-16]="",,"|n"&R1C13)&IF(RC[-19]="",,"|n"&R1C14&RC[-19])&IF(RC[-18]="",,"|n"&R1C15&RC[-18])&IF(RC[-17]="",,"|n"&R1C16&RC[-17])&IF(RC[-16]="",,"|n"&R1C17&RC[-16])&IF(RC[-15]="",,"|n"&R1C18&RC[-15])&IF(RC[-14]="",,"|n"&R1C19&RC[-14])&IF(RC[-13]="",,"|n"&R1C20&RC[-13])&IF(RC[-12]="",,"|n"&R1C21&RC[-12])&IF(RC[-10]="",,"|n"&R1C23&RC[-10])&IF(RC[-9]="",,"|n"&R1C24&RC[-9])&IF(RC[-8]="",,"|n"&R1C25&RC[-8])&IF(RC[-7]="",,"|n"&R1C26&RC[-7])&IF(RC[-6]="",,"|n"&R1C27&RC[-6])&IF(RC[-5]="",,"|n"&R1C28&RC[-5])&IF(RC[-2]="",,"|n"&RC[-2]) -> 
AG569: =IF(RC[-26]&RC[-25]&RC[-24]&RC[-23]&RC[-22]&RC[-21]="",,R1C6)&IF(RC[-26]="",,"|n"&R1C7&RC[-26])&IF(RC[-25]="",,"|n"&R1C8&RC[-25])&IF(RC[-24]="",,"|n"&R1C9&RC[-24])&IF(RC[-23]="",,"|n"&R1C10&RC[-23])&IF(RC[-22]="",,"|n"&R1C11&RC[-22])&IF(RC[-21]="",,"|n"&R1C12&RC[-21])&IF(RC[-19]&RC[-18]&RC[-17]&RC[-16]="",,"|n"&R1C13)&IF(RC[-19]="",,"|n"&R1C14&RC[-19])&IF(RC[-18]="",,"|n"&R1C15&RC[-18])&IF(RC[-17]="",,"|n"&R1C16&RC[-17])&IF(RC[-16]="",,"|n"&R1C17&RC[-16])&IF(RC[-15]="",,"|n"&R1C18&RC[-15])&IF(RC[-14]="",,"|n"&R1C19&RC[-14])&IF(RC[-13]="",,"|n"&R1C20&RC[-13])&IF(RC[-12]="",,"|n"&R1C21&RC[-12])&IF(RC[-10]="",,"|n"&R1C23&RC[-10])&IF(RC[-9]="",,"|n"&R1C24&RC[-9])&IF(RC[-8]="",,"|n"&R1C25&RC[-8])&IF(RC[-7]="",,"|n"&R1C26&RC[-7])&IF(RC[-6]="",,"|n"&R1C27&RC[-6])&IF(RC[-5]="",,"|n"&R1C28&RC[-5])&IF(RC[-2]="",,"|n"&RC[-2]) -> 
AG570: =IF(RC[-26]&RC[-25]&RC[-24]&RC[-23]&RC[-22]&RC[-21]="",,R1C6)&IF(RC[-26]="",,"|n"&R1C7&RC[-26])&IF(RC[-25]="",,"|n"&R1C8&RC[-25])&IF(RC[-24]="",,"|n"&R1C9&RC[-24])&IF(RC[-23]="",,"|n"&R1C10&RC[-23])&IF(RC[-22]="",,"|n"&R1C11&RC[-22])&IF(RC[-21]="",,"|n"&R1C12&RC[-21])&IF(RC[-19]&RC[-18]&RC[-17]&RC[-16]="",,"|n"&R1C13)&IF(RC[-19]="",,"|n"&R1C14&RC[-19])&IF(RC[-18]="",,"|n"&R1C15&RC[-18])&IF(RC[-17]="",,"|n"&R1C16&RC[-17])&IF(RC[-16]="",,"|n"&R1C17&RC[-16])&IF(RC[-15]="",,"|n"&R1C18&RC[-15])&IF(RC[-14]="",,"|n"&R1C19&RC[-14])&IF(RC[-13]="",,"|n"&R1C20&RC[-13])&IF(RC[-12]="",,"|n"&R1C21&RC[-12])&IF(RC[-10]="",,"|n"&R1C23&RC[-10])&IF(RC[-9]="",,"|n"&R1C24&RC[-9])&IF(RC[-8]="",,"|n"&R1C25&RC[-8])&IF(RC[-7]="",,"|n"&R1C26&RC[-7])&IF(RC[-6]="",,"|n"&R1C27&RC[-6])&IF(RC[-5]="",,"|n"&R1C28&RC[-5])&IF(RC[-2]="",,"|n"&RC[-2]) -> 
AG571: =IF(RC[-26]&RC[-25]&RC[-24]&RC[-23]&RC[-22]&RC[-21]="",,R1C6)&IF(RC[-26]="",,"|n"&R1C7&RC[-26])&IF(RC[-25]="",,"|n"&R1C8&RC[-25])&IF(RC[-24]="",,"|n"&R1C9&RC[-24])&IF(RC[-23]="",,"|n"&R1C10&RC[-23])&IF(RC[-22]="",,"|n"&R1C11&RC[-22])&IF(RC[-21]="",,"|n"&R1C12&RC[-21])&IF(RC[-19]&RC[-18]&RC[-17]&RC[-16]="",,"|n"&R1C13)&IF(RC[-19]="",,"|n"&R1C14&RC[-19])&IF(RC[-18]="",,"|n"&R1C15&RC[-18])&IF(RC[-17]="",,"|n"&R1C16&RC[-17])&IF(RC[-16]="",,"|n"&R1C17&RC[-16])&IF(RC[-15]="",,"|n"&R1C18&RC[-15])&IF(RC[-14]="",,"|n"&R1C19&RC[-14])&IF(RC[-13]="",,"|n"&R1C20&RC[-13])&IF(RC[-12]="",,"|n"&R1C21&RC[-12])&IF(RC[-10]="",,"|n"&R1C23&RC[-10])&IF(RC[-9]="",,"|n"&R1C24&RC[-9])&IF(RC[-8]="",,"|n"&R1C25&RC[-8])&IF(RC[-7]="",,"|n"&R1C26&RC[-7])&IF(RC[-6]="",,"|n"&R1C27&RC[-6])&IF(RC[-5]="",,"|n"&R1C28&RC[-5])&IF(RC[-2]="",,"|n"&RC[-2]) -> 
AG572: =IF(RC[-26]&RC[-25]&RC[-24]&RC[-23]&RC[-22]&RC[-21]="",,R1C6)&IF(RC[-26]="",,"|n"&R1C7&RC[-26])&IF(RC[-25]="",,"|n"&R1C8&RC[-25])&IF(RC[-24]="",,"|n"&R1C9&RC[-24])&IF(RC[-23]="",,"|n"&R1C10&RC[-23])&IF(RC[-22]="",,"|n"&R1C11&RC[-22])&IF(RC[-21]="",,"|n"&R1C12&RC[-21])&IF(RC[-19]&RC[-18]&RC[-17]&RC[-16]="",,"|n"&R1C13)&IF(RC[-19]="",,"|n"&R1C14&RC[-19])&IF(RC[-18]="",,"|n"&R1C15&RC[-18])&IF(RC[-17]="",,"|n"&R1C16&RC[-17])&IF(RC[-16]="",,"|n"&R1C17&RC[-16])&IF(RC[-15]="",,"|n"&R1C18&RC[-15])&IF(RC[-14]="",,"|n"&R1C19&RC[-14])&IF(RC[-13]="",,"|n"&R1C20&RC[-13])&IF(RC[-12]="",,"|n"&R1C21&RC[-12])&IF(RC[-10]="",,"|n"&R1C23&RC[-10])&IF(RC[-9]="",,"|n"&R1C24&RC[-9])&IF(RC[-8]="",,"|n"&R1C25&RC[-8])&IF(RC[-7]="",,"|n"&R1C26&RC[-7])&IF(RC[-6]="",,"|n"&R1C27&RC[-6])&IF(RC[-5]="",,"|n"&R1C28&RC[-5])&IF(RC[-2]="",,"|n"&RC[-2]) -> 
AG573: =IF(RC[-26]&RC[-25]&RC[-24]&RC[-23]&RC[-22]&RC[-21]="",,R1C6)&IF(RC[-26]="",,"|n"&R1C7&RC[-26])&IF(RC[-25]="",,"|n"&R1C8&RC[-25])&IF(RC[-24]="",,"|n"&R1C9&RC[-24])&IF(RC[-23]="",,"|n"&R1C10&RC[-23])&IF(RC[-22]="",,"|n"&R1C11&RC[-22])&IF(RC[-21]="",,"|n"&R1C12&RC[-21])&IF(RC[-19]&RC[-18]&RC[-17]&RC[-16]="",,"|n"&R1C13)&IF(RC[-19]="",,"|n"&R1C14&RC[-19])&IF(RC[-18]="",,"|n"&R1C15&RC[-18])&IF(RC[-17]="",,"|n"&R1C16&RC[-17])&IF(RC[-16]="",,"|n"&R1C17&RC[-16])&IF(RC[-15]="",,"|n"&R1C18&RC[-15])&IF(RC[-14]="",,"|n"&R1C19&RC[-14])&IF(RC[-13]="",,"|n"&R1C20&RC[-13])&IF(RC[-12]="",,"|n"&R1C21&RC[-12])&IF(RC[-10]="",,"|n"&R1C23&RC[-10])&IF(RC[-9]="",,"|n"&R1C24&RC[-9])&IF(RC[-8]="",,"|n"&R1C25&RC[-8])&IF(RC[-7]="",,"|n"&R1C26&RC[-7])&IF(RC[-6]="",,"|n"&R1C27&RC[-6])&IF(RC[-5]="",,"|n"&R1C28&RC[-5])&IF(RC[-2]="",,"|n"&RC[-2]) -> 
AG574: =IF(RC[-26]&RC[-25]&RC[-24]&RC[-23]&RC[-22]&RC[-21]="",,R1C6)&IF(RC[-26]="",,"|n"&R1C7&RC[-26])&IF(RC[-25]="",,"|n"&R1C8&RC[-25])&IF(RC[-24]="",,"|n"&R1C9&RC[-24])&IF(RC[-23]="",,"|n"&R1C10&RC[-23])&IF(RC[-22]="",,"|n"&R1C11&RC[-22])&IF(RC[-21]="",,"|n"&R1C12&RC[-21])&IF(RC[-19]&RC[-18]&RC[-17]&RC[-16]="",,"|n"&R1C13)&IF(RC[-19]="",,"|n"&R1C14&RC[-19])&IF(RC[-18]="",,"|n"&R1C15&RC[-18])&IF(RC[-17]="",,"|n"&R1C16&RC[-17])&IF(RC[-16]="",,"|n"&R1C17&RC[-16])&IF(RC[-15]="",,"|n"&R1C18&RC[-15])&IF(RC[-14]="",,"|n"&R1C19&RC[-14])&IF(RC[-13]="",,"|n"&R1C20&RC[-13])&IF(RC[-12]="",,"|n"&R1C21&RC[-12])&IF(RC[-10]="",,"|n"&R1C23&RC[-10])&IF(RC[-9]="",,"|n"&R1C24&RC[-9])&IF(RC[-8]="",,"|n"&R1C25&RC[-8])&IF(RC[-7]="",,"|n"&R1C26&RC[-7])&IF(RC[-6]="",,"|n"&R1C27&RC[-6])&IF(RC[-5]="",,"|n"&R1C28&RC[-5])&IF(RC[-2]="",,"|n"&RC[-2]) -> 
AG575: =IF(RC[-26]&RC[-25]&RC[-24]&RC[-23]&RC[-22]&RC[-21]="",,R1C6)&IF(RC[-26]="",,"|n"&R1C7&RC[-26])&IF(RC[-25]="",,"|n"&R1C8&RC[-25])&IF(RC[-24]="",,"|n"&R1C9&RC[-24])&IF(RC[-23]="",,"|n"&R1C10&RC[-23])&IF(RC[-22]="",,"|n"&R1C11&RC[-22])&IF(RC[-21]="",,"|n"&R1C12&RC[-21])&IF(RC[-19]&RC[-18]&RC[-17]&RC[-16]="",,"|n"&R1C13)&IF(RC[-19]="",,"|n"&R1C14&RC[-19])&IF(RC[-18]="",,"|n"&R1C15&RC[-18])&IF(RC[-17]="",,"|n"&R1C16&RC[-17])&IF(RC[-16]="",,"|n"&R1C17&RC[-16])&IF(RC[-15]="",,"|n"&R1C18&RC[-15])&IF(RC[-14]="",,"|n"&R1C19&RC[-14])&IF(RC[-13]="",,"|n"&R1C20&RC[-13])&IF(RC[-12]="",,"|n"&R1C21&RC[-12])&IF(RC[-10]="",,"|n"&R1C23&RC[-10])&IF(RC[-9]="",,"|n"&R1C24&RC[-9])&IF(RC[-8]="",,"|n"&R1C25&RC[-8])&IF(RC[-7]="",,"|n"&R1C26&RC[-7])&IF(RC[-6]="",,"|n"&R1C27&RC[-6])&IF(RC[-5]="",,"|n"&R1C28&RC[-5])&IF(RC[-2]="",,"|n"&RC[-2]) -> 
AG576: =IF(RC[-26]&RC[-25]&RC[-24]&RC[-23]&RC[-22]&RC[-21]="",,R1C6)&IF(RC[-26]="",,"|n"&R1C7&RC[-26])&IF(RC[-25]="",,"|n"&R1C8&RC[-25])&IF(RC[-24]="",,"|n"&R1C9&RC[-24])&IF(RC[-23]="",,"|n"&R1C10&RC[-23])&IF(RC[-22]="",,"|n"&R1C11&RC[-22])&IF(RC[-21]="",,"|n"&R1C12&RC[-21])&IF(RC[-19]&RC[-18]&RC[-17]&RC[-16]="",,"|n"&R1C13)&IF(RC[-19]="",,"|n"&R1C14&RC[-19])&IF(RC[-18]="",,"|n"&R1C15&RC[-18])&IF(RC[-17]="",,"|n"&R1C16&RC[-17])&IF(RC[-16]="",,"|n"&R1C17&RC[-16])&IF(RC[-15]="",,"|n"&R1C18&RC[-15])&IF(RC[-14]="",,"|n"&R1C19&RC[-14])&IF(RC[-13]="",,"|n"&R1C20&RC[-13])&IF(RC[-12]="",,"|n"&R1C21&RC[-12])&IF(RC[-10]="",,"|n"&R1C23&RC[-10])&IF(RC[-9]="",,"|n"&R1C24&RC[-9])&IF(RC[-8]="",,"|n"&R1C25&RC[-8])&IF(RC[-7]="",,"|n"&R1C26&RC[-7])&IF(RC[-6]="",,"|n"&R1C27&RC[-6])&IF(RC[-5]="",,"|n"&R1C28&RC[-5])&IF(RC[-2]="",,"|n"&RC[-2]) -> 
AG577: =IF(RC[-26]&RC[-25]&RC[-24]&RC[-23]&RC[-22]&RC[-21]="",,R1C6)&IF(RC[-26]="",,"|n"&R1C7&RC[-26])&IF(RC[-25]="",,"|n"&R1C8&RC[-25])&IF(RC[-24]="",,"|n"&R1C9&RC[-24])&IF(RC[-23]="",,"|n"&R1C10&RC[-23])&IF(RC[-22]="",,"|n"&R1C11&RC[-22])&IF(RC[-21]="",,"|n"&R1C12&RC[-21])&IF(RC[-19]&RC[-18]&RC[-17]&RC[-16]="",,"|n"&R1C13)&IF(RC[-19]="",,"|n"&R1C14&RC[-19])&IF(RC[-18]="",,"|n"&R1C15&RC[-18])&IF(RC[-17]="",,"|n"&R1C16&RC[-17])&IF(RC[-16]="",,"|n"&R1C17&RC[-16])&IF(RC[-15]="",,"|n"&R1C18&RC[-15])&IF(RC[-14]="",,"|n"&R1C19&RC[-14])&IF(RC[-13]="",,"|n"&R1C20&RC[-13])&IF(RC[-12]="",,"|n"&R1C21&RC[-12])&IF(RC[-10]="",,"|n"&R1C23&RC[-10])&IF(RC[-9]="",,"|n"&R1C24&RC[-9])&IF(RC[-8]="",,"|n"&R1C25&RC[-8])&IF(RC[-7]="",,"|n"&R1C26&RC[-7])&IF(RC[-6]="",,"|n"&R1C27&RC[-6])&IF(RC[-5]="",,"|n"&R1C28&RC[-5])&IF(RC[-2]="",,"|n"&RC[-2]) -> 
AG578: =IF(RC[-26]&RC[-25]&RC[-24]&RC[-23]&RC[-22]&RC[-21]="",,R1C6)&IF(RC[-26]="",,"|n"&R1C7&RC[-26])&IF(RC[-25]="",,"|n"&R1C8&RC[-25])&IF(RC[-24]="",,"|n"&R1C9&RC[-24])&IF(RC[-23]="",,"|n"&R1C10&RC[-23])&IF(RC[-22]="",,"|n"&R1C11&RC[-22])&IF(RC[-21]="",,"|n"&R1C12&RC[-21])&IF(RC[-19]&RC[-18]&RC[-17]&RC[-16]="",,"|n"&R1C13)&IF(RC[-19]="",,"|n"&R1C14&RC[-19])&IF(RC[-18]="",,"|n"&R1C15&RC[-18])&IF(RC[-17]="",,"|n"&R1C16&RC[-17])&IF(RC[-16]="",,"|n"&R1C17&RC[-16])&IF(RC[-15]="",,"|n"&R1C18&RC[-15])&IF(RC[-14]="",,"|n"&R1C19&RC[-14])&IF(RC[-13]="",,"|n"&R1C20&RC[-13])&IF(RC[-12]="",,"|n"&R1C21&RC[-12])&IF(RC[-10]="",,"|n"&R1C23&RC[-10])&IF(RC[-9]="",,"|n"&R1C24&RC[-9])&IF(RC[-8]="",,"|n"&R1C25&RC[-8])&IF(RC[-7]="",,"|n"&R1C26&RC[-7])&IF(RC[-6]="",,"|n"&R1C27&RC[-6])&IF(RC[-5]="",,"|n"&R1C28&RC[-5])&IF(RC[-2]="",,"|n"&RC[-2]) -> 
AG579: =IF(RC[-26]&RC[-25]&RC[-24]&RC[-23]&RC[-22]&RC[-21]="",,R1C6)&IF(RC[-26]="",,"|n"&R1C7&RC[-26])&IF(RC[-25]="",,"|n"&R1C8&RC[-25])&IF(RC[-24]="",,"|n"&R1C9&RC[-24])&IF(RC[-23]="",,"|n"&R1C10&RC[-23])&IF(RC[-22]="",,"|n"&R1C11&RC[-22])&IF(RC[-21]="",,"|n"&R1C12&RC[-21])&IF(RC[-19]&RC[-18]&RC[-17]&RC[-16]="",,"|n"&R1C13)&IF(RC[-19]="",,"|n"&R1C14&RC[-19])&IF(RC[-18]="",,"|n"&R1C15&RC[-18])&IF(RC[-17]="",,"|n"&R1C16&RC[-17])&IF(RC[-16]="",,"|n"&R1C17&RC[-16])&IF(RC[-15]="",,"|n"&R1C18&RC[-15])&IF(RC[-14]="",,"|n"&R1C19&RC[-14])&IF(RC[-13]="",,"|n"&R1C20&RC[-13])&IF(RC[-12]="",,"|n"&R1C21&RC[-12])&IF(RC[-10]="",,"|n"&R1C23&RC[-10])&IF(RC[-9]="",,"|n"&R1C24&RC[-9])&IF(RC[-8]="",,"|n"&R1C25&RC[-8])&IF(RC[-7]="",,"|n"&R1C26&RC[-7])&IF(RC[-6]="",,"|n"&R1C27&RC[-6])&IF(RC[-5]="",,"|n"&R1C28&RC[-5])&IF(RC[-2]="",,"|n"&RC[-2]) -> 
AG580: =IF(RC[-26]&RC[-25]&RC[-24]&RC[-23]&RC[-22]&RC[-21]="",,R1C6)&IF(RC[-26]="",,"|n"&R1C7&RC[-26])&IF(RC[-25]="",,"|n"&R1C8&RC[-25])&IF(RC[-24]="",,"|n"&R1C9&RC[-24])&IF(RC[-23]="",,"|n"&R1C10&RC[-23])&IF(RC[-22]="",,"|n"&R1C11&RC[-22])&IF(RC[-21]="",,"|n"&R1C12&RC[-21])&IF(RC[-19]&RC[-18]&RC[-17]&RC[-16]="",,"|n"&R1C13)&IF(RC[-19]="",,"|n"&R1C14&RC[-19])&IF(RC[-18]="",,"|n"&R1C15&RC[-18])&IF(RC[-17]="",,"|n"&R1C16&RC[-17])&IF(RC[-16]="",,"|n"&R1C17&RC[-16])&IF(RC[-15]="",,"|n"&R1C18&RC[-15])&IF(RC[-14]="",,"|n"&R1C19&RC[-14])&IF(RC[-13]="",,"|n"&R1C20&RC[-13])&IF(RC[-12]="",,"|n"&R1C21&RC[-12])&IF(RC[-10]="",,"|n"&R1C23&RC[-10])&IF(RC[-9]="",,"|n"&R1C24&RC[-9])&IF(RC[-8]="",,"|n"&R1C25&RC[-8])&IF(RC[-7]="",,"|n"&R1C26&RC[-7])&IF(RC[-6]="",,"|n"&R1C27&RC[-6])&IF(RC[-5]="",,"|n"&R1C28&RC[-5])&IF(RC[-2]="",,"|n"&RC[-2]) -> 
AG581: =IF(RC[-26]&RC[-25]&RC[-24]&RC[-23]&RC[-22]&RC[-21]="",,R1C6)&IF(RC[-26]="",,"|n"&R1C7&RC[-26])&IF(RC[-25]="",,"|n"&R1C8&RC[-25])&IF(RC[-24]="",,"|n"&R1C9&RC[-24])&IF(RC[-23]="",,"|n"&R1C10&RC[-23])&IF(RC[-22]="",,"|n"&R1C11&RC[-22])&IF(RC[-21]="",,"|n"&R1C12&RC[-21])&IF(RC[-19]&RC[-18]&RC[-17]&RC[-16]="",,"|n"&R1C13)&IF(RC[-19]="",,"|n"&R1C14&RC[-19])&IF(RC[-18]="",,"|n"&R1C15&RC[-18])&IF(RC[-17]="",,"|n"&R1C16&RC[-17])&IF(RC[-16]="",,"|n"&R1C17&RC[-16])&IF(RC[-15]="",,"|n"&R1C18&RC[-15])&IF(RC[-14]="",,"|n"&R1C19&RC[-14])&IF(RC[-13]="",,"|n"&R1C20&RC[-13])&IF(RC[-12]="",,"|n"&R1C21&RC[-12])&IF(RC[-10]="",,"|n"&R1C23&RC[-10])&IF(RC[-9]="",,"|n"&R1C24&RC[-9])&IF(RC[-8]="",,"|n"&R1C25&RC[-8])&IF(RC[-7]="",,"|n"&R1C26&RC[-7])&IF(RC[-6]="",,"|n"&R1C27&RC[-6])&IF(RC[-5]="",,"|n"&R1C28&RC[-5])&IF(RC[-2]="",,"|n"&RC[-2]) -> 
AG582: =IF(RC[-26]&RC[-25]&RC[-24]&RC[-23]&RC[-22]&RC[-21]="",,R1C6)&IF(RC[-26]="",,"|n"&R1C7&RC[-26])&IF(RC[-25]="",,"|n"&R1C8&RC[-25])&IF(RC[-24]="",,"|n"&R1C9&RC[-24])&IF(RC[-23]="",,"|n"&R1C10&RC[-23])&IF(RC[-22]="",,"|n"&R1C11&RC[-22])&IF(RC[-21]="",,"|n"&R1C12&RC[-21])&IF(RC[-19]&RC[-18]&RC[-17]&RC[-16]="",,"|n"&R1C13)&IF(RC[-19]="",,"|n"&R1C14&RC[-19])&IF(RC[-18]="",,"|n"&R1C15&RC[-18])&IF(RC[-17]="",,"|n"&R1C16&RC[-17])&IF(RC[-16]="",,"|n"&R1C17&RC[-16])&IF(RC[-15]="",,"|n"&R1C18&RC[-15])&IF(RC[-14]="",,"|n"&R1C19&RC[-14])&IF(RC[-13]="",,"|n"&R1C20&RC[-13])&IF(RC[-12]="",,"|n"&R1C21&RC[-12])&IF(RC[-10]="",,"|n"&R1C23&RC[-10])&IF(RC[-9]="",,"|n"&R1C24&RC[-9])&IF(RC[-8]="",,"|n"&R1C25&RC[-8])&IF(RC[-7]="",,"|n"&R1C26&RC[-7])&IF(RC[-6]="",,"|n"&R1C27&RC[-6])&IF(RC[-5]="",,"|n"&R1C28&RC[-5])&IF(RC[-2]="",,"|n"&RC[-2]) -> 
AG583: =IF(RC[-26]&RC[-25]&RC[-24]&RC[-23]&RC[-22]&RC[-21]="",,R1C6)&IF(RC[-26]="",,"|n"&R1C7&RC[-26])&IF(RC[-25]="",,"|n"&R1C8&RC[-25])&IF(RC[-24]="",,"|n"&R1C9&RC[-24])&IF(RC[-23]="",,"|n"&R1C10&RC[-23])&IF(RC[-22]="",,"|n"&R1C11&RC[-22])&IF(RC[-21]="",,"|n"&R1C12&RC[-21])&IF(RC[-19]&RC[-18]&RC[-17]&RC[-16]="",,"|n"&R1C13)&IF(RC[-19]="",,"|n"&R1C14&RC[-19])&IF(RC[-18]="",,"|n"&R1C15&RC[-18])&IF(RC[-17]="",,"|n"&R1C16&RC[-17])&IF(RC[-16]="",,"|n"&R1C17&RC[-16])&IF(RC[-15]="",,"|n"&R1C18&RC[-15])&IF(RC[-14]="",,"|n"&R1C19&RC[-14])&IF(RC[-13]="",,"|n"&R1C20&RC[-13])&IF(RC[-12]="",,"|n"&R1C21&RC[-12])&IF(RC[-10]="",,"|n"&R1C23&RC[-10])&IF(RC[-9]="",,"|n"&R1C24&RC[-9])&IF(RC[-8]="",,"|n"&R1C25&RC[-8])&IF(RC[-7]="",,"|n"&R1C26&RC[-7])&IF(RC[-6]="",,"|n"&R1C27&RC[-6])&IF(RC[-5]="",,"|n"&R1C28&RC[-5])&IF(RC[-2]="",,"|n"&RC[-2]) -> 
AG584: =IF(RC[-26]&RC[-25]&RC[-24]&RC[-23]&RC[-22]&RC[-21]="",,R1C6)&IF(RC[-26]="",,"|n"&R1C7&RC[-26])&IF(RC[-25]="",,"|n"&R1C8&RC[-25])&IF(RC[-24]="",,"|n"&R1C9&RC[-24])&IF(RC[-23]="",,"|n"&R1C10&RC[-23])&IF(RC[-22]="",,"|n"&R1C11&RC[-22])&IF(RC[-21]="",,"|n"&R1C12&RC[-21])&IF(RC[-19]&RC[-18]&RC[-17]&RC[-16]="",,"|n"&R1C13)&IF(RC[-19]="",,"|n"&R1C14&RC[-19])&IF(RC[-18]="",,"|n"&R1C15&RC[-18])&IF(RC[-17]="",,"|n"&R1C16&RC[-17])&IF(RC[-16]="",,"|n"&R1C17&RC[-16])&IF(RC[-15]="",,"|n"&R1C18&RC[-15])&IF(RC[-14]="",,"|n"&R1C19&RC[-14])&IF(RC[-13]="",,"|n"&R1C20&RC[-13])&IF(RC[-12]="",,"|n"&R1C21&RC[-12])&IF(RC[-10]="",,"|n"&R1C23&RC[-10])&IF(RC[-9]="",,"|n"&R1C24&RC[-9])&IF(RC[-8]="",,"|n"&R1C25&RC[-8])&IF(RC[-7]="",,"|n"&R1C26&RC[-7])&IF(RC[-6]="",,"|n"&R1C27&RC[-6])&IF(RC[-5]="",,"|n"&R1C28&RC[-5])&IF(RC[-2]="",,"|n"&RC[-2]) -> 
AG585: =IF(RC[-26]&RC[-25]&RC[-24]&RC[-23]&RC[-22]&RC[-21]="",,R1C6)&IF(RC[-26]="",,"|n"&R1C7&RC[-26])&IF(RC[-25]="",,"|n"&R1C8&RC[-25])&IF(RC[-24]="",,"|n"&R1C9&RC[-24])&IF(RC[-23]="",,"|n"&R1C10&RC[-23])&IF(RC[-22]="",,"|n"&R1C11&RC[-22])&IF(RC[-21]="",,"|n"&R1C12&RC[-21])&IF(RC[-19]&RC[-18]&RC[-17]&RC[-16]="",,"|n"&R1C13)&IF(RC[-19]="",,"|n"&R1C14&RC[-19])&IF(RC[-18]="",,"|n"&R1C15&RC[-18])&IF(RC[-17]="",,"|n"&R1C16&RC[-17])&IF(RC[-16]="",,"|n"&R1C17&RC[-16])&IF(RC[-15]="",,"|n"&R1C18&RC[-15])&IF(RC[-14]="",,"|n"&R1C19&RC[-14])&IF(RC[-13]="",,"|n"&R1C20&RC[-13])&IF(RC[-12]="",,"|n"&R1C21&RC[-12])&IF(RC[-10]="",,"|n"&R1C23&RC[-10])&IF(RC[-9]="",,"|n"&R1C24&RC[-9])&IF(RC[-8]="",,"|n"&R1C25&RC[-8])&IF(RC[-7]="",,"|n"&R1C26&RC[-7])&IF(RC[-6]="",,"|n"&R1C27&RC[-6])&IF(RC[-5]="",,"|n"&R1C28&RC[-5])&IF(RC[-2]="",,"|n"&RC[-2]) -> 
AG586: =IF(RC[-26]&RC[-25]&RC[-24]&RC[-23]&RC[-22]&RC[-21]="",,R1C6)&IF(RC[-26]="",,"|n"&R1C7&RC[-26])&IF(RC[-25]="",,"|n"&R1C8&RC[-25])&IF(RC[-24]="",,"|n"&R1C9&RC[-24])&IF(RC[-23]="",,"|n"&R1C10&RC[-23])&IF(RC[-22]="",,"|n"&R1C11&RC[-22])&IF(RC[-21]="",,"|n"&R1C12&RC[-21])&IF(RC[-19]&RC[-18]&RC[-17]&RC[-16]="",,"|n"&R1C13)&IF(RC[-19]="",,"|n"&R1C14&RC[-19])&IF(RC[-18]="",,"|n"&R1C15&RC[-18])&IF(RC[-17]="",,"|n"&R1C16&RC[-17])&IF(RC[-16]="",,"|n"&R1C17&RC[-16])&IF(RC[-15]="",,"|n"&R1C18&RC[-15])&IF(RC[-14]="",,"|n"&R1C19&RC[-14])&IF(RC[-13]="",,"|n"&R1C20&RC[-13])&IF(RC[-12]="",,"|n"&R1C21&RC[-12])&IF(RC[-10]="",,"|n"&R1C23&RC[-10])&IF(RC[-9]="",,"|n"&R1C24&RC[-9])&IF(RC[-8]="",,"|n"&R1C25&RC[-8])&IF(RC[-7]="",,"|n"&R1C26&RC[-7])&IF(RC[-6]="",,"|n"&R1C27&RC[-6])&IF(RC[-5]="",,"|n"&R1C28&RC[-5])&IF(RC[-2]="",,"|n"&RC[-2]) -> 
AG587: =IF(RC[-26]&RC[-25]&RC[-24]&RC[-23]&RC[-22]&RC[-21]="",,R1C6)&IF(RC[-26]="",,"|n"&R1C7&RC[-26])&IF(RC[-25]="",,"|n"&R1C8&RC[-25])&IF(RC[-24]="",,"|n"&R1C9&RC[-24])&IF(RC[-23]="",,"|n"&R1C10&RC[-23])&IF(RC[-22]="",,"|n"&R1C11&RC[-22])&IF(RC[-21]="",,"|n"&R1C12&RC[-21])&IF(RC[-19]&RC[-18]&RC[-17]&RC[-16]="",,"|n"&R1C13)&IF(RC[-19]="",,"|n"&R1C14&RC[-19])&IF(RC[-18]="",,"|n"&R1C15&RC[-18])&IF(RC[-17]="",,"|n"&R1C16&RC[-17])&IF(RC[-16]="",,"|n"&R1C17&RC[-16])&IF(RC[-15]="",,"|n"&R1C18&RC[-15])&IF(RC[-14]="",,"|n"&R1C19&RC[-14])&IF(RC[-13]="",,"|n"&R1C20&RC[-13])&IF(RC[-12]="",,"|n"&R1C21&RC[-12])&IF(RC[-10]="",,"|n"&R1C23&RC[-10])&IF(RC[-9]="",,"|n"&R1C24&RC[-9])&IF(RC[-8]="",,"|n"&R1C25&RC[-8])&IF(RC[-7]="",,"|n"&R1C26&RC[-7])&IF(RC[-6]="",,"|n"&R1C27&RC[-6])&IF(RC[-5]="",,"|n"&R1C28&RC[-5])&IF(RC[-2]="",,"|n"&RC[-2]) -> 
AG588: =IF(RC[-26]&RC[-25]&RC[-24]&RC[-23]&RC[-22]&RC[-21]="",,R1C6)&IF(RC[-26]="",,"|n"&R1C7&RC[-26])&IF(RC[-25]="",,"|n"&R1C8&RC[-25])&IF(RC[-24]="",,"|n"&R1C9&RC[-24])&IF(RC[-23]="",,"|n"&R1C10&RC[-23])&IF(RC[-22]="",,"|n"&R1C11&RC[-22])&IF(RC[-21]="",,"|n"&R1C12&RC[-21])&IF(RC[-19]&RC[-18]&RC[-17]&RC[-16]="",,"|n"&R1C13)&IF(RC[-19]="",,"|n"&R1C14&RC[-19])&IF(RC[-18]="",,"|n"&R1C15&RC[-18])&IF(RC[-17]="",,"|n"&R1C16&RC[-17])&IF(RC[-16]="",,"|n"&R1C17&RC[-16])&IF(RC[-15]="",,"|n"&R1C18&RC[-15])&IF(RC[-14]="",,"|n"&R1C19&RC[-14])&IF(RC[-13]="",,"|n"&R1C20&RC[-13])&IF(RC[-12]="",,"|n"&R1C21&RC[-12])&IF(RC[-10]="",,"|n"&R1C23&RC[-10])&IF(RC[-9]="",,"|n"&R1C24&RC[-9])&IF(RC[-8]="",,"|n"&R1C25&RC[-8])&IF(RC[-7]="",,"|n"&R1C26&RC[-7])&IF(RC[-6]="",,"|n"&R1C27&RC[-6])&IF(RC[-5]="",,"|n"&R1C28&RC[-5])&IF(RC[-2]="",,"|n"&RC[-2]) -> 
AG589: =IF(RC[-26]&RC[-25]&RC[-24]&RC[-23]&RC[-22]&RC[-21]="",,R1C6)&IF(RC[-26]="",,"|n"&R1C7&RC[-26])&IF(RC[-25]="",,"|n"&R1C8&RC[-25])&IF(RC[-24]="",,"|n"&R1C9&RC[-24])&IF(RC[-23]="",,"|n"&R1C10&RC[-23])&IF(RC[-22]="",,"|n"&R1C11&RC[-22])&IF(RC[-21]="",,"|n"&R1C12&RC[-21])&IF(RC[-19]&RC[-18]&RC[-17]&RC[-16]="",,"|n"&R1C13)&IF(RC[-19]="",,"|n"&R1C14&RC[-19])&IF(RC[-18]="",,"|n"&R1C15&RC[-18])&IF(RC[-17]="",,"|n"&R1C16&RC[-17])&IF(RC[-16]="",,"|n"&R1C17&RC[-16])&IF(RC[-15]="",,"|n"&R1C18&RC[-15])&IF(RC[-14]="",,"|n"&R1C19&RC[-14])&IF(RC[-13]="",,"|n"&R1C20&RC[-13])&IF(RC[-12]="",,"|n"&R1C21&RC[-12])&IF(RC[-10]="",,"|n"&R1C23&RC[-10])&IF(RC[-9]="",,"|n"&R1C24&RC[-9])&IF(RC[-8]="",,"|n"&R1C25&RC[-8])&IF(RC[-7]="",,"|n"&R1C26&RC[-7])&IF(RC[-6]="",,"|n"&R1C27&RC[-6])&IF(RC[-5]="",,"|n"&R1C28&RC[-5])&IF(RC[-2]="",,"|n"&RC[-2]) -> 
AG590: =IF(RC[-26]&RC[-25]&RC[-24]&RC[-23]&RC[-22]&RC[-21]="",,R1C6)&IF(RC[-26]="",,"|n"&R1C7&RC[-26])&IF(RC[-25]="",,"|n"&R1C8&RC[-25])&IF(RC[-24]="",,"|n"&R1C9&RC[-24])&IF(RC[-23]="",,"|n"&R1C10&RC[-23])&IF(RC[-22]="",,"|n"&R1C11&RC[-22])&IF(RC[-21]="",,"|n"&R1C12&RC[-21])&IF(RC[-19]&RC[-18]&RC[-17]&RC[-16]="",,"|n"&R1C13)&IF(RC[-19]="",,"|n"&R1C14&RC[-19])&IF(RC[-18]="",,"|n"&R1C15&RC[-18])&IF(RC[-17]="",,"|n"&R1C16&RC[-17])&IF(RC[-16]="",,"|n"&R1C17&RC[-16])&IF(RC[-15]="",,"|n"&R1C18&RC[-15])&IF(RC[-14]="",,"|n"&R1C19&RC[-14])&IF(RC[-13]="",,"|n"&R1C20&RC[-13])&IF(RC[-12]="",,"|n"&R1C21&RC[-12])&IF(RC[-10]="",,"|n"&R1C23&RC[-10])&IF(RC[-9]="",,"|n"&R1C24&RC[-9])&IF(RC[-8]="",,"|n"&R1C25&RC[-8])&IF(RC[-7]="",,"|n"&R1C26&RC[-7])&IF(RC[-6]="",,"|n"&R1C27&RC[-6])&IF(RC[-5]="",,"|n"&R1C28&RC[-5])&IF(RC[-2]="",,"|n"&RC[-2]) -> 
AG591: =IF(RC[-26]&RC[-25]&RC[-24]&RC[-23]&RC[-22]&RC[-21]="",,R1C6)&IF(RC[-26]="",,"|n"&R1C7&RC[-26])&IF(RC[-25]="",,"|n"&R1C8&RC[-25])&IF(RC[-24]="",,"|n"&R1C9&RC[-24])&IF(RC[-23]="",,"|n"&R1C10&RC[-23])&IF(RC[-22]="",,"|n"&R1C11&RC[-22])&IF(RC[-21]="",,"|n"&R1C12&RC[-21])&IF(RC[-19]&RC[-18]&RC[-17]&RC[-16]="",,"|n"&R1C13)&IF(RC[-19]="",,"|n"&R1C14&RC[-19])&IF(RC[-18]="",,"|n"&R1C15&RC[-18])&IF(RC[-17]="",,"|n"&R1C16&RC[-17])&IF(RC[-16]="",,"|n"&R1C17&RC[-16])&IF(RC[-15]="",,"|n"&R1C18&RC[-15])&IF(RC[-14]="",,"|n"&R1C19&RC[-14])&IF(RC[-13]="",,"|n"&R1C20&RC[-13])&IF(RC[-12]="",,"|n"&R1C21&RC[-12])&IF(RC[-10]="",,"|n"&R1C23&RC[-10])&IF(RC[-9]="",,"|n"&R1C24&RC[-9])&IF(RC[-8]="",,"|n"&R1C25&RC[-8])&IF(RC[-7]="",,"|n"&R1C26&RC[-7])&IF(RC[-6]="",,"|n"&R1C27&RC[-6])&IF(RC[-5]="",,"|n"&R1C28&RC[-5])&IF(RC[-2]="",,"|n"&RC[-2]) -> 
AG592: =IF(RC[-26]&RC[-25]&RC[-24]&RC[-23]&RC[-22]&RC[-21]="",,R1C6)&IF(RC[-26]="",,"|n"&R1C7&RC[-26])&IF(RC[-25]="",,"|n"&R1C8&RC[-25])&IF(RC[-24]="",,"|n"&R1C9&RC[-24])&IF(RC[-23]="",,"|n"&R1C10&RC[-23])&IF(RC[-22]="",,"|n"&R1C11&RC[-22])&IF(RC[-21]="",,"|n"&R1C12&RC[-21])&IF(RC[-19]&RC[-18]&RC[-17]&RC[-16]="",,"|n"&R1C13)&IF(RC[-19]="",,"|n"&R1C14&RC[-19])&IF(RC[-18]="",,"|n"&R1C15&RC[-18])&IF(RC[-17]="",,"|n"&R1C16&RC[-17])&IF(RC[-16]="",,"|n"&R1C17&RC[-16])&IF(RC[-15]="",,"|n"&R1C18&RC[-15])&IF(RC[-14]="",,"|n"&R1C19&RC[-14])&IF(RC[-13]="",,"|n"&R1C20&RC[-13])&IF(RC[-12]="",,"|n"&R1C21&RC[-12])&IF(RC[-10]="",,"|n"&R1C23&RC[-10])&IF(RC[-9]="",,"|n"&R1C24&RC[-9])&IF(RC[-8]="",,"|n"&R1C25&RC[-8])&IF(RC[-7]="",,"|n"&R1C26&RC[-7])&IF(RC[-6]="",,"|n"&R1C27&RC[-6])&IF(RC[-5]="",,"|n"&R1C28&RC[-5])&IF(RC[-2]="",,"|n"&RC[-2]) -> 
AG593: =IF(RC[-26]&RC[-25]&RC[-24]&RC[-23]&RC[-22]&RC[-21]="",,R1C6)&IF(RC[-26]="",,"|n"&R1C7&RC[-26])&IF(RC[-25]="",,"|n"&R1C8&RC[-25])&IF(RC[-24]="",,"|n"&R1C9&RC[-24])&IF(RC[-23]="",,"|n"&R1C10&RC[-23])&IF(RC[-22]="",,"|n"&R1C11&RC[-22])&IF(RC[-21]="",,"|n"&R1C12&RC[-21])&IF(RC[-19]&RC[-18]&RC[-17]&RC[-16]="",,"|n"&R1C13)&IF(RC[-19]="",,"|n"&R1C14&RC[-19])&IF(RC[-18]="",,"|n"&R1C15&RC[-18])&IF(RC[-17]="",,"|n"&R1C16&RC[-17])&IF(RC[-16]="",,"|n"&R1C17&RC[-16])&IF(RC[-15]="",,"|n"&R1C18&RC[-15])&IF(RC[-14]="",,"|n"&R1C19&RC[-14])&IF(RC[-13]="",,"|n"&R1C20&RC[-13])&IF(RC[-12]="",,"|n"&R1C21&RC[-12])&IF(RC[-10]="",,"|n"&R1C23&RC[-10])&IF(RC[-9]="",,"|n"&R1C24&RC[-9])&IF(RC[-8]="",,"|n"&R1C25&RC[-8])&IF(RC[-7]="",,"|n"&R1C26&RC[-7])&IF(RC[-6]="",,"|n"&R1C27&RC[-6])&IF(RC[-5]="",,"|n"&R1C28&RC[-5])&IF(RC[-2]="",,"|n"&RC[-2]) -> 
AG594: =IF(RC[-26]&RC[-25]&RC[-24]&RC[-23]&RC[-22]&RC[-21]="",,R1C6)&IF(RC[-26]="",,"|n"&R1C7&RC[-26])&IF(RC[-25]="",,"|n"&R1C8&RC[-25])&IF(RC[-24]="",,"|n"&R1C9&RC[-24])&IF(RC[-23]="",,"|n"&R1C10&RC[-23])&IF(RC[-22]="",,"|n"&R1C11&RC[-22])&IF(RC[-21]="",,"|n"&R1C12&RC[-21])&IF(RC[-19]&RC[-18]&RC[-17]&RC[-16]="",,"|n"&R1C13)&IF(RC[-19]="",,"|n"&R1C14&RC[-19])&IF(RC[-18]="",,"|n"&R1C15&RC[-18])&IF(RC[-17]="",,"|n"&R1C16&RC[-17])&IF(RC[-16]="",,"|n"&R1C17&RC[-16])&IF(RC[-15]="",,"|n"&R1C18&RC[-15])&IF(RC[-14]="",,"|n"&R1C19&RC[-14])&IF(RC[-13]="",,"|n"&R1C20&RC[-13])&IF(RC[-12]="",,"|n"&R1C21&RC[-12])&IF(RC[-10]="",,"|n"&R1C23&RC[-10])&IF(RC[-9]="",,"|n"&R1C24&RC[-9])&IF(RC[-8]="",,"|n"&R1C25&RC[-8])&IF(RC[-7]="",,"|n"&R1C26&RC[-7])&IF(RC[-6]="",,"|n"&R1C27&RC[-6])&IF(RC[-5]="",,"|n"&R1C28&RC[-5])&IF(RC[-2]="",,"|n"&RC[-2]) -> 
AG595: =IF(RC[-26]&RC[-25]&RC[-24]&RC[-23]&RC[-22]&RC[-21]="",,R1C6)&IF(RC[-26]="",,"|n"&R1C7&RC[-26])&IF(RC[-25]="",,"|n"&R1C8&RC[-25])&IF(RC[-24]="",,"|n"&R1C9&RC[-24])&IF(RC[-23]="",,"|n"&R1C10&RC[-23])&IF(RC[-22]="",,"|n"&R1C11&RC[-22])&IF(RC[-21]="",,"|n"&R1C12&RC[-21])&IF(RC[-19]&RC[-18]&RC[-17]&RC[-16]="",,"|n"&R1C13)&IF(RC[-19]="",,"|n"&R1C14&RC[-19])&IF(RC[-18]="",,"|n"&R1C15&RC[-18])&IF(RC[-17]="",,"|n"&R1C16&RC[-17])&IF(RC[-16]="",,"|n"&R1C17&RC[-16])&IF(RC[-15]="",,"|n"&R1C18&RC[-15])&IF(RC[-14]="",,"|n"&R1C19&RC[-14])&IF(RC[-13]="",,"|n"&R1C20&RC[-13])&IF(RC[-12]="",,"|n"&R1C21&RC[-12])&IF(RC[-10]="",,"|n"&R1C23&RC[-10])&IF(RC[-9]="",,"|n"&R1C24&RC[-9])&IF(RC[-8]="",,"|n"&R1C25&RC[-8])&IF(RC[-7]="",,"|n"&R1C26&RC[-7])&IF(RC[-6]="",,"|n"&R1C27&RC[-6])&IF(RC[-5]="",,"|n"&R1C28&RC[-5])&IF(RC[-2]="",,"|n"&RC[-2]) -> 
AG596: =IF(RC[-26]&RC[-25]&RC[-24]&RC[-23]&RC[-22]&RC[-21]="",,R1C6)&IF(RC[-26]="",,"|n"&R1C7&RC[-26])&IF(RC[-25]="",,"|n"&R1C8&RC[-25])&IF(RC[-24]="",,"|n"&R1C9&RC[-24])&IF(RC[-23]="",,"|n"&R1C10&RC[-23])&IF(RC[-22]="",,"|n"&R1C11&RC[-22])&IF(RC[-21]="",,"|n"&R1C12&RC[-21])&IF(RC[-19]&RC[-18]&RC[-17]&RC[-16]="",,"|n"&R1C13)&IF(RC[-19]="",,"|n"&R1C14&RC[-19])&IF(RC[-18]="",,"|n"&R1C15&RC[-18])&IF(RC[-17]="",,"|n"&R1C16&RC[-17])&IF(RC[-16]="",,"|n"&R1C17&RC[-16])&IF(RC[-15]="",,"|n"&R1C18&RC[-15])&IF(RC[-14]="",,"|n"&R1C19&RC[-14])&IF(RC[-13]="",,"|n"&R1C20&RC[-13])&IF(RC[-12]="",,"|n"&R1C21&RC[-12])&IF(RC[-10]="",,"|n"&R1C23&RC[-10])&IF(RC[-9]="",,"|n"&R1C24&RC[-9])&IF(RC[-8]="",,"|n"&R1C25&RC[-8])&IF(RC[-7]="",,"|n"&R1C26&RC[-7])&IF(RC[-6]="",,"|n"&R1C27&RC[-6])&IF(RC[-5]="",,"|n"&R1C28&RC[-5])&IF(RC[-2]="",,"|n"&RC[-2]) -> 
AG597: =IF(RC[-26]&RC[-25]&RC[-24]&RC[-23]&RC[-22]&RC[-21]="",,R1C6)&IF(RC[-26]="",,"|n"&R1C7&RC[-26])&IF(RC[-25]="",,"|n"&R1C8&RC[-25])&IF(RC[-24]="",,"|n"&R1C9&RC[-24])&IF(RC[-23]="",,"|n"&R1C10&RC[-23])&IF(RC[-22]="",,"|n"&R1C11&RC[-22])&IF(RC[-21]="",,"|n"&R1C12&RC[-21])&IF(RC[-19]&RC[-18]&RC[-17]&RC[-16]="",,"|n"&R1C13)&IF(RC[-19]="",,"|n"&R1C14&RC[-19])&IF(RC[-18]="",,"|n"&R1C15&RC[-18])&IF(RC[-17]="",,"|n"&R1C16&RC[-17])&IF(RC[-16]="",,"|n"&R1C17&RC[-16])&IF(RC[-15]="",,"|n"&R1C18&RC[-15])&IF(RC[-14]="",,"|n"&R1C19&RC[-14])&IF(RC[-13]="",,"|n"&R1C20&RC[-13])&IF(RC[-12]="",,"|n"&R1C21&RC[-12])&IF(RC[-10]="",,"|n"&R1C23&RC[-10])&IF(RC[-9]="",,"|n"&R1C24&RC[-9])&IF(RC[-8]="",,"|n"&R1C25&RC[-8])&IF(RC[-7]="",,"|n"&R1C26&RC[-7])&IF(RC[-6]="",,"|n"&R1C27&RC[-6])&IF(RC[-5]="",,"|n"&R1C28&RC[-5])&IF(RC[-2]="",,"|n"&RC[-2]) -> 
AG598: =IF(RC[-26]&RC[-25]&RC[-24]&RC[-23]&RC[-22]&RC[-21]="",,R1C6)&IF(RC[-26]="",,"|n"&R1C7&RC[-26])&IF(RC[-25]="",,"|n"&R1C8&RC[-25])&IF(RC[-24]="",,"|n"&R1C9&RC[-24])&IF(RC[-23]="",,"|n"&R1C10&RC[-23])&IF(RC[-22]="",,"|n"&R1C11&RC[-22])&IF(RC[-21]="",,"|n"&R1C12&RC[-21])&IF(RC[-19]&RC[-18]&RC[-17]&RC[-16]="",,"|n"&R1C13)&IF(RC[-19]="",,"|n"&R1C14&RC[-19])&IF(RC[-18]="",,"|n"&R1C15&RC[-18])&IF(RC[-17]="",,"|n"&R1C16&RC[-17])&IF(RC[-16]="",,"|n"&R1C17&RC[-16])&IF(RC[-15]="",,"|n"&R1C18&RC[-15])&IF(RC[-14]="",,"|n"&R1C19&RC[-14])&IF(RC[-13]="",,"|n"&R1C20&RC[-13])&IF(RC[-12]="",,"|n"&R1C21&RC[-12])&IF(RC[-10]="",,"|n"&R1C23&RC[-10])&IF(RC[-9]="",,"|n"&R1C24&RC[-9])&IF(RC[-8]="",,"|n"&R1C25&RC[-8])&IF(RC[-7]="",,"|n"&R1C26&RC[-7])&IF(RC[-6]="",,"|n"&R1C27&RC[-6])&IF(RC[-5]="",,"|n"&R1C28&RC[-5])&IF(RC[-2]="",,"|n"&RC[-2]) -> 
AG599: =IF(RC[-26]&RC[-25]&RC[-24]&RC[-23]&RC[-22]&RC[-21]="",,R1C6)&IF(RC[-26]="",,"|n"&R1C7&RC[-26])&IF(RC[-25]="",,"|n"&R1C8&RC[-25])&IF(RC[-24]="",,"|n"&R1C9&RC[-24])&IF(RC[-23]="",,"|n"&R1C10&RC[-23])&IF(RC[-22]="",,"|n"&R1C11&RC[-22])&IF(RC[-21]="",,"|n"&R1C12&RC[-21])&IF(RC[-19]&RC[-18]&RC[-17]&RC[-16]="",,"|n"&R1C13)&IF(RC[-19]="",,"|n"&R1C14&RC[-19])&IF(RC[-18]="",,"|n"&R1C15&RC[-18])&IF(RC[-17]="",,"|n"&R1C16&RC[-17])&IF(RC[-16]="",,"|n"&R1C17&RC[-16])&IF(RC[-15]="",,"|n"&R1C18&RC[-15])&IF(RC[-14]="",,"|n"&R1C19&RC[-14])&IF(RC[-13]="",,"|n"&R1C20&RC[-13])&IF(RC[-12]="",,"|n"&R1C21&RC[-12])&IF(RC[-10]="",,"|n"&R1C23&RC[-10])&IF(RC[-9]="",,"|n"&R1C24&RC[-9])&IF(RC[-8]="",,"|n"&R1C25&RC[-8])&IF(RC[-7]="",,"|n"&R1C26&RC[-7])&IF(RC[-6]="",,"|n"&R1C27&RC[-6])&IF(RC[-5]="",,"|n"&R1C28&RC[-5])&IF(RC[-2]="",,"|n"&RC[-2]) -> 
AG600: =IF(RC[-26]&RC[-25]&RC[-24]&RC[-23]&RC[-22]&RC[-21]="",,R1C6)&IF(RC[-26]="",,"|n"&R1C7&RC[-26])&IF(RC[-25]="",,"|n"&R1C8&RC[-25])&IF(RC[-24]="",,"|n"&R1C9&RC[-24])&IF(RC[-23]="",,"|n"&R1C10&RC[-23])&IF(RC[-22]="",,"|n"&R1C11&RC[-22])&IF(RC[-21]="",,"|n"&R1C12&RC[-21])&IF(RC[-19]&RC[-18]&RC[-17]&RC[-16]="",,"|n"&R1C13)&IF(RC[-19]="",,"|n"&R1C14&RC[-19])&IF(RC[-18]="",,"|n"&R1C15&RC[-18])&IF(RC[-17]="",,"|n"&R1C16&RC[-17])&IF(RC[-16]="",,"|n"&R1C17&RC[-16])&IF(RC[-15]="",,"|n"&R1C18&RC[-15])&IF(RC[-14]="",,"|n"&R1C19&RC[-14])&IF(RC[-13]="",,"|n"&R1C20&RC[-13])&IF(RC[-12]="",,"|n"&R1C21&RC[-12])&IF(RC[-10]="",,"|n"&R1C23&RC[-10])&IF(RC[-9]="",,"|n"&R1C24&RC[-9])&IF(RC[-8]="",,"|n"&R1C25&RC[-8])&IF(RC[-7]="",,"|n"&R1C26&RC[-7])&IF(RC[-6]="",,"|n"&R1C27&RC[-6])&IF(RC[-5]="",,"|n"&R1C28&RC[-5])&IF(RC[-2]="",,"|n"&RC[-2]) -> 
AG601: =IF(RC[-26]&RC[-25]&RC[-24]&RC[-23]&RC[-22]&RC[-21]="",,R1C6)&IF(RC[-26]="",,"|n"&R1C7&RC[-26])&IF(RC[-25]="",,"|n"&R1C8&RC[-25])&IF(RC[-24]="",,"|n"&R1C9&RC[-24])&IF(RC[-23]="",,"|n"&R1C10&RC[-23])&IF(RC[-22]="",,"|n"&R1C11&RC[-22])&IF(RC[-21]="",,"|n"&R1C12&RC[-21])&IF(RC[-19]&RC[-18]&RC[-17]&RC[-16]="",,"|n"&R1C13)&IF(RC[-19]="",,"|n"&R1C14&RC[-19])&IF(RC[-18]="",,"|n"&R1C15&RC[-18])&IF(RC[-17]="",,"|n"&R1C16&RC[-17])&IF(RC[-16]="",,"|n"&R1C17&RC[-16])&IF(RC[-15]="",,"|n"&R1C18&RC[-15])&IF(RC[-14]="",,"|n"&R1C19&RC[-14])&IF(RC[-13]="",,"|n"&R1C20&RC[-13])&IF(RC[-12]="",,"|n"&R1C21&RC[-12])&IF(RC[-10]="",,"|n"&R1C23&RC[-10])&IF(RC[-9]="",,"|n"&R1C24&RC[-9])&IF(RC[-8]="",,"|n"&R1C25&RC[-8])&IF(RC[-7]="",,"|n"&R1C26&RC[-7])&IF(RC[-6]="",,"|n"&R1C27&RC[-6])&IF(RC[-5]="",,"|n"&R1C28&RC[-5])&IF(RC[-2]="",,"|n"&RC[-2]) -> 
AG602: =IF(RC[-26]&RC[-25]&RC[-24]&RC[-23]&RC[-22]&RC[-21]="",,R1C6)&IF(RC[-26]="",,"|n"&R1C7&RC[-26])&IF(RC[-25]="",,"|n"&R1C8&RC[-25])&IF(RC[-24]="",,"|n"&R1C9&RC[-24])&IF(RC[-23]="",,"|n"&R1C10&RC[-23])&IF(RC[-22]="",,"|n"&R1C11&RC[-22])&IF(RC[-21]="",,"|n"&R1C12&RC[-21])&IF(RC[-19]&RC[-18]&RC[-17]&RC[-16]="",,"|n"&R1C13)&IF(RC[-19]="",,"|n"&R1C14&RC[-19])&IF(RC[-18]="",,"|n"&R1C15&RC[-18])&IF(RC[-17]="",,"|n"&R1C16&RC[-17])&IF(RC[-16]="",,"|n"&R1C17&RC[-16])&IF(RC[-15]="",,"|n"&R1C18&RC[-15])&IF(RC[-14]="",,"|n"&R1C19&RC[-14])&IF(RC[-13]="",,"|n"&R1C20&RC[-13])&IF(RC[-12]="",,"|n"&R1C21&RC[-12])&IF(RC[-10]="",,"|n"&R1C23&RC[-10])&IF(RC[-9]="",,"|n"&R1C24&RC[-9])&IF(RC[-8]="",,"|n"&R1C25&RC[-8])&IF(RC[-7]="",,"|n"&R1C26&RC[-7])&IF(RC[-6]="",,"|n"&R1C27&RC[-6])&IF(RC[-5]="",,"|n"&R1C28&RC[-5])&IF(RC[-2]="",,"|n"&RC[-2]) -> 
AG603: =IF(RC[-26]&RC[-25]&RC[-24]&RC[-23]&RC[-22]&RC[-21]="",,R1C6)&IF(RC[-26]="",,"|n"&R1C7&RC[-26])&IF(RC[-25]="",,"|n"&R1C8&RC[-25])&IF(RC[-24]="",,"|n"&R1C9&RC[-24])&IF(RC[-23]="",,"|n"&R1C10&RC[-23])&IF(RC[-22]="",,"|n"&R1C11&RC[-22])&IF(RC[-21]="",,"|n"&R1C12&RC[-21])&IF(RC[-19]&RC[-18]&RC[-17]&RC[-16]="",,"|n"&R1C13)&IF(RC[-19]="",,"|n"&R1C14&RC[-19])&IF(RC[-18]="",,"|n"&R1C15&RC[-18])&IF(RC[-17]="",,"|n"&R1C16&RC[-17])&IF(RC[-16]="",,"|n"&R1C17&RC[-16])&IF(RC[-15]="",,"|n"&R1C18&RC[-15])&IF(RC[-14]="",,"|n"&R1C19&RC[-14])&IF(RC[-13]="",,"|n"&R1C20&RC[-13])&IF(RC[-12]="",,"|n"&R1C21&RC[-12])&IF(RC[-10]="",,"|n"&R1C23&RC[-10])&IF(RC[-9]="",,"|n"&R1C24&RC[-9])&IF(RC[-8]="",,"|n"&R1C25&RC[-8])&IF(RC[-7]="",,"|n"&R1C26&RC[-7])&IF(RC[-6]="",,"|n"&R1C27&RC[-6])&IF(RC[-5]="",,"|n"&R1C28&RC[-5])&IF(RC[-2]="",,"|n"&RC[-2]) -> 
AG604: =IF(RC[-26]&RC[-25]&RC[-24]&RC[-23]&RC[-22]&RC[-21]="",,R1C6)&IF(RC[-26]="",,"|n"&R1C7&RC[-26])&IF(RC[-25]="",,"|n"&R1C8&RC[-25])&IF(RC[-24]="",,"|n"&R1C9&RC[-24])&IF(RC[-23]="",,"|n"&R1C10&RC[-23])&IF(RC[-22]="",,"|n"&R1C11&RC[-22])&IF(RC[-21]="",,"|n"&R1C12&RC[-21])&IF(RC[-19]&RC[-18]&RC[-17]&RC[-16]="",,"|n"&R1C13)&IF(RC[-19]="",,"|n"&R1C14&RC[-19])&IF(RC[-18]="",,"|n"&R1C15&RC[-18])&IF(RC[-17]="",,"|n"&R1C16&RC[-17])&IF(RC[-16]="",,"|n"&R1C17&RC[-16])&IF(RC[-15]="",,"|n"&R1C18&RC[-15])&IF(RC[-14]="",,"|n"&R1C19&RC[-14])&IF(RC[-13]="",,"|n"&R1C20&RC[-13])&IF(RC[-12]="",,"|n"&R1C21&RC[-12])&IF(RC[-10]="",,"|n"&R1C23&RC[-10])&IF(RC[-9]="",,"|n"&R1C24&RC[-9])&IF(RC[-8]="",,"|n"&R1C25&RC[-8])&IF(RC[-7]="",,"|n"&R1C26&RC[-7])&IF(RC[-6]="",,"|n"&R1C27&RC[-6])&IF(RC[-5]="",,"|n"&R1C28&RC[-5])&IF(RC[-2]="",,"|n"&RC[-2]) -> 
AG605: =IF(RC[-26]&RC[-25]&RC[-24]&RC[-23]&RC[-22]&RC[-21]="",,R1C6)&IF(RC[-26]="",,"|n"&R1C7&RC[-26])&IF(RC[-25]="",,"|n"&R1C8&RC[-25])&IF(RC[-24]="",,"|n"&R1C9&RC[-24])&IF(RC[-23]="",,"|n"&R1C10&RC[-23])&IF(RC[-22]="",,"|n"&R1C11&RC[-22])&IF(RC[-21]="",,"|n"&R1C12&RC[-21])&IF(RC[-19]&RC[-18]&RC[-17]&RC[-16]="",,"|n"&R1C13)&IF(RC[-19]="",,"|n"&R1C14&RC[-19])&IF(RC[-18]="",,"|n"&R1C15&RC[-18])&IF(RC[-17]="",,"|n"&R1C16&RC[-17])&IF(RC[-16]="",,"|n"&R1C17&RC[-16])&IF(RC[-15]="",,"|n"&R1C18&RC[-15])&IF(RC[-14]="",,"|n"&R1C19&RC[-14])&IF(RC[-13]="",,"|n"&R1C20&RC[-13])&IF(RC[-12]="",,"|n"&R1C21&RC[-12])&IF(RC[-10]="",,"|n"&R1C23&RC[-10])&IF(RC[-9]="",,"|n"&R1C24&RC[-9])&IF(RC[-8]="",,"|n"&R1C25&RC[-8])&IF(RC[-7]="",,"|n"&R1C26&RC[-7])&IF(RC[-6]="",,"|n"&R1C27&RC[-6])&IF(RC[-5]="",,"|n"&R1C28&RC[-5])&IF(RC[-2]="",,"|n"&RC[-2]) -> 
AG606: =IF(RC[-26]&RC[-25]&RC[-24]&RC[-23]&RC[-22]&RC[-21]="",,R1C6)&IF(RC[-26]="",,"|n"&R1C7&RC[-26])&IF(RC[-25]="",,"|n"&R1C8&RC[-25])&IF(RC[-24]="",,"|n"&R1C9&RC[-24])&IF(RC[-23]="",,"|n"&R1C10&RC[-23])&IF(RC[-22]="",,"|n"&R1C11&RC[-22])&IF(RC[-21]="",,"|n"&R1C12&RC[-21])&IF(RC[-19]&RC[-18]&RC[-17]&RC[-16]="",,"|n"&R1C13)&IF(RC[-19]="",,"|n"&R1C14&RC[-19])&IF(RC[-18]="",,"|n"&R1C15&RC[-18])&IF(RC[-17]="",,"|n"&R1C16&RC[-17])&IF(RC[-16]="",,"|n"&R1C17&RC[-16])&IF(RC[-15]="",,"|n"&R1C18&RC[-15])&IF(RC[-14]="",,"|n"&R1C19&RC[-14])&IF(RC[-13]="",,"|n"&R1C20&RC[-13])&IF(RC[-12]="",,"|n"&R1C21&RC[-12])&IF(RC[-10]="",,"|n"&R1C23&RC[-10])&IF(RC[-9]="",,"|n"&R1C24&RC[-9])&IF(RC[-8]="",,"|n"&R1C25&RC[-8])&IF(RC[-7]="",,"|n"&R1C26&RC[-7])&IF(RC[-6]="",,"|n"&R1C27&RC[-6])&IF(RC[-5]="",,"|n"&R1C28&RC[-5])&IF(RC[-2]="",,"|n"&RC[-2]) -> 
AG607: =IF(RC[-26]&RC[-25]&RC[-24]&RC[-23]&RC[-22]&RC[-21]="",,R1C6)&IF(RC[-26]="",,"|n"&R1C7&RC[-26])&IF(RC[-25]="",,"|n"&R1C8&RC[-25])&IF(RC[-24]="",,"|n"&R1C9&RC[-24])&IF(RC[-23]="",,"|n"&R1C10&RC[-23])&IF(RC[-22]="",,"|n"&R1C11&RC[-22])&IF(RC[-21]="",,"|n"&R1C12&RC[-21])&IF(RC[-19]&RC[-18]&RC[-17]&RC[-16]="",,"|n"&R1C13)&IF(RC[-19]="",,"|n"&R1C14&RC[-19])&IF(RC[-18]="",,"|n"&R1C15&RC[-18])&IF(RC[-17]="",,"|n"&R1C16&RC[-17])&IF(RC[-16]="",,"|n"&R1C17&RC[-16])&IF(RC[-15]="",,"|n"&R1C18&RC[-15])&IF(RC[-14]="",,"|n"&R1C19&RC[-14])&IF(RC[-13]="",,"|n"&R1C20&RC[-13])&IF(RC[-12]="",,"|n"&R1C21&RC[-12])&IF(RC[-10]="",,"|n"&R1C23&RC[-10])&IF(RC[-9]="",,"|n"&R1C24&RC[-9])&IF(RC[-8]="",,"|n"&R1C25&RC[-8])&IF(RC[-7]="",,"|n"&R1C26&RC[-7])&IF(RC[-6]="",,"|n"&R1C27&RC[-6])&IF(RC[-5]="",,"|n"&R1C28&RC[-5])&IF(RC[-2]="",,"|n"&RC[-2]) -> 
AG608: =IF(RC[-26]&RC[-25]&RC[-24]&RC[-23]&RC[-22]&RC[-21]="",,R1C6)&IF(RC[-26]="",,"|n"&R1C7&RC[-26])&IF(RC[-25]="",,"|n"&R1C8&RC[-25])&IF(RC[-24]="",,"|n"&R1C9&RC[-24])&IF(RC[-23]="",,"|n"&R1C10&RC[-23])&IF(RC[-22]="",,"|n"&R1C11&RC[-22])&IF(RC[-21]="",,"|n"&R1C12&RC[-21])&IF(RC[-19]&RC[-18]&RC[-17]&RC[-16]="",,"|n"&R1C13)&IF(RC[-19]="",,"|n"&R1C14&RC[-19])&IF(RC[-18]="",,"|n"&R1C15&RC[-18])&IF(RC[-17]="",,"|n"&R1C16&RC[-17])&IF(RC[-16]="",,"|n"&R1C17&RC[-16])&IF(RC[-15]="",,"|n"&R1C18&RC[-15])&IF(RC[-14]="",,"|n"&R1C19&RC[-14])&IF(RC[-13]="",,"|n"&R1C20&RC[-13])&IF(RC[-12]="",,"|n"&R1C21&RC[-12])&IF(RC[-10]="",,"|n"&R1C23&RC[-10])&IF(RC[-9]="",,"|n"&R1C24&RC[-9])&IF(RC[-8]="",,"|n"&R1C25&RC[-8])&IF(RC[-7]="",,"|n"&R1C26&RC[-7])&IF(RC[-6]="",,"|n"&R1C27&RC[-6])&IF(RC[-5]="",,"|n"&R1C28&RC[-5])&IF(RC[-2]="",,"|n"&RC[-2]) -> 
AG609: =IF(RC[-26]&RC[-25]&RC[-24]&RC[-23]&RC[-22]&RC[-21]="",,R1C6)&IF(RC[-26]="",,"|n"&R1C7&RC[-26])&IF(RC[-25]="",,"|n"&R1C8&RC[-25])&IF(RC[-24]="",,"|n"&R1C9&RC[-24])&IF(RC[-23]="",,"|n"&R1C10&RC[-23])&IF(RC[-22]="",,"|n"&R1C11&RC[-22])&IF(RC[-21]="",,"|n"&R1C12&RC[-21])&IF(RC[-19]&RC[-18]&RC[-17]&RC[-16]="",,"|n"&R1C13)&IF(RC[-19]="",,"|n"&R1C14&RC[-19])&IF(RC[-18]="",,"|n"&R1C15&RC[-18])&IF(RC[-17]="",,"|n"&R1C16&RC[-17])&IF(RC[-16]="",,"|n"&R1C17&RC[-16])&IF(RC[-15]="",,"|n"&R1C18&RC[-15])&IF(RC[-14]="",,"|n"&R1C19&RC[-14])&IF(RC[-13]="",,"|n"&R1C20&RC[-13])&IF(RC[-12]="",,"|n"&R1C21&RC[-12])&IF(RC[-10]="",,"|n"&R1C23&RC[-10])&IF(RC[-9]="",,"|n"&R1C24&RC[-9])&IF(RC[-8]="",,"|n"&R1C25&RC[-8])&IF(RC[-7]="",,"|n"&R1C26&RC[-7])&IF(RC[-6]="",,"|n"&R1C27&RC[-6])&IF(RC[-5]="",,"|n"&R1C28&RC[-5])&IF(RC[-2]="",,"|n"&RC[-2]) -> 
AG610: =IF(RC[-26]&RC[-25]&RC[-24]&RC[-23]&RC[-22]&RC[-21]="",,R1C6)&IF(RC[-26]="",,"|n"&R1C7&RC[-26])&IF(RC[-25]="",,"|n"&R1C8&RC[-25])&IF(RC[-24]="",,"|n"&R1C9&RC[-24])&IF(RC[-23]="",,"|n"&R1C10&RC[-23])&IF(RC[-22]="",,"|n"&R1C11&RC[-22])&IF(RC[-21]="",,"|n"&R1C12&RC[-21])&IF(RC[-19]&RC[-18]&RC[-17]&RC[-16]="",,"|n"&R1C13)&IF(RC[-19]="",,"|n"&R1C14&RC[-19])&IF(RC[-18]="",,"|n"&R1C15&RC[-18])&IF(RC[-17]="",,"|n"&R1C16&RC[-17])&IF(RC[-16]="",,"|n"&R1C17&RC[-16])&IF(RC[-15]="",,"|n"&R1C18&RC[-15])&IF(RC[-14]="",,"|n"&R1C19&RC[-14])&IF(RC[-13]="",,"|n"&R1C20&RC[-13])&IF(RC[-12]="",,"|n"&R1C21&RC[-12])&IF(RC[-10]="",,"|n"&R1C23&RC[-10])&IF(RC[-9]="",,"|n"&R1C24&RC[-9])&IF(RC[-8]="",,"|n"&R1C25&RC[-8])&IF(RC[-7]="",,"|n"&R1C26&RC[-7])&IF(RC[-6]="",,"|n"&R1C27&RC[-6])&IF(RC[-5]="",,"|n"&R1C28&RC[-5])&IF(RC[-2]="",,"|n"&RC[-2]) -> 
AG611: =IF(RC[-26]&RC[-25]&RC[-24]&RC[-23]&RC[-22]&RC[-21]="",,R1C6)&IF(RC[-26]="",,"|n"&R1C7&RC[-26])&IF(RC[-25]="",,"|n"&R1C8&RC[-25])&IF(RC[-24]="",,"|n"&R1C9&RC[-24])&IF(RC[-23]="",,"|n"&R1C10&RC[-23])&IF(RC[-22]="",,"|n"&R1C11&RC[-22])&IF(RC[-21]="",,"|n"&R1C12&RC[-21])&IF(RC[-19]&RC[-18]&RC[-17]&RC[-16]="",,"|n"&R1C13)&IF(RC[-19]="",,"|n"&R1C14&RC[-19])&IF(RC[-18]="",,"|n"&R1C15&RC[-18])&IF(RC[-17]="",,"|n"&R1C16&RC[-17])&IF(RC[-16]="",,"|n"&R1C17&RC[-16])&IF(RC[-15]="",,"|n"&R1C18&RC[-15])&IF(RC[-14]="",,"|n"&R1C19&RC[-14])&IF(RC[-13]="",,"|n"&R1C20&RC[-13])&IF(RC[-12]="",,"|n"&R1C21&RC[-12])&IF(RC[-10]="",,"|n"&R1C23&RC[-10])&IF(RC[-9]="",,"|n"&R1C24&RC[-9])&IF(RC[-8]="",,"|n"&R1C25&RC[-8])&IF(RC[-7]="",,"|n"&R1C26&RC[-7])&IF(RC[-6]="",,"|n"&R1C27&RC[-6])&IF(RC[-5]="",,"|n"&R1C28&RC[-5])&IF(RC[-2]="",,"|n"&RC[-2]) -> 
AG612: =IF(RC[-26]&RC[-25]&RC[-24]&RC[-23]&RC[-22]&RC[-21]="",,R1C6)&IF(RC[-26]="",,"|n"&R1C7&RC[-26])&IF(RC[-25]="",,"|n"&R1C8&RC[-25])&IF(RC[-24]="",,"|n"&R1C9&RC[-24])&IF(RC[-23]="",,"|n"&R1C10&RC[-23])&IF(RC[-22]="",,"|n"&R1C11&RC[-22])&IF(RC[-21]="",,"|n"&R1C12&RC[-21])&IF(RC[-19]&RC[-18]&RC[-17]&RC[-16]="",,"|n"&R1C13)&IF(RC[-19]="",,"|n"&R1C14&RC[-19])&IF(RC[-18]="",,"|n"&R1C15&RC[-18])&IF(RC[-17]="",,"|n"&R1C16&RC[-17])&IF(RC[-16]="",,"|n"&R1C17&RC[-16])&IF(RC[-15]="",,"|n"&R1C18&RC[-15])&IF(RC[-14]="",,"|n"&R1C19&RC[-14])&IF(RC[-13]="",,"|n"&R1C20&RC[-13])&IF(RC[-12]="",,"|n"&R1C21&RC[-12])&IF(RC[-10]="",,"|n"&R1C23&RC[-10])&IF(RC[-9]="",,"|n"&R1C24&RC[-9])&IF(RC[-8]="",,"|n"&R1C25&RC[-8])&IF(RC[-7]="",,"|n"&R1C26&RC[-7])&IF(RC[-6]="",,"|n"&R1C27&RC[-6])&IF(RC[-5]="",,"|n"&R1C28&RC[-5])&IF(RC[-2]="",,"|n"&RC[-2]) -> 
AG613: =IF(RC[-26]&RC[-25]&RC[-24]&RC[-23]&RC[-22]&RC[-21]="",,R1C6)&IF(RC[-26]="",,"|n"&R1C7&RC[-26])&IF(RC[-25]="",,"|n"&R1C8&RC[-25])&IF(RC[-24]="",,"|n"&R1C9&RC[-24])&IF(RC[-23]="",,"|n"&R1C10&RC[-23])&IF(RC[-22]="",,"|n"&R1C11&RC[-22])&IF(RC[-21]="",,"|n"&R1C12&RC[-21])&IF(RC[-19]&RC[-18]&RC[-17]&RC[-16]="",,"|n"&R1C13)&IF(RC[-19]="",,"|n"&R1C14&RC[-19])&IF(RC[-18]="",,"|n"&R1C15&RC[-18])&IF(RC[-17]="",,"|n"&R1C16&RC[-17])&IF(RC[-16]="",,"|n"&R1C17&RC[-16])&IF(RC[-15]="",,"|n"&R1C18&RC[-15])&IF(RC[-14]="",,"|n"&R1C19&RC[-14])&IF(RC[-13]="",,"|n"&R1C20&RC[-13])&IF(RC[-12]="",,"|n"&R1C21&RC[-12])&IF(RC[-10]="",,"|n"&R1C23&RC[-10])&IF(RC[-9]="",,"|n"&R1C24&RC[-9])&IF(RC[-8]="",,"|n"&R1C25&RC[-8])&IF(RC[-7]="",,"|n"&R1C26&RC[-7])&IF(RC[-6]="",,"|n"&R1C27&RC[-6])&IF(RC[-5]="",,"|n"&R1C28&RC[-5])&IF(RC[-2]="",,"|n"&RC[-2]) -> 
AG614: =IF(RC[-26]&RC[-25]&RC[-24]&RC[-23]&RC[-22]&RC[-21]="",,R1C6)&IF(RC[-26]="",,"|n"&R1C7&RC[-26])&IF(RC[-25]="",,"|n"&R1C8&RC[-25])&IF(RC[-24]="",,"|n"&R1C9&RC[-24])&IF(RC[-23]="",,"|n"&R1C10&RC[-23])&IF(RC[-22]="",,"|n"&R1C11&RC[-22])&IF(RC[-21]="",,"|n"&R1C12&RC[-21])&IF(RC[-19]&RC[-18]&RC[-17]&RC[-16]="",,"|n"&R1C13)&IF(RC[-19]="",,"|n"&R1C14&RC[-19])&IF(RC[-18]="",,"|n"&R1C15&RC[-18])&IF(RC[-17]="",,"|n"&R1C16&RC[-17])&IF(RC[-16]="",,"|n"&R1C17&RC[-16])&IF(RC[-15]="",,"|n"&R1C18&RC[-15])&IF(RC[-14]="",,"|n"&R1C19&RC[-14])&IF(RC[-13]="",,"|n"&R1C20&RC[-13])&IF(RC[-12]="",,"|n"&R1C21&RC[-12])&IF(RC[-10]="",,"|n"&R1C23&RC[-10])&IF(RC[-9]="",,"|n"&R1C24&RC[-9])&IF(RC[-8]="",,"|n"&R1C25&RC[-8])&IF(RC[-7]="",,"|n"&R1C26&RC[-7])&IF(RC[-6]="",,"|n"&R1C27&RC[-6])&IF(RC[-5]="",,"|n"&R1C28&RC[-5])&IF(RC[-2]="",,"|n"&RC[-2]) -> 
AG615: =IF(RC[-26]&RC[-25]&RC[-24]&RC[-23]&RC[-22]&RC[-21]="",,R1C6)&IF(RC[-26]="",,"|n"&R1C7&RC[-26])&IF(RC[-25]="",,"|n"&R1C8&RC[-25])&IF(RC[-24]="",,"|n"&R1C9&RC[-24])&IF(RC[-23]="",,"|n"&R1C10&RC[-23])&IF(RC[-22]="",,"|n"&R1C11&RC[-22])&IF(RC[-21]="",,"|n"&R1C12&RC[-21])&IF(RC[-19]&RC[-18]&RC[-17]&RC[-16]="",,"|n"&R1C13)&IF(RC[-19]="",,"|n"&R1C14&RC[-19])&IF(RC[-18]="",,"|n"&R1C15&RC[-18])&IF(RC[-17]="",,"|n"&R1C16&RC[-17])&IF(RC[-16]="",,"|n"&R1C17&RC[-16])&IF(RC[-15]="",,"|n"&R1C18&RC[-15])&IF(RC[-14]="",,"|n"&R1C19&RC[-14])&IF(RC[-13]="",,"|n"&R1C20&RC[-13])&IF(RC[-12]="",,"|n"&R1C21&RC[-12])&IF(RC[-10]="",,"|n"&R1C23&RC[-10])&IF(RC[-9]="",,"|n"&R1C24&RC[-9])&IF(RC[-8]="",,"|n"&R1C25&RC[-8])&IF(RC[-7]="",,"|n"&R1C26&RC[-7])&IF(RC[-6]="",,"|n"&R1C27&RC[-6])&IF(RC[-5]="",,"|n"&R1C28&RC[-5])&IF(RC[-2]="",,"|n"&RC[-2]) -> 
AG616: =IF(RC[-26]&RC[-25]&RC[-24]&RC[-23]&RC[-22]&RC[-21]="",,R1C6)&IF(RC[-26]="",,"|n"&R1C7&RC[-26])&IF(RC[-25]="",,"|n"&R1C8&RC[-25])&IF(RC[-24]="",,"|n"&R1C9&RC[-24])&IF(RC[-23]="",,"|n"&R1C10&RC[-23])&IF(RC[-22]="",,"|n"&R1C11&RC[-22])&IF(RC[-21]="",,"|n"&R1C12&RC[-21])&IF(RC[-19]&RC[-18]&RC[-17]&RC[-16]="",,"|n"&R1C13)&IF(RC[-19]="",,"|n"&R1C14&RC[-19])&IF(RC[-18]="",,"|n"&R1C15&RC[-18])&IF(RC[-17]="",,"|n"&R1C16&RC[-17])&IF(RC[-16]="",,"|n"&R1C17&RC[-16])&IF(RC[-15]="",,"|n"&R1C18&RC[-15])&IF(RC[-14]="",,"|n"&R1C19&RC[-14])&IF(RC[-13]="",,"|n"&R1C20&RC[-13])&IF(RC[-12]="",,"|n"&R1C21&RC[-12])&IF(RC[-10]="",,"|n"&R1C23&RC[-10])&IF(RC[-9]="",,"|n"&R1C24&RC[-9])&IF(RC[-8]="",,"|n"&R1C25&RC[-8])&IF(RC[-7]="",,"|n"&R1C26&RC[-7])&IF(RC[-6]="",,"|n"&R1C27&RC[-6])&IF(RC[-5]="",,"|n"&R1C28&RC[-5])&IF(RC[-2]="",,"|n"&RC[-2]) -> 
AG617: =IF(RC[-26]&RC[-25]&RC[-24]&RC[-23]&RC[-22]&RC[-21]="",,R1C6)&IF(RC[-26]="",,"|n"&R1C7&RC[-26])&IF(RC[-25]="",,"|n"&R1C8&RC[-25])&IF(RC[-24]="",,"|n"&R1C9&RC[-24])&IF(RC[-23]="",,"|n"&R1C10&RC[-23])&IF(RC[-22]="",,"|n"&R1C11&RC[-22])&IF(RC[-21]="",,"|n"&R1C12&RC[-21])&IF(RC[-19]&RC[-18]&RC[-17]&RC[-16]="",,"|n"&R1C13)&IF(RC[-19]="",,"|n"&R1C14&RC[-19])&IF(RC[-18]="",,"|n"&R1C15&RC[-18])&IF(RC[-17]="",,"|n"&R1C16&RC[-17])&IF(RC[-16]="",,"|n"&R1C17&RC[-16])&IF(RC[-15]="",,"|n"&R1C18&RC[-15])&IF(RC[-14]="",,"|n"&R1C19&RC[-14])&IF(RC[-13]="",,"|n"&R1C20&RC[-13])&IF(RC[-12]="",,"|n"&R1C21&RC[-12])&IF(RC[-10]="",,"|n"&R1C23&RC[-10])&IF(RC[-9]="",,"|n"&R1C24&RC[-9])&IF(RC[-8]="",,"|n"&R1C25&RC[-8])&IF(RC[-7]="",,"|n"&R1C26&RC[-7])&IF(RC[-6]="",,"|n"&R1C27&RC[-6])&IF(RC[-5]="",,"|n"&R1C28&RC[-5])&IF(RC[-2]="",,"|n"&RC[-2]) -> 
AG618: =IF(RC[-26]&RC[-25]&RC[-24]&RC[-23]&RC[-22]&RC[-21]="",,R1C6)&IF(RC[-26]="",,"|n"&R1C7&RC[-26])&IF(RC[-25]="",,"|n"&R1C8&RC[-25])&IF(RC[-24]="",,"|n"&R1C9&RC[-24])&IF(RC[-23]="",,"|n"&R1C10&RC[-23])&IF(RC[-22]="",,"|n"&R1C11&RC[-22])&IF(RC[-21]="",,"|n"&R1C12&RC[-21])&IF(RC[-19]&RC[-18]&RC[-17]&RC[-16]="",,"|n"&R1C13)&IF(RC[-19]="",,"|n"&R1C14&RC[-19])&IF(RC[-18]="",,"|n"&R1C15&RC[-18])&IF(RC[-17]="",,"|n"&R1C16&RC[-17])&IF(RC[-16]="",,"|n"&R1C17&RC[-16])&IF(RC[-15]="",,"|n"&R1C18&RC[-15])&IF(RC[-14]="",,"|n"&R1C19&RC[-14])&IF(RC[-13]="",,"|n"&R1C20&RC[-13])&IF(RC[-12]="",,"|n"&R1C21&RC[-12])&IF(RC[-10]="",,"|n"&R1C23&RC[-10])&IF(RC[-9]="",,"|n"&R1C24&RC[-9])&IF(RC[-8]="",,"|n"&R1C25&RC[-8])&IF(RC[-7]="",,"|n"&R1C26&RC[-7])&IF(RC[-6]="",,"|n"&R1C27&RC[-6])&IF(RC[-5]="",,"|n"&R1C28&RC[-5])&IF(RC[-2]="",,"|n"&RC[-2]) -> 
AG619: =IF(RC[-26]&RC[-25]&RC[-24]&RC[-23]&RC[-22]&RC[-21]="",,R1C6)&IF(RC[-26]="",,"|n"&R1C7&RC[-26])&IF(RC[-25]="",,"|n"&R1C8&RC[-25])&IF(RC[-24]="",,"|n"&R1C9&RC[-24])&IF(RC[-23]="",,"|n"&R1C10&RC[-23])&IF(RC[-22]="",,"|n"&R1C11&RC[-22])&IF(RC[-21]="",,"|n"&R1C12&RC[-21])&IF(RC[-19]&RC[-18]&RC[-17]&RC[-16]="",,"|n"&R1C13)&IF(RC[-19]="",,"|n"&R1C14&RC[-19])&IF(RC[-18]="",,"|n"&R1C15&RC[-18])&IF(RC[-17]="",,"|n"&R1C16&RC[-17])&IF(RC[-16]="",,"|n"&R1C17&RC[-16])&IF(RC[-15]="",,"|n"&R1C18&RC[-15])&IF(RC[-14]="",,"|n"&R1C19&RC[-14])&IF(RC[-13]="",,"|n"&R1C20&RC[-13])&IF(RC[-12]="",,"|n"&R1C21&RC[-12])&IF(RC[-10]="",,"|n"&R1C23&RC[-10])&IF(RC[-9]="",,"|n"&R1C24&RC[-9])&IF(RC[-8]="",,"|n"&R1C25&RC[-8])&IF(RC[-7]="",,"|n"&R1C26&RC[-7])&IF(RC[-6]="",,"|n"&R1C27&RC[-6])&IF(RC[-5]="",,"|n"&R1C28&RC[-5])&IF(RC[-2]="",,"|n"&RC[-2]) -> 
AG620: =IF(RC[-26]&RC[-25]&RC[-24]&RC[-23]&RC[-22]&RC[-21]="",,R1C6)&IF(RC[-26]="",,"|n"&R1C7&RC[-26])&IF(RC[-25]="",,"|n"&R1C8&RC[-25])&IF(RC[-24]="",,"|n"&R1C9&RC[-24])&IF(RC[-23]="",,"|n"&R1C10&RC[-23])&IF(RC[-22]="",,"|n"&R1C11&RC[-22])&IF(RC[-21]="",,"|n"&R1C12&RC[-21])&IF(RC[-19]&RC[-18]&RC[-17]&RC[-16]="",,"|n"&R1C13)&IF(RC[-19]="",,"|n"&R1C14&RC[-19])&IF(RC[-18]="",,"|n"&R1C15&RC[-18])&IF(RC[-17]="",,"|n"&R1C16&RC[-17])&IF(RC[-16]="",,"|n"&R1C17&RC[-16])&IF(RC[-15]="",,"|n"&R1C18&RC[-15])&IF(RC[-14]="",,"|n"&R1C19&RC[-14])&IF(RC[-13]="",,"|n"&R1C20&RC[-13])&IF(RC[-12]="",,"|n"&R1C21&RC[-12])&IF(RC[-10]="",,"|n"&R1C23&RC[-10])&IF(RC[-9]="",,"|n"&R1C24&RC[-9])&IF(RC[-8]="",,"|n"&R1C25&RC[-8])&IF(RC[-7]="",,"|n"&R1C26&RC[-7])&IF(RC[-6]="",,"|n"&R1C27&RC[-6])&IF(RC[-5]="",,"|n"&R1C28&RC[-5])&IF(RC[-2]="",,"|n"&RC[-2]) -> 
AG621: =IF(RC[-26]&RC[-25]&RC[-24]&RC[-23]&RC[-22]&RC[-21]="",,R1C6)&IF(RC[-26]="",,"|n"&R1C7&RC[-26])&IF(RC[-25]="",,"|n"&R1C8&RC[-25])&IF(RC[-24]="",,"|n"&R1C9&RC[-24])&IF(RC[-23]="",,"|n"&R1C10&RC[-23])&IF(RC[-22]="",,"|n"&R1C11&RC[-22])&IF(RC[-21]="",,"|n"&R1C12&RC[-21])&IF(RC[-19]&RC[-18]&RC[-17]&RC[-16]="",,"|n"&R1C13)&IF(RC[-19]="",,"|n"&R1C14&RC[-19])&IF(RC[-18]="",,"|n"&R1C15&RC[-18])&IF(RC[-17]="",,"|n"&R1C16&RC[-17])&IF(RC[-16]="",,"|n"&R1C17&RC[-16])&IF(RC[-15]="",,"|n"&R1C18&RC[-15])&IF(RC[-14]="",,"|n"&R1C19&RC[-14])&IF(RC[-13]="",,"|n"&R1C20&RC[-13])&IF(RC[-12]="",,"|n"&R1C21&RC[-12])&IF(RC[-10]="",,"|n"&R1C23&RC[-10])&IF(RC[-9]="",,"|n"&R1C24&RC[-9])&IF(RC[-8]="",,"|n"&R1C25&RC[-8])&IF(RC[-7]="",,"|n"&R1C26&RC[-7])&IF(RC[-6]="",,"|n"&R1C27&RC[-6])&IF(RC[-5]="",,"|n"&R1C28&RC[-5])&IF(RC[-2]="",,"|n"&RC[-2]) -> 
AG622: =IF(RC[-26]&RC[-25]&RC[-24]&RC[-23]&RC[-22]&RC[-21]="",,R1C6)&IF(RC[-26]="",,"|n"&R1C7&RC[-26])&IF(RC[-25]="",,"|n"&R1C8&RC[-25])&IF(RC[-24]="",,"|n"&R1C9&RC[-24])&IF(RC[-23]="",,"|n"&R1C10&RC[-23])&IF(RC[-22]="",,"|n"&R1C11&RC[-22])&IF(RC[-21]="",,"|n"&R1C12&RC[-21])&IF(RC[-19]&RC[-18]&RC[-17]&RC[-16]="",,"|n"&R1C13)&IF(RC[-19]="",,"|n"&R1C14&RC[-19])&IF(RC[-18]="",,"|n"&R1C15&RC[-18])&IF(RC[-17]="",,"|n"&R1C16&RC[-17])&IF(RC[-16]="",,"|n"&R1C17&RC[-16])&IF(RC[-15]="",,"|n"&R1C18&RC[-15])&IF(RC[-14]="",,"|n"&R1C19&RC[-14])&IF(RC[-13]="",,"|n"&R1C20&RC[-13])&IF(RC[-12]="",,"|n"&R1C21&RC[-12])&IF(RC[-10]="",,"|n"&R1C23&RC[-10])&IF(RC[-9]="",,"|n"&R1C24&RC[-9])&IF(RC[-8]="",,"|n"&R1C25&RC[-8])&IF(RC[-7]="",,"|n"&R1C26&RC[-7])&IF(RC[-6]="",,"|n"&R1C27&RC[-6])&IF(RC[-5]="",,"|n"&R1C28&RC[-5])&IF(RC[-2]="",,"|n"&RC[-2]) -> 
AG623: =IF(RC[-26]&RC[-25]&RC[-24]&RC[-23]&RC[-22]&RC[-21]="",,R1C6)&IF(RC[-26]="",,"|n"&R1C7&RC[-26])&IF(RC[-25]="",,"|n"&R1C8&RC[-25])&IF(RC[-24]="",,"|n"&R1C9&RC[-24])&IF(RC[-23]="",,"|n"&R1C10&RC[-23])&IF(RC[-22]="",,"|n"&R1C11&RC[-22])&IF(RC[-21]="",,"|n"&R1C12&RC[-21])&IF(RC[-19]&RC[-18]&RC[-17]&RC[-16]="",,"|n"&R1C13)&IF(RC[-19]="",,"|n"&R1C14&RC[-19])&IF(RC[-18]="",,"|n"&R1C15&RC[-18])&IF(RC[-17]="",,"|n"&R1C16&RC[-17])&IF(RC[-16]="",,"|n"&R1C17&RC[-16])&IF(RC[-15]="",,"|n"&R1C18&RC[-15])&IF(RC[-14]="",,"|n"&R1C19&RC[-14])&IF(RC[-13]="",,"|n"&R1C20&RC[-13])&IF(RC[-12]="",,"|n"&R1C21&RC[-12])&IF(RC[-10]="",,"|n"&R1C23&RC[-10])&IF(RC[-9]="",,"|n"&R1C24&RC[-9])&IF(RC[-8]="",,"|n"&R1C25&RC[-8])&IF(RC[-7]="",,"|n"&R1C26&RC[-7])&IF(RC[-6]="",,"|n"&R1C27&RC[-6])&IF(RC[-5]="",,"|n"&R1C28&RC[-5])&IF(RC[-2]="",,"|n"&RC[-2]) -> 
AG624: =IF(RC[-26]&RC[-25]&RC[-24]&RC[-23]&RC[-22]&RC[-21]="",,R1C6)&IF(RC[-26]="",,"|n"&R1C7&RC[-26])&IF(RC[-25]="",,"|n"&R1C8&RC[-25])&IF(RC[-24]="",,"|n"&R1C9&RC[-24])&IF(RC[-23]="",,"|n"&R1C10&RC[-23])&IF(RC[-22]="",,"|n"&R1C11&RC[-22])&IF(RC[-21]="",,"|n"&R1C12&RC[-21])&IF(RC[-19]&RC[-18]&RC[-17]&RC[-16]="",,"|n"&R1C13)&IF(RC[-19]="",,"|n"&R1C14&RC[-19])&IF(RC[-18]="",,"|n"&R1C15&RC[-18])&IF(RC[-17]="",,"|n"&R1C16&RC[-17])&IF(RC[-16]="",,"|n"&R1C17&RC[-16])&IF(RC[-15]="",,"|n"&R1C18&RC[-15])&IF(RC[-14]="",,"|n"&R1C19&RC[-14])&IF(RC[-13]="",,"|n"&R1C20&RC[-13])&IF(RC[-12]="",,"|n"&R1C21&RC[-12])&IF(RC[-10]="",,"|n"&R1C23&RC[-10])&IF(RC[-9]="",,"|n"&R1C24&RC[-9])&IF(RC[-8]="",,"|n"&R1C25&RC[-8])&IF(RC[-7]="",,"|n"&R1C26&RC[-7])&IF(RC[-6]="",,"|n"&R1C27&RC[-6])&IF(RC[-5]="",,"|n"&R1C28&RC[-5])&IF(RC[-2]="",,"|n"&RC[-2]) -> 
AG625: =IF(RC[-26]&RC[-25]&RC[-24]&RC[-23]&RC[-22]&RC[-21]="",,R1C6)&IF(RC[-26]="",,"|n"&R1C7&RC[-26])&IF(RC[-25]="",,"|n"&R1C8&RC[-25])&IF(RC[-24]="",,"|n"&R1C9&RC[-24])&IF(RC[-23]="",,"|n"&R1C10&RC[-23])&IF(RC[-22]="",,"|n"&R1C11&RC[-22])&IF(RC[-21]="",,"|n"&R1C12&RC[-21])&IF(RC[-19]&RC[-18]&RC[-17]&RC[-16]="",,"|n"&R1C13)&IF(RC[-19]="",,"|n"&R1C14&RC[-19])&IF(RC[-18]="",,"|n"&R1C15&RC[-18])&IF(RC[-17]="",,"|n"&R1C16&RC[-17])&IF(RC[-16]="",,"|n"&R1C17&RC[-16])&IF(RC[-15]="",,"|n"&R1C18&RC[-15])&IF(RC[-14]="",,"|n"&R1C19&RC[-14])&IF(RC[-13]="",,"|n"&R1C20&RC[-13])&IF(RC[-12]="",,"|n"&R1C21&RC[-12])&IF(RC[-10]="",,"|n"&R1C23&RC[-10])&IF(RC[-9]="",,"|n"&R1C24&RC[-9])&IF(RC[-8]="",,"|n"&R1C25&RC[-8])&IF(RC[-7]="",,"|n"&R1C26&RC[-7])&IF(RC[-6]="",,"|n"&R1C27&RC[-6])&IF(RC[-5]="",,"|n"&R1C28&RC[-5])&IF(RC[-2]="",,"|n"&RC[-2]) -> 
AG626: =IF(RC[-26]&RC[-25]&RC[-24]&RC[-23]&RC[-22]&RC[-21]="",,R1C6)&IF(RC[-26]="",,"|n"&R1C7&RC[-26])&IF(RC[-25]="",,"|n"&R1C8&RC[-25])&IF(RC[-24]="",,"|n"&R1C9&RC[-24])&IF(RC[-23]="",,"|n"&R1C10&RC[-23])&IF(RC[-22]="",,"|n"&R1C11&RC[-22])&IF(RC[-21]="",,"|n"&R1C12&RC[-21])&IF(RC[-19]&RC[-18]&RC[-17]&RC[-16]="",,"|n"&R1C13)&IF(RC[-19]="",,"|n"&R1C14&RC[-19])&IF(RC[-18]="",,"|n"&R1C15&RC[-18])&IF(RC[-17]="",,"|n"&R1C16&RC[-17])&IF(RC[-16]="",,"|n"&R1C17&RC[-16])&IF(RC[-15]="",,"|n"&R1C18&RC[-15])&IF(RC[-14]="",,"|n"&R1C19&RC[-14])&IF(RC[-13]="",,"|n"&R1C20&RC[-13])&IF(RC[-12]="",,"|n"&R1C21&RC[-12])&IF(RC[-10]="",,"|n"&R1C23&RC[-10])&IF(RC[-9]="",,"|n"&R1C24&RC[-9])&IF(RC[-8]="",,"|n"&R1C25&RC[-8])&IF(RC[-7]="",,"|n"&R1C26&RC[-7])&IF(RC[-6]="",,"|n"&R1C27&RC[-6])&IF(RC[-5]="",,"|n"&R1C28&RC[-5])&IF(RC[-2]="",,"|n"&RC[-2]) -> 
AG627: =IF(RC[-26]&RC[-25]&RC[-24]&RC[-23]&RC[-22]&RC[-21]="",,R1C6)&IF(RC[-26]="",,"|n"&R1C7&RC[-26])&IF(RC[-25]="",,"|n"&R1C8&RC[-25])&IF(RC[-24]="",,"|n"&R1C9&RC[-24])&IF(RC[-23]="",,"|n"&R1C10&RC[-23])&IF(RC[-22]="",,"|n"&R1C11&RC[-22])&IF(RC[-21]="",,"|n"&R1C12&RC[-21])&IF(RC[-19]&RC[-18]&RC[-17]&RC[-16]="",,"|n"&R1C13)&IF(RC[-19]="",,"|n"&R1C14&RC[-19])&IF(RC[-18]="",,"|n"&R1C15&RC[-18])&IF(RC[-17]="",,"|n"&R1C16&RC[-17])&IF(RC[-16]="",,"|n"&R1C17&RC[-16])&IF(RC[-15]="",,"|n"&R1C18&RC[-15])&IF(RC[-14]="",,"|n"&R1C19&RC[-14])&IF(RC[-13]="",,"|n"&R1C20&RC[-13])&IF(RC[-12]="",,"|n"&R1C21&RC[-12])&IF(RC[-10]="",,"|n"&R1C23&RC[-10])&IF(RC[-9]="",,"|n"&R1C24&RC[-9])&IF(RC[-8]="",,"|n"&R1C25&RC[-8])&IF(RC[-7]="",,"|n"&R1C26&RC[-7])&IF(RC[-6]="",,"|n"&R1C27&RC[-6])&IF(RC[-5]="",,"|n"&R1C28&RC[-5])&IF(RC[-2]="",,"|n"&RC[-2]) -> 
AG628: =IF(RC[-26]&RC[-25]&RC[-24]&RC[-23]&RC[-22]&RC[-21]="",,R1C6)&IF(RC[-26]="",,"|n"&R1C7&RC[-26])&IF(RC[-25]="",,"|n"&R1C8&RC[-25])&IF(RC[-24]="",,"|n"&R1C9&RC[-24])&IF(RC[-23]="",,"|n"&R1C10&RC[-23])&IF(RC[-22]="",,"|n"&R1C11&RC[-22])&IF(RC[-21]="",,"|n"&R1C12&RC[-21])&IF(RC[-19]&RC[-18]&RC[-17]&RC[-16]="",,"|n"&R1C13)&IF(RC[-19]="",,"|n"&R1C14&RC[-19])&IF(RC[-18]="",,"|n"&R1C15&RC[-18])&IF(RC[-17]="",,"|n"&R1C16&RC[-17])&IF(RC[-16]="",,"|n"&R1C17&RC[-16])&IF(RC[-15]="",,"|n"&R1C18&RC[-15])&IF(RC[-14]="",,"|n"&R1C19&RC[-14])&IF(RC[-13]="",,"|n"&R1C20&RC[-13])&IF(RC[-12]="",,"|n"&R1C21&RC[-12])&IF(RC[-10]="",,"|n"&R1C23&RC[-10])&IF(RC[-9]="",,"|n"&R1C24&RC[-9])&IF(RC[-8]="",,"|n"&R1C25&RC[-8])&IF(RC[-7]="",,"|n"&R1C26&RC[-7])&IF(RC[-6]="",,"|n"&R1C27&RC[-6])&IF(RC[-5]="",,"|n"&R1C28&RC[-5])&IF(RC[-2]="",,"|n"&RC[-2]) -> 
AG629: =IF(RC[-26]&RC[-25]&RC[-24]&RC[-23]&RC[-22]&RC[-21]="",,R1C6)&IF(RC[-26]="",,"|n"&R1C7&RC[-26])&IF(RC[-25]="",,"|n"&R1C8&RC[-25])&IF(RC[-24]="",,"|n"&R1C9&RC[-24])&IF(RC[-23]="",,"|n"&R1C10&RC[-23])&IF(RC[-22]="",,"|n"&R1C11&RC[-22])&IF(RC[-21]="",,"|n"&R1C12&RC[-21])&IF(RC[-19]&RC[-18]&RC[-17]&RC[-16]="",,"|n"&R1C13)&IF(RC[-19]="",,"|n"&R1C14&RC[-19])&IF(RC[-18]="",,"|n"&R1C15&RC[-18])&IF(RC[-17]="",,"|n"&R1C16&RC[-17])&IF(RC[-16]="",,"|n"&R1C17&RC[-16])&IF(RC[-15]="",,"|n"&R1C18&RC[-15])&IF(RC[-14]="",,"|n"&R1C19&RC[-14])&IF(RC[-13]="",,"|n"&R1C20&RC[-13])&IF(RC[-12]="",,"|n"&R1C21&RC[-12])&IF(RC[-10]="",,"|n"&R1C23&RC[-10])&IF(RC[-9]="",,"|n"&R1C24&RC[-9])&IF(RC[-8]="",,"|n"&R1C25&RC[-8])&IF(RC[-7]="",,"|n"&R1C26&RC[-7])&IF(RC[-6]="",,"|n"&R1C27&RC[-6])&IF(RC[-5]="",,"|n"&R1C28&RC[-5])&IF(RC[-2]="",,"|n"&RC[-2]) -> 
AG630: =IF(RC[-26]&RC[-25]&RC[-24]&RC[-23]&RC[-22]&RC[-21]="",,R1C6)&IF(RC[-26]="",,"|n"&R1C7&RC[-26])&IF(RC[-25]="",,"|n"&R1C8&RC[-25])&IF(RC[-24]="",,"|n"&R1C9&RC[-24])&IF(RC[-23]="",,"|n"&R1C10&RC[-23])&IF(RC[-22]="",,"|n"&R1C11&RC[-22])&IF(RC[-21]="",,"|n"&R1C12&RC[-21])&IF(RC[-19]&RC[-18]&RC[-17]&RC[-16]="",,"|n"&R1C13)&IF(RC[-19]="",,"|n"&R1C14&RC[-19])&IF(RC[-18]="",,"|n"&R1C15&RC[-18])&IF(RC[-17]="",,"|n"&R1C16&RC[-17])&IF(RC[-16]="",,"|n"&R1C17&RC[-16])&IF(RC[-15]="",,"|n"&R1C18&RC[-15])&IF(RC[-14]="",,"|n"&R1C19&RC[-14])&IF(RC[-13]="",,"|n"&R1C20&RC[-13])&IF(RC[-12]="",,"|n"&R1C21&RC[-12])&IF(RC[-10]="",,"|n"&R1C23&RC[-10])&IF(RC[-9]="",,"|n"&R1C24&RC[-9])&IF(RC[-8]="",,"|n"&R1C25&RC[-8])&IF(RC[-7]="",,"|n"&R1C26&RC[-7])&IF(RC[-6]="",,"|n"&R1C27&RC[-6])&IF(RC[-5]="",,"|n"&R1C28&RC[-5])&IF(RC[-2]="",,"|n"&RC[-2]) -> 
AG631: =IF(RC[-26]&RC[-25]&RC[-24]&RC[-23]&RC[-22]&RC[-21]="",,R1C6)&IF(RC[-26]="",,"|n"&R1C7&RC[-26])&IF(RC[-25]="",,"|n"&R1C8&RC[-25])&IF(RC[-24]="",,"|n"&R1C9&RC[-24])&IF(RC[-23]="",,"|n"&R1C10&RC[-23])&IF(RC[-22]="",,"|n"&R1C11&RC[-22])&IF(RC[-21]="",,"|n"&R1C12&RC[-21])&IF(RC[-19]&RC[-18]&RC[-17]&RC[-16]="",,"|n"&R1C13)&IF(RC[-19]="",,"|n"&R1C14&RC[-19])&IF(RC[-18]="",,"|n"&R1C15&RC[-18])&IF(RC[-17]="",,"|n"&R1C16&RC[-17])&IF(RC[-16]="",,"|n"&R1C17&RC[-16])&IF(RC[-15]="",,"|n"&R1C18&RC[-15])&IF(RC[-14]="",,"|n"&R1C19&RC[-14])&IF(RC[-13]="",,"|n"&R1C20&RC[-13])&IF(RC[-12]="",,"|n"&R1C21&RC[-12])&IF(RC[-10]="",,"|n"&R1C23&RC[-10])&IF(RC[-9]="",,"|n"&R1C24&RC[-9])&IF(RC[-8]="",,"|n"&R1C25&RC[-8])&IF(RC[-7]="",,"|n"&R1C26&RC[-7])&IF(RC[-6]="",,"|n"&R1C27&RC[-6])&IF(RC[-5]="",,"|n"&R1C28&RC[-5])&IF(RC[-2]="",,"|n"&RC[-2]) -> 
AG632: =IF(RC[-26]&RC[-25]&RC[-24]&RC[-23]&RC[-22]&RC[-21]="",,R1C6)&IF(RC[-26]="",,"|n"&R1C7&RC[-26])&IF(RC[-25]="",,"|n"&R1C8&RC[-25])&IF(RC[-24]="",,"|n"&R1C9&RC[-24])&IF(RC[-23]="",,"|n"&R1C10&RC[-23])&IF(RC[-22]="",,"|n"&R1C11&RC[-22])&IF(RC[-21]="",,"|n"&R1C12&RC[-21])&IF(RC[-19]&RC[-18]&RC[-17]&RC[-16]="",,"|n"&R1C13)&IF(RC[-19]="",,"|n"&R1C14&RC[-19])&IF(RC[-18]="",,"|n"&R1C15&RC[-18])&IF(RC[-17]="",,"|n"&R1C16&RC[-17])&IF(RC[-16]="",,"|n"&R1C17&RC[-16])&IF(RC[-15]="",,"|n"&R1C18&RC[-15])&IF(RC[-14]="",,"|n"&R1C19&RC[-14])&IF(RC[-13]="",,"|n"&R1C20&RC[-13])&IF(RC[-12]="",,"|n"&R1C21&RC[-12])&IF(RC[-10]="",,"|n"&R1C23&RC[-10])&IF(RC[-9]="",,"|n"&R1C24&RC[-9])&IF(RC[-8]="",,"|n"&R1C25&RC[-8])&IF(RC[-7]="",,"|n"&R1C26&RC[-7])&IF(RC[-6]="",,"|n"&R1C27&RC[-6])&IF(RC[-5]="",,"|n"&R1C28&RC[-5])&IF(RC[-2]="",,"|n"&RC[-2]) -> 
AG633: =IF(RC[-26]&RC[-25]&RC[-24]&RC[-23]&RC[-22]&RC[-21]="",,R1C6)&IF(RC[-26]="",,"|n"&R1C7&RC[-26])&IF(RC[-25]="",,"|n"&R1C8&RC[-25])&IF(RC[-24]="",,"|n"&R1C9&RC[-24])&IF(RC[-23]="",,"|n"&R1C10&RC[-23])&IF(RC[-22]="",,"|n"&R1C11&RC[-22])&IF(RC[-21]="",,"|n"&R1C12&RC[-21])&IF(RC[-19]&RC[-18]&RC[-17]&RC[-16]="",,"|n"&R1C13)&IF(RC[-19]="",,"|n"&R1C14&RC[-19])&IF(RC[-18]="",,"|n"&R1C15&RC[-18])&IF(RC[-17]="",,"|n"&R1C16&RC[-17])&IF(RC[-16]="",,"|n"&R1C17&RC[-16])&IF(RC[-15]="",,"|n"&R1C18&RC[-15])&IF(RC[-14]="",,"|n"&R1C19&RC[-14])&IF(RC[-13]="",,"|n"&R1C20&RC[-13])&IF(RC[-12]="",,"|n"&R1C21&RC[-12])&IF(RC[-10]="",,"|n"&R1C23&RC[-10])&IF(RC[-9]="",,"|n"&R1C24&RC[-9])&IF(RC[-8]="",,"|n"&R1C25&RC[-8])&IF(RC[-7]="",,"|n"&R1C26&RC[-7])&IF(RC[-6]="",,"|n"&R1C27&RC[-6])&IF(RC[-5]="",,"|n"&R1C28&RC[-5])&IF(RC[-2]="",,"|n"&RC[-2]) -> 
AG634: =IF(RC[-26]&RC[-25]&RC[-24]&RC[-23]&RC[-22]&RC[-21]="",,R1C6)&IF(RC[-26]="",,"|n"&R1C7&RC[-26])&IF(RC[-25]="",,"|n"&R1C8&RC[-25])&IF(RC[-24]="",,"|n"&R1C9&RC[-24])&IF(RC[-23]="",,"|n"&R1C10&RC[-23])&IF(RC[-22]="",,"|n"&R1C11&RC[-22])&IF(RC[-21]="",,"|n"&R1C12&RC[-21])&IF(RC[-19]&RC[-18]&RC[-17]&RC[-16]="",,"|n"&R1C13)&IF(RC[-19]="",,"|n"&R1C14&RC[-19])&IF(RC[-18]="",,"|n"&R1C15&RC[-18])&IF(RC[-17]="",,"|n"&R1C16&RC[-17])&IF(RC[-16]="",,"|n"&R1C17&RC[-16])&IF(RC[-15]="",,"|n"&R1C18&RC[-15])&IF(RC[-14]="",,"|n"&R1C19&RC[-14])&IF(RC[-13]="",,"|n"&R1C20&RC[-13])&IF(RC[-12]="",,"|n"&R1C21&RC[-12])&IF(RC[-10]="",,"|n"&R1C23&RC[-10])&IF(RC[-9]="",,"|n"&R1C24&RC[-9])&IF(RC[-8]="",,"|n"&R1C25&RC[-8])&IF(RC[-7]="",,"|n"&R1C26&RC[-7])&IF(RC[-6]="",,"|n"&R1C27&RC[-6])&IF(RC[-5]="",,"|n"&R1C28&RC[-5])&IF(RC[-2]="",,"|n"&RC[-2]) -> 
AG635: =IF(RC[-26]&RC[-25]&RC[-24]&RC[-23]&RC[-22]&RC[-21]="",,R1C6)&IF(RC[-26]="",,"|n"&R1C7&RC[-26])&IF(RC[-25]="",,"|n"&R1C8&RC[-25])&IF(RC[-24]="",,"|n"&R1C9&RC[-24])&IF(RC[-23]="",,"|n"&R1C10&RC[-23])&IF(RC[-22]="",,"|n"&R1C11&RC[-22])&IF(RC[-21]="",,"|n"&R1C12&RC[-21])&IF(RC[-19]&RC[-18]&RC[-17]&RC[-16]="",,"|n"&R1C13)&IF(RC[-19]="",,"|n"&R1C14&RC[-19])&IF(RC[-18]="",,"|n"&R1C15&RC[-18])&IF(RC[-17]="",,"|n"&R1C16&RC[-17])&IF(RC[-16]="",,"|n"&R1C17&RC[-16])&IF(RC[-15]="",,"|n"&R1C18&RC[-15])&IF(RC[-14]="",,"|n"&R1C19&RC[-14])&IF(RC[-13]="",,"|n"&R1C20&RC[-13])&IF(RC[-12]="",,"|n"&R1C21&RC[-12])&IF(RC[-10]="",,"|n"&R1C23&RC[-10])&IF(RC[-9]="",,"|n"&R1C24&RC[-9])&IF(RC[-8]="",,"|n"&R1C25&RC[-8])&IF(RC[-7]="",,"|n"&R1C26&RC[-7])&IF(RC[-6]="",,"|n"&R1C27&RC[-6])&IF(RC[-5]="",,"|n"&R1C28&RC[-5])&IF(RC[-2]="",,"|n"&RC[-2]) -> 
AG636: =IF(RC[-26]&RC[-25]&RC[-24]&RC[-23]&RC[-22]&RC[-21]="",,R1C6)&IF(RC[-26]="",,"|n"&R1C7&RC[-26])&IF(RC[-25]="",,"|n"&R1C8&RC[-25])&IF(RC[-24]="",,"|n"&R1C9&RC[-24])&IF(RC[-23]="",,"|n"&R1C10&RC[-23])&IF(RC[-22]="",,"|n"&R1C11&RC[-22])&IF(RC[-21]="",,"|n"&R1C12&RC[-21])&IF(RC[-19]&RC[-18]&RC[-17]&RC[-16]="",,"|n"&R1C13)&IF(RC[-19]="",,"|n"&R1C14&RC[-19])&IF(RC[-18]="",,"|n"&R1C15&RC[-18])&IF(RC[-17]="",,"|n"&R1C16&RC[-17])&IF(RC[-16]="",,"|n"&R1C17&RC[-16])&IF(RC[-15]="",,"|n"&R1C18&RC[-15])&IF(RC[-14]="",,"|n"&R1C19&RC[-14])&IF(RC[-13]="",,"|n"&R1C20&RC[-13])&IF(RC[-12]="",,"|n"&R1C21&RC[-12])&IF(RC[-10]="",,"|n"&R1C23&RC[-10])&IF(RC[-9]="",,"|n"&R1C24&RC[-9])&IF(RC[-8]="",,"|n"&R1C25&RC[-8])&IF(RC[-7]="",,"|n"&R1C26&RC[-7])&IF(RC[-6]="",,"|n"&R1C27&RC[-6])&IF(RC[-5]="",,"|n"&R1C28&RC[-5])&IF(RC[-2]="",,"|n"&RC[-2]) -> 
AG637: =IF(RC[-26]&RC[-25]&RC[-24]&RC[-23]&RC[-22]&RC[-21]="",,R1C6)&IF(RC[-26]="",,"|n"&R1C7&RC[-26])&IF(RC[-25]="",,"|n"&R1C8&RC[-25])&IF(RC[-24]="",,"|n"&R1C9&RC[-24])&IF(RC[-23]="",,"|n"&R1C10&RC[-23])&IF(RC[-22]="",,"|n"&R1C11&RC[-22])&IF(RC[-21]="",,"|n"&R1C12&RC[-21])&IF(RC[-19]&RC[-18]&RC[-17]&RC[-16]="",,"|n"&R1C13)&IF(RC[-19]="",,"|n"&R1C14&RC[-19])&IF(RC[-18]="",,"|n"&R1C15&RC[-18])&IF(RC[-17]="",,"|n"&R1C16&RC[-17])&IF(RC[-16]="",,"|n"&R1C17&RC[-16])&IF(RC[-15]="",,"|n"&R1C18&RC[-15])&IF(RC[-14]="",,"|n"&R1C19&RC[-14])&IF(RC[-13]="",,"|n"&R1C20&RC[-13])&IF(RC[-12]="",,"|n"&R1C21&RC[-12])&IF(RC[-10]="",,"|n"&R1C23&RC[-10])&IF(RC[-9]="",,"|n"&R1C24&RC[-9])&IF(RC[-8]="",,"|n"&R1C25&RC[-8])&IF(RC[-7]="",,"|n"&R1C26&RC[-7])&IF(RC[-6]="",,"|n"&R1C27&RC[-6])&IF(RC[-5]="",,"|n"&R1C28&RC[-5])&IF(RC[-2]="",,"|n"&RC[-2]) -> 
AG638: =IF(RC[-26]&RC[-25]&RC[-24]&RC[-23]&RC[-22]&RC[-21]="",,R1C6)&IF(RC[-26]="",,"|n"&R1C7&RC[-26])&IF(RC[-25]="",,"|n"&R1C8&RC[-25])&IF(RC[-24]="",,"|n"&R1C9&RC[-24])&IF(RC[-23]="",,"|n"&R1C10&RC[-23])&IF(RC[-22]="",,"|n"&R1C11&RC[-22])&IF(RC[-21]="",,"|n"&R1C12&RC[-21])&IF(RC[-19]&RC[-18]&RC[-17]&RC[-16]="",,"|n"&R1C13)&IF(RC[-19]="",,"|n"&R1C14&RC[-19])&IF(RC[-18]="",,"|n"&R1C15&RC[-18])&IF(RC[-17]="",,"|n"&R1C16&RC[-17])&IF(RC[-16]="",,"|n"&R1C17&RC[-16])&IF(RC[-15]="",,"|n"&R1C18&RC[-15])&IF(RC[-14]="",,"|n"&R1C19&RC[-14])&IF(RC[-13]="",,"|n"&R1C20&RC[-13])&IF(RC[-12]="",,"|n"&R1C21&RC[-12])&IF(RC[-10]="",,"|n"&R1C23&RC[-10])&IF(RC[-9]="",,"|n"&R1C24&RC[-9])&IF(RC[-8]="",,"|n"&R1C25&RC[-8])&IF(RC[-7]="",,"|n"&R1C26&RC[-7])&IF(RC[-6]="",,"|n"&R1C27&RC[-6])&IF(RC[-5]="",,"|n"&R1C28&RC[-5])&IF(RC[-2]="",,"|n"&RC[-2]) -> 
AG639: =IF(RC[-26]&RC[-25]&RC[-24]&RC[-23]&RC[-22]&RC[-21]="",,R1C6)&IF(RC[-26]="",,"|n"&R1C7&RC[-26])&IF(RC[-25]="",,"|n"&R1C8&RC[-25])&IF(RC[-24]="",,"|n"&R1C9&RC[-24])&IF(RC[-23]="",,"|n"&R1C10&RC[-23])&IF(RC[-22]="",,"|n"&R1C11&RC[-22])&IF(RC[-21]="",,"|n"&R1C12&RC[-21])&IF(RC[-19]&RC[-18]&RC[-17]&RC[-16]="",,"|n"&R1C13)&IF(RC[-19]="",,"|n"&R1C14&RC[-19])&IF(RC[-18]="",,"|n"&R1C15&RC[-18])&IF(RC[-17]="",,"|n"&R1C16&RC[-17])&IF(RC[-16]="",,"|n"&R1C17&RC[-16])&IF(RC[-15]="",,"|n"&R1C18&RC[-15])&IF(RC[-14]="",,"|n"&R1C19&RC[-14])&IF(RC[-13]="",,"|n"&R1C20&RC[-13])&IF(RC[-12]="",,"|n"&R1C21&RC[-12])&IF(RC[-10]="",,"|n"&R1C23&RC[-10])&IF(RC[-9]="",,"|n"&R1C24&RC[-9])&IF(RC[-8]="",,"|n"&R1C25&RC[-8])&IF(RC[-7]="",,"|n"&R1C26&RC[-7])&IF(RC[-6]="",,"|n"&R1C27&RC[-6])&IF(RC[-5]="",,"|n"&R1C28&RC[-5])&IF(RC[-2]="",,"|n"&RC[-2]) -> 
AG640: =IF(RC[-26]&RC[-25]&RC[-24]&RC[-23]&RC[-22]&RC[-21]="",,R1C6)&IF(RC[-26]="",,"|n"&R1C7&RC[-26])&IF(RC[-25]="",,"|n"&R1C8&RC[-25])&IF(RC[-24]="",,"|n"&R1C9&RC[-24])&IF(RC[-23]="",,"|n"&R1C10&RC[-23])&IF(RC[-22]="",,"|n"&R1C11&RC[-22])&IF(RC[-21]="",,"|n"&R1C12&RC[-21])&IF(RC[-19]&RC[-18]&RC[-17]&RC[-16]="",,"|n"&R1C13)&IF(RC[-19]="",,"|n"&R1C14&RC[-19])&IF(RC[-18]="",,"|n"&R1C15&RC[-18])&IF(RC[-17]="",,"|n"&R1C16&RC[-17])&IF(RC[-16]="",,"|n"&R1C17&RC[-16])&IF(RC[-15]="",,"|n"&R1C18&RC[-15])&IF(RC[-14]="",,"|n"&R1C19&RC[-14])&IF(RC[-13]="",,"|n"&R1C20&RC[-13])&IF(RC[-12]="",,"|n"&R1C21&RC[-12])&IF(RC[-10]="",,"|n"&R1C23&RC[-10])&IF(RC[-9]="",,"|n"&R1C24&RC[-9])&IF(RC[-8]="",,"|n"&R1C25&RC[-8])&IF(RC[-7]="",,"|n"&R1C26&RC[-7])&IF(RC[-6]="",,"|n"&R1C27&RC[-6])&IF(RC[-5]="",,"|n"&R1C28&RC[-5])&IF(RC[-2]="",,"|n"&RC[-2]) -> 
AG641: =IF(RC[-26]&RC[-25]&RC[-24]&RC[-23]&RC[-22]&RC[-21]="",,R1C6)&IF(RC[-26]="",,"|n"&R1C7&RC[-26])&IF(RC[-25]="",,"|n"&R1C8&RC[-25])&IF(RC[-24]="",,"|n"&R1C9&RC[-24])&IF(RC[-23]="",,"|n"&R1C10&RC[-23])&IF(RC[-22]="",,"|n"&R1C11&RC[-22])&IF(RC[-21]="",,"|n"&R1C12&RC[-21])&IF(RC[-19]&RC[-18]&RC[-17]&RC[-16]="",,"|n"&R1C13)&IF(RC[-19]="",,"|n"&R1C14&RC[-19])&IF(RC[-18]="",,"|n"&R1C15&RC[-18])&IF(RC[-17]="",,"|n"&R1C16&RC[-17])&IF(RC[-16]="",,"|n"&R1C17&RC[-16])&IF(RC[-15]="",,"|n"&R1C18&RC[-15])&IF(RC[-14]="",,"|n"&R1C19&RC[-14])&IF(RC[-13]="",,"|n"&R1C20&RC[-13])&IF(RC[-12]="",,"|n"&R1C21&RC[-12])&IF(RC[-10]="",,"|n"&R1C23&RC[-10])&IF(RC[-9]="",,"|n"&R1C24&RC[-9])&IF(RC[-8]="",,"|n"&R1C25&RC[-8])&IF(RC[-7]="",,"|n"&R1C26&RC[-7])&IF(RC[-6]="",,"|n"&R1C27&RC[-6])&IF(RC[-5]="",,"|n"&R1C28&RC[-5])&IF(RC[-2]="",,"|n"&RC[-2]) -> 
AG642: =IF(RC[-26]&RC[-25]&RC[-24]&RC[-23]&RC[-22]&RC[-21]="",,R1C6)&IF(RC[-26]="",,"|n"&R1C7&RC[-26])&IF(RC[-25]="",,"|n"&R1C8&RC[-25])&IF(RC[-24]="",,"|n"&R1C9&RC[-24])&IF(RC[-23]="",,"|n"&R1C10&RC[-23])&IF(RC[-22]="",,"|n"&R1C11&RC[-22])&IF(RC[-21]="",,"|n"&R1C12&RC[-21])&IF(RC[-19]&RC[-18]&RC[-17]&RC[-16]="",,"|n"&R1C13)&IF(RC[-19]="",,"|n"&R1C14&RC[-19])&IF(RC[-18]="",,"|n"&R1C15&RC[-18])&IF(RC[-17]="",,"|n"&R1C16&RC[-17])&IF(RC[-16]="",,"|n"&R1C17&RC[-16])&IF(RC[-15]="",,"|n"&R1C18&RC[-15])&IF(RC[-14]="",,"|n"&R1C19&RC[-14])&IF(RC[-13]="",,"|n"&R1C20&RC[-13])&IF(RC[-12]="",,"|n"&R1C21&RC[-12])&IF(RC[-10]="",,"|n"&R1C23&RC[-10])&IF(RC[-9]="",,"|n"&R1C24&RC[-9])&IF(RC[-8]="",,"|n"&R1C25&RC[-8])&IF(RC[-7]="",,"|n"&R1C26&RC[-7])&IF(RC[-6]="",,"|n"&R1C27&RC[-6])&IF(RC[-5]="",,"|n"&R1C28&RC[-5])&IF(RC[-2]="",,"|n"&RC[-2]) -> 
AG643: =IF(RC[-26]&RC[-25]&RC[-24]&RC[-23]&RC[-22]&RC[-21]="",,R1C6)&IF(RC[-26]="",,"|n"&R1C7&RC[-26])&IF(RC[-25]="",,"|n"&R1C8&RC[-25])&IF(RC[-24]="",,"|n"&R1C9&RC[-24])&IF(RC[-23]="",,"|n"&R1C10&RC[-23])&IF(RC[-22]="",,"|n"&R1C11&RC[-22])&IF(RC[-21]="",,"|n"&R1C12&RC[-21])&IF(RC[-19]&RC[-18]&RC[-17]&RC[-16]="",,"|n"&R1C13)&IF(RC[-19]="",,"|n"&R1C14&RC[-19])&IF(RC[-18]="",,"|n"&R1C15&RC[-18])&IF(RC[-17]="",,"|n"&R1C16&RC[-17])&IF(RC[-16]="",,"|n"&R1C17&RC[-16])&IF(RC[-15]="",,"|n"&R1C18&RC[-15])&IF(RC[-14]="",,"|n"&R1C19&RC[-14])&IF(RC[-13]="",,"|n"&R1C20&RC[-13])&IF(RC[-12]="",,"|n"&R1C21&RC[-12])&IF(RC[-10]="",,"|n"&R1C23&RC[-10])&IF(RC[-9]="",,"|n"&R1C24&RC[-9])&IF(RC[-8]="",,"|n"&R1C25&RC[-8])&IF(RC[-7]="",,"|n"&R1C26&RC[-7])&IF(RC[-6]="",,"|n"&R1C27&RC[-6])&IF(RC[-5]="",,"|n"&R1C28&RC[-5])&IF(RC[-2]="",,"|n"&RC[-2]) -> 
AG644: =IF(RC[-26]&RC[-25]&RC[-24]&RC[-23]&RC[-22]&RC[-21]="",,R1C6)&IF(RC[-26]="",,"|n"&R1C7&RC[-26])&IF(RC[-25]="",,"|n"&R1C8&RC[-25])&IF(RC[-24]="",,"|n"&R1C9&RC[-24])&IF(RC[-23]="",,"|n"&R1C10&RC[-23])&IF(RC[-22]="",,"|n"&R1C11&RC[-22])&IF(RC[-21]="",,"|n"&R1C12&RC[-21])&IF(RC[-19]&RC[-18]&RC[-17]&RC[-16]="",,"|n"&R1C13)&IF(RC[-19]="",,"|n"&R1C14&RC[-19])&IF(RC[-18]="",,"|n"&R1C15&RC[-18])&IF(RC[-17]="",,"|n"&R1C16&RC[-17])&IF(RC[-16]="",,"|n"&R1C17&RC[-16])&IF(RC[-15]="",,"|n"&R1C18&RC[-15])&IF(RC[-14]="",,"|n"&R1C19&RC[-14])&IF(RC[-13]="",,"|n"&R1C20&RC[-13])&IF(RC[-12]="",,"|n"&R1C21&RC[-12])&IF(RC[-10]="",,"|n"&R1C23&RC[-10])&IF(RC[-9]="",,"|n"&R1C24&RC[-9])&IF(RC[-8]="",,"|n"&R1C25&RC[-8])&IF(RC[-7]="",,"|n"&R1C26&RC[-7])&IF(RC[-6]="",,"|n"&R1C27&RC[-6])&IF(RC[-5]="",,"|n"&R1C28&RC[-5])&IF(RC[-2]="",,"|n"&RC[-2]) -> 
AG645: =IF(RC[-26]&RC[-25]&RC[-24]&RC[-23]&RC[-22]&RC[-21]="",,R1C6)&IF(RC[-26]="",,"|n"&R1C7&RC[-26])&IF(RC[-25]="",,"|n"&R1C8&RC[-25])&IF(RC[-24]="",,"|n"&R1C9&RC[-24])&IF(RC[-23]="",,"|n"&R1C10&RC[-23])&IF(RC[-22]="",,"|n"&R1C11&RC[-22])&IF(RC[-21]="",,"|n"&R1C12&RC[-21])&IF(RC[-19]&RC[-18]&RC[-17]&RC[-16]="",,"|n"&R1C13)&IF(RC[-19]="",,"|n"&R1C14&RC[-19])&IF(RC[-18]="",,"|n"&R1C15&RC[-18])&IF(RC[-17]="",,"|n"&R1C16&RC[-17])&IF(RC[-16]="",,"|n"&R1C17&RC[-16])&IF(RC[-15]="",,"|n"&R1C18&RC[-15])&IF(RC[-14]="",,"|n"&R1C19&RC[-14])&IF(RC[-13]="",,"|n"&R1C20&RC[-13])&IF(RC[-12]="",,"|n"&R1C21&RC[-12])&IF(RC[-10]="",,"|n"&R1C23&RC[-10])&IF(RC[-9]="",,"|n"&R1C24&RC[-9])&IF(RC[-8]="",,"|n"&R1C25&RC[-8])&IF(RC[-7]="",,"|n"&R1C26&RC[-7])&IF(RC[-6]="",,"|n"&R1C27&RC[-6])&IF(RC[-5]="",,"|n"&R1C28&RC[-5])&IF(RC[-2]="",,"|n"&RC[-2]) -> 
AG646: =IF(RC[-26]&RC[-25]&RC[-24]&RC[-23]&RC[-22]&RC[-21]="",,R1C6)&IF(RC[-26]="",,"|n"&R1C7&RC[-26])&IF(RC[-25]="",,"|n"&R1C8&RC[-25])&IF(RC[-24]="",,"|n"&R1C9&RC[-24])&IF(RC[-23]="",,"|n"&R1C10&RC[-23])&IF(RC[-22]="",,"|n"&R1C11&RC[-22])&IF(RC[-21]="",,"|n"&R1C12&RC[-21])&IF(RC[-19]&RC[-18]&RC[-17]&RC[-16]="",,"|n"&R1C13)&IF(RC[-19]="",,"|n"&R1C14&RC[-19])&IF(RC[-18]="",,"|n"&R1C15&RC[-18])&IF(RC[-17]="",,"|n"&R1C16&RC[-17])&IF(RC[-16]="",,"|n"&R1C17&RC[-16])&IF(RC[-15]="",,"|n"&R1C18&RC[-15])&IF(RC[-14]="",,"|n"&R1C19&RC[-14])&IF(RC[-13]="",,"|n"&R1C20&RC[-13])&IF(RC[-12]="",,"|n"&R1C21&RC[-12])&IF(RC[-10]="",,"|n"&R1C23&RC[-10])&IF(RC[-9]="",,"|n"&R1C24&RC[-9])&IF(RC[-8]="",,"|n"&R1C25&RC[-8])&IF(RC[-7]="",,"|n"&R1C26&RC[-7])&IF(RC[-6]="",,"|n"&R1C27&RC[-6])&IF(RC[-5]="",,"|n"&R1C28&RC[-5])&IF(RC[-2]="",,"|n"&RC[-2]) -> 
AG647: =IF(RC[-26]&RC[-25]&RC[-24]&RC[-23]&RC[-22]&RC[-21]="",,R1C6)&IF(RC[-26]="",,"|n"&R1C7&RC[-26])&IF(RC[-25]="",,"|n"&R1C8&RC[-25])&IF(RC[-24]="",,"|n"&R1C9&RC[-24])&IF(RC[-23]="",,"|n"&R1C10&RC[-23])&IF(RC[-22]="",,"|n"&R1C11&RC[-22])&IF(RC[-21]="",,"|n"&R1C12&RC[-21])&IF(RC[-19]&RC[-18]&RC[-17]&RC[-16]="",,"|n"&R1C13)&IF(RC[-19]="",,"|n"&R1C14&RC[-19])&IF(RC[-18]="",,"|n"&R1C15&RC[-18])&IF(RC[-17]="",,"|n"&R1C16&RC[-17])&IF(RC[-16]="",,"|n"&R1C17&RC[-16])&IF(RC[-15]="",,"|n"&R1C18&RC[-15])&IF(RC[-14]="",,"|n"&R1C19&RC[-14])&IF(RC[-13]="",,"|n"&R1C20&RC[-13])&IF(RC[-12]="",,"|n"&R1C21&RC[-12])&IF(RC[-10]="",,"|n"&R1C23&RC[-10])&IF(RC[-9]="",,"|n"&R1C24&RC[-9])&IF(RC[-8]="",,"|n"&R1C25&RC[-8])&IF(RC[-7]="",,"|n"&R1C26&RC[-7])&IF(RC[-6]="",,"|n"&R1C27&RC[-6])&IF(RC[-5]="",,"|n"&R1C28&RC[-5])&IF(RC[-2]="",,"|n"&RC[-2]) -> 
AG648: =IF(RC[-26]&RC[-25]&RC[-24]&RC[-23]&RC[-22]&RC[-21]="",,R1C6)&IF(RC[-26]="",,"|n"&R1C7&RC[-26])&IF(RC[-25]="",,"|n"&R1C8&RC[-25])&IF(RC[-24]="",,"|n"&R1C9&RC[-24])&IF(RC[-23]="",,"|n"&R1C10&RC[-23])&IF(RC[-22]="",,"|n"&R1C11&RC[-22])&IF(RC[-21]="",,"|n"&R1C12&RC[-21])&IF(RC[-19]&RC[-18]&RC[-17]&RC[-16]="",,"|n"&R1C13)&IF(RC[-19]="",,"|n"&R1C14&RC[-19])&IF(RC[-18]="",,"|n"&R1C15&RC[-18])&IF(RC[-17]="",,"|n"&R1C16&RC[-17])&IF(RC[-16]="",,"|n"&R1C17&RC[-16])&IF(RC[-15]="",,"|n"&R1C18&RC[-15])&IF(RC[-14]="",,"|n"&R1C19&RC[-14])&IF(RC[-13]="",,"|n"&R1C20&RC[-13])&IF(RC[-12]="",,"|n"&R1C21&RC[-12])&IF(RC[-10]="",,"|n"&R1C23&RC[-10])&IF(RC[-9]="",,"|n"&R1C24&RC[-9])&IF(RC[-8]="",,"|n"&R1C25&RC[-8])&IF(RC[-7]="",,"|n"&R1C26&RC[-7])&IF(RC[-6]="",,"|n"&R1C27&RC[-6])&IF(RC[-5]="",,"|n"&R1C28&RC[-5])&IF(RC[-2]="",,"|n"&RC[-2]) -> 
AG649: =IF(RC[-26]&RC[-25]&RC[-24]&RC[-23]&RC[-22]&RC[-21]="",,R1C6)&IF(RC[-26]="",,"|n"&R1C7&RC[-26])&IF(RC[-25]="",,"|n"&R1C8&RC[-25])&IF(RC[-24]="",,"|n"&R1C9&RC[-24])&IF(RC[-23]="",,"|n"&R1C10&RC[-23])&IF(RC[-22]="",,"|n"&R1C11&RC[-22])&IF(RC[-21]="",,"|n"&R1C12&RC[-21])&IF(RC[-19]&RC[-18]&RC[-17]&RC[-16]="",,"|n"&R1C13)&IF(RC[-19]="",,"|n"&R1C14&RC[-19])&IF(RC[-18]="",,"|n"&R1C15&RC[-18])&IF(RC[-17]="",,"|n"&R1C16&RC[-17])&IF(RC[-16]="",,"|n"&R1C17&RC[-16])&IF(RC[-15]="",,"|n"&R1C18&RC[-15])&IF(RC[-14]="",,"|n"&R1C19&RC[-14])&IF(RC[-13]="",,"|n"&R1C20&RC[-13])&IF(RC[-12]="",,"|n"&R1C21&RC[-12])&IF(RC[-10]="",,"|n"&R1C23&RC[-10])&IF(RC[-9]="",,"|n"&R1C24&RC[-9])&IF(RC[-8]="",,"|n"&R1C25&RC[-8])&IF(RC[-7]="",,"|n"&R1C26&RC[-7])&IF(RC[-6]="",,"|n"&R1C27&RC[-6])&IF(RC[-5]="",,"|n"&R1C28&RC[-5])&IF(RC[-2]="",,"|n"&RC[-2]) -> 
AG650: =IF(RC[-26]&RC[-25]&RC[-24]&RC[-23]&RC[-22]&RC[-21]="",,R1C6)&IF(RC[-26]="",,"|n"&R1C7&RC[-26])&IF(RC[-25]="",,"|n"&R1C8&RC[-25])&IF(RC[-24]="",,"|n"&R1C9&RC[-24])&IF(RC[-23]="",,"|n"&R1C10&RC[-23])&IF(RC[-22]="",,"|n"&R1C11&RC[-22])&IF(RC[-21]="",,"|n"&R1C12&RC[-21])&IF(RC[-19]&RC[-18]&RC[-17]&RC[-16]="",,"|n"&R1C13)&IF(RC[-19]="",,"|n"&R1C14&RC[-19])&IF(RC[-18]="",,"|n"&R1C15&RC[-18])&IF(RC[-17]="",,"|n"&R1C16&RC[-17])&IF(RC[-16]="",,"|n"&R1C17&RC[-16])&IF(RC[-15]="",,"|n"&R1C18&RC[-15])&IF(RC[-14]="",,"|n"&R1C19&RC[-14])&IF(RC[-13]="",,"|n"&R1C20&RC[-13])&IF(RC[-12]="",,"|n"&R1C21&RC[-12])&IF(RC[-10]="",,"|n"&R1C23&RC[-10])&IF(RC[-9]="",,"|n"&R1C24&RC[-9])&IF(RC[-8]="",,"|n"&R1C25&RC[-8])&IF(RC[-7]="",,"|n"&R1C26&RC[-7])&IF(RC[-6]="",,"|n"&R1C27&RC[-6])&IF(RC[-5]="",,"|n"&R1C28&RC[-5])&IF(RC[-2]="",,"|n"&RC[-2]) -> 
AG651: =IF(RC[-26]&RC[-25]&RC[-24]&RC[-23]&RC[-22]&RC[-21]="",,R1C6)&IF(RC[-26]="",,"|n"&R1C7&RC[-26])&IF(RC[-25]="",,"|n"&R1C8&RC[-25])&IF(RC[-24]="",,"|n"&R1C9&RC[-24])&IF(RC[-23]="",,"|n"&R1C10&RC[-23])&IF(RC[-22]="",,"|n"&R1C11&RC[-22])&IF(RC[-21]="",,"|n"&R1C12&RC[-21])&IF(RC[-19]&RC[-18]&RC[-17]&RC[-16]="",,"|n"&R1C13)&IF(RC[-19]="",,"|n"&R1C14&RC[-19])&IF(RC[-18]="",,"|n"&R1C15&RC[-18])&IF(RC[-17]="",,"|n"&R1C16&RC[-17])&IF(RC[-16]="",,"|n"&R1C17&RC[-16])&IF(RC[-15]="",,"|n"&R1C18&RC[-15])&IF(RC[-14]="",,"|n"&R1C19&RC[-14])&IF(RC[-13]="",,"|n"&R1C20&RC[-13])&IF(RC[-12]="",,"|n"&R1C21&RC[-12])&IF(RC[-10]="",,"|n"&R1C23&RC[-10])&IF(RC[-9]="",,"|n"&R1C24&RC[-9])&IF(RC[-8]="",,"|n"&R1C25&RC[-8])&IF(RC[-7]="",,"|n"&R1C26&RC[-7])&IF(RC[-6]="",,"|n"&R1C27&RC[-6])&IF(RC[-5]="",,"|n"&R1C28&RC[-5])&IF(RC[-2]="",,"|n"&RC[-2]) -> 
AG652: =IF(RC[-26]&RC[-25]&RC[-24]&RC[-23]&RC[-22]&RC[-21]="",,R1C6)&IF(RC[-26]="",,"|n"&R1C7&RC[-26])&IF(RC[-25]="",,"|n"&R1C8&RC[-25])&IF(RC[-24]="",,"|n"&R1C9&RC[-24])&IF(RC[-23]="",,"|n"&R1C10&RC[-23])&IF(RC[-22]="",,"|n"&R1C11&RC[-22])&IF(RC[-21]="",,"|n"&R1C12&RC[-21])&IF(RC[-19]&RC[-18]&RC[-17]&RC[-16]="",,"|n"&R1C13)&IF(RC[-19]="",,"|n"&R1C14&RC[-19])&IF(RC[-18]="",,"|n"&R1C15&RC[-18])&IF(RC[-17]="",,"|n"&R1C16&RC[-17])&IF(RC[-16]="",,"|n"&R1C17&RC[-16])&IF(RC[-15]="",,"|n"&R1C18&RC[-15])&IF(RC[-14]="",,"|n"&R1C19&RC[-14])&IF(RC[-13]="",,"|n"&R1C20&RC[-13])&IF(RC[-12]="",,"|n"&R1C21&RC[-12])&IF(RC[-10]="",,"|n"&R1C23&RC[-10])&IF(RC[-9]="",,"|n"&R1C24&RC[-9])&IF(RC[-8]="",,"|n"&R1C25&RC[-8])&IF(RC[-7]="",,"|n"&R1C26&RC[-7])&IF(RC[-6]="",,"|n"&R1C27&RC[-6])&IF(RC[-5]="",,"|n"&R1C28&RC[-5])&IF(RC[-2]="",,"|n"&RC[-2]) -> 
AG653: =IF(RC[-26]&RC[-25]&RC[-24]&RC[-23]&RC[-22]&RC[-21]="",,R1C6)&IF(RC[-26]="",,"|n"&R1C7&RC[-26])&IF(RC[-25]="",,"|n"&R1C8&RC[-25])&IF(RC[-24]="",,"|n"&R1C9&RC[-24])&IF(RC[-23]="",,"|n"&R1C10&RC[-23])&IF(RC[-22]="",,"|n"&R1C11&RC[-22])&IF(RC[-21]="",,"|n"&R1C12&RC[-21])&IF(RC[-19]&RC[-18]&RC[-17]&RC[-16]="",,"|n"&R1C13)&IF(RC[-19]="",,"|n"&R1C14&RC[-19])&IF(RC[-18]="",,"|n"&R1C15&RC[-18])&IF(RC[-17]="",,"|n"&R1C16&RC[-17])&IF(RC[-16]="",,"|n"&R1C17&RC[-16])&IF(RC[-15]="",,"|n"&R1C18&RC[-15])&IF(RC[-14]="",,"|n"&R1C19&RC[-14])&IF(RC[-13]="",,"|n"&R1C20&RC[-13])&IF(RC[-12]="",,"|n"&R1C21&RC[-12])&IF(RC[-10]="",,"|n"&R1C23&RC[-10])&IF(RC[-9]="",,"|n"&R1C24&RC[-9])&IF(RC[-8]="",,"|n"&R1C25&RC[-8])&IF(RC[-7]="",,"|n"&R1C26&RC[-7])&IF(RC[-6]="",,"|n"&R1C27&RC[-6])&IF(RC[-5]="",,"|n"&R1C28&RC[-5])&IF(RC[-2]="",,"|n"&RC[-2]) -> 
AG654: =IF(RC[-26]&RC[-25]&RC[-24]&RC[-23]&RC[-22]&RC[-21]="",,R1C6)&IF(RC[-26]="",,"|n"&R1C7&RC[-26])&IF(RC[-25]="",,"|n"&R1C8&RC[-25])&IF(RC[-24]="",,"|n"&R1C9&RC[-24])&IF(RC[-23]="",,"|n"&R1C10&RC[-23])&IF(RC[-22]="",,"|n"&R1C11&RC[-22])&IF(RC[-21]="",,"|n"&R1C12&RC[-21])&IF(RC[-19]&RC[-18]&RC[-17]&RC[-16]="",,"|n"&R1C13)&IF(RC[-19]="",,"|n"&R1C14&RC[-19])&IF(RC[-18]="",,"|n"&R1C15&RC[-18])&IF(RC[-17]="",,"|n"&R1C16&RC[-17])&IF(RC[-16]="",,"|n"&R1C17&RC[-16])&IF(RC[-15]="",,"|n"&R1C18&RC[-15])&IF(RC[-14]="",,"|n"&R1C19&RC[-14])&IF(RC[-13]="",,"|n"&R1C20&RC[-13])&IF(RC[-12]="",,"|n"&R1C21&RC[-12])&IF(RC[-10]="",,"|n"&R1C23&RC[-10])&IF(RC[-9]="",,"|n"&R1C24&RC[-9])&IF(RC[-8]="",,"|n"&R1C25&RC[-8])&IF(RC[-7]="",,"|n"&R1C26&RC[-7])&IF(RC[-6]="",,"|n"&R1C27&RC[-6])&IF(RC[-5]="",,"|n"&R1C28&RC[-5])&IF(RC[-2]="",,"|n"&RC[-2]) -> 
AG655: =IF(RC[-26]&RC[-25]&RC[-24]&RC[-23]&RC[-22]&RC[-21]="",,R1C6)&IF(RC[-26]="",,"|n"&R1C7&RC[-26])&IF(RC[-25]="",,"|n"&R1C8&RC[-25])&IF(RC[-24]="",,"|n"&R1C9&RC[-24])&IF(RC[-23]="",,"|n"&R1C10&RC[-23])&IF(RC[-22]="",,"|n"&R1C11&RC[-22])&IF(RC[-21]="",,"|n"&R1C12&RC[-21])&IF(RC[-19]&RC[-18]&RC[-17]&RC[-16]="",,"|n"&R1C13)&IF(RC[-19]="",,"|n"&R1C14&RC[-19])&IF(RC[-18]="",,"|n"&R1C15&RC[-18])&IF(RC[-17]="",,"|n"&R1C16&RC[-17])&IF(RC[-16]="",,"|n"&R1C17&RC[-16])&IF(RC[-15]="",,"|n"&R1C18&RC[-15])&IF(RC[-14]="",,"|n"&R1C19&RC[-14])&IF(RC[-13]="",,"|n"&R1C20&RC[-13])&IF(RC[-12]="",,"|n"&R1C21&RC[-12])&IF(RC[-10]="",,"|n"&R1C23&RC[-10])&IF(RC[-9]="",,"|n"&R1C24&RC[-9])&IF(RC[-8]="",,"|n"&R1C25&RC[-8])&IF(RC[-7]="",,"|n"&R1C26&RC[-7])&IF(RC[-6]="",,"|n"&R1C27&RC[-6])&IF(RC[-5]="",,"|n"&R1C28&RC[-5])&IF(RC[-2]="",,"|n"&RC[-2]) -> 
AG656: =IF(RC[-26]&RC[-25]&RC[-24]&RC[-23]&RC[-22]&RC[-21]="",,R1C6)&IF(RC[-26]="",,"|n"&R1C7&RC[-26])&IF(RC[-25]="",,"|n"&R1C8&RC[-25])&IF(RC[-24]="",,"|n"&R1C9&RC[-24])&IF(RC[-23]="",,"|n"&R1C10&RC[-23])&IF(RC[-22]="",,"|n"&R1C11&RC[-22])&IF(RC[-21]="",,"|n"&R1C12&RC[-21])&IF(RC[-19]&RC[-18]&RC[-17]&RC[-16]="",,"|n"&R1C13)&IF(RC[-19]="",,"|n"&R1C14&RC[-19])&IF(RC[-18]="",,"|n"&R1C15&RC[-18])&IF(RC[-17]="",,"|n"&R1C16&RC[-17])&IF(RC[-16]="",,"|n"&R1C17&RC[-16])&IF(RC[-15]="",,"|n"&R1C18&RC[-15])&IF(RC[-14]="",,"|n"&R1C19&RC[-14])&IF(RC[-13]="",,"|n"&R1C20&RC[-13])&IF(RC[-12]="",,"|n"&R1C21&RC[-12])&IF(RC[-10]="",,"|n"&R1C23&RC[-10])&IF(RC[-9]="",,"|n"&R1C24&RC[-9])&IF(RC[-8]="",,"|n"&R1C25&RC[-8])&IF(RC[-7]="",,"|n"&R1C26&RC[-7])&IF(RC[-6]="",,"|n"&R1C27&RC[-6])&IF(RC[-5]="",,"|n"&R1C28&RC[-5])&IF(RC[-2]="",,"|n"&RC[-2]) -> 
AG657: =IF(RC[-26]&RC[-25]&RC[-24]&RC[-23]&RC[-22]&RC[-21]="",,R1C6)&IF(RC[-26]="",,"|n"&R1C7&RC[-26])&IF(RC[-25]="",,"|n"&R1C8&RC[-25])&IF(RC[-24]="",,"|n"&R1C9&RC[-24])&IF(RC[-23]="",,"|n"&R1C10&RC[-23])&IF(RC[-22]="",,"|n"&R1C11&RC[-22])&IF(RC[-21]="",,"|n"&R1C12&RC[-21])&IF(RC[-19]&RC[-18]&RC[-17]&RC[-16]="",,"|n"&R1C13)&IF(RC[-19]="",,"|n"&R1C14&RC[-19])&IF(RC[-18]="",,"|n"&R1C15&RC[-18])&IF(RC[-17]="",,"|n"&R1C16&RC[-17])&IF(RC[-16]="",,"|n"&R1C17&RC[-16])&IF(RC[-15]="",,"|n"&R1C18&RC[-15])&IF(RC[-14]="",,"|n"&R1C19&RC[-14])&IF(RC[-13]="",,"|n"&R1C20&RC[-13])&IF(RC[-12]="",,"|n"&R1C21&RC[-12])&IF(RC[-10]="",,"|n"&R1C23&RC[-10])&IF(RC[-9]="",,"|n"&R1C24&RC[-9])&IF(RC[-8]="",,"|n"&R1C25&RC[-8])&IF(RC[-7]="",,"|n"&R1C26&RC[-7])&IF(RC[-6]="",,"|n"&R1C27&RC[-6])&IF(RC[-5]="",,"|n"&R1C28&RC[-5])&IF(RC[-2]="",,"|n"&RC[-2]) -> 
AG658: =IF(RC[-26]&RC[-25]&RC[-24]&RC[-23]&RC[-22]&RC[-21]="",,R1C6)&IF(RC[-26]="",,"|n"&R1C7&RC[-26])&IF(RC[-25]="",,"|n"&R1C8&RC[-25])&IF(RC[-24]="",,"|n"&R1C9&RC[-24])&IF(RC[-23]="",,"|n"&R1C10&RC[-23])&IF(RC[-22]="",,"|n"&R1C11&RC[-22])&IF(RC[-21]="",,"|n"&R1C12&RC[-21])&IF(RC[-19]&RC[-18]&RC[-17]&RC[-16]="",,"|n"&R1C13)&IF(RC[-19]="",,"|n"&R1C14&RC[-19])&IF(RC[-18]="",,"|n"&R1C15&RC[-18])&IF(RC[-17]="",,"|n"&R1C16&RC[-17])&IF(RC[-16]="",,"|n"&R1C17&RC[-16])&IF(RC[-15]="",,"|n"&R1C18&RC[-15])&IF(RC[-14]="",,"|n"&R1C19&RC[-14])&IF(RC[-13]="",,"|n"&R1C20&RC[-13])&IF(RC[-12]="",,"|n"&R1C21&RC[-12])&IF(RC[-10]="",,"|n"&R1C23&RC[-10])&IF(RC[-9]="",,"|n"&R1C24&RC[-9])&IF(RC[-8]="",,"|n"&R1C25&RC[-8])&IF(RC[-7]="",,"|n"&R1C26&RC[-7])&IF(RC[-6]="",,"|n"&R1C27&RC[-6])&IF(RC[-5]="",,"|n"&R1C28&RC[-5])&IF(RC[-2]="",,"|n"&RC[-2]) -> 
AG659: =IF(RC[-26]&RC[-25]&RC[-24]&RC[-23]&RC[-22]&RC[-21]="",,R1C6)&IF(RC[-26]="",,"|n"&R1C7&RC[-26])&IF(RC[-25]="",,"|n"&R1C8&RC[-25])&IF(RC[-24]="",,"|n"&R1C9&RC[-24])&IF(RC[-23]="",,"|n"&R1C10&RC[-23])&IF(RC[-22]="",,"|n"&R1C11&RC[-22])&IF(RC[-21]="",,"|n"&R1C12&RC[-21])&IF(RC[-19]&RC[-18]&RC[-17]&RC[-16]="",,"|n"&R1C13)&IF(RC[-19]="",,"|n"&R1C14&RC[-19])&IF(RC[-18]="",,"|n"&R1C15&RC[-18])&IF(RC[-17]="",,"|n"&R1C16&RC[-17])&IF(RC[-16]="",,"|n"&R1C17&RC[-16])&IF(RC[-15]="",,"|n"&R1C18&RC[-15])&IF(RC[-14]="",,"|n"&R1C19&RC[-14])&IF(RC[-13]="",,"|n"&R1C20&RC[-13])&IF(RC[-12]="",,"|n"&R1C21&RC[-12])&IF(RC[-10]="",,"|n"&R1C23&RC[-10])&IF(RC[-9]="",,"|n"&R1C24&RC[-9])&IF(RC[-8]="",,"|n"&R1C25&RC[-8])&IF(RC[-7]="",,"|n"&R1C26&RC[-7])&IF(RC[-6]="",,"|n"&R1C27&RC[-6])&IF(RC[-5]="",,"|n"&R1C28&RC[-5])&IF(RC[-2]="",,"|n"&RC[-2]) -> 
AG660: =IF(RC[-26]&RC[-25]&RC[-24]&RC[-23]&RC[-22]&RC[-21]="",,R1C6)&IF(RC[-26]="",,"|n"&R1C7&RC[-26])&IF(RC[-25]="",,"|n"&R1C8&RC[-25])&IF(RC[-24]="",,"|n"&R1C9&RC[-24])&IF(RC[-23]="",,"|n"&R1C10&RC[-23])&IF(RC[-22]="",,"|n"&R1C11&RC[-22])&IF(RC[-21]="",,"|n"&R1C12&RC[-21])&IF(RC[-19]&RC[-18]&RC[-17]&RC[-16]="",,"|n"&R1C13)&IF(RC[-19]="",,"|n"&R1C14&RC[-19])&IF(RC[-18]="",,"|n"&R1C15&RC[-18])&IF(RC[-17]="",,"|n"&R1C16&RC[-17])&IF(RC[-16]="",,"|n"&R1C17&RC[-16])&IF(RC[-15]="",,"|n"&R1C18&RC[-15])&IF(RC[-14]="",,"|n"&R1C19&RC[-14])&IF(RC[-13]="",,"|n"&R1C20&RC[-13])&IF(RC[-12]="",,"|n"&R1C21&RC[-12])&IF(RC[-10]="",,"|n"&R1C23&RC[-10])&IF(RC[-9]="",,"|n"&R1C24&RC[-9])&IF(RC[-8]="",,"|n"&R1C25&RC[-8])&IF(RC[-7]="",,"|n"&R1C26&RC[-7])&IF(RC[-6]="",,"|n"&R1C27&RC[-6])&IF(RC[-5]="",,"|n"&R1C28&RC[-5])&IF(RC[-2]="",,"|n"&RC[-2]) -> 
AG661: =IF(RC[-26]&RC[-25]&RC[-24]&RC[-23]&RC[-22]&RC[-21]="",,R1C6)&IF(RC[-26]="",,"|n"&R1C7&RC[-26])&IF(RC[-25]="",,"|n"&R1C8&RC[-25])&IF(RC[-24]="",,"|n"&R1C9&RC[-24])&IF(RC[-23]="",,"|n"&R1C10&RC[-23])&IF(RC[-22]="",,"|n"&R1C11&RC[-22])&IF(RC[-21]="",,"|n"&R1C12&RC[-21])&IF(RC[-19]&RC[-18]&RC[-17]&RC[-16]="",,"|n"&R1C13)&IF(RC[-19]="",,"|n"&R1C14&RC[-19])&IF(RC[-18]="",,"|n"&R1C15&RC[-18])&IF(RC[-17]="",,"|n"&R1C16&RC[-17])&IF(RC[-16]="",,"|n"&R1C17&RC[-16])&IF(RC[-15]="",,"|n"&R1C18&RC[-15])&IF(RC[-14]="",,"|n"&R1C19&RC[-14])&IF(RC[-13]="",,"|n"&R1C20&RC[-13])&IF(RC[-12]="",,"|n"&R1C21&RC[-12])&IF(RC[-10]="",,"|n"&R1C23&RC[-10])&IF(RC[-9]="",,"|n"&R1C24&RC[-9])&IF(RC[-8]="",,"|n"&R1C25&RC[-8])&IF(RC[-7]="",,"|n"&R1C26&RC[-7])&IF(RC[-6]="",,"|n"&R1C27&RC[-6])&IF(RC[-5]="",,"|n"&R1C28&RC[-5])&IF(RC[-2]="",,"|n"&RC[-2]) -> 
AG662: =IF(RC[-26]&RC[-25]&RC[-24]&RC[-23]&RC[-22]&RC[-21]="",,R1C6)&IF(RC[-26]="",,"|n"&R1C7&RC[-26])&IF(RC[-25]="",,"|n"&R1C8&RC[-25])&IF(RC[-24]="",,"|n"&R1C9&RC[-24])&IF(RC[-23]="",,"|n"&R1C10&RC[-23])&IF(RC[-22]="",,"|n"&R1C11&RC[-22])&IF(RC[-21]="",,"|n"&R1C12&RC[-21])&IF(RC[-19]&RC[-18]&RC[-17]&RC[-16]="",,"|n"&R1C13)&IF(RC[-19]="",,"|n"&R1C14&RC[-19])&IF(RC[-18]="",,"|n"&R1C15&RC[-18])&IF(RC[-17]="",,"|n"&R1C16&RC[-17])&IF(RC[-16]="",,"|n"&R1C17&RC[-16])&IF(RC[-15]="",,"|n"&R1C18&RC[-15])&IF(RC[-14]="",,"|n"&R1C19&RC[-14])&IF(RC[-13]="",,"|n"&R1C20&RC[-13])&IF(RC[-12]="",,"|n"&R1C21&RC[-12])&IF(RC[-10]="",,"|n"&R1C23&RC[-10])&IF(RC[-9]="",,"|n"&R1C24&RC[-9])&IF(RC[-8]="",,"|n"&R1C25&RC[-8])&IF(RC[-7]="",,"|n"&R1C26&RC[-7])&IF(RC[-6]="",,"|n"&R1C27&RC[-6])&IF(RC[-5]="",,"|n"&R1C28&RC[-5])&IF(RC[-2]="",,"|n"&RC[-2]) -> 
AG663: =IF(RC[-26]&RC[-25]&RC[-24]&RC[-23]&RC[-22]&RC[-21]="",,R1C6)&IF(RC[-26]="",,"|n"&R1C7&RC[-26])&IF(RC[-25]="",,"|n"&R1C8&RC[-25])&IF(RC[-24]="",,"|n"&R1C9&RC[-24])&IF(RC[-23]="",,"|n"&R1C10&RC[-23])&IF(RC[-22]="",,"|n"&R1C11&RC[-22])&IF(RC[-21]="",,"|n"&R1C12&RC[-21])&IF(RC[-19]&RC[-18]&RC[-17]&RC[-16]="",,"|n"&R1C13)&IF(RC[-19]="",,"|n"&R1C14&RC[-19])&IF(RC[-18]="",,"|n"&R1C15&RC[-18])&IF(RC[-17]="",,"|n"&R1C16&RC[-17])&IF(RC[-16]="",,"|n"&R1C17&RC[-16])&IF(RC[-15]="",,"|n"&R1C18&RC[-15])&IF(RC[-14]="",,"|n"&R1C19&RC[-14])&IF(RC[-13]="",,"|n"&R1C20&RC[-13])&IF(RC[-12]="",,"|n"&R1C21&RC[-12])&IF(RC[-10]="",,"|n"&R1C23&RC[-10])&IF(RC[-9]="",,"|n"&R1C24&RC[-9])&IF(RC[-8]="",,"|n"&R1C25&RC[-8])&IF(RC[-7]="",,"|n"&R1C26&RC[-7])&IF(RC[-6]="",,"|n"&R1C27&RC[-6])&IF(RC[-5]="",,"|n"&R1C28&RC[-5])&IF(RC[-2]="",,"|n"&RC[-2]) -> 
AG664: =IF(RC[-26]&RC[-25]&RC[-24]&RC[-23]&RC[-22]&RC[-21]="",,R1C6)&IF(RC[-26]="",,"|n"&R1C7&RC[-26])&IF(RC[-25]="",,"|n"&R1C8&RC[-25])&IF(RC[-24]="",,"|n"&R1C9&RC[-24])&IF(RC[-23]="",,"|n"&R1C10&RC[-23])&IF(RC[-22]="",,"|n"&R1C11&RC[-22])&IF(RC[-21]="",,"|n"&R1C12&RC[-21])&IF(RC[-19]&RC[-18]&RC[-17]&RC[-16]="",,"|n"&R1C13)&IF(RC[-19]="",,"|n"&R1C14&RC[-19])&IF(RC[-18]="",,"|n"&R1C15&RC[-18])&IF(RC[-17]="",,"|n"&R1C16&RC[-17])&IF(RC[-16]="",,"|n"&R1C17&RC[-16])&IF(RC[-15]="",,"|n"&R1C18&RC[-15])&IF(RC[-14]="",,"|n"&R1C19&RC[-14])&IF(RC[-13]="",,"|n"&R1C20&RC[-13])&IF(RC[-12]="",,"|n"&R1C21&RC[-12])&IF(RC[-10]="",,"|n"&R1C23&RC[-10])&IF(RC[-9]="",,"|n"&R1C24&RC[-9])&IF(RC[-8]="",,"|n"&R1C25&RC[-8])&IF(RC[-7]="",,"|n"&R1C26&RC[-7])&IF(RC[-6]="",,"|n"&R1C27&RC[-6])&IF(RC[-5]="",,"|n"&R1C28&RC[-5])&IF(RC[-2]="",,"|n"&RC[-2]) -> 
AG665: =IF(RC[-26]&RC[-25]&RC[-24]&RC[-23]&RC[-22]&RC[-21]="",,R1C6)&IF(RC[-26]="",,"|n"&R1C7&RC[-26])&IF(RC[-25]="",,"|n"&R1C8&RC[-25])&IF(RC[-24]="",,"|n"&R1C9&RC[-24])&IF(RC[-23]="",,"|n"&R1C10&RC[-23])&IF(RC[-22]="",,"|n"&R1C11&RC[-22])&IF(RC[-21]="",,"|n"&R1C12&RC[-21])&IF(RC[-19]&RC[-18]&RC[-17]&RC[-16]="",,"|n"&R1C13)&IF(RC[-19]="",,"|n"&R1C14&RC[-19])&IF(RC[-18]="",,"|n"&R1C15&RC[-18])&IF(RC[-17]="",,"|n"&R1C16&RC[-17])&IF(RC[-16]="",,"|n"&R1C17&RC[-16])&IF(RC[-15]="",,"|n"&R1C18&RC[-15])&IF(RC[-14]="",,"|n"&R1C19&RC[-14])&IF(RC[-13]="",,"|n"&R1C20&RC[-13])&IF(RC[-12]="",,"|n"&R1C21&RC[-12])&IF(RC[-10]="",,"|n"&R1C23&RC[-10])&IF(RC[-9]="",,"|n"&R1C24&RC[-9])&IF(RC[-8]="",,"|n"&R1C25&RC[-8])&IF(RC[-7]="",,"|n"&R1C26&RC[-7])&IF(RC[-6]="",,"|n"&R1C27&RC[-6])&IF(RC[-5]="",,"|n"&R1C28&RC[-5])&IF(RC[-2]="",,"|n"&RC[-2]) -> 
AG666: =IF(RC[-26]&RC[-25]&RC[-24]&RC[-23]&RC[-22]&RC[-21]="",,R1C6)&IF(RC[-26]="",,"|n"&R1C7&RC[-26])&IF(RC[-25]="",,"|n"&R1C8&RC[-25])&IF(RC[-24]="",,"|n"&R1C9&RC[-24])&IF(RC[-23]="",,"|n"&R1C10&RC[-23])&IF(RC[-22]="",,"|n"&R1C11&RC[-22])&IF(RC[-21]="",,"|n"&R1C12&RC[-21])&IF(RC[-19]&RC[-18]&RC[-17]&RC[-16]="",,"|n"&R1C13)&IF(RC[-19]="",,"|n"&R1C14&RC[-19])&IF(RC[-18]="",,"|n"&R1C15&RC[-18])&IF(RC[-17]="",,"|n"&R1C16&RC[-17])&IF(RC[-16]="",,"|n"&R1C17&RC[-16])&IF(RC[-15]="",,"|n"&R1C18&RC[-15])&IF(RC[-14]="",,"|n"&R1C19&RC[-14])&IF(RC[-13]="",,"|n"&R1C20&RC[-13])&IF(RC[-12]="",,"|n"&R1C21&RC[-12])&IF(RC[-10]="",,"|n"&R1C23&RC[-10])&IF(RC[-9]="",,"|n"&R1C24&RC[-9])&IF(RC[-8]="",,"|n"&R1C25&RC[-8])&IF(RC[-7]="",,"|n"&R1C26&RC[-7])&IF(RC[-6]="",,"|n"&R1C27&RC[-6])&IF(RC[-5]="",,"|n"&R1C28&RC[-5])&IF(RC[-2]="",,"|n"&RC[-2]) -> 
AG667: =IF(RC[-26]&RC[-25]&RC[-24]&RC[-23]&RC[-22]&RC[-21]="",,R1C6)&IF(RC[-26]="",,"|n"&R1C7&RC[-26])&IF(RC[-25]="",,"|n"&R1C8&RC[-25])&IF(RC[-24]="",,"|n"&R1C9&RC[-24])&IF(RC[-23]="",,"|n"&R1C10&RC[-23])&IF(RC[-22]="",,"|n"&R1C11&RC[-22])&IF(RC[-21]="",,"|n"&R1C12&RC[-21])&IF(RC[-19]&RC[-18]&RC[-17]&RC[-16]="",,"|n"&R1C13)&IF(RC[-19]="",,"|n"&R1C14&RC[-19])&IF(RC[-18]="",,"|n"&R1C15&RC[-18])&IF(RC[-17]="",,"|n"&R1C16&RC[-17])&IF(RC[-16]="",,"|n"&R1C17&RC[-16])&IF(RC[-15]="",,"|n"&R1C18&RC[-15])&IF(RC[-14]="",,"|n"&R1C19&RC[-14])&IF(RC[-13]="",,"|n"&R1C20&RC[-13])&IF(RC[-12]="",,"|n"&R1C21&RC[-12])&IF(RC[-10]="",,"|n"&R1C23&RC[-10])&IF(RC[-9]="",,"|n"&R1C24&RC[-9])&IF(RC[-8]="",,"|n"&R1C25&RC[-8])&IF(RC[-7]="",,"|n"&R1C26&RC[-7])&IF(RC[-6]="",,"|n"&R1C27&RC[-6])&IF(RC[-5]="",,"|n"&R1C28&RC[-5])&IF(RC[-2]="",,"|n"&RC[-2]) -> 
AG668: =IF(RC[-26]&RC[-25]&RC[-24]&RC[-23]&RC[-22]&RC[-21]="",,R1C6)&IF(RC[-26]="",,"|n"&R1C7&RC[-26])&IF(RC[-25]="",,"|n"&R1C8&RC[-25])&IF(RC[-24]="",,"|n"&R1C9&RC[-24])&IF(RC[-23]="",,"|n"&R1C10&RC[-23])&IF(RC[-22]="",,"|n"&R1C11&RC[-22])&IF(RC[-21]="",,"|n"&R1C12&RC[-21])&IF(RC[-19]&RC[-18]&RC[-17]&RC[-16]="",,"|n"&R1C13)&IF(RC[-19]="",,"|n"&R1C14&RC[-19])&IF(RC[-18]="",,"|n"&R1C15&RC[-18])&IF(RC[-17]="",,"|n"&R1C16&RC[-17])&IF(RC[-16]="",,"|n"&R1C17&RC[-16])&IF(RC[-15]="",,"|n"&R1C18&RC[-15])&IF(RC[-14]="",,"|n"&R1C19&RC[-14])&IF(RC[-13]="",,"|n"&R1C20&RC[-13])&IF(RC[-12]="",,"|n"&R1C21&RC[-12])&IF(RC[-10]="",,"|n"&R1C23&RC[-10])&IF(RC[-9]="",,"|n"&R1C24&RC[-9])&IF(RC[-8]="",,"|n"&R1C25&RC[-8])&IF(RC[-7]="",,"|n"&R1C26&RC[-7])&IF(RC[-6]="",,"|n"&R1C27&RC[-6])&IF(RC[-5]="",,"|n"&R1C28&RC[-5])&IF(RC[-2]="",,"|n"&RC[-2]) -> 
AG669: =IF(RC[-26]&RC[-25]&RC[-24]&RC[-23]&RC[-22]&RC[-21]="",,R1C6)&IF(RC[-26]="",,"|n"&R1C7&RC[-26])&IF(RC[-25]="",,"|n"&R1C8&RC[-25])&IF(RC[-24]="",,"|n"&R1C9&RC[-24])&IF(RC[-23]="",,"|n"&R1C10&RC[-23])&IF(RC[-22]="",,"|n"&R1C11&RC[-22])&IF(RC[-21]="",,"|n"&R1C12&RC[-21])&IF(RC[-19]&RC[-18]&RC[-17]&RC[-16]="",,"|n"&R1C13)&IF(RC[-19]="",,"|n"&R1C14&RC[-19])&IF(RC[-18]="",,"|n"&R1C15&RC[-18])&IF(RC[-17]="",,"|n"&R1C16&RC[-17])&IF(RC[-16]="",,"|n"&R1C17&RC[-16])&IF(RC[-15]="",,"|n"&R1C18&RC[-15])&IF(RC[-14]="",,"|n"&R1C19&RC[-14])&IF(RC[-13]="",,"|n"&R1C20&RC[-13])&IF(RC[-12]="",,"|n"&R1C21&RC[-12])&IF(RC[-10]="",,"|n"&R1C23&RC[-10])&IF(RC[-9]="",,"|n"&R1C24&RC[-9])&IF(RC[-8]="",,"|n"&R1C25&RC[-8])&IF(RC[-7]="",,"|n"&R1C26&RC[-7])&IF(RC[-6]="",,"|n"&R1C27&RC[-6])&IF(RC[-5]="",,"|n"&R1C28&RC[-5])&IF(RC[-2]="",,"|n"&RC[-2]) -> 
AG670: =IF(RC[-26]&RC[-25]&RC[-24]&RC[-23]&RC[-22]&RC[-21]="",,R1C6)&IF(RC[-26]="",,"|n"&R1C7&RC[-26])&IF(RC[-25]="",,"|n"&R1C8&RC[-25])&IF(RC[-24]="",,"|n"&R1C9&RC[-24])&IF(RC[-23]="",,"|n"&R1C10&RC[-23])&IF(RC[-22]="",,"|n"&R1C11&RC[-22])&IF(RC[-21]="",,"|n"&R1C12&RC[-21])&IF(RC[-19]&RC[-18]&RC[-17]&RC[-16]="",,"|n"&R1C13)&IF(RC[-19]="",,"|n"&R1C14&RC[-19])&IF(RC[-18]="",,"|n"&R1C15&RC[-18])&IF(RC[-17]="",,"|n"&R1C16&RC[-17])&IF(RC[-16]="",,"|n"&R1C17&RC[-16])&IF(RC[-15]="",,"|n"&R1C18&RC[-15])&IF(RC[-14]="",,"|n"&R1C19&RC[-14])&IF(RC[-13]="",,"|n"&R1C20&RC[-13])&IF(RC[-12]="",,"|n"&R1C21&RC[-12])&IF(RC[-10]="",,"|n"&R1C23&RC[-10])&IF(RC[-9]="",,"|n"&R1C24&RC[-9])&IF(RC[-8]="",,"|n"&R1C25&RC[-8])&IF(RC[-7]="",,"|n"&R1C26&RC[-7])&IF(RC[-6]="",,"|n"&R1C27&RC[-6])&IF(RC[-5]="",,"|n"&R1C28&RC[-5])&IF(RC[-2]="",,"|n"&RC[-2]) -> 
AG671: =IF(RC[-26]&RC[-25]&RC[-24]&RC[-23]&RC[-22]&RC[-21]="",,R1C6)&IF(RC[-26]="",,"|n"&R1C7&RC[-26])&IF(RC[-25]="",,"|n"&R1C8&RC[-25])&IF(RC[-24]="",,"|n"&R1C9&RC[-24])&IF(RC[-23]="",,"|n"&R1C10&RC[-23])&IF(RC[-22]="",,"|n"&R1C11&RC[-22])&IF(RC[-21]="",,"|n"&R1C12&RC[-21])&IF(RC[-19]&RC[-18]&RC[-17]&RC[-16]="",,"|n"&R1C13)&IF(RC[-19]="",,"|n"&R1C14&RC[-19])&IF(RC[-18]="",,"|n"&R1C15&RC[-18])&IF(RC[-17]="",,"|n"&R1C16&RC[-17])&IF(RC[-16]="",,"|n"&R1C17&RC[-16])&IF(RC[-15]="",,"|n"&R1C18&RC[-15])&IF(RC[-14]="",,"|n"&R1C19&RC[-14])&IF(RC[-13]="",,"|n"&R1C20&RC[-13])&IF(RC[-12]="",,"|n"&R1C21&RC[-12])&IF(RC[-10]="",,"|n"&R1C23&RC[-10])&IF(RC[-9]="",,"|n"&R1C24&RC[-9])&IF(RC[-8]="",,"|n"&R1C25&RC[-8])&IF(RC[-7]="",,"|n"&R1C26&RC[-7])&IF(RC[-6]="",,"|n"&R1C27&RC[-6])&IF(RC[-5]="",,"|n"&R1C28&RC[-5])&IF(RC[-2]="",,"|n"&RC[-2]) -> 
AG672: =IF(RC[-26]&RC[-25]&RC[-24]&RC[-23]&RC[-22]&RC[-21]="",,R1C6)&IF(RC[-26]="",,"|n"&R1C7&RC[-26])&IF(RC[-25]="",,"|n"&R1C8&RC[-25])&IF(RC[-24]="",,"|n"&R1C9&RC[-24])&IF(RC[-23]="",,"|n"&R1C10&RC[-23])&IF(RC[-22]="",,"|n"&R1C11&RC[-22])&IF(RC[-21]="",,"|n"&R1C12&RC[-21])&IF(RC[-19]&RC[-18]&RC[-17]&RC[-16]="",,"|n"&R1C13)&IF(RC[-19]="",,"|n"&R1C14&RC[-19])&IF(RC[-18]="",,"|n"&R1C15&RC[-18])&IF(RC[-17]="",,"|n"&R1C16&RC[-17])&IF(RC[-16]="",,"|n"&R1C17&RC[-16])&IF(RC[-15]="",,"|n"&R1C18&RC[-15])&IF(RC[-14]="",,"|n"&R1C19&RC[-14])&IF(RC[-13]="",,"|n"&R1C20&RC[-13])&IF(RC[-12]="",,"|n"&R1C21&RC[-12])&IF(RC[-10]="",,"|n"&R1C23&RC[-10])&IF(RC[-9]="",,"|n"&R1C24&RC[-9])&IF(RC[-8]="",,"|n"&R1C25&RC[-8])&IF(RC[-7]="",,"|n"&R1C26&RC[-7])&IF(RC[-6]="",,"|n"&R1C27&RC[-6])&IF(RC[-5]="",,"|n"&R1C28&RC[-5])&IF(RC[-2]="",,"|n"&RC[-2]) -> 
AG673: =IF(RC[-26]&RC[-25]&RC[-24]&RC[-23]&RC[-22]&RC[-21]="",,R1C6)&IF(RC[-26]="",,"|n"&R1C7&RC[-26])&IF(RC[-25]="",,"|n"&R1C8&RC[-25])&IF(RC[-24]="",,"|n"&R1C9&RC[-24])&IF(RC[-23]="",,"|n"&R1C10&RC[-23])&IF(RC[-22]="",,"|n"&R1C11&RC[-22])&IF(RC[-21]="",,"|n"&R1C12&RC[-21])&IF(RC[-19]&RC[-18]&RC[-17]&RC[-16]="",,"|n"&R1C13)&IF(RC[-19]="",,"|n"&R1C14&RC[-19])&IF(RC[-18]="",,"|n"&R1C15&RC[-18])&IF(RC[-17]="",,"|n"&R1C16&RC[-17])&IF(RC[-16]="",,"|n"&R1C17&RC[-16])&IF(RC[-15]="",,"|n"&R1C18&RC[-15])&IF(RC[-14]="",,"|n"&R1C19&RC[-14])&IF(RC[-13]="",,"|n"&R1C20&RC[-13])&IF(RC[-12]="",,"|n"&R1C21&RC[-12])&IF(RC[-10]="",,"|n"&R1C23&RC[-10])&IF(RC[-9]="",,"|n"&R1C24&RC[-9])&IF(RC[-8]="",,"|n"&R1C25&RC[-8])&IF(RC[-7]="",,"|n"&R1C26&RC[-7])&IF(RC[-6]="",,"|n"&R1C27&RC[-6])&IF(RC[-5]="",,"|n"&R1C28&RC[-5])&IF(RC[-2]="",,"|n"&RC[-2]) -> 
AG674: =IF(RC[-26]&RC[-25]&RC[-24]&RC[-23]&RC[-22]&RC[-21]="",,R1C6)&IF(RC[-26]="",,"|n"&R1C7&RC[-26])&IF(RC[-25]="",,"|n"&R1C8&RC[-25])&IF(RC[-24]="",,"|n"&R1C9&RC[-24])&IF(RC[-23]="",,"|n"&R1C10&RC[-23])&IF(RC[-22]="",,"|n"&R1C11&RC[-22])&IF(RC[-21]="",,"|n"&R1C12&RC[-21])&IF(RC[-19]&RC[-18]&RC[-17]&RC[-16]="",,"|n"&R1C13)&IF(RC[-19]="",,"|n"&R1C14&RC[-19])&IF(RC[-18]="",,"|n"&R1C15&RC[-18])&IF(RC[-17]="",,"|n"&R1C16&RC[-17])&IF(RC[-16]="",,"|n"&R1C17&RC[-16])&IF(RC[-15]="",,"|n"&R1C18&RC[-15])&IF(RC[-14]="",,"|n"&R1C19&RC[-14])&IF(RC[-13]="",,"|n"&R1C20&RC[-13])&IF(RC[-12]="",,"|n"&R1C21&RC[-12])&IF(RC[-10]="",,"|n"&R1C23&RC[-10])&IF(RC[-9]="",,"|n"&R1C24&RC[-9])&IF(RC[-8]="",,"|n"&R1C25&RC[-8])&IF(RC[-7]="",,"|n"&R1C26&RC[-7])&IF(RC[-6]="",,"|n"&R1C27&RC[-6])&IF(RC[-5]="",,"|n"&R1C28&RC[-5])&IF(RC[-2]="",,"|n"&RC[-2]) -> 
AG675: =IF(RC[-26]&RC[-25]&RC[-24]&RC[-23]&RC[-22]&RC[-21]="",,R1C6)&IF(RC[-26]="",,"|n"&R1C7&RC[-26])&IF(RC[-25]="",,"|n"&R1C8&RC[-25])&IF(RC[-24]="",,"|n"&R1C9&RC[-24])&IF(RC[-23]="",,"|n"&R1C10&RC[-23])&IF(RC[-22]="",,"|n"&R1C11&RC[-22])&IF(RC[-21]="",,"|n"&R1C12&RC[-21])&IF(RC[-19]&RC[-18]&RC[-17]&RC[-16]="",,"|n"&R1C13)&IF(RC[-19]="",,"|n"&R1C14&RC[-19])&IF(RC[-18]="",,"|n"&R1C15&RC[-18])&IF(RC[-17]="",,"|n"&R1C16&RC[-17])&IF(RC[-16]="",,"|n"&R1C17&RC[-16])&IF(RC[-15]="",,"|n"&R1C18&RC[-15])&IF(RC[-14]="",,"|n"&R1C19&RC[-14])&IF(RC[-13]="",,"|n"&R1C20&RC[-13])&IF(RC[-12]="",,"|n"&R1C21&RC[-12])&IF(RC[-10]="",,"|n"&R1C23&RC[-10])&IF(RC[-9]="",,"|n"&R1C24&RC[-9])&IF(RC[-8]="",,"|n"&R1C25&RC[-8])&IF(RC[-7]="",,"|n"&R1C26&RC[-7])&IF(RC[-6]="",,"|n"&R1C27&RC[-6])&IF(RC[-5]="",,"|n"&R1C28&RC[-5])&IF(RC[-2]="",,"|n"&RC[-2]) -> 
AG676: =IF(RC[-26]&RC[-25]&RC[-24]&RC[-23]&RC[-22]&RC[-21]="",,R1C6)&IF(RC[-26]="",,"|n"&R1C7&RC[-26])&IF(RC[-25]="",,"|n"&R1C8&RC[-25])&IF(RC[-24]="",,"|n"&R1C9&RC[-24])&IF(RC[-23]="",,"|n"&R1C10&RC[-23])&IF(RC[-22]="",,"|n"&R1C11&RC[-22])&IF(RC[-21]="",,"|n"&R1C12&RC[-21])&IF(RC[-19]&RC[-18]&RC[-17]&RC[-16]="",,"|n"&R1C13)&IF(RC[-19]="",,"|n"&R1C14&RC[-19])&IF(RC[-18]="",,"|n"&R1C15&RC[-18])&IF(RC[-17]="",,"|n"&R1C16&RC[-17])&IF(RC[-16]="",,"|n"&R1C17&RC[-16])&IF(RC[-15]="",,"|n"&R1C18&RC[-15])&IF(RC[-14]="",,"|n"&R1C19&RC[-14])&IF(RC[-13]="",,"|n"&R1C20&RC[-13])&IF(RC[-12]="",,"|n"&R1C21&RC[-12])&IF(RC[-10]="",,"|n"&R1C23&RC[-10])&IF(RC[-9]="",,"|n"&R1C24&RC[-9])&IF(RC[-8]="",,"|n"&R1C25&RC[-8])&IF(RC[-7]="",,"|n"&R1C26&RC[-7])&IF(RC[-6]="",,"|n"&R1C27&RC[-6])&IF(RC[-5]="",,"|n"&R1C28&RC[-5])&IF(RC[-2]="",,"|n"&RC[-2]) -> 
AG677: =IF(RC[-26]&RC[-25]&RC[-24]&RC[-23]&RC[-22]&RC[-21]="",,R1C6)&IF(RC[-26]="",,"|n"&R1C7&RC[-26])&IF(RC[-25]="",,"|n"&R1C8&RC[-25])&IF(RC[-24]="",,"|n"&R1C9&RC[-24])&IF(RC[-23]="",,"|n"&R1C10&RC[-23])&IF(RC[-22]="",,"|n"&R1C11&RC[-22])&IF(RC[-21]="",,"|n"&R1C12&RC[-21])&IF(RC[-19]&RC[-18]&RC[-17]&RC[-16]="",,"|n"&R1C13)&IF(RC[-19]="",,"|n"&R1C14&RC[-19])&IF(RC[-18]="",,"|n"&R1C15&RC[-18])&IF(RC[-17]="",,"|n"&R1C16&RC[-17])&IF(RC[-16]="",,"|n"&R1C17&RC[-16])&IF(RC[-15]="",,"|n"&R1C18&RC[-15])&IF(RC[-14]="",,"|n"&R1C19&RC[-14])&IF(RC[-13]="",,"|n"&R1C20&RC[-13])&IF(RC[-12]="",,"|n"&R1C21&RC[-12])&IF(RC[-10]="",,"|n"&R1C23&RC[-10])&IF(RC[-9]="",,"|n"&R1C24&RC[-9])&IF(RC[-8]="",,"|n"&R1C25&RC[-8])&IF(RC[-7]="",,"|n"&R1C26&RC[-7])&IF(RC[-6]="",,"|n"&R1C27&RC[-6])&IF(RC[-5]="",,"|n"&R1C28&RC[-5])&IF(RC[-2]="",,"|n"&RC[-2]) -> 
AG678: =IF(RC[-26]&RC[-25]&RC[-24]&RC[-23]&RC[-22]&RC[-21]="",,R1C6)&IF(RC[-26]="",,"|n"&R1C7&RC[-26])&IF(RC[-25]="",,"|n"&R1C8&RC[-25])&IF(RC[-24]="",,"|n"&R1C9&RC[-24])&IF(RC[-23]="",,"|n"&R1C10&RC[-23])&IF(RC[-22]="",,"|n"&R1C11&RC[-22])&IF(RC[-21]="",,"|n"&R1C12&RC[-21])&IF(RC[-19]&RC[-18]&RC[-17]&RC[-16]="",,"|n"&R1C13)&IF(RC[-19]="",,"|n"&R1C14&RC[-19])&IF(RC[-18]="",,"|n"&R1C15&RC[-18])&IF(RC[-17]="",,"|n"&R1C16&RC[-17])&IF(RC[-16]="",,"|n"&R1C17&RC[-16])&IF(RC[-15]="",,"|n"&R1C18&RC[-15])&IF(RC[-14]="",,"|n"&R1C19&RC[-14])&IF(RC[-13]="",,"|n"&R1C20&RC[-13])&IF(RC[-12]="",,"|n"&R1C21&RC[-12])&IF(RC[-10]="",,"|n"&R1C23&RC[-10])&IF(RC[-9]="",,"|n"&R1C24&RC[-9])&IF(RC[-8]="",,"|n"&R1C25&RC[-8])&IF(RC[-7]="",,"|n"&R1C26&RC[-7])&IF(RC[-6]="",,"|n"&R1C27&RC[-6])&IF(RC[-5]="",,"|n"&R1C28&RC[-5])&IF(RC[-2]="",,"|n"&RC[-2]) -> 
AG679: =IF(RC[-26]&RC[-25]&RC[-24]&RC[-23]&RC[-22]&RC[-21]="",,R1C6)&IF(RC[-26]="",,"|n"&R1C7&RC[-26])&IF(RC[-25]="",,"|n"&R1C8&RC[-25])&IF(RC[-24]="",,"|n"&R1C9&RC[-24])&IF(RC[-23]="",,"|n"&R1C10&RC[-23])&IF(RC[-22]="",,"|n"&R1C11&RC[-22])&IF(RC[-21]="",,"|n"&R1C12&RC[-21])&IF(RC[-19]&RC[-18]&RC[-17]&RC[-16]="",,"|n"&R1C13)&IF(RC[-19]="",,"|n"&R1C14&RC[-19])&IF(RC[-18]="",,"|n"&R1C15&RC[-18])&IF(RC[-17]="",,"|n"&R1C16&RC[-17])&IF(RC[-16]="",,"|n"&R1C17&RC[-16])&IF(RC[-15]="",,"|n"&R1C18&RC[-15])&IF(RC[-14]="",,"|n"&R1C19&RC[-14])&IF(RC[-13]="",,"|n"&R1C20&RC[-13])&IF(RC[-12]="",,"|n"&R1C21&RC[-12])&IF(RC[-10]="",,"|n"&R1C23&RC[-10])&IF(RC[-9]="",,"|n"&R1C24&RC[-9])&IF(RC[-8]="",,"|n"&R1C25&RC[-8])&IF(RC[-7]="",,"|n"&R1C26&RC[-7])&IF(RC[-6]="",,"|n"&R1C27&RC[-6])&IF(RC[-5]="",,"|n"&R1C28&RC[-5])&IF(RC[-2]="",,"|n"&RC[-2]) -> 
AG680: =IF(RC[-26]&RC[-25]&RC[-24]&RC[-23]&RC[-22]&RC[-21]="",,R1C6)&IF(RC[-26]="",,"|n"&R1C7&RC[-26])&IF(RC[-25]="",,"|n"&R1C8&RC[-25])&IF(RC[-24]="",,"|n"&R1C9&RC[-24])&IF(RC[-23]="",,"|n"&R1C10&RC[-23])&IF(RC[-22]="",,"|n"&R1C11&RC[-22])&IF(RC[-21]="",,"|n"&R1C12&RC[-21])&IF(RC[-19]&RC[-18]&RC[-17]&RC[-16]="",,"|n"&R1C13)&IF(RC[-19]="",,"|n"&R1C14&RC[-19])&IF(RC[-18]="",,"|n"&R1C15&RC[-18])&IF(RC[-17]="",,"|n"&R1C16&RC[-17])&IF(RC[-16]="",,"|n"&R1C17&RC[-16])&IF(RC[-15]="",,"|n"&R1C18&RC[-15])&IF(RC[-14]="",,"|n"&R1C19&RC[-14])&IF(RC[-13]="",,"|n"&R1C20&RC[-13])&IF(RC[-12]="",,"|n"&R1C21&RC[-12])&IF(RC[-10]="",,"|n"&R1C23&RC[-10])&IF(RC[-9]="",,"|n"&R1C24&RC[-9])&IF(RC[-8]="",,"|n"&R1C25&RC[-8])&IF(RC[-7]="",,"|n"&R1C26&RC[-7])&IF(RC[-6]="",,"|n"&R1C27&RC[-6])&IF(RC[-5]="",,"|n"&R1C28&RC[-5])&IF(RC[-2]="",,"|n"&RC[-2]) -> 
AG681: =IF(RC[-26]&RC[-25]&RC[-24]&RC[-23]&RC[-22]&RC[-21]="",,R1C6)&IF(RC[-26]="",,"|n"&R1C7&RC[-26])&IF(RC[-25]="",,"|n"&R1C8&RC[-25])&IF(RC[-24]="",,"|n"&R1C9&RC[-24])&IF(RC[-23]="",,"|n"&R1C10&RC[-23])&IF(RC[-22]="",,"|n"&R1C11&RC[-22])&IF(RC[-21]="",,"|n"&R1C12&RC[-21])&IF(RC[-19]&RC[-18]&RC[-17]&RC[-16]="",,"|n"&R1C13)&IF(RC[-19]="",,"|n"&R1C14&RC[-19])&IF(RC[-18]="",,"|n"&R1C15&RC[-18])&IF(RC[-17]="",,"|n"&R1C16&RC[-17])&IF(RC[-16]="",,"|n"&R1C17&RC[-16])&IF(RC[-15]="",,"|n"&R1C18&RC[-15])&IF(RC[-14]="",,"|n"&R1C19&RC[-14])&IF(RC[-13]="",,"|n"&R1C20&RC[-13])&IF(RC[-12]="",,"|n"&R1C21&RC[-12])&IF(RC[-10]="",,"|n"&R1C23&RC[-10])&IF(RC[-9]="",,"|n"&R1C24&RC[-9])&IF(RC[-8]="",,"|n"&R1C25&RC[-8])&IF(RC[-7]="",,"|n"&R1C26&RC[-7])&IF(RC[-6]="",,"|n"&R1C27&RC[-6])&IF(RC[-5]="",,"|n"&R1C28&RC[-5])&IF(RC[-2]="",,"|n"&RC[-2]) -> 
AG682: =IF(RC[-26]&RC[-25]&RC[-24]&RC[-23]&RC[-22]&RC[-21]="",,R1C6)&IF(RC[-26]="",,"|n"&R1C7&RC[-26])&IF(RC[-25]="",,"|n"&R1C8&RC[-25])&IF(RC[-24]="",,"|n"&R1C9&RC[-24])&IF(RC[-23]="",,"|n"&R1C10&RC[-23])&IF(RC[-22]="",,"|n"&R1C11&RC[-22])&IF(RC[-21]="",,"|n"&R1C12&RC[-21])&IF(RC[-19]&RC[-18]&RC[-17]&RC[-16]="",,"|n"&R1C13)&IF(RC[-19]="",,"|n"&R1C14&RC[-19])&IF(RC[-18]="",,"|n"&R1C15&RC[-18])&IF(RC[-17]="",,"|n"&R1C16&RC[-17])&IF(RC[-16]="",,"|n"&R1C17&RC[-16])&IF(RC[-15]="",,"|n"&R1C18&RC[-15])&IF(RC[-14]="",,"|n"&R1C19&RC[-14])&IF(RC[-13]="",,"|n"&R1C20&RC[-13])&IF(RC[-12]="",,"|n"&R1C21&RC[-12])&IF(RC[-10]="",,"|n"&R1C23&RC[-10])&IF(RC[-9]="",,"|n"&R1C24&RC[-9])&IF(RC[-8]="",,"|n"&R1C25&RC[-8])&IF(RC[-7]="",,"|n"&R1C26&RC[-7])&IF(RC[-6]="",,"|n"&R1C27&RC[-6])&IF(RC[-5]="",,"|n"&R1C28&RC[-5])&IF(RC[-2]="",,"|n"&RC[-2]) -> 
AG683: =IF(RC[-26]&RC[-25]&RC[-24]&RC[-23]&RC[-22]&RC[-21]="",,R1C6)&IF(RC[-26]="",,"|n"&R1C7&RC[-26])&IF(RC[-25]="",,"|n"&R1C8&RC[-25])&IF(RC[-24]="",,"|n"&R1C9&RC[-24])&IF(RC[-23]="",,"|n"&R1C10&RC[-23])&IF(RC[-22]="",,"|n"&R1C11&RC[-22])&IF(RC[-21]="",,"|n"&R1C12&RC[-21])&IF(RC[-19]&RC[-18]&RC[-17]&RC[-16]="",,"|n"&R1C13)&IF(RC[-19]="",,"|n"&R1C14&RC[-19])&IF(RC[-18]="",,"|n"&R1C15&RC[-18])&IF(RC[-17]="",,"|n"&R1C16&RC[-17])&IF(RC[-16]="",,"|n"&R1C17&RC[-16])&IF(RC[-15]="",,"|n"&R1C18&RC[-15])&IF(RC[-14]="",,"|n"&R1C19&RC[-14])&IF(RC[-13]="",,"|n"&R1C20&RC[-13])&IF(RC[-12]="",,"|n"&R1C21&RC[-12])&IF(RC[-10]="",,"|n"&R1C23&RC[-10])&IF(RC[-9]="",,"|n"&R1C24&RC[-9])&IF(RC[-8]="",,"|n"&R1C25&RC[-8])&IF(RC[-7]="",,"|n"&R1C26&RC[-7])&IF(RC[-6]="",,"|n"&R1C27&RC[-6])&IF(RC[-5]="",,"|n"&R1C28&RC[-5])&IF(RC[-2]="",,"|n"&RC[-2]) -> 
AG684: =IF(RC[-26]&RC[-25]&RC[-24]&RC[-23]&RC[-22]&RC[-21]="",,R1C6)&IF(RC[-26]="",,"|n"&R1C7&RC[-26])&IF(RC[-25]="",,"|n"&R1C8&RC[-25])&IF(RC[-24]="",,"|n"&R1C9&RC[-24])&IF(RC[-23]="",,"|n"&R1C10&RC[-23])&IF(RC[-22]="",,"|n"&R1C11&RC[-22])&IF(RC[-21]="",,"|n"&R1C12&RC[-21])&IF(RC[-19]&RC[-18]&RC[-17]&RC[-16]="",,"|n"&R1C13)&IF(RC[-19]="",,"|n"&R1C14&RC[-19])&IF(RC[-18]="",,"|n"&R1C15&RC[-18])&IF(RC[-17]="",,"|n"&R1C16&RC[-17])&IF(RC[-16]="",,"|n"&R1C17&RC[-16])&IF(RC[-15]="",,"|n"&R1C18&RC[-15])&IF(RC[-14]="",,"|n"&R1C19&RC[-14])&IF(RC[-13]="",,"|n"&R1C20&RC[-13])&IF(RC[-12]="",,"|n"&R1C21&RC[-12])&IF(RC[-10]="",,"|n"&R1C23&RC[-10])&IF(RC[-9]="",,"|n"&R1C24&RC[-9])&IF(RC[-8]="",,"|n"&R1C25&RC[-8])&IF(RC[-7]="",,"|n"&R1C26&RC[-7])&IF(RC[-6]="",,"|n"&R1C27&RC[-6])&IF(RC[-5]="",,"|n"&R1C28&RC[-5])&IF(RC[-2]="",,"|n"&RC[-2]) -> 
AG685: =IF(RC[-26]&RC[-25]&RC[-24]&RC[-23]&RC[-22]&RC[-21]="",,R1C6)&IF(RC[-26]="",,"|n"&R1C7&RC[-26])&IF(RC[-25]="",,"|n"&R1C8&RC[-25])&IF(RC[-24]="",,"|n"&R1C9&RC[-24])&IF(RC[-23]="",,"|n"&R1C10&RC[-23])&IF(RC[-22]="",,"|n"&R1C11&RC[-22])&IF(RC[-21]="",,"|n"&R1C12&RC[-21])&IF(RC[-19]&RC[-18]&RC[-17]&RC[-16]="",,"|n"&R1C13)&IF(RC[-19]="",,"|n"&R1C14&RC[-19])&IF(RC[-18]="",,"|n"&R1C15&RC[-18])&IF(RC[-17]="",,"|n"&R1C16&RC[-17])&IF(RC[-16]="",,"|n"&R1C17&RC[-16])&IF(RC[-15]="",,"|n"&R1C18&RC[-15])&IF(RC[-14]="",,"|n"&R1C19&RC[-14])&IF(RC[-13]="",,"|n"&R1C20&RC[-13])&IF(RC[-12]="",,"|n"&R1C21&RC[-12])&IF(RC[-10]="",,"|n"&R1C23&RC[-10])&IF(RC[-9]="",,"|n"&R1C24&RC[-9])&IF(RC[-8]="",,"|n"&R1C25&RC[-8])&IF(RC[-7]="",,"|n"&R1C26&RC[-7])&IF(RC[-6]="",,"|n"&R1C27&RC[-6])&IF(RC[-5]="",,"|n"&R1C28&RC[-5])&IF(RC[-2]="",,"|n"&RC[-2]) -> 
AG686: =IF(RC[-26]&RC[-25]&RC[-24]&RC[-23]&RC[-22]&RC[-21]="",,R1C6)&IF(RC[-26]="",,"|n"&R1C7&RC[-26])&IF(RC[-25]="",,"|n"&R1C8&RC[-25])&IF(RC[-24]="",,"|n"&R1C9&RC[-24])&IF(RC[-23]="",,"|n"&R1C10&RC[-23])&IF(RC[-22]="",,"|n"&R1C11&RC[-22])&IF(RC[-21]="",,"|n"&R1C12&RC[-21])&IF(RC[-19]&RC[-18]&RC[-17]&RC[-16]="",,"|n"&R1C13)&IF(RC[-19]="",,"|n"&R1C14&RC[-19])&IF(RC[-18]="",,"|n"&R1C15&RC[-18])&IF(RC[-17]="",,"|n"&R1C16&RC[-17])&IF(RC[-16]="",,"|n"&R1C17&RC[-16])&IF(RC[-15]="",,"|n"&R1C18&RC[-15])&IF(RC[-14]="",,"|n"&R1C19&RC[-14])&IF(RC[-13]="",,"|n"&R1C20&RC[-13])&IF(RC[-12]="",,"|n"&R1C21&RC[-12])&IF(RC[-10]="",,"|n"&R1C23&RC[-10])&IF(RC[-9]="",,"|n"&R1C24&RC[-9])&IF(RC[-8]="",,"|n"&R1C25&RC[-8])&IF(RC[-7]="",,"|n"&R1C26&RC[-7])&IF(RC[-6]="",,"|n"&R1C27&RC[-6])&IF(RC[-5]="",,"|n"&R1C28&RC[-5])&IF(RC[-2]="",,"|n"&RC[-2]) -> 
AG687: =IF(RC[-26]&RC[-25]&RC[-24]&RC[-23]&RC[-22]&RC[-21]="",,R1C6)&IF(RC[-26]="",,"|n"&R1C7&RC[-26])&IF(RC[-25]="",,"|n"&R1C8&RC[-25])&IF(RC[-24]="",,"|n"&R1C9&RC[-24])&IF(RC[-23]="",,"|n"&R1C10&RC[-23])&IF(RC[-22]="",,"|n"&R1C11&RC[-22])&IF(RC[-21]="",,"|n"&R1C12&RC[-21])&IF(RC[-19]&RC[-18]&RC[-17]&RC[-16]="",,"|n"&R1C13)&IF(RC[-19]="",,"|n"&R1C14&RC[-19])&IF(RC[-18]="",,"|n"&R1C15&RC[-18])&IF(RC[-17]="",,"|n"&R1C16&RC[-17])&IF(RC[-16]="",,"|n"&R1C17&RC[-16])&IF(RC[-15]="",,"|n"&R1C18&RC[-15])&IF(RC[-14]="",,"|n"&R1C19&RC[-14])&IF(RC[-13]="",,"|n"&R1C20&RC[-13])&IF(RC[-12]="",,"|n"&R1C21&RC[-12])&IF(RC[-10]="",,"|n"&R1C23&RC[-10])&IF(RC[-9]="",,"|n"&R1C24&RC[-9])&IF(RC[-8]="",,"|n"&R1C25&RC[-8])&IF(RC[-7]="",,"|n"&R1C26&RC[-7])&IF(RC[-6]="",,"|n"&R1C27&RC[-6])&IF(RC[-5]="",,"|n"&R1C28&RC[-5])&IF(RC[-2]="",,"|n"&RC[-2]) -> 
AG688: =IF(RC[-26]&RC[-25]&RC[-24]&RC[-23]&RC[-22]&RC[-21]="",,R1C6)&IF(RC[-26]="",,"|n"&R1C7&RC[-26])&IF(RC[-25]="",,"|n"&R1C8&RC[-25])&IF(RC[-24]="",,"|n"&R1C9&RC[-24])&IF(RC[-23]="",,"|n"&R1C10&RC[-23])&IF(RC[-22]="",,"|n"&R1C11&RC[-22])&IF(RC[-21]="",,"|n"&R1C12&RC[-21])&IF(RC[-19]&RC[-18]&RC[-17]&RC[-16]="",,"|n"&R1C13)&IF(RC[-19]="",,"|n"&R1C14&RC[-19])&IF(RC[-18]="",,"|n"&R1C15&RC[-18])&IF(RC[-17]="",,"|n"&R1C16&RC[-17])&IF(RC[-16]="",,"|n"&R1C17&RC[-16])&IF(RC[-15]="",,"|n"&R1C18&RC[-15])&IF(RC[-14]="",,"|n"&R1C19&RC[-14])&IF(RC[-13]="",,"|n"&R1C20&RC[-13])&IF(RC[-12]="",,"|n"&R1C21&RC[-12])&IF(RC[-10]="",,"|n"&R1C23&RC[-10])&IF(RC[-9]="",,"|n"&R1C24&RC[-9])&IF(RC[-8]="",,"|n"&R1C25&RC[-8])&IF(RC[-7]="",,"|n"&R1C26&RC[-7])&IF(RC[-6]="",,"|n"&R1C27&RC[-6])&IF(RC[-5]="",,"|n"&R1C28&RC[-5])&IF(RC[-2]="",,"|n"&RC[-2]) -> 
AG689: =IF(RC[-26]&RC[-25]&RC[-24]&RC[-23]&RC[-22]&RC[-21]="",,R1C6)&IF(RC[-26]="",,"|n"&R1C7&RC[-26])&IF(RC[-25]="",,"|n"&R1C8&RC[-25])&IF(RC[-24]="",,"|n"&R1C9&RC[-24])&IF(RC[-23]="",,"|n"&R1C10&RC[-23])&IF(RC[-22]="",,"|n"&R1C11&RC[-22])&IF(RC[-21]="",,"|n"&R1C12&RC[-21])&IF(RC[-19]&RC[-18]&RC[-17]&RC[-16]="",,"|n"&R1C13)&IF(RC[-19]="",,"|n"&R1C14&RC[-19])&IF(RC[-18]="",,"|n"&R1C15&RC[-18])&IF(RC[-17]="",,"|n"&R1C16&RC[-17])&IF(RC[-16]="",,"|n"&R1C17&RC[-16])&IF(RC[-15]="",,"|n"&R1C18&RC[-15])&IF(RC[-14]="",,"|n"&R1C19&RC[-14])&IF(RC[-13]="",,"|n"&R1C20&RC[-13])&IF(RC[-12]="",,"|n"&R1C21&RC[-12])&IF(RC[-10]="",,"|n"&R1C23&RC[-10])&IF(RC[-9]="",,"|n"&R1C24&RC[-9])&IF(RC[-8]="",,"|n"&R1C25&RC[-8])&IF(RC[-7]="",,"|n"&R1C26&RC[-7])&IF(RC[-6]="",,"|n"&R1C27&RC[-6])&IF(RC[-5]="",,"|n"&R1C28&RC[-5])&IF(RC[-2]="",,"|n"&RC[-2]) -> 
AG690: =IF(RC[-26]&RC[-25]&RC[-24]&RC[-23]&RC[-22]&RC[-21]="",,R1C6)&IF(RC[-26]="",,"|n"&R1C7&RC[-26])&IF(RC[-25]="",,"|n"&R1C8&RC[-25])&IF(RC[-24]="",,"|n"&R1C9&RC[-24])&IF(RC[-23]="",,"|n"&R1C10&RC[-23])&IF(RC[-22]="",,"|n"&R1C11&RC[-22])&IF(RC[-21]="",,"|n"&R1C12&RC[-21])&IF(RC[-19]&RC[-18]&RC[-17]&RC[-16]="",,"|n"&R1C13)&IF(RC[-19]="",,"|n"&R1C14&RC[-19])&IF(RC[-18]="",,"|n"&R1C15&RC[-18])&IF(RC[-17]="",,"|n"&R1C16&RC[-17])&IF(RC[-16]="",,"|n"&R1C17&RC[-16])&IF(RC[-15]="",,"|n"&R1C18&RC[-15])&IF(RC[-14]="",,"|n"&R1C19&RC[-14])&IF(RC[-13]="",,"|n"&R1C20&RC[-13])&IF(RC[-12]="",,"|n"&R1C21&RC[-12])&IF(RC[-10]="",,"|n"&R1C23&RC[-10])&IF(RC[-9]="",,"|n"&R1C24&RC[-9])&IF(RC[-8]="",,"|n"&R1C25&RC[-8])&IF(RC[-7]="",,"|n"&R1C26&RC[-7])&IF(RC[-6]="",,"|n"&R1C27&RC[-6])&IF(RC[-5]="",,"|n"&R1C28&RC[-5])&IF(RC[-2]="",,"|n"&RC[-2]) -> 
AG691: =IF(RC[-26]&RC[-25]&RC[-24]&RC[-23]&RC[-22]&RC[-21]="",,R1C6)&IF(RC[-26]="",,"|n"&R1C7&RC[-26])&IF(RC[-25]="",,"|n"&R1C8&RC[-25])&IF(RC[-24]="",,"|n"&R1C9&RC[-24])&IF(RC[-23]="",,"|n"&R1C10&RC[-23])&IF(RC[-22]="",,"|n"&R1C11&RC[-22])&IF(RC[-21]="",,"|n"&R1C12&RC[-21])&IF(RC[-19]&RC[-18]&RC[-17]&RC[-16]="",,"|n"&R1C13)&IF(RC[-19]="",,"|n"&R1C14&RC[-19])&IF(RC[-18]="",,"|n"&R1C15&RC[-18])&IF(RC[-17]="",,"|n"&R1C16&RC[-17])&IF(RC[-16]="",,"|n"&R1C17&RC[-16])&IF(RC[-15]="",,"|n"&R1C18&RC[-15])&IF(RC[-14]="",,"|n"&R1C19&RC[-14])&IF(RC[-13]="",,"|n"&R1C20&RC[-13])&IF(RC[-12]="",,"|n"&R1C21&RC[-12])&IF(RC[-10]="",,"|n"&R1C23&RC[-10])&IF(RC[-9]="",,"|n"&R1C24&RC[-9])&IF(RC[-8]="",,"|n"&R1C25&RC[-8])&IF(RC[-7]="",,"|n"&R1C26&RC[-7])&IF(RC[-6]="",,"|n"&R1C27&RC[-6])&IF(RC[-5]="",,"|n"&R1C28&RC[-5])&IF(RC[-2]="",,"|n"&RC[-2]) -> 
AG692: =IF(RC[-26]&RC[-25]&RC[-24]&RC[-23]&RC[-22]&RC[-21]="",,R1C6)&IF(RC[-26]="",,"|n"&R1C7&RC[-26])&IF(RC[-25]="",,"|n"&R1C8&RC[-25])&IF(RC[-24]="",,"|n"&R1C9&RC[-24])&IF(RC[-23]="",,"|n"&R1C10&RC[-23])&IF(RC[-22]="",,"|n"&R1C11&RC[-22])&IF(RC[-21]="",,"|n"&R1C12&RC[-21])&IF(RC[-19]&RC[-18]&RC[-17]&RC[-16]="",,"|n"&R1C13)&IF(RC[-19]="",,"|n"&R1C14&RC[-19])&IF(RC[-18]="",,"|n"&R1C15&RC[-18])&IF(RC[-17]="",,"|n"&R1C16&RC[-17])&IF(RC[-16]="",,"|n"&R1C17&RC[-16])&IF(RC[-15]="",,"|n"&R1C18&RC[-15])&IF(RC[-14]="",,"|n"&R1C19&RC[-14])&IF(RC[-13]="",,"|n"&R1C20&RC[-13])&IF(RC[-12]="",,"|n"&R1C21&RC[-12])&IF(RC[-10]="",,"|n"&R1C23&RC[-10])&IF(RC[-9]="",,"|n"&R1C24&RC[-9])&IF(RC[-8]="",,"|n"&R1C25&RC[-8])&IF(RC[-7]="",,"|n"&R1C26&RC[-7])&IF(RC[-6]="",,"|n"&R1C27&RC[-6])&IF(RC[-5]="",,"|n"&R1C28&RC[-5])&IF(RC[-2]="",,"|n"&RC[-2]) -> 
AG693: =IF(RC[-26]&RC[-25]&RC[-24]&RC[-23]&RC[-22]&RC[-21]="",,R1C6)&IF(RC[-26]="",,"|n"&R1C7&RC[-26])&IF(RC[-25]="",,"|n"&R1C8&RC[-25])&IF(RC[-24]="",,"|n"&R1C9&RC[-24])&IF(RC[-23]="",,"|n"&R1C10&RC[-23])&IF(RC[-22]="",,"|n"&R1C11&RC[-22])&IF(RC[-21]="",,"|n"&R1C12&RC[-21])&IF(RC[-19]&RC[-18]&RC[-17]&RC[-16]="",,"|n"&R1C13)&IF(RC[-19]="",,"|n"&R1C14&RC[-19])&IF(RC[-18]="",,"|n"&R1C15&RC[-18])&IF(RC[-17]="",,"|n"&R1C16&RC[-17])&IF(RC[-16]="",,"|n"&R1C17&RC[-16])&IF(RC[-15]="",,"|n"&R1C18&RC[-15])&IF(RC[-14]="",,"|n"&R1C19&RC[-14])&IF(RC[-13]="",,"|n"&R1C20&RC[-13])&IF(RC[-12]="",,"|n"&R1C21&RC[-12])&IF(RC[-10]="",,"|n"&R1C23&RC[-10])&IF(RC[-9]="",,"|n"&R1C24&RC[-9])&IF(RC[-8]="",,"|n"&R1C25&RC[-8])&IF(RC[-7]="",,"|n"&R1C26&RC[-7])&IF(RC[-6]="",,"|n"&R1C27&RC[-6])&IF(RC[-5]="",,"|n"&R1C28&RC[-5])&IF(RC[-2]="",,"|n"&RC[-2]) -> 
AG694: =IF(RC[-26]&RC[-25]&RC[-24]&RC[-23]&RC[-22]&RC[-21]="",,R1C6)&IF(RC[-26]="",,"|n"&R1C7&RC[-26])&IF(RC[-25]="",,"|n"&R1C8&RC[-25])&IF(RC[-24]="",,"|n"&R1C9&RC[-24])&IF(RC[-23]="",,"|n"&R1C10&RC[-23])&IF(RC[-22]="",,"|n"&R1C11&RC[-22])&IF(RC[-21]="",,"|n"&R1C12&RC[-21])&IF(RC[-19]&RC[-18]&RC[-17]&RC[-16]="",,"|n"&R1C13)&IF(RC[-19]="",,"|n"&R1C14&RC[-19])&IF(RC[-18]="",,"|n"&R1C15&RC[-18])&IF(RC[-17]="",,"|n"&R1C16&RC[-17])&IF(RC[-16]="",,"|n"&R1C17&RC[-16])&IF(RC[-15]="",,"|n"&R1C18&RC[-15])&IF(RC[-14]="",,"|n"&R1C19&RC[-14])&IF(RC[-13]="",,"|n"&R1C20&RC[-13])&IF(RC[-12]="",,"|n"&R1C21&RC[-12])&IF(RC[-10]="",,"|n"&R1C23&RC[-10])&IF(RC[-9]="",,"|n"&R1C24&RC[-9])&IF(RC[-8]="",,"|n"&R1C25&RC[-8])&IF(RC[-7]="",,"|n"&R1C26&RC[-7])&IF(RC[-6]="",,"|n"&R1C27&RC[-6])&IF(RC[-5]="",,"|n"&R1C28&RC[-5])&IF(RC[-2]="",,"|n"&RC[-2]) -> 
AG695: =IF(RC[-26]&RC[-25]&RC[-24]&RC[-23]&RC[-22]&RC[-21]="",,R1C6)&IF(RC[-26]="",,"|n"&R1C7&RC[-26])&IF(RC[-25]="",,"|n"&R1C8&RC[-25])&IF(RC[-24]="",,"|n"&R1C9&RC[-24])&IF(RC[-23]="",,"|n"&R1C10&RC[-23])&IF(RC[-22]="",,"|n"&R1C11&RC[-22])&IF(RC[-21]="",,"|n"&R1C12&RC[-21])&IF(RC[-19]&RC[-18]&RC[-17]&RC[-16]="",,"|n"&R1C13)&IF(RC[-19]="",,"|n"&R1C14&RC[-19])&IF(RC[-18]="",,"|n"&R1C15&RC[-18])&IF(RC[-17]="",,"|n"&R1C16&RC[-17])&IF(RC[-16]="",,"|n"&R1C17&RC[-16])&IF(RC[-15]="",,"|n"&R1C18&RC[-15])&IF(RC[-14]="",,"|n"&R1C19&RC[-14])&IF(RC[-13]="",,"|n"&R1C20&RC[-13])&IF(RC[-12]="",,"|n"&R1C21&RC[-12])&IF(RC[-10]="",,"|n"&R1C23&RC[-10])&IF(RC[-9]="",,"|n"&R1C24&RC[-9])&IF(RC[-8]="",,"|n"&R1C25&RC[-8])&IF(RC[-7]="",,"|n"&R1C26&RC[-7])&IF(RC[-6]="",,"|n"&R1C27&RC[-6])&IF(RC[-5]="",,"|n"&R1C28&RC[-5])&IF(RC[-2]="",,"|n"&RC[-2]) -> 
AG696: =IF(RC[-26]&RC[-25]&RC[-24]&RC[-23]&RC[-22]&RC[-21]="",,R1C6)&IF(RC[-26]="",,"|n"&R1C7&RC[-26])&IF(RC[-25]="",,"|n"&R1C8&RC[-25])&IF(RC[-24]="",,"|n"&R1C9&RC[-24])&IF(RC[-23]="",,"|n"&R1C10&RC[-23])&IF(RC[-22]="",,"|n"&R1C11&RC[-22])&IF(RC[-21]="",,"|n"&R1C12&RC[-21])&IF(RC[-19]&RC[-18]&RC[-17]&RC[-16]="",,"|n"&R1C13)&IF(RC[-19]="",,"|n"&R1C14&RC[-19])&IF(RC[-18]="",,"|n"&R1C15&RC[-18])&IF(RC[-17]="",,"|n"&R1C16&RC[-17])&IF(RC[-16]="",,"|n"&R1C17&RC[-16])&IF(RC[-15]="",,"|n"&R1C18&RC[-15])&IF(RC[-14]="",,"|n"&R1C19&RC[-14])&IF(RC[-13]="",,"|n"&R1C20&RC[-13])&IF(RC[-12]="",,"|n"&R1C21&RC[-12])&IF(RC[-10]="",,"|n"&R1C23&RC[-10])&IF(RC[-9]="",,"|n"&R1C24&RC[-9])&IF(RC[-8]="",,"|n"&R1C25&RC[-8])&IF(RC[-7]="",,"|n"&R1C26&RC[-7])&IF(RC[-6]="",,"|n"&R1C27&RC[-6])&IF(RC[-5]="",,"|n"&R1C28&RC[-5])&IF(RC[-2]="",,"|n"&RC[-2]) -> 
AG697: =IF(RC[-26]&RC[-25]&RC[-24]&RC[-23]&RC[-22]&RC[-21]="",,R1C6)&IF(RC[-26]="",,"|n"&R1C7&RC[-26])&IF(RC[-25]="",,"|n"&R1C8&RC[-25])&IF(RC[-24]="",,"|n"&R1C9&RC[-24])&IF(RC[-23]="",,"|n"&R1C10&RC[-23])&IF(RC[-22]="",,"|n"&R1C11&RC[-22])&IF(RC[-21]="",,"|n"&R1C12&RC[-21])&IF(RC[-19]&RC[-18]&RC[-17]&RC[-16]="",,"|n"&R1C13)&IF(RC[-19]="",,"|n"&R1C14&RC[-19])&IF(RC[-18]="",,"|n"&R1C15&RC[-18])&IF(RC[-17]="",,"|n"&R1C16&RC[-17])&IF(RC[-16]="",,"|n"&R1C17&RC[-16])&IF(RC[-15]="",,"|n"&R1C18&RC[-15])&IF(RC[-14]="",,"|n"&R1C19&RC[-14])&IF(RC[-13]="",,"|n"&R1C20&RC[-13])&IF(RC[-12]="",,"|n"&R1C21&RC[-12])&IF(RC[-10]="",,"|n"&R1C23&RC[-10])&IF(RC[-9]="",,"|n"&R1C24&RC[-9])&IF(RC[-8]="",,"|n"&R1C25&RC[-8])&IF(RC[-7]="",,"|n"&R1C26&RC[-7])&IF(RC[-6]="",,"|n"&R1C27&RC[-6])&IF(RC[-5]="",,"|n"&R1C28&RC[-5])&IF(RC[-2]="",,"|n"&RC[-2]) -> 
AG698: =IF(RC[-26]&RC[-25]&RC[-24]&RC[-23]&RC[-22]&RC[-21]="",,R1C6)&IF(RC[-26]="",,"|n"&R1C7&RC[-26])&IF(RC[-25]="",,"|n"&R1C8&RC[-25])&IF(RC[-24]="",,"|n"&R1C9&RC[-24])&IF(RC[-23]="",,"|n"&R1C10&RC[-23])&IF(RC[-22]="",,"|n"&R1C11&RC[-22])&IF(RC[-21]="",,"|n"&R1C12&RC[-21])&IF(RC[-19]&RC[-18]&RC[-17]&RC[-16]="",,"|n"&R1C13)&IF(RC[-19]="",,"|n"&R1C14&RC[-19])&IF(RC[-18]="",,"|n"&R1C15&RC[-18])&IF(RC[-17]="",,"|n"&R1C16&RC[-17])&IF(RC[-16]="",,"|n"&R1C17&RC[-16])&IF(RC[-15]="",,"|n"&R1C18&RC[-15])&IF(RC[-14]="",,"|n"&R1C19&RC[-14])&IF(RC[-13]="",,"|n"&R1C20&RC[-13])&IF(RC[-12]="",,"|n"&R1C21&RC[-12])&IF(RC[-10]="",,"|n"&R1C23&RC[-10])&IF(RC[-9]="",,"|n"&R1C24&RC[-9])&IF(RC[-8]="",,"|n"&R1C25&RC[-8])&IF(RC[-7]="",,"|n"&R1C26&RC[-7])&IF(RC[-6]="",,"|n"&R1C27&RC[-6])&IF(RC[-5]="",,"|n"&R1C28&RC[-5])&IF(RC[-2]="",,"|n"&RC[-2]) -> 
AG699: =IF(RC[-26]&RC[-25]&RC[-24]&RC[-23]&RC[-22]&RC[-21]="",,R1C6)&IF(RC[-26]="",,"|n"&R1C7&RC[-26])&IF(RC[-25]="",,"|n"&R1C8&RC[-25])&IF(RC[-24]="",,"|n"&R1C9&RC[-24])&IF(RC[-23]="",,"|n"&R1C10&RC[-23])&IF(RC[-22]="",,"|n"&R1C11&RC[-22])&IF(RC[-21]="",,"|n"&R1C12&RC[-21])&IF(RC[-19]&RC[-18]&RC[-17]&RC[-16]="",,"|n"&R1C13)&IF(RC[-19]="",,"|n"&R1C14&RC[-19])&IF(RC[-18]="",,"|n"&R1C15&RC[-18])&IF(RC[-17]="",,"|n"&R1C16&RC[-17])&IF(RC[-16]="",,"|n"&R1C17&RC[-16])&IF(RC[-15]="",,"|n"&R1C18&RC[-15])&IF(RC[-14]="",,"|n"&R1C19&RC[-14])&IF(RC[-13]="",,"|n"&R1C20&RC[-13])&IF(RC[-12]="",,"|n"&R1C21&RC[-12])&IF(RC[-10]="",,"|n"&R1C23&RC[-10])&IF(RC[-9]="",,"|n"&R1C24&RC[-9])&IF(RC[-8]="",,"|n"&R1C25&RC[-8])&IF(RC[-7]="",,"|n"&R1C26&RC[-7])&IF(RC[-6]="",,"|n"&R1C27&RC[-6])&IF(RC[-5]="",,"|n"&R1C28&RC[-5])&IF(RC[-2]="",,"|n"&RC[-2]) -> 
AG700: =IF(RC[-26]&RC[-25]&RC[-24]&RC[-23]&RC[-22]&RC[-21]="",,R1C6)&IF(RC[-26]="",,"|n"&R1C7&RC[-26])&IF(RC[-25]="",,"|n"&R1C8&RC[-25])&IF(RC[-24]="",,"|n"&R1C9&RC[-24])&IF(RC[-23]="",,"|n"&R1C10&RC[-23])&IF(RC[-22]="",,"|n"&R1C11&RC[-22])&IF(RC[-21]="",,"|n"&R1C12&RC[-21])&IF(RC[-19]&RC[-18]&RC[-17]&RC[-16]="",,"|n"&R1C13)&IF(RC[-19]="",,"|n"&R1C14&RC[-19])&IF(RC[-18]="",,"|n"&R1C15&RC[-18])&IF(RC[-17]="",,"|n"&R1C16&RC[-17])&IF(RC[-16]="",,"|n"&R1C17&RC[-16])&IF(RC[-15]="",,"|n"&R1C18&RC[-15])&IF(RC[-14]="",,"|n"&R1C19&RC[-14])&IF(RC[-13]="",,"|n"&R1C20&RC[-13])&IF(RC[-12]="",,"|n"&R1C21&RC[-12])&IF(RC[-10]="",,"|n"&R1C23&RC[-10])&IF(RC[-9]="",,"|n"&R1C24&RC[-9])&IF(RC[-8]="",,"|n"&R1C25&RC[-8])&IF(RC[-7]="",,"|n"&R1C26&RC[-7])&IF(RC[-6]="",,"|n"&R1C27&RC[-6])&IF(RC[-5]="",,"|n"&R1C28&RC[-5])&IF(RC[-2]="",,"|n"&RC[-2]) -> 
AG701: =IF(RC[-26]&RC[-25]&RC[-24]&RC[-23]&RC[-22]&RC[-21]="",,R1C6)&IF(RC[-26]="",,"|n"&R1C7&RC[-26])&IF(RC[-25]="",,"|n"&R1C8&RC[-25])&IF(RC[-24]="",,"|n"&R1C9&RC[-24])&IF(RC[-23]="",,"|n"&R1C10&RC[-23])&IF(RC[-22]="",,"|n"&R1C11&RC[-22])&IF(RC[-21]="",,"|n"&R1C12&RC[-21])&IF(RC[-19]&RC[-18]&RC[-17]&RC[-16]="",,"|n"&R1C13)&IF(RC[-19]="",,"|n"&R1C14&RC[-19])&IF(RC[-18]="",,"|n"&R1C15&RC[-18])&IF(RC[-17]="",,"|n"&R1C16&RC[-17])&IF(RC[-16]="",,"|n"&R1C17&RC[-16])&IF(RC[-15]="",,"|n"&R1C18&RC[-15])&IF(RC[-14]="",,"|n"&R1C19&RC[-14])&IF(RC[-13]="",,"|n"&R1C20&RC[-13])&IF(RC[-12]="",,"|n"&R1C21&RC[-12])&IF(RC[-10]="",,"|n"&R1C23&RC[-10])&IF(RC[-9]="",,"|n"&R1C24&RC[-9])&IF(RC[-8]="",,"|n"&R1C25&RC[-8])&IF(RC[-7]="",,"|n"&R1C26&RC[-7])&IF(RC[-6]="",,"|n"&R1C27&RC[-6])&IF(RC[-5]="",,"|n"&R1C28&RC[-5])&IF(RC[-2]="",,"|n"&RC[-2]) -> 
AG702: =IF(RC[-26]&RC[-25]&RC[-24]&RC[-23]&RC[-22]&RC[-21]="",,R1C6)&IF(RC[-26]="",,"|n"&R1C7&RC[-26])&IF(RC[-25]="",,"|n"&R1C8&RC[-25])&IF(RC[-24]="",,"|n"&R1C9&RC[-24])&IF(RC[-23]="",,"|n"&R1C10&RC[-23])&IF(RC[-22]="",,"|n"&R1C11&RC[-22])&IF(RC[-21]="",,"|n"&R1C12&RC[-21])&IF(RC[-19]&RC[-18]&RC[-17]&RC[-16]="",,"|n"&R1C13)&IF(RC[-19]="",,"|n"&R1C14&RC[-19])&IF(RC[-18]="",,"|n"&R1C15&RC[-18])&IF(RC[-17]="",,"|n"&R1C16&RC[-17])&IF(RC[-16]="",,"|n"&R1C17&RC[-16])&IF(RC[-15]="",,"|n"&R1C18&RC[-15])&IF(RC[-14]="",,"|n"&R1C19&RC[-14])&IF(RC[-13]="",,"|n"&R1C20&RC[-13])&IF(RC[-12]="",,"|n"&R1C21&RC[-12])&IF(RC[-10]="",,"|n"&R1C23&RC[-10])&IF(RC[-9]="",,"|n"&R1C24&RC[-9])&IF(RC[-8]="",,"|n"&R1C25&RC[-8])&IF(RC[-7]="",,"|n"&R1C26&RC[-7])&IF(RC[-6]="",,"|n"&R1C27&RC[-6])&IF(RC[-5]="",,"|n"&R1C28&RC[-5])&IF(RC[-2]="",,"|n"&RC[-2]) -> 
AG703: =IF(RC[-26]&RC[-25]&RC[-24]&RC[-23]&RC[-22]&RC[-21]="",,R1C6)&IF(RC[-26]="",,"|n"&R1C7&RC[-26])&IF(RC[-25]="",,"|n"&R1C8&RC[-25])&IF(RC[-24]="",,"|n"&R1C9&RC[-24])&IF(RC[-23]="",,"|n"&R1C10&RC[-23])&IF(RC[-22]="",,"|n"&R1C11&RC[-22])&IF(RC[-21]="",,"|n"&R1C12&RC[-21])&IF(RC[-19]&RC[-18]&RC[-17]&RC[-16]="",,"|n"&R1C13)&IF(RC[-19]="",,"|n"&R1C14&RC[-19])&IF(RC[-18]="",,"|n"&R1C15&RC[-18])&IF(RC[-17]="",,"|n"&R1C16&RC[-17])&IF(RC[-16]="",,"|n"&R1C17&RC[-16])&IF(RC[-15]="",,"|n"&R1C18&RC[-15])&IF(RC[-14]="",,"|n"&R1C19&RC[-14])&IF(RC[-13]="",,"|n"&R1C20&RC[-13])&IF(RC[-12]="",,"|n"&R1C21&RC[-12])&IF(RC[-10]="",,"|n"&R1C23&RC[-10])&IF(RC[-9]="",,"|n"&R1C24&RC[-9])&IF(RC[-8]="",,"|n"&R1C25&RC[-8])&IF(RC[-7]="",,"|n"&R1C26&RC[-7])&IF(RC[-6]="",,"|n"&R1C27&RC[-6])&IF(RC[-5]="",,"|n"&R1C28&RC[-5])&IF(RC[-2]="",,"|n"&RC[-2]) -> 
AG704: =IF(RC[-26]&RC[-25]&RC[-24]&RC[-23]&RC[-22]&RC[-21]="",,R1C6)&IF(RC[-26]="",,"|n"&R1C7&RC[-26])&IF(RC[-25]="",,"|n"&R1C8&RC[-25])&IF(RC[-24]="",,"|n"&R1C9&RC[-24])&IF(RC[-23]="",,"|n"&R1C10&RC[-23])&IF(RC[-22]="",,"|n"&R1C11&RC[-22])&IF(RC[-21]="",,"|n"&R1C12&RC[-21])&IF(RC[-19]&RC[-18]&RC[-17]&RC[-16]="",,"|n"&R1C13)&IF(RC[-19]="",,"|n"&R1C14&RC[-19])&IF(RC[-18]="",,"|n"&R1C15&RC[-18])&IF(RC[-17]="",,"|n"&R1C16&RC[-17])&IF(RC[-16]="",,"|n"&R1C17&RC[-16])&IF(RC[-15]="",,"|n"&R1C18&RC[-15])&IF(RC[-14]="",,"|n"&R1C19&RC[-14])&IF(RC[-13]="",,"|n"&R1C20&RC[-13])&IF(RC[-12]="",,"|n"&R1C21&RC[-12])&IF(RC[-10]="",,"|n"&R1C23&RC[-10])&IF(RC[-9]="",,"|n"&R1C24&RC[-9])&IF(RC[-8]="",,"|n"&R1C25&RC[-8])&IF(RC[-7]="",,"|n"&R1C26&RC[-7])&IF(RC[-6]="",,"|n"&R1C27&RC[-6])&IF(RC[-5]="",,"|n"&R1C28&RC[-5])&IF(RC[-2]="",,"|n"&RC[-2]) -> 
AG705: =IF(RC[-26]&RC[-25]&RC[-24]&RC[-23]&RC[-22]&RC[-21]="",,R1C6)&IF(RC[-26]="",,"|n"&R1C7&RC[-26])&IF(RC[-25]="",,"|n"&R1C8&RC[-25])&IF(RC[-24]="",,"|n"&R1C9&RC[-24])&IF(RC[-23]="",,"|n"&R1C10&RC[-23])&IF(RC[-22]="",,"|n"&R1C11&RC[-22])&IF(RC[-21]="",,"|n"&R1C12&RC[-21])&IF(RC[-19]&RC[-18]&RC[-17]&RC[-16]="",,"|n"&R1C13)&IF(RC[-19]="",,"|n"&R1C14&RC[-19])&IF(RC[-18]="",,"|n"&R1C15&RC[-18])&IF(RC[-17]="",,"|n"&R1C16&RC[-17])&IF(RC[-16]="",,"|n"&R1C17&RC[-16])&IF(RC[-15]="",,"|n"&R1C18&RC[-15])&IF(RC[-14]="",,"|n"&R1C19&RC[-14])&IF(RC[-13]="",,"|n"&R1C20&RC[-13])&IF(RC[-12]="",,"|n"&R1C21&RC[-12])&IF(RC[-10]="",,"|n"&R1C23&RC[-10])&IF(RC[-9]="",,"|n"&R1C24&RC[-9])&IF(RC[-8]="",,"|n"&R1C25&RC[-8])&IF(RC[-7]="",,"|n"&R1C26&RC[-7])&IF(RC[-6]="",,"|n"&R1C27&RC[-6])&IF(RC[-5]="",,"|n"&R1C28&RC[-5])&IF(RC[-2]="",,"|n"&RC[-2]) -> 
AG706: =IF(RC[-26]&RC[-25]&RC[-24]&RC[-23]&RC[-22]&RC[-21]="",,R1C6)&IF(RC[-26]="",,"|n"&R1C7&RC[-26])&IF(RC[-25]="",,"|n"&R1C8&RC[-25])&IF(RC[-24]="",,"|n"&R1C9&RC[-24])&IF(RC[-23]="",,"|n"&R1C10&RC[-23])&IF(RC[-22]="",,"|n"&R1C11&RC[-22])&IF(RC[-21]="",,"|n"&R1C12&RC[-21])&IF(RC[-19]&RC[-18]&RC[-17]&RC[-16]="",,"|n"&R1C13)&IF(RC[-19]="",,"|n"&R1C14&RC[-19])&IF(RC[-18]="",,"|n"&R1C15&RC[-18])&IF(RC[-17]="",,"|n"&R1C16&RC[-17])&IF(RC[-16]="",,"|n"&R1C17&RC[-16])&IF(RC[-15]="",,"|n"&R1C18&RC[-15])&IF(RC[-14]="",,"|n"&R1C19&RC[-14])&IF(RC[-13]="",,"|n"&R1C20&RC[-13])&IF(RC[-12]="",,"|n"&R1C21&RC[-12])&IF(RC[-10]="",,"|n"&R1C23&RC[-10])&IF(RC[-9]="",,"|n"&R1C24&RC[-9])&IF(RC[-8]="",,"|n"&R1C25&RC[-8])&IF(RC[-7]="",,"|n"&R1C26&RC[-7])&IF(RC[-6]="",,"|n"&R1C27&RC[-6])&IF(RC[-5]="",,"|n"&R1C28&RC[-5])&IF(RC[-2]="",,"|n"&RC[-2]) -> 
AG707: =IF(RC[-26]&RC[-25]&RC[-24]&RC[-23]&RC[-22]&RC[-21]="",,R1C6)&IF(RC[-26]="",,"|n"&R1C7&RC[-26])&IF(RC[-25]="",,"|n"&R1C8&RC[-25])&IF(RC[-24]="",,"|n"&R1C9&RC[-24])&IF(RC[-23]="",,"|n"&R1C10&RC[-23])&IF(RC[-22]="",,"|n"&R1C11&RC[-22])&IF(RC[-21]="",,"|n"&R1C12&RC[-21])&IF(RC[-19]&RC[-18]&RC[-17]&RC[-16]="",,"|n"&R1C13)&IF(RC[-19]="",,"|n"&R1C14&RC[-19])&IF(RC[-18]="",,"|n"&R1C15&RC[-18])&IF(RC[-17]="",,"|n"&R1C16&RC[-17])&IF(RC[-16]="",,"|n"&R1C17&RC[-16])&IF(RC[-15]="",,"|n"&R1C18&RC[-15])&IF(RC[-14]="",,"|n"&R1C19&RC[-14])&IF(RC[-13]="",,"|n"&R1C20&RC[-13])&IF(RC[-12]="",,"|n"&R1C21&RC[-12])&IF(RC[-10]="",,"|n"&R1C23&RC[-10])&IF(RC[-9]="",,"|n"&R1C24&RC[-9])&IF(RC[-8]="",,"|n"&R1C25&RC[-8])&IF(RC[-7]="",,"|n"&R1C26&RC[-7])&IF(RC[-6]="",,"|n"&R1C27&RC[-6])&IF(RC[-5]="",,"|n"&R1C28&RC[-5])&IF(RC[-2]="",,"|n"&RC[-2]) -> 
AG708: =IF(RC[-26]&RC[-25]&RC[-24]&RC[-23]&RC[-22]&RC[-21]="",,R1C6)&IF(RC[-26]="",,"|n"&R1C7&RC[-26])&IF(RC[-25]="",,"|n"&R1C8&RC[-25])&IF(RC[-24]="",,"|n"&R1C9&RC[-24])&IF(RC[-23]="",,"|n"&R1C10&RC[-23])&IF(RC[-22]="",,"|n"&R1C11&RC[-22])&IF(RC[-21]="",,"|n"&R1C12&RC[-21])&IF(RC[-19]&RC[-18]&RC[-17]&RC[-16]="",,"|n"&R1C13)&IF(RC[-19]="",,"|n"&R1C14&RC[-19])&IF(RC[-18]="",,"|n"&R1C15&RC[-18])&IF(RC[-17]="",,"|n"&R1C16&RC[-17])&IF(RC[-16]="",,"|n"&R1C17&RC[-16])&IF(RC[-15]="",,"|n"&R1C18&RC[-15])&IF(RC[-14]="",,"|n"&R1C19&RC[-14])&IF(RC[-13]="",,"|n"&R1C20&RC[-13])&IF(RC[-12]="",,"|n"&R1C21&RC[-12])&IF(RC[-10]="",,"|n"&R1C23&RC[-10])&IF(RC[-9]="",,"|n"&R1C24&RC[-9])&IF(RC[-8]="",,"|n"&R1C25&RC[-8])&IF(RC[-7]="",,"|n"&R1C26&RC[-7])&IF(RC[-6]="",,"|n"&R1C27&RC[-6])&IF(RC[-5]="",,"|n"&R1C28&RC[-5])&IF(RC[-2]="",,"|n"&RC[-2]) -> 
AG709: =IF(RC[-26]&RC[-25]&RC[-24]&RC[-23]&RC[-22]&RC[-21]="",,R1C6)&IF(RC[-26]="",,"|n"&R1C7&RC[-26])&IF(RC[-25]="",,"|n"&R1C8&RC[-25])&IF(RC[-24]="",,"|n"&R1C9&RC[-24])&IF(RC[-23]="",,"|n"&R1C10&RC[-23])&IF(RC[-22]="",,"|n"&R1C11&RC[-22])&IF(RC[-21]="",,"|n"&R1C12&RC[-21])&IF(RC[-19]&RC[-18]&RC[-17]&RC[-16]="",,"|n"&R1C13)&IF(RC[-19]="",,"|n"&R1C14&RC[-19])&IF(RC[-18]="",,"|n"&R1C15&RC[-18])&IF(RC[-17]="",,"|n"&R1C16&RC[-17])&IF(RC[-16]="",,"|n"&R1C17&RC[-16])&IF(RC[-15]="",,"|n"&R1C18&RC[-15])&IF(RC[-14]="",,"|n"&R1C19&RC[-14])&IF(RC[-13]="",,"|n"&R1C20&RC[-13])&IF(RC[-12]="",,"|n"&R1C21&RC[-12])&IF(RC[-10]="",,"|n"&R1C23&RC[-10])&IF(RC[-9]="",,"|n"&R1C24&RC[-9])&IF(RC[-8]="",,"|n"&R1C25&RC[-8])&IF(RC[-7]="",,"|n"&R1C26&RC[-7])&IF(RC[-6]="",,"|n"&R1C27&RC[-6])&IF(RC[-5]="",,"|n"&R1C28&RC[-5])&IF(RC[-2]="",,"|n"&RC[-2]) -> 
AG710: =IF(RC[-26]&RC[-25]&RC[-24]&RC[-23]&RC[-22]&RC[-21]="",,R1C6)&IF(RC[-26]="",,"|n"&R1C7&RC[-26])&IF(RC[-25]="",,"|n"&R1C8&RC[-25])&IF(RC[-24]="",,"|n"&R1C9&RC[-24])&IF(RC[-23]="",,"|n"&R1C10&RC[-23])&IF(RC[-22]="",,"|n"&R1C11&RC[-22])&IF(RC[-21]="",,"|n"&R1C12&RC[-21])&IF(RC[-19]&RC[-18]&RC[-17]&RC[-16]="",,"|n"&R1C13)&IF(RC[-19]="",,"|n"&R1C14&RC[-19])&IF(RC[-18]="",,"|n"&R1C15&RC[-18])&IF(RC[-17]="",,"|n"&R1C16&RC[-17])&IF(RC[-16]="",,"|n"&R1C17&RC[-16])&IF(RC[-15]="",,"|n"&R1C18&RC[-15])&IF(RC[-14]="",,"|n"&R1C19&RC[-14])&IF(RC[-13]="",,"|n"&R1C20&RC[-13])&IF(RC[-12]="",,"|n"&R1C21&RC[-12])&IF(RC[-10]="",,"|n"&R1C23&RC[-10])&IF(RC[-9]="",,"|n"&R1C24&RC[-9])&IF(RC[-8]="",,"|n"&R1C25&RC[-8])&IF(RC[-7]="",,"|n"&R1C26&RC[-7])&IF(RC[-6]="",,"|n"&R1C27&RC[-6])&IF(RC[-5]="",,"|n"&R1C28&RC[-5])&IF(RC[-2]="",,"|n"&RC[-2]) -> 
AG711: =IF(RC[-26]&RC[-25]&RC[-24]&RC[-23]&RC[-22]&RC[-21]="",,R1C6)&IF(RC[-26]="",,"|n"&R1C7&RC[-26])&IF(RC[-25]="",,"|n"&R1C8&RC[-25])&IF(RC[-24]="",,"|n"&R1C9&RC[-24])&IF(RC[-23]="",,"|n"&R1C10&RC[-23])&IF(RC[-22]="",,"|n"&R1C11&RC[-22])&IF(RC[-21]="",,"|n"&R1C12&RC[-21])&IF(RC[-19]&RC[-18]&RC[-17]&RC[-16]="",,"|n"&R1C13)&IF(RC[-19]="",,"|n"&R1C14&RC[-19])&IF(RC[-18]="",,"|n"&R1C15&RC[-18])&IF(RC[-17]="",,"|n"&R1C16&RC[-17])&IF(RC[-16]="",,"|n"&R1C17&RC[-16])&IF(RC[-15]="",,"|n"&R1C18&RC[-15])&IF(RC[-14]="",,"|n"&R1C19&RC[-14])&IF(RC[-13]="",,"|n"&R1C20&RC[-13])&IF(RC[-12]="",,"|n"&R1C21&RC[-12])&IF(RC[-10]="",,"|n"&R1C23&RC[-10])&IF(RC[-9]="",,"|n"&R1C24&RC[-9])&IF(RC[-8]="",,"|n"&R1C25&RC[-8])&IF(RC[-7]="",,"|n"&R1C26&RC[-7])&IF(RC[-6]="",,"|n"&R1C27&RC[-6])&IF(RC[-5]="",,"|n"&R1C28&RC[-5])&IF(RC[-2]="",,"|n"&RC[-2]) -> 
AG712: =IF(RC[-26]&RC[-25]&RC[-24]&RC[-23]&RC[-22]&RC[-21]="",,R1C6)&IF(RC[-26]="",,"|n"&R1C7&RC[-26])&IF(RC[-25]="",,"|n"&R1C8&RC[-25])&IF(RC[-24]="",,"|n"&R1C9&RC[-24])&IF(RC[-23]="",,"|n"&R1C10&RC[-23])&IF(RC[-22]="",,"|n"&R1C11&RC[-22])&IF(RC[-21]="",,"|n"&R1C12&RC[-21])&IF(RC[-19]&RC[-18]&RC[-17]&RC[-16]="",,"|n"&R1C13)&IF(RC[-19]="",,"|n"&R1C14&RC[-19])&IF(RC[-18]="",,"|n"&R1C15&RC[-18])&IF(RC[-17]="",,"|n"&R1C16&RC[-17])&IF(RC[-16]="",,"|n"&R1C17&RC[-16])&IF(RC[-15]="",,"|n"&R1C18&RC[-15])&IF(RC[-14]="",,"|n"&R1C19&RC[-14])&IF(RC[-13]="",,"|n"&R1C20&RC[-13])&IF(RC[-12]="",,"|n"&R1C21&RC[-12])&IF(RC[-10]="",,"|n"&R1C23&RC[-10])&IF(RC[-9]="",,"|n"&R1C24&RC[-9])&IF(RC[-8]="",,"|n"&R1C25&RC[-8])&IF(RC[-7]="",,"|n"&R1C26&RC[-7])&IF(RC[-6]="",,"|n"&R1C27&RC[-6])&IF(RC[-5]="",,"|n"&R1C28&RC[-5])&IF(RC[-2]="",,"|n"&RC[-2]) -> 
AG713: =IF(RC[-26]&RC[-25]&RC[-24]&RC[-23]&RC[-22]&RC[-21]="",,R1C6)&IF(RC[-26]="",,"|n"&R1C7&RC[-26])&IF(RC[-25]="",,"|n"&R1C8&RC[-25])&IF(RC[-24]="",,"|n"&R1C9&RC[-24])&IF(RC[-23]="",,"|n"&R1C10&RC[-23])&IF(RC[-22]="",,"|n"&R1C11&RC[-22])&IF(RC[-21]="",,"|n"&R1C12&RC[-21])&IF(RC[-19]&RC[-18]&RC[-17]&RC[-16]="",,"|n"&R1C13)&IF(RC[-19]="",,"|n"&R1C14&RC[-19])&IF(RC[-18]="",,"|n"&R1C15&RC[-18])&IF(RC[-17]="",,"|n"&R1C16&RC[-17])&IF(RC[-16]="",,"|n"&R1C17&RC[-16])&IF(RC[-15]="",,"|n"&R1C18&RC[-15])&IF(RC[-14]="",,"|n"&R1C19&RC[-14])&IF(RC[-13]="",,"|n"&R1C20&RC[-13])&IF(RC[-12]="",,"|n"&R1C21&RC[-12])&IF(RC[-10]="",,"|n"&R1C23&RC[-10])&IF(RC[-9]="",,"|n"&R1C24&RC[-9])&IF(RC[-8]="",,"|n"&R1C25&RC[-8])&IF(RC[-7]="",,"|n"&R1C26&RC[-7])&IF(RC[-6]="",,"|n"&R1C27&RC[-6])&IF(RC[-5]="",,"|n"&R1C28&RC[-5])&IF(RC[-2]="",,"|n"&RC[-2]) -> 
AG714: =IF(RC[-26]&RC[-25]&RC[-24]&RC[-23]&RC[-22]&RC[-21]="",,R1C6)&IF(RC[-26]="",,"|n"&R1C7&RC[-26])&IF(RC[-25]="",,"|n"&R1C8&RC[-25])&IF(RC[-24]="",,"|n"&R1C9&RC[-24])&IF(RC[-23]="",,"|n"&R1C10&RC[-23])&IF(RC[-22]="",,"|n"&R1C11&RC[-22])&IF(RC[-21]="",,"|n"&R1C12&RC[-21])&IF(RC[-19]&RC[-18]&RC[-17]&RC[-16]="",,"|n"&R1C13)&IF(RC[-19]="",,"|n"&R1C14&RC[-19])&IF(RC[-18]="",,"|n"&R1C15&RC[-18])&IF(RC[-17]="",,"|n"&R1C16&RC[-17])&IF(RC[-16]="",,"|n"&R1C17&RC[-16])&IF(RC[-15]="",,"|n"&R1C18&RC[-15])&IF(RC[-14]="",,"|n"&R1C19&RC[-14])&IF(RC[-13]="",,"|n"&R1C20&RC[-13])&IF(RC[-12]="",,"|n"&R1C21&RC[-12])&IF(RC[-10]="",,"|n"&R1C23&RC[-10])&IF(RC[-9]="",,"|n"&R1C24&RC[-9])&IF(RC[-8]="",,"|n"&R1C25&RC[-8])&IF(RC[-7]="",,"|n"&R1C26&RC[-7])&IF(RC[-6]="",,"|n"&R1C27&RC[-6])&IF(RC[-5]="",,"|n"&R1C28&RC[-5])&IF(RC[-2]="",,"|n"&RC[-2]) -> 
AG715: =IF(RC[-26]&RC[-25]&RC[-24]&RC[-23]&RC[-22]&RC[-21]="",,R1C6)&IF(RC[-26]="",,"|n"&R1C7&RC[-26])&IF(RC[-25]="",,"|n"&R1C8&RC[-25])&IF(RC[-24]="",,"|n"&R1C9&RC[-24])&IF(RC[-23]="",,"|n"&R1C10&RC[-23])&IF(RC[-22]="",,"|n"&R1C11&RC[-22])&IF(RC[-21]="",,"|n"&R1C12&RC[-21])&IF(RC[-19]&RC[-18]&RC[-17]&RC[-16]="",,"|n"&R1C13)&IF(RC[-19]="",,"|n"&R1C14&RC[-19])&IF(RC[-18]="",,"|n"&R1C15&RC[-18])&IF(RC[-17]="",,"|n"&R1C16&RC[-17])&IF(RC[-16]="",,"|n"&R1C17&RC[-16])&IF(RC[-15]="",,"|n"&R1C18&RC[-15])&IF(RC[-14]="",,"|n"&R1C19&RC[-14])&IF(RC[-13]="",,"|n"&R1C20&RC[-13])&IF(RC[-12]="",,"|n"&R1C21&RC[-12])&IF(RC[-10]="",,"|n"&R1C23&RC[-10])&IF(RC[-9]="",,"|n"&R1C24&RC[-9])&IF(RC[-8]="",,"|n"&R1C25&RC[-8])&IF(RC[-7]="",,"|n"&R1C26&RC[-7])&IF(RC[-6]="",,"|n"&R1C27&RC[-6])&IF(RC[-5]="",,"|n"&R1C28&RC[-5])&IF(RC[-2]="",,"|n"&RC[-2]) -> 
AG716: =IF(RC[-26]&RC[-25]&RC[-24]&RC[-23]&RC[-22]&RC[-21]="",,R1C6)&IF(RC[-26]="",,"|n"&R1C7&RC[-26])&IF(RC[-25]="",,"|n"&R1C8&RC[-25])&IF(RC[-24]="",,"|n"&R1C9&RC[-24])&IF(RC[-23]="",,"|n"&R1C10&RC[-23])&IF(RC[-22]="",,"|n"&R1C11&RC[-22])&IF(RC[-21]="",,"|n"&R1C12&RC[-21])&IF(RC[-19]&RC[-18]&RC[-17]&RC[-16]="",,"|n"&R1C13)&IF(RC[-19]="",,"|n"&R1C14&RC[-19])&IF(RC[-18]="",,"|n"&R1C15&RC[-18])&IF(RC[-17]="",,"|n"&R1C16&RC[-17])&IF(RC[-16]="",,"|n"&R1C17&RC[-16])&IF(RC[-15]="",,"|n"&R1C18&RC[-15])&IF(RC[-14]="",,"|n"&R1C19&RC[-14])&IF(RC[-13]="",,"|n"&R1C20&RC[-13])&IF(RC[-12]="",,"|n"&R1C21&RC[-12])&IF(RC[-10]="",,"|n"&R1C23&RC[-10])&IF(RC[-9]="",,"|n"&R1C24&RC[-9])&IF(RC[-8]="",,"|n"&R1C25&RC[-8])&IF(RC[-7]="",,"|n"&R1C26&RC[-7])&IF(RC[-6]="",,"|n"&R1C27&RC[-6])&IF(RC[-5]="",,"|n"&R1C28&RC[-5])&IF(RC[-2]="",,"|n"&RC[-2]) -> 
AG717: =IF(RC[-26]&RC[-25]&RC[-24]&RC[-23]&RC[-22]&RC[-21]="",,R1C6)&IF(RC[-26]="",,"|n"&R1C7&RC[-26])&IF(RC[-25]="",,"|n"&R1C8&RC[-25])&IF(RC[-24]="",,"|n"&R1C9&RC[-24])&IF(RC[-23]="",,"|n"&R1C10&RC[-23])&IF(RC[-22]="",,"|n"&R1C11&RC[-22])&IF(RC[-21]="",,"|n"&R1C12&RC[-21])&IF(RC[-19]&RC[-18]&RC[-17]&RC[-16]="",,"|n"&R1C13)&IF(RC[-19]="",,"|n"&R1C14&RC[-19])&IF(RC[-18]="",,"|n"&R1C15&RC[-18])&IF(RC[-17]="",,"|n"&R1C16&RC[-17])&IF(RC[-16]="",,"|n"&R1C17&RC[-16])&IF(RC[-15]="",,"|n"&R1C18&RC[-15])&IF(RC[-14]="",,"|n"&R1C19&RC[-14])&IF(RC[-13]="",,"|n"&R1C20&RC[-13])&IF(RC[-12]="",,"|n"&R1C21&RC[-12])&IF(RC[-10]="",,"|n"&R1C23&RC[-10])&IF(RC[-9]="",,"|n"&R1C24&RC[-9])&IF(RC[-8]="",,"|n"&R1C25&RC[-8])&IF(RC[-7]="",,"|n"&R1C26&RC[-7])&IF(RC[-6]="",,"|n"&R1C27&RC[-6])&IF(RC[-5]="",,"|n"&R1C28&RC[-5])&IF(RC[-2]="",,"|n"&RC[-2]) -> 
AG718: =IF(RC[-26]&RC[-25]&RC[-24]&RC[-23]&RC[-22]&RC[-21]="",,R1C6)&IF(RC[-26]="",,"|n"&R1C7&RC[-26])&IF(RC[-25]="",,"|n"&R1C8&RC[-25])&IF(RC[-24]="",,"|n"&R1C9&RC[-24])&IF(RC[-23]="",,"|n"&R1C10&RC[-23])&IF(RC[-22]="",,"|n"&R1C11&RC[-22])&IF(RC[-21]="",,"|n"&R1C12&RC[-21])&IF(RC[-19]&RC[-18]&RC[-17]&RC[-16]="",,"|n"&R1C13)&IF(RC[-19]="",,"|n"&R1C14&RC[-19])&IF(RC[-18]="",,"|n"&R1C15&RC[-18])&IF(RC[-17]="",,"|n"&R1C16&RC[-17])&IF(RC[-16]="",,"|n"&R1C17&RC[-16])&IF(RC[-15]="",,"|n"&R1C18&RC[-15])&IF(RC[-14]="",,"|n"&R1C19&RC[-14])&IF(RC[-13]="",,"|n"&R1C20&RC[-13])&IF(RC[-12]="",,"|n"&R1C21&RC[-12])&IF(RC[-10]="",,"|n"&R1C23&RC[-10])&IF(RC[-9]="",,"|n"&R1C24&RC[-9])&IF(RC[-8]="",,"|n"&R1C25&RC[-8])&IF(RC[-7]="",,"|n"&R1C26&RC[-7])&IF(RC[-6]="",,"|n"&R1C27&RC[-6])&IF(RC[-5]="",,"|n"&R1C28&RC[-5])&IF(RC[-2]="",,"|n"&RC[-2]) -> 
AG719: =IF(RC[-26]&RC[-25]&RC[-24]&RC[-23]&RC[-22]&RC[-21]="",,R1C6)&IF(RC[-26]="",,"|n"&R1C7&RC[-26])&IF(RC[-25]="",,"|n"&R1C8&RC[-25])&IF(RC[-24]="",,"|n"&R1C9&RC[-24])&IF(RC[-23]="",,"|n"&R1C10&RC[-23])&IF(RC[-22]="",,"|n"&R1C11&RC[-22])&IF(RC[-21]="",,"|n"&R1C12&RC[-21])&IF(RC[-19]&RC[-18]&RC[-17]&RC[-16]="",,"|n"&R1C13)&IF(RC[-19]="",,"|n"&R1C14&RC[-19])&IF(RC[-18]="",,"|n"&R1C15&RC[-18])&IF(RC[-17]="",,"|n"&R1C16&RC[-17])&IF(RC[-16]="",,"|n"&R1C17&RC[-16])&IF(RC[-15]="",,"|n"&R1C18&RC[-15])&IF(RC[-14]="",,"|n"&R1C19&RC[-14])&IF(RC[-13]="",,"|n"&R1C20&RC[-13])&IF(RC[-12]="",,"|n"&R1C21&RC[-12])&IF(RC[-10]="",,"|n"&R1C23&RC[-10])&IF(RC[-9]="",,"|n"&R1C24&RC[-9])&IF(RC[-8]="",,"|n"&R1C25&RC[-8])&IF(RC[-7]="",,"|n"&R1C26&RC[-7])&IF(RC[-6]="",,"|n"&R1C27&RC[-6])&IF(RC[-5]="",,"|n"&R1C28&RC[-5])&IF(RC[-2]="",,"|n"&RC[-2]) -> 
AG720: =IF(RC[-26]&RC[-25]&RC[-24]&RC[-23]&RC[-22]&RC[-21]="",,R1C6)&IF(RC[-26]="",,"|n"&R1C7&RC[-26])&IF(RC[-25]="",,"|n"&R1C8&RC[-25])&IF(RC[-24]="",,"|n"&R1C9&RC[-24])&IF(RC[-23]="",,"|n"&R1C10&RC[-23])&IF(RC[-22]="",,"|n"&R1C11&RC[-22])&IF(RC[-21]="",,"|n"&R1C12&RC[-21])&IF(RC[-19]&RC[-18]&RC[-17]&RC[-16]="",,"|n"&R1C13)&IF(RC[-19]="",,"|n"&R1C14&RC[-19])&IF(RC[-18]="",,"|n"&R1C15&RC[-18])&IF(RC[-17]="",,"|n"&R1C16&RC[-17])&IF(RC[-16]="",,"|n"&R1C17&RC[-16])&IF(RC[-15]="",,"|n"&R1C18&RC[-15])&IF(RC[-14]="",,"|n"&R1C19&RC[-14])&IF(RC[-13]="",,"|n"&R1C20&RC[-13])&IF(RC[-12]="",,"|n"&R1C21&RC[-12])&IF(RC[-10]="",,"|n"&R1C23&RC[-10])&IF(RC[-9]="",,"|n"&R1C24&RC[-9])&IF(RC[-8]="",,"|n"&R1C25&RC[-8])&IF(RC[-7]="",,"|n"&R1C26&RC[-7])&IF(RC[-6]="",,"|n"&R1C27&RC[-6])&IF(RC[-5]="",,"|n"&R1C28&RC[-5])&IF(RC[-2]="",,"|n"&RC[-2]) -> 
AG721: =IF(RC[-26]&RC[-25]&RC[-24]&RC[-23]&RC[-22]&RC[-21]="",,R1C6)&IF(RC[-26]="",,"|n"&R1C7&RC[-26])&IF(RC[-25]="",,"|n"&R1C8&RC[-25])&IF(RC[-24]="",,"|n"&R1C9&RC[-24])&IF(RC[-23]="",,"|n"&R1C10&RC[-23])&IF(RC[-22]="",,"|n"&R1C11&RC[-22])&IF(RC[-21]="",,"|n"&R1C12&RC[-21])&IF(RC[-19]&RC[-18]&RC[-17]&RC[-16]="",,"|n"&R1C13)&IF(RC[-19]="",,"|n"&R1C14&RC[-19])&IF(RC[-18]="",,"|n"&R1C15&RC[-18])&IF(RC[-17]="",,"|n"&R1C16&RC[-17])&IF(RC[-16]="",,"|n"&R1C17&RC[-16])&IF(RC[-15]="",,"|n"&R1C18&RC[-15])&IF(RC[-14]="",,"|n"&R1C19&RC[-14])&IF(RC[-13]="",,"|n"&R1C20&RC[-13])&IF(RC[-12]="",,"|n"&R1C21&RC[-12])&IF(RC[-10]="",,"|n"&R1C23&RC[-10])&IF(RC[-9]="",,"|n"&R1C24&RC[-9])&IF(RC[-8]="",,"|n"&R1C25&RC[-8])&IF(RC[-7]="",,"|n"&R1C26&RC[-7])&IF(RC[-6]="",,"|n"&R1C27&RC[-6])&IF(RC[-5]="",,"|n"&R1C28&RC[-5])&IF(RC[-2]="",,"|n"&RC[-2]) -> 
AG722: =IF(RC[-26]&RC[-25]&RC[-24]&RC[-23]&RC[-22]&RC[-21]="",,R1C6)&IF(RC[-26]="",,"|n"&R1C7&RC[-26])&IF(RC[-25]="",,"|n"&R1C8&RC[-25])&IF(RC[-24]="",,"|n"&R1C9&RC[-24])&IF(RC[-23]="",,"|n"&R1C10&RC[-23])&IF(RC[-22]="",,"|n"&R1C11&RC[-22])&IF(RC[-21]="",,"|n"&R1C12&RC[-21])&IF(RC[-19]&RC[-18]&RC[-17]&RC[-16]="",,"|n"&R1C13)&IF(RC[-19]="",,"|n"&R1C14&RC[-19])&IF(RC[-18]="",,"|n"&R1C15&RC[-18])&IF(RC[-17]="",,"|n"&R1C16&RC[-17])&IF(RC[-16]="",,"|n"&R1C17&RC[-16])&IF(RC[-15]="",,"|n"&R1C18&RC[-15])&IF(RC[-14]="",,"|n"&R1C19&RC[-14])&IF(RC[-13]="",,"|n"&R1C20&RC[-13])&IF(RC[-12]="",,"|n"&R1C21&RC[-12])&IF(RC[-10]="",,"|n"&R1C23&RC[-10])&IF(RC[-9]="",,"|n"&R1C24&RC[-9])&IF(RC[-8]="",,"|n"&R1C25&RC[-8])&IF(RC[-7]="",,"|n"&R1C26&RC[-7])&IF(RC[-6]="",,"|n"&R1C27&RC[-6])&IF(RC[-5]="",,"|n"&R1C28&RC[-5])&IF(RC[-2]="",,"|n"&RC[-2]) -> 
AG723: =IF(RC[-26]&RC[-25]&RC[-24]&RC[-23]&RC[-22]&RC[-21]="",,R1C6)&IF(RC[-26]="",,"|n"&R1C7&RC[-26])&IF(RC[-25]="",,"|n"&R1C8&RC[-25])&IF(RC[-24]="",,"|n"&R1C9&RC[-24])&IF(RC[-23]="",,"|n"&R1C10&RC[-23])&IF(RC[-22]="",,"|n"&R1C11&RC[-22])&IF(RC[-21]="",,"|n"&R1C12&RC[-21])&IF(RC[-19]&RC[-18]&RC[-17]&RC[-16]="",,"|n"&R1C13)&IF(RC[-19]="",,"|n"&R1C14&RC[-19])&IF(RC[-18]="",,"|n"&R1C15&RC[-18])&IF(RC[-17]="",,"|n"&R1C16&RC[-17])&IF(RC[-16]="",,"|n"&R1C17&RC[-16])&IF(RC[-15]="",,"|n"&R1C18&RC[-15])&IF(RC[-14]="",,"|n"&R1C19&RC[-14])&IF(RC[-13]="",,"|n"&R1C20&RC[-13])&IF(RC[-12]="",,"|n"&R1C21&RC[-12])&IF(RC[-10]="",,"|n"&R1C23&RC[-10])&IF(RC[-9]="",,"|n"&R1C24&RC[-9])&IF(RC[-8]="",,"|n"&R1C25&RC[-8])&IF(RC[-7]="",,"|n"&R1C26&RC[-7])&IF(RC[-6]="",,"|n"&R1C27&RC[-6])&IF(RC[-5]="",,"|n"&R1C28&RC[-5])&IF(RC[-2]="",,"|n"&RC[-2]) -> 
AG724: =IF(RC[-26]&RC[-25]&RC[-24]&RC[-23]&RC[-22]&RC[-21]="",,R1C6)&IF(RC[-26]="",,"|n"&R1C7&RC[-26])&IF(RC[-25]="",,"|n"&R1C8&RC[-25])&IF(RC[-24]="",,"|n"&R1C9&RC[-24])&IF(RC[-23]="",,"|n"&R1C10&RC[-23])&IF(RC[-22]="",,"|n"&R1C11&RC[-22])&IF(RC[-21]="",,"|n"&R1C12&RC[-21])&IF(RC[-19]&RC[-18]&RC[-17]&RC[-16]="",,"|n"&R1C13)&IF(RC[-19]="",,"|n"&R1C14&RC[-19])&IF(RC[-18]="",,"|n"&R1C15&RC[-18])&IF(RC[-17]="",,"|n"&R1C16&RC[-17])&IF(RC[-16]="",,"|n"&R1C17&RC[-16])&IF(RC[-15]="",,"|n"&R1C18&RC[-15])&IF(RC[-14]="",,"|n"&R1C19&RC[-14])&IF(RC[-13]="",,"|n"&R1C20&RC[-13])&IF(RC[-12]="",,"|n"&R1C21&RC[-12])&IF(RC[-10]="",,"|n"&R1C23&RC[-10])&IF(RC[-9]="",,"|n"&R1C24&RC[-9])&IF(RC[-8]="",,"|n"&R1C25&RC[-8])&IF(RC[-7]="",,"|n"&R1C26&RC[-7])&IF(RC[-6]="",,"|n"&R1C27&RC[-6])&IF(RC[-5]="",,"|n"&R1C28&RC[-5])&IF(RC[-2]="",,"|n"&RC[-2]) -> 
AG725: =IF(RC[-26]&RC[-25]&RC[-24]&RC[-23]&RC[-22]&RC[-21]="",,R1C6)&IF(RC[-26]="",,"|n"&R1C7&RC[-26])&IF(RC[-25]="",,"|n"&R1C8&RC[-25])&IF(RC[-24]="",,"|n"&R1C9&RC[-24])&IF(RC[-23]="",,"|n"&R1C10&RC[-23])&IF(RC[-22]="",,"|n"&R1C11&RC[-22])&IF(RC[-21]="",,"|n"&R1C12&RC[-21])&IF(RC[-19]&RC[-18]&RC[-17]&RC[-16]="",,"|n"&R1C13)&IF(RC[-19]="",,"|n"&R1C14&RC[-19])&IF(RC[-18]="",,"|n"&R1C15&RC[-18])&IF(RC[-17]="",,"|n"&R1C16&RC[-17])&IF(RC[-16]="",,"|n"&R1C17&RC[-16])&IF(RC[-15]="",,"|n"&R1C18&RC[-15])&IF(RC[-14]="",,"|n"&R1C19&RC[-14])&IF(RC[-13]="",,"|n"&R1C20&RC[-13])&IF(RC[-12]="",,"|n"&R1C21&RC[-12])&IF(RC[-10]="",,"|n"&R1C23&RC[-10])&IF(RC[-9]="",,"|n"&R1C24&RC[-9])&IF(RC[-8]="",,"|n"&R1C25&RC[-8])&IF(RC[-7]="",,"|n"&R1C26&RC[-7])&IF(RC[-6]="",,"|n"&R1C27&RC[-6])&IF(RC[-5]="",,"|n"&R1C28&RC[-5])&IF(RC[-2]="",,"|n"&RC[-2]) -> 
AG726: =IF(RC[-26]&RC[-25]&RC[-24]&RC[-23]&RC[-22]&RC[-21]="",,R1C6)&IF(RC[-26]="",,"|n"&R1C7&RC[-26])&IF(RC[-25]="",,"|n"&R1C8&RC[-25])&IF(RC[-24]="",,"|n"&R1C9&RC[-24])&IF(RC[-23]="",,"|n"&R1C10&RC[-23])&IF(RC[-22]="",,"|n"&R1C11&RC[-22])&IF(RC[-21]="",,"|n"&R1C12&RC[-21])&IF(RC[-19]&RC[-18]&RC[-17]&RC[-16]="",,"|n"&R1C13)&IF(RC[-19]="",,"|n"&R1C14&RC[-19])&IF(RC[-18]="",,"|n"&R1C15&RC[-18])&IF(RC[-17]="",,"|n"&R1C16&RC[-17])&IF(RC[-16]="",,"|n"&R1C17&RC[-16])&IF(RC[-15]="",,"|n"&R1C18&RC[-15])&IF(RC[-14]="",,"|n"&R1C19&RC[-14])&IF(RC[-13]="",,"|n"&R1C20&RC[-13])&IF(RC[-12]="",,"|n"&R1C21&RC[-12])&IF(RC[-10]="",,"|n"&R1C23&RC[-10])&IF(RC[-9]="",,"|n"&R1C24&RC[-9])&IF(RC[-8]="",,"|n"&R1C25&RC[-8])&IF(RC[-7]="",,"|n"&R1C26&RC[-7])&IF(RC[-6]="",,"|n"&R1C27&RC[-6])&IF(RC[-5]="",,"|n"&R1C28&RC[-5])&IF(RC[-2]="",,"|n"&RC[-2]) -> 
AG727: =IF(RC[-26]&RC[-25]&RC[-24]&RC[-23]&RC[-22]&RC[-21]="",,R1C6)&IF(RC[-26]="",,"|n"&R1C7&RC[-26])&IF(RC[-25]="",,"|n"&R1C8&RC[-25])&IF(RC[-24]="",,"|n"&R1C9&RC[-24])&IF(RC[-23]="",,"|n"&R1C10&RC[-23])&IF(RC[-22]="",,"|n"&R1C11&RC[-22])&IF(RC[-21]="",,"|n"&R1C12&RC[-21])&IF(RC[-19]&RC[-18]&RC[-17]&RC[-16]="",,"|n"&R1C13)&IF(RC[-19]="",,"|n"&R1C14&RC[-19])&IF(RC[-18]="",,"|n"&R1C15&RC[-18])&IF(RC[-17]="",,"|n"&R1C16&RC[-17])&IF(RC[-16]="",,"|n"&R1C17&RC[-16])&IF(RC[-15]="",,"|n"&R1C18&RC[-15])&IF(RC[-14]="",,"|n"&R1C19&RC[-14])&IF(RC[-13]="",,"|n"&R1C20&RC[-13])&IF(RC[-12]="",,"|n"&R1C21&RC[-12])&IF(RC[-10]="",,"|n"&R1C23&RC[-10])&IF(RC[-9]="",,"|n"&R1C24&RC[-9])&IF(RC[-8]="",,"|n"&R1C25&RC[-8])&IF(RC[-7]="",,"|n"&R1C26&RC[-7])&IF(RC[-6]="",,"|n"&R1C27&RC[-6])&IF(RC[-5]="",,"|n"&R1C28&RC[-5])&IF(RC[-2]="",,"|n"&RC[-2]) -> 
AG728: =IF(RC[-26]&RC[-25]&RC[-24]&RC[-23]&RC[-22]&RC[-21]="",,R1C6)&IF(RC[-26]="",,"|n"&R1C7&RC[-26])&IF(RC[-25]="",,"|n"&R1C8&RC[-25])&IF(RC[-24]="",,"|n"&R1C9&RC[-24])&IF(RC[-23]="",,"|n"&R1C10&RC[-23])&IF(RC[-22]="",,"|n"&R1C11&RC[-22])&IF(RC[-21]="",,"|n"&R1C12&RC[-21])&IF(RC[-19]&RC[-18]&RC[-17]&RC[-16]="",,"|n"&R1C13)&IF(RC[-19]="",,"|n"&R1C14&RC[-19])&IF(RC[-18]="",,"|n"&R1C15&RC[-18])&IF(RC[-17]="",,"|n"&R1C16&RC[-17])&IF(RC[-16]="",,"|n"&R1C17&RC[-16])&IF(RC[-15]="",,"|n"&R1C18&RC[-15])&IF(RC[-14]="",,"|n"&R1C19&RC[-14])&IF(RC[-13]="",,"|n"&R1C20&RC[-13])&IF(RC[-12]="",,"|n"&R1C21&RC[-12])&IF(RC[-10]="",,"|n"&R1C23&RC[-10])&IF(RC[-9]="",,"|n"&R1C24&RC[-9])&IF(RC[-8]="",,"|n"&R1C25&RC[-8])&IF(RC[-7]="",,"|n"&R1C26&RC[-7])&IF(RC[-6]="",,"|n"&R1C27&RC[-6])&IF(RC[-5]="",,"|n"&R1C28&RC[-5])&IF(RC[-2]="",,"|n"&RC[-2]) -> 
AG729: =IF(RC[-26]&RC[-25]&RC[-24]&RC[-23]&RC[-22]&RC[-21]="",,R1C6)&IF(RC[-26]="",,"|n"&R1C7&RC[-26])&IF(RC[-25]="",,"|n"&R1C8&RC[-25])&IF(RC[-24]="",,"|n"&R1C9&RC[-24])&IF(RC[-23]="",,"|n"&R1C10&RC[-23])&IF(RC[-22]="",,"|n"&R1C11&RC[-22])&IF(RC[-21]="",,"|n"&R1C12&RC[-21])&IF(RC[-19]&RC[-18]&RC[-17]&RC[-16]="",,"|n"&R1C13)&IF(RC[-19]="",,"|n"&R1C14&RC[-19])&IF(RC[-18]="",,"|n"&R1C15&RC[-18])&IF(RC[-17]="",,"|n"&R1C16&RC[-17])&IF(RC[-16]="",,"|n"&R1C17&RC[-16])&IF(RC[-15]="",,"|n"&R1C18&RC[-15])&IF(RC[-14]="",,"|n"&R1C19&RC[-14])&IF(RC[-13]="",,"|n"&R1C20&RC[-13])&IF(RC[-12]="",,"|n"&R1C21&RC[-12])&IF(RC[-10]="",,"|n"&R1C23&RC[-10])&IF(RC[-9]="",,"|n"&R1C24&RC[-9])&IF(RC[-8]="",,"|n"&R1C25&RC[-8])&IF(RC[-7]="",,"|n"&R1C26&RC[-7])&IF(RC[-6]="",,"|n"&R1C27&RC[-6])&IF(RC[-5]="",,"|n"&R1C28&RC[-5])&IF(RC[-2]="",,"|n"&RC[-2]) -> 
AG730: =IF(RC[-26]&RC[-25]&RC[-24]&RC[-23]&RC[-22]&RC[-21]="",,R1C6)&IF(RC[-26]="",,"|n"&R1C7&RC[-26])&IF(RC[-25]="",,"|n"&R1C8&RC[-25])&IF(RC[-24]="",,"|n"&R1C9&RC[-24])&IF(RC[-23]="",,"|n"&R1C10&RC[-23])&IF(RC[-22]="",,"|n"&R1C11&RC[-22])&IF(RC[-21]="",,"|n"&R1C12&RC[-21])&IF(RC[-19]&RC[-18]&RC[-17]&RC[-16]="",,"|n"&R1C13)&IF(RC[-19]="",,"|n"&R1C14&RC[-19])&IF(RC[-18]="",,"|n"&R1C15&RC[-18])&IF(RC[-17]="",,"|n"&R1C16&RC[-17])&IF(RC[-16]="",,"|n"&R1C17&RC[-16])&IF(RC[-15]="",,"|n"&R1C18&RC[-15])&IF(RC[-14]="",,"|n"&R1C19&RC[-14])&IF(RC[-13]="",,"|n"&R1C20&RC[-13])&IF(RC[-12]="",,"|n"&R1C21&RC[-12])&IF(RC[-10]="",,"|n"&R1C23&RC[-10])&IF(RC[-9]="",,"|n"&R1C24&RC[-9])&IF(RC[-8]="",,"|n"&R1C25&RC[-8])&IF(RC[-7]="",,"|n"&R1C26&RC[-7])&IF(RC[-6]="",,"|n"&R1C27&RC[-6])&IF(RC[-5]="",,"|n"&R1C28&RC[-5])&IF(RC[-2]="",,"|n"&RC[-2]) -> 
AG731: =IF(RC[-26]&RC[-25]&RC[-24]&RC[-23]&RC[-22]&RC[-21]="",,R1C6)&IF(RC[-26]="",,"|n"&R1C7&RC[-26])&IF(RC[-25]="",,"|n"&R1C8&RC[-25])&IF(RC[-24]="",,"|n"&R1C9&RC[-24])&IF(RC[-23]="",,"|n"&R1C10&RC[-23])&IF(RC[-22]="",,"|n"&R1C11&RC[-22])&IF(RC[-21]="",,"|n"&R1C12&RC[-21])&IF(RC[-19]&RC[-18]&RC[-17]&RC[-16]="",,"|n"&R1C13)&IF(RC[-19]="",,"|n"&R1C14&RC[-19])&IF(RC[-18]="",,"|n"&R1C15&RC[-18])&IF(RC[-17]="",,"|n"&R1C16&RC[-17])&IF(RC[-16]="",,"|n"&R1C17&RC[-16])&IF(RC[-15]="",,"|n"&R1C18&RC[-15])&IF(RC[-14]="",,"|n"&R1C19&RC[-14])&IF(RC[-13]="",,"|n"&R1C20&RC[-13])&IF(RC[-12]="",,"|n"&R1C21&RC[-12])&IF(RC[-10]="",,"|n"&R1C23&RC[-10])&IF(RC[-9]="",,"|n"&R1C24&RC[-9])&IF(RC[-8]="",,"|n"&R1C25&RC[-8])&IF(RC[-7]="",,"|n"&R1C26&RC[-7])&IF(RC[-6]="",,"|n"&R1C27&RC[-6])&IF(RC[-5]="",,"|n"&R1C28&RC[-5])&IF(RC[-2]="",,"|n"&RC[-2]) -> 
AG732: =IF(RC[-26]&RC[-25]&RC[-24]&RC[-23]&RC[-22]&RC[-21]="",,R1C6)&IF(RC[-26]="",,"|n"&R1C7&RC[-26])&IF(RC[-25]="",,"|n"&R1C8&RC[-25])&IF(RC[-24]="",,"|n"&R1C9&RC[-24])&IF(RC[-23]="",,"|n"&R1C10&RC[-23])&IF(RC[-22]="",,"|n"&R1C11&RC[-22])&IF(RC[-21]="",,"|n"&R1C12&RC[-21])&IF(RC[-19]&RC[-18]&RC[-17]&RC[-16]="",,"|n"&R1C13)&IF(RC[-19]="",,"|n"&R1C14&RC[-19])&IF(RC[-18]="",,"|n"&R1C15&RC[-18])&IF(RC[-17]="",,"|n"&R1C16&RC[-17])&IF(RC[-16]="",,"|n"&R1C17&RC[-16])&IF(RC[-15]="",,"|n"&R1C18&RC[-15])&IF(RC[-14]="",,"|n"&R1C19&RC[-14])&IF(RC[-13]="",,"|n"&R1C20&RC[-13])&IF(RC[-12]="",,"|n"&R1C21&RC[-12])&IF(RC[-10]="",,"|n"&R1C23&RC[-10])&IF(RC[-9]="",,"|n"&R1C24&RC[-9])&IF(RC[-8]="",,"|n"&R1C25&RC[-8])&IF(RC[-7]="",,"|n"&R1C26&RC[-7])&IF(RC[-6]="",,"|n"&R1C27&RC[-6])&IF(RC[-5]="",,"|n"&R1C28&RC[-5])&IF(RC[-2]="",,"|n"&RC[-2]) -> 
AG733: =IF(RC[-26]&RC[-25]&RC[-24]&RC[-23]&RC[-22]&RC[-21]="",,R1C6)&IF(RC[-26]="",,"|n"&R1C7&RC[-26])&IF(RC[-25]="",,"|n"&R1C8&RC[-25])&IF(RC[-24]="",,"|n"&R1C9&RC[-24])&IF(RC[-23]="",,"|n"&R1C10&RC[-23])&IF(RC[-22]="",,"|n"&R1C11&RC[-22])&IF(RC[-21]="",,"|n"&R1C12&RC[-21])&IF(RC[-19]&RC[-18]&RC[-17]&RC[-16]="",,"|n"&R1C13)&IF(RC[-19]="",,"|n"&R1C14&RC[-19])&IF(RC[-18]="",,"|n"&R1C15&RC[-18])&IF(RC[-17]="",,"|n"&R1C16&RC[-17])&IF(RC[-16]="",,"|n"&R1C17&RC[-16])&IF(RC[-15]="",,"|n"&R1C18&RC[-15])&IF(RC[-14]="",,"|n"&R1C19&RC[-14])&IF(RC[-13]="",,"|n"&R1C20&RC[-13])&IF(RC[-12]="",,"|n"&R1C21&RC[-12])&IF(RC[-10]="",,"|n"&R1C23&RC[-10])&IF(RC[-9]="",,"|n"&R1C24&RC[-9])&IF(RC[-8]="",,"|n"&R1C25&RC[-8])&IF(RC[-7]="",,"|n"&R1C26&RC[-7])&IF(RC[-6]="",,"|n"&R1C27&RC[-6])&IF(RC[-5]="",,"|n"&R1C28&RC[-5])&IF(RC[-2]="",,"|n"&RC[-2]) -> 
AG734: =IF(RC[-26]&RC[-25]&RC[-24]&RC[-23]&RC[-22]&RC[-21]="",,R1C6)&IF(RC[-26]="",,"|n"&R1C7&RC[-26])&IF(RC[-25]="",,"|n"&R1C8&RC[-25])&IF(RC[-24]="",,"|n"&R1C9&RC[-24])&IF(RC[-23]="",,"|n"&R1C10&RC[-23])&IF(RC[-22]="",,"|n"&R1C11&RC[-22])&IF(RC[-21]="",,"|n"&R1C12&RC[-21])&IF(RC[-19]&RC[-18]&RC[-17]&RC[-16]="",,"|n"&R1C13)&IF(RC[-19]="",,"|n"&R1C14&RC[-19])&IF(RC[-18]="",,"|n"&R1C15&RC[-18])&IF(RC[-17]="",,"|n"&R1C16&RC[-17])&IF(RC[-16]="",,"|n"&R1C17&RC[-16])&IF(RC[-15]="",,"|n"&R1C18&RC[-15])&IF(RC[-14]="",,"|n"&R1C19&RC[-14])&IF(RC[-13]="",,"|n"&R1C20&RC[-13])&IF(RC[-12]="",,"|n"&R1C21&RC[-12])&IF(RC[-10]="",,"|n"&R1C23&RC[-10])&IF(RC[-9]="",,"|n"&R1C24&RC[-9])&IF(RC[-8]="",,"|n"&R1C25&RC[-8])&IF(RC[-7]="",,"|n"&R1C26&RC[-7])&IF(RC[-6]="",,"|n"&R1C27&RC[-6])&IF(RC[-5]="",,"|n"&R1C28&RC[-5])&IF(RC[-2]="",,"|n"&RC[-2]) -> 
AG735: =IF(RC[-26]&RC[-25]&RC[-24]&RC[-23]&RC[-22]&RC[-21]="",,R1C6)&IF(RC[-26]="",,"|n"&R1C7&RC[-26])&IF(RC[-25]="",,"|n"&R1C8&RC[-25])&IF(RC[-24]="",,"|n"&R1C9&RC[-24])&IF(RC[-23]="",,"|n"&R1C10&RC[-23])&IF(RC[-22]="",,"|n"&R1C11&RC[-22])&IF(RC[-21]="",,"|n"&R1C12&RC[-21])&IF(RC[-19]&RC[-18]&RC[-17]&RC[-16]="",,"|n"&R1C13)&IF(RC[-19]="",,"|n"&R1C14&RC[-19])&IF(RC[-18]="",,"|n"&R1C15&RC[-18])&IF(RC[-17]="",,"|n"&R1C16&RC[-17])&IF(RC[-16]="",,"|n"&R1C17&RC[-16])&IF(RC[-15]="",,"|n"&R1C18&RC[-15])&IF(RC[-14]="",,"|n"&R1C19&RC[-14])&IF(RC[-13]="",,"|n"&R1C20&RC[-13])&IF(RC[-12]="",,"|n"&R1C21&RC[-12])&IF(RC[-10]="",,"|n"&R1C23&RC[-10])&IF(RC[-9]="",,"|n"&R1C24&RC[-9])&IF(RC[-8]="",,"|n"&R1C25&RC[-8])&IF(RC[-7]="",,"|n"&R1C26&RC[-7])&IF(RC[-6]="",,"|n"&R1C27&RC[-6])&IF(RC[-5]="",,"|n"&R1C28&RC[-5])&IF(RC[-2]="",,"|n"&RC[-2]) -> 
AG736: =IF(RC[-26]&RC[-25]&RC[-24]&RC[-23]&RC[-22]&RC[-21]="",,R1C6)&IF(RC[-26]="",,"|n"&R1C7&RC[-26])&IF(RC[-25]="",,"|n"&R1C8&RC[-25])&IF(RC[-24]="",,"|n"&R1C9&RC[-24])&IF(RC[-23]="",,"|n"&R1C10&RC[-23])&IF(RC[-22]="",,"|n"&R1C11&RC[-22])&IF(RC[-21]="",,"|n"&R1C12&RC[-21])&IF(RC[-19]&RC[-18]&RC[-17]&RC[-16]="",,"|n"&R1C13)&IF(RC[-19]="",,"|n"&R1C14&RC[-19])&IF(RC[-18]="",,"|n"&R1C15&RC[-18])&IF(RC[-17]="",,"|n"&R1C16&RC[-17])&IF(RC[-16]="",,"|n"&R1C17&RC[-16])&IF(RC[-15]="",,"|n"&R1C18&RC[-15])&IF(RC[-14]="",,"|n"&R1C19&RC[-14])&IF(RC[-13]="",,"|n"&R1C20&RC[-13])&IF(RC[-12]="",,"|n"&R1C21&RC[-12])&IF(RC[-10]="",,"|n"&R1C23&RC[-10])&IF(RC[-9]="",,"|n"&R1C24&RC[-9])&IF(RC[-8]="",,"|n"&R1C25&RC[-8])&IF(RC[-7]="",,"|n"&R1C26&RC[-7])&IF(RC[-6]="",,"|n"&R1C27&RC[-6])&IF(RC[-5]="",,"|n"&R1C28&RC[-5])&IF(RC[-2]="",,"|n"&RC[-2]) -> 
AG737: =IF(RC[-26]&RC[-25]&RC[-24]&RC[-23]&RC[-22]&RC[-21]="",,R1C6)&IF(RC[-26]="",,"|n"&R1C7&RC[-26])&IF(RC[-25]="",,"|n"&R1C8&RC[-25])&IF(RC[-24]="",,"|n"&R1C9&RC[-24])&IF(RC[-23]="",,"|n"&R1C10&RC[-23])&IF(RC[-22]="",,"|n"&R1C11&RC[-22])&IF(RC[-21]="",,"|n"&R1C12&RC[-21])&IF(RC[-19]&RC[-18]&RC[-17]&RC[-16]="",,"|n"&R1C13)&IF(RC[-19]="",,"|n"&R1C14&RC[-19])&IF(RC[-18]="",,"|n"&R1C15&RC[-18])&IF(RC[-17]="",,"|n"&R1C16&RC[-17])&IF(RC[-16]="",,"|n"&R1C17&RC[-16])&IF(RC[-15]="",,"|n"&R1C18&RC[-15])&IF(RC[-14]="",,"|n"&R1C19&RC[-14])&IF(RC[-13]="",,"|n"&R1C20&RC[-13])&IF(RC[-12]="",,"|n"&R1C21&RC[-12])&IF(RC[-10]="",,"|n"&R1C23&RC[-10])&IF(RC[-9]="",,"|n"&R1C24&RC[-9])&IF(RC[-8]="",,"|n"&R1C25&RC[-8])&IF(RC[-7]="",,"|n"&R1C26&RC[-7])&IF(RC[-6]="",,"|n"&R1C27&RC[-6])&IF(RC[-5]="",,"|n"&R1C28&RC[-5])&IF(RC[-2]="",,"|n"&RC[-2]) -> 
AG738: =IF(RC[-26]&RC[-25]&RC[-24]&RC[-23]&RC[-22]&RC[-21]="",,R1C6)&IF(RC[-26]="",,"|n"&R1C7&RC[-26])&IF(RC[-25]="",,"|n"&R1C8&RC[-25])&IF(RC[-24]="",,"|n"&R1C9&RC[-24])&IF(RC[-23]="",,"|n"&R1C10&RC[-23])&IF(RC[-22]="",,"|n"&R1C11&RC[-22])&IF(RC[-21]="",,"|n"&R1C12&RC[-21])&IF(RC[-19]&RC[-18]&RC[-17]&RC[-16]="",,"|n"&R1C13)&IF(RC[-19]="",,"|n"&R1C14&RC[-19])&IF(RC[-18]="",,"|n"&R1C15&RC[-18])&IF(RC[-17]="",,"|n"&R1C16&RC[-17])&IF(RC[-16]="",,"|n"&R1C17&RC[-16])&IF(RC[-15]="",,"|n"&R1C18&RC[-15])&IF(RC[-14]="",,"|n"&R1C19&RC[-14])&IF(RC[-13]="",,"|n"&R1C20&RC[-13])&IF(RC[-12]="",,"|n"&R1C21&RC[-12])&IF(RC[-10]="",,"|n"&R1C23&RC[-10])&IF(RC[-9]="",,"|n"&R1C24&RC[-9])&IF(RC[-8]="",,"|n"&R1C25&RC[-8])&IF(RC[-7]="",,"|n"&R1C26&RC[-7])&IF(RC[-6]="",,"|n"&R1C27&RC[-6])&IF(RC[-5]="",,"|n"&R1C28&RC[-5])&IF(RC[-2]="",,"|n"&RC[-2]) -> 
AG739: =IF(RC[-26]&RC[-25]&RC[-24]&RC[-23]&RC[-22]&RC[-21]="",,R1C6)&IF(RC[-26]="",,"|n"&R1C7&RC[-26])&IF(RC[-25]="",,"|n"&R1C8&RC[-25])&IF(RC[-24]="",,"|n"&R1C9&RC[-24])&IF(RC[-23]="",,"|n"&R1C10&RC[-23])&IF(RC[-22]="",,"|n"&R1C11&RC[-22])&IF(RC[-21]="",,"|n"&R1C12&RC[-21])&IF(RC[-19]&RC[-18]&RC[-17]&RC[-16]="",,"|n"&R1C13)&IF(RC[-19]="",,"|n"&R1C14&RC[-19])&IF(RC[-18]="",,"|n"&R1C15&RC[-18])&IF(RC[-17]="",,"|n"&R1C16&RC[-17])&IF(RC[-16]="",,"|n"&R1C17&RC[-16])&IF(RC[-15]="",,"|n"&R1C18&RC[-15])&IF(RC[-14]="",,"|n"&R1C19&RC[-14])&IF(RC[-13]="",,"|n"&R1C20&RC[-13])&IF(RC[-12]="",,"|n"&R1C21&RC[-12])&IF(RC[-10]="",,"|n"&R1C23&RC[-10])&IF(RC[-9]="",,"|n"&R1C24&RC[-9])&IF(RC[-8]="",,"|n"&R1C25&RC[-8])&IF(RC[-7]="",,"|n"&R1C26&RC[-7])&IF(RC[-6]="",,"|n"&R1C27&RC[-6])&IF(RC[-5]="",,"|n"&R1C28&RC[-5])&IF(RC[-2]="",,"|n"&RC[-2]) -> 
AG740: =IF(RC[-26]&RC[-25]&RC[-24]&RC[-23]&RC[-22]&RC[-21]="",,R1C6)&IF(RC[-26]="",,"|n"&R1C7&RC[-26])&IF(RC[-25]="",,"|n"&R1C8&RC[-25])&IF(RC[-24]="",,"|n"&R1C9&RC[-24])&IF(RC[-23]="",,"|n"&R1C10&RC[-23])&IF(RC[-22]="",,"|n"&R1C11&RC[-22])&IF(RC[-21]="",,"|n"&R1C12&RC[-21])&IF(RC[-19]&RC[-18]&RC[-17]&RC[-16]="",,"|n"&R1C13)&IF(RC[-19]="",,"|n"&R1C14&RC[-19])&IF(RC[-18]="",,"|n"&R1C15&RC[-18])&IF(RC[-17]="",,"|n"&R1C16&RC[-17])&IF(RC[-16]="",,"|n"&R1C17&RC[-16])&IF(RC[-15]="",,"|n"&R1C18&RC[-15])&IF(RC[-14]="",,"|n"&R1C19&RC[-14])&IF(RC[-13]="",,"|n"&R1C20&RC[-13])&IF(RC[-12]="",,"|n"&R1C21&RC[-12])&IF(RC[-10]="",,"|n"&R1C23&RC[-10])&IF(RC[-9]="",,"|n"&R1C24&RC[-9])&IF(RC[-8]="",,"|n"&R1C25&RC[-8])&IF(RC[-7]="",,"|n"&R1C26&RC[-7])&IF(RC[-6]="",,"|n"&R1C27&RC[-6])&IF(RC[-5]="",,"|n"&R1C28&RC[-5])&IF(RC[-2]="",,"|n"&RC[-2]) -> 
AG741: =IF(RC[-26]&RC[-25]&RC[-24]&RC[-23]&RC[-22]&RC[-21]="",,R1C6)&IF(RC[-26]="",,"|n"&R1C7&RC[-26])&IF(RC[-25]="",,"|n"&R1C8&RC[-25])&IF(RC[-24]="",,"|n"&R1C9&RC[-24])&IF(RC[-23]="",,"|n"&R1C10&RC[-23])&IF(RC[-22]="",,"|n"&R1C11&RC[-22])&IF(RC[-21]="",,"|n"&R1C12&RC[-21])&IF(RC[-19]&RC[-18]&RC[-17]&RC[-16]="",,"|n"&R1C13)&IF(RC[-19]="",,"|n"&R1C14&RC[-19])&IF(RC[-18]="",,"|n"&R1C15&RC[-18])&IF(RC[-17]="",,"|n"&R1C16&RC[-17])&IF(RC[-16]="",,"|n"&R1C17&RC[-16])&IF(RC[-15]="",,"|n"&R1C18&RC[-15])&IF(RC[-14]="",,"|n"&R1C19&RC[-14])&IF(RC[-13]="",,"|n"&R1C20&RC[-13])&IF(RC[-12]="",,"|n"&R1C21&RC[-12])&IF(RC[-10]="",,"|n"&R1C23&RC[-10])&IF(RC[-9]="",,"|n"&R1C24&RC[-9])&IF(RC[-8]="",,"|n"&R1C25&RC[-8])&IF(RC[-7]="",,"|n"&R1C26&RC[-7])&IF(RC[-6]="",,"|n"&R1C27&RC[-6])&IF(RC[-5]="",,"|n"&R1C28&RC[-5])&IF(RC[-2]="",,"|n"&RC[-2]) -> 
AG742: =IF(RC[-26]&RC[-25]&RC[-24]&RC[-23]&RC[-22]&RC[-21]="",,R1C6)&IF(RC[-26]="",,"|n"&R1C7&RC[-26])&IF(RC[-25]="",,"|n"&R1C8&RC[-25])&IF(RC[-24]="",,"|n"&R1C9&RC[-24])&IF(RC[-23]="",,"|n"&R1C10&RC[-23])&IF(RC[-22]="",,"|n"&R1C11&RC[-22])&IF(RC[-21]="",,"|n"&R1C12&RC[-21])&IF(RC[-19]&RC[-18]&RC[-17]&RC[-16]="",,"|n"&R1C13)&IF(RC[-19]="",,"|n"&R1C14&RC[-19])&IF(RC[-18]="",,"|n"&R1C15&RC[-18])&IF(RC[-17]="",,"|n"&R1C16&RC[-17])&IF(RC[-16]="",,"|n"&R1C17&RC[-16])&IF(RC[-15]="",,"|n"&R1C18&RC[-15])&IF(RC[-14]="",,"|n"&R1C19&RC[-14])&IF(RC[-13]="",,"|n"&R1C20&RC[-13])&IF(RC[-12]="",,"|n"&R1C21&RC[-12])&IF(RC[-10]="",,"|n"&R1C23&RC[-10])&IF(RC[-9]="",,"|n"&R1C24&RC[-9])&IF(RC[-8]="",,"|n"&R1C25&RC[-8])&IF(RC[-7]="",,"|n"&R1C26&RC[-7])&IF(RC[-6]="",,"|n"&R1C27&RC[-6])&IF(RC[-5]="",,"|n"&R1C28&RC[-5])&IF(RC[-2]="",,"|n"&RC[-2]) -> 
AG743: =IF(RC[-26]&RC[-25]&RC[-24]&RC[-23]&RC[-22]&RC[-21]="",,R1C6)&IF(RC[-26]="",,"|n"&R1C7&RC[-26])&IF(RC[-25]="",,"|n"&R1C8&RC[-25])&IF(RC[-24]="",,"|n"&R1C9&RC[-24])&IF(RC[-23]="",,"|n"&R1C10&RC[-23])&IF(RC[-22]="",,"|n"&R1C11&RC[-22])&IF(RC[-21]="",,"|n"&R1C12&RC[-21])&IF(RC[-19]&RC[-18]&RC[-17]&RC[-16]="",,"|n"&R1C13)&IF(RC[-19]="",,"|n"&R1C14&RC[-19])&IF(RC[-18]="",,"|n"&R1C15&RC[-18])&IF(RC[-17]="",,"|n"&R1C16&RC[-17])&IF(RC[-16]="",,"|n"&R1C17&RC[-16])&IF(RC[-15]="",,"|n"&R1C18&RC[-15])&IF(RC[-14]="",,"|n"&R1C19&RC[-14])&IF(RC[-13]="",,"|n"&R1C20&RC[-13])&IF(RC[-12]="",,"|n"&R1C21&RC[-12])&IF(RC[-10]="",,"|n"&R1C23&RC[-10])&IF(RC[-9]="",,"|n"&R1C24&RC[-9])&IF(RC[-8]="",,"|n"&R1C25&RC[-8])&IF(RC[-7]="",,"|n"&R1C26&RC[-7])&IF(RC[-6]="",,"|n"&R1C27&RC[-6])&IF(RC[-5]="",,"|n"&R1C28&RC[-5])&IF(RC[-2]="",,"|n"&RC[-2]) -> 
AG744: =IF(RC[-26]&RC[-25]&RC[-24]&RC[-23]&RC[-22]&RC[-21]="",,R1C6)&IF(RC[-26]="",,"|n"&R1C7&RC[-26])&IF(RC[-25]="",,"|n"&R1C8&RC[-25])&IF(RC[-24]="",,"|n"&R1C9&RC[-24])&IF(RC[-23]="",,"|n"&R1C10&RC[-23])&IF(RC[-22]="",,"|n"&R1C11&RC[-22])&IF(RC[-21]="",,"|n"&R1C12&RC[-21])&IF(RC[-19]&RC[-18]&RC[-17]&RC[-16]="",,"|n"&R1C13)&IF(RC[-19]="",,"|n"&R1C14&RC[-19])&IF(RC[-18]="",,"|n"&R1C15&RC[-18])&IF(RC[-17]="",,"|n"&R1C16&RC[-17])&IF(RC[-16]="",,"|n"&R1C17&RC[-16])&IF(RC[-15]="",,"|n"&R1C18&RC[-15])&IF(RC[-14]="",,"|n"&R1C19&RC[-14])&IF(RC[-13]="",,"|n"&R1C20&RC[-13])&IF(RC[-12]="",,"|n"&R1C21&RC[-12])&IF(RC[-10]="",,"|n"&R1C23&RC[-10])&IF(RC[-9]="",,"|n"&R1C24&RC[-9])&IF(RC[-8]="",,"|n"&R1C25&RC[-8])&IF(RC[-7]="",,"|n"&R1C26&RC[-7])&IF(RC[-6]="",,"|n"&R1C27&RC[-6])&IF(RC[-5]="",,"|n"&R1C28&RC[-5])&IF(RC[-2]="",,"|n"&RC[-2]) -> 
AG745: =IF(RC[-26]&RC[-25]&RC[-24]&RC[-23]&RC[-22]&RC[-21]="",,R1C6)&IF(RC[-26]="",,"|n"&R1C7&RC[-26])&IF(RC[-25]="",,"|n"&R1C8&RC[-25])&IF(RC[-24]="",,"|n"&R1C9&RC[-24])&IF(RC[-23]="",,"|n"&R1C10&RC[-23])&IF(RC[-22]="",,"|n"&R1C11&RC[-22])&IF(RC[-21]="",,"|n"&R1C12&RC[-21])&IF(RC[-19]&RC[-18]&RC[-17]&RC[-16]="",,"|n"&R1C13)&IF(RC[-19]="",,"|n"&R1C14&RC[-19])&IF(RC[-18]="",,"|n"&R1C15&RC[-18])&IF(RC[-17]="",,"|n"&R1C16&RC[-17])&IF(RC[-16]="",,"|n"&R1C17&RC[-16])&IF(RC[-15]="",,"|n"&R1C18&RC[-15])&IF(RC[-14]="",,"|n"&R1C19&RC[-14])&IF(RC[-13]="",,"|n"&R1C20&RC[-13])&IF(RC[-12]="",,"|n"&R1C21&RC[-12])&IF(RC[-10]="",,"|n"&R1C23&RC[-10])&IF(RC[-9]="",,"|n"&R1C24&RC[-9])&IF(RC[-8]="",,"|n"&R1C25&RC[-8])&IF(RC[-7]="",,"|n"&R1C26&RC[-7])&IF(RC[-6]="",,"|n"&R1C27&RC[-6])&IF(RC[-5]="",,"|n"&R1C28&RC[-5])&IF(RC[-2]="",,"|n"&RC[-2]) -> 
AG746: =IF(RC[-26]&RC[-25]&RC[-24]&RC[-23]&RC[-22]&RC[-21]="",,R1C6)&IF(RC[-26]="",,"|n"&R1C7&RC[-26])&IF(RC[-25]="",,"|n"&R1C8&RC[-25])&IF(RC[-24]="",,"|n"&R1C9&RC[-24])&IF(RC[-23]="",,"|n"&R1C10&RC[-23])&IF(RC[-22]="",,"|n"&R1C11&RC[-22])&IF(RC[-21]="",,"|n"&R1C12&RC[-21])&IF(RC[-19]&RC[-18]&RC[-17]&RC[-16]="",,"|n"&R1C13)&IF(RC[-19]="",,"|n"&R1C14&RC[-19])&IF(RC[-18]="",,"|n"&R1C15&RC[-18])&IF(RC[-17]="",,"|n"&R1C16&RC[-17])&IF(RC[-16]="",,"|n"&R1C17&RC[-16])&IF(RC[-15]="",,"|n"&R1C18&RC[-15])&IF(RC[-14]="",,"|n"&R1C19&RC[-14])&IF(RC[-13]="",,"|n"&R1C20&RC[-13])&IF(RC[-12]="",,"|n"&R1C21&RC[-12])&IF(RC[-10]="",,"|n"&R1C23&RC[-10])&IF(RC[-9]="",,"|n"&R1C24&RC[-9])&IF(RC[-8]="",,"|n"&R1C25&RC[-8])&IF(RC[-7]="",,"|n"&R1C26&RC[-7])&IF(RC[-6]="",,"|n"&R1C27&RC[-6])&IF(RC[-5]="",,"|n"&R1C28&RC[-5])&IF(RC[-2]="",,"|n"&RC[-2]) -> 
AG747: =IF(RC[-26]&RC[-25]&RC[-24]&RC[-23]&RC[-22]&RC[-21]="",,R1C6)&IF(RC[-26]="",,"|n"&R1C7&RC[-26])&IF(RC[-25]="",,"|n"&R1C8&RC[-25])&IF(RC[-24]="",,"|n"&R1C9&RC[-24])&IF(RC[-23]="",,"|n"&R1C10&RC[-23])&IF(RC[-22]="",,"|n"&R1C11&RC[-22])&IF(RC[-21]="",,"|n"&R1C12&RC[-21])&IF(RC[-19]&RC[-18]&RC[-17]&RC[-16]="",,"|n"&R1C13)&IF(RC[-19]="",,"|n"&R1C14&RC[-19])&IF(RC[-18]="",,"|n"&R1C15&RC[-18])&IF(RC[-17]="",,"|n"&R1C16&RC[-17])&IF(RC[-16]="",,"|n"&R1C17&RC[-16])&IF(RC[-15]="",,"|n"&R1C18&RC[-15])&IF(RC[-14]="",,"|n"&R1C19&RC[-14])&IF(RC[-13]="",,"|n"&R1C20&RC[-13])&IF(RC[-12]="",,"|n"&R1C21&RC[-12])&IF(RC[-10]="",,"|n"&R1C23&RC[-10])&IF(RC[-9]="",,"|n"&R1C24&RC[-9])&IF(RC[-8]="",,"|n"&R1C25&RC[-8])&IF(RC[-7]="",,"|n"&R1C26&RC[-7])&IF(RC[-6]="",,"|n"&R1C27&RC[-6])&IF(RC[-5]="",,"|n"&R1C28&RC[-5])&IF(RC[-2]="",,"|n"&RC[-2]) -> 
AG748: =IF(RC[-26]&RC[-25]&RC[-24]&RC[-23]&RC[-22]&RC[-21]="",,R1C6)&IF(RC[-26]="",,"|n"&R1C7&RC[-26])&IF(RC[-25]="",,"|n"&R1C8&RC[-25])&IF(RC[-24]="",,"|n"&R1C9&RC[-24])&IF(RC[-23]="",,"|n"&R1C10&RC[-23])&IF(RC[-22]="",,"|n"&R1C11&RC[-22])&IF(RC[-21]="",,"|n"&R1C12&RC[-21])&IF(RC[-19]&RC[-18]&RC[-17]&RC[-16]="",,"|n"&R1C13)&IF(RC[-19]="",,"|n"&R1C14&RC[-19])&IF(RC[-18]="",,"|n"&R1C15&RC[-18])&IF(RC[-17]="",,"|n"&R1C16&RC[-17])&IF(RC[-16]="",,"|n"&R1C17&RC[-16])&IF(RC[-15]="",,"|n"&R1C18&RC[-15])&IF(RC[-14]="",,"|n"&R1C19&RC[-14])&IF(RC[-13]="",,"|n"&R1C20&RC[-13])&IF(RC[-12]="",,"|n"&R1C21&RC[-12])&IF(RC[-10]="",,"|n"&R1C23&RC[-10])&IF(RC[-9]="",,"|n"&R1C24&RC[-9])&IF(RC[-8]="",,"|n"&R1C25&RC[-8])&IF(RC[-7]="",,"|n"&R1C26&RC[-7])&IF(RC[-6]="",,"|n"&R1C27&RC[-6])&IF(RC[-5]="",,"|n"&R1C28&RC[-5])&IF(RC[-2]="",,"|n"&RC[-2]) -> 
AG749: =IF(RC[-26]&RC[-25]&RC[-24]&RC[-23]&RC[-22]&RC[-21]="",,R1C6)&IF(RC[-26]="",,"|n"&R1C7&RC[-26])&IF(RC[-25]="",,"|n"&R1C8&RC[-25])&IF(RC[-24]="",,"|n"&R1C9&RC[-24])&IF(RC[-23]="",,"|n"&R1C10&RC[-23])&IF(RC[-22]="",,"|n"&R1C11&RC[-22])&IF(RC[-21]="",,"|n"&R1C12&RC[-21])&IF(RC[-19]&RC[-18]&RC[-17]&RC[-16]="",,"|n"&R1C13)&IF(RC[-19]="",,"|n"&R1C14&RC[-19])&IF(RC[-18]="",,"|n"&R1C15&RC[-18])&IF(RC[-17]="",,"|n"&R1C16&RC[-17])&IF(RC[-16]="",,"|n"&R1C17&RC[-16])&IF(RC[-15]="",,"|n"&R1C18&RC[-15])&IF(RC[-14]="",,"|n"&R1C19&RC[-14])&IF(RC[-13]="",,"|n"&R1C20&RC[-13])&IF(RC[-12]="",,"|n"&R1C21&RC[-12])&IF(RC[-10]="",,"|n"&R1C23&RC[-10])&IF(RC[-9]="",,"|n"&R1C24&RC[-9])&IF(RC[-8]="",,"|n"&R1C25&RC[-8])&IF(RC[-7]="",,"|n"&R1C26&RC[-7])&IF(RC[-6]="",,"|n"&R1C27&RC[-6])&IF(RC[-5]="",,"|n"&R1C28&RC[-5])&IF(RC[-2]="",,"|n"&RC[-2]) -> 
AG750: =IF(RC[-26]&RC[-25]&RC[-24]&RC[-23]&RC[-22]&RC[-21]="",,R1C6)&IF(RC[-26]="",,"|n"&R1C7&RC[-26])&IF(RC[-25]="",,"|n"&R1C8&RC[-25])&IF(RC[-24]="",,"|n"&R1C9&RC[-24])&IF(RC[-23]="",,"|n"&R1C10&RC[-23])&IF(RC[-22]="",,"|n"&R1C11&RC[-22])&IF(RC[-21]="",,"|n"&R1C12&RC[-21])&IF(RC[-19]&RC[-18]&RC[-17]&RC[-16]="",,"|n"&R1C13)&IF(RC[-19]="",,"|n"&R1C14&RC[-19])&IF(RC[-18]="",,"|n"&R1C15&RC[-18])&IF(RC[-17]="",,"|n"&R1C16&RC[-17])&IF(RC[-16]="",,"|n"&R1C17&RC[-16])&IF(RC[-15]="",,"|n"&R1C18&RC[-15])&IF(RC[-14]="",,"|n"&R1C19&RC[-14])&IF(RC[-13]="",,"|n"&R1C20&RC[-13])&IF(RC[-12]="",,"|n"&R1C21&RC[-12])&IF(RC[-10]="",,"|n"&R1C23&RC[-10])&IF(RC[-9]="",,"|n"&R1C24&RC[-9])&IF(RC[-8]="",,"|n"&R1C25&RC[-8])&IF(RC[-7]="",,"|n"&R1C26&RC[-7])&IF(RC[-6]="",,"|n"&R1C27&RC[-6])&IF(RC[-5]="",,"|n"&R1C28&RC[-5])&IF(RC[-2]="",,"|n"&RC[-2]) -> 
AG751: =IF(RC[-26]&RC[-25]&RC[-24]&RC[-23]&RC[-22]&RC[-21]="",,R1C6)&IF(RC[-26]="",,"|n"&R1C7&RC[-26])&IF(RC[-25]="",,"|n"&R1C8&RC[-25])&IF(RC[-24]="",,"|n"&R1C9&RC[-24])&IF(RC[-23]="",,"|n"&R1C10&RC[-23])&IF(RC[-22]="",,"|n"&R1C11&RC[-22])&IF(RC[-21]="",,"|n"&R1C12&RC[-21])&IF(RC[-19]&RC[-18]&RC[-17]&RC[-16]="",,"|n"&R1C13)&IF(RC[-19]="",,"|n"&R1C14&RC[-19])&IF(RC[-18]="",,"|n"&R1C15&RC[-18])&IF(RC[-17]="",,"|n"&R1C16&RC[-17])&IF(RC[-16]="",,"|n"&R1C17&RC[-16])&IF(RC[-15]="",,"|n"&R1C18&RC[-15])&IF(RC[-14]="",,"|n"&R1C19&RC[-14])&IF(RC[-13]="",,"|n"&R1C20&RC[-13])&IF(RC[-12]="",,"|n"&R1C21&RC[-12])&IF(RC[-10]="",,"|n"&R1C23&RC[-10])&IF(RC[-9]="",,"|n"&R1C24&RC[-9])&IF(RC[-8]="",,"|n"&R1C25&RC[-8])&IF(RC[-7]="",,"|n"&R1C26&RC[-7])&IF(RC[-6]="",,"|n"&R1C27&RC[-6])&IF(RC[-5]="",,"|n"&R1C28&RC[-5])&IF(RC[-2]="",,"|n"&RC[-2]) -> 
AG752: =IF(RC[-26]&RC[-25]&RC[-24]&RC[-23]&RC[-22]&RC[-21]="",,R1C6)&IF(RC[-26]="",,"|n"&R1C7&RC[-26])&IF(RC[-25]="",,"|n"&R1C8&RC[-25])&IF(RC[-24]="",,"|n"&R1C9&RC[-24])&IF(RC[-23]="",,"|n"&R1C10&RC[-23])&IF(RC[-22]="",,"|n"&R1C11&RC[-22])&IF(RC[-21]="",,"|n"&R1C12&RC[-21])&IF(RC[-19]&RC[-18]&RC[-17]&RC[-16]="",,"|n"&R1C13)&IF(RC[-19]="",,"|n"&R1C14&RC[-19])&IF(RC[-18]="",,"|n"&R1C15&RC[-18])&IF(RC[-17]="",,"|n"&R1C16&RC[-17])&IF(RC[-16]="",,"|n"&R1C17&RC[-16])&IF(RC[-15]="",,"|n"&R1C18&RC[-15])&IF(RC[-14]="",,"|n"&R1C19&RC[-14])&IF(RC[-13]="",,"|n"&R1C20&RC[-13])&IF(RC[-12]="",,"|n"&R1C21&RC[-12])&IF(RC[-10]="",,"|n"&R1C23&RC[-10])&IF(RC[-9]="",,"|n"&R1C24&RC[-9])&IF(RC[-8]="",,"|n"&R1C25&RC[-8])&IF(RC[-7]="",,"|n"&R1C26&RC[-7])&IF(RC[-6]="",,"|n"&R1C27&RC[-6])&IF(RC[-5]="",,"|n"&R1C28&RC[-5])&IF(RC[-2]="",,"|n"&RC[-2]) -> 
AG753: =IF(RC[-26]&RC[-25]&RC[-24]&RC[-23]&RC[-22]&RC[-21]="",,R1C6)&IF(RC[-26]="",,"|n"&R1C7&RC[-26])&IF(RC[-25]="",,"|n"&R1C8&RC[-25])&IF(RC[-24]="",,"|n"&R1C9&RC[-24])&IF(RC[-23]="",,"|n"&R1C10&RC[-23])&IF(RC[-22]="",,"|n"&R1C11&RC[-22])&IF(RC[-21]="",,"|n"&R1C12&RC[-21])&IF(RC[-19]&RC[-18]&RC[-17]&RC[-16]="",,"|n"&R1C13)&IF(RC[-19]="",,"|n"&R1C14&RC[-19])&IF(RC[-18]="",,"|n"&R1C15&RC[-18])&IF(RC[-17]="",,"|n"&R1C16&RC[-17])&IF(RC[-16]="",,"|n"&R1C17&RC[-16])&IF(RC[-15]="",,"|n"&R1C18&RC[-15])&IF(RC[-14]="",,"|n"&R1C19&RC[-14])&IF(RC[-13]="",,"|n"&R1C20&RC[-13])&IF(RC[-12]="",,"|n"&R1C21&RC[-12])&IF(RC[-10]="",,"|n"&R1C23&RC[-10])&IF(RC[-9]="",,"|n"&R1C24&RC[-9])&IF(RC[-8]="",,"|n"&R1C25&RC[-8])&IF(RC[-7]="",,"|n"&R1C26&RC[-7])&IF(RC[-6]="",,"|n"&R1C27&RC[-6])&IF(RC[-5]="",,"|n"&R1C28&RC[-5])&IF(RC[-2]="",,"|n"&RC[-2]) -> 
AG754: =IF(RC[-26]&RC[-25]&RC[-24]&RC[-23]&RC[-22]&RC[-21]="",,R1C6)&IF(RC[-26]="",,"|n"&R1C7&RC[-26])&IF(RC[-25]="",,"|n"&R1C8&RC[-25])&IF(RC[-24]="",,"|n"&R1C9&RC[-24])&IF(RC[-23]="",,"|n"&R1C10&RC[-23])&IF(RC[-22]="",,"|n"&R1C11&RC[-22])&IF(RC[-21]="",,"|n"&R1C12&RC[-21])&IF(RC[-19]&RC[-18]&RC[-17]&RC[-16]="",,"|n"&R1C13)&IF(RC[-19]="",,"|n"&R1C14&RC[-19])&IF(RC[-18]="",,"|n"&R1C15&RC[-18])&IF(RC[-17]="",,"|n"&R1C16&RC[-17])&IF(RC[-16]="",,"|n"&R1C17&RC[-16])&IF(RC[-15]="",,"|n"&R1C18&RC[-15])&IF(RC[-14]="",,"|n"&R1C19&RC[-14])&IF(RC[-13]="",,"|n"&R1C20&RC[-13])&IF(RC[-12]="",,"|n"&R1C21&RC[-12])&IF(RC[-10]="",,"|n"&R1C23&RC[-10])&IF(RC[-9]="",,"|n"&R1C24&RC[-9])&IF(RC[-8]="",,"|n"&R1C25&RC[-8])&IF(RC[-7]="",,"|n"&R1C26&RC[-7])&IF(RC[-6]="",,"|n"&R1C27&RC[-6])&IF(RC[-5]="",,"|n"&R1C28&RC[-5])&IF(RC[-2]="",,"|n"&RC[-2]) -> 
AG755: =IF(RC[-26]&RC[-25]&RC[-24]&RC[-23]&RC[-22]&RC[-21]="",,R1C6)&IF(RC[-26]="",,"|n"&R1C7&RC[-26])&IF(RC[-25]="",,"|n"&R1C8&RC[-25])&IF(RC[-24]="",,"|n"&R1C9&RC[-24])&IF(RC[-23]="",,"|n"&R1C10&RC[-23])&IF(RC[-22]="",,"|n"&R1C11&RC[-22])&IF(RC[-21]="",,"|n"&R1C12&RC[-21])&IF(RC[-19]&RC[-18]&RC[-17]&RC[-16]="",,"|n"&R1C13)&IF(RC[-19]="",,"|n"&R1C14&RC[-19])&IF(RC[-18]="",,"|n"&R1C15&RC[-18])&IF(RC[-17]="",,"|n"&R1C16&RC[-17])&IF(RC[-16]="",,"|n"&R1C17&RC[-16])&IF(RC[-15]="",,"|n"&R1C18&RC[-15])&IF(RC[-14]="",,"|n"&R1C19&RC[-14])&IF(RC[-13]="",,"|n"&R1C20&RC[-13])&IF(RC[-12]="",,"|n"&R1C21&RC[-12])&IF(RC[-10]="",,"|n"&R1C23&RC[-10])&IF(RC[-9]="",,"|n"&R1C24&RC[-9])&IF(RC[-8]="",,"|n"&R1C25&RC[-8])&IF(RC[-7]="",,"|n"&R1C26&RC[-7])&IF(RC[-6]="",,"|n"&R1C27&RC[-6])&IF(RC[-5]="",,"|n"&R1C28&RC[-5])&IF(RC[-2]="",,"|n"&RC[-2]) -> 
AG756: =IF(RC[-26]&RC[-25]&RC[-24]&RC[-23]&RC[-22]&RC[-21]="",,R1C6)&IF(RC[-26]="",,"|n"&R1C7&RC[-26])&IF(RC[-25]="",,"|n"&R1C8&RC[-25])&IF(RC[-24]="",,"|n"&R1C9&RC[-24])&IF(RC[-23]="",,"|n"&R1C10&RC[-23])&IF(RC[-22]="",,"|n"&R1C11&RC[-22])&IF(RC[-21]="",,"|n"&R1C12&RC[-21])&IF(RC[-19]&RC[-18]&RC[-17]&RC[-16]="",,"|n"&R1C13)&IF(RC[-19]="",,"|n"&R1C14&RC[-19])&IF(RC[-18]="",,"|n"&R1C15&RC[-18])&IF(RC[-17]="",,"|n"&R1C16&RC[-17])&IF(RC[-16]="",,"|n"&R1C17&RC[-16])&IF(RC[-15]="",,"|n"&R1C18&RC[-15])&IF(RC[-14]="",,"|n"&R1C19&RC[-14])&IF(RC[-13]="",,"|n"&R1C20&RC[-13])&IF(RC[-12]="",,"|n"&R1C21&RC[-12])&IF(RC[-10]="",,"|n"&R1C23&RC[-10])&IF(RC[-9]="",,"|n"&R1C24&RC[-9])&IF(RC[-8]="",,"|n"&R1C25&RC[-8])&IF(RC[-7]="",,"|n"&R1C26&RC[-7])&IF(RC[-6]="",,"|n"&R1C27&RC[-6])&IF(RC[-5]="",,"|n"&R1C28&RC[-5])&IF(RC[-2]="",,"|n"&RC[-2]) -> 
AG757: =IF(RC[-26]&RC[-25]&RC[-24]&RC[-23]&RC[-22]&RC[-21]="",,R1C6)&IF(RC[-26]="",,"|n"&R1C7&RC[-26])&IF(RC[-25]="",,"|n"&R1C8&RC[-25])&IF(RC[-24]="",,"|n"&R1C9&RC[-24])&IF(RC[-23]="",,"|n"&R1C10&RC[-23])&IF(RC[-22]="",,"|n"&R1C11&RC[-22])&IF(RC[-21]="",,"|n"&R1C12&RC[-21])&IF(RC[-19]&RC[-18]&RC[-17]&RC[-16]="",,"|n"&R1C13)&IF(RC[-19]="",,"|n"&R1C14&RC[-19])&IF(RC[-18]="",,"|n"&R1C15&RC[-18])&IF(RC[-17]="",,"|n"&R1C16&RC[-17])&IF(RC[-16]="",,"|n"&R1C17&RC[-16])&IF(RC[-15]="",,"|n"&R1C18&RC[-15])&IF(RC[-14]="",,"|n"&R1C19&RC[-14])&IF(RC[-13]="",,"|n"&R1C20&RC[-13])&IF(RC[-12]="",,"|n"&R1C21&RC[-12])&IF(RC[-10]="",,"|n"&R1C23&RC[-10])&IF(RC[-9]="",,"|n"&R1C24&RC[-9])&IF(RC[-8]="",,"|n"&R1C25&RC[-8])&IF(RC[-7]="",,"|n"&R1C26&RC[-7])&IF(RC[-6]="",,"|n"&R1C27&RC[-6])&IF(RC[-5]="",,"|n"&R1C28&RC[-5])&IF(RC[-2]="",,"|n"&RC[-2]) -> 
AG758: =IF(RC[-26]&RC[-25]&RC[-24]&RC[-23]&RC[-22]&RC[-21]="",,R1C6)&IF(RC[-26]="",,"|n"&R1C7&RC[-26])&IF(RC[-25]="",,"|n"&R1C8&RC[-25])&IF(RC[-24]="",,"|n"&R1C9&RC[-24])&IF(RC[-23]="",,"|n"&R1C10&RC[-23])&IF(RC[-22]="",,"|n"&R1C11&RC[-22])&IF(RC[-21]="",,"|n"&R1C12&RC[-21])&IF(RC[-19]&RC[-18]&RC[-17]&RC[-16]="",,"|n"&R1C13)&IF(RC[-19]="",,"|n"&R1C14&RC[-19])&IF(RC[-18]="",,"|n"&R1C15&RC[-18])&IF(RC[-17]="",,"|n"&R1C16&RC[-17])&IF(RC[-16]="",,"|n"&R1C17&RC[-16])&IF(RC[-15]="",,"|n"&R1C18&RC[-15])&IF(RC[-14]="",,"|n"&R1C19&RC[-14])&IF(RC[-13]="",,"|n"&R1C20&RC[-13])&IF(RC[-12]="",,"|n"&R1C21&RC[-12])&IF(RC[-10]="",,"|n"&R1C23&RC[-10])&IF(RC[-9]="",,"|n"&R1C24&RC[-9])&IF(RC[-8]="",,"|n"&R1C25&RC[-8])&IF(RC[-7]="",,"|n"&R1C26&RC[-7])&IF(RC[-6]="",,"|n"&R1C27&RC[-6])&IF(RC[-5]="",,"|n"&R1C28&RC[-5])&IF(RC[-2]="",,"|n"&RC[-2]) -> 
AG759: =IF(RC[-26]&RC[-25]&RC[-24]&RC[-23]&RC[-22]&RC[-21]="",,R1C6)&IF(RC[-26]="",,"|n"&R1C7&RC[-26])&IF(RC[-25]="",,"|n"&R1C8&RC[-25])&IF(RC[-24]="",,"|n"&R1C9&RC[-24])&IF(RC[-23]="",,"|n"&R1C10&RC[-23])&IF(RC[-22]="",,"|n"&R1C11&RC[-22])&IF(RC[-21]="",,"|n"&R1C12&RC[-21])&IF(RC[-19]&RC[-18]&RC[-17]&RC[-16]="",,"|n"&R1C13)&IF(RC[-19]="",,"|n"&R1C14&RC[-19])&IF(RC[-18]="",,"|n"&R1C15&RC[-18])&IF(RC[-17]="",,"|n"&R1C16&RC[-17])&IF(RC[-16]="",,"|n"&R1C17&RC[-16])&IF(RC[-15]="",,"|n"&R1C18&RC[-15])&IF(RC[-14]="",,"|n"&R1C19&RC[-14])&IF(RC[-13]="",,"|n"&R1C20&RC[-13])&IF(RC[-12]="",,"|n"&R1C21&RC[-12])&IF(RC[-10]="",,"|n"&R1C23&RC[-10])&IF(RC[-9]="",,"|n"&R1C24&RC[-9])&IF(RC[-8]="",,"|n"&R1C25&RC[-8])&IF(RC[-7]="",,"|n"&R1C26&RC[-7])&IF(RC[-6]="",,"|n"&R1C27&RC[-6])&IF(RC[-5]="",,"|n"&R1C28&RC[-5])&IF(RC[-2]="",,"|n"&RC[-2]) -> 
AG760: =IF(RC[-26]&RC[-25]&RC[-24]&RC[-23]&RC[-22]&RC[-21]="",,R1C6)&IF(RC[-26]="",,"|n"&R1C7&RC[-26])&IF(RC[-25]="",,"|n"&R1C8&RC[-25])&IF(RC[-24]="",,"|n"&R1C9&RC[-24])&IF(RC[-23]="",,"|n"&R1C10&RC[-23])&IF(RC[-22]="",,"|n"&R1C11&RC[-22])&IF(RC[-21]="",,"|n"&R1C12&RC[-21])&IF(RC[-19]&RC[-18]&RC[-17]&RC[-16]="",,"|n"&R1C13)&IF(RC[-19]="",,"|n"&R1C14&RC[-19])&IF(RC[-18]="",,"|n"&R1C15&RC[-18])&IF(RC[-17]="",,"|n"&R1C16&RC[-17])&IF(RC[-16]="",,"|n"&R1C17&RC[-16])&IF(RC[-15]="",,"|n"&R1C18&RC[-15])&IF(RC[-14]="",,"|n"&R1C19&RC[-14])&IF(RC[-13]="",,"|n"&R1C20&RC[-13])&IF(RC[-12]="",,"|n"&R1C21&RC[-12])&IF(RC[-10]="",,"|n"&R1C23&RC[-10])&IF(RC[-9]="",,"|n"&R1C24&RC[-9])&IF(RC[-8]="",,"|n"&R1C25&RC[-8])&IF(RC[-7]="",,"|n"&R1C26&RC[-7])&IF(RC[-6]="",,"|n"&R1C27&RC[-6])&IF(RC[-5]="",,"|n"&R1C28&RC[-5])&IF(RC[-2]="",,"|n"&RC[-2]) -> 
AG761: =IF(RC[-26]&RC[-25]&RC[-24]&RC[-23]&RC[-22]&RC[-21]="",,R1C6)&IF(RC[-26]="",,"|n"&R1C7&RC[-26])&IF(RC[-25]="",,"|n"&R1C8&RC[-25])&IF(RC[-24]="",,"|n"&R1C9&RC[-24])&IF(RC[-23]="",,"|n"&R1C10&RC[-23])&IF(RC[-22]="",,"|n"&R1C11&RC[-22])&IF(RC[-21]="",,"|n"&R1C12&RC[-21])&IF(RC[-19]&RC[-18]&RC[-17]&RC[-16]="",,"|n"&R1C13)&IF(RC[-19]="",,"|n"&R1C14&RC[-19])&IF(RC[-18]="",,"|n"&R1C15&RC[-18])&IF(RC[-17]="",,"|n"&R1C16&RC[-17])&IF(RC[-16]="",,"|n"&R1C17&RC[-16])&IF(RC[-15]="",,"|n"&R1C18&RC[-15])&IF(RC[-14]="",,"|n"&R1C19&RC[-14])&IF(RC[-13]="",,"|n"&R1C20&RC[-13])&IF(RC[-12]="",,"|n"&R1C21&RC[-12])&IF(RC[-10]="",,"|n"&R1C23&RC[-10])&IF(RC[-9]="",,"|n"&R1C24&RC[-9])&IF(RC[-8]="",,"|n"&R1C25&RC[-8])&IF(RC[-7]="",,"|n"&R1C26&RC[-7])&IF(RC[-6]="",,"|n"&R1C27&RC[-6])&IF(RC[-5]="",,"|n"&R1C28&RC[-5])&IF(RC[-2]="",,"|n"&RC[-2]) -> 
AG762: =IF(RC[-26]&RC[-25]&RC[-24]&RC[-23]&RC[-22]&RC[-21]="",,R1C6)&IF(RC[-26]="",,"|n"&R1C7&RC[-26])&IF(RC[-25]="",,"|n"&R1C8&RC[-25])&IF(RC[-24]="",,"|n"&R1C9&RC[-24])&IF(RC[-23]="",,"|n"&R1C10&RC[-23])&IF(RC[-22]="",,"|n"&R1C11&RC[-22])&IF(RC[-21]="",,"|n"&R1C12&RC[-21])&IF(RC[-19]&RC[-18]&RC[-17]&RC[-16]="",,"|n"&R1C13)&IF(RC[-19]="",,"|n"&R1C14&RC[-19])&IF(RC[-18]="",,"|n"&R1C15&RC[-18])&IF(RC[-17]="",,"|n"&R1C16&RC[-17])&IF(RC[-16]="",,"|n"&R1C17&RC[-16])&IF(RC[-15]="",,"|n"&R1C18&RC[-15])&IF(RC[-14]="",,"|n"&R1C19&RC[-14])&IF(RC[-13]="",,"|n"&R1C20&RC[-13])&IF(RC[-12]="",,"|n"&R1C21&RC[-12])&IF(RC[-10]="",,"|n"&R1C23&RC[-10])&IF(RC[-9]="",,"|n"&R1C24&RC[-9])&IF(RC[-8]="",,"|n"&R1C25&RC[-8])&IF(RC[-7]="",,"|n"&R1C26&RC[-7])&IF(RC[-6]="",,"|n"&R1C27&RC[-6])&IF(RC[-5]="",,"|n"&R1C28&RC[-5])&IF(RC[-2]="",,"|n"&RC[-2]) -> 
AG763: =IF(RC[-26]&RC[-25]&RC[-24]&RC[-23]&RC[-22]&RC[-21]="",,R1C6)&IF(RC[-26]="",,"|n"&R1C7&RC[-26])&IF(RC[-25]="",,"|n"&R1C8&RC[-25])&IF(RC[-24]="",,"|n"&R1C9&RC[-24])&IF(RC[-23]="",,"|n"&R1C10&RC[-23])&IF(RC[-22]="",,"|n"&R1C11&RC[-22])&IF(RC[-21]="",,"|n"&R1C12&RC[-21])&IF(RC[-19]&RC[-18]&RC[-17]&RC[-16]="",,"|n"&R1C13)&IF(RC[-19]="",,"|n"&R1C14&RC[-19])&IF(RC[-18]="",,"|n"&R1C15&RC[-18])&IF(RC[-17]="",,"|n"&R1C16&RC[-17])&IF(RC[-16]="",,"|n"&R1C17&RC[-16])&IF(RC[-15]="",,"|n"&R1C18&RC[-15])&IF(RC[-14]="",,"|n"&R1C19&RC[-14])&IF(RC[-13]="",,"|n"&R1C20&RC[-13])&IF(RC[-12]="",,"|n"&R1C21&RC[-12])&IF(RC[-10]="",,"|n"&R1C23&RC[-10])&IF(RC[-9]="",,"|n"&R1C24&RC[-9])&IF(RC[-8]="",,"|n"&R1C25&RC[-8])&IF(RC[-7]="",,"|n"&R1C26&RC[-7])&IF(RC[-6]="",,"|n"&R1C27&RC[-6])&IF(RC[-5]="",,"|n"&R1C28&RC[-5])&IF(RC[-2]="",,"|n"&RC[-2]) -> 
AG764: =IF(RC[-26]&RC[-25]&RC[-24]&RC[-23]&RC[-22]&RC[-21]="",,R1C6)&IF(RC[-26]="",,"|n"&R1C7&RC[-26])&IF(RC[-25]="",,"|n"&R1C8&RC[-25])&IF(RC[-24]="",,"|n"&R1C9&RC[-24])&IF(RC[-23]="",,"|n"&R1C10&RC[-23])&IF(RC[-22]="",,"|n"&R1C11&RC[-22])&IF(RC[-21]="",,"|n"&R1C12&RC[-21])&IF(RC[-19]&RC[-18]&RC[-17]&RC[-16]="",,"|n"&R1C13)&IF(RC[-19]="",,"|n"&R1C14&RC[-19])&IF(RC[-18]="",,"|n"&R1C15&RC[-18])&IF(RC[-17]="",,"|n"&R1C16&RC[-17])&IF(RC[-16]="",,"|n"&R1C17&RC[-16])&IF(RC[-15]="",,"|n"&R1C18&RC[-15])&IF(RC[-14]="",,"|n"&R1C19&RC[-14])&IF(RC[-13]="",,"|n"&R1C20&RC[-13])&IF(RC[-12]="",,"|n"&R1C21&RC[-12])&IF(RC[-10]="",,"|n"&R1C23&RC[-10])&IF(RC[-9]="",,"|n"&R1C24&RC[-9])&IF(RC[-8]="",,"|n"&R1C25&RC[-8])&IF(RC[-7]="",,"|n"&R1C26&RC[-7])&IF(RC[-6]="",,"|n"&R1C27&RC[-6])&IF(RC[-5]="",,"|n"&R1C28&RC[-5])&IF(RC[-2]="",,"|n"&RC[-2]) -> 
AG765: =IF(RC[-26]&RC[-25]&RC[-24]&RC[-23]&RC[-22]&RC[-21]="",,R1C6)&IF(RC[-26]="",,"|n"&R1C7&RC[-26])&IF(RC[-25]="",,"|n"&R1C8&RC[-25])&IF(RC[-24]="",,"|n"&R1C9&RC[-24])&IF(RC[-23]="",,"|n"&R1C10&RC[-23])&IF(RC[-22]="",,"|n"&R1C11&RC[-22])&IF(RC[-21]="",,"|n"&R1C12&RC[-21])&IF(RC[-19]&RC[-18]&RC[-17]&RC[-16]="",,"|n"&R1C13)&IF(RC[-19]="",,"|n"&R1C14&RC[-19])&IF(RC[-18]="",,"|n"&R1C15&RC[-18])&IF(RC[-17]="",,"|n"&R1C16&RC[-17])&IF(RC[-16]="",,"|n"&R1C17&RC[-16])&IF(RC[-15]="",,"|n"&R1C18&RC[-15])&IF(RC[-14]="",,"|n"&R1C19&RC[-14])&IF(RC[-13]="",,"|n"&R1C20&RC[-13])&IF(RC[-12]="",,"|n"&R1C21&RC[-12])&IF(RC[-10]="",,"|n"&R1C23&RC[-10])&IF(RC[-9]="",,"|n"&R1C24&RC[-9])&IF(RC[-8]="",,"|n"&R1C25&RC[-8])&IF(RC[-7]="",,"|n"&R1C26&RC[-7])&IF(RC[-6]="",,"|n"&R1C27&RC[-6])&IF(RC[-5]="",,"|n"&R1C28&RC[-5])&IF(RC[-2]="",,"|n"&RC[-2]) -> 
AG766: =IF(RC[-26]&RC[-25]&RC[-24]&RC[-23]&RC[-22]&RC[-21]="",,R1C6)&IF(RC[-26]="",,"|n"&R1C7&RC[-26])&IF(RC[-25]="",,"|n"&R1C8&RC[-25])&IF(RC[-24]="",,"|n"&R1C9&RC[-24])&IF(RC[-23]="",,"|n"&R1C10&RC[-23])&IF(RC[-22]="",,"|n"&R1C11&RC[-22])&IF(RC[-21]="",,"|n"&R1C12&RC[-21])&IF(RC[-19]&RC[-18]&RC[-17]&RC[-16]="",,"|n"&R1C13)&IF(RC[-19]="",,"|n"&R1C14&RC[-19])&IF(RC[-18]="",,"|n"&R1C15&RC[-18])&IF(RC[-17]="",,"|n"&R1C16&RC[-17])&IF(RC[-16]="",,"|n"&R1C17&RC[-16])&IF(RC[-15]="",,"|n"&R1C18&RC[-15])&IF(RC[-14]="",,"|n"&R1C19&RC[-14])&IF(RC[-13]="",,"|n"&R1C20&RC[-13])&IF(RC[-12]="",,"|n"&R1C21&RC[-12])&IF(RC[-10]="",,"|n"&R1C23&RC[-10])&IF(RC[-9]="",,"|n"&R1C24&RC[-9])&IF(RC[-8]="",,"|n"&R1C25&RC[-8])&IF(RC[-7]="",,"|n"&R1C26&RC[-7])&IF(RC[-6]="",,"|n"&R1C27&RC[-6])&IF(RC[-5]="",,"|n"&R1C28&RC[-5])&IF(RC[-2]="",,"|n"&RC[-2]) -> 
AG767: =IF(RC[-26]&RC[-25]&RC[-24]&RC[-23]&RC[-22]&RC[-21]="",,R1C6)&IF(RC[-26]="",,"|n"&R1C7&RC[-26])&IF(RC[-25]="",,"|n"&R1C8&RC[-25])&IF(RC[-24]="",,"|n"&R1C9&RC[-24])&IF(RC[-23]="",,"|n"&R1C10&RC[-23])&IF(RC[-22]="",,"|n"&R1C11&RC[-22])&IF(RC[-21]="",,"|n"&R1C12&RC[-21])&IF(RC[-19]&RC[-18]&RC[-17]&RC[-16]="",,"|n"&R1C13)&IF(RC[-19]="",,"|n"&R1C14&RC[-19])&IF(RC[-18]="",,"|n"&R1C15&RC[-18])&IF(RC[-17]="",,"|n"&R1C16&RC[-17])&IF(RC[-16]="",,"|n"&R1C17&RC[-16])&IF(RC[-15]="",,"|n"&R1C18&RC[-15])&IF(RC[-14]="",,"|n"&R1C19&RC[-14])&IF(RC[-13]="",,"|n"&R1C20&RC[-13])&IF(RC[-12]="",,"|n"&R1C21&RC[-12])&IF(RC[-10]="",,"|n"&R1C23&RC[-10])&IF(RC[-9]="",,"|n"&R1C24&RC[-9])&IF(RC[-8]="",,"|n"&R1C25&RC[-8])&IF(RC[-7]="",,"|n"&R1C26&RC[-7])&IF(RC[-6]="",,"|n"&R1C27&RC[-6])&IF(RC[-5]="",,"|n"&R1C28&RC[-5])&IF(RC[-2]="",,"|n"&RC[-2]) -> 
AG768: =IF(RC[-26]&RC[-25]&RC[-24]&RC[-23]&RC[-22]&RC[-21]="",,R1C6)&IF(RC[-26]="",,"|n"&R1C7&RC[-26])&IF(RC[-25]="",,"|n"&R1C8&RC[-25])&IF(RC[-24]="",,"|n"&R1C9&RC[-24])&IF(RC[-23]="",,"|n"&R1C10&RC[-23])&IF(RC[-22]="",,"|n"&R1C11&RC[-22])&IF(RC[-21]="",,"|n"&R1C12&RC[-21])&IF(RC[-19]&RC[-18]&RC[-17]&RC[-16]="",,"|n"&R1C13)&IF(RC[-19]="",,"|n"&R1C14&RC[-19])&IF(RC[-18]="",,"|n"&R1C15&RC[-18])&IF(RC[-17]="",,"|n"&R1C16&RC[-17])&IF(RC[-16]="",,"|n"&R1C17&RC[-16])&IF(RC[-15]="",,"|n"&R1C18&RC[-15])&IF(RC[-14]="",,"|n"&R1C19&RC[-14])&IF(RC[-13]="",,"|n"&R1C20&RC[-13])&IF(RC[-12]="",,"|n"&R1C21&RC[-12])&IF(RC[-10]="",,"|n"&R1C23&RC[-10])&IF(RC[-9]="",,"|n"&R1C24&RC[-9])&IF(RC[-8]="",,"|n"&R1C25&RC[-8])&IF(RC[-7]="",,"|n"&R1C26&RC[-7])&IF(RC[-6]="",,"|n"&R1C27&RC[-6])&IF(RC[-5]="",,"|n"&R1C28&RC[-5])&IF(RC[-2]="",,"|n"&RC[-2]) -> 
AG769: =IF(RC[-26]&RC[-25]&RC[-24]&RC[-23]&RC[-22]&RC[-21]="",,R1C6)&IF(RC[-26]="",,"|n"&R1C7&RC[-26])&IF(RC[-25]="",,"|n"&R1C8&RC[-25])&IF(RC[-24]="",,"|n"&R1C9&RC[-24])&IF(RC[-23]="",,"|n"&R1C10&RC[-23])&IF(RC[-22]="",,"|n"&R1C11&RC[-22])&IF(RC[-21]="",,"|n"&R1C12&RC[-21])&IF(RC[-19]&RC[-18]&RC[-17]&RC[-16]="",,"|n"&R1C13)&IF(RC[-19]="",,"|n"&R1C14&RC[-19])&IF(RC[-18]="",,"|n"&R1C15&RC[-18])&IF(RC[-17]="",,"|n"&R1C16&RC[-17])&IF(RC[-16]="",,"|n"&R1C17&RC[-16])&IF(RC[-15]="",,"|n"&R1C18&RC[-15])&IF(RC[-14]="",,"|n"&R1C19&RC[-14])&IF(RC[-13]="",,"|n"&R1C20&RC[-13])&IF(RC[-12]="",,"|n"&R1C21&RC[-12])&IF(RC[-10]="",,"|n"&R1C23&RC[-10])&IF(RC[-9]="",,"|n"&R1C24&RC[-9])&IF(RC[-8]="",,"|n"&R1C25&RC[-8])&IF(RC[-7]="",,"|n"&R1C26&RC[-7])&IF(RC[-6]="",,"|n"&R1C27&RC[-6])&IF(RC[-5]="",,"|n"&R1C28&RC[-5])&IF(RC[-2]="",,"|n"&RC[-2]) -> 
AG770: =IF(RC[-26]&RC[-25]&RC[-24]&RC[-23]&RC[-22]&RC[-21]="",,R1C6)&IF(RC[-26]="",,"|n"&R1C7&RC[-26])&IF(RC[-25]="",,"|n"&R1C8&RC[-25])&IF(RC[-24]="",,"|n"&R1C9&RC[-24])&IF(RC[-23]="",,"|n"&R1C10&RC[-23])&IF(RC[-22]="",,"|n"&R1C11&RC[-22])&IF(RC[-21]="",,"|n"&R1C12&RC[-21])&IF(RC[-19]&RC[-18]&RC[-17]&RC[-16]="",,"|n"&R1C13)&IF(RC[-19]="",,"|n"&R1C14&RC[-19])&IF(RC[-18]="",,"|n"&R1C15&RC[-18])&IF(RC[-17]="",,"|n"&R1C16&RC[-17])&IF(RC[-16]="",,"|n"&R1C17&RC[-16])&IF(RC[-15]="",,"|n"&R1C18&RC[-15])&IF(RC[-14]="",,"|n"&R1C19&RC[-14])&IF(RC[-13]="",,"|n"&R1C20&RC[-13])&IF(RC[-12]="",,"|n"&R1C21&RC[-12])&IF(RC[-10]="",,"|n"&R1C23&RC[-10])&IF(RC[-9]="",,"|n"&R1C24&RC[-9])&IF(RC[-8]="",,"|n"&R1C25&RC[-8])&IF(RC[-7]="",,"|n"&R1C26&RC[-7])&IF(RC[-6]="",,"|n"&R1C27&RC[-6])&IF(RC[-5]="",,"|n"&R1C28&RC[-5])&IF(RC[-2]="",,"|n"&RC[-2]) -> 
AG771: =IF(RC[-26]&RC[-25]&RC[-24]&RC[-23]&RC[-22]&RC[-21]="",,R1C6)&IF(RC[-26]="",,"|n"&R1C7&RC[-26])&IF(RC[-25]="",,"|n"&R1C8&RC[-25])&IF(RC[-24]="",,"|n"&R1C9&RC[-24])&IF(RC[-23]="",,"|n"&R1C10&RC[-23])&IF(RC[-22]="",,"|n"&R1C11&RC[-22])&IF(RC[-21]="",,"|n"&R1C12&RC[-21])&IF(RC[-19]&RC[-18]&RC[-17]&RC[-16]="",,"|n"&R1C13)&IF(RC[-19]="",,"|n"&R1C14&RC[-19])&IF(RC[-18]="",,"|n"&R1C15&RC[-18])&IF(RC[-17]="",,"|n"&R1C16&RC[-17])&IF(RC[-16]="",,"|n"&R1C17&RC[-16])&IF(RC[-15]="",,"|n"&R1C18&RC[-15])&IF(RC[-14]="",,"|n"&R1C19&RC[-14])&IF(RC[-13]="",,"|n"&R1C20&RC[-13])&IF(RC[-12]="",,"|n"&R1C21&RC[-12])&IF(RC[-10]="",,"|n"&R1C23&RC[-10])&IF(RC[-9]="",,"|n"&R1C24&RC[-9])&IF(RC[-8]="",,"|n"&R1C25&RC[-8])&IF(RC[-7]="",,"|n"&R1C26&RC[-7])&IF(RC[-6]="",,"|n"&R1C27&RC[-6])&IF(RC[-5]="",,"|n"&R1C28&RC[-5])&IF(RC[-2]="",,"|n"&RC[-2]) -> 
AG772: =IF(RC[-26]&RC[-25]&RC[-24]&RC[-23]&RC[-22]&RC[-21]="",,R1C6)&IF(RC[-26]="",,"|n"&R1C7&RC[-26])&IF(RC[-25]="",,"|n"&R1C8&RC[-25])&IF(RC[-24]="",,"|n"&R1C9&RC[-24])&IF(RC[-23]="",,"|n"&R1C10&RC[-23])&IF(RC[-22]="",,"|n"&R1C11&RC[-22])&IF(RC[-21]="",,"|n"&R1C12&RC[-21])&IF(RC[-19]&RC[-18]&RC[-17]&RC[-16]="",,"|n"&R1C13)&IF(RC[-19]="",,"|n"&R1C14&RC[-19])&IF(RC[-18]="",,"|n"&R1C15&RC[-18])&IF(RC[-17]="",,"|n"&R1C16&RC[-17])&IF(RC[-16]="",,"|n"&R1C17&RC[-16])&IF(RC[-15]="",,"|n"&R1C18&RC[-15])&IF(RC[-14]="",,"|n"&R1C19&RC[-14])&IF(RC[-13]="",,"|n"&R1C20&RC[-13])&IF(RC[-12]="",,"|n"&R1C21&RC[-12])&IF(RC[-10]="",,"|n"&R1C23&RC[-10])&IF(RC[-9]="",,"|n"&R1C24&RC[-9])&IF(RC[-8]="",,"|n"&R1C25&RC[-8])&IF(RC[-7]="",,"|n"&R1C26&RC[-7])&IF(RC[-6]="",,"|n"&R1C27&RC[-6])&IF(RC[-5]="",,"|n"&R1C28&RC[-5])&IF(RC[-2]="",,"|n"&RC[-2]) -> 
AG773: =IF(RC[-26]&RC[-25]&RC[-24]&RC[-23]&RC[-22]&RC[-21]="",,R1C6)&IF(RC[-26]="",,"|n"&R1C7&RC[-26])&IF(RC[-25]="",,"|n"&R1C8&RC[-25])&IF(RC[-24]="",,"|n"&R1C9&RC[-24])&IF(RC[-23]="",,"|n"&R1C10&RC[-23])&IF(RC[-22]="",,"|n"&R1C11&RC[-22])&IF(RC[-21]="",,"|n"&R1C12&RC[-21])&IF(RC[-19]&RC[-18]&RC[-17]&RC[-16]="",,"|n"&R1C13)&IF(RC[-19]="",,"|n"&R1C14&RC[-19])&IF(RC[-18]="",,"|n"&R1C15&RC[-18])&IF(RC[-17]="",,"|n"&R1C16&RC[-17])&IF(RC[-16]="",,"|n"&R1C17&RC[-16])&IF(RC[-15]="",,"|n"&R1C18&RC[-15])&IF(RC[-14]="",,"|n"&R1C19&RC[-14])&IF(RC[-13]="",,"|n"&R1C20&RC[-13])&IF(RC[-12]="",,"|n"&R1C21&RC[-12])&IF(RC[-10]="",,"|n"&R1C23&RC[-10])&IF(RC[-9]="",,"|n"&R1C24&RC[-9])&IF(RC[-8]="",,"|n"&R1C25&RC[-8])&IF(RC[-7]="",,"|n"&R1C26&RC[-7])&IF(RC[-6]="",,"|n"&R1C27&RC[-6])&IF(RC[-5]="",,"|n"&R1C28&RC[-5])&IF(RC[-2]="",,"|n"&RC[-2]) -> 
AG774: =IF(RC[-26]&RC[-25]&RC[-24]&RC[-23]&RC[-22]&RC[-21]="",,R1C6)&IF(RC[-26]="",,"|n"&R1C7&RC[-26])&IF(RC[-25]="",,"|n"&R1C8&RC[-25])&IF(RC[-24]="",,"|n"&R1C9&RC[-24])&IF(RC[-23]="",,"|n"&R1C10&RC[-23])&IF(RC[-22]="",,"|n"&R1C11&RC[-22])&IF(RC[-21]="",,"|n"&R1C12&RC[-21])&IF(RC[-19]&RC[-18]&RC[-17]&RC[-16]="",,"|n"&R1C13)&IF(RC[-19]="",,"|n"&R1C14&RC[-19])&IF(RC[-18]="",,"|n"&R1C15&RC[-18])&IF(RC[-17]="",,"|n"&R1C16&RC[-17])&IF(RC[-16]="",,"|n"&R1C17&RC[-16])&IF(RC[-15]="",,"|n"&R1C18&RC[-15])&IF(RC[-14]="",,"|n"&R1C19&RC[-14])&IF(RC[-13]="",,"|n"&R1C20&RC[-13])&IF(RC[-12]="",,"|n"&R1C21&RC[-12])&IF(RC[-10]="",,"|n"&R1C23&RC[-10])&IF(RC[-9]="",,"|n"&R1C24&RC[-9])&IF(RC[-8]="",,"|n"&R1C25&RC[-8])&IF(RC[-7]="",,"|n"&R1C26&RC[-7])&IF(RC[-6]="",,"|n"&R1C27&RC[-6])&IF(RC[-5]="",,"|n"&R1C28&RC[-5])&IF(RC[-2]="",,"|n"&RC[-2]) -> 
AG775: =IF(RC[-26]&RC[-25]&RC[-24]&RC[-23]&RC[-22]&RC[-21]="",,R1C6)&IF(RC[-26]="",,"|n"&R1C7&RC[-26])&IF(RC[-25]="",,"|n"&R1C8&RC[-25])&IF(RC[-24]="",,"|n"&R1C9&RC[-24])&IF(RC[-23]="",,"|n"&R1C10&RC[-23])&IF(RC[-22]="",,"|n"&R1C11&RC[-22])&IF(RC[-21]="",,"|n"&R1C12&RC[-21])&IF(RC[-19]&RC[-18]&RC[-17]&RC[-16]="",,"|n"&R1C13)&IF(RC[-19]="",,"|n"&R1C14&RC[-19])&IF(RC[-18]="",,"|n"&R1C15&RC[-18])&IF(RC[-17]="",,"|n"&R1C16&RC[-17])&IF(RC[-16]="",,"|n"&R1C17&RC[-16])&IF(RC[-15]="",,"|n"&R1C18&RC[-15])&IF(RC[-14]="",,"|n"&R1C19&RC[-14])&IF(RC[-13]="",,"|n"&R1C20&RC[-13])&IF(RC[-12]="",,"|n"&R1C21&RC[-12])&IF(RC[-10]="",,"|n"&R1C23&RC[-10])&IF(RC[-9]="",,"|n"&R1C24&RC[-9])&IF(RC[-8]="",,"|n"&R1C25&RC[-8])&IF(RC[-7]="",,"|n"&R1C26&RC[-7])&IF(RC[-6]="",,"|n"&R1C27&RC[-6])&IF(RC[-5]="",,"|n"&R1C28&RC[-5])&IF(RC[-2]="",,"|n"&RC[-2]) -> 
AG776: =IF(RC[-26]&RC[-25]&RC[-24]&RC[-23]&RC[-22]&RC[-21]="",,R1C6)&IF(RC[-26]="",,"|n"&R1C7&RC[-26])&IF(RC[-25]="",,"|n"&R1C8&RC[-25])&IF(RC[-24]="",,"|n"&R1C9&RC[-24])&IF(RC[-23]="",,"|n"&R1C10&RC[-23])&IF(RC[-22]="",,"|n"&R1C11&RC[-22])&IF(RC[-21]="",,"|n"&R1C12&RC[-21])&IF(RC[-19]&RC[-18]&RC[-17]&RC[-16]="",,"|n"&R1C13)&IF(RC[-19]="",,"|n"&R1C14&RC[-19])&IF(RC[-18]="",,"|n"&R1C15&RC[-18])&IF(RC[-17]="",,"|n"&R1C16&RC[-17])&IF(RC[-16]="",,"|n"&R1C17&RC[-16])&IF(RC[-15]="",,"|n"&R1C18&RC[-15])&IF(RC[-14]="",,"|n"&R1C19&RC[-14])&IF(RC[-13]="",,"|n"&R1C20&RC[-13])&IF(RC[-12]="",,"|n"&R1C21&RC[-12])&IF(RC[-10]="",,"|n"&R1C23&RC[-10])&IF(RC[-9]="",,"|n"&R1C24&RC[-9])&IF(RC[-8]="",,"|n"&R1C25&RC[-8])&IF(RC[-7]="",,"|n"&R1C26&RC[-7])&IF(RC[-6]="",,"|n"&R1C27&RC[-6])&IF(RC[-5]="",,"|n"&R1C28&RC[-5])&IF(RC[-2]="",,"|n"&RC[-2]) -> 
AG777: =IF(RC[-26]&RC[-25]&RC[-24]&RC[-23]&RC[-22]&RC[-21]="",,R1C6)&IF(RC[-26]="",,"|n"&R1C7&RC[-26])&IF(RC[-25]="",,"|n"&R1C8&RC[-25])&IF(RC[-24]="",,"|n"&R1C9&RC[-24])&IF(RC[-23]="",,"|n"&R1C10&RC[-23])&IF(RC[-22]="",,"|n"&R1C11&RC[-22])&IF(RC[-21]="",,"|n"&R1C12&RC[-21])&IF(RC[-19]&RC[-18]&RC[-17]&RC[-16]="",,"|n"&R1C13)&IF(RC[-19]="",,"|n"&R1C14&RC[-19])&IF(RC[-18]="",,"|n"&R1C15&RC[-18])&IF(RC[-17]="",,"|n"&R1C16&RC[-17])&IF(RC[-16]="",,"|n"&R1C17&RC[-16])&IF(RC[-15]="",,"|n"&R1C18&RC[-15])&IF(RC[-14]="",,"|n"&R1C19&RC[-14])&IF(RC[-13]="",,"|n"&R1C20&RC[-13])&IF(RC[-12]="",,"|n"&R1C21&RC[-12])&IF(RC[-10]="",,"|n"&R1C23&RC[-10])&IF(RC[-9]="",,"|n"&R1C24&RC[-9])&IF(RC[-8]="",,"|n"&R1C25&RC[-8])&IF(RC[-7]="",,"|n"&R1C26&RC[-7])&IF(RC[-6]="",,"|n"&R1C27&RC[-6])&IF(RC[-5]="",,"|n"&R1C28&RC[-5])&IF(RC[-2]="",,"|n"&RC[-2]) -> 
AG778: =IF(RC[-26]&RC[-25]&RC[-24]&RC[-23]&RC[-22]&RC[-21]="",,R1C6)&IF(RC[-26]="",,"|n"&R1C7&RC[-26])&IF(RC[-25]="",,"|n"&R1C8&RC[-25])&IF(RC[-24]="",,"|n"&R1C9&RC[-24])&IF(RC[-23]="",,"|n"&R1C10&RC[-23])&IF(RC[-22]="",,"|n"&R1C11&RC[-22])&IF(RC[-21]="",,"|n"&R1C12&RC[-21])&IF(RC[-19]&RC[-18]&RC[-17]&RC[-16]="",,"|n"&R1C13)&IF(RC[-19]="",,"|n"&R1C14&RC[-19])&IF(RC[-18]="",,"|n"&R1C15&RC[-18])&IF(RC[-17]="",,"|n"&R1C16&RC[-17])&IF(RC[-16]="",,"|n"&R1C17&RC[-16])&IF(RC[-15]="",,"|n"&R1C18&RC[-15])&IF(RC[-14]="",,"|n"&R1C19&RC[-14])&IF(RC[-13]="",,"|n"&R1C20&RC[-13])&IF(RC[-12]="",,"|n"&R1C21&RC[-12])&IF(RC[-10]="",,"|n"&R1C23&RC[-10])&IF(RC[-9]="",,"|n"&R1C24&RC[-9])&IF(RC[-8]="",,"|n"&R1C25&RC[-8])&IF(RC[-7]="",,"|n"&R1C26&RC[-7])&IF(RC[-6]="",,"|n"&R1C27&RC[-6])&IF(RC[-5]="",,"|n"&R1C28&RC[-5])&IF(RC[-2]="",,"|n"&RC[-2]) -> 
AG779: =IF(RC[-26]&RC[-25]&RC[-24]&RC[-23]&RC[-22]&RC[-21]="",,R1C6)&IF(RC[-26]="",,"|n"&R1C7&RC[-26])&IF(RC[-25]="",,"|n"&R1C8&RC[-25])&IF(RC[-24]="",,"|n"&R1C9&RC[-24])&IF(RC[-23]="",,"|n"&R1C10&RC[-23])&IF(RC[-22]="",,"|n"&R1C11&RC[-22])&IF(RC[-21]="",,"|n"&R1C12&RC[-21])&IF(RC[-19]&RC[-18]&RC[-17]&RC[-16]="",,"|n"&R1C13)&IF(RC[-19]="",,"|n"&R1C14&RC[-19])&IF(RC[-18]="",,"|n"&R1C15&RC[-18])&IF(RC[-17]="",,"|n"&R1C16&RC[-17])&IF(RC[-16]="",,"|n"&R1C17&RC[-16])&IF(RC[-15]="",,"|n"&R1C18&RC[-15])&IF(RC[-14]="",,"|n"&R1C19&RC[-14])&IF(RC[-13]="",,"|n"&R1C20&RC[-13])&IF(RC[-12]="",,"|n"&R1C21&RC[-12])&IF(RC[-10]="",,"|n"&R1C23&RC[-10])&IF(RC[-9]="",,"|n"&R1C24&RC[-9])&IF(RC[-8]="",,"|n"&R1C25&RC[-8])&IF(RC[-7]="",,"|n"&R1C26&RC[-7])&IF(RC[-6]="",,"|n"&R1C27&RC[-6])&IF(RC[-5]="",,"|n"&R1C28&RC[-5])&IF(RC[-2]="",,"|n"&RC[-2]) -> 
AG780: =IF(RC[-26]&RC[-25]&RC[-24]&RC[-23]&RC[-22]&RC[-21]="",,R1C6)&IF(RC[-26]="",,"|n"&R1C7&RC[-26])&IF(RC[-25]="",,"|n"&R1C8&RC[-25])&IF(RC[-24]="",,"|n"&R1C9&RC[-24])&IF(RC[-23]="",,"|n"&R1C10&RC[-23])&IF(RC[-22]="",,"|n"&R1C11&RC[-22])&IF(RC[-21]="",,"|n"&R1C12&RC[-21])&IF(RC[-19]&RC[-18]&RC[-17]&RC[-16]="",,"|n"&R1C13)&IF(RC[-19]="",,"|n"&R1C14&RC[-19])&IF(RC[-18]="",,"|n"&R1C15&RC[-18])&IF(RC[-17]="",,"|n"&R1C16&RC[-17])&IF(RC[-16]="",,"|n"&R1C17&RC[-16])&IF(RC[-15]="",,"|n"&R1C18&RC[-15])&IF(RC[-14]="",,"|n"&R1C19&RC[-14])&IF(RC[-13]="",,"|n"&R1C20&RC[-13])&IF(RC[-12]="",,"|n"&R1C21&RC[-12])&IF(RC[-10]="",,"|n"&R1C23&RC[-10])&IF(RC[-9]="",,"|n"&R1C24&RC[-9])&IF(RC[-8]="",,"|n"&R1C25&RC[-8])&IF(RC[-7]="",,"|n"&R1C26&RC[-7])&IF(RC[-6]="",,"|n"&R1C27&RC[-6])&IF(RC[-5]="",,"|n"&R1C28&RC[-5])&IF(RC[-2]="",,"|n"&RC[-2]) -> 
AG781: =IF(RC[-26]&RC[-25]&RC[-24]&RC[-23]&RC[-22]&RC[-21]="",,R1C6)&IF(RC[-26]="",,"|n"&R1C7&RC[-26])&IF(RC[-25]="",,"|n"&R1C8&RC[-25])&IF(RC[-24]="",,"|n"&R1C9&RC[-24])&IF(RC[-23]="",,"|n"&R1C10&RC[-23])&IF(RC[-22]="",,"|n"&R1C11&RC[-22])&IF(RC[-21]="",,"|n"&R1C12&RC[-21])&IF(RC[-19]&RC[-18]&RC[-17]&RC[-16]="",,"|n"&R1C13)&IF(RC[-19]="",,"|n"&R1C14&RC[-19])&IF(RC[-18]="",,"|n"&R1C15&RC[-18])&IF(RC[-17]="",,"|n"&R1C16&RC[-17])&IF(RC[-16]="",,"|n"&R1C17&RC[-16])&IF(RC[-15]="",,"|n"&R1C18&RC[-15])&IF(RC[-14]="",,"|n"&R1C19&RC[-14])&IF(RC[-13]="",,"|n"&R1C20&RC[-13])&IF(RC[-12]="",,"|n"&R1C21&RC[-12])&IF(RC[-10]="",,"|n"&R1C23&RC[-10])&IF(RC[-9]="",,"|n"&R1C24&RC[-9])&IF(RC[-8]="",,"|n"&R1C25&RC[-8])&IF(RC[-7]="",,"|n"&R1C26&RC[-7])&IF(RC[-6]="",,"|n"&R1C27&RC[-6])&IF(RC[-5]="",,"|n"&R1C28&RC[-5])&IF(RC[-2]="",,"|n"&RC[-2]) -> 
AG782: =IF(RC[-26]&RC[-25]&RC[-24]&RC[-23]&RC[-22]&RC[-21]="",,R1C6)&IF(RC[-26]="",,"|n"&R1C7&RC[-26])&IF(RC[-25]="",,"|n"&R1C8&RC[-25])&IF(RC[-24]="",,"|n"&R1C9&RC[-24])&IF(RC[-23]="",,"|n"&R1C10&RC[-23])&IF(RC[-22]="",,"|n"&R1C11&RC[-22])&IF(RC[-21]="",,"|n"&R1C12&RC[-21])&IF(RC[-19]&RC[-18]&RC[-17]&RC[-16]="",,"|n"&R1C13)&IF(RC[-19]="",,"|n"&R1C14&RC[-19])&IF(RC[-18]="",,"|n"&R1C15&RC[-18])&IF(RC[-17]="",,"|n"&R1C16&RC[-17])&IF(RC[-16]="",,"|n"&R1C17&RC[-16])&IF(RC[-15]="",,"|n"&R1C18&RC[-15])&IF(RC[-14]="",,"|n"&R1C19&RC[-14])&IF(RC[-13]="",,"|n"&R1C20&RC[-13])&IF(RC[-12]="",,"|n"&R1C21&RC[-12])&IF(RC[-10]="",,"|n"&R1C23&RC[-10])&IF(RC[-9]="",,"|n"&R1C24&RC[-9])&IF(RC[-8]="",,"|n"&R1C25&RC[-8])&IF(RC[-7]="",,"|n"&R1C26&RC[-7])&IF(RC[-6]="",,"|n"&R1C27&RC[-6])&IF(RC[-5]="",,"|n"&R1C28&RC[-5])&IF(RC[-2]="",,"|n"&RC[-2]) -> 
AG783: =IF(RC[-26]&RC[-25]&RC[-24]&RC[-23]&RC[-22]&RC[-21]="",,R1C6)&IF(RC[-26]="",,"|n"&R1C7&RC[-26])&IF(RC[-25]="",,"|n"&R1C8&RC[-25])&IF(RC[-24]="",,"|n"&R1C9&RC[-24])&IF(RC[-23]="",,"|n"&R1C10&RC[-23])&IF(RC[-22]="",,"|n"&R1C11&RC[-22])&IF(RC[-21]="",,"|n"&R1C12&RC[-21])&IF(RC[-19]&RC[-18]&RC[-17]&RC[-16]="",,"|n"&R1C13)&IF(RC[-19]="",,"|n"&R1C14&RC[-19])&IF(RC[-18]="",,"|n"&R1C15&RC[-18])&IF(RC[-17]="",,"|n"&R1C16&RC[-17])&IF(RC[-16]="",,"|n"&R1C17&RC[-16])&IF(RC[-15]="",,"|n"&R1C18&RC[-15])&IF(RC[-14]="",,"|n"&R1C19&RC[-14])&IF(RC[-13]="",,"|n"&R1C20&RC[-13])&IF(RC[-12]="",,"|n"&R1C21&RC[-12])&IF(RC[-10]="",,"|n"&R1C23&RC[-10])&IF(RC[-9]="",,"|n"&R1C24&RC[-9])&IF(RC[-8]="",,"|n"&R1C25&RC[-8])&IF(RC[-7]="",,"|n"&R1C26&RC[-7])&IF(RC[-6]="",,"|n"&R1C27&RC[-6])&IF(RC[-5]="",,"|n"&R1C28&RC[-5])&IF(RC[-2]="",,"|n"&RC[-2]) -> 
AG784: =IF(RC[-26]&RC[-25]&RC[-24]&RC[-23]&RC[-22]&RC[-21]="",,R1C6)&IF(RC[-26]="",,"|n"&R1C7&RC[-26])&IF(RC[-25]="",,"|n"&R1C8&RC[-25])&IF(RC[-24]="",,"|n"&R1C9&RC[-24])&IF(RC[-23]="",,"|n"&R1C10&RC[-23])&IF(RC[-22]="",,"|n"&R1C11&RC[-22])&IF(RC[-21]="",,"|n"&R1C12&RC[-21])&IF(RC[-19]&RC[-18]&RC[-17]&RC[-16]="",,"|n"&R1C13)&IF(RC[-19]="",,"|n"&R1C14&RC[-19])&IF(RC[-18]="",,"|n"&R1C15&RC[-18])&IF(RC[-17]="",,"|n"&R1C16&RC[-17])&IF(RC[-16]="",,"|n"&R1C17&RC[-16])&IF(RC[-15]="",,"|n"&R1C18&RC[-15])&IF(RC[-14]="",,"|n"&R1C19&RC[-14])&IF(RC[-13]="",,"|n"&R1C20&RC[-13])&IF(RC[-12]="",,"|n"&R1C21&RC[-12])&IF(RC[-10]="",,"|n"&R1C23&RC[-10])&IF(RC[-9]="",,"|n"&R1C24&RC[-9])&IF(RC[-8]="",,"|n"&R1C25&RC[-8])&IF(RC[-7]="",,"|n"&R1C26&RC[-7])&IF(RC[-6]="",,"|n"&R1C27&RC[-6])&IF(RC[-5]="",,"|n"&R1C28&RC[-5])&IF(RC[-2]="",,"|n"&RC[-2]) -> 
AG785: =IF(RC[-26]&RC[-25]&RC[-24]&RC[-23]&RC[-22]&RC[-21]="",,R1C6)&IF(RC[-26]="",,"|n"&R1C7&RC[-26])&IF(RC[-25]="",,"|n"&R1C8&RC[-25])&IF(RC[-24]="",,"|n"&R1C9&RC[-24])&IF(RC[-23]="",,"|n"&R1C10&RC[-23])&IF(RC[-22]="",,"|n"&R1C11&RC[-22])&IF(RC[-21]="",,"|n"&R1C12&RC[-21])&IF(RC[-19]&RC[-18]&RC[-17]&RC[-16]="",,"|n"&R1C13)&IF(RC[-19]="",,"|n"&R1C14&RC[-19])&IF(RC[-18]="",,"|n"&R1C15&RC[-18])&IF(RC[-17]="",,"|n"&R1C16&RC[-17])&IF(RC[-16]="",,"|n"&R1C17&RC[-16])&IF(RC[-15]="",,"|n"&R1C18&RC[-15])&IF(RC[-14]="",,"|n"&R1C19&RC[-14])&IF(RC[-13]="",,"|n"&R1C20&RC[-13])&IF(RC[-12]="",,"|n"&R1C21&RC[-12])&IF(RC[-10]="",,"|n"&R1C23&RC[-10])&IF(RC[-9]="",,"|n"&R1C24&RC[-9])&IF(RC[-8]="",,"|n"&R1C25&RC[-8])&IF(RC[-7]="",,"|n"&R1C26&RC[-7])&IF(RC[-6]="",,"|n"&R1C27&RC[-6])&IF(RC[-5]="",,"|n"&R1C28&RC[-5])&IF(RC[-2]="",,"|n"&RC[-2]) -> 
AG786: =IF(RC[-26]&RC[-25]&RC[-24]&RC[-23]&RC[-22]&RC[-21]="",,R1C6)&IF(RC[-26]="",,"|n"&R1C7&RC[-26])&IF(RC[-25]="",,"|n"&R1C8&RC[-25])&IF(RC[-24]="",,"|n"&R1C9&RC[-24])&IF(RC[-23]="",,"|n"&R1C10&RC[-23])&IF(RC[-22]="",,"|n"&R1C11&RC[-22])&IF(RC[-21]="",,"|n"&R1C12&RC[-21])&IF(RC[-19]&RC[-18]&RC[-17]&RC[-16]="",,"|n"&R1C13)&IF(RC[-19]="",,"|n"&R1C14&RC[-19])&IF(RC[-18]="",,"|n"&R1C15&RC[-18])&IF(RC[-17]="",,"|n"&R1C16&RC[-17])&IF(RC[-16]="",,"|n"&R1C17&RC[-16])&IF(RC[-15]="",,"|n"&R1C18&RC[-15])&IF(RC[-14]="",,"|n"&R1C19&RC[-14])&IF(RC[-13]="",,"|n"&R1C20&RC[-13])&IF(RC[-12]="",,"|n"&R1C21&RC[-12])&IF(RC[-10]="",,"|n"&R1C23&RC[-10])&IF(RC[-9]="",,"|n"&R1C24&RC[-9])&IF(RC[-8]="",,"|n"&R1C25&RC[-8])&IF(RC[-7]="",,"|n"&R1C26&RC[-7])&IF(RC[-6]="",,"|n"&R1C27&RC[-6])&IF(RC[-5]="",,"|n"&R1C28&RC[-5])&IF(RC[-2]="",,"|n"&RC[-2]) -> 
AG787: =IF(RC[-26]&RC[-25]&RC[-24]&RC[-23]&RC[-22]&RC[-21]="",,R1C6)&IF(RC[-26]="",,"|n"&R1C7&RC[-26])&IF(RC[-25]="",,"|n"&R1C8&RC[-25])&IF(RC[-24]="",,"|n"&R1C9&RC[-24])&IF(RC[-23]="",,"|n"&R1C10&RC[-23])&IF(RC[-22]="",,"|n"&R1C11&RC[-22])&IF(RC[-21]="",,"|n"&R1C12&RC[-21])&IF(RC[-19]&RC[-18]&RC[-17]&RC[-16]="",,"|n"&R1C13)&IF(RC[-19]="",,"|n"&R1C14&RC[-19])&IF(RC[-18]="",,"|n"&R1C15&RC[-18])&IF(RC[-17]="",,"|n"&R1C16&RC[-17])&IF(RC[-16]="",,"|n"&R1C17&RC[-16])&IF(RC[-15]="",,"|n"&R1C18&RC[-15])&IF(RC[-14]="",,"|n"&R1C19&RC[-14])&IF(RC[-13]="",,"|n"&R1C20&RC[-13])&IF(RC[-12]="",,"|n"&R1C21&RC[-12])&IF(RC[-10]="",,"|n"&R1C23&RC[-10])&IF(RC[-9]="",,"|n"&R1C24&RC[-9])&IF(RC[-8]="",,"|n"&R1C25&RC[-8])&IF(RC[-7]="",,"|n"&R1C26&RC[-7])&IF(RC[-6]="",,"|n"&R1C27&RC[-6])&IF(RC[-5]="",,"|n"&R1C28&RC[-5])&IF(RC[-2]="",,"|n"&RC[-2]) -> 
AG788: =IF(RC[-26]&RC[-25]&RC[-24]&RC[-23]&RC[-22]&RC[-21]="",,R1C6)&IF(RC[-26]="",,"|n"&R1C7&RC[-26])&IF(RC[-25]="",,"|n"&R1C8&RC[-25])&IF(RC[-24]="",,"|n"&R1C9&RC[-24])&IF(RC[-23]="",,"|n"&R1C10&RC[-23])&IF(RC[-22]="",,"|n"&R1C11&RC[-22])&IF(RC[-21]="",,"|n"&R1C12&RC[-21])&IF(RC[-19]&RC[-18]&RC[-17]&RC[-16]="",,"|n"&R1C13)&IF(RC[-19]="",,"|n"&R1C14&RC[-19])&IF(RC[-18]="",,"|n"&R1C15&RC[-18])&IF(RC[-17]="",,"|n"&R1C16&RC[-17])&IF(RC[-16]="",,"|n"&R1C17&RC[-16])&IF(RC[-15]="",,"|n"&R1C18&RC[-15])&IF(RC[-14]="",,"|n"&R1C19&RC[-14])&IF(RC[-13]="",,"|n"&R1C20&RC[-13])&IF(RC[-12]="",,"|n"&R1C21&RC[-12])&IF(RC[-10]="",,"|n"&R1C23&RC[-10])&IF(RC[-9]="",,"|n"&R1C24&RC[-9])&IF(RC[-8]="",,"|n"&R1C25&RC[-8])&IF(RC[-7]="",,"|n"&R1C26&RC[-7])&IF(RC[-6]="",,"|n"&R1C27&RC[-6])&IF(RC[-5]="",,"|n"&R1C28&RC[-5])&IF(RC[-2]="",,"|n"&RC[-2]) -> 
AG789: =IF(RC[-26]&RC[-25]&RC[-24]&RC[-23]&RC[-22]&RC[-21]="",,R1C6)&IF(RC[-26]="",,"|n"&R1C7&RC[-26])&IF(RC[-25]="",,"|n"&R1C8&RC[-25])&IF(RC[-24]="",,"|n"&R1C9&RC[-24])&IF(RC[-23]="",,"|n"&R1C10&RC[-23])&IF(RC[-22]="",,"|n"&R1C11&RC[-22])&IF(RC[-21]="",,"|n"&R1C12&RC[-21])&IF(RC[-19]&RC[-18]&RC[-17]&RC[-16]="",,"|n"&R1C13)&IF(RC[-19]="",,"|n"&R1C14&RC[-19])&IF(RC[-18]="",,"|n"&R1C15&RC[-18])&IF(RC[-17]="",,"|n"&R1C16&RC[-17])&IF(RC[-16]="",,"|n"&R1C17&RC[-16])&IF(RC[-15]="",,"|n"&R1C18&RC[-15])&IF(RC[-14]="",,"|n"&R1C19&RC[-14])&IF(RC[-13]="",,"|n"&R1C20&RC[-13])&IF(RC[-12]="",,"|n"&R1C21&RC[-12])&IF(RC[-10]="",,"|n"&R1C23&RC[-10])&IF(RC[-9]="",,"|n"&R1C24&RC[-9])&IF(RC[-8]="",,"|n"&R1C25&RC[-8])&IF(RC[-7]="",,"|n"&R1C26&RC[-7])&IF(RC[-6]="",,"|n"&R1C27&RC[-6])&IF(RC[-5]="",,"|n"&R1C28&RC[-5])&IF(RC[-2]="",,"|n"&RC[-2]) -> 
AG790: =IF(RC[-26]&RC[-25]&RC[-24]&RC[-23]&RC[-22]&RC[-21]="",,R1C6)&IF(RC[-26]="",,"|n"&R1C7&RC[-26])&IF(RC[-25]="",,"|n"&R1C8&RC[-25])&IF(RC[-24]="",,"|n"&R1C9&RC[-24])&IF(RC[-23]="",,"|n"&R1C10&RC[-23])&IF(RC[-22]="",,"|n"&R1C11&RC[-22])&IF(RC[-21]="",,"|n"&R1C12&RC[-21])&IF(RC[-19]&RC[-18]&RC[-17]&RC[-16]="",,"|n"&R1C13)&IF(RC[-19]="",,"|n"&R1C14&RC[-19])&IF(RC[-18]="",,"|n"&R1C15&RC[-18])&IF(RC[-17]="",,"|n"&R1C16&RC[-17])&IF(RC[-16]="",,"|n"&R1C17&RC[-16])&IF(RC[-15]="",,"|n"&R1C18&RC[-15])&IF(RC[-14]="",,"|n"&R1C19&RC[-14])&IF(RC[-13]="",,"|n"&R1C20&RC[-13])&IF(RC[-12]="",,"|n"&R1C21&RC[-12])&IF(RC[-10]="",,"|n"&R1C23&RC[-10])&IF(RC[-9]="",,"|n"&R1C24&RC[-9])&IF(RC[-8]="",,"|n"&R1C25&RC[-8])&IF(RC[-7]="",,"|n"&R1C26&RC[-7])&IF(RC[-6]="",,"|n"&R1C27&RC[-6])&IF(RC[-5]="",,"|n"&R1C28&RC[-5])&IF(RC[-2]="",,"|n"&RC[-2]) -> 
AG791: =IF(RC[-26]&RC[-25]&RC[-24]&RC[-23]&RC[-22]&RC[-21]="",,R1C6)&IF(RC[-26]="",,"|n"&R1C7&RC[-26])&IF(RC[-25]="",,"|n"&R1C8&RC[-25])&IF(RC[-24]="",,"|n"&R1C9&RC[-24])&IF(RC[-23]="",,"|n"&R1C10&RC[-23])&IF(RC[-22]="",,"|n"&R1C11&RC[-22])&IF(RC[-21]="",,"|n"&R1C12&RC[-21])&IF(RC[-19]&RC[-18]&RC[-17]&RC[-16]="",,"|n"&R1C13)&IF(RC[-19]="",,"|n"&R1C14&RC[-19])&IF(RC[-18]="",,"|n"&R1C15&RC[-18])&IF(RC[-17]="",,"|n"&R1C16&RC[-17])&IF(RC[-16]="",,"|n"&R1C17&RC[-16])&IF(RC[-15]="",,"|n"&R1C18&RC[-15])&IF(RC[-14]="",,"|n"&R1C19&RC[-14])&IF(RC[-13]="",,"|n"&R1C20&RC[-13])&IF(RC[-12]="",,"|n"&R1C21&RC[-12])&IF(RC[-10]="",,"|n"&R1C23&RC[-10])&IF(RC[-9]="",,"|n"&R1C24&RC[-9])&IF(RC[-8]="",,"|n"&R1C25&RC[-8])&IF(RC[-7]="",,"|n"&R1C26&RC[-7])&IF(RC[-6]="",,"|n"&R1C27&RC[-6])&IF(RC[-5]="",,"|n"&R1C28&RC[-5])&IF(RC[-2]="",,"|n"&RC[-2]) -> 
AG792: =IF(RC[-26]&RC[-25]&RC[-24]&RC[-23]&RC[-22]&RC[-21]="",,R1C6)&IF(RC[-26]="",,"|n"&R1C7&RC[-26])&IF(RC[-25]="",,"|n"&R1C8&RC[-25])&IF(RC[-24]="",,"|n"&R1C9&RC[-24])&IF(RC[-23]="",,"|n"&R1C10&RC[-23])&IF(RC[-22]="",,"|n"&R1C11&RC[-22])&IF(RC[-21]="",,"|n"&R1C12&RC[-21])&IF(RC[-19]&RC[-18]&RC[-17]&RC[-16]="",,"|n"&R1C13)&IF(RC[-19]="",,"|n"&R1C14&RC[-19])&IF(RC[-18]="",,"|n"&R1C15&RC[-18])&IF(RC[-17]="",,"|n"&R1C16&RC[-17])&IF(RC[-16]="",,"|n"&R1C17&RC[-16])&IF(RC[-15]="",,"|n"&R1C18&RC[-15])&IF(RC[-14]="",,"|n"&R1C19&RC[-14])&IF(RC[-13]="",,"|n"&R1C20&RC[-13])&IF(RC[-12]="",,"|n"&R1C21&RC[-12])&IF(RC[-10]="",,"|n"&R1C23&RC[-10])&IF(RC[-9]="",,"|n"&R1C24&RC[-9])&IF(RC[-8]="",,"|n"&R1C25&RC[-8])&IF(RC[-7]="",,"|n"&R1C26&RC[-7])&IF(RC[-6]="",,"|n"&R1C27&RC[-6])&IF(RC[-5]="",,"|n"&R1C28&RC[-5])&IF(RC[-2]="",,"|n"&RC[-2]) -> 
AG793: =IF(RC[-26]&RC[-25]&RC[-24]&RC[-23]&RC[-22]&RC[-21]="",,R1C6)&IF(RC[-26]="",,"|n"&R1C7&RC[-26])&IF(RC[-25]="",,"|n"&R1C8&RC[-25])&IF(RC[-24]="",,"|n"&R1C9&RC[-24])&IF(RC[-23]="",,"|n"&R1C10&RC[-23])&IF(RC[-22]="",,"|n"&R1C11&RC[-22])&IF(RC[-21]="",,"|n"&R1C12&RC[-21])&IF(RC[-19]&RC[-18]&RC[-17]&RC[-16]="",,"|n"&R1C13)&IF(RC[-19]="",,"|n"&R1C14&RC[-19])&IF(RC[-18]="",,"|n"&R1C15&RC[-18])&IF(RC[-17]="",,"|n"&R1C16&RC[-17])&IF(RC[-16]="",,"|n"&R1C17&RC[-16])&IF(RC[-15]="",,"|n"&R1C18&RC[-15])&IF(RC[-14]="",,"|n"&R1C19&RC[-14])&IF(RC[-13]="",,"|n"&R1C20&RC[-13])&IF(RC[-12]="",,"|n"&R1C21&RC[-12])&IF(RC[-10]="",,"|n"&R1C23&RC[-10])&IF(RC[-9]="",,"|n"&R1C24&RC[-9])&IF(RC[-8]="",,"|n"&R1C25&RC[-8])&IF(RC[-7]="",,"|n"&R1C26&RC[-7])&IF(RC[-6]="",,"|n"&R1C27&RC[-6])&IF(RC[-5]="",,"|n"&R1C28&RC[-5])&IF(RC[-2]="",,"|n"&RC[-2]) -> 
AG794: =IF(RC[-26]&RC[-25]&RC[-24]&RC[-23]&RC[-22]&RC[-21]="",,R1C6)&IF(RC[-26]="",,"|n"&R1C7&RC[-26])&IF(RC[-25]="",,"|n"&R1C8&RC[-25])&IF(RC[-24]="",,"|n"&R1C9&RC[-24])&IF(RC[-23]="",,"|n"&R1C10&RC[-23])&IF(RC[-22]="",,"|n"&R1C11&RC[-22])&IF(RC[-21]="",,"|n"&R1C12&RC[-21])&IF(RC[-19]&RC[-18]&RC[-17]&RC[-16]="",,"|n"&R1C13)&IF(RC[-19]="",,"|n"&R1C14&RC[-19])&IF(RC[-18]="",,"|n"&R1C15&RC[-18])&IF(RC[-17]="",,"|n"&R1C16&RC[-17])&IF(RC[-16]="",,"|n"&R1C17&RC[-16])&IF(RC[-15]="",,"|n"&R1C18&RC[-15])&IF(RC[-14]="",,"|n"&R1C19&RC[-14])&IF(RC[-13]="",,"|n"&R1C20&RC[-13])&IF(RC[-12]="",,"|n"&R1C21&RC[-12])&IF(RC[-10]="",,"|n"&R1C23&RC[-10])&IF(RC[-9]="",,"|n"&R1C24&RC[-9])&IF(RC[-8]="",,"|n"&R1C25&RC[-8])&IF(RC[-7]="",,"|n"&R1C26&RC[-7])&IF(RC[-6]="",,"|n"&R1C27&RC[-6])&IF(RC[-5]="",,"|n"&R1C28&RC[-5])&IF(RC[-2]="",,"|n"&RC[-2]) -> 
AG795: =IF(RC[-26]&RC[-25]&RC[-24]&RC[-23]&RC[-22]&RC[-21]="",,R1C6)&IF(RC[-26]="",,"|n"&R1C7&RC[-26])&IF(RC[-25]="",,"|n"&R1C8&RC[-25])&IF(RC[-24]="",,"|n"&R1C9&RC[-24])&IF(RC[-23]="",,"|n"&R1C10&RC[-23])&IF(RC[-22]="",,"|n"&R1C11&RC[-22])&IF(RC[-21]="",,"|n"&R1C12&RC[-21])&IF(RC[-19]&RC[-18]&RC[-17]&RC[-16]="",,"|n"&R1C13)&IF(RC[-19]="",,"|n"&R1C14&RC[-19])&IF(RC[-18]="",,"|n"&R1C15&RC[-18])&IF(RC[-17]="",,"|n"&R1C16&RC[-17])&IF(RC[-16]="",,"|n"&R1C17&RC[-16])&IF(RC[-15]="",,"|n"&R1C18&RC[-15])&IF(RC[-14]="",,"|n"&R1C19&RC[-14])&IF(RC[-13]="",,"|n"&R1C20&RC[-13])&IF(RC[-12]="",,"|n"&R1C21&RC[-12])&IF(RC[-10]="",,"|n"&R1C23&RC[-10])&IF(RC[-9]="",,"|n"&R1C24&RC[-9])&IF(RC[-8]="",,"|n"&R1C25&RC[-8])&IF(RC[-7]="",,"|n"&R1C26&RC[-7])&IF(RC[-6]="",,"|n"&R1C27&RC[-6])&IF(RC[-5]="",,"|n"&R1C28&RC[-5])&IF(RC[-2]="",,"|n"&RC[-2]) -> 
AG796: =IF(RC[-26]&RC[-25]&RC[-24]&RC[-23]&RC[-22]&RC[-21]="",,R1C6)&IF(RC[-26]="",,"|n"&R1C7&RC[-26])&IF(RC[-25]="",,"|n"&R1C8&RC[-25])&IF(RC[-24]="",,"|n"&R1C9&RC[-24])&IF(RC[-23]="",,"|n"&R1C10&RC[-23])&IF(RC[-22]="",,"|n"&R1C11&RC[-22])&IF(RC[-21]="",,"|n"&R1C12&RC[-21])&IF(RC[-19]&RC[-18]&RC[-17]&RC[-16]="",,"|n"&R1C13)&IF(RC[-19]="",,"|n"&R1C14&RC[-19])&IF(RC[-18]="",,"|n"&R1C15&RC[-18])&IF(RC[-17]="",,"|n"&R1C16&RC[-17])&IF(RC[-16]="",,"|n"&R1C17&RC[-16])&IF(RC[-15]="",,"|n"&R1C18&RC[-15])&IF(RC[-14]="",,"|n"&R1C19&RC[-14])&IF(RC[-13]="",,"|n"&R1C20&RC[-13])&IF(RC[-12]="",,"|n"&R1C21&RC[-12])&IF(RC[-10]="",,"|n"&R1C23&RC[-10])&IF(RC[-9]="",,"|n"&R1C24&RC[-9])&IF(RC[-8]="",,"|n"&R1C25&RC[-8])&IF(RC[-7]="",,"|n"&R1C26&RC[-7])&IF(RC[-6]="",,"|n"&R1C27&RC[-6])&IF(RC[-5]="",,"|n"&R1C28&RC[-5])&IF(RC[-2]="",,"|n"&RC[-2]) -> 
AG797: =IF(RC[-26]&RC[-25]&RC[-24]&RC[-23]&RC[-22]&RC[-21]="",,R1C6)&IF(RC[-26]="",,"|n"&R1C7&RC[-26])&IF(RC[-25]="",,"|n"&R1C8&RC[-25])&IF(RC[-24]="",,"|n"&R1C9&RC[-24])&IF(RC[-23]="",,"|n"&R1C10&RC[-23])&IF(RC[-22]="",,"|n"&R1C11&RC[-22])&IF(RC[-21]="",,"|n"&R1C12&RC[-21])&IF(RC[-19]&RC[-18]&RC[-17]&RC[-16]="",,"|n"&R1C13)&IF(RC[-19]="",,"|n"&R1C14&RC[-19])&IF(RC[-18]="",,"|n"&R1C15&RC[-18])&IF(RC[-17]="",,"|n"&R1C16&RC[-17])&IF(RC[-16]="",,"|n"&R1C17&RC[-16])&IF(RC[-15]="",,"|n"&R1C18&RC[-15])&IF(RC[-14]="",,"|n"&R1C19&RC[-14])&IF(RC[-13]="",,"|n"&R1C20&RC[-13])&IF(RC[-12]="",,"|n"&R1C21&RC[-12])&IF(RC[-10]="",,"|n"&R1C23&RC[-10])&IF(RC[-9]="",,"|n"&R1C24&RC[-9])&IF(RC[-8]="",,"|n"&R1C25&RC[-8])&IF(RC[-7]="",,"|n"&R1C26&RC[-7])&IF(RC[-6]="",,"|n"&R1C27&RC[-6])&IF(RC[-5]="",,"|n"&R1C28&RC[-5])&IF(RC[-2]="",,"|n"&RC[-2]) -> 
AG798: =IF(RC[-26]&RC[-25]&RC[-24]&RC[-23]&RC[-22]&RC[-21]="",,R1C6)&IF(RC[-26]="",,"|n"&R1C7&RC[-26])&IF(RC[-25]="",,"|n"&R1C8&RC[-25])&IF(RC[-24]="",,"|n"&R1C9&RC[-24])&IF(RC[-23]="",,"|n"&R1C10&RC[-23])&IF(RC[-22]="",,"|n"&R1C11&RC[-22])&IF(RC[-21]="",,"|n"&R1C12&RC[-21])&IF(RC[-19]&RC[-18]&RC[-17]&RC[-16]="",,"|n"&R1C13)&IF(RC[-19]="",,"|n"&R1C14&RC[-19])&IF(RC[-18]="",,"|n"&R1C15&RC[-18])&IF(RC[-17]="",,"|n"&R1C16&RC[-17])&IF(RC[-16]="",,"|n"&R1C17&RC[-16])&IF(RC[-15]="",,"|n"&R1C18&RC[-15])&IF(RC[-14]="",,"|n"&R1C19&RC[-14])&IF(RC[-13]="",,"|n"&R1C20&RC[-13])&IF(RC[-12]="",,"|n"&R1C21&RC[-12])&IF(RC[-10]="",,"|n"&R1C23&RC[-10])&IF(RC[-9]="",,"|n"&R1C24&RC[-9])&IF(RC[-8]="",,"|n"&R1C25&RC[-8])&IF(RC[-7]="",,"|n"&R1C26&RC[-7])&IF(RC[-6]="",,"|n"&R1C27&RC[-6])&IF(RC[-5]="",,"|n"&R1C28&RC[-5])&IF(RC[-2]="",,"|n"&RC[-2]) -> 
AG799: =IF(RC[-26]&RC[-25]&RC[-24]&RC[-23]&RC[-22]&RC[-21]="",,R1C6)&IF(RC[-26]="",,"|n"&R1C7&RC[-26])&IF(RC[-25]="",,"|n"&R1C8&RC[-25])&IF(RC[-24]="",,"|n"&R1C9&RC[-24])&IF(RC[-23]="",,"|n"&R1C10&RC[-23])&IF(RC[-22]="",,"|n"&R1C11&RC[-22])&IF(RC[-21]="",,"|n"&R1C12&RC[-21])&IF(RC[-19]&RC[-18]&RC[-17]&RC[-16]="",,"|n"&R1C13)&IF(RC[-19]="",,"|n"&R1C14&RC[-19])&IF(RC[-18]="",,"|n"&R1C15&RC[-18])&IF(RC[-17]="",,"|n"&R1C16&RC[-17])&IF(RC[-16]="",,"|n"&R1C17&RC[-16])&IF(RC[-15]="",,"|n"&R1C18&RC[-15])&IF(RC[-14]="",,"|n"&R1C19&RC[-14])&IF(RC[-13]="",,"|n"&R1C20&RC[-13])&IF(RC[-12]="",,"|n"&R1C21&RC[-12])&IF(RC[-10]="",,"|n"&R1C23&RC[-10])&IF(RC[-9]="",,"|n"&R1C24&RC[-9])&IF(RC[-8]="",,"|n"&R1C25&RC[-8])&IF(RC[-7]="",,"|n"&R1C26&RC[-7])&IF(RC[-6]="",,"|n"&R1C27&RC[-6])&IF(RC[-5]="",,"|n"&R1C28&RC[-5])&IF(RC[-2]="",,"|n"&RC[-2]) -> 
AG800: =IF(RC[-26]&RC[-25]&RC[-24]&RC[-23]&RC[-22]&RC[-21]="",,R1C6)&IF(RC[-26]="",,"|n"&R1C7&RC[-26])&IF(RC[-25]="",,"|n"&R1C8&RC[-25])&IF(RC[-24]="",,"|n"&R1C9&RC[-24])&IF(RC[-23]="",,"|n"&R1C10&RC[-23])&IF(RC[-22]="",,"|n"&R1C11&RC[-22])&IF(RC[-21]="",,"|n"&R1C12&RC[-21])&IF(RC[-19]&RC[-18]&RC[-17]&RC[-16]="",,"|n"&R1C13)&IF(RC[-19]="",,"|n"&R1C14&RC[-19])&IF(RC[-18]="",,"|n"&R1C15&RC[-18])&IF(RC[-17]="",,"|n"&R1C16&RC[-17])&IF(RC[-16]="",,"|n"&R1C17&RC[-16])&IF(RC[-15]="",,"|n"&R1C18&RC[-15])&IF(RC[-14]="",,"|n"&R1C19&RC[-14])&IF(RC[-13]="",,"|n"&R1C20&RC[-13])&IF(RC[-12]="",,"|n"&R1C21&RC[-12])&IF(RC[-10]="",,"|n"&R1C23&RC[-10])&IF(RC[-9]="",,"|n"&R1C24&RC[-9])&IF(RC[-8]="",,"|n"&R1C25&RC[-8])&IF(RC[-7]="",,"|n"&R1C26&RC[-7])&IF(RC[-6]="",,"|n"&R1C27&RC[-6])&IF(RC[-5]="",,"|n"&R1C28&RC[-5])&IF(RC[-2]="",,"|n"&RC[-2]) -> 
AG801: =IF(RC[-26]&RC[-25]&RC[-24]&RC[-23]&RC[-22]&RC[-21]="",,R1C6)&IF(RC[-26]="",,"|n"&R1C7&RC[-26])&IF(RC[-25]="",,"|n"&R1C8&RC[-25])&IF(RC[-24]="",,"|n"&R1C9&RC[-24])&IF(RC[-23]="",,"|n"&R1C10&RC[-23])&IF(RC[-22]="",,"|n"&R1C11&RC[-22])&IF(RC[-21]="",,"|n"&R1C12&RC[-21])&IF(RC[-19]&RC[-18]&RC[-17]&RC[-16]="",,"|n"&R1C13)&IF(RC[-19]="",,"|n"&R1C14&RC[-19])&IF(RC[-18]="",,"|n"&R1C15&RC[-18])&IF(RC[-17]="",,"|n"&R1C16&RC[-17])&IF(RC[-16]="",,"|n"&R1C17&RC[-16])&IF(RC[-15]="",,"|n"&R1C18&RC[-15])&IF(RC[-14]="",,"|n"&R1C19&RC[-14])&IF(RC[-13]="",,"|n"&R1C20&RC[-13])&IF(RC[-12]="",,"|n"&R1C21&RC[-12])&IF(RC[-10]="",,"|n"&R1C23&RC[-10])&IF(RC[-9]="",,"|n"&R1C24&RC[-9])&IF(RC[-8]="",,"|n"&R1C25&RC[-8])&IF(RC[-7]="",,"|n"&R1C26&RC[-7])&IF(RC[-6]="",,"|n"&R1C27&RC[-6])&IF(RC[-5]="",,"|n"&R1C28&RC[-5])&IF(RC[-2]="",,"|n"&RC[-2]) -> 
AG802: =IF(RC[-26]&RC[-25]&RC[-24]&RC[-23]&RC[-22]&RC[-21]="",,R1C6)&IF(RC[-26]="",,"|n"&R1C7&RC[-26])&IF(RC[-25]="",,"|n"&R1C8&RC[-25])&IF(RC[-24]="",,"|n"&R1C9&RC[-24])&IF(RC[-23]="",,"|n"&R1C10&RC[-23])&IF(RC[-22]="",,"|n"&R1C11&RC[-22])&IF(RC[-21]="",,"|n"&R1C12&RC[-21])&IF(RC[-19]&RC[-18]&RC[-17]&RC[-16]="",,"|n"&R1C13)&IF(RC[-19]="",,"|n"&R1C14&RC[-19])&IF(RC[-18]="",,"|n"&R1C15&RC[-18])&IF(RC[-17]="",,"|n"&R1C16&RC[-17])&IF(RC[-16]="",,"|n"&R1C17&RC[-16])&IF(RC[-15]="",,"|n"&R1C18&RC[-15])&IF(RC[-14]="",,"|n"&R1C19&RC[-14])&IF(RC[-13]="",,"|n"&R1C20&RC[-13])&IF(RC[-12]="",,"|n"&R1C21&RC[-12])&IF(RC[-10]="",,"|n"&R1C23&RC[-10])&IF(RC[-9]="",,"|n"&R1C24&RC[-9])&IF(RC[-8]="",,"|n"&R1C25&RC[-8])&IF(RC[-7]="",,"|n"&R1C26&RC[-7])&IF(RC[-6]="",,"|n"&R1C27&RC[-6])&IF(RC[-5]="",,"|n"&R1C28&RC[-5])&IF(RC[-2]="",,"|n"&RC[-2]) -> 
AG803: =IF(RC[-26]&RC[-25]&RC[-24]&RC[-23]&RC[-22]&RC[-21]="",,R1C6)&IF(RC[-26]="",,"|n"&R1C7&RC[-26])&IF(RC[-25]="",,"|n"&R1C8&RC[-25])&IF(RC[-24]="",,"|n"&R1C9&RC[-24])&IF(RC[-23]="",,"|n"&R1C10&RC[-23])&IF(RC[-22]="",,"|n"&R1C11&RC[-22])&IF(RC[-21]="",,"|n"&R1C12&RC[-21])&IF(RC[-19]&RC[-18]&RC[-17]&RC[-16]="",,"|n"&R1C13)&IF(RC[-19]="",,"|n"&R1C14&RC[-19])&IF(RC[-18]="",,"|n"&R1C15&RC[-18])&IF(RC[-17]="",,"|n"&R1C16&RC[-17])&IF(RC[-16]="",,"|n"&R1C17&RC[-16])&IF(RC[-15]="",,"|n"&R1C18&RC[-15])&IF(RC[-14]="",,"|n"&R1C19&RC[-14])&IF(RC[-13]="",,"|n"&R1C20&RC[-13])&IF(RC[-12]="",,"|n"&R1C21&RC[-12])&IF(RC[-10]="",,"|n"&R1C23&RC[-10])&IF(RC[-9]="",,"|n"&R1C24&RC[-9])&IF(RC[-8]="",,"|n"&R1C25&RC[-8])&IF(RC[-7]="",,"|n"&R1C26&RC[-7])&IF(RC[-6]="",,"|n"&R1C27&RC[-6])&IF(RC[-5]="",,"|n"&R1C28&RC[-5])&IF(RC[-2]="",,"|n"&RC[-2]) -> 
AG804: =IF(RC[-26]&RC[-25]&RC[-24]&RC[-23]&RC[-22]&RC[-21]="",,R1C6)&IF(RC[-26]="",,"|n"&R1C7&RC[-26])&IF(RC[-25]="",,"|n"&R1C8&RC[-25])&IF(RC[-24]="",,"|n"&R1C9&RC[-24])&IF(RC[-23]="",,"|n"&R1C10&RC[-23])&IF(RC[-22]="",,"|n"&R1C11&RC[-22])&IF(RC[-21]="",,"|n"&R1C12&RC[-21])&IF(RC[-19]&RC[-18]&RC[-17]&RC[-16]="",,"|n"&R1C13)&IF(RC[-19]="",,"|n"&R1C14&RC[-19])&IF(RC[-18]="",,"|n"&R1C15&RC[-18])&IF(RC[-17]="",,"|n"&R1C16&RC[-17])&IF(RC[-16]="",,"|n"&R1C17&RC[-16])&IF(RC[-15]="",,"|n"&R1C18&RC[-15])&IF(RC[-14]="",,"|n"&R1C19&RC[-14])&IF(RC[-13]="",,"|n"&R1C20&RC[-13])&IF(RC[-12]="",,"|n"&R1C21&RC[-12])&IF(RC[-10]="",,"|n"&R1C23&RC[-10])&IF(RC[-9]="",,"|n"&R1C24&RC[-9])&IF(RC[-8]="",,"|n"&R1C25&RC[-8])&IF(RC[-7]="",,"|n"&R1C26&RC[-7])&IF(RC[-6]="",,"|n"&R1C27&RC[-6])&IF(RC[-5]="",,"|n"&R1C28&RC[-5])&IF(RC[-2]="",,"|n"&RC[-2]) -> 
AG805: =IF(RC[-26]&RC[-25]&RC[-24]&RC[-23]&RC[-22]&RC[-21]="",,R1C6)&IF(RC[-26]="",,"|n"&R1C7&RC[-26])&IF(RC[-25]="",,"|n"&R1C8&RC[-25])&IF(RC[-24]="",,"|n"&R1C9&RC[-24])&IF(RC[-23]="",,"|n"&R1C10&RC[-23])&IF(RC[-22]="",,"|n"&R1C11&RC[-22])&IF(RC[-21]="",,"|n"&R1C12&RC[-21])&IF(RC[-19]&RC[-18]&RC[-17]&RC[-16]="",,"|n"&R1C13)&IF(RC[-19]="",,"|n"&R1C14&RC[-19])&IF(RC[-18]="",,"|n"&R1C15&RC[-18])&IF(RC[-17]="",,"|n"&R1C16&RC[-17])&IF(RC[-16]="",,"|n"&R1C17&RC[-16])&IF(RC[-15]="",,"|n"&R1C18&RC[-15])&IF(RC[-14]="",,"|n"&R1C19&RC[-14])&IF(RC[-13]="",,"|n"&R1C20&RC[-13])&IF(RC[-12]="",,"|n"&R1C21&RC[-12])&IF(RC[-10]="",,"|n"&R1C23&RC[-10])&IF(RC[-9]="",,"|n"&R1C24&RC[-9])&IF(RC[-8]="",,"|n"&R1C25&RC[-8])&IF(RC[-7]="",,"|n"&R1C26&RC[-7])&IF(RC[-6]="",,"|n"&R1C27&RC[-6])&IF(RC[-5]="",,"|n"&R1C28&RC[-5])&IF(RC[-2]="",,"|n"&RC[-2]) -> 
AG806: =IF(RC[-26]&RC[-25]&RC[-24]&RC[-23]&RC[-22]&RC[-21]="",,R1C6)&IF(RC[-26]="",,"|n"&R1C7&RC[-26])&IF(RC[-25]="",,"|n"&R1C8&RC[-25])&IF(RC[-24]="",,"|n"&R1C9&RC[-24])&IF(RC[-23]="",,"|n"&R1C10&RC[-23])&IF(RC[-22]="",,"|n"&R1C11&RC[-22])&IF(RC[-21]="",,"|n"&R1C12&RC[-21])&IF(RC[-19]&RC[-18]&RC[-17]&RC[-16]="",,"|n"&R1C13)&IF(RC[-19]="",,"|n"&R1C14&RC[-19])&IF(RC[-18]="",,"|n"&R1C15&RC[-18])&IF(RC[-17]="",,"|n"&R1C16&RC[-17])&IF(RC[-16]="",,"|n"&R1C17&RC[-16])&IF(RC[-15]="",,"|n"&R1C18&RC[-15])&IF(RC[-14]="",,"|n"&R1C19&RC[-14])&IF(RC[-13]="",,"|n"&R1C20&RC[-13])&IF(RC[-12]="",,"|n"&R1C21&RC[-12])&IF(RC[-10]="",,"|n"&R1C23&RC[-10])&IF(RC[-9]="",,"|n"&R1C24&RC[-9])&IF(RC[-8]="",,"|n"&R1C25&RC[-8])&IF(RC[-7]="",,"|n"&R1C26&RC[-7])&IF(RC[-6]="",,"|n"&R1C27&RC[-6])&IF(RC[-5]="",,"|n"&R1C28&RC[-5])&IF(RC[-2]="",,"|n"&RC[-2]) -> 
AG807: =IF(RC[-26]&RC[-25]&RC[-24]&RC[-23]&RC[-22]&RC[-21]="",,R1C6)&IF(RC[-26]="",,"|n"&R1C7&RC[-26])&IF(RC[-25]="",,"|n"&R1C8&RC[-25])&IF(RC[-24]="",,"|n"&R1C9&RC[-24])&IF(RC[-23]="",,"|n"&R1C10&RC[-23])&IF(RC[-22]="",,"|n"&R1C11&RC[-22])&IF(RC[-21]="",,"|n"&R1C12&RC[-21])&IF(RC[-19]&RC[-18]&RC[-17]&RC[-16]="",,"|n"&R1C13)&IF(RC[-19]="",,"|n"&R1C14&RC[-19])&IF(RC[-18]="",,"|n"&R1C15&RC[-18])&IF(RC[-17]="",,"|n"&R1C16&RC[-17])&IF(RC[-16]="",,"|n"&R1C17&RC[-16])&IF(RC[-15]="",,"|n"&R1C18&RC[-15])&IF(RC[-14]="",,"|n"&R1C19&RC[-14])&IF(RC[-13]="",,"|n"&R1C20&RC[-13])&IF(RC[-12]="",,"|n"&R1C21&RC[-12])&IF(RC[-10]="",,"|n"&R1C23&RC[-10])&IF(RC[-9]="",,"|n"&R1C24&RC[-9])&IF(RC[-8]="",,"|n"&R1C25&RC[-8])&IF(RC[-7]="",,"|n"&R1C26&RC[-7])&IF(RC[-6]="",,"|n"&R1C27&RC[-6])&IF(RC[-5]="",,"|n"&R1C28&RC[-5])&IF(RC[-2]="",,"|n"&RC[-2]) -> 
AG808: =IF(RC[-26]&RC[-25]&RC[-24]&RC[-23]&RC[-22]&RC[-21]="",,R1C6)&IF(RC[-26]="",,"|n"&R1C7&RC[-26])&IF(RC[-25]="",,"|n"&R1C8&RC[-25])&IF(RC[-24]="",,"|n"&R1C9&RC[-24])&IF(RC[-23]="",,"|n"&R1C10&RC[-23])&IF(RC[-22]="",,"|n"&R1C11&RC[-22])&IF(RC[-21]="",,"|n"&R1C12&RC[-21])&IF(RC[-19]&RC[-18]&RC[-17]&RC[-16]="",,"|n"&R1C13)&IF(RC[-19]="",,"|n"&R1C14&RC[-19])&IF(RC[-18]="",,"|n"&R1C15&RC[-18])&IF(RC[-17]="",,"|n"&R1C16&RC[-17])&IF(RC[-16]="",,"|n"&R1C17&RC[-16])&IF(RC[-15]="",,"|n"&R1C18&RC[-15])&IF(RC[-14]="",,"|n"&R1C19&RC[-14])&IF(RC[-13]="",,"|n"&R1C20&RC[-13])&IF(RC[-12]="",,"|n"&R1C21&RC[-12])&IF(RC[-10]="",,"|n"&R1C23&RC[-10])&IF(RC[-9]="",,"|n"&R1C24&RC[-9])&IF(RC[-8]="",,"|n"&R1C25&RC[-8])&IF(RC[-7]="",,"|n"&R1C26&RC[-7])&IF(RC[-6]="",,"|n"&R1C27&RC[-6])&IF(RC[-5]="",,"|n"&R1C28&RC[-5])&IF(RC[-2]="",,"|n"&RC[-2]) -> 
AG809: =IF(RC[-26]&RC[-25]&RC[-24]&RC[-23]&RC[-22]&RC[-21]="",,R1C6)&IF(RC[-26]="",,"|n"&R1C7&RC[-26])&IF(RC[-25]="",,"|n"&R1C8&RC[-25])&IF(RC[-24]="",,"|n"&R1C9&RC[-24])&IF(RC[-23]="",,"|n"&R1C10&RC[-23])&IF(RC[-22]="",,"|n"&R1C11&RC[-22])&IF(RC[-21]="",,"|n"&R1C12&RC[-21])&IF(RC[-19]&RC[-18]&RC[-17]&RC[-16]="",,"|n"&R1C13)&IF(RC[-19]="",,"|n"&R1C14&RC[-19])&IF(RC[-18]="",,"|n"&R1C15&RC[-18])&IF(RC[-17]="",,"|n"&R1C16&RC[-17])&IF(RC[-16]="",,"|n"&R1C17&RC[-16])&IF(RC[-15]="",,"|n"&R1C18&RC[-15])&IF(RC[-14]="",,"|n"&R1C19&RC[-14])&IF(RC[-13]="",,"|n"&R1C20&RC[-13])&IF(RC[-12]="",,"|n"&R1C21&RC[-12])&IF(RC[-10]="",,"|n"&R1C23&RC[-10])&IF(RC[-9]="",,"|n"&R1C24&RC[-9])&IF(RC[-8]="",,"|n"&R1C25&RC[-8])&IF(RC[-7]="",,"|n"&R1C26&RC[-7])&IF(RC[-6]="",,"|n"&R1C27&RC[-6])&IF(RC[-5]="",,"|n"&R1C28&RC[-5])&IF(RC[-2]="",,"|n"&RC[-2]) -> 
AG810: =IF(RC[-26]&RC[-25]&RC[-24]&RC[-23]&RC[-22]&RC[-21]="",,R1C6)&IF(RC[-26]="",,"|n"&R1C7&RC[-26])&IF(RC[-25]="",,"|n"&R1C8&RC[-25])&IF(RC[-24]="",,"|n"&R1C9&RC[-24])&IF(RC[-23]="",,"|n"&R1C10&RC[-23])&IF(RC[-22]="",,"|n"&R1C11&RC[-22])&IF(RC[-21]="",,"|n"&R1C12&RC[-21])&IF(RC[-19]&RC[-18]&RC[-17]&RC[-16]="",,"|n"&R1C13)&IF(RC[-19]="",,"|n"&R1C14&RC[-19])&IF(RC[-18]="",,"|n"&R1C15&RC[-18])&IF(RC[-17]="",,"|n"&R1C16&RC[-17])&IF(RC[-16]="",,"|n"&R1C17&RC[-16])&IF(RC[-15]="",,"|n"&R1C18&RC[-15])&IF(RC[-14]="",,"|n"&R1C19&RC[-14])&IF(RC[-13]="",,"|n"&R1C20&RC[-13])&IF(RC[-12]="",,"|n"&R1C21&RC[-12])&IF(RC[-10]="",,"|n"&R1C23&RC[-10])&IF(RC[-9]="",,"|n"&R1C24&RC[-9])&IF(RC[-8]="",,"|n"&R1C25&RC[-8])&IF(RC[-7]="",,"|n"&R1C26&RC[-7])&IF(RC[-6]="",,"|n"&R1C27&RC[-6])&IF(RC[-5]="",,"|n"&R1C28&RC[-5])&IF(RC[-2]="",,"|n"&RC[-2]) -> 
AG811: =IF(RC[-26]&RC[-25]&RC[-24]&RC[-23]&RC[-22]&RC[-21]="",,R1C6)&IF(RC[-26]="",,"|n"&R1C7&RC[-26])&IF(RC[-25]="",,"|n"&R1C8&RC[-25])&IF(RC[-24]="",,"|n"&R1C9&RC[-24])&IF(RC[-23]="",,"|n"&R1C10&RC[-23])&IF(RC[-22]="",,"|n"&R1C11&RC[-22])&IF(RC[-21]="",,"|n"&R1C12&RC[-21])&IF(RC[-19]&RC[-18]&RC[-17]&RC[-16]="",,"|n"&R1C13)&IF(RC[-19]="",,"|n"&R1C14&RC[-19])&IF(RC[-18]="",,"|n"&R1C15&RC[-18])&IF(RC[-17]="",,"|n"&R1C16&RC[-17])&IF(RC[-16]="",,"|n"&R1C17&RC[-16])&IF(RC[-15]="",,"|n"&R1C18&RC[-15])&IF(RC[-14]="",,"|n"&R1C19&RC[-14])&IF(RC[-13]="",,"|n"&R1C20&RC[-13])&IF(RC[-12]="",,"|n"&R1C21&RC[-12])&IF(RC[-10]="",,"|n"&R1C23&RC[-10])&IF(RC[-9]="",,"|n"&R1C24&RC[-9])&IF(RC[-8]="",,"|n"&R1C25&RC[-8])&IF(RC[-7]="",,"|n"&R1C26&RC[-7])&IF(RC[-6]="",,"|n"&R1C27&RC[-6])&IF(RC[-5]="",,"|n"&R1C28&RC[-5])&IF(RC[-2]="",,"|n"&RC[-2]) -> 
AG812: =IF(RC[-26]&RC[-25]&RC[-24]&RC[-23]&RC[-22]&RC[-21]="",,R1C6)&IF(RC[-26]="",,"|n"&R1C7&RC[-26])&IF(RC[-25]="",,"|n"&R1C8&RC[-25])&IF(RC[-24]="",,"|n"&R1C9&RC[-24])&IF(RC[-23]="",,"|n"&R1C10&RC[-23])&IF(RC[-22]="",,"|n"&R1C11&RC[-22])&IF(RC[-21]="",,"|n"&R1C12&RC[-21])&IF(RC[-19]&RC[-18]&RC[-17]&RC[-16]="",,"|n"&R1C13)&IF(RC[-19]="",,"|n"&R1C14&RC[-19])&IF(RC[-18]="",,"|n"&R1C15&RC[-18])&IF(RC[-17]="",,"|n"&R1C16&RC[-17])&IF(RC[-16]="",,"|n"&R1C17&RC[-16])&IF(RC[-15]="",,"|n"&R1C18&RC[-15])&IF(RC[-14]="",,"|n"&R1C19&RC[-14])&IF(RC[-13]="",,"|n"&R1C20&RC[-13])&IF(RC[-12]="",,"|n"&R1C21&RC[-12])&IF(RC[-10]="",,"|n"&R1C23&RC[-10])&IF(RC[-9]="",,"|n"&R1C24&RC[-9])&IF(RC[-8]="",,"|n"&R1C25&RC[-8])&IF(RC[-7]="",,"|n"&R1C26&RC[-7])&IF(RC[-6]="",,"|n"&R1C27&RC[-6])&IF(RC[-5]="",,"|n"&R1C28&RC[-5])&IF(RC[-2]="",,"|n"&RC[-2]) -> 
AG813: =IF(RC[-26]&RC[-25]&RC[-24]&RC[-23]&RC[-22]&RC[-21]="",,R1C6)&IF(RC[-26]="",,"|n"&R1C7&RC[-26])&IF(RC[-25]="",,"|n"&R1C8&RC[-25])&IF(RC[-24]="",,"|n"&R1C9&RC[-24])&IF(RC[-23]="",,"|n"&R1C10&RC[-23])&IF(RC[-22]="",,"|n"&R1C11&RC[-22])&IF(RC[-21]="",,"|n"&R1C12&RC[-21])&IF(RC[-19]&RC[-18]&RC[-17]&RC[-16]="",,"|n"&R1C13)&IF(RC[-19]="",,"|n"&R1C14&RC[-19])&IF(RC[-18]="",,"|n"&R1C15&RC[-18])&IF(RC[-17]="",,"|n"&R1C16&RC[-17])&IF(RC[-16]="",,"|n"&R1C17&RC[-16])&IF(RC[-15]="",,"|n"&R1C18&RC[-15])&IF(RC[-14]="",,"|n"&R1C19&RC[-14])&IF(RC[-13]="",,"|n"&R1C20&RC[-13])&IF(RC[-12]="",,"|n"&R1C21&RC[-12])&IF(RC[-10]="",,"|n"&R1C23&RC[-10])&IF(RC[-9]="",,"|n"&R1C24&RC[-9])&IF(RC[-8]="",,"|n"&R1C25&RC[-8])&IF(RC[-7]="",,"|n"&R1C26&RC[-7])&IF(RC[-6]="",,"|n"&R1C27&RC[-6])&IF(RC[-5]="",,"|n"&R1C28&RC[-5])&IF(RC[-2]="",,"|n"&RC[-2]) -> 
AG814: =IF(RC[-26]&RC[-25]&RC[-24]&RC[-23]&RC[-22]&RC[-21]="",,R1C6)&IF(RC[-26]="",,"|n"&R1C7&RC[-26])&IF(RC[-25]="",,"|n"&R1C8&RC[-25])&IF(RC[-24]="",,"|n"&R1C9&RC[-24])&IF(RC[-23]="",,"|n"&R1C10&RC[-23])&IF(RC[-22]="",,"|n"&R1C11&RC[-22])&IF(RC[-21]="",,"|n"&R1C12&RC[-21])&IF(RC[-19]&RC[-18]&RC[-17]&RC[-16]="",,"|n"&R1C13)&IF(RC[-19]="",,"|n"&R1C14&RC[-19])&IF(RC[-18]="",,"|n"&R1C15&RC[-18])&IF(RC[-17]="",,"|n"&R1C16&RC[-17])&IF(RC[-16]="",,"|n"&R1C17&RC[-16])&IF(RC[-15]="",,"|n"&R1C18&RC[-15])&IF(RC[-14]="",,"|n"&R1C19&RC[-14])&IF(RC[-13]="",,"|n"&R1C20&RC[-13])&IF(RC[-12]="",,"|n"&R1C21&RC[-12])&IF(RC[-10]="",,"|n"&R1C23&RC[-10])&IF(RC[-9]="",,"|n"&R1C24&RC[-9])&IF(RC[-8]="",,"|n"&R1C25&RC[-8])&IF(RC[-7]="",,"|n"&R1C26&RC[-7])&IF(RC[-6]="",,"|n"&R1C27&RC[-6])&IF(RC[-5]="",,"|n"&R1C28&RC[-5])&IF(RC[-2]="",,"|n"&RC[-2]) -> 
AG815: =IF(RC[-26]&RC[-25]&RC[-24]&RC[-23]&RC[-22]&RC[-21]="",,R1C6)&IF(RC[-26]="",,"|n"&R1C7&RC[-26])&IF(RC[-25]="",,"|n"&R1C8&RC[-25])&IF(RC[-24]="",,"|n"&R1C9&RC[-24])&IF(RC[-23]="",,"|n"&R1C10&RC[-23])&IF(RC[-22]="",,"|n"&R1C11&RC[-22])&IF(RC[-21]="",,"|n"&R1C12&RC[-21])&IF(RC[-19]&RC[-18]&RC[-17]&RC[-16]="",,"|n"&R1C13)&IF(RC[-19]="",,"|n"&R1C14&RC[-19])&IF(RC[-18]="",,"|n"&R1C15&RC[-18])&IF(RC[-17]="",,"|n"&R1C16&RC[-17])&IF(RC[-16]="",,"|n"&R1C17&RC[-16])&IF(RC[-15]="",,"|n"&R1C18&RC[-15])&IF(RC[-14]="",,"|n"&R1C19&RC[-14])&IF(RC[-13]="",,"|n"&R1C20&RC[-13])&IF(RC[-12]="",,"|n"&R1C21&RC[-12])&IF(RC[-10]="",,"|n"&R1C23&RC[-10])&IF(RC[-9]="",,"|n"&R1C24&RC[-9])&IF(RC[-8]="",,"|n"&R1C25&RC[-8])&IF(RC[-7]="",,"|n"&R1C26&RC[-7])&IF(RC[-6]="",,"|n"&R1C27&RC[-6])&IF(RC[-5]="",,"|n"&R1C28&RC[-5])&IF(RC[-2]="",,"|n"&RC[-2]) -> 
AG816: =IF(RC[-26]&RC[-25]&RC[-24]&RC[-23]&RC[-22]&RC[-21]="",,R1C6)&IF(RC[-26]="",,"|n"&R1C7&RC[-26])&IF(RC[-25]="",,"|n"&R1C8&RC[-25])&IF(RC[-24]="",,"|n"&R1C9&RC[-24])&IF(RC[-23]="",,"|n"&R1C10&RC[-23])&IF(RC[-22]="",,"|n"&R1C11&RC[-22])&IF(RC[-21]="",,"|n"&R1C12&RC[-21])&IF(RC[-19]&RC[-18]&RC[-17]&RC[-16]="",,"|n"&R1C13)&IF(RC[-19]="",,"|n"&R1C14&RC[-19])&IF(RC[-18]="",,"|n"&R1C15&RC[-18])&IF(RC[-17]="",,"|n"&R1C16&RC[-17])&IF(RC[-16]="",,"|n"&R1C17&RC[-16])&IF(RC[-15]="",,"|n"&R1C18&RC[-15])&IF(RC[-14]="",,"|n"&R1C19&RC[-14])&IF(RC[-13]="",,"|n"&R1C20&RC[-13])&IF(RC[-12]="",,"|n"&R1C21&RC[-12])&IF(RC[-10]="",,"|n"&R1C23&RC[-10])&IF(RC[-9]="",,"|n"&R1C24&RC[-9])&IF(RC[-8]="",,"|n"&R1C25&RC[-8])&IF(RC[-7]="",,"|n"&R1C26&RC[-7])&IF(RC[-6]="",,"|n"&R1C27&RC[-6])&IF(RC[-5]="",,"|n"&R1C28&RC[-5])&IF(RC[-2]="",,"|n"&RC[-2]) -> 
AG817: =IF(RC[-26]&RC[-25]&RC[-24]&RC[-23]&RC[-22]&RC[-21]="",,R1C6)&IF(RC[-26]="",,"|n"&R1C7&RC[-26])&IF(RC[-25]="",,"|n"&R1C8&RC[-25])&IF(RC[-24]="",,"|n"&R1C9&RC[-24])&IF(RC[-23]="",,"|n"&R1C10&RC[-23])&IF(RC[-22]="",,"|n"&R1C11&RC[-22])&IF(RC[-21]="",,"|n"&R1C12&RC[-21])&IF(RC[-19]&RC[-18]&RC[-17]&RC[-16]="",,"|n"&R1C13)&IF(RC[-19]="",,"|n"&R1C14&RC[-19])&IF(RC[-18]="",,"|n"&R1C15&RC[-18])&IF(RC[-17]="",,"|n"&R1C16&RC[-17])&IF(RC[-16]="",,"|n"&R1C17&RC[-16])&IF(RC[-15]="",,"|n"&R1C18&RC[-15])&IF(RC[-14]="",,"|n"&R1C19&RC[-14])&IF(RC[-13]="",,"|n"&R1C20&RC[-13])&IF(RC[-12]="",,"|n"&R1C21&RC[-12])&IF(RC[-10]="",,"|n"&R1C23&RC[-10])&IF(RC[-9]="",,"|n"&R1C24&RC[-9])&IF(RC[-8]="",,"|n"&R1C25&RC[-8])&IF(RC[-7]="",,"|n"&R1C26&RC[-7])&IF(RC[-6]="",,"|n"&R1C27&RC[-6])&IF(RC[-5]="",,"|n"&R1C28&RC[-5])&IF(RC[-2]="",,"|n"&RC[-2]) -> 
AG818: =IF(RC[-26]&RC[-25]&RC[-24]&RC[-23]&RC[-22]&RC[-21]="",,R1C6)&IF(RC[-26]="",,"|n"&R1C7&RC[-26])&IF(RC[-25]="",,"|n"&R1C8&RC[-25])&IF(RC[-24]="",,"|n"&R1C9&RC[-24])&IF(RC[-23]="",,"|n"&R1C10&RC[-23])&IF(RC[-22]="",,"|n"&R1C11&RC[-22])&IF(RC[-21]="",,"|n"&R1C12&RC[-21])&IF(RC[-19]&RC[-18]&RC[-17]&RC[-16]="",,"|n"&R1C13)&IF(RC[-19]="",,"|n"&R1C14&RC[-19])&IF(RC[-18]="",,"|n"&R1C15&RC[-18])&IF(RC[-17]="",,"|n"&R1C16&RC[-17])&IF(RC[-16]="",,"|n"&R1C17&RC[-16])&IF(RC[-15]="",,"|n"&R1C18&RC[-15])&IF(RC[-14]="",,"|n"&R1C19&RC[-14])&IF(RC[-13]="",,"|n"&R1C20&RC[-13])&IF(RC[-12]="",,"|n"&R1C21&RC[-12])&IF(RC[-10]="",,"|n"&R1C23&RC[-10])&IF(RC[-9]="",,"|n"&R1C24&RC[-9])&IF(RC[-8]="",,"|n"&R1C25&RC[-8])&IF(RC[-7]="",,"|n"&R1C26&RC[-7])&IF(RC[-6]="",,"|n"&R1C27&RC[-6])&IF(RC[-5]="",,"|n"&R1C28&RC[-5])&IF(RC[-2]="",,"|n"&RC[-2]) -> 
AG819: =IF(RC[-26]&RC[-25]&RC[-24]&RC[-23]&RC[-22]&RC[-21]="",,R1C6)&IF(RC[-26]="",,"|n"&R1C7&RC[-26])&IF(RC[-25]="",,"|n"&R1C8&RC[-25])&IF(RC[-24]="",,"|n"&R1C9&RC[-24])&IF(RC[-23]="",,"|n"&R1C10&RC[-23])&IF(RC[-22]="",,"|n"&R1C11&RC[-22])&IF(RC[-21]="",,"|n"&R1C12&RC[-21])&IF(RC[-19]&RC[-18]&RC[-17]&RC[-16]="",,"|n"&R1C13)&IF(RC[-19]="",,"|n"&R1C14&RC[-19])&IF(RC[-18]="",,"|n"&R1C15&RC[-18])&IF(RC[-17]="",,"|n"&R1C16&RC[-17])&IF(RC[-16]="",,"|n"&R1C17&RC[-16])&IF(RC[-15]="",,"|n"&R1C18&RC[-15])&IF(RC[-14]="",,"|n"&R1C19&RC[-14])&IF(RC[-13]="",,"|n"&R1C20&RC[-13])&IF(RC[-12]="",,"|n"&R1C21&RC[-12])&IF(RC[-10]="",,"|n"&R1C23&RC[-10])&IF(RC[-9]="",,"|n"&R1C24&RC[-9])&IF(RC[-8]="",,"|n"&R1C25&RC[-8])&IF(RC[-7]="",,"|n"&R1C26&RC[-7])&IF(RC[-6]="",,"|n"&R1C27&RC[-6])&IF(RC[-5]="",,"|n"&R1C28&RC[-5])&IF(RC[-2]="",,"|n"&RC[-2]) -> 
AG820: =IF(RC[-26]&RC[-25]&RC[-24]&RC[-23]&RC[-22]&RC[-21]="",,R1C6)&IF(RC[-26]="",,"|n"&R1C7&RC[-26])&IF(RC[-25]="",,"|n"&R1C8&RC[-25])&IF(RC[-24]="",,"|n"&R1C9&RC[-24])&IF(RC[-23]="",,"|n"&R1C10&RC[-23])&IF(RC[-22]="",,"|n"&R1C11&RC[-22])&IF(RC[-21]="",,"|n"&R1C12&RC[-21])&IF(RC[-19]&RC[-18]&RC[-17]&RC[-16]="",,"|n"&R1C13)&IF(RC[-19]="",,"|n"&R1C14&RC[-19])&IF(RC[-18]="",,"|n"&R1C15&RC[-18])&IF(RC[-17]="",,"|n"&R1C16&RC[-17])&IF(RC[-16]="",,"|n"&R1C17&RC[-16])&IF(RC[-15]="",,"|n"&R1C18&RC[-15])&IF(RC[-14]="",,"|n"&R1C19&RC[-14])&IF(RC[-13]="",,"|n"&R1C20&RC[-13])&IF(RC[-12]="",,"|n"&R1C21&RC[-12])&IF(RC[-10]="",,"|n"&R1C23&RC[-10])&IF(RC[-9]="",,"|n"&R1C24&RC[-9])&IF(RC[-8]="",,"|n"&R1C25&RC[-8])&IF(RC[-7]="",,"|n"&R1C26&RC[-7])&IF(RC[-6]="",,"|n"&R1C27&RC[-6])&IF(RC[-5]="",,"|n"&R1C28&RC[-5])&IF(RC[-2]="",,"|n"&RC[-2]) -> 
AG821: =IF(RC[-26]&RC[-25]&RC[-24]&RC[-23]&RC[-22]&RC[-21]="",,R1C6)&IF(RC[-26]="",,"|n"&R1C7&RC[-26])&IF(RC[-25]="",,"|n"&R1C8&RC[-25])&IF(RC[-24]="",,"|n"&R1C9&RC[-24])&IF(RC[-23]="",,"|n"&R1C10&RC[-23])&IF(RC[-22]="",,"|n"&R1C11&RC[-22])&IF(RC[-21]="",,"|n"&R1C12&RC[-21])&IF(RC[-19]&RC[-18]&RC[-17]&RC[-16]="",,"|n"&R1C13)&IF(RC[-19]="",,"|n"&R1C14&RC[-19])&IF(RC[-18]="",,"|n"&R1C15&RC[-18])&IF(RC[-17]="",,"|n"&R1C16&RC[-17])&IF(RC[-16]="",,"|n"&R1C17&RC[-16])&IF(RC[-15]="",,"|n"&R1C18&RC[-15])&IF(RC[-14]="",,"|n"&R1C19&RC[-14])&IF(RC[-13]="",,"|n"&R1C20&RC[-13])&IF(RC[-12]="",,"|n"&R1C21&RC[-12])&IF(RC[-10]="",,"|n"&R1C23&RC[-10])&IF(RC[-9]="",,"|n"&R1C24&RC[-9])&IF(RC[-8]="",,"|n"&R1C25&RC[-8])&IF(RC[-7]="",,"|n"&R1C26&RC[-7])&IF(RC[-6]="",,"|n"&R1C27&RC[-6])&IF(RC[-5]="",,"|n"&R1C28&RC[-5])&IF(RC[-2]="",,"|n"&RC[-2]) -> 
AG822: =IF(RC[-26]&RC[-25]&RC[-24]&RC[-23]&RC[-22]&RC[-21]="",,R1C6)&IF(RC[-26]="",,"|n"&R1C7&RC[-26])&IF(RC[-25]="",,"|n"&R1C8&RC[-25])&IF(RC[-24]="",,"|n"&R1C9&RC[-24])&IF(RC[-23]="",,"|n"&R1C10&RC[-23])&IF(RC[-22]="",,"|n"&R1C11&RC[-22])&IF(RC[-21]="",,"|n"&R1C12&RC[-21])&IF(RC[-19]&RC[-18]&RC[-17]&RC[-16]="",,"|n"&R1C13)&IF(RC[-19]="",,"|n"&R1C14&RC[-19])&IF(RC[-18]="",,"|n"&R1C15&RC[-18])&IF(RC[-17]="",,"|n"&R1C16&RC[-17])&IF(RC[-16]="",,"|n"&R1C17&RC[-16])&IF(RC[-15]="",,"|n"&R1C18&RC[-15])&IF(RC[-14]="",,"|n"&R1C19&RC[-14])&IF(RC[-13]="",,"|n"&R1C20&RC[-13])&IF(RC[-12]="",,"|n"&R1C21&RC[-12])&IF(RC[-10]="",,"|n"&R1C23&RC[-10])&IF(RC[-9]="",,"|n"&R1C24&RC[-9])&IF(RC[-8]="",,"|n"&R1C25&RC[-8])&IF(RC[-7]="",,"|n"&R1C26&RC[-7])&IF(RC[-6]="",,"|n"&R1C27&RC[-6])&IF(RC[-5]="",,"|n"&R1C28&RC[-5])&IF(RC[-2]="",,"|n"&RC[-2]) -> 
AG823: =IF(RC[-26]&RC[-25]&RC[-24]&RC[-23]&RC[-22]&RC[-21]="",,R1C6)&IF(RC[-26]="",,"|n"&R1C7&RC[-26])&IF(RC[-25]="",,"|n"&R1C8&RC[-25])&IF(RC[-24]="",,"|n"&R1C9&RC[-24])&IF(RC[-23]="",,"|n"&R1C10&RC[-23])&IF(RC[-22]="",,"|n"&R1C11&RC[-22])&IF(RC[-21]="",,"|n"&R1C12&RC[-21])&IF(RC[-19]&RC[-18]&RC[-17]&RC[-16]="",,"|n"&R1C13)&IF(RC[-19]="",,"|n"&R1C14&RC[-19])&IF(RC[-18]="",,"|n"&R1C15&RC[-18])&IF(RC[-17]="",,"|n"&R1C16&RC[-17])&IF(RC[-16]="",,"|n"&R1C17&RC[-16])&IF(RC[-15]="",,"|n"&R1C18&RC[-15])&IF(RC[-14]="",,"|n"&R1C19&RC[-14])&IF(RC[-13]="",,"|n"&R1C20&RC[-13])&IF(RC[-12]="",,"|n"&R1C21&RC[-12])&IF(RC[-10]="",,"|n"&R1C23&RC[-10])&IF(RC[-9]="",,"|n"&R1C24&RC[-9])&IF(RC[-8]="",,"|n"&R1C25&RC[-8])&IF(RC[-7]="",,"|n"&R1C26&RC[-7])&IF(RC[-6]="",,"|n"&R1C27&RC[-6])&IF(RC[-5]="",,"|n"&R1C28&RC[-5])&IF(RC[-2]="",,"|n"&RC[-2]) -> 
AG824: =IF(RC[-26]&RC[-25]&RC[-24]&RC[-23]&RC[-22]&RC[-21]="",,R1C6)&IF(RC[-26]="",,"|n"&R1C7&RC[-26])&IF(RC[-25]="",,"|n"&R1C8&RC[-25])&IF(RC[-24]="",,"|n"&R1C9&RC[-24])&IF(RC[-23]="",,"|n"&R1C10&RC[-23])&IF(RC[-22]="",,"|n"&R1C11&RC[-22])&IF(RC[-21]="",,"|n"&R1C12&RC[-21])&IF(RC[-19]&RC[-18]&RC[-17]&RC[-16]="",,"|n"&R1C13)&IF(RC[-19]="",,"|n"&R1C14&RC[-19])&IF(RC[-18]="",,"|n"&R1C15&RC[-18])&IF(RC[-17]="",,"|n"&R1C16&RC[-17])&IF(RC[-16]="",,"|n"&R1C17&RC[-16])&IF(RC[-15]="",,"|n"&R1C18&RC[-15])&IF(RC[-14]="",,"|n"&R1C19&RC[-14])&IF(RC[-13]="",,"|n"&R1C20&RC[-13])&IF(RC[-12]="",,"|n"&R1C21&RC[-12])&IF(RC[-10]="",,"|n"&R1C23&RC[-10])&IF(RC[-9]="",,"|n"&R1C24&RC[-9])&IF(RC[-8]="",,"|n"&R1C25&RC[-8])&IF(RC[-7]="",,"|n"&R1C26&RC[-7])&IF(RC[-6]="",,"|n"&R1C27&RC[-6])&IF(RC[-5]="",,"|n"&R1C28&RC[-5])&IF(RC[-2]="",,"|n"&RC[-2]) -> 
AG825: =IF(RC[-26]&RC[-25]&RC[-24]&RC[-23]&RC[-22]&RC[-21]="",,R1C6)&IF(RC[-26]="",,"|n"&R1C7&RC[-26])&IF(RC[-25]="",,"|n"&R1C8&RC[-25])&IF(RC[-24]="",,"|n"&R1C9&RC[-24])&IF(RC[-23]="",,"|n"&R1C10&RC[-23])&IF(RC[-22]="",,"|n"&R1C11&RC[-22])&IF(RC[-21]="",,"|n"&R1C12&RC[-21])&IF(RC[-19]&RC[-18]&RC[-17]&RC[-16]="",,"|n"&R1C13)&IF(RC[-19]="",,"|n"&R1C14&RC[-19])&IF(RC[-18]="",,"|n"&R1C15&RC[-18])&IF(RC[-17]="",,"|n"&R1C16&RC[-17])&IF(RC[-16]="",,"|n"&R1C17&RC[-16])&IF(RC[-15]="",,"|n"&R1C18&RC[-15])&IF(RC[-14]="",,"|n"&R1C19&RC[-14])&IF(RC[-13]="",,"|n"&R1C20&RC[-13])&IF(RC[-12]="",,"|n"&R1C21&RC[-12])&IF(RC[-10]="",,"|n"&R1C23&RC[-10])&IF(RC[-9]="",,"|n"&R1C24&RC[-9])&IF(RC[-8]="",,"|n"&R1C25&RC[-8])&IF(RC[-7]="",,"|n"&R1C26&RC[-7])&IF(RC[-6]="",,"|n"&R1C27&RC[-6])&IF(RC[-5]="",,"|n"&R1C28&RC[-5])&IF(RC[-2]="",,"|n"&RC[-2]) -> 
AG826: =IF(RC[-26]&RC[-25]&RC[-24]&RC[-23]&RC[-22]&RC[-21]="",,R1C6)&IF(RC[-26]="",,"|n"&R1C7&RC[-26])&IF(RC[-25]="",,"|n"&R1C8&RC[-25])&IF(RC[-24]="",,"|n"&R1C9&RC[-24])&IF(RC[-23]="",,"|n"&R1C10&RC[-23])&IF(RC[-22]="",,"|n"&R1C11&RC[-22])&IF(RC[-21]="",,"|n"&R1C12&RC[-21])&IF(RC[-19]&RC[-18]&RC[-17]&RC[-16]="",,"|n"&R1C13)&IF(RC[-19]="",,"|n"&R1C14&RC[-19])&IF(RC[-18]="",,"|n"&R1C15&RC[-18])&IF(RC[-17]="",,"|n"&R1C16&RC[-17])&IF(RC[-16]="",,"|n"&R1C17&RC[-16])&IF(RC[-15]="",,"|n"&R1C18&RC[-15])&IF(RC[-14]="",,"|n"&R1C19&RC[-14])&IF(RC[-13]="",,"|n"&R1C20&RC[-13])&IF(RC[-12]="",,"|n"&R1C21&RC[-12])&IF(RC[-10]="",,"|n"&R1C23&RC[-10])&IF(RC[-9]="",,"|n"&R1C24&RC[-9])&IF(RC[-8]="",,"|n"&R1C25&RC[-8])&IF(RC[-7]="",,"|n"&R1C26&RC[-7])&IF(RC[-6]="",,"|n"&R1C27&RC[-6])&IF(RC[-5]="",,"|n"&R1C28&RC[-5])&IF(RC[-2]="",,"|n"&RC[-2]) -> 
AG827: =IF(RC[-26]&RC[-25]&RC[-24]&RC[-23]&RC[-22]&RC[-21]="",,R1C6)&IF(RC[-26]="",,"|n"&R1C7&RC[-26])&IF(RC[-25]="",,"|n"&R1C8&RC[-25])&IF(RC[-24]="",,"|n"&R1C9&RC[-24])&IF(RC[-23]="",,"|n"&R1C10&RC[-23])&IF(RC[-22]="",,"|n"&R1C11&RC[-22])&IF(RC[-21]="",,"|n"&R1C12&RC[-21])&IF(RC[-19]&RC[-18]&RC[-17]&RC[-16]="",,"|n"&R1C13)&IF(RC[-19]="",,"|n"&R1C14&RC[-19])&IF(RC[-18]="",,"|n"&R1C15&RC[-18])&IF(RC[-17]="",,"|n"&R1C16&RC[-17])&IF(RC[-16]="",,"|n"&R1C17&RC[-16])&IF(RC[-15]="",,"|n"&R1C18&RC[-15])&IF(RC[-14]="",,"|n"&R1C19&RC[-14])&IF(RC[-13]="",,"|n"&R1C20&RC[-13])&IF(RC[-12]="",,"|n"&R1C21&RC[-12])&IF(RC[-10]="",,"|n"&R1C23&RC[-10])&IF(RC[-9]="",,"|n"&R1C24&RC[-9])&IF(RC[-8]="",,"|n"&R1C25&RC[-8])&IF(RC[-7]="",,"|n"&R1C26&RC[-7])&IF(RC[-6]="",,"|n"&R1C27&RC[-6])&IF(RC[-5]="",,"|n"&R1C28&RC[-5])&IF(RC[-2]="",,"|n"&RC[-2]) -> 
AG828: =IF(RC[-26]&RC[-25]&RC[-24]&RC[-23]&RC[-22]&RC[-21]="",,R1C6)&IF(RC[-26]="",,"|n"&R1C7&RC[-26])&IF(RC[-25]="",,"|n"&R1C8&RC[-25])&IF(RC[-24]="",,"|n"&R1C9&RC[-24])&IF(RC[-23]="",,"|n"&R1C10&RC[-23])&IF(RC[-22]="",,"|n"&R1C11&RC[-22])&IF(RC[-21]="",,"|n"&R1C12&RC[-21])&IF(RC[-19]&RC[-18]&RC[-17]&RC[-16]="",,"|n"&R1C13)&IF(RC[-19]="",,"|n"&R1C14&RC[-19])&IF(RC[-18]="",,"|n"&R1C15&RC[-18])&IF(RC[-17]="",,"|n"&R1C16&RC[-17])&IF(RC[-16]="",,"|n"&R1C17&RC[-16])&IF(RC[-15]="",,"|n"&R1C18&RC[-15])&IF(RC[-14]="",,"|n"&R1C19&RC[-14])&IF(RC[-13]="",,"|n"&R1C20&RC[-13])&IF(RC[-12]="",,"|n"&R1C21&RC[-12])&IF(RC[-10]="",,"|n"&R1C23&RC[-10])&IF(RC[-9]="",,"|n"&R1C24&RC[-9])&IF(RC[-8]="",,"|n"&R1C25&RC[-8])&IF(RC[-7]="",,"|n"&R1C26&RC[-7])&IF(RC[-6]="",,"|n"&R1C27&RC[-6])&IF(RC[-5]="",,"|n"&R1C28&RC[-5])&IF(RC[-2]="",,"|n"&RC[-2]) -> 
AG829: =IF(RC[-26]&RC[-25]&RC[-24]&RC[-23]&RC[-22]&RC[-21]="",,R1C6)&IF(RC[-26]="",,"|n"&R1C7&RC[-26])&IF(RC[-25]="",,"|n"&R1C8&RC[-25])&IF(RC[-24]="",,"|n"&R1C9&RC[-24])&IF(RC[-23]="",,"|n"&R1C10&RC[-23])&IF(RC[-22]="",,"|n"&R1C11&RC[-22])&IF(RC[-21]="",,"|n"&R1C12&RC[-21])&IF(RC[-19]&RC[-18]&RC[-17]&RC[-16]="",,"|n"&R1C13)&IF(RC[-19]="",,"|n"&R1C14&RC[-19])&IF(RC[-18]="",,"|n"&R1C15&RC[-18])&IF(RC[-17]="",,"|n"&R1C16&RC[-17])&IF(RC[-16]="",,"|n"&R1C17&RC[-16])&IF(RC[-15]="",,"|n"&R1C18&RC[-15])&IF(RC[-14]="",,"|n"&R1C19&RC[-14])&IF(RC[-13]="",,"|n"&R1C20&RC[-13])&IF(RC[-12]="",,"|n"&R1C21&RC[-12])&IF(RC[-10]="",,"|n"&R1C23&RC[-10])&IF(RC[-9]="",,"|n"&R1C24&RC[-9])&IF(RC[-8]="",,"|n"&R1C25&RC[-8])&IF(RC[-7]="",,"|n"&R1C26&RC[-7])&IF(RC[-6]="",,"|n"&R1C27&RC[-6])&IF(RC[-5]="",,"|n"&R1C28&RC[-5])&IF(RC[-2]="",,"|n"&RC[-2]) -> 
AG830: =IF(RC[-26]&RC[-25]&RC[-24]&RC[-23]&RC[-22]&RC[-21]="",,R1C6)&IF(RC[-26]="",,"|n"&R1C7&RC[-26])&IF(RC[-25]="",,"|n"&R1C8&RC[-25])&IF(RC[-24]="",,"|n"&R1C9&RC[-24])&IF(RC[-23]="",,"|n"&R1C10&RC[-23])&IF(RC[-22]="",,"|n"&R1C11&RC[-22])&IF(RC[-21]="",,"|n"&R1C12&RC[-21])&IF(RC[-19]&RC[-18]&RC[-17]&RC[-16]="",,"|n"&R1C13)&IF(RC[-19]="",,"|n"&R1C14&RC[-19])&IF(RC[-18]="",,"|n"&R1C15&RC[-18])&IF(RC[-17]="",,"|n"&R1C16&RC[-17])&IF(RC[-16]="",,"|n"&R1C17&RC[-16])&IF(RC[-15]="",,"|n"&R1C18&RC[-15])&IF(RC[-14]="",,"|n"&R1C19&RC[-14])&IF(RC[-13]="",,"|n"&R1C20&RC[-13])&IF(RC[-12]="",,"|n"&R1C21&RC[-12])&IF(RC[-10]="",,"|n"&R1C23&RC[-10])&IF(RC[-9]="",,"|n"&R1C24&RC[-9])&IF(RC[-8]="",,"|n"&R1C25&RC[-8])&IF(RC[-7]="",,"|n"&R1C26&RC[-7])&IF(RC[-6]="",,"|n"&R1C27&RC[-6])&IF(RC[-5]="",,"|n"&R1C28&RC[-5])&IF(RC[-2]="",,"|n"&RC[-2]) -> 
AG831: =IF(RC[-26]&RC[-25]&RC[-24]&RC[-23]&RC[-22]&RC[-21]="",,R1C6)&IF(RC[-26]="",,"|n"&R1C7&RC[-26])&IF(RC[-25]="",,"|n"&R1C8&RC[-25])&IF(RC[-24]="",,"|n"&R1C9&RC[-24])&IF(RC[-23]="",,"|n"&R1C10&RC[-23])&IF(RC[-22]="",,"|n"&R1C11&RC[-22])&IF(RC[-21]="",,"|n"&R1C12&RC[-21])&IF(RC[-19]&RC[-18]&RC[-17]&RC[-16]="",,"|n"&R1C13)&IF(RC[-19]="",,"|n"&R1C14&RC[-19])&IF(RC[-18]="",,"|n"&R1C15&RC[-18])&IF(RC[-17]="",,"|n"&R1C16&RC[-17])&IF(RC[-16]="",,"|n"&R1C17&RC[-16])&IF(RC[-15]="",,"|n"&R1C18&RC[-15])&IF(RC[-14]="",,"|n"&R1C19&RC[-14])&IF(RC[-13]="",,"|n"&R1C20&RC[-13])&IF(RC[-12]="",,"|n"&R1C21&RC[-12])&IF(RC[-10]="",,"|n"&R1C23&RC[-10])&IF(RC[-9]="",,"|n"&R1C24&RC[-9])&IF(RC[-8]="",,"|n"&R1C25&RC[-8])&IF(RC[-7]="",,"|n"&R1C26&RC[-7])&IF(RC[-6]="",,"|n"&R1C27&RC[-6])&IF(RC[-5]="",,"|n"&R1C28&RC[-5])&IF(RC[-2]="",,"|n"&RC[-2]) -> 
AG832: =IF(RC[-26]&RC[-25]&RC[-24]&RC[-23]&RC[-22]&RC[-21]="",,R1C6)&IF(RC[-26]="",,"|n"&R1C7&RC[-26])&IF(RC[-25]="",,"|n"&R1C8&RC[-25])&IF(RC[-24]="",,"|n"&R1C9&RC[-24])&IF(RC[-23]="",,"|n"&R1C10&RC[-23])&IF(RC[-22]="",,"|n"&R1C11&RC[-22])&IF(RC[-21]="",,"|n"&R1C12&RC[-21])&IF(RC[-19]&RC[-18]&RC[-17]&RC[-16]="",,"|n"&R1C13)&IF(RC[-19]="",,"|n"&R1C14&RC[-19])&IF(RC[-18]="",,"|n"&R1C15&RC[-18])&IF(RC[-17]="",,"|n"&R1C16&RC[-17])&IF(RC[-16]="",,"|n"&R1C17&RC[-16])&IF(RC[-15]="",,"|n"&R1C18&RC[-15])&IF(RC[-14]="",,"|n"&R1C19&RC[-14])&IF(RC[-13]="",,"|n"&R1C20&RC[-13])&IF(RC[-12]="",,"|n"&R1C21&RC[-12])&IF(RC[-10]="",,"|n"&R1C23&RC[-10])&IF(RC[-9]="",,"|n"&R1C24&RC[-9])&IF(RC[-8]="",,"|n"&R1C25&RC[-8])&IF(RC[-7]="",,"|n"&R1C26&RC[-7])&IF(RC[-6]="",,"|n"&R1C27&RC[-6])&IF(RC[-5]="",,"|n"&R1C28&RC[-5])&IF(RC[-2]="",,"|n"&RC[-2]) -> 
AG833: =IF(RC[-26]&RC[-25]&RC[-24]&RC[-23]&RC[-22]&RC[-21]="",,R1C6)&IF(RC[-26]="",,"|n"&R1C7&RC[-26])&IF(RC[-25]="",,"|n"&R1C8&RC[-25])&IF(RC[-24]="",,"|n"&R1C9&RC[-24])&IF(RC[-23]="",,"|n"&R1C10&RC[-23])&IF(RC[-22]="",,"|n"&R1C11&RC[-22])&IF(RC[-21]="",,"|n"&R1C12&RC[-21])&IF(RC[-19]&RC[-18]&RC[-17]&RC[-16]="",,"|n"&R1C13)&IF(RC[-19]="",,"|n"&R1C14&RC[-19])&IF(RC[-18]="",,"|n"&R1C15&RC[-18])&IF(RC[-17]="",,"|n"&R1C16&RC[-17])&IF(RC[-16]="",,"|n"&R1C17&RC[-16])&IF(RC[-15]="",,"|n"&R1C18&RC[-15])&IF(RC[-14]="",,"|n"&R1C19&RC[-14])&IF(RC[-13]="",,"|n"&R1C20&RC[-13])&IF(RC[-12]="",,"|n"&R1C21&RC[-12])&IF(RC[-10]="",,"|n"&R1C23&RC[-10])&IF(RC[-9]="",,"|n"&R1C24&RC[-9])&IF(RC[-8]="",,"|n"&R1C25&RC[-8])&IF(RC[-7]="",,"|n"&R1C26&RC[-7])&IF(RC[-6]="",,"|n"&R1C27&RC[-6])&IF(RC[-5]="",,"|n"&R1C28&RC[-5])&IF(RC[-2]="",,"|n"&RC[-2]) -> 
AG834: =IF(RC[-26]&RC[-25]&RC[-24]&RC[-23]&RC[-22]&RC[-21]="",,R1C6)&IF(RC[-26]="",,"|n"&R1C7&RC[-26])&IF(RC[-25]="",,"|n"&R1C8&RC[-25])&IF(RC[-24]="",,"|n"&R1C9&RC[-24])&IF(RC[-23]="",,"|n"&R1C10&RC[-23])&IF(RC[-22]="",,"|n"&R1C11&RC[-22])&IF(RC[-21]="",,"|n"&R1C12&RC[-21])&IF(RC[-19]&RC[-18]&RC[-17]&RC[-16]="",,"|n"&R1C13)&IF(RC[-19]="",,"|n"&R1C14&RC[-19])&IF(RC[-18]="",,"|n"&R1C15&RC[-18])&IF(RC[-17]="",,"|n"&R1C16&RC[-17])&IF(RC[-16]="",,"|n"&R1C17&RC[-16])&IF(RC[-15]="",,"|n"&R1C18&RC[-15])&IF(RC[-14]="",,"|n"&R1C19&RC[-14])&IF(RC[-13]="",,"|n"&R1C20&RC[-13])&IF(RC[-12]="",,"|n"&R1C21&RC[-12])&IF(RC[-10]="",,"|n"&R1C23&RC[-10])&IF(RC[-9]="",,"|n"&R1C24&RC[-9])&IF(RC[-8]="",,"|n"&R1C25&RC[-8])&IF(RC[-7]="",,"|n"&R1C26&RC[-7])&IF(RC[-6]="",,"|n"&R1C27&RC[-6])&IF(RC[-5]="",,"|n"&R1C28&RC[-5])&IF(RC[-2]="",,"|n"&RC[-2]) -> 
AG835: =IF(RC[-26]&RC[-25]&RC[-24]&RC[-23]&RC[-22]&RC[-21]="",,R1C6)&IF(RC[-26]="",,"|n"&R1C7&RC[-26])&IF(RC[-25]="",,"|n"&R1C8&RC[-25])&IF(RC[-24]="",,"|n"&R1C9&RC[-24])&IF(RC[-23]="",,"|n"&R1C10&RC[-23])&IF(RC[-22]="",,"|n"&R1C11&RC[-22])&IF(RC[-21]="",,"|n"&R1C12&RC[-21])&IF(RC[-19]&RC[-18]&RC[-17]&RC[-16]="",,"|n"&R1C13)&IF(RC[-19]="",,"|n"&R1C14&RC[-19])&IF(RC[-18]="",,"|n"&R1C15&RC[-18])&IF(RC[-17]="",,"|n"&R1C16&RC[-17])&IF(RC[-16]="",,"|n"&R1C17&RC[-16])&IF(RC[-15]="",,"|n"&R1C18&RC[-15])&IF(RC[-14]="",,"|n"&R1C19&RC[-14])&IF(RC[-13]="",,"|n"&R1C20&RC[-13])&IF(RC[-12]="",,"|n"&R1C21&RC[-12])&IF(RC[-10]="",,"|n"&R1C23&RC[-10])&IF(RC[-9]="",,"|n"&R1C24&RC[-9])&IF(RC[-8]="",,"|n"&R1C25&RC[-8])&IF(RC[-7]="",,"|n"&R1C26&RC[-7])&IF(RC[-6]="",,"|n"&R1C27&RC[-6])&IF(RC[-5]="",,"|n"&R1C28&RC[-5])&IF(RC[-2]="",,"|n"&RC[-2]) -> 
AG836: =IF(RC[-26]&RC[-25]&RC[-24]&RC[-23]&RC[-22]&RC[-21]="",,R1C6)&IF(RC[-26]="",,"|n"&R1C7&RC[-26])&IF(RC[-25]="",,"|n"&R1C8&RC[-25])&IF(RC[-24]="",,"|n"&R1C9&RC[-24])&IF(RC[-23]="",,"|n"&R1C10&RC[-23])&IF(RC[-22]="",,"|n"&R1C11&RC[-22])&IF(RC[-21]="",,"|n"&R1C12&RC[-21])&IF(RC[-19]&RC[-18]&RC[-17]&RC[-16]="",,"|n"&R1C13)&IF(RC[-19]="",,"|n"&R1C14&RC[-19])&IF(RC[-18]="",,"|n"&R1C15&RC[-18])&IF(RC[-17]="",,"|n"&R1C16&RC[-17])&IF(RC[-16]="",,"|n"&R1C17&RC[-16])&IF(RC[-15]="",,"|n"&R1C18&RC[-15])&IF(RC[-14]="",,"|n"&R1C19&RC[-14])&IF(RC[-13]="",,"|n"&R1C20&RC[-13])&IF(RC[-12]="",,"|n"&R1C21&RC[-12])&IF(RC[-10]="",,"|n"&R1C23&RC[-10])&IF(RC[-9]="",,"|n"&R1C24&RC[-9])&IF(RC[-8]="",,"|n"&R1C25&RC[-8])&IF(RC[-7]="",,"|n"&R1C26&RC[-7])&IF(RC[-6]="",,"|n"&R1C27&RC[-6])&IF(RC[-5]="",,"|n"&R1C28&RC[-5])&IF(RC[-2]="",,"|n"&RC[-2]) -> 
AG837: =IF(RC[-26]&RC[-25]&RC[-24]&RC[-23]&RC[-22]&RC[-21]="",,R1C6)&IF(RC[-26]="",,"|n"&R1C7&RC[-26])&IF(RC[-25]="",,"|n"&R1C8&RC[-25])&IF(RC[-24]="",,"|n"&R1C9&RC[-24])&IF(RC[-23]="",,"|n"&R1C10&RC[-23])&IF(RC[-22]="",,"|n"&R1C11&RC[-22])&IF(RC[-21]="",,"|n"&R1C12&RC[-21])&IF(RC[-19]&RC[-18]&RC[-17]&RC[-16]="",,"|n"&R1C13)&IF(RC[-19]="",,"|n"&R1C14&RC[-19])&IF(RC[-18]="",,"|n"&R1C15&RC[-18])&IF(RC[-17]="",,"|n"&R1C16&RC[-17])&IF(RC[-16]="",,"|n"&R1C17&RC[-16])&IF(RC[-15]="",,"|n"&R1C18&RC[-15])&IF(RC[-14]="",,"|n"&R1C19&RC[-14])&IF(RC[-13]="",,"|n"&R1C20&RC[-13])&IF(RC[-12]="",,"|n"&R1C21&RC[-12])&IF(RC[-10]="",,"|n"&R1C23&RC[-10])&IF(RC[-9]="",,"|n"&R1C24&RC[-9])&IF(RC[-8]="",,"|n"&R1C25&RC[-8])&IF(RC[-7]="",,"|n"&R1C26&RC[-7])&IF(RC[-6]="",,"|n"&R1C27&RC[-6])&IF(RC[-5]="",,"|n"&R1C28&RC[-5])&IF(RC[-2]="",,"|n"&RC[-2]) -> 
AG838: =IF(RC[-26]&RC[-25]&RC[-24]&RC[-23]&RC[-22]&RC[-21]="",,R1C6)&IF(RC[-26]="",,"|n"&R1C7&RC[-26])&IF(RC[-25]="",,"|n"&R1C8&RC[-25])&IF(RC[-24]="",,"|n"&R1C9&RC[-24])&IF(RC[-23]="",,"|n"&R1C10&RC[-23])&IF(RC[-22]="",,"|n"&R1C11&RC[-22])&IF(RC[-21]="",,"|n"&R1C12&RC[-21])&IF(RC[-19]&RC[-18]&RC[-17]&RC[-16]="",,"|n"&R1C13)&IF(RC[-19]="",,"|n"&R1C14&RC[-19])&IF(RC[-18]="",,"|n"&R1C15&RC[-18])&IF(RC[-17]="",,"|n"&R1C16&RC[-17])&IF(RC[-16]="",,"|n"&R1C17&RC[-16])&IF(RC[-15]="",,"|n"&R1C18&RC[-15])&IF(RC[-14]="",,"|n"&R1C19&RC[-14])&IF(RC[-13]="",,"|n"&R1C20&RC[-13])&IF(RC[-12]="",,"|n"&R1C21&RC[-12])&IF(RC[-10]="",,"|n"&R1C23&RC[-10])&IF(RC[-9]="",,"|n"&R1C24&RC[-9])&IF(RC[-8]="",,"|n"&R1C25&RC[-8])&IF(RC[-7]="",,"|n"&R1C26&RC[-7])&IF(RC[-6]="",,"|n"&R1C27&RC[-6])&IF(RC[-5]="",,"|n"&R1C28&RC[-5])&IF(RC[-2]="",,"|n"&RC[-2]) -> 
AG839: =IF(RC[-26]&RC[-25]&RC[-24]&RC[-23]&RC[-22]&RC[-21]="",,R1C6)&IF(RC[-26]="",,"|n"&R1C7&RC[-26])&IF(RC[-25]="",,"|n"&R1C8&RC[-25])&IF(RC[-24]="",,"|n"&R1C9&RC[-24])&IF(RC[-23]="",,"|n"&R1C10&RC[-23])&IF(RC[-22]="",,"|n"&R1C11&RC[-22])&IF(RC[-21]="",,"|n"&R1C12&RC[-21])&IF(RC[-19]&RC[-18]&RC[-17]&RC[-16]="",,"|n"&R1C13)&IF(RC[-19]="",,"|n"&R1C14&RC[-19])&IF(RC[-18]="",,"|n"&R1C15&RC[-18])&IF(RC[-17]="",,"|n"&R1C16&RC[-17])&IF(RC[-16]="",,"|n"&R1C17&RC[-16])&IF(RC[-15]="",,"|n"&R1C18&RC[-15])&IF(RC[-14]="",,"|n"&R1C19&RC[-14])&IF(RC[-13]="",,"|n"&R1C20&RC[-13])&IF(RC[-12]="",,"|n"&R1C21&RC[-12])&IF(RC[-10]="",,"|n"&R1C23&RC[-10])&IF(RC[-9]="",,"|n"&R1C24&RC[-9])&IF(RC[-8]="",,"|n"&R1C25&RC[-8])&IF(RC[-7]="",,"|n"&R1C26&RC[-7])&IF(RC[-6]="",,"|n"&R1C27&RC[-6])&IF(RC[-5]="",,"|n"&R1C28&RC[-5])&IF(RC[-2]="",,"|n"&RC[-2]) -> 
AG840: =IF(RC[-26]&RC[-25]&RC[-24]&RC[-23]&RC[-22]&RC[-21]="",,R1C6)&IF(RC[-26]="",,"|n"&R1C7&RC[-26])&IF(RC[-25]="",,"|n"&R1C8&RC[-25])&IF(RC[-24]="",,"|n"&R1C9&RC[-24])&IF(RC[-23]="",,"|n"&R1C10&RC[-23])&IF(RC[-22]="",,"|n"&R1C11&RC[-22])&IF(RC[-21]="",,"|n"&R1C12&RC[-21])&IF(RC[-19]&RC[-18]&RC[-17]&RC[-16]="",,"|n"&R1C13)&IF(RC[-19]="",,"|n"&R1C14&RC[-19])&IF(RC[-18]="",,"|n"&R1C15&RC[-18])&IF(RC[-17]="",,"|n"&R1C16&RC[-17])&IF(RC[-16]="",,"|n"&R1C17&RC[-16])&IF(RC[-15]="",,"|n"&R1C18&RC[-15])&IF(RC[-14]="",,"|n"&R1C19&RC[-14])&IF(RC[-13]="",,"|n"&R1C20&RC[-13])&IF(RC[-12]="",,"|n"&R1C21&RC[-12])&IF(RC[-10]="",,"|n"&R1C23&RC[-10])&IF(RC[-9]="",,"|n"&R1C24&RC[-9])&IF(RC[-8]="",,"|n"&R1C25&RC[-8])&IF(RC[-7]="",,"|n"&R1C26&RC[-7])&IF(RC[-6]="",,"|n"&R1C27&RC[-6])&IF(RC[-5]="",,"|n"&R1C28&RC[-5])&IF(RC[-2]="",,"|n"&RC[-2]) -> 
AG841: =IF(RC[-26]&RC[-25]&RC[-24]&RC[-23]&RC[-22]&RC[-21]="",,R1C6)&IF(RC[-26]="",,"|n"&R1C7&RC[-26])&IF(RC[-25]="",,"|n"&R1C8&RC[-25])&IF(RC[-24]="",,"|n"&R1C9&RC[-24])&IF(RC[-23]="",,"|n"&R1C10&RC[-23])&IF(RC[-22]="",,"|n"&R1C11&RC[-22])&IF(RC[-21]="",,"|n"&R1C12&RC[-21])&IF(RC[-19]&RC[-18]&RC[-17]&RC[-16]="",,"|n"&R1C13)&IF(RC[-19]="",,"|n"&R1C14&RC[-19])&IF(RC[-18]="",,"|n"&R1C15&RC[-18])&IF(RC[-17]="",,"|n"&R1C16&RC[-17])&IF(RC[-16]="",,"|n"&R1C17&RC[-16])&IF(RC[-15]="",,"|n"&R1C18&RC[-15])&IF(RC[-14]="",,"|n"&R1C19&RC[-14])&IF(RC[-13]="",,"|n"&R1C20&RC[-13])&IF(RC[-12]="",,"|n"&R1C21&RC[-12])&IF(RC[-10]="",,"|n"&R1C23&RC[-10])&IF(RC[-9]="",,"|n"&R1C24&RC[-9])&IF(RC[-8]="",,"|n"&R1C25&RC[-8])&IF(RC[-7]="",,"|n"&R1C26&RC[-7])&IF(RC[-6]="",,"|n"&R1C27&RC[-6])&IF(RC[-5]="",,"|n"&R1C28&RC[-5])&IF(RC[-2]="",,"|n"&RC[-2]) -> 
AG842: =IF(RC[-26]&RC[-25]&RC[-24]&RC[-23]&RC[-22]&RC[-21]="",,R1C6)&IF(RC[-26]="",,"|n"&R1C7&RC[-26])&IF(RC[-25]="",,"|n"&R1C8&RC[-25])&IF(RC[-24]="",,"|n"&R1C9&RC[-24])&IF(RC[-23]="",,"|n"&R1C10&RC[-23])&IF(RC[-22]="",,"|n"&R1C11&RC[-22])&IF(RC[-21]="",,"|n"&R1C12&RC[-21])&IF(RC[-19]&RC[-18]&RC[-17]&RC[-16]="",,"|n"&R1C13)&IF(RC[-19]="",,"|n"&R1C14&RC[-19])&IF(RC[-18]="",,"|n"&R1C15&RC[-18])&IF(RC[-17]="",,"|n"&R1C16&RC[-17])&IF(RC[-16]="",,"|n"&R1C17&RC[-16])&IF(RC[-15]="",,"|n"&R1C18&RC[-15])&IF(RC[-14]="",,"|n"&R1C19&RC[-14])&IF(RC[-13]="",,"|n"&R1C20&RC[-13])&IF(RC[-12]="",,"|n"&R1C21&RC[-12])&IF(RC[-10]="",,"|n"&R1C23&RC[-10])&IF(RC[-9]="",,"|n"&R1C24&RC[-9])&IF(RC[-8]="",,"|n"&R1C25&RC[-8])&IF(RC[-7]="",,"|n"&R1C26&RC[-7])&IF(RC[-6]="",,"|n"&R1C27&RC[-6])&IF(RC[-5]="",,"|n"&R1C28&RC[-5])&IF(RC[-2]="",,"|n"&RC[-2]) -> 
AG843: =IF(RC[-26]&RC[-25]&RC[-24]&RC[-23]&RC[-22]&RC[-21]="",,R1C6)&IF(RC[-26]="",,"|n"&R1C7&RC[-26])&IF(RC[-25]="",,"|n"&R1C8&RC[-25])&IF(RC[-24]="",,"|n"&R1C9&RC[-24])&IF(RC[-23]="",,"|n"&R1C10&RC[-23])&IF(RC[-22]="",,"|n"&R1C11&RC[-22])&IF(RC[-21]="",,"|n"&R1C12&RC[-21])&IF(RC[-19]&RC[-18]&RC[-17]&RC[-16]="",,"|n"&R1C13)&IF(RC[-19]="",,"|n"&R1C14&RC[-19])&IF(RC[-18]="",,"|n"&R1C15&RC[-18])&IF(RC[-17]="",,"|n"&R1C16&RC[-17])&IF(RC[-16]="",,"|n"&R1C17&RC[-16])&IF(RC[-15]="",,"|n"&R1C18&RC[-15])&IF(RC[-14]="",,"|n"&R1C19&RC[-14])&IF(RC[-13]="",,"|n"&R1C20&RC[-13])&IF(RC[-12]="",,"|n"&R1C21&RC[-12])&IF(RC[-10]="",,"|n"&R1C23&RC[-10])&IF(RC[-9]="",,"|n"&R1C24&RC[-9])&IF(RC[-8]="",,"|n"&R1C25&RC[-8])&IF(RC[-7]="",,"|n"&R1C26&RC[-7])&IF(RC[-6]="",,"|n"&R1C27&RC[-6])&IF(RC[-5]="",,"|n"&R1C28&RC[-5])&IF(RC[-2]="",,"|n"&RC[-2]) -> 
AG844: =IF(RC[-26]&RC[-25]&RC[-24]&RC[-23]&RC[-22]&RC[-21]="",,R1C6)&IF(RC[-26]="",,"|n"&R1C7&RC[-26])&IF(RC[-25]="",,"|n"&R1C8&RC[-25])&IF(RC[-24]="",,"|n"&R1C9&RC[-24])&IF(RC[-23]="",,"|n"&R1C10&RC[-23])&IF(RC[-22]="",,"|n"&R1C11&RC[-22])&IF(RC[-21]="",,"|n"&R1C12&RC[-21])&IF(RC[-19]&RC[-18]&RC[-17]&RC[-16]="",,"|n"&R1C13)&IF(RC[-19]="",,"|n"&R1C14&RC[-19])&IF(RC[-18]="",,"|n"&R1C15&RC[-18])&IF(RC[-17]="",,"|n"&R1C16&RC[-17])&IF(RC[-16]="",,"|n"&R1C17&RC[-16])&IF(RC[-15]="",,"|n"&R1C18&RC[-15])&IF(RC[-14]="",,"|n"&R1C19&RC[-14])&IF(RC[-13]="",,"|n"&R1C20&RC[-13])&IF(RC[-12]="",,"|n"&R1C21&RC[-12])&IF(RC[-10]="",,"|n"&R1C23&RC[-10])&IF(RC[-9]="",,"|n"&R1C24&RC[-9])&IF(RC[-8]="",,"|n"&R1C25&RC[-8])&IF(RC[-7]="",,"|n"&R1C26&RC[-7])&IF(RC[-6]="",,"|n"&R1C27&RC[-6])&IF(RC[-5]="",,"|n"&R1C28&RC[-5])&IF(RC[-2]="",,"|n"&RC[-2]) -> 
AG845: =IF(RC[-26]&RC[-25]&RC[-24]&RC[-23]&RC[-22]&RC[-21]="",,R1C6)&IF(RC[-26]="",,"|n"&R1C7&RC[-26])&IF(RC[-25]="",,"|n"&R1C8&RC[-25])&IF(RC[-24]="",,"|n"&R1C9&RC[-24])&IF(RC[-23]="",,"|n"&R1C10&RC[-23])&IF(RC[-22]="",,"|n"&R1C11&RC[-22])&IF(RC[-21]="",,"|n"&R1C12&RC[-21])&IF(RC[-19]&RC[-18]&RC[-17]&RC[-16]="",,"|n"&R1C13)&IF(RC[-19]="",,"|n"&R1C14&RC[-19])&IF(RC[-18]="",,"|n"&R1C15&RC[-18])&IF(RC[-17]="",,"|n"&R1C16&RC[-17])&IF(RC[-16]="",,"|n"&R1C17&RC[-16])&IF(RC[-15]="",,"|n"&R1C18&RC[-15])&IF(RC[-14]="",,"|n"&R1C19&RC[-14])&IF(RC[-13]="",,"|n"&R1C20&RC[-13])&IF(RC[-12]="",,"|n"&R1C21&RC[-12])&IF(RC[-10]="",,"|n"&R1C23&RC[-10])&IF(RC[-9]="",,"|n"&R1C24&RC[-9])&IF(RC[-8]="",,"|n"&R1C25&RC[-8])&IF(RC[-7]="",,"|n"&R1C26&RC[-7])&IF(RC[-6]="",,"|n"&R1C27&RC[-6])&IF(RC[-5]="",,"|n"&R1C28&RC[-5])&IF(RC[-2]="",,"|n"&RC[-2]) -> 
AG846: =IF(RC[-26]&RC[-25]&RC[-24]&RC[-23]&RC[-22]&RC[-21]="",,R1C6)&IF(RC[-26]="",,"|n"&R1C7&RC[-26])&IF(RC[-25]="",,"|n"&R1C8&RC[-25])&IF(RC[-24]="",,"|n"&R1C9&RC[-24])&IF(RC[-23]="",,"|n"&R1C10&RC[-23])&IF(RC[-22]="",,"|n"&R1C11&RC[-22])&IF(RC[-21]="",,"|n"&R1C12&RC[-21])&IF(RC[-19]&RC[-18]&RC[-17]&RC[-16]="",,"|n"&R1C13)&IF(RC[-19]="",,"|n"&R1C14&RC[-19])&IF(RC[-18]="",,"|n"&R1C15&RC[-18])&IF(RC[-17]="",,"|n"&R1C16&RC[-17])&IF(RC[-16]="",,"|n"&R1C17&RC[-16])&IF(RC[-15]="",,"|n"&R1C18&RC[-15])&IF(RC[-14]="",,"|n"&R1C19&RC[-14])&IF(RC[-13]="",,"|n"&R1C20&RC[-13])&IF(RC[-12]="",,"|n"&R1C21&RC[-12])&IF(RC[-10]="",,"|n"&R1C23&RC[-10])&IF(RC[-9]="",,"|n"&R1C24&RC[-9])&IF(RC[-8]="",,"|n"&R1C25&RC[-8])&IF(RC[-7]="",,"|n"&R1C26&RC[-7])&IF(RC[-6]="",,"|n"&R1C27&RC[-6])&IF(RC[-5]="",,"|n"&R1C28&RC[-5])&IF(RC[-2]="",,"|n"&RC[-2]) -> 
AG847: =IF(RC[-26]&RC[-25]&RC[-24]&RC[-23]&RC[-22]&RC[-21]="",,R1C6)&IF(RC[-26]="",,"|n"&R1C7&RC[-26])&IF(RC[-25]="",,"|n"&R1C8&RC[-25])&IF(RC[-24]="",,"|n"&R1C9&RC[-24])&IF(RC[-23]="",,"|n"&R1C10&RC[-23])&IF(RC[-22]="",,"|n"&R1C11&RC[-22])&IF(RC[-21]="",,"|n"&R1C12&RC[-21])&IF(RC[-19]&RC[-18]&RC[-17]&RC[-16]="",,"|n"&R1C13)&IF(RC[-19]="",,"|n"&R1C14&RC[-19])&IF(RC[-18]="",,"|n"&R1C15&RC[-18])&IF(RC[-17]="",,"|n"&R1C16&RC[-17])&IF(RC[-16]="",,"|n"&R1C17&RC[-16])&IF(RC[-15]="",,"|n"&R1C18&RC[-15])&IF(RC[-14]="",,"|n"&R1C19&RC[-14])&IF(RC[-13]="",,"|n"&R1C20&RC[-13])&IF(RC[-12]="",,"|n"&R1C21&RC[-12])&IF(RC[-10]="",,"|n"&R1C23&RC[-10])&IF(RC[-9]="",,"|n"&R1C24&RC[-9])&IF(RC[-8]="",,"|n"&R1C25&RC[-8])&IF(RC[-7]="",,"|n"&R1C26&RC[-7])&IF(RC[-6]="",,"|n"&R1C27&RC[-6])&IF(RC[-5]="",,"|n"&R1C28&RC[-5])&IF(RC[-2]="",,"|n"&RC[-2]) -> 
AG848: =IF(RC[-26]&RC[-25]&RC[-24]&RC[-23]&RC[-22]&RC[-21]="",,R1C6)&IF(RC[-26]="",,"|n"&R1C7&RC[-26])&IF(RC[-25]="",,"|n"&R1C8&RC[-25])&IF(RC[-24]="",,"|n"&R1C9&RC[-24])&IF(RC[-23]="",,"|n"&R1C10&RC[-23])&IF(RC[-22]="",,"|n"&R1C11&RC[-22])&IF(RC[-21]="",,"|n"&R1C12&RC[-21])&IF(RC[-19]&RC[-18]&RC[-17]&RC[-16]="",,"|n"&R1C13)&IF(RC[-19]="",,"|n"&R1C14&RC[-19])&IF(RC[-18]="",,"|n"&R1C15&RC[-18])&IF(RC[-17]="",,"|n"&R1C16&RC[-17])&IF(RC[-16]="",,"|n"&R1C17&RC[-16])&IF(RC[-15]="",,"|n"&R1C18&RC[-15])&IF(RC[-14]="",,"|n"&R1C19&RC[-14])&IF(RC[-13]="",,"|n"&R1C20&RC[-13])&IF(RC[-12]="",,"|n"&R1C21&RC[-12])&IF(RC[-10]="",,"|n"&R1C23&RC[-10])&IF(RC[-9]="",,"|n"&R1C24&RC[-9])&IF(RC[-8]="",,"|n"&R1C25&RC[-8])&IF(RC[-7]="",,"|n"&R1C26&RC[-7])&IF(RC[-6]="",,"|n"&R1C27&RC[-6])&IF(RC[-5]="",,"|n"&R1C28&RC[-5])&IF(RC[-2]="",,"|n"&RC[-2]) -> 
AG849: =IF(RC[-26]&RC[-25]&RC[-24]&RC[-23]&RC[-22]&RC[-21]="",,R1C6)&IF(RC[-26]="",,"|n"&R1C7&RC[-26])&IF(RC[-25]="",,"|n"&R1C8&RC[-25])&IF(RC[-24]="",,"|n"&R1C9&RC[-24])&IF(RC[-23]="",,"|n"&R1C10&RC[-23])&IF(RC[-22]="",,"|n"&R1C11&RC[-22])&IF(RC[-21]="",,"|n"&R1C12&RC[-21])&IF(RC[-19]&RC[-18]&RC[-17]&RC[-16]="",,"|n"&R1C13)&IF(RC[-19]="",,"|n"&R1C14&RC[-19])&IF(RC[-18]="",,"|n"&R1C15&RC[-18])&IF(RC[-17]="",,"|n"&R1C16&RC[-17])&IF(RC[-16]="",,"|n"&R1C17&RC[-16])&IF(RC[-15]="",,"|n"&R1C18&RC[-15])&IF(RC[-14]="",,"|n"&R1C19&RC[-14])&IF(RC[-13]="",,"|n"&R1C20&RC[-13])&IF(RC[-12]="",,"|n"&R1C21&RC[-12])&IF(RC[-10]="",,"|n"&R1C23&RC[-10])&IF(RC[-9]="",,"|n"&R1C24&RC[-9])&IF(RC[-8]="",,"|n"&R1C25&RC[-8])&IF(RC[-7]="",,"|n"&R1C26&RC[-7])&IF(RC[-6]="",,"|n"&R1C27&RC[-6])&IF(RC[-5]="",,"|n"&R1C28&RC[-5])&IF(RC[-2]="",,"|n"&RC[-2]) -> 
AG850: =IF(RC[-26]&RC[-25]&RC[-24]&RC[-23]&RC[-22]&RC[-21]="",,R1C6)&IF(RC[-26]="",,"|n"&R1C7&RC[-26])&IF(RC[-25]="",,"|n"&R1C8&RC[-25])&IF(RC[-24]="",,"|n"&R1C9&RC[-24])&IF(RC[-23]="",,"|n"&R1C10&RC[-23])&IF(RC[-22]="",,"|n"&R1C11&RC[-22])&IF(RC[-21]="",,"|n"&R1C12&RC[-21])&IF(RC[-19]&RC[-18]&RC[-17]&RC[-16]="",,"|n"&R1C13)&IF(RC[-19]="",,"|n"&R1C14&RC[-19])&IF(RC[-18]="",,"|n"&R1C15&RC[-18])&IF(RC[-17]="",,"|n"&R1C16&RC[-17])&IF(RC[-16]="",,"|n"&R1C17&RC[-16])&IF(RC[-15]="",,"|n"&R1C18&RC[-15])&IF(RC[-14]="",,"|n"&R1C19&RC[-14])&IF(RC[-13]="",,"|n"&R1C20&RC[-13])&IF(RC[-12]="",,"|n"&R1C21&RC[-12])&IF(RC[-10]="",,"|n"&R1C23&RC[-10])&IF(RC[-9]="",,"|n"&R1C24&RC[-9])&IF(RC[-8]="",,"|n"&R1C25&RC[-8])&IF(RC[-7]="",,"|n"&R1C26&RC[-7])&IF(RC[-6]="",,"|n"&R1C27&RC[-6])&IF(RC[-5]="",,"|n"&R1C28&RC[-5])&IF(RC[-2]="",,"|n"&RC[-2]) -> 
AG851: =IF(RC[-26]&RC[-25]&RC[-24]&RC[-23]&RC[-22]&RC[-21]="",,R1C6)&IF(RC[-26]="",,"|n"&R1C7&RC[-26])&IF(RC[-25]="",,"|n"&R1C8&RC[-25])&IF(RC[-24]="",,"|n"&R1C9&RC[-24])&IF(RC[-23]="",,"|n"&R1C10&RC[-23])&IF(RC[-22]="",,"|n"&R1C11&RC[-22])&IF(RC[-21]="",,"|n"&R1C12&RC[-21])&IF(RC[-19]&RC[-18]&RC[-17]&RC[-16]="",,"|n"&R1C13)&IF(RC[-19]="",,"|n"&R1C14&RC[-19])&IF(RC[-18]="",,"|n"&R1C15&RC[-18])&IF(RC[-17]="",,"|n"&R1C16&RC[-17])&IF(RC[-16]="",,"|n"&R1C17&RC[-16])&IF(RC[-15]="",,"|n"&R1C18&RC[-15])&IF(RC[-14]="",,"|n"&R1C19&RC[-14])&IF(RC[-13]="",,"|n"&R1C20&RC[-13])&IF(RC[-12]="",,"|n"&R1C21&RC[-12])&IF(RC[-10]="",,"|n"&R1C23&RC[-10])&IF(RC[-9]="",,"|n"&R1C24&RC[-9])&IF(RC[-8]="",,"|n"&R1C25&RC[-8])&IF(RC[-7]="",,"|n"&R1C26&RC[-7])&IF(RC[-6]="",,"|n"&R1C27&RC[-6])&IF(RC[-5]="",,"|n"&R1C28&RC[-5])&IF(RC[-2]="",,"|n"&RC[-2]) -> 
AG852: =IF(RC[-26]&RC[-25]&RC[-24]&RC[-23]&RC[-22]&RC[-21]="",,R1C6)&IF(RC[-26]="",,"|n"&R1C7&RC[-26])&IF(RC[-25]="",,"|n"&R1C8&RC[-25])&IF(RC[-24]="",,"|n"&R1C9&RC[-24])&IF(RC[-23]="",,"|n"&R1C10&RC[-23])&IF(RC[-22]="",,"|n"&R1C11&RC[-22])&IF(RC[-21]="",,"|n"&R1C12&RC[-21])&IF(RC[-19]&RC[-18]&RC[-17]&RC[-16]="",,"|n"&R1C13)&IF(RC[-19]="",,"|n"&R1C14&RC[-19])&IF(RC[-18]="",,"|n"&R1C15&RC[-18])&IF(RC[-17]="",,"|n"&R1C16&RC[-17])&IF(RC[-16]="",,"|n"&R1C17&RC[-16])&IF(RC[-15]="",,"|n"&R1C18&RC[-15])&IF(RC[-14]="",,"|n"&R1C19&RC[-14])&IF(RC[-13]="",,"|n"&R1C20&RC[-13])&IF(RC[-12]="",,"|n"&R1C21&RC[-12])&IF(RC[-10]="",,"|n"&R1C23&RC[-10])&IF(RC[-9]="",,"|n"&R1C24&RC[-9])&IF(RC[-8]="",,"|n"&R1C25&RC[-8])&IF(RC[-7]="",,"|n"&R1C26&RC[-7])&IF(RC[-6]="",,"|n"&R1C27&RC[-6])&IF(RC[-5]="",,"|n"&R1C28&RC[-5])&IF(RC[-2]="",,"|n"&RC[-2]) -> 
AG853: =IF(RC[-26]&RC[-25]&RC[-24]&RC[-23]&RC[-22]&RC[-21]="",,R1C6)&IF(RC[-26]="",,"|n"&R1C7&RC[-26])&IF(RC[-25]="",,"|n"&R1C8&RC[-25])&IF(RC[-24]="",,"|n"&R1C9&RC[-24])&IF(RC[-23]="",,"|n"&R1C10&RC[-23])&IF(RC[-22]="",,"|n"&R1C11&RC[-22])&IF(RC[-21]="",,"|n"&R1C12&RC[-21])&IF(RC[-19]&RC[-18]&RC[-17]&RC[-16]="",,"|n"&R1C13)&IF(RC[-19]="",,"|n"&R1C14&RC[-19])&IF(RC[-18]="",,"|n"&R1C15&RC[-18])&IF(RC[-17]="",,"|n"&R1C16&RC[-17])&IF(RC[-16]="",,"|n"&R1C17&RC[-16])&IF(RC[-15]="",,"|n"&R1C18&RC[-15])&IF(RC[-14]="",,"|n"&R1C19&RC[-14])&IF(RC[-13]="",,"|n"&R1C20&RC[-13])&IF(RC[-12]="",,"|n"&R1C21&RC[-12])&IF(RC[-10]="",,"|n"&R1C23&RC[-10])&IF(RC[-9]="",,"|n"&R1C24&RC[-9])&IF(RC[-8]="",,"|n"&R1C25&RC[-8])&IF(RC[-7]="",,"|n"&R1C26&RC[-7])&IF(RC[-6]="",,"|n"&R1C27&RC[-6])&IF(RC[-5]="",,"|n"&R1C28&RC[-5])&IF(RC[-2]="",,"|n"&RC[-2]) -> 
AG854: =IF(RC[-26]&RC[-25]&RC[-24]&RC[-23]&RC[-22]&RC[-21]="",,R1C6)&IF(RC[-26]="",,"|n"&R1C7&RC[-26])&IF(RC[-25]="",,"|n"&R1C8&RC[-25])&IF(RC[-24]="",,"|n"&R1C9&RC[-24])&IF(RC[-23]="",,"|n"&R1C10&RC[-23])&IF(RC[-22]="",,"|n"&R1C11&RC[-22])&IF(RC[-21]="",,"|n"&R1C12&RC[-21])&IF(RC[-19]&RC[-18]&RC[-17]&RC[-16]="",,"|n"&R1C13)&IF(RC[-19]="",,"|n"&R1C14&RC[-19])&IF(RC[-18]="",,"|n"&R1C15&RC[-18])&IF(RC[-17]="",,"|n"&R1C16&RC[-17])&IF(RC[-16]="",,"|n"&R1C17&RC[-16])&IF(RC[-15]="",,"|n"&R1C18&RC[-15])&IF(RC[-14]="",,"|n"&R1C19&RC[-14])&IF(RC[-13]="",,"|n"&R1C20&RC[-13])&IF(RC[-12]="",,"|n"&R1C21&RC[-12])&IF(RC[-10]="",,"|n"&R1C23&RC[-10])&IF(RC[-9]="",,"|n"&R1C24&RC[-9])&IF(RC[-8]="",,"|n"&R1C25&RC[-8])&IF(RC[-7]="",,"|n"&R1C26&RC[-7])&IF(RC[-6]="",,"|n"&R1C27&RC[-6])&IF(RC[-5]="",,"|n"&R1C28&RC[-5])&IF(RC[-2]="",,"|n"&RC[-2]) -> 
AG855: =IF(RC[-26]&RC[-25]&RC[-24]&RC[-23]&RC[-22]&RC[-21]="",,R1C6)&IF(RC[-26]="",,"|n"&R1C7&RC[-26])&IF(RC[-25]="",,"|n"&R1C8&RC[-25])&IF(RC[-24]="",,"|n"&R1C9&RC[-24])&IF(RC[-23]="",,"|n"&R1C10&RC[-23])&IF(RC[-22]="",,"|n"&R1C11&RC[-22])&IF(RC[-21]="",,"|n"&R1C12&RC[-21])&IF(RC[-19]&RC[-18]&RC[-17]&RC[-16]="",,"|n"&R1C13)&IF(RC[-19]="",,"|n"&R1C14&RC[-19])&IF(RC[-18]="",,"|n"&R1C15&RC[-18])&IF(RC[-17]="",,"|n"&R1C16&RC[-17])&IF(RC[-16]="",,"|n"&R1C17&RC[-16])&IF(RC[-15]="",,"|n"&R1C18&RC[-15])&IF(RC[-14]="",,"|n"&R1C19&RC[-14])&IF(RC[-13]="",,"|n"&R1C20&RC[-13])&IF(RC[-12]="",,"|n"&R1C21&RC[-12])&IF(RC[-10]="",,"|n"&R1C23&RC[-10])&IF(RC[-9]="",,"|n"&R1C24&RC[-9])&IF(RC[-8]="",,"|n"&R1C25&RC[-8])&IF(RC[-7]="",,"|n"&R1C26&RC[-7])&IF(RC[-6]="",,"|n"&R1C27&RC[-6])&IF(RC[-5]="",,"|n"&R1C28&RC[-5])&IF(RC[-2]="",,"|n"&RC[-2]) -> 
AG856: =IF(RC[-26]&RC[-25]&RC[-24]&RC[-23]&RC[-22]&RC[-21]="",,R1C6)&IF(RC[-26]="",,"|n"&R1C7&RC[-26])&IF(RC[-25]="",,"|n"&R1C8&RC[-25])&IF(RC[-24]="",,"|n"&R1C9&RC[-24])&IF(RC[-23]="",,"|n"&R1C10&RC[-23])&IF(RC[-22]="",,"|n"&R1C11&RC[-22])&IF(RC[-21]="",,"|n"&R1C12&RC[-21])&IF(RC[-19]&RC[-18]&RC[-17]&RC[-16]="",,"|n"&R1C13)&IF(RC[-19]="",,"|n"&R1C14&RC[-19])&IF(RC[-18]="",,"|n"&R1C15&RC[-18])&IF(RC[-17]="",,"|n"&R1C16&RC[-17])&IF(RC[-16]="",,"|n"&R1C17&RC[-16])&IF(RC[-15]="",,"|n"&R1C18&RC[-15])&IF(RC[-14]="",,"|n"&R1C19&RC[-14])&IF(RC[-13]="",,"|n"&R1C20&RC[-13])&IF(RC[-12]="",,"|n"&R1C21&RC[-12])&IF(RC[-10]="",,"|n"&R1C23&RC[-10])&IF(RC[-9]="",,"|n"&R1C24&RC[-9])&IF(RC[-8]="",,"|n"&R1C25&RC[-8])&IF(RC[-7]="",,"|n"&R1C26&RC[-7])&IF(RC[-6]="",,"|n"&R1C27&RC[-6])&IF(RC[-5]="",,"|n"&R1C28&RC[-5])&IF(RC[-2]="",,"|n"&RC[-2]) -> 
AG857: =IF(RC[-26]&RC[-25]&RC[-24]&RC[-23]&RC[-22]&RC[-21]="",,R1C6)&IF(RC[-26]="",,"|n"&R1C7&RC[-26])&IF(RC[-25]="",,"|n"&R1C8&RC[-25])&IF(RC[-24]="",,"|n"&R1C9&RC[-24])&IF(RC[-23]="",,"|n"&R1C10&RC[-23])&IF(RC[-22]="",,"|n"&R1C11&RC[-22])&IF(RC[-21]="",,"|n"&R1C12&RC[-21])&IF(RC[-19]&RC[-18]&RC[-17]&RC[-16]="",,"|n"&R1C13)&IF(RC[-19]="",,"|n"&R1C14&RC[-19])&IF(RC[-18]="",,"|n"&R1C15&RC[-18])&IF(RC[-17]="",,"|n"&R1C16&RC[-17])&IF(RC[-16]="",,"|n"&R1C17&RC[-16])&IF(RC[-15]="",,"|n"&R1C18&RC[-15])&IF(RC[-14]="",,"|n"&R1C19&RC[-14])&IF(RC[-13]="",,"|n"&R1C20&RC[-13])&IF(RC[-12]="",,"|n"&R1C21&RC[-12])&IF(RC[-10]="",,"|n"&R1C23&RC[-10])&IF(RC[-9]="",,"|n"&R1C24&RC[-9])&IF(RC[-8]="",,"|n"&R1C25&RC[-8])&IF(RC[-7]="",,"|n"&R1C26&RC[-7])&IF(RC[-6]="",,"|n"&R1C27&RC[-6])&IF(RC[-5]="",,"|n"&R1C28&RC[-5])&IF(RC[-2]="",,"|n"&RC[-2]) -> 
AG858: =IF(RC[-26]&RC[-25]&RC[-24]&RC[-23]&RC[-22]&RC[-21]="",,R1C6)&IF(RC[-26]="",,"|n"&R1C7&RC[-26])&IF(RC[-25]="",,"|n"&R1C8&RC[-25])&IF(RC[-24]="",,"|n"&R1C9&RC[-24])&IF(RC[-23]="",,"|n"&R1C10&RC[-23])&IF(RC[-22]="",,"|n"&R1C11&RC[-22])&IF(RC[-21]="",,"|n"&R1C12&RC[-21])&IF(RC[-19]&RC[-18]&RC[-17]&RC[-16]="",,"|n"&R1C13)&IF(RC[-19]="",,"|n"&R1C14&RC[-19])&IF(RC[-18]="",,"|n"&R1C15&RC[-18])&IF(RC[-17]="",,"|n"&R1C16&RC[-17])&IF(RC[-16]="",,"|n"&R1C17&RC[-16])&IF(RC[-15]="",,"|n"&R1C18&RC[-15])&IF(RC[-14]="",,"|n"&R1C19&RC[-14])&IF(RC[-13]="",,"|n"&R1C20&RC[-13])&IF(RC[-12]="",,"|n"&R1C21&RC[-12])&IF(RC[-10]="",,"|n"&R1C23&RC[-10])&IF(RC[-9]="",,"|n"&R1C24&RC[-9])&IF(RC[-8]="",,"|n"&R1C25&RC[-8])&IF(RC[-7]="",,"|n"&R1C26&RC[-7])&IF(RC[-6]="",,"|n"&R1C27&RC[-6])&IF(RC[-5]="",,"|n"&R1C28&RC[-5])&IF(RC[-2]="",,"|n"&RC[-2]) -> 
AG859: =IF(RC[-26]&RC[-25]&RC[-24]&RC[-23]&RC[-22]&RC[-21]="",,R1C6)&IF(RC[-26]="",,"|n"&R1C7&RC[-26])&IF(RC[-25]="",,"|n"&R1C8&RC[-25])&IF(RC[-24]="",,"|n"&R1C9&RC[-24])&IF(RC[-23]="",,"|n"&R1C10&RC[-23])&IF(RC[-22]="",,"|n"&R1C11&RC[-22])&IF(RC[-21]="",,"|n"&R1C12&RC[-21])&IF(RC[-19]&RC[-18]&RC[-17]&RC[-16]="",,"|n"&R1C13)&IF(RC[-19]="",,"|n"&R1C14&RC[-19])&IF(RC[-18]="",,"|n"&R1C15&RC[-18])&IF(RC[-17]="",,"|n"&R1C16&RC[-17])&IF(RC[-16]="",,"|n"&R1C17&RC[-16])&IF(RC[-15]="",,"|n"&R1C18&RC[-15])&IF(RC[-14]="",,"|n"&R1C19&RC[-14])&IF(RC[-13]="",,"|n"&R1C20&RC[-13])&IF(RC[-12]="",,"|n"&R1C21&RC[-12])&IF(RC[-10]="",,"|n"&R1C23&RC[-10])&IF(RC[-9]="",,"|n"&R1C24&RC[-9])&IF(RC[-8]="",,"|n"&R1C25&RC[-8])&IF(RC[-7]="",,"|n"&R1C26&RC[-7])&IF(RC[-6]="",,"|n"&R1C27&RC[-6])&IF(RC[-5]="",,"|n"&R1C28&RC[-5])&IF(RC[-2]="",,"|n"&RC[-2]) -> 
AG860: =IF(RC[-26]&RC[-25]&RC[-24]&RC[-23]&RC[-22]&RC[-21]="",,R1C6)&IF(RC[-26]="",,"|n"&R1C7&RC[-26])&IF(RC[-25]="",,"|n"&R1C8&RC[-25])&IF(RC[-24]="",,"|n"&R1C9&RC[-24])&IF(RC[-23]="",,"|n"&R1C10&RC[-23])&IF(RC[-22]="",,"|n"&R1C11&RC[-22])&IF(RC[-21]="",,"|n"&R1C12&RC[-21])&IF(RC[-19]&RC[-18]&RC[-17]&RC[-16]="",,"|n"&R1C13)&IF(RC[-19]="",,"|n"&R1C14&RC[-19])&IF(RC[-18]="",,"|n"&R1C15&RC[-18])&IF(RC[-17]="",,"|n"&R1C16&RC[-17])&IF(RC[-16]="",,"|n"&R1C17&RC[-16])&IF(RC[-15]="",,"|n"&R1C18&RC[-15])&IF(RC[-14]="",,"|n"&R1C19&RC[-14])&IF(RC[-13]="",,"|n"&R1C20&RC[-13])&IF(RC[-12]="",,"|n"&R1C21&RC[-12])&IF(RC[-10]="",,"|n"&R1C23&RC[-10])&IF(RC[-9]="",,"|n"&R1C24&RC[-9])&IF(RC[-8]="",,"|n"&R1C25&RC[-8])&IF(RC[-7]="",,"|n"&R1C26&RC[-7])&IF(RC[-6]="",,"|n"&R1C27&RC[-6])&IF(RC[-5]="",,"|n"&R1C28&RC[-5])&IF(RC[-2]="",,"|n"&RC[-2]) -> 
AG861: =IF(RC[-26]&RC[-25]&RC[-24]&RC[-23]&RC[-22]&RC[-21]="",,R1C6)&IF(RC[-26]="",,"|n"&R1C7&RC[-26])&IF(RC[-25]="",,"|n"&R1C8&RC[-25])&IF(RC[-24]="",,"|n"&R1C9&RC[-24])&IF(RC[-23]="",,"|n"&R1C10&RC[-23])&IF(RC[-22]="",,"|n"&R1C11&RC[-22])&IF(RC[-21]="",,"|n"&R1C12&RC[-21])&IF(RC[-19]&RC[-18]&RC[-17]&RC[-16]="",,"|n"&R1C13)&IF(RC[-19]="",,"|n"&R1C14&RC[-19])&IF(RC[-18]="",,"|n"&R1C15&RC[-18])&IF(RC[-17]="",,"|n"&R1C16&RC[-17])&IF(RC[-16]="",,"|n"&R1C17&RC[-16])&IF(RC[-15]="",,"|n"&R1C18&RC[-15])&IF(RC[-14]="",,"|n"&R1C19&RC[-14])&IF(RC[-13]="",,"|n"&R1C20&RC[-13])&IF(RC[-12]="",,"|n"&R1C21&RC[-12])&IF(RC[-10]="",,"|n"&R1C23&RC[-10])&IF(RC[-9]="",,"|n"&R1C24&RC[-9])&IF(RC[-8]="",,"|n"&R1C25&RC[-8])&IF(RC[-7]="",,"|n"&R1C26&RC[-7])&IF(RC[-6]="",,"|n"&R1C27&RC[-6])&IF(RC[-5]="",,"|n"&R1C28&RC[-5])&IF(RC[-2]="",,"|n"&RC[-2]) -> 
AG862: =IF(RC[-26]&RC[-25]&RC[-24]&RC[-23]&RC[-22]&RC[-21]="",,R1C6)&IF(RC[-26]="",,"|n"&R1C7&RC[-26])&IF(RC[-25]="",,"|n"&R1C8&RC[-25])&IF(RC[-24]="",,"|n"&R1C9&RC[-24])&IF(RC[-23]="",,"|n"&R1C10&RC[-23])&IF(RC[-22]="",,"|n"&R1C11&RC[-22])&IF(RC[-21]="",,"|n"&R1C12&RC[-21])&IF(RC[-19]&RC[-18]&RC[-17]&RC[-16]="",,"|n"&R1C13)&IF(RC[-19]="",,"|n"&R1C14&RC[-19])&IF(RC[-18]="",,"|n"&R1C15&RC[-18])&IF(RC[-17]="",,"|n"&R1C16&RC[-17])&IF(RC[-16]="",,"|n"&R1C17&RC[-16])&IF(RC[-15]="",,"|n"&R1C18&RC[-15])&IF(RC[-14]="",,"|n"&R1C19&RC[-14])&IF(RC[-13]="",,"|n"&R1C20&RC[-13])&IF(RC[-12]="",,"|n"&R1C21&RC[-12])&IF(RC[-10]="",,"|n"&R1C23&RC[-10])&IF(RC[-9]="",,"|n"&R1C24&RC[-9])&IF(RC[-8]="",,"|n"&R1C25&RC[-8])&IF(RC[-7]="",,"|n"&R1C26&RC[-7])&IF(RC[-6]="",,"|n"&R1C27&RC[-6])&IF(RC[-5]="",,"|n"&R1C28&RC[-5])&IF(RC[-2]="",,"|n"&RC[-2]) -> 
AG863: =IF(RC[-26]&RC[-25]&RC[-24]&RC[-23]&RC[-22]&RC[-21]="",,R1C6)&IF(RC[-26]="",,"|n"&R1C7&RC[-26])&IF(RC[-25]="",,"|n"&R1C8&RC[-25])&IF(RC[-24]="",,"|n"&R1C9&RC[-24])&IF(RC[-23]="",,"|n"&R1C10&RC[-23])&IF(RC[-22]="",,"|n"&R1C11&RC[-22])&IF(RC[-21]="",,"|n"&R1C12&RC[-21])&IF(RC[-19]&RC[-18]&RC[-17]&RC[-16]="",,"|n"&R1C13)&IF(RC[-19]="",,"|n"&R1C14&RC[-19])&IF(RC[-18]="",,"|n"&R1C15&RC[-18])&IF(RC[-17]="",,"|n"&R1C16&RC[-17])&IF(RC[-16]="",,"|n"&R1C17&RC[-16])&IF(RC[-15]="",,"|n"&R1C18&RC[-15])&IF(RC[-14]="",,"|n"&R1C19&RC[-14])&IF(RC[-13]="",,"|n"&R1C20&RC[-13])&IF(RC[-12]="",,"|n"&R1C21&RC[-12])&IF(RC[-10]="",,"|n"&R1C23&RC[-10])&IF(RC[-9]="",,"|n"&R1C24&RC[-9])&IF(RC[-8]="",,"|n"&R1C25&RC[-8])&IF(RC[-7]="",,"|n"&R1C26&RC[-7])&IF(RC[-6]="",,"|n"&R1C27&RC[-6])&IF(RC[-5]="",,"|n"&R1C28&RC[-5])&IF(RC[-2]="",,"|n"&RC[-2]) -> 
AG864: =IF(RC[-26]&RC[-25]&RC[-24]&RC[-23]&RC[-22]&RC[-21]="",,R1C6)&IF(RC[-26]="",,"|n"&R1C7&RC[-26])&IF(RC[-25]="",,"|n"&R1C8&RC[-25])&IF(RC[-24]="",,"|n"&R1C9&RC[-24])&IF(RC[-23]="",,"|n"&R1C10&RC[-23])&IF(RC[-22]="",,"|n"&R1C11&RC[-22])&IF(RC[-21]="",,"|n"&R1C12&RC[-21])&IF(RC[-19]&RC[-18]&RC[-17]&RC[-16]="",,"|n"&R1C13)&IF(RC[-19]="",,"|n"&R1C14&RC[-19])&IF(RC[-18]="",,"|n"&R1C15&RC[-18])&IF(RC[-17]="",,"|n"&R1C16&RC[-17])&IF(RC[-16]="",,"|n"&R1C17&RC[-16])&IF(RC[-15]="",,"|n"&R1C18&RC[-15])&IF(RC[-14]="",,"|n"&R1C19&RC[-14])&IF(RC[-13]="",,"|n"&R1C20&RC[-13])&IF(RC[-12]="",,"|n"&R1C21&RC[-12])&IF(RC[-10]="",,"|n"&R1C23&RC[-10])&IF(RC[-9]="",,"|n"&R1C24&RC[-9])&IF(RC[-8]="",,"|n"&R1C25&RC[-8])&IF(RC[-7]="",,"|n"&R1C26&RC[-7])&IF(RC[-6]="",,"|n"&R1C27&RC[-6])&IF(RC[-5]="",,"|n"&R1C28&RC[-5])&IF(RC[-2]="",,"|n"&RC[-2]) -> 
AG865: =IF(RC[-26]&RC[-25]&RC[-24]&RC[-23]&RC[-22]&RC[-21]="",,R1C6)&IF(RC[-26]="",,"|n"&R1C7&RC[-26])&IF(RC[-25]="",,"|n"&R1C8&RC[-25])&IF(RC[-24]="",,"|n"&R1C9&RC[-24])&IF(RC[-23]="",,"|n"&R1C10&RC[-23])&IF(RC[-22]="",,"|n"&R1C11&RC[-22])&IF(RC[-21]="",,"|n"&R1C12&RC[-21])&IF(RC[-19]&RC[-18]&RC[-17]&RC[-16]="",,"|n"&R1C13)&IF(RC[-19]="",,"|n"&R1C14&RC[-19])&IF(RC[-18]="",,"|n"&R1C15&RC[-18])&IF(RC[-17]="",,"|n"&R1C16&RC[-17])&IF(RC[-16]="",,"|n"&R1C17&RC[-16])&IF(RC[-15]="",,"|n"&R1C18&RC[-15])&IF(RC[-14]="",,"|n"&R1C19&RC[-14])&IF(RC[-13]="",,"|n"&R1C20&RC[-13])&IF(RC[-12]="",,"|n"&R1C21&RC[-12])&IF(RC[-10]="",,"|n"&R1C23&RC[-10])&IF(RC[-9]="",,"|n"&R1C24&RC[-9])&IF(RC[-8]="",,"|n"&R1C25&RC[-8])&IF(RC[-7]="",,"|n"&R1C26&RC[-7])&IF(RC[-6]="",,"|n"&R1C27&RC[-6])&IF(RC[-5]="",,"|n"&R1C28&RC[-5])&IF(RC[-2]="",,"|n"&RC[-2]) -> 
AG866: =IF(RC[-26]&RC[-25]&RC[-24]&RC[-23]&RC[-22]&RC[-21]="",,R1C6)&IF(RC[-26]="",,"|n"&R1C7&RC[-26])&IF(RC[-25]="",,"|n"&R1C8&RC[-25])&IF(RC[-24]="",,"|n"&R1C9&RC[-24])&IF(RC[-23]="",,"|n"&R1C10&RC[-23])&IF(RC[-22]="",,"|n"&R1C11&RC[-22])&IF(RC[-21]="",,"|n"&R1C12&RC[-21])&IF(RC[-19]&RC[-18]&RC[-17]&RC[-16]="",,"|n"&R1C13)&IF(RC[-19]="",,"|n"&R1C14&RC[-19])&IF(RC[-18]="",,"|n"&R1C15&RC[-18])&IF(RC[-17]="",,"|n"&R1C16&RC[-17])&IF(RC[-16]="",,"|n"&R1C17&RC[-16])&IF(RC[-15]="",,"|n"&R1C18&RC[-15])&IF(RC[-14]="",,"|n"&R1C19&RC[-14])&IF(RC[-13]="",,"|n"&R1C20&RC[-13])&IF(RC[-12]="",,"|n"&R1C21&RC[-12])&IF(RC[-10]="",,"|n"&R1C23&RC[-10])&IF(RC[-9]="",,"|n"&R1C24&RC[-9])&IF(RC[-8]="",,"|n"&R1C25&RC[-8])&IF(RC[-7]="",,"|n"&R1C26&RC[-7])&IF(RC[-6]="",,"|n"&R1C27&RC[-6])&IF(RC[-5]="",,"|n"&R1C28&RC[-5])&IF(RC[-2]="",,"|n"&RC[-2]) -> 
AG867: =IF(RC[-26]&RC[-25]&RC[-24]&RC[-23]&RC[-22]&RC[-21]="",,R1C6)&IF(RC[-26]="",,"|n"&R1C7&RC[-26])&IF(RC[-25]="",,"|n"&R1C8&RC[-25])&IF(RC[-24]="",,"|n"&R1C9&RC[-24])&IF(RC[-23]="",,"|n"&R1C10&RC[-23])&IF(RC[-22]="",,"|n"&R1C11&RC[-22])&IF(RC[-21]="",,"|n"&R1C12&RC[-21])&IF(RC[-19]&RC[-18]&RC[-17]&RC[-16]="",,"|n"&R1C13)&IF(RC[-19]="",,"|n"&R1C14&RC[-19])&IF(RC[-18]="",,"|n"&R1C15&RC[-18])&IF(RC[-17]="",,"|n"&R1C16&RC[-17])&IF(RC[-16]="",,"|n"&R1C17&RC[-16])&IF(RC[-15]="",,"|n"&R1C18&RC[-15])&IF(RC[-14]="",,"|n"&R1C19&RC[-14])&IF(RC[-13]="",,"|n"&R1C20&RC[-13])&IF(RC[-12]="",,"|n"&R1C21&RC[-12])&IF(RC[-10]="",,"|n"&R1C23&RC[-10])&IF(RC[-9]="",,"|n"&R1C24&RC[-9])&IF(RC[-8]="",,"|n"&R1C25&RC[-8])&IF(RC[-7]="",,"|n"&R1C26&RC[-7])&IF(RC[-6]="",,"|n"&R1C27&RC[-6])&IF(RC[-5]="",,"|n"&R1C28&RC[-5])&IF(RC[-2]="",,"|n"&RC[-2]) -> 
AG868: =IF(RC[-26]&RC[-25]&RC[-24]&RC[-23]&RC[-22]&RC[-21]="",,R1C6)&IF(RC[-26]="",,"|n"&R1C7&RC[-26])&IF(RC[-25]="",,"|n"&R1C8&RC[-25])&IF(RC[-24]="",,"|n"&R1C9&RC[-24])&IF(RC[-23]="",,"|n"&R1C10&RC[-23])&IF(RC[-22]="",,"|n"&R1C11&RC[-22])&IF(RC[-21]="",,"|n"&R1C12&RC[-21])&IF(RC[-19]&RC[-18]&RC[-17]&RC[-16]="",,"|n"&R1C13)&IF(RC[-19]="",,"|n"&R1C14&RC[-19])&IF(RC[-18]="",,"|n"&R1C15&RC[-18])&IF(RC[-17]="",,"|n"&R1C16&RC[-17])&IF(RC[-16]="",,"|n"&R1C17&RC[-16])&IF(RC[-15]="",,"|n"&R1C18&RC[-15])&IF(RC[-14]="",,"|n"&R1C19&RC[-14])&IF(RC[-13]="",,"|n"&R1C20&RC[-13])&IF(RC[-12]="",,"|n"&R1C21&RC[-12])&IF(RC[-10]="",,"|n"&R1C23&RC[-10])&IF(RC[-9]="",,"|n"&R1C24&RC[-9])&IF(RC[-8]="",,"|n"&R1C25&RC[-8])&IF(RC[-7]="",,"|n"&R1C26&RC[-7])&IF(RC[-6]="",,"|n"&R1C27&RC[-6])&IF(RC[-5]="",,"|n"&R1C28&RC[-5])&IF(RC[-2]="",,"|n"&RC[-2]) -> 
AG869: =IF(RC[-26]&RC[-25]&RC[-24]&RC[-23]&RC[-22]&RC[-21]="",,R1C6)&IF(RC[-26]="",,"|n"&R1C7&RC[-26])&IF(RC[-25]="",,"|n"&R1C8&RC[-25])&IF(RC[-24]="",,"|n"&R1C9&RC[-24])&IF(RC[-23]="",,"|n"&R1C10&RC[-23])&IF(RC[-22]="",,"|n"&R1C11&RC[-22])&IF(RC[-21]="",,"|n"&R1C12&RC[-21])&IF(RC[-19]&RC[-18]&RC[-17]&RC[-16]="",,"|n"&R1C13)&IF(RC[-19]="",,"|n"&R1C14&RC[-19])&IF(RC[-18]="",,"|n"&R1C15&RC[-18])&IF(RC[-17]="",,"|n"&R1C16&RC[-17])&IF(RC[-16]="",,"|n"&R1C17&RC[-16])&IF(RC[-15]="",,"|n"&R1C18&RC[-15])&IF(RC[-14]="",,"|n"&R1C19&RC[-14])&IF(RC[-13]="",,"|n"&R1C20&RC[-13])&IF(RC[-12]="",,"|n"&R1C21&RC[-12])&IF(RC[-10]="",,"|n"&R1C23&RC[-10])&IF(RC[-9]="",,"|n"&R1C24&RC[-9])&IF(RC[-8]="",,"|n"&R1C25&RC[-8])&IF(RC[-7]="",,"|n"&R1C26&RC[-7])&IF(RC[-6]="",,"|n"&R1C27&RC[-6])&IF(RC[-5]="",,"|n"&R1C28&RC[-5])&IF(RC[-2]="",,"|n"&RC[-2]) -> 
AG870: =IF(RC[-26]&RC[-25]&RC[-24]&RC[-23]&RC[-22]&RC[-21]="",,R1C6)&IF(RC[-26]="",,"|n"&R1C7&RC[-26])&IF(RC[-25]="",,"|n"&R1C8&RC[-25])&IF(RC[-24]="",,"|n"&R1C9&RC[-24])&IF(RC[-23]="",,"|n"&R1C10&RC[-23])&IF(RC[-22]="",,"|n"&R1C11&RC[-22])&IF(RC[-21]="",,"|n"&R1C12&RC[-21])&IF(RC[-19]&RC[-18]&RC[-17]&RC[-16]="",,"|n"&R1C13)&IF(RC[-19]="",,"|n"&R1C14&RC[-19])&IF(RC[-18]="",,"|n"&R1C15&RC[-18])&IF(RC[-17]="",,"|n"&R1C16&RC[-17])&IF(RC[-16]="",,"|n"&R1C17&RC[-16])&IF(RC[-15]="",,"|n"&R1C18&RC[-15])&IF(RC[-14]="",,"|n"&R1C19&RC[-14])&IF(RC[-13]="",,"|n"&R1C20&RC[-13])&IF(RC[-12]="",,"|n"&R1C21&RC[-12])&IF(RC[-10]="",,"|n"&R1C23&RC[-10])&IF(RC[-9]="",,"|n"&R1C24&RC[-9])&IF(RC[-8]="",,"|n"&R1C25&RC[-8])&IF(RC[-7]="",,"|n"&R1C26&RC[-7])&IF(RC[-6]="",,"|n"&R1C27&RC[-6])&IF(RC[-5]="",,"|n"&R1C28&RC[-5])&IF(RC[-2]="",,"|n"&RC[-2]) -> 
AG871: =IF(RC[-26]&RC[-25]&RC[-24]&RC[-23]&RC[-22]&RC[-21]="",,R1C6)&IF(RC[-26]="",,"|n"&R1C7&RC[-26])&IF(RC[-25]="",,"|n"&R1C8&RC[-25])&IF(RC[-24]="",,"|n"&R1C9&RC[-24])&IF(RC[-23]="",,"|n"&R1C10&RC[-23])&IF(RC[-22]="",,"|n"&R1C11&RC[-22])&IF(RC[-21]="",,"|n"&R1C12&RC[-21])&IF(RC[-19]&RC[-18]&RC[-17]&RC[-16]="",,"|n"&R1C13)&IF(RC[-19]="",,"|n"&R1C14&RC[-19])&IF(RC[-18]="",,"|n"&R1C15&RC[-18])&IF(RC[-17]="",,"|n"&R1C16&RC[-17])&IF(RC[-16]="",,"|n"&R1C17&RC[-16])&IF(RC[-15]="",,"|n"&R1C18&RC[-15])&IF(RC[-14]="",,"|n"&R1C19&RC[-14])&IF(RC[-13]="",,"|n"&R1C20&RC[-13])&IF(RC[-12]="",,"|n"&R1C21&RC[-12])&IF(RC[-10]="",,"|n"&R1C23&RC[-10])&IF(RC[-9]="",,"|n"&R1C24&RC[-9])&IF(RC[-8]="",,"|n"&R1C25&RC[-8])&IF(RC[-7]="",,"|n"&R1C26&RC[-7])&IF(RC[-6]="",,"|n"&R1C27&RC[-6])&IF(RC[-5]="",,"|n"&R1C28&RC[-5])&IF(RC[-2]="",,"|n"&RC[-2]) -> 
AG872: =IF(RC[-26]&RC[-25]&RC[-24]&RC[-23]&RC[-22]&RC[-21]="",,R1C6)&IF(RC[-26]="",,"|n"&R1C7&RC[-26])&IF(RC[-25]="",,"|n"&R1C8&RC[-25])&IF(RC[-24]="",,"|n"&R1C9&RC[-24])&IF(RC[-23]="",,"|n"&R1C10&RC[-23])&IF(RC[-22]="",,"|n"&R1C11&RC[-22])&IF(RC[-21]="",,"|n"&R1C12&RC[-21])&IF(RC[-19]&RC[-18]&RC[-17]&RC[-16]="",,"|n"&R1C13)&IF(RC[-19]="",,"|n"&R1C14&RC[-19])&IF(RC[-18]="",,"|n"&R1C15&RC[-18])&IF(RC[-17]="",,"|n"&R1C16&RC[-17])&IF(RC[-16]="",,"|n"&R1C17&RC[-16])&IF(RC[-15]="",,"|n"&R1C18&RC[-15])&IF(RC[-14]="",,"|n"&R1C19&RC[-14])&IF(RC[-13]="",,"|n"&R1C20&RC[-13])&IF(RC[-12]="",,"|n"&R1C21&RC[-12])&IF(RC[-10]="",,"|n"&R1C23&RC[-10])&IF(RC[-9]="",,"|n"&R1C24&RC[-9])&IF(RC[-8]="",,"|n"&R1C25&RC[-8])&IF(RC[-7]="",,"|n"&R1C26&RC[-7])&IF(RC[-6]="",,"|n"&R1C27&RC[-6])&IF(RC[-5]="",,"|n"&R1C28&RC[-5])&IF(RC[-2]="",,"|n"&RC[-2]) -> 
AG873: =IF(RC[-26]&RC[-25]&RC[-24]&RC[-23]&RC[-22]&RC[-21]="",,R1C6)&IF(RC[-26]="",,"|n"&R1C7&RC[-26])&IF(RC[-25]="",,"|n"&R1C8&RC[-25])&IF(RC[-24]="",,"|n"&R1C9&RC[-24])&IF(RC[-23]="",,"|n"&R1C10&RC[-23])&IF(RC[-22]="",,"|n"&R1C11&RC[-22])&IF(RC[-21]="",,"|n"&R1C12&RC[-21])&IF(RC[-19]&RC[-18]&RC[-17]&RC[-16]="",,"|n"&R1C13)&IF(RC[-19]="",,"|n"&R1C14&RC[-19])&IF(RC[-18]="",,"|n"&R1C15&RC[-18])&IF(RC[-17]="",,"|n"&R1C16&RC[-17])&IF(RC[-16]="",,"|n"&R1C17&RC[-16])&IF(RC[-15]="",,"|n"&R1C18&RC[-15])&IF(RC[-14]="",,"|n"&R1C19&RC[-14])&IF(RC[-13]="",,"|n"&R1C20&RC[-13])&IF(RC[-12]="",,"|n"&R1C21&RC[-12])&IF(RC[-10]="",,"|n"&R1C23&RC[-10])&IF(RC[-9]="",,"|n"&R1C24&RC[-9])&IF(RC[-8]="",,"|n"&R1C25&RC[-8])&IF(RC[-7]="",,"|n"&R1C26&RC[-7])&IF(RC[-6]="",,"|n"&R1C27&RC[-6])&IF(RC[-5]="",,"|n"&R1C28&RC[-5])&IF(RC[-2]="",,"|n"&RC[-2]) -> 
AG874: =IF(RC[-26]&RC[-25]&RC[-24]&RC[-23]&RC[-22]&RC[-21]="",,R1C6)&IF(RC[-26]="",,"|n"&R1C7&RC[-26])&IF(RC[-25]="",,"|n"&R1C8&RC[-25])&IF(RC[-24]="",,"|n"&R1C9&RC[-24])&IF(RC[-23]="",,"|n"&R1C10&RC[-23])&IF(RC[-22]="",,"|n"&R1C11&RC[-22])&IF(RC[-21]="",,"|n"&R1C12&RC[-21])&IF(RC[-19]&RC[-18]&RC[-17]&RC[-16]="",,"|n"&R1C13)&IF(RC[-19]="",,"|n"&R1C14&RC[-19])&IF(RC[-18]="",,"|n"&R1C15&RC[-18])&IF(RC[-17]="",,"|n"&R1C16&RC[-17])&IF(RC[-16]="",,"|n"&R1C17&RC[-16])&IF(RC[-15]="",,"|n"&R1C18&RC[-15])&IF(RC[-14]="",,"|n"&R1C19&RC[-14])&IF(RC[-13]="",,"|n"&R1C20&RC[-13])&IF(RC[-12]="",,"|n"&R1C21&RC[-12])&IF(RC[-10]="",,"|n"&R1C23&RC[-10])&IF(RC[-9]="",,"|n"&R1C24&RC[-9])&IF(RC[-8]="",,"|n"&R1C25&RC[-8])&IF(RC[-7]="",,"|n"&R1C26&RC[-7])&IF(RC[-6]="",,"|n"&R1C27&RC[-6])&IF(RC[-5]="",,"|n"&R1C28&RC[-5])&IF(RC[-2]="",,"|n"&RC[-2]) -> 
AG875: =IF(RC[-26]&RC[-25]&RC[-24]&RC[-23]&RC[-22]&RC[-21]="",,R1C6)&IF(RC[-26]="",,"|n"&R1C7&RC[-26])&IF(RC[-25]="",,"|n"&R1C8&RC[-25])&IF(RC[-24]="",,"|n"&R1C9&RC[-24])&IF(RC[-23]="",,"|n"&R1C10&RC[-23])&IF(RC[-22]="",,"|n"&R1C11&RC[-22])&IF(RC[-21]="",,"|n"&R1C12&RC[-21])&IF(RC[-19]&RC[-18]&RC[-17]&RC[-16]="",,"|n"&R1C13)&IF(RC[-19]="",,"|n"&R1C14&RC[-19])&IF(RC[-18]="",,"|n"&R1C15&RC[-18])&IF(RC[-17]="",,"|n"&R1C16&RC[-17])&IF(RC[-16]="",,"|n"&R1C17&RC[-16])&IF(RC[-15]="",,"|n"&R1C18&RC[-15])&IF(RC[-14]="",,"|n"&R1C19&RC[-14])&IF(RC[-13]="",,"|n"&R1C20&RC[-13])&IF(RC[-12]="",,"|n"&R1C21&RC[-12])&IF(RC[-10]="",,"|n"&R1C23&RC[-10])&IF(RC[-9]="",,"|n"&R1C24&RC[-9])&IF(RC[-8]="",,"|n"&R1C25&RC[-8])&IF(RC[-7]="",,"|n"&R1C26&RC[-7])&IF(RC[-6]="",,"|n"&R1C27&RC[-6])&IF(RC[-5]="",,"|n"&R1C28&RC[-5])&IF(RC[-2]="",,"|n"&RC[-2]) -> 
AG876: =IF(RC[-26]&RC[-25]&RC[-24]&RC[-23]&RC[-22]&RC[-21]="",,R1C6)&IF(RC[-26]="",,"|n"&R1C7&RC[-26])&IF(RC[-25]="",,"|n"&R1C8&RC[-25])&IF(RC[-24]="",,"|n"&R1C9&RC[-24])&IF(RC[-23]="",,"|n"&R1C10&RC[-23])&IF(RC[-22]="",,"|n"&R1C11&RC[-22])&IF(RC[-21]="",,"|n"&R1C12&RC[-21])&IF(RC[-19]&RC[-18]&RC[-17]&RC[-16]="",,"|n"&R1C13)&IF(RC[-19]="",,"|n"&R1C14&RC[-19])&IF(RC[-18]="",,"|n"&R1C15&RC[-18])&IF(RC[-17]="",,"|n"&R1C16&RC[-17])&IF(RC[-16]="",,"|n"&R1C17&RC[-16])&IF(RC[-15]="",,"|n"&R1C18&RC[-15])&IF(RC[-14]="",,"|n"&R1C19&RC[-14])&IF(RC[-13]="",,"|n"&R1C20&RC[-13])&IF(RC[-12]="",,"|n"&R1C21&RC[-12])&IF(RC[-10]="",,"|n"&R1C23&RC[-10])&IF(RC[-9]="",,"|n"&R1C24&RC[-9])&IF(RC[-8]="",,"|n"&R1C25&RC[-8])&IF(RC[-7]="",,"|n"&R1C26&RC[-7])&IF(RC[-6]="",,"|n"&R1C27&RC[-6])&IF(RC[-5]="",,"|n"&R1C28&RC[-5])&IF(RC[-2]="",,"|n"&RC[-2]) -> 
AG877: =IF(RC[-26]&RC[-25]&RC[-24]&RC[-23]&RC[-22]&RC[-21]="",,R1C6)&IF(RC[-26]="",,"|n"&R1C7&RC[-26])&IF(RC[-25]="",,"|n"&R1C8&RC[-25])&IF(RC[-24]="",,"|n"&R1C9&RC[-24])&IF(RC[-23]="",,"|n"&R1C10&RC[-23])&IF(RC[-22]="",,"|n"&R1C11&RC[-22])&IF(RC[-21]="",,"|n"&R1C12&RC[-21])&IF(RC[-19]&RC[-18]&RC[-17]&RC[-16]="",,"|n"&R1C13)&IF(RC[-19]="",,"|n"&R1C14&RC[-19])&IF(RC[-18]="",,"|n"&R1C15&RC[-18])&IF(RC[-17]="",,"|n"&R1C16&RC[-17])&IF(RC[-16]="",,"|n"&R1C17&RC[-16])&IF(RC[-15]="",,"|n"&R1C18&RC[-15])&IF(RC[-14]="",,"|n"&R1C19&RC[-14])&IF(RC[-13]="",,"|n"&R1C20&RC[-13])&IF(RC[-12]="",,"|n"&R1C21&RC[-12])&IF(RC[-10]="",,"|n"&R1C23&RC[-10])&IF(RC[-9]="",,"|n"&R1C24&RC[-9])&IF(RC[-8]="",,"|n"&R1C25&RC[-8])&IF(RC[-7]="",,"|n"&R1C26&RC[-7])&IF(RC[-6]="",,"|n"&R1C27&RC[-6])&IF(RC[-5]="",,"|n"&R1C28&RC[-5])&IF(RC[-2]="",,"|n"&RC[-2]) -> 
AG878: =IF(RC[-26]&RC[-25]&RC[-24]&RC[-23]&RC[-22]&RC[-21]="",,R1C6)&IF(RC[-26]="",,"|n"&R1C7&RC[-26])&IF(RC[-25]="",,"|n"&R1C8&RC[-25])&IF(RC[-24]="",,"|n"&R1C9&RC[-24])&IF(RC[-23]="",,"|n"&R1C10&RC[-23])&IF(RC[-22]="",,"|n"&R1C11&RC[-22])&IF(RC[-21]="",,"|n"&R1C12&RC[-21])&IF(RC[-19]&RC[-18]&RC[-17]&RC[-16]="",,"|n"&R1C13)&IF(RC[-19]="",,"|n"&R1C14&RC[-19])&IF(RC[-18]="",,"|n"&R1C15&RC[-18])&IF(RC[-17]="",,"|n"&R1C16&RC[-17])&IF(RC[-16]="",,"|n"&R1C17&RC[-16])&IF(RC[-15]="",,"|n"&R1C18&RC[-15])&IF(RC[-14]="",,"|n"&R1C19&RC[-14])&IF(RC[-13]="",,"|n"&R1C20&RC[-13])&IF(RC[-12]="",,"|n"&R1C21&RC[-12])&IF(RC[-10]="",,"|n"&R1C23&RC[-10])&IF(RC[-9]="",,"|n"&R1C24&RC[-9])&IF(RC[-8]="",,"|n"&R1C25&RC[-8])&IF(RC[-7]="",,"|n"&R1C26&RC[-7])&IF(RC[-6]="",,"|n"&R1C27&RC[-6])&IF(RC[-5]="",,"|n"&R1C28&RC[-5])&IF(RC[-2]="",,"|n"&RC[-2]) -> 
AG879: =IF(RC[-26]&RC[-25]&RC[-24]&RC[-23]&RC[-22]&RC[-21]="",,R1C6)&IF(RC[-26]="",,"|n"&R1C7&RC[-26])&IF(RC[-25]="",,"|n"&R1C8&RC[-25])&IF(RC[-24]="",,"|n"&R1C9&RC[-24])&IF(RC[-23]="",,"|n"&R1C10&RC[-23])&IF(RC[-22]="",,"|n"&R1C11&RC[-22])&IF(RC[-21]="",,"|n"&R1C12&RC[-21])&IF(RC[-19]&RC[-18]&RC[-17]&RC[-16]="",,"|n"&R1C13)&IF(RC[-19]="",,"|n"&R1C14&RC[-19])&IF(RC[-18]="",,"|n"&R1C15&RC[-18])&IF(RC[-17]="",,"|n"&R1C16&RC[-17])&IF(RC[-16]="",,"|n"&R1C17&RC[-16])&IF(RC[-15]="",,"|n"&R1C18&RC[-15])&IF(RC[-14]="",,"|n"&R1C19&RC[-14])&IF(RC[-13]="",,"|n"&R1C20&RC[-13])&IF(RC[-12]="",,"|n"&R1C21&RC[-12])&IF(RC[-10]="",,"|n"&R1C23&RC[-10])&IF(RC[-9]="",,"|n"&R1C24&RC[-9])&IF(RC[-8]="",,"|n"&R1C25&RC[-8])&IF(RC[-7]="",,"|n"&R1C26&RC[-7])&IF(RC[-6]="",,"|n"&R1C27&RC[-6])&IF(RC[-5]="",,"|n"&R1C28&RC[-5])&IF(RC[-2]="",,"|n"&RC[-2]) -> 
AG880: =IF(RC[-26]&RC[-25]&RC[-24]&RC[-23]&RC[-22]&RC[-21]="",,R1C6)&IF(RC[-26]="",,"|n"&R1C7&RC[-26])&IF(RC[-25]="",,"|n"&R1C8&RC[-25])&IF(RC[-24]="",,"|n"&R1C9&RC[-24])&IF(RC[-23]="",,"|n"&R1C10&RC[-23])&IF(RC[-22]="",,"|n"&R1C11&RC[-22])&IF(RC[-21]="",,"|n"&R1C12&RC[-21])&IF(RC[-19]&RC[-18]&RC[-17]&RC[-16]="",,"|n"&R1C13)&IF(RC[-19]="",,"|n"&R1C14&RC[-19])&IF(RC[-18]="",,"|n"&R1C15&RC[-18])&IF(RC[-17]="",,"|n"&R1C16&RC[-17])&IF(RC[-16]="",,"|n"&R1C17&RC[-16])&IF(RC[-15]="",,"|n"&R1C18&RC[-15])&IF(RC[-14]="",,"|n"&R1C19&RC[-14])&IF(RC[-13]="",,"|n"&R1C20&RC[-13])&IF(RC[-12]="",,"|n"&R1C21&RC[-12])&IF(RC[-10]="",,"|n"&R1C23&RC[-10])&IF(RC[-9]="",,"|n"&R1C24&RC[-9])&IF(RC[-8]="",,"|n"&R1C25&RC[-8])&IF(RC[-7]="",,"|n"&R1C26&RC[-7])&IF(RC[-6]="",,"|n"&R1C27&RC[-6])&IF(RC[-5]="",,"|n"&R1C28&RC[-5])&IF(RC[-2]="",,"|n"&RC[-2]) -> 
AG881: =IF(RC[-26]&RC[-25]&RC[-24]&RC[-23]&RC[-22]&RC[-21]="",,R1C6)&IF(RC[-26]="",,"|n"&R1C7&RC[-26])&IF(RC[-25]="",,"|n"&R1C8&RC[-25])&IF(RC[-24]="",,"|n"&R1C9&RC[-24])&IF(RC[-23]="",,"|n"&R1C10&RC[-23])&IF(RC[-22]="",,"|n"&R1C11&RC[-22])&IF(RC[-21]="",,"|n"&R1C12&RC[-21])&IF(RC[-19]&RC[-18]&RC[-17]&RC[-16]="",,"|n"&R1C13)&IF(RC[-19]="",,"|n"&R1C14&RC[-19])&IF(RC[-18]="",,"|n"&R1C15&RC[-18])&IF(RC[-17]="",,"|n"&R1C16&RC[-17])&IF(RC[-16]="",,"|n"&R1C17&RC[-16])&IF(RC[-15]="",,"|n"&R1C18&RC[-15])&IF(RC[-14]="",,"|n"&R1C19&RC[-14])&IF(RC[-13]="",,"|n"&R1C20&RC[-13])&IF(RC[-12]="",,"|n"&R1C21&RC[-12])&IF(RC[-10]="",,"|n"&R1C23&RC[-10])&IF(RC[-9]="",,"|n"&R1C24&RC[-9])&IF(RC[-8]="",,"|n"&R1C25&RC[-8])&IF(RC[-7]="",,"|n"&R1C26&RC[-7])&IF(RC[-6]="",,"|n"&R1C27&RC[-6])&IF(RC[-5]="",,"|n"&R1C28&RC[-5])&IF(RC[-2]="",,"|n"&RC[-2]) -> 
AG882: =IF(RC[-26]&RC[-25]&RC[-24]&RC[-23]&RC[-22]&RC[-21]="",,R1C6)&IF(RC[-26]="",,"|n"&R1C7&RC[-26])&IF(RC[-25]="",,"|n"&R1C8&RC[-25])&IF(RC[-24]="",,"|n"&R1C9&RC[-24])&IF(RC[-23]="",,"|n"&R1C10&RC[-23])&IF(RC[-22]="",,"|n"&R1C11&RC[-22])&IF(RC[-21]="",,"|n"&R1C12&RC[-21])&IF(RC[-19]&RC[-18]&RC[-17]&RC[-16]="",,"|n"&R1C13)&IF(RC[-19]="",,"|n"&R1C14&RC[-19])&IF(RC[-18]="",,"|n"&R1C15&RC[-18])&IF(RC[-17]="",,"|n"&R1C16&RC[-17])&IF(RC[-16]="",,"|n"&R1C17&RC[-16])&IF(RC[-15]="",,"|n"&R1C18&RC[-15])&IF(RC[-14]="",,"|n"&R1C19&RC[-14])&IF(RC[-13]="",,"|n"&R1C20&RC[-13])&IF(RC[-12]="",,"|n"&R1C21&RC[-12])&IF(RC[-10]="",,"|n"&R1C23&RC[-10])&IF(RC[-9]="",,"|n"&R1C24&RC[-9])&IF(RC[-8]="",,"|n"&R1C25&RC[-8])&IF(RC[-7]="",,"|n"&R1C26&RC[-7])&IF(RC[-6]="",,"|n"&R1C27&RC[-6])&IF(RC[-5]="",,"|n"&R1C28&RC[-5])&IF(RC[-2]="",,"|n"&RC[-2]) -> 
AG883: =IF(RC[-26]&RC[-25]&RC[-24]&RC[-23]&RC[-22]&RC[-21]="",,R1C6)&IF(RC[-26]="",,"|n"&R1C7&RC[-26])&IF(RC[-25]="",,"|n"&R1C8&RC[-25])&IF(RC[-24]="",,"|n"&R1C9&RC[-24])&IF(RC[-23]="",,"|n"&R1C10&RC[-23])&IF(RC[-22]="",,"|n"&R1C11&RC[-22])&IF(RC[-21]="",,"|n"&R1C12&RC[-21])&IF(RC[-19]&RC[-18]&RC[-17]&RC[-16]="",,"|n"&R1C13)&IF(RC[-19]="",,"|n"&R1C14&RC[-19])&IF(RC[-18]="",,"|n"&R1C15&RC[-18])&IF(RC[-17]="",,"|n"&R1C16&RC[-17])&IF(RC[-16]="",,"|n"&R1C17&RC[-16])&IF(RC[-15]="",,"|n"&R1C18&RC[-15])&IF(RC[-14]="",,"|n"&R1C19&RC[-14])&IF(RC[-13]="",,"|n"&R1C20&RC[-13])&IF(RC[-12]="",,"|n"&R1C21&RC[-12])&IF(RC[-10]="",,"|n"&R1C23&RC[-10])&IF(RC[-9]="",,"|n"&R1C24&RC[-9])&IF(RC[-8]="",,"|n"&R1C25&RC[-8])&IF(RC[-7]="",,"|n"&R1C26&RC[-7])&IF(RC[-6]="",,"|n"&R1C27&RC[-6])&IF(RC[-5]="",,"|n"&R1C28&RC[-5])&IF(RC[-2]="",,"|n"&RC[-2]) -> 
AG884: =IF(RC[-26]&RC[-25]&RC[-24]&RC[-23]&RC[-22]&RC[-21]="",,R1C6)&IF(RC[-26]="",,"|n"&R1C7&RC[-26])&IF(RC[-25]="",,"|n"&R1C8&RC[-25])&IF(RC[-24]="",,"|n"&R1C9&RC[-24])&IF(RC[-23]="",,"|n"&R1C10&RC[-23])&IF(RC[-22]="",,"|n"&R1C11&RC[-22])&IF(RC[-21]="",,"|n"&R1C12&RC[-21])&IF(RC[-19]&RC[-18]&RC[-17]&RC[-16]="",,"|n"&R1C13)&IF(RC[-19]="",,"|n"&R1C14&RC[-19])&IF(RC[-18]="",,"|n"&R1C15&RC[-18])&IF(RC[-17]="",,"|n"&R1C16&RC[-17])&IF(RC[-16]="",,"|n"&R1C17&RC[-16])&IF(RC[-15]="",,"|n"&R1C18&RC[-15])&IF(RC[-14]="",,"|n"&R1C19&RC[-14])&IF(RC[-13]="",,"|n"&R1C20&RC[-13])&IF(RC[-12]="",,"|n"&R1C21&RC[-12])&IF(RC[-10]="",,"|n"&R1C23&RC[-10])&IF(RC[-9]="",,"|n"&R1C24&RC[-9])&IF(RC[-8]="",,"|n"&R1C25&RC[-8])&IF(RC[-7]="",,"|n"&R1C26&RC[-7])&IF(RC[-6]="",,"|n"&R1C27&RC[-6])&IF(RC[-5]="",,"|n"&R1C28&RC[-5])&IF(RC[-2]="",,"|n"&RC[-2]) -> 
AG885: =IF(RC[-26]&RC[-25]&RC[-24]&RC[-23]&RC[-22]&RC[-21]="",,R1C6)&IF(RC[-26]="",,"|n"&R1C7&RC[-26])&IF(RC[-25]="",,"|n"&R1C8&RC[-25])&IF(RC[-24]="",,"|n"&R1C9&RC[-24])&IF(RC[-23]="",,"|n"&R1C10&RC[-23])&IF(RC[-22]="",,"|n"&R1C11&RC[-22])&IF(RC[-21]="",,"|n"&R1C12&RC[-21])&IF(RC[-19]&RC[-18]&RC[-17]&RC[-16]="",,"|n"&R1C13)&IF(RC[-19]="",,"|n"&R1C14&RC[-19])&IF(RC[-18]="",,"|n"&R1C15&RC[-18])&IF(RC[-17]="",,"|n"&R1C16&RC[-17])&IF(RC[-16]="",,"|n"&R1C17&RC[-16])&IF(RC[-15]="",,"|n"&R1C18&RC[-15])&IF(RC[-14]="",,"|n"&R1C19&RC[-14])&IF(RC[-13]="",,"|n"&R1C20&RC[-13])&IF(RC[-12]="",,"|n"&R1C21&RC[-12])&IF(RC[-10]="",,"|n"&R1C23&RC[-10])&IF(RC[-9]="",,"|n"&R1C24&RC[-9])&IF(RC[-8]="",,"|n"&R1C25&RC[-8])&IF(RC[-7]="",,"|n"&R1C26&RC[-7])&IF(RC[-6]="",,"|n"&R1C27&RC[-6])&IF(RC[-5]="",,"|n"&R1C28&RC[-5])&IF(RC[-2]="",,"|n"&RC[-2]) -> 
AG886: =IF(RC[-26]&RC[-25]&RC[-24]&RC[-23]&RC[-22]&RC[-21]="",,R1C6)&IF(RC[-26]="",,"|n"&R1C7&RC[-26])&IF(RC[-25]="",,"|n"&R1C8&RC[-25])&IF(RC[-24]="",,"|n"&R1C9&RC[-24])&IF(RC[-23]="",,"|n"&R1C10&RC[-23])&IF(RC[-22]="",,"|n"&R1C11&RC[-22])&IF(RC[-21]="",,"|n"&R1C12&RC[-21])&IF(RC[-19]&RC[-18]&RC[-17]&RC[-16]="",,"|n"&R1C13)&IF(RC[-19]="",,"|n"&R1C14&RC[-19])&IF(RC[-18]="",,"|n"&R1C15&RC[-18])&IF(RC[-17]="",,"|n"&R1C16&RC[-17])&IF(RC[-16]="",,"|n"&R1C17&RC[-16])&IF(RC[-15]="",,"|n"&R1C18&RC[-15])&IF(RC[-14]="",,"|n"&R1C19&RC[-14])&IF(RC[-13]="",,"|n"&R1C20&RC[-13])&IF(RC[-12]="",,"|n"&R1C21&RC[-12])&IF(RC[-10]="",,"|n"&R1C23&RC[-10])&IF(RC[-9]="",,"|n"&R1C24&RC[-9])&IF(RC[-8]="",,"|n"&R1C25&RC[-8])&IF(RC[-7]="",,"|n"&R1C26&RC[-7])&IF(RC[-6]="",,"|n"&R1C27&RC[-6])&IF(RC[-5]="",,"|n"&R1C28&RC[-5])&IF(RC[-2]="",,"|n"&RC[-2]) -> 
AG887: =IF(RC[-26]&RC[-25]&RC[-24]&RC[-23]&RC[-22]&RC[-21]="",,R1C6)&IF(RC[-26]="",,"|n"&R1C7&RC[-26])&IF(RC[-25]="",,"|n"&R1C8&RC[-25])&IF(RC[-24]="",,"|n"&R1C9&RC[-24])&IF(RC[-23]="",,"|n"&R1C10&RC[-23])&IF(RC[-22]="",,"|n"&R1C11&RC[-22])&IF(RC[-21]="",,"|n"&R1C12&RC[-21])&IF(RC[-19]&RC[-18]&RC[-17]&RC[-16]="",,"|n"&R1C13)&IF(RC[-19]="",,"|n"&R1C14&RC[-19])&IF(RC[-18]="",,"|n"&R1C15&RC[-18])&IF(RC[-17]="",,"|n"&R1C16&RC[-17])&IF(RC[-16]="",,"|n"&R1C17&RC[-16])&IF(RC[-15]="",,"|n"&R1C18&RC[-15])&IF(RC[-14]="",,"|n"&R1C19&RC[-14])&IF(RC[-13]="",,"|n"&R1C20&RC[-13])&IF(RC[-12]="",,"|n"&R1C21&RC[-12])&IF(RC[-10]="",,"|n"&R1C23&RC[-10])&IF(RC[-9]="",,"|n"&R1C24&RC[-9])&IF(RC[-8]="",,"|n"&R1C25&RC[-8])&IF(RC[-7]="",,"|n"&R1C26&RC[-7])&IF(RC[-6]="",,"|n"&R1C27&RC[-6])&IF(RC[-5]="",,"|n"&R1C28&RC[-5])&IF(RC[-2]="",,"|n"&RC[-2]) -> 
AG888: =IF(RC[-26]&RC[-25]&RC[-24]&RC[-23]&RC[-22]&RC[-21]="",,R1C6)&IF(RC[-26]="",,"|n"&R1C7&RC[-26])&IF(RC[-25]="",,"|n"&R1C8&RC[-25])&IF(RC[-24]="",,"|n"&R1C9&RC[-24])&IF(RC[-23]="",,"|n"&R1C10&RC[-23])&IF(RC[-22]="",,"|n"&R1C11&RC[-22])&IF(RC[-21]="",,"|n"&R1C12&RC[-21])&IF(RC[-19]&RC[-18]&RC[-17]&RC[-16]="",,"|n"&R1C13)&IF(RC[-19]="",,"|n"&R1C14&RC[-19])&IF(RC[-18]="",,"|n"&R1C15&RC[-18])&IF(RC[-17]="",,"|n"&R1C16&RC[-17])&IF(RC[-16]="",,"|n"&R1C17&RC[-16])&IF(RC[-15]="",,"|n"&R1C18&RC[-15])&IF(RC[-14]="",,"|n"&R1C19&RC[-14])&IF(RC[-13]="",,"|n"&R1C20&RC[-13])&IF(RC[-12]="",,"|n"&R1C21&RC[-12])&IF(RC[-10]="",,"|n"&R1C23&RC[-10])&IF(RC[-9]="",,"|n"&R1C24&RC[-9])&IF(RC[-8]="",,"|n"&R1C25&RC[-8])&IF(RC[-7]="",,"|n"&R1C26&RC[-7])&IF(RC[-6]="",,"|n"&R1C27&RC[-6])&IF(RC[-5]="",,"|n"&R1C28&RC[-5])&IF(RC[-2]="",,"|n"&RC[-2]) -> 
AG889: =IF(RC[-26]&RC[-25]&RC[-24]&RC[-23]&RC[-22]&RC[-21]="",,R1C6)&IF(RC[-26]="",,"|n"&R1C7&RC[-26])&IF(RC[-25]="",,"|n"&R1C8&RC[-25])&IF(RC[-24]="",,"|n"&R1C9&RC[-24])&IF(RC[-23]="",,"|n"&R1C10&RC[-23])&IF(RC[-22]="",,"|n"&R1C11&RC[-22])&IF(RC[-21]="",,"|n"&R1C12&RC[-21])&IF(RC[-19]&RC[-18]&RC[-17]&RC[-16]="",,"|n"&R1C13)&IF(RC[-19]="",,"|n"&R1C14&RC[-19])&IF(RC[-18]="",,"|n"&R1C15&RC[-18])&IF(RC[-17]="",,"|n"&R1C16&RC[-17])&IF(RC[-16]="",,"|n"&R1C17&RC[-16])&IF(RC[-15]="",,"|n"&R1C18&RC[-15])&IF(RC[-14]="",,"|n"&R1C19&RC[-14])&IF(RC[-13]="",,"|n"&R1C20&RC[-13])&IF(RC[-12]="",,"|n"&R1C21&RC[-12])&IF(RC[-10]="",,"|n"&R1C23&RC[-10])&IF(RC[-9]="",,"|n"&R1C24&RC[-9])&IF(RC[-8]="",,"|n"&R1C25&RC[-8])&IF(RC[-7]="",,"|n"&R1C26&RC[-7])&IF(RC[-6]="",,"|n"&R1C27&RC[-6])&IF(RC[-5]="",,"|n"&R1C28&RC[-5])&IF(RC[-2]="",,"|n"&RC[-2]) -> 
AG890: =IF(RC[-26]&RC[-25]&RC[-24]&RC[-23]&RC[-22]&RC[-21]="",,R1C6)&IF(RC[-26]="",,"|n"&R1C7&RC[-26])&IF(RC[-25]="",,"|n"&R1C8&RC[-25])&IF(RC[-24]="",,"|n"&R1C9&RC[-24])&IF(RC[-23]="",,"|n"&R1C10&RC[-23])&IF(RC[-22]="",,"|n"&R1C11&RC[-22])&IF(RC[-21]="",,"|n"&R1C12&RC[-21])&IF(RC[-19]&RC[-18]&RC[-17]&RC[-16]="",,"|n"&R1C13)&IF(RC[-19]="",,"|n"&R1C14&RC[-19])&IF(RC[-18]="",,"|n"&R1C15&RC[-18])&IF(RC[-17]="",,"|n"&R1C16&RC[-17])&IF(RC[-16]="",,"|n"&R1C17&RC[-16])&IF(RC[-15]="",,"|n"&R1C18&RC[-15])&IF(RC[-14]="",,"|n"&R1C19&RC[-14])&IF(RC[-13]="",,"|n"&R1C20&RC[-13])&IF(RC[-12]="",,"|n"&R1C21&RC[-12])&IF(RC[-10]="",,"|n"&R1C23&RC[-10])&IF(RC[-9]="",,"|n"&R1C24&RC[-9])&IF(RC[-8]="",,"|n"&R1C25&RC[-8])&IF(RC[-7]="",,"|n"&R1C26&RC[-7])&IF(RC[-6]="",,"|n"&R1C27&RC[-6])&IF(RC[-5]="",,"|n"&R1C28&RC[-5])&IF(RC[-2]="",,"|n"&RC[-2]) -> 
AG891: =IF(RC[-26]&RC[-25]&RC[-24]&RC[-23]&RC[-22]&RC[-21]="",,R1C6)&IF(RC[-26]="",,"|n"&R1C7&RC[-26])&IF(RC[-25]="",,"|n"&R1C8&RC[-25])&IF(RC[-24]="",,"|n"&R1C9&RC[-24])&IF(RC[-23]="",,"|n"&R1C10&RC[-23])&IF(RC[-22]="",,"|n"&R1C11&RC[-22])&IF(RC[-21]="",,"|n"&R1C12&RC[-21])&IF(RC[-19]&RC[-18]&RC[-17]&RC[-16]="",,"|n"&R1C13)&IF(RC[-19]="",,"|n"&R1C14&RC[-19])&IF(RC[-18]="",,"|n"&R1C15&RC[-18])&IF(RC[-17]="",,"|n"&R1C16&RC[-17])&IF(RC[-16]="",,"|n"&R1C17&RC[-16])&IF(RC[-15]="",,"|n"&R1C18&RC[-15])&IF(RC[-14]="",,"|n"&R1C19&RC[-14])&IF(RC[-13]="",,"|n"&R1C20&RC[-13])&IF(RC[-12]="",,"|n"&R1C21&RC[-12])&IF(RC[-10]="",,"|n"&R1C23&RC[-10])&IF(RC[-9]="",,"|n"&R1C24&RC[-9])&IF(RC[-8]="",,"|n"&R1C25&RC[-8])&IF(RC[-7]="",,"|n"&R1C26&RC[-7])&IF(RC[-6]="",,"|n"&R1C27&RC[-6])&IF(RC[-5]="",,"|n"&R1C28&RC[-5])&IF(RC[-2]="",,"|n"&RC[-2]) -> 
AG892: =IF(RC[-26]&RC[-25]&RC[-24]&RC[-23]&RC[-22]&RC[-21]="",,R1C6)&IF(RC[-26]="",,"|n"&R1C7&RC[-26])&IF(RC[-25]="",,"|n"&R1C8&RC[-25])&IF(RC[-24]="",,"|n"&R1C9&RC[-24])&IF(RC[-23]="",,"|n"&R1C10&RC[-23])&IF(RC[-22]="",,"|n"&R1C11&RC[-22])&IF(RC[-21]="",,"|n"&R1C12&RC[-21])&IF(RC[-19]&RC[-18]&RC[-17]&RC[-16]="",,"|n"&R1C13)&IF(RC[-19]="",,"|n"&R1C14&RC[-19])&IF(RC[-18]="",,"|n"&R1C15&RC[-18])&IF(RC[-17]="",,"|n"&R1C16&RC[-17])&IF(RC[-16]="",,"|n"&R1C17&RC[-16])&IF(RC[-15]="",,"|n"&R1C18&RC[-15])&IF(RC[-14]="",,"|n"&R1C19&RC[-14])&IF(RC[-13]="",,"|n"&R1C20&RC[-13])&IF(RC[-12]="",,"|n"&R1C21&RC[-12])&IF(RC[-10]="",,"|n"&R1C23&RC[-10])&IF(RC[-9]="",,"|n"&R1C24&RC[-9])&IF(RC[-8]="",,"|n"&R1C25&RC[-8])&IF(RC[-7]="",,"|n"&R1C26&RC[-7])&IF(RC[-6]="",,"|n"&R1C27&RC[-6])&IF(RC[-5]="",,"|n"&R1C28&RC[-5])&IF(RC[-2]="",,"|n"&RC[-2]) -> 
AG893: =IF(RC[-26]&RC[-25]&RC[-24]&RC[-23]&RC[-22]&RC[-21]="",,R1C6)&IF(RC[-26]="",,"|n"&R1C7&RC[-26])&IF(RC[-25]="",,"|n"&R1C8&RC[-25])&IF(RC[-24]="",,"|n"&R1C9&RC[-24])&IF(RC[-23]="",,"|n"&R1C10&RC[-23])&IF(RC[-22]="",,"|n"&R1C11&RC[-22])&IF(RC[-21]="",,"|n"&R1C12&RC[-21])&IF(RC[-19]&RC[-18]&RC[-17]&RC[-16]="",,"|n"&R1C13)&IF(RC[-19]="",,"|n"&R1C14&RC[-19])&IF(RC[-18]="",,"|n"&R1C15&RC[-18])&IF(RC[-17]="",,"|n"&R1C16&RC[-17])&IF(RC[-16]="",,"|n"&R1C17&RC[-16])&IF(RC[-15]="",,"|n"&R1C18&RC[-15])&IF(RC[-14]="",,"|n"&R1C19&RC[-14])&IF(RC[-13]="",,"|n"&R1C20&RC[-13])&IF(RC[-12]="",,"|n"&R1C21&RC[-12])&IF(RC[-10]="",,"|n"&R1C23&RC[-10])&IF(RC[-9]="",,"|n"&R1C24&RC[-9])&IF(RC[-8]="",,"|n"&R1C25&RC[-8])&IF(RC[-7]="",,"|n"&R1C26&RC[-7])&IF(RC[-6]="",,"|n"&R1C27&RC[-6])&IF(RC[-5]="",,"|n"&R1C28&RC[-5])&IF(RC[-2]="",,"|n"&RC[-2]) -> 
AG894: =IF(RC[-26]&RC[-25]&RC[-24]&RC[-23]&RC[-22]&RC[-21]="",,R1C6)&IF(RC[-26]="",,"|n"&R1C7&RC[-26])&IF(RC[-25]="",,"|n"&R1C8&RC[-25])&IF(RC[-24]="",,"|n"&R1C9&RC[-24])&IF(RC[-23]="",,"|n"&R1C10&RC[-23])&IF(RC[-22]="",,"|n"&R1C11&RC[-22])&IF(RC[-21]="",,"|n"&R1C12&RC[-21])&IF(RC[-19]&RC[-18]&RC[-17]&RC[-16]="",,"|n"&R1C13)&IF(RC[-19]="",,"|n"&R1C14&RC[-19])&IF(RC[-18]="",,"|n"&R1C15&RC[-18])&IF(RC[-17]="",,"|n"&R1C16&RC[-17])&IF(RC[-16]="",,"|n"&R1C17&RC[-16])&IF(RC[-15]="",,"|n"&R1C18&RC[-15])&IF(RC[-14]="",,"|n"&R1C19&RC[-14])&IF(RC[-13]="",,"|n"&R1C20&RC[-13])&IF(RC[-12]="",,"|n"&R1C21&RC[-12])&IF(RC[-10]="",,"|n"&R1C23&RC[-10])&IF(RC[-9]="",,"|n"&R1C24&RC[-9])&IF(RC[-8]="",,"|n"&R1C25&RC[-8])&IF(RC[-7]="",,"|n"&R1C26&RC[-7])&IF(RC[-6]="",,"|n"&R1C27&RC[-6])&IF(RC[-5]="",,"|n"&R1C28&RC[-5])&IF(RC[-2]="",,"|n"&RC[-2]) -> 
AG895: =IF(RC[-26]&RC[-25]&RC[-24]&RC[-23]&RC[-22]&RC[-21]="",,R1C6)&IF(RC[-26]="",,"|n"&R1C7&RC[-26])&IF(RC[-25]="",,"|n"&R1C8&RC[-25])&IF(RC[-24]="",,"|n"&R1C9&RC[-24])&IF(RC[-23]="",,"|n"&R1C10&RC[-23])&IF(RC[-22]="",,"|n"&R1C11&RC[-22])&IF(RC[-21]="",,"|n"&R1C12&RC[-21])&IF(RC[-19]&RC[-18]&RC[-17]&RC[-16]="",,"|n"&R1C13)&IF(RC[-19]="",,"|n"&R1C14&RC[-19])&IF(RC[-18]="",,"|n"&R1C15&RC[-18])&IF(RC[-17]="",,"|n"&R1C16&RC[-17])&IF(RC[-16]="",,"|n"&R1C17&RC[-16])&IF(RC[-15]="",,"|n"&R1C18&RC[-15])&IF(RC[-14]="",,"|n"&R1C19&RC[-14])&IF(RC[-13]="",,"|n"&R1C20&RC[-13])&IF(RC[-12]="",,"|n"&R1C21&RC[-12])&IF(RC[-10]="",,"|n"&R1C23&RC[-10])&IF(RC[-9]="",,"|n"&R1C24&RC[-9])&IF(RC[-8]="",,"|n"&R1C25&RC[-8])&IF(RC[-7]="",,"|n"&R1C26&RC[-7])&IF(RC[-6]="",,"|n"&R1C27&RC[-6])&IF(RC[-5]="",,"|n"&R1C28&RC[-5])&IF(RC[-2]="",,"|n"&RC[-2]) -> 
AG896: =IF(RC[-26]&RC[-25]&RC[-24]&RC[-23]&RC[-22]&RC[-21]="",,R1C6)&IF(RC[-26]="",,"|n"&R1C7&RC[-26])&IF(RC[-25]="",,"|n"&R1C8&RC[-25])&IF(RC[-24]="",,"|n"&R1C9&RC[-24])&IF(RC[-23]="",,"|n"&R1C10&RC[-23])&IF(RC[-22]="",,"|n"&R1C11&RC[-22])&IF(RC[-21]="",,"|n"&R1C12&RC[-21])&IF(RC[-19]&RC[-18]&RC[-17]&RC[-16]="",,"|n"&R1C13)&IF(RC[-19]="",,"|n"&R1C14&RC[-19])&IF(RC[-18]="",,"|n"&R1C15&RC[-18])&IF(RC[-17]="",,"|n"&R1C16&RC[-17])&IF(RC[-16]="",,"|n"&R1C17&RC[-16])&IF(RC[-15]="",,"|n"&R1C18&RC[-15])&IF(RC[-14]="",,"|n"&R1C19&RC[-14])&IF(RC[-13]="",,"|n"&R1C20&RC[-13])&IF(RC[-12]="",,"|n"&R1C21&RC[-12])&IF(RC[-10]="",,"|n"&R1C23&RC[-10])&IF(RC[-9]="",,"|n"&R1C24&RC[-9])&IF(RC[-8]="",,"|n"&R1C25&RC[-8])&IF(RC[-7]="",,"|n"&R1C26&RC[-7])&IF(RC[-6]="",,"|n"&R1C27&RC[-6])&IF(RC[-5]="",,"|n"&R1C28&RC[-5])&IF(RC[-2]="",,"|n"&RC[-2]) -> 
AG897: =IF(RC[-26]&RC[-25]&RC[-24]&RC[-23]&RC[-22]&RC[-21]="",,R1C6)&IF(RC[-26]="",,"|n"&R1C7&RC[-26])&IF(RC[-25]="",,"|n"&R1C8&RC[-25])&IF(RC[-24]="",,"|n"&R1C9&RC[-24])&IF(RC[-23]="",,"|n"&R1C10&RC[-23])&IF(RC[-22]="",,"|n"&R1C11&RC[-22])&IF(RC[-21]="",,"|n"&R1C12&RC[-21])&IF(RC[-19]&RC[-18]&RC[-17]&RC[-16]="",,"|n"&R1C13)&IF(RC[-19]="",,"|n"&R1C14&RC[-19])&IF(RC[-18]="",,"|n"&R1C15&RC[-18])&IF(RC[-17]="",,"|n"&R1C16&RC[-17])&IF(RC[-16]="",,"|n"&R1C17&RC[-16])&IF(RC[-15]="",,"|n"&R1C18&RC[-15])&IF(RC[-14]="",,"|n"&R1C19&RC[-14])&IF(RC[-13]="",,"|n"&R1C20&RC[-13])&IF(RC[-12]="",,"|n"&R1C21&RC[-12])&IF(RC[-10]="",,"|n"&R1C23&RC[-10])&IF(RC[-9]="",,"|n"&R1C24&RC[-9])&IF(RC[-8]="",,"|n"&R1C25&RC[-8])&IF(RC[-7]="",,"|n"&R1C26&RC[-7])&IF(RC[-6]="",,"|n"&R1C27&RC[-6])&IF(RC[-5]="",,"|n"&R1C28&RC[-5])&IF(RC[-2]="",,"|n"&RC[-2]) -> 
AG898: =IF(RC[-26]&RC[-25]&RC[-24]&RC[-23]&RC[-22]&RC[-21]="",,R1C6)&IF(RC[-26]="",,"|n"&R1C7&RC[-26])&IF(RC[-25]="",,"|n"&R1C8&RC[-25])&IF(RC[-24]="",,"|n"&R1C9&RC[-24])&IF(RC[-23]="",,"|n"&R1C10&RC[-23])&IF(RC[-22]="",,"|n"&R1C11&RC[-22])&IF(RC[-21]="",,"|n"&R1C12&RC[-21])&IF(RC[-19]&RC[-18]&RC[-17]&RC[-16]="",,"|n"&R1C13)&IF(RC[-19]="",,"|n"&R1C14&RC[-19])&IF(RC[-18]="",,"|n"&R1C15&RC[-18])&IF(RC[-17]="",,"|n"&R1C16&RC[-17])&IF(RC[-16]="",,"|n"&R1C17&RC[-16])&IF(RC[-15]="",,"|n"&R1C18&RC[-15])&IF(RC[-14]="",,"|n"&R1C19&RC[-14])&IF(RC[-13]="",,"|n"&R1C20&RC[-13])&IF(RC[-12]="",,"|n"&R1C21&RC[-12])&IF(RC[-10]="",,"|n"&R1C23&RC[-10])&IF(RC[-9]="",,"|n"&R1C24&RC[-9])&IF(RC[-8]="",,"|n"&R1C25&RC[-8])&IF(RC[-7]="",,"|n"&R1C26&RC[-7])&IF(RC[-6]="",,"|n"&R1C27&RC[-6])&IF(RC[-5]="",,"|n"&R1C28&RC[-5])&IF(RC[-2]="",,"|n"&RC[-2]) -> 
AG899: =IF(RC[-26]&RC[-25]&RC[-24]&RC[-23]&RC[-22]&RC[-21]="",,R1C6)&IF(RC[-26]="",,"|n"&R1C7&RC[-26])&IF(RC[-25]="",,"|n"&R1C8&RC[-25])&IF(RC[-24]="",,"|n"&R1C9&RC[-24])&IF(RC[-23]="",,"|n"&R1C10&RC[-23])&IF(RC[-22]="",,"|n"&R1C11&RC[-22])&IF(RC[-21]="",,"|n"&R1C12&RC[-21])&IF(RC[-19]&RC[-18]&RC[-17]&RC[-16]="",,"|n"&R1C13)&IF(RC[-19]="",,"|n"&R1C14&RC[-19])&IF(RC[-18]="",,"|n"&R1C15&RC[-18])&IF(RC[-17]="",,"|n"&R1C16&RC[-17])&IF(RC[-16]="",,"|n"&R1C17&RC[-16])&IF(RC[-15]="",,"|n"&R1C18&RC[-15])&IF(RC[-14]="",,"|n"&R1C19&RC[-14])&IF(RC[-13]="",,"|n"&R1C20&RC[-13])&IF(RC[-12]="",,"|n"&R1C21&RC[-12])&IF(RC[-10]="",,"|n"&R1C23&RC[-10])&IF(RC[-9]="",,"|n"&R1C24&RC[-9])&IF(RC[-8]="",,"|n"&R1C25&RC[-8])&IF(RC[-7]="",,"|n"&R1C26&RC[-7])&IF(RC[-6]="",,"|n"&R1C27&RC[-6])&IF(RC[-5]="",,"|n"&R1C28&RC[-5])&IF(RC[-2]="",,"|n"&RC[-2]) -> 
AG900: =IF(RC[-26]&RC[-25]&RC[-24]&RC[-23]&RC[-22]&RC[-21]="",,R1C6)&IF(RC[-26]="",,"|n"&R1C7&RC[-26])&IF(RC[-25]="",,"|n"&R1C8&RC[-25])&IF(RC[-24]="",,"|n"&R1C9&RC[-24])&IF(RC[-23]="",,"|n"&R1C10&RC[-23])&IF(RC[-22]="",,"|n"&R1C11&RC[-22])&IF(RC[-21]="",,"|n"&R1C12&RC[-21])&IF(RC[-19]&RC[-18]&RC[-17]&RC[-16]="",,"|n"&R1C13)&IF(RC[-19]="",,"|n"&R1C14&RC[-19])&IF(RC[-18]="",,"|n"&R1C15&RC[-18])&IF(RC[-17]="",,"|n"&R1C16&RC[-17])&IF(RC[-16]="",,"|n"&R1C17&RC[-16])&IF(RC[-15]="",,"|n"&R1C18&RC[-15])&IF(RC[-14]="",,"|n"&R1C19&RC[-14])&IF(RC[-13]="",,"|n"&R1C20&RC[-13])&IF(RC[-12]="",,"|n"&R1C21&RC[-12])&IF(RC[-10]="",,"|n"&R1C23&RC[-10])&IF(RC[-9]="",,"|n"&R1C24&RC[-9])&IF(RC[-8]="",,"|n"&R1C25&RC[-8])&IF(RC[-7]="",,"|n"&R1C26&RC[-7])&IF(RC[-6]="",,"|n"&R1C27&RC[-6])&IF(RC[-5]="",,"|n"&R1C28&RC[-5])&IF(RC[-2]="",,"|n"&RC[-2]) -> 
AG901: =IF(RC[-26]&RC[-25]&RC[-24]&RC[-23]&RC[-22]&RC[-21]="",,R1C6)&IF(RC[-26]="",,"|n"&R1C7&RC[-26])&IF(RC[-25]="",,"|n"&R1C8&RC[-25])&IF(RC[-24]="",,"|n"&R1C9&RC[-24])&IF(RC[-23]="",,"|n"&R1C10&RC[-23])&IF(RC[-22]="",,"|n"&R1C11&RC[-22])&IF(RC[-21]="",,"|n"&R1C12&RC[-21])&IF(RC[-19]&RC[-18]&RC[-17]&RC[-16]="",,"|n"&R1C13)&IF(RC[-19]="",,"|n"&R1C14&RC[-19])&IF(RC[-18]="",,"|n"&R1C15&RC[-18])&IF(RC[-17]="",,"|n"&R1C16&RC[-17])&IF(RC[-16]="",,"|n"&R1C17&RC[-16])&IF(RC[-15]="",,"|n"&R1C18&RC[-15])&IF(RC[-14]="",,"|n"&R1C19&RC[-14])&IF(RC[-13]="",,"|n"&R1C20&RC[-13])&IF(RC[-12]="",,"|n"&R1C21&RC[-12])&IF(RC[-10]="",,"|n"&R1C23&RC[-10])&IF(RC[-9]="",,"|n"&R1C24&RC[-9])&IF(RC[-8]="",,"|n"&R1C25&RC[-8])&IF(RC[-7]="",,"|n"&R1C26&RC[-7])&IF(RC[-6]="",,"|n"&R1C27&RC[-6])&IF(RC[-5]="",,"|n"&R1C28&RC[-5])&IF(RC[-2]="",,"|n"&RC[-2]) -> 
AG902: =IF(RC[-26]&RC[-25]&RC[-24]&RC[-23]&RC[-22]&RC[-21]="",,R1C6)&IF(RC[-26]="",,"|n"&R1C7&RC[-26])&IF(RC[-25]="",,"|n"&R1C8&RC[-25])&IF(RC[-24]="",,"|n"&R1C9&RC[-24])&IF(RC[-23]="",,"|n"&R1C10&RC[-23])&IF(RC[-22]="",,"|n"&R1C11&RC[-22])&IF(RC[-21]="",,"|n"&R1C12&RC[-21])&IF(RC[-19]&RC[-18]&RC[-17]&RC[-16]="",,"|n"&R1C13)&IF(RC[-19]="",,"|n"&R1C14&RC[-19])&IF(RC[-18]="",,"|n"&R1C15&RC[-18])&IF(RC[-17]="",,"|n"&R1C16&RC[-17])&IF(RC[-16]="",,"|n"&R1C17&RC[-16])&IF(RC[-15]="",,"|n"&R1C18&RC[-15])&IF(RC[-14]="",,"|n"&R1C19&RC[-14])&IF(RC[-13]="",,"|n"&R1C20&RC[-13])&IF(RC[-12]="",,"|n"&R1C21&RC[-12])&IF(RC[-10]="",,"|n"&R1C23&RC[-10])&IF(RC[-9]="",,"|n"&R1C24&RC[-9])&IF(RC[-8]="",,"|n"&R1C25&RC[-8])&IF(RC[-7]="",,"|n"&R1C26&RC[-7])&IF(RC[-6]="",,"|n"&R1C27&RC[-6])&IF(RC[-5]="",,"|n"&R1C28&RC[-5])&IF(RC[-2]="",,"|n"&RC[-2]) -> 
AG903: =IF(RC[-26]&RC[-25]&RC[-24]&RC[-23]&RC[-22]&RC[-21]="",,R1C6)&IF(RC[-26]="",,"|n"&R1C7&RC[-26])&IF(RC[-25]="",,"|n"&R1C8&RC[-25])&IF(RC[-24]="",,"|n"&R1C9&RC[-24])&IF(RC[-23]="",,"|n"&R1C10&RC[-23])&IF(RC[-22]="",,"|n"&R1C11&RC[-22])&IF(RC[-21]="",,"|n"&R1C12&RC[-21])&IF(RC[-19]&RC[-18]&RC[-17]&RC[-16]="",,"|n"&R1C13)&IF(RC[-19]="",,"|n"&R1C14&RC[-19])&IF(RC[-18]="",,"|n"&R1C15&RC[-18])&IF(RC[-17]="",,"|n"&R1C16&RC[-17])&IF(RC[-16]="",,"|n"&R1C17&RC[-16])&IF(RC[-15]="",,"|n"&R1C18&RC[-15])&IF(RC[-14]="",,"|n"&R1C19&RC[-14])&IF(RC[-13]="",,"|n"&R1C20&RC[-13])&IF(RC[-12]="",,"|n"&R1C21&RC[-12])&IF(RC[-10]="",,"|n"&R1C23&RC[-10])&IF(RC[-9]="",,"|n"&R1C24&RC[-9])&IF(RC[-8]="",,"|n"&R1C25&RC[-8])&IF(RC[-7]="",,"|n"&R1C26&RC[-7])&IF(RC[-6]="",,"|n"&R1C27&RC[-6])&IF(RC[-5]="",,"|n"&R1C28&RC[-5])&IF(RC[-2]="",,"|n"&RC[-2]) -> 
AG904: =IF(RC[-26]&RC[-25]&RC[-24]&RC[-23]&RC[-22]&RC[-21]="",,R1C6)&IF(RC[-26]="",,"|n"&R1C7&RC[-26])&IF(RC[-25]="",,"|n"&R1C8&RC[-25])&IF(RC[-24]="",,"|n"&R1C9&RC[-24])&IF(RC[-23]="",,"|n"&R1C10&RC[-23])&IF(RC[-22]="",,"|n"&R1C11&RC[-22])&IF(RC[-21]="",,"|n"&R1C12&RC[-21])&IF(RC[-19]&RC[-18]&RC[-17]&RC[-16]="",,"|n"&R1C13)&IF(RC[-19]="",,"|n"&R1C14&RC[-19])&IF(RC[-18]="",,"|n"&R1C15&RC[-18])&IF(RC[-17]="",,"|n"&R1C16&RC[-17])&IF(RC[-16]="",,"|n"&R1C17&RC[-16])&IF(RC[-15]="",,"|n"&R1C18&RC[-15])&IF(RC[-14]="",,"|n"&R1C19&RC[-14])&IF(RC[-13]="",,"|n"&R1C20&RC[-13])&IF(RC[-12]="",,"|n"&R1C21&RC[-12])&IF(RC[-10]="",,"|n"&R1C23&RC[-10])&IF(RC[-9]="",,"|n"&R1C24&RC[-9])&IF(RC[-8]="",,"|n"&R1C25&RC[-8])&IF(RC[-7]="",,"|n"&R1C26&RC[-7])&IF(RC[-6]="",,"|n"&R1C27&RC[-6])&IF(RC[-5]="",,"|n"&R1C28&RC[-5])&IF(RC[-2]="",,"|n"&RC[-2]) -> 
AG905: =IF(RC[-26]&RC[-25]&RC[-24]&RC[-23]&RC[-22]&RC[-21]="",,R1C6)&IF(RC[-26]="",,"|n"&R1C7&RC[-26])&IF(RC[-25]="",,"|n"&R1C8&RC[-25])&IF(RC[-24]="",,"|n"&R1C9&RC[-24])&IF(RC[-23]="",,"|n"&R1C10&RC[-23])&IF(RC[-22]="",,"|n"&R1C11&RC[-22])&IF(RC[-21]="",,"|n"&R1C12&RC[-21])&IF(RC[-19]&RC[-18]&RC[-17]&RC[-16]="",,"|n"&R1C13)&IF(RC[-19]="",,"|n"&R1C14&RC[-19])&IF(RC[-18]="",,"|n"&R1C15&RC[-18])&IF(RC[-17]="",,"|n"&R1C16&RC[-17])&IF(RC[-16]="",,"|n"&R1C17&RC[-16])&IF(RC[-15]="",,"|n"&R1C18&RC[-15])&IF(RC[-14]="",,"|n"&R1C19&RC[-14])&IF(RC[-13]="",,"|n"&R1C20&RC[-13])&IF(RC[-12]="",,"|n"&R1C21&RC[-12])&IF(RC[-10]="",,"|n"&R1C23&RC[-10])&IF(RC[-9]="",,"|n"&R1C24&RC[-9])&IF(RC[-8]="",,"|n"&R1C25&RC[-8])&IF(RC[-7]="",,"|n"&R1C26&RC[-7])&IF(RC[-6]="",,"|n"&R1C27&RC[-6])&IF(RC[-5]="",,"|n"&R1C28&RC[-5])&IF(RC[-2]="",,"|n"&RC[-2]) -> 
AG906: =IF(RC[-26]&RC[-25]&RC[-24]&RC[-23]&RC[-22]&RC[-21]="",,R1C6)&IF(RC[-26]="",,"|n"&R1C7&RC[-26])&IF(RC[-25]="",,"|n"&R1C8&RC[-25])&IF(RC[-24]="",,"|n"&R1C9&RC[-24])&IF(RC[-23]="",,"|n"&R1C10&RC[-23])&IF(RC[-22]="",,"|n"&R1C11&RC[-22])&IF(RC[-21]="",,"|n"&R1C12&RC[-21])&IF(RC[-19]&RC[-18]&RC[-17]&RC[-16]="",,"|n"&R1C13)&IF(RC[-19]="",,"|n"&R1C14&RC[-19])&IF(RC[-18]="",,"|n"&R1C15&RC[-18])&IF(RC[-17]="",,"|n"&R1C16&RC[-17])&IF(RC[-16]="",,"|n"&R1C17&RC[-16])&IF(RC[-15]="",,"|n"&R1C18&RC[-15])&IF(RC[-14]="",,"|n"&R1C19&RC[-14])&IF(RC[-13]="",,"|n"&R1C20&RC[-13])&IF(RC[-12]="",,"|n"&R1C21&RC[-12])&IF(RC[-10]="",,"|n"&R1C23&RC[-10])&IF(RC[-9]="",,"|n"&R1C24&RC[-9])&IF(RC[-8]="",,"|n"&R1C25&RC[-8])&IF(RC[-7]="",,"|n"&R1C26&RC[-7])&IF(RC[-6]="",,"|n"&R1C27&RC[-6])&IF(RC[-5]="",,"|n"&R1C28&RC[-5])&IF(RC[-2]="",,"|n"&RC[-2]) -> 
AG907: =IF(RC[-26]&RC[-25]&RC[-24]&RC[-23]&RC[-22]&RC[-21]="",,R1C6)&IF(RC[-26]="",,"|n"&R1C7&RC[-26])&IF(RC[-25]="",,"|n"&R1C8&RC[-25])&IF(RC[-24]="",,"|n"&R1C9&RC[-24])&IF(RC[-23]="",,"|n"&R1C10&RC[-23])&IF(RC[-22]="",,"|n"&R1C11&RC[-22])&IF(RC[-21]="",,"|n"&R1C12&RC[-21])&IF(RC[-19]&RC[-18]&RC[-17]&RC[-16]="",,"|n"&R1C13)&IF(RC[-19]="",,"|n"&R1C14&RC[-19])&IF(RC[-18]="",,"|n"&R1C15&RC[-18])&IF(RC[-17]="",,"|n"&R1C16&RC[-17])&IF(RC[-16]="",,"|n"&R1C17&RC[-16])&IF(RC[-15]="",,"|n"&R1C18&RC[-15])&IF(RC[-14]="",,"|n"&R1C19&RC[-14])&IF(RC[-13]="",,"|n"&R1C20&RC[-13])&IF(RC[-12]="",,"|n"&R1C21&RC[-12])&IF(RC[-10]="",,"|n"&R1C23&RC[-10])&IF(RC[-9]="",,"|n"&R1C24&RC[-9])&IF(RC[-8]="",,"|n"&R1C25&RC[-8])&IF(RC[-7]="",,"|n"&R1C26&RC[-7])&IF(RC[-6]="",,"|n"&R1C27&RC[-6])&IF(RC[-5]="",,"|n"&R1C28&RC[-5])&IF(RC[-2]="",,"|n"&RC[-2]) -> 
AG908: =IF(RC[-26]&RC[-25]&RC[-24]&RC[-23]&RC[-22]&RC[-21]="",,R1C6)&IF(RC[-26]="",,"|n"&R1C7&RC[-26])&IF(RC[-25]="",,"|n"&R1C8&RC[-25])&IF(RC[-24]="",,"|n"&R1C9&RC[-24])&IF(RC[-23]="",,"|n"&R1C10&RC[-23])&IF(RC[-22]="",,"|n"&R1C11&RC[-22])&IF(RC[-21]="",,"|n"&R1C12&RC[-21])&IF(RC[-19]&RC[-18]&RC[-17]&RC[-16]="",,"|n"&R1C13)&IF(RC[-19]="",,"|n"&R1C14&RC[-19])&IF(RC[-18]="",,"|n"&R1C15&RC[-18])&IF(RC[-17]="",,"|n"&R1C16&RC[-17])&IF(RC[-16]="",,"|n"&R1C17&RC[-16])&IF(RC[-15]="",,"|n"&R1C18&RC[-15])&IF(RC[-14]="",,"|n"&R1C19&RC[-14])&IF(RC[-13]="",,"|n"&R1C20&RC[-13])&IF(RC[-12]="",,"|n"&R1C21&RC[-12])&IF(RC[-10]="",,"|n"&R1C23&RC[-10])&IF(RC[-9]="",,"|n"&R1C24&RC[-9])&IF(RC[-8]="",,"|n"&R1C25&RC[-8])&IF(RC[-7]="",,"|n"&R1C26&RC[-7])&IF(RC[-6]="",,"|n"&R1C27&RC[-6])&IF(RC[-5]="",,"|n"&R1C28&RC[-5])&IF(RC[-2]="",,"|n"&RC[-2]) -> 
AG909: =IF(RC[-26]&RC[-25]&RC[-24]&RC[-23]&RC[-22]&RC[-21]="",,R1C6)&IF(RC[-26]="",,"|n"&R1C7&RC[-26])&IF(RC[-25]="",,"|n"&R1C8&RC[-25])&IF(RC[-24]="",,"|n"&R1C9&RC[-24])&IF(RC[-23]="",,"|n"&R1C10&RC[-23])&IF(RC[-22]="",,"|n"&R1C11&RC[-22])&IF(RC[-21]="",,"|n"&R1C12&RC[-21])&IF(RC[-19]&RC[-18]&RC[-17]&RC[-16]="",,"|n"&R1C13)&IF(RC[-19]="",,"|n"&R1C14&RC[-19])&IF(RC[-18]="",,"|n"&R1C15&RC[-18])&IF(RC[-17]="",,"|n"&R1C16&RC[-17])&IF(RC[-16]="",,"|n"&R1C17&RC[-16])&IF(RC[-15]="",,"|n"&R1C18&RC[-15])&IF(RC[-14]="",,"|n"&R1C19&RC[-14])&IF(RC[-13]="",,"|n"&R1C20&RC[-13])&IF(RC[-12]="",,"|n"&R1C21&RC[-12])&IF(RC[-10]="",,"|n"&R1C23&RC[-10])&IF(RC[-9]="",,"|n"&R1C24&RC[-9])&IF(RC[-8]="",,"|n"&R1C25&RC[-8])&IF(RC[-7]="",,"|n"&R1C26&RC[-7])&IF(RC[-6]="",,"|n"&R1C27&RC[-6])&IF(RC[-5]="",,"|n"&R1C28&RC[-5])&IF(RC[-2]="",,"|n"&RC[-2]) -> 
AG910: =IF(RC[-26]&RC[-25]&RC[-24]&RC[-23]&RC[-22]&RC[-21]="",,R1C6)&IF(RC[-26]="",,"|n"&R1C7&RC[-26])&IF(RC[-25]="",,"|n"&R1C8&RC[-25])&IF(RC[-24]="",,"|n"&R1C9&RC[-24])&IF(RC[-23]="",,"|n"&R1C10&RC[-23])&IF(RC[-22]="",,"|n"&R1C11&RC[-22])&IF(RC[-21]="",,"|n"&R1C12&RC[-21])&IF(RC[-19]&RC[-18]&RC[-17]&RC[-16]="",,"|n"&R1C13)&IF(RC[-19]="",,"|n"&R1C14&RC[-19])&IF(RC[-18]="",,"|n"&R1C15&RC[-18])&IF(RC[-17]="",,"|n"&R1C16&RC[-17])&IF(RC[-16]="",,"|n"&R1C17&RC[-16])&IF(RC[-15]="",,"|n"&R1C18&RC[-15])&IF(RC[-14]="",,"|n"&R1C19&RC[-14])&IF(RC[-13]="",,"|n"&R1C20&RC[-13])&IF(RC[-12]="",,"|n"&R1C21&RC[-12])&IF(RC[-10]="",,"|n"&R1C23&RC[-10])&IF(RC[-9]="",,"|n"&R1C24&RC[-9])&IF(RC[-8]="",,"|n"&R1C25&RC[-8])&IF(RC[-7]="",,"|n"&R1C26&RC[-7])&IF(RC[-6]="",,"|n"&R1C27&RC[-6])&IF(RC[-5]="",,"|n"&R1C28&RC[-5])&IF(RC[-2]="",,"|n"&RC[-2]) -> 
AG911: =IF(RC[-26]&RC[-25]&RC[-24]&RC[-23]&RC[-22]&RC[-21]="",,R1C6)&IF(RC[-26]="",,"|n"&R1C7&RC[-26])&IF(RC[-25]="",,"|n"&R1C8&RC[-25])&IF(RC[-24]="",,"|n"&R1C9&RC[-24])&IF(RC[-23]="",,"|n"&R1C10&RC[-23])&IF(RC[-22]="",,"|n"&R1C11&RC[-22])&IF(RC[-21]="",,"|n"&R1C12&RC[-21])&IF(RC[-19]&RC[-18]&RC[-17]&RC[-16]="",,"|n"&R1C13)&IF(RC[-19]="",,"|n"&R1C14&RC[-19])&IF(RC[-18]="",,"|n"&R1C15&RC[-18])&IF(RC[-17]="",,"|n"&R1C16&RC[-17])&IF(RC[-16]="",,"|n"&R1C17&RC[-16])&IF(RC[-15]="",,"|n"&R1C18&RC[-15])&IF(RC[-14]="",,"|n"&R1C19&RC[-14])&IF(RC[-13]="",,"|n"&R1C20&RC[-13])&IF(RC[-12]="",,"|n"&R1C21&RC[-12])&IF(RC[-10]="",,"|n"&R1C23&RC[-10])&IF(RC[-9]="",,"|n"&R1C24&RC[-9])&IF(RC[-8]="",,"|n"&R1C25&RC[-8])&IF(RC[-7]="",,"|n"&R1C26&RC[-7])&IF(RC[-6]="",,"|n"&R1C27&RC[-6])&IF(RC[-5]="",,"|n"&R1C28&RC[-5])&IF(RC[-2]="",,"|n"&RC[-2]) -> 
AG912: =IF(RC[-26]&RC[-25]&RC[-24]&RC[-23]&RC[-22]&RC[-21]="",,R1C6)&IF(RC[-26]="",,"|n"&R1C7&RC[-26])&IF(RC[-25]="",,"|n"&R1C8&RC[-25])&IF(RC[-24]="",,"|n"&R1C9&RC[-24])&IF(RC[-23]="",,"|n"&R1C10&RC[-23])&IF(RC[-22]="",,"|n"&R1C11&RC[-22])&IF(RC[-21]="",,"|n"&R1C12&RC[-21])&IF(RC[-19]&RC[-18]&RC[-17]&RC[-16]="",,"|n"&R1C13)&IF(RC[-19]="",,"|n"&R1C14&RC[-19])&IF(RC[-18]="",,"|n"&R1C15&RC[-18])&IF(RC[-17]="",,"|n"&R1C16&RC[-17])&IF(RC[-16]="",,"|n"&R1C17&RC[-16])&IF(RC[-15]="",,"|n"&R1C18&RC[-15])&IF(RC[-14]="",,"|n"&R1C19&RC[-14])&IF(RC[-13]="",,"|n"&R1C20&RC[-13])&IF(RC[-12]="",,"|n"&R1C21&RC[-12])&IF(RC[-10]="",,"|n"&R1C23&RC[-10])&IF(RC[-9]="",,"|n"&R1C24&RC[-9])&IF(RC[-8]="",,"|n"&R1C25&RC[-8])&IF(RC[-7]="",,"|n"&R1C26&RC[-7])&IF(RC[-6]="",,"|n"&R1C27&RC[-6])&IF(RC[-5]="",,"|n"&R1C28&RC[-5])&IF(RC[-2]="",,"|n"&RC[-2]) -> 
AG913: =IF(RC[-26]&RC[-25]&RC[-24]&RC[-23]&RC[-22]&RC[-21]="",,R1C6)&IF(RC[-26]="",,"|n"&R1C7&RC[-26])&IF(RC[-25]="",,"|n"&R1C8&RC[-25])&IF(RC[-24]="",,"|n"&R1C9&RC[-24])&IF(RC[-23]="",,"|n"&R1C10&RC[-23])&IF(RC[-22]="",,"|n"&R1C11&RC[-22])&IF(RC[-21]="",,"|n"&R1C12&RC[-21])&IF(RC[-19]&RC[-18]&RC[-17]&RC[-16]="",,"|n"&R1C13)&IF(RC[-19]="",,"|n"&R1C14&RC[-19])&IF(RC[-18]="",,"|n"&R1C15&RC[-18])&IF(RC[-17]="",,"|n"&R1C16&RC[-17])&IF(RC[-16]="",,"|n"&R1C17&RC[-16])&IF(RC[-15]="",,"|n"&R1C18&RC[-15])&IF(RC[-14]="",,"|n"&R1C19&RC[-14])&IF(RC[-13]="",,"|n"&R1C20&RC[-13])&IF(RC[-12]="",,"|n"&R1C21&RC[-12])&IF(RC[-10]="",,"|n"&R1C23&RC[-10])&IF(RC[-9]="",,"|n"&R1C24&RC[-9])&IF(RC[-8]="",,"|n"&R1C25&RC[-8])&IF(RC[-7]="",,"|n"&R1C26&RC[-7])&IF(RC[-6]="",,"|n"&R1C27&RC[-6])&IF(RC[-5]="",,"|n"&R1C28&RC[-5])&IF(RC[-2]="",,"|n"&RC[-2]) -> 
AG914: =IF(RC[-26]&RC[-25]&RC[-24]&RC[-23]&RC[-22]&RC[-21]="",,R1C6)&IF(RC[-26]="",,"|n"&R1C7&RC[-26])&IF(RC[-25]="",,"|n"&R1C8&RC[-25])&IF(RC[-24]="",,"|n"&R1C9&RC[-24])&IF(RC[-23]="",,"|n"&R1C10&RC[-23])&IF(RC[-22]="",,"|n"&R1C11&RC[-22])&IF(RC[-21]="",,"|n"&R1C12&RC[-21])&IF(RC[-19]&RC[-18]&RC[-17]&RC[-16]="",,"|n"&R1C13)&IF(RC[-19]="",,"|n"&R1C14&RC[-19])&IF(RC[-18]="",,"|n"&R1C15&RC[-18])&IF(RC[-17]="",,"|n"&R1C16&RC[-17])&IF(RC[-16]="",,"|n"&R1C17&RC[-16])&IF(RC[-15]="",,"|n"&R1C18&RC[-15])&IF(RC[-14]="",,"|n"&R1C19&RC[-14])&IF(RC[-13]="",,"|n"&R1C20&RC[-13])&IF(RC[-12]="",,"|n"&R1C21&RC[-12])&IF(RC[-10]="",,"|n"&R1C23&RC[-10])&IF(RC[-9]="",,"|n"&R1C24&RC[-9])&IF(RC[-8]="",,"|n"&R1C25&RC[-8])&IF(RC[-7]="",,"|n"&R1C26&RC[-7])&IF(RC[-6]="",,"|n"&R1C27&RC[-6])&IF(RC[-5]="",,"|n"&R1C28&RC[-5])&IF(RC[-2]="",,"|n"&RC[-2]) -> 
AG915: =IF(RC[-26]&RC[-25]&RC[-24]&RC[-23]&RC[-22]&RC[-21]="",,R1C6)&IF(RC[-26]="",,"|n"&R1C7&RC[-26])&IF(RC[-25]="",,"|n"&R1C8&RC[-25])&IF(RC[-24]="",,"|n"&R1C9&RC[-24])&IF(RC[-23]="",,"|n"&R1C10&RC[-23])&IF(RC[-22]="",,"|n"&R1C11&RC[-22])&IF(RC[-21]="",,"|n"&R1C12&RC[-21])&IF(RC[-19]&RC[-18]&RC[-17]&RC[-16]="",,"|n"&R1C13)&IF(RC[-19]="",,"|n"&R1C14&RC[-19])&IF(RC[-18]="",,"|n"&R1C15&RC[-18])&IF(RC[-17]="",,"|n"&R1C16&RC[-17])&IF(RC[-16]="",,"|n"&R1C17&RC[-16])&IF(RC[-15]="",,"|n"&R1C18&RC[-15])&IF(RC[-14]="",,"|n"&R1C19&RC[-14])&IF(RC[-13]="",,"|n"&R1C20&RC[-13])&IF(RC[-12]="",,"|n"&R1C21&RC[-12])&IF(RC[-10]="",,"|n"&R1C23&RC[-10])&IF(RC[-9]="",,"|n"&R1C24&RC[-9])&IF(RC[-8]="",,"|n"&R1C25&RC[-8])&IF(RC[-7]="",,"|n"&R1C26&RC[-7])&IF(RC[-6]="",,"|n"&R1C27&RC[-6])&IF(RC[-5]="",,"|n"&R1C28&RC[-5])&IF(RC[-2]="",,"|n"&RC[-2]) -> 
AG916: =IF(RC[-26]&RC[-25]&RC[-24]&RC[-23]&RC[-22]&RC[-21]="",,R1C6)&IF(RC[-26]="",,"|n"&R1C7&RC[-26])&IF(RC[-25]="",,"|n"&R1C8&RC[-25])&IF(RC[-24]="",,"|n"&R1C9&RC[-24])&IF(RC[-23]="",,"|n"&R1C10&RC[-23])&IF(RC[-22]="",,"|n"&R1C11&RC[-22])&IF(RC[-21]="",,"|n"&R1C12&RC[-21])&IF(RC[-19]&RC[-18]&RC[-17]&RC[-16]="",,"|n"&R1C13)&IF(RC[-19]="",,"|n"&R1C14&RC[-19])&IF(RC[-18]="",,"|n"&R1C15&RC[-18])&IF(RC[-17]="",,"|n"&R1C16&RC[-17])&IF(RC[-16]="",,"|n"&R1C17&RC[-16])&IF(RC[-15]="",,"|n"&R1C18&RC[-15])&IF(RC[-14]="",,"|n"&R1C19&RC[-14])&IF(RC[-13]="",,"|n"&R1C20&RC[-13])&IF(RC[-12]="",,"|n"&R1C21&RC[-12])&IF(RC[-10]="",,"|n"&R1C23&RC[-10])&IF(RC[-9]="",,"|n"&R1C24&RC[-9])&IF(RC[-8]="",,"|n"&R1C25&RC[-8])&IF(RC[-7]="",,"|n"&R1C26&RC[-7])&IF(RC[-6]="",,"|n"&R1C27&RC[-6])&IF(RC[-5]="",,"|n"&R1C28&RC[-5])&IF(RC[-2]="",,"|n"&RC[-2]) -> 
AG917: =IF(RC[-26]&RC[-25]&RC[-24]&RC[-23]&RC[-22]&RC[-21]="",,R1C6)&IF(RC[-26]="",,"|n"&R1C7&RC[-26])&IF(RC[-25]="",,"|n"&R1C8&RC[-25])&IF(RC[-24]="",,"|n"&R1C9&RC[-24])&IF(RC[-23]="",,"|n"&R1C10&RC[-23])&IF(RC[-22]="",,"|n"&R1C11&RC[-22])&IF(RC[-21]="",,"|n"&R1C12&RC[-21])&IF(RC[-19]&RC[-18]&RC[-17]&RC[-16]="",,"|n"&R1C13)&IF(RC[-19]="",,"|n"&R1C14&RC[-19])&IF(RC[-18]="",,"|n"&R1C15&RC[-18])&IF(RC[-17]="",,"|n"&R1C16&RC[-17])&IF(RC[-16]="",,"|n"&R1C17&RC[-16])&IF(RC[-15]="",,"|n"&R1C18&RC[-15])&IF(RC[-14]="",,"|n"&R1C19&RC[-14])&IF(RC[-13]="",,"|n"&R1C20&RC[-13])&IF(RC[-12]="",,"|n"&R1C21&RC[-12])&IF(RC[-10]="",,"|n"&R1C23&RC[-10])&IF(RC[-9]="",,"|n"&R1C24&RC[-9])&IF(RC[-8]="",,"|n"&R1C25&RC[-8])&IF(RC[-7]="",,"|n"&R1C26&RC[-7])&IF(RC[-6]="",,"|n"&R1C27&RC[-6])&IF(RC[-5]="",,"|n"&R1C28&RC[-5])&IF(RC[-2]="",,"|n"&RC[-2]) -> 
AG918: =IF(RC[-26]&RC[-25]&RC[-24]&RC[-23]&RC[-22]&RC[-21]="",,R1C6)&IF(RC[-26]="",,"|n"&R1C7&RC[-26])&IF(RC[-25]="",,"|n"&R1C8&RC[-25])&IF(RC[-24]="",,"|n"&R1C9&RC[-24])&IF(RC[-23]="",,"|n"&R1C10&RC[-23])&IF(RC[-22]="",,"|n"&R1C11&RC[-22])&IF(RC[-21]="",,"|n"&R1C12&RC[-21])&IF(RC[-19]&RC[-18]&RC[-17]&RC[-16]="",,"|n"&R1C13)&IF(RC[-19]="",,"|n"&R1C14&RC[-19])&IF(RC[-18]="",,"|n"&R1C15&RC[-18])&IF(RC[-17]="",,"|n"&R1C16&RC[-17])&IF(RC[-16]="",,"|n"&R1C17&RC[-16])&IF(RC[-15]="",,"|n"&R1C18&RC[-15])&IF(RC[-14]="",,"|n"&R1C19&RC[-14])&IF(RC[-13]="",,"|n"&R1C20&RC[-13])&IF(RC[-12]="",,"|n"&R1C21&RC[-12])&IF(RC[-10]="",,"|n"&R1C23&RC[-10])&IF(RC[-9]="",,"|n"&R1C24&RC[-9])&IF(RC[-8]="",,"|n"&R1C25&RC[-8])&IF(RC[-7]="",,"|n"&R1C26&RC[-7])&IF(RC[-6]="",,"|n"&R1C27&RC[-6])&IF(RC[-5]="",,"|n"&R1C28&RC[-5])&IF(RC[-2]="",,"|n"&RC[-2]) -> 
AG919: =IF(RC[-26]&RC[-25]&RC[-24]&RC[-23]&RC[-22]&RC[-21]="",,R1C6)&IF(RC[-26]="",,"|n"&R1C7&RC[-26])&IF(RC[-25]="",,"|n"&R1C8&RC[-25])&IF(RC[-24]="",,"|n"&R1C9&RC[-24])&IF(RC[-23]="",,"|n"&R1C10&RC[-23])&IF(RC[-22]="",,"|n"&R1C11&RC[-22])&IF(RC[-21]="",,"|n"&R1C12&RC[-21])&IF(RC[-19]&RC[-18]&RC[-17]&RC[-16]="",,"|n"&R1C13)&IF(RC[-19]="",,"|n"&R1C14&RC[-19])&IF(RC[-18]="",,"|n"&R1C15&RC[-18])&IF(RC[-17]="",,"|n"&R1C16&RC[-17])&IF(RC[-16]="",,"|n"&R1C17&RC[-16])&IF(RC[-15]="",,"|n"&R1C18&RC[-15])&IF(RC[-14]="",,"|n"&R1C19&RC[-14])&IF(RC[-13]="",,"|n"&R1C20&RC[-13])&IF(RC[-12]="",,"|n"&R1C21&RC[-12])&IF(RC[-10]="",,"|n"&R1C23&RC[-10])&IF(RC[-9]="",,"|n"&R1C24&RC[-9])&IF(RC[-8]="",,"|n"&R1C25&RC[-8])&IF(RC[-7]="",,"|n"&R1C26&RC[-7])&IF(RC[-6]="",,"|n"&R1C27&RC[-6])&IF(RC[-5]="",,"|n"&R1C28&RC[-5])&IF(RC[-2]="",,"|n"&RC[-2]) -> 
AG920: =IF(RC[-26]&RC[-25]&RC[-24]&RC[-23]&RC[-22]&RC[-21]="",,R1C6)&IF(RC[-26]="",,"|n"&R1C7&RC[-26])&IF(RC[-25]="",,"|n"&R1C8&RC[-25])&IF(RC[-24]="",,"|n"&R1C9&RC[-24])&IF(RC[-23]="",,"|n"&R1C10&RC[-23])&IF(RC[-22]="",,"|n"&R1C11&RC[-22])&IF(RC[-21]="",,"|n"&R1C12&RC[-21])&IF(RC[-19]&RC[-18]&RC[-17]&RC[-16]="",,"|n"&R1C13)&IF(RC[-19]="",,"|n"&R1C14&RC[-19])&IF(RC[-18]="",,"|n"&R1C15&RC[-18])&IF(RC[-17]="",,"|n"&R1C16&RC[-17])&IF(RC[-16]="",,"|n"&R1C17&RC[-16])&IF(RC[-15]="",,"|n"&R1C18&RC[-15])&IF(RC[-14]="",,"|n"&R1C19&RC[-14])&IF(RC[-13]="",,"|n"&R1C20&RC[-13])&IF(RC[-12]="",,"|n"&R1C21&RC[-12])&IF(RC[-10]="",,"|n"&R1C23&RC[-10])&IF(RC[-9]="",,"|n"&R1C24&RC[-9])&IF(RC[-8]="",,"|n"&R1C25&RC[-8])&IF(RC[-7]="",,"|n"&R1C26&RC[-7])&IF(RC[-6]="",,"|n"&R1C27&RC[-6])&IF(RC[-5]="",,"|n"&R1C28&RC[-5])&IF(RC[-2]="",,"|n"&RC[-2]) -> 
AG921: =IF(RC[-26]&RC[-25]&RC[-24]&RC[-23]&RC[-22]&RC[-21]="",,R1C6)&IF(RC[-26]="",,"|n"&R1C7&RC[-26])&IF(RC[-25]="",,"|n"&R1C8&RC[-25])&IF(RC[-24]="",,"|n"&R1C9&RC[-24])&IF(RC[-23]="",,"|n"&R1C10&RC[-23])&IF(RC[-22]="",,"|n"&R1C11&RC[-22])&IF(RC[-21]="",,"|n"&R1C12&RC[-21])&IF(RC[-19]&RC[-18]&RC[-17]&RC[-16]="",,"|n"&R1C13)&IF(RC[-19]="",,"|n"&R1C14&RC[-19])&IF(RC[-18]="",,"|n"&R1C15&RC[-18])&IF(RC[-17]="",,"|n"&R1C16&RC[-17])&IF(RC[-16]="",,"|n"&R1C17&RC[-16])&IF(RC[-15]="",,"|n"&R1C18&RC[-15])&IF(RC[-14]="",,"|n"&R1C19&RC[-14])&IF(RC[-13]="",,"|n"&R1C20&RC[-13])&IF(RC[-12]="",,"|n"&R1C21&RC[-12])&IF(RC[-10]="",,"|n"&R1C23&RC[-10])&IF(RC[-9]="",,"|n"&R1C24&RC[-9])&IF(RC[-8]="",,"|n"&R1C25&RC[-8])&IF(RC[-7]="",,"|n"&R1C26&RC[-7])&IF(RC[-6]="",,"|n"&R1C27&RC[-6])&IF(RC[-5]="",,"|n"&R1C28&RC[-5])&IF(RC[-2]="",,"|n"&RC[-2]) -> 
AG922: =IF(RC[-26]&RC[-25]&RC[-24]&RC[-23]&RC[-22]&RC[-21]="",,R1C6)&IF(RC[-26]="",,"|n"&R1C7&RC[-26])&IF(RC[-25]="",,"|n"&R1C8&RC[-25])&IF(RC[-24]="",,"|n"&R1C9&RC[-24])&IF(RC[-23]="",,"|n"&R1C10&RC[-23])&IF(RC[-22]="",,"|n"&R1C11&RC[-22])&IF(RC[-21]="",,"|n"&R1C12&RC[-21])&IF(RC[-19]&RC[-18]&RC[-17]&RC[-16]="",,"|n"&R1C13)&IF(RC[-19]="",,"|n"&R1C14&RC[-19])&IF(RC[-18]="",,"|n"&R1C15&RC[-18])&IF(RC[-17]="",,"|n"&R1C16&RC[-17])&IF(RC[-16]="",,"|n"&R1C17&RC[-16])&IF(RC[-15]="",,"|n"&R1C18&RC[-15])&IF(RC[-14]="",,"|n"&R1C19&RC[-14])&IF(RC[-13]="",,"|n"&R1C20&RC[-13])&IF(RC[-12]="",,"|n"&R1C21&RC[-12])&IF(RC[-10]="",,"|n"&R1C23&RC[-10])&IF(RC[-9]="",,"|n"&R1C24&RC[-9])&IF(RC[-8]="",,"|n"&R1C25&RC[-8])&IF(RC[-7]="",,"|n"&R1C26&RC[-7])&IF(RC[-6]="",,"|n"&R1C27&RC[-6])&IF(RC[-5]="",,"|n"&R1C28&RC[-5])&IF(RC[-2]="",,"|n"&RC[-2]) -> 
AG923: =IF(RC[-26]&RC[-25]&RC[-24]&RC[-23]&RC[-22]&RC[-21]="",,R1C6)&IF(RC[-26]="",,"|n"&R1C7&RC[-26])&IF(RC[-25]="",,"|n"&R1C8&RC[-25])&IF(RC[-24]="",,"|n"&R1C9&RC[-24])&IF(RC[-23]="",,"|n"&R1C10&RC[-23])&IF(RC[-22]="",,"|n"&R1C11&RC[-22])&IF(RC[-21]="",,"|n"&R1C12&RC[-21])&IF(RC[-19]&RC[-18]&RC[-17]&RC[-16]="",,"|n"&R1C13)&IF(RC[-19]="",,"|n"&R1C14&RC[-19])&IF(RC[-18]="",,"|n"&R1C15&RC[-18])&IF(RC[-17]="",,"|n"&R1C16&RC[-17])&IF(RC[-16]="",,"|n"&R1C17&RC[-16])&IF(RC[-15]="",,"|n"&R1C18&RC[-15])&IF(RC[-14]="",,"|n"&R1C19&RC[-14])&IF(RC[-13]="",,"|n"&R1C20&RC[-13])&IF(RC[-12]="",,"|n"&R1C21&RC[-12])&IF(RC[-10]="",,"|n"&R1C23&RC[-10])&IF(RC[-9]="",,"|n"&R1C24&RC[-9])&IF(RC[-8]="",,"|n"&R1C25&RC[-8])&IF(RC[-7]="",,"|n"&R1C26&RC[-7])&IF(RC[-6]="",,"|n"&R1C27&RC[-6])&IF(RC[-5]="",,"|n"&R1C28&RC[-5])&IF(RC[-2]="",,"|n"&RC[-2]) -> 
AG924: =IF(RC[-26]&RC[-25]&RC[-24]&RC[-23]&RC[-22]&RC[-21]="",,R1C6)&IF(RC[-26]="",,"|n"&R1C7&RC[-26])&IF(RC[-25]="",,"|n"&R1C8&RC[-25])&IF(RC[-24]="",,"|n"&R1C9&RC[-24])&IF(RC[-23]="",,"|n"&R1C10&RC[-23])&IF(RC[-22]="",,"|n"&R1C11&RC[-22])&IF(RC[-21]="",,"|n"&R1C12&RC[-21])&IF(RC[-19]&RC[-18]&RC[-17]&RC[-16]="",,"|n"&R1C13)&IF(RC[-19]="",,"|n"&R1C14&RC[-19])&IF(RC[-18]="",,"|n"&R1C15&RC[-18])&IF(RC[-17]="",,"|n"&R1C16&RC[-17])&IF(RC[-16]="",,"|n"&R1C17&RC[-16])&IF(RC[-15]="",,"|n"&R1C18&RC[-15])&IF(RC[-14]="",,"|n"&R1C19&RC[-14])&IF(RC[-13]="",,"|n"&R1C20&RC[-13])&IF(RC[-12]="",,"|n"&R1C21&RC[-12])&IF(RC[-10]="",,"|n"&R1C23&RC[-10])&IF(RC[-9]="",,"|n"&R1C24&RC[-9])&IF(RC[-8]="",,"|n"&R1C25&RC[-8])&IF(RC[-7]="",,"|n"&R1C26&RC[-7])&IF(RC[-6]="",,"|n"&R1C27&RC[-6])&IF(RC[-5]="",,"|n"&R1C28&RC[-5])&IF(RC[-2]="",,"|n"&RC[-2]) -> 
AG925: =IF(RC[-26]&RC[-25]&RC[-24]&RC[-23]&RC[-22]&RC[-21]="",,R1C6)&IF(RC[-26]="",,"|n"&R1C7&RC[-26])&IF(RC[-25]="",,"|n"&R1C8&RC[-25])&IF(RC[-24]="",,"|n"&R1C9&RC[-24])&IF(RC[-23]="",,"|n"&R1C10&RC[-23])&IF(RC[-22]="",,"|n"&R1C11&RC[-22])&IF(RC[-21]="",,"|n"&R1C12&RC[-21])&IF(RC[-19]&RC[-18]&RC[-17]&RC[-16]="",,"|n"&R1C13)&IF(RC[-19]="",,"|n"&R1C14&RC[-19])&IF(RC[-18]="",,"|n"&R1C15&RC[-18])&IF(RC[-17]="",,"|n"&R1C16&RC[-17])&IF(RC[-16]="",,"|n"&R1C17&RC[-16])&IF(RC[-15]="",,"|n"&R1C18&RC[-15])&IF(RC[-14]="",,"|n"&R1C19&RC[-14])&IF(RC[-13]="",,"|n"&R1C20&RC[-13])&IF(RC[-12]="",,"|n"&R1C21&RC[-12])&IF(RC[-10]="",,"|n"&R1C23&RC[-10])&IF(RC[-9]="",,"|n"&R1C24&RC[-9])&IF(RC[-8]="",,"|n"&R1C25&RC[-8])&IF(RC[-7]="",,"|n"&R1C26&RC[-7])&IF(RC[-6]="",,"|n"&R1C27&RC[-6])&IF(RC[-5]="",,"|n"&R1C28&RC[-5])&IF(RC[-2]="",,"|n"&RC[-2]) -> 
AG926: =IF(RC[-26]&RC[-25]&RC[-24]&RC[-23]&RC[-22]&RC[-21]="",,R1C6)&IF(RC[-26]="",,"|n"&R1C7&RC[-26])&IF(RC[-25]="",,"|n"&R1C8&RC[-25])&IF(RC[-24]="",,"|n"&R1C9&RC[-24])&IF(RC[-23]="",,"|n"&R1C10&RC[-23])&IF(RC[-22]="",,"|n"&R1C11&RC[-22])&IF(RC[-21]="",,"|n"&R1C12&RC[-21])&IF(RC[-19]&RC[-18]&RC[-17]&RC[-16]="",,"|n"&R1C13)&IF(RC[-19]="",,"|n"&R1C14&RC[-19])&IF(RC[-18]="",,"|n"&R1C15&RC[-18])&IF(RC[-17]="",,"|n"&R1C16&RC[-17])&IF(RC[-16]="",,"|n"&R1C17&RC[-16])&IF(RC[-15]="",,"|n"&R1C18&RC[-15])&IF(RC[-14]="",,"|n"&R1C19&RC[-14])&IF(RC[-13]="",,"|n"&R1C20&RC[-13])&IF(RC[-12]="",,"|n"&R1C21&RC[-12])&IF(RC[-10]="",,"|n"&R1C23&RC[-10])&IF(RC[-9]="",,"|n"&R1C24&RC[-9])&IF(RC[-8]="",,"|n"&R1C25&RC[-8])&IF(RC[-7]="",,"|n"&R1C26&RC[-7])&IF(RC[-6]="",,"|n"&R1C27&RC[-6])&IF(RC[-5]="",,"|n"&R1C28&RC[-5])&IF(RC[-2]="",,"|n"&RC[-2]) -> 
AG927: =IF(RC[-26]&RC[-25]&RC[-24]&RC[-23]&RC[-22]&RC[-21]="",,R1C6)&IF(RC[-26]="",,"|n"&R1C7&RC[-26])&IF(RC[-25]="",,"|n"&R1C8&RC[-25])&IF(RC[-24]="",,"|n"&R1C9&RC[-24])&IF(RC[-23]="",,"|n"&R1C10&RC[-23])&IF(RC[-22]="",,"|n"&R1C11&RC[-22])&IF(RC[-21]="",,"|n"&R1C12&RC[-21])&IF(RC[-19]&RC[-18]&RC[-17]&RC[-16]="",,"|n"&R1C13)&IF(RC[-19]="",,"|n"&R1C14&RC[-19])&IF(RC[-18]="",,"|n"&R1C15&RC[-18])&IF(RC[-17]="",,"|n"&R1C16&RC[-17])&IF(RC[-16]="",,"|n"&R1C17&RC[-16])&IF(RC[-15]="",,"|n"&R1C18&RC[-15])&IF(RC[-14]="",,"|n"&R1C19&RC[-14])&IF(RC[-13]="",,"|n"&R1C20&RC[-13])&IF(RC[-12]="",,"|n"&R1C21&RC[-12])&IF(RC[-10]="",,"|n"&R1C23&RC[-10])&IF(RC[-9]="",,"|n"&R1C24&RC[-9])&IF(RC[-8]="",,"|n"&R1C25&RC[-8])&IF(RC[-7]="",,"|n"&R1C26&RC[-7])&IF(RC[-6]="",,"|n"&R1C27&RC[-6])&IF(RC[-5]="",,"|n"&R1C28&RC[-5])&IF(RC[-2]="",,"|n"&RC[-2]) -> 
AG928: =IF(RC[-26]&RC[-25]&RC[-24]&RC[-23]&RC[-22]&RC[-21]="",,R1C6)&IF(RC[-26]="",,"|n"&R1C7&RC[-26])&IF(RC[-25]="",,"|n"&R1C8&RC[-25])&IF(RC[-24]="",,"|n"&R1C9&RC[-24])&IF(RC[-23]="",,"|n"&R1C10&RC[-23])&IF(RC[-22]="",,"|n"&R1C11&RC[-22])&IF(RC[-21]="",,"|n"&R1C12&RC[-21])&IF(RC[-19]&RC[-18]&RC[-17]&RC[-16]="",,"|n"&R1C13)&IF(RC[-19]="",,"|n"&R1C14&RC[-19])&IF(RC[-18]="",,"|n"&R1C15&RC[-18])&IF(RC[-17]="",,"|n"&R1C16&RC[-17])&IF(RC[-16]="",,"|n"&R1C17&RC[-16])&IF(RC[-15]="",,"|n"&R1C18&RC[-15])&IF(RC[-14]="",,"|n"&R1C19&RC[-14])&IF(RC[-13]="",,"|n"&R1C20&RC[-13])&IF(RC[-12]="",,"|n"&R1C21&RC[-12])&IF(RC[-10]="",,"|n"&R1C23&RC[-10])&IF(RC[-9]="",,"|n"&R1C24&RC[-9])&IF(RC[-8]="",,"|n"&R1C25&RC[-8])&IF(RC[-7]="",,"|n"&R1C26&RC[-7])&IF(RC[-6]="",,"|n"&R1C27&RC[-6])&IF(RC[-5]="",,"|n"&R1C28&RC[-5])&IF(RC[-2]="",,"|n"&RC[-2]) -> 
AG929: =IF(RC[-26]&RC[-25]&RC[-24]&RC[-23]&RC[-22]&RC[-21]="",,R1C6)&IF(RC[-26]="",,"|n"&R1C7&RC[-26])&IF(RC[-25]="",,"|n"&R1C8&RC[-25])&IF(RC[-24]="",,"|n"&R1C9&RC[-24])&IF(RC[-23]="",,"|n"&R1C10&RC[-23])&IF(RC[-22]="",,"|n"&R1C11&RC[-22])&IF(RC[-21]="",,"|n"&R1C12&RC[-21])&IF(RC[-19]&RC[-18]&RC[-17]&RC[-16]="",,"|n"&R1C13)&IF(RC[-19]="",,"|n"&R1C14&RC[-19])&IF(RC[-18]="",,"|n"&R1C15&RC[-18])&IF(RC[-17]="",,"|n"&R1C16&RC[-17])&IF(RC[-16]="",,"|n"&R1C17&RC[-16])&IF(RC[-15]="",,"|n"&R1C18&RC[-15])&IF(RC[-14]="",,"|n"&R1C19&RC[-14])&IF(RC[-13]="",,"|n"&R1C20&RC[-13])&IF(RC[-12]="",,"|n"&R1C21&RC[-12])&IF(RC[-10]="",,"|n"&R1C23&RC[-10])&IF(RC[-9]="",,"|n"&R1C24&RC[-9])&IF(RC[-8]="",,"|n"&R1C25&RC[-8])&IF(RC[-7]="",,"|n"&R1C26&RC[-7])&IF(RC[-6]="",,"|n"&R1C27&RC[-6])&IF(RC[-5]="",,"|n"&R1C28&RC[-5])&IF(RC[-2]="",,"|n"&RC[-2]) -> 
AG930: =IF(RC[-26]&RC[-25]&RC[-24]&RC[-23]&RC[-22]&RC[-21]="",,R1C6)&IF(RC[-26]="",,"|n"&R1C7&RC[-26])&IF(RC[-25]="",,"|n"&R1C8&RC[-25])&IF(RC[-24]="",,"|n"&R1C9&RC[-24])&IF(RC[-23]="",,"|n"&R1C10&RC[-23])&IF(RC[-22]="",,"|n"&R1C11&RC[-22])&IF(RC[-21]="",,"|n"&R1C12&RC[-21])&IF(RC[-19]&RC[-18]&RC[-17]&RC[-16]="",,"|n"&R1C13)&IF(RC[-19]="",,"|n"&R1C14&RC[-19])&IF(RC[-18]="",,"|n"&R1C15&RC[-18])&IF(RC[-17]="",,"|n"&R1C16&RC[-17])&IF(RC[-16]="",,"|n"&R1C17&RC[-16])&IF(RC[-15]="",,"|n"&R1C18&RC[-15])&IF(RC[-14]="",,"|n"&R1C19&RC[-14])&IF(RC[-13]="",,"|n"&R1C20&RC[-13])&IF(RC[-12]="",,"|n"&R1C21&RC[-12])&IF(RC[-10]="",,"|n"&R1C23&RC[-10])&IF(RC[-9]="",,"|n"&R1C24&RC[-9])&IF(RC[-8]="",,"|n"&R1C25&RC[-8])&IF(RC[-7]="",,"|n"&R1C26&RC[-7])&IF(RC[-6]="",,"|n"&R1C27&RC[-6])&IF(RC[-5]="",,"|n"&R1C28&RC[-5])&IF(RC[-2]="",,"|n"&RC[-2]) -> 
AG931: =IF(RC[-26]&RC[-25]&RC[-24]&RC[-23]&RC[-22]&RC[-21]="",,R1C6)&IF(RC[-26]="",,"|n"&R1C7&RC[-26])&IF(RC[-25]="",,"|n"&R1C8&RC[-25])&IF(RC[-24]="",,"|n"&R1C9&RC[-24])&IF(RC[-23]="",,"|n"&R1C10&RC[-23])&IF(RC[-22]="",,"|n"&R1C11&RC[-22])&IF(RC[-21]="",,"|n"&R1C12&RC[-21])&IF(RC[-19]&RC[-18]&RC[-17]&RC[-16]="",,"|n"&R1C13)&IF(RC[-19]="",,"|n"&R1C14&RC[-19])&IF(RC[-18]="",,"|n"&R1C15&RC[-18])&IF(RC[-17]="",,"|n"&R1C16&RC[-17])&IF(RC[-16]="",,"|n"&R1C17&RC[-16])&IF(RC[-15]="",,"|n"&R1C18&RC[-15])&IF(RC[-14]="",,"|n"&R1C19&RC[-14])&IF(RC[-13]="",,"|n"&R1C20&RC[-13])&IF(RC[-12]="",,"|n"&R1C21&RC[-12])&IF(RC[-10]="",,"|n"&R1C23&RC[-10])&IF(RC[-9]="",,"|n"&R1C24&RC[-9])&IF(RC[-8]="",,"|n"&R1C25&RC[-8])&IF(RC[-7]="",,"|n"&R1C26&RC[-7])&IF(RC[-6]="",,"|n"&R1C27&RC[-6])&IF(RC[-5]="",,"|n"&R1C28&RC[-5])&IF(RC[-2]="",,"|n"&RC[-2]) -> 
AG932: =IF(RC[-26]&RC[-25]&RC[-24]&RC[-23]&RC[-22]&RC[-21]="",,R1C6)&IF(RC[-26]="",,"|n"&R1C7&RC[-26])&IF(RC[-25]="",,"|n"&R1C8&RC[-25])&IF(RC[-24]="",,"|n"&R1C9&RC[-24])&IF(RC[-23]="",,"|n"&R1C10&RC[-23])&IF(RC[-22]="",,"|n"&R1C11&RC[-22])&IF(RC[-21]="",,"|n"&R1C12&RC[-21])&IF(RC[-19]&RC[-18]&RC[-17]&RC[-16]="",,"|n"&R1C13)&IF(RC[-19]="",,"|n"&R1C14&RC[-19])&IF(RC[-18]="",,"|n"&R1C15&RC[-18])&IF(RC[-17]="",,"|n"&R1C16&RC[-17])&IF(RC[-16]="",,"|n"&R1C17&RC[-16])&IF(RC[-15]="",,"|n"&R1C18&RC[-15])&IF(RC[-14]="",,"|n"&R1C19&RC[-14])&IF(RC[-13]="",,"|n"&R1C20&RC[-13])&IF(RC[-12]="",,"|n"&R1C21&RC[-12])&IF(RC[-10]="",,"|n"&R1C23&RC[-10])&IF(RC[-9]="",,"|n"&R1C24&RC[-9])&IF(RC[-8]="",,"|n"&R1C25&RC[-8])&IF(RC[-7]="",,"|n"&R1C26&RC[-7])&IF(RC[-6]="",,"|n"&R1C27&RC[-6])&IF(RC[-5]="",,"|n"&R1C28&RC[-5])&IF(RC[-2]="",,"|n"&RC[-2]) -> 
AG933: =IF(RC[-26]&RC[-25]&RC[-24]&RC[-23]&RC[-22]&RC[-21]="",,R1C6)&IF(RC[-26]="",,"|n"&R1C7&RC[-26])&IF(RC[-25]="",,"|n"&R1C8&RC[-25])&IF(RC[-24]="",,"|n"&R1C9&RC[-24])&IF(RC[-23]="",,"|n"&R1C10&RC[-23])&IF(RC[-22]="",,"|n"&R1C11&RC[-22])&IF(RC[-21]="",,"|n"&R1C12&RC[-21])&IF(RC[-19]&RC[-18]&RC[-17]&RC[-16]="",,"|n"&R1C13)&IF(RC[-19]="",,"|n"&R1C14&RC[-19])&IF(RC[-18]="",,"|n"&R1C15&RC[-18])&IF(RC[-17]="",,"|n"&R1C16&RC[-17])&IF(RC[-16]="",,"|n"&R1C17&RC[-16])&IF(RC[-15]="",,"|n"&R1C18&RC[-15])&IF(RC[-14]="",,"|n"&R1C19&RC[-14])&IF(RC[-13]="",,"|n"&R1C20&RC[-13])&IF(RC[-12]="",,"|n"&R1C21&RC[-12])&IF(RC[-10]="",,"|n"&R1C23&RC[-10])&IF(RC[-9]="",,"|n"&R1C24&RC[-9])&IF(RC[-8]="",,"|n"&R1C25&RC[-8])&IF(RC[-7]="",,"|n"&R1C26&RC[-7])&IF(RC[-6]="",,"|n"&R1C27&RC[-6])&IF(RC[-5]="",,"|n"&R1C28&RC[-5])&IF(RC[-2]="",,"|n"&RC[-2]) -> 
AG934: =IF(RC[-26]&RC[-25]&RC[-24]&RC[-23]&RC[-22]&RC[-21]="",,R1C6)&IF(RC[-26]="",,"|n"&R1C7&RC[-26])&IF(RC[-25]="",,"|n"&R1C8&RC[-25])&IF(RC[-24]="",,"|n"&R1C9&RC[-24])&IF(RC[-23]="",,"|n"&R1C10&RC[-23])&IF(RC[-22]="",,"|n"&R1C11&RC[-22])&IF(RC[-21]="",,"|n"&R1C12&RC[-21])&IF(RC[-19]&RC[-18]&RC[-17]&RC[-16]="",,"|n"&R1C13)&IF(RC[-19]="",,"|n"&R1C14&RC[-19])&IF(RC[-18]="",,"|n"&R1C15&RC[-18])&IF(RC[-17]="",,"|n"&R1C16&RC[-17])&IF(RC[-16]="",,"|n"&R1C17&RC[-16])&IF(RC[-15]="",,"|n"&R1C18&RC[-15])&IF(RC[-14]="",,"|n"&R1C19&RC[-14])&IF(RC[-13]="",,"|n"&R1C20&RC[-13])&IF(RC[-12]="",,"|n"&R1C21&RC[-12])&IF(RC[-10]="",,"|n"&R1C23&RC[-10])&IF(RC[-9]="",,"|n"&R1C24&RC[-9])&IF(RC[-8]="",,"|n"&R1C25&RC[-8])&IF(RC[-7]="",,"|n"&R1C26&RC[-7])&IF(RC[-6]="",,"|n"&R1C27&RC[-6])&IF(RC[-5]="",,"|n"&R1C28&RC[-5])&IF(RC[-2]="",,"|n"&RC[-2]) -> 
AG935: =IF(RC[-26]&RC[-25]&RC[-24]&RC[-23]&RC[-22]&RC[-21]="",,R1C6)&IF(RC[-26]="",,"|n"&R1C7&RC[-26])&IF(RC[-25]="",,"|n"&R1C8&RC[-25])&IF(RC[-24]="",,"|n"&R1C9&RC[-24])&IF(RC[-23]="",,"|n"&R1C10&RC[-23])&IF(RC[-22]="",,"|n"&R1C11&RC[-22])&IF(RC[-21]="",,"|n"&R1C12&RC[-21])&IF(RC[-19]&RC[-18]&RC[-17]&RC[-16]="",,"|n"&R1C13)&IF(RC[-19]="",,"|n"&R1C14&RC[-19])&IF(RC[-18]="",,"|n"&R1C15&RC[-18])&IF(RC[-17]="",,"|n"&R1C16&RC[-17])&IF(RC[-16]="",,"|n"&R1C17&RC[-16])&IF(RC[-15]="",,"|n"&R1C18&RC[-15])&IF(RC[-14]="",,"|n"&R1C19&RC[-14])&IF(RC[-13]="",,"|n"&R1C20&RC[-13])&IF(RC[-12]="",,"|n"&R1C21&RC[-12])&IF(RC[-10]="",,"|n"&R1C23&RC[-10])&IF(RC[-9]="",,"|n"&R1C24&RC[-9])&IF(RC[-8]="",,"|n"&R1C25&RC[-8])&IF(RC[-7]="",,"|n"&R1C26&RC[-7])&IF(RC[-6]="",,"|n"&R1C27&RC[-6])&IF(RC[-5]="",,"|n"&R1C28&RC[-5])&IF(RC[-2]="",,"|n"&RC[-2]) -> 
AG936: =IF(RC[-26]&RC[-25]&RC[-24]&RC[-23]&RC[-22]&RC[-21]="",,R1C6)&IF(RC[-26]="",,"|n"&R1C7&RC[-26])&IF(RC[-25]="",,"|n"&R1C8&RC[-25])&IF(RC[-24]="",,"|n"&R1C9&RC[-24])&IF(RC[-23]="",,"|n"&R1C10&RC[-23])&IF(RC[-22]="",,"|n"&R1C11&RC[-22])&IF(RC[-21]="",,"|n"&R1C12&RC[-21])&IF(RC[-19]&RC[-18]&RC[-17]&RC[-16]="",,"|n"&R1C13)&IF(RC[-19]="",,"|n"&R1C14&RC[-19])&IF(RC[-18]="",,"|n"&R1C15&RC[-18])&IF(RC[-17]="",,"|n"&R1C16&RC[-17])&IF(RC[-16]="",,"|n"&R1C17&RC[-16])&IF(RC[-15]="",,"|n"&R1C18&RC[-15])&IF(RC[-14]="",,"|n"&R1C19&RC[-14])&IF(RC[-13]="",,"|n"&R1C20&RC[-13])&IF(RC[-12]="",,"|n"&R1C21&RC[-12])&IF(RC[-10]="",,"|n"&R1C23&RC[-10])&IF(RC[-9]="",,"|n"&R1C24&RC[-9])&IF(RC[-8]="",,"|n"&R1C25&RC[-8])&IF(RC[-7]="",,"|n"&R1C26&RC[-7])&IF(RC[-6]="",,"|n"&R1C27&RC[-6])&IF(RC[-5]="",,"|n"&R1C28&RC[-5])&IF(RC[-2]="",,"|n"&RC[-2]) -> 
AG937: =IF(RC[-26]&RC[-25]&RC[-24]&RC[-23]&RC[-22]&RC[-21]="",,R1C6)&IF(RC[-26]="",,"|n"&R1C7&RC[-26])&IF(RC[-25]="",,"|n"&R1C8&RC[-25])&IF(RC[-24]="",,"|n"&R1C9&RC[-24])&IF(RC[-23]="",,"|n"&R1C10&RC[-23])&IF(RC[-22]="",,"|n"&R1C11&RC[-22])&IF(RC[-21]="",,"|n"&R1C12&RC[-21])&IF(RC[-19]&RC[-18]&RC[-17]&RC[-16]="",,"|n"&R1C13)&IF(RC[-19]="",,"|n"&R1C14&RC[-19])&IF(RC[-18]="",,"|n"&R1C15&RC[-18])&IF(RC[-17]="",,"|n"&R1C16&RC[-17])&IF(RC[-16]="",,"|n"&R1C17&RC[-16])&IF(RC[-15]="",,"|n"&R1C18&RC[-15])&IF(RC[-14]="",,"|n"&R1C19&RC[-14])&IF(RC[-13]="",,"|n"&R1C20&RC[-13])&IF(RC[-12]="",,"|n"&R1C21&RC[-12])&IF(RC[-10]="",,"|n"&R1C23&RC[-10])&IF(RC[-9]="",,"|n"&R1C24&RC[-9])&IF(RC[-8]="",,"|n"&R1C25&RC[-8])&IF(RC[-7]="",,"|n"&R1C26&RC[-7])&IF(RC[-6]="",,"|n"&R1C27&RC[-6])&IF(RC[-5]="",,"|n"&R1C28&RC[-5])&IF(RC[-2]="",,"|n"&RC[-2]) -> 
AG938: =IF(RC[-26]&RC[-25]&RC[-24]&RC[-23]&RC[-22]&RC[-21]="",,R1C6)&IF(RC[-26]="",,"|n"&R1C7&RC[-26])&IF(RC[-25]="",,"|n"&R1C8&RC[-25])&IF(RC[-24]="",,"|n"&R1C9&RC[-24])&IF(RC[-23]="",,"|n"&R1C10&RC[-23])&IF(RC[-22]="",,"|n"&R1C11&RC[-22])&IF(RC[-21]="",,"|n"&R1C12&RC[-21])&IF(RC[-19]&RC[-18]&RC[-17]&RC[-16]="",,"|n"&R1C13)&IF(RC[-19]="",,"|n"&R1C14&RC[-19])&IF(RC[-18]="",,"|n"&R1C15&RC[-18])&IF(RC[-17]="",,"|n"&R1C16&RC[-17])&IF(RC[-16]="",,"|n"&R1C17&RC[-16])&IF(RC[-15]="",,"|n"&R1C18&RC[-15])&IF(RC[-14]="",,"|n"&R1C19&RC[-14])&IF(RC[-13]="",,"|n"&R1C20&RC[-13])&IF(RC[-12]="",,"|n"&R1C21&RC[-12])&IF(RC[-10]="",,"|n"&R1C23&RC[-10])&IF(RC[-9]="",,"|n"&R1C24&RC[-9])&IF(RC[-8]="",,"|n"&R1C25&RC[-8])&IF(RC[-7]="",,"|n"&R1C26&RC[-7])&IF(RC[-6]="",,"|n"&R1C27&RC[-6])&IF(RC[-5]="",,"|n"&R1C28&RC[-5])&IF(RC[-2]="",,"|n"&RC[-2]) -> 
AG939: =IF(RC[-26]&RC[-25]&RC[-24]&RC[-23]&RC[-22]&RC[-21]="",,R1C6)&IF(RC[-26]="",,"|n"&R1C7&RC[-26])&IF(RC[-25]="",,"|n"&R1C8&RC[-25])&IF(RC[-24]="",,"|n"&R1C9&RC[-24])&IF(RC[-23]="",,"|n"&R1C10&RC[-23])&IF(RC[-22]="",,"|n"&R1C11&RC[-22])&IF(RC[-21]="",,"|n"&R1C12&RC[-21])&IF(RC[-19]&RC[-18]&RC[-17]&RC[-16]="",,"|n"&R1C13)&IF(RC[-19]="",,"|n"&R1C14&RC[-19])&IF(RC[-18]="",,"|n"&R1C15&RC[-18])&IF(RC[-17]="",,"|n"&R1C16&RC[-17])&IF(RC[-16]="",,"|n"&R1C17&RC[-16])&IF(RC[-15]="",,"|n"&R1C18&RC[-15])&IF(RC[-14]="",,"|n"&R1C19&RC[-14])&IF(RC[-13]="",,"|n"&R1C20&RC[-13])&IF(RC[-12]="",,"|n"&R1C21&RC[-12])&IF(RC[-10]="",,"|n"&R1C23&RC[-10])&IF(RC[-9]="",,"|n"&R1C24&RC[-9])&IF(RC[-8]="",,"|n"&R1C25&RC[-8])&IF(RC[-7]="",,"|n"&R1C26&RC[-7])&IF(RC[-6]="",,"|n"&R1C27&RC[-6])&IF(RC[-5]="",,"|n"&R1C28&RC[-5])&IF(RC[-2]="",,"|n"&RC[-2]) -> 
AG940: =IF(RC[-26]&RC[-25]&RC[-24]&RC[-23]&RC[-22]&RC[-21]="",,R1C6)&IF(RC[-26]="",,"|n"&R1C7&RC[-26])&IF(RC[-25]="",,"|n"&R1C8&RC[-25])&IF(RC[-24]="",,"|n"&R1C9&RC[-24])&IF(RC[-23]="",,"|n"&R1C10&RC[-23])&IF(RC[-22]="",,"|n"&R1C11&RC[-22])&IF(RC[-21]="",,"|n"&R1C12&RC[-21])&IF(RC[-19]&RC[-18]&RC[-17]&RC[-16]="",,"|n"&R1C13)&IF(RC[-19]="",,"|n"&R1C14&RC[-19])&IF(RC[-18]="",,"|n"&R1C15&RC[-18])&IF(RC[-17]="",,"|n"&R1C16&RC[-17])&IF(RC[-16]="",,"|n"&R1C17&RC[-16])&IF(RC[-15]="",,"|n"&R1C18&RC[-15])&IF(RC[-14]="",,"|n"&R1C19&RC[-14])&IF(RC[-13]="",,"|n"&R1C20&RC[-13])&IF(RC[-12]="",,"|n"&R1C21&RC[-12])&IF(RC[-10]="",,"|n"&R1C23&RC[-10])&IF(RC[-9]="",,"|n"&R1C24&RC[-9])&IF(RC[-8]="",,"|n"&R1C25&RC[-8])&IF(RC[-7]="",,"|n"&R1C26&RC[-7])&IF(RC[-6]="",,"|n"&R1C27&RC[-6])&IF(RC[-5]="",,"|n"&R1C28&RC[-5])&IF(RC[-2]="",,"|n"&RC[-2]) -> 
AG941: =IF(RC[-26]&RC[-25]&RC[-24]&RC[-23]&RC[-22]&RC[-21]="",,R1C6)&IF(RC[-26]="",,"|n"&R1C7&RC[-26])&IF(RC[-25]="",,"|n"&R1C8&RC[-25])&IF(RC[-24]="",,"|n"&R1C9&RC[-24])&IF(RC[-23]="",,"|n"&R1C10&RC[-23])&IF(RC[-22]="",,"|n"&R1C11&RC[-22])&IF(RC[-21]="",,"|n"&R1C12&RC[-21])&IF(RC[-19]&RC[-18]&RC[-17]&RC[-16]="",,"|n"&R1C13)&IF(RC[-19]="",,"|n"&R1C14&RC[-19])&IF(RC[-18]="",,"|n"&R1C15&RC[-18])&IF(RC[-17]="",,"|n"&R1C16&RC[-17])&IF(RC[-16]="",,"|n"&R1C17&RC[-16])&IF(RC[-15]="",,"|n"&R1C18&RC[-15])&IF(RC[-14]="",,"|n"&R1C19&RC[-14])&IF(RC[-13]="",,"|n"&R1C20&RC[-13])&IF(RC[-12]="",,"|n"&R1C21&RC[-12])&IF(RC[-10]="",,"|n"&R1C23&RC[-10])&IF(RC[-9]="",,"|n"&R1C24&RC[-9])&IF(RC[-8]="",,"|n"&R1C25&RC[-8])&IF(RC[-7]="",,"|n"&R1C26&RC[-7])&IF(RC[-6]="",,"|n"&R1C27&RC[-6])&IF(RC[-5]="",,"|n"&R1C28&RC[-5])&IF(RC[-2]="",,"|n"&RC[-2]) -> 
AG942: =IF(RC[-26]&RC[-25]&RC[-24]&RC[-23]&RC[-22]&RC[-21]="",,R1C6)&IF(RC[-26]="",,"|n"&R1C7&RC[-26])&IF(RC[-25]="",,"|n"&R1C8&RC[-25])&IF(RC[-24]="",,"|n"&R1C9&RC[-24])&IF(RC[-23]="",,"|n"&R1C10&RC[-23])&IF(RC[-22]="",,"|n"&R1C11&RC[-22])&IF(RC[-21]="",,"|n"&R1C12&RC[-21])&IF(RC[-19]&RC[-18]&RC[-17]&RC[-16]="",,"|n"&R1C13)&IF(RC[-19]="",,"|n"&R1C14&RC[-19])&IF(RC[-18]="",,"|n"&R1C15&RC[-18])&IF(RC[-17]="",,"|n"&R1C16&RC[-17])&IF(RC[-16]="",,"|n"&R1C17&RC[-16])&IF(RC[-15]="",,"|n"&R1C18&RC[-15])&IF(RC[-14]="",,"|n"&R1C19&RC[-14])&IF(RC[-13]="",,"|n"&R1C20&RC[-13])&IF(RC[-12]="",,"|n"&R1C21&RC[-12])&IF(RC[-10]="",,"|n"&R1C23&RC[-10])&IF(RC[-9]="",,"|n"&R1C24&RC[-9])&IF(RC[-8]="",,"|n"&R1C25&RC[-8])&IF(RC[-7]="",,"|n"&R1C26&RC[-7])&IF(RC[-6]="",,"|n"&R1C27&RC[-6])&IF(RC[-5]="",,"|n"&R1C28&RC[-5])&IF(RC[-2]="",,"|n"&RC[-2]) -> 
AG943: =IF(RC[-26]&RC[-25]&RC[-24]&RC[-23]&RC[-22]&RC[-21]="",,R1C6)&IF(RC[-26]="",,"|n"&R1C7&RC[-26])&IF(RC[-25]="",,"|n"&R1C8&RC[-25])&IF(RC[-24]="",,"|n"&R1C9&RC[-24])&IF(RC[-23]="",,"|n"&R1C10&RC[-23])&IF(RC[-22]="",,"|n"&R1C11&RC[-22])&IF(RC[-21]="",,"|n"&R1C12&RC[-21])&IF(RC[-19]&RC[-18]&RC[-17]&RC[-16]="",,"|n"&R1C13)&IF(RC[-19]="",,"|n"&R1C14&RC[-19])&IF(RC[-18]="",,"|n"&R1C15&RC[-18])&IF(RC[-17]="",,"|n"&R1C16&RC[-17])&IF(RC[-16]="",,"|n"&R1C17&RC[-16])&IF(RC[-15]="",,"|n"&R1C18&RC[-15])&IF(RC[-14]="",,"|n"&R1C19&RC[-14])&IF(RC[-13]="",,"|n"&R1C20&RC[-13])&IF(RC[-12]="",,"|n"&R1C21&RC[-12])&IF(RC[-10]="",,"|n"&R1C23&RC[-10])&IF(RC[-9]="",,"|n"&R1C24&RC[-9])&IF(RC[-8]="",,"|n"&R1C25&RC[-8])&IF(RC[-7]="",,"|n"&R1C26&RC[-7])&IF(RC[-6]="",,"|n"&R1C27&RC[-6])&IF(RC[-5]="",,"|n"&R1C28&RC[-5])&IF(RC[-2]="",,"|n"&RC[-2]) -> 
AG944: =IF(RC[-26]&RC[-25]&RC[-24]&RC[-23]&RC[-22]&RC[-21]="",,R1C6)&IF(RC[-26]="",,"|n"&R1C7&RC[-26])&IF(RC[-25]="",,"|n"&R1C8&RC[-25])&IF(RC[-24]="",,"|n"&R1C9&RC[-24])&IF(RC[-23]="",,"|n"&R1C10&RC[-23])&IF(RC[-22]="",,"|n"&R1C11&RC[-22])&IF(RC[-21]="",,"|n"&R1C12&RC[-21])&IF(RC[-19]&RC[-18]&RC[-17]&RC[-16]="",,"|n"&R1C13)&IF(RC[-19]="",,"|n"&R1C14&RC[-19])&IF(RC[-18]="",,"|n"&R1C15&RC[-18])&IF(RC[-17]="",,"|n"&R1C16&RC[-17])&IF(RC[-16]="",,"|n"&R1C17&RC[-16])&IF(RC[-15]="",,"|n"&R1C18&RC[-15])&IF(RC[-14]="",,"|n"&R1C19&RC[-14])&IF(RC[-13]="",,"|n"&R1C20&RC[-13])&IF(RC[-12]="",,"|n"&R1C21&RC[-12])&IF(RC[-10]="",,"|n"&R1C23&RC[-10])&IF(RC[-9]="",,"|n"&R1C24&RC[-9])&IF(RC[-8]="",,"|n"&R1C25&RC[-8])&IF(RC[-7]="",,"|n"&R1C26&RC[-7])&IF(RC[-6]="",,"|n"&R1C27&RC[-6])&IF(RC[-5]="",,"|n"&R1C28&RC[-5])&IF(RC[-2]="",,"|n"&RC[-2]) -> 
AG945: =IF(RC[-26]&RC[-25]&RC[-24]&RC[-23]&RC[-22]&RC[-21]="",,R1C6)&IF(RC[-26]="",,"|n"&R1C7&RC[-26])&IF(RC[-25]="",,"|n"&R1C8&RC[-25])&IF(RC[-24]="",,"|n"&R1C9&RC[-24])&IF(RC[-23]="",,"|n"&R1C10&RC[-23])&IF(RC[-22]="",,"|n"&R1C11&RC[-22])&IF(RC[-21]="",,"|n"&R1C12&RC[-21])&IF(RC[-19]&RC[-18]&RC[-17]&RC[-16]="",,"|n"&R1C13)&IF(RC[-19]="",,"|n"&R1C14&RC[-19])&IF(RC[-18]="",,"|n"&R1C15&RC[-18])&IF(RC[-17]="",,"|n"&R1C16&RC[-17])&IF(RC[-16]="",,"|n"&R1C17&RC[-16])&IF(RC[-15]="",,"|n"&R1C18&RC[-15])&IF(RC[-14]="",,"|n"&R1C19&RC[-14])&IF(RC[-13]="",,"|n"&R1C20&RC[-13])&IF(RC[-12]="",,"|n"&R1C21&RC[-12])&IF(RC[-10]="",,"|n"&R1C23&RC[-10])&IF(RC[-9]="",,"|n"&R1C24&RC[-9])&IF(RC[-8]="",,"|n"&R1C25&RC[-8])&IF(RC[-7]="",,"|n"&R1C26&RC[-7])&IF(RC[-6]="",,"|n"&R1C27&RC[-6])&IF(RC[-5]="",,"|n"&R1C28&RC[-5])&IF(RC[-2]="",,"|n"&RC[-2]) -> 
AG946: =IF(RC[-26]&RC[-25]&RC[-24]&RC[-23]&RC[-22]&RC[-21]="",,R1C6)&IF(RC[-26]="",,"|n"&R1C7&RC[-26])&IF(RC[-25]="",,"|n"&R1C8&RC[-25])&IF(RC[-24]="",,"|n"&R1C9&RC[-24])&IF(RC[-23]="",,"|n"&R1C10&RC[-23])&IF(RC[-22]="",,"|n"&R1C11&RC[-22])&IF(RC[-21]="",,"|n"&R1C12&RC[-21])&IF(RC[-19]&RC[-18]&RC[-17]&RC[-16]="",,"|n"&R1C13)&IF(RC[-19]="",,"|n"&R1C14&RC[-19])&IF(RC[-18]="",,"|n"&R1C15&RC[-18])&IF(RC[-17]="",,"|n"&R1C16&RC[-17])&IF(RC[-16]="",,"|n"&R1C17&RC[-16])&IF(RC[-15]="",,"|n"&R1C18&RC[-15])&IF(RC[-14]="",,"|n"&R1C19&RC[-14])&IF(RC[-13]="",,"|n"&R1C20&RC[-13])&IF(RC[-12]="",,"|n"&R1C21&RC[-12])&IF(RC[-10]="",,"|n"&R1C23&RC[-10])&IF(RC[-9]="",,"|n"&R1C24&RC[-9])&IF(RC[-8]="",,"|n"&R1C25&RC[-8])&IF(RC[-7]="",,"|n"&R1C26&RC[-7])&IF(RC[-6]="",,"|n"&R1C27&RC[-6])&IF(RC[-5]="",,"|n"&R1C28&RC[-5])&IF(RC[-2]="",,"|n"&RC[-2]) -> 
AG947: =IF(RC[-26]&RC[-25]&RC[-24]&RC[-23]&RC[-22]&RC[-21]="",,R1C6)&IF(RC[-26]="",,"|n"&R1C7&RC[-26])&IF(RC[-25]="",,"|n"&R1C8&RC[-25])&IF(RC[-24]="",,"|n"&R1C9&RC[-24])&IF(RC[-23]="",,"|n"&R1C10&RC[-23])&IF(RC[-22]="",,"|n"&R1C11&RC[-22])&IF(RC[-21]="",,"|n"&R1C12&RC[-21])&IF(RC[-19]&RC[-18]&RC[-17]&RC[-16]="",,"|n"&R1C13)&IF(RC[-19]="",,"|n"&R1C14&RC[-19])&IF(RC[-18]="",,"|n"&R1C15&RC[-18])&IF(RC[-17]="",,"|n"&R1C16&RC[-17])&IF(RC[-16]="",,"|n"&R1C17&RC[-16])&IF(RC[-15]="",,"|n"&R1C18&RC[-15])&IF(RC[-14]="",,"|n"&R1C19&RC[-14])&IF(RC[-13]="",,"|n"&R1C20&RC[-13])&IF(RC[-12]="",,"|n"&R1C21&RC[-12])&IF(RC[-10]="",,"|n"&R1C23&RC[-10])&IF(RC[-9]="",,"|n"&R1C24&RC[-9])&IF(RC[-8]="",,"|n"&R1C25&RC[-8])&IF(RC[-7]="",,"|n"&R1C26&RC[-7])&IF(RC[-6]="",,"|n"&R1C27&RC[-6])&IF(RC[-5]="",,"|n"&R1C28&RC[-5])&IF(RC[-2]="",,"|n"&RC[-2]) -> 
AG948: =IF(RC[-26]&RC[-25]&RC[-24]&RC[-23]&RC[-22]&RC[-21]="",,R1C6)&IF(RC[-26]="",,"|n"&R1C7&RC[-26])&IF(RC[-25]="",,"|n"&R1C8&RC[-25])&IF(RC[-24]="",,"|n"&R1C9&RC[-24])&IF(RC[-23]="",,"|n"&R1C10&RC[-23])&IF(RC[-22]="",,"|n"&R1C11&RC[-22])&IF(RC[-21]="",,"|n"&R1C12&RC[-21])&IF(RC[-19]&RC[-18]&RC[-17]&RC[-16]="",,"|n"&R1C13)&IF(RC[-19]="",,"|n"&R1C14&RC[-19])&IF(RC[-18]="",,"|n"&R1C15&RC[-18])&IF(RC[-17]="",,"|n"&R1C16&RC[-17])&IF(RC[-16]="",,"|n"&R1C17&RC[-16])&IF(RC[-15]="",,"|n"&R1C18&RC[-15])&IF(RC[-14]="",,"|n"&R1C19&RC[-14])&IF(RC[-13]="",,"|n"&R1C20&RC[-13])&IF(RC[-12]="",,"|n"&R1C21&RC[-12])&IF(RC[-10]="",,"|n"&R1C23&RC[-10])&IF(RC[-9]="",,"|n"&R1C24&RC[-9])&IF(RC[-8]="",,"|n"&R1C25&RC[-8])&IF(RC[-7]="",,"|n"&R1C26&RC[-7])&IF(RC[-6]="",,"|n"&R1C27&RC[-6])&IF(RC[-5]="",,"|n"&R1C28&RC[-5])&IF(RC[-2]="",,"|n"&RC[-2]) -> 
AG949: =IF(RC[-26]&RC[-25]&RC[-24]&RC[-23]&RC[-22]&RC[-21]="",,R1C6)&IF(RC[-26]="",,"|n"&R1C7&RC[-26])&IF(RC[-25]="",,"|n"&R1C8&RC[-25])&IF(RC[-24]="",,"|n"&R1C9&RC[-24])&IF(RC[-23]="",,"|n"&R1C10&RC[-23])&IF(RC[-22]="",,"|n"&R1C11&RC[-22])&IF(RC[-21]="",,"|n"&R1C12&RC[-21])&IF(RC[-19]&RC[-18]&RC[-17]&RC[-16]="",,"|n"&R1C13)&IF(RC[-19]="",,"|n"&R1C14&RC[-19])&IF(RC[-18]="",,"|n"&R1C15&RC[-18])&IF(RC[-17]="",,"|n"&R1C16&RC[-17])&IF(RC[-16]="",,"|n"&R1C17&RC[-16])&IF(RC[-15]="",,"|n"&R1C18&RC[-15])&IF(RC[-14]="",,"|n"&R1C19&RC[-14])&IF(RC[-13]="",,"|n"&R1C20&RC[-13])&IF(RC[-12]="",,"|n"&R1C21&RC[-12])&IF(RC[-10]="",,"|n"&R1C23&RC[-10])&IF(RC[-9]="",,"|n"&R1C24&RC[-9])&IF(RC[-8]="",,"|n"&R1C25&RC[-8])&IF(RC[-7]="",,"|n"&R1C26&RC[-7])&IF(RC[-6]="",,"|n"&R1C27&RC[-6])&IF(RC[-5]="",,"|n"&R1C28&RC[-5])&IF(RC[-2]="",,"|n"&RC[-2]) -> 
AG950: =IF(RC[-26]&RC[-25]&RC[-24]&RC[-23]&RC[-22]&RC[-21]="",,R1C6)&IF(RC[-26]="",,"|n"&R1C7&RC[-26])&IF(RC[-25]="",,"|n"&R1C8&RC[-25])&IF(RC[-24]="",,"|n"&R1C9&RC[-24])&IF(RC[-23]="",,"|n"&R1C10&RC[-23])&IF(RC[-22]="",,"|n"&R1C11&RC[-22])&IF(RC[-21]="",,"|n"&R1C12&RC[-21])&IF(RC[-19]&RC[-18]&RC[-17]&RC[-16]="",,"|n"&R1C13)&IF(RC[-19]="",,"|n"&R1C14&RC[-19])&IF(RC[-18]="",,"|n"&R1C15&RC[-18])&IF(RC[-17]="",,"|n"&R1C16&RC[-17])&IF(RC[-16]="",,"|n"&R1C17&RC[-16])&IF(RC[-15]="",,"|n"&R1C18&RC[-15])&IF(RC[-14]="",,"|n"&R1C19&RC[-14])&IF(RC[-13]="",,"|n"&R1C20&RC[-13])&IF(RC[-12]="",,"|n"&R1C21&RC[-12])&IF(RC[-10]="",,"|n"&R1C23&RC[-10])&IF(RC[-9]="",,"|n"&R1C24&RC[-9])&IF(RC[-8]="",,"|n"&R1C25&RC[-8])&IF(RC[-7]="",,"|n"&R1C26&RC[-7])&IF(RC[-6]="",,"|n"&R1C27&RC[-6])&IF(RC[-5]="",,"|n"&R1C28&RC[-5])&IF(RC[-2]="",,"|n"&RC[-2]) -> 
AG951: =IF(RC[-26]&RC[-25]&RC[-24]&RC[-23]&RC[-22]&RC[-21]="",,R1C6)&IF(RC[-26]="",,"|n"&R1C7&RC[-26])&IF(RC[-25]="",,"|n"&R1C8&RC[-25])&IF(RC[-24]="",,"|n"&R1C9&RC[-24])&IF(RC[-23]="",,"|n"&R1C10&RC[-23])&IF(RC[-22]="",,"|n"&R1C11&RC[-22])&IF(RC[-21]="",,"|n"&R1C12&RC[-21])&IF(RC[-19]&RC[-18]&RC[-17]&RC[-16]="",,"|n"&R1C13)&IF(RC[-19]="",,"|n"&R1C14&RC[-19])&IF(RC[-18]="",,"|n"&R1C15&RC[-18])&IF(RC[-17]="",,"|n"&R1C16&RC[-17])&IF(RC[-16]="",,"|n"&R1C17&RC[-16])&IF(RC[-15]="",,"|n"&R1C18&RC[-15])&IF(RC[-14]="",,"|n"&R1C19&RC[-14])&IF(RC[-13]="",,"|n"&R1C20&RC[-13])&IF(RC[-12]="",,"|n"&R1C21&RC[-12])&IF(RC[-10]="",,"|n"&R1C23&RC[-10])&IF(RC[-9]="",,"|n"&R1C24&RC[-9])&IF(RC[-8]="",,"|n"&R1C25&RC[-8])&IF(RC[-7]="",,"|n"&R1C26&RC[-7])&IF(RC[-6]="",,"|n"&R1C27&RC[-6])&IF(RC[-5]="",,"|n"&R1C28&RC[-5])&IF(RC[-2]="",,"|n"&RC[-2]) -> 
AG952: =IF(RC[-26]&RC[-25]&RC[-24]&RC[-23]&RC[-22]&RC[-21]="",,R1C6)&IF(RC[-26]="",,"|n"&R1C7&RC[-26])&IF(RC[-25]="",,"|n"&R1C8&RC[-25])&IF(RC[-24]="",,"|n"&R1C9&RC[-24])&IF(RC[-23]="",,"|n"&R1C10&RC[-23])&IF(RC[-22]="",,"|n"&R1C11&RC[-22])&IF(RC[-21]="",,"|n"&R1C12&RC[-21])&IF(RC[-19]&RC[-18]&RC[-17]&RC[-16]="",,"|n"&R1C13)&IF(RC[-19]="",,"|n"&R1C14&RC[-19])&IF(RC[-18]="",,"|n"&R1C15&RC[-18])&IF(RC[-17]="",,"|n"&R1C16&RC[-17])&IF(RC[-16]="",,"|n"&R1C17&RC[-16])&IF(RC[-15]="",,"|n"&R1C18&RC[-15])&IF(RC[-14]="",,"|n"&R1C19&RC[-14])&IF(RC[-13]="",,"|n"&R1C20&RC[-13])&IF(RC[-12]="",,"|n"&R1C21&RC[-12])&IF(RC[-10]="",,"|n"&R1C23&RC[-10])&IF(RC[-9]="",,"|n"&R1C24&RC[-9])&IF(RC[-8]="",,"|n"&R1C25&RC[-8])&IF(RC[-7]="",,"|n"&R1C26&RC[-7])&IF(RC[-6]="",,"|n"&R1C27&RC[-6])&IF(RC[-5]="",,"|n"&R1C28&RC[-5])&IF(RC[-2]="",,"|n"&RC[-2]) -> 
AG953: =IF(RC[-26]&RC[-25]&RC[-24]&RC[-23]&RC[-22]&RC[-21]="",,R1C6)&IF(RC[-26]="",,"|n"&R1C7&RC[-26])&IF(RC[-25]="",,"|n"&R1C8&RC[-25])&IF(RC[-24]="",,"|n"&R1C9&RC[-24])&IF(RC[-23]="",,"|n"&R1C10&RC[-23])&IF(RC[-22]="",,"|n"&R1C11&RC[-22])&IF(RC[-21]="",,"|n"&R1C12&RC[-21])&IF(RC[-19]&RC[-18]&RC[-17]&RC[-16]="",,"|n"&R1C13)&IF(RC[-19]="",,"|n"&R1C14&RC[-19])&IF(RC[-18]="",,"|n"&R1C15&RC[-18])&IF(RC[-17]="",,"|n"&R1C16&RC[-17])&IF(RC[-16]="",,"|n"&R1C17&RC[-16])&IF(RC[-15]="",,"|n"&R1C18&RC[-15])&IF(RC[-14]="",,"|n"&R1C19&RC[-14])&IF(RC[-13]="",,"|n"&R1C20&RC[-13])&IF(RC[-12]="",,"|n"&R1C21&RC[-12])&IF(RC[-10]="",,"|n"&R1C23&RC[-10])&IF(RC[-9]="",,"|n"&R1C24&RC[-9])&IF(RC[-8]="",,"|n"&R1C25&RC[-8])&IF(RC[-7]="",,"|n"&R1C26&RC[-7])&IF(RC[-6]="",,"|n"&R1C27&RC[-6])&IF(RC[-5]="",,"|n"&R1C28&RC[-5])&IF(RC[-2]="",,"|n"&RC[-2]) -> 
AG954: =IF(RC[-26]&RC[-25]&RC[-24]&RC[-23]&RC[-22]&RC[-21]="",,R1C6)&IF(RC[-26]="",,"|n"&R1C7&RC[-26])&IF(RC[-25]="",,"|n"&R1C8&RC[-25])&IF(RC[-24]="",,"|n"&R1C9&RC[-24])&IF(RC[-23]="",,"|n"&R1C10&RC[-23])&IF(RC[-22]="",,"|n"&R1C11&RC[-22])&IF(RC[-21]="",,"|n"&R1C12&RC[-21])&IF(RC[-19]&RC[-18]&RC[-17]&RC[-16]="",,"|n"&R1C13)&IF(RC[-19]="",,"|n"&R1C14&RC[-19])&IF(RC[-18]="",,"|n"&R1C15&RC[-18])&IF(RC[-17]="",,"|n"&R1C16&RC[-17])&IF(RC[-16]="",,"|n"&R1C17&RC[-16])&IF(RC[-15]="",,"|n"&R1C18&RC[-15])&IF(RC[-14]="",,"|n"&R1C19&RC[-14])&IF(RC[-13]="",,"|n"&R1C20&RC[-13])&IF(RC[-12]="",,"|n"&R1C21&RC[-12])&IF(RC[-10]="",,"|n"&R1C23&RC[-10])&IF(RC[-9]="",,"|n"&R1C24&RC[-9])&IF(RC[-8]="",,"|n"&R1C25&RC[-8])&IF(RC[-7]="",,"|n"&R1C26&RC[-7])&IF(RC[-6]="",,"|n"&R1C27&RC[-6])&IF(RC[-5]="",,"|n"&R1C28&RC[-5])&IF(RC[-2]="",,"|n"&RC[-2]) -> 
AG955: =IF(RC[-26]&RC[-25]&RC[-24]&RC[-23]&RC[-22]&RC[-21]="",,R1C6)&IF(RC[-26]="",,"|n"&R1C7&RC[-26])&IF(RC[-25]="",,"|n"&R1C8&RC[-25])&IF(RC[-24]="",,"|n"&R1C9&RC[-24])&IF(RC[-23]="",,"|n"&R1C10&RC[-23])&IF(RC[-22]="",,"|n"&R1C11&RC[-22])&IF(RC[-21]="",,"|n"&R1C12&RC[-21])&IF(RC[-19]&RC[-18]&RC[-17]&RC[-16]="",,"|n"&R1C13)&IF(RC[-19]="",,"|n"&R1C14&RC[-19])&IF(RC[-18]="",,"|n"&R1C15&RC[-18])&IF(RC[-17]="",,"|n"&R1C16&RC[-17])&IF(RC[-16]="",,"|n"&R1C17&RC[-16])&IF(RC[-15]="",,"|n"&R1C18&RC[-15])&IF(RC[-14]="",,"|n"&R1C19&RC[-14])&IF(RC[-13]="",,"|n"&R1C20&RC[-13])&IF(RC[-12]="",,"|n"&R1C21&RC[-12])&IF(RC[-10]="",,"|n"&R1C23&RC[-10])&IF(RC[-9]="",,"|n"&R1C24&RC[-9])&IF(RC[-8]="",,"|n"&R1C25&RC[-8])&IF(RC[-7]="",,"|n"&R1C26&RC[-7])&IF(RC[-6]="",,"|n"&R1C27&RC[-6])&IF(RC[-5]="",,"|n"&R1C28&RC[-5])&IF(RC[-2]="",,"|n"&RC[-2]) -> 
AG956: =IF(RC[-26]&RC[-25]&RC[-24]&RC[-23]&RC[-22]&RC[-21]="",,R1C6)&IF(RC[-26]="",,"|n"&R1C7&RC[-26])&IF(RC[-25]="",,"|n"&R1C8&RC[-25])&IF(RC[-24]="",,"|n"&R1C9&RC[-24])&IF(RC[-23]="",,"|n"&R1C10&RC[-23])&IF(RC[-22]="",,"|n"&R1C11&RC[-22])&IF(RC[-21]="",,"|n"&R1C12&RC[-21])&IF(RC[-19]&RC[-18]&RC[-17]&RC[-16]="",,"|n"&R1C13)&IF(RC[-19]="",,"|n"&R1C14&RC[-19])&IF(RC[-18]="",,"|n"&R1C15&RC[-18])&IF(RC[-17]="",,"|n"&R1C16&RC[-17])&IF(RC[-16]="",,"|n"&R1C17&RC[-16])&IF(RC[-15]="",,"|n"&R1C18&RC[-15])&IF(RC[-14]="",,"|n"&R1C19&RC[-14])&IF(RC[-13]="",,"|n"&R1C20&RC[-13])&IF(RC[-12]="",,"|n"&R1C21&RC[-12])&IF(RC[-10]="",,"|n"&R1C23&RC[-10])&IF(RC[-9]="",,"|n"&R1C24&RC[-9])&IF(RC[-8]="",,"|n"&R1C25&RC[-8])&IF(RC[-7]="",,"|n"&R1C26&RC[-7])&IF(RC[-6]="",,"|n"&R1C27&RC[-6])&IF(RC[-5]="",,"|n"&R1C28&RC[-5])&IF(RC[-2]="",,"|n"&RC[-2]) -> 
AG957: =IF(RC[-26]&RC[-25]&RC[-24]&RC[-23]&RC[-22]&RC[-21]="",,R1C6)&IF(RC[-26]="",,"|n"&R1C7&RC[-26])&IF(RC[-25]="",,"|n"&R1C8&RC[-25])&IF(RC[-24]="",,"|n"&R1C9&RC[-24])&IF(RC[-23]="",,"|n"&R1C10&RC[-23])&IF(RC[-22]="",,"|n"&R1C11&RC[-22])&IF(RC[-21]="",,"|n"&R1C12&RC[-21])&IF(RC[-19]&RC[-18]&RC[-17]&RC[-16]="",,"|n"&R1C13)&IF(RC[-19]="",,"|n"&R1C14&RC[-19])&IF(RC[-18]="",,"|n"&R1C15&RC[-18])&IF(RC[-17]="",,"|n"&R1C16&RC[-17])&IF(RC[-16]="",,"|n"&R1C17&RC[-16])&IF(RC[-15]="",,"|n"&R1C18&RC[-15])&IF(RC[-14]="",,"|n"&R1C19&RC[-14])&IF(RC[-13]="",,"|n"&R1C20&RC[-13])&IF(RC[-12]="",,"|n"&R1C21&RC[-12])&IF(RC[-10]="",,"|n"&R1C23&RC[-10])&IF(RC[-9]="",,"|n"&R1C24&RC[-9])&IF(RC[-8]="",,"|n"&R1C25&RC[-8])&IF(RC[-7]="",,"|n"&R1C26&RC[-7])&IF(RC[-6]="",,"|n"&R1C27&RC[-6])&IF(RC[-5]="",,"|n"&R1C28&RC[-5])&IF(RC[-2]="",,"|n"&RC[-2]) -> 
AG958: =IF(RC[-26]&RC[-25]&RC[-24]&RC[-23]&RC[-22]&RC[-21]="",,R1C6)&IF(RC[-26]="",,"|n"&R1C7&RC[-26])&IF(RC[-25]="",,"|n"&R1C8&RC[-25])&IF(RC[-24]="",,"|n"&R1C9&RC[-24])&IF(RC[-23]="",,"|n"&R1C10&RC[-23])&IF(RC[-22]="",,"|n"&R1C11&RC[-22])&IF(RC[-21]="",,"|n"&R1C12&RC[-21])&IF(RC[-19]&RC[-18]&RC[-17]&RC[-16]="",,"|n"&R1C13)&IF(RC[-19]="",,"|n"&R1C14&RC[-19])&IF(RC[-18]="",,"|n"&R1C15&RC[-18])&IF(RC[-17]="",,"|n"&R1C16&RC[-17])&IF(RC[-16]="",,"|n"&R1C17&RC[-16])&IF(RC[-15]="",,"|n"&R1C18&RC[-15])&IF(RC[-14]="",,"|n"&R1C19&RC[-14])&IF(RC[-13]="",,"|n"&R1C20&RC[-13])&IF(RC[-12]="",,"|n"&R1C21&RC[-12])&IF(RC[-10]="",,"|n"&R1C23&RC[-10])&IF(RC[-9]="",,"|n"&R1C24&RC[-9])&IF(RC[-8]="",,"|n"&R1C25&RC[-8])&IF(RC[-7]="",,"|n"&R1C26&RC[-7])&IF(RC[-6]="",,"|n"&R1C27&RC[-6])&IF(RC[-5]="",,"|n"&R1C28&RC[-5])&IF(RC[-2]="",,"|n"&RC[-2]) -> 
AG959: =IF(RC[-26]&RC[-25]&RC[-24]&RC[-23]&RC[-22]&RC[-21]="",,R1C6)&IF(RC[-26]="",,"|n"&R1C7&RC[-26])&IF(RC[-25]="",,"|n"&R1C8&RC[-25])&IF(RC[-24]="",,"|n"&R1C9&RC[-24])&IF(RC[-23]="",,"|n"&R1C10&RC[-23])&IF(RC[-22]="",,"|n"&R1C11&RC[-22])&IF(RC[-21]="",,"|n"&R1C12&RC[-21])&IF(RC[-19]&RC[-18]&RC[-17]&RC[-16]="",,"|n"&R1C13)&IF(RC[-19]="",,"|n"&R1C14&RC[-19])&IF(RC[-18]="",,"|n"&R1C15&RC[-18])&IF(RC[-17]="",,"|n"&R1C16&RC[-17])&IF(RC[-16]="",,"|n"&R1C17&RC[-16])&IF(RC[-15]="",,"|n"&R1C18&RC[-15])&IF(RC[-14]="",,"|n"&R1C19&RC[-14])&IF(RC[-13]="",,"|n"&R1C20&RC[-13])&IF(RC[-12]="",,"|n"&R1C21&RC[-12])&IF(RC[-10]="",,"|n"&R1C23&RC[-10])&IF(RC[-9]="",,"|n"&R1C24&RC[-9])&IF(RC[-8]="",,"|n"&R1C25&RC[-8])&IF(RC[-7]="",,"|n"&R1C26&RC[-7])&IF(RC[-6]="",,"|n"&R1C27&RC[-6])&IF(RC[-5]="",,"|n"&R1C28&RC[-5])&IF(RC[-2]="",,"|n"&RC[-2]) -> 
AG960: =IF(RC[-26]&RC[-25]&RC[-24]&RC[-23]&RC[-22]&RC[-21]="",,R1C6)&IF(RC[-26]="",,"|n"&R1C7&RC[-26])&IF(RC[-25]="",,"|n"&R1C8&RC[-25])&IF(RC[-24]="",,"|n"&R1C9&RC[-24])&IF(RC[-23]="",,"|n"&R1C10&RC[-23])&IF(RC[-22]="",,"|n"&R1C11&RC[-22])&IF(RC[-21]="",,"|n"&R1C12&RC[-21])&IF(RC[-19]&RC[-18]&RC[-17]&RC[-16]="",,"|n"&R1C13)&IF(RC[-19]="",,"|n"&R1C14&RC[-19])&IF(RC[-18]="",,"|n"&R1C15&RC[-18])&IF(RC[-17]="",,"|n"&R1C16&RC[-17])&IF(RC[-16]="",,"|n"&R1C17&RC[-16])&IF(RC[-15]="",,"|n"&R1C18&RC[-15])&IF(RC[-14]="",,"|n"&R1C19&RC[-14])&IF(RC[-13]="",,"|n"&R1C20&RC[-13])&IF(RC[-12]="",,"|n"&R1C21&RC[-12])&IF(RC[-10]="",,"|n"&R1C23&RC[-10])&IF(RC[-9]="",,"|n"&R1C24&RC[-9])&IF(RC[-8]="",,"|n"&R1C25&RC[-8])&IF(RC[-7]="",,"|n"&R1C26&RC[-7])&IF(RC[-6]="",,"|n"&R1C27&RC[-6])&IF(RC[-5]="",,"|n"&R1C28&RC[-5])&IF(RC[-2]="",,"|n"&RC[-2]) -> 
AG961: =IF(RC[-26]&RC[-25]&RC[-24]&RC[-23]&RC[-22]&RC[-21]="",,R1C6)&IF(RC[-26]="",,"|n"&R1C7&RC[-26])&IF(RC[-25]="",,"|n"&R1C8&RC[-25])&IF(RC[-24]="",,"|n"&R1C9&RC[-24])&IF(RC[-23]="",,"|n"&R1C10&RC[-23])&IF(RC[-22]="",,"|n"&R1C11&RC[-22])&IF(RC[-21]="",,"|n"&R1C12&RC[-21])&IF(RC[-19]&RC[-18]&RC[-17]&RC[-16]="",,"|n"&R1C13)&IF(RC[-19]="",,"|n"&R1C14&RC[-19])&IF(RC[-18]="",,"|n"&R1C15&RC[-18])&IF(RC[-17]="",,"|n"&R1C16&RC[-17])&IF(RC[-16]="",,"|n"&R1C17&RC[-16])&IF(RC[-15]="",,"|n"&R1C18&RC[-15])&IF(RC[-14]="",,"|n"&R1C19&RC[-14])&IF(RC[-13]="",,"|n"&R1C20&RC[-13])&IF(RC[-12]="",,"|n"&R1C21&RC[-12])&IF(RC[-10]="",,"|n"&R1C23&RC[-10])&IF(RC[-9]="",,"|n"&R1C24&RC[-9])&IF(RC[-8]="",,"|n"&R1C25&RC[-8])&IF(RC[-7]="",,"|n"&R1C26&RC[-7])&IF(RC[-6]="",,"|n"&R1C27&RC[-6])&IF(RC[-5]="",,"|n"&R1C28&RC[-5])&IF(RC[-2]="",,"|n"&RC[-2]) -> 
AG962: =IF(RC[-26]&RC[-25]&RC[-24]&RC[-23]&RC[-22]&RC[-21]="",,R1C6)&IF(RC[-26]="",,"|n"&R1C7&RC[-26])&IF(RC[-25]="",,"|n"&R1C8&RC[-25])&IF(RC[-24]="",,"|n"&R1C9&RC[-24])&IF(RC[-23]="",,"|n"&R1C10&RC[-23])&IF(RC[-22]="",,"|n"&R1C11&RC[-22])&IF(RC[-21]="",,"|n"&R1C12&RC[-21])&IF(RC[-19]&RC[-18]&RC[-17]&RC[-16]="",,"|n"&R1C13)&IF(RC[-19]="",,"|n"&R1C14&RC[-19])&IF(RC[-18]="",,"|n"&R1C15&RC[-18])&IF(RC[-17]="",,"|n"&R1C16&RC[-17])&IF(RC[-16]="",,"|n"&R1C17&RC[-16])&IF(RC[-15]="",,"|n"&R1C18&RC[-15])&IF(RC[-14]="",,"|n"&R1C19&RC[-14])&IF(RC[-13]="",,"|n"&R1C20&RC[-13])&IF(RC[-12]="",,"|n"&R1C21&RC[-12])&IF(RC[-10]="",,"|n"&R1C23&RC[-10])&IF(RC[-9]="",,"|n"&R1C24&RC[-9])&IF(RC[-8]="",,"|n"&R1C25&RC[-8])&IF(RC[-7]="",,"|n"&R1C26&RC[-7])&IF(RC[-6]="",,"|n"&R1C27&RC[-6])&IF(RC[-5]="",,"|n"&R1C28&RC[-5])&IF(RC[-2]="",,"|n"&RC[-2]) -> 
AG963: =IF(RC[-26]&RC[-25]&RC[-24]&RC[-23]&RC[-22]&RC[-21]="",,R1C6)&IF(RC[-26]="",,"|n"&R1C7&RC[-26])&IF(RC[-25]="",,"|n"&R1C8&RC[-25])&IF(RC[-24]="",,"|n"&R1C9&RC[-24])&IF(RC[-23]="",,"|n"&R1C10&RC[-23])&IF(RC[-22]="",,"|n"&R1C11&RC[-22])&IF(RC[-21]="",,"|n"&R1C12&RC[-21])&IF(RC[-19]&RC[-18]&RC[-17]&RC[-16]="",,"|n"&R1C13)&IF(RC[-19]="",,"|n"&R1C14&RC[-19])&IF(RC[-18]="",,"|n"&R1C15&RC[-18])&IF(RC[-17]="",,"|n"&R1C16&RC[-17])&IF(RC[-16]="",,"|n"&R1C17&RC[-16])&IF(RC[-15]="",,"|n"&R1C18&RC[-15])&IF(RC[-14]="",,"|n"&R1C19&RC[-14])&IF(RC[-13]="",,"|n"&R1C20&RC[-13])&IF(RC[-12]="",,"|n"&R1C21&RC[-12])&IF(RC[-10]="",,"|n"&R1C23&RC[-10])&IF(RC[-9]="",,"|n"&R1C24&RC[-9])&IF(RC[-8]="",,"|n"&R1C25&RC[-8])&IF(RC[-7]="",,"|n"&R1C26&RC[-7])&IF(RC[-6]="",,"|n"&R1C27&RC[-6])&IF(RC[-5]="",,"|n"&R1C28&RC[-5])&IF(RC[-2]="",,"|n"&RC[-2]) -> 
AG964: =IF(RC[-26]&RC[-25]&RC[-24]&RC[-23]&RC[-22]&RC[-21]="",,R1C6)&IF(RC[-26]="",,"|n"&R1C7&RC[-26])&IF(RC[-25]="",,"|n"&R1C8&RC[-25])&IF(RC[-24]="",,"|n"&R1C9&RC[-24])&IF(RC[-23]="",,"|n"&R1C10&RC[-23])&IF(RC[-22]="",,"|n"&R1C11&RC[-22])&IF(RC[-21]="",,"|n"&R1C12&RC[-21])&IF(RC[-19]&RC[-18]&RC[-17]&RC[-16]="",,"|n"&R1C13)&IF(RC[-19]="",,"|n"&R1C14&RC[-19])&IF(RC[-18]="",,"|n"&R1C15&RC[-18])&IF(RC[-17]="",,"|n"&R1C16&RC[-17])&IF(RC[-16]="",,"|n"&R1C17&RC[-16])&IF(RC[-15]="",,"|n"&R1C18&RC[-15])&IF(RC[-14]="",,"|n"&R1C19&RC[-14])&IF(RC[-13]="",,"|n"&R1C20&RC[-13])&IF(RC[-12]="",,"|n"&R1C21&RC[-12])&IF(RC[-10]="",,"|n"&R1C23&RC[-10])&IF(RC[-9]="",,"|n"&R1C24&RC[-9])&IF(RC[-8]="",,"|n"&R1C25&RC[-8])&IF(RC[-7]="",,"|n"&R1C26&RC[-7])&IF(RC[-6]="",,"|n"&R1C27&RC[-6])&IF(RC[-5]="",,"|n"&R1C28&RC[-5])&IF(RC[-2]="",,"|n"&RC[-2]) -> 
AG965: =IF(RC[-26]&RC[-25]&RC[-24]&RC[-23]&RC[-22]&RC[-21]="",,R1C6)&IF(RC[-26]="",,"|n"&R1C7&RC[-26])&IF(RC[-25]="",,"|n"&R1C8&RC[-25])&IF(RC[-24]="",,"|n"&R1C9&RC[-24])&IF(RC[-23]="",,"|n"&R1C10&RC[-23])&IF(RC[-22]="",,"|n"&R1C11&RC[-22])&IF(RC[-21]="",,"|n"&R1C12&RC[-21])&IF(RC[-19]&RC[-18]&RC[-17]&RC[-16]="",,"|n"&R1C13)&IF(RC[-19]="",,"|n"&R1C14&RC[-19])&IF(RC[-18]="",,"|n"&R1C15&RC[-18])&IF(RC[-17]="",,"|n"&R1C16&RC[-17])&IF(RC[-16]="",,"|n"&R1C17&RC[-16])&IF(RC[-15]="",,"|n"&R1C18&RC[-15])&IF(RC[-14]="",,"|n"&R1C19&RC[-14])&IF(RC[-13]="",,"|n"&R1C20&RC[-13])&IF(RC[-12]="",,"|n"&R1C21&RC[-12])&IF(RC[-10]="",,"|n"&R1C23&RC[-10])&IF(RC[-9]="",,"|n"&R1C24&RC[-9])&IF(RC[-8]="",,"|n"&R1C25&RC[-8])&IF(RC[-7]="",,"|n"&R1C26&RC[-7])&IF(RC[-6]="",,"|n"&R1C27&RC[-6])&IF(RC[-5]="",,"|n"&R1C28&RC[-5])&IF(RC[-2]="",,"|n"&RC[-2]) -> 
AG966: =IF(RC[-26]&RC[-25]&RC[-24]&RC[-23]&RC[-22]&RC[-21]="",,R1C6)&IF(RC[-26]="",,"|n"&R1C7&RC[-26])&IF(RC[-25]="",,"|n"&R1C8&RC[-25])&IF(RC[-24]="",,"|n"&R1C9&RC[-24])&IF(RC[-23]="",,"|n"&R1C10&RC[-23])&IF(RC[-22]="",,"|n"&R1C11&RC[-22])&IF(RC[-21]="",,"|n"&R1C12&RC[-21])&IF(RC[-19]&RC[-18]&RC[-17]&RC[-16]="",,"|n"&R1C13)&IF(RC[-19]="",,"|n"&R1C14&RC[-19])&IF(RC[-18]="",,"|n"&R1C15&RC[-18])&IF(RC[-17]="",,"|n"&R1C16&RC[-17])&IF(RC[-16]="",,"|n"&R1C17&RC[-16])&IF(RC[-15]="",,"|n"&R1C18&RC[-15])&IF(RC[-14]="",,"|n"&R1C19&RC[-14])&IF(RC[-13]="",,"|n"&R1C20&RC[-13])&IF(RC[-12]="",,"|n"&R1C21&RC[-12])&IF(RC[-10]="",,"|n"&R1C23&RC[-10])&IF(RC[-9]="",,"|n"&R1C24&RC[-9])&IF(RC[-8]="",,"|n"&R1C25&RC[-8])&IF(RC[-7]="",,"|n"&R1C26&RC[-7])&IF(RC[-6]="",,"|n"&R1C27&RC[-6])&IF(RC[-5]="",,"|n"&R1C28&RC[-5])&IF(RC[-2]="",,"|n"&RC[-2]) -> 
AG967: =IF(RC[-26]&RC[-25]&RC[-24]&RC[-23]&RC[-22]&RC[-21]="",,R1C6)&IF(RC[-26]="",,"|n"&R1C7&RC[-26])&IF(RC[-25]="",,"|n"&R1C8&RC[-25])&IF(RC[-24]="",,"|n"&R1C9&RC[-24])&IF(RC[-23]="",,"|n"&R1C10&RC[-23])&IF(RC[-22]="",,"|n"&R1C11&RC[-22])&IF(RC[-21]="",,"|n"&R1C12&RC[-21])&IF(RC[-19]&RC[-18]&RC[-17]&RC[-16]="",,"|n"&R1C13)&IF(RC[-19]="",,"|n"&R1C14&RC[-19])&IF(RC[-18]="",,"|n"&R1C15&RC[-18])&IF(RC[-17]="",,"|n"&R1C16&RC[-17])&IF(RC[-16]="",,"|n"&R1C17&RC[-16])&IF(RC[-15]="",,"|n"&R1C18&RC[-15])&IF(RC[-14]="",,"|n"&R1C19&RC[-14])&IF(RC[-13]="",,"|n"&R1C20&RC[-13])&IF(RC[-12]="",,"|n"&R1C21&RC[-12])&IF(RC[-10]="",,"|n"&R1C23&RC[-10])&IF(RC[-9]="",,"|n"&R1C24&RC[-9])&IF(RC[-8]="",,"|n"&R1C25&RC[-8])&IF(RC[-7]="",,"|n"&R1C26&RC[-7])&IF(RC[-6]="",,"|n"&R1C27&RC[-6])&IF(RC[-5]="",,"|n"&R1C28&RC[-5])&IF(RC[-2]="",,"|n"&RC[-2]) -> 
AG968: =IF(RC[-26]&RC[-25]&RC[-24]&RC[-23]&RC[-22]&RC[-21]="",,R1C6)&IF(RC[-26]="",,"|n"&R1C7&RC[-26])&IF(RC[-25]="",,"|n"&R1C8&RC[-25])&IF(RC[-24]="",,"|n"&R1C9&RC[-24])&IF(RC[-23]="",,"|n"&R1C10&RC[-23])&IF(RC[-22]="",,"|n"&R1C11&RC[-22])&IF(RC[-21]="",,"|n"&R1C12&RC[-21])&IF(RC[-19]&RC[-18]&RC[-17]&RC[-16]="",,"|n"&R1C13)&IF(RC[-19]="",,"|n"&R1C14&RC[-19])&IF(RC[-18]="",,"|n"&R1C15&RC[-18])&IF(RC[-17]="",,"|n"&R1C16&RC[-17])&IF(RC[-16]="",,"|n"&R1C17&RC[-16])&IF(RC[-15]="",,"|n"&R1C18&RC[-15])&IF(RC[-14]="",,"|n"&R1C19&RC[-14])&IF(RC[-13]="",,"|n"&R1C20&RC[-13])&IF(RC[-12]="",,"|n"&R1C21&RC[-12])&IF(RC[-10]="",,"|n"&R1C23&RC[-10])&IF(RC[-9]="",,"|n"&R1C24&RC[-9])&IF(RC[-8]="",,"|n"&R1C25&RC[-8])&IF(RC[-7]="",,"|n"&R1C26&RC[-7])&IF(RC[-6]="",,"|n"&R1C27&RC[-6])&IF(RC[-5]="",,"|n"&R1C28&RC[-5])&IF(RC[-2]="",,"|n"&RC[-2]) -> 
AG969: =IF(RC[-26]&RC[-25]&RC[-24]&RC[-23]&RC[-22]&RC[-21]="",,R1C6)&IF(RC[-26]="",,"|n"&R1C7&RC[-26])&IF(RC[-25]="",,"|n"&R1C8&RC[-25])&IF(RC[-24]="",,"|n"&R1C9&RC[-24])&IF(RC[-23]="",,"|n"&R1C10&RC[-23])&IF(RC[-22]="",,"|n"&R1C11&RC[-22])&IF(RC[-21]="",,"|n"&R1C12&RC[-21])&IF(RC[-19]&RC[-18]&RC[-17]&RC[-16]="",,"|n"&R1C13)&IF(RC[-19]="",,"|n"&R1C14&RC[-19])&IF(RC[-18]="",,"|n"&R1C15&RC[-18])&IF(RC[-17]="",,"|n"&R1C16&RC[-17])&IF(RC[-16]="",,"|n"&R1C17&RC[-16])&IF(RC[-15]="",,"|n"&R1C18&RC[-15])&IF(RC[-14]="",,"|n"&R1C19&RC[-14])&IF(RC[-13]="",,"|n"&R1C20&RC[-13])&IF(RC[-12]="",,"|n"&R1C21&RC[-12])&IF(RC[-10]="",,"|n"&R1C23&RC[-10])&IF(RC[-9]="",,"|n"&R1C24&RC[-9])&IF(RC[-8]="",,"|n"&R1C25&RC[-8])&IF(RC[-7]="",,"|n"&R1C26&RC[-7])&IF(RC[-6]="",,"|n"&R1C27&RC[-6])&IF(RC[-5]="",,"|n"&R1C28&RC[-5])&IF(RC[-2]="",,"|n"&RC[-2]) -> 
AG970: =IF(RC[-26]&RC[-25]&RC[-24]&RC[-23]&RC[-22]&RC[-21]="",,R1C6)&IF(RC[-26]="",,"|n"&R1C7&RC[-26])&IF(RC[-25]="",,"|n"&R1C8&RC[-25])&IF(RC[-24]="",,"|n"&R1C9&RC[-24])&IF(RC[-23]="",,"|n"&R1C10&RC[-23])&IF(RC[-22]="",,"|n"&R1C11&RC[-22])&IF(RC[-21]="",,"|n"&R1C12&RC[-21])&IF(RC[-19]&RC[-18]&RC[-17]&RC[-16]="",,"|n"&R1C13)&IF(RC[-19]="",,"|n"&R1C14&RC[-19])&IF(RC[-18]="",,"|n"&R1C15&RC[-18])&IF(RC[-17]="",,"|n"&R1C16&RC[-17])&IF(RC[-16]="",,"|n"&R1C17&RC[-16])&IF(RC[-15]="",,"|n"&R1C18&RC[-15])&IF(RC[-14]="",,"|n"&R1C19&RC[-14])&IF(RC[-13]="",,"|n"&R1C20&RC[-13])&IF(RC[-12]="",,"|n"&R1C21&RC[-12])&IF(RC[-10]="",,"|n"&R1C23&RC[-10])&IF(RC[-9]="",,"|n"&R1C24&RC[-9])&IF(RC[-8]="",,"|n"&R1C25&RC[-8])&IF(RC[-7]="",,"|n"&R1C26&RC[-7])&IF(RC[-6]="",,"|n"&R1C27&RC[-6])&IF(RC[-5]="",,"|n"&R1C28&RC[-5])&IF(RC[-2]="",,"|n"&RC[-2]) -> 
AG971: =IF(RC[-26]&RC[-25]&RC[-24]&RC[-23]&RC[-22]&RC[-21]="",,R1C6)&IF(RC[-26]="",,"|n"&R1C7&RC[-26])&IF(RC[-25]="",,"|n"&R1C8&RC[-25])&IF(RC[-24]="",,"|n"&R1C9&RC[-24])&IF(RC[-23]="",,"|n"&R1C10&RC[-23])&IF(RC[-22]="",,"|n"&R1C11&RC[-22])&IF(RC[-21]="",,"|n"&R1C12&RC[-21])&IF(RC[-19]&RC[-18]&RC[-17]&RC[-16]="",,"|n"&R1C13)&IF(RC[-19]="",,"|n"&R1C14&RC[-19])&IF(RC[-18]="",,"|n"&R1C15&RC[-18])&IF(RC[-17]="",,"|n"&R1C16&RC[-17])&IF(RC[-16]="",,"|n"&R1C17&RC[-16])&IF(RC[-15]="",,"|n"&R1C18&RC[-15])&IF(RC[-14]="",,"|n"&R1C19&RC[-14])&IF(RC[-13]="",,"|n"&R1C20&RC[-13])&IF(RC[-12]="",,"|n"&R1C21&RC[-12])&IF(RC[-10]="",,"|n"&R1C23&RC[-10])&IF(RC[-9]="",,"|n"&R1C24&RC[-9])&IF(RC[-8]="",,"|n"&R1C25&RC[-8])&IF(RC[-7]="",,"|n"&R1C26&RC[-7])&IF(RC[-6]="",,"|n"&R1C27&RC[-6])&IF(RC[-5]="",,"|n"&R1C28&RC[-5])&IF(RC[-2]="",,"|n"&RC[-2]) -> 
AG972: =IF(RC[-26]&RC[-25]&RC[-24]&RC[-23]&RC[-22]&RC[-21]="",,R1C6)&IF(RC[-26]="",,"|n"&R1C7&RC[-26])&IF(RC[-25]="",,"|n"&R1C8&RC[-25])&IF(RC[-24]="",,"|n"&R1C9&RC[-24])&IF(RC[-23]="",,"|n"&R1C10&RC[-23])&IF(RC[-22]="",,"|n"&R1C11&RC[-22])&IF(RC[-21]="",,"|n"&R1C12&RC[-21])&IF(RC[-19]&RC[-18]&RC[-17]&RC[-16]="",,"|n"&R1C13)&IF(RC[-19]="",,"|n"&R1C14&RC[-19])&IF(RC[-18]="",,"|n"&R1C15&RC[-18])&IF(RC[-17]="",,"|n"&R1C16&RC[-17])&IF(RC[-16]="",,"|n"&R1C17&RC[-16])&IF(RC[-15]="",,"|n"&R1C18&RC[-15])&IF(RC[-14]="",,"|n"&R1C19&RC[-14])&IF(RC[-13]="",,"|n"&R1C20&RC[-13])&IF(RC[-12]="",,"|n"&R1C21&RC[-12])&IF(RC[-10]="",,"|n"&R1C23&RC[-10])&IF(RC[-9]="",,"|n"&R1C24&RC[-9])&IF(RC[-8]="",,"|n"&R1C25&RC[-8])&IF(RC[-7]="",,"|n"&R1C26&RC[-7])&IF(RC[-6]="",,"|n"&R1C27&RC[-6])&IF(RC[-5]="",,"|n"&R1C28&RC[-5])&IF(RC[-2]="",,"|n"&RC[-2]) -> 
AG973: =IF(RC[-26]&RC[-25]&RC[-24]&RC[-23]&RC[-22]&RC[-21]="",,R1C6)&IF(RC[-26]="",,"|n"&R1C7&RC[-26])&IF(RC[-25]="",,"|n"&R1C8&RC[-25])&IF(RC[-24]="",,"|n"&R1C9&RC[-24])&IF(RC[-23]="",,"|n"&R1C10&RC[-23])&IF(RC[-22]="",,"|n"&R1C11&RC[-22])&IF(RC[-21]="",,"|n"&R1C12&RC[-21])&IF(RC[-19]&RC[-18]&RC[-17]&RC[-16]="",,"|n"&R1C13)&IF(RC[-19]="",,"|n"&R1C14&RC[-19])&IF(RC[-18]="",,"|n"&R1C15&RC[-18])&IF(RC[-17]="",,"|n"&R1C16&RC[-17])&IF(RC[-16]="",,"|n"&R1C17&RC[-16])&IF(RC[-15]="",,"|n"&R1C18&RC[-15])&IF(RC[-14]="",,"|n"&R1C19&RC[-14])&IF(RC[-13]="",,"|n"&R1C20&RC[-13])&IF(RC[-12]="",,"|n"&R1C21&RC[-12])&IF(RC[-10]="",,"|n"&R1C23&RC[-10])&IF(RC[-9]="",,"|n"&R1C24&RC[-9])&IF(RC[-8]="",,"|n"&R1C25&RC[-8])&IF(RC[-7]="",,"|n"&R1C26&RC[-7])&IF(RC[-6]="",,"|n"&R1C27&RC[-6])&IF(RC[-5]="",,"|n"&R1C28&RC[-5])&IF(RC[-2]="",,"|n"&RC[-2]) -> 
AG974: =IF(RC[-26]&RC[-25]&RC[-24]&RC[-23]&RC[-22]&RC[-21]="",,R1C6)&IF(RC[-26]="",,"|n"&R1C7&RC[-26])&IF(RC[-25]="",,"|n"&R1C8&RC[-25])&IF(RC[-24]="",,"|n"&R1C9&RC[-24])&IF(RC[-23]="",,"|n"&R1C10&RC[-23])&IF(RC[-22]="",,"|n"&R1C11&RC[-22])&IF(RC[-21]="",,"|n"&R1C12&RC[-21])&IF(RC[-19]&RC[-18]&RC[-17]&RC[-16]="",,"|n"&R1C13)&IF(RC[-19]="",,"|n"&R1C14&RC[-19])&IF(RC[-18]="",,"|n"&R1C15&RC[-18])&IF(RC[-17]="",,"|n"&R1C16&RC[-17])&IF(RC[-16]="",,"|n"&R1C17&RC[-16])&IF(RC[-15]="",,"|n"&R1C18&RC[-15])&IF(RC[-14]="",,"|n"&R1C19&RC[-14])&IF(RC[-13]="",,"|n"&R1C20&RC[-13])&IF(RC[-12]="",,"|n"&R1C21&RC[-12])&IF(RC[-10]="",,"|n"&R1C23&RC[-10])&IF(RC[-9]="",,"|n"&R1C24&RC[-9])&IF(RC[-8]="",,"|n"&R1C25&RC[-8])&IF(RC[-7]="",,"|n"&R1C26&RC[-7])&IF(RC[-6]="",,"|n"&R1C27&RC[-6])&IF(RC[-5]="",,"|n"&R1C28&RC[-5])&IF(RC[-2]="",,"|n"&RC[-2]) -> 
AG975: =IF(RC[-26]&RC[-25]&RC[-24]&RC[-23]&RC[-22]&RC[-21]="",,R1C6)&IF(RC[-26]="",,"|n"&R1C7&RC[-26])&IF(RC[-25]="",,"|n"&R1C8&RC[-25])&IF(RC[-24]="",,"|n"&R1C9&RC[-24])&IF(RC[-23]="",,"|n"&R1C10&RC[-23])&IF(RC[-22]="",,"|n"&R1C11&RC[-22])&IF(RC[-21]="",,"|n"&R1C12&RC[-21])&IF(RC[-19]&RC[-18]&RC[-17]&RC[-16]="",,"|n"&R1C13)&IF(RC[-19]="",,"|n"&R1C14&RC[-19])&IF(RC[-18]="",,"|n"&R1C15&RC[-18])&IF(RC[-17]="",,"|n"&R1C16&RC[-17])&IF(RC[-16]="",,"|n"&R1C17&RC[-16])&IF(RC[-15]="",,"|n"&R1C18&RC[-15])&IF(RC[-14]="",,"|n"&R1C19&RC[-14])&IF(RC[-13]="",,"|n"&R1C20&RC[-13])&IF(RC[-12]="",,"|n"&R1C21&RC[-12])&IF(RC[-10]="",,"|n"&R1C23&RC[-10])&IF(RC[-9]="",,"|n"&R1C24&RC[-9])&IF(RC[-8]="",,"|n"&R1C25&RC[-8])&IF(RC[-7]="",,"|n"&R1C26&RC[-7])&IF(RC[-6]="",,"|n"&R1C27&RC[-6])&IF(RC[-5]="",,"|n"&R1C28&RC[-5])&IF(RC[-2]="",,"|n"&RC[-2]) -> 
AG976: =IF(RC[-26]&RC[-25]&RC[-24]&RC[-23]&RC[-22]&RC[-21]="",,R1C6)&IF(RC[-26]="",,"|n"&R1C7&RC[-26])&IF(RC[-25]="",,"|n"&R1C8&RC[-25])&IF(RC[-24]="",,"|n"&R1C9&RC[-24])&IF(RC[-23]="",,"|n"&R1C10&RC[-23])&IF(RC[-22]="",,"|n"&R1C11&RC[-22])&IF(RC[-21]="",,"|n"&R1C12&RC[-21])&IF(RC[-19]&RC[-18]&RC[-17]&RC[-16]="",,"|n"&R1C13)&IF(RC[-19]="",,"|n"&R1C14&RC[-19])&IF(RC[-18]="",,"|n"&R1C15&RC[-18])&IF(RC[-17]="",,"|n"&R1C16&RC[-17])&IF(RC[-16]="",,"|n"&R1C17&RC[-16])&IF(RC[-15]="",,"|n"&R1C18&RC[-15])&IF(RC[-14]="",,"|n"&R1C19&RC[-14])&IF(RC[-13]="",,"|n"&R1C20&RC[-13])&IF(RC[-12]="",,"|n"&R1C21&RC[-12])&IF(RC[-10]="",,"|n"&R1C23&RC[-10])&IF(RC[-9]="",,"|n"&R1C24&RC[-9])&IF(RC[-8]="",,"|n"&R1C25&RC[-8])&IF(RC[-7]="",,"|n"&R1C26&RC[-7])&IF(RC[-6]="",,"|n"&R1C27&RC[-6])&IF(RC[-5]="",,"|n"&R1C28&RC[-5])&IF(RC[-2]="",,"|n"&RC[-2]) -> 
AG977: =IF(RC[-26]&RC[-25]&RC[-24]&RC[-23]&RC[-22]&RC[-21]="",,R1C6)&IF(RC[-26]="",,"|n"&R1C7&RC[-26])&IF(RC[-25]="",,"|n"&R1C8&RC[-25])&IF(RC[-24]="",,"|n"&R1C9&RC[-24])&IF(RC[-23]="",,"|n"&R1C10&RC[-23])&IF(RC[-22]="",,"|n"&R1C11&RC[-22])&IF(RC[-21]="",,"|n"&R1C12&RC[-21])&IF(RC[-19]&RC[-18]&RC[-17]&RC[-16]="",,"|n"&R1C13)&IF(RC[-19]="",,"|n"&R1C14&RC[-19])&IF(RC[-18]="",,"|n"&R1C15&RC[-18])&IF(RC[-17]="",,"|n"&R1C16&RC[-17])&IF(RC[-16]="",,"|n"&R1C17&RC[-16])&IF(RC[-15]="",,"|n"&R1C18&RC[-15])&IF(RC[-14]="",,"|n"&R1C19&RC[-14])&IF(RC[-13]="",,"|n"&R1C20&RC[-13])&IF(RC[-12]="",,"|n"&R1C21&RC[-12])&IF(RC[-10]="",,"|n"&R1C23&RC[-10])&IF(RC[-9]="",,"|n"&R1C24&RC[-9])&IF(RC[-8]="",,"|n"&R1C25&RC[-8])&IF(RC[-7]="",,"|n"&R1C26&RC[-7])&IF(RC[-6]="",,"|n"&R1C27&RC[-6])&IF(RC[-5]="",,"|n"&R1C28&RC[-5])&IF(RC[-2]="",,"|n"&RC[-2]) -> 
AG978: =IF(RC[-26]&RC[-25]&RC[-24]&RC[-23]&RC[-22]&RC[-21]="",,R1C6)&IF(RC[-26]="",,"|n"&R1C7&RC[-26])&IF(RC[-25]="",,"|n"&R1C8&RC[-25])&IF(RC[-24]="",,"|n"&R1C9&RC[-24])&IF(RC[-23]="",,"|n"&R1C10&RC[-23])&IF(RC[-22]="",,"|n"&R1C11&RC[-22])&IF(RC[-21]="",,"|n"&R1C12&RC[-21])&IF(RC[-19]&RC[-18]&RC[-17]&RC[-16]="",,"|n"&R1C13)&IF(RC[-19]="",,"|n"&R1C14&RC[-19])&IF(RC[-18]="",,"|n"&R1C15&RC[-18])&IF(RC[-17]="",,"|n"&R1C16&RC[-17])&IF(RC[-16]="",,"|n"&R1C17&RC[-16])&IF(RC[-15]="",,"|n"&R1C18&RC[-15])&IF(RC[-14]="",,"|n"&R1C19&RC[-14])&IF(RC[-13]="",,"|n"&R1C20&RC[-13])&IF(RC[-12]="",,"|n"&R1C21&RC[-12])&IF(RC[-10]="",,"|n"&R1C23&RC[-10])&IF(RC[-9]="",,"|n"&R1C24&RC[-9])&IF(RC[-8]="",,"|n"&R1C25&RC[-8])&IF(RC[-7]="",,"|n"&R1C26&RC[-7])&IF(RC[-6]="",,"|n"&R1C27&RC[-6])&IF(RC[-5]="",,"|n"&R1C28&RC[-5])&IF(RC[-2]="",,"|n"&RC[-2]) -> 
AG979: =IF(RC[-26]&RC[-25]&RC[-24]&RC[-23]&RC[-22]&RC[-21]="",,R1C6)&IF(RC[-26]="",,"|n"&R1C7&RC[-26])&IF(RC[-25]="",,"|n"&R1C8&RC[-25])&IF(RC[-24]="",,"|n"&R1C9&RC[-24])&IF(RC[-23]="",,"|n"&R1C10&RC[-23])&IF(RC[-22]="",,"|n"&R1C11&RC[-22])&IF(RC[-21]="",,"|n"&R1C12&RC[-21])&IF(RC[-19]&RC[-18]&RC[-17]&RC[-16]="",,"|n"&R1C13)&IF(RC[-19]="",,"|n"&R1C14&RC[-19])&IF(RC[-18]="",,"|n"&R1C15&RC[-18])&IF(RC[-17]="",,"|n"&R1C16&RC[-17])&IF(RC[-16]="",,"|n"&R1C17&RC[-16])&IF(RC[-15]="",,"|n"&R1C18&RC[-15])&IF(RC[-14]="",,"|n"&R1C19&RC[-14])&IF(RC[-13]="",,"|n"&R1C20&RC[-13])&IF(RC[-12]="",,"|n"&R1C21&RC[-12])&IF(RC[-10]="",,"|n"&R1C23&RC[-10])&IF(RC[-9]="",,"|n"&R1C24&RC[-9])&IF(RC[-8]="",,"|n"&R1C25&RC[-8])&IF(RC[-7]="",,"|n"&R1C26&RC[-7])&IF(RC[-6]="",,"|n"&R1C27&RC[-6])&IF(RC[-5]="",,"|n"&R1C28&RC[-5])&IF(RC[-2]="",,"|n"&RC[-2]) -> 
AG980: =IF(RC[-26]&RC[-25]&RC[-24]&RC[-23]&RC[-22]&RC[-21]="",,R1C6)&IF(RC[-26]="",,"|n"&R1C7&RC[-26])&IF(RC[-25]="",,"|n"&R1C8&RC[-25])&IF(RC[-24]="",,"|n"&R1C9&RC[-24])&IF(RC[-23]="",,"|n"&R1C10&RC[-23])&IF(RC[-22]="",,"|n"&R1C11&RC[-22])&IF(RC[-21]="",,"|n"&R1C12&RC[-21])&IF(RC[-19]&RC[-18]&RC[-17]&RC[-16]="",,"|n"&R1C13)&IF(RC[-19]="",,"|n"&R1C14&RC[-19])&IF(RC[-18]="",,"|n"&R1C15&RC[-18])&IF(RC[-17]="",,"|n"&R1C16&RC[-17])&IF(RC[-16]="",,"|n"&R1C17&RC[-16])&IF(RC[-15]="",,"|n"&R1C18&RC[-15])&IF(RC[-14]="",,"|n"&R1C19&RC[-14])&IF(RC[-13]="",,"|n"&R1C20&RC[-13])&IF(RC[-12]="",,"|n"&R1C21&RC[-12])&IF(RC[-10]="",,"|n"&R1C23&RC[-10])&IF(RC[-9]="",,"|n"&R1C24&RC[-9])&IF(RC[-8]="",,"|n"&R1C25&RC[-8])&IF(RC[-7]="",,"|n"&R1C26&RC[-7])&IF(RC[-6]="",,"|n"&R1C27&RC[-6])&IF(RC[-5]="",,"|n"&R1C28&RC[-5])&IF(RC[-2]="",,"|n"&RC[-2]) -> 
AG981: =IF(RC[-26]&RC[-25]&RC[-24]&RC[-23]&RC[-22]&RC[-21]="",,R1C6)&IF(RC[-26]="",,"|n"&R1C7&RC[-26])&IF(RC[-25]="",,"|n"&R1C8&RC[-25])&IF(RC[-24]="",,"|n"&R1C9&RC[-24])&IF(RC[-23]="",,"|n"&R1C10&RC[-23])&IF(RC[-22]="",,"|n"&R1C11&RC[-22])&IF(RC[-21]="",,"|n"&R1C12&RC[-21])&IF(RC[-19]&RC[-18]&RC[-17]&RC[-16]="",,"|n"&R1C13)&IF(RC[-19]="",,"|n"&R1C14&RC[-19])&IF(RC[-18]="",,"|n"&R1C15&RC[-18])&IF(RC[-17]="",,"|n"&R1C16&RC[-17])&IF(RC[-16]="",,"|n"&R1C17&RC[-16])&IF(RC[-15]="",,"|n"&R1C18&RC[-15])&IF(RC[-14]="",,"|n"&R1C19&RC[-14])&IF(RC[-13]="",,"|n"&R1C20&RC[-13])&IF(RC[-12]="",,"|n"&R1C21&RC[-12])&IF(RC[-10]="",,"|n"&R1C23&RC[-10])&IF(RC[-9]="",,"|n"&R1C24&RC[-9])&IF(RC[-8]="",,"|n"&R1C25&RC[-8])&IF(RC[-7]="",,"|n"&R1C26&RC[-7])&IF(RC[-6]="",,"|n"&R1C27&RC[-6])&IF(RC[-5]="",,"|n"&R1C28&RC[-5])&IF(RC[-2]="",,"|n"&RC[-2]) -> 
AG982: =IF(RC[-26]&RC[-25]&RC[-24]&RC[-23]&RC[-22]&RC[-21]="",,R1C6)&IF(RC[-26]="",,"|n"&R1C7&RC[-26])&IF(RC[-25]="",,"|n"&R1C8&RC[-25])&IF(RC[-24]="",,"|n"&R1C9&RC[-24])&IF(RC[-23]="",,"|n"&R1C10&RC[-23])&IF(RC[-22]="",,"|n"&R1C11&RC[-22])&IF(RC[-21]="",,"|n"&R1C12&RC[-21])&IF(RC[-19]&RC[-18]&RC[-17]&RC[-16]="",,"|n"&R1C13)&IF(RC[-19]="",,"|n"&R1C14&RC[-19])&IF(RC[-18]="",,"|n"&R1C15&RC[-18])&IF(RC[-17]="",,"|n"&R1C16&RC[-17])&IF(RC[-16]="",,"|n"&R1C17&RC[-16])&IF(RC[-15]="",,"|n"&R1C18&RC[-15])&IF(RC[-14]="",,"|n"&R1C19&RC[-14])&IF(RC[-13]="",,"|n"&R1C20&RC[-13])&IF(RC[-12]="",,"|n"&R1C21&RC[-12])&IF(RC[-10]="",,"|n"&R1C23&RC[-10])&IF(RC[-9]="",,"|n"&R1C24&RC[-9])&IF(RC[-8]="",,"|n"&R1C25&RC[-8])&IF(RC[-7]="",,"|n"&R1C26&RC[-7])&IF(RC[-6]="",,"|n"&R1C27&RC[-6])&IF(RC[-5]="",,"|n"&R1C28&RC[-5])&IF(RC[-2]="",,"|n"&RC[-2]) -> 
AG983: =IF(RC[-26]&RC[-25]&RC[-24]&RC[-23]&RC[-22]&RC[-21]="",,R1C6)&IF(RC[-26]="",,"|n"&R1C7&RC[-26])&IF(RC[-25]="",,"|n"&R1C8&RC[-25])&IF(RC[-24]="",,"|n"&R1C9&RC[-24])&IF(RC[-23]="",,"|n"&R1C10&RC[-23])&IF(RC[-22]="",,"|n"&R1C11&RC[-22])&IF(RC[-21]="",,"|n"&R1C12&RC[-21])&IF(RC[-19]&RC[-18]&RC[-17]&RC[-16]="",,"|n"&R1C13)&IF(RC[-19]="",,"|n"&R1C14&RC[-19])&IF(RC[-18]="",,"|n"&R1C15&RC[-18])&IF(RC[-17]="",,"|n"&R1C16&RC[-17])&IF(RC[-16]="",,"|n"&R1C17&RC[-16])&IF(RC[-15]="",,"|n"&R1C18&RC[-15])&IF(RC[-14]="",,"|n"&R1C19&RC[-14])&IF(RC[-13]="",,"|n"&R1C20&RC[-13])&IF(RC[-12]="",,"|n"&R1C21&RC[-12])&IF(RC[-10]="",,"|n"&R1C23&RC[-10])&IF(RC[-9]="",,"|n"&R1C24&RC[-9])&IF(RC[-8]="",,"|n"&R1C25&RC[-8])&IF(RC[-7]="",,"|n"&R1C26&RC[-7])&IF(RC[-6]="",,"|n"&R1C27&RC[-6])&IF(RC[-5]="",,"|n"&R1C28&RC[-5])&IF(RC[-2]="",,"|n"&RC[-2]) -> 
AG984: =IF(RC[-26]&RC[-25]&RC[-24]&RC[-23]&RC[-22]&RC[-21]="",,R1C6)&IF(RC[-26]="",,"|n"&R1C7&RC[-26])&IF(RC[-25]="",,"|n"&R1C8&RC[-25])&IF(RC[-24]="",,"|n"&R1C9&RC[-24])&IF(RC[-23]="",,"|n"&R1C10&RC[-23])&IF(RC[-22]="",,"|n"&R1C11&RC[-22])&IF(RC[-21]="",,"|n"&R1C12&RC[-21])&IF(RC[-19]&RC[-18]&RC[-17]&RC[-16]="",,"|n"&R1C13)&IF(RC[-19]="",,"|n"&R1C14&RC[-19])&IF(RC[-18]="",,"|n"&R1C15&RC[-18])&IF(RC[-17]="",,"|n"&R1C16&RC[-17])&IF(RC[-16]="",,"|n"&R1C17&RC[-16])&IF(RC[-15]="",,"|n"&R1C18&RC[-15])&IF(RC[-14]="",,"|n"&R1C19&RC[-14])&IF(RC[-13]="",,"|n"&R1C20&RC[-13])&IF(RC[-12]="",,"|n"&R1C21&RC[-12])&IF(RC[-10]="",,"|n"&R1C23&RC[-10])&IF(RC[-9]="",,"|n"&R1C24&RC[-9])&IF(RC[-8]="",,"|n"&R1C25&RC[-8])&IF(RC[-7]="",,"|n"&R1C26&RC[-7])&IF(RC[-6]="",,"|n"&R1C27&RC[-6])&IF(RC[-5]="",,"|n"&R1C28&RC[-5])&IF(RC[-2]="",,"|n"&RC[-2]) -> 
AG985: =IF(RC[-26]&RC[-25]&RC[-24]&RC[-23]&RC[-22]&RC[-21]="",,R1C6)&IF(RC[-26]="",,"|n"&R1C7&RC[-26])&IF(RC[-25]="",,"|n"&R1C8&RC[-25])&IF(RC[-24]="",,"|n"&R1C9&RC[-24])&IF(RC[-23]="",,"|n"&R1C10&RC[-23])&IF(RC[-22]="",,"|n"&R1C11&RC[-22])&IF(RC[-21]="",,"|n"&R1C12&RC[-21])&IF(RC[-19]&RC[-18]&RC[-17]&RC[-16]="",,"|n"&R1C13)&IF(RC[-19]="",,"|n"&R1C14&RC[-19])&IF(RC[-18]="",,"|n"&R1C15&RC[-18])&IF(RC[-17]="",,"|n"&R1C16&RC[-17])&IF(RC[-16]="",,"|n"&R1C17&RC[-16])&IF(RC[-15]="",,"|n"&R1C18&RC[-15])&IF(RC[-14]="",,"|n"&R1C19&RC[-14])&IF(RC[-13]="",,"|n"&R1C20&RC[-13])&IF(RC[-12]="",,"|n"&R1C21&RC[-12])&IF(RC[-10]="",,"|n"&R1C23&RC[-10])&IF(RC[-9]="",,"|n"&R1C24&RC[-9])&IF(RC[-8]="",,"|n"&R1C25&RC[-8])&IF(RC[-7]="",,"|n"&R1C26&RC[-7])&IF(RC[-6]="",,"|n"&R1C27&RC[-6])&IF(RC[-5]="",,"|n"&R1C28&RC[-5])&IF(RC[-2]="",,"|n"&RC[-2]) -> 
AG986: =IF(RC[-26]&RC[-25]&RC[-24]&RC[-23]&RC[-22]&RC[-21]="",,R1C6)&IF(RC[-26]="",,"|n"&R1C7&RC[-26])&IF(RC[-25]="",,"|n"&R1C8&RC[-25])&IF(RC[-24]="",,"|n"&R1C9&RC[-24])&IF(RC[-23]="",,"|n"&R1C10&RC[-23])&IF(RC[-22]="",,"|n"&R1C11&RC[-22])&IF(RC[-21]="",,"|n"&R1C12&RC[-21])&IF(RC[-19]&RC[-18]&RC[-17]&RC[-16]="",,"|n"&R1C13)&IF(RC[-19]="",,"|n"&R1C14&RC[-19])&IF(RC[-18]="",,"|n"&R1C15&RC[-18])&IF(RC[-17]="",,"|n"&R1C16&RC[-17])&IF(RC[-16]="",,"|n"&R1C17&RC[-16])&IF(RC[-15]="",,"|n"&R1C18&RC[-15])&IF(RC[-14]="",,"|n"&R1C19&RC[-14])&IF(RC[-13]="",,"|n"&R1C20&RC[-13])&IF(RC[-12]="",,"|n"&R1C21&RC[-12])&IF(RC[-10]="",,"|n"&R1C23&RC[-10])&IF(RC[-9]="",,"|n"&R1C24&RC[-9])&IF(RC[-8]="",,"|n"&R1C25&RC[-8])&IF(RC[-7]="",,"|n"&R1C26&RC[-7])&IF(RC[-6]="",,"|n"&R1C27&RC[-6])&IF(RC[-5]="",,"|n"&R1C28&RC[-5])&IF(RC[-2]="",,"|n"&RC[-2]) -> 
AG987: =IF(RC[-26]&RC[-25]&RC[-24]&RC[-23]&RC[-22]&RC[-21]="",,R1C6)&IF(RC[-26]="",,"|n"&R1C7&RC[-26])&IF(RC[-25]="",,"|n"&R1C8&RC[-25])&IF(RC[-24]="",,"|n"&R1C9&RC[-24])&IF(RC[-23]="",,"|n"&R1C10&RC[-23])&IF(RC[-22]="",,"|n"&R1C11&RC[-22])&IF(RC[-21]="",,"|n"&R1C12&RC[-21])&IF(RC[-19]&RC[-18]&RC[-17]&RC[-16]="",,"|n"&R1C13)&IF(RC[-19]="",,"|n"&R1C14&RC[-19])&IF(RC[-18]="",,"|n"&R1C15&RC[-18])&IF(RC[-17]="",,"|n"&R1C16&RC[-17])&IF(RC[-16]="",,"|n"&R1C17&RC[-16])&IF(RC[-15]="",,"|n"&R1C18&RC[-15])&IF(RC[-14]="",,"|n"&R1C19&RC[-14])&IF(RC[-13]="",,"|n"&R1C20&RC[-13])&IF(RC[-12]="",,"|n"&R1C21&RC[-12])&IF(RC[-10]="",,"|n"&R1C23&RC[-10])&IF(RC[-9]="",,"|n"&R1C24&RC[-9])&IF(RC[-8]="",,"|n"&R1C25&RC[-8])&IF(RC[-7]="",,"|n"&R1C26&RC[-7])&IF(RC[-6]="",,"|n"&R1C27&RC[-6])&IF(RC[-5]="",,"|n"&R1C28&RC[-5])&IF(RC[-2]="",,"|n"&RC[-2]) -> 
AG988: =IF(RC[-26]&RC[-25]&RC[-24]&RC[-23]&RC[-22]&RC[-21]="",,R1C6)&IF(RC[-26]="",,"|n"&R1C7&RC[-26])&IF(RC[-25]="",,"|n"&R1C8&RC[-25])&IF(RC[-24]="",,"|n"&R1C9&RC[-24])&IF(RC[-23]="",,"|n"&R1C10&RC[-23])&IF(RC[-22]="",,"|n"&R1C11&RC[-22])&IF(RC[-21]="",,"|n"&R1C12&RC[-21])&IF(RC[-19]&RC[-18]&RC[-17]&RC[-16]="",,"|n"&R1C13)&IF(RC[-19]="",,"|n"&R1C14&RC[-19])&IF(RC[-18]="",,"|n"&R1C15&RC[-18])&IF(RC[-17]="",,"|n"&R1C16&RC[-17])&IF(RC[-16]="",,"|n"&R1C17&RC[-16])&IF(RC[-15]="",,"|n"&R1C18&RC[-15])&IF(RC[-14]="",,"|n"&R1C19&RC[-14])&IF(RC[-13]="",,"|n"&R1C20&RC[-13])&IF(RC[-12]="",,"|n"&R1C21&RC[-12])&IF(RC[-10]="",,"|n"&R1C23&RC[-10])&IF(RC[-9]="",,"|n"&R1C24&RC[-9])&IF(RC[-8]="",,"|n"&R1C25&RC[-8])&IF(RC[-7]="",,"|n"&R1C26&RC[-7])&IF(RC[-6]="",,"|n"&R1C27&RC[-6])&IF(RC[-5]="",,"|n"&R1C28&RC[-5])&IF(RC[-2]="",,"|n"&RC[-2]) -> 
AG989: =IF(RC[-26]&RC[-25]&RC[-24]&RC[-23]&RC[-22]&RC[-21]="",,R1C6)&IF(RC[-26]="",,"|n"&R1C7&RC[-26])&IF(RC[-25]="",,"|n"&R1C8&RC[-25])&IF(RC[-24]="",,"|n"&R1C9&RC[-24])&IF(RC[-23]="",,"|n"&R1C10&RC[-23])&IF(RC[-22]="",,"|n"&R1C11&RC[-22])&IF(RC[-21]="",,"|n"&R1C12&RC[-21])&IF(RC[-19]&RC[-18]&RC[-17]&RC[-16]="",,"|n"&R1C13)&IF(RC[-19]="",,"|n"&R1C14&RC[-19])&IF(RC[-18]="",,"|n"&R1C15&RC[-18])&IF(RC[-17]="",,"|n"&R1C16&RC[-17])&IF(RC[-16]="",,"|n"&R1C17&RC[-16])&IF(RC[-15]="",,"|n"&R1C18&RC[-15])&IF(RC[-14]="",,"|n"&R1C19&RC[-14])&IF(RC[-13]="",,"|n"&R1C20&RC[-13])&IF(RC[-12]="",,"|n"&R1C21&RC[-12])&IF(RC[-10]="",,"|n"&R1C23&RC[-10])&IF(RC[-9]="",,"|n"&R1C24&RC[-9])&IF(RC[-8]="",,"|n"&R1C25&RC[-8])&IF(RC[-7]="",,"|n"&R1C26&RC[-7])&IF(RC[-6]="",,"|n"&R1C27&RC[-6])&IF(RC[-5]="",,"|n"&R1C28&RC[-5])&IF(RC[-2]="",,"|n"&RC[-2]) -> 
AG990: =IF(RC[-26]&RC[-25]&RC[-24]&RC[-23]&RC[-22]&RC[-21]="",,R1C6)&IF(RC[-26]="",,"|n"&R1C7&RC[-26])&IF(RC[-25]="",,"|n"&R1C8&RC[-25])&IF(RC[-24]="",,"|n"&R1C9&RC[-24])&IF(RC[-23]="",,"|n"&R1C10&RC[-23])&IF(RC[-22]="",,"|n"&R1C11&RC[-22])&IF(RC[-21]="",,"|n"&R1C12&RC[-21])&IF(RC[-19]&RC[-18]&RC[-17]&RC[-16]="",,"|n"&R1C13)&IF(RC[-19]="",,"|n"&R1C14&RC[-19])&IF(RC[-18]="",,"|n"&R1C15&RC[-18])&IF(RC[-17]="",,"|n"&R1C16&RC[-17])&IF(RC[-16]="",,"|n"&R1C17&RC[-16])&IF(RC[-15]="",,"|n"&R1C18&RC[-15])&IF(RC[-14]="",,"|n"&R1C19&RC[-14])&IF(RC[-13]="",,"|n"&R1C20&RC[-13])&IF(RC[-12]="",,"|n"&R1C21&RC[-12])&IF(RC[-10]="",,"|n"&R1C23&RC[-10])&IF(RC[-9]="",,"|n"&R1C24&RC[-9])&IF(RC[-8]="",,"|n"&R1C25&RC[-8])&IF(RC[-7]="",,"|n"&R1C26&RC[-7])&IF(RC[-6]="",,"|n"&R1C27&RC[-6])&IF(RC[-5]="",,"|n"&R1C28&RC[-5])&IF(RC[-2]="",,"|n"&RC[-2]) -> 
AG991: =IF(RC[-26]&RC[-25]&RC[-24]&RC[-23]&RC[-22]&RC[-21]="",,R1C6)&IF(RC[-26]="",,"|n"&R1C7&RC[-26])&IF(RC[-25]="",,"|n"&R1C8&RC[-25])&IF(RC[-24]="",,"|n"&R1C9&RC[-24])&IF(RC[-23]="",,"|n"&R1C10&RC[-23])&IF(RC[-22]="",,"|n"&R1C11&RC[-22])&IF(RC[-21]="",,"|n"&R1C12&RC[-21])&IF(RC[-19]&RC[-18]&RC[-17]&RC[-16]="",,"|n"&R1C13)&IF(RC[-19]="",,"|n"&R1C14&RC[-19])&IF(RC[-18]="",,"|n"&R1C15&RC[-18])&IF(RC[-17]="",,"|n"&R1C16&RC[-17])&IF(RC[-16]="",,"|n"&R1C17&RC[-16])&IF(RC[-15]="",,"|n"&R1C18&RC[-15])&IF(RC[-14]="",,"|n"&R1C19&RC[-14])&IF(RC[-13]="",,"|n"&R1C20&RC[-13])&IF(RC[-12]="",,"|n"&R1C21&RC[-12])&IF(RC[-10]="",,"|n"&R1C23&RC[-10])&IF(RC[-9]="",,"|n"&R1C24&RC[-9])&IF(RC[-8]="",,"|n"&R1C25&RC[-8])&IF(RC[-7]="",,"|n"&R1C26&RC[-7])&IF(RC[-6]="",,"|n"&R1C27&RC[-6])&IF(RC[-5]="",,"|n"&R1C28&RC[-5])&IF(RC[-2]="",,"|n"&RC[-2]) -> 
AG992: =IF(RC[-26]&RC[-25]&RC[-24]&RC[-23]&RC[-22]&RC[-21]="",,R1C6)&IF(RC[-26]="",,"|n"&R1C7&RC[-26])&IF(RC[-25]="",,"|n"&R1C8&RC[-25])&IF(RC[-24]="",,"|n"&R1C9&RC[-24])&IF(RC[-23]="",,"|n"&R1C10&RC[-23])&IF(RC[-22]="",,"|n"&R1C11&RC[-22])&IF(RC[-21]="",,"|n"&R1C12&RC[-21])&IF(RC[-19]&RC[-18]&RC[-17]&RC[-16]="",,"|n"&R1C13)&IF(RC[-19]="",,"|n"&R1C14&RC[-19])&IF(RC[-18]="",,"|n"&R1C15&RC[-18])&IF(RC[-17]="",,"|n"&R1C16&RC[-17])&IF(RC[-16]="",,"|n"&R1C17&RC[-16])&IF(RC[-15]="",,"|n"&R1C18&RC[-15])&IF(RC[-14]="",,"|n"&R1C19&RC[-14])&IF(RC[-13]="",,"|n"&R1C20&RC[-13])&IF(RC[-12]="",,"|n"&R1C21&RC[-12])&IF(RC[-10]="",,"|n"&R1C23&RC[-10])&IF(RC[-9]="",,"|n"&R1C24&RC[-9])&IF(RC[-8]="",,"|n"&R1C25&RC[-8])&IF(RC[-7]="",,"|n"&R1C26&RC[-7])&IF(RC[-6]="",,"|n"&R1C27&RC[-6])&IF(RC[-5]="",,"|n"&R1C28&RC[-5])&IF(RC[-2]="",,"|n"&RC[-2]) -> 
AG993: =IF(RC[-26]&RC[-25]&RC[-24]&RC[-23]&RC[-22]&RC[-21]="",,R1C6)&IF(RC[-26]="",,"|n"&R1C7&RC[-26])&IF(RC[-25]="",,"|n"&R1C8&RC[-25])&IF(RC[-24]="",,"|n"&R1C9&RC[-24])&IF(RC[-23]="",,"|n"&R1C10&RC[-23])&IF(RC[-22]="",,"|n"&R1C11&RC[-22])&IF(RC[-21]="",,"|n"&R1C12&RC[-21])&IF(RC[-19]&RC[-18]&RC[-17]&RC[-16]="",,"|n"&R1C13)&IF(RC[-19]="",,"|n"&R1C14&RC[-19])&IF(RC[-18]="",,"|n"&R1C15&RC[-18])&IF(RC[-17]="",,"|n"&R1C16&RC[-17])&IF(RC[-16]="",,"|n"&R1C17&RC[-16])&IF(RC[-15]="",,"|n"&R1C18&RC[-15])&IF(RC[-14]="",,"|n"&R1C19&RC[-14])&IF(RC[-13]="",,"|n"&R1C20&RC[-13])&IF(RC[-12]="",,"|n"&R1C21&RC[-12])&IF(RC[-10]="",,"|n"&R1C23&RC[-10])&IF(RC[-9]="",,"|n"&R1C24&RC[-9])&IF(RC[-8]="",,"|n"&R1C25&RC[-8])&IF(RC[-7]="",,"|n"&R1C26&RC[-7])&IF(RC[-6]="",,"|n"&R1C27&RC[-6])&IF(RC[-5]="",,"|n"&R1C28&RC[-5])&IF(RC[-2]="",,"|n"&RC[-2]) -> 
AG994: =IF(RC[-26]&RC[-25]&RC[-24]&RC[-23]&RC[-22]&RC[-21]="",,R1C6)&IF(RC[-26]="",,"|n"&R1C7&RC[-26])&IF(RC[-25]="",,"|n"&R1C8&RC[-25])&IF(RC[-24]="",,"|n"&R1C9&RC[-24])&IF(RC[-23]="",,"|n"&R1C10&RC[-23])&IF(RC[-22]="",,"|n"&R1C11&RC[-22])&IF(RC[-21]="",,"|n"&R1C12&RC[-21])&IF(RC[-19]&RC[-18]&RC[-17]&RC[-16]="",,"|n"&R1C13)&IF(RC[-19]="",,"|n"&R1C14&RC[-19])&IF(RC[-18]="",,"|n"&R1C15&RC[-18])&IF(RC[-17]="",,"|n"&R1C16&RC[-17])&IF(RC[-16]="",,"|n"&R1C17&RC[-16])&IF(RC[-15]="",,"|n"&R1C18&RC[-15])&IF(RC[-14]="",,"|n"&R1C19&RC[-14])&IF(RC[-13]="",,"|n"&R1C20&RC[-13])&IF(RC[-12]="",,"|n"&R1C21&RC[-12])&IF(RC[-10]="",,"|n"&R1C23&RC[-10])&IF(RC[-9]="",,"|n"&R1C24&RC[-9])&IF(RC[-8]="",,"|n"&R1C25&RC[-8])&IF(RC[-7]="",,"|n"&R1C26&RC[-7])&IF(RC[-6]="",,"|n"&R1C27&RC[-6])&IF(RC[-5]="",,"|n"&R1C28&RC[-5])&IF(RC[-2]="",,"|n"&RC[-2]) -> 
AG995: =IF(RC[-26]&RC[-25]&RC[-24]&RC[-23]&RC[-22]&RC[-21]="",,R1C6)&IF(RC[-26]="",,"|n"&R1C7&RC[-26])&IF(RC[-25]="",,"|n"&R1C8&RC[-25])&IF(RC[-24]="",,"|n"&R1C9&RC[-24])&IF(RC[-23]="",,"|n"&R1C10&RC[-23])&IF(RC[-22]="",,"|n"&R1C11&RC[-22])&IF(RC[-21]="",,"|n"&R1C12&RC[-21])&IF(RC[-19]&RC[-18]&RC[-17]&RC[-16]="",,"|n"&R1C13)&IF(RC[-19]="",,"|n"&R1C14&RC[-19])&IF(RC[-18]="",,"|n"&R1C15&RC[-18])&IF(RC[-17]="",,"|n"&R1C16&RC[-17])&IF(RC[-16]="",,"|n"&R1C17&RC[-16])&IF(RC[-15]="",,"|n"&R1C18&RC[-15])&IF(RC[-14]="",,"|n"&R1C19&RC[-14])&IF(RC[-13]="",,"|n"&R1C20&RC[-13])&IF(RC[-12]="",,"|n"&R1C21&RC[-12])&IF(RC[-10]="",,"|n"&R1C23&RC[-10])&IF(RC[-9]="",,"|n"&R1C24&RC[-9])&IF(RC[-8]="",,"|n"&R1C25&RC[-8])&IF(RC[-7]="",,"|n"&R1C26&RC[-7])&IF(RC[-6]="",,"|n"&R1C27&RC[-6])&IF(RC[-5]="",,"|n"&R1C28&RC[-5])&IF(RC[-2]="",,"|n"&RC[-2]) -> 
AG996: =IF(RC[-26]&RC[-25]&RC[-24]&RC[-23]&RC[-22]&RC[-21]="",,R1C6)&IF(RC[-26]="",,"|n"&R1C7&RC[-26])&IF(RC[-25]="",,"|n"&R1C8&RC[-25])&IF(RC[-24]="",,"|n"&R1C9&RC[-24])&IF(RC[-23]="",,"|n"&R1C10&RC[-23])&IF(RC[-22]="",,"|n"&R1C11&RC[-22])&IF(RC[-21]="",,"|n"&R1C12&RC[-21])&IF(RC[-19]&RC[-18]&RC[-17]&RC[-16]="",,"|n"&R1C13)&IF(RC[-19]="",,"|n"&R1C14&RC[-19])&IF(RC[-18]="",,"|n"&R1C15&RC[-18])&IF(RC[-17]="",,"|n"&R1C16&RC[-17])&IF(RC[-16]="",,"|n"&R1C17&RC[-16])&IF(RC[-15]="",,"|n"&R1C18&RC[-15])&IF(RC[-14]="",,"|n"&R1C19&RC[-14])&IF(RC[-13]="",,"|n"&R1C20&RC[-13])&IF(RC[-12]="",,"|n"&R1C21&RC[-12])&IF(RC[-10]="",,"|n"&R1C23&RC[-10])&IF(RC[-9]="",,"|n"&R1C24&RC[-9])&IF(RC[-8]="",,"|n"&R1C25&RC[-8])&IF(RC[-7]="",,"|n"&R1C26&RC[-7])&IF(RC[-6]="",,"|n"&R1C27&RC[-6])&IF(RC[-5]="",,"|n"&R1C28&RC[-5])&IF(RC[-2]="",,"|n"&RC[-2]) -> 
AG997: =IF(RC[-26]&RC[-25]&RC[-24]&RC[-23]&RC[-22]&RC[-21]="",,R1C6)&IF(RC[-26]="",,"|n"&R1C7&RC[-26])&IF(RC[-25]="",,"|n"&R1C8&RC[-25])&IF(RC[-24]="",,"|n"&R1C9&RC[-24])&IF(RC[-23]="",,"|n"&R1C10&RC[-23])&IF(RC[-22]="",,"|n"&R1C11&RC[-22])&IF(RC[-21]="",,"|n"&R1C12&RC[-21])&IF(RC[-19]&RC[-18]&RC[-17]&RC[-16]="",,"|n"&R1C13)&IF(RC[-19]="",,"|n"&R1C14&RC[-19])&IF(RC[-18]="",,"|n"&R1C15&RC[-18])&IF(RC[-17]="",,"|n"&R1C16&RC[-17])&IF(RC[-16]="",,"|n"&R1C17&RC[-16])&IF(RC[-15]="",,"|n"&R1C18&RC[-15])&IF(RC[-14]="",,"|n"&R1C19&RC[-14])&IF(RC[-13]="",,"|n"&R1C20&RC[-13])&IF(RC[-12]="",,"|n"&R1C21&RC[-12])&IF(RC[-10]="",,"|n"&R1C23&RC[-10])&IF(RC[-9]="",,"|n"&R1C24&RC[-9])&IF(RC[-8]="",,"|n"&R1C25&RC[-8])&IF(RC[-7]="",,"|n"&R1C26&RC[-7])&IF(RC[-6]="",,"|n"&R1C27&RC[-6])&IF(RC[-5]="",,"|n"&R1C28&RC[-5])&IF(RC[-2]="",,"|n"&RC[-2]) -> 
AG998: =IF(RC[-26]&RC[-25]&RC[-24]&RC[-23]&RC[-22]&RC[-21]="",,R1C6)&IF(RC[-26]="",,"|n"&R1C7&RC[-26])&IF(RC[-25]="",,"|n"&R1C8&RC[-25])&IF(RC[-24]="",,"|n"&R1C9&RC[-24])&IF(RC[-23]="",,"|n"&R1C10&RC[-23])&IF(RC[-22]="",,"|n"&R1C11&RC[-22])&IF(RC[-21]="",,"|n"&R1C12&RC[-21])&IF(RC[-19]&RC[-18]&RC[-17]&RC[-16]="",,"|n"&R1C13)&IF(RC[-19]="",,"|n"&R1C14&RC[-19])&IF(RC[-18]="",,"|n"&R1C15&RC[-18])&IF(RC[-17]="",,"|n"&R1C16&RC[-17])&IF(RC[-16]="",,"|n"&R1C17&RC[-16])&IF(RC[-15]="",,"|n"&R1C18&RC[-15])&IF(RC[-14]="",,"|n"&R1C19&RC[-14])&IF(RC[-13]="",,"|n"&R1C20&RC[-13])&IF(RC[-12]="",,"|n"&R1C21&RC[-12])&IF(RC[-10]="",,"|n"&R1C23&RC[-10])&IF(RC[-9]="",,"|n"&R1C24&RC[-9])&IF(RC[-8]="",,"|n"&R1C25&RC[-8])&IF(RC[-7]="",,"|n"&R1C26&RC[-7])&IF(RC[-6]="",,"|n"&R1C27&RC[-6])&IF(RC[-5]="",,"|n"&R1C28&RC[-5])&IF(RC[-2]="",,"|n"&RC[-2]) -> 
AG999: =IF(RC[-26]&RC[-25]&RC[-24]&RC[-23]&RC[-22]&RC[-21]="",,R1C6)&IF(RC[-26]="",,"|n"&R1C7&RC[-26])&IF(RC[-25]="",,"|n"&R1C8&RC[-25])&IF(RC[-24]="",,"|n"&R1C9&RC[-24])&IF(RC[-23]="",,"|n"&R1C10&RC[-23])&IF(RC[-22]="",,"|n"&R1C11&RC[-22])&IF(RC[-21]="",,"|n"&R1C12&RC[-21])&IF(RC[-19]&RC[-18]&RC[-17]&RC[-16]="",,"|n"&R1C13)&IF(RC[-19]="",,"|n"&R1C14&RC[-19])&IF(RC[-18]="",,"|n"&R1C15&RC[-18])&IF(RC[-17]="",,"|n"&R1C16&RC[-17])&IF(RC[-16]="",,"|n"&R1C17&RC[-16])&IF(RC[-15]="",,"|n"&R1C18&RC[-15])&IF(RC[-14]="",,"|n"&R1C19&RC[-14])&IF(RC[-13]="",,"|n"&R1C20&RC[-13])&IF(RC[-12]="",,"|n"&R1C21&RC[-12])&IF(RC[-10]="",,"|n"&R1C23&RC[-10])&IF(RC[-9]="",,"|n"&R1C24&RC[-9])&IF(RC[-8]="",,"|n"&R1C25&RC[-8])&IF(RC[-7]="",,"|n"&R1C26&RC[-7])&IF(RC[-6]="",,"|n"&R1C27&RC[-6])&IF(RC[-5]="",,"|n"&R1C28&RC[-5])&IF(RC[-2]="",,"|n"&RC[-2]) -> 
AG1000: =IF(RC[-26]&RC[-25]&RC[-24]&RC[-23]&RC[-22]&RC[-21]="",,R1C6)&IF(RC[-26]="",,"|n"&R1C7&RC[-26])&IF(RC[-25]="",,"|n"&R1C8&RC[-25])&IF(RC[-24]="",,"|n"&R1C9&RC[-24])&IF(RC[-23]="",,"|n"&R1C10&RC[-23])&IF(RC[-22]="",,"|n"&R1C11&RC[-22])&IF(RC[-21]="",,"|n"&R1C12&RC[-21])&IF(RC[-19]&RC[-18]&RC[-17]&RC[-16]="",,"|n"&R1C13)&IF(RC[-19]="",,"|n"&R1C14&RC[-19])&IF(RC[-18]="",,"|n"&R1C15&RC[-18])&IF(RC[-17]="",,"|n"&R1C16&RC[-17])&IF(RC[-16]="",,"|n"&R1C17&RC[-16])&IF(RC[-15]="",,"|n"&R1C18&RC[-15])&IF(RC[-14]="",,"|n"&R1C19&RC[-14])&IF(RC[-13]="",,"|n"&R1C20&RC[-13])&IF(RC[-12]="",,"|n"&R1C21&RC[-12])&IF(RC[-10]="",,"|n"&R1C23&RC[-10])&IF(RC[-9]="",,"|n"&R1C24&RC[-9])&IF(RC[-8]="",,"|n"&R1C25&RC[-8])&IF(RC[-7]="",,"|n"&R1C26&RC[-7])&IF(RC[-6]="",,"|n"&R1C27&RC[-6])&IF(RC[-5]="",,"|n"&R1C28&RC[-5])&IF(RC[-2]="",,"|n"&RC[-2]) -> 
AG1001: =IF(RC[-26]&RC[-25]&RC[-24]&RC[-23]&RC[-22]&RC[-21]="",,R1C6)&IF(RC[-26]="",,"|n"&R1C7&RC[-26])&IF(RC[-25]="",,"|n"&R1C8&RC[-25])&IF(RC[-24]="",,"|n"&R1C9&RC[-24])&IF(RC[-23]="",,"|n"&R1C10&RC[-23])&IF(RC[-22]="",,"|n"&R1C11&RC[-22])&IF(RC[-21]="",,"|n"&R1C12&RC[-21])&IF(RC[-19]&RC[-18]&RC[-17]&RC[-16]="",,"|n"&R1C13)&IF(RC[-19]="",,"|n"&R1C14&RC[-19])&IF(RC[-18]="",,"|n"&R1C15&RC[-18])&IF(RC[-17]="",,"|n"&R1C16&RC[-17])&IF(RC[-16]="",,"|n"&R1C17&RC[-16])&IF(RC[-15]="",,"|n"&R1C18&RC[-15])&IF(RC[-14]="",,"|n"&R1C19&RC[-14])&IF(RC[-13]="",,"|n"&R1C20&RC[-13])&IF(RC[-12]="",,"|n"&R1C21&RC[-12])&IF(RC[-10]="",,"|n"&R1C23&RC[-10])&IF(RC[-9]="",,"|n"&R1C24&RC[-9])&IF(RC[-8]="",,"|n"&R1C25&RC[-8])&IF(RC[-7]="",,"|n"&R1C26&RC[-7])&IF(RC[-6]="",,"|n"&R1C27&RC[-6])&IF(RC[-5]="",,"|n"&R1C28&RC[-5])&IF(RC[-2]="",,"|n"&RC[-2]) -> 
AG1002: =IF(RC[-26]&RC[-25]&RC[-24]&RC[-23]&RC[-22]&RC[-21]="",,R1C6)&IF(RC[-26]="",,"|n"&R1C7&RC[-26])&IF(RC[-25]="",,"|n"&R1C8&RC[-25])&IF(RC[-24]="",,"|n"&R1C9&RC[-24])&IF(RC[-23]="",,"|n"&R1C10&RC[-23])&IF(RC[-22]="",,"|n"&R1C11&RC[-22])&IF(RC[-21]="",,"|n"&R1C12&RC[-21])&IF(RC[-19]&RC[-18]&RC[-17]&RC[-16]="",,"|n"&R1C13)&IF(RC[-19]="",,"|n"&R1C14&RC[-19])&IF(RC[-18]="",,"|n"&R1C15&RC[-18])&IF(RC[-17]="",,"|n"&R1C16&RC[-17])&IF(RC[-16]="",,"|n"&R1C17&RC[-16])&IF(RC[-15]="",,"|n"&R1C18&RC[-15])&IF(RC[-14]="",,"|n"&R1C19&RC[-14])&IF(RC[-13]="",,"|n"&R1C20&RC[-13])&IF(RC[-12]="",,"|n"&R1C21&RC[-12])&IF(RC[-10]="",,"|n"&R1C23&RC[-10])&IF(RC[-9]="",,"|n"&R1C24&RC[-9])&IF(RC[-8]="",,"|n"&R1C25&RC[-8])&IF(RC[-7]="",,"|n"&R1C26&RC[-7])&IF(RC[-6]="",,"|n"&R1C27&RC[-6])&IF(RC[-5]="",,"|n"&R1C28&RC[-5])&IF(RC[-2]="",,"|n"&RC[-2]) -> 
AG1003: =IF(RC[-26]&RC[-25]&RC[-24]&RC[-23]&RC[-22]&RC[-21]="",,R1C6)&IF(RC[-26]="",,"|n"&R1C7&RC[-26])&IF(RC[-25]="",,"|n"&R1C8&RC[-25])&IF(RC[-24]="",,"|n"&R1C9&RC[-24])&IF(RC[-23]="",,"|n"&R1C10&RC[-23])&IF(RC[-22]="",,"|n"&R1C11&RC[-22])&IF(RC[-21]="",,"|n"&R1C12&RC[-21])&IF(RC[-19]&RC[-18]&RC[-17]&RC[-16]="",,"|n"&R1C13)&IF(RC[-19]="",,"|n"&R1C14&RC[-19])&IF(RC[-18]="",,"|n"&R1C15&RC[-18])&IF(RC[-17]="",,"|n"&R1C16&RC[-17])&IF(RC[-16]="",,"|n"&R1C17&RC[-16])&IF(RC[-15]="",,"|n"&R1C18&RC[-15])&IF(RC[-14]="",,"|n"&R1C19&RC[-14])&IF(RC[-13]="",,"|n"&R1C20&RC[-13])&IF(RC[-12]="",,"|n"&R1C21&RC[-12])&IF(RC[-10]="",,"|n"&R1C23&RC[-10])&IF(RC[-9]="",,"|n"&R1C24&RC[-9])&IF(RC[-8]="",,"|n"&R1C25&RC[-8])&IF(RC[-7]="",,"|n"&R1C26&RC[-7])&IF(RC[-6]="",,"|n"&R1C27&RC[-6])&IF(RC[-5]="",,"|n"&R1C28&RC[-5])&IF(RC[-2]="",,"|n"&RC[-2]) -> 
AG1004: =IF(RC[-26]&RC[-25]&RC[-24]&RC[-23]&RC[-22]&RC[-21]="",,R1C6)&IF(RC[-26]="",,"|n"&R1C7&RC[-26])&IF(RC[-25]="",,"|n"&R1C8&RC[-25])&IF(RC[-24]="",,"|n"&R1C9&RC[-24])&IF(RC[-23]="",,"|n"&R1C10&RC[-23])&IF(RC[-22]="",,"|n"&R1C11&RC[-22])&IF(RC[-21]="",,"|n"&R1C12&RC[-21])&IF(RC[-19]&RC[-18]&RC[-17]&RC[-16]="",,"|n"&R1C13)&IF(RC[-19]="",,"|n"&R1C14&RC[-19])&IF(RC[-18]="",,"|n"&R1C15&RC[-18])&IF(RC[-17]="",,"|n"&R1C16&RC[-17])&IF(RC[-16]="",,"|n"&R1C17&RC[-16])&IF(RC[-15]="",,"|n"&R1C18&RC[-15])&IF(RC[-14]="",,"|n"&R1C19&RC[-14])&IF(RC[-13]="",,"|n"&R1C20&RC[-13])&IF(RC[-12]="",,"|n"&R1C21&RC[-12])&IF(RC[-10]="",,"|n"&R1C23&RC[-10])&IF(RC[-9]="",,"|n"&R1C24&RC[-9])&IF(RC[-8]="",,"|n"&R1C25&RC[-8])&IF(RC[-7]="",,"|n"&R1C26&RC[-7])&IF(RC[-6]="",,"|n"&R1C27&RC[-6])&IF(RC[-5]="",,"|n"&R1C28&RC[-5])&IF(RC[-2]="",,"|n"&RC[-2]) -> 
AG1005: =IF(RC[-26]&RC[-25]&RC[-24]&RC[-23]&RC[-22]&RC[-21]="",,R1C6)&IF(RC[-26]="",,"|n"&R1C7&RC[-26])&IF(RC[-25]="",,"|n"&R1C8&RC[-25])&IF(RC[-24]="",,"|n"&R1C9&RC[-24])&IF(RC[-23]="",,"|n"&R1C10&RC[-23])&IF(RC[-22]="",,"|n"&R1C11&RC[-22])&IF(RC[-21]="",,"|n"&R1C12&RC[-21])&IF(RC[-19]&RC[-18]&RC[-17]&RC[-16]="",,"|n"&R1C13)&IF(RC[-19]="",,"|n"&R1C14&RC[-19])&IF(RC[-18]="",,"|n"&R1C15&RC[-18])&IF(RC[-17]="",,"|n"&R1C16&RC[-17])&IF(RC[-16]="",,"|n"&R1C17&RC[-16])&IF(RC[-15]="",,"|n"&R1C18&RC[-15])&IF(RC[-14]="",,"|n"&R1C19&RC[-14])&IF(RC[-13]="",,"|n"&R1C20&RC[-13])&IF(RC[-12]="",,"|n"&R1C21&RC[-12])&IF(RC[-10]="",,"|n"&R1C23&RC[-10])&IF(RC[-9]="",,"|n"&R1C24&RC[-9])&IF(RC[-8]="",,"|n"&R1C25&RC[-8])&IF(RC[-7]="",,"|n"&R1C26&RC[-7])&IF(RC[-6]="",,"|n"&R1C27&RC[-6])&IF(RC[-5]="",,"|n"&R1C28&RC[-5])&IF(RC[-2]="",,"|n"&RC[-2]) -> 
AG1006: =IF(RC[-26]&RC[-25]&RC[-24]&RC[-23]&RC[-22]&RC[-21]="",,R1C6)&IF(RC[-26]="",,"|n"&R1C7&RC[-26])&IF(RC[-25]="",,"|n"&R1C8&RC[-25])&IF(RC[-24]="",,"|n"&R1C9&RC[-24])&IF(RC[-23]="",,"|n"&R1C10&RC[-23])&IF(RC[-22]="",,"|n"&R1C11&RC[-22])&IF(RC[-21]="",,"|n"&R1C12&RC[-21])&IF(RC[-19]&RC[-18]&RC[-17]&RC[-16]="",,"|n"&R1C13)&IF(RC[-19]="",,"|n"&R1C14&RC[-19])&IF(RC[-18]="",,"|n"&R1C15&RC[-18])&IF(RC[-17]="",,"|n"&R1C16&RC[-17])&IF(RC[-16]="",,"|n"&R1C17&RC[-16])&IF(RC[-15]="",,"|n"&R1C18&RC[-15])&IF(RC[-14]="",,"|n"&R1C19&RC[-14])&IF(RC[-13]="",,"|n"&R1C20&RC[-13])&IF(RC[-12]="",,"|n"&R1C21&RC[-12])&IF(RC[-10]="",,"|n"&R1C23&RC[-10])&IF(RC[-9]="",,"|n"&R1C24&RC[-9])&IF(RC[-8]="",,"|n"&R1C25&RC[-8])&IF(RC[-7]="",,"|n"&R1C26&RC[-7])&IF(RC[-6]="",,"|n"&R1C27&RC[-6])&IF(RC[-5]="",,"|n"&R1C28&RC[-5])&IF(RC[-2]="",,"|n"&RC[-2]) -> 
AG1007: =IF(RC[-26]&RC[-25]&RC[-24]&RC[-23]&RC[-22]&RC[-21]="",,R1C6)&IF(RC[-26]="",,"|n"&R1C7&RC[-26])&IF(RC[-25]="",,"|n"&R1C8&RC[-25])&IF(RC[-24]="",,"|n"&R1C9&RC[-24])&IF(RC[-23]="",,"|n"&R1C10&RC[-23])&IF(RC[-22]="",,"|n"&R1C11&RC[-22])&IF(RC[-21]="",,"|n"&R1C12&RC[-21])&IF(RC[-19]&RC[-18]&RC[-17]&RC[-16]="",,"|n"&R1C13)&IF(RC[-19]="",,"|n"&R1C14&RC[-19])&IF(RC[-18]="",,"|n"&R1C15&RC[-18])&IF(RC[-17]="",,"|n"&R1C16&RC[-17])&IF(RC[-16]="",,"|n"&R1C17&RC[-16])&IF(RC[-15]="",,"|n"&R1C18&RC[-15])&IF(RC[-14]="",,"|n"&R1C19&RC[-14])&IF(RC[-13]="",,"|n"&R1C20&RC[-13])&IF(RC[-12]="",,"|n"&R1C21&RC[-12])&IF(RC[-10]="",,"|n"&R1C23&RC[-10])&IF(RC[-9]="",,"|n"&R1C24&RC[-9])&IF(RC[-8]="",,"|n"&R1C25&RC[-8])&IF(RC[-7]="",,"|n"&R1C26&RC[-7])&IF(RC[-6]="",,"|n"&R1C27&RC[-6])&IF(RC[-5]="",,"|n"&R1C28&RC[-5])&IF(RC[-2]="",,"|n"&RC[-2]) -> 
AG1008: =IF(RC[-26]&RC[-25]&RC[-24]&RC[-23]&RC[-22]&RC[-21]="",,R1C6)&IF(RC[-26]="",,"|n"&R1C7&RC[-26])&IF(RC[-25]="",,"|n"&R1C8&RC[-25])&IF(RC[-24]="",,"|n"&R1C9&RC[-24])&IF(RC[-23]="",,"|n"&R1C10&RC[-23])&IF(RC[-22]="",,"|n"&R1C11&RC[-22])&IF(RC[-21]="",,"|n"&R1C12&RC[-21])&IF(RC[-19]&RC[-18]&RC[-17]&RC[-16]="",,"|n"&R1C13)&IF(RC[-19]="",,"|n"&R1C14&RC[-19])&IF(RC[-18]="",,"|n"&R1C15&RC[-18])&IF(RC[-17]="",,"|n"&R1C16&RC[-17])&IF(RC[-16]="",,"|n"&R1C17&RC[-16])&IF(RC[-15]="",,"|n"&R1C18&RC[-15])&IF(RC[-14]="",,"|n"&R1C19&RC[-14])&IF(RC[-13]="",,"|n"&R1C20&RC[-13])&IF(RC[-12]="",,"|n"&R1C21&RC[-12])&IF(RC[-10]="",,"|n"&R1C23&RC[-10])&IF(RC[-9]="",,"|n"&R1C24&RC[-9])&IF(RC[-8]="",,"|n"&R1C25&RC[-8])&IF(RC[-7]="",,"|n"&R1C26&RC[-7])&IF(RC[-6]="",,"|n"&R1C27&RC[-6])&IF(RC[-5]="",,"|n"&R1C28&RC[-5])&IF(RC[-2]="",,"|n"&RC[-2]) -> 
AG1009: =IF(RC[-26]&RC[-25]&RC[-24]&RC[-23]&RC[-22]&RC[-21]="",,R1C6)&IF(RC[-26]="",,"|n"&R1C7&RC[-26])&IF(RC[-25]="",,"|n"&R1C8&RC[-25])&IF(RC[-24]="",,"|n"&R1C9&RC[-24])&IF(RC[-23]="",,"|n"&R1C10&RC[-23])&IF(RC[-22]="",,"|n"&R1C11&RC[-22])&IF(RC[-21]="",,"|n"&R1C12&RC[-21])&IF(RC[-19]&RC[-18]&RC[-17]&RC[-16]="",,"|n"&R1C13)&IF(RC[-19]="",,"|n"&R1C14&RC[-19])&IF(RC[-18]="",,"|n"&R1C15&RC[-18])&IF(RC[-17]="",,"|n"&R1C16&RC[-17])&IF(RC[-16]="",,"|n"&R1C17&RC[-16])&IF(RC[-15]="",,"|n"&R1C18&RC[-15])&IF(RC[-14]="",,"|n"&R1C19&RC[-14])&IF(RC[-13]="",,"|n"&R1C20&RC[-13])&IF(RC[-12]="",,"|n"&R1C21&RC[-12])&IF(RC[-10]="",,"|n"&R1C23&RC[-10])&IF(RC[-9]="",,"|n"&R1C24&RC[-9])&IF(RC[-8]="",,"|n"&R1C25&RC[-8])&IF(RC[-7]="",,"|n"&R1C26&RC[-7])&IF(RC[-6]="",,"|n"&R1C27&RC[-6])&IF(RC[-5]="",,"|n"&R1C28&RC[-5])&IF(RC[-2]="",,"|n"&RC[-2]) -> 
AG1010: =IF(RC[-26]&RC[-25]&RC[-24]&RC[-23]&RC[-22]&RC[-21]="",,R1C6)&IF(RC[-26]="",,"|n"&R1C7&RC[-26])&IF(RC[-25]="",,"|n"&R1C8&RC[-25])&IF(RC[-24]="",,"|n"&R1C9&RC[-24])&IF(RC[-23]="",,"|n"&R1C10&RC[-23])&IF(RC[-22]="",,"|n"&R1C11&RC[-22])&IF(RC[-21]="",,"|n"&R1C12&RC[-21])&IF(RC[-19]&RC[-18]&RC[-17]&RC[-16]="",,"|n"&R1C13)&IF(RC[-19]="",,"|n"&R1C14&RC[-19])&IF(RC[-18]="",,"|n"&R1C15&RC[-18])&IF(RC[-17]="",,"|n"&R1C16&RC[-17])&IF(RC[-16]="",,"|n"&R1C17&RC[-16])&IF(RC[-15]="",,"|n"&R1C18&RC[-15])&IF(RC[-14]="",,"|n"&R1C19&RC[-14])&IF(RC[-13]="",,"|n"&R1C20&RC[-13])&IF(RC[-12]="",,"|n"&R1C21&RC[-12])&IF(RC[-10]="",,"|n"&R1C23&RC[-10])&IF(RC[-9]="",,"|n"&R1C24&RC[-9])&IF(RC[-8]="",,"|n"&R1C25&RC[-8])&IF(RC[-7]="",,"|n"&R1C26&RC[-7])&IF(RC[-6]="",,"|n"&R1C27&RC[-6])&IF(RC[-5]="",,"|n"&R1C28&RC[-5])&IF(RC[-2]="",,"|n"&RC[-2]) -> 
AG1011: =IF(RC[-26]&RC[-25]&RC[-24]&RC[-23]&RC[-22]&RC[-21]="",,R1C6)&IF(RC[-26]="",,"|n"&R1C7&RC[-26])&IF(RC[-25]="",,"|n"&R1C8&RC[-25])&IF(RC[-24]="",,"|n"&R1C9&RC[-24])&IF(RC[-23]="",,"|n"&R1C10&RC[-23])&IF(RC[-22]="",,"|n"&R1C11&RC[-22])&IF(RC[-21]="",,"|n"&R1C12&RC[-21])&IF(RC[-19]&RC[-18]&RC[-17]&RC[-16]="",,"|n"&R1C13)&IF(RC[-19]="",,"|n"&R1C14&RC[-19])&IF(RC[-18]="",,"|n"&R1C15&RC[-18])&IF(RC[-17]="",,"|n"&R1C16&RC[-17])&IF(RC[-16]="",,"|n"&R1C17&RC[-16])&IF(RC[-15]="",,"|n"&R1C18&RC[-15])&IF(RC[-14]="",,"|n"&R1C19&RC[-14])&IF(RC[-13]="",,"|n"&R1C20&RC[-13])&IF(RC[-12]="",,"|n"&R1C21&RC[-12])&IF(RC[-10]="",,"|n"&R1C23&RC[-10])&IF(RC[-9]="",,"|n"&R1C24&RC[-9])&IF(RC[-8]="",,"|n"&R1C25&RC[-8])&IF(RC[-7]="",,"|n"&R1C26&RC[-7])&IF(RC[-6]="",,"|n"&R1C27&RC[-6])&IF(RC[-5]="",,"|n"&R1C28&RC[-5])&IF(RC[-2]="",,"|n"&RC[-2]) -> 
AG1012: =IF(RC[-26]&RC[-25]&RC[-24]&RC[-23]&RC[-22]&RC[-21]="",,R1C6)&IF(RC[-26]="",,"|n"&R1C7&RC[-26])&IF(RC[-25]="",,"|n"&R1C8&RC[-25])&IF(RC[-24]="",,"|n"&R1C9&RC[-24])&IF(RC[-23]="",,"|n"&R1C10&RC[-23])&IF(RC[-22]="",,"|n"&R1C11&RC[-22])&IF(RC[-21]="",,"|n"&R1C12&RC[-21])&IF(RC[-19]&RC[-18]&RC[-17]&RC[-16]="",,"|n"&R1C13)&IF(RC[-19]="",,"|n"&R1C14&RC[-19])&IF(RC[-18]="",,"|n"&R1C15&RC[-18])&IF(RC[-17]="",,"|n"&R1C16&RC[-17])&IF(RC[-16]="",,"|n"&R1C17&RC[-16])&IF(RC[-15]="",,"|n"&R1C18&RC[-15])&IF(RC[-14]="",,"|n"&R1C19&RC[-14])&IF(RC[-13]="",,"|n"&R1C20&RC[-13])&IF(RC[-12]="",,"|n"&R1C21&RC[-12])&IF(RC[-10]="",,"|n"&R1C23&RC[-10])&IF(RC[-9]="",,"|n"&R1C24&RC[-9])&IF(RC[-8]="",,"|n"&R1C25&RC[-8])&IF(RC[-7]="",,"|n"&R1C26&RC[-7])&IF(RC[-6]="",,"|n"&R1C27&RC[-6])&IF(RC[-5]="",,"|n"&R1C28&RC[-5])&IF(RC[-2]="",,"|n"&RC[-2]) -> 
AG1013: =IF(RC[-26]&RC[-25]&RC[-24]&RC[-23]&RC[-22]&RC[-21]="",,R1C6)&IF(RC[-26]="",,"|n"&R1C7&RC[-26])&IF(RC[-25]="",,"|n"&R1C8&RC[-25])&IF(RC[-24]="",,"|n"&R1C9&RC[-24])&IF(RC[-23]="",,"|n"&R1C10&RC[-23])&IF(RC[-22]="",,"|n"&R1C11&RC[-22])&IF(RC[-21]="",,"|n"&R1C12&RC[-21])&IF(RC[-19]&RC[-18]&RC[-17]&RC[-16]="",,"|n"&R1C13)&IF(RC[-19]="",,"|n"&R1C14&RC[-19])&IF(RC[-18]="",,"|n"&R1C15&RC[-18])&IF(RC[-17]="",,"|n"&R1C16&RC[-17])&IF(RC[-16]="",,"|n"&R1C17&RC[-16])&IF(RC[-15]="",,"|n"&R1C18&RC[-15])&IF(RC[-14]="",,"|n"&R1C19&RC[-14])&IF(RC[-13]="",,"|n"&R1C20&RC[-13])&IF(RC[-12]="",,"|n"&R1C21&RC[-12])&IF(RC[-10]="",,"|n"&R1C23&RC[-10])&IF(RC[-9]="",,"|n"&R1C24&RC[-9])&IF(RC[-8]="",,"|n"&R1C25&RC[-8])&IF(RC[-7]="",,"|n"&R1C26&RC[-7])&IF(RC[-6]="",,"|n"&R1C27&RC[-6])&IF(RC[-5]="",,"|n"&R1C28&RC[-5])&IF(RC[-2]="",,"|n"&RC[-2]) -> 
AG1014: =IF(RC[-26]&RC[-25]&RC[-24]&RC[-23]&RC[-22]&RC[-21]="",,R1C6)&IF(RC[-26]="",,"|n"&R1C7&RC[-26])&IF(RC[-25]="",,"|n"&R1C8&RC[-25])&IF(RC[-24]="",,"|n"&R1C9&RC[-24])&IF(RC[-23]="",,"|n"&R1C10&RC[-23])&IF(RC[-22]="",,"|n"&R1C11&RC[-22])&IF(RC[-21]="",,"|n"&R1C12&RC[-21])&IF(RC[-19]&RC[-18]&RC[-17]&RC[-16]="",,"|n"&R1C13)&IF(RC[-19]="",,"|n"&R1C14&RC[-19])&IF(RC[-18]="",,"|n"&R1C15&RC[-18])&IF(RC[-17]="",,"|n"&R1C16&RC[-17])&IF(RC[-16]="",,"|n"&R1C17&RC[-16])&IF(RC[-15]="",,"|n"&R1C18&RC[-15])&IF(RC[-14]="",,"|n"&R1C19&RC[-14])&IF(RC[-13]="",,"|n"&R1C20&RC[-13])&IF(RC[-12]="",,"|n"&R1C21&RC[-12])&IF(RC[-10]="",,"|n"&R1C23&RC[-10])&IF(RC[-9]="",,"|n"&R1C24&RC[-9])&IF(RC[-8]="",,"|n"&R1C25&RC[-8])&IF(RC[-7]="",,"|n"&R1C26&RC[-7])&IF(RC[-6]="",,"|n"&R1C27&RC[-6])&IF(RC[-5]="",,"|n"&R1C28&RC[-5])&IF(RC[-2]="",,"|n"&RC[-2]) -> 
AG1015: =IF(RC[-26]&RC[-25]&RC[-24]&RC[-23]&RC[-22]&RC[-21]="",,R1C6)&IF(RC[-26]="",,"|n"&R1C7&RC[-26])&IF(RC[-25]="",,"|n"&R1C8&RC[-25])&IF(RC[-24]="",,"|n"&R1C9&RC[-24])&IF(RC[-23]="",,"|n"&R1C10&RC[-23])&IF(RC[-22]="",,"|n"&R1C11&RC[-22])&IF(RC[-21]="",,"|n"&R1C12&RC[-21])&IF(RC[-19]&RC[-18]&RC[-17]&RC[-16]="",,"|n"&R1C13)&IF(RC[-19]="",,"|n"&R1C14&RC[-19])&IF(RC[-18]="",,"|n"&R1C15&RC[-18])&IF(RC[-17]="",,"|n"&R1C16&RC[-17])&IF(RC[-16]="",,"|n"&R1C17&RC[-16])&IF(RC[-15]="",,"|n"&R1C18&RC[-15])&IF(RC[-14]="",,"|n"&R1C19&RC[-14])&IF(RC[-13]="",,"|n"&R1C20&RC[-13])&IF(RC[-12]="",,"|n"&R1C21&RC[-12])&IF(RC[-10]="",,"|n"&R1C23&RC[-10])&IF(RC[-9]="",,"|n"&R1C24&RC[-9])&IF(RC[-8]="",,"|n"&R1C25&RC[-8])&IF(RC[-7]="",,"|n"&R1C26&RC[-7])&IF(RC[-6]="",,"|n"&R1C27&RC[-6])&IF(RC[-5]="",,"|n"&R1C28&RC[-5])&IF(RC[-2]="",,"|n"&RC[-2]) -> 
AG1016: =IF(RC[-26]&RC[-25]&RC[-24]&RC[-23]&RC[-22]&RC[-21]="",,R1C6)&IF(RC[-26]="",,"|n"&R1C7&RC[-26])&IF(RC[-25]="",,"|n"&R1C8&RC[-25])&IF(RC[-24]="",,"|n"&R1C9&RC[-24])&IF(RC[-23]="",,"|n"&R1C10&RC[-23])&IF(RC[-22]="",,"|n"&R1C11&RC[-22])&IF(RC[-21]="",,"|n"&R1C12&RC[-21])&IF(RC[-19]&RC[-18]&RC[-17]&RC[-16]="",,"|n"&R1C13)&IF(RC[-19]="",,"|n"&R1C14&RC[-19])&IF(RC[-18]="",,"|n"&R1C15&RC[-18])&IF(RC[-17]="",,"|n"&R1C16&RC[-17])&IF(RC[-16]="",,"|n"&R1C17&RC[-16])&IF(RC[-15]="",,"|n"&R1C18&RC[-15])&IF(RC[-14]="",,"|n"&R1C19&RC[-14])&IF(RC[-13]="",,"|n"&R1C20&RC[-13])&IF(RC[-12]="",,"|n"&R1C21&RC[-12])&IF(RC[-10]="",,"|n"&R1C23&RC[-10])&IF(RC[-9]="",,"|n"&R1C24&RC[-9])&IF(RC[-8]="",,"|n"&R1C25&RC[-8])&IF(RC[-7]="",,"|n"&R1C26&RC[-7])&IF(RC[-6]="",,"|n"&R1C27&RC[-6])&IF(RC[-5]="",,"|n"&R1C28&RC[-5])&IF(RC[-2]="",,"|n"&RC[-2]) -> 
AG1017: =IF(RC[-26]&RC[-25]&RC[-24]&RC[-23]&RC[-22]&RC[-21]="",,R1C6)&IF(RC[-26]="",,"|n"&R1C7&RC[-26])&IF(RC[-25]="",,"|n"&R1C8&RC[-25])&IF(RC[-24]="",,"|n"&R1C9&RC[-24])&IF(RC[-23]="",,"|n"&R1C10&RC[-23])&IF(RC[-22]="",,"|n"&R1C11&RC[-22])&IF(RC[-21]="",,"|n"&R1C12&RC[-21])&IF(RC[-19]&RC[-18]&RC[-17]&RC[-16]="",,"|n"&R1C13)&IF(RC[-19]="",,"|n"&R1C14&RC[-19])&IF(RC[-18]="",,"|n"&R1C15&RC[-18])&IF(RC[-17]="",,"|n"&R1C16&RC[-17])&IF(RC[-16]="",,"|n"&R1C17&RC[-16])&IF(RC[-15]="",,"|n"&R1C18&RC[-15])&IF(RC[-14]="",,"|n"&R1C19&RC[-14])&IF(RC[-13]="",,"|n"&R1C20&RC[-13])&IF(RC[-12]="",,"|n"&R1C21&RC[-12])&IF(RC[-10]="",,"|n"&R1C23&RC[-10])&IF(RC[-9]="",,"|n"&R1C24&RC[-9])&IF(RC[-8]="",,"|n"&R1C25&RC[-8])&IF(RC[-7]="",,"|n"&R1C26&RC[-7])&IF(RC[-6]="",,"|n"&R1C27&RC[-6])&IF(RC[-5]="",,"|n"&R1C28&RC[-5])&IF(RC[-2]="",,"|n"&RC[-2]) -> 
AG1018: =IF(RC[-26]&RC[-25]&RC[-24]&RC[-23]&RC[-22]&RC[-21]="",,R1C6)&IF(RC[-26]="",,"|n"&R1C7&RC[-26])&IF(RC[-25]="",,"|n"&R1C8&RC[-25])&IF(RC[-24]="",,"|n"&R1C9&RC[-24])&IF(RC[-23]="",,"|n"&R1C10&RC[-23])&IF(RC[-22]="",,"|n"&R1C11&RC[-22])&IF(RC[-21]="",,"|n"&R1C12&RC[-21])&IF(RC[-19]&RC[-18]&RC[-17]&RC[-16]="",,"|n"&R1C13)&IF(RC[-19]="",,"|n"&R1C14&RC[-19])&IF(RC[-18]="",,"|n"&R1C15&RC[-18])&IF(RC[-17]="",,"|n"&R1C16&RC[-17])&IF(RC[-16]="",,"|n"&R1C17&RC[-16])&IF(RC[-15]="",,"|n"&R1C18&RC[-15])&IF(RC[-14]="",,"|n"&R1C19&RC[-14])&IF(RC[-13]="",,"|n"&R1C20&RC[-13])&IF(RC[-12]="",,"|n"&R1C21&RC[-12])&IF(RC[-10]="",,"|n"&R1C23&RC[-10])&IF(RC[-9]="",,"|n"&R1C24&RC[-9])&IF(RC[-8]="",,"|n"&R1C25&RC[-8])&IF(RC[-7]="",,"|n"&R1C26&RC[-7])&IF(RC[-6]="",,"|n"&R1C27&RC[-6])&IF(RC[-5]="",,"|n"&R1C28&RC[-5])&IF(RC[-2]="",,"|n"&RC[-2]) -> 
AG1019: =IF(RC[-26]&RC[-25]&RC[-24]&RC[-23]&RC[-22]&RC[-21]="",,R1C6)&IF(RC[-26]="",,"|n"&R1C7&RC[-26])&IF(RC[-25]="",,"|n"&R1C8&RC[-25])&IF(RC[-24]="",,"|n"&R1C9&RC[-24])&IF(RC[-23]="",,"|n"&R1C10&RC[-23])&IF(RC[-22]="",,"|n"&R1C11&RC[-22])&IF(RC[-21]="",,"|n"&R1C12&RC[-21])&IF(RC[-19]&RC[-18]&RC[-17]&RC[-16]="",,"|n"&R1C13)&IF(RC[-19]="",,"|n"&R1C14&RC[-19])&IF(RC[-18]="",,"|n"&R1C15&RC[-18])&IF(RC[-17]="",,"|n"&R1C16&RC[-17])&IF(RC[-16]="",,"|n"&R1C17&RC[-16])&IF(RC[-15]="",,"|n"&R1C18&RC[-15])&IF(RC[-14]="",,"|n"&R1C19&RC[-14])&IF(RC[-13]="",,"|n"&R1C20&RC[-13])&IF(RC[-12]="",,"|n"&R1C21&RC[-12])&IF(RC[-10]="",,"|n"&R1C23&RC[-10])&IF(RC[-9]="",,"|n"&R1C24&RC[-9])&IF(RC[-8]="",,"|n"&R1C25&RC[-8])&IF(RC[-7]="",,"|n"&R1C26&RC[-7])&IF(RC[-6]="",,"|n"&R1C27&RC[-6])&IF(RC[-5]="",,"|n"&R1C28&RC[-5])&IF(RC[-2]="",,"|n"&RC[-2]) -> 
AG1020: =IF(RC[-26]&RC[-25]&RC[-24]&RC[-23]&RC[-22]&RC[-21]="",,R1C6)&IF(RC[-26]="",,"|n"&R1C7&RC[-26])&IF(RC[-25]="",,"|n"&R1C8&RC[-25])&IF(RC[-24]="",,"|n"&R1C9&RC[-24])&IF(RC[-23]="",,"|n"&R1C10&RC[-23])&IF(RC[-22]="",,"|n"&R1C11&RC[-22])&IF(RC[-21]="",,"|n"&R1C12&RC[-21])&IF(RC[-19]&RC[-18]&RC[-17]&RC[-16]="",,"|n"&R1C13)&IF(RC[-19]="",,"|n"&R1C14&RC[-19])&IF(RC[-18]="",,"|n"&R1C15&RC[-18])&IF(RC[-17]="",,"|n"&R1C16&RC[-17])&IF(RC[-16]="",,"|n"&R1C17&RC[-16])&IF(RC[-15]="",,"|n"&R1C18&RC[-15])&IF(RC[-14]="",,"|n"&R1C19&RC[-14])&IF(RC[-13]="",,"|n"&R1C20&RC[-13])&IF(RC[-12]="",,"|n"&R1C21&RC[-12])&IF(RC[-10]="",,"|n"&R1C23&RC[-10])&IF(RC[-9]="",,"|n"&R1C24&RC[-9])&IF(RC[-8]="",,"|n"&R1C25&RC[-8])&IF(RC[-7]="",,"|n"&R1C26&RC[-7])&IF(RC[-6]="",,"|n"&R1C27&RC[-6])&IF(RC[-5]="",,"|n"&R1C28&RC[-5])&IF(RC[-2]="",,"|n"&RC[-2]) -> 
AG1021: =IF(RC[-26]&RC[-25]&RC[-24]&RC[-23]&RC[-22]&RC[-21]="",,R1C6)&IF(RC[-26]="",,"|n"&R1C7&RC[-26])&IF(RC[-25]="",,"|n"&R1C8&RC[-25])&IF(RC[-24]="",,"|n"&R1C9&RC[-24])&IF(RC[-23]="",,"|n"&R1C10&RC[-23])&IF(RC[-22]="",,"|n"&R1C11&RC[-22])&IF(RC[-21]="",,"|n"&R1C12&RC[-21])&IF(RC[-19]&RC[-18]&RC[-17]&RC[-16]="",,"|n"&R1C13)&IF(RC[-19]="",,"|n"&R1C14&RC[-19])&IF(RC[-18]="",,"|n"&R1C15&RC[-18])&IF(RC[-17]="",,"|n"&R1C16&RC[-17])&IF(RC[-16]="",,"|n"&R1C17&RC[-16])&IF(RC[-15]="",,"|n"&R1C18&RC[-15])&IF(RC[-14]="",,"|n"&R1C19&RC[-14])&IF(RC[-13]="",,"|n"&R1C20&RC[-13])&IF(RC[-12]="",,"|n"&R1C21&RC[-12])&IF(RC[-10]="",,"|n"&R1C23&RC[-10])&IF(RC[-9]="",,"|n"&R1C24&RC[-9])&IF(RC[-8]="",,"|n"&R1C25&RC[-8])&IF(RC[-7]="",,"|n"&R1C26&RC[-7])&IF(RC[-6]="",,"|n"&R1C27&RC[-6])&IF(RC[-5]="",,"|n"&R1C28&RC[-5])&IF(RC[-2]="",,"|n"&RC[-2]) -> 
AG1022: =IF(RC[-26]&RC[-25]&RC[-24]&RC[-23]&RC[-22]&RC[-21]="",,R1C6)&IF(RC[-26]="",,"|n"&R1C7&RC[-26])&IF(RC[-25]="",,"|n"&R1C8&RC[-25])&IF(RC[-24]="",,"|n"&R1C9&RC[-24])&IF(RC[-23]="",,"|n"&R1C10&RC[-23])&IF(RC[-22]="",,"|n"&R1C11&RC[-22])&IF(RC[-21]="",,"|n"&R1C12&RC[-21])&IF(RC[-19]&RC[-18]&RC[-17]&RC[-16]="",,"|n"&R1C13)&IF(RC[-19]="",,"|n"&R1C14&RC[-19])&IF(RC[-18]="",,"|n"&R1C15&RC[-18])&IF(RC[-17]="",,"|n"&R1C16&RC[-17])&IF(RC[-16]="",,"|n"&R1C17&RC[-16])&IF(RC[-15]="",,"|n"&R1C18&RC[-15])&IF(RC[-14]="",,"|n"&R1C19&RC[-14])&IF(RC[-13]="",,"|n"&R1C20&RC[-13])&IF(RC[-12]="",,"|n"&R1C21&RC[-12])&IF(RC[-10]="",,"|n"&R1C23&RC[-10])&IF(RC[-9]="",,"|n"&R1C24&RC[-9])&IF(RC[-8]="",,"|n"&R1C25&RC[-8])&IF(RC[-7]="",,"|n"&R1C26&RC[-7])&IF(RC[-6]="",,"|n"&R1C27&RC[-6])&IF(RC[-5]="",,"|n"&R1C28&RC[-5])&IF(RC[-2]="",,"|n"&RC[-2]) -> 
AG1023: =IF(RC[-26]&RC[-25]&RC[-24]&RC[-23]&RC[-22]&RC[-21]="",,R1C6)&IF(RC[-26]="",,"|n"&R1C7&RC[-26])&IF(RC[-25]="",,"|n"&R1C8&RC[-25])&IF(RC[-24]="",,"|n"&R1C9&RC[-24])&IF(RC[-23]="",,"|n"&R1C10&RC[-23])&IF(RC[-22]="",,"|n"&R1C11&RC[-22])&IF(RC[-21]="",,"|n"&R1C12&RC[-21])&IF(RC[-19]&RC[-18]&RC[-17]&RC[-16]="",,"|n"&R1C13)&IF(RC[-19]="",,"|n"&R1C14&RC[-19])&IF(RC[-18]="",,"|n"&R1C15&RC[-18])&IF(RC[-17]="",,"|n"&R1C16&RC[-17])&IF(RC[-16]="",,"|n"&R1C17&RC[-16])&IF(RC[-15]="",,"|n"&R1C18&RC[-15])&IF(RC[-14]="",,"|n"&R1C19&RC[-14])&IF(RC[-13]="",,"|n"&R1C20&RC[-13])&IF(RC[-12]="",,"|n"&R1C21&RC[-12])&IF(RC[-10]="",,"|n"&R1C23&RC[-10])&IF(RC[-9]="",,"|n"&R1C24&RC[-9])&IF(RC[-8]="",,"|n"&R1C25&RC[-8])&IF(RC[-7]="",,"|n"&R1C26&RC[-7])&IF(RC[-6]="",,"|n"&R1C27&RC[-6])&IF(RC[-5]="",,"|n"&R1C28&RC[-5])&IF(RC[-2]="",,"|n"&RC[-2]) -> 
AG1024: =IF(RC[-26]&RC[-25]&RC[-24]&RC[-23]&RC[-22]&RC[-21]="",,R1C6)&IF(RC[-26]="",,"|n"&R1C7&RC[-26])&IF(RC[-25]="",,"|n"&R1C8&RC[-25])&IF(RC[-24]="",,"|n"&R1C9&RC[-24])&IF(RC[-23]="",,"|n"&R1C10&RC[-23])&IF(RC[-22]="",,"|n"&R1C11&RC[-22])&IF(RC[-21]="",,"|n"&R1C12&RC[-21])&IF(RC[-19]&RC[-18]&RC[-17]&RC[-16]="",,"|n"&R1C13)&IF(RC[-19]="",,"|n"&R1C14&RC[-19])&IF(RC[-18]="",,"|n"&R1C15&RC[-18])&IF(RC[-17]="",,"|n"&R1C16&RC[-17])&IF(RC[-16]="",,"|n"&R1C17&RC[-16])&IF(RC[-15]="",,"|n"&R1C18&RC[-15])&IF(RC[-14]="",,"|n"&R1C19&RC[-14])&IF(RC[-13]="",,"|n"&R1C20&RC[-13])&IF(RC[-12]="",,"|n"&R1C21&RC[-12])&IF(RC[-10]="",,"|n"&R1C23&RC[-10])&IF(RC[-9]="",,"|n"&R1C24&RC[-9])&IF(RC[-8]="",,"|n"&R1C25&RC[-8])&IF(RC[-7]="",,"|n"&R1C26&RC[-7])&IF(RC[-6]="",,"|n"&R1C27&RC[-6])&IF(RC[-5]="",,"|n"&R1C28&RC[-5])&IF(RC[-2]="",,"|n"&RC[-2]) -> 
AG1025: =IF(RC[-26]&RC[-25]&RC[-24]&RC[-23]&RC[-22]&RC[-21]="",,R1C6)&IF(RC[-26]="",,"|n"&R1C7&RC[-26])&IF(RC[-25]="",,"|n"&R1C8&RC[-25])&IF(RC[-24]="",,"|n"&R1C9&RC[-24])&IF(RC[-23]="",,"|n"&R1C10&RC[-23])&IF(RC[-22]="",,"|n"&R1C11&RC[-22])&IF(RC[-21]="",,"|n"&R1C12&RC[-21])&IF(RC[-19]&RC[-18]&RC[-17]&RC[-16]="",,"|n"&R1C13)&IF(RC[-19]="",,"|n"&R1C14&RC[-19])&IF(RC[-18]="",,"|n"&R1C15&RC[-18])&IF(RC[-17]="",,"|n"&R1C16&RC[-17])&IF(RC[-16]="",,"|n"&R1C17&RC[-16])&IF(RC[-15]="",,"|n"&R1C18&RC[-15])&IF(RC[-14]="",,"|n"&R1C19&RC[-14])&IF(RC[-13]="",,"|n"&R1C20&RC[-13])&IF(RC[-12]="",,"|n"&R1C21&RC[-12])&IF(RC[-10]="",,"|n"&R1C23&RC[-10])&IF(RC[-9]="",,"|n"&R1C24&RC[-9])&IF(RC[-8]="",,"|n"&R1C25&RC[-8])&IF(RC[-7]="",,"|n"&R1C26&RC[-7])&IF(RC[-6]="",,"|n"&R1C27&RC[-6])&IF(RC[-5]="",,"|n"&R1C28&RC[-5])&IF(RC[-2]="",,"|n"&RC[-2]) -> 
AG1026: =IF(RC[-26]&RC[-25]&RC[-24]&RC[-23]&RC[-22]&RC[-21]="",,R1C6)&IF(RC[-26]="",,"|n"&R1C7&RC[-26])&IF(RC[-25]="",,"|n"&R1C8&RC[-25])&IF(RC[-24]="",,"|n"&R1C9&RC[-24])&IF(RC[-23]="",,"|n"&R1C10&RC[-23])&IF(RC[-22]="",,"|n"&R1C11&RC[-22])&IF(RC[-21]="",,"|n"&R1C12&RC[-21])&IF(RC[-19]&RC[-18]&RC[-17]&RC[-16]="",,"|n"&R1C13)&IF(RC[-19]="",,"|n"&R1C14&RC[-19])&IF(RC[-18]="",,"|n"&R1C15&RC[-18])&IF(RC[-17]="",,"|n"&R1C16&RC[-17])&IF(RC[-16]="",,"|n"&R1C17&RC[-16])&IF(RC[-15]="",,"|n"&R1C18&RC[-15])&IF(RC[-14]="",,"|n"&R1C19&RC[-14])&IF(RC[-13]="",,"|n"&R1C20&RC[-13])&IF(RC[-12]="",,"|n"&R1C21&RC[-12])&IF(RC[-10]="",,"|n"&R1C23&RC[-10])&IF(RC[-9]="",,"|n"&R1C24&RC[-9])&IF(RC[-8]="",,"|n"&R1C25&RC[-8])&IF(RC[-7]="",,"|n"&R1C26&RC[-7])&IF(RC[-6]="",,"|n"&R1C27&RC[-6])&IF(RC[-5]="",,"|n"&R1C28&RC[-5])&IF(RC[-2]="",,"|n"&RC[-2]) -> 
AG1027: =IF(RC[-26]&RC[-25]&RC[-24]&RC[-23]&RC[-22]&RC[-21]="",,R1C6)&IF(RC[-26]="",,"|n"&R1C7&RC[-26])&IF(RC[-25]="",,"|n"&R1C8&RC[-25])&IF(RC[-24]="",,"|n"&R1C9&RC[-24])&IF(RC[-23]="",,"|n"&R1C10&RC[-23])&IF(RC[-22]="",,"|n"&R1C11&RC[-22])&IF(RC[-21]="",,"|n"&R1C12&RC[-21])&IF(RC[-19]&RC[-18]&RC[-17]&RC[-16]="",,"|n"&R1C13)&IF(RC[-19]="",,"|n"&R1C14&RC[-19])&IF(RC[-18]="",,"|n"&R1C15&RC[-18])&IF(RC[-17]="",,"|n"&R1C16&RC[-17])&IF(RC[-16]="",,"|n"&R1C17&RC[-16])&IF(RC[-15]="",,"|n"&R1C18&RC[-15])&IF(RC[-14]="",,"|n"&R1C19&RC[-14])&IF(RC[-13]="",,"|n"&R1C20&RC[-13])&IF(RC[-12]="",,"|n"&R1C21&RC[-12])&IF(RC[-10]="",,"|n"&R1C23&RC[-10])&IF(RC[-9]="",,"|n"&R1C24&RC[-9])&IF(RC[-8]="",,"|n"&R1C25&RC[-8])&IF(RC[-7]="",,"|n"&R1C26&RC[-7])&IF(RC[-6]="",,"|n"&R1C27&RC[-6])&IF(RC[-5]="",,"|n"&R1C28&RC[-5])&IF(RC[-2]="",,"|n"&RC[-2]) -> 
AG1028: =IF(RC[-26]&RC[-25]&RC[-24]&RC[-23]&RC[-22]&RC[-21]="",,R1C6)&IF(RC[-26]="",,"|n"&R1C7&RC[-26])&IF(RC[-25]="",,"|n"&R1C8&RC[-25])&IF(RC[-24]="",,"|n"&R1C9&RC[-24])&IF(RC[-23]="",,"|n"&R1C10&RC[-23])&IF(RC[-22]="",,"|n"&R1C11&RC[-22])&IF(RC[-21]="",,"|n"&R1C12&RC[-21])&IF(RC[-19]&RC[-18]&RC[-17]&RC[-16]="",,"|n"&R1C13)&IF(RC[-19]="",,"|n"&R1C14&RC[-19])&IF(RC[-18]="",,"|n"&R1C15&RC[-18])&IF(RC[-17]="",,"|n"&R1C16&RC[-17])&IF(RC[-16]="",,"|n"&R1C17&RC[-16])&IF(RC[-15]="",,"|n"&R1C18&RC[-15])&IF(RC[-14]="",,"|n"&R1C19&RC[-14])&IF(RC[-13]="",,"|n"&R1C20&RC[-13])&IF(RC[-12]="",,"|n"&R1C21&RC[-12])&IF(RC[-10]="",,"|n"&R1C23&RC[-10])&IF(RC[-9]="",,"|n"&R1C24&RC[-9])&IF(RC[-8]="",,"|n"&R1C25&RC[-8])&IF(RC[-7]="",,"|n"&R1C26&RC[-7])&IF(RC[-6]="",,"|n"&R1C27&RC[-6])&IF(RC[-5]="",,"|n"&R1C28&RC[-5])&IF(RC[-2]="",,"|n"&RC[-2]) -> 
AG1029: =IF(RC[-26]&RC[-25]&RC[-24]&RC[-23]&RC[-22]&RC[-21]="",,R1C6)&IF(RC[-26]="",,"|n"&R1C7&RC[-26])&IF(RC[-25]="",,"|n"&R1C8&RC[-25])&IF(RC[-24]="",,"|n"&R1C9&RC[-24])&IF(RC[-23]="",,"|n"&R1C10&RC[-23])&IF(RC[-22]="",,"|n"&R1C11&RC[-22])&IF(RC[-21]="",,"|n"&R1C12&RC[-21])&IF(RC[-19]&RC[-18]&RC[-17]&RC[-16]="",,"|n"&R1C13)&IF(RC[-19]="",,"|n"&R1C14&RC[-19])&IF(RC[-18]="",,"|n"&R1C15&RC[-18])&IF(RC[-17]="",,"|n"&R1C16&RC[-17])&IF(RC[-16]="",,"|n"&R1C17&RC[-16])&IF(RC[-15]="",,"|n"&R1C18&RC[-15])&IF(RC[-14]="",,"|n"&R1C19&RC[-14])&IF(RC[-13]="",,"|n"&R1C20&RC[-13])&IF(RC[-12]="",,"|n"&R1C21&RC[-12])&IF(RC[-10]="",,"|n"&R1C23&RC[-10])&IF(RC[-9]="",,"|n"&R1C24&RC[-9])&IF(RC[-8]="",,"|n"&R1C25&RC[-8])&IF(RC[-7]="",,"|n"&R1C26&RC[-7])&IF(RC[-6]="",,"|n"&R1C27&RC[-6])&IF(RC[-5]="",,"|n"&R1C28&RC[-5])&IF(RC[-2]="",,"|n"&RC[-2]) -> 
AG1030: =IF(RC[-26]&RC[-25]&RC[-24]&RC[-23]&RC[-22]&RC[-21]="",,R1C6)&IF(RC[-26]="",,"|n"&R1C7&RC[-26])&IF(RC[-25]="",,"|n"&R1C8&RC[-25])&IF(RC[-24]="",,"|n"&R1C9&RC[-24])&IF(RC[-23]="",,"|n"&R1C10&RC[-23])&IF(RC[-22]="",,"|n"&R1C11&RC[-22])&IF(RC[-21]="",,"|n"&R1C12&RC[-21])&IF(RC[-19]&RC[-18]&RC[-17]&RC[-16]="",,"|n"&R1C13)&IF(RC[-19]="",,"|n"&R1C14&RC[-19])&IF(RC[-18]="",,"|n"&R1C15&RC[-18])&IF(RC[-17]="",,"|n"&R1C16&RC[-17])&IF(RC[-16]="",,"|n"&R1C17&RC[-16])&IF(RC[-15]="",,"|n"&R1C18&RC[-15])&IF(RC[-14]="",,"|n"&R1C19&RC[-14])&IF(RC[-13]="",,"|n"&R1C20&RC[-13])&IF(RC[-12]="",,"|n"&R1C21&RC[-12])&IF(RC[-10]="",,"|n"&R1C23&RC[-10])&IF(RC[-9]="",,"|n"&R1C24&RC[-9])&IF(RC[-8]="",,"|n"&R1C25&RC[-8])&IF(RC[-7]="",,"|n"&R1C26&RC[-7])&IF(RC[-6]="",,"|n"&R1C27&RC[-6])&IF(RC[-5]="",,"|n"&R1C28&RC[-5])&IF(RC[-2]="",,"|n"&RC[-2]) -> 
AG1031: =IF(RC[-26]&RC[-25]&RC[-24]&RC[-23]&RC[-22]&RC[-21]="",,R1C6)&IF(RC[-26]="",,"|n"&R1C7&RC[-26])&IF(RC[-25]="",,"|n"&R1C8&RC[-25])&IF(RC[-24]="",,"|n"&R1C9&RC[-24])&IF(RC[-23]="",,"|n"&R1C10&RC[-23])&IF(RC[-22]="",,"|n"&R1C11&RC[-22])&IF(RC[-21]="",,"|n"&R1C12&RC[-21])&IF(RC[-19]&RC[-18]&RC[-17]&RC[-16]="",,"|n"&R1C13)&IF(RC[-19]="",,"|n"&R1C14&RC[-19])&IF(RC[-18]="",,"|n"&R1C15&RC[-18])&IF(RC[-17]="",,"|n"&R1C16&RC[-17])&IF(RC[-16]="",,"|n"&R1C17&RC[-16])&IF(RC[-15]="",,"|n"&R1C18&RC[-15])&IF(RC[-14]="",,"|n"&R1C19&RC[-14])&IF(RC[-13]="",,"|n"&R1C20&RC[-13])&IF(RC[-12]="",,"|n"&R1C21&RC[-12])&IF(RC[-10]="",,"|n"&R1C23&RC[-10])&IF(RC[-9]="",,"|n"&R1C24&RC[-9])&IF(RC[-8]="",,"|n"&R1C25&RC[-8])&IF(RC[-7]="",,"|n"&R1C26&RC[-7])&IF(RC[-6]="",,"|n"&R1C27&RC[-6])&IF(RC[-5]="",,"|n"&R1C28&RC[-5])&IF(RC[-2]="",,"|n"&RC[-2]) -> 
AG1032: =IF(RC[-26]&RC[-25]&RC[-24]&RC[-23]&RC[-22]&RC[-21]="",,R1C6)&IF(RC[-26]="",,"|n"&R1C7&RC[-26])&IF(RC[-25]="",,"|n"&R1C8&RC[-25])&IF(RC[-24]="",,"|n"&R1C9&RC[-24])&IF(RC[-23]="",,"|n"&R1C10&RC[-23])&IF(RC[-22]="",,"|n"&R1C11&RC[-22])&IF(RC[-21]="",,"|n"&R1C12&RC[-21])&IF(RC[-19]&RC[-18]&RC[-17]&RC[-16]="",,"|n"&R1C13)&IF(RC[-19]="",,"|n"&R1C14&RC[-19])&IF(RC[-18]="",,"|n"&R1C15&RC[-18])&IF(RC[-17]="",,"|n"&R1C16&RC[-17])&IF(RC[-16]="",,"|n"&R1C17&RC[-16])&IF(RC[-15]="",,"|n"&R1C18&RC[-15])&IF(RC[-14]="",,"|n"&R1C19&RC[-14])&IF(RC[-13]="",,"|n"&R1C20&RC[-13])&IF(RC[-12]="",,"|n"&R1C21&RC[-12])&IF(RC[-10]="",,"|n"&R1C23&RC[-10])&IF(RC[-9]="",,"|n"&R1C24&RC[-9])&IF(RC[-8]="",,"|n"&R1C25&RC[-8])&IF(RC[-7]="",,"|n"&R1C26&RC[-7])&IF(RC[-6]="",,"|n"&R1C27&RC[-6])&IF(RC[-5]="",,"|n"&R1C28&RC[-5])&IF(RC[-2]="",,"|n"&RC[-2]) -> 
AG1033: =IF(RC[-26]&RC[-25]&RC[-24]&RC[-23]&RC[-22]&RC[-21]="",,R1C6)&IF(RC[-26]="",,"|n"&R1C7&RC[-26])&IF(RC[-25]="",,"|n"&R1C8&RC[-25])&IF(RC[-24]="",,"|n"&R1C9&RC[-24])&IF(RC[-23]="",,"|n"&R1C10&RC[-23])&IF(RC[-22]="",,"|n"&R1C11&RC[-22])&IF(RC[-21]="",,"|n"&R1C12&RC[-21])&IF(RC[-19]&RC[-18]&RC[-17]&RC[-16]="",,"|n"&R1C13)&IF(RC[-19]="",,"|n"&R1C14&RC[-19])&IF(RC[-18]="",,"|n"&R1C15&RC[-18])&IF(RC[-17]="",,"|n"&R1C16&RC[-17])&IF(RC[-16]="",,"|n"&R1C17&RC[-16])&IF(RC[-15]="",,"|n"&R1C18&RC[-15])&IF(RC[-14]="",,"|n"&R1C19&RC[-14])&IF(RC[-13]="",,"|n"&R1C20&RC[-13])&IF(RC[-12]="",,"|n"&R1C21&RC[-12])&IF(RC[-10]="",,"|n"&R1C23&RC[-10])&IF(RC[-9]="",,"|n"&R1C24&RC[-9])&IF(RC[-8]="",,"|n"&R1C25&RC[-8])&IF(RC[-7]="",,"|n"&R1C26&RC[-7])&IF(RC[-6]="",,"|n"&R1C27&RC[-6])&IF(RC[-5]="",,"|n"&R1C28&RC[-5])&IF(RC[-2]="",,"|n"&RC[-2]) -> 
AG1034: =IF(RC[-26]&RC[-25]&RC[-24]&RC[-23]&RC[-22]&RC[-21]="",,R1C6)&IF(RC[-26]="",,"|n"&R1C7&RC[-26])&IF(RC[-25]="",,"|n"&R1C8&RC[-25])&IF(RC[-24]="",,"|n"&R1C9&RC[-24])&IF(RC[-23]="",,"|n"&R1C10&RC[-23])&IF(RC[-22]="",,"|n"&R1C11&RC[-22])&IF(RC[-21]="",,"|n"&R1C12&RC[-21])&IF(RC[-19]&RC[-18]&RC[-17]&RC[-16]="",,"|n"&R1C13)&IF(RC[-19]="",,"|n"&R1C14&RC[-19])&IF(RC[-18]="",,"|n"&R1C15&RC[-18])&IF(RC[-17]="",,"|n"&R1C16&RC[-17])&IF(RC[-16]="",,"|n"&R1C17&RC[-16])&IF(RC[-15]="",,"|n"&R1C18&RC[-15])&IF(RC[-14]="",,"|n"&R1C19&RC[-14])&IF(RC[-13]="",,"|n"&R1C20&RC[-13])&IF(RC[-12]="",,"|n"&R1C21&RC[-12])&IF(RC[-10]="",,"|n"&R1C23&RC[-10])&IF(RC[-9]="",,"|n"&R1C24&RC[-9])&IF(RC[-8]="",,"|n"&R1C25&RC[-8])&IF(RC[-7]="",,"|n"&R1C26&RC[-7])&IF(RC[-6]="",,"|n"&R1C27&RC[-6])&IF(RC[-5]="",,"|n"&R1C28&RC[-5])&IF(RC[-2]="",,"|n"&RC[-2]) -> 
AG1035: =IF(RC[-26]&RC[-25]&RC[-24]&RC[-23]&RC[-22]&RC[-21]="",,R1C6)&IF(RC[-26]="",,"|n"&R1C7&RC[-26])&IF(RC[-25]="",,"|n"&R1C8&RC[-25])&IF(RC[-24]="",,"|n"&R1C9&RC[-24])&IF(RC[-23]="",,"|n"&R1C10&RC[-23])&IF(RC[-22]="",,"|n"&R1C11&RC[-22])&IF(RC[-21]="",,"|n"&R1C12&RC[-21])&IF(RC[-19]&RC[-18]&RC[-17]&RC[-16]="",,"|n"&R1C13)&IF(RC[-19]="",,"|n"&R1C14&RC[-19])&IF(RC[-18]="",,"|n"&R1C15&RC[-18])&IF(RC[-17]="",,"|n"&R1C16&RC[-17])&IF(RC[-16]="",,"|n"&R1C17&RC[-16])&IF(RC[-15]="",,"|n"&R1C18&RC[-15])&IF(RC[-14]="",,"|n"&R1C19&RC[-14])&IF(RC[-13]="",,"|n"&R1C20&RC[-13])&IF(RC[-12]="",,"|n"&R1C21&RC[-12])&IF(RC[-10]="",,"|n"&R1C23&RC[-10])&IF(RC[-9]="",,"|n"&R1C24&RC[-9])&IF(RC[-8]="",,"|n"&R1C25&RC[-8])&IF(RC[-7]="",,"|n"&R1C26&RC[-7])&IF(RC[-6]="",,"|n"&R1C27&RC[-6])&IF(RC[-5]="",,"|n"&R1C28&RC[-5])&IF(RC[-2]="",,"|n"&RC[-2]) -> 
AG1036: =IF(RC[-26]&RC[-25]&RC[-24]&RC[-23]&RC[-22]&RC[-21]="",,R1C6)&IF(RC[-26]="",,"|n"&R1C7&RC[-26])&IF(RC[-25]="",,"|n"&R1C8&RC[-25])&IF(RC[-24]="",,"|n"&R1C9&RC[-24])&IF(RC[-23]="",,"|n"&R1C10&RC[-23])&IF(RC[-22]="",,"|n"&R1C11&RC[-22])&IF(RC[-21]="",,"|n"&R1C12&RC[-21])&IF(RC[-19]&RC[-18]&RC[-17]&RC[-16]="",,"|n"&R1C13)&IF(RC[-19]="",,"|n"&R1C14&RC[-19])&IF(RC[-18]="",,"|n"&R1C15&RC[-18])&IF(RC[-17]="",,"|n"&R1C16&RC[-17])&IF(RC[-16]="",,"|n"&R1C17&RC[-16])&IF(RC[-15]="",,"|n"&R1C18&RC[-15])&IF(RC[-14]="",,"|n"&R1C19&RC[-14])&IF(RC[-13]="",,"|n"&R1C20&RC[-13])&IF(RC[-12]="",,"|n"&R1C21&RC[-12])&IF(RC[-10]="",,"|n"&R1C23&RC[-10])&IF(RC[-9]="",,"|n"&R1C24&RC[-9])&IF(RC[-8]="",,"|n"&R1C25&RC[-8])&IF(RC[-7]="",,"|n"&R1C26&RC[-7])&IF(RC[-6]="",,"|n"&R1C27&RC[-6])&IF(RC[-5]="",,"|n"&R1C28&RC[-5])&IF(RC[-2]="",,"|n"&RC[-2]) -> 
AG1037: =IF(RC[-26]&RC[-25]&RC[-24]&RC[-23]&RC[-22]&RC[-21]="",,R1C6)&IF(RC[-26]="",,"|n"&R1C7&RC[-26])&IF(RC[-25]="",,"|n"&R1C8&RC[-25])&IF(RC[-24]="",,"|n"&R1C9&RC[-24])&IF(RC[-23]="",,"|n"&R1C10&RC[-23])&IF(RC[-22]="",,"|n"&R1C11&RC[-22])&IF(RC[-21]="",,"|n"&R1C12&RC[-21])&IF(RC[-19]&RC[-18]&RC[-17]&RC[-16]="",,"|n"&R1C13)&IF(RC[-19]="",,"|n"&R1C14&RC[-19])&IF(RC[-18]="",,"|n"&R1C15&RC[-18])&IF(RC[-17]="",,"|n"&R1C16&RC[-17])&IF(RC[-16]="",,"|n"&R1C17&RC[-16])&IF(RC[-15]="",,"|n"&R1C18&RC[-15])&IF(RC[-14]="",,"|n"&R1C19&RC[-14])&IF(RC[-13]="",,"|n"&R1C20&RC[-13])&IF(RC[-12]="",,"|n"&R1C21&RC[-12])&IF(RC[-10]="",,"|n"&R1C23&RC[-10])&IF(RC[-9]="",,"|n"&R1C24&RC[-9])&IF(RC[-8]="",,"|n"&R1C25&RC[-8])&IF(RC[-7]="",,"|n"&R1C26&RC[-7])&IF(RC[-6]="",,"|n"&R1C27&RC[-6])&IF(RC[-5]="",,"|n"&R1C28&RC[-5])&IF(RC[-2]="",,"|n"&RC[-2]) -> 
AG1038: =IF(RC[-26]&RC[-25]&RC[-24]&RC[-23]&RC[-22]&RC[-21]="",,R1C6)&IF(RC[-26]="",,"|n"&R1C7&RC[-26])&IF(RC[-25]="",,"|n"&R1C8&RC[-25])&IF(RC[-24]="",,"|n"&R1C9&RC[-24])&IF(RC[-23]="",,"|n"&R1C10&RC[-23])&IF(RC[-22]="",,"|n"&R1C11&RC[-22])&IF(RC[-21]="",,"|n"&R1C12&RC[-21])&IF(RC[-19]&RC[-18]&RC[-17]&RC[-16]="",,"|n"&R1C13)&IF(RC[-19]="",,"|n"&R1C14&RC[-19])&IF(RC[-18]="",,"|n"&R1C15&RC[-18])&IF(RC[-17]="",,"|n"&R1C16&RC[-17])&IF(RC[-16]="",,"|n"&R1C17&RC[-16])&IF(RC[-15]="",,"|n"&R1C18&RC[-15])&IF(RC[-14]="",,"|n"&R1C19&RC[-14])&IF(RC[-13]="",,"|n"&R1C20&RC[-13])&IF(RC[-12]="",,"|n"&R1C21&RC[-12])&IF(RC[-10]="",,"|n"&R1C23&RC[-10])&IF(RC[-9]="",,"|n"&R1C24&RC[-9])&IF(RC[-8]="",,"|n"&R1C25&RC[-8])&IF(RC[-7]="",,"|n"&R1C26&RC[-7])&IF(RC[-6]="",,"|n"&R1C27&RC[-6])&IF(RC[-5]="",,"|n"&R1C28&RC[-5])&IF(RC[-2]="",,"|n"&RC[-2]) -> 
AG1039: =IF(RC[-26]&RC[-25]&RC[-24]&RC[-23]&RC[-22]&RC[-21]="",,R1C6)&IF(RC[-26]="",,"|n"&R1C7&RC[-26])&IF(RC[-25]="",,"|n"&R1C8&RC[-25])&IF(RC[-24]="",,"|n"&R1C9&RC[-24])&IF(RC[-23]="",,"|n"&R1C10&RC[-23])&IF(RC[-22]="",,"|n"&R1C11&RC[-22])&IF(RC[-21]="",,"|n"&R1C12&RC[-21])&IF(RC[-19]&RC[-18]&RC[-17]&RC[-16]="",,"|n"&R1C13)&IF(RC[-19]="",,"|n"&R1C14&RC[-19])&IF(RC[-18]="",,"|n"&R1C15&RC[-18])&IF(RC[-17]="",,"|n"&R1C16&RC[-17])&IF(RC[-16]="",,"|n"&R1C17&RC[-16])&IF(RC[-15]="",,"|n"&R1C18&RC[-15])&IF(RC[-14]="",,"|n"&R1C19&RC[-14])&IF(RC[-13]="",,"|n"&R1C20&RC[-13])&IF(RC[-12]="",,"|n"&R1C21&RC[-12])&IF(RC[-10]="",,"|n"&R1C23&RC[-10])&IF(RC[-9]="",,"|n"&R1C24&RC[-9])&IF(RC[-8]="",,"|n"&R1C25&RC[-8])&IF(RC[-7]="",,"|n"&R1C26&RC[-7])&IF(RC[-6]="",,"|n"&R1C27&RC[-6])&IF(RC[-5]="",,"|n"&R1C28&RC[-5])&IF(RC[-2]="",,"|n"&RC[-2]) -> 
AG1040: =IF(RC[-26]&RC[-25]&RC[-24]&RC[-23]&RC[-22]&RC[-21]="",,R1C6)&IF(RC[-26]="",,"|n"&R1C7&RC[-26])&IF(RC[-25]="",,"|n"&R1C8&RC[-25])&IF(RC[-24]="",,"|n"&R1C9&RC[-24])&IF(RC[-23]="",,"|n"&R1C10&RC[-23])&IF(RC[-22]="",,"|n"&R1C11&RC[-22])&IF(RC[-21]="",,"|n"&R1C12&RC[-21])&IF(RC[-19]&RC[-18]&RC[-17]&RC[-16]="",,"|n"&R1C13)&IF(RC[-19]="",,"|n"&R1C14&RC[-19])&IF(RC[-18]="",,"|n"&R1C15&RC[-18])&IF(RC[-17]="",,"|n"&R1C16&RC[-17])&IF(RC[-16]="",,"|n"&R1C17&RC[-16])&IF(RC[-15]="",,"|n"&R1C18&RC[-15])&IF(RC[-14]="",,"|n"&R1C19&RC[-14])&IF(RC[-13]="",,"|n"&R1C20&RC[-13])&IF(RC[-12]="",,"|n"&R1C21&RC[-12])&IF(RC[-10]="",,"|n"&R1C23&RC[-10])&IF(RC[-9]="",,"|n"&R1C24&RC[-9])&IF(RC[-8]="",,"|n"&R1C25&RC[-8])&IF(RC[-7]="",,"|n"&R1C26&RC[-7])&IF(RC[-6]="",,"|n"&R1C27&RC[-6])&IF(RC[-5]="",,"|n"&R1C28&RC[-5])&IF(RC[-2]="",,"|n"&RC[-2]) -> 
AG1041: =IF(RC[-26]&RC[-25]&RC[-24]&RC[-23]&RC[-22]&RC[-21]="",,R1C6)&IF(RC[-26]="",,"|n"&R1C7&RC[-26])&IF(RC[-25]="",,"|n"&R1C8&RC[-25])&IF(RC[-24]="",,"|n"&R1C9&RC[-24])&IF(RC[-23]="",,"|n"&R1C10&RC[-23])&IF(RC[-22]="",,"|n"&R1C11&RC[-22])&IF(RC[-21]="",,"|n"&R1C12&RC[-21])&IF(RC[-19]&RC[-18]&RC[-17]&RC[-16]="",,"|n"&R1C13)&IF(RC[-19]="",,"|n"&R1C14&RC[-19])&IF(RC[-18]="",,"|n"&R1C15&RC[-18])&IF(RC[-17]="",,"|n"&R1C16&RC[-17])&IF(RC[-16]="",,"|n"&R1C17&RC[-16])&IF(RC[-15]="",,"|n"&R1C18&RC[-15])&IF(RC[-14]="",,"|n"&R1C19&RC[-14])&IF(RC[-13]="",,"|n"&R1C20&RC[-13])&IF(RC[-12]="",,"|n"&R1C21&RC[-12])&IF(RC[-10]="",,"|n"&R1C23&RC[-10])&IF(RC[-9]="",,"|n"&R1C24&RC[-9])&IF(RC[-8]="",,"|n"&R1C25&RC[-8])&IF(RC[-7]="",,"|n"&R1C26&RC[-7])&IF(RC[-6]="",,"|n"&R1C27&RC[-6])&IF(RC[-5]="",,"|n"&R1C28&RC[-5])&IF(RC[-2]="",,"|n"&RC[-2]) -> 
AG1042: =IF(RC[-26]&RC[-25]&RC[-24]&RC[-23]&RC[-22]&RC[-21]="",,R1C6)&IF(RC[-26]="",,"|n"&R1C7&RC[-26])&IF(RC[-25]="",,"|n"&R1C8&RC[-25])&IF(RC[-24]="",,"|n"&R1C9&RC[-24])&IF(RC[-23]="",,"|n"&R1C10&RC[-23])&IF(RC[-22]="",,"|n"&R1C11&RC[-22])&IF(RC[-21]="",,"|n"&R1C12&RC[-21])&IF(RC[-19]&RC[-18]&RC[-17]&RC[-16]="",,"|n"&R1C13)&IF(RC[-19]="",,"|n"&R1C14&RC[-19])&IF(RC[-18]="",,"|n"&R1C15&RC[-18])&IF(RC[-17]="",,"|n"&R1C16&RC[-17])&IF(RC[-16]="",,"|n"&R1C17&RC[-16])&IF(RC[-15]="",,"|n"&R1C18&RC[-15])&IF(RC[-14]="",,"|n"&R1C19&RC[-14])&IF(RC[-13]="",,"|n"&R1C20&RC[-13])&IF(RC[-12]="",,"|n"&R1C21&RC[-12])&IF(RC[-10]="",,"|n"&R1C23&RC[-10])&IF(RC[-9]="",,"|n"&R1C24&RC[-9])&IF(RC[-8]="",,"|n"&R1C25&RC[-8])&IF(RC[-7]="",,"|n"&R1C26&RC[-7])&IF(RC[-6]="",,"|n"&R1C27&RC[-6])&IF(RC[-5]="",,"|n"&R1C28&RC[-5])&IF(RC[-2]="",,"|n"&RC[-2]) -> 
AG1043: =IF(RC[-26]&RC[-25]&RC[-24]&RC[-23]&RC[-22]&RC[-21]="",,R1C6)&IF(RC[-26]="",,"|n"&R1C7&RC[-26])&IF(RC[-25]="",,"|n"&R1C8&RC[-25])&IF(RC[-24]="",,"|n"&R1C9&RC[-24])&IF(RC[-23]="",,"|n"&R1C10&RC[-23])&IF(RC[-22]="",,"|n"&R1C11&RC[-22])&IF(RC[-21]="",,"|n"&R1C12&RC[-21])&IF(RC[-19]&RC[-18]&RC[-17]&RC[-16]="",,"|n"&R1C13)&IF(RC[-19]="",,"|n"&R1C14&RC[-19])&IF(RC[-18]="",,"|n"&R1C15&RC[-18])&IF(RC[-17]="",,"|n"&R1C16&RC[-17])&IF(RC[-16]="",,"|n"&R1C17&RC[-16])&IF(RC[-15]="",,"|n"&R1C18&RC[-15])&IF(RC[-14]="",,"|n"&R1C19&RC[-14])&IF(RC[-13]="",,"|n"&R1C20&RC[-13])&IF(RC[-12]="",,"|n"&R1C21&RC[-12])&IF(RC[-10]="",,"|n"&R1C23&RC[-10])&IF(RC[-9]="",,"|n"&R1C24&RC[-9])&IF(RC[-8]="",,"|n"&R1C25&RC[-8])&IF(RC[-7]="",,"|n"&R1C26&RC[-7])&IF(RC[-6]="",,"|n"&R1C27&RC[-6])&IF(RC[-5]="",,"|n"&R1C28&RC[-5])&IF(RC[-2]="",,"|n"&RC[-2]) -> 
AG1044: =IF(RC[-26]&RC[-25]&RC[-24]&RC[-23]&RC[-22]&RC[-21]="",,R1C6)&IF(RC[-26]="",,"|n"&R1C7&RC[-26])&IF(RC[-25]="",,"|n"&R1C8&RC[-25])&IF(RC[-24]="",,"|n"&R1C9&RC[-24])&IF(RC[-23]="",,"|n"&R1C10&RC[-23])&IF(RC[-22]="",,"|n"&R1C11&RC[-22])&IF(RC[-21]="",,"|n"&R1C12&RC[-21])&IF(RC[-19]&RC[-18]&RC[-17]&RC[-16]="",,"|n"&R1C13)&IF(RC[-19]="",,"|n"&R1C14&RC[-19])&IF(RC[-18]="",,"|n"&R1C15&RC[-18])&IF(RC[-17]="",,"|n"&R1C16&RC[-17])&IF(RC[-16]="",,"|n"&R1C17&RC[-16])&IF(RC[-15]="",,"|n"&R1C18&RC[-15])&IF(RC[-14]="",,"|n"&R1C19&RC[-14])&IF(RC[-13]="",,"|n"&R1C20&RC[-13])&IF(RC[-12]="",,"|n"&R1C21&RC[-12])&IF(RC[-10]="",,"|n"&R1C23&RC[-10])&IF(RC[-9]="",,"|n"&R1C24&RC[-9])&IF(RC[-8]="",,"|n"&R1C25&RC[-8])&IF(RC[-7]="",,"|n"&R1C26&RC[-7])&IF(RC[-6]="",,"|n"&R1C27&RC[-6])&IF(RC[-5]="",,"|n"&R1C28&RC[-5])&IF(RC[-2]="",,"|n"&RC[-2]) -> 
AG1045: =IF(RC[-26]&RC[-25]&RC[-24]&RC[-23]&RC[-22]&RC[-21]="",,R1C6)&IF(RC[-26]="",,"|n"&R1C7&RC[-26])&IF(RC[-25]="",,"|n"&R1C8&RC[-25])&IF(RC[-24]="",,"|n"&R1C9&RC[-24])&IF(RC[-23]="",,"|n"&R1C10&RC[-23])&IF(RC[-22]="",,"|n"&R1C11&RC[-22])&IF(RC[-21]="",,"|n"&R1C12&RC[-21])&IF(RC[-19]&RC[-18]&RC[-17]&RC[-16]="",,"|n"&R1C13)&IF(RC[-19]="",,"|n"&R1C14&RC[-19])&IF(RC[-18]="",,"|n"&R1C15&RC[-18])&IF(RC[-17]="",,"|n"&R1C16&RC[-17])&IF(RC[-16]="",,"|n"&R1C17&RC[-16])&IF(RC[-15]="",,"|n"&R1C18&RC[-15])&IF(RC[-14]="",,"|n"&R1C19&RC[-14])&IF(RC[-13]="",,"|n"&R1C20&RC[-13])&IF(RC[-12]="",,"|n"&R1C21&RC[-12])&IF(RC[-10]="",,"|n"&R1C23&RC[-10])&IF(RC[-9]="",,"|n"&R1C24&RC[-9])&IF(RC[-8]="",,"|n"&R1C25&RC[-8])&IF(RC[-7]="",,"|n"&R1C26&RC[-7])&IF(RC[-6]="",,"|n"&R1C27&RC[-6])&IF(RC[-5]="",,"|n"&R1C28&RC[-5])&IF(RC[-2]="",,"|n"&RC[-2]) -> 
AG1046: =IF(RC[-26]&RC[-25]&RC[-24]&RC[-23]&RC[-22]&RC[-21]="",,R1C6)&IF(RC[-26]="",,"|n"&R1C7&RC[-26])&IF(RC[-25]="",,"|n"&R1C8&RC[-25])&IF(RC[-24]="",,"|n"&R1C9&RC[-24])&IF(RC[-23]="",,"|n"&R1C10&RC[-23])&IF(RC[-22]="",,"|n"&R1C11&RC[-22])&IF(RC[-21]="",,"|n"&R1C12&RC[-21])&IF(RC[-19]&RC[-18]&RC[-17]&RC[-16]="",,"|n"&R1C13)&IF(RC[-19]="",,"|n"&R1C14&RC[-19])&IF(RC[-18]="",,"|n"&R1C15&RC[-18])&IF(RC[-17]="",,"|n"&R1C16&RC[-17])&IF(RC[-16]="",,"|n"&R1C17&RC[-16])&IF(RC[-15]="",,"|n"&R1C18&RC[-15])&IF(RC[-14]="",,"|n"&R1C19&RC[-14])&IF(RC[-13]="",,"|n"&R1C20&RC[-13])&IF(RC[-12]="",,"|n"&R1C21&RC[-12])&IF(RC[-10]="",,"|n"&R1C23&RC[-10])&IF(RC[-9]="",,"|n"&R1C24&RC[-9])&IF(RC[-8]="",,"|n"&R1C25&RC[-8])&IF(RC[-7]="",,"|n"&R1C26&RC[-7])&IF(RC[-6]="",,"|n"&R1C27&RC[-6])&IF(RC[-5]="",,"|n"&R1C28&RC[-5])&IF(RC[-2]="",,"|n"&RC[-2]) -> 
AG1047: =IF(RC[-26]&RC[-25]&RC[-24]&RC[-23]&RC[-22]&RC[-21]="",,R1C6)&IF(RC[-26]="",,"|n"&R1C7&RC[-26])&IF(RC[-25]="",,"|n"&R1C8&RC[-25])&IF(RC[-24]="",,"|n"&R1C9&RC[-24])&IF(RC[-23]="",,"|n"&R1C10&RC[-23])&IF(RC[-22]="",,"|n"&R1C11&RC[-22])&IF(RC[-21]="",,"|n"&R1C12&RC[-21])&IF(RC[-19]&RC[-18]&RC[-17]&RC[-16]="",,"|n"&R1C13)&IF(RC[-19]="",,"|n"&R1C14&RC[-19])&IF(RC[-18]="",,"|n"&R1C15&RC[-18])&IF(RC[-17]="",,"|n"&R1C16&RC[-17])&IF(RC[-16]="",,"|n"&R1C17&RC[-16])&IF(RC[-15]="",,"|n"&R1C18&RC[-15])&IF(RC[-14]="",,"|n"&R1C19&RC[-14])&IF(RC[-13]="",,"|n"&R1C20&RC[-13])&IF(RC[-12]="",,"|n"&R1C21&RC[-12])&IF(RC[-10]="",,"|n"&R1C23&RC[-10])&IF(RC[-9]="",,"|n"&R1C24&RC[-9])&IF(RC[-8]="",,"|n"&R1C25&RC[-8])&IF(RC[-7]="",,"|n"&R1C26&RC[-7])&IF(RC[-6]="",,"|n"&R1C27&RC[-6])&IF(RC[-5]="",,"|n"&R1C28&RC[-5])&IF(RC[-2]="",,"|n"&RC[-2]) -> 
AG1048: =IF(RC[-26]&RC[-25]&RC[-24]&RC[-23]&RC[-22]&RC[-21]="",,R1C6)&IF(RC[-26]="",,"|n"&R1C7&RC[-26])&IF(RC[-25]="",,"|n"&R1C8&RC[-25])&IF(RC[-24]="",,"|n"&R1C9&RC[-24])&IF(RC[-23]="",,"|n"&R1C10&RC[-23])&IF(RC[-22]="",,"|n"&R1C11&RC[-22])&IF(RC[-21]="",,"|n"&R1C12&RC[-21])&IF(RC[-19]&RC[-18]&RC[-17]&RC[-16]="",,"|n"&R1C13)&IF(RC[-19]="",,"|n"&R1C14&RC[-19])&IF(RC[-18]="",,"|n"&R1C15&RC[-18])&IF(RC[-17]="",,"|n"&R1C16&RC[-17])&IF(RC[-16]="",,"|n"&R1C17&RC[-16])&IF(RC[-15]="",,"|n"&R1C18&RC[-15])&IF(RC[-14]="",,"|n"&R1C19&RC[-14])&IF(RC[-13]="",,"|n"&R1C20&RC[-13])&IF(RC[-12]="",,"|n"&R1C21&RC[-12])&IF(RC[-10]="",,"|n"&R1C23&RC[-10])&IF(RC[-9]="",,"|n"&R1C24&RC[-9])&IF(RC[-8]="",,"|n"&R1C25&RC[-8])&IF(RC[-7]="",,"|n"&R1C26&RC[-7])&IF(RC[-6]="",,"|n"&R1C27&RC[-6])&IF(RC[-5]="",,"|n"&R1C28&RC[-5])&IF(RC[-2]="",,"|n"&RC[-2]) -> 
AG1049: =IF(RC[-26]&RC[-25]&RC[-24]&RC[-23]&RC[-22]&RC[-21]="",,R1C6)&IF(RC[-26]="",,"|n"&R1C7&RC[-26])&IF(RC[-25]="",,"|n"&R1C8&RC[-25])&IF(RC[-24]="",,"|n"&R1C9&RC[-24])&IF(RC[-23]="",,"|n"&R1C10&RC[-23])&IF(RC[-22]="",,"|n"&R1C11&RC[-22])&IF(RC[-21]="",,"|n"&R1C12&RC[-21])&IF(RC[-19]&RC[-18]&RC[-17]&RC[-16]="",,"|n"&R1C13)&IF(RC[-19]="",,"|n"&R1C14&RC[-19])&IF(RC[-18]="",,"|n"&R1C15&RC[-18])&IF(RC[-17]="",,"|n"&R1C16&RC[-17])&IF(RC[-16]="",,"|n"&R1C17&RC[-16])&IF(RC[-15]="",,"|n"&R1C18&RC[-15])&IF(RC[-14]="",,"|n"&R1C19&RC[-14])&IF(RC[-13]="",,"|n"&R1C20&RC[-13])&IF(RC[-12]="",,"|n"&R1C21&RC[-12])&IF(RC[-10]="",,"|n"&R1C23&RC[-10])&IF(RC[-9]="",,"|n"&R1C24&RC[-9])&IF(RC[-8]="",,"|n"&R1C25&RC[-8])&IF(RC[-7]="",,"|n"&R1C26&RC[-7])&IF(RC[-6]="",,"|n"&R1C27&RC[-6])&IF(RC[-5]="",,"|n"&R1C28&RC[-5])&IF(RC[-2]="",,"|n"&RC[-2]) -> 
AG1050: =IF(RC[-26]&RC[-25]&RC[-24]&RC[-23]&RC[-22]&RC[-21]="",,R1C6)&IF(RC[-26]="",,"|n"&R1C7&RC[-26])&IF(RC[-25]="",,"|n"&R1C8&RC[-25])&IF(RC[-24]="",,"|n"&R1C9&RC[-24])&IF(RC[-23]="",,"|n"&R1C10&RC[-23])&IF(RC[-22]="",,"|n"&R1C11&RC[-22])&IF(RC[-21]="",,"|n"&R1C12&RC[-21])&IF(RC[-19]&RC[-18]&RC[-17]&RC[-16]="",,"|n"&R1C13)&IF(RC[-19]="",,"|n"&R1C14&RC[-19])&IF(RC[-18]="",,"|n"&R1C15&RC[-18])&IF(RC[-17]="",,"|n"&R1C16&RC[-17])&IF(RC[-16]="",,"|n"&R1C17&RC[-16])&IF(RC[-15]="",,"|n"&R1C18&RC[-15])&IF(RC[-14]="",,"|n"&R1C19&RC[-14])&IF(RC[-13]="",,"|n"&R1C20&RC[-13])&IF(RC[-12]="",,"|n"&R1C21&RC[-12])&IF(RC[-10]="",,"|n"&R1C23&RC[-10])&IF(RC[-9]="",,"|n"&R1C24&RC[-9])&IF(RC[-8]="",,"|n"&R1C25&RC[-8])&IF(RC[-7]="",,"|n"&R1C26&RC[-7])&IF(RC[-6]="",,"|n"&R1C27&RC[-6])&IF(RC[-5]="",,"|n"&R1C28&RC[-5])&IF(RC[-2]="",,"|n"&RC[-2]) -> 
AG1051: =IF(RC[-26]&RC[-25]&RC[-24]&RC[-23]&RC[-22]&RC[-21]="",,R1C6)&IF(RC[-26]="",,"|n"&R1C7&RC[-26])&IF(RC[-25]="",,"|n"&R1C8&RC[-25])&IF(RC[-24]="",,"|n"&R1C9&RC[-24])&IF(RC[-23]="",,"|n"&R1C10&RC[-23])&IF(RC[-22]="",,"|n"&R1C11&RC[-22])&IF(RC[-21]="",,"|n"&R1C12&RC[-21])&IF(RC[-19]&RC[-18]&RC[-17]&RC[-16]="",,"|n"&R1C13)&IF(RC[-19]="",,"|n"&R1C14&RC[-19])&IF(RC[-18]="",,"|n"&R1C15&RC[-18])&IF(RC[-17]="",,"|n"&R1C16&RC[-17])&IF(RC[-16]="",,"|n"&R1C17&RC[-16])&IF(RC[-15]="",,"|n"&R1C18&RC[-15])&IF(RC[-14]="",,"|n"&R1C19&RC[-14])&IF(RC[-13]="",,"|n"&R1C20&RC[-13])&IF(RC[-12]="",,"|n"&R1C21&RC[-12])&IF(RC[-10]="",,"|n"&R1C23&RC[-10])&IF(RC[-9]="",,"|n"&R1C24&RC[-9])&IF(RC[-8]="",,"|n"&R1C25&RC[-8])&IF(RC[-7]="",,"|n"&R1C26&RC[-7])&IF(RC[-6]="",,"|n"&R1C27&RC[-6])&IF(RC[-5]="",,"|n"&R1C28&RC[-5])&IF(RC[-2]="",,"|n"&RC[-2]) -> 
AG1052: =IF(RC[-26]&RC[-25]&RC[-24]&RC[-23]&RC[-22]&RC[-21]="",,R1C6)&IF(RC[-26]="",,"|n"&R1C7&RC[-26])&IF(RC[-25]="",,"|n"&R1C8&RC[-25])&IF(RC[-24]="",,"|n"&R1C9&RC[-24])&IF(RC[-23]="",,"|n"&R1C10&RC[-23])&IF(RC[-22]="",,"|n"&R1C11&RC[-22])&IF(RC[-21]="",,"|n"&R1C12&RC[-21])&IF(RC[-19]&RC[-18]&RC[-17]&RC[-16]="",,"|n"&R1C13)&IF(RC[-19]="",,"|n"&R1C14&RC[-19])&IF(RC[-18]="",,"|n"&R1C15&RC[-18])&IF(RC[-17]="",,"|n"&R1C16&RC[-17])&IF(RC[-16]="",,"|n"&R1C17&RC[-16])&IF(RC[-15]="",,"|n"&R1C18&RC[-15])&IF(RC[-14]="",,"|n"&R1C19&RC[-14])&IF(RC[-13]="",,"|n"&R1C20&RC[-13])&IF(RC[-12]="",,"|n"&R1C21&RC[-12])&IF(RC[-10]="",,"|n"&R1C23&RC[-10])&IF(RC[-9]="",,"|n"&R1C24&RC[-9])&IF(RC[-8]="",,"|n"&R1C25&RC[-8])&IF(RC[-7]="",,"|n"&R1C26&RC[-7])&IF(RC[-6]="",,"|n"&R1C27&RC[-6])&IF(RC[-5]="",,"|n"&R1C28&RC[-5])&IF(RC[-2]="",,"|n"&RC[-2]) -> 
AG1053: =IF(RC[-26]&RC[-25]&RC[-24]&RC[-23]&RC[-22]&RC[-21]="",,R1C6)&IF(RC[-26]="",,"|n"&R1C7&RC[-26])&IF(RC[-25]="",,"|n"&R1C8&RC[-25])&IF(RC[-24]="",,"|n"&R1C9&RC[-24])&IF(RC[-23]="",,"|n"&R1C10&RC[-23])&IF(RC[-22]="",,"|n"&R1C11&RC[-22])&IF(RC[-21]="",,"|n"&R1C12&RC[-21])&IF(RC[-19]&RC[-18]&RC[-17]&RC[-16]="",,"|n"&R1C13)&IF(RC[-19]="",,"|n"&R1C14&RC[-19])&IF(RC[-18]="",,"|n"&R1C15&RC[-18])&IF(RC[-17]="",,"|n"&R1C16&RC[-17])&IF(RC[-16]="",,"|n"&R1C17&RC[-16])&IF(RC[-15]="",,"|n"&R1C18&RC[-15])&IF(RC[-14]="",,"|n"&R1C19&RC[-14])&IF(RC[-13]="",,"|n"&R1C20&RC[-13])&IF(RC[-12]="",,"|n"&R1C21&RC[-12])&IF(RC[-10]="",,"|n"&R1C23&RC[-10])&IF(RC[-9]="",,"|n"&R1C24&RC[-9])&IF(RC[-8]="",,"|n"&R1C25&RC[-8])&IF(RC[-7]="",,"|n"&R1C26&RC[-7])&IF(RC[-6]="",,"|n"&R1C27&RC[-6])&IF(RC[-5]="",,"|n"&R1C28&RC[-5])&IF(RC[-2]="",,"|n"&RC[-2]) -> 
AG1054: =IF(RC[-26]&RC[-25]&RC[-24]&RC[-23]&RC[-22]&RC[-21]="",,R1C6)&IF(RC[-26]="",,"|n"&R1C7&RC[-26])&IF(RC[-25]="",,"|n"&R1C8&RC[-25])&IF(RC[-24]="",,"|n"&R1C9&RC[-24])&IF(RC[-23]="",,"|n"&R1C10&RC[-23])&IF(RC[-22]="",,"|n"&R1C11&RC[-22])&IF(RC[-21]="",,"|n"&R1C12&RC[-21])&IF(RC[-19]&RC[-18]&RC[-17]&RC[-16]="",,"|n"&R1C13)&IF(RC[-19]="",,"|n"&R1C14&RC[-19])&IF(RC[-18]="",,"|n"&R1C15&RC[-18])&IF(RC[-17]="",,"|n"&R1C16&RC[-17])&IF(RC[-16]="",,"|n"&R1C17&RC[-16])&IF(RC[-15]="",,"|n"&R1C18&RC[-15])&IF(RC[-14]="",,"|n"&R1C19&RC[-14])&IF(RC[-13]="",,"|n"&R1C20&RC[-13])&IF(RC[-12]="",,"|n"&R1C21&RC[-12])&IF(RC[-10]="",,"|n"&R1C23&RC[-10])&IF(RC[-9]="",,"|n"&R1C24&RC[-9])&IF(RC[-8]="",,"|n"&R1C25&RC[-8])&IF(RC[-7]="",,"|n"&R1C26&RC[-7])&IF(RC[-6]="",,"|n"&R1C27&RC[-6])&IF(RC[-5]="",,"|n"&R1C28&RC[-5])&IF(RC[-2]="",,"|n"&RC[-2]) -> 
AG1055: =IF(RC[-26]&RC[-25]&RC[-24]&RC[-23]&RC[-22]&RC[-21]="",,R1C6)&IF(RC[-26]="",,"|n"&R1C7&RC[-26])&IF(RC[-25]="",,"|n"&R1C8&RC[-25])&IF(RC[-24]="",,"|n"&R1C9&RC[-24])&IF(RC[-23]="",,"|n"&R1C10&RC[-23])&IF(RC[-22]="",,"|n"&R1C11&RC[-22])&IF(RC[-21]="",,"|n"&R1C12&RC[-21])&IF(RC[-19]&RC[-18]&RC[-17]&RC[-16]="",,"|n"&R1C13)&IF(RC[-19]="",,"|n"&R1C14&RC[-19])&IF(RC[-18]="",,"|n"&R1C15&RC[-18])&IF(RC[-17]="",,"|n"&R1C16&RC[-17])&IF(RC[-16]="",,"|n"&R1C17&RC[-16])&IF(RC[-15]="",,"|n"&R1C18&RC[-15])&IF(RC[-14]="",,"|n"&R1C19&RC[-14])&IF(RC[-13]="",,"|n"&R1C20&RC[-13])&IF(RC[-12]="",,"|n"&R1C21&RC[-12])&IF(RC[-10]="",,"|n"&R1C23&RC[-10])&IF(RC[-9]="",,"|n"&R1C24&RC[-9])&IF(RC[-8]="",,"|n"&R1C25&RC[-8])&IF(RC[-7]="",,"|n"&R1C26&RC[-7])&IF(RC[-6]="",,"|n"&R1C27&RC[-6])&IF(RC[-5]="",,"|n"&R1C28&RC[-5])&IF(RC[-2]="",,"|n"&RC[-2]) -> 
AG1056: =IF(RC[-26]&RC[-25]&RC[-24]&RC[-23]&RC[-22]&RC[-21]="",,R1C6)&IF(RC[-26]="",,"|n"&R1C7&RC[-26])&IF(RC[-25]="",,"|n"&R1C8&RC[-25])&IF(RC[-24]="",,"|n"&R1C9&RC[-24])&IF(RC[-23]="",,"|n"&R1C10&RC[-23])&IF(RC[-22]="",,"|n"&R1C11&RC[-22])&IF(RC[-21]="",,"|n"&R1C12&RC[-21])&IF(RC[-19]&RC[-18]&RC[-17]&RC[-16]="",,"|n"&R1C13)&IF(RC[-19]="",,"|n"&R1C14&RC[-19])&IF(RC[-18]="",,"|n"&R1C15&RC[-18])&IF(RC[-17]="",,"|n"&R1C16&RC[-17])&IF(RC[-16]="",,"|n"&R1C17&RC[-16])&IF(RC[-15]="",,"|n"&R1C18&RC[-15])&IF(RC[-14]="",,"|n"&R1C19&RC[-14])&IF(RC[-13]="",,"|n"&R1C20&RC[-13])&IF(RC[-12]="",,"|n"&R1C21&RC[-12])&IF(RC[-10]="",,"|n"&R1C23&RC[-10])&IF(RC[-9]="",,"|n"&R1C24&RC[-9])&IF(RC[-8]="",,"|n"&R1C25&RC[-8])&IF(RC[-7]="",,"|n"&R1C26&RC[-7])&IF(RC[-6]="",,"|n"&R1C27&RC[-6])&IF(RC[-5]="",,"|n"&R1C28&RC[-5])&IF(RC[-2]="",,"|n"&RC[-2]) -> 
AG1057: =IF(RC[-26]&RC[-25]&RC[-24]&RC[-23]&RC[-22]&RC[-21]="",,R1C6)&IF(RC[-26]="",,"|n"&R1C7&RC[-26])&IF(RC[-25]="",,"|n"&R1C8&RC[-25])&IF(RC[-24]="",,"|n"&R1C9&RC[-24])&IF(RC[-23]="",,"|n"&R1C10&RC[-23])&IF(RC[-22]="",,"|n"&R1C11&RC[-22])&IF(RC[-21]="",,"|n"&R1C12&RC[-21])&IF(RC[-19]&RC[-18]&RC[-17]&RC[-16]="",,"|n"&R1C13)&IF(RC[-19]="",,"|n"&R1C14&RC[-19])&IF(RC[-18]="",,"|n"&R1C15&RC[-18])&IF(RC[-17]="",,"|n"&R1C16&RC[-17])&IF(RC[-16]="",,"|n"&R1C17&RC[-16])&IF(RC[-15]="",,"|n"&R1C18&RC[-15])&IF(RC[-14]="",,"|n"&R1C19&RC[-14])&IF(RC[-13]="",,"|n"&R1C20&RC[-13])&IF(RC[-12]="",,"|n"&R1C21&RC[-12])&IF(RC[-10]="",,"|n"&R1C23&RC[-10])&IF(RC[-9]="",,"|n"&R1C24&RC[-9])&IF(RC[-8]="",,"|n"&R1C25&RC[-8])&IF(RC[-7]="",,"|n"&R1C26&RC[-7])&IF(RC[-6]="",,"|n"&R1C27&RC[-6])&IF(RC[-5]="",,"|n"&R1C28&RC[-5])&IF(RC[-2]="",,"|n"&RC[-2]) -> 
AG1058: =IF(RC[-26]&RC[-25]&RC[-24]&RC[-23]&RC[-22]&RC[-21]="",,R1C6)&IF(RC[-26]="",,"|n"&R1C7&RC[-26])&IF(RC[-25]="",,"|n"&R1C8&RC[-25])&IF(RC[-24]="",,"|n"&R1C9&RC[-24])&IF(RC[-23]="",,"|n"&R1C10&RC[-23])&IF(RC[-22]="",,"|n"&R1C11&RC[-22])&IF(RC[-21]="",,"|n"&R1C12&RC[-21])&IF(RC[-19]&RC[-18]&RC[-17]&RC[-16]="",,"|n"&R1C13)&IF(RC[-19]="",,"|n"&R1C14&RC[-19])&IF(RC[-18]="",,"|n"&R1C15&RC[-18])&IF(RC[-17]="",,"|n"&R1C16&RC[-17])&IF(RC[-16]="",,"|n"&R1C17&RC[-16])&IF(RC[-15]="",,"|n"&R1C18&RC[-15])&IF(RC[-14]="",,"|n"&R1C19&RC[-14])&IF(RC[-13]="",,"|n"&R1C20&RC[-13])&IF(RC[-12]="",,"|n"&R1C21&RC[-12])&IF(RC[-10]="",,"|n"&R1C23&RC[-10])&IF(RC[-9]="",,"|n"&R1C24&RC[-9])&IF(RC[-8]="",,"|n"&R1C25&RC[-8])&IF(RC[-7]="",,"|n"&R1C26&RC[-7])&IF(RC[-6]="",,"|n"&R1C27&RC[-6])&IF(RC[-5]="",,"|n"&R1C28&RC[-5])&IF(RC[-2]="",,"|n"&RC[-2]) -> 
AG1059: =IF(RC[-26]&RC[-25]&RC[-24]&RC[-23]&RC[-22]&RC[-21]="",,R1C6)&IF(RC[-26]="",,"|n"&R1C7&RC[-26])&IF(RC[-25]="",,"|n"&R1C8&RC[-25])&IF(RC[-24]="",,"|n"&R1C9&RC[-24])&IF(RC[-23]="",,"|n"&R1C10&RC[-23])&IF(RC[-22]="",,"|n"&R1C11&RC[-22])&IF(RC[-21]="",,"|n"&R1C12&RC[-21])&IF(RC[-19]&RC[-18]&RC[-17]&RC[-16]="",,"|n"&R1C13)&IF(RC[-19]="",,"|n"&R1C14&RC[-19])&IF(RC[-18]="",,"|n"&R1C15&RC[-18])&IF(RC[-17]="",,"|n"&R1C16&RC[-17])&IF(RC[-16]="",,"|n"&R1C17&RC[-16])&IF(RC[-15]="",,"|n"&R1C18&RC[-15])&IF(RC[-14]="",,"|n"&R1C19&RC[-14])&IF(RC[-13]="",,"|n"&R1C20&RC[-13])&IF(RC[-12]="",,"|n"&R1C21&RC[-12])&IF(RC[-10]="",,"|n"&R1C23&RC[-10])&IF(RC[-9]="",,"|n"&R1C24&RC[-9])&IF(RC[-8]="",,"|n"&R1C25&RC[-8])&IF(RC[-7]="",,"|n"&R1C26&RC[-7])&IF(RC[-6]="",,"|n"&R1C27&RC[-6])&IF(RC[-5]="",,"|n"&R1C28&RC[-5])&IF(RC[-2]="",,"|n"&RC[-2]) -> 
AG1060: =IF(RC[-26]&RC[-25]&RC[-24]&RC[-23]&RC[-22]&RC[-21]="",,R1C6)&IF(RC[-26]="",,"|n"&R1C7&RC[-26])&IF(RC[-25]="",,"|n"&R1C8&RC[-25])&IF(RC[-24]="",,"|n"&R1C9&RC[-24])&IF(RC[-23]="",,"|n"&R1C10&RC[-23])&IF(RC[-22]="",,"|n"&R1C11&RC[-22])&IF(RC[-21]="",,"|n"&R1C12&RC[-21])&IF(RC[-19]&RC[-18]&RC[-17]&RC[-16]="",,"|n"&R1C13)&IF(RC[-19]="",,"|n"&R1C14&RC[-19])&IF(RC[-18]="",,"|n"&R1C15&RC[-18])&IF(RC[-17]="",,"|n"&R1C16&RC[-17])&IF(RC[-16]="",,"|n"&R1C17&RC[-16])&IF(RC[-15]="",,"|n"&R1C18&RC[-15])&IF(RC[-14]="",,"|n"&R1C19&RC[-14])&IF(RC[-13]="",,"|n"&R1C20&RC[-13])&IF(RC[-12]="",,"|n"&R1C21&RC[-12])&IF(RC[-10]="",,"|n"&R1C23&RC[-10])&IF(RC[-9]="",,"|n"&R1C24&RC[-9])&IF(RC[-8]="",,"|n"&R1C25&RC[-8])&IF(RC[-7]="",,"|n"&R1C26&RC[-7])&IF(RC[-6]="",,"|n"&R1C27&RC[-6])&IF(RC[-5]="",,"|n"&R1C28&RC[-5])&IF(RC[-2]="",,"|n"&RC[-2]) -> 
AG1061: =IF(RC[-26]&RC[-25]&RC[-24]&RC[-23]&RC[-22]&RC[-21]="",,R1C6)&IF(RC[-26]="",,"|n"&R1C7&RC[-26])&IF(RC[-25]="",,"|n"&R1C8&RC[-25])&IF(RC[-24]="",,"|n"&R1C9&RC[-24])&IF(RC[-23]="",,"|n"&R1C10&RC[-23])&IF(RC[-22]="",,"|n"&R1C11&RC[-22])&IF(RC[-21]="",,"|n"&R1C12&RC[-21])&IF(RC[-19]&RC[-18]&RC[-17]&RC[-16]="",,"|n"&R1C13)&IF(RC[-19]="",,"|n"&R1C14&RC[-19])&IF(RC[-18]="",,"|n"&R1C15&RC[-18])&IF(RC[-17]="",,"|n"&R1C16&RC[-17])&IF(RC[-16]="",,"|n"&R1C17&RC[-16])&IF(RC[-15]="",,"|n"&R1C18&RC[-15])&IF(RC[-14]="",,"|n"&R1C19&RC[-14])&IF(RC[-13]="",,"|n"&R1C20&RC[-13])&IF(RC[-12]="",,"|n"&R1C21&RC[-12])&IF(RC[-10]="",,"|n"&R1C23&RC[-10])&IF(RC[-9]="",,"|n"&R1C24&RC[-9])&IF(RC[-8]="",,"|n"&R1C25&RC[-8])&IF(RC[-7]="",,"|n"&R1C26&RC[-7])&IF(RC[-6]="",,"|n"&R1C27&RC[-6])&IF(RC[-5]="",,"|n"&R1C28&RC[-5])&IF(RC[-2]="",,"|n"&RC[-2]) -> 
AG1062: =IF(RC[-26]&RC[-25]&RC[-24]&RC[-23]&RC[-22]&RC[-21]="",,R1C6)&IF(RC[-26]="",,"|n"&R1C7&RC[-26])&IF(RC[-25]="",,"|n"&R1C8&RC[-25])&IF(RC[-24]="",,"|n"&R1C9&RC[-24])&IF(RC[-23]="",,"|n"&R1C10&RC[-23])&IF(RC[-22]="",,"|n"&R1C11&RC[-22])&IF(RC[-21]="",,"|n"&R1C12&RC[-21])&IF(RC[-19]&RC[-18]&RC[-17]&RC[-16]="",,"|n"&R1C13)&IF(RC[-19]="",,"|n"&R1C14&RC[-19])&IF(RC[-18]="",,"|n"&R1C15&RC[-18])&IF(RC[-17]="",,"|n"&R1C16&RC[-17])&IF(RC[-16]="",,"|n"&R1C17&RC[-16])&IF(RC[-15]="",,"|n"&R1C18&RC[-15])&IF(RC[-14]="",,"|n"&R1C19&RC[-14])&IF(RC[-13]="",,"|n"&R1C20&RC[-13])&IF(RC[-12]="",,"|n"&R1C21&RC[-12])&IF(RC[-10]="",,"|n"&R1C23&RC[-10])&IF(RC[-9]="",,"|n"&R1C24&RC[-9])&IF(RC[-8]="",,"|n"&R1C25&RC[-8])&IF(RC[-7]="",,"|n"&R1C26&RC[-7])&IF(RC[-6]="",,"|n"&R1C27&RC[-6])&IF(RC[-5]="",,"|n"&R1C28&RC[-5])&IF(RC[-2]="",,"|n"&RC[-2]) -> 
AG1063: =IF(RC[-26]&RC[-25]&RC[-24]&RC[-23]&RC[-22]&RC[-21]="",,R1C6)&IF(RC[-26]="",,"|n"&R1C7&RC[-26])&IF(RC[-25]="",,"|n"&R1C8&RC[-25])&IF(RC[-24]="",,"|n"&R1C9&RC[-24])&IF(RC[-23]="",,"|n"&R1C10&RC[-23])&IF(RC[-22]="",,"|n"&R1C11&RC[-22])&IF(RC[-21]="",,"|n"&R1C12&RC[-21])&IF(RC[-19]&RC[-18]&RC[-17]&RC[-16]="",,"|n"&R1C13)&IF(RC[-19]="",,"|n"&R1C14&RC[-19])&IF(RC[-18]="",,"|n"&R1C15&RC[-18])&IF(RC[-17]="",,"|n"&R1C16&RC[-17])&IF(RC[-16]="",,"|n"&R1C17&RC[-16])&IF(RC[-15]="",,"|n"&R1C18&RC[-15])&IF(RC[-14]="",,"|n"&R1C19&RC[-14])&IF(RC[-13]="",,"|n"&R1C20&RC[-13])&IF(RC[-12]="",,"|n"&R1C21&RC[-12])&IF(RC[-10]="",,"|n"&R1C23&RC[-10])&IF(RC[-9]="",,"|n"&R1C24&RC[-9])&IF(RC[-8]="",,"|n"&R1C25&RC[-8])&IF(RC[-7]="",,"|n"&R1C26&RC[-7])&IF(RC[-6]="",,"|n"&R1C27&RC[-6])&IF(RC[-5]="",,"|n"&R1C28&RC[-5])&IF(RC[-2]="",,"|n"&RC[-2]) -> 
AG1064: =IF(RC[-26]&RC[-25]&RC[-24]&RC[-23]&RC[-22]&RC[-21]="",,R1C6)&IF(RC[-26]="",,"|n"&R1C7&RC[-26])&IF(RC[-25]="",,"|n"&R1C8&RC[-25])&IF(RC[-24]="",,"|n"&R1C9&RC[-24])&IF(RC[-23]="",,"|n"&R1C10&RC[-23])&IF(RC[-22]="",,"|n"&R1C11&RC[-22])&IF(RC[-21]="",,"|n"&R1C12&RC[-21])&IF(RC[-19]&RC[-18]&RC[-17]&RC[-16]="",,"|n"&R1C13)&IF(RC[-19]="",,"|n"&R1C14&RC[-19])&IF(RC[-18]="",,"|n"&R1C15&RC[-18])&IF(RC[-17]="",,"|n"&R1C16&RC[-17])&IF(RC[-16]="",,"|n"&R1C17&RC[-16])&IF(RC[-15]="",,"|n"&R1C18&RC[-15])&IF(RC[-14]="",,"|n"&R1C19&RC[-14])&IF(RC[-13]="",,"|n"&R1C20&RC[-13])&IF(RC[-12]="",,"|n"&R1C21&RC[-12])&IF(RC[-10]="",,"|n"&R1C23&RC[-10])&IF(RC[-9]="",,"|n"&R1C24&RC[-9])&IF(RC[-8]="",,"|n"&R1C25&RC[-8])&IF(RC[-7]="",,"|n"&R1C26&RC[-7])&IF(RC[-6]="",,"|n"&R1C27&RC[-6])&IF(RC[-5]="",,"|n"&R1C28&RC[-5])&IF(RC[-2]="",,"|n"&RC[-2]) -> 
AG1065: =IF(RC[-26]&RC[-25]&RC[-24]&RC[-23]&RC[-22]&RC[-21]="",,R1C6)&IF(RC[-26]="",,"|n"&R1C7&RC[-26])&IF(RC[-25]="",,"|n"&R1C8&RC[-25])&IF(RC[-24]="",,"|n"&R1C9&RC[-24])&IF(RC[-23]="",,"|n"&R1C10&RC[-23])&IF(RC[-22]="",,"|n"&R1C11&RC[-22])&IF(RC[-21]="",,"|n"&R1C12&RC[-21])&IF(RC[-19]&RC[-18]&RC[-17]&RC[-16]="",,"|n"&R1C13)&IF(RC[-19]="",,"|n"&R1C14&RC[-19])&IF(RC[-18]="",,"|n"&R1C15&RC[-18])&IF(RC[-17]="",,"|n"&R1C16&RC[-17])&IF(RC[-16]="",,"|n"&R1C17&RC[-16])&IF(RC[-15]="",,"|n"&R1C18&RC[-15])&IF(RC[-14]="",,"|n"&R1C19&RC[-14])&IF(RC[-13]="",,"|n"&R1C20&RC[-13])&IF(RC[-12]="",,"|n"&R1C21&RC[-12])&IF(RC[-10]="",,"|n"&R1C23&RC[-10])&IF(RC[-9]="",,"|n"&R1C24&RC[-9])&IF(RC[-8]="",,"|n"&R1C25&RC[-8])&IF(RC[-7]="",,"|n"&R1C26&RC[-7])&IF(RC[-6]="",,"|n"&R1C27&RC[-6])&IF(RC[-5]="",,"|n"&R1C28&RC[-5])&IF(RC[-2]="",,"|n"&RC[-2]) -> 
AG1066: =IF(RC[-26]&RC[-25]&RC[-24]&RC[-23]&RC[-22]&RC[-21]="",,R1C6)&IF(RC[-26]="",,"|n"&R1C7&RC[-26])&IF(RC[-25]="",,"|n"&R1C8&RC[-25])&IF(RC[-24]="",,"|n"&R1C9&RC[-24])&IF(RC[-23]="",,"|n"&R1C10&RC[-23])&IF(RC[-22]="",,"|n"&R1C11&RC[-22])&IF(RC[-21]="",,"|n"&R1C12&RC[-21])&IF(RC[-19]&RC[-18]&RC[-17]&RC[-16]="",,"|n"&R1C13)&IF(RC[-19]="",,"|n"&R1C14&RC[-19])&IF(RC[-18]="",,"|n"&R1C15&RC[-18])&IF(RC[-17]="",,"|n"&R1C16&RC[-17])&IF(RC[-16]="",,"|n"&R1C17&RC[-16])&IF(RC[-15]="",,"|n"&R1C18&RC[-15])&IF(RC[-14]="",,"|n"&R1C19&RC[-14])&IF(RC[-13]="",,"|n"&R1C20&RC[-13])&IF(RC[-12]="",,"|n"&R1C21&RC[-12])&IF(RC[-10]="",,"|n"&R1C23&RC[-10])&IF(RC[-9]="",,"|n"&R1C24&RC[-9])&IF(RC[-8]="",,"|n"&R1C25&RC[-8])&IF(RC[-7]="",,"|n"&R1C26&RC[-7])&IF(RC[-6]="",,"|n"&R1C27&RC[-6])&IF(RC[-5]="",,"|n"&R1C28&RC[-5])&IF(RC[-2]="",,"|n"&RC[-2]) -> 
AG1067: =IF(RC[-26]&RC[-25]&RC[-24]&RC[-23]&RC[-22]&RC[-21]="",,R1C6)&IF(RC[-26]="",,"|n"&R1C7&RC[-26])&IF(RC[-25]="",,"|n"&R1C8&RC[-25])&IF(RC[-24]="",,"|n"&R1C9&RC[-24])&IF(RC[-23]="",,"|n"&R1C10&RC[-23])&IF(RC[-22]="",,"|n"&R1C11&RC[-22])&IF(RC[-21]="",,"|n"&R1C12&RC[-21])&IF(RC[-19]&RC[-18]&RC[-17]&RC[-16]="",,"|n"&R1C13)&IF(RC[-19]="",,"|n"&R1C14&RC[-19])&IF(RC[-18]="",,"|n"&R1C15&RC[-18])&IF(RC[-17]="",,"|n"&R1C16&RC[-17])&IF(RC[-16]="",,"|n"&R1C17&RC[-16])&IF(RC[-15]="",,"|n"&R1C18&RC[-15])&IF(RC[-14]="",,"|n"&R1C19&RC[-14])&IF(RC[-13]="",,"|n"&R1C20&RC[-13])&IF(RC[-12]="",,"|n"&R1C21&RC[-12])&IF(RC[-10]="",,"|n"&R1C23&RC[-10])&IF(RC[-9]="",,"|n"&R1C24&RC[-9])&IF(RC[-8]="",,"|n"&R1C25&RC[-8])&IF(RC[-7]="",,"|n"&R1C26&RC[-7])&IF(RC[-6]="",,"|n"&R1C27&RC[-6])&IF(RC[-5]="",,"|n"&R1C28&RC[-5])&IF(RC[-2]="",,"|n"&RC[-2]) -> 
AG1068: =IF(RC[-26]&RC[-25]&RC[-24]&RC[-23]&RC[-22]&RC[-21]="",,R1C6)&IF(RC[-26]="",,"|n"&R1C7&RC[-26])&IF(RC[-25]="",,"|n"&R1C8&RC[-25])&IF(RC[-24]="",,"|n"&R1C9&RC[-24])&IF(RC[-23]="",,"|n"&R1C10&RC[-23])&IF(RC[-22]="",,"|n"&R1C11&RC[-22])&IF(RC[-21]="",,"|n"&R1C12&RC[-21])&IF(RC[-19]&RC[-18]&RC[-17]&RC[-16]="",,"|n"&R1C13)&IF(RC[-19]="",,"|n"&R1C14&RC[-19])&IF(RC[-18]="",,"|n"&R1C15&RC[-18])&IF(RC[-17]="",,"|n"&R1C16&RC[-17])&IF(RC[-16]="",,"|n"&R1C17&RC[-16])&IF(RC[-15]="",,"|n"&R1C18&RC[-15])&IF(RC[-14]="",,"|n"&R1C19&RC[-14])&IF(RC[-13]="",,"|n"&R1C20&RC[-13])&IF(RC[-12]="",,"|n"&R1C21&RC[-12])&IF(RC[-10]="",,"|n"&R1C23&RC[-10])&IF(RC[-9]="",,"|n"&R1C24&RC[-9])&IF(RC[-8]="",,"|n"&R1C25&RC[-8])&IF(RC[-7]="",,"|n"&R1C26&RC[-7])&IF(RC[-6]="",,"|n"&R1C27&RC[-6])&IF(RC[-5]="",,"|n"&R1C28&RC[-5])&IF(RC[-2]="",,"|n"&RC[-2]) -> 
AG1069: =IF(RC[-26]&RC[-25]&RC[-24]&RC[-23]&RC[-22]&RC[-21]="",,R1C6)&IF(RC[-26]="",,"|n"&R1C7&RC[-26])&IF(RC[-25]="",,"|n"&R1C8&RC[-25])&IF(RC[-24]="",,"|n"&R1C9&RC[-24])&IF(RC[-23]="",,"|n"&R1C10&RC[-23])&IF(RC[-22]="",,"|n"&R1C11&RC[-22])&IF(RC[-21]="",,"|n"&R1C12&RC[-21])&IF(RC[-19]&RC[-18]&RC[-17]&RC[-16]="",,"|n"&R1C13)&IF(RC[-19]="",,"|n"&R1C14&RC[-19])&IF(RC[-18]="",,"|n"&R1C15&RC[-18])&IF(RC[-17]="",,"|n"&R1C16&RC[-17])&IF(RC[-16]="",,"|n"&R1C17&RC[-16])&IF(RC[-15]="",,"|n"&R1C18&RC[-15])&IF(RC[-14]="",,"|n"&R1C19&RC[-14])&IF(RC[-13]="",,"|n"&R1C20&RC[-13])&IF(RC[-12]="",,"|n"&R1C21&RC[-12])&IF(RC[-10]="",,"|n"&R1C23&RC[-10])&IF(RC[-9]="",,"|n"&R1C24&RC[-9])&IF(RC[-8]="",,"|n"&R1C25&RC[-8])&IF(RC[-7]="",,"|n"&R1C26&RC[-7])&IF(RC[-6]="",,"|n"&R1C27&RC[-6])&IF(RC[-5]="",,"|n"&R1C28&RC[-5])&IF(RC[-2]="",,"|n"&RC[-2]) -> 
AG1070: =IF(RC[-26]&RC[-25]&RC[-24]&RC[-23]&RC[-22]&RC[-21]="",,R1C6)&IF(RC[-26]="",,"|n"&R1C7&RC[-26])&IF(RC[-25]="",,"|n"&R1C8&RC[-25])&IF(RC[-24]="",,"|n"&R1C9&RC[-24])&IF(RC[-23]="",,"|n"&R1C10&RC[-23])&IF(RC[-22]="",,"|n"&R1C11&RC[-22])&IF(RC[-21]="",,"|n"&R1C12&RC[-21])&IF(RC[-19]&RC[-18]&RC[-17]&RC[-16]="",,"|n"&R1C13)&IF(RC[-19]="",,"|n"&R1C14&RC[-19])&IF(RC[-18]="",,"|n"&R1C15&RC[-18])&IF(RC[-17]="",,"|n"&R1C16&RC[-17])&IF(RC[-16]="",,"|n"&R1C17&RC[-16])&IF(RC[-15]="",,"|n"&R1C18&RC[-15])&IF(RC[-14]="",,"|n"&R1C19&RC[-14])&IF(RC[-13]="",,"|n"&R1C20&RC[-13])&IF(RC[-12]="",,"|n"&R1C21&RC[-12])&IF(RC[-10]="",,"|n"&R1C23&RC[-10])&IF(RC[-9]="",,"|n"&R1C24&RC[-9])&IF(RC[-8]="",,"|n"&R1C25&RC[-8])&IF(RC[-7]="",,"|n"&R1C26&RC[-7])&IF(RC[-6]="",,"|n"&R1C27&RC[-6])&IF(RC[-5]="",,"|n"&R1C28&RC[-5])&IF(RC[-2]="",,"|n"&RC[-2]) -> 
AG1071: =IF(RC[-26]&RC[-25]&RC[-24]&RC[-23]&RC[-22]&RC[-21]="",,R1C6)&IF(RC[-26]="",,"|n"&R1C7&RC[-26])&IF(RC[-25]="",,"|n"&R1C8&RC[-25])&IF(RC[-24]="",,"|n"&R1C9&RC[-24])&IF(RC[-23]="",,"|n"&R1C10&RC[-23])&IF(RC[-22]="",,"|n"&R1C11&RC[-22])&IF(RC[-21]="",,"|n"&R1C12&RC[-21])&IF(RC[-19]&RC[-18]&RC[-17]&RC[-16]="",,"|n"&R1C13)&IF(RC[-19]="",,"|n"&R1C14&RC[-19])&IF(RC[-18]="",,"|n"&R1C15&RC[-18])&IF(RC[-17]="",,"|n"&R1C16&RC[-17])&IF(RC[-16]="",,"|n"&R1C17&RC[-16])&IF(RC[-15]="",,"|n"&R1C18&RC[-15])&IF(RC[-14]="",,"|n"&R1C19&RC[-14])&IF(RC[-13]="",,"|n"&R1C20&RC[-13])&IF(RC[-12]="",,"|n"&R1C21&RC[-12])&IF(RC[-10]="",,"|n"&R1C23&RC[-10])&IF(RC[-9]="",,"|n"&R1C24&RC[-9])&IF(RC[-8]="",,"|n"&R1C25&RC[-8])&IF(RC[-7]="",,"|n"&R1C26&RC[-7])&IF(RC[-6]="",,"|n"&R1C27&RC[-6])&IF(RC[-5]="",,"|n"&R1C28&RC[-5])&IF(RC[-2]="",,"|n"&RC[-2]) -> 
AG1072: =IF(RC[-26]&RC[-25]&RC[-24]&RC[-23]&RC[-22]&RC[-21]="",,R1C6)&IF(RC[-26]="",,"|n"&R1C7&RC[-26])&IF(RC[-25]="",,"|n"&R1C8&RC[-25])&IF(RC[-24]="",,"|n"&R1C9&RC[-24])&IF(RC[-23]="",,"|n"&R1C10&RC[-23])&IF(RC[-22]="",,"|n"&R1C11&RC[-22])&IF(RC[-21]="",,"|n"&R1C12&RC[-21])&IF(RC[-19]&RC[-18]&RC[-17]&RC[-16]="",,"|n"&R1C13)&IF(RC[-19]="",,"|n"&R1C14&RC[-19])&IF(RC[-18]="",,"|n"&R1C15&RC[-18])&IF(RC[-17]="",,"|n"&R1C16&RC[-17])&IF(RC[-16]="",,"|n"&R1C17&RC[-16])&IF(RC[-15]="",,"|n"&R1C18&RC[-15])&IF(RC[-14]="",,"|n"&R1C19&RC[-14])&IF(RC[-13]="",,"|n"&R1C20&RC[-13])&IF(RC[-12]="",,"|n"&R1C21&RC[-12])&IF(RC[-10]="",,"|n"&R1C23&RC[-10])&IF(RC[-9]="",,"|n"&R1C24&RC[-9])&IF(RC[-8]="",,"|n"&R1C25&RC[-8])&IF(RC[-7]="",,"|n"&R1C26&RC[-7])&IF(RC[-6]="",,"|n"&R1C27&RC[-6])&IF(RC[-5]="",,"|n"&R1C28&RC[-5])&IF(RC[-2]="",,"|n"&RC[-2]) -> 
AG1073: =IF(RC[-26]&RC[-25]&RC[-24]&RC[-23]&RC[-22]&RC[-21]="",,R1C6)&IF(RC[-26]="",,"|n"&R1C7&RC[-26])&IF(RC[-25]="",,"|n"&R1C8&RC[-25])&IF(RC[-24]="",,"|n"&R1C9&RC[-24])&IF(RC[-23]="",,"|n"&R1C10&RC[-23])&IF(RC[-22]="",,"|n"&R1C11&RC[-22])&IF(RC[-21]="",,"|n"&R1C12&RC[-21])&IF(RC[-19]&RC[-18]&RC[-17]&RC[-16]="",,"|n"&R1C13)&IF(RC[-19]="",,"|n"&R1C14&RC[-19])&IF(RC[-18]="",,"|n"&R1C15&RC[-18])&IF(RC[-17]="",,"|n"&R1C16&RC[-17])&IF(RC[-16]="",,"|n"&R1C17&RC[-16])&IF(RC[-15]="",,"|n"&R1C18&RC[-15])&IF(RC[-14]="",,"|n"&R1C19&RC[-14])&IF(RC[-13]="",,"|n"&R1C20&RC[-13])&IF(RC[-12]="",,"|n"&R1C21&RC[-12])&IF(RC[-10]="",,"|n"&R1C23&RC[-10])&IF(RC[-9]="",,"|n"&R1C24&RC[-9])&IF(RC[-8]="",,"|n"&R1C25&RC[-8])&IF(RC[-7]="",,"|n"&R1C26&RC[-7])&IF(RC[-6]="",,"|n"&R1C27&RC[-6])&IF(RC[-5]="",,"|n"&R1C28&RC[-5])&IF(RC[-2]="",,"|n"&RC[-2]) -> 
AG1074: =IF(RC[-26]&RC[-25]&RC[-24]&RC[-23]&RC[-22]&RC[-21]="",,R1C6)&IF(RC[-26]="",,"|n"&R1C7&RC[-26])&IF(RC[-25]="",,"|n"&R1C8&RC[-25])&IF(RC[-24]="",,"|n"&R1C9&RC[-24])&IF(RC[-23]="",,"|n"&R1C10&RC[-23])&IF(RC[-22]="",,"|n"&R1C11&RC[-22])&IF(RC[-21]="",,"|n"&R1C12&RC[-21])&IF(RC[-19]&RC[-18]&RC[-17]&RC[-16]="",,"|n"&R1C13)&IF(RC[-19]="",,"|n"&R1C14&RC[-19])&IF(RC[-18]="",,"|n"&R1C15&RC[-18])&IF(RC[-17]="",,"|n"&R1C16&RC[-17])&IF(RC[-16]="",,"|n"&R1C17&RC[-16])&IF(RC[-15]="",,"|n"&R1C18&RC[-15])&IF(RC[-14]="",,"|n"&R1C19&RC[-14])&IF(RC[-13]="",,"|n"&R1C20&RC[-13])&IF(RC[-12]="",,"|n"&R1C21&RC[-12])&IF(RC[-10]="",,"|n"&R1C23&RC[-10])&IF(RC[-9]="",,"|n"&R1C24&RC[-9])&IF(RC[-8]="",,"|n"&R1C25&RC[-8])&IF(RC[-7]="",,"|n"&R1C26&RC[-7])&IF(RC[-6]="",,"|n"&R1C27&RC[-6])&IF(RC[-5]="",,"|n"&R1C28&RC[-5])&IF(RC[-2]="",,"|n"&RC[-2]) -> 
AG1075: =IF(RC[-26]&RC[-25]&RC[-24]&RC[-23]&RC[-22]&RC[-21]="",,R1C6)&IF(RC[-26]="",,"|n"&R1C7&RC[-26])&IF(RC[-25]="",,"|n"&R1C8&RC[-25])&IF(RC[-24]="",,"|n"&R1C9&RC[-24])&IF(RC[-23]="",,"|n"&R1C10&RC[-23])&IF(RC[-22]="",,"|n"&R1C11&RC[-22])&IF(RC[-21]="",,"|n"&R1C12&RC[-21])&IF(RC[-19]&RC[-18]&RC[-17]&RC[-16]="",,"|n"&R1C13)&IF(RC[-19]="",,"|n"&R1C14&RC[-19])&IF(RC[-18]="",,"|n"&R1C15&RC[-18])&IF(RC[-17]="",,"|n"&R1C16&RC[-17])&IF(RC[-16]="",,"|n"&R1C17&RC[-16])&IF(RC[-15]="",,"|n"&R1C18&RC[-15])&IF(RC[-14]="",,"|n"&R1C19&RC[-14])&IF(RC[-13]="",,"|n"&R1C20&RC[-13])&IF(RC[-12]="",,"|n"&R1C21&RC[-12])&IF(RC[-10]="",,"|n"&R1C23&RC[-10])&IF(RC[-9]="",,"|n"&R1C24&RC[-9])&IF(RC[-8]="",,"|n"&R1C25&RC[-8])&IF(RC[-7]="",,"|n"&R1C26&RC[-7])&IF(RC[-6]="",,"|n"&R1C27&RC[-6])&IF(RC[-5]="",,"|n"&R1C28&RC[-5])&IF(RC[-2]="",,"|n"&RC[-2]) -> 
AG1076: =IF(RC[-26]&RC[-25]&RC[-24]&RC[-23]&RC[-22]&RC[-21]="",,R1C6)&IF(RC[-26]="",,"|n"&R1C7&RC[-26])&IF(RC[-25]="",,"|n"&R1C8&RC[-25])&IF(RC[-24]="",,"|n"&R1C9&RC[-24])&IF(RC[-23]="",,"|n"&R1C10&RC[-23])&IF(RC[-22]="",,"|n"&R1C11&RC[-22])&IF(RC[-21]="",,"|n"&R1C12&RC[-21])&IF(RC[-19]&RC[-18]&RC[-17]&RC[-16]="",,"|n"&R1C13)&IF(RC[-19]="",,"|n"&R1C14&RC[-19])&IF(RC[-18]="",,"|n"&R1C15&RC[-18])&IF(RC[-17]="",,"|n"&R1C16&RC[-17])&IF(RC[-16]="",,"|n"&R1C17&RC[-16])&IF(RC[-15]="",,"|n"&R1C18&RC[-15])&IF(RC[-14]="",,"|n"&R1C19&RC[-14])&IF(RC[-13]="",,"|n"&R1C20&RC[-13])&IF(RC[-12]="",,"|n"&R1C21&RC[-12])&IF(RC[-10]="",,"|n"&R1C23&RC[-10])&IF(RC[-9]="",,"|n"&R1C24&RC[-9])&IF(RC[-8]="",,"|n"&R1C25&RC[-8])&IF(RC[-7]="",,"|n"&R1C26&RC[-7])&IF(RC[-6]="",,"|n"&R1C27&RC[-6])&IF(RC[-5]="",,"|n"&R1C28&RC[-5])&IF(RC[-2]="",,"|n"&RC[-2]) -> 
AG1077: =IF(RC[-26]&RC[-25]&RC[-24]&RC[-23]&RC[-22]&RC[-21]="",,R1C6)&IF(RC[-26]="",,"|n"&R1C7&RC[-26])&IF(RC[-25]="",,"|n"&R1C8&RC[-25])&IF(RC[-24]="",,"|n"&R1C9&RC[-24])&IF(RC[-23]="",,"|n"&R1C10&RC[-23])&IF(RC[-22]="",,"|n"&R1C11&RC[-22])&IF(RC[-21]="",,"|n"&R1C12&RC[-21])&IF(RC[-19]&RC[-18]&RC[-17]&RC[-16]="",,"|n"&R1C13)&IF(RC[-19]="",,"|n"&R1C14&RC[-19])&IF(RC[-18]="",,"|n"&R1C15&RC[-18])&IF(RC[-17]="",,"|n"&R1C16&RC[-17])&IF(RC[-16]="",,"|n"&R1C17&RC[-16])&IF(RC[-15]="",,"|n"&R1C18&RC[-15])&IF(RC[-14]="",,"|n"&R1C19&RC[-14])&IF(RC[-13]="",,"|n"&R1C20&RC[-13])&IF(RC[-12]="",,"|n"&R1C21&RC[-12])&IF(RC[-10]="",,"|n"&R1C23&RC[-10])&IF(RC[-9]="",,"|n"&R1C24&RC[-9])&IF(RC[-8]="",,"|n"&R1C25&RC[-8])&IF(RC[-7]="",,"|n"&R1C26&RC[-7])&IF(RC[-6]="",,"|n"&R1C27&RC[-6])&IF(RC[-5]="",,"|n"&R1C28&RC[-5])&IF(RC[-2]="",,"|n"&RC[-2]) -> 
AG1078: =IF(RC[-26]&RC[-25]&RC[-24]&RC[-23]&RC[-22]&RC[-21]="",,R1C6)&IF(RC[-26]="",,"|n"&R1C7&RC[-26])&IF(RC[-25]="",,"|n"&R1C8&RC[-25])&IF(RC[-24]="",,"|n"&R1C9&RC[-24])&IF(RC[-23]="",,"|n"&R1C10&RC[-23])&IF(RC[-22]="",,"|n"&R1C11&RC[-22])&IF(RC[-21]="",,"|n"&R1C12&RC[-21])&IF(RC[-19]&RC[-18]&RC[-17]&RC[-16]="",,"|n"&R1C13)&IF(RC[-19]="",,"|n"&R1C14&RC[-19])&IF(RC[-18]="",,"|n"&R1C15&RC[-18])&IF(RC[-17]="",,"|n"&R1C16&RC[-17])&IF(RC[-16]="",,"|n"&R1C17&RC[-16])&IF(RC[-15]="",,"|n"&R1C18&RC[-15])&IF(RC[-14]="",,"|n"&R1C19&RC[-14])&IF(RC[-13]="",,"|n"&R1C20&RC[-13])&IF(RC[-12]="",,"|n"&R1C21&RC[-12])&IF(RC[-10]="",,"|n"&R1C23&RC[-10])&IF(RC[-9]="",,"|n"&R1C24&RC[-9])&IF(RC[-8]="",,"|n"&R1C25&RC[-8])&IF(RC[-7]="",,"|n"&R1C26&RC[-7])&IF(RC[-6]="",,"|n"&R1C27&RC[-6])&IF(RC[-5]="",,"|n"&R1C28&RC[-5])&IF(RC[-2]="",,"|n"&RC[-2]) -> 
AG1079: =IF(RC[-26]&RC[-25]&RC[-24]&RC[-23]&RC[-22]&RC[-21]="",,R1C6)&IF(RC[-26]="",,"|n"&R1C7&RC[-26])&IF(RC[-25]="",,"|n"&R1C8&RC[-25])&IF(RC[-24]="",,"|n"&R1C9&RC[-24])&IF(RC[-23]="",,"|n"&R1C10&RC[-23])&IF(RC[-22]="",,"|n"&R1C11&RC[-22])&IF(RC[-21]="",,"|n"&R1C12&RC[-21])&IF(RC[-19]&RC[-18]&RC[-17]&RC[-16]="",,"|n"&R1C13)&IF(RC[-19]="",,"|n"&R1C14&RC[-19])&IF(RC[-18]="",,"|n"&R1C15&RC[-18])&IF(RC[-17]="",,"|n"&R1C16&RC[-17])&IF(RC[-16]="",,"|n"&R1C17&RC[-16])&IF(RC[-15]="",,"|n"&R1C18&RC[-15])&IF(RC[-14]="",,"|n"&R1C19&RC[-14])&IF(RC[-13]="",,"|n"&R1C20&RC[-13])&IF(RC[-12]="",,"|n"&R1C21&RC[-12])&IF(RC[-10]="",,"|n"&R1C23&RC[-10])&IF(RC[-9]="",,"|n"&R1C24&RC[-9])&IF(RC[-8]="",,"|n"&R1C25&RC[-8])&IF(RC[-7]="",,"|n"&R1C26&RC[-7])&IF(RC[-6]="",,"|n"&R1C27&RC[-6])&IF(RC[-5]="",,"|n"&R1C28&RC[-5])&IF(RC[-2]="",,"|n"&RC[-2]) -> 
AG1080: =IF(RC[-26]&RC[-25]&RC[-24]&RC[-23]&RC[-22]&RC[-21]="",,R1C6)&IF(RC[-26]="",,"|n"&R1C7&RC[-26])&IF(RC[-25]="",,"|n"&R1C8&RC[-25])&IF(RC[-24]="",,"|n"&R1C9&RC[-24])&IF(RC[-23]="",,"|n"&R1C10&RC[-23])&IF(RC[-22]="",,"|n"&R1C11&RC[-22])&IF(RC[-21]="",,"|n"&R1C12&RC[-21])&IF(RC[-19]&RC[-18]&RC[-17]&RC[-16]="",,"|n"&R1C13)&IF(RC[-19]="",,"|n"&R1C14&RC[-19])&IF(RC[-18]="",,"|n"&R1C15&RC[-18])&IF(RC[-17]="",,"|n"&R1C16&RC[-17])&IF(RC[-16]="",,"|n"&R1C17&RC[-16])&IF(RC[-15]="",,"|n"&R1C18&RC[-15])&IF(RC[-14]="",,"|n"&R1C19&RC[-14])&IF(RC[-13]="",,"|n"&R1C20&RC[-13])&IF(RC[-12]="",,"|n"&R1C21&RC[-12])&IF(RC[-10]="",,"|n"&R1C23&RC[-10])&IF(RC[-9]="",,"|n"&R1C24&RC[-9])&IF(RC[-8]="",,"|n"&R1C25&RC[-8])&IF(RC[-7]="",,"|n"&R1C26&RC[-7])&IF(RC[-6]="",,"|n"&R1C27&RC[-6])&IF(RC[-5]="",,"|n"&R1C28&RC[-5])&IF(RC[-2]="",,"|n"&RC[-2]) -> 
AG1081: =IF(RC[-26]&RC[-25]&RC[-24]&RC[-23]&RC[-22]&RC[-21]="",,R1C6)&IF(RC[-26]="",,"|n"&R1C7&RC[-26])&IF(RC[-25]="",,"|n"&R1C8&RC[-25])&IF(RC[-24]="",,"|n"&R1C9&RC[-24])&IF(RC[-23]="",,"|n"&R1C10&RC[-23])&IF(RC[-22]="",,"|n"&R1C11&RC[-22])&IF(RC[-21]="",,"|n"&R1C12&RC[-21])&IF(RC[-19]&RC[-18]&RC[-17]&RC[-16]="",,"|n"&R1C13)&IF(RC[-19]="",,"|n"&R1C14&RC[-19])&IF(RC[-18]="",,"|n"&R1C15&RC[-18])&IF(RC[-17]="",,"|n"&R1C16&RC[-17])&IF(RC[-16]="",,"|n"&R1C17&RC[-16])&IF(RC[-15]="",,"|n"&R1C18&RC[-15])&IF(RC[-14]="",,"|n"&R1C19&RC[-14])&IF(RC[-13]="",,"|n"&R1C20&RC[-13])&IF(RC[-12]="",,"|n"&R1C21&RC[-12])&IF(RC[-10]="",,"|n"&R1C23&RC[-10])&IF(RC[-9]="",,"|n"&R1C24&RC[-9])&IF(RC[-8]="",,"|n"&R1C25&RC[-8])&IF(RC[-7]="",,"|n"&R1C26&RC[-7])&IF(RC[-6]="",,"|n"&R1C27&RC[-6])&IF(RC[-5]="",,"|n"&R1C28&RC[-5])&IF(RC[-2]="",,"|n"&RC[-2]) -> 
AG1082: =IF(RC[-26]&RC[-25]&RC[-24]&RC[-23]&RC[-22]&RC[-21]="",,R1C6)&IF(RC[-26]="",,"|n"&R1C7&RC[-26])&IF(RC[-25]="",,"|n"&R1C8&RC[-25])&IF(RC[-24]="",,"|n"&R1C9&RC[-24])&IF(RC[-23]="",,"|n"&R1C10&RC[-23])&IF(RC[-22]="",,"|n"&R1C11&RC[-22])&IF(RC[-21]="",,"|n"&R1C12&RC[-21])&IF(RC[-19]&RC[-18]&RC[-17]&RC[-16]="",,"|n"&R1C13)&IF(RC[-19]="",,"|n"&R1C14&RC[-19])&IF(RC[-18]="",,"|n"&R1C15&RC[-18])&IF(RC[-17]="",,"|n"&R1C16&RC[-17])&IF(RC[-16]="",,"|n"&R1C17&RC[-16])&IF(RC[-15]="",,"|n"&R1C18&RC[-15])&IF(RC[-14]="",,"|n"&R1C19&RC[-14])&IF(RC[-13]="",,"|n"&R1C20&RC[-13])&IF(RC[-12]="",,"|n"&R1C21&RC[-12])&IF(RC[-10]="",,"|n"&R1C23&RC[-10])&IF(RC[-9]="",,"|n"&R1C24&RC[-9])&IF(RC[-8]="",,"|n"&R1C25&RC[-8])&IF(RC[-7]="",,"|n"&R1C26&RC[-7])&IF(RC[-6]="",,"|n"&R1C27&RC[-6])&IF(RC[-5]="",,"|n"&R1C28&RC[-5])&IF(RC[-2]="",,"|n"&RC[-2]) -> 
AG1083: =IF(RC[-26]&RC[-25]&RC[-24]&RC[-23]&RC[-22]&RC[-21]="",,R1C6)&IF(RC[-26]="",,"|n"&R1C7&RC[-26])&IF(RC[-25]="",,"|n"&R1C8&RC[-25])&IF(RC[-24]="",,"|n"&R1C9&RC[-24])&IF(RC[-23]="",,"|n"&R1C10&RC[-23])&IF(RC[-22]="",,"|n"&R1C11&RC[-22])&IF(RC[-21]="",,"|n"&R1C12&RC[-21])&IF(RC[-19]&RC[-18]&RC[-17]&RC[-16]="",,"|n"&R1C13)&IF(RC[-19]="",,"|n"&R1C14&RC[-19])&IF(RC[-18]="",,"|n"&R1C15&RC[-18])&IF(RC[-17]="",,"|n"&R1C16&RC[-17])&IF(RC[-16]="",,"|n"&R1C17&RC[-16])&IF(RC[-15]="",,"|n"&R1C18&RC[-15])&IF(RC[-14]="",,"|n"&R1C19&RC[-14])&IF(RC[-13]="",,"|n"&R1C20&RC[-13])&IF(RC[-12]="",,"|n"&R1C21&RC[-12])&IF(RC[-10]="",,"|n"&R1C23&RC[-10])&IF(RC[-9]="",,"|n"&R1C24&RC[-9])&IF(RC[-8]="",,"|n"&R1C25&RC[-8])&IF(RC[-7]="",,"|n"&R1C26&RC[-7])&IF(RC[-6]="",,"|n"&R1C27&RC[-6])&IF(RC[-5]="",,"|n"&R1C28&RC[-5])&IF(RC[-2]="",,"|n"&RC[-2]) -> 
AG1084: =IF(RC[-26]&RC[-25]&RC[-24]&RC[-23]&RC[-22]&RC[-21]="",,R1C6)&IF(RC[-26]="",,"|n"&R1C7&RC[-26])&IF(RC[-25]="",,"|n"&R1C8&RC[-25])&IF(RC[-24]="",,"|n"&R1C9&RC[-24])&IF(RC[-23]="",,"|n"&R1C10&RC[-23])&IF(RC[-22]="",,"|n"&R1C11&RC[-22])&IF(RC[-21]="",,"|n"&R1C12&RC[-21])&IF(RC[-19]&RC[-18]&RC[-17]&RC[-16]="",,"|n"&R1C13)&IF(RC[-19]="",,"|n"&R1C14&RC[-19])&IF(RC[-18]="",,"|n"&R1C15&RC[-18])&IF(RC[-17]="",,"|n"&R1C16&RC[-17])&IF(RC[-16]="",,"|n"&R1C17&RC[-16])&IF(RC[-15]="",,"|n"&R1C18&RC[-15])&IF(RC[-14]="",,"|n"&R1C19&RC[-14])&IF(RC[-13]="",,"|n"&R1C20&RC[-13])&IF(RC[-12]="",,"|n"&R1C21&RC[-12])&IF(RC[-10]="",,"|n"&R1C23&RC[-10])&IF(RC[-9]="",,"|n"&R1C24&RC[-9])&IF(RC[-8]="",,"|n"&R1C25&RC[-8])&IF(RC[-7]="",,"|n"&R1C26&RC[-7])&IF(RC[-6]="",,"|n"&R1C27&RC[-6])&IF(RC[-5]="",,"|n"&R1C28&RC[-5])&IF(RC[-2]="",,"|n"&RC[-2]) -> 
AG1085: =IF(RC[-26]&RC[-25]&RC[-24]&RC[-23]&RC[-22]&RC[-21]="",,R1C6)&IF(RC[-26]="",,"|n"&R1C7&RC[-26])&IF(RC[-25]="",,"|n"&R1C8&RC[-25])&IF(RC[-24]="",,"|n"&R1C9&RC[-24])&IF(RC[-23]="",,"|n"&R1C10&RC[-23])&IF(RC[-22]="",,"|n"&R1C11&RC[-22])&IF(RC[-21]="",,"|n"&R1C12&RC[-21])&IF(RC[-19]&RC[-18]&RC[-17]&RC[-16]="",,"|n"&R1C13)&IF(RC[-19]="",,"|n"&R1C14&RC[-19])&IF(RC[-18]="",,"|n"&R1C15&RC[-18])&IF(RC[-17]="",,"|n"&R1C16&RC[-17])&IF(RC[-16]="",,"|n"&R1C17&RC[-16])&IF(RC[-15]="",,"|n"&R1C18&RC[-15])&IF(RC[-14]="",,"|n"&R1C19&RC[-14])&IF(RC[-13]="",,"|n"&R1C20&RC[-13])&IF(RC[-12]="",,"|n"&R1C21&RC[-12])&IF(RC[-10]="",,"|n"&R1C23&RC[-10])&IF(RC[-9]="",,"|n"&R1C24&RC[-9])&IF(RC[-8]="",,"|n"&R1C25&RC[-8])&IF(RC[-7]="",,"|n"&R1C26&RC[-7])&IF(RC[-6]="",,"|n"&R1C27&RC[-6])&IF(RC[-5]="",,"|n"&R1C28&RC[-5])&IF(RC[-2]="",,"|n"&RC[-2]) -> 
AG1086: =IF(RC[-26]&RC[-25]&RC[-24]&RC[-23]&RC[-22]&RC[-21]="",,R1C6)&IF(RC[-26]="",,"|n"&R1C7&RC[-26])&IF(RC[-25]="",,"|n"&R1C8&RC[-25])&IF(RC[-24]="",,"|n"&R1C9&RC[-24])&IF(RC[-23]="",,"|n"&R1C10&RC[-23])&IF(RC[-22]="",,"|n"&R1C11&RC[-22])&IF(RC[-21]="",,"|n"&R1C12&RC[-21])&IF(RC[-19]&RC[-18]&RC[-17]&RC[-16]="",,"|n"&R1C13)&IF(RC[-19]="",,"|n"&R1C14&RC[-19])&IF(RC[-18]="",,"|n"&R1C15&RC[-18])&IF(RC[-17]="",,"|n"&R1C16&RC[-17])&IF(RC[-16]="",,"|n"&R1C17&RC[-16])&IF(RC[-15]="",,"|n"&R1C18&RC[-15])&IF(RC[-14]="",,"|n"&R1C19&RC[-14])&IF(RC[-13]="",,"|n"&R1C20&RC[-13])&IF(RC[-12]="",,"|n"&R1C21&RC[-12])&IF(RC[-10]="",,"|n"&R1C23&RC[-10])&IF(RC[-9]="",,"|n"&R1C24&RC[-9])&IF(RC[-8]="",,"|n"&R1C25&RC[-8])&IF(RC[-7]="",,"|n"&R1C26&RC[-7])&IF(RC[-6]="",,"|n"&R1C27&RC[-6])&IF(RC[-5]="",,"|n"&R1C28&RC[-5])&IF(RC[-2]="",,"|n"&RC[-2]) -> 
AG1087: =IF(RC[-26]&RC[-25]&RC[-24]&RC[-23]&RC[-22]&RC[-21]="",,R1C6)&IF(RC[-26]="",,"|n"&R1C7&RC[-26])&IF(RC[-25]="",,"|n"&R1C8&RC[-25])&IF(RC[-24]="",,"|n"&R1C9&RC[-24])&IF(RC[-23]="",,"|n"&R1C10&RC[-23])&IF(RC[-22]="",,"|n"&R1C11&RC[-22])&IF(RC[-21]="",,"|n"&R1C12&RC[-21])&IF(RC[-19]&RC[-18]&RC[-17]&RC[-16]="",,"|n"&R1C13)&IF(RC[-19]="",,"|n"&R1C14&RC[-19])&IF(RC[-18]="",,"|n"&R1C15&RC[-18])&IF(RC[-17]="",,"|n"&R1C16&RC[-17])&IF(RC[-16]="",,"|n"&R1C17&RC[-16])&IF(RC[-15]="",,"|n"&R1C18&RC[-15])&IF(RC[-14]="",,"|n"&R1C19&RC[-14])&IF(RC[-13]="",,"|n"&R1C20&RC[-13])&IF(RC[-12]="",,"|n"&R1C21&RC[-12])&IF(RC[-10]="",,"|n"&R1C23&RC[-10])&IF(RC[-9]="",,"|n"&R1C24&RC[-9])&IF(RC[-8]="",,"|n"&R1C25&RC[-8])&IF(RC[-7]="",,"|n"&R1C26&RC[-7])&IF(RC[-6]="",,"|n"&R1C27&RC[-6])&IF(RC[-5]="",,"|n"&R1C28&RC[-5])&IF(RC[-2]="",,"|n"&RC[-2]) -> 
AG1088: =IF(RC[-26]&RC[-25]&RC[-24]&RC[-23]&RC[-22]&RC[-21]="",,R1C6)&IF(RC[-26]="",,"|n"&R1C7&RC[-26])&IF(RC[-25]="",,"|n"&R1C8&RC[-25])&IF(RC[-24]="",,"|n"&R1C9&RC[-24])&IF(RC[-23]="",,"|n"&R1C10&RC[-23])&IF(RC[-22]="",,"|n"&R1C11&RC[-22])&IF(RC[-21]="",,"|n"&R1C12&RC[-21])&IF(RC[-19]&RC[-18]&RC[-17]&RC[-16]="",,"|n"&R1C13)&IF(RC[-19]="",,"|n"&R1C14&RC[-19])&IF(RC[-18]="",,"|n"&R1C15&RC[-18])&IF(RC[-17]="",,"|n"&R1C16&RC[-17])&IF(RC[-16]="",,"|n"&R1C17&RC[-16])&IF(RC[-15]="",,"|n"&R1C18&RC[-15])&IF(RC[-14]="",,"|n"&R1C19&RC[-14])&IF(RC[-13]="",,"|n"&R1C20&RC[-13])&IF(RC[-12]="",,"|n"&R1C21&RC[-12])&IF(RC[-10]="",,"|n"&R1C23&RC[-10])&IF(RC[-9]="",,"|n"&R1C24&RC[-9])&IF(RC[-8]="",,"|n"&R1C25&RC[-8])&IF(RC[-7]="",,"|n"&R1C26&RC[-7])&IF(RC[-6]="",,"|n"&R1C27&RC[-6])&IF(RC[-5]="",,"|n"&R1C28&RC[-5])&IF(RC[-2]="",,"|n"&RC[-2]) -> 
AG1089: =IF(RC[-26]&RC[-25]&RC[-24]&RC[-23]&RC[-22]&RC[-21]="",,R1C6)&IF(RC[-26]="",,"|n"&R1C7&RC[-26])&IF(RC[-25]="",,"|n"&R1C8&RC[-25])&IF(RC[-24]="",,"|n"&R1C9&RC[-24])&IF(RC[-23]="",,"|n"&R1C10&RC[-23])&IF(RC[-22]="",,"|n"&R1C11&RC[-22])&IF(RC[-21]="",,"|n"&R1C12&RC[-21])&IF(RC[-19]&RC[-18]&RC[-17]&RC[-16]="",,"|n"&R1C13)&IF(RC[-19]="",,"|n"&R1C14&RC[-19])&IF(RC[-18]="",,"|n"&R1C15&RC[-18])&IF(RC[-17]="",,"|n"&R1C16&RC[-17])&IF(RC[-16]="",,"|n"&R1C17&RC[-16])&IF(RC[-15]="",,"|n"&R1C18&RC[-15])&IF(RC[-14]="",,"|n"&R1C19&RC[-14])&IF(RC[-13]="",,"|n"&R1C20&RC[-13])&IF(RC[-12]="",,"|n"&R1C21&RC[-12])&IF(RC[-10]="",,"|n"&R1C23&RC[-10])&IF(RC[-9]="",,"|n"&R1C24&RC[-9])&IF(RC[-8]="",,"|n"&R1C25&RC[-8])&IF(RC[-7]="",,"|n"&R1C26&RC[-7])&IF(RC[-6]="",,"|n"&R1C27&RC[-6])&IF(RC[-5]="",,"|n"&R1C28&RC[-5])&IF(RC[-2]="",,"|n"&RC[-2]) -> 
AG1090: =IF(RC[-26]&RC[-25]&RC[-24]&RC[-23]&RC[-22]&RC[-21]="",,R1C6)&IF(RC[-26]="",,"|n"&R1C7&RC[-26])&IF(RC[-25]="",,"|n"&R1C8&RC[-25])&IF(RC[-24]="",,"|n"&R1C9&RC[-24])&IF(RC[-23]="",,"|n"&R1C10&RC[-23])&IF(RC[-22]="",,"|n"&R1C11&RC[-22])&IF(RC[-21]="",,"|n"&R1C12&RC[-21])&IF(RC[-19]&RC[-18]&RC[-17]&RC[-16]="",,"|n"&R1C13)&IF(RC[-19]="",,"|n"&R1C14&RC[-19])&IF(RC[-18]="",,"|n"&R1C15&RC[-18])&IF(RC[-17]="",,"|n"&R1C16&RC[-17])&IF(RC[-16]="",,"|n"&R1C17&RC[-16])&IF(RC[-15]="",,"|n"&R1C18&RC[-15])&IF(RC[-14]="",,"|n"&R1C19&RC[-14])&IF(RC[-13]="",,"|n"&R1C20&RC[-13])&IF(RC[-12]="",,"|n"&R1C21&RC[-12])&IF(RC[-10]="",,"|n"&R1C23&RC[-10])&IF(RC[-9]="",,"|n"&R1C24&RC[-9])&IF(RC[-8]="",,"|n"&R1C25&RC[-8])&IF(RC[-7]="",,"|n"&R1C26&RC[-7])&IF(RC[-6]="",,"|n"&R1C27&RC[-6])&IF(RC[-5]="",,"|n"&R1C28&RC[-5])&IF(RC[-2]="",,"|n"&RC[-2]) -> 
AG1091: =IF(RC[-26]&RC[-25]&RC[-24]&RC[-23]&RC[-22]&RC[-21]="",,R1C6)&IF(RC[-26]="",,"|n"&R1C7&RC[-26])&IF(RC[-25]="",,"|n"&R1C8&RC[-25])&IF(RC[-24]="",,"|n"&R1C9&RC[-24])&IF(RC[-23]="",,"|n"&R1C10&RC[-23])&IF(RC[-22]="",,"|n"&R1C11&RC[-22])&IF(RC[-21]="",,"|n"&R1C12&RC[-21])&IF(RC[-19]&RC[-18]&RC[-17]&RC[-16]="",,"|n"&R1C13)&IF(RC[-19]="",,"|n"&R1C14&RC[-19])&IF(RC[-18]="",,"|n"&R1C15&RC[-18])&IF(RC[-17]="",,"|n"&R1C16&RC[-17])&IF(RC[-16]="",,"|n"&R1C17&RC[-16])&IF(RC[-15]="",,"|n"&R1C18&RC[-15])&IF(RC[-14]="",,"|n"&R1C19&RC[-14])&IF(RC[-13]="",,"|n"&R1C20&RC[-13])&IF(RC[-12]="",,"|n"&R1C21&RC[-12])&IF(RC[-10]="",,"|n"&R1C23&RC[-10])&IF(RC[-9]="",,"|n"&R1C24&RC[-9])&IF(RC[-8]="",,"|n"&R1C25&RC[-8])&IF(RC[-7]="",,"|n"&R1C26&RC[-7])&IF(RC[-6]="",,"|n"&R1C27&RC[-6])&IF(RC[-5]="",,"|n"&R1C28&RC[-5])&IF(RC[-2]="",,"|n"&RC[-2]) -> 
AG1092: =IF(RC[-26]&RC[-25]&RC[-24]&RC[-23]&RC[-22]&RC[-21]="",,R1C6)&IF(RC[-26]="",,"|n"&R1C7&RC[-26])&IF(RC[-25]="",,"|n"&R1C8&RC[-25])&IF(RC[-24]="",,"|n"&R1C9&RC[-24])&IF(RC[-23]="",,"|n"&R1C10&RC[-23])&IF(RC[-22]="",,"|n"&R1C11&RC[-22])&IF(RC[-21]="",,"|n"&R1C12&RC[-21])&IF(RC[-19]&RC[-18]&RC[-17]&RC[-16]="",,"|n"&R1C13)&IF(RC[-19]="",,"|n"&R1C14&RC[-19])&IF(RC[-18]="",,"|n"&R1C15&RC[-18])&IF(RC[-17]="",,"|n"&R1C16&RC[-17])&IF(RC[-16]="",,"|n"&R1C17&RC[-16])&IF(RC[-15]="",,"|n"&R1C18&RC[-15])&IF(RC[-14]="",,"|n"&R1C19&RC[-14])&IF(RC[-13]="",,"|n"&R1C20&RC[-13])&IF(RC[-12]="",,"|n"&R1C21&RC[-12])&IF(RC[-10]="",,"|n"&R1C23&RC[-10])&IF(RC[-9]="",,"|n"&R1C24&RC[-9])&IF(RC[-8]="",,"|n"&R1C25&RC[-8])&IF(RC[-7]="",,"|n"&R1C26&RC[-7])&IF(RC[-6]="",,"|n"&R1C27&RC[-6])&IF(RC[-5]="",,"|n"&R1C28&RC[-5])&IF(RC[-2]="",,"|n"&RC[-2]) -> 
AG1093: =IF(RC[-26]&RC[-25]&RC[-24]&RC[-23]&RC[-22]&RC[-21]="",,R1C6)&IF(RC[-26]="",,"|n"&R1C7&RC[-26])&IF(RC[-25]="",,"|n"&R1C8&RC[-25])&IF(RC[-24]="",,"|n"&R1C9&RC[-24])&IF(RC[-23]="",,"|n"&R1C10&RC[-23])&IF(RC[-22]="",,"|n"&R1C11&RC[-22])&IF(RC[-21]="",,"|n"&R1C12&RC[-21])&IF(RC[-19]&RC[-18]&RC[-17]&RC[-16]="",,"|n"&R1C13)&IF(RC[-19]="",,"|n"&R1C14&RC[-19])&IF(RC[-18]="",,"|n"&R1C15&RC[-18])&IF(RC[-17]="",,"|n"&R1C16&RC[-17])&IF(RC[-16]="",,"|n"&R1C17&RC[-16])&IF(RC[-15]="",,"|n"&R1C18&RC[-15])&IF(RC[-14]="",,"|n"&R1C19&RC[-14])&IF(RC[-13]="",,"|n"&R1C20&RC[-13])&IF(RC[-12]="",,"|n"&R1C21&RC[-12])&IF(RC[-10]="",,"|n"&R1C23&RC[-10])&IF(RC[-9]="",,"|n"&R1C24&RC[-9])&IF(RC[-8]="",,"|n"&R1C25&RC[-8])&IF(RC[-7]="",,"|n"&R1C26&RC[-7])&IF(RC[-6]="",,"|n"&R1C27&RC[-6])&IF(RC[-5]="",,"|n"&R1C28&RC[-5])&IF(RC[-2]="",,"|n"&RC[-2]) -> 
AG1094: =IF(RC[-26]&RC[-25]&RC[-24]&RC[-23]&RC[-22]&RC[-21]="",,R1C6)&IF(RC[-26]="",,"|n"&R1C7&RC[-26])&IF(RC[-25]="",,"|n"&R1C8&RC[-25])&IF(RC[-24]="",,"|n"&R1C9&RC[-24])&IF(RC[-23]="",,"|n"&R1C10&RC[-23])&IF(RC[-22]="",,"|n"&R1C11&RC[-22])&IF(RC[-21]="",,"|n"&R1C12&RC[-21])&IF(RC[-19]&RC[-18]&RC[-17]&RC[-16]="",,"|n"&R1C13)&IF(RC[-19]="",,"|n"&R1C14&RC[-19])&IF(RC[-18]="",,"|n"&R1C15&RC[-18])&IF(RC[-17]="",,"|n"&R1C16&RC[-17])&IF(RC[-16]="",,"|n"&R1C17&RC[-16])&IF(RC[-15]="",,"|n"&R1C18&RC[-15])&IF(RC[-14]="",,"|n"&R1C19&RC[-14])&IF(RC[-13]="",,"|n"&R1C20&RC[-13])&IF(RC[-12]="",,"|n"&R1C21&RC[-12])&IF(RC[-10]="",,"|n"&R1C23&RC[-10])&IF(RC[-9]="",,"|n"&R1C24&RC[-9])&IF(RC[-8]="",,"|n"&R1C25&RC[-8])&IF(RC[-7]="",,"|n"&R1C26&RC[-7])&IF(RC[-6]="",,"|n"&R1C27&RC[-6])&IF(RC[-5]="",,"|n"&R1C28&RC[-5])&IF(RC[-2]="",,"|n"&RC[-2]) -> 
AG1095: =IF(RC[-26]&RC[-25]&RC[-24]&RC[-23]&RC[-22]&RC[-21]="",,R1C6)&IF(RC[-26]="",,"|n"&R1C7&RC[-26])&IF(RC[-25]="",,"|n"&R1C8&RC[-25])&IF(RC[-24]="",,"|n"&R1C9&RC[-24])&IF(RC[-23]="",,"|n"&R1C10&RC[-23])&IF(RC[-22]="",,"|n"&R1C11&RC[-22])&IF(RC[-21]="",,"|n"&R1C12&RC[-21])&IF(RC[-19]&RC[-18]&RC[-17]&RC[-16]="",,"|n"&R1C13)&IF(RC[-19]="",,"|n"&R1C14&RC[-19])&IF(RC[-18]="",,"|n"&R1C15&RC[-18])&IF(RC[-17]="",,"|n"&R1C16&RC[-17])&IF(RC[-16]="",,"|n"&R1C17&RC[-16])&IF(RC[-15]="",,"|n"&R1C18&RC[-15])&IF(RC[-14]="",,"|n"&R1C19&RC[-14])&IF(RC[-13]="",,"|n"&R1C20&RC[-13])&IF(RC[-12]="",,"|n"&R1C21&RC[-12])&IF(RC[-10]="",,"|n"&R1C23&RC[-10])&IF(RC[-9]="",,"|n"&R1C24&RC[-9])&IF(RC[-8]="",,"|n"&R1C25&RC[-8])&IF(RC[-7]="",,"|n"&R1C26&RC[-7])&IF(RC[-6]="",,"|n"&R1C27&RC[-6])&IF(RC[-5]="",,"|n"&R1C28&RC[-5])&IF(RC[-2]="",,"|n"&RC[-2]) -> 
AG1096: =IF(RC[-26]&RC[-25]&RC[-24]&RC[-23]&RC[-22]&RC[-21]="",,R1C6)&IF(RC[-26]="",,"|n"&R1C7&RC[-26])&IF(RC[-25]="",,"|n"&R1C8&RC[-25])&IF(RC[-24]="",,"|n"&R1C9&RC[-24])&IF(RC[-23]="",,"|n"&R1C10&RC[-23])&IF(RC[-22]="",,"|n"&R1C11&RC[-22])&IF(RC[-21]="",,"|n"&R1C12&RC[-21])&IF(RC[-19]&RC[-18]&RC[-17]&RC[-16]="",,"|n"&R1C13)&IF(RC[-19]="",,"|n"&R1C14&RC[-19])&IF(RC[-18]="",,"|n"&R1C15&RC[-18])&IF(RC[-17]="",,"|n"&R1C16&RC[-17])&IF(RC[-16]="",,"|n"&R1C17&RC[-16])&IF(RC[-15]="",,"|n"&R1C18&RC[-15])&IF(RC[-14]="",,"|n"&R1C19&RC[-14])&IF(RC[-13]="",,"|n"&R1C20&RC[-13])&IF(RC[-12]="",,"|n"&R1C21&RC[-12])&IF(RC[-10]="",,"|n"&R1C23&RC[-10])&IF(RC[-9]="",,"|n"&R1C24&RC[-9])&IF(RC[-8]="",,"|n"&R1C25&RC[-8])&IF(RC[-7]="",,"|n"&R1C26&RC[-7])&IF(RC[-6]="",,"|n"&R1C27&RC[-6])&IF(RC[-5]="",,"|n"&R1C28&RC[-5])&IF(RC[-2]="",,"|n"&RC[-2]) -> 
AG1097: =IF(RC[-26]&RC[-25]&RC[-24]&RC[-23]&RC[-22]&RC[-21]="",,R1C6)&IF(RC[-26]="",,"|n"&R1C7&RC[-26])&IF(RC[-25]="",,"|n"&R1C8&RC[-25])&IF(RC[-24]="",,"|n"&R1C9&RC[-24])&IF(RC[-23]="",,"|n"&R1C10&RC[-23])&IF(RC[-22]="",,"|n"&R1C11&RC[-22])&IF(RC[-21]="",,"|n"&R1C12&RC[-21])&IF(RC[-19]&RC[-18]&RC[-17]&RC[-16]="",,"|n"&R1C13)&IF(RC[-19]="",,"|n"&R1C14&RC[-19])&IF(RC[-18]="",,"|n"&R1C15&RC[-18])&IF(RC[-17]="",,"|n"&R1C16&RC[-17])&IF(RC[-16]="",,"|n"&R1C17&RC[-16])&IF(RC[-15]="",,"|n"&R1C18&RC[-15])&IF(RC[-14]="",,"|n"&R1C19&RC[-14])&IF(RC[-13]="",,"|n"&R1C20&RC[-13])&IF(RC[-12]="",,"|n"&R1C21&RC[-12])&IF(RC[-10]="",,"|n"&R1C23&RC[-10])&IF(RC[-9]="",,"|n"&R1C24&RC[-9])&IF(RC[-8]="",,"|n"&R1C25&RC[-8])&IF(RC[-7]="",,"|n"&R1C26&RC[-7])&IF(RC[-6]="",,"|n"&R1C27&RC[-6])&IF(RC[-5]="",,"|n"&R1C28&RC[-5])&IF(RC[-2]="",,"|n"&RC[-2]) -> 
AG1098: =IF(RC[-26]&RC[-25]&RC[-24]&RC[-23]&RC[-22]&RC[-21]="",,R1C6)&IF(RC[-26]="",,"|n"&R1C7&RC[-26])&IF(RC[-25]="",,"|n"&R1C8&RC[-25])&IF(RC[-24]="",,"|n"&R1C9&RC[-24])&IF(RC[-23]="",,"|n"&R1C10&RC[-23])&IF(RC[-22]="",,"|n"&R1C11&RC[-22])&IF(RC[-21]="",,"|n"&R1C12&RC[-21])&IF(RC[-19]&RC[-18]&RC[-17]&RC[-16]="",,"|n"&R1C13)&IF(RC[-19]="",,"|n"&R1C14&RC[-19])&IF(RC[-18]="",,"|n"&R1C15&RC[-18])&IF(RC[-17]="",,"|n"&R1C16&RC[-17])&IF(RC[-16]="",,"|n"&R1C17&RC[-16])&IF(RC[-15]="",,"|n"&R1C18&RC[-15])&IF(RC[-14]="",,"|n"&R1C19&RC[-14])&IF(RC[-13]="",,"|n"&R1C20&RC[-13])&IF(RC[-12]="",,"|n"&R1C21&RC[-12])&IF(RC[-10]="",,"|n"&R1C23&RC[-10])&IF(RC[-9]="",,"|n"&R1C24&RC[-9])&IF(RC[-8]="",,"|n"&R1C25&RC[-8])&IF(RC[-7]="",,"|n"&R1C26&RC[-7])&IF(RC[-6]="",,"|n"&R1C27&RC[-6])&IF(RC[-5]="",,"|n"&R1C28&RC[-5])&IF(RC[-2]="",,"|n"&RC[-2]) -> 
AG1099: =IF(RC[-26]&RC[-25]&RC[-24]&RC[-23]&RC[-22]&RC[-21]="",,R1C6)&IF(RC[-26]="",,"|n"&R1C7&RC[-26])&IF(RC[-25]="",,"|n"&R1C8&RC[-25])&IF(RC[-24]="",,"|n"&R1C9&RC[-24])&IF(RC[-23]="",,"|n"&R1C10&RC[-23])&IF(RC[-22]="",,"|n"&R1C11&RC[-22])&IF(RC[-21]="",,"|n"&R1C12&RC[-21])&IF(RC[-19]&RC[-18]&RC[-17]&RC[-16]="",,"|n"&R1C13)&IF(RC[-19]="",,"|n"&R1C14&RC[-19])&IF(RC[-18]="",,"|n"&R1C15&RC[-18])&IF(RC[-17]="",,"|n"&R1C16&RC[-17])&IF(RC[-16]="",,"|n"&R1C17&RC[-16])&IF(RC[-15]="",,"|n"&R1C18&RC[-15])&IF(RC[-14]="",,"|n"&R1C19&RC[-14])&IF(RC[-13]="",,"|n"&R1C20&RC[-13])&IF(RC[-12]="",,"|n"&R1C21&RC[-12])&IF(RC[-10]="",,"|n"&R1C23&RC[-10])&IF(RC[-9]="",,"|n"&R1C24&RC[-9])&IF(RC[-8]="",,"|n"&R1C25&RC[-8])&IF(RC[-7]="",,"|n"&R1C26&RC[-7])&IF(RC[-6]="",,"|n"&R1C27&RC[-6])&IF(RC[-5]="",,"|n"&R1C28&RC[-5])&IF(RC[-2]="",,"|n"&RC[-2]) -> 
AG1100: =IF(RC[-26]&RC[-25]&RC[-24]&RC[-23]&RC[-22]&RC[-21]="",,R1C6)&IF(RC[-26]="",,"|n"&R1C7&RC[-26])&IF(RC[-25]="",,"|n"&R1C8&RC[-25])&IF(RC[-24]="",,"|n"&R1C9&RC[-24])&IF(RC[-23]="",,"|n"&R1C10&RC[-23])&IF(RC[-22]="",,"|n"&R1C11&RC[-22])&IF(RC[-21]="",,"|n"&R1C12&RC[-21])&IF(RC[-19]&RC[-18]&RC[-17]&RC[-16]="",,"|n"&R1C13)&IF(RC[-19]="",,"|n"&R1C14&RC[-19])&IF(RC[-18]="",,"|n"&R1C15&RC[-18])&IF(RC[-17]="",,"|n"&R1C16&RC[-17])&IF(RC[-16]="",,"|n"&R1C17&RC[-16])&IF(RC[-15]="",,"|n"&R1C18&RC[-15])&IF(RC[-14]="",,"|n"&R1C19&RC[-14])&IF(RC[-13]="",,"|n"&R1C20&RC[-13])&IF(RC[-12]="",,"|n"&R1C21&RC[-12])&IF(RC[-10]="",,"|n"&R1C23&RC[-10])&IF(RC[-9]="",,"|n"&R1C24&RC[-9])&IF(RC[-8]="",,"|n"&R1C25&RC[-8])&IF(RC[-7]="",,"|n"&R1C26&RC[-7])&IF(RC[-6]="",,"|n"&R1C27&RC[-6])&IF(RC[-5]="",,"|n"&R1C28&RC[-5])&IF(RC[-2]="",,"|n"&RC[-2]) -> 
AG1101: =IF(RC[-26]&RC[-25]&RC[-24]&RC[-23]&RC[-22]&RC[-21]="",,R1C6)&IF(RC[-26]="",,"|n"&R1C7&RC[-26])&IF(RC[-25]="",,"|n"&R1C8&RC[-25])&IF(RC[-24]="",,"|n"&R1C9&RC[-24])&IF(RC[-23]="",,"|n"&R1C10&RC[-23])&IF(RC[-22]="",,"|n"&R1C11&RC[-22])&IF(RC[-21]="",,"|n"&R1C12&RC[-21])&IF(RC[-19]&RC[-18]&RC[-17]&RC[-16]="",,"|n"&R1C13)&IF(RC[-19]="",,"|n"&R1C14&RC[-19])&IF(RC[-18]="",,"|n"&R1C15&RC[-18])&IF(RC[-17]="",,"|n"&R1C16&RC[-17])&IF(RC[-16]="",,"|n"&R1C17&RC[-16])&IF(RC[-15]="",,"|n"&R1C18&RC[-15])&IF(RC[-14]="",,"|n"&R1C19&RC[-14])&IF(RC[-13]="",,"|n"&R1C20&RC[-13])&IF(RC[-12]="",,"|n"&R1C21&RC[-12])&IF(RC[-10]="",,"|n"&R1C23&RC[-10])&IF(RC[-9]="",,"|n"&R1C24&RC[-9])&IF(RC[-8]="",,"|n"&R1C25&RC[-8])&IF(RC[-7]="",,"|n"&R1C26&RC[-7])&IF(RC[-6]="",,"|n"&R1C27&RC[-6])&IF(RC[-5]="",,"|n"&R1C28&RC[-5])&IF(RC[-2]="",,"|n"&RC[-2]) -> 
AG1102: =IF(RC[-26]&RC[-25]&RC[-24]&RC[-23]&RC[-22]&RC[-21]="",,R1C6)&IF(RC[-26]="",,"|n"&R1C7&RC[-26])&IF(RC[-25]="",,"|n"&R1C8&RC[-25])&IF(RC[-24]="",,"|n"&R1C9&RC[-24])&IF(RC[-23]="",,"|n"&R1C10&RC[-23])&IF(RC[-22]="",,"|n"&R1C11&RC[-22])&IF(RC[-21]="",,"|n"&R1C12&RC[-21])&IF(RC[-19]&RC[-18]&RC[-17]&RC[-16]="",,"|n"&R1C13)&IF(RC[-19]="",,"|n"&R1C14&RC[-19])&IF(RC[-18]="",,"|n"&R1C15&RC[-18])&IF(RC[-17]="",,"|n"&R1C16&RC[-17])&IF(RC[-16]="",,"|n"&R1C17&RC[-16])&IF(RC[-15]="",,"|n"&R1C18&RC[-15])&IF(RC[-14]="",,"|n"&R1C19&RC[-14])&IF(RC[-13]="",,"|n"&R1C20&RC[-13])&IF(RC[-12]="",,"|n"&R1C21&RC[-12])&IF(RC[-10]="",,"|n"&R1C23&RC[-10])&IF(RC[-9]="",,"|n"&R1C24&RC[-9])&IF(RC[-8]="",,"|n"&R1C25&RC[-8])&IF(RC[-7]="",,"|n"&R1C26&RC[-7])&IF(RC[-6]="",,"|n"&R1C27&RC[-6])&IF(RC[-5]="",,"|n"&R1C28&RC[-5])&IF(RC[-2]="",,"|n"&RC[-2]) -> 
AG1103: =IF(RC[-26]&RC[-25]&RC[-24]&RC[-23]&RC[-22]&RC[-21]="",,R1C6)&IF(RC[-26]="",,"|n"&R1C7&RC[-26])&IF(RC[-25]="",,"|n"&R1C8&RC[-25])&IF(RC[-24]="",,"|n"&R1C9&RC[-24])&IF(RC[-23]="",,"|n"&R1C10&RC[-23])&IF(RC[-22]="",,"|n"&R1C11&RC[-22])&IF(RC[-21]="",,"|n"&R1C12&RC[-21])&IF(RC[-19]&RC[-18]&RC[-17]&RC[-16]="",,"|n"&R1C13)&IF(RC[-19]="",,"|n"&R1C14&RC[-19])&IF(RC[-18]="",,"|n"&R1C15&RC[-18])&IF(RC[-17]="",,"|n"&R1C16&RC[-17])&IF(RC[-16]="",,"|n"&R1C17&RC[-16])&IF(RC[-15]="",,"|n"&R1C18&RC[-15])&IF(RC[-14]="",,"|n"&R1C19&RC[-14])&IF(RC[-13]="",,"|n"&R1C20&RC[-13])&IF(RC[-12]="",,"|n"&R1C21&RC[-12])&IF(RC[-10]="",,"|n"&R1C23&RC[-10])&IF(RC[-9]="",,"|n"&R1C24&RC[-9])&IF(RC[-8]="",,"|n"&R1C25&RC[-8])&IF(RC[-7]="",,"|n"&R1C26&RC[-7])&IF(RC[-6]="",,"|n"&R1C27&RC[-6])&IF(RC[-5]="",,"|n"&R1C28&RC[-5])&IF(RC[-2]="",,"|n"&RC[-2]) -> 
AG1104: =IF(RC[-26]&RC[-25]&RC[-24]&RC[-23]&RC[-22]&RC[-21]="",,R1C6)&IF(RC[-26]="",,"|n"&R1C7&RC[-26])&IF(RC[-25]="",,"|n"&R1C8&RC[-25])&IF(RC[-24]="",,"|n"&R1C9&RC[-24])&IF(RC[-23]="",,"|n"&R1C10&RC[-23])&IF(RC[-22]="",,"|n"&R1C11&RC[-22])&IF(RC[-21]="",,"|n"&R1C12&RC[-21])&IF(RC[-19]&RC[-18]&RC[-17]&RC[-16]="",,"|n"&R1C13)&IF(RC[-19]="",,"|n"&R1C14&RC[-19])&IF(RC[-18]="",,"|n"&R1C15&RC[-18])&IF(RC[-17]="",,"|n"&R1C16&RC[-17])&IF(RC[-16]="",,"|n"&R1C17&RC[-16])&IF(RC[-15]="",,"|n"&R1C18&RC[-15])&IF(RC[-14]="",,"|n"&R1C19&RC[-14])&IF(RC[-13]="",,"|n"&R1C20&RC[-13])&IF(RC[-12]="",,"|n"&R1C21&RC[-12])&IF(RC[-10]="",,"|n"&R1C23&RC[-10])&IF(RC[-9]="",,"|n"&R1C24&RC[-9])&IF(RC[-8]="",,"|n"&R1C25&RC[-8])&IF(RC[-7]="",,"|n"&R1C26&RC[-7])&IF(RC[-6]="",,"|n"&R1C27&RC[-6])&IF(RC[-5]="",,"|n"&R1C28&RC[-5])&IF(RC[-2]="",,"|n"&RC[-2]) -> 
AG1105: =IF(RC[-26]&RC[-25]&RC[-24]&RC[-23]&RC[-22]&RC[-21]="",,R1C6)&IF(RC[-26]="",,"|n"&R1C7&RC[-26])&IF(RC[-25]="",,"|n"&R1C8&RC[-25])&IF(RC[-24]="",,"|n"&R1C9&RC[-24])&IF(RC[-23]="",,"|n"&R1C10&RC[-23])&IF(RC[-22]="",,"|n"&R1C11&RC[-22])&IF(RC[-21]="",,"|n"&R1C12&RC[-21])&IF(RC[-19]&RC[-18]&RC[-17]&RC[-16]="",,"|n"&R1C13)&IF(RC[-19]="",,"|n"&R1C14&RC[-19])&IF(RC[-18]="",,"|n"&R1C15&RC[-18])&IF(RC[-17]="",,"|n"&R1C16&RC[-17])&IF(RC[-16]="",,"|n"&R1C17&RC[-16])&IF(RC[-15]="",,"|n"&R1C18&RC[-15])&IF(RC[-14]="",,"|n"&R1C19&RC[-14])&IF(RC[-13]="",,"|n"&R1C20&RC[-13])&IF(RC[-12]="",,"|n"&R1C21&RC[-12])&IF(RC[-10]="",,"|n"&R1C23&RC[-10])&IF(RC[-9]="",,"|n"&R1C24&RC[-9])&IF(RC[-8]="",,"|n"&R1C25&RC[-8])&IF(RC[-7]="",,"|n"&R1C26&RC[-7])&IF(RC[-6]="",,"|n"&R1C27&RC[-6])&IF(RC[-5]="",,"|n"&R1C28&RC[-5])&IF(RC[-2]="",,"|n"&RC[-2]) -> 
AG1106: =IF(RC[-26]&RC[-25]&RC[-24]&RC[-23]&RC[-22]&RC[-21]="",,R1C6)&IF(RC[-26]="",,"|n"&R1C7&RC[-26])&IF(RC[-25]="",,"|n"&R1C8&RC[-25])&IF(RC[-24]="",,"|n"&R1C9&RC[-24])&IF(RC[-23]="",,"|n"&R1C10&RC[-23])&IF(RC[-22]="",,"|n"&R1C11&RC[-22])&IF(RC[-21]="",,"|n"&R1C12&RC[-21])&IF(RC[-19]&RC[-18]&RC[-17]&RC[-16]="",,"|n"&R1C13)&IF(RC[-19]="",,"|n"&R1C14&RC[-19])&IF(RC[-18]="",,"|n"&R1C15&RC[-18])&IF(RC[-17]="",,"|n"&R1C16&RC[-17])&IF(RC[-16]="",,"|n"&R1C17&RC[-16])&IF(RC[-15]="",,"|n"&R1C18&RC[-15])&IF(RC[-14]="",,"|n"&R1C19&RC[-14])&IF(RC[-13]="",,"|n"&R1C20&RC[-13])&IF(RC[-12]="",,"|n"&R1C21&RC[-12])&IF(RC[-10]="",,"|n"&R1C23&RC[-10])&IF(RC[-9]="",,"|n"&R1C24&RC[-9])&IF(RC[-8]="",,"|n"&R1C25&RC[-8])&IF(RC[-7]="",,"|n"&R1C26&RC[-7])&IF(RC[-6]="",,"|n"&R1C27&RC[-6])&IF(RC[-5]="",,"|n"&R1C28&RC[-5])&IF(RC[-2]="",,"|n"&RC[-2]) -> 
AG1107: =IF(RC[-26]&RC[-25]&RC[-24]&RC[-23]&RC[-22]&RC[-21]="",,R1C6)&IF(RC[-26]="",,"|n"&R1C7&RC[-26])&IF(RC[-25]="",,"|n"&R1C8&RC[-25])&IF(RC[-24]="",,"|n"&R1C9&RC[-24])&IF(RC[-23]="",,"|n"&R1C10&RC[-23])&IF(RC[-22]="",,"|n"&R1C11&RC[-22])&IF(RC[-21]="",,"|n"&R1C12&RC[-21])&IF(RC[-19]&RC[-18]&RC[-17]&RC[-16]="",,"|n"&R1C13)&IF(RC[-19]="",,"|n"&R1C14&RC[-19])&IF(RC[-18]="",,"|n"&R1C15&RC[-18])&IF(RC[-17]="",,"|n"&R1C16&RC[-17])&IF(RC[-16]="",,"|n"&R1C17&RC[-16])&IF(RC[-15]="",,"|n"&R1C18&RC[-15])&IF(RC[-14]="",,"|n"&R1C19&RC[-14])&IF(RC[-13]="",,"|n"&R1C20&RC[-13])&IF(RC[-12]="",,"|n"&R1C21&RC[-12])&IF(RC[-10]="",,"|n"&R1C23&RC[-10])&IF(RC[-9]="",,"|n"&R1C24&RC[-9])&IF(RC[-8]="",,"|n"&R1C25&RC[-8])&IF(RC[-7]="",,"|n"&R1C26&RC[-7])&IF(RC[-6]="",,"|n"&R1C27&RC[-6])&IF(RC[-5]="",,"|n"&R1C28&RC[-5])&IF(RC[-2]="",,"|n"&RC[-2]) -> 
AG1108: =IF(RC[-26]&RC[-25]&RC[-24]&RC[-23]&RC[-22]&RC[-21]="",,R1C6)&IF(RC[-26]="",,"|n"&R1C7&RC[-26])&IF(RC[-25]="",,"|n"&R1C8&RC[-25])&IF(RC[-24]="",,"|n"&R1C9&RC[-24])&IF(RC[-23]="",,"|n"&R1C10&RC[-23])&IF(RC[-22]="",,"|n"&R1C11&RC[-22])&IF(RC[-21]="",,"|n"&R1C12&RC[-21])&IF(RC[-19]&RC[-18]&RC[-17]&RC[-16]="",,"|n"&R1C13)&IF(RC[-19]="",,"|n"&R1C14&RC[-19])&IF(RC[-18]="",,"|n"&R1C15&RC[-18])&IF(RC[-17]="",,"|n"&R1C16&RC[-17])&IF(RC[-16]="",,"|n"&R1C17&RC[-16])&IF(RC[-15]="",,"|n"&R1C18&RC[-15])&IF(RC[-14]="",,"|n"&R1C19&RC[-14])&IF(RC[-13]="",,"|n"&R1C20&RC[-13])&IF(RC[-12]="",,"|n"&R1C21&RC[-12])&IF(RC[-10]="",,"|n"&R1C23&RC[-10])&IF(RC[-9]="",,"|n"&R1C24&RC[-9])&IF(RC[-8]="",,"|n"&R1C25&RC[-8])&IF(RC[-7]="",,"|n"&R1C26&RC[-7])&IF(RC[-6]="",,"|n"&R1C27&RC[-6])&IF(RC[-5]="",,"|n"&R1C28&RC[-5])&IF(RC[-2]="",,"|n"&RC[-2]) -> 
AG1109: =IF(RC[-26]&RC[-25]&RC[-24]&RC[-23]&RC[-22]&RC[-21]="",,R1C6)&IF(RC[-26]="",,"|n"&R1C7&RC[-26])&IF(RC[-25]="",,"|n"&R1C8&RC[-25])&IF(RC[-24]="",,"|n"&R1C9&RC[-24])&IF(RC[-23]="",,"|n"&R1C10&RC[-23])&IF(RC[-22]="",,"|n"&R1C11&RC[-22])&IF(RC[-21]="",,"|n"&R1C12&RC[-21])&IF(RC[-19]&RC[-18]&RC[-17]&RC[-16]="",,"|n"&R1C13)&IF(RC[-19]="",,"|n"&R1C14&RC[-19])&IF(RC[-18]="",,"|n"&R1C15&RC[-18])&IF(RC[-17]="",,"|n"&R1C16&RC[-17])&IF(RC[-16]="",,"|n"&R1C17&RC[-16])&IF(RC[-15]="",,"|n"&R1C18&RC[-15])&IF(RC[-14]="",,"|n"&R1C19&RC[-14])&IF(RC[-13]="",,"|n"&R1C20&RC[-13])&IF(RC[-12]="",,"|n"&R1C21&RC[-12])&IF(RC[-10]="",,"|n"&R1C23&RC[-10])&IF(RC[-9]="",,"|n"&R1C24&RC[-9])&IF(RC[-8]="",,"|n"&R1C25&RC[-8])&IF(RC[-7]="",,"|n"&R1C26&RC[-7])&IF(RC[-6]="",,"|n"&R1C27&RC[-6])&IF(RC[-5]="",,"|n"&R1C28&RC[-5])&IF(RC[-2]="",,"|n"&RC[-2]) -> 
AG1110: =IF(RC[-26]&RC[-25]&RC[-24]&RC[-23]&RC[-22]&RC[-21]="",,R1C6)&IF(RC[-26]="",,"|n"&R1C7&RC[-26])&IF(RC[-25]="",,"|n"&R1C8&RC[-25])&IF(RC[-24]="",,"|n"&R1C9&RC[-24])&IF(RC[-23]="",,"|n"&R1C10&RC[-23])&IF(RC[-22]="",,"|n"&R1C11&RC[-22])&IF(RC[-21]="",,"|n"&R1C12&RC[-21])&IF(RC[-19]&RC[-18]&RC[-17]&RC[-16]="",,"|n"&R1C13)&IF(RC[-19]="",,"|n"&R1C14&RC[-19])&IF(RC[-18]="",,"|n"&R1C15&RC[-18])&IF(RC[-17]="",,"|n"&R1C16&RC[-17])&IF(RC[-16]="",,"|n"&R1C17&RC[-16])&IF(RC[-15]="",,"|n"&R1C18&RC[-15])&IF(RC[-14]="",,"|n"&R1C19&RC[-14])&IF(RC[-13]="",,"|n"&R1C20&RC[-13])&IF(RC[-12]="",,"|n"&R1C21&RC[-12])&IF(RC[-10]="",,"|n"&R1C23&RC[-10])&IF(RC[-9]="",,"|n"&R1C24&RC[-9])&IF(RC[-8]="",,"|n"&R1C25&RC[-8])&IF(RC[-7]="",,"|n"&R1C26&RC[-7])&IF(RC[-6]="",,"|n"&R1C27&RC[-6])&IF(RC[-5]="",,"|n"&R1C28&RC[-5])&IF(RC[-2]="",,"|n"&RC[-2]) -> 
AG1111: =IF(RC[-26]&RC[-25]&RC[-24]&RC[-23]&RC[-22]&RC[-21]="",,R1C6)&IF(RC[-26]="",,"|n"&R1C7&RC[-26])&IF(RC[-25]="",,"|n"&R1C8&RC[-25])&IF(RC[-24]="",,"|n"&R1C9&RC[-24])&IF(RC[-23]="",,"|n"&R1C10&RC[-23])&IF(RC[-22]="",,"|n"&R1C11&RC[-22])&IF(RC[-21]="",,"|n"&R1C12&RC[-21])&IF(RC[-19]&RC[-18]&RC[-17]&RC[-16]="",,"|n"&R1C13)&IF(RC[-19]="",,"|n"&R1C14&RC[-19])&IF(RC[-18]="",,"|n"&R1C15&RC[-18])&IF(RC[-17]="",,"|n"&R1C16&RC[-17])&IF(RC[-16]="",,"|n"&R1C17&RC[-16])&IF(RC[-15]="",,"|n"&R1C18&RC[-15])&IF(RC[-14]="",,"|n"&R1C19&RC[-14])&IF(RC[-13]="",,"|n"&R1C20&RC[-13])&IF(RC[-12]="",,"|n"&R1C21&RC[-12])&IF(RC[-10]="",,"|n"&R1C23&RC[-10])&IF(RC[-9]="",,"|n"&R1C24&RC[-9])&IF(RC[-8]="",,"|n"&R1C25&RC[-8])&IF(RC[-7]="",,"|n"&R1C26&RC[-7])&IF(RC[-6]="",,"|n"&R1C27&RC[-6])&IF(RC[-5]="",,"|n"&R1C28&RC[-5])&IF(RC[-2]="",,"|n"&RC[-2]) -> 
AG1112: =IF(RC[-26]&RC[-25]&RC[-24]&RC[-23]&RC[-22]&RC[-21]="",,R1C6)&IF(RC[-26]="",,"|n"&R1C7&RC[-26])&IF(RC[-25]="",,"|n"&R1C8&RC[-25])&IF(RC[-24]="",,"|n"&R1C9&RC[-24])&IF(RC[-23]="",,"|n"&R1C10&RC[-23])&IF(RC[-22]="",,"|n"&R1C11&RC[-22])&IF(RC[-21]="",,"|n"&R1C12&RC[-21])&IF(RC[-19]&RC[-18]&RC[-17]&RC[-16]="",,"|n"&R1C13)&IF(RC[-19]="",,"|n"&R1C14&RC[-19])&IF(RC[-18]="",,"|n"&R1C15&RC[-18])&IF(RC[-17]="",,"|n"&R1C16&RC[-17])&IF(RC[-16]="",,"|n"&R1C17&RC[-16])&IF(RC[-15]="",,"|n"&R1C18&RC[-15])&IF(RC[-14]="",,"|n"&R1C19&RC[-14])&IF(RC[-13]="",,"|n"&R1C20&RC[-13])&IF(RC[-12]="",,"|n"&R1C21&RC[-12])&IF(RC[-10]="",,"|n"&R1C23&RC[-10])&IF(RC[-9]="",,"|n"&R1C24&RC[-9])&IF(RC[-8]="",,"|n"&R1C25&RC[-8])&IF(RC[-7]="",,"|n"&R1C26&RC[-7])&IF(RC[-6]="",,"|n"&R1C27&RC[-6])&IF(RC[-5]="",,"|n"&R1C28&RC[-5])&IF(RC[-2]="",,"|n"&RC[-2]) -> 
AG1113: =IF(RC[-26]&RC[-25]&RC[-24]&RC[-23]&RC[-22]&RC[-21]="",,R1C6)&IF(RC[-26]="",,"|n"&R1C7&RC[-26])&IF(RC[-25]="",,"|n"&R1C8&RC[-25])&IF(RC[-24]="",,"|n"&R1C9&RC[-24])&IF(RC[-23]="",,"|n"&R1C10&RC[-23])&IF(RC[-22]="",,"|n"&R1C11&RC[-22])&IF(RC[-21]="",,"|n"&R1C12&RC[-21])&IF(RC[-19]&RC[-18]&RC[-17]&RC[-16]="",,"|n"&R1C13)&IF(RC[-19]="",,"|n"&R1C14&RC[-19])&IF(RC[-18]="",,"|n"&R1C15&RC[-18])&IF(RC[-17]="",,"|n"&R1C16&RC[-17])&IF(RC[-16]="",,"|n"&R1C17&RC[-16])&IF(RC[-15]="",,"|n"&R1C18&RC[-15])&IF(RC[-14]="",,"|n"&R1C19&RC[-14])&IF(RC[-13]="",,"|n"&R1C20&RC[-13])&IF(RC[-12]="",,"|n"&R1C21&RC[-12])&IF(RC[-10]="",,"|n"&R1C23&RC[-10])&IF(RC[-9]="",,"|n"&R1C24&RC[-9])&IF(RC[-8]="",,"|n"&R1C25&RC[-8])&IF(RC[-7]="",,"|n"&R1C26&RC[-7])&IF(RC[-6]="",,"|n"&R1C27&RC[-6])&IF(RC[-5]="",,"|n"&R1C28&RC[-5])&IF(RC[-2]="",,"|n"&RC[-2]) -> 
AG1114: =IF(RC[-26]&RC[-25]&RC[-24]&RC[-23]&RC[-22]&RC[-21]="",,R1C6)&IF(RC[-26]="",,"|n"&R1C7&RC[-26])&IF(RC[-25]="",,"|n"&R1C8&RC[-25])&IF(RC[-24]="",,"|n"&R1C9&RC[-24])&IF(RC[-23]="",,"|n"&R1C10&RC[-23])&IF(RC[-22]="",,"|n"&R1C11&RC[-22])&IF(RC[-21]="",,"|n"&R1C12&RC[-21])&IF(RC[-19]&RC[-18]&RC[-17]&RC[-16]="",,"|n"&R1C13)&IF(RC[-19]="",,"|n"&R1C14&RC[-19])&IF(RC[-18]="",,"|n"&R1C15&RC[-18])&IF(RC[-17]="",,"|n"&R1C16&RC[-17])&IF(RC[-16]="",,"|n"&R1C17&RC[-16])&IF(RC[-15]="",,"|n"&R1C18&RC[-15])&IF(RC[-14]="",,"|n"&R1C19&RC[-14])&IF(RC[-13]="",,"|n"&R1C20&RC[-13])&IF(RC[-12]="",,"|n"&R1C21&RC[-12])&IF(RC[-10]="",,"|n"&R1C23&RC[-10])&IF(RC[-9]="",,"|n"&R1C24&RC[-9])&IF(RC[-8]="",,"|n"&R1C25&RC[-8])&IF(RC[-7]="",,"|n"&R1C26&RC[-7])&IF(RC[-6]="",,"|n"&R1C27&RC[-6])&IF(RC[-5]="",,"|n"&R1C28&RC[-5])&IF(RC[-2]="",,"|n"&RC[-2]) -> 
AG1115: =IF(RC[-26]&RC[-25]&RC[-24]&RC[-23]&RC[-22]&RC[-21]="",,R1C6)&IF(RC[-26]="",,"|n"&R1C7&RC[-26])&IF(RC[-25]="",,"|n"&R1C8&RC[-25])&IF(RC[-24]="",,"|n"&R1C9&RC[-24])&IF(RC[-23]="",,"|n"&R1C10&RC[-23])&IF(RC[-22]="",,"|n"&R1C11&RC[-22])&IF(RC[-21]="",,"|n"&R1C12&RC[-21])&IF(RC[-19]&RC[-18]&RC[-17]&RC[-16]="",,"|n"&R1C13)&IF(RC[-19]="",,"|n"&R1C14&RC[-19])&IF(RC[-18]="",,"|n"&R1C15&RC[-18])&IF(RC[-17]="",,"|n"&R1C16&RC[-17])&IF(RC[-16]="",,"|n"&R1C17&RC[-16])&IF(RC[-15]="",,"|n"&R1C18&RC[-15])&IF(RC[-14]="",,"|n"&R1C19&RC[-14])&IF(RC[-13]="",,"|n"&R1C20&RC[-13])&IF(RC[-12]="",,"|n"&R1C21&RC[-12])&IF(RC[-10]="",,"|n"&R1C23&RC[-10])&IF(RC[-9]="",,"|n"&R1C24&RC[-9])&IF(RC[-8]="",,"|n"&R1C25&RC[-8])&IF(RC[-7]="",,"|n"&R1C26&RC[-7])&IF(RC[-6]="",,"|n"&R1C27&RC[-6])&IF(RC[-5]="",,"|n"&R1C28&RC[-5])&IF(RC[-2]="",,"|n"&RC[-2]) -> 
AG1116: =IF(RC[-26]&RC[-25]&RC[-24]&RC[-23]&RC[-22]&RC[-21]="",,R1C6)&IF(RC[-26]="",,"|n"&R1C7&RC[-26])&IF(RC[-25]="",,"|n"&R1C8&RC[-25])&IF(RC[-24]="",,"|n"&R1C9&RC[-24])&IF(RC[-23]="",,"|n"&R1C10&RC[-23])&IF(RC[-22]="",,"|n"&R1C11&RC[-22])&IF(RC[-21]="",,"|n"&R1C12&RC[-21])&IF(RC[-19]&RC[-18]&RC[-17]&RC[-16]="",,"|n"&R1C13)&IF(RC[-19]="",,"|n"&R1C14&RC[-19])&IF(RC[-18]="",,"|n"&R1C15&RC[-18])&IF(RC[-17]="",,"|n"&R1C16&RC[-17])&IF(RC[-16]="",,"|n"&R1C17&RC[-16])&IF(RC[-15]="",,"|n"&R1C18&RC[-15])&IF(RC[-14]="",,"|n"&R1C19&RC[-14])&IF(RC[-13]="",,"|n"&R1C20&RC[-13])&IF(RC[-12]="",,"|n"&R1C21&RC[-12])&IF(RC[-10]="",,"|n"&R1C23&RC[-10])&IF(RC[-9]="",,"|n"&R1C24&RC[-9])&IF(RC[-8]="",,"|n"&R1C25&RC[-8])&IF(RC[-7]="",,"|n"&R1C26&RC[-7])&IF(RC[-6]="",,"|n"&R1C27&RC[-6])&IF(RC[-5]="",,"|n"&R1C28&RC[-5])&IF(RC[-2]="",,"|n"&RC[-2]) -> 
AG1117: =IF(RC[-26]&RC[-25]&RC[-24]&RC[-23]&RC[-22]&RC[-21]="",,R1C6)&IF(RC[-26]="",,"|n"&R1C7&RC[-26])&IF(RC[-25]="",,"|n"&R1C8&RC[-25])&IF(RC[-24]="",,"|n"&R1C9&RC[-24])&IF(RC[-23]="",,"|n"&R1C10&RC[-23])&IF(RC[-22]="",,"|n"&R1C11&RC[-22])&IF(RC[-21]="",,"|n"&R1C12&RC[-21])&IF(RC[-19]&RC[-18]&RC[-17]&RC[-16]="",,"|n"&R1C13)&IF(RC[-19]="",,"|n"&R1C14&RC[-19])&IF(RC[-18]="",,"|n"&R1C15&RC[-18])&IF(RC[-17]="",,"|n"&R1C16&RC[-17])&IF(RC[-16]="",,"|n"&R1C17&RC[-16])&IF(RC[-15]="",,"|n"&R1C18&RC[-15])&IF(RC[-14]="",,"|n"&R1C19&RC[-14])&IF(RC[-13]="",,"|n"&R1C20&RC[-13])&IF(RC[-12]="",,"|n"&R1C21&RC[-12])&IF(RC[-10]="",,"|n"&R1C23&RC[-10])&IF(RC[-9]="",,"|n"&R1C24&RC[-9])&IF(RC[-8]="",,"|n"&R1C25&RC[-8])&IF(RC[-7]="",,"|n"&R1C26&RC[-7])&IF(RC[-6]="",,"|n"&R1C27&RC[-6])&IF(RC[-5]="",,"|n"&R1C28&RC[-5])&IF(RC[-2]="",,"|n"&RC[-2]) -> 
AG1118: =IF(RC[-26]&RC[-25]&RC[-24]&RC[-23]&RC[-22]&RC[-21]="",,R1C6)&IF(RC[-26]="",,"|n"&R1C7&RC[-26])&IF(RC[-25]="",,"|n"&R1C8&RC[-25])&IF(RC[-24]="",,"|n"&R1C9&RC[-24])&IF(RC[-23]="",,"|n"&R1C10&RC[-23])&IF(RC[-22]="",,"|n"&R1C11&RC[-22])&IF(RC[-21]="",,"|n"&R1C12&RC[-21])&IF(RC[-19]&RC[-18]&RC[-17]&RC[-16]="",,"|n"&R1C13)&IF(RC[-19]="",,"|n"&R1C14&RC[-19])&IF(RC[-18]="",,"|n"&R1C15&RC[-18])&IF(RC[-17]="",,"|n"&R1C16&RC[-17])&IF(RC[-16]="",,"|n"&R1C17&RC[-16])&IF(RC[-15]="",,"|n"&R1C18&RC[-15])&IF(RC[-14]="",,"|n"&R1C19&RC[-14])&IF(RC[-13]="",,"|n"&R1C20&RC[-13])&IF(RC[-12]="",,"|n"&R1C21&RC[-12])&IF(RC[-10]="",,"|n"&R1C23&RC[-10])&IF(RC[-9]="",,"|n"&R1C24&RC[-9])&IF(RC[-8]="",,"|n"&R1C25&RC[-8])&IF(RC[-7]="",,"|n"&R1C26&RC[-7])&IF(RC[-6]="",,"|n"&R1C27&RC[-6])&IF(RC[-5]="",,"|n"&R1C28&RC[-5])&IF(RC[-2]="",,"|n"&RC[-2]) -> 
AG1119: =IF(RC[-26]&RC[-25]&RC[-24]&RC[-23]&RC[-22]&RC[-21]="",,R1C6)&IF(RC[-26]="",,"|n"&R1C7&RC[-26])&IF(RC[-25]="",,"|n"&R1C8&RC[-25])&IF(RC[-24]="",,"|n"&R1C9&RC[-24])&IF(RC[-23]="",,"|n"&R1C10&RC[-23])&IF(RC[-22]="",,"|n"&R1C11&RC[-22])&IF(RC[-21]="",,"|n"&R1C12&RC[-21])&IF(RC[-19]&RC[-18]&RC[-17]&RC[-16]="",,"|n"&R1C13)&IF(RC[-19]="",,"|n"&R1C14&RC[-19])&IF(RC[-18]="",,"|n"&R1C15&RC[-18])&IF(RC[-17]="",,"|n"&R1C16&RC[-17])&IF(RC[-16]="",,"|n"&R1C17&RC[-16])&IF(RC[-15]="",,"|n"&R1C18&RC[-15])&IF(RC[-14]="",,"|n"&R1C19&RC[-14])&IF(RC[-13]="",,"|n"&R1C20&RC[-13])&IF(RC[-12]="",,"|n"&R1C21&RC[-12])&IF(RC[-10]="",,"|n"&R1C23&RC[-10])&IF(RC[-9]="",,"|n"&R1C24&RC[-9])&IF(RC[-8]="",,"|n"&R1C25&RC[-8])&IF(RC[-7]="",,"|n"&R1C26&RC[-7])&IF(RC[-6]="",,"|n"&R1C27&RC[-6])&IF(RC[-5]="",,"|n"&R1C28&RC[-5])&IF(RC[-2]="",,"|n"&RC[-2]) -> 
AG1120: =IF(RC[-26]&RC[-25]&RC[-24]&RC[-23]&RC[-22]&RC[-21]="",,R1C6)&IF(RC[-26]="",,"|n"&R1C7&RC[-26])&IF(RC[-25]="",,"|n"&R1C8&RC[-25])&IF(RC[-24]="",,"|n"&R1C9&RC[-24])&IF(RC[-23]="",,"|n"&R1C10&RC[-23])&IF(RC[-22]="",,"|n"&R1C11&RC[-22])&IF(RC[-21]="",,"|n"&R1C12&RC[-21])&IF(RC[-19]&RC[-18]&RC[-17]&RC[-16]="",,"|n"&R1C13)&IF(RC[-19]="",,"|n"&R1C14&RC[-19])&IF(RC[-18]="",,"|n"&R1C15&RC[-18])&IF(RC[-17]="",,"|n"&R1C16&RC[-17])&IF(RC[-16]="",,"|n"&R1C17&RC[-16])&IF(RC[-15]="",,"|n"&R1C18&RC[-15])&IF(RC[-14]="",,"|n"&R1C19&RC[-14])&IF(RC[-13]="",,"|n"&R1C20&RC[-13])&IF(RC[-12]="",,"|n"&R1C21&RC[-12])&IF(RC[-10]="",,"|n"&R1C23&RC[-10])&IF(RC[-9]="",,"|n"&R1C24&RC[-9])&IF(RC[-8]="",,"|n"&R1C25&RC[-8])&IF(RC[-7]="",,"|n"&R1C26&RC[-7])&IF(RC[-6]="",,"|n"&R1C27&RC[-6])&IF(RC[-5]="",,"|n"&R1C28&RC[-5])&IF(RC[-2]="",,"|n"&RC[-2]) -> 
AG1121: =IF(RC[-26]&RC[-25]&RC[-24]&RC[-23]&RC[-22]&RC[-21]="",,R1C6)&IF(RC[-26]="",,"|n"&R1C7&RC[-26])&IF(RC[-25]="",,"|n"&R1C8&RC[-25])&IF(RC[-24]="",,"|n"&R1C9&RC[-24])&IF(RC[-23]="",,"|n"&R1C10&RC[-23])&IF(RC[-22]="",,"|n"&R1C11&RC[-22])&IF(RC[-21]="",,"|n"&R1C12&RC[-21])&IF(RC[-19]&RC[-18]&RC[-17]&RC[-16]="",,"|n"&R1C13)&IF(RC[-19]="",,"|n"&R1C14&RC[-19])&IF(RC[-18]="",,"|n"&R1C15&RC[-18])&IF(RC[-17]="",,"|n"&R1C16&RC[-17])&IF(RC[-16]="",,"|n"&R1C17&RC[-16])&IF(RC[-15]="",,"|n"&R1C18&RC[-15])&IF(RC[-14]="",,"|n"&R1C19&RC[-14])&IF(RC[-13]="",,"|n"&R1C20&RC[-13])&IF(RC[-12]="",,"|n"&R1C21&RC[-12])&IF(RC[-10]="",,"|n"&R1C23&RC[-10])&IF(RC[-9]="",,"|n"&R1C24&RC[-9])&IF(RC[-8]="",,"|n"&R1C25&RC[-8])&IF(RC[-7]="",,"|n"&R1C26&RC[-7])&IF(RC[-6]="",,"|n"&R1C27&RC[-6])&IF(RC[-5]="",,"|n"&R1C28&RC[-5])&IF(RC[-2]="",,"|n"&RC[-2]) -> 
AG1122: =IF(RC[-26]&RC[-25]&RC[-24]&RC[-23]&RC[-22]&RC[-21]="",,R1C6)&IF(RC[-26]="",,"|n"&R1C7&RC[-26])&IF(RC[-25]="",,"|n"&R1C8&RC[-25])&IF(RC[-24]="",,"|n"&R1C9&RC[-24])&IF(RC[-23]="",,"|n"&R1C10&RC[-23])&IF(RC[-22]="",,"|n"&R1C11&RC[-22])&IF(RC[-21]="",,"|n"&R1C12&RC[-21])&IF(RC[-19]&RC[-18]&RC[-17]&RC[-16]="",,"|n"&R1C13)&IF(RC[-19]="",,"|n"&R1C14&RC[-19])&IF(RC[-18]="",,"|n"&R1C15&RC[-18])&IF(RC[-17]="",,"|n"&R1C16&RC[-17])&IF(RC[-16]="",,"|n"&R1C17&RC[-16])&IF(RC[-15]="",,"|n"&R1C18&RC[-15])&IF(RC[-14]="",,"|n"&R1C19&RC[-14])&IF(RC[-13]="",,"|n"&R1C20&RC[-13])&IF(RC[-12]="",,"|n"&R1C21&RC[-12])&IF(RC[-10]="",,"|n"&R1C23&RC[-10])&IF(RC[-9]="",,"|n"&R1C24&RC[-9])&IF(RC[-8]="",,"|n"&R1C25&RC[-8])&IF(RC[-7]="",,"|n"&R1C26&RC[-7])&IF(RC[-6]="",,"|n"&R1C27&RC[-6])&IF(RC[-5]="",,"|n"&R1C28&RC[-5])&IF(RC[-2]="",,"|n"&RC[-2]) -> 
AG1123: =IF(RC[-26]&RC[-25]&RC[-24]&RC[-23]&RC[-22]&RC[-21]="",,R1C6)&IF(RC[-26]="",,"|n"&R1C7&RC[-26])&IF(RC[-25]="",,"|n"&R1C8&RC[-25])&IF(RC[-24]="",,"|n"&R1C9&RC[-24])&IF(RC[-23]="",,"|n"&R1C10&RC[-23])&IF(RC[-22]="",,"|n"&R1C11&RC[-22])&IF(RC[-21]="",,"|n"&R1C12&RC[-21])&IF(RC[-19]&RC[-18]&RC[-17]&RC[-16]="",,"|n"&R1C13)&IF(RC[-19]="",,"|n"&R1C14&RC[-19])&IF(RC[-18]="",,"|n"&R1C15&RC[-18])&IF(RC[-17]="",,"|n"&R1C16&RC[-17])&IF(RC[-16]="",,"|n"&R1C17&RC[-16])&IF(RC[-15]="",,"|n"&R1C18&RC[-15])&IF(RC[-14]="",,"|n"&R1C19&RC[-14])&IF(RC[-13]="",,"|n"&R1C20&RC[-13])&IF(RC[-12]="",,"|n"&R1C21&RC[-12])&IF(RC[-10]="",,"|n"&R1C23&RC[-10])&IF(RC[-9]="",,"|n"&R1C24&RC[-9])&IF(RC[-8]="",,"|n"&R1C25&RC[-8])&IF(RC[-7]="",,"|n"&R1C26&RC[-7])&IF(RC[-6]="",,"|n"&R1C27&RC[-6])&IF(RC[-5]="",,"|n"&R1C28&RC[-5])&IF(RC[-2]="",,"|n"&RC[-2]) -> 
AG1124: =IF(RC[-26]&RC[-25]&RC[-24]&RC[-23]&RC[-22]&RC[-21]="",,R1C6)&IF(RC[-26]="",,"|n"&R1C7&RC[-26])&IF(RC[-25]="",,"|n"&R1C8&RC[-25])&IF(RC[-24]="",,"|n"&R1C9&RC[-24])&IF(RC[-23]="",,"|n"&R1C10&RC[-23])&IF(RC[-22]="",,"|n"&R1C11&RC[-22])&IF(RC[-21]="",,"|n"&R1C12&RC[-21])&IF(RC[-19]&RC[-18]&RC[-17]&RC[-16]="",,"|n"&R1C13)&IF(RC[-19]="",,"|n"&R1C14&RC[-19])&IF(RC[-18]="",,"|n"&R1C15&RC[-18])&IF(RC[-17]="",,"|n"&R1C16&RC[-17])&IF(RC[-16]="",,"|n"&R1C17&RC[-16])&IF(RC[-15]="",,"|n"&R1C18&RC[-15])&IF(RC[-14]="",,"|n"&R1C19&RC[-14])&IF(RC[-13]="",,"|n"&R1C20&RC[-13])&IF(RC[-12]="",,"|n"&R1C21&RC[-12])&IF(RC[-10]="",,"|n"&R1C23&RC[-10])&IF(RC[-9]="",,"|n"&R1C24&RC[-9])&IF(RC[-8]="",,"|n"&R1C25&RC[-8])&IF(RC[-7]="",,"|n"&R1C26&RC[-7])&IF(RC[-6]="",,"|n"&R1C27&RC[-6])&IF(RC[-5]="",,"|n"&R1C28&RC[-5])&IF(RC[-2]="",,"|n"&RC[-2]) -> 
AG1125: =IF(RC[-26]&RC[-25]&RC[-24]&RC[-23]&RC[-22]&RC[-21]="",,R1C6)&IF(RC[-26]="",,"|n"&R1C7&RC[-26])&IF(RC[-25]="",,"|n"&R1C8&RC[-25])&IF(RC[-24]="",,"|n"&R1C9&RC[-24])&IF(RC[-23]="",,"|n"&R1C10&RC[-23])&IF(RC[-22]="",,"|n"&R1C11&RC[-22])&IF(RC[-21]="",,"|n"&R1C12&RC[-21])&IF(RC[-19]&RC[-18]&RC[-17]&RC[-16]="",,"|n"&R1C13)&IF(RC[-19]="",,"|n"&R1C14&RC[-19])&IF(RC[-18]="",,"|n"&R1C15&RC[-18])&IF(RC[-17]="",,"|n"&R1C16&RC[-17])&IF(RC[-16]="",,"|n"&R1C17&RC[-16])&IF(RC[-15]="",,"|n"&R1C18&RC[-15])&IF(RC[-14]="",,"|n"&R1C19&RC[-14])&IF(RC[-13]="",,"|n"&R1C20&RC[-13])&IF(RC[-12]="",,"|n"&R1C21&RC[-12])&IF(RC[-10]="",,"|n"&R1C23&RC[-10])&IF(RC[-9]="",,"|n"&R1C24&RC[-9])&IF(RC[-8]="",,"|n"&R1C25&RC[-8])&IF(RC[-7]="",,"|n"&R1C26&RC[-7])&IF(RC[-6]="",,"|n"&R1C27&RC[-6])&IF(RC[-5]="",,"|n"&R1C28&RC[-5])&IF(RC[-2]="",,"|n"&RC[-2]) -> 
AG1126: =IF(RC[-26]&RC[-25]&RC[-24]&RC[-23]&RC[-22]&RC[-21]="",,R1C6)&IF(RC[-26]="",,"|n"&R1C7&RC[-26])&IF(RC[-25]="",,"|n"&R1C8&RC[-25])&IF(RC[-24]="",,"|n"&R1C9&RC[-24])&IF(RC[-23]="",,"|n"&R1C10&RC[-23])&IF(RC[-22]="",,"|n"&R1C11&RC[-22])&IF(RC[-21]="",,"|n"&R1C12&RC[-21])&IF(RC[-19]&RC[-18]&RC[-17]&RC[-16]="",,"|n"&R1C13)&IF(RC[-19]="",,"|n"&R1C14&RC[-19])&IF(RC[-18]="",,"|n"&R1C15&RC[-18])&IF(RC[-17]="",,"|n"&R1C16&RC[-17])&IF(RC[-16]="",,"|n"&R1C17&RC[-16])&IF(RC[-15]="",,"|n"&R1C18&RC[-15])&IF(RC[-14]="",,"|n"&R1C19&RC[-14])&IF(RC[-13]="",,"|n"&R1C20&RC[-13])&IF(RC[-12]="",,"|n"&R1C21&RC[-12])&IF(RC[-10]="",,"|n"&R1C23&RC[-10])&IF(RC[-9]="",,"|n"&R1C24&RC[-9])&IF(RC[-8]="",,"|n"&R1C25&RC[-8])&IF(RC[-7]="",,"|n"&R1C26&RC[-7])&IF(RC[-6]="",,"|n"&R1C27&RC[-6])&IF(RC[-5]="",,"|n"&R1C28&RC[-5])&IF(RC[-2]="",,"|n"&RC[-2]) -> 
AG1127: =IF(RC[-26]&RC[-25]&RC[-24]&RC[-23]&RC[-22]&RC[-21]="",,R1C6)&IF(RC[-26]="",,"|n"&R1C7&RC[-26])&IF(RC[-25]="",,"|n"&R1C8&RC[-25])&IF(RC[-24]="",,"|n"&R1C9&RC[-24])&IF(RC[-23]="",,"|n"&R1C10&RC[-23])&IF(RC[-22]="",,"|n"&R1C11&RC[-22])&IF(RC[-21]="",,"|n"&R1C12&RC[-21])&IF(RC[-19]&RC[-18]&RC[-17]&RC[-16]="",,"|n"&R1C13)&IF(RC[-19]="",,"|n"&R1C14&RC[-19])&IF(RC[-18]="",,"|n"&R1C15&RC[-18])&IF(RC[-17]="",,"|n"&R1C16&RC[-17])&IF(RC[-16]="",,"|n"&R1C17&RC[-16])&IF(RC[-15]="",,"|n"&R1C18&RC[-15])&IF(RC[-14]="",,"|n"&R1C19&RC[-14])&IF(RC[-13]="",,"|n"&R1C20&RC[-13])&IF(RC[-12]="",,"|n"&R1C21&RC[-12])&IF(RC[-10]="",,"|n"&R1C23&RC[-10])&IF(RC[-9]="",,"|n"&R1C24&RC[-9])&IF(RC[-8]="",,"|n"&R1C25&RC[-8])&IF(RC[-7]="",,"|n"&R1C26&RC[-7])&IF(RC[-6]="",,"|n"&R1C27&RC[-6])&IF(RC[-5]="",,"|n"&R1C28&RC[-5])&IF(RC[-2]="",,"|n"&RC[-2]) -> 
AG1128: =IF(RC[-26]&RC[-25]&RC[-24]&RC[-23]&RC[-22]&RC[-21]="",,R1C6)&IF(RC[-26]="",,"|n"&R1C7&RC[-26])&IF(RC[-25]="",,"|n"&R1C8&RC[-25])&IF(RC[-24]="",,"|n"&R1C9&RC[-24])&IF(RC[-23]="",,"|n"&R1C10&RC[-23])&IF(RC[-22]="",,"|n"&R1C11&RC[-22])&IF(RC[-21]="",,"|n"&R1C12&RC[-21])&IF(RC[-19]&RC[-18]&RC[-17]&RC[-16]="",,"|n"&R1C13)&IF(RC[-19]="",,"|n"&R1C14&RC[-19])&IF(RC[-18]="",,"|n"&R1C15&RC[-18])&IF(RC[-17]="",,"|n"&R1C16&RC[-17])&IF(RC[-16]="",,"|n"&R1C17&RC[-16])&IF(RC[-15]="",,"|n"&R1C18&RC[-15])&IF(RC[-14]="",,"|n"&R1C19&RC[-14])&IF(RC[-13]="",,"|n"&R1C20&RC[-13])&IF(RC[-12]="",,"|n"&R1C21&RC[-12])&IF(RC[-10]="",,"|n"&R1C23&RC[-10])&IF(RC[-9]="",,"|n"&R1C24&RC[-9])&IF(RC[-8]="",,"|n"&R1C25&RC[-8])&IF(RC[-7]="",,"|n"&R1C26&RC[-7])&IF(RC[-6]="",,"|n"&R1C27&RC[-6])&IF(RC[-5]="",,"|n"&R1C28&RC[-5])&IF(RC[-2]="",,"|n"&RC[-2]) -> 
AG1129: =IF(RC[-26]&RC[-25]&RC[-24]&RC[-23]&RC[-22]&RC[-21]="",,R1C6)&IF(RC[-26]="",,"|n"&R1C7&RC[-26])&IF(RC[-25]="",,"|n"&R1C8&RC[-25])&IF(RC[-24]="",,"|n"&R1C9&RC[-24])&IF(RC[-23]="",,"|n"&R1C10&RC[-23])&IF(RC[-22]="",,"|n"&R1C11&RC[-22])&IF(RC[-21]="",,"|n"&R1C12&RC[-21])&IF(RC[-19]&RC[-18]&RC[-17]&RC[-16]="",,"|n"&R1C13)&IF(RC[-19]="",,"|n"&R1C14&RC[-19])&IF(RC[-18]="",,"|n"&R1C15&RC[-18])&IF(RC[-17]="",,"|n"&R1C16&RC[-17])&IF(RC[-16]="",,"|n"&R1C17&RC[-16])&IF(RC[-15]="",,"|n"&R1C18&RC[-15])&IF(RC[-14]="",,"|n"&R1C19&RC[-14])&IF(RC[-13]="",,"|n"&R1C20&RC[-13])&IF(RC[-12]="",,"|n"&R1C21&RC[-12])&IF(RC[-10]="",,"|n"&R1C23&RC[-10])&IF(RC[-9]="",,"|n"&R1C24&RC[-9])&IF(RC[-8]="",,"|n"&R1C25&RC[-8])&IF(RC[-7]="",,"|n"&R1C26&RC[-7])&IF(RC[-6]="",,"|n"&R1C27&RC[-6])&IF(RC[-5]="",,"|n"&R1C28&RC[-5])&IF(RC[-2]="",,"|n"&RC[-2]) -> 
AG1130: =IF(RC[-26]&RC[-25]&RC[-24]&RC[-23]&RC[-22]&RC[-21]="",,R1C6)&IF(RC[-26]="",,"|n"&R1C7&RC[-26])&IF(RC[-25]="",,"|n"&R1C8&RC[-25])&IF(RC[-24]="",,"|n"&R1C9&RC[-24])&IF(RC[-23]="",,"|n"&R1C10&RC[-23])&IF(RC[-22]="",,"|n"&R1C11&RC[-22])&IF(RC[-21]="",,"|n"&R1C12&RC[-21])&IF(RC[-19]&RC[-18]&RC[-17]&RC[-16]="",,"|n"&R1C13)&IF(RC[-19]="",,"|n"&R1C14&RC[-19])&IF(RC[-18]="",,"|n"&R1C15&RC[-18])&IF(RC[-17]="",,"|n"&R1C16&RC[-17])&IF(RC[-16]="",,"|n"&R1C17&RC[-16])&IF(RC[-15]="",,"|n"&R1C18&RC[-15])&IF(RC[-14]="",,"|n"&R1C19&RC[-14])&IF(RC[-13]="",,"|n"&R1C20&RC[-13])&IF(RC[-12]="",,"|n"&R1C21&RC[-12])&IF(RC[-10]="",,"|n"&R1C23&RC[-10])&IF(RC[-9]="",,"|n"&R1C24&RC[-9])&IF(RC[-8]="",,"|n"&R1C25&RC[-8])&IF(RC[-7]="",,"|n"&R1C26&RC[-7])&IF(RC[-6]="",,"|n"&R1C27&RC[-6])&IF(RC[-5]="",,"|n"&R1C28&RC[-5])&IF(RC[-2]="",,"|n"&RC[-2]) -> 
AG1131: =IF(RC[-26]&RC[-25]&RC[-24]&RC[-23]&RC[-22]&RC[-21]="",,R1C6)&IF(RC[-26]="",,"|n"&R1C7&RC[-26])&IF(RC[-25]="",,"|n"&R1C8&RC[-25])&IF(RC[-24]="",,"|n"&R1C9&RC[-24])&IF(RC[-23]="",,"|n"&R1C10&RC[-23])&IF(RC[-22]="",,"|n"&R1C11&RC[-22])&IF(RC[-21]="",,"|n"&R1C12&RC[-21])&IF(RC[-19]&RC[-18]&RC[-17]&RC[-16]="",,"|n"&R1C13)&IF(RC[-19]="",,"|n"&R1C14&RC[-19])&IF(RC[-18]="",,"|n"&R1C15&RC[-18])&IF(RC[-17]="",,"|n"&R1C16&RC[-17])&IF(RC[-16]="",,"|n"&R1C17&RC[-16])&IF(RC[-15]="",,"|n"&R1C18&RC[-15])&IF(RC[-14]="",,"|n"&R1C19&RC[-14])&IF(RC[-13]="",,"|n"&R1C20&RC[-13])&IF(RC[-12]="",,"|n"&R1C21&RC[-12])&IF(RC[-10]="",,"|n"&R1C23&RC[-10])&IF(RC[-9]="",,"|n"&R1C24&RC[-9])&IF(RC[-8]="",,"|n"&R1C25&RC[-8])&IF(RC[-7]="",,"|n"&R1C26&RC[-7])&IF(RC[-6]="",,"|n"&R1C27&RC[-6])&IF(RC[-5]="",,"|n"&R1C28&RC[-5])&IF(RC[-2]="",,"|n"&RC[-2]) -> 
AG1132: =IF(RC[-26]&RC[-25]&RC[-24]&RC[-23]&RC[-22]&RC[-21]="",,R1C6)&IF(RC[-26]="",,"|n"&R1C7&RC[-26])&IF(RC[-25]="",,"|n"&R1C8&RC[-25])&IF(RC[-24]="",,"|n"&R1C9&RC[-24])&IF(RC[-23]="",,"|n"&R1C10&RC[-23])&IF(RC[-22]="",,"|n"&R1C11&RC[-22])&IF(RC[-21]="",,"|n"&R1C12&RC[-21])&IF(RC[-19]&RC[-18]&RC[-17]&RC[-16]="",,"|n"&R1C13)&IF(RC[-19]="",,"|n"&R1C14&RC[-19])&IF(RC[-18]="",,"|n"&R1C15&RC[-18])&IF(RC[-17]="",,"|n"&R1C16&RC[-17])&IF(RC[-16]="",,"|n"&R1C17&RC[-16])&IF(RC[-15]="",,"|n"&R1C18&RC[-15])&IF(RC[-14]="",,"|n"&R1C19&RC[-14])&IF(RC[-13]="",,"|n"&R1C20&RC[-13])&IF(RC[-12]="",,"|n"&R1C21&RC[-12])&IF(RC[-10]="",,"|n"&R1C23&RC[-10])&IF(RC[-9]="",,"|n"&R1C24&RC[-9])&IF(RC[-8]="",,"|n"&R1C25&RC[-8])&IF(RC[-7]="",,"|n"&R1C26&RC[-7])&IF(RC[-6]="",,"|n"&R1C27&RC[-6])&IF(RC[-5]="",,"|n"&R1C28&RC[-5])&IF(RC[-2]="",,"|n"&RC[-2]) -> 
AG1133: =IF(RC[-26]&RC[-25]&RC[-24]&RC[-23]&RC[-22]&RC[-21]="",,R1C6)&IF(RC[-26]="",,"|n"&R1C7&RC[-26])&IF(RC[-25]="",,"|n"&R1C8&RC[-25])&IF(RC[-24]="",,"|n"&R1C9&RC[-24])&IF(RC[-23]="",,"|n"&R1C10&RC[-23])&IF(RC[-22]="",,"|n"&R1C11&RC[-22])&IF(RC[-21]="",,"|n"&R1C12&RC[-21])&IF(RC[-19]&RC[-18]&RC[-17]&RC[-16]="",,"|n"&R1C13)&IF(RC[-19]="",,"|n"&R1C14&RC[-19])&IF(RC[-18]="",,"|n"&R1C15&RC[-18])&IF(RC[-17]="",,"|n"&R1C16&RC[-17])&IF(RC[-16]="",,"|n"&R1C17&RC[-16])&IF(RC[-15]="",,"|n"&R1C18&RC[-15])&IF(RC[-14]="",,"|n"&R1C19&RC[-14])&IF(RC[-13]="",,"|n"&R1C20&RC[-13])&IF(RC[-12]="",,"|n"&R1C21&RC[-12])&IF(RC[-10]="",,"|n"&R1C23&RC[-10])&IF(RC[-9]="",,"|n"&R1C24&RC[-9])&IF(RC[-8]="",,"|n"&R1C25&RC[-8])&IF(RC[-7]="",,"|n"&R1C26&RC[-7])&IF(RC[-6]="",,"|n"&R1C27&RC[-6])&IF(RC[-5]="",,"|n"&R1C28&RC[-5])&IF(RC[-2]="",,"|n"&RC[-2]) -> 
AG1134: =IF(RC[-26]&RC[-25]&RC[-24]&RC[-23]&RC[-22]&RC[-21]="",,R1C6)&IF(RC[-26]="",,"|n"&R1C7&RC[-26])&IF(RC[-25]="",,"|n"&R1C8&RC[-25])&IF(RC[-24]="",,"|n"&R1C9&RC[-24])&IF(RC[-23]="",,"|n"&R1C10&RC[-23])&IF(RC[-22]="",,"|n"&R1C11&RC[-22])&IF(RC[-21]="",,"|n"&R1C12&RC[-21])&IF(RC[-19]&RC[-18]&RC[-17]&RC[-16]="",,"|n"&R1C13)&IF(RC[-19]="",,"|n"&R1C14&RC[-19])&IF(RC[-18]="",,"|n"&R1C15&RC[-18])&IF(RC[-17]="",,"|n"&R1C16&RC[-17])&IF(RC[-16]="",,"|n"&R1C17&RC[-16])&IF(RC[-15]="",,"|n"&R1C18&RC[-15])&IF(RC[-14]="",,"|n"&R1C19&RC[-14])&IF(RC[-13]="",,"|n"&R1C20&RC[-13])&IF(RC[-12]="",,"|n"&R1C21&RC[-12])&IF(RC[-10]="",,"|n"&R1C23&RC[-10])&IF(RC[-9]="",,"|n"&R1C24&RC[-9])&IF(RC[-8]="",,"|n"&R1C25&RC[-8])&IF(RC[-7]="",,"|n"&R1C26&RC[-7])&IF(RC[-6]="",,"|n"&R1C27&RC[-6])&IF(RC[-5]="",,"|n"&R1C28&RC[-5])&IF(RC[-2]="",,"|n"&RC[-2]) -> 
AG1135: =IF(RC[-26]&RC[-25]&RC[-24]&RC[-23]&RC[-22]&RC[-21]="",,R1C6)&IF(RC[-26]="",,"|n"&R1C7&RC[-26])&IF(RC[-25]="",,"|n"&R1C8&RC[-25])&IF(RC[-24]="",,"|n"&R1C9&RC[-24])&IF(RC[-23]="",,"|n"&R1C10&RC[-23])&IF(RC[-22]="",,"|n"&R1C11&RC[-22])&IF(RC[-21]="",,"|n"&R1C12&RC[-21])&IF(RC[-19]&RC[-18]&RC[-17]&RC[-16]="",,"|n"&R1C13)&IF(RC[-19]="",,"|n"&R1C14&RC[-19])&IF(RC[-18]="",,"|n"&R1C15&RC[-18])&IF(RC[-17]="",,"|n"&R1C16&RC[-17])&IF(RC[-16]="",,"|n"&R1C17&RC[-16])&IF(RC[-15]="",,"|n"&R1C18&RC[-15])&IF(RC[-14]="",,"|n"&R1C19&RC[-14])&IF(RC[-13]="",,"|n"&R1C20&RC[-13])&IF(RC[-12]="",,"|n"&R1C21&RC[-12])&IF(RC[-10]="",,"|n"&R1C23&RC[-10])&IF(RC[-9]="",,"|n"&R1C24&RC[-9])&IF(RC[-8]="",,"|n"&R1C25&RC[-8])&IF(RC[-7]="",,"|n"&R1C26&RC[-7])&IF(RC[-6]="",,"|n"&R1C27&RC[-6])&IF(RC[-5]="",,"|n"&R1C28&RC[-5])&IF(RC[-2]="",,"|n"&RC[-2]) -> 
AG1136: =IF(RC[-26]&RC[-25]&RC[-24]&RC[-23]&RC[-22]&RC[-21]="",,R1C6)&IF(RC[-26]="",,"|n"&R1C7&RC[-26])&IF(RC[-25]="",,"|n"&R1C8&RC[-25])&IF(RC[-24]="",,"|n"&R1C9&RC[-24])&IF(RC[-23]="",,"|n"&R1C10&RC[-23])&IF(RC[-22]="",,"|n"&R1C11&RC[-22])&IF(RC[-21]="",,"|n"&R1C12&RC[-21])&IF(RC[-19]&RC[-18]&RC[-17]&RC[-16]="",,"|n"&R1C13)&IF(RC[-19]="",,"|n"&R1C14&RC[-19])&IF(RC[-18]="",,"|n"&R1C15&RC[-18])&IF(RC[-17]="",,"|n"&R1C16&RC[-17])&IF(RC[-16]="",,"|n"&R1C17&RC[-16])&IF(RC[-15]="",,"|n"&R1C18&RC[-15])&IF(RC[-14]="",,"|n"&R1C19&RC[-14])&IF(RC[-13]="",,"|n"&R1C20&RC[-13])&IF(RC[-12]="",,"|n"&R1C21&RC[-12])&IF(RC[-10]="",,"|n"&R1C23&RC[-10])&IF(RC[-9]="",,"|n"&R1C24&RC[-9])&IF(RC[-8]="",,"|n"&R1C25&RC[-8])&IF(RC[-7]="",,"|n"&R1C26&RC[-7])&IF(RC[-6]="",,"|n"&R1C27&RC[-6])&IF(RC[-5]="",,"|n"&R1C28&RC[-5])&IF(RC[-2]="",,"|n"&RC[-2]) -> 
AG1137: =IF(RC[-26]&RC[-25]&RC[-24]&RC[-23]&RC[-22]&RC[-21]="",,R1C6)&IF(RC[-26]="",,"|n"&R1C7&RC[-26])&IF(RC[-25]="",,"|n"&R1C8&RC[-25])&IF(RC[-24]="",,"|n"&R1C9&RC[-24])&IF(RC[-23]="",,"|n"&R1C10&RC[-23])&IF(RC[-22]="",,"|n"&R1C11&RC[-22])&IF(RC[-21]="",,"|n"&R1C12&RC[-21])&IF(RC[-19]&RC[-18]&RC[-17]&RC[-16]="",,"|n"&R1C13)&IF(RC[-19]="",,"|n"&R1C14&RC[-19])&IF(RC[-18]="",,"|n"&R1C15&RC[-18])&IF(RC[-17]="",,"|n"&R1C16&RC[-17])&IF(RC[-16]="",,"|n"&R1C17&RC[-16])&IF(RC[-15]="",,"|n"&R1C18&RC[-15])&IF(RC[-14]="",,"|n"&R1C19&RC[-14])&IF(RC[-13]="",,"|n"&R1C20&RC[-13])&IF(RC[-12]="",,"|n"&R1C21&RC[-12])&IF(RC[-10]="",,"|n"&R1C23&RC[-10])&IF(RC[-9]="",,"|n"&R1C24&RC[-9])&IF(RC[-8]="",,"|n"&R1C25&RC[-8])&IF(RC[-7]="",,"|n"&R1C26&RC[-7])&IF(RC[-6]="",,"|n"&R1C27&RC[-6])&IF(RC[-5]="",,"|n"&R1C28&RC[-5])&IF(RC[-2]="",,"|n"&RC[-2]) -> 
AG1138: =IF(RC[-26]&RC[-25]&RC[-24]&RC[-23]&RC[-22]&RC[-21]="",,R1C6)&IF(RC[-26]="",,"|n"&R1C7&RC[-26])&IF(RC[-25]="",,"|n"&R1C8&RC[-25])&IF(RC[-24]="",,"|n"&R1C9&RC[-24])&IF(RC[-23]="",,"|n"&R1C10&RC[-23])&IF(RC[-22]="",,"|n"&R1C11&RC[-22])&IF(RC[-21]="",,"|n"&R1C12&RC[-21])&IF(RC[-19]&RC[-18]&RC[-17]&RC[-16]="",,"|n"&R1C13)&IF(RC[-19]="",,"|n"&R1C14&RC[-19])&IF(RC[-18]="",,"|n"&R1C15&RC[-18])&IF(RC[-17]="",,"|n"&R1C16&RC[-17])&IF(RC[-16]="",,"|n"&R1C17&RC[-16])&IF(RC[-15]="",,"|n"&R1C18&RC[-15])&IF(RC[-14]="",,"|n"&R1C19&RC[-14])&IF(RC[-13]="",,"|n"&R1C20&RC[-13])&IF(RC[-12]="",,"|n"&R1C21&RC[-12])&IF(RC[-10]="",,"|n"&R1C23&RC[-10])&IF(RC[-9]="",,"|n"&R1C24&RC[-9])&IF(RC[-8]="",,"|n"&R1C25&RC[-8])&IF(RC[-7]="",,"|n"&R1C26&RC[-7])&IF(RC[-6]="",,"|n"&R1C27&RC[-6])&IF(RC[-5]="",,"|n"&R1C28&RC[-5])&IF(RC[-2]="",,"|n"&RC[-2]) -> 
AG1139: =IF(RC[-26]&RC[-25]&RC[-24]&RC[-23]&RC[-22]&RC[-21]="",,R1C6)&IF(RC[-26]="",,"|n"&R1C7&RC[-26])&IF(RC[-25]="",,"|n"&R1C8&RC[-25])&IF(RC[-24]="",,"|n"&R1C9&RC[-24])&IF(RC[-23]="",,"|n"&R1C10&RC[-23])&IF(RC[-22]="",,"|n"&R1C11&RC[-22])&IF(RC[-21]="",,"|n"&R1C12&RC[-21])&IF(RC[-19]&RC[-18]&RC[-17]&RC[-16]="",,"|n"&R1C13)&IF(RC[-19]="",,"|n"&R1C14&RC[-19])&IF(RC[-18]="",,"|n"&R1C15&RC[-18])&IF(RC[-17]="",,"|n"&R1C16&RC[-17])&IF(RC[-16]="",,"|n"&R1C17&RC[-16])&IF(RC[-15]="",,"|n"&R1C18&RC[-15])&IF(RC[-14]="",,"|n"&R1C19&RC[-14])&IF(RC[-13]="",,"|n"&R1C20&RC[-13])&IF(RC[-12]="",,"|n"&R1C21&RC[-12])&IF(RC[-10]="",,"|n"&R1C23&RC[-10])&IF(RC[-9]="",,"|n"&R1C24&RC[-9])&IF(RC[-8]="",,"|n"&R1C25&RC[-8])&IF(RC[-7]="",,"|n"&R1C26&RC[-7])&IF(RC[-6]="",,"|n"&R1C27&RC[-6])&IF(RC[-5]="",,"|n"&R1C28&RC[-5])&IF(RC[-2]="",,"|n"&RC[-2]) -> 
AG1140: =IF(RC[-26]&RC[-25]&RC[-24]&RC[-23]&RC[-22]&RC[-21]="",,R1C6)&IF(RC[-26]="",,"|n"&R1C7&RC[-26])&IF(RC[-25]="",,"|n"&R1C8&RC[-25])&IF(RC[-24]="",,"|n"&R1C9&RC[-24])&IF(RC[-23]="",,"|n"&R1C10&RC[-23])&IF(RC[-22]="",,"|n"&R1C11&RC[-22])&IF(RC[-21]="",,"|n"&R1C12&RC[-21])&IF(RC[-19]&RC[-18]&RC[-17]&RC[-16]="",,"|n"&R1C13)&IF(RC[-19]="",,"|n"&R1C14&RC[-19])&IF(RC[-18]="",,"|n"&R1C15&RC[-18])&IF(RC[-17]="",,"|n"&R1C16&RC[-17])&IF(RC[-16]="",,"|n"&R1C17&RC[-16])&IF(RC[-15]="",,"|n"&R1C18&RC[-15])&IF(RC[-14]="",,"|n"&R1C19&RC[-14])&IF(RC[-13]="",,"|n"&R1C20&RC[-13])&IF(RC[-12]="",,"|n"&R1C21&RC[-12])&IF(RC[-10]="",,"|n"&R1C23&RC[-10])&IF(RC[-9]="",,"|n"&R1C24&RC[-9])&IF(RC[-8]="",,"|n"&R1C25&RC[-8])&IF(RC[-7]="",,"|n"&R1C26&RC[-7])&IF(RC[-6]="",,"|n"&R1C27&RC[-6])&IF(RC[-5]="",,"|n"&R1C28&RC[-5])&IF(RC[-2]="",,"|n"&RC[-2]) -> 
AG1141: =IF(RC[-26]&RC[-25]&RC[-24]&RC[-23]&RC[-22]&RC[-21]="",,R1C6)&IF(RC[-26]="",,"|n"&R1C7&RC[-26])&IF(RC[-25]="",,"|n"&R1C8&RC[-25])&IF(RC[-24]="",,"|n"&R1C9&RC[-24])&IF(RC[-23]="",,"|n"&R1C10&RC[-23])&IF(RC[-22]="",,"|n"&R1C11&RC[-22])&IF(RC[-21]="",,"|n"&R1C12&RC[-21])&IF(RC[-19]&RC[-18]&RC[-17]&RC[-16]="",,"|n"&R1C13)&IF(RC[-19]="",,"|n"&R1C14&RC[-19])&IF(RC[-18]="",,"|n"&R1C15&RC[-18])&IF(RC[-17]="",,"|n"&R1C16&RC[-17])&IF(RC[-16]="",,"|n"&R1C17&RC[-16])&IF(RC[-15]="",,"|n"&R1C18&RC[-15])&IF(RC[-14]="",,"|n"&R1C19&RC[-14])&IF(RC[-13]="",,"|n"&R1C20&RC[-13])&IF(RC[-12]="",,"|n"&R1C21&RC[-12])&IF(RC[-10]="",,"|n"&R1C23&RC[-10])&IF(RC[-9]="",,"|n"&R1C24&RC[-9])&IF(RC[-8]="",,"|n"&R1C25&RC[-8])&IF(RC[-7]="",,"|n"&R1C26&RC[-7])&IF(RC[-6]="",,"|n"&R1C27&RC[-6])&IF(RC[-5]="",,"|n"&R1C28&RC[-5])&IF(RC[-2]="",,"|n"&RC[-2]) -> 
AG1142: =IF(RC[-26]&RC[-25]&RC[-24]&RC[-23]&RC[-22]&RC[-21]="",,R1C6)&IF(RC[-26]="",,"|n"&R1C7&RC[-26])&IF(RC[-25]="",,"|n"&R1C8&RC[-25])&IF(RC[-24]="",,"|n"&R1C9&RC[-24])&IF(RC[-23]="",,"|n"&R1C10&RC[-23])&IF(RC[-22]="",,"|n"&R1C11&RC[-22])&IF(RC[-21]="",,"|n"&R1C12&RC[-21])&IF(RC[-19]&RC[-18]&RC[-17]&RC[-16]="",,"|n"&R1C13)&IF(RC[-19]="",,"|n"&R1C14&RC[-19])&IF(RC[-18]="",,"|n"&R1C15&RC[-18])&IF(RC[-17]="",,"|n"&R1C16&RC[-17])&IF(RC[-16]="",,"|n"&R1C17&RC[-16])&IF(RC[-15]="",,"|n"&R1C18&RC[-15])&IF(RC[-14]="",,"|n"&R1C19&RC[-14])&IF(RC[-13]="",,"|n"&R1C20&RC[-13])&IF(RC[-12]="",,"|n"&R1C21&RC[-12])&IF(RC[-10]="",,"|n"&R1C23&RC[-10])&IF(RC[-9]="",,"|n"&R1C24&RC[-9])&IF(RC[-8]="",,"|n"&R1C25&RC[-8])&IF(RC[-7]="",,"|n"&R1C26&RC[-7])&IF(RC[-6]="",,"|n"&R1C27&RC[-6])&IF(RC[-5]="",,"|n"&R1C28&RC[-5])&IF(RC[-2]="",,"|n"&RC[-2]) -> 
AG1143: =IF(RC[-26]&RC[-25]&RC[-24]&RC[-23]&RC[-22]&RC[-21]="",,R1C6)&IF(RC[-26]="",,"|n"&R1C7&RC[-26])&IF(RC[-25]="",,"|n"&R1C8&RC[-25])&IF(RC[-24]="",,"|n"&R1C9&RC[-24])&IF(RC[-23]="",,"|n"&R1C10&RC[-23])&IF(RC[-22]="",,"|n"&R1C11&RC[-22])&IF(RC[-21]="",,"|n"&R1C12&RC[-21])&IF(RC[-19]&RC[-18]&RC[-17]&RC[-16]="",,"|n"&R1C13)&IF(RC[-19]="",,"|n"&R1C14&RC[-19])&IF(RC[-18]="",,"|n"&R1C15&RC[-18])&IF(RC[-17]="",,"|n"&R1C16&RC[-17])&IF(RC[-16]="",,"|n"&R1C17&RC[-16])&IF(RC[-15]="",,"|n"&R1C18&RC[-15])&IF(RC[-14]="",,"|n"&R1C19&RC[-14])&IF(RC[-13]="",,"|n"&R1C20&RC[-13])&IF(RC[-12]="",,"|n"&R1C21&RC[-12])&IF(RC[-10]="",,"|n"&R1C23&RC[-10])&IF(RC[-9]="",,"|n"&R1C24&RC[-9])&IF(RC[-8]="",,"|n"&R1C25&RC[-8])&IF(RC[-7]="",,"|n"&R1C26&RC[-7])&IF(RC[-6]="",,"|n"&R1C27&RC[-6])&IF(RC[-5]="",,"|n"&R1C28&RC[-5])&IF(RC[-2]="",,"|n"&RC[-2]) -> 
AG1144: =IF(RC[-26]&RC[-25]&RC[-24]&RC[-23]&RC[-22]&RC[-21]="",,R1C6)&IF(RC[-26]="",,"|n"&R1C7&RC[-26])&IF(RC[-25]="",,"|n"&R1C8&RC[-25])&IF(RC[-24]="",,"|n"&R1C9&RC[-24])&IF(RC[-23]="",,"|n"&R1C10&RC[-23])&IF(RC[-22]="",,"|n"&R1C11&RC[-22])&IF(RC[-21]="",,"|n"&R1C12&RC[-21])&IF(RC[-19]&RC[-18]&RC[-17]&RC[-16]="",,"|n"&R1C13)&IF(RC[-19]="",,"|n"&R1C14&RC[-19])&IF(RC[-18]="",,"|n"&R1C15&RC[-18])&IF(RC[-17]="",,"|n"&R1C16&RC[-17])&IF(RC[-16]="",,"|n"&R1C17&RC[-16])&IF(RC[-15]="",,"|n"&R1C18&RC[-15])&IF(RC[-14]="",,"|n"&R1C19&RC[-14])&IF(RC[-13]="",,"|n"&R1C20&RC[-13])&IF(RC[-12]="",,"|n"&R1C21&RC[-12])&IF(RC[-10]="",,"|n"&R1C23&RC[-10])&IF(RC[-9]="",,"|n"&R1C24&RC[-9])&IF(RC[-8]="",,"|n"&R1C25&RC[-8])&IF(RC[-7]="",,"|n"&R1C26&RC[-7])&IF(RC[-6]="",,"|n"&R1C27&RC[-6])&IF(RC[-5]="",,"|n"&R1C28&RC[-5])&IF(RC[-2]="",,"|n"&RC[-2]) -> 
AG1145: =IF(RC[-26]&RC[-25]&RC[-24]&RC[-23]&RC[-22]&RC[-21]="",,R1C6)&IF(RC[-26]="",,"|n"&R1C7&RC[-26])&IF(RC[-25]="",,"|n"&R1C8&RC[-25])&IF(RC[-24]="",,"|n"&R1C9&RC[-24])&IF(RC[-23]="",,"|n"&R1C10&RC[-23])&IF(RC[-22]="",,"|n"&R1C11&RC[-22])&IF(RC[-21]="",,"|n"&R1C12&RC[-21])&IF(RC[-19]&RC[-18]&RC[-17]&RC[-16]="",,"|n"&R1C13)&IF(RC[-19]="",,"|n"&R1C14&RC[-19])&IF(RC[-18]="",,"|n"&R1C15&RC[-18])&IF(RC[-17]="",,"|n"&R1C16&RC[-17])&IF(RC[-16]="",,"|n"&R1C17&RC[-16])&IF(RC[-15]="",,"|n"&R1C18&RC[-15])&IF(RC[-14]="",,"|n"&R1C19&RC[-14])&IF(RC[-13]="",,"|n"&R1C20&RC[-13])&IF(RC[-12]="",,"|n"&R1C21&RC[-12])&IF(RC[-10]="",,"|n"&R1C23&RC[-10])&IF(RC[-9]="",,"|n"&R1C24&RC[-9])&IF(RC[-8]="",,"|n"&R1C25&RC[-8])&IF(RC[-7]="",,"|n"&R1C26&RC[-7])&IF(RC[-6]="",,"|n"&R1C27&RC[-6])&IF(RC[-5]="",,"|n"&R1C28&RC[-5])&IF(RC[-2]="",,"|n"&RC[-2]) -> 
AG1146: =IF(RC[-26]&RC[-25]&RC[-24]&RC[-23]&RC[-22]&RC[-21]="",,R1C6)&IF(RC[-26]="",,"|n"&R1C7&RC[-26])&IF(RC[-25]="",,"|n"&R1C8&RC[-25])&IF(RC[-24]="",,"|n"&R1C9&RC[-24])&IF(RC[-23]="",,"|n"&R1C10&RC[-23])&IF(RC[-22]="",,"|n"&R1C11&RC[-22])&IF(RC[-21]="",,"|n"&R1C12&RC[-21])&IF(RC[-19]&RC[-18]&RC[-17]&RC[-16]="",,"|n"&R1C13)&IF(RC[-19]="",,"|n"&R1C14&RC[-19])&IF(RC[-18]="",,"|n"&R1C15&RC[-18])&IF(RC[-17]="",,"|n"&R1C16&RC[-17])&IF(RC[-16]="",,"|n"&R1C17&RC[-16])&IF(RC[-15]="",,"|n"&R1C18&RC[-15])&IF(RC[-14]="",,"|n"&R1C19&RC[-14])&IF(RC[-13]="",,"|n"&R1C20&RC[-13])&IF(RC[-12]="",,"|n"&R1C21&RC[-12])&IF(RC[-10]="",,"|n"&R1C23&RC[-10])&IF(RC[-9]="",,"|n"&R1C24&RC[-9])&IF(RC[-8]="",,"|n"&R1C25&RC[-8])&IF(RC[-7]="",,"|n"&R1C26&RC[-7])&IF(RC[-6]="",,"|n"&R1C27&RC[-6])&IF(RC[-5]="",,"|n"&R1C28&RC[-5])&IF(RC[-2]="",,"|n"&RC[-2]) -> 
AG1147: =IF(RC[-26]&RC[-25]&RC[-24]&RC[-23]&RC[-22]&RC[-21]="",,R1C6)&IF(RC[-26]="",,"|n"&R1C7&RC[-26])&IF(RC[-25]="",,"|n"&R1C8&RC[-25])&IF(RC[-24]="",,"|n"&R1C9&RC[-24])&IF(RC[-23]="",,"|n"&R1C10&RC[-23])&IF(RC[-22]="",,"|n"&R1C11&RC[-22])&IF(RC[-21]="",,"|n"&R1C12&RC[-21])&IF(RC[-19]&RC[-18]&RC[-17]&RC[-16]="",,"|n"&R1C13)&IF(RC[-19]="",,"|n"&R1C14&RC[-19])&IF(RC[-18]="",,"|n"&R1C15&RC[-18])&IF(RC[-17]="",,"|n"&R1C16&RC[-17])&IF(RC[-16]="",,"|n"&R1C17&RC[-16])&IF(RC[-15]="",,"|n"&R1C18&RC[-15])&IF(RC[-14]="",,"|n"&R1C19&RC[-14])&IF(RC[-13]="",,"|n"&R1C20&RC[-13])&IF(RC[-12]="",,"|n"&R1C21&RC[-12])&IF(RC[-10]="",,"|n"&R1C23&RC[-10])&IF(RC[-9]="",,"|n"&R1C24&RC[-9])&IF(RC[-8]="",,"|n"&R1C25&RC[-8])&IF(RC[-7]="",,"|n"&R1C26&RC[-7])&IF(RC[-6]="",,"|n"&R1C27&RC[-6])&IF(RC[-5]="",,"|n"&R1C28&RC[-5])&IF(RC[-2]="",,"|n"&RC[-2]) -> 
AG1148: =IF(RC[-26]&RC[-25]&RC[-24]&RC[-23]&RC[-22]&RC[-21]="",,R1C6)&IF(RC[-26]="",,"|n"&R1C7&RC[-26])&IF(RC[-25]="",,"|n"&R1C8&RC[-25])&IF(RC[-24]="",,"|n"&R1C9&RC[-24])&IF(RC[-23]="",,"|n"&R1C10&RC[-23])&IF(RC[-22]="",,"|n"&R1C11&RC[-22])&IF(RC[-21]="",,"|n"&R1C12&RC[-21])&IF(RC[-19]&RC[-18]&RC[-17]&RC[-16]="",,"|n"&R1C13)&IF(RC[-19]="",,"|n"&R1C14&RC[-19])&IF(RC[-18]="",,"|n"&R1C15&RC[-18])&IF(RC[-17]="",,"|n"&R1C16&RC[-17])&IF(RC[-16]="",,"|n"&R1C17&RC[-16])&IF(RC[-15]="",,"|n"&R1C18&RC[-15])&IF(RC[-14]="",,"|n"&R1C19&RC[-14])&IF(RC[-13]="",,"|n"&R1C20&RC[-13])&IF(RC[-12]="",,"|n"&R1C21&RC[-12])&IF(RC[-10]="",,"|n"&R1C23&RC[-10])&IF(RC[-9]="",,"|n"&R1C24&RC[-9])&IF(RC[-8]="",,"|n"&R1C25&RC[-8])&IF(RC[-7]="",,"|n"&R1C26&RC[-7])&IF(RC[-6]="",,"|n"&R1C27&RC[-6])&IF(RC[-5]="",,"|n"&R1C28&RC[-5])&IF(RC[-2]="",,"|n"&RC[-2]) -> 
AG1149: =IF(RC[-26]&RC[-25]&RC[-24]&RC[-23]&RC[-22]&RC[-21]="",,R1C6)&IF(RC[-26]="",,"|n"&R1C7&RC[-26])&IF(RC[-25]="",,"|n"&R1C8&RC[-25])&IF(RC[-24]="",,"|n"&R1C9&RC[-24])&IF(RC[-23]="",,"|n"&R1C10&RC[-23])&IF(RC[-22]="",,"|n"&R1C11&RC[-22])&IF(RC[-21]="",,"|n"&R1C12&RC[-21])&IF(RC[-19]&RC[-18]&RC[-17]&RC[-16]="",,"|n"&R1C13)&IF(RC[-19]="",,"|n"&R1C14&RC[-19])&IF(RC[-18]="",,"|n"&R1C15&RC[-18])&IF(RC[-17]="",,"|n"&R1C16&RC[-17])&IF(RC[-16]="",,"|n"&R1C17&RC[-16])&IF(RC[-15]="",,"|n"&R1C18&RC[-15])&IF(RC[-14]="",,"|n"&R1C19&RC[-14])&IF(RC[-13]="",,"|n"&R1C20&RC[-13])&IF(RC[-12]="",,"|n"&R1C21&RC[-12])&IF(RC[-10]="",,"|n"&R1C23&RC[-10])&IF(RC[-9]="",,"|n"&R1C24&RC[-9])&IF(RC[-8]="",,"|n"&R1C25&RC[-8])&IF(RC[-7]="",,"|n"&R1C26&RC[-7])&IF(RC[-6]="",,"|n"&R1C27&RC[-6])&IF(RC[-5]="",,"|n"&R1C28&RC[-5])&IF(RC[-2]="",,"|n"&RC[-2]) -> 
AG1150: =IF(RC[-26]&RC[-25]&RC[-24]&RC[-23]&RC[-22]&RC[-21]="",,R1C6)&IF(RC[-26]="",,"|n"&R1C7&RC[-26])&IF(RC[-25]="",,"|n"&R1C8&RC[-25])&IF(RC[-24]="",,"|n"&R1C9&RC[-24])&IF(RC[-23]="",,"|n"&R1C10&RC[-23])&IF(RC[-22]="",,"|n"&R1C11&RC[-22])&IF(RC[-21]="",,"|n"&R1C12&RC[-21])&IF(RC[-19]&RC[-18]&RC[-17]&RC[-16]="",,"|n"&R1C13)&IF(RC[-19]="",,"|n"&R1C14&RC[-19])&IF(RC[-18]="",,"|n"&R1C15&RC[-18])&IF(RC[-17]="",,"|n"&R1C16&RC[-17])&IF(RC[-16]="",,"|n"&R1C17&RC[-16])&IF(RC[-15]="",,"|n"&R1C18&RC[-15])&IF(RC[-14]="",,"|n"&R1C19&RC[-14])&IF(RC[-13]="",,"|n"&R1C20&RC[-13])&IF(RC[-12]="",,"|n"&R1C21&RC[-12])&IF(RC[-10]="",,"|n"&R1C23&RC[-10])&IF(RC[-9]="",,"|n"&R1C24&RC[-9])&IF(RC[-8]="",,"|n"&R1C25&RC[-8])&IF(RC[-7]="",,"|n"&R1C26&RC[-7])&IF(RC[-6]="",,"|n"&R1C27&RC[-6])&IF(RC[-5]="",,"|n"&R1C28&RC[-5])&IF(RC[-2]="",,"|n"&RC[-2]) -> 
AG1151: =IF(RC[-26]&RC[-25]&RC[-24]&RC[-23]&RC[-22]&RC[-21]="",,R1C6)&IF(RC[-26]="",,"|n"&R1C7&RC[-26])&IF(RC[-25]="",,"|n"&R1C8&RC[-25])&IF(RC[-24]="",,"|n"&R1C9&RC[-24])&IF(RC[-23]="",,"|n"&R1C10&RC[-23])&IF(RC[-22]="",,"|n"&R1C11&RC[-22])&IF(RC[-21]="",,"|n"&R1C12&RC[-21])&IF(RC[-19]&RC[-18]&RC[-17]&RC[-16]="",,"|n"&R1C13)&IF(RC[-19]="",,"|n"&R1C14&RC[-19])&IF(RC[-18]="",,"|n"&R1C15&RC[-18])&IF(RC[-17]="",,"|n"&R1C16&RC[-17])&IF(RC[-16]="",,"|n"&R1C17&RC[-16])&IF(RC[-15]="",,"|n"&R1C18&RC[-15])&IF(RC[-14]="",,"|n"&R1C19&RC[-14])&IF(RC[-13]="",,"|n"&R1C20&RC[-13])&IF(RC[-12]="",,"|n"&R1C21&RC[-12])&IF(RC[-10]="",,"|n"&R1C23&RC[-10])&IF(RC[-9]="",,"|n"&R1C24&RC[-9])&IF(RC[-8]="",,"|n"&R1C25&RC[-8])&IF(RC[-7]="",,"|n"&R1C26&RC[-7])&IF(RC[-6]="",,"|n"&R1C27&RC[-6])&IF(RC[-5]="",,"|n"&R1C28&RC[-5])&IF(RC[-2]="",,"|n"&RC[-2]) -> 
AG1152: =IF(RC[-26]&RC[-25]&RC[-24]&RC[-23]&RC[-22]&RC[-21]="",,R1C6)&IF(RC[-26]="",,"|n"&R1C7&RC[-26])&IF(RC[-25]="",,"|n"&R1C8&RC[-25])&IF(RC[-24]="",,"|n"&R1C9&RC[-24])&IF(RC[-23]="",,"|n"&R1C10&RC[-23])&IF(RC[-22]="",,"|n"&R1C11&RC[-22])&IF(RC[-21]="",,"|n"&R1C12&RC[-21])&IF(RC[-19]&RC[-18]&RC[-17]&RC[-16]="",,"|n"&R1C13)&IF(RC[-19]="",,"|n"&R1C14&RC[-19])&IF(RC[-18]="",,"|n"&R1C15&RC[-18])&IF(RC[-17]="",,"|n"&R1C16&RC[-17])&IF(RC[-16]="",,"|n"&R1C17&RC[-16])&IF(RC[-15]="",,"|n"&R1C18&RC[-15])&IF(RC[-14]="",,"|n"&R1C19&RC[-14])&IF(RC[-13]="",,"|n"&R1C20&RC[-13])&IF(RC[-12]="",,"|n"&R1C21&RC[-12])&IF(RC[-10]="",,"|n"&R1C23&RC[-10])&IF(RC[-9]="",,"|n"&R1C24&RC[-9])&IF(RC[-8]="",,"|n"&R1C25&RC[-8])&IF(RC[-7]="",,"|n"&R1C26&RC[-7])&IF(RC[-6]="",,"|n"&R1C27&RC[-6])&IF(RC[-5]="",,"|n"&R1C28&RC[-5])&IF(RC[-2]="",,"|n"&RC[-2]) -> 
AG1153: =IF(RC[-26]&RC[-25]&RC[-24]&RC[-23]&RC[-22]&RC[-21]="",,R1C6)&IF(RC[-26]="",,"|n"&R1C7&RC[-26])&IF(RC[-25]="",,"|n"&R1C8&RC[-25])&IF(RC[-24]="",,"|n"&R1C9&RC[-24])&IF(RC[-23]="",,"|n"&R1C10&RC[-23])&IF(RC[-22]="",,"|n"&R1C11&RC[-22])&IF(RC[-21]="",,"|n"&R1C12&RC[-21])&IF(RC[-19]&RC[-18]&RC[-17]&RC[-16]="",,"|n"&R1C13)&IF(RC[-19]="",,"|n"&R1C14&RC[-19])&IF(RC[-18]="",,"|n"&R1C15&RC[-18])&IF(RC[-17]="",,"|n"&R1C16&RC[-17])&IF(RC[-16]="",,"|n"&R1C17&RC[-16])&IF(RC[-15]="",,"|n"&R1C18&RC[-15])&IF(RC[-14]="",,"|n"&R1C19&RC[-14])&IF(RC[-13]="",,"|n"&R1C20&RC[-13])&IF(RC[-12]="",,"|n"&R1C21&RC[-12])&IF(RC[-10]="",,"|n"&R1C23&RC[-10])&IF(RC[-9]="",,"|n"&R1C24&RC[-9])&IF(RC[-8]="",,"|n"&R1C25&RC[-8])&IF(RC[-7]="",,"|n"&R1C26&RC[-7])&IF(RC[-6]="",,"|n"&R1C27&RC[-6])&IF(RC[-5]="",,"|n"&R1C28&RC[-5])&IF(RC[-2]="",,"|n"&RC[-2]) -> 
AG1154: =IF(RC[-26]&RC[-25]&RC[-24]&RC[-23]&RC[-22]&RC[-21]="",,R1C6)&IF(RC[-26]="",,"|n"&R1C7&RC[-26])&IF(RC[-25]="",,"|n"&R1C8&RC[-25])&IF(RC[-24]="",,"|n"&R1C9&RC[-24])&IF(RC[-23]="",,"|n"&R1C10&RC[-23])&IF(RC[-22]="",,"|n"&R1C11&RC[-22])&IF(RC[-21]="",,"|n"&R1C12&RC[-21])&IF(RC[-19]&RC[-18]&RC[-17]&RC[-16]="",,"|n"&R1C13)&IF(RC[-19]="",,"|n"&R1C14&RC[-19])&IF(RC[-18]="",,"|n"&R1C15&RC[-18])&IF(RC[-17]="",,"|n"&R1C16&RC[-17])&IF(RC[-16]="",,"|n"&R1C17&RC[-16])&IF(RC[-15]="",,"|n"&R1C18&RC[-15])&IF(RC[-14]="",,"|n"&R1C19&RC[-14])&IF(RC[-13]="",,"|n"&R1C20&RC[-13])&IF(RC[-12]="",,"|n"&R1C21&RC[-12])&IF(RC[-10]="",,"|n"&R1C23&RC[-10])&IF(RC[-9]="",,"|n"&R1C24&RC[-9])&IF(RC[-8]="",,"|n"&R1C25&RC[-8])&IF(RC[-7]="",,"|n"&R1C26&RC[-7])&IF(RC[-6]="",,"|n"&R1C27&RC[-6])&IF(RC[-5]="",,"|n"&R1C28&RC[-5])&IF(RC[-2]="",,"|n"&RC[-2]) -> 
AG1155: =IF(RC[-26]&RC[-25]&RC[-24]&RC[-23]&RC[-22]&RC[-21]="",,R1C6)&IF(RC[-26]="",,"|n"&R1C7&RC[-26])&IF(RC[-25]="",,"|n"&R1C8&RC[-25])&IF(RC[-24]="",,"|n"&R1C9&RC[-24])&IF(RC[-23]="",,"|n"&R1C10&RC[-23])&IF(RC[-22]="",,"|n"&R1C11&RC[-22])&IF(RC[-21]="",,"|n"&R1C12&RC[-21])&IF(RC[-19]&RC[-18]&RC[-17]&RC[-16]="",,"|n"&R1C13)&IF(RC[-19]="",,"|n"&R1C14&RC[-19])&IF(RC[-18]="",,"|n"&R1C15&RC[-18])&IF(RC[-17]="",,"|n"&R1C16&RC[-17])&IF(RC[-16]="",,"|n"&R1C17&RC[-16])&IF(RC[-15]="",,"|n"&R1C18&RC[-15])&IF(RC[-14]="",,"|n"&R1C19&RC[-14])&IF(RC[-13]="",,"|n"&R1C20&RC[-13])&IF(RC[-12]="",,"|n"&R1C21&RC[-12])&IF(RC[-10]="",,"|n"&R1C23&RC[-10])&IF(RC[-9]="",,"|n"&R1C24&RC[-9])&IF(RC[-8]="",,"|n"&R1C25&RC[-8])&IF(RC[-7]="",,"|n"&R1C26&RC[-7])&IF(RC[-6]="",,"|n"&R1C27&RC[-6])&IF(RC[-5]="",,"|n"&R1C28&RC[-5])&IF(RC[-2]="",,"|n"&RC[-2]) -> 
AG1156: =IF(RC[-26]&RC[-25]&RC[-24]&RC[-23]&RC[-22]&RC[-21]="",,R1C6)&IF(RC[-26]="",,"|n"&R1C7&RC[-26])&IF(RC[-25]="",,"|n"&R1C8&RC[-25])&IF(RC[-24]="",,"|n"&R1C9&RC[-24])&IF(RC[-23]="",,"|n"&R1C10&RC[-23])&IF(RC[-22]="",,"|n"&R1C11&RC[-22])&IF(RC[-21]="",,"|n"&R1C12&RC[-21])&IF(RC[-19]&RC[-18]&RC[-17]&RC[-16]="",,"|n"&R1C13)&IF(RC[-19]="",,"|n"&R1C14&RC[-19])&IF(RC[-18]="",,"|n"&R1C15&RC[-18])&IF(RC[-17]="",,"|n"&R1C16&RC[-17])&IF(RC[-16]="",,"|n"&R1C17&RC[-16])&IF(RC[-15]="",,"|n"&R1C18&RC[-15])&IF(RC[-14]="",,"|n"&R1C19&RC[-14])&IF(RC[-13]="",,"|n"&R1C20&RC[-13])&IF(RC[-12]="",,"|n"&R1C21&RC[-12])&IF(RC[-10]="",,"|n"&R1C23&RC[-10])&IF(RC[-9]="",,"|n"&R1C24&RC[-9])&IF(RC[-8]="",,"|n"&R1C25&RC[-8])&IF(RC[-7]="",,"|n"&R1C26&RC[-7])&IF(RC[-6]="",,"|n"&R1C27&RC[-6])&IF(RC[-5]="",,"|n"&R1C28&RC[-5])&IF(RC[-2]="",,"|n"&RC[-2]) -> 
AG1157: =IF(RC[-26]&RC[-25]&RC[-24]&RC[-23]&RC[-22]&RC[-21]="",,R1C6)&IF(RC[-26]="",,"|n"&R1C7&RC[-26])&IF(RC[-25]="",,"|n"&R1C8&RC[-25])&IF(RC[-24]="",,"|n"&R1C9&RC[-24])&IF(RC[-23]="",,"|n"&R1C10&RC[-23])&IF(RC[-22]="",,"|n"&R1C11&RC[-22])&IF(RC[-21]="",,"|n"&R1C12&RC[-21])&IF(RC[-19]&RC[-18]&RC[-17]&RC[-16]="",,"|n"&R1C13)&IF(RC[-19]="",,"|n"&R1C14&RC[-19])&IF(RC[-18]="",,"|n"&R1C15&RC[-18])&IF(RC[-17]="",,"|n"&R1C16&RC[-17])&IF(RC[-16]="",,"|n"&R1C17&RC[-16])&IF(RC[-15]="",,"|n"&R1C18&RC[-15])&IF(RC[-14]="",,"|n"&R1C19&RC[-14])&IF(RC[-13]="",,"|n"&R1C20&RC[-13])&IF(RC[-12]="",,"|n"&R1C21&RC[-12])&IF(RC[-10]="",,"|n"&R1C23&RC[-10])&IF(RC[-9]="",,"|n"&R1C24&RC[-9])&IF(RC[-8]="",,"|n"&R1C25&RC[-8])&IF(RC[-7]="",,"|n"&R1C26&RC[-7])&IF(RC[-6]="",,"|n"&R1C27&RC[-6])&IF(RC[-5]="",,"|n"&R1C28&RC[-5])&IF(RC[-2]="",,"|n"&RC[-2]) -> 
AG1158: =IF(RC[-26]&RC[-25]&RC[-24]&RC[-23]&RC[-22]&RC[-21]="",,R1C6)&IF(RC[-26]="",,"|n"&R1C7&RC[-26])&IF(RC[-25]="",,"|n"&R1C8&RC[-25])&IF(RC[-24]="",,"|n"&R1C9&RC[-24])&IF(RC[-23]="",,"|n"&R1C10&RC[-23])&IF(RC[-22]="",,"|n"&R1C11&RC[-22])&IF(RC[-21]="",,"|n"&R1C12&RC[-21])&IF(RC[-19]&RC[-18]&RC[-17]&RC[-16]="",,"|n"&R1C13)&IF(RC[-19]="",,"|n"&R1C14&RC[-19])&IF(RC[-18]="",,"|n"&R1C15&RC[-18])&IF(RC[-17]="",,"|n"&R1C16&RC[-17])&IF(RC[-16]="",,"|n"&R1C17&RC[-16])&IF(RC[-15]="",,"|n"&R1C18&RC[-15])&IF(RC[-14]="",,"|n"&R1C19&RC[-14])&IF(RC[-13]="",,"|n"&R1C20&RC[-13])&IF(RC[-12]="",,"|n"&R1C21&RC[-12])&IF(RC[-10]="",,"|n"&R1C23&RC[-10])&IF(RC[-9]="",,"|n"&R1C24&RC[-9])&IF(RC[-8]="",,"|n"&R1C25&RC[-8])&IF(RC[-7]="",,"|n"&R1C26&RC[-7])&IF(RC[-6]="",,"|n"&R1C27&RC[-6])&IF(RC[-5]="",,"|n"&R1C28&RC[-5])&IF(RC[-2]="",,"|n"&RC[-2]) -> 
AG1159: =IF(RC[-26]&RC[-25]&RC[-24]&RC[-23]&RC[-22]&RC[-21]="",,R1C6)&IF(RC[-26]="",,"|n"&R1C7&RC[-26])&IF(RC[-25]="",,"|n"&R1C8&RC[-25])&IF(RC[-24]="",,"|n"&R1C9&RC[-24])&IF(RC[-23]="",,"|n"&R1C10&RC[-23])&IF(RC[-22]="",,"|n"&R1C11&RC[-22])&IF(RC[-21]="",,"|n"&R1C12&RC[-21])&IF(RC[-19]&RC[-18]&RC[-17]&RC[-16]="",,"|n"&R1C13)&IF(RC[-19]="",,"|n"&R1C14&RC[-19])&IF(RC[-18]="",,"|n"&R1C15&RC[-18])&IF(RC[-17]="",,"|n"&R1C16&RC[-17])&IF(RC[-16]="",,"|n"&R1C17&RC[-16])&IF(RC[-15]="",,"|n"&R1C18&RC[-15])&IF(RC[-14]="",,"|n"&R1C19&RC[-14])&IF(RC[-13]="",,"|n"&R1C20&RC[-13])&IF(RC[-12]="",,"|n"&R1C21&RC[-12])&IF(RC[-10]="",,"|n"&R1C23&RC[-10])&IF(RC[-9]="",,"|n"&R1C24&RC[-9])&IF(RC[-8]="",,"|n"&R1C25&RC[-8])&IF(RC[-7]="",,"|n"&R1C26&RC[-7])&IF(RC[-6]="",,"|n"&R1C27&RC[-6])&IF(RC[-5]="",,"|n"&R1C28&RC[-5])&IF(RC[-2]="",,"|n"&RC[-2]) -> 
AG1160: =IF(RC[-26]&RC[-25]&RC[-24]&RC[-23]&RC[-22]&RC[-21]="",,R1C6)&IF(RC[-26]="",,"|n"&R1C7&RC[-26])&IF(RC[-25]="",,"|n"&R1C8&RC[-25])&IF(RC[-24]="",,"|n"&R1C9&RC[-24])&IF(RC[-23]="",,"|n"&R1C10&RC[-23])&IF(RC[-22]="",,"|n"&R1C11&RC[-22])&IF(RC[-21]="",,"|n"&R1C12&RC[-21])&IF(RC[-19]&RC[-18]&RC[-17]&RC[-16]="",,"|n"&R1C13)&IF(RC[-19]="",,"|n"&R1C14&RC[-19])&IF(RC[-18]="",,"|n"&R1C15&RC[-18])&IF(RC[-17]="",,"|n"&R1C16&RC[-17])&IF(RC[-16]="",,"|n"&R1C17&RC[-16])&IF(RC[-15]="",,"|n"&R1C18&RC[-15])&IF(RC[-14]="",,"|n"&R1C19&RC[-14])&IF(RC[-13]="",,"|n"&R1C20&RC[-13])&IF(RC[-12]="",,"|n"&R1C21&RC[-12])&IF(RC[-10]="",,"|n"&R1C23&RC[-10])&IF(RC[-9]="",,"|n"&R1C24&RC[-9])&IF(RC[-8]="",,"|n"&R1C25&RC[-8])&IF(RC[-7]="",,"|n"&R1C26&RC[-7])&IF(RC[-6]="",,"|n"&R1C27&RC[-6])&IF(RC[-5]="",,"|n"&R1C28&RC[-5])&IF(RC[-2]="",,"|n"&RC[-2]) -> 
AG1161: =IF(RC[-26]&RC[-25]&RC[-24]&RC[-23]&RC[-22]&RC[-21]="",,R1C6)&IF(RC[-26]="",,"|n"&R1C7&RC[-26])&IF(RC[-25]="",,"|n"&R1C8&RC[-25])&IF(RC[-24]="",,"|n"&R1C9&RC[-24])&IF(RC[-23]="",,"|n"&R1C10&RC[-23])&IF(RC[-22]="",,"|n"&R1C11&RC[-22])&IF(RC[-21]="",,"|n"&R1C12&RC[-21])&IF(RC[-19]&RC[-18]&RC[-17]&RC[-16]="",,"|n"&R1C13)&IF(RC[-19]="",,"|n"&R1C14&RC[-19])&IF(RC[-18]="",,"|n"&R1C15&RC[-18])&IF(RC[-17]="",,"|n"&R1C16&RC[-17])&IF(RC[-16]="",,"|n"&R1C17&RC[-16])&IF(RC[-15]="",,"|n"&R1C18&RC[-15])&IF(RC[-14]="",,"|n"&R1C19&RC[-14])&IF(RC[-13]="",,"|n"&R1C20&RC[-13])&IF(RC[-12]="",,"|n"&R1C21&RC[-12])&IF(RC[-10]="",,"|n"&R1C23&RC[-10])&IF(RC[-9]="",,"|n"&R1C24&RC[-9])&IF(RC[-8]="",,"|n"&R1C25&RC[-8])&IF(RC[-7]="",,"|n"&R1C26&RC[-7])&IF(RC[-6]="",,"|n"&R1C27&RC[-6])&IF(RC[-5]="",,"|n"&R1C28&RC[-5])&IF(RC[-2]="",,"|n"&RC[-2]) -> 
AG1162: =IF(RC[-26]&RC[-25]&RC[-24]&RC[-23]&RC[-22]&RC[-21]="",,R1C6)&IF(RC[-26]="",,"|n"&R1C7&RC[-26])&IF(RC[-25]="",,"|n"&R1C8&RC[-25])&IF(RC[-24]="",,"|n"&R1C9&RC[-24])&IF(RC[-23]="",,"|n"&R1C10&RC[-23])&IF(RC[-22]="",,"|n"&R1C11&RC[-22])&IF(RC[-21]="",,"|n"&R1C12&RC[-21])&IF(RC[-19]&RC[-18]&RC[-17]&RC[-16]="",,"|n"&R1C13)&IF(RC[-19]="",,"|n"&R1C14&RC[-19])&IF(RC[-18]="",,"|n"&R1C15&RC[-18])&IF(RC[-17]="",,"|n"&R1C16&RC[-17])&IF(RC[-16]="",,"|n"&R1C17&RC[-16])&IF(RC[-15]="",,"|n"&R1C18&RC[-15])&IF(RC[-14]="",,"|n"&R1C19&RC[-14])&IF(RC[-13]="",,"|n"&R1C20&RC[-13])&IF(RC[-12]="",,"|n"&R1C21&RC[-12])&IF(RC[-10]="",,"|n"&R1C23&RC[-10])&IF(RC[-9]="",,"|n"&R1C24&RC[-9])&IF(RC[-8]="",,"|n"&R1C25&RC[-8])&IF(RC[-7]="",,"|n"&R1C26&RC[-7])&IF(RC[-6]="",,"|n"&R1C27&RC[-6])&IF(RC[-5]="",,"|n"&R1C28&RC[-5])&IF(RC[-2]="",,"|n"&RC[-2]) -> 
AG1163: =IF(RC[-26]&RC[-25]&RC[-24]&RC[-23]&RC[-22]&RC[-21]="",,R1C6)&IF(RC[-26]="",,"|n"&R1C7&RC[-26])&IF(RC[-25]="",,"|n"&R1C8&RC[-25])&IF(RC[-24]="",,"|n"&R1C9&RC[-24])&IF(RC[-23]="",,"|n"&R1C10&RC[-23])&IF(RC[-22]="",,"|n"&R1C11&RC[-22])&IF(RC[-21]="",,"|n"&R1C12&RC[-21])&IF(RC[-19]&RC[-18]&RC[-17]&RC[-16]="",,"|n"&R1C13)&IF(RC[-19]="",,"|n"&R1C14&RC[-19])&IF(RC[-18]="",,"|n"&R1C15&RC[-18])&IF(RC[-17]="",,"|n"&R1C16&RC[-17])&IF(RC[-16]="",,"|n"&R1C17&RC[-16])&IF(RC[-15]="",,"|n"&R1C18&RC[-15])&IF(RC[-14]="",,"|n"&R1C19&RC[-14])&IF(RC[-13]="",,"|n"&R1C20&RC[-13])&IF(RC[-12]="",,"|n"&R1C21&RC[-12])&IF(RC[-10]="",,"|n"&R1C23&RC[-10])&IF(RC[-9]="",,"|n"&R1C24&RC[-9])&IF(RC[-8]="",,"|n"&R1C25&RC[-8])&IF(RC[-7]="",,"|n"&R1C26&RC[-7])&IF(RC[-6]="",,"|n"&R1C27&RC[-6])&IF(RC[-5]="",,"|n"&R1C28&RC[-5])&IF(RC[-2]="",,"|n"&RC[-2]) -> 
AG1164: =IF(RC[-26]&RC[-25]&RC[-24]&RC[-23]&RC[-22]&RC[-21]="",,R1C6)&IF(RC[-26]="",,"|n"&R1C7&RC[-26])&IF(RC[-25]="",,"|n"&R1C8&RC[-25])&IF(RC[-24]="",,"|n"&R1C9&RC[-24])&IF(RC[-23]="",,"|n"&R1C10&RC[-23])&IF(RC[-22]="",,"|n"&R1C11&RC[-22])&IF(RC[-21]="",,"|n"&R1C12&RC[-21])&IF(RC[-19]&RC[-18]&RC[-17]&RC[-16]="",,"|n"&R1C13)&IF(RC[-19]="",,"|n"&R1C14&RC[-19])&IF(RC[-18]="",,"|n"&R1C15&RC[-18])&IF(RC[-17]="",,"|n"&R1C16&RC[-17])&IF(RC[-16]="",,"|n"&R1C17&RC[-16])&IF(RC[-15]="",,"|n"&R1C18&RC[-15])&IF(RC[-14]="",,"|n"&R1C19&RC[-14])&IF(RC[-13]="",,"|n"&R1C20&RC[-13])&IF(RC[-12]="",,"|n"&R1C21&RC[-12])&IF(RC[-10]="",,"|n"&R1C23&RC[-10])&IF(RC[-9]="",,"|n"&R1C24&RC[-9])&IF(RC[-8]="",,"|n"&R1C25&RC[-8])&IF(RC[-7]="",,"|n"&R1C26&RC[-7])&IF(RC[-6]="",,"|n"&R1C27&RC[-6])&IF(RC[-5]="",,"|n"&R1C28&RC[-5])&IF(RC[-2]="",,"|n"&RC[-2]) -> 
AG1165: =IF(RC[-26]&RC[-25]&RC[-24]&RC[-23]&RC[-22]&RC[-21]="",,R1C6)&IF(RC[-26]="",,"|n"&R1C7&RC[-26])&IF(RC[-25]="",,"|n"&R1C8&RC[-25])&IF(RC[-24]="",,"|n"&R1C9&RC[-24])&IF(RC[-23]="",,"|n"&R1C10&RC[-23])&IF(RC[-22]="",,"|n"&R1C11&RC[-22])&IF(RC[-21]="",,"|n"&R1C12&RC[-21])&IF(RC[-19]&RC[-18]&RC[-17]&RC[-16]="",,"|n"&R1C13)&IF(RC[-19]="",,"|n"&R1C14&RC[-19])&IF(RC[-18]="",,"|n"&R1C15&RC[-18])&IF(RC[-17]="",,"|n"&R1C16&RC[-17])&IF(RC[-16]="",,"|n"&R1C17&RC[-16])&IF(RC[-15]="",,"|n"&R1C18&RC[-15])&IF(RC[-14]="",,"|n"&R1C19&RC[-14])&IF(RC[-13]="",,"|n"&R1C20&RC[-13])&IF(RC[-12]="",,"|n"&R1C21&RC[-12])&IF(RC[-10]="",,"|n"&R1C23&RC[-10])&IF(RC[-9]="",,"|n"&R1C24&RC[-9])&IF(RC[-8]="",,"|n"&R1C25&RC[-8])&IF(RC[-7]="",,"|n"&R1C26&RC[-7])&IF(RC[-6]="",,"|n"&R1C27&RC[-6])&IF(RC[-5]="",,"|n"&R1C28&RC[-5])&IF(RC[-2]="",,"|n"&RC[-2]) -> 
AG1166: =IF(RC[-26]&RC[-25]&RC[-24]&RC[-23]&RC[-22]&RC[-21]="",,R1C6)&IF(RC[-26]="",,"|n"&R1C7&RC[-26])&IF(RC[-25]="",,"|n"&R1C8&RC[-25])&IF(RC[-24]="",,"|n"&R1C9&RC[-24])&IF(RC[-23]="",,"|n"&R1C10&RC[-23])&IF(RC[-22]="",,"|n"&R1C11&RC[-22])&IF(RC[-21]="",,"|n"&R1C12&RC[-21])&IF(RC[-19]&RC[-18]&RC[-17]&RC[-16]="",,"|n"&R1C13)&IF(RC[-19]="",,"|n"&R1C14&RC[-19])&IF(RC[-18]="",,"|n"&R1C15&RC[-18])&IF(RC[-17]="",,"|n"&R1C16&RC[-17])&IF(RC[-16]="",,"|n"&R1C17&RC[-16])&IF(RC[-15]="",,"|n"&R1C18&RC[-15])&IF(RC[-14]="",,"|n"&R1C19&RC[-14])&IF(RC[-13]="",,"|n"&R1C20&RC[-13])&IF(RC[-12]="",,"|n"&R1C21&RC[-12])&IF(RC[-10]="",,"|n"&R1C23&RC[-10])&IF(RC[-9]="",,"|n"&R1C24&RC[-9])&IF(RC[-8]="",,"|n"&R1C25&RC[-8])&IF(RC[-7]="",,"|n"&R1C26&RC[-7])&IF(RC[-6]="",,"|n"&R1C27&RC[-6])&IF(RC[-5]="",,"|n"&R1C28&RC[-5])&IF(RC[-2]="",,"|n"&RC[-2]) -> 
AG1167: =IF(RC[-26]&RC[-25]&RC[-24]&RC[-23]&RC[-22]&RC[-21]="",,R1C6)&IF(RC[-26]="",,"|n"&R1C7&RC[-26])&IF(RC[-25]="",,"|n"&R1C8&RC[-25])&IF(RC[-24]="",,"|n"&R1C9&RC[-24])&IF(RC[-23]="",,"|n"&R1C10&RC[-23])&IF(RC[-22]="",,"|n"&R1C11&RC[-22])&IF(RC[-21]="",,"|n"&R1C12&RC[-21])&IF(RC[-19]&RC[-18]&RC[-17]&RC[-16]="",,"|n"&R1C13)&IF(RC[-19]="",,"|n"&R1C14&RC[-19])&IF(RC[-18]="",,"|n"&R1C15&RC[-18])&IF(RC[-17]="",,"|n"&R1C16&RC[-17])&IF(RC[-16]="",,"|n"&R1C17&RC[-16])&IF(RC[-15]="",,"|n"&R1C18&RC[-15])&IF(RC[-14]="",,"|n"&R1C19&RC[-14])&IF(RC[-13]="",,"|n"&R1C20&RC[-13])&IF(RC[-12]="",,"|n"&R1C21&RC[-12])&IF(RC[-10]="",,"|n"&R1C23&RC[-10])&IF(RC[-9]="",,"|n"&R1C24&RC[-9])&IF(RC[-8]="",,"|n"&R1C25&RC[-8])&IF(RC[-7]="",,"|n"&R1C26&RC[-7])&IF(RC[-6]="",,"|n"&R1C27&RC[-6])&IF(RC[-5]="",,"|n"&R1C28&RC[-5])&IF(RC[-2]="",,"|n"&RC[-2]) -> 
AG1168: =IF(RC[-26]&RC[-25]&RC[-24]&RC[-23]&RC[-22]&RC[-21]="",,R1C6)&IF(RC[-26]="",,"|n"&R1C7&RC[-26])&IF(RC[-25]="",,"|n"&R1C8&RC[-25])&IF(RC[-24]="",,"|n"&R1C9&RC[-24])&IF(RC[-23]="",,"|n"&R1C10&RC[-23])&IF(RC[-22]="",,"|n"&R1C11&RC[-22])&IF(RC[-21]="",,"|n"&R1C12&RC[-21])&IF(RC[-19]&RC[-18]&RC[-17]&RC[-16]="",,"|n"&R1C13)&IF(RC[-19]="",,"|n"&R1C14&RC[-19])&IF(RC[-18]="",,"|n"&R1C15&RC[-18])&IF(RC[-17]="",,"|n"&R1C16&RC[-17])&IF(RC[-16]="",,"|n"&R1C17&RC[-16])&IF(RC[-15]="",,"|n"&R1C18&RC[-15])&IF(RC[-14]="",,"|n"&R1C19&RC[-14])&IF(RC[-13]="",,"|n"&R1C20&RC[-13])&IF(RC[-12]="",,"|n"&R1C21&RC[-12])&IF(RC[-10]="",,"|n"&R1C23&RC[-10])&IF(RC[-9]="",,"|n"&R1C24&RC[-9])&IF(RC[-8]="",,"|n"&R1C25&RC[-8])&IF(RC[-7]="",,"|n"&R1C26&RC[-7])&IF(RC[-6]="",,"|n"&R1C27&RC[-6])&IF(RC[-5]="",,"|n"&R1C28&RC[-5])&IF(RC[-2]="",,"|n"&RC[-2]) -> 
AG1169: =IF(RC[-26]&RC[-25]&RC[-24]&RC[-23]&RC[-22]&RC[-21]="",,R1C6)&IF(RC[-26]="",,"|n"&R1C7&RC[-26])&IF(RC[-25]="",,"|n"&R1C8&RC[-25])&IF(RC[-24]="",,"|n"&R1C9&RC[-24])&IF(RC[-23]="",,"|n"&R1C10&RC[-23])&IF(RC[-22]="",,"|n"&R1C11&RC[-22])&IF(RC[-21]="",,"|n"&R1C12&RC[-21])&IF(RC[-19]&RC[-18]&RC[-17]&RC[-16]="",,"|n"&R1C13)&IF(RC[-19]="",,"|n"&R1C14&RC[-19])&IF(RC[-18]="",,"|n"&R1C15&RC[-18])&IF(RC[-17]="",,"|n"&R1C16&RC[-17])&IF(RC[-16]="",,"|n"&R1C17&RC[-16])&IF(RC[-15]="",,"|n"&R1C18&RC[-15])&IF(RC[-14]="",,"|n"&R1C19&RC[-14])&IF(RC[-13]="",,"|n"&R1C20&RC[-13])&IF(RC[-12]="",,"|n"&R1C21&RC[-12])&IF(RC[-10]="",,"|n"&R1C23&RC[-10])&IF(RC[-9]="",,"|n"&R1C24&RC[-9])&IF(RC[-8]="",,"|n"&R1C25&RC[-8])&IF(RC[-7]="",,"|n"&R1C26&RC[-7])&IF(RC[-6]="",,"|n"&R1C27&RC[-6])&IF(RC[-5]="",,"|n"&R1C28&RC[-5])&IF(RC[-2]="",,"|n"&RC[-2]) -> 
AG1170: =IF(RC[-26]&RC[-25]&RC[-24]&RC[-23]&RC[-22]&RC[-21]="",,R1C6)&IF(RC[-26]="",,"|n"&R1C7&RC[-26])&IF(RC[-25]="",,"|n"&R1C8&RC[-25])&IF(RC[-24]="",,"|n"&R1C9&RC[-24])&IF(RC[-23]="",,"|n"&R1C10&RC[-23])&IF(RC[-22]="",,"|n"&R1C11&RC[-22])&IF(RC[-21]="",,"|n"&R1C12&RC[-21])&IF(RC[-19]&RC[-18]&RC[-17]&RC[-16]="",,"|n"&R1C13)&IF(RC[-19]="",,"|n"&R1C14&RC[-19])&IF(RC[-18]="",,"|n"&R1C15&RC[-18])&IF(RC[-17]="",,"|n"&R1C16&RC[-17])&IF(RC[-16]="",,"|n"&R1C17&RC[-16])&IF(RC[-15]="",,"|n"&R1C18&RC[-15])&IF(RC[-14]="",,"|n"&R1C19&RC[-14])&IF(RC[-13]="",,"|n"&R1C20&RC[-13])&IF(RC[-12]="",,"|n"&R1C21&RC[-12])&IF(RC[-10]="",,"|n"&R1C23&RC[-10])&IF(RC[-9]="",,"|n"&R1C24&RC[-9])&IF(RC[-8]="",,"|n"&R1C25&RC[-8])&IF(RC[-7]="",,"|n"&R1C26&RC[-7])&IF(RC[-6]="",,"|n"&R1C27&RC[-6])&IF(RC[-5]="",,"|n"&R1C28&RC[-5])&IF(RC[-2]="",,"|n"&RC[-2]) -> 
AG1171: =IF(RC[-26]&RC[-25]&RC[-24]&RC[-23]&RC[-22]&RC[-21]="",,R1C6)&IF(RC[-26]="",,"|n"&R1C7&RC[-26])&IF(RC[-25]="",,"|n"&R1C8&RC[-25])&IF(RC[-24]="",,"|n"&R1C9&RC[-24])&IF(RC[-23]="",,"|n"&R1C10&RC[-23])&IF(RC[-22]="",,"|n"&R1C11&RC[-22])&IF(RC[-21]="",,"|n"&R1C12&RC[-21])&IF(RC[-19]&RC[-18]&RC[-17]&RC[-16]="",,"|n"&R1C13)&IF(RC[-19]="",,"|n"&R1C14&RC[-19])&IF(RC[-18]="",,"|n"&R1C15&RC[-18])&IF(RC[-17]="",,"|n"&R1C16&RC[-17])&IF(RC[-16]="",,"|n"&R1C17&RC[-16])&IF(RC[-15]="",,"|n"&R1C18&RC[-15])&IF(RC[-14]="",,"|n"&R1C19&RC[-14])&IF(RC[-13]="",,"|n"&R1C20&RC[-13])&IF(RC[-12]="",,"|n"&R1C21&RC[-12])&IF(RC[-10]="",,"|n"&R1C23&RC[-10])&IF(RC[-9]="",,"|n"&R1C24&RC[-9])&IF(RC[-8]="",,"|n"&R1C25&RC[-8])&IF(RC[-7]="",,"|n"&R1C26&RC[-7])&IF(RC[-6]="",,"|n"&R1C27&RC[-6])&IF(RC[-5]="",,"|n"&R1C28&RC[-5])&IF(RC[-2]="",,"|n"&RC[-2]) -> 
AG1172: =IF(RC[-26]&RC[-25]&RC[-24]&RC[-23]&RC[-22]&RC[-21]="",,R1C6)&IF(RC[-26]="",,"|n"&R1C7&RC[-26])&IF(RC[-25]="",,"|n"&R1C8&RC[-25])&IF(RC[-24]="",,"|n"&R1C9&RC[-24])&IF(RC[-23]="",,"|n"&R1C10&RC[-23])&IF(RC[-22]="",,"|n"&R1C11&RC[-22])&IF(RC[-21]="",,"|n"&R1C12&RC[-21])&IF(RC[-19]&RC[-18]&RC[-17]&RC[-16]="",,"|n"&R1C13)&IF(RC[-19]="",,"|n"&R1C14&RC[-19])&IF(RC[-18]="",,"|n"&R1C15&RC[-18])&IF(RC[-17]="",,"|n"&R1C16&RC[-17])&IF(RC[-16]="",,"|n"&R1C17&RC[-16])&IF(RC[-15]="",,"|n"&R1C18&RC[-15])&IF(RC[-14]="",,"|n"&R1C19&RC[-14])&IF(RC[-13]="",,"|n"&R1C20&RC[-13])&IF(RC[-12]="",,"|n"&R1C21&RC[-12])&IF(RC[-10]="",,"|n"&R1C23&RC[-10])&IF(RC[-9]="",,"|n"&R1C24&RC[-9])&IF(RC[-8]="",,"|n"&R1C25&RC[-8])&IF(RC[-7]="",,"|n"&R1C26&RC[-7])&IF(RC[-6]="",,"|n"&R1C27&RC[-6])&IF(RC[-5]="",,"|n"&R1C28&RC[-5])&IF(RC[-2]="",,"|n"&RC[-2]) -> 
AG1173: =IF(RC[-26]&RC[-25]&RC[-24]&RC[-23]&RC[-22]&RC[-21]="",,R1C6)&IF(RC[-26]="",,"|n"&R1C7&RC[-26])&IF(RC[-25]="",,"|n"&R1C8&RC[-25])&IF(RC[-24]="",,"|n"&R1C9&RC[-24])&IF(RC[-23]="",,"|n"&R1C10&RC[-23])&IF(RC[-22]="",,"|n"&R1C11&RC[-22])&IF(RC[-21]="",,"|n"&R1C12&RC[-21])&IF(RC[-19]&RC[-18]&RC[-17]&RC[-16]="",,"|n"&R1C13)&IF(RC[-19]="",,"|n"&R1C14&RC[-19])&IF(RC[-18]="",,"|n"&R1C15&RC[-18])&IF(RC[-17]="",,"|n"&R1C16&RC[-17])&IF(RC[-16]="",,"|n"&R1C17&RC[-16])&IF(RC[-15]="",,"|n"&R1C18&RC[-15])&IF(RC[-14]="",,"|n"&R1C19&RC[-14])&IF(RC[-13]="",,"|n"&R1C20&RC[-13])&IF(RC[-12]="",,"|n"&R1C21&RC[-12])&IF(RC[-10]="",,"|n"&R1C23&RC[-10])&IF(RC[-9]="",,"|n"&R1C24&RC[-9])&IF(RC[-8]="",,"|n"&R1C25&RC[-8])&IF(RC[-7]="",,"|n"&R1C26&RC[-7])&IF(RC[-6]="",,"|n"&R1C27&RC[-6])&IF(RC[-5]="",,"|n"&R1C28&RC[-5])&IF(RC[-2]="",,"|n"&RC[-2]) -> 
AG1174: =IF(RC[-26]&RC[-25]&RC[-24]&RC[-23]&RC[-22]&RC[-21]="",,R1C6)&IF(RC[-26]="",,"|n"&R1C7&RC[-26])&IF(RC[-25]="",,"|n"&R1C8&RC[-25])&IF(RC[-24]="",,"|n"&R1C9&RC[-24])&IF(RC[-23]="",,"|n"&R1C10&RC[-23])&IF(RC[-22]="",,"|n"&R1C11&RC[-22])&IF(RC[-21]="",,"|n"&R1C12&RC[-21])&IF(RC[-19]&RC[-18]&RC[-17]&RC[-16]="",,"|n"&R1C13)&IF(RC[-19]="",,"|n"&R1C14&RC[-19])&IF(RC[-18]="",,"|n"&R1C15&RC[-18])&IF(RC[-17]="",,"|n"&R1C16&RC[-17])&IF(RC[-16]="",,"|n"&R1C17&RC[-16])&IF(RC[-15]="",,"|n"&R1C18&RC[-15])&IF(RC[-14]="",,"|n"&R1C19&RC[-14])&IF(RC[-13]="",,"|n"&R1C20&RC[-13])&IF(RC[-12]="",,"|n"&R1C21&RC[-12])&IF(RC[-10]="",,"|n"&R1C23&RC[-10])&IF(RC[-9]="",,"|n"&R1C24&RC[-9])&IF(RC[-8]="",,"|n"&R1C25&RC[-8])&IF(RC[-7]="",,"|n"&R1C26&RC[-7])&IF(RC[-6]="",,"|n"&R1C27&RC[-6])&IF(RC[-5]="",,"|n"&R1C28&RC[-5])&IF(RC[-2]="",,"|n"&RC[-2]) -> 
AG1175: =IF(RC[-26]&RC[-25]&RC[-24]&RC[-23]&RC[-22]&RC[-21]="",,R1C6)&IF(RC[-26]="",,"|n"&R1C7&RC[-26])&IF(RC[-25]="",,"|n"&R1C8&RC[-25])&IF(RC[-24]="",,"|n"&R1C9&RC[-24])&IF(RC[-23]="",,"|n"&R1C10&RC[-23])&IF(RC[-22]="",,"|n"&R1C11&RC[-22])&IF(RC[-21]="",,"|n"&R1C12&RC[-21])&IF(RC[-19]&RC[-18]&RC[-17]&RC[-16]="",,"|n"&R1C13)&IF(RC[-19]="",,"|n"&R1C14&RC[-19])&IF(RC[-18]="",,"|n"&R1C15&RC[-18])&IF(RC[-17]="",,"|n"&R1C16&RC[-17])&IF(RC[-16]="",,"|n"&R1C17&RC[-16])&IF(RC[-15]="",,"|n"&R1C18&RC[-15])&IF(RC[-14]="",,"|n"&R1C19&RC[-14])&IF(RC[-13]="",,"|n"&R1C20&RC[-13])&IF(RC[-12]="",,"|n"&R1C21&RC[-12])&IF(RC[-10]="",,"|n"&R1C23&RC[-10])&IF(RC[-9]="",,"|n"&R1C24&RC[-9])&IF(RC[-8]="",,"|n"&R1C25&RC[-8])&IF(RC[-7]="",,"|n"&R1C26&RC[-7])&IF(RC[-6]="",,"|n"&R1C27&RC[-6])&IF(RC[-5]="",,"|n"&R1C28&RC[-5])&IF(RC[-2]="",,"|n"&RC[-2]) -> 
AG1176: =IF(RC[-26]&RC[-25]&RC[-24]&RC[-23]&RC[-22]&RC[-21]="",,R1C6)&IF(RC[-26]="",,"|n"&R1C7&RC[-26])&IF(RC[-25]="",,"|n"&R1C8&RC[-25])&IF(RC[-24]="",,"|n"&R1C9&RC[-24])&IF(RC[-23]="",,"|n"&R1C10&RC[-23])&IF(RC[-22]="",,"|n"&R1C11&RC[-22])&IF(RC[-21]="",,"|n"&R1C12&RC[-21])&IF(RC[-19]&RC[-18]&RC[-17]&RC[-16]="",,"|n"&R1C13)&IF(RC[-19]="",,"|n"&R1C14&RC[-19])&IF(RC[-18]="",,"|n"&R1C15&RC[-18])&IF(RC[-17]="",,"|n"&R1C16&RC[-17])&IF(RC[-16]="",,"|n"&R1C17&RC[-16])&IF(RC[-15]="",,"|n"&R1C18&RC[-15])&IF(RC[-14]="",,"|n"&R1C19&RC[-14])&IF(RC[-13]="",,"|n"&R1C20&RC[-13])&IF(RC[-12]="",,"|n"&R1C21&RC[-12])&IF(RC[-10]="",,"|n"&R1C23&RC[-10])&IF(RC[-9]="",,"|n"&R1C24&RC[-9])&IF(RC[-8]="",,"|n"&R1C25&RC[-8])&IF(RC[-7]="",,"|n"&R1C26&RC[-7])&IF(RC[-6]="",,"|n"&R1C27&RC[-6])&IF(RC[-5]="",,"|n"&R1C28&RC[-5])&IF(RC[-2]="",,"|n"&RC[-2]) -> 
AG1177: =IF(RC[-26]&RC[-25]&RC[-24]&RC[-23]&RC[-22]&RC[-21]="",,R1C6)&IF(RC[-26]="",,"|n"&R1C7&RC[-26])&IF(RC[-25]="",,"|n"&R1C8&RC[-25])&IF(RC[-24]="",,"|n"&R1C9&RC[-24])&IF(RC[-23]="",,"|n"&R1C10&RC[-23])&IF(RC[-22]="",,"|n"&R1C11&RC[-22])&IF(RC[-21]="",,"|n"&R1C12&RC[-21])&IF(RC[-19]&RC[-18]&RC[-17]&RC[-16]="",,"|n"&R1C13)&IF(RC[-19]="",,"|n"&R1C14&RC[-19])&IF(RC[-18]="",,"|n"&R1C15&RC[-18])&IF(RC[-17]="",,"|n"&R1C16&RC[-17])&IF(RC[-16]="",,"|n"&R1C17&RC[-16])&IF(RC[-15]="",,"|n"&R1C18&RC[-15])&IF(RC[-14]="",,"|n"&R1C19&RC[-14])&IF(RC[-13]="",,"|n"&R1C20&RC[-13])&IF(RC[-12]="",,"|n"&R1C21&RC[-12])&IF(RC[-10]="",,"|n"&R1C23&RC[-10])&IF(RC[-9]="",,"|n"&R1C24&RC[-9])&IF(RC[-8]="",,"|n"&R1C25&RC[-8])&IF(RC[-7]="",,"|n"&R1C26&RC[-7])&IF(RC[-6]="",,"|n"&R1C27&RC[-6])&IF(RC[-5]="",,"|n"&R1C28&RC[-5])&IF(RC[-2]="",,"|n"&RC[-2]) -> 
AG1178: =IF(RC[-26]&RC[-25]&RC[-24]&RC[-23]&RC[-22]&RC[-21]="",,R1C6)&IF(RC[-26]="",,"|n"&R1C7&RC[-26])&IF(RC[-25]="",,"|n"&R1C8&RC[-25])&IF(RC[-24]="",,"|n"&R1C9&RC[-24])&IF(RC[-23]="",,"|n"&R1C10&RC[-23])&IF(RC[-22]="",,"|n"&R1C11&RC[-22])&IF(RC[-21]="",,"|n"&R1C12&RC[-21])&IF(RC[-19]&RC[-18]&RC[-17]&RC[-16]="",,"|n"&R1C13)&IF(RC[-19]="",,"|n"&R1C14&RC[-19])&IF(RC[-18]="",,"|n"&R1C15&RC[-18])&IF(RC[-17]="",,"|n"&R1C16&RC[-17])&IF(RC[-16]="",,"|n"&R1C17&RC[-16])&IF(RC[-15]="",,"|n"&R1C18&RC[-15])&IF(RC[-14]="",,"|n"&R1C19&RC[-14])&IF(RC[-13]="",,"|n"&R1C20&RC[-13])&IF(RC[-12]="",,"|n"&R1C21&RC[-12])&IF(RC[-10]="",,"|n"&R1C23&RC[-10])&IF(RC[-9]="",,"|n"&R1C24&RC[-9])&IF(RC[-8]="",,"|n"&R1C25&RC[-8])&IF(RC[-7]="",,"|n"&R1C26&RC[-7])&IF(RC[-6]="",,"|n"&R1C27&RC[-6])&IF(RC[-5]="",,"|n"&R1C28&RC[-5])&IF(RC[-2]="",,"|n"&RC[-2]) -> 
AG1179: =IF(RC[-26]&RC[-25]&RC[-24]&RC[-23]&RC[-22]&RC[-21]="",,R1C6)&IF(RC[-26]="",,"|n"&R1C7&RC[-26])&IF(RC[-25]="",,"|n"&R1C8&RC[-25])&IF(RC[-24]="",,"|n"&R1C9&RC[-24])&IF(RC[-23]="",,"|n"&R1C10&RC[-23])&IF(RC[-22]="",,"|n"&R1C11&RC[-22])&IF(RC[-21]="",,"|n"&R1C12&RC[-21])&IF(RC[-19]&RC[-18]&RC[-17]&RC[-16]="",,"|n"&R1C13)&IF(RC[-19]="",,"|n"&R1C14&RC[-19])&IF(RC[-18]="",,"|n"&R1C15&RC[-18])&IF(RC[-17]="",,"|n"&R1C16&RC[-17])&IF(RC[-16]="",,"|n"&R1C17&RC[-16])&IF(RC[-15]="",,"|n"&R1C18&RC[-15])&IF(RC[-14]="",,"|n"&R1C19&RC[-14])&IF(RC[-13]="",,"|n"&R1C20&RC[-13])&IF(RC[-12]="",,"|n"&R1C21&RC[-12])&IF(RC[-10]="",,"|n"&R1C23&RC[-10])&IF(RC[-9]="",,"|n"&R1C24&RC[-9])&IF(RC[-8]="",,"|n"&R1C25&RC[-8])&IF(RC[-7]="",,"|n"&R1C26&RC[-7])&IF(RC[-6]="",,"|n"&R1C27&RC[-6])&IF(RC[-5]="",,"|n"&R1C28&RC[-5])&IF(RC[-2]="",,"|n"&RC[-2]) -> 
AG1180: =IF(RC[-26]&RC[-25]&RC[-24]&RC[-23]&RC[-22]&RC[-21]="",,R1C6)&IF(RC[-26]="",,"|n"&R1C7&RC[-26])&IF(RC[-25]="",,"|n"&R1C8&RC[-25])&IF(RC[-24]="",,"|n"&R1C9&RC[-24])&IF(RC[-23]="",,"|n"&R1C10&RC[-23])&IF(RC[-22]="",,"|n"&R1C11&RC[-22])&IF(RC[-21]="",,"|n"&R1C12&RC[-21])&IF(RC[-19]&RC[-18]&RC[-17]&RC[-16]="",,"|n"&R1C13)&IF(RC[-19]="",,"|n"&R1C14&RC[-19])&IF(RC[-18]="",,"|n"&R1C15&RC[-18])&IF(RC[-17]="",,"|n"&R1C16&RC[-17])&IF(RC[-16]="",,"|n"&R1C17&RC[-16])&IF(RC[-15]="",,"|n"&R1C18&RC[-15])&IF(RC[-14]="",,"|n"&R1C19&RC[-14])&IF(RC[-13]="",,"|n"&R1C20&RC[-13])&IF(RC[-12]="",,"|n"&R1C21&RC[-12])&IF(RC[-10]="",,"|n"&R1C23&RC[-10])&IF(RC[-9]="",,"|n"&R1C24&RC[-9])&IF(RC[-8]="",,"|n"&R1C25&RC[-8])&IF(RC[-7]="",,"|n"&R1C26&RC[-7])&IF(RC[-6]="",,"|n"&R1C27&RC[-6])&IF(RC[-5]="",,"|n"&R1C28&RC[-5])&IF(RC[-2]="",,"|n"&RC[-2]) -> 
AG1181: =IF(RC[-26]&RC[-25]&RC[-24]&RC[-23]&RC[-22]&RC[-21]="",,R1C6)&IF(RC[-26]="",,"|n"&R1C7&RC[-26])&IF(RC[-25]="",,"|n"&R1C8&RC[-25])&IF(RC[-24]="",,"|n"&R1C9&RC[-24])&IF(RC[-23]="",,"|n"&R1C10&RC[-23])&IF(RC[-22]="",,"|n"&R1C11&RC[-22])&IF(RC[-21]="",,"|n"&R1C12&RC[-21])&IF(RC[-19]&RC[-18]&RC[-17]&RC[-16]="",,"|n"&R1C13)&IF(RC[-19]="",,"|n"&R1C14&RC[-19])&IF(RC[-18]="",,"|n"&R1C15&RC[-18])&IF(RC[-17]="",,"|n"&R1C16&RC[-17])&IF(RC[-16]="",,"|n"&R1C17&RC[-16])&IF(RC[-15]="",,"|n"&R1C18&RC[-15])&IF(RC[-14]="",,"|n"&R1C19&RC[-14])&IF(RC[-13]="",,"|n"&R1C20&RC[-13])&IF(RC[-12]="",,"|n"&R1C21&RC[-12])&IF(RC[-10]="",,"|n"&R1C23&RC[-10])&IF(RC[-9]="",,"|n"&R1C24&RC[-9])&IF(RC[-8]="",,"|n"&R1C25&RC[-8])&IF(RC[-7]="",,"|n"&R1C26&RC[-7])&IF(RC[-6]="",,"|n"&R1C27&RC[-6])&IF(RC[-5]="",,"|n"&R1C28&RC[-5])&IF(RC[-2]="",,"|n"&RC[-2]) -> 
AG1182: =IF(RC[-26]&RC[-25]&RC[-24]&RC[-23]&RC[-22]&RC[-21]="",,R1C6)&IF(RC[-26]="",,"|n"&R1C7&RC[-26])&IF(RC[-25]="",,"|n"&R1C8&RC[-25])&IF(RC[-24]="",,"|n"&R1C9&RC[-24])&IF(RC[-23]="",,"|n"&R1C10&RC[-23])&IF(RC[-22]="",,"|n"&R1C11&RC[-22])&IF(RC[-21]="",,"|n"&R1C12&RC[-21])&IF(RC[-19]&RC[-18]&RC[-17]&RC[-16]="",,"|n"&R1C13)&IF(RC[-19]="",,"|n"&R1C14&RC[-19])&IF(RC[-18]="",,"|n"&R1C15&RC[-18])&IF(RC[-17]="",,"|n"&R1C16&RC[-17])&IF(RC[-16]="",,"|n"&R1C17&RC[-16])&IF(RC[-15]="",,"|n"&R1C18&RC[-15])&IF(RC[-14]="",,"|n"&R1C19&RC[-14])&IF(RC[-13]="",,"|n"&R1C20&RC[-13])&IF(RC[-12]="",,"|n"&R1C21&RC[-12])&IF(RC[-10]="",,"|n"&R1C23&RC[-10])&IF(RC[-9]="",,"|n"&R1C24&RC[-9])&IF(RC[-8]="",,"|n"&R1C25&RC[-8])&IF(RC[-7]="",,"|n"&R1C26&RC[-7])&IF(RC[-6]="",,"|n"&R1C27&RC[-6])&IF(RC[-5]="",,"|n"&R1C28&RC[-5])&IF(RC[-2]="",,"|n"&RC[-2]) -> 
AG1183: =IF(RC[-26]&RC[-25]&RC[-24]&RC[-23]&RC[-22]&RC[-21]="",,R1C6)&IF(RC[-26]="",,"|n"&R1C7&RC[-26])&IF(RC[-25]="",,"|n"&R1C8&RC[-25])&IF(RC[-24]="",,"|n"&R1C9&RC[-24])&IF(RC[-23]="",,"|n"&R1C10&RC[-23])&IF(RC[-22]="",,"|n"&R1C11&RC[-22])&IF(RC[-21]="",,"|n"&R1C12&RC[-21])&IF(RC[-19]&RC[-18]&RC[-17]&RC[-16]="",,"|n"&R1C13)&IF(RC[-19]="",,"|n"&R1C14&RC[-19])&IF(RC[-18]="",,"|n"&R1C15&RC[-18])&IF(RC[-17]="",,"|n"&R1C16&RC[-17])&IF(RC[-16]="",,"|n"&R1C17&RC[-16])&IF(RC[-15]="",,"|n"&R1C18&RC[-15])&IF(RC[-14]="",,"|n"&R1C19&RC[-14])&IF(RC[-13]="",,"|n"&R1C20&RC[-13])&IF(RC[-12]="",,"|n"&R1C21&RC[-12])&IF(RC[-10]="",,"|n"&R1C23&RC[-10])&IF(RC[-9]="",,"|n"&R1C24&RC[-9])&IF(RC[-8]="",,"|n"&R1C25&RC[-8])&IF(RC[-7]="",,"|n"&R1C26&RC[-7])&IF(RC[-6]="",,"|n"&R1C27&RC[-6])&IF(RC[-5]="",,"|n"&R1C28&RC[-5])&IF(RC[-2]="",,"|n"&RC[-2]) -> 
AG1184: =IF(RC[-26]&RC[-25]&RC[-24]&RC[-23]&RC[-22]&RC[-21]="",,R1C6)&IF(RC[-26]="",,"|n"&R1C7&RC[-26])&IF(RC[-25]="",,"|n"&R1C8&RC[-25])&IF(RC[-24]="",,"|n"&R1C9&RC[-24])&IF(RC[-23]="",,"|n"&R1C10&RC[-23])&IF(RC[-22]="",,"|n"&R1C11&RC[-22])&IF(RC[-21]="",,"|n"&R1C12&RC[-21])&IF(RC[-19]&RC[-18]&RC[-17]&RC[-16]="",,"|n"&R1C13)&IF(RC[-19]="",,"|n"&R1C14&RC[-19])&IF(RC[-18]="",,"|n"&R1C15&RC[-18])&IF(RC[-17]="",,"|n"&R1C16&RC[-17])&IF(RC[-16]="",,"|n"&R1C17&RC[-16])&IF(RC[-15]="",,"|n"&R1C18&RC[-15])&IF(RC[-14]="",,"|n"&R1C19&RC[-14])&IF(RC[-13]="",,"|n"&R1C20&RC[-13])&IF(RC[-12]="",,"|n"&R1C21&RC[-12])&IF(RC[-10]="",,"|n"&R1C23&RC[-10])&IF(RC[-9]="",,"|n"&R1C24&RC[-9])&IF(RC[-8]="",,"|n"&R1C25&RC[-8])&IF(RC[-7]="",,"|n"&R1C26&RC[-7])&IF(RC[-6]="",,"|n"&R1C27&RC[-6])&IF(RC[-5]="",,"|n"&R1C28&RC[-5])&IF(RC[-2]="",,"|n"&RC[-2]) -> 
AG1185: =IF(RC[-26]&RC[-25]&RC[-24]&RC[-23]&RC[-22]&RC[-21]="",,R1C6)&IF(RC[-26]="",,"|n"&R1C7&RC[-26])&IF(RC[-25]="",,"|n"&R1C8&RC[-25])&IF(RC[-24]="",,"|n"&R1C9&RC[-24])&IF(RC[-23]="",,"|n"&R1C10&RC[-23])&IF(RC[-22]="",,"|n"&R1C11&RC[-22])&IF(RC[-21]="",,"|n"&R1C12&RC[-21])&IF(RC[-19]&RC[-18]&RC[-17]&RC[-16]="",,"|n"&R1C13)&IF(RC[-19]="",,"|n"&R1C14&RC[-19])&IF(RC[-18]="",,"|n"&R1C15&RC[-18])&IF(RC[-17]="",,"|n"&R1C16&RC[-17])&IF(RC[-16]="",,"|n"&R1C17&RC[-16])&IF(RC[-15]="",,"|n"&R1C18&RC[-15])&IF(RC[-14]="",,"|n"&R1C19&RC[-14])&IF(RC[-13]="",,"|n"&R1C20&RC[-13])&IF(RC[-12]="",,"|n"&R1C21&RC[-12])&IF(RC[-10]="",,"|n"&R1C23&RC[-10])&IF(RC[-9]="",,"|n"&R1C24&RC[-9])&IF(RC[-8]="",,"|n"&R1C25&RC[-8])&IF(RC[-7]="",,"|n"&R1C26&RC[-7])&IF(RC[-6]="",,"|n"&R1C27&RC[-6])&IF(RC[-5]="",,"|n"&R1C28&RC[-5])&IF(RC[-2]="",,"|n"&RC[-2]) -> 
AG1186: =IF(RC[-26]&RC[-25]&RC[-24]&RC[-23]&RC[-22]&RC[-21]="",,R1C6)&IF(RC[-26]="",,"|n"&R1C7&RC[-26])&IF(RC[-25]="",,"|n"&R1C8&RC[-25])&IF(RC[-24]="",,"|n"&R1C9&RC[-24])&IF(RC[-23]="",,"|n"&R1C10&RC[-23])&IF(RC[-22]="",,"|n"&R1C11&RC[-22])&IF(RC[-21]="",,"|n"&R1C12&RC[-21])&IF(RC[-19]&RC[-18]&RC[-17]&RC[-16]="",,"|n"&R1C13)&IF(RC[-19]="",,"|n"&R1C14&RC[-19])&IF(RC[-18]="",,"|n"&R1C15&RC[-18])&IF(RC[-17]="",,"|n"&R1C16&RC[-17])&IF(RC[-16]="",,"|n"&R1C17&RC[-16])&IF(RC[-15]="",,"|n"&R1C18&RC[-15])&IF(RC[-14]="",,"|n"&R1C19&RC[-14])&IF(RC[-13]="",,"|n"&R1C20&RC[-13])&IF(RC[-12]="",,"|n"&R1C21&RC[-12])&IF(RC[-10]="",,"|n"&R1C23&RC[-10])&IF(RC[-9]="",,"|n"&R1C24&RC[-9])&IF(RC[-8]="",,"|n"&R1C25&RC[-8])&IF(RC[-7]="",,"|n"&R1C26&RC[-7])&IF(RC[-6]="",,"|n"&R1C27&RC[-6])&IF(RC[-5]="",,"|n"&R1C28&RC[-5])&IF(RC[-2]="",,"|n"&RC[-2]) -> 
AG1187: =IF(RC[-26]&RC[-25]&RC[-24]&RC[-23]&RC[-22]&RC[-21]="",,R1C6)&IF(RC[-26]="",,"|n"&R1C7&RC[-26])&IF(RC[-25]="",,"|n"&R1C8&RC[-25])&IF(RC[-24]="",,"|n"&R1C9&RC[-24])&IF(RC[-23]="",,"|n"&R1C10&RC[-23])&IF(RC[-22]="",,"|n"&R1C11&RC[-22])&IF(RC[-21]="",,"|n"&R1C12&RC[-21])&IF(RC[-19]&RC[-18]&RC[-17]&RC[-16]="",,"|n"&R1C13)&IF(RC[-19]="",,"|n"&R1C14&RC[-19])&IF(RC[-18]="",,"|n"&R1C15&RC[-18])&IF(RC[-17]="",,"|n"&R1C16&RC[-17])&IF(RC[-16]="",,"|n"&R1C17&RC[-16])&IF(RC[-15]="",,"|n"&R1C18&RC[-15])&IF(RC[-14]="",,"|n"&R1C19&RC[-14])&IF(RC[-13]="",,"|n"&R1C20&RC[-13])&IF(RC[-12]="",,"|n"&R1C21&RC[-12])&IF(RC[-10]="",,"|n"&R1C23&RC[-10])&IF(RC[-9]="",,"|n"&R1C24&RC[-9])&IF(RC[-8]="",,"|n"&R1C25&RC[-8])&IF(RC[-7]="",,"|n"&R1C26&RC[-7])&IF(RC[-6]="",,"|n"&R1C27&RC[-6])&IF(RC[-5]="",,"|n"&R1C28&RC[-5])&IF(RC[-2]="",,"|n"&RC[-2]) -> 
AG1188: =IF(RC[-26]&RC[-25]&RC[-24]&RC[-23]&RC[-22]&RC[-21]="",,R1C6)&IF(RC[-26]="",,"|n"&R1C7&RC[-26])&IF(RC[-25]="",,"|n"&R1C8&RC[-25])&IF(RC[-24]="",,"|n"&R1C9&RC[-24])&IF(RC[-23]="",,"|n"&R1C10&RC[-23])&IF(RC[-22]="",,"|n"&R1C11&RC[-22])&IF(RC[-21]="",,"|n"&R1C12&RC[-21])&IF(RC[-19]&RC[-18]&RC[-17]&RC[-16]="",,"|n"&R1C13)&IF(RC[-19]="",,"|n"&R1C14&RC[-19])&IF(RC[-18]="",,"|n"&R1C15&RC[-18])&IF(RC[-17]="",,"|n"&R1C16&RC[-17])&IF(RC[-16]="",,"|n"&R1C17&RC[-16])&IF(RC[-15]="",,"|n"&R1C18&RC[-15])&IF(RC[-14]="",,"|n"&R1C19&RC[-14])&IF(RC[-13]="",,"|n"&R1C20&RC[-13])&IF(RC[-12]="",,"|n"&R1C21&RC[-12])&IF(RC[-10]="",,"|n"&R1C23&RC[-10])&IF(RC[-9]="",,"|n"&R1C24&RC[-9])&IF(RC[-8]="",,"|n"&R1C25&RC[-8])&IF(RC[-7]="",,"|n"&R1C26&RC[-7])&IF(RC[-6]="",,"|n"&R1C27&RC[-6])&IF(RC[-5]="",,"|n"&R1C28&RC[-5])&IF(RC[-2]="",,"|n"&RC[-2]) -> 
AG1189: =IF(RC[-26]&RC[-25]&RC[-24]&RC[-23]&RC[-22]&RC[-21]="",,R1C6)&IF(RC[-26]="",,"|n"&R1C7&RC[-26])&IF(RC[-25]="",,"|n"&R1C8&RC[-25])&IF(RC[-24]="",,"|n"&R1C9&RC[-24])&IF(RC[-23]="",,"|n"&R1C10&RC[-23])&IF(RC[-22]="",,"|n"&R1C11&RC[-22])&IF(RC[-21]="",,"|n"&R1C12&RC[-21])&IF(RC[-19]&RC[-18]&RC[-17]&RC[-16]="",,"|n"&R1C13)&IF(RC[-19]="",,"|n"&R1C14&RC[-19])&IF(RC[-18]="",,"|n"&R1C15&RC[-18])&IF(RC[-17]="",,"|n"&R1C16&RC[-17])&IF(RC[-16]="",,"|n"&R1C17&RC[-16])&IF(RC[-15]="",,"|n"&R1C18&RC[-15])&IF(RC[-14]="",,"|n"&R1C19&RC[-14])&IF(RC[-13]="",,"|n"&R1C20&RC[-13])&IF(RC[-12]="",,"|n"&R1C21&RC[-12])&IF(RC[-10]="",,"|n"&R1C23&RC[-10])&IF(RC[-9]="",,"|n"&R1C24&RC[-9])&IF(RC[-8]="",,"|n"&R1C25&RC[-8])&IF(RC[-7]="",,"|n"&R1C26&RC[-7])&IF(RC[-6]="",,"|n"&R1C27&RC[-6])&IF(RC[-5]="",,"|n"&R1C28&RC[-5])&IF(RC[-2]="",,"|n"&RC[-2]) -> 
AG1190: =IF(RC[-26]&RC[-25]&RC[-24]&RC[-23]&RC[-22]&RC[-21]="",,R1C6)&IF(RC[-26]="",,"|n"&R1C7&RC[-26])&IF(RC[-25]="",,"|n"&R1C8&RC[-25])&IF(RC[-24]="",,"|n"&R1C9&RC[-24])&IF(RC[-23]="",,"|n"&R1C10&RC[-23])&IF(RC[-22]="",,"|n"&R1C11&RC[-22])&IF(RC[-21]="",,"|n"&R1C12&RC[-21])&IF(RC[-19]&RC[-18]&RC[-17]&RC[-16]="",,"|n"&R1C13)&IF(RC[-19]="",,"|n"&R1C14&RC[-19])&IF(RC[-18]="",,"|n"&R1C15&RC[-18])&IF(RC[-17]="",,"|n"&R1C16&RC[-17])&IF(RC[-16]="",,"|n"&R1C17&RC[-16])&IF(RC[-15]="",,"|n"&R1C18&RC[-15])&IF(RC[-14]="",,"|n"&R1C19&RC[-14])&IF(RC[-13]="",,"|n"&R1C20&RC[-13])&IF(RC[-12]="",,"|n"&R1C21&RC[-12])&IF(RC[-10]="",,"|n"&R1C23&RC[-10])&IF(RC[-9]="",,"|n"&R1C24&RC[-9])&IF(RC[-8]="",,"|n"&R1C25&RC[-8])&IF(RC[-7]="",,"|n"&R1C26&RC[-7])&IF(RC[-6]="",,"|n"&R1C27&RC[-6])&IF(RC[-5]="",,"|n"&R1C28&RC[-5])&IF(RC[-2]="",,"|n"&RC[-2]) -> 
AG1191: =IF(RC[-26]&RC[-25]&RC[-24]&RC[-23]&RC[-22]&RC[-21]="",,R1C6)&IF(RC[-26]="",,"|n"&R1C7&RC[-26])&IF(RC[-25]="",,"|n"&R1C8&RC[-25])&IF(RC[-24]="",,"|n"&R1C9&RC[-24])&IF(RC[-23]="",,"|n"&R1C10&RC[-23])&IF(RC[-22]="",,"|n"&R1C11&RC[-22])&IF(RC[-21]="",,"|n"&R1C12&RC[-21])&IF(RC[-19]&RC[-18]&RC[-17]&RC[-16]="",,"|n"&R1C13)&IF(RC[-19]="",,"|n"&R1C14&RC[-19])&IF(RC[-18]="",,"|n"&R1C15&RC[-18])&IF(RC[-17]="",,"|n"&R1C16&RC[-17])&IF(RC[-16]="",,"|n"&R1C17&RC[-16])&IF(RC[-15]="",,"|n"&R1C18&RC[-15])&IF(RC[-14]="",,"|n"&R1C19&RC[-14])&IF(RC[-13]="",,"|n"&R1C20&RC[-13])&IF(RC[-12]="",,"|n"&R1C21&RC[-12])&IF(RC[-10]="",,"|n"&R1C23&RC[-10])&IF(RC[-9]="",,"|n"&R1C24&RC[-9])&IF(RC[-8]="",,"|n"&R1C25&RC[-8])&IF(RC[-7]="",,"|n"&R1C26&RC[-7])&IF(RC[-6]="",,"|n"&R1C27&RC[-6])&IF(RC[-5]="",,"|n"&R1C28&RC[-5])&IF(RC[-2]="",,"|n"&RC[-2]) -> 
AG1192: =IF(RC[-26]&RC[-25]&RC[-24]&RC[-23]&RC[-22]&RC[-21]="",,R1C6)&IF(RC[-26]="",,"|n"&R1C7&RC[-26])&IF(RC[-25]="",,"|n"&R1C8&RC[-25])&IF(RC[-24]="",,"|n"&R1C9&RC[-24])&IF(RC[-23]="",,"|n"&R1C10&RC[-23])&IF(RC[-22]="",,"|n"&R1C11&RC[-22])&IF(RC[-21]="",,"|n"&R1C12&RC[-21])&IF(RC[-19]&RC[-18]&RC[-17]&RC[-16]="",,"|n"&R1C13)&IF(RC[-19]="",,"|n"&R1C14&RC[-19])&IF(RC[-18]="",,"|n"&R1C15&RC[-18])&IF(RC[-17]="",,"|n"&R1C16&RC[-17])&IF(RC[-16]="",,"|n"&R1C17&RC[-16])&IF(RC[-15]="",,"|n"&R1C18&RC[-15])&IF(RC[-14]="",,"|n"&R1C19&RC[-14])&IF(RC[-13]="",,"|n"&R1C20&RC[-13])&IF(RC[-12]="",,"|n"&R1C21&RC[-12])&IF(RC[-10]="",,"|n"&R1C23&RC[-10])&IF(RC[-9]="",,"|n"&R1C24&RC[-9])&IF(RC[-8]="",,"|n"&R1C25&RC[-8])&IF(RC[-7]="",,"|n"&R1C26&RC[-7])&IF(RC[-6]="",,"|n"&R1C27&RC[-6])&IF(RC[-5]="",,"|n"&R1C28&RC[-5])&IF(RC[-2]="",,"|n"&RC[-2]) -> 
AG1193: =IF(RC[-26]&RC[-25]&RC[-24]&RC[-23]&RC[-22]&RC[-21]="",,R1C6)&IF(RC[-26]="",,"|n"&R1C7&RC[-26])&IF(RC[-25]="",,"|n"&R1C8&RC[-25])&IF(RC[-24]="",,"|n"&R1C9&RC[-24])&IF(RC[-23]="",,"|n"&R1C10&RC[-23])&IF(RC[-22]="",,"|n"&R1C11&RC[-22])&IF(RC[-21]="",,"|n"&R1C12&RC[-21])&IF(RC[-19]&RC[-18]&RC[-17]&RC[-16]="",,"|n"&R1C13)&IF(RC[-19]="",,"|n"&R1C14&RC[-19])&IF(RC[-18]="",,"|n"&R1C15&RC[-18])&IF(RC[-17]="",,"|n"&R1C16&RC[-17])&IF(RC[-16]="",,"|n"&R1C17&RC[-16])&IF(RC[-15]="",,"|n"&R1C18&RC[-15])&IF(RC[-14]="",,"|n"&R1C19&RC[-14])&IF(RC[-13]="",,"|n"&R1C20&RC[-13])&IF(RC[-12]="",,"|n"&R1C21&RC[-12])&IF(RC[-10]="",,"|n"&R1C23&RC[-10])&IF(RC[-9]="",,"|n"&R1C24&RC[-9])&IF(RC[-8]="",,"|n"&R1C25&RC[-8])&IF(RC[-7]="",,"|n"&R1C26&RC[-7])&IF(RC[-6]="",,"|n"&R1C27&RC[-6])&IF(RC[-5]="",,"|n"&R1C28&RC[-5])&IF(RC[-2]="",,"|n"&RC[-2]) -> 
AG1194: =IF(RC[-26]&RC[-25]&RC[-24]&RC[-23]&RC[-22]&RC[-21]="",,R1C6)&IF(RC[-26]="",,"|n"&R1C7&RC[-26])&IF(RC[-25]="",,"|n"&R1C8&RC[-25])&IF(RC[-24]="",,"|n"&R1C9&RC[-24])&IF(RC[-23]="",,"|n"&R1C10&RC[-23])&IF(RC[-22]="",,"|n"&R1C11&RC[-22])&IF(RC[-21]="",,"|n"&R1C12&RC[-21])&IF(RC[-19]&RC[-18]&RC[-17]&RC[-16]="",,"|n"&R1C13)&IF(RC[-19]="",,"|n"&R1C14&RC[-19])&IF(RC[-18]="",,"|n"&R1C15&RC[-18])&IF(RC[-17]="",,"|n"&R1C16&RC[-17])&IF(RC[-16]="",,"|n"&R1C17&RC[-16])&IF(RC[-15]="",,"|n"&R1C18&RC[-15])&IF(RC[-14]="",,"|n"&R1C19&RC[-14])&IF(RC[-13]="",,"|n"&R1C20&RC[-13])&IF(RC[-12]="",,"|n"&R1C21&RC[-12])&IF(RC[-10]="",,"|n"&R1C23&RC[-10])&IF(RC[-9]="",,"|n"&R1C24&RC[-9])&IF(RC[-8]="",,"|n"&R1C25&RC[-8])&IF(RC[-7]="",,"|n"&R1C26&RC[-7])&IF(RC[-6]="",,"|n"&R1C27&RC[-6])&IF(RC[-5]="",,"|n"&R1C28&RC[-5])&IF(RC[-2]="",,"|n"&RC[-2]) -> 
AG1195: =IF(RC[-26]&RC[-25]&RC[-24]&RC[-23]&RC[-22]&RC[-21]="",,R1C6)&IF(RC[-26]="",,"|n"&R1C7&RC[-26])&IF(RC[-25]="",,"|n"&R1C8&RC[-25])&IF(RC[-24]="",,"|n"&R1C9&RC[-24])&IF(RC[-23]="",,"|n"&R1C10&RC[-23])&IF(RC[-22]="",,"|n"&R1C11&RC[-22])&IF(RC[-21]="",,"|n"&R1C12&RC[-21])&IF(RC[-19]&RC[-18]&RC[-17]&RC[-16]="",,"|n"&R1C13)&IF(RC[-19]="",,"|n"&R1C14&RC[-19])&IF(RC[-18]="",,"|n"&R1C15&RC[-18])&IF(RC[-17]="",,"|n"&R1C16&RC[-17])&IF(RC[-16]="",,"|n"&R1C17&RC[-16])&IF(RC[-15]="",,"|n"&R1C18&RC[-15])&IF(RC[-14]="",,"|n"&R1C19&RC[-14])&IF(RC[-13]="",,"|n"&R1C20&RC[-13])&IF(RC[-12]="",,"|n"&R1C21&RC[-12])&IF(RC[-10]="",,"|n"&R1C23&RC[-10])&IF(RC[-9]="",,"|n"&R1C24&RC[-9])&IF(RC[-8]="",,"|n"&R1C25&RC[-8])&IF(RC[-7]="",,"|n"&R1C26&RC[-7])&IF(RC[-6]="",,"|n"&R1C27&RC[-6])&IF(RC[-5]="",,"|n"&R1C28&RC[-5])&IF(RC[-2]="",,"|n"&RC[-2]) -> 
AG1196: =IF(RC[-26]&RC[-25]&RC[-24]&RC[-23]&RC[-22]&RC[-21]="",,R1C6)&IF(RC[-26]="",,"|n"&R1C7&RC[-26])&IF(RC[-25]="",,"|n"&R1C8&RC[-25])&IF(RC[-24]="",,"|n"&R1C9&RC[-24])&IF(RC[-23]="",,"|n"&R1C10&RC[-23])&IF(RC[-22]="",,"|n"&R1C11&RC[-22])&IF(RC[-21]="",,"|n"&R1C12&RC[-21])&IF(RC[-19]&RC[-18]&RC[-17]&RC[-16]="",,"|n"&R1C13)&IF(RC[-19]="",,"|n"&R1C14&RC[-19])&IF(RC[-18]="",,"|n"&R1C15&RC[-18])&IF(RC[-17]="",,"|n"&R1C16&RC[-17])&IF(RC[-16]="",,"|n"&R1C17&RC[-16])&IF(RC[-15]="",,"|n"&R1C18&RC[-15])&IF(RC[-14]="",,"|n"&R1C19&RC[-14])&IF(RC[-13]="",,"|n"&R1C20&RC[-13])&IF(RC[-12]="",,"|n"&R1C21&RC[-12])&IF(RC[-10]="",,"|n"&R1C23&RC[-10])&IF(RC[-9]="",,"|n"&R1C24&RC[-9])&IF(RC[-8]="",,"|n"&R1C25&RC[-8])&IF(RC[-7]="",,"|n"&R1C26&RC[-7])&IF(RC[-6]="",,"|n"&R1C27&RC[-6])&IF(RC[-5]="",,"|n"&R1C28&RC[-5])&IF(RC[-2]="",,"|n"&RC[-2]) -> 
AG1197: =IF(RC[-26]&RC[-25]&RC[-24]&RC[-23]&RC[-22]&RC[-21]="",,R1C6)&IF(RC[-26]="",,"|n"&R1C7&RC[-26])&IF(RC[-25]="",,"|n"&R1C8&RC[-25])&IF(RC[-24]="",,"|n"&R1C9&RC[-24])&IF(RC[-23]="",,"|n"&R1C10&RC[-23])&IF(RC[-22]="",,"|n"&R1C11&RC[-22])&IF(RC[-21]="",,"|n"&R1C12&RC[-21])&IF(RC[-19]&RC[-18]&RC[-17]&RC[-16]="",,"|n"&R1C13)&IF(RC[-19]="",,"|n"&R1C14&RC[-19])&IF(RC[-18]="",,"|n"&R1C15&RC[-18])&IF(RC[-17]="",,"|n"&R1C16&RC[-17])&IF(RC[-16]="",,"|n"&R1C17&RC[-16])&IF(RC[-15]="",,"|n"&R1C18&RC[-15])&IF(RC[-14]="",,"|n"&R1C19&RC[-14])&IF(RC[-13]="",,"|n"&R1C20&RC[-13])&IF(RC[-12]="",,"|n"&R1C21&RC[-12])&IF(RC[-10]="",,"|n"&R1C23&RC[-10])&IF(RC[-9]="",,"|n"&R1C24&RC[-9])&IF(RC[-8]="",,"|n"&R1C25&RC[-8])&IF(RC[-7]="",,"|n"&R1C26&RC[-7])&IF(RC[-6]="",,"|n"&R1C27&RC[-6])&IF(RC[-5]="",,"|n"&R1C28&RC[-5])&IF(RC[-2]="",,"|n"&RC[-2]) -> 
AG1198: =IF(RC[-26]&RC[-25]&RC[-24]&RC[-23]&RC[-22]&RC[-21]="",,R1C6)&IF(RC[-26]="",,"|n"&R1C7&RC[-26])&IF(RC[-25]="",,"|n"&R1C8&RC[-25])&IF(RC[-24]="",,"|n"&R1C9&RC[-24])&IF(RC[-23]="",,"|n"&R1C10&RC[-23])&IF(RC[-22]="",,"|n"&R1C11&RC[-22])&IF(RC[-21]="",,"|n"&R1C12&RC[-21])&IF(RC[-19]&RC[-18]&RC[-17]&RC[-16]="",,"|n"&R1C13)&IF(RC[-19]="",,"|n"&R1C14&RC[-19])&IF(RC[-18]="",,"|n"&R1C15&RC[-18])&IF(RC[-17]="",,"|n"&R1C16&RC[-17])&IF(RC[-16]="",,"|n"&R1C17&RC[-16])&IF(RC[-15]="",,"|n"&R1C18&RC[-15])&IF(RC[-14]="",,"|n"&R1C19&RC[-14])&IF(RC[-13]="",,"|n"&R1C20&RC[-13])&IF(RC[-12]="",,"|n"&R1C21&RC[-12])&IF(RC[-10]="",,"|n"&R1C23&RC[-10])&IF(RC[-9]="",,"|n"&R1C24&RC[-9])&IF(RC[-8]="",,"|n"&R1C25&RC[-8])&IF(RC[-7]="",,"|n"&R1C26&RC[-7])&IF(RC[-6]="",,"|n"&R1C27&RC[-6])&IF(RC[-5]="",,"|n"&R1C28&RC[-5])&IF(RC[-2]="",,"|n"&RC[-2]) -> 
AG1199: =IF(RC[-26]&RC[-25]&RC[-24]&RC[-23]&RC[-22]&RC[-21]="",,R1C6)&IF(RC[-26]="",,"|n"&R1C7&RC[-26])&IF(RC[-25]="",,"|n"&R1C8&RC[-25])&IF(RC[-24]="",,"|n"&R1C9&RC[-24])&IF(RC[-23]="",,"|n"&R1C10&RC[-23])&IF(RC[-22]="",,"|n"&R1C11&RC[-22])&IF(RC[-21]="",,"|n"&R1C12&RC[-21])&IF(RC[-19]&RC[-18]&RC[-17]&RC[-16]="",,"|n"&R1C13)&IF(RC[-19]="",,"|n"&R1C14&RC[-19])&IF(RC[-18]="",,"|n"&R1C15&RC[-18])&IF(RC[-17]="",,"|n"&R1C16&RC[-17])&IF(RC[-16]="",,"|n"&R1C17&RC[-16])&IF(RC[-15]="",,"|n"&R1C18&RC[-15])&IF(RC[-14]="",,"|n"&R1C19&RC[-14])&IF(RC[-13]="",,"|n"&R1C20&RC[-13])&IF(RC[-12]="",,"|n"&R1C21&RC[-12])&IF(RC[-10]="",,"|n"&R1C23&RC[-10])&IF(RC[-9]="",,"|n"&R1C24&RC[-9])&IF(RC[-8]="",,"|n"&R1C25&RC[-8])&IF(RC[-7]="",,"|n"&R1C26&RC[-7])&IF(RC[-6]="",,"|n"&R1C27&RC[-6])&IF(RC[-5]="",,"|n"&R1C28&RC[-5])&IF(RC[-2]="",,"|n"&RC[-2]) -> 
AG1200: =IF(RC[-26]&RC[-25]&RC[-24]&RC[-23]&RC[-22]&RC[-21]="",,R1C6)&IF(RC[-26]="",,"|n"&R1C7&RC[-26])&IF(RC[-25]="",,"|n"&R1C8&RC[-25])&IF(RC[-24]="",,"|n"&R1C9&RC[-24])&IF(RC[-23]="",,"|n"&R1C10&RC[-23])&IF(RC[-22]="",,"|n"&R1C11&RC[-22])&IF(RC[-21]="",,"|n"&R1C12&RC[-21])&IF(RC[-19]&RC[-18]&RC[-17]&RC[-16]="",,"|n"&R1C13)&IF(RC[-19]="",,"|n"&R1C14&RC[-19])&IF(RC[-18]="",,"|n"&R1C15&RC[-18])&IF(RC[-17]="",,"|n"&R1C16&RC[-17])&IF(RC[-16]="",,"|n"&R1C17&RC[-16])&IF(RC[-15]="",,"|n"&R1C18&RC[-15])&IF(RC[-14]="",,"|n"&R1C19&RC[-14])&IF(RC[-13]="",,"|n"&R1C20&RC[-13])&IF(RC[-12]="",,"|n"&R1C21&RC[-12])&IF(RC[-10]="",,"|n"&R1C23&RC[-10])&IF(RC[-9]="",,"|n"&R1C24&RC[-9])&IF(RC[-8]="",,"|n"&R1C25&RC[-8])&IF(RC[-7]="",,"|n"&R1C26&RC[-7])&IF(RC[-6]="",,"|n"&R1C27&RC[-6])&IF(RC[-5]="",,"|n"&R1C28&RC[-5])&IF(RC[-2]="",,"|n"&RC[-2]) -> 
AG1201: =IF(RC[-26]&RC[-25]&RC[-24]&RC[-23]&RC[-22]&RC[-21]="",,R1C6)&IF(RC[-26]="",,"|n"&R1C7&RC[-26])&IF(RC[-25]="",,"|n"&R1C8&RC[-25])&IF(RC[-24]="",,"|n"&R1C9&RC[-24])&IF(RC[-23]="",,"|n"&R1C10&RC[-23])&IF(RC[-22]="",,"|n"&R1C11&RC[-22])&IF(RC[-21]="",,"|n"&R1C12&RC[-21])&IF(RC[-19]&RC[-18]&RC[-17]&RC[-16]="",,"|n"&R1C13)&IF(RC[-19]="",,"|n"&R1C14&RC[-19])&IF(RC[-18]="",,"|n"&R1C15&RC[-18])&IF(RC[-17]="",,"|n"&R1C16&RC[-17])&IF(RC[-16]="",,"|n"&R1C17&RC[-16])&IF(RC[-15]="",,"|n"&R1C18&RC[-15])&IF(RC[-14]="",,"|n"&R1C19&RC[-14])&IF(RC[-13]="",,"|n"&R1C20&RC[-13])&IF(RC[-12]="",,"|n"&R1C21&RC[-12])&IF(RC[-10]="",,"|n"&R1C23&RC[-10])&IF(RC[-9]="",,"|n"&R1C24&RC[-9])&IF(RC[-8]="",,"|n"&R1C25&RC[-8])&IF(RC[-7]="",,"|n"&R1C26&RC[-7])&IF(RC[-6]="",,"|n"&R1C27&RC[-6])&IF(RC[-5]="",,"|n"&R1C28&RC[-5])&IF(RC[-2]="",,"|n"&RC[-2]) -> 
AG1202: =IF(RC[-26]&RC[-25]&RC[-24]&RC[-23]&RC[-22]&RC[-21]="",,R1C6)&IF(RC[-26]="",,"|n"&R1C7&RC[-26])&IF(RC[-25]="",,"|n"&R1C8&RC[-25])&IF(RC[-24]="",,"|n"&R1C9&RC[-24])&IF(RC[-23]="",,"|n"&R1C10&RC[-23])&IF(RC[-22]="",,"|n"&R1C11&RC[-22])&IF(RC[-21]="",,"|n"&R1C12&RC[-21])&IF(RC[-19]&RC[-18]&RC[-17]&RC[-16]="",,"|n"&R1C13)&IF(RC[-19]="",,"|n"&R1C14&RC[-19])&IF(RC[-18]="",,"|n"&R1C15&RC[-18])&IF(RC[-17]="",,"|n"&R1C16&RC[-17])&IF(RC[-16]="",,"|n"&R1C17&RC[-16])&IF(RC[-15]="",,"|n"&R1C18&RC[-15])&IF(RC[-14]="",,"|n"&R1C19&RC[-14])&IF(RC[-13]="",,"|n"&R1C20&RC[-13])&IF(RC[-12]="",,"|n"&R1C21&RC[-12])&IF(RC[-10]="",,"|n"&R1C23&RC[-10])&IF(RC[-9]="",,"|n"&R1C24&RC[-9])&IF(RC[-8]="",,"|n"&R1C25&RC[-8])&IF(RC[-7]="",,"|n"&R1C26&RC[-7])&IF(RC[-6]="",,"|n"&R1C27&RC[-6])&IF(RC[-5]="",,"|n"&R1C28&RC[-5])&IF(RC[-2]="",,"|n"&RC[-2]) -> 
AG1203: =IF(RC[-26]&RC[-25]&RC[-24]&RC[-23]&RC[-22]&RC[-21]="",,R1C6)&IF(RC[-26]="",,"|n"&R1C7&RC[-26])&IF(RC[-25]="",,"|n"&R1C8&RC[-25])&IF(RC[-24]="",,"|n"&R1C9&RC[-24])&IF(RC[-23]="",,"|n"&R1C10&RC[-23])&IF(RC[-22]="",,"|n"&R1C11&RC[-22])&IF(RC[-21]="",,"|n"&R1C12&RC[-21])&IF(RC[-19]&RC[-18]&RC[-17]&RC[-16]="",,"|n"&R1C13)&IF(RC[-19]="",,"|n"&R1C14&RC[-19])&IF(RC[-18]="",,"|n"&R1C15&RC[-18])&IF(RC[-17]="",,"|n"&R1C16&RC[-17])&IF(RC[-16]="",,"|n"&R1C17&RC[-16])&IF(RC[-15]="",,"|n"&R1C18&RC[-15])&IF(RC[-14]="",,"|n"&R1C19&RC[-14])&IF(RC[-13]="",,"|n"&R1C20&RC[-13])&IF(RC[-12]="",,"|n"&R1C21&RC[-12])&IF(RC[-10]="",,"|n"&R1C23&RC[-10])&IF(RC[-9]="",,"|n"&R1C24&RC[-9])&IF(RC[-8]="",,"|n"&R1C25&RC[-8])&IF(RC[-7]="",,"|n"&R1C26&RC[-7])&IF(RC[-6]="",,"|n"&R1C27&RC[-6])&IF(RC[-5]="",,"|n"&R1C28&RC[-5])&IF(RC[-2]="",,"|n"&RC[-2]) -> 
AG1204: =IF(RC[-26]&RC[-25]&RC[-24]&RC[-23]&RC[-22]&RC[-21]="",,R1C6)&IF(RC[-26]="",,"|n"&R1C7&RC[-26])&IF(RC[-25]="",,"|n"&R1C8&RC[-25])&IF(RC[-24]="",,"|n"&R1C9&RC[-24])&IF(RC[-23]="",,"|n"&R1C10&RC[-23])&IF(RC[-22]="",,"|n"&R1C11&RC[-22])&IF(RC[-21]="",,"|n"&R1C12&RC[-21])&IF(RC[-19]&RC[-18]&RC[-17]&RC[-16]="",,"|n"&R1C13)&IF(RC[-19]="",,"|n"&R1C14&RC[-19])&IF(RC[-18]="",,"|n"&R1C15&RC[-18])&IF(RC[-17]="",,"|n"&R1C16&RC[-17])&IF(RC[-16]="",,"|n"&R1C17&RC[-16])&IF(RC[-15]="",,"|n"&R1C18&RC[-15])&IF(RC[-14]="",,"|n"&R1C19&RC[-14])&IF(RC[-13]="",,"|n"&R1C20&RC[-13])&IF(RC[-12]="",,"|n"&R1C21&RC[-12])&IF(RC[-10]="",,"|n"&R1C23&RC[-10])&IF(RC[-9]="",,"|n"&R1C24&RC[-9])&IF(RC[-8]="",,"|n"&R1C25&RC[-8])&IF(RC[-7]="",,"|n"&R1C26&RC[-7])&IF(RC[-6]="",,"|n"&R1C27&RC[-6])&IF(RC[-5]="",,"|n"&R1C28&RC[-5])&IF(RC[-2]="",,"|n"&RC[-2]) -> 
AG1205: =IF(RC[-26]&RC[-25]&RC[-24]&RC[-23]&RC[-22]&RC[-21]="",,R1C6)&IF(RC[-26]="",,"|n"&R1C7&RC[-26])&IF(RC[-25]="",,"|n"&R1C8&RC[-25])&IF(RC[-24]="",,"|n"&R1C9&RC[-24])&IF(RC[-23]="",,"|n"&R1C10&RC[-23])&IF(RC[-22]="",,"|n"&R1C11&RC[-22])&IF(RC[-21]="",,"|n"&R1C12&RC[-21])&IF(RC[-19]&RC[-18]&RC[-17]&RC[-16]="",,"|n"&R1C13)&IF(RC[-19]="",,"|n"&R1C14&RC[-19])&IF(RC[-18]="",,"|n"&R1C15&RC[-18])&IF(RC[-17]="",,"|n"&R1C16&RC[-17])&IF(RC[-16]="",,"|n"&R1C17&RC[-16])&IF(RC[-15]="",,"|n"&R1C18&RC[-15])&IF(RC[-14]="",,"|n"&R1C19&RC[-14])&IF(RC[-13]="",,"|n"&R1C20&RC[-13])&IF(RC[-12]="",,"|n"&R1C21&RC[-12])&IF(RC[-10]="",,"|n"&R1C23&RC[-10])&IF(RC[-9]="",,"|n"&R1C24&RC[-9])&IF(RC[-8]="",,"|n"&R1C25&RC[-8])&IF(RC[-7]="",,"|n"&R1C26&RC[-7])&IF(RC[-6]="",,"|n"&R1C27&RC[-6])&IF(RC[-5]="",,"|n"&R1C28&RC[-5])&IF(RC[-2]="",,"|n"&RC[-2]) -> 
AG1206: =IF(RC[-26]&RC[-25]&RC[-24]&RC[-23]&RC[-22]&RC[-21]="",,R1C6)&IF(RC[-26]="",,"|n"&R1C7&RC[-26])&IF(RC[-25]="",,"|n"&R1C8&RC[-25])&IF(RC[-24]="",,"|n"&R1C9&RC[-24])&IF(RC[-23]="",,"|n"&R1C10&RC[-23])&IF(RC[-22]="",,"|n"&R1C11&RC[-22])&IF(RC[-21]="",,"|n"&R1C12&RC[-21])&IF(RC[-19]&RC[-18]&RC[-17]&RC[-16]="",,"|n"&R1C13)&IF(RC[-19]="",,"|n"&R1C14&RC[-19])&IF(RC[-18]="",,"|n"&R1C15&RC[-18])&IF(RC[-17]="",,"|n"&R1C16&RC[-17])&IF(RC[-16]="",,"|n"&R1C17&RC[-16])&IF(RC[-15]="",,"|n"&R1C18&RC[-15])&IF(RC[-14]="",,"|n"&R1C19&RC[-14])&IF(RC[-13]="",,"|n"&R1C20&RC[-13])&IF(RC[-12]="",,"|n"&R1C21&RC[-12])&IF(RC[-10]="",,"|n"&R1C23&RC[-10])&IF(RC[-9]="",,"|n"&R1C24&RC[-9])&IF(RC[-8]="",,"|n"&R1C25&RC[-8])&IF(RC[-7]="",,"|n"&R1C26&RC[-7])&IF(RC[-6]="",,"|n"&R1C27&RC[-6])&IF(RC[-5]="",,"|n"&R1C28&RC[-5])&IF(RC[-2]="",,"|n"&RC[-2]) -> 
AG1207: =IF(RC[-26]&RC[-25]&RC[-24]&RC[-23]&RC[-22]&RC[-21]="",,R1C6)&IF(RC[-26]="",,"|n"&R1C7&RC[-26])&IF(RC[-25]="",,"|n"&R1C8&RC[-25])&IF(RC[-24]="",,"|n"&R1C9&RC[-24])&IF(RC[-23]="",,"|n"&R1C10&RC[-23])&IF(RC[-22]="",,"|n"&R1C11&RC[-22])&IF(RC[-21]="",,"|n"&R1C12&RC[-21])&IF(RC[-19]&RC[-18]&RC[-17]&RC[-16]="",,"|n"&R1C13)&IF(RC[-19]="",,"|n"&R1C14&RC[-19])&IF(RC[-18]="",,"|n"&R1C15&RC[-18])&IF(RC[-17]="",,"|n"&R1C16&RC[-17])&IF(RC[-16]="",,"|n"&R1C17&RC[-16])&IF(RC[-15]="",,"|n"&R1C18&RC[-15])&IF(RC[-14]="",,"|n"&R1C19&RC[-14])&IF(RC[-13]="",,"|n"&R1C20&RC[-13])&IF(RC[-12]="",,"|n"&R1C21&RC[-12])&IF(RC[-10]="",,"|n"&R1C23&RC[-10])&IF(RC[-9]="",,"|n"&R1C24&RC[-9])&IF(RC[-8]="",,"|n"&R1C25&RC[-8])&IF(RC[-7]="",,"|n"&R1C26&RC[-7])&IF(RC[-6]="",,"|n"&R1C27&RC[-6])&IF(RC[-5]="",,"|n"&R1C28&RC[-5])&IF(RC[-2]="",,"|n"&RC[-2]) -> 
AG1208: =IF(RC[-26]&RC[-25]&RC[-24]&RC[-23]&RC[-22]&RC[-21]="",,R1C6)&IF(RC[-26]="",,"|n"&R1C7&RC[-26])&IF(RC[-25]="",,"|n"&R1C8&RC[-25])&IF(RC[-24]="",,"|n"&R1C9&RC[-24])&IF(RC[-23]="",,"|n"&R1C10&RC[-23])&IF(RC[-22]="",,"|n"&R1C11&RC[-22])&IF(RC[-21]="",,"|n"&R1C12&RC[-21])&IF(RC[-19]&RC[-18]&RC[-17]&RC[-16]="",,"|n"&R1C13)&IF(RC[-19]="",,"|n"&R1C14&RC[-19])&IF(RC[-18]="",,"|n"&R1C15&RC[-18])&IF(RC[-17]="",,"|n"&R1C16&RC[-17])&IF(RC[-16]="",,"|n"&R1C17&RC[-16])&IF(RC[-15]="",,"|n"&R1C18&RC[-15])&IF(RC[-14]="",,"|n"&R1C19&RC[-14])&IF(RC[-13]="",,"|n"&R1C20&RC[-13])&IF(RC[-12]="",,"|n"&R1C21&RC[-12])&IF(RC[-10]="",,"|n"&R1C23&RC[-10])&IF(RC[-9]="",,"|n"&R1C24&RC[-9])&IF(RC[-8]="",,"|n"&R1C25&RC[-8])&IF(RC[-7]="",,"|n"&R1C26&RC[-7])&IF(RC[-6]="",,"|n"&R1C27&RC[-6])&IF(RC[-5]="",,"|n"&R1C28&RC[-5])&IF(RC[-2]="",,"|n"&RC[-2]) -> 
AG1209: =IF(RC[-26]&RC[-25]&RC[-24]&RC[-23]&RC[-22]&RC[-21]="",,R1C6)&IF(RC[-26]="",,"|n"&R1C7&RC[-26])&IF(RC[-25]="",,"|n"&R1C8&RC[-25])&IF(RC[-24]="",,"|n"&R1C9&RC[-24])&IF(RC[-23]="",,"|n"&R1C10&RC[-23])&IF(RC[-22]="",,"|n"&R1C11&RC[-22])&IF(RC[-21]="",,"|n"&R1C12&RC[-21])&IF(RC[-19]&RC[-18]&RC[-17]&RC[-16]="",,"|n"&R1C13)&IF(RC[-19]="",,"|n"&R1C14&RC[-19])&IF(RC[-18]="",,"|n"&R1C15&RC[-18])&IF(RC[-17]="",,"|n"&R1C16&RC[-17])&IF(RC[-16]="",,"|n"&R1C17&RC[-16])&IF(RC[-15]="",,"|n"&R1C18&RC[-15])&IF(RC[-14]="",,"|n"&R1C19&RC[-14])&IF(RC[-13]="",,"|n"&R1C20&RC[-13])&IF(RC[-12]="",,"|n"&R1C21&RC[-12])&IF(RC[-10]="",,"|n"&R1C23&RC[-10])&IF(RC[-9]="",,"|n"&R1C24&RC[-9])&IF(RC[-8]="",,"|n"&R1C25&RC[-8])&IF(RC[-7]="",,"|n"&R1C26&RC[-7])&IF(RC[-6]="",,"|n"&R1C27&RC[-6])&IF(RC[-5]="",,"|n"&R1C28&RC[-5])&IF(RC[-2]="",,"|n"&RC[-2]) -> 
AG1210: =IF(RC[-26]&RC[-25]&RC[-24]&RC[-23]&RC[-22]&RC[-21]="",,R1C6)&IF(RC[-26]="",,"|n"&R1C7&RC[-26])&IF(RC[-25]="",,"|n"&R1C8&RC[-25])&IF(RC[-24]="",,"|n"&R1C9&RC[-24])&IF(RC[-23]="",,"|n"&R1C10&RC[-23])&IF(RC[-22]="",,"|n"&R1C11&RC[-22])&IF(RC[-21]="",,"|n"&R1C12&RC[-21])&IF(RC[-19]&RC[-18]&RC[-17]&RC[-16]="",,"|n"&R1C13)&IF(RC[-19]="",,"|n"&R1C14&RC[-19])&IF(RC[-18]="",,"|n"&R1C15&RC[-18])&IF(RC[-17]="",,"|n"&R1C16&RC[-17])&IF(RC[-16]="",,"|n"&R1C17&RC[-16])&IF(RC[-15]="",,"|n"&R1C18&RC[-15])&IF(RC[-14]="",,"|n"&R1C19&RC[-14])&IF(RC[-13]="",,"|n"&R1C20&RC[-13])&IF(RC[-12]="",,"|n"&R1C21&RC[-12])&IF(RC[-10]="",,"|n"&R1C23&RC[-10])&IF(RC[-9]="",,"|n"&R1C24&RC[-9])&IF(RC[-8]="",,"|n"&R1C25&RC[-8])&IF(RC[-7]="",,"|n"&R1C26&RC[-7])&IF(RC[-6]="",,"|n"&R1C27&RC[-6])&IF(RC[-5]="",,"|n"&R1C28&RC[-5])&IF(RC[-2]="",,"|n"&RC[-2]) -> 
AG1211: =IF(RC[-26]&RC[-25]&RC[-24]&RC[-23]&RC[-22]&RC[-21]="",,R1C6)&IF(RC[-26]="",,"|n"&R1C7&RC[-26])&IF(RC[-25]="",,"|n"&R1C8&RC[-25])&IF(RC[-24]="",,"|n"&R1C9&RC[-24])&IF(RC[-23]="",,"|n"&R1C10&RC[-23])&IF(RC[-22]="",,"|n"&R1C11&RC[-22])&IF(RC[-21]="",,"|n"&R1C12&RC[-21])&IF(RC[-19]&RC[-18]&RC[-17]&RC[-16]="",,"|n"&R1C13)&IF(RC[-19]="",,"|n"&R1C14&RC[-19])&IF(RC[-18]="",,"|n"&R1C15&RC[-18])&IF(RC[-17]="",,"|n"&R1C16&RC[-17])&IF(RC[-16]="",,"|n"&R1C17&RC[-16])&IF(RC[-15]="",,"|n"&R1C18&RC[-15])&IF(RC[-14]="",,"|n"&R1C19&RC[-14])&IF(RC[-13]="",,"|n"&R1C20&RC[-13])&IF(RC[-12]="",,"|n"&R1C21&RC[-12])&IF(RC[-10]="",,"|n"&R1C23&RC[-10])&IF(RC[-9]="",,"|n"&R1C24&RC[-9])&IF(RC[-8]="",,"|n"&R1C25&RC[-8])&IF(RC[-7]="",,"|n"&R1C26&RC[-7])&IF(RC[-6]="",,"|n"&R1C27&RC[-6])&IF(RC[-5]="",,"|n"&R1C28&RC[-5])&IF(RC[-2]="",,"|n"&RC[-2]) -> 
AG1212: =IF(RC[-26]&RC[-25]&RC[-24]&RC[-23]&RC[-22]&RC[-21]="",,R1C6)&IF(RC[-26]="",,"|n"&R1C7&RC[-26])&IF(RC[-25]="",,"|n"&R1C8&RC[-25])&IF(RC[-24]="",,"|n"&R1C9&RC[-24])&IF(RC[-23]="",,"|n"&R1C10&RC[-23])&IF(RC[-22]="",,"|n"&R1C11&RC[-22])&IF(RC[-21]="",,"|n"&R1C12&RC[-21])&IF(RC[-19]&RC[-18]&RC[-17]&RC[-16]="",,"|n"&R1C13)&IF(RC[-19]="",,"|n"&R1C14&RC[-19])&IF(RC[-18]="",,"|n"&R1C15&RC[-18])&IF(RC[-17]="",,"|n"&R1C16&RC[-17])&IF(RC[-16]="",,"|n"&R1C17&RC[-16])&IF(RC[-15]="",,"|n"&R1C18&RC[-15])&IF(RC[-14]="",,"|n"&R1C19&RC[-14])&IF(RC[-13]="",,"|n"&R1C20&RC[-13])&IF(RC[-12]="",,"|n"&R1C21&RC[-12])&IF(RC[-10]="",,"|n"&R1C23&RC[-10])&IF(RC[-9]="",,"|n"&R1C24&RC[-9])&IF(RC[-8]="",,"|n"&R1C25&RC[-8])&IF(RC[-7]="",,"|n"&R1C26&RC[-7])&IF(RC[-6]="",,"|n"&R1C27&RC[-6])&IF(RC[-5]="",,"|n"&R1C28&RC[-5])&IF(RC[-2]="",,"|n"&RC[-2]) -> 
AG1213: =IF(RC[-26]&RC[-25]&RC[-24]&RC[-23]&RC[-22]&RC[-21]="",,R1C6)&IF(RC[-26]="",,"|n"&R1C7&RC[-26])&IF(RC[-25]="",,"|n"&R1C8&RC[-25])&IF(RC[-24]="",,"|n"&R1C9&RC[-24])&IF(RC[-23]="",,"|n"&R1C10&RC[-23])&IF(RC[-22]="",,"|n"&R1C11&RC[-22])&IF(RC[-21]="",,"|n"&R1C12&RC[-21])&IF(RC[-19]&RC[-18]&RC[-17]&RC[-16]="",,"|n"&R1C13)&IF(RC[-19]="",,"|n"&R1C14&RC[-19])&IF(RC[-18]="",,"|n"&R1C15&RC[-18])&IF(RC[-17]="",,"|n"&R1C16&RC[-17])&IF(RC[-16]="",,"|n"&R1C17&RC[-16])&IF(RC[-15]="",,"|n"&R1C18&RC[-15])&IF(RC[-14]="",,"|n"&R1C19&RC[-14])&IF(RC[-13]="",,"|n"&R1C20&RC[-13])&IF(RC[-12]="",,"|n"&R1C21&RC[-12])&IF(RC[-10]="",,"|n"&R1C23&RC[-10])&IF(RC[-9]="",,"|n"&R1C24&RC[-9])&IF(RC[-8]="",,"|n"&R1C25&RC[-8])&IF(RC[-7]="",,"|n"&R1C26&RC[-7])&IF(RC[-6]="",,"|n"&R1C27&RC[-6])&IF(RC[-5]="",,"|n"&R1C28&RC[-5])&IF(RC[-2]="",,"|n"&RC[-2]) -> 
AG1214: =IF(RC[-26]&RC[-25]&RC[-24]&RC[-23]&RC[-22]&RC[-21]="",,R1C6)&IF(RC[-26]="",,"|n"&R1C7&RC[-26])&IF(RC[-25]="",,"|n"&R1C8&RC[-25])&IF(RC[-24]="",,"|n"&R1C9&RC[-24])&IF(RC[-23]="",,"|n"&R1C10&RC[-23])&IF(RC[-22]="",,"|n"&R1C11&RC[-22])&IF(RC[-21]="",,"|n"&R1C12&RC[-21])&IF(RC[-19]&RC[-18]&RC[-17]&RC[-16]="",,"|n"&R1C13)&IF(RC[-19]="",,"|n"&R1C14&RC[-19])&IF(RC[-18]="",,"|n"&R1C15&RC[-18])&IF(RC[-17]="",,"|n"&R1C16&RC[-17])&IF(RC[-16]="",,"|n"&R1C17&RC[-16])&IF(RC[-15]="",,"|n"&R1C18&RC[-15])&IF(RC[-14]="",,"|n"&R1C19&RC[-14])&IF(RC[-13]="",,"|n"&R1C20&RC[-13])&IF(RC[-12]="",,"|n"&R1C21&RC[-12])&IF(RC[-10]="",,"|n"&R1C23&RC[-10])&IF(RC[-9]="",,"|n"&R1C24&RC[-9])&IF(RC[-8]="",,"|n"&R1C25&RC[-8])&IF(RC[-7]="",,"|n"&R1C26&RC[-7])&IF(RC[-6]="",,"|n"&R1C27&RC[-6])&IF(RC[-5]="",,"|n"&R1C28&RC[-5])&IF(RC[-2]="",,"|n"&RC[-2]) -> 
AG1215: =IF(RC[-26]&RC[-25]&RC[-24]&RC[-23]&RC[-22]&RC[-21]="",,R1C6)&IF(RC[-26]="",,"|n"&R1C7&RC[-26])&IF(RC[-25]="",,"|n"&R1C8&RC[-25])&IF(RC[-24]="",,"|n"&R1C9&RC[-24])&IF(RC[-23]="",,"|n"&R1C10&RC[-23])&IF(RC[-22]="",,"|n"&R1C11&RC[-22])&IF(RC[-21]="",,"|n"&R1C12&RC[-21])&IF(RC[-19]&RC[-18]&RC[-17]&RC[-16]="",,"|n"&R1C13)&IF(RC[-19]="",,"|n"&R1C14&RC[-19])&IF(RC[-18]="",,"|n"&R1C15&RC[-18])&IF(RC[-17]="",,"|n"&R1C16&RC[-17])&IF(RC[-16]="",,"|n"&R1C17&RC[-16])&IF(RC[-15]="",,"|n"&R1C18&RC[-15])&IF(RC[-14]="",,"|n"&R1C19&RC[-14])&IF(RC[-13]="",,"|n"&R1C20&RC[-13])&IF(RC[-12]="",,"|n"&R1C21&RC[-12])&IF(RC[-10]="",,"|n"&R1C23&RC[-10])&IF(RC[-9]="",,"|n"&R1C24&RC[-9])&IF(RC[-8]="",,"|n"&R1C25&RC[-8])&IF(RC[-7]="",,"|n"&R1C26&RC[-7])&IF(RC[-6]="",,"|n"&R1C27&RC[-6])&IF(RC[-5]="",,"|n"&R1C28&RC[-5])&IF(RC[-2]="",,"|n"&RC[-2]) -> 
AG1216: =IF(RC[-26]&RC[-25]&RC[-24]&RC[-23]&RC[-22]&RC[-21]="",,R1C6)&IF(RC[-26]="",,"|n"&R1C7&RC[-26])&IF(RC[-25]="",,"|n"&R1C8&RC[-25])&IF(RC[-24]="",,"|n"&R1C9&RC[-24])&IF(RC[-23]="",,"|n"&R1C10&RC[-23])&IF(RC[-22]="",,"|n"&R1C11&RC[-22])&IF(RC[-21]="",,"|n"&R1C12&RC[-21])&IF(RC[-19]&RC[-18]&RC[-17]&RC[-16]="",,"|n"&R1C13)&IF(RC[-19]="",,"|n"&R1C14&RC[-19])&IF(RC[-18]="",,"|n"&R1C15&RC[-18])&IF(RC[-17]="",,"|n"&R1C16&RC[-17])&IF(RC[-16]="",,"|n"&R1C17&RC[-16])&IF(RC[-15]="",,"|n"&R1C18&RC[-15])&IF(RC[-14]="",,"|n"&R1C19&RC[-14])&IF(RC[-13]="",,"|n"&R1C20&RC[-13])&IF(RC[-12]="",,"|n"&R1C21&RC[-12])&IF(RC[-10]="",,"|n"&R1C23&RC[-10])&IF(RC[-9]="",,"|n"&R1C24&RC[-9])&IF(RC[-8]="",,"|n"&R1C25&RC[-8])&IF(RC[-7]="",,"|n"&R1C26&RC[-7])&IF(RC[-6]="",,"|n"&R1C27&RC[-6])&IF(RC[-5]="",,"|n"&R1C28&RC[-5])&IF(RC[-2]="",,"|n"&RC[-2]) -> 
AG1217: =IF(RC[-26]&RC[-25]&RC[-24]&RC[-23]&RC[-22]&RC[-21]="",,R1C6)&IF(RC[-26]="",,"|n"&R1C7&RC[-26])&IF(RC[-25]="",,"|n"&R1C8&RC[-25])&IF(RC[-24]="",,"|n"&R1C9&RC[-24])&IF(RC[-23]="",,"|n"&R1C10&RC[-23])&IF(RC[-22]="",,"|n"&R1C11&RC[-22])&IF(RC[-21]="",,"|n"&R1C12&RC[-21])&IF(RC[-19]&RC[-18]&RC[-17]&RC[-16]="",,"|n"&R1C13)&IF(RC[-19]="",,"|n"&R1C14&RC[-19])&IF(RC[-18]="",,"|n"&R1C15&RC[-18])&IF(RC[-17]="",,"|n"&R1C16&RC[-17])&IF(RC[-16]="",,"|n"&R1C17&RC[-16])&IF(RC[-15]="",,"|n"&R1C18&RC[-15])&IF(RC[-14]="",,"|n"&R1C19&RC[-14])&IF(RC[-13]="",,"|n"&R1C20&RC[-13])&IF(RC[-12]="",,"|n"&R1C21&RC[-12])&IF(RC[-10]="",,"|n"&R1C23&RC[-10])&IF(RC[-9]="",,"|n"&R1C24&RC[-9])&IF(RC[-8]="",,"|n"&R1C25&RC[-8])&IF(RC[-7]="",,"|n"&R1C26&RC[-7])&IF(RC[-6]="",,"|n"&R1C27&RC[-6])&IF(RC[-5]="",,"|n"&R1C28&RC[-5])&IF(RC[-2]="",,"|n"&RC[-2]) -> 
AG1218: =IF(RC[-26]&RC[-25]&RC[-24]&RC[-23]&RC[-22]&RC[-21]="",,R1C6)&IF(RC[-26]="",,"|n"&R1C7&RC[-26])&IF(RC[-25]="",,"|n"&R1C8&RC[-25])&IF(RC[-24]="",,"|n"&R1C9&RC[-24])&IF(RC[-23]="",,"|n"&R1C10&RC[-23])&IF(RC[-22]="",,"|n"&R1C11&RC[-22])&IF(RC[-21]="",,"|n"&R1C12&RC[-21])&IF(RC[-19]&RC[-18]&RC[-17]&RC[-16]="",,"|n"&R1C13)&IF(RC[-19]="",,"|n"&R1C14&RC[-19])&IF(RC[-18]="",,"|n"&R1C15&RC[-18])&IF(RC[-17]="",,"|n"&R1C16&RC[-17])&IF(RC[-16]="",,"|n"&R1C17&RC[-16])&IF(RC[-15]="",,"|n"&R1C18&RC[-15])&IF(RC[-14]="",,"|n"&R1C19&RC[-14])&IF(RC[-13]="",,"|n"&R1C20&RC[-13])&IF(RC[-12]="",,"|n"&R1C21&RC[-12])&IF(RC[-10]="",,"|n"&R1C23&RC[-10])&IF(RC[-9]="",,"|n"&R1C24&RC[-9])&IF(RC[-8]="",,"|n"&R1C25&RC[-8])&IF(RC[-7]="",,"|n"&R1C26&RC[-7])&IF(RC[-6]="",,"|n"&R1C27&RC[-6])&IF(RC[-5]="",,"|n"&R1C28&RC[-5])&IF(RC[-2]="",,"|n"&RC[-2]) -> 
AG1219: =IF(RC[-26]&RC[-25]&RC[-24]&RC[-23]&RC[-22]&RC[-21]="",,R1C6)&IF(RC[-26]="",,"|n"&R1C7&RC[-26])&IF(RC[-25]="",,"|n"&R1C8&RC[-25])&IF(RC[-24]="",,"|n"&R1C9&RC[-24])&IF(RC[-23]="",,"|n"&R1C10&RC[-23])&IF(RC[-22]="",,"|n"&R1C11&RC[-22])&IF(RC[-21]="",,"|n"&R1C12&RC[-21])&IF(RC[-19]&RC[-18]&RC[-17]&RC[-16]="",,"|n"&R1C13)&IF(RC[-19]="",,"|n"&R1C14&RC[-19])&IF(RC[-18]="",,"|n"&R1C15&RC[-18])&IF(RC[-17]="",,"|n"&R1C16&RC[-17])&IF(RC[-16]="",,"|n"&R1C17&RC[-16])&IF(RC[-15]="",,"|n"&R1C18&RC[-15])&IF(RC[-14]="",,"|n"&R1C19&RC[-14])&IF(RC[-13]="",,"|n"&R1C20&RC[-13])&IF(RC[-12]="",,"|n"&R1C21&RC[-12])&IF(RC[-10]="",,"|n"&R1C23&RC[-10])&IF(RC[-9]="",,"|n"&R1C24&RC[-9])&IF(RC[-8]="",,"|n"&R1C25&RC[-8])&IF(RC[-7]="",,"|n"&R1C26&RC[-7])&IF(RC[-6]="",,"|n"&R1C27&RC[-6])&IF(RC[-5]="",,"|n"&R1C28&RC[-5])&IF(RC[-2]="",,"|n"&RC[-2]) -> 
AG1220: =IF(RC[-26]&RC[-25]&RC[-24]&RC[-23]&RC[-22]&RC[-21]="",,R1C6)&IF(RC[-26]="",,"|n"&R1C7&RC[-26])&IF(RC[-25]="",,"|n"&R1C8&RC[-25])&IF(RC[-24]="",,"|n"&R1C9&RC[-24])&IF(RC[-23]="",,"|n"&R1C10&RC[-23])&IF(RC[-22]="",,"|n"&R1C11&RC[-22])&IF(RC[-21]="",,"|n"&R1C12&RC[-21])&IF(RC[-19]&RC[-18]&RC[-17]&RC[-16]="",,"|n"&R1C13)&IF(RC[-19]="",,"|n"&R1C14&RC[-19])&IF(RC[-18]="",,"|n"&R1C15&RC[-18])&IF(RC[-17]="",,"|n"&R1C16&RC[-17])&IF(RC[-16]="",,"|n"&R1C17&RC[-16])&IF(RC[-15]="",,"|n"&R1C18&RC[-15])&IF(RC[-14]="",,"|n"&R1C19&RC[-14])&IF(RC[-13]="",,"|n"&R1C20&RC[-13])&IF(RC[-12]="",,"|n"&R1C21&RC[-12])&IF(RC[-10]="",,"|n"&R1C23&RC[-10])&IF(RC[-9]="",,"|n"&R1C24&RC[-9])&IF(RC[-8]="",,"|n"&R1C25&RC[-8])&IF(RC[-7]="",,"|n"&R1C26&RC[-7])&IF(RC[-6]="",,"|n"&R1C27&RC[-6])&IF(RC[-5]="",,"|n"&R1C28&RC[-5])&IF(RC[-2]="",,"|n"&RC[-2]) -> 
AG1221: =IF(RC[-26]&RC[-25]&RC[-24]&RC[-23]&RC[-22]&RC[-21]="",,R1C6)&IF(RC[-26]="",,"|n"&R1C7&RC[-26])&IF(RC[-25]="",,"|n"&R1C8&RC[-25])&IF(RC[-24]="",,"|n"&R1C9&RC[-24])&IF(RC[-23]="",,"|n"&R1C10&RC[-23])&IF(RC[-22]="",,"|n"&R1C11&RC[-22])&IF(RC[-21]="",,"|n"&R1C12&RC[-21])&IF(RC[-19]&RC[-18]&RC[-17]&RC[-16]="",,"|n"&R1C13)&IF(RC[-19]="",,"|n"&R1C14&RC[-19])&IF(RC[-18]="",,"|n"&R1C15&RC[-18])&IF(RC[-17]="",,"|n"&R1C16&RC[-17])&IF(RC[-16]="",,"|n"&R1C17&RC[-16])&IF(RC[-15]="",,"|n"&R1C18&RC[-15])&IF(RC[-14]="",,"|n"&R1C19&RC[-14])&IF(RC[-13]="",,"|n"&R1C20&RC[-13])&IF(RC[-12]="",,"|n"&R1C21&RC[-12])&IF(RC[-10]="",,"|n"&R1C23&RC[-10])&IF(RC[-9]="",,"|n"&R1C24&RC[-9])&IF(RC[-8]="",,"|n"&R1C25&RC[-8])&IF(RC[-7]="",,"|n"&R1C26&RC[-7])&IF(RC[-6]="",,"|n"&R1C27&RC[-6])&IF(RC[-5]="",,"|n"&R1C28&RC[-5])&IF(RC[-2]="",,"|n"&RC[-2]) -> 
AG1222: =IF(RC[-26]&RC[-25]&RC[-24]&RC[-23]&RC[-22]&RC[-21]="",,R1C6)&IF(RC[-26]="",,"|n"&R1C7&RC[-26])&IF(RC[-25]="",,"|n"&R1C8&RC[-25])&IF(RC[-24]="",,"|n"&R1C9&RC[-24])&IF(RC[-23]="",,"|n"&R1C10&RC[-23])&IF(RC[-22]="",,"|n"&R1C11&RC[-22])&IF(RC[-21]="",,"|n"&R1C12&RC[-21])&IF(RC[-19]&RC[-18]&RC[-17]&RC[-16]="",,"|n"&R1C13)&IF(RC[-19]="",,"|n"&R1C14&RC[-19])&IF(RC[-18]="",,"|n"&R1C15&RC[-18])&IF(RC[-17]="",,"|n"&R1C16&RC[-17])&IF(RC[-16]="",,"|n"&R1C17&RC[-16])&IF(RC[-15]="",,"|n"&R1C18&RC[-15])&IF(RC[-14]="",,"|n"&R1C19&RC[-14])&IF(RC[-13]="",,"|n"&R1C20&RC[-13])&IF(RC[-12]="",,"|n"&R1C21&RC[-12])&IF(RC[-10]="",,"|n"&R1C23&RC[-10])&IF(RC[-9]="",,"|n"&R1C24&RC[-9])&IF(RC[-8]="",,"|n"&R1C25&RC[-8])&IF(RC[-7]="",,"|n"&R1C26&RC[-7])&IF(RC[-6]="",,"|n"&R1C27&RC[-6])&IF(RC[-5]="",,"|n"&R1C28&RC[-5])&IF(RC[-2]="",,"|n"&RC[-2]) -> 
AG1223: =IF(RC[-26]&RC[-25]&RC[-24]&RC[-23]&RC[-22]&RC[-21]="",,R1C6)&IF(RC[-26]="",,"|n"&R1C7&RC[-26])&IF(RC[-25]="",,"|n"&R1C8&RC[-25])&IF(RC[-24]="",,"|n"&R1C9&RC[-24])&IF(RC[-23]="",,"|n"&R1C10&RC[-23])&IF(RC[-22]="",,"|n"&R1C11&RC[-22])&IF(RC[-21]="",,"|n"&R1C12&RC[-21])&IF(RC[-19]&RC[-18]&RC[-17]&RC[-16]="",,"|n"&R1C13)&IF(RC[-19]="",,"|n"&R1C14&RC[-19])&IF(RC[-18]="",,"|n"&R1C15&RC[-18])&IF(RC[-17]="",,"|n"&R1C16&RC[-17])&IF(RC[-16]="",,"|n"&R1C17&RC[-16])&IF(RC[-15]="",,"|n"&R1C18&RC[-15])&IF(RC[-14]="",,"|n"&R1C19&RC[-14])&IF(RC[-13]="",,"|n"&R1C20&RC[-13])&IF(RC[-12]="",,"|n"&R1C21&RC[-12])&IF(RC[-10]="",,"|n"&R1C23&RC[-10])&IF(RC[-9]="",,"|n"&R1C24&RC[-9])&IF(RC[-8]="",,"|n"&R1C25&RC[-8])&IF(RC[-7]="",,"|n"&R1C26&RC[-7])&IF(RC[-6]="",,"|n"&R1C27&RC[-6])&IF(RC[-5]="",,"|n"&R1C28&RC[-5])&IF(RC[-2]="",,"|n"&RC[-2]) -> 
AG1224: =IF(RC[-26]&RC[-25]&RC[-24]&RC[-23]&RC[-22]&RC[-21]="",,R1C6)&IF(RC[-26]="",,"|n"&R1C7&RC[-26])&IF(RC[-25]="",,"|n"&R1C8&RC[-25])&IF(RC[-24]="",,"|n"&R1C9&RC[-24])&IF(RC[-23]="",,"|n"&R1C10&RC[-23])&IF(RC[-22]="",,"|n"&R1C11&RC[-22])&IF(RC[-21]="",,"|n"&R1C12&RC[-21])&IF(RC[-19]&RC[-18]&RC[-17]&RC[-16]="",,"|n"&R1C13)&IF(RC[-19]="",,"|n"&R1C14&RC[-19])&IF(RC[-18]="",,"|n"&R1C15&RC[-18])&IF(RC[-17]="",,"|n"&R1C16&RC[-17])&IF(RC[-16]="",,"|n"&R1C17&RC[-16])&IF(RC[-15]="",,"|n"&R1C18&RC[-15])&IF(RC[-14]="",,"|n"&R1C19&RC[-14])&IF(RC[-13]="",,"|n"&R1C20&RC[-13])&IF(RC[-12]="",,"|n"&R1C21&RC[-12])&IF(RC[-10]="",,"|n"&R1C23&RC[-10])&IF(RC[-9]="",,"|n"&R1C24&RC[-9])&IF(RC[-8]="",,"|n"&R1C25&RC[-8])&IF(RC[-7]="",,"|n"&R1C26&RC[-7])&IF(RC[-6]="",,"|n"&R1C27&RC[-6])&IF(RC[-5]="",,"|n"&R1C28&RC[-5])&IF(RC[-2]="",,"|n"&RC[-2]) -> 
AG1225: =IF(RC[-26]&RC[-25]&RC[-24]&RC[-23]&RC[-22]&RC[-21]="",,R1C6)&IF(RC[-26]="",,"|n"&R1C7&RC[-26])&IF(RC[-25]="",,"|n"&R1C8&RC[-25])&IF(RC[-24]="",,"|n"&R1C9&RC[-24])&IF(RC[-23]="",,"|n"&R1C10&RC[-23])&IF(RC[-22]="",,"|n"&R1C11&RC[-22])&IF(RC[-21]="",,"|n"&R1C12&RC[-21])&IF(RC[-19]&RC[-18]&RC[-17]&RC[-16]="",,"|n"&R1C13)&IF(RC[-19]="",,"|n"&R1C14&RC[-19])&IF(RC[-18]="",,"|n"&R1C15&RC[-18])&IF(RC[-17]="",,"|n"&R1C16&RC[-17])&IF(RC[-16]="",,"|n"&R1C17&RC[-16])&IF(RC[-15]="",,"|n"&R1C18&RC[-15])&IF(RC[-14]="",,"|n"&R1C19&RC[-14])&IF(RC[-13]="",,"|n"&R1C20&RC[-13])&IF(RC[-12]="",,"|n"&R1C21&RC[-12])&IF(RC[-10]="",,"|n"&R1C23&RC[-10])&IF(RC[-9]="",,"|n"&R1C24&RC[-9])&IF(RC[-8]="",,"|n"&R1C25&RC[-8])&IF(RC[-7]="",,"|n"&R1C26&RC[-7])&IF(RC[-6]="",,"|n"&R1C27&RC[-6])&IF(RC[-5]="",,"|n"&R1C28&RC[-5])&IF(RC[-2]="",,"|n"&RC[-2]) -> 
AG1226: =IF(RC[-26]&RC[-25]&RC[-24]&RC[-23]&RC[-22]&RC[-21]="",,R1C6)&IF(RC[-26]="",,"|n"&R1C7&RC[-26])&IF(RC[-25]="",,"|n"&R1C8&RC[-25])&IF(RC[-24]="",,"|n"&R1C9&RC[-24])&IF(RC[-23]="",,"|n"&R1C10&RC[-23])&IF(RC[-22]="",,"|n"&R1C11&RC[-22])&IF(RC[-21]="",,"|n"&R1C12&RC[-21])&IF(RC[-19]&RC[-18]&RC[-17]&RC[-16]="",,"|n"&R1C13)&IF(RC[-19]="",,"|n"&R1C14&RC[-19])&IF(RC[-18]="",,"|n"&R1C15&RC[-18])&IF(RC[-17]="",,"|n"&R1C16&RC[-17])&IF(RC[-16]="",,"|n"&R1C17&RC[-16])&IF(RC[-15]="",,"|n"&R1C18&RC[-15])&IF(RC[-14]="",,"|n"&R1C19&RC[-14])&IF(RC[-13]="",,"|n"&R1C20&RC[-13])&IF(RC[-12]="",,"|n"&R1C21&RC[-12])&IF(RC[-10]="",,"|n"&R1C23&RC[-10])&IF(RC[-9]="",,"|n"&R1C24&RC[-9])&IF(RC[-8]="",,"|n"&R1C25&RC[-8])&IF(RC[-7]="",,"|n"&R1C26&RC[-7])&IF(RC[-6]="",,"|n"&R1C27&RC[-6])&IF(RC[-5]="",,"|n"&R1C28&RC[-5])&IF(RC[-2]="",,"|n"&RC[-2]) -> 
AG1227: =IF(RC[-26]&RC[-25]&RC[-24]&RC[-23]&RC[-22]&RC[-21]="",,R1C6)&IF(RC[-26]="",,"|n"&R1C7&RC[-26])&IF(RC[-25]="",,"|n"&R1C8&RC[-25])&IF(RC[-24]="",,"|n"&R1C9&RC[-24])&IF(RC[-23]="",,"|n"&R1C10&RC[-23])&IF(RC[-22]="",,"|n"&R1C11&RC[-22])&IF(RC[-21]="",,"|n"&R1C12&RC[-21])&IF(RC[-19]&RC[-18]&RC[-17]&RC[-16]="",,"|n"&R1C13)&IF(RC[-19]="",,"|n"&R1C14&RC[-19])&IF(RC[-18]="",,"|n"&R1C15&RC[-18])&IF(RC[-17]="",,"|n"&R1C16&RC[-17])&IF(RC[-16]="",,"|n"&R1C17&RC[-16])&IF(RC[-15]="",,"|n"&R1C18&RC[-15])&IF(RC[-14]="",,"|n"&R1C19&RC[-14])&IF(RC[-13]="",,"|n"&R1C20&RC[-13])&IF(RC[-12]="",,"|n"&R1C21&RC[-12])&IF(RC[-10]="",,"|n"&R1C23&RC[-10])&IF(RC[-9]="",,"|n"&R1C24&RC[-9])&IF(RC[-8]="",,"|n"&R1C25&RC[-8])&IF(RC[-7]="",,"|n"&R1C26&RC[-7])&IF(RC[-6]="",,"|n"&R1C27&RC[-6])&IF(RC[-5]="",,"|n"&R1C28&RC[-5])&IF(RC[-2]="",,"|n"&RC[-2]) -> 
AG1228: =IF(RC[-26]&RC[-25]&RC[-24]&RC[-23]&RC[-22]&RC[-21]="",,R1C6)&IF(RC[-26]="",,"|n"&R1C7&RC[-26])&IF(RC[-25]="",,"|n"&R1C8&RC[-25])&IF(RC[-24]="",,"|n"&R1C9&RC[-24])&IF(RC[-23]="",,"|n"&R1C10&RC[-23])&IF(RC[-22]="",,"|n"&R1C11&RC[-22])&IF(RC[-21]="",,"|n"&R1C12&RC[-21])&IF(RC[-19]&RC[-18]&RC[-17]&RC[-16]="",,"|n"&R1C13)&IF(RC[-19]="",,"|n"&R1C14&RC[-19])&IF(RC[-18]="",,"|n"&R1C15&RC[-18])&IF(RC[-17]="",,"|n"&R1C16&RC[-17])&IF(RC[-16]="",,"|n"&R1C17&RC[-16])&IF(RC[-15]="",,"|n"&R1C18&RC[-15])&IF(RC[-14]="",,"|n"&R1C19&RC[-14])&IF(RC[-13]="",,"|n"&R1C20&RC[-13])&IF(RC[-12]="",,"|n"&R1C21&RC[-12])&IF(RC[-10]="",,"|n"&R1C23&RC[-10])&IF(RC[-9]="",,"|n"&R1C24&RC[-9])&IF(RC[-8]="",,"|n"&R1C25&RC[-8])&IF(RC[-7]="",,"|n"&R1C26&RC[-7])&IF(RC[-6]="",,"|n"&R1C27&RC[-6])&IF(RC[-5]="",,"|n"&R1C28&RC[-5])&IF(RC[-2]="",,"|n"&RC[-2]) -> 
AG1229: =IF(RC[-26]&RC[-25]&RC[-24]&RC[-23]&RC[-22]&RC[-21]="",,R1C6)&IF(RC[-26]="",,"|n"&R1C7&RC[-26])&IF(RC[-25]="",,"|n"&R1C8&RC[-25])&IF(RC[-24]="",,"|n"&R1C9&RC[-24])&IF(RC[-23]="",,"|n"&R1C10&RC[-23])&IF(RC[-22]="",,"|n"&R1C11&RC[-22])&IF(RC[-21]="",,"|n"&R1C12&RC[-21])&IF(RC[-19]&RC[-18]&RC[-17]&RC[-16]="",,"|n"&R1C13)&IF(RC[-19]="",,"|n"&R1C14&RC[-19])&IF(RC[-18]="",,"|n"&R1C15&RC[-18])&IF(RC[-17]="",,"|n"&R1C16&RC[-17])&IF(RC[-16]="",,"|n"&R1C17&RC[-16])&IF(RC[-15]="",,"|n"&R1C18&RC[-15])&IF(RC[-14]="",,"|n"&R1C19&RC[-14])&IF(RC[-13]="",,"|n"&R1C20&RC[-13])&IF(RC[-12]="",,"|n"&R1C21&RC[-12])&IF(RC[-10]="",,"|n"&R1C23&RC[-10])&IF(RC[-9]="",,"|n"&R1C24&RC[-9])&IF(RC[-8]="",,"|n"&R1C25&RC[-8])&IF(RC[-7]="",,"|n"&R1C26&RC[-7])&IF(RC[-6]="",,"|n"&R1C27&RC[-6])&IF(RC[-5]="",,"|n"&R1C28&RC[-5])&IF(RC[-2]="",,"|n"&RC[-2]) -> 
AG1230: =IF(RC[-26]&RC[-25]&RC[-24]&RC[-23]&RC[-22]&RC[-21]="",,R1C6)&IF(RC[-26]="",,"|n"&R1C7&RC[-26])&IF(RC[-25]="",,"|n"&R1C8&RC[-25])&IF(RC[-24]="",,"|n"&R1C9&RC[-24])&IF(RC[-23]="",,"|n"&R1C10&RC[-23])&IF(RC[-22]="",,"|n"&R1C11&RC[-22])&IF(RC[-21]="",,"|n"&R1C12&RC[-21])&IF(RC[-19]&RC[-18]&RC[-17]&RC[-16]="",,"|n"&R1C13)&IF(RC[-19]="",,"|n"&R1C14&RC[-19])&IF(RC[-18]="",,"|n"&R1C15&RC[-18])&IF(RC[-17]="",,"|n"&R1C16&RC[-17])&IF(RC[-16]="",,"|n"&R1C17&RC[-16])&IF(RC[-15]="",,"|n"&R1C18&RC[-15])&IF(RC[-14]="",,"|n"&R1C19&RC[-14])&IF(RC[-13]="",,"|n"&R1C20&RC[-13])&IF(RC[-12]="",,"|n"&R1C21&RC[-12])&IF(RC[-10]="",,"|n"&R1C23&RC[-10])&IF(RC[-9]="",,"|n"&R1C24&RC[-9])&IF(RC[-8]="",,"|n"&R1C25&RC[-8])&IF(RC[-7]="",,"|n"&R1C26&RC[-7])&IF(RC[-6]="",,"|n"&R1C27&RC[-6])&IF(RC[-5]="",,"|n"&R1C28&RC[-5])&IF(RC[-2]="",,"|n"&RC[-2]) -> 
AG1231: =IF(RC[-26]&RC[-25]&RC[-24]&RC[-23]&RC[-22]&RC[-21]="",,R1C6)&IF(RC[-26]="",,"|n"&R1C7&RC[-26])&IF(RC[-25]="",,"|n"&R1C8&RC[-25])&IF(RC[-24]="",,"|n"&R1C9&RC[-24])&IF(RC[-23]="",,"|n"&R1C10&RC[-23])&IF(RC[-22]="",,"|n"&R1C11&RC[-22])&IF(RC[-21]="",,"|n"&R1C12&RC[-21])&IF(RC[-19]&RC[-18]&RC[-17]&RC[-16]="",,"|n"&R1C13)&IF(RC[-19]="",,"|n"&R1C14&RC[-19])&IF(RC[-18]="",,"|n"&R1C15&RC[-18])&IF(RC[-17]="",,"|n"&R1C16&RC[-17])&IF(RC[-16]="",,"|n"&R1C17&RC[-16])&IF(RC[-15]="",,"|n"&R1C18&RC[-15])&IF(RC[-14]="",,"|n"&R1C19&RC[-14])&IF(RC[-13]="",,"|n"&R1C20&RC[-13])&IF(RC[-12]="",,"|n"&R1C21&RC[-12])&IF(RC[-10]="",,"|n"&R1C23&RC[-10])&IF(RC[-9]="",,"|n"&R1C24&RC[-9])&IF(RC[-8]="",,"|n"&R1C25&RC[-8])&IF(RC[-7]="",,"|n"&R1C26&RC[-7])&IF(RC[-6]="",,"|n"&R1C27&RC[-6])&IF(RC[-5]="",,"|n"&R1C28&RC[-5])&IF(RC[-2]="",,"|n"&RC[-2]) -> 
AG1232: =IF(RC[-26]&RC[-25]&RC[-24]&RC[-23]&RC[-22]&RC[-21]="",,R1C6)&IF(RC[-26]="",,"|n"&R1C7&RC[-26])&IF(RC[-25]="",,"|n"&R1C8&RC[-25])&IF(RC[-24]="",,"|n"&R1C9&RC[-24])&IF(RC[-23]="",,"|n"&R1C10&RC[-23])&IF(RC[-22]="",,"|n"&R1C11&RC[-22])&IF(RC[-21]="",,"|n"&R1C12&RC[-21])&IF(RC[-19]&RC[-18]&RC[-17]&RC[-16]="",,"|n"&R1C13)&IF(RC[-19]="",,"|n"&R1C14&RC[-19])&IF(RC[-18]="",,"|n"&R1C15&RC[-18])&IF(RC[-17]="",,"|n"&R1C16&RC[-17])&IF(RC[-16]="",,"|n"&R1C17&RC[-16])&IF(RC[-15]="",,"|n"&R1C18&RC[-15])&IF(RC[-14]="",,"|n"&R1C19&RC[-14])&IF(RC[-13]="",,"|n"&R1C20&RC[-13])&IF(RC[-12]="",,"|n"&R1C21&RC[-12])&IF(RC[-10]="",,"|n"&R1C23&RC[-10])&IF(RC[-9]="",,"|n"&R1C24&RC[-9])&IF(RC[-8]="",,"|n"&R1C25&RC[-8])&IF(RC[-7]="",,"|n"&R1C26&RC[-7])&IF(RC[-6]="",,"|n"&R1C27&RC[-6])&IF(RC[-5]="",,"|n"&R1C28&RC[-5])&IF(RC[-2]="",,"|n"&RC[-2]) -> 
AG1233: =IF(RC[-26]&RC[-25]&RC[-24]&RC[-23]&RC[-22]&RC[-21]="",,R1C6)&IF(RC[-26]="",,"|n"&R1C7&RC[-26])&IF(RC[-25]="",,"|n"&R1C8&RC[-25])&IF(RC[-24]="",,"|n"&R1C9&RC[-24])&IF(RC[-23]="",,"|n"&R1C10&RC[-23])&IF(RC[-22]="",,"|n"&R1C11&RC[-22])&IF(RC[-21]="",,"|n"&R1C12&RC[-21])&IF(RC[-19]&RC[-18]&RC[-17]&RC[-16]="",,"|n"&R1C13)&IF(RC[-19]="",,"|n"&R1C14&RC[-19])&IF(RC[-18]="",,"|n"&R1C15&RC[-18])&IF(RC[-17]="",,"|n"&R1C16&RC[-17])&IF(RC[-16]="",,"|n"&R1C17&RC[-16])&IF(RC[-15]="",,"|n"&R1C18&RC[-15])&IF(RC[-14]="",,"|n"&R1C19&RC[-14])&IF(RC[-13]="",,"|n"&R1C20&RC[-13])&IF(RC[-12]="",,"|n"&R1C21&RC[-12])&IF(RC[-10]="",,"|n"&R1C23&RC[-10])&IF(RC[-9]="",,"|n"&R1C24&RC[-9])&IF(RC[-8]="",,"|n"&R1C25&RC[-8])&IF(RC[-7]="",,"|n"&R1C26&RC[-7])&IF(RC[-6]="",,"|n"&R1C27&RC[-6])&IF(RC[-5]="",,"|n"&R1C28&RC[-5])&IF(RC[-2]="",,"|n"&RC[-2]) -> 
AG1234: =IF(RC[-26]&RC[-25]&RC[-24]&RC[-23]&RC[-22]&RC[-21]="",,R1C6)&IF(RC[-26]="",,"|n"&R1C7&RC[-26])&IF(RC[-25]="",,"|n"&R1C8&RC[-25])&IF(RC[-24]="",,"|n"&R1C9&RC[-24])&IF(RC[-23]="",,"|n"&R1C10&RC[-23])&IF(RC[-22]="",,"|n"&R1C11&RC[-22])&IF(RC[-21]="",,"|n"&R1C12&RC[-21])&IF(RC[-19]&RC[-18]&RC[-17]&RC[-16]="",,"|n"&R1C13)&IF(RC[-19]="",,"|n"&R1C14&RC[-19])&IF(RC[-18]="",,"|n"&R1C15&RC[-18])&IF(RC[-17]="",,"|n"&R1C16&RC[-17])&IF(RC[-16]="",,"|n"&R1C17&RC[-16])&IF(RC[-15]="",,"|n"&R1C18&RC[-15])&IF(RC[-14]="",,"|n"&R1C19&RC[-14])&IF(RC[-13]="",,"|n"&R1C20&RC[-13])&IF(RC[-12]="",,"|n"&R1C21&RC[-12])&IF(RC[-10]="",,"|n"&R1C23&RC[-10])&IF(RC[-9]="",,"|n"&R1C24&RC[-9])&IF(RC[-8]="",,"|n"&R1C25&RC[-8])&IF(RC[-7]="",,"|n"&R1C26&RC[-7])&IF(RC[-6]="",,"|n"&R1C27&RC[-6])&IF(RC[-5]="",,"|n"&R1C28&RC[-5])&IF(RC[-2]="",,"|n"&RC[-2]) -> 
AG1235: =IF(RC[-26]&RC[-25]&RC[-24]&RC[-23]&RC[-22]&RC[-21]="",,R1C6)&IF(RC[-26]="",,"|n"&R1C7&RC[-26])&IF(RC[-25]="",,"|n"&R1C8&RC[-25])&IF(RC[-24]="",,"|n"&R1C9&RC[-24])&IF(RC[-23]="",,"|n"&R1C10&RC[-23])&IF(RC[-22]="",,"|n"&R1C11&RC[-22])&IF(RC[-21]="",,"|n"&R1C12&RC[-21])&IF(RC[-19]&RC[-18]&RC[-17]&RC[-16]="",,"|n"&R1C13)&IF(RC[-19]="",,"|n"&R1C14&RC[-19])&IF(RC[-18]="",,"|n"&R1C15&RC[-18])&IF(RC[-17]="",,"|n"&R1C16&RC[-17])&IF(RC[-16]="",,"|n"&R1C17&RC[-16])&IF(RC[-15]="",,"|n"&R1C18&RC[-15])&IF(RC[-14]="",,"|n"&R1C19&RC[-14])&IF(RC[-13]="",,"|n"&R1C20&RC[-13])&IF(RC[-12]="",,"|n"&R1C21&RC[-12])&IF(RC[-10]="",,"|n"&R1C23&RC[-10])&IF(RC[-9]="",,"|n"&R1C24&RC[-9])&IF(RC[-8]="",,"|n"&R1C25&RC[-8])&IF(RC[-7]="",,"|n"&R1C26&RC[-7])&IF(RC[-6]="",,"|n"&R1C27&RC[-6])&IF(RC[-5]="",,"|n"&R1C28&RC[-5])&IF(RC[-2]="",,"|n"&RC[-2]) -> 
AG1236: =IF(RC[-26]&RC[-25]&RC[-24]&RC[-23]&RC[-22]&RC[-21]="",,R1C6)&IF(RC[-26]="",,"|n"&R1C7&RC[-26])&IF(RC[-25]="",,"|n"&R1C8&RC[-25])&IF(RC[-24]="",,"|n"&R1C9&RC[-24])&IF(RC[-23]="",,"|n"&R1C10&RC[-23])&IF(RC[-22]="",,"|n"&R1C11&RC[-22])&IF(RC[-21]="",,"|n"&R1C12&RC[-21])&IF(RC[-19]&RC[-18]&RC[-17]&RC[-16]="",,"|n"&R1C13)&IF(RC[-19]="",,"|n"&R1C14&RC[-19])&IF(RC[-18]="",,"|n"&R1C15&RC[-18])&IF(RC[-17]="",,"|n"&R1C16&RC[-17])&IF(RC[-16]="",,"|n"&R1C17&RC[-16])&IF(RC[-15]="",,"|n"&R1C18&RC[-15])&IF(RC[-14]="",,"|n"&R1C19&RC[-14])&IF(RC[-13]="",,"|n"&R1C20&RC[-13])&IF(RC[-12]="",,"|n"&R1C21&RC[-12])&IF(RC[-10]="",,"|n"&R1C23&RC[-10])&IF(RC[-9]="",,"|n"&R1C24&RC[-9])&IF(RC[-8]="",,"|n"&R1C25&RC[-8])&IF(RC[-7]="",,"|n"&R1C26&RC[-7])&IF(RC[-6]="",,"|n"&R1C27&RC[-6])&IF(RC[-5]="",,"|n"&R1C28&RC[-5])&IF(RC[-2]="",,"|n"&RC[-2]) -> 
AG1237: =IF(RC[-26]&RC[-25]&RC[-24]&RC[-23]&RC[-22]&RC[-21]="",,R1C6)&IF(RC[-26]="",,"|n"&R1C7&RC[-26])&IF(RC[-25]="",,"|n"&R1C8&RC[-25])&IF(RC[-24]="",,"|n"&R1C9&RC[-24])&IF(RC[-23]="",,"|n"&R1C10&RC[-23])&IF(RC[-22]="",,"|n"&R1C11&RC[-22])&IF(RC[-21]="",,"|n"&R1C12&RC[-21])&IF(RC[-19]&RC[-18]&RC[-17]&RC[-16]="",,"|n"&R1C13)&IF(RC[-19]="",,"|n"&R1C14&RC[-19])&IF(RC[-18]="",,"|n"&R1C15&RC[-18])&IF(RC[-17]="",,"|n"&R1C16&RC[-17])&IF(RC[-16]="",,"|n"&R1C17&RC[-16])&IF(RC[-15]="",,"|n"&R1C18&RC[-15])&IF(RC[-14]="",,"|n"&R1C19&RC[-14])&IF(RC[-13]="",,"|n"&R1C20&RC[-13])&IF(RC[-12]="",,"|n"&R1C21&RC[-12])&IF(RC[-10]="",,"|n"&R1C23&RC[-10])&IF(RC[-9]="",,"|n"&R1C24&RC[-9])&IF(RC[-8]="",,"|n"&R1C25&RC[-8])&IF(RC[-7]="",,"|n"&R1C26&RC[-7])&IF(RC[-6]="",,"|n"&R1C27&RC[-6])&IF(RC[-5]="",,"|n"&R1C28&RC[-5])&IF(RC[-2]="",,"|n"&RC[-2]) -> 
AG1238: =IF(RC[-26]&RC[-25]&RC[-24]&RC[-23]&RC[-22]&RC[-21]="",,R1C6)&IF(RC[-26]="",,"|n"&R1C7&RC[-26])&IF(RC[-25]="",,"|n"&R1C8&RC[-25])&IF(RC[-24]="",,"|n"&R1C9&RC[-24])&IF(RC[-23]="",,"|n"&R1C10&RC[-23])&IF(RC[-22]="",,"|n"&R1C11&RC[-22])&IF(RC[-21]="",,"|n"&R1C12&RC[-21])&IF(RC[-19]&RC[-18]&RC[-17]&RC[-16]="",,"|n"&R1C13)&IF(RC[-19]="",,"|n"&R1C14&RC[-19])&IF(RC[-18]="",,"|n"&R1C15&RC[-18])&IF(RC[-17]="",,"|n"&R1C16&RC[-17])&IF(RC[-16]="",,"|n"&R1C17&RC[-16])&IF(RC[-15]="",,"|n"&R1C18&RC[-15])&IF(RC[-14]="",,"|n"&R1C19&RC[-14])&IF(RC[-13]="",,"|n"&R1C20&RC[-13])&IF(RC[-12]="",,"|n"&R1C21&RC[-12])&IF(RC[-10]="",,"|n"&R1C23&RC[-10])&IF(RC[-9]="",,"|n"&R1C24&RC[-9])&IF(RC[-8]="",,"|n"&R1C25&RC[-8])&IF(RC[-7]="",,"|n"&R1C26&RC[-7])&IF(RC[-6]="",,"|n"&R1C27&RC[-6])&IF(RC[-5]="",,"|n"&R1C28&RC[-5])&IF(RC[-2]="",,"|n"&RC[-2]) -> 
AG1239: =IF(RC[-26]&RC[-25]&RC[-24]&RC[-23]&RC[-22]&RC[-21]="",,R1C6)&IF(RC[-26]="",,"|n"&R1C7&RC[-26])&IF(RC[-25]="",,"|n"&R1C8&RC[-25])&IF(RC[-24]="",,"|n"&R1C9&RC[-24])&IF(RC[-23]="",,"|n"&R1C10&RC[-23])&IF(RC[-22]="",,"|n"&R1C11&RC[-22])&IF(RC[-21]="",,"|n"&R1C12&RC[-21])&IF(RC[-19]&RC[-18]&RC[-17]&RC[-16]="",,"|n"&R1C13)&IF(RC[-19]="",,"|n"&R1C14&RC[-19])&IF(RC[-18]="",,"|n"&R1C15&RC[-18])&IF(RC[-17]="",,"|n"&R1C16&RC[-17])&IF(RC[-16]="",,"|n"&R1C17&RC[-16])&IF(RC[-15]="",,"|n"&R1C18&RC[-15])&IF(RC[-14]="",,"|n"&R1C19&RC[-14])&IF(RC[-13]="",,"|n"&R1C20&RC[-13])&IF(RC[-12]="",,"|n"&R1C21&RC[-12])&IF(RC[-10]="",,"|n"&R1C23&RC[-10])&IF(RC[-9]="",,"|n"&R1C24&RC[-9])&IF(RC[-8]="",,"|n"&R1C25&RC[-8])&IF(RC[-7]="",,"|n"&R1C26&RC[-7])&IF(RC[-6]="",,"|n"&R1C27&RC[-6])&IF(RC[-5]="",,"|n"&R1C28&RC[-5])&IF(RC[-2]="",,"|n"&RC[-2]) -> 
AG1240: =IF(RC[-26]&RC[-25]&RC[-24]&RC[-23]&RC[-22]&RC[-21]="",,R1C6)&IF(RC[-26]="",,"|n"&R1C7&RC[-26])&IF(RC[-25]="",,"|n"&R1C8&RC[-25])&IF(RC[-24]="",,"|n"&R1C9&RC[-24])&IF(RC[-23]="",,"|n"&R1C10&RC[-23])&IF(RC[-22]="",,"|n"&R1C11&RC[-22])&IF(RC[-21]="",,"|n"&R1C12&RC[-21])&IF(RC[-19]&RC[-18]&RC[-17]&RC[-16]="",,"|n"&R1C13)&IF(RC[-19]="",,"|n"&R1C14&RC[-19])&IF(RC[-18]="",,"|n"&R1C15&RC[-18])&IF(RC[-17]="",,"|n"&R1C16&RC[-17])&IF(RC[-16]="",,"|n"&R1C17&RC[-16])&IF(RC[-15]="",,"|n"&R1C18&RC[-15])&IF(RC[-14]="",,"|n"&R1C19&RC[-14])&IF(RC[-13]="",,"|n"&R1C20&RC[-13])&IF(RC[-12]="",,"|n"&R1C21&RC[-12])&IF(RC[-10]="",,"|n"&R1C23&RC[-10])&IF(RC[-9]="",,"|n"&R1C24&RC[-9])&IF(RC[-8]="",,"|n"&R1C25&RC[-8])&IF(RC[-7]="",,"|n"&R1C26&RC[-7])&IF(RC[-6]="",,"|n"&R1C27&RC[-6])&IF(RC[-5]="",,"|n"&R1C28&RC[-5])&IF(RC[-2]="",,"|n"&RC[-2]) -> 
AG1241: =IF(RC[-26]&RC[-25]&RC[-24]&RC[-23]&RC[-22]&RC[-21]="",,R1C6)&IF(RC[-26]="",,"|n"&R1C7&RC[-26])&IF(RC[-25]="",,"|n"&R1C8&RC[-25])&IF(RC[-24]="",,"|n"&R1C9&RC[-24])&IF(RC[-23]="",,"|n"&R1C10&RC[-23])&IF(RC[-22]="",,"|n"&R1C11&RC[-22])&IF(RC[-21]="",,"|n"&R1C12&RC[-21])&IF(RC[-19]&RC[-18]&RC[-17]&RC[-16]="",,"|n"&R1C13)&IF(RC[-19]="",,"|n"&R1C14&RC[-19])&IF(RC[-18]="",,"|n"&R1C15&RC[-18])&IF(RC[-17]="",,"|n"&R1C16&RC[-17])&IF(RC[-16]="",,"|n"&R1C17&RC[-16])&IF(RC[-15]="",,"|n"&R1C18&RC[-15])&IF(RC[-14]="",,"|n"&R1C19&RC[-14])&IF(RC[-13]="",,"|n"&R1C20&RC[-13])&IF(RC[-12]="",,"|n"&R1C21&RC[-12])&IF(RC[-10]="",,"|n"&R1C23&RC[-10])&IF(RC[-9]="",,"|n"&R1C24&RC[-9])&IF(RC[-8]="",,"|n"&R1C25&RC[-8])&IF(RC[-7]="",,"|n"&R1C26&RC[-7])&IF(RC[-6]="",,"|n"&R1C27&RC[-6])&IF(RC[-5]="",,"|n"&R1C28&RC[-5])&IF(RC[-2]="",,"|n"&RC[-2]) -> 
AG1242: =IF(RC[-26]&RC[-25]&RC[-24]&RC[-23]&RC[-22]&RC[-21]="",,R1C6)&IF(RC[-26]="",,"|n"&R1C7&RC[-26])&IF(RC[-25]="",,"|n"&R1C8&RC[-25])&IF(RC[-24]="",,"|n"&R1C9&RC[-24])&IF(RC[-23]="",,"|n"&R1C10&RC[-23])&IF(RC[-22]="",,"|n"&R1C11&RC[-22])&IF(RC[-21]="",,"|n"&R1C12&RC[-21])&IF(RC[-19]&RC[-18]&RC[-17]&RC[-16]="",,"|n"&R1C13)&IF(RC[-19]="",,"|n"&R1C14&RC[-19])&IF(RC[-18]="",,"|n"&R1C15&RC[-18])&IF(RC[-17]="",,"|n"&R1C16&RC[-17])&IF(RC[-16]="",,"|n"&R1C17&RC[-16])&IF(RC[-15]="",,"|n"&R1C18&RC[-15])&IF(RC[-14]="",,"|n"&R1C19&RC[-14])&IF(RC[-13]="",,"|n"&R1C20&RC[-13])&IF(RC[-12]="",,"|n"&R1C21&RC[-12])&IF(RC[-10]="",,"|n"&R1C23&RC[-10])&IF(RC[-9]="",,"|n"&R1C24&RC[-9])&IF(RC[-8]="",,"|n"&R1C25&RC[-8])&IF(RC[-7]="",,"|n"&R1C26&RC[-7])&IF(RC[-6]="",,"|n"&R1C27&RC[-6])&IF(RC[-5]="",,"|n"&R1C28&RC[-5])&IF(RC[-2]="",,"|n"&RC[-2]) -> 
AG1243: =IF(RC[-26]&RC[-25]&RC[-24]&RC[-23]&RC[-22]&RC[-21]="",,R1C6)&IF(RC[-26]="",,"|n"&R1C7&RC[-26])&IF(RC[-25]="",,"|n"&R1C8&RC[-25])&IF(RC[-24]="",,"|n"&R1C9&RC[-24])&IF(RC[-23]="",,"|n"&R1C10&RC[-23])&IF(RC[-22]="",,"|n"&R1C11&RC[-22])&IF(RC[-21]="",,"|n"&R1C12&RC[-21])&IF(RC[-19]&RC[-18]&RC[-17]&RC[-16]="",,"|n"&R1C13)&IF(RC[-19]="",,"|n"&R1C14&RC[-19])&IF(RC[-18]="",,"|n"&R1C15&RC[-18])&IF(RC[-17]="",,"|n"&R1C16&RC[-17])&IF(RC[-16]="",,"|n"&R1C17&RC[-16])&IF(RC[-15]="",,"|n"&R1C18&RC[-15])&IF(RC[-14]="",,"|n"&R1C19&RC[-14])&IF(RC[-13]="",,"|n"&R1C20&RC[-13])&IF(RC[-12]="",,"|n"&R1C21&RC[-12])&IF(RC[-10]="",,"|n"&R1C23&RC[-10])&IF(RC[-9]="",,"|n"&R1C24&RC[-9])&IF(RC[-8]="",,"|n"&R1C25&RC[-8])&IF(RC[-7]="",,"|n"&R1C26&RC[-7])&IF(RC[-6]="",,"|n"&R1C27&RC[-6])&IF(RC[-5]="",,"|n"&R1C28&RC[-5])&IF(RC[-2]="",,"|n"&RC[-2]) -> 
AG1244: =IF(RC[-26]&RC[-25]&RC[-24]&RC[-23]&RC[-22]&RC[-21]="",,R1C6)&IF(RC[-26]="",,"|n"&R1C7&RC[-26])&IF(RC[-25]="",,"|n"&R1C8&RC[-25])&IF(RC[-24]="",,"|n"&R1C9&RC[-24])&IF(RC[-23]="",,"|n"&R1C10&RC[-23])&IF(RC[-22]="",,"|n"&R1C11&RC[-22])&IF(RC[-21]="",,"|n"&R1C12&RC[-21])&IF(RC[-19]&RC[-18]&RC[-17]&RC[-16]="",,"|n"&R1C13)&IF(RC[-19]="",,"|n"&R1C14&RC[-19])&IF(RC[-18]="",,"|n"&R1C15&RC[-18])&IF(RC[-17]="",,"|n"&R1C16&RC[-17])&IF(RC[-16]="",,"|n"&R1C17&RC[-16])&IF(RC[-15]="",,"|n"&R1C18&RC[-15])&IF(RC[-14]="",,"|n"&R1C19&RC[-14])&IF(RC[-13]="",,"|n"&R1C20&RC[-13])&IF(RC[-12]="",,"|n"&R1C21&RC[-12])&IF(RC[-10]="",,"|n"&R1C23&RC[-10])&IF(RC[-9]="",,"|n"&R1C24&RC[-9])&IF(RC[-8]="",,"|n"&R1C25&RC[-8])&IF(RC[-7]="",,"|n"&R1C26&RC[-7])&IF(RC[-6]="",,"|n"&R1C27&RC[-6])&IF(RC[-5]="",,"|n"&R1C28&RC[-5])&IF(RC[-2]="",,"|n"&RC[-2]) -> 
AG1245: =IF(RC[-26]&RC[-25]&RC[-24]&RC[-23]&RC[-22]&RC[-21]="",,R1C6)&IF(RC[-26]="",,"|n"&R1C7&RC[-26])&IF(RC[-25]="",,"|n"&R1C8&RC[-25])&IF(RC[-24]="",,"|n"&R1C9&RC[-24])&IF(RC[-23]="",,"|n"&R1C10&RC[-23])&IF(RC[-22]="",,"|n"&R1C11&RC[-22])&IF(RC[-21]="",,"|n"&R1C12&RC[-21])&IF(RC[-19]&RC[-18]&RC[-17]&RC[-16]="",,"|n"&R1C13)&IF(RC[-19]="",,"|n"&R1C14&RC[-19])&IF(RC[-18]="",,"|n"&R1C15&RC[-18])&IF(RC[-17]="",,"|n"&R1C16&RC[-17])&IF(RC[-16]="",,"|n"&R1C17&RC[-16])&IF(RC[-15]="",,"|n"&R1C18&RC[-15])&IF(RC[-14]="",,"|n"&R1C19&RC[-14])&IF(RC[-13]="",,"|n"&R1C20&RC[-13])&IF(RC[-12]="",,"|n"&R1C21&RC[-12])&IF(RC[-10]="",,"|n"&R1C23&RC[-10])&IF(RC[-9]="",,"|n"&R1C24&RC[-9])&IF(RC[-8]="",,"|n"&R1C25&RC[-8])&IF(RC[-7]="",,"|n"&R1C26&RC[-7])&IF(RC[-6]="",,"|n"&R1C27&RC[-6])&IF(RC[-5]="",,"|n"&R1C28&RC[-5])&IF(RC[-2]="",,"|n"&RC[-2]) -> 
AG1246: =IF(RC[-26]&RC[-25]&RC[-24]&RC[-23]&RC[-22]&RC[-21]="",,R1C6)&IF(RC[-26]="",,"|n"&R1C7&RC[-26])&IF(RC[-25]="",,"|n"&R1C8&RC[-25])&IF(RC[-24]="",,"|n"&R1C9&RC[-24])&IF(RC[-23]="",,"|n"&R1C10&RC[-23])&IF(RC[-22]="",,"|n"&R1C11&RC[-22])&IF(RC[-21]="",,"|n"&R1C12&RC[-21])&IF(RC[-19]&RC[-18]&RC[-17]&RC[-16]="",,"|n"&R1C13)&IF(RC[-19]="",,"|n"&R1C14&RC[-19])&IF(RC[-18]="",,"|n"&R1C15&RC[-18])&IF(RC[-17]="",,"|n"&R1C16&RC[-17])&IF(RC[-16]="",,"|n"&R1C17&RC[-16])&IF(RC[-15]="",,"|n"&R1C18&RC[-15])&IF(RC[-14]="",,"|n"&R1C19&RC[-14])&IF(RC[-13]="",,"|n"&R1C20&RC[-13])&IF(RC[-12]="",,"|n"&R1C21&RC[-12])&IF(RC[-10]="",,"|n"&R1C23&RC[-10])&IF(RC[-9]="",,"|n"&R1C24&RC[-9])&IF(RC[-8]="",,"|n"&R1C25&RC[-8])&IF(RC[-7]="",,"|n"&R1C26&RC[-7])&IF(RC[-6]="",,"|n"&R1C27&RC[-6])&IF(RC[-5]="",,"|n"&R1C28&RC[-5])&IF(RC[-2]="",,"|n"&RC[-2]) -> 
AG1247: =IF(RC[-26]&RC[-25]&RC[-24]&RC[-23]&RC[-22]&RC[-21]="",,R1C6)&IF(RC[-26]="",,"|n"&R1C7&RC[-26])&IF(RC[-25]="",,"|n"&R1C8&RC[-25])&IF(RC[-24]="",,"|n"&R1C9&RC[-24])&IF(RC[-23]="",,"|n"&R1C10&RC[-23])&IF(RC[-22]="",,"|n"&R1C11&RC[-22])&IF(RC[-21]="",,"|n"&R1C12&RC[-21])&IF(RC[-19]&RC[-18]&RC[-17]&RC[-16]="",,"|n"&R1C13)&IF(RC[-19]="",,"|n"&R1C14&RC[-19])&IF(RC[-18]="",,"|n"&R1C15&RC[-18])&IF(RC[-17]="",,"|n"&R1C16&RC[-17])&IF(RC[-16]="",,"|n"&R1C17&RC[-16])&IF(RC[-15]="",,"|n"&R1C18&RC[-15])&IF(RC[-14]="",,"|n"&R1C19&RC[-14])&IF(RC[-13]="",,"|n"&R1C20&RC[-13])&IF(RC[-12]="",,"|n"&R1C21&RC[-12])&IF(RC[-10]="",,"|n"&R1C23&RC[-10])&IF(RC[-9]="",,"|n"&R1C24&RC[-9])&IF(RC[-8]="",,"|n"&R1C25&RC[-8])&IF(RC[-7]="",,"|n"&R1C26&RC[-7])&IF(RC[-6]="",,"|n"&R1C27&RC[-6])&IF(RC[-5]="",,"|n"&R1C28&RC[-5])&IF(RC[-2]="",,"|n"&RC[-2]) -> 
AG1248: =IF(RC[-26]&RC[-25]&RC[-24]&RC[-23]&RC[-22]&RC[-21]="",,R1C6)&IF(RC[-26]="",,"|n"&R1C7&RC[-26])&IF(RC[-25]="",,"|n"&R1C8&RC[-25])&IF(RC[-24]="",,"|n"&R1C9&RC[-24])&IF(RC[-23]="",,"|n"&R1C10&RC[-23])&IF(RC[-22]="",,"|n"&R1C11&RC[-22])&IF(RC[-21]="",,"|n"&R1C12&RC[-21])&IF(RC[-19]&RC[-18]&RC[-17]&RC[-16]="",,"|n"&R1C13)&IF(RC[-19]="",,"|n"&R1C14&RC[-19])&IF(RC[-18]="",,"|n"&R1C15&RC[-18])&IF(RC[-17]="",,"|n"&R1C16&RC[-17])&IF(RC[-16]="",,"|n"&R1C17&RC[-16])&IF(RC[-15]="",,"|n"&R1C18&RC[-15])&IF(RC[-14]="",,"|n"&R1C19&RC[-14])&IF(RC[-13]="",,"|n"&R1C20&RC[-13])&IF(RC[-12]="",,"|n"&R1C21&RC[-12])&IF(RC[-10]="",,"|n"&R1C23&RC[-10])&IF(RC[-9]="",,"|n"&R1C24&RC[-9])&IF(RC[-8]="",,"|n"&R1C25&RC[-8])&IF(RC[-7]="",,"|n"&R1C26&RC[-7])&IF(RC[-6]="",,"|n"&R1C27&RC[-6])&IF(RC[-5]="",,"|n"&R1C28&RC[-5])&IF(RC[-2]="",,"|n"&RC[-2]) -> 
AG1249: =IF(RC[-26]&RC[-25]&RC[-24]&RC[-23]&RC[-22]&RC[-21]="",,R1C6)&IF(RC[-26]="",,"|n"&R1C7&RC[-26])&IF(RC[-25]="",,"|n"&R1C8&RC[-25])&IF(RC[-24]="",,"|n"&R1C9&RC[-24])&IF(RC[-23]="",,"|n"&R1C10&RC[-23])&IF(RC[-22]="",,"|n"&R1C11&RC[-22])&IF(RC[-21]="",,"|n"&R1C12&RC[-21])&IF(RC[-19]&RC[-18]&RC[-17]&RC[-16]="",,"|n"&R1C13)&IF(RC[-19]="",,"|n"&R1C14&RC[-19])&IF(RC[-18]="",,"|n"&R1C15&RC[-18])&IF(RC[-17]="",,"|n"&R1C16&RC[-17])&IF(RC[-16]="",,"|n"&R1C17&RC[-16])&IF(RC[-15]="",,"|n"&R1C18&RC[-15])&IF(RC[-14]="",,"|n"&R1C19&RC[-14])&IF(RC[-13]="",,"|n"&R1C20&RC[-13])&IF(RC[-12]="",,"|n"&R1C21&RC[-12])&IF(RC[-10]="",,"|n"&R1C23&RC[-10])&IF(RC[-9]="",,"|n"&R1C24&RC[-9])&IF(RC[-8]="",,"|n"&R1C25&RC[-8])&IF(RC[-7]="",,"|n"&R1C26&RC[-7])&IF(RC[-6]="",,"|n"&R1C27&RC[-6])&IF(RC[-5]="",,"|n"&R1C28&RC[-5])&IF(RC[-2]="",,"|n"&RC[-2]) -> 
AG1250: =IF(RC[-26]&RC[-25]&RC[-24]&RC[-23]&RC[-22]&RC[-21]="",,R1C6)&IF(RC[-26]="",,"|n"&R1C7&RC[-26])&IF(RC[-25]="",,"|n"&R1C8&RC[-25])&IF(RC[-24]="",,"|n"&R1C9&RC[-24])&IF(RC[-23]="",,"|n"&R1C10&RC[-23])&IF(RC[-22]="",,"|n"&R1C11&RC[-22])&IF(RC[-21]="",,"|n"&R1C12&RC[-21])&IF(RC[-19]&RC[-18]&RC[-17]&RC[-16]="",,"|n"&R1C13)&IF(RC[-19]="",,"|n"&R1C14&RC[-19])&IF(RC[-18]="",,"|n"&R1C15&RC[-18])&IF(RC[-17]="",,"|n"&R1C16&RC[-17])&IF(RC[-16]="",,"|n"&R1C17&RC[-16])&IF(RC[-15]="",,"|n"&R1C18&RC[-15])&IF(RC[-14]="",,"|n"&R1C19&RC[-14])&IF(RC[-13]="",,"|n"&R1C20&RC[-13])&IF(RC[-12]="",,"|n"&R1C21&RC[-12])&IF(RC[-10]="",,"|n"&R1C23&RC[-10])&IF(RC[-9]="",,"|n"&R1C24&RC[-9])&IF(RC[-8]="",,"|n"&R1C25&RC[-8])&IF(RC[-7]="",,"|n"&R1C26&RC[-7])&IF(RC[-6]="",,"|n"&R1C27&RC[-6])&IF(RC[-5]="",,"|n"&R1C28&RC[-5])&IF(RC[-2]="",,"|n"&RC[-2]) -> 
AG1251: =IF(RC[-26]&RC[-25]&RC[-24]&RC[-23]&RC[-22]&RC[-21]="",,R1C6)&IF(RC[-26]="",,"|n"&R1C7&RC[-26])&IF(RC[-25]="",,"|n"&R1C8&RC[-25])&IF(RC[-24]="",,"|n"&R1C9&RC[-24])&IF(RC[-23]="",,"|n"&R1C10&RC[-23])&IF(RC[-22]="",,"|n"&R1C11&RC[-22])&IF(RC[-21]="",,"|n"&R1C12&RC[-21])&IF(RC[-19]&RC[-18]&RC[-17]&RC[-16]="",,"|n"&R1C13)&IF(RC[-19]="",,"|n"&R1C14&RC[-19])&IF(RC[-18]="",,"|n"&R1C15&RC[-18])&IF(RC[-17]="",,"|n"&R1C16&RC[-17])&IF(RC[-16]="",,"|n"&R1C17&RC[-16])&IF(RC[-15]="",,"|n"&R1C18&RC[-15])&IF(RC[-14]="",,"|n"&R1C19&RC[-14])&IF(RC[-13]="",,"|n"&R1C20&RC[-13])&IF(RC[-12]="",,"|n"&R1C21&RC[-12])&IF(RC[-10]="",,"|n"&R1C23&RC[-10])&IF(RC[-9]="",,"|n"&R1C24&RC[-9])&IF(RC[-8]="",,"|n"&R1C25&RC[-8])&IF(RC[-7]="",,"|n"&R1C26&RC[-7])&IF(RC[-6]="",,"|n"&R1C27&RC[-6])&IF(RC[-5]="",,"|n"&R1C28&RC[-5])&IF(RC[-2]="",,"|n"&RC[-2]) -> 
AG1252: =IF(RC[-26]&RC[-25]&RC[-24]&RC[-23]&RC[-22]&RC[-21]="",,R1C6)&IF(RC[-26]="",,"|n"&R1C7&RC[-26])&IF(RC[-25]="",,"|n"&R1C8&RC[-25])&IF(RC[-24]="",,"|n"&R1C9&RC[-24])&IF(RC[-23]="",,"|n"&R1C10&RC[-23])&IF(RC[-22]="",,"|n"&R1C11&RC[-22])&IF(RC[-21]="",,"|n"&R1C12&RC[-21])&IF(RC[-19]&RC[-18]&RC[-17]&RC[-16]="",,"|n"&R1C13)&IF(RC[-19]="",,"|n"&R1C14&RC[-19])&IF(RC[-18]="",,"|n"&R1C15&RC[-18])&IF(RC[-17]="",,"|n"&R1C16&RC[-17])&IF(RC[-16]="",,"|n"&R1C17&RC[-16])&IF(RC[-15]="",,"|n"&R1C18&RC[-15])&IF(RC[-14]="",,"|n"&R1C19&RC[-14])&IF(RC[-13]="",,"|n"&R1C20&RC[-13])&IF(RC[-12]="",,"|n"&R1C21&RC[-12])&IF(RC[-10]="",,"|n"&R1C23&RC[-10])&IF(RC[-9]="",,"|n"&R1C24&RC[-9])&IF(RC[-8]="",,"|n"&R1C25&RC[-8])&IF(RC[-7]="",,"|n"&R1C26&RC[-7])&IF(RC[-6]="",,"|n"&R1C27&RC[-6])&IF(RC[-5]="",,"|n"&R1C28&RC[-5])&IF(RC[-2]="",,"|n"&RC[-2]) -> 
AG1253: =IF(RC[-26]&RC[-25]&RC[-24]&RC[-23]&RC[-22]&RC[-21]="",,R1C6)&IF(RC[-26]="",,"|n"&R1C7&RC[-26])&IF(RC[-25]="",,"|n"&R1C8&RC[-25])&IF(RC[-24]="",,"|n"&R1C9&RC[-24])&IF(RC[-23]="",,"|n"&R1C10&RC[-23])&IF(RC[-22]="",,"|n"&R1C11&RC[-22])&IF(RC[-21]="",,"|n"&R1C12&RC[-21])&IF(RC[-19]&RC[-18]&RC[-17]&RC[-16]="",,"|n"&R1C13)&IF(RC[-19]="",,"|n"&R1C14&RC[-19])&IF(RC[-18]="",,"|n"&R1C15&RC[-18])&IF(RC[-17]="",,"|n"&R1C16&RC[-17])&IF(RC[-16]="",,"|n"&R1C17&RC[-16])&IF(RC[-15]="",,"|n"&R1C18&RC[-15])&IF(RC[-14]="",,"|n"&R1C19&RC[-14])&IF(RC[-13]="",,"|n"&R1C20&RC[-13])&IF(RC[-12]="",,"|n"&R1C21&RC[-12])&IF(RC[-10]="",,"|n"&R1C23&RC[-10])&IF(RC[-9]="",,"|n"&R1C24&RC[-9])&IF(RC[-8]="",,"|n"&R1C25&RC[-8])&IF(RC[-7]="",,"|n"&R1C26&RC[-7])&IF(RC[-6]="",,"|n"&R1C27&RC[-6])&IF(RC[-5]="",,"|n"&R1C28&RC[-5])&IF(RC[-2]="",,"|n"&RC[-2]) -> 
AG1254: =IF(RC[-26]&RC[-25]&RC[-24]&RC[-23]&RC[-22]&RC[-21]="",,R1C6)&IF(RC[-26]="",,"|n"&R1C7&RC[-26])&IF(RC[-25]="",,"|n"&R1C8&RC[-25])&IF(RC[-24]="",,"|n"&R1C9&RC[-24])&IF(RC[-23]="",,"|n"&R1C10&RC[-23])&IF(RC[-22]="",,"|n"&R1C11&RC[-22])&IF(RC[-21]="",,"|n"&R1C12&RC[-21])&IF(RC[-19]&RC[-18]&RC[-17]&RC[-16]="",,"|n"&R1C13)&IF(RC[-19]="",,"|n"&R1C14&RC[-19])&IF(RC[-18]="",,"|n"&R1C15&RC[-18])&IF(RC[-17]="",,"|n"&R1C16&RC[-17])&IF(RC[-16]="",,"|n"&R1C17&RC[-16])&IF(RC[-15]="",,"|n"&R1C18&RC[-15])&IF(RC[-14]="",,"|n"&R1C19&RC[-14])&IF(RC[-13]="",,"|n"&R1C20&RC[-13])&IF(RC[-12]="",,"|n"&R1C21&RC[-12])&IF(RC[-10]="",,"|n"&R1C23&RC[-10])&IF(RC[-9]="",,"|n"&R1C24&RC[-9])&IF(RC[-8]="",,"|n"&R1C25&RC[-8])&IF(RC[-7]="",,"|n"&R1C26&RC[-7])&IF(RC[-6]="",,"|n"&R1C27&RC[-6])&IF(RC[-5]="",,"|n"&R1C28&RC[-5])&IF(RC[-2]="",,"|n"&RC[-2]) -> 
AG1255: =IF(RC[-26]&RC[-25]&RC[-24]&RC[-23]&RC[-22]&RC[-21]="",,R1C6)&IF(RC[-26]="",,"|n"&R1C7&RC[-26])&IF(RC[-25]="",,"|n"&R1C8&RC[-25])&IF(RC[-24]="",,"|n"&R1C9&RC[-24])&IF(RC[-23]="",,"|n"&R1C10&RC[-23])&IF(RC[-22]="",,"|n"&R1C11&RC[-22])&IF(RC[-21]="",,"|n"&R1C12&RC[-21])&IF(RC[-19]&RC[-18]&RC[-17]&RC[-16]="",,"|n"&R1C13)&IF(RC[-19]="",,"|n"&R1C14&RC[-19])&IF(RC[-18]="",,"|n"&R1C15&RC[-18])&IF(RC[-17]="",,"|n"&R1C16&RC[-17])&IF(RC[-16]="",,"|n"&R1C17&RC[-16])&IF(RC[-15]="",,"|n"&R1C18&RC[-15])&IF(RC[-14]="",,"|n"&R1C19&RC[-14])&IF(RC[-13]="",,"|n"&R1C20&RC[-13])&IF(RC[-12]="",,"|n"&R1C21&RC[-12])&IF(RC[-10]="",,"|n"&R1C23&RC[-10])&IF(RC[-9]="",,"|n"&R1C24&RC[-9])&IF(RC[-8]="",,"|n"&R1C25&RC[-8])&IF(RC[-7]="",,"|n"&R1C26&RC[-7])&IF(RC[-6]="",,"|n"&R1C27&RC[-6])&IF(RC[-5]="",,"|n"&R1C28&RC[-5])&IF(RC[-2]="",,"|n"&RC[-2]) -> 
AG1256: =IF(RC[-26]&RC[-25]&RC[-24]&RC[-23]&RC[-22]&RC[-21]="",,R1C6)&IF(RC[-26]="",,"|n"&R1C7&RC[-26])&IF(RC[-25]="",,"|n"&R1C8&RC[-25])&IF(RC[-24]="",,"|n"&R1C9&RC[-24])&IF(RC[-23]="",,"|n"&R1C10&RC[-23])&IF(RC[-22]="",,"|n"&R1C11&RC[-22])&IF(RC[-21]="",,"|n"&R1C12&RC[-21])&IF(RC[-19]&RC[-18]&RC[-17]&RC[-16]="",,"|n"&R1C13)&IF(RC[-19]="",,"|n"&R1C14&RC[-19])&IF(RC[-18]="",,"|n"&R1C15&RC[-18])&IF(RC[-17]="",,"|n"&R1C16&RC[-17])&IF(RC[-16]="",,"|n"&R1C17&RC[-16])&IF(RC[-15]="",,"|n"&R1C18&RC[-15])&IF(RC[-14]="",,"|n"&R1C19&RC[-14])&IF(RC[-13]="",,"|n"&R1C20&RC[-13])&IF(RC[-12]="",,"|n"&R1C21&RC[-12])&IF(RC[-10]="",,"|n"&R1C23&RC[-10])&IF(RC[-9]="",,"|n"&R1C24&RC[-9])&IF(RC[-8]="",,"|n"&R1C25&RC[-8])&IF(RC[-7]="",,"|n"&R1C26&RC[-7])&IF(RC[-6]="",,"|n"&R1C27&RC[-6])&IF(RC[-5]="",,"|n"&R1C28&RC[-5])&IF(RC[-2]="",,"|n"&RC[-2]) -> 
AG1257: =IF(RC[-26]&RC[-25]&RC[-24]&RC[-23]&RC[-22]&RC[-21]="",,R1C6)&IF(RC[-26]="",,"|n"&R1C7&RC[-26])&IF(RC[-25]="",,"|n"&R1C8&RC[-25])&IF(RC[-24]="",,"|n"&R1C9&RC[-24])&IF(RC[-23]="",,"|n"&R1C10&RC[-23])&IF(RC[-22]="",,"|n"&R1C11&RC[-22])&IF(RC[-21]="",,"|n"&R1C12&RC[-21])&IF(RC[-19]&RC[-18]&RC[-17]&RC[-16]="",,"|n"&R1C13)&IF(RC[-19]="",,"|n"&R1C14&RC[-19])&IF(RC[-18]="",,"|n"&R1C15&RC[-18])&IF(RC[-17]="",,"|n"&R1C16&RC[-17])&IF(RC[-16]="",,"|n"&R1C17&RC[-16])&IF(RC[-15]="",,"|n"&R1C18&RC[-15])&IF(RC[-14]="",,"|n"&R1C19&RC[-14])&IF(RC[-13]="",,"|n"&R1C20&RC[-13])&IF(RC[-12]="",,"|n"&R1C21&RC[-12])&IF(RC[-10]="",,"|n"&R1C23&RC[-10])&IF(RC[-9]="",,"|n"&R1C24&RC[-9])&IF(RC[-8]="",,"|n"&R1C25&RC[-8])&IF(RC[-7]="",,"|n"&R1C26&RC[-7])&IF(RC[-6]="",,"|n"&R1C27&RC[-6])&IF(RC[-5]="",,"|n"&R1C28&RC[-5])&IF(RC[-2]="",,"|n"&RC[-2]) -> 
AG1258: =IF(RC[-26]&RC[-25]&RC[-24]&RC[-23]&RC[-22]&RC[-21]="",,R1C6)&IF(RC[-26]="",,"|n"&R1C7&RC[-26])&IF(RC[-25]="",,"|n"&R1C8&RC[-25])&IF(RC[-24]="",,"|n"&R1C9&RC[-24])&IF(RC[-23]="",,"|n"&R1C10&RC[-23])&IF(RC[-22]="",,"|n"&R1C11&RC[-22])&IF(RC[-21]="",,"|n"&R1C12&RC[-21])&IF(RC[-19]&RC[-18]&RC[-17]&RC[-16]="",,"|n"&R1C13)&IF(RC[-19]="",,"|n"&R1C14&RC[-19])&IF(RC[-18]="",,"|n"&R1C15&RC[-18])&IF(RC[-17]="",,"|n"&R1C16&RC[-17])&IF(RC[-16]="",,"|n"&R1C17&RC[-16])&IF(RC[-15]="",,"|n"&R1C18&RC[-15])&IF(RC[-14]="",,"|n"&R1C19&RC[-14])&IF(RC[-13]="",,"|n"&R1C20&RC[-13])&IF(RC[-12]="",,"|n"&R1C21&RC[-12])&IF(RC[-10]="",,"|n"&R1C23&RC[-10])&IF(RC[-9]="",,"|n"&R1C24&RC[-9])&IF(RC[-8]="",,"|n"&R1C25&RC[-8])&IF(RC[-7]="",,"|n"&R1C26&RC[-7])&IF(RC[-6]="",,"|n"&R1C27&RC[-6])&IF(RC[-5]="",,"|n"&R1C28&RC[-5])&IF(RC[-2]="",,"|n"&RC[-2]) -> 
AG1259: =IF(RC[-26]&RC[-25]&RC[-24]&RC[-23]&RC[-22]&RC[-21]="",,R1C6)&IF(RC[-26]="",,"|n"&R1C7&RC[-26])&IF(RC[-25]="",,"|n"&R1C8&RC[-25])&IF(RC[-24]="",,"|n"&R1C9&RC[-24])&IF(RC[-23]="",,"|n"&R1C10&RC[-23])&IF(RC[-22]="",,"|n"&R1C11&RC[-22])&IF(RC[-21]="",,"|n"&R1C12&RC[-21])&IF(RC[-19]&RC[-18]&RC[-17]&RC[-16]="",,"|n"&R1C13)&IF(RC[-19]="",,"|n"&R1C14&RC[-19])&IF(RC[-18]="",,"|n"&R1C15&RC[-18])&IF(RC[-17]="",,"|n"&R1C16&RC[-17])&IF(RC[-16]="",,"|n"&R1C17&RC[-16])&IF(RC[-15]="",,"|n"&R1C18&RC[-15])&IF(RC[-14]="",,"|n"&R1C19&RC[-14])&IF(RC[-13]="",,"|n"&R1C20&RC[-13])&IF(RC[-12]="",,"|n"&R1C21&RC[-12])&IF(RC[-10]="",,"|n"&R1C23&RC[-10])&IF(RC[-9]="",,"|n"&R1C24&RC[-9])&IF(RC[-8]="",,"|n"&R1C25&RC[-8])&IF(RC[-7]="",,"|n"&R1C26&RC[-7])&IF(RC[-6]="",,"|n"&R1C27&RC[-6])&IF(RC[-5]="",,"|n"&R1C28&RC[-5])&IF(RC[-2]="",,"|n"&RC[-2]) -> 
AG1260: =IF(RC[-26]&RC[-25]&RC[-24]&RC[-23]&RC[-22]&RC[-21]="",,R1C6)&IF(RC[-26]="",,"|n"&R1C7&RC[-26])&IF(RC[-25]="",,"|n"&R1C8&RC[-25])&IF(RC[-24]="",,"|n"&R1C9&RC[-24])&IF(RC[-23]="",,"|n"&R1C10&RC[-23])&IF(RC[-22]="",,"|n"&R1C11&RC[-22])&IF(RC[-21]="",,"|n"&R1C12&RC[-21])&IF(RC[-19]&RC[-18]&RC[-17]&RC[-16]="",,"|n"&R1C13)&IF(RC[-19]="",,"|n"&R1C14&RC[-19])&IF(RC[-18]="",,"|n"&R1C15&RC[-18])&IF(RC[-17]="",,"|n"&R1C16&RC[-17])&IF(RC[-16]="",,"|n"&R1C17&RC[-16])&IF(RC[-15]="",,"|n"&R1C18&RC[-15])&IF(RC[-14]="",,"|n"&R1C19&RC[-14])&IF(RC[-13]="",,"|n"&R1C20&RC[-13])&IF(RC[-12]="",,"|n"&R1C21&RC[-12])&IF(RC[-10]="",,"|n"&R1C23&RC[-10])&IF(RC[-9]="",,"|n"&R1C24&RC[-9])&IF(RC[-8]="",,"|n"&R1C25&RC[-8])&IF(RC[-7]="",,"|n"&R1C26&RC[-7])&IF(RC[-6]="",,"|n"&R1C27&RC[-6])&IF(RC[-5]="",,"|n"&R1C28&RC[-5])&IF(RC[-2]="",,"|n"&RC[-2]) -> 
AG1261: =IF(RC[-26]&RC[-25]&RC[-24]&RC[-23]&RC[-22]&RC[-21]="",,R1C6)&IF(RC[-26]="",,"|n"&R1C7&RC[-26])&IF(RC[-25]="",,"|n"&R1C8&RC[-25])&IF(RC[-24]="",,"|n"&R1C9&RC[-24])&IF(RC[-23]="",,"|n"&R1C10&RC[-23])&IF(RC[-22]="",,"|n"&R1C11&RC[-22])&IF(RC[-21]="",,"|n"&R1C12&RC[-21])&IF(RC[-19]&RC[-18]&RC[-17]&RC[-16]="",,"|n"&R1C13)&IF(RC[-19]="",,"|n"&R1C14&RC[-19])&IF(RC[-18]="",,"|n"&R1C15&RC[-18])&IF(RC[-17]="",,"|n"&R1C16&RC[-17])&IF(RC[-16]="",,"|n"&R1C17&RC[-16])&IF(RC[-15]="",,"|n"&R1C18&RC[-15])&IF(RC[-14]="",,"|n"&R1C19&RC[-14])&IF(RC[-13]="",,"|n"&R1C20&RC[-13])&IF(RC[-12]="",,"|n"&R1C21&RC[-12])&IF(RC[-10]="",,"|n"&R1C23&RC[-10])&IF(RC[-9]="",,"|n"&R1C24&RC[-9])&IF(RC[-8]="",,"|n"&R1C25&RC[-8])&IF(RC[-7]="",,"|n"&R1C26&RC[-7])&IF(RC[-6]="",,"|n"&R1C27&RC[-6])&IF(RC[-5]="",,"|n"&R1C28&RC[-5])&IF(RC[-2]="",,"|n"&RC[-2]) -> 
AG1262: =IF(RC[-26]&RC[-25]&RC[-24]&RC[-23]&RC[-22]&RC[-21]="",,R1C6)&IF(RC[-26]="",,"|n"&R1C7&RC[-26])&IF(RC[-25]="",,"|n"&R1C8&RC[-25])&IF(RC[-24]="",,"|n"&R1C9&RC[-24])&IF(RC[-23]="",,"|n"&R1C10&RC[-23])&IF(RC[-22]="",,"|n"&R1C11&RC[-22])&IF(RC[-21]="",,"|n"&R1C12&RC[-21])&IF(RC[-19]&RC[-18]&RC[-17]&RC[-16]="",,"|n"&R1C13)&IF(RC[-19]="",,"|n"&R1C14&RC[-19])&IF(RC[-18]="",,"|n"&R1C15&RC[-18])&IF(RC[-17]="",,"|n"&R1C16&RC[-17])&IF(RC[-16]="",,"|n"&R1C17&RC[-16])&IF(RC[-15]="",,"|n"&R1C18&RC[-15])&IF(RC[-14]="",,"|n"&R1C19&RC[-14])&IF(RC[-13]="",,"|n"&R1C20&RC[-13])&IF(RC[-12]="",,"|n"&R1C21&RC[-12])&IF(RC[-10]="",,"|n"&R1C23&RC[-10])&IF(RC[-9]="",,"|n"&R1C24&RC[-9])&IF(RC[-8]="",,"|n"&R1C25&RC[-8])&IF(RC[-7]="",,"|n"&R1C26&RC[-7])&IF(RC[-6]="",,"|n"&R1C27&RC[-6])&IF(RC[-5]="",,"|n"&R1C28&RC[-5])&IF(RC[-2]="",,"|n"&RC[-2]) -> 
AG1263: =IF(RC[-26]&RC[-25]&RC[-24]&RC[-23]&RC[-22]&RC[-21]="",,R1C6)&IF(RC[-26]="",,"|n"&R1C7&RC[-26])&IF(RC[-25]="",,"|n"&R1C8&RC[-25])&IF(RC[-24]="",,"|n"&R1C9&RC[-24])&IF(RC[-23]="",,"|n"&R1C10&RC[-23])&IF(RC[-22]="",,"|n"&R1C11&RC[-22])&IF(RC[-21]="",,"|n"&R1C12&RC[-21])&IF(RC[-19]&RC[-18]&RC[-17]&RC[-16]="",,"|n"&R1C13)&IF(RC[-19]="",,"|n"&R1C14&RC[-19])&IF(RC[-18]="",,"|n"&R1C15&RC[-18])&IF(RC[-17]="",,"|n"&R1C16&RC[-17])&IF(RC[-16]="",,"|n"&R1C17&RC[-16])&IF(RC[-15]="",,"|n"&R1C18&RC[-15])&IF(RC[-14]="",,"|n"&R1C19&RC[-14])&IF(RC[-13]="",,"|n"&R1C20&RC[-13])&IF(RC[-12]="",,"|n"&R1C21&RC[-12])&IF(RC[-10]="",,"|n"&R1C23&RC[-10])&IF(RC[-9]="",,"|n"&R1C24&RC[-9])&IF(RC[-8]="",,"|n"&R1C25&RC[-8])&IF(RC[-7]="",,"|n"&R1C26&RC[-7])&IF(RC[-6]="",,"|n"&R1C27&RC[-6])&IF(RC[-5]="",,"|n"&R1C28&RC[-5])&IF(RC[-2]="",,"|n"&RC[-2]) -> 
AG1264: =IF(RC[-26]&RC[-25]&RC[-24]&RC[-23]&RC[-22]&RC[-21]="",,R1C6)&IF(RC[-26]="",,"|n"&R1C7&RC[-26])&IF(RC[-25]="",,"|n"&R1C8&RC[-25])&IF(RC[-24]="",,"|n"&R1C9&RC[-24])&IF(RC[-23]="",,"|n"&R1C10&RC[-23])&IF(RC[-22]="",,"|n"&R1C11&RC[-22])&IF(RC[-21]="",,"|n"&R1C12&RC[-21])&IF(RC[-19]&RC[-18]&RC[-17]&RC[-16]="",,"|n"&R1C13)&IF(RC[-19]="",,"|n"&R1C14&RC[-19])&IF(RC[-18]="",,"|n"&R1C15&RC[-18])&IF(RC[-17]="",,"|n"&R1C16&RC[-17])&IF(RC[-16]="",,"|n"&R1C17&RC[-16])&IF(RC[-15]="",,"|n"&R1C18&RC[-15])&IF(RC[-14]="",,"|n"&R1C19&RC[-14])&IF(RC[-13]="",,"|n"&R1C20&RC[-13])&IF(RC[-12]="",,"|n"&R1C21&RC[-12])&IF(RC[-10]="",,"|n"&R1C23&RC[-10])&IF(RC[-9]="",,"|n"&R1C24&RC[-9])&IF(RC[-8]="",,"|n"&R1C25&RC[-8])&IF(RC[-7]="",,"|n"&R1C26&RC[-7])&IF(RC[-6]="",,"|n"&R1C27&RC[-6])&IF(RC[-5]="",,"|n"&R1C28&RC[-5])&IF(RC[-2]="",,"|n"&RC[-2]) -> 
AG1265: =IF(RC[-26]&RC[-25]&RC[-24]&RC[-23]&RC[-22]&RC[-21]="",,R1C6)&IF(RC[-26]="",,"|n"&R1C7&RC[-26])&IF(RC[-25]="",,"|n"&R1C8&RC[-25])&IF(RC[-24]="",,"|n"&R1C9&RC[-24])&IF(RC[-23]="",,"|n"&R1C10&RC[-23])&IF(RC[-22]="",,"|n"&R1C11&RC[-22])&IF(RC[-21]="",,"|n"&R1C12&RC[-21])&IF(RC[-19]&RC[-18]&RC[-17]&RC[-16]="",,"|n"&R1C13)&IF(RC[-19]="",,"|n"&R1C14&RC[-19])&IF(RC[-18]="",,"|n"&R1C15&RC[-18])&IF(RC[-17]="",,"|n"&R1C16&RC[-17])&IF(RC[-16]="",,"|n"&R1C17&RC[-16])&IF(RC[-15]="",,"|n"&R1C18&RC[-15])&IF(RC[-14]="",,"|n"&R1C19&RC[-14])&IF(RC[-13]="",,"|n"&R1C20&RC[-13])&IF(RC[-12]="",,"|n"&R1C21&RC[-12])&IF(RC[-10]="",,"|n"&R1C23&RC[-10])&IF(RC[-9]="",,"|n"&R1C24&RC[-9])&IF(RC[-8]="",,"|n"&R1C25&RC[-8])&IF(RC[-7]="",,"|n"&R1C26&RC[-7])&IF(RC[-6]="",,"|n"&R1C27&RC[-6])&IF(RC[-5]="",,"|n"&R1C28&RC[-5])&IF(RC[-2]="",,"|n"&RC[-2]) -> 
AG1266: =IF(RC[-26]&RC[-25]&RC[-24]&RC[-23]&RC[-22]&RC[-21]="",,R1C6)&IF(RC[-26]="",,"|n"&R1C7&RC[-26])&IF(RC[-25]="",,"|n"&R1C8&RC[-25])&IF(RC[-24]="",,"|n"&R1C9&RC[-24])&IF(RC[-23]="",,"|n"&R1C10&RC[-23])&IF(RC[-22]="",,"|n"&R1C11&RC[-22])&IF(RC[-21]="",,"|n"&R1C12&RC[-21])&IF(RC[-19]&RC[-18]&RC[-17]&RC[-16]="",,"|n"&R1C13)&IF(RC[-19]="",,"|n"&R1C14&RC[-19])&IF(RC[-18]="",,"|n"&R1C15&RC[-18])&IF(RC[-17]="",,"|n"&R1C16&RC[-17])&IF(RC[-16]="",,"|n"&R1C17&RC[-16])&IF(RC[-15]="",,"|n"&R1C18&RC[-15])&IF(RC[-14]="",,"|n"&R1C19&RC[-14])&IF(RC[-13]="",,"|n"&R1C20&RC[-13])&IF(RC[-12]="",,"|n"&R1C21&RC[-12])&IF(RC[-10]="",,"|n"&R1C23&RC[-10])&IF(RC[-9]="",,"|n"&R1C24&RC[-9])&IF(RC[-8]="",,"|n"&R1C25&RC[-8])&IF(RC[-7]="",,"|n"&R1C26&RC[-7])&IF(RC[-6]="",,"|n"&R1C27&RC[-6])&IF(RC[-5]="",,"|n"&R1C28&RC[-5])&IF(RC[-2]="",,"|n"&RC[-2]) -> 
AG1267: =IF(RC[-26]&RC[-25]&RC[-24]&RC[-23]&RC[-22]&RC[-21]="",,R1C6)&IF(RC[-26]="",,"|n"&R1C7&RC[-26])&IF(RC[-25]="",,"|n"&R1C8&RC[-25])&IF(RC[-24]="",,"|n"&R1C9&RC[-24])&IF(RC[-23]="",,"|n"&R1C10&RC[-23])&IF(RC[-22]="",,"|n"&R1C11&RC[-22])&IF(RC[-21]="",,"|n"&R1C12&RC[-21])&IF(RC[-19]&RC[-18]&RC[-17]&RC[-16]="",,"|n"&R1C13)&IF(RC[-19]="",,"|n"&R1C14&RC[-19])&IF(RC[-18]="",,"|n"&R1C15&RC[-18])&IF(RC[-17]="",,"|n"&R1C16&RC[-17])&IF(RC[-16]="",,"|n"&R1C17&RC[-16])&IF(RC[-15]="",,"|n"&R1C18&RC[-15])&IF(RC[-14]="",,"|n"&R1C19&RC[-14])&IF(RC[-13]="",,"|n"&R1C20&RC[-13])&IF(RC[-12]="",,"|n"&R1C21&RC[-12])&IF(RC[-10]="",,"|n"&R1C23&RC[-10])&IF(RC[-9]="",,"|n"&R1C24&RC[-9])&IF(RC[-8]="",,"|n"&R1C25&RC[-8])&IF(RC[-7]="",,"|n"&R1C26&RC[-7])&IF(RC[-6]="",,"|n"&R1C27&RC[-6])&IF(RC[-5]="",,"|n"&R1C28&RC[-5])&IF(RC[-2]="",,"|n"&RC[-2]) -> 
AG1268: =IF(RC[-26]&RC[-25]&RC[-24]&RC[-23]&RC[-22]&RC[-21]="",,R1C6)&IF(RC[-26]="",,"|n"&R1C7&RC[-26])&IF(RC[-25]="",,"|n"&R1C8&RC[-25])&IF(RC[-24]="",,"|n"&R1C9&RC[-24])&IF(RC[-23]="",,"|n"&R1C10&RC[-23])&IF(RC[-22]="",,"|n"&R1C11&RC[-22])&IF(RC[-21]="",,"|n"&R1C12&RC[-21])&IF(RC[-19]&RC[-18]&RC[-17]&RC[-16]="",,"|n"&R1C13)&IF(RC[-19]="",,"|n"&R1C14&RC[-19])&IF(RC[-18]="",,"|n"&R1C15&RC[-18])&IF(RC[-17]="",,"|n"&R1C16&RC[-17])&IF(RC[-16]="",,"|n"&R1C17&RC[-16])&IF(RC[-15]="",,"|n"&R1C18&RC[-15])&IF(RC[-14]="",,"|n"&R1C19&RC[-14])&IF(RC[-13]="",,"|n"&R1C20&RC[-13])&IF(RC[-12]="",,"|n"&R1C21&RC[-12])&IF(RC[-10]="",,"|n"&R1C23&RC[-10])&IF(RC[-9]="",,"|n"&R1C24&RC[-9])&IF(RC[-8]="",,"|n"&R1C25&RC[-8])&IF(RC[-7]="",,"|n"&R1C26&RC[-7])&IF(RC[-6]="",,"|n"&R1C27&RC[-6])&IF(RC[-5]="",,"|n"&R1C28&RC[-5])&IF(RC[-2]="",,"|n"&RC[-2]) -> 
AG1269: =IF(RC[-26]&RC[-25]&RC[-24]&RC[-23]&RC[-22]&RC[-21]="",,R1C6)&IF(RC[-26]="",,"|n"&R1C7&RC[-26])&IF(RC[-25]="",,"|n"&R1C8&RC[-25])&IF(RC[-24]="",,"|n"&R1C9&RC[-24])&IF(RC[-23]="",,"|n"&R1C10&RC[-23])&IF(RC[-22]="",,"|n"&R1C11&RC[-22])&IF(RC[-21]="",,"|n"&R1C12&RC[-21])&IF(RC[-19]&RC[-18]&RC[-17]&RC[-16]="",,"|n"&R1C13)&IF(RC[-19]="",,"|n"&R1C14&RC[-19])&IF(RC[-18]="",,"|n"&R1C15&RC[-18])&IF(RC[-17]="",,"|n"&R1C16&RC[-17])&IF(RC[-16]="",,"|n"&R1C17&RC[-16])&IF(RC[-15]="",,"|n"&R1C18&RC[-15])&IF(RC[-14]="",,"|n"&R1C19&RC[-14])&IF(RC[-13]="",,"|n"&R1C20&RC[-13])&IF(RC[-12]="",,"|n"&R1C21&RC[-12])&IF(RC[-10]="",,"|n"&R1C23&RC[-10])&IF(RC[-9]="",,"|n"&R1C24&RC[-9])&IF(RC[-8]="",,"|n"&R1C25&RC[-8])&IF(RC[-7]="",,"|n"&R1C26&RC[-7])&IF(RC[-6]="",,"|n"&R1C27&RC[-6])&IF(RC[-5]="",,"|n"&R1C28&RC[-5])&IF(RC[-2]="",,"|n"&RC[-2]) -> 
AG1270: =IF(RC[-26]&RC[-25]&RC[-24]&RC[-23]&RC[-22]&RC[-21]="",,R1C6)&IF(RC[-26]="",,"|n"&R1C7&RC[-26])&IF(RC[-25]="",,"|n"&R1C8&RC[-25])&IF(RC[-24]="",,"|n"&R1C9&RC[-24])&IF(RC[-23]="",,"|n"&R1C10&RC[-23])&IF(RC[-22]="",,"|n"&R1C11&RC[-22])&IF(RC[-21]="",,"|n"&R1C12&RC[-21])&IF(RC[-19]&RC[-18]&RC[-17]&RC[-16]="",,"|n"&R1C13)&IF(RC[-19]="",,"|n"&R1C14&RC[-19])&IF(RC[-18]="",,"|n"&R1C15&RC[-18])&IF(RC[-17]="",,"|n"&R1C16&RC[-17])&IF(RC[-16]="",,"|n"&R1C17&RC[-16])&IF(RC[-15]="",,"|n"&R1C18&RC[-15])&IF(RC[-14]="",,"|n"&R1C19&RC[-14])&IF(RC[-13]="",,"|n"&R1C20&RC[-13])&IF(RC[-12]="",,"|n"&R1C21&RC[-12])&IF(RC[-10]="",,"|n"&R1C23&RC[-10])&IF(RC[-9]="",,"|n"&R1C24&RC[-9])&IF(RC[-8]="",,"|n"&R1C25&RC[-8])&IF(RC[-7]="",,"|n"&R1C26&RC[-7])&IF(RC[-6]="",,"|n"&R1C27&RC[-6])&IF(RC[-5]="",,"|n"&R1C28&RC[-5])&IF(RC[-2]="",,"|n"&RC[-2]) -> 
AG1271: =IF(RC[-26]&RC[-25]&RC[-24]&RC[-23]&RC[-22]&RC[-21]="",,R1C6)&IF(RC[-26]="",,"|n"&R1C7&RC[-26])&IF(RC[-25]="",,"|n"&R1C8&RC[-25])&IF(RC[-24]="",,"|n"&R1C9&RC[-24])&IF(RC[-23]="",,"|n"&R1C10&RC[-23])&IF(RC[-22]="",,"|n"&R1C11&RC[-22])&IF(RC[-21]="",,"|n"&R1C12&RC[-21])&IF(RC[-19]&RC[-18]&RC[-17]&RC[-16]="",,"|n"&R1C13)&IF(RC[-19]="",,"|n"&R1C14&RC[-19])&IF(RC[-18]="",,"|n"&R1C15&RC[-18])&IF(RC[-17]="",,"|n"&R1C16&RC[-17])&IF(RC[-16]="",,"|n"&R1C17&RC[-16])&IF(RC[-15]="",,"|n"&R1C18&RC[-15])&IF(RC[-14]="",,"|n"&R1C19&RC[-14])&IF(RC[-13]="",,"|n"&R1C20&RC[-13])&IF(RC[-12]="",,"|n"&R1C21&RC[-12])&IF(RC[-10]="",,"|n"&R1C23&RC[-10])&IF(RC[-9]="",,"|n"&R1C24&RC[-9])&IF(RC[-8]="",,"|n"&R1C25&RC[-8])&IF(RC[-7]="",,"|n"&R1C26&RC[-7])&IF(RC[-6]="",,"|n"&R1C27&RC[-6])&IF(RC[-5]="",,"|n"&R1C28&RC[-5])&IF(RC[-2]="",,"|n"&RC[-2]) -> 
AG1272: =IF(RC[-26]&RC[-25]&RC[-24]&RC[-23]&RC[-22]&RC[-21]="",,R1C6)&IF(RC[-26]="",,"|n"&R1C7&RC[-26])&IF(RC[-25]="",,"|n"&R1C8&RC[-25])&IF(RC[-24]="",,"|n"&R1C9&RC[-24])&IF(RC[-23]="",,"|n"&R1C10&RC[-23])&IF(RC[-22]="",,"|n"&R1C11&RC[-22])&IF(RC[-21]="",,"|n"&R1C12&RC[-21])&IF(RC[-19]&RC[-18]&RC[-17]&RC[-16]="",,"|n"&R1C13)&IF(RC[-19]="",,"|n"&R1C14&RC[-19])&IF(RC[-18]="",,"|n"&R1C15&RC[-18])&IF(RC[-17]="",,"|n"&R1C16&RC[-17])&IF(RC[-16]="",,"|n"&R1C17&RC[-16])&IF(RC[-15]="",,"|n"&R1C18&RC[-15])&IF(RC[-14]="",,"|n"&R1C19&RC[-14])&IF(RC[-13]="",,"|n"&R1C20&RC[-13])&IF(RC[-12]="",,"|n"&R1C21&RC[-12])&IF(RC[-10]="",,"|n"&R1C23&RC[-10])&IF(RC[-9]="",,"|n"&R1C24&RC[-9])&IF(RC[-8]="",,"|n"&R1C25&RC[-8])&IF(RC[-7]="",,"|n"&R1C26&RC[-7])&IF(RC[-6]="",,"|n"&R1C27&RC[-6])&IF(RC[-5]="",,"|n"&R1C28&RC[-5])&IF(RC[-2]="",,"|n"&RC[-2]) -> 
AG1273: =IF(RC[-26]&RC[-25]&RC[-24]&RC[-23]&RC[-22]&RC[-21]="",,R1C6)&IF(RC[-26]="",,"|n"&R1C7&RC[-26])&IF(RC[-25]="",,"|n"&R1C8&RC[-25])&IF(RC[-24]="",,"|n"&R1C9&RC[-24])&IF(RC[-23]="",,"|n"&R1C10&RC[-23])&IF(RC[-22]="",,"|n"&R1C11&RC[-22])&IF(RC[-21]="",,"|n"&R1C12&RC[-21])&IF(RC[-19]&RC[-18]&RC[-17]&RC[-16]="",,"|n"&R1C13)&IF(RC[-19]="",,"|n"&R1C14&RC[-19])&IF(RC[-18]="",,"|n"&R1C15&RC[-18])&IF(RC[-17]="",,"|n"&R1C16&RC[-17])&IF(RC[-16]="",,"|n"&R1C17&RC[-16])&IF(RC[-15]="",,"|n"&R1C18&RC[-15])&IF(RC[-14]="",,"|n"&R1C19&RC[-14])&IF(RC[-13]="",,"|n"&R1C20&RC[-13])&IF(RC[-12]="",,"|n"&R1C21&RC[-12])&IF(RC[-10]="",,"|n"&R1C23&RC[-10])&IF(RC[-9]="",,"|n"&R1C24&RC[-9])&IF(RC[-8]="",,"|n"&R1C25&RC[-8])&IF(RC[-7]="",,"|n"&R1C26&RC[-7])&IF(RC[-6]="",,"|n"&R1C27&RC[-6])&IF(RC[-5]="",,"|n"&R1C28&RC[-5])&IF(RC[-2]="",,"|n"&RC[-2]) -> 
AG1274: =IF(RC[-26]&RC[-25]&RC[-24]&RC[-23]&RC[-22]&RC[-21]="",,R1C6)&IF(RC[-26]="",,"|n"&R1C7&RC[-26])&IF(RC[-25]="",,"|n"&R1C8&RC[-25])&IF(RC[-24]="",,"|n"&R1C9&RC[-24])&IF(RC[-23]="",,"|n"&R1C10&RC[-23])&IF(RC[-22]="",,"|n"&R1C11&RC[-22])&IF(RC[-21]="",,"|n"&R1C12&RC[-21])&IF(RC[-19]&RC[-18]&RC[-17]&RC[-16]="",,"|n"&R1C13)&IF(RC[-19]="",,"|n"&R1C14&RC[-19])&IF(RC[-18]="",,"|n"&R1C15&RC[-18])&IF(RC[-17]="",,"|n"&R1C16&RC[-17])&IF(RC[-16]="",,"|n"&R1C17&RC[-16])&IF(RC[-15]="",,"|n"&R1C18&RC[-15])&IF(RC[-14]="",,"|n"&R1C19&RC[-14])&IF(RC[-13]="",,"|n"&R1C20&RC[-13])&IF(RC[-12]="",,"|n"&R1C21&RC[-12])&IF(RC[-10]="",,"|n"&R1C23&RC[-10])&IF(RC[-9]="",,"|n"&R1C24&RC[-9])&IF(RC[-8]="",,"|n"&R1C25&RC[-8])&IF(RC[-7]="",,"|n"&R1C26&RC[-7])&IF(RC[-6]="",,"|n"&R1C27&RC[-6])&IF(RC[-5]="",,"|n"&R1C28&RC[-5])&IF(RC[-2]="",,"|n"&RC[-2]) -> 
AG1275: =IF(RC[-26]&RC[-25]&RC[-24]&RC[-23]&RC[-22]&RC[-21]="",,R1C6)&IF(RC[-26]="",,"|n"&R1C7&RC[-26])&IF(RC[-25]="",,"|n"&R1C8&RC[-25])&IF(RC[-24]="",,"|n"&R1C9&RC[-24])&IF(RC[-23]="",,"|n"&R1C10&RC[-23])&IF(RC[-22]="",,"|n"&R1C11&RC[-22])&IF(RC[-21]="",,"|n"&R1C12&RC[-21])&IF(RC[-19]&RC[-18]&RC[-17]&RC[-16]="",,"|n"&R1C13)&IF(RC[-19]="",,"|n"&R1C14&RC[-19])&IF(RC[-18]="",,"|n"&R1C15&RC[-18])&IF(RC[-17]="",,"|n"&R1C16&RC[-17])&IF(RC[-16]="",,"|n"&R1C17&RC[-16])&IF(RC[-15]="",,"|n"&R1C18&RC[-15])&IF(RC[-14]="",,"|n"&R1C19&RC[-14])&IF(RC[-13]="",,"|n"&R1C20&RC[-13])&IF(RC[-12]="",,"|n"&R1C21&RC[-12])&IF(RC[-10]="",,"|n"&R1C23&RC[-10])&IF(RC[-9]="",,"|n"&R1C24&RC[-9])&IF(RC[-8]="",,"|n"&R1C25&RC[-8])&IF(RC[-7]="",,"|n"&R1C26&RC[-7])&IF(RC[-6]="",,"|n"&R1C27&RC[-6])&IF(RC[-5]="",,"|n"&R1C28&RC[-5])&IF(RC[-2]="",,"|n"&RC[-2]) -> 
AG1276: =IF(RC[-26]&RC[-25]&RC[-24]&RC[-23]&RC[-22]&RC[-21]="",,R1C6)&IF(RC[-26]="",,"|n"&R1C7&RC[-26])&IF(RC[-25]="",,"|n"&R1C8&RC[-25])&IF(RC[-24]="",,"|n"&R1C9&RC[-24])&IF(RC[-23]="",,"|n"&R1C10&RC[-23])&IF(RC[-22]="",,"|n"&R1C11&RC[-22])&IF(RC[-21]="",,"|n"&R1C12&RC[-21])&IF(RC[-19]&RC[-18]&RC[-17]&RC[-16]="",,"|n"&R1C13)&IF(RC[-19]="",,"|n"&R1C14&RC[-19])&IF(RC[-18]="",,"|n"&R1C15&RC[-18])&IF(RC[-17]="",,"|n"&R1C16&RC[-17])&IF(RC[-16]="",,"|n"&R1C17&RC[-16])&IF(RC[-15]="",,"|n"&R1C18&RC[-15])&IF(RC[-14]="",,"|n"&R1C19&RC[-14])&IF(RC[-13]="",,"|n"&R1C20&RC[-13])&IF(RC[-12]="",,"|n"&R1C21&RC[-12])&IF(RC[-10]="",,"|n"&R1C23&RC[-10])&IF(RC[-9]="",,"|n"&R1C24&RC[-9])&IF(RC[-8]="",,"|n"&R1C25&RC[-8])&IF(RC[-7]="",,"|n"&R1C26&RC[-7])&IF(RC[-6]="",,"|n"&R1C27&RC[-6])&IF(RC[-5]="",,"|n"&R1C28&RC[-5])&IF(RC[-2]="",,"|n"&RC[-2]) -> 
AG1277: =IF(RC[-26]&RC[-25]&RC[-24]&RC[-23]&RC[-22]&RC[-21]="",,R1C6)&IF(RC[-26]="",,"|n"&R1C7&RC[-26])&IF(RC[-25]="",,"|n"&R1C8&RC[-25])&IF(RC[-24]="",,"|n"&R1C9&RC[-24])&IF(RC[-23]="",,"|n"&R1C10&RC[-23])&IF(RC[-22]="",,"|n"&R1C11&RC[-22])&IF(RC[-21]="",,"|n"&R1C12&RC[-21])&IF(RC[-19]&RC[-18]&RC[-17]&RC[-16]="",,"|n"&R1C13)&IF(RC[-19]="",,"|n"&R1C14&RC[-19])&IF(RC[-18]="",,"|n"&R1C15&RC[-18])&IF(RC[-17]="",,"|n"&R1C16&RC[-17])&IF(RC[-16]="",,"|n"&R1C17&RC[-16])&IF(RC[-15]="",,"|n"&R1C18&RC[-15])&IF(RC[-14]="",,"|n"&R1C19&RC[-14])&IF(RC[-13]="",,"|n"&R1C20&RC[-13])&IF(RC[-12]="",,"|n"&R1C21&RC[-12])&IF(RC[-10]="",,"|n"&R1C23&RC[-10])&IF(RC[-9]="",,"|n"&R1C24&RC[-9])&IF(RC[-8]="",,"|n"&R1C25&RC[-8])&IF(RC[-7]="",,"|n"&R1C26&RC[-7])&IF(RC[-6]="",,"|n"&R1C27&RC[-6])&IF(RC[-5]="",,"|n"&R1C28&RC[-5])&IF(RC[-2]="",,"|n"&RC[-2]) -> 
AG1278: =IF(RC[-26]&RC[-25]&RC[-24]&RC[-23]&RC[-22]&RC[-21]="",,R1C6)&IF(RC[-26]="",,"|n"&R1C7&RC[-26])&IF(RC[-25]="",,"|n"&R1C8&RC[-25])&IF(RC[-24]="",,"|n"&R1C9&RC[-24])&IF(RC[-23]="",,"|n"&R1C10&RC[-23])&IF(RC[-22]="",,"|n"&R1C11&RC[-22])&IF(RC[-21]="",,"|n"&R1C12&RC[-21])&IF(RC[-19]&RC[-18]&RC[-17]&RC[-16]="",,"|n"&R1C13)&IF(RC[-19]="",,"|n"&R1C14&RC[-19])&IF(RC[-18]="",,"|n"&R1C15&RC[-18])&IF(RC[-17]="",,"|n"&R1C16&RC[-17])&IF(RC[-16]="",,"|n"&R1C17&RC[-16])&IF(RC[-15]="",,"|n"&R1C18&RC[-15])&IF(RC[-14]="",,"|n"&R1C19&RC[-14])&IF(RC[-13]="",,"|n"&R1C20&RC[-13])&IF(RC[-12]="",,"|n"&R1C21&RC[-12])&IF(RC[-10]="",,"|n"&R1C23&RC[-10])&IF(RC[-9]="",,"|n"&R1C24&RC[-9])&IF(RC[-8]="",,"|n"&R1C25&RC[-8])&IF(RC[-7]="",,"|n"&R1C26&RC[-7])&IF(RC[-6]="",,"|n"&R1C27&RC[-6])&IF(RC[-5]="",,"|n"&R1C28&RC[-5])&IF(RC[-2]="",,"|n"&RC[-2]) -> 
AG1279: =IF(RC[-26]&RC[-25]&RC[-24]&RC[-23]&RC[-22]&RC[-21]="",,R1C6)&IF(RC[-26]="",,"|n"&R1C7&RC[-26])&IF(RC[-25]="",,"|n"&R1C8&RC[-25])&IF(RC[-24]="",,"|n"&R1C9&RC[-24])&IF(RC[-23]="",,"|n"&R1C10&RC[-23])&IF(RC[-22]="",,"|n"&R1C11&RC[-22])&IF(RC[-21]="",,"|n"&R1C12&RC[-21])&IF(RC[-19]&RC[-18]&RC[-17]&RC[-16]="",,"|n"&R1C13)&IF(RC[-19]="",,"|n"&R1C14&RC[-19])&IF(RC[-18]="",,"|n"&R1C15&RC[-18])&IF(RC[-17]="",,"|n"&R1C16&RC[-17])&IF(RC[-16]="",,"|n"&R1C17&RC[-16])&IF(RC[-15]="",,"|n"&R1C18&RC[-15])&IF(RC[-14]="",,"|n"&R1C19&RC[-14])&IF(RC[-13]="",,"|n"&R1C20&RC[-13])&IF(RC[-12]="",,"|n"&R1C21&RC[-12])&IF(RC[-10]="",,"|n"&R1C23&RC[-10])&IF(RC[-9]="",,"|n"&R1C24&RC[-9])&IF(RC[-8]="",,"|n"&R1C25&RC[-8])&IF(RC[-7]="",,"|n"&R1C26&RC[-7])&IF(RC[-6]="",,"|n"&R1C27&RC[-6])&IF(RC[-5]="",,"|n"&R1C28&RC[-5])&IF(RC[-2]="",,"|n"&RC[-2]) -> 
AG1280: =IF(RC[-26]&RC[-25]&RC[-24]&RC[-23]&RC[-22]&RC[-21]="",,R1C6)&IF(RC[-26]="",,"|n"&R1C7&RC[-26])&IF(RC[-25]="",,"|n"&R1C8&RC[-25])&IF(RC[-24]="",,"|n"&R1C9&RC[-24])&IF(RC[-23]="",,"|n"&R1C10&RC[-23])&IF(RC[-22]="",,"|n"&R1C11&RC[-22])&IF(RC[-21]="",,"|n"&R1C12&RC[-21])&IF(RC[-19]&RC[-18]&RC[-17]&RC[-16]="",,"|n"&R1C13)&IF(RC[-19]="",,"|n"&R1C14&RC[-19])&IF(RC[-18]="",,"|n"&R1C15&RC[-18])&IF(RC[-17]="",,"|n"&R1C16&RC[-17])&IF(RC[-16]="",,"|n"&R1C17&RC[-16])&IF(RC[-15]="",,"|n"&R1C18&RC[-15])&IF(RC[-14]="",,"|n"&R1C19&RC[-14])&IF(RC[-13]="",,"|n"&R1C20&RC[-13])&IF(RC[-12]="",,"|n"&R1C21&RC[-12])&IF(RC[-10]="",,"|n"&R1C23&RC[-10])&IF(RC[-9]="",,"|n"&R1C24&RC[-9])&IF(RC[-8]="",,"|n"&R1C25&RC[-8])&IF(RC[-7]="",,"|n"&R1C26&RC[-7])&IF(RC[-6]="",,"|n"&R1C27&RC[-6])&IF(RC[-5]="",,"|n"&R1C28&RC[-5])&IF(RC[-2]="",,"|n"&RC[-2]) -> 
AG1281: =IF(RC[-26]&RC[-25]&RC[-24]&RC[-23]&RC[-22]&RC[-21]="",,R1C6)&IF(RC[-26]="",,"|n"&R1C7&RC[-26])&IF(RC[-25]="",,"|n"&R1C8&RC[-25])&IF(RC[-24]="",,"|n"&R1C9&RC[-24])&IF(RC[-23]="",,"|n"&R1C10&RC[-23])&IF(RC[-22]="",,"|n"&R1C11&RC[-22])&IF(RC[-21]="",,"|n"&R1C12&RC[-21])&IF(RC[-19]&RC[-18]&RC[-17]&RC[-16]="",,"|n"&R1C13)&IF(RC[-19]="",,"|n"&R1C14&RC[-19])&IF(RC[-18]="",,"|n"&R1C15&RC[-18])&IF(RC[-17]="",,"|n"&R1C16&RC[-17])&IF(RC[-16]="",,"|n"&R1C17&RC[-16])&IF(RC[-15]="",,"|n"&R1C18&RC[-15])&IF(RC[-14]="",,"|n"&R1C19&RC[-14])&IF(RC[-13]="",,"|n"&R1C20&RC[-13])&IF(RC[-12]="",,"|n"&R1C21&RC[-12])&IF(RC[-10]="",,"|n"&R1C23&RC[-10])&IF(RC[-9]="",,"|n"&R1C24&RC[-9])&IF(RC[-8]="",,"|n"&R1C25&RC[-8])&IF(RC[-7]="",,"|n"&R1C26&RC[-7])&IF(RC[-6]="",,"|n"&R1C27&RC[-6])&IF(RC[-5]="",,"|n"&R1C28&RC[-5])&IF(RC[-2]="",,"|n"&RC[-2]) -> 
AG1282: =IF(RC[-26]&RC[-25]&RC[-24]&RC[-23]&RC[-22]&RC[-21]="",,R1C6)&IF(RC[-26]="",,"|n"&R1C7&RC[-26])&IF(RC[-25]="",,"|n"&R1C8&RC[-25])&IF(RC[-24]="",,"|n"&R1C9&RC[-24])&IF(RC[-23]="",,"|n"&R1C10&RC[-23])&IF(RC[-22]="",,"|n"&R1C11&RC[-22])&IF(RC[-21]="",,"|n"&R1C12&RC[-21])&IF(RC[-19]&RC[-18]&RC[-17]&RC[-16]="",,"|n"&R1C13)&IF(RC[-19]="",,"|n"&R1C14&RC[-19])&IF(RC[-18]="",,"|n"&R1C15&RC[-18])&IF(RC[-17]="",,"|n"&R1C16&RC[-17])&IF(RC[-16]="",,"|n"&R1C17&RC[-16])&IF(RC[-15]="",,"|n"&R1C18&RC[-15])&IF(RC[-14]="",,"|n"&R1C19&RC[-14])&IF(RC[-13]="",,"|n"&R1C20&RC[-13])&IF(RC[-12]="",,"|n"&R1C21&RC[-12])&IF(RC[-10]="",,"|n"&R1C23&RC[-10])&IF(RC[-9]="",,"|n"&R1C24&RC[-9])&IF(RC[-8]="",,"|n"&R1C25&RC[-8])&IF(RC[-7]="",,"|n"&R1C26&RC[-7])&IF(RC[-6]="",,"|n"&R1C27&RC[-6])&IF(RC[-5]="",,"|n"&R1C28&RC[-5])&IF(RC[-2]="",,"|n"&RC[-2]) -> 
AG1283: =IF(RC[-26]&RC[-25]&RC[-24]&RC[-23]&RC[-22]&RC[-21]="",,R1C6)&IF(RC[-26]="",,"|n"&R1C7&RC[-26])&IF(RC[-25]="",,"|n"&R1C8&RC[-25])&IF(RC[-24]="",,"|n"&R1C9&RC[-24])&IF(RC[-23]="",,"|n"&R1C10&RC[-23])&IF(RC[-22]="",,"|n"&R1C11&RC[-22])&IF(RC[-21]="",,"|n"&R1C12&RC[-21])&IF(RC[-19]&RC[-18]&RC[-17]&RC[-16]="",,"|n"&R1C13)&IF(RC[-19]="",,"|n"&R1C14&RC[-19])&IF(RC[-18]="",,"|n"&R1C15&RC[-18])&IF(RC[-17]="",,"|n"&R1C16&RC[-17])&IF(RC[-16]="",,"|n"&R1C17&RC[-16])&IF(RC[-15]="",,"|n"&R1C18&RC[-15])&IF(RC[-14]="",,"|n"&R1C19&RC[-14])&IF(RC[-13]="",,"|n"&R1C20&RC[-13])&IF(RC[-12]="",,"|n"&R1C21&RC[-12])&IF(RC[-10]="",,"|n"&R1C23&RC[-10])&IF(RC[-9]="",,"|n"&R1C24&RC[-9])&IF(RC[-8]="",,"|n"&R1C25&RC[-8])&IF(RC[-7]="",,"|n"&R1C26&RC[-7])&IF(RC[-6]="",,"|n"&R1C27&RC[-6])&IF(RC[-5]="",,"|n"&R1C28&RC[-5])&IF(RC[-2]="",,"|n"&RC[-2]) -> 
AG1284: =IF(RC[-26]&RC[-25]&RC[-24]&RC[-23]&RC[-22]&RC[-21]="",,R1C6)&IF(RC[-26]="",,"|n"&R1C7&RC[-26])&IF(RC[-25]="",,"|n"&R1C8&RC[-25])&IF(RC[-24]="",,"|n"&R1C9&RC[-24])&IF(RC[-23]="",,"|n"&R1C10&RC[-23])&IF(RC[-22]="",,"|n"&R1C11&RC[-22])&IF(RC[-21]="",,"|n"&R1C12&RC[-21])&IF(RC[-19]&RC[-18]&RC[-17]&RC[-16]="",,"|n"&R1C13)&IF(RC[-19]="",,"|n"&R1C14&RC[-19])&IF(RC[-18]="",,"|n"&R1C15&RC[-18])&IF(RC[-17]="",,"|n"&R1C16&RC[-17])&IF(RC[-16]="",,"|n"&R1C17&RC[-16])&IF(RC[-15]="",,"|n"&R1C18&RC[-15])&IF(RC[-14]="",,"|n"&R1C19&RC[-14])&IF(RC[-13]="",,"|n"&R1C20&RC[-13])&IF(RC[-12]="",,"|n"&R1C21&RC[-12])&IF(RC[-10]="",,"|n"&R1C23&RC[-10])&IF(RC[-9]="",,"|n"&R1C24&RC[-9])&IF(RC[-8]="",,"|n"&R1C25&RC[-8])&IF(RC[-7]="",,"|n"&R1C26&RC[-7])&IF(RC[-6]="",,"|n"&R1C27&RC[-6])&IF(RC[-5]="",,"|n"&R1C28&RC[-5])&IF(RC[-2]="",,"|n"&RC[-2]) -> 
AG1285: =IF(RC[-26]&RC[-25]&RC[-24]&RC[-23]&RC[-22]&RC[-21]="",,R1C6)&IF(RC[-26]="",,"|n"&R1C7&RC[-26])&IF(RC[-25]="",,"|n"&R1C8&RC[-25])&IF(RC[-24]="",,"|n"&R1C9&RC[-24])&IF(RC[-23]="",,"|n"&R1C10&RC[-23])&IF(RC[-22]="",,"|n"&R1C11&RC[-22])&IF(RC[-21]="",,"|n"&R1C12&RC[-21])&IF(RC[-19]&RC[-18]&RC[-17]&RC[-16]="",,"|n"&R1C13)&IF(RC[-19]="",,"|n"&R1C14&RC[-19])&IF(RC[-18]="",,"|n"&R1C15&RC[-18])&IF(RC[-17]="",,"|n"&R1C16&RC[-17])&IF(RC[-16]="",,"|n"&R1C17&RC[-16])&IF(RC[-15]="",,"|n"&R1C18&RC[-15])&IF(RC[-14]="",,"|n"&R1C19&RC[-14])&IF(RC[-13]="",,"|n"&R1C20&RC[-13])&IF(RC[-12]="",,"|n"&R1C21&RC[-12])&IF(RC[-10]="",,"|n"&R1C23&RC[-10])&IF(RC[-9]="",,"|n"&R1C24&RC[-9])&IF(RC[-8]="",,"|n"&R1C25&RC[-8])&IF(RC[-7]="",,"|n"&R1C26&RC[-7])&IF(RC[-6]="",,"|n"&R1C27&RC[-6])&IF(RC[-5]="",,"|n"&R1C28&RC[-5])&IF(RC[-2]="",,"|n"&RC[-2]) -> 
AG1286: =IF(RC[-26]&RC[-25]&RC[-24]&RC[-23]&RC[-22]&RC[-21]="",,R1C6)&IF(RC[-26]="",,"|n"&R1C7&RC[-26])&IF(RC[-25]="",,"|n"&R1C8&RC[-25])&IF(RC[-24]="",,"|n"&R1C9&RC[-24])&IF(RC[-23]="",,"|n"&R1C10&RC[-23])&IF(RC[-22]="",,"|n"&R1C11&RC[-22])&IF(RC[-21]="",,"|n"&R1C12&RC[-21])&IF(RC[-19]&RC[-18]&RC[-17]&RC[-16]="",,"|n"&R1C13)&IF(RC[-19]="",,"|n"&R1C14&RC[-19])&IF(RC[-18]="",,"|n"&R1C15&RC[-18])&IF(RC[-17]="",,"|n"&R1C16&RC[-17])&IF(RC[-16]="",,"|n"&R1C17&RC[-16])&IF(RC[-15]="",,"|n"&R1C18&RC[-15])&IF(RC[-14]="",,"|n"&R1C19&RC[-14])&IF(RC[-13]="",,"|n"&R1C20&RC[-13])&IF(RC[-12]="",,"|n"&R1C21&RC[-12])&IF(RC[-10]="",,"|n"&R1C23&RC[-10])&IF(RC[-9]="",,"|n"&R1C24&RC[-9])&IF(RC[-8]="",,"|n"&R1C25&RC[-8])&IF(RC[-7]="",,"|n"&R1C26&RC[-7])&IF(RC[-6]="",,"|n"&R1C27&RC[-6])&IF(RC[-5]="",,"|n"&R1C28&RC[-5])&IF(RC[-2]="",,"|n"&RC[-2]) -> 
AG1287: =IF(RC[-26]&RC[-25]&RC[-24]&RC[-23]&RC[-22]&RC[-21]="",,R1C6)&IF(RC[-26]="",,"|n"&R1C7&RC[-26])&IF(RC[-25]="",,"|n"&R1C8&RC[-25])&IF(RC[-24]="",,"|n"&R1C9&RC[-24])&IF(RC[-23]="",,"|n"&R1C10&RC[-23])&IF(RC[-22]="",,"|n"&R1C11&RC[-22])&IF(RC[-21]="",,"|n"&R1C12&RC[-21])&IF(RC[-19]&RC[-18]&RC[-17]&RC[-16]="",,"|n"&R1C13)&IF(RC[-19]="",,"|n"&R1C14&RC[-19])&IF(RC[-18]="",,"|n"&R1C15&RC[-18])&IF(RC[-17]="",,"|n"&R1C16&RC[-17])&IF(RC[-16]="",,"|n"&R1C17&RC[-16])&IF(RC[-15]="",,"|n"&R1C18&RC[-15])&IF(RC[-14]="",,"|n"&R1C19&RC[-14])&IF(RC[-13]="",,"|n"&R1C20&RC[-13])&IF(RC[-12]="",,"|n"&R1C21&RC[-12])&IF(RC[-10]="",,"|n"&R1C23&RC[-10])&IF(RC[-9]="",,"|n"&R1C24&RC[-9])&IF(RC[-8]="",,"|n"&R1C25&RC[-8])&IF(RC[-7]="",,"|n"&R1C26&RC[-7])&IF(RC[-6]="",,"|n"&R1C27&RC[-6])&IF(RC[-5]="",,"|n"&R1C28&RC[-5])&IF(RC[-2]="",,"|n"&RC[-2]) -> 
AG1288: =IF(RC[-26]&RC[-25]&RC[-24]&RC[-23]&RC[-22]&RC[-21]="",,R1C6)&IF(RC[-26]="",,"|n"&R1C7&RC[-26])&IF(RC[-25]="",,"|n"&R1C8&RC[-25])&IF(RC[-24]="",,"|n"&R1C9&RC[-24])&IF(RC[-23]="",,"|n"&R1C10&RC[-23])&IF(RC[-22]="",,"|n"&R1C11&RC[-22])&IF(RC[-21]="",,"|n"&R1C12&RC[-21])&IF(RC[-19]&RC[-18]&RC[-17]&RC[-16]="",,"|n"&R1C13)&IF(RC[-19]="",,"|n"&R1C14&RC[-19])&IF(RC[-18]="",,"|n"&R1C15&RC[-18])&IF(RC[-17]="",,"|n"&R1C16&RC[-17])&IF(RC[-16]="",,"|n"&R1C17&RC[-16])&IF(RC[-15]="",,"|n"&R1C18&RC[-15])&IF(RC[-14]="",,"|n"&R1C19&RC[-14])&IF(RC[-13]="",,"|n"&R1C20&RC[-13])&IF(RC[-12]="",,"|n"&R1C21&RC[-12])&IF(RC[-10]="",,"|n"&R1C23&RC[-10])&IF(RC[-9]="",,"|n"&R1C24&RC[-9])&IF(RC[-8]="",,"|n"&R1C25&RC[-8])&IF(RC[-7]="",,"|n"&R1C26&RC[-7])&IF(RC[-6]="",,"|n"&R1C27&RC[-6])&IF(RC[-5]="",,"|n"&R1C28&RC[-5])&IF(RC[-2]="",,"|n"&RC[-2]) -> 
AG1289: =IF(RC[-26]&RC[-25]&RC[-24]&RC[-23]&RC[-22]&RC[-21]="",,R1C6)&IF(RC[-26]="",,"|n"&R1C7&RC[-26])&IF(RC[-25]="",,"|n"&R1C8&RC[-25])&IF(RC[-24]="",,"|n"&R1C9&RC[-24])&IF(RC[-23]="",,"|n"&R1C10&RC[-23])&IF(RC[-22]="",,"|n"&R1C11&RC[-22])&IF(RC[-21]="",,"|n"&R1C12&RC[-21])&IF(RC[-19]&RC[-18]&RC[-17]&RC[-16]="",,"|n"&R1C13)&IF(RC[-19]="",,"|n"&R1C14&RC[-19])&IF(RC[-18]="",,"|n"&R1C15&RC[-18])&IF(RC[-17]="",,"|n"&R1C16&RC[-17])&IF(RC[-16]="",,"|n"&R1C17&RC[-16])&IF(RC[-15]="",,"|n"&R1C18&RC[-15])&IF(RC[-14]="",,"|n"&R1C19&RC[-14])&IF(RC[-13]="",,"|n"&R1C20&RC[-13])&IF(RC[-12]="",,"|n"&R1C21&RC[-12])&IF(RC[-10]="",,"|n"&R1C23&RC[-10])&IF(RC[-9]="",,"|n"&R1C24&RC[-9])&IF(RC[-8]="",,"|n"&R1C25&RC[-8])&IF(RC[-7]="",,"|n"&R1C26&RC[-7])&IF(RC[-6]="",,"|n"&R1C27&RC[-6])&IF(RC[-5]="",,"|n"&R1C28&RC[-5])&IF(RC[-2]="",,"|n"&RC[-2]) -> 
AG1290: =IF(RC[-26]&RC[-25]&RC[-24]&RC[-23]&RC[-22]&RC[-21]="",,R1C6)&IF(RC[-26]="",,"|n"&R1C7&RC[-26])&IF(RC[-25]="",,"|n"&R1C8&RC[-25])&IF(RC[-24]="",,"|n"&R1C9&RC[-24])&IF(RC[-23]="",,"|n"&R1C10&RC[-23])&IF(RC[-22]="",,"|n"&R1C11&RC[-22])&IF(RC[-21]="",,"|n"&R1C12&RC[-21])&IF(RC[-19]&RC[-18]&RC[-17]&RC[-16]="",,"|n"&R1C13)&IF(RC[-19]="",,"|n"&R1C14&RC[-19])&IF(RC[-18]="",,"|n"&R1C15&RC[-18])&IF(RC[-17]="",,"|n"&R1C16&RC[-17])&IF(RC[-16]="",,"|n"&R1C17&RC[-16])&IF(RC[-15]="",,"|n"&R1C18&RC[-15])&IF(RC[-14]="",,"|n"&R1C19&RC[-14])&IF(RC[-13]="",,"|n"&R1C20&RC[-13])&IF(RC[-12]="",,"|n"&R1C21&RC[-12])&IF(RC[-10]="",,"|n"&R1C23&RC[-10])&IF(RC[-9]="",,"|n"&R1C24&RC[-9])&IF(RC[-8]="",,"|n"&R1C25&RC[-8])&IF(RC[-7]="",,"|n"&R1C26&RC[-7])&IF(RC[-6]="",,"|n"&R1C27&RC[-6])&IF(RC[-5]="",,"|n"&R1C28&RC[-5])&IF(RC[-2]="",,"|n"&RC[-2]) -> 
AG1291: =IF(RC[-26]&RC[-25]&RC[-24]&RC[-23]&RC[-22]&RC[-21]="",,R1C6)&IF(RC[-26]="",,"|n"&R1C7&RC[-26])&IF(RC[-25]="",,"|n"&R1C8&RC[-25])&IF(RC[-24]="",,"|n"&R1C9&RC[-24])&IF(RC[-23]="",,"|n"&R1C10&RC[-23])&IF(RC[-22]="",,"|n"&R1C11&RC[-22])&IF(RC[-21]="",,"|n"&R1C12&RC[-21])&IF(RC[-19]&RC[-18]&RC[-17]&RC[-16]="",,"|n"&R1C13)&IF(RC[-19]="",,"|n"&R1C14&RC[-19])&IF(RC[-18]="",,"|n"&R1C15&RC[-18])&IF(RC[-17]="",,"|n"&R1C16&RC[-17])&IF(RC[-16]="",,"|n"&R1C17&RC[-16])&IF(RC[-15]="",,"|n"&R1C18&RC[-15])&IF(RC[-14]="",,"|n"&R1C19&RC[-14])&IF(RC[-13]="",,"|n"&R1C20&RC[-13])&IF(RC[-12]="",,"|n"&R1C21&RC[-12])&IF(RC[-10]="",,"|n"&R1C23&RC[-10])&IF(RC[-9]="",,"|n"&R1C24&RC[-9])&IF(RC[-8]="",,"|n"&R1C25&RC[-8])&IF(RC[-7]="",,"|n"&R1C26&RC[-7])&IF(RC[-6]="",,"|n"&R1C27&RC[-6])&IF(RC[-5]="",,"|n"&R1C28&RC[-5])&IF(RC[-2]="",,"|n"&RC[-2]) -> 
AG1292: =IF(RC[-26]&RC[-25]&RC[-24]&RC[-23]&RC[-22]&RC[-21]="",,R1C6)&IF(RC[-26]="",,"|n"&R1C7&RC[-26])&IF(RC[-25]="",,"|n"&R1C8&RC[-25])&IF(RC[-24]="",,"|n"&R1C9&RC[-24])&IF(RC[-23]="",,"|n"&R1C10&RC[-23])&IF(RC[-22]="",,"|n"&R1C11&RC[-22])&IF(RC[-21]="",,"|n"&R1C12&RC[-21])&IF(RC[-19]&RC[-18]&RC[-17]&RC[-16]="",,"|n"&R1C13)&IF(RC[-19]="",,"|n"&R1C14&RC[-19])&IF(RC[-18]="",,"|n"&R1C15&RC[-18])&IF(RC[-17]="",,"|n"&R1C16&RC[-17])&IF(RC[-16]="",,"|n"&R1C17&RC[-16])&IF(RC[-15]="",,"|n"&R1C18&RC[-15])&IF(RC[-14]="",,"|n"&R1C19&RC[-14])&IF(RC[-13]="",,"|n"&R1C20&RC[-13])&IF(RC[-12]="",,"|n"&R1C21&RC[-12])&IF(RC[-10]="",,"|n"&R1C23&RC[-10])&IF(RC[-9]="",,"|n"&R1C24&RC[-9])&IF(RC[-8]="",,"|n"&R1C25&RC[-8])&IF(RC[-7]="",,"|n"&R1C26&RC[-7])&IF(RC[-6]="",,"|n"&R1C27&RC[-6])&IF(RC[-5]="",,"|n"&R1C28&RC[-5])&IF(RC[-2]="",,"|n"&RC[-2]) -> 
AG1293: =IF(RC[-26]&RC[-25]&RC[-24]&RC[-23]&RC[-22]&RC[-21]="",,R1C6)&IF(RC[-26]="",,"|n"&R1C7&RC[-26])&IF(RC[-25]="",,"|n"&R1C8&RC[-25])&IF(RC[-24]="",,"|n"&R1C9&RC[-24])&IF(RC[-23]="",,"|n"&R1C10&RC[-23])&IF(RC[-22]="",,"|n"&R1C11&RC[-22])&IF(RC[-21]="",,"|n"&R1C12&RC[-21])&IF(RC[-19]&RC[-18]&RC[-17]&RC[-16]="",,"|n"&R1C13)&IF(RC[-19]="",,"|n"&R1C14&RC[-19])&IF(RC[-18]="",,"|n"&R1C15&RC[-18])&IF(RC[-17]="",,"|n"&R1C16&RC[-17])&IF(RC[-16]="",,"|n"&R1C17&RC[-16])&IF(RC[-15]="",,"|n"&R1C18&RC[-15])&IF(RC[-14]="",,"|n"&R1C19&RC[-14])&IF(RC[-13]="",,"|n"&R1C20&RC[-13])&IF(RC[-12]="",,"|n"&R1C21&RC[-12])&IF(RC[-10]="",,"|n"&R1C23&RC[-10])&IF(RC[-9]="",,"|n"&R1C24&RC[-9])&IF(RC[-8]="",,"|n"&R1C25&RC[-8])&IF(RC[-7]="",,"|n"&R1C26&RC[-7])&IF(RC[-6]="",,"|n"&R1C27&RC[-6])&IF(RC[-5]="",,"|n"&R1C28&RC[-5])&IF(RC[-2]="",,"|n"&RC[-2]) -> 
AG1294: =IF(RC[-26]&RC[-25]&RC[-24]&RC[-23]&RC[-22]&RC[-21]="",,R1C6)&IF(RC[-26]="",,"|n"&R1C7&RC[-26])&IF(RC[-25]="",,"|n"&R1C8&RC[-25])&IF(RC[-24]="",,"|n"&R1C9&RC[-24])&IF(RC[-23]="",,"|n"&R1C10&RC[-23])&IF(RC[-22]="",,"|n"&R1C11&RC[-22])&IF(RC[-21]="",,"|n"&R1C12&RC[-21])&IF(RC[-19]&RC[-18]&RC[-17]&RC[-16]="",,"|n"&R1C13)&IF(RC[-19]="",,"|n"&R1C14&RC[-19])&IF(RC[-18]="",,"|n"&R1C15&RC[-18])&IF(RC[-17]="",,"|n"&R1C16&RC[-17])&IF(RC[-16]="",,"|n"&R1C17&RC[-16])&IF(RC[-15]="",,"|n"&R1C18&RC[-15])&IF(RC[-14]="",,"|n"&R1C19&RC[-14])&IF(RC[-13]="",,"|n"&R1C20&RC[-13])&IF(RC[-12]="",,"|n"&R1C21&RC[-12])&IF(RC[-10]="",,"|n"&R1C23&RC[-10])&IF(RC[-9]="",,"|n"&R1C24&RC[-9])&IF(RC[-8]="",,"|n"&R1C25&RC[-8])&IF(RC[-7]="",,"|n"&R1C26&RC[-7])&IF(RC[-6]="",,"|n"&R1C27&RC[-6])&IF(RC[-5]="",,"|n"&R1C28&RC[-5])&IF(RC[-2]="",,"|n"&RC[-2]) -> 
AG1295: =IF(RC[-26]&RC[-25]&RC[-24]&RC[-23]&RC[-22]&RC[-21]="",,R1C6)&IF(RC[-26]="",,"|n"&R1C7&RC[-26])&IF(RC[-25]="",,"|n"&R1C8&RC[-25])&IF(RC[-24]="",,"|n"&R1C9&RC[-24])&IF(RC[-23]="",,"|n"&R1C10&RC[-23])&IF(RC[-22]="",,"|n"&R1C11&RC[-22])&IF(RC[-21]="",,"|n"&R1C12&RC[-21])&IF(RC[-19]&RC[-18]&RC[-17]&RC[-16]="",,"|n"&R1C13)&IF(RC[-19]="",,"|n"&R1C14&RC[-19])&IF(RC[-18]="",,"|n"&R1C15&RC[-18])&IF(RC[-17]="",,"|n"&R1C16&RC[-17])&IF(RC[-16]="",,"|n"&R1C17&RC[-16])&IF(RC[-15]="",,"|n"&R1C18&RC[-15])&IF(RC[-14]="",,"|n"&R1C19&RC[-14])&IF(RC[-13]="",,"|n"&R1C20&RC[-13])&IF(RC[-12]="",,"|n"&R1C21&RC[-12])&IF(RC[-10]="",,"|n"&R1C23&RC[-10])&IF(RC[-9]="",,"|n"&R1C24&RC[-9])&IF(RC[-8]="",,"|n"&R1C25&RC[-8])&IF(RC[-7]="",,"|n"&R1C26&RC[-7])&IF(RC[-6]="",,"|n"&R1C27&RC[-6])&IF(RC[-5]="",,"|n"&R1C28&RC[-5])&IF(RC[-2]="",,"|n"&RC[-2]) -> 
AG1296: =IF(RC[-26]&RC[-25]&RC[-24]&RC[-23]&RC[-22]&RC[-21]="",,R1C6)&IF(RC[-26]="",,"|n"&R1C7&RC[-26])&IF(RC[-25]="",,"|n"&R1C8&RC[-25])&IF(RC[-24]="",,"|n"&R1C9&RC[-24])&IF(RC[-23]="",,"|n"&R1C10&RC[-23])&IF(RC[-22]="",,"|n"&R1C11&RC[-22])&IF(RC[-21]="",,"|n"&R1C12&RC[-21])&IF(RC[-19]&RC[-18]&RC[-17]&RC[-16]="",,"|n"&R1C13)&IF(RC[-19]="",,"|n"&R1C14&RC[-19])&IF(RC[-18]="",,"|n"&R1C15&RC[-18])&IF(RC[-17]="",,"|n"&R1C16&RC[-17])&IF(RC[-16]="",,"|n"&R1C17&RC[-16])&IF(RC[-15]="",,"|n"&R1C18&RC[-15])&IF(RC[-14]="",,"|n"&R1C19&RC[-14])&IF(RC[-13]="",,"|n"&R1C20&RC[-13])&IF(RC[-12]="",,"|n"&R1C21&RC[-12])&IF(RC[-10]="",,"|n"&R1C23&RC[-10])&IF(RC[-9]="",,"|n"&R1C24&RC[-9])&IF(RC[-8]="",,"|n"&R1C25&RC[-8])&IF(RC[-7]="",,"|n"&R1C26&RC[-7])&IF(RC[-6]="",,"|n"&R1C27&RC[-6])&IF(RC[-5]="",,"|n"&R1C28&RC[-5])&IF(RC[-2]="",,"|n"&RC[-2]) -> 
AG1297: =IF(RC[-26]&RC[-25]&RC[-24]&RC[-23]&RC[-22]&RC[-21]="",,R1C6)&IF(RC[-26]="",,"|n"&R1C7&RC[-26])&IF(RC[-25]="",,"|n"&R1C8&RC[-25])&IF(RC[-24]="",,"|n"&R1C9&RC[-24])&IF(RC[-23]="",,"|n"&R1C10&RC[-23])&IF(RC[-22]="",,"|n"&R1C11&RC[-22])&IF(RC[-21]="",,"|n"&R1C12&RC[-21])&IF(RC[-19]&RC[-18]&RC[-17]&RC[-16]="",,"|n"&R1C13)&IF(RC[-19]="",,"|n"&R1C14&RC[-19])&IF(RC[-18]="",,"|n"&R1C15&RC[-18])&IF(RC[-17]="",,"|n"&R1C16&RC[-17])&IF(RC[-16]="",,"|n"&R1C17&RC[-16])&IF(RC[-15]="",,"|n"&R1C18&RC[-15])&IF(RC[-14]="",,"|n"&R1C19&RC[-14])&IF(RC[-13]="",,"|n"&R1C20&RC[-13])&IF(RC[-12]="",,"|n"&R1C21&RC[-12])&IF(RC[-10]="",,"|n"&R1C23&RC[-10])&IF(RC[-9]="",,"|n"&R1C24&RC[-9])&IF(RC[-8]="",,"|n"&R1C25&RC[-8])&IF(RC[-7]="",,"|n"&R1C26&RC[-7])&IF(RC[-6]="",,"|n"&R1C27&RC[-6])&IF(RC[-5]="",,"|n"&R1C28&RC[-5])&IF(RC[-2]="",,"|n"&RC[-2]) -> 
AG1298: =IF(RC[-26]&RC[-25]&RC[-24]&RC[-23]&RC[-22]&RC[-21]="",,R1C6)&IF(RC[-26]="",,"|n"&R1C7&RC[-26])&IF(RC[-25]="",,"|n"&R1C8&RC[-25])&IF(RC[-24]="",,"|n"&R1C9&RC[-24])&IF(RC[-23]="",,"|n"&R1C10&RC[-23])&IF(RC[-22]="",,"|n"&R1C11&RC[-22])&IF(RC[-21]="",,"|n"&R1C12&RC[-21])&IF(RC[-19]&RC[-18]&RC[-17]&RC[-16]="",,"|n"&R1C13)&IF(RC[-19]="",,"|n"&R1C14&RC[-19])&IF(RC[-18]="",,"|n"&R1C15&RC[-18])&IF(RC[-17]="",,"|n"&R1C16&RC[-17])&IF(RC[-16]="",,"|n"&R1C17&RC[-16])&IF(RC[-15]="",,"|n"&R1C18&RC[-15])&IF(RC[-14]="",,"|n"&R1C19&RC[-14])&IF(RC[-13]="",,"|n"&R1C20&RC[-13])&IF(RC[-12]="",,"|n"&R1C21&RC[-12])&IF(RC[-10]="",,"|n"&R1C23&RC[-10])&IF(RC[-9]="",,"|n"&R1C24&RC[-9])&IF(RC[-8]="",,"|n"&R1C25&RC[-8])&IF(RC[-7]="",,"|n"&R1C26&RC[-7])&IF(RC[-6]="",,"|n"&R1C27&RC[-6])&IF(RC[-5]="",,"|n"&R1C28&RC[-5])&IF(RC[-2]="",,"|n"&RC[-2]) -> 
AG1299: =IF(RC[-26]&RC[-25]&RC[-24]&RC[-23]&RC[-22]&RC[-21]="",,R1C6)&IF(RC[-26]="",,"|n"&R1C7&RC[-26])&IF(RC[-25]="",,"|n"&R1C8&RC[-25])&IF(RC[-24]="",,"|n"&R1C9&RC[-24])&IF(RC[-23]="",,"|n"&R1C10&RC[-23])&IF(RC[-22]="",,"|n"&R1C11&RC[-22])&IF(RC[-21]="",,"|n"&R1C12&RC[-21])&IF(RC[-19]&RC[-18]&RC[-17]&RC[-16]="",,"|n"&R1C13)&IF(RC[-19]="",,"|n"&R1C14&RC[-19])&IF(RC[-18]="",,"|n"&R1C15&RC[-18])&IF(RC[-17]="",,"|n"&R1C16&RC[-17])&IF(RC[-16]="",,"|n"&R1C17&RC[-16])&IF(RC[-15]="",,"|n"&R1C18&RC[-15])&IF(RC[-14]="",,"|n"&R1C19&RC[-14])&IF(RC[-13]="",,"|n"&R1C20&RC[-13])&IF(RC[-12]="",,"|n"&R1C21&RC[-12])&IF(RC[-10]="",,"|n"&R1C23&RC[-10])&IF(RC[-9]="",,"|n"&R1C24&RC[-9])&IF(RC[-8]="",,"|n"&R1C25&RC[-8])&IF(RC[-7]="",,"|n"&R1C26&RC[-7])&IF(RC[-6]="",,"|n"&R1C27&RC[-6])&IF(RC[-5]="",,"|n"&R1C28&RC[-5])&IF(RC[-2]="",,"|n"&RC[-2]) -> 
AG1300: =IF(RC[-26]&RC[-25]&RC[-24]&RC[-23]&RC[-22]&RC[-21]="",,R1C6)&IF(RC[-26]="",,"|n"&R1C7&RC[-26])&IF(RC[-25]="",,"|n"&R1C8&RC[-25])&IF(RC[-24]="",,"|n"&R1C9&RC[-24])&IF(RC[-23]="",,"|n"&R1C10&RC[-23])&IF(RC[-22]="",,"|n"&R1C11&RC[-22])&IF(RC[-21]="",,"|n"&R1C12&RC[-21])&IF(RC[-19]&RC[-18]&RC[-17]&RC[-16]="",,"|n"&R1C13)&IF(RC[-19]="",,"|n"&R1C14&RC[-19])&IF(RC[-18]="",,"|n"&R1C15&RC[-18])&IF(RC[-17]="",,"|n"&R1C16&RC[-17])&IF(RC[-16]="",,"|n"&R1C17&RC[-16])&IF(RC[-15]="",,"|n"&R1C18&RC[-15])&IF(RC[-14]="",,"|n"&R1C19&RC[-14])&IF(RC[-13]="",,"|n"&R1C20&RC[-13])&IF(RC[-12]="",,"|n"&R1C21&RC[-12])&IF(RC[-10]="",,"|n"&R1C23&RC[-10])&IF(RC[-9]="",,"|n"&R1C24&RC[-9])&IF(RC[-8]="",,"|n"&R1C25&RC[-8])&IF(RC[-7]="",,"|n"&R1C26&RC[-7])&IF(RC[-6]="",,"|n"&R1C27&RC[-6])&IF(RC[-5]="",,"|n"&R1C28&RC[-5])&IF(RC[-2]="",,"|n"&RC[-2]) -> 
AG1301: =IF(RC[-26]&RC[-25]&RC[-24]&RC[-23]&RC[-22]&RC[-21]="",,R1C6)&IF(RC[-26]="",,"|n"&R1C7&RC[-26])&IF(RC[-25]="",,"|n"&R1C8&RC[-25])&IF(RC[-24]="",,"|n"&R1C9&RC[-24])&IF(RC[-23]="",,"|n"&R1C10&RC[-23])&IF(RC[-22]="",,"|n"&R1C11&RC[-22])&IF(RC[-21]="",,"|n"&R1C12&RC[-21])&IF(RC[-19]&RC[-18]&RC[-17]&RC[-16]="",,"|n"&R1C13)&IF(RC[-19]="",,"|n"&R1C14&RC[-19])&IF(RC[-18]="",,"|n"&R1C15&RC[-18])&IF(RC[-17]="",,"|n"&R1C16&RC[-17])&IF(RC[-16]="",,"|n"&R1C17&RC[-16])&IF(RC[-15]="",,"|n"&R1C18&RC[-15])&IF(RC[-14]="",,"|n"&R1C19&RC[-14])&IF(RC[-13]="",,"|n"&R1C20&RC[-13])&IF(RC[-12]="",,"|n"&R1C21&RC[-12])&IF(RC[-10]="",,"|n"&R1C23&RC[-10])&IF(RC[-9]="",,"|n"&R1C24&RC[-9])&IF(RC[-8]="",,"|n"&R1C25&RC[-8])&IF(RC[-7]="",,"|n"&R1C26&RC[-7])&IF(RC[-6]="",,"|n"&R1C27&RC[-6])&IF(RC[-5]="",,"|n"&R1C28&RC[-5])&IF(RC[-2]="",,"|n"&RC[-2]) -> 
AG1302: =IF(RC[-26]&RC[-25]&RC[-24]&RC[-23]&RC[-22]&RC[-21]="",,R1C6)&IF(RC[-26]="",,"|n"&R1C7&RC[-26])&IF(RC[-25]="",,"|n"&R1C8&RC[-25])&IF(RC[-24]="",,"|n"&R1C9&RC[-24])&IF(RC[-23]="",,"|n"&R1C10&RC[-23])&IF(RC[-22]="",,"|n"&R1C11&RC[-22])&IF(RC[-21]="",,"|n"&R1C12&RC[-21])&IF(RC[-19]&RC[-18]&RC[-17]&RC[-16]="",,"|n"&R1C13)&IF(RC[-19]="",,"|n"&R1C14&RC[-19])&IF(RC[-18]="",,"|n"&R1C15&RC[-18])&IF(RC[-17]="",,"|n"&R1C16&RC[-17])&IF(RC[-16]="",,"|n"&R1C17&RC[-16])&IF(RC[-15]="",,"|n"&R1C18&RC[-15])&IF(RC[-14]="",,"|n"&R1C19&RC[-14])&IF(RC[-13]="",,"|n"&R1C20&RC[-13])&IF(RC[-12]="",,"|n"&R1C21&RC[-12])&IF(RC[-10]="",,"|n"&R1C23&RC[-10])&IF(RC[-9]="",,"|n"&R1C24&RC[-9])&IF(RC[-8]="",,"|n"&R1C25&RC[-8])&IF(RC[-7]="",,"|n"&R1C26&RC[-7])&IF(RC[-6]="",,"|n"&R1C27&RC[-6])&IF(RC[-5]="",,"|n"&R1C28&RC[-5])&IF(RC[-2]="",,"|n"&RC[-2]) -> 
AG1303: =IF(RC[-26]&RC[-25]&RC[-24]&RC[-23]&RC[-22]&RC[-21]="",,R1C6)&IF(RC[-26]="",,"|n"&R1C7&RC[-26])&IF(RC[-25]="",,"|n"&R1C8&RC[-25])&IF(RC[-24]="",,"|n"&R1C9&RC[-24])&IF(RC[-23]="",,"|n"&R1C10&RC[-23])&IF(RC[-22]="",,"|n"&R1C11&RC[-22])&IF(RC[-21]="",,"|n"&R1C12&RC[-21])&IF(RC[-19]&RC[-18]&RC[-17]&RC[-16]="",,"|n"&R1C13)&IF(RC[-19]="",,"|n"&R1C14&RC[-19])&IF(RC[-18]="",,"|n"&R1C15&RC[-18])&IF(RC[-17]="",,"|n"&R1C16&RC[-17])&IF(RC[-16]="",,"|n"&R1C17&RC[-16])&IF(RC[-15]="",,"|n"&R1C18&RC[-15])&IF(RC[-14]="",,"|n"&R1C19&RC[-14])&IF(RC[-13]="",,"|n"&R1C20&RC[-13])&IF(RC[-12]="",,"|n"&R1C21&RC[-12])&IF(RC[-10]="",,"|n"&R1C23&RC[-10])&IF(RC[-9]="",,"|n"&R1C24&RC[-9])&IF(RC[-8]="",,"|n"&R1C25&RC[-8])&IF(RC[-7]="",,"|n"&R1C26&RC[-7])&IF(RC[-6]="",,"|n"&R1C27&RC[-6])&IF(RC[-5]="",,"|n"&R1C28&RC[-5])&IF(RC[-2]="",,"|n"&RC[-2]) -> 
AG1304: =IF(RC[-26]&RC[-25]&RC[-24]&RC[-23]&RC[-22]&RC[-21]="",,R1C6)&IF(RC[-26]="",,"|n"&R1C7&RC[-26])&IF(RC[-25]="",,"|n"&R1C8&RC[-25])&IF(RC[-24]="",,"|n"&R1C9&RC[-24])&IF(RC[-23]="",,"|n"&R1C10&RC[-23])&IF(RC[-22]="",,"|n"&R1C11&RC[-22])&IF(RC[-21]="",,"|n"&R1C12&RC[-21])&IF(RC[-19]&RC[-18]&RC[-17]&RC[-16]="",,"|n"&R1C13)&IF(RC[-19]="",,"|n"&R1C14&RC[-19])&IF(RC[-18]="",,"|n"&R1C15&RC[-18])&IF(RC[-17]="",,"|n"&R1C16&RC[-17])&IF(RC[-16]="",,"|n"&R1C17&RC[-16])&IF(RC[-15]="",,"|n"&R1C18&RC[-15])&IF(RC[-14]="",,"|n"&R1C19&RC[-14])&IF(RC[-13]="",,"|n"&R1C20&RC[-13])&IF(RC[-12]="",,"|n"&R1C21&RC[-12])&IF(RC[-10]="",,"|n"&R1C23&RC[-10])&IF(RC[-9]="",,"|n"&R1C24&RC[-9])&IF(RC[-8]="",,"|n"&R1C25&RC[-8])&IF(RC[-7]="",,"|n"&R1C26&RC[-7])&IF(RC[-6]="",,"|n"&R1C27&RC[-6])&IF(RC[-5]="",,"|n"&R1C28&RC[-5])&IF(RC[-2]="",,"|n"&RC[-2]) -> 
AG1305: =IF(RC[-26]&RC[-25]&RC[-24]&RC[-23]&RC[-22]&RC[-21]="",,R1C6)&IF(RC[-26]="",,"|n"&R1C7&RC[-26])&IF(RC[-25]="",,"|n"&R1C8&RC[-25])&IF(RC[-24]="",,"|n"&R1C9&RC[-24])&IF(RC[-23]="",,"|n"&R1C10&RC[-23])&IF(RC[-22]="",,"|n"&R1C11&RC[-22])&IF(RC[-21]="",,"|n"&R1C12&RC[-21])&IF(RC[-19]&RC[-18]&RC[-17]&RC[-16]="",,"|n"&R1C13)&IF(RC[-19]="",,"|n"&R1C14&RC[-19])&IF(RC[-18]="",,"|n"&R1C15&RC[-18])&IF(RC[-17]="",,"|n"&R1C16&RC[-17])&IF(RC[-16]="",,"|n"&R1C17&RC[-16])&IF(RC[-15]="",,"|n"&R1C18&RC[-15])&IF(RC[-14]="",,"|n"&R1C19&RC[-14])&IF(RC[-13]="",,"|n"&R1C20&RC[-13])&IF(RC[-12]="",,"|n"&R1C21&RC[-12])&IF(RC[-10]="",,"|n"&R1C23&RC[-10])&IF(RC[-9]="",,"|n"&R1C24&RC[-9])&IF(RC[-8]="",,"|n"&R1C25&RC[-8])&IF(RC[-7]="",,"|n"&R1C26&RC[-7])&IF(RC[-6]="",,"|n"&R1C27&RC[-6])&IF(RC[-5]="",,"|n"&R1C28&RC[-5])&IF(RC[-2]="",,"|n"&RC[-2]) -> 
AG1306: =IF(RC[-26]&RC[-25]&RC[-24]&RC[-23]&RC[-22]&RC[-21]="",,R1C6)&IF(RC[-26]="",,"|n"&R1C7&RC[-26])&IF(RC[-25]="",,"|n"&R1C8&RC[-25])&IF(RC[-24]="",,"|n"&R1C9&RC[-24])&IF(RC[-23]="",,"|n"&R1C10&RC[-23])&IF(RC[-22]="",,"|n"&R1C11&RC[-22])&IF(RC[-21]="",,"|n"&R1C12&RC[-21])&IF(RC[-19]&RC[-18]&RC[-17]&RC[-16]="",,"|n"&R1C13)&IF(RC[-19]="",,"|n"&R1C14&RC[-19])&IF(RC[-18]="",,"|n"&R1C15&RC[-18])&IF(RC[-17]="",,"|n"&R1C16&RC[-17])&IF(RC[-16]="",,"|n"&R1C17&RC[-16])&IF(RC[-15]="",,"|n"&R1C18&RC[-15])&IF(RC[-14]="",,"|n"&R1C19&RC[-14])&IF(RC[-13]="",,"|n"&R1C20&RC[-13])&IF(RC[-12]="",,"|n"&R1C21&RC[-12])&IF(RC[-10]="",,"|n"&R1C23&RC[-10])&IF(RC[-9]="",,"|n"&R1C24&RC[-9])&IF(RC[-8]="",,"|n"&R1C25&RC[-8])&IF(RC[-7]="",,"|n"&R1C26&RC[-7])&IF(RC[-6]="",,"|n"&R1C27&RC[-6])&IF(RC[-5]="",,"|n"&R1C28&RC[-5])&IF(RC[-2]="",,"|n"&RC[-2]) -> 
AG1307: =IF(RC[-26]&RC[-25]&RC[-24]&RC[-23]&RC[-22]&RC[-21]="",,R1C6)&IF(RC[-26]="",,"|n"&R1C7&RC[-26])&IF(RC[-25]="",,"|n"&R1C8&RC[-25])&IF(RC[-24]="",,"|n"&R1C9&RC[-24])&IF(RC[-23]="",,"|n"&R1C10&RC[-23])&IF(RC[-22]="",,"|n"&R1C11&RC[-22])&IF(RC[-21]="",,"|n"&R1C12&RC[-21])&IF(RC[-19]&RC[-18]&RC[-17]&RC[-16]="",,"|n"&R1C13)&IF(RC[-19]="",,"|n"&R1C14&RC[-19])&IF(RC[-18]="",,"|n"&R1C15&RC[-18])&IF(RC[-17]="",,"|n"&R1C16&RC[-17])&IF(RC[-16]="",,"|n"&R1C17&RC[-16])&IF(RC[-15]="",,"|n"&R1C18&RC[-15])&IF(RC[-14]="",,"|n"&R1C19&RC[-14])&IF(RC[-13]="",,"|n"&R1C20&RC[-13])&IF(RC[-12]="",,"|n"&R1C21&RC[-12])&IF(RC[-10]="",,"|n"&R1C23&RC[-10])&IF(RC[-9]="",,"|n"&R1C24&RC[-9])&IF(RC[-8]="",,"|n"&R1C25&RC[-8])&IF(RC[-7]="",,"|n"&R1C26&RC[-7])&IF(RC[-6]="",,"|n"&R1C27&RC[-6])&IF(RC[-5]="",,"|n"&R1C28&RC[-5])&IF(RC[-2]="",,"|n"&RC[-2]) -> 
AG1308: =IF(RC[-26]&RC[-25]&RC[-24]&RC[-23]&RC[-22]&RC[-21]="",,R1C6)&IF(RC[-26]="",,"|n"&R1C7&RC[-26])&IF(RC[-25]="",,"|n"&R1C8&RC[-25])&IF(RC[-24]="",,"|n"&R1C9&RC[-24])&IF(RC[-23]="",,"|n"&R1C10&RC[-23])&IF(RC[-22]="",,"|n"&R1C11&RC[-22])&IF(RC[-21]="",,"|n"&R1C12&RC[-21])&IF(RC[-19]&RC[-18]&RC[-17]&RC[-16]="",,"|n"&R1C13)&IF(RC[-19]="",,"|n"&R1C14&RC[-19])&IF(RC[-18]="",,"|n"&R1C15&RC[-18])&IF(RC[-17]="",,"|n"&R1C16&RC[-17])&IF(RC[-16]="",,"|n"&R1C17&RC[-16])&IF(RC[-15]="",,"|n"&R1C18&RC[-15])&IF(RC[-14]="",,"|n"&R1C19&RC[-14])&IF(RC[-13]="",,"|n"&R1C20&RC[-13])&IF(RC[-12]="",,"|n"&R1C21&RC[-12])&IF(RC[-10]="",,"|n"&R1C23&RC[-10])&IF(RC[-9]="",,"|n"&R1C24&RC[-9])&IF(RC[-8]="",,"|n"&R1C25&RC[-8])&IF(RC[-7]="",,"|n"&R1C26&RC[-7])&IF(RC[-6]="",,"|n"&R1C27&RC[-6])&IF(RC[-5]="",,"|n"&R1C28&RC[-5])&IF(RC[-2]="",,"|n"&RC[-2]) -> 
AG1309: =IF(RC[-26]&RC[-25]&RC[-24]&RC[-23]&RC[-22]&RC[-21]="",,R1C6)&IF(RC[-26]="",,"|n"&R1C7&RC[-26])&IF(RC[-25]="",,"|n"&R1C8&RC[-25])&IF(RC[-24]="",,"|n"&R1C9&RC[-24])&IF(RC[-23]="",,"|n"&R1C10&RC[-23])&IF(RC[-22]="",,"|n"&R1C11&RC[-22])&IF(RC[-21]="",,"|n"&R1C12&RC[-21])&IF(RC[-19]&RC[-18]&RC[-17]&RC[-16]="",,"|n"&R1C13)&IF(RC[-19]="",,"|n"&R1C14&RC[-19])&IF(RC[-18]="",,"|n"&R1C15&RC[-18])&IF(RC[-17]="",,"|n"&R1C16&RC[-17])&IF(RC[-16]="",,"|n"&R1C17&RC[-16])&IF(RC[-15]="",,"|n"&R1C18&RC[-15])&IF(RC[-14]="",,"|n"&R1C19&RC[-14])&IF(RC[-13]="",,"|n"&R1C20&RC[-13])&IF(RC[-12]="",,"|n"&R1C21&RC[-12])&IF(RC[-10]="",,"|n"&R1C23&RC[-10])&IF(RC[-9]="",,"|n"&R1C24&RC[-9])&IF(RC[-8]="",,"|n"&R1C25&RC[-8])&IF(RC[-7]="",,"|n"&R1C26&RC[-7])&IF(RC[-6]="",,"|n"&R1C27&RC[-6])&IF(RC[-5]="",,"|n"&R1C28&RC[-5])&IF(RC[-2]="",,"|n"&RC[-2]) -> 
AG1310: =IF(RC[-26]&RC[-25]&RC[-24]&RC[-23]&RC[-22]&RC[-21]="",,R1C6)&IF(RC[-26]="",,"|n"&R1C7&RC[-26])&IF(RC[-25]="",,"|n"&R1C8&RC[-25])&IF(RC[-24]="",,"|n"&R1C9&RC[-24])&IF(RC[-23]="",,"|n"&R1C10&RC[-23])&IF(RC[-22]="",,"|n"&R1C11&RC[-22])&IF(RC[-21]="",,"|n"&R1C12&RC[-21])&IF(RC[-19]&RC[-18]&RC[-17]&RC[-16]="",,"|n"&R1C13)&IF(RC[-19]="",,"|n"&R1C14&RC[-19])&IF(RC[-18]="",,"|n"&R1C15&RC[-18])&IF(RC[-17]="",,"|n"&R1C16&RC[-17])&IF(RC[-16]="",,"|n"&R1C17&RC[-16])&IF(RC[-15]="",,"|n"&R1C18&RC[-15])&IF(RC[-14]="",,"|n"&R1C19&RC[-14])&IF(RC[-13]="",,"|n"&R1C20&RC[-13])&IF(RC[-12]="",,"|n"&R1C21&RC[-12])&IF(RC[-10]="",,"|n"&R1C23&RC[-10])&IF(RC[-9]="",,"|n"&R1C24&RC[-9])&IF(RC[-8]="",,"|n"&R1C25&RC[-8])&IF(RC[-7]="",,"|n"&R1C26&RC[-7])&IF(RC[-6]="",,"|n"&R1C27&RC[-6])&IF(RC[-5]="",,"|n"&R1C28&RC[-5])&IF(RC[-2]="",,"|n"&RC[-2]) -> 
AG1311: =IF(RC[-26]&RC[-25]&RC[-24]&RC[-23]&RC[-22]&RC[-21]="",,R1C6)&IF(RC[-26]="",,"|n"&R1C7&RC[-26])&IF(RC[-25]="",,"|n"&R1C8&RC[-25])&IF(RC[-24]="",,"|n"&R1C9&RC[-24])&IF(RC[-23]="",,"|n"&R1C10&RC[-23])&IF(RC[-22]="",,"|n"&R1C11&RC[-22])&IF(RC[-21]="",,"|n"&R1C12&RC[-21])&IF(RC[-19]&RC[-18]&RC[-17]&RC[-16]="",,"|n"&R1C13)&IF(RC[-19]="",,"|n"&R1C14&RC[-19])&IF(RC[-18]="",,"|n"&R1C15&RC[-18])&IF(RC[-17]="",,"|n"&R1C16&RC[-17])&IF(RC[-16]="",,"|n"&R1C17&RC[-16])&IF(RC[-15]="",,"|n"&R1C18&RC[-15])&IF(RC[-14]="",,"|n"&R1C19&RC[-14])&IF(RC[-13]="",,"|n"&R1C20&RC[-13])&IF(RC[-12]="",,"|n"&R1C21&RC[-12])&IF(RC[-10]="",,"|n"&R1C23&RC[-10])&IF(RC[-9]="",,"|n"&R1C24&RC[-9])&IF(RC[-8]="",,"|n"&R1C25&RC[-8])&IF(RC[-7]="",,"|n"&R1C26&RC[-7])&IF(RC[-6]="",,"|n"&R1C27&RC[-6])&IF(RC[-5]="",,"|n"&R1C28&RC[-5])&IF(RC[-2]="",,"|n"&RC[-2]) -> 
AG1312: =IF(RC[-26]&RC[-25]&RC[-24]&RC[-23]&RC[-22]&RC[-21]="",,R1C6)&IF(RC[-26]="",,"|n"&R1C7&RC[-26])&IF(RC[-25]="",,"|n"&R1C8&RC[-25])&IF(RC[-24]="",,"|n"&R1C9&RC[-24])&IF(RC[-23]="",,"|n"&R1C10&RC[-23])&IF(RC[-22]="",,"|n"&R1C11&RC[-22])&IF(RC[-21]="",,"|n"&R1C12&RC[-21])&IF(RC[-19]&RC[-18]&RC[-17]&RC[-16]="",,"|n"&R1C13)&IF(RC[-19]="",,"|n"&R1C14&RC[-19])&IF(RC[-18]="",,"|n"&R1C15&RC[-18])&IF(RC[-17]="",,"|n"&R1C16&RC[-17])&IF(RC[-16]="",,"|n"&R1C17&RC[-16])&IF(RC[-15]="",,"|n"&R1C18&RC[-15])&IF(RC[-14]="",,"|n"&R1C19&RC[-14])&IF(RC[-13]="",,"|n"&R1C20&RC[-13])&IF(RC[-12]="",,"|n"&R1C21&RC[-12])&IF(RC[-10]="",,"|n"&R1C23&RC[-10])&IF(RC[-9]="",,"|n"&R1C24&RC[-9])&IF(RC[-8]="",,"|n"&R1C25&RC[-8])&IF(RC[-7]="",,"|n"&R1C26&RC[-7])&IF(RC[-6]="",,"|n"&R1C27&RC[-6])&IF(RC[-5]="",,"|n"&R1C28&RC[-5])&IF(RC[-2]="",,"|n"&RC[-2]) -> 
AG1313: =IF(RC[-26]&RC[-25]&RC[-24]&RC[-23]&RC[-22]&RC[-21]="",,R1C6)&IF(RC[-26]="",,"|n"&R1C7&RC[-26])&IF(RC[-25]="",,"|n"&R1C8&RC[-25])&IF(RC[-24]="",,"|n"&R1C9&RC[-24])&IF(RC[-23]="",,"|n"&R1C10&RC[-23])&IF(RC[-22]="",,"|n"&R1C11&RC[-22])&IF(RC[-21]="",,"|n"&R1C12&RC[-21])&IF(RC[-19]&RC[-18]&RC[-17]&RC[-16]="",,"|n"&R1C13)&IF(RC[-19]="",,"|n"&R1C14&RC[-19])&IF(RC[-18]="",,"|n"&R1C15&RC[-18])&IF(RC[-17]="",,"|n"&R1C16&RC[-17])&IF(RC[-16]="",,"|n"&R1C17&RC[-16])&IF(RC[-15]="",,"|n"&R1C18&RC[-15])&IF(RC[-14]="",,"|n"&R1C19&RC[-14])&IF(RC[-13]="",,"|n"&R1C20&RC[-13])&IF(RC[-12]="",,"|n"&R1C21&RC[-12])&IF(RC[-10]="",,"|n"&R1C23&RC[-10])&IF(RC[-9]="",,"|n"&R1C24&RC[-9])&IF(RC[-8]="",,"|n"&R1C25&RC[-8])&IF(RC[-7]="",,"|n"&R1C26&RC[-7])&IF(RC[-6]="",,"|n"&R1C27&RC[-6])&IF(RC[-5]="",,"|n"&R1C28&RC[-5])&IF(RC[-2]="",,"|n"&RC[-2]) -> 
AG1314: =IF(RC[-26]&RC[-25]&RC[-24]&RC[-23]&RC[-22]&RC[-21]="",,R1C6)&IF(RC[-26]="",,"|n"&R1C7&RC[-26])&IF(RC[-25]="",,"|n"&R1C8&RC[-25])&IF(RC[-24]="",,"|n"&R1C9&RC[-24])&IF(RC[-23]="",,"|n"&R1C10&RC[-23])&IF(RC[-22]="",,"|n"&R1C11&RC[-22])&IF(RC[-21]="",,"|n"&R1C12&RC[-21])&IF(RC[-19]&RC[-18]&RC[-17]&RC[-16]="",,"|n"&R1C13)&IF(RC[-19]="",,"|n"&R1C14&RC[-19])&IF(RC[-18]="",,"|n"&R1C15&RC[-18])&IF(RC[-17]="",,"|n"&R1C16&RC[-17])&IF(RC[-16]="",,"|n"&R1C17&RC[-16])&IF(RC[-15]="",,"|n"&R1C18&RC[-15])&IF(RC[-14]="",,"|n"&R1C19&RC[-14])&IF(RC[-13]="",,"|n"&R1C20&RC[-13])&IF(RC[-12]="",,"|n"&R1C21&RC[-12])&IF(RC[-10]="",,"|n"&R1C23&RC[-10])&IF(RC[-9]="",,"|n"&R1C24&RC[-9])&IF(RC[-8]="",,"|n"&R1C25&RC[-8])&IF(RC[-7]="",,"|n"&R1C26&RC[-7])&IF(RC[-6]="",,"|n"&R1C27&RC[-6])&IF(RC[-5]="",,"|n"&R1C28&RC[-5])&IF(RC[-2]="",,"|n"&RC[-2]) -> 
AG1315: =IF(RC[-26]&RC[-25]&RC[-24]&RC[-23]&RC[-22]&RC[-21]="",,R1C6)&IF(RC[-26]="",,"|n"&R1C7&RC[-26])&IF(RC[-25]="",,"|n"&R1C8&RC[-25])&IF(RC[-24]="",,"|n"&R1C9&RC[-24])&IF(RC[-23]="",,"|n"&R1C10&RC[-23])&IF(RC[-22]="",,"|n"&R1C11&RC[-22])&IF(RC[-21]="",,"|n"&R1C12&RC[-21])&IF(RC[-19]&RC[-18]&RC[-17]&RC[-16]="",,"|n"&R1C13)&IF(RC[-19]="",,"|n"&R1C14&RC[-19])&IF(RC[-18]="",,"|n"&R1C15&RC[-18])&IF(RC[-17]="",,"|n"&R1C16&RC[-17])&IF(RC[-16]="",,"|n"&R1C17&RC[-16])&IF(RC[-15]="",,"|n"&R1C18&RC[-15])&IF(RC[-14]="",,"|n"&R1C19&RC[-14])&IF(RC[-13]="",,"|n"&R1C20&RC[-13])&IF(RC[-12]="",,"|n"&R1C21&RC[-12])&IF(RC[-10]="",,"|n"&R1C23&RC[-10])&IF(RC[-9]="",,"|n"&R1C24&RC[-9])&IF(RC[-8]="",,"|n"&R1C25&RC[-8])&IF(RC[-7]="",,"|n"&R1C26&RC[-7])&IF(RC[-6]="",,"|n"&R1C27&RC[-6])&IF(RC[-5]="",,"|n"&R1C28&RC[-5])&IF(RC[-2]="",,"|n"&RC[-2]) -> 
AG1316: =IF(RC[-26]&RC[-25]&RC[-24]&RC[-23]&RC[-22]&RC[-21]="",,R1C6)&IF(RC[-26]="",,"|n"&R1C7&RC[-26])&IF(RC[-25]="",,"|n"&R1C8&RC[-25])&IF(RC[-24]="",,"|n"&R1C9&RC[-24])&IF(RC[-23]="",,"|n"&R1C10&RC[-23])&IF(RC[-22]="",,"|n"&R1C11&RC[-22])&IF(RC[-21]="",,"|n"&R1C12&RC[-21])&IF(RC[-19]&RC[-18]&RC[-17]&RC[-16]="",,"|n"&R1C13)&IF(RC[-19]="",,"|n"&R1C14&RC[-19])&IF(RC[-18]="",,"|n"&R1C15&RC[-18])&IF(RC[-17]="",,"|n"&R1C16&RC[-17])&IF(RC[-16]="",,"|n"&R1C17&RC[-16])&IF(RC[-15]="",,"|n"&R1C18&RC[-15])&IF(RC[-14]="",,"|n"&R1C19&RC[-14])&IF(RC[-13]="",,"|n"&R1C20&RC[-13])&IF(RC[-12]="",,"|n"&R1C21&RC[-12])&IF(RC[-10]="",,"|n"&R1C23&RC[-10])&IF(RC[-9]="",,"|n"&R1C24&RC[-9])&IF(RC[-8]="",,"|n"&R1C25&RC[-8])&IF(RC[-7]="",,"|n"&R1C26&RC[-7])&IF(RC[-6]="",,"|n"&R1C27&RC[-6])&IF(RC[-5]="",,"|n"&R1C28&RC[-5])&IF(RC[-2]="",,"|n"&RC[-2]) -> 
AG1317: =IF(RC[-26]&RC[-25]&RC[-24]&RC[-23]&RC[-22]&RC[-21]="",,R1C6)&IF(RC[-26]="",,"|n"&R1C7&RC[-26])&IF(RC[-25]="",,"|n"&R1C8&RC[-25])&IF(RC[-24]="",,"|n"&R1C9&RC[-24])&IF(RC[-23]="",,"|n"&R1C10&RC[-23])&IF(RC[-22]="",,"|n"&R1C11&RC[-22])&IF(RC[-21]="",,"|n"&R1C12&RC[-21])&IF(RC[-19]&RC[-18]&RC[-17]&RC[-16]="",,"|n"&R1C13)&IF(RC[-19]="",,"|n"&R1C14&RC[-19])&IF(RC[-18]="",,"|n"&R1C15&RC[-18])&IF(RC[-17]="",,"|n"&R1C16&RC[-17])&IF(RC[-16]="",,"|n"&R1C17&RC[-16])&IF(RC[-15]="",,"|n"&R1C18&RC[-15])&IF(RC[-14]="",,"|n"&R1C19&RC[-14])&IF(RC[-13]="",,"|n"&R1C20&RC[-13])&IF(RC[-12]="",,"|n"&R1C21&RC[-12])&IF(RC[-10]="",,"|n"&R1C23&RC[-10])&IF(RC[-9]="",,"|n"&R1C24&RC[-9])&IF(RC[-8]="",,"|n"&R1C25&RC[-8])&IF(RC[-7]="",,"|n"&R1C26&RC[-7])&IF(RC[-6]="",,"|n"&R1C27&RC[-6])&IF(RC[-5]="",,"|n"&R1C28&RC[-5])&IF(RC[-2]="",,"|n"&RC[-2]) -> 
AG1318: =IF(RC[-26]&RC[-25]&RC[-24]&RC[-23]&RC[-22]&RC[-21]="",,R1C6)&IF(RC[-26]="",,"|n"&R1C7&RC[-26])&IF(RC[-25]="",,"|n"&R1C8&RC[-25])&IF(RC[-24]="",,"|n"&R1C9&RC[-24])&IF(RC[-23]="",,"|n"&R1C10&RC[-23])&IF(RC[-22]="",,"|n"&R1C11&RC[-22])&IF(RC[-21]="",,"|n"&R1C12&RC[-21])&IF(RC[-19]&RC[-18]&RC[-17]&RC[-16]="",,"|n"&R1C13)&IF(RC[-19]="",,"|n"&R1C14&RC[-19])&IF(RC[-18]="",,"|n"&R1C15&RC[-18])&IF(RC[-17]="",,"|n"&R1C16&RC[-17])&IF(RC[-16]="",,"|n"&R1C17&RC[-16])&IF(RC[-15]="",,"|n"&R1C18&RC[-15])&IF(RC[-14]="",,"|n"&R1C19&RC[-14])&IF(RC[-13]="",,"|n"&R1C20&RC[-13])&IF(RC[-12]="",,"|n"&R1C21&RC[-12])&IF(RC[-10]="",,"|n"&R1C23&RC[-10])&IF(RC[-9]="",,"|n"&R1C24&RC[-9])&IF(RC[-8]="",,"|n"&R1C25&RC[-8])&IF(RC[-7]="",,"|n"&R1C26&RC[-7])&IF(RC[-6]="",,"|n"&R1C27&RC[-6])&IF(RC[-5]="",,"|n"&R1C28&RC[-5])&IF(RC[-2]="",,"|n"&RC[-2]) -> 
AG1319: =IF(RC[-26]&RC[-25]&RC[-24]&RC[-23]&RC[-22]&RC[-21]="",,R1C6)&IF(RC[-26]="",,"|n"&R1C7&RC[-26])&IF(RC[-25]="",,"|n"&R1C8&RC[-25])&IF(RC[-24]="",,"|n"&R1C9&RC[-24])&IF(RC[-23]="",,"|n"&R1C10&RC[-23])&IF(RC[-22]="",,"|n"&R1C11&RC[-22])&IF(RC[-21]="",,"|n"&R1C12&RC[-21])&IF(RC[-19]&RC[-18]&RC[-17]&RC[-16]="",,"|n"&R1C13)&IF(RC[-19]="",,"|n"&R1C14&RC[-19])&IF(RC[-18]="",,"|n"&R1C15&RC[-18])&IF(RC[-17]="",,"|n"&R1C16&RC[-17])&IF(RC[-16]="",,"|n"&R1C17&RC[-16])&IF(RC[-15]="",,"|n"&R1C18&RC[-15])&IF(RC[-14]="",,"|n"&R1C19&RC[-14])&IF(RC[-13]="",,"|n"&R1C20&RC[-13])&IF(RC[-12]="",,"|n"&R1C21&RC[-12])&IF(RC[-10]="",,"|n"&R1C23&RC[-10])&IF(RC[-9]="",,"|n"&R1C24&RC[-9])&IF(RC[-8]="",,"|n"&R1C25&RC[-8])&IF(RC[-7]="",,"|n"&R1C26&RC[-7])&IF(RC[-6]="",,"|n"&R1C27&RC[-6])&IF(RC[-5]="",,"|n"&R1C28&RC[-5])&IF(RC[-2]="",,"|n"&RC[-2]) -> 
AG1320: =IF(RC[-26]&RC[-25]&RC[-24]&RC[-23]&RC[-22]&RC[-21]="",,R1C6)&IF(RC[-26]="",,"|n"&R1C7&RC[-26])&IF(RC[-25]="",,"|n"&R1C8&RC[-25])&IF(RC[-24]="",,"|n"&R1C9&RC[-24])&IF(RC[-23]="",,"|n"&R1C10&RC[-23])&IF(RC[-22]="",,"|n"&R1C11&RC[-22])&IF(RC[-21]="",,"|n"&R1C12&RC[-21])&IF(RC[-19]&RC[-18]&RC[-17]&RC[-16]="",,"|n"&R1C13)&IF(RC[-19]="",,"|n"&R1C14&RC[-19])&IF(RC[-18]="",,"|n"&R1C15&RC[-18])&IF(RC[-17]="",,"|n"&R1C16&RC[-17])&IF(RC[-16]="",,"|n"&R1C17&RC[-16])&IF(RC[-15]="",,"|n"&R1C18&RC[-15])&IF(RC[-14]="",,"|n"&R1C19&RC[-14])&IF(RC[-13]="",,"|n"&R1C20&RC[-13])&IF(RC[-12]="",,"|n"&R1C21&RC[-12])&IF(RC[-10]="",,"|n"&R1C23&RC[-10])&IF(RC[-9]="",,"|n"&R1C24&RC[-9])&IF(RC[-8]="",,"|n"&R1C25&RC[-8])&IF(RC[-7]="",,"|n"&R1C26&RC[-7])&IF(RC[-6]="",,"|n"&R1C27&RC[-6])&IF(RC[-5]="",,"|n"&R1C28&RC[-5])&IF(RC[-2]="",,"|n"&RC[-2]) -> 
AG1321: =IF(RC[-26]&RC[-25]&RC[-24]&RC[-23]&RC[-22]&RC[-21]="",,R1C6)&IF(RC[-26]="",,"|n"&R1C7&RC[-26])&IF(RC[-25]="",,"|n"&R1C8&RC[-25])&IF(RC[-24]="",,"|n"&R1C9&RC[-24])&IF(RC[-23]="",,"|n"&R1C10&RC[-23])&IF(RC[-22]="",,"|n"&R1C11&RC[-22])&IF(RC[-21]="",,"|n"&R1C12&RC[-21])&IF(RC[-19]&RC[-18]&RC[-17]&RC[-16]="",,"|n"&R1C13)&IF(RC[-19]="",,"|n"&R1C14&RC[-19])&IF(RC[-18]="",,"|n"&R1C15&RC[-18])&IF(RC[-17]="",,"|n"&R1C16&RC[-17])&IF(RC[-16]="",,"|n"&R1C17&RC[-16])&IF(RC[-15]="",,"|n"&R1C18&RC[-15])&IF(RC[-14]="",,"|n"&R1C19&RC[-14])&IF(RC[-13]="",,"|n"&R1C20&RC[-13])&IF(RC[-12]="",,"|n"&R1C21&RC[-12])&IF(RC[-10]="",,"|n"&R1C23&RC[-10])&IF(RC[-9]="",,"|n"&R1C24&RC[-9])&IF(RC[-8]="",,"|n"&R1C25&RC[-8])&IF(RC[-7]="",,"|n"&R1C26&RC[-7])&IF(RC[-6]="",,"|n"&R1C27&RC[-6])&IF(RC[-5]="",,"|n"&R1C28&RC[-5])&IF(RC[-2]="",,"|n"&RC[-2]) -> 
AG1322: =IF(RC[-26]&RC[-25]&RC[-24]&RC[-23]&RC[-22]&RC[-21]="",,R1C6)&IF(RC[-26]="",,"|n"&R1C7&RC[-26])&IF(RC[-25]="",,"|n"&R1C8&RC[-25])&IF(RC[-24]="",,"|n"&R1C9&RC[-24])&IF(RC[-23]="",,"|n"&R1C10&RC[-23])&IF(RC[-22]="",,"|n"&R1C11&RC[-22])&IF(RC[-21]="",,"|n"&R1C12&RC[-21])&IF(RC[-19]&RC[-18]&RC[-17]&RC[-16]="",,"|n"&R1C13)&IF(RC[-19]="",,"|n"&R1C14&RC[-19])&IF(RC[-18]="",,"|n"&R1C15&RC[-18])&IF(RC[-17]="",,"|n"&R1C16&RC[-17])&IF(RC[-16]="",,"|n"&R1C17&RC[-16])&IF(RC[-15]="",,"|n"&R1C18&RC[-15])&IF(RC[-14]="",,"|n"&R1C19&RC[-14])&IF(RC[-13]="",,"|n"&R1C20&RC[-13])&IF(RC[-12]="",,"|n"&R1C21&RC[-12])&IF(RC[-10]="",,"|n"&R1C23&RC[-10])&IF(RC[-9]="",,"|n"&R1C24&RC[-9])&IF(RC[-8]="",,"|n"&R1C25&RC[-8])&IF(RC[-7]="",,"|n"&R1C26&RC[-7])&IF(RC[-6]="",,"|n"&R1C27&RC[-6])&IF(RC[-5]="",,"|n"&R1C28&RC[-5])&IF(RC[-2]="",,"|n"&RC[-2]) -> 
AG1323: =IF(RC[-26]&RC[-25]&RC[-24]&RC[-23]&RC[-22]&RC[-21]="",,R1C6)&IF(RC[-26]="",,"|n"&R1C7&RC[-26])&IF(RC[-25]="",,"|n"&R1C8&RC[-25])&IF(RC[-24]="",,"|n"&R1C9&RC[-24])&IF(RC[-23]="",,"|n"&R1C10&RC[-23])&IF(RC[-22]="",,"|n"&R1C11&RC[-22])&IF(RC[-21]="",,"|n"&R1C12&RC[-21])&IF(RC[-19]&RC[-18]&RC[-17]&RC[-16]="",,"|n"&R1C13)&IF(RC[-19]="",,"|n"&R1C14&RC[-19])&IF(RC[-18]="",,"|n"&R1C15&RC[-18])&IF(RC[-17]="",,"|n"&R1C16&RC[-17])&IF(RC[-16]="",,"|n"&R1C17&RC[-16])&IF(RC[-15]="",,"|n"&R1C18&RC[-15])&IF(RC[-14]="",,"|n"&R1C19&RC[-14])&IF(RC[-13]="",,"|n"&R1C20&RC[-13])&IF(RC[-12]="",,"|n"&R1C21&RC[-12])&IF(RC[-10]="",,"|n"&R1C23&RC[-10])&IF(RC[-9]="",,"|n"&R1C24&RC[-9])&IF(RC[-8]="",,"|n"&R1C25&RC[-8])&IF(RC[-7]="",,"|n"&R1C26&RC[-7])&IF(RC[-6]="",,"|n"&R1C27&RC[-6])&IF(RC[-5]="",,"|n"&R1C28&RC[-5])&IF(RC[-2]="",,"|n"&RC[-2]) -> 
AG1324: =IF(RC[-26]&RC[-25]&RC[-24]&RC[-23]&RC[-22]&RC[-21]="",,R1C6)&IF(RC[-26]="",,"|n"&R1C7&RC[-26])&IF(RC[-25]="",,"|n"&R1C8&RC[-25])&IF(RC[-24]="",,"|n"&R1C9&RC[-24])&IF(RC[-23]="",,"|n"&R1C10&RC[-23])&IF(RC[-22]="",,"|n"&R1C11&RC[-22])&IF(RC[-21]="",,"|n"&R1C12&RC[-21])&IF(RC[-19]&RC[-18]&RC[-17]&RC[-16]="",,"|n"&R1C13)&IF(RC[-19]="",,"|n"&R1C14&RC[-19])&IF(RC[-18]="",,"|n"&R1C15&RC[-18])&IF(RC[-17]="",,"|n"&R1C16&RC[-17])&IF(RC[-16]="",,"|n"&R1C17&RC[-16])&IF(RC[-15]="",,"|n"&R1C18&RC[-15])&IF(RC[-14]="",,"|n"&R1C19&RC[-14])&IF(RC[-13]="",,"|n"&R1C20&RC[-13])&IF(RC[-12]="",,"|n"&R1C21&RC[-12])&IF(RC[-10]="",,"|n"&R1C23&RC[-10])&IF(RC[-9]="",,"|n"&R1C24&RC[-9])&IF(RC[-8]="",,"|n"&R1C25&RC[-8])&IF(RC[-7]="",,"|n"&R1C26&RC[-7])&IF(RC[-6]="",,"|n"&R1C27&RC[-6])&IF(RC[-5]="",,"|n"&R1C28&RC[-5])&IF(RC[-2]="",,"|n"&RC[-2]) -> 
AG1325: =IF(RC[-26]&RC[-25]&RC[-24]&RC[-23]&RC[-22]&RC[-21]="",,R1C6)&IF(RC[-26]="",,"|n"&R1C7&RC[-26])&IF(RC[-25]="",,"|n"&R1C8&RC[-25])&IF(RC[-24]="",,"|n"&R1C9&RC[-24])&IF(RC[-23]="",,"|n"&R1C10&RC[-23])&IF(RC[-22]="",,"|n"&R1C11&RC[-22])&IF(RC[-21]="",,"|n"&R1C12&RC[-21])&IF(RC[-19]&RC[-18]&RC[-17]&RC[-16]="",,"|n"&R1C13)&IF(RC[-19]="",,"|n"&R1C14&RC[-19])&IF(RC[-18]="",,"|n"&R1C15&RC[-18])&IF(RC[-17]="",,"|n"&R1C16&RC[-17])&IF(RC[-16]="",,"|n"&R1C17&RC[-16])&IF(RC[-15]="",,"|n"&R1C18&RC[-15])&IF(RC[-14]="",,"|n"&R1C19&RC[-14])&IF(RC[-13]="",,"|n"&R1C20&RC[-13])&IF(RC[-12]="",,"|n"&R1C21&RC[-12])&IF(RC[-10]="",,"|n"&R1C23&RC[-10])&IF(RC[-9]="",,"|n"&R1C24&RC[-9])&IF(RC[-8]="",,"|n"&R1C25&RC[-8])&IF(RC[-7]="",,"|n"&R1C26&RC[-7])&IF(RC[-6]="",,"|n"&R1C27&RC[-6])&IF(RC[-5]="",,"|n"&R1C28&RC[-5])&IF(RC[-2]="",,"|n"&RC[-2]) -> 
AG1326: =IF(RC[-26]&RC[-25]&RC[-24]&RC[-23]&RC[-22]&RC[-21]="",,R1C6)&IF(RC[-26]="",,"|n"&R1C7&RC[-26])&IF(RC[-25]="",,"|n"&R1C8&RC[-25])&IF(RC[-24]="",,"|n"&R1C9&RC[-24])&IF(RC[-23]="",,"|n"&R1C10&RC[-23])&IF(RC[-22]="",,"|n"&R1C11&RC[-22])&IF(RC[-21]="",,"|n"&R1C12&RC[-21])&IF(RC[-19]&RC[-18]&RC[-17]&RC[-16]="",,"|n"&R1C13)&IF(RC[-19]="",,"|n"&R1C14&RC[-19])&IF(RC[-18]="",,"|n"&R1C15&RC[-18])&IF(RC[-17]="",,"|n"&R1C16&RC[-17])&IF(RC[-16]="",,"|n"&R1C17&RC[-16])&IF(RC[-15]="",,"|n"&R1C18&RC[-15])&IF(RC[-14]="",,"|n"&R1C19&RC[-14])&IF(RC[-13]="",,"|n"&R1C20&RC[-13])&IF(RC[-12]="",,"|n"&R1C21&RC[-12])&IF(RC[-10]="",,"|n"&R1C23&RC[-10])&IF(RC[-9]="",,"|n"&R1C24&RC[-9])&IF(RC[-8]="",,"|n"&R1C25&RC[-8])&IF(RC[-7]="",,"|n"&R1C26&RC[-7])&IF(RC[-6]="",,"|n"&R1C27&RC[-6])&IF(RC[-5]="",,"|n"&R1C28&RC[-5])&IF(RC[-2]="",,"|n"&RC[-2]) -> 
AG1327: =IF(RC[-26]&RC[-25]&RC[-24]&RC[-23]&RC[-22]&RC[-21]="",,R1C6)&IF(RC[-26]="",,"|n"&R1C7&RC[-26])&IF(RC[-25]="",,"|n"&R1C8&RC[-25])&IF(RC[-24]="",,"|n"&R1C9&RC[-24])&IF(RC[-23]="",,"|n"&R1C10&RC[-23])&IF(RC[-22]="",,"|n"&R1C11&RC[-22])&IF(RC[-21]="",,"|n"&R1C12&RC[-21])&IF(RC[-19]&RC[-18]&RC[-17]&RC[-16]="",,"|n"&R1C13)&IF(RC[-19]="",,"|n"&R1C14&RC[-19])&IF(RC[-18]="",,"|n"&R1C15&RC[-18])&IF(RC[-17]="",,"|n"&R1C16&RC[-17])&IF(RC[-16]="",,"|n"&R1C17&RC[-16])&IF(RC[-15]="",,"|n"&R1C18&RC[-15])&IF(RC[-14]="",,"|n"&R1C19&RC[-14])&IF(RC[-13]="",,"|n"&R1C20&RC[-13])&IF(RC[-12]="",,"|n"&R1C21&RC[-12])&IF(RC[-10]="",,"|n"&R1C23&RC[-10])&IF(RC[-9]="",,"|n"&R1C24&RC[-9])&IF(RC[-8]="",,"|n"&R1C25&RC[-8])&IF(RC[-7]="",,"|n"&R1C26&RC[-7])&IF(RC[-6]="",,"|n"&R1C27&RC[-6])&IF(RC[-5]="",,"|n"&R1C28&RC[-5])&IF(RC[-2]="",,"|n"&RC[-2]) -> 
AG1328: =IF(RC[-26]&RC[-25]&RC[-24]&RC[-23]&RC[-22]&RC[-21]="",,R1C6)&IF(RC[-26]="",,"|n"&R1C7&RC[-26])&IF(RC[-25]="",,"|n"&R1C8&RC[-25])&IF(RC[-24]="",,"|n"&R1C9&RC[-24])&IF(RC[-23]="",,"|n"&R1C10&RC[-23])&IF(RC[-22]="",,"|n"&R1C11&RC[-22])&IF(RC[-21]="",,"|n"&R1C12&RC[-21])&IF(RC[-19]&RC[-18]&RC[-17]&RC[-16]="",,"|n"&R1C13)&IF(RC[-19]="",,"|n"&R1C14&RC[-19])&IF(RC[-18]="",,"|n"&R1C15&RC[-18])&IF(RC[-17]="",,"|n"&R1C16&RC[-17])&IF(RC[-16]="",,"|n"&R1C17&RC[-16])&IF(RC[-15]="",,"|n"&R1C18&RC[-15])&IF(RC[-14]="",,"|n"&R1C19&RC[-14])&IF(RC[-13]="",,"|n"&R1C20&RC[-13])&IF(RC[-12]="",,"|n"&R1C21&RC[-12])&IF(RC[-10]="",,"|n"&R1C23&RC[-10])&IF(RC[-9]="",,"|n"&R1C24&RC[-9])&IF(RC[-8]="",,"|n"&R1C25&RC[-8])&IF(RC[-7]="",,"|n"&R1C26&RC[-7])&IF(RC[-6]="",,"|n"&R1C27&RC[-6])&IF(RC[-5]="",,"|n"&R1C28&RC[-5])&IF(RC[-2]="",,"|n"&RC[-2]) -> 
AG1329: =IF(RC[-26]&RC[-25]&RC[-24]&RC[-23]&RC[-22]&RC[-21]="",,R1C6)&IF(RC[-26]="",,"|n"&R1C7&RC[-26])&IF(RC[-25]="",,"|n"&R1C8&RC[-25])&IF(RC[-24]="",,"|n"&R1C9&RC[-24])&IF(RC[-23]="",,"|n"&R1C10&RC[-23])&IF(RC[-22]="",,"|n"&R1C11&RC[-22])&IF(RC[-21]="",,"|n"&R1C12&RC[-21])&IF(RC[-19]&RC[-18]&RC[-17]&RC[-16]="",,"|n"&R1C13)&IF(RC[-19]="",,"|n"&R1C14&RC[-19])&IF(RC[-18]="",,"|n"&R1C15&RC[-18])&IF(RC[-17]="",,"|n"&R1C16&RC[-17])&IF(RC[-16]="",,"|n"&R1C17&RC[-16])&IF(RC[-15]="",,"|n"&R1C18&RC[-15])&IF(RC[-14]="",,"|n"&R1C19&RC[-14])&IF(RC[-13]="",,"|n"&R1C20&RC[-13])&IF(RC[-12]="",,"|n"&R1C21&RC[-12])&IF(RC[-10]="",,"|n"&R1C23&RC[-10])&IF(RC[-9]="",,"|n"&R1C24&RC[-9])&IF(RC[-8]="",,"|n"&R1C25&RC[-8])&IF(RC[-7]="",,"|n"&R1C26&RC[-7])&IF(RC[-6]="",,"|n"&R1C27&RC[-6])&IF(RC[-5]="",,"|n"&R1C28&RC[-5])&IF(RC[-2]="",,"|n"&RC[-2]) -> 
AG1330: =IF(RC[-26]&RC[-25]&RC[-24]&RC[-23]&RC[-22]&RC[-21]="",,R1C6)&IF(RC[-26]="",,"|n"&R1C7&RC[-26])&IF(RC[-25]="",,"|n"&R1C8&RC[-25])&IF(RC[-24]="",,"|n"&R1C9&RC[-24])&IF(RC[-23]="",,"|n"&R1C10&RC[-23])&IF(RC[-22]="",,"|n"&R1C11&RC[-22])&IF(RC[-21]="",,"|n"&R1C12&RC[-21])&IF(RC[-19]&RC[-18]&RC[-17]&RC[-16]="",,"|n"&R1C13)&IF(RC[-19]="",,"|n"&R1C14&RC[-19])&IF(RC[-18]="",,"|n"&R1C15&RC[-18])&IF(RC[-17]="",,"|n"&R1C16&RC[-17])&IF(RC[-16]="",,"|n"&R1C17&RC[-16])&IF(RC[-15]="",,"|n"&R1C18&RC[-15])&IF(RC[-14]="",,"|n"&R1C19&RC[-14])&IF(RC[-13]="",,"|n"&R1C20&RC[-13])&IF(RC[-12]="",,"|n"&R1C21&RC[-12])&IF(RC[-10]="",,"|n"&R1C23&RC[-10])&IF(RC[-9]="",,"|n"&R1C24&RC[-9])&IF(RC[-8]="",,"|n"&R1C25&RC[-8])&IF(RC[-7]="",,"|n"&R1C26&RC[-7])&IF(RC[-6]="",,"|n"&R1C27&RC[-6])&IF(RC[-5]="",,"|n"&R1C28&RC[-5])&IF(RC[-2]="",,"|n"&RC[-2]) -> 
AG1331: =IF(RC[-26]&RC[-25]&RC[-24]&RC[-23]&RC[-22]&RC[-21]="",,R1C6)&IF(RC[-26]="",,"|n"&R1C7&RC[-26])&IF(RC[-25]="",,"|n"&R1C8&RC[-25])&IF(RC[-24]="",,"|n"&R1C9&RC[-24])&IF(RC[-23]="",,"|n"&R1C10&RC[-23])&IF(RC[-22]="",,"|n"&R1C11&RC[-22])&IF(RC[-21]="",,"|n"&R1C12&RC[-21])&IF(RC[-19]&RC[-18]&RC[-17]&RC[-16]="",,"|n"&R1C13)&IF(RC[-19]="",,"|n"&R1C14&RC[-19])&IF(RC[-18]="",,"|n"&R1C15&RC[-18])&IF(RC[-17]="",,"|n"&R1C16&RC[-17])&IF(RC[-16]="",,"|n"&R1C17&RC[-16])&IF(RC[-15]="",,"|n"&R1C18&RC[-15])&IF(RC[-14]="",,"|n"&R1C19&RC[-14])&IF(RC[-13]="",,"|n"&R1C20&RC[-13])&IF(RC[-12]="",,"|n"&R1C21&RC[-12])&IF(RC[-10]="",,"|n"&R1C23&RC[-10])&IF(RC[-9]="",,"|n"&R1C24&RC[-9])&IF(RC[-8]="",,"|n"&R1C25&RC[-8])&IF(RC[-7]="",,"|n"&R1C26&RC[-7])&IF(RC[-6]="",,"|n"&R1C27&RC[-6])&IF(RC[-5]="",,"|n"&R1C28&RC[-5])&IF(RC[-2]="",,"|n"&RC[-2]) -> 
AG1332: =IF(RC[-26]&RC[-25]&RC[-24]&RC[-23]&RC[-22]&RC[-21]="",,R1C6)&IF(RC[-26]="",,"|n"&R1C7&RC[-26])&IF(RC[-25]="",,"|n"&R1C8&RC[-25])&IF(RC[-24]="",,"|n"&R1C9&RC[-24])&IF(RC[-23]="",,"|n"&R1C10&RC[-23])&IF(RC[-22]="",,"|n"&R1C11&RC[-22])&IF(RC[-21]="",,"|n"&R1C12&RC[-21])&IF(RC[-19]&RC[-18]&RC[-17]&RC[-16]="",,"|n"&R1C13)&IF(RC[-19]="",,"|n"&R1C14&RC[-19])&IF(RC[-18]="",,"|n"&R1C15&RC[-18])&IF(RC[-17]="",,"|n"&R1C16&RC[-17])&IF(RC[-16]="",,"|n"&R1C17&RC[-16])&IF(RC[-15]="",,"|n"&R1C18&RC[-15])&IF(RC[-14]="",,"|n"&R1C19&RC[-14])&IF(RC[-13]="",,"|n"&R1C20&RC[-13])&IF(RC[-12]="",,"|n"&R1C21&RC[-12])&IF(RC[-10]="",,"|n"&R1C23&RC[-10])&IF(RC[-9]="",,"|n"&R1C24&RC[-9])&IF(RC[-8]="",,"|n"&R1C25&RC[-8])&IF(RC[-7]="",,"|n"&R1C26&RC[-7])&IF(RC[-6]="",,"|n"&R1C27&RC[-6])&IF(RC[-5]="",,"|n"&R1C28&RC[-5])&IF(RC[-2]="",,"|n"&RC[-2]) -> 
AG1333: =IF(RC[-26]&RC[-25]&RC[-24]&RC[-23]&RC[-22]&RC[-21]="",,R1C6)&IF(RC[-26]="",,"|n"&R1C7&RC[-26])&IF(RC[-25]="",,"|n"&R1C8&RC[-25])&IF(RC[-24]="",,"|n"&R1C9&RC[-24])&IF(RC[-23]="",,"|n"&R1C10&RC[-23])&IF(RC[-22]="",,"|n"&R1C11&RC[-22])&IF(RC[-21]="",,"|n"&R1C12&RC[-21])&IF(RC[-19]&RC[-18]&RC[-17]&RC[-16]="",,"|n"&R1C13)&IF(RC[-19]="",,"|n"&R1C14&RC[-19])&IF(RC[-18]="",,"|n"&R1C15&RC[-18])&IF(RC[-17]="",,"|n"&R1C16&RC[-17])&IF(RC[-16]="",,"|n"&R1C17&RC[-16])&IF(RC[-15]="",,"|n"&R1C18&RC[-15])&IF(RC[-14]="",,"|n"&R1C19&RC[-14])&IF(RC[-13]="",,"|n"&R1C20&RC[-13])&IF(RC[-12]="",,"|n"&R1C21&RC[-12])&IF(RC[-10]="",,"|n"&R1C23&RC[-10])&IF(RC[-9]="",,"|n"&R1C24&RC[-9])&IF(RC[-8]="",,"|n"&R1C25&RC[-8])&IF(RC[-7]="",,"|n"&R1C26&RC[-7])&IF(RC[-6]="",,"|n"&R1C27&RC[-6])&IF(RC[-5]="",,"|n"&R1C28&RC[-5])&IF(RC[-2]="",,"|n"&RC[-2]) -> 
AG1334: =IF(RC[-26]&RC[-25]&RC[-24]&RC[-23]&RC[-22]&RC[-21]="",,R1C6)&IF(RC[-26]="",,"|n"&R1C7&RC[-26])&IF(RC[-25]="",,"|n"&R1C8&RC[-25])&IF(RC[-24]="",,"|n"&R1C9&RC[-24])&IF(RC[-23]="",,"|n"&R1C10&RC[-23])&IF(RC[-22]="",,"|n"&R1C11&RC[-22])&IF(RC[-21]="",,"|n"&R1C12&RC[-21])&IF(RC[-19]&RC[-18]&RC[-17]&RC[-16]="",,"|n"&R1C13)&IF(RC[-19]="",,"|n"&R1C14&RC[-19])&IF(RC[-18]="",,"|n"&R1C15&RC[-18])&IF(RC[-17]="",,"|n"&R1C16&RC[-17])&IF(RC[-16]="",,"|n"&R1C17&RC[-16])&IF(RC[-15]="",,"|n"&R1C18&RC[-15])&IF(RC[-14]="",,"|n"&R1C19&RC[-14])&IF(RC[-13]="",,"|n"&R1C20&RC[-13])&IF(RC[-12]="",,"|n"&R1C21&RC[-12])&IF(RC[-10]="",,"|n"&R1C23&RC[-10])&IF(RC[-9]="",,"|n"&R1C24&RC[-9])&IF(RC[-8]="",,"|n"&R1C25&RC[-8])&IF(RC[-7]="",,"|n"&R1C26&RC[-7])&IF(RC[-6]="",,"|n"&R1C27&RC[-6])&IF(RC[-5]="",,"|n"&R1C28&RC[-5])&IF(RC[-2]="",,"|n"&RC[-2]) -> 
AG1335: =IF(RC[-26]&RC[-25]&RC[-24]&RC[-23]&RC[-22]&RC[-21]="",,R1C6)&IF(RC[-26]="",,"|n"&R1C7&RC[-26])&IF(RC[-25]="",,"|n"&R1C8&RC[-25])&IF(RC[-24]="",,"|n"&R1C9&RC[-24])&IF(RC[-23]="",,"|n"&R1C10&RC[-23])&IF(RC[-22]="",,"|n"&R1C11&RC[-22])&IF(RC[-21]="",,"|n"&R1C12&RC[-21])&IF(RC[-19]&RC[-18]&RC[-17]&RC[-16]="",,"|n"&R1C13)&IF(RC[-19]="",,"|n"&R1C14&RC[-19])&IF(RC[-18]="",,"|n"&R1C15&RC[-18])&IF(RC[-17]="",,"|n"&R1C16&RC[-17])&IF(RC[-16]="",,"|n"&R1C17&RC[-16])&IF(RC[-15]="",,"|n"&R1C18&RC[-15])&IF(RC[-14]="",,"|n"&R1C19&RC[-14])&IF(RC[-13]="",,"|n"&R1C20&RC[-13])&IF(RC[-12]="",,"|n"&R1C21&RC[-12])&IF(RC[-10]="",,"|n"&R1C23&RC[-10])&IF(RC[-9]="",,"|n"&R1C24&RC[-9])&IF(RC[-8]="",,"|n"&R1C25&RC[-8])&IF(RC[-7]="",,"|n"&R1C26&RC[-7])&IF(RC[-6]="",,"|n"&R1C27&RC[-6])&IF(RC[-5]="",,"|n"&R1C28&RC[-5])&IF(RC[-2]="",,"|n"&RC[-2]) -> 
AG1336: =IF(RC[-26]&RC[-25]&RC[-24]&RC[-23]&RC[-22]&RC[-21]="",,R1C6)&IF(RC[-26]="",,"|n"&R1C7&RC[-26])&IF(RC[-25]="",,"|n"&R1C8&RC[-25])&IF(RC[-24]="",,"|n"&R1C9&RC[-24])&IF(RC[-23]="",,"|n"&R1C10&RC[-23])&IF(RC[-22]="",,"|n"&R1C11&RC[-22])&IF(RC[-21]="",,"|n"&R1C12&RC[-21])&IF(RC[-19]&RC[-18]&RC[-17]&RC[-16]="",,"|n"&R1C13)&IF(RC[-19]="",,"|n"&R1C14&RC[-19])&IF(RC[-18]="",,"|n"&R1C15&RC[-18])&IF(RC[-17]="",,"|n"&R1C16&RC[-17])&IF(RC[-16]="",,"|n"&R1C17&RC[-16])&IF(RC[-15]="",,"|n"&R1C18&RC[-15])&IF(RC[-14]="",,"|n"&R1C19&RC[-14])&IF(RC[-13]="",,"|n"&R1C20&RC[-13])&IF(RC[-12]="",,"|n"&R1C21&RC[-12])&IF(RC[-10]="",,"|n"&R1C23&RC[-10])&IF(RC[-9]="",,"|n"&R1C24&RC[-9])&IF(RC[-8]="",,"|n"&R1C25&RC[-8])&IF(RC[-7]="",,"|n"&R1C26&RC[-7])&IF(RC[-6]="",,"|n"&R1C27&RC[-6])&IF(RC[-5]="",,"|n"&R1C28&RC[-5])&IF(RC[-2]="",,"|n"&RC[-2]) -> 
AG1337: =IF(RC[-26]&RC[-25]&RC[-24]&RC[-23]&RC[-22]&RC[-21]="",,R1C6)&IF(RC[-26]="",,"|n"&R1C7&RC[-26])&IF(RC[-25]="",,"|n"&R1C8&RC[-25])&IF(RC[-24]="",,"|n"&R1C9&RC[-24])&IF(RC[-23]="",,"|n"&R1C10&RC[-23])&IF(RC[-22]="",,"|n"&R1C11&RC[-22])&IF(RC[-21]="",,"|n"&R1C12&RC[-21])&IF(RC[-19]&RC[-18]&RC[-17]&RC[-16]="",,"|n"&R1C13)&IF(RC[-19]="",,"|n"&R1C14&RC[-19])&IF(RC[-18]="",,"|n"&R1C15&RC[-18])&IF(RC[-17]="",,"|n"&R1C16&RC[-17])&IF(RC[-16]="",,"|n"&R1C17&RC[-16])&IF(RC[-15]="",,"|n"&R1C18&RC[-15])&IF(RC[-14]="",,"|n"&R1C19&RC[-14])&IF(RC[-13]="",,"|n"&R1C20&RC[-13])&IF(RC[-12]="",,"|n"&R1C21&RC[-12])&IF(RC[-10]="",,"|n"&R1C23&RC[-10])&IF(RC[-9]="",,"|n"&R1C24&RC[-9])&IF(RC[-8]="",,"|n"&R1C25&RC[-8])&IF(RC[-7]="",,"|n"&R1C26&RC[-7])&IF(RC[-6]="",,"|n"&R1C27&RC[-6])&IF(RC[-5]="",,"|n"&R1C28&RC[-5])&IF(RC[-2]="",,"|n"&RC[-2]) -> 
AG1338: =IF(RC[-26]&RC[-25]&RC[-24]&RC[-23]&RC[-22]&RC[-21]="",,R1C6)&IF(RC[-26]="",,"|n"&R1C7&RC[-26])&IF(RC[-25]="",,"|n"&R1C8&RC[-25])&IF(RC[-24]="",,"|n"&R1C9&RC[-24])&IF(RC[-23]="",,"|n"&R1C10&RC[-23])&IF(RC[-22]="",,"|n"&R1C11&RC[-22])&IF(RC[-21]="",,"|n"&R1C12&RC[-21])&IF(RC[-19]&RC[-18]&RC[-17]&RC[-16]="",,"|n"&R1C13)&IF(RC[-19]="",,"|n"&R1C14&RC[-19])&IF(RC[-18]="",,"|n"&R1C15&RC[-18])&IF(RC[-17]="",,"|n"&R1C16&RC[-17])&IF(RC[-16]="",,"|n"&R1C17&RC[-16])&IF(RC[-15]="",,"|n"&R1C18&RC[-15])&IF(RC[-14]="",,"|n"&R1C19&RC[-14])&IF(RC[-13]="",,"|n"&R1C20&RC[-13])&IF(RC[-12]="",,"|n"&R1C21&RC[-12])&IF(RC[-10]="",,"|n"&R1C23&RC[-10])&IF(RC[-9]="",,"|n"&R1C24&RC[-9])&IF(RC[-8]="",,"|n"&R1C25&RC[-8])&IF(RC[-7]="",,"|n"&R1C26&RC[-7])&IF(RC[-6]="",,"|n"&R1C27&RC[-6])&IF(RC[-5]="",,"|n"&R1C28&RC[-5])&IF(RC[-2]="",,"|n"&RC[-2]) -> 
AG1339: =IF(RC[-26]&RC[-25]&RC[-24]&RC[-23]&RC[-22]&RC[-21]="",,R1C6)&IF(RC[-26]="",,"|n"&R1C7&RC[-26])&IF(RC[-25]="",,"|n"&R1C8&RC[-25])&IF(RC[-24]="",,"|n"&R1C9&RC[-24])&IF(RC[-23]="",,"|n"&R1C10&RC[-23])&IF(RC[-22]="",,"|n"&R1C11&RC[-22])&IF(RC[-21]="",,"|n"&R1C12&RC[-21])&IF(RC[-19]&RC[-18]&RC[-17]&RC[-16]="",,"|n"&R1C13)&IF(RC[-19]="",,"|n"&R1C14&RC[-19])&IF(RC[-18]="",,"|n"&R1C15&RC[-18])&IF(RC[-17]="",,"|n"&R1C16&RC[-17])&IF(RC[-16]="",,"|n"&R1C17&RC[-16])&IF(RC[-15]="",,"|n"&R1C18&RC[-15])&IF(RC[-14]="",,"|n"&R1C19&RC[-14])&IF(RC[-13]="",,"|n"&R1C20&RC[-13])&IF(RC[-12]="",,"|n"&R1C21&RC[-12])&IF(RC[-10]="",,"|n"&R1C23&RC[-10])&IF(RC[-9]="",,"|n"&R1C24&RC[-9])&IF(RC[-8]="",,"|n"&R1C25&RC[-8])&IF(RC[-7]="",,"|n"&R1C26&RC[-7])&IF(RC[-6]="",,"|n"&R1C27&RC[-6])&IF(RC[-5]="",,"|n"&R1C28&RC[-5])&IF(RC[-2]="",,"|n"&RC[-2]) -> 
AG1340: =IF(RC[-26]&RC[-25]&RC[-24]&RC[-23]&RC[-22]&RC[-21]="",,R1C6)&IF(RC[-26]="",,"|n"&R1C7&RC[-26])&IF(RC[-25]="",,"|n"&R1C8&RC[-25])&IF(RC[-24]="",,"|n"&R1C9&RC[-24])&IF(RC[-23]="",,"|n"&R1C10&RC[-23])&IF(RC[-22]="",,"|n"&R1C11&RC[-22])&IF(RC[-21]="",,"|n"&R1C12&RC[-21])&IF(RC[-19]&RC[-18]&RC[-17]&RC[-16]="",,"|n"&R1C13)&IF(RC[-19]="",,"|n"&R1C14&RC[-19])&IF(RC[-18]="",,"|n"&R1C15&RC[-18])&IF(RC[-17]="",,"|n"&R1C16&RC[-17])&IF(RC[-16]="",,"|n"&R1C17&RC[-16])&IF(RC[-15]="",,"|n"&R1C18&RC[-15])&IF(RC[-14]="",,"|n"&R1C19&RC[-14])&IF(RC[-13]="",,"|n"&R1C20&RC[-13])&IF(RC[-12]="",,"|n"&R1C21&RC[-12])&IF(RC[-10]="",,"|n"&R1C23&RC[-10])&IF(RC[-9]="",,"|n"&R1C24&RC[-9])&IF(RC[-8]="",,"|n"&R1C25&RC[-8])&IF(RC[-7]="",,"|n"&R1C26&RC[-7])&IF(RC[-6]="",,"|n"&R1C27&RC[-6])&IF(RC[-5]="",,"|n"&R1C28&RC[-5])&IF(RC[-2]="",,"|n"&RC[-2]) -> 
AG1341: =IF(RC[-26]&RC[-25]&RC[-24]&RC[-23]&RC[-22]&RC[-21]="",,R1C6)&IF(RC[-26]="",,"|n"&R1C7&RC[-26])&IF(RC[-25]="",,"|n"&R1C8&RC[-25])&IF(RC[-24]="",,"|n"&R1C9&RC[-24])&IF(RC[-23]="",,"|n"&R1C10&RC[-23])&IF(RC[-22]="",,"|n"&R1C11&RC[-22])&IF(RC[-21]="",,"|n"&R1C12&RC[-21])&IF(RC[-19]&RC[-18]&RC[-17]&RC[-16]="",,"|n"&R1C13)&IF(RC[-19]="",,"|n"&R1C14&RC[-19])&IF(RC[-18]="",,"|n"&R1C15&RC[-18])&IF(RC[-17]="",,"|n"&R1C16&RC[-17])&IF(RC[-16]="",,"|n"&R1C17&RC[-16])&IF(RC[-15]="",,"|n"&R1C18&RC[-15])&IF(RC[-14]="",,"|n"&R1C19&RC[-14])&IF(RC[-13]="",,"|n"&R1C20&RC[-13])&IF(RC[-12]="",,"|n"&R1C21&RC[-12])&IF(RC[-10]="",,"|n"&R1C23&RC[-10])&IF(RC[-9]="",,"|n"&R1C24&RC[-9])&IF(RC[-8]="",,"|n"&R1C25&RC[-8])&IF(RC[-7]="",,"|n"&R1C26&RC[-7])&IF(RC[-6]="",,"|n"&R1C27&RC[-6])&IF(RC[-5]="",,"|n"&R1C28&RC[-5])&IF(RC[-2]="",,"|n"&RC[-2]) -> 
AG1342: =IF(RC[-26]&RC[-25]&RC[-24]&RC[-23]&RC[-22]&RC[-21]="",,R1C6)&IF(RC[-26]="",,"|n"&R1C7&RC[-26])&IF(RC[-25]="",,"|n"&R1C8&RC[-25])&IF(RC[-24]="",,"|n"&R1C9&RC[-24])&IF(RC[-23]="",,"|n"&R1C10&RC[-23])&IF(RC[-22]="",,"|n"&R1C11&RC[-22])&IF(RC[-21]="",,"|n"&R1C12&RC[-21])&IF(RC[-19]&RC[-18]&RC[-17]&RC[-16]="",,"|n"&R1C13)&IF(RC[-19]="",,"|n"&R1C14&RC[-19])&IF(RC[-18]="",,"|n"&R1C15&RC[-18])&IF(RC[-17]="",,"|n"&R1C16&RC[-17])&IF(RC[-16]="",,"|n"&R1C17&RC[-16])&IF(RC[-15]="",,"|n"&R1C18&RC[-15])&IF(RC[-14]="",,"|n"&R1C19&RC[-14])&IF(RC[-13]="",,"|n"&R1C20&RC[-13])&IF(RC[-12]="",,"|n"&R1C21&RC[-12])&IF(RC[-10]="",,"|n"&R1C23&RC[-10])&IF(RC[-9]="",,"|n"&R1C24&RC[-9])&IF(RC[-8]="",,"|n"&R1C25&RC[-8])&IF(RC[-7]="",,"|n"&R1C26&RC[-7])&IF(RC[-6]="",,"|n"&R1C27&RC[-6])&IF(RC[-5]="",,"|n"&R1C28&RC[-5])&IF(RC[-2]="",,"|n"&RC[-2]) -> 
AG1343: =IF(RC[-26]&RC[-25]&RC[-24]&RC[-23]&RC[-22]&RC[-21]="",,R1C6)&IF(RC[-26]="",,"|n"&R1C7&RC[-26])&IF(RC[-25]="",,"|n"&R1C8&RC[-25])&IF(RC[-24]="",,"|n"&R1C9&RC[-24])&IF(RC[-23]="",,"|n"&R1C10&RC[-23])&IF(RC[-22]="",,"|n"&R1C11&RC[-22])&IF(RC[-21]="",,"|n"&R1C12&RC[-21])&IF(RC[-19]&RC[-18]&RC[-17]&RC[-16]="",,"|n"&R1C13)&IF(RC[-19]="",,"|n"&R1C14&RC[-19])&IF(RC[-18]="",,"|n"&R1C15&RC[-18])&IF(RC[-17]="",,"|n"&R1C16&RC[-17])&IF(RC[-16]="",,"|n"&R1C17&RC[-16])&IF(RC[-15]="",,"|n"&R1C18&RC[-15])&IF(RC[-14]="",,"|n"&R1C19&RC[-14])&IF(RC[-13]="",,"|n"&R1C20&RC[-13])&IF(RC[-12]="",,"|n"&R1C21&RC[-12])&IF(RC[-10]="",,"|n"&R1C23&RC[-10])&IF(RC[-9]="",,"|n"&R1C24&RC[-9])&IF(RC[-8]="",,"|n"&R1C25&RC[-8])&IF(RC[-7]="",,"|n"&R1C26&RC[-7])&IF(RC[-6]="",,"|n"&R1C27&RC[-6])&IF(RC[-5]="",,"|n"&R1C28&RC[-5])&IF(RC[-2]="",,"|n"&RC[-2]) -> 
AG1344: =IF(RC[-26]&RC[-25]&RC[-24]&RC[-23]&RC[-22]&RC[-21]="",,R1C6)&IF(RC[-26]="",,"|n"&R1C7&RC[-26])&IF(RC[-25]="",,"|n"&R1C8&RC[-25])&IF(RC[-24]="",,"|n"&R1C9&RC[-24])&IF(RC[-23]="",,"|n"&R1C10&RC[-23])&IF(RC[-22]="",,"|n"&R1C11&RC[-22])&IF(RC[-21]="",,"|n"&R1C12&RC[-21])&IF(RC[-19]&RC[-18]&RC[-17]&RC[-16]="",,"|n"&R1C13)&IF(RC[-19]="",,"|n"&R1C14&RC[-19])&IF(RC[-18]="",,"|n"&R1C15&RC[-18])&IF(RC[-17]="",,"|n"&R1C16&RC[-17])&IF(RC[-16]="",,"|n"&R1C17&RC[-16])&IF(RC[-15]="",,"|n"&R1C18&RC[-15])&IF(RC[-14]="",,"|n"&R1C19&RC[-14])&IF(RC[-13]="",,"|n"&R1C20&RC[-13])&IF(RC[-12]="",,"|n"&R1C21&RC[-12])&IF(RC[-10]="",,"|n"&R1C23&RC[-10])&IF(RC[-9]="",,"|n"&R1C24&RC[-9])&IF(RC[-8]="",,"|n"&R1C25&RC[-8])&IF(RC[-7]="",,"|n"&R1C26&RC[-7])&IF(RC[-6]="",,"|n"&R1C27&RC[-6])&IF(RC[-5]="",,"|n"&R1C28&RC[-5])&IF(RC[-2]="",,"|n"&RC[-2]) -> 
AG1345: =IF(RC[-26]&RC[-25]&RC[-24]&RC[-23]&RC[-22]&RC[-21]="",,R1C6)&IF(RC[-26]="",,"|n"&R1C7&RC[-26])&IF(RC[-25]="",,"|n"&R1C8&RC[-25])&IF(RC[-24]="",,"|n"&R1C9&RC[-24])&IF(RC[-23]="",,"|n"&R1C10&RC[-23])&IF(RC[-22]="",,"|n"&R1C11&RC[-22])&IF(RC[-21]="",,"|n"&R1C12&RC[-21])&IF(RC[-19]&RC[-18]&RC[-17]&RC[-16]="",,"|n"&R1C13)&IF(RC[-19]="",,"|n"&R1C14&RC[-19])&IF(RC[-18]="",,"|n"&R1C15&RC[-18])&IF(RC[-17]="",,"|n"&R1C16&RC[-17])&IF(RC[-16]="",,"|n"&R1C17&RC[-16])&IF(RC[-15]="",,"|n"&R1C18&RC[-15])&IF(RC[-14]="",,"|n"&R1C19&RC[-14])&IF(RC[-13]="",,"|n"&R1C20&RC[-13])&IF(RC[-12]="",,"|n"&R1C21&RC[-12])&IF(RC[-10]="",,"|n"&R1C23&RC[-10])&IF(RC[-9]="",,"|n"&R1C24&RC[-9])&IF(RC[-8]="",,"|n"&R1C25&RC[-8])&IF(RC[-7]="",,"|n"&R1C26&RC[-7])&IF(RC[-6]="",,"|n"&R1C27&RC[-6])&IF(RC[-5]="",,"|n"&R1C28&RC[-5])&IF(RC[-2]="",,"|n"&RC[-2]) -> 
AG1346: =IF(RC[-26]&RC[-25]&RC[-24]&RC[-23]&RC[-22]&RC[-21]="",,R1C6)&IF(RC[-26]="",,"|n"&R1C7&RC[-26])&IF(RC[-25]="",,"|n"&R1C8&RC[-25])&IF(RC[-24]="",,"|n"&R1C9&RC[-24])&IF(RC[-23]="",,"|n"&R1C10&RC[-23])&IF(RC[-22]="",,"|n"&R1C11&RC[-22])&IF(RC[-21]="",,"|n"&R1C12&RC[-21])&IF(RC[-19]&RC[-18]&RC[-17]&RC[-16]="",,"|n"&R1C13)&IF(RC[-19]="",,"|n"&R1C14&RC[-19])&IF(RC[-18]="",,"|n"&R1C15&RC[-18])&IF(RC[-17]="",,"|n"&R1C16&RC[-17])&IF(RC[-16]="",,"|n"&R1C17&RC[-16])&IF(RC[-15]="",,"|n"&R1C18&RC[-15])&IF(RC[-14]="",,"|n"&R1C19&RC[-14])&IF(RC[-13]="",,"|n"&R1C20&RC[-13])&IF(RC[-12]="",,"|n"&R1C21&RC[-12])&IF(RC[-10]="",,"|n"&R1C23&RC[-10])&IF(RC[-9]="",,"|n"&R1C24&RC[-9])&IF(RC[-8]="",,"|n"&R1C25&RC[-8])&IF(RC[-7]="",,"|n"&R1C26&RC[-7])&IF(RC[-6]="",,"|n"&R1C27&RC[-6])&IF(RC[-5]="",,"|n"&R1C28&RC[-5])&IF(RC[-2]="",,"|n"&RC[-2]) -> 
AG1347: =IF(RC[-26]&RC[-25]&RC[-24]&RC[-23]&RC[-22]&RC[-21]="",,R1C6)&IF(RC[-26]="",,"|n"&R1C7&RC[-26])&IF(RC[-25]="",,"|n"&R1C8&RC[-25])&IF(RC[-24]="",,"|n"&R1C9&RC[-24])&IF(RC[-23]="",,"|n"&R1C10&RC[-23])&IF(RC[-22]="",,"|n"&R1C11&RC[-22])&IF(RC[-21]="",,"|n"&R1C12&RC[-21])&IF(RC[-19]&RC[-18]&RC[-17]&RC[-16]="",,"|n"&R1C13)&IF(RC[-19]="",,"|n"&R1C14&RC[-19])&IF(RC[-18]="",,"|n"&R1C15&RC[-18])&IF(RC[-17]="",,"|n"&R1C16&RC[-17])&IF(RC[-16]="",,"|n"&R1C17&RC[-16])&IF(RC[-15]="",,"|n"&R1C18&RC[-15])&IF(RC[-14]="",,"|n"&R1C19&RC[-14])&IF(RC[-13]="",,"|n"&R1C20&RC[-13])&IF(RC[-12]="",,"|n"&R1C21&RC[-12])&IF(RC[-10]="",,"|n"&R1C23&RC[-10])&IF(RC[-9]="",,"|n"&R1C24&RC[-9])&IF(RC[-8]="",,"|n"&R1C25&RC[-8])&IF(RC[-7]="",,"|n"&R1C26&RC[-7])&IF(RC[-6]="",,"|n"&R1C27&RC[-6])&IF(RC[-5]="",,"|n"&R1C28&RC[-5])&IF(RC[-2]="",,"|n"&RC[-2]) -> 
AG1348: =IF(RC[-26]&RC[-25]&RC[-24]&RC[-23]&RC[-22]&RC[-21]="",,R1C6)&IF(RC[-26]="",,"|n"&R1C7&RC[-26])&IF(RC[-25]="",,"|n"&R1C8&RC[-25])&IF(RC[-24]="",,"|n"&R1C9&RC[-24])&IF(RC[-23]="",,"|n"&R1C10&RC[-23])&IF(RC[-22]="",,"|n"&R1C11&RC[-22])&IF(RC[-21]="",,"|n"&R1C12&RC[-21])&IF(RC[-19]&RC[-18]&RC[-17]&RC[-16]="",,"|n"&R1C13)&IF(RC[-19]="",,"|n"&R1C14&RC[-19])&IF(RC[-18]="",,"|n"&R1C15&RC[-18])&IF(RC[-17]="",,"|n"&R1C16&RC[-17])&IF(RC[-16]="",,"|n"&R1C17&RC[-16])&IF(RC[-15]="",,"|n"&R1C18&RC[-15])&IF(RC[-14]="",,"|n"&R1C19&RC[-14])&IF(RC[-13]="",,"|n"&R1C20&RC[-13])&IF(RC[-12]="",,"|n"&R1C21&RC[-12])&IF(RC[-10]="",,"|n"&R1C23&RC[-10])&IF(RC[-9]="",,"|n"&R1C24&RC[-9])&IF(RC[-8]="",,"|n"&R1C25&RC[-8])&IF(RC[-7]="",,"|n"&R1C26&RC[-7])&IF(RC[-6]="",,"|n"&R1C27&RC[-6])&IF(RC[-5]="",,"|n"&R1C28&RC[-5])&IF(RC[-2]="",,"|n"&RC[-2]) -> 
AG1349: =IF(RC[-26]&RC[-25]&RC[-24]&RC[-23]&RC[-22]&RC[-21]="",,R1C6)&IF(RC[-26]="",,"|n"&R1C7&RC[-26])&IF(RC[-25]="",,"|n"&R1C8&RC[-25])&IF(RC[-24]="",,"|n"&R1C9&RC[-24])&IF(RC[-23]="",,"|n"&R1C10&RC[-23])&IF(RC[-22]="",,"|n"&R1C11&RC[-22])&IF(RC[-21]="",,"|n"&R1C12&RC[-21])&IF(RC[-19]&RC[-18]&RC[-17]&RC[-16]="",,"|n"&R1C13)&IF(RC[-19]="",,"|n"&R1C14&RC[-19])&IF(RC[-18]="",,"|n"&R1C15&RC[-18])&IF(RC[-17]="",,"|n"&R1C16&RC[-17])&IF(RC[-16]="",,"|n"&R1C17&RC[-16])&IF(RC[-15]="",,"|n"&R1C18&RC[-15])&IF(RC[-14]="",,"|n"&R1C19&RC[-14])&IF(RC[-13]="",,"|n"&R1C20&RC[-13])&IF(RC[-12]="",,"|n"&R1C21&RC[-12])&IF(RC[-10]="",,"|n"&R1C23&RC[-10])&IF(RC[-9]="",,"|n"&R1C24&RC[-9])&IF(RC[-8]="",,"|n"&R1C25&RC[-8])&IF(RC[-7]="",,"|n"&R1C26&RC[-7])&IF(RC[-6]="",,"|n"&R1C27&RC[-6])&IF(RC[-5]="",,"|n"&R1C28&RC[-5])&IF(RC[-2]="",,"|n"&RC[-2]) -> 
AG1350: =IF(RC[-26]&RC[-25]&RC[-24]&RC[-23]&RC[-22]&RC[-21]="",,R1C6)&IF(RC[-26]="",,"|n"&R1C7&RC[-26])&IF(RC[-25]="",,"|n"&R1C8&RC[-25])&IF(RC[-24]="",,"|n"&R1C9&RC[-24])&IF(RC[-23]="",,"|n"&R1C10&RC[-23])&IF(RC[-22]="",,"|n"&R1C11&RC[-22])&IF(RC[-21]="",,"|n"&R1C12&RC[-21])&IF(RC[-19]&RC[-18]&RC[-17]&RC[-16]="",,"|n"&R1C13)&IF(RC[-19]="",,"|n"&R1C14&RC[-19])&IF(RC[-18]="",,"|n"&R1C15&RC[-18])&IF(RC[-17]="",,"|n"&R1C16&RC[-17])&IF(RC[-16]="",,"|n"&R1C17&RC[-16])&IF(RC[-15]="",,"|n"&R1C18&RC[-15])&IF(RC[-14]="",,"|n"&R1C19&RC[-14])&IF(RC[-13]="",,"|n"&R1C20&RC[-13])&IF(RC[-12]="",,"|n"&R1C21&RC[-12])&IF(RC[-10]="",,"|n"&R1C23&RC[-10])&IF(RC[-9]="",,"|n"&R1C24&RC[-9])&IF(RC[-8]="",,"|n"&R1C25&RC[-8])&IF(RC[-7]="",,"|n"&R1C26&RC[-7])&IF(RC[-6]="",,"|n"&R1C27&RC[-6])&IF(RC[-5]="",,"|n"&R1C28&RC[-5])&IF(RC[-2]="",,"|n"&RC[-2]) -> 
AG1351: =IF(RC[-26]&RC[-25]&RC[-24]&RC[-23]&RC[-22]&RC[-21]="",,R1C6)&IF(RC[-26]="",,"|n"&R1C7&RC[-26])&IF(RC[-25]="",,"|n"&R1C8&RC[-25])&IF(RC[-24]="",,"|n"&R1C9&RC[-24])&IF(RC[-23]="",,"|n"&R1C10&RC[-23])&IF(RC[-22]="",,"|n"&R1C11&RC[-22])&IF(RC[-21]="",,"|n"&R1C12&RC[-21])&IF(RC[-19]&RC[-18]&RC[-17]&RC[-16]="",,"|n"&R1C13)&IF(RC[-19]="",,"|n"&R1C14&RC[-19])&IF(RC[-18]="",,"|n"&R1C15&RC[-18])&IF(RC[-17]="",,"|n"&R1C16&RC[-17])&IF(RC[-16]="",,"|n"&R1C17&RC[-16])&IF(RC[-15]="",,"|n"&R1C18&RC[-15])&IF(RC[-14]="",,"|n"&R1C19&RC[-14])&IF(RC[-13]="",,"|n"&R1C20&RC[-13])&IF(RC[-12]="",,"|n"&R1C21&RC[-12])&IF(RC[-10]="",,"|n"&R1C23&RC[-10])&IF(RC[-9]="",,"|n"&R1C24&RC[-9])&IF(RC[-8]="",,"|n"&R1C25&RC[-8])&IF(RC[-7]="",,"|n"&R1C26&RC[-7])&IF(RC[-6]="",,"|n"&R1C27&RC[-6])&IF(RC[-5]="",,"|n"&R1C28&RC[-5])&IF(RC[-2]="",,"|n"&RC[-2]) -> 
AG1352: =IF(RC[-26]&RC[-25]&RC[-24]&RC[-23]&RC[-22]&RC[-21]="",,R1C6)&IF(RC[-26]="",,"|n"&R1C7&RC[-26])&IF(RC[-25]="",,"|n"&R1C8&RC[-25])&IF(RC[-24]="",,"|n"&R1C9&RC[-24])&IF(RC[-23]="",,"|n"&R1C10&RC[-23])&IF(RC[-22]="",,"|n"&R1C11&RC[-22])&IF(RC[-21]="",,"|n"&R1C12&RC[-21])&IF(RC[-19]&RC[-18]&RC[-17]&RC[-16]="",,"|n"&R1C13)&IF(RC[-19]="",,"|n"&R1C14&RC[-19])&IF(RC[-18]="",,"|n"&R1C15&RC[-18])&IF(RC[-17]="",,"|n"&R1C16&RC[-17])&IF(RC[-16]="",,"|n"&R1C17&RC[-16])&IF(RC[-15]="",,"|n"&R1C18&RC[-15])&IF(RC[-14]="",,"|n"&R1C19&RC[-14])&IF(RC[-13]="",,"|n"&R1C20&RC[-13])&IF(RC[-12]="",,"|n"&R1C21&RC[-12])&IF(RC[-10]="",,"|n"&R1C23&RC[-10])&IF(RC[-9]="",,"|n"&R1C24&RC[-9])&IF(RC[-8]="",,"|n"&R1C25&RC[-8])&IF(RC[-7]="",,"|n"&R1C26&RC[-7])&IF(RC[-6]="",,"|n"&R1C27&RC[-6])&IF(RC[-5]="",,"|n"&R1C28&RC[-5])&IF(RC[-2]="",,"|n"&RC[-2]) -> 
AG1353: =IF(RC[-26]&RC[-25]&RC[-24]&RC[-23]&RC[-22]&RC[-21]="",,R1C6)&IF(RC[-26]="",,"|n"&R1C7&RC[-26])&IF(RC[-25]="",,"|n"&R1C8&RC[-25])&IF(RC[-24]="",,"|n"&R1C9&RC[-24])&IF(RC[-23]="",,"|n"&R1C10&RC[-23])&IF(RC[-22]="",,"|n"&R1C11&RC[-22])&IF(RC[-21]="",,"|n"&R1C12&RC[-21])&IF(RC[-19]&RC[-18]&RC[-17]&RC[-16]="",,"|n"&R1C13)&IF(RC[-19]="",,"|n"&R1C14&RC[-19])&IF(RC[-18]="",,"|n"&R1C15&RC[-18])&IF(RC[-17]="",,"|n"&R1C16&RC[-17])&IF(RC[-16]="",,"|n"&R1C17&RC[-16])&IF(RC[-15]="",,"|n"&R1C18&RC[-15])&IF(RC[-14]="",,"|n"&R1C19&RC[-14])&IF(RC[-13]="",,"|n"&R1C20&RC[-13])&IF(RC[-12]="",,"|n"&R1C21&RC[-12])&IF(RC[-10]="",,"|n"&R1C23&RC[-10])&IF(RC[-9]="",,"|n"&R1C24&RC[-9])&IF(RC[-8]="",,"|n"&R1C25&RC[-8])&IF(RC[-7]="",,"|n"&R1C26&RC[-7])&IF(RC[-6]="",,"|n"&R1C27&RC[-6])&IF(RC[-5]="",,"|n"&R1C28&RC[-5])&IF(RC[-2]="",,"|n"&RC[-2]) -> 
AG1354: =IF(RC[-26]&RC[-25]&RC[-24]&RC[-23]&RC[-22]&RC[-21]="",,R1C6)&IF(RC[-26]="",,"|n"&R1C7&RC[-26])&IF(RC[-25]="",,"|n"&R1C8&RC[-25])&IF(RC[-24]="",,"|n"&R1C9&RC[-24])&IF(RC[-23]="",,"|n"&R1C10&RC[-23])&IF(RC[-22]="",,"|n"&R1C11&RC[-22])&IF(RC[-21]="",,"|n"&R1C12&RC[-21])&IF(RC[-19]&RC[-18]&RC[-17]&RC[-16]="",,"|n"&R1C13)&IF(RC[-19]="",,"|n"&R1C14&RC[-19])&IF(RC[-18]="",,"|n"&R1C15&RC[-18])&IF(RC[-17]="",,"|n"&R1C16&RC[-17])&IF(RC[-16]="",,"|n"&R1C17&RC[-16])&IF(RC[-15]="",,"|n"&R1C18&RC[-15])&IF(RC[-14]="",,"|n"&R1C19&RC[-14])&IF(RC[-13]="",,"|n"&R1C20&RC[-13])&IF(RC[-12]="",,"|n"&R1C21&RC[-12])&IF(RC[-10]="",,"|n"&R1C23&RC[-10])&IF(RC[-9]="",,"|n"&R1C24&RC[-9])&IF(RC[-8]="",,"|n"&R1C25&RC[-8])&IF(RC[-7]="",,"|n"&R1C26&RC[-7])&IF(RC[-6]="",,"|n"&R1C27&RC[-6])&IF(RC[-5]="",,"|n"&R1C28&RC[-5])&IF(RC[-2]="",,"|n"&RC[-2]) -> 
AG1355: =IF(RC[-26]&RC[-25]&RC[-24]&RC[-23]&RC[-22]&RC[-21]="",,R1C6)&IF(RC[-26]="",,"|n"&R1C7&RC[-26])&IF(RC[-25]="",,"|n"&R1C8&RC[-25])&IF(RC[-24]="",,"|n"&R1C9&RC[-24])&IF(RC[-23]="",,"|n"&R1C10&RC[-23])&IF(RC[-22]="",,"|n"&R1C11&RC[-22])&IF(RC[-21]="",,"|n"&R1C12&RC[-21])&IF(RC[-19]&RC[-18]&RC[-17]&RC[-16]="",,"|n"&R1C13)&IF(RC[-19]="",,"|n"&R1C14&RC[-19])&IF(RC[-18]="",,"|n"&R1C15&RC[-18])&IF(RC[-17]="",,"|n"&R1C16&RC[-17])&IF(RC[-16]="",,"|n"&R1C17&RC[-16])&IF(RC[-15]="",,"|n"&R1C18&RC[-15])&IF(RC[-14]="",,"|n"&R1C19&RC[-14])&IF(RC[-13]="",,"|n"&R1C20&RC[-13])&IF(RC[-12]="",,"|n"&R1C21&RC[-12])&IF(RC[-10]="",,"|n"&R1C23&RC[-10])&IF(RC[-9]="",,"|n"&R1C24&RC[-9])&IF(RC[-8]="",,"|n"&R1C25&RC[-8])&IF(RC[-7]="",,"|n"&R1C26&RC[-7])&IF(RC[-6]="",,"|n"&R1C27&RC[-6])&IF(RC[-5]="",,"|n"&R1C28&RC[-5])&IF(RC[-2]="",,"|n"&RC[-2]) -> 
AG1356: =IF(RC[-26]&RC[-25]&RC[-24]&RC[-23]&RC[-22]&RC[-21]="",,R1C6)&IF(RC[-26]="",,"|n"&R1C7&RC[-26])&IF(RC[-25]="",,"|n"&R1C8&RC[-25])&IF(RC[-24]="",,"|n"&R1C9&RC[-24])&IF(RC[-23]="",,"|n"&R1C10&RC[-23])&IF(RC[-22]="",,"|n"&R1C11&RC[-22])&IF(RC[-21]="",,"|n"&R1C12&RC[-21])&IF(RC[-19]&RC[-18]&RC[-17]&RC[-16]="",,"|n"&R1C13)&IF(RC[-19]="",,"|n"&R1C14&RC[-19])&IF(RC[-18]="",,"|n"&R1C15&RC[-18])&IF(RC[-17]="",,"|n"&R1C16&RC[-17])&IF(RC[-16]="",,"|n"&R1C17&RC[-16])&IF(RC[-15]="",,"|n"&R1C18&RC[-15])&IF(RC[-14]="",,"|n"&R1C19&RC[-14])&IF(RC[-13]="",,"|n"&R1C20&RC[-13])&IF(RC[-12]="",,"|n"&R1C21&RC[-12])&IF(RC[-10]="",,"|n"&R1C23&RC[-10])&IF(RC[-9]="",,"|n"&R1C24&RC[-9])&IF(RC[-8]="",,"|n"&R1C25&RC[-8])&IF(RC[-7]="",,"|n"&R1C26&RC[-7])&IF(RC[-6]="",,"|n"&R1C27&RC[-6])&IF(RC[-5]="",,"|n"&R1C28&RC[-5])&IF(RC[-2]="",,"|n"&RC[-2]) -> 
AG1357: =IF(RC[-26]&RC[-25]&RC[-24]&RC[-23]&RC[-22]&RC[-21]="",,R1C6)&IF(RC[-26]="",,"|n"&R1C7&RC[-26])&IF(RC[-25]="",,"|n"&R1C8&RC[-25])&IF(RC[-24]="",,"|n"&R1C9&RC[-24])&IF(RC[-23]="",,"|n"&R1C10&RC[-23])&IF(RC[-22]="",,"|n"&R1C11&RC[-22])&IF(RC[-21]="",,"|n"&R1C12&RC[-21])&IF(RC[-19]&RC[-18]&RC[-17]&RC[-16]="",,"|n"&R1C13)&IF(RC[-19]="",,"|n"&R1C14&RC[-19])&IF(RC[-18]="",,"|n"&R1C15&RC[-18])&IF(RC[-17]="",,"|n"&R1C16&RC[-17])&IF(RC[-16]="",,"|n"&R1C17&RC[-16])&IF(RC[-15]="",,"|n"&R1C18&RC[-15])&IF(RC[-14]="",,"|n"&R1C19&RC[-14])&IF(RC[-13]="",,"|n"&R1C20&RC[-13])&IF(RC[-12]="",,"|n"&R1C21&RC[-12])&IF(RC[-10]="",,"|n"&R1C23&RC[-10])&IF(RC[-9]="",,"|n"&R1C24&RC[-9])&IF(RC[-8]="",,"|n"&R1C25&RC[-8])&IF(RC[-7]="",,"|n"&R1C26&RC[-7])&IF(RC[-6]="",,"|n"&R1C27&RC[-6])&IF(RC[-5]="",,"|n"&R1C28&RC[-5])&IF(RC[-2]="",,"|n"&RC[-2]) -> 
AG1358: =IF(RC[-26]&RC[-25]&RC[-24]&RC[-23]&RC[-22]&RC[-21]="",,R1C6)&IF(RC[-26]="",,"|n"&R1C7&RC[-26])&IF(RC[-25]="",,"|n"&R1C8&RC[-25])&IF(RC[-24]="",,"|n"&R1C9&RC[-24])&IF(RC[-23]="",,"|n"&R1C10&RC[-23])&IF(RC[-22]="",,"|n"&R1C11&RC[-22])&IF(RC[-21]="",,"|n"&R1C12&RC[-21])&IF(RC[-19]&RC[-18]&RC[-17]&RC[-16]="",,"|n"&R1C13)&IF(RC[-19]="",,"|n"&R1C14&RC[-19])&IF(RC[-18]="",,"|n"&R1C15&RC[-18])&IF(RC[-17]="",,"|n"&R1C16&RC[-17])&IF(RC[-16]="",,"|n"&R1C17&RC[-16])&IF(RC[-15]="",,"|n"&R1C18&RC[-15])&IF(RC[-14]="",,"|n"&R1C19&RC[-14])&IF(RC[-13]="",,"|n"&R1C20&RC[-13])&IF(RC[-12]="",,"|n"&R1C21&RC[-12])&IF(RC[-10]="",,"|n"&R1C23&RC[-10])&IF(RC[-9]="",,"|n"&R1C24&RC[-9])&IF(RC[-8]="",,"|n"&R1C25&RC[-8])&IF(RC[-7]="",,"|n"&R1C26&RC[-7])&IF(RC[-6]="",,"|n"&R1C27&RC[-6])&IF(RC[-5]="",,"|n"&R1C28&RC[-5])&IF(RC[-2]="",,"|n"&RC[-2]) -> 
AG1359: =IF(RC[-26]&RC[-25]&RC[-24]&RC[-23]&RC[-22]&RC[-21]="",,R1C6)&IF(RC[-26]="",,"|n"&R1C7&RC[-26])&IF(RC[-25]="",,"|n"&R1C8&RC[-25])&IF(RC[-24]="",,"|n"&R1C9&RC[-24])&IF(RC[-23]="",,"|n"&R1C10&RC[-23])&IF(RC[-22]="",,"|n"&R1C11&RC[-22])&IF(RC[-21]="",,"|n"&R1C12&RC[-21])&IF(RC[-19]&RC[-18]&RC[-17]&RC[-16]="",,"|n"&R1C13)&IF(RC[-19]="",,"|n"&R1C14&RC[-19])&IF(RC[-18]="",,"|n"&R1C15&RC[-18])&IF(RC[-17]="",,"|n"&R1C16&RC[-17])&IF(RC[-16]="",,"|n"&R1C17&RC[-16])&IF(RC[-15]="",,"|n"&R1C18&RC[-15])&IF(RC[-14]="",,"|n"&R1C19&RC[-14])&IF(RC[-13]="",,"|n"&R1C20&RC[-13])&IF(RC[-12]="",,"|n"&R1C21&RC[-12])&IF(RC[-10]="",,"|n"&R1C23&RC[-10])&IF(RC[-9]="",,"|n"&R1C24&RC[-9])&IF(RC[-8]="",,"|n"&R1C25&RC[-8])&IF(RC[-7]="",,"|n"&R1C26&RC[-7])&IF(RC[-6]="",,"|n"&R1C27&RC[-6])&IF(RC[-5]="",,"|n"&R1C28&RC[-5])&IF(RC[-2]="",,"|n"&RC[-2]) -> 
AG1360: =IF(RC[-26]&RC[-25]&RC[-24]&RC[-23]&RC[-22]&RC[-21]="",,R1C6)&IF(RC[-26]="",,"|n"&R1C7&RC[-26])&IF(RC[-25]="",,"|n"&R1C8&RC[-25])&IF(RC[-24]="",,"|n"&R1C9&RC[-24])&IF(RC[-23]="",,"|n"&R1C10&RC[-23])&IF(RC[-22]="",,"|n"&R1C11&RC[-22])&IF(RC[-21]="",,"|n"&R1C12&RC[-21])&IF(RC[-19]&RC[-18]&RC[-17]&RC[-16]="",,"|n"&R1C13)&IF(RC[-19]="",,"|n"&R1C14&RC[-19])&IF(RC[-18]="",,"|n"&R1C15&RC[-18])&IF(RC[-17]="",,"|n"&R1C16&RC[-17])&IF(RC[-16]="",,"|n"&R1C17&RC[-16])&IF(RC[-15]="",,"|n"&R1C18&RC[-15])&IF(RC[-14]="",,"|n"&R1C19&RC[-14])&IF(RC[-13]="",,"|n"&R1C20&RC[-13])&IF(RC[-12]="",,"|n"&R1C21&RC[-12])&IF(RC[-10]="",,"|n"&R1C23&RC[-10])&IF(RC[-9]="",,"|n"&R1C24&RC[-9])&IF(RC[-8]="",,"|n"&R1C25&RC[-8])&IF(RC[-7]="",,"|n"&R1C26&RC[-7])&IF(RC[-6]="",,"|n"&R1C27&RC[-6])&IF(RC[-5]="",,"|n"&R1C28&RC[-5])&IF(RC[-2]="",,"|n"&RC[-2]) -> 
AG1361: =IF(RC[-26]&RC[-25]&RC[-24]&RC[-23]&RC[-22]&RC[-21]="",,R1C6)&IF(RC[-26]="",,"|n"&R1C7&RC[-26])&IF(RC[-25]="",,"|n"&R1C8&RC[-25])&IF(RC[-24]="",,"|n"&R1C9&RC[-24])&IF(RC[-23]="",,"|n"&R1C10&RC[-23])&IF(RC[-22]="",,"|n"&R1C11&RC[-22])&IF(RC[-21]="",,"|n"&R1C12&RC[-21])&IF(RC[-19]&RC[-18]&RC[-17]&RC[-16]="",,"|n"&R1C13)&IF(RC[-19]="",,"|n"&R1C14&RC[-19])&IF(RC[-18]="",,"|n"&R1C15&RC[-18])&IF(RC[-17]="",,"|n"&R1C16&RC[-17])&IF(RC[-16]="",,"|n"&R1C17&RC[-16])&IF(RC[-15]="",,"|n"&R1C18&RC[-15])&IF(RC[-14]="",,"|n"&R1C19&RC[-14])&IF(RC[-13]="",,"|n"&R1C20&RC[-13])&IF(RC[-12]="",,"|n"&R1C21&RC[-12])&IF(RC[-10]="",,"|n"&R1C23&RC[-10])&IF(RC[-9]="",,"|n"&R1C24&RC[-9])&IF(RC[-8]="",,"|n"&R1C25&RC[-8])&IF(RC[-7]="",,"|n"&R1C26&RC[-7])&IF(RC[-6]="",,"|n"&R1C27&RC[-6])&IF(RC[-5]="",,"|n"&R1C28&RC[-5])&IF(RC[-2]="",,"|n"&RC[-2]) -> 
AG1362: =IF(RC[-26]&RC[-25]&RC[-24]&RC[-23]&RC[-22]&RC[-21]="",,R1C6)&IF(RC[-26]="",,"|n"&R1C7&RC[-26])&IF(RC[-25]="",,"|n"&R1C8&RC[-25])&IF(RC[-24]="",,"|n"&R1C9&RC[-24])&IF(RC[-23]="",,"|n"&R1C10&RC[-23])&IF(RC[-22]="",,"|n"&R1C11&RC[-22])&IF(RC[-21]="",,"|n"&R1C12&RC[-21])&IF(RC[-19]&RC[-18]&RC[-17]&RC[-16]="",,"|n"&R1C13)&IF(RC[-19]="",,"|n"&R1C14&RC[-19])&IF(RC[-18]="",,"|n"&R1C15&RC[-18])&IF(RC[-17]="",,"|n"&R1C16&RC[-17])&IF(RC[-16]="",,"|n"&R1C17&RC[-16])&IF(RC[-15]="",,"|n"&R1C18&RC[-15])&IF(RC[-14]="",,"|n"&R1C19&RC[-14])&IF(RC[-13]="",,"|n"&R1C20&RC[-13])&IF(RC[-12]="",,"|n"&R1C21&RC[-12])&IF(RC[-10]="",,"|n"&R1C23&RC[-10])&IF(RC[-9]="",,"|n"&R1C24&RC[-9])&IF(RC[-8]="",,"|n"&R1C25&RC[-8])&IF(RC[-7]="",,"|n"&R1C26&RC[-7])&IF(RC[-6]="",,"|n"&R1C27&RC[-6])&IF(RC[-5]="",,"|n"&R1C28&RC[-5])&IF(RC[-2]="",,"|n"&RC[-2]) -> 
AG1363: =IF(RC[-26]&RC[-25]&RC[-24]&RC[-23]&RC[-22]&RC[-21]="",,R1C6)&IF(RC[-26]="",,"|n"&R1C7&RC[-26])&IF(RC[-25]="",,"|n"&R1C8&RC[-25])&IF(RC[-24]="",,"|n"&R1C9&RC[-24])&IF(RC[-23]="",,"|n"&R1C10&RC[-23])&IF(RC[-22]="",,"|n"&R1C11&RC[-22])&IF(RC[-21]="",,"|n"&R1C12&RC[-21])&IF(RC[-19]&RC[-18]&RC[-17]&RC[-16]="",,"|n"&R1C13)&IF(RC[-19]="",,"|n"&R1C14&RC[-19])&IF(RC[-18]="",,"|n"&R1C15&RC[-18])&IF(RC[-17]="",,"|n"&R1C16&RC[-17])&IF(RC[-16]="",,"|n"&R1C17&RC[-16])&IF(RC[-15]="",,"|n"&R1C18&RC[-15])&IF(RC[-14]="",,"|n"&R1C19&RC[-14])&IF(RC[-13]="",,"|n"&R1C20&RC[-13])&IF(RC[-12]="",,"|n"&R1C21&RC[-12])&IF(RC[-10]="",,"|n"&R1C23&RC[-10])&IF(RC[-9]="",,"|n"&R1C24&RC[-9])&IF(RC[-8]="",,"|n"&R1C25&RC[-8])&IF(RC[-7]="",,"|n"&R1C26&RC[-7])&IF(RC[-6]="",,"|n"&R1C27&RC[-6])&IF(RC[-5]="",,"|n"&R1C28&RC[-5])&IF(RC[-2]="",,"|n"&RC[-2]) -> 
AG1364: =IF(RC[-26]&RC[-25]&RC[-24]&RC[-23]&RC[-22]&RC[-21]="",,R1C6)&IF(RC[-26]="",,"|n"&R1C7&RC[-26])&IF(RC[-25]="",,"|n"&R1C8&RC[-25])&IF(RC[-24]="",,"|n"&R1C9&RC[-24])&IF(RC[-23]="",,"|n"&R1C10&RC[-23])&IF(RC[-22]="",,"|n"&R1C11&RC[-22])&IF(RC[-21]="",,"|n"&R1C12&RC[-21])&IF(RC[-19]&RC[-18]&RC[-17]&RC[-16]="",,"|n"&R1C13)&IF(RC[-19]="",,"|n"&R1C14&RC[-19])&IF(RC[-18]="",,"|n"&R1C15&RC[-18])&IF(RC[-17]="",,"|n"&R1C16&RC[-17])&IF(RC[-16]="",,"|n"&R1C17&RC[-16])&IF(RC[-15]="",,"|n"&R1C18&RC[-15])&IF(RC[-14]="",,"|n"&R1C19&RC[-14])&IF(RC[-13]="",,"|n"&R1C20&RC[-13])&IF(RC[-12]="",,"|n"&R1C21&RC[-12])&IF(RC[-10]="",,"|n"&R1C23&RC[-10])&IF(RC[-9]="",,"|n"&R1C24&RC[-9])&IF(RC[-8]="",,"|n"&R1C25&RC[-8])&IF(RC[-7]="",,"|n"&R1C26&RC[-7])&IF(RC[-6]="",,"|n"&R1C27&RC[-6])&IF(RC[-5]="",,"|n"&R1C28&RC[-5])&IF(RC[-2]="",,"|n"&RC[-2]) -> 
AG1365: =IF(RC[-26]&RC[-25]&RC[-24]&RC[-23]&RC[-22]&RC[-21]="",,R1C6)&IF(RC[-26]="",,"|n"&R1C7&RC[-26])&IF(RC[-25]="",,"|n"&R1C8&RC[-25])&IF(RC[-24]="",,"|n"&R1C9&RC[-24])&IF(RC[-23]="",,"|n"&R1C10&RC[-23])&IF(RC[-22]="",,"|n"&R1C11&RC[-22])&IF(RC[-21]="",,"|n"&R1C12&RC[-21])&IF(RC[-19]&RC[-18]&RC[-17]&RC[-16]="",,"|n"&R1C13)&IF(RC[-19]="",,"|n"&R1C14&RC[-19])&IF(RC[-18]="",,"|n"&R1C15&RC[-18])&IF(RC[-17]="",,"|n"&R1C16&RC[-17])&IF(RC[-16]="",,"|n"&R1C17&RC[-16])&IF(RC[-15]="",,"|n"&R1C18&RC[-15])&IF(RC[-14]="",,"|n"&R1C19&RC[-14])&IF(RC[-13]="",,"|n"&R1C20&RC[-13])&IF(RC[-12]="",,"|n"&R1C21&RC[-12])&IF(RC[-10]="",,"|n"&R1C23&RC[-10])&IF(RC[-9]="",,"|n"&R1C24&RC[-9])&IF(RC[-8]="",,"|n"&R1C25&RC[-8])&IF(RC[-7]="",,"|n"&R1C26&RC[-7])&IF(RC[-6]="",,"|n"&R1C27&RC[-6])&IF(RC[-5]="",,"|n"&R1C28&RC[-5])&IF(RC[-2]="",,"|n"&RC[-2]) -> 
AG1366: =IF(RC[-26]&RC[-25]&RC[-24]&RC[-23]&RC[-22]&RC[-21]="",,R1C6)&IF(RC[-26]="",,"|n"&R1C7&RC[-26])&IF(RC[-25]="",,"|n"&R1C8&RC[-25])&IF(RC[-24]="",,"|n"&R1C9&RC[-24])&IF(RC[-23]="",,"|n"&R1C10&RC[-23])&IF(RC[-22]="",,"|n"&R1C11&RC[-22])&IF(RC[-21]="",,"|n"&R1C12&RC[-21])&IF(RC[-19]&RC[-18]&RC[-17]&RC[-16]="",,"|n"&R1C13)&IF(RC[-19]="",,"|n"&R1C14&RC[-19])&IF(RC[-18]="",,"|n"&R1C15&RC[-18])&IF(RC[-17]="",,"|n"&R1C16&RC[-17])&IF(RC[-16]="",,"|n"&R1C17&RC[-16])&IF(RC[-15]="",,"|n"&R1C18&RC[-15])&IF(RC[-14]="",,"|n"&R1C19&RC[-14])&IF(RC[-13]="",,"|n"&R1C20&RC[-13])&IF(RC[-12]="",,"|n"&R1C21&RC[-12])&IF(RC[-10]="",,"|n"&R1C23&RC[-10])&IF(RC[-9]="",,"|n"&R1C24&RC[-9])&IF(RC[-8]="",,"|n"&R1C25&RC[-8])&IF(RC[-7]="",,"|n"&R1C26&RC[-7])&IF(RC[-6]="",,"|n"&R1C27&RC[-6])&IF(RC[-5]="",,"|n"&R1C28&RC[-5])&IF(RC[-2]="",,"|n"&RC[-2]) -> 
AG1367: =IF(RC[-26]&RC[-25]&RC[-24]&RC[-23]&RC[-22]&RC[-21]="",,R1C6)&IF(RC[-26]="",,"|n"&R1C7&RC[-26])&IF(RC[-25]="",,"|n"&R1C8&RC[-25])&IF(RC[-24]="",,"|n"&R1C9&RC[-24])&IF(RC[-23]="",,"|n"&R1C10&RC[-23])&IF(RC[-22]="",,"|n"&R1C11&RC[-22])&IF(RC[-21]="",,"|n"&R1C12&RC[-21])&IF(RC[-19]&RC[-18]&RC[-17]&RC[-16]="",,"|n"&R1C13)&IF(RC[-19]="",,"|n"&R1C14&RC[-19])&IF(RC[-18]="",,"|n"&R1C15&RC[-18])&IF(RC[-17]="",,"|n"&R1C16&RC[-17])&IF(RC[-16]="",,"|n"&R1C17&RC[-16])&IF(RC[-15]="",,"|n"&R1C18&RC[-15])&IF(RC[-14]="",,"|n"&R1C19&RC[-14])&IF(RC[-13]="",,"|n"&R1C20&RC[-13])&IF(RC[-12]="",,"|n"&R1C21&RC[-12])&IF(RC[-10]="",,"|n"&R1C23&RC[-10])&IF(RC[-9]="",,"|n"&R1C24&RC[-9])&IF(RC[-8]="",,"|n"&R1C25&RC[-8])&IF(RC[-7]="",,"|n"&R1C26&RC[-7])&IF(RC[-6]="",,"|n"&R1C27&RC[-6])&IF(RC[-5]="",,"|n"&R1C28&RC[-5])&IF(RC[-2]="",,"|n"&RC[-2]) -> 
AG1368: =IF(RC[-26]&RC[-25]&RC[-24]&RC[-23]&RC[-22]&RC[-21]="",,R1C6)&IF(RC[-26]="",,"|n"&R1C7&RC[-26])&IF(RC[-25]="",,"|n"&R1C8&RC[-25])&IF(RC[-24]="",,"|n"&R1C9&RC[-24])&IF(RC[-23]="",,"|n"&R1C10&RC[-23])&IF(RC[-22]="",,"|n"&R1C11&RC[-22])&IF(RC[-21]="",,"|n"&R1C12&RC[-21])&IF(RC[-19]&RC[-18]&RC[-17]&RC[-16]="",,"|n"&R1C13)&IF(RC[-19]="",,"|n"&R1C14&RC[-19])&IF(RC[-18]="",,"|n"&R1C15&RC[-18])&IF(RC[-17]="",,"|n"&R1C16&RC[-17])&IF(RC[-16]="",,"|n"&R1C17&RC[-16])&IF(RC[-15]="",,"|n"&R1C18&RC[-15])&IF(RC[-14]="",,"|n"&R1C19&RC[-14])&IF(RC[-13]="",,"|n"&R1C20&RC[-13])&IF(RC[-12]="",,"|n"&R1C21&RC[-12])&IF(RC[-10]="",,"|n"&R1C23&RC[-10])&IF(RC[-9]="",,"|n"&R1C24&RC[-9])&IF(RC[-8]="",,"|n"&R1C25&RC[-8])&IF(RC[-7]="",,"|n"&R1C26&RC[-7])&IF(RC[-6]="",,"|n"&R1C27&RC[-6])&IF(RC[-5]="",,"|n"&R1C28&RC[-5])&IF(RC[-2]="",,"|n"&RC[-2]) -> 
AG1369: =IF(RC[-26]&RC[-25]&RC[-24]&RC[-23]&RC[-22]&RC[-21]="",,R1C6)&IF(RC[-26]="",,"|n"&R1C7&RC[-26])&IF(RC[-25]="",,"|n"&R1C8&RC[-25])&IF(RC[-24]="",,"|n"&R1C9&RC[-24])&IF(RC[-23]="",,"|n"&R1C10&RC[-23])&IF(RC[-22]="",,"|n"&R1C11&RC[-22])&IF(RC[-21]="",,"|n"&R1C12&RC[-21])&IF(RC[-19]&RC[-18]&RC[-17]&RC[-16]="",,"|n"&R1C13)&IF(RC[-19]="",,"|n"&R1C14&RC[-19])&IF(RC[-18]="",,"|n"&R1C15&RC[-18])&IF(RC[-17]="",,"|n"&R1C16&RC[-17])&IF(RC[-16]="",,"|n"&R1C17&RC[-16])&IF(RC[-15]="",,"|n"&R1C18&RC[-15])&IF(RC[-14]="",,"|n"&R1C19&RC[-14])&IF(RC[-13]="",,"|n"&R1C20&RC[-13])&IF(RC[-12]="",,"|n"&R1C21&RC[-12])&IF(RC[-10]="",,"|n"&R1C23&RC[-10])&IF(RC[-9]="",,"|n"&R1C24&RC[-9])&IF(RC[-8]="",,"|n"&R1C25&RC[-8])&IF(RC[-7]="",,"|n"&R1C26&RC[-7])&IF(RC[-6]="",,"|n"&R1C27&RC[-6])&IF(RC[-5]="",,"|n"&R1C28&RC[-5])&IF(RC[-2]="",,"|n"&RC[-2]) -> 
AG1370: =IF(RC[-26]&RC[-25]&RC[-24]&RC[-23]&RC[-22]&RC[-21]="",,R1C6)&IF(RC[-26]="",,"|n"&R1C7&RC[-26])&IF(RC[-25]="",,"|n"&R1C8&RC[-25])&IF(RC[-24]="",,"|n"&R1C9&RC[-24])&IF(RC[-23]="",,"|n"&R1C10&RC[-23])&IF(RC[-22]="",,"|n"&R1C11&RC[-22])&IF(RC[-21]="",,"|n"&R1C12&RC[-21])&IF(RC[-19]&RC[-18]&RC[-17]&RC[-16]="",,"|n"&R1C13)&IF(RC[-19]="",,"|n"&R1C14&RC[-19])&IF(RC[-18]="",,"|n"&R1C15&RC[-18])&IF(RC[-17]="",,"|n"&R1C16&RC[-17])&IF(RC[-16]="",,"|n"&R1C17&RC[-16])&IF(RC[-15]="",,"|n"&R1C18&RC[-15])&IF(RC[-14]="",,"|n"&R1C19&RC[-14])&IF(RC[-13]="",,"|n"&R1C20&RC[-13])&IF(RC[-12]="",,"|n"&R1C21&RC[-12])&IF(RC[-10]="",,"|n"&R1C23&RC[-10])&IF(RC[-9]="",,"|n"&R1C24&RC[-9])&IF(RC[-8]="",,"|n"&R1C25&RC[-8])&IF(RC[-7]="",,"|n"&R1C26&RC[-7])&IF(RC[-6]="",,"|n"&R1C27&RC[-6])&IF(RC[-5]="",,"|n"&R1C28&RC[-5])&IF(RC[-2]="",,"|n"&RC[-2]) -> 
AG1371: =IF(RC[-26]&RC[-25]&RC[-24]&RC[-23]&RC[-22]&RC[-21]="",,R1C6)&IF(RC[-26]="",,"|n"&R1C7&RC[-26])&IF(RC[-25]="",,"|n"&R1C8&RC[-25])&IF(RC[-24]="",,"|n"&R1C9&RC[-24])&IF(RC[-23]="",,"|n"&R1C10&RC[-23])&IF(RC[-22]="",,"|n"&R1C11&RC[-22])&IF(RC[-21]="",,"|n"&R1C12&RC[-21])&IF(RC[-19]&RC[-18]&RC[-17]&RC[-16]="",,"|n"&R1C13)&IF(RC[-19]="",,"|n"&R1C14&RC[-19])&IF(RC[-18]="",,"|n"&R1C15&RC[-18])&IF(RC[-17]="",,"|n"&R1C16&RC[-17])&IF(RC[-16]="",,"|n"&R1C17&RC[-16])&IF(RC[-15]="",,"|n"&R1C18&RC[-15])&IF(RC[-14]="",,"|n"&R1C19&RC[-14])&IF(RC[-13]="",,"|n"&R1C20&RC[-13])&IF(RC[-12]="",,"|n"&R1C21&RC[-12])&IF(RC[-10]="",,"|n"&R1C23&RC[-10])&IF(RC[-9]="",,"|n"&R1C24&RC[-9])&IF(RC[-8]="",,"|n"&R1C25&RC[-8])&IF(RC[-7]="",,"|n"&R1C26&RC[-7])&IF(RC[-6]="",,"|n"&R1C27&RC[-6])&IF(RC[-5]="",,"|n"&R1C28&RC[-5])&IF(RC[-2]="",,"|n"&RC[-2]) -> 
AG1372: =IF(RC[-26]&RC[-25]&RC[-24]&RC[-23]&RC[-22]&RC[-21]="",,R1C6)&IF(RC[-26]="",,"|n"&R1C7&RC[-26])&IF(RC[-25]="",,"|n"&R1C8&RC[-25])&IF(RC[-24]="",,"|n"&R1C9&RC[-24])&IF(RC[-23]="",,"|n"&R1C10&RC[-23])&IF(RC[-22]="",,"|n"&R1C11&RC[-22])&IF(RC[-21]="",,"|n"&R1C12&RC[-21])&IF(RC[-19]&RC[-18]&RC[-17]&RC[-16]="",,"|n"&R1C13)&IF(RC[-19]="",,"|n"&R1C14&RC[-19])&IF(RC[-18]="",,"|n"&R1C15&RC[-18])&IF(RC[-17]="",,"|n"&R1C16&RC[-17])&IF(RC[-16]="",,"|n"&R1C17&RC[-16])&IF(RC[-15]="",,"|n"&R1C18&RC[-15])&IF(RC[-14]="",,"|n"&R1C19&RC[-14])&IF(RC[-13]="",,"|n"&R1C20&RC[-13])&IF(RC[-12]="",,"|n"&R1C21&RC[-12])&IF(RC[-10]="",,"|n"&R1C23&RC[-10])&IF(RC[-9]="",,"|n"&R1C24&RC[-9])&IF(RC[-8]="",,"|n"&R1C25&RC[-8])&IF(RC[-7]="",,"|n"&R1C26&RC[-7])&IF(RC[-6]="",,"|n"&R1C27&RC[-6])&IF(RC[-5]="",,"|n"&R1C28&RC[-5])&IF(RC[-2]="",,"|n"&RC[-2]) -> 
AG1373: =IF(RC[-26]&RC[-25]&RC[-24]&RC[-23]&RC[-22]&RC[-21]="",,R1C6)&IF(RC[-26]="",,"|n"&R1C7&RC[-26])&IF(RC[-25]="",,"|n"&R1C8&RC[-25])&IF(RC[-24]="",,"|n"&R1C9&RC[-24])&IF(RC[-23]="",,"|n"&R1C10&RC[-23])&IF(RC[-22]="",,"|n"&R1C11&RC[-22])&IF(RC[-21]="",,"|n"&R1C12&RC[-21])&IF(RC[-19]&RC[-18]&RC[-17]&RC[-16]="",,"|n"&R1C13)&IF(RC[-19]="",,"|n"&R1C14&RC[-19])&IF(RC[-18]="",,"|n"&R1C15&RC[-18])&IF(RC[-17]="",,"|n"&R1C16&RC[-17])&IF(RC[-16]="",,"|n"&R1C17&RC[-16])&IF(RC[-15]="",,"|n"&R1C18&RC[-15])&IF(RC[-14]="",,"|n"&R1C19&RC[-14])&IF(RC[-13]="",,"|n"&R1C20&RC[-13])&IF(RC[-12]="",,"|n"&R1C21&RC[-12])&IF(RC[-10]="",,"|n"&R1C23&RC[-10])&IF(RC[-9]="",,"|n"&R1C24&RC[-9])&IF(RC[-8]="",,"|n"&R1C25&RC[-8])&IF(RC[-7]="",,"|n"&R1C26&RC[-7])&IF(RC[-6]="",,"|n"&R1C27&RC[-6])&IF(RC[-5]="",,"|n"&R1C28&RC[-5])&IF(RC[-2]="",,"|n"&RC[-2]) -> 
AG1374: =IF(RC[-26]&RC[-25]&RC[-24]&RC[-23]&RC[-22]&RC[-21]="",,R1C6)&IF(RC[-26]="",,"|n"&R1C7&RC[-26])&IF(RC[-25]="",,"|n"&R1C8&RC[-25])&IF(RC[-24]="",,"|n"&R1C9&RC[-24])&IF(RC[-23]="",,"|n"&R1C10&RC[-23])&IF(RC[-22]="",,"|n"&R1C11&RC[-22])&IF(RC[-21]="",,"|n"&R1C12&RC[-21])&IF(RC[-19]&RC[-18]&RC[-17]&RC[-16]="",,"|n"&R1C13)&IF(RC[-19]="",,"|n"&R1C14&RC[-19])&IF(RC[-18]="",,"|n"&R1C15&RC[-18])&IF(RC[-17]="",,"|n"&R1C16&RC[-17])&IF(RC[-16]="",,"|n"&R1C17&RC[-16])&IF(RC[-15]="",,"|n"&R1C18&RC[-15])&IF(RC[-14]="",,"|n"&R1C19&RC[-14])&IF(RC[-13]="",,"|n"&R1C20&RC[-13])&IF(RC[-12]="",,"|n"&R1C21&RC[-12])&IF(RC[-10]="",,"|n"&R1C23&RC[-10])&IF(RC[-9]="",,"|n"&R1C24&RC[-9])&IF(RC[-8]="",,"|n"&R1C25&RC[-8])&IF(RC[-7]="",,"|n"&R1C26&RC[-7])&IF(RC[-6]="",,"|n"&R1C27&RC[-6])&IF(RC[-5]="",,"|n"&R1C28&RC[-5])&IF(RC[-2]="",,"|n"&RC[-2]) -> 
AG1375: =IF(RC[-26]&RC[-25]&RC[-24]&RC[-23]&RC[-22]&RC[-21]="",,R1C6)&IF(RC[-26]="",,"|n"&R1C7&RC[-26])&IF(RC[-25]="",,"|n"&R1C8&RC[-25])&IF(RC[-24]="",,"|n"&R1C9&RC[-24])&IF(RC[-23]="",,"|n"&R1C10&RC[-23])&IF(RC[-22]="",,"|n"&R1C11&RC[-22])&IF(RC[-21]="",,"|n"&R1C12&RC[-21])&IF(RC[-19]&RC[-18]&RC[-17]&RC[-16]="",,"|n"&R1C13)&IF(RC[-19]="",,"|n"&R1C14&RC[-19])&IF(RC[-18]="",,"|n"&R1C15&RC[-18])&IF(RC[-17]="",,"|n"&R1C16&RC[-17])&IF(RC[-16]="",,"|n"&R1C17&RC[-16])&IF(RC[-15]="",,"|n"&R1C18&RC[-15])&IF(RC[-14]="",,"|n"&R1C19&RC[-14])&IF(RC[-13]="",,"|n"&R1C20&RC[-13])&IF(RC[-12]="",,"|n"&R1C21&RC[-12])&IF(RC[-10]="",,"|n"&R1C23&RC[-10])&IF(RC[-9]="",,"|n"&R1C24&RC[-9])&IF(RC[-8]="",,"|n"&R1C25&RC[-8])&IF(RC[-7]="",,"|n"&R1C26&RC[-7])&IF(RC[-6]="",,"|n"&R1C27&RC[-6])&IF(RC[-5]="",,"|n"&R1C28&RC[-5])&IF(RC[-2]="",,"|n"&RC[-2]) -> 
AG1376: =IF(RC[-26]&RC[-25]&RC[-24]&RC[-23]&RC[-22]&RC[-21]="",,R1C6)&IF(RC[-26]="",,"|n"&R1C7&RC[-26])&IF(RC[-25]="",,"|n"&R1C8&RC[-25])&IF(RC[-24]="",,"|n"&R1C9&RC[-24])&IF(RC[-23]="",,"|n"&R1C10&RC[-23])&IF(RC[-22]="",,"|n"&R1C11&RC[-22])&IF(RC[-21]="",,"|n"&R1C12&RC[-21])&IF(RC[-19]&RC[-18]&RC[-17]&RC[-16]="",,"|n"&R1C13)&IF(RC[-19]="",,"|n"&R1C14&RC[-19])&IF(RC[-18]="",,"|n"&R1C15&RC[-18])&IF(RC[-17]="",,"|n"&R1C16&RC[-17])&IF(RC[-16]="",,"|n"&R1C17&RC[-16])&IF(RC[-15]="",,"|n"&R1C18&RC[-15])&IF(RC[-14]="",,"|n"&R1C19&RC[-14])&IF(RC[-13]="",,"|n"&R1C20&RC[-13])&IF(RC[-12]="",,"|n"&R1C21&RC[-12])&IF(RC[-10]="",,"|n"&R1C23&RC[-10])&IF(RC[-9]="",,"|n"&R1C24&RC[-9])&IF(RC[-8]="",,"|n"&R1C25&RC[-8])&IF(RC[-7]="",,"|n"&R1C26&RC[-7])&IF(RC[-6]="",,"|n"&R1C27&RC[-6])&IF(RC[-5]="",,"|n"&R1C28&RC[-5])&IF(RC[-2]="",,"|n"&RC[-2]) -> 
AG1377: =IF(RC[-26]&RC[-25]&RC[-24]&RC[-23]&RC[-22]&RC[-21]="",,R1C6)&IF(RC[-26]="",,"|n"&R1C7&RC[-26])&IF(RC[-25]="",,"|n"&R1C8&RC[-25])&IF(RC[-24]="",,"|n"&R1C9&RC[-24])&IF(RC[-23]="",,"|n"&R1C10&RC[-23])&IF(RC[-22]="",,"|n"&R1C11&RC[-22])&IF(RC[-21]="",,"|n"&R1C12&RC[-21])&IF(RC[-19]&RC[-18]&RC[-17]&RC[-16]="",,"|n"&R1C13)&IF(RC[-19]="",,"|n"&R1C14&RC[-19])&IF(RC[-18]="",,"|n"&R1C15&RC[-18])&IF(RC[-17]="",,"|n"&R1C16&RC[-17])&IF(RC[-16]="",,"|n"&R1C17&RC[-16])&IF(RC[-15]="",,"|n"&R1C18&RC[-15])&IF(RC[-14]="",,"|n"&R1C19&RC[-14])&IF(RC[-13]="",,"|n"&R1C20&RC[-13])&IF(RC[-12]="",,"|n"&R1C21&RC[-12])&IF(RC[-10]="",,"|n"&R1C23&RC[-10])&IF(RC[-9]="",,"|n"&R1C24&RC[-9])&IF(RC[-8]="",,"|n"&R1C25&RC[-8])&IF(RC[-7]="",,"|n"&R1C26&RC[-7])&IF(RC[-6]="",,"|n"&R1C27&RC[-6])&IF(RC[-5]="",,"|n"&R1C28&RC[-5])&IF(RC[-2]="",,"|n"&RC[-2]) -> 
AG1378: =IF(RC[-26]&RC[-25]&RC[-24]&RC[-23]&RC[-22]&RC[-21]="",,R1C6)&IF(RC[-26]="",,"|n"&R1C7&RC[-26])&IF(RC[-25]="",,"|n"&R1C8&RC[-25])&IF(RC[-24]="",,"|n"&R1C9&RC[-24])&IF(RC[-23]="",,"|n"&R1C10&RC[-23])&IF(RC[-22]="",,"|n"&R1C11&RC[-22])&IF(RC[-21]="",,"|n"&R1C12&RC[-21])&IF(RC[-19]&RC[-18]&RC[-17]&RC[-16]="",,"|n"&R1C13)&IF(RC[-19]="",,"|n"&R1C14&RC[-19])&IF(RC[-18]="",,"|n"&R1C15&RC[-18])&IF(RC[-17]="",,"|n"&R1C16&RC[-17])&IF(RC[-16]="",,"|n"&R1C17&RC[-16])&IF(RC[-15]="",,"|n"&R1C18&RC[-15])&IF(RC[-14]="",,"|n"&R1C19&RC[-14])&IF(RC[-13]="",,"|n"&R1C20&RC[-13])&IF(RC[-12]="",,"|n"&R1C21&RC[-12])&IF(RC[-10]="",,"|n"&R1C23&RC[-10])&IF(RC[-9]="",,"|n"&R1C24&RC[-9])&IF(RC[-8]="",,"|n"&R1C25&RC[-8])&IF(RC[-7]="",,"|n"&R1C26&RC[-7])&IF(RC[-6]="",,"|n"&R1C27&RC[-6])&IF(RC[-5]="",,"|n"&R1C28&RC[-5])&IF(RC[-2]="",,"|n"&RC[-2]) -> 
AG1379: =IF(RC[-26]&RC[-25]&RC[-24]&RC[-23]&RC[-22]&RC[-21]="",,R1C6)&IF(RC[-26]="",,"|n"&R1C7&RC[-26])&IF(RC[-25]="",,"|n"&R1C8&RC[-25])&IF(RC[-24]="",,"|n"&R1C9&RC[-24])&IF(RC[-23]="",,"|n"&R1C10&RC[-23])&IF(RC[-22]="",,"|n"&R1C11&RC[-22])&IF(RC[-21]="",,"|n"&R1C12&RC[-21])&IF(RC[-19]&RC[-18]&RC[-17]&RC[-16]="",,"|n"&R1C13)&IF(RC[-19]="",,"|n"&R1C14&RC[-19])&IF(RC[-18]="",,"|n"&R1C15&RC[-18])&IF(RC[-17]="",,"|n"&R1C16&RC[-17])&IF(RC[-16]="",,"|n"&R1C17&RC[-16])&IF(RC[-15]="",,"|n"&R1C18&RC[-15])&IF(RC[-14]="",,"|n"&R1C19&RC[-14])&IF(RC[-13]="",,"|n"&R1C20&RC[-13])&IF(RC[-12]="",,"|n"&R1C21&RC[-12])&IF(RC[-10]="",,"|n"&R1C23&RC[-10])&IF(RC[-9]="",,"|n"&R1C24&RC[-9])&IF(RC[-8]="",,"|n"&R1C25&RC[-8])&IF(RC[-7]="",,"|n"&R1C26&RC[-7])&IF(RC[-6]="",,"|n"&R1C27&RC[-6])&IF(RC[-5]="",,"|n"&R1C28&RC[-5])&IF(RC[-2]="",,"|n"&RC[-2]) -> 
AG1380: =IF(RC[-26]&RC[-25]&RC[-24]&RC[-23]&RC[-22]&RC[-21]="",,R1C6)&IF(RC[-26]="",,"|n"&R1C7&RC[-26])&IF(RC[-25]="",,"|n"&R1C8&RC[-25])&IF(RC[-24]="",,"|n"&R1C9&RC[-24])&IF(RC[-23]="",,"|n"&R1C10&RC[-23])&IF(RC[-22]="",,"|n"&R1C11&RC[-22])&IF(RC[-21]="",,"|n"&R1C12&RC[-21])&IF(RC[-19]&RC[-18]&RC[-17]&RC[-16]="",,"|n"&R1C13)&IF(RC[-19]="",,"|n"&R1C14&RC[-19])&IF(RC[-18]="",,"|n"&R1C15&RC[-18])&IF(RC[-17]="",,"|n"&R1C16&RC[-17])&IF(RC[-16]="",,"|n"&R1C17&RC[-16])&IF(RC[-15]="",,"|n"&R1C18&RC[-15])&IF(RC[-14]="",,"|n"&R1C19&RC[-14])&IF(RC[-13]="",,"|n"&R1C20&RC[-13])&IF(RC[-12]="",,"|n"&R1C21&RC[-12])&IF(RC[-10]="",,"|n"&R1C23&RC[-10])&IF(RC[-9]="",,"|n"&R1C24&RC[-9])&IF(RC[-8]="",,"|n"&R1C25&RC[-8])&IF(RC[-7]="",,"|n"&R1C26&RC[-7])&IF(RC[-6]="",,"|n"&R1C27&RC[-6])&IF(RC[-5]="",,"|n"&R1C28&RC[-5])&IF(RC[-2]="",,"|n"&RC[-2]) -> 
AG1381: =IF(RC[-26]&RC[-25]&RC[-24]&RC[-23]&RC[-22]&RC[-21]="",,R1C6)&IF(RC[-26]="",,"|n"&R1C7&RC[-26])&IF(RC[-25]="",,"|n"&R1C8&RC[-25])&IF(RC[-24]="",,"|n"&R1C9&RC[-24])&IF(RC[-23]="",,"|n"&R1C10&RC[-23])&IF(RC[-22]="",,"|n"&R1C11&RC[-22])&IF(RC[-21]="",,"|n"&R1C12&RC[-21])&IF(RC[-19]&RC[-18]&RC[-17]&RC[-16]="",,"|n"&R1C13)&IF(RC[-19]="",,"|n"&R1C14&RC[-19])&IF(RC[-18]="",,"|n"&R1C15&RC[-18])&IF(RC[-17]="",,"|n"&R1C16&RC[-17])&IF(RC[-16]="",,"|n"&R1C17&RC[-16])&IF(RC[-15]="",,"|n"&R1C18&RC[-15])&IF(RC[-14]="",,"|n"&R1C19&RC[-14])&IF(RC[-13]="",,"|n"&R1C20&RC[-13])&IF(RC[-12]="",,"|n"&R1C21&RC[-12])&IF(RC[-10]="",,"|n"&R1C23&RC[-10])&IF(RC[-9]="",,"|n"&R1C24&RC[-9])&IF(RC[-8]="",,"|n"&R1C25&RC[-8])&IF(RC[-7]="",,"|n"&R1C26&RC[-7])&IF(RC[-6]="",,"|n"&R1C27&RC[-6])&IF(RC[-5]="",,"|n"&R1C28&RC[-5])&IF(RC[-2]="",,"|n"&RC[-2]) -> 
AG1382: =IF(RC[-26]&RC[-25]&RC[-24]&RC[-23]&RC[-22]&RC[-21]="",,R1C6)&IF(RC[-26]="",,"|n"&R1C7&RC[-26])&IF(RC[-25]="",,"|n"&R1C8&RC[-25])&IF(RC[-24]="",,"|n"&R1C9&RC[-24])&IF(RC[-23]="",,"|n"&R1C10&RC[-23])&IF(RC[-22]="",,"|n"&R1C11&RC[-22])&IF(RC[-21]="",,"|n"&R1C12&RC[-21])&IF(RC[-19]&RC[-18]&RC[-17]&RC[-16]="",,"|n"&R1C13)&IF(RC[-19]="",,"|n"&R1C14&RC[-19])&IF(RC[-18]="",,"|n"&R1C15&RC[-18])&IF(RC[-17]="",,"|n"&R1C16&RC[-17])&IF(RC[-16]="",,"|n"&R1C17&RC[-16])&IF(RC[-15]="",,"|n"&R1C18&RC[-15])&IF(RC[-14]="",,"|n"&R1C19&RC[-14])&IF(RC[-13]="",,"|n"&R1C20&RC[-13])&IF(RC[-12]="",,"|n"&R1C21&RC[-12])&IF(RC[-10]="",,"|n"&R1C23&RC[-10])&IF(RC[-9]="",,"|n"&R1C24&RC[-9])&IF(RC[-8]="",,"|n"&R1C25&RC[-8])&IF(RC[-7]="",,"|n"&R1C26&RC[-7])&IF(RC[-6]="",,"|n"&R1C27&RC[-6])&IF(RC[-5]="",,"|n"&R1C28&RC[-5])&IF(RC[-2]="",,"|n"&RC[-2]) -> 
AG1383: =IF(RC[-26]&RC[-25]&RC[-24]&RC[-23]&RC[-22]&RC[-21]="",,R1C6)&IF(RC[-26]="",,"|n"&R1C7&RC[-26])&IF(RC[-25]="",,"|n"&R1C8&RC[-25])&IF(RC[-24]="",,"|n"&R1C9&RC[-24])&IF(RC[-23]="",,"|n"&R1C10&RC[-23])&IF(RC[-22]="",,"|n"&R1C11&RC[-22])&IF(RC[-21]="",,"|n"&R1C12&RC[-21])&IF(RC[-19]&RC[-18]&RC[-17]&RC[-16]="",,"|n"&R1C13)&IF(RC[-19]="",,"|n"&R1C14&RC[-19])&IF(RC[-18]="",,"|n"&R1C15&RC[-18])&IF(RC[-17]="",,"|n"&R1C16&RC[-17])&IF(RC[-16]="",,"|n"&R1C17&RC[-16])&IF(RC[-15]="",,"|n"&R1C18&RC[-15])&IF(RC[-14]="",,"|n"&R1C19&RC[-14])&IF(RC[-13]="",,"|n"&R1C20&RC[-13])&IF(RC[-12]="",,"|n"&R1C21&RC[-12])&IF(RC[-10]="",,"|n"&R1C23&RC[-10])&IF(RC[-9]="",,"|n"&R1C24&RC[-9])&IF(RC[-8]="",,"|n"&R1C25&RC[-8])&IF(RC[-7]="",,"|n"&R1C26&RC[-7])&IF(RC[-6]="",,"|n"&R1C27&RC[-6])&IF(RC[-5]="",,"|n"&R1C28&RC[-5])&IF(RC[-2]="",,"|n"&RC[-2]) -> 
AG1384: =IF(RC[-26]&RC[-25]&RC[-24]&RC[-23]&RC[-22]&RC[-21]="",,R1C6)&IF(RC[-26]="",,"|n"&R1C7&RC[-26])&IF(RC[-25]="",,"|n"&R1C8&RC[-25])&IF(RC[-24]="",,"|n"&R1C9&RC[-24])&IF(RC[-23]="",,"|n"&R1C10&RC[-23])&IF(RC[-22]="",,"|n"&R1C11&RC[-22])&IF(RC[-21]="",,"|n"&R1C12&RC[-21])&IF(RC[-19]&RC[-18]&RC[-17]&RC[-16]="",,"|n"&R1C13)&IF(RC[-19]="",,"|n"&R1C14&RC[-19])&IF(RC[-18]="",,"|n"&R1C15&RC[-18])&IF(RC[-17]="",,"|n"&R1C16&RC[-17])&IF(RC[-16]="",,"|n"&R1C17&RC[-16])&IF(RC[-15]="",,"|n"&R1C18&RC[-15])&IF(RC[-14]="",,"|n"&R1C19&RC[-14])&IF(RC[-13]="",,"|n"&R1C20&RC[-13])&IF(RC[-12]="",,"|n"&R1C21&RC[-12])&IF(RC[-10]="",,"|n"&R1C23&RC[-10])&IF(RC[-9]="",,"|n"&R1C24&RC[-9])&IF(RC[-8]="",,"|n"&R1C25&RC[-8])&IF(RC[-7]="",,"|n"&R1C26&RC[-7])&IF(RC[-6]="",,"|n"&R1C27&RC[-6])&IF(RC[-5]="",,"|n"&R1C28&RC[-5])&IF(RC[-2]="",,"|n"&RC[-2]) -> 
AG1385: =IF(RC[-26]&RC[-25]&RC[-24]&RC[-23]&RC[-22]&RC[-21]="",,R1C6)&IF(RC[-26]="",,"|n"&R1C7&RC[-26])&IF(RC[-25]="",,"|n"&R1C8&RC[-25])&IF(RC[-24]="",,"|n"&R1C9&RC[-24])&IF(RC[-23]="",,"|n"&R1C10&RC[-23])&IF(RC[-22]="",,"|n"&R1C11&RC[-22])&IF(RC[-21]="",,"|n"&R1C12&RC[-21])&IF(RC[-19]&RC[-18]&RC[-17]&RC[-16]="",,"|n"&R1C13)&IF(RC[-19]="",,"|n"&R1C14&RC[-19])&IF(RC[-18]="",,"|n"&R1C15&RC[-18])&IF(RC[-17]="",,"|n"&R1C16&RC[-17])&IF(RC[-16]="",,"|n"&R1C17&RC[-16])&IF(RC[-15]="",,"|n"&R1C18&RC[-15])&IF(RC[-14]="",,"|n"&R1C19&RC[-14])&IF(RC[-13]="",,"|n"&R1C20&RC[-13])&IF(RC[-12]="",,"|n"&R1C21&RC[-12])&IF(RC[-10]="",,"|n"&R1C23&RC[-10])&IF(RC[-9]="",,"|n"&R1C24&RC[-9])&IF(RC[-8]="",,"|n"&R1C25&RC[-8])&IF(RC[-7]="",,"|n"&R1C26&RC[-7])&IF(RC[-6]="",,"|n"&R1C27&RC[-6])&IF(RC[-5]="",,"|n"&R1C28&RC[-5])&IF(RC[-2]="",,"|n"&RC[-2]) -> 
AG1386: =IF(RC[-26]&RC[-25]&RC[-24]&RC[-23]&RC[-22]&RC[-21]="",,R1C6)&IF(RC[-26]="",,"|n"&R1C7&RC[-26])&IF(RC[-25]="",,"|n"&R1C8&RC[-25])&IF(RC[-24]="",,"|n"&R1C9&RC[-24])&IF(RC[-23]="",,"|n"&R1C10&RC[-23])&IF(RC[-22]="",,"|n"&R1C11&RC[-22])&IF(RC[-21]="",,"|n"&R1C12&RC[-21])&IF(RC[-19]&RC[-18]&RC[-17]&RC[-16]="",,"|n"&R1C13)&IF(RC[-19]="",,"|n"&R1C14&RC[-19])&IF(RC[-18]="",,"|n"&R1C15&RC[-18])&IF(RC[-17]="",,"|n"&R1C16&RC[-17])&IF(RC[-16]="",,"|n"&R1C17&RC[-16])&IF(RC[-15]="",,"|n"&R1C18&RC[-15])&IF(RC[-14]="",,"|n"&R1C19&RC[-14])&IF(RC[-13]="",,"|n"&R1C20&RC[-13])&IF(RC[-12]="",,"|n"&R1C21&RC[-12])&IF(RC[-10]="",,"|n"&R1C23&RC[-10])&IF(RC[-9]="",,"|n"&R1C24&RC[-9])&IF(RC[-8]="",,"|n"&R1C25&RC[-8])&IF(RC[-7]="",,"|n"&R1C26&RC[-7])&IF(RC[-6]="",,"|n"&R1C27&RC[-6])&IF(RC[-5]="",,"|n"&R1C28&RC[-5])&IF(RC[-2]="",,"|n"&RC[-2]) -> 
AG1387: =IF(RC[-26]&RC[-25]&RC[-24]&RC[-23]&RC[-22]&RC[-21]="",,R1C6)&IF(RC[-26]="",,"|n"&R1C7&RC[-26])&IF(RC[-25]="",,"|n"&R1C8&RC[-25])&IF(RC[-24]="",,"|n"&R1C9&RC[-24])&IF(RC[-23]="",,"|n"&R1C10&RC[-23])&IF(RC[-22]="",,"|n"&R1C11&RC[-22])&IF(RC[-21]="",,"|n"&R1C12&RC[-21])&IF(RC[-19]&RC[-18]&RC[-17]&RC[-16]="",,"|n"&R1C13)&IF(RC[-19]="",,"|n"&R1C14&RC[-19])&IF(RC[-18]="",,"|n"&R1C15&RC[-18])&IF(RC[-17]="",,"|n"&R1C16&RC[-17])&IF(RC[-16]="",,"|n"&R1C17&RC[-16])&IF(RC[-15]="",,"|n"&R1C18&RC[-15])&IF(RC[-14]="",,"|n"&R1C19&RC[-14])&IF(RC[-13]="",,"|n"&R1C20&RC[-13])&IF(RC[-12]="",,"|n"&R1C21&RC[-12])&IF(RC[-10]="",,"|n"&R1C23&RC[-10])&IF(RC[-9]="",,"|n"&R1C24&RC[-9])&IF(RC[-8]="",,"|n"&R1C25&RC[-8])&IF(RC[-7]="",,"|n"&R1C26&RC[-7])&IF(RC[-6]="",,"|n"&R1C27&RC[-6])&IF(RC[-5]="",,"|n"&R1C28&RC[-5])&IF(RC[-2]="",,"|n"&RC[-2]) -> 
AG1388: =IF(RC[-26]&RC[-25]&RC[-24]&RC[-23]&RC[-22]&RC[-21]="",,R1C6)&IF(RC[-26]="",,"|n"&R1C7&RC[-26])&IF(RC[-25]="",,"|n"&R1C8&RC[-25])&IF(RC[-24]="",,"|n"&R1C9&RC[-24])&IF(RC[-23]="",,"|n"&R1C10&RC[-23])&IF(RC[-22]="",,"|n"&R1C11&RC[-22])&IF(RC[-21]="",,"|n"&R1C12&RC[-21])&IF(RC[-19]&RC[-18]&RC[-17]&RC[-16]="",,"|n"&R1C13)&IF(RC[-19]="",,"|n"&R1C14&RC[-19])&IF(RC[-18]="",,"|n"&R1C15&RC[-18])&IF(RC[-17]="",,"|n"&R1C16&RC[-17])&IF(RC[-16]="",,"|n"&R1C17&RC[-16])&IF(RC[-15]="",,"|n"&R1C18&RC[-15])&IF(RC[-14]="",,"|n"&R1C19&RC[-14])&IF(RC[-13]="",,"|n"&R1C20&RC[-13])&IF(RC[-12]="",,"|n"&R1C21&RC[-12])&IF(RC[-10]="",,"|n"&R1C23&RC[-10])&IF(RC[-9]="",,"|n"&R1C24&RC[-9])&IF(RC[-8]="",,"|n"&R1C25&RC[-8])&IF(RC[-7]="",,"|n"&R1C26&RC[-7])&IF(RC[-6]="",,"|n"&R1C27&RC[-6])&IF(RC[-5]="",,"|n"&R1C28&RC[-5])&IF(RC[-2]="",,"|n"&RC[-2]) -> 
AG1389: =IF(RC[-26]&RC[-25]&RC[-24]&RC[-23]&RC[-22]&RC[-21]="",,R1C6)&IF(RC[-26]="",,"|n"&R1C7&RC[-26])&IF(RC[-25]="",,"|n"&R1C8&RC[-25])&IF(RC[-24]="",,"|n"&R1C9&RC[-24])&IF(RC[-23]="",,"|n"&R1C10&RC[-23])&IF(RC[-22]="",,"|n"&R1C11&RC[-22])&IF(RC[-21]="",,"|n"&R1C12&RC[-21])&IF(RC[-19]&RC[-18]&RC[-17]&RC[-16]="",,"|n"&R1C13)&IF(RC[-19]="",,"|n"&R1C14&RC[-19])&IF(RC[-18]="",,"|n"&R1C15&RC[-18])&IF(RC[-17]="",,"|n"&R1C16&RC[-17])&IF(RC[-16]="",,"|n"&R1C17&RC[-16])&IF(RC[-15]="",,"|n"&R1C18&RC[-15])&IF(RC[-14]="",,"|n"&R1C19&RC[-14])&IF(RC[-13]="",,"|n"&R1C20&RC[-13])&IF(RC[-12]="",,"|n"&R1C21&RC[-12])&IF(RC[-10]="",,"|n"&R1C23&RC[-10])&IF(RC[-9]="",,"|n"&R1C24&RC[-9])&IF(RC[-8]="",,"|n"&R1C25&RC[-8])&IF(RC[-7]="",,"|n"&R1C26&RC[-7])&IF(RC[-6]="",,"|n"&R1C27&RC[-6])&IF(RC[-5]="",,"|n"&R1C28&RC[-5])&IF(RC[-2]="",,"|n"&RC[-2]) -> 
AG1390: =IF(RC[-26]&RC[-25]&RC[-24]&RC[-23]&RC[-22]&RC[-21]="",,R1C6)&IF(RC[-26]="",,"|n"&R1C7&RC[-26])&IF(RC[-25]="",,"|n"&R1C8&RC[-25])&IF(RC[-24]="",,"|n"&R1C9&RC[-24])&IF(RC[-23]="",,"|n"&R1C10&RC[-23])&IF(RC[-22]="",,"|n"&R1C11&RC[-22])&IF(RC[-21]="",,"|n"&R1C12&RC[-21])&IF(RC[-19]&RC[-18]&RC[-17]&RC[-16]="",,"|n"&R1C13)&IF(RC[-19]="",,"|n"&R1C14&RC[-19])&IF(RC[-18]="",,"|n"&R1C15&RC[-18])&IF(RC[-17]="",,"|n"&R1C16&RC[-17])&IF(RC[-16]="",,"|n"&R1C17&RC[-16])&IF(RC[-15]="",,"|n"&R1C18&RC[-15])&IF(RC[-14]="",,"|n"&R1C19&RC[-14])&IF(RC[-13]="",,"|n"&R1C20&RC[-13])&IF(RC[-12]="",,"|n"&R1C21&RC[-12])&IF(RC[-10]="",,"|n"&R1C23&RC[-10])&IF(RC[-9]="",,"|n"&R1C24&RC[-9])&IF(RC[-8]="",,"|n"&R1C25&RC[-8])&IF(RC[-7]="",,"|n"&R1C26&RC[-7])&IF(RC[-6]="",,"|n"&R1C27&RC[-6])&IF(RC[-5]="",,"|n"&R1C28&RC[-5])&IF(RC[-2]="",,"|n"&RC[-2]) -> 
AG1391: =IF(RC[-26]&RC[-25]&RC[-24]&RC[-23]&RC[-22]&RC[-21]="",,R1C6)&IF(RC[-26]="",,"|n"&R1C7&RC[-26])&IF(RC[-25]="",,"|n"&R1C8&RC[-25])&IF(RC[-24]="",,"|n"&R1C9&RC[-24])&IF(RC[-23]="",,"|n"&R1C10&RC[-23])&IF(RC[-22]="",,"|n"&R1C11&RC[-22])&IF(RC[-21]="",,"|n"&R1C12&RC[-21])&IF(RC[-19]&RC[-18]&RC[-17]&RC[-16]="",,"|n"&R1C13)&IF(RC[-19]="",,"|n"&R1C14&RC[-19])&IF(RC[-18]="",,"|n"&R1C15&RC[-18])&IF(RC[-17]="",,"|n"&R1C16&RC[-17])&IF(RC[-16]="",,"|n"&R1C17&RC[-16])&IF(RC[-15]="",,"|n"&R1C18&RC[-15])&IF(RC[-14]="",,"|n"&R1C19&RC[-14])&IF(RC[-13]="",,"|n"&R1C20&RC[-13])&IF(RC[-12]="",,"|n"&R1C21&RC[-12])&IF(RC[-10]="",,"|n"&R1C23&RC[-10])&IF(RC[-9]="",,"|n"&R1C24&RC[-9])&IF(RC[-8]="",,"|n"&R1C25&RC[-8])&IF(RC[-7]="",,"|n"&R1C26&RC[-7])&IF(RC[-6]="",,"|n"&R1C27&RC[-6])&IF(RC[-5]="",,"|n"&R1C28&RC[-5])&IF(RC[-2]="",,"|n"&RC[-2]) -> 
AG1392: =IF(RC[-26]&RC[-25]&RC[-24]&RC[-23]&RC[-22]&RC[-21]="",,R1C6)&IF(RC[-26]="",,"|n"&R1C7&RC[-26])&IF(RC[-25]="",,"|n"&R1C8&RC[-25])&IF(RC[-24]="",,"|n"&R1C9&RC[-24])&IF(RC[-23]="",,"|n"&R1C10&RC[-23])&IF(RC[-22]="",,"|n"&R1C11&RC[-22])&IF(RC[-21]="",,"|n"&R1C12&RC[-21])&IF(RC[-19]&RC[-18]&RC[-17]&RC[-16]="",,"|n"&R1C13)&IF(RC[-19]="",,"|n"&R1C14&RC[-19])&IF(RC[-18]="",,"|n"&R1C15&RC[-18])&IF(RC[-17]="",,"|n"&R1C16&RC[-17])&IF(RC[-16]="",,"|n"&R1C17&RC[-16])&IF(RC[-15]="",,"|n"&R1C18&RC[-15])&IF(RC[-14]="",,"|n"&R1C19&RC[-14])&IF(RC[-13]="",,"|n"&R1C20&RC[-13])&IF(RC[-12]="",,"|n"&R1C21&RC[-12])&IF(RC[-10]="",,"|n"&R1C23&RC[-10])&IF(RC[-9]="",,"|n"&R1C24&RC[-9])&IF(RC[-8]="",,"|n"&R1C25&RC[-8])&IF(RC[-7]="",,"|n"&R1C26&RC[-7])&IF(RC[-6]="",,"|n"&R1C27&RC[-6])&IF(RC[-5]="",,"|n"&R1C28&RC[-5])&IF(RC[-2]="",,"|n"&RC[-2]) -> 
AG1393: =IF(RC[-26]&RC[-25]&RC[-24]&RC[-23]&RC[-22]&RC[-21]="",,R1C6)&IF(RC[-26]="",,"|n"&R1C7&RC[-26])&IF(RC[-25]="",,"|n"&R1C8&RC[-25])&IF(RC[-24]="",,"|n"&R1C9&RC[-24])&IF(RC[-23]="",,"|n"&R1C10&RC[-23])&IF(RC[-22]="",,"|n"&R1C11&RC[-22])&IF(RC[-21]="",,"|n"&R1C12&RC[-21])&IF(RC[-19]&RC[-18]&RC[-17]&RC[-16]="",,"|n"&R1C13)&IF(RC[-19]="",,"|n"&R1C14&RC[-19])&IF(RC[-18]="",,"|n"&R1C15&RC[-18])&IF(RC[-17]="",,"|n"&R1C16&RC[-17])&IF(RC[-16]="",,"|n"&R1C17&RC[-16])&IF(RC[-15]="",,"|n"&R1C18&RC[-15])&IF(RC[-14]="",,"|n"&R1C19&RC[-14])&IF(RC[-13]="",,"|n"&R1C20&RC[-13])&IF(RC[-12]="",,"|n"&R1C21&RC[-12])&IF(RC[-10]="",,"|n"&R1C23&RC[-10])&IF(RC[-9]="",,"|n"&R1C24&RC[-9])&IF(RC[-8]="",,"|n"&R1C25&RC[-8])&IF(RC[-7]="",,"|n"&R1C26&RC[-7])&IF(RC[-6]="",,"|n"&R1C27&RC[-6])&IF(RC[-5]="",,"|n"&R1C28&RC[-5])&IF(RC[-2]="",,"|n"&RC[-2]) -> 
AG1394: =IF(RC[-26]&RC[-25]&RC[-24]&RC[-23]&RC[-22]&RC[-21]="",,R1C6)&IF(RC[-26]="",,"|n"&R1C7&RC[-26])&IF(RC[-25]="",,"|n"&R1C8&RC[-25])&IF(RC[-24]="",,"|n"&R1C9&RC[-24])&IF(RC[-23]="",,"|n"&R1C10&RC[-23])&IF(RC[-22]="",,"|n"&R1C11&RC[-22])&IF(RC[-21]="",,"|n"&R1C12&RC[-21])&IF(RC[-19]&RC[-18]&RC[-17]&RC[-16]="",,"|n"&R1C13)&IF(RC[-19]="",,"|n"&R1C14&RC[-19])&IF(RC[-18]="",,"|n"&R1C15&RC[-18])&IF(RC[-17]="",,"|n"&R1C16&RC[-17])&IF(RC[-16]="",,"|n"&R1C17&RC[-16])&IF(RC[-15]="",,"|n"&R1C18&RC[-15])&IF(RC[-14]="",,"|n"&R1C19&RC[-14])&IF(RC[-13]="",,"|n"&R1C20&RC[-13])&IF(RC[-12]="",,"|n"&R1C21&RC[-12])&IF(RC[-10]="",,"|n"&R1C23&RC[-10])&IF(RC[-9]="",,"|n"&R1C24&RC[-9])&IF(RC[-8]="",,"|n"&R1C25&RC[-8])&IF(RC[-7]="",,"|n"&R1C26&RC[-7])&IF(RC[-6]="",,"|n"&R1C27&RC[-6])&IF(RC[-5]="",,"|n"&R1C28&RC[-5])&IF(RC[-2]="",,"|n"&RC[-2]) -> 
AG1395: =IF(RC[-26]&RC[-25]&RC[-24]&RC[-23]&RC[-22]&RC[-21]="",,R1C6)&IF(RC[-26]="",,"|n"&R1C7&RC[-26])&IF(RC[-25]="",,"|n"&R1C8&RC[-25])&IF(RC[-24]="",,"|n"&R1C9&RC[-24])&IF(RC[-23]="",,"|n"&R1C10&RC[-23])&IF(RC[-22]="",,"|n"&R1C11&RC[-22])&IF(RC[-21]="",,"|n"&R1C12&RC[-21])&IF(RC[-19]&RC[-18]&RC[-17]&RC[-16]="",,"|n"&R1C13)&IF(RC[-19]="",,"|n"&R1C14&RC[-19])&IF(RC[-18]="",,"|n"&R1C15&RC[-18])&IF(RC[-17]="",,"|n"&R1C16&RC[-17])&IF(RC[-16]="",,"|n"&R1C17&RC[-16])&IF(RC[-15]="",,"|n"&R1C18&RC[-15])&IF(RC[-14]="",,"|n"&R1C19&RC[-14])&IF(RC[-13]="",,"|n"&R1C20&RC[-13])&IF(RC[-12]="",,"|n"&R1C21&RC[-12])&IF(RC[-10]="",,"|n"&R1C23&RC[-10])&IF(RC[-9]="",,"|n"&R1C24&RC[-9])&IF(RC[-8]="",,"|n"&R1C25&RC[-8])&IF(RC[-7]="",,"|n"&R1C26&RC[-7])&IF(RC[-6]="",,"|n"&R1C27&RC[-6])&IF(RC[-5]="",,"|n"&R1C28&RC[-5])&IF(RC[-2]="",,"|n"&RC[-2]) -> 
AG1396: =IF(RC[-26]&RC[-25]&RC[-24]&RC[-23]&RC[-22]&RC[-21]="",,R1C6)&IF(RC[-26]="",,"|n"&R1C7&RC[-26])&IF(RC[-25]="",,"|n"&R1C8&RC[-25])&IF(RC[-24]="",,"|n"&R1C9&RC[-24])&IF(RC[-23]="",,"|n"&R1C10&RC[-23])&IF(RC[-22]="",,"|n"&R1C11&RC[-22])&IF(RC[-21]="",,"|n"&R1C12&RC[-21])&IF(RC[-19]&RC[-18]&RC[-17]&RC[-16]="",,"|n"&R1C13)&IF(RC[-19]="",,"|n"&R1C14&RC[-19])&IF(RC[-18]="",,"|n"&R1C15&RC[-18])&IF(RC[-17]="",,"|n"&R1C16&RC[-17])&IF(RC[-16]="",,"|n"&R1C17&RC[-16])&IF(RC[-15]="",,"|n"&R1C18&RC[-15])&IF(RC[-14]="",,"|n"&R1C19&RC[-14])&IF(RC[-13]="",,"|n"&R1C20&RC[-13])&IF(RC[-12]="",,"|n"&R1C21&RC[-12])&IF(RC[-10]="",,"|n"&R1C23&RC[-10])&IF(RC[-9]="",,"|n"&R1C24&RC[-9])&IF(RC[-8]="",,"|n"&R1C25&RC[-8])&IF(RC[-7]="",,"|n"&R1C26&RC[-7])&IF(RC[-6]="",,"|n"&R1C27&RC[-6])&IF(RC[-5]="",,"|n"&R1C28&RC[-5])&IF(RC[-2]="",,"|n"&RC[-2]) -> 
AG1397: =IF(RC[-26]&RC[-25]&RC[-24]&RC[-23]&RC[-22]&RC[-21]="",,R1C6)&IF(RC[-26]="",,"|n"&R1C7&RC[-26])&IF(RC[-25]="",,"|n"&R1C8&RC[-25])&IF(RC[-24]="",,"|n"&R1C9&RC[-24])&IF(RC[-23]="",,"|n"&R1C10&RC[-23])&IF(RC[-22]="",,"|n"&R1C11&RC[-22])&IF(RC[-21]="",,"|n"&R1C12&RC[-21])&IF(RC[-19]&RC[-18]&RC[-17]&RC[-16]="",,"|n"&R1C13)&IF(RC[-19]="",,"|n"&R1C14&RC[-19])&IF(RC[-18]="",,"|n"&R1C15&RC[-18])&IF(RC[-17]="",,"|n"&R1C16&RC[-17])&IF(RC[-16]="",,"|n"&R1C17&RC[-16])&IF(RC[-15]="",,"|n"&R1C18&RC[-15])&IF(RC[-14]="",,"|n"&R1C19&RC[-14])&IF(RC[-13]="",,"|n"&R1C20&RC[-13])&IF(RC[-12]="",,"|n"&R1C21&RC[-12])&IF(RC[-10]="",,"|n"&R1C23&RC[-10])&IF(RC[-9]="",,"|n"&R1C24&RC[-9])&IF(RC[-8]="",,"|n"&R1C25&RC[-8])&IF(RC[-7]="",,"|n"&R1C26&RC[-7])&IF(RC[-6]="",,"|n"&R1C27&RC[-6])&IF(RC[-5]="",,"|n"&R1C28&RC[-5])&IF(RC[-2]="",,"|n"&RC[-2]) -> 
AG1398: =IF(RC[-26]&RC[-25]&RC[-24]&RC[-23]&RC[-22]&RC[-21]="",,R1C6)&IF(RC[-26]="",,"|n"&R1C7&RC[-26])&IF(RC[-25]="",,"|n"&R1C8&RC[-25])&IF(RC[-24]="",,"|n"&R1C9&RC[-24])&IF(RC[-23]="",,"|n"&R1C10&RC[-23])&IF(RC[-22]="",,"|n"&R1C11&RC[-22])&IF(RC[-21]="",,"|n"&R1C12&RC[-21])&IF(RC[-19]&RC[-18]&RC[-17]&RC[-16]="",,"|n"&R1C13)&IF(RC[-19]="",,"|n"&R1C14&RC[-19])&IF(RC[-18]="",,"|n"&R1C15&RC[-18])&IF(RC[-17]="",,"|n"&R1C16&RC[-17])&IF(RC[-16]="",,"|n"&R1C17&RC[-16])&IF(RC[-15]="",,"|n"&R1C18&RC[-15])&IF(RC[-14]="",,"|n"&R1C19&RC[-14])&IF(RC[-13]="",,"|n"&R1C20&RC[-13])&IF(RC[-12]="",,"|n"&R1C21&RC[-12])&IF(RC[-10]="",,"|n"&R1C23&RC[-10])&IF(RC[-9]="",,"|n"&R1C24&RC[-9])&IF(RC[-8]="",,"|n"&R1C25&RC[-8])&IF(RC[-7]="",,"|n"&R1C26&RC[-7])&IF(RC[-6]="",,"|n"&R1C27&RC[-6])&IF(RC[-5]="",,"|n"&R1C28&RC[-5])&IF(RC[-2]="",,"|n"&RC[-2]) -> 
AG1399: =IF(RC[-26]&RC[-25]&RC[-24]&RC[-23]&RC[-22]&RC[-21]="",,R1C6)&IF(RC[-26]="",,"|n"&R1C7&RC[-26])&IF(RC[-25]="",,"|n"&R1C8&RC[-25])&IF(RC[-24]="",,"|n"&R1C9&RC[-24])&IF(RC[-23]="",,"|n"&R1C10&RC[-23])&IF(RC[-22]="",,"|n"&R1C11&RC[-22])&IF(RC[-21]="",,"|n"&R1C12&RC[-21])&IF(RC[-19]&RC[-18]&RC[-17]&RC[-16]="",,"|n"&R1C13)&IF(RC[-19]="",,"|n"&R1C14&RC[-19])&IF(RC[-18]="",,"|n"&R1C15&RC[-18])&IF(RC[-17]="",,"|n"&R1C16&RC[-17])&IF(RC[-16]="",,"|n"&R1C17&RC[-16])&IF(RC[-15]="",,"|n"&R1C18&RC[-15])&IF(RC[-14]="",,"|n"&R1C19&RC[-14])&IF(RC[-13]="",,"|n"&R1C20&RC[-13])&IF(RC[-12]="",,"|n"&R1C21&RC[-12])&IF(RC[-10]="",,"|n"&R1C23&RC[-10])&IF(RC[-9]="",,"|n"&R1C24&RC[-9])&IF(RC[-8]="",,"|n"&R1C25&RC[-8])&IF(RC[-7]="",,"|n"&R1C26&RC[-7])&IF(RC[-6]="",,"|n"&R1C27&RC[-6])&IF(RC[-5]="",,"|n"&R1C28&RC[-5])&IF(RC[-2]="",,"|n"&RC[-2]) -> 
AG1400: =IF(RC[-26]&RC[-25]&RC[-24]&RC[-23]&RC[-22]&RC[-21]="",,R1C6)&IF(RC[-26]="",,"|n"&R1C7&RC[-26])&IF(RC[-25]="",,"|n"&R1C8&RC[-25])&IF(RC[-24]="",,"|n"&R1C9&RC[-24])&IF(RC[-23]="",,"|n"&R1C10&RC[-23])&IF(RC[-22]="",,"|n"&R1C11&RC[-22])&IF(RC[-21]="",,"|n"&R1C12&RC[-21])&IF(RC[-19]&RC[-18]&RC[-17]&RC[-16]="",,"|n"&R1C13)&IF(RC[-19]="",,"|n"&R1C14&RC[-19])&IF(RC[-18]="",,"|n"&R1C15&RC[-18])&IF(RC[-17]="",,"|n"&R1C16&RC[-17])&IF(RC[-16]="",,"|n"&R1C17&RC[-16])&IF(RC[-15]="",,"|n"&R1C18&RC[-15])&IF(RC[-14]="",,"|n"&R1C19&RC[-14])&IF(RC[-13]="",,"|n"&R1C20&RC[-13])&IF(RC[-12]="",,"|n"&R1C21&RC[-12])&IF(RC[-10]="",,"|n"&R1C23&RC[-10])&IF(RC[-9]="",,"|n"&R1C24&RC[-9])&IF(RC[-8]="",,"|n"&R1C25&RC[-8])&IF(RC[-7]="",,"|n"&R1C26&RC[-7])&IF(RC[-6]="",,"|n"&R1C27&RC[-6])&IF(RC[-5]="",,"|n"&R1C28&RC[-5])&IF(RC[-2]="",,"|n"&RC[-2]) -> 
AG1401: =IF(RC[-26]&RC[-25]&RC[-24]&RC[-23]&RC[-22]&RC[-21]="",,R1C6)&IF(RC[-26]="",,"|n"&R1C7&RC[-26])&IF(RC[-25]="",,"|n"&R1C8&RC[-25])&IF(RC[-24]="",,"|n"&R1C9&RC[-24])&IF(RC[-23]="",,"|n"&R1C10&RC[-23])&IF(RC[-22]="",,"|n"&R1C11&RC[-22])&IF(RC[-21]="",,"|n"&R1C12&RC[-21])&IF(RC[-19]&RC[-18]&RC[-17]&RC[-16]="",,"|n"&R1C13)&IF(RC[-19]="",,"|n"&R1C14&RC[-19])&IF(RC[-18]="",,"|n"&R1C15&RC[-18])&IF(RC[-17]="",,"|n"&R1C16&RC[-17])&IF(RC[-16]="",,"|n"&R1C17&RC[-16])&IF(RC[-15]="",,"|n"&R1C18&RC[-15])&IF(RC[-14]="",,"|n"&R1C19&RC[-14])&IF(RC[-13]="",,"|n"&R1C20&RC[-13])&IF(RC[-12]="",,"|n"&R1C21&RC[-12])&IF(RC[-10]="",,"|n"&R1C23&RC[-10])&IF(RC[-9]="",,"|n"&R1C24&RC[-9])&IF(RC[-8]="",,"|n"&R1C25&RC[-8])&IF(RC[-7]="",,"|n"&R1C26&RC[-7])&IF(RC[-6]="",,"|n"&R1C27&RC[-6])&IF(RC[-5]="",,"|n"&R1C28&RC[-5])&IF(RC[-2]="",,"|n"&RC[-2]) -> 
AG1402: =IF(RC[-26]&RC[-25]&RC[-24]&RC[-23]&RC[-22]&RC[-21]="",,R1C6)&IF(RC[-26]="",,"|n"&R1C7&RC[-26])&IF(RC[-25]="",,"|n"&R1C8&RC[-25])&IF(RC[-24]="",,"|n"&R1C9&RC[-24])&IF(RC[-23]="",,"|n"&R1C10&RC[-23])&IF(RC[-22]="",,"|n"&R1C11&RC[-22])&IF(RC[-21]="",,"|n"&R1C12&RC[-21])&IF(RC[-19]&RC[-18]&RC[-17]&RC[-16]="",,"|n"&R1C13)&IF(RC[-19]="",,"|n"&R1C14&RC[-19])&IF(RC[-18]="",,"|n"&R1C15&RC[-18])&IF(RC[-17]="",,"|n"&R1C16&RC[-17])&IF(RC[-16]="",,"|n"&R1C17&RC[-16])&IF(RC[-15]="",,"|n"&R1C18&RC[-15])&IF(RC[-14]="",,"|n"&R1C19&RC[-14])&IF(RC[-13]="",,"|n"&R1C20&RC[-13])&IF(RC[-12]="",,"|n"&R1C21&RC[-12])&IF(RC[-10]="",,"|n"&R1C23&RC[-10])&IF(RC[-9]="",,"|n"&R1C24&RC[-9])&IF(RC[-8]="",,"|n"&R1C25&RC[-8])&IF(RC[-7]="",,"|n"&R1C26&RC[-7])&IF(RC[-6]="",,"|n"&R1C27&RC[-6])&IF(RC[-5]="",,"|n"&R1C28&RC[-5])&IF(RC[-2]="",,"|n"&RC[-2]) -> 
AG1403: =IF(RC[-26]&RC[-25]&RC[-24]&RC[-23]&RC[-22]&RC[-21]="",,R1C6)&IF(RC[-26]="",,"|n"&R1C7&RC[-26])&IF(RC[-25]="",,"|n"&R1C8&RC[-25])&IF(RC[-24]="",,"|n"&R1C9&RC[-24])&IF(RC[-23]="",,"|n"&R1C10&RC[-23])&IF(RC[-22]="",,"|n"&R1C11&RC[-22])&IF(RC[-21]="",,"|n"&R1C12&RC[-21])&IF(RC[-19]&RC[-18]&RC[-17]&RC[-16]="",,"|n"&R1C13)&IF(RC[-19]="",,"|n"&R1C14&RC[-19])&IF(RC[-18]="",,"|n"&R1C15&RC[-18])&IF(RC[-17]="",,"|n"&R1C16&RC[-17])&IF(RC[-16]="",,"|n"&R1C17&RC[-16])&IF(RC[-15]="",,"|n"&R1C18&RC[-15])&IF(RC[-14]="",,"|n"&R1C19&RC[-14])&IF(RC[-13]="",,"|n"&R1C20&RC[-13])&IF(RC[-12]="",,"|n"&R1C21&RC[-12])&IF(RC[-10]="",,"|n"&R1C23&RC[-10])&IF(RC[-9]="",,"|n"&R1C24&RC[-9])&IF(RC[-8]="",,"|n"&R1C25&RC[-8])&IF(RC[-7]="",,"|n"&R1C26&RC[-7])&IF(RC[-6]="",,"|n"&R1C27&RC[-6])&IF(RC[-5]="",,"|n"&R1C28&RC[-5])&IF(RC[-2]="",,"|n"&RC[-2]) -> 
AG1404: =IF(RC[-26]&RC[-25]&RC[-24]&RC[-23]&RC[-22]&RC[-21]="",,R1C6)&IF(RC[-26]="",,"|n"&R1C7&RC[-26])&IF(RC[-25]="",,"|n"&R1C8&RC[-25])&IF(RC[-24]="",,"|n"&R1C9&RC[-24])&IF(RC[-23]="",,"|n"&R1C10&RC[-23])&IF(RC[-22]="",,"|n"&R1C11&RC[-22])&IF(RC[-21]="",,"|n"&R1C12&RC[-21])&IF(RC[-19]&RC[-18]&RC[-17]&RC[-16]="",,"|n"&R1C13)&IF(RC[-19]="",,"|n"&R1C14&RC[-19])&IF(RC[-18]="",,"|n"&R1C15&RC[-18])&IF(RC[-17]="",,"|n"&R1C16&RC[-17])&IF(RC[-16]="",,"|n"&R1C17&RC[-16])&IF(RC[-15]="",,"|n"&R1C18&RC[-15])&IF(RC[-14]="",,"|n"&R1C19&RC[-14])&IF(RC[-13]="",,"|n"&R1C20&RC[-13])&IF(RC[-12]="",,"|n"&R1C21&RC[-12])&IF(RC[-10]="",,"|n"&R1C23&RC[-10])&IF(RC[-9]="",,"|n"&R1C24&RC[-9])&IF(RC[-8]="",,"|n"&R1C25&RC[-8])&IF(RC[-7]="",,"|n"&R1C26&RC[-7])&IF(RC[-6]="",,"|n"&R1C27&RC[-6])&IF(RC[-5]="",,"|n"&R1C28&RC[-5])&IF(RC[-2]="",,"|n"&RC[-2]) -> 
AG1405: =IF(RC[-26]&RC[-25]&RC[-24]&RC[-23]&RC[-22]&RC[-21]="",,R1C6)&IF(RC[-26]="",,"|n"&R1C7&RC[-26])&IF(RC[-25]="",,"|n"&R1C8&RC[-25])&IF(RC[-24]="",,"|n"&R1C9&RC[-24])&IF(RC[-23]="",,"|n"&R1C10&RC[-23])&IF(RC[-22]="",,"|n"&R1C11&RC[-22])&IF(RC[-21]="",,"|n"&R1C12&RC[-21])&IF(RC[-19]&RC[-18]&RC[-17]&RC[-16]="",,"|n"&R1C13)&IF(RC[-19]="",,"|n"&R1C14&RC[-19])&IF(RC[-18]="",,"|n"&R1C15&RC[-18])&IF(RC[-17]="",,"|n"&R1C16&RC[-17])&IF(RC[-16]="",,"|n"&R1C17&RC[-16])&IF(RC[-15]="",,"|n"&R1C18&RC[-15])&IF(RC[-14]="",,"|n"&R1C19&RC[-14])&IF(RC[-13]="",,"|n"&R1C20&RC[-13])&IF(RC[-12]="",,"|n"&R1C21&RC[-12])&IF(RC[-10]="",,"|n"&R1C23&RC[-10])&IF(RC[-9]="",,"|n"&R1C24&RC[-9])&IF(RC[-8]="",,"|n"&R1C25&RC[-8])&IF(RC[-7]="",,"|n"&R1C26&RC[-7])&IF(RC[-6]="",,"|n"&R1C27&RC[-6])&IF(RC[-5]="",,"|n"&R1C28&RC[-5])&IF(RC[-2]="",,"|n"&RC[-2]) -> 
AG1406: =IF(RC[-26]&RC[-25]&RC[-24]&RC[-23]&RC[-22]&RC[-21]="",,R1C6)&IF(RC[-26]="",,"|n"&R1C7&RC[-26])&IF(RC[-25]="",,"|n"&R1C8&RC[-25])&IF(RC[-24]="",,"|n"&R1C9&RC[-24])&IF(RC[-23]="",,"|n"&R1C10&RC[-23])&IF(RC[-22]="",,"|n"&R1C11&RC[-22])&IF(RC[-21]="",,"|n"&R1C12&RC[-21])&IF(RC[-19]&RC[-18]&RC[-17]&RC[-16]="",,"|n"&R1C13)&IF(RC[-19]="",,"|n"&R1C14&RC[-19])&IF(RC[-18]="",,"|n"&R1C15&RC[-18])&IF(RC[-17]="",,"|n"&R1C16&RC[-17])&IF(RC[-16]="",,"|n"&R1C17&RC[-16])&IF(RC[-15]="",,"|n"&R1C18&RC[-15])&IF(RC[-14]="",,"|n"&R1C19&RC[-14])&IF(RC[-13]="",,"|n"&R1C20&RC[-13])&IF(RC[-12]="",,"|n"&R1C21&RC[-12])&IF(RC[-10]="",,"|n"&R1C23&RC[-10])&IF(RC[-9]="",,"|n"&R1C24&RC[-9])&IF(RC[-8]="",,"|n"&R1C25&RC[-8])&IF(RC[-7]="",,"|n"&R1C26&RC[-7])&IF(RC[-6]="",,"|n"&R1C27&RC[-6])&IF(RC[-5]="",,"|n"&R1C28&RC[-5])&IF(RC[-2]="",,"|n"&RC[-2]) -> 
AG1407: =IF(RC[-26]&RC[-25]&RC[-24]&RC[-23]&RC[-22]&RC[-21]="",,R1C6)&IF(RC[-26]="",,"|n"&R1C7&RC[-26])&IF(RC[-25]="",,"|n"&R1C8&RC[-25])&IF(RC[-24]="",,"|n"&R1C9&RC[-24])&IF(RC[-23]="",,"|n"&R1C10&RC[-23])&IF(RC[-22]="",,"|n"&R1C11&RC[-22])&IF(RC[-21]="",,"|n"&R1C12&RC[-21])&IF(RC[-19]&RC[-18]&RC[-17]&RC[-16]="",,"|n"&R1C13)&IF(RC[-19]="",,"|n"&R1C14&RC[-19])&IF(RC[-18]="",,"|n"&R1C15&RC[-18])&IF(RC[-17]="",,"|n"&R1C16&RC[-17])&IF(RC[-16]="",,"|n"&R1C17&RC[-16])&IF(RC[-15]="",,"|n"&R1C18&RC[-15])&IF(RC[-14]="",,"|n"&R1C19&RC[-14])&IF(RC[-13]="",,"|n"&R1C20&RC[-13])&IF(RC[-12]="",,"|n"&R1C21&RC[-12])&IF(RC[-10]="",,"|n"&R1C23&RC[-10])&IF(RC[-9]="",,"|n"&R1C24&RC[-9])&IF(RC[-8]="",,"|n"&R1C25&RC[-8])&IF(RC[-7]="",,"|n"&R1C26&RC[-7])&IF(RC[-6]="",,"|n"&R1C27&RC[-6])&IF(RC[-5]="",,"|n"&R1C28&RC[-5])&IF(RC[-2]="",,"|n"&RC[-2]) -> 
AG1408: =IF(RC[-26]&RC[-25]&RC[-24]&RC[-23]&RC[-22]&RC[-21]="",,R1C6)&IF(RC[-26]="",,"|n"&R1C7&RC[-26])&IF(RC[-25]="",,"|n"&R1C8&RC[-25])&IF(RC[-24]="",,"|n"&R1C9&RC[-24])&IF(RC[-23]="",,"|n"&R1C10&RC[-23])&IF(RC[-22]="",,"|n"&R1C11&RC[-22])&IF(RC[-21]="",,"|n"&R1C12&RC[-21])&IF(RC[-19]&RC[-18]&RC[-17]&RC[-16]="",,"|n"&R1C13)&IF(RC[-19]="",,"|n"&R1C14&RC[-19])&IF(RC[-18]="",,"|n"&R1C15&RC[-18])&IF(RC[-17]="",,"|n"&R1C16&RC[-17])&IF(RC[-16]="",,"|n"&R1C17&RC[-16])&IF(RC[-15]="",,"|n"&R1C18&RC[-15])&IF(RC[-14]="",,"|n"&R1C19&RC[-14])&IF(RC[-13]="",,"|n"&R1C20&RC[-13])&IF(RC[-12]="",,"|n"&R1C21&RC[-12])&IF(RC[-10]="",,"|n"&R1C23&RC[-10])&IF(RC[-9]="",,"|n"&R1C24&RC[-9])&IF(RC[-8]="",,"|n"&R1C25&RC[-8])&IF(RC[-7]="",,"|n"&R1C26&RC[-7])&IF(RC[-6]="",,"|n"&R1C27&RC[-6])&IF(RC[-5]="",,"|n"&R1C28&RC[-5])&IF(RC[-2]="",,"|n"&RC[-2]) -> 
AG1409: =IF(RC[-26]&RC[-25]&RC[-24]&RC[-23]&RC[-22]&RC[-21]="",,R1C6)&IF(RC[-26]="",,"|n"&R1C7&RC[-26])&IF(RC[-25]="",,"|n"&R1C8&RC[-25])&IF(RC[-24]="",,"|n"&R1C9&RC[-24])&IF(RC[-23]="",,"|n"&R1C10&RC[-23])&IF(RC[-22]="",,"|n"&R1C11&RC[-22])&IF(RC[-21]="",,"|n"&R1C12&RC[-21])&IF(RC[-19]&RC[-18]&RC[-17]&RC[-16]="",,"|n"&R1C13)&IF(RC[-19]="",,"|n"&R1C14&RC[-19])&IF(RC[-18]="",,"|n"&R1C15&RC[-18])&IF(RC[-17]="",,"|n"&R1C16&RC[-17])&IF(RC[-16]="",,"|n"&R1C17&RC[-16])&IF(RC[-15]="",,"|n"&R1C18&RC[-15])&IF(RC[-14]="",,"|n"&R1C19&RC[-14])&IF(RC[-13]="",,"|n"&R1C20&RC[-13])&IF(RC[-12]="",,"|n"&R1C21&RC[-12])&IF(RC[-10]="",,"|n"&R1C23&RC[-10])&IF(RC[-9]="",,"|n"&R1C24&RC[-9])&IF(RC[-8]="",,"|n"&R1C25&RC[-8])&IF(RC[-7]="",,"|n"&R1C26&RC[-7])&IF(RC[-6]="",,"|n"&R1C27&RC[-6])&IF(RC[-5]="",,"|n"&R1C28&RC[-5])&IF(RC[-2]="",,"|n"&RC[-2]) -> 
AG1410: =IF(RC[-26]&RC[-25]&RC[-24]&RC[-23]&RC[-22]&RC[-21]="",,R1C6)&IF(RC[-26]="",,"|n"&R1C7&RC[-26])&IF(RC[-25]="",,"|n"&R1C8&RC[-25])&IF(RC[-24]="",,"|n"&R1C9&RC[-24])&IF(RC[-23]="",,"|n"&R1C10&RC[-23])&IF(RC[-22]="",,"|n"&R1C11&RC[-22])&IF(RC[-21]="",,"|n"&R1C12&RC[-21])&IF(RC[-19]&RC[-18]&RC[-17]&RC[-16]="",,"|n"&R1C13)&IF(RC[-19]="",,"|n"&R1C14&RC[-19])&IF(RC[-18]="",,"|n"&R1C15&RC[-18])&IF(RC[-17]="",,"|n"&R1C16&RC[-17])&IF(RC[-16]="",,"|n"&R1C17&RC[-16])&IF(RC[-15]="",,"|n"&R1C18&RC[-15])&IF(RC[-14]="",,"|n"&R1C19&RC[-14])&IF(RC[-13]="",,"|n"&R1C20&RC[-13])&IF(RC[-12]="",,"|n"&R1C21&RC[-12])&IF(RC[-10]="",,"|n"&R1C23&RC[-10])&IF(RC[-9]="",,"|n"&R1C24&RC[-9])&IF(RC[-8]="",,"|n"&R1C25&RC[-8])&IF(RC[-7]="",,"|n"&R1C26&RC[-7])&IF(RC[-6]="",,"|n"&R1C27&RC[-6])&IF(RC[-5]="",,"|n"&R1C28&RC[-5])&IF(RC[-2]="",,"|n"&RC[-2]) -> 
AG1411: =IF(RC[-26]&RC[-25]&RC[-24]&RC[-23]&RC[-22]&RC[-21]="",,R1C6)&IF(RC[-26]="",,"|n"&R1C7&RC[-26])&IF(RC[-25]="",,"|n"&R1C8&RC[-25])&IF(RC[-24]="",,"|n"&R1C9&RC[-24])&IF(RC[-23]="",,"|n"&R1C10&RC[-23])&IF(RC[-22]="",,"|n"&R1C11&RC[-22])&IF(RC[-21]="",,"|n"&R1C12&RC[-21])&IF(RC[-19]&RC[-18]&RC[-17]&RC[-16]="",,"|n"&R1C13)&IF(RC[-19]="",,"|n"&R1C14&RC[-19])&IF(RC[-18]="",,"|n"&R1C15&RC[-18])&IF(RC[-17]="",,"|n"&R1C16&RC[-17])&IF(RC[-16]="",,"|n"&R1C17&RC[-16])&IF(RC[-15]="",,"|n"&R1C18&RC[-15])&IF(RC[-14]="",,"|n"&R1C19&RC[-14])&IF(RC[-13]="",,"|n"&R1C20&RC[-13])&IF(RC[-12]="",,"|n"&R1C21&RC[-12])&IF(RC[-10]="",,"|n"&R1C23&RC[-10])&IF(RC[-9]="",,"|n"&R1C24&RC[-9])&IF(RC[-8]="",,"|n"&R1C25&RC[-8])&IF(RC[-7]="",,"|n"&R1C26&RC[-7])&IF(RC[-6]="",,"|n"&R1C27&RC[-6])&IF(RC[-5]="",,"|n"&R1C28&RC[-5])&IF(RC[-2]="",,"|n"&RC[-2]) -> 
AG1412: =IF(RC[-26]&RC[-25]&RC[-24]&RC[-23]&RC[-22]&RC[-21]="",,R1C6)&IF(RC[-26]="",,"|n"&R1C7&RC[-26])&IF(RC[-25]="",,"|n"&R1C8&RC[-25])&IF(RC[-24]="",,"|n"&R1C9&RC[-24])&IF(RC[-23]="",,"|n"&R1C10&RC[-23])&IF(RC[-22]="",,"|n"&R1C11&RC[-22])&IF(RC[-21]="",,"|n"&R1C12&RC[-21])&IF(RC[-19]&RC[-18]&RC[-17]&RC[-16]="",,"|n"&R1C13)&IF(RC[-19]="",,"|n"&R1C14&RC[-19])&IF(RC[-18]="",,"|n"&R1C15&RC[-18])&IF(RC[-17]="",,"|n"&R1C16&RC[-17])&IF(RC[-16]="",,"|n"&R1C17&RC[-16])&IF(RC[-15]="",,"|n"&R1C18&RC[-15])&IF(RC[-14]="",,"|n"&R1C19&RC[-14])&IF(RC[-13]="",,"|n"&R1C20&RC[-13])&IF(RC[-12]="",,"|n"&R1C21&RC[-12])&IF(RC[-10]="",,"|n"&R1C23&RC[-10])&IF(RC[-9]="",,"|n"&R1C24&RC[-9])&IF(RC[-8]="",,"|n"&R1C25&RC[-8])&IF(RC[-7]="",,"|n"&R1C26&RC[-7])&IF(RC[-6]="",,"|n"&R1C27&RC[-6])&IF(RC[-5]="",,"|n"&R1C28&RC[-5])&IF(RC[-2]="",,"|n"&RC[-2]) -> 
AG1413: =IF(RC[-26]&RC[-25]&RC[-24]&RC[-23]&RC[-22]&RC[-21]="",,R1C6)&IF(RC[-26]="",,"|n"&R1C7&RC[-26])&IF(RC[-25]="",,"|n"&R1C8&RC[-25])&IF(RC[-24]="",,"|n"&R1C9&RC[-24])&IF(RC[-23]="",,"|n"&R1C10&RC[-23])&IF(RC[-22]="",,"|n"&R1C11&RC[-22])&IF(RC[-21]="",,"|n"&R1C12&RC[-21])&IF(RC[-19]&RC[-18]&RC[-17]&RC[-16]="",,"|n"&R1C13)&IF(RC[-19]="",,"|n"&R1C14&RC[-19])&IF(RC[-18]="",,"|n"&R1C15&RC[-18])&IF(RC[-17]="",,"|n"&R1C16&RC[-17])&IF(RC[-16]="",,"|n"&R1C17&RC[-16])&IF(RC[-15]="",,"|n"&R1C18&RC[-15])&IF(RC[-14]="",,"|n"&R1C19&RC[-14])&IF(RC[-13]="",,"|n"&R1C20&RC[-13])&IF(RC[-12]="",,"|n"&R1C21&RC[-12])&IF(RC[-10]="",,"|n"&R1C23&RC[-10])&IF(RC[-9]="",,"|n"&R1C24&RC[-9])&IF(RC[-8]="",,"|n"&R1C25&RC[-8])&IF(RC[-7]="",,"|n"&R1C26&RC[-7])&IF(RC[-6]="",,"|n"&R1C27&RC[-6])&IF(RC[-5]="",,"|n"&R1C28&RC[-5])&IF(RC[-2]="",,"|n"&RC[-2]) -> 
AG1414: =IF(RC[-26]&RC[-25]&RC[-24]&RC[-23]&RC[-22]&RC[-21]="",,R1C6)&IF(RC[-26]="",,"|n"&R1C7&RC[-26])&IF(RC[-25]="",,"|n"&R1C8&RC[-25])&IF(RC[-24]="",,"|n"&R1C9&RC[-24])&IF(RC[-23]="",,"|n"&R1C10&RC[-23])&IF(RC[-22]="",,"|n"&R1C11&RC[-22])&IF(RC[-21]="",,"|n"&R1C12&RC[-21])&IF(RC[-19]&RC[-18]&RC[-17]&RC[-16]="",,"|n"&R1C13)&IF(RC[-19]="",,"|n"&R1C14&RC[-19])&IF(RC[-18]="",,"|n"&R1C15&RC[-18])&IF(RC[-17]="",,"|n"&R1C16&RC[-17])&IF(RC[-16]="",,"|n"&R1C17&RC[-16])&IF(RC[-15]="",,"|n"&R1C18&RC[-15])&IF(RC[-14]="",,"|n"&R1C19&RC[-14])&IF(RC[-13]="",,"|n"&R1C20&RC[-13])&IF(RC[-12]="",,"|n"&R1C21&RC[-12])&IF(RC[-10]="",,"|n"&R1C23&RC[-10])&IF(RC[-9]="",,"|n"&R1C24&RC[-9])&IF(RC[-8]="",,"|n"&R1C25&RC[-8])&IF(RC[-7]="",,"|n"&R1C26&RC[-7])&IF(RC[-6]="",,"|n"&R1C27&RC[-6])&IF(RC[-5]="",,"|n"&R1C28&RC[-5])&IF(RC[-2]="",,"|n"&RC[-2]) -> 
AG1415: =IF(RC[-26]&RC[-25]&RC[-24]&RC[-23]&RC[-22]&RC[-21]="",,R1C6)&IF(RC[-26]="",,"|n"&R1C7&RC[-26])&IF(RC[-25]="",,"|n"&R1C8&RC[-25])&IF(RC[-24]="",,"|n"&R1C9&RC[-24])&IF(RC[-23]="",,"|n"&R1C10&RC[-23])&IF(RC[-22]="",,"|n"&R1C11&RC[-22])&IF(RC[-21]="",,"|n"&R1C12&RC[-21])&IF(RC[-19]&RC[-18]&RC[-17]&RC[-16]="",,"|n"&R1C13)&IF(RC[-19]="",,"|n"&R1C14&RC[-19])&IF(RC[-18]="",,"|n"&R1C15&RC[-18])&IF(RC[-17]="",,"|n"&R1C16&RC[-17])&IF(RC[-16]="",,"|n"&R1C17&RC[-16])&IF(RC[-15]="",,"|n"&R1C18&RC[-15])&IF(RC[-14]="",,"|n"&R1C19&RC[-14])&IF(RC[-13]="",,"|n"&R1C20&RC[-13])&IF(RC[-12]="",,"|n"&R1C21&RC[-12])&IF(RC[-10]="",,"|n"&R1C23&RC[-10])&IF(RC[-9]="",,"|n"&R1C24&RC[-9])&IF(RC[-8]="",,"|n"&R1C25&RC[-8])&IF(RC[-7]="",,"|n"&R1C26&RC[-7])&IF(RC[-6]="",,"|n"&R1C27&RC[-6])&IF(RC[-5]="",,"|n"&R1C28&RC[-5])&IF(RC[-2]="",,"|n"&RC[-2]) -> 
AG1416: =IF(RC[-26]&RC[-25]&RC[-24]&RC[-23]&RC[-22]&RC[-21]="",,R1C6)&IF(RC[-26]="",,"|n"&R1C7&RC[-26])&IF(RC[-25]="",,"|n"&R1C8&RC[-25])&IF(RC[-24]="",,"|n"&R1C9&RC[-24])&IF(RC[-23]="",,"|n"&R1C10&RC[-23])&IF(RC[-22]="",,"|n"&R1C11&RC[-22])&IF(RC[-21]="",,"|n"&R1C12&RC[-21])&IF(RC[-19]&RC[-18]&RC[-17]&RC[-16]="",,"|n"&R1C13)&IF(RC[-19]="",,"|n"&R1C14&RC[-19])&IF(RC[-18]="",,"|n"&R1C15&RC[-18])&IF(RC[-17]="",,"|n"&R1C16&RC[-17])&IF(RC[-16]="",,"|n"&R1C17&RC[-16])&IF(RC[-15]="",,"|n"&R1C18&RC[-15])&IF(RC[-14]="",,"|n"&R1C19&RC[-14])&IF(RC[-13]="",,"|n"&R1C20&RC[-13])&IF(RC[-12]="",,"|n"&R1C21&RC[-12])&IF(RC[-10]="",,"|n"&R1C23&RC[-10])&IF(RC[-9]="",,"|n"&R1C24&RC[-9])&IF(RC[-8]="",,"|n"&R1C25&RC[-8])&IF(RC[-7]="",,"|n"&R1C26&RC[-7])&IF(RC[-6]="",,"|n"&R1C27&RC[-6])&IF(RC[-5]="",,"|n"&R1C28&RC[-5])&IF(RC[-2]="",,"|n"&RC[-2]) -> 
AG1417: =IF(RC[-26]&RC[-25]&RC[-24]&RC[-23]&RC[-22]&RC[-21]="",,R1C6)&IF(RC[-26]="",,"|n"&R1C7&RC[-26])&IF(RC[-25]="",,"|n"&R1C8&RC[-25])&IF(RC[-24]="",,"|n"&R1C9&RC[-24])&IF(RC[-23]="",,"|n"&R1C10&RC[-23])&IF(RC[-22]="",,"|n"&R1C11&RC[-22])&IF(RC[-21]="",,"|n"&R1C12&RC[-21])&IF(RC[-19]&RC[-18]&RC[-17]&RC[-16]="",,"|n"&R1C13)&IF(RC[-19]="",,"|n"&R1C14&RC[-19])&IF(RC[-18]="",,"|n"&R1C15&RC[-18])&IF(RC[-17]="",,"|n"&R1C16&RC[-17])&IF(RC[-16]="",,"|n"&R1C17&RC[-16])&IF(RC[-15]="",,"|n"&R1C18&RC[-15])&IF(RC[-14]="",,"|n"&R1C19&RC[-14])&IF(RC[-13]="",,"|n"&R1C20&RC[-13])&IF(RC[-12]="",,"|n"&R1C21&RC[-12])&IF(RC[-10]="",,"|n"&R1C23&RC[-10])&IF(RC[-9]="",,"|n"&R1C24&RC[-9])&IF(RC[-8]="",,"|n"&R1C25&RC[-8])&IF(RC[-7]="",,"|n"&R1C26&RC[-7])&IF(RC[-6]="",,"|n"&R1C27&RC[-6])&IF(RC[-5]="",,"|n"&R1C28&RC[-5])&IF(RC[-2]="",,"|n"&RC[-2]) -> 
AG1418: =IF(RC[-26]&RC[-25]&RC[-24]&RC[-23]&RC[-22]&RC[-21]="",,R1C6)&IF(RC[-26]="",,"|n"&R1C7&RC[-26])&IF(RC[-25]="",,"|n"&R1C8&RC[-25])&IF(RC[-24]="",,"|n"&R1C9&RC[-24])&IF(RC[-23]="",,"|n"&R1C10&RC[-23])&IF(RC[-22]="",,"|n"&R1C11&RC[-22])&IF(RC[-21]="",,"|n"&R1C12&RC[-21])&IF(RC[-19]&RC[-18]&RC[-17]&RC[-16]="",,"|n"&R1C13)&IF(RC[-19]="",,"|n"&R1C14&RC[-19])&IF(RC[-18]="",,"|n"&R1C15&RC[-18])&IF(RC[-17]="",,"|n"&R1C16&RC[-17])&IF(RC[-16]="",,"|n"&R1C17&RC[-16])&IF(RC[-15]="",,"|n"&R1C18&RC[-15])&IF(RC[-14]="",,"|n"&R1C19&RC[-14])&IF(RC[-13]="",,"|n"&R1C20&RC[-13])&IF(RC[-12]="",,"|n"&R1C21&RC[-12])&IF(RC[-10]="",,"|n"&R1C23&RC[-10])&IF(RC[-9]="",,"|n"&R1C24&RC[-9])&IF(RC[-8]="",,"|n"&R1C25&RC[-8])&IF(RC[-7]="",,"|n"&R1C26&RC[-7])&IF(RC[-6]="",,"|n"&R1C27&RC[-6])&IF(RC[-5]="",,"|n"&R1C28&RC[-5])&IF(RC[-2]="",,"|n"&RC[-2]) -> 
AG1419: =IF(RC[-26]&RC[-25]&RC[-24]&RC[-23]&RC[-22]&RC[-21]="",,R1C6)&IF(RC[-26]="",,"|n"&R1C7&RC[-26])&IF(RC[-25]="",,"|n"&R1C8&RC[-25])&IF(RC[-24]="",,"|n"&R1C9&RC[-24])&IF(RC[-23]="",,"|n"&R1C10&RC[-23])&IF(RC[-22]="",,"|n"&R1C11&RC[-22])&IF(RC[-21]="",,"|n"&R1C12&RC[-21])&IF(RC[-19]&RC[-18]&RC[-17]&RC[-16]="",,"|n"&R1C13)&IF(RC[-19]="",,"|n"&R1C14&RC[-19])&IF(RC[-18]="",,"|n"&R1C15&RC[-18])&IF(RC[-17]="",,"|n"&R1C16&RC[-17])&IF(RC[-16]="",,"|n"&R1C17&RC[-16])&IF(RC[-15]="",,"|n"&R1C18&RC[-15])&IF(RC[-14]="",,"|n"&R1C19&RC[-14])&IF(RC[-13]="",,"|n"&R1C20&RC[-13])&IF(RC[-12]="",,"|n"&R1C21&RC[-12])&IF(RC[-10]="",,"|n"&R1C23&RC[-10])&IF(RC[-9]="",,"|n"&R1C24&RC[-9])&IF(RC[-8]="",,"|n"&R1C25&RC[-8])&IF(RC[-7]="",,"|n"&R1C26&RC[-7])&IF(RC[-6]="",,"|n"&R1C27&RC[-6])&IF(RC[-5]="",,"|n"&R1C28&RC[-5])&IF(RC[-2]="",,"|n"&RC[-2]) -> 
AG1420: =IF(RC[-26]&RC[-25]&RC[-24]&RC[-23]&RC[-22]&RC[-21]="",,R1C6)&IF(RC[-26]="",,"|n"&R1C7&RC[-26])&IF(RC[-25]="",,"|n"&R1C8&RC[-25])&IF(RC[-24]="",,"|n"&R1C9&RC[-24])&IF(RC[-23]="",,"|n"&R1C10&RC[-23])&IF(RC[-22]="",,"|n"&R1C11&RC[-22])&IF(RC[-21]="",,"|n"&R1C12&RC[-21])&IF(RC[-19]&RC[-18]&RC[-17]&RC[-16]="",,"|n"&R1C13)&IF(RC[-19]="",,"|n"&R1C14&RC[-19])&IF(RC[-18]="",,"|n"&R1C15&RC[-18])&IF(RC[-17]="",,"|n"&R1C16&RC[-17])&IF(RC[-16]="",,"|n"&R1C17&RC[-16])&IF(RC[-15]="",,"|n"&R1C18&RC[-15])&IF(RC[-14]="",,"|n"&R1C19&RC[-14])&IF(RC[-13]="",,"|n"&R1C20&RC[-13])&IF(RC[-12]="",,"|n"&R1C21&RC[-12])&IF(RC[-10]="",,"|n"&R1C23&RC[-10])&IF(RC[-9]="",,"|n"&R1C24&RC[-9])&IF(RC[-8]="",,"|n"&R1C25&RC[-8])&IF(RC[-7]="",,"|n"&R1C26&RC[-7])&IF(RC[-6]="",,"|n"&R1C27&RC[-6])&IF(RC[-5]="",,"|n"&R1C28&RC[-5])&IF(RC[-2]="",,"|n"&RC[-2]) -> 
AG1421: =IF(RC[-26]&RC[-25]&RC[-24]&RC[-23]&RC[-22]&RC[-21]="",,R1C6)&IF(RC[-26]="",,"|n"&R1C7&RC[-26])&IF(RC[-25]="",,"|n"&R1C8&RC[-25])&IF(RC[-24]="",,"|n"&R1C9&RC[-24])&IF(RC[-23]="",,"|n"&R1C10&RC[-23])&IF(RC[-22]="",,"|n"&R1C11&RC[-22])&IF(RC[-21]="",,"|n"&R1C12&RC[-21])&IF(RC[-19]&RC[-18]&RC[-17]&RC[-16]="",,"|n"&R1C13)&IF(RC[-19]="",,"|n"&R1C14&RC[-19])&IF(RC[-18]="",,"|n"&R1C15&RC[-18])&IF(RC[-17]="",,"|n"&R1C16&RC[-17])&IF(RC[-16]="",,"|n"&R1C17&RC[-16])&IF(RC[-15]="",,"|n"&R1C18&RC[-15])&IF(RC[-14]="",,"|n"&R1C19&RC[-14])&IF(RC[-13]="",,"|n"&R1C20&RC[-13])&IF(RC[-12]="",,"|n"&R1C21&RC[-12])&IF(RC[-10]="",,"|n"&R1C23&RC[-10])&IF(RC[-9]="",,"|n"&R1C24&RC[-9])&IF(RC[-8]="",,"|n"&R1C25&RC[-8])&IF(RC[-7]="",,"|n"&R1C26&RC[-7])&IF(RC[-6]="",,"|n"&R1C27&RC[-6])&IF(RC[-5]="",,"|n"&R1C28&RC[-5])&IF(RC[-2]="",,"|n"&RC[-2]) -> 
AG1422: =IF(RC[-26]&RC[-25]&RC[-24]&RC[-23]&RC[-22]&RC[-21]="",,R1C6)&IF(RC[-26]="",,"|n"&R1C7&RC[-26])&IF(RC[-25]="",,"|n"&R1C8&RC[-25])&IF(RC[-24]="",,"|n"&R1C9&RC[-24])&IF(RC[-23]="",,"|n"&R1C10&RC[-23])&IF(RC[-22]="",,"|n"&R1C11&RC[-22])&IF(RC[-21]="",,"|n"&R1C12&RC[-21])&IF(RC[-19]&RC[-18]&RC[-17]&RC[-16]="",,"|n"&R1C13)&IF(RC[-19]="",,"|n"&R1C14&RC[-19])&IF(RC[-18]="",,"|n"&R1C15&RC[-18])&IF(RC[-17]="",,"|n"&R1C16&RC[-17])&IF(RC[-16]="",,"|n"&R1C17&RC[-16])&IF(RC[-15]="",,"|n"&R1C18&RC[-15])&IF(RC[-14]="",,"|n"&R1C19&RC[-14])&IF(RC[-13]="",,"|n"&R1C20&RC[-13])&IF(RC[-12]="",,"|n"&R1C21&RC[-12])&IF(RC[-10]="",,"|n"&R1C23&RC[-10])&IF(RC[-9]="",,"|n"&R1C24&RC[-9])&IF(RC[-8]="",,"|n"&R1C25&RC[-8])&IF(RC[-7]="",,"|n"&R1C26&RC[-7])&IF(RC[-6]="",,"|n"&R1C27&RC[-6])&IF(RC[-5]="",,"|n"&R1C28&RC[-5])&IF(RC[-2]="",,"|n"&RC[-2]) -> 
AG1423: =IF(RC[-26]&RC[-25]&RC[-24]&RC[-23]&RC[-22]&RC[-21]="",,R1C6)&IF(RC[-26]="",,"|n"&R1C7&RC[-26])&IF(RC[-25]="",,"|n"&R1C8&RC[-25])&IF(RC[-24]="",,"|n"&R1C9&RC[-24])&IF(RC[-23]="",,"|n"&R1C10&RC[-23])&IF(RC[-22]="",,"|n"&R1C11&RC[-22])&IF(RC[-21]="",,"|n"&R1C12&RC[-21])&IF(RC[-19]&RC[-18]&RC[-17]&RC[-16]="",,"|n"&R1C13)&IF(RC[-19]="",,"|n"&R1C14&RC[-19])&IF(RC[-18]="",,"|n"&R1C15&RC[-18])&IF(RC[-17]="",,"|n"&R1C16&RC[-17])&IF(RC[-16]="",,"|n"&R1C17&RC[-16])&IF(RC[-15]="",,"|n"&R1C18&RC[-15])&IF(RC[-14]="",,"|n"&R1C19&RC[-14])&IF(RC[-13]="",,"|n"&R1C20&RC[-13])&IF(RC[-12]="",,"|n"&R1C21&RC[-12])&IF(RC[-10]="",,"|n"&R1C23&RC[-10])&IF(RC[-9]="",,"|n"&R1C24&RC[-9])&IF(RC[-8]="",,"|n"&R1C25&RC[-8])&IF(RC[-7]="",,"|n"&R1C26&RC[-7])&IF(RC[-6]="",,"|n"&R1C27&RC[-6])&IF(RC[-5]="",,"|n"&R1C28&RC[-5])&IF(RC[-2]="",,"|n"&RC[-2]) -> 
AG1424: =IF(RC[-26]&RC[-25]&RC[-24]&RC[-23]&RC[-22]&RC[-21]="",,R1C6)&IF(RC[-26]="",,"|n"&R1C7&RC[-26])&IF(RC[-25]="",,"|n"&R1C8&RC[-25])&IF(RC[-24]="",,"|n"&R1C9&RC[-24])&IF(RC[-23]="",,"|n"&R1C10&RC[-23])&IF(RC[-22]="",,"|n"&R1C11&RC[-22])&IF(RC[-21]="",,"|n"&R1C12&RC[-21])&IF(RC[-19]&RC[-18]&RC[-17]&RC[-16]="",,"|n"&R1C13)&IF(RC[-19]="",,"|n"&R1C14&RC[-19])&IF(RC[-18]="",,"|n"&R1C15&RC[-18])&IF(RC[-17]="",,"|n"&R1C16&RC[-17])&IF(RC[-16]="",,"|n"&R1C17&RC[-16])&IF(RC[-15]="",,"|n"&R1C18&RC[-15])&IF(RC[-14]="",,"|n"&R1C19&RC[-14])&IF(RC[-13]="",,"|n"&R1C20&RC[-13])&IF(RC[-12]="",,"|n"&R1C21&RC[-12])&IF(RC[-10]="",,"|n"&R1C23&RC[-10])&IF(RC[-9]="",,"|n"&R1C24&RC[-9])&IF(RC[-8]="",,"|n"&R1C25&RC[-8])&IF(RC[-7]="",,"|n"&R1C26&RC[-7])&IF(RC[-6]="",,"|n"&R1C27&RC[-6])&IF(RC[-5]="",,"|n"&R1C28&RC[-5])&IF(RC[-2]="",,"|n"&RC[-2]) -> 
AG1425: =IF(RC[-26]&RC[-25]&RC[-24]&RC[-23]&RC[-22]&RC[-21]="",,R1C6)&IF(RC[-26]="",,"|n"&R1C7&RC[-26])&IF(RC[-25]="",,"|n"&R1C8&RC[-25])&IF(RC[-24]="",,"|n"&R1C9&RC[-24])&IF(RC[-23]="",,"|n"&R1C10&RC[-23])&IF(RC[-22]="",,"|n"&R1C11&RC[-22])&IF(RC[-21]="",,"|n"&R1C12&RC[-21])&IF(RC[-19]&RC[-18]&RC[-17]&RC[-16]="",,"|n"&R1C13)&IF(RC[-19]="",,"|n"&R1C14&RC[-19])&IF(RC[-18]="",,"|n"&R1C15&RC[-18])&IF(RC[-17]="",,"|n"&R1C16&RC[-17])&IF(RC[-16]="",,"|n"&R1C17&RC[-16])&IF(RC[-15]="",,"|n"&R1C18&RC[-15])&IF(RC[-14]="",,"|n"&R1C19&RC[-14])&IF(RC[-13]="",,"|n"&R1C20&RC[-13])&IF(RC[-12]="",,"|n"&R1C21&RC[-12])&IF(RC[-10]="",,"|n"&R1C23&RC[-10])&IF(RC[-9]="",,"|n"&R1C24&RC[-9])&IF(RC[-8]="",,"|n"&R1C25&RC[-8])&IF(RC[-7]="",,"|n"&R1C26&RC[-7])&IF(RC[-6]="",,"|n"&R1C27&RC[-6])&IF(RC[-5]="",,"|n"&R1C28&RC[-5])&IF(RC[-2]="",,"|n"&RC[-2]) -> 
AG1426: =IF(RC[-26]&RC[-25]&RC[-24]&RC[-23]&RC[-22]&RC[-21]="",,R1C6)&IF(RC[-26]="",,"|n"&R1C7&RC[-26])&IF(RC[-25]="",,"|n"&R1C8&RC[-25])&IF(RC[-24]="",,"|n"&R1C9&RC[-24])&IF(RC[-23]="",,"|n"&R1C10&RC[-23])&IF(RC[-22]="",,"|n"&R1C11&RC[-22])&IF(RC[-21]="",,"|n"&R1C12&RC[-21])&IF(RC[-19]&RC[-18]&RC[-17]&RC[-16]="",,"|n"&R1C13)&IF(RC[-19]="",,"|n"&R1C14&RC[-19])&IF(RC[-18]="",,"|n"&R1C15&RC[-18])&IF(RC[-17]="",,"|n"&R1C16&RC[-17])&IF(RC[-16]="",,"|n"&R1C17&RC[-16])&IF(RC[-15]="",,"|n"&R1C18&RC[-15])&IF(RC[-14]="",,"|n"&R1C19&RC[-14])&IF(RC[-13]="",,"|n"&R1C20&RC[-13])&IF(RC[-12]="",,"|n"&R1C21&RC[-12])&IF(RC[-10]="",,"|n"&R1C23&RC[-10])&IF(RC[-9]="",,"|n"&R1C24&RC[-9])&IF(RC[-8]="",,"|n"&R1C25&RC[-8])&IF(RC[-7]="",,"|n"&R1C26&RC[-7])&IF(RC[-6]="",,"|n"&R1C27&RC[-6])&IF(RC[-5]="",,"|n"&R1C28&RC[-5])&IF(RC[-2]="",,"|n"&RC[-2]) -> 
AG1427: =IF(RC[-26]&RC[-25]&RC[-24]&RC[-23]&RC[-22]&RC[-21]="",,R1C6)&IF(RC[-26]="",,"|n"&R1C7&RC[-26])&IF(RC[-25]="",,"|n"&R1C8&RC[-25])&IF(RC[-24]="",,"|n"&R1C9&RC[-24])&IF(RC[-23]="",,"|n"&R1C10&RC[-23])&IF(RC[-22]="",,"|n"&R1C11&RC[-22])&IF(RC[-21]="",,"|n"&R1C12&RC[-21])&IF(RC[-19]&RC[-18]&RC[-17]&RC[-16]="",,"|n"&R1C13)&IF(RC[-19]="",,"|n"&R1C14&RC[-19])&IF(RC[-18]="",,"|n"&R1C15&RC[-18])&IF(RC[-17]="",,"|n"&R1C16&RC[-17])&IF(RC[-16]="",,"|n"&R1C17&RC[-16])&IF(RC[-15]="",,"|n"&R1C18&RC[-15])&IF(RC[-14]="",,"|n"&R1C19&RC[-14])&IF(RC[-13]="",,"|n"&R1C20&RC[-13])&IF(RC[-12]="",,"|n"&R1C21&RC[-12])&IF(RC[-10]="",,"|n"&R1C23&RC[-10])&IF(RC[-9]="",,"|n"&R1C24&RC[-9])&IF(RC[-8]="",,"|n"&R1C25&RC[-8])&IF(RC[-7]="",,"|n"&R1C26&RC[-7])&IF(RC[-6]="",,"|n"&R1C27&RC[-6])&IF(RC[-5]="",,"|n"&R1C28&RC[-5])&IF(RC[-2]="",,"|n"&RC[-2]) -> 
AG1428: =IF(RC[-26]&RC[-25]&RC[-24]&RC[-23]&RC[-22]&RC[-21]="",,R1C6)&IF(RC[-26]="",,"|n"&R1C7&RC[-26])&IF(RC[-25]="",,"|n"&R1C8&RC[-25])&IF(RC[-24]="",,"|n"&R1C9&RC[-24])&IF(RC[-23]="",,"|n"&R1C10&RC[-23])&IF(RC[-22]="",,"|n"&R1C11&RC[-22])&IF(RC[-21]="",,"|n"&R1C12&RC[-21])&IF(RC[-19]&RC[-18]&RC[-17]&RC[-16]="",,"|n"&R1C13)&IF(RC[-19]="",,"|n"&R1C14&RC[-19])&IF(RC[-18]="",,"|n"&R1C15&RC[-18])&IF(RC[-17]="",,"|n"&R1C16&RC[-17])&IF(RC[-16]="",,"|n"&R1C17&RC[-16])&IF(RC[-15]="",,"|n"&R1C18&RC[-15])&IF(RC[-14]="",,"|n"&R1C19&RC[-14])&IF(RC[-13]="",,"|n"&R1C20&RC[-13])&IF(RC[-12]="",,"|n"&R1C21&RC[-12])&IF(RC[-10]="",,"|n"&R1C23&RC[-10])&IF(RC[-9]="",,"|n"&R1C24&RC[-9])&IF(RC[-8]="",,"|n"&R1C25&RC[-8])&IF(RC[-7]="",,"|n"&R1C26&RC[-7])&IF(RC[-6]="",,"|n"&R1C27&RC[-6])&IF(RC[-5]="",,"|n"&R1C28&RC[-5])&IF(RC[-2]="",,"|n"&RC[-2]) -> 
AG1429: =IF(RC[-26]&RC[-25]&RC[-24]&RC[-23]&RC[-22]&RC[-21]="",,R1C6)&IF(RC[-26]="",,"|n"&R1C7&RC[-26])&IF(RC[-25]="",,"|n"&R1C8&RC[-25])&IF(RC[-24]="",,"|n"&R1C9&RC[-24])&IF(RC[-23]="",,"|n"&R1C10&RC[-23])&IF(RC[-22]="",,"|n"&R1C11&RC[-22])&IF(RC[-21]="",,"|n"&R1C12&RC[-21])&IF(RC[-19]&RC[-18]&RC[-17]&RC[-16]="",,"|n"&R1C13)&IF(RC[-19]="",,"|n"&R1C14&RC[-19])&IF(RC[-18]="",,"|n"&R1C15&RC[-18])&IF(RC[-17]="",,"|n"&R1C16&RC[-17])&IF(RC[-16]="",,"|n"&R1C17&RC[-16])&IF(RC[-15]="",,"|n"&R1C18&RC[-15])&IF(RC[-14]="",,"|n"&R1C19&RC[-14])&IF(RC[-13]="",,"|n"&R1C20&RC[-13])&IF(RC[-12]="",,"|n"&R1C21&RC[-12])&IF(RC[-10]="",,"|n"&R1C23&RC[-10])&IF(RC[-9]="",,"|n"&R1C24&RC[-9])&IF(RC[-8]="",,"|n"&R1C25&RC[-8])&IF(RC[-7]="",,"|n"&R1C26&RC[-7])&IF(RC[-6]="",,"|n"&R1C27&RC[-6])&IF(RC[-5]="",,"|n"&R1C28&RC[-5])&IF(RC[-2]="",,"|n"&RC[-2]) -> 
AG1430: =IF(RC[-26]&RC[-25]&RC[-24]&RC[-23]&RC[-22]&RC[-21]="",,R1C6)&IF(RC[-26]="",,"|n"&R1C7&RC[-26])&IF(RC[-25]="",,"|n"&R1C8&RC[-25])&IF(RC[-24]="",,"|n"&R1C9&RC[-24])&IF(RC[-23]="",,"|n"&R1C10&RC[-23])&IF(RC[-22]="",,"|n"&R1C11&RC[-22])&IF(RC[-21]="",,"|n"&R1C12&RC[-21])&IF(RC[-19]&RC[-18]&RC[-17]&RC[-16]="",,"|n"&R1C13)&IF(RC[-19]="",,"|n"&R1C14&RC[-19])&IF(RC[-18]="",,"|n"&R1C15&RC[-18])&IF(RC[-17]="",,"|n"&R1C16&RC[-17])&IF(RC[-16]="",,"|n"&R1C17&RC[-16])&IF(RC[-15]="",,"|n"&R1C18&RC[-15])&IF(RC[-14]="",,"|n"&R1C19&RC[-14])&IF(RC[-13]="",,"|n"&R1C20&RC[-13])&IF(RC[-12]="",,"|n"&R1C21&RC[-12])&IF(RC[-10]="",,"|n"&R1C23&RC[-10])&IF(RC[-9]="",,"|n"&R1C24&RC[-9])&IF(RC[-8]="",,"|n"&R1C25&RC[-8])&IF(RC[-7]="",,"|n"&R1C26&RC[-7])&IF(RC[-6]="",,"|n"&R1C27&RC[-6])&IF(RC[-5]="",,"|n"&R1C28&RC[-5])&IF(RC[-2]="",,"|n"&RC[-2]) -> 
AG1431: =IF(RC[-26]&RC[-25]&RC[-24]&RC[-23]&RC[-22]&RC[-21]="",,R1C6)&IF(RC[-26]="",,"|n"&R1C7&RC[-26])&IF(RC[-25]="",,"|n"&R1C8&RC[-25])&IF(RC[-24]="",,"|n"&R1C9&RC[-24])&IF(RC[-23]="",,"|n"&R1C10&RC[-23])&IF(RC[-22]="",,"|n"&R1C11&RC[-22])&IF(RC[-21]="",,"|n"&R1C12&RC[-21])&IF(RC[-19]&RC[-18]&RC[-17]&RC[-16]="",,"|n"&R1C13)&IF(RC[-19]="",,"|n"&R1C14&RC[-19])&IF(RC[-18]="",,"|n"&R1C15&RC[-18])&IF(RC[-17]="",,"|n"&R1C16&RC[-17])&IF(RC[-16]="",,"|n"&R1C17&RC[-16])&IF(RC[-15]="",,"|n"&R1C18&RC[-15])&IF(RC[-14]="",,"|n"&R1C19&RC[-14])&IF(RC[-13]="",,"|n"&R1C20&RC[-13])&IF(RC[-12]="",,"|n"&R1C21&RC[-12])&IF(RC[-10]="",,"|n"&R1C23&RC[-10])&IF(RC[-9]="",,"|n"&R1C24&RC[-9])&IF(RC[-8]="",,"|n"&R1C25&RC[-8])&IF(RC[-7]="",,"|n"&R1C26&RC[-7])&IF(RC[-6]="",,"|n"&R1C27&RC[-6])&IF(RC[-5]="",,"|n"&R1C28&RC[-5])&IF(RC[-2]="",,"|n"&RC[-2]) -> 
AG1432: =IF(RC[-26]&RC[-25]&RC[-24]&RC[-23]&RC[-22]&RC[-21]="",,R1C6)&IF(RC[-26]="",,"|n"&R1C7&RC[-26])&IF(RC[-25]="",,"|n"&R1C8&RC[-25])&IF(RC[-24]="",,"|n"&R1C9&RC[-24])&IF(RC[-23]="",,"|n"&R1C10&RC[-23])&IF(RC[-22]="",,"|n"&R1C11&RC[-22])&IF(RC[-21]="",,"|n"&R1C12&RC[-21])&IF(RC[-19]&RC[-18]&RC[-17]&RC[-16]="",,"|n"&R1C13)&IF(RC[-19]="",,"|n"&R1C14&RC[-19])&IF(RC[-18]="",,"|n"&R1C15&RC[-18])&IF(RC[-17]="",,"|n"&R1C16&RC[-17])&IF(RC[-16]="",,"|n"&R1C17&RC[-16])&IF(RC[-15]="",,"|n"&R1C18&RC[-15])&IF(RC[-14]="",,"|n"&R1C19&RC[-14])&IF(RC[-13]="",,"|n"&R1C20&RC[-13])&IF(RC[-12]="",,"|n"&R1C21&RC[-12])&IF(RC[-10]="",,"|n"&R1C23&RC[-10])&IF(RC[-9]="",,"|n"&R1C24&RC[-9])&IF(RC[-8]="",,"|n"&R1C25&RC[-8])&IF(RC[-7]="",,"|n"&R1C26&RC[-7])&IF(RC[-6]="",,"|n"&R1C27&RC[-6])&IF(RC[-5]="",,"|n"&R1C28&RC[-5])&IF(RC[-2]="",,"|n"&RC[-2]) -> 
AG1433: =IF(RC[-26]&RC[-25]&RC[-24]&RC[-23]&RC[-22]&RC[-21]="",,R1C6)&IF(RC[-26]="",,"|n"&R1C7&RC[-26])&IF(RC[-25]="",,"|n"&R1C8&RC[-25])&IF(RC[-24]="",,"|n"&R1C9&RC[-24])&IF(RC[-23]="",,"|n"&R1C10&RC[-23])&IF(RC[-22]="",,"|n"&R1C11&RC[-22])&IF(RC[-21]="",,"|n"&R1C12&RC[-21])&IF(RC[-19]&RC[-18]&RC[-17]&RC[-16]="",,"|n"&R1C13)&IF(RC[-19]="",,"|n"&R1C14&RC[-19])&IF(RC[-18]="",,"|n"&R1C15&RC[-18])&IF(RC[-17]="",,"|n"&R1C16&RC[-17])&IF(RC[-16]="",,"|n"&R1C17&RC[-16])&IF(RC[-15]="",,"|n"&R1C18&RC[-15])&IF(RC[-14]="",,"|n"&R1C19&RC[-14])&IF(RC[-13]="",,"|n"&R1C20&RC[-13])&IF(RC[-12]="",,"|n"&R1C21&RC[-12])&IF(RC[-10]="",,"|n"&R1C23&RC[-10])&IF(RC[-9]="",,"|n"&R1C24&RC[-9])&IF(RC[-8]="",,"|n"&R1C25&RC[-8])&IF(RC[-7]="",,"|n"&R1C26&RC[-7])&IF(RC[-6]="",,"|n"&R1C27&RC[-6])&IF(RC[-5]="",,"|n"&R1C28&RC[-5])&IF(RC[-2]="",,"|n"&RC[-2]) -> 
AG1434: =IF(RC[-26]&RC[-25]&RC[-24]&RC[-23]&RC[-22]&RC[-21]="",,R1C6)&IF(RC[-26]="",,"|n"&R1C7&RC[-26])&IF(RC[-25]="",,"|n"&R1C8&RC[-25])&IF(RC[-24]="",,"|n"&R1C9&RC[-24])&IF(RC[-23]="",,"|n"&R1C10&RC[-23])&IF(RC[-22]="",,"|n"&R1C11&RC[-22])&IF(RC[-21]="",,"|n"&R1C12&RC[-21])&IF(RC[-19]&RC[-18]&RC[-17]&RC[-16]="",,"|n"&R1C13)&IF(RC[-19]="",,"|n"&R1C14&RC[-19])&IF(RC[-18]="",,"|n"&R1C15&RC[-18])&IF(RC[-17]="",,"|n"&R1C16&RC[-17])&IF(RC[-16]="",,"|n"&R1C17&RC[-16])&IF(RC[-15]="",,"|n"&R1C18&RC[-15])&IF(RC[-14]="",,"|n"&R1C19&RC[-14])&IF(RC[-13]="",,"|n"&R1C20&RC[-13])&IF(RC[-12]="",,"|n"&R1C21&RC[-12])&IF(RC[-10]="",,"|n"&R1C23&RC[-10])&IF(RC[-9]="",,"|n"&R1C24&RC[-9])&IF(RC[-8]="",,"|n"&R1C25&RC[-8])&IF(RC[-7]="",,"|n"&R1C26&RC[-7])&IF(RC[-6]="",,"|n"&R1C27&RC[-6])&IF(RC[-5]="",,"|n"&R1C28&RC[-5])&IF(RC[-2]="",,"|n"&RC[-2]) -> 
AG1435: =IF(RC[-26]&RC[-25]&RC[-24]&RC[-23]&RC[-22]&RC[-21]="",,R1C6)&IF(RC[-26]="",,"|n"&R1C7&RC[-26])&IF(RC[-25]="",,"|n"&R1C8&RC[-25])&IF(RC[-24]="",,"|n"&R1C9&RC[-24])&IF(RC[-23]="",,"|n"&R1C10&RC[-23])&IF(RC[-22]="",,"|n"&R1C11&RC[-22])&IF(RC[-21]="",,"|n"&R1C12&RC[-21])&IF(RC[-19]&RC[-18]&RC[-17]&RC[-16]="",,"|n"&R1C13)&IF(RC[-19]="",,"|n"&R1C14&RC[-19])&IF(RC[-18]="",,"|n"&R1C15&RC[-18])&IF(RC[-17]="",,"|n"&R1C16&RC[-17])&IF(RC[-16]="",,"|n"&R1C17&RC[-16])&IF(RC[-15]="",,"|n"&R1C18&RC[-15])&IF(RC[-14]="",,"|n"&R1C19&RC[-14])&IF(RC[-13]="",,"|n"&R1C20&RC[-13])&IF(RC[-12]="",,"|n"&R1C21&RC[-12])&IF(RC[-10]="",,"|n"&R1C23&RC[-10])&IF(RC[-9]="",,"|n"&R1C24&RC[-9])&IF(RC[-8]="",,"|n"&R1C25&RC[-8])&IF(RC[-7]="",,"|n"&R1C26&RC[-7])&IF(RC[-6]="",,"|n"&R1C27&RC[-6])&IF(RC[-5]="",,"|n"&R1C28&RC[-5])&IF(RC[-2]="",,"|n"&RC[-2]) -> 
AG1436: =IF(RC[-26]&RC[-25]&RC[-24]&RC[-23]&RC[-22]&RC[-21]="",,R1C6)&IF(RC[-26]="",,"|n"&R1C7&RC[-26])&IF(RC[-25]="",,"|n"&R1C8&RC[-25])&IF(RC[-24]="",,"|n"&R1C9&RC[-24])&IF(RC[-23]="",,"|n"&R1C10&RC[-23])&IF(RC[-22]="",,"|n"&R1C11&RC[-22])&IF(RC[-21]="",,"|n"&R1C12&RC[-21])&IF(RC[-19]&RC[-18]&RC[-17]&RC[-16]="",,"|n"&R1C13)&IF(RC[-19]="",,"|n"&R1C14&RC[-19])&IF(RC[-18]="",,"|n"&R1C15&RC[-18])&IF(RC[-17]="",,"|n"&R1C16&RC[-17])&IF(RC[-16]="",,"|n"&R1C17&RC[-16])&IF(RC[-15]="",,"|n"&R1C18&RC[-15])&IF(RC[-14]="",,"|n"&R1C19&RC[-14])&IF(RC[-13]="",,"|n"&R1C20&RC[-13])&IF(RC[-12]="",,"|n"&R1C21&RC[-12])&IF(RC[-10]="",,"|n"&R1C23&RC[-10])&IF(RC[-9]="",,"|n"&R1C24&RC[-9])&IF(RC[-8]="",,"|n"&R1C25&RC[-8])&IF(RC[-7]="",,"|n"&R1C26&RC[-7])&IF(RC[-6]="",,"|n"&R1C27&RC[-6])&IF(RC[-5]="",,"|n"&R1C28&RC[-5])&IF(RC[-2]="",,"|n"&RC[-2]) -> 
AG1437: =IF(RC[-26]&RC[-25]&RC[-24]&RC[-23]&RC[-22]&RC[-21]="",,R1C6)&IF(RC[-26]="",,"|n"&R1C7&RC[-26])&IF(RC[-25]="",,"|n"&R1C8&RC[-25])&IF(RC[-24]="",,"|n"&R1C9&RC[-24])&IF(RC[-23]="",,"|n"&R1C10&RC[-23])&IF(RC[-22]="",,"|n"&R1C11&RC[-22])&IF(RC[-21]="",,"|n"&R1C12&RC[-21])&IF(RC[-19]&RC[-18]&RC[-17]&RC[-16]="",,"|n"&R1C13)&IF(RC[-19]="",,"|n"&R1C14&RC[-19])&IF(RC[-18]="",,"|n"&R1C15&RC[-18])&IF(RC[-17]="",,"|n"&R1C16&RC[-17])&IF(RC[-16]="",,"|n"&R1C17&RC[-16])&IF(RC[-15]="",,"|n"&R1C18&RC[-15])&IF(RC[-14]="",,"|n"&R1C19&RC[-14])&IF(RC[-13]="",,"|n"&R1C20&RC[-13])&IF(RC[-12]="",,"|n"&R1C21&RC[-12])&IF(RC[-10]="",,"|n"&R1C23&RC[-10])&IF(RC[-9]="",,"|n"&R1C24&RC[-9])&IF(RC[-8]="",,"|n"&R1C25&RC[-8])&IF(RC[-7]="",,"|n"&R1C26&RC[-7])&IF(RC[-6]="",,"|n"&R1C27&RC[-6])&IF(RC[-5]="",,"|n"&R1C28&RC[-5])&IF(RC[-2]="",,"|n"&RC[-2]) -> 
AG1438: =IF(RC[-26]&RC[-25]&RC[-24]&RC[-23]&RC[-22]&RC[-21]="",,R1C6)&IF(RC[-26]="",,"|n"&R1C7&RC[-26])&IF(RC[-25]="",,"|n"&R1C8&RC[-25])&IF(RC[-24]="",,"|n"&R1C9&RC[-24])&IF(RC[-23]="",,"|n"&R1C10&RC[-23])&IF(RC[-22]="",,"|n"&R1C11&RC[-22])&IF(RC[-21]="",,"|n"&R1C12&RC[-21])&IF(RC[-19]&RC[-18]&RC[-17]&RC[-16]="",,"|n"&R1C13)&IF(RC[-19]="",,"|n"&R1C14&RC[-19])&IF(RC[-18]="",,"|n"&R1C15&RC[-18])&IF(RC[-17]="",,"|n"&R1C16&RC[-17])&IF(RC[-16]="",,"|n"&R1C17&RC[-16])&IF(RC[-15]="",,"|n"&R1C18&RC[-15])&IF(RC[-14]="",,"|n"&R1C19&RC[-14])&IF(RC[-13]="",,"|n"&R1C20&RC[-13])&IF(RC[-12]="",,"|n"&R1C21&RC[-12])&IF(RC[-10]="",,"|n"&R1C23&RC[-10])&IF(RC[-9]="",,"|n"&R1C24&RC[-9])&IF(RC[-8]="",,"|n"&R1C25&RC[-8])&IF(RC[-7]="",,"|n"&R1C26&RC[-7])&IF(RC[-6]="",,"|n"&R1C27&RC[-6])&IF(RC[-5]="",,"|n"&R1C28&RC[-5])&IF(RC[-2]="",,"|n"&RC[-2]) -> 
AG1439: =IF(RC[-26]&RC[-25]&RC[-24]&RC[-23]&RC[-22]&RC[-21]="",,R1C6)&IF(RC[-26]="",,"|n"&R1C7&RC[-26])&IF(RC[-25]="",,"|n"&R1C8&RC[-25])&IF(RC[-24]="",,"|n"&R1C9&RC[-24])&IF(RC[-23]="",,"|n"&R1C10&RC[-23])&IF(RC[-22]="",,"|n"&R1C11&RC[-22])&IF(RC[-21]="",,"|n"&R1C12&RC[-21])&IF(RC[-19]&RC[-18]&RC[-17]&RC[-16]="",,"|n"&R1C13)&IF(RC[-19]="",,"|n"&R1C14&RC[-19])&IF(RC[-18]="",,"|n"&R1C15&RC[-18])&IF(RC[-17]="",,"|n"&R1C16&RC[-17])&IF(RC[-16]="",,"|n"&R1C17&RC[-16])&IF(RC[-15]="",,"|n"&R1C18&RC[-15])&IF(RC[-14]="",,"|n"&R1C19&RC[-14])&IF(RC[-13]="",,"|n"&R1C20&RC[-13])&IF(RC[-12]="",,"|n"&R1C21&RC[-12])&IF(RC[-10]="",,"|n"&R1C23&RC[-10])&IF(RC[-9]="",,"|n"&R1C24&RC[-9])&IF(RC[-8]="",,"|n"&R1C25&RC[-8])&IF(RC[-7]="",,"|n"&R1C26&RC[-7])&IF(RC[-6]="",,"|n"&R1C27&RC[-6])&IF(RC[-5]="",,"|n"&R1C28&RC[-5])&IF(RC[-2]="",,"|n"&RC[-2]) -> 
AG1440: =IF(RC[-26]&RC[-25]&RC[-24]&RC[-23]&RC[-22]&RC[-21]="",,R1C6)&IF(RC[-26]="",,"|n"&R1C7&RC[-26])&IF(RC[-25]="",,"|n"&R1C8&RC[-25])&IF(RC[-24]="",,"|n"&R1C9&RC[-24])&IF(RC[-23]="",,"|n"&R1C10&RC[-23])&IF(RC[-22]="",,"|n"&R1C11&RC[-22])&IF(RC[-21]="",,"|n"&R1C12&RC[-21])&IF(RC[-19]&RC[-18]&RC[-17]&RC[-16]="",,"|n"&R1C13)&IF(RC[-19]="",,"|n"&R1C14&RC[-19])&IF(RC[-18]="",,"|n"&R1C15&RC[-18])&IF(RC[-17]="",,"|n"&R1C16&RC[-17])&IF(RC[-16]="",,"|n"&R1C17&RC[-16])&IF(RC[-15]="",,"|n"&R1C18&RC[-15])&IF(RC[-14]="",,"|n"&R1C19&RC[-14])&IF(RC[-13]="",,"|n"&R1C20&RC[-13])&IF(RC[-12]="",,"|n"&R1C21&RC[-12])&IF(RC[-10]="",,"|n"&R1C23&RC[-10])&IF(RC[-9]="",,"|n"&R1C24&RC[-9])&IF(RC[-8]="",,"|n"&R1C25&RC[-8])&IF(RC[-7]="",,"|n"&R1C26&RC[-7])&IF(RC[-6]="",,"|n"&R1C27&RC[-6])&IF(RC[-5]="",,"|n"&R1C28&RC[-5])&IF(RC[-2]="",,"|n"&RC[-2]) -> 
AG1441: =IF(RC[-26]&RC[-25]&RC[-24]&RC[-23]&RC[-22]&RC[-21]="",,R1C6)&IF(RC[-26]="",,"|n"&R1C7&RC[-26])&IF(RC[-25]="",,"|n"&R1C8&RC[-25])&IF(RC[-24]="",,"|n"&R1C9&RC[-24])&IF(RC[-23]="",,"|n"&R1C10&RC[-23])&IF(RC[-22]="",,"|n"&R1C11&RC[-22])&IF(RC[-21]="",,"|n"&R1C12&RC[-21])&IF(RC[-19]&RC[-18]&RC[-17]&RC[-16]="",,"|n"&R1C13)&IF(RC[-19]="",,"|n"&R1C14&RC[-19])&IF(RC[-18]="",,"|n"&R1C15&RC[-18])&IF(RC[-17]="",,"|n"&R1C16&RC[-17])&IF(RC[-16]="",,"|n"&R1C17&RC[-16])&IF(RC[-15]="",,"|n"&R1C18&RC[-15])&IF(RC[-14]="",,"|n"&R1C19&RC[-14])&IF(RC[-13]="",,"|n"&R1C20&RC[-13])&IF(RC[-12]="",,"|n"&R1C21&RC[-12])&IF(RC[-10]="",,"|n"&R1C23&RC[-10])&IF(RC[-9]="",,"|n"&R1C24&RC[-9])&IF(RC[-8]="",,"|n"&R1C25&RC[-8])&IF(RC[-7]="",,"|n"&R1C26&RC[-7])&IF(RC[-6]="",,"|n"&R1C27&RC[-6])&IF(RC[-5]="",,"|n"&R1C28&RC[-5])&IF(RC[-2]="",,"|n"&RC[-2]) -> 
AG1442: =IF(RC[-26]&RC[-25]&RC[-24]&RC[-23]&RC[-22]&RC[-21]="",,R1C6)&IF(RC[-26]="",,"|n"&R1C7&RC[-26])&IF(RC[-25]="",,"|n"&R1C8&RC[-25])&IF(RC[-24]="",,"|n"&R1C9&RC[-24])&IF(RC[-23]="",,"|n"&R1C10&RC[-23])&IF(RC[-22]="",,"|n"&R1C11&RC[-22])&IF(RC[-21]="",,"|n"&R1C12&RC[-21])&IF(RC[-19]&RC[-18]&RC[-17]&RC[-16]="",,"|n"&R1C13)&IF(RC[-19]="",,"|n"&R1C14&RC[-19])&IF(RC[-18]="",,"|n"&R1C15&RC[-18])&IF(RC[-17]="",,"|n"&R1C16&RC[-17])&IF(RC[-16]="",,"|n"&R1C17&RC[-16])&IF(RC[-15]="",,"|n"&R1C18&RC[-15])&IF(RC[-14]="",,"|n"&R1C19&RC[-14])&IF(RC[-13]="",,"|n"&R1C20&RC[-13])&IF(RC[-12]="",,"|n"&R1C21&RC[-12])&IF(RC[-10]="",,"|n"&R1C23&RC[-10])&IF(RC[-9]="",,"|n"&R1C24&RC[-9])&IF(RC[-8]="",,"|n"&R1C25&RC[-8])&IF(RC[-7]="",,"|n"&R1C26&RC[-7])&IF(RC[-6]="",,"|n"&R1C27&RC[-6])&IF(RC[-5]="",,"|n"&R1C28&RC[-5])&IF(RC[-2]="",,"|n"&RC[-2]) -> 
AG1443: =IF(RC[-26]&RC[-25]&RC[-24]&RC[-23]&RC[-22]&RC[-21]="",,R1C6)&IF(RC[-26]="",,"|n"&R1C7&RC[-26])&IF(RC[-25]="",,"|n"&R1C8&RC[-25])&IF(RC[-24]="",,"|n"&R1C9&RC[-24])&IF(RC[-23]="",,"|n"&R1C10&RC[-23])&IF(RC[-22]="",,"|n"&R1C11&RC[-22])&IF(RC[-21]="",,"|n"&R1C12&RC[-21])&IF(RC[-19]&RC[-18]&RC[-17]&RC[-16]="",,"|n"&R1C13)&IF(RC[-19]="",,"|n"&R1C14&RC[-19])&IF(RC[-18]="",,"|n"&R1C15&RC[-18])&IF(RC[-17]="",,"|n"&R1C16&RC[-17])&IF(RC[-16]="",,"|n"&R1C17&RC[-16])&IF(RC[-15]="",,"|n"&R1C18&RC[-15])&IF(RC[-14]="",,"|n"&R1C19&RC[-14])&IF(RC[-13]="",,"|n"&R1C20&RC[-13])&IF(RC[-12]="",,"|n"&R1C21&RC[-12])&IF(RC[-10]="",,"|n"&R1C23&RC[-10])&IF(RC[-9]="",,"|n"&R1C24&RC[-9])&IF(RC[-8]="",,"|n"&R1C25&RC[-8])&IF(RC[-7]="",,"|n"&R1C26&RC[-7])&IF(RC[-6]="",,"|n"&R1C27&RC[-6])&IF(RC[-5]="",,"|n"&R1C28&RC[-5])&IF(RC[-2]="",,"|n"&RC[-2]) -> 
AG1444: =IF(RC[-26]&RC[-25]&RC[-24]&RC[-23]&RC[-22]&RC[-21]="",,R1C6)&IF(RC[-26]="",,"|n"&R1C7&RC[-26])&IF(RC[-25]="",,"|n"&R1C8&RC[-25])&IF(RC[-24]="",,"|n"&R1C9&RC[-24])&IF(RC[-23]="",,"|n"&R1C10&RC[-23])&IF(RC[-22]="",,"|n"&R1C11&RC[-22])&IF(RC[-21]="",,"|n"&R1C12&RC[-21])&IF(RC[-19]&RC[-18]&RC[-17]&RC[-16]="",,"|n"&R1C13)&IF(RC[-19]="",,"|n"&R1C14&RC[-19])&IF(RC[-18]="",,"|n"&R1C15&RC[-18])&IF(RC[-17]="",,"|n"&R1C16&RC[-17])&IF(RC[-16]="",,"|n"&R1C17&RC[-16])&IF(RC[-15]="",,"|n"&R1C18&RC[-15])&IF(RC[-14]="",,"|n"&R1C19&RC[-14])&IF(RC[-13]="",,"|n"&R1C20&RC[-13])&IF(RC[-12]="",,"|n"&R1C21&RC[-12])&IF(RC[-10]="",,"|n"&R1C23&RC[-10])&IF(RC[-9]="",,"|n"&R1C24&RC[-9])&IF(RC[-8]="",,"|n"&R1C25&RC[-8])&IF(RC[-7]="",,"|n"&R1C26&RC[-7])&IF(RC[-6]="",,"|n"&R1C27&RC[-6])&IF(RC[-5]="",,"|n"&R1C28&RC[-5])&IF(RC[-2]="",,"|n"&RC[-2]) -> 
AG1445: =IF(RC[-26]&RC[-25]&RC[-24]&RC[-23]&RC[-22]&RC[-21]="",,R1C6)&IF(RC[-26]="",,"|n"&R1C7&RC[-26])&IF(RC[-25]="",,"|n"&R1C8&RC[-25])&IF(RC[-24]="",,"|n"&R1C9&RC[-24])&IF(RC[-23]="",,"|n"&R1C10&RC[-23])&IF(RC[-22]="",,"|n"&R1C11&RC[-22])&IF(RC[-21]="",,"|n"&R1C12&RC[-21])&IF(RC[-19]&RC[-18]&RC[-17]&RC[-16]="",,"|n"&R1C13)&IF(RC[-19]="",,"|n"&R1C14&RC[-19])&IF(RC[-18]="",,"|n"&R1C15&RC[-18])&IF(RC[-17]="",,"|n"&R1C16&RC[-17])&IF(RC[-16]="",,"|n"&R1C17&RC[-16])&IF(RC[-15]="",,"|n"&R1C18&RC[-15])&IF(RC[-14]="",,"|n"&R1C19&RC[-14])&IF(RC[-13]="",,"|n"&R1C20&RC[-13])&IF(RC[-12]="",,"|n"&R1C21&RC[-12])&IF(RC[-10]="",,"|n"&R1C23&RC[-10])&IF(RC[-9]="",,"|n"&R1C24&RC[-9])&IF(RC[-8]="",,"|n"&R1C25&RC[-8])&IF(RC[-7]="",,"|n"&R1C26&RC[-7])&IF(RC[-6]="",,"|n"&R1C27&RC[-6])&IF(RC[-5]="",,"|n"&R1C28&RC[-5])&IF(RC[-2]="",,"|n"&RC[-2]) -> 
AG1446: =IF(RC[-26]&RC[-25]&RC[-24]&RC[-23]&RC[-22]&RC[-21]="",,R1C6)&IF(RC[-26]="",,"|n"&R1C7&RC[-26])&IF(RC[-25]="",,"|n"&R1C8&RC[-25])&IF(RC[-24]="",,"|n"&R1C9&RC[-24])&IF(RC[-23]="",,"|n"&R1C10&RC[-23])&IF(RC[-22]="",,"|n"&R1C11&RC[-22])&IF(RC[-21]="",,"|n"&R1C12&RC[-21])&IF(RC[-19]&RC[-18]&RC[-17]&RC[-16]="",,"|n"&R1C13)&IF(RC[-19]="",,"|n"&R1C14&RC[-19])&IF(RC[-18]="",,"|n"&R1C15&RC[-18])&IF(RC[-17]="",,"|n"&R1C16&RC[-17])&IF(RC[-16]="",,"|n"&R1C17&RC[-16])&IF(RC[-15]="",,"|n"&R1C18&RC[-15])&IF(RC[-14]="",,"|n"&R1C19&RC[-14])&IF(RC[-13]="",,"|n"&R1C20&RC[-13])&IF(RC[-12]="",,"|n"&R1C21&RC[-12])&IF(RC[-10]="",,"|n"&R1C23&RC[-10])&IF(RC[-9]="",,"|n"&R1C24&RC[-9])&IF(RC[-8]="",,"|n"&R1C25&RC[-8])&IF(RC[-7]="",,"|n"&R1C26&RC[-7])&IF(RC[-6]="",,"|n"&R1C27&RC[-6])&IF(RC[-5]="",,"|n"&R1C28&RC[-5])&IF(RC[-2]="",,"|n"&RC[-2]) -> 
AG1447: =IF(RC[-26]&RC[-25]&RC[-24]&RC[-23]&RC[-22]&RC[-21]="",,R1C6)&IF(RC[-26]="",,"|n"&R1C7&RC[-26])&IF(RC[-25]="",,"|n"&R1C8&RC[-25])&IF(RC[-24]="",,"|n"&R1C9&RC[-24])&IF(RC[-23]="",,"|n"&R1C10&RC[-23])&IF(RC[-22]="",,"|n"&R1C11&RC[-22])&IF(RC[-21]="",,"|n"&R1C12&RC[-21])&IF(RC[-19]&RC[-18]&RC[-17]&RC[-16]="",,"|n"&R1C13)&IF(RC[-19]="",,"|n"&R1C14&RC[-19])&IF(RC[-18]="",,"|n"&R1C15&RC[-18])&IF(RC[-17]="",,"|n"&R1C16&RC[-17])&IF(RC[-16]="",,"|n"&R1C17&RC[-16])&IF(RC[-15]="",,"|n"&R1C18&RC[-15])&IF(RC[-14]="",,"|n"&R1C19&RC[-14])&IF(RC[-13]="",,"|n"&R1C20&RC[-13])&IF(RC[-12]="",,"|n"&R1C21&RC[-12])&IF(RC[-10]="",,"|n"&R1C23&RC[-10])&IF(RC[-9]="",,"|n"&R1C24&RC[-9])&IF(RC[-8]="",,"|n"&R1C25&RC[-8])&IF(RC[-7]="",,"|n"&R1C26&RC[-7])&IF(RC[-6]="",,"|n"&R1C27&RC[-6])&IF(RC[-5]="",,"|n"&R1C28&RC[-5])&IF(RC[-2]="",,"|n"&RC[-2]) -> 
AG1448: =IF(RC[-26]&RC[-25]&RC[-24]&RC[-23]&RC[-22]&RC[-21]="",,R1C6)&IF(RC[-26]="",,"|n"&R1C7&RC[-26])&IF(RC[-25]="",,"|n"&R1C8&RC[-25])&IF(RC[-24]="",,"|n"&R1C9&RC[-24])&IF(RC[-23]="",,"|n"&R1C10&RC[-23])&IF(RC[-22]="",,"|n"&R1C11&RC[-22])&IF(RC[-21]="",,"|n"&R1C12&RC[-21])&IF(RC[-19]&RC[-18]&RC[-17]&RC[-16]="",,"|n"&R1C13)&IF(RC[-19]="",,"|n"&R1C14&RC[-19])&IF(RC[-18]="",,"|n"&R1C15&RC[-18])&IF(RC[-17]="",,"|n"&R1C16&RC[-17])&IF(RC[-16]="",,"|n"&R1C17&RC[-16])&IF(RC[-15]="",,"|n"&R1C18&RC[-15])&IF(RC[-14]="",,"|n"&R1C19&RC[-14])&IF(RC[-13]="",,"|n"&R1C20&RC[-13])&IF(RC[-12]="",,"|n"&R1C21&RC[-12])&IF(RC[-10]="",,"|n"&R1C23&RC[-10])&IF(RC[-9]="",,"|n"&R1C24&RC[-9])&IF(RC[-8]="",,"|n"&R1C25&RC[-8])&IF(RC[-7]="",,"|n"&R1C26&RC[-7])&IF(RC[-6]="",,"|n"&R1C27&RC[-6])&IF(RC[-5]="",,"|n"&R1C28&RC[-5])&IF(RC[-2]="",,"|n"&RC[-2]) -> 
AG1449: =IF(RC[-26]&RC[-25]&RC[-24]&RC[-23]&RC[-22]&RC[-21]="",,R1C6)&IF(RC[-26]="",,"|n"&R1C7&RC[-26])&IF(RC[-25]="",,"|n"&R1C8&RC[-25])&IF(RC[-24]="",,"|n"&R1C9&RC[-24])&IF(RC[-23]="",,"|n"&R1C10&RC[-23])&IF(RC[-22]="",,"|n"&R1C11&RC[-22])&IF(RC[-21]="",,"|n"&R1C12&RC[-21])&IF(RC[-19]&RC[-18]&RC[-17]&RC[-16]="",,"|n"&R1C13)&IF(RC[-19]="",,"|n"&R1C14&RC[-19])&IF(RC[-18]="",,"|n"&R1C15&RC[-18])&IF(RC[-17]="",,"|n"&R1C16&RC[-17])&IF(RC[-16]="",,"|n"&R1C17&RC[-16])&IF(RC[-15]="",,"|n"&R1C18&RC[-15])&IF(RC[-14]="",,"|n"&R1C19&RC[-14])&IF(RC[-13]="",,"|n"&R1C20&RC[-13])&IF(RC[-12]="",,"|n"&R1C21&RC[-12])&IF(RC[-10]="",,"|n"&R1C23&RC[-10])&IF(RC[-9]="",,"|n"&R1C24&RC[-9])&IF(RC[-8]="",,"|n"&R1C25&RC[-8])&IF(RC[-7]="",,"|n"&R1C26&RC[-7])&IF(RC[-6]="",,"|n"&R1C27&RC[-6])&IF(RC[-5]="",,"|n"&R1C28&RC[-5])&IF(RC[-2]="",,"|n"&RC[-2]) -> 
AG1450: =IF(RC[-26]&RC[-25]&RC[-24]&RC[-23]&RC[-22]&RC[-21]="",,R1C6)&IF(RC[-26]="",,"|n"&R1C7&RC[-26])&IF(RC[-25]="",,"|n"&R1C8&RC[-25])&IF(RC[-24]="",,"|n"&R1C9&RC[-24])&IF(RC[-23]="",,"|n"&R1C10&RC[-23])&IF(RC[-22]="",,"|n"&R1C11&RC[-22])&IF(RC[-21]="",,"|n"&R1C12&RC[-21])&IF(RC[-19]&RC[-18]&RC[-17]&RC[-16]="",,"|n"&R1C13)&IF(RC[-19]="",,"|n"&R1C14&RC[-19])&IF(RC[-18]="",,"|n"&R1C15&RC[-18])&IF(RC[-17]="",,"|n"&R1C16&RC[-17])&IF(RC[-16]="",,"|n"&R1C17&RC[-16])&IF(RC[-15]="",,"|n"&R1C18&RC[-15])&IF(RC[-14]="",,"|n"&R1C19&RC[-14])&IF(RC[-13]="",,"|n"&R1C20&RC[-13])&IF(RC[-12]="",,"|n"&R1C21&RC[-12])&IF(RC[-10]="",,"|n"&R1C23&RC[-10])&IF(RC[-9]="",,"|n"&R1C24&RC[-9])&IF(RC[-8]="",,"|n"&R1C25&RC[-8])&IF(RC[-7]="",,"|n"&R1C26&RC[-7])&IF(RC[-6]="",,"|n"&R1C27&RC[-6])&IF(RC[-5]="",,"|n"&R1C28&RC[-5])&IF(RC[-2]="",,"|n"&RC[-2]) -> 
AG1451: =IF(RC[-26]&RC[-25]&RC[-24]&RC[-23]&RC[-22]&RC[-21]="",,R1C6)&IF(RC[-26]="",,"|n"&R1C7&RC[-26])&IF(RC[-25]="",,"|n"&R1C8&RC[-25])&IF(RC[-24]="",,"|n"&R1C9&RC[-24])&IF(RC[-23]="",,"|n"&R1C10&RC[-23])&IF(RC[-22]="",,"|n"&R1C11&RC[-22])&IF(RC[-21]="",,"|n"&R1C12&RC[-21])&IF(RC[-19]&RC[-18]&RC[-17]&RC[-16]="",,"|n"&R1C13)&IF(RC[-19]="",,"|n"&R1C14&RC[-19])&IF(RC[-18]="",,"|n"&R1C15&RC[-18])&IF(RC[-17]="",,"|n"&R1C16&RC[-17])&IF(RC[-16]="",,"|n"&R1C17&RC[-16])&IF(RC[-15]="",,"|n"&R1C18&RC[-15])&IF(RC[-14]="",,"|n"&R1C19&RC[-14])&IF(RC[-13]="",,"|n"&R1C20&RC[-13])&IF(RC[-12]="",,"|n"&R1C21&RC[-12])&IF(RC[-10]="",,"|n"&R1C23&RC[-10])&IF(RC[-9]="",,"|n"&R1C24&RC[-9])&IF(RC[-8]="",,"|n"&R1C25&RC[-8])&IF(RC[-7]="",,"|n"&R1C26&RC[-7])&IF(RC[-6]="",,"|n"&R1C27&RC[-6])&IF(RC[-5]="",,"|n"&R1C28&RC[-5])&IF(RC[-2]="",,"|n"&RC[-2]) -> 
AG1452: =IF(RC[-26]&RC[-25]&RC[-24]&RC[-23]&RC[-22]&RC[-21]="",,R1C6)&IF(RC[-26]="",,"|n"&R1C7&RC[-26])&IF(RC[-25]="",,"|n"&R1C8&RC[-25])&IF(RC[-24]="",,"|n"&R1C9&RC[-24])&IF(RC[-23]="",,"|n"&R1C10&RC[-23])&IF(RC[-22]="",,"|n"&R1C11&RC[-22])&IF(RC[-21]="",,"|n"&R1C12&RC[-21])&IF(RC[-19]&RC[-18]&RC[-17]&RC[-16]="",,"|n"&R1C13)&IF(RC[-19]="",,"|n"&R1C14&RC[-19])&IF(RC[-18]="",,"|n"&R1C15&RC[-18])&IF(RC[-17]="",,"|n"&R1C16&RC[-17])&IF(RC[-16]="",,"|n"&R1C17&RC[-16])&IF(RC[-15]="",,"|n"&R1C18&RC[-15])&IF(RC[-14]="",,"|n"&R1C19&RC[-14])&IF(RC[-13]="",,"|n"&R1C20&RC[-13])&IF(RC[-12]="",,"|n"&R1C21&RC[-12])&IF(RC[-10]="",,"|n"&R1C23&RC[-10])&IF(RC[-9]="",,"|n"&R1C24&RC[-9])&IF(RC[-8]="",,"|n"&R1C25&RC[-8])&IF(RC[-7]="",,"|n"&R1C26&RC[-7])&IF(RC[-6]="",,"|n"&R1C27&RC[-6])&IF(RC[-5]="",,"|n"&R1C28&RC[-5])&IF(RC[-2]="",,"|n"&RC[-2]) -> 
AG1453: =IF(RC[-26]&RC[-25]&RC[-24]&RC[-23]&RC[-22]&RC[-21]="",,R1C6)&IF(RC[-26]="",,"|n"&R1C7&RC[-26])&IF(RC[-25]="",,"|n"&R1C8&RC[-25])&IF(RC[-24]="",,"|n"&R1C9&RC[-24])&IF(RC[-23]="",,"|n"&R1C10&RC[-23])&IF(RC[-22]="",,"|n"&R1C11&RC[-22])&IF(RC[-21]="",,"|n"&R1C12&RC[-21])&IF(RC[-19]&RC[-18]&RC[-17]&RC[-16]="",,"|n"&R1C13)&IF(RC[-19]="",,"|n"&R1C14&RC[-19])&IF(RC[-18]="",,"|n"&R1C15&RC[-18])&IF(RC[-17]="",,"|n"&R1C16&RC[-17])&IF(RC[-16]="",,"|n"&R1C17&RC[-16])&IF(RC[-15]="",,"|n"&R1C18&RC[-15])&IF(RC[-14]="",,"|n"&R1C19&RC[-14])&IF(RC[-13]="",,"|n"&R1C20&RC[-13])&IF(RC[-12]="",,"|n"&R1C21&RC[-12])&IF(RC[-10]="",,"|n"&R1C23&RC[-10])&IF(RC[-9]="",,"|n"&R1C24&RC[-9])&IF(RC[-8]="",,"|n"&R1C25&RC[-8])&IF(RC[-7]="",,"|n"&R1C26&RC[-7])&IF(RC[-6]="",,"|n"&R1C27&RC[-6])&IF(RC[-5]="",,"|n"&R1C28&RC[-5])&IF(RC[-2]="",,"|n"&RC[-2]) -> 
AG1454: =IF(RC[-26]&RC[-25]&RC[-24]&RC[-23]&RC[-22]&RC[-21]="",,R1C6)&IF(RC[-26]="",,"|n"&R1C7&RC[-26])&IF(RC[-25]="",,"|n"&R1C8&RC[-25])&IF(RC[-24]="",,"|n"&R1C9&RC[-24])&IF(RC[-23]="",,"|n"&R1C10&RC[-23])&IF(RC[-22]="",,"|n"&R1C11&RC[-22])&IF(RC[-21]="",,"|n"&R1C12&RC[-21])&IF(RC[-19]&RC[-18]&RC[-17]&RC[-16]="",,"|n"&R1C13)&IF(RC[-19]="",,"|n"&R1C14&RC[-19])&IF(RC[-18]="",,"|n"&R1C15&RC[-18])&IF(RC[-17]="",,"|n"&R1C16&RC[-17])&IF(RC[-16]="",,"|n"&R1C17&RC[-16])&IF(RC[-15]="",,"|n"&R1C18&RC[-15])&IF(RC[-14]="",,"|n"&R1C19&RC[-14])&IF(RC[-13]="",,"|n"&R1C20&RC[-13])&IF(RC[-12]="",,"|n"&R1C21&RC[-12])&IF(RC[-10]="",,"|n"&R1C23&RC[-10])&IF(RC[-9]="",,"|n"&R1C24&RC[-9])&IF(RC[-8]="",,"|n"&R1C25&RC[-8])&IF(RC[-7]="",,"|n"&R1C26&RC[-7])&IF(RC[-6]="",,"|n"&R1C27&RC[-6])&IF(RC[-5]="",,"|n"&R1C28&RC[-5])&IF(RC[-2]="",,"|n"&RC[-2]) -> 
AG1455: =IF(RC[-26]&RC[-25]&RC[-24]&RC[-23]&RC[-22]&RC[-21]="",,R1C6)&IF(RC[-26]="",,"|n"&R1C7&RC[-26])&IF(RC[-25]="",,"|n"&R1C8&RC[-25])&IF(RC[-24]="",,"|n"&R1C9&RC[-24])&IF(RC[-23]="",,"|n"&R1C10&RC[-23])&IF(RC[-22]="",,"|n"&R1C11&RC[-22])&IF(RC[-21]="",,"|n"&R1C12&RC[-21])&IF(RC[-19]&RC[-18]&RC[-17]&RC[-16]="",,"|n"&R1C13)&IF(RC[-19]="",,"|n"&R1C14&RC[-19])&IF(RC[-18]="",,"|n"&R1C15&RC[-18])&IF(RC[-17]="",,"|n"&R1C16&RC[-17])&IF(RC[-16]="",,"|n"&R1C17&RC[-16])&IF(RC[-15]="",,"|n"&R1C18&RC[-15])&IF(RC[-14]="",,"|n"&R1C19&RC[-14])&IF(RC[-13]="",,"|n"&R1C20&RC[-13])&IF(RC[-12]="",,"|n"&R1C21&RC[-12])&IF(RC[-10]="",,"|n"&R1C23&RC[-10])&IF(RC[-9]="",,"|n"&R1C24&RC[-9])&IF(RC[-8]="",,"|n"&R1C25&RC[-8])&IF(RC[-7]="",,"|n"&R1C26&RC[-7])&IF(RC[-6]="",,"|n"&R1C27&RC[-6])&IF(RC[-5]="",,"|n"&R1C28&RC[-5])&IF(RC[-2]="",,"|n"&RC[-2]) -> 
AG1456: =IF(RC[-26]&RC[-25]&RC[-24]&RC[-23]&RC[-22]&RC[-21]="",,R1C6)&IF(RC[-26]="",,"|n"&R1C7&RC[-26])&IF(RC[-25]="",,"|n"&R1C8&RC[-25])&IF(RC[-24]="",,"|n"&R1C9&RC[-24])&IF(RC[-23]="",,"|n"&R1C10&RC[-23])&IF(RC[-22]="",,"|n"&R1C11&RC[-22])&IF(RC[-21]="",,"|n"&R1C12&RC[-21])&IF(RC[-19]&RC[-18]&RC[-17]&RC[-16]="",,"|n"&R1C13)&IF(RC[-19]="",,"|n"&R1C14&RC[-19])&IF(RC[-18]="",,"|n"&R1C15&RC[-18])&IF(RC[-17]="",,"|n"&R1C16&RC[-17])&IF(RC[-16]="",,"|n"&R1C17&RC[-16])&IF(RC[-15]="",,"|n"&R1C18&RC[-15])&IF(RC[-14]="",,"|n"&R1C19&RC[-14])&IF(RC[-13]="",,"|n"&R1C20&RC[-13])&IF(RC[-12]="",,"|n"&R1C21&RC[-12])&IF(RC[-10]="",,"|n"&R1C23&RC[-10])&IF(RC[-9]="",,"|n"&R1C24&RC[-9])&IF(RC[-8]="",,"|n"&R1C25&RC[-8])&IF(RC[-7]="",,"|n"&R1C26&RC[-7])&IF(RC[-6]="",,"|n"&R1C27&RC[-6])&IF(RC[-5]="",,"|n"&R1C28&RC[-5])&IF(RC[-2]="",,"|n"&RC[-2]) -> 
AG1457: =IF(RC[-26]&RC[-25]&RC[-24]&RC[-23]&RC[-22]&RC[-21]="",,R1C6)&IF(RC[-26]="",,"|n"&R1C7&RC[-26])&IF(RC[-25]="",,"|n"&R1C8&RC[-25])&IF(RC[-24]="",,"|n"&R1C9&RC[-24])&IF(RC[-23]="",,"|n"&R1C10&RC[-23])&IF(RC[-22]="",,"|n"&R1C11&RC[-22])&IF(RC[-21]="",,"|n"&R1C12&RC[-21])&IF(RC[-19]&RC[-18]&RC[-17]&RC[-16]="",,"|n"&R1C13)&IF(RC[-19]="",,"|n"&R1C14&RC[-19])&IF(RC[-18]="",,"|n"&R1C15&RC[-18])&IF(RC[-17]="",,"|n"&R1C16&RC[-17])&IF(RC[-16]="",,"|n"&R1C17&RC[-16])&IF(RC[-15]="",,"|n"&R1C18&RC[-15])&IF(RC[-14]="",,"|n"&R1C19&RC[-14])&IF(RC[-13]="",,"|n"&R1C20&RC[-13])&IF(RC[-12]="",,"|n"&R1C21&RC[-12])&IF(RC[-10]="",,"|n"&R1C23&RC[-10])&IF(RC[-9]="",,"|n"&R1C24&RC[-9])&IF(RC[-8]="",,"|n"&R1C25&RC[-8])&IF(RC[-7]="",,"|n"&R1C26&RC[-7])&IF(RC[-6]="",,"|n"&R1C27&RC[-6])&IF(RC[-5]="",,"|n"&R1C28&RC[-5])&IF(RC[-2]="",,"|n"&RC[-2]) -> 
AG1458: =IF(RC[-26]&RC[-25]&RC[-24]&RC[-23]&RC[-22]&RC[-21]="",,R1C6)&IF(RC[-26]="",,"|n"&R1C7&RC[-26])&IF(RC[-25]="",,"|n"&R1C8&RC[-25])&IF(RC[-24]="",,"|n"&R1C9&RC[-24])&IF(RC[-23]="",,"|n"&R1C10&RC[-23])&IF(RC[-22]="",,"|n"&R1C11&RC[-22])&IF(RC[-21]="",,"|n"&R1C12&RC[-21])&IF(RC[-19]&RC[-18]&RC[-17]&RC[-16]="",,"|n"&R1C13)&IF(RC[-19]="",,"|n"&R1C14&RC[-19])&IF(RC[-18]="",,"|n"&R1C15&RC[-18])&IF(RC[-17]="",,"|n"&R1C16&RC[-17])&IF(RC[-16]="",,"|n"&R1C17&RC[-16])&IF(RC[-15]="",,"|n"&R1C18&RC[-15])&IF(RC[-14]="",,"|n"&R1C19&RC[-14])&IF(RC[-13]="",,"|n"&R1C20&RC[-13])&IF(RC[-12]="",,"|n"&R1C21&RC[-12])&IF(RC[-10]="",,"|n"&R1C23&RC[-10])&IF(RC[-9]="",,"|n"&R1C24&RC[-9])&IF(RC[-8]="",,"|n"&R1C25&RC[-8])&IF(RC[-7]="",,"|n"&R1C26&RC[-7])&IF(RC[-6]="",,"|n"&R1C27&RC[-6])&IF(RC[-5]="",,"|n"&R1C28&RC[-5])&IF(RC[-2]="",,"|n"&RC[-2]) -> 
AG1459: =IF(RC[-26]&RC[-25]&RC[-24]&RC[-23]&RC[-22]&RC[-21]="",,R1C6)&IF(RC[-26]="",,"|n"&R1C7&RC[-26])&IF(RC[-25]="",,"|n"&R1C8&RC[-25])&IF(RC[-24]="",,"|n"&R1C9&RC[-24])&IF(RC[-23]="",,"|n"&R1C10&RC[-23])&IF(RC[-22]="",,"|n"&R1C11&RC[-22])&IF(RC[-21]="",,"|n"&R1C12&RC[-21])&IF(RC[-19]&RC[-18]&RC[-17]&RC[-16]="",,"|n"&R1C13)&IF(RC[-19]="",,"|n"&R1C14&RC[-19])&IF(RC[-18]="",,"|n"&R1C15&RC[-18])&IF(RC[-17]="",,"|n"&R1C16&RC[-17])&IF(RC[-16]="",,"|n"&R1C17&RC[-16])&IF(RC[-15]="",,"|n"&R1C18&RC[-15])&IF(RC[-14]="",,"|n"&R1C19&RC[-14])&IF(RC[-13]="",,"|n"&R1C20&RC[-13])&IF(RC[-12]="",,"|n"&R1C21&RC[-12])&IF(RC[-10]="",,"|n"&R1C23&RC[-10])&IF(RC[-9]="",,"|n"&R1C24&RC[-9])&IF(RC[-8]="",,"|n"&R1C25&RC[-8])&IF(RC[-7]="",,"|n"&R1C26&RC[-7])&IF(RC[-6]="",,"|n"&R1C27&RC[-6])&IF(RC[-5]="",,"|n"&R1C28&RC[-5])&IF(RC[-2]="",,"|n"&RC[-2]) -> 
AG1460: =IF(RC[-26]&RC[-25]&RC[-24]&RC[-23]&RC[-22]&RC[-21]="",,R1C6)&IF(RC[-26]="",,"|n"&R1C7&RC[-26])&IF(RC[-25]="",,"|n"&R1C8&RC[-25])&IF(RC[-24]="",,"|n"&R1C9&RC[-24])&IF(RC[-23]="",,"|n"&R1C10&RC[-23])&IF(RC[-22]="",,"|n"&R1C11&RC[-22])&IF(RC[-21]="",,"|n"&R1C12&RC[-21])&IF(RC[-19]&RC[-18]&RC[-17]&RC[-16]="",,"|n"&R1C13)&IF(RC[-19]="",,"|n"&R1C14&RC[-19])&IF(RC[-18]="",,"|n"&R1C15&RC[-18])&IF(RC[-17]="",,"|n"&R1C16&RC[-17])&IF(RC[-16]="",,"|n"&R1C17&RC[-16])&IF(RC[-15]="",,"|n"&R1C18&RC[-15])&IF(RC[-14]="",,"|n"&R1C19&RC[-14])&IF(RC[-13]="",,"|n"&R1C20&RC[-13])&IF(RC[-12]="",,"|n"&R1C21&RC[-12])&IF(RC[-10]="",,"|n"&R1C23&RC[-10])&IF(RC[-9]="",,"|n"&R1C24&RC[-9])&IF(RC[-8]="",,"|n"&R1C25&RC[-8])&IF(RC[-7]="",,"|n"&R1C26&RC[-7])&IF(RC[-6]="",,"|n"&R1C27&RC[-6])&IF(RC[-5]="",,"|n"&R1C28&RC[-5])&IF(RC[-2]="",,"|n"&RC[-2]) -> 
AG1461: =IF(RC[-26]&RC[-25]&RC[-24]&RC[-23]&RC[-22]&RC[-21]="",,R1C6)&IF(RC[-26]="",,"|n"&R1C7&RC[-26])&IF(RC[-25]="",,"|n"&R1C8&RC[-25])&IF(RC[-24]="",,"|n"&R1C9&RC[-24])&IF(RC[-23]="",,"|n"&R1C10&RC[-23])&IF(RC[-22]="",,"|n"&R1C11&RC[-22])&IF(RC[-21]="",,"|n"&R1C12&RC[-21])&IF(RC[-19]&RC[-18]&RC[-17]&RC[-16]="",,"|n"&R1C13)&IF(RC[-19]="",,"|n"&R1C14&RC[-19])&IF(RC[-18]="",,"|n"&R1C15&RC[-18])&IF(RC[-17]="",,"|n"&R1C16&RC[-17])&IF(RC[-16]="",,"|n"&R1C17&RC[-16])&IF(RC[-15]="",,"|n"&R1C18&RC[-15])&IF(RC[-14]="",,"|n"&R1C19&RC[-14])&IF(RC[-13]="",,"|n"&R1C20&RC[-13])&IF(RC[-12]="",,"|n"&R1C21&RC[-12])&IF(RC[-10]="",,"|n"&R1C23&RC[-10])&IF(RC[-9]="",,"|n"&R1C24&RC[-9])&IF(RC[-8]="",,"|n"&R1C25&RC[-8])&IF(RC[-7]="",,"|n"&R1C26&RC[-7])&IF(RC[-6]="",,"|n"&R1C27&RC[-6])&IF(RC[-5]="",,"|n"&R1C28&RC[-5])&IF(RC[-2]="",,"|n"&RC[-2]) -> 
AG1462: =IF(RC[-26]&RC[-25]&RC[-24]&RC[-23]&RC[-22]&RC[-21]="",,R1C6)&IF(RC[-26]="",,"|n"&R1C7&RC[-26])&IF(RC[-25]="",,"|n"&R1C8&RC[-25])&IF(RC[-24]="",,"|n"&R1C9&RC[-24])&IF(RC[-23]="",,"|n"&R1C10&RC[-23])&IF(RC[-22]="",,"|n"&R1C11&RC[-22])&IF(RC[-21]="",,"|n"&R1C12&RC[-21])&IF(RC[-19]&RC[-18]&RC[-17]&RC[-16]="",,"|n"&R1C13)&IF(RC[-19]="",,"|n"&R1C14&RC[-19])&IF(RC[-18]="",,"|n"&R1C15&RC[-18])&IF(RC[-17]="",,"|n"&R1C16&RC[-17])&IF(RC[-16]="",,"|n"&R1C17&RC[-16])&IF(RC[-15]="",,"|n"&R1C18&RC[-15])&IF(RC[-14]="",,"|n"&R1C19&RC[-14])&IF(RC[-13]="",,"|n"&R1C20&RC[-13])&IF(RC[-12]="",,"|n"&R1C21&RC[-12])&IF(RC[-10]="",,"|n"&R1C23&RC[-10])&IF(RC[-9]="",,"|n"&R1C24&RC[-9])&IF(RC[-8]="",,"|n"&R1C25&RC[-8])&IF(RC[-7]="",,"|n"&R1C26&RC[-7])&IF(RC[-6]="",,"|n"&R1C27&RC[-6])&IF(RC[-5]="",,"|n"&R1C28&RC[-5])&IF(RC[-2]="",,"|n"&RC[-2]) -> 
AG1463: =IF(RC[-26]&RC[-25]&RC[-24]&RC[-23]&RC[-22]&RC[-21]="",,R1C6)&IF(RC[-26]="",,"|n"&R1C7&RC[-26])&IF(RC[-25]="",,"|n"&R1C8&RC[-25])&IF(RC[-24]="",,"|n"&R1C9&RC[-24])&IF(RC[-23]="",,"|n"&R1C10&RC[-23])&IF(RC[-22]="",,"|n"&R1C11&RC[-22])&IF(RC[-21]="",,"|n"&R1C12&RC[-21])&IF(RC[-19]&RC[-18]&RC[-17]&RC[-16]="",,"|n"&R1C13)&IF(RC[-19]="",,"|n"&R1C14&RC[-19])&IF(RC[-18]="",,"|n"&R1C15&RC[-18])&IF(RC[-17]="",,"|n"&R1C16&RC[-17])&IF(RC[-16]="",,"|n"&R1C17&RC[-16])&IF(RC[-15]="",,"|n"&R1C18&RC[-15])&IF(RC[-14]="",,"|n"&R1C19&RC[-14])&IF(RC[-13]="",,"|n"&R1C20&RC[-13])&IF(RC[-12]="",,"|n"&R1C21&RC[-12])&IF(RC[-10]="",,"|n"&R1C23&RC[-10])&IF(RC[-9]="",,"|n"&R1C24&RC[-9])&IF(RC[-8]="",,"|n"&R1C25&RC[-8])&IF(RC[-7]="",,"|n"&R1C26&RC[-7])&IF(RC[-6]="",,"|n"&R1C27&RC[-6])&IF(RC[-5]="",,"|n"&R1C28&RC[-5])&IF(RC[-2]="",,"|n"&RC[-2]) -> 
AG1464: =IF(RC[-26]&RC[-25]&RC[-24]&RC[-23]&RC[-22]&RC[-21]="",,R1C6)&IF(RC[-26]="",,"|n"&R1C7&RC[-26])&IF(RC[-25]="",,"|n"&R1C8&RC[-25])&IF(RC[-24]="",,"|n"&R1C9&RC[-24])&IF(RC[-23]="",,"|n"&R1C10&RC[-23])&IF(RC[-22]="",,"|n"&R1C11&RC[-22])&IF(RC[-21]="",,"|n"&R1C12&RC[-21])&IF(RC[-19]&RC[-18]&RC[-17]&RC[-16]="",,"|n"&R1C13)&IF(RC[-19]="",,"|n"&R1C14&RC[-19])&IF(RC[-18]="",,"|n"&R1C15&RC[-18])&IF(RC[-17]="",,"|n"&R1C16&RC[-17])&IF(RC[-16]="",,"|n"&R1C17&RC[-16])&IF(RC[-15]="",,"|n"&R1C18&RC[-15])&IF(RC[-14]="",,"|n"&R1C19&RC[-14])&IF(RC[-13]="",,"|n"&R1C20&RC[-13])&IF(RC[-12]="",,"|n"&R1C21&RC[-12])&IF(RC[-10]="",,"|n"&R1C23&RC[-10])&IF(RC[-9]="",,"|n"&R1C24&RC[-9])&IF(RC[-8]="",,"|n"&R1C25&RC[-8])&IF(RC[-7]="",,"|n"&R1C26&RC[-7])&IF(RC[-6]="",,"|n"&R1C27&RC[-6])&IF(RC[-5]="",,"|n"&R1C28&RC[-5])&IF(RC[-2]="",,"|n"&RC[-2]) -> 
AG1465: =IF(RC[-26]&RC[-25]&RC[-24]&RC[-23]&RC[-22]&RC[-21]="",,R1C6)&IF(RC[-26]="",,"|n"&R1C7&RC[-26])&IF(RC[-25]="",,"|n"&R1C8&RC[-25])&IF(RC[-24]="",,"|n"&R1C9&RC[-24])&IF(RC[-23]="",,"|n"&R1C10&RC[-23])&IF(RC[-22]="",,"|n"&R1C11&RC[-22])&IF(RC[-21]="",,"|n"&R1C12&RC[-21])&IF(RC[-19]&RC[-18]&RC[-17]&RC[-16]="",,"|n"&R1C13)&IF(RC[-19]="",,"|n"&R1C14&RC[-19])&IF(RC[-18]="",,"|n"&R1C15&RC[-18])&IF(RC[-17]="",,"|n"&R1C16&RC[-17])&IF(RC[-16]="",,"|n"&R1C17&RC[-16])&IF(RC[-15]="",,"|n"&R1C18&RC[-15])&IF(RC[-14]="",,"|n"&R1C19&RC[-14])&IF(RC[-13]="",,"|n"&R1C20&RC[-13])&IF(RC[-12]="",,"|n"&R1C21&RC[-12])&IF(RC[-10]="",,"|n"&R1C23&RC[-10])&IF(RC[-9]="",,"|n"&R1C24&RC[-9])&IF(RC[-8]="",,"|n"&R1C25&RC[-8])&IF(RC[-7]="",,"|n"&R1C26&RC[-7])&IF(RC[-6]="",,"|n"&R1C27&RC[-6])&IF(RC[-5]="",,"|n"&R1C28&RC[-5])&IF(RC[-2]="",,"|n"&RC[-2]) -> 
AG1466: =IF(RC[-26]&RC[-25]&RC[-24]&RC[-23]&RC[-22]&RC[-21]="",,R1C6)&IF(RC[-26]="",,"|n"&R1C7&RC[-26])&IF(RC[-25]="",,"|n"&R1C8&RC[-25])&IF(RC[-24]="",,"|n"&R1C9&RC[-24])&IF(RC[-23]="",,"|n"&R1C10&RC[-23])&IF(RC[-22]="",,"|n"&R1C11&RC[-22])&IF(RC[-21]="",,"|n"&R1C12&RC[-21])&IF(RC[-19]&RC[-18]&RC[-17]&RC[-16]="",,"|n"&R1C13)&IF(RC[-19]="",,"|n"&R1C14&RC[-19])&IF(RC[-18]="",,"|n"&R1C15&RC[-18])&IF(RC[-17]="",,"|n"&R1C16&RC[-17])&IF(RC[-16]="",,"|n"&R1C17&RC[-16])&IF(RC[-15]="",,"|n"&R1C18&RC[-15])&IF(RC[-14]="",,"|n"&R1C19&RC[-14])&IF(RC[-13]="",,"|n"&R1C20&RC[-13])&IF(RC[-12]="",,"|n"&R1C21&RC[-12])&IF(RC[-10]="",,"|n"&R1C23&RC[-10])&IF(RC[-9]="",,"|n"&R1C24&RC[-9])&IF(RC[-8]="",,"|n"&R1C25&RC[-8])&IF(RC[-7]="",,"|n"&R1C26&RC[-7])&IF(RC[-6]="",,"|n"&R1C27&RC[-6])&IF(RC[-5]="",,"|n"&R1C28&RC[-5])&IF(RC[-2]="",,"|n"&RC[-2]) -> 
AG1467: =IF(RC[-26]&RC[-25]&RC[-24]&RC[-23]&RC[-22]&RC[-21]="",,R1C6)&IF(RC[-26]="",,"|n"&R1C7&RC[-26])&IF(RC[-25]="",,"|n"&R1C8&RC[-25])&IF(RC[-24]="",,"|n"&R1C9&RC[-24])&IF(RC[-23]="",,"|n"&R1C10&RC[-23])&IF(RC[-22]="",,"|n"&R1C11&RC[-22])&IF(RC[-21]="",,"|n"&R1C12&RC[-21])&IF(RC[-19]&RC[-18]&RC[-17]&RC[-16]="",,"|n"&R1C13)&IF(RC[-19]="",,"|n"&R1C14&RC[-19])&IF(RC[-18]="",,"|n"&R1C15&RC[-18])&IF(RC[-17]="",,"|n"&R1C16&RC[-17])&IF(RC[-16]="",,"|n"&R1C17&RC[-16])&IF(RC[-15]="",,"|n"&R1C18&RC[-15])&IF(RC[-14]="",,"|n"&R1C19&RC[-14])&IF(RC[-13]="",,"|n"&R1C20&RC[-13])&IF(RC[-12]="",,"|n"&R1C21&RC[-12])&IF(RC[-10]="",,"|n"&R1C23&RC[-10])&IF(RC[-9]="",,"|n"&R1C24&RC[-9])&IF(RC[-8]="",,"|n"&R1C25&RC[-8])&IF(RC[-7]="",,"|n"&R1C26&RC[-7])&IF(RC[-6]="",,"|n"&R1C27&RC[-6])&IF(RC[-5]="",,"|n"&R1C28&RC[-5])&IF(RC[-2]="",,"|n"&RC[-2]) -> 
AG1468: =IF(RC[-26]&RC[-25]&RC[-24]&RC[-23]&RC[-22]&RC[-21]="",,R1C6)&IF(RC[-26]="",,"|n"&R1C7&RC[-26])&IF(RC[-25]="",,"|n"&R1C8&RC[-25])&IF(RC[-24]="",,"|n"&R1C9&RC[-24])&IF(RC[-23]="",,"|n"&R1C10&RC[-23])&IF(RC[-22]="",,"|n"&R1C11&RC[-22])&IF(RC[-21]="",,"|n"&R1C12&RC[-21])&IF(RC[-19]&RC[-18]&RC[-17]&RC[-16]="",,"|n"&R1C13)&IF(RC[-19]="",,"|n"&R1C14&RC[-19])&IF(RC[-18]="",,"|n"&R1C15&RC[-18])&IF(RC[-17]="",,"|n"&R1C16&RC[-17])&IF(RC[-16]="",,"|n"&R1C17&RC[-16])&IF(RC[-15]="",,"|n"&R1C18&RC[-15])&IF(RC[-14]="",,"|n"&R1C19&RC[-14])&IF(RC[-13]="",,"|n"&R1C20&RC[-13])&IF(RC[-12]="",,"|n"&R1C21&RC[-12])&IF(RC[-10]="",,"|n"&R1C23&RC[-10])&IF(RC[-9]="",,"|n"&R1C24&RC[-9])&IF(RC[-8]="",,"|n"&R1C25&RC[-8])&IF(RC[-7]="",,"|n"&R1C26&RC[-7])&IF(RC[-6]="",,"|n"&R1C27&RC[-6])&IF(RC[-5]="",,"|n"&R1C28&RC[-5])&IF(RC[-2]="",,"|n"&RC[-2]) -> 
AG1469: =IF(RC[-26]&RC[-25]&RC[-24]&RC[-23]&RC[-22]&RC[-21]="",,R1C6)&IF(RC[-26]="",,"|n"&R1C7&RC[-26])&IF(RC[-25]="",,"|n"&R1C8&RC[-25])&IF(RC[-24]="",,"|n"&R1C9&RC[-24])&IF(RC[-23]="",,"|n"&R1C10&RC[-23])&IF(RC[-22]="",,"|n"&R1C11&RC[-22])&IF(RC[-21]="",,"|n"&R1C12&RC[-21])&IF(RC[-19]&RC[-18]&RC[-17]&RC[-16]="",,"|n"&R1C13)&IF(RC[-19]="",,"|n"&R1C14&RC[-19])&IF(RC[-18]="",,"|n"&R1C15&RC[-18])&IF(RC[-17]="",,"|n"&R1C16&RC[-17])&IF(RC[-16]="",,"|n"&R1C17&RC[-16])&IF(RC[-15]="",,"|n"&R1C18&RC[-15])&IF(RC[-14]="",,"|n"&R1C19&RC[-14])&IF(RC[-13]="",,"|n"&R1C20&RC[-13])&IF(RC[-12]="",,"|n"&R1C21&RC[-12])&IF(RC[-10]="",,"|n"&R1C23&RC[-10])&IF(RC[-9]="",,"|n"&R1C24&RC[-9])&IF(RC[-8]="",,"|n"&R1C25&RC[-8])&IF(RC[-7]="",,"|n"&R1C26&RC[-7])&IF(RC[-6]="",,"|n"&R1C27&RC[-6])&IF(RC[-5]="",,"|n"&R1C28&RC[-5])&IF(RC[-2]="",,"|n"&RC[-2]) -> 
AG1470: =IF(RC[-26]&RC[-25]&RC[-24]&RC[-23]&RC[-22]&RC[-21]="",,R1C6)&IF(RC[-26]="",,"|n"&R1C7&RC[-26])&IF(RC[-25]="",,"|n"&R1C8&RC[-25])&IF(RC[-24]="",,"|n"&R1C9&RC[-24])&IF(RC[-23]="",,"|n"&R1C10&RC[-23])&IF(RC[-22]="",,"|n"&R1C11&RC[-22])&IF(RC[-21]="",,"|n"&R1C12&RC[-21])&IF(RC[-19]&RC[-18]&RC[-17]&RC[-16]="",,"|n"&R1C13)&IF(RC[-19]="",,"|n"&R1C14&RC[-19])&IF(RC[-18]="",,"|n"&R1C15&RC[-18])&IF(RC[-17]="",,"|n"&R1C16&RC[-17])&IF(RC[-16]="",,"|n"&R1C17&RC[-16])&IF(RC[-15]="",,"|n"&R1C18&RC[-15])&IF(RC[-14]="",,"|n"&R1C19&RC[-14])&IF(RC[-13]="",,"|n"&R1C20&RC[-13])&IF(RC[-12]="",,"|n"&R1C21&RC[-12])&IF(RC[-10]="",,"|n"&R1C23&RC[-10])&IF(RC[-9]="",,"|n"&R1C24&RC[-9])&IF(RC[-8]="",,"|n"&R1C25&RC[-8])&IF(RC[-7]="",,"|n"&R1C26&RC[-7])&IF(RC[-6]="",,"|n"&R1C27&RC[-6])&IF(RC[-5]="",,"|n"&R1C28&RC[-5])&IF(RC[-2]="",,"|n"&RC[-2]) -> 
AG1471: =IF(RC[-26]&RC[-25]&RC[-24]&RC[-23]&RC[-22]&RC[-21]="",,R1C6)&IF(RC[-26]="",,"|n"&R1C7&RC[-26])&IF(RC[-25]="",,"|n"&R1C8&RC[-25])&IF(RC[-24]="",,"|n"&R1C9&RC[-24])&IF(RC[-23]="",,"|n"&R1C10&RC[-23])&IF(RC[-22]="",,"|n"&R1C11&RC[-22])&IF(RC[-21]="",,"|n"&R1C12&RC[-21])&IF(RC[-19]&RC[-18]&RC[-17]&RC[-16]="",,"|n"&R1C13)&IF(RC[-19]="",,"|n"&R1C14&RC[-19])&IF(RC[-18]="",,"|n"&R1C15&RC[-18])&IF(RC[-17]="",,"|n"&R1C16&RC[-17])&IF(RC[-16]="",,"|n"&R1C17&RC[-16])&IF(RC[-15]="",,"|n"&R1C18&RC[-15])&IF(RC[-14]="",,"|n"&R1C19&RC[-14])&IF(RC[-13]="",,"|n"&R1C20&RC[-13])&IF(RC[-12]="",,"|n"&R1C21&RC[-12])&IF(RC[-10]="",,"|n"&R1C23&RC[-10])&IF(RC[-9]="",,"|n"&R1C24&RC[-9])&IF(RC[-8]="",,"|n"&R1C25&RC[-8])&IF(RC[-7]="",,"|n"&R1C26&RC[-7])&IF(RC[-6]="",,"|n"&R1C27&RC[-6])&IF(RC[-5]="",,"|n"&R1C28&RC[-5])&IF(RC[-2]="",,"|n"&RC[-2]) -> 
AG1472: =IF(RC[-26]&RC[-25]&RC[-24]&RC[-23]&RC[-22]&RC[-21]="",,R1C6)&IF(RC[-26]="",,"|n"&R1C7&RC[-26])&IF(RC[-25]="",,"|n"&R1C8&RC[-25])&IF(RC[-24]="",,"|n"&R1C9&RC[-24])&IF(RC[-23]="",,"|n"&R1C10&RC[-23])&IF(RC[-22]="",,"|n"&R1C11&RC[-22])&IF(RC[-21]="",,"|n"&R1C12&RC[-21])&IF(RC[-19]&RC[-18]&RC[-17]&RC[-16]="",,"|n"&R1C13)&IF(RC[-19]="",,"|n"&R1C14&RC[-19])&IF(RC[-18]="",,"|n"&R1C15&RC[-18])&IF(RC[-17]="",,"|n"&R1C16&RC[-17])&IF(RC[-16]="",,"|n"&R1C17&RC[-16])&IF(RC[-15]="",,"|n"&R1C18&RC[-15])&IF(RC[-14]="",,"|n"&R1C19&RC[-14])&IF(RC[-13]="",,"|n"&R1C20&RC[-13])&IF(RC[-12]="",,"|n"&R1C21&RC[-12])&IF(RC[-10]="",,"|n"&R1C23&RC[-10])&IF(RC[-9]="",,"|n"&R1C24&RC[-9])&IF(RC[-8]="",,"|n"&R1C25&RC[-8])&IF(RC[-7]="",,"|n"&R1C26&RC[-7])&IF(RC[-6]="",,"|n"&R1C27&RC[-6])&IF(RC[-5]="",,"|n"&R1C28&RC[-5])&IF(RC[-2]="",,"|n"&RC[-2]) -> 
AG1473: =IF(RC[-26]&RC[-25]&RC[-24]&RC[-23]&RC[-22]&RC[-21]="",,R1C6)&IF(RC[-26]="",,"|n"&R1C7&RC[-26])&IF(RC[-25]="",,"|n"&R1C8&RC[-25])&IF(RC[-24]="",,"|n"&R1C9&RC[-24])&IF(RC[-23]="",,"|n"&R1C10&RC[-23])&IF(RC[-22]="",,"|n"&R1C11&RC[-22])&IF(RC[-21]="",,"|n"&R1C12&RC[-21])&IF(RC[-19]&RC[-18]&RC[-17]&RC[-16]="",,"|n"&R1C13)&IF(RC[-19]="",,"|n"&R1C14&RC[-19])&IF(RC[-18]="",,"|n"&R1C15&RC[-18])&IF(RC[-17]="",,"|n"&R1C16&RC[-17])&IF(RC[-16]="",,"|n"&R1C17&RC[-16])&IF(RC[-15]="",,"|n"&R1C18&RC[-15])&IF(RC[-14]="",,"|n"&R1C19&RC[-14])&IF(RC[-13]="",,"|n"&R1C20&RC[-13])&IF(RC[-12]="",,"|n"&R1C21&RC[-12])&IF(RC[-10]="",,"|n"&R1C23&RC[-10])&IF(RC[-9]="",,"|n"&R1C24&RC[-9])&IF(RC[-8]="",,"|n"&R1C25&RC[-8])&IF(RC[-7]="",,"|n"&R1C26&RC[-7])&IF(RC[-6]="",,"|n"&R1C27&RC[-6])&IF(RC[-5]="",,"|n"&R1C28&RC[-5])&IF(RC[-2]="",,"|n"&RC[-2]) -> 
AG1474: =IF(RC[-26]&RC[-25]&RC[-24]&RC[-23]&RC[-22]&RC[-21]="",,R1C6)&IF(RC[-26]="",,"|n"&R1C7&RC[-26])&IF(RC[-25]="",,"|n"&R1C8&RC[-25])&IF(RC[-24]="",,"|n"&R1C9&RC[-24])&IF(RC[-23]="",,"|n"&R1C10&RC[-23])&IF(RC[-22]="",,"|n"&R1C11&RC[-22])&IF(RC[-21]="",,"|n"&R1C12&RC[-21])&IF(RC[-19]&RC[-18]&RC[-17]&RC[-16]="",,"|n"&R1C13)&IF(RC[-19]="",,"|n"&R1C14&RC[-19])&IF(RC[-18]="",,"|n"&R1C15&RC[-18])&IF(RC[-17]="",,"|n"&R1C16&RC[-17])&IF(RC[-16]="",,"|n"&R1C17&RC[-16])&IF(RC[-15]="",,"|n"&R1C18&RC[-15])&IF(RC[-14]="",,"|n"&R1C19&RC[-14])&IF(RC[-13]="",,"|n"&R1C20&RC[-13])&IF(RC[-12]="",,"|n"&R1C21&RC[-12])&IF(RC[-10]="",,"|n"&R1C23&RC[-10])&IF(RC[-9]="",,"|n"&R1C24&RC[-9])&IF(RC[-8]="",,"|n"&R1C25&RC[-8])&IF(RC[-7]="",,"|n"&R1C26&RC[-7])&IF(RC[-6]="",,"|n"&R1C27&RC[-6])&IF(RC[-5]="",,"|n"&R1C28&RC[-5])&IF(RC[-2]="",,"|n"&RC[-2]) -> 
AG1475: =IF(RC[-26]&RC[-25]&RC[-24]&RC[-23]&RC[-22]&RC[-21]="",,R1C6)&IF(RC[-26]="",,"|n"&R1C7&RC[-26])&IF(RC[-25]="",,"|n"&R1C8&RC[-25])&IF(RC[-24]="",,"|n"&R1C9&RC[-24])&IF(RC[-23]="",,"|n"&R1C10&RC[-23])&IF(RC[-22]="",,"|n"&R1C11&RC[-22])&IF(RC[-21]="",,"|n"&R1C12&RC[-21])&IF(RC[-19]&RC[-18]&RC[-17]&RC[-16]="",,"|n"&R1C13)&IF(RC[-19]="",,"|n"&R1C14&RC[-19])&IF(RC[-18]="",,"|n"&R1C15&RC[-18])&IF(RC[-17]="",,"|n"&R1C16&RC[-17])&IF(RC[-16]="",,"|n"&R1C17&RC[-16])&IF(RC[-15]="",,"|n"&R1C18&RC[-15])&IF(RC[-14]="",,"|n"&R1C19&RC[-14])&IF(RC[-13]="",,"|n"&R1C20&RC[-13])&IF(RC[-12]="",,"|n"&R1C21&RC[-12])&IF(RC[-10]="",,"|n"&R1C23&RC[-10])&IF(RC[-9]="",,"|n"&R1C24&RC[-9])&IF(RC[-8]="",,"|n"&R1C25&RC[-8])&IF(RC[-7]="",,"|n"&R1C26&RC[-7])&IF(RC[-6]="",,"|n"&R1C27&RC[-6])&IF(RC[-5]="",,"|n"&R1C28&RC[-5])&IF(RC[-2]="",,"|n"&RC[-2]) -> 
AG1476: =IF(RC[-26]&RC[-25]&RC[-24]&RC[-23]&RC[-22]&RC[-21]="",,R1C6)&IF(RC[-26]="",,"|n"&R1C7&RC[-26])&IF(RC[-25]="",,"|n"&R1C8&RC[-25])&IF(RC[-24]="",,"|n"&R1C9&RC[-24])&IF(RC[-23]="",,"|n"&R1C10&RC[-23])&IF(RC[-22]="",,"|n"&R1C11&RC[-22])&IF(RC[-21]="",,"|n"&R1C12&RC[-21])&IF(RC[-19]&RC[-18]&RC[-17]&RC[-16]="",,"|n"&R1C13)&IF(RC[-19]="",,"|n"&R1C14&RC[-19])&IF(RC[-18]="",,"|n"&R1C15&RC[-18])&IF(RC[-17]="",,"|n"&R1C16&RC[-17])&IF(RC[-16]="",,"|n"&R1C17&RC[-16])&IF(RC[-15]="",,"|n"&R1C18&RC[-15])&IF(RC[-14]="",,"|n"&R1C19&RC[-14])&IF(RC[-13]="",,"|n"&R1C20&RC[-13])&IF(RC[-12]="",,"|n"&R1C21&RC[-12])&IF(RC[-10]="",,"|n"&R1C23&RC[-10])&IF(RC[-9]="",,"|n"&R1C24&RC[-9])&IF(RC[-8]="",,"|n"&R1C25&RC[-8])&IF(RC[-7]="",,"|n"&R1C26&RC[-7])&IF(RC[-6]="",,"|n"&R1C27&RC[-6])&IF(RC[-5]="",,"|n"&R1C28&RC[-5])&IF(RC[-2]="",,"|n"&RC[-2]) -> 
AG1477: =IF(RC[-26]&RC[-25]&RC[-24]&RC[-23]&RC[-22]&RC[-21]="",,R1C6)&IF(RC[-26]="",,"|n"&R1C7&RC[-26])&IF(RC[-25]="",,"|n"&R1C8&RC[-25])&IF(RC[-24]="",,"|n"&R1C9&RC[-24])&IF(RC[-23]="",,"|n"&R1C10&RC[-23])&IF(RC[-22]="",,"|n"&R1C11&RC[-22])&IF(RC[-21]="",,"|n"&R1C12&RC[-21])&IF(RC[-19]&RC[-18]&RC[-17]&RC[-16]="",,"|n"&R1C13)&IF(RC[-19]="",,"|n"&R1C14&RC[-19])&IF(RC[-18]="",,"|n"&R1C15&RC[-18])&IF(RC[-17]="",,"|n"&R1C16&RC[-17])&IF(RC[-16]="",,"|n"&R1C17&RC[-16])&IF(RC[-15]="",,"|n"&R1C18&RC[-15])&IF(RC[-14]="",,"|n"&R1C19&RC[-14])&IF(RC[-13]="",,"|n"&R1C20&RC[-13])&IF(RC[-12]="",,"|n"&R1C21&RC[-12])&IF(RC[-10]="",,"|n"&R1C23&RC[-10])&IF(RC[-9]="",,"|n"&R1C24&RC[-9])&IF(RC[-8]="",,"|n"&R1C25&RC[-8])&IF(RC[-7]="",,"|n"&R1C26&RC[-7])&IF(RC[-6]="",,"|n"&R1C27&RC[-6])&IF(RC[-5]="",,"|n"&R1C28&RC[-5])&IF(RC[-2]="",,"|n"&RC[-2]) -> 
AG1478: =IF(RC[-26]&RC[-25]&RC[-24]&RC[-23]&RC[-22]&RC[-21]="",,R1C6)&IF(RC[-26]="",,"|n"&R1C7&RC[-26])&IF(RC[-25]="",,"|n"&R1C8&RC[-25])&IF(RC[-24]="",,"|n"&R1C9&RC[-24])&IF(RC[-23]="",,"|n"&R1C10&RC[-23])&IF(RC[-22]="",,"|n"&R1C11&RC[-22])&IF(RC[-21]="",,"|n"&R1C12&RC[-21])&IF(RC[-19]&RC[-18]&RC[-17]&RC[-16]="",,"|n"&R1C13)&IF(RC[-19]="",,"|n"&R1C14&RC[-19])&IF(RC[-18]="",,"|n"&R1C15&RC[-18])&IF(RC[-17]="",,"|n"&R1C16&RC[-17])&IF(RC[-16]="",,"|n"&R1C17&RC[-16])&IF(RC[-15]="",,"|n"&R1C18&RC[-15])&IF(RC[-14]="",,"|n"&R1C19&RC[-14])&IF(RC[-13]="",,"|n"&R1C20&RC[-13])&IF(RC[-12]="",,"|n"&R1C21&RC[-12])&IF(RC[-10]="",,"|n"&R1C23&RC[-10])&IF(RC[-9]="",,"|n"&R1C24&RC[-9])&IF(RC[-8]="",,"|n"&R1C25&RC[-8])&IF(RC[-7]="",,"|n"&R1C26&RC[-7])&IF(RC[-6]="",,"|n"&R1C27&RC[-6])&IF(RC[-5]="",,"|n"&R1C28&RC[-5])&IF(RC[-2]="",,"|n"&RC[-2]) -> 
AG1479: =IF(RC[-26]&RC[-25]&RC[-24]&RC[-23]&RC[-22]&RC[-21]="",,R1C6)&IF(RC[-26]="",,"|n"&R1C7&RC[-26])&IF(RC[-25]="",,"|n"&R1C8&RC[-25])&IF(RC[-24]="",,"|n"&R1C9&RC[-24])&IF(RC[-23]="",,"|n"&R1C10&RC[-23])&IF(RC[-22]="",,"|n"&R1C11&RC[-22])&IF(RC[-21]="",,"|n"&R1C12&RC[-21])&IF(RC[-19]&RC[-18]&RC[-17]&RC[-16]="",,"|n"&R1C13)&IF(RC[-19]="",,"|n"&R1C14&RC[-19])&IF(RC[-18]="",,"|n"&R1C15&RC[-18])&IF(RC[-17]="",,"|n"&R1C16&RC[-17])&IF(RC[-16]="",,"|n"&R1C17&RC[-16])&IF(RC[-15]="",,"|n"&R1C18&RC[-15])&IF(RC[-14]="",,"|n"&R1C19&RC[-14])&IF(RC[-13]="",,"|n"&R1C20&RC[-13])&IF(RC[-12]="",,"|n"&R1C21&RC[-12])&IF(RC[-10]="",,"|n"&R1C23&RC[-10])&IF(RC[-9]="",,"|n"&R1C24&RC[-9])&IF(RC[-8]="",,"|n"&R1C25&RC[-8])&IF(RC[-7]="",,"|n"&R1C26&RC[-7])&IF(RC[-6]="",,"|n"&R1C27&RC[-6])&IF(RC[-5]="",,"|n"&R1C28&RC[-5])&IF(RC[-2]="",,"|n"&RC[-2]) -> 
AG1480: =IF(RC[-26]&RC[-25]&RC[-24]&RC[-23]&RC[-22]&RC[-21]="",,R1C6)&IF(RC[-26]="",,"|n"&R1C7&RC[-26])&IF(RC[-25]="",,"|n"&R1C8&RC[-25])&IF(RC[-24]="",,"|n"&R1C9&RC[-24])&IF(RC[-23]="",,"|n"&R1C10&RC[-23])&IF(RC[-22]="",,"|n"&R1C11&RC[-22])&IF(RC[-21]="",,"|n"&R1C12&RC[-21])&IF(RC[-19]&RC[-18]&RC[-17]&RC[-16]="",,"|n"&R1C13)&IF(RC[-19]="",,"|n"&R1C14&RC[-19])&IF(RC[-18]="",,"|n"&R1C15&RC[-18])&IF(RC[-17]="",,"|n"&R1C16&RC[-17])&IF(RC[-16]="",,"|n"&R1C17&RC[-16])&IF(RC[-15]="",,"|n"&R1C18&RC[-15])&IF(RC[-14]="",,"|n"&R1C19&RC[-14])&IF(RC[-13]="",,"|n"&R1C20&RC[-13])&IF(RC[-12]="",,"|n"&R1C21&RC[-12])&IF(RC[-10]="",,"|n"&R1C23&RC[-10])&IF(RC[-9]="",,"|n"&R1C24&RC[-9])&IF(RC[-8]="",,"|n"&R1C25&RC[-8])&IF(RC[-7]="",,"|n"&R1C26&RC[-7])&IF(RC[-6]="",,"|n"&R1C27&RC[-6])&IF(RC[-5]="",,"|n"&R1C28&RC[-5])&IF(RC[-2]="",,"|n"&RC[-2]) -> 
AG1481: =IF(RC[-26]&RC[-25]&RC[-24]&RC[-23]&RC[-22]&RC[-21]="",,R1C6)&IF(RC[-26]="",,"|n"&R1C7&RC[-26])&IF(RC[-25]="",,"|n"&R1C8&RC[-25])&IF(RC[-24]="",,"|n"&R1C9&RC[-24])&IF(RC[-23]="",,"|n"&R1C10&RC[-23])&IF(RC[-22]="",,"|n"&R1C11&RC[-22])&IF(RC[-21]="",,"|n"&R1C12&RC[-21])&IF(RC[-19]&RC[-18]&RC[-17]&RC[-16]="",,"|n"&R1C13)&IF(RC[-19]="",,"|n"&R1C14&RC[-19])&IF(RC[-18]="",,"|n"&R1C15&RC[-18])&IF(RC[-17]="",,"|n"&R1C16&RC[-17])&IF(RC[-16]="",,"|n"&R1C17&RC[-16])&IF(RC[-15]="",,"|n"&R1C18&RC[-15])&IF(RC[-14]="",,"|n"&R1C19&RC[-14])&IF(RC[-13]="",,"|n"&R1C20&RC[-13])&IF(RC[-12]="",,"|n"&R1C21&RC[-12])&IF(RC[-10]="",,"|n"&R1C23&RC[-10])&IF(RC[-9]="",,"|n"&R1C24&RC[-9])&IF(RC[-8]="",,"|n"&R1C25&RC[-8])&IF(RC[-7]="",,"|n"&R1C26&RC[-7])&IF(RC[-6]="",,"|n"&R1C27&RC[-6])&IF(RC[-5]="",,"|n"&R1C28&RC[-5])&IF(RC[-2]="",,"|n"&RC[-2]) -> 
AG1482: =IF(RC[-26]&RC[-25]&RC[-24]&RC[-23]&RC[-22]&RC[-21]="",,R1C6)&IF(RC[-26]="",,"|n"&R1C7&RC[-26])&IF(RC[-25]="",,"|n"&R1C8&RC[-25])&IF(RC[-24]="",,"|n"&R1C9&RC[-24])&IF(RC[-23]="",,"|n"&R1C10&RC[-23])&IF(RC[-22]="",,"|n"&R1C11&RC[-22])&IF(RC[-21]="",,"|n"&R1C12&RC[-21])&IF(RC[-19]&RC[-18]&RC[-17]&RC[-16]="",,"|n"&R1C13)&IF(RC[-19]="",,"|n"&R1C14&RC[-19])&IF(RC[-18]="",,"|n"&R1C15&RC[-18])&IF(RC[-17]="",,"|n"&R1C16&RC[-17])&IF(RC[-16]="",,"|n"&R1C17&RC[-16])&IF(RC[-15]="",,"|n"&R1C18&RC[-15])&IF(RC[-14]="",,"|n"&R1C19&RC[-14])&IF(RC[-13]="",,"|n"&R1C20&RC[-13])&IF(RC[-12]="",,"|n"&R1C21&RC[-12])&IF(RC[-10]="",,"|n"&R1C23&RC[-10])&IF(RC[-9]="",,"|n"&R1C24&RC[-9])&IF(RC[-8]="",,"|n"&R1C25&RC[-8])&IF(RC[-7]="",,"|n"&R1C26&RC[-7])&IF(RC[-6]="",,"|n"&R1C27&RC[-6])&IF(RC[-5]="",,"|n"&R1C28&RC[-5])&IF(RC[-2]="",,"|n"&RC[-2]) -> 
AG1483: =IF(RC[-26]&RC[-25]&RC[-24]&RC[-23]&RC[-22]&RC[-21]="",,R1C6)&IF(RC[-26]="",,"|n"&R1C7&RC[-26])&IF(RC[-25]="",,"|n"&R1C8&RC[-25])&IF(RC[-24]="",,"|n"&R1C9&RC[-24])&IF(RC[-23]="",,"|n"&R1C10&RC[-23])&IF(RC[-22]="",,"|n"&R1C11&RC[-22])&IF(RC[-21]="",,"|n"&R1C12&RC[-21])&IF(RC[-19]&RC[-18]&RC[-17]&RC[-16]="",,"|n"&R1C13)&IF(RC[-19]="",,"|n"&R1C14&RC[-19])&IF(RC[-18]="",,"|n"&R1C15&RC[-18])&IF(RC[-17]="",,"|n"&R1C16&RC[-17])&IF(RC[-16]="",,"|n"&R1C17&RC[-16])&IF(RC[-15]="",,"|n"&R1C18&RC[-15])&IF(RC[-14]="",,"|n"&R1C19&RC[-14])&IF(RC[-13]="",,"|n"&R1C20&RC[-13])&IF(RC[-12]="",,"|n"&R1C21&RC[-12])&IF(RC[-10]="",,"|n"&R1C23&RC[-10])&IF(RC[-9]="",,"|n"&R1C24&RC[-9])&IF(RC[-8]="",,"|n"&R1C25&RC[-8])&IF(RC[-7]="",,"|n"&R1C26&RC[-7])&IF(RC[-6]="",,"|n"&R1C27&RC[-6])&IF(RC[-5]="",,"|n"&R1C28&RC[-5])&IF(RC[-2]="",,"|n"&RC[-2]) -> 
AG1484: =IF(RC[-26]&RC[-25]&RC[-24]&RC[-23]&RC[-22]&RC[-21]="",,R1C6)&IF(RC[-26]="",,"|n"&R1C7&RC[-26])&IF(RC[-25]="",,"|n"&R1C8&RC[-25])&IF(RC[-24]="",,"|n"&R1C9&RC[-24])&IF(RC[-23]="",,"|n"&R1C10&RC[-23])&IF(RC[-22]="",,"|n"&R1C11&RC[-22])&IF(RC[-21]="",,"|n"&R1C12&RC[-21])&IF(RC[-19]&RC[-18]&RC[-17]&RC[-16]="",,"|n"&R1C13)&IF(RC[-19]="",,"|n"&R1C14&RC[-19])&IF(RC[-18]="",,"|n"&R1C15&RC[-18])&IF(RC[-17]="",,"|n"&R1C16&RC[-17])&IF(RC[-16]="",,"|n"&R1C17&RC[-16])&IF(RC[-15]="",,"|n"&R1C18&RC[-15])&IF(RC[-14]="",,"|n"&R1C19&RC[-14])&IF(RC[-13]="",,"|n"&R1C20&RC[-13])&IF(RC[-12]="",,"|n"&R1C21&RC[-12])&IF(RC[-10]="",,"|n"&R1C23&RC[-10])&IF(RC[-9]="",,"|n"&R1C24&RC[-9])&IF(RC[-8]="",,"|n"&R1C25&RC[-8])&IF(RC[-7]="",,"|n"&R1C26&RC[-7])&IF(RC[-6]="",,"|n"&R1C27&RC[-6])&IF(RC[-5]="",,"|n"&R1C28&RC[-5])&IF(RC[-2]="",,"|n"&RC[-2]) -> 
AG1485: =IF(RC[-26]&RC[-25]&RC[-24]&RC[-23]&RC[-22]&RC[-21]="",,R1C6)&IF(RC[-26]="",,"|n"&R1C7&RC[-26])&IF(RC[-25]="",,"|n"&R1C8&RC[-25])&IF(RC[-24]="",,"|n"&R1C9&RC[-24])&IF(RC[-23]="",,"|n"&R1C10&RC[-23])&IF(RC[-22]="",,"|n"&R1C11&RC[-22])&IF(RC[-21]="",,"|n"&R1C12&RC[-21])&IF(RC[-19]&RC[-18]&RC[-17]&RC[-16]="",,"|n"&R1C13)&IF(RC[-19]="",,"|n"&R1C14&RC[-19])&IF(RC[-18]="",,"|n"&R1C15&RC[-18])&IF(RC[-17]="",,"|n"&R1C16&RC[-17])&IF(RC[-16]="",,"|n"&R1C17&RC[-16])&IF(RC[-15]="",,"|n"&R1C18&RC[-15])&IF(RC[-14]="",,"|n"&R1C19&RC[-14])&IF(RC[-13]="",,"|n"&R1C20&RC[-13])&IF(RC[-12]="",,"|n"&R1C21&RC[-12])&IF(RC[-10]="",,"|n"&R1C23&RC[-10])&IF(RC[-9]="",,"|n"&R1C24&RC[-9])&IF(RC[-8]="",,"|n"&R1C25&RC[-8])&IF(RC[-7]="",,"|n"&R1C26&RC[-7])&IF(RC[-6]="",,"|n"&R1C27&RC[-6])&IF(RC[-5]="",,"|n"&R1C28&RC[-5])&IF(RC[-2]="",,"|n"&RC[-2]) -> 
AG1486: =IF(RC[-26]&RC[-25]&RC[-24]&RC[-23]&RC[-22]&RC[-21]="",,R1C6)&IF(RC[-26]="",,"|n"&R1C7&RC[-26])&IF(RC[-25]="",,"|n"&R1C8&RC[-25])&IF(RC[-24]="",,"|n"&R1C9&RC[-24])&IF(RC[-23]="",,"|n"&R1C10&RC[-23])&IF(RC[-22]="",,"|n"&R1C11&RC[-22])&IF(RC[-21]="",,"|n"&R1C12&RC[-21])&IF(RC[-19]&RC[-18]&RC[-17]&RC[-16]="",,"|n"&R1C13)&IF(RC[-19]="",,"|n"&R1C14&RC[-19])&IF(RC[-18]="",,"|n"&R1C15&RC[-18])&IF(RC[-17]="",,"|n"&R1C16&RC[-17])&IF(RC[-16]="",,"|n"&R1C17&RC[-16])&IF(RC[-15]="",,"|n"&R1C18&RC[-15])&IF(RC[-14]="",,"|n"&R1C19&RC[-14])&IF(RC[-13]="",,"|n"&R1C20&RC[-13])&IF(RC[-12]="",,"|n"&R1C21&RC[-12])&IF(RC[-10]="",,"|n"&R1C23&RC[-10])&IF(RC[-9]="",,"|n"&R1C24&RC[-9])&IF(RC[-8]="",,"|n"&R1C25&RC[-8])&IF(RC[-7]="",,"|n"&R1C26&RC[-7])&IF(RC[-6]="",,"|n"&R1C27&RC[-6])&IF(RC[-5]="",,"|n"&R1C28&RC[-5])&IF(RC[-2]="",,"|n"&RC[-2]) -> 
AG1487: =IF(RC[-26]&RC[-25]&RC[-24]&RC[-23]&RC[-22]&RC[-21]="",,R1C6)&IF(RC[-26]="",,"|n"&R1C7&RC[-26])&IF(RC[-25]="",,"|n"&R1C8&RC[-25])&IF(RC[-24]="",,"|n"&R1C9&RC[-24])&IF(RC[-23]="",,"|n"&R1C10&RC[-23])&IF(RC[-22]="",,"|n"&R1C11&RC[-22])&IF(RC[-21]="",,"|n"&R1C12&RC[-21])&IF(RC[-19]&RC[-18]&RC[-17]&RC[-16]="",,"|n"&R1C13)&IF(RC[-19]="",,"|n"&R1C14&RC[-19])&IF(RC[-18]="",,"|n"&R1C15&RC[-18])&IF(RC[-17]="",,"|n"&R1C16&RC[-17])&IF(RC[-16]="",,"|n"&R1C17&RC[-16])&IF(RC[-15]="",,"|n"&R1C18&RC[-15])&IF(RC[-14]="",,"|n"&R1C19&RC[-14])&IF(RC[-13]="",,"|n"&R1C20&RC[-13])&IF(RC[-12]="",,"|n"&R1C21&RC[-12])&IF(RC[-10]="",,"|n"&R1C23&RC[-10])&IF(RC[-9]="",,"|n"&R1C24&RC[-9])&IF(RC[-8]="",,"|n"&R1C25&RC[-8])&IF(RC[-7]="",,"|n"&R1C26&RC[-7])&IF(RC[-6]="",,"|n"&R1C27&RC[-6])&IF(RC[-5]="",,"|n"&R1C28&RC[-5])&IF(RC[-2]="",,"|n"&RC[-2]) -> 
AG1488: =IF(RC[-26]&RC[-25]&RC[-24]&RC[-23]&RC[-22]&RC[-21]="",,R1C6)&IF(RC[-26]="",,"|n"&R1C7&RC[-26])&IF(RC[-25]="",,"|n"&R1C8&RC[-25])&IF(RC[-24]="",,"|n"&R1C9&RC[-24])&IF(RC[-23]="",,"|n"&R1C10&RC[-23])&IF(RC[-22]="",,"|n"&R1C11&RC[-22])&IF(RC[-21]="",,"|n"&R1C12&RC[-21])&IF(RC[-19]&RC[-18]&RC[-17]&RC[-16]="",,"|n"&R1C13)&IF(RC[-19]="",,"|n"&R1C14&RC[-19])&IF(RC[-18]="",,"|n"&R1C15&RC[-18])&IF(RC[-17]="",,"|n"&R1C16&RC[-17])&IF(RC[-16]="",,"|n"&R1C17&RC[-16])&IF(RC[-15]="",,"|n"&R1C18&RC[-15])&IF(RC[-14]="",,"|n"&R1C19&RC[-14])&IF(RC[-13]="",,"|n"&R1C20&RC[-13])&IF(RC[-12]="",,"|n"&R1C21&RC[-12])&IF(RC[-10]="",,"|n"&R1C23&RC[-10])&IF(RC[-9]="",,"|n"&R1C24&RC[-9])&IF(RC[-8]="",,"|n"&R1C25&RC[-8])&IF(RC[-7]="",,"|n"&R1C26&RC[-7])&IF(RC[-6]="",,"|n"&R1C27&RC[-6])&IF(RC[-5]="",,"|n"&R1C28&RC[-5])&IF(RC[-2]="",,"|n"&RC[-2]) -> 
AG1489: =IF(RC[-26]&RC[-25]&RC[-24]&RC[-23]&RC[-22]&RC[-21]="",,R1C6)&IF(RC[-26]="",,"|n"&R1C7&RC[-26])&IF(RC[-25]="",,"|n"&R1C8&RC[-25])&IF(RC[-24]="",,"|n"&R1C9&RC[-24])&IF(RC[-23]="",,"|n"&R1C10&RC[-23])&IF(RC[-22]="",,"|n"&R1C11&RC[-22])&IF(RC[-21]="",,"|n"&R1C12&RC[-21])&IF(RC[-19]&RC[-18]&RC[-17]&RC[-16]="",,"|n"&R1C13)&IF(RC[-19]="",,"|n"&R1C14&RC[-19])&IF(RC[-18]="",,"|n"&R1C15&RC[-18])&IF(RC[-17]="",,"|n"&R1C16&RC[-17])&IF(RC[-16]="",,"|n"&R1C17&RC[-16])&IF(RC[-15]="",,"|n"&R1C18&RC[-15])&IF(RC[-14]="",,"|n"&R1C19&RC[-14])&IF(RC[-13]="",,"|n"&R1C20&RC[-13])&IF(RC[-12]="",,"|n"&R1C21&RC[-12])&IF(RC[-10]="",,"|n"&R1C23&RC[-10])&IF(RC[-9]="",,"|n"&R1C24&RC[-9])&IF(RC[-8]="",,"|n"&R1C25&RC[-8])&IF(RC[-7]="",,"|n"&R1C26&RC[-7])&IF(RC[-6]="",,"|n"&R1C27&RC[-6])&IF(RC[-5]="",,"|n"&R1C28&RC[-5])&IF(RC[-2]="",,"|n"&RC[-2]) -> 
AG1490: =IF(RC[-26]&RC[-25]&RC[-24]&RC[-23]&RC[-22]&RC[-21]="",,R1C6)&IF(RC[-26]="",,"|n"&R1C7&RC[-26])&IF(RC[-25]="",,"|n"&R1C8&RC[-25])&IF(RC[-24]="",,"|n"&R1C9&RC[-24])&IF(RC[-23]="",,"|n"&R1C10&RC[-23])&IF(RC[-22]="",,"|n"&R1C11&RC[-22])&IF(RC[-21]="",,"|n"&R1C12&RC[-21])&IF(RC[-19]&RC[-18]&RC[-17]&RC[-16]="",,"|n"&R1C13)&IF(RC[-19]="",,"|n"&R1C14&RC[-19])&IF(RC[-18]="",,"|n"&R1C15&RC[-18])&IF(RC[-17]="",,"|n"&R1C16&RC[-17])&IF(RC[-16]="",,"|n"&R1C17&RC[-16])&IF(RC[-15]="",,"|n"&R1C18&RC[-15])&IF(RC[-14]="",,"|n"&R1C19&RC[-14])&IF(RC[-13]="",,"|n"&R1C20&RC[-13])&IF(RC[-12]="",,"|n"&R1C21&RC[-12])&IF(RC[-10]="",,"|n"&R1C23&RC[-10])&IF(RC[-9]="",,"|n"&R1C24&RC[-9])&IF(RC[-8]="",,"|n"&R1C25&RC[-8])&IF(RC[-7]="",,"|n"&R1C26&RC[-7])&IF(RC[-6]="",,"|n"&R1C27&RC[-6])&IF(RC[-5]="",,"|n"&R1C28&RC[-5])&IF(RC[-2]="",,"|n"&RC[-2]) -> 
AG1491: =IF(RC[-26]&RC[-25]&RC[-24]&RC[-23]&RC[-22]&RC[-21]="",,R1C6)&IF(RC[-26]="",,"|n"&R1C7&RC[-26])&IF(RC[-25]="",,"|n"&R1C8&RC[-25])&IF(RC[-24]="",,"|n"&R1C9&RC[-24])&IF(RC[-23]="",,"|n"&R1C10&RC[-23])&IF(RC[-22]="",,"|n"&R1C11&RC[-22])&IF(RC[-21]="",,"|n"&R1C12&RC[-21])&IF(RC[-19]&RC[-18]&RC[-17]&RC[-16]="",,"|n"&R1C13)&IF(RC[-19]="",,"|n"&R1C14&RC[-19])&IF(RC[-18]="",,"|n"&R1C15&RC[-18])&IF(RC[-17]="",,"|n"&R1C16&RC[-17])&IF(RC[-16]="",,"|n"&R1C17&RC[-16])&IF(RC[-15]="",,"|n"&R1C18&RC[-15])&IF(RC[-14]="",,"|n"&R1C19&RC[-14])&IF(RC[-13]="",,"|n"&R1C20&RC[-13])&IF(RC[-12]="",,"|n"&R1C21&RC[-12])&IF(RC[-10]="",,"|n"&R1C23&RC[-10])&IF(RC[-9]="",,"|n"&R1C24&RC[-9])&IF(RC[-8]="",,"|n"&R1C25&RC[-8])&IF(RC[-7]="",,"|n"&R1C26&RC[-7])&IF(RC[-6]="",,"|n"&R1C27&RC[-6])&IF(RC[-5]="",,"|n"&R1C28&RC[-5])&IF(RC[-2]="",,"|n"&RC[-2]) -> 
AG1492: =IF(RC[-26]&RC[-25]&RC[-24]&RC[-23]&RC[-22]&RC[-21]="",,R1C6)&IF(RC[-26]="",,"|n"&R1C7&RC[-26])&IF(RC[-25]="",,"|n"&R1C8&RC[-25])&IF(RC[-24]="",,"|n"&R1C9&RC[-24])&IF(RC[-23]="",,"|n"&R1C10&RC[-23])&IF(RC[-22]="",,"|n"&R1C11&RC[-22])&IF(RC[-21]="",,"|n"&R1C12&RC[-21])&IF(RC[-19]&RC[-18]&RC[-17]&RC[-16]="",,"|n"&R1C13)&IF(RC[-19]="",,"|n"&R1C14&RC[-19])&IF(RC[-18]="",,"|n"&R1C15&RC[-18])&IF(RC[-17]="",,"|n"&R1C16&RC[-17])&IF(RC[-16]="",,"|n"&R1C17&RC[-16])&IF(RC[-15]="",,"|n"&R1C18&RC[-15])&IF(RC[-14]="",,"|n"&R1C19&RC[-14])&IF(RC[-13]="",,"|n"&R1C20&RC[-13])&IF(RC[-12]="",,"|n"&R1C21&RC[-12])&IF(RC[-10]="",,"|n"&R1C23&RC[-10])&IF(RC[-9]="",,"|n"&R1C24&RC[-9])&IF(RC[-8]="",,"|n"&R1C25&RC[-8])&IF(RC[-7]="",,"|n"&R1C26&RC[-7])&IF(RC[-6]="",,"|n"&R1C27&RC[-6])&IF(RC[-5]="",,"|n"&R1C28&RC[-5])&IF(RC[-2]="",,"|n"&RC[-2]) -> 
AG1493: =IF(RC[-26]&RC[-25]&RC[-24]&RC[-23]&RC[-22]&RC[-21]="",,R1C6)&IF(RC[-26]="",,"|n"&R1C7&RC[-26])&IF(RC[-25]="",,"|n"&R1C8&RC[-25])&IF(RC[-24]="",,"|n"&R1C9&RC[-24])&IF(RC[-23]="",,"|n"&R1C10&RC[-23])&IF(RC[-22]="",,"|n"&R1C11&RC[-22])&IF(RC[-21]="",,"|n"&R1C12&RC[-21])&IF(RC[-19]&RC[-18]&RC[-17]&RC[-16]="",,"|n"&R1C13)&IF(RC[-19]="",,"|n"&R1C14&RC[-19])&IF(RC[-18]="",,"|n"&R1C15&RC[-18])&IF(RC[-17]="",,"|n"&R1C16&RC[-17])&IF(RC[-16]="",,"|n"&R1C17&RC[-16])&IF(RC[-15]="",,"|n"&R1C18&RC[-15])&IF(RC[-14]="",,"|n"&R1C19&RC[-14])&IF(RC[-13]="",,"|n"&R1C20&RC[-13])&IF(RC[-12]="",,"|n"&R1C21&RC[-12])&IF(RC[-10]="",,"|n"&R1C23&RC[-10])&IF(RC[-9]="",,"|n"&R1C24&RC[-9])&IF(RC[-8]="",,"|n"&R1C25&RC[-8])&IF(RC[-7]="",,"|n"&R1C26&RC[-7])&IF(RC[-6]="",,"|n"&R1C27&RC[-6])&IF(RC[-5]="",,"|n"&R1C28&RC[-5])&IF(RC[-2]="",,"|n"&RC[-2]) -> 
AG1494: =IF(RC[-26]&RC[-25]&RC[-24]&RC[-23]&RC[-22]&RC[-21]="",,R1C6)&IF(RC[-26]="",,"|n"&R1C7&RC[-26])&IF(RC[-25]="",,"|n"&R1C8&RC[-25])&IF(RC[-24]="",,"|n"&R1C9&RC[-24])&IF(RC[-23]="",,"|n"&R1C10&RC[-23])&IF(RC[-22]="",,"|n"&R1C11&RC[-22])&IF(RC[-21]="",,"|n"&R1C12&RC[-21])&IF(RC[-19]&RC[-18]&RC[-17]&RC[-16]="",,"|n"&R1C13)&IF(RC[-19]="",,"|n"&R1C14&RC[-19])&IF(RC[-18]="",,"|n"&R1C15&RC[-18])&IF(RC[-17]="",,"|n"&R1C16&RC[-17])&IF(RC[-16]="",,"|n"&R1C17&RC[-16])&IF(RC[-15]="",,"|n"&R1C18&RC[-15])&IF(RC[-14]="",,"|n"&R1C19&RC[-14])&IF(RC[-13]="",,"|n"&R1C20&RC[-13])&IF(RC[-12]="",,"|n"&R1C21&RC[-12])&IF(RC[-10]="",,"|n"&R1C23&RC[-10])&IF(RC[-9]="",,"|n"&R1C24&RC[-9])&IF(RC[-8]="",,"|n"&R1C25&RC[-8])&IF(RC[-7]="",,"|n"&R1C26&RC[-7])&IF(RC[-6]="",,"|n"&R1C27&RC[-6])&IF(RC[-5]="",,"|n"&R1C28&RC[-5])&IF(RC[-2]="",,"|n"&RC[-2]) -> 
AG1495: =IF(RC[-26]&RC[-25]&RC[-24]&RC[-23]&RC[-22]&RC[-21]="",,R1C6)&IF(RC[-26]="",,"|n"&R1C7&RC[-26])&IF(RC[-25]="",,"|n"&R1C8&RC[-25])&IF(RC[-24]="",,"|n"&R1C9&RC[-24])&IF(RC[-23]="",,"|n"&R1C10&RC[-23])&IF(RC[-22]="",,"|n"&R1C11&RC[-22])&IF(RC[-21]="",,"|n"&R1C12&RC[-21])&IF(RC[-19]&RC[-18]&RC[-17]&RC[-16]="",,"|n"&R1C13)&IF(RC[-19]="",,"|n"&R1C14&RC[-19])&IF(RC[-18]="",,"|n"&R1C15&RC[-18])&IF(RC[-17]="",,"|n"&R1C16&RC[-17])&IF(RC[-16]="",,"|n"&R1C17&RC[-16])&IF(RC[-15]="",,"|n"&R1C18&RC[-15])&IF(RC[-14]="",,"|n"&R1C19&RC[-14])&IF(RC[-13]="",,"|n"&R1C20&RC[-13])&IF(RC[-12]="",,"|n"&R1C21&RC[-12])&IF(RC[-10]="",,"|n"&R1C23&RC[-10])&IF(RC[-9]="",,"|n"&R1C24&RC[-9])&IF(RC[-8]="",,"|n"&R1C25&RC[-8])&IF(RC[-7]="",,"|n"&R1C26&RC[-7])&IF(RC[-6]="",,"|n"&R1C27&RC[-6])&IF(RC[-5]="",,"|n"&R1C28&RC[-5])&IF(RC[-2]="",,"|n"&RC[-2]) -> 
AG1496: =IF(RC[-26]&RC[-25]&RC[-24]&RC[-23]&RC[-22]&RC[-21]="",,R1C6)&IF(RC[-26]="",,"|n"&R1C7&RC[-26])&IF(RC[-25]="",,"|n"&R1C8&RC[-25])&IF(RC[-24]="",,"|n"&R1C9&RC[-24])&IF(RC[-23]="",,"|n"&R1C10&RC[-23])&IF(RC[-22]="",,"|n"&R1C11&RC[-22])&IF(RC[-21]="",,"|n"&R1C12&RC[-21])&IF(RC[-19]&RC[-18]&RC[-17]&RC[-16]="",,"|n"&R1C13)&IF(RC[-19]="",,"|n"&R1C14&RC[-19])&IF(RC[-18]="",,"|n"&R1C15&RC[-18])&IF(RC[-17]="",,"|n"&R1C16&RC[-17])&IF(RC[-16]="",,"|n"&R1C17&RC[-16])&IF(RC[-15]="",,"|n"&R1C18&RC[-15])&IF(RC[-14]="",,"|n"&R1C19&RC[-14])&IF(RC[-13]="",,"|n"&R1C20&RC[-13])&IF(RC[-12]="",,"|n"&R1C21&RC[-12])&IF(RC[-10]="",,"|n"&R1C23&RC[-10])&IF(RC[-9]="",,"|n"&R1C24&RC[-9])&IF(RC[-8]="",,"|n"&R1C25&RC[-8])&IF(RC[-7]="",,"|n"&R1C26&RC[-7])&IF(RC[-6]="",,"|n"&R1C27&RC[-6])&IF(RC[-5]="",,"|n"&R1C28&RC[-5])&IF(RC[-2]="",,"|n"&RC[-2]) -> 
AG1497: =IF(RC[-26]&RC[-25]&RC[-24]&RC[-23]&RC[-22]&RC[-21]="",,R1C6)&IF(RC[-26]="",,"|n"&R1C7&RC[-26])&IF(RC[-25]="",,"|n"&R1C8&RC[-25])&IF(RC[-24]="",,"|n"&R1C9&RC[-24])&IF(RC[-23]="",,"|n"&R1C10&RC[-23])&IF(RC[-22]="",,"|n"&R1C11&RC[-22])&IF(RC[-21]="",,"|n"&R1C12&RC[-21])&IF(RC[-19]&RC[-18]&RC[-17]&RC[-16]="",,"|n"&R1C13)&IF(RC[-19]="",,"|n"&R1C14&RC[-19])&IF(RC[-18]="",,"|n"&R1C15&RC[-18])&IF(RC[-17]="",,"|n"&R1C16&RC[-17])&IF(RC[-16]="",,"|n"&R1C17&RC[-16])&IF(RC[-15]="",,"|n"&R1C18&RC[-15])&IF(RC[-14]="",,"|n"&R1C19&RC[-14])&IF(RC[-13]="",,"|n"&R1C20&RC[-13])&IF(RC[-12]="",,"|n"&R1C21&RC[-12])&IF(RC[-10]="",,"|n"&R1C23&RC[-10])&IF(RC[-9]="",,"|n"&R1C24&RC[-9])&IF(RC[-8]="",,"|n"&R1C25&RC[-8])&IF(RC[-7]="",,"|n"&R1C26&RC[-7])&IF(RC[-6]="",,"|n"&R1C27&RC[-6])&IF(RC[-5]="",,"|n"&R1C28&RC[-5])&IF(RC[-2]="",,"|n"&RC[-2]) -> 
AG1498: =IF(RC[-26]&RC[-25]&RC[-24]&RC[-23]&RC[-22]&RC[-21]="",,R1C6)&IF(RC[-26]="",,"|n"&R1C7&RC[-26])&IF(RC[-25]="",,"|n"&R1C8&RC[-25])&IF(RC[-24]="",,"|n"&R1C9&RC[-24])&IF(RC[-23]="",,"|n"&R1C10&RC[-23])&IF(RC[-22]="",,"|n"&R1C11&RC[-22])&IF(RC[-21]="",,"|n"&R1C12&RC[-21])&IF(RC[-19]&RC[-18]&RC[-17]&RC[-16]="",,"|n"&R1C13)&IF(RC[-19]="",,"|n"&R1C14&RC[-19])&IF(RC[-18]="",,"|n"&R1C15&RC[-18])&IF(RC[-17]="",,"|n"&R1C16&RC[-17])&IF(RC[-16]="",,"|n"&R1C17&RC[-16])&IF(RC[-15]="",,"|n"&R1C18&RC[-15])&IF(RC[-14]="",,"|n"&R1C19&RC[-14])&IF(RC[-13]="",,"|n"&R1C20&RC[-13])&IF(RC[-12]="",,"|n"&R1C21&RC[-12])&IF(RC[-10]="",,"|n"&R1C23&RC[-10])&IF(RC[-9]="",,"|n"&R1C24&RC[-9])&IF(RC[-8]="",,"|n"&R1C25&RC[-8])&IF(RC[-7]="",,"|n"&R1C26&RC[-7])&IF(RC[-6]="",,"|n"&R1C27&RC[-6])&IF(RC[-5]="",,"|n"&R1C28&RC[-5])&IF(RC[-2]="",,"|n"&RC[-2]) -> 
AG1499: =IF(RC[-26]&RC[-25]&RC[-24]&RC[-23]&RC[-22]&RC[-21]="",,R1C6)&IF(RC[-26]="",,"|n"&R1C7&RC[-26])&IF(RC[-25]="",,"|n"&R1C8&RC[-25])&IF(RC[-24]="",,"|n"&R1C9&RC[-24])&IF(RC[-23]="",,"|n"&R1C10&RC[-23])&IF(RC[-22]="",,"|n"&R1C11&RC[-22])&IF(RC[-21]="",,"|n"&R1C12&RC[-21])&IF(RC[-19]&RC[-18]&RC[-17]&RC[-16]="",,"|n"&R1C13)&IF(RC[-19]="",,"|n"&R1C14&RC[-19])&IF(RC[-18]="",,"|n"&R1C15&RC[-18])&IF(RC[-17]="",,"|n"&R1C16&RC[-17])&IF(RC[-16]="",,"|n"&R1C17&RC[-16])&IF(RC[-15]="",,"|n"&R1C18&RC[-15])&IF(RC[-14]="",,"|n"&R1C19&RC[-14])&IF(RC[-13]="",,"|n"&R1C20&RC[-13])&IF(RC[-12]="",,"|n"&R1C21&RC[-12])&IF(RC[-10]="",,"|n"&R1C23&RC[-10])&IF(RC[-9]="",,"|n"&R1C24&RC[-9])&IF(RC[-8]="",,"|n"&R1C25&RC[-8])&IF(RC[-7]="",,"|n"&R1C26&RC[-7])&IF(RC[-6]="",,"|n"&R1C27&RC[-6])&IF(RC[-5]="",,"|n"&R1C28&RC[-5])&IF(RC[-2]="",,"|n"&RC[-2]) -> 
AG1500: =IF(RC[-26]&RC[-25]&RC[-24]&RC[-23]&RC[-22]&RC[-21]="",,R1C6)&IF(RC[-26]="",,"|n"&R1C7&RC[-26])&IF(RC[-25]="",,"|n"&R1C8&RC[-25])&IF(RC[-24]="",,"|n"&R1C9&RC[-24])&IF(RC[-23]="",,"|n"&R1C10&RC[-23])&IF(RC[-22]="",,"|n"&R1C11&RC[-22])&IF(RC[-21]="",,"|n"&R1C12&RC[-21])&IF(RC[-19]&RC[-18]&RC[-17]&RC[-16]="",,"|n"&R1C13)&IF(RC[-19]="",,"|n"&R1C14&RC[-19])&IF(RC[-18]="",,"|n"&R1C15&RC[-18])&IF(RC[-17]="",,"|n"&R1C16&RC[-17])&IF(RC[-16]="",,"|n"&R1C17&RC[-16])&IF(RC[-15]="",,"|n"&R1C18&RC[-15])&IF(RC[-14]="",,"|n"&R1C19&RC[-14])&IF(RC[-13]="",,"|n"&R1C20&RC[-13])&IF(RC[-12]="",,"|n"&R1C21&RC[-12])&IF(RC[-10]="",,"|n"&R1C23&RC[-10])&IF(RC[-9]="",,"|n"&R1C24&RC[-9])&IF(RC[-8]="",,"|n"&R1C25&RC[-8])&IF(RC[-7]="",,"|n"&R1C26&RC[-7])&IF(RC[-6]="",,"|n"&R1C27&RC[-6])&IF(RC[-5]="",,"|n"&R1C28&RC[-5])&IF(RC[-2]="",,"|n"&RC[-2]) -> 
AG1501: =IF(RC[-26]&RC[-25]&RC[-24]&RC[-23]&RC[-22]&RC[-21]="",,R1C6)&IF(RC[-26]="",,"|n"&R1C7&RC[-26])&IF(RC[-25]="",,"|n"&R1C8&RC[-25])&IF(RC[-24]="",,"|n"&R1C9&RC[-24])&IF(RC[-23]="",,"|n"&R1C10&RC[-23])&IF(RC[-22]="",,"|n"&R1C11&RC[-22])&IF(RC[-21]="",,"|n"&R1C12&RC[-21])&IF(RC[-19]&RC[-18]&RC[-17]&RC[-16]="",,"|n"&R1C13)&IF(RC[-19]="",,"|n"&R1C14&RC[-19])&IF(RC[-18]="",,"|n"&R1C15&RC[-18])&IF(RC[-17]="",,"|n"&R1C16&RC[-17])&IF(RC[-16]="",,"|n"&R1C17&RC[-16])&IF(RC[-15]="",,"|n"&R1C18&RC[-15])&IF(RC[-14]="",,"|n"&R1C19&RC[-14])&IF(RC[-13]="",,"|n"&R1C20&RC[-13])&IF(RC[-12]="",,"|n"&R1C21&RC[-12])&IF(RC[-10]="",,"|n"&R1C23&RC[-10])&IF(RC[-9]="",,"|n"&R1C24&RC[-9])&IF(RC[-8]="",,"|n"&R1C25&RC[-8])&IF(RC[-7]="",,"|n"&R1C26&RC[-7])&IF(RC[-6]="",,"|n"&R1C27&RC[-6])&IF(RC[-5]="",,"|n"&R1C28&RC[-5])&IF(RC[-2]="",,"|n"&RC[-2]) -> 
AG1502: =IF(RC[-26]&RC[-25]&RC[-24]&RC[-23]&RC[-22]&RC[-21]="",,R1C6)&IF(RC[-26]="",,"|n"&R1C7&RC[-26])&IF(RC[-25]="",,"|n"&R1C8&RC[-25])&IF(RC[-24]="",,"|n"&R1C9&RC[-24])&IF(RC[-23]="",,"|n"&R1C10&RC[-23])&IF(RC[-22]="",,"|n"&R1C11&RC[-22])&IF(RC[-21]="",,"|n"&R1C12&RC[-21])&IF(RC[-19]&RC[-18]&RC[-17]&RC[-16]="",,"|n"&R1C13)&IF(RC[-19]="",,"|n"&R1C14&RC[-19])&IF(RC[-18]="",,"|n"&R1C15&RC[-18])&IF(RC[-17]="",,"|n"&R1C16&RC[-17])&IF(RC[-16]="",,"|n"&R1C17&RC[-16])&IF(RC[-15]="",,"|n"&R1C18&RC[-15])&IF(RC[-14]="",,"|n"&R1C19&RC[-14])&IF(RC[-13]="",,"|n"&R1C20&RC[-13])&IF(RC[-12]="",,"|n"&R1C21&RC[-12])&IF(RC[-10]="",,"|n"&R1C23&RC[-10])&IF(RC[-9]="",,"|n"&R1C24&RC[-9])&IF(RC[-8]="",,"|n"&R1C25&RC[-8])&IF(RC[-7]="",,"|n"&R1C26&RC[-7])&IF(RC[-6]="",,"|n"&R1C27&RC[-6])&IF(RC[-5]="",,"|n"&R1C28&RC[-5])&IF(RC[-2]="",,"|n"&RC[-2]) -> 
AG1503: =IF(RC[-26]&RC[-25]&RC[-24]&RC[-23]&RC[-22]&RC[-21]="",,R1C6)&IF(RC[-26]="",,"|n"&R1C7&RC[-26])&IF(RC[-25]="",,"|n"&R1C8&RC[-25])&IF(RC[-24]="",,"|n"&R1C9&RC[-24])&IF(RC[-23]="",,"|n"&R1C10&RC[-23])&IF(RC[-22]="",,"|n"&R1C11&RC[-22])&IF(RC[-21]="",,"|n"&R1C12&RC[-21])&IF(RC[-19]&RC[-18]&RC[-17]&RC[-16]="",,"|n"&R1C13)&IF(RC[-19]="",,"|n"&R1C14&RC[-19])&IF(RC[-18]="",,"|n"&R1C15&RC[-18])&IF(RC[-17]="",,"|n"&R1C16&RC[-17])&IF(RC[-16]="",,"|n"&R1C17&RC[-16])&IF(RC[-15]="",,"|n"&R1C18&RC[-15])&IF(RC[-14]="",,"|n"&R1C19&RC[-14])&IF(RC[-13]="",,"|n"&R1C20&RC[-13])&IF(RC[-12]="",,"|n"&R1C21&RC[-12])&IF(RC[-10]="",,"|n"&R1C23&RC[-10])&IF(RC[-9]="",,"|n"&R1C24&RC[-9])&IF(RC[-8]="",,"|n"&R1C25&RC[-8])&IF(RC[-7]="",,"|n"&R1C26&RC[-7])&IF(RC[-6]="",,"|n"&R1C27&RC[-6])&IF(RC[-5]="",,"|n"&R1C28&RC[-5])&IF(RC[-2]="",,"|n"&RC[-2]) -> 
AG1504: =IF(RC[-26]&RC[-25]&RC[-24]&RC[-23]&RC[-22]&RC[-21]="",,R1C6)&IF(RC[-26]="",,"|n"&R1C7&RC[-26])&IF(RC[-25]="",,"|n"&R1C8&RC[-25])&IF(RC[-24]="",,"|n"&R1C9&RC[-24])&IF(RC[-23]="",,"|n"&R1C10&RC[-23])&IF(RC[-22]="",,"|n"&R1C11&RC[-22])&IF(RC[-21]="",,"|n"&R1C12&RC[-21])&IF(RC[-19]&RC[-18]&RC[-17]&RC[-16]="",,"|n"&R1C13)&IF(RC[-19]="",,"|n"&R1C14&RC[-19])&IF(RC[-18]="",,"|n"&R1C15&RC[-18])&IF(RC[-17]="",,"|n"&R1C16&RC[-17])&IF(RC[-16]="",,"|n"&R1C17&RC[-16])&IF(RC[-15]="",,"|n"&R1C18&RC[-15])&IF(RC[-14]="",,"|n"&R1C19&RC[-14])&IF(RC[-13]="",,"|n"&R1C20&RC[-13])&IF(RC[-12]="",,"|n"&R1C21&RC[-12])&IF(RC[-10]="",,"|n"&R1C23&RC[-10])&IF(RC[-9]="",,"|n"&R1C24&RC[-9])&IF(RC[-8]="",,"|n"&R1C25&RC[-8])&IF(RC[-7]="",,"|n"&R1C26&RC[-7])&IF(RC[-6]="",,"|n"&R1C27&RC[-6])&IF(RC[-5]="",,"|n"&R1C28&RC[-5])&IF(RC[-2]="",,"|n"&RC[-2]) -> 
AG1505: =IF(RC[-26]&RC[-25]&RC[-24]&RC[-23]&RC[-22]&RC[-21]="",,R1C6)&IF(RC[-26]="",,"|n"&R1C7&RC[-26])&IF(RC[-25]="",,"|n"&R1C8&RC[-25])&IF(RC[-24]="",,"|n"&R1C9&RC[-24])&IF(RC[-23]="",,"|n"&R1C10&RC[-23])&IF(RC[-22]="",,"|n"&R1C11&RC[-22])&IF(RC[-21]="",,"|n"&R1C12&RC[-21])&IF(RC[-19]&RC[-18]&RC[-17]&RC[-16]="",,"|n"&R1C13)&IF(RC[-19]="",,"|n"&R1C14&RC[-19])&IF(RC[-18]="",,"|n"&R1C15&RC[-18])&IF(RC[-17]="",,"|n"&R1C16&RC[-17])&IF(RC[-16]="",,"|n"&R1C17&RC[-16])&IF(RC[-15]="",,"|n"&R1C18&RC[-15])&IF(RC[-14]="",,"|n"&R1C19&RC[-14])&IF(RC[-13]="",,"|n"&R1C20&RC[-13])&IF(RC[-12]="",,"|n"&R1C21&RC[-12])&IF(RC[-10]="",,"|n"&R1C23&RC[-10])&IF(RC[-9]="",,"|n"&R1C24&RC[-9])&IF(RC[-8]="",,"|n"&R1C25&RC[-8])&IF(RC[-7]="",,"|n"&R1C26&RC[-7])&IF(RC[-6]="",,"|n"&R1C27&RC[-6])&IF(RC[-5]="",,"|n"&R1C28&RC[-5])&IF(RC[-2]="",,"|n"&RC[-2]) -> 
AG1506: =IF(RC[-26]&RC[-25]&RC[-24]&RC[-23]&RC[-22]&RC[-21]="",,R1C6)&IF(RC[-26]="",,"|n"&R1C7&RC[-26])&IF(RC[-25]="",,"|n"&R1C8&RC[-25])&IF(RC[-24]="",,"|n"&R1C9&RC[-24])&IF(RC[-23]="",,"|n"&R1C10&RC[-23])&IF(RC[-22]="",,"|n"&R1C11&RC[-22])&IF(RC[-21]="",,"|n"&R1C12&RC[-21])&IF(RC[-19]&RC[-18]&RC[-17]&RC[-16]="",,"|n"&R1C13)&IF(RC[-19]="",,"|n"&R1C14&RC[-19])&IF(RC[-18]="",,"|n"&R1C15&RC[-18])&IF(RC[-17]="",,"|n"&R1C16&RC[-17])&IF(RC[-16]="",,"|n"&R1C17&RC[-16])&IF(RC[-15]="",,"|n"&R1C18&RC[-15])&IF(RC[-14]="",,"|n"&R1C19&RC[-14])&IF(RC[-13]="",,"|n"&R1C20&RC[-13])&IF(RC[-12]="",,"|n"&R1C21&RC[-12])&IF(RC[-10]="",,"|n"&R1C23&RC[-10])&IF(RC[-9]="",,"|n"&R1C24&RC[-9])&IF(RC[-8]="",,"|n"&R1C25&RC[-8])&IF(RC[-7]="",,"|n"&R1C26&RC[-7])&IF(RC[-6]="",,"|n"&R1C27&RC[-6])&IF(RC[-5]="",,"|n"&R1C28&RC[-5])&IF(RC[-2]="",,"|n"&RC[-2]) -> 
AG1507: =IF(RC[-26]&RC[-25]&RC[-24]&RC[-23]&RC[-22]&RC[-21]="",,R1C6)&IF(RC[-26]="",,"|n"&R1C7&RC[-26])&IF(RC[-25]="",,"|n"&R1C8&RC[-25])&IF(RC[-24]="",,"|n"&R1C9&RC[-24])&IF(RC[-23]="",,"|n"&R1C10&RC[-23])&IF(RC[-22]="",,"|n"&R1C11&RC[-22])&IF(RC[-21]="",,"|n"&R1C12&RC[-21])&IF(RC[-19]&RC[-18]&RC[-17]&RC[-16]="",,"|n"&R1C13)&IF(RC[-19]="",,"|n"&R1C14&RC[-19])&IF(RC[-18]="",,"|n"&R1C15&RC[-18])&IF(RC[-17]="",,"|n"&R1C16&RC[-17])&IF(RC[-16]="",,"|n"&R1C17&RC[-16])&IF(RC[-15]="",,"|n"&R1C18&RC[-15])&IF(RC[-14]="",,"|n"&R1C19&RC[-14])&IF(RC[-13]="",,"|n"&R1C20&RC[-13])&IF(RC[-12]="",,"|n"&R1C21&RC[-12])&IF(RC[-10]="",,"|n"&R1C23&RC[-10])&IF(RC[-9]="",,"|n"&R1C24&RC[-9])&IF(RC[-8]="",,"|n"&R1C25&RC[-8])&IF(RC[-7]="",,"|n"&R1C26&RC[-7])&IF(RC[-6]="",,"|n"&R1C27&RC[-6])&IF(RC[-5]="",,"|n"&R1C28&RC[-5])&IF(RC[-2]="",,"|n"&RC[-2]) -> 
AG1508: =IF(RC[-26]&RC[-25]&RC[-24]&RC[-23]&RC[-22]&RC[-21]="",,R1C6)&IF(RC[-26]="",,"|n"&R1C7&RC[-26])&IF(RC[-25]="",,"|n"&R1C8&RC[-25])&IF(RC[-24]="",,"|n"&R1C9&RC[-24])&IF(RC[-23]="",,"|n"&R1C10&RC[-23])&IF(RC[-22]="",,"|n"&R1C11&RC[-22])&IF(RC[-21]="",,"|n"&R1C12&RC[-21])&IF(RC[-19]&RC[-18]&RC[-17]&RC[-16]="",,"|n"&R1C13)&IF(RC[-19]="",,"|n"&R1C14&RC[-19])&IF(RC[-18]="",,"|n"&R1C15&RC[-18])&IF(RC[-17]="",,"|n"&R1C16&RC[-17])&IF(RC[-16]="",,"|n"&R1C17&RC[-16])&IF(RC[-15]="",,"|n"&R1C18&RC[-15])&IF(RC[-14]="",,"|n"&R1C19&RC[-14])&IF(RC[-13]="",,"|n"&R1C20&RC[-13])&IF(RC[-12]="",,"|n"&R1C21&RC[-12])&IF(RC[-10]="",,"|n"&R1C23&RC[-10])&IF(RC[-9]="",,"|n"&R1C24&RC[-9])&IF(RC[-8]="",,"|n"&R1C25&RC[-8])&IF(RC[-7]="",,"|n"&R1C26&RC[-7])&IF(RC[-6]="",,"|n"&R1C27&RC[-6])&IF(RC[-5]="",,"|n"&R1C28&RC[-5])&IF(RC[-2]="",,"|n"&RC[-2]) -> 
AG1509: =IF(RC[-26]&RC[-25]&RC[-24]&RC[-23]&RC[-22]&RC[-21]="",,R1C6)&IF(RC[-26]="",,"|n"&R1C7&RC[-26])&IF(RC[-25]="",,"|n"&R1C8&RC[-25])&IF(RC[-24]="",,"|n"&R1C9&RC[-24])&IF(RC[-23]="",,"|n"&R1C10&RC[-23])&IF(RC[-22]="",,"|n"&R1C11&RC[-22])&IF(RC[-21]="",,"|n"&R1C12&RC[-21])&IF(RC[-19]&RC[-18]&RC[-17]&RC[-16]="",,"|n"&R1C13)&IF(RC[-19]="",,"|n"&R1C14&RC[-19])&IF(RC[-18]="",,"|n"&R1C15&RC[-18])&IF(RC[-17]="",,"|n"&R1C16&RC[-17])&IF(RC[-16]="",,"|n"&R1C17&RC[-16])&IF(RC[-15]="",,"|n"&R1C18&RC[-15])&IF(RC[-14]="",,"|n"&R1C19&RC[-14])&IF(RC[-13]="",,"|n"&R1C20&RC[-13])&IF(RC[-12]="",,"|n"&R1C21&RC[-12])&IF(RC[-10]="",,"|n"&R1C23&RC[-10])&IF(RC[-9]="",,"|n"&R1C24&RC[-9])&IF(RC[-8]="",,"|n"&R1C25&RC[-8])&IF(RC[-7]="",,"|n"&R1C26&RC[-7])&IF(RC[-6]="",,"|n"&R1C27&RC[-6])&IF(RC[-5]="",,"|n"&R1C28&RC[-5])&IF(RC[-2]="",,"|n"&RC[-2]) -> 
AG1510: =IF(RC[-26]&RC[-25]&RC[-24]&RC[-23]&RC[-22]&RC[-21]="",,R1C6)&IF(RC[-26]="",,"|n"&R1C7&RC[-26])&IF(RC[-25]="",,"|n"&R1C8&RC[-25])&IF(RC[-24]="",,"|n"&R1C9&RC[-24])&IF(RC[-23]="",,"|n"&R1C10&RC[-23])&IF(RC[-22]="",,"|n"&R1C11&RC[-22])&IF(RC[-21]="",,"|n"&R1C12&RC[-21])&IF(RC[-19]&RC[-18]&RC[-17]&RC[-16]="",,"|n"&R1C13)&IF(RC[-19]="",,"|n"&R1C14&RC[-19])&IF(RC[-18]="",,"|n"&R1C15&RC[-18])&IF(RC[-17]="",,"|n"&R1C16&RC[-17])&IF(RC[-16]="",,"|n"&R1C17&RC[-16])&IF(RC[-15]="",,"|n"&R1C18&RC[-15])&IF(RC[-14]="",,"|n"&R1C19&RC[-14])&IF(RC[-13]="",,"|n"&R1C20&RC[-13])&IF(RC[-12]="",,"|n"&R1C21&RC[-12])&IF(RC[-10]="",,"|n"&R1C23&RC[-10])&IF(RC[-9]="",,"|n"&R1C24&RC[-9])&IF(RC[-8]="",,"|n"&R1C25&RC[-8])&IF(RC[-7]="",,"|n"&R1C26&RC[-7])&IF(RC[-6]="",,"|n"&R1C27&RC[-6])&IF(RC[-5]="",,"|n"&R1C28&RC[-5])&IF(RC[-2]="",,"|n"&RC[-2]) -> 
AG1511: =IF(RC[-26]&RC[-25]&RC[-24]&RC[-23]&RC[-22]&RC[-21]="",,R1C6)&IF(RC[-26]="",,"|n"&R1C7&RC[-26])&IF(RC[-25]="",,"|n"&R1C8&RC[-25])&IF(RC[-24]="",,"|n"&R1C9&RC[-24])&IF(RC[-23]="",,"|n"&R1C10&RC[-23])&IF(RC[-22]="",,"|n"&R1C11&RC[-22])&IF(RC[-21]="",,"|n"&R1C12&RC[-21])&IF(RC[-19]&RC[-18]&RC[-17]&RC[-16]="",,"|n"&R1C13)&IF(RC[-19]="",,"|n"&R1C14&RC[-19])&IF(RC[-18]="",,"|n"&R1C15&RC[-18])&IF(RC[-17]="",,"|n"&R1C16&RC[-17])&IF(RC[-16]="",,"|n"&R1C17&RC[-16])&IF(RC[-15]="",,"|n"&R1C18&RC[-15])&IF(RC[-14]="",,"|n"&R1C19&RC[-14])&IF(RC[-13]="",,"|n"&R1C20&RC[-13])&IF(RC[-12]="",,"|n"&R1C21&RC[-12])&IF(RC[-10]="",,"|n"&R1C23&RC[-10])&IF(RC[-9]="",,"|n"&R1C24&RC[-9])&IF(RC[-8]="",,"|n"&R1C25&RC[-8])&IF(RC[-7]="",,"|n"&R1C26&RC[-7])&IF(RC[-6]="",,"|n"&R1C27&RC[-6])&IF(RC[-5]="",,"|n"&R1C28&RC[-5])&IF(RC[-2]="",,"|n"&RC[-2]) -> 
AG1512: =IF(RC[-26]&RC[-25]&RC[-24]&RC[-23]&RC[-22]&RC[-21]="",,R1C6)&IF(RC[-26]="",,"|n"&R1C7&RC[-26])&IF(RC[-25]="",,"|n"&R1C8&RC[-25])&IF(RC[-24]="",,"|n"&R1C9&RC[-24])&IF(RC[-23]="",,"|n"&R1C10&RC[-23])&IF(RC[-22]="",,"|n"&R1C11&RC[-22])&IF(RC[-21]="",,"|n"&R1C12&RC[-21])&IF(RC[-19]&RC[-18]&RC[-17]&RC[-16]="",,"|n"&R1C13)&IF(RC[-19]="",,"|n"&R1C14&RC[-19])&IF(RC[-18]="",,"|n"&R1C15&RC[-18])&IF(RC[-17]="",,"|n"&R1C16&RC[-17])&IF(RC[-16]="",,"|n"&R1C17&RC[-16])&IF(RC[-15]="",,"|n"&R1C18&RC[-15])&IF(RC[-14]="",,"|n"&R1C19&RC[-14])&IF(RC[-13]="",,"|n"&R1C20&RC[-13])&IF(RC[-12]="",,"|n"&R1C21&RC[-12])&IF(RC[-10]="",,"|n"&R1C23&RC[-10])&IF(RC[-9]="",,"|n"&R1C24&RC[-9])&IF(RC[-8]="",,"|n"&R1C25&RC[-8])&IF(RC[-7]="",,"|n"&R1C26&RC[-7])&IF(RC[-6]="",,"|n"&R1C27&RC[-6])&IF(RC[-5]="",,"|n"&R1C28&RC[-5])&IF(RC[-2]="",,"|n"&RC[-2]) -> 
AG1513: =IF(RC[-26]&RC[-25]&RC[-24]&RC[-23]&RC[-22]&RC[-21]="",,R1C6)&IF(RC[-26]="",,"|n"&R1C7&RC[-26])&IF(RC[-25]="",,"|n"&R1C8&RC[-25])&IF(RC[-24]="",,"|n"&R1C9&RC[-24])&IF(RC[-23]="",,"|n"&R1C10&RC[-23])&IF(RC[-22]="",,"|n"&R1C11&RC[-22])&IF(RC[-21]="",,"|n"&R1C12&RC[-21])&IF(RC[-19]&RC[-18]&RC[-17]&RC[-16]="",,"|n"&R1C13)&IF(RC[-19]="",,"|n"&R1C14&RC[-19])&IF(RC[-18]="",,"|n"&R1C15&RC[-18])&IF(RC[-17]="",,"|n"&R1C16&RC[-17])&IF(RC[-16]="",,"|n"&R1C17&RC[-16])&IF(RC[-15]="",,"|n"&R1C18&RC[-15])&IF(RC[-14]="",,"|n"&R1C19&RC[-14])&IF(RC[-13]="",,"|n"&R1C20&RC[-13])&IF(RC[-12]="",,"|n"&R1C21&RC[-12])&IF(RC[-10]="",,"|n"&R1C23&RC[-10])&IF(RC[-9]="",,"|n"&R1C24&RC[-9])&IF(RC[-8]="",,"|n"&R1C25&RC[-8])&IF(RC[-7]="",,"|n"&R1C26&RC[-7])&IF(RC[-6]="",,"|n"&R1C27&RC[-6])&IF(RC[-5]="",,"|n"&R1C28&RC[-5])&IF(RC[-2]="",,"|n"&RC[-2]) -> 
AG1514: =IF(RC[-26]&RC[-25]&RC[-24]&RC[-23]&RC[-22]&RC[-21]="",,R1C6)&IF(RC[-26]="",,"|n"&R1C7&RC[-26])&IF(RC[-25]="",,"|n"&R1C8&RC[-25])&IF(RC[-24]="",,"|n"&R1C9&RC[-24])&IF(RC[-23]="",,"|n"&R1C10&RC[-23])&IF(RC[-22]="",,"|n"&R1C11&RC[-22])&IF(RC[-21]="",,"|n"&R1C12&RC[-21])&IF(RC[-19]&RC[-18]&RC[-17]&RC[-16]="",,"|n"&R1C13)&IF(RC[-19]="",,"|n"&R1C14&RC[-19])&IF(RC[-18]="",,"|n"&R1C15&RC[-18])&IF(RC[-17]="",,"|n"&R1C16&RC[-17])&IF(RC[-16]="",,"|n"&R1C17&RC[-16])&IF(RC[-15]="",,"|n"&R1C18&RC[-15])&IF(RC[-14]="",,"|n"&R1C19&RC[-14])&IF(RC[-13]="",,"|n"&R1C20&RC[-13])&IF(RC[-12]="",,"|n"&R1C21&RC[-12])&IF(RC[-10]="",,"|n"&R1C23&RC[-10])&IF(RC[-9]="",,"|n"&R1C24&RC[-9])&IF(RC[-8]="",,"|n"&R1C25&RC[-8])&IF(RC[-7]="",,"|n"&R1C26&RC[-7])&IF(RC[-6]="",,"|n"&R1C27&RC[-6])&IF(RC[-5]="",,"|n"&R1C28&RC[-5])&IF(RC[-2]="",,"|n"&RC[-2]) -> 
AG1515: =IF(RC[-26]&RC[-25]&RC[-24]&RC[-23]&RC[-22]&RC[-21]="",,R1C6)&IF(RC[-26]="",,"|n"&R1C7&RC[-26])&IF(RC[-25]="",,"|n"&R1C8&RC[-25])&IF(RC[-24]="",,"|n"&R1C9&RC[-24])&IF(RC[-23]="",,"|n"&R1C10&RC[-23])&IF(RC[-22]="",,"|n"&R1C11&RC[-22])&IF(RC[-21]="",,"|n"&R1C12&RC[-21])&IF(RC[-19]&RC[-18]&RC[-17]&RC[-16]="",,"|n"&R1C13)&IF(RC[-19]="",,"|n"&R1C14&RC[-19])&IF(RC[-18]="",,"|n"&R1C15&RC[-18])&IF(RC[-17]="",,"|n"&R1C16&RC[-17])&IF(RC[-16]="",,"|n"&R1C17&RC[-16])&IF(RC[-15]="",,"|n"&R1C18&RC[-15])&IF(RC[-14]="",,"|n"&R1C19&RC[-14])&IF(RC[-13]="",,"|n"&R1C20&RC[-13])&IF(RC[-12]="",,"|n"&R1C21&RC[-12])&IF(RC[-10]="",,"|n"&R1C23&RC[-10])&IF(RC[-9]="",,"|n"&R1C24&RC[-9])&IF(RC[-8]="",,"|n"&R1C25&RC[-8])&IF(RC[-7]="",,"|n"&R1C26&RC[-7])&IF(RC[-6]="",,"|n"&R1C27&RC[-6])&IF(RC[-5]="",,"|n"&R1C28&RC[-5])&IF(RC[-2]="",,"|n"&RC[-2]) -> 
AG1516: =IF(RC[-26]&RC[-25]&RC[-24]&RC[-23]&RC[-22]&RC[-21]="",,R1C6)&IF(RC[-26]="",,"|n"&R1C7&RC[-26])&IF(RC[-25]="",,"|n"&R1C8&RC[-25])&IF(RC[-24]="",,"|n"&R1C9&RC[-24])&IF(RC[-23]="",,"|n"&R1C10&RC[-23])&IF(RC[-22]="",,"|n"&R1C11&RC[-22])&IF(RC[-21]="",,"|n"&R1C12&RC[-21])&IF(RC[-19]&RC[-18]&RC[-17]&RC[-16]="",,"|n"&R1C13)&IF(RC[-19]="",,"|n"&R1C14&RC[-19])&IF(RC[-18]="",,"|n"&R1C15&RC[-18])&IF(RC[-17]="",,"|n"&R1C16&RC[-17])&IF(RC[-16]="",,"|n"&R1C17&RC[-16])&IF(RC[-15]="",,"|n"&R1C18&RC[-15])&IF(RC[-14]="",,"|n"&R1C19&RC[-14])&IF(RC[-13]="",,"|n"&R1C20&RC[-13])&IF(RC[-12]="",,"|n"&R1C21&RC[-12])&IF(RC[-10]="",,"|n"&R1C23&RC[-10])&IF(RC[-9]="",,"|n"&R1C24&RC[-9])&IF(RC[-8]="",,"|n"&R1C25&RC[-8])&IF(RC[-7]="",,"|n"&R1C26&RC[-7])&IF(RC[-6]="",,"|n"&R1C27&RC[-6])&IF(RC[-5]="",,"|n"&R1C28&RC[-5])&IF(RC[-2]="",,"|n"&RC[-2]) -> 
AG1517: =IF(RC[-26]&RC[-25]&RC[-24]&RC[-23]&RC[-22]&RC[-21]="",,R1C6)&IF(RC[-26]="",,"|n"&R1C7&RC[-26])&IF(RC[-25]="",,"|n"&R1C8&RC[-25])&IF(RC[-24]="",,"|n"&R1C9&RC[-24])&IF(RC[-23]="",,"|n"&R1C10&RC[-23])&IF(RC[-22]="",,"|n"&R1C11&RC[-22])&IF(RC[-21]="",,"|n"&R1C12&RC[-21])&IF(RC[-19]&RC[-18]&RC[-17]&RC[-16]="",,"|n"&R1C13)&IF(RC[-19]="",,"|n"&R1C14&RC[-19])&IF(RC[-18]="",,"|n"&R1C15&RC[-18])&IF(RC[-17]="",,"|n"&R1C16&RC[-17])&IF(RC[-16]="",,"|n"&R1C17&RC[-16])&IF(RC[-15]="",,"|n"&R1C18&RC[-15])&IF(RC[-14]="",,"|n"&R1C19&RC[-14])&IF(RC[-13]="",,"|n"&R1C20&RC[-13])&IF(RC[-12]="",,"|n"&R1C21&RC[-12])&IF(RC[-10]="",,"|n"&R1C23&RC[-10])&IF(RC[-9]="",,"|n"&R1C24&RC[-9])&IF(RC[-8]="",,"|n"&R1C25&RC[-8])&IF(RC[-7]="",,"|n"&R1C26&RC[-7])&IF(RC[-6]="",,"|n"&R1C27&RC[-6])&IF(RC[-5]="",,"|n"&R1C28&RC[-5])&IF(RC[-2]="",,"|n"&RC[-2]) -> 
AG1518: =IF(RC[-26]&RC[-25]&RC[-24]&RC[-23]&RC[-22]&RC[-21]="",,R1C6)&IF(RC[-26]="",,"|n"&R1C7&RC[-26])&IF(RC[-25]="",,"|n"&R1C8&RC[-25])&IF(RC[-24]="",,"|n"&R1C9&RC[-24])&IF(RC[-23]="",,"|n"&R1C10&RC[-23])&IF(RC[-22]="",,"|n"&R1C11&RC[-22])&IF(RC[-21]="",,"|n"&R1C12&RC[-21])&IF(RC[-19]&RC[-18]&RC[-17]&RC[-16]="",,"|n"&R1C13)&IF(RC[-19]="",,"|n"&R1C14&RC[-19])&IF(RC[-18]="",,"|n"&R1C15&RC[-18])&IF(RC[-17]="",,"|n"&R1C16&RC[-17])&IF(RC[-16]="",,"|n"&R1C17&RC[-16])&IF(RC[-15]="",,"|n"&R1C18&RC[-15])&IF(RC[-14]="",,"|n"&R1C19&RC[-14])&IF(RC[-13]="",,"|n"&R1C20&RC[-13])&IF(RC[-12]="",,"|n"&R1C21&RC[-12])&IF(RC[-10]="",,"|n"&R1C23&RC[-10])&IF(RC[-9]="",,"|n"&R1C24&RC[-9])&IF(RC[-8]="",,"|n"&R1C25&RC[-8])&IF(RC[-7]="",,"|n"&R1C26&RC[-7])&IF(RC[-6]="",,"|n"&R1C27&RC[-6])&IF(RC[-5]="",,"|n"&R1C28&RC[-5])&IF(RC[-2]="",,"|n"&RC[-2]) -> 
AG1519: =IF(RC[-26]&RC[-25]&RC[-24]&RC[-23]&RC[-22]&RC[-21]="",,R1C6)&IF(RC[-26]="",,"|n"&R1C7&RC[-26])&IF(RC[-25]="",,"|n"&R1C8&RC[-25])&IF(RC[-24]="",,"|n"&R1C9&RC[-24])&IF(RC[-23]="",,"|n"&R1C10&RC[-23])&IF(RC[-22]="",,"|n"&R1C11&RC[-22])&IF(RC[-21]="",,"|n"&R1C12&RC[-21])&IF(RC[-19]&RC[-18]&RC[-17]&RC[-16]="",,"|n"&R1C13)&IF(RC[-19]="",,"|n"&R1C14&RC[-19])&IF(RC[-18]="",,"|n"&R1C15&RC[-18])&IF(RC[-17]="",,"|n"&R1C16&RC[-17])&IF(RC[-16]="",,"|n"&R1C17&RC[-16])&IF(RC[-15]="",,"|n"&R1C18&RC[-15])&IF(RC[-14]="",,"|n"&R1C19&RC[-14])&IF(RC[-13]="",,"|n"&R1C20&RC[-13])&IF(RC[-12]="",,"|n"&R1C21&RC[-12])&IF(RC[-10]="",,"|n"&R1C23&RC[-10])&IF(RC[-9]="",,"|n"&R1C24&RC[-9])&IF(RC[-8]="",,"|n"&R1C25&RC[-8])&IF(RC[-7]="",,"|n"&R1C26&RC[-7])&IF(RC[-6]="",,"|n"&R1C27&RC[-6])&IF(RC[-5]="",,"|n"&R1C28&RC[-5])&IF(RC[-2]="",,"|n"&RC[-2]) -> 
AG1520: =IF(RC[-26]&RC[-25]&RC[-24]&RC[-23]&RC[-22]&RC[-21]="",,R1C6)&IF(RC[-26]="",,"|n"&R1C7&RC[-26])&IF(RC[-25]="",,"|n"&R1C8&RC[-25])&IF(RC[-24]="",,"|n"&R1C9&RC[-24])&IF(RC[-23]="",,"|n"&R1C10&RC[-23])&IF(RC[-22]="",,"|n"&R1C11&RC[-22])&IF(RC[-21]="",,"|n"&R1C12&RC[-21])&IF(RC[-19]&RC[-18]&RC[-17]&RC[-16]="",,"|n"&R1C13)&IF(RC[-19]="",,"|n"&R1C14&RC[-19])&IF(RC[-18]="",,"|n"&R1C15&RC[-18])&IF(RC[-17]="",,"|n"&R1C16&RC[-17])&IF(RC[-16]="",,"|n"&R1C17&RC[-16])&IF(RC[-15]="",,"|n"&R1C18&RC[-15])&IF(RC[-14]="",,"|n"&R1C19&RC[-14])&IF(RC[-13]="",,"|n"&R1C20&RC[-13])&IF(RC[-12]="",,"|n"&R1C21&RC[-12])&IF(RC[-10]="",,"|n"&R1C23&RC[-10])&IF(RC[-9]="",,"|n"&R1C24&RC[-9])&IF(RC[-8]="",,"|n"&R1C25&RC[-8])&IF(RC[-7]="",,"|n"&R1C26&RC[-7])&IF(RC[-6]="",,"|n"&R1C27&RC[-6])&IF(RC[-5]="",,"|n"&R1C28&RC[-5])&IF(RC[-2]="",,"|n"&RC[-2]) -> 
AG1521: =IF(RC[-26]&RC[-25]&RC[-24]&RC[-23]&RC[-22]&RC[-21]="",,R1C6)&IF(RC[-26]="",,"|n"&R1C7&RC[-26])&IF(RC[-25]="",,"|n"&R1C8&RC[-25])&IF(RC[-24]="",,"|n"&R1C9&RC[-24])&IF(RC[-23]="",,"|n"&R1C10&RC[-23])&IF(RC[-22]="",,"|n"&R1C11&RC[-22])&IF(RC[-21]="",,"|n"&R1C12&RC[-21])&IF(RC[-19]&RC[-18]&RC[-17]&RC[-16]="",,"|n"&R1C13)&IF(RC[-19]="",,"|n"&R1C14&RC[-19])&IF(RC[-18]="",,"|n"&R1C15&RC[-18])&IF(RC[-17]="",,"|n"&R1C16&RC[-17])&IF(RC[-16]="",,"|n"&R1C17&RC[-16])&IF(RC[-15]="",,"|n"&R1C18&RC[-15])&IF(RC[-14]="",,"|n"&R1C19&RC[-14])&IF(RC[-13]="",,"|n"&R1C20&RC[-13])&IF(RC[-12]="",,"|n"&R1C21&RC[-12])&IF(RC[-10]="",,"|n"&R1C23&RC[-10])&IF(RC[-9]="",,"|n"&R1C24&RC[-9])&IF(RC[-8]="",,"|n"&R1C25&RC[-8])&IF(RC[-7]="",,"|n"&R1C26&RC[-7])&IF(RC[-6]="",,"|n"&R1C27&RC[-6])&IF(RC[-5]="",,"|n"&R1C28&RC[-5])&IF(RC[-2]="",,"|n"&RC[-2]) -> 
AG1522: =IF(RC[-26]&RC[-25]&RC[-24]&RC[-23]&RC[-22]&RC[-21]="",,R1C6)&IF(RC[-26]="",,"|n"&R1C7&RC[-26])&IF(RC[-25]="",,"|n"&R1C8&RC[-25])&IF(RC[-24]="",,"|n"&R1C9&RC[-24])&IF(RC[-23]="",,"|n"&R1C10&RC[-23])&IF(RC[-22]="",,"|n"&R1C11&RC[-22])&IF(RC[-21]="",,"|n"&R1C12&RC[-21])&IF(RC[-19]&RC[-18]&RC[-17]&RC[-16]="",,"|n"&R1C13)&IF(RC[-19]="",,"|n"&R1C14&RC[-19])&IF(RC[-18]="",,"|n"&R1C15&RC[-18])&IF(RC[-17]="",,"|n"&R1C16&RC[-17])&IF(RC[-16]="",,"|n"&R1C17&RC[-16])&IF(RC[-15]="",,"|n"&R1C18&RC[-15])&IF(RC[-14]="",,"|n"&R1C19&RC[-14])&IF(RC[-13]="",,"|n"&R1C20&RC[-13])&IF(RC[-12]="",,"|n"&R1C21&RC[-12])&IF(RC[-10]="",,"|n"&R1C23&RC[-10])&IF(RC[-9]="",,"|n"&R1C24&RC[-9])&IF(RC[-8]="",,"|n"&R1C25&RC[-8])&IF(RC[-7]="",,"|n"&R1C26&RC[-7])&IF(RC[-6]="",,"|n"&R1C27&RC[-6])&IF(RC[-5]="",,"|n"&R1C28&RC[-5])&IF(RC[-2]="",,"|n"&RC[-2]) -> 
AG1523: =IF(RC[-26]&RC[-25]&RC[-24]&RC[-23]&RC[-22]&RC[-21]="",,R1C6)&IF(RC[-26]="",,"|n"&R1C7&RC[-26])&IF(RC[-25]="",,"|n"&R1C8&RC[-25])&IF(RC[-24]="",,"|n"&R1C9&RC[-24])&IF(RC[-23]="",,"|n"&R1C10&RC[-23])&IF(RC[-22]="",,"|n"&R1C11&RC[-22])&IF(RC[-21]="",,"|n"&R1C12&RC[-21])&IF(RC[-19]&RC[-18]&RC[-17]&RC[-16]="",,"|n"&R1C13)&IF(RC[-19]="",,"|n"&R1C14&RC[-19])&IF(RC[-18]="",,"|n"&R1C15&RC[-18])&IF(RC[-17]="",,"|n"&R1C16&RC[-17])&IF(RC[-16]="",,"|n"&R1C17&RC[-16])&IF(RC[-15]="",,"|n"&R1C18&RC[-15])&IF(RC[-14]="",,"|n"&R1C19&RC[-14])&IF(RC[-13]="",,"|n"&R1C20&RC[-13])&IF(RC[-12]="",,"|n"&R1C21&RC[-12])&IF(RC[-10]="",,"|n"&R1C23&RC[-10])&IF(RC[-9]="",,"|n"&R1C24&RC[-9])&IF(RC[-8]="",,"|n"&R1C25&RC[-8])&IF(RC[-7]="",,"|n"&R1C26&RC[-7])&IF(RC[-6]="",,"|n"&R1C27&RC[-6])&IF(RC[-5]="",,"|n"&R1C28&RC[-5])&IF(RC[-2]="",,"|n"&RC[-2]) -> 
AG1524: =IF(RC[-26]&RC[-25]&RC[-24]&RC[-23]&RC[-22]&RC[-21]="",,R1C6)&IF(RC[-26]="",,"|n"&R1C7&RC[-26])&IF(RC[-25]="",,"|n"&R1C8&RC[-25])&IF(RC[-24]="",,"|n"&R1C9&RC[-24])&IF(RC[-23]="",,"|n"&R1C10&RC[-23])&IF(RC[-22]="",,"|n"&R1C11&RC[-22])&IF(RC[-21]="",,"|n"&R1C12&RC[-21])&IF(RC[-19]&RC[-18]&RC[-17]&RC[-16]="",,"|n"&R1C13)&IF(RC[-19]="",,"|n"&R1C14&RC[-19])&IF(RC[-18]="",,"|n"&R1C15&RC[-18])&IF(RC[-17]="",,"|n"&R1C16&RC[-17])&IF(RC[-16]="",,"|n"&R1C17&RC[-16])&IF(RC[-15]="",,"|n"&R1C18&RC[-15])&IF(RC[-14]="",,"|n"&R1C19&RC[-14])&IF(RC[-13]="",,"|n"&R1C20&RC[-13])&IF(RC[-12]="",,"|n"&R1C21&RC[-12])&IF(RC[-10]="",,"|n"&R1C23&RC[-10])&IF(RC[-9]="",,"|n"&R1C24&RC[-9])&IF(RC[-8]="",,"|n"&R1C25&RC[-8])&IF(RC[-7]="",,"|n"&R1C26&RC[-7])&IF(RC[-6]="",,"|n"&R1C27&RC[-6])&IF(RC[-5]="",,"|n"&R1C28&RC[-5])&IF(RC[-2]="",,"|n"&RC[-2]) -> 
AG1525: =IF(RC[-26]&RC[-25]&RC[-24]&RC[-23]&RC[-22]&RC[-21]="",,R1C6)&IF(RC[-26]="",,"|n"&R1C7&RC[-26])&IF(RC[-25]="",,"|n"&R1C8&RC[-25])&IF(RC[-24]="",,"|n"&R1C9&RC[-24])&IF(RC[-23]="",,"|n"&R1C10&RC[-23])&IF(RC[-22]="",,"|n"&R1C11&RC[-22])&IF(RC[-21]="",,"|n"&R1C12&RC[-21])&IF(RC[-19]&RC[-18]&RC[-17]&RC[-16]="",,"|n"&R1C13)&IF(RC[-19]="",,"|n"&R1C14&RC[-19])&IF(RC[-18]="",,"|n"&R1C15&RC[-18])&IF(RC[-17]="",,"|n"&R1C16&RC[-17])&IF(RC[-16]="",,"|n"&R1C17&RC[-16])&IF(RC[-15]="",,"|n"&R1C18&RC[-15])&IF(RC[-14]="",,"|n"&R1C19&RC[-14])&IF(RC[-13]="",,"|n"&R1C20&RC[-13])&IF(RC[-12]="",,"|n"&R1C21&RC[-12])&IF(RC[-10]="",,"|n"&R1C23&RC[-10])&IF(RC[-9]="",,"|n"&R1C24&RC[-9])&IF(RC[-8]="",,"|n"&R1C25&RC[-8])&IF(RC[-7]="",,"|n"&R1C26&RC[-7])&IF(RC[-6]="",,"|n"&R1C27&RC[-6])&IF(RC[-5]="",,"|n"&R1C28&RC[-5])&IF(RC[-2]="",,"|n"&RC[-2]) -> 
AG1526: =IF(RC[-26]&RC[-25]&RC[-24]&RC[-23]&RC[-22]&RC[-21]="",,R1C6)&IF(RC[-26]="",,"|n"&R1C7&RC[-26])&IF(RC[-25]="",,"|n"&R1C8&RC[-25])&IF(RC[-24]="",,"|n"&R1C9&RC[-24])&IF(RC[-23]="",,"|n"&R1C10&RC[-23])&IF(RC[-22]="",,"|n"&R1C11&RC[-22])&IF(RC[-21]="",,"|n"&R1C12&RC[-21])&IF(RC[-19]&RC[-18]&RC[-17]&RC[-16]="",,"|n"&R1C13)&IF(RC[-19]="",,"|n"&R1C14&RC[-19])&IF(RC[-18]="",,"|n"&R1C15&RC[-18])&IF(RC[-17]="",,"|n"&R1C16&RC[-17])&IF(RC[-16]="",,"|n"&R1C17&RC[-16])&IF(RC[-15]="",,"|n"&R1C18&RC[-15])&IF(RC[-14]="",,"|n"&R1C19&RC[-14])&IF(RC[-13]="",,"|n"&R1C20&RC[-13])&IF(RC[-12]="",,"|n"&R1C21&RC[-12])&IF(RC[-10]="",,"|n"&R1C23&RC[-10])&IF(RC[-9]="",,"|n"&R1C24&RC[-9])&IF(RC[-8]="",,"|n"&R1C25&RC[-8])&IF(RC[-7]="",,"|n"&R1C26&RC[-7])&IF(RC[-6]="",,"|n"&R1C27&RC[-6])&IF(RC[-5]="",,"|n"&R1C28&RC[-5])&IF(RC[-2]="",,"|n"&RC[-2]) -> 
AG1527: =IF(RC[-26]&RC[-25]&RC[-24]&RC[-23]&RC[-22]&RC[-21]="",,R1C6)&IF(RC[-26]="",,"|n"&R1C7&RC[-26])&IF(RC[-25]="",,"|n"&R1C8&RC[-25])&IF(RC[-24]="",,"|n"&R1C9&RC[-24])&IF(RC[-23]="",,"|n"&R1C10&RC[-23])&IF(RC[-22]="",,"|n"&R1C11&RC[-22])&IF(RC[-21]="",,"|n"&R1C12&RC[-21])&IF(RC[-19]&RC[-18]&RC[-17]&RC[-16]="",,"|n"&R1C13)&IF(RC[-19]="",,"|n"&R1C14&RC[-19])&IF(RC[-18]="",,"|n"&R1C15&RC[-18])&IF(RC[-17]="",,"|n"&R1C16&RC[-17])&IF(RC[-16]="",,"|n"&R1C17&RC[-16])&IF(RC[-15]="",,"|n"&R1C18&RC[-15])&IF(RC[-14]="",,"|n"&R1C19&RC[-14])&IF(RC[-13]="",,"|n"&R1C20&RC[-13])&IF(RC[-12]="",,"|n"&R1C21&RC[-12])&IF(RC[-10]="",,"|n"&R1C23&RC[-10])&IF(RC[-9]="",,"|n"&R1C24&RC[-9])&IF(RC[-8]="",,"|n"&R1C25&RC[-8])&IF(RC[-7]="",,"|n"&R1C26&RC[-7])&IF(RC[-6]="",,"|n"&R1C27&RC[-6])&IF(RC[-5]="",,"|n"&R1C28&RC[-5])&IF(RC[-2]="",,"|n"&RC[-2]) -> 
AG1528: =IF(RC[-26]&RC[-25]&RC[-24]&RC[-23]&RC[-22]&RC[-21]="",,R1C6)&IF(RC[-26]="",,"|n"&R1C7&RC[-26])&IF(RC[-25]="",,"|n"&R1C8&RC[-25])&IF(RC[-24]="",,"|n"&R1C9&RC[-24])&IF(RC[-23]="",,"|n"&R1C10&RC[-23])&IF(RC[-22]="",,"|n"&R1C11&RC[-22])&IF(RC[-21]="",,"|n"&R1C12&RC[-21])&IF(RC[-19]&RC[-18]&RC[-17]&RC[-16]="",,"|n"&R1C13)&IF(RC[-19]="",,"|n"&R1C14&RC[-19])&IF(RC[-18]="",,"|n"&R1C15&RC[-18])&IF(RC[-17]="",,"|n"&R1C16&RC[-17])&IF(RC[-16]="",,"|n"&R1C17&RC[-16])&IF(RC[-15]="",,"|n"&R1C18&RC[-15])&IF(RC[-14]="",,"|n"&R1C19&RC[-14])&IF(RC[-13]="",,"|n"&R1C20&RC[-13])&IF(RC[-12]="",,"|n"&R1C21&RC[-12])&IF(RC[-10]="",,"|n"&R1C23&RC[-10])&IF(RC[-9]="",,"|n"&R1C24&RC[-9])&IF(RC[-8]="",,"|n"&R1C25&RC[-8])&IF(RC[-7]="",,"|n"&R1C26&RC[-7])&IF(RC[-6]="",,"|n"&R1C27&RC[-6])&IF(RC[-5]="",,"|n"&R1C28&RC[-5])&IF(RC[-2]="",,"|n"&RC[-2]) -> 
AG1529: =IF(RC[-26]&RC[-25]&RC[-24]&RC[-23]&RC[-22]&RC[-21]="",,R1C6)&IF(RC[-26]="",,"|n"&R1C7&RC[-26])&IF(RC[-25]="",,"|n"&R1C8&RC[-25])&IF(RC[-24]="",,"|n"&R1C9&RC[-24])&IF(RC[-23]="",,"|n"&R1C10&RC[-23])&IF(RC[-22]="",,"|n"&R1C11&RC[-22])&IF(RC[-21]="",,"|n"&R1C12&RC[-21])&IF(RC[-19]&RC[-18]&RC[-17]&RC[-16]="",,"|n"&R1C13)&IF(RC[-19]="",,"|n"&R1C14&RC[-19])&IF(RC[-18]="",,"|n"&R1C15&RC[-18])&IF(RC[-17]="",,"|n"&R1C16&RC[-17])&IF(RC[-16]="",,"|n"&R1C17&RC[-16])&IF(RC[-15]="",,"|n"&R1C18&RC[-15])&IF(RC[-14]="",,"|n"&R1C19&RC[-14])&IF(RC[-13]="",,"|n"&R1C20&RC[-13])&IF(RC[-12]="",,"|n"&R1C21&RC[-12])&IF(RC[-10]="",,"|n"&R1C23&RC[-10])&IF(RC[-9]="",,"|n"&R1C24&RC[-9])&IF(RC[-8]="",,"|n"&R1C25&RC[-8])&IF(RC[-7]="",,"|n"&R1C26&RC[-7])&IF(RC[-6]="",,"|n"&R1C27&RC[-6])&IF(RC[-5]="",,"|n"&R1C28&RC[-5])&IF(RC[-2]="",,"|n"&RC[-2]) -> 
AG1530: =IF(RC[-26]&RC[-25]&RC[-24]&RC[-23]&RC[-22]&RC[-21]="",,R1C6)&IF(RC[-26]="",,"|n"&R1C7&RC[-26])&IF(RC[-25]="",,"|n"&R1C8&RC[-25])&IF(RC[-24]="",,"|n"&R1C9&RC[-24])&IF(RC[-23]="",,"|n"&R1C10&RC[-23])&IF(RC[-22]="",,"|n"&R1C11&RC[-22])&IF(RC[-21]="",,"|n"&R1C12&RC[-21])&IF(RC[-19]&RC[-18]&RC[-17]&RC[-16]="",,"|n"&R1C13)&IF(RC[-19]="",,"|n"&R1C14&RC[-19])&IF(RC[-18]="",,"|n"&R1C15&RC[-18])&IF(RC[-17]="",,"|n"&R1C16&RC[-17])&IF(RC[-16]="",,"|n"&R1C17&RC[-16])&IF(RC[-15]="",,"|n"&R1C18&RC[-15])&IF(RC[-14]="",,"|n"&R1C19&RC[-14])&IF(RC[-13]="",,"|n"&R1C20&RC[-13])&IF(RC[-12]="",,"|n"&R1C21&RC[-12])&IF(RC[-10]="",,"|n"&R1C23&RC[-10])&IF(RC[-9]="",,"|n"&R1C24&RC[-9])&IF(RC[-8]="",,"|n"&R1C25&RC[-8])&IF(RC[-7]="",,"|n"&R1C26&RC[-7])&IF(RC[-6]="",,"|n"&R1C27&RC[-6])&IF(RC[-5]="",,"|n"&R1C28&RC[-5])&IF(RC[-2]="",,"|n"&RC[-2]) -> 
AG1531: =IF(RC[-26]&RC[-25]&RC[-24]&RC[-23]&RC[-22]&RC[-21]="",,R1C6)&IF(RC[-26]="",,"|n"&R1C7&RC[-26])&IF(RC[-25]="",,"|n"&R1C8&RC[-25])&IF(RC[-24]="",,"|n"&R1C9&RC[-24])&IF(RC[-23]="",,"|n"&R1C10&RC[-23])&IF(RC[-22]="",,"|n"&R1C11&RC[-22])&IF(RC[-21]="",,"|n"&R1C12&RC[-21])&IF(RC[-19]&RC[-18]&RC[-17]&RC[-16]="",,"|n"&R1C13)&IF(RC[-19]="",,"|n"&R1C14&RC[-19])&IF(RC[-18]="",,"|n"&R1C15&RC[-18])&IF(RC[-17]="",,"|n"&R1C16&RC[-17])&IF(RC[-16]="",,"|n"&R1C17&RC[-16])&IF(RC[-15]="",,"|n"&R1C18&RC[-15])&IF(RC[-14]="",,"|n"&R1C19&RC[-14])&IF(RC[-13]="",,"|n"&R1C20&RC[-13])&IF(RC[-12]="",,"|n"&R1C21&RC[-12])&IF(RC[-10]="",,"|n"&R1C23&RC[-10])&IF(RC[-9]="",,"|n"&R1C24&RC[-9])&IF(RC[-8]="",,"|n"&R1C25&RC[-8])&IF(RC[-7]="",,"|n"&R1C26&RC[-7])&IF(RC[-6]="",,"|n"&R1C27&RC[-6])&IF(RC[-5]="",,"|n"&R1C28&RC[-5])&IF(RC[-2]="",,"|n"&RC[-2]) -> 
AG1532: =IF(RC[-26]&RC[-25]&RC[-24]&RC[-23]&RC[-22]&RC[-21]="",,R1C6)&IF(RC[-26]="",,"|n"&R1C7&RC[-26])&IF(RC[-25]="",,"|n"&R1C8&RC[-25])&IF(RC[-24]="",,"|n"&R1C9&RC[-24])&IF(RC[-23]="",,"|n"&R1C10&RC[-23])&IF(RC[-22]="",,"|n"&R1C11&RC[-22])&IF(RC[-21]="",,"|n"&R1C12&RC[-21])&IF(RC[-19]&RC[-18]&RC[-17]&RC[-16]="",,"|n"&R1C13)&IF(RC[-19]="",,"|n"&R1C14&RC[-19])&IF(RC[-18]="",,"|n"&R1C15&RC[-18])&IF(RC[-17]="",,"|n"&R1C16&RC[-17])&IF(RC[-16]="",,"|n"&R1C17&RC[-16])&IF(RC[-15]="",,"|n"&R1C18&RC[-15])&IF(RC[-14]="",,"|n"&R1C19&RC[-14])&IF(RC[-13]="",,"|n"&R1C20&RC[-13])&IF(RC[-12]="",,"|n"&R1C21&RC[-12])&IF(RC[-10]="",,"|n"&R1C23&RC[-10])&IF(RC[-9]="",,"|n"&R1C24&RC[-9])&IF(RC[-8]="",,"|n"&R1C25&RC[-8])&IF(RC[-7]="",,"|n"&R1C26&RC[-7])&IF(RC[-6]="",,"|n"&R1C27&RC[-6])&IF(RC[-5]="",,"|n"&R1C28&RC[-5])&IF(RC[-2]="",,"|n"&RC[-2]) -> 
AG1533: =IF(RC[-26]&RC[-25]&RC[-24]&RC[-23]&RC[-22]&RC[-21]="",,R1C6)&IF(RC[-26]="",,"|n"&R1C7&RC[-26])&IF(RC[-25]="",,"|n"&R1C8&RC[-25])&IF(RC[-24]="",,"|n"&R1C9&RC[-24])&IF(RC[-23]="",,"|n"&R1C10&RC[-23])&IF(RC[-22]="",,"|n"&R1C11&RC[-22])&IF(RC[-21]="",,"|n"&R1C12&RC[-21])&IF(RC[-19]&RC[-18]&RC[-17]&RC[-16]="",,"|n"&R1C13)&IF(RC[-19]="",,"|n"&R1C14&RC[-19])&IF(RC[-18]="",,"|n"&R1C15&RC[-18])&IF(RC[-17]="",,"|n"&R1C16&RC[-17])&IF(RC[-16]="",,"|n"&R1C17&RC[-16])&IF(RC[-15]="",,"|n"&R1C18&RC[-15])&IF(RC[-14]="",,"|n"&R1C19&RC[-14])&IF(RC[-13]="",,"|n"&R1C20&RC[-13])&IF(RC[-12]="",,"|n"&R1C21&RC[-12])&IF(RC[-10]="",,"|n"&R1C23&RC[-10])&IF(RC[-9]="",,"|n"&R1C24&RC[-9])&IF(RC[-8]="",,"|n"&R1C25&RC[-8])&IF(RC[-7]="",,"|n"&R1C26&RC[-7])&IF(RC[-6]="",,"|n"&R1C27&RC[-6])&IF(RC[-5]="",,"|n"&R1C28&RC[-5])&IF(RC[-2]="",,"|n"&RC[-2]) -> 
AG1534: =IF(RC[-26]&RC[-25]&RC[-24]&RC[-23]&RC[-22]&RC[-21]="",,R1C6)&IF(RC[-26]="",,"|n"&R1C7&RC[-26])&IF(RC[-25]="",,"|n"&R1C8&RC[-25])&IF(RC[-24]="",,"|n"&R1C9&RC[-24])&IF(RC[-23]="",,"|n"&R1C10&RC[-23])&IF(RC[-22]="",,"|n"&R1C11&RC[-22])&IF(RC[-21]="",,"|n"&R1C12&RC[-21])&IF(RC[-19]&RC[-18]&RC[-17]&RC[-16]="",,"|n"&R1C13)&IF(RC[-19]="",,"|n"&R1C14&RC[-19])&IF(RC[-18]="",,"|n"&R1C15&RC[-18])&IF(RC[-17]="",,"|n"&R1C16&RC[-17])&IF(RC[-16]="",,"|n"&R1C17&RC[-16])&IF(RC[-15]="",,"|n"&R1C18&RC[-15])&IF(RC[-14]="",,"|n"&R1C19&RC[-14])&IF(RC[-13]="",,"|n"&R1C20&RC[-13])&IF(RC[-12]="",,"|n"&R1C21&RC[-12])&IF(RC[-10]="",,"|n"&R1C23&RC[-10])&IF(RC[-9]="",,"|n"&R1C24&RC[-9])&IF(RC[-8]="",,"|n"&R1C25&RC[-8])&IF(RC[-7]="",,"|n"&R1C26&RC[-7])&IF(RC[-6]="",,"|n"&R1C27&RC[-6])&IF(RC[-5]="",,"|n"&R1C28&RC[-5])&IF(RC[-2]="",,"|n"&RC[-2]) -> 
AG1535: =IF(RC[-26]&RC[-25]&RC[-24]&RC[-23]&RC[-22]&RC[-21]="",,R1C6)&IF(RC[-26]="",,"|n"&R1C7&RC[-26])&IF(RC[-25]="",,"|n"&R1C8&RC[-25])&IF(RC[-24]="",,"|n"&R1C9&RC[-24])&IF(RC[-23]="",,"|n"&R1C10&RC[-23])&IF(RC[-22]="",,"|n"&R1C11&RC[-22])&IF(RC[-21]="",,"|n"&R1C12&RC[-21])&IF(RC[-19]&RC[-18]&RC[-17]&RC[-16]="",,"|n"&R1C13)&IF(RC[-19]="",,"|n"&R1C14&RC[-19])&IF(RC[-18]="",,"|n"&R1C15&RC[-18])&IF(RC[-17]="",,"|n"&R1C16&RC[-17])&IF(RC[-16]="",,"|n"&R1C17&RC[-16])&IF(RC[-15]="",,"|n"&R1C18&RC[-15])&IF(RC[-14]="",,"|n"&R1C19&RC[-14])&IF(RC[-13]="",,"|n"&R1C20&RC[-13])&IF(RC[-12]="",,"|n"&R1C21&RC[-12])&IF(RC[-10]="",,"|n"&R1C23&RC[-10])&IF(RC[-9]="",,"|n"&R1C24&RC[-9])&IF(RC[-8]="",,"|n"&R1C25&RC[-8])&IF(RC[-7]="",,"|n"&R1C26&RC[-7])&IF(RC[-6]="",,"|n"&R1C27&RC[-6])&IF(RC[-5]="",,"|n"&R1C28&RC[-5])&IF(RC[-2]="",,"|n"&RC[-2]) -> 
AG1536: =IF(RC[-26]&RC[-25]&RC[-24]&RC[-23]&RC[-22]&RC[-21]="",,R1C6)&IF(RC[-26]="",,"|n"&R1C7&RC[-26])&IF(RC[-25]="",,"|n"&R1C8&RC[-25])&IF(RC[-24]="",,"|n"&R1C9&RC[-24])&IF(RC[-23]="",,"|n"&R1C10&RC[-23])&IF(RC[-22]="",,"|n"&R1C11&RC[-22])&IF(RC[-21]="",,"|n"&R1C12&RC[-21])&IF(RC[-19]&RC[-18]&RC[-17]&RC[-16]="",,"|n"&R1C13)&IF(RC[-19]="",,"|n"&R1C14&RC[-19])&IF(RC[-18]="",,"|n"&R1C15&RC[-18])&IF(RC[-17]="",,"|n"&R1C16&RC[-17])&IF(RC[-16]="",,"|n"&R1C17&RC[-16])&IF(RC[-15]="",,"|n"&R1C18&RC[-15])&IF(RC[-14]="",,"|n"&R1C19&RC[-14])&IF(RC[-13]="",,"|n"&R1C20&RC[-13])&IF(RC[-12]="",,"|n"&R1C21&RC[-12])&IF(RC[-10]="",,"|n"&R1C23&RC[-10])&IF(RC[-9]="",,"|n"&R1C24&RC[-9])&IF(RC[-8]="",,"|n"&R1C25&RC[-8])&IF(RC[-7]="",,"|n"&R1C26&RC[-7])&IF(RC[-6]="",,"|n"&R1C27&RC[-6])&IF(RC[-5]="",,"|n"&R1C28&RC[-5])&IF(RC[-2]="",,"|n"&RC[-2]) -> 
AG1537: =IF(RC[-26]&RC[-25]&RC[-24]&RC[-23]&RC[-22]&RC[-21]="",,R1C6)&IF(RC[-26]="",,"|n"&R1C7&RC[-26])&IF(RC[-25]="",,"|n"&R1C8&RC[-25])&IF(RC[-24]="",,"|n"&R1C9&RC[-24])&IF(RC[-23]="",,"|n"&R1C10&RC[-23])&IF(RC[-22]="",,"|n"&R1C11&RC[-22])&IF(RC[-21]="",,"|n"&R1C12&RC[-21])&IF(RC[-19]&RC[-18]&RC[-17]&RC[-16]="",,"|n"&R1C13)&IF(RC[-19]="",,"|n"&R1C14&RC[-19])&IF(RC[-18]="",,"|n"&R1C15&RC[-18])&IF(RC[-17]="",,"|n"&R1C16&RC[-17])&IF(RC[-16]="",,"|n"&R1C17&RC[-16])&IF(RC[-15]="",,"|n"&R1C18&RC[-15])&IF(RC[-14]="",,"|n"&R1C19&RC[-14])&IF(RC[-13]="",,"|n"&R1C20&RC[-13])&IF(RC[-12]="",,"|n"&R1C21&RC[-12])&IF(RC[-10]="",,"|n"&R1C23&RC[-10])&IF(RC[-9]="",,"|n"&R1C24&RC[-9])&IF(RC[-8]="",,"|n"&R1C25&RC[-8])&IF(RC[-7]="",,"|n"&R1C26&RC[-7])&IF(RC[-6]="",,"|n"&R1C27&RC[-6])&IF(RC[-5]="",,"|n"&R1C28&RC[-5])&IF(RC[-2]="",,"|n"&RC[-2]) -> 
AG1538: =IF(RC[-26]&RC[-25]&RC[-24]&RC[-23]&RC[-22]&RC[-21]="",,R1C6)&IF(RC[-26]="",,"|n"&R1C7&RC[-26])&IF(RC[-25]="",,"|n"&R1C8&RC[-25])&IF(RC[-24]="",,"|n"&R1C9&RC[-24])&IF(RC[-23]="",,"|n"&R1C10&RC[-23])&IF(RC[-22]="",,"|n"&R1C11&RC[-22])&IF(RC[-21]="",,"|n"&R1C12&RC[-21])&IF(RC[-19]&RC[-18]&RC[-17]&RC[-16]="",,"|n"&R1C13)&IF(RC[-19]="",,"|n"&R1C14&RC[-19])&IF(RC[-18]="",,"|n"&R1C15&RC[-18])&IF(RC[-17]="",,"|n"&R1C16&RC[-17])&IF(RC[-16]="",,"|n"&R1C17&RC[-16])&IF(RC[-15]="",,"|n"&R1C18&RC[-15])&IF(RC[-14]="",,"|n"&R1C19&RC[-14])&IF(RC[-13]="",,"|n"&R1C20&RC[-13])&IF(RC[-12]="",,"|n"&R1C21&RC[-12])&IF(RC[-10]="",,"|n"&R1C23&RC[-10])&IF(RC[-9]="",,"|n"&R1C24&RC[-9])&IF(RC[-8]="",,"|n"&R1C25&RC[-8])&IF(RC[-7]="",,"|n"&R1C26&RC[-7])&IF(RC[-6]="",,"|n"&R1C27&RC[-6])&IF(RC[-5]="",,"|n"&R1C28&RC[-5])&IF(RC[-2]="",,"|n"&RC[-2]) -> 
AG1539: =IF(RC[-26]&RC[-25]&RC[-24]&RC[-23]&RC[-22]&RC[-21]="",,R1C6)&IF(RC[-26]="",,"|n"&R1C7&RC[-26])&IF(RC[-25]="",,"|n"&R1C8&RC[-25])&IF(RC[-24]="",,"|n"&R1C9&RC[-24])&IF(RC[-23]="",,"|n"&R1C10&RC[-23])&IF(RC[-22]="",,"|n"&R1C11&RC[-22])&IF(RC[-21]="",,"|n"&R1C12&RC[-21])&IF(RC[-19]&RC[-18]&RC[-17]&RC[-16]="",,"|n"&R1C13)&IF(RC[-19]="",,"|n"&R1C14&RC[-19])&IF(RC[-18]="",,"|n"&R1C15&RC[-18])&IF(RC[-17]="",,"|n"&R1C16&RC[-17])&IF(RC[-16]="",,"|n"&R1C17&RC[-16])&IF(RC[-15]="",,"|n"&R1C18&RC[-15])&IF(RC[-14]="",,"|n"&R1C19&RC[-14])&IF(RC[-13]="",,"|n"&R1C20&RC[-13])&IF(RC[-12]="",,"|n"&R1C21&RC[-12])&IF(RC[-10]="",,"|n"&R1C23&RC[-10])&IF(RC[-9]="",,"|n"&R1C24&RC[-9])&IF(RC[-8]="",,"|n"&R1C25&RC[-8])&IF(RC[-7]="",,"|n"&R1C26&RC[-7])&IF(RC[-6]="",,"|n"&R1C27&RC[-6])&IF(RC[-5]="",,"|n"&R1C28&RC[-5])&IF(RC[-2]="",,"|n"&RC[-2]) -> 
AG1540: =IF(RC[-26]&RC[-25]&RC[-24]&RC[-23]&RC[-22]&RC[-21]="",,R1C6)&IF(RC[-26]="",,"|n"&R1C7&RC[-26])&IF(RC[-25]="",,"|n"&R1C8&RC[-25])&IF(RC[-24]="",,"|n"&R1C9&RC[-24])&IF(RC[-23]="",,"|n"&R1C10&RC[-23])&IF(RC[-22]="",,"|n"&R1C11&RC[-22])&IF(RC[-21]="",,"|n"&R1C12&RC[-21])&IF(RC[-19]&RC[-18]&RC[-17]&RC[-16]="",,"|n"&R1C13)&IF(RC[-19]="",,"|n"&R1C14&RC[-19])&IF(RC[-18]="",,"|n"&R1C15&RC[-18])&IF(RC[-17]="",,"|n"&R1C16&RC[-17])&IF(RC[-16]="",,"|n"&R1C17&RC[-16])&IF(RC[-15]="",,"|n"&R1C18&RC[-15])&IF(RC[-14]="",,"|n"&R1C19&RC[-14])&IF(RC[-13]="",,"|n"&R1C20&RC[-13])&IF(RC[-12]="",,"|n"&R1C21&RC[-12])&IF(RC[-10]="",,"|n"&R1C23&RC[-10])&IF(RC[-9]="",,"|n"&R1C24&RC[-9])&IF(RC[-8]="",,"|n"&R1C25&RC[-8])&IF(RC[-7]="",,"|n"&R1C26&RC[-7])&IF(RC[-6]="",,"|n"&R1C27&RC[-6])&IF(RC[-5]="",,"|n"&R1C28&RC[-5])&IF(RC[-2]="",,"|n"&RC[-2]) -> 
AG1541: =IF(RC[-26]&RC[-25]&RC[-24]&RC[-23]&RC[-22]&RC[-21]="",,R1C6)&IF(RC[-26]="",,"|n"&R1C7&RC[-26])&IF(RC[-25]="",,"|n"&R1C8&RC[-25])&IF(RC[-24]="",,"|n"&R1C9&RC[-24])&IF(RC[-23]="",,"|n"&R1C10&RC[-23])&IF(RC[-22]="",,"|n"&R1C11&RC[-22])&IF(RC[-21]="",,"|n"&R1C12&RC[-21])&IF(RC[-19]&RC[-18]&RC[-17]&RC[-16]="",,"|n"&R1C13)&IF(RC[-19]="",,"|n"&R1C14&RC[-19])&IF(RC[-18]="",,"|n"&R1C15&RC[-18])&IF(RC[-17]="",,"|n"&R1C16&RC[-17])&IF(RC[-16]="",,"|n"&R1C17&RC[-16])&IF(RC[-15]="",,"|n"&R1C18&RC[-15])&IF(RC[-14]="",,"|n"&R1C19&RC[-14])&IF(RC[-13]="",,"|n"&R1C20&RC[-13])&IF(RC[-12]="",,"|n"&R1C21&RC[-12])&IF(RC[-10]="",,"|n"&R1C23&RC[-10])&IF(RC[-9]="",,"|n"&R1C24&RC[-9])&IF(RC[-8]="",,"|n"&R1C25&RC[-8])&IF(RC[-7]="",,"|n"&R1C26&RC[-7])&IF(RC[-6]="",,"|n"&R1C27&RC[-6])&IF(RC[-5]="",,"|n"&R1C28&RC[-5])&IF(RC[-2]="",,"|n"&RC[-2]) -> 
AG1542: =IF(RC[-26]&RC[-25]&RC[-24]&RC[-23]&RC[-22]&RC[-21]="",,R1C6)&IF(RC[-26]="",,"|n"&R1C7&RC[-26])&IF(RC[-25]="",,"|n"&R1C8&RC[-25])&IF(RC[-24]="",,"|n"&R1C9&RC[-24])&IF(RC[-23]="",,"|n"&R1C10&RC[-23])&IF(RC[-22]="",,"|n"&R1C11&RC[-22])&IF(RC[-21]="",,"|n"&R1C12&RC[-21])&IF(RC[-19]&RC[-18]&RC[-17]&RC[-16]="",,"|n"&R1C13)&IF(RC[-19]="",,"|n"&R1C14&RC[-19])&IF(RC[-18]="",,"|n"&R1C15&RC[-18])&IF(RC[-17]="",,"|n"&R1C16&RC[-17])&IF(RC[-16]="",,"|n"&R1C17&RC[-16])&IF(RC[-15]="",,"|n"&R1C18&RC[-15])&IF(RC[-14]="",,"|n"&R1C19&RC[-14])&IF(RC[-13]="",,"|n"&R1C20&RC[-13])&IF(RC[-12]="",,"|n"&R1C21&RC[-12])&IF(RC[-10]="",,"|n"&R1C23&RC[-10])&IF(RC[-9]="",,"|n"&R1C24&RC[-9])&IF(RC[-8]="",,"|n"&R1C25&RC[-8])&IF(RC[-7]="",,"|n"&R1C26&RC[-7])&IF(RC[-6]="",,"|n"&R1C27&RC[-6])&IF(RC[-5]="",,"|n"&R1C28&RC[-5])&IF(RC[-2]="",,"|n"&RC[-2]) -> 
AG1543: =IF(RC[-26]&RC[-25]&RC[-24]&RC[-23]&RC[-22]&RC[-21]="",,R1C6)&IF(RC[-26]="",,"|n"&R1C7&RC[-26])&IF(RC[-25]="",,"|n"&R1C8&RC[-25])&IF(RC[-24]="",,"|n"&R1C9&RC[-24])&IF(RC[-23]="",,"|n"&R1C10&RC[-23])&IF(RC[-22]="",,"|n"&R1C11&RC[-22])&IF(RC[-21]="",,"|n"&R1C12&RC[-21])&IF(RC[-19]&RC[-18]&RC[-17]&RC[-16]="",,"|n"&R1C13)&IF(RC[-19]="",,"|n"&R1C14&RC[-19])&IF(RC[-18]="",,"|n"&R1C15&RC[-18])&IF(RC[-17]="",,"|n"&R1C16&RC[-17])&IF(RC[-16]="",,"|n"&R1C17&RC[-16])&IF(RC[-15]="",,"|n"&R1C18&RC[-15])&IF(RC[-14]="",,"|n"&R1C19&RC[-14])&IF(RC[-13]="",,"|n"&R1C20&RC[-13])&IF(RC[-12]="",,"|n"&R1C21&RC[-12])&IF(RC[-10]="",,"|n"&R1C23&RC[-10])&IF(RC[-9]="",,"|n"&R1C24&RC[-9])&IF(RC[-8]="",,"|n"&R1C25&RC[-8])&IF(RC[-7]="",,"|n"&R1C26&RC[-7])&IF(RC[-6]="",,"|n"&R1C27&RC[-6])&IF(RC[-5]="",,"|n"&R1C28&RC[-5])&IF(RC[-2]="",,"|n"&RC[-2]) -> 
AG1544: =IF(RC[-26]&RC[-25]&RC[-24]&RC[-23]&RC[-22]&RC[-21]="",,R1C6)&IF(RC[-26]="",,"|n"&R1C7&RC[-26])&IF(RC[-25]="",,"|n"&R1C8&RC[-25])&IF(RC[-24]="",,"|n"&R1C9&RC[-24])&IF(RC[-23]="",,"|n"&R1C10&RC[-23])&IF(RC[-22]="",,"|n"&R1C11&RC[-22])&IF(RC[-21]="",,"|n"&R1C12&RC[-21])&IF(RC[-19]&RC[-18]&RC[-17]&RC[-16]="",,"|n"&R1C13)&IF(RC[-19]="",,"|n"&R1C14&RC[-19])&IF(RC[-18]="",,"|n"&R1C15&RC[-18])&IF(RC[-17]="",,"|n"&R1C16&RC[-17])&IF(RC[-16]="",,"|n"&R1C17&RC[-16])&IF(RC[-15]="",,"|n"&R1C18&RC[-15])&IF(RC[-14]="",,"|n"&R1C19&RC[-14])&IF(RC[-13]="",,"|n"&R1C20&RC[-13])&IF(RC[-12]="",,"|n"&R1C21&RC[-12])&IF(RC[-10]="",,"|n"&R1C23&RC[-10])&IF(RC[-9]="",,"|n"&R1C24&RC[-9])&IF(RC[-8]="",,"|n"&R1C25&RC[-8])&IF(RC[-7]="",,"|n"&R1C26&RC[-7])&IF(RC[-6]="",,"|n"&R1C27&RC[-6])&IF(RC[-5]="",,"|n"&R1C28&RC[-5])&IF(RC[-2]="",,"|n"&RC[-2]) -> 
AG1545: =IF(RC[-26]&RC[-25]&RC[-24]&RC[-23]&RC[-22]&RC[-21]="",,R1C6)&IF(RC[-26]="",,"|n"&R1C7&RC[-26])&IF(RC[-25]="",,"|n"&R1C8&RC[-25])&IF(RC[-24]="",,"|n"&R1C9&RC[-24])&IF(RC[-23]="",,"|n"&R1C10&RC[-23])&IF(RC[-22]="",,"|n"&R1C11&RC[-22])&IF(RC[-21]="",,"|n"&R1C12&RC[-21])&IF(RC[-19]&RC[-18]&RC[-17]&RC[-16]="",,"|n"&R1C13)&IF(RC[-19]="",,"|n"&R1C14&RC[-19])&IF(RC[-18]="",,"|n"&R1C15&RC[-18])&IF(RC[-17]="",,"|n"&R1C16&RC[-17])&IF(RC[-16]="",,"|n"&R1C17&RC[-16])&IF(RC[-15]="",,"|n"&R1C18&RC[-15])&IF(RC[-14]="",,"|n"&R1C19&RC[-14])&IF(RC[-13]="",,"|n"&R1C20&RC[-13])&IF(RC[-12]="",,"|n"&R1C21&RC[-12])&IF(RC[-10]="",,"|n"&R1C23&RC[-10])&IF(RC[-9]="",,"|n"&R1C24&RC[-9])&IF(RC[-8]="",,"|n"&R1C25&RC[-8])&IF(RC[-7]="",,"|n"&R1C26&RC[-7])&IF(RC[-6]="",,"|n"&R1C27&RC[-6])&IF(RC[-5]="",,"|n"&R1C28&RC[-5])&IF(RC[-2]="",,"|n"&RC[-2]) -> 
AG1546: =IF(RC[-26]&RC[-25]&RC[-24]&RC[-23]&RC[-22]&RC[-21]="",,R1C6)&IF(RC[-26]="",,"|n"&R1C7&RC[-26])&IF(RC[-25]="",,"|n"&R1C8&RC[-25])&IF(RC[-24]="",,"|n"&R1C9&RC[-24])&IF(RC[-23]="",,"|n"&R1C10&RC[-23])&IF(RC[-22]="",,"|n"&R1C11&RC[-22])&IF(RC[-21]="",,"|n"&R1C12&RC[-21])&IF(RC[-19]&RC[-18]&RC[-17]&RC[-16]="",,"|n"&R1C13)&IF(RC[-19]="",,"|n"&R1C14&RC[-19])&IF(RC[-18]="",,"|n"&R1C15&RC[-18])&IF(RC[-17]="",,"|n"&R1C16&RC[-17])&IF(RC[-16]="",,"|n"&R1C17&RC[-16])&IF(RC[-15]="",,"|n"&R1C18&RC[-15])&IF(RC[-14]="",,"|n"&R1C19&RC[-14])&IF(RC[-13]="",,"|n"&R1C20&RC[-13])&IF(RC[-12]="",,"|n"&R1C21&RC[-12])&IF(RC[-10]="",,"|n"&R1C23&RC[-10])&IF(RC[-9]="",,"|n"&R1C24&RC[-9])&IF(RC[-8]="",,"|n"&R1C25&RC[-8])&IF(RC[-7]="",,"|n"&R1C26&RC[-7])&IF(RC[-6]="",,"|n"&R1C27&RC[-6])&IF(RC[-5]="",,"|n"&R1C28&RC[-5])&IF(RC[-2]="",,"|n"&RC[-2]) -> 
AG1547: =IF(RC[-26]&RC[-25]&RC[-24]&RC[-23]&RC[-22]&RC[-21]="",,R1C6)&IF(RC[-26]="",,"|n"&R1C7&RC[-26])&IF(RC[-25]="",,"|n"&R1C8&RC[-25])&IF(RC[-24]="",,"|n"&R1C9&RC[-24])&IF(RC[-23]="",,"|n"&R1C10&RC[-23])&IF(RC[-22]="",,"|n"&R1C11&RC[-22])&IF(RC[-21]="",,"|n"&R1C12&RC[-21])&IF(RC[-19]&RC[-18]&RC[-17]&RC[-16]="",,"|n"&R1C13)&IF(RC[-19]="",,"|n"&R1C14&RC[-19])&IF(RC[-18]="",,"|n"&R1C15&RC[-18])&IF(RC[-17]="",,"|n"&R1C16&RC[-17])&IF(RC[-16]="",,"|n"&R1C17&RC[-16])&IF(RC[-15]="",,"|n"&R1C18&RC[-15])&IF(RC[-14]="",,"|n"&R1C19&RC[-14])&IF(RC[-13]="",,"|n"&R1C20&RC[-13])&IF(RC[-12]="",,"|n"&R1C21&RC[-12])&IF(RC[-10]="",,"|n"&R1C23&RC[-10])&IF(RC[-9]="",,"|n"&R1C24&RC[-9])&IF(RC[-8]="",,"|n"&R1C25&RC[-8])&IF(RC[-7]="",,"|n"&R1C26&RC[-7])&IF(RC[-6]="",,"|n"&R1C27&RC[-6])&IF(RC[-5]="",,"|n"&R1C28&RC[-5])&IF(RC[-2]="",,"|n"&RC[-2]) -> 
AG1548: =IF(RC[-26]&RC[-25]&RC[-24]&RC[-23]&RC[-22]&RC[-21]="",,R1C6)&IF(RC[-26]="",,"|n"&R1C7&RC[-26])&IF(RC[-25]="",,"|n"&R1C8&RC[-25])&IF(RC[-24]="",,"|n"&R1C9&RC[-24])&IF(RC[-23]="",,"|n"&R1C10&RC[-23])&IF(RC[-22]="",,"|n"&R1C11&RC[-22])&IF(RC[-21]="",,"|n"&R1C12&RC[-21])&IF(RC[-19]&RC[-18]&RC[-17]&RC[-16]="",,"|n"&R1C13)&IF(RC[-19]="",,"|n"&R1C14&RC[-19])&IF(RC[-18]="",,"|n"&R1C15&RC[-18])&IF(RC[-17]="",,"|n"&R1C16&RC[-17])&IF(RC[-16]="",,"|n"&R1C17&RC[-16])&IF(RC[-15]="",,"|n"&R1C18&RC[-15])&IF(RC[-14]="",,"|n"&R1C19&RC[-14])&IF(RC[-13]="",,"|n"&R1C20&RC[-13])&IF(RC[-12]="",,"|n"&R1C21&RC[-12])&IF(RC[-10]="",,"|n"&R1C23&RC[-10])&IF(RC[-9]="",,"|n"&R1C24&RC[-9])&IF(RC[-8]="",,"|n"&R1C25&RC[-8])&IF(RC[-7]="",,"|n"&R1C26&RC[-7])&IF(RC[-6]="",,"|n"&R1C27&RC[-6])&IF(RC[-5]="",,"|n"&R1C28&RC[-5])&IF(RC[-2]="",,"|n"&RC[-2]) -> 
AG1549: =IF(RC[-26]&RC[-25]&RC[-24]&RC[-23]&RC[-22]&RC[-21]="",,R1C6)&IF(RC[-26]="",,"|n"&R1C7&RC[-26])&IF(RC[-25]="",,"|n"&R1C8&RC[-25])&IF(RC[-24]="",,"|n"&R1C9&RC[-24])&IF(RC[-23]="",,"|n"&R1C10&RC[-23])&IF(RC[-22]="",,"|n"&R1C11&RC[-22])&IF(RC[-21]="",,"|n"&R1C12&RC[-21])&IF(RC[-19]&RC[-18]&RC[-17]&RC[-16]="",,"|n"&R1C13)&IF(RC[-19]="",,"|n"&R1C14&RC[-19])&IF(RC[-18]="",,"|n"&R1C15&RC[-18])&IF(RC[-17]="",,"|n"&R1C16&RC[-17])&IF(RC[-16]="",,"|n"&R1C17&RC[-16])&IF(RC[-15]="",,"|n"&R1C18&RC[-15])&IF(RC[-14]="",,"|n"&R1C19&RC[-14])&IF(RC[-13]="",,"|n"&R1C20&RC[-13])&IF(RC[-12]="",,"|n"&R1C21&RC[-12])&IF(RC[-10]="",,"|n"&R1C23&RC[-10])&IF(RC[-9]="",,"|n"&R1C24&RC[-9])&IF(RC[-8]="",,"|n"&R1C25&RC[-8])&IF(RC[-7]="",,"|n"&R1C26&RC[-7])&IF(RC[-6]="",,"|n"&R1C27&RC[-6])&IF(RC[-5]="",,"|n"&R1C28&RC[-5])&IF(RC[-2]="",,"|n"&RC[-2]) -> 
AG1550: =IF(RC[-26]&RC[-25]&RC[-24]&RC[-23]&RC[-22]&RC[-21]="",,R1C6)&IF(RC[-26]="",,"|n"&R1C7&RC[-26])&IF(RC[-25]="",,"|n"&R1C8&RC[-25])&IF(RC[-24]="",,"|n"&R1C9&RC[-24])&IF(RC[-23]="",,"|n"&R1C10&RC[-23])&IF(RC[-22]="",,"|n"&R1C11&RC[-22])&IF(RC[-21]="",,"|n"&R1C12&RC[-21])&IF(RC[-19]&RC[-18]&RC[-17]&RC[-16]="",,"|n"&R1C13)&IF(RC[-19]="",,"|n"&R1C14&RC[-19])&IF(RC[-18]="",,"|n"&R1C15&RC[-18])&IF(RC[-17]="",,"|n"&R1C16&RC[-17])&IF(RC[-16]="",,"|n"&R1C17&RC[-16])&IF(RC[-15]="",,"|n"&R1C18&RC[-15])&IF(RC[-14]="",,"|n"&R1C19&RC[-14])&IF(RC[-13]="",,"|n"&R1C20&RC[-13])&IF(RC[-12]="",,"|n"&R1C21&RC[-12])&IF(RC[-10]="",,"|n"&R1C23&RC[-10])&IF(RC[-9]="",,"|n"&R1C24&RC[-9])&IF(RC[-8]="",,"|n"&R1C25&RC[-8])&IF(RC[-7]="",,"|n"&R1C26&RC[-7])&IF(RC[-6]="",,"|n"&R1C27&RC[-6])&IF(RC[-5]="",,"|n"&R1C28&RC[-5])&IF(RC[-2]="",,"|n"&RC[-2]) -> 
AG1551: =IF(RC[-26]&RC[-25]&RC[-24]&RC[-23]&RC[-22]&RC[-21]="",,R1C6)&IF(RC[-26]="",,"|n"&R1C7&RC[-26])&IF(RC[-25]="",,"|n"&R1C8&RC[-25])&IF(RC[-24]="",,"|n"&R1C9&RC[-24])&IF(RC[-23]="",,"|n"&R1C10&RC[-23])&IF(RC[-22]="",,"|n"&R1C11&RC[-22])&IF(RC[-21]="",,"|n"&R1C12&RC[-21])&IF(RC[-19]&RC[-18]&RC[-17]&RC[-16]="",,"|n"&R1C13)&IF(RC[-19]="",,"|n"&R1C14&RC[-19])&IF(RC[-18]="",,"|n"&R1C15&RC[-18])&IF(RC[-17]="",,"|n"&R1C16&RC[-17])&IF(RC[-16]="",,"|n"&R1C17&RC[-16])&IF(RC[-15]="",,"|n"&R1C18&RC[-15])&IF(RC[-14]="",,"|n"&R1C19&RC[-14])&IF(RC[-13]="",,"|n"&R1C20&RC[-13])&IF(RC[-12]="",,"|n"&R1C21&RC[-12])&IF(RC[-10]="",,"|n"&R1C23&RC[-10])&IF(RC[-9]="",,"|n"&R1C24&RC[-9])&IF(RC[-8]="",,"|n"&R1C25&RC[-8])&IF(RC[-7]="",,"|n"&R1C26&RC[-7])&IF(RC[-6]="",,"|n"&R1C27&RC[-6])&IF(RC[-5]="",,"|n"&R1C28&RC[-5])&IF(RC[-2]="",,"|n"&RC[-2]) -> 
AG1552: =IF(RC[-26]&RC[-25]&RC[-24]&RC[-23]&RC[-22]&RC[-21]="",,R1C6)&IF(RC[-26]="",,"|n"&R1C7&RC[-26])&IF(RC[-25]="",,"|n"&R1C8&RC[-25])&IF(RC[-24]="",,"|n"&R1C9&RC[-24])&IF(RC[-23]="",,"|n"&R1C10&RC[-23])&IF(RC[-22]="",,"|n"&R1C11&RC[-22])&IF(RC[-21]="",,"|n"&R1C12&RC[-21])&IF(RC[-19]&RC[-18]&RC[-17]&RC[-16]="",,"|n"&R1C13)&IF(RC[-19]="",,"|n"&R1C14&RC[-19])&IF(RC[-18]="",,"|n"&R1C15&RC[-18])&IF(RC[-17]="",,"|n"&R1C16&RC[-17])&IF(RC[-16]="",,"|n"&R1C17&RC[-16])&IF(RC[-15]="",,"|n"&R1C18&RC[-15])&IF(RC[-14]="",,"|n"&R1C19&RC[-14])&IF(RC[-13]="",,"|n"&R1C20&RC[-13])&IF(RC[-12]="",,"|n"&R1C21&RC[-12])&IF(RC[-10]="",,"|n"&R1C23&RC[-10])&IF(RC[-9]="",,"|n"&R1C24&RC[-9])&IF(RC[-8]="",,"|n"&R1C25&RC[-8])&IF(RC[-7]="",,"|n"&R1C26&RC[-7])&IF(RC[-6]="",,"|n"&R1C27&RC[-6])&IF(RC[-5]="",,"|n"&R1C28&RC[-5])&IF(RC[-2]="",,"|n"&RC[-2]) -> 
AG1553: =IF(RC[-26]&RC[-25]&RC[-24]&RC[-23]&RC[-22]&RC[-21]="",,R1C6)&IF(RC[-26]="",,"|n"&R1C7&RC[-26])&IF(RC[-25]="",,"|n"&R1C8&RC[-25])&IF(RC[-24]="",,"|n"&R1C9&RC[-24])&IF(RC[-23]="",,"|n"&R1C10&RC[-23])&IF(RC[-22]="",,"|n"&R1C11&RC[-22])&IF(RC[-21]="",,"|n"&R1C12&RC[-21])&IF(RC[-19]&RC[-18]&RC[-17]&RC[-16]="",,"|n"&R1C13)&IF(RC[-19]="",,"|n"&R1C14&RC[-19])&IF(RC[-18]="",,"|n"&R1C15&RC[-18])&IF(RC[-17]="",,"|n"&R1C16&RC[-17])&IF(RC[-16]="",,"|n"&R1C17&RC[-16])&IF(RC[-15]="",,"|n"&R1C18&RC[-15])&IF(RC[-14]="",,"|n"&R1C19&RC[-14])&IF(RC[-13]="",,"|n"&R1C20&RC[-13])&IF(RC[-12]="",,"|n"&R1C21&RC[-12])&IF(RC[-10]="",,"|n"&R1C23&RC[-10])&IF(RC[-9]="",,"|n"&R1C24&RC[-9])&IF(RC[-8]="",,"|n"&R1C25&RC[-8])&IF(RC[-7]="",,"|n"&R1C26&RC[-7])&IF(RC[-6]="",,"|n"&R1C27&RC[-6])&IF(RC[-5]="",,"|n"&R1C28&RC[-5])&IF(RC[-2]="",,"|n"&RC[-2]) -> 
AG1554: =IF(RC[-26]&RC[-25]&RC[-24]&RC[-23]&RC[-22]&RC[-21]="",,R1C6)&IF(RC[-26]="",,"|n"&R1C7&RC[-26])&IF(RC[-25]="",,"|n"&R1C8&RC[-25])&IF(RC[-24]="",,"|n"&R1C9&RC[-24])&IF(RC[-23]="",,"|n"&R1C10&RC[-23])&IF(RC[-22]="",,"|n"&R1C11&RC[-22])&IF(RC[-21]="",,"|n"&R1C12&RC[-21])&IF(RC[-19]&RC[-18]&RC[-17]&RC[-16]="",,"|n"&R1C13)&IF(RC[-19]="",,"|n"&R1C14&RC[-19])&IF(RC[-18]="",,"|n"&R1C15&RC[-18])&IF(RC[-17]="",,"|n"&R1C16&RC[-17])&IF(RC[-16]="",,"|n"&R1C17&RC[-16])&IF(RC[-15]="",,"|n"&R1C18&RC[-15])&IF(RC[-14]="",,"|n"&R1C19&RC[-14])&IF(RC[-13]="",,"|n"&R1C20&RC[-13])&IF(RC[-12]="",,"|n"&R1C21&RC[-12])&IF(RC[-10]="",,"|n"&R1C23&RC[-10])&IF(RC[-9]="",,"|n"&R1C24&RC[-9])&IF(RC[-8]="",,"|n"&R1C25&RC[-8])&IF(RC[-7]="",,"|n"&R1C26&RC[-7])&IF(RC[-6]="",,"|n"&R1C27&RC[-6])&IF(RC[-5]="",,"|n"&R1C28&RC[-5])&IF(RC[-2]="",,"|n"&RC[-2]) -> 
AG1555: =IF(RC[-26]&RC[-25]&RC[-24]&RC[-23]&RC[-22]&RC[-21]="",,R1C6)&IF(RC[-26]="",,"|n"&R1C7&RC[-26])&IF(RC[-25]="",,"|n"&R1C8&RC[-25])&IF(RC[-24]="",,"|n"&R1C9&RC[-24])&IF(RC[-23]="",,"|n"&R1C10&RC[-23])&IF(RC[-22]="",,"|n"&R1C11&RC[-22])&IF(RC[-21]="",,"|n"&R1C12&RC[-21])&IF(RC[-19]&RC[-18]&RC[-17]&RC[-16]="",,"|n"&R1C13)&IF(RC[-19]="",,"|n"&R1C14&RC[-19])&IF(RC[-18]="",,"|n"&R1C15&RC[-18])&IF(RC[-17]="",,"|n"&R1C16&RC[-17])&IF(RC[-16]="",,"|n"&R1C17&RC[-16])&IF(RC[-15]="",,"|n"&R1C18&RC[-15])&IF(RC[-14]="",,"|n"&R1C19&RC[-14])&IF(RC[-13]="",,"|n"&R1C20&RC[-13])&IF(RC[-12]="",,"|n"&R1C21&RC[-12])&IF(RC[-10]="",,"|n"&R1C23&RC[-10])&IF(RC[-9]="",,"|n"&R1C24&RC[-9])&IF(RC[-8]="",,"|n"&R1C25&RC[-8])&IF(RC[-7]="",,"|n"&R1C26&RC[-7])&IF(RC[-6]="",,"|n"&R1C27&RC[-6])&IF(RC[-5]="",,"|n"&R1C28&RC[-5])&IF(RC[-2]="",,"|n"&RC[-2]) -> 
AG1556: =IF(RC[-26]&RC[-25]&RC[-24]&RC[-23]&RC[-22]&RC[-21]="",,R1C6)&IF(RC[-26]="",,"|n"&R1C7&RC[-26])&IF(RC[-25]="",,"|n"&R1C8&RC[-25])&IF(RC[-24]="",,"|n"&R1C9&RC[-24])&IF(RC[-23]="",,"|n"&R1C10&RC[-23])&IF(RC[-22]="",,"|n"&R1C11&RC[-22])&IF(RC[-21]="",,"|n"&R1C12&RC[-21])&IF(RC[-19]&RC[-18]&RC[-17]&RC[-16]="",,"|n"&R1C13)&IF(RC[-19]="",,"|n"&R1C14&RC[-19])&IF(RC[-18]="",,"|n"&R1C15&RC[-18])&IF(RC[-17]="",,"|n"&R1C16&RC[-17])&IF(RC[-16]="",,"|n"&R1C17&RC[-16])&IF(RC[-15]="",,"|n"&R1C18&RC[-15])&IF(RC[-14]="",,"|n"&R1C19&RC[-14])&IF(RC[-13]="",,"|n"&R1C20&RC[-13])&IF(RC[-12]="",,"|n"&R1C21&RC[-12])&IF(RC[-10]="",,"|n"&R1C23&RC[-10])&IF(RC[-9]="",,"|n"&R1C24&RC[-9])&IF(RC[-8]="",,"|n"&R1C25&RC[-8])&IF(RC[-7]="",,"|n"&R1C26&RC[-7])&IF(RC[-6]="",,"|n"&R1C27&RC[-6])&IF(RC[-5]="",,"|n"&R1C28&RC[-5])&IF(RC[-2]="",,"|n"&RC[-2]) -> 
AG1557: =IF(RC[-26]&RC[-25]&RC[-24]&RC[-23]&RC[-22]&RC[-21]="",,R1C6)&IF(RC[-26]="",,"|n"&R1C7&RC[-26])&IF(RC[-25]="",,"|n"&R1C8&RC[-25])&IF(RC[-24]="",,"|n"&R1C9&RC[-24])&IF(RC[-23]="",,"|n"&R1C10&RC[-23])&IF(RC[-22]="",,"|n"&R1C11&RC[-22])&IF(RC[-21]="",,"|n"&R1C12&RC[-21])&IF(RC[-19]&RC[-18]&RC[-17]&RC[-16]="",,"|n"&R1C13)&IF(RC[-19]="",,"|n"&R1C14&RC[-19])&IF(RC[-18]="",,"|n"&R1C15&RC[-18])&IF(RC[-17]="",,"|n"&R1C16&RC[-17])&IF(RC[-16]="",,"|n"&R1C17&RC[-16])&IF(RC[-15]="",,"|n"&R1C18&RC[-15])&IF(RC[-14]="",,"|n"&R1C19&RC[-14])&IF(RC[-13]="",,"|n"&R1C20&RC[-13])&IF(RC[-12]="",,"|n"&R1C21&RC[-12])&IF(RC[-10]="",,"|n"&R1C23&RC[-10])&IF(RC[-9]="",,"|n"&R1C24&RC[-9])&IF(RC[-8]="",,"|n"&R1C25&RC[-8])&IF(RC[-7]="",,"|n"&R1C26&RC[-7])&IF(RC[-6]="",,"|n"&R1C27&RC[-6])&IF(RC[-5]="",,"|n"&R1C28&RC[-5])&IF(RC[-2]="",,"|n"&RC[-2]) -> 
AG1558: =IF(RC[-26]&RC[-25]&RC[-24]&RC[-23]&RC[-22]&RC[-21]="",,R1C6)&IF(RC[-26]="",,"|n"&R1C7&RC[-26])&IF(RC[-25]="",,"|n"&R1C8&RC[-25])&IF(RC[-24]="",,"|n"&R1C9&RC[-24])&IF(RC[-23]="",,"|n"&R1C10&RC[-23])&IF(RC[-22]="",,"|n"&R1C11&RC[-22])&IF(RC[-21]="",,"|n"&R1C12&RC[-21])&IF(RC[-19]&RC[-18]&RC[-17]&RC[-16]="",,"|n"&R1C13)&IF(RC[-19]="",,"|n"&R1C14&RC[-19])&IF(RC[-18]="",,"|n"&R1C15&RC[-18])&IF(RC[-17]="",,"|n"&R1C16&RC[-17])&IF(RC[-16]="",,"|n"&R1C17&RC[-16])&IF(RC[-15]="",,"|n"&R1C18&RC[-15])&IF(RC[-14]="",,"|n"&R1C19&RC[-14])&IF(RC[-13]="",,"|n"&R1C20&RC[-13])&IF(RC[-12]="",,"|n"&R1C21&RC[-12])&IF(RC[-10]="",,"|n"&R1C23&RC[-10])&IF(RC[-9]="",,"|n"&R1C24&RC[-9])&IF(RC[-8]="",,"|n"&R1C25&RC[-8])&IF(RC[-7]="",,"|n"&R1C26&RC[-7])&IF(RC[-6]="",,"|n"&R1C27&RC[-6])&IF(RC[-5]="",,"|n"&R1C28&RC[-5])&IF(RC[-2]="",,"|n"&RC[-2]) -> 
AG1559: =IF(RC[-26]&RC[-25]&RC[-24]&RC[-23]&RC[-22]&RC[-21]="",,R1C6)&IF(RC[-26]="",,"|n"&R1C7&RC[-26])&IF(RC[-25]="",,"|n"&R1C8&RC[-25])&IF(RC[-24]="",,"|n"&R1C9&RC[-24])&IF(RC[-23]="",,"|n"&R1C10&RC[-23])&IF(RC[-22]="",,"|n"&R1C11&RC[-22])&IF(RC[-21]="",,"|n"&R1C12&RC[-21])&IF(RC[-19]&RC[-18]&RC[-17]&RC[-16]="",,"|n"&R1C13)&IF(RC[-19]="",,"|n"&R1C14&RC[-19])&IF(RC[-18]="",,"|n"&R1C15&RC[-18])&IF(RC[-17]="",,"|n"&R1C16&RC[-17])&IF(RC[-16]="",,"|n"&R1C17&RC[-16])&IF(RC[-15]="",,"|n"&R1C18&RC[-15])&IF(RC[-14]="",,"|n"&R1C19&RC[-14])&IF(RC[-13]="",,"|n"&R1C20&RC[-13])&IF(RC[-12]="",,"|n"&R1C21&RC[-12])&IF(RC[-10]="",,"|n"&R1C23&RC[-10])&IF(RC[-9]="",,"|n"&R1C24&RC[-9])&IF(RC[-8]="",,"|n"&R1C25&RC[-8])&IF(RC[-7]="",,"|n"&R1C26&RC[-7])&IF(RC[-6]="",,"|n"&R1C27&RC[-6])&IF(RC[-5]="",,"|n"&R1C28&RC[-5])&IF(RC[-2]="",,"|n"&RC[-2]) -> 
AG1560: =IF(RC[-26]&RC[-25]&RC[-24]&RC[-23]&RC[-22]&RC[-21]="",,R1C6)&IF(RC[-26]="",,"|n"&R1C7&RC[-26])&IF(RC[-25]="",,"|n"&R1C8&RC[-25])&IF(RC[-24]="",,"|n"&R1C9&RC[-24])&IF(RC[-23]="",,"|n"&R1C10&RC[-23])&IF(RC[-22]="",,"|n"&R1C11&RC[-22])&IF(RC[-21]="",,"|n"&R1C12&RC[-21])&IF(RC[-19]&RC[-18]&RC[-17]&RC[-16]="",,"|n"&R1C13)&IF(RC[-19]="",,"|n"&R1C14&RC[-19])&IF(RC[-18]="",,"|n"&R1C15&RC[-18])&IF(RC[-17]="",,"|n"&R1C16&RC[-17])&IF(RC[-16]="",,"|n"&R1C17&RC[-16])&IF(RC[-15]="",,"|n"&R1C18&RC[-15])&IF(RC[-14]="",,"|n"&R1C19&RC[-14])&IF(RC[-13]="",,"|n"&R1C20&RC[-13])&IF(RC[-12]="",,"|n"&R1C21&RC[-12])&IF(RC[-10]="",,"|n"&R1C23&RC[-10])&IF(RC[-9]="",,"|n"&R1C24&RC[-9])&IF(RC[-8]="",,"|n"&R1C25&RC[-8])&IF(RC[-7]="",,"|n"&R1C26&RC[-7])&IF(RC[-6]="",,"|n"&R1C27&RC[-6])&IF(RC[-5]="",,"|n"&R1C28&RC[-5])&IF(RC[-2]="",,"|n"&RC[-2]) -> 
AG1561: =IF(RC[-26]&RC[-25]&RC[-24]&RC[-23]&RC[-22]&RC[-21]="",,R1C6)&IF(RC[-26]="",,"|n"&R1C7&RC[-26])&IF(RC[-25]="",,"|n"&R1C8&RC[-25])&IF(RC[-24]="",,"|n"&R1C9&RC[-24])&IF(RC[-23]="",,"|n"&R1C10&RC[-23])&IF(RC[-22]="",,"|n"&R1C11&RC[-22])&IF(RC[-21]="",,"|n"&R1C12&RC[-21])&IF(RC[-19]&RC[-18]&RC[-17]&RC[-16]="",,"|n"&R1C13)&IF(RC[-19]="",,"|n"&R1C14&RC[-19])&IF(RC[-18]="",,"|n"&R1C15&RC[-18])&IF(RC[-17]="",,"|n"&R1C16&RC[-17])&IF(RC[-16]="",,"|n"&R1C17&RC[-16])&IF(RC[-15]="",,"|n"&R1C18&RC[-15])&IF(RC[-14]="",,"|n"&R1C19&RC[-14])&IF(RC[-13]="",,"|n"&R1C20&RC[-13])&IF(RC[-12]="",,"|n"&R1C21&RC[-12])&IF(RC[-10]="",,"|n"&R1C23&RC[-10])&IF(RC[-9]="",,"|n"&R1C24&RC[-9])&IF(RC[-8]="",,"|n"&R1C25&RC[-8])&IF(RC[-7]="",,"|n"&R1C26&RC[-7])&IF(RC[-6]="",,"|n"&R1C27&RC[-6])&IF(RC[-5]="",,"|n"&R1C28&RC[-5])&IF(RC[-2]="",,"|n"&RC[-2]) -> 
AG1562: =IF(RC[-26]&RC[-25]&RC[-24]&RC[-23]&RC[-22]&RC[-21]="",,R1C6)&IF(RC[-26]="",,"|n"&R1C7&RC[-26])&IF(RC[-25]="",,"|n"&R1C8&RC[-25])&IF(RC[-24]="",,"|n"&R1C9&RC[-24])&IF(RC[-23]="",,"|n"&R1C10&RC[-23])&IF(RC[-22]="",,"|n"&R1C11&RC[-22])&IF(RC[-21]="",,"|n"&R1C12&RC[-21])&IF(RC[-19]&RC[-18]&RC[-17]&RC[-16]="",,"|n"&R1C13)&IF(RC[-19]="",,"|n"&R1C14&RC[-19])&IF(RC[-18]="",,"|n"&R1C15&RC[-18])&IF(RC[-17]="",,"|n"&R1C16&RC[-17])&IF(RC[-16]="",,"|n"&R1C17&RC[-16])&IF(RC[-15]="",,"|n"&R1C18&RC[-15])&IF(RC[-14]="",,"|n"&R1C19&RC[-14])&IF(RC[-13]="",,"|n"&R1C20&RC[-13])&IF(RC[-12]="",,"|n"&R1C21&RC[-12])&IF(RC[-10]="",,"|n"&R1C23&RC[-10])&IF(RC[-9]="",,"|n"&R1C24&RC[-9])&IF(RC[-8]="",,"|n"&R1C25&RC[-8])&IF(RC[-7]="",,"|n"&R1C26&RC[-7])&IF(RC[-6]="",,"|n"&R1C27&RC[-6])&IF(RC[-5]="",,"|n"&R1C28&RC[-5])&IF(RC[-2]="",,"|n"&RC[-2]) -> 
AG1563: =IF(RC[-26]&RC[-25]&RC[-24]&RC[-23]&RC[-22]&RC[-21]="",,R1C6)&IF(RC[-26]="",,"|n"&R1C7&RC[-26])&IF(RC[-25]="",,"|n"&R1C8&RC[-25])&IF(RC[-24]="",,"|n"&R1C9&RC[-24])&IF(RC[-23]="",,"|n"&R1C10&RC[-23])&IF(RC[-22]="",,"|n"&R1C11&RC[-22])&IF(RC[-21]="",,"|n"&R1C12&RC[-21])&IF(RC[-19]&RC[-18]&RC[-17]&RC[-16]="",,"|n"&R1C13)&IF(RC[-19]="",,"|n"&R1C14&RC[-19])&IF(RC[-18]="",,"|n"&R1C15&RC[-18])&IF(RC[-17]="",,"|n"&R1C16&RC[-17])&IF(RC[-16]="",,"|n"&R1C17&RC[-16])&IF(RC[-15]="",,"|n"&R1C18&RC[-15])&IF(RC[-14]="",,"|n"&R1C19&RC[-14])&IF(RC[-13]="",,"|n"&R1C20&RC[-13])&IF(RC[-12]="",,"|n"&R1C21&RC[-12])&IF(RC[-10]="",,"|n"&R1C23&RC[-10])&IF(RC[-9]="",,"|n"&R1C24&RC[-9])&IF(RC[-8]="",,"|n"&R1C25&RC[-8])&IF(RC[-7]="",,"|n"&R1C26&RC[-7])&IF(RC[-6]="",,"|n"&R1C27&RC[-6])&IF(RC[-5]="",,"|n"&R1C28&RC[-5])&IF(RC[-2]="",,"|n"&RC[-2]) -> 
AG1564: =IF(RC[-26]&RC[-25]&RC[-24]&RC[-23]&RC[-22]&RC[-21]="",,R1C6)&IF(RC[-26]="",,"|n"&R1C7&RC[-26])&IF(RC[-25]="",,"|n"&R1C8&RC[-25])&IF(RC[-24]="",,"|n"&R1C9&RC[-24])&IF(RC[-23]="",,"|n"&R1C10&RC[-23])&IF(RC[-22]="",,"|n"&R1C11&RC[-22])&IF(RC[-21]="",,"|n"&R1C12&RC[-21])&IF(RC[-19]&RC[-18]&RC[-17]&RC[-16]="",,"|n"&R1C13)&IF(RC[-19]="",,"|n"&R1C14&RC[-19])&IF(RC[-18]="",,"|n"&R1C15&RC[-18])&IF(RC[-17]="",,"|n"&R1C16&RC[-17])&IF(RC[-16]="",,"|n"&R1C17&RC[-16])&IF(RC[-15]="",,"|n"&R1C18&RC[-15])&IF(RC[-14]="",,"|n"&R1C19&RC[-14])&IF(RC[-13]="",,"|n"&R1C20&RC[-13])&IF(RC[-12]="",,"|n"&R1C21&RC[-12])&IF(RC[-10]="",,"|n"&R1C23&RC[-10])&IF(RC[-9]="",,"|n"&R1C24&RC[-9])&IF(RC[-8]="",,"|n"&R1C25&RC[-8])&IF(RC[-7]="",,"|n"&R1C26&RC[-7])&IF(RC[-6]="",,"|n"&R1C27&RC[-6])&IF(RC[-5]="",,"|n"&R1C28&RC[-5])&IF(RC[-2]="",,"|n"&RC[-2]) -> 
AG1565: =IF(RC[-26]&RC[-25]&RC[-24]&RC[-23]&RC[-22]&RC[-21]="",,R1C6)&IF(RC[-26]="",,"|n"&R1C7&RC[-26])&IF(RC[-25]="",,"|n"&R1C8&RC[-25])&IF(RC[-24]="",,"|n"&R1C9&RC[-24])&IF(RC[-23]="",,"|n"&R1C10&RC[-23])&IF(RC[-22]="",,"|n"&R1C11&RC[-22])&IF(RC[-21]="",,"|n"&R1C12&RC[-21])&IF(RC[-19]&RC[-18]&RC[-17]&RC[-16]="",,"|n"&R1C13)&IF(RC[-19]="",,"|n"&R1C14&RC[-19])&IF(RC[-18]="",,"|n"&R1C15&RC[-18])&IF(RC[-17]="",,"|n"&R1C16&RC[-17])&IF(RC[-16]="",,"|n"&R1C17&RC[-16])&IF(RC[-15]="",,"|n"&R1C18&RC[-15])&IF(RC[-14]="",,"|n"&R1C19&RC[-14])&IF(RC[-13]="",,"|n"&R1C20&RC[-13])&IF(RC[-12]="",,"|n"&R1C21&RC[-12])&IF(RC[-10]="",,"|n"&R1C23&RC[-10])&IF(RC[-9]="",,"|n"&R1C24&RC[-9])&IF(RC[-8]="",,"|n"&R1C25&RC[-8])&IF(RC[-7]="",,"|n"&R1C26&RC[-7])&IF(RC[-6]="",,"|n"&R1C27&RC[-6])&IF(RC[-5]="",,"|n"&R1C28&RC[-5])&IF(RC[-2]="",,"|n"&RC[-2]) -> 
AG1566: =IF(RC[-26]&RC[-25]&RC[-24]&RC[-23]&RC[-22]&RC[-21]="",,R1C6)&IF(RC[-26]="",,"|n"&R1C7&RC[-26])&IF(RC[-25]="",,"|n"&R1C8&RC[-25])&IF(RC[-24]="",,"|n"&R1C9&RC[-24])&IF(RC[-23]="",,"|n"&R1C10&RC[-23])&IF(RC[-22]="",,"|n"&R1C11&RC[-22])&IF(RC[-21]="",,"|n"&R1C12&RC[-21])&IF(RC[-19]&RC[-18]&RC[-17]&RC[-16]="",,"|n"&R1C13)&IF(RC[-19]="",,"|n"&R1C14&RC[-19])&IF(RC[-18]="",,"|n"&R1C15&RC[-18])&IF(RC[-17]="",,"|n"&R1C16&RC[-17])&IF(RC[-16]="",,"|n"&R1C17&RC[-16])&IF(RC[-15]="",,"|n"&R1C18&RC[-15])&IF(RC[-14]="",,"|n"&R1C19&RC[-14])&IF(RC[-13]="",,"|n"&R1C20&RC[-13])&IF(RC[-12]="",,"|n"&R1C21&RC[-12])&IF(RC[-10]="",,"|n"&R1C23&RC[-10])&IF(RC[-9]="",,"|n"&R1C24&RC[-9])&IF(RC[-8]="",,"|n"&R1C25&RC[-8])&IF(RC[-7]="",,"|n"&R1C26&RC[-7])&IF(RC[-6]="",,"|n"&R1C27&RC[-6])&IF(RC[-5]="",,"|n"&R1C28&RC[-5])&IF(RC[-2]="",,"|n"&RC[-2]) -> 
AG1567: =IF(RC[-26]&RC[-25]&RC[-24]&RC[-23]&RC[-22]&RC[-21]="",,R1C6)&IF(RC[-26]="",,"|n"&R1C7&RC[-26])&IF(RC[-25]="",,"|n"&R1C8&RC[-25])&IF(RC[-24]="",,"|n"&R1C9&RC[-24])&IF(RC[-23]="",,"|n"&R1C10&RC[-23])&IF(RC[-22]="",,"|n"&R1C11&RC[-22])&IF(RC[-21]="",,"|n"&R1C12&RC[-21])&IF(RC[-19]&RC[-18]&RC[-17]&RC[-16]="",,"|n"&R1C13)&IF(RC[-19]="",,"|n"&R1C14&RC[-19])&IF(RC[-18]="",,"|n"&R1C15&RC[-18])&IF(RC[-17]="",,"|n"&R1C16&RC[-17])&IF(RC[-16]="",,"|n"&R1C17&RC[-16])&IF(RC[-15]="",,"|n"&R1C18&RC[-15])&IF(RC[-14]="",,"|n"&R1C19&RC[-14])&IF(RC[-13]="",,"|n"&R1C20&RC[-13])&IF(RC[-12]="",,"|n"&R1C21&RC[-12])&IF(RC[-10]="",,"|n"&R1C23&RC[-10])&IF(RC[-9]="",,"|n"&R1C24&RC[-9])&IF(RC[-8]="",,"|n"&R1C25&RC[-8])&IF(RC[-7]="",,"|n"&R1C26&RC[-7])&IF(RC[-6]="",,"|n"&R1C27&RC[-6])&IF(RC[-5]="",,"|n"&R1C28&RC[-5])&IF(RC[-2]="",,"|n"&RC[-2]) -> 
AG1568: =IF(RC[-26]&RC[-25]&RC[-24]&RC[-23]&RC[-22]&RC[-21]="",,R1C6)&IF(RC[-26]="",,"|n"&R1C7&RC[-26])&IF(RC[-25]="",,"|n"&R1C8&RC[-25])&IF(RC[-24]="",,"|n"&R1C9&RC[-24])&IF(RC[-23]="",,"|n"&R1C10&RC[-23])&IF(RC[-22]="",,"|n"&R1C11&RC[-22])&IF(RC[-21]="",,"|n"&R1C12&RC[-21])&IF(RC[-19]&RC[-18]&RC[-17]&RC[-16]="",,"|n"&R1C13)&IF(RC[-19]="",,"|n"&R1C14&RC[-19])&IF(RC[-18]="",,"|n"&R1C15&RC[-18])&IF(RC[-17]="",,"|n"&R1C16&RC[-17])&IF(RC[-16]="",,"|n"&R1C17&RC[-16])&IF(RC[-15]="",,"|n"&R1C18&RC[-15])&IF(RC[-14]="",,"|n"&R1C19&RC[-14])&IF(RC[-13]="",,"|n"&R1C20&RC[-13])&IF(RC[-12]="",,"|n"&R1C21&RC[-12])&IF(RC[-10]="",,"|n"&R1C23&RC[-10])&IF(RC[-9]="",,"|n"&R1C24&RC[-9])&IF(RC[-8]="",,"|n"&R1C25&RC[-8])&IF(RC[-7]="",,"|n"&R1C26&RC[-7])&IF(RC[-6]="",,"|n"&R1C27&RC[-6])&IF(RC[-5]="",,"|n"&R1C28&RC[-5])&IF(RC[-2]="",,"|n"&RC[-2]) -> 
AG1569: =IF(RC[-26]&RC[-25]&RC[-24]&RC[-23]&RC[-22]&RC[-21]="",,R1C6)&IF(RC[-26]="",,"|n"&R1C7&RC[-26])&IF(RC[-25]="",,"|n"&R1C8&RC[-25])&IF(RC[-24]="",,"|n"&R1C9&RC[-24])&IF(RC[-23]="",,"|n"&R1C10&RC[-23])&IF(RC[-22]="",,"|n"&R1C11&RC[-22])&IF(RC[-21]="",,"|n"&R1C12&RC[-21])&IF(RC[-19]&RC[-18]&RC[-17]&RC[-16]="",,"|n"&R1C13)&IF(RC[-19]="",,"|n"&R1C14&RC[-19])&IF(RC[-18]="",,"|n"&R1C15&RC[-18])&IF(RC[-17]="",,"|n"&R1C16&RC[-17])&IF(RC[-16]="",,"|n"&R1C17&RC[-16])&IF(RC[-15]="",,"|n"&R1C18&RC[-15])&IF(RC[-14]="",,"|n"&R1C19&RC[-14])&IF(RC[-13]="",,"|n"&R1C20&RC[-13])&IF(RC[-12]="",,"|n"&R1C21&RC[-12])&IF(RC[-10]="",,"|n"&R1C23&RC[-10])&IF(RC[-9]="",,"|n"&R1C24&RC[-9])&IF(RC[-8]="",,"|n"&R1C25&RC[-8])&IF(RC[-7]="",,"|n"&R1C26&RC[-7])&IF(RC[-6]="",,"|n"&R1C27&RC[-6])&IF(RC[-5]="",,"|n"&R1C28&RC[-5])&IF(RC[-2]="",,"|n"&RC[-2]) -> 
AG1570: =IF(RC[-26]&RC[-25]&RC[-24]&RC[-23]&RC[-22]&RC[-21]="",,R1C6)&IF(RC[-26]="",,"|n"&R1C7&RC[-26])&IF(RC[-25]="",,"|n"&R1C8&RC[-25])&IF(RC[-24]="",,"|n"&R1C9&RC[-24])&IF(RC[-23]="",,"|n"&R1C10&RC[-23])&IF(RC[-22]="",,"|n"&R1C11&RC[-22])&IF(RC[-21]="",,"|n"&R1C12&RC[-21])&IF(RC[-19]&RC[-18]&RC[-17]&RC[-16]="",,"|n"&R1C13)&IF(RC[-19]="",,"|n"&R1C14&RC[-19])&IF(RC[-18]="",,"|n"&R1C15&RC[-18])&IF(RC[-17]="",,"|n"&R1C16&RC[-17])&IF(RC[-16]="",,"|n"&R1C17&RC[-16])&IF(RC[-15]="",,"|n"&R1C18&RC[-15])&IF(RC[-14]="",,"|n"&R1C19&RC[-14])&IF(RC[-13]="",,"|n"&R1C20&RC[-13])&IF(RC[-12]="",,"|n"&R1C21&RC[-12])&IF(RC[-10]="",,"|n"&R1C23&RC[-10])&IF(RC[-9]="",,"|n"&R1C24&RC[-9])&IF(RC[-8]="",,"|n"&R1C25&RC[-8])&IF(RC[-7]="",,"|n"&R1C26&RC[-7])&IF(RC[-6]="",,"|n"&R1C27&RC[-6])&IF(RC[-5]="",,"|n"&R1C28&RC[-5])&IF(RC[-2]="",,"|n"&RC[-2]) -> 
AG1571: =IF(RC[-26]&RC[-25]&RC[-24]&RC[-23]&RC[-22]&RC[-21]="",,R1C6)&IF(RC[-26]="",,"|n"&R1C7&RC[-26])&IF(RC[-25]="",,"|n"&R1C8&RC[-25])&IF(RC[-24]="",,"|n"&R1C9&RC[-24])&IF(RC[-23]="",,"|n"&R1C10&RC[-23])&IF(RC[-22]="",,"|n"&R1C11&RC[-22])&IF(RC[-21]="",,"|n"&R1C12&RC[-21])&IF(RC[-19]&RC[-18]&RC[-17]&RC[-16]="",,"|n"&R1C13)&IF(RC[-19]="",,"|n"&R1C14&RC[-19])&IF(RC[-18]="",,"|n"&R1C15&RC[-18])&IF(RC[-17]="",,"|n"&R1C16&RC[-17])&IF(RC[-16]="",,"|n"&R1C17&RC[-16])&IF(RC[-15]="",,"|n"&R1C18&RC[-15])&IF(RC[-14]="",,"|n"&R1C19&RC[-14])&IF(RC[-13]="",,"|n"&R1C20&RC[-13])&IF(RC[-12]="",,"|n"&R1C21&RC[-12])&IF(RC[-10]="",,"|n"&R1C23&RC[-10])&IF(RC[-9]="",,"|n"&R1C24&RC[-9])&IF(RC[-8]="",,"|n"&R1C25&RC[-8])&IF(RC[-7]="",,"|n"&R1C26&RC[-7])&IF(RC[-6]="",,"|n"&R1C27&RC[-6])&IF(RC[-5]="",,"|n"&R1C28&RC[-5])&IF(RC[-2]="",,"|n"&RC[-2]) -> 
AG1572: =IF(RC[-26]&RC[-25]&RC[-24]&RC[-23]&RC[-22]&RC[-21]="",,R1C6)&IF(RC[-26]="",,"|n"&R1C7&RC[-26])&IF(RC[-25]="",,"|n"&R1C8&RC[-25])&IF(RC[-24]="",,"|n"&R1C9&RC[-24])&IF(RC[-23]="",,"|n"&R1C10&RC[-23])&IF(RC[-22]="",,"|n"&R1C11&RC[-22])&IF(RC[-21]="",,"|n"&R1C12&RC[-21])&IF(RC[-19]&RC[-18]&RC[-17]&RC[-16]="",,"|n"&R1C13)&IF(RC[-19]="",,"|n"&R1C14&RC[-19])&IF(RC[-18]="",,"|n"&R1C15&RC[-18])&IF(RC[-17]="",,"|n"&R1C16&RC[-17])&IF(RC[-16]="",,"|n"&R1C17&RC[-16])&IF(RC[-15]="",,"|n"&R1C18&RC[-15])&IF(RC[-14]="",,"|n"&R1C19&RC[-14])&IF(RC[-13]="",,"|n"&R1C20&RC[-13])&IF(RC[-12]="",,"|n"&R1C21&RC[-12])&IF(RC[-10]="",,"|n"&R1C23&RC[-10])&IF(RC[-9]="",,"|n"&R1C24&RC[-9])&IF(RC[-8]="",,"|n"&R1C25&RC[-8])&IF(RC[-7]="",,"|n"&R1C26&RC[-7])&IF(RC[-6]="",,"|n"&R1C27&RC[-6])&IF(RC[-5]="",,"|n"&R1C28&RC[-5])&IF(RC[-2]="",,"|n"&RC[-2]) -> 
AG1573: =IF(RC[-26]&RC[-25]&RC[-24]&RC[-23]&RC[-22]&RC[-21]="",,R1C6)&IF(RC[-26]="",,"|n"&R1C7&RC[-26])&IF(RC[-25]="",,"|n"&R1C8&RC[-25])&IF(RC[-24]="",,"|n"&R1C9&RC[-24])&IF(RC[-23]="",,"|n"&R1C10&RC[-23])&IF(RC[-22]="",,"|n"&R1C11&RC[-22])&IF(RC[-21]="",,"|n"&R1C12&RC[-21])&IF(RC[-19]&RC[-18]&RC[-17]&RC[-16]="",,"|n"&R1C13)&IF(RC[-19]="",,"|n"&R1C14&RC[-19])&IF(RC[-18]="",,"|n"&R1C15&RC[-18])&IF(RC[-17]="",,"|n"&R1C16&RC[-17])&IF(RC[-16]="",,"|n"&R1C17&RC[-16])&IF(RC[-15]="",,"|n"&R1C18&RC[-15])&IF(RC[-14]="",,"|n"&R1C19&RC[-14])&IF(RC[-13]="",,"|n"&R1C20&RC[-13])&IF(RC[-12]="",,"|n"&R1C21&RC[-12])&IF(RC[-10]="",,"|n"&R1C23&RC[-10])&IF(RC[-9]="",,"|n"&R1C24&RC[-9])&IF(RC[-8]="",,"|n"&R1C25&RC[-8])&IF(RC[-7]="",,"|n"&R1C26&RC[-7])&IF(RC[-6]="",,"|n"&R1C27&RC[-6])&IF(RC[-5]="",,"|n"&R1C28&RC[-5])&IF(RC[-2]="",,"|n"&RC[-2]) -> 
AG1574: =IF(RC[-26]&RC[-25]&RC[-24]&RC[-23]&RC[-22]&RC[-21]="",,R1C6)&IF(RC[-26]="",,"|n"&R1C7&RC[-26])&IF(RC[-25]="",,"|n"&R1C8&RC[-25])&IF(RC[-24]="",,"|n"&R1C9&RC[-24])&IF(RC[-23]="",,"|n"&R1C10&RC[-23])&IF(RC[-22]="",,"|n"&R1C11&RC[-22])&IF(RC[-21]="",,"|n"&R1C12&RC[-21])&IF(RC[-19]&RC[-18]&RC[-17]&RC[-16]="",,"|n"&R1C13)&IF(RC[-19]="",,"|n"&R1C14&RC[-19])&IF(RC[-18]="",,"|n"&R1C15&RC[-18])&IF(RC[-17]="",,"|n"&R1C16&RC[-17])&IF(RC[-16]="",,"|n"&R1C17&RC[-16])&IF(RC[-15]="",,"|n"&R1C18&RC[-15])&IF(RC[-14]="",,"|n"&R1C19&RC[-14])&IF(RC[-13]="",,"|n"&R1C20&RC[-13])&IF(RC[-12]="",,"|n"&R1C21&RC[-12])&IF(RC[-10]="",,"|n"&R1C23&RC[-10])&IF(RC[-9]="",,"|n"&R1C24&RC[-9])&IF(RC[-8]="",,"|n"&R1C25&RC[-8])&IF(RC[-7]="",,"|n"&R1C26&RC[-7])&IF(RC[-6]="",,"|n"&R1C27&RC[-6])&IF(RC[-5]="",,"|n"&R1C28&RC[-5])&IF(RC[-2]="",,"|n"&RC[-2]) -> 
AG1575: =IF(RC[-26]&RC[-25]&RC[-24]&RC[-23]&RC[-22]&RC[-21]="",,R1C6)&IF(RC[-26]="",,"|n"&R1C7&RC[-26])&IF(RC[-25]="",,"|n"&R1C8&RC[-25])&IF(RC[-24]="",,"|n"&R1C9&RC[-24])&IF(RC[-23]="",,"|n"&R1C10&RC[-23])&IF(RC[-22]="",,"|n"&R1C11&RC[-22])&IF(RC[-21]="",,"|n"&R1C12&RC[-21])&IF(RC[-19]&RC[-18]&RC[-17]&RC[-16]="",,"|n"&R1C13)&IF(RC[-19]="",,"|n"&R1C14&RC[-19])&IF(RC[-18]="",,"|n"&R1C15&RC[-18])&IF(RC[-17]="",,"|n"&R1C16&RC[-17])&IF(RC[-16]="",,"|n"&R1C17&RC[-16])&IF(RC[-15]="",,"|n"&R1C18&RC[-15])&IF(RC[-14]="",,"|n"&R1C19&RC[-14])&IF(RC[-13]="",,"|n"&R1C20&RC[-13])&IF(RC[-12]="",,"|n"&R1C21&RC[-12])&IF(RC[-10]="",,"|n"&R1C23&RC[-10])&IF(RC[-9]="",,"|n"&R1C24&RC[-9])&IF(RC[-8]="",,"|n"&R1C25&RC[-8])&IF(RC[-7]="",,"|n"&R1C26&RC[-7])&IF(RC[-6]="",,"|n"&R1C27&RC[-6])&IF(RC[-5]="",,"|n"&R1C28&RC[-5])&IF(RC[-2]="",,"|n"&RC[-2]) -> 
AG1576: =IF(RC[-26]&RC[-25]&RC[-24]&RC[-23]&RC[-22]&RC[-21]="",,R1C6)&IF(RC[-26]="",,"|n"&R1C7&RC[-26])&IF(RC[-25]="",,"|n"&R1C8&RC[-25])&IF(RC[-24]="",,"|n"&R1C9&RC[-24])&IF(RC[-23]="",,"|n"&R1C10&RC[-23])&IF(RC[-22]="",,"|n"&R1C11&RC[-22])&IF(RC[-21]="",,"|n"&R1C12&RC[-21])&IF(RC[-19]&RC[-18]&RC[-17]&RC[-16]="",,"|n"&R1C13)&IF(RC[-19]="",,"|n"&R1C14&RC[-19])&IF(RC[-18]="",,"|n"&R1C15&RC[-18])&IF(RC[-17]="",,"|n"&R1C16&RC[-17])&IF(RC[-16]="",,"|n"&R1C17&RC[-16])&IF(RC[-15]="",,"|n"&R1C18&RC[-15])&IF(RC[-14]="",,"|n"&R1C19&RC[-14])&IF(RC[-13]="",,"|n"&R1C20&RC[-13])&IF(RC[-12]="",,"|n"&R1C21&RC[-12])&IF(RC[-10]="",,"|n"&R1C23&RC[-10])&IF(RC[-9]="",,"|n"&R1C24&RC[-9])&IF(RC[-8]="",,"|n"&R1C25&RC[-8])&IF(RC[-7]="",,"|n"&R1C26&RC[-7])&IF(RC[-6]="",,"|n"&R1C27&RC[-6])&IF(RC[-5]="",,"|n"&R1C28&RC[-5])&IF(RC[-2]="",,"|n"&RC[-2]) -> 
AG1577: =IF(RC[-26]&RC[-25]&RC[-24]&RC[-23]&RC[-22]&RC[-21]="",,R1C6)&IF(RC[-26]="",,"|n"&R1C7&RC[-26])&IF(RC[-25]="",,"|n"&R1C8&RC[-25])&IF(RC[-24]="",,"|n"&R1C9&RC[-24])&IF(RC[-23]="",,"|n"&R1C10&RC[-23])&IF(RC[-22]="",,"|n"&R1C11&RC[-22])&IF(RC[-21]="",,"|n"&R1C12&RC[-21])&IF(RC[-19]&RC[-18]&RC[-17]&RC[-16]="",,"|n"&R1C13)&IF(RC[-19]="",,"|n"&R1C14&RC[-19])&IF(RC[-18]="",,"|n"&R1C15&RC[-18])&IF(RC[-17]="",,"|n"&R1C16&RC[-17])&IF(RC[-16]="",,"|n"&R1C17&RC[-16])&IF(RC[-15]="",,"|n"&R1C18&RC[-15])&IF(RC[-14]="",,"|n"&R1C19&RC[-14])&IF(RC[-13]="",,"|n"&R1C20&RC[-13])&IF(RC[-12]="",,"|n"&R1C21&RC[-12])&IF(RC[-10]="",,"|n"&R1C23&RC[-10])&IF(RC[-9]="",,"|n"&R1C24&RC[-9])&IF(RC[-8]="",,"|n"&R1C25&RC[-8])&IF(RC[-7]="",,"|n"&R1C26&RC[-7])&IF(RC[-6]="",,"|n"&R1C27&RC[-6])&IF(RC[-5]="",,"|n"&R1C28&RC[-5])&IF(RC[-2]="",,"|n"&RC[-2]) -> 
AG1578: =IF(RC[-26]&RC[-25]&RC[-24]&RC[-23]&RC[-22]&RC[-21]="",,R1C6)&IF(RC[-26]="",,"|n"&R1C7&RC[-26])&IF(RC[-25]="",,"|n"&R1C8&RC[-25])&IF(RC[-24]="",,"|n"&R1C9&RC[-24])&IF(RC[-23]="",,"|n"&R1C10&RC[-23])&IF(RC[-22]="",,"|n"&R1C11&RC[-22])&IF(RC[-21]="",,"|n"&R1C12&RC[-21])&IF(RC[-19]&RC[-18]&RC[-17]&RC[-16]="",,"|n"&R1C13)&IF(RC[-19]="",,"|n"&R1C14&RC[-19])&IF(RC[-18]="",,"|n"&R1C15&RC[-18])&IF(RC[-17]="",,"|n"&R1C16&RC[-17])&IF(RC[-16]="",,"|n"&R1C17&RC[-16])&IF(RC[-15]="",,"|n"&R1C18&RC[-15])&IF(RC[-14]="",,"|n"&R1C19&RC[-14])&IF(RC[-13]="",,"|n"&R1C20&RC[-13])&IF(RC[-12]="",,"|n"&R1C21&RC[-12])&IF(RC[-10]="",,"|n"&R1C23&RC[-10])&IF(RC[-9]="",,"|n"&R1C24&RC[-9])&IF(RC[-8]="",,"|n"&R1C25&RC[-8])&IF(RC[-7]="",,"|n"&R1C26&RC[-7])&IF(RC[-6]="",,"|n"&R1C27&RC[-6])&IF(RC[-5]="",,"|n"&R1C28&RC[-5])&IF(RC[-2]="",,"|n"&RC[-2]) -> 
AG1579: =IF(RC[-26]&RC[-25]&RC[-24]&RC[-23]&RC[-22]&RC[-21]="",,R1C6)&IF(RC[-26]="",,"|n"&R1C7&RC[-26])&IF(RC[-25]="",,"|n"&R1C8&RC[-25])&IF(RC[-24]="",,"|n"&R1C9&RC[-24])&IF(RC[-23]="",,"|n"&R1C10&RC[-23])&IF(RC[-22]="",,"|n"&R1C11&RC[-22])&IF(RC[-21]="",,"|n"&R1C12&RC[-21])&IF(RC[-19]&RC[-18]&RC[-17]&RC[-16]="",,"|n"&R1C13)&IF(RC[-19]="",,"|n"&R1C14&RC[-19])&IF(RC[-18]="",,"|n"&R1C15&RC[-18])&IF(RC[-17]="",,"|n"&R1C16&RC[-17])&IF(RC[-16]="",,"|n"&R1C17&RC[-16])&IF(RC[-15]="",,"|n"&R1C18&RC[-15])&IF(RC[-14]="",,"|n"&R1C19&RC[-14])&IF(RC[-13]="",,"|n"&R1C20&RC[-13])&IF(RC[-12]="",,"|n"&R1C21&RC[-12])&IF(RC[-10]="",,"|n"&R1C23&RC[-10])&IF(RC[-9]="",,"|n"&R1C24&RC[-9])&IF(RC[-8]="",,"|n"&R1C25&RC[-8])&IF(RC[-7]="",,"|n"&R1C26&RC[-7])&IF(RC[-6]="",,"|n"&R1C27&RC[-6])&IF(RC[-5]="",,"|n"&R1C28&RC[-5])&IF(RC[-2]="",,"|n"&RC[-2]) -> 
AG1580: =IF(RC[-26]&RC[-25]&RC[-24]&RC[-23]&RC[-22]&RC[-21]="",,R1C6)&IF(RC[-26]="",,"|n"&R1C7&RC[-26])&IF(RC[-25]="",,"|n"&R1C8&RC[-25])&IF(RC[-24]="",,"|n"&R1C9&RC[-24])&IF(RC[-23]="",,"|n"&R1C10&RC[-23])&IF(RC[-22]="",,"|n"&R1C11&RC[-22])&IF(RC[-21]="",,"|n"&R1C12&RC[-21])&IF(RC[-19]&RC[-18]&RC[-17]&RC[-16]="",,"|n"&R1C13)&IF(RC[-19]="",,"|n"&R1C14&RC[-19])&IF(RC[-18]="",,"|n"&R1C15&RC[-18])&IF(RC[-17]="",,"|n"&R1C16&RC[-17])&IF(RC[-16]="",,"|n"&R1C17&RC[-16])&IF(RC[-15]="",,"|n"&R1C18&RC[-15])&IF(RC[-14]="",,"|n"&R1C19&RC[-14])&IF(RC[-13]="",,"|n"&R1C20&RC[-13])&IF(RC[-12]="",,"|n"&R1C21&RC[-12])&IF(RC[-10]="",,"|n"&R1C23&RC[-10])&IF(RC[-9]="",,"|n"&R1C24&RC[-9])&IF(RC[-8]="",,"|n"&R1C25&RC[-8])&IF(RC[-7]="",,"|n"&R1C26&RC[-7])&IF(RC[-6]="",,"|n"&R1C27&RC[-6])&IF(RC[-5]="",,"|n"&R1C28&RC[-5])&IF(RC[-2]="",,"|n"&RC[-2]) -> 
AG1581: =IF(RC[-26]&RC[-25]&RC[-24]&RC[-23]&RC[-22]&RC[-21]="",,R1C6)&IF(RC[-26]="",,"|n"&R1C7&RC[-26])&IF(RC[-25]="",,"|n"&R1C8&RC[-25])&IF(RC[-24]="",,"|n"&R1C9&RC[-24])&IF(RC[-23]="",,"|n"&R1C10&RC[-23])&IF(RC[-22]="",,"|n"&R1C11&RC[-22])&IF(RC[-21]="",,"|n"&R1C12&RC[-21])&IF(RC[-19]&RC[-18]&RC[-17]&RC[-16]="",,"|n"&R1C13)&IF(RC[-19]="",,"|n"&R1C14&RC[-19])&IF(RC[-18]="",,"|n"&R1C15&RC[-18])&IF(RC[-17]="",,"|n"&R1C16&RC[-17])&IF(RC[-16]="",,"|n"&R1C17&RC[-16])&IF(RC[-15]="",,"|n"&R1C18&RC[-15])&IF(RC[-14]="",,"|n"&R1C19&RC[-14])&IF(RC[-13]="",,"|n"&R1C20&RC[-13])&IF(RC[-12]="",,"|n"&R1C21&RC[-12])&IF(RC[-10]="",,"|n"&R1C23&RC[-10])&IF(RC[-9]="",,"|n"&R1C24&RC[-9])&IF(RC[-8]="",,"|n"&R1C25&RC[-8])&IF(RC[-7]="",,"|n"&R1C26&RC[-7])&IF(RC[-6]="",,"|n"&R1C27&RC[-6])&IF(RC[-5]="",,"|n"&R1C28&RC[-5])&IF(RC[-2]="",,"|n"&RC[-2]) -> 
AG1582: =IF(RC[-26]&RC[-25]&RC[-24]&RC[-23]&RC[-22]&RC[-21]="",,R1C6)&IF(RC[-26]="",,"|n"&R1C7&RC[-26])&IF(RC[-25]="",,"|n"&R1C8&RC[-25])&IF(RC[-24]="",,"|n"&R1C9&RC[-24])&IF(RC[-23]="",,"|n"&R1C10&RC[-23])&IF(RC[-22]="",,"|n"&R1C11&RC[-22])&IF(RC[-21]="",,"|n"&R1C12&RC[-21])&IF(RC[-19]&RC[-18]&RC[-17]&RC[-16]="",,"|n"&R1C13)&IF(RC[-19]="",,"|n"&R1C14&RC[-19])&IF(RC[-18]="",,"|n"&R1C15&RC[-18])&IF(RC[-17]="",,"|n"&R1C16&RC[-17])&IF(RC[-16]="",,"|n"&R1C17&RC[-16])&IF(RC[-15]="",,"|n"&R1C18&RC[-15])&IF(RC[-14]="",,"|n"&R1C19&RC[-14])&IF(RC[-13]="",,"|n"&R1C20&RC[-13])&IF(RC[-12]="",,"|n"&R1C21&RC[-12])&IF(RC[-10]="",,"|n"&R1C23&RC[-10])&IF(RC[-9]="",,"|n"&R1C24&RC[-9])&IF(RC[-8]="",,"|n"&R1C25&RC[-8])&IF(RC[-7]="",,"|n"&R1C26&RC[-7])&IF(RC[-6]="",,"|n"&R1C27&RC[-6])&IF(RC[-5]="",,"|n"&R1C28&RC[-5])&IF(RC[-2]="",,"|n"&RC[-2]) -> 
AG1583: =IF(RC[-26]&RC[-25]&RC[-24]&RC[-23]&RC[-22]&RC[-21]="",,R1C6)&IF(RC[-26]="",,"|n"&R1C7&RC[-26])&IF(RC[-25]="",,"|n"&R1C8&RC[-25])&IF(RC[-24]="",,"|n"&R1C9&RC[-24])&IF(RC[-23]="",,"|n"&R1C10&RC[-23])&IF(RC[-22]="",,"|n"&R1C11&RC[-22])&IF(RC[-21]="",,"|n"&R1C12&RC[-21])&IF(RC[-19]&RC[-18]&RC[-17]&RC[-16]="",,"|n"&R1C13)&IF(RC[-19]="",,"|n"&R1C14&RC[-19])&IF(RC[-18]="",,"|n"&R1C15&RC[-18])&IF(RC[-17]="",,"|n"&R1C16&RC[-17])&IF(RC[-16]="",,"|n"&R1C17&RC[-16])&IF(RC[-15]="",,"|n"&R1C18&RC[-15])&IF(RC[-14]="",,"|n"&R1C19&RC[-14])&IF(RC[-13]="",,"|n"&R1C20&RC[-13])&IF(RC[-12]="",,"|n"&R1C21&RC[-12])&IF(RC[-10]="",,"|n"&R1C23&RC[-10])&IF(RC[-9]="",,"|n"&R1C24&RC[-9])&IF(RC[-8]="",,"|n"&R1C25&RC[-8])&IF(RC[-7]="",,"|n"&R1C26&RC[-7])&IF(RC[-6]="",,"|n"&R1C27&RC[-6])&IF(RC[-5]="",,"|n"&R1C28&RC[-5])&IF(RC[-2]="",,"|n"&RC[-2]) -> 
AG1584: =IF(RC[-26]&RC[-25]&RC[-24]&RC[-23]&RC[-22]&RC[-21]="",,R1C6)&IF(RC[-26]="",,"|n"&R1C7&RC[-26])&IF(RC[-25]="",,"|n"&R1C8&RC[-25])&IF(RC[-24]="",,"|n"&R1C9&RC[-24])&IF(RC[-23]="",,"|n"&R1C10&RC[-23])&IF(RC[-22]="",,"|n"&R1C11&RC[-22])&IF(RC[-21]="",,"|n"&R1C12&RC[-21])&IF(RC[-19]&RC[-18]&RC[-17]&RC[-16]="",,"|n"&R1C13)&IF(RC[-19]="",,"|n"&R1C14&RC[-19])&IF(RC[-18]="",,"|n"&R1C15&RC[-18])&IF(RC[-17]="",,"|n"&R1C16&RC[-17])&IF(RC[-16]="",,"|n"&R1C17&RC[-16])&IF(RC[-15]="",,"|n"&R1C18&RC[-15])&IF(RC[-14]="",,"|n"&R1C19&RC[-14])&IF(RC[-13]="",,"|n"&R1C20&RC[-13])&IF(RC[-12]="",,"|n"&R1C21&RC[-12])&IF(RC[-10]="",,"|n"&R1C23&RC[-10])&IF(RC[-9]="",,"|n"&R1C24&RC[-9])&IF(RC[-8]="",,"|n"&R1C25&RC[-8])&IF(RC[-7]="",,"|n"&R1C26&RC[-7])&IF(RC[-6]="",,"|n"&R1C27&RC[-6])&IF(RC[-5]="",,"|n"&R1C28&RC[-5])&IF(RC[-2]="",,"|n"&RC[-2]) -> 
AG1585: =IF(RC[-26]&RC[-25]&RC[-24]&RC[-23]&RC[-22]&RC[-21]="",,R1C6)&IF(RC[-26]="",,"|n"&R1C7&RC[-26])&IF(RC[-25]="",,"|n"&R1C8&RC[-25])&IF(RC[-24]="",,"|n"&R1C9&RC[-24])&IF(RC[-23]="",,"|n"&R1C10&RC[-23])&IF(RC[-22]="",,"|n"&R1C11&RC[-22])&IF(RC[-21]="",,"|n"&R1C12&RC[-21])&IF(RC[-19]&RC[-18]&RC[-17]&RC[-16]="",,"|n"&R1C13)&IF(RC[-19]="",,"|n"&R1C14&RC[-19])&IF(RC[-18]="",,"|n"&R1C15&RC[-18])&IF(RC[-17]="",,"|n"&R1C16&RC[-17])&IF(RC[-16]="",,"|n"&R1C17&RC[-16])&IF(RC[-15]="",,"|n"&R1C18&RC[-15])&IF(RC[-14]="",,"|n"&R1C19&RC[-14])&IF(RC[-13]="",,"|n"&R1C20&RC[-13])&IF(RC[-12]="",,"|n"&R1C21&RC[-12])&IF(RC[-10]="",,"|n"&R1C23&RC[-10])&IF(RC[-9]="",,"|n"&R1C24&RC[-9])&IF(RC[-8]="",,"|n"&R1C25&RC[-8])&IF(RC[-7]="",,"|n"&R1C26&RC[-7])&IF(RC[-6]="",,"|n"&R1C27&RC[-6])&IF(RC[-5]="",,"|n"&R1C28&RC[-5])&IF(RC[-2]="",,"|n"&RC[-2]) -> 
AG1586: =IF(RC[-26]&RC[-25]&RC[-24]&RC[-23]&RC[-22]&RC[-21]="",,R1C6)&IF(RC[-26]="",,"|n"&R1C7&RC[-26])&IF(RC[-25]="",,"|n"&R1C8&RC[-25])&IF(RC[-24]="",,"|n"&R1C9&RC[-24])&IF(RC[-23]="",,"|n"&R1C10&RC[-23])&IF(RC[-22]="",,"|n"&R1C11&RC[-22])&IF(RC[-21]="",,"|n"&R1C12&RC[-21])&IF(RC[-19]&RC[-18]&RC[-17]&RC[-16]="",,"|n"&R1C13)&IF(RC[-19]="",,"|n"&R1C14&RC[-19])&IF(RC[-18]="",,"|n"&R1C15&RC[-18])&IF(RC[-17]="",,"|n"&R1C16&RC[-17])&IF(RC[-16]="",,"|n"&R1C17&RC[-16])&IF(RC[-15]="",,"|n"&R1C18&RC[-15])&IF(RC[-14]="",,"|n"&R1C19&RC[-14])&IF(RC[-13]="",,"|n"&R1C20&RC[-13])&IF(RC[-12]="",,"|n"&R1C21&RC[-12])&IF(RC[-10]="",,"|n"&R1C23&RC[-10])&IF(RC[-9]="",,"|n"&R1C24&RC[-9])&IF(RC[-8]="",,"|n"&R1C25&RC[-8])&IF(RC[-7]="",,"|n"&R1C26&RC[-7])&IF(RC[-6]="",,"|n"&R1C27&RC[-6])&IF(RC[-5]="",,"|n"&R1C28&RC[-5])&IF(RC[-2]="",,"|n"&RC[-2]) -> 
AG1587: =IF(RC[-26]&RC[-25]&RC[-24]&RC[-23]&RC[-22]&RC[-21]="",,R1C6)&IF(RC[-26]="",,"|n"&R1C7&RC[-26])&IF(RC[-25]="",,"|n"&R1C8&RC[-25])&IF(RC[-24]="",,"|n"&R1C9&RC[-24])&IF(RC[-23]="",,"|n"&R1C10&RC[-23])&IF(RC[-22]="",,"|n"&R1C11&RC[-22])&IF(RC[-21]="",,"|n"&R1C12&RC[-21])&IF(RC[-19]&RC[-18]&RC[-17]&RC[-16]="",,"|n"&R1C13)&IF(RC[-19]="",,"|n"&R1C14&RC[-19])&IF(RC[-18]="",,"|n"&R1C15&RC[-18])&IF(RC[-17]="",,"|n"&R1C16&RC[-17])&IF(RC[-16]="",,"|n"&R1C17&RC[-16])&IF(RC[-15]="",,"|n"&R1C18&RC[-15])&IF(RC[-14]="",,"|n"&R1C19&RC[-14])&IF(RC[-13]="",,"|n"&R1C20&RC[-13])&IF(RC[-12]="",,"|n"&R1C21&RC[-12])&IF(RC[-10]="",,"|n"&R1C23&RC[-10])&IF(RC[-9]="",,"|n"&R1C24&RC[-9])&IF(RC[-8]="",,"|n"&R1C25&RC[-8])&IF(RC[-7]="",,"|n"&R1C26&RC[-7])&IF(RC[-6]="",,"|n"&R1C27&RC[-6])&IF(RC[-5]="",,"|n"&R1C28&RC[-5])&IF(RC[-2]="",,"|n"&RC[-2]) -> 
AG1588: =IF(RC[-26]&RC[-25]&RC[-24]&RC[-23]&RC[-22]&RC[-21]="",,R1C6)&IF(RC[-26]="",,"|n"&R1C7&RC[-26])&IF(RC[-25]="",,"|n"&R1C8&RC[-25])&IF(RC[-24]="",,"|n"&R1C9&RC[-24])&IF(RC[-23]="",,"|n"&R1C10&RC[-23])&IF(RC[-22]="",,"|n"&R1C11&RC[-22])&IF(RC[-21]="",,"|n"&R1C12&RC[-21])&IF(RC[-19]&RC[-18]&RC[-17]&RC[-16]="",,"|n"&R1C13)&IF(RC[-19]="",,"|n"&R1C14&RC[-19])&IF(RC[-18]="",,"|n"&R1C15&RC[-18])&IF(RC[-17]="",,"|n"&R1C16&RC[-17])&IF(RC[-16]="",,"|n"&R1C17&RC[-16])&IF(RC[-15]="",,"|n"&R1C18&RC[-15])&IF(RC[-14]="",,"|n"&R1C19&RC[-14])&IF(RC[-13]="",,"|n"&R1C20&RC[-13])&IF(RC[-12]="",,"|n"&R1C21&RC[-12])&IF(RC[-10]="",,"|n"&R1C23&RC[-10])&IF(RC[-9]="",,"|n"&R1C24&RC[-9])&IF(RC[-8]="",,"|n"&R1C25&RC[-8])&IF(RC[-7]="",,"|n"&R1C26&RC[-7])&IF(RC[-6]="",,"|n"&R1C27&RC[-6])&IF(RC[-5]="",,"|n"&R1C28&RC[-5])&IF(RC[-2]="",,"|n"&RC[-2]) -> 
AG1589: =IF(RC[-26]&RC[-25]&RC[-24]&RC[-23]&RC[-22]&RC[-21]="",,R1C6)&IF(RC[-26]="",,"|n"&R1C7&RC[-26])&IF(RC[-25]="",,"|n"&R1C8&RC[-25])&IF(RC[-24]="",,"|n"&R1C9&RC[-24])&IF(RC[-23]="",,"|n"&R1C10&RC[-23])&IF(RC[-22]="",,"|n"&R1C11&RC[-22])&IF(RC[-21]="",,"|n"&R1C12&RC[-21])&IF(RC[-19]&RC[-18]&RC[-17]&RC[-16]="",,"|n"&R1C13)&IF(RC[-19]="",,"|n"&R1C14&RC[-19])&IF(RC[-18]="",,"|n"&R1C15&RC[-18])&IF(RC[-17]="",,"|n"&R1C16&RC[-17])&IF(RC[-16]="",,"|n"&R1C17&RC[-16])&IF(RC[-15]="",,"|n"&R1C18&RC[-15])&IF(RC[-14]="",,"|n"&R1C19&RC[-14])&IF(RC[-13]="",,"|n"&R1C20&RC[-13])&IF(RC[-12]="",,"|n"&R1C21&RC[-12])&IF(RC[-10]="",,"|n"&R1C23&RC[-10])&IF(RC[-9]="",,"|n"&R1C24&RC[-9])&IF(RC[-8]="",,"|n"&R1C25&RC[-8])&IF(RC[-7]="",,"|n"&R1C26&RC[-7])&IF(RC[-6]="",,"|n"&R1C27&RC[-6])&IF(RC[-5]="",,"|n"&R1C28&RC[-5])&IF(RC[-2]="",,"|n"&RC[-2]) -> 
AG1590: =IF(RC[-26]&RC[-25]&RC[-24]&RC[-23]&RC[-22]&RC[-21]="",,R1C6)&IF(RC[-26]="",,"|n"&R1C7&RC[-26])&IF(RC[-25]="",,"|n"&R1C8&RC[-25])&IF(RC[-24]="",,"|n"&R1C9&RC[-24])&IF(RC[-23]="",,"|n"&R1C10&RC[-23])&IF(RC[-22]="",,"|n"&R1C11&RC[-22])&IF(RC[-21]="",,"|n"&R1C12&RC[-21])&IF(RC[-19]&RC[-18]&RC[-17]&RC[-16]="",,"|n"&R1C13)&IF(RC[-19]="",,"|n"&R1C14&RC[-19])&IF(RC[-18]="",,"|n"&R1C15&RC[-18])&IF(RC[-17]="",,"|n"&R1C16&RC[-17])&IF(RC[-16]="",,"|n"&R1C17&RC[-16])&IF(RC[-15]="",,"|n"&R1C18&RC[-15])&IF(RC[-14]="",,"|n"&R1C19&RC[-14])&IF(RC[-13]="",,"|n"&R1C20&RC[-13])&IF(RC[-12]="",,"|n"&R1C21&RC[-12])&IF(RC[-10]="",,"|n"&R1C23&RC[-10])&IF(RC[-9]="",,"|n"&R1C24&RC[-9])&IF(RC[-8]="",,"|n"&R1C25&RC[-8])&IF(RC[-7]="",,"|n"&R1C26&RC[-7])&IF(RC[-6]="",,"|n"&R1C27&RC[-6])&IF(RC[-5]="",,"|n"&R1C28&RC[-5])&IF(RC[-2]="",,"|n"&RC[-2]) -> 
AG1591: =IF(RC[-26]&RC[-25]&RC[-24]&RC[-23]&RC[-22]&RC[-21]="",,R1C6)&IF(RC[-26]="",,"|n"&R1C7&RC[-26])&IF(RC[-25]="",,"|n"&R1C8&RC[-25])&IF(RC[-24]="",,"|n"&R1C9&RC[-24])&IF(RC[-23]="",,"|n"&R1C10&RC[-23])&IF(RC[-22]="",,"|n"&R1C11&RC[-22])&IF(RC[-21]="",,"|n"&R1C12&RC[-21])&IF(RC[-19]&RC[-18]&RC[-17]&RC[-16]="",,"|n"&R1C13)&IF(RC[-19]="",,"|n"&R1C14&RC[-19])&IF(RC[-18]="",,"|n"&R1C15&RC[-18])&IF(RC[-17]="",,"|n"&R1C16&RC[-17])&IF(RC[-16]="",,"|n"&R1C17&RC[-16])&IF(RC[-15]="",,"|n"&R1C18&RC[-15])&IF(RC[-14]="",,"|n"&R1C19&RC[-14])&IF(RC[-13]="",,"|n"&R1C20&RC[-13])&IF(RC[-12]="",,"|n"&R1C21&RC[-12])&IF(RC[-10]="",,"|n"&R1C23&RC[-10])&IF(RC[-9]="",,"|n"&R1C24&RC[-9])&IF(RC[-8]="",,"|n"&R1C25&RC[-8])&IF(RC[-7]="",,"|n"&R1C26&RC[-7])&IF(RC[-6]="",,"|n"&R1C27&RC[-6])&IF(RC[-5]="",,"|n"&R1C28&RC[-5])&IF(RC[-2]="",,"|n"&RC[-2]) -> 
AG1592: =IF(RC[-26]&RC[-25]&RC[-24]&RC[-23]&RC[-22]&RC[-21]="",,R1C6)&IF(RC[-26]="",,"|n"&R1C7&RC[-26])&IF(RC[-25]="",,"|n"&R1C8&RC[-25])&IF(RC[-24]="",,"|n"&R1C9&RC[-24])&IF(RC[-23]="",,"|n"&R1C10&RC[-23])&IF(RC[-22]="",,"|n"&R1C11&RC[-22])&IF(RC[-21]="",,"|n"&R1C12&RC[-21])&IF(RC[-19]&RC[-18]&RC[-17]&RC[-16]="",,"|n"&R1C13)&IF(RC[-19]="",,"|n"&R1C14&RC[-19])&IF(RC[-18]="",,"|n"&R1C15&RC[-18])&IF(RC[-17]="",,"|n"&R1C16&RC[-17])&IF(RC[-16]="",,"|n"&R1C17&RC[-16])&IF(RC[-15]="",,"|n"&R1C18&RC[-15])&IF(RC[-14]="",,"|n"&R1C19&RC[-14])&IF(RC[-13]="",,"|n"&R1C20&RC[-13])&IF(RC[-12]="",,"|n"&R1C21&RC[-12])&IF(RC[-10]="",,"|n"&R1C23&RC[-10])&IF(RC[-9]="",,"|n"&R1C24&RC[-9])&IF(RC[-8]="",,"|n"&R1C25&RC[-8])&IF(RC[-7]="",,"|n"&R1C26&RC[-7])&IF(RC[-6]="",,"|n"&R1C27&RC[-6])&IF(RC[-5]="",,"|n"&R1C28&RC[-5])&IF(RC[-2]="",,"|n"&RC[-2]) -> 
AG1593: =IF(RC[-26]&RC[-25]&RC[-24]&RC[-23]&RC[-22]&RC[-21]="",,R1C6)&IF(RC[-26]="",,"|n"&R1C7&RC[-26])&IF(RC[-25]="",,"|n"&R1C8&RC[-25])&IF(RC[-24]="",,"|n"&R1C9&RC[-24])&IF(RC[-23]="",,"|n"&R1C10&RC[-23])&IF(RC[-22]="",,"|n"&R1C11&RC[-22])&IF(RC[-21]="",,"|n"&R1C12&RC[-21])&IF(RC[-19]&RC[-18]&RC[-17]&RC[-16]="",,"|n"&R1C13)&IF(RC[-19]="",,"|n"&R1C14&RC[-19])&IF(RC[-18]="",,"|n"&R1C15&RC[-18])&IF(RC[-17]="",,"|n"&R1C16&RC[-17])&IF(RC[-16]="",,"|n"&R1C17&RC[-16])&IF(RC[-15]="",,"|n"&R1C18&RC[-15])&IF(RC[-14]="",,"|n"&R1C19&RC[-14])&IF(RC[-13]="",,"|n"&R1C20&RC[-13])&IF(RC[-12]="",,"|n"&R1C21&RC[-12])&IF(RC[-10]="",,"|n"&R1C23&RC[-10])&IF(RC[-9]="",,"|n"&R1C24&RC[-9])&IF(RC[-8]="",,"|n"&R1C25&RC[-8])&IF(RC[-7]="",,"|n"&R1C26&RC[-7])&IF(RC[-6]="",,"|n"&R1C27&RC[-6])&IF(RC[-5]="",,"|n"&R1C28&RC[-5])&IF(RC[-2]="",,"|n"&RC[-2]) -> 
AG1594: =IF(RC[-26]&RC[-25]&RC[-24]&RC[-23]&RC[-22]&RC[-21]="",,R1C6)&IF(RC[-26]="",,"|n"&R1C7&RC[-26])&IF(RC[-25]="",,"|n"&R1C8&RC[-25])&IF(RC[-24]="",,"|n"&R1C9&RC[-24])&IF(RC[-23]="",,"|n"&R1C10&RC[-23])&IF(RC[-22]="",,"|n"&R1C11&RC[-22])&IF(RC[-21]="",,"|n"&R1C12&RC[-21])&IF(RC[-19]&RC[-18]&RC[-17]&RC[-16]="",,"|n"&R1C13)&IF(RC[-19]="",,"|n"&R1C14&RC[-19])&IF(RC[-18]="",,"|n"&R1C15&RC[-18])&IF(RC[-17]="",,"|n"&R1C16&RC[-17])&IF(RC[-16]="",,"|n"&R1C17&RC[-16])&IF(RC[-15]="",,"|n"&R1C18&RC[-15])&IF(RC[-14]="",,"|n"&R1C19&RC[-14])&IF(RC[-13]="",,"|n"&R1C20&RC[-13])&IF(RC[-12]="",,"|n"&R1C21&RC[-12])&IF(RC[-10]="",,"|n"&R1C23&RC[-10])&IF(RC[-9]="",,"|n"&R1C24&RC[-9])&IF(RC[-8]="",,"|n"&R1C25&RC[-8])&IF(RC[-7]="",,"|n"&R1C26&RC[-7])&IF(RC[-6]="",,"|n"&R1C27&RC[-6])&IF(RC[-5]="",,"|n"&R1C28&RC[-5])&IF(RC[-2]="",,"|n"&RC[-2]) -> 
AG1595: =IF(RC[-26]&RC[-25]&RC[-24]&RC[-23]&RC[-22]&RC[-21]="",,R1C6)&IF(RC[-26]="",,"|n"&R1C7&RC[-26])&IF(RC[-25]="",,"|n"&R1C8&RC[-25])&IF(RC[-24]="",,"|n"&R1C9&RC[-24])&IF(RC[-23]="",,"|n"&R1C10&RC[-23])&IF(RC[-22]="",,"|n"&R1C11&RC[-22])&IF(RC[-21]="",,"|n"&R1C12&RC[-21])&IF(RC[-19]&RC[-18]&RC[-17]&RC[-16]="",,"|n"&R1C13)&IF(RC[-19]="",,"|n"&R1C14&RC[-19])&IF(RC[-18]="",,"|n"&R1C15&RC[-18])&IF(RC[-17]="",,"|n"&R1C16&RC[-17])&IF(RC[-16]="",,"|n"&R1C17&RC[-16])&IF(RC[-15]="",,"|n"&R1C18&RC[-15])&IF(RC[-14]="",,"|n"&R1C19&RC[-14])&IF(RC[-13]="",,"|n"&R1C20&RC[-13])&IF(RC[-12]="",,"|n"&R1C21&RC[-12])&IF(RC[-10]="",,"|n"&R1C23&RC[-10])&IF(RC[-9]="",,"|n"&R1C24&RC[-9])&IF(RC[-8]="",,"|n"&R1C25&RC[-8])&IF(RC[-7]="",,"|n"&R1C26&RC[-7])&IF(RC[-6]="",,"|n"&R1C27&RC[-6])&IF(RC[-5]="",,"|n"&R1C28&RC[-5])&IF(RC[-2]="",,"|n"&RC[-2]) -> 
AG1596: =IF(RC[-26]&RC[-25]&RC[-24]&RC[-23]&RC[-22]&RC[-21]="",,R1C6)&IF(RC[-26]="",,"|n"&R1C7&RC[-26])&IF(RC[-25]="",,"|n"&R1C8&RC[-25])&IF(RC[-24]="",,"|n"&R1C9&RC[-24])&IF(RC[-23]="",,"|n"&R1C10&RC[-23])&IF(RC[-22]="",,"|n"&R1C11&RC[-22])&IF(RC[-21]="",,"|n"&R1C12&RC[-21])&IF(RC[-19]&RC[-18]&RC[-17]&RC[-16]="",,"|n"&R1C13)&IF(RC[-19]="",,"|n"&R1C14&RC[-19])&IF(RC[-18]="",,"|n"&R1C15&RC[-18])&IF(RC[-17]="",,"|n"&R1C16&RC[-17])&IF(RC[-16]="",,"|n"&R1C17&RC[-16])&IF(RC[-15]="",,"|n"&R1C18&RC[-15])&IF(RC[-14]="",,"|n"&R1C19&RC[-14])&IF(RC[-13]="",,"|n"&R1C20&RC[-13])&IF(RC[-12]="",,"|n"&R1C21&RC[-12])&IF(RC[-10]="",,"|n"&R1C23&RC[-10])&IF(RC[-9]="",,"|n"&R1C24&RC[-9])&IF(RC[-8]="",,"|n"&R1C25&RC[-8])&IF(RC[-7]="",,"|n"&R1C26&RC[-7])&IF(RC[-6]="",,"|n"&R1C27&RC[-6])&IF(RC[-5]="",,"|n"&R1C28&RC[-5])&IF(RC[-2]="",,"|n"&RC[-2]) -> 
AG1597: =IF(RC[-26]&RC[-25]&RC[-24]&RC[-23]&RC[-22]&RC[-21]="",,R1C6)&IF(RC[-26]="",,"|n"&R1C7&RC[-26])&IF(RC[-25]="",,"|n"&R1C8&RC[-25])&IF(RC[-24]="",,"|n"&R1C9&RC[-24])&IF(RC[-23]="",,"|n"&R1C10&RC[-23])&IF(RC[-22]="",,"|n"&R1C11&RC[-22])&IF(RC[-21]="",,"|n"&R1C12&RC[-21])&IF(RC[-19]&RC[-18]&RC[-17]&RC[-16]="",,"|n"&R1C13)&IF(RC[-19]="",,"|n"&R1C14&RC[-19])&IF(RC[-18]="",,"|n"&R1C15&RC[-18])&IF(RC[-17]="",,"|n"&R1C16&RC[-17])&IF(RC[-16]="",,"|n"&R1C17&RC[-16])&IF(RC[-15]="",,"|n"&R1C18&RC[-15])&IF(RC[-14]="",,"|n"&R1C19&RC[-14])&IF(RC[-13]="",,"|n"&R1C20&RC[-13])&IF(RC[-12]="",,"|n"&R1C21&RC[-12])&IF(RC[-10]="",,"|n"&R1C23&RC[-10])&IF(RC[-9]="",,"|n"&R1C24&RC[-9])&IF(RC[-8]="",,"|n"&R1C25&RC[-8])&IF(RC[-7]="",,"|n"&R1C26&RC[-7])&IF(RC[-6]="",,"|n"&R1C27&RC[-6])&IF(RC[-5]="",,"|n"&R1C28&RC[-5])&IF(RC[-2]="",,"|n"&RC[-2]) -> 
AG1598: =IF(RC[-26]&RC[-25]&RC[-24]&RC[-23]&RC[-22]&RC[-21]="",,R1C6)&IF(RC[-26]="",,"|n"&R1C7&RC[-26])&IF(RC[-25]="",,"|n"&R1C8&RC[-25])&IF(RC[-24]="",,"|n"&R1C9&RC[-24])&IF(RC[-23]="",,"|n"&R1C10&RC[-23])&IF(RC[-22]="",,"|n"&R1C11&RC[-22])&IF(RC[-21]="",,"|n"&R1C12&RC[-21])&IF(RC[-19]&RC[-18]&RC[-17]&RC[-16]="",,"|n"&R1C13)&IF(RC[-19]="",,"|n"&R1C14&RC[-19])&IF(RC[-18]="",,"|n"&R1C15&RC[-18])&IF(RC[-17]="",,"|n"&R1C16&RC[-17])&IF(RC[-16]="",,"|n"&R1C17&RC[-16])&IF(RC[-15]="",,"|n"&R1C18&RC[-15])&IF(RC[-14]="",,"|n"&R1C19&RC[-14])&IF(RC[-13]="",,"|n"&R1C20&RC[-13])&IF(RC[-12]="",,"|n"&R1C21&RC[-12])&IF(RC[-10]="",,"|n"&R1C23&RC[-10])&IF(RC[-9]="",,"|n"&R1C24&RC[-9])&IF(RC[-8]="",,"|n"&R1C25&RC[-8])&IF(RC[-7]="",,"|n"&R1C26&RC[-7])&IF(RC[-6]="",,"|n"&R1C27&RC[-6])&IF(RC[-5]="",,"|n"&R1C28&RC[-5])&IF(RC[-2]="",,"|n"&RC[-2]) -> 
AG1599: =IF(RC[-26]&RC[-25]&RC[-24]&RC[-23]&RC[-22]&RC[-21]="",,R1C6)&IF(RC[-26]="",,"|n"&R1C7&RC[-26])&IF(RC[-25]="",,"|n"&R1C8&RC[-25])&IF(RC[-24]="",,"|n"&R1C9&RC[-24])&IF(RC[-23]="",,"|n"&R1C10&RC[-23])&IF(RC[-22]="",,"|n"&R1C11&RC[-22])&IF(RC[-21]="",,"|n"&R1C12&RC[-21])&IF(RC[-19]&RC[-18]&RC[-17]&RC[-16]="",,"|n"&R1C13)&IF(RC[-19]="",,"|n"&R1C14&RC[-19])&IF(RC[-18]="",,"|n"&R1C15&RC[-18])&IF(RC[-17]="",,"|n"&R1C16&RC[-17])&IF(RC[-16]="",,"|n"&R1C17&RC[-16])&IF(RC[-15]="",,"|n"&R1C18&RC[-15])&IF(RC[-14]="",,"|n"&R1C19&RC[-14])&IF(RC[-13]="",,"|n"&R1C20&RC[-13])&IF(RC[-12]="",,"|n"&R1C21&RC[-12])&IF(RC[-10]="",,"|n"&R1C23&RC[-10])&IF(RC[-9]="",,"|n"&R1C24&RC[-9])&IF(RC[-8]="",,"|n"&R1C25&RC[-8])&IF(RC[-7]="",,"|n"&R1C26&RC[-7])&IF(RC[-6]="",,"|n"&R1C27&RC[-6])&IF(RC[-5]="",,"|n"&R1C28&RC[-5])&IF(RC[-2]="",,"|n"&RC[-2]) -> 
AG1600: =IF(RC[-26]&RC[-25]&RC[-24]&RC[-23]&RC[-22]&RC[-21]="",,R1C6)&IF(RC[-26]="",,"|n"&R1C7&RC[-26])&IF(RC[-25]="",,"|n"&R1C8&RC[-25])&IF(RC[-24]="",,"|n"&R1C9&RC[-24])&IF(RC[-23]="",,"|n"&R1C10&RC[-23])&IF(RC[-22]="",,"|n"&R1C11&RC[-22])&IF(RC[-21]="",,"|n"&R1C12&RC[-21])&IF(RC[-19]&RC[-18]&RC[-17]&RC[-16]="",,"|n"&R1C13)&IF(RC[-19]="",,"|n"&R1C14&RC[-19])&IF(RC[-18]="",,"|n"&R1C15&RC[-18])&IF(RC[-17]="",,"|n"&R1C16&RC[-17])&IF(RC[-16]="",,"|n"&R1C17&RC[-16])&IF(RC[-15]="",,"|n"&R1C18&RC[-15])&IF(RC[-14]="",,"|n"&R1C19&RC[-14])&IF(RC[-13]="",,"|n"&R1C20&RC[-13])&IF(RC[-12]="",,"|n"&R1C21&RC[-12])&IF(RC[-10]="",,"|n"&R1C23&RC[-10])&IF(RC[-9]="",,"|n"&R1C24&RC[-9])&IF(RC[-8]="",,"|n"&R1C25&RC[-8])&IF(RC[-7]="",,"|n"&R1C26&RC[-7])&IF(RC[-6]="",,"|n"&R1C27&RC[-6])&IF(RC[-5]="",,"|n"&R1C28&RC[-5])&IF(RC[-2]="",,"|n"&RC[-2]) -> 
AG1601: =IF(RC[-26]&RC[-25]&RC[-24]&RC[-23]&RC[-22]&RC[-21]="",,R1C6)&IF(RC[-26]="",,"|n"&R1C7&RC[-26])&IF(RC[-25]="",,"|n"&R1C8&RC[-25])&IF(RC[-24]="",,"|n"&R1C9&RC[-24])&IF(RC[-23]="",,"|n"&R1C10&RC[-23])&IF(RC[-22]="",,"|n"&R1C11&RC[-22])&IF(RC[-21]="",,"|n"&R1C12&RC[-21])&IF(RC[-19]&RC[-18]&RC[-17]&RC[-16]="",,"|n"&R1C13)&IF(RC[-19]="",,"|n"&R1C14&RC[-19])&IF(RC[-18]="",,"|n"&R1C15&RC[-18])&IF(RC[-17]="",,"|n"&R1C16&RC[-17])&IF(RC[-16]="",,"|n"&R1C17&RC[-16])&IF(RC[-15]="",,"|n"&R1C18&RC[-15])&IF(RC[-14]="",,"|n"&R1C19&RC[-14])&IF(RC[-13]="",,"|n"&R1C20&RC[-13])&IF(RC[-12]="",,"|n"&R1C21&RC[-12])&IF(RC[-10]="",,"|n"&R1C23&RC[-10])&IF(RC[-9]="",,"|n"&R1C24&RC[-9])&IF(RC[-8]="",,"|n"&R1C25&RC[-8])&IF(RC[-7]="",,"|n"&R1C26&RC[-7])&IF(RC[-6]="",,"|n"&R1C27&RC[-6])&IF(RC[-5]="",,"|n"&R1C28&RC[-5])&IF(RC[-2]="",,"|n"&RC[-2]) -> 
AG1602: =IF(RC[-26]&RC[-25]&RC[-24]&RC[-23]&RC[-22]&RC[-21]="",,R1C6)&IF(RC[-26]="",,"|n"&R1C7&RC[-26])&IF(RC[-25]="",,"|n"&R1C8&RC[-25])&IF(RC[-24]="",,"|n"&R1C9&RC[-24])&IF(RC[-23]="",,"|n"&R1C10&RC[-23])&IF(RC[-22]="",,"|n"&R1C11&RC[-22])&IF(RC[-21]="",,"|n"&R1C12&RC[-21])&IF(RC[-19]&RC[-18]&RC[-17]&RC[-16]="",,"|n"&R1C13)&IF(RC[-19]="",,"|n"&R1C14&RC[-19])&IF(RC[-18]="",,"|n"&R1C15&RC[-18])&IF(RC[-17]="",,"|n"&R1C16&RC[-17])&IF(RC[-16]="",,"|n"&R1C17&RC[-16])&IF(RC[-15]="",,"|n"&R1C18&RC[-15])&IF(RC[-14]="",,"|n"&R1C19&RC[-14])&IF(RC[-13]="",,"|n"&R1C20&RC[-13])&IF(RC[-12]="",,"|n"&R1C21&RC[-12])&IF(RC[-10]="",,"|n"&R1C23&RC[-10])&IF(RC[-9]="",,"|n"&R1C24&RC[-9])&IF(RC[-8]="",,"|n"&R1C25&RC[-8])&IF(RC[-7]="",,"|n"&R1C26&RC[-7])&IF(RC[-6]="",,"|n"&R1C27&RC[-6])&IF(RC[-5]="",,"|n"&R1C28&RC[-5])&IF(RC[-2]="",,"|n"&RC[-2]) -> 
AG1603: =IF(RC[-26]&RC[-25]&RC[-24]&RC[-23]&RC[-22]&RC[-21]="",,R1C6)&IF(RC[-26]="",,"|n"&R1C7&RC[-26])&IF(RC[-25]="",,"|n"&R1C8&RC[-25])&IF(RC[-24]="",,"|n"&R1C9&RC[-24])&IF(RC[-23]="",,"|n"&R1C10&RC[-23])&IF(RC[-22]="",,"|n"&R1C11&RC[-22])&IF(RC[-21]="",,"|n"&R1C12&RC[-21])&IF(RC[-19]&RC[-18]&RC[-17]&RC[-16]="",,"|n"&R1C13)&IF(RC[-19]="",,"|n"&R1C14&RC[-19])&IF(RC[-18]="",,"|n"&R1C15&RC[-18])&IF(RC[-17]="",,"|n"&R1C16&RC[-17])&IF(RC[-16]="",,"|n"&R1C17&RC[-16])&IF(RC[-15]="",,"|n"&R1C18&RC[-15])&IF(RC[-14]="",,"|n"&R1C19&RC[-14])&IF(RC[-13]="",,"|n"&R1C20&RC[-13])&IF(RC[-12]="",,"|n"&R1C21&RC[-12])&IF(RC[-10]="",,"|n"&R1C23&RC[-10])&IF(RC[-9]="",,"|n"&R1C24&RC[-9])&IF(RC[-8]="",,"|n"&R1C25&RC[-8])&IF(RC[-7]="",,"|n"&R1C26&RC[-7])&IF(RC[-6]="",,"|n"&R1C27&RC[-6])&IF(RC[-5]="",,"|n"&R1C28&RC[-5])&IF(RC[-2]="",,"|n"&RC[-2]) -> 
AG1604: =IF(RC[-26]&RC[-25]&RC[-24]&RC[-23]&RC[-22]&RC[-21]="",,R1C6)&IF(RC[-26]="",,"|n"&R1C7&RC[-26])&IF(RC[-25]="",,"|n"&R1C8&RC[-25])&IF(RC[-24]="",,"|n"&R1C9&RC[-24])&IF(RC[-23]="",,"|n"&R1C10&RC[-23])&IF(RC[-22]="",,"|n"&R1C11&RC[-22])&IF(RC[-21]="",,"|n"&R1C12&RC[-21])&IF(RC[-19]&RC[-18]&RC[-17]&RC[-16]="",,"|n"&R1C13)&IF(RC[-19]="",,"|n"&R1C14&RC[-19])&IF(RC[-18]="",,"|n"&R1C15&RC[-18])&IF(RC[-17]="",,"|n"&R1C16&RC[-17])&IF(RC[-16]="",,"|n"&R1C17&RC[-16])&IF(RC[-15]="",,"|n"&R1C18&RC[-15])&IF(RC[-14]="",,"|n"&R1C19&RC[-14])&IF(RC[-13]="",,"|n"&R1C20&RC[-13])&IF(RC[-12]="",,"|n"&R1C21&RC[-12])&IF(RC[-10]="",,"|n"&R1C23&RC[-10])&IF(RC[-9]="",,"|n"&R1C24&RC[-9])&IF(RC[-8]="",,"|n"&R1C25&RC[-8])&IF(RC[-7]="",,"|n"&R1C26&RC[-7])&IF(RC[-6]="",,"|n"&R1C27&RC[-6])&IF(RC[-5]="",,"|n"&R1C28&RC[-5])&IF(RC[-2]="",,"|n"&RC[-2]) -> 
AG1605: =IF(RC[-26]&RC[-25]&RC[-24]&RC[-23]&RC[-22]&RC[-21]="",,R1C6)&IF(RC[-26]="",,"|n"&R1C7&RC[-26])&IF(RC[-25]="",,"|n"&R1C8&RC[-25])&IF(RC[-24]="",,"|n"&R1C9&RC[-24])&IF(RC[-23]="",,"|n"&R1C10&RC[-23])&IF(RC[-22]="",,"|n"&R1C11&RC[-22])&IF(RC[-21]="",,"|n"&R1C12&RC[-21])&IF(RC[-19]&RC[-18]&RC[-17]&RC[-16]="",,"|n"&R1C13)&IF(RC[-19]="",,"|n"&R1C14&RC[-19])&IF(RC[-18]="",,"|n"&R1C15&RC[-18])&IF(RC[-17]="",,"|n"&R1C16&RC[-17])&IF(RC[-16]="",,"|n"&R1C17&RC[-16])&IF(RC[-15]="",,"|n"&R1C18&RC[-15])&IF(RC[-14]="",,"|n"&R1C19&RC[-14])&IF(RC[-13]="",,"|n"&R1C20&RC[-13])&IF(RC[-12]="",,"|n"&R1C21&RC[-12])&IF(RC[-10]="",,"|n"&R1C23&RC[-10])&IF(RC[-9]="",,"|n"&R1C24&RC[-9])&IF(RC[-8]="",,"|n"&R1C25&RC[-8])&IF(RC[-7]="",,"|n"&R1C26&RC[-7])&IF(RC[-6]="",,"|n"&R1C27&RC[-6])&IF(RC[-5]="",,"|n"&R1C28&RC[-5])&IF(RC[-2]="",,"|n"&RC[-2]) -> 
AG1606: =IF(RC[-26]&RC[-25]&RC[-24]&RC[-23]&RC[-22]&RC[-21]="",,R1C6)&IF(RC[-26]="",,"|n"&R1C7&RC[-26])&IF(RC[-25]="",,"|n"&R1C8&RC[-25])&IF(RC[-24]="",,"|n"&R1C9&RC[-24])&IF(RC[-23]="",,"|n"&R1C10&RC[-23])&IF(RC[-22]="",,"|n"&R1C11&RC[-22])&IF(RC[-21]="",,"|n"&R1C12&RC[-21])&IF(RC[-19]&RC[-18]&RC[-17]&RC[-16]="",,"|n"&R1C13)&IF(RC[-19]="",,"|n"&R1C14&RC[-19])&IF(RC[-18]="",,"|n"&R1C15&RC[-18])&IF(RC[-17]="",,"|n"&R1C16&RC[-17])&IF(RC[-16]="",,"|n"&R1C17&RC[-16])&IF(RC[-15]="",,"|n"&R1C18&RC[-15])&IF(RC[-14]="",,"|n"&R1C19&RC[-14])&IF(RC[-13]="",,"|n"&R1C20&RC[-13])&IF(RC[-12]="",,"|n"&R1C21&RC[-12])&IF(RC[-10]="",,"|n"&R1C23&RC[-10])&IF(RC[-9]="",,"|n"&R1C24&RC[-9])&IF(RC[-8]="",,"|n"&R1C25&RC[-8])&IF(RC[-7]="",,"|n"&R1C26&RC[-7])&IF(RC[-6]="",,"|n"&R1C27&RC[-6])&IF(RC[-5]="",,"|n"&R1C28&RC[-5])&IF(RC[-2]="",,"|n"&RC[-2]) -> 
AG1607: =IF(RC[-26]&RC[-25]&RC[-24]&RC[-23]&RC[-22]&RC[-21]="",,R1C6)&IF(RC[-26]="",,"|n"&R1C7&RC[-26])&IF(RC[-25]="",,"|n"&R1C8&RC[-25])&IF(RC[-24]="",,"|n"&R1C9&RC[-24])&IF(RC[-23]="",,"|n"&R1C10&RC[-23])&IF(RC[-22]="",,"|n"&R1C11&RC[-22])&IF(RC[-21]="",,"|n"&R1C12&RC[-21])&IF(RC[-19]&RC[-18]&RC[-17]&RC[-16]="",,"|n"&R1C13)&IF(RC[-19]="",,"|n"&R1C14&RC[-19])&IF(RC[-18]="",,"|n"&R1C15&RC[-18])&IF(RC[-17]="",,"|n"&R1C16&RC[-17])&IF(RC[-16]="",,"|n"&R1C17&RC[-16])&IF(RC[-15]="",,"|n"&R1C18&RC[-15])&IF(RC[-14]="",,"|n"&R1C19&RC[-14])&IF(RC[-13]="",,"|n"&R1C20&RC[-13])&IF(RC[-12]="",,"|n"&R1C21&RC[-12])&IF(RC[-10]="",,"|n"&R1C23&RC[-10])&IF(RC[-9]="",,"|n"&R1C24&RC[-9])&IF(RC[-8]="",,"|n"&R1C25&RC[-8])&IF(RC[-7]="",,"|n"&R1C26&RC[-7])&IF(RC[-6]="",,"|n"&R1C27&RC[-6])&IF(RC[-5]="",,"|n"&R1C28&RC[-5])&IF(RC[-2]="",,"|n"&RC[-2]) -> 
AG1608: =IF(RC[-26]&RC[-25]&RC[-24]&RC[-23]&RC[-22]&RC[-21]="",,R1C6)&IF(RC[-26]="",,"|n"&R1C7&RC[-26])&IF(RC[-25]="",,"|n"&R1C8&RC[-25])&IF(RC[-24]="",,"|n"&R1C9&RC[-24])&IF(RC[-23]="",,"|n"&R1C10&RC[-23])&IF(RC[-22]="",,"|n"&R1C11&RC[-22])&IF(RC[-21]="",,"|n"&R1C12&RC[-21])&IF(RC[-19]&RC[-18]&RC[-17]&RC[-16]="",,"|n"&R1C13)&IF(RC[-19]="",,"|n"&R1C14&RC[-19])&IF(RC[-18]="",,"|n"&R1C15&RC[-18])&IF(RC[-17]="",,"|n"&R1C16&RC[-17])&IF(RC[-16]="",,"|n"&R1C17&RC[-16])&IF(RC[-15]="",,"|n"&R1C18&RC[-15])&IF(RC[-14]="",,"|n"&R1C19&RC[-14])&IF(RC[-13]="",,"|n"&R1C20&RC[-13])&IF(RC[-12]="",,"|n"&R1C21&RC[-12])&IF(RC[-10]="",,"|n"&R1C23&RC[-10])&IF(RC[-9]="",,"|n"&R1C24&RC[-9])&IF(RC[-8]="",,"|n"&R1C25&RC[-8])&IF(RC[-7]="",,"|n"&R1C26&RC[-7])&IF(RC[-6]="",,"|n"&R1C27&RC[-6])&IF(RC[-5]="",,"|n"&R1C28&RC[-5])&IF(RC[-2]="",,"|n"&RC[-2]) -> 
AG1609: =IF(RC[-26]&RC[-25]&RC[-24]&RC[-23]&RC[-22]&RC[-21]="",,R1C6)&IF(RC[-26]="",,"|n"&R1C7&RC[-26])&IF(RC[-25]="",,"|n"&R1C8&RC[-25])&IF(RC[-24]="",,"|n"&R1C9&RC[-24])&IF(RC[-23]="",,"|n"&R1C10&RC[-23])&IF(RC[-22]="",,"|n"&R1C11&RC[-22])&IF(RC[-21]="",,"|n"&R1C12&RC[-21])&IF(RC[-19]&RC[-18]&RC[-17]&RC[-16]="",,"|n"&R1C13)&IF(RC[-19]="",,"|n"&R1C14&RC[-19])&IF(RC[-18]="",,"|n"&R1C15&RC[-18])&IF(RC[-17]="",,"|n"&R1C16&RC[-17])&IF(RC[-16]="",,"|n"&R1C17&RC[-16])&IF(RC[-15]="",,"|n"&R1C18&RC[-15])&IF(RC[-14]="",,"|n"&R1C19&RC[-14])&IF(RC[-13]="",,"|n"&R1C20&RC[-13])&IF(RC[-12]="",,"|n"&R1C21&RC[-12])&IF(RC[-10]="",,"|n"&R1C23&RC[-10])&IF(RC[-9]="",,"|n"&R1C24&RC[-9])&IF(RC[-8]="",,"|n"&R1C25&RC[-8])&IF(RC[-7]="",,"|n"&R1C26&RC[-7])&IF(RC[-6]="",,"|n"&R1C27&RC[-6])&IF(RC[-5]="",,"|n"&R1C28&RC[-5])&IF(RC[-2]="",,"|n"&RC[-2]) -> 
AG1610: =IF(RC[-26]&RC[-25]&RC[-24]&RC[-23]&RC[-22]&RC[-21]="",,R1C6)&IF(RC[-26]="",,"|n"&R1C7&RC[-26])&IF(RC[-25]="",,"|n"&R1C8&RC[-25])&IF(RC[-24]="",,"|n"&R1C9&RC[-24])&IF(RC[-23]="",,"|n"&R1C10&RC[-23])&IF(RC[-22]="",,"|n"&R1C11&RC[-22])&IF(RC[-21]="",,"|n"&R1C12&RC[-21])&IF(RC[-19]&RC[-18]&RC[-17]&RC[-16]="",,"|n"&R1C13)&IF(RC[-19]="",,"|n"&R1C14&RC[-19])&IF(RC[-18]="",,"|n"&R1C15&RC[-18])&IF(RC[-17]="",,"|n"&R1C16&RC[-17])&IF(RC[-16]="",,"|n"&R1C17&RC[-16])&IF(RC[-15]="",,"|n"&R1C18&RC[-15])&IF(RC[-14]="",,"|n"&R1C19&RC[-14])&IF(RC[-13]="",,"|n"&R1C20&RC[-13])&IF(RC[-12]="",,"|n"&R1C21&RC[-12])&IF(RC[-10]="",,"|n"&R1C23&RC[-10])&IF(RC[-9]="",,"|n"&R1C24&RC[-9])&IF(RC[-8]="",,"|n"&R1C25&RC[-8])&IF(RC[-7]="",,"|n"&R1C26&RC[-7])&IF(RC[-6]="",,"|n"&R1C27&RC[-6])&IF(RC[-5]="",,"|n"&R1C28&RC[-5])&IF(RC[-2]="",,"|n"&RC[-2]) -> 
AG1611: =IF(RC[-26]&RC[-25]&RC[-24]&RC[-23]&RC[-22]&RC[-21]="",,R1C6)&IF(RC[-26]="",,"|n"&R1C7&RC[-26])&IF(RC[-25]="",,"|n"&R1C8&RC[-25])&IF(RC[-24]="",,"|n"&R1C9&RC[-24])&IF(RC[-23]="",,"|n"&R1C10&RC[-23])&IF(RC[-22]="",,"|n"&R1C11&RC[-22])&IF(RC[-21]="",,"|n"&R1C12&RC[-21])&IF(RC[-19]&RC[-18]&RC[-17]&RC[-16]="",,"|n"&R1C13)&IF(RC[-19]="",,"|n"&R1C14&RC[-19])&IF(RC[-18]="",,"|n"&R1C15&RC[-18])&IF(RC[-17]="",,"|n"&R1C16&RC[-17])&IF(RC[-16]="",,"|n"&R1C17&RC[-16])&IF(RC[-15]="",,"|n"&R1C18&RC[-15])&IF(RC[-14]="",,"|n"&R1C19&RC[-14])&IF(RC[-13]="",,"|n"&R1C20&RC[-13])&IF(RC[-12]="",,"|n"&R1C21&RC[-12])&IF(RC[-10]="",,"|n"&R1C23&RC[-10])&IF(RC[-9]="",,"|n"&R1C24&RC[-9])&IF(RC[-8]="",,"|n"&R1C25&RC[-8])&IF(RC[-7]="",,"|n"&R1C26&RC[-7])&IF(RC[-6]="",,"|n"&R1C27&RC[-6])&IF(RC[-5]="",,"|n"&R1C28&RC[-5])&IF(RC[-2]="",,"|n"&RC[-2]) -> 
AG1612: =IF(RC[-26]&RC[-25]&RC[-24]&RC[-23]&RC[-22]&RC[-21]="",,R1C6)&IF(RC[-26]="",,"|n"&R1C7&RC[-26])&IF(RC[-25]="",,"|n"&R1C8&RC[-25])&IF(RC[-24]="",,"|n"&R1C9&RC[-24])&IF(RC[-23]="",,"|n"&R1C10&RC[-23])&IF(RC[-22]="",,"|n"&R1C11&RC[-22])&IF(RC[-21]="",,"|n"&R1C12&RC[-21])&IF(RC[-19]&RC[-18]&RC[-17]&RC[-16]="",,"|n"&R1C13)&IF(RC[-19]="",,"|n"&R1C14&RC[-19])&IF(RC[-18]="",,"|n"&R1C15&RC[-18])&IF(RC[-17]="",,"|n"&R1C16&RC[-17])&IF(RC[-16]="",,"|n"&R1C17&RC[-16])&IF(RC[-15]="",,"|n"&R1C18&RC[-15])&IF(RC[-14]="",,"|n"&R1C19&RC[-14])&IF(RC[-13]="",,"|n"&R1C20&RC[-13])&IF(RC[-12]="",,"|n"&R1C21&RC[-12])&IF(RC[-10]="",,"|n"&R1C23&RC[-10])&IF(RC[-9]="",,"|n"&R1C24&RC[-9])&IF(RC[-8]="",,"|n"&R1C25&RC[-8])&IF(RC[-7]="",,"|n"&R1C26&RC[-7])&IF(RC[-6]="",,"|n"&R1C27&RC[-6])&IF(RC[-5]="",,"|n"&R1C28&RC[-5])&IF(RC[-2]="",,"|n"&RC[-2]) -> 
AG1613: =IF(RC[-26]&RC[-25]&RC[-24]&RC[-23]&RC[-22]&RC[-21]="",,R1C6)&IF(RC[-26]="",,"|n"&R1C7&RC[-26])&IF(RC[-25]="",,"|n"&R1C8&RC[-25])&IF(RC[-24]="",,"|n"&R1C9&RC[-24])&IF(RC[-23]="",,"|n"&R1C10&RC[-23])&IF(RC[-22]="",,"|n"&R1C11&RC[-22])&IF(RC[-21]="",,"|n"&R1C12&RC[-21])&IF(RC[-19]&RC[-18]&RC[-17]&RC[-16]="",,"|n"&R1C13)&IF(RC[-19]="",,"|n"&R1C14&RC[-19])&IF(RC[-18]="",,"|n"&R1C15&RC[-18])&IF(RC[-17]="",,"|n"&R1C16&RC[-17])&IF(RC[-16]="",,"|n"&R1C17&RC[-16])&IF(RC[-15]="",,"|n"&R1C18&RC[-15])&IF(RC[-14]="",,"|n"&R1C19&RC[-14])&IF(RC[-13]="",,"|n"&R1C20&RC[-13])&IF(RC[-12]="",,"|n"&R1C21&RC[-12])&IF(RC[-10]="",,"|n"&R1C23&RC[-10])&IF(RC[-9]="",,"|n"&R1C24&RC[-9])&IF(RC[-8]="",,"|n"&R1C25&RC[-8])&IF(RC[-7]="",,"|n"&R1C26&RC[-7])&IF(RC[-6]="",,"|n"&R1C27&RC[-6])&IF(RC[-5]="",,"|n"&R1C28&RC[-5])&IF(RC[-2]="",,"|n"&RC[-2]) -> 
AG1614: =IF(RC[-26]&RC[-25]&RC[-24]&RC[-23]&RC[-22]&RC[-21]="",,R1C6)&IF(RC[-26]="",,"|n"&R1C7&RC[-26])&IF(RC[-25]="",,"|n"&R1C8&RC[-25])&IF(RC[-24]="",,"|n"&R1C9&RC[-24])&IF(RC[-23]="",,"|n"&R1C10&RC[-23])&IF(RC[-22]="",,"|n"&R1C11&RC[-22])&IF(RC[-21]="",,"|n"&R1C12&RC[-21])&IF(RC[-19]&RC[-18]&RC[-17]&RC[-16]="",,"|n"&R1C13)&IF(RC[-19]="",,"|n"&R1C14&RC[-19])&IF(RC[-18]="",,"|n"&R1C15&RC[-18])&IF(RC[-17]="",,"|n"&R1C16&RC[-17])&IF(RC[-16]="",,"|n"&R1C17&RC[-16])&IF(RC[-15]="",,"|n"&R1C18&RC[-15])&IF(RC[-14]="",,"|n"&R1C19&RC[-14])&IF(RC[-13]="",,"|n"&R1C20&RC[-13])&IF(RC[-12]="",,"|n"&R1C21&RC[-12])&IF(RC[-10]="",,"|n"&R1C23&RC[-10])&IF(RC[-9]="",,"|n"&R1C24&RC[-9])&IF(RC[-8]="",,"|n"&R1C25&RC[-8])&IF(RC[-7]="",,"|n"&R1C26&RC[-7])&IF(RC[-6]="",,"|n"&R1C27&RC[-6])&IF(RC[-5]="",,"|n"&R1C28&RC[-5])&IF(RC[-2]="",,"|n"&RC[-2]) -> 
AG1615: =IF(RC[-26]&RC[-25]&RC[-24]&RC[-23]&RC[-22]&RC[-21]="",,R1C6)&IF(RC[-26]="",,"|n"&R1C7&RC[-26])&IF(RC[-25]="",,"|n"&R1C8&RC[-25])&IF(RC[-24]="",,"|n"&R1C9&RC[-24])&IF(RC[-23]="",,"|n"&R1C10&RC[-23])&IF(RC[-22]="",,"|n"&R1C11&RC[-22])&IF(RC[-21]="",,"|n"&R1C12&RC[-21])&IF(RC[-19]&RC[-18]&RC[-17]&RC[-16]="",,"|n"&R1C13)&IF(RC[-19]="",,"|n"&R1C14&RC[-19])&IF(RC[-18]="",,"|n"&R1C15&RC[-18])&IF(RC[-17]="",,"|n"&R1C16&RC[-17])&IF(RC[-16]="",,"|n"&R1C17&RC[-16])&IF(RC[-15]="",,"|n"&R1C18&RC[-15])&IF(RC[-14]="",,"|n"&R1C19&RC[-14])&IF(RC[-13]="",,"|n"&R1C20&RC[-13])&IF(RC[-12]="",,"|n"&R1C21&RC[-12])&IF(RC[-10]="",,"|n"&R1C23&RC[-10])&IF(RC[-9]="",,"|n"&R1C24&RC[-9])&IF(RC[-8]="",,"|n"&R1C25&RC[-8])&IF(RC[-7]="",,"|n"&R1C26&RC[-7])&IF(RC[-6]="",,"|n"&R1C27&RC[-6])&IF(RC[-5]="",,"|n"&R1C28&RC[-5])&IF(RC[-2]="",,"|n"&RC[-2]) -> 
AG1616: =IF(RC[-26]&RC[-25]&RC[-24]&RC[-23]&RC[-22]&RC[-21]="",,R1C6)&IF(RC[-26]="",,"|n"&R1C7&RC[-26])&IF(RC[-25]="",,"|n"&R1C8&RC[-25])&IF(RC[-24]="",,"|n"&R1C9&RC[-24])&IF(RC[-23]="",,"|n"&R1C10&RC[-23])&IF(RC[-22]="",,"|n"&R1C11&RC[-22])&IF(RC[-21]="",,"|n"&R1C12&RC[-21])&IF(RC[-19]&RC[-18]&RC[-17]&RC[-16]="",,"|n"&R1C13)&IF(RC[-19]="",,"|n"&R1C14&RC[-19])&IF(RC[-18]="",,"|n"&R1C15&RC[-18])&IF(RC[-17]="",,"|n"&R1C16&RC[-17])&IF(RC[-16]="",,"|n"&R1C17&RC[-16])&IF(RC[-15]="",,"|n"&R1C18&RC[-15])&IF(RC[-14]="",,"|n"&R1C19&RC[-14])&IF(RC[-13]="",,"|n"&R1C20&RC[-13])&IF(RC[-12]="",,"|n"&R1C21&RC[-12])&IF(RC[-10]="",,"|n"&R1C23&RC[-10])&IF(RC[-9]="",,"|n"&R1C24&RC[-9])&IF(RC[-8]="",,"|n"&R1C25&RC[-8])&IF(RC[-7]="",,"|n"&R1C26&RC[-7])&IF(RC[-6]="",,"|n"&R1C27&RC[-6])&IF(RC[-5]="",,"|n"&R1C28&RC[-5])&IF(RC[-2]="",,"|n"&RC[-2]) -> 
AG1617: =IF(RC[-26]&RC[-25]&RC[-24]&RC[-23]&RC[-22]&RC[-21]="",,R1C6)&IF(RC[-26]="",,"|n"&R1C7&RC[-26])&IF(RC[-25]="",,"|n"&R1C8&RC[-25])&IF(RC[-24]="",,"|n"&R1C9&RC[-24])&IF(RC[-23]="",,"|n"&R1C10&RC[-23])&IF(RC[-22]="",,"|n"&R1C11&RC[-22])&IF(RC[-21]="",,"|n"&R1C12&RC[-21])&IF(RC[-19]&RC[-18]&RC[-17]&RC[-16]="",,"|n"&R1C13)&IF(RC[-19]="",,"|n"&R1C14&RC[-19])&IF(RC[-18]="",,"|n"&R1C15&RC[-18])&IF(RC[-17]="",,"|n"&R1C16&RC[-17])&IF(RC[-16]="",,"|n"&R1C17&RC[-16])&IF(RC[-15]="",,"|n"&R1C18&RC[-15])&IF(RC[-14]="",,"|n"&R1C19&RC[-14])&IF(RC[-13]="",,"|n"&R1C20&RC[-13])&IF(RC[-12]="",,"|n"&R1C21&RC[-12])&IF(RC[-10]="",,"|n"&R1C23&RC[-10])&IF(RC[-9]="",,"|n"&R1C24&RC[-9])&IF(RC[-8]="",,"|n"&R1C25&RC[-8])&IF(RC[-7]="",,"|n"&R1C26&RC[-7])&IF(RC[-6]="",,"|n"&R1C27&RC[-6])&IF(RC[-5]="",,"|n"&R1C28&RC[-5])&IF(RC[-2]="",,"|n"&RC[-2]) -> 
AG1618: =IF(RC[-26]&RC[-25]&RC[-24]&RC[-23]&RC[-22]&RC[-21]="",,R1C6)&IF(RC[-26]="",,"|n"&R1C7&RC[-26])&IF(RC[-25]="",,"|n"&R1C8&RC[-25])&IF(RC[-24]="",,"|n"&R1C9&RC[-24])&IF(RC[-23]="",,"|n"&R1C10&RC[-23])&IF(RC[-22]="",,"|n"&R1C11&RC[-22])&IF(RC[-21]="",,"|n"&R1C12&RC[-21])&IF(RC[-19]&RC[-18]&RC[-17]&RC[-16]="",,"|n"&R1C13)&IF(RC[-19]="",,"|n"&R1C14&RC[-19])&IF(RC[-18]="",,"|n"&R1C15&RC[-18])&IF(RC[-17]="",,"|n"&R1C16&RC[-17])&IF(RC[-16]="",,"|n"&R1C17&RC[-16])&IF(RC[-15]="",,"|n"&R1C18&RC[-15])&IF(RC[-14]="",,"|n"&R1C19&RC[-14])&IF(RC[-13]="",,"|n"&R1C20&RC[-13])&IF(RC[-12]="",,"|n"&R1C21&RC[-12])&IF(RC[-10]="",,"|n"&R1C23&RC[-10])&IF(RC[-9]="",,"|n"&R1C24&RC[-9])&IF(RC[-8]="",,"|n"&R1C25&RC[-8])&IF(RC[-7]="",,"|n"&R1C26&RC[-7])&IF(RC[-6]="",,"|n"&R1C27&RC[-6])&IF(RC[-5]="",,"|n"&R1C28&RC[-5])&IF(RC[-2]="",,"|n"&RC[-2]) -> 
AG1619: =IF(RC[-26]&RC[-25]&RC[-24]&RC[-23]&RC[-22]&RC[-21]="",,R1C6)&IF(RC[-26]="",,"|n"&R1C7&RC[-26])&IF(RC[-25]="",,"|n"&R1C8&RC[-25])&IF(RC[-24]="",,"|n"&R1C9&RC[-24])&IF(RC[-23]="",,"|n"&R1C10&RC[-23])&IF(RC[-22]="",,"|n"&R1C11&RC[-22])&IF(RC[-21]="",,"|n"&R1C12&RC[-21])&IF(RC[-19]&RC[-18]&RC[-17]&RC[-16]="",,"|n"&R1C13)&IF(RC[-19]="",,"|n"&R1C14&RC[-19])&IF(RC[-18]="",,"|n"&R1C15&RC[-18])&IF(RC[-17]="",,"|n"&R1C16&RC[-17])&IF(RC[-16]="",,"|n"&R1C17&RC[-16])&IF(RC[-15]="",,"|n"&R1C18&RC[-15])&IF(RC[-14]="",,"|n"&R1C19&RC[-14])&IF(RC[-13]="",,"|n"&R1C20&RC[-13])&IF(RC[-12]="",,"|n"&R1C21&RC[-12])&IF(RC[-10]="",,"|n"&R1C23&RC[-10])&IF(RC[-9]="",,"|n"&R1C24&RC[-9])&IF(RC[-8]="",,"|n"&R1C25&RC[-8])&IF(RC[-7]="",,"|n"&R1C26&RC[-7])&IF(RC[-6]="",,"|n"&R1C27&RC[-6])&IF(RC[-5]="",,"|n"&R1C28&RC[-5])&IF(RC[-2]="",,"|n"&RC[-2]) -> 
AG1620: =IF(RC[-26]&RC[-25]&RC[-24]&RC[-23]&RC[-22]&RC[-21]="",,R1C6)&IF(RC[-26]="",,"|n"&R1C7&RC[-26])&IF(RC[-25]="",,"|n"&R1C8&RC[-25])&IF(RC[-24]="",,"|n"&R1C9&RC[-24])&IF(RC[-23]="",,"|n"&R1C10&RC[-23])&IF(RC[-22]="",,"|n"&R1C11&RC[-22])&IF(RC[-21]="",,"|n"&R1C12&RC[-21])&IF(RC[-19]&RC[-18]&RC[-17]&RC[-16]="",,"|n"&R1C13)&IF(RC[-19]="",,"|n"&R1C14&RC[-19])&IF(RC[-18]="",,"|n"&R1C15&RC[-18])&IF(RC[-17]="",,"|n"&R1C16&RC[-17])&IF(RC[-16]="",,"|n"&R1C17&RC[-16])&IF(RC[-15]="",,"|n"&R1C18&RC[-15])&IF(RC[-14]="",,"|n"&R1C19&RC[-14])&IF(RC[-13]="",,"|n"&R1C20&RC[-13])&IF(RC[-12]="",,"|n"&R1C21&RC[-12])&IF(RC[-10]="",,"|n"&R1C23&RC[-10])&IF(RC[-9]="",,"|n"&R1C24&RC[-9])&IF(RC[-8]="",,"|n"&R1C25&RC[-8])&IF(RC[-7]="",,"|n"&R1C26&RC[-7])&IF(RC[-6]="",,"|n"&R1C27&RC[-6])&IF(RC[-5]="",,"|n"&R1C28&RC[-5])&IF(RC[-2]="",,"|n"&RC[-2]) -> 
AG1621: =IF(RC[-26]&RC[-25]&RC[-24]&RC[-23]&RC[-22]&RC[-21]="",,R1C6)&IF(RC[-26]="",,"|n"&R1C7&RC[-26])&IF(RC[-25]="",,"|n"&R1C8&RC[-25])&IF(RC[-24]="",,"|n"&R1C9&RC[-24])&IF(RC[-23]="",,"|n"&R1C10&RC[-23])&IF(RC[-22]="",,"|n"&R1C11&RC[-22])&IF(RC[-21]="",,"|n"&R1C12&RC[-21])&IF(RC[-19]&RC[-18]&RC[-17]&RC[-16]="",,"|n"&R1C13)&IF(RC[-19]="",,"|n"&R1C14&RC[-19])&IF(RC[-18]="",,"|n"&R1C15&RC[-18])&IF(RC[-17]="",,"|n"&R1C16&RC[-17])&IF(RC[-16]="",,"|n"&R1C17&RC[-16])&IF(RC[-15]="",,"|n"&R1C18&RC[-15])&IF(RC[-14]="",,"|n"&R1C19&RC[-14])&IF(RC[-13]="",,"|n"&R1C20&RC[-13])&IF(RC[-12]="",,"|n"&R1C21&RC[-12])&IF(RC[-10]="",,"|n"&R1C23&RC[-10])&IF(RC[-9]="",,"|n"&R1C24&RC[-9])&IF(RC[-8]="",,"|n"&R1C25&RC[-8])&IF(RC[-7]="",,"|n"&R1C26&RC[-7])&IF(RC[-6]="",,"|n"&R1C27&RC[-6])&IF(RC[-5]="",,"|n"&R1C28&RC[-5])&IF(RC[-2]="",,"|n"&RC[-2]) -> 
AG1622: =IF(RC[-26]&RC[-25]&RC[-24]&RC[-23]&RC[-22]&RC[-21]="",,R1C6)&IF(RC[-26]="",,"|n"&R1C7&RC[-26])&IF(RC[-25]="",,"|n"&R1C8&RC[-25])&IF(RC[-24]="",,"|n"&R1C9&RC[-24])&IF(RC[-23]="",,"|n"&R1C10&RC[-23])&IF(RC[-22]="",,"|n"&R1C11&RC[-22])&IF(RC[-21]="",,"|n"&R1C12&RC[-21])&IF(RC[-19]&RC[-18]&RC[-17]&RC[-16]="",,"|n"&R1C13)&IF(RC[-19]="",,"|n"&R1C14&RC[-19])&IF(RC[-18]="",,"|n"&R1C15&RC[-18])&IF(RC[-17]="",,"|n"&R1C16&RC[-17])&IF(RC[-16]="",,"|n"&R1C17&RC[-16])&IF(RC[-15]="",,"|n"&R1C18&RC[-15])&IF(RC[-14]="",,"|n"&R1C19&RC[-14])&IF(RC[-13]="",,"|n"&R1C20&RC[-13])&IF(RC[-12]="",,"|n"&R1C21&RC[-12])&IF(RC[-10]="",,"|n"&R1C23&RC[-10])&IF(RC[-9]="",,"|n"&R1C24&RC[-9])&IF(RC[-8]="",,"|n"&R1C25&RC[-8])&IF(RC[-7]="",,"|n"&R1C26&RC[-7])&IF(RC[-6]="",,"|n"&R1C27&RC[-6])&IF(RC[-5]="",,"|n"&R1C28&RC[-5])&IF(RC[-2]="",,"|n"&RC[-2]) -> 
AG1623: =IF(RC[-26]&RC[-25]&RC[-24]&RC[-23]&RC[-22]&RC[-21]="",,R1C6)&IF(RC[-26]="",,"|n"&R1C7&RC[-26])&IF(RC[-25]="",,"|n"&R1C8&RC[-25])&IF(RC[-24]="",,"|n"&R1C9&RC[-24])&IF(RC[-23]="",,"|n"&R1C10&RC[-23])&IF(RC[-22]="",,"|n"&R1C11&RC[-22])&IF(RC[-21]="",,"|n"&R1C12&RC[-21])&IF(RC[-19]&RC[-18]&RC[-17]&RC[-16]="",,"|n"&R1C13)&IF(RC[-19]="",,"|n"&R1C14&RC[-19])&IF(RC[-18]="",,"|n"&R1C15&RC[-18])&IF(RC[-17]="",,"|n"&R1C16&RC[-17])&IF(RC[-16]="",,"|n"&R1C17&RC[-16])&IF(RC[-15]="",,"|n"&R1C18&RC[-15])&IF(RC[-14]="",,"|n"&R1C19&RC[-14])&IF(RC[-13]="",,"|n"&R1C20&RC[-13])&IF(RC[-12]="",,"|n"&R1C21&RC[-12])&IF(RC[-10]="",,"|n"&R1C23&RC[-10])&IF(RC[-9]="",,"|n"&R1C24&RC[-9])&IF(RC[-8]="",,"|n"&R1C25&RC[-8])&IF(RC[-7]="",,"|n"&R1C26&RC[-7])&IF(RC[-6]="",,"|n"&R1C27&RC[-6])&IF(RC[-5]="",,"|n"&R1C28&RC[-5])&IF(RC[-2]="",,"|n"&RC[-2]) -> 
AG1624: =IF(RC[-26]&RC[-25]&RC[-24]&RC[-23]&RC[-22]&RC[-21]="",,R1C6)&IF(RC[-26]="",,"|n"&R1C7&RC[-26])&IF(RC[-25]="",,"|n"&R1C8&RC[-25])&IF(RC[-24]="",,"|n"&R1C9&RC[-24])&IF(RC[-23]="",,"|n"&R1C10&RC[-23])&IF(RC[-22]="",,"|n"&R1C11&RC[-22])&IF(RC[-21]="",,"|n"&R1C12&RC[-21])&IF(RC[-19]&RC[-18]&RC[-17]&RC[-16]="",,"|n"&R1C13)&IF(RC[-19]="",,"|n"&R1C14&RC[-19])&IF(RC[-18]="",,"|n"&R1C15&RC[-18])&IF(RC[-17]="",,"|n"&R1C16&RC[-17])&IF(RC[-16]="",,"|n"&R1C17&RC[-16])&IF(RC[-15]="",,"|n"&R1C18&RC[-15])&IF(RC[-14]="",,"|n"&R1C19&RC[-14])&IF(RC[-13]="",,"|n"&R1C20&RC[-13])&IF(RC[-12]="",,"|n"&R1C21&RC[-12])&IF(RC[-10]="",,"|n"&R1C23&RC[-10])&IF(RC[-9]="",,"|n"&R1C24&RC[-9])&IF(RC[-8]="",,"|n"&R1C25&RC[-8])&IF(RC[-7]="",,"|n"&R1C26&RC[-7])&IF(RC[-6]="",,"|n"&R1C27&RC[-6])&IF(RC[-5]="",,"|n"&R1C28&RC[-5])&IF(RC[-2]="",,"|n"&RC[-2]) -> 
AG1625: =IF(RC[-26]&RC[-25]&RC[-24]&RC[-23]&RC[-22]&RC[-21]="",,R1C6)&IF(RC[-26]="",,"|n"&R1C7&RC[-26])&IF(RC[-25]="",,"|n"&R1C8&RC[-25])&IF(RC[-24]="",,"|n"&R1C9&RC[-24])&IF(RC[-23]="",,"|n"&R1C10&RC[-23])&IF(RC[-22]="",,"|n"&R1C11&RC[-22])&IF(RC[-21]="",,"|n"&R1C12&RC[-21])&IF(RC[-19]&RC[-18]&RC[-17]&RC[-16]="",,"|n"&R1C13)&IF(RC[-19]="",,"|n"&R1C14&RC[-19])&IF(RC[-18]="",,"|n"&R1C15&RC[-18])&IF(RC[-17]="",,"|n"&R1C16&RC[-17])&IF(RC[-16]="",,"|n"&R1C17&RC[-16])&IF(RC[-15]="",,"|n"&R1C18&RC[-15])&IF(RC[-14]="",,"|n"&R1C19&RC[-14])&IF(RC[-13]="",,"|n"&R1C20&RC[-13])&IF(RC[-12]="",,"|n"&R1C21&RC[-12])&IF(RC[-10]="",,"|n"&R1C23&RC[-10])&IF(RC[-9]="",,"|n"&R1C24&RC[-9])&IF(RC[-8]="",,"|n"&R1C25&RC[-8])&IF(RC[-7]="",,"|n"&R1C26&RC[-7])&IF(RC[-6]="",,"|n"&R1C27&RC[-6])&IF(RC[-5]="",,"|n"&R1C28&RC[-5])&IF(RC[-2]="",,"|n"&RC[-2]) -> 
AG1626: =IF(RC[-26]&RC[-25]&RC[-24]&RC[-23]&RC[-22]&RC[-21]="",,R1C6)&IF(RC[-26]="",,"|n"&R1C7&RC[-26])&IF(RC[-25]="",,"|n"&R1C8&RC[-25])&IF(RC[-24]="",,"|n"&R1C9&RC[-24])&IF(RC[-23]="",,"|n"&R1C10&RC[-23])&IF(RC[-22]="",,"|n"&R1C11&RC[-22])&IF(RC[-21]="",,"|n"&R1C12&RC[-21])&IF(RC[-19]&RC[-18]&RC[-17]&RC[-16]="",,"|n"&R1C13)&IF(RC[-19]="",,"|n"&R1C14&RC[-19])&IF(RC[-18]="",,"|n"&R1C15&RC[-18])&IF(RC[-17]="",,"|n"&R1C16&RC[-17])&IF(RC[-16]="",,"|n"&R1C17&RC[-16])&IF(RC[-15]="",,"|n"&R1C18&RC[-15])&IF(RC[-14]="",,"|n"&R1C19&RC[-14])&IF(RC[-13]="",,"|n"&R1C20&RC[-13])&IF(RC[-12]="",,"|n"&R1C21&RC[-12])&IF(RC[-10]="",,"|n"&R1C23&RC[-10])&IF(RC[-9]="",,"|n"&R1C24&RC[-9])&IF(RC[-8]="",,"|n"&R1C25&RC[-8])&IF(RC[-7]="",,"|n"&R1C26&RC[-7])&IF(RC[-6]="",,"|n"&R1C27&RC[-6])&IF(RC[-5]="",,"|n"&R1C28&RC[-5])&IF(RC[-2]="",,"|n"&RC[-2]) -> 
AG1627: =IF(RC[-26]&RC[-25]&RC[-24]&RC[-23]&RC[-22]&RC[-21]="",,R1C6)&IF(RC[-26]="",,"|n"&R1C7&RC[-26])&IF(RC[-25]="",,"|n"&R1C8&RC[-25])&IF(RC[-24]="",,"|n"&R1C9&RC[-24])&IF(RC[-23]="",,"|n"&R1C10&RC[-23])&IF(RC[-22]="",,"|n"&R1C11&RC[-22])&IF(RC[-21]="",,"|n"&R1C12&RC[-21])&IF(RC[-19]&RC[-18]&RC[-17]&RC[-16]="",,"|n"&R1C13)&IF(RC[-19]="",,"|n"&R1C14&RC[-19])&IF(RC[-18]="",,"|n"&R1C15&RC[-18])&IF(RC[-17]="",,"|n"&R1C16&RC[-17])&IF(RC[-16]="",,"|n"&R1C17&RC[-16])&IF(RC[-15]="",,"|n"&R1C18&RC[-15])&IF(RC[-14]="",,"|n"&R1C19&RC[-14])&IF(RC[-13]="",,"|n"&R1C20&RC[-13])&IF(RC[-12]="",,"|n"&R1C21&RC[-12])&IF(RC[-10]="",,"|n"&R1C23&RC[-10])&IF(RC[-9]="",,"|n"&R1C24&RC[-9])&IF(RC[-8]="",,"|n"&R1C25&RC[-8])&IF(RC[-7]="",,"|n"&R1C26&RC[-7])&IF(RC[-6]="",,"|n"&R1C27&RC[-6])&IF(RC[-5]="",,"|n"&R1C28&RC[-5])&IF(RC[-2]="",,"|n"&RC[-2]) -> 
AG1628: =IF(RC[-26]&RC[-25]&RC[-24]&RC[-23]&RC[-22]&RC[-21]="",,R1C6)&IF(RC[-26]="",,"|n"&R1C7&RC[-26])&IF(RC[-25]="",,"|n"&R1C8&RC[-25])&IF(RC[-24]="",,"|n"&R1C9&RC[-24])&IF(RC[-23]="",,"|n"&R1C10&RC[-23])&IF(RC[-22]="",,"|n"&R1C11&RC[-22])&IF(RC[-21]="",,"|n"&R1C12&RC[-21])&IF(RC[-19]&RC[-18]&RC[-17]&RC[-16]="",,"|n"&R1C13)&IF(RC[-19]="",,"|n"&R1C14&RC[-19])&IF(RC[-18]="",,"|n"&R1C15&RC[-18])&IF(RC[-17]="",,"|n"&R1C16&RC[-17])&IF(RC[-16]="",,"|n"&R1C17&RC[-16])&IF(RC[-15]="",,"|n"&R1C18&RC[-15])&IF(RC[-14]="",,"|n"&R1C19&RC[-14])&IF(RC[-13]="",,"|n"&R1C20&RC[-13])&IF(RC[-12]="",,"|n"&R1C21&RC[-12])&IF(RC[-10]="",,"|n"&R1C23&RC[-10])&IF(RC[-9]="",,"|n"&R1C24&RC[-9])&IF(RC[-8]="",,"|n"&R1C25&RC[-8])&IF(RC[-7]="",,"|n"&R1C26&RC[-7])&IF(RC[-6]="",,"|n"&R1C27&RC[-6])&IF(RC[-5]="",,"|n"&R1C28&RC[-5])&IF(RC[-2]="",,"|n"&RC[-2]) -> 
AG1629: =IF(RC[-26]&RC[-25]&RC[-24]&RC[-23]&RC[-22]&RC[-21]="",,R1C6)&IF(RC[-26]="",,"|n"&R1C7&RC[-26])&IF(RC[-25]="",,"|n"&R1C8&RC[-25])&IF(RC[-24]="",,"|n"&R1C9&RC[-24])&IF(RC[-23]="",,"|n"&R1C10&RC[-23])&IF(RC[-22]="",,"|n"&R1C11&RC[-22])&IF(RC[-21]="",,"|n"&R1C12&RC[-21])&IF(RC[-19]&RC[-18]&RC[-17]&RC[-16]="",,"|n"&R1C13)&IF(RC[-19]="",,"|n"&R1C14&RC[-19])&IF(RC[-18]="",,"|n"&R1C15&RC[-18])&IF(RC[-17]="",,"|n"&R1C16&RC[-17])&IF(RC[-16]="",,"|n"&R1C17&RC[-16])&IF(RC[-15]="",,"|n"&R1C18&RC[-15])&IF(RC[-14]="",,"|n"&R1C19&RC[-14])&IF(RC[-13]="",,"|n"&R1C20&RC[-13])&IF(RC[-12]="",,"|n"&R1C21&RC[-12])&IF(RC[-10]="",,"|n"&R1C23&RC[-10])&IF(RC[-9]="",,"|n"&R1C24&RC[-9])&IF(RC[-8]="",,"|n"&R1C25&RC[-8])&IF(RC[-7]="",,"|n"&R1C26&RC[-7])&IF(RC[-6]="",,"|n"&R1C27&RC[-6])&IF(RC[-5]="",,"|n"&R1C28&RC[-5])&IF(RC[-2]="",,"|n"&RC[-2]) -> 
AG1630: =IF(RC[-26]&RC[-25]&RC[-24]&RC[-23]&RC[-22]&RC[-21]="",,R1C6)&IF(RC[-26]="",,"|n"&R1C7&RC[-26])&IF(RC[-25]="",,"|n"&R1C8&RC[-25])&IF(RC[-24]="",,"|n"&R1C9&RC[-24])&IF(RC[-23]="",,"|n"&R1C10&RC[-23])&IF(RC[-22]="",,"|n"&R1C11&RC[-22])&IF(RC[-21]="",,"|n"&R1C12&RC[-21])&IF(RC[-19]&RC[-18]&RC[-17]&RC[-16]="",,"|n"&R1C13)&IF(RC[-19]="",,"|n"&R1C14&RC[-19])&IF(RC[-18]="",,"|n"&R1C15&RC[-18])&IF(RC[-17]="",,"|n"&R1C16&RC[-17])&IF(RC[-16]="",,"|n"&R1C17&RC[-16])&IF(RC[-15]="",,"|n"&R1C18&RC[-15])&IF(RC[-14]="",,"|n"&R1C19&RC[-14])&IF(RC[-13]="",,"|n"&R1C20&RC[-13])&IF(RC[-12]="",,"|n"&R1C21&RC[-12])&IF(RC[-10]="",,"|n"&R1C23&RC[-10])&IF(RC[-9]="",,"|n"&R1C24&RC[-9])&IF(RC[-8]="",,"|n"&R1C25&RC[-8])&IF(RC[-7]="",,"|n"&R1C26&RC[-7])&IF(RC[-6]="",,"|n"&R1C27&RC[-6])&IF(RC[-5]="",,"|n"&R1C28&RC[-5])&IF(RC[-2]="",,"|n"&RC[-2]) -> 
AG1631: =IF(RC[-26]&RC[-25]&RC[-24]&RC[-23]&RC[-22]&RC[-21]="",,R1C6)&IF(RC[-26]="",,"|n"&R1C7&RC[-26])&IF(RC[-25]="",,"|n"&R1C8&RC[-25])&IF(RC[-24]="",,"|n"&R1C9&RC[-24])&IF(RC[-23]="",,"|n"&R1C10&RC[-23])&IF(RC[-22]="",,"|n"&R1C11&RC[-22])&IF(RC[-21]="",,"|n"&R1C12&RC[-21])&IF(RC[-19]&RC[-18]&RC[-17]&RC[-16]="",,"|n"&R1C13)&IF(RC[-19]="",,"|n"&R1C14&RC[-19])&IF(RC[-18]="",,"|n"&R1C15&RC[-18])&IF(RC[-17]="",,"|n"&R1C16&RC[-17])&IF(RC[-16]="",,"|n"&R1C17&RC[-16])&IF(RC[-15]="",,"|n"&R1C18&RC[-15])&IF(RC[-14]="",,"|n"&R1C19&RC[-14])&IF(RC[-13]="",,"|n"&R1C20&RC[-13])&IF(RC[-12]="",,"|n"&R1C21&RC[-12])&IF(RC[-10]="",,"|n"&R1C23&RC[-10])&IF(RC[-9]="",,"|n"&R1C24&RC[-9])&IF(RC[-8]="",,"|n"&R1C25&RC[-8])&IF(RC[-7]="",,"|n"&R1C26&RC[-7])&IF(RC[-6]="",,"|n"&R1C27&RC[-6])&IF(RC[-5]="",,"|n"&R1C28&RC[-5])&IF(RC[-2]="",,"|n"&RC[-2]) -> 
AG1632: =IF(RC[-26]&RC[-25]&RC[-24]&RC[-23]&RC[-22]&RC[-21]="",,R1C6)&IF(RC[-26]="",,"|n"&R1C7&RC[-26])&IF(RC[-25]="",,"|n"&R1C8&RC[-25])&IF(RC[-24]="",,"|n"&R1C9&RC[-24])&IF(RC[-23]="",,"|n"&R1C10&RC[-23])&IF(RC[-22]="",,"|n"&R1C11&RC[-22])&IF(RC[-21]="",,"|n"&R1C12&RC[-21])&IF(RC[-19]&RC[-18]&RC[-17]&RC[-16]="",,"|n"&R1C13)&IF(RC[-19]="",,"|n"&R1C14&RC[-19])&IF(RC[-18]="",,"|n"&R1C15&RC[-18])&IF(RC[-17]="",,"|n"&R1C16&RC[-17])&IF(RC[-16]="",,"|n"&R1C17&RC[-16])&IF(RC[-15]="",,"|n"&R1C18&RC[-15])&IF(RC[-14]="",,"|n"&R1C19&RC[-14])&IF(RC[-13]="",,"|n"&R1C20&RC[-13])&IF(RC[-12]="",,"|n"&R1C21&RC[-12])&IF(RC[-10]="",,"|n"&R1C23&RC[-10])&IF(RC[-9]="",,"|n"&R1C24&RC[-9])&IF(RC[-8]="",,"|n"&R1C25&RC[-8])&IF(RC[-7]="",,"|n"&R1C26&RC[-7])&IF(RC[-6]="",,"|n"&R1C27&RC[-6])&IF(RC[-5]="",,"|n"&R1C28&RC[-5])&IF(RC[-2]="",,"|n"&RC[-2]) -> 
AG1633: =IF(RC[-26]&RC[-25]&RC[-24]&RC[-23]&RC[-22]&RC[-21]="",,R1C6)&IF(RC[-26]="",,"|n"&R1C7&RC[-26])&IF(RC[-25]="",,"|n"&R1C8&RC[-25])&IF(RC[-24]="",,"|n"&R1C9&RC[-24])&IF(RC[-23]="",,"|n"&R1C10&RC[-23])&IF(RC[-22]="",,"|n"&R1C11&RC[-22])&IF(RC[-21]="",,"|n"&R1C12&RC[-21])&IF(RC[-19]&RC[-18]&RC[-17]&RC[-16]="",,"|n"&R1C13)&IF(RC[-19]="",,"|n"&R1C14&RC[-19])&IF(RC[-18]="",,"|n"&R1C15&RC[-18])&IF(RC[-17]="",,"|n"&R1C16&RC[-17])&IF(RC[-16]="",,"|n"&R1C17&RC[-16])&IF(RC[-15]="",,"|n"&R1C18&RC[-15])&IF(RC[-14]="",,"|n"&R1C19&RC[-14])&IF(RC[-13]="",,"|n"&R1C20&RC[-13])&IF(RC[-12]="",,"|n"&R1C21&RC[-12])&IF(RC[-10]="",,"|n"&R1C23&RC[-10])&IF(RC[-9]="",,"|n"&R1C24&RC[-9])&IF(RC[-8]="",,"|n"&R1C25&RC[-8])&IF(RC[-7]="",,"|n"&R1C26&RC[-7])&IF(RC[-6]="",,"|n"&R1C27&RC[-6])&IF(RC[-5]="",,"|n"&R1C28&RC[-5])&IF(RC[-2]="",,"|n"&RC[-2]) -> 
AG1634: =IF(RC[-26]&RC[-25]&RC[-24]&RC[-23]&RC[-22]&RC[-21]="",,R1C6)&IF(RC[-26]="",,"|n"&R1C7&RC[-26])&IF(RC[-25]="",,"|n"&R1C8&RC[-25])&IF(RC[-24]="",,"|n"&R1C9&RC[-24])&IF(RC[-23]="",,"|n"&R1C10&RC[-23])&IF(RC[-22]="",,"|n"&R1C11&RC[-22])&IF(RC[-21]="",,"|n"&R1C12&RC[-21])&IF(RC[-19]&RC[-18]&RC[-17]&RC[-16]="",,"|n"&R1C13)&IF(RC[-19]="",,"|n"&R1C14&RC[-19])&IF(RC[-18]="",,"|n"&R1C15&RC[-18])&IF(RC[-17]="",,"|n"&R1C16&RC[-17])&IF(RC[-16]="",,"|n"&R1C17&RC[-16])&IF(RC[-15]="",,"|n"&R1C18&RC[-15])&IF(RC[-14]="",,"|n"&R1C19&RC[-14])&IF(RC[-13]="",,"|n"&R1C20&RC[-13])&IF(RC[-12]="",,"|n"&R1C21&RC[-12])&IF(RC[-10]="",,"|n"&R1C23&RC[-10])&IF(RC[-9]="",,"|n"&R1C24&RC[-9])&IF(RC[-8]="",,"|n"&R1C25&RC[-8])&IF(RC[-7]="",,"|n"&R1C26&RC[-7])&IF(RC[-6]="",,"|n"&R1C27&RC[-6])&IF(RC[-5]="",,"|n"&R1C28&RC[-5])&IF(RC[-2]="",,"|n"&RC[-2]) -> 
AG1635: =IF(RC[-26]&RC[-25]&RC[-24]&RC[-23]&RC[-22]&RC[-21]="",,R1C6)&IF(RC[-26]="",,"|n"&R1C7&RC[-26])&IF(RC[-25]="",,"|n"&R1C8&RC[-25])&IF(RC[-24]="",,"|n"&R1C9&RC[-24])&IF(RC[-23]="",,"|n"&R1C10&RC[-23])&IF(RC[-22]="",,"|n"&R1C11&RC[-22])&IF(RC[-21]="",,"|n"&R1C12&RC[-21])&IF(RC[-19]&RC[-18]&RC[-17]&RC[-16]="",,"|n"&R1C13)&IF(RC[-19]="",,"|n"&R1C14&RC[-19])&IF(RC[-18]="",,"|n"&R1C15&RC[-18])&IF(RC[-17]="",,"|n"&R1C16&RC[-17])&IF(RC[-16]="",,"|n"&R1C17&RC[-16])&IF(RC[-15]="",,"|n"&R1C18&RC[-15])&IF(RC[-14]="",,"|n"&R1C19&RC[-14])&IF(RC[-13]="",,"|n"&R1C20&RC[-13])&IF(RC[-12]="",,"|n"&R1C21&RC[-12])&IF(RC[-10]="",,"|n"&R1C23&RC[-10])&IF(RC[-9]="",,"|n"&R1C24&RC[-9])&IF(RC[-8]="",,"|n"&R1C25&RC[-8])&IF(RC[-7]="",,"|n"&R1C26&RC[-7])&IF(RC[-6]="",,"|n"&R1C27&RC[-6])&IF(RC[-5]="",,"|n"&R1C28&RC[-5])&IF(RC[-2]="",,"|n"&RC[-2]) -> 
AG1636: =IF(RC[-26]&RC[-25]&RC[-24]&RC[-23]&RC[-22]&RC[-21]="",,R1C6)&IF(RC[-26]="",,"|n"&R1C7&RC[-26])&IF(RC[-25]="",,"|n"&R1C8&RC[-25])&IF(RC[-24]="",,"|n"&R1C9&RC[-24])&IF(RC[-23]="",,"|n"&R1C10&RC[-23])&IF(RC[-22]="",,"|n"&R1C11&RC[-22])&IF(RC[-21]="",,"|n"&R1C12&RC[-21])&IF(RC[-19]&RC[-18]&RC[-17]&RC[-16]="",,"|n"&R1C13)&IF(RC[-19]="",,"|n"&R1C14&RC[-19])&IF(RC[-18]="",,"|n"&R1C15&RC[-18])&IF(RC[-17]="",,"|n"&R1C16&RC[-17])&IF(RC[-16]="",,"|n"&R1C17&RC[-16])&IF(RC[-15]="",,"|n"&R1C18&RC[-15])&IF(RC[-14]="",,"|n"&R1C19&RC[-14])&IF(RC[-13]="",,"|n"&R1C20&RC[-13])&IF(RC[-12]="",,"|n"&R1C21&RC[-12])&IF(RC[-10]="",,"|n"&R1C23&RC[-10])&IF(RC[-9]="",,"|n"&R1C24&RC[-9])&IF(RC[-8]="",,"|n"&R1C25&RC[-8])&IF(RC[-7]="",,"|n"&R1C26&RC[-7])&IF(RC[-6]="",,"|n"&R1C27&RC[-6])&IF(RC[-5]="",,"|n"&R1C28&RC[-5])&IF(RC[-2]="",,"|n"&RC[-2]) -> 
AG1637: =IF(RC[-26]&RC[-25]&RC[-24]&RC[-23]&RC[-22]&RC[-21]="",,R1C6)&IF(RC[-26]="",,"|n"&R1C7&RC[-26])&IF(RC[-25]="",,"|n"&R1C8&RC[-25])&IF(RC[-24]="",,"|n"&R1C9&RC[-24])&IF(RC[-23]="",,"|n"&R1C10&RC[-23])&IF(RC[-22]="",,"|n"&R1C11&RC[-22])&IF(RC[-21]="",,"|n"&R1C12&RC[-21])&IF(RC[-19]&RC[-18]&RC[-17]&RC[-16]="",,"|n"&R1C13)&IF(RC[-19]="",,"|n"&R1C14&RC[-19])&IF(RC[-18]="",,"|n"&R1C15&RC[-18])&IF(RC[-17]="",,"|n"&R1C16&RC[-17])&IF(RC[-16]="",,"|n"&R1C17&RC[-16])&IF(RC[-15]="",,"|n"&R1C18&RC[-15])&IF(RC[-14]="",,"|n"&R1C19&RC[-14])&IF(RC[-13]="",,"|n"&R1C20&RC[-13])&IF(RC[-12]="",,"|n"&R1C21&RC[-12])&IF(RC[-10]="",,"|n"&R1C23&RC[-10])&IF(RC[-9]="",,"|n"&R1C24&RC[-9])&IF(RC[-8]="",,"|n"&R1C25&RC[-8])&IF(RC[-7]="",,"|n"&R1C26&RC[-7])&IF(RC[-6]="",,"|n"&R1C27&RC[-6])&IF(RC[-5]="",,"|n"&R1C28&RC[-5])&IF(RC[-2]="",,"|n"&RC[-2]) -> 
AG1638: =IF(RC[-26]&RC[-25]&RC[-24]&RC[-23]&RC[-22]&RC[-21]="",,R1C6)&IF(RC[-26]="",,"|n"&R1C7&RC[-26])&IF(RC[-25]="",,"|n"&R1C8&RC[-25])&IF(RC[-24]="",,"|n"&R1C9&RC[-24])&IF(RC[-23]="",,"|n"&R1C10&RC[-23])&IF(RC[-22]="",,"|n"&R1C11&RC[-22])&IF(RC[-21]="",,"|n"&R1C12&RC[-21])&IF(RC[-19]&RC[-18]&RC[-17]&RC[-16]="",,"|n"&R1C13)&IF(RC[-19]="",,"|n"&R1C14&RC[-19])&IF(RC[-18]="",,"|n"&R1C15&RC[-18])&IF(RC[-17]="",,"|n"&R1C16&RC[-17])&IF(RC[-16]="",,"|n"&R1C17&RC[-16])&IF(RC[-15]="",,"|n"&R1C18&RC[-15])&IF(RC[-14]="",,"|n"&R1C19&RC[-14])&IF(RC[-13]="",,"|n"&R1C20&RC[-13])&IF(RC[-12]="",,"|n"&R1C21&RC[-12])&IF(RC[-10]="",,"|n"&R1C23&RC[-10])&IF(RC[-9]="",,"|n"&R1C24&RC[-9])&IF(RC[-8]="",,"|n"&R1C25&RC[-8])&IF(RC[-7]="",,"|n"&R1C26&RC[-7])&IF(RC[-6]="",,"|n"&R1C27&RC[-6])&IF(RC[-5]="",,"|n"&R1C28&RC[-5])&IF(RC[-2]="",,"|n"&RC[-2]) -> 
AG1639: =IF(RC[-26]&RC[-25]&RC[-24]&RC[-23]&RC[-22]&RC[-21]="",,R1C6)&IF(RC[-26]="",,"|n"&R1C7&RC[-26])&IF(RC[-25]="",,"|n"&R1C8&RC[-25])&IF(RC[-24]="",,"|n"&R1C9&RC[-24])&IF(RC[-23]="",,"|n"&R1C10&RC[-23])&IF(RC[-22]="",,"|n"&R1C11&RC[-22])&IF(RC[-21]="",,"|n"&R1C12&RC[-21])&IF(RC[-19]&RC[-18]&RC[-17]&RC[-16]="",,"|n"&R1C13)&IF(RC[-19]="",,"|n"&R1C14&RC[-19])&IF(RC[-18]="",,"|n"&R1C15&RC[-18])&IF(RC[-17]="",,"|n"&R1C16&RC[-17])&IF(RC[-16]="",,"|n"&R1C17&RC[-16])&IF(RC[-15]="",,"|n"&R1C18&RC[-15])&IF(RC[-14]="",,"|n"&R1C19&RC[-14])&IF(RC[-13]="",,"|n"&R1C20&RC[-13])&IF(RC[-12]="",,"|n"&R1C21&RC[-12])&IF(RC[-10]="",,"|n"&R1C23&RC[-10])&IF(RC[-9]="",,"|n"&R1C24&RC[-9])&IF(RC[-8]="",,"|n"&R1C25&RC[-8])&IF(RC[-7]="",,"|n"&R1C26&RC[-7])&IF(RC[-6]="",,"|n"&R1C27&RC[-6])&IF(RC[-5]="",,"|n"&R1C28&RC[-5])&IF(RC[-2]="",,"|n"&RC[-2]) -> 
AG1640: =IF(RC[-26]&RC[-25]&RC[-24]&RC[-23]&RC[-22]&RC[-21]="",,R1C6)&IF(RC[-26]="",,"|n"&R1C7&RC[-26])&IF(RC[-25]="",,"|n"&R1C8&RC[-25])&IF(RC[-24]="",,"|n"&R1C9&RC[-24])&IF(RC[-23]="",,"|n"&R1C10&RC[-23])&IF(RC[-22]="",,"|n"&R1C11&RC[-22])&IF(RC[-21]="",,"|n"&R1C12&RC[-21])&IF(RC[-19]&RC[-18]&RC[-17]&RC[-16]="",,"|n"&R1C13)&IF(RC[-19]="",,"|n"&R1C14&RC[-19])&IF(RC[-18]="",,"|n"&R1C15&RC[-18])&IF(RC[-17]="",,"|n"&R1C16&RC[-17])&IF(RC[-16]="",,"|n"&R1C17&RC[-16])&IF(RC[-15]="",,"|n"&R1C18&RC[-15])&IF(RC[-14]="",,"|n"&R1C19&RC[-14])&IF(RC[-13]="",,"|n"&R1C20&RC[-13])&IF(RC[-12]="",,"|n"&R1C21&RC[-12])&IF(RC[-10]="",,"|n"&R1C23&RC[-10])&IF(RC[-9]="",,"|n"&R1C24&RC[-9])&IF(RC[-8]="",,"|n"&R1C25&RC[-8])&IF(RC[-7]="",,"|n"&R1C26&RC[-7])&IF(RC[-6]="",,"|n"&R1C27&RC[-6])&IF(RC[-5]="",,"|n"&R1C28&RC[-5])&IF(RC[-2]="",,"|n"&RC[-2]) -> 
AG1641: =IF(RC[-26]&RC[-25]&RC[-24]&RC[-23]&RC[-22]&RC[-21]="",,R1C6)&IF(RC[-26]="",,"|n"&R1C7&RC[-26])&IF(RC[-25]="",,"|n"&R1C8&RC[-25])&IF(RC[-24]="",,"|n"&R1C9&RC[-24])&IF(RC[-23]="",,"|n"&R1C10&RC[-23])&IF(RC[-22]="",,"|n"&R1C11&RC[-22])&IF(RC[-21]="",,"|n"&R1C12&RC[-21])&IF(RC[-19]&RC[-18]&RC[-17]&RC[-16]="",,"|n"&R1C13)&IF(RC[-19]="",,"|n"&R1C14&RC[-19])&IF(RC[-18]="",,"|n"&R1C15&RC[-18])&IF(RC[-17]="",,"|n"&R1C16&RC[-17])&IF(RC[-16]="",,"|n"&R1C17&RC[-16])&IF(RC[-15]="",,"|n"&R1C18&RC[-15])&IF(RC[-14]="",,"|n"&R1C19&RC[-14])&IF(RC[-13]="",,"|n"&R1C20&RC[-13])&IF(RC[-12]="",,"|n"&R1C21&RC[-12])&IF(RC[-10]="",,"|n"&R1C23&RC[-10])&IF(RC[-9]="",,"|n"&R1C24&RC[-9])&IF(RC[-8]="",,"|n"&R1C25&RC[-8])&IF(RC[-7]="",,"|n"&R1C26&RC[-7])&IF(RC[-6]="",,"|n"&R1C27&RC[-6])&IF(RC[-5]="",,"|n"&R1C28&RC[-5])&IF(RC[-2]="",,"|n"&RC[-2]) -> 
AG1642: =IF(RC[-26]&RC[-25]&RC[-24]&RC[-23]&RC[-22]&RC[-21]="",,R1C6)&IF(RC[-26]="",,"|n"&R1C7&RC[-26])&IF(RC[-25]="",,"|n"&R1C8&RC[-25])&IF(RC[-24]="",,"|n"&R1C9&RC[-24])&IF(RC[-23]="",,"|n"&R1C10&RC[-23])&IF(RC[-22]="",,"|n"&R1C11&RC[-22])&IF(RC[-21]="",,"|n"&R1C12&RC[-21])&IF(RC[-19]&RC[-18]&RC[-17]&RC[-16]="",,"|n"&R1C13)&IF(RC[-19]="",,"|n"&R1C14&RC[-19])&IF(RC[-18]="",,"|n"&R1C15&RC[-18])&IF(RC[-17]="",,"|n"&R1C16&RC[-17])&IF(RC[-16]="",,"|n"&R1C17&RC[-16])&IF(RC[-15]="",,"|n"&R1C18&RC[-15])&IF(RC[-14]="",,"|n"&R1C19&RC[-14])&IF(RC[-13]="",,"|n"&R1C20&RC[-13])&IF(RC[-12]="",,"|n"&R1C21&RC[-12])&IF(RC[-10]="",,"|n"&R1C23&RC[-10])&IF(RC[-9]="",,"|n"&R1C24&RC[-9])&IF(RC[-8]="",,"|n"&R1C25&RC[-8])&IF(RC[-7]="",,"|n"&R1C26&RC[-7])&IF(RC[-6]="",,"|n"&R1C27&RC[-6])&IF(RC[-5]="",,"|n"&R1C28&RC[-5])&IF(RC[-2]="",,"|n"&RC[-2]) -> 
AG1643: =IF(RC[-26]&RC[-25]&RC[-24]&RC[-23]&RC[-22]&RC[-21]="",,R1C6)&IF(RC[-26]="",,"|n"&R1C7&RC[-26])&IF(RC[-25]="",,"|n"&R1C8&RC[-25])&IF(RC[-24]="",,"|n"&R1C9&RC[-24])&IF(RC[-23]="",,"|n"&R1C10&RC[-23])&IF(RC[-22]="",,"|n"&R1C11&RC[-22])&IF(RC[-21]="",,"|n"&R1C12&RC[-21])&IF(RC[-19]&RC[-18]&RC[-17]&RC[-16]="",,"|n"&R1C13)&IF(RC[-19]="",,"|n"&R1C14&RC[-19])&IF(RC[-18]="",,"|n"&R1C15&RC[-18])&IF(RC[-17]="",,"|n"&R1C16&RC[-17])&IF(RC[-16]="",,"|n"&R1C17&RC[-16])&IF(RC[-15]="",,"|n"&R1C18&RC[-15])&IF(RC[-14]="",,"|n"&R1C19&RC[-14])&IF(RC[-13]="",,"|n"&R1C20&RC[-13])&IF(RC[-12]="",,"|n"&R1C21&RC[-12])&IF(RC[-10]="",,"|n"&R1C23&RC[-10])&IF(RC[-9]="",,"|n"&R1C24&RC[-9])&IF(RC[-8]="",,"|n"&R1C25&RC[-8])&IF(RC[-7]="",,"|n"&R1C26&RC[-7])&IF(RC[-6]="",,"|n"&R1C27&RC[-6])&IF(RC[-5]="",,"|n"&R1C28&RC[-5])&IF(RC[-2]="",,"|n"&RC[-2]) -> 
AG1644: =IF(RC[-26]&RC[-25]&RC[-24]&RC[-23]&RC[-22]&RC[-21]="",,R1C6)&IF(RC[-26]="",,"|n"&R1C7&RC[-26])&IF(RC[-25]="",,"|n"&R1C8&RC[-25])&IF(RC[-24]="",,"|n"&R1C9&RC[-24])&IF(RC[-23]="",,"|n"&R1C10&RC[-23])&IF(RC[-22]="",,"|n"&R1C11&RC[-22])&IF(RC[-21]="",,"|n"&R1C12&RC[-21])&IF(RC[-19]&RC[-18]&RC[-17]&RC[-16]="",,"|n"&R1C13)&IF(RC[-19]="",,"|n"&R1C14&RC[-19])&IF(RC[-18]="",,"|n"&R1C15&RC[-18])&IF(RC[-17]="",,"|n"&R1C16&RC[-17])&IF(RC[-16]="",,"|n"&R1C17&RC[-16])&IF(RC[-15]="",,"|n"&R1C18&RC[-15])&IF(RC[-14]="",,"|n"&R1C19&RC[-14])&IF(RC[-13]="",,"|n"&R1C20&RC[-13])&IF(RC[-12]="",,"|n"&R1C21&RC[-12])&IF(RC[-10]="",,"|n"&R1C23&RC[-10])&IF(RC[-9]="",,"|n"&R1C24&RC[-9])&IF(RC[-8]="",,"|n"&R1C25&RC[-8])&IF(RC[-7]="",,"|n"&R1C26&RC[-7])&IF(RC[-6]="",,"|n"&R1C27&RC[-6])&IF(RC[-5]="",,"|n"&R1C28&RC[-5])&IF(RC[-2]="",,"|n"&RC[-2]) -> 
AG1645: =IF(RC[-26]&RC[-25]&RC[-24]&RC[-23]&RC[-22]&RC[-21]="",,R1C6)&IF(RC[-26]="",,"|n"&R1C7&RC[-26])&IF(RC[-25]="",,"|n"&R1C8&RC[-25])&IF(RC[-24]="",,"|n"&R1C9&RC[-24])&IF(RC[-23]="",,"|n"&R1C10&RC[-23])&IF(RC[-22]="",,"|n"&R1C11&RC[-22])&IF(RC[-21]="",,"|n"&R1C12&RC[-21])&IF(RC[-19]&RC[-18]&RC[-17]&RC[-16]="",,"|n"&R1C13)&IF(RC[-19]="",,"|n"&R1C14&RC[-19])&IF(RC[-18]="",,"|n"&R1C15&RC[-18])&IF(RC[-17]="",,"|n"&R1C16&RC[-17])&IF(RC[-16]="",,"|n"&R1C17&RC[-16])&IF(RC[-15]="",,"|n"&R1C18&RC[-15])&IF(RC[-14]="",,"|n"&R1C19&RC[-14])&IF(RC[-13]="",,"|n"&R1C20&RC[-13])&IF(RC[-12]="",,"|n"&R1C21&RC[-12])&IF(RC[-10]="",,"|n"&R1C23&RC[-10])&IF(RC[-9]="",,"|n"&R1C24&RC[-9])&IF(RC[-8]="",,"|n"&R1C25&RC[-8])&IF(RC[-7]="",,"|n"&R1C26&RC[-7])&IF(RC[-6]="",,"|n"&R1C27&RC[-6])&IF(RC[-5]="",,"|n"&R1C28&RC[-5])&IF(RC[-2]="",,"|n"&RC[-2]) -> 
AG1646: =IF(RC[-26]&RC[-25]&RC[-24]&RC[-23]&RC[-22]&RC[-21]="",,R1C6)&IF(RC[-26]="",,"|n"&R1C7&RC[-26])&IF(RC[-25]="",,"|n"&R1C8&RC[-25])&IF(RC[-24]="",,"|n"&R1C9&RC[-24])&IF(RC[-23]="",,"|n"&R1C10&RC[-23])&IF(RC[-22]="",,"|n"&R1C11&RC[-22])&IF(RC[-21]="",,"|n"&R1C12&RC[-21])&IF(RC[-19]&RC[-18]&RC[-17]&RC[-16]="",,"|n"&R1C13)&IF(RC[-19]="",,"|n"&R1C14&RC[-19])&IF(RC[-18]="",,"|n"&R1C15&RC[-18])&IF(RC[-17]="",,"|n"&R1C16&RC[-17])&IF(RC[-16]="",,"|n"&R1C17&RC[-16])&IF(RC[-15]="",,"|n"&R1C18&RC[-15])&IF(RC[-14]="",,"|n"&R1C19&RC[-14])&IF(RC[-13]="",,"|n"&R1C20&RC[-13])&IF(RC[-12]="",,"|n"&R1C21&RC[-12])&IF(RC[-10]="",,"|n"&R1C23&RC[-10])&IF(RC[-9]="",,"|n"&R1C24&RC[-9])&IF(RC[-8]="",,"|n"&R1C25&RC[-8])&IF(RC[-7]="",,"|n"&R1C26&RC[-7])&IF(RC[-6]="",,"|n"&R1C27&RC[-6])&IF(RC[-5]="",,"|n"&R1C28&RC[-5])&IF(RC[-2]="",,"|n"&RC[-2]) -> 
AG1647: =IF(RC[-26]&RC[-25]&RC[-24]&RC[-23]&RC[-22]&RC[-21]="",,R1C6)&IF(RC[-26]="",,"|n"&R1C7&RC[-26])&IF(RC[-25]="",,"|n"&R1C8&RC[-25])&IF(RC[-24]="",,"|n"&R1C9&RC[-24])&IF(RC[-23]="",,"|n"&R1C10&RC[-23])&IF(RC[-22]="",,"|n"&R1C11&RC[-22])&IF(RC[-21]="",,"|n"&R1C12&RC[-21])&IF(RC[-19]&RC[-18]&RC[-17]&RC[-16]="",,"|n"&R1C13)&IF(RC[-19]="",,"|n"&R1C14&RC[-19])&IF(RC[-18]="",,"|n"&R1C15&RC[-18])&IF(RC[-17]="",,"|n"&R1C16&RC[-17])&IF(RC[-16]="",,"|n"&R1C17&RC[-16])&IF(RC[-15]="",,"|n"&R1C18&RC[-15])&IF(RC[-14]="",,"|n"&R1C19&RC[-14])&IF(RC[-13]="",,"|n"&R1C20&RC[-13])&IF(RC[-12]="",,"|n"&R1C21&RC[-12])&IF(RC[-10]="",,"|n"&R1C23&RC[-10])&IF(RC[-9]="",,"|n"&R1C24&RC[-9])&IF(RC[-8]="",,"|n"&R1C25&RC[-8])&IF(RC[-7]="",,"|n"&R1C26&RC[-7])&IF(RC[-6]="",,"|n"&R1C27&RC[-6])&IF(RC[-5]="",,"|n"&R1C28&RC[-5])&IF(RC[-2]="",,"|n"&RC[-2]) -> 
AG1648: =IF(RC[-26]&RC[-25]&RC[-24]&RC[-23]&RC[-22]&RC[-21]="",,R1C6)&IF(RC[-26]="",,"|n"&R1C7&RC[-26])&IF(RC[-25]="",,"|n"&R1C8&RC[-25])&IF(RC[-24]="",,"|n"&R1C9&RC[-24])&IF(RC[-23]="",,"|n"&R1C10&RC[-23])&IF(RC[-22]="",,"|n"&R1C11&RC[-22])&IF(RC[-21]="",,"|n"&R1C12&RC[-21])&IF(RC[-19]&RC[-18]&RC[-17]&RC[-16]="",,"|n"&R1C13)&IF(RC[-19]="",,"|n"&R1C14&RC[-19])&IF(RC[-18]="",,"|n"&R1C15&RC[-18])&IF(RC[-17]="",,"|n"&R1C16&RC[-17])&IF(RC[-16]="",,"|n"&R1C17&RC[-16])&IF(RC[-15]="",,"|n"&R1C18&RC[-15])&IF(RC[-14]="",,"|n"&R1C19&RC[-14])&IF(RC[-13]="",,"|n"&R1C20&RC[-13])&IF(RC[-12]="",,"|n"&R1C21&RC[-12])&IF(RC[-10]="",,"|n"&R1C23&RC[-10])&IF(RC[-9]="",,"|n"&R1C24&RC[-9])&IF(RC[-8]="",,"|n"&R1C25&RC[-8])&IF(RC[-7]="",,"|n"&R1C26&RC[-7])&IF(RC[-6]="",,"|n"&R1C27&RC[-6])&IF(RC[-5]="",,"|n"&R1C28&RC[-5])&IF(RC[-2]="",,"|n"&RC[-2]) -> 
AG1649: =IF(RC[-26]&RC[-25]&RC[-24]&RC[-23]&RC[-22]&RC[-21]="",,R1C6)&IF(RC[-26]="",,"|n"&R1C7&RC[-26])&IF(RC[-25]="",,"|n"&R1C8&RC[-25])&IF(RC[-24]="",,"|n"&R1C9&RC[-24])&IF(RC[-23]="",,"|n"&R1C10&RC[-23])&IF(RC[-22]="",,"|n"&R1C11&RC[-22])&IF(RC[-21]="",,"|n"&R1C12&RC[-21])&IF(RC[-19]&RC[-18]&RC[-17]&RC[-16]="",,"|n"&R1C13)&IF(RC[-19]="",,"|n"&R1C14&RC[-19])&IF(RC[-18]="",,"|n"&R1C15&RC[-18])&IF(RC[-17]="",,"|n"&R1C16&RC[-17])&IF(RC[-16]="",,"|n"&R1C17&RC[-16])&IF(RC[-15]="",,"|n"&R1C18&RC[-15])&IF(RC[-14]="",,"|n"&R1C19&RC[-14])&IF(RC[-13]="",,"|n"&R1C20&RC[-13])&IF(RC[-12]="",,"|n"&R1C21&RC[-12])&IF(RC[-10]="",,"|n"&R1C23&RC[-10])&IF(RC[-9]="",,"|n"&R1C24&RC[-9])&IF(RC[-8]="",,"|n"&R1C25&RC[-8])&IF(RC[-7]="",,"|n"&R1C26&RC[-7])&IF(RC[-6]="",,"|n"&R1C27&RC[-6])&IF(RC[-5]="",,"|n"&R1C28&RC[-5])&IF(RC[-2]="",,"|n"&RC[-2]) -> 
AG1650: =IF(RC[-26]&RC[-25]&RC[-24]&RC[-23]&RC[-22]&RC[-21]="",,R1C6)&IF(RC[-26]="",,"|n"&R1C7&RC[-26])&IF(RC[-25]="",,"|n"&R1C8&RC[-25])&IF(RC[-24]="",,"|n"&R1C9&RC[-24])&IF(RC[-23]="",,"|n"&R1C10&RC[-23])&IF(RC[-22]="",,"|n"&R1C11&RC[-22])&IF(RC[-21]="",,"|n"&R1C12&RC[-21])&IF(RC[-19]&RC[-18]&RC[-17]&RC[-16]="",,"|n"&R1C13)&IF(RC[-19]="",,"|n"&R1C14&RC[-19])&IF(RC[-18]="",,"|n"&R1C15&RC[-18])&IF(RC[-17]="",,"|n"&R1C16&RC[-17])&IF(RC[-16]="",,"|n"&R1C17&RC[-16])&IF(RC[-15]="",,"|n"&R1C18&RC[-15])&IF(RC[-14]="",,"|n"&R1C19&RC[-14])&IF(RC[-13]="",,"|n"&R1C20&RC[-13])&IF(RC[-12]="",,"|n"&R1C21&RC[-12])&IF(RC[-10]="",,"|n"&R1C23&RC[-10])&IF(RC[-9]="",,"|n"&R1C24&RC[-9])&IF(RC[-8]="",,"|n"&R1C25&RC[-8])&IF(RC[-7]="",,"|n"&R1C26&RC[-7])&IF(RC[-6]="",,"|n"&R1C27&RC[-6])&IF(RC[-5]="",,"|n"&R1C28&RC[-5])&IF(RC[-2]="",,"|n"&RC[-2]) -> 
AG1651: =IF(RC[-26]&RC[-25]&RC[-24]&RC[-23]&RC[-22]&RC[-21]="",,R1C6)&IF(RC[-26]="",,"|n"&R1C7&RC[-26])&IF(RC[-25]="",,"|n"&R1C8&RC[-25])&IF(RC[-24]="",,"|n"&R1C9&RC[-24])&IF(RC[-23]="",,"|n"&R1C10&RC[-23])&IF(RC[-22]="",,"|n"&R1C11&RC[-22])&IF(RC[-21]="",,"|n"&R1C12&RC[-21])&IF(RC[-19]&RC[-18]&RC[-17]&RC[-16]="",,"|n"&R1C13)&IF(RC[-19]="",,"|n"&R1C14&RC[-19])&IF(RC[-18]="",,"|n"&R1C15&RC[-18])&IF(RC[-17]="",,"|n"&R1C16&RC[-17])&IF(RC[-16]="",,"|n"&R1C17&RC[-16])&IF(RC[-15]="",,"|n"&R1C18&RC[-15])&IF(RC[-14]="",,"|n"&R1C19&RC[-14])&IF(RC[-13]="",,"|n"&R1C20&RC[-13])&IF(RC[-12]="",,"|n"&R1C21&RC[-12])&IF(RC[-10]="",,"|n"&R1C23&RC[-10])&IF(RC[-9]="",,"|n"&R1C24&RC[-9])&IF(RC[-8]="",,"|n"&R1C25&RC[-8])&IF(RC[-7]="",,"|n"&R1C26&RC[-7])&IF(RC[-6]="",,"|n"&R1C27&RC[-6])&IF(RC[-5]="",,"|n"&R1C28&RC[-5])&IF(RC[-2]="",,"|n"&RC[-2]) -> 
AG1652: =IF(RC[-26]&RC[-25]&RC[-24]&RC[-23]&RC[-22]&RC[-21]="",,R1C6)&IF(RC[-26]="",,"|n"&R1C7&RC[-26])&IF(RC[-25]="",,"|n"&R1C8&RC[-25])&IF(RC[-24]="",,"|n"&R1C9&RC[-24])&IF(RC[-23]="",,"|n"&R1C10&RC[-23])&IF(RC[-22]="",,"|n"&R1C11&RC[-22])&IF(RC[-21]="",,"|n"&R1C12&RC[-21])&IF(RC[-19]&RC[-18]&RC[-17]&RC[-16]="",,"|n"&R1C13)&IF(RC[-19]="",,"|n"&R1C14&RC[-19])&IF(RC[-18]="",,"|n"&R1C15&RC[-18])&IF(RC[-17]="",,"|n"&R1C16&RC[-17])&IF(RC[-16]="",,"|n"&R1C17&RC[-16])&IF(RC[-15]="",,"|n"&R1C18&RC[-15])&IF(RC[-14]="",,"|n"&R1C19&RC[-14])&IF(RC[-13]="",,"|n"&R1C20&RC[-13])&IF(RC[-12]="",,"|n"&R1C21&RC[-12])&IF(RC[-10]="",,"|n"&R1C23&RC[-10])&IF(RC[-9]="",,"|n"&R1C24&RC[-9])&IF(RC[-8]="",,"|n"&R1C25&RC[-8])&IF(RC[-7]="",,"|n"&R1C26&RC[-7])&IF(RC[-6]="",,"|n"&R1C27&RC[-6])&IF(RC[-5]="",,"|n"&R1C28&RC[-5])&IF(RC[-2]="",,"|n"&RC[-2]) -> 
AG1653: =IF(RC[-26]&RC[-25]&RC[-24]&RC[-23]&RC[-22]&RC[-21]="",,R1C6)&IF(RC[-26]="",,"|n"&R1C7&RC[-26])&IF(RC[-25]="",,"|n"&R1C8&RC[-25])&IF(RC[-24]="",,"|n"&R1C9&RC[-24])&IF(RC[-23]="",,"|n"&R1C10&RC[-23])&IF(RC[-22]="",,"|n"&R1C11&RC[-22])&IF(RC[-21]="",,"|n"&R1C12&RC[-21])&IF(RC[-19]&RC[-18]&RC[-17]&RC[-16]="",,"|n"&R1C13)&IF(RC[-19]="",,"|n"&R1C14&RC[-19])&IF(RC[-18]="",,"|n"&R1C15&RC[-18])&IF(RC[-17]="",,"|n"&R1C16&RC[-17])&IF(RC[-16]="",,"|n"&R1C17&RC[-16])&IF(RC[-15]="",,"|n"&R1C18&RC[-15])&IF(RC[-14]="",,"|n"&R1C19&RC[-14])&IF(RC[-13]="",,"|n"&R1C20&RC[-13])&IF(RC[-12]="",,"|n"&R1C21&RC[-12])&IF(RC[-10]="",,"|n"&R1C23&RC[-10])&IF(RC[-9]="",,"|n"&R1C24&RC[-9])&IF(RC[-8]="",,"|n"&R1C25&RC[-8])&IF(RC[-7]="",,"|n"&R1C26&RC[-7])&IF(RC[-6]="",,"|n"&R1C27&RC[-6])&IF(RC[-5]="",,"|n"&R1C28&RC[-5])&IF(RC[-2]="",,"|n"&RC[-2]) -> 
AG1654: =IF(RC[-26]&RC[-25]&RC[-24]&RC[-23]&RC[-22]&RC[-21]="",,R1C6)&IF(RC[-26]="",,"|n"&R1C7&RC[-26])&IF(RC[-25]="",,"|n"&R1C8&RC[-25])&IF(RC[-24]="",,"|n"&R1C9&RC[-24])&IF(RC[-23]="",,"|n"&R1C10&RC[-23])&IF(RC[-22]="",,"|n"&R1C11&RC[-22])&IF(RC[-21]="",,"|n"&R1C12&RC[-21])&IF(RC[-19]&RC[-18]&RC[-17]&RC[-16]="",,"|n"&R1C13)&IF(RC[-19]="",,"|n"&R1C14&RC[-19])&IF(RC[-18]="",,"|n"&R1C15&RC[-18])&IF(RC[-17]="",,"|n"&R1C16&RC[-17])&IF(RC[-16]="",,"|n"&R1C17&RC[-16])&IF(RC[-15]="",,"|n"&R1C18&RC[-15])&IF(RC[-14]="",,"|n"&R1C19&RC[-14])&IF(RC[-13]="",,"|n"&R1C20&RC[-13])&IF(RC[-12]="",,"|n"&R1C21&RC[-12])&IF(RC[-10]="",,"|n"&R1C23&RC[-10])&IF(RC[-9]="",,"|n"&R1C24&RC[-9])&IF(RC[-8]="",,"|n"&R1C25&RC[-8])&IF(RC[-7]="",,"|n"&R1C26&RC[-7])&IF(RC[-6]="",,"|n"&R1C27&RC[-6])&IF(RC[-5]="",,"|n"&R1C28&RC[-5])&IF(RC[-2]="",,"|n"&RC[-2]) -> 
AG1655: =IF(RC[-26]&RC[-25]&RC[-24]&RC[-23]&RC[-22]&RC[-21]="",,R1C6)&IF(RC[-26]="",,"|n"&R1C7&RC[-26])&IF(RC[-25]="",,"|n"&R1C8&RC[-25])&IF(RC[-24]="",,"|n"&R1C9&RC[-24])&IF(RC[-23]="",,"|n"&R1C10&RC[-23])&IF(RC[-22]="",,"|n"&R1C11&RC[-22])&IF(RC[-21]="",,"|n"&R1C12&RC[-21])&IF(RC[-19]&RC[-18]&RC[-17]&RC[-16]="",,"|n"&R1C13)&IF(RC[-19]="",,"|n"&R1C14&RC[-19])&IF(RC[-18]="",,"|n"&R1C15&RC[-18])&IF(RC[-17]="",,"|n"&R1C16&RC[-17])&IF(RC[-16]="",,"|n"&R1C17&RC[-16])&IF(RC[-15]="",,"|n"&R1C18&RC[-15])&IF(RC[-14]="",,"|n"&R1C19&RC[-14])&IF(RC[-13]="",,"|n"&R1C20&RC[-13])&IF(RC[-12]="",,"|n"&R1C21&RC[-12])&IF(RC[-10]="",,"|n"&R1C23&RC[-10])&IF(RC[-9]="",,"|n"&R1C24&RC[-9])&IF(RC[-8]="",,"|n"&R1C25&RC[-8])&IF(RC[-7]="",,"|n"&R1C26&RC[-7])&IF(RC[-6]="",,"|n"&R1C27&RC[-6])&IF(RC[-5]="",,"|n"&R1C28&RC[-5])&IF(RC[-2]="",,"|n"&RC[-2]) -> 
AG1656: =IF(RC[-26]&RC[-25]&RC[-24]&RC[-23]&RC[-22]&RC[-21]="",,R1C6)&IF(RC[-26]="",,"|n"&R1C7&RC[-26])&IF(RC[-25]="",,"|n"&R1C8&RC[-25])&IF(RC[-24]="",,"|n"&R1C9&RC[-24])&IF(RC[-23]="",,"|n"&R1C10&RC[-23])&IF(RC[-22]="",,"|n"&R1C11&RC[-22])&IF(RC[-21]="",,"|n"&R1C12&RC[-21])&IF(RC[-19]&RC[-18]&RC[-17]&RC[-16]="",,"|n"&R1C13)&IF(RC[-19]="",,"|n"&R1C14&RC[-19])&IF(RC[-18]="",,"|n"&R1C15&RC[-18])&IF(RC[-17]="",,"|n"&R1C16&RC[-17])&IF(RC[-16]="",,"|n"&R1C17&RC[-16])&IF(RC[-15]="",,"|n"&R1C18&RC[-15])&IF(RC[-14]="",,"|n"&R1C19&RC[-14])&IF(RC[-13]="",,"|n"&R1C20&RC[-13])&IF(RC[-12]="",,"|n"&R1C21&RC[-12])&IF(RC[-10]="",,"|n"&R1C23&RC[-10])&IF(RC[-9]="",,"|n"&R1C24&RC[-9])&IF(RC[-8]="",,"|n"&R1C25&RC[-8])&IF(RC[-7]="",,"|n"&R1C26&RC[-7])&IF(RC[-6]="",,"|n"&R1C27&RC[-6])&IF(RC[-5]="",,"|n"&R1C28&RC[-5])&IF(RC[-2]="",,"|n"&RC[-2]) -> 
AG1657: =IF(RC[-26]&RC[-25]&RC[-24]&RC[-23]&RC[-22]&RC[-21]="",,R1C6)&IF(RC[-26]="",,"|n"&R1C7&RC[-26])&IF(RC[-25]="",,"|n"&R1C8&RC[-25])&IF(RC[-24]="",,"|n"&R1C9&RC[-24])&IF(RC[-23]="",,"|n"&R1C10&RC[-23])&IF(RC[-22]="",,"|n"&R1C11&RC[-22])&IF(RC[-21]="",,"|n"&R1C12&RC[-21])&IF(RC[-19]&RC[-18]&RC[-17]&RC[-16]="",,"|n"&R1C13)&IF(RC[-19]="",,"|n"&R1C14&RC[-19])&IF(RC[-18]="",,"|n"&R1C15&RC[-18])&IF(RC[-17]="",,"|n"&R1C16&RC[-17])&IF(RC[-16]="",,"|n"&R1C17&RC[-16])&IF(RC[-15]="",,"|n"&R1C18&RC[-15])&IF(RC[-14]="",,"|n"&R1C19&RC[-14])&IF(RC[-13]="",,"|n"&R1C20&RC[-13])&IF(RC[-12]="",,"|n"&R1C21&RC[-12])&IF(RC[-10]="",,"|n"&R1C23&RC[-10])&IF(RC[-9]="",,"|n"&R1C24&RC[-9])&IF(RC[-8]="",,"|n"&R1C25&RC[-8])&IF(RC[-7]="",,"|n"&R1C26&RC[-7])&IF(RC[-6]="",,"|n"&R1C27&RC[-6])&IF(RC[-5]="",,"|n"&R1C28&RC[-5])&IF(RC[-2]="",,"|n"&RC[-2]) -> 
AG1658: =IF(RC[-26]&RC[-25]&RC[-24]&RC[-23]&RC[-22]&RC[-21]="",,R1C6)&IF(RC[-26]="",,"|n"&R1C7&RC[-26])&IF(RC[-25]="",,"|n"&R1C8&RC[-25])&IF(RC[-24]="",,"|n"&R1C9&RC[-24])&IF(RC[-23]="",,"|n"&R1C10&RC[-23])&IF(RC[-22]="",,"|n"&R1C11&RC[-22])&IF(RC[-21]="",,"|n"&R1C12&RC[-21])&IF(RC[-19]&RC[-18]&RC[-17]&RC[-16]="",,"|n"&R1C13)&IF(RC[-19]="",,"|n"&R1C14&RC[-19])&IF(RC[-18]="",,"|n"&R1C15&RC[-18])&IF(RC[-17]="",,"|n"&R1C16&RC[-17])&IF(RC[-16]="",,"|n"&R1C17&RC[-16])&IF(RC[-15]="",,"|n"&R1C18&RC[-15])&IF(RC[-14]="",,"|n"&R1C19&RC[-14])&IF(RC[-13]="",,"|n"&R1C20&RC[-13])&IF(RC[-12]="",,"|n"&R1C21&RC[-12])&IF(RC[-10]="",,"|n"&R1C23&RC[-10])&IF(RC[-9]="",,"|n"&R1C24&RC[-9])&IF(RC[-8]="",,"|n"&R1C25&RC[-8])&IF(RC[-7]="",,"|n"&R1C26&RC[-7])&IF(RC[-6]="",,"|n"&R1C27&RC[-6])&IF(RC[-5]="",,"|n"&R1C28&RC[-5])&IF(RC[-2]="",,"|n"&RC[-2]) -> 
AG1659: =IF(RC[-26]&RC[-25]&RC[-24]&RC[-23]&RC[-22]&RC[-21]="",,R1C6)&IF(RC[-26]="",,"|n"&R1C7&RC[-26])&IF(RC[-25]="",,"|n"&R1C8&RC[-25])&IF(RC[-24]="",,"|n"&R1C9&RC[-24])&IF(RC[-23]="",,"|n"&R1C10&RC[-23])&IF(RC[-22]="",,"|n"&R1C11&RC[-22])&IF(RC[-21]="",,"|n"&R1C12&RC[-21])&IF(RC[-19]&RC[-18]&RC[-17]&RC[-16]="",,"|n"&R1C13)&IF(RC[-19]="",,"|n"&R1C14&RC[-19])&IF(RC[-18]="",,"|n"&R1C15&RC[-18])&IF(RC[-17]="",,"|n"&R1C16&RC[-17])&IF(RC[-16]="",,"|n"&R1C17&RC[-16])&IF(RC[-15]="",,"|n"&R1C18&RC[-15])&IF(RC[-14]="",,"|n"&R1C19&RC[-14])&IF(RC[-13]="",,"|n"&R1C20&RC[-13])&IF(RC[-12]="",,"|n"&R1C21&RC[-12])&IF(RC[-10]="",,"|n"&R1C23&RC[-10])&IF(RC[-9]="",,"|n"&R1C24&RC[-9])&IF(RC[-8]="",,"|n"&R1C25&RC[-8])&IF(RC[-7]="",,"|n"&R1C26&RC[-7])&IF(RC[-6]="",,"|n"&R1C27&RC[-6])&IF(RC[-5]="",,"|n"&R1C28&RC[-5])&IF(RC[-2]="",,"|n"&RC[-2]) -> 
AG1660: =IF(RC[-26]&RC[-25]&RC[-24]&RC[-23]&RC[-22]&RC[-21]="",,R1C6)&IF(RC[-26]="",,"|n"&R1C7&RC[-26])&IF(RC[-25]="",,"|n"&R1C8&RC[-25])&IF(RC[-24]="",,"|n"&R1C9&RC[-24])&IF(RC[-23]="",,"|n"&R1C10&RC[-23])&IF(RC[-22]="",,"|n"&R1C11&RC[-22])&IF(RC[-21]="",,"|n"&R1C12&RC[-21])&IF(RC[-19]&RC[-18]&RC[-17]&RC[-16]="",,"|n"&R1C13)&IF(RC[-19]="",,"|n"&R1C14&RC[-19])&IF(RC[-18]="",,"|n"&R1C15&RC[-18])&IF(RC[-17]="",,"|n"&R1C16&RC[-17])&IF(RC[-16]="",,"|n"&R1C17&RC[-16])&IF(RC[-15]="",,"|n"&R1C18&RC[-15])&IF(RC[-14]="",,"|n"&R1C19&RC[-14])&IF(RC[-13]="",,"|n"&R1C20&RC[-13])&IF(RC[-12]="",,"|n"&R1C21&RC[-12])&IF(RC[-10]="",,"|n"&R1C23&RC[-10])&IF(RC[-9]="",,"|n"&R1C24&RC[-9])&IF(RC[-8]="",,"|n"&R1C25&RC[-8])&IF(RC[-7]="",,"|n"&R1C26&RC[-7])&IF(RC[-6]="",,"|n"&R1C27&RC[-6])&IF(RC[-5]="",,"|n"&R1C28&RC[-5])&IF(RC[-2]="",,"|n"&RC[-2]) -> 
AG1661: =IF(RC[-26]&RC[-25]&RC[-24]&RC[-23]&RC[-22]&RC[-21]="",,R1C6)&IF(RC[-26]="",,"|n"&R1C7&RC[-26])&IF(RC[-25]="",,"|n"&R1C8&RC[-25])&IF(RC[-24]="",,"|n"&R1C9&RC[-24])&IF(RC[-23]="",,"|n"&R1C10&RC[-23])&IF(RC[-22]="",,"|n"&R1C11&RC[-22])&IF(RC[-21]="",,"|n"&R1C12&RC[-21])&IF(RC[-19]&RC[-18]&RC[-17]&RC[-16]="",,"|n"&R1C13)&IF(RC[-19]="",,"|n"&R1C14&RC[-19])&IF(RC[-18]="",,"|n"&R1C15&RC[-18])&IF(RC[-17]="",,"|n"&R1C16&RC[-17])&IF(RC[-16]="",,"|n"&R1C17&RC[-16])&IF(RC[-15]="",,"|n"&R1C18&RC[-15])&IF(RC[-14]="",,"|n"&R1C19&RC[-14])&IF(RC[-13]="",,"|n"&R1C20&RC[-13])&IF(RC[-12]="",,"|n"&R1C21&RC[-12])&IF(RC[-10]="",,"|n"&R1C23&RC[-10])&IF(RC[-9]="",,"|n"&R1C24&RC[-9])&IF(RC[-8]="",,"|n"&R1C25&RC[-8])&IF(RC[-7]="",,"|n"&R1C26&RC[-7])&IF(RC[-6]="",,"|n"&R1C27&RC[-6])&IF(RC[-5]="",,"|n"&R1C28&RC[-5])&IF(RC[-2]="",,"|n"&RC[-2]) -> 
AG1662: =IF(RC[-26]&RC[-25]&RC[-24]&RC[-23]&RC[-22]&RC[-21]="",,R1C6)&IF(RC[-26]="",,"|n"&R1C7&RC[-26])&IF(RC[-25]="",,"|n"&R1C8&RC[-25])&IF(RC[-24]="",,"|n"&R1C9&RC[-24])&IF(RC[-23]="",,"|n"&R1C10&RC[-23])&IF(RC[-22]="",,"|n"&R1C11&RC[-22])&IF(RC[-21]="",,"|n"&R1C12&RC[-21])&IF(RC[-19]&RC[-18]&RC[-17]&RC[-16]="",,"|n"&R1C13)&IF(RC[-19]="",,"|n"&R1C14&RC[-19])&IF(RC[-18]="",,"|n"&R1C15&RC[-18])&IF(RC[-17]="",,"|n"&R1C16&RC[-17])&IF(RC[-16]="",,"|n"&R1C17&RC[-16])&IF(RC[-15]="",,"|n"&R1C18&RC[-15])&IF(RC[-14]="",,"|n"&R1C19&RC[-14])&IF(RC[-13]="",,"|n"&R1C20&RC[-13])&IF(RC[-12]="",,"|n"&R1C21&RC[-12])&IF(RC[-10]="",,"|n"&R1C23&RC[-10])&IF(RC[-9]="",,"|n"&R1C24&RC[-9])&IF(RC[-8]="",,"|n"&R1C25&RC[-8])&IF(RC[-7]="",,"|n"&R1C26&RC[-7])&IF(RC[-6]="",,"|n"&R1C27&RC[-6])&IF(RC[-5]="",,"|n"&R1C28&RC[-5])&IF(RC[-2]="",,"|n"&RC[-2]) -> 
AG1663: =IF(RC[-26]&RC[-25]&RC[-24]&RC[-23]&RC[-22]&RC[-21]="",,R1C6)&IF(RC[-26]="",,"|n"&R1C7&RC[-26])&IF(RC[-25]="",,"|n"&R1C8&RC[-25])&IF(RC[-24]="",,"|n"&R1C9&RC[-24])&IF(RC[-23]="",,"|n"&R1C10&RC[-23])&IF(RC[-22]="",,"|n"&R1C11&RC[-22])&IF(RC[-21]="",,"|n"&R1C12&RC[-21])&IF(RC[-19]&RC[-18]&RC[-17]&RC[-16]="",,"|n"&R1C13)&IF(RC[-19]="",,"|n"&R1C14&RC[-19])&IF(RC[-18]="",,"|n"&R1C15&RC[-18])&IF(RC[-17]="",,"|n"&R1C16&RC[-17])&IF(RC[-16]="",,"|n"&R1C17&RC[-16])&IF(RC[-15]="",,"|n"&R1C18&RC[-15])&IF(RC[-14]="",,"|n"&R1C19&RC[-14])&IF(RC[-13]="",,"|n"&R1C20&RC[-13])&IF(RC[-12]="",,"|n"&R1C21&RC[-12])&IF(RC[-10]="",,"|n"&R1C23&RC[-10])&IF(RC[-9]="",,"|n"&R1C24&RC[-9])&IF(RC[-8]="",,"|n"&R1C25&RC[-8])&IF(RC[-7]="",,"|n"&R1C26&RC[-7])&IF(RC[-6]="",,"|n"&R1C27&RC[-6])&IF(RC[-5]="",,"|n"&R1C28&RC[-5])&IF(RC[-2]="",,"|n"&RC[-2]) -> 
AG1664: =IF(RC[-26]&RC[-25]&RC[-24]&RC[-23]&RC[-22]&RC[-21]="",,R1C6)&IF(RC[-26]="",,"|n"&R1C7&RC[-26])&IF(RC[-25]="",,"|n"&R1C8&RC[-25])&IF(RC[-24]="",,"|n"&R1C9&RC[-24])&IF(RC[-23]="",,"|n"&R1C10&RC[-23])&IF(RC[-22]="",,"|n"&R1C11&RC[-22])&IF(RC[-21]="",,"|n"&R1C12&RC[-21])&IF(RC[-19]&RC[-18]&RC[-17]&RC[-16]="",,"|n"&R1C13)&IF(RC[-19]="",,"|n"&R1C14&RC[-19])&IF(RC[-18]="",,"|n"&R1C15&RC[-18])&IF(RC[-17]="",,"|n"&R1C16&RC[-17])&IF(RC[-16]="",,"|n"&R1C17&RC[-16])&IF(RC[-15]="",,"|n"&R1C18&RC[-15])&IF(RC[-14]="",,"|n"&R1C19&RC[-14])&IF(RC[-13]="",,"|n"&R1C20&RC[-13])&IF(RC[-12]="",,"|n"&R1C21&RC[-12])&IF(RC[-10]="",,"|n"&R1C23&RC[-10])&IF(RC[-9]="",,"|n"&R1C24&RC[-9])&IF(RC[-8]="",,"|n"&R1C25&RC[-8])&IF(RC[-7]="",,"|n"&R1C26&RC[-7])&IF(RC[-6]="",,"|n"&R1C27&RC[-6])&IF(RC[-5]="",,"|n"&R1C28&RC[-5])&IF(RC[-2]="",,"|n"&RC[-2]) -> 
AG1665: =IF(RC[-26]&RC[-25]&RC[-24]&RC[-23]&RC[-22]&RC[-21]="",,R1C6)&IF(RC[-26]="",,"|n"&R1C7&RC[-26])&IF(RC[-25]="",,"|n"&R1C8&RC[-25])&IF(RC[-24]="",,"|n"&R1C9&RC[-24])&IF(RC[-23]="",,"|n"&R1C10&RC[-23])&IF(RC[-22]="",,"|n"&R1C11&RC[-22])&IF(RC[-21]="",,"|n"&R1C12&RC[-21])&IF(RC[-19]&RC[-18]&RC[-17]&RC[-16]="",,"|n"&R1C13)&IF(RC[-19]="",,"|n"&R1C14&RC[-19])&IF(RC[-18]="",,"|n"&R1C15&RC[-18])&IF(RC[-17]="",,"|n"&R1C16&RC[-17])&IF(RC[-16]="",,"|n"&R1C17&RC[-16])&IF(RC[-15]="",,"|n"&R1C18&RC[-15])&IF(RC[-14]="",,"|n"&R1C19&RC[-14])&IF(RC[-13]="",,"|n"&R1C20&RC[-13])&IF(RC[-12]="",,"|n"&R1C21&RC[-12])&IF(RC[-10]="",,"|n"&R1C23&RC[-10])&IF(RC[-9]="",,"|n"&R1C24&RC[-9])&IF(RC[-8]="",,"|n"&R1C25&RC[-8])&IF(RC[-7]="",,"|n"&R1C26&RC[-7])&IF(RC[-6]="",,"|n"&R1C27&RC[-6])&IF(RC[-5]="",,"|n"&R1C28&RC[-5])&IF(RC[-2]="",,"|n"&RC[-2]) -> 
AG1666: =IF(RC[-26]&RC[-25]&RC[-24]&RC[-23]&RC[-22]&RC[-21]="",,R1C6)&IF(RC[-26]="",,"|n"&R1C7&RC[-26])&IF(RC[-25]="",,"|n"&R1C8&RC[-25])&IF(RC[-24]="",,"|n"&R1C9&RC[-24])&IF(RC[-23]="",,"|n"&R1C10&RC[-23])&IF(RC[-22]="",,"|n"&R1C11&RC[-22])&IF(RC[-21]="",,"|n"&R1C12&RC[-21])&IF(RC[-19]&RC[-18]&RC[-17]&RC[-16]="",,"|n"&R1C13)&IF(RC[-19]="",,"|n"&R1C14&RC[-19])&IF(RC[-18]="",,"|n"&R1C15&RC[-18])&IF(RC[-17]="",,"|n"&R1C16&RC[-17])&IF(RC[-16]="",,"|n"&R1C17&RC[-16])&IF(RC[-15]="",,"|n"&R1C18&RC[-15])&IF(RC[-14]="",,"|n"&R1C19&RC[-14])&IF(RC[-13]="",,"|n"&R1C20&RC[-13])&IF(RC[-12]="",,"|n"&R1C21&RC[-12])&IF(RC[-10]="",,"|n"&R1C23&RC[-10])&IF(RC[-9]="",,"|n"&R1C24&RC[-9])&IF(RC[-8]="",,"|n"&R1C25&RC[-8])&IF(RC[-7]="",,"|n"&R1C26&RC[-7])&IF(RC[-6]="",,"|n"&R1C27&RC[-6])&IF(RC[-5]="",,"|n"&R1C28&RC[-5])&IF(RC[-2]="",,"|n"&RC[-2]) -> 
AG1667: =IF(RC[-26]&RC[-25]&RC[-24]&RC[-23]&RC[-22]&RC[-21]="",,R1C6)&IF(RC[-26]="",,"|n"&R1C7&RC[-26])&IF(RC[-25]="",,"|n"&R1C8&RC[-25])&IF(RC[-24]="",,"|n"&R1C9&RC[-24])&IF(RC[-23]="",,"|n"&R1C10&RC[-23])&IF(RC[-22]="",,"|n"&R1C11&RC[-22])&IF(RC[-21]="",,"|n"&R1C12&RC[-21])&IF(RC[-19]&RC[-18]&RC[-17]&RC[-16]="",,"|n"&R1C13)&IF(RC[-19]="",,"|n"&R1C14&RC[-19])&IF(RC[-18]="",,"|n"&R1C15&RC[-18])&IF(RC[-17]="",,"|n"&R1C16&RC[-17])&IF(RC[-16]="",,"|n"&R1C17&RC[-16])&IF(RC[-15]="",,"|n"&R1C18&RC[-15])&IF(RC[-14]="",,"|n"&R1C19&RC[-14])&IF(RC[-13]="",,"|n"&R1C20&RC[-13])&IF(RC[-12]="",,"|n"&R1C21&RC[-12])&IF(RC[-10]="",,"|n"&R1C23&RC[-10])&IF(RC[-9]="",,"|n"&R1C24&RC[-9])&IF(RC[-8]="",,"|n"&R1C25&RC[-8])&IF(RC[-7]="",,"|n"&R1C26&RC[-7])&IF(RC[-6]="",,"|n"&R1C27&RC[-6])&IF(RC[-5]="",,"|n"&R1C28&RC[-5])&IF(RC[-2]="",,"|n"&RC[-2]) -> 
AG1668: =IF(RC[-26]&RC[-25]&RC[-24]&RC[-23]&RC[-22]&RC[-21]="",,R1C6)&IF(RC[-26]="",,"|n"&R1C7&RC[-26])&IF(RC[-25]="",,"|n"&R1C8&RC[-25])&IF(RC[-24]="",,"|n"&R1C9&RC[-24])&IF(RC[-23]="",,"|n"&R1C10&RC[-23])&IF(RC[-22]="",,"|n"&R1C11&RC[-22])&IF(RC[-21]="",,"|n"&R1C12&RC[-21])&IF(RC[-19]&RC[-18]&RC[-17]&RC[-16]="",,"|n"&R1C13)&IF(RC[-19]="",,"|n"&R1C14&RC[-19])&IF(RC[-18]="",,"|n"&R1C15&RC[-18])&IF(RC[-17]="",,"|n"&R1C16&RC[-17])&IF(RC[-16]="",,"|n"&R1C17&RC[-16])&IF(RC[-15]="",,"|n"&R1C18&RC[-15])&IF(RC[-14]="",,"|n"&R1C19&RC[-14])&IF(RC[-13]="",,"|n"&R1C20&RC[-13])&IF(RC[-12]="",,"|n"&R1C21&RC[-12])&IF(RC[-10]="",,"|n"&R1C23&RC[-10])&IF(RC[-9]="",,"|n"&R1C24&RC[-9])&IF(RC[-8]="",,"|n"&R1C25&RC[-8])&IF(RC[-7]="",,"|n"&R1C26&RC[-7])&IF(RC[-6]="",,"|n"&R1C27&RC[-6])&IF(RC[-5]="",,"|n"&R1C28&RC[-5])&IF(RC[-2]="",,"|n"&RC[-2]) -> 
AG1669: =IF(RC[-26]&RC[-25]&RC[-24]&RC[-23]&RC[-22]&RC[-21]="",,R1C6)&IF(RC[-26]="",,"|n"&R1C7&RC[-26])&IF(RC[-25]="",,"|n"&R1C8&RC[-25])&IF(RC[-24]="",,"|n"&R1C9&RC[-24])&IF(RC[-23]="",,"|n"&R1C10&RC[-23])&IF(RC[-22]="",,"|n"&R1C11&RC[-22])&IF(RC[-21]="",,"|n"&R1C12&RC[-21])&IF(RC[-19]&RC[-18]&RC[-17]&RC[-16]="",,"|n"&R1C13)&IF(RC[-19]="",,"|n"&R1C14&RC[-19])&IF(RC[-18]="",,"|n"&R1C15&RC[-18])&IF(RC[-17]="",,"|n"&R1C16&RC[-17])&IF(RC[-16]="",,"|n"&R1C17&RC[-16])&IF(RC[-15]="",,"|n"&R1C18&RC[-15])&IF(RC[-14]="",,"|n"&R1C19&RC[-14])&IF(RC[-13]="",,"|n"&R1C20&RC[-13])&IF(RC[-12]="",,"|n"&R1C21&RC[-12])&IF(RC[-10]="",,"|n"&R1C23&RC[-10])&IF(RC[-9]="",,"|n"&R1C24&RC[-9])&IF(RC[-8]="",,"|n"&R1C25&RC[-8])&IF(RC[-7]="",,"|n"&R1C26&RC[-7])&IF(RC[-6]="",,"|n"&R1C27&RC[-6])&IF(RC[-5]="",,"|n"&R1C28&RC[-5])&IF(RC[-2]="",,"|n"&RC[-2]) -> 
AG1670: =IF(RC[-26]&RC[-25]&RC[-24]&RC[-23]&RC[-22]&RC[-21]="",,R1C6)&IF(RC[-26]="",,"|n"&R1C7&RC[-26])&IF(RC[-25]="",,"|n"&R1C8&RC[-25])&IF(RC[-24]="",,"|n"&R1C9&RC[-24])&IF(RC[-23]="",,"|n"&R1C10&RC[-23])&IF(RC[-22]="",,"|n"&R1C11&RC[-22])&IF(RC[-21]="",,"|n"&R1C12&RC[-21])&IF(RC[-19]&RC[-18]&RC[-17]&RC[-16]="",,"|n"&R1C13)&IF(RC[-19]="",,"|n"&R1C14&RC[-19])&IF(RC[-18]="",,"|n"&R1C15&RC[-18])&IF(RC[-17]="",,"|n"&R1C16&RC[-17])&IF(RC[-16]="",,"|n"&R1C17&RC[-16])&IF(RC[-15]="",,"|n"&R1C18&RC[-15])&IF(RC[-14]="",,"|n"&R1C19&RC[-14])&IF(RC[-13]="",,"|n"&R1C20&RC[-13])&IF(RC[-12]="",,"|n"&R1C21&RC[-12])&IF(RC[-10]="",,"|n"&R1C23&RC[-10])&IF(RC[-9]="",,"|n"&R1C24&RC[-9])&IF(RC[-8]="",,"|n"&R1C25&RC[-8])&IF(RC[-7]="",,"|n"&R1C26&RC[-7])&IF(RC[-6]="",,"|n"&R1C27&RC[-6])&IF(RC[-5]="",,"|n"&R1C28&RC[-5])&IF(RC[-2]="",,"|n"&RC[-2]) -> 
AG1671: =IF(RC[-26]&RC[-25]&RC[-24]&RC[-23]&RC[-22]&RC[-21]="",,R1C6)&IF(RC[-26]="",,"|n"&R1C7&RC[-26])&IF(RC[-25]="",,"|n"&R1C8&RC[-25])&IF(RC[-24]="",,"|n"&R1C9&RC[-24])&IF(RC[-23]="",,"|n"&R1C10&RC[-23])&IF(RC[-22]="",,"|n"&R1C11&RC[-22])&IF(RC[-21]="",,"|n"&R1C12&RC[-21])&IF(RC[-19]&RC[-18]&RC[-17]&RC[-16]="",,"|n"&R1C13)&IF(RC[-19]="",,"|n"&R1C14&RC[-19])&IF(RC[-18]="",,"|n"&R1C15&RC[-18])&IF(RC[-17]="",,"|n"&R1C16&RC[-17])&IF(RC[-16]="",,"|n"&R1C17&RC[-16])&IF(RC[-15]="",,"|n"&R1C18&RC[-15])&IF(RC[-14]="",,"|n"&R1C19&RC[-14])&IF(RC[-13]="",,"|n"&R1C20&RC[-13])&IF(RC[-12]="",,"|n"&R1C21&RC[-12])&IF(RC[-10]="",,"|n"&R1C23&RC[-10])&IF(RC[-9]="",,"|n"&R1C24&RC[-9])&IF(RC[-8]="",,"|n"&R1C25&RC[-8])&IF(RC[-7]="",,"|n"&R1C26&RC[-7])&IF(RC[-6]="",,"|n"&R1C27&RC[-6])&IF(RC[-5]="",,"|n"&R1C28&RC[-5])&IF(RC[-2]="",,"|n"&RC[-2]) -> 
AG1672: =IF(RC[-26]&RC[-25]&RC[-24]&RC[-23]&RC[-22]&RC[-21]="",,R1C6)&IF(RC[-26]="",,"|n"&R1C7&RC[-26])&IF(RC[-25]="",,"|n"&R1C8&RC[-25])&IF(RC[-24]="",,"|n"&R1C9&RC[-24])&IF(RC[-23]="",,"|n"&R1C10&RC[-23])&IF(RC[-22]="",,"|n"&R1C11&RC[-22])&IF(RC[-21]="",,"|n"&R1C12&RC[-21])&IF(RC[-19]&RC[-18]&RC[-17]&RC[-16]="",,"|n"&R1C13)&IF(RC[-19]="",,"|n"&R1C14&RC[-19])&IF(RC[-18]="",,"|n"&R1C15&RC[-18])&IF(RC[-17]="",,"|n"&R1C16&RC[-17])&IF(RC[-16]="",,"|n"&R1C17&RC[-16])&IF(RC[-15]="",,"|n"&R1C18&RC[-15])&IF(RC[-14]="",,"|n"&R1C19&RC[-14])&IF(RC[-13]="",,"|n"&R1C20&RC[-13])&IF(RC[-12]="",,"|n"&R1C21&RC[-12])&IF(RC[-10]="",,"|n"&R1C23&RC[-10])&IF(RC[-9]="",,"|n"&R1C24&RC[-9])&IF(RC[-8]="",,"|n"&R1C25&RC[-8])&IF(RC[-7]="",,"|n"&R1C26&RC[-7])&IF(RC[-6]="",,"|n"&R1C27&RC[-6])&IF(RC[-5]="",,"|n"&R1C28&RC[-5])&IF(RC[-2]="",,"|n"&RC[-2]) -> 
AG1673: =IF(RC[-26]&RC[-25]&RC[-24]&RC[-23]&RC[-22]&RC[-21]="",,R1C6)&IF(RC[-26]="",,"|n"&R1C7&RC[-26])&IF(RC[-25]="",,"|n"&R1C8&RC[-25])&IF(RC[-24]="",,"|n"&R1C9&RC[-24])&IF(RC[-23]="",,"|n"&R1C10&RC[-23])&IF(RC[-22]="",,"|n"&R1C11&RC[-22])&IF(RC[-21]="",,"|n"&R1C12&RC[-21])&IF(RC[-19]&RC[-18]&RC[-17]&RC[-16]="",,"|n"&R1C13)&IF(RC[-19]="",,"|n"&R1C14&RC[-19])&IF(RC[-18]="",,"|n"&R1C15&RC[-18])&IF(RC[-17]="",,"|n"&R1C16&RC[-17])&IF(RC[-16]="",,"|n"&R1C17&RC[-16])&IF(RC[-15]="",,"|n"&R1C18&RC[-15])&IF(RC[-14]="",,"|n"&R1C19&RC[-14])&IF(RC[-13]="",,"|n"&R1C20&RC[-13])&IF(RC[-12]="",,"|n"&R1C21&RC[-12])&IF(RC[-10]="",,"|n"&R1C23&RC[-10])&IF(RC[-9]="",,"|n"&R1C24&RC[-9])&IF(RC[-8]="",,"|n"&R1C25&RC[-8])&IF(RC[-7]="",,"|n"&R1C26&RC[-7])&IF(RC[-6]="",,"|n"&R1C27&RC[-6])&IF(RC[-5]="",,"|n"&R1C28&RC[-5])&IF(RC[-2]="",,"|n"&RC[-2]) -> 
AG1674: =IF(RC[-26]&RC[-25]&RC[-24]&RC[-23]&RC[-22]&RC[-21]="",,R1C6)&IF(RC[-26]="",,"|n"&R1C7&RC[-26])&IF(RC[-25]="",,"|n"&R1C8&RC[-25])&IF(RC[-24]="",,"|n"&R1C9&RC[-24])&IF(RC[-23]="",,"|n"&R1C10&RC[-23])&IF(RC[-22]="",,"|n"&R1C11&RC[-22])&IF(RC[-21]="",,"|n"&R1C12&RC[-21])&IF(RC[-19]&RC[-18]&RC[-17]&RC[-16]="",,"|n"&R1C13)&IF(RC[-19]="",,"|n"&R1C14&RC[-19])&IF(RC[-18]="",,"|n"&R1C15&RC[-18])&IF(RC[-17]="",,"|n"&R1C16&RC[-17])&IF(RC[-16]="",,"|n"&R1C17&RC[-16])&IF(RC[-15]="",,"|n"&R1C18&RC[-15])&IF(RC[-14]="",,"|n"&R1C19&RC[-14])&IF(RC[-13]="",,"|n"&R1C20&RC[-13])&IF(RC[-12]="",,"|n"&R1C21&RC[-12])&IF(RC[-10]="",,"|n"&R1C23&RC[-10])&IF(RC[-9]="",,"|n"&R1C24&RC[-9])&IF(RC[-8]="",,"|n"&R1C25&RC[-8])&IF(RC[-7]="",,"|n"&R1C26&RC[-7])&IF(RC[-6]="",,"|n"&R1C27&RC[-6])&IF(RC[-5]="",,"|n"&R1C28&RC[-5])&IF(RC[-2]="",,"|n"&RC[-2]) -> 
AG1675: =IF(RC[-26]&RC[-25]&RC[-24]&RC[-23]&RC[-22]&RC[-21]="",,R1C6)&IF(RC[-26]="",,"|n"&R1C7&RC[-26])&IF(RC[-25]="",,"|n"&R1C8&RC[-25])&IF(RC[-24]="",,"|n"&R1C9&RC[-24])&IF(RC[-23]="",,"|n"&R1C10&RC[-23])&IF(RC[-22]="",,"|n"&R1C11&RC[-22])&IF(RC[-21]="",,"|n"&R1C12&RC[-21])&IF(RC[-19]&RC[-18]&RC[-17]&RC[-16]="",,"|n"&R1C13)&IF(RC[-19]="",,"|n"&R1C14&RC[-19])&IF(RC[-18]="",,"|n"&R1C15&RC[-18])&IF(RC[-17]="",,"|n"&R1C16&RC[-17])&IF(RC[-16]="",,"|n"&R1C17&RC[-16])&IF(RC[-15]="",,"|n"&R1C18&RC[-15])&IF(RC[-14]="",,"|n"&R1C19&RC[-14])&IF(RC[-13]="",,"|n"&R1C20&RC[-13])&IF(RC[-12]="",,"|n"&R1C21&RC[-12])&IF(RC[-10]="",,"|n"&R1C23&RC[-10])&IF(RC[-9]="",,"|n"&R1C24&RC[-9])&IF(RC[-8]="",,"|n"&R1C25&RC[-8])&IF(RC[-7]="",,"|n"&R1C26&RC[-7])&IF(RC[-6]="",,"|n"&R1C27&RC[-6])&IF(RC[-5]="",,"|n"&R1C28&RC[-5])&IF(RC[-2]="",,"|n"&RC[-2]) -> 
AG1676: =IF(RC[-26]&RC[-25]&RC[-24]&RC[-23]&RC[-22]&RC[-21]="",,R1C6)&IF(RC[-26]="",,"|n"&R1C7&RC[-26])&IF(RC[-25]="",,"|n"&R1C8&RC[-25])&IF(RC[-24]="",,"|n"&R1C9&RC[-24])&IF(RC[-23]="",,"|n"&R1C10&RC[-23])&IF(RC[-22]="",,"|n"&R1C11&RC[-22])&IF(RC[-21]="",,"|n"&R1C12&RC[-21])&IF(RC[-19]&RC[-18]&RC[-17]&RC[-16]="",,"|n"&R1C13)&IF(RC[-19]="",,"|n"&R1C14&RC[-19])&IF(RC[-18]="",,"|n"&R1C15&RC[-18])&IF(RC[-17]="",,"|n"&R1C16&RC[-17])&IF(RC[-16]="",,"|n"&R1C17&RC[-16])&IF(RC[-15]="",,"|n"&R1C18&RC[-15])&IF(RC[-14]="",,"|n"&R1C19&RC[-14])&IF(RC[-13]="",,"|n"&R1C20&RC[-13])&IF(RC[-12]="",,"|n"&R1C21&RC[-12])&IF(RC[-10]="",,"|n"&R1C23&RC[-10])&IF(RC[-9]="",,"|n"&R1C24&RC[-9])&IF(RC[-8]="",,"|n"&R1C25&RC[-8])&IF(RC[-7]="",,"|n"&R1C26&RC[-7])&IF(RC[-6]="",,"|n"&R1C27&RC[-6])&IF(RC[-5]="",,"|n"&R1C28&RC[-5])&IF(RC[-2]="",,"|n"&RC[-2]) -> 
AG1677: =IF(RC[-26]&RC[-25]&RC[-24]&RC[-23]&RC[-22]&RC[-21]="",,R1C6)&IF(RC[-26]="",,"|n"&R1C7&RC[-26])&IF(RC[-25]="",,"|n"&R1C8&RC[-25])&IF(RC[-24]="",,"|n"&R1C9&RC[-24])&IF(RC[-23]="",,"|n"&R1C10&RC[-23])&IF(RC[-22]="",,"|n"&R1C11&RC[-22])&IF(RC[-21]="",,"|n"&R1C12&RC[-21])&IF(RC[-19]&RC[-18]&RC[-17]&RC[-16]="",,"|n"&R1C13)&IF(RC[-19]="",,"|n"&R1C14&RC[-19])&IF(RC[-18]="",,"|n"&R1C15&RC[-18])&IF(RC[-17]="",,"|n"&R1C16&RC[-17])&IF(RC[-16]="",,"|n"&R1C17&RC[-16])&IF(RC[-15]="",,"|n"&R1C18&RC[-15])&IF(RC[-14]="",,"|n"&R1C19&RC[-14])&IF(RC[-13]="",,"|n"&R1C20&RC[-13])&IF(RC[-12]="",,"|n"&R1C21&RC[-12])&IF(RC[-10]="",,"|n"&R1C23&RC[-10])&IF(RC[-9]="",,"|n"&R1C24&RC[-9])&IF(RC[-8]="",,"|n"&R1C25&RC[-8])&IF(RC[-7]="",,"|n"&R1C26&RC[-7])&IF(RC[-6]="",,"|n"&R1C27&RC[-6])&IF(RC[-5]="",,"|n"&R1C28&RC[-5])&IF(RC[-2]="",,"|n"&RC[-2]) -> 
AG1678: =IF(RC[-26]&RC[-25]&RC[-24]&RC[-23]&RC[-22]&RC[-21]="",,R1C6)&IF(RC[-26]="",,"|n"&R1C7&RC[-26])&IF(RC[-25]="",,"|n"&R1C8&RC[-25])&IF(RC[-24]="",,"|n"&R1C9&RC[-24])&IF(RC[-23]="",,"|n"&R1C10&RC[-23])&IF(RC[-22]="",,"|n"&R1C11&RC[-22])&IF(RC[-21]="",,"|n"&R1C12&RC[-21])&IF(RC[-19]&RC[-18]&RC[-17]&RC[-16]="",,"|n"&R1C13)&IF(RC[-19]="",,"|n"&R1C14&RC[-19])&IF(RC[-18]="",,"|n"&R1C15&RC[-18])&IF(RC[-17]="",,"|n"&R1C16&RC[-17])&IF(RC[-16]="",,"|n"&R1C17&RC[-16])&IF(RC[-15]="",,"|n"&R1C18&RC[-15])&IF(RC[-14]="",,"|n"&R1C19&RC[-14])&IF(RC[-13]="",,"|n"&R1C20&RC[-13])&IF(RC[-12]="",,"|n"&R1C21&RC[-12])&IF(RC[-10]="",,"|n"&R1C23&RC[-10])&IF(RC[-9]="",,"|n"&R1C24&RC[-9])&IF(RC[-8]="",,"|n"&R1C25&RC[-8])&IF(RC[-7]="",,"|n"&R1C26&RC[-7])&IF(RC[-6]="",,"|n"&R1C27&RC[-6])&IF(RC[-5]="",,"|n"&R1C28&RC[-5])&IF(RC[-2]="",,"|n"&RC[-2]) -> 
AG1679: =IF(RC[-26]&RC[-25]&RC[-24]&RC[-23]&RC[-22]&RC[-21]="",,R1C6)&IF(RC[-26]="",,"|n"&R1C7&RC[-26])&IF(RC[-25]="",,"|n"&R1C8&RC[-25])&IF(RC[-24]="",,"|n"&R1C9&RC[-24])&IF(RC[-23]="",,"|n"&R1C10&RC[-23])&IF(RC[-22]="",,"|n"&R1C11&RC[-22])&IF(RC[-21]="",,"|n"&R1C12&RC[-21])&IF(RC[-19]&RC[-18]&RC[-17]&RC[-16]="",,"|n"&R1C13)&IF(RC[-19]="",,"|n"&R1C14&RC[-19])&IF(RC[-18]="",,"|n"&R1C15&RC[-18])&IF(RC[-17]="",,"|n"&R1C16&RC[-17])&IF(RC[-16]="",,"|n"&R1C17&RC[-16])&IF(RC[-15]="",,"|n"&R1C18&RC[-15])&IF(RC[-14]="",,"|n"&R1C19&RC[-14])&IF(RC[-13]="",,"|n"&R1C20&RC[-13])&IF(RC[-12]="",,"|n"&R1C21&RC[-12])&IF(RC[-10]="",,"|n"&R1C23&RC[-10])&IF(RC[-9]="",,"|n"&R1C24&RC[-9])&IF(RC[-8]="",,"|n"&R1C25&RC[-8])&IF(RC[-7]="",,"|n"&R1C26&RC[-7])&IF(RC[-6]="",,"|n"&R1C27&RC[-6])&IF(RC[-5]="",,"|n"&R1C28&RC[-5])&IF(RC[-2]="",,"|n"&RC[-2]) -> 
AG1680: =IF(RC[-26]&RC[-25]&RC[-24]&RC[-23]&RC[-22]&RC[-21]="",,R1C6)&IF(RC[-26]="",,"|n"&R1C7&RC[-26])&IF(RC[-25]="",,"|n"&R1C8&RC[-25])&IF(RC[-24]="",,"|n"&R1C9&RC[-24])&IF(RC[-23]="",,"|n"&R1C10&RC[-23])&IF(RC[-22]="",,"|n"&R1C11&RC[-22])&IF(RC[-21]="",,"|n"&R1C12&RC[-21])&IF(RC[-19]&RC[-18]&RC[-17]&RC[-16]="",,"|n"&R1C13)&IF(RC[-19]="",,"|n"&R1C14&RC[-19])&IF(RC[-18]="",,"|n"&R1C15&RC[-18])&IF(RC[-17]="",,"|n"&R1C16&RC[-17])&IF(RC[-16]="",,"|n"&R1C17&RC[-16])&IF(RC[-15]="",,"|n"&R1C18&RC[-15])&IF(RC[-14]="",,"|n"&R1C19&RC[-14])&IF(RC[-13]="",,"|n"&R1C20&RC[-13])&IF(RC[-12]="",,"|n"&R1C21&RC[-12])&IF(RC[-10]="",,"|n"&R1C23&RC[-10])&IF(RC[-9]="",,"|n"&R1C24&RC[-9])&IF(RC[-8]="",,"|n"&R1C25&RC[-8])&IF(RC[-7]="",,"|n"&R1C26&RC[-7])&IF(RC[-6]="",,"|n"&R1C27&RC[-6])&IF(RC[-5]="",,"|n"&R1C28&RC[-5])&IF(RC[-2]="",,"|n"&RC[-2]) -> 
AG1681: =IF(RC[-26]&RC[-25]&RC[-24]&RC[-23]&RC[-22]&RC[-21]="",,R1C6)&IF(RC[-26]="",,"|n"&R1C7&RC[-26])&IF(RC[-25]="",,"|n"&R1C8&RC[-25])&IF(RC[-24]="",,"|n"&R1C9&RC[-24])&IF(RC[-23]="",,"|n"&R1C10&RC[-23])&IF(RC[-22]="",,"|n"&R1C11&RC[-22])&IF(RC[-21]="",,"|n"&R1C12&RC[-21])&IF(RC[-19]&RC[-18]&RC[-17]&RC[-16]="",,"|n"&R1C13)&IF(RC[-19]="",,"|n"&R1C14&RC[-19])&IF(RC[-18]="",,"|n"&R1C15&RC[-18])&IF(RC[-17]="",,"|n"&R1C16&RC[-17])&IF(RC[-16]="",,"|n"&R1C17&RC[-16])&IF(RC[-15]="",,"|n"&R1C18&RC[-15])&IF(RC[-14]="",,"|n"&R1C19&RC[-14])&IF(RC[-13]="",,"|n"&R1C20&RC[-13])&IF(RC[-12]="",,"|n"&R1C21&RC[-12])&IF(RC[-10]="",,"|n"&R1C23&RC[-10])&IF(RC[-9]="",,"|n"&R1C24&RC[-9])&IF(RC[-8]="",,"|n"&R1C25&RC[-8])&IF(RC[-7]="",,"|n"&R1C26&RC[-7])&IF(RC[-6]="",,"|n"&R1C27&RC[-6])&IF(RC[-5]="",,"|n"&R1C28&RC[-5])&IF(RC[-2]="",,"|n"&RC[-2]) -> 
AG1682: =IF(RC[-26]&RC[-25]&RC[-24]&RC[-23]&RC[-22]&RC[-21]="",,R1C6)&IF(RC[-26]="",,"|n"&R1C7&RC[-26])&IF(RC[-25]="",,"|n"&R1C8&RC[-25])&IF(RC[-24]="",,"|n"&R1C9&RC[-24])&IF(RC[-23]="",,"|n"&R1C10&RC[-23])&IF(RC[-22]="",,"|n"&R1C11&RC[-22])&IF(RC[-21]="",,"|n"&R1C12&RC[-21])&IF(RC[-19]&RC[-18]&RC[-17]&RC[-16]="",,"|n"&R1C13)&IF(RC[-19]="",,"|n"&R1C14&RC[-19])&IF(RC[-18]="",,"|n"&R1C15&RC[-18])&IF(RC[-17]="",,"|n"&R1C16&RC[-17])&IF(RC[-16]="",,"|n"&R1C17&RC[-16])&IF(RC[-15]="",,"|n"&R1C18&RC[-15])&IF(RC[-14]="",,"|n"&R1C19&RC[-14])&IF(RC[-13]="",,"|n"&R1C20&RC[-13])&IF(RC[-12]="",,"|n"&R1C21&RC[-12])&IF(RC[-10]="",,"|n"&R1C23&RC[-10])&IF(RC[-9]="",,"|n"&R1C24&RC[-9])&IF(RC[-8]="",,"|n"&R1C25&RC[-8])&IF(RC[-7]="",,"|n"&R1C26&RC[-7])&IF(RC[-6]="",,"|n"&R1C27&RC[-6])&IF(RC[-5]="",,"|n"&R1C28&RC[-5])&IF(RC[-2]="",,"|n"&RC[-2]) -> 
AG1683: =IF(RC[-26]&RC[-25]&RC[-24]&RC[-23]&RC[-22]&RC[-21]="",,R1C6)&IF(RC[-26]="",,"|n"&R1C7&RC[-26])&IF(RC[-25]="",,"|n"&R1C8&RC[-25])&IF(RC[-24]="",,"|n"&R1C9&RC[-24])&IF(RC[-23]="",,"|n"&R1C10&RC[-23])&IF(RC[-22]="",,"|n"&R1C11&RC[-22])&IF(RC[-21]="",,"|n"&R1C12&RC[-21])&IF(RC[-19]&RC[-18]&RC[-17]&RC[-16]="",,"|n"&R1C13)&IF(RC[-19]="",,"|n"&R1C14&RC[-19])&IF(RC[-18]="",,"|n"&R1C15&RC[-18])&IF(RC[-17]="",,"|n"&R1C16&RC[-17])&IF(RC[-16]="",,"|n"&R1C17&RC[-16])&IF(RC[-15]="",,"|n"&R1C18&RC[-15])&IF(RC[-14]="",,"|n"&R1C19&RC[-14])&IF(RC[-13]="",,"|n"&R1C20&RC[-13])&IF(RC[-12]="",,"|n"&R1C21&RC[-12])&IF(RC[-10]="",,"|n"&R1C23&RC[-10])&IF(RC[-9]="",,"|n"&R1C24&RC[-9])&IF(RC[-8]="",,"|n"&R1C25&RC[-8])&IF(RC[-7]="",,"|n"&R1C26&RC[-7])&IF(RC[-6]="",,"|n"&R1C27&RC[-6])&IF(RC[-5]="",,"|n"&R1C28&RC[-5])&IF(RC[-2]="",,"|n"&RC[-2]) -> 
AG1684: =IF(RC[-26]&RC[-25]&RC[-24]&RC[-23]&RC[-22]&RC[-21]="",,R1C6)&IF(RC[-26]="",,"|n"&R1C7&RC[-26])&IF(RC[-25]="",,"|n"&R1C8&RC[-25])&IF(RC[-24]="",,"|n"&R1C9&RC[-24])&IF(RC[-23]="",,"|n"&R1C10&RC[-23])&IF(RC[-22]="",,"|n"&R1C11&RC[-22])&IF(RC[-21]="",,"|n"&R1C12&RC[-21])&IF(RC[-19]&RC[-18]&RC[-17]&RC[-16]="",,"|n"&R1C13)&IF(RC[-19]="",,"|n"&R1C14&RC[-19])&IF(RC[-18]="",,"|n"&R1C15&RC[-18])&IF(RC[-17]="",,"|n"&R1C16&RC[-17])&IF(RC[-16]="",,"|n"&R1C17&RC[-16])&IF(RC[-15]="",,"|n"&R1C18&RC[-15])&IF(RC[-14]="",,"|n"&R1C19&RC[-14])&IF(RC[-13]="",,"|n"&R1C20&RC[-13])&IF(RC[-12]="",,"|n"&R1C21&RC[-12])&IF(RC[-10]="",,"|n"&R1C23&RC[-10])&IF(RC[-9]="",,"|n"&R1C24&RC[-9])&IF(RC[-8]="",,"|n"&R1C25&RC[-8])&IF(RC[-7]="",,"|n"&R1C26&RC[-7])&IF(RC[-6]="",,"|n"&R1C27&RC[-6])&IF(RC[-5]="",,"|n"&R1C28&RC[-5])&IF(RC[-2]="",,"|n"&RC[-2]) -> 
AG1685: =IF(RC[-26]&RC[-25]&RC[-24]&RC[-23]&RC[-22]&RC[-21]="",,R1C6)&IF(RC[-26]="",,"|n"&R1C7&RC[-26])&IF(RC[-25]="",,"|n"&R1C8&RC[-25])&IF(RC[-24]="",,"|n"&R1C9&RC[-24])&IF(RC[-23]="",,"|n"&R1C10&RC[-23])&IF(RC[-22]="",,"|n"&R1C11&RC[-22])&IF(RC[-21]="",,"|n"&R1C12&RC[-21])&IF(RC[-19]&RC[-18]&RC[-17]&RC[-16]="",,"|n"&R1C13)&IF(RC[-19]="",,"|n"&R1C14&RC[-19])&IF(RC[-18]="",,"|n"&R1C15&RC[-18])&IF(RC[-17]="",,"|n"&R1C16&RC[-17])&IF(RC[-16]="",,"|n"&R1C17&RC[-16])&IF(RC[-15]="",,"|n"&R1C18&RC[-15])&IF(RC[-14]="",,"|n"&R1C19&RC[-14])&IF(RC[-13]="",,"|n"&R1C20&RC[-13])&IF(RC[-12]="",,"|n"&R1C21&RC[-12])&IF(RC[-10]="",,"|n"&R1C23&RC[-10])&IF(RC[-9]="",,"|n"&R1C24&RC[-9])&IF(RC[-8]="",,"|n"&R1C25&RC[-8])&IF(RC[-7]="",,"|n"&R1C26&RC[-7])&IF(RC[-6]="",,"|n"&R1C27&RC[-6])&IF(RC[-5]="",,"|n"&R1C28&RC[-5])&IF(RC[-2]="",,"|n"&RC[-2]) -> 
AG1686: =IF(RC[-26]&RC[-25]&RC[-24]&RC[-23]&RC[-22]&RC[-21]="",,R1C6)&IF(RC[-26]="",,"|n"&R1C7&RC[-26])&IF(RC[-25]="",,"|n"&R1C8&RC[-25])&IF(RC[-24]="",,"|n"&R1C9&RC[-24])&IF(RC[-23]="",,"|n"&R1C10&RC[-23])&IF(RC[-22]="",,"|n"&R1C11&RC[-22])&IF(RC[-21]="",,"|n"&R1C12&RC[-21])&IF(RC[-19]&RC[-18]&RC[-17]&RC[-16]="",,"|n"&R1C13)&IF(RC[-19]="",,"|n"&R1C14&RC[-19])&IF(RC[-18]="",,"|n"&R1C15&RC[-18])&IF(RC[-17]="",,"|n"&R1C16&RC[-17])&IF(RC[-16]="",,"|n"&R1C17&RC[-16])&IF(RC[-15]="",,"|n"&R1C18&RC[-15])&IF(RC[-14]="",,"|n"&R1C19&RC[-14])&IF(RC[-13]="",,"|n"&R1C20&RC[-13])&IF(RC[-12]="",,"|n"&R1C21&RC[-12])&IF(RC[-10]="",,"|n"&R1C23&RC[-10])&IF(RC[-9]="",,"|n"&R1C24&RC[-9])&IF(RC[-8]="",,"|n"&R1C25&RC[-8])&IF(RC[-7]="",,"|n"&R1C26&RC[-7])&IF(RC[-6]="",,"|n"&R1C27&RC[-6])&IF(RC[-5]="",,"|n"&R1C28&RC[-5])&IF(RC[-2]="",,"|n"&RC[-2]) -> 
AG1687: =IF(RC[-26]&RC[-25]&RC[-24]&RC[-23]&RC[-22]&RC[-21]="",,R1C6)&IF(RC[-26]="",,"|n"&R1C7&RC[-26])&IF(RC[-25]="",,"|n"&R1C8&RC[-25])&IF(RC[-24]="",,"|n"&R1C9&RC[-24])&IF(RC[-23]="",,"|n"&R1C10&RC[-23])&IF(RC[-22]="",,"|n"&R1C11&RC[-22])&IF(RC[-21]="",,"|n"&R1C12&RC[-21])&IF(RC[-19]&RC[-18]&RC[-17]&RC[-16]="",,"|n"&R1C13)&IF(RC[-19]="",,"|n"&R1C14&RC[-19])&IF(RC[-18]="",,"|n"&R1C15&RC[-18])&IF(RC[-17]="",,"|n"&R1C16&RC[-17])&IF(RC[-16]="",,"|n"&R1C17&RC[-16])&IF(RC[-15]="",,"|n"&R1C18&RC[-15])&IF(RC[-14]="",,"|n"&R1C19&RC[-14])&IF(RC[-13]="",,"|n"&R1C20&RC[-13])&IF(RC[-12]="",,"|n"&R1C21&RC[-12])&IF(RC[-10]="",,"|n"&R1C23&RC[-10])&IF(RC[-9]="",,"|n"&R1C24&RC[-9])&IF(RC[-8]="",,"|n"&R1C25&RC[-8])&IF(RC[-7]="",,"|n"&R1C26&RC[-7])&IF(RC[-6]="",,"|n"&R1C27&RC[-6])&IF(RC[-5]="",,"|n"&R1C28&RC[-5])&IF(RC[-2]="",,"|n"&RC[-2]) -> 
AG1688: =IF(RC[-26]&RC[-25]&RC[-24]&RC[-23]&RC[-22]&RC[-21]="",,R1C6)&IF(RC[-26]="",,"|n"&R1C7&RC[-26])&IF(RC[-25]="",,"|n"&R1C8&RC[-25])&IF(RC[-24]="",,"|n"&R1C9&RC[-24])&IF(RC[-23]="",,"|n"&R1C10&RC[-23])&IF(RC[-22]="",,"|n"&R1C11&RC[-22])&IF(RC[-21]="",,"|n"&R1C12&RC[-21])&IF(RC[-19]&RC[-18]&RC[-17]&RC[-16]="",,"|n"&R1C13)&IF(RC[-19]="",,"|n"&R1C14&RC[-19])&IF(RC[-18]="",,"|n"&R1C15&RC[-18])&IF(RC[-17]="",,"|n"&R1C16&RC[-17])&IF(RC[-16]="",,"|n"&R1C17&RC[-16])&IF(RC[-15]="",,"|n"&R1C18&RC[-15])&IF(RC[-14]="",,"|n"&R1C19&RC[-14])&IF(RC[-13]="",,"|n"&R1C20&RC[-13])&IF(RC[-12]="",,"|n"&R1C21&RC[-12])&IF(RC[-10]="",,"|n"&R1C23&RC[-10])&IF(RC[-9]="",,"|n"&R1C24&RC[-9])&IF(RC[-8]="",,"|n"&R1C25&RC[-8])&IF(RC[-7]="",,"|n"&R1C26&RC[-7])&IF(RC[-6]="",,"|n"&R1C27&RC[-6])&IF(RC[-5]="",,"|n"&R1C28&RC[-5])&IF(RC[-2]="",,"|n"&RC[-2]) -> 
AG1689: =IF(RC[-26]&RC[-25]&RC[-24]&RC[-23]&RC[-22]&RC[-21]="",,R1C6)&IF(RC[-26]="",,"|n"&R1C7&RC[-26])&IF(RC[-25]="",,"|n"&R1C8&RC[-25])&IF(RC[-24]="",,"|n"&R1C9&RC[-24])&IF(RC[-23]="",,"|n"&R1C10&RC[-23])&IF(RC[-22]="",,"|n"&R1C11&RC[-22])&IF(RC[-21]="",,"|n"&R1C12&RC[-21])&IF(RC[-19]&RC[-18]&RC[-17]&RC[-16]="",,"|n"&R1C13)&IF(RC[-19]="",,"|n"&R1C14&RC[-19])&IF(RC[-18]="",,"|n"&R1C15&RC[-18])&IF(RC[-17]="",,"|n"&R1C16&RC[-17])&IF(RC[-16]="",,"|n"&R1C17&RC[-16])&IF(RC[-15]="",,"|n"&R1C18&RC[-15])&IF(RC[-14]="",,"|n"&R1C19&RC[-14])&IF(RC[-13]="",,"|n"&R1C20&RC[-13])&IF(RC[-12]="",,"|n"&R1C21&RC[-12])&IF(RC[-10]="",,"|n"&R1C23&RC[-10])&IF(RC[-9]="",,"|n"&R1C24&RC[-9])&IF(RC[-8]="",,"|n"&R1C25&RC[-8])&IF(RC[-7]="",,"|n"&R1C26&RC[-7])&IF(RC[-6]="",,"|n"&R1C27&RC[-6])&IF(RC[-5]="",,"|n"&R1C28&RC[-5])&IF(RC[-2]="",,"|n"&RC[-2]) -> 
AG1690: =IF(RC[-26]&RC[-25]&RC[-24]&RC[-23]&RC[-22]&RC[-21]="",,R1C6)&IF(RC[-26]="",,"|n"&R1C7&RC[-26])&IF(RC[-25]="",,"|n"&R1C8&RC[-25])&IF(RC[-24]="",,"|n"&R1C9&RC[-24])&IF(RC[-23]="",,"|n"&R1C10&RC[-23])&IF(RC[-22]="",,"|n"&R1C11&RC[-22])&IF(RC[-21]="",,"|n"&R1C12&RC[-21])&IF(RC[-19]&RC[-18]&RC[-17]&RC[-16]="",,"|n"&R1C13)&IF(RC[-19]="",,"|n"&R1C14&RC[-19])&IF(RC[-18]="",,"|n"&R1C15&RC[-18])&IF(RC[-17]="",,"|n"&R1C16&RC[-17])&IF(RC[-16]="",,"|n"&R1C17&RC[-16])&IF(RC[-15]="",,"|n"&R1C18&RC[-15])&IF(RC[-14]="",,"|n"&R1C19&RC[-14])&IF(RC[-13]="",,"|n"&R1C20&RC[-13])&IF(RC[-12]="",,"|n"&R1C21&RC[-12])&IF(RC[-10]="",,"|n"&R1C23&RC[-10])&IF(RC[-9]="",,"|n"&R1C24&RC[-9])&IF(RC[-8]="",,"|n"&R1C25&RC[-8])&IF(RC[-7]="",,"|n"&R1C26&RC[-7])&IF(RC[-6]="",,"|n"&R1C27&RC[-6])&IF(RC[-5]="",,"|n"&R1C28&RC[-5])&IF(RC[-2]="",,"|n"&RC[-2]) -> 
AG1691: =IF(RC[-26]&RC[-25]&RC[-24]&RC[-23]&RC[-22]&RC[-21]="",,R1C6)&IF(RC[-26]="",,"|n"&R1C7&RC[-26])&IF(RC[-25]="",,"|n"&R1C8&RC[-25])&IF(RC[-24]="",,"|n"&R1C9&RC[-24])&IF(RC[-23]="",,"|n"&R1C10&RC[-23])&IF(RC[-22]="",,"|n"&R1C11&RC[-22])&IF(RC[-21]="",,"|n"&R1C12&RC[-21])&IF(RC[-19]&RC[-18]&RC[-17]&RC[-16]="",,"|n"&R1C13)&IF(RC[-19]="",,"|n"&R1C14&RC[-19])&IF(RC[-18]="",,"|n"&R1C15&RC[-18])&IF(RC[-17]="",,"|n"&R1C16&RC[-17])&IF(RC[-16]="",,"|n"&R1C17&RC[-16])&IF(RC[-15]="",,"|n"&R1C18&RC[-15])&IF(RC[-14]="",,"|n"&R1C19&RC[-14])&IF(RC[-13]="",,"|n"&R1C20&RC[-13])&IF(RC[-12]="",,"|n"&R1C21&RC[-12])&IF(RC[-10]="",,"|n"&R1C23&RC[-10])&IF(RC[-9]="",,"|n"&R1C24&RC[-9])&IF(RC[-8]="",,"|n"&R1C25&RC[-8])&IF(RC[-7]="",,"|n"&R1C26&RC[-7])&IF(RC[-6]="",,"|n"&R1C27&RC[-6])&IF(RC[-5]="",,"|n"&R1C28&RC[-5])&IF(RC[-2]="",,"|n"&RC[-2]) -> 
AG1692: =IF(RC[-26]&RC[-25]&RC[-24]&RC[-23]&RC[-22]&RC[-21]="",,R1C6)&IF(RC[-26]="",,"|n"&R1C7&RC[-26])&IF(RC[-25]="",,"|n"&R1C8&RC[-25])&IF(RC[-24]="",,"|n"&R1C9&RC[-24])&IF(RC[-23]="",,"|n"&R1C10&RC[-23])&IF(RC[-22]="",,"|n"&R1C11&RC[-22])&IF(RC[-21]="",,"|n"&R1C12&RC[-21])&IF(RC[-19]&RC[-18]&RC[-17]&RC[-16]="",,"|n"&R1C13)&IF(RC[-19]="",,"|n"&R1C14&RC[-19])&IF(RC[-18]="",,"|n"&R1C15&RC[-18])&IF(RC[-17]="",,"|n"&R1C16&RC[-17])&IF(RC[-16]="",,"|n"&R1C17&RC[-16])&IF(RC[-15]="",,"|n"&R1C18&RC[-15])&IF(RC[-14]="",,"|n"&R1C19&RC[-14])&IF(RC[-13]="",,"|n"&R1C20&RC[-13])&IF(RC[-12]="",,"|n"&R1C21&RC[-12])&IF(RC[-10]="",,"|n"&R1C23&RC[-10])&IF(RC[-9]="",,"|n"&R1C24&RC[-9])&IF(RC[-8]="",,"|n"&R1C25&RC[-8])&IF(RC[-7]="",,"|n"&R1C26&RC[-7])&IF(RC[-6]="",,"|n"&R1C27&RC[-6])&IF(RC[-5]="",,"|n"&R1C28&RC[-5])&IF(RC[-2]="",,"|n"&RC[-2]) -> 
AG1693: =IF(RC[-26]&RC[-25]&RC[-24]&RC[-23]&RC[-22]&RC[-21]="",,R1C6)&IF(RC[-26]="",,"|n"&R1C7&RC[-26])&IF(RC[-25]="",,"|n"&R1C8&RC[-25])&IF(RC[-24]="",,"|n"&R1C9&RC[-24])&IF(RC[-23]="",,"|n"&R1C10&RC[-23])&IF(RC[-22]="",,"|n"&R1C11&RC[-22])&IF(RC[-21]="",,"|n"&R1C12&RC[-21])&IF(RC[-19]&RC[-18]&RC[-17]&RC[-16]="",,"|n"&R1C13)&IF(RC[-19]="",,"|n"&R1C14&RC[-19])&IF(RC[-18]="",,"|n"&R1C15&RC[-18])&IF(RC[-17]="",,"|n"&R1C16&RC[-17])&IF(RC[-16]="",,"|n"&R1C17&RC[-16])&IF(RC[-15]="",,"|n"&R1C18&RC[-15])&IF(RC[-14]="",,"|n"&R1C19&RC[-14])&IF(RC[-13]="",,"|n"&R1C20&RC[-13])&IF(RC[-12]="",,"|n"&R1C21&RC[-12])&IF(RC[-10]="",,"|n"&R1C23&RC[-10])&IF(RC[-9]="",,"|n"&R1C24&RC[-9])&IF(RC[-8]="",,"|n"&R1C25&RC[-8])&IF(RC[-7]="",,"|n"&R1C26&RC[-7])&IF(RC[-6]="",,"|n"&R1C27&RC[-6])&IF(RC[-5]="",,"|n"&R1C28&RC[-5])&IF(RC[-2]="",,"|n"&RC[-2]) -> 
AG1694: =IF(RC[-26]&RC[-25]&RC[-24]&RC[-23]&RC[-22]&RC[-21]="",,R1C6)&IF(RC[-26]="",,"|n"&R1C7&RC[-26])&IF(RC[-25]="",,"|n"&R1C8&RC[-25])&IF(RC[-24]="",,"|n"&R1C9&RC[-24])&IF(RC[-23]="",,"|n"&R1C10&RC[-23])&IF(RC[-22]="",,"|n"&R1C11&RC[-22])&IF(RC[-21]="",,"|n"&R1C12&RC[-21])&IF(RC[-19]&RC[-18]&RC[-17]&RC[-16]="",,"|n"&R1C13)&IF(RC[-19]="",,"|n"&R1C14&RC[-19])&IF(RC[-18]="",,"|n"&R1C15&RC[-18])&IF(RC[-17]="",,"|n"&R1C16&RC[-17])&IF(RC[-16]="",,"|n"&R1C17&RC[-16])&IF(RC[-15]="",,"|n"&R1C18&RC[-15])&IF(RC[-14]="",,"|n"&R1C19&RC[-14])&IF(RC[-13]="",,"|n"&R1C20&RC[-13])&IF(RC[-12]="",,"|n"&R1C21&RC[-12])&IF(RC[-10]="",,"|n"&R1C23&RC[-10])&IF(RC[-9]="",,"|n"&R1C24&RC[-9])&IF(RC[-8]="",,"|n"&R1C25&RC[-8])&IF(RC[-7]="",,"|n"&R1C26&RC[-7])&IF(RC[-6]="",,"|n"&R1C27&RC[-6])&IF(RC[-5]="",,"|n"&R1C28&RC[-5])&IF(RC[-2]="",,"|n"&RC[-2]) -> 
AG1695: =IF(RC[-26]&RC[-25]&RC[-24]&RC[-23]&RC[-22]&RC[-21]="",,R1C6)&IF(RC[-26]="",,"|n"&R1C7&RC[-26])&IF(RC[-25]="",,"|n"&R1C8&RC[-25])&IF(RC[-24]="",,"|n"&R1C9&RC[-24])&IF(RC[-23]="",,"|n"&R1C10&RC[-23])&IF(RC[-22]="",,"|n"&R1C11&RC[-22])&IF(RC[-21]="",,"|n"&R1C12&RC[-21])&IF(RC[-19]&RC[-18]&RC[-17]&RC[-16]="",,"|n"&R1C13)&IF(RC[-19]="",,"|n"&R1C14&RC[-19])&IF(RC[-18]="",,"|n"&R1C15&RC[-18])&IF(RC[-17]="",,"|n"&R1C16&RC[-17])&IF(RC[-16]="",,"|n"&R1C17&RC[-16])&IF(RC[-15]="",,"|n"&R1C18&RC[-15])&IF(RC[-14]="",,"|n"&R1C19&RC[-14])&IF(RC[-13]="",,"|n"&R1C20&RC[-13])&IF(RC[-12]="",,"|n"&R1C21&RC[-12])&IF(RC[-10]="",,"|n"&R1C23&RC[-10])&IF(RC[-9]="",,"|n"&R1C24&RC[-9])&IF(RC[-8]="",,"|n"&R1C25&RC[-8])&IF(RC[-7]="",,"|n"&R1C26&RC[-7])&IF(RC[-6]="",,"|n"&R1C27&RC[-6])&IF(RC[-5]="",,"|n"&R1C28&RC[-5])&IF(RC[-2]="",,"|n"&RC[-2]) -> 
AG1696: =IF(RC[-26]&RC[-25]&RC[-24]&RC[-23]&RC[-22]&RC[-21]="",,R1C6)&IF(RC[-26]="",,"|n"&R1C7&RC[-26])&IF(RC[-25]="",,"|n"&R1C8&RC[-25])&IF(RC[-24]="",,"|n"&R1C9&RC[-24])&IF(RC[-23]="",,"|n"&R1C10&RC[-23])&IF(RC[-22]="",,"|n"&R1C11&RC[-22])&IF(RC[-21]="",,"|n"&R1C12&RC[-21])&IF(RC[-19]&RC[-18]&RC[-17]&RC[-16]="",,"|n"&R1C13)&IF(RC[-19]="",,"|n"&R1C14&RC[-19])&IF(RC[-18]="",,"|n"&R1C15&RC[-18])&IF(RC[-17]="",,"|n"&R1C16&RC[-17])&IF(RC[-16]="",,"|n"&R1C17&RC[-16])&IF(RC[-15]="",,"|n"&R1C18&RC[-15])&IF(RC[-14]="",,"|n"&R1C19&RC[-14])&IF(RC[-13]="",,"|n"&R1C20&RC[-13])&IF(RC[-12]="",,"|n"&R1C21&RC[-12])&IF(RC[-10]="",,"|n"&R1C23&RC[-10])&IF(RC[-9]="",,"|n"&R1C24&RC[-9])&IF(RC[-8]="",,"|n"&R1C25&RC[-8])&IF(RC[-7]="",,"|n"&R1C26&RC[-7])&IF(RC[-6]="",,"|n"&R1C27&RC[-6])&IF(RC[-5]="",,"|n"&R1C28&RC[-5])&IF(RC[-2]="",,"|n"&RC[-2]) -> 
AG1697: =IF(RC[-26]&RC[-25]&RC[-24]&RC[-23]&RC[-22]&RC[-21]="",,R1C6)&IF(RC[-26]="",,"|n"&R1C7&RC[-26])&IF(RC[-25]="",,"|n"&R1C8&RC[-25])&IF(RC[-24]="",,"|n"&R1C9&RC[-24])&IF(RC[-23]="",,"|n"&R1C10&RC[-23])&IF(RC[-22]="",,"|n"&R1C11&RC[-22])&IF(RC[-21]="",,"|n"&R1C12&RC[-21])&IF(RC[-19]&RC[-18]&RC[-17]&RC[-16]="",,"|n"&R1C13)&IF(RC[-19]="",,"|n"&R1C14&RC[-19])&IF(RC[-18]="",,"|n"&R1C15&RC[-18])&IF(RC[-17]="",,"|n"&R1C16&RC[-17])&IF(RC[-16]="",,"|n"&R1C17&RC[-16])&IF(RC[-15]="",,"|n"&R1C18&RC[-15])&IF(RC[-14]="",,"|n"&R1C19&RC[-14])&IF(RC[-13]="",,"|n"&R1C20&RC[-13])&IF(RC[-12]="",,"|n"&R1C21&RC[-12])&IF(RC[-10]="",,"|n"&R1C23&RC[-10])&IF(RC[-9]="",,"|n"&R1C24&RC[-9])&IF(RC[-8]="",,"|n"&R1C25&RC[-8])&IF(RC[-7]="",,"|n"&R1C26&RC[-7])&IF(RC[-6]="",,"|n"&R1C27&RC[-6])&IF(RC[-5]="",,"|n"&R1C28&RC[-5])&IF(RC[-2]="",,"|n"&RC[-2]) -> 
AG1698: =IF(RC[-26]&RC[-25]&RC[-24]&RC[-23]&RC[-22]&RC[-21]="",,R1C6)&IF(RC[-26]="",,"|n"&R1C7&RC[-26])&IF(RC[-25]="",,"|n"&R1C8&RC[-25])&IF(RC[-24]="",,"|n"&R1C9&RC[-24])&IF(RC[-23]="",,"|n"&R1C10&RC[-23])&IF(RC[-22]="",,"|n"&R1C11&RC[-22])&IF(RC[-21]="",,"|n"&R1C12&RC[-21])&IF(RC[-19]&RC[-18]&RC[-17]&RC[-16]="",,"|n"&R1C13)&IF(RC[-19]="",,"|n"&R1C14&RC[-19])&IF(RC[-18]="",,"|n"&R1C15&RC[-18])&IF(RC[-17]="",,"|n"&R1C16&RC[-17])&IF(RC[-16]="",,"|n"&R1C17&RC[-16])&IF(RC[-15]="",,"|n"&R1C18&RC[-15])&IF(RC[-14]="",,"|n"&R1C19&RC[-14])&IF(RC[-13]="",,"|n"&R1C20&RC[-13])&IF(RC[-12]="",,"|n"&R1C21&RC[-12])&IF(RC[-10]="",,"|n"&R1C23&RC[-10])&IF(RC[-9]="",,"|n"&R1C24&RC[-9])&IF(RC[-8]="",,"|n"&R1C25&RC[-8])&IF(RC[-7]="",,"|n"&R1C26&RC[-7])&IF(RC[-6]="",,"|n"&R1C27&RC[-6])&IF(RC[-5]="",,"|n"&R1C28&RC[-5])&IF(RC[-2]="",,"|n"&RC[-2]) -> 
AG1699: =IF(RC[-26]&RC[-25]&RC[-24]&RC[-23]&RC[-22]&RC[-21]="",,R1C6)&IF(RC[-26]="",,"|n"&R1C7&RC[-26])&IF(RC[-25]="",,"|n"&R1C8&RC[-25])&IF(RC[-24]="",,"|n"&R1C9&RC[-24])&IF(RC[-23]="",,"|n"&R1C10&RC[-23])&IF(RC[-22]="",,"|n"&R1C11&RC[-22])&IF(RC[-21]="",,"|n"&R1C12&RC[-21])&IF(RC[-19]&RC[-18]&RC[-17]&RC[-16]="",,"|n"&R1C13)&IF(RC[-19]="",,"|n"&R1C14&RC[-19])&IF(RC[-18]="",,"|n"&R1C15&RC[-18])&IF(RC[-17]="",,"|n"&R1C16&RC[-17])&IF(RC[-16]="",,"|n"&R1C17&RC[-16])&IF(RC[-15]="",,"|n"&R1C18&RC[-15])&IF(RC[-14]="",,"|n"&R1C19&RC[-14])&IF(RC[-13]="",,"|n"&R1C20&RC[-13])&IF(RC[-12]="",,"|n"&R1C21&RC[-12])&IF(RC[-10]="",,"|n"&R1C23&RC[-10])&IF(RC[-9]="",,"|n"&R1C24&RC[-9])&IF(RC[-8]="",,"|n"&R1C25&RC[-8])&IF(RC[-7]="",,"|n"&R1C26&RC[-7])&IF(RC[-6]="",,"|n"&R1C27&RC[-6])&IF(RC[-5]="",,"|n"&R1C28&RC[-5])&IF(RC[-2]="",,"|n"&RC[-2]) -> 
AG1700: =IF(RC[-26]&RC[-25]&RC[-24]&RC[-23]&RC[-22]&RC[-21]="",,R1C6)&IF(RC[-26]="",,"|n"&R1C7&RC[-26])&IF(RC[-25]="",,"|n"&R1C8&RC[-25])&IF(RC[-24]="",,"|n"&R1C9&RC[-24])&IF(RC[-23]="",,"|n"&R1C10&RC[-23])&IF(RC[-22]="",,"|n"&R1C11&RC[-22])&IF(RC[-21]="",,"|n"&R1C12&RC[-21])&IF(RC[-19]&RC[-18]&RC[-17]&RC[-16]="",,"|n"&R1C13)&IF(RC[-19]="",,"|n"&R1C14&RC[-19])&IF(RC[-18]="",,"|n"&R1C15&RC[-18])&IF(RC[-17]="",,"|n"&R1C16&RC[-17])&IF(RC[-16]="",,"|n"&R1C17&RC[-16])&IF(RC[-15]="",,"|n"&R1C18&RC[-15])&IF(RC[-14]="",,"|n"&R1C19&RC[-14])&IF(RC[-13]="",,"|n"&R1C20&RC[-13])&IF(RC[-12]="",,"|n"&R1C21&RC[-12])&IF(RC[-10]="",,"|n"&R1C23&RC[-10])&IF(RC[-9]="",,"|n"&R1C24&RC[-9])&IF(RC[-8]="",,"|n"&R1C25&RC[-8])&IF(RC[-7]="",,"|n"&R1C26&RC[-7])&IF(RC[-6]="",,"|n"&R1C27&RC[-6])&IF(RC[-5]="",,"|n"&R1C28&RC[-5])&IF(RC[-2]="",,"|n"&RC[-2]) -> 
AG1701: =IF(RC[-26]&RC[-25]&RC[-24]&RC[-23]&RC[-22]&RC[-21]="",,R1C6)&IF(RC[-26]="",,"|n"&R1C7&RC[-26])&IF(RC[-25]="",,"|n"&R1C8&RC[-25])&IF(RC[-24]="",,"|n"&R1C9&RC[-24])&IF(RC[-23]="",,"|n"&R1C10&RC[-23])&IF(RC[-22]="",,"|n"&R1C11&RC[-22])&IF(RC[-21]="",,"|n"&R1C12&RC[-21])&IF(RC[-19]&RC[-18]&RC[-17]&RC[-16]="",,"|n"&R1C13)&IF(RC[-19]="",,"|n"&R1C14&RC[-19])&IF(RC[-18]="",,"|n"&R1C15&RC[-18])&IF(RC[-17]="",,"|n"&R1C16&RC[-17])&IF(RC[-16]="",,"|n"&R1C17&RC[-16])&IF(RC[-15]="",,"|n"&R1C18&RC[-15])&IF(RC[-14]="",,"|n"&R1C19&RC[-14])&IF(RC[-13]="",,"|n"&R1C20&RC[-13])&IF(RC[-12]="",,"|n"&R1C21&RC[-12])&IF(RC[-10]="",,"|n"&R1C23&RC[-10])&IF(RC[-9]="",,"|n"&R1C24&RC[-9])&IF(RC[-8]="",,"|n"&R1C25&RC[-8])&IF(RC[-7]="",,"|n"&R1C26&RC[-7])&IF(RC[-6]="",,"|n"&R1C27&RC[-6])&IF(RC[-5]="",,"|n"&R1C28&RC[-5])&IF(RC[-2]="",,"|n"&RC[-2]) -> 
AG1702: =IF(RC[-26]&RC[-25]&RC[-24]&RC[-23]&RC[-22]&RC[-21]="",,R1C6)&IF(RC[-26]="",,"|n"&R1C7&RC[-26])&IF(RC[-25]="",,"|n"&R1C8&RC[-25])&IF(RC[-24]="",,"|n"&R1C9&RC[-24])&IF(RC[-23]="",,"|n"&R1C10&RC[-23])&IF(RC[-22]="",,"|n"&R1C11&RC[-22])&IF(RC[-21]="",,"|n"&R1C12&RC[-21])&IF(RC[-19]&RC[-18]&RC[-17]&RC[-16]="",,"|n"&R1C13)&IF(RC[-19]="",,"|n"&R1C14&RC[-19])&IF(RC[-18]="",,"|n"&R1C15&RC[-18])&IF(RC[-17]="",,"|n"&R1C16&RC[-17])&IF(RC[-16]="",,"|n"&R1C17&RC[-16])&IF(RC[-15]="",,"|n"&R1C18&RC[-15])&IF(RC[-14]="",,"|n"&R1C19&RC[-14])&IF(RC[-13]="",,"|n"&R1C20&RC[-13])&IF(RC[-12]="",,"|n"&R1C21&RC[-12])&IF(RC[-10]="",,"|n"&R1C23&RC[-10])&IF(RC[-9]="",,"|n"&R1C24&RC[-9])&IF(RC[-8]="",,"|n"&R1C25&RC[-8])&IF(RC[-7]="",,"|n"&R1C26&RC[-7])&IF(RC[-6]="",,"|n"&R1C27&RC[-6])&IF(RC[-5]="",,"|n"&R1C28&RC[-5])&IF(RC[-2]="",,"|n"&RC[-2]) -> 
AG1703: =IF(RC[-26]&RC[-25]&RC[-24]&RC[-23]&RC[-22]&RC[-21]="",,R1C6)&IF(RC[-26]="",,"|n"&R1C7&RC[-26])&IF(RC[-25]="",,"|n"&R1C8&RC[-25])&IF(RC[-24]="",,"|n"&R1C9&RC[-24])&IF(RC[-23]="",,"|n"&R1C10&RC[-23])&IF(RC[-22]="",,"|n"&R1C11&RC[-22])&IF(RC[-21]="",,"|n"&R1C12&RC[-21])&IF(RC[-19]&RC[-18]&RC[-17]&RC[-16]="",,"|n"&R1C13)&IF(RC[-19]="",,"|n"&R1C14&RC[-19])&IF(RC[-18]="",,"|n"&R1C15&RC[-18])&IF(RC[-17]="",,"|n"&R1C16&RC[-17])&IF(RC[-16]="",,"|n"&R1C17&RC[-16])&IF(RC[-15]="",,"|n"&R1C18&RC[-15])&IF(RC[-14]="",,"|n"&R1C19&RC[-14])&IF(RC[-13]="",,"|n"&R1C20&RC[-13])&IF(RC[-12]="",,"|n"&R1C21&RC[-12])&IF(RC[-10]="",,"|n"&R1C23&RC[-10])&IF(RC[-9]="",,"|n"&R1C24&RC[-9])&IF(RC[-8]="",,"|n"&R1C25&RC[-8])&IF(RC[-7]="",,"|n"&R1C26&RC[-7])&IF(RC[-6]="",,"|n"&R1C27&RC[-6])&IF(RC[-5]="",,"|n"&R1C28&RC[-5])&IF(RC[-2]="",,"|n"&RC[-2]) -> 
AG1704: =IF(RC[-26]&RC[-25]&RC[-24]&RC[-23]&RC[-22]&RC[-21]="",,R1C6)&IF(RC[-26]="",,"|n"&R1C7&RC[-26])&IF(RC[-25]="",,"|n"&R1C8&RC[-25])&IF(RC[-24]="",,"|n"&R1C9&RC[-24])&IF(RC[-23]="",,"|n"&R1C10&RC[-23])&IF(RC[-22]="",,"|n"&R1C11&RC[-22])&IF(RC[-21]="",,"|n"&R1C12&RC[-21])&IF(RC[-19]&RC[-18]&RC[-17]&RC[-16]="",,"|n"&R1C13)&IF(RC[-19]="",,"|n"&R1C14&RC[-19])&IF(RC[-18]="",,"|n"&R1C15&RC[-18])&IF(RC[-17]="",,"|n"&R1C16&RC[-17])&IF(RC[-16]="",,"|n"&R1C17&RC[-16])&IF(RC[-15]="",,"|n"&R1C18&RC[-15])&IF(RC[-14]="",,"|n"&R1C19&RC[-14])&IF(RC[-13]="",,"|n"&R1C20&RC[-13])&IF(RC[-12]="",,"|n"&R1C21&RC[-12])&IF(RC[-10]="",,"|n"&R1C23&RC[-10])&IF(RC[-9]="",,"|n"&R1C24&RC[-9])&IF(RC[-8]="",,"|n"&R1C25&RC[-8])&IF(RC[-7]="",,"|n"&R1C26&RC[-7])&IF(RC[-6]="",,"|n"&R1C27&RC[-6])&IF(RC[-5]="",,"|n"&R1C28&RC[-5])&IF(RC[-2]="",,"|n"&RC[-2]) -> 

Sheet: Sheet2
A1: D | B1: |cFF999999 | C1: |r | D1: 1 | E1: 2
A2: C | B2: |cFF99FF66 | D2: 1.2 | E2: 2.4
A3: B | B3: |cFF1BE6B8 | D3: 1.4 | E3: 2.8
A4: A | B4: |cFF33FF00 | D4: 1.8 | E4: 3.6
A5: S | B5: |cFFFF9933 | D5: 2 | E5: 4
A6: X | B6: |Cffff0000 | D6: 2.5 | E6: 5
A7: D | B7: 丁 | C7: 16 | D7: 1 | E7: model\item\texiao_dijiguangzhu.mdx
A8: C | B8: 丙 | C8: 8 | D8: =R[-1]C*2 -> 2 | E8: model\item\texiao_dijiguangzhu.mdx
A9: B | B9: 乙 | C9: 4 | D9: 3 | E9: model\item\texiao_zhongjiguangzhu.mdx
A10: A | B10: 甲 | C10: 2 | D10: 4 | E10: model\item\texiao_zhongjiguangzhu2.mdx
A11: S | B11: 绝 | C11: 1 | D11: 5 | E11: model\item\texiao_gaojiguangzhu.mdx
A12: X | B12: 神 | C12: 1 | D12: 6 | E12: model\item\texiao_gaojiguangzhu.mdx
A13: 1 | B13: 一 | D13: 1
A14: 2 | B14: 二 | D14: 3
A15: 3 | B15: 三 | D15: 8
A16: 4 | B16: 四 | D16: 10
A17: 5 | B17: 五 | D17: 16
A18: 6 | B18: 六 | D18: 22

Sheet: Sheet3
A1: 硬骨 | B1: 焚海 | C1: 蚀肉 | D1: 星罗 | E1: 幽冥 | F1: 五灵 | G1: 混元细 | H1: 天钧绣 | I1: 断魂今 | J1: 罗候奇 | K1: 闇影曲 | L1: 流云锈 | M1: 玄月妖空 | N1: 鸿蒙窄木 | O1: 金鼎细晶 | P1: 双龙魔凰 | Q1: 量天佛酝 | R1: 日月之石 | S1: 风华绝世 | T1: 武动之魂 | U1: 黑月之潮 | V1: 灼灼其华 | W1: 清泉流响 | X1: 无限之光
A2: 寒梅 | B2: 玄冥 | C2: 镏金 | D2: 临枫 | E2: 天翔 | F2: 邪月 | G2: 金胎精 | H2: 天回绣 | I2: 神鸩绣 | J2: 寒天灵 | K2: 点星明 | L2: 苍炎狭 | M2: 断肠魔根 | N2: 修灭弯土 | O2: 噬魂直韫 | P2: 兽王窄缎 | Q2: 霓光软雾 | R2: 幻光神链 | S2: 金镶玉翠 | T2: 瘟疫之源 | U2: 成王之志 | V2: 耀武锋芒 | W2: 氤氲之息 | X2: 无瑕纯白
A3: 五岳 | B3: 风雷 | C3: 豹爪 | D3: 兽鳞 | E3: 白焰 | F3: 枯禅 | G3: 碧云奇 | H3: 破天幽 | I3: 影游歧 | J3: 曜仙直 | K3: 雨霖重 | L3: 龙虎鬼 | M3: 绫罗毒金 | N3: 利爪幽神 | O3: 赤霞纯鬼 | P3: 雷音粗阙 | Q3: 七绝佛沙 | R3: 星尘神镯
A4: 天龙 | B4: 乾坤 | C4: 影游 | D4: 帝恨 | E4: 血龙 | F4: 千红 | G4: 飘转直 | H4: 风雷影 | I4: 邪光利 | J4: 链铠古 | K4: 孤风闇 | L4: 万仞神 | M4: 飞云古火 | N4: 望月直玉 | O4: 洗髓幻神 | P4: 勾陈灵丝 | Q4: 虚空神光 | R4: 玄灵魔戒
A5: 玉蟾 | B5: 白骨 | C5: 凤王 | D5: 紫雷 | E5: 暗影 | F5: 照影 | G5: 法性旧 | H5: 孤风魔 | I5: 青丝重 | J5: 银月蛊 | K5: 闪光幽 | L5: 无量硬 | S5: 释灵渊 - 黑暮瞳 | T5: 龙战 - 怒心 | U5: 道禅 - 静心 | V5: 空城泪 - 旧王愁 | W5: 忆古昔 - 克己 | X5: 仙道 - 至鸿
A6: 混元 | B6: 凝霜 | C6: 龙鳞 | D6: 灵角 | E6: 罡风 | F6: 追魂 | G6: 昱暝直 | H6: 红锦破 | I6: 照影锐 | J6: 战狼毒 | K6: 灵蛇幽 | L6: 雄狮精 | S6: 释灵渊 - 电光气 | T6: 龙战 - 激魂 | U6: 道禅 - 制怒 | V6: 空城泪 - 故国恨 | W6: 忆古昔 - 守心 | X6: 仙道 - 永恒
A7: 金凤 | B7: 狂龙 | C7: 佛光 | D7: 紫清 | E7: 穿心 | F7: 极光 | G7: 流涂纯 | H7: 黄鹤粗 | I7: 棂兰广 | J7: 轮炎古 | K7: 摧心软 | L7: 孤问小
A8: 碧霞 | B8: 龙林 | C8: 非影 | D8: 怀云 | E8: 青涛 | F8: 断情 | G8: 天浪广 | H8: 星象冥 | I8: 战豹秘 | J8: 蚀魂鬼 | K8: 金凤精 | L8: 罡风轻
A9: 问道 | B9: 闇黑 | C9: 万仞 | D9: 武斗 | E9: 遮那 | F9: 碎骨
A10: 狐绒 | B10: 儒风 | C10: 绣云 | D10: 龙凰 | E10: 通神 | F10: 鬼哭
A11: 焚城 | B11: 风雨 | C11: 黑鸦 | D11: 天厉 | E11: 神鹰 | F11: 丹心
A12: 擎雷 | B12: 花雨 | C12: 封焰 | D12: 天恋 | E12: 蓝布 | F12: 血鸦
A13: 炼心 | B13: 断空 | C13: 布锦 | D13: 逍遥 | E13: 紫云 | F13: 荡旋
A14: 开山 | B14: 浑天 | C14: 孤星 | D14: 惊天 | E14: 沥泉 | F14: 极意
A15: 方士 | B15: 风舞 | C15: 龙爪 | D15: 烟涛 | E15: 销魂 | F15: 迦蓝
A16: 北寒 | B16: 无双 | C16: 螺旋 | D16: 巫谢 | E16: 焚魂 | F16: 灵鹤