Sheet: ITEM
A1: TYPE | B1: id | C1: _ind | D1: _lev | E1: _cls | F1: oid | G1: iabi | H1: unam | I1: ides | J1: utip | K1: utub | L1: uhot | M1: iico | N1: isca | O1: ifil | P1: ubpx | Q1: ubpy | R1: issc | S1: iclr | T1: iclb | U1: iclg | V1: iarm | W1: ilvo | X1: ilev | Y1: icla | Z1: igol | AA1: ihtp | AB1: isst | AC1: istr | AD1: ilum | AE1: isto | AF1: ipri | AG1: icid | AH1: iicd | AI1: imor | AJ1: idrp | AK1: ipow | AL1: isel | AM1: ipaw | AN1: idro | AO1: iprn | AP1: iuse | AQ1: iper | AR1: iusa | AS1: ureq | AT1: urqa
A2: COMMENT | B2: 物品ID | C2: 类型 | D2: 等级 | E2: 品级 | F2: 物品模板ID | G2: 技能 - 技能 | H2: 文本 - 名字 | I2: 文本 - 说明 | J2: 文本 - 提示工具 - 基础 | K2: 文本 - 提示工具 - 扩展 | L2: 文本 - 热键 | M2: 显示 - 界面图标 | N2: 显示 - 模型缩放 | O2: 显示 - 使用模型 | P2: 显示 - 按钮位置(X) | Q2: 显示 - 按钮位置(Y) | R2: 显示 - 选择圈大小(编辑器) | S2: 显示 - 颜色值(红) | T2: 显示 - 颜色值(蓝) | U2: 显示 - 颜色值(绿) | V2: 战斗 - 装甲类型 | W2: 状态 - 等级(旧版) | X2: 状态 - 等级 | Y2: 状态 - 物品分类 | Z2: 状态 - 黄金消耗 | AA2: 状态 - 生命值 | AB2: 状态 - 购买开始时间 | AC2: 状态 - 购买时间间隔 | AD2: 状态 - 木材消耗 | AE2: 状态 - 最大库存量 | AF2: 状态 - 优先权 | AG2: 状态 - CD间隔组 | AH2: 状态 - 无视CD间隔 | AI2: 状态 - 有效的物品转换目标 | AJ2: 状态 - 持有者死亡时掉落 | AK2: 状态 - 捡取时自动使用 | AL2: 状态 - 可被市场出售 | AM2: 状态 - 可以被抵押 | AN2: 状态 - 可以丢弃 | AO2: 状态 - 可作为随机物品 | AP2: 状态 - 使用次数 | AQ2: 状态 - 使用完会消失 | AR2: 状态 - 主动使用 | AS2: 科技树 - 需求 | AT2: 科技树 - 需求值
A3: OBJECT | B3: ZB01 | D3: 1 | E3: 1 | F3: srbd | G3: null | H3: =Sheet1!R[-1]C[26] -> |cFF999999制式长剑 - Lv1|r | I3: =Sheet1!R[-1]C[26] -> |cFFFFFF99基础属性|r|n攻击:563|n|cFFFFFF55附加属性|r(%)|n攻速:10|n攻击吸血:50|n升级途径:|cFF1BE6B8找 装备升级NPC(练功房) 挑战升级|r | J3: =RC[-2] -> |cFF999999制式长剑 - Lv1|r | K3: =RC[-2] -> |cFFFFFF99基础属性|r|n攻击:563|n|cFFFFFF55附加属性|r(%)|n攻速:10|n攻击吸血:50|n升级途径:|cFF1BE6B8找 装备升级NPC(练功房) 挑战升级|r | M3: blp\baseItem\weapon\2_01.blp | X3: 1 | Y3: Permanent | Z3: 0 | AA3: 233 | AB3: 0 | AC3: 0 | AD3: 0 | AM3: 0 | AO3: 0
A4: OBJECT | B4: ZB02 | D4: 1 | E4: 1 | F4: srbd | G4: null | H4: =Sheet1!R[-1]C[26] -> |cFF999999制式长剑 - Lv2|r | I4: =Sheet1!R[-1]C[26] -> |cFFFFFF99基础属性|r|n攻击:1325|n|cFFFFFF55附加属性|r(%)|n攻速:10|n攻击吸血:50|n升级途径:|cFF1BE6B8找 装备升级NPC(练功房) 挑战升级|r | J4: =RC[-2] -> |cFF999999制式长剑 - Lv2|r | K4: =RC[-2] -> |cFFFFFF99基础属性|r|n攻击:1325|n|cFFFFFF55附加属性|r(%)|n攻速:10|n攻击吸血:50|n升级途径:|cFF1BE6B8找 装备升级NPC(练功房) 挑战升级|r | M4: blp\baseItem\weapon\2_02.blp | X4: 1 | Y4: Permanent | Z4: 0 | AA4: 233 | AB4: 0 | AC4: 0 | AD4: 0 | AM4: 0 | AO4: 0
A5: OBJECT | B5: ZB03 | D5: 1 | E5: 1 | F5: srbd | G5: null | H5: =Sheet1!R[-1]C[26] -> |cFF999999制式长剑 - Lv3|r | I5: =Sheet1!R[-1]C[26] -> |cFFFFFF99基础属性|r|n攻击:2335|n|cFFFFFF55附加属性|r(%)|n攻速:10|n攻击吸血:50|n升级途径:|cFF1BE6B8找 装备升级NPC(练功房) 挑战升级|r | J5: =RC[-2] -> |cFF999999制式长剑 - Lv3|r | K5: =RC[-2] -> |cFFFFFF99基础属性|r|n攻击:2335|n|cFFFFFF55附加属性|r(%)|n攻速:10|n攻击吸血:50|n升级途径:|cFF1BE6B8找 装备升级NPC(练功房) 挑战升级|r | M5: blp\baseItem\weapon\2_03.blp | X5: 1 | Y5: Permanent | Z5: 0 | AA5: 233 | AB5: 0 | AC5: 0 | AD5: 0 | AM5: 0 | AO5: 0
A6: OBJECT | B6: ZB04 | D6: 1 | E6: 1 | F6: srbd | G6: null | H6: =Sheet1!R[-1]C[26] -> |cFF999999制式长剑 - Lv4|r | I6: =Sheet1!R[-1]C[26] -> |cFFFFFF99基础属性|r|n攻击:3658|n|cFFFFFF55附加属性|r(%)|n攻速:10|n攻击吸血:50|n升级途径:|cFF1BE6B8找 装备升级NPC(练功房) 挑战升级|r | J6: =RC[-2] -> |cFF999999制式长剑 - Lv4|r | K6: =RC[-2] -> |cFFFFFF99基础属性|r|n攻击:3658|n|cFFFFFF55附加属性|r(%)|n攻速:10|n攻击吸血:50|n升级途径:|cFF1BE6B8找 装备升级NPC(练功房) 挑战升级|r | M6: blp\baseItem\weapon\2_04.blp | X6: 1 | Y6: Permanent | Z6: 0 | AA6: 233 | AB6: 0 | AC6: 0 | AD6: 0 | AM6: 0 | AO6: 0
A7: OBJECT | B7: ZB05 | D7: 1 | E7: 1 | F7: srbd | G7: null | H7: =Sheet1!R[-1]C[26] -> |cFF999999制式长剑 - Lv5|r | I7: =Sheet1!R[-1]C[26] -> |cFFFFFF99基础属性|r|n攻击:5372|n|cFFFFFF55附加属性|r(%)|n攻速:10|n攻击吸血:50|n升级途径:|cFF1BE6B8击杀20只 盗贼(阿拉希盆地1) |r 升级 | J7: =RC[-2] -> |cFF999999制式长剑 - Lv5|r | K7: =RC[-2] -> |cFFFFFF99基础属性|r|n攻击:5372|n|cFFFFFF55附加属性|r(%)|n攻速:10|n攻击吸血:50|n升级途径:|cFF1BE6B8击杀20只 盗贼(阿拉希盆地1) |r 升级 | M7: blp\baseItem\weapon\2_05.blp | X7: 1 | Y7: Permanent | Z7: 0 | AA7: 233 | AB7: 0 | AC7: 0 | AD7: 0 | AM7: 0 | AO7: 0
A8: OBJECT | B8: ZB06 | D8: 1 | E8: 1 | F8: srbd | G8: null | H8: =Sheet1!R[-1]C[26] -> |CFFFFFFFF断水长剑 - Lv1|r | I8: =Sheet1!R[-1]C[26] -> |cFFFFFF99基础属性|r|n攻击:13942|n|cFFFFFF55附加属性|r(%)|n攻速:20|n攻击吸血:45|n升级途径:|cFF1BE6B8击杀20只 鱼人(阿拉希盆地2) |r 升级 | J8: =RC[-2] -> |CFFFFFFFF断水长剑 - Lv1|r | K8: =RC[-2] -> |cFFFFFF99基础属性|r|n攻击:13942|n|cFFFFFF55附加属性|r(%)|n攻速:20|n攻击吸血:45|n升级途径:|cFF1BE6B8击杀20只 鱼人(阿拉希盆地2) |r 升级 | M8: blp\baseItem\weapon\2_11.blp | X8: 1 | Y8: Permanent | Z8: 0 | AA8: 233 | AB8: 0 | AC8: 0 | AD8: 0 | AM8: 0 | AO8: 0
A9: OBJECT | B9: ZB07 | D9: 1 | E9: 1 | F9: srbd | G9: null | H9: =Sheet1!R[-1]C[26] -> |CFFFFFFFF断水长剑 - Lv2|r | I9: =Sheet1!R[-1]C[26] -> |cFFFFFF99基础属性|r|n攻击:18428|n|cFFFFFF55附加属性|r(%)|n攻速:20|n攻击吸血:45|n升级途径:|cFF1BE6B8击杀20只 森林狼(阿拉希盆地3) |r 升级 | J9: =RC[-2] -> |CFFFFFFFF断水长剑 - Lv2|r | K9: =RC[-2] -> |cFFFFFF99基础属性|r|n攻击:18428|n|cFFFFFF55附加属性|r(%)|n攻速:20|n攻击吸血:45|n升级途径:|cFF1BE6B8击杀20只 森林狼(阿拉希盆地3) |r 升级 | M9: blp\baseItem\weapon\2_11.blp | X9: 1 | Y9: Permanent | Z9: 0 | AA9: 233 | AB9: 0 | AC9: 0 | AD9: 0 | AM9: 0 | AO9: 0
A10: OBJECT | B10: ZB08 | D10: 1 | E10: 1 | F10: srbd | G10: null | H10: =Sheet1!R[-1]C[26] -> |CFFFFFFFF断水长剑 - Lv3|r | I10: =Sheet1!R[-1]C[26] -> |cFFFFFF99基础属性|r|n攻击:24056|n|cFFFFFF55附加属性|r(%)|n攻速:20|n攻击吸血:45|n升级途径:|cFF1BE6B8击杀20只 豪猪(阿拉希盆地4) |r 升级 | J10: =RC[-2] -> |CFFFFFFFF断水长剑 - Lv3|r | K10: =RC[-2] -> |cFFFFFF99基础属性|r|n攻击:24056|n|cFFFFFF55附加属性|r(%)|n攻速:20|n攻击吸血:45|n升级途径:|cFF1BE6B8击杀20只 豪猪(阿拉希盆地4) |r 升级 | M10: blp\baseItem\weapon\2_11.blp | X10: 1 | Y10: Permanent | Z10: 0 | AA10: 233 | AB10: 0 | AC10: 0 | AD10: 0 | AM10: 0 | AO10: 0
A11: OBJECT | B11: ZB09 | D11: 1 | E11: 1 | F11: srbd | G11: null | H11: =Sheet1!R[-1]C[26] -> |CFFFFFFFF断水长剑 - Lv4|r | I11: =Sheet1!R[-1]C[26] -> |cFFFFFF99基础属性|r|n攻击:31090|n|cFFFFFF55附加属性|r(%)|n攻速:20|n攻击吸血:45|n升级途径:|cFF1BE6B8击杀20只 达拉内尔信徒(死亡矿井1) |r 升级 | J11: =RC[-2] -> |CFFFFFFFF断水长剑 - Lv4|r | K11: =RC[-2] -> |cFFFFFF99基础属性|r|n攻击:31090|n|cFFFFFF55附加属性|r(%)|n攻速:20|n攻击吸血:45|n升级途径:|cFF1BE6B8击杀20只 达拉内尔信徒(死亡矿井1) |r 升级 | M11: blp\baseItem\weapon\2_11.blp | X11: 1 | Y11: Permanent | Z11: 0 | AA11: 233 | AB11: 0 | AC11: 0 | AD11: 0 | AM11: 0 | AO11: 0
A12: OBJECT | B12: ZB0A | D12: 1 | E12: 1 | F12: srbd | G12: null | H12: =Sheet1!R[-1]C[26] -> |CFFB6D7A8玄铁长剑 - Lv1|r | I12: =Sheet1!R[-1]C[26] -> |cFFFFFF99基础属性|r|n攻击:64175|n|cFFFFFF55附加属性|r(%)|n攻速:30|n攻击吸血:40|n升级途径:|cFF1BE6B8击杀20只 食人魔(死亡矿井2) |r 升级 | J12: =RC[-2] -> |CFFB6D7A8玄铁长剑 - Lv1|r | K12: =RC[-2] -> |cFFFFFF99基础属性|r|n攻击:64175|n|cFFFFFF55附加属性|r(%)|n攻速:30|n攻击吸血:40|n升级途径:|cFF1BE6B8击杀20只 食人魔(死亡矿井2) |r 升级 | M12: blp\baseItem\weapon\2_12.blp | X12: 1 | Y12: Permanent | Z12: 0 | AA12: 233 | AB12: 0 | AC12: 0 | AD12: 0 | AM12: 0 | AO12: 0
A13: OBJECT | B13: ZB0B | D13: 1 | E13: 1 | F13: srbd | G13: null | H13: =Sheet1!R[-1]C[26] -> |CFFB6D7A8玄铁长剑 - Lv2|r | I13: =Sheet1!R[-1]C[26] -> |cFFFFFF99基础属性|r|n攻击:80785|n|cFFFFFF55附加属性|r(%)|n攻速:30|n攻击吸血:40|n升级途径:|cFF1BE6B8击杀20只 狗头人(死亡矿井3) |r 升级 | J13: =RC[-2] -> |CFFB6D7A8玄铁长剑 - Lv2|r | K13: =RC[-2] -> |cFFFFFF99基础属性|r|n攻击:80785|n|cFFFFFF55附加属性|r(%)|n攻速:30|n攻击吸血:40|n升级途径:|cFF1BE6B8击杀20只 狗头人(死亡矿井3) |r 升级 | M13: blp\baseItem\weapon\2_12.blp | X13: 1 | Y13: Permanent | Z13: 0 | AA13: 233 | AB13: 0 | AC13: 0 | AD13: 0 | AM13: 0 | AO13: 0
A14: OBJECT | B14: ZB0C | D14: 1 | E14: 1 | F14: srbd | G14: null | H14: =Sheet1!R[-1]C[26] -> |CFFB6D7A8玄铁长剑 - Lv3|r | I14: =Sheet1!R[-1]C[26] -> |cFFFFFF99基础属性|r|n攻击:101242|n|cFFFFFF55附加属性|r(%)|n攻速:30|n攻击吸血:40|n升级途径:|cFF1BE6B8击杀20只 矿井蝎子(死亡矿井4) |r 升级 | J14: =RC[-2] -> |CFFB6D7A8玄铁长剑 - Lv3|r | K14: =RC[-2] -> |cFFFFFF99基础属性|r|n攻击:101242|n|cFFFFFF55附加属性|r(%)|n攻速:30|n攻击吸血:40|n升级途径:|cFF1BE6B8击杀20只 矿井蝎子(死亡矿井4) |r 升级 | M14: blp\baseItem\weapon\2_12.blp | X14: 1 | Y14: Permanent | Z14: 0 | AA14: 233 | AB14: 0 | AC14: 0 | AD14: 0 | AM14: 0 | AO14: 0
A15: OBJECT | B15: ZB0D | D15: 1 | E15: 1 | F15: srbd | G15: null | H15: =Sheet1!R[-1]C[26] -> |CFFB6D7A8玄铁长剑 - Lv4|r | I15: =Sheet1!R[-1]C[26] -> |cFFFFFF99基础属性|r|n攻击:126383|n|cFFFFFF55附加属性|r(%)|n攻速:30|n攻击吸血:40|n升级途径:|cFF1BE6B8击杀20只 熔岩怪物(熔火之心1) |r 升级 | J15: =RC[-2] -> |CFFB6D7A8玄铁长剑 - Lv4|r | K15: =RC[-2] -> |cFFFFFF99基础属性|r|n攻击:126383|n|cFFFFFF55附加属性|r(%)|n攻速:30|n攻击吸血:40|n升级途径:|cFF1BE6B8击杀20只 熔岩怪物(熔火之心1) |r 升级 | M15: blp\baseItem\weapon\2_12.blp | X15: 1 | Y15: Permanent | Z15: 0 | AA15: 233 | AB15: 0 | AC15: 0 | AD15: 0 | AM15: 0 | AO15: 0
A16: OBJECT | B16: ZB0E | D16: 1 | E16: 1 | F16: srbd | G16: null | H16: =Sheet1!R[-1]C[26] -> |cFF99FF66烈焰长剑 - Lv1|r | I16: =Sheet1!R[-1]C[26] -> |cFFFFFF99基础属性|r|n攻击:241141|n|cFFFFFF55附加属性|r(%)|n攻速:40|n攻击吸血:35|n升级途径:|cFF1BE6B8击杀20只 火焰蜥蜴(熔火之心2) |r 升级 | J16: =RC[-2] -> |cFF99FF66烈焰长剑 - Lv1|r | K16: =RC[-2] -> |cFFFFFF99基础属性|r|n攻击:241141|n|cFFFFFF55附加属性|r(%)|n攻速:40|n攻击吸血:35|n升级途径:|cFF1BE6B8击杀20只 火焰蜥蜴(熔火之心2) |r 升级 | M16: blp\baseItem\weapon\2_13.blp | X16: 1 | Y16: Permanent | Z16: 0 | AA16: 233 | AB16: 0 | AC16: 0 | AD16: 0 | AM16: 0 | AO16: 0
A17: OBJECT | B17: ZB0F | D17: 1 | E17: 1 | F17: srbd | G17: null | H17: =Sheet1!R[-1]C[26] -> |cFF99FF66烈焰长剑 - Lv2|r | I17: =Sheet1!R[-1]C[26] -> |cFFFFFF99基础属性|r|n攻击:297481|n|cFFFFFF55附加属性|r(%)|n攻速:40|n攻击吸血:35|n升级途径:|cFF1BE6B8击杀20只 烈焰龙龟(熔火之心3) |r 升级 | J17: =RC[-2] -> |cFF99FF66烈焰长剑 - Lv2|r | K17: =RC[-2] -> |cFFFFFF99基础属性|r|n攻击:297481|n|cFFFFFF55附加属性|r(%)|n攻速:40|n攻击吸血:35|n升级途径:|cFF1BE6B8击杀20只 烈焰龙龟(熔火之心3) |r 升级 | M17: blp\baseItem\weapon\2_13.blp | X17: 1 | Y17: Permanent | Z17: 0 | AA17: 233 | AB17: 0 | AC17: 0 | AD17: 0 | AM17: 0 | AO17: 0
A18: OBJECT | B18: ZB0G | D18: 1 | E18: 1 | F18: srbd | G18: null | H18: =Sheet1!R[-1]C[26] -> |cFF99FF66烈焰长剑 - Lv3|r | I18: =Sheet1!R[-1]C[26] -> |cFFFFFF99基础属性|r|n攻击:366154|n|cFFFFFF55附加属性|r(%)|n攻速:40|n攻击吸血:35|n升级途径:|cFF1BE6B8击杀20只 幼龙(熔火之心4) |r 升级 | J18: =RC[-2] -> |cFF99FF66烈焰长剑 - Lv3|r | K18: =RC[-2] -> |cFFFFFF99基础属性|r|n攻击:366154|n|cFFFFFF55附加属性|r(%)|n攻速:40|n攻击吸血:35|n升级途径:|cFF1BE6B8击杀20只 幼龙(熔火之心4) |r 升级 | M18: blp\baseItem\weapon\2_13.blp | X18: 1 | Y18: Permanent | Z18: 0 | AA18: 233 | AB18: 0 | AC18: 0 | AD18: 0 | AM18: 0 | AO18: 0
A19: OBJECT | B19: ZB0H | D19: 1 | E19: 1 | F19: srbd | G19: null | H19: =Sheet1!R[-1]C[26] -> |cFF99FF66烈焰长剑 - Lv4|r | I19: =Sheet1!R[-1]C[26] -> |cFFFFFF99基础属性|r|n攻击:449747|n|cFFFFFF55附加属性|r(%)|n攻速:40|n攻击吸血:35|n升级途径:|cFF1BE6B8击杀20只 冰霜巨魔(祖阿曼岛1) |r 升级 | J19: =RC[-2] -> |cFF99FF66烈焰长剑 - Lv4|r | K19: =RC[-2] -> |cFFFFFF99基础属性|r|n攻击:449747|n|cFFFFFF55附加属性|r(%)|n攻速:40|n攻击吸血:35|n升级途径:|cFF1BE6B8击杀20只 冰霜巨魔(祖阿曼岛1) |r 升级 | M19: blp\baseItem\weapon\2_13.blp | X19: 1 | Y19: Permanent | Z19: 0 | AA19: 233 | AB19: 0 | AC19: 0 | AD19: 0 | AM19: 0 | AO19: 0
A20: OBJECT | B20: ZB0I | D20: 1 | E20: 1 | F20: srbd | G20: null | H20: =Sheet1!R[-1]C[26] -> |cFF99FF66龙吟长剑 - Lv1|r | I20: =Sheet1!R[-1]C[26] -> |cFFFFFF99基础属性|r|n攻击:824545|n|cFFFFFF55附加属性|r(%)|n攻速:50|n攻击吸血:30|n升级途径:|cFF1BE6B8击杀20只 丛林巨魔(祖阿曼岛2) |r 升级 | J20: =RC[-2] -> |cFF99FF66龙吟长剑 - Lv1|r | K20: =RC[-2] -> |cFFFFFF99基础属性|r|n攻击:824545|n|cFFFFFF55附加属性|r(%)|n攻速:50|n攻击吸血:30|n升级途径:|cFF1BE6B8击杀20只 丛林巨魔(祖阿曼岛2) |r 升级 | M20: blp\baseItem\weapon\2_14.blp | X20: 1 | Y20: Permanent | Z20: 0 | AA20: 233 | AB20: 0 | AC20: 0 | AD20: 0 | AM20: 0 | AO20: 0
A21: OBJECT | B21: ZB0J | D21: 1 | E21: 1 | F21: srbd | G21: null | H21: =Sheet1!R[-1]C[26] -> |cFF99FF66龙吟长剑 - Lv2|r | I21: =Sheet1!R[-1]C[26] -> |cFFFFFF99基础属性|r|n攻击:1006016|n|cFFFFFF55附加属性|r(%)|n攻速:50|n攻击吸血:30|n升级途径:|cFF1BE6B8击杀20只 娜迦护卫(祖阿曼岛3) |r 升级 | J21: =RC[-2] -> |cFF99FF66龙吟长剑 - Lv2|r | K21: =RC[-2] -> |cFFFFFF99基础属性|r|n攻击:1006016|n|cFFFFFF55附加属性|r(%)|n攻速:50|n攻击吸血:30|n升级途径:|cFF1BE6B8击杀20只 娜迦护卫(祖阿曼岛3) |r 升级 | M21: blp\baseItem\weapon\2_14.blp | X21: 1 | Y21: Permanent | Z21: 0 | AA21: 233 | AB21: 0 | AC21: 0 | AD21: 0 | AM21: 0 | AO21: 0
A22: OBJECT | B22: ZB0K | D22: 1 | E22: 1 | F22: srbd | G22: null | H22: =Sheet1!R[-1]C[26] -> |cFF99FF66龙吟长剑 - Lv3|r | I22: =Sheet1!R[-1]C[26] -> |cFFFFFF99基础属性|r|n攻击:1225742|n|cFFFFFF55附加属性|r(%)|n攻速:50|n攻击吸血:30|n升级途径:|cFF1BE6B8击杀20只 黑暗巨魔(祖阿曼岛4) |r 升级 | J22: =RC[-2] -> |cFF99FF66龙吟长剑 - Lv3|r | K22: =RC[-2] -> |cFFFFFF99基础属性|r|n攻击:1225742|n|cFFFFFF55附加属性|r(%)|n攻速:50|n攻击吸血:30|n升级途径:|cFF1BE6B8击杀20只 黑暗巨魔(祖阿曼岛4) |r 升级 | M22: blp\baseItem\weapon\2_14.blp | X22: 1 | Y22: Permanent | Z22: 0 | AA22: 233 | AB22: 0 | AC22: 0 | AD22: 0 | AM22: 0 | AO22: 0
A23: OBJECT | B23: ZB0L | D23: 1 | E23: 1 | F23: srbd | G23: null | H23: =Sheet1!R[-1]C[26] -> |cFF99FF66龙吟长剑 - Lv4|r | I23: =Sheet1!R[-1]C[26] -> |cFFFFFF99基础属性|r|n攻击:1491554|n|cFFFFFF55附加属性|r(%)|n攻速:50|n攻击吸血:30|n升级途径:|cFF1BE6B8击杀20只 火元素(达拉然奥术秘境1) |r 升级 | J23: =RC[-2] -> |cFF99FF66龙吟长剑 - Lv4|r | K23: =RC[-2] -> |cFFFFFF99基础属性|r|n攻击:1491554|n|cFFFFFF55附加属性|r(%)|n攻速:50|n攻击吸血:30|n升级途径:|cFF1BE6B8击杀20只 火元素(达拉然奥术秘境1) |r 升级 | M23: blp\baseItem\weapon\2_14.blp | X23: 1 | Y23: Permanent | Z23: 0 | AA23: 233 | AB23: 0 | AC23: 0 | AD23: 0 | AM23: 0 | AO23: 0
A24: OBJECT | B24: ZB0M | D24: 1 | E24: 1 | F24: srbd | G24: null | H24: =Sheet1!R[-1]C[26] -> |cFF99FF66神使长剑 - Lv1|r | I24: =Sheet1!R[-1]C[26] -> |cFFFFFF99基础属性|r|n攻击:2669262|n|cFFFFFF55附加属性|r(%)|n攻速:60|n攻击吸血:25|n升级途径:|cFF1BE6B8击杀20只 风元素(达拉然奥术秘境2) |r 升级 | J24: =RC[-2] -> |cFF99FF66神使长剑 - Lv1|r | K24: =RC[-2] -> |cFFFFFF99基础属性|r|n攻击:2669262|n|cFFFFFF55附加属性|r(%)|n攻速:60|n攻击吸血:25|n升级途径:|cFF1BE6B8击杀20只 风元素(达拉然奥术秘境2) |r 升级 | M24: blp\baseItem\weapon\2_15.blp | X24: 1 | Y24: Permanent | Z24: 0 | AA24: 233 | AB24: 0 | AC24: 0 | AD24: 0 | AM24: 0 | AO24: 0
A25: OBJECT | B25: ZB0N | D25: 1 | E25: 1 | F25: srbd | G25: null | H25: =Sheet1!R[-1]C[26] -> |cFF99FF66神使长剑 - Lv2|r | I25: =Sheet1!R[-1]C[26] -> |cFFFFFF99基础属性|r|n攻击:3234112|n|cFFFFFF55附加属性|r(%)|n攻速:60|n攻击吸血:25|n升级途径:|cFF1BE6B8击杀20只 水元素(达拉然奥术秘境3) |r 升级 | J25: =RC[-2] -> |cFF99FF66神使长剑 - Lv2|r | K25: =RC[-2] -> |cFFFFFF99基础属性|r|n攻击:3234112|n|cFFFFFF55附加属性|r(%)|n攻速:60|n攻击吸血:25|n升级途径:|cFF1BE6B8击杀20只 水元素(达拉然奥术秘境3) |r 升级 | M25: blp\baseItem\weapon\2_15.blp | X25: 1 | Y25: Permanent | Z25: 0 | AA25: 233 | AB25: 0 | AC25: 0 | AD25: 0 | AM25: 0 | AO25: 0
A26: OBJECT | B26: ZB0O | D26: 1 | E26: 1 | F26: srbd | G26: null | H26: =Sheet1!R[-1]C[26] -> |cFF99FF66神使长剑 - Lv3|r | I26: =Sheet1!R[-1]C[26] -> |cFFFFFF99基础属性|r|n攻击:3914895|n|cFFFFFF55附加属性|r(%)|n攻速:60|n攻击吸血:25|n升级途径:|cFF1BE6B8击杀20只 土元素(达拉然奥术秘境4) |r 升级 | J26: =RC[-2] -> |cFF99FF66神使长剑 - Lv3|r | K26: =RC[-2] -> |cFFFFFF99基础属性|r|n攻击:3914895|n|cFFFFFF55附加属性|r(%)|n攻速:60|n攻击吸血:25|n升级途径:|cFF1BE6B8击杀20只 土元素(达拉然奥术秘境4) |r 升级 | M26: blp\baseItem\weapon\2_15.blp | X26: 1 | Y26: Permanent | Z26: 0 | AA26: 233 | AB26: 0 | AC26: 0 | AD26: 0 | AM26: 0 | AO26: 0
A27: OBJECT | B27: ZB0P | D27: 1 | E27: 1 | F27: srbd | G27: null | H27: =Sheet1!R[-1]C[26] -> |cFF99FF66神使长剑 - Lv4|r | I27: =Sheet1!R[-1]C[26] -> |cFFFFFF99基础属性|r|n攻击:4734883|n|cFFFFFF55附加属性|r(%)|n攻速:60|n攻击吸血:25|n升级途径:|cFF1BE6B8找 圣魂信仰NPC(后山)|r 合成升级 | J27: =RC[-2] -> |cFF99FF66神使长剑 - Lv4|r | K27: =RC[-2] -> |cFFFFFF99基础属性|r|n攻击:4734883|n|cFFFFFF55附加属性|r(%)|n攻速:60|n攻击吸血:25|n升级途径:|cFF1BE6B8找 圣魂信仰NPC(后山)|r 合成升级 | M27: blp\baseItem\weapon\2_15.blp | X27: 1 | Y27: Permanent | Z27: 0 | AA27: 233 | AB27: 0 | AC27: 0 | AD27: 0 | AM27: 0 | AO27: 0
A28: OBJECT | B28: ZB11 | D28: 1 | E28: 2 | F28: srbd | G28: null | H28: =Sheet1!R[-1]C[26] -> |cFF999999制式护甲 - Lv1|r | I28: =Sheet1!R[-1]C[26] -> |cFFFFFF99基础属性|r|n力量:140|n敏捷:140|n智力:140|n血量:1174|n护甲:10447|n升级途径:|cFF1BE6B8找 装备升级NPC(练功房) 挑战升级|r | J28: =RC[-2] -> |cFF999999制式护甲 - Lv1|r | K28: =RC[-2] -> |cFFFFFF99基础属性|r|n力量:140|n敏捷:140|n智力:140|n血量:1174|n护甲:10447|n升级途径:|cFF1BE6B8找 装备升级NPC(练功房) 挑战升级|r | M28: blp\baseItem\equipment\1_01.blp | X28: 1 | Y28: Permanent | Z28: 0 | AA28: 233 | AB28: 0 | AC28: 0 | AD28: 0 | AM28: 0 | AO28: 0
A29: OBJECT | B29: ZB12 | D29: 1 | E29: 2 | F29: srbd | G29: null | H29: =Sheet1!R[-1]C[26] -> |cFF999999制式护甲 - Lv2|r | I29: =Sheet1!R[-1]C[26] -> |cFFFFFF99基础属性|r|n力量:331|n敏捷:331|n智力:331|n血量:2760|n护甲:10914|n升级途径:|cFF1BE6B8找 装备升级NPC(练功房) 挑战升级|r | J29: =RC[-2] -> |cFF999999制式护甲 - Lv2|r | K29: =RC[-2] -> |cFFFFFF99基础属性|r|n力量:331|n敏捷:331|n智力:331|n血量:2760|n护甲:10914|n升级途径:|cFF1BE6B8找 装备升级NPC(练功房) 挑战升级|r | M29: blp\baseItem\equipment\1_02.blp | X29: 1 | Y29: Permanent | Z29: 0 | AA29: 233 | AB29: 0 | AC29: 0 | AD29: 0 | AM29: 0 | AO29: 0
A30: OBJECT | B30: ZB13 | D30: 1 | E30: 2 | F30: srbd | G30: null | H30: =Sheet1!R[-1]C[26] -> |cFF999999制式护甲 - Lv3|r | I30: =Sheet1!R[-1]C[26] -> |cFFFFFF99基础属性|r|n力量:583|n敏捷:583|n智力:583|n血量:4865|n护甲:11402|n升级途径:|cFF1BE6B8找 装备升级NPC(练功房) 挑战升级|r | J30: =RC[-2] -> |cFF999999制式护甲 - Lv3|r | K30: =RC[-2] -> |cFFFFFF99基础属性|r|n力量:583|n敏捷:583|n智力:583|n血量:4865|n护甲:11402|n升级途径:|cFF1BE6B8找 装备升级NPC(练功房) 挑战升级|r | M30: blp\baseItem\equipment\1_03.blp | X30: 1 | Y30: Permanent | Z30: 0 | AA30: 233 | AB30: 0 | AC30: 0 | AD30: 0 | AM30: 0 | AO30: 0
A31: OBJECT | B31: ZB14 | D31: 1 | E31: 2 | F31: srbd | G31: null | H31: =Sheet1!R[-1]C[26] -> |cFF999999制式护甲 - Lv4|r | I31: =Sheet1!R[-1]C[26] -> |cFFFFFF99基础属性|r|n力量:914|n敏捷:914|n智力:914|n血量:7621|n护甲:11912|n升级途径:|cFF1BE6B8找 装备升级NPC(练功房) 挑战升级|r | J31: =RC[-2] -> |cFF999999制式护甲 - Lv4|r | K31: =RC[-2] -> |cFFFFFF99基础属性|r|n力量:914|n敏捷:914|n智力:914|n血量:7621|n护甲:11912|n升级途径:|cFF1BE6B8找 装备升级NPC(练功房) 挑战升级|r | M31: blp\baseItem\equipment\1_04.blp | X31: 1 | Y31: Permanent | Z31: 0 | AA31: 233 | AB31: 0 | AC31: 0 | AD31: 0 | AM31: 0 | AO31: 0
A32: OBJECT | B32: ZB15 | D32: 1 | E32: 2 | F32: srbd | G32: null | H32: =Sheet1!R[-1]C[26] -> |cFF999999制式护甲 - Lv5|r | I32: =Sheet1!R[-1]C[26] -> |cFFFFFF99基础属性|r|n力量:1343|n敏捷:1343|n智力:1343|n血量:11193|n护甲:12445|n升级途径:|cFF1BE6B8击杀 盗贼王(阿拉希盆地1) |r 升级 | J32: =RC[-2] -> |cFF999999制式护甲 - Lv5|r | K32: =RC[-2] -> |cFFFFFF99基础属性|r|n力量:1343|n敏捷:1343|n智力:1343|n血量:11193|n护甲:12445|n升级途径:|cFF1BE6B8击杀 盗贼王(阿拉希盆地1) |r 升级 | M32: blp\baseItem\equipment\1_05.blp | X32: 1 | Y32: Permanent | Z32: 0 | AA32: 233 | AB32: 0 | AC32: 0 | AD32: 0 | AM32: 0 | AO32: 0
A33: OBJECT | B33: ZB16 | D33: 1 | E33: 2 | F33: srbd | G33: null | H33: =Sheet1!R[-1]C[26] -> |CFFFFFFFF断水护甲 - Lv1|r | I33: =Sheet1!R[-1]C[26] -> |cFFFFFF99基础属性|r|n力量:3485|n敏捷:3485|n智力:3485|n血量:29046|n护甲:14190|n升级途径:|cFF1BE6B8击杀 鱼人首领(阿拉希盆地2) |r 升级 | J33: =RC[-2] -> |CFFFFFFFF断水护甲 - Lv1|r | K33: =RC[-2] -> |cFFFFFF99基础属性|r|n力量:3485|n敏捷:3485|n智力:3485|n血量:29046|n护甲:14190|n升级途径:|cFF1BE6B8击杀 鱼人首领(阿拉希盆地2) |r 升级 | M33: blp\baseItem\equipment\1_11.blp | X33: 1 | Y33: Permanent | Z33: 0 | AA33: 233 | AB33: 0 | AC33: 0 | AD33: 0 | AM33: 0 | AO33: 0
A34: OBJECT | B34: ZB17 | D34: 1 | E34: 2 | F34: srbd | G34: null | H34: =Sheet1!R[-1]C[26] -> |CFFFFFFFF断水护甲 - Lv2|r | I34: =Sheet1!R[-1]C[26] -> |cFFFFFF99基础属性|r|n力量:4607|n敏捷:4607|n智力:4607|n血量:38392|n护甲:14825|n升级途径:|cFF1BE6B8击杀 森林狼王(阿拉希盆地3) |r 升级 | J34: =RC[-2] -> |CFFFFFFFF断水护甲 - Lv2|r | K34: =RC[-2] -> |cFFFFFF99基础属性|r|n力量:4607|n敏捷:4607|n智力:4607|n血量:38392|n护甲:14825|n升级途径:|cFF1BE6B8击杀 森林狼王(阿拉希盆地3) |r 升级 | M34: blp\baseItem\equipment\1_11.blp | X34: 1 | Y34: Permanent | Z34: 0 | AA34: 233 | AB34: 0 | AC34: 0 | AD34: 0 | AM34: 0 | AO34: 0
A35: OBJECT | B35: ZB18 | D35: 1 | E35: 2 | F35: srbd | G35: null | H35: =Sheet1!R[-1]C[26] -> |CFFFFFFFF断水护甲 - Lv3|r | I35: =Sheet1!R[-1]C[26] -> |cFFFFFF99基础属性|r|n力量:6014|n敏捷:6014|n智力:6014|n血量:50118|n护甲:15488|n升级途径:|cFF1BE6B8击杀 豪猪王(阿拉希盆地4) |r 升级 | J35: =RC[-2] -> |CFFFFFFFF断水护甲 - Lv3|r | K35: =RC[-2] -> |cFFFFFF99基础属性|r|n力量:6014|n敏捷:6014|n智力:6014|n血量:50118|n护甲:15488|n升级途径:|cFF1BE6B8击杀 豪猪王(阿拉希盆地4) |r 升级 | M35: blp\baseItem\equipment\1_11.blp | X35: 1 | Y35: Permanent | Z35: 0 | AA35: 233 | AB35: 0 | AC35: 0 | AD35: 0 | AM35: 0 | AO35: 0
A36: OBJECT | B36: ZB19 | D36: 1 | E36: 2 | F36: srbd | G36: null | H36: =Sheet1!R[-1]C[26] -> |CFFFFFFFF断水护甲 - Lv4|r | I36: =Sheet1!R[-1]C[26] -> |cFFFFFF99基础属性|r|n力量:7772|n敏捷:7772|n智力:7772|n血量:64772|n护甲:16180|n升级途径:|cFF1BE6B8击杀 达拉内尔主教(死亡矿井1) |r 升级 | J36: =RC[-2] -> |CFFFFFFFF断水护甲 - Lv4|r | K36: =RC[-2] -> |cFFFFFF99基础属性|r|n力量:7772|n敏捷:7772|n智力:7772|n血量:64772|n护甲:16180|n升级途径:|cFF1BE6B8击杀 达拉内尔主教(死亡矿井1) |r 升级 | M36: blp\baseItem\equipment\1_11.blp | X36: 1 | Y36: Permanent | Z36: 0 | AA36: 233 | AB36: 0 | AC36: 0 | AD36: 0 | AM36: 0 | AO36: 0
A37: OBJECT | B37: ZB1A | D37: 1 | E37: 2 | F37: srbd | G37: null | H37: =Sheet1!R[-1]C[26] -> |CFFB6D7A8玄铁护甲 - Lv1|r | I37: =Sheet1!R[-1]C[26] -> |cFFFFFF99基础属性|r|n力量:16043|n敏捷:16043|n智力:16043|n血量:133698|n护甲:18450|n升级途径:|cFF1BE6B8击杀 食人魔酋长(死亡矿井2) |r 升级 | J37: =RC[-2] -> |CFFB6D7A8玄铁护甲 - Lv1|r | K37: =RC[-2] -> |cFFFFFF99基础属性|r|n力量:16043|n敏捷:16043|n智力:16043|n血量:133698|n护甲:18450|n升级途径:|cFF1BE6B8击杀 食人魔酋长(死亡矿井2) |r 升级 | M37: blp\baseItem\equipment\1_12.blp | X37: 1 | Y37: Permanent | Z37: 0 | AA37: 233 | AB37: 0 | AC37: 0 | AD37: 0 | AM37: 0 | AO37: 0
A38: OBJECT | B38: ZB1B | D38: 1 | E38: 2 | F38: srbd | G38: null | H38: =Sheet1!R[-1]C[26] -> |CFFB6D7A8玄铁护甲 - Lv2|r | I38: =Sheet1!R[-1]C[26] -> |cFFFFFF99基础属性|r|n力量:20196|n敏捷:20196|n智力:20196|n血量:168302|n护甲:19275|n升级途径:|cFF1BE6B8击杀 狗头人酋长(死亡矿井3) |r 升级 | J38: =RC[-2] -> |CFFB6D7A8玄铁护甲 - Lv2|r | K38: =RC[-2] -> |cFFFFFF99基础属性|r|n力量:20196|n敏捷:20196|n智力:20196|n血量:168302|n护甲:19275|n升级途径:|cFF1BE6B8击杀 狗头人酋长(死亡矿井3) |r 升级 | M38: blp\baseItem\equipment\1_12.blp | X38: 1 | Y38: Permanent | Z38: 0 | AA38: 233 | AB38: 0 | AC38: 0 | AD38: 0 | AM38: 0 | AO38: 0
A39: OBJECT | B39: ZB1C | D39: 1 | E39: 2 | F39: srbd | G39: null | H39: =Sheet1!R[-1]C[26] -> |CFFB6D7A8玄铁护甲 - Lv3|r | I39: =Sheet1!R[-1]C[26] -> |cFFFFFF99基础属性|r|n力量:25310|n敏捷:25310|n智力:25310|n血量:210921|n护甲:20137|n升级途径:|cFF1BE6B8击杀 矿井魔蝎(死亡矿井4) |r 升级 | J39: =RC[-2] -> |CFFB6D7A8玄铁护甲 - Lv3|r | K39: =RC[-2] -> |cFFFFFF99基础属性|r|n力量:25310|n敏捷:25310|n智力:25310|n血量:210921|n护甲:20137|n升级途径:|cFF1BE6B8击杀 矿井魔蝎(死亡矿井4) |r 升级 | M39: blp\baseItem\equipment\1_12.blp | X39: 1 | Y39: Permanent | Z39: 0 | AA39: 233 | AB39: 0 | AC39: 0 | AD39: 0 | AM39: 0 | AO39: 0
A40: OBJECT | B40: ZB1D | D40: 1 | E40: 2 | F40: srbd | G40: null | H40: =Sheet1!R[-1]C[26] -> |CFFB6D7A8玄铁护甲 - Lv4|r | I40: =Sheet1!R[-1]C[26] -> |cFFFFFF99基础属性|r|n力量:31595|n敏捷:31595|n智力:31595|n血量:263298|n护甲:21037|n升级途径:|cFF1BE6B8击杀 炎魔(熔火之心1) |r 升级 | J40: =RC[-2] -> |CFFB6D7A8玄铁护甲 - Lv4|r | K40: =RC[-2] -> |cFFFFFF99基础属性|r|n力量:31595|n敏捷:31595|n智力:31595|n血量:263298|n护甲:21037|n升级途径:|cFF1BE6B8击杀 炎魔(熔火之心1) |r 升级 | M40: blp\baseItem\equipment\1_12.blp | X40: 1 | Y40: Permanent | Z40: 0 | AA40: 233 | AB40: 0 | AC40: 0 | AD40: 0 | AM40: 0 | AO40: 0
A41: OBJECT | B41: ZB1E | D41: 1 | E41: 2 | F41: srbd | G41: null | H41: =Sheet1!R[-1]C[26] -> |cFF99FF66烈焰护甲 - Lv1|r | I41: =Sheet1!R[-1]C[26] -> |cFFFFFF99基础属性|r|n力量:60285|n敏捷:60285|n智力:60285|n血量:502377|n护甲:23988|n升级途径:|cFF1BE6B8击杀 巨型蜥蜴(熔火之心2) |r 升级 | J41: =RC[-2] -> |cFF99FF66烈焰护甲 - Lv1|r | K41: =RC[-2] -> |cFFFFFF99基础属性|r|n力量:60285|n敏捷:60285|n智力:60285|n血量:502377|n护甲:23988|n升级途径:|cFF1BE6B8击杀 巨型蜥蜴(熔火之心2) |r 升级 | M41: blp\baseItem\equipment\1_13.blp | X41: 1 | Y41: Permanent | Z41: 0 | AA41: 233 | AB41: 0 | AC41: 0 | AD41: 0 | AM41: 0 | AO41: 0
A42: OBJECT | B42: ZB1F | D42: 1 | E42: 2 | F42: srbd | G42: null | H42: =Sheet1!R[-1]C[26] -> |cFF99FF66烈焰护甲 - Lv2|r | I42: =Sheet1!R[-1]C[26] -> |cFFFFFF99基础属性|r|n力量:74370|n敏捷:74370|n智力:74370|n血量:619753|n护甲:25061|n升级途径:|cFF1BE6B8击杀 千年龙龟(熔火之心3) |r 升级 | J42: =RC[-2] -> |cFF99FF66烈焰护甲 - Lv2|r | K42: =RC[-2] -> |cFFFFFF99基础属性|r|n力量:74370|n敏捷:74370|n智力:74370|n血量:619753|n护甲:25061|n升级途径:|cFF1BE6B8击杀 千年龙龟(熔火之心3) |r 升级 | M42: blp\baseItem\equipment\1_13.blp | X42: 1 | Y42: Permanent | Z42: 0 | AA42: 233 | AB42: 0 | AC42: 0 | AD42: 0 | AM42: 0 | AO42: 0
A43: OBJECT | B43: ZB1G | D43: 1 | E43: 2 | F43: srbd | G43: null | H43: =Sheet1!R[-1]C[26] -> |cFF99FF66烈焰护甲 - Lv3|r | I43: =Sheet1!R[-1]C[26] -> |cFFFFFF99基础属性|r|n力量:91538|n敏捷:91538|n智力:91538|n血量:762821|n护甲:26181|n升级途径:|cFF1BE6B8击杀 成年巨龙(熔火之心4) |r 升级 | J43: =RC[-2] -> |cFF99FF66烈焰护甲 - Lv3|r | K43: =RC[-2] -> |cFFFFFF99基础属性|r|n力量:91538|n敏捷:91538|n智力:91538|n血量:762821|n护甲:26181|n升级途径:|cFF1BE6B8击杀 成年巨龙(熔火之心4) |r 升级 | M43: blp\baseItem\equipment\1_13.blp | X43: 1 | Y43: Permanent | Z43: 0 | AA43: 233 | AB43: 0 | AC43: 0 | AD43: 0 | AM43: 0 | AO43: 0
A44: OBJECT | B44: ZB1H | D44: 1 | E44: 2 | F44: srbd | G44: null | H44: =Sheet1!R[-1]C[26] -> |cFF99FF66烈焰护甲 - Lv4|r | I44: =Sheet1!R[-1]C[26] -> |cFFFFFF99基础属性|r|n力量:112436|n敏捷:112436|n智力:112436|n血量:936974|n护甲:27352|n升级途径:|cFF1BE6B8击杀 冰霜巨魔酋长(祖阿曼岛1) |r 升级 | J44: =RC[-2] -> |cFF99FF66烈焰护甲 - Lv4|r | K44: =RC[-2] -> |cFFFFFF99基础属性|r|n力量:112436|n敏捷:112436|n智力:112436|n血量:936974|n护甲:27352|n升级途径:|cFF1BE6B8击杀 冰霜巨魔酋长(祖阿曼岛1) |r 升级 | M44: blp\baseItem\equipment\1_13.blp | X44: 1 | Y44: Permanent | Z44: 0 | AA44: 233 | AB44: 0 | AC44: 0 | AD44: 0 | AM44: 0 | AO44: 0
A45: OBJECT | B45: ZB1I | D45: 1 | E45: 2 | F45: srbd | G45: null | H45: =Sheet1!R[-1]C[26] -> |cFF99FF66龙吟护甲 - Lv1|r | I45: =Sheet1!R[-1]C[26] -> |cFFFFFF99基础属性|r|n力量:206136|n敏捷:206136|n智力:206136|n血量:1717802|n护甲:31188|n升级途径:|cFF1BE6B8击杀 丛林巨魔酋长(祖阿曼岛2) |r 升级 | J45: =RC[-2] -> |cFF99FF66龙吟护甲 - Lv1|r | K45: =RC[-2] -> |cFFFFFF99基础属性|r|n力量:206136|n敏捷:206136|n智力:206136|n血量:1717802|n护甲:31188|n升级途径:|cFF1BE6B8击杀 丛林巨魔酋长(祖阿曼岛2) |r 升级 | M45: blp\baseItem\equipment\1_14.blp | X45: 1 | Y45: Permanent | Z45: 0 | AA45: 233 | AB45: 0 | AC45: 0 | AD45: 0 | AM45: 0 | AO45: 0
A46: OBJECT | B46: ZB1J | D46: 1 | E46: 2 | F46: srbd | G46: null | H46: =Sheet1!R[-1]C[26] -> |cFF99FF66龙吟护甲 - Lv2|r | I46: =Sheet1!R[-1]C[26] -> |cFFFFFF99基础属性|r|n力量:251504|n敏捷:251504|n智力:251504|n血量:2095867|n护甲:32583|n升级途径:|cFF1BE6B8击杀 娜迦暴君(祖阿曼岛3) |r 升级 | J46: =RC[-2] -> |cFF99FF66龙吟护甲 - Lv2|r | K46: =RC[-2] -> |cFFFFFF99基础属性|r|n力量:251504|n敏捷:251504|n智力:251504|n血量:2095867|n护甲:32583|n升级途径:|cFF1BE6B8击杀 娜迦暴君(祖阿曼岛3) |r 升级 | M46: blp\baseItem\equipment\1_14.blp | X46: 1 | Y46: Permanent | Z46: 0 | AA46: 233 | AB46: 0 | AC46: 0 | AD46: 0 | AM46: 0 | AO46: 0
A47: OBJECT | B47: ZB1K | D47: 1 | E47: 2 | F47: srbd | G47: null | H47: =Sheet1!R[-1]C[26] -> |cFF99FF66龙吟护甲 - Lv3|r | I47: =Sheet1!R[-1]C[26] -> |cFFFFFF99基础属性|r|n力量:306435|n敏捷:306435|n智力:306435|n血量:2553630|n护甲:34040|n升级途径:|cFF1BE6B8击杀 黑暗巨魔酋长(祖阿曼岛4) |r 升级 | J47: =RC[-2] -> |cFF99FF66龙吟护甲 - Lv3|r | K47: =RC[-2] -> |cFFFFFF99基础属性|r|n力量:306435|n敏捷:306435|n智力:306435|n血量:2553630|n护甲:34040|n升级途径:|cFF1BE6B8击杀 黑暗巨魔酋长(祖阿曼岛4) |r 升级 | M47: blp\baseItem\equipment\1_14.blp | X47: 1 | Y47: Permanent | Z47: 0 | AA47: 233 | AB47: 0 | AC47: 0 | AD47: 0 | AM47: 0 | AO47: 0
A48: OBJECT | B48: ZB1L | D48: 1 | E48: 2 | F48: srbd | G48: null | H48: =Sheet1!R[-1]C[26] -> |cFF99FF66龙吟护甲 - Lv4|r | I48: =Sheet1!R[-1]C[26] -> |cFFFFFF99基础属性|r|n力量:372888|n敏捷:372888|n智力:372888|n血量:3107405|n护甲:35563|n升级途径:|cFF1BE6B8击杀 火元素领主(达拉然奥术秘境1) |r 升级 | J48: =RC[-2] -> |cFF99FF66龙吟护甲 - Lv4|r | K48: =RC[-2] -> |cFFFFFF99基础属性|r|n力量:372888|n敏捷:372888|n智力:372888|n血量:3107405|n护甲:35563|n升级途径:|cFF1BE6B8击杀 火元素领主(达拉然奥术秘境1) |r 升级 | M48: blp\baseItem\equipment\1_14.blp | X48: 1 | Y48: Permanent | Z48: 0 | AA48: 233 | AB48: 0 | AC48: 0 | AD48: 0 | AM48: 0 | AO48: 0
A49: OBJECT | B49: ZB1M | D49: 1 | E49: 2 | F49: srbd | G49: null | H49: =Sheet1!R[-1]C[26] -> |cFF99FF66神使护甲 - Lv1|r | I49: =Sheet1!R[-1]C[26] -> |cFFFFFF99基础属性|r|n力量:667315|n敏捷:667315|n智力:667315|n血量:5560962|n护甲:40550|n升级途径:|cFF1BE6B8击杀 风元素领主(达拉然奥术秘境2) |r 升级 | J49: =RC[-2] -> |cFF99FF66神使护甲 - Lv1|r | K49: =RC[-2] -> |cFFFFFF99基础属性|r|n力量:667315|n敏捷:667315|n智力:667315|n血量:5560962|n护甲:40550|n升级途径:|cFF1BE6B8击杀 风元素领主(达拉然奥术秘境2) |r 升级 | M49: blp\baseItem\equipment\1_15.blp | X49: 1 | Y49: Permanent | Z49: 0 | AA49: 233 | AB49: 0 | AC49: 0 | AD49: 0 | AM49: 0 | AO49: 0
A50: OBJECT | B50: ZB1N | D50: 1 | E50: 2 | F50: srbd | G50: null | H50: =Sheet1!R[-1]C[26] -> |cFF99FF66神使护甲 - Lv2|r | I50: =Sheet1!R[-1]C[26] -> |cFFFFFF99基础属性|r|n力量:808528|n敏捷:808528|n智力:808528|n血量:6737735|n护甲:42364|n升级途径:|cFF1BE6B8击杀 水元素领主(达拉然奥术秘境3) |r 升级 | J50: =RC[-2] -> |cFF99FF66神使护甲 - Lv2|r | K50: =RC[-2] -> |cFFFFFF99基础属性|r|n力量:808528|n敏捷:808528|n智力:808528|n血量:6737735|n护甲:42364|n升级途径:|cFF1BE6B8击杀 水元素领主(达拉然奥术秘境3) |r 升级 | M50: blp\baseItem\equipment\1_15.blp | X50: 1 | Y50: Permanent | Z50: 0 | AA50: 233 | AB50: 0 | AC50: 0 | AD50: 0 | AM50: 0 | AO50: 0
A51: OBJECT | B51: ZB1O | D51: 1 | E51: 2 | F51: srbd | G51: null | H51: =Sheet1!R[-1]C[26] -> |cFF99FF66神使护甲 - Lv3|r | I51: =Sheet1!R[-1]C[26] -> |cFFFFFF99基础属性|r|n力量:978723|n敏捷:978723|n智力:978723|n血量:8156031|n护甲:44258|n升级途径:|cFF1BE6B8击杀 土元素领主(达拉然奥术秘境4) |r 升级 | J51: =RC[-2] -> |cFF99FF66神使护甲 - Lv3|r | K51: =RC[-2] -> |cFFFFFF99基础属性|r|n力量:978723|n敏捷:978723|n智力:978723|n血量:8156031|n护甲:44258|n升级途径:|cFF1BE6B8击杀 土元素领主(达拉然奥术秘境4) |r 升级 | M51: blp\baseItem\equipment\1_15.blp | X51: 1 | Y51: Permanent | Z51: 0 | AA51: 233 | AB51: 0 | AC51: 0 | AD51: 0 | AM51: 0 | AO51: 0
A52: OBJECT | B52: ZB1P | D52: 1 | E52: 2 | F52: srbd | G52: null | H52: =Sheet1!R[-1]C[26] -> |cFF99FF66神使护甲 - Lv4|r | I52: =Sheet1!R[-1]C[26] -> |cFFFFFF99基础属性|r|n力量:1183720|n敏捷:1183720|n智力:1183720|n血量:9864340|n护甲:46238|n升级途径:|cFF1BE6B8找 圣魂信仰NPC(后山)|r 合成升级 | J52: =RC[-2] -> |cFF99FF66神使护甲 - Lv4|r | K52: =RC[-2] -> |cFFFFFF99基础属性|r|n力量:1183720|n敏捷:1183720|n智力:1183720|n血量:9864340|n护甲:46238|n升级途径:|cFF1BE6B8找 圣魂信仰NPC(后山)|r 合成升级 | M52: blp\baseItem\equipment\1_15.blp | X52: 1 | Y52: Permanent | Z52: 0 | AA52: 233 | AB52: 0 | AC52: 0 | AD52: 0 | AM52: 0 | AO52: 0
A53: OBJECT | B53: ZB21 | D53: 2 | F53: srbd | G53: null | H53: =Sheet1!R[-1]C[26] -> |cFF99FF66[淡蓝]圣魂结晶|r | I53: =Sheet1!R[-1]C[26] -> |cFFFFFF99基础属性|r|n智力:800000 | J53: =RC[-2] -> |cFF99FF66[淡蓝]圣魂结晶|r | K53: =RC[-2] -> |cFFFFFF99基础属性|r|n智力:800000 | M53: ReplaceableTextures\CommandButtons\BTNIceShard.blp | X53: 1 | Y53: Permanent | Z53: 0 | AA53: 233 | AB53: 0 | AC53: 0 | AD53: 0 | AM53: 0 | AO53: 0
A54: OBJECT | B54: ZB22 | D54: 2 | F54: srbd | G54: null | H54: =Sheet1!R[-1]C[26] -> |cFF99FF66[赤炎]圣魂结晶|r | I54: =Sheet1!R[-1]C[26] -> |cFFFFFF99基础属性|r|n敏捷:800000 | J54: =RC[-2] -> |cFF99FF66[赤炎]圣魂结晶|r | K54: =RC[-2] -> |cFFFFFF99基础属性|r|n敏捷:800000 | M54: ReplaceableTextures\CommandButtons\BTNStaffOfSilence.blp | X54: 1 | Y54: Permanent | Z54: 0 | AA54: 233 | AB54: 0 | AC54: 0 | AD54: 0 | AM54: 0 | AO54: 0
A55: OBJECT | B55: ZB23 | D55: 2 | F55: srbd | G55: null | H55: =Sheet1!R[-1]C[26] -> |cFF99FF66[圣光]圣魂结晶|r | I55: =Sheet1!R[-1]C[26] -> |cFFFFFF99基础属性|r|n血量:5000000 | J55: =RC[-2] -> |cFF99FF66[圣光]圣魂结晶|r | K55: =RC[-2] -> |cFFFFFF99基础属性|r|n血量:5000000 | M55: ReplaceableTextures\CommandButtons\BTNHeartOfAszune.blp | X55: 1 | Y55: Permanent | Z55: 0 | AA55: 233 | AB55: 0 | AC55: 0 | AD55: 0 | AM55: 0 | AO55: 0
A56: OBJECT | B56: ZB24 | D56: 2 | F56: srbd | G56: null | H56: =Sheet1!R[-1]C[26] -> |cFF99FF66[暗黑]圣魂结晶|r | I56: =Sheet1!R[-1]C[26] -> |cFFFFFF99基础属性|r|n攻击:3000000|n|cFFFFFF55附加属性|r(%)|n攻速:20 | J56: =RC[-2] -> |cFF99FF66[暗黑]圣魂结晶|r | K56: =RC[-2] -> |cFFFFFF99基础属性|r|n攻击:3000000|n|cFFFFFF55附加属性|r(%)|n攻速:20 | M56: ReplaceableTextures\CommandButtons\BTNPeriapt1.blp | X56: 1 | Y56: Permanent | Z56: 0 | AA56: 233 | AB56: 0 | AC56: 0 | AD56: 0 | AM56: 0 | AO56: 0
A57: OBJECT | B57: ZB25 | D57: 2 | F57: srbd | G57: null | H57: =Sheet1!R[-1]C[26] -> |cFF99FF66[纯白]圣魂结晶|r | I57: =Sheet1!R[-1]C[26] -> |cFFFFFF99基础属性|r|n力量:800000 | J57: =RC[-2] -> |cFF99FF66[纯白]圣魂结晶|r | K57: =RC[-2] -> |cFFFFFF99基础属性|r|n力量:800000 | M57: ReplaceableTextures\CommandButtons\BTNStaffOfPreservation.blp | X57: 1 | Y57: Permanent | Z57: 0 | AA57: 233 | AB57: 0 | AC57: 0 | AD57: 0 | AM57: 0 | AO57: 0
A58: OBJECT | B58: ZB26 | D58: 3 | F58: srbd | G58: null | H58: =Sheet1!R[-1]C[26] -> |cFF99FF66[淡蓝]圣魂珠|r | I58: =Sheet1!R[-1]C[26] -> |cFFFFFF99基础属性|r|n攻击:6000000|n力量:1500000|n敏捷:1500000|n智力:2500000|n血量:13000000|n护甲:50000|n|cFFFFFF55附加属性|r(%)|n攻速:60|n攻击吸血:20 | J58: =RC[-2] -> |cFF99FF66[淡蓝]圣魂珠|r | K58: =RC[-2] -> |cFFFFFF99基础属性|r|n攻击:6000000|n力量:1500000|n敏捷:1500000|n智力:2500000|n血量:13000000|n护甲:50000|n|cFFFFFF55附加属性|r(%)|n攻速:60|n攻击吸血:20 | M58: ReplaceableTextures\CommandButtons\BTNOrbOfFrost.blp | X58: 1 | Y58: Permanent | Z58: 0 | AA58: 233 | AB58: 0 | AC58: 0 | AD58: 0 | AM58: 0 | AO58: 0
A59: OBJECT | B59: ZB27 | D59: 3 | F59: srbd | G59: null | H59: =Sheet1!R[-1]C[26] -> |cFF99FF66[赤炎]圣魂珠|r | I59: =Sheet1!R[-1]C[26] -> |cFFFFFF99基础属性|r|n攻击:6000000|n力量:1500000|n敏捷:2500000|n智力:1500000|n血量:13000000|n护甲:50000|n|cFFFFFF55附加属性|r(%)|n攻速:60|n攻击吸血:20 | J59: =RC[-2] -> |cFF99FF66[赤炎]圣魂珠|r | K59: =RC[-2] -> |cFFFFFF99基础属性|r|n攻击:6000000|n力量:1500000|n敏捷:2500000|n智力:1500000|n血量:13000000|n护甲:50000|n|cFFFFFF55附加属性|r(%)|n攻速:60|n攻击吸血:20 | M59: ReplaceableTextures\CommandButtons\BTNOrbOfFire.blp | X59: 1 | Y59: Permanent | Z59: 0 | AA59: 233 | AB59: 0 | AC59: 0 | AD59: 0 | AM59: 0 | AO59: 0
A60: OBJECT | B60: ZB28 | D60: 3 | F60: srbd | G60: null | H60: =Sheet1!R[-1]C[26] -> |cFF99FF66[圣光]圣魂珠|r | I60: =Sheet1!R[-1]C[26] -> |cFFFFFF99基础属性|r|n攻击:6000000|n力量:1500000|n敏捷:1500000|n智力:1500000|n血量:25000000|n护甲:50000|n|cFFFFFF55附加属性|r(%)|n攻速:60|n攻击吸血:20 | J60: =RC[-2] -> |cFF99FF66[圣光]圣魂珠|r | K60: =RC[-2] -> |cFFFFFF99基础属性|r|n攻击:6000000|n力量:1500000|n敏捷:1500000|n智力:1500000|n血量:25000000|n护甲:50000|n|cFFFFFF55附加属性|r(%)|n攻速:60|n攻击吸血:20 | M60: ReplaceableTextures\CommandButtons\BTNHolyBolt.blp | X60: 1 | Y60: Permanent | Z60: 0 | AA60: 233 | AB60: 0 | AC60: 0 | AD60: 0 | AM60: 0 | AO60: 0
A61: OBJECT | B61: ZB29 | D61: 3 | F61: srbd | G61: null | H61: =Sheet1!R[-1]C[26] -> |cFF99FF66[暗黑]圣魂珠|r | I61: =Sheet1!R[-1]C[26] -> |cFFFFFF99基础属性|r|n攻击:10000000|n力量:1500000|n敏捷:1500000|n智力:1500000|n血量:13000000|n护甲:50000|n|cFFFFFF55附加属性|r(%)|n攻速:80|n攻击吸血:20 | J61: =RC[-2] -> |cFF99FF66[暗黑]圣魂珠|r | K61: =RC[-2] -> |cFFFFFF99基础属性|r|n攻击:10000000|n力量:1500000|n敏捷:1500000|n智力:1500000|n血量:13000000|n护甲:50000|n|cFFFFFF55附加属性|r(%)|n攻速:80|n攻击吸血:20 | M61: ReplaceableTextures\CommandButtons\BTNOrbOfDarkness.blp | X61: 1 | Y61: Permanent | Z61: 0 | AA61: 233 | AB61: 0 | AC61: 0 | AD61: 0 | AM61: 0 | AO61: 0
A62: OBJECT | B62: ZB2A | D62: 3 | F62: srbd | G62: null | H62: =Sheet1!R[-1]C[26] -> |cFF99FF66[纯白]圣魂珠|r | I62: =Sheet1!R[-1]C[26] -> |cFFFFFF99基础属性|r|n攻击:6000000|n力量:2500000|n敏捷:1500000|n智力:1500000|n血量:13000000|n护甲:50000|n|cFFFFFF55附加属性|r(%)|n攻速:60|n攻击吸血:20 | J62: =RC[-2] -> |cFF99FF66[纯白]圣魂珠|r | K62: =RC[-2] -> |cFFFFFF99基础属性|r|n攻击:6000000|n力量:2500000|n敏捷:1500000|n智力:1500000|n血量:13000000|n护甲:50000|n|cFFFFFF55附加属性|r(%)|n攻速:60|n攻击吸血:20 | M62: ReplaceableTextures\CommandButtons\BTNOrbOfLightning.blp | X62: 1 | Y62: Permanent | Z62: 0 | AA62: 233 | AB62: 0 | AC62: 0 | AD62: 0 | AM62: 0 | AO62: 0
A63: OBJECT | B63: ZB30 | D63: 3 | F63: srbd | G63: ZZZY | H63: =Sheet1!R[-1]C[26] -> |cFF99FF66[A级宝珠]时间巨龙之心|r | I63: =Sheet1!R[-1]C[26] -> |cFFFFFF99基础属性|r|n力量:270000|n敏捷:270000|n智力:270000|n|cFFFFFF11成长属性|r|n每秒属性:1250|n|n升级途径:|cFF1BE6B8使用 |cFF33FF00传说气息|r 升级|r | J63: =RC[-2] -> |cFF99FF66[A级宝珠]时间巨龙之心|r | K63: =RC[-2] -> |cFFFFFF99基础属性|r|n力量:270000|n敏捷:270000|n智力:270000|n|cFFFFFF11成长属性|r|n每秒属性:1250|n|n升级途径:|cFF1BE6B8使用 |cFF33FF00传说气息|r 升级|r | M63: blp\baseItem\gem\bz_1_4.blp | X63: 3 | Y63: Permanent | Z63: 8000 | AA63: 236 | AB63: 0 | AC63: 0 | AD63: 0 | AO63: 0 | AR63: 1
A64: OBJECT | B64: ZB31 | D64: 3 | F64: srbd | G64: ZZZY | H64: =Sheet1!R[-1]C[26] -> |cFF99FF66[A级宝珠]生命巨龙之心|r | I64: =Sheet1!R[-1]C[26] -> |cFFFFFF99基础属性|r|n血量:4860000|n|cFFFFFF11成长属性|r|n杀敌属性:250|n|n升级途径:|cFF1BE6B8使用 |cFF33FF00传说气息|r 升级|r | J64: =RC[-2] -> |cFF99FF66[A级宝珠]生命巨龙之心|r | K64: =RC[-2] -> |cFFFFFF99基础属性|r|n血量:4860000|n|cFFFFFF11成长属性|r|n杀敌属性:250|n|n升级途径:|cFF1BE6B8使用 |cFF33FF00传说气息|r 升级|r | M64: blp\baseItem\gem\bz_2_4.blp | X64: 3 | Y64: Permanent | Z64: 8000 | AA64: 236 | AB64: 0 | AC64: 0 | AD64: 0 | AO64: 0 | AR64: 1
A65: OBJECT | B65: ZB32 | D65: 3 | F65: srbd | G65: ZZZY | H65: =Sheet1!R[-1]C[26] -> |cFF99FF66[A级宝珠]魔法巨龙之心|r | I65: =Sheet1!R[-1]C[26] -> |cFFFFFF99基础属性|r|n力量:270000|n敏捷:270000|n智力:270000|n|cFFFFFF11成长属性|r|n升级属性:6000|n|n升级途径:|cFF1BE6B8使用 |cFF33FF00传说气息|r 升级|r | J65: =RC[-2] -> |cFF99FF66[A级宝珠]魔法巨龙之心|r | K65: =RC[-2] -> |cFFFFFF99基础属性|r|n力量:270000|n敏捷:270000|n智力:270000|n|cFFFFFF11成长属性|r|n升级属性:6000|n|n升级途径:|cFF1BE6B8使用 |cFF33FF00传说气息|r 升级|r | M65: blp\baseItem\gem\bz_3_4.blp | X65: 3 | Y65: Permanent | Z65: 8000 | AA65: 236 | AB65: 0 | AC65: 0 | AD65: 0 | AO65: 0 | AR65: 1
A66: OBJECT | B66: ZB33 | D66: 3 | F66: srbd | G66: ZZZY | H66: =Sheet1!R[-1]C[26] -> |cFF99FF66[A级宝珠]梦境巨龙之心|r | I66: =Sheet1!R[-1]C[26] -> |n|cFFFFFF55附加属性|r(%)|n伤害减免:20|n|n升级途径:|cFF1BE6B8使用 |cFF33FF00传说气息|r 升级|r | J66: =RC[-2] -> |cFF99FF66[A级宝珠]梦境巨龙之心|r | K66: =RC[-2] -> |n|cFFFFFF55附加属性|r(%)|n伤害减免:20|n|n升级途径:|cFF1BE6B8使用 |cFF33FF00传说气息|r 升级|r | M66: blp\baseItem\gem\bz_4_4.blp | X66: 3 | Y66: Permanent | Z66: 8000 | AA66: 236 | AB66: 0 | AC66: 0 | AD66: 0 | AO66: 0 | AR66: 1
A67: OBJECT | B67: ZB34 | D67: 3 | F67: srbd | G67: ZZZY | H67: =Sheet1!R[-1]C[26] -> |cFF99FF66[A级宝珠]大地巨龙之心|r | I67: =Sheet1!R[-1]C[26] -> |cFFFFFF99基础属性|r|n护甲:27000|n|cFFFFFF55附加属性|r(%)|n附加伤害:60|n|n升级途径:|cFF1BE6B8使用 |cFF33FF00传说气息|r 升级|r | J67: =RC[-2] -> |cFF99FF66[A级宝珠]大地巨龙之心|r | K67: =RC[-2] -> |cFFFFFF99基础属性|r|n护甲:27000|n|cFFFFFF55附加属性|r(%)|n附加伤害:60|n|n升级途径:|cFF1BE6B8使用 |cFF33FF00传说气息|r 升级|r | M67: blp\baseItem\gem\bz_5_4.blp | X67: 3 | Y67: Permanent | Z67: 8000 | AA67: 236 | AB67: 0 | AC67: 0 | AD67: 0 | AO67: 0 | AR67: 1
A68: OBJECT | B68: ZB35 | D68: 3 | F68: srbd | G68: ZZZY | H68: =Sheet1!R[-1]C[26] -> |cFF99FF66[A级宝珠]泰坦能量核心|r | I68: =Sheet1!R[-1]C[26] -> |cFFFFFF99基础属性|r|n攻击:1350000|n|cFFFFFF55附加属性|r(%)|n攻速:50|n|n升级途径:|cFF1BE6B8使用 |cFF33FF00传说气息|r 升级|r | J68: =RC[-2] -> |cFF99FF66[A级宝珠]泰坦能量核心|r | K68: =RC[-2] -> |cFFFFFF99基础属性|r|n攻击:1350000|n|cFFFFFF55附加属性|r(%)|n攻速:50|n|n升级途径:|cFF1BE6B8使用 |cFF33FF00传说气息|r 升级|r | M68: blp\baseItem\gem\bz_6_4.blp | X68: 3 | Y68: Permanent | Z68: 8000 | AA68: 236 | AB68: 0 | AC68: 0 | AD68: 0 | AO68: 0 | AR68: 1
A69: OBJECT | B69: ZB36 | D69: 3 | F69: srbd | G69: ZZZY | H69: =Sheet1!R[-1]C[26] -> |cFF99FF66[A级宝珠]监视枢纽之钥|r | I69: =Sheet1!R[-1]C[26] -> |n|cFFFFFF55附加属性|r(%)|n攻击吸血:20|n|n升级途径:|cFF1BE6B8使用 |cFF33FF00传说气息|r 升级|r | J69: =RC[-2] -> |cFF99FF66[A级宝珠]监视枢纽之钥|r | K69: =RC[-2] -> |n|cFFFFFF55附加属性|r(%)|n攻击吸血:20|n|n升级途径:|cFF1BE6B8使用 |cFF33FF00传说气息|r 升级|r | M69: blp\baseItem\gem\bz_7_4.blp | X69: 3 | Y69: Permanent | Z69: 8000 | AA69: 236 | AB69: 0 | AC69: 0 | AD69: 0 | AO69: 0 | AR69: 1
A70: OBJECT | B70: ZB37 | D70: 3 | F70: srbd | G70: ZZZY | H70: =Sheet1!R[-1]C[26] -> |cFF99FF66[A级宝珠]冰封灵魂之匣|r | I70: =Sheet1!R[-1]C[26] -> |n|cFFFFFF55附加属性|r(%)|n暴击概率:10|n暴击伤害:60|n|n升级途径:|cFF1BE6B8使用 |cFF33FF00传说气息|r 升级|r | J70: =RC[-2] -> |cFF99FF66[A级宝珠]冰封灵魂之匣|r | K70: =RC[-2] -> |n|cFFFFFF55附加属性|r(%)|n暴击概率:10|n暴击伤害:60|n|n升级途径:|cFF1BE6B8使用 |cFF33FF00传说气息|r 升级|r | M70: blp\baseItem\gem\bz_8_4.blp | X70: 3 | Y70: Permanent | Z70: 8000 | AA70: 236 | AB70: 0 | AC70: 0 | AD70: 0 | AO70: 0 | AR70: 1
A71: OBJECT | B71: ZB40 | D71: 3 | F71: srbd | G71: ZZZY | H71: =Sheet1!R[-1]C[26] -> |cFF99FF66[B级宝珠]时空结晶石|r | I71: =Sheet1!R[-1]C[26] -> |cFFFFFF99基础属性|r|n力量:90000|n敏捷:90000|n智力:90000|n|cFFFFFF11成长属性|r|n每秒属性:200|n|n升级途径:|cFF1BE6B8使用 |cFF1BE6B8玄天灵髓|r 升级|r | J71: =RC[-2] -> |cFF99FF66[B级宝珠]时空结晶石|r | K71: =RC[-2] -> |cFFFFFF99基础属性|r|n力量:90000|n敏捷:90000|n智力:90000|n|cFFFFFF11成长属性|r|n每秒属性:200|n|n升级途径:|cFF1BE6B8使用 |cFF1BE6B8玄天灵髓|r 升级|r | M71: blp\baseItem\gem\bz_1_3.blp | X71: 3 | Y71: Permanent | Z71: 4000 | AA71: 236 | AB71: 0 | AC71: 0 | AD71: 0 | AO71: 0 | AR71: 1
A72: OBJECT | B72: ZB41 | D72: 3 | F72: srbd | G72: ZZZY | H72: =Sheet1!R[-1]C[26] -> |cFF99FF66[B级宝珠]生命结晶石|r | I72: =Sheet1!R[-1]C[26] -> |cFFFFFF99基础属性|r|n血量:1620000|n|cFFFFFF11成长属性|r|n杀敌属性:40|n|n升级途径:|cFF1BE6B8使用 |cFF1BE6B8玄天灵髓|r 升级|r | J72: =RC[-2] -> |cFF99FF66[B级宝珠]生命结晶石|r | K72: =RC[-2] -> |cFFFFFF99基础属性|r|n血量:1620000|n|cFFFFFF11成长属性|r|n杀敌属性:40|n|n升级途径:|cFF1BE6B8使用 |cFF1BE6B8玄天灵髓|r 升级|r | M72: blp\baseItem\gem\bz_2_3.blp | X72: 3 | Y72: Permanent | Z72: 4000 | AA72: 236 | AB72: 0 | AC72: 0 | AD72: 0 | AO72: 0 | AR72: 1
A73: OBJECT | B73: ZB42 | D73: 3 | F73: srbd | G73: ZZZY | H73: =Sheet1!R[-1]C[26] -> |cFF99FF66[B级宝珠]魔法结晶石|r | I73: =Sheet1!R[-1]C[26] -> |cFFFFFF99基础属性|r|n力量:90000|n敏捷:90000|n智力:90000|n|cFFFFFF11成长属性|r|n升级属性:2000|n|n升级途径:|cFF1BE6B8使用 |cFF1BE6B8玄天灵髓|r 升级|r | J73: =RC[-2] -> |cFF99FF66[B级宝珠]魔法结晶石|r | K73: =RC[-2] -> |cFFFFFF99基础属性|r|n力量:90000|n敏捷:90000|n智力:90000|n|cFFFFFF11成长属性|r|n升级属性:2000|n|n升级途径:|cFF1BE6B8使用 |cFF1BE6B8玄天灵髓|r 升级|r | M73: blp\baseItem\gem\bz_3_3.blp | X73: 3 | Y73: Permanent | Z73: 4000 | AA73: 236 | AB73: 0 | AC73: 0 | AD73: 0 | AO73: 0 | AR73: 1
A74: OBJECT | B74: ZB43 | D74: 3 | F74: srbd | G74: ZZZY | H74: =Sheet1!R[-1]C[26] -> |cFF99FF66[B级宝珠]梦境结晶石|r | I74: =Sheet1!R[-1]C[26] -> |n|cFFFFFF55附加属性|r(%)|n伤害减免:15|n|n升级途径:|cFF1BE6B8使用 |cFF1BE6B8玄天灵髓|r 升级|r | J74: =RC[-2] -> |cFF99FF66[B级宝珠]梦境结晶石|r | K74: =RC[-2] -> |n|cFFFFFF55附加属性|r(%)|n伤害减免:15|n|n升级途径:|cFF1BE6B8使用 |cFF1BE6B8玄天灵髓|r 升级|r | M74: blp\baseItem\gem\bz_4_3.blp | X74: 3 | Y74: Permanent | Z74: 4000 | AA74: 236 | AB74: 0 | AC74: 0 | AD74: 0 | AO74: 0 | AR74: 1
A75: OBJECT | B75: ZB44 | D75: 3 | F75: srbd | G75: ZZZY | H75: =Sheet1!R[-1]C[26] -> |cFF99FF66[B级宝珠]大地结晶石|r | I75: =Sheet1!R[-1]C[26] -> |cFFFFFF99基础属性|r|n护甲:9000|n|cFFFFFF55附加属性|r(%)|n附加伤害:40|n|n升级途径:|cFF1BE6B8使用 |cFF1BE6B8玄天灵髓|r 升级|r | J75: =RC[-2] -> |cFF99FF66[B级宝珠]大地结晶石|r | K75: =RC[-2] -> |cFFFFFF99基础属性|r|n护甲:9000|n|cFFFFFF55附加属性|r(%)|n附加伤害:40|n|n升级途径:|cFF1BE6B8使用 |cFF1BE6B8玄天灵髓|r 升级|r | M75: blp\baseItem\gem\bz_5_3.blp | X75: 3 | Y75: Permanent | Z75: 4000 | AA75: 236 | AB75: 0 | AC75: 0 | AD75: 0 | AO75: 0 | AR75: 1
A76: OBJECT | B76: ZB45 | D76: 3 | F76: srbd | G76: ZZZY | H76: =Sheet1!R[-1]C[26] -> |cFF99FF66[B级宝珠]泰坦结晶石|r | I76: =Sheet1!R[-1]C[26] -> |cFFFFFF99基础属性|r|n攻击:450000|n|cFFFFFF55附加属性|r(%)|n攻速:40|n|n升级途径:|cFF1BE6B8使用 |cFF1BE6B8玄天灵髓|r 升级|r | J76: =RC[-2] -> |cFF99FF66[B级宝珠]泰坦结晶石|r | K76: =RC[-2] -> |cFFFFFF99基础属性|r|n攻击:450000|n|cFFFFFF55附加属性|r(%)|n攻速:40|n|n升级途径:|cFF1BE6B8使用 |cFF1BE6B8玄天灵髓|r 升级|r | M76: blp\baseItem\gem\bz_6_3.blp | X76: 3 | Y76: Permanent | Z76: 4000 | AA76: 236 | AB76: 0 | AC76: 0 | AD76: 0 | AO76: 0 | AR76: 1
A77: OBJECT | B77: ZB46 | D77: 3 | F77: srbd | G77: ZZZY | H77: =Sheet1!R[-1]C[26] -> |cFF99FF66[B级宝珠]枢纽结晶石|r | I77: =Sheet1!R[-1]C[26] -> |n|cFFFFFF55附加属性|r(%)|n攻击吸血:15|n|n升级途径:|cFF1BE6B8使用 |cFF1BE6B8玄天灵髓|r 升级|r | J77: =RC[-2] -> |cFF99FF66[B级宝珠]枢纽结晶石|r | K77: =RC[-2] -> |n|cFFFFFF55附加属性|r(%)|n攻击吸血:15|n|n升级途径:|cFF1BE6B8使用 |cFF1BE6B8玄天灵髓|r 升级|r | M77: blp\baseItem\gem\bz_7_3.blp | X77: 3 | Y77: Permanent | Z77: 4000 | AA77: 236 | AB77: 0 | AC77: 0 | AD77: 0 | AO77: 0 | AR77: 1
A78: OBJECT | B78: ZB47 | D78: 3 | F78: srbd | G78: ZZZY | H78: =Sheet1!R[-1]C[26] -> |cFF99FF66[B级宝珠]灵魂结晶石|r | I78: =Sheet1!R[-1]C[26] -> |n|cFFFFFF55附加属性|r(%)|n暴击概率:10|n暴击伤害:40|n|n升级途径:|cFF1BE6B8使用 |cFF1BE6B8玄天灵髓|r 升级|r | J78: =RC[-2] -> |cFF99FF66[B级宝珠]灵魂结晶石|r | K78: =RC[-2] -> |n|cFFFFFF55附加属性|r(%)|n暴击概率:10|n暴击伤害:40|n|n升级途径:|cFF1BE6B8使用 |cFF1BE6B8玄天灵髓|r 升级|r | M78: blp\baseItem\gem\bz_8_3.blp | X78: 3 | Y78: Permanent | Z78: 4000 | AA78: 236 | AB78: 0 | AC78: 0 | AD78: 0 | AO78: 0 | AR78: 1
A79: OBJECT | B79: ZB50 | D79: 3 | F79: srbd | G79: ZZZY | H79: =Sheet1!R[-1]C[26] -> |CFFB6D7A8[C级宝珠]时空水晶|r | I79: =Sheet1!R[-1]C[26] -> |cFFFFFF99基础属性|r|n力量:30000|n敏捷:30000|n智力:30000|n|cFFFFFF11成长属性|r|n每秒属性:50|n|n升级途径:|cFF1BE6B8使用 |cFF99FF66精炼晶石|r 升级|r | J79: =RC[-2] -> |CFFB6D7A8[C级宝珠]时空水晶|r | K79: =RC[-2] -> |cFFFFFF99基础属性|r|n力量:30000|n敏捷:30000|n智力:30000|n|cFFFFFF11成长属性|r|n每秒属性:50|n|n升级途径:|cFF1BE6B8使用 |cFF99FF66精炼晶石|r 升级|r | M79: blp\baseItem\gem\bz_1_2.blp | X79: 3 | Y79: Permanent | Z79: 2000 | AA79: 236 | AB79: 0 | AC79: 0 | AD79: 0 | AO79: 0 | AR79: 1
A80: OBJECT | B80: ZB51 | D80: 3 | F80: srbd | G80: ZZZY | H80: =Sheet1!R[-1]C[26] -> |CFFB6D7A8[C级宝珠]生命水晶|r | I80: =Sheet1!R[-1]C[26] -> |cFFFFFF99基础属性|r|n血量:540000|n|cFFFFFF11成长属性|r|n杀敌属性:10|n|n升级途径:|cFF1BE6B8使用 |cFF99FF66精炼晶石|r 升级|r | J80: =RC[-2] -> |CFFB6D7A8[C级宝珠]生命水晶|r | K80: =RC[-2] -> |cFFFFFF99基础属性|r|n血量:540000|n|cFFFFFF11成长属性|r|n杀敌属性:10|n|n升级途径:|cFF1BE6B8使用 |cFF99FF66精炼晶石|r 升级|r | M80: blp\baseItem\gem\bz_2_2.blp | X80: 3 | Y80: Permanent | Z80: 2000 | AA80: 236 | AB80: 0 | AC80: 0 | AD80: 0 | AO80: 0 | AR80: 1
A81: OBJECT | B81: ZB52 | D81: 3 | F81: srbd | G81: ZZZY | H81: =Sheet1!R[-1]C[26] -> |CFFB6D7A8[C级宝珠]魔法水晶|r | I81: =Sheet1!R[-1]C[26] -> |cFFFFFF99基础属性|r|n力量:30000|n敏捷:30000|n智力:30000|n|cFFFFFF11成长属性|r|n升级属性:500|n|n升级途径:|cFF1BE6B8使用 |cFF99FF66精炼晶石|r 升级|r | J81: =RC[-2] -> |CFFB6D7A8[C级宝珠]魔法水晶|r | K81: =RC[-2] -> |cFFFFFF99基础属性|r|n力量:30000|n敏捷:30000|n智力:30000|n|cFFFFFF11成长属性|r|n升级属性:500|n|n升级途径:|cFF1BE6B8使用 |cFF99FF66精炼晶石|r 升级|r | M81: blp\baseItem\gem\bz_3_2.blp | X81: 3 | Y81: Permanent | Z81: 2000 | AA81: 236 | AB81: 0 | AC81: 0 | AD81: 0 | AO81: 0 | AR81: 1
A82: OBJECT | B82: ZB53 | D82: 3 | F82: srbd | G82: ZZZY | H82: =Sheet1!R[-1]C[26] -> |CFFB6D7A8[C级宝珠]梦境水晶|r | I82: =Sheet1!R[-1]C[26] -> |n|cFFFFFF55附加属性|r(%)|n伤害减免:10|n|n升级途径:|cFF1BE6B8使用 |cFF99FF66精炼晶石|r 升级|r | J82: =RC[-2] -> |CFFB6D7A8[C级宝珠]梦境水晶|r | K82: =RC[-2] -> |n|cFFFFFF55附加属性|r(%)|n伤害减免:10|n|n升级途径:|cFF1BE6B8使用 |cFF99FF66精炼晶石|r 升级|r | M82: blp\baseItem\gem\bz_4_2.blp | X82: 3 | Y82: Permanent | Z82: 2000 | AA82: 236 | AB82: 0 | AC82: 0 | AD82: 0 | AO82: 0 | AR82: 1
A83: OBJECT | B83: ZB54 | D83: 3 | F83: srbd | G83: ZZZY | H83: =Sheet1!R[-1]C[26] -> |CFFB6D7A8[C级宝珠]大地水晶|r | I83: =Sheet1!R[-1]C[26] -> |cFFFFFF99基础属性|r|n护甲:3000|n|cFFFFFF55附加属性|r(%)|n附加伤害:20|n|n升级途径:|cFF1BE6B8使用 |cFF99FF66精炼晶石|r 升级|r | J83: =RC[-2] -> |CFFB6D7A8[C级宝珠]大地水晶|r | K83: =RC[-2] -> |cFFFFFF99基础属性|r|n护甲:3000|n|cFFFFFF55附加属性|r(%)|n附加伤害:20|n|n升级途径:|cFF1BE6B8使用 |cFF99FF66精炼晶石|r 升级|r | M83: blp\baseItem\gem\bz_5_2.blp | X83: 3 | Y83: Permanent | Z83: 2000 | AA83: 236 | AB83: 0 | AC83: 0 | AD83: 0 | AO83: 0 | AR83: 1
A84: OBJECT | B84: ZB55 | D84: 3 | F84: srbd | G84: ZZZY | H84: =Sheet1!R[-1]C[26] -> |CFFB6D7A8[C级宝珠]泰坦水晶|r | I84: =Sheet1!R[-1]C[26] -> |cFFFFFF99基础属性|r|n攻击:150000|n|cFFFFFF55附加属性|r(%)|n攻速:30|n|n升级途径:|cFF1BE6B8使用 |cFF99FF66精炼晶石|r 升级|r | J84: =RC[-2] -> |CFFB6D7A8[C级宝珠]泰坦水晶|r | K84: =RC[-2] -> |cFFFFFF99基础属性|r|n攻击:150000|n|cFFFFFF55附加属性|r(%)|n攻速:30|n|n升级途径:|cFF1BE6B8使用 |cFF99FF66精炼晶石|r 升级|r | M84: blp\baseItem\gem\bz_6_2.blp | X84: 3 | Y84: Permanent | Z84: 2000 | AA84: 236 | AB84: 0 | AC84: 0 | AD84: 0 | AO84: 0 | AR84: 1
A85: OBJECT | B85: ZB56 | D85: 3 | F85: srbd | G85: ZZZY | H85: =Sheet1!R[-1]C[26] -> |CFFB6D7A8[C级宝珠]枢纽水晶|r | I85: =Sheet1!R[-1]C[26] -> |n|cFFFFFF55附加属性|r(%)|n攻击吸血:10|n|n升级途径:|cFF1BE6B8使用 |cFF99FF66精炼晶石|r 升级|r | J85: =RC[-2] -> |CFFB6D7A8[C级宝珠]枢纽水晶|r | K85: =RC[-2] -> |n|cFFFFFF55附加属性|r(%)|n攻击吸血:10|n|n升级途径:|cFF1BE6B8使用 |cFF99FF66精炼晶石|r 升级|r | M85: blp\baseItem\gem\bz_7_2.blp | X85: 3 | Y85: Permanent | Z85: 2000 | AA85: 236 | AB85: 0 | AC85: 0 | AD85: 0 | AO85: 0 | AR85: 1
A86: OBJECT | B86: ZB57 | D86: 3 | F86: srbd | G86: ZZZY | H86: =Sheet1!R[-1]C[26] -> |CFFB6D7A8[C级宝珠]灵魂水晶|r | I86: =Sheet1!R[-1]C[26] -> |n|cFFFFFF55附加属性|r(%)|n暴击概率:10|n暴击伤害:20|n|n升级途径:|cFF1BE6B8使用 |cFF99FF66精炼晶石|r 升级|r | J86: =RC[-2] -> |CFFB6D7A8[C级宝珠]灵魂水晶|r | K86: =RC[-2] -> |n|cFFFFFF55附加属性|r(%)|n暴击概率:10|n暴击伤害:20|n|n升级途径:|cFF1BE6B8使用 |cFF99FF66精炼晶石|r 升级|r | M86: blp\baseItem\gem\bz_8_2.blp | X86: 3 | Y86: Permanent | Z86: 2000 | AA86: 236 | AB86: 0 | AC86: 0 | AD86: 0 | AO86: 0 | AR86: 1
A87: OBJECT | B87: ZB60 | D87: 3 | F87: srbd | G87: ZZZY | H87: =Sheet1!R[-1]C[26] -> |CFFFFFFFF[D级宝珠]时空石|r | I87: =Sheet1!R[-1]C[26] -> |cFFFFFF99基础属性|r|n力量:10000|n敏捷:10000|n智力:10000|n|cFFFFFF11成长属性|r|n每秒属性:10|n|n升级途径:|cFF1BE6B8使用 |CFFB6D7A8石化水晶|r 升级|r|n需要轮回1才可熔炼|n[提示]:难度1只可以熔炼2个宝珠,每提升难度1可以多熔炼一个! | J87: =RC[-2] -> |CFFFFFFFF[D级宝珠]时空石|r | K87: =RC[-2] -> |cFFFFFF99基础属性|r|n力量:10000|n敏捷:10000|n智力:10000|n|cFFFFFF11成长属性|r|n每秒属性:10|n|n升级途径:|cFF1BE6B8使用 |CFFB6D7A8石化水晶|r 升级|r|n需要轮回1才可熔炼|n[提示]:难度1只可以熔炼2个宝珠,每提升难度1可以多熔炼一个! | M87: blp\baseItem\gem\bz_1_1.blp | X87: 3 | Y87: Permanent | Z87: 1000 | AA87: 236 | AB87: 0 | AC87: 0 | AD87: 0 | AO87: 0 | AR87: 1
A88: OBJECT | B88: ZB61 | D88: 3 | F88: srbd | G88: ZZZY | H88: =Sheet1!R[-1]C[26] -> |CFFFFFFFF[D级宝珠]生命石|r | I88: =Sheet1!R[-1]C[26] -> |cFFFFFF99基础属性|r|n血量:180000|n|cFFFFFF11成长属性|r|n杀敌属性:2|n|n升级途径:|cFF1BE6B8使用 |CFFB6D7A8石化水晶|r 升级|r|n需要轮回1才可熔炼|n[提示]:难度1只可以熔炼2个宝珠,每提升难度1可以多熔炼一个! | J88: =RC[-2] -> |CFFFFFFFF[D级宝珠]生命石|r | K88: =RC[-2] -> |cFFFFFF99基础属性|r|n血量:180000|n|cFFFFFF11成长属性|r|n杀敌属性:2|n|n升级途径:|cFF1BE6B8使用 |CFFB6D7A8石化水晶|r 升级|r|n需要轮回1才可熔炼|n[提示]:难度1只可以熔炼2个宝珠,每提升难度1可以多熔炼一个! | M88: blp\baseItem\gem\bz_2_1.blp | X88: 3 | Y88: Permanent | Z88: 1000 | AA88: 236 | AB88: 0 | AC88: 0 | AD88: 0 | AO88: 0 | AR88: 1
A89: OBJECT | B89: ZB62 | D89: 3 | F89: srbd | G89: ZZZY | H89: =Sheet1!R[-1]C[26] -> |CFFFFFFFF[D级宝珠]魔法石|r | I89: =Sheet1!R[-1]C[26] -> |cFFFFFF99基础属性|r|n力量:10000|n敏捷:10000|n智力:10000|n|cFFFFFF11成长属性|r|n升级属性:100|n|n升级途径:|cFF1BE6B8使用 |CFFB6D7A8石化水晶|r 升级|r|n需要轮回1才可熔炼|n[提示]:难度1只可以熔炼2个宝珠,每提升难度1可以多熔炼一个! | J89: =RC[-2] -> |CFFFFFFFF[D级宝珠]魔法石|r | K89: =RC[-2] -> |cFFFFFF99基础属性|r|n力量:10000|n敏捷:10000|n智力:10000|n|cFFFFFF11成长属性|r|n升级属性:100|n|n升级途径:|cFF1BE6B8使用 |CFFB6D7A8石化水晶|r 升级|r|n需要轮回1才可熔炼|n[提示]:难度1只可以熔炼2个宝珠,每提升难度1可以多熔炼一个! | M89: blp\baseItem\gem\bz_3_1.blp | X89: 3 | Y89: Permanent | Z89: 1000 | AA89: 236 | AB89: 0 | AC89: 0 | AD89: 0 | AO89: 0 | AR89: 1
A90: OBJECT | B90: ZB63 | D90: 3 | F90: srbd | G90: ZZZY | H90: =Sheet1!R[-1]C[26] -> |CFFFFFFFF[D级宝珠]梦境石|r | I90: =Sheet1!R[-1]C[26] -> |n|cFFFFFF55附加属性|r(%)|n伤害减免:5|n|n升级途径:|cFF1BE6B8使用 |CFFB6D7A8石化水晶|r 升级|r|n需要轮回1才可熔炼|n[提示]:难度1只可以熔炼2个宝珠,每提升难度1可以多熔炼一个! | J90: =RC[-2] -> |CFFFFFFFF[D级宝珠]梦境石|r | K90: =RC[-2] -> |n|cFFFFFF55附加属性|r(%)|n伤害减免:5|n|n升级途径:|cFF1BE6B8使用 |CFFB6D7A8石化水晶|r 升级|r|n需要轮回1才可熔炼|n[提示]:难度1只可以熔炼2个宝珠,每提升难度1可以多熔炼一个! | M90: blp\baseItem\gem\bz_4_1.blp | X90: 3 | Y90: Permanent | Z90: 1000 | AA90: 236 | AB90: 0 | AC90: 0 | AD90: 0 | AO90: 0 | AR90: 1
A91: OBJECT | B91: ZB64 | D91: 3 | F91: srbd | G91: ZZZY | H91: =Sheet1!R[-1]C[26] -> |CFFFFFFFF[D级宝珠]大地石|r | I91: =Sheet1!R[-1]C[26] -> |cFFFFFF99基础属性|r|n护甲:1000|n|cFFFFFF55附加属性|r(%)|n附加伤害:10|n|n升级途径:|cFF1BE6B8使用 |CFFB6D7A8石化水晶|r 升级|r|n需要轮回1才可熔炼|n[提示]:难度1只可以熔炼2个宝珠,每提升难度1可以多熔炼一个! | J91: =RC[-2] -> |CFFFFFFFF[D级宝珠]大地石|r | K91: =RC[-2] -> |cFFFFFF99基础属性|r|n护甲:1000|n|cFFFFFF55附加属性|r(%)|n附加伤害:10|n|n升级途径:|cFF1BE6B8使用 |CFFB6D7A8石化水晶|r 升级|r|n需要轮回1才可熔炼|n[提示]:难度1只可以熔炼2个宝珠,每提升难度1可以多熔炼一个! | M91: blp\baseItem\gem\bz_5_1.blp | X91: 3 | Y91: Permanent | Z91: 1000 | AA91: 236 | AB91: 0 | AC91: 0 | AD91: 0 | AO91: 0 | AR91: 1
A92: OBJECT | B92: ZB65 | D92: 3 | F92: srbd | G92: ZZZY | H92: =Sheet1!R[-1]C[26] -> |CFFFFFFFF[D级宝珠]泰坦石|r | I92: =Sheet1!R[-1]C[26] -> |cFFFFFF99基础属性|r|n攻击:50000|n|cFFFFFF55附加属性|r(%)|n攻速:20|n|n升级途径:|cFF1BE6B8使用 |CFFB6D7A8石化水晶|r 升级|r|n需要轮回1才可熔炼|n[提示]:难度1只可以熔炼2个宝珠,每提升难度1可以多熔炼一个! | J92: =RC[-2] -> |CFFFFFFFF[D级宝珠]泰坦石|r | K92: =RC[-2] -> |cFFFFFF99基础属性|r|n攻击:50000|n|cFFFFFF55附加属性|r(%)|n攻速:20|n|n升级途径:|cFF1BE6B8使用 |CFFB6D7A8石化水晶|r 升级|r|n需要轮回1才可熔炼|n[提示]:难度1只可以熔炼2个宝珠,每提升难度1可以多熔炼一个! | M92: blp\baseItem\gem\bz_6_1.blp | X92: 3 | Y92: Permanent | Z92: 1000 | AA92: 236 | AB92: 0 | AC92: 0 | AD92: 0 | AO92: 0 | AR92: 1
A93: OBJECT | B93: ZB66 | D93: 3 | F93: srbd | G93: ZZZY | H93: =Sheet1!R[-1]C[26] -> |CFFFFFFFF[D级宝珠]枢纽石|r | I93: =Sheet1!R[-1]C[26] -> |n|cFFFFFF55附加属性|r(%)|n攻击吸血:5|n|n升级途径:|cFF1BE6B8使用 |CFFB6D7A8石化水晶|r 升级|r|n需要轮回1才可熔炼|n[提示]:难度1只可以熔炼2个宝珠,每提升难度1可以多熔炼一个! | J93: =RC[-2] -> |CFFFFFFFF[D级宝珠]枢纽石|r | K93: =RC[-2] -> |n|cFFFFFF55附加属性|r(%)|n攻击吸血:5|n|n升级途径:|cFF1BE6B8使用 |CFFB6D7A8石化水晶|r 升级|r|n需要轮回1才可熔炼|n[提示]:难度1只可以熔炼2个宝珠,每提升难度1可以多熔炼一个! | M93: blp\baseItem\gem\bz_7_1.blp | X93: 3 | Y93: Permanent | Z93: 1000 | AA93: 236 | AB93: 0 | AC93: 0 | AD93: 0 | AO93: 0 | AR93: 1
A94: OBJECT | B94: ZB67 | D94: 3 | F94: srbd | G94: ZZZY | H94: =Sheet1!R[-1]C[26] -> |CFFFFFFFF[D级宝珠]灵魂石|r | I94: =Sheet1!R[-1]C[26] -> |n|cFFFFFF55附加属性|r(%)|n暴击概率:10|n暴击伤害:10|n|n升级途径:|cFF1BE6B8使用 |CFFB6D7A8石化水晶|r 升级|r|n需要轮回1才可熔炼|n[提示]:难度1只可以熔炼2个宝珠,每提升难度1可以多熔炼一个! | J94: =RC[-2] -> |CFFFFFFFF[D级宝珠]灵魂石|r | K94: =RC[-2] -> |n|cFFFFFF55附加属性|r(%)|n暴击概率:10|n暴击伤害:10|n|n升级途径:|cFF1BE6B8使用 |CFFB6D7A8石化水晶|r 升级|r|n需要轮回1才可熔炼|n[提示]:难度1只可以熔炼2个宝珠,每提升难度1可以多熔炼一个! | M94: blp\baseItem\gem\bz_8_1.blp | X94: 3 | Y94: Permanent | Z94: 1000 | AA94: 236 | AB94: 0 | AC94: 0 | AD94: 0 | AO94: 0 | AR94: 1
A95: OBJECT | B95: ZD00 | F95: srbd | G95: null | H95: =Sheet1!R[-1]C[26] -> |CFFFFFFFF[雪山]雪花|r | I95: =Sheet1!R[-1]C[26] -> |n|cFFFFFF55附加属性|r(%)|n附加伤害:10|n雪花+冰块 = 雪山结晶 | J95: =RC[-2] -> |CFFFFFFFF[雪山]雪花|r | K95: =RC[-2] -> |n|cFFFFFF55附加属性|r(%)|n附加伤害:10|n雪花+冰块 = 雪山结晶 | M95: blp\spec_dungeon\mountain\xuehua.blp | X95: 1 | Y95: Permanent | Z95: 1000 | AA95: 233 | AB95: 0 | AC95: 0 | AD95: 0 | AO95: 0
A96: OBJECT | B96: ZD01 | F96: srbd | G96: null | H96: =Sheet1!R[-1]C[26] -> |CFFFFFFFF[雪山]冰块|r | I96: =Sheet1!R[-1]C[26] -> |n|cFFFFFF55附加属性|r(%)|n附加伤害:10|n雪花+冰块 = 雪山结晶 | J96: =RC[-2] -> |CFFFFFFFF[雪山]冰块|r | K96: =RC[-2] -> |n|cFFFFFF55附加属性|r(%)|n附加伤害:10|n雪花+冰块 = 雪山结晶 | M96: blp\spec_dungeon\mountain\bingkuai.blp | X96: 1 | Y96: Permanent | Z96: 1000 | AA96: 233 | AB96: 0 | AC96: 0 | AD96: 0 | AO96: 0
A97: OBJECT | B97: ZD02 | F97: srbd | G97: null | H97: =Sheet1!R[-1]C[26] -> |CFFB6D7A8[雪山]雪山结晶|r | I97: =Sheet1!R[-1]C[26] -> |n|cFFFFFF55附加属性|r(%)|n附加伤害:20|n雪狐皮毛+雪熊利爪+雪鸟羽毛+雪山结晶 = 雪灵之心 | J97: =RC[-2] -> |CFFB6D7A8[雪山]雪山结晶|r | K97: =RC[-2] -> |n|cFFFFFF55附加属性|r(%)|n附加伤害:20|n雪狐皮毛+雪熊利爪+雪鸟羽毛+雪山结晶 = 雪灵之心 | M97: blp\spec_dungeon\mountain\xueshanjiejing.blp | X97: 1 | Y97: Permanent | Z97: 1000 | AA97: 233 | AB97: 0 | AC97: 0 | AD97: 0 | AO97: 0
A98: OBJECT | B98: ZD03 | F98: srbd | G98: null | H98: =Sheet1!R[-1]C[26] -> |CFFB6D7A8[雪山]雪山-雪狐皮毛|r | I98: =Sheet1!R[-1]C[26] -> |n|cFFFFFF55附加属性|r(%)|n附加伤害:15|n雪狐皮毛+雪熊利爪+雪鸟羽毛+雪山结晶 = 雪灵之心 | J98: =RC[-2] -> |CFFB6D7A8[雪山]雪山-雪狐皮毛|r | K98: =RC[-2] -> |n|cFFFFFF55附加属性|r(%)|n附加伤害:15|n雪狐皮毛+雪熊利爪+雪鸟羽毛+雪山结晶 = 雪灵之心 | M98: blp\spec_dungeon\mountain\pimao.blp | X98: 1 | Y98: Permanent | Z98: 1000 | AA98: 233 | AB98: 0 | AC98: 0 | AD98: 0 | AO98: 0
A99: OBJECT | B99: ZD04 | F99: srbd | G99: null | H99: =Sheet1!R[-1]C[26] -> |CFFB6D7A8[雪山]雪山-雪熊利爪|r | I99: =Sheet1!R[-1]C[26] -> |n|cFFFFFF55附加属性|r(%)|n附加伤害:15|n雪狐皮毛+雪熊利爪+雪鸟羽毛+雪山结晶 = 雪灵之心 | J99: =RC[-2] -> |CFFB6D7A8[雪山]雪山-雪熊利爪|r | K99: =RC[-2] -> |n|cFFFFFF55附加属性|r(%)|n附加伤害:15|n雪狐皮毛+雪熊利爪+雪鸟羽毛+雪山结晶 = 雪灵之心 | M99: blp\spec_dungeon\mountain\lizhua.blp | X99: 1 | Y99: Permanent | Z99: 1000 | AA99: 233 | AB99: 0 | AC99: 0 | AD99: 0 | AO99: 0
A100: OBJECT | B100: ZD05 | F100: srbd | G100: null | H100: =Sheet1!R[-1]C[26] -> |CFFB6D7A8[雪山]雪山-雪鸟羽毛|r | I100: =Sheet1!R[-1]C[26] -> |n|cFFFFFF55附加属性|r(%)|n附加伤害:15|n雪狐皮毛+雪熊利爪+雪鸟羽毛+雪山结晶 = 雪灵之心 | J100: =RC[-2] -> |CFFB6D7A8[雪山]雪山-雪鸟羽毛|r | K100: =RC[-2] -> |n|cFFFFFF55附加属性|r(%)|n附加伤害:15|n雪狐皮毛+雪熊利爪+雪鸟羽毛+雪山结晶 = 雪灵之心 | M100: blp\spec_dungeon\mountain\yumao.blp | X100: 1 | Y100: Permanent | Z100: 1000 | AA100: 233 | AB100: 0 | AC100: 0 | AD100: 0 | AO100: 0
A101: OBJECT | B101: ZD06 | F101: srbd | G101: null | H101: =Sheet1!R[-1]C[26] -> |cFF99FF66[雪山]雪灵之心|r | I101: =Sheet1!R[-1]C[26] -> |n|cFFFFFF55附加属性|r(%)|n附加伤害:60|n雪灵之心+万年玄冰+雪山罡风+雪山古剑 = 风雪古剑 | J101: =RC[-2] -> |cFF99FF66[雪山]雪灵之心|r | K101: =RC[-2] -> |n|cFFFFFF55附加属性|r(%)|n附加伤害:60|n雪灵之心+万年玄冰+雪山罡风+雪山古剑 = 风雪古剑 | M101: blp\spec_dungeon\mountain\xuelingzhixin.blp | X101: 1 | Y101: Permanent | Z101: 1000 | AA101: 233 | AB101: 0 | AC101: 0 | AD101: 0 | AO101: 0
A102: OBJECT | B102: ZD07 | F102: srbd | G102: null | H102: =Sheet1!R[-1]C[26] -> |cFF99FF66[雪山]万年玄冰碎片-寒|r | I102: =Sheet1!R[-1]C[26] -> |n|cFFFFFF55附加属性|r(%)|n伤害减免:5|n万年玄冰碎片-寒 + 万年玄冰碎片-霜 + 万年玄冰碎片-冰 + 万年玄冰碎片-雪 + 千年玄冰 = 万年玄冰 | J102: =RC[-2] -> |cFF99FF66[雪山]万年玄冰碎片-寒|r | K102: =RC[-2] -> |n|cFFFFFF55附加属性|r(%)|n伤害减免:5|n万年玄冰碎片-寒 + 万年玄冰碎片-霜 + 万年玄冰碎片-冰 + 万年玄冰碎片-雪 + 千年玄冰 = 万年玄冰 | M102: blp\spec_dungeon\mountain\han.blp | X102: 1 | Y102: Permanent | Z102: 1000 | AA102: 233 | AB102: 0 | AC102: 0 | AD102: 0 | AO102: 0
A103: OBJECT | B103: ZD08 | F103: srbd | G103: null | H103: =Sheet1!R[-1]C[26] -> |cFF99FF66[雪山]万年玄冰碎片-霜|r | I103: =Sheet1!R[-1]C[26] -> |n|cFFFFFF55附加属性|r(%)|n伤害减免:5|n万年玄冰碎片-寒 + 万年玄冰碎片-霜 + 万年玄冰碎片-冰 + 万年玄冰碎片-雪 + 千年玄冰 = 万年玄冰 | J103: =RC[-2] -> |cFF99FF66[雪山]万年玄冰碎片-霜|r | K103: =RC[-2] -> |n|cFFFFFF55附加属性|r(%)|n伤害减免:5|n万年玄冰碎片-寒 + 万年玄冰碎片-霜 + 万年玄冰碎片-冰 + 万年玄冰碎片-雪 + 千年玄冰 = 万年玄冰 | M103: blp\spec_dungeon\mountain\shuang.blp | X103: 1 | Y103: Permanent | Z103: 1000 | AA103: 233 | AB103: 0 | AC103: 0 | AD103: 0 | AO103: 0
A104: OBJECT | B104: ZD09 | F104: srbd | G104: null | H104: =Sheet1!R[-1]C[26] -> |cFF99FF66[雪山]万年玄冰碎片-冰|r | I104: =Sheet1!R[-1]C[26] -> |n|cFFFFFF55附加属性|r(%)|n伤害减免:5|n万年玄冰碎片-寒 + 万年玄冰碎片-霜 + 万年玄冰碎片-冰 + 万年玄冰碎片-雪 + 千年玄冰 = 万年玄冰 | J104: =RC[-2] -> |cFF99FF66[雪山]万年玄冰碎片-冰|r | K104: =RC[-2] -> |n|cFFFFFF55附加属性|r(%)|n伤害减免:5|n万年玄冰碎片-寒 + 万年玄冰碎片-霜 + 万年玄冰碎片-冰 + 万年玄冰碎片-雪 + 千年玄冰 = 万年玄冰 | M104: blp\spec_dungeon\mountain\bing.blp | X104: 1 | Y104: Permanent | Z104: 1000 | AA104: 233 | AB104: 0 | AC104: 0 | AD104: 0 | AO104: 0
A105: OBJECT | B105: ZD0A | F105: srbd | G105: null | H105: =Sheet1!R[-1]C[26] -> |cFF99FF66[雪山]万年玄冰碎片-雪|r | I105: =Sheet1!R[-1]C[26] -> |n|cFFFFFF55附加属性|r(%)|n伤害减免:5|n万年玄冰碎片-寒 + 万年玄冰碎片-霜 + 万年玄冰碎片-冰 + 万年玄冰碎片-雪 + 千年玄冰 = 万年玄冰 | J105: =RC[-2] -> |cFF99FF66[雪山]万年玄冰碎片-雪|r | K105: =RC[-2] -> |n|cFFFFFF55附加属性|r(%)|n伤害减免:5|n万年玄冰碎片-寒 + 万年玄冰碎片-霜 + 万年玄冰碎片-冰 + 万年玄冰碎片-雪 + 千年玄冰 = 万年玄冰 | M105: blp\spec_dungeon\mountain\xue.blp | X105: 1 | Y105: Permanent | Z105: 1000 | AA105: 233 | AB105: 0 | AC105: 0 | AD105: 0 | AO105: 0
A106: OBJECT | B106: ZD0B | F106: srbd | G106: null | H106: =Sheet1!R[-1]C[26] -> |cFF99FF66[雪山]千年玄冰|r | I106: =Sheet1!R[-1]C[26] -> |n|cFFFFFF55附加属性|r(%)|n伤害抵抗:10|n万年玄冰碎片-寒 + 万年玄冰碎片-霜 + 万年玄冰碎片-冰 + 万年玄冰碎片-雪 + 千年玄冰 = 万年玄冰 | J106: =RC[-2] -> |cFF99FF66[雪山]千年玄冰|r | K106: =RC[-2] -> |n|cFFFFFF55附加属性|r(%)|n伤害抵抗:10|n万年玄冰碎片-寒 + 万年玄冰碎片-霜 + 万年玄冰碎片-冰 + 万年玄冰碎片-雪 + 千年玄冰 = 万年玄冰 | M106: blp\spec_dungeon\mountain\qiannianxuanbing.blp | X106: 1 | Y106: Permanent | Z106: 1000 | AA106: 233 | AB106: 0 | AC106: 0 | AD106: 0 | AO106: 0
A107: OBJECT | B107: ZD0C | F107: srbd | G107: null | H107: =Sheet1!R[-1]C[26] -> |cFF99FF66[雪山]万年玄冰|r | I107: =Sheet1!R[-1]C[26] -> |n|cFFFFFF55附加属性|r(%)|n伤害抵抗:10|n伤害减免:15|n雪灵之心+万年玄冰+雪山罡风+雪山古剑 = 风雪古剑 | J107: =RC[-2] -> |cFF99FF66[雪山]万年玄冰|r | K107: =RC[-2] -> |n|cFFFFFF55附加属性|r(%)|n伤害抵抗:10|n伤害减免:15|n雪灵之心+万年玄冰+雪山罡风+雪山古剑 = 风雪古剑 | M107: blp\spec_dungeon\mountain\wannianxuanbing.blp | X107: 1 | Y107: Permanent | Z107: 1000 | AA107: 233 | AB107: 0 | AC107: 0 | AD107: 0 | AO107: 0
A108: OBJECT | B108: ZD0D | F108: srbd | G108: null | H108: =Sheet1!R[-1]C[26] -> |cFF99FF66[雪山]雪山罡风|r | I108: =Sheet1!R[-1]C[26] -> |n|cFFFFFF55附加属性|r(%)|n暴击伤害:60|n雪灵之心+万年玄冰+雪山罡风+雪山古剑 = 风雪古剑 | J108: =RC[-2] -> |cFF99FF66[雪山]雪山罡风|r | K108: =RC[-2] -> |n|cFFFFFF55附加属性|r(%)|n暴击伤害:60|n雪灵之心+万年玄冰+雪山罡风+雪山古剑 = 风雪古剑 | M108: blp\spec_dungeon\mountain\xueshangangfeng.blp | X108: 1 | Y108: Permanent | Z108: 1000 | AA108: 233 | AB108: 0 | AC108: 0 | AD108: 0 | AO108: 0
A109: OBJECT | B109: ZD0E | F109: srbd | G109: null | H109: =Sheet1!R[-1]C[26] -> |cFF99FF66[雪山]雪山古剑|r | I109: =Sheet1!R[-1]C[26] -> |cFFFFFF99基础属性|r|n攻击:1000000|n|cFFFFFF55附加属性|r(%)|n暴击概率:25|n雪灵之心+万年玄冰+雪山罡风+雪山古剑 = 风雪古剑 | J109: =RC[-2] -> |cFF99FF66[雪山]雪山古剑|r | K109: =RC[-2] -> |cFFFFFF99基础属性|r|n攻击:1000000|n|cFFFFFF55附加属性|r(%)|n暴击概率:25|n雪灵之心+万年玄冰+雪山罡风+雪山古剑 = 风雪古剑 | M109: blp\spec_dungeon\mountain\xueshangujian.blp | X109: 1 | Y109: Permanent | Z109: 1000 | AA109: 233 | AB109: 0 | AC109: 0 | AD109: 0 | AO109: 0
A110: OBJECT | B110: ZD0F | F110: srbd | G110: null | H110: =Sheet1!R[-1]C[26] -> |cFF99FF66[雪山]风雪古剑|r | I110: =Sheet1!R[-1]C[26] -> |cFFFFFF99基础属性|r|n攻击:1000000|n|cFFFFFF55附加属性|r(%)|n暴击概率:25|n暴击伤害:60|n附加伤害:60|n伤害抵抗:10|n伤害减免:15|n非常强力的一把古剑,不过剑上似乎存在神秘的封印! | J110: =RC[-2] -> |cFF99FF66[雪山]风雪古剑|r | K110: =RC[-2] -> |cFFFFFF99基础属性|r|n攻击:1000000|n|cFFFFFF55附加属性|r(%)|n暴击概率:25|n暴击伤害:60|n附加伤害:60|n伤害抵抗:10|n伤害减免:15|n非常强力的一把古剑,不过剑上似乎存在神秘的封印! | M110: blp\spec_dungeon\mountain\fengxuegujian.blp | X110: 1 | Y110: Permanent | Z110: 1000 | AA110: 233 | AB110: 0 | AC110: 0 | AD110: 0 | AO110: 0
A111: OBJECT | B111: ZD0G | F111: srbd | G111: null | H111: =Sheet1!R[-1]C[26] -> |cFF99FF66[雪山]公主之心|r | I111: =Sheet1!R[-1]C[26] -> |n|cFFFFFF55附加属性|r(%)|n攻击吸血:1|n暴击伤害:10|n公主之心! | J111: =RC[-2] -> |cFF99FF66[雪山]公主之心|r | K111: =RC[-2] -> |n|cFFFFFF55附加属性|r(%)|n攻击吸血:1|n暴击伤害:10|n公主之心! | M111: blp\spec_dungeon\mountain\shaonvzhixin.blp | X111: 1 | Y111: Permanent | Z111: 1000 | AA111: 233 | AB111: 0 | AC111: 0 | AD111: 0 | AO111: 0
A112: OBJECT | B112: ZD0H | F112: srbd | G112: A007 | H112: =Sheet1!R[-1]C[26] -> |cFF99FF66[雪山]公主之信|r | I112: =Sheet1!R[-1]C[26] -> |n公主的信件,似乎上面画着一幅地图. | J112: =RC[-2] -> |cFF99FF66[雪山]公主之信|r | K112: =RC[-2] -> |n公主的信件,似乎上面画着一幅地图. | M112: blp\spec_dungeon\mountain\xin.blp | X112: 1 | Y112: Permanent | Z112: 1000 | AA112: 233 | AB112: 0 | AC112: 0 | AD112: 0 | AM112: 0 | AO112: 0 | AR112: 1
A113: OBJECT | B113: ZD0I | F113: srbd | G113: null | H113: =Sheet1!R[-1]C[26] -> |cFF99FF66[雪山]公主爱心|r | I113: =Sheet1!R[-1]C[26] -> |n|cFFFFFF55附加属性|r(%)|n攻击吸血:2|n暴击伤害:20|n公主的爱心! | J113: =RC[-2] -> |cFF99FF66[雪山]公主爱心|r | K113: =RC[-2] -> |n|cFFFFFF55附加属性|r(%)|n攻击吸血:2|n暴击伤害:20|n公主的爱心! | M113: blp\spec_dungeon\mountain\anyi.blp | X113: 1 | Y113: Permanent | Z113: 1000 | AA113: 233 | AB113: 0 | AC113: 0 | AD113: 0 | AM113: 0 | AO113: 0
A114: OBJECT | B114: ZD0J | F114: srbd | G114: null | H114: =Sheet1!R[-1]C[26] -> |cFFFF9933[雪山]风雪神剑|r | I114: =Sheet1!R[-1]C[26] -> |cFFFFFF99基础属性|r|n攻击:2000000|n护甲:5000|n|cFFFFFF55附加属性|r(%)|n攻击吸血:5|n暴击概率:25|n暴击伤害:80|n附加伤害:60|n伤害抵抗:10|n伤害减免:20|n风雪神剑! | J114: =RC[-2] -> |cFFFF9933[雪山]风雪神剑|r | K114: =RC[-2] -> |cFFFFFF99基础属性|r|n攻击:2000000|n护甲:5000|n|cFFFFFF55附加属性|r(%)|n攻击吸血:5|n暴击概率:25|n暴击伤害:80|n附加伤害:60|n伤害抵抗:10|n伤害减免:20|n风雪神剑! | M114: blp\spec_dungeon\mountain\fengxueshengjian2.blp | X114: 1 | Y114: Permanent | Z114: 1000 | AA114: 233 | AB114: 0 | AC114: 0 | AD114: 0 | AM114: 0 | AO114: 0
A115: OBJECT | B115: ZD0K | F115: srbd | G115: null | H115: =Sheet1!R[-1]C[26] -> |cFFFF9933[雪山]风雪圣剑|r | I115: =Sheet1!R[-1]C[26] -> |cFFFFFF99基础属性|r|n攻击:2500000|n护甲:5000|n|cFFFFFF55附加属性|r(%)|n攻击吸血:5|n暴击概率:25|n暴击伤害:130|n附加伤害:60|n伤害抵抗:10|n伤害减免:20|n充满公主爱意的风雪圣剑! | J115: =RC[-2] -> |cFFFF9933[雪山]风雪圣剑|r | K115: =RC[-2] -> |cFFFFFF99基础属性|r|n攻击:2500000|n护甲:5000|n|cFFFFFF55附加属性|r(%)|n攻击吸血:5|n暴击概率:25|n暴击伤害:130|n附加伤害:60|n伤害抵抗:10|n伤害减免:20|n充满公主爱意的风雪圣剑! | M115: blp\spec_dungeon\mountain\fengxueshengjian1.blp | X115: 1 | Y115: Permanent | Z115: 1000 | AA115: 233 | AB115: 0 | AC115: 0 | AD115: 0 | AM115: 0 | AO115: 0
A116: OBJECT | B116: ZD0L | F116: srbd | G116: null | H116: =Sheet1!R[-1]C[26] -> |cFF99FF66[雪山]神秘的少女裙子|r | I116: =Sheet1!R[-1]C[26] -> |cFFFFFF99基础属性|r|n护甲:1000|n|cFFFFFF55附加属性|r(%)|n暴击伤害:5|n伤害减免:2|n一件女装,似乎是某个礼服的一部分! | J116: =RC[-2] -> |cFF99FF66[雪山]神秘的少女裙子|r | K116: =RC[-2] -> |cFFFFFF99基础属性|r|n护甲:1000|n|cFFFFFF55附加属性|r(%)|n暴击伤害:5|n伤害减免:2|n一件女装,似乎是某个礼服的一部分! | M116: blp\spec_dungeon\mountain\qunzi.blp | X116: 1 | Y116: Permanent | Z116: 1000 | AA116: 233 | AB116: 0 | AC116: 0 | AD116: 0 | AO116: 0
A117: OBJECT | B117: ZD0M | F117: srbd | G117: null | H117: =Sheet1!R[-1]C[26] -> |cFF99FF66[雪山]神秘的少女鞋子|r | I117: =Sheet1!R[-1]C[26] -> |cFFFFFF99基础属性|r|n护甲:1000|n|cFFFFFF55附加属性|r(%)|n暴击伤害:5|n伤害减免:2|n一件女装,似乎是某个礼服的一部分! | J117: =RC[-2] -> |cFF99FF66[雪山]神秘的少女鞋子|r | K117: =RC[-2] -> |cFFFFFF99基础属性|r|n护甲:1000|n|cFFFFFF55附加属性|r(%)|n暴击伤害:5|n伤害减免:2|n一件女装,似乎是某个礼服的一部分! | M117: blp\spec_dungeon\mountain\xie.blp | X117: 1 | Y117: Permanent | Z117: 1000 | AA117: 233 | AB117: 0 | AC117: 0 | AD117: 0 | AO117: 0
A118: OBJECT | B118: ZD0N | F118: srbd | G118: null | H118: =Sheet1!R[-1]C[26] -> |cFF99FF66[雪山]神秘的少女衣服|r | I118: =Sheet1!R[-1]C[26] -> |cFFFFFF99基础属性|r|n护甲:1000|n|cFFFFFF55附加属性|r(%)|n暴击伤害:5|n伤害减免:2|n一件女装,似乎是某个礼服的一部分! | J118: =RC[-2] -> |cFF99FF66[雪山]神秘的少女衣服|r | K118: =RC[-2] -> |cFFFFFF99基础属性|r|n护甲:1000|n|cFFFFFF55附加属性|r(%)|n暴击伤害:5|n伤害减免:2|n一件女装,似乎是某个礼服的一部分! | M118: blp\spec_dungeon\mountain\yifu.blp | X118: 1 | Y118: Permanent | Z118: 1000 | AA118: 233 | AB118: 0 | AC118: 0 | AD118: 0 | AO118: 0
A119: OBJECT | B119: ZD0O | F119: srbd | G119: A009 | H119: =Sheet1!R[-1]C[26] -> |cFF99FF66[雪山]神秘的少女礼服|r | I119: =Sheet1!R[-1]C[26] -> |cFFFFFF99基础属性|r|n护甲:5000|n|cFFFFFF55附加属性|r(%)|n暴击伤害:20|n伤害减免:5|n一套女装,要不穿穿看? | J119: =RC[-2] -> |cFF99FF66[雪山]神秘的少女礼服|r | K119: =RC[-2] -> |cFFFFFF99基础属性|r|n护甲:5000|n|cFFFFFF55附加属性|r(%)|n暴击伤害:20|n伤害减免:5|n一套女装,要不穿穿看? | M119: blp\spec_dungeon\mountain\shaonvdeyifu.blp | X119: 1 | Y119: Permanent | Z119: 1000 | AA119: 233 | AB119: 0 | AC119: 0 | AD119: 0 | AO119: 0 | AR119: 1
A120: OBJECT | B120: ZD0P | F120: srbd | G120: null | H120: =Sheet1!R[-1]C[26] -> |CFFFFFFFF[扭曲神殿]扭曲魔石|r | I120: =Sheet1!R[-1]C[26] -> |n|cFFFFFF55附加属性|r(%)|n伤害抵抗:3|n力量增幅:2|n敏捷增幅:2|n智力增幅:2|n扭曲魔石+扭曲妖石+扭曲邪石+扭曲怪石 = 扭曲结晶 | J120: =RC[-2] -> |CFFFFFFFF[扭曲神殿]扭曲魔石|r | K120: =RC[-2] -> |n|cFFFFFF55附加属性|r(%)|n伤害抵抗:3|n力量增幅:2|n敏捷增幅:2|n智力增幅:2|n扭曲魔石+扭曲妖石+扭曲邪石+扭曲怪石 = 扭曲结晶 | M120: blp\spec_dungeon\temple\niuqumoshi.blp | X120: 1 | Y120: Permanent | Z120: 1000 | AA120: 233 | AB120: 0 | AC120: 0 | AD120: 0 | AO120: 0
A121: OBJECT | B121: ZD0Q | F121: srbd | G121: null | H121: =Sheet1!R[-1]C[26] -> |CFFFFFFFF[扭曲神殿]扭曲妖石|r | I121: =Sheet1!R[-1]C[26] -> |n|cFFFFFF55附加属性|r(%)|n伤害抵抗:3|n力量增幅:2|n敏捷增幅:2|n智力增幅:2|n扭曲魔石+扭曲妖石+扭曲邪石+扭曲怪石 = 扭曲结晶 | J121: =RC[-2] -> |CFFFFFFFF[扭曲神殿]扭曲妖石|r | K121: =RC[-2] -> |n|cFFFFFF55附加属性|r(%)|n伤害抵抗:3|n力量增幅:2|n敏捷增幅:2|n智力增幅:2|n扭曲魔石+扭曲妖石+扭曲邪石+扭曲怪石 = 扭曲结晶 | M121: blp\spec_dungeon\temple\niuquyaoshi.blp | X121: 1 | Y121: Permanent | Z121: 1000 | AA121: 233 | AB121: 0 | AC121: 0 | AD121: 0 | AO121: 0
A122: OBJECT | B122: ZD0R | F122: srbd | G122: null | H122: =Sheet1!R[-1]C[26] -> |CFFFFFFFF[扭曲神殿]扭曲邪石|r | I122: =Sheet1!R[-1]C[26] -> |n|cFFFFFF55附加属性|r(%)|n伤害抵抗:3|n力量增幅:2|n敏捷增幅:2|n智力增幅:2|n扭曲魔石+扭曲妖石+扭曲邪石+扭曲怪石 = 扭曲结晶 | J122: =RC[-2] -> |CFFFFFFFF[扭曲神殿]扭曲邪石|r | K122: =RC[-2] -> |n|cFFFFFF55附加属性|r(%)|n伤害抵抗:3|n力量增幅:2|n敏捷增幅:2|n智力增幅:2|n扭曲魔石+扭曲妖石+扭曲邪石+扭曲怪石 = 扭曲结晶 | M122: blp\spec_dungeon\temple\niuquxieshi.blp | X122: 1 | Y122: Permanent | Z122: 1000 | AA122: 233 | AB122: 0 | AC122: 0 | AD122: 0 | AO122: 0
A123: OBJECT | B123: ZD0S | F123: srbd | G123: null | H123: =Sheet1!R[-1]C[26] -> |CFFFFFFFF[扭曲神殿]扭曲怪石|r | I123: =Sheet1!R[-1]C[26] -> |n|cFFFFFF55附加属性|r(%)|n伤害抵抗:3|n力量增幅:2|n敏捷增幅:2|n智力增幅:2|n扭曲魔石+扭曲妖石+扭曲邪石+扭曲怪石 = 扭曲结晶 | J123: =RC[-2] -> |CFFFFFFFF[扭曲神殿]扭曲怪石|r | K123: =RC[-2] -> |n|cFFFFFF55附加属性|r(%)|n伤害抵抗:3|n力量增幅:2|n敏捷增幅:2|n智力增幅:2|n扭曲魔石+扭曲妖石+扭曲邪石+扭曲怪石 = 扭曲结晶 | M123: blp\spec_dungeon\temple\niuquguaishi.blp | X123: 1 | Y123: Permanent | Z123: 1000 | AA123: 233 | AB123: 0 | AC123: 0 | AD123: 0 | AO123: 0
A124: OBJECT | B124: ZD0T | F124: srbd | G124: null | H124: =Sheet1!R[-1]C[26] -> |cFF99FF66[扭曲神殿]扭曲结晶|r | I124: =Sheet1!R[-1]C[26] -> |n|cFFFFFF55附加属性|r(%)|n伤害抵抗:10|n力量增幅:6|n敏捷增幅:6|n智力增幅:6|n扭曲结晶+扭曲金属+虚空魔石 = 扭曲虚空之核 | J124: =RC[-2] -> |cFF99FF66[扭曲神殿]扭曲结晶|r | K124: =RC[-2] -> |n|cFFFFFF55附加属性|r(%)|n伤害抵抗:10|n力量增幅:6|n敏捷增幅:6|n智力增幅:6|n扭曲结晶+扭曲金属+虚空魔石 = 扭曲虚空之核 | M124: blp\spec_dungeon\temple\niuqujiejing.blp | X124: 1 | Y124: Permanent | Z124: 1000 | AA124: 233 | AB124: 0 | AC124: 0 | AD124: 0 | AO124: 0
A125: OBJECT | B125: ZD0U | F125: srbd | G125: null | H125: =Sheet1!R[-1]C[26] -> |CFFB6D7A8[扭曲神殿]扭曲的书|r | I125: =Sheet1!R[-1]C[26] -> |cFFFFFF99基础属性|r|n力量:50000|n敏捷:50000|n智力:50000|n|cFFFFFF55附加属性|r(%)|n伤害增幅:10|n扭曲的书+扭曲的枪+扭曲的棒+扭曲的杖 = 扭曲金属 | J125: =RC[-2] -> |CFFB6D7A8[扭曲神殿]扭曲的书|r | K125: =RC[-2] -> |cFFFFFF99基础属性|r|n力量:50000|n敏捷:50000|n智力:50000|n|cFFFFFF55附加属性|r(%)|n伤害增幅:10|n扭曲的书+扭曲的枪+扭曲的棒+扭曲的杖 = 扭曲金属 | M125: blp\spec_dungeon\temple\niuqudeshu.blp | X125: 1 | Y125: Permanent | Z125: 1000 | AA125: 233 | AB125: 0 | AC125: 0 | AD125: 0 | AO125: 0
A126: OBJECT | B126: ZD0V | F126: srbd | G126: null | H126: =Sheet1!R[-1]C[26] -> |CFFB6D7A8[扭曲神殿]扭曲的枪|r | I126: =Sheet1!R[-1]C[26] -> |cFFFFFF99基础属性|r|n攻击:150000|n|cFFFFFF55附加属性|r(%)|n伤害增幅:10|n扭曲的书+扭曲的枪+扭曲的棒+扭曲的杖 = 扭曲金属 | J126: =RC[-2] -> |CFFB6D7A8[扭曲神殿]扭曲的枪|r | K126: =RC[-2] -> |cFFFFFF99基础属性|r|n攻击:150000|n|cFFFFFF55附加属性|r(%)|n伤害增幅:10|n扭曲的书+扭曲的枪+扭曲的棒+扭曲的杖 = 扭曲金属 | M126: blp\spec_dungeon\temple\niuqudeqiang.blp | X126: 1 | Y126: Permanent | Z126: 1000 | AA126: 233 | AB126: 0 | AC126: 0 | AD126: 0 | AO126: 0
A127: OBJECT | B127: ZD0W | F127: srbd | G127: null | H127: =Sheet1!R[-1]C[26] -> |CFFB6D7A8[扭曲神殿]扭曲的棒|r | I127: =Sheet1!R[-1]C[26] -> |cFFFFFF99基础属性|r|n攻击:150000|n|cFFFFFF55附加属性|r(%)|n伤害增幅:10|n扭曲的书+扭曲的枪+扭曲的棒+扭曲的杖 = 扭曲金属 | J127: =RC[-2] -> |CFFB6D7A8[扭曲神殿]扭曲的棒|r | K127: =RC[-2] -> |cFFFFFF99基础属性|r|n攻击:150000|n|cFFFFFF55附加属性|r(%)|n伤害增幅:10|n扭曲的书+扭曲的枪+扭曲的棒+扭曲的杖 = 扭曲金属 | M127: blp\spec_dungeon\temple\niuqudebang.blp | X127: 1 | Y127: Permanent | Z127: 1000 | AA127: 233 | AB127: 0 | AC127: 0 | AD127: 0 | AO127: 0
A128: OBJECT | B128: ZD0X | F128: srbd | G128: null | H128: =Sheet1!R[-1]C[26] -> |CFFB6D7A8[扭曲神殿]扭曲的杖|r | I128: =Sheet1!R[-1]C[26] -> |cFFFFFF99基础属性|r|n力量:50000|n敏捷:50000|n智力:50000|n|cFFFFFF55附加属性|r(%)|n伤害增幅:10|n扭曲的书+扭曲的枪+扭曲的棒+扭曲的杖 = 扭曲金属 | J128: =RC[-2] -> |CFFB6D7A8[扭曲神殿]扭曲的杖|r | K128: =RC[-2] -> |cFFFFFF99基础属性|r|n力量:50000|n敏捷:50000|n智力:50000|n|cFFFFFF55附加属性|r(%)|n伤害增幅:10|n扭曲的书+扭曲的枪+扭曲的棒+扭曲的杖 = 扭曲金属 | M128: blp\spec_dungeon\temple\niuqudezhang.blp | X128: 1 | Y128: Permanent | Z128: 1000 | AA128: 233 | AB128: 0 | AC128: 0 | AD128: 0 | AO128: 0
A129: OBJECT | B129: ZD0Y | F129: srbd | G129: null | H129: =Sheet1!R[-1]C[26] -> |cFF99FF66[扭曲神殿]扭曲金属|r | I129: =Sheet1!R[-1]C[26] -> |cFFFFFF99基础属性|r|n攻击:300000|n力量:100000|n敏捷:100000|n智力:100000|n|cFFFFFF55附加属性|r(%)|n伤害增幅:40|n扭曲结晶+扭曲金属+虚空魔石 = 扭曲虚空之核 | J129: =RC[-2] -> |cFF99FF66[扭曲神殿]扭曲金属|r | K129: =RC[-2] -> |cFFFFFF99基础属性|r|n攻击:300000|n力量:100000|n敏捷:100000|n智力:100000|n|cFFFFFF55附加属性|r(%)|n伤害增幅:40|n扭曲结晶+扭曲金属+虚空魔石 = 扭曲虚空之核 | M129: blp\spec_dungeon\temple\niuqujinshu.blp | X129: 1 | Y129: Permanent | Z129: 1000 | AA129: 233 | AB129: 0 | AC129: 0 | AD129: 0 | AO129: 0
A130: OBJECT | B130: ZD0Z | F130: srbd | G130: null | H130: =Sheet1!R[-1]C[26] -> |cFF99FF66[扭曲神殿]虚空水晶|r | I130: =Sheet1!R[-1]C[26] -> |cFFFFFF99基础属性|r|n力量:300000|n敏捷:300000|n智力:300000|n|cFFFFFF55附加属性|r(%)|n伤害减免:20|n虚空水晶+虚空触角 = 虚空魔石 | J130: =RC[-2] -> |cFF99FF66[扭曲神殿]虚空水晶|r | K130: =RC[-2] -> |cFFFFFF99基础属性|r|n力量:300000|n敏捷:300000|n智力:300000|n|cFFFFFF55附加属性|r(%)|n伤害减免:20|n虚空水晶+虚空触角 = 虚空魔石 | M130: blp\spec_dungeon\temple\xukongshuijing.blp | X130: 1 | Y130: Permanent | Z130: 1000 | AA130: 233 | AB130: 0 | AC130: 0 | AD130: 0 | AO130: 0
A131: OBJECT | B131: ZD10 | F131: srbd | G131: null | H131: =Sheet1!R[-1]C[26] -> |cFF99FF66[扭曲神殿]虚空触角|r | I131: =Sheet1!R[-1]C[26] -> |n|cFFFFFF55附加属性|r(%)|n力量增幅:5|n敏捷增幅:5|n智力增幅:5|n虚空水晶+虚空触角 = 虚空魔石 | J131: =RC[-2] -> |cFF99FF66[扭曲神殿]虚空触角|r | K131: =RC[-2] -> |n|cFFFFFF55附加属性|r(%)|n力量增幅:5|n敏捷增幅:5|n智力增幅:5|n虚空水晶+虚空触角 = 虚空魔石 | M131: blp\spec_dungeon\temple\xukongchujiao.blp | X131: 1 | Y131: Permanent | Z131: 1000 | AA131: 233 | AB131: 0 | AC131: 0 | AD131: 0 | AO131: 0
A132: OBJECT | B132: ZD11 | F132: srbd | G132: null | H132: =Sheet1!R[-1]C[26] -> |cFF99FF66[扭曲神殿]虚空魔石|r | I132: =Sheet1!R[-1]C[26] -> |cFFFFFF99基础属性|r|n力量:400000|n敏捷:400000|n智力:400000|n|cFFFFFF55附加属性|r(%)|n伤害减免:20|n力量增幅:5|n敏捷增幅:5|n智力增幅:5|n扭曲结晶+扭曲金属+虚空魔石 = 扭曲虚空之核 | J132: =RC[-2] -> |cFF99FF66[扭曲神殿]虚空魔石|r | K132: =RC[-2] -> |cFFFFFF99基础属性|r|n力量:400000|n敏捷:400000|n智力:400000|n|cFFFFFF55附加属性|r(%)|n伤害减免:20|n力量增幅:5|n敏捷增幅:5|n智力增幅:5|n扭曲结晶+扭曲金属+虚空魔石 = 扭曲虚空之核 | M132: blp\spec_dungeon\temple\xukongmoshi.blp | X132: 1 | Y132: Permanent | Z132: 1000 | AA132: 233 | AB132: 0 | AC132: 0 | AD132: 0 | AO132: 0
A133: OBJECT | B133: ZD12 | F133: srbd | G133: null | H133: =Sheet1!R[-1]C[26] -> |cFF99FF66[扭曲神殿]扭曲虚空之核|r | I133: =Sheet1!R[-1]C[26] -> |cFFFFFF99基础属性|r|n力量:500000|n敏捷:500000|n智力:500000|n|cFFFFFF55附加属性|r(%)|n伤害增幅:40|n伤害抵抗:10|n伤害减免:30|n力量增幅:10|n敏捷增幅:10|n智力增幅:10|n拥有奇特力量的宝石,不过似乎不太稳定! | J133: =RC[-2] -> |cFF99FF66[扭曲神殿]扭曲虚空之核|r | K133: =RC[-2] -> |cFFFFFF99基础属性|r|n力量:500000|n敏捷:500000|n智力:500000|n|cFFFFFF55附加属性|r(%)|n伤害增幅:40|n伤害抵抗:10|n伤害减免:30|n力量增幅:10|n敏捷增幅:10|n智力增幅:10|n拥有奇特力量的宝石,不过似乎不太稳定! | M133: blp\spec_dungeon\temple\niuquxukongzhihe.blp | X133: 1 | Y133: Permanent | Z133: 1000 | AA133: 233 | AB133: 0 | AC133: 0 | AD133: 0 | AO133: 0
A134: OBJECT | B134: ZD13 | F134: srbd | G134: null | H134: =Sheet1!R[-1]C[26] -> |cFF99FF66[扭曲神殿]熔火熔岩|r | I134: =Sheet1!R[-1]C[26] -> |n|cFFFFFF55附加属性|r(%)|n伤害减免:10|n力量增幅:5|n敏捷增幅:5|n智力增幅:5|n拥有极高温度的熔岩! | J134: =RC[-2] -> |cFF99FF66[扭曲神殿]熔火熔岩|r | K134: =RC[-2] -> |n|cFFFFFF55附加属性|r(%)|n伤害减免:10|n力量增幅:5|n敏捷增幅:5|n智力增幅:5|n拥有极高温度的熔岩! | M134: blp\spec_dungeon\temple\ronghuorongyan.blp | X134: 1 | Y134: Permanent | Z134: 1000 | AA134: 233 | AB134: 0 | AC134: 0 | AD134: 0 | AM134: 0 | AO134: 0
A135: OBJECT | B135: ZD14 | F135: srbd | G135: null | H135: =Sheet1!R[-1]C[26] -> |cFFFF9933[扭曲神殿]扭曲虚空魔核|r | I135: =Sheet1!R[-1]C[26] -> |cFFFFFF99基础属性|r|n力量:500000|n敏捷:500000|n智力:500000|n|cFFFFFF55附加属性|r(%)|n伤害增幅:40|n伤害抵抗:10|n伤害减免:50|n力量增幅:15|n敏捷增幅:15|n智力增幅:15|n拥有奇特力量的宝石,拥有着不可思议的力量! | J135: =RC[-2] -> |cFFFF9933[扭曲神殿]扭曲虚空魔核|r | K135: =RC[-2] -> |cFFFFFF99基础属性|r|n力量:500000|n敏捷:500000|n智力:500000|n|cFFFFFF55附加属性|r(%)|n伤害增幅:40|n伤害抵抗:10|n伤害减免:50|n力量增幅:15|n敏捷增幅:15|n智力增幅:15|n拥有奇特力量的宝石,拥有着不可思议的力量! | M135: blp\spec_dungeon\temple\niuquxukongmohe.blp | X135: 1 | Y135: Permanent | Z135: 1000 | AA135: 233 | AB135: 0 | AC135: 0 | AD135: 0 | AM135: 0 | AO135: 0
A136: OBJECT | B136: ZD15 | F136: srbd | G136: null | H136: =Sheet1!R[-1]C[26] -> |cFF99FF66[上古之神-克苏恩]死亡之钉|r | I136: =Sheet1!R[-1]C[26] -> |cFFFFFF99基础属性|r|n攻击:2000000|n|cFFFFFF55附加属性|r(%)|n暴击伤害:100 | J136: =RC[-2] -> |cFF99FF66[上古之神-克苏恩]死亡之钉|r | K136: =RC[-2] -> |cFFFFFF99基础属性|r|n攻击:2000000|n|cFFFFFF55附加属性|r(%)|n暴击伤害:100 | M136: ="blp\old_god\"&RC[-11]&".blp" -> blp\old_god\ZD15.blp | X136: 1 | Y136: Permanent | Z136: 1000 | AA136: 233 | AB136: 0 | AC136: 0 | AD136: 0 | AO136: 0
A137: OBJECT | B137: ZD16 | F137: srbd | G137: null | H137: =Sheet1!R[-1]C[26] -> |cFF99FF66[上古之神-克苏恩]克苏恩之眼|r | I137: =Sheet1!R[-1]C[26] -> |cFFFFFF99基础属性|r|n力量:1000000|n力量增幅:25 | J137: =RC[-2] -> |cFF99FF66[上古之神-克苏恩]克苏恩之眼|r | K137: =RC[-2] -> |cFFFFFF99基础属性|r|n力量:1000000|n力量增幅:25 | M137: ="blp\old_god\"&RC[-11]&".blp" -> blp\old_god\ZD16.blp | X137: 1 | Y137: Permanent | Z137: 1000 | AA137: 233 | AB137: 0 | AC137: 0 | AD137: 0 | AO137: 0
A138: OBJECT | B138: ZD17 | F138: srbd | G138: null | H138: =Sheet1!R[-1]C[26] -> |cFF99FF66[上古之神-克苏恩]堕落神明披风|r | I138: =Sheet1!R[-1]C[26] -> |cFFFFFF99基础属性|r|n敏捷:1000000|n敏捷增幅:25 | J138: =RC[-2] -> |cFF99FF66[上古之神-克苏恩]堕落神明披风|r | K138: =RC[-2] -> |cFFFFFF99基础属性|r|n敏捷:1000000|n敏捷增幅:25 | M138: ="blp\old_god\"&RC[-11]&".blp" -> blp\old_god\ZD17.blp | X138: 1 | Y138: Permanent | Z138: 1000 | AA138: 233 | AB138: 0 | AC138: 0 | AD138: 0 | AO138: 0
A139: OBJECT | B139: ZD18 | F139: srbd | G139: null | H139: =Sheet1!R[-1]C[26] -> |cFF99FF66[上古之神-克苏恩]上古之神的拥抱|r | I139: =Sheet1!R[-1]C[26] -> |cFFFFFF99基础属性|r|n攻击:1000000|n力量:300000|n敏捷:300000|n智力:300000|n附加伤害:20 | J139: =RC[-2] -> |cFF99FF66[上古之神-克苏恩]上古之神的拥抱|r | K139: =RC[-2] -> |cFFFFFF99基础属性|r|n攻击:1000000|n力量:300000|n敏捷:300000|n智力:300000|n附加伤害:20 | M139: ="blp\old_god\"&RC[-11]&".blp" -> blp\old_god\ZD18.blp | X139: 1 | Y139: Permanent | Z139: 1000 | AA139: 233 | AB139: 0 | AC139: 0 | AD139: 0 | AO139: 0
A140: OBJECT | B140: ZD19 | F140: srbd | G140: null | H140: =Sheet1!R[-1]C[26] -> |cFF99FF66[上古之神-尤格萨隆]千喉坠饰|r | I140: =Sheet1!R[-1]C[26] -> |cFFFFFF99基础属性|r|n敏捷:1000000|n敏捷增幅:25 | J140: =RC[-2] -> |cFF99FF66[上古之神-尤格萨隆]千喉坠饰|r | K140: =RC[-2] -> |cFFFFFF99基础属性|r|n敏捷:1000000|n敏捷增幅:25 | M140: ="blp\old_god\"&RC[-11]&".blp" -> blp\old_god\ZD19.blp | X140: 1 | Y140: Permanent | Z140: 1000 | AA140: 233 | AB140: 0 | AC140: 0 | AD140: 0 | AO140: 0
A141: OBJECT | B141: ZD1A | F141: srbd | G141: null | H141: =Sheet1!R[-1]C[26] -> |cFF99FF66[上古之神-尤格萨隆]贪欲者胸甲|r | I141: =Sheet1!R[-1]C[26] -> |cFFFFFF99基础属性|r|n血量:6500000 | J141: =RC[-2] -> |cFF99FF66[上古之神-尤格萨隆]贪欲者胸甲|r | K141: =RC[-2] -> |cFFFFFF99基础属性|r|n血量:6500000 | M141: ="blp\old_god\"&RC[-11]&".blp" -> blp\old_god\ZD1A.blp | X141: 1 | Y141: Permanent | Z141: 1000 | AA141: 233 | AB141: 0 | AC141: 0 | AD141: 0 | AO141: 0
A142: OBJECT | B142: ZD1B | F142: srbd | G142: null | H142: =Sheet1!R[-1]C[26] -> |cFF99FF66[上古之神-尤格萨隆]堕落神明之刃|r | I142: =Sheet1!R[-1]C[26] -> |cFFFFFF99基础属性|r|n攻击:1500000|n|cFFFFFF55附加属性|r(%)|n暴击概率:35 | J142: =RC[-2] -> |cFF99FF66[上古之神-尤格萨隆]堕落神明之刃|r | K142: =RC[-2] -> |cFFFFFF99基础属性|r|n攻击:1500000|n|cFFFFFF55附加属性|r(%)|n暴击概率:35 | M142: ="blp\old_god\"&RC[-11]&".blp" -> blp\old_god\ZD1B.blp | X142: 1 | Y142: Permanent | Z142: 1000 | AA142: 233 | AB142: 0 | AC142: 0 | AD142: 0 | AO142: 0
A143: OBJECT | B143: ZD1C | F143: srbd | G143: null | H143: =Sheet1!R[-1]C[26] -> |cFF99FF66[上古之神-尤格萨隆]上古之神的低语|r | I143: =Sheet1!R[-1]C[26] -> |n|cFFFFFF55附加属性|r(%)|n暴击伤害:30|n伤害增幅:30|n附加伤害:30 | J143: =RC[-2] -> |cFF99FF66[上古之神-尤格萨隆]上古之神的低语|r | K143: =RC[-2] -> |n|cFFFFFF55附加属性|r(%)|n暴击伤害:30|n伤害增幅:30|n附加伤害:30 | M143: ="blp\old_god\"&RC[-11]&".blp" -> blp\old_god\ZD1C.blp | X143: 1 | Y143: Permanent | Z143: 1000 | AA143: 233 | AB143: 0 | AC143: 0 | AD143: 0 | AO143: 0
A144: OBJECT | B144: ZD1D | F144: srbd | G144: null | H144: =Sheet1!R[-1]C[26] -> |cFF99FF66[上古之神-亚煞极]狂怒之刃|r | I144: =Sheet1!R[-1]C[26] -> |cFFFFFF99基础属性|r|n攻击:3000000 | J144: =RC[-2] -> |cFF99FF66[上古之神-亚煞极]狂怒之刃|r | K144: =RC[-2] -> |cFFFFFF99基础属性|r|n攻击:3000000 | M144: ="blp\old_god\"&RC[-11]&".blp" -> blp\old_god\ZD1D.blp | X144: 1 | Y144: Permanent | Z144: 1000 | AA144: 233 | AB144: 0 | AC144: 0 | AD144: 0 | AO144: 0
A145: OBJECT | B145: ZD1E | F145: srbd | G145: null | H145: =Sheet1!R[-1]C[26] -> |cFF99FF66[上古之神-亚煞极]恐惧者胸甲 |r | I145: =Sheet1!R[-1]C[26] -> |cFFFFFF99基础属性|r|n护甲:65000 | J145: =RC[-2] -> |cFF99FF66[上古之神-亚煞极]恐惧者胸甲 |r | K145: =RC[-2] -> |cFFFFFF99基础属性|r|n护甲:65000 | M145: ="blp\old_god\"&RC[-11]&".blp" -> blp\old_god\ZD1E.blp | X145: 1 | Y145: Permanent | Z145: 1000 | AA145: 233 | AB145: 0 | AC145: 0 | AD145: 0 | AO145: 0
A146: OBJECT | B146: ZD1F | F146: srbd | G146: null | H146: =Sheet1!R[-1]C[26] -> |cFF99FF66[上古之神-亚煞极]堕落神明咒符|r | I146: =Sheet1!R[-1]C[26] -> |cFFFFFF99基础属性|r|n力量:1000000|n力量增幅:25 | J146: =RC[-2] -> |cFF99FF66[上古之神-亚煞极]堕落神明咒符|r | K146: =RC[-2] -> |cFFFFFF99基础属性|r|n力量:1000000|n力量增幅:25 | M146: ="blp\old_god\"&RC[-11]&".blp" -> blp\old_god\ZD1F.blp | X146: 1 | Y146: Permanent | Z146: 1000 | AA146: 233 | AB146: 0 | AC146: 0 | AD146: 0 | AO146: 0
A147: OBJECT | B147: ZD1G | F147: srbd | G147: null | H147: =Sheet1!R[-1]C[26] -> |cFF99FF66[上古之神-亚煞极]上古之神的诅咒|r | I147: =Sheet1!R[-1]C[26] -> |cFFFFFF99基础属性|r|n力量:600000|n敏捷:600000|n智力:600000|n力量增幅:10|n敏捷增幅:10|n智力增幅:10 | J147: =RC[-2] -> |cFF99FF66[上古之神-亚煞极]上古之神的诅咒|r | K147: =RC[-2] -> |cFFFFFF99基础属性|r|n力量:600000|n敏捷:600000|n智力:600000|n力量增幅:10|n敏捷增幅:10|n智力增幅:10 | M147: ="blp\old_god\"&RC[-11]&".blp" -> blp\old_god\ZD1G.blp | X147: 1 | Y147: Permanent | Z147: 1000 | AA147: 233 | AB147: 0 | AC147: 0 | AD147: 0 | AO147: 0
A148: OBJECT | B148: ZD1H | F148: srbd | G148: null | H148: =Sheet1!R[-1]C[26] -> |cFF99FF66[上古之神-恩佐斯]梦魇面具|r | I148: =Sheet1!R[-1]C[26] -> |cFFFFFF99基础属性|r|n力量:450000|n敏捷:450000|n智力:450000|n附加伤害:30 | J148: =RC[-2] -> |cFF99FF66[上古之神-恩佐斯]梦魇面具|r | K148: =RC[-2] -> |cFFFFFF99基础属性|r|n力量:450000|n敏捷:450000|n智力:450000|n附加伤害:30 | M148: ="blp\old_god\"&RC[-11]&".blp" -> blp\old_god\ZD1H.blp | X148: 1 | Y148: Permanent | Z148: 1000 | AA148: 233 | AB148: 0 | AC148: 0 | AD148: 0 | AO148: 0
A149: OBJECT | B149: ZD1I | F149: srbd | G149: null | H149: =Sheet1!R[-1]C[26] -> |cFF99FF66[上古之神-恩佐斯]灵魂之触手|r | I149: =Sheet1!R[-1]C[26] -> |cFFFFFF99基础属性|r|n攻击:2500000|n|cFFFFFF55附加属性|r(%)|n暴击概率:15|n暴击伤害:50 | J149: =RC[-2] -> |cFF99FF66[上古之神-恩佐斯]灵魂之触手|r | K149: =RC[-2] -> |cFFFFFF99基础属性|r|n攻击:2500000|n|cFFFFFF55附加属性|r(%)|n暴击概率:15|n暴击伤害:50 | M149: ="blp\old_god\"&RC[-11]&".blp" -> blp\old_god\ZD1I.blp | X149: 1 | Y149: Permanent | Z149: 1000 | AA149: 233 | AB149: 0 | AC149: 0 | AD149: 0 | AO149: 0
A150: OBJECT | B150: ZD1J | F150: srbd | G150: null | H150: =Sheet1!R[-1]C[26] -> |cFF99FF66[上古之神-恩佐斯]堕落神明之戒|r | I150: =Sheet1!R[-1]C[26] -> |cFFFFFF99基础属性|r|n智力:1000000|n智力增幅:25 | J150: =RC[-2] -> |cFF99FF66[上古之神-恩佐斯]堕落神明之戒|r | K150: =RC[-2] -> |cFFFFFF99基础属性|r|n智力:1000000|n智力增幅:25 | M150: ="blp\old_god\"&RC[-11]&".blp" -> blp\old_god\ZD1J.blp | X150: 1 | Y150: Permanent | Z150: 1000 | AA150: 233 | AB150: 0 | AC150: 0 | AD150: 0 | AO150: 0
A151: OBJECT | B151: ZD1K | F151: srbd | G151: null | H151: =Sheet1!R[-1]C[26] -> |cFF99FF66[上古之神-恩佐斯]上古之神的甲壳|r | I151: =Sheet1!R[-1]C[26] -> |cFFFFFF99基础属性|r|n血量:8000000|n护甲:80000 | J151: =RC[-2] -> |cFF99FF66[上古之神-恩佐斯]上古之神的甲壳|r | K151: =RC[-2] -> |cFFFFFF99基础属性|r|n血量:8000000|n护甲:80000 | M151: ="blp\old_god\"&RC[-11]&".blp" -> blp\old_god\ZD1K.blp | X151: 1 | Y151: Permanent | Z151: 1000 | AA151: 233 | AB151: 0 | AC151: 0 | AD151: 0 | AO151: 0
A152: OBJECT | B152: ZD1L | F152: srbd | G152: null | H152: =Sheet1!R[-1]C[26] -> |cFF99FF66[上古之神-萨拉塔斯]古神之血|r | I152: =Sheet1!R[-1]C[26] -> |cFFFFFF99基础属性|r|n智力:1000000|n智力增幅:25 | J152: =RC[-2] -> |cFF99FF66[上古之神-萨拉塔斯]古神之血|r | K152: =RC[-2] -> |cFFFFFF99基础属性|r|n智力:1000000|n智力增幅:25 | M152: ="blp\old_god\"&RC[-11]&".blp" -> blp\old_god\ZD1L.blp | X152: 1 | Y152: Permanent | Z152: 1000 | AA152: 233 | AB152: 0 | AC152: 0 | AD152: 0 | AO152: 0
A153: OBJECT | B153: ZD1M | F153: srbd | G153: null | H153: =Sheet1!R[-1]C[26] -> |cFF99FF66[上古之神-萨拉塔斯]背信者徽记|r | I153: =Sheet1!R[-1]C[26] -> |cFFFFFF99基础属性|r|n力量:450000|n敏捷:450000|n智力:450000|n|cFFFFFF55附加属性|r(%)|n暴击伤害:20|n伤害增幅:20|n附加伤害:20 | J153: =RC[-2] -> |cFF99FF66[上古之神-萨拉塔斯]背信者徽记|r | K153: =RC[-2] -> |cFFFFFF99基础属性|r|n力量:450000|n敏捷:450000|n智力:450000|n|cFFFFFF55附加属性|r(%)|n暴击伤害:20|n伤害增幅:20|n附加伤害:20 | M153: ="blp\old_god\"&RC[-11]&".blp" -> blp\old_god\ZD1M.blp | X153: 1 | Y153: Permanent | Z153: 1000 | AA153: 233 | AB153: 0 | AC153: 0 | AD153: 0 | AO153: 0
A154: OBJECT | B154: ZD1N | F154: srbd | G154: null | H154: =Sheet1!R[-1]C[26] -> |cFF99FF66[上古之神-萨拉塔斯]堕落神明胸甲|r | I154: =Sheet1!R[-1]C[26] -> |cFFFFFF99基础属性|r|n血量:500000|n护甲:50000|n伤害抵抗:10 | J154: =RC[-2] -> |cFF99FF66[上古之神-萨拉塔斯]堕落神明胸甲|r | K154: =RC[-2] -> |cFFFFFF99基础属性|r|n血量:500000|n护甲:50000|n伤害抵抗:10 | M154: ="blp\old_god\"&RC[-11]&".blp" -> blp\old_god\ZD1N.blp | X154: 1 | Y154: Permanent | Z154: 1000 | AA154: 233 | AB154: 0 | AC154: 0 | AD154: 0 | AO154: 0
A155: OBJECT | B155: ZD1O | F155: srbd | G155: null | H155: =Sheet1!R[-1]C[26] -> |cFF99FF66[上古之神-萨拉塔斯]上古之神的末日|r | I155: =Sheet1!R[-1]C[26] -> |cFFFFFF99基础属性|r|n攻击:3000000|n伤害增幅:50 | J155: =RC[-2] -> |cFF99FF66[上古之神-萨拉塔斯]上古之神的末日|r | K155: =RC[-2] -> |cFFFFFF99基础属性|r|n攻击:3000000|n伤害增幅:50 | M155: ="blp\old_god\"&RC[-11]&".blp" -> blp\old_god\ZD1O.blp | X155: 1 | Y155: Permanent | Z155: 1000 | AA155: 233 | AB155: 0 | AC155: 0 | AD155: 0 | AO155: 0
A156: OBJECT | B156: ZD1P | F156: srbd | G156: null | H156: =Sheet1!R[-1]C[26] -> |cFF99FF66[繁花秘境]繁花幻木|r | I156: =Sheet1!R[-1]C[26] -> |cFFFFFF99基础属性|r|n血量:1000000 | J156: =RC[-2] -> |cFF99FF66[繁花秘境]繁花幻木|r | K156: =RC[-2] -> |cFFFFFF99基础属性|r|n血量:1000000 | M156: ="blp\old_god\"&RC[-11]&".blp" -> blp\old_god\ZD1P.blp | X156: 1 | Y156: Permanent | Z156: 1000 | AA156: 233 | AB156: 0 | AC156: 0 | AD156: 0 | AO156: 0
A157: OBJECT | B157: ZD1Q | F157: srbd | G157: null | H157: =Sheet1!R[-1]C[26] -> |cFF99FF66[繁花秘境]万年天木|r | I157: =Sheet1!R[-1]C[26] -> |cFFFFFF99基础属性|r|n血量:5000000 | J157: =RC[-2] -> |cFF99FF66[繁花秘境]万年天木|r | K157: =RC[-2] -> |cFFFFFF99基础属性|r|n血量:5000000 | M157: ="blp\old_god\"&RC[-11]&".blp" -> blp\old_god\ZD1Q.blp | X157: 1 | Y157: Permanent | Z157: 1000 | AA157: 233 | AB157: 0 | AC157: 0 | AD157: 0 | AO157: 0
A158: OBJECT | B158: ZD1R | F158: srbd | G158: null | H158: =Sheet1!R[-1]C[26] -> |cFF99FF66[繁花秘境]虚空合金|r | I158: =Sheet1!R[-1]C[26] -> |cFFFFFF99基础属性|r|n攻击:1000000|n|cFFFFFF55附加属性|r(%)|n攻击吸血:2 | J158: =RC[-2] -> |cFF99FF66[繁花秘境]虚空合金|r | K158: =RC[-2] -> |cFFFFFF99基础属性|r|n攻击:1000000|n|cFFFFFF55附加属性|r(%)|n攻击吸血:2 | M158: ="blp\old_god\"&RC[-11]&".blp" -> blp\old_god\ZD1R.blp | X158: 1 | Y158: Permanent | Z158: 1000 | AA158: 233 | AB158: 0 | AC158: 0 | AD158: 0 | AO158: 0
A159: OBJECT | B159: ZD1S | F159: srbd | G159: null | H159: =Sheet1!R[-1]C[26] -> |cFF99FF66[繁花秘境]秘境水晶|r | I159: =Sheet1!R[-1]C[26] -> |cFFFFFF99基础属性|r|n攻击:1000000|n|cFFFFFF55附加属性|r(%)|n攻击吸血:2 | J159: =RC[-2] -> |cFF99FF66[繁花秘境]秘境水晶|r | K159: =RC[-2] -> |cFFFFFF99基础属性|r|n攻击:1000000|n|cFFFFFF55附加属性|r(%)|n攻击吸血:2 | M159: ="blp\old_god\"&RC[-11]&".blp" -> blp\old_god\ZD1S.blp | X159: 1 | Y159: Permanent | Z159: 1000 | AA159: 233 | AB159: 0 | AC159: 0 | AD159: 0 | AO159: 0
A160: OBJECT | B160: ZD1T | F160: srbd | G160: null | H160: =Sheet1!R[-1]C[26] -> |cFF99FF66[繁花秘境]灵木之刃|r | I160: =Sheet1!R[-1]C[26] -> |cFFFFFF99基础属性|r|n攻击:2500000|n血量:1000000|n|cFFFFFF55附加属性|r(%)|n攻击吸血:4 | J160: =RC[-2] -> |cFF99FF66[繁花秘境]灵木之刃|r | K160: =RC[-2] -> |cFFFFFF99基础属性|r|n攻击:2500000|n血量:1000000|n|cFFFFFF55附加属性|r(%)|n攻击吸血:4 | M160: ="blp\old_god\"&RC[-11]&".blp" -> blp\old_god\ZD1T.blp | X160: 1 | Y160: Permanent | Z160: 1000 | AA160: 233 | AB160: 0 | AC160: 0 | AD160: 0 | AO160: 0
A161: OBJECT | B161: ZD1U | F161: srbd | G161: null | H161: =Sheet1!R[-1]C[26] -> |cFF99FF66[繁花秘境]神木之刃|r | I161: =Sheet1!R[-1]C[26] -> |cFFFFFF99基础属性|r|n攻击:5000000|n血量:6000000|n|cFFFFFF55附加属性|r(%)|n攻击吸血:4 | J161: =RC[-2] -> |cFF99FF66[繁花秘境]神木之刃|r | K161: =RC[-2] -> |cFFFFFF99基础属性|r|n攻击:5000000|n血量:6000000|n|cFFFFFF55附加属性|r(%)|n攻击吸血:4 | M161: ="blp\old_god\"&RC[-11]&".blp" -> blp\old_god\ZD1U.blp | X161: 1 | Y161: Permanent | Z161: 1000 | AA161: 233 | AB161: 0 | AC161: 0 | AD161: 0 | AO161: 0
A162: OBJECT | B162: ZD1V | F162: srbd | G162: null | H162: =Sheet1!R[-1]C[26] -> |cFF99FF66[繁花秘境]女装-神木之刃|r | I162: =Sheet1!R[-1]C[26] -> |cFFFFFF99基础属性|r|n攻击:8000000|n血量:10000000|n|cFFFFFF55附加属性|r(%)|n攻击吸血:4|n暴击伤害:20 | J162: =RC[-2] -> |cFF99FF66[繁花秘境]女装-神木之刃|r | K162: =RC[-2] -> |cFFFFFF99基础属性|r|n攻击:8000000|n血量:10000000|n|cFFFFFF55附加属性|r(%)|n攻击吸血:4|n暴击伤害:20 | M162: ="blp\old_god\"&RC[-11]&".blp" -> blp\old_god\ZD1V.blp | X162: 1 | Y162: Permanent | Z162: 1000 | AA162: 233 | AB162: 0 | AC162: 0 | AD162: 0 | AO162: 0

Sheet: Sheet1
B1: 等级 | C1: 品级 | D1: 前缀 | E1: 名字 | F1: 后缀 | G1: |cFFFFFF99基础属性|r | H1: 攻击: | I1: 力量: | J1: 敏捷: | K1: 智力: | L1: 血量: | M1: 护甲: | N1: |cFFFFFF55附加属性|r(%) | O1: 攻速: | P1: 攻击吸血: | Q1: 暴击概率: | R1: 暴击伤害: | S1: 伤害增幅: | T1: 附加伤害: | U1: 最终伤害: | V1: 伤害抵抗: | W1: 伤害减免: | X1: 伤害反弹: | Y1: 力量增幅: | Z1: 敏捷增幅: | AA1: 智力增幅: | AB1: |cFFFFFF11成长属性|r | AC1: 升级属性: | AD1: 杀敌属性: | AE1: 每秒属性: | AF1: = | AG1: 描述 | AH1: 名字 | AI1: 文本
A2: 1 | B2: 1 | C2: F | D2: 制式长剑 | E2: - Lv | F2: 1 | H2: =INT(480*RC[-7]*POWER(10,0.07*RC[-7])) -> 563 | O2: 10 | P2: 50 | AG2: =VLOOKUP(RC[-30],Sheet2!R1C1:R7C7,7,0) -> 升级途径:|cFF1BE6B8找 装备升级NPC(练功房) 挑战升级|r | AH2: =VLOOKUP(RC[-31],Sheet2!R1C1:R7C2,2,0)&RC[-30]&RC[-29]&RC[-28]&Sheet2!R1C3&"" -> |cFF999999制式长剑 - Lv1|r | AI2: =IF(RC[-27]&RC[-26]&RC[-25]&RC[-24]&RC[-23]&RC[-22]="",,R1C7)&IF(RC[-27]="",,"|n"&R1C8&RC[-27])&IF(RC[-26]="",,"|n"&R1C9&RC[-26])&IF(RC[-25]="",,"|n"&R1C10&RC[-25])&IF(RC[-24]="",,"|n"&R1C11&RC[-24])&IF(RC[-23]="",,"|n"&R1C12&RC[-23])&IF(RC[-22]="",,"|n"&R1C13&RC[-22])&IF(RC[-20]&RC[-19]&RC[-18]&RC[-17]&RC[-16]&RC[-15]&RC[-14]&RC[-13]&RC[-12]&RC[-11]&RC[-10]&RC[-9]&RC[-8]="",,"|n"&R1C14)&IF(RC[-20]="",,"|n"&R1C15&RC[-20])&IF(RC[-19]="",,"|n"&R1C16&RC[-19])&IF(RC[-18]="",,"|n"&R1C17&RC[-18])&IF(RC[-17]="",,"|n"&R1C18&RC[-17])&IF(RC[-16]="",,"|n"&R1C19&RC[-16])&IF(RC[-15]="",,"|n"&R1C20&RC[-15])&IF(RC[-14]="",,"|n"&R1C21&RC[-14])&IF(RC[-13]="",,"|n"&R1C22&RC[-13])&IF(RC[-12]="",,"|n"&R1C23&RC[-12])&IF(RC[-11]="",,"|n"&R1C24&RC[-11])&IF(RC[-10]="",,"|n"&R1C25&RC[-10])&IF(RC[-9]="",,"|n"&R1C26&RC[-9])&IF(RC[-8]="",,"|n"&R1C27&RC[-8])&IF(RC[-6]&RC[-5]&RC[-4]="",,"|n"&R1C28)&IF(RC[-6]="",,"|n"&R1C29&RC[-6])&IF(RC[-5]="",,"|n"&R1C30&RC[-5])&IF(RC[-4]="",,"|n"&R1C31&RC[-4])&IF(RC[-2]="",,"|n"&RC[-2]) -> |cFFFFFF99基础属性|r|n攻击:563|n|cFFFFFF55附加属性|r(%)|n攻速:10|n攻击吸血:50|n升级途径:|cFF1BE6B8找 装备升级NPC(练功房) 挑战升级|r
A3: 2 | B3: 1 | C3: F | D3: 制式长剑 | E3: - Lv | F3: 2 | H3: =INT(480*RC[-7]*POWER(10,0.07*RC[-7])) -> 1325 | O3: 10 | P3: 50 | AG3: =VLOOKUP(RC[-30],Sheet2!R1C1:R7C7,7,0) -> 升级途径:|cFF1BE6B8找 装备升级NPC(练功房) 挑战升级|r | AH3: =VLOOKUP(RC[-31],Sheet2!R1C1:R7C2,2,0)&RC[-30]&RC[-29]&RC[-28]&Sheet2!R1C3&"" -> |cFF999999制式长剑 - Lv2|r | AI3: =IF(RC[-27]&RC[-26]&RC[-25]&RC[-24]&RC[-23]&RC[-22]="",,R1C7)&IF(RC[-27]="",,"|n"&R1C8&RC[-27])&IF(RC[-26]="",,"|n"&R1C9&RC[-26])&IF(RC[-25]="",,"|n"&R1C10&RC[-25])&IF(RC[-24]="",,"|n"&R1C11&RC[-24])&IF(RC[-23]="",,"|n"&R1C12&RC[-23])&IF(RC[-22]="",,"|n"&R1C13&RC[-22])&IF(RC[-20]&RC[-19]&RC[-18]&RC[-17]&RC[-16]&RC[-15]&RC[-14]&RC[-13]&RC[-12]&RC[-11]&RC[-10]&RC[-9]&RC[-8]="",,"|n"&R1C14)&IF(RC[-20]="",,"|n"&R1C15&RC[-20])&IF(RC[-19]="",,"|n"&R1C16&RC[-19])&IF(RC[-18]="",,"|n"&R1C17&RC[-18])&IF(RC[-17]="",,"|n"&R1C18&RC[-17])&IF(RC[-16]="",,"|n"&R1C19&RC[-16])&IF(RC[-15]="",,"|n"&R1C20&RC[-15])&IF(RC[-14]="",,"|n"&R1C21&RC[-14])&IF(RC[-13]="",,"|n"&R1C22&RC[-13])&IF(RC[-12]="",,"|n"&R1C23&RC[-12])&IF(RC[-11]="",,"|n"&R1C24&RC[-11])&IF(RC[-10]="",,"|n"&R1C25&RC[-10])&IF(RC[-9]="",,"|n"&R1C26&RC[-9])&IF(RC[-8]="",,"|n"&R1C27&RC[-8])&IF(RC[-6]&RC[-5]&RC[-4]="",,"|n"&R1C28)&IF(RC[-6]="",,"|n"&R1C29&RC[-6])&IF(RC[-5]="",,"|n"&R1C30&RC[-5])&IF(RC[-4]="",,"|n"&R1C31&RC[-4])&IF(RC[-2]="",,"|n"&RC[-2]) -> |cFFFFFF99基础属性|r|n攻击:1325|n|cFFFFFF55附加属性|r(%)|n攻速:10|n攻击吸血:50|n升级途径:|cFF1BE6B8找 装备升级NPC(练功房) 挑战升级|r
A4: 3 | B4: 1 | C4: F | D4: 制式长剑 | E4: - Lv | F4: 3 | H4: =INT(480*RC[-7]*POWER(10,0.07*RC[-7])) -> 2335 | O4: 10 | P4: 50 | AG4: =VLOOKUP(RC[-30],Sheet2!R1C1:R7C7,7,0) -> 升级途径:|cFF1BE6B8找 装备升级NPC(练功房) 挑战升级|r | AH4: =VLOOKUP(RC[-31],Sheet2!R1C1:R7C2,2,0)&RC[-30]&RC[-29]&RC[-28]&Sheet2!R1C3&"" -> |cFF999999制式长剑 - Lv3|r | AI4: =IF(RC[-27]&RC[-26]&RC[-25]&RC[-24]&RC[-23]&RC[-22]="",,R1C7)&IF(RC[-27]="",,"|n"&R1C8&RC[-27])&IF(RC[-26]="",,"|n"&R1C9&RC[-26])&IF(RC[-25]="",,"|n"&R1C10&RC[-25])&IF(RC[-24]="",,"|n"&R1C11&RC[-24])&IF(RC[-23]="",,"|n"&R1C12&RC[-23])&IF(RC[-22]="",,"|n"&R1C13&RC[-22])&IF(RC[-20]&RC[-19]&RC[-18]&RC[-17]&RC[-16]&RC[-15]&RC[-14]&RC[-13]&RC[-12]&RC[-11]&RC[-10]&RC[-9]&RC[-8]="",,"|n"&R1C14)&IF(RC[-20]="",,"|n"&R1C15&RC[-20])&IF(RC[-19]="",,"|n"&R1C16&RC[-19])&IF(RC[-18]="",,"|n"&R1C17&RC[-18])&IF(RC[-17]="",,"|n"&R1C18&RC[-17])&IF(RC[-16]="",,"|n"&R1C19&RC[-16])&IF(RC[-15]="",,"|n"&R1C20&RC[-15])&IF(RC[-14]="",,"|n"&R1C21&RC[-14])&IF(RC[-13]="",,"|n"&R1C22&RC[-13])&IF(RC[-12]="",,"|n"&R1C23&RC[-12])&IF(RC[-11]="",,"|n"&R1C24&RC[-11])&IF(RC[-10]="",,"|n"&R1C25&RC[-10])&IF(RC[-9]="",,"|n"&R1C26&RC[-9])&IF(RC[-8]="",,"|n"&R1C27&RC[-8])&IF(RC[-6]&RC[-5]&RC[-4]="",,"|n"&R1C28)&IF(RC[-6]="",,"|n"&R1C29&RC[-6])&IF(RC[-5]="",,"|n"&R1C30&RC[-5])&IF(RC[-4]="",,"|n"&R1C31&RC[-4])&IF(RC[-2]="",,"|n"&RC[-2]) -> |cFFFFFF99基础属性|r|n攻击:2335|n|cFFFFFF55附加属性|r(%)|n攻速:10|n攻击吸血:50|n升级途径:|cFF1BE6B8找 装备升级NPC(练功房) 挑战升级|r
A5: 4 | B5: 1 | C5: F | D5: 制式长剑 | E5: - Lv | F5: 4 | H5: =INT(480*RC[-7]*POWER(10,0.07*RC[-7])) -> 3658 | O5: 10 | P5: 50 | AG5: =VLOOKUP(RC[-30],Sheet2!R1C1:R7C7,7,0) -> 升级途径:|cFF1BE6B8找 装备升级NPC(练功房) 挑战升级|r | AH5: =VLOOKUP(RC[-31],Sheet2!R1C1:R7C2,2,0)&RC[-30]&RC[-29]&RC[-28]&Sheet2!R1C3&"" -> |cFF999999制式长剑 - Lv4|r | AI5: =IF(RC[-27]&RC[-26]&RC[-25]&RC[-24]&RC[-23]&RC[-22]="",,R1C7)&IF(RC[-27]="",,"|n"&R1C8&RC[-27])&IF(RC[-26]="",,"|n"&R1C9&RC[-26])&IF(RC[-25]="",,"|n"&R1C10&RC[-25])&IF(RC[-24]="",,"|n"&R1C11&RC[-24])&IF(RC[-23]="",,"|n"&R1C12&RC[-23])&IF(RC[-22]="",,"|n"&R1C13&RC[-22])&IF(RC[-20]&RC[-19]&RC[-18]&RC[-17]&RC[-16]&RC[-15]&RC[-14]&RC[-13]&RC[-12]&RC[-11]&RC[-10]&RC[-9]&RC[-8]="",,"|n"&R1C14)&IF(RC[-20]="",,"|n"&R1C15&RC[-20])&IF(RC[-19]="",,"|n"&R1C16&RC[-19])&IF(RC[-18]="",,"|n"&R1C17&RC[-18])&IF(RC[-17]="",,"|n"&R1C18&RC[-17])&IF(RC[-16]="",,"|n"&R1C19&RC[-16])&IF(RC[-15]="",,"|n"&R1C20&RC[-15])&IF(RC[-14]="",,"|n"&R1C21&RC[-14])&IF(RC[-13]="",,"|n"&R1C22&RC[-13])&IF(RC[-12]="",,"|n"&R1C23&RC[-12])&IF(RC[-11]="",,"|n"&R1C24&RC[-11])&IF(RC[-10]="",,"|n"&R1C25&RC[-10])&IF(RC[-9]="",,"|n"&R1C26&RC[-9])&IF(RC[-8]="",,"|n"&R1C27&RC[-8])&IF(RC[-6]&RC[-5]&RC[-4]="",,"|n"&R1C28)&IF(RC[-6]="",,"|n"&R1C29&RC[-6])&IF(RC[-5]="",,"|n"&R1C30&RC[-5])&IF(RC[-4]="",,"|n"&R1C31&RC[-4])&IF(RC[-2]="",,"|n"&RC[-2]) -> |cFFFFFF99基础属性|r|n攻击:3658|n|cFFFFFF55附加属性|r(%)|n攻速:10|n攻击吸血:50|n升级途径:|cFF1BE6B8找 装备升级NPC(练功房) 挑战升级|r
A6: 5 | B6: 2 | C6: F | D6: 制式长剑 | E6: - Lv | F6: 5 | H6: =INT(480*RC[-7]*POWER(10,0.07*RC[-7])) -> 5372 | O6: 10 | P6: 50 | AG6: ="升级途径:|cFF1BE6B8"&"击杀20只 "&VLOOKUP(VLOOKUP(Sheet1!RC[-31],Sheet2!R20C1:R25C3,3,0),Sheet2!R28C2:R32C10,1+R[1]C[-27],0)&"("&VLOOKUP(Sheet1!RC[-31],Sheet2!R20C1:R25C3,3,0)&R[1]C[-27]&") |r 升级" -> 升级途径:|cFF1BE6B8击杀20只 盗贼(阿拉希盆地1) |r 升级 | AH6: =VLOOKUP(RC[-31],Sheet2!R1C1:R7C2,2,0)&RC[-30]&RC[-29]&RC[-28]&Sheet2!R1C3&"" -> |cFF999999制式长剑 - Lv5|r | AI6: =IF(RC[-27]&RC[-26]&RC[-25]&RC[-24]&RC[-23]&RC[-22]="",,R1C7)&IF(RC[-27]="",,"|n"&R1C8&RC[-27])&IF(RC[-26]="",,"|n"&R1C9&RC[-26])&IF(RC[-25]="",,"|n"&R1C10&RC[-25])&IF(RC[-24]="",,"|n"&R1C11&RC[-24])&IF(RC[-23]="",,"|n"&R1C12&RC[-23])&IF(RC[-22]="",,"|n"&R1C13&RC[-22])&IF(RC[-20]&RC[-19]&RC[-18]&RC[-17]&RC[-16]&RC[-15]&RC[-14]&RC[-13]&RC[-12]&RC[-11]&RC[-10]&RC[-9]&RC[-8]="",,"|n"&R1C14)&IF(RC[-20]="",,"|n"&R1C15&RC[-20])&IF(RC[-19]="",,"|n"&R1C16&RC[-19])&IF(RC[-18]="",,"|n"&R1C17&RC[-18])&IF(RC[-17]="",,"|n"&R1C18&RC[-17])&IF(RC[-16]="",,"|n"&R1C19&RC[-16])&IF(RC[-15]="",,"|n"&R1C20&RC[-15])&IF(RC[-14]="",,"|n"&R1C21&RC[-14])&IF(RC[-13]="",,"|n"&R1C22&RC[-13])&IF(RC[-12]="",,"|n"&R1C23&RC[-12])&IF(RC[-11]="",,"|n"&R1C24&RC[-11])&IF(RC[-10]="",,"|n"&R1C25&RC[-10])&IF(RC[-9]="",,"|n"&R1C26&RC[-9])&IF(RC[-8]="",,"|n"&R1C27&RC[-8])&IF(RC[-6]&RC[-5]&RC[-4]="",,"|n"&R1C28)&IF(RC[-6]="",,"|n"&R1C29&RC[-6])&IF(RC[-5]="",,"|n"&R1C30&RC[-5])&IF(RC[-4]="",,"|n"&R1C31&RC[-4])&IF(RC[-2]="",,"|n"&RC[-2]) -> |cFFFFFF99基础属性|r|n攻击:5372|n|cFFFFFF55附加属性|r(%)|n攻速:10|n攻击吸血:50|n升级途径:|cFF1BE6B8击杀20只 盗贼(阿拉希盆地1) |r 升级
A7: 8 | B7: 2 | C7: E | D7: 断水长剑 | E7: - Lv | F7: 1 | H7: =INT(480*RC[-7]*POWER(10,0.07*RC[-7])) -> 13942 | O7: 20 | P7: 45 | AG7: ="升级途径:|cFF1BE6B8"&"击杀20只 "&VLOOKUP(VLOOKUP(Sheet1!RC[-31],Sheet2!R20C1:R25C3,3,0),Sheet2!R28C2:R32C10,1+R[1]C[-27],0)&"("&VLOOKUP(Sheet1!RC[-31],Sheet2!R20C1:R25C3,3,0)&R[1]C[-27]&") |r 升级" -> 升级途径:|cFF1BE6B8击杀20只 鱼人(阿拉希盆地2) |r 升级 | AH7: =VLOOKUP(RC[-31],Sheet2!R1C1:R7C2,2,0)&RC[-30]&RC[-29]&RC[-28]&Sheet2!R1C3&"" -> |CFFFFFFFF断水长剑 - Lv1|r | AI7: =IF(RC[-27]&RC[-26]&RC[-25]&RC[-24]&RC[-23]&RC[-22]="",,R1C7)&IF(RC[-27]="",,"|n"&R1C8&RC[-27])&IF(RC[-26]="",,"|n"&R1C9&RC[-26])&IF(RC[-25]="",,"|n"&R1C10&RC[-25])&IF(RC[-24]="",,"|n"&R1C11&RC[-24])&IF(RC[-23]="",,"|n"&R1C12&RC[-23])&IF(RC[-22]="",,"|n"&R1C13&RC[-22])&IF(RC[-20]&RC[-19]&RC[-18]&RC[-17]&RC[-16]&RC[-15]&RC[-14]&RC[-13]&RC[-12]&RC[-11]&RC[-10]&RC[-9]&RC[-8]="",,"|n"&R1C14)&IF(RC[-20]="",,"|n"&R1C15&RC[-20])&IF(RC[-19]="",,"|n"&R1C16&RC[-19])&IF(RC[-18]="",,"|n"&R1C17&RC[-18])&IF(RC[-17]="",,"|n"&R1C18&RC[-17])&IF(RC[-16]="",,"|n"&R1C19&RC[-16])&IF(RC[-15]="",,"|n"&R1C20&RC[-15])&IF(RC[-14]="",,"|n"&R1C21&RC[-14])&IF(RC[-13]="",,"|n"&R1C22&RC[-13])&IF(RC[-12]="",,"|n"&R1C23&RC[-12])&IF(RC[-11]="",,"|n"&R1C24&RC[-11])&IF(RC[-10]="",,"|n"&R1C25&RC[-10])&IF(RC[-9]="",,"|n"&R1C26&RC[-9])&IF(RC[-8]="",,"|n"&R1C27&RC[-8])&IF(RC[-6]&RC[-5]&RC[-4]="",,"|n"&R1C28)&IF(RC[-6]="",,"|n"&R1C29&RC[-6])&IF(RC[-5]="",,"|n"&R1C30&RC[-5])&IF(RC[-4]="",,"|n"&R1C31&RC[-4])&IF(RC[-2]="",,"|n"&RC[-2]) -> |cFFFFFF99基础属性|r|n攻击:13942|n|cFFFFFF55附加属性|r(%)|n攻速:20|n攻击吸血:45|n升级途径:|cFF1BE6B8击杀20只 鱼人(阿拉希盆地2) |r 升级
A8: 9 | B8: 2 | C8: E | D8: 断水长剑 | E8: - Lv | F8: 2 | H8: =INT(480*RC[-7]*POWER(10,0.07*RC[-7])) -> 18428 | O8: 20 | P8: 45 | AG8: ="升级途径:|cFF1BE6B8"&"击杀20只 "&VLOOKUP(VLOOKUP(Sheet1!RC[-31],Sheet2!R20C1:R25C3,3,0),Sheet2!R28C2:R32C10,1+R[1]C[-27],0)&"("&VLOOKUP(Sheet1!RC[-31],Sheet2!R20C1:R25C3,3,0)&R[1]C[-27]&") |r 升级" -> 升级途径:|cFF1BE6B8击杀20只 森林狼(阿拉希盆地3) |r 升级 | AH8: =VLOOKUP(RC[-31],Sheet2!R1C1:R7C2,2,0)&RC[-30]&RC[-29]&RC[-28]&Sheet2!R1C3&"" -> |CFFFFFFFF断水长剑 - Lv2|r | AI8: =IF(RC[-27]&RC[-26]&RC[-25]&RC[-24]&RC[-23]&RC[-22]="",,R1C7)&IF(RC[-27]="",,"|n"&R1C8&RC[-27])&IF(RC[-26]="",,"|n"&R1C9&RC[-26])&IF(RC[-25]="",,"|n"&R1C10&RC[-25])&IF(RC[-24]="",,"|n"&R1C11&RC[-24])&IF(RC[-23]="",,"|n"&R1C12&RC[-23])&IF(RC[-22]="",,"|n"&R1C13&RC[-22])&IF(RC[-20]&RC[-19]&RC[-18]&RC[-17]&RC[-16]&RC[-15]&RC[-14]&RC[-13]&RC[-12]&RC[-11]&RC[-10]&RC[-9]&RC[-8]="",,"|n"&R1C14)&IF(RC[-20]="",,"|n"&R1C15&RC[-20])&IF(RC[-19]="",,"|n"&R1C16&RC[-19])&IF(RC[-18]="",,"|n"&R1C17&RC[-18])&IF(RC[-17]="",,"|n"&R1C18&RC[-17])&IF(RC[-16]="",,"|n"&R1C19&RC[-16])&IF(RC[-15]="",,"|n"&R1C20&RC[-15])&IF(RC[-14]="",,"|n"&R1C21&RC[-14])&IF(RC[-13]="",,"|n"&R1C22&RC[-13])&IF(RC[-12]="",,"|n"&R1C23&RC[-12])&IF(RC[-11]="",,"|n"&R1C24&RC[-11])&IF(RC[-10]="",,"|n"&R1C25&RC[-10])&IF(RC[-9]="",,"|n"&R1C26&RC[-9])&IF(RC[-8]="",,"|n"&R1C27&RC[-8])&IF(RC[-6]&RC[-5]&RC[-4]="",,"|n"&R1C28)&IF(RC[-6]="",,"|n"&R1C29&RC[-6])&IF(RC[-5]="",,"|n"&R1C30&RC[-5])&IF(RC[-4]="",,"|n"&R1C31&RC[-4])&IF(RC[-2]="",,"|n"&RC[-2]) -> |cFFFFFF99基础属性|r|n攻击:18428|n|cFFFFFF55附加属性|r(%)|n攻速:20|n攻击吸血:45|n升级途径:|cFF1BE6B8击杀20只 森林狼(阿拉希盆地3) |r 升级
A9: 10 | B9: 2 | C9: E | D9: 断水长剑 | E9: - Lv | F9: 3 | H9: =INT(480*RC[-7]*POWER(10,0.07*RC[-7])) -> 24056 | O9: 20 | P9: 45 | AG9: ="升级途径:|cFF1BE6B8"&"击杀20只 "&VLOOKUP(VLOOKUP(Sheet1!RC[-31],Sheet2!R20C1:R25C3,3,0),Sheet2!R28C2:R32C10,1+R[1]C[-27],0)&"("&VLOOKUP(Sheet1!RC[-31],Sheet2!R20C1:R25C3,3,0)&R[1]C[-27]&") |r 升级" -> 升级途径:|cFF1BE6B8击杀20只 豪猪(阿拉希盆地4) |r 升级 | AH9: =VLOOKUP(RC[-31],Sheet2!R1C1:R7C2,2,0)&RC[-30]&RC[-29]&RC[-28]&Sheet2!R1C3&"" -> |CFFFFFFFF断水长剑 - Lv3|r | AI9: =IF(RC[-27]&RC[-26]&RC[-25]&RC[-24]&RC[-23]&RC[-22]="",,R1C7)&IF(RC[-27]="",,"|n"&R1C8&RC[-27])&IF(RC[-26]="",,"|n"&R1C9&RC[-26])&IF(RC[-25]="",,"|n"&R1C10&RC[-25])&IF(RC[-24]="",,"|n"&R1C11&RC[-24])&IF(RC[-23]="",,"|n"&R1C12&RC[-23])&IF(RC[-22]="",,"|n"&R1C13&RC[-22])&IF(RC[-20]&RC[-19]&RC[-18]&RC[-17]&RC[-16]&RC[-15]&RC[-14]&RC[-13]&RC[-12]&RC[-11]&RC[-10]&RC[-9]&RC[-8]="",,"|n"&R1C14)&IF(RC[-20]="",,"|n"&R1C15&RC[-20])&IF(RC[-19]="",,"|n"&R1C16&RC[-19])&IF(RC[-18]="",,"|n"&R1C17&RC[-18])&IF(RC[-17]="",,"|n"&R1C18&RC[-17])&IF(RC[-16]="",,"|n"&R1C19&RC[-16])&IF(RC[-15]="",,"|n"&R1C20&RC[-15])&IF(RC[-14]="",,"|n"&R1C21&RC[-14])&IF(RC[-13]="",,"|n"&R1C22&RC[-13])&IF(RC[-12]="",,"|n"&R1C23&RC[-12])&IF(RC[-11]="",,"|n"&R1C24&RC[-11])&IF(RC[-10]="",,"|n"&R1C25&RC[-10])&IF(RC[-9]="",,"|n"&R1C26&RC[-9])&IF(RC[-8]="",,"|n"&R1C27&RC[-8])&IF(RC[-6]&RC[-5]&RC[-4]="",,"|n"&R1C28)&IF(RC[-6]="",,"|n"&R1C29&RC[-6])&IF(RC[-5]="",,"|n"&R1C30&RC[-5])&IF(RC[-4]="",,"|n"&R1C31&RC[-4])&IF(RC[-2]="",,"|n"&RC[-2]) -> |cFFFFFF99基础属性|r|n攻击:24056|n|cFFFFFF55附加属性|r(%)|n攻速:20|n攻击吸血:45|n升级途径:|cFF1BE6B8击杀20只 豪猪(阿拉希盆地4) |r 升级
A10: 11 | B10: 3 | C10: E | D10: 断水长剑 | E10: - Lv | F10: 4 | H10: =INT(480*RC[-7]*POWER(10,0.07*RC[-7])) -> 31090 | O10: 20 | P10: 45 | AG10: ="升级途径:|cFF1BE6B8"&"击杀20只 "&VLOOKUP(VLOOKUP(Sheet1!RC[-31],Sheet2!R20C1:R25C3,3,0),Sheet2!R28C2:R32C10,1+R[1]C[-27],0)&"("&VLOOKUP(Sheet1!RC[-31],Sheet2!R20C1:R25C3,3,0)&R[1]C[-27]&") |r 升级" -> 升级途径:|cFF1BE6B8击杀20只 达拉内尔信徒(死亡矿井1) |r 升级 | AH10: =VLOOKUP(RC[-31],Sheet2!R1C1:R7C2,2,0)&RC[-30]&RC[-29]&RC[-28]&Sheet2!R1C3&"" -> |CFFFFFFFF断水长剑 - Lv4|r | AI10: =IF(RC[-27]&RC[-26]&RC[-25]&RC[-24]&RC[-23]&RC[-22]="",,R1C7)&IF(RC[-27]="",,"|n"&R1C8&RC[-27])&IF(RC[-26]="",,"|n"&R1C9&RC[-26])&IF(RC[-25]="",,"|n"&R1C10&RC[-25])&IF(RC[-24]="",,"|n"&R1C11&RC[-24])&IF(RC[-23]="",,"|n"&R1C12&RC[-23])&IF(RC[-22]="",,"|n"&R1C13&RC[-22])&IF(RC[-20]&RC[-19]&RC[-18]&RC[-17]&RC[-16]&RC[-15]&RC[-14]&RC[-13]&RC[-12]&RC[-11]&RC[-10]&RC[-9]&RC[-8]="",,"|n"&R1C14)&IF(RC[-20]="",,"|n"&R1C15&RC[-20])&IF(RC[-19]="",,"|n"&R1C16&RC[-19])&IF(RC[-18]="",,"|n"&R1C17&RC[-18])&IF(RC[-17]="",,"|n"&R1C18&RC[-17])&IF(RC[-16]="",,"|n"&R1C19&RC[-16])&IF(RC[-15]="",,"|n"&R1C20&RC[-15])&IF(RC[-14]="",,"|n"&R1C21&RC[-14])&IF(RC[-13]="",,"|n"&R1C22&RC[-13])&IF(RC[-12]="",,"|n"&R1C23&RC[-12])&IF(RC[-11]="",,"|n"&R1C24&RC[-11])&IF(RC[-10]="",,"|n"&R1C25&RC[-10])&IF(RC[-9]="",,"|n"&R1C26&RC[-9])&IF(RC[-8]="",,"|n"&R1C27&RC[-8])&IF(RC[-6]&RC[-5]&RC[-4]="",,"|n"&R1C28)&IF(RC[-6]="",,"|n"&R1C29&RC[-6])&IF(RC[-5]="",,"|n"&R1C30&RC[-5])&IF(RC[-4]="",,"|n"&R1C31&RC[-4])&IF(RC[-2]="",,"|n"&RC[-2]) -> |cFFFFFF99基础属性|r|n攻击:31090|n|cFFFFFF55附加属性|r(%)|n攻速:20|n攻击吸血:45|n升级途径:|cFF1BE6B8击杀20只 达拉内尔信徒(死亡矿井1) |r 升级
A11: 14 | B11: 3 | C11: D | D11: 玄铁长剑 | E11: - Lv | F11: 1 | H11: =INT(480*RC[-7]*POWER(10,0.07*RC[-7])) -> 64175 | O11: 30 | P11: 40 | AG11: ="升级途径:|cFF1BE6B8"&"击杀20只 "&VLOOKUP(VLOOKUP(Sheet1!RC[-31],Sheet2!R20C1:R25C3,3,0),Sheet2!R28C2:R32C10,1+R[1]C[-27],0)&"("&VLOOKUP(Sheet1!RC[-31],Sheet2!R20C1:R25C3,3,0)&R[1]C[-27]&") |r 升级" -> 升级途径:|cFF1BE6B8击杀20只 食人魔(死亡矿井2) |r 升级 | AH11: =VLOOKUP(RC[-31],Sheet2!R1C1:R7C2,2,0)&RC[-30]&RC[-29]&RC[-28]&Sheet2!R1C3&"" -> |CFFB6D7A8玄铁长剑 - Lv1|r | AI11: =IF(RC[-27]&RC[-26]&RC[-25]&RC[-24]&RC[-23]&RC[-22]="",,R1C7)&IF(RC[-27]="",,"|n"&R1C8&RC[-27])&IF(RC[-26]="",,"|n"&R1C9&RC[-26])&IF(RC[-25]="",,"|n"&R1C10&RC[-25])&IF(RC[-24]="",,"|n"&R1C11&RC[-24])&IF(RC[-23]="",,"|n"&R1C12&RC[-23])&IF(RC[-22]="",,"|n"&R1C13&RC[-22])&IF(RC[-20]&RC[-19]&RC[-18]&RC[-17]&RC[-16]&RC[-15]&RC[-14]&RC[-13]&RC[-12]&RC[-11]&RC[-10]&RC[-9]&RC[-8]="",,"|n"&R1C14)&IF(RC[-20]="",,"|n"&R1C15&RC[-20])&IF(RC[-19]="",,"|n"&R1C16&RC[-19])&IF(RC[-18]="",,"|n"&R1C17&RC[-18])&IF(RC[-17]="",,"|n"&R1C18&RC[-17])&IF(RC[-16]="",,"|n"&R1C19&RC[-16])&IF(RC[-15]="",,"|n"&R1C20&RC[-15])&IF(RC[-14]="",,"|n"&R1C21&RC[-14])&IF(RC[-13]="",,"|n"&R1C22&RC[-13])&IF(RC[-12]="",,"|n"&R1C23&RC[-12])&IF(RC[-11]="",,"|n"&R1C24&RC[-11])&IF(RC[-10]="",,"|n"&R1C25&RC[-10])&IF(RC[-9]="",,"|n"&R1C26&RC[-9])&IF(RC[-8]="",,"|n"&R1C27&RC[-8])&IF(RC[-6]&RC[-5]&RC[-4]="",,"|n"&R1C28)&IF(RC[-6]="",,"|n"&R1C29&RC[-6])&IF(RC[-5]="",,"|n"&R1C30&RC[-5])&IF(RC[-4]="",,"|n"&R1C31&RC[-4])&IF(RC[-2]="",,"|n"&RC[-2]) -> |cFFFFFF99基础属性|r|n攻击:64175|n|cFFFFFF55附加属性|r(%)|n攻速:30|n攻击吸血:40|n升级途径:|cFF1BE6B8击杀20只 食人魔(死亡矿井2) |r 升级
A12: 15 | B12: 3 | C12: D | D12: 玄铁长剑 | E12: - Lv | F12: 2 | H12: =INT(480*RC[-7]*POWER(10,0.07*RC[-7])) -> 80785 | O12: 30 | P12: 40 | AG12: ="升级途径:|cFF1BE6B8"&"击杀20只 "&VLOOKUP(VLOOKUP(Sheet1!RC[-31],Sheet2!R20C1:R25C3,3,0),Sheet2!R28C2:R32C10,1+R[1]C[-27],0)&"("&VLOOKUP(Sheet1!RC[-31],Sheet2!R20C1:R25C3,3,0)&R[1]C[-27]&") |r 升级" -> 升级途径:|cFF1BE6B8击杀20只 狗头人(死亡矿井3) |r 升级 | AH12: =VLOOKUP(RC[-31],Sheet2!R1C1:R7C2,2,0)&RC[-30]&RC[-29]&RC[-28]&Sheet2!R1C3&"" -> |CFFB6D7A8玄铁长剑 - Lv2|r | AI12: =IF(RC[-27]&RC[-26]&RC[-25]&RC[-24]&RC[-23]&RC[-22]="",,R1C7)&IF(RC[-27]="",,"|n"&R1C8&RC[-27])&IF(RC[-26]="",,"|n"&R1C9&RC[-26])&IF(RC[-25]="",,"|n"&R1C10&RC[-25])&IF(RC[-24]="",,"|n"&R1C11&RC[-24])&IF(RC[-23]="",,"|n"&R1C12&RC[-23])&IF(RC[-22]="",,"|n"&R1C13&RC[-22])&IF(RC[-20]&RC[-19]&RC[-18]&RC[-17]&RC[-16]&RC[-15]&RC[-14]&RC[-13]&RC[-12]&RC[-11]&RC[-10]&RC[-9]&RC[-8]="",,"|n"&R1C14)&IF(RC[-20]="",,"|n"&R1C15&RC[-20])&IF(RC[-19]="",,"|n"&R1C16&RC[-19])&IF(RC[-18]="",,"|n"&R1C17&RC[-18])&IF(RC[-17]="",,"|n"&R1C18&RC[-17])&IF(RC[-16]="",,"|n"&R1C19&RC[-16])&IF(RC[-15]="",,"|n"&R1C20&RC[-15])&IF(RC[-14]="",,"|n"&R1C21&RC[-14])&IF(RC[-13]="",,"|n"&R1C22&RC[-13])&IF(RC[-12]="",,"|n"&R1C23&RC[-12])&IF(RC[-11]="",,"|n"&R1C24&RC[-11])&IF(RC[-10]="",,"|n"&R1C25&RC[-10])&IF(RC[-9]="",,"|n"&R1C26&RC[-9])&IF(RC[-8]="",,"|n"&R1C27&RC[-8])&IF(RC[-6]&RC[-5]&RC[-4]="",,"|n"&R1C28)&IF(RC[-6]="",,"|n"&R1C29&RC[-6])&IF(RC[-5]="",,"|n"&R1C30&RC[-5])&IF(RC[-4]="",,"|n"&R1C31&RC[-4])&IF(RC[-2]="",,"|n"&RC[-2]) -> |cFFFFFF99基础属性|r|n攻击:80785|n|cFFFFFF55附加属性|r(%)|n攻速:30|n攻击吸血:40|n升级途径:|cFF1BE6B8击杀20只 狗头人(死亡矿井3) |r 升级
A13: 16 | B13: 3 | C13: D | D13: 玄铁长剑 | E13: - Lv | F13: 3 | H13: =INT(480*RC[-7]*POWER(10,0.07*RC[-7])) -> 101242 | O13: 30 | P13: 40 | AG13: ="升级途径:|cFF1BE6B8"&"击杀20只 "&VLOOKUP(VLOOKUP(Sheet1!RC[-31],Sheet2!R20C1:R25C3,3,0),Sheet2!R28C2:R32C10,1+R[1]C[-27],0)&"("&VLOOKUP(Sheet1!RC[-31],Sheet2!R20C1:R25C3,3,0)&R[1]C[-27]&") |r 升级" -> 升级途径:|cFF1BE6B8击杀20只 矿井蝎子(死亡矿井4) |r 升级 | AH13: =VLOOKUP(RC[-31],Sheet2!R1C1:R7C2,2,0)&RC[-30]&RC[-29]&RC[-28]&Sheet2!R1C3&"" -> |CFFB6D7A8玄铁长剑 - Lv3|r | AI13: =IF(RC[-27]&RC[-26]&RC[-25]&RC[-24]&RC[-23]&RC[-22]="",,R1C7)&IF(RC[-27]="",,"|n"&R1C8&RC[-27])&IF(RC[-26]="",,"|n"&R1C9&RC[-26])&IF(RC[-25]="",,"|n"&R1C10&RC[-25])&IF(RC[-24]="",,"|n"&R1C11&RC[-24])&IF(RC[-23]="",,"|n"&R1C12&RC[-23])&IF(RC[-22]="",,"|n"&R1C13&RC[-22])&IF(RC[-20]&RC[-19]&RC[-18]&RC[-17]&RC[-16]&RC[-15]&RC[-14]&RC[-13]&RC[-12]&RC[-11]&RC[-10]&RC[-9]&RC[-8]="",,"|n"&R1C14)&IF(RC[-20]="",,"|n"&R1C15&RC[-20])&IF(RC[-19]="",,"|n"&R1C16&RC[-19])&IF(RC[-18]="",,"|n"&R1C17&RC[-18])&IF(RC[-17]="",,"|n"&R1C18&RC[-17])&IF(RC[-16]="",,"|n"&R1C19&RC[-16])&IF(RC[-15]="",,"|n"&R1C20&RC[-15])&IF(RC[-14]="",,"|n"&R1C21&RC[-14])&IF(RC[-13]="",,"|n"&R1C22&RC[-13])&IF(RC[-12]="",,"|n"&R1C23&RC[-12])&IF(RC[-11]="",,"|n"&R1C24&RC[-11])&IF(RC[-10]="",,"|n"&R1C25&RC[-10])&IF(RC[-9]="",,"|n"&R1C26&RC[-9])&IF(RC[-8]="",,"|n"&R1C27&RC[-8])&IF(RC[-6]&RC[-5]&RC[-4]="",,"|n"&R1C28)&IF(RC[-6]="",,"|n"&R1C29&RC[-6])&IF(RC[-5]="",,"|n"&R1C30&RC[-5])&IF(RC[-4]="",,"|n"&R1C31&RC[-4])&IF(RC[-2]="",,"|n"&RC[-2]) -> |cFFFFFF99基础属性|r|n攻击:101242|n|cFFFFFF55附加属性|r(%)|n攻速:30|n攻击吸血:40|n升级途径:|cFF1BE6B8击杀20只 矿井蝎子(死亡矿井4) |r 升级
A14: 17 | B14: 4 | C14: D | D14: 玄铁长剑 | E14: - Lv | F14: 4 | H14: =INT(480*RC[-7]*POWER(10,0.07*RC[-7])) -> 126383 | O14: 30 | P14: 40 | AG14: ="升级途径:|cFF1BE6B8"&"击杀20只 "&VLOOKUP(VLOOKUP(Sheet1!RC[-31],Sheet2!R20C1:R25C3,3,0),Sheet2!R28C2:R32C10,1+R[1]C[-27],0)&"("&VLOOKUP(Sheet1!RC[-31],Sheet2!R20C1:R25C3,3,0)&R[1]C[-27]&") |r 升级" -> 升级途径:|cFF1BE6B8击杀20只 熔岩怪物(熔火之心1) |r 升级 | AH14: =VLOOKUP(RC[-31],Sheet2!R1C1:R7C2,2,0)&RC[-30]&RC[-29]&RC[-28]&Sheet2!R1C3&"" -> |CFFB6D7A8玄铁长剑 - Lv4|r | AI14: =IF(RC[-27]&RC[-26]&RC[-25]&RC[-24]&RC[-23]&RC[-22]="",,R1C7)&IF(RC[-27]="",,"|n"&R1C8&RC[-27])&IF(RC[-26]="",,"|n"&R1C9&RC[-26])&IF(RC[-25]="",,"|n"&R1C10&RC[-25])&IF(RC[-24]="",,"|n"&R1C11&RC[-24])&IF(RC[-23]="",,"|n"&R1C12&RC[-23])&IF(RC[-22]="",,"|n"&R1C13&RC[-22])&IF(RC[-20]&RC[-19]&RC[-18]&RC[-17]&RC[-16]&RC[-15]&RC[-14]&RC[-13]&RC[-12]&RC[-11]&RC[-10]&RC[-9]&RC[-8]="",,"|n"&R1C14)&IF(RC[-20]="",,"|n"&R1C15&RC[-20])&IF(RC[-19]="",,"|n"&R1C16&RC[-19])&IF(RC[-18]="",,"|n"&R1C17&RC[-18])&IF(RC[-17]="",,"|n"&R1C18&RC[-17])&IF(RC[-16]="",,"|n"&R1C19&RC[-16])&IF(RC[-15]="",,"|n"&R1C20&RC[-15])&IF(RC[-14]="",,"|n"&R1C21&RC[-14])&IF(RC[-13]="",,"|n"&R1C22&RC[-13])&IF(RC[-12]="",,"|n"&R1C23&RC[-12])&IF(RC[-11]="",,"|n"&R1C24&RC[-11])&IF(RC[-10]="",,"|n"&R1C25&RC[-10])&IF(RC[-9]="",,"|n"&R1C26&RC[-9])&IF(RC[-8]="",,"|n"&R1C27&RC[-8])&IF(RC[-6]&RC[-5]&RC[-4]="",,"|n"&R1C28)&IF(RC[-6]="",,"|n"&R1C29&RC[-6])&IF(RC[-5]="",,"|n"&R1C30&RC[-5])&IF(RC[-4]="",,"|n"&R1C31&RC[-4])&IF(RC[-2]="",,"|n"&RC[-2]) -> |cFFFFFF99基础属性|r|n攻击:126383|n|cFFFFFF55附加属性|r(%)|n攻速:30|n攻击吸血:40|n升级途径:|cFF1BE6B8击杀20只 熔岩怪物(熔火之心1) |r 升级
A15: 20 | B15: 4 | C15: C | D15: 烈焰长剑 | E15: - Lv | F15: 1 | H15: =INT(480*RC[-7]*POWER(10,0.07*RC[-7])) -> 241141 | O15: 40 | P15: 35 | AG15: ="升级途径:|cFF1BE6B8"&"击杀20只 "&VLOOKUP(VLOOKUP(Sheet1!RC[-31],Sheet2!R20C1:R25C3,3,0),Sheet2!R28C2:R32C10,1+R[1]C[-27],0)&"("&VLOOKUP(Sheet1!RC[-31],Sheet2!R20C1:R25C3,3,0)&R[1]C[-27]&") |r 升级" -> 升级途径:|cFF1BE6B8击杀20只 火焰蜥蜴(熔火之心2) |r 升级 | AH15: =VLOOKUP(RC[-31],Sheet2!R1C1:R7C2,2,0)&RC[-30]&RC[-29]&RC[-28]&Sheet2!R1C3&"" -> |cFF99FF66烈焰长剑 - Lv1|r | AI15: =IF(RC[-27]&RC[-26]&RC[-25]&RC[-24]&RC[-23]&RC[-22]="",,R1C7)&IF(RC[-27]="",,"|n"&R1C8&RC[-27])&IF(RC[-26]="",,"|n"&R1C9&RC[-26])&IF(RC[-25]="",,"|n"&R1C10&RC[-25])&IF(RC[-24]="",,"|n"&R1C11&RC[-24])&IF(RC[-23]="",,"|n"&R1C12&RC[-23])&IF(RC[-22]="",,"|n"&R1C13&RC[-22])&IF(RC[-20]&RC[-19]&RC[-18]&RC[-17]&RC[-16]&RC[-15]&RC[-14]&RC[-13]&RC[-12]&RC[-11]&RC[-10]&RC[-9]&RC[-8]="",,"|n"&R1C14)&IF(RC[-20]="",,"|n"&R1C15&RC[-20])&IF(RC[-19]="",,"|n"&R1C16&RC[-19])&IF(RC[-18]="",,"|n"&R1C17&RC[-18])&IF(RC[-17]="",,"|n"&R1C18&RC[-17])&IF(RC[-16]="",,"|n"&R1C19&RC[-16])&IF(RC[-15]="",,"|n"&R1C20&RC[-15])&IF(RC[-14]="",,"|n"&R1C21&RC[-14])&IF(RC[-13]="",,"|n"&R1C22&RC[-13])&IF(RC[-12]="",,"|n"&R1C23&RC[-12])&IF(RC[-11]="",,"|n"&R1C24&RC[-11])&IF(RC[-10]="",,"|n"&R1C25&RC[-10])&IF(RC[-9]="",,"|n"&R1C26&RC[-9])&IF(RC[-8]="",,"|n"&R1C27&RC[-8])&IF(RC[-6]&RC[-5]&RC[-4]="",,"|n"&R1C28)&IF(RC[-6]="",,"|n"&R1C29&RC[-6])&IF(RC[-5]="",,"|n"&R1C30&RC[-5])&IF(RC[-4]="",,"|n"&R1C31&RC[-4])&IF(RC[-2]="",,"|n"&RC[-2]) -> |cFFFFFF99基础属性|r|n攻击:241141|n|cFFFFFF55附加属性|r(%)|n攻速:40|n攻击吸血:35|n升级途径:|cFF1BE6B8击杀20只 火焰蜥蜴(熔火之心2) |r 升级
A16: 21 | B16: 4 | C16: C | D16: 烈焰长剑 | E16: - Lv | F16: 2 | H16: =INT(480*RC[-7]*POWER(10,0.07*RC[-7])) -> 297481 | O16: 40 | P16: 35 | AG16: ="升级途径:|cFF1BE6B8"&"击杀20只 "&VLOOKUP(VLOOKUP(Sheet1!RC[-31],Sheet2!R20C1:R25C3,3,0),Sheet2!R28C2:R32C10,1+R[1]C[-27],0)&"("&VLOOKUP(Sheet1!RC[-31],Sheet2!R20C1:R25C3,3,0)&R[1]C[-27]&") |r 升级" -> 升级途径:|cFF1BE6B8击杀20只 烈焰龙龟(熔火之心3) |r 升级 | AH16: =VLOOKUP(RC[-31],Sheet2!R1C1:R7C2,2,0)&RC[-30]&RC[-29]&RC[-28]&Sheet2!R1C3&"" -> |cFF99FF66烈焰长剑 - Lv2|r | AI16: =IF(RC[-27]&RC[-26]&RC[-25]&RC[-24]&RC[-23]&RC[-22]="",,R1C7)&IF(RC[-27]="",,"|n"&R1C8&RC[-27])&IF(RC[-26]="",,"|n"&R1C9&RC[-26])&IF(RC[-25]="",,"|n"&R1C10&RC[-25])&IF(RC[-24]="",,"|n"&R1C11&RC[-24])&IF(RC[-23]="",,"|n"&R1C12&RC[-23])&IF(RC[-22]="",,"|n"&R1C13&RC[-22])&IF(RC[-20]&RC[-19]&RC[-18]&RC[-17]&RC[-16]&RC[-15]&RC[-14]&RC[-13]&RC[-12]&RC[-11]&RC[-10]&RC[-9]&RC[-8]="",,"|n"&R1C14)&IF(RC[-20]="",,"|n"&R1C15&RC[-20])&IF(RC[-19]="",,"|n"&R1C16&RC[-19])&IF(RC[-18]="",,"|n"&R1C17&RC[-18])&IF(RC[-17]="",,"|n"&R1C18&RC[-17])&IF(RC[-16]="",,"|n"&R1C19&RC[-16])&IF(RC[-15]="",,"|n"&R1C20&RC[-15])&IF(RC[-14]="",,"|n"&R1C21&RC[-14])&IF(RC[-13]="",,"|n"&R1C22&RC[-13])&IF(RC[-12]="",,"|n"&R1C23&RC[-12])&IF(RC[-11]="",,"|n"&R1C24&RC[-11])&IF(RC[-10]="",,"|n"&R1C25&RC[-10])&IF(RC[-9]="",,"|n"&R1C26&RC[-9])&IF(RC[-8]="",,"|n"&R1C27&RC[-8])&IF(RC[-6]&RC[-5]&RC[-4]="",,"|n"&R1C28)&IF(RC[-6]="",,"|n"&R1C29&RC[-6])&IF(RC[-5]="",,"|n"&R1C30&RC[-5])&IF(RC[-4]="",,"|n"&R1C31&RC[-4])&IF(RC[-2]="",,"|n"&RC[-2]) -> |cFFFFFF99基础属性|r|n攻击:297481|n|cFFFFFF55附加属性|r(%)|n攻速:40|n攻击吸血:35|n升级途径:|cFF1BE6B8击杀20只 烈焰龙龟(熔火之心3) |r 升级
A17: 22 | B17: 4 | C17: C | D17: 烈焰长剑 | E17: - Lv | F17: 3 | H17: =INT(480*RC[-7]*POWER(10,0.07*RC[-7])) -> 366154 | O17: 40 | P17: 35 | AG17: ="升级途径:|cFF1BE6B8"&"击杀20只 "&VLOOKUP(VLOOKUP(Sheet1!RC[-31],Sheet2!R20C1:R25C3,3,0),Sheet2!R28C2:R32C10,1+R[1]C[-27],0)&"("&VLOOKUP(Sheet1!RC[-31],Sheet2!R20C1:R25C3,3,0)&R[1]C[-27]&") |r 升级" -> 升级途径:|cFF1BE6B8击杀20只 幼龙(熔火之心4) |r 升级 | AH17: =VLOOKUP(RC[-31],Sheet2!R1C1:R7C2,2,0)&RC[-30]&RC[-29]&RC[-28]&Sheet2!R1C3&"" -> |cFF99FF66烈焰长剑 - Lv3|r | AI17: =IF(RC[-27]&RC[-26]&RC[-25]&RC[-24]&RC[-23]&RC[-22]="",,R1C7)&IF(RC[-27]="",,"|n"&R1C8&RC[-27])&IF(RC[-26]="",,"|n"&R1C9&RC[-26])&IF(RC[-25]="",,"|n"&R1C10&RC[-25])&IF(RC[-24]="",,"|n"&R1C11&RC[-24])&IF(RC[-23]="",,"|n"&R1C12&RC[-23])&IF(RC[-22]="",,"|n"&R1C13&RC[-22])&IF(RC[-20]&RC[-19]&RC[-18]&RC[-17]&RC[-16]&RC[-15]&RC[-14]&RC[-13]&RC[-12]&RC[-11]&RC[-10]&RC[-9]&RC[-8]="",,"|n"&R1C14)&IF(RC[-20]="",,"|n"&R1C15&RC[-20])&IF(RC[-19]="",,"|n"&R1C16&RC[-19])&IF(RC[-18]="",,"|n"&R1C17&RC[-18])&IF(RC[-17]="",,"|n"&R1C18&RC[-17])&IF(RC[-16]="",,"|n"&R1C19&RC[-16])&IF(RC[-15]="",,"|n"&R1C20&RC[-15])&IF(RC[-14]="",,"|n"&R1C21&RC[-14])&IF(RC[-13]="",,"|n"&R1C22&RC[-13])&IF(RC[-12]="",,"|n"&R1C23&RC[-12])&IF(RC[-11]="",,"|n"&R1C24&RC[-11])&IF(RC[-10]="",,"|n"&R1C25&RC[-10])&IF(RC[-9]="",,"|n"&R1C26&RC[-9])&IF(RC[-8]="",,"|n"&R1C27&RC[-8])&IF(RC[-6]&RC[-5]&RC[-4]="",,"|n"&R1C28)&IF(RC[-6]="",,"|n"&R1C29&RC[-6])&IF(RC[-5]="",,"|n"&R1C30&RC[-5])&IF(RC[-4]="",,"|n"&R1C31&RC[-4])&IF(RC[-2]="",,"|n"&RC[-2]) -> |cFFFFFF99基础属性|r|n攻击:366154|n|cFFFFFF55附加属性|r(%)|n攻速:40|n攻击吸血:35|n升级途径:|cFF1BE6B8击杀20只 幼龙(熔火之心4) |r 升级
A18: 23 | B18: 5 | C18: C | D18: 烈焰长剑 | E18: - Lv | F18: 4 | H18: =INT(480*RC[-7]*POWER(10,0.07*RC[-7])) -> 449747 | O18: 40 | P18: 35 | AG18: ="升级途径:|cFF1BE6B8"&"击杀20只 "&VLOOKUP(VLOOKUP(Sheet1!RC[-31],Sheet2!R20C1:R25C3,3,0),Sheet2!R28C2:R32C10,1+R[1]C[-27],0)&"("&VLOOKUP(Sheet1!RC[-31],Sheet2!R20C1:R25C3,3,0)&R[1]C[-27]&") |r 升级" -> 升级途径:|cFF1BE6B8击杀20只 冰霜巨魔(祖阿曼岛1) |r 升级 | AH18: =VLOOKUP(RC[-31],Sheet2!R1C1:R7C2,2,0)&RC[-30]&RC[-29]&RC[-28]&Sheet2!R1C3&"" -> |cFF99FF66烈焰长剑 - Lv4|r | AI18: =IF(RC[-27]&RC[-26]&RC[-25]&RC[-24]&RC[-23]&RC[-22]="",,R1C7)&IF(RC[-27]="",,"|n"&R1C8&RC[-27])&IF(RC[-26]="",,"|n"&R1C9&RC[-26])&IF(RC[-25]="",,"|n"&R1C10&RC[-25])&IF(RC[-24]="",,"|n"&R1C11&RC[-24])&IF(RC[-23]="",,"|n"&R1C12&RC[-23])&IF(RC[-22]="",,"|n"&R1C13&RC[-22])&IF(RC[-20]&RC[-19]&RC[-18]&RC[-17]&RC[-16]&RC[-15]&RC[-14]&RC[-13]&RC[-12]&RC[-11]&RC[-10]&RC[-9]&RC[-8]="",,"|n"&R1C14)&IF(RC[-20]="",,"|n"&R1C15&RC[-20])&IF(RC[-19]="",,"|n"&R1C16&RC[-19])&IF(RC[-18]="",,"|n"&R1C17&RC[-18])&IF(RC[-17]="",,"|n"&R1C18&RC[-17])&IF(RC[-16]="",,"|n"&R1C19&RC[-16])&IF(RC[-15]="",,"|n"&R1C20&RC[-15])&IF(RC[-14]="",,"|n"&R1C21&RC[-14])&IF(RC[-13]="",,"|n"&R1C22&RC[-13])&IF(RC[-12]="",,"|n"&R1C23&RC[-12])&IF(RC[-11]="",,"|n"&R1C24&RC[-11])&IF(RC[-10]="",,"|n"&R1C25&RC[-10])&IF(RC[-9]="",,"|n"&R1C26&RC[-9])&IF(RC[-8]="",,"|n"&R1C27&RC[-8])&IF(RC[-6]&RC[-5]&RC[-4]="",,"|n"&R1C28)&IF(RC[-6]="",,"|n"&R1C29&RC[-6])&IF(RC[-5]="",,"|n"&R1C30&RC[-5])&IF(RC[-4]="",,"|n"&R1C31&RC[-4])&IF(RC[-2]="",,"|n"&RC[-2]) -> |cFFFFFF99基础属性|r|n攻击:449747|n|cFFFFFF55附加属性|r(%)|n攻速:40|n攻击吸血:35|n升级途径:|cFF1BE6B8击杀20只 冰霜巨魔(祖阿曼岛1) |r 升级
A19: 26 | B19: 5 | C19: B | D19: 龙吟长剑 | E19: - Lv | F19: 1 | H19: =INT(480*RC[-7]*POWER(10,0.07*RC[-7])) -> 824545 | O19: 50 | P19: 30 | AG19: ="升级途径:|cFF1BE6B8"&"击杀20只 "&VLOOKUP(VLOOKUP(Sheet1!RC[-31],Sheet2!R20C1:R25C3,3,0),Sheet2!R28C2:R32C10,1+R[1]C[-27],0)&"("&VLOOKUP(Sheet1!RC[-31],Sheet2!R20C1:R25C3,3,0)&R[1]C[-27]&") |r 升级" -> 升级途径:|cFF1BE6B8击杀20只 丛林巨魔(祖阿曼岛2) |r 升级 | AH19: =VLOOKUP(RC[-31],Sheet2!R1C1:R7C2,2,0)&RC[-30]&RC[-29]&RC[-28]&Sheet2!R1C3&"" -> |cFF99FF66龙吟长剑 - Lv1|r | AI19: =IF(RC[-27]&RC[-26]&RC[-25]&RC[-24]&RC[-23]&RC[-22]="",,R1C7)&IF(RC[-27]="",,"|n"&R1C8&RC[-27])&IF(RC[-26]="",,"|n"&R1C9&RC[-26])&IF(RC[-25]="",,"|n"&R1C10&RC[-25])&IF(RC[-24]="",,"|n"&R1C11&RC[-24])&IF(RC[-23]="",,"|n"&R1C12&RC[-23])&IF(RC[-22]="",,"|n"&R1C13&RC[-22])&IF(RC[-20]&RC[-19]&RC[-18]&RC[-17]&RC[-16]&RC[-15]&RC[-14]&RC[-13]&RC[-12]&RC[-11]&RC[-10]&RC[-9]&RC[-8]="",,"|n"&R1C14)&IF(RC[-20]="",,"|n"&R1C15&RC[-20])&IF(RC[-19]="",,"|n"&R1C16&RC[-19])&IF(RC[-18]="",,"|n"&R1C17&RC[-18])&IF(RC[-17]="",,"|n"&R1C18&RC[-17])&IF(RC[-16]="",,"|n"&R1C19&RC[-16])&IF(RC[-15]="",,"|n"&R1C20&RC[-15])&IF(RC[-14]="",,"|n"&R1C21&RC[-14])&IF(RC[-13]="",,"|n"&R1C22&RC[-13])&IF(RC[-12]="",,"|n"&R1C23&RC[-12])&IF(RC[-11]="",,"|n"&R1C24&RC[-11])&IF(RC[-10]="",,"|n"&R1C25&RC[-10])&IF(RC[-9]="",,"|n"&R1C26&RC[-9])&IF(RC[-8]="",,"|n"&R1C27&RC[-8])&IF(RC[-6]&RC[-5]&RC[-4]="",,"|n"&R1C28)&IF(RC[-6]="",,"|n"&R1C29&RC[-6])&IF(RC[-5]="",,"|n"&R1C30&RC[-5])&IF(RC[-4]="",,"|n"&R1C31&RC[-4])&IF(RC[-2]="",,"|n"&RC[-2]) -> |cFFFFFF99基础属性|r|n攻击:824545|n|cFFFFFF55附加属性|r(%)|n攻速:50|n攻击吸血:30|n升级途径:|cFF1BE6B8击杀20只 丛林巨魔(祖阿曼岛2) |r 升级
A20: 27 | B20: 5 | C20: B | D20: 龙吟长剑 | E20: - Lv | F20: 2 | H20: =INT(480*RC[-7]*POWER(10,0.07*RC[-7])) -> 1006016 | O20: 50 | P20: 30 | AG20: ="升级途径:|cFF1BE6B8"&"击杀20只 "&VLOOKUP(VLOOKUP(Sheet1!RC[-31],Sheet2!R20C1:R25C3,3,0),Sheet2!R28C2:R32C10,1+R[1]C[-27],0)&"("&VLOOKUP(Sheet1!RC[-31],Sheet2!R20C1:R25C3,3,0)&R[1]C[-27]&") |r 升级" -> 升级途径:|cFF1BE6B8击杀20只 娜迦护卫(祖阿曼岛3) |r 升级 | AH20: =VLOOKUP(RC[-31],Sheet2!R1C1:R7C2,2,0)&RC[-30]&RC[-29]&RC[-28]&Sheet2!R1C3&"" -> |cFF99FF66龙吟长剑 - Lv2|r | AI20: =IF(RC[-27]&RC[-26]&RC[-25]&RC[-24]&RC[-23]&RC[-22]="",,R1C7)&IF(RC[-27]="",,"|n"&R1C8&RC[-27])&IF(RC[-26]="",,"|n"&R1C9&RC[-26])&IF(RC[-25]="",,"|n"&R1C10&RC[-25])&IF(RC[-24]="",,"|n"&R1C11&RC[-24])&IF(RC[-23]="",,"|n"&R1C12&RC[-23])&IF(RC[-22]="",,"|n"&R1C13&RC[-22])&IF(RC[-20]&RC[-19]&RC[-18]&RC[-17]&RC[-16]&RC[-15]&RC[-14]&RC[-13]&RC[-12]&RC[-11]&RC[-10]&RC[-9]&RC[-8]="",,"|n"&R1C14)&IF(RC[-20]="",,"|n"&R1C15&RC[-20])&IF(RC[-19]="",,"|n"&R1C16&RC[-19])&IF(RC[-18]="",,"|n"&R1C17&RC[-18])&IF(RC[-17]="",,"|n"&R1C18&RC[-17])&IF(RC[-16]="",,"|n"&R1C19&RC[-16])&IF(RC[-15]="",,"|n"&R1C20&RC[-15])&IF(RC[-14]="",,"|n"&R1C21&RC[-14])&IF(RC[-13]="",,"|n"&R1C22&RC[-13])&IF(RC[-12]="",,"|n"&R1C23&RC[-12])&IF(RC[-11]="",,"|n"&R1C24&RC[-11])&IF(RC[-10]="",,"|n"&R1C25&RC[-10])&IF(RC[-9]="",,"|n"&R1C26&RC[-9])&IF(RC[-8]="",,"|n"&R1C27&RC[-8])&IF(RC[-6]&RC[-5]&RC[-4]="",,"|n"&R1C28)&IF(RC[-6]="",,"|n"&R1C29&RC[-6])&IF(RC[-5]="",,"|n"&R1C30&RC[-5])&IF(RC[-4]="",,"|n"&R1C31&RC[-4])&IF(RC[-2]="",,"|n"&RC[-2]) -> |cFFFFFF99基础属性|r|n攻击:1006016|n|cFFFFFF55附加属性|r(%)|n攻速:50|n攻击吸血:30|n升级途径:|cFF1BE6B8击杀20只 娜迦护卫(祖阿曼岛3) |r 升级
A21: 28 | B21: 5 | C21: B | D21: 龙吟长剑 | E21: - Lv | F21: 3 | H21: =INT(480*RC[-7]*POWER(10,0.07*RC[-7])) -> 1225742 | O21: 50 | P21: 30 | AG21: ="升级途径:|cFF1BE6B8"&"击杀20只 "&VLOOKUP(VLOOKUP(Sheet1!RC[-31],Sheet2!R20C1:R25C3,3,0),Sheet2!R28C2:R32C10,1+R[1]C[-27],0)&"("&VLOOKUP(Sheet1!RC[-31],Sheet2!R20C1:R25C3,3,0)&R[1]C[-27]&") |r 升级" -> 升级途径:|cFF1BE6B8击杀20只 黑暗巨魔(祖阿曼岛4) |r 升级 | AH21: =VLOOKUP(RC[-31],Sheet2!R1C1:R7C2,2,0)&RC[-30]&RC[-29]&RC[-28]&Sheet2!R1C3&"" -> |cFF99FF66龙吟长剑 - Lv3|r | AI21: =IF(RC[-27]&RC[-26]&RC[-25]&RC[-24]&RC[-23]&RC[-22]="",,R1C7)&IF(RC[-27]="",,"|n"&R1C8&RC[-27])&IF(RC[-26]="",,"|n"&R1C9&RC[-26])&IF(RC[-25]="",,"|n"&R1C10&RC[-25])&IF(RC[-24]="",,"|n"&R1C11&RC[-24])&IF(RC[-23]="",,"|n"&R1C12&RC[-23])&IF(RC[-22]="",,"|n"&R1C13&RC[-22])&IF(RC[-20]&RC[-19]&RC[-18]&RC[-17]&RC[-16]&RC[-15]&RC[-14]&RC[-13]&RC[-12]&RC[-11]&RC[-10]&RC[-9]&RC[-8]="",,"|n"&R1C14)&IF(RC[-20]="",,"|n"&R1C15&RC[-20])&IF(RC[-19]="",,"|n"&R1C16&RC[-19])&IF(RC[-18]="",,"|n"&R1C17&RC[-18])&IF(RC[-17]="",,"|n"&R1C18&RC[-17])&IF(RC[-16]="",,"|n"&R1C19&RC[-16])&IF(RC[-15]="",,"|n"&R1C20&RC[-15])&IF(RC[-14]="",,"|n"&R1C21&RC[-14])&IF(RC[-13]="",,"|n"&R1C22&RC[-13])&IF(RC[-12]="",,"|n"&R1C23&RC[-12])&IF(RC[-11]="",,"|n"&R1C24&RC[-11])&IF(RC[-10]="",,"|n"&R1C25&RC[-10])&IF(RC[-9]="",,"|n"&R1C26&RC[-9])&IF(RC[-8]="",,"|n"&R1C27&RC[-8])&IF(RC[-6]&RC[-5]&RC[-4]="",,"|n"&R1C28)&IF(RC[-6]="",,"|n"&R1C29&RC[-6])&IF(RC[-5]="",,"|n"&R1C30&RC[-5])&IF(RC[-4]="",,"|n"&R1C31&RC[-4])&IF(RC[-2]="",,"|n"&RC[-2]) -> |cFFFFFF99基础属性|r|n攻击:1225742|n|cFFFFFF55附加属性|r(%)|n攻速:50|n攻击吸血:30|n升级途径:|cFF1BE6B8击杀20只 黑暗巨魔(祖阿曼岛4) |r 升级
A22: 29 | B22: 6 | C22: B | D22: 龙吟长剑 | E22: - Lv | F22: 4 | H22: =INT(480*RC[-7]*POWER(10,0.07*RC[-7])) -> 1491554 | O22: 50 | P22: 30 | AG22: ="升级途径:|cFF1BE6B8"&"击杀20只 "&VLOOKUP(VLOOKUP(Sheet1!RC[-31],Sheet2!R20C1:R25C3,3,0),Sheet2!R28C2:R32C10,1+R[1]C[-27],0)&"("&VLOOKUP(Sheet1!RC[-31],Sheet2!R20C1:R25C3,3,0)&R[1]C[-27]&") |r 升级" -> 升级途径:|cFF1BE6B8击杀20只 火元素(达拉然奥术秘境1) |r 升级 | AH22: =VLOOKUP(RC[-31],Sheet2!R1C1:R7C2,2,0)&RC[-30]&RC[-29]&RC[-28]&Sheet2!R1C3&"" -> |cFF99FF66龙吟长剑 - Lv4|r | AI22: =IF(RC[-27]&RC[-26]&RC[-25]&RC[-24]&RC[-23]&RC[-22]="",,R1C7)&IF(RC[-27]="",,"|n"&R1C8&RC[-27])&IF(RC[-26]="",,"|n"&R1C9&RC[-26])&IF(RC[-25]="",,"|n"&R1C10&RC[-25])&IF(RC[-24]="",,"|n"&R1C11&RC[-24])&IF(RC[-23]="",,"|n"&R1C12&RC[-23])&IF(RC[-22]="",,"|n"&R1C13&RC[-22])&IF(RC[-20]&RC[-19]&RC[-18]&RC[-17]&RC[-16]&RC[-15]&RC[-14]&RC[-13]&RC[-12]&RC[-11]&RC[-10]&RC[-9]&RC[-8]="",,"|n"&R1C14)&IF(RC[-20]="",,"|n"&R1C15&RC[-20])&IF(RC[-19]="",,"|n"&R1C16&RC[-19])&IF(RC[-18]="",,"|n"&R1C17&RC[-18])&IF(RC[-17]="",,"|n"&R1C18&RC[-17])&IF(RC[-16]="",,"|n"&R1C19&RC[-16])&IF(RC[-15]="",,"|n"&R1C20&RC[-15])&IF(RC[-14]="",,"|n"&R1C21&RC[-14])&IF(RC[-13]="",,"|n"&R1C22&RC[-13])&IF(RC[-12]="",,"|n"&R1C23&RC[-12])&IF(RC[-11]="",,"|n"&R1C24&RC[-11])&IF(RC[-10]="",,"|n"&R1C25&RC[-10])&IF(RC[-9]="",,"|n"&R1C26&RC[-9])&IF(RC[-8]="",,"|n"&R1C27&RC[-8])&IF(RC[-6]&RC[-5]&RC[-4]="",,"|n"&R1C28)&IF(RC[-6]="",,"|n"&R1C29&RC[-6])&IF(RC[-5]="",,"|n"&R1C30&RC[-5])&IF(RC[-4]="",,"|n"&R1C31&RC[-4])&IF(RC[-2]="",,"|n"&RC[-2]) -> |cFFFFFF99基础属性|r|n攻击:1491554|n|cFFFFFF55附加属性|r(%)|n攻速:50|n攻击吸血:30|n升级途径:|cFF1BE6B8击杀20只 火元素(达拉然奥术秘境1) |r 升级
A23: 32 | B23: 6 | C23: A | D23: 神使长剑 | E23: - Lv | F23: 1 | H23: =INT(480*RC[-7]*POWER(10,0.07*RC[-7])) -> 2669262 | O23: 60 | P23: 25 | AG23: ="升级途径:|cFF1BE6B8"&"击杀20只 "&VLOOKUP(VLOOKUP(Sheet1!RC[-31],Sheet2!R20C1:R25C3,3,0),Sheet2!R28C2:R32C10,1+R[1]C[-27],0)&"("&VLOOKUP(Sheet1!RC[-31],Sheet2!R20C1:R25C3,3,0)&R[1]C[-27]&") |r 升级" -> 升级途径:|cFF1BE6B8击杀20只 风元素(达拉然奥术秘境2) |r 升级 | AH23: =VLOOKUP(RC[-31],Sheet2!R1C1:R7C2,2,0)&RC[-30]&RC[-29]&RC[-28]&Sheet2!R1C3&"" -> |cFF99FF66神使长剑 - Lv1|r | AI23: =IF(RC[-27]&RC[-26]&RC[-25]&RC[-24]&RC[-23]&RC[-22]="",,R1C7)&IF(RC[-27]="",,"|n"&R1C8&RC[-27])&IF(RC[-26]="",,"|n"&R1C9&RC[-26])&IF(RC[-25]="",,"|n"&R1C10&RC[-25])&IF(RC[-24]="",,"|n"&R1C11&RC[-24])&IF(RC[-23]="",,"|n"&R1C12&RC[-23])&IF(RC[-22]="",,"|n"&R1C13&RC[-22])&IF(RC[-20]&RC[-19]&RC[-18]&RC[-17]&RC[-16]&RC[-15]&RC[-14]&RC[-13]&RC[-12]&RC[-11]&RC[-10]&RC[-9]&RC[-8]="",,"|n"&R1C14)&IF(RC[-20]="",,"|n"&R1C15&RC[-20])&IF(RC[-19]="",,"|n"&R1C16&RC[-19])&IF(RC[-18]="",,"|n"&R1C17&RC[-18])&IF(RC[-17]="",,"|n"&R1C18&RC[-17])&IF(RC[-16]="",,"|n"&R1C19&RC[-16])&IF(RC[-15]="",,"|n"&R1C20&RC[-15])&IF(RC[-14]="",,"|n"&R1C21&RC[-14])&IF(RC[-13]="",,"|n"&R1C22&RC[-13])&IF(RC[-12]="",,"|n"&R1C23&RC[-12])&IF(RC[-11]="",,"|n"&R1C24&RC[-11])&IF(RC[-10]="",,"|n"&R1C25&RC[-10])&IF(RC[-9]="",,"|n"&R1C26&RC[-9])&IF(RC[-8]="",,"|n"&R1C27&RC[-8])&IF(RC[-6]&RC[-5]&RC[-4]="",,"|n"&R1C28)&IF(RC[-6]="",,"|n"&R1C29&RC[-6])&IF(RC[-5]="",,"|n"&R1C30&RC[-5])&IF(RC[-4]="",,"|n"&R1C31&RC[-4])&IF(RC[-2]="",,"|n"&RC[-2]) -> |cFFFFFF99基础属性|r|n攻击:2669262|n|cFFFFFF55附加属性|r(%)|n攻速:60|n攻击吸血:25|n升级途径:|cFF1BE6B8击杀20只 风元素(达拉然奥术秘境2) |r 升级
A24: 33 | B24: 6 | C24: A | D24: 神使长剑 | E24: - Lv | F24: 2 | H24: =INT(480*RC[-7]*POWER(10,0.07*RC[-7])) -> 3234112 | O24: 60 | P24: 25 | AG24: ="升级途径:|cFF1BE6B8"&"击杀20只 "&VLOOKUP(VLOOKUP(Sheet1!RC[-31],Sheet2!R20C1:R25C3,3,0),Sheet2!R28C2:R32C10,1+R[1]C[-27],0)&"("&VLOOKUP(Sheet1!RC[-31],Sheet2!R20C1:R25C3,3,0)&R[1]C[-27]&") |r 升级" -> 升级途径:|cFF1BE6B8击杀20只 水元素(达拉然奥术秘境3) |r 升级 | AH24: =VLOOKUP(RC[-31],Sheet2!R1C1:R7C2,2,0)&RC[-30]&RC[-29]&RC[-28]&Sheet2!R1C3&"" -> |cFF99FF66神使长剑 - Lv2|r | AI24: =IF(RC[-27]&RC[-26]&RC[-25]&RC[-24]&RC[-23]&RC[-22]="",,R1C7)&IF(RC[-27]="",,"|n"&R1C8&RC[-27])&IF(RC[-26]="",,"|n"&R1C9&RC[-26])&IF(RC[-25]="",,"|n"&R1C10&RC[-25])&IF(RC[-24]="",,"|n"&R1C11&RC[-24])&IF(RC[-23]="",,"|n"&R1C12&RC[-23])&IF(RC[-22]="",,"|n"&R1C13&RC[-22])&IF(RC[-20]&RC[-19]&RC[-18]&RC[-17]&RC[-16]&RC[-15]&RC[-14]&RC[-13]&RC[-12]&RC[-11]&RC[-10]&RC[-9]&RC[-8]="",,"|n"&R1C14)&IF(RC[-20]="",,"|n"&R1C15&RC[-20])&IF(RC[-19]="",,"|n"&R1C16&RC[-19])&IF(RC[-18]="",,"|n"&R1C17&RC[-18])&IF(RC[-17]="",,"|n"&R1C18&RC[-17])&IF(RC[-16]="",,"|n"&R1C19&RC[-16])&IF(RC[-15]="",,"|n"&R1C20&RC[-15])&IF(RC[-14]="",,"|n"&R1C21&RC[-14])&IF(RC[-13]="",,"|n"&R1C22&RC[-13])&IF(RC[-12]="",,"|n"&R1C23&RC[-12])&IF(RC[-11]="",,"|n"&R1C24&RC[-11])&IF(RC[-10]="",,"|n"&R1C25&RC[-10])&IF(RC[-9]="",,"|n"&R1C26&RC[-9])&IF(RC[-8]="",,"|n"&R1C27&RC[-8])&IF(RC[-6]&RC[-5]&RC[-4]="",,"|n"&R1C28)&IF(RC[-6]="",,"|n"&R1C29&RC[-6])&IF(RC[-5]="",,"|n"&R1C30&RC[-5])&IF(RC[-4]="",,"|n"&R1C31&RC[-4])&IF(RC[-2]="",,"|n"&RC[-2]) -> |cFFFFFF99基础属性|r|n攻击:3234112|n|cFFFFFF55附加属性|r(%)|n攻速:60|n攻击吸血:25|n升级途径:|cFF1BE6B8击杀20只 水元素(达拉然奥术秘境3) |r 升级
A25: 34 | B25: 6 | C25: A | D25: 神使长剑 | E25: - Lv | F25: 3 | H25: =INT(480*RC[-7]*POWER(10,0.07*RC[-7])) -> 3914895 | O25: 60 | P25: 25 | AG25: ="升级途径:|cFF1BE6B8"&"击杀20只 "&VLOOKUP(VLOOKUP(Sheet1!RC[-31],Sheet2!R20C1:R25C3,3,0),Sheet2!R28C2:R32C10,1+R[1]C[-27],0)&"("&VLOOKUP(Sheet1!RC[-31],Sheet2!R20C1:R25C3,3,0)&R[1]C[-27]&") |r 升级" -> 升级途径:|cFF1BE6B8击杀20只 土元素(达拉然奥术秘境4) |r 升级 | AH25: =VLOOKUP(RC[-31],Sheet2!R1C1:R7C2,2,0)&RC[-30]&RC[-29]&RC[-28]&Sheet2!R1C3&"" -> |cFF99FF66神使长剑 - Lv3|r | AI25: =IF(RC[-27]&RC[-26]&RC[-25]&RC[-24]&RC[-23]&RC[-22]="",,R1C7)&IF(RC[-27]="",,"|n"&R1C8&RC[-27])&IF(RC[-26]="",,"|n"&R1C9&RC[-26])&IF(RC[-25]="",,"|n"&R1C10&RC[-25])&IF(RC[-24]="",,"|n"&R1C11&RC[-24])&IF(RC[-23]="",,"|n"&R1C12&RC[-23])&IF(RC[-22]="",,"|n"&R1C13&RC[-22])&IF(RC[-20]&RC[-19]&RC[-18]&RC[-17]&RC[-16]&RC[-15]&RC[-14]&RC[-13]&RC[-12]&RC[-11]&RC[-10]&RC[-9]&RC[-8]="",,"|n"&R1C14)&IF(RC[-20]="",,"|n"&R1C15&RC[-20])&IF(RC[-19]="",,"|n"&R1C16&RC[-19])&IF(RC[-18]="",,"|n"&R1C17&RC[-18])&IF(RC[-17]="",,"|n"&R1C18&RC[-17])&IF(RC[-16]="",,"|n"&R1C19&RC[-16])&IF(RC[-15]="",,"|n"&R1C20&RC[-15])&IF(RC[-14]="",,"|n"&R1C21&RC[-14])&IF(RC[-13]="",,"|n"&R1C22&RC[-13])&IF(RC[-12]="",,"|n"&R1C23&RC[-12])&IF(RC[-11]="",,"|n"&R1C24&RC[-11])&IF(RC[-10]="",,"|n"&R1C25&RC[-10])&IF(RC[-9]="",,"|n"&R1C26&RC[-9])&IF(RC[-8]="",,"|n"&R1C27&RC[-8])&IF(RC[-6]&RC[-5]&RC[-4]="",,"|n"&R1C28)&IF(RC[-6]="",,"|n"&R1C29&RC[-6])&IF(RC[-5]="",,"|n"&R1C30&RC[-5])&IF(RC[-4]="",,"|n"&R1C31&RC[-4])&IF(RC[-2]="",,"|n"&RC[-2]) -> |cFFFFFF99基础属性|r|n攻击:3914895|n|cFFFFFF55附加属性|r(%)|n攻速:60|n攻击吸血:25|n升级途径:|cFF1BE6B8击杀20只 土元素(达拉然奥术秘境4) |r 升级
A26: 35 | B26: 7 | C26: A | D26: 神使长剑 | E26: - Lv | F26: 4 | H26: =INT(480*RC[-7]*POWER(10,0.07*RC[-7])) -> 4734883 | O26: 60 | P26: 25 | AG26: =VLOOKUP(RC[-31],Sheet2!R20C1:R25C5,5,0) -> 升级途径:|cFF1BE6B8找 圣魂信仰NPC(后山)|r 合成升级 | AH26: =VLOOKUP(RC[-31],Sheet2!R1C1:R7C2,2,0)&RC[-30]&RC[-29]&RC[-28]&Sheet2!R1C3&"" -> |cFF99FF66神使长剑 - Lv4|r | AI26: =IF(RC[-27]&RC[-26]&RC[-25]&RC[-24]&RC[-23]&RC[-22]="",,R1C7)&IF(RC[-27]="",,"|n"&R1C8&RC[-27])&IF(RC[-26]="",,"|n"&R1C9&RC[-26])&IF(RC[-25]="",,"|n"&R1C10&RC[-25])&IF(RC[-24]="",,"|n"&R1C11&RC[-24])&IF(RC[-23]="",,"|n"&R1C12&RC[-23])&IF(RC[-22]="",,"|n"&R1C13&RC[-22])&IF(RC[-20]&RC[-19]&RC[-18]&RC[-17]&RC[-16]&RC[-15]&RC[-14]&RC[-13]&RC[-12]&RC[-11]&RC[-10]&RC[-9]&RC[-8]="",,"|n"&R1C14)&IF(RC[-20]="",,"|n"&R1C15&RC[-20])&IF(RC[-19]="",,"|n"&R1C16&RC[-19])&IF(RC[-18]="",,"|n"&R1C17&RC[-18])&IF(RC[-17]="",,"|n"&R1C18&RC[-17])&IF(RC[-16]="",,"|n"&R1C19&RC[-16])&IF(RC[-15]="",,"|n"&R1C20&RC[-15])&IF(RC[-14]="",,"|n"&R1C21&RC[-14])&IF(RC[-13]="",,"|n"&R1C22&RC[-13])&IF(RC[-12]="",,"|n"&R1C23&RC[-12])&IF(RC[-11]="",,"|n"&R1C24&RC[-11])&IF(RC[-10]="",,"|n"&R1C25&RC[-10])&IF(RC[-9]="",,"|n"&R1C26&RC[-9])&IF(RC[-8]="",,"|n"&R1C27&RC[-8])&IF(RC[-6]&RC[-5]&RC[-4]="",,"|n"&R1C28)&IF(RC[-6]="",,"|n"&R1C29&RC[-6])&IF(RC[-5]="",,"|n"&R1C30&RC[-5])&IF(RC[-4]="",,"|n"&R1C31&RC[-4])&IF(RC[-2]="",,"|n"&RC[-2]) -> |cFFFFFF99基础属性|r|n攻击:4734883|n|cFFFFFF55附加属性|r(%)|n攻速:60|n攻击吸血:25|n升级途径:|cFF1BE6B8找 圣魂信仰NPC(后山)|r 合成升级
A27: 1 | B27: 1 | C27: F | D27: 制式护甲 | E27: - Lv | F27: 1 | I27: =INT(120*RC[-8]*POWER(10,0.07*RC[-8])) -> 140 | J27: =RC[-1] -> 140 | K27: =RC[-1] -> 140 | L27: =INT(1000*RC[-11]*POWER(10,0.07*RC[-11])) -> 1174 | M27: =INT(10000*POWER(10,0.019*RC[-12])) -> 10447 | AG27: =VLOOKUP(RC[-30],Sheet2!R1C1:R7C7,7,0) -> 升级途径:|cFF1BE6B8找 装备升级NPC(练功房) 挑战升级|r | AH27: =VLOOKUP(RC[-31],Sheet2!R1C1:R7C2,2,0)&RC[-30]&RC[-29]&RC[-28]&Sheet2!R1C3&"" -> |cFF999999制式护甲 - Lv1|r | AI27: =IF(RC[-27]&RC[-26]&RC[-25]&RC[-24]&RC[-23]&RC[-22]="",,R1C7)&IF(RC[-27]="",,"|n"&R1C8&RC[-27])&IF(RC[-26]="",,"|n"&R1C9&RC[-26])&IF(RC[-25]="",,"|n"&R1C10&RC[-25])&IF(RC[-24]="",,"|n"&R1C11&RC[-24])&IF(RC[-23]="",,"|n"&R1C12&RC[-23])&IF(RC[-22]="",,"|n"&R1C13&RC[-22])&IF(RC[-20]&RC[-19]&RC[-18]&RC[-17]&RC[-16]&RC[-15]&RC[-14]&RC[-13]&RC[-12]&RC[-11]&RC[-10]&RC[-9]&RC[-8]="",,"|n"&R1C14)&IF(RC[-20]="",,"|n"&R1C15&RC[-20])&IF(RC[-19]="",,"|n"&R1C16&RC[-19])&IF(RC[-18]="",,"|n"&R1C17&RC[-18])&IF(RC[-17]="",,"|n"&R1C18&RC[-17])&IF(RC[-16]="",,"|n"&R1C19&RC[-16])&IF(RC[-15]="",,"|n"&R1C20&RC[-15])&IF(RC[-14]="",,"|n"&R1C21&RC[-14])&IF(RC[-13]="",,"|n"&R1C22&RC[-13])&IF(RC[-12]="",,"|n"&R1C23&RC[-12])&IF(RC[-11]="",,"|n"&R1C24&RC[-11])&IF(RC[-10]="",,"|n"&R1C25&RC[-10])&IF(RC[-9]="",,"|n"&R1C26&RC[-9])&IF(RC[-8]="",,"|n"&R1C27&RC[-8])&IF(RC[-6]&RC[-5]&RC[-4]="",,"|n"&R1C28)&IF(RC[-6]="",,"|n"&R1C29&RC[-6])&IF(RC[-5]="",,"|n"&R1C30&RC[-5])&IF(RC[-4]="",,"|n"&R1C31&RC[-4])&IF(RC[-2]="",,"|n"&RC[-2]) -> |cFFFFFF99基础属性|r|n力量:140|n敏捷:140|n智力:140|n血量:1174|n护甲:10447|n升级途径:|cFF1BE6B8找 装备升级NPC(练功房) 挑战升级|r
A28: 2 | B28: 1 | C28: F | D28: 制式护甲 | E28: - Lv | F28: 2 | I28: =INT(120*RC[-8]*POWER(10,0.07*RC[-8])) -> 331 | J28: =RC[-1] -> 331 | K28: =RC[-1] -> 331 | L28: =INT(1000*RC[-11]*POWER(10,0.07*RC[-11])) -> 2760 | M28: =INT(10000*POWER(10,0.019*RC[-12])) -> 10914 | AG28: =VLOOKUP(RC[-30],Sheet2!R1C1:R7C7,7,0) -> 升级途径:|cFF1BE6B8找 装备升级NPC(练功房) 挑战升级|r | AH28: =VLOOKUP(RC[-31],Sheet2!R1C1:R7C2,2,0)&RC[-30]&RC[-29]&RC[-28]&Sheet2!R1C3&"" -> |cFF999999制式护甲 - Lv2|r | AI28: =IF(RC[-27]&RC[-26]&RC[-25]&RC[-24]&RC[-23]&RC[-22]="",,R1C7)&IF(RC[-27]="",,"|n"&R1C8&RC[-27])&IF(RC[-26]="",,"|n"&R1C9&RC[-26])&IF(RC[-25]="",,"|n"&R1C10&RC[-25])&IF(RC[-24]="",,"|n"&R1C11&RC[-24])&IF(RC[-23]="",,"|n"&R1C12&RC[-23])&IF(RC[-22]="",,"|n"&R1C13&RC[-22])&IF(RC[-20]&RC[-19]&RC[-18]&RC[-17]&RC[-16]&RC[-15]&RC[-14]&RC[-13]&RC[-12]&RC[-11]&RC[-10]&RC[-9]&RC[-8]="",,"|n"&R1C14)&IF(RC[-20]="",,"|n"&R1C15&RC[-20])&IF(RC[-19]="",,"|n"&R1C16&RC[-19])&IF(RC[-18]="",,"|n"&R1C17&RC[-18])&IF(RC[-17]="",,"|n"&R1C18&RC[-17])&IF(RC[-16]="",,"|n"&R1C19&RC[-16])&IF(RC[-15]="",,"|n"&R1C20&RC[-15])&IF(RC[-14]="",,"|n"&R1C21&RC[-14])&IF(RC[-13]="",,"|n"&R1C22&RC[-13])&IF(RC[-12]="",,"|n"&R1C23&RC[-12])&IF(RC[-11]="",,"|n"&R1C24&RC[-11])&IF(RC[-10]="",,"|n"&R1C25&RC[-10])&IF(RC[-9]="",,"|n"&R1C26&RC[-9])&IF(RC[-8]="",,"|n"&R1C27&RC[-8])&IF(RC[-6]&RC[-5]&RC[-4]="",,"|n"&R1C28)&IF(RC[-6]="",,"|n"&R1C29&RC[-6])&IF(RC[-5]="",,"|n"&R1C30&RC[-5])&IF(RC[-4]="",,"|n"&R1C31&RC[-4])&IF(RC[-2]="",,"|n"&RC[-2]) -> |cFFFFFF99基础属性|r|n力量:331|n敏捷:331|n智力:331|n血量:2760|n护甲:10914|n升级途径:|cFF1BE6B8找 装备升级NPC(练功房) 挑战升级|r
A29: 3 | B29: 1 | C29: F | D29: 制式护甲 | E29: - Lv | F29: 3 | I29: =INT(120*RC[-8]*POWER(10,0.07*RC[-8])) -> 583 | J29: =RC[-1] -> 583 | K29: =RC[-1] -> 583 | L29: =INT(1000*RC[-11]*POWER(10,0.07*RC[-11])) -> 4865 | M29: =INT(10000*POWER(10,0.019*RC[-12])) -> 11402 | AG29: =VLOOKUP(RC[-30],Sheet2!R1C1:R7C7,7,0) -> 升级途径:|cFF1BE6B8找 装备升级NPC(练功房) 挑战升级|r | AH29: =VLOOKUP(RC[-31],Sheet2!R1C1:R7C2,2,0)&RC[-30]&RC[-29]&RC[-28]&Sheet2!R1C3&"" -> |cFF999999制式护甲 - Lv3|r | AI29: =IF(RC[-27]&RC[-26]&RC[-25]&RC[-24]&RC[-23]&RC[-22]="",,R1C7)&IF(RC[-27]="",,"|n"&R1C8&RC[-27])&IF(RC[-26]="",,"|n"&R1C9&RC[-26])&IF(RC[-25]="",,"|n"&R1C10&RC[-25])&IF(RC[-24]="",,"|n"&R1C11&RC[-24])&IF(RC[-23]="",,"|n"&R1C12&RC[-23])&IF(RC[-22]="",,"|n"&R1C13&RC[-22])&IF(RC[-20]&RC[-19]&RC[-18]&RC[-17]&RC[-16]&RC[-15]&RC[-14]&RC[-13]&RC[-12]&RC[-11]&RC[-10]&RC[-9]&RC[-8]="",,"|n"&R1C14)&IF(RC[-20]="",,"|n"&R1C15&RC[-20])&IF(RC[-19]="",,"|n"&R1C16&RC[-19])&IF(RC[-18]="",,"|n"&R1C17&RC[-18])&IF(RC[-17]="",,"|n"&R1C18&RC[-17])&IF(RC[-16]="",,"|n"&R1C19&RC[-16])&IF(RC[-15]="",,"|n"&R1C20&RC[-15])&IF(RC[-14]="",,"|n"&R1C21&RC[-14])&IF(RC[-13]="",,"|n"&R1C22&RC[-13])&IF(RC[-12]="",,"|n"&R1C23&RC[-12])&IF(RC[-11]="",,"|n"&R1C24&RC[-11])&IF(RC[-10]="",,"|n"&R1C25&RC[-10])&IF(RC[-9]="",,"|n"&R1C26&RC[-9])&IF(RC[-8]="",,"|n"&R1C27&RC[-8])&IF(RC[-6]&RC[-5]&RC[-4]="",,"|n"&R1C28)&IF(RC[-6]="",,"|n"&R1C29&RC[-6])&IF(RC[-5]="",,"|n"&R1C30&RC[-5])&IF(RC[-4]="",,"|n"&R1C31&RC[-4])&IF(RC[-2]="",,"|n"&RC[-2]) -> |cFFFFFF99基础属性|r|n力量:583|n敏捷:583|n智力:583|n血量:4865|n护甲:11402|n升级途径:|cFF1BE6B8找 装备升级NPC(练功房) 挑战升级|r
A30: 4 | B30: 1 | C30: F | D30: 制式护甲 | E30: - Lv | F30: 4 | I30: =INT(120*RC[-8]*POWER(10,0.07*RC[-8])) -> 914 | J30: =RC[-1] -> 914 | K30: =RC[-1] -> 914 | L30: =INT(1000*RC[-11]*POWER(10,0.07*RC[-11])) -> 7621 | M30: =INT(10000*POWER(10,0.019*RC[-12])) -> 11912 | AG30: =VLOOKUP(RC[-30],Sheet2!R1C1:R7C7,7,0) -> 升级途径:|cFF1BE6B8找 装备升级NPC(练功房) 挑战升级|r | AH30: =VLOOKUP(RC[-31],Sheet2!R1C1:R7C2,2,0)&RC[-30]&RC[-29]&RC[-28]&Sheet2!R1C3&"" -> |cFF999999制式护甲 - Lv4|r | AI30: =IF(RC[-27]&RC[-26]&RC[-25]&RC[-24]&RC[-23]&RC[-22]="",,R1C7)&IF(RC[-27]="",,"|n"&R1C8&RC[-27])&IF(RC[-26]="",,"|n"&R1C9&RC[-26])&IF(RC[-25]="",,"|n"&R1C10&RC[-25])&IF(RC[-24]="",,"|n"&R1C11&RC[-24])&IF(RC[-23]="",,"|n"&R1C12&RC[-23])&IF(RC[-22]="",,"|n"&R1C13&RC[-22])&IF(RC[-20]&RC[-19]&RC[-18]&RC[-17]&RC[-16]&RC[-15]&RC[-14]&RC[-13]&RC[-12]&RC[-11]&RC[-10]&RC[-9]&RC[-8]="",,"|n"&R1C14)&IF(RC[-20]="",,"|n"&R1C15&RC[-20])&IF(RC[-19]="",,"|n"&R1C16&RC[-19])&IF(RC[-18]="",,"|n"&R1C17&RC[-18])&IF(RC[-17]="",,"|n"&R1C18&RC[-17])&IF(RC[-16]="",,"|n"&R1C19&RC[-16])&IF(RC[-15]="",,"|n"&R1C20&RC[-15])&IF(RC[-14]="",,"|n"&R1C21&RC[-14])&IF(RC[-13]="",,"|n"&R1C22&RC[-13])&IF(RC[-12]="",,"|n"&R1C23&RC[-12])&IF(RC[-11]="",,"|n"&R1C24&RC[-11])&IF(RC[-10]="",,"|n"&R1C25&RC[-10])&IF(RC[-9]="",,"|n"&R1C26&RC[-9])&IF(RC[-8]="",,"|n"&R1C27&RC[-8])&IF(RC[-6]&RC[-5]&RC[-4]="",,"|n"&R1C28)&IF(RC[-6]="",,"|n"&R1C29&RC[-6])&IF(RC[-5]="",,"|n"&R1C30&RC[-5])&IF(RC[-4]="",,"|n"&R1C31&RC[-4])&IF(RC[-2]="",,"|n"&RC[-2]) -> |cFFFFFF99基础属性|r|n力量:914|n敏捷:914|n智力:914|n血量:7621|n护甲:11912|n升级途径:|cFF1BE6B8找 装备升级NPC(练功房) 挑战升级|r
A31: 5 | B31: 2 | C31: F | D31: 制式护甲 | E31: - Lv | F31: 5 | I31: =INT(120*RC[-8]*POWER(10,0.07*RC[-8])) -> 1343 | J31: =RC[-1] -> 1343 | K31: =RC[-1] -> 1343 | L31: =INT(1000*RC[-11]*POWER(10,0.07*RC[-11])) -> 11193 | M31: =INT(10000*POWER(10,0.019*RC[-12])) -> 12445 | AG31: ="升级途径:|cFF1BE6B8"&"击杀 "&VLOOKUP(VLOOKUP(Sheet1!RC[-31],Sheet2!R20C1:R25C3,3,0),Sheet2!R28C2:R32C10,5+R[1]C[-27],0)&"("&VLOOKUP(Sheet1!RC[-31],Sheet2!R20C1:R25C3,3,0)&R[1]C[-27]&") |r 升级" -> 升级途径:|cFF1BE6B8击杀 盗贼王(阿拉希盆地1) |r 升级 | AH31: =VLOOKUP(RC[-31],Sheet2!R1C1:R7C2,2,0)&RC[-30]&RC[-29]&RC[-28]&Sheet2!R1C3&"" -> |cFF999999制式护甲 - Lv5|r | AI31: =IF(RC[-27]&RC[-26]&RC[-25]&RC[-24]&RC[-23]&RC[-22]="",,R1C7)&IF(RC[-27]="",,"|n"&R1C8&RC[-27])&IF(RC[-26]="",,"|n"&R1C9&RC[-26])&IF(RC[-25]="",,"|n"&R1C10&RC[-25])&IF(RC[-24]="",,"|n"&R1C11&RC[-24])&IF(RC[-23]="",,"|n"&R1C12&RC[-23])&IF(RC[-22]="",,"|n"&R1C13&RC[-22])&IF(RC[-20]&RC[-19]&RC[-18]&RC[-17]&RC[-16]&RC[-15]&RC[-14]&RC[-13]&RC[-12]&RC[-11]&RC[-10]&RC[-9]&RC[-8]="",,"|n"&R1C14)&IF(RC[-20]="",,"|n"&R1C15&RC[-20])&IF(RC[-19]="",,"|n"&R1C16&RC[-19])&IF(RC[-18]="",,"|n"&R1C17&RC[-18])&IF(RC[-17]="",,"|n"&R1C18&RC[-17])&IF(RC[-16]="",,"|n"&R1C19&RC[-16])&IF(RC[-15]="",,"|n"&R1C20&RC[-15])&IF(RC[-14]="",,"|n"&R1C21&RC[-14])&IF(RC[-13]="",,"|n"&R1C22&RC[-13])&IF(RC[-12]="",,"|n"&R1C23&RC[-12])&IF(RC[-11]="",,"|n"&R1C24&RC[-11])&IF(RC[-10]="",,"|n"&R1C25&RC[-10])&IF(RC[-9]="",,"|n"&R1C26&RC[-9])&IF(RC[-8]="",,"|n"&R1C27&RC[-8])&IF(RC[-6]&RC[-5]&RC[-4]="",,"|n"&R1C28)&IF(RC[-6]="",,"|n"&R1C29&RC[-6])&IF(RC[-5]="",,"|n"&R1C30&RC[-5])&IF(RC[-4]="",,"|n"&R1C31&RC[-4])&IF(RC[-2]="",,"|n"&RC[-2]) -> |cFFFFFF99基础属性|r|n力量:1343|n敏捷:1343|n智力:1343|n血量:11193|n护甲:12445|n升级途径:|cFF1BE6B8击杀 盗贼王(阿拉希盆地1) |r 升级
A32: 8 | B32: 2 | C32: E | D32: 断水护甲 | E32: - Lv | F32: 1 | I32: =INT(120*RC[-8]*POWER(10,0.07*RC[-8])) -> 3485 | J32: =RC[-1] -> 3485 | K32: =RC[-1] -> 3485 | L32: =INT(1000*RC[-11]*POWER(10,0.07*RC[-11])) -> 29046 | M32: =INT(10000*POWER(10,0.019*RC[-12])) -> 14190 | AG32: ="升级途径:|cFF1BE6B8"&"击杀 "&VLOOKUP(VLOOKUP(Sheet1!RC[-31],Sheet2!R20C1:R25C3,3,0),Sheet2!R28C2:R32C10,5+R[1]C[-27],0)&"("&VLOOKUP(Sheet1!RC[-31],Sheet2!R20C1:R25C3,3,0)&R[1]C[-27]&") |r 升级" -> 升级途径:|cFF1BE6B8击杀 鱼人首领(阿拉希盆地2) |r 升级 | AH32: =VLOOKUP(RC[-31],Sheet2!R1C1:R7C2,2,0)&RC[-30]&RC[-29]&RC[-28]&Sheet2!R1C3&"" -> |CFFFFFFFF断水护甲 - Lv1|r | AI32: =IF(RC[-27]&RC[-26]&RC[-25]&RC[-24]&RC[-23]&RC[-22]="",,R1C7)&IF(RC[-27]="",,"|n"&R1C8&RC[-27])&IF(RC[-26]="",,"|n"&R1C9&RC[-26])&IF(RC[-25]="",,"|n"&R1C10&RC[-25])&IF(RC[-24]="",,"|n"&R1C11&RC[-24])&IF(RC[-23]="",,"|n"&R1C12&RC[-23])&IF(RC[-22]="",,"|n"&R1C13&RC[-22])&IF(RC[-20]&RC[-19]&RC[-18]&RC[-17]&RC[-16]&RC[-15]&RC[-14]&RC[-13]&RC[-12]&RC[-11]&RC[-10]&RC[-9]&RC[-8]="",,"|n"&R1C14)&IF(RC[-20]="",,"|n"&R1C15&RC[-20])&IF(RC[-19]="",,"|n"&R1C16&RC[-19])&IF(RC[-18]="",,"|n"&R1C17&RC[-18])&IF(RC[-17]="",,"|n"&R1C18&RC[-17])&IF(RC[-16]="",,"|n"&R1C19&RC[-16])&IF(RC[-15]="",,"|n"&R1C20&RC[-15])&IF(RC[-14]="",,"|n"&R1C21&RC[-14])&IF(RC[-13]="",,"|n"&R1C22&RC[-13])&IF(RC[-12]="",,"|n"&R1C23&RC[-12])&IF(RC[-11]="",,"|n"&R1C24&RC[-11])&IF(RC[-10]="",,"|n"&R1C25&RC[-10])&IF(RC[-9]="",,"|n"&R1C26&RC[-9])&IF(RC[-8]="",,"|n"&R1C27&RC[-8])&IF(RC[-6]&RC[-5]&RC[-4]="",,"|n"&R1C28)&IF(RC[-6]="",,"|n"&R1C29&RC[-6])&IF(RC[-5]="",,"|n"&R1C30&RC[-5])&IF(RC[-4]="",,"|n"&R1C31&RC[-4])&IF(RC[-2]="",,"|n"&RC[-2]) -> |cFFFFFF99基础属性|r|n力量:3485|n敏捷:3485|n智力:3485|n血量:29046|n护甲:14190|n升级途径:|cFF1BE6B8击杀 鱼人首领(阿拉希盆地2) |r 升级
A33: 9 | B33: 2 | C33: E | D33: 断水护甲 | E33: - Lv | F33: 2 | I33: =INT(120*RC[-8]*POWER(10,0.07*RC[-8])) -> 4607 | J33: =RC[-1] -> 4607 | K33: =RC[-1] -> 4607 | L33: =INT(1000*RC[-11]*POWER(10,0.07*RC[-11])) -> 38392 | M33: =INT(10000*POWER(10,0.019*RC[-12])) -> 14825 | AG33: ="升级途径:|cFF1BE6B8"&"击杀 "&VLOOKUP(VLOOKUP(Sheet1!RC[-31],Sheet2!R20C1:R25C3,3,0),Sheet2!R28C2:R32C10,5+R[1]C[-27],0)&"("&VLOOKUP(Sheet1!RC[-31],Sheet2!R20C1:R25C3,3,0)&R[1]C[-27]&") |r 升级" -> 升级途径:|cFF1BE6B8击杀 森林狼王(阿拉希盆地3) |r 升级 | AH33: =VLOOKUP(RC[-31],Sheet2!R1C1:R7C2,2,0)&RC[-30]&RC[-29]&RC[-28]&Sheet2!R1C3&"" -> |CFFFFFFFF断水护甲 - Lv2|r | AI33: =IF(RC[-27]&RC[-26]&RC[-25]&RC[-24]&RC[-23]&RC[-22]="",,R1C7)&IF(RC[-27]="",,"|n"&R1C8&RC[-27])&IF(RC[-26]="",,"|n"&R1C9&RC[-26])&IF(RC[-25]="",,"|n"&R1C10&RC[-25])&IF(RC[-24]="",,"|n"&R1C11&RC[-24])&IF(RC[-23]="",,"|n"&R1C12&RC[-23])&IF(RC[-22]="",,"|n"&R1C13&RC[-22])&IF(RC[-20]&RC[-19]&RC[-18]&RC[-17]&RC[-16]&RC[-15]&RC[-14]&RC[-13]&RC[-12]&RC[-11]&RC[-10]&RC[-9]&RC[-8]="",,"|n"&R1C14)&IF(RC[-20]="",,"|n"&R1C15&RC[-20])&IF(RC[-19]="",,"|n"&R1C16&RC[-19])&IF(RC[-18]="",,"|n"&R1C17&RC[-18])&IF(RC[-17]="",,"|n"&R1C18&RC[-17])&IF(RC[-16]="",,"|n"&R1C19&RC[-16])&IF(RC[-15]="",,"|n"&R1C20&RC[-15])&IF(RC[-14]="",,"|n"&R1C21&RC[-14])&IF(RC[-13]="",,"|n"&R1C22&RC[-13])&IF(RC[-12]="",,"|n"&R1C23&RC[-12])&IF(RC[-11]="",,"|n"&R1C24&RC[-11])&IF(RC[-10]="",,"|n"&R1C25&RC[-10])&IF(RC[-9]="",,"|n"&R1C26&RC[-9])&IF(RC[-8]="",,"|n"&R1C27&RC[-8])&IF(RC[-6]&RC[-5]&RC[-4]="",,"|n"&R1C28)&IF(RC[-6]="",,"|n"&R1C29&RC[-6])&IF(RC[-5]="",,"|n"&R1C30&RC[-5])&IF(RC[-4]="",,"|n"&R1C31&RC[-4])&IF(RC[-2]="",,"|n"&RC[-2]) -> |cFFFFFF99基础属性|r|n力量:4607|n敏捷:4607|n智力:4607|n血量:38392|n护甲:14825|n升级途径:|cFF1BE6B8击杀 森林狼王(阿拉希盆地3) |r 升级
A34: 10 | B34: 2 | C34: E | D34: 断水护甲 | E34: - Lv | F34: 3 | I34: =INT(120*RC[-8]*POWER(10,0.07*RC[-8])) -> 6014 | J34: =RC[-1] -> 6014 | K34: =RC[-1] -> 6014 | L34: =INT(1000*RC[-11]*POWER(10,0.07*RC[-11])) -> 50118 | M34: =INT(10000*POWER(10,0.019*RC[-12])) -> 15488 | AG34: ="升级途径:|cFF1BE6B8"&"击杀 "&VLOOKUP(VLOOKUP(Sheet1!RC[-31],Sheet2!R20C1:R25C3,3,0),Sheet2!R28C2:R32C10,5+R[1]C[-27],0)&"("&VLOOKUP(Sheet1!RC[-31],Sheet2!R20C1:R25C3,3,0)&R[1]C[-27]&") |r 升级" -> 升级途径:|cFF1BE6B8击杀 豪猪王(阿拉希盆地4) |r 升级 | AH34: =VLOOKUP(RC[-31],Sheet2!R1C1:R7C2,2,0)&RC[-30]&RC[-29]&RC[-28]&Sheet2!R1C3&"" -> |CFFFFFFFF断水护甲 - Lv3|r | AI34: =IF(RC[-27]&RC[-26]&RC[-25]&RC[-24]&RC[-23]&RC[-22]="",,R1C7)&IF(RC[-27]="",,"|n"&R1C8&RC[-27])&IF(RC[-26]="",,"|n"&R1C9&RC[-26])&IF(RC[-25]="",,"|n"&R1C10&RC[-25])&IF(RC[-24]="",,"|n"&R1C11&RC[-24])&IF(RC[-23]="",,"|n"&R1C12&RC[-23])&IF(RC[-22]="",,"|n"&R1C13&RC[-22])&IF(RC[-20]&RC[-19]&RC[-18]&RC[-17]&RC[-16]&RC[-15]&RC[-14]&RC[-13]&RC[-12]&RC[-11]&RC[-10]&RC[-9]&RC[-8]="",,"|n"&R1C14)&IF(RC[-20]="",,"|n"&R1C15&RC[-20])&IF(RC[-19]="",,"|n"&R1C16&RC[-19])&IF(RC[-18]="",,"|n"&R1C17&RC[-18])&IF(RC[-17]="",,"|n"&R1C18&RC[-17])&IF(RC[-16]="",,"|n"&R1C19&RC[-16])&IF(RC[-15]="",,"|n"&R1C20&RC[-15])&IF(RC[-14]="",,"|n"&R1C21&RC[-14])&IF(RC[-13]="",,"|n"&R1C22&RC[-13])&IF(RC[-12]="",,"|n"&R1C23&RC[-12])&IF(RC[-11]="",,"|n"&R1C24&RC[-11])&IF(RC[-10]="",,"|n"&R1C25&RC[-10])&IF(RC[-9]="",,"|n"&R1C26&RC[-9])&IF(RC[-8]="",,"|n"&R1C27&RC[-8])&IF(RC[-6]&RC[-5]&RC[-4]="",,"|n"&R1C28)&IF(RC[-6]="",,"|n"&R1C29&RC[-6])&IF(RC[-5]="",,"|n"&R1C30&RC[-5])&IF(RC[-4]="",,"|n"&R1C31&RC[-4])&IF(RC[-2]="",,"|n"&RC[-2]) -> |cFFFFFF99基础属性|r|n力量:6014|n敏捷:6014|n智力:6014|n血量:50118|n护甲:15488|n升级途径:|cFF1BE6B8击杀 豪猪王(阿拉希盆地4) |r 升级
A35: 11 | B35: 3 | C35: E | D35: 断水护甲 | E35: - Lv | F35: 4 | I35: =INT(120*RC[-8]*POWER(10,0.07*RC[-8])) -> 7772 | J35: =RC[-1] -> 7772 | K35: =RC[-1] -> 7772 | L35: =INT(1000*RC[-11]*POWER(10,0.07*RC[-11])) -> 64772 | M35: =INT(10000*POWER(10,0.019*RC[-12])) -> 16180 | AG35: ="升级途径:|cFF1BE6B8"&"击杀 "&VLOOKUP(VLOOKUP(Sheet1!RC[-31],Sheet2!R20C1:R25C3,3,0),Sheet2!R28C2:R32C10,5+R[1]C[-27],0)&"("&VLOOKUP(Sheet1!RC[-31],Sheet2!R20C1:R25C3,3,0)&R[1]C[-27]&") |r 升级" -> 升级途径:|cFF1BE6B8击杀 达拉内尔主教(死亡矿井1) |r 升级 | AH35: =VLOOKUP(RC[-31],Sheet2!R1C1:R7C2,2,0)&RC[-30]&RC[-29]&RC[-28]&Sheet2!R1C3&"" -> |CFFFFFFFF断水护甲 - Lv4|r | AI35: =IF(RC[-27]&RC[-26]&RC[-25]&RC[-24]&RC[-23]&RC[-22]="",,R1C7)&IF(RC[-27]="",,"|n"&R1C8&RC[-27])&IF(RC[-26]="",,"|n"&R1C9&RC[-26])&IF(RC[-25]="",,"|n"&R1C10&RC[-25])&IF(RC[-24]="",,"|n"&R1C11&RC[-24])&IF(RC[-23]="",,"|n"&R1C12&RC[-23])&IF(RC[-22]="",,"|n"&R1C13&RC[-22])&IF(RC[-20]&RC[-19]&RC[-18]&RC[-17]&RC[-16]&RC[-15]&RC[-14]&RC[-13]&RC[-12]&RC[-11]&RC[-10]&RC[-9]&RC[-8]="",,"|n"&R1C14)&IF(RC[-20]="",,"|n"&R1C15&RC[-20])&IF(RC[-19]="",,"|n"&R1C16&RC[-19])&IF(RC[-18]="",,"|n"&R1C17&RC[-18])&IF(RC[-17]="",,"|n"&R1C18&RC[-17])&IF(RC[-16]="",,"|n"&R1C19&RC[-16])&IF(RC[-15]="",,"|n"&R1C20&RC[-15])&IF(RC[-14]="",,"|n"&R1C21&RC[-14])&IF(RC[-13]="",,"|n"&R1C22&RC[-13])&IF(RC[-12]="",,"|n"&R1C23&RC[-12])&IF(RC[-11]="",,"|n"&R1C24&RC[-11])&IF(RC[-10]="",,"|n"&R1C25&RC[-10])&IF(RC[-9]="",,"|n"&R1C26&RC[-9])&IF(RC[-8]="",,"|n"&R1C27&RC[-8])&IF(RC[-6]&RC[-5]&RC[-4]="",,"|n"&R1C28)&IF(RC[-6]="",,"|n"&R1C29&RC[-6])&IF(RC[-5]="",,"|n"&R1C30&RC[-5])&IF(RC[-4]="",,"|n"&R1C31&RC[-4])&IF(RC[-2]="",,"|n"&RC[-2]) -> |cFFFFFF99基础属性|r|n力量:7772|n敏捷:7772|n智力:7772|n血量:64772|n护甲:16180|n升级途径:|cFF1BE6B8击杀 达拉内尔主教(死亡矿井1) |r 升级
A36: 14 | B36: 3 | C36: D | D36: 玄铁护甲 | E36: - Lv | F36: 1 | I36: =INT(120*RC[-8]*POWER(10,0.07*RC[-8])) -> 16043 | J36: =RC[-1] -> 16043 | K36: =RC[-1] -> 16043 | L36: =INT(1000*RC[-11]*POWER(10,0.07*RC[-11])) -> 133698 | M36: =INT(10000*POWER(10,0.019*RC[-12])) -> 18450 | AG36: ="升级途径:|cFF1BE6B8"&"击杀 "&VLOOKUP(VLOOKUP(Sheet1!RC[-31],Sheet2!R20C1:R25C3,3,0),Sheet2!R28C2:R32C10,5+R[1]C[-27],0)&"("&VLOOKUP(Sheet1!RC[-31],Sheet2!R20C1:R25C3,3,0)&R[1]C[-27]&") |r 升级" -> 升级途径:|cFF1BE6B8击杀 食人魔酋长(死亡矿井2) |r 升级 | AH36: =VLOOKUP(RC[-31],Sheet2!R1C1:R7C2,2,0)&RC[-30]&RC[-29]&RC[-28]&Sheet2!R1C3&"" -> |CFFB6D7A8玄铁护甲 - Lv1|r | AI36: =IF(RC[-27]&RC[-26]&RC[-25]&RC[-24]&RC[-23]&RC[-22]="",,R1C7)&IF(RC[-27]="",,"|n"&R1C8&RC[-27])&IF(RC[-26]="",,"|n"&R1C9&RC[-26])&IF(RC[-25]="",,"|n"&R1C10&RC[-25])&IF(RC[-24]="",,"|n"&R1C11&RC[-24])&IF(RC[-23]="",,"|n"&R1C12&RC[-23])&IF(RC[-22]="",,"|n"&R1C13&RC[-22])&IF(RC[-20]&RC[-19]&RC[-18]&RC[-17]&RC[-16]&RC[-15]&RC[-14]&RC[-13]&RC[-12]&RC[-11]&RC[-10]&RC[-9]&RC[-8]="",,"|n"&R1C14)&IF(RC[-20]="",,"|n"&R1C15&RC[-20])&IF(RC[-19]="",,"|n"&R1C16&RC[-19])&IF(RC[-18]="",,"|n"&R1C17&RC[-18])&IF(RC[-17]="",,"|n"&R1C18&RC[-17])&IF(RC[-16]="",,"|n"&R1C19&RC[-16])&IF(RC[-15]="",,"|n"&R1C20&RC[-15])&IF(RC[-14]="",,"|n"&R1C21&RC[-14])&IF(RC[-13]="",,"|n"&R1C22&RC[-13])&IF(RC[-12]="",,"|n"&R1C23&RC[-12])&IF(RC[-11]="",,"|n"&R1C24&RC[-11])&IF(RC[-10]="",,"|n"&R1C25&RC[-10])&IF(RC[-9]="",,"|n"&R1C26&RC[-9])&IF(RC[-8]="",,"|n"&R1C27&RC[-8])&IF(RC[-6]&RC[-5]&RC[-4]="",,"|n"&R1C28)&IF(RC[-6]="",,"|n"&R1C29&RC[-6])&IF(RC[-5]="",,"|n"&R1C30&RC[-5])&IF(RC[-4]="",,"|n"&R1C31&RC[-4])&IF(RC[-2]="",,"|n"&RC[-2]) -> |cFFFFFF99基础属性|r|n力量:16043|n敏捷:16043|n智力:16043|n血量:133698|n护甲:18450|n升级途径:|cFF1BE6B8击杀 食人魔酋长(死亡矿井2) |r 升级
A37: 15 | B37: 3 | C37: D | D37: 玄铁护甲 | E37: - Lv | F37: 2 | I37: =INT(120*RC[-8]*POWER(10,0.07*RC[-8])) -> 20196 | J37: =RC[-1] -> 20196 | K37: =RC[-1] -> 20196 | L37: =INT(1000*RC[-11]*POWER(10,0.07*RC[-11])) -> 168302 | M37: =INT(10000*POWER(10,0.019*RC[-12])) -> 19275 | AG37: ="升级途径:|cFF1BE6B8"&"击杀 "&VLOOKUP(VLOOKUP(Sheet1!RC[-31],Sheet2!R20C1:R25C3,3,0),Sheet2!R28C2:R32C10,5+R[1]C[-27],0)&"("&VLOOKUP(Sheet1!RC[-31],Sheet2!R20C1:R25C3,3,0)&R[1]C[-27]&") |r 升级" -> 升级途径:|cFF1BE6B8击杀 狗头人酋长(死亡矿井3) |r 升级 | AH37: =VLOOKUP(RC[-31],Sheet2!R1C1:R7C2,2,0)&RC[-30]&RC[-29]&RC[-28]&Sheet2!R1C3&"" -> |CFFB6D7A8玄铁护甲 - Lv2|r | AI37: =IF(RC[-27]&RC[-26]&RC[-25]&RC[-24]&RC[-23]&RC[-22]="",,R1C7)&IF(RC[-27]="",,"|n"&R1C8&RC[-27])&IF(RC[-26]="",,"|n"&R1C9&RC[-26])&IF(RC[-25]="",,"|n"&R1C10&RC[-25])&IF(RC[-24]="",,"|n"&R1C11&RC[-24])&IF(RC[-23]="",,"|n"&R1C12&RC[-23])&IF(RC[-22]="",,"|n"&R1C13&RC[-22])&IF(RC[-20]&RC[-19]&RC[-18]&RC[-17]&RC[-16]&RC[-15]&RC[-14]&RC[-13]&RC[-12]&RC[-11]&RC[-10]&RC[-9]&RC[-8]="",,"|n"&R1C14)&IF(RC[-20]="",,"|n"&R1C15&RC[-20])&IF(RC[-19]="",,"|n"&R1C16&RC[-19])&IF(RC[-18]="",,"|n"&R1C17&RC[-18])&IF(RC[-17]="",,"|n"&R1C18&RC[-17])&IF(RC[-16]="",,"|n"&R1C19&RC[-16])&IF(RC[-15]="",,"|n"&R1C20&RC[-15])&IF(RC[-14]="",,"|n"&R1C21&RC[-14])&IF(RC[-13]="",,"|n"&R1C22&RC[-13])&IF(RC[-12]="",,"|n"&R1C23&RC[-12])&IF(RC[-11]="",,"|n"&R1C24&RC[-11])&IF(RC[-10]="",,"|n"&R1C25&RC[-10])&IF(RC[-9]="",,"|n"&R1C26&RC[-9])&IF(RC[-8]="",,"|n"&R1C27&RC[-8])&IF(RC[-6]&RC[-5]&RC[-4]="",,"|n"&R1C28)&IF(RC[-6]="",,"|n"&R1C29&RC[-6])&IF(RC[-5]="",,"|n"&R1C30&RC[-5])&IF(RC[-4]="",,"|n"&R1C31&RC[-4])&IF(RC[-2]="",,"|n"&RC[-2]) -> |cFFFFFF99基础属性|r|n力量:20196|n敏捷:20196|n智力:20196|n血量:168302|n护甲:19275|n升级途径:|cFF1BE6B8击杀 狗头人酋长(死亡矿井3) |r 升级
A38: 16 | B38: 3 | C38: D | D38: 玄铁护甲 | E38: - Lv | F38: 3 | I38: =INT(120*RC[-8]*POWER(10,0.07*RC[-8])) -> 25310 | J38: =RC[-1] -> 25310 | K38: =RC[-1] -> 25310 | L38: =INT(1000*RC[-11]*POWER(10,0.07*RC[-11])) -> 210921 | M38: =INT(10000*POWER(10,0.019*RC[-12])) -> 20137 | AG38: ="升级途径:|cFF1BE6B8"&"击杀 "&VLOOKUP(VLOOKUP(Sheet1!RC[-31],Sheet2!R20C1:R25C3,3,0),Sheet2!R28C2:R32C10,5+R[1]C[-27],0)&"("&VLOOKUP(Sheet1!RC[-31],Sheet2!R20C1:R25C3,3,0)&R[1]C[-27]&") |r 升级" -> 升级途径:|cFF1BE6B8击杀 矿井魔蝎(死亡矿井4) |r 升级 | AH38: =VLOOKUP(RC[-31],Sheet2!R1C1:R7C2,2,0)&RC[-30]&RC[-29]&RC[-28]&Sheet2!R1C3&"" -> |CFFB6D7A8玄铁护甲 - Lv3|r | AI38: =IF(RC[-27]&RC[-26]&RC[-25]&RC[-24]&RC[-23]&RC[-22]="",,R1C7)&IF(RC[-27]="",,"|n"&R1C8&RC[-27])&IF(RC[-26]="",,"|n"&R1C9&RC[-26])&IF(RC[-25]="",,"|n"&R1C10&RC[-25])&IF(RC[-24]="",,"|n"&R1C11&RC[-24])&IF(RC[-23]="",,"|n"&R1C12&RC[-23])&IF(RC[-22]="",,"|n"&R1C13&RC[-22])&IF(RC[-20]&RC[-19]&RC[-18]&RC[-17]&RC[-16]&RC[-15]&RC[-14]&RC[-13]&RC[-12]&RC[-11]&RC[-10]&RC[-9]&RC[-8]="",,"|n"&R1C14)&IF(RC[-20]="",,"|n"&R1C15&RC[-20])&IF(RC[-19]="",,"|n"&R1C16&RC[-19])&IF(RC[-18]="",,"|n"&R1C17&RC[-18])&IF(RC[-17]="",,"|n"&R1C18&RC[-17])&IF(RC[-16]="",,"|n"&R1C19&RC[-16])&IF(RC[-15]="",,"|n"&R1C20&RC[-15])&IF(RC[-14]="",,"|n"&R1C21&RC[-14])&IF(RC[-13]="",,"|n"&R1C22&RC[-13])&IF(RC[-12]="",,"|n"&R1C23&RC[-12])&IF(RC[-11]="",,"|n"&R1C24&RC[-11])&IF(RC[-10]="",,"|n"&R1C25&RC[-10])&IF(RC[-9]="",,"|n"&R1C26&RC[-9])&IF(RC[-8]="",,"|n"&R1C27&RC[-8])&IF(RC[-6]&RC[-5]&RC[-4]="",,"|n"&R1C28)&IF(RC[-6]="",,"|n"&R1C29&RC[-6])&IF(RC[-5]="",,"|n"&R1C30&RC[-5])&IF(RC[-4]="",,"|n"&R1C31&RC[-4])&IF(RC[-2]="",,"|n"&RC[-2]) -> |cFFFFFF99基础属性|r|n力量:25310|n敏捷:25310|n智力:25310|n血量:210921|n护甲:20137|n升级途径:|cFF1BE6B8击杀 矿井魔蝎(死亡矿井4) |r 升级
A39: 17 | B39: 4 | C39: D | D39: 玄铁护甲 | E39: - Lv | F39: 4 | I39: =INT(120*RC[-8]*POWER(10,0.07*RC[-8])) -> 31595 | J39: =RC[-1] -> 31595 | K39: =RC[-1] -> 31595 | L39: =INT(1000*RC[-11]*POWER(10,0.07*RC[-11])) -> 263298 | M39: =INT(10000*POWER(10,0.019*RC[-12])) -> 21037 | AG39: ="升级途径:|cFF1BE6B8"&"击杀 "&VLOOKUP(VLOOKUP(Sheet1!RC[-31],Sheet2!R20C1:R25C3,3,0),Sheet2!R28C2:R32C10,5+R[1]C[-27],0)&"("&VLOOKUP(Sheet1!RC[-31],Sheet2!R20C1:R25C3,3,0)&R[1]C[-27]&") |r 升级" -> 升级途径:|cFF1BE6B8击杀 炎魔(熔火之心1) |r 升级 | AH39: =VLOOKUP(RC[-31],Sheet2!R1C1:R7C2,2,0)&RC[-30]&RC[-29]&RC[-28]&Sheet2!R1C3&"" -> |CFFB6D7A8玄铁护甲 - Lv4|r | AI39: =IF(RC[-27]&RC[-26]&RC[-25]&RC[-24]&RC[-23]&RC[-22]="",,R1C7)&IF(RC[-27]="",,"|n"&R1C8&RC[-27])&IF(RC[-26]="",,"|n"&R1C9&RC[-26])&IF(RC[-25]="",,"|n"&R1C10&RC[-25])&IF(RC[-24]="",,"|n"&R1C11&RC[-24])&IF(RC[-23]="",,"|n"&R1C12&RC[-23])&IF(RC[-22]="",,"|n"&R1C13&RC[-22])&IF(RC[-20]&RC[-19]&RC[-18]&RC[-17]&RC[-16]&RC[-15]&RC[-14]&RC[-13]&RC[-12]&RC[-11]&RC[-10]&RC[-9]&RC[-8]="",,"|n"&R1C14)&IF(RC[-20]="",,"|n"&R1C15&RC[-20])&IF(RC[-19]="",,"|n"&R1C16&RC[-19])&IF(RC[-18]="",,"|n"&R1C17&RC[-18])&IF(RC[-17]="",,"|n"&R1C18&RC[-17])&IF(RC[-16]="",,"|n"&R1C19&RC[-16])&IF(RC[-15]="",,"|n"&R1C20&RC[-15])&IF(RC[-14]="",,"|n"&R1C21&RC[-14])&IF(RC[-13]="",,"|n"&R1C22&RC[-13])&IF(RC[-12]="",,"|n"&R1C23&RC[-12])&IF(RC[-11]="",,"|n"&R1C24&RC[-11])&IF(RC[-10]="",,"|n"&R1C25&RC[-10])&IF(RC[-9]="",,"|n"&R1C26&RC[-9])&IF(RC[-8]="",,"|n"&R1C27&RC[-8])&IF(RC[-6]&RC[-5]&RC[-4]="",,"|n"&R1C28)&IF(RC[-6]="",,"|n"&R1C29&RC[-6])&IF(RC[-5]="",,"|n"&R1C30&RC[-5])&IF(RC[-4]="",,"|n"&R1C31&RC[-4])&IF(RC[-2]="",,"|n"&RC[-2]) -> |cFFFFFF99基础属性|r|n力量:31595|n敏捷:31595|n智力:31595|n血量:263298|n护甲:21037|n升级途径:|cFF1BE6B8击杀 炎魔(熔火之心1) |r 升级
A40: 20 | B40: 4 | C40: C | D40: 烈焰护甲 | E40: - Lv | F40: 1 | I40: =INT(120*RC[-8]*POWER(10,0.07*RC[-8])) -> 60285 | J40: =RC[-1] -> 60285 | K40: =RC[-1] -> 60285 | L40: =INT(1000*RC[-11]*POWER(10,0.07*RC[-11])) -> 502377 | M40: =INT(10000*POWER(10,0.019*RC[-12])) -> 23988 | AG40: ="升级途径:|cFF1BE6B8"&"击杀 "&VLOOKUP(VLOOKUP(Sheet1!RC[-31],Sheet2!R20C1:R25C3,3,0),Sheet2!R28C2:R32C10,5+R[1]C[-27],0)&"("&VLOOKUP(Sheet1!RC[-31],Sheet2!R20C1:R25C3,3,0)&R[1]C[-27]&") |r 升级" -> 升级途径:|cFF1BE6B8击杀 巨型蜥蜴(熔火之心2) |r 升级 | AH40: =VLOOKUP(RC[-31],Sheet2!R1C1:R7C2,2,0)&RC[-30]&RC[-29]&RC[-28]&Sheet2!R1C3&"" -> |cFF99FF66烈焰护甲 - Lv1|r | AI40: =IF(RC[-27]&RC[-26]&RC[-25]&RC[-24]&RC[-23]&RC[-22]="",,R1C7)&IF(RC[-27]="",,"|n"&R1C8&RC[-27])&IF(RC[-26]="",,"|n"&R1C9&RC[-26])&IF(RC[-25]="",,"|n"&R1C10&RC[-25])&IF(RC[-24]="",,"|n"&R1C11&RC[-24])&IF(RC[-23]="",,"|n"&R1C12&RC[-23])&IF(RC[-22]="",,"|n"&R1C13&RC[-22])&IF(RC[-20]&RC[-19]&RC[-18]&RC[-17]&RC[-16]&RC[-15]&RC[-14]&RC[-13]&RC[-12]&RC[-11]&RC[-10]&RC[-9]&RC[-8]="",,"|n"&R1C14)&IF(RC[-20]="",,"|n"&R1C15&RC[-20])&IF(RC[-19]="",,"|n"&R1C16&RC[-19])&IF(RC[-18]="",,"|n"&R1C17&RC[-18])&IF(RC[-17]="",,"|n"&R1C18&RC[-17])&IF(RC[-16]="",,"|n"&R1C19&RC[-16])&IF(RC[-15]="",,"|n"&R1C20&RC[-15])&IF(RC[-14]="",,"|n"&R1C21&RC[-14])&IF(RC[-13]="",,"|n"&R1C22&RC[-13])&IF(RC[-12]="",,"|n"&R1C23&RC[-12])&IF(RC[-11]="",,"|n"&R1C24&RC[-11])&IF(RC[-10]="",,"|n"&R1C25&RC[-10])&IF(RC[-9]="",,"|n"&R1C26&RC[-9])&IF(RC[-8]="",,"|n"&R1C27&RC[-8])&IF(RC[-6]&RC[-5]&RC[-4]="",,"|n"&R1C28)&IF(RC[-6]="",,"|n"&R1C29&RC[-6])&IF(RC[-5]="",,"|n"&R1C30&RC[-5])&IF(RC[-4]="",,"|n"&R1C31&RC[-4])&IF(RC[-2]="",,"|n"&RC[-2]) -> |cFFFFFF99基础属性|r|n力量:60285|n敏捷:60285|n智力:60285|n血量:502377|n护甲:23988|n升级途径:|cFF1BE6B8击杀 巨型蜥蜴(熔火之心2) |r 升级
A41: 21 | B41: 4 | C41: C | D41: 烈焰护甲 | E41: - Lv | F41: 2 | I41: =INT(120*RC[-8]*POWER(10,0.07*RC[-8])) -> 74370 | J41: =RC[-1] -> 74370 | K41: =RC[-1] -> 74370 | L41: =INT(1000*RC[-11]*POWER(10,0.07*RC[-11])) -> 619753 | M41: =INT(10000*POWER(10,0.019*RC[-12])) -> 25061 | AG41: ="升级途径:|cFF1BE6B8"&"击杀 "&VLOOKUP(VLOOKUP(Sheet1!RC[-31],Sheet2!R20C1:R25C3,3,0),Sheet2!R28C2:R32C10,5+R[1]C[-27],0)&"("&VLOOKUP(Sheet1!RC[-31],Sheet2!R20C1:R25C3,3,0)&R[1]C[-27]&") |r 升级" -> 升级途径:|cFF1BE6B8击杀 千年龙龟(熔火之心3) |r 升级 | AH41: =VLOOKUP(RC[-31],Sheet2!R1C1:R7C2,2,0)&RC[-30]&RC[-29]&RC[-28]&Sheet2!R1C3&"" -> |cFF99FF66烈焰护甲 - Lv2|r | AI41: =IF(RC[-27]&RC[-26]&RC[-25]&RC[-24]&RC[-23]&RC[-22]="",,R1C7)&IF(RC[-27]="",,"|n"&R1C8&RC[-27])&IF(RC[-26]="",,"|n"&R1C9&RC[-26])&IF(RC[-25]="",,"|n"&R1C10&RC[-25])&IF(RC[-24]="",,"|n"&R1C11&RC[-24])&IF(RC[-23]="",,"|n"&R1C12&RC[-23])&IF(RC[-22]="",,"|n"&R1C13&RC[-22])&IF(RC[-20]&RC[-19]&RC[-18]&RC[-17]&RC[-16]&RC[-15]&RC[-14]&RC[-13]&RC[-12]&RC[-11]&RC[-10]&RC[-9]&RC[-8]="",,"|n"&R1C14)&IF(RC[-20]="",,"|n"&R1C15&RC[-20])&IF(RC[-19]="",,"|n"&R1C16&RC[-19])&IF(RC[-18]="",,"|n"&R1C17&RC[-18])&IF(RC[-17]="",,"|n"&R1C18&RC[-17])&IF(RC[-16]="",,"|n"&R1C19&RC[-16])&IF(RC[-15]="",,"|n"&R1C20&RC[-15])&IF(RC[-14]="",,"|n"&R1C21&RC[-14])&IF(RC[-13]="",,"|n"&R1C22&RC[-13])&IF(RC[-12]="",,"|n"&R1C23&RC[-12])&IF(RC[-11]="",,"|n"&R1C24&RC[-11])&IF(RC[-10]="",,"|n"&R1C25&RC[-10])&IF(RC[-9]="",,"|n"&R1C26&RC[-9])&IF(RC[-8]="",,"|n"&R1C27&RC[-8])&IF(RC[-6]&RC[-5]&RC[-4]="",,"|n"&R1C28)&IF(RC[-6]="",,"|n"&R1C29&RC[-6])&IF(RC[-5]="",,"|n"&R1C30&RC[-5])&IF(RC[-4]="",,"|n"&R1C31&RC[-4])&IF(RC[-2]="",,"|n"&RC[-2]) -> |cFFFFFF99基础属性|r|n力量:74370|n敏捷:74370|n智力:74370|n血量:619753|n护甲:25061|n升级途径:|cFF1BE6B8击杀 千年龙龟(熔火之心3) |r 升级
A42: 22 | B42: 4 | C42: C | D42: 烈焰护甲 | E42: - Lv | F42: 3 | I42: =INT(120*RC[-8]*POWER(10,0.07*RC[-8])) -> 91538 | J42: =RC[-1] -> 91538 | K42: =RC[-1] -> 91538 | L42: =INT(1000*RC[-11]*POWER(10,0.07*RC[-11])) -> 762821 | M42: =INT(10000*POWER(10,0.019*RC[-12])) -> 26181 | AG42: ="升级途径:|cFF1BE6B8"&"击杀 "&VLOOKUP(VLOOKUP(Sheet1!RC[-31],Sheet2!R20C1:R25C3,3,0),Sheet2!R28C2:R32C10,5+R[1]C[-27],0)&"("&VLOOKUP(Sheet1!RC[-31],Sheet2!R20C1:R25C3,3,0)&R[1]C[-27]&") |r 升级" -> 升级途径:|cFF1BE6B8击杀 成年巨龙(熔火之心4) |r 升级 | AH42: =VLOOKUP(RC[-31],Sheet2!R1C1:R7C2,2,0)&RC[-30]&RC[-29]&RC[-28]&Sheet2!R1C3&"" -> |cFF99FF66烈焰护甲 - Lv3|r | AI42: =IF(RC[-27]&RC[-26]&RC[-25]&RC[-24]&RC[-23]&RC[-22]="",,R1C7)&IF(RC[-27]="",,"|n"&R1C8&RC[-27])&IF(RC[-26]="",,"|n"&R1C9&RC[-26])&IF(RC[-25]="",,"|n"&R1C10&RC[-25])&IF(RC[-24]="",,"|n"&R1C11&RC[-24])&IF(RC[-23]="",,"|n"&R1C12&RC[-23])&IF(RC[-22]="",,"|n"&R1C13&RC[-22])&IF(RC[-20]&RC[-19]&RC[-18]&RC[-17]&RC[-16]&RC[-15]&RC[-14]&RC[-13]&RC[-12]&RC[-11]&RC[-10]&RC[-9]&RC[-8]="",,"|n"&R1C14)&IF(RC[-20]="",,"|n"&R1C15&RC[-20])&IF(RC[-19]="",,"|n"&R1C16&RC[-19])&IF(RC[-18]="",,"|n"&R1C17&RC[-18])&IF(RC[-17]="",,"|n"&R1C18&RC[-17])&IF(RC[-16]="",,"|n"&R1C19&RC[-16])&IF(RC[-15]="",,"|n"&R1C20&RC[-15])&IF(RC[-14]="",,"|n"&R1C21&RC[-14])&IF(RC[-13]="",,"|n"&R1C22&RC[-13])&IF(RC[-12]="",,"|n"&R1C23&RC[-12])&IF(RC[-11]="",,"|n"&R1C24&RC[-11])&IF(RC[-10]="",,"|n"&R1C25&RC[-10])&IF(RC[-9]="",,"|n"&R1C26&RC[-9])&IF(RC[-8]="",,"|n"&R1C27&RC[-8])&IF(RC[-6]&RC[-5]&RC[-4]="",,"|n"&R1C28)&IF(RC[-6]="",,"|n"&R1C29&RC[-6])&IF(RC[-5]="",,"|n"&R1C30&RC[-5])&IF(RC[-4]="",,"|n"&R1C31&RC[-4])&IF(RC[-2]="",,"|n"&RC[-2]) -> |cFFFFFF99基础属性|r|n力量:91538|n敏捷:91538|n智力:91538|n血量:762821|n护甲:26181|n升级途径:|cFF1BE6B8击杀 成年巨龙(熔火之心4) |r 升级
A43: 23 | B43: 5 | C43: C | D43: 烈焰护甲 | E43: - Lv | F43: 4 | I43: =INT(120*RC[-8]*POWER(10,0.07*RC[-8])) -> 112436 | J43: =RC[-1] -> 112436 | K43: =RC[-1] -> 112436 | L43: =INT(1000*RC[-11]*POWER(10,0.07*RC[-11])) -> 936974 | M43: =INT(10000*POWER(10,0.019*RC[-12])) -> 27352 | AG43: ="升级途径:|cFF1BE6B8"&"击杀 "&VLOOKUP(VLOOKUP(Sheet1!RC[-31],Sheet2!R20C1:R25C3,3,0),Sheet2!R28C2:R32C10,5+R[1]C[-27],0)&"("&VLOOKUP(Sheet1!RC[-31],Sheet2!R20C1:R25C3,3,0)&R[1]C[-27]&") |r 升级" -> 升级途径:|cFF1BE6B8击杀 冰霜巨魔酋长(祖阿曼岛1) |r 升级 | AH43: =VLOOKUP(RC[-31],Sheet2!R1C1:R7C2,2,0)&RC[-30]&RC[-29]&RC[-28]&Sheet2!R1C3&"" -> |cFF99FF66烈焰护甲 - Lv4|r | AI43: =IF(RC[-27]&RC[-26]&RC[-25]&RC[-24]&RC[-23]&RC[-22]="",,R1C7)&IF(RC[-27]="",,"|n"&R1C8&RC[-27])&IF(RC[-26]="",,"|n"&R1C9&RC[-26])&IF(RC[-25]="",,"|n"&R1C10&RC[-25])&IF(RC[-24]="",,"|n"&R1C11&RC[-24])&IF(RC[-23]="",,"|n"&R1C12&RC[-23])&IF(RC[-22]="",,"|n"&R1C13&RC[-22])&IF(RC[-20]&RC[-19]&RC[-18]&RC[-17]&RC[-16]&RC[-15]&RC[-14]&RC[-13]&RC[-12]&RC[-11]&RC[-10]&RC[-9]&RC[-8]="",,"|n"&R1C14)&IF(RC[-20]="",,"|n"&R1C15&RC[-20])&IF(RC[-19]="",,"|n"&R1C16&RC[-19])&IF(RC[-18]="",,"|n"&R1C17&RC[-18])&IF(RC[-17]="",,"|n"&R1C18&RC[-17])&IF(RC[-16]="",,"|n"&R1C19&RC[-16])&IF(RC[-15]="",,"|n"&R1C20&RC[-15])&IF(RC[-14]="",,"|n"&R1C21&RC[-14])&IF(RC[-13]="",,"|n"&R1C22&RC[-13])&IF(RC[-12]="",,"|n"&R1C23&RC[-12])&IF(RC[-11]="",,"|n"&R1C24&RC[-11])&IF(RC[-10]="",,"|n"&R1C25&RC[-10])&IF(RC[-9]="",,"|n"&R1C26&RC[-9])&IF(RC[-8]="",,"|n"&R1C27&RC[-8])&IF(RC[-6]&RC[-5]&RC[-4]="",,"|n"&R1C28)&IF(RC[-6]="",,"|n"&R1C29&RC[-6])&IF(RC[-5]="",,"|n"&R1C30&RC[-5])&IF(RC[-4]="",,"|n"&R1C31&RC[-4])&IF(RC[-2]="",,"|n"&RC[-2]) -> |cFFFFFF99基础属性|r|n力量:112436|n敏捷:112436|n智力:112436|n血量:936974|n护甲:27352|n升级途径:|cFF1BE6B8击杀 冰霜巨魔酋长(祖阿曼岛1) |r 升级
A44: 26 | B44: 5 | C44: B | D44: 龙吟护甲 | E44: - Lv | F44: 1 | I44: =INT(120*RC[-8]*POWER(10,0.07*RC[-8])) -> 206136 | J44: =RC[-1] -> 206136 | K44: =RC[-1] -> 206136 | L44: =INT(1000*RC[-11]*POWER(10,0.07*RC[-11])) -> 1717802 | M44: =INT(10000*POWER(10,0.019*RC[-12])) -> 31188 | AG44: ="升级途径:|cFF1BE6B8"&"击杀 "&VLOOKUP(VLOOKUP(Sheet1!RC[-31],Sheet2!R20C1:R25C3,3,0),Sheet2!R28C2:R32C10,5+R[1]C[-27],0)&"("&VLOOKUP(Sheet1!RC[-31],Sheet2!R20C1:R25C3,3,0)&R[1]C[-27]&") |r 升级" -> 升级途径:|cFF1BE6B8击杀 丛林巨魔酋长(祖阿曼岛2) |r 升级 | AH44: =VLOOKUP(RC[-31],Sheet2!R1C1:R7C2,2,0)&RC[-30]&RC[-29]&RC[-28]&Sheet2!R1C3&"" -> |cFF99FF66龙吟护甲 - Lv1|r | AI44: =IF(RC[-27]&RC[-26]&RC[-25]&RC[-24]&RC[-23]&RC[-22]="",,R1C7)&IF(RC[-27]="",,"|n"&R1C8&RC[-27])&IF(RC[-26]="",,"|n"&R1C9&RC[-26])&IF(RC[-25]="",,"|n"&R1C10&RC[-25])&IF(RC[-24]="",,"|n"&R1C11&RC[-24])&IF(RC[-23]="",,"|n"&R1C12&RC[-23])&IF(RC[-22]="",,"|n"&R1C13&RC[-22])&IF(RC[-20]&RC[-19]&RC[-18]&RC[-17]&RC[-16]&RC[-15]&RC[-14]&RC[-13]&RC[-12]&RC[-11]&RC[-10]&RC[-9]&RC[-8]="",,"|n"&R1C14)&IF(RC[-20]="",,"|n"&R1C15&RC[-20])&IF(RC[-19]="",,"|n"&R1C16&RC[-19])&IF(RC[-18]="",,"|n"&R1C17&RC[-18])&IF(RC[-17]="",,"|n"&R1C18&RC[-17])&IF(RC[-16]="",,"|n"&R1C19&RC[-16])&IF(RC[-15]="",,"|n"&R1C20&RC[-15])&IF(RC[-14]="",,"|n"&R1C21&RC[-14])&IF(RC[-13]="",,"|n"&R1C22&RC[-13])&IF(RC[-12]="",,"|n"&R1C23&RC[-12])&IF(RC[-11]="",,"|n"&R1C24&RC[-11])&IF(RC[-10]="",,"|n"&R1C25&RC[-10])&IF(RC[-9]="",,"|n"&R1C26&RC[-9])&IF(RC[-8]="",,"|n"&R1C27&RC[-8])&IF(RC[-6]&RC[-5]&RC[-4]="",,"|n"&R1C28)&IF(RC[-6]="",,"|n"&R1C29&RC[-6])&IF(RC[-5]="",,"|n"&R1C30&RC[-5])&IF(RC[-4]="",,"|n"&R1C31&RC[-4])&IF(RC[-2]="",,"|n"&RC[-2]) -> |cFFFFFF99基础属性|r|n力量:206136|n敏捷:206136|n智力:206136|n血量:1717802|n护甲:31188|n升级途径:|cFF1BE6B8击杀 丛林巨魔酋长(祖阿曼岛2) |r 升级
A45: 27 | B45: 5 | C45: B | D45: 龙吟护甲 | E45: - Lv | F45: 2 | I45: =INT(120*RC[-8]*POWER(10,0.07*RC[-8])) -> 251504 | J45: =RC[-1] -> 251504 | K45: =RC[-1] -> 251504 | L45: =INT(1000*RC[-11]*POWER(10,0.07*RC[-11])) -> 2095867 | M45: =INT(10000*POWER(10,0.019*RC[-12])) -> 32583 | AG45: ="升级途径:|cFF1BE6B8"&"击杀 "&VLOOKUP(VLOOKUP(Sheet1!RC[-31],Sheet2!R20C1:R25C3,3,0),Sheet2!R28C2:R32C10,5+R[1]C[-27],0)&"("&VLOOKUP(Sheet1!RC[-31],Sheet2!R20C1:R25C3,3,0)&R[1]C[-27]&") |r 升级" -> 升级途径:|cFF1BE6B8击杀 娜迦暴君(祖阿曼岛3) |r 升级 | AH45: =VLOOKUP(RC[-31],Sheet2!R1C1:R7C2,2,0)&RC[-30]&RC[-29]&RC[-28]&Sheet2!R1C3&"" -> |cFF99FF66龙吟护甲 - Lv2|r | AI45: =IF(RC[-27]&RC[-26]&RC[-25]&RC[-24]&RC[-23]&RC[-22]="",,R1C7)&IF(RC[-27]="",,"|n"&R1C8&RC[-27])&IF(RC[-26]="",,"|n"&R1C9&RC[-26])&IF(RC[-25]="",,"|n"&R1C10&RC[-25])&IF(RC[-24]="",,"|n"&R1C11&RC[-24])&IF(RC[-23]="",,"|n"&R1C12&RC[-23])&IF(RC[-22]="",,"|n"&R1C13&RC[-22])&IF(RC[-20]&RC[-19]&RC[-18]&RC[-17]&RC[-16]&RC[-15]&RC[-14]&RC[-13]&RC[-12]&RC[-11]&RC[-10]&RC[-9]&RC[-8]="",,"|n"&R1C14)&IF(RC[-20]="",,"|n"&R1C15&RC[-20])&IF(RC[-19]="",,"|n"&R1C16&RC[-19])&IF(RC[-18]="",,"|n"&R1C17&RC[-18])&IF(RC[-17]="",,"|n"&R1C18&RC[-17])&IF(RC[-16]="",,"|n"&R1C19&RC[-16])&IF(RC[-15]="",,"|n"&R1C20&RC[-15])&IF(RC[-14]="",,"|n"&R1C21&RC[-14])&IF(RC[-13]="",,"|n"&R1C22&RC[-13])&IF(RC[-12]="",,"|n"&R1C23&RC[-12])&IF(RC[-11]="",,"|n"&R1C24&RC[-11])&IF(RC[-10]="",,"|n"&R1C25&RC[-10])&IF(RC[-9]="",,"|n"&R1C26&RC[-9])&IF(RC[-8]="",,"|n"&R1C27&RC[-8])&IF(RC[-6]&RC[-5]&RC[-4]="",,"|n"&R1C28)&IF(RC[-6]="",,"|n"&R1C29&RC[-6])&IF(RC[-5]="",,"|n"&R1C30&RC[-5])&IF(RC[-4]="",,"|n"&R1C31&RC[-4])&IF(RC[-2]="",,"|n"&RC[-2]) -> |cFFFFFF99基础属性|r|n力量:251504|n敏捷:251504|n智力:251504|n血量:2095867|n护甲:32583|n升级途径:|cFF1BE6B8击杀 娜迦暴君(祖阿曼岛3) |r 升级
A46: 28 | B46: 5 | C46: B | D46: 龙吟护甲 | E46: - Lv | F46: 3 | I46: =INT(120*RC[-8]*POWER(10,0.07*RC[-8])) -> 306435 | J46: =RC[-1] -> 306435 | K46: =RC[-1] -> 306435 | L46: =INT(1000*RC[-11]*POWER(10,0.07*RC[-11])) -> 2553630 | M46: =INT(10000*POWER(10,0.019*RC[-12])) -> 34040 | AG46: ="升级途径:|cFF1BE6B8"&"击杀 "&VLOOKUP(VLOOKUP(Sheet1!RC[-31],Sheet2!R20C1:R25C3,3,0),Sheet2!R28C2:R32C10,5+R[1]C[-27],0)&"("&VLOOKUP(Sheet1!RC[-31],Sheet2!R20C1:R25C3,3,0)&R[1]C[-27]&") |r 升级" -> 升级途径:|cFF1BE6B8击杀 黑暗巨魔酋长(祖阿曼岛4) |r 升级 | AH46: =VLOOKUP(RC[-31],Sheet2!R1C1:R7C2,2,0)&RC[-30]&RC[-29]&RC[-28]&Sheet2!R1C3&"" -> |cFF99FF66龙吟护甲 - Lv3|r | AI46: =IF(RC[-27]&RC[-26]&RC[-25]&RC[-24]&RC[-23]&RC[-22]="",,R1C7)&IF(RC[-27]="",,"|n"&R1C8&RC[-27])&IF(RC[-26]="",,"|n"&R1C9&RC[-26])&IF(RC[-25]="",,"|n"&R1C10&RC[-25])&IF(RC[-24]="",,"|n"&R1C11&RC[-24])&IF(RC[-23]="",,"|n"&R1C12&RC[-23])&IF(RC[-22]="",,"|n"&R1C13&RC[-22])&IF(RC[-20]&RC[-19]&RC[-18]&RC[-17]&RC[-16]&RC[-15]&RC[-14]&RC[-13]&RC[-12]&RC[-11]&RC[-10]&RC[-9]&RC[-8]="",,"|n"&R1C14)&IF(RC[-20]="",,"|n"&R1C15&RC[-20])&IF(RC[-19]="",,"|n"&R1C16&RC[-19])&IF(RC[-18]="",,"|n"&R1C17&RC[-18])&IF(RC[-17]="",,"|n"&R1C18&RC[-17])&IF(RC[-16]="",,"|n"&R1C19&RC[-16])&IF(RC[-15]="",,"|n"&R1C20&RC[-15])&IF(RC[-14]="",,"|n"&R1C21&RC[-14])&IF(RC[-13]="",,"|n"&R1C22&RC[-13])&IF(RC[-12]="",,"|n"&R1C23&RC[-12])&IF(RC[-11]="",,"|n"&R1C24&RC[-11])&IF(RC[-10]="",,"|n"&R1C25&RC[-10])&IF(RC[-9]="",,"|n"&R1C26&RC[-9])&IF(RC[-8]="",,"|n"&R1C27&RC[-8])&IF(RC[-6]&RC[-5]&RC[-4]="",,"|n"&R1C28)&IF(RC[-6]="",,"|n"&R1C29&RC[-6])&IF(RC[-5]="",,"|n"&R1C30&RC[-5])&IF(RC[-4]="",,"|n"&R1C31&RC[-4])&IF(RC[-2]="",,"|n"&RC[-2]) -> |cFFFFFF99基础属性|r|n力量:306435|n敏捷:306435|n智力:306435|n血量:2553630|n护甲:34040|n升级途径:|cFF1BE6B8击杀 黑暗巨魔酋长(祖阿曼岛4) |r 升级
A47: 29 | B47: 6 | C47: B | D47: 龙吟护甲 | E47: - Lv | F47: 4 | I47: =INT(120*RC[-8]*POWER(10,0.07*RC[-8])) -> 372888 | J47: =RC[-1] -> 372888 | K47: =RC[-1] -> 372888 | L47: =INT(1000*RC[-11]*POWER(10,0.07*RC[-11])) -> 3107405 | M47: =INT(10000*POWER(10,0.019*RC[-12])) -> 35563 | AG47: ="升级途径:|cFF1BE6B8"&"击杀 "&VLOOKUP(VLOOKUP(Sheet1!RC[-31],Sheet2!R20C1:R25C3,3,0),Sheet2!R28C2:R32C10,5+R[1]C[-27],0)&"("&VLOOKUP(Sheet1!RC[-31],Sheet2!R20C1:R25C3,3,0)&R[1]C[-27]&") |r 升级" -> 升级途径:|cFF1BE6B8击杀 火元素领主(达拉然奥术秘境1) |r 升级 | AH47: =VLOOKUP(RC[-31],Sheet2!R1C1:R7C2,2,0)&RC[-30]&RC[-29]&RC[-28]&Sheet2!R1C3&"" -> |cFF99FF66龙吟护甲 - Lv4|r | AI47: =IF(RC[-27]&RC[-26]&RC[-25]&RC[-24]&RC[-23]&RC[-22]="",,R1C7)&IF(RC[-27]="",,"|n"&R1C8&RC[-27])&IF(RC[-26]="",,"|n"&R1C9&RC[-26])&IF(RC[-25]="",,"|n"&R1C10&RC[-25])&IF(RC[-24]="",,"|n"&R1C11&RC[-24])&IF(RC[-23]="",,"|n"&R1C12&RC[-23])&IF(RC[-22]="",,"|n"&R1C13&RC[-22])&IF(RC[-20]&RC[-19]&RC[-18]&RC[-17]&RC[-16]&RC[-15]&RC[-14]&RC[-13]&RC[-12]&RC[-11]&RC[-10]&RC[-9]&RC[-8]="",,"|n"&R1C14)&IF(RC[-20]="",,"|n"&R1C15&RC[-20])&IF(RC[-19]="",,"|n"&R1C16&RC[-19])&IF(RC[-18]="",,"|n"&R1C17&RC[-18])&IF(RC[-17]="",,"|n"&R1C18&RC[-17])&IF(RC[-16]="",,"|n"&R1C19&RC[-16])&IF(RC[-15]="",,"|n"&R1C20&RC[-15])&IF(RC[-14]="",,"|n"&R1C21&RC[-14])&IF(RC[-13]="",,"|n"&R1C22&RC[-13])&IF(RC[-12]="",,"|n"&R1C23&RC[-12])&IF(RC[-11]="",,"|n"&R1C24&RC[-11])&IF(RC[-10]="",,"|n"&R1C25&RC[-10])&IF(RC[-9]="",,"|n"&R1C26&RC[-9])&IF(RC[-8]="",,"|n"&R1C27&RC[-8])&IF(RC[-6]&RC[-5]&RC[-4]="",,"|n"&R1C28)&IF(RC[-6]="",,"|n"&R1C29&RC[-6])&IF(RC[-5]="",,"|n"&R1C30&RC[-5])&IF(RC[-4]="",,"|n"&R1C31&RC[-4])&IF(RC[-2]="",,"|n"&RC[-2]) -> |cFFFFFF99基础属性|r|n力量:372888|n敏捷:372888|n智力:372888|n血量:3107405|n护甲:35563|n升级途径:|cFF1BE6B8击杀 火元素领主(达拉然奥术秘境1) |r 升级
A48: 32 | B48: 6 | C48: A | D48: 神使护甲 | E48: - Lv | F48: 1 | I48: =INT(120*RC[-8]*POWER(10,0.07*RC[-8])) -> 667315 | J48: =RC[-1] -> 667315 | K48: =RC[-1] -> 667315 | L48: =INT(1000*RC[-11]*POWER(10,0.07*RC[-11])) -> 5560962 | M48: =INT(10000*POWER(10,0.019*RC[-12])) -> 40550 | AG48: ="升级途径:|cFF1BE6B8"&"击杀 "&VLOOKUP(VLOOKUP(Sheet1!RC[-31],Sheet2!R20C1:R25C3,3,0),Sheet2!R28C2:R32C10,5+R[1]C[-27],0)&"("&VLOOKUP(Sheet1!RC[-31],Sheet2!R20C1:R25C3,3,0)&R[1]C[-27]&") |r 升级" -> 升级途径:|cFF1BE6B8击杀 风元素领主(达拉然奥术秘境2) |r 升级 | AH48: =VLOOKUP(RC[-31],Sheet2!R1C1:R7C2,2,0)&RC[-30]&RC[-29]&RC[-28]&Sheet2!R1C3&"" -> |cFF99FF66神使护甲 - Lv1|r | AI48: =IF(RC[-27]&RC[-26]&RC[-25]&RC[-24]&RC[-23]&RC[-22]="",,R1C7)&IF(RC[-27]="",,"|n"&R1C8&RC[-27])&IF(RC[-26]="",,"|n"&R1C9&RC[-26])&IF(RC[-25]="",,"|n"&R1C10&RC[-25])&IF(RC[-24]="",,"|n"&R1C11&RC[-24])&IF(RC[-23]="",,"|n"&R1C12&RC[-23])&IF(RC[-22]="",,"|n"&R1C13&RC[-22])&IF(RC[-20]&RC[-19]&RC[-18]&RC[-17]&RC[-16]&RC[-15]&RC[-14]&RC[-13]&RC[-12]&RC[-11]&RC[-10]&RC[-9]&RC[-8]="",,"|n"&R1C14)&IF(RC[-20]="",,"|n"&R1C15&RC[-20])&IF(RC[-19]="",,"|n"&R1C16&RC[-19])&IF(RC[-18]="",,"|n"&R1C17&RC[-18])&IF(RC[-17]="",,"|n"&R1C18&RC[-17])&IF(RC[-16]="",,"|n"&R1C19&RC[-16])&IF(RC[-15]="",,"|n"&R1C20&RC[-15])&IF(RC[-14]="",,"|n"&R1C21&RC[-14])&IF(RC[-13]="",,"|n"&R1C22&RC[-13])&IF(RC[-12]="",,"|n"&R1C23&RC[-12])&IF(RC[-11]="",,"|n"&R1C24&RC[-11])&IF(RC[-10]="",,"|n"&R1C25&RC[-10])&IF(RC[-9]="",,"|n"&R1C26&RC[-9])&IF(RC[-8]="",,"|n"&R1C27&RC[-8])&IF(RC[-6]&RC[-5]&RC[-4]="",,"|n"&R1C28)&IF(RC[-6]="",,"|n"&R1C29&RC[-6])&IF(RC[-5]="",,"|n"&R1C30&RC[-5])&IF(RC[-4]="",,"|n"&R1C31&RC[-4])&IF(RC[-2]="",,"|n"&RC[-2]) -> |cFFFFFF99基础属性|r|n力量:667315|n敏捷:667315|n智力:667315|n血量:5560962|n护甲:40550|n升级途径:|cFF1BE6B8击杀 风元素领主(达拉然奥术秘境2) |r 升级
A49: 33 | B49: 6 | C49: A | D49: 神使护甲 | E49: - Lv | F49: 2 | I49: =INT(120*RC[-8]*POWER(10,0.07*RC[-8])) -> 808528 | J49: =RC[-1] -> 808528 | K49: =RC[-1] -> 808528 | L49: =INT(1000*RC[-11]*POWER(10,0.07*RC[-11])) -> 6737735 | M49: =INT(10000*POWER(10,0.019*RC[-12])) -> 42364 | AG49: ="升级途径:|cFF1BE6B8"&"击杀 "&VLOOKUP(VLOOKUP(Sheet1!RC[-31],Sheet2!R20C1:R25C3,3,0),Sheet2!R28C2:R32C10,5+R[1]C[-27],0)&"("&VLOOKUP(Sheet1!RC[-31],Sheet2!R20C1:R25C3,3,0)&R[1]C[-27]&") |r 升级" -> 升级途径:|cFF1BE6B8击杀 水元素领主(达拉然奥术秘境3) |r 升级 | AH49: =VLOOKUP(RC[-31],Sheet2!R1C1:R7C2,2,0)&RC[-30]&RC[-29]&RC[-28]&Sheet2!R1C3&"" -> |cFF99FF66神使护甲 - Lv2|r | AI49: =IF(RC[-27]&RC[-26]&RC[-25]&RC[-24]&RC[-23]&RC[-22]="",,R1C7)&IF(RC[-27]="",,"|n"&R1C8&RC[-27])&IF(RC[-26]="",,"|n"&R1C9&RC[-26])&IF(RC[-25]="",,"|n"&R1C10&RC[-25])&IF(RC[-24]="",,"|n"&R1C11&RC[-24])&IF(RC[-23]="",,"|n"&R1C12&RC[-23])&IF(RC[-22]="",,"|n"&R1C13&RC[-22])&IF(RC[-20]&RC[-19]&RC[-18]&RC[-17]&RC[-16]&RC[-15]&RC[-14]&RC[-13]&RC[-12]&RC[-11]&RC[-10]&RC[-9]&RC[-8]="",,"|n"&R1C14)&IF(RC[-20]="",,"|n"&R1C15&RC[-20])&IF(RC[-19]="",,"|n"&R1C16&RC[-19])&IF(RC[-18]="",,"|n"&R1C17&RC[-18])&IF(RC[-17]="",,"|n"&R1C18&RC[-17])&IF(RC[-16]="",,"|n"&R1C19&RC[-16])&IF(RC[-15]="",,"|n"&R1C20&RC[-15])&IF(RC[-14]="",,"|n"&R1C21&RC[-14])&IF(RC[-13]="",,"|n"&R1C22&RC[-13])&IF(RC[-12]="",,"|n"&R1C23&RC[-12])&IF(RC[-11]="",,"|n"&R1C24&RC[-11])&IF(RC[-10]="",,"|n"&R1C25&RC[-10])&IF(RC[-9]="",,"|n"&R1C26&RC[-9])&IF(RC[-8]="",,"|n"&R1C27&RC[-8])&IF(RC[-6]&RC[-5]&RC[-4]="",,"|n"&R1C28)&IF(RC[-6]="",,"|n"&R1C29&RC[-6])&IF(RC[-5]="",,"|n"&R1C30&RC[-5])&IF(RC[-4]="",,"|n"&R1C31&RC[-4])&IF(RC[-2]="",,"|n"&RC[-2]) -> |cFFFFFF99基础属性|r|n力量:808528|n敏捷:808528|n智力:808528|n血量:6737735|n护甲:42364|n升级途径:|cFF1BE6B8击杀 水元素领主(达拉然奥术秘境3) |r 升级
A50: 34 | B50: 6 | C50: A | D50: 神使护甲 | E50: - Lv | F50: 3 | I50: =INT(120*RC[-8]*POWER(10,0.07*RC[-8])) -> 978723 | J50: =RC[-1] -> 978723 | K50: =RC[-1] -> 978723 | L50: =INT(1000*RC[-11]*POWER(10,0.07*RC[-11])) -> 8156031 | M50: =INT(10000*POWER(10,0.019*RC[-12])) -> 44258 | AG50: ="升级途径:|cFF1BE6B8"&"击杀 "&VLOOKUP(VLOOKUP(Sheet1!RC[-31],Sheet2!R20C1:R25C3,3,0),Sheet2!R28C2:R32C10,5+R[1]C[-27],0)&"("&VLOOKUP(Sheet1!RC[-31],Sheet2!R20C1:R25C3,3,0)&R[1]C[-27]&") |r 升级" -> 升级途径:|cFF1BE6B8击杀 土元素领主(达拉然奥术秘境4) |r 升级 | AH50: =VLOOKUP(RC[-31],Sheet2!R1C1:R7C2,2,0)&RC[-30]&RC[-29]&RC[-28]&Sheet2!R1C3&"" -> |cFF99FF66神使护甲 - Lv3|r | AI50: =IF(RC[-27]&RC[-26]&RC[-25]&RC[-24]&RC[-23]&RC[-22]="",,R1C7)&IF(RC[-27]="",,"|n"&R1C8&RC[-27])&IF(RC[-26]="",,"|n"&R1C9&RC[-26])&IF(RC[-25]="",,"|n"&R1C10&RC[-25])&IF(RC[-24]="",,"|n"&R1C11&RC[-24])&IF(RC[-23]="",,"|n"&R1C12&RC[-23])&IF(RC[-22]="",,"|n"&R1C13&RC[-22])&IF(RC[-20]&RC[-19]&RC[-18]&RC[-17]&RC[-16]&RC[-15]&RC[-14]&RC[-13]&RC[-12]&RC[-11]&RC[-10]&RC[-9]&RC[-8]="",,"|n"&R1C14)&IF(RC[-20]="",,"|n"&R1C15&RC[-20])&IF(RC[-19]="",,"|n"&R1C16&RC[-19])&IF(RC[-18]="",,"|n"&R1C17&RC[-18])&IF(RC[-17]="",,"|n"&R1C18&RC[-17])&IF(RC[-16]="",,"|n"&R1C19&RC[-16])&IF(RC[-15]="",,"|n"&R1C20&RC[-15])&IF(RC[-14]="",,"|n"&R1C21&RC[-14])&IF(RC[-13]="",,"|n"&R1C22&RC[-13])&IF(RC[-12]="",,"|n"&R1C23&RC[-12])&IF(RC[-11]="",,"|n"&R1C24&RC[-11])&IF(RC[-10]="",,"|n"&R1C25&RC[-10])&IF(RC[-9]="",,"|n"&R1C26&RC[-9])&IF(RC[-8]="",,"|n"&R1C27&RC[-8])&IF(RC[-6]&RC[-5]&RC[-4]="",,"|n"&R1C28)&IF(RC[-6]="",,"|n"&R1C29&RC[-6])&IF(RC[-5]="",,"|n"&R1C30&RC[-5])&IF(RC[-4]="",,"|n"&R1C31&RC[-4])&IF(RC[-2]="",,"|n"&RC[-2]) -> |cFFFFFF99基础属性|r|n力量:978723|n敏捷:978723|n智力:978723|n血量:8156031|n护甲:44258|n升级途径:|cFF1BE6B8击杀 土元素领主(达拉然奥术秘境4) |r 升级
A51: 35 | B51: 7 | C51: A | D51: 神使护甲 | E51: - Lv | F51: 4 | I51: =INT(120*RC[-8]*POWER(10,0.07*RC[-8])) -> 1183720 | J51: =RC[-1] -> 1183720 | K51: =RC[-1] -> 1183720 | L51: =INT(1000*RC[-11]*POWER(10,0.07*RC[-11])) -> 9864340 | M51: =INT(10000*POWER(10,0.019*RC[-12])) -> 46238 | AG51: =VLOOKUP(RC[-31],Sheet2!R20C1:R25C5,5,0) -> 升级途径:|cFF1BE6B8找 圣魂信仰NPC(后山)|r 合成升级 | AH51: =VLOOKUP(RC[-31],Sheet2!R1C1:R7C2,2,0)&RC[-30]&RC[-29]&RC[-28]&Sheet2!R1C3&"" -> |cFF99FF66神使护甲 - Lv4|r | AI51: =IF(RC[-27]&RC[-26]&RC[-25]&RC[-24]&RC[-23]&RC[-22]="",,R1C7)&IF(RC[-27]="",,"|n"&R1C8&RC[-27])&IF(RC[-26]="",,"|n"&R1C9&RC[-26])&IF(RC[-25]="",,"|n"&R1C10&RC[-25])&IF(RC[-24]="",,"|n"&R1C11&RC[-24])&IF(RC[-23]="",,"|n"&R1C12&RC[-23])&IF(RC[-22]="",,"|n"&R1C13&RC[-22])&IF(RC[-20]&RC[-19]&RC[-18]&RC[-17]&RC[-16]&RC[-15]&RC[-14]&RC[-13]&RC[-12]&RC[-11]&RC[-10]&RC[-9]&RC[-8]="",,"|n"&R1C14)&IF(RC[-20]="",,"|n"&R1C15&RC[-20])&IF(RC[-19]="",,"|n"&R1C16&RC[-19])&IF(RC[-18]="",,"|n"&R1C17&RC[-18])&IF(RC[-17]="",,"|n"&R1C18&RC[-17])&IF(RC[-16]="",,"|n"&R1C19&RC[-16])&IF(RC[-15]="",,"|n"&R1C20&RC[-15])&IF(RC[-14]="",,"|n"&R1C21&RC[-14])&IF(RC[-13]="",,"|n"&R1C22&RC[-13])&IF(RC[-12]="",,"|n"&R1C23&RC[-12])&IF(RC[-11]="",,"|n"&R1C24&RC[-11])&IF(RC[-10]="",,"|n"&R1C25&RC[-10])&IF(RC[-9]="",,"|n"&R1C26&RC[-9])&IF(RC[-8]="",,"|n"&R1C27&RC[-8])&IF(RC[-6]&RC[-5]&RC[-4]="",,"|n"&R1C28)&IF(RC[-6]="",,"|n"&R1C29&RC[-6])&IF(RC[-5]="",,"|n"&R1C30&RC[-5])&IF(RC[-4]="",,"|n"&R1C31&RC[-4])&IF(RC[-2]="",,"|n"&RC[-2]) -> |cFFFFFF99基础属性|r|n力量:1183720|n敏捷:1183720|n智力:1183720|n血量:9864340|n护甲:46238|n升级途径:|cFF1BE6B8找 圣魂信仰NPC(后山)|r 合成升级
A52: 11 | B52: 1 | C52: C | D52: [ | E52: 淡蓝 | F52: ]圣魂结晶 | K52: 800000 | AH52: =VLOOKUP(RC[-31],Sheet2!R1C1:R7C2,2,0)&RC[-30]&RC[-29]&RC[-28]&Sheet2!R1C3&"" -> |cFF99FF66[淡蓝]圣魂结晶|r | AI52: =IF(RC[-27]&RC[-26]&RC[-25]&RC[-24]&RC[-23]&RC[-22]="",,R1C7)&IF(RC[-27]="",,"|n"&R1C8&RC[-27])&IF(RC[-26]="",,"|n"&R1C9&RC[-26])&IF(RC[-25]="",,"|n"&R1C10&RC[-25])&IF(RC[-24]="",,"|n"&R1C11&RC[-24])&IF(RC[-23]="",,"|n"&R1C12&RC[-23])&IF(RC[-22]="",,"|n"&R1C13&RC[-22])&IF(RC[-20]&RC[-19]&RC[-18]&RC[-17]&RC[-16]&RC[-15]&RC[-14]&RC[-13]&RC[-12]&RC[-11]&RC[-10]&RC[-9]&RC[-8]="",,"|n"&R1C14)&IF(RC[-20]="",,"|n"&R1C15&RC[-20])&IF(RC[-19]="",,"|n"&R1C16&RC[-19])&IF(RC[-18]="",,"|n"&R1C17&RC[-18])&IF(RC[-17]="",,"|n"&R1C18&RC[-17])&IF(RC[-16]="",,"|n"&R1C19&RC[-16])&IF(RC[-15]="",,"|n"&R1C20&RC[-15])&IF(RC[-14]="",,"|n"&R1C21&RC[-14])&IF(RC[-13]="",,"|n"&R1C22&RC[-13])&IF(RC[-12]="",,"|n"&R1C23&RC[-12])&IF(RC[-11]="",,"|n"&R1C24&RC[-11])&IF(RC[-10]="",,"|n"&R1C25&RC[-10])&IF(RC[-9]="",,"|n"&R1C26&RC[-9])&IF(RC[-8]="",,"|n"&R1C27&RC[-8])&IF(RC[-6]&RC[-5]&RC[-4]="",,"|n"&R1C28)&IF(RC[-6]="",,"|n"&R1C29&RC[-6])&IF(RC[-5]="",,"|n"&R1C30&RC[-5])&IF(RC[-4]="",,"|n"&R1C31&RC[-4])&IF(RC[-2]="",,"|n"&RC[-2]) -> |cFFFFFF99基础属性|r|n智力:800000
A53: 11 | B53: 1 | C53: C | D53: [ | E53: 赤炎 | F53: ]圣魂结晶 | J53: 800000 | AH53: =VLOOKUP(RC[-31],Sheet2!R1C1:R7C2,2,0)&RC[-30]&RC[-29]&RC[-28]&Sheet2!R1C3&"" -> |cFF99FF66[赤炎]圣魂结晶|r | AI53: =IF(RC[-27]&RC[-26]&RC[-25]&RC[-24]&RC[-23]&RC[-22]="",,R1C7)&IF(RC[-27]="",,"|n"&R1C8&RC[-27])&IF(RC[-26]="",,"|n"&R1C9&RC[-26])&IF(RC[-25]="",,"|n"&R1C10&RC[-25])&IF(RC[-24]="",,"|n"&R1C11&RC[-24])&IF(RC[-23]="",,"|n"&R1C12&RC[-23])&IF(RC[-22]="",,"|n"&R1C13&RC[-22])&IF(RC[-20]&RC[-19]&RC[-18]&RC[-17]&RC[-16]&RC[-15]&RC[-14]&RC[-13]&RC[-12]&RC[-11]&RC[-10]&RC[-9]&RC[-8]="",,"|n"&R1C14)&IF(RC[-20]="",,"|n"&R1C15&RC[-20])&IF(RC[-19]="",,"|n"&R1C16&RC[-19])&IF(RC[-18]="",,"|n"&R1C17&RC[-18])&IF(RC[-17]="",,"|n"&R1C18&RC[-17])&IF(RC[-16]="",,"|n"&R1C19&RC[-16])&IF(RC[-15]="",,"|n"&R1C20&RC[-15])&IF(RC[-14]="",,"|n"&R1C21&RC[-14])&IF(RC[-13]="",,"|n"&R1C22&RC[-13])&IF(RC[-12]="",,"|n"&R1C23&RC[-12])&IF(RC[-11]="",,"|n"&R1C24&RC[-11])&IF(RC[-10]="",,"|n"&R1C25&RC[-10])&IF(RC[-9]="",,"|n"&R1C26&RC[-9])&IF(RC[-8]="",,"|n"&R1C27&RC[-8])&IF(RC[-6]&RC[-5]&RC[-4]="",,"|n"&R1C28)&IF(RC[-6]="",,"|n"&R1C29&RC[-6])&IF(RC[-5]="",,"|n"&R1C30&RC[-5])&IF(RC[-4]="",,"|n"&R1C31&RC[-4])&IF(RC[-2]="",,"|n"&RC[-2]) -> |cFFFFFF99基础属性|r|n敏捷:800000
A54: 11 | B54: 1 | C54: C | D54: [ | E54: 圣光 | F54: ]圣魂结晶 | L54: 5000000 | AH54: =VLOOKUP(RC[-31],Sheet2!R1C1:R7C2,2,0)&RC[-30]&RC[-29]&RC[-28]&Sheet2!R1C3&"" -> |cFF99FF66[圣光]圣魂结晶|r | AI54: =IF(RC[-27]&RC[-26]&RC[-25]&RC[-24]&RC[-23]&RC[-22]="",,R1C7)&IF(RC[-27]="",,"|n"&R1C8&RC[-27])&IF(RC[-26]="",,"|n"&R1C9&RC[-26])&IF(RC[-25]="",,"|n"&R1C10&RC[-25])&IF(RC[-24]="",,"|n"&R1C11&RC[-24])&IF(RC[-23]="",,"|n"&R1C12&RC[-23])&IF(RC[-22]="",,"|n"&R1C13&RC[-22])&IF(RC[-20]&RC[-19]&RC[-18]&RC[-17]&RC[-16]&RC[-15]&RC[-14]&RC[-13]&RC[-12]&RC[-11]&RC[-10]&RC[-9]&RC[-8]="",,"|n"&R1C14)&IF(RC[-20]="",,"|n"&R1C15&RC[-20])&IF(RC[-19]="",,"|n"&R1C16&RC[-19])&IF(RC[-18]="",,"|n"&R1C17&RC[-18])&IF(RC[-17]="",,"|n"&R1C18&RC[-17])&IF(RC[-16]="",,"|n"&R1C19&RC[-16])&IF(RC[-15]="",,"|n"&R1C20&RC[-15])&IF(RC[-14]="",,"|n"&R1C21&RC[-14])&IF(RC[-13]="",,"|n"&R1C22&RC[-13])&IF(RC[-12]="",,"|n"&R1C23&RC[-12])&IF(RC[-11]="",,"|n"&R1C24&RC[-11])&IF(RC[-10]="",,"|n"&R1C25&RC[-10])&IF(RC[-9]="",,"|n"&R1C26&RC[-9])&IF(RC[-8]="",,"|n"&R1C27&RC[-8])&IF(RC[-6]&RC[-5]&RC[-4]="",,"|n"&R1C28)&IF(RC[-6]="",,"|n"&R1C29&RC[-6])&IF(RC[-5]="",,"|n"&R1C30&RC[-5])&IF(RC[-4]="",,"|n"&R1C31&RC[-4])&IF(RC[-2]="",,"|n"&RC[-2]) -> |cFFFFFF99基础属性|r|n血量:5000000
A55: 11 | B55: 1 | C55: C | D55: [ | E55: 暗黑 | F55: ]圣魂结晶 | H55: 3000000 | O55: 20 | AH55: =VLOOKUP(RC[-31],Sheet2!R1C1:R7C2,2,0)&RC[-30]&RC[-29]&RC[-28]&Sheet2!R1C3&"" -> |cFF99FF66[暗黑]圣魂结晶|r | AI55: =IF(RC[-27]&RC[-26]&RC[-25]&RC[-24]&RC[-23]&RC[-22]="",,R1C7)&IF(RC[-27]="",,"|n"&R1C8&RC[-27])&IF(RC[-26]="",,"|n"&R1C9&RC[-26])&IF(RC[-25]="",,"|n"&R1C10&RC[-25])&IF(RC[-24]="",,"|n"&R1C11&RC[-24])&IF(RC[-23]="",,"|n"&R1C12&RC[-23])&IF(RC[-22]="",,"|n"&R1C13&RC[-22])&IF(RC[-20]&RC[-19]&RC[-18]&RC[-17]&RC[-16]&RC[-15]&RC[-14]&RC[-13]&RC[-12]&RC[-11]&RC[-10]&RC[-9]&RC[-8]="",,"|n"&R1C14)&IF(RC[-20]="",,"|n"&R1C15&RC[-20])&IF(RC[-19]="",,"|n"&R1C16&RC[-19])&IF(RC[-18]="",,"|n"&R1C17&RC[-18])&IF(RC[-17]="",,"|n"&R1C18&RC[-17])&IF(RC[-16]="",,"|n"&R1C19&RC[-16])&IF(RC[-15]="",,"|n"&R1C20&RC[-15])&IF(RC[-14]="",,"|n"&R1C21&RC[-14])&IF(RC[-13]="",,"|n"&R1C22&RC[-13])&IF(RC[-12]="",,"|n"&R1C23&RC[-12])&IF(RC[-11]="",,"|n"&R1C24&RC[-11])&IF(RC[-10]="",,"|n"&R1C25&RC[-10])&IF(RC[-9]="",,"|n"&R1C26&RC[-9])&IF(RC[-8]="",,"|n"&R1C27&RC[-8])&IF(RC[-6]&RC[-5]&RC[-4]="",,"|n"&R1C28)&IF(RC[-6]="",,"|n"&R1C29&RC[-6])&IF(RC[-5]="",,"|n"&R1C30&RC[-5])&IF(RC[-4]="",,"|n"&R1C31&RC[-4])&IF(RC[-2]="",,"|n"&RC[-2]) -> |cFFFFFF99基础属性|r|n攻击:3000000|n|cFFFFFF55附加属性|r(%)|n攻速:20
A56: 11 | B56: 1 | C56: C | D56: [ | E56: 纯白 | F56: ]圣魂结晶 | I56: 800000 | AH56: =VLOOKUP(RC[-31],Sheet2!R1C1:R7C2,2,0)&RC[-30]&RC[-29]&RC[-28]&Sheet2!R1C3&"" -> |cFF99FF66[纯白]圣魂结晶|r | AI56: =IF(RC[-27]&RC[-26]&RC[-25]&RC[-24]&RC[-23]&RC[-22]="",,R1C7)&IF(RC[-27]="",,"|n"&R1C8&RC[-27])&IF(RC[-26]="",,"|n"&R1C9&RC[-26])&IF(RC[-25]="",,"|n"&R1C10&RC[-25])&IF(RC[-24]="",,"|n"&R1C11&RC[-24])&IF(RC[-23]="",,"|n"&R1C12&RC[-23])&IF(RC[-22]="",,"|n"&R1C13&RC[-22])&IF(RC[-20]&RC[-19]&RC[-18]&RC[-17]&RC[-16]&RC[-15]&RC[-14]&RC[-13]&RC[-12]&RC[-11]&RC[-10]&RC[-9]&RC[-8]="",,"|n"&R1C14)&IF(RC[-20]="",,"|n"&R1C15&RC[-20])&IF(RC[-19]="",,"|n"&R1C16&RC[-19])&IF(RC[-18]="",,"|n"&R1C17&RC[-18])&IF(RC[-17]="",,"|n"&R1C18&RC[-17])&IF(RC[-16]="",,"|n"&R1C19&RC[-16])&IF(RC[-15]="",,"|n"&R1C20&RC[-15])&IF(RC[-14]="",,"|n"&R1C21&RC[-14])&IF(RC[-13]="",,"|n"&R1C22&RC[-13])&IF(RC[-12]="",,"|n"&R1C23&RC[-12])&IF(RC[-11]="",,"|n"&R1C24&RC[-11])&IF(RC[-10]="",,"|n"&R1C25&RC[-10])&IF(RC[-9]="",,"|n"&R1C26&RC[-9])&IF(RC[-8]="",,"|n"&R1C27&RC[-8])&IF(RC[-6]&RC[-5]&RC[-4]="",,"|n"&R1C28)&IF(RC[-6]="",,"|n"&R1C29&RC[-6])&IF(RC[-5]="",,"|n"&R1C30&RC[-5])&IF(RC[-4]="",,"|n"&R1C31&RC[-4])&IF(RC[-2]="",,"|n"&RC[-2]) -> |cFFFFFF99基础属性|r|n力量:800000
A57: 12 | C57: B | D57: [ | E57: 淡蓝 | F57: ]圣魂珠 | H57: 6000000 | I57: 1500000 | J57: 1500000 | K57: 2500000 | L57: 13000000 | M57: 50000 | O57: 60 | P57: 20 | AH57: =VLOOKUP(RC[-31],Sheet2!R1C1:R7C2,2,0)&RC[-30]&RC[-29]&RC[-28]&Sheet2!R1C3&"" -> |cFF99FF66[淡蓝]圣魂珠|r | AI57: =IF(RC[-27]&RC[-26]&RC[-25]&RC[-24]&RC[-23]&RC[-22]="",,R1C7)&IF(RC[-27]="",,"|n"&R1C8&RC[-27])&IF(RC[-26]="",,"|n"&R1C9&RC[-26])&IF(RC[-25]="",,"|n"&R1C10&RC[-25])&IF(RC[-24]="",,"|n"&R1C11&RC[-24])&IF(RC[-23]="",,"|n"&R1C12&RC[-23])&IF(RC[-22]="",,"|n"&R1C13&RC[-22])&IF(RC[-20]&RC[-19]&RC[-18]&RC[-17]&RC[-16]&RC[-15]&RC[-14]&RC[-13]&RC[-12]&RC[-11]&RC[-10]&RC[-9]&RC[-8]="",,"|n"&R1C14)&IF(RC[-20]="",,"|n"&R1C15&RC[-20])&IF(RC[-19]="",,"|n"&R1C16&RC[-19])&IF(RC[-18]="",,"|n"&R1C17&RC[-18])&IF(RC[-17]="",,"|n"&R1C18&RC[-17])&IF(RC[-16]="",,"|n"&R1C19&RC[-16])&IF(RC[-15]="",,"|n"&R1C20&RC[-15])&IF(RC[-14]="",,"|n"&R1C21&RC[-14])&IF(RC[-13]="",,"|n"&R1C22&RC[-13])&IF(RC[-12]="",,"|n"&R1C23&RC[-12])&IF(RC[-11]="",,"|n"&R1C24&RC[-11])&IF(RC[-10]="",,"|n"&R1C25&RC[-10])&IF(RC[-9]="",,"|n"&R1C26&RC[-9])&IF(RC[-8]="",,"|n"&R1C27&RC[-8])&IF(RC[-6]&RC[-5]&RC[-4]="",,"|n"&R1C28)&IF(RC[-6]="",,"|n"&R1C29&RC[-6])&IF(RC[-5]="",,"|n"&R1C30&RC[-5])&IF(RC[-4]="",,"|n"&R1C31&RC[-4])&IF(RC[-2]="",,"|n"&RC[-2]) -> |cFFFFFF99基础属性|r|n攻击:6000000|n力量:1500000|n敏捷:1500000|n智力:2500000|n血量:13000000|n护甲:50000|n|cFFFFFF55附加属性|r(%)|n攻速:60|n攻击吸血:20
A58: 12 | C58: B | D58: [ | E58: 赤炎 | F58: ]圣魂珠 | H58: 6000000 | I58: 1500000 | J58: 2500000 | K58: 1500000 | L58: 13000000 | M58: 50000 | O58: 60 | P58: 20 | AH58: =VLOOKUP(RC[-31],Sheet2!R1C1:R7C2,2,0)&RC[-30]&RC[-29]&RC[-28]&Sheet2!R1C3&"" -> |cFF99FF66[赤炎]圣魂珠|r | AI58: =IF(RC[-27]&RC[-26]&RC[-25]&RC[-24]&RC[-23]&RC[-22]="",,R1C7)&IF(RC[-27]="",,"|n"&R1C8&RC[-27])&IF(RC[-26]="",,"|n"&R1C9&RC[-26])&IF(RC[-25]="",,"|n"&R1C10&RC[-25])&IF(RC[-24]="",,"|n"&R1C11&RC[-24])&IF(RC[-23]="",,"|n"&R1C12&RC[-23])&IF(RC[-22]="",,"|n"&R1C13&RC[-22])&IF(RC[-20]&RC[-19]&RC[-18]&RC[-17]&RC[-16]&RC[-15]&RC[-14]&RC[-13]&RC[-12]&RC[-11]&RC[-10]&RC[-9]&RC[-8]="",,"|n"&R1C14)&IF(RC[-20]="",,"|n"&R1C15&RC[-20])&IF(RC[-19]="",,"|n"&R1C16&RC[-19])&IF(RC[-18]="",,"|n"&R1C17&RC[-18])&IF(RC[-17]="",,"|n"&R1C18&RC[-17])&IF(RC[-16]="",,"|n"&R1C19&RC[-16])&IF(RC[-15]="",,"|n"&R1C20&RC[-15])&IF(RC[-14]="",,"|n"&R1C21&RC[-14])&IF(RC[-13]="",,"|n"&R1C22&RC[-13])&IF(RC[-12]="",,"|n"&R1C23&RC[-12])&IF(RC[-11]="",,"|n"&R1C24&RC[-11])&IF(RC[-10]="",,"|n"&R1C25&RC[-10])&IF(RC[-9]="",,"|n"&R1C26&RC[-9])&IF(RC[-8]="",,"|n"&R1C27&RC[-8])&IF(RC[-6]&RC[-5]&RC[-4]="",,"|n"&R1C28)&IF(RC[-6]="",,"|n"&R1C29&RC[-6])&IF(RC[-5]="",,"|n"&R1C30&RC[-5])&IF(RC[-4]="",,"|n"&R1C31&RC[-4])&IF(RC[-2]="",,"|n"&RC[-2]) -> |cFFFFFF99基础属性|r|n攻击:6000000|n力量:1500000|n敏捷:2500000|n智力:1500000|n血量:13000000|n护甲:50000|n|cFFFFFF55附加属性|r(%)|n攻速:60|n攻击吸血:20
A59: 12 | C59: B | D59: [ | E59: 圣光 | F59: ]圣魂珠 | H59: 6000000 | I59: 1500000 | J59: 1500000 | K59: 1500000 | L59: 25000000 | M59: 50000 | O59: 60 | P59: 20 | AH59: =VLOOKUP(RC[-31],Sheet2!R1C1:R7C2,2,0)&RC[-30]&RC[-29]&RC[-28]&Sheet2!R1C3&"" -> |cFF99FF66[圣光]圣魂珠|r | AI59: =IF(RC[-27]&RC[-26]&RC[-25]&RC[-24]&RC[-23]&RC[-22]="",,R1C7)&IF(RC[-27]="",,"|n"&R1C8&RC[-27])&IF(RC[-26]="",,"|n"&R1C9&RC[-26])&IF(RC[-25]="",,"|n"&R1C10&RC[-25])&IF(RC[-24]="",,"|n"&R1C11&RC[-24])&IF(RC[-23]="",,"|n"&R1C12&RC[-23])&IF(RC[-22]="",,"|n"&R1C13&RC[-22])&IF(RC[-20]&RC[-19]&RC[-18]&RC[-17]&RC[-16]&RC[-15]&RC[-14]&RC[-13]&RC[-12]&RC[-11]&RC[-10]&RC[-9]&RC[-8]="",,"|n"&R1C14)&IF(RC[-20]="",,"|n"&R1C15&RC[-20])&IF(RC[-19]="",,"|n"&R1C16&RC[-19])&IF(RC[-18]="",,"|n"&R1C17&RC[-18])&IF(RC[-17]="",,"|n"&R1C18&RC[-17])&IF(RC[-16]="",,"|n"&R1C19&RC[-16])&IF(RC[-15]="",,"|n"&R1C20&RC[-15])&IF(RC[-14]="",,"|n"&R1C21&RC[-14])&IF(RC[-13]="",,"|n"&R1C22&RC[-13])&IF(RC[-12]="",,"|n"&R1C23&RC[-12])&IF(RC[-11]="",,"|n"&R1C24&RC[-11])&IF(RC[-10]="",,"|n"&R1C25&RC[-10])&IF(RC[-9]="",,"|n"&R1C26&RC[-9])&IF(RC[-8]="",,"|n"&R1C27&RC[-8])&IF(RC[-6]&RC[-5]&RC[-4]="",,"|n"&R1C28)&IF(RC[-6]="",,"|n"&R1C29&RC[-6])&IF(RC[-5]="",,"|n"&R1C30&RC[-5])&IF(RC[-4]="",,"|n"&R1C31&RC[-4])&IF(RC[-2]="",,"|n"&RC[-2]) -> |cFFFFFF99基础属性|r|n攻击:6000000|n力量:1500000|n敏捷:1500000|n智力:1500000|n血量:25000000|n护甲:50000|n|cFFFFFF55附加属性|r(%)|n攻速:60|n攻击吸血:20
A60: 12 | C60: B | D60: [ | E60: 暗黑 | F60: ]圣魂珠 | H60: 10000000 | I60: 1500000 | J60: 1500000 | K60: 1500000 | L60: 13000000 | M60: 50000 | O60: 80 | P60: 20 | AH60: =VLOOKUP(RC[-31],Sheet2!R1C1:R7C2,2,0)&RC[-30]&RC[-29]&RC[-28]&Sheet2!R1C3&"" -> |cFF99FF66[暗黑]圣魂珠|r | AI60: =IF(RC[-27]&RC[-26]&RC[-25]&RC[-24]&RC[-23]&RC[-22]="",,R1C7)&IF(RC[-27]="",,"|n"&R1C8&RC[-27])&IF(RC[-26]="",,"|n"&R1C9&RC[-26])&IF(RC[-25]="",,"|n"&R1C10&RC[-25])&IF(RC[-24]="",,"|n"&R1C11&RC[-24])&IF(RC[-23]="",,"|n"&R1C12&RC[-23])&IF(RC[-22]="",,"|n"&R1C13&RC[-22])&IF(RC[-20]&RC[-19]&RC[-18]&RC[-17]&RC[-16]&RC[-15]&RC[-14]&RC[-13]&RC[-12]&RC[-11]&RC[-10]&RC[-9]&RC[-8]="",,"|n"&R1C14)&IF(RC[-20]="",,"|n"&R1C15&RC[-20])&IF(RC[-19]="",,"|n"&R1C16&RC[-19])&IF(RC[-18]="",,"|n"&R1C17&RC[-18])&IF(RC[-17]="",,"|n"&R1C18&RC[-17])&IF(RC[-16]="",,"|n"&R1C19&RC[-16])&IF(RC[-15]="",,"|n"&R1C20&RC[-15])&IF(RC[-14]="",,"|n"&R1C21&RC[-14])&IF(RC[-13]="",,"|n"&R1C22&RC[-13])&IF(RC[-12]="",,"|n"&R1C23&RC[-12])&IF(RC[-11]="",,"|n"&R1C24&RC[-11])&IF(RC[-10]="",,"|n"&R1C25&RC[-10])&IF(RC[-9]="",,"|n"&R1C26&RC[-9])&IF(RC[-8]="",,"|n"&R1C27&RC[-8])&IF(RC[-6]&RC[-5]&RC[-4]="",,"|n"&R1C28)&IF(RC[-6]="",,"|n"&R1C29&RC[-6])&IF(RC[-5]="",,"|n"&R1C30&RC[-5])&IF(RC[-4]="",,"|n"&R1C31&RC[-4])&IF(RC[-2]="",,"|n"&RC[-2]) -> |cFFFFFF99基础属性|r|n攻击:10000000|n力量:1500000|n敏捷:1500000|n智力:1500000|n血量:13000000|n护甲:50000|n|cFFFFFF55附加属性|r(%)|n攻速:80|n攻击吸血:20
A61: 12 | C61: B | D61: [ | E61: 纯白 | F61: ]圣魂珠 | H61: 6000000 | I61: 2500000 | J61: 1500000 | K61: 1500000 | L61: 13000000 | M61: 50000 | O61: 60 | P61: 20 | AH61: =VLOOKUP(RC[-31],Sheet2!R1C1:R7C2,2,0)&RC[-30]&RC[-29]&RC[-28]&Sheet2!R1C3&"" -> |cFF99FF66[纯白]圣魂珠|r | AI61: =IF(RC[-27]&RC[-26]&RC[-25]&RC[-24]&RC[-23]&RC[-22]="",,R1C7)&IF(RC[-27]="",,"|n"&R1C8&RC[-27])&IF(RC[-26]="",,"|n"&R1C9&RC[-26])&IF(RC[-25]="",,"|n"&R1C10&RC[-25])&IF(RC[-24]="",,"|n"&R1C11&RC[-24])&IF(RC[-23]="",,"|n"&R1C12&RC[-23])&IF(RC[-22]="",,"|n"&R1C13&RC[-22])&IF(RC[-20]&RC[-19]&RC[-18]&RC[-17]&RC[-16]&RC[-15]&RC[-14]&RC[-13]&RC[-12]&RC[-11]&RC[-10]&RC[-9]&RC[-8]="",,"|n"&R1C14)&IF(RC[-20]="",,"|n"&R1C15&RC[-20])&IF(RC[-19]="",,"|n"&R1C16&RC[-19])&IF(RC[-18]="",,"|n"&R1C17&RC[-18])&IF(RC[-17]="",,"|n"&R1C18&RC[-17])&IF(RC[-16]="",,"|n"&R1C19&RC[-16])&IF(RC[-15]="",,"|n"&R1C20&RC[-15])&IF(RC[-14]="",,"|n"&R1C21&RC[-14])&IF(RC[-13]="",,"|n"&R1C22&RC[-13])&IF(RC[-12]="",,"|n"&R1C23&RC[-12])&IF(RC[-11]="",,"|n"&R1C24&RC[-11])&IF(RC[-10]="",,"|n"&R1C25&RC[-10])&IF(RC[-9]="",,"|n"&R1C26&RC[-9])&IF(RC[-8]="",,"|n"&R1C27&RC[-8])&IF(RC[-6]&RC[-5]&RC[-4]="",,"|n"&R1C28)&IF(RC[-6]="",,"|n"&R1C29&RC[-6])&IF(RC[-5]="",,"|n"&R1C30&RC[-5])&IF(RC[-4]="",,"|n"&R1C31&RC[-4])&IF(RC[-2]="",,"|n"&RC[-2]) -> |cFFFFFF99基础属性|r|n攻击:6000000|n力量:2500000|n敏捷:1500000|n智力:1500000|n血量:13000000|n护甲:50000|n|cFFFFFF55附加属性|r(%)|n攻速:60|n攻击吸血:20
A62: 4 | C62: B | D62: [A级宝珠] | E62: 时间巨龙之心 | H62: =IF(R[8]C<>"",INT(R[8]C*3),"") ->  | I62: =IF(R[8]C<>"",INT(R[8]C*3),"") -> 270000 | J62: =IF(R[8]C<>"",INT(R[8]C*3),"") -> 270000 | K62: =IF(R[8]C<>"",INT(R[8]C*3),"") -> 270000 | L62: =IF(R[8]C<>"",INT(R[8]C*3),"") ->  | M62: =IF(R[8]C<>"",INT(R[8]C*3),"") ->  | AE62: 1250 | AG62: ="|n"&VLOOKUP(RC[-30],Sheet2!R1C1:R7C10,10,0) -> |n升级途径:|cFF1BE6B8使用 |cFF33FF00传说气息|r 升级|r | AH62: =VLOOKUP(RC[-31],Sheet2!R1C1:R7C2,2,0)&RC[-30]&RC[-29]&RC[-28]&Sheet2!R1C3&"" -> |cFF99FF66[A级宝珠]时间巨龙之心|r | AI62: =IF(RC[-27]&RC[-26]&RC[-25]&RC[-24]&RC[-23]&RC[-22]="",,R1C7)&IF(RC[-27]="",,"|n"&R1C8&RC[-27])&IF(RC[-26]="",,"|n"&R1C9&RC[-26])&IF(RC[-25]="",,"|n"&R1C10&RC[-25])&IF(RC[-24]="",,"|n"&R1C11&RC[-24])&IF(RC[-23]="",,"|n"&R1C12&RC[-23])&IF(RC[-22]="",,"|n"&R1C13&RC[-22])&IF(RC[-20]&RC[-19]&RC[-18]&RC[-17]&RC[-16]&RC[-15]&RC[-14]&RC[-13]&RC[-12]&RC[-11]&RC[-10]&RC[-9]&RC[-8]="",,"|n"&R1C14)&IF(RC[-20]="",,"|n"&R1C15&RC[-20])&IF(RC[-19]="",,"|n"&R1C16&RC[-19])&IF(RC[-18]="",,"|n"&R1C17&RC[-18])&IF(RC[-17]="",,"|n"&R1C18&RC[-17])&IF(RC[-16]="",,"|n"&R1C19&RC[-16])&IF(RC[-15]="",,"|n"&R1C20&RC[-15])&IF(RC[-14]="",,"|n"&R1C21&RC[-14])&IF(RC[-13]="",,"|n"&R1C22&RC[-13])&IF(RC[-12]="",,"|n"&R1C23&RC[-12])&IF(RC[-11]="",,"|n"&R1C24&RC[-11])&IF(RC[-10]="",,"|n"&R1C25&RC[-10])&IF(RC[-9]="",,"|n"&R1C26&RC[-9])&IF(RC[-8]="",,"|n"&R1C27&RC[-8])&IF(RC[-6]&RC[-5]&RC[-4]="",,"|n"&R1C28)&IF(RC[-6]="",,"|n"&R1C29&RC[-6])&IF(RC[-5]="",,"|n"&R1C30&RC[-5])&IF(RC[-4]="",,"|n"&R1C31&RC[-4])&IF(RC[-2]="",,"|n"&RC[-2]) -> |cFFFFFF99基础属性|r|n力量:270000|n敏捷:270000|n智力:270000|n|cFFFFFF11成长属性|r|n每秒属性:1250|n|n升级途径:|cFF1BE6B8使用 |cFF33FF00传说气息|r 升级|r
A63: 4 | C63: B | D63: [A级宝珠] | E63: 生命巨龙之心 | H63: =IF(R[8]C<>"",INT(R[8]C*3),"") ->  | I63: =IF(R[8]C<>"",INT(R[8]C*3),"") ->  | J63: =IF(R[8]C<>"",INT(R[8]C*3),"") ->  | K63: =IF(R[8]C<>"",INT(R[8]C*3),"") ->  | L63: =IF(R[8]C<>"",INT(R[8]C*3),"") -> 4860000 | M63: =IF(R[8]C<>"",INT(R[8]C*3),"") ->  | AD63: 250 | AG63: ="|n"&VLOOKUP(RC[-30],Sheet2!R1C1:R7C10,10,0) -> |n升级途径:|cFF1BE6B8使用 |cFF33FF00传说气息|r 升级|r | AH63: =VLOOKUP(RC[-31],Sheet2!R1C1:R7C2,2,0)&RC[-30]&RC[-29]&RC[-28]&Sheet2!R1C3&"" -> |cFF99FF66[A级宝珠]生命巨龙之心|r | AI63: =IF(RC[-27]&RC[-26]&RC[-25]&RC[-24]&RC[-23]&RC[-22]="",,R1C7)&IF(RC[-27]="",,"|n"&R1C8&RC[-27])&IF(RC[-26]="",,"|n"&R1C9&RC[-26])&IF(RC[-25]="",,"|n"&R1C10&RC[-25])&IF(RC[-24]="",,"|n"&R1C11&RC[-24])&IF(RC[-23]="",,"|n"&R1C12&RC[-23])&IF(RC[-22]="",,"|n"&R1C13&RC[-22])&IF(RC[-20]&RC[-19]&RC[-18]&RC[-17]&RC[-16]&RC[-15]&RC[-14]&RC[-13]&RC[-12]&RC[-11]&RC[-10]&RC[-9]&RC[-8]="",,"|n"&R1C14)&IF(RC[-20]="",,"|n"&R1C15&RC[-20])&IF(RC[-19]="",,"|n"&R1C16&RC[-19])&IF(RC[-18]="",,"|n"&R1C17&RC[-18])&IF(RC[-17]="",,"|n"&R1C18&RC[-17])&IF(RC[-16]="",,"|n"&R1C19&RC[-16])&IF(RC[-15]="",,"|n"&R1C20&RC[-15])&IF(RC[-14]="",,"|n"&R1C21&RC[-14])&IF(RC[-13]="",,"|n"&R1C22&RC[-13])&IF(RC[-12]="",,"|n"&R1C23&RC[-12])&IF(RC[-11]="",,"|n"&R1C24&RC[-11])&IF(RC[-10]="",,"|n"&R1C25&RC[-10])&IF(RC[-9]="",,"|n"&R1C26&RC[-9])&IF(RC[-8]="",,"|n"&R1C27&RC[-8])&IF(RC[-6]&RC[-5]&RC[-4]="",,"|n"&R1C28)&IF(RC[-6]="",,"|n"&R1C29&RC[-6])&IF(RC[-5]="",,"|n"&R1C30&RC[-5])&IF(RC[-4]="",,"|n"&R1C31&RC[-4])&IF(RC[-2]="",,"|n"&RC[-2]) -> |cFFFFFF99基础属性|r|n血量:4860000|n|cFFFFFF11成长属性|r|n杀敌属性:250|n|n升级途径:|cFF1BE6B8使用 |cFF33FF00传说气息|r 升级|r
A64: 4 | C64: B | D64: [A级宝珠] | E64: 魔法巨龙之心 | H64: =IF(R[8]C<>"",INT(R[8]C*3),"") ->  | I64: =IF(R[8]C<>"",INT(R[8]C*3),"") -> 270000 | J64: =IF(R[8]C<>"",INT(R[8]C*3),"") -> 270000 | K64: =IF(R[8]C<>"",INT(R[8]C*3),"") -> 270000 | L64: =IF(R[8]C<>"",INT(R[8]C*3),"") ->  | M64: =IF(R[8]C<>"",INT(R[8]C*3),"") ->  | AC64: 6000 | AG64: ="|n"&VLOOKUP(RC[-30],Sheet2!R1C1:R7C10,10,0) -> |n升级途径:|cFF1BE6B8使用 |cFF33FF00传说气息|r 升级|r | AH64: =VLOOKUP(RC[-31],Sheet2!R1C1:R7C2,2,0)&RC[-30]&RC[-29]&RC[-28]&Sheet2!R1C3&"" -> |cFF99FF66[A级宝珠]魔法巨龙之心|r | AI64: =IF(RC[-27]&RC[-26]&RC[-25]&RC[-24]&RC[-23]&RC[-22]="",,R1C7)&IF(RC[-27]="",,"|n"&R1C8&RC[-27])&IF(RC[-26]="",,"|n"&R1C9&RC[-26])&IF(RC[-25]="",,"|n"&R1C10&RC[-25])&IF(RC[-24]="",,"|n"&R1C11&RC[-24])&IF(RC[-23]="",,"|n"&R1C12&RC[-23])&IF(RC[-22]="",,"|n"&R1C13&RC[-22])&IF(RC[-20]&RC[-19]&RC[-18]&RC[-17]&RC[-16]&RC[-15]&RC[-14]&RC[-13]&RC[-12]&RC[-11]&RC[-10]&RC[-9]&RC[-8]="",,"|n"&R1C14)&IF(RC[-20]="",,"|n"&R1C15&RC[-20])&IF(RC[-19]="",,"|n"&R1C16&RC[-19])&IF(RC[-18]="",,"|n"&R1C17&RC[-18])&IF(RC[-17]="",,"|n"&R1C18&RC[-17])&IF(RC[-16]="",,"|n"&R1C19&RC[-16])&IF(RC[-15]="",,"|n"&R1C20&RC[-15])&IF(RC[-14]="",,"|n"&R1C21&RC[-14])&IF(RC[-13]="",,"|n"&R1C22&RC[-13])&IF(RC[-12]="",,"|n"&R1C23&RC[-12])&IF(RC[-11]="",,"|n"&R1C24&RC[-11])&IF(RC[-10]="",,"|n"&R1C25&RC[-10])&IF(RC[-9]="",,"|n"&R1C26&RC[-9])&IF(RC[-8]="",,"|n"&R1C27&RC[-8])&IF(RC[-6]&RC[-5]&RC[-4]="",,"|n"&R1C28)&IF(RC[-6]="",,"|n"&R1C29&RC[-6])&IF(RC[-5]="",,"|n"&R1C30&RC[-5])&IF(RC[-4]="",,"|n"&R1C31&RC[-4])&IF(RC[-2]="",,"|n"&RC[-2]) -> |cFFFFFF99基础属性|r|n力量:270000|n敏捷:270000|n智力:270000|n|cFFFFFF11成长属性|r|n升级属性:6000|n|n升级途径:|cFF1BE6B8使用 |cFF33FF00传说气息|r 升级|r
A65: 4 | C65: B | D65: [A级宝珠] | E65: 梦境巨龙之心 | H65: =IF(R[8]C<>"",INT(R[8]C*3),"") ->  | I65: =IF(R[8]C<>"",INT(R[8]C*3),"") ->  | J65: =IF(R[8]C<>"",INT(R[8]C*3),"") ->  | K65: =IF(R[8]C<>"",INT(R[8]C*3),"") ->  | L65: =IF(R[8]C<>"",INT(R[8]C*3),"") ->  | M65: =IF(R[8]C<>"",INT(R[8]C*3),"") ->  | W65: 20 | AG65: ="|n"&VLOOKUP(RC[-30],Sheet2!R1C1:R7C10,10,0) -> |n升级途径:|cFF1BE6B8使用 |cFF33FF00传说气息|r 升级|r | AH65: =VLOOKUP(RC[-31],Sheet2!R1C1:R7C2,2,0)&RC[-30]&RC[-29]&RC[-28]&Sheet2!R1C3&"" -> |cFF99FF66[A级宝珠]梦境巨龙之心|r | AI65: =IF(RC[-27]&RC[-26]&RC[-25]&RC[-24]&RC[-23]&RC[-22]="",,R1C7)&IF(RC[-27]="",,"|n"&R1C8&RC[-27])&IF(RC[-26]="",,"|n"&R1C9&RC[-26])&IF(RC[-25]="",,"|n"&R1C10&RC[-25])&IF(RC[-24]="",,"|n"&R1C11&RC[-24])&IF(RC[-23]="",,"|n"&R1C12&RC[-23])&IF(RC[-22]="",,"|n"&R1C13&RC[-22])&IF(RC[-20]&RC[-19]&RC[-18]&RC[-17]&RC[-16]&RC[-15]&RC[-14]&RC[-13]&RC[-12]&RC[-11]&RC[-10]&RC[-9]&RC[-8]="",,"|n"&R1C14)&IF(RC[-20]="",,"|n"&R1C15&RC[-20])&IF(RC[-19]="",,"|n"&R1C16&RC[-19])&IF(RC[-18]="",,"|n"&R1C17&RC[-18])&IF(RC[-17]="",,"|n"&R1C18&RC[-17])&IF(RC[-16]="",,"|n"&R1C19&RC[-16])&IF(RC[-15]="",,"|n"&R1C20&RC[-15])&IF(RC[-14]="",,"|n"&R1C21&RC[-14])&IF(RC[-13]="",,"|n"&R1C22&RC[-13])&IF(RC[-12]="",,"|n"&R1C23&RC[-12])&IF(RC[-11]="",,"|n"&R1C24&RC[-11])&IF(RC[-10]="",,"|n"&R1C25&RC[-10])&IF(RC[-9]="",,"|n"&R1C26&RC[-9])&IF(RC[-8]="",,"|n"&R1C27&RC[-8])&IF(RC[-6]&RC[-5]&RC[-4]="",,"|n"&R1C28)&IF(RC[-6]="",,"|n"&R1C29&RC[-6])&IF(RC[-5]="",,"|n"&R1C30&RC[-5])&IF(RC[-4]="",,"|n"&R1C31&RC[-4])&IF(RC[-2]="",,"|n"&RC[-2]) -> |n|cFFFFFF55附加属性|r(%)|n伤害减免:20|n|n升级途径:|cFF1BE6B8使用 |cFF33FF00传说气息|r 升级|r
A66: 4 | C66: B | D66: [A级宝珠] | E66: 大地巨龙之心 | H66: =IF(R[8]C<>"",INT(R[8]C*3),"") ->  | I66: =IF(R[8]C<>"",INT(R[8]C*3),"") ->  | J66: =IF(R[8]C<>"",INT(R[8]C*3),"") ->  | K66: =IF(R[8]C<>"",INT(R[8]C*3),"") ->  | L66: =IF(R[8]C<>"",INT(R[8]C*3),"") ->  | M66: =IF(R[8]C<>"",INT(R[8]C*3),"") -> 27000 | T66: 60 | AG66: ="|n"&VLOOKUP(RC[-30],Sheet2!R1C1:R7C10,10,0) -> |n升级途径:|cFF1BE6B8使用 |cFF33FF00传说气息|r 升级|r | AH66: =VLOOKUP(RC[-31],Sheet2!R1C1:R7C2,2,0)&RC[-30]&RC[-29]&RC[-28]&Sheet2!R1C3&"" -> |cFF99FF66[A级宝珠]大地巨龙之心|r | AI66: =IF(RC[-27]&RC[-26]&RC[-25]&RC[-24]&RC[-23]&RC[-22]="",,R1C7)&IF(RC[-27]="",,"|n"&R1C8&RC[-27])&IF(RC[-26]="",,"|n"&R1C9&RC[-26])&IF(RC[-25]="",,"|n"&R1C10&RC[-25])&IF(RC[-24]="",,"|n"&R1C11&RC[-24])&IF(RC[-23]="",,"|n"&R1C12&RC[-23])&IF(RC[-22]="",,"|n"&R1C13&RC[-22])&IF(RC[-20]&RC[-19]&RC[-18]&RC[-17]&RC[-16]&RC[-15]&RC[-14]&RC[-13]&RC[-12]&RC[-11]&RC[-10]&RC[-9]&RC[-8]="",,"|n"&R1C14)&IF(RC[-20]="",,"|n"&R1C15&RC[-20])&IF(RC[-19]="",,"|n"&R1C16&RC[-19])&IF(RC[-18]="",,"|n"&R1C17&RC[-18])&IF(RC[-17]="",,"|n"&R1C18&RC[-17])&IF(RC[-16]="",,"|n"&R1C19&RC[-16])&IF(RC[-15]="",,"|n"&R1C20&RC[-15])&IF(RC[-14]="",,"|n"&R1C21&RC[-14])&IF(RC[-13]="",,"|n"&R1C22&RC[-13])&IF(RC[-12]="",,"|n"&R1C23&RC[-12])&IF(RC[-11]="",,"|n"&R1C24&RC[-11])&IF(RC[-10]="",,"|n"&R1C25&RC[-10])&IF(RC[-9]="",,"|n"&R1C26&RC[-9])&IF(RC[-8]="",,"|n"&R1C27&RC[-8])&IF(RC[-6]&RC[-5]&RC[-4]="",,"|n"&R1C28)&IF(RC[-6]="",,"|n"&R1C29&RC[-6])&IF(RC[-5]="",,"|n"&R1C30&RC[-5])&IF(RC[-4]="",,"|n"&R1C31&RC[-4])&IF(RC[-2]="",,"|n"&RC[-2]) -> |cFFFFFF99基础属性|r|n护甲:27000|n|cFFFFFF55附加属性|r(%)|n附加伤害:60|n|n升级途径:|cFF1BE6B8使用 |cFF33FF00传说气息|r 升级|r
A67: 4 | C67: B | D67: [A级宝珠] | E67: 泰坦能量核心 | H67: =IF(R[8]C<>"",INT(R[8]C*3),"") -> 1350000 | I67: =IF(R[8]C<>"",INT(R[8]C*3),"") ->  | J67: =IF(R[8]C<>"",INT(R[8]C*3),"") ->  | K67: =IF(R[8]C<>"",INT(R[8]C*3),"") ->  | L67: =IF(R[8]C<>"",INT(R[8]C*3),"") ->  | M67: =IF(R[8]C<>"",INT(R[8]C*3),"") ->  | O67: 50 | AG67: ="|n"&VLOOKUP(RC[-30],Sheet2!R1C1:R7C10,10,0) -> |n升级途径:|cFF1BE6B8使用 |cFF33FF00传说气息|r 升级|r | AH67: =VLOOKUP(RC[-31],Sheet2!R1C1:R7C2,2,0)&RC[-30]&RC[-29]&RC[-28]&Sheet2!R1C3&"" -> |cFF99FF66[A级宝珠]泰坦能量核心|r | AI67: =IF(RC[-27]&RC[-26]&RC[-25]&RC[-24]&RC[-23]&RC[-22]="",,R1C7)&IF(RC[-27]="",,"|n"&R1C8&RC[-27])&IF(RC[-26]="",,"|n"&R1C9&RC[-26])&IF(RC[-25]="",,"|n"&R1C10&RC[-25])&IF(RC[-24]="",,"|n"&R1C11&RC[-24])&IF(RC[-23]="",,"|n"&R1C12&RC[-23])&IF(RC[-22]="",,"|n"&R1C13&RC[-22])&IF(RC[-20]&RC[-19]&RC[-18]&RC[-17]&RC[-16]&RC[-15]&RC[-14]&RC[-13]&RC[-12]&RC[-11]&RC[-10]&RC[-9]&RC[-8]="",,"|n"&R1C14)&IF(RC[-20]="",,"|n"&R1C15&RC[-20])&IF(RC[-19]="",,"|n"&R1C16&RC[-19])&IF(RC[-18]="",,"|n"&R1C17&RC[-18])&IF(RC[-17]="",,"|n"&R1C18&RC[-17])&IF(RC[-16]="",,"|n"&R1C19&RC[-16])&IF(RC[-15]="",,"|n"&R1C20&RC[-15])&IF(RC[-14]="",,"|n"&R1C21&RC[-14])&IF(RC[-13]="",,"|n"&R1C22&RC[-13])&IF(RC[-12]="",,"|n"&R1C23&RC[-12])&IF(RC[-11]="",,"|n"&R1C24&RC[-11])&IF(RC[-10]="",,"|n"&R1C25&RC[-10])&IF(RC[-9]="",,"|n"&R1C26&RC[-9])&IF(RC[-8]="",,"|n"&R1C27&RC[-8])&IF(RC[-6]&RC[-5]&RC[-4]="",,"|n"&R1C28)&IF(RC[-6]="",,"|n"&R1C29&RC[-6])&IF(RC[-5]="",,"|n"&R1C30&RC[-5])&IF(RC[-4]="",,"|n"&R1C31&RC[-4])&IF(RC[-2]="",,"|n"&RC[-2]) -> |cFFFFFF99基础属性|r|n攻击:1350000|n|cFFFFFF55附加属性|r(%)|n攻速:50|n|n升级途径:|cFF1BE6B8使用 |cFF33FF00传说气息|r 升级|r
A68: 4 | C68: B | D68: [A级宝珠] | E68: 监视枢纽之钥 | H68: =IF(R[8]C<>"",INT(R[8]C*3),"") ->  | I68: =IF(R[8]C<>"",INT(R[8]C*3),"") ->  | J68: =IF(R[8]C<>"",INT(R[8]C*3),"") ->  | K68: =IF(R[8]C<>"",INT(R[8]C*3),"") ->  | L68: =IF(R[8]C<>"",INT(R[8]C*3),"") ->  | M68: =IF(R[8]C<>"",INT(R[8]C*3),"") ->  | P68: 20 | AG68: ="|n"&VLOOKUP(RC[-30],Sheet2!R1C1:R7C10,10,0) -> |n升级途径:|cFF1BE6B8使用 |cFF33FF00传说气息|r 升级|r | AH68: =VLOOKUP(RC[-31],Sheet2!R1C1:R7C2,2,0)&RC[-30]&RC[-29]&RC[-28]&Sheet2!R1C3&"" -> |cFF99FF66[A级宝珠]监视枢纽之钥|r | AI68: =IF(RC[-27]&RC[-26]&RC[-25]&RC[-24]&RC[-23]&RC[-22]="",,R1C7)&IF(RC[-27]="",,"|n"&R1C8&RC[-27])&IF(RC[-26]="",,"|n"&R1C9&RC[-26])&IF(RC[-25]="",,"|n"&R1C10&RC[-25])&IF(RC[-24]="",,"|n"&R1C11&RC[-24])&IF(RC[-23]="",,"|n"&R1C12&RC[-23])&IF(RC[-22]="",,"|n"&R1C13&RC[-22])&IF(RC[-20]&RC[-19]&RC[-18]&RC[-17]&RC[-16]&RC[-15]&RC[-14]&RC[-13]&RC[-12]&RC[-11]&RC[-10]&RC[-9]&RC[-8]="",,"|n"&R1C14)&IF(RC[-20]="",,"|n"&R1C15&RC[-20])&IF(RC[-19]="",,"|n"&R1C16&RC[-19])&IF(RC[-18]="",,"|n"&R1C17&RC[-18])&IF(RC[-17]="",,"|n"&R1C18&RC[-17])&IF(RC[-16]="",,"|n"&R1C19&RC[-16])&IF(RC[-15]="",,"|n"&R1C20&RC[-15])&IF(RC[-14]="",,"|n"&R1C21&RC[-14])&IF(RC[-13]="",,"|n"&R1C22&RC[-13])&IF(RC[-12]="",,"|n"&R1C23&RC[-12])&IF(RC[-11]="",,"|n"&R1C24&RC[-11])&IF(RC[-10]="",,"|n"&R1C25&RC[-10])&IF(RC[-9]="",,"|n"&R1C26&RC[-9])&IF(RC[-8]="",,"|n"&R1C27&RC[-8])&IF(RC[-6]&RC[-5]&RC[-4]="",,"|n"&R1C28)&IF(RC[-6]="",,"|n"&R1C29&RC[-6])&IF(RC[-5]="",,"|n"&R1C30&RC[-5])&IF(RC[-4]="",,"|n"&R1C31&RC[-4])&IF(RC[-2]="",,"|n"&RC[-2]) -> |n|cFFFFFF55附加属性|r(%)|n攻击吸血:20|n|n升级途径:|cFF1BE6B8使用 |cFF33FF00传说气息|r 升级|r
A69: 4 | C69: B | D69: [A级宝珠] | E69: 冰封灵魂之匣 | H69: =IF(R[8]C<>"",INT(R[8]C*3),"") ->  | I69: =IF(R[8]C<>"",INT(R[8]C*3),"") ->  | J69: =IF(R[8]C<>"",INT(R[8]C*3),"") ->  | K69: =IF(R[8]C<>"",INT(R[8]C*3),"") ->  | L69: =IF(R[8]C<>"",INT(R[8]C*3),"") ->  | M69: =IF(R[8]C<>"",INT(R[8]C*3),"") ->  | Q69: 10 | R69: 60 | AG69: ="|n"&VLOOKUP(RC[-30],Sheet2!R1C1:R7C10,10,0) -> |n升级途径:|cFF1BE6B8使用 |cFF33FF00传说气息|r 升级|r | AH69: =VLOOKUP(RC[-31],Sheet2!R1C1:R7C2,2,0)&RC[-30]&RC[-29]&RC[-28]&Sheet2!R1C3&"" -> |cFF99FF66[A级宝珠]冰封灵魂之匣|r | AI69: =IF(RC[-27]&RC[-26]&RC[-25]&RC[-24]&RC[-23]&RC[-22]="",,R1C7)&IF(RC[-27]="",,"|n"&R1C8&RC[-27])&IF(RC[-26]="",,"|n"&R1C9&RC[-26])&IF(RC[-25]="",,"|n"&R1C10&RC[-25])&IF(RC[-24]="",,"|n"&R1C11&RC[-24])&IF(RC[-23]="",,"|n"&R1C12&RC[-23])&IF(RC[-22]="",,"|n"&R1C13&RC[-22])&IF(RC[-20]&RC[-19]&RC[-18]&RC[-17]&RC[-16]&RC[-15]&RC[-14]&RC[-13]&RC[-12]&RC[-11]&RC[-10]&RC[-9]&RC[-8]="",,"|n"&R1C14)&IF(RC[-20]="",,"|n"&R1C15&RC[-20])&IF(RC[-19]="",,"|n"&R1C16&RC[-19])&IF(RC[-18]="",,"|n"&R1C17&RC[-18])&IF(RC[-17]="",,"|n"&R1C18&RC[-17])&IF(RC[-16]="",,"|n"&R1C19&RC[-16])&IF(RC[-15]="",,"|n"&R1C20&RC[-15])&IF(RC[-14]="",,"|n"&R1C21&RC[-14])&IF(RC[-13]="",,"|n"&R1C22&RC[-13])&IF(RC[-12]="",,"|n"&R1C23&RC[-12])&IF(RC[-11]="",,"|n"&R1C24&RC[-11])&IF(RC[-10]="",,"|n"&R1C25&RC[-10])&IF(RC[-9]="",,"|n"&R1C26&RC[-9])&IF(RC[-8]="",,"|n"&R1C27&RC[-8])&IF(RC[-6]&RC[-5]&RC[-4]="",,"|n"&R1C28)&IF(RC[-6]="",,"|n"&R1C29&RC[-6])&IF(RC[-5]="",,"|n"&R1C30&RC[-5])&IF(RC[-4]="",,"|n"&R1C31&RC[-4])&IF(RC[-2]="",,"|n"&RC[-2]) -> |n|cFFFFFF55附加属性|r(%)|n暴击概率:10|n暴击伤害:60|n|n升级途径:|cFF1BE6B8使用 |cFF33FF00传说气息|r 升级|r
A70: 3 | C70: C | D70: [B级宝珠] | E70: 时空结晶石 | H70: =IF(R[8]C<>"",INT(R[8]C*3),"") ->  | I70: =IF(R[8]C<>"",INT(R[8]C*3),"") -> 90000 | J70: =IF(R[8]C<>"",INT(R[8]C*3),"") -> 90000 | K70: =IF(R[8]C<>"",INT(R[8]C*3),"") -> 90000 | L70: =IF(R[8]C<>"",INT(R[8]C*3),"") ->  | M70: =IF(R[8]C<>"",INT(R[8]C*3),"") ->  | AE70: 200 | AG70: ="|n"&VLOOKUP(RC[-30],Sheet2!R1C1:R7C10,10,0) -> |n升级途径:|cFF1BE6B8使用 |cFF1BE6B8玄天灵髓|r 升级|r | AH70: =VLOOKUP(RC[-31],Sheet2!R1C1:R7C2,2,0)&RC[-30]&RC[-29]&RC[-28]&Sheet2!R1C3&"" -> |cFF99FF66[B级宝珠]时空结晶石|r | AI70: =IF(RC[-27]&RC[-26]&RC[-25]&RC[-24]&RC[-23]&RC[-22]="",,R1C7)&IF(RC[-27]="",,"|n"&R1C8&RC[-27])&IF(RC[-26]="",,"|n"&R1C9&RC[-26])&IF(RC[-25]="",,"|n"&R1C10&RC[-25])&IF(RC[-24]="",,"|n"&R1C11&RC[-24])&IF(RC[-23]="",,"|n"&R1C12&RC[-23])&IF(RC[-22]="",,"|n"&R1C13&RC[-22])&IF(RC[-20]&RC[-19]&RC[-18]&RC[-17]&RC[-16]&RC[-15]&RC[-14]&RC[-13]&RC[-12]&RC[-11]&RC[-10]&RC[-9]&RC[-8]="",,"|n"&R1C14)&IF(RC[-20]="",,"|n"&R1C15&RC[-20])&IF(RC[-19]="",,"|n"&R1C16&RC[-19])&IF(RC[-18]="",,"|n"&R1C17&RC[-18])&IF(RC[-17]="",,"|n"&R1C18&RC[-17])&IF(RC[-16]="",,"|n"&R1C19&RC[-16])&IF(RC[-15]="",,"|n"&R1C20&RC[-15])&IF(RC[-14]="",,"|n"&R1C21&RC[-14])&IF(RC[-13]="",,"|n"&R1C22&RC[-13])&IF(RC[-12]="",,"|n"&R1C23&RC[-12])&IF(RC[-11]="",,"|n"&R1C24&RC[-11])&IF(RC[-10]="",,"|n"&R1C25&RC[-10])&IF(RC[-9]="",,"|n"&R1C26&RC[-9])&IF(RC[-8]="",,"|n"&R1C27&RC[-8])&IF(RC[-6]&RC[-5]&RC[-4]="",,"|n"&R1C28)&IF(RC[-6]="",,"|n"&R1C29&RC[-6])&IF(RC[-5]="",,"|n"&R1C30&RC[-5])&IF(RC[-4]="",,"|n"&R1C31&RC[-4])&IF(RC[-2]="",,"|n"&RC[-2]) -> |cFFFFFF99基础属性|r|n力量:90000|n敏捷:90000|n智力:90000|n|cFFFFFF11成长属性|r|n每秒属性:200|n|n升级途径:|cFF1BE6B8使用 |cFF1BE6B8玄天灵髓|r 升级|r
A71: 3 | C71: C | D71: [B级宝珠] | E71: 生命结晶石 | H71: =IF(R[8]C<>"",INT(R[8]C*3),"") ->  | I71: =IF(R[8]C<>"",INT(R[8]C*3),"") ->  | J71: =IF(R[8]C<>"",INT(R[8]C*3),"") ->  | K71: =IF(R[8]C<>"",INT(R[8]C*3),"") ->  | L71: =IF(R[8]C<>"",INT(R[8]C*3),"") -> 1620000 | M71: =IF(R[8]C<>"",INT(R[8]C*3),"") ->  | AD71: 40 | AG71: ="|n"&VLOOKUP(RC[-30],Sheet2!R1C1:R7C10,10,0) -> |n升级途径:|cFF1BE6B8使用 |cFF1BE6B8玄天灵髓|r 升级|r | AH71: =VLOOKUP(RC[-31],Sheet2!R1C1:R7C2,2,0)&RC[-30]&RC[-29]&RC[-28]&Sheet2!R1C3&"" -> |cFF99FF66[B级宝珠]生命结晶石|r | AI71: =IF(RC[-27]&RC[-26]&RC[-25]&RC[-24]&RC[-23]&RC[-22]="",,R1C7)&IF(RC[-27]="",,"|n"&R1C8&RC[-27])&IF(RC[-26]="",,"|n"&R1C9&RC[-26])&IF(RC[-25]="",,"|n"&R1C10&RC[-25])&IF(RC[-24]="",,"|n"&R1C11&RC[-24])&IF(RC[-23]="",,"|n"&R1C12&RC[-23])&IF(RC[-22]="",,"|n"&R1C13&RC[-22])&IF(RC[-20]&RC[-19]&RC[-18]&RC[-17]&RC[-16]&RC[-15]&RC[-14]&RC[-13]&RC[-12]&RC[-11]&RC[-10]&RC[-9]&RC[-8]="",,"|n"&R1C14)&IF(RC[-20]="",,"|n"&R1C15&RC[-20])&IF(RC[-19]="",,"|n"&R1C16&RC[-19])&IF(RC[-18]="",,"|n"&R1C17&RC[-18])&IF(RC[-17]="",,"|n"&R1C18&RC[-17])&IF(RC[-16]="",,"|n"&R1C19&RC[-16])&IF(RC[-15]="",,"|n"&R1C20&RC[-15])&IF(RC[-14]="",,"|n"&R1C21&RC[-14])&IF(RC[-13]="",,"|n"&R1C22&RC[-13])&IF(RC[-12]="",,"|n"&R1C23&RC[-12])&IF(RC[-11]="",,"|n"&R1C24&RC[-11])&IF(RC[-10]="",,"|n"&R1C25&RC[-10])&IF(RC[-9]="",,"|n"&R1C26&RC[-9])&IF(RC[-8]="",,"|n"&R1C27&RC[-8])&IF(RC[-6]&RC[-5]&RC[-4]="",,"|n"&R1C28)&IF(RC[-6]="",,"|n"&R1C29&RC[-6])&IF(RC[-5]="",,"|n"&R1C30&RC[-5])&IF(RC[-4]="",,"|n"&R1C31&RC[-4])&IF(RC[-2]="",,"|n"&RC[-2]) -> |cFFFFFF99基础属性|r|n血量:1620000|n|cFFFFFF11成长属性|r|n杀敌属性:40|n|n升级途径:|cFF1BE6B8使用 |cFF1BE6B8玄天灵髓|r 升级|r
A72: 3 | C72: C | D72: [B级宝珠] | E72: 魔法结晶石 | H72: =IF(R[8]C<>"",INT(R[8]C*3),"") ->  | I72: =IF(R[8]C<>"",INT(R[8]C*3),"") -> 90000 | J72: =IF(R[8]C<>"",INT(R[8]C*3),"") -> 90000 | K72: =IF(R[8]C<>"",INT(R[8]C*3),"") -> 90000 | L72: =IF(R[8]C<>"",INT(R[8]C*3),"") ->  | M72: =IF(R[8]C<>"",INT(R[8]C*3),"") ->  | AC72: 2000 | AG72: ="|n"&VLOOKUP(RC[-30],Sheet2!R1C1:R7C10,10,0) -> |n升级途径:|cFF1BE6B8使用 |cFF1BE6B8玄天灵髓|r 升级|r | AH72: =VLOOKUP(RC[-31],Sheet2!R1C1:R7C2,2,0)&RC[-30]&RC[-29]&RC[-28]&Sheet2!R1C3&"" -> |cFF99FF66[B级宝珠]魔法结晶石|r | AI72: =IF(RC[-27]&RC[-26]&RC[-25]&RC[-24]&RC[-23]&RC[-22]="",,R1C7)&IF(RC[-27]="",,"|n"&R1C8&RC[-27])&IF(RC[-26]="",,"|n"&R1C9&RC[-26])&IF(RC[-25]="",,"|n"&R1C10&RC[-25])&IF(RC[-24]="",,"|n"&R1C11&RC[-24])&IF(RC[-23]="",,"|n"&R1C12&RC[-23])&IF(RC[-22]="",,"|n"&R1C13&RC[-22])&IF(RC[-20]&RC[-19]&RC[-18]&RC[-17]&RC[-16]&RC[-15]&RC[-14]&RC[-13]&RC[-12]&RC[-11]&RC[-10]&RC[-9]&RC[-8]="",,"|n"&R1C14)&IF(RC[-20]="",,"|n"&R1C15&RC[-20])&IF(RC[-19]="",,"|n"&R1C16&RC[-19])&IF(RC[-18]="",,"|n"&R1C17&RC[-18])&IF(RC[-17]="",,"|n"&R1C18&RC[-17])&IF(RC[-16]="",,"|n"&R1C19&RC[-16])&IF(RC[-15]="",,"|n"&R1C20&RC[-15])&IF(RC[-14]="",,"|n"&R1C21&RC[-14])&IF(RC[-13]="",,"|n"&R1C22&RC[-13])&IF(RC[-12]="",,"|n"&R1C23&RC[-12])&IF(RC[-11]="",,"|n"&R1C24&RC[-11])&IF(RC[-10]="",,"|n"&R1C25&RC[-10])&IF(RC[-9]="",,"|n"&R1C26&RC[-9])&IF(RC[-8]="",,"|n"&R1C27&RC[-8])&IF(RC[-6]&RC[-5]&RC[-4]="",,"|n"&R1C28)&IF(RC[-6]="",,"|n"&R1C29&RC[-6])&IF(RC[-5]="",,"|n"&R1C30&RC[-5])&IF(RC[-4]="",,"|n"&R1C31&RC[-4])&IF(RC[-2]="",,"|n"&RC[-2]) -> |cFFFFFF99基础属性|r|n力量:90000|n敏捷:90000|n智力:90000|n|cFFFFFF11成长属性|r|n升级属性:2000|n|n升级途径:|cFF1BE6B8使用 |cFF1BE6B8玄天灵髓|r 升级|r
A73: 3 | C73: C | D73: [B级宝珠] | E73: 梦境结晶石 | H73: =IF(R[8]C<>"",INT(R[8]C*3),"") ->  | I73: =IF(R[8]C<>"",INT(R[8]C*3),"") ->  | J73: =IF(R[8]C<>"",INT(R[8]C*3),"") ->  | K73: =IF(R[8]C<>"",INT(R[8]C*3),"") ->  | L73: =IF(R[8]C<>"",INT(R[8]C*3),"") ->  | M73: =IF(R[8]C<>"",INT(R[8]C*3),"") ->  | W73: 15 | AG73: ="|n"&VLOOKUP(RC[-30],Sheet2!R1C1:R7C10,10,0) -> |n升级途径:|cFF1BE6B8使用 |cFF1BE6B8玄天灵髓|r 升级|r | AH73: =VLOOKUP(RC[-31],Sheet2!R1C1:R7C2,2,0)&RC[-30]&RC[-29]&RC[-28]&Sheet2!R1C3&"" -> |cFF99FF66[B级宝珠]梦境结晶石|r | AI73: =IF(RC[-27]&RC[-26]&RC[-25]&RC[-24]&RC[-23]&RC[-22]="",,R1C7)&IF(RC[-27]="",,"|n"&R1C8&RC[-27])&IF(RC[-26]="",,"|n"&R1C9&RC[-26])&IF(RC[-25]="",,"|n"&R1C10&RC[-25])&IF(RC[-24]="",,"|n"&R1C11&RC[-24])&IF(RC[-23]="",,"|n"&R1C12&RC[-23])&IF(RC[-22]="",,"|n"&R1C13&RC[-22])&IF(RC[-20]&RC[-19]&RC[-18]&RC[-17]&RC[-16]&RC[-15]&RC[-14]&RC[-13]&RC[-12]&RC[-11]&RC[-10]&RC[-9]&RC[-8]="",,"|n"&R1C14)&IF(RC[-20]="",,"|n"&R1C15&RC[-20])&IF(RC[-19]="",,"|n"&R1C16&RC[-19])&IF(RC[-18]="",,"|n"&R1C17&RC[-18])&IF(RC[-17]="",,"|n"&R1C18&RC[-17])&IF(RC[-16]="",,"|n"&R1C19&RC[-16])&IF(RC[-15]="",,"|n"&R1C20&RC[-15])&IF(RC[-14]="",,"|n"&R1C21&RC[-14])&IF(RC[-13]="",,"|n"&R1C22&RC[-13])&IF(RC[-12]="",,"|n"&R1C23&RC[-12])&IF(RC[-11]="",,"|n"&R1C24&RC[-11])&IF(RC[-10]="",,"|n"&R1C25&RC[-10])&IF(RC[-9]="",,"|n"&R1C26&RC[-9])&IF(RC[-8]="",,"|n"&R1C27&RC[-8])&IF(RC[-6]&RC[-5]&RC[-4]="",,"|n"&R1C28)&IF(RC[-6]="",,"|n"&R1C29&RC[-6])&IF(RC[-5]="",,"|n"&R1C30&RC[-5])&IF(RC[-4]="",,"|n"&R1C31&RC[-4])&IF(RC[-2]="",,"|n"&RC[-2]) -> |n|cFFFFFF55附加属性|r(%)|n伤害减免:15|n|n升级途径:|cFF1BE6B8使用 |cFF1BE6B8玄天灵髓|r 升级|r
A74: 3 | C74: C | D74: [B级宝珠] | E74: 大地结晶石 | H74: =IF(R[8]C<>"",INT(R[8]C*3),"") ->  | I74: =IF(R[8]C<>"",INT(R[8]C*3),"") ->  | J74: =IF(R[8]C<>"",INT(R[8]C*3),"") ->  | K74: =IF(R[8]C<>"",INT(R[8]C*3),"") ->  | L74: =IF(R[8]C<>"",INT(R[8]C*3),"") ->  | M74: =IF(R[8]C<>"",INT(R[8]C*3),"") -> 9000 | T74: 40 | AG74: ="|n"&VLOOKUP(RC[-30],Sheet2!R1C1:R7C10,10,0) -> |n升级途径:|cFF1BE6B8使用 |cFF1BE6B8玄天灵髓|r 升级|r | AH74: =VLOOKUP(RC[-31],Sheet2!R1C1:R7C2,2,0)&RC[-30]&RC[-29]&RC[-28]&Sheet2!R1C3&"" -> |cFF99FF66[B级宝珠]大地结晶石|r | AI74: =IF(RC[-27]&RC[-26]&RC[-25]&RC[-24]&RC[-23]&RC[-22]="",,R1C7)&IF(RC[-27]="",,"|n"&R1C8&RC[-27])&IF(RC[-26]="",,"|n"&R1C9&RC[-26])&IF(RC[-25]="",,"|n"&R1C10&RC[-25])&IF(RC[-24]="",,"|n"&R1C11&RC[-24])&IF(RC[-23]="",,"|n"&R1C12&RC[-23])&IF(RC[-22]="",,"|n"&R1C13&RC[-22])&IF(RC[-20]&RC[-19]&RC[-18]&RC[-17]&RC[-16]&RC[-15]&RC[-14]&RC[-13]&RC[-12]&RC[-11]&RC[-10]&RC[-9]&RC[-8]="",,"|n"&R1C14)&IF(RC[-20]="",,"|n"&R1C15&RC[-20])&IF(RC[-19]="",,"|n"&R1C16&RC[-19])&IF(RC[-18]="",,"|n"&R1C17&RC[-18])&IF(RC[-17]="",,"|n"&R1C18&RC[-17])&IF(RC[-16]="",,"|n"&R1C19&RC[-16])&IF(RC[-15]="",,"|n"&R1C20&RC[-15])&IF(RC[-14]="",,"|n"&R1C21&RC[-14])&IF(RC[-13]="",,"|n"&R1C22&RC[-13])&IF(RC[-12]="",,"|n"&R1C23&RC[-12])&IF(RC[-11]="",,"|n"&R1C24&RC[-11])&IF(RC[-10]="",,"|n"&R1C25&RC[-10])&IF(RC[-9]="",,"|n"&R1C26&RC[-9])&IF(RC[-8]="",,"|n"&R1C27&RC[-8])&IF(RC[-6]&RC[-5]&RC[-4]="",,"|n"&R1C28)&IF(RC[-6]="",,"|n"&R1C29&RC[-6])&IF(RC[-5]="",,"|n"&R1C30&RC[-5])&IF(RC[-4]="",,"|n"&R1C31&RC[-4])&IF(RC[-2]="",,"|n"&RC[-2]) -> |cFFFFFF99基础属性|r|n护甲:9000|n|cFFFFFF55附加属性|r(%)|n附加伤害:40|n|n升级途径:|cFF1BE6B8使用 |cFF1BE6B8玄天灵髓|r 升级|r
A75: 3 | C75: C | D75: [B级宝珠] | E75: 泰坦结晶石 | H75: =IF(R[8]C<>"",INT(R[8]C*3),"") -> 450000 | I75: =IF(R[8]C<>"",INT(R[8]C*3),"") ->  | J75: =IF(R[8]C<>"",INT(R[8]C*3),"") ->  | K75: =IF(R[8]C<>"",INT(R[8]C*3),"") ->  | L75: =IF(R[8]C<>"",INT(R[8]C*3),"") ->  | M75: =IF(R[8]C<>"",INT(R[8]C*3),"") ->  | O75: 40 | AG75: ="|n"&VLOOKUP(RC[-30],Sheet2!R1C1:R7C10,10,0) -> |n升级途径:|cFF1BE6B8使用 |cFF1BE6B8玄天灵髓|r 升级|r | AH75: =VLOOKUP(RC[-31],Sheet2!R1C1:R7C2,2,0)&RC[-30]&RC[-29]&RC[-28]&Sheet2!R1C3&"" -> |cFF99FF66[B级宝珠]泰坦结晶石|r | AI75: =IF(RC[-27]&RC[-26]&RC[-25]&RC[-24]&RC[-23]&RC[-22]="",,R1C7)&IF(RC[-27]="",,"|n"&R1C8&RC[-27])&IF(RC[-26]="",,"|n"&R1C9&RC[-26])&IF(RC[-25]="",,"|n"&R1C10&RC[-25])&IF(RC[-24]="",,"|n"&R1C11&RC[-24])&IF(RC[-23]="",,"|n"&R1C12&RC[-23])&IF(RC[-22]="",,"|n"&R1C13&RC[-22])&IF(RC[-20]&RC[-19]&RC[-18]&RC[-17]&RC[-16]&RC[-15]&RC[-14]&RC[-13]&RC[-12]&RC[-11]&RC[-10]&RC[-9]&RC[-8]="",,"|n"&R1C14)&IF(RC[-20]="",,"|n"&R1C15&RC[-20])&IF(RC[-19]="",,"|n"&R1C16&RC[-19])&IF(RC[-18]="",,"|n"&R1C17&RC[-18])&IF(RC[-17]="",,"|n"&R1C18&RC[-17])&IF(RC[-16]="",,"|n"&R1C19&RC[-16])&IF(RC[-15]="",,"|n"&R1C20&RC[-15])&IF(RC[-14]="",,"|n"&R1C21&RC[-14])&IF(RC[-13]="",,"|n"&R1C22&RC[-13])&IF(RC[-12]="",,"|n"&R1C23&RC[-12])&IF(RC[-11]="",,"|n"&R1C24&RC[-11])&IF(RC[-10]="",,"|n"&R1C25&RC[-10])&IF(RC[-9]="",,"|n"&R1C26&RC[-9])&IF(RC[-8]="",,"|n"&R1C27&RC[-8])&IF(RC[-6]&RC[-5]&RC[-4]="",,"|n"&R1C28)&IF(RC[-6]="",,"|n"&R1C29&RC[-6])&IF(RC[-5]="",,"|n"&R1C30&RC[-5])&IF(RC[-4]="",,"|n"&R1C31&RC[-4])&IF(RC[-2]="",,"|n"&RC[-2]) -> |cFFFFFF99基础属性|r|n攻击:450000|n|cFFFFFF55附加属性|r(%)|n攻速:40|n|n升级途径:|cFF1BE6B8使用 |cFF1BE6B8玄天灵髓|r 升级|r
A76: 3 | C76: C | D76: [B级宝珠] | E76: 枢纽结晶石 | H76: =IF(R[8]C<>"",INT(R[8]C*3),"") ->  | I76: =IF(R[8]C<>"",INT(R[8]C*3),"") ->  | J76: =IF(R[8]C<>"",INT(R[8]C*3),"") ->  | K76: =IF(R[8]C<>"",INT(R[8]C*3),"") ->  | L76: =IF(R[8]C<>"",INT(R[8]C*3),"") ->  | M76: =IF(R[8]C<>"",INT(R[8]C*3),"") ->  | P76: 15 | AG76: ="|n"&VLOOKUP(RC[-30],Sheet2!R1C1:R7C10,10,0) -> |n升级途径:|cFF1BE6B8使用 |cFF1BE6B8玄天灵髓|r 升级|r | AH76: =VLOOKUP(RC[-31],Sheet2!R1C1:R7C2,2,0)&RC[-30]&RC[-29]&RC[-28]&Sheet2!R1C3&"" -> |cFF99FF66[B级宝珠]枢纽结晶石|r | AI76: =IF(RC[-27]&RC[-26]&RC[-25]&RC[-24]&RC[-23]&RC[-22]="",,R1C7)&IF(RC[-27]="",,"|n"&R1C8&RC[-27])&IF(RC[-26]="",,"|n"&R1C9&RC[-26])&IF(RC[-25]="",,"|n"&R1C10&RC[-25])&IF(RC[-24]="",,"|n"&R1C11&RC[-24])&IF(RC[-23]="",,"|n"&R1C12&RC[-23])&IF(RC[-22]="",,"|n"&R1C13&RC[-22])&IF(RC[-20]&RC[-19]&RC[-18]&RC[-17]&RC[-16]&RC[-15]&RC[-14]&RC[-13]&RC[-12]&RC[-11]&RC[-10]&RC[-9]&RC[-8]="",,"|n"&R1C14)&IF(RC[-20]="",,"|n"&R1C15&RC[-20])&IF(RC[-19]="",,"|n"&R1C16&RC[-19])&IF(RC[-18]="",,"|n"&R1C17&RC[-18])&IF(RC[-17]="",,"|n"&R1C18&RC[-17])&IF(RC[-16]="",,"|n"&R1C19&RC[-16])&IF(RC[-15]="",,"|n"&R1C20&RC[-15])&IF(RC[-14]="",,"|n"&R1C21&RC[-14])&IF(RC[-13]="",,"|n"&R1C22&RC[-13])&IF(RC[-12]="",,"|n"&R1C23&RC[-12])&IF(RC[-11]="",,"|n"&R1C24&RC[-11])&IF(RC[-10]="",,"|n"&R1C25&RC[-10])&IF(RC[-9]="",,"|n"&R1C26&RC[-9])&IF(RC[-8]="",,"|n"&R1C27&RC[-8])&IF(RC[-6]&RC[-5]&RC[-4]="",,"|n"&R1C28)&IF(RC[-6]="",,"|n"&R1C29&RC[-6])&IF(RC[-5]="",,"|n"&R1C30&RC[-5])&IF(RC[-4]="",,"|n"&R1C31&RC[-4])&IF(RC[-2]="",,"|n"&RC[-2]) -> |n|cFFFFFF55附加属性|r(%)|n攻击吸血:15|n|n升级途径:|cFF1BE6B8使用 |cFF1BE6B8玄天灵髓|r 升级|r
A77: 3 | C77: C | D77: [B级宝珠] | E77: 灵魂结晶石 | H77: =IF(R[8]C<>"",INT(R[8]C*3),"") ->  | I77: =IF(R[8]C<>"",INT(R[8]C*3),"") ->  | J77: =IF(R[8]C<>"",INT(R[8]C*3),"") ->  | K77: =IF(R[8]C<>"",INT(R[8]C*3),"") ->  | L77: =IF(R[8]C<>"",INT(R[8]C*3),"") ->  | M77: =IF(R[8]C<>"",INT(R[8]C*3),"") ->  | Q77: 10 | R77: 40 | AG77: ="|n"&VLOOKUP(RC[-30],Sheet2!R1C1:R7C10,10,0) -> |n升级途径:|cFF1BE6B8使用 |cFF1BE6B8玄天灵髓|r 升级|r | AH77: =VLOOKUP(RC[-31],Sheet2!R1C1:R7C2,2,0)&RC[-30]&RC[-29]&RC[-28]&Sheet2!R1C3&"" -> |cFF99FF66[B级宝珠]灵魂结晶石|r | AI77: =IF(RC[-27]&RC[-26]&RC[-25]&RC[-24]&RC[-23]&RC[-22]="",,R1C7)&IF(RC[-27]="",,"|n"&R1C8&RC[-27])&IF(RC[-26]="",,"|n"&R1C9&RC[-26])&IF(RC[-25]="",,"|n"&R1C10&RC[-25])&IF(RC[-24]="",,"|n"&R1C11&RC[-24])&IF(RC[-23]="",,"|n"&R1C12&RC[-23])&IF(RC[-22]="",,"|n"&R1C13&RC[-22])&IF(RC[-20]&RC[-19]&RC[-18]&RC[-17]&RC[-16]&RC[-15]&RC[-14]&RC[-13]&RC[-12]&RC[-11]&RC[-10]&RC[-9]&RC[-8]="",,"|n"&R1C14)&IF(RC[-20]="",,"|n"&R1C15&RC[-20])&IF(RC[-19]="",,"|n"&R1C16&RC[-19])&IF(RC[-18]="",,"|n"&R1C17&RC[-18])&IF(RC[-17]="",,"|n"&R1C18&RC[-17])&IF(RC[-16]="",,"|n"&R1C19&RC[-16])&IF(RC[-15]="",,"|n"&R1C20&RC[-15])&IF(RC[-14]="",,"|n"&R1C21&RC[-14])&IF(RC[-13]="",,"|n"&R1C22&RC[-13])&IF(RC[-12]="",,"|n"&R1C23&RC[-12])&IF(RC[-11]="",,"|n"&R1C24&RC[-11])&IF(RC[-10]="",,"|n"&R1C25&RC[-10])&IF(RC[-9]="",,"|n"&R1C26&RC[-9])&IF(RC[-8]="",,"|n"&R1C27&RC[-8])&IF(RC[-6]&RC[-5]&RC[-4]="",,"|n"&R1C28)&IF(RC[-6]="",,"|n"&R1C29&RC[-6])&IF(RC[-5]="",,"|n"&R1C30&RC[-5])&IF(RC[-4]="",,"|n"&R1C31&RC[-4])&IF(RC[-2]="",,"|n"&RC[-2]) -> |n|cFFFFFF55附加属性|r(%)|n暴击概率:10|n暴击伤害:40|n|n升级途径:|cFF1BE6B8使用 |cFF1BE6B8玄天灵髓|r 升级|r
A78: 2 | C78: D | D78: [C级宝珠] | E78: 时空水晶 | H78: =IF(R[8]C<>"",INT(R[8]C*3),"") ->  | I78: =IF(R[8]C<>"",INT(R[8]C*3),"") -> 30000 | J78: =IF(R[8]C<>"",INT(R[8]C*3),"") -> 30000 | K78: =IF(R[8]C<>"",INT(R[8]C*3),"") -> 30000 | L78: =IF(R[8]C<>"",INT(R[8]C*3),"") ->  | M78: =IF(R[8]C<>"",INT(R[8]C*3),"") ->  | AE78: 50 | AG78: ="|n"&VLOOKUP(RC[-30],Sheet2!R1C1:R7C10,10,0) -> |n升级途径:|cFF1BE6B8使用 |cFF99FF66精炼晶石|r 升级|r | AH78: =VLOOKUP(RC[-31],Sheet2!R1C1:R7C2,2,0)&RC[-30]&RC[-29]&RC[-28]&Sheet2!R1C3&"" -> |CFFB6D7A8[C级宝珠]时空水晶|r | AI78: =IF(RC[-27]&RC[-26]&RC[-25]&RC[-24]&RC[-23]&RC[-22]="",,R1C7)&IF(RC[-27]="",,"|n"&R1C8&RC[-27])&IF(RC[-26]="",,"|n"&R1C9&RC[-26])&IF(RC[-25]="",,"|n"&R1C10&RC[-25])&IF(RC[-24]="",,"|n"&R1C11&RC[-24])&IF(RC[-23]="",,"|n"&R1C12&RC[-23])&IF(RC[-22]="",,"|n"&R1C13&RC[-22])&IF(RC[-20]&RC[-19]&RC[-18]&RC[-17]&RC[-16]&RC[-15]&RC[-14]&RC[-13]&RC[-12]&RC[-11]&RC[-10]&RC[-9]&RC[-8]="",,"|n"&R1C14)&IF(RC[-20]="",,"|n"&R1C15&RC[-20])&IF(RC[-19]="",,"|n"&R1C16&RC[-19])&IF(RC[-18]="",,"|n"&R1C17&RC[-18])&IF(RC[-17]="",,"|n"&R1C18&RC[-17])&IF(RC[-16]="",,"|n"&R1C19&RC[-16])&IF(RC[-15]="",,"|n"&R1C20&RC[-15])&IF(RC[-14]="",,"|n"&R1C21&RC[-14])&IF(RC[-13]="",,"|n"&R1C22&RC[-13])&IF(RC[-12]="",,"|n"&R1C23&RC[-12])&IF(RC[-11]="",,"|n"&R1C24&RC[-11])&IF(RC[-10]="",,"|n"&R1C25&RC[-10])&IF(RC[-9]="",,"|n"&R1C26&RC[-9])&IF(RC[-8]="",,"|n"&R1C27&RC[-8])&IF(RC[-6]&RC[-5]&RC[-4]="",,"|n"&R1C28)&IF(RC[-6]="",,"|n"&R1C29&RC[-6])&IF(RC[-5]="",,"|n"&R1C30&RC[-5])&IF(RC[-4]="",,"|n"&R1C31&RC[-4])&IF(RC[-2]="",,"|n"&RC[-2]) -> |cFFFFFF99基础属性|r|n力量:30000|n敏捷:30000|n智力:30000|n|cFFFFFF11成长属性|r|n每秒属性:50|n|n升级途径:|cFF1BE6B8使用 |cFF99FF66精炼晶石|r 升级|r
A79: 2 | C79: D | D79: [C级宝珠] | E79: 生命水晶 | H79: =IF(R[8]C<>"",INT(R[8]C*3),"") ->  | I79: =IF(R[8]C<>"",INT(R[8]C*3),"") ->  | J79: =IF(R[8]C<>"",INT(R[8]C*3),"") ->  | K79: =IF(R[8]C<>"",INT(R[8]C*3),"") ->  | L79: =IF(R[8]C<>"",INT(R[8]C*3),"") -> 540000 | M79: =IF(R[8]C<>"",INT(R[8]C*3),"") ->  | AD79: 10 | AG79: ="|n"&VLOOKUP(RC[-30],Sheet2!R1C1:R7C10,10,0) -> |n升级途径:|cFF1BE6B8使用 |cFF99FF66精炼晶石|r 升级|r | AH79: =VLOOKUP(RC[-31],Sheet2!R1C1:R7C2,2,0)&RC[-30]&RC[-29]&RC[-28]&Sheet2!R1C3&"" -> |CFFB6D7A8[C级宝珠]生命水晶|r | AI79: =IF(RC[-27]&RC[-26]&RC[-25]&RC[-24]&RC[-23]&RC[-22]="",,R1C7)&IF(RC[-27]="",,"|n"&R1C8&RC[-27])&IF(RC[-26]="",,"|n"&R1C9&RC[-26])&IF(RC[-25]="",,"|n"&R1C10&RC[-25])&IF(RC[-24]="",,"|n"&R1C11&RC[-24])&IF(RC[-23]="",,"|n"&R1C12&RC[-23])&IF(RC[-22]="",,"|n"&R1C13&RC[-22])&IF(RC[-20]&RC[-19]&RC[-18]&RC[-17]&RC[-16]&RC[-15]&RC[-14]&RC[-13]&RC[-12]&RC[-11]&RC[-10]&RC[-9]&RC[-8]="",,"|n"&R1C14)&IF(RC[-20]="",,"|n"&R1C15&RC[-20])&IF(RC[-19]="",,"|n"&R1C16&RC[-19])&IF(RC[-18]="",,"|n"&R1C17&RC[-18])&IF(RC[-17]="",,"|n"&R1C18&RC[-17])&IF(RC[-16]="",,"|n"&R1C19&RC[-16])&IF(RC[-15]="",,"|n"&R1C20&RC[-15])&IF(RC[-14]="",,"|n"&R1C21&RC[-14])&IF(RC[-13]="",,"|n"&R1C22&RC[-13])&IF(RC[-12]="",,"|n"&R1C23&RC[-12])&IF(RC[-11]="",,"|n"&R1C24&RC[-11])&IF(RC[-10]="",,"|n"&R1C25&RC[-10])&IF(RC[-9]="",,"|n"&R1C26&RC[-9])&IF(RC[-8]="",,"|n"&R1C27&RC[-8])&IF(RC[-6]&RC[-5]&RC[-4]="",,"|n"&R1C28)&IF(RC[-6]="",,"|n"&R1C29&RC[-6])&IF(RC[-5]="",,"|n"&R1C30&RC[-5])&IF(RC[-4]="",,"|n"&R1C31&RC[-4])&IF(RC[-2]="",,"|n"&RC[-2]) -> |cFFFFFF99基础属性|r|n血量:540000|n|cFFFFFF11成长属性|r|n杀敌属性:10|n|n升级途径:|cFF1BE6B8使用 |cFF99FF66精炼晶石|r 升级|r
A80: 2 | C80: D | D80: [C级宝珠] | E80: 魔法水晶 | H80: =IF(R[8]C<>"",INT(R[8]C*3),"") ->  | I80: =IF(R[8]C<>"",INT(R[8]C*3),"") -> 30000 | J80: =IF(R[8]C<>"",INT(R[8]C*3),"") -> 30000 | K80: =IF(R[8]C<>"",INT(R[8]C*3),"") -> 30000 | L80: =IF(R[8]C<>"",INT(R[8]C*3),"") ->  | M80: =IF(R[8]C<>"",INT(R[8]C*3),"") ->  | AC80: 500 | AG80: ="|n"&VLOOKUP(RC[-30],Sheet2!R1C1:R7C10,10,0) -> |n升级途径:|cFF1BE6B8使用 |cFF99FF66精炼晶石|r 升级|r | AH80: =VLOOKUP(RC[-31],Sheet2!R1C1:R7C2,2,0)&RC[-30]&RC[-29]&RC[-28]&Sheet2!R1C3&"" -> |CFFB6D7A8[C级宝珠]魔法水晶|r | AI80: =IF(RC[-27]&RC[-26]&RC[-25]&RC[-24]&RC[-23]&RC[-22]="",,R1C7)&IF(RC[-27]="",,"|n"&R1C8&RC[-27])&IF(RC[-26]="",,"|n"&R1C9&RC[-26])&IF(RC[-25]="",,"|n"&R1C10&RC[-25])&IF(RC[-24]="",,"|n"&R1C11&RC[-24])&IF(RC[-23]="",,"|n"&R1C12&RC[-23])&IF(RC[-22]="",,"|n"&R1C13&RC[-22])&IF(RC[-20]&RC[-19]&RC[-18]&RC[-17]&RC[-16]&RC[-15]&RC[-14]&RC[-13]&RC[-12]&RC[-11]&RC[-10]&RC[-9]&RC[-8]="",,"|n"&R1C14)&IF(RC[-20]="",,"|n"&R1C15&RC[-20])&IF(RC[-19]="",,"|n"&R1C16&RC[-19])&IF(RC[-18]="",,"|n"&R1C17&RC[-18])&IF(RC[-17]="",,"|n"&R1C18&RC[-17])&IF(RC[-16]="",,"|n"&R1C19&RC[-16])&IF(RC[-15]="",,"|n"&R1C20&RC[-15])&IF(RC[-14]="",,"|n"&R1C21&RC[-14])&IF(RC[-13]="",,"|n"&R1C22&RC[-13])&IF(RC[-12]="",,"|n"&R1C23&RC[-12])&IF(RC[-11]="",,"|n"&R1C24&RC[-11])&IF(RC[-10]="",,"|n"&R1C25&RC[-10])&IF(RC[-9]="",,"|n"&R1C26&RC[-9])&IF(RC[-8]="",,"|n"&R1C27&RC[-8])&IF(RC[-6]&RC[-5]&RC[-4]="",,"|n"&R1C28)&IF(RC[-6]="",,"|n"&R1C29&RC[-6])&IF(RC[-5]="",,"|n"&R1C30&RC[-5])&IF(RC[-4]="",,"|n"&R1C31&RC[-4])&IF(RC[-2]="",,"|n"&RC[-2]) -> |cFFFFFF99基础属性|r|n力量:30000|n敏捷:30000|n智力:30000|n|cFFFFFF11成长属性|r|n升级属性:500|n|n升级途径:|cFF1BE6B8使用 |cFF99FF66精炼晶石|r 升级|r
A81: 2 | C81: D | D81: [C级宝珠] | E81: 梦境水晶 | H81: =IF(R[8]C<>"",INT(R[8]C*3),"") ->  | I81: =IF(R[8]C<>"",INT(R[8]C*3),"") ->  | J81: =IF(R[8]C<>"",INT(R[8]C*3),"") ->  | K81: =IF(R[8]C<>"",INT(R[8]C*3),"") ->  | L81: =IF(R[8]C<>"",INT(R[8]C*3),"") ->  | M81: =IF(R[8]C<>"",INT(R[8]C*3),"") ->  | W81: 10 | AG81: ="|n"&VLOOKUP(RC[-30],Sheet2!R1C1:R7C10,10,0) -> |n升级途径:|cFF1BE6B8使用 |cFF99FF66精炼晶石|r 升级|r | AH81: =VLOOKUP(RC[-31],Sheet2!R1C1:R7C2,2,0)&RC[-30]&RC[-29]&RC[-28]&Sheet2!R1C3&"" -> |CFFB6D7A8[C级宝珠]梦境水晶|r | AI81: =IF(RC[-27]&RC[-26]&RC[-25]&RC[-24]&RC[-23]&RC[-22]="",,R1C7)&IF(RC[-27]="",,"|n"&R1C8&RC[-27])&IF(RC[-26]="",,"|n"&R1C9&RC[-26])&IF(RC[-25]="",,"|n"&R1C10&RC[-25])&IF(RC[-24]="",,"|n"&R1C11&RC[-24])&IF(RC[-23]="",,"|n"&R1C12&RC[-23])&IF(RC[-22]="",,"|n"&R1C13&RC[-22])&IF(RC[-20]&RC[-19]&RC[-18]&RC[-17]&RC[-16]&RC[-15]&RC[-14]&RC[-13]&RC[-12]&RC[-11]&RC[-10]&RC[-9]&RC[-8]="",,"|n"&R1C14)&IF(RC[-20]="",,"|n"&R1C15&RC[-20])&IF(RC[-19]="",,"|n"&R1C16&RC[-19])&IF(RC[-18]="",,"|n"&R1C17&RC[-18])&IF(RC[-17]="",,"|n"&R1C18&RC[-17])&IF(RC[-16]="",,"|n"&R1C19&RC[-16])&IF(RC[-15]="",,"|n"&R1C20&RC[-15])&IF(RC[-14]="",,"|n"&R1C21&RC[-14])&IF(RC[-13]="",,"|n"&R1C22&RC[-13])&IF(RC[-12]="",,"|n"&R1C23&RC[-12])&IF(RC[-11]="",,"|n"&R1C24&RC[-11])&IF(RC[-10]="",,"|n"&R1C25&RC[-10])&IF(RC[-9]="",,"|n"&R1C26&RC[-9])&IF(RC[-8]="",,"|n"&R1C27&RC[-8])&IF(RC[-6]&RC[-5]&RC[-4]="",,"|n"&R1C28)&IF(RC[-6]="",,"|n"&R1C29&RC[-6])&IF(RC[-5]="",,"|n"&R1C30&RC[-5])&IF(RC[-4]="",,"|n"&R1C31&RC[-4])&IF(RC[-2]="",,"|n"&RC[-2]) -> |n|cFFFFFF55附加属性|r(%)|n伤害减免:10|n|n升级途径:|cFF1BE6B8使用 |cFF99FF66精炼晶石|r 升级|r
A82: 2 | C82: D | D82: [C级宝珠] | E82: 大地水晶 | H82: =IF(R[8]C<>"",INT(R[8]C*3),"") ->  | I82: =IF(R[8]C<>"",INT(R[8]C*3),"") ->  | J82: =IF(R[8]C<>"",INT(R[8]C*3),"") ->  | K82: =IF(R[8]C<>"",INT(R[8]C*3),"") ->  | L82: =IF(R[8]C<>"",INT(R[8]C*3),"") ->  | M82: =IF(R[8]C<>"",INT(R[8]C*3),"") -> 3000 | T82: 20 | AG82: ="|n"&VLOOKUP(RC[-30],Sheet2!R1C1:R7C10,10,0) -> |n升级途径:|cFF1BE6B8使用 |cFF99FF66精炼晶石|r 升级|r | AH82: =VLOOKUP(RC[-31],Sheet2!R1C1:R7C2,2,0)&RC[-30]&RC[-29]&RC[-28]&Sheet2!R1C3&"" -> |CFFB6D7A8[C级宝珠]大地水晶|r | AI82: =IF(RC[-27]&RC[-26]&RC[-25]&RC[-24]&RC[-23]&RC[-22]="",,R1C7)&IF(RC[-27]="",,"|n"&R1C8&RC[-27])&IF(RC[-26]="",,"|n"&R1C9&RC[-26])&IF(RC[-25]="",,"|n"&R1C10&RC[-25])&IF(RC[-24]="",,"|n"&R1C11&RC[-24])&IF(RC[-23]="",,"|n"&R1C12&RC[-23])&IF(RC[-22]="",,"|n"&R1C13&RC[-22])&IF(RC[-20]&RC[-19]&RC[-18]&RC[-17]&RC[-16]&RC[-15]&RC[-14]&RC[-13]&RC[-12]&RC[-11]&RC[-10]&RC[-9]&RC[-8]="",,"|n"&R1C14)&IF(RC[-20]="",,"|n"&R1C15&RC[-20])&IF(RC[-19]="",,"|n"&R1C16&RC[-19])&IF(RC[-18]="",,"|n"&R1C17&RC[-18])&IF(RC[-17]="",,"|n"&R1C18&RC[-17])&IF(RC[-16]="",,"|n"&R1C19&RC[-16])&IF(RC[-15]="",,"|n"&R1C20&RC[-15])&IF(RC[-14]="",,"|n"&R1C21&RC[-14])&IF(RC[-13]="",,"|n"&R1C22&RC[-13])&IF(RC[-12]="",,"|n"&R1C23&RC[-12])&IF(RC[-11]="",,"|n"&R1C24&RC[-11])&IF(RC[-10]="",,"|n"&R1C25&RC[-10])&IF(RC[-9]="",,"|n"&R1C26&RC[-9])&IF(RC[-8]="",,"|n"&R1C27&RC[-8])&IF(RC[-6]&RC[-5]&RC[-4]="",,"|n"&R1C28)&IF(RC[-6]="",,"|n"&R1C29&RC[-6])&IF(RC[-5]="",,"|n"&R1C30&RC[-5])&IF(RC[-4]="",,"|n"&R1C31&RC[-4])&IF(RC[-2]="",,"|n"&RC[-2]) -> |cFFFFFF99基础属性|r|n护甲:3000|n|cFFFFFF55附加属性|r(%)|n附加伤害:20|n|n升级途径:|cFF1BE6B8使用 |cFF99FF66精炼晶石|r 升级|r
A83: 2 | C83: D | D83: [C级宝珠] | E83: 泰坦水晶 | H83: =IF(R[8]C<>"",INT(R[8]C*3),"") -> 150000 | I83: =IF(R[8]C<>"",INT(R[8]C*3),"") ->  | J83: =IF(R[8]C<>"",INT(R[8]C*3),"") ->  | K83: =IF(R[8]C<>"",INT(R[8]C*3),"") ->  | L83: =IF(R[8]C<>"",INT(R[8]C*3),"") ->  | M83: =IF(R[8]C<>"",INT(R[8]C*3),"") ->  | O83: 30 | AG83: ="|n"&VLOOKUP(RC[-30],Sheet2!R1C1:R7C10,10,0) -> |n升级途径:|cFF1BE6B8使用 |cFF99FF66精炼晶石|r 升级|r | AH83: =VLOOKUP(RC[-31],Sheet2!R1C1:R7C2,2,0)&RC[-30]&RC[-29]&RC[-28]&Sheet2!R1C3&"" -> |CFFB6D7A8[C级宝珠]泰坦水晶|r | AI83: =IF(RC[-27]&RC[-26]&RC[-25]&RC[-24]&RC[-23]&RC[-22]="",,R1C7)&IF(RC[-27]="",,"|n"&R1C8&RC[-27])&IF(RC[-26]="",,"|n"&R1C9&RC[-26])&IF(RC[-25]="",,"|n"&R1C10&RC[-25])&IF(RC[-24]="",,"|n"&R1C11&RC[-24])&IF(RC[-23]="",,"|n"&R1C12&RC[-23])&IF(RC[-22]="",,"|n"&R1C13&RC[-22])&IF(RC[-20]&RC[-19]&RC[-18]&RC[-17]&RC[-16]&RC[-15]&RC[-14]&RC[-13]&RC[-12]&RC[-11]&RC[-10]&RC[-9]&RC[-8]="",,"|n"&R1C14)&IF(RC[-20]="",,"|n"&R1C15&RC[-20])&IF(RC[-19]="",,"|n"&R1C16&RC[-19])&IF(RC[-18]="",,"|n"&R1C17&RC[-18])&IF(RC[-17]="",,"|n"&R1C18&RC[-17])&IF(RC[-16]="",,"|n"&R1C19&RC[-16])&IF(RC[-15]="",,"|n"&R1C20&RC[-15])&IF(RC[-14]="",,"|n"&R1C21&RC[-14])&IF(RC[-13]="",,"|n"&R1C22&RC[-13])&IF(RC[-12]="",,"|n"&R1C23&RC[-12])&IF(RC[-11]="",,"|n"&R1C24&RC[-11])&IF(RC[-10]="",,"|n"&R1C25&RC[-10])&IF(RC[-9]="",,"|n"&R1C26&RC[-9])&IF(RC[-8]="",,"|n"&R1C27&RC[-8])&IF(RC[-6]&RC[-5]&RC[-4]="",,"|n"&R1C28)&IF(RC[-6]="",,"|n"&R1C29&RC[-6])&IF(RC[-5]="",,"|n"&R1C30&RC[-5])&IF(RC[-4]="",,"|n"&R1C31&RC[-4])&IF(RC[-2]="",,"|n"&RC[-2]) -> |cFFFFFF99基础属性|r|n攻击:150000|n|cFFFFFF55附加属性|r(%)|n攻速:30|n|n升级途径:|cFF1BE6B8使用 |cFF99FF66精炼晶石|r 升级|r
A84: 2 | C84: D | D84: [C级宝珠] | E84: 枢纽水晶 | H84: =IF(R[8]C<>"",INT(R[8]C*3),"") ->  | I84: =IF(R[8]C<>"",INT(R[8]C*3),"") ->  | J84: =IF(R[8]C<>"",INT(R[8]C*3),"") ->  | K84: =IF(R[8]C<>"",INT(R[8]C*3),"") ->  | L84: =IF(R[8]C<>"",INT(R[8]C*3),"") ->  | M84: =IF(R[8]C<>"",INT(R[8]C*3),"") ->  | P84: 10 | AG84: ="|n"&VLOOKUP(RC[-30],Sheet2!R1C1:R7C10,10,0) -> |n升级途径:|cFF1BE6B8使用 |cFF99FF66精炼晶石|r 升级|r | AH84: =VLOOKUP(RC[-31],Sheet2!R1C1:R7C2,2,0)&RC[-30]&RC[-29]&RC[-28]&Sheet2!R1C3&"" -> |CFFB6D7A8[C级宝珠]枢纽水晶|r | AI84: =IF(RC[-27]&RC[-26]&RC[-25]&RC[-24]&RC[-23]&RC[-22]="",,R1C7)&IF(RC[-27]="",,"|n"&R1C8&RC[-27])&IF(RC[-26]="",,"|n"&R1C9&RC[-26])&IF(RC[-25]="",,"|n"&R1C10&RC[-25])&IF(RC[-24]="",,"|n"&R1C11&RC[-24])&IF(RC[-23]="",,"|n"&R1C12&RC[-23])&IF(RC[-22]="",,"|n"&R1C13&RC[-22])&IF(RC[-20]&RC[-19]&RC[-18]&RC[-17]&RC[-16]&RC[-15]&RC[-14]&RC[-13]&RC[-12]&RC[-11]&RC[-10]&RC[-9]&RC[-8]="",,"|n"&R1C14)&IF(RC[-20]="",,"|n"&R1C15&RC[-20])&IF(RC[-19]="",,"|n"&R1C16&RC[-19])&IF(RC[-18]="",,"|n"&R1C17&RC[-18])&IF(RC[-17]="",,"|n"&R1C18&RC[-17])&IF(RC[-16]="",,"|n"&R1C19&RC[-16])&IF(RC[-15]="",,"|n"&R1C20&RC[-15])&IF(RC[-14]="",,"|n"&R1C21&RC[-14])&IF(RC[-13]="",,"|n"&R1C22&RC[-13])&IF(RC[-12]="",,"|n"&R1C23&RC[-12])&IF(RC[-11]="",,"|n"&R1C24&RC[-11])&IF(RC[-10]="",,"|n"&R1C25&RC[-10])&IF(RC[-9]="",,"|n"&R1C26&RC[-9])&IF(RC[-8]="",,"|n"&R1C27&RC[-8])&IF(RC[-6]&RC[-5]&RC[-4]="",,"|n"&R1C28)&IF(RC[-6]="",,"|n"&R1C29&RC[-6])&IF(RC[-5]="",,"|n"&R1C30&RC[-5])&IF(RC[-4]="",,"|n"&R1C31&RC[-4])&IF(RC[-2]="",,"|n"&RC[-2]) -> |n|cFFFFFF55附加属性|r(%)|n攻击吸血:10|n|n升级途径:|cFF1BE6B8使用 |cFF99FF66精炼晶石|r 升级|r
A85: 2 | C85: D | D85: [C级宝珠] | E85: 灵魂水晶 | Q85: 10 | R85: 20 | AG85: ="|n"&VLOOKUP(RC[-30],Sheet2!R1C1:R7C10,10,0) -> |n升级途径:|cFF1BE6B8使用 |cFF99FF66精炼晶石|r 升级|r | AH85: =VLOOKUP(RC[-31],Sheet2!R1C1:R7C2,2,0)&RC[-30]&RC[-29]&RC[-28]&Sheet2!R1C3&"" -> |CFFB6D7A8[C级宝珠]灵魂水晶|r | AI85: =IF(RC[-27]&RC[-26]&RC[-25]&RC[-24]&RC[-23]&RC[-22]="",,R1C7)&IF(RC[-27]="",,"|n"&R1C8&RC[-27])&IF(RC[-26]="",,"|n"&R1C9&RC[-26])&IF(RC[-25]="",,"|n"&R1C10&RC[-25])&IF(RC[-24]="",,"|n"&R1C11&RC[-24])&IF(RC[-23]="",,"|n"&R1C12&RC[-23])&IF(RC[-22]="",,"|n"&R1C13&RC[-22])&IF(RC[-20]&RC[-19]&RC[-18]&RC[-17]&RC[-16]&RC[-15]&RC[-14]&RC[-13]&RC[-12]&RC[-11]&RC[-10]&RC[-9]&RC[-8]="",,"|n"&R1C14)&IF(RC[-20]="",,"|n"&R1C15&RC[-20])&IF(RC[-19]="",,"|n"&R1C16&RC[-19])&IF(RC[-18]="",,"|n"&R1C17&RC[-18])&IF(RC[-17]="",,"|n"&R1C18&RC[-17])&IF(RC[-16]="",,"|n"&R1C19&RC[-16])&IF(RC[-15]="",,"|n"&R1C20&RC[-15])&IF(RC[-14]="",,"|n"&R1C21&RC[-14])&IF(RC[-13]="",,"|n"&R1C22&RC[-13])&IF(RC[-12]="",,"|n"&R1C23&RC[-12])&IF(RC[-11]="",,"|n"&R1C24&RC[-11])&IF(RC[-10]="",,"|n"&R1C25&RC[-10])&IF(RC[-9]="",,"|n"&R1C26&RC[-9])&IF(RC[-8]="",,"|n"&R1C27&RC[-8])&IF(RC[-6]&RC[-5]&RC[-4]="",,"|n"&R1C28)&IF(RC[-6]="",,"|n"&R1C29&RC[-6])&IF(RC[-5]="",,"|n"&R1C30&RC[-5])&IF(RC[-4]="",,"|n"&R1C31&RC[-4])&IF(RC[-2]="",,"|n"&RC[-2]) -> |n|cFFFFFF55附加属性|r(%)|n暴击概率:10|n暴击伤害:20|n|n升级途径:|cFF1BE6B8使用 |cFF99FF66精炼晶石|r 升级|r
A86: 1 | C86: E | D86: [D级宝珠] | E86: 时空石 | I86: 10000 | J86: 10000 | K86: 10000 | AE86: 10 | AG86: ="|n"&VLOOKUP(RC[-30],Sheet2!R1C1:R7C10,10,0)&"|n需要轮回1才可熔炼|n[提示]:难度1只可以熔炼2个宝珠,每提升难度1可以多熔炼一个!" -> |n升级途径:|cFF1BE6B8使用 |CFFB6D7A8石化水晶|r 升级|r|n需要轮回1才可熔炼|n[提示]:难度1只可以熔炼2个宝珠,每提升难度1可以多熔炼一个! | AH86: =VLOOKUP(RC[-31],Sheet2!R1C1:R7C2,2,0)&RC[-30]&RC[-29]&RC[-28]&Sheet2!R1C3&"" -> |CFFFFFFFF[D级宝珠]时空石|r | AI86: =IF(RC[-27]&RC[-26]&RC[-25]&RC[-24]&RC[-23]&RC[-22]="",,R1C7)&IF(RC[-27]="",,"|n"&R1C8&RC[-27])&IF(RC[-26]="",,"|n"&R1C9&RC[-26])&IF(RC[-25]="",,"|n"&R1C10&RC[-25])&IF(RC[-24]="",,"|n"&R1C11&RC[-24])&IF(RC[-23]="",,"|n"&R1C12&RC[-23])&IF(RC[-22]="",,"|n"&R1C13&RC[-22])&IF(RC[-20]&RC[-19]&RC[-18]&RC[-17]&RC[-16]&RC[-15]&RC[-14]&RC[-13]&RC[-12]&RC[-11]&RC[-10]&RC[-9]&RC[-8]="",,"|n"&R1C14)&IF(RC[-20]="",,"|n"&R1C15&RC[-20])&IF(RC[-19]="",,"|n"&R1C16&RC[-19])&IF(RC[-18]="",,"|n"&R1C17&RC[-18])&IF(RC[-17]="",,"|n"&R1C18&RC[-17])&IF(RC[-16]="",,"|n"&R1C19&RC[-16])&IF(RC[-15]="",,"|n"&R1C20&RC[-15])&IF(RC[-14]="",,"|n"&R1C21&RC[-14])&IF(RC[-13]="",,"|n"&R1C22&RC[-13])&IF(RC[-12]="",,"|n"&R1C23&RC[-12])&IF(RC[-11]="",,"|n"&R1C24&RC[-11])&IF(RC[-10]="",,"|n"&R1C25&RC[-10])&IF(RC[-9]="",,"|n"&R1C26&RC[-9])&IF(RC[-8]="",,"|n"&R1C27&RC[-8])&IF(RC[-6]&RC[-5]&RC[-4]="",,"|n"&R1C28)&IF(RC[-6]="",,"|n"&R1C29&RC[-6])&IF(RC[-5]="",,"|n"&R1C30&RC[-5])&IF(RC[-4]="",,"|n"&R1C31&RC[-4])&IF(RC[-2]="",,"|n"&RC[-2]) -> |cFFFFFF99基础属性|r|n力量:10000|n敏捷:10000|n智力:10000|n|cFFFFFF11成长属性|r|n每秒属性:10|n|n升级途径:|cFF1BE6B8使用 |CFFB6D7A8石化水晶|r 升级|r|n需要轮回1才可熔炼|n[提示]:难度1只可以熔炼2个宝珠,每提升难度1可以多熔炼一个!
A87: 1 | C87: E | D87: [D级宝珠] | E87: 生命石 | L87: 180000 | AD87: 2 | AG87: ="|n"&VLOOKUP(RC[-30],Sheet2!R1C1:R7C10,10,0)&"|n需要轮回1才可熔炼|n[提示]:难度1只可以熔炼2个宝珠,每提升难度1可以多熔炼一个!" -> |n升级途径:|cFF1BE6B8使用 |CFFB6D7A8石化水晶|r 升级|r|n需要轮回1才可熔炼|n[提示]:难度1只可以熔炼2个宝珠,每提升难度1可以多熔炼一个! | AH87: =VLOOKUP(RC[-31],Sheet2!R1C1:R7C2,2,0)&RC[-30]&RC[-29]&RC[-28]&Sheet2!R1C3&"" -> |CFFFFFFFF[D级宝珠]生命石|r | AI87: =IF(RC[-27]&RC[-26]&RC[-25]&RC[-24]&RC[-23]&RC[-22]="",,R1C7)&IF(RC[-27]="",,"|n"&R1C8&RC[-27])&IF(RC[-26]="",,"|n"&R1C9&RC[-26])&IF(RC[-25]="",,"|n"&R1C10&RC[-25])&IF(RC[-24]="",,"|n"&R1C11&RC[-24])&IF(RC[-23]="",,"|n"&R1C12&RC[-23])&IF(RC[-22]="",,"|n"&R1C13&RC[-22])&IF(RC[-20]&RC[-19]&RC[-18]&RC[-17]&RC[-16]&RC[-15]&RC[-14]&RC[-13]&RC[-12]&RC[-11]&RC[-10]&RC[-9]&RC[-8]="",,"|n"&R1C14)&IF(RC[-20]="",,"|n"&R1C15&RC[-20])&IF(RC[-19]="",,"|n"&R1C16&RC[-19])&IF(RC[-18]="",,"|n"&R1C17&RC[-18])&IF(RC[-17]="",,"|n"&R1C18&RC[-17])&IF(RC[-16]="",,"|n"&R1C19&RC[-16])&IF(RC[-15]="",,"|n"&R1C20&RC[-15])&IF(RC[-14]="",,"|n"&R1C21&RC[-14])&IF(RC[-13]="",,"|n"&R1C22&RC[-13])&IF(RC[-12]="",,"|n"&R1C23&RC[-12])&IF(RC[-11]="",,"|n"&R1C24&RC[-11])&IF(RC[-10]="",,"|n"&R1C25&RC[-10])&IF(RC[-9]="",,"|n"&R1C26&RC[-9])&IF(RC[-8]="",,"|n"&R1C27&RC[-8])&IF(RC[-6]&RC[-5]&RC[-4]="",,"|n"&R1C28)&IF(RC[-6]="",,"|n"&R1C29&RC[-6])&IF(RC[-5]="",,"|n"&R1C30&RC[-5])&IF(RC[-4]="",,"|n"&R1C31&RC[-4])&IF(RC[-2]="",,"|n"&RC[-2]) -> |cFFFFFF99基础属性|r|n血量:180000|n|cFFFFFF11成长属性|r|n杀敌属性:2|n|n升级途径:|cFF1BE6B8使用 |CFFB6D7A8石化水晶|r 升级|r|n需要轮回1才可熔炼|n[提示]:难度1只可以熔炼2个宝珠,每提升难度1可以多熔炼一个!
A88: 1 | C88: E | D88: [D级宝珠] | E88: 魔法石 | I88: 10000 | J88: 10000 | K88: 10000 | AC88: 100 | AG88: ="|n"&VLOOKUP(RC[-30],Sheet2!R1C1:R7C10,10,0)&"|n需要轮回1才可熔炼|n[提示]:难度1只可以熔炼2个宝珠,每提升难度1可以多熔炼一个!" -> |n升级途径:|cFF1BE6B8使用 |CFFB6D7A8石化水晶|r 升级|r|n需要轮回1才可熔炼|n[提示]:难度1只可以熔炼2个宝珠,每提升难度1可以多熔炼一个! | AH88: =VLOOKUP(RC[-31],Sheet2!R1C1:R7C2,2,0)&RC[-30]&RC[-29]&RC[-28]&Sheet2!R1C3&"" -> |CFFFFFFFF[D级宝珠]魔法石|r | AI88: =IF(RC[-27]&RC[-26]&RC[-25]&RC[-24]&RC[-23]&RC[-22]="",,R1C7)&IF(RC[-27]="",,"|n"&R1C8&RC[-27])&IF(RC[-26]="",,"|n"&R1C9&RC[-26])&IF(RC[-25]="",,"|n"&R1C10&RC[-25])&IF(RC[-24]="",,"|n"&R1C11&RC[-24])&IF(RC[-23]="",,"|n"&R1C12&RC[-23])&IF(RC[-22]="",,"|n"&R1C13&RC[-22])&IF(RC[-20]&RC[-19]&RC[-18]&RC[-17]&RC[-16]&RC[-15]&RC[-14]&RC[-13]&RC[-12]&RC[-11]&RC[-10]&RC[-9]&RC[-8]="",,"|n"&R1C14)&IF(RC[-20]="",,"|n"&R1C15&RC[-20])&IF(RC[-19]="",,"|n"&R1C16&RC[-19])&IF(RC[-18]="",,"|n"&R1C17&RC[-18])&IF(RC[-17]="",,"|n"&R1C18&RC[-17])&IF(RC[-16]="",,"|n"&R1C19&RC[-16])&IF(RC[-15]="",,"|n"&R1C20&RC[-15])&IF(RC[-14]="",,"|n"&R1C21&RC[-14])&IF(RC[-13]="",,"|n"&R1C22&RC[-13])&IF(RC[-12]="",,"|n"&R1C23&RC[-12])&IF(RC[-11]="",,"|n"&R1C24&RC[-11])&IF(RC[-10]="",,"|n"&R1C25&RC[-10])&IF(RC[-9]="",,"|n"&R1C26&RC[-9])&IF(RC[-8]="",,"|n"&R1C27&RC[-8])&IF(RC[-6]&RC[-5]&RC[-4]="",,"|n"&R1C28)&IF(RC[-6]="",,"|n"&R1C29&RC[-6])&IF(RC[-5]="",,"|n"&R1C30&RC[-5])&IF(RC[-4]="",,"|n"&R1C31&RC[-4])&IF(RC[-2]="",,"|n"&RC[-2]) -> |cFFFFFF99基础属性|r|n力量:10000|n敏捷:10000|n智力:10000|n|cFFFFFF11成长属性|r|n升级属性:100|n|n升级途径:|cFF1BE6B8使用 |CFFB6D7A8石化水晶|r 升级|r|n需要轮回1才可熔炼|n[提示]:难度1只可以熔炼2个宝珠,每提升难度1可以多熔炼一个!
A89: 1 | C89: E | D89: [D级宝珠] | E89: 梦境石 | W89: 5 | AG89: ="|n"&VLOOKUP(RC[-30],Sheet2!R1C1:R7C10,10,0)&"|n需要轮回1才可熔炼|n[提示]:难度1只可以熔炼2个宝珠,每提升难度1可以多熔炼一个!" -> |n升级途径:|cFF1BE6B8使用 |CFFB6D7A8石化水晶|r 升级|r|n需要轮回1才可熔炼|n[提示]:难度1只可以熔炼2个宝珠,每提升难度1可以多熔炼一个! | AH89: =VLOOKUP(RC[-31],Sheet2!R1C1:R7C2,2,0)&RC[-30]&RC[-29]&RC[-28]&Sheet2!R1C3&"" -> |CFFFFFFFF[D级宝珠]梦境石|r | AI89: =IF(RC[-27]&RC[-26]&RC[-25]&RC[-24]&RC[-23]&RC[-22]="",,R1C7)&IF(RC[-27]="",,"|n"&R1C8&RC[-27])&IF(RC[-26]="",,"|n"&R1C9&RC[-26])&IF(RC[-25]="",,"|n"&R1C10&RC[-25])&IF(RC[-24]="",,"|n"&R1C11&RC[-24])&IF(RC[-23]="",,"|n"&R1C12&RC[-23])&IF(RC[-22]="",,"|n"&R1C13&RC[-22])&IF(RC[-20]&RC[-19]&RC[-18]&RC[-17]&RC[-16]&RC[-15]&RC[-14]&RC[-13]&RC[-12]&RC[-11]&RC[-10]&RC[-9]&RC[-8]="",,"|n"&R1C14)&IF(RC[-20]="",,"|n"&R1C15&RC[-20])&IF(RC[-19]="",,"|n"&R1C16&RC[-19])&IF(RC[-18]="",,"|n"&R1C17&RC[-18])&IF(RC[-17]="",,"|n"&R1C18&RC[-17])&IF(RC[-16]="",,"|n"&R1C19&RC[-16])&IF(RC[-15]="",,"|n"&R1C20&RC[-15])&IF(RC[-14]="",,"|n"&R1C21&RC[-14])&IF(RC[-13]="",,"|n"&R1C22&RC[-13])&IF(RC[-12]="",,"|n"&R1C23&RC[-12])&IF(RC[-11]="",,"|n"&R1C24&RC[-11])&IF(RC[-10]="",,"|n"&R1C25&RC[-10])&IF(RC[-9]="",,"|n"&R1C26&RC[-9])&IF(RC[-8]="",,"|n"&R1C27&RC[-8])&IF(RC[-6]&RC[-5]&RC[-4]="",,"|n"&R1C28)&IF(RC[-6]="",,"|n"&R1C29&RC[-6])&IF(RC[-5]="",,"|n"&R1C30&RC[-5])&IF(RC[-4]="",,"|n"&R1C31&RC[-4])&IF(RC[-2]="",,"|n"&RC[-2]) -> |n|cFFFFFF55附加属性|r(%)|n伤害减免:5|n|n升级途径:|cFF1BE6B8使用 |CFFB6D7A8石化水晶|r 升级|r|n需要轮回1才可熔炼|n[提示]:难度1只可以熔炼2个宝珠,每提升难度1可以多熔炼一个!
A90: 1 | C90: E | D90: [D级宝珠] | E90: 大地石 | M90: 1000 | T90: 10 | AG90: ="|n"&VLOOKUP(RC[-30],Sheet2!R1C1:R7C10,10,0)&"|n需要轮回1才可熔炼|n[提示]:难度1只可以熔炼2个宝珠,每提升难度1可以多熔炼一个!" -> |n升级途径:|cFF1BE6B8使用 |CFFB6D7A8石化水晶|r 升级|r|n需要轮回1才可熔炼|n[提示]:难度1只可以熔炼2个宝珠,每提升难度1可以多熔炼一个! | AH90: =VLOOKUP(RC[-31],Sheet2!R1C1:R7C2,2,0)&RC[-30]&RC[-29]&RC[-28]&Sheet2!R1C3&"" -> |CFFFFFFFF[D级宝珠]大地石|r | AI90: =IF(RC[-27]&RC[-26]&RC[-25]&RC[-24]&RC[-23]&RC[-22]="",,R1C7)&IF(RC[-27]="",,"|n"&R1C8&RC[-27])&IF(RC[-26]="",,"|n"&R1C9&RC[-26])&IF(RC[-25]="",,"|n"&R1C10&RC[-25])&IF(RC[-24]="",,"|n"&R1C11&RC[-24])&IF(RC[-23]="",,"|n"&R1C12&RC[-23])&IF(RC[-22]="",,"|n"&R1C13&RC[-22])&IF(RC[-20]&RC[-19]&RC[-18]&RC[-17]&RC[-16]&RC[-15]&RC[-14]&RC[-13]&RC[-12]&RC[-11]&RC[-10]&RC[-9]&RC[-8]="",,"|n"&R1C14)&IF(RC[-20]="",,"|n"&R1C15&RC[-20])&IF(RC[-19]="",,"|n"&R1C16&RC[-19])&IF(RC[-18]="",,"|n"&R1C17&RC[-18])&IF(RC[-17]="",,"|n"&R1C18&RC[-17])&IF(RC[-16]="",,"|n"&R1C19&RC[-16])&IF(RC[-15]="",,"|n"&R1C20&RC[-15])&IF(RC[-14]="",,"|n"&R1C21&RC[-14])&IF(RC[-13]="",,"|n"&R1C22&RC[-13])&IF(RC[-12]="",,"|n"&R1C23&RC[-12])&IF(RC[-11]="",,"|n"&R1C24&RC[-11])&IF(RC[-10]="",,"|n"&R1C25&RC[-10])&IF(RC[-9]="",,"|n"&R1C26&RC[-9])&IF(RC[-8]="",,"|n"&R1C27&RC[-8])&IF(RC[-6]&RC[-5]&RC[-4]="",,"|n"&R1C28)&IF(RC[-6]="",,"|n"&R1C29&RC[-6])&IF(RC[-5]="",,"|n"&R1C30&RC[-5])&IF(RC[-4]="",,"|n"&R1C31&RC[-4])&IF(RC[-2]="",,"|n"&RC[-2]) -> |cFFFFFF99基础属性|r|n护甲:1000|n|cFFFFFF55附加属性|r(%)|n附加伤害:10|n|n升级途径:|cFF1BE6B8使用 |CFFB6D7A8石化水晶|r 升级|r|n需要轮回1才可熔炼|n[提示]:难度1只可以熔炼2个宝珠,每提升难度1可以多熔炼一个!
A91: 1 | C91: E | D91: [D级宝珠] | E91: 泰坦石 | H91: 50000 | O91: 20 | AG91: ="|n"&VLOOKUP(RC[-30],Sheet2!R1C1:R7C10,10,0)&"|n需要轮回1才可熔炼|n[提示]:难度1只可以熔炼2个宝珠,每提升难度1可以多熔炼一个!" -> |n升级途径:|cFF1BE6B8使用 |CFFB6D7A8石化水晶|r 升级|r|n需要轮回1才可熔炼|n[提示]:难度1只可以熔炼2个宝珠,每提升难度1可以多熔炼一个! | AH91: =VLOOKUP(RC[-31],Sheet2!R1C1:R7C2,2,0)&RC[-30]&RC[-29]&RC[-28]&Sheet2!R1C3&"" -> |CFFFFFFFF[D级宝珠]泰坦石|r | AI91: =IF(RC[-27]&RC[-26]&RC[-25]&RC[-24]&RC[-23]&RC[-22]="",,R1C7)&IF(RC[-27]="",,"|n"&R1C8&RC[-27])&IF(RC[-26]="",,"|n"&R1C9&RC[-26])&IF(RC[-25]="",,"|n"&R1C10&RC[-25])&IF(RC[-24]="",,"|n"&R1C11&RC[-24])&IF(RC[-23]="",,"|n"&R1C12&RC[-23])&IF(RC[-22]="",,"|n"&R1C13&RC[-22])&IF(RC[-20]&RC[-19]&RC[-18]&RC[-17]&RC[-16]&RC[-15]&RC[-14]&RC[-13]&RC[-12]&RC[-11]&RC[-10]&RC[-9]&RC[-8]="",,"|n"&R1C14)&IF(RC[-20]="",,"|n"&R1C15&RC[-20])&IF(RC[-19]="",,"|n"&R1C16&RC[-19])&IF(RC[-18]="",,"|n"&R1C17&RC[-18])&IF(RC[-17]="",,"|n"&R1C18&RC[-17])&IF(RC[-16]="",,"|n"&R1C19&RC[-16])&IF(RC[-15]="",,"|n"&R1C20&RC[-15])&IF(RC[-14]="",,"|n"&R1C21&RC[-14])&IF(RC[-13]="",,"|n"&R1C22&RC[-13])&IF(RC[-12]="",,"|n"&R1C23&RC[-12])&IF(RC[-11]="",,"|n"&R1C24&RC[-11])&IF(RC[-10]="",,"|n"&R1C25&RC[-10])&IF(RC[-9]="",,"|n"&R1C26&RC[-9])&IF(RC[-8]="",,"|n"&R1C27&RC[-8])&IF(RC[-6]&RC[-5]&RC[-4]="",,"|n"&R1C28)&IF(RC[-6]="",,"|n"&R1C29&RC[-6])&IF(RC[-5]="",,"|n"&R1C30&RC[-5])&IF(RC[-4]="",,"|n"&R1C31&RC[-4])&IF(RC[-2]="",,"|n"&RC[-2]) -> |cFFFFFF99基础属性|r|n攻击:50000|n|cFFFFFF55附加属性|r(%)|n攻速:20|n|n升级途径:|cFF1BE6B8使用 |CFFB6D7A8石化水晶|r 升级|r|n需要轮回1才可熔炼|n[提示]:难度1只可以熔炼2个宝珠,每提升难度1可以多熔炼一个!
A92: 1 | C92: E | D92: [D级宝珠] | E92: 枢纽石 | P92: 5 | AG92: ="|n"&VLOOKUP(RC[-30],Sheet2!R1C1:R7C10,10,0)&"|n需要轮回1才可熔炼|n[提示]:难度1只可以熔炼2个宝珠,每提升难度1可以多熔炼一个!" -> |n升级途径:|cFF1BE6B8使用 |CFFB6D7A8石化水晶|r 升级|r|n需要轮回1才可熔炼|n[提示]:难度1只可以熔炼2个宝珠,每提升难度1可以多熔炼一个! | AH92: =VLOOKUP(RC[-31],Sheet2!R1C1:R7C2,2,0)&RC[-30]&RC[-29]&RC[-28]&Sheet2!R1C3&"" -> |CFFFFFFFF[D级宝珠]枢纽石|r | AI92: =IF(RC[-27]&RC[-26]&RC[-25]&RC[-24]&RC[-23]&RC[-22]="",,R1C7)&IF(RC[-27]="",,"|n"&R1C8&RC[-27])&IF(RC[-26]="",,"|n"&R1C9&RC[-26])&IF(RC[-25]="",,"|n"&R1C10&RC[-25])&IF(RC[-24]="",,"|n"&R1C11&RC[-24])&IF(RC[-23]="",,"|n"&R1C12&RC[-23])&IF(RC[-22]="",,"|n"&R1C13&RC[-22])&IF(RC[-20]&RC[-19]&RC[-18]&RC[-17]&RC[-16]&RC[-15]&RC[-14]&RC[-13]&RC[-12]&RC[-11]&RC[-10]&RC[-9]&RC[-8]="",,"|n"&R1C14)&IF(RC[-20]="",,"|n"&R1C15&RC[-20])&IF(RC[-19]="",,"|n"&R1C16&RC[-19])&IF(RC[-18]="",,"|n"&R1C17&RC[-18])&IF(RC[-17]="",,"|n"&R1C18&RC[-17])&IF(RC[-16]="",,"|n"&R1C19&RC[-16])&IF(RC[-15]="",,"|n"&R1C20&RC[-15])&IF(RC[-14]="",,"|n"&R1C21&RC[-14])&IF(RC[-13]="",,"|n"&R1C22&RC[-13])&IF(RC[-12]="",,"|n"&R1C23&RC[-12])&IF(RC[-11]="",,"|n"&R1C24&RC[-11])&IF(RC[-10]="",,"|n"&R1C25&RC[-10])&IF(RC[-9]="",,"|n"&R1C26&RC[-9])&IF(RC[-8]="",,"|n"&R1C27&RC[-8])&IF(RC[-6]&RC[-5]&RC[-4]="",,"|n"&R1C28)&IF(RC[-6]="",,"|n"&R1C29&RC[-6])&IF(RC[-5]="",,"|n"&R1C30&RC[-5])&IF(RC[-4]="",,"|n"&R1C31&RC[-4])&IF(RC[-2]="",,"|n"&RC[-2]) -> |n|cFFFFFF55附加属性|r(%)|n攻击吸血:5|n|n升级途径:|cFF1BE6B8使用 |CFFB6D7A8石化水晶|r 升级|r|n需要轮回1才可熔炼|n[提示]:难度1只可以熔炼2个宝珠,每提升难度1可以多熔炼一个!
A93: 1 | C93: E | D93: [D级宝珠] | E93: 灵魂石 | Q93: 10 | R93: 10 | AG93: ="|n"&VLOOKUP(RC[-30],Sheet2!R1C1:R7C10,10,0)&"|n需要轮回1才可熔炼|n[提示]:难度1只可以熔炼2个宝珠,每提升难度1可以多熔炼一个!" -> |n升级途径:|cFF1BE6B8使用 |CFFB6D7A8石化水晶|r 升级|r|n需要轮回1才可熔炼|n[提示]:难度1只可以熔炼2个宝珠,每提升难度1可以多熔炼一个! | AH93: =VLOOKUP(RC[-31],Sheet2!R1C1:R7C2,2,0)&RC[-30]&RC[-29]&RC[-28]&Sheet2!R1C3&"" -> |CFFFFFFFF[D级宝珠]灵魂石|r | AI93: =IF(RC[-27]&RC[-26]&RC[-25]&RC[-24]&RC[-23]&RC[-22]="",,R1C7)&IF(RC[-27]="",,"|n"&R1C8&RC[-27])&IF(RC[-26]="",,"|n"&R1C9&RC[-26])&IF(RC[-25]="",,"|n"&R1C10&RC[-25])&IF(RC[-24]="",,"|n"&R1C11&RC[-24])&IF(RC[-23]="",,"|n"&R1C12&RC[-23])&IF(RC[-22]="",,"|n"&R1C13&RC[-22])&IF(RC[-20]&RC[-19]&RC[-18]&RC[-17]&RC[-16]&RC[-15]&RC[-14]&RC[-13]&RC[-12]&RC[-11]&RC[-10]&RC[-9]&RC[-8]="",,"|n"&R1C14)&IF(RC[-20]="",,"|n"&R1C15&RC[-20])&IF(RC[-19]="",,"|n"&R1C16&RC[-19])&IF(RC[-18]="",,"|n"&R1C17&RC[-18])&IF(RC[-17]="",,"|n"&R1C18&RC[-17])&IF(RC[-16]="",,"|n"&R1C19&RC[-16])&IF(RC[-15]="",,"|n"&R1C20&RC[-15])&IF(RC[-14]="",,"|n"&R1C21&RC[-14])&IF(RC[-13]="",,"|n"&R1C22&RC[-13])&IF(RC[-12]="",,"|n"&R1C23&RC[-12])&IF(RC[-11]="",,"|n"&R1C24&RC[-11])&IF(RC[-10]="",,"|n"&R1C25&RC[-10])&IF(RC[-9]="",,"|n"&R1C26&RC[-9])&IF(RC[-8]="",,"|n"&R1C27&RC[-8])&IF(RC[-6]&RC[-5]&RC[-4]="",,"|n"&R1C28)&IF(RC[-6]="",,"|n"&R1C29&RC[-6])&IF(RC[-5]="",,"|n"&R1C30&RC[-5])&IF(RC[-4]="",,"|n"&R1C31&RC[-4])&IF(RC[-2]="",,"|n"&RC[-2]) -> |n|cFFFFFF55附加属性|r(%)|n暴击概率:10|n暴击伤害:10|n|n升级途径:|cFF1BE6B8使用 |CFFB6D7A8石化水晶|r 升级|r|n需要轮回1才可熔炼|n[提示]:难度1只可以熔炼2个宝珠,每提升难度1可以多熔炼一个!
C94: E | D94: [雪山] | E94: 雪花 | T94: 10 | AG94: 雪花+冰块 = 雪山结晶 | AH94: =VLOOKUP(RC[-31],Sheet2!R1C1:R7C2,2,0)&RC[-30]&RC[-29]&RC[-28]&Sheet2!R1C3&"" -> |CFFFFFFFF[雪山]雪花|r | AI94: =IF(RC[-27]&RC[-26]&RC[-25]&RC[-24]&RC[-23]&RC[-22]="",,R1C7)&IF(RC[-27]="",,"|n"&R1C8&RC[-27])&IF(RC[-26]="",,"|n"&R1C9&RC[-26])&IF(RC[-25]="",,"|n"&R1C10&RC[-25])&IF(RC[-24]="",,"|n"&R1C11&RC[-24])&IF(RC[-23]="",,"|n"&R1C12&RC[-23])&IF(RC[-22]="",,"|n"&R1C13&RC[-22])&IF(RC[-20]&RC[-19]&RC[-18]&RC[-17]&RC[-16]&RC[-15]&RC[-14]&RC[-13]&RC[-12]&RC[-11]&RC[-10]&RC[-9]&RC[-8]="",,"|n"&R1C14)&IF(RC[-20]="",,"|n"&R1C15&RC[-20])&IF(RC[-19]="",,"|n"&R1C16&RC[-19])&IF(RC[-18]="",,"|n"&R1C17&RC[-18])&IF(RC[-17]="",,"|n"&R1C18&RC[-17])&IF(RC[-16]="",,"|n"&R1C19&RC[-16])&IF(RC[-15]="",,"|n"&R1C20&RC[-15])&IF(RC[-14]="",,"|n"&R1C21&RC[-14])&IF(RC[-13]="",,"|n"&R1C22&RC[-13])&IF(RC[-12]="",,"|n"&R1C23&RC[-12])&IF(RC[-11]="",,"|n"&R1C24&RC[-11])&IF(RC[-10]="",,"|n"&R1C25&RC[-10])&IF(RC[-9]="",,"|n"&R1C26&RC[-9])&IF(RC[-8]="",,"|n"&R1C27&RC[-8])&IF(RC[-6]&RC[-5]&RC[-4]="",,"|n"&R1C28)&IF(RC[-6]="",,"|n"&R1C29&RC[-6])&IF(RC[-5]="",,"|n"&R1C30&RC[-5])&IF(RC[-4]="",,"|n"&R1C31&RC[-4])&IF(RC[-2]="",,"|n"&RC[-2]) -> |n|cFFFFFF55附加属性|r(%)|n附加伤害:10|n雪花+冰块 = 雪山结晶
C95: E | D95: [雪山] | E95: 冰块 | T95: 10 | AG95: 雪花+冰块 = 雪山结晶 | AH95: =VLOOKUP(RC[-31],Sheet2!R1C1:R7C2,2,0)&RC[-30]&RC[-29]&RC[-28]&Sheet2!R1C3&"" -> |CFFFFFFFF[雪山]冰块|r | AI95: =IF(RC[-27]&RC[-26]&RC[-25]&RC[-24]&RC[-23]&RC[-22]="",,R1C7)&IF(RC[-27]="",,"|n"&R1C8&RC[-27])&IF(RC[-26]="",,"|n"&R1C9&RC[-26])&IF(RC[-25]="",,"|n"&R1C10&RC[-25])&IF(RC[-24]="",,"|n"&R1C11&RC[-24])&IF(RC[-23]="",,"|n"&R1C12&RC[-23])&IF(RC[-22]="",,"|n"&R1C13&RC[-22])&IF(RC[-20]&RC[-19]&RC[-18]&RC[-17]&RC[-16]&RC[-15]&RC[-14]&RC[-13]&RC[-12]&RC[-11]&RC[-10]&RC[-9]&RC[-8]="",,"|n"&R1C14)&IF(RC[-20]="",,"|n"&R1C15&RC[-20])&IF(RC[-19]="",,"|n"&R1C16&RC[-19])&IF(RC[-18]="",,"|n"&R1C17&RC[-18])&IF(RC[-17]="",,"|n"&R1C18&RC[-17])&IF(RC[-16]="",,"|n"&R1C19&RC[-16])&IF(RC[-15]="",,"|n"&R1C20&RC[-15])&IF(RC[-14]="",,"|n"&R1C21&RC[-14])&IF(RC[-13]="",,"|n"&R1C22&RC[-13])&IF(RC[-12]="",,"|n"&R1C23&RC[-12])&IF(RC[-11]="",,"|n"&R1C24&RC[-11])&IF(RC[-10]="",,"|n"&R1C25&RC[-10])&IF(RC[-9]="",,"|n"&R1C26&RC[-9])&IF(RC[-8]="",,"|n"&R1C27&RC[-8])&IF(RC[-6]&RC[-5]&RC[-4]="",,"|n"&R1C28)&IF(RC[-6]="",,"|n"&R1C29&RC[-6])&IF(RC[-5]="",,"|n"&R1C30&RC[-5])&IF(RC[-4]="",,"|n"&R1C31&RC[-4])&IF(RC[-2]="",,"|n"&RC[-2]) -> |n|cFFFFFF55附加属性|r(%)|n附加伤害:10|n雪花+冰块 = 雪山结晶
C96: D | D96: [雪山] | E96: 雪山结晶 | T96: 20 | AG96: 雪狐皮毛+雪熊利爪+雪鸟羽毛+雪山结晶 = 雪灵之心 | AH96: =VLOOKUP(RC[-31],Sheet2!R1C1:R7C2,2,0)&RC[-30]&RC[-29]&RC[-28]&Sheet2!R1C3&"" -> |CFFB6D7A8[雪山]雪山结晶|r | AI96: =IF(RC[-27]&RC[-26]&RC[-25]&RC[-24]&RC[-23]&RC[-22]="",,R1C7)&IF(RC[-27]="",,"|n"&R1C8&RC[-27])&IF(RC[-26]="",,"|n"&R1C9&RC[-26])&IF(RC[-25]="",,"|n"&R1C10&RC[-25])&IF(RC[-24]="",,"|n"&R1C11&RC[-24])&IF(RC[-23]="",,"|n"&R1C12&RC[-23])&IF(RC[-22]="",,"|n"&R1C13&RC[-22])&IF(RC[-20]&RC[-19]&RC[-18]&RC[-17]&RC[-16]&RC[-15]&RC[-14]&RC[-13]&RC[-12]&RC[-11]&RC[-10]&RC[-9]&RC[-8]="",,"|n"&R1C14)&IF(RC[-20]="",,"|n"&R1C15&RC[-20])&IF(RC[-19]="",,"|n"&R1C16&RC[-19])&IF(RC[-18]="",,"|n"&R1C17&RC[-18])&IF(RC[-17]="",,"|n"&R1C18&RC[-17])&IF(RC[-16]="",,"|n"&R1C19&RC[-16])&IF(RC[-15]="",,"|n"&R1C20&RC[-15])&IF(RC[-14]="",,"|n"&R1C21&RC[-14])&IF(RC[-13]="",,"|n"&R1C22&RC[-13])&IF(RC[-12]="",,"|n"&R1C23&RC[-12])&IF(RC[-11]="",,"|n"&R1C24&RC[-11])&IF(RC[-10]="",,"|n"&R1C25&RC[-10])&IF(RC[-9]="",,"|n"&R1C26&RC[-9])&IF(RC[-8]="",,"|n"&R1C27&RC[-8])&IF(RC[-6]&RC[-5]&RC[-4]="",,"|n"&R1C28)&IF(RC[-6]="",,"|n"&R1C29&RC[-6])&IF(RC[-5]="",,"|n"&R1C30&RC[-5])&IF(RC[-4]="",,"|n"&R1C31&RC[-4])&IF(RC[-2]="",,"|n"&RC[-2]) -> |n|cFFFFFF55附加属性|r(%)|n附加伤害:20|n雪狐皮毛+雪熊利爪+雪鸟羽毛+雪山结晶 = 雪灵之心
C97: D | D97: [雪山] | E97: 雪山-雪狐皮毛 | T97: 15 | AG97: 雪狐皮毛+雪熊利爪+雪鸟羽毛+雪山结晶 = 雪灵之心 | AH97: =VLOOKUP(RC[-31],Sheet2!R1C1:R7C2,2,0)&RC[-30]&RC[-29]&RC[-28]&Sheet2!R1C3&"" -> |CFFB6D7A8[雪山]雪山-雪狐皮毛|r | AI97: =IF(RC[-27]&RC[-26]&RC[-25]&RC[-24]&RC[-23]&RC[-22]="",,R1C7)&IF(RC[-27]="",,"|n"&R1C8&RC[-27])&IF(RC[-26]="",,"|n"&R1C9&RC[-26])&IF(RC[-25]="",,"|n"&R1C10&RC[-25])&IF(RC[-24]="",,"|n"&R1C11&RC[-24])&IF(RC[-23]="",,"|n"&R1C12&RC[-23])&IF(RC[-22]="",,"|n"&R1C13&RC[-22])&IF(RC[-20]&RC[-19]&RC[-18]&RC[-17]&RC[-16]&RC[-15]&RC[-14]&RC[-13]&RC[-12]&RC[-11]&RC[-10]&RC[-9]&RC[-8]="",,"|n"&R1C14)&IF(RC[-20]="",,"|n"&R1C15&RC[-20])&IF(RC[-19]="",,"|n"&R1C16&RC[-19])&IF(RC[-18]="",,"|n"&R1C17&RC[-18])&IF(RC[-17]="",,"|n"&R1C18&RC[-17])&IF(RC[-16]="",,"|n"&R1C19&RC[-16])&IF(RC[-15]="",,"|n"&R1C20&RC[-15])&IF(RC[-14]="",,"|n"&R1C21&RC[-14])&IF(RC[-13]="",,"|n"&R1C22&RC[-13])&IF(RC[-12]="",,"|n"&R1C23&RC[-12])&IF(RC[-11]="",,"|n"&R1C24&RC[-11])&IF(RC[-10]="",,"|n"&R1C25&RC[-10])&IF(RC[-9]="",,"|n"&R1C26&RC[-9])&IF(RC[-8]="",,"|n"&R1C27&RC[-8])&IF(RC[-6]&RC[-5]&RC[-4]="",,"|n"&R1C28)&IF(RC[-6]="",,"|n"&R1C29&RC[-6])&IF(RC[-5]="",,"|n"&R1C30&RC[-5])&IF(RC[-4]="",,"|n"&R1C31&RC[-4])&IF(RC[-2]="",,"|n"&RC[-2]) -> |n|cFFFFFF55附加属性|r(%)|n附加伤害:15|n雪狐皮毛+雪熊利爪+雪鸟羽毛+雪山结晶 = 雪灵之心
C98: D | D98: [雪山] | E98: 雪山-雪熊利爪 | T98: 15 | AG98: 雪狐皮毛+雪熊利爪+雪鸟羽毛+雪山结晶 = 雪灵之心 | AH98: =VLOOKUP(RC[-31],Sheet2!R1C1:R7C2,2,0)&RC[-30]&RC[-29]&RC[-28]&Sheet2!R1C3&"" -> |CFFB6D7A8[雪山]雪山-雪熊利爪|r | AI98: =IF(RC[-27]&RC[-26]&RC[-25]&RC[-24]&RC[-23]&RC[-22]="",,R1C7)&IF(RC[-27]="",,"|n"&R1C8&RC[-27])&IF(RC[-26]="",,"|n"&R1C9&RC[-26])&IF(RC[-25]="",,"|n"&R1C10&RC[-25])&IF(RC[-24]="",,"|n"&R1C11&RC[-24])&IF(RC[-23]="",,"|n"&R1C12&RC[-23])&IF(RC[-22]="",,"|n"&R1C13&RC[-22])&IF(RC[-20]&RC[-19]&RC[-18]&RC[-17]&RC[-16]&RC[-15]&RC[-14]&RC[-13]&RC[-12]&RC[-11]&RC[-10]&RC[-9]&RC[-8]="",,"|n"&R1C14)&IF(RC[-20]="",,"|n"&R1C15&RC[-20])&IF(RC[-19]="",,"|n"&R1C16&RC[-19])&IF(RC[-18]="",,"|n"&R1C17&RC[-18])&IF(RC[-17]="",,"|n"&R1C18&RC[-17])&IF(RC[-16]="",,"|n"&R1C19&RC[-16])&IF(RC[-15]="",,"|n"&R1C20&RC[-15])&IF(RC[-14]="",,"|n"&R1C21&RC[-14])&IF(RC[-13]="",,"|n"&R1C22&RC[-13])&IF(RC[-12]="",,"|n"&R1C23&RC[-12])&IF(RC[-11]="",,"|n"&R1C24&RC[-11])&IF(RC[-10]="",,"|n"&R1C25&RC[-10])&IF(RC[-9]="",,"|n"&R1C26&RC[-9])&IF(RC[-8]="",,"|n"&R1C27&RC[-8])&IF(RC[-6]&RC[-5]&RC[-4]="",,"|n"&R1C28)&IF(RC[-6]="",,"|n"&R1C29&RC[-6])&IF(RC[-5]="",,"|n"&R1C30&RC[-5])&IF(RC[-4]="",,"|n"&R1C31&RC[-4])&IF(RC[-2]="",,"|n"&RC[-2]) -> |n|cFFFFFF55附加属性|r(%)|n附加伤害:15|n雪狐皮毛+雪熊利爪+雪鸟羽毛+雪山结晶 = 雪灵之心
C99: D | D99: [雪山] | E99: 雪山-雪鸟羽毛 | T99: 15 | AG99: 雪狐皮毛+雪熊利爪+雪鸟羽毛+雪山结晶 = 雪灵之心 | AH99: =VLOOKUP(RC[-31],Sheet2!R1C1:R7C2,2,0)&RC[-30]&RC[-29]&RC[-28]&Sheet2!R1C3&"" -> |CFFB6D7A8[雪山]雪山-雪鸟羽毛|r | AI99: =IF(RC[-27]&RC[-26]&RC[-25]&RC[-24]&RC[-23]&RC[-22]="",,R1C7)&IF(RC[-27]="",,"|n"&R1C8&RC[-27])&IF(RC[-26]="",,"|n"&R1C9&RC[-26])&IF(RC[-25]="",,"|n"&R1C10&RC[-25])&IF(RC[-24]="",,"|n"&R1C11&RC[-24])&IF(RC[-23]="",,"|n"&R1C12&RC[-23])&IF(RC[-22]="",,"|n"&R1C13&RC[-22])&IF(RC[-20]&RC[-19]&RC[-18]&RC[-17]&RC[-16]&RC[-15]&RC[-14]&RC[-13]&RC[-12]&RC[-11]&RC[-10]&RC[-9]&RC[-8]="",,"|n"&R1C14)&IF(RC[-20]="",,"|n"&R1C15&RC[-20])&IF(RC[-19]="",,"|n"&R1C16&RC[-19])&IF(RC[-18]="",,"|n"&R1C17&RC[-18])&IF(RC[-17]="",,"|n"&R1C18&RC[-17])&IF(RC[-16]="",,"|n"&R1C19&RC[-16])&IF(RC[-15]="",,"|n"&R1C20&RC[-15])&IF(RC[-14]="",,"|n"&R1C21&RC[-14])&IF(RC[-13]="",,"|n"&R1C22&RC[-13])&IF(RC[-12]="",,"|n"&R1C23&RC[-12])&IF(RC[-11]="",,"|n"&R1C24&RC[-11])&IF(RC[-10]="",,"|n"&R1C25&RC[-10])&IF(RC[-9]="",,"|n"&R1C26&RC[-9])&IF(RC[-8]="",,"|n"&R1C27&RC[-8])&IF(RC[-6]&RC[-5]&RC[-4]="",,"|n"&R1C28)&IF(RC[-6]="",,"|n"&R1C29&RC[-6])&IF(RC[-5]="",,"|n"&R1C30&RC[-5])&IF(RC[-4]="",,"|n"&R1C31&RC[-4])&IF(RC[-2]="",,"|n"&RC[-2]) -> |n|cFFFFFF55附加属性|r(%)|n附加伤害:15|n雪狐皮毛+雪熊利爪+雪鸟羽毛+雪山结晶 = 雪灵之心
C100: B | D100: [雪山] | E100: 雪灵之心 | T100: 60 | AG100: 雪灵之心+万年玄冰+雪山罡风+雪山古剑 = 风雪古剑 | AH100: =VLOOKUP(RC[-31],Sheet2!R1C1:R7C2,2,0)&RC[-30]&RC[-29]&RC[-28]&Sheet2!R1C3&"" -> |cFF99FF66[雪山]雪灵之心|r | AI100: =IF(RC[-27]&RC[-26]&RC[-25]&RC[-24]&RC[-23]&RC[-22]="",,R1C7)&IF(RC[-27]="",,"|n"&R1C8&RC[-27])&IF(RC[-26]="",,"|n"&R1C9&RC[-26])&IF(RC[-25]="",,"|n"&R1C10&RC[-25])&IF(RC[-24]="",,"|n"&R1C11&RC[-24])&IF(RC[-23]="",,"|n"&R1C12&RC[-23])&IF(RC[-22]="",,"|n"&R1C13&RC[-22])&IF(RC[-20]&RC[-19]&RC[-18]&RC[-17]&RC[-16]&RC[-15]&RC[-14]&RC[-13]&RC[-12]&RC[-11]&RC[-10]&RC[-9]&RC[-8]="",,"|n"&R1C14)&IF(RC[-20]="",,"|n"&R1C15&RC[-20])&IF(RC[-19]="",,"|n"&R1C16&RC[-19])&IF(RC[-18]="",,"|n"&R1C17&RC[-18])&IF(RC[-17]="",,"|n"&R1C18&RC[-17])&IF(RC[-16]="",,"|n"&R1C19&RC[-16])&IF(RC[-15]="",,"|n"&R1C20&RC[-15])&IF(RC[-14]="",,"|n"&R1C21&RC[-14])&IF(RC[-13]="",,"|n"&R1C22&RC[-13])&IF(RC[-12]="",,"|n"&R1C23&RC[-12])&IF(RC[-11]="",,"|n"&R1C24&RC[-11])&IF(RC[-10]="",,"|n"&R1C25&RC[-10])&IF(RC[-9]="",,"|n"&R1C26&RC[-9])&IF(RC[-8]="",,"|n"&R1C27&RC[-8])&IF(RC[-6]&RC[-5]&RC[-4]="",,"|n"&R1C28)&IF(RC[-6]="",,"|n"&R1C29&RC[-6])&IF(RC[-5]="",,"|n"&R1C30&RC[-5])&IF(RC[-4]="",,"|n"&R1C31&RC[-4])&IF(RC[-2]="",,"|n"&RC[-2]) -> |n|cFFFFFF55附加属性|r(%)|n附加伤害:60|n雪灵之心+万年玄冰+雪山罡风+雪山古剑 = 风雪古剑
C101: C | D101: [雪山] | E101: 万年玄冰碎片-寒 | W101: 5 | AG101: 万年玄冰碎片-寒 + 万年玄冰碎片-霜 + 万年玄冰碎片-冰 + 万年玄冰碎片-雪 + 千年玄冰 = 万年玄冰 | AH101: =VLOOKUP(RC[-31],Sheet2!R1C1:R7C2,2,0)&RC[-30]&RC[-29]&RC[-28]&Sheet2!R1C3&"" -> |cFF99FF66[雪山]万年玄冰碎片-寒|r | AI101: =IF(RC[-27]&RC[-26]&RC[-25]&RC[-24]&RC[-23]&RC[-22]="",,R1C7)&IF(RC[-27]="",,"|n"&R1C8&RC[-27])&IF(RC[-26]="",,"|n"&R1C9&RC[-26])&IF(RC[-25]="",,"|n"&R1C10&RC[-25])&IF(RC[-24]="",,"|n"&R1C11&RC[-24])&IF(RC[-23]="",,"|n"&R1C12&RC[-23])&IF(RC[-22]="",,"|n"&R1C13&RC[-22])&IF(RC[-20]&RC[-19]&RC[-18]&RC[-17]&RC[-16]&RC[-15]&RC[-14]&RC[-13]&RC[-12]&RC[-11]&RC[-10]&RC[-9]&RC[-8]="",,"|n"&R1C14)&IF(RC[-20]="",,"|n"&R1C15&RC[-20])&IF(RC[-19]="",,"|n"&R1C16&RC[-19])&IF(RC[-18]="",,"|n"&R1C17&RC[-18])&IF(RC[-17]="",,"|n"&R1C18&RC[-17])&IF(RC[-16]="",,"|n"&R1C19&RC[-16])&IF(RC[-15]="",,"|n"&R1C20&RC[-15])&IF(RC[-14]="",,"|n"&R1C21&RC[-14])&IF(RC[-13]="",,"|n"&R1C22&RC[-13])&IF(RC[-12]="",,"|n"&R1C23&RC[-12])&IF(RC[-11]="",,"|n"&R1C24&RC[-11])&IF(RC[-10]="",,"|n"&R1C25&RC[-10])&IF(RC[-9]="",,"|n"&R1C26&RC[-9])&IF(RC[-8]="",,"|n"&R1C27&RC[-8])&IF(RC[-6]&RC[-5]&RC[-4]="",,"|n"&R1C28)&IF(RC[-6]="",,"|n"&R1C29&RC[-6])&IF(RC[-5]="",,"|n"&R1C30&RC[-5])&IF(RC[-4]="",,"|n"&R1C31&RC[-4])&IF(RC[-2]="",,"|n"&RC[-2]) -> |n|cFFFFFF55附加属性|r(%)|n伤害减免:5|n万年玄冰碎片-寒 + 万年玄冰碎片-霜 + 万年玄冰碎片-冰 + 万年玄冰碎片-雪 + 千年玄冰 = 万年玄冰
C102: C | D102: [雪山] | E102: 万年玄冰碎片-霜 | W102: 5 | AG102: 万年玄冰碎片-寒 + 万年玄冰碎片-霜 + 万年玄冰碎片-冰 + 万年玄冰碎片-雪 + 千年玄冰 = 万年玄冰 | AH102: =VLOOKUP(RC[-31],Sheet2!R1C1:R7C2,2,0)&RC[-30]&RC[-29]&RC[-28]&Sheet2!R1C3&"" -> |cFF99FF66[雪山]万年玄冰碎片-霜|r | AI102: =IF(RC[-27]&RC[-26]&RC[-25]&RC[-24]&RC[-23]&RC[-22]="",,R1C7)&IF(RC[-27]="",,"|n"&R1C8&RC[-27])&IF(RC[-26]="",,"|n"&R1C9&RC[-26])&IF(RC[-25]="",,"|n"&R1C10&RC[-25])&IF(RC[-24]="",,"|n"&R1C11&RC[-24])&IF(RC[-23]="",,"|n"&R1C12&RC[-23])&IF(RC[-22]="",,"|n"&R1C13&RC[-22])&IF(RC[-20]&RC[-19]&RC[-18]&RC[-17]&RC[-16]&RC[-15]&RC[-14]&RC[-13]&RC[-12]&RC[-11]&RC[-10]&RC[-9]&RC[-8]="",,"|n"&R1C14)&IF(RC[-20]="",,"|n"&R1C15&RC[-20])&IF(RC[-19]="",,"|n"&R1C16&RC[-19])&IF(RC[-18]="",,"|n"&R1C17&RC[-18])&IF(RC[-17]="",,"|n"&R1C18&RC[-17])&IF(RC[-16]="",,"|n"&R1C19&RC[-16])&IF(RC[-15]="",,"|n"&R1C20&RC[-15])&IF(RC[-14]="",,"|n"&R1C21&RC[-14])&IF(RC[-13]="",,"|n"&R1C22&RC[-13])&IF(RC[-12]="",,"|n"&R1C23&RC[-12])&IF(RC[-11]="",,"|n"&R1C24&RC[-11])&IF(RC[-10]="",,"|n"&R1C25&RC[-10])&IF(RC[-9]="",,"|n"&R1C26&RC[-9])&IF(RC[-8]="",,"|n"&R1C27&RC[-8])&IF(RC[-6]&RC[-5]&RC[-4]="",,"|n"&R1C28)&IF(RC[-6]="",,"|n"&R1C29&RC[-6])&IF(RC[-5]="",,"|n"&R1C30&RC[-5])&IF(RC[-4]="",,"|n"&R1C31&RC[-4])&IF(RC[-2]="",,"|n"&RC[-2]) -> |n|cFFFFFF55附加属性|r(%)|n伤害减免:5|n万年玄冰碎片-寒 + 万年玄冰碎片-霜 + 万年玄冰碎片-冰 + 万年玄冰碎片-雪 + 千年玄冰 = 万年玄冰
C103: C | D103: [雪山] | E103: 万年玄冰碎片-冰 | W103: 5 | AG103: 万年玄冰碎片-寒 + 万年玄冰碎片-霜 + 万年玄冰碎片-冰 + 万年玄冰碎片-雪 + 千年玄冰 = 万年玄冰 | AH103: =VLOOKUP(RC[-31],Sheet2!R1C1:R7C2,2,0)&RC[-30]&RC[-29]&RC[-28]&Sheet2!R1C3&"" -> |cFF99FF66[雪山]万年玄冰碎片-冰|r | AI103: =IF(RC[-27]&RC[-26]&RC[-25]&RC[-24]&RC[-23]&RC[-22]="",,R1C7)&IF(RC[-27]="",,"|n"&R1C8&RC[-27])&IF(RC[-26]="",,"|n"&R1C9&RC[-26])&IF(RC[-25]="",,"|n"&R1C10&RC[-25])&IF(RC[-24]="",,"|n"&R1C11&RC[-24])&IF(RC[-23]="",,"|n"&R1C12&RC[-23])&IF(RC[-22]="",,"|n"&R1C13&RC[-22])&IF(RC[-20]&RC[-19]&RC[-18]&RC[-17]&RC[-16]&RC[-15]&RC[-14]&RC[-13]&RC[-12]&RC[-11]&RC[-10]&RC[-9]&RC[-8]="",,"|n"&R1C14)&IF(RC[-20]="",,"|n"&R1C15&RC[-20])&IF(RC[-19]="",,"|n"&R1C16&RC[-19])&IF(RC[-18]="",,"|n"&R1C17&RC[-18])&IF(RC[-17]="",,"|n"&R1C18&RC[-17])&IF(RC[-16]="",,"|n"&R1C19&RC[-16])&IF(RC[-15]="",,"|n"&R1C20&RC[-15])&IF(RC[-14]="",,"|n"&R1C21&RC[-14])&IF(RC[-13]="",,"|n"&R1C22&RC[-13])&IF(RC[-12]="",,"|n"&R1C23&RC[-12])&IF(RC[-11]="",,"|n"&R1C24&RC[-11])&IF(RC[-10]="",,"|n"&R1C25&RC[-10])&IF(RC[-9]="",,"|n"&R1C26&RC[-9])&IF(RC[-8]="",,"|n"&R1C27&RC[-8])&IF(RC[-6]&RC[-5]&RC[-4]="",,"|n"&R1C28)&IF(RC[-6]="",,"|n"&R1C29&RC[-6])&IF(RC[-5]="",,"|n"&R1C30&RC[-5])&IF(RC[-4]="",,"|n"&R1C31&RC[-4])&IF(RC[-2]="",,"|n"&RC[-2]) -> |n|cFFFFFF55附加属性|r(%)|n伤害减免:5|n万年玄冰碎片-寒 + 万年玄冰碎片-霜 + 万年玄冰碎片-冰 + 万年玄冰碎片-雪 + 千年玄冰 = 万年玄冰
C104: C | D104: [雪山] | E104: 万年玄冰碎片-雪 | W104: 5 | AG104: 万年玄冰碎片-寒 + 万年玄冰碎片-霜 + 万年玄冰碎片-冰 + 万年玄冰碎片-雪 + 千年玄冰 = 万年玄冰 | AH104: =VLOOKUP(RC[-31],Sheet2!R1C1:R7C2,2,0)&RC[-30]&RC[-29]&RC[-28]&Sheet2!R1C3&"" -> |cFF99FF66[雪山]万年玄冰碎片-雪|r | AI104: =IF(RC[-27]&RC[-26]&RC[-25]&RC[-24]&RC[-23]&RC[-22]="",,R1C7)&IF(RC[-27]="",,"|n"&R1C8&RC[-27])&IF(RC[-26]="",,"|n"&R1C9&RC[-26])&IF(RC[-25]="",,"|n"&R1C10&RC[-25])&IF(RC[-24]="",,"|n"&R1C11&RC[-24])&IF(RC[-23]="",,"|n"&R1C12&RC[-23])&IF(RC[-22]="",,"|n"&R1C13&RC[-22])&IF(RC[-20]&RC[-19]&RC[-18]&RC[-17]&RC[-16]&RC[-15]&RC[-14]&RC[-13]&RC[-12]&RC[-11]&RC[-10]&RC[-9]&RC[-8]="",,"|n"&R1C14)&IF(RC[-20]="",,"|n"&R1C15&RC[-20])&IF(RC[-19]="",,"|n"&R1C16&RC[-19])&IF(RC[-18]="",,"|n"&R1C17&RC[-18])&IF(RC[-17]="",,"|n"&R1C18&RC[-17])&IF(RC[-16]="",,"|n"&R1C19&RC[-16])&IF(RC[-15]="",,"|n"&R1C20&RC[-15])&IF(RC[-14]="",,"|n"&R1C21&RC[-14])&IF(RC[-13]="",,"|n"&R1C22&RC[-13])&IF(RC[-12]="",,"|n"&R1C23&RC[-12])&IF(RC[-11]="",,"|n"&R1C24&RC[-11])&IF(RC[-10]="",,"|n"&R1C25&RC[-10])&IF(RC[-9]="",,"|n"&R1C26&RC[-9])&IF(RC[-8]="",,"|n"&R1C27&RC[-8])&IF(RC[-6]&RC[-5]&RC[-4]="",,"|n"&R1C28)&IF(RC[-6]="",,"|n"&R1C29&RC[-6])&IF(RC[-5]="",,"|n"&R1C30&RC[-5])&IF(RC[-4]="",,"|n"&R1C31&RC[-4])&IF(RC[-2]="",,"|n"&RC[-2]) -> |n|cFFFFFF55附加属性|r(%)|n伤害减免:5|n万年玄冰碎片-寒 + 万年玄冰碎片-霜 + 万年玄冰碎片-冰 + 万年玄冰碎片-雪 + 千年玄冰 = 万年玄冰
C105: C | D105: [雪山] | E105: 千年玄冰 | V105: 10 | AG105: 万年玄冰碎片-寒 + 万年玄冰碎片-霜 + 万年玄冰碎片-冰 + 万年玄冰碎片-雪 + 千年玄冰 = 万年玄冰 | AH105: =VLOOKUP(RC[-31],Sheet2!R1C1:R7C2,2,0)&RC[-30]&RC[-29]&RC[-28]&Sheet2!R1C3&"" -> |cFF99FF66[雪山]千年玄冰|r | AI105: =IF(RC[-27]&RC[-26]&RC[-25]&RC[-24]&RC[-23]&RC[-22]="",,R1C7)&IF(RC[-27]="",,"|n"&R1C8&RC[-27])&IF(RC[-26]="",,"|n"&R1C9&RC[-26])&IF(RC[-25]="",,"|n"&R1C10&RC[-25])&IF(RC[-24]="",,"|n"&R1C11&RC[-24])&IF(RC[-23]="",,"|n"&R1C12&RC[-23])&IF(RC[-22]="",,"|n"&R1C13&RC[-22])&IF(RC[-20]&RC[-19]&RC[-18]&RC[-17]&RC[-16]&RC[-15]&RC[-14]&RC[-13]&RC[-12]&RC[-11]&RC[-10]&RC[-9]&RC[-8]="",,"|n"&R1C14)&IF(RC[-20]="",,"|n"&R1C15&RC[-20])&IF(RC[-19]="",,"|n"&R1C16&RC[-19])&IF(RC[-18]="",,"|n"&R1C17&RC[-18])&IF(RC[-17]="",,"|n"&R1C18&RC[-17])&IF(RC[-16]="",,"|n"&R1C19&RC[-16])&IF(RC[-15]="",,"|n"&R1C20&RC[-15])&IF(RC[-14]="",,"|n"&R1C21&RC[-14])&IF(RC[-13]="",,"|n"&R1C22&RC[-13])&IF(RC[-12]="",,"|n"&R1C23&RC[-12])&IF(RC[-11]="",,"|n"&R1C24&RC[-11])&IF(RC[-10]="",,"|n"&R1C25&RC[-10])&IF(RC[-9]="",,"|n"&R1C26&RC[-9])&IF(RC[-8]="",,"|n"&R1C27&RC[-8])&IF(RC[-6]&RC[-5]&RC[-4]="",,"|n"&R1C28)&IF(RC[-6]="",,"|n"&R1C29&RC[-6])&IF(RC[-5]="",,"|n"&R1C30&RC[-5])&IF(RC[-4]="",,"|n"&R1C31&RC[-4])&IF(RC[-2]="",,"|n"&RC[-2]) -> |n|cFFFFFF55附加属性|r(%)|n伤害抵抗:10|n万年玄冰碎片-寒 + 万年玄冰碎片-霜 + 万年玄冰碎片-冰 + 万年玄冰碎片-雪 + 千年玄冰 = 万年玄冰
C106: B | D106: [雪山] | E106: 万年玄冰 | V106: 10 | W106: 15 | AG106: 雪灵之心+万年玄冰+雪山罡风+雪山古剑 = 风雪古剑 | AH106: =VLOOKUP(RC[-31],Sheet2!R1C1:R7C2,2,0)&RC[-30]&RC[-29]&RC[-28]&Sheet2!R1C3&"" -> |cFF99FF66[雪山]万年玄冰|r | AI106: =IF(RC[-27]&RC[-26]&RC[-25]&RC[-24]&RC[-23]&RC[-22]="",,R1C7)&IF(RC[-27]="",,"|n"&R1C8&RC[-27])&IF(RC[-26]="",,"|n"&R1C9&RC[-26])&IF(RC[-25]="",,"|n"&R1C10&RC[-25])&IF(RC[-24]="",,"|n"&R1C11&RC[-24])&IF(RC[-23]="",,"|n"&R1C12&RC[-23])&IF(RC[-22]="",,"|n"&R1C13&RC[-22])&IF(RC[-20]&RC[-19]&RC[-18]&RC[-17]&RC[-16]&RC[-15]&RC[-14]&RC[-13]&RC[-12]&RC[-11]&RC[-10]&RC[-9]&RC[-8]="",,"|n"&R1C14)&IF(RC[-20]="",,"|n"&R1C15&RC[-20])&IF(RC[-19]="",,"|n"&R1C16&RC[-19])&IF(RC[-18]="",,"|n"&R1C17&RC[-18])&IF(RC[-17]="",,"|n"&R1C18&RC[-17])&IF(RC[-16]="",,"|n"&R1C19&RC[-16])&IF(RC[-15]="",,"|n"&R1C20&RC[-15])&IF(RC[-14]="",,"|n"&R1C21&RC[-14])&IF(RC[-13]="",,"|n"&R1C22&RC[-13])&IF(RC[-12]="",,"|n"&R1C23&RC[-12])&IF(RC[-11]="",,"|n"&R1C24&RC[-11])&IF(RC[-10]="",,"|n"&R1C25&RC[-10])&IF(RC[-9]="",,"|n"&R1C26&RC[-9])&IF(RC[-8]="",,"|n"&R1C27&RC[-8])&IF(RC[-6]&RC[-5]&RC[-4]="",,"|n"&R1C28)&IF(RC[-6]="",,"|n"&R1C29&RC[-6])&IF(RC[-5]="",,"|n"&R1C30&RC[-5])&IF(RC[-4]="",,"|n"&R1C31&RC[-4])&IF(RC[-2]="",,"|n"&RC[-2]) -> |n|cFFFFFF55附加属性|r(%)|n伤害抵抗:10|n伤害减免:15|n雪灵之心+万年玄冰+雪山罡风+雪山古剑 = 风雪古剑
C107: B | D107: [雪山] | E107: 雪山罡风 | R107: 60 | AG107: 雪灵之心+万年玄冰+雪山罡风+雪山古剑 = 风雪古剑 | AH107: =VLOOKUP(RC[-31],Sheet2!R1C1:R7C2,2,0)&RC[-30]&RC[-29]&RC[-28]&Sheet2!R1C3&"" -> |cFF99FF66[雪山]雪山罡风|r | AI107: =IF(RC[-27]&RC[-26]&RC[-25]&RC[-24]&RC[-23]&RC[-22]="",,R1C7)&IF(RC[-27]="",,"|n"&R1C8&RC[-27])&IF(RC[-26]="",,"|n"&R1C9&RC[-26])&IF(RC[-25]="",,"|n"&R1C10&RC[-25])&IF(RC[-24]="",,"|n"&R1C11&RC[-24])&IF(RC[-23]="",,"|n"&R1C12&RC[-23])&IF(RC[-22]="",,"|n"&R1C13&RC[-22])&IF(RC[-20]&RC[-19]&RC[-18]&RC[-17]&RC[-16]&RC[-15]&RC[-14]&RC[-13]&RC[-12]&RC[-11]&RC[-10]&RC[-9]&RC[-8]="",,"|n"&R1C14)&IF(RC[-20]="",,"|n"&R1C15&RC[-20])&IF(RC[-19]="",,"|n"&R1C16&RC[-19])&IF(RC[-18]="",,"|n"&R1C17&RC[-18])&IF(RC[-17]="",,"|n"&R1C18&RC[-17])&IF(RC[-16]="",,"|n"&R1C19&RC[-16])&IF(RC[-15]="",,"|n"&R1C20&RC[-15])&IF(RC[-14]="",,"|n"&R1C21&RC[-14])&IF(RC[-13]="",,"|n"&R1C22&RC[-13])&IF(RC[-12]="",,"|n"&R1C23&RC[-12])&IF(RC[-11]="",,"|n"&R1C24&RC[-11])&IF(RC[-10]="",,"|n"&R1C25&RC[-10])&IF(RC[-9]="",,"|n"&R1C26&RC[-9])&IF(RC[-8]="",,"|n"&R1C27&RC[-8])&IF(RC[-6]&RC[-5]&RC[-4]="",,"|n"&R1C28)&IF(RC[-6]="",,"|n"&R1C29&RC[-6])&IF(RC[-5]="",,"|n"&R1C30&RC[-5])&IF(RC[-4]="",,"|n"&R1C31&RC[-4])&IF(RC[-2]="",,"|n"&RC[-2]) -> |n|cFFFFFF55附加属性|r(%)|n暴击伤害:60|n雪灵之心+万年玄冰+雪山罡风+雪山古剑 = 风雪古剑
C108: B | D108: [雪山] | E108: 雪山古剑 | H108: 1000000 | Q108: 25 | AG108: 雪灵之心+万年玄冰+雪山罡风+雪山古剑 = 风雪古剑 | AH108: =VLOOKUP(RC[-31],Sheet2!R1C1:R7C2,2,0)&RC[-30]&RC[-29]&RC[-28]&Sheet2!R1C3&"" -> |cFF99FF66[雪山]雪山古剑|r | AI108: =IF(RC[-27]&RC[-26]&RC[-25]&RC[-24]&RC[-23]&RC[-22]="",,R1C7)&IF(RC[-27]="",,"|n"&R1C8&RC[-27])&IF(RC[-26]="",,"|n"&R1C9&RC[-26])&IF(RC[-25]="",,"|n"&R1C10&RC[-25])&IF(RC[-24]="",,"|n"&R1C11&RC[-24])&IF(RC[-23]="",,"|n"&R1C12&RC[-23])&IF(RC[-22]="",,"|n"&R1C13&RC[-22])&IF(RC[-20]&RC[-19]&RC[-18]&RC[-17]&RC[-16]&RC[-15]&RC[-14]&RC[-13]&RC[-12]&RC[-11]&RC[-10]&RC[-9]&RC[-8]="",,"|n"&R1C14)&IF(RC[-20]="",,"|n"&R1C15&RC[-20])&IF(RC[-19]="",,"|n"&R1C16&RC[-19])&IF(RC[-18]="",,"|n"&R1C17&RC[-18])&IF(RC[-17]="",,"|n"&R1C18&RC[-17])&IF(RC[-16]="",,"|n"&R1C19&RC[-16])&IF(RC[-15]="",,"|n"&R1C20&RC[-15])&IF(RC[-14]="",,"|n"&R1C21&RC[-14])&IF(RC[-13]="",,"|n"&R1C22&RC[-13])&IF(RC[-12]="",,"|n"&R1C23&RC[-12])&IF(RC[-11]="",,"|n"&R1C24&RC[-11])&IF(RC[-10]="",,"|n"&R1C25&RC[-10])&IF(RC[-9]="",,"|n"&R1C26&RC[-9])&IF(RC[-8]="",,"|n"&R1C27&RC[-8])&IF(RC[-6]&RC[-5]&RC[-4]="",,"|n"&R1C28)&IF(RC[-6]="",,"|n"&R1C29&RC[-6])&IF(RC[-5]="",,"|n"&R1C30&RC[-5])&IF(RC[-4]="",,"|n"&R1C31&RC[-4])&IF(RC[-2]="",,"|n"&RC[-2]) -> |cFFFFFF99基础属性|r|n攻击:1000000|n|cFFFFFF55附加属性|r(%)|n暴击概率:25|n雪灵之心+万年玄冰+雪山罡风+雪山古剑 = 风雪古剑
C109: A | D109: [雪山] | E109: 风雪古剑 | H109: 1000000 | Q109: 25 | R109: 60 | T109: 60 | V109: 10 | W109: 15 | AG109: 非常强力的一把古剑,不过剑上似乎存在神秘的封印! | AH109: =VLOOKUP(RC[-31],Sheet2!R1C1:R7C2,2,0)&RC[-30]&RC[-29]&RC[-28]&Sheet2!R1C3&"" -> |cFF99FF66[雪山]风雪古剑|r | AI109: =IF(RC[-27]&RC[-26]&RC[-25]&RC[-24]&RC[-23]&RC[-22]="",,R1C7)&IF(RC[-27]="",,"|n"&R1C8&RC[-27])&IF(RC[-26]="",,"|n"&R1C9&RC[-26])&IF(RC[-25]="",,"|n"&R1C10&RC[-25])&IF(RC[-24]="",,"|n"&R1C11&RC[-24])&IF(RC[-23]="",,"|n"&R1C12&RC[-23])&IF(RC[-22]="",,"|n"&R1C13&RC[-22])&IF(RC[-20]&RC[-19]&RC[-18]&RC[-17]&RC[-16]&RC[-15]&RC[-14]&RC[-13]&RC[-12]&RC[-11]&RC[-10]&RC[-9]&RC[-8]="",,"|n"&R1C14)&IF(RC[-20]="",,"|n"&R1C15&RC[-20])&IF(RC[-19]="",,"|n"&R1C16&RC[-19])&IF(RC[-18]="",,"|n"&R1C17&RC[-18])&IF(RC[-17]="",,"|n"&R1C18&RC[-17])&IF(RC[-16]="",,"|n"&R1C19&RC[-16])&IF(RC[-15]="",,"|n"&R1C20&RC[-15])&IF(RC[-14]="",,"|n"&R1C21&RC[-14])&IF(RC[-13]="",,"|n"&R1C22&RC[-13])&IF(RC[-12]="",,"|n"&R1C23&RC[-12])&IF(RC[-11]="",,"|n"&R1C24&RC[-11])&IF(RC[-10]="",,"|n"&R1C25&RC[-10])&IF(RC[-9]="",,"|n"&R1C26&RC[-9])&IF(RC[-8]="",,"|n"&R1C27&RC[-8])&IF(RC[-6]&RC[-5]&RC[-4]="",,"|n"&R1C28)&IF(RC[-6]="",,"|n"&R1C29&RC[-6])&IF(RC[-5]="",,"|n"&R1C30&RC[-5])&IF(RC[-4]="",,"|n"&R1C31&RC[-4])&IF(RC[-2]="",,"|n"&RC[-2]) -> |cFFFFFF99基础属性|r|n攻击:1000000|n|cFFFFFF55附加属性|r(%)|n暴击概率:25|n暴击伤害:60|n附加伤害:60|n伤害抵抗:10|n伤害减免:15|n非常强力的一把古剑,不过剑上似乎存在神秘的封印!
C110: A | D110: [雪山] | E110: 公主之心 | P110: 1 | R110: 10 | AG110: 公主之心! | AH110: =VLOOKUP(RC[-31],Sheet2!R1C1:R7C2,2,0)&RC[-30]&RC[-29]&RC[-28]&Sheet2!R1C3&"" -> |cFF99FF66[雪山]公主之心|r | AI110: =IF(RC[-27]&RC[-26]&RC[-25]&RC[-24]&RC[-23]&RC[-22]="",,R1C7)&IF(RC[-27]="",,"|n"&R1C8&RC[-27])&IF(RC[-26]="",,"|n"&R1C9&RC[-26])&IF(RC[-25]="",,"|n"&R1C10&RC[-25])&IF(RC[-24]="",,"|n"&R1C11&RC[-24])&IF(RC[-23]="",,"|n"&R1C12&RC[-23])&IF(RC[-22]="",,"|n"&R1C13&RC[-22])&IF(RC[-20]&RC[-19]&RC[-18]&RC[-17]&RC[-16]&RC[-15]&RC[-14]&RC[-13]&RC[-12]&RC[-11]&RC[-10]&RC[-9]&RC[-8]="",,"|n"&R1C14)&IF(RC[-20]="",,"|n"&R1C15&RC[-20])&IF(RC[-19]="",,"|n"&R1C16&RC[-19])&IF(RC[-18]="",,"|n"&R1C17&RC[-18])&IF(RC[-17]="",,"|n"&R1C18&RC[-17])&IF(RC[-16]="",,"|n"&R1C19&RC[-16])&IF(RC[-15]="",,"|n"&R1C20&RC[-15])&IF(RC[-14]="",,"|n"&R1C21&RC[-14])&IF(RC[-13]="",,"|n"&R1C22&RC[-13])&IF(RC[-12]="",,"|n"&R1C23&RC[-12])&IF(RC[-11]="",,"|n"&R1C24&RC[-11])&IF(RC[-10]="",,"|n"&R1C25&RC[-10])&IF(RC[-9]="",,"|n"&R1C26&RC[-9])&IF(RC[-8]="",,"|n"&R1C27&RC[-8])&IF(RC[-6]&RC[-5]&RC[-4]="",,"|n"&R1C28)&IF(RC[-6]="",,"|n"&R1C29&RC[-6])&IF(RC[-5]="",,"|n"&R1C30&RC[-5])&IF(RC[-4]="",,"|n"&R1C31&RC[-4])&IF(RC[-2]="",,"|n"&RC[-2]) -> |n|cFFFFFF55附加属性|r(%)|n攻击吸血:1|n暴击伤害:10|n公主之心!
C111: A | D111: [雪山] | E111: 公主之信 | AG111: 公主的信件,似乎上面画着一幅地图. | AH111: =VLOOKUP(RC[-31],Sheet2!R1C1:R7C2,2,0)&RC[-30]&RC[-29]&RC[-28]&Sheet2!R1C3&"" -> |cFF99FF66[雪山]公主之信|r | AI111: =IF(RC[-27]&RC[-26]&RC[-25]&RC[-24]&RC[-23]&RC[-22]="",,R1C7)&IF(RC[-27]="",,"|n"&R1C8&RC[-27])&IF(RC[-26]="",,"|n"&R1C9&RC[-26])&IF(RC[-25]="",,"|n"&R1C10&RC[-25])&IF(RC[-24]="",,"|n"&R1C11&RC[-24])&IF(RC[-23]="",,"|n"&R1C12&RC[-23])&IF(RC[-22]="",,"|n"&R1C13&RC[-22])&IF(RC[-20]&RC[-19]&RC[-18]&RC[-17]&RC[-16]&RC[-15]&RC[-14]&RC[-13]&RC[-12]&RC[-11]&RC[-10]&RC[-9]&RC[-8]="",,"|n"&R1C14)&IF(RC[-20]="",,"|n"&R1C15&RC[-20])&IF(RC[-19]="",,"|n"&R1C16&RC[-19])&IF(RC[-18]="",,"|n"&R1C17&RC[-18])&IF(RC[-17]="",,"|n"&R1C18&RC[-17])&IF(RC[-16]="",,"|n"&R1C19&RC[-16])&IF(RC[-15]="",,"|n"&R1C20&RC[-15])&IF(RC[-14]="",,"|n"&R1C21&RC[-14])&IF(RC[-13]="",,"|n"&R1C22&RC[-13])&IF(RC[-12]="",,"|n"&R1C23&RC[-12])&IF(RC[-11]="",,"|n"&R1C24&RC[-11])&IF(RC[-10]="",,"|n"&R1C25&RC[-10])&IF(RC[-9]="",,"|n"&R1C26&RC[-9])&IF(RC[-8]="",,"|n"&R1C27&RC[-8])&IF(RC[-6]&RC[-5]&RC[-4]="",,"|n"&R1C28)&IF(RC[-6]="",,"|n"&R1C29&RC[-6])&IF(RC[-5]="",,"|n"&R1C30&RC[-5])&IF(RC[-4]="",,"|n"&R1C31&RC[-4])&IF(RC[-2]="",,"|n"&RC[-2]) -> |n公主的信件,似乎上面画着一幅地图.
C112: A | D112: [雪山] | E112: 公主爱心 | P112: 2 | R112: 20 | AG112: 公主的爱心! | AH112: =VLOOKUP(RC[-31],Sheet2!R1C1:R7C2,2,0)&RC[-30]&RC[-29]&RC[-28]&Sheet2!R1C3&"" -> |cFF99FF66[雪山]公主爱心|r | AI112: =IF(RC[-27]&RC[-26]&RC[-25]&RC[-24]&RC[-23]&RC[-22]="",,R1C7)&IF(RC[-27]="",,"|n"&R1C8&RC[-27])&IF(RC[-26]="",,"|n"&R1C9&RC[-26])&IF(RC[-25]="",,"|n"&R1C10&RC[-25])&IF(RC[-24]="",,"|n"&R1C11&RC[-24])&IF(RC[-23]="",,"|n"&R1C12&RC[-23])&IF(RC[-22]="",,"|n"&R1C13&RC[-22])&IF(RC[-20]&RC[-19]&RC[-18]&RC[-17]&RC[-16]&RC[-15]&RC[-14]&RC[-13]&RC[-12]&RC[-11]&RC[-10]&RC[-9]&RC[-8]="",,"|n"&R1C14)&IF(RC[-20]="",,"|n"&R1C15&RC[-20])&IF(RC[-19]="",,"|n"&R1C16&RC[-19])&IF(RC[-18]="",,"|n"&R1C17&RC[-18])&IF(RC[-17]="",,"|n"&R1C18&RC[-17])&IF(RC[-16]="",,"|n"&R1C19&RC[-16])&IF(RC[-15]="",,"|n"&R1C20&RC[-15])&IF(RC[-14]="",,"|n"&R1C21&RC[-14])&IF(RC[-13]="",,"|n"&R1C22&RC[-13])&IF(RC[-12]="",,"|n"&R1C23&RC[-12])&IF(RC[-11]="",,"|n"&R1C24&RC[-11])&IF(RC[-10]="",,"|n"&R1C25&RC[-10])&IF(RC[-9]="",,"|n"&R1C26&RC[-9])&IF(RC[-8]="",,"|n"&R1C27&RC[-8])&IF(RC[-6]&RC[-5]&RC[-4]="",,"|n"&R1C28)&IF(RC[-6]="",,"|n"&R1C29&RC[-6])&IF(RC[-5]="",,"|n"&R1C30&RC[-5])&IF(RC[-4]="",,"|n"&R1C31&RC[-4])&IF(RC[-2]="",,"|n"&RC[-2]) -> |n|cFFFFFF55附加属性|r(%)|n攻击吸血:2|n暴击伤害:20|n公主的爱心!
C113: S | D113: [雪山] | E113: 风雪神剑 | H113: 2000000 | M113: 5000 | P113: 5 | Q113: 25 | R113: 80 | T113: 60 | V113: 10 | W113: 20 | AG113: 风雪神剑! | AH113: =VLOOKUP(RC[-31],Sheet2!R1C1:R7C2,2,0)&RC[-30]&RC[-29]&RC[-28]&Sheet2!R1C3&"" -> |cFFFF9933[雪山]风雪神剑|r | AI113: =IF(RC[-27]&RC[-26]&RC[-25]&RC[-24]&RC[-23]&RC[-22]="",,R1C7)&IF(RC[-27]="",,"|n"&R1C8&RC[-27])&IF(RC[-26]="",,"|n"&R1C9&RC[-26])&IF(RC[-25]="",,"|n"&R1C10&RC[-25])&IF(RC[-24]="",,"|n"&R1C11&RC[-24])&IF(RC[-23]="",,"|n"&R1C12&RC[-23])&IF(RC[-22]="",,"|n"&R1C13&RC[-22])&IF(RC[-20]&RC[-19]&RC[-18]&RC[-17]&RC[-16]&RC[-15]&RC[-14]&RC[-13]&RC[-12]&RC[-11]&RC[-10]&RC[-9]&RC[-8]="",,"|n"&R1C14)&IF(RC[-20]="",,"|n"&R1C15&RC[-20])&IF(RC[-19]="",,"|n"&R1C16&RC[-19])&IF(RC[-18]="",,"|n"&R1C17&RC[-18])&IF(RC[-17]="",,"|n"&R1C18&RC[-17])&IF(RC[-16]="",,"|n"&R1C19&RC[-16])&IF(RC[-15]="",,"|n"&R1C20&RC[-15])&IF(RC[-14]="",,"|n"&R1C21&RC[-14])&IF(RC[-13]="",,"|n"&R1C22&RC[-13])&IF(RC[-12]="",,"|n"&R1C23&RC[-12])&IF(RC[-11]="",,"|n"&R1C24&RC[-11])&IF(RC[-10]="",,"|n"&R1C25&RC[-10])&IF(RC[-9]="",,"|n"&R1C26&RC[-9])&IF(RC[-8]="",,"|n"&R1C27&RC[-8])&IF(RC[-6]&RC[-5]&RC[-4]="",,"|n"&R1C28)&IF(RC[-6]="",,"|n"&R1C29&RC[-6])&IF(RC[-5]="",,"|n"&R1C30&RC[-5])&IF(RC[-4]="",,"|n"&R1C31&RC[-4])&IF(RC[-2]="",,"|n"&RC[-2]) -> |cFFFFFF99基础属性|r|n攻击:2000000|n护甲:5000|n|cFFFFFF55附加属性|r(%)|n攻击吸血:5|n暴击概率:25|n暴击伤害:80|n附加伤害:60|n伤害抵抗:10|n伤害减免:20|n风雪神剑!
C114: S | D114: [雪山] | E114: 风雪圣剑 | H114: 2500000 | M114: 5000 | P114: 5 | Q114: 25 | R114: 130 | T114: 60 | V114: 10 | W114: 20 | AG114: 充满公主爱意的风雪圣剑! | AH114: =VLOOKUP(RC[-31],Sheet2!R1C1:R7C2,2,0)&RC[-30]&RC[-29]&RC[-28]&Sheet2!R1C3&"" -> |cFFFF9933[雪山]风雪圣剑|r | AI114: =IF(RC[-27]&RC[-26]&RC[-25]&RC[-24]&RC[-23]&RC[-22]="",,R1C7)&IF(RC[-27]="",,"|n"&R1C8&RC[-27])&IF(RC[-26]="",,"|n"&R1C9&RC[-26])&IF(RC[-25]="",,"|n"&R1C10&RC[-25])&IF(RC[-24]="",,"|n"&R1C11&RC[-24])&IF(RC[-23]="",,"|n"&R1C12&RC[-23])&IF(RC[-22]="",,"|n"&R1C13&RC[-22])&IF(RC[-20]&RC[-19]&RC[-18]&RC[-17]&RC[-16]&RC[-15]&RC[-14]&RC[-13]&RC[-12]&RC[-11]&RC[-10]&RC[-9]&RC[-8]="",,"|n"&R1C14)&IF(RC[-20]="",,"|n"&R1C15&RC[-20])&IF(RC[-19]="",,"|n"&R1C16&RC[-19])&IF(RC[-18]="",,"|n"&R1C17&RC[-18])&IF(RC[-17]="",,"|n"&R1C18&RC[-17])&IF(RC[-16]="",,"|n"&R1C19&RC[-16])&IF(RC[-15]="",,"|n"&R1C20&RC[-15])&IF(RC[-14]="",,"|n"&R1C21&RC[-14])&IF(RC[-13]="",,"|n"&R1C22&RC[-13])&IF(RC[-12]="",,"|n"&R1C23&RC[-12])&IF(RC[-11]="",,"|n"&R1C24&RC[-11])&IF(RC[-10]="",,"|n"&R1C25&RC[-10])&IF(RC[-9]="",,"|n"&R1C26&RC[-9])&IF(RC[-8]="",,"|n"&R1C27&RC[-8])&IF(RC[-6]&RC[-5]&RC[-4]="",,"|n"&R1C28)&IF(RC[-6]="",,"|n"&R1C29&RC[-6])&IF(RC[-5]="",,"|n"&R1C30&RC[-5])&IF(RC[-4]="",,"|n"&R1C31&RC[-4])&IF(RC[-2]="",,"|n"&RC[-2]) -> |cFFFFFF99基础属性|r|n攻击:2500000|n护甲:5000|n|cFFFFFF55附加属性|r(%)|n攻击吸血:5|n暴击概率:25|n暴击伤害:130|n附加伤害:60|n伤害抵抗:10|n伤害减免:20|n充满公主爱意的风雪圣剑!
C115: B | D115: [雪山] | E115: 神秘的少女裙子 | M115: 1000 | R115: 5 | W115: 2 | AG115: 一件女装,似乎是某个礼服的一部分! | AH115: =VLOOKUP(RC[-31],Sheet2!R1C1:R7C2,2,0)&RC[-30]&RC[-29]&RC[-28]&Sheet2!R1C3&"" -> |cFF99FF66[雪山]神秘的少女裙子|r | AI115: =IF(RC[-27]&RC[-26]&RC[-25]&RC[-24]&RC[-23]&RC[-22]="",,R1C7)&IF(RC[-27]="",,"|n"&R1C8&RC[-27])&IF(RC[-26]="",,"|n"&R1C9&RC[-26])&IF(RC[-25]="",,"|n"&R1C10&RC[-25])&IF(RC[-24]="",,"|n"&R1C11&RC[-24])&IF(RC[-23]="",,"|n"&R1C12&RC[-23])&IF(RC[-22]="",,"|n"&R1C13&RC[-22])&IF(RC[-20]&RC[-19]&RC[-18]&RC[-17]&RC[-16]&RC[-15]&RC[-14]&RC[-13]&RC[-12]&RC[-11]&RC[-10]&RC[-9]&RC[-8]="",,"|n"&R1C14)&IF(RC[-20]="",,"|n"&R1C15&RC[-20])&IF(RC[-19]="",,"|n"&R1C16&RC[-19])&IF(RC[-18]="",,"|n"&R1C17&RC[-18])&IF(RC[-17]="",,"|n"&R1C18&RC[-17])&IF(RC[-16]="",,"|n"&R1C19&RC[-16])&IF(RC[-15]="",,"|n"&R1C20&RC[-15])&IF(RC[-14]="",,"|n"&R1C21&RC[-14])&IF(RC[-13]="",,"|n"&R1C22&RC[-13])&IF(RC[-12]="",,"|n"&R1C23&RC[-12])&IF(RC[-11]="",,"|n"&R1C24&RC[-11])&IF(RC[-10]="",,"|n"&R1C25&RC[-10])&IF(RC[-9]="",,"|n"&R1C26&RC[-9])&IF(RC[-8]="",,"|n"&R1C27&RC[-8])&IF(RC[-6]&RC[-5]&RC[-4]="",,"|n"&R1C28)&IF(RC[-6]="",,"|n"&R1C29&RC[-6])&IF(RC[-5]="",,"|n"&R1C30&RC[-5])&IF(RC[-4]="",,"|n"&R1C31&RC[-4])&IF(RC[-2]="",,"|n"&RC[-2]) -> |cFFFFFF99基础属性|r|n护甲:1000|n|cFFFFFF55附加属性|r(%)|n暴击伤害:5|n伤害减免:2|n一件女装,似乎是某个礼服的一部分!
C116: B | D116: [雪山] | E116: 神秘的少女鞋子 | M116: 1000 | R116: 5 | W116: 2 | AG116: 一件女装,似乎是某个礼服的一部分! | AH116: =VLOOKUP(RC[-31],Sheet2!R1C1:R7C2,2,0)&RC[-30]&RC[-29]&RC[-28]&Sheet2!R1C3&"" -> |cFF99FF66[雪山]神秘的少女鞋子|r | AI116: =IF(RC[-27]&RC[-26]&RC[-25]&RC[-24]&RC[-23]&RC[-22]="",,R1C7)&IF(RC[-27]="",,"|n"&R1C8&RC[-27])&IF(RC[-26]="",,"|n"&R1C9&RC[-26])&IF(RC[-25]="",,"|n"&R1C10&RC[-25])&IF(RC[-24]="",,"|n"&R1C11&RC[-24])&IF(RC[-23]="",,"|n"&R1C12&RC[-23])&IF(RC[-22]="",,"|n"&R1C13&RC[-22])&IF(RC[-20]&RC[-19]&RC[-18]&RC[-17]&RC[-16]&RC[-15]&RC[-14]&RC[-13]&RC[-12]&RC[-11]&RC[-10]&RC[-9]&RC[-8]="",,"|n"&R1C14)&IF(RC[-20]="",,"|n"&R1C15&RC[-20])&IF(RC[-19]="",,"|n"&R1C16&RC[-19])&IF(RC[-18]="",,"|n"&R1C17&RC[-18])&IF(RC[-17]="",,"|n"&R1C18&RC[-17])&IF(RC[-16]="",,"|n"&R1C19&RC[-16])&IF(RC[-15]="",,"|n"&R1C20&RC[-15])&IF(RC[-14]="",,"|n"&R1C21&RC[-14])&IF(RC[-13]="",,"|n"&R1C22&RC[-13])&IF(RC[-12]="",,"|n"&R1C23&RC[-12])&IF(RC[-11]="",,"|n"&R1C24&RC[-11])&IF(RC[-10]="",,"|n"&R1C25&RC[-10])&IF(RC[-9]="",,"|n"&R1C26&RC[-9])&IF(RC[-8]="",,"|n"&R1C27&RC[-8])&IF(RC[-6]&RC[-5]&RC[-4]="",,"|n"&R1C28)&IF(RC[-6]="",,"|n"&R1C29&RC[-6])&IF(RC[-5]="",,"|n"&R1C30&RC[-5])&IF(RC[-4]="",,"|n"&R1C31&RC[-4])&IF(RC[-2]="",,"|n"&RC[-2]) -> |cFFFFFF99基础属性|r|n护甲:1000|n|cFFFFFF55附加属性|r(%)|n暴击伤害:5|n伤害减免:2|n一件女装,似乎是某个礼服的一部分!
C117: B | D117: [雪山] | E117: 神秘的少女衣服 | M117: 1000 | R117: 5 | W117: 2 | AG117: 一件女装,似乎是某个礼服的一部分! | AH117: =VLOOKUP(RC[-31],Sheet2!R1C1:R7C2,2,0)&RC[-30]&RC[-29]&RC[-28]&Sheet2!R1C3&"" -> |cFF99FF66[雪山]神秘的少女衣服|r | AI117: =IF(RC[-27]&RC[-26]&RC[-25]&RC[-24]&RC[-23]&RC[-22]="",,R1C7)&IF(RC[-27]="",,"|n"&R1C8&RC[-27])&IF(RC[-26]="",,"|n"&R1C9&RC[-26])&IF(RC[-25]="",,"|n"&R1C10&RC[-25])&IF(RC[-24]="",,"|n"&R1C11&RC[-24])&IF(RC[-23]="",,"|n"&R1C12&RC[-23])&IF(RC[-22]="",,"|n"&R1C13&RC[-22])&IF(RC[-20]&RC[-19]&RC[-18]&RC[-17]&RC[-16]&RC[-15]&RC[-14]&RC[-13]&RC[-12]&RC[-11]&RC[-10]&RC[-9]&RC[-8]="",,"|n"&R1C14)&IF(RC[-20]="",,"|n"&R1C15&RC[-20])&IF(RC[-19]="",,"|n"&R1C16&RC[-19])&IF(RC[-18]="",,"|n"&R1C17&RC[-18])&IF(RC[-17]="",,"|n"&R1C18&RC[-17])&IF(RC[-16]="",,"|n"&R1C19&RC[-16])&IF(RC[-15]="",,"|n"&R1C20&RC[-15])&IF(RC[-14]="",,"|n"&R1C21&RC[-14])&IF(RC[-13]="",,"|n"&R1C22&RC[-13])&IF(RC[-12]="",,"|n"&R1C23&RC[-12])&IF(RC[-11]="",,"|n"&R1C24&RC[-11])&IF(RC[-10]="",,"|n"&R1C25&RC[-10])&IF(RC[-9]="",,"|n"&R1C26&RC[-9])&IF(RC[-8]="",,"|n"&R1C27&RC[-8])&IF(RC[-6]&RC[-5]&RC[-4]="",,"|n"&R1C28)&IF(RC[-6]="",,"|n"&R1C29&RC[-6])&IF(RC[-5]="",,"|n"&R1C30&RC[-5])&IF(RC[-4]="",,"|n"&R1C31&RC[-4])&IF(RC[-2]="",,"|n"&RC[-2]) -> |cFFFFFF99基础属性|r|n护甲:1000|n|cFFFFFF55附加属性|r(%)|n暴击伤害:5|n伤害减免:2|n一件女装,似乎是某个礼服的一部分!
C118: A | D118: [雪山] | E118: 神秘的少女礼服 | M118: 5000 | R118: 20 | W118: 5 | AG118: 一套女装,要不穿穿看? | AH118: =VLOOKUP(RC[-31],Sheet2!R1C1:R7C2,2,0)&RC[-30]&RC[-29]&RC[-28]&Sheet2!R1C3&"" -> |cFF99FF66[雪山]神秘的少女礼服|r | AI118: =IF(RC[-27]&RC[-26]&RC[-25]&RC[-24]&RC[-23]&RC[-22]="",,R1C7)&IF(RC[-27]="",,"|n"&R1C8&RC[-27])&IF(RC[-26]="",,"|n"&R1C9&RC[-26])&IF(RC[-25]="",,"|n"&R1C10&RC[-25])&IF(RC[-24]="",,"|n"&R1C11&RC[-24])&IF(RC[-23]="",,"|n"&R1C12&RC[-23])&IF(RC[-22]="",,"|n"&R1C13&RC[-22])&IF(RC[-20]&RC[-19]&RC[-18]&RC[-17]&RC[-16]&RC[-15]&RC[-14]&RC[-13]&RC[-12]&RC[-11]&RC[-10]&RC[-9]&RC[-8]="",,"|n"&R1C14)&IF(RC[-20]="",,"|n"&R1C15&RC[-20])&IF(RC[-19]="",,"|n"&R1C16&RC[-19])&IF(RC[-18]="",,"|n"&R1C17&RC[-18])&IF(RC[-17]="",,"|n"&R1C18&RC[-17])&IF(RC[-16]="",,"|n"&R1C19&RC[-16])&IF(RC[-15]="",,"|n"&R1C20&RC[-15])&IF(RC[-14]="",,"|n"&R1C21&RC[-14])&IF(RC[-13]="",,"|n"&R1C22&RC[-13])&IF(RC[-12]="",,"|n"&R1C23&RC[-12])&IF(RC[-11]="",,"|n"&R1C24&RC[-11])&IF(RC[-10]="",,"|n"&R1C25&RC[-10])&IF(RC[-9]="",,"|n"&R1C26&RC[-9])&IF(RC[-8]="",,"|n"&R1C27&RC[-8])&IF(RC[-6]&RC[-5]&RC[-4]="",,"|n"&R1C28)&IF(RC[-6]="",,"|n"&R1C29&RC[-6])&IF(RC[-5]="",,"|n"&R1C30&RC[-5])&IF(RC[-4]="",,"|n"&R1C31&RC[-4])&IF(RC[-2]="",,"|n"&RC[-2]) -> |cFFFFFF99基础属性|r|n护甲:5000|n|cFFFFFF55附加属性|r(%)|n暴击伤害:20|n伤害减免:5|n一套女装,要不穿穿看?
C119: E | D119: [扭曲神殿] | E119: 扭曲魔石 | V119: 3 | Y119: 2 | Z119: 2 | AA119: 2 | AG119: 扭曲魔石+扭曲妖石+扭曲邪石+扭曲怪石 = 扭曲结晶 | AH119: =VLOOKUP(RC[-31],Sheet2!R1C1:R7C2,2,0)&RC[-30]&RC[-29]&RC[-28]&Sheet2!R1C3&"" -> |CFFFFFFFF[扭曲神殿]扭曲魔石|r | AI119: =IF(RC[-27]&RC[-26]&RC[-25]&RC[-24]&RC[-23]&RC[-22]="",,R1C7)&IF(RC[-27]="",,"|n"&R1C8&RC[-27])&IF(RC[-26]="",,"|n"&R1C9&RC[-26])&IF(RC[-25]="",,"|n"&R1C10&RC[-25])&IF(RC[-24]="",,"|n"&R1C11&RC[-24])&IF(RC[-23]="",,"|n"&R1C12&RC[-23])&IF(RC[-22]="",,"|n"&R1C13&RC[-22])&IF(RC[-20]&RC[-19]&RC[-18]&RC[-17]&RC[-16]&RC[-15]&RC[-14]&RC[-13]&RC[-12]&RC[-11]&RC[-10]&RC[-9]&RC[-8]="",,"|n"&R1C14)&IF(RC[-20]="",,"|n"&R1C15&RC[-20])&IF(RC[-19]="",,"|n"&R1C16&RC[-19])&IF(RC[-18]="",,"|n"&R1C17&RC[-18])&IF(RC[-17]="",,"|n"&R1C18&RC[-17])&IF(RC[-16]="",,"|n"&R1C19&RC[-16])&IF(RC[-15]="",,"|n"&R1C20&RC[-15])&IF(RC[-14]="",,"|n"&R1C21&RC[-14])&IF(RC[-13]="",,"|n"&R1C22&RC[-13])&IF(RC[-12]="",,"|n"&R1C23&RC[-12])&IF(RC[-11]="",,"|n"&R1C24&RC[-11])&IF(RC[-10]="",,"|n"&R1C25&RC[-10])&IF(RC[-9]="",,"|n"&R1C26&RC[-9])&IF(RC[-8]="",,"|n"&R1C27&RC[-8])&IF(RC[-6]&RC[-5]&RC[-4]="",,"|n"&R1C28)&IF(RC[-6]="",,"|n"&R1C29&RC[-6])&IF(RC[-5]="",,"|n"&R1C30&RC[-5])&IF(RC[-4]="",,"|n"&R1C31&RC[-4])&IF(RC[-2]="",,"|n"&RC[-2]) -> |n|cFFFFFF55附加属性|r(%)|n伤害抵抗:3|n力量增幅:2|n敏捷增幅:2|n智力增幅:2|n扭曲魔石+扭曲妖石+扭曲邪石+扭曲怪石 = 扭曲结晶
C120: E | D120: [扭曲神殿] | E120: 扭曲妖石 | V120: 3 | Y120: 2 | Z120: 2 | AA120: 2 | AG120: 扭曲魔石+扭曲妖石+扭曲邪石+扭曲怪石 = 扭曲结晶 | AH120: =VLOOKUP(RC[-31],Sheet2!R1C1:R7C2,2,0)&RC[-30]&RC[-29]&RC[-28]&Sheet2!R1C3&"" -> |CFFFFFFFF[扭曲神殿]扭曲妖石|r | AI120: =IF(RC[-27]&RC[-26]&RC[-25]&RC[-24]&RC[-23]&RC[-22]="",,R1C7)&IF(RC[-27]="",,"|n"&R1C8&RC[-27])&IF(RC[-26]="",,"|n"&R1C9&RC[-26])&IF(RC[-25]="",,"|n"&R1C10&RC[-25])&IF(RC[-24]="",,"|n"&R1C11&RC[-24])&IF(RC[-23]="",,"|n"&R1C12&RC[-23])&IF(RC[-22]="",,"|n"&R1C13&RC[-22])&IF(RC[-20]&RC[-19]&RC[-18]&RC[-17]&RC[-16]&RC[-15]&RC[-14]&RC[-13]&RC[-12]&RC[-11]&RC[-10]&RC[-9]&RC[-8]="",,"|n"&R1C14)&IF(RC[-20]="",,"|n"&R1C15&RC[-20])&IF(RC[-19]="",,"|n"&R1C16&RC[-19])&IF(RC[-18]="",,"|n"&R1C17&RC[-18])&IF(RC[-17]="",,"|n"&R1C18&RC[-17])&IF(RC[-16]="",,"|n"&R1C19&RC[-16])&IF(RC[-15]="",,"|n"&R1C20&RC[-15])&IF(RC[-14]="",,"|n"&R1C21&RC[-14])&IF(RC[-13]="",,"|n"&R1C22&RC[-13])&IF(RC[-12]="",,"|n"&R1C23&RC[-12])&IF(RC[-11]="",,"|n"&R1C24&RC[-11])&IF(RC[-10]="",,"|n"&R1C25&RC[-10])&IF(RC[-9]="",,"|n"&R1C26&RC[-9])&IF(RC[-8]="",,"|n"&R1C27&RC[-8])&IF(RC[-6]&RC[-5]&RC[-4]="",,"|n"&R1C28)&IF(RC[-6]="",,"|n"&R1C29&RC[-6])&IF(RC[-5]="",,"|n"&R1C30&RC[-5])&IF(RC[-4]="",,"|n"&R1C31&RC[-4])&IF(RC[-2]="",,"|n"&RC[-2]) -> |n|cFFFFFF55附加属性|r(%)|n伤害抵抗:3|n力量增幅:2|n敏捷增幅:2|n智力增幅:2|n扭曲魔石+扭曲妖石+扭曲邪石+扭曲怪石 = 扭曲结晶
C121: E | D121: [扭曲神殿] | E121: 扭曲邪石 | V121: 3 | Y121: 2 | Z121: 2 | AA121: 2 | AG121: 扭曲魔石+扭曲妖石+扭曲邪石+扭曲怪石 = 扭曲结晶 | AH121: =VLOOKUP(RC[-31],Sheet2!R1C1:R7C2,2,0)&RC[-30]&RC[-29]&RC[-28]&Sheet2!R1C3&"" -> |CFFFFFFFF[扭曲神殿]扭曲邪石|r | AI121: =IF(RC[-27]&RC[-26]&RC[-25]&RC[-24]&RC[-23]&RC[-22]="",,R1C7)&IF(RC[-27]="",,"|n"&R1C8&RC[-27])&IF(RC[-26]="",,"|n"&R1C9&RC[-26])&IF(RC[-25]="",,"|n"&R1C10&RC[-25])&IF(RC[-24]="",,"|n"&R1C11&RC[-24])&IF(RC[-23]="",,"|n"&R1C12&RC[-23])&IF(RC[-22]="",,"|n"&R1C13&RC[-22])&IF(RC[-20]&RC[-19]&RC[-18]&RC[-17]&RC[-16]&RC[-15]&RC[-14]&RC[-13]&RC[-12]&RC[-11]&RC[-10]&RC[-9]&RC[-8]="",,"|n"&R1C14)&IF(RC[-20]="",,"|n"&R1C15&RC[-20])&IF(RC[-19]="",,"|n"&R1C16&RC[-19])&IF(RC[-18]="",,"|n"&R1C17&RC[-18])&IF(RC[-17]="",,"|n"&R1C18&RC[-17])&IF(RC[-16]="",,"|n"&R1C19&RC[-16])&IF(RC[-15]="",,"|n"&R1C20&RC[-15])&IF(RC[-14]="",,"|n"&R1C21&RC[-14])&IF(RC[-13]="",,"|n"&R1C22&RC[-13])&IF(RC[-12]="",,"|n"&R1C23&RC[-12])&IF(RC[-11]="",,"|n"&R1C24&RC[-11])&IF(RC[-10]="",,"|n"&R1C25&RC[-10])&IF(RC[-9]="",,"|n"&R1C26&RC[-9])&IF(RC[-8]="",,"|n"&R1C27&RC[-8])&IF(RC[-6]&RC[-5]&RC[-4]="",,"|n"&R1C28)&IF(RC[-6]="",,"|n"&R1C29&RC[-6])&IF(RC[-5]="",,"|n"&R1C30&RC[-5])&IF(RC[-4]="",,"|n"&R1C31&RC[-4])&IF(RC[-2]="",,"|n"&RC[-2]) -> |n|cFFFFFF55附加属性|r(%)|n伤害抵抗:3|n力量增幅:2|n敏捷增幅:2|n智力增幅:2|n扭曲魔石+扭曲妖石+扭曲邪石+扭曲怪石 = 扭曲结晶
C122: E | D122: [扭曲神殿] | E122: 扭曲怪石 | V122: 3 | Y122: 2 | Z122: 2 | AA122: 2 | AG122: 扭曲魔石+扭曲妖石+扭曲邪石+扭曲怪石 = 扭曲结晶 | AH122: =VLOOKUP(RC[-31],Sheet2!R1C1:R7C2,2,0)&RC[-30]&RC[-29]&RC[-28]&Sheet2!R1C3&"" -> |CFFFFFFFF[扭曲神殿]扭曲怪石|r | AI122: =IF(RC[-27]&RC[-26]&RC[-25]&RC[-24]&RC[-23]&RC[-22]="",,R1C7)&IF(RC[-27]="",,"|n"&R1C8&RC[-27])&IF(RC[-26]="",,"|n"&R1C9&RC[-26])&IF(RC[-25]="",,"|n"&R1C10&RC[-25])&IF(RC[-24]="",,"|n"&R1C11&RC[-24])&IF(RC[-23]="",,"|n"&R1C12&RC[-23])&IF(RC[-22]="",,"|n"&R1C13&RC[-22])&IF(RC[-20]&RC[-19]&RC[-18]&RC[-17]&RC[-16]&RC[-15]&RC[-14]&RC[-13]&RC[-12]&RC[-11]&RC[-10]&RC[-9]&RC[-8]="",,"|n"&R1C14)&IF(RC[-20]="",,"|n"&R1C15&RC[-20])&IF(RC[-19]="",,"|n"&R1C16&RC[-19])&IF(RC[-18]="",,"|n"&R1C17&RC[-18])&IF(RC[-17]="",,"|n"&R1C18&RC[-17])&IF(RC[-16]="",,"|n"&R1C19&RC[-16])&IF(RC[-15]="",,"|n"&R1C20&RC[-15])&IF(RC[-14]="",,"|n"&R1C21&RC[-14])&IF(RC[-13]="",,"|n"&R1C22&RC[-13])&IF(RC[-12]="",,"|n"&R1C23&RC[-12])&IF(RC[-11]="",,"|n"&R1C24&RC[-11])&IF(RC[-10]="",,"|n"&R1C25&RC[-10])&IF(RC[-9]="",,"|n"&R1C26&RC[-9])&IF(RC[-8]="",,"|n"&R1C27&RC[-8])&IF(RC[-6]&RC[-5]&RC[-4]="",,"|n"&R1C28)&IF(RC[-6]="",,"|n"&R1C29&RC[-6])&IF(RC[-5]="",,"|n"&R1C30&RC[-5])&IF(RC[-4]="",,"|n"&R1C31&RC[-4])&IF(RC[-2]="",,"|n"&RC[-2]) -> |n|cFFFFFF55附加属性|r(%)|n伤害抵抗:3|n力量增幅:2|n敏捷增幅:2|n智力增幅:2|n扭曲魔石+扭曲妖石+扭曲邪石+扭曲怪石 = 扭曲结晶
C123: B | D123: [扭曲神殿] | E123: 扭曲结晶 | V123: 10 | Y123: 6 | Z123: 6 | AA123: 6 | AG123: 扭曲结晶+扭曲金属+虚空魔石 = 扭曲虚空之核 | AH123: =VLOOKUP(RC[-31],Sheet2!R1C1:R7C2,2,0)&RC[-30]&RC[-29]&RC[-28]&Sheet2!R1C3&"" -> |cFF99FF66[扭曲神殿]扭曲结晶|r | AI123: =IF(RC[-27]&RC[-26]&RC[-25]&RC[-24]&RC[-23]&RC[-22]="",,R1C7)&IF(RC[-27]="",,"|n"&R1C8&RC[-27])&IF(RC[-26]="",,"|n"&R1C9&RC[-26])&IF(RC[-25]="",,"|n"&R1C10&RC[-25])&IF(RC[-24]="",,"|n"&R1C11&RC[-24])&IF(RC[-23]="",,"|n"&R1C12&RC[-23])&IF(RC[-22]="",,"|n"&R1C13&RC[-22])&IF(RC[-20]&RC[-19]&RC[-18]&RC[-17]&RC[-16]&RC[-15]&RC[-14]&RC[-13]&RC[-12]&RC[-11]&RC[-10]&RC[-9]&RC[-8]="",,"|n"&R1C14)&IF(RC[-20]="",,"|n"&R1C15&RC[-20])&IF(RC[-19]="",,"|n"&R1C16&RC[-19])&IF(RC[-18]="",,"|n"&R1C17&RC[-18])&IF(RC[-17]="",,"|n"&R1C18&RC[-17])&IF(RC[-16]="",,"|n"&R1C19&RC[-16])&IF(RC[-15]="",,"|n"&R1C20&RC[-15])&IF(RC[-14]="",,"|n"&R1C21&RC[-14])&IF(RC[-13]="",,"|n"&R1C22&RC[-13])&IF(RC[-12]="",,"|n"&R1C23&RC[-12])&IF(RC[-11]="",,"|n"&R1C24&RC[-11])&IF(RC[-10]="",,"|n"&R1C25&RC[-10])&IF(RC[-9]="",,"|n"&R1C26&RC[-9])&IF(RC[-8]="",,"|n"&R1C27&RC[-8])&IF(RC[-6]&RC[-5]&RC[-4]="",,"|n"&R1C28)&IF(RC[-6]="",,"|n"&R1C29&RC[-6])&IF(RC[-5]="",,"|n"&R1C30&RC[-5])&IF(RC[-4]="",,"|n"&R1C31&RC[-4])&IF(RC[-2]="",,"|n"&RC[-2]) -> |n|cFFFFFF55附加属性|r(%)|n伤害抵抗:10|n力量增幅:6|n敏捷增幅:6|n智力增幅:6|n扭曲结晶+扭曲金属+虚空魔石 = 扭曲虚空之核
C124: D | D124: [扭曲神殿] | E124: 扭曲的书 | I124: 50000 | J124: 50000 | K124: 50000 | S124: 10 | AG124: 扭曲的书+扭曲的枪+扭曲的棒+扭曲的杖 = 扭曲金属 | AH124: =VLOOKUP(RC[-31],Sheet2!R1C1:R7C2,2,0)&RC[-30]&RC[-29]&RC[-28]&Sheet2!R1C3&"" -> |CFFB6D7A8[扭曲神殿]扭曲的书|r | AI124: =IF(RC[-27]&RC[-26]&RC[-25]&RC[-24]&RC[-23]&RC[-22]="",,R1C7)&IF(RC[-27]="",,"|n"&R1C8&RC[-27])&IF(RC[-26]="",,"|n"&R1C9&RC[-26])&IF(RC[-25]="",,"|n"&R1C10&RC[-25])&IF(RC[-24]="",,"|n"&R1C11&RC[-24])&IF(RC[-23]="",,"|n"&R1C12&RC[-23])&IF(RC[-22]="",,"|n"&R1C13&RC[-22])&IF(RC[-20]&RC[-19]&RC[-18]&RC[-17]&RC[-16]&RC[-15]&RC[-14]&RC[-13]&RC[-12]&RC[-11]&RC[-10]&RC[-9]&RC[-8]="",,"|n"&R1C14)&IF(RC[-20]="",,"|n"&R1C15&RC[-20])&IF(RC[-19]="",,"|n"&R1C16&RC[-19])&IF(RC[-18]="",,"|n"&R1C17&RC[-18])&IF(RC[-17]="",,"|n"&R1C18&RC[-17])&IF(RC[-16]="",,"|n"&R1C19&RC[-16])&IF(RC[-15]="",,"|n"&R1C20&RC[-15])&IF(RC[-14]="",,"|n"&R1C21&RC[-14])&IF(RC[-13]="",,"|n"&R1C22&RC[-13])&IF(RC[-12]="",,"|n"&R1C23&RC[-12])&IF(RC[-11]="",,"|n"&R1C24&RC[-11])&IF(RC[-10]="",,"|n"&R1C25&RC[-10])&IF(RC[-9]="",,"|n"&R1C26&RC[-9])&IF(RC[-8]="",,"|n"&R1C27&RC[-8])&IF(RC[-6]&RC[-5]&RC[-4]="",,"|n"&R1C28)&IF(RC[-6]="",,"|n"&R1C29&RC[-6])&IF(RC[-5]="",,"|n"&R1C30&RC[-5])&IF(RC[-4]="",,"|n"&R1C31&RC[-4])&IF(RC[-2]="",,"|n"&RC[-2]) -> |cFFFFFF99基础属性|r|n力量:50000|n敏捷:50000|n智力:50000|n|cFFFFFF55附加属性|r(%)|n伤害增幅:10|n扭曲的书+扭曲的枪+扭曲的棒+扭曲的杖 = 扭曲金属
C125: D | D125: [扭曲神殿] | E125: 扭曲的枪 | H125: 150000 | S125: 10 | AG125: 扭曲的书+扭曲的枪+扭曲的棒+扭曲的杖 = 扭曲金属 | AH125: =VLOOKUP(RC[-31],Sheet2!R1C1:R7C2,2,0)&RC[-30]&RC[-29]&RC[-28]&Sheet2!R1C3&"" -> |CFFB6D7A8[扭曲神殿]扭曲的枪|r | AI125: =IF(RC[-27]&RC[-26]&RC[-25]&RC[-24]&RC[-23]&RC[-22]="",,R1C7)&IF(RC[-27]="",,"|n"&R1C8&RC[-27])&IF(RC[-26]="",,"|n"&R1C9&RC[-26])&IF(RC[-25]="",,"|n"&R1C10&RC[-25])&IF(RC[-24]="",,"|n"&R1C11&RC[-24])&IF(RC[-23]="",,"|n"&R1C12&RC[-23])&IF(RC[-22]="",,"|n"&R1C13&RC[-22])&IF(RC[-20]&RC[-19]&RC[-18]&RC[-17]&RC[-16]&RC[-15]&RC[-14]&RC[-13]&RC[-12]&RC[-11]&RC[-10]&RC[-9]&RC[-8]="",,"|n"&R1C14)&IF(RC[-20]="",,"|n"&R1C15&RC[-20])&IF(RC[-19]="",,"|n"&R1C16&RC[-19])&IF(RC[-18]="",,"|n"&R1C17&RC[-18])&IF(RC[-17]="",,"|n"&R1C18&RC[-17])&IF(RC[-16]="",,"|n"&R1C19&RC[-16])&IF(RC[-15]="",,"|n"&R1C20&RC[-15])&IF(RC[-14]="",,"|n"&R1C21&RC[-14])&IF(RC[-13]="",,"|n"&R1C22&RC[-13])&IF(RC[-12]="",,"|n"&R1C23&RC[-12])&IF(RC[-11]="",,"|n"&R1C24&RC[-11])&IF(RC[-10]="",,"|n"&R1C25&RC[-10])&IF(RC[-9]="",,"|n"&R1C26&RC[-9])&IF(RC[-8]="",,"|n"&R1C27&RC[-8])&IF(RC[-6]&RC[-5]&RC[-4]="",,"|n"&R1C28)&IF(RC[-6]="",,"|n"&R1C29&RC[-6])&IF(RC[-5]="",,"|n"&R1C30&RC[-5])&IF(RC[-4]="",,"|n"&R1C31&RC[-4])&IF(RC[-2]="",,"|n"&RC[-2]) -> |cFFFFFF99基础属性|r|n攻击:150000|n|cFFFFFF55附加属性|r(%)|n伤害增幅:10|n扭曲的书+扭曲的枪+扭曲的棒+扭曲的杖 = 扭曲金属
C126: D | D126: [扭曲神殿] | E126: 扭曲的棒 | H126: 150000 | S126: 10 | AG126: 扭曲的书+扭曲的枪+扭曲的棒+扭曲的杖 = 扭曲金属 | AH126: =VLOOKUP(RC[-31],Sheet2!R1C1:R7C2,2,0)&RC[-30]&RC[-29]&RC[-28]&Sheet2!R1C3&"" -> |CFFB6D7A8[扭曲神殿]扭曲的棒|r | AI126: =IF(RC[-27]&RC[-26]&RC[-25]&RC[-24]&RC[-23]&RC[-22]="",,R1C7)&IF(RC[-27]="",,"|n"&R1C8&RC[-27])&IF(RC[-26]="",,"|n"&R1C9&RC[-26])&IF(RC[-25]="",,"|n"&R1C10&RC[-25])&IF(RC[-24]="",,"|n"&R1C11&RC[-24])&IF(RC[-23]="",,"|n"&R1C12&RC[-23])&IF(RC[-22]="",,"|n"&R1C13&RC[-22])&IF(RC[-20]&RC[-19]&RC[-18]&RC[-17]&RC[-16]&RC[-15]&RC[-14]&RC[-13]&RC[-12]&RC[-11]&RC[-10]&RC[-9]&RC[-8]="",,"|n"&R1C14)&IF(RC[-20]="",,"|n"&R1C15&RC[-20])&IF(RC[-19]="",,"|n"&R1C16&RC[-19])&IF(RC[-18]="",,"|n"&R1C17&RC[-18])&IF(RC[-17]="",,"|n"&R1C18&RC[-17])&IF(RC[-16]="",,"|n"&R1C19&RC[-16])&IF(RC[-15]="",,"|n"&R1C20&RC[-15])&IF(RC[-14]="",,"|n"&R1C21&RC[-14])&IF(RC[-13]="",,"|n"&R1C22&RC[-13])&IF(RC[-12]="",,"|n"&R1C23&RC[-12])&IF(RC[-11]="",,"|n"&R1C24&RC[-11])&IF(RC[-10]="",,"|n"&R1C25&RC[-10])&IF(RC[-9]="",,"|n"&R1C26&RC[-9])&IF(RC[-8]="",,"|n"&R1C27&RC[-8])&IF(RC[-6]&RC[-5]&RC[-4]="",,"|n"&R1C28)&IF(RC[-6]="",,"|n"&R1C29&RC[-6])&IF(RC[-5]="",,"|n"&R1C30&RC[-5])&IF(RC[-4]="",,"|n"&R1C31&RC[-4])&IF(RC[-2]="",,"|n"&RC[-2]) -> |cFFFFFF99基础属性|r|n攻击:150000|n|cFFFFFF55附加属性|r(%)|n伤害增幅:10|n扭曲的书+扭曲的枪+扭曲的棒+扭曲的杖 = 扭曲金属
C127: D | D127: [扭曲神殿] | E127: 扭曲的杖 | I127: 50000 | J127: 50000 | K127: 50000 | S127: 10 | AG127: 扭曲的书+扭曲的枪+扭曲的棒+扭曲的杖 = 扭曲金属 | AH127: =VLOOKUP(RC[-31],Sheet2!R1C1:R7C2,2,0)&RC[-30]&RC[-29]&RC[-28]&Sheet2!R1C3&"" -> |CFFB6D7A8[扭曲神殿]扭曲的杖|r | AI127: =IF(RC[-27]&RC[-26]&RC[-25]&RC[-24]&RC[-23]&RC[-22]="",,R1C7)&IF(RC[-27]="",,"|n"&R1C8&RC[-27])&IF(RC[-26]="",,"|n"&R1C9&RC[-26])&IF(RC[-25]="",,"|n"&R1C10&RC[-25])&IF(RC[-24]="",,"|n"&R1C11&RC[-24])&IF(RC[-23]="",,"|n"&R1C12&RC[-23])&IF(RC[-22]="",,"|n"&R1C13&RC[-22])&IF(RC[-20]&RC[-19]&RC[-18]&RC[-17]&RC[-16]&RC[-15]&RC[-14]&RC[-13]&RC[-12]&RC[-11]&RC[-10]&RC[-9]&RC[-8]="",,"|n"&R1C14)&IF(RC[-20]="",,"|n"&R1C15&RC[-20])&IF(RC[-19]="",,"|n"&R1C16&RC[-19])&IF(RC[-18]="",,"|n"&R1C17&RC[-18])&IF(RC[-17]="",,"|n"&R1C18&RC[-17])&IF(RC[-16]="",,"|n"&R1C19&RC[-16])&IF(RC[-15]="",,"|n"&R1C20&RC[-15])&IF(RC[-14]="",,"|n"&R1C21&RC[-14])&IF(RC[-13]="",,"|n"&R1C22&RC[-13])&IF(RC[-12]="",,"|n"&R1C23&RC[-12])&IF(RC[-11]="",,"|n"&R1C24&RC[-11])&IF(RC[-10]="",,"|n"&R1C25&RC[-10])&IF(RC[-9]="",,"|n"&R1C26&RC[-9])&IF(RC[-8]="",,"|n"&R1C27&RC[-8])&IF(RC[-6]&RC[-5]&RC[-4]="",,"|n"&R1C28)&IF(RC[-6]="",,"|n"&R1C29&RC[-6])&IF(RC[-5]="",,"|n"&R1C30&RC[-5])&IF(RC[-4]="",,"|n"&R1C31&RC[-4])&IF(RC[-2]="",,"|n"&RC[-2]) -> |cFFFFFF99基础属性|r|n力量:50000|n敏捷:50000|n智力:50000|n|cFFFFFF55附加属性|r(%)|n伤害增幅:10|n扭曲的书+扭曲的枪+扭曲的棒+扭曲的杖 = 扭曲金属
C128: B | D128: [扭曲神殿] | E128: 扭曲金属 | H128: 300000 | I128: 100000 | J128: 100000 | K128: 100000 | S128: 40 | AG128: 扭曲结晶+扭曲金属+虚空魔石 = 扭曲虚空之核 | AH128: =VLOOKUP(RC[-31],Sheet2!R1C1:R7C2,2,0)&RC[-30]&RC[-29]&RC[-28]&Sheet2!R1C3&"" -> |cFF99FF66[扭曲神殿]扭曲金属|r | AI128: =IF(RC[-27]&RC[-26]&RC[-25]&RC[-24]&RC[-23]&RC[-22]="",,R1C7)&IF(RC[-27]="",,"|n"&R1C8&RC[-27])&IF(RC[-26]="",,"|n"&R1C9&RC[-26])&IF(RC[-25]="",,"|n"&R1C10&RC[-25])&IF(RC[-24]="",,"|n"&R1C11&RC[-24])&IF(RC[-23]="",,"|n"&R1C12&RC[-23])&IF(RC[-22]="",,"|n"&R1C13&RC[-22])&IF(RC[-20]&RC[-19]&RC[-18]&RC[-17]&RC[-16]&RC[-15]&RC[-14]&RC[-13]&RC[-12]&RC[-11]&RC[-10]&RC[-9]&RC[-8]="",,"|n"&R1C14)&IF(RC[-20]="",,"|n"&R1C15&RC[-20])&IF(RC[-19]="",,"|n"&R1C16&RC[-19])&IF(RC[-18]="",,"|n"&R1C17&RC[-18])&IF(RC[-17]="",,"|n"&R1C18&RC[-17])&IF(RC[-16]="",,"|n"&R1C19&RC[-16])&IF(RC[-15]="",,"|n"&R1C20&RC[-15])&IF(RC[-14]="",,"|n"&R1C21&RC[-14])&IF(RC[-13]="",,"|n"&R1C22&RC[-13])&IF(RC[-12]="",,"|n"&R1C23&RC[-12])&IF(RC[-11]="",,"|n"&R1C24&RC[-11])&IF(RC[-10]="",,"|n"&R1C25&RC[-10])&IF(RC[-9]="",,"|n"&R1C26&RC[-9])&IF(RC[-8]="",,"|n"&R1C27&RC[-8])&IF(RC[-6]&RC[-5]&RC[-4]="",,"|n"&R1C28)&IF(RC[-6]="",,"|n"&R1C29&RC[-6])&IF(RC[-5]="",,"|n"&R1C30&RC[-5])&IF(RC[-4]="",,"|n"&R1C31&RC[-4])&IF(RC[-2]="",,"|n"&RC[-2]) -> |cFFFFFF99基础属性|r|n攻击:300000|n力量:100000|n敏捷:100000|n智力:100000|n|cFFFFFF55附加属性|r(%)|n伤害增幅:40|n扭曲结晶+扭曲金属+虚空魔石 = 扭曲虚空之核
C129: C | D129: [扭曲神殿] | E129: 虚空水晶 | I129: 300000 | J129: 300000 | K129: 300000 | W129: 20 | AG129: 虚空水晶+虚空触角 = 虚空魔石 | AH129: =VLOOKUP(RC[-31],Sheet2!R1C1:R7C2,2,0)&RC[-30]&RC[-29]&RC[-28]&Sheet2!R1C3&"" -> |cFF99FF66[扭曲神殿]虚空水晶|r | AI129: =IF(RC[-27]&RC[-26]&RC[-25]&RC[-24]&RC[-23]&RC[-22]="",,R1C7)&IF(RC[-27]="",,"|n"&R1C8&RC[-27])&IF(RC[-26]="",,"|n"&R1C9&RC[-26])&IF(RC[-25]="",,"|n"&R1C10&RC[-25])&IF(RC[-24]="",,"|n"&R1C11&RC[-24])&IF(RC[-23]="",,"|n"&R1C12&RC[-23])&IF(RC[-22]="",,"|n"&R1C13&RC[-22])&IF(RC[-20]&RC[-19]&RC[-18]&RC[-17]&RC[-16]&RC[-15]&RC[-14]&RC[-13]&RC[-12]&RC[-11]&RC[-10]&RC[-9]&RC[-8]="",,"|n"&R1C14)&IF(RC[-20]="",,"|n"&R1C15&RC[-20])&IF(RC[-19]="",,"|n"&R1C16&RC[-19])&IF(RC[-18]="",,"|n"&R1C17&RC[-18])&IF(RC[-17]="",,"|n"&R1C18&RC[-17])&IF(RC[-16]="",,"|n"&R1C19&RC[-16])&IF(RC[-15]="",,"|n"&R1C20&RC[-15])&IF(RC[-14]="",,"|n"&R1C21&RC[-14])&IF(RC[-13]="",,"|n"&R1C22&RC[-13])&IF(RC[-12]="",,"|n"&R1C23&RC[-12])&IF(RC[-11]="",,"|n"&R1C24&RC[-11])&IF(RC[-10]="",,"|n"&R1C25&RC[-10])&IF(RC[-9]="",,"|n"&R1C26&RC[-9])&IF(RC[-8]="",,"|n"&R1C27&RC[-8])&IF(RC[-6]&RC[-5]&RC[-4]="",,"|n"&R1C28)&IF(RC[-6]="",,"|n"&R1C29&RC[-6])&IF(RC[-5]="",,"|n"&R1C30&RC[-5])&IF(RC[-4]="",,"|n"&R1C31&RC[-4])&IF(RC[-2]="",,"|n"&RC[-2]) -> |cFFFFFF99基础属性|r|n力量:300000|n敏捷:300000|n智力:300000|n|cFFFFFF55附加属性|r(%)|n伤害减免:20|n虚空水晶+虚空触角 = 虚空魔石
C130: C | D130: [扭曲神殿] | E130: 虚空触角 | Y130: 5 | Z130: 5 | AA130: 5 | AG130: 虚空水晶+虚空触角 = 虚空魔石 | AH130: =VLOOKUP(RC[-31],Sheet2!R1C1:R7C2,2,0)&RC[-30]&RC[-29]&RC[-28]&Sheet2!R1C3&"" -> |cFF99FF66[扭曲神殿]虚空触角|r | AI130: =IF(RC[-27]&RC[-26]&RC[-25]&RC[-24]&RC[-23]&RC[-22]="",,R1C7)&IF(RC[-27]="",,"|n"&R1C8&RC[-27])&IF(RC[-26]="",,"|n"&R1C9&RC[-26])&IF(RC[-25]="",,"|n"&R1C10&RC[-25])&IF(RC[-24]="",,"|n"&R1C11&RC[-24])&IF(RC[-23]="",,"|n"&R1C12&RC[-23])&IF(RC[-22]="",,"|n"&R1C13&RC[-22])&IF(RC[-20]&RC[-19]&RC[-18]&RC[-17]&RC[-16]&RC[-15]&RC[-14]&RC[-13]&RC[-12]&RC[-11]&RC[-10]&RC[-9]&RC[-8]="",,"|n"&R1C14)&IF(RC[-20]="",,"|n"&R1C15&RC[-20])&IF(RC[-19]="",,"|n"&R1C16&RC[-19])&IF(RC[-18]="",,"|n"&R1C17&RC[-18])&IF(RC[-17]="",,"|n"&R1C18&RC[-17])&IF(RC[-16]="",,"|n"&R1C19&RC[-16])&IF(RC[-15]="",,"|n"&R1C20&RC[-15])&IF(RC[-14]="",,"|n"&R1C21&RC[-14])&IF(RC[-13]="",,"|n"&R1C22&RC[-13])&IF(RC[-12]="",,"|n"&R1C23&RC[-12])&IF(RC[-11]="",,"|n"&R1C24&RC[-11])&IF(RC[-10]="",,"|n"&R1C25&RC[-10])&IF(RC[-9]="",,"|n"&R1C26&RC[-9])&IF(RC[-8]="",,"|n"&R1C27&RC[-8])&IF(RC[-6]&RC[-5]&RC[-4]="",,"|n"&R1C28)&IF(RC[-6]="",,"|n"&R1C29&RC[-6])&IF(RC[-5]="",,"|n"&R1C30&RC[-5])&IF(RC[-4]="",,"|n"&R1C31&RC[-4])&IF(RC[-2]="",,"|n"&RC[-2]) -> |n|cFFFFFF55附加属性|r(%)|n力量增幅:5|n敏捷增幅:5|n智力增幅:5|n虚空水晶+虚空触角 = 虚空魔石
C131: B | D131: [扭曲神殿] | E131: 虚空魔石 | I131: 400000 | J131: 400000 | K131: 400000 | W131: 20 | Y131: 5 | Z131: 5 | AA131: 5 | AG131: 扭曲结晶+扭曲金属+虚空魔石 = 扭曲虚空之核 | AH131: =VLOOKUP(RC[-31],Sheet2!R1C1:R7C2,2,0)&RC[-30]&RC[-29]&RC[-28]&Sheet2!R1C3&"" -> |cFF99FF66[扭曲神殿]虚空魔石|r | AI131: =IF(RC[-27]&RC[-26]&RC[-25]&RC[-24]&RC[-23]&RC[-22]="",,R1C7)&IF(RC[-27]="",,"|n"&R1C8&RC[-27])&IF(RC[-26]="",,"|n"&R1C9&RC[-26])&IF(RC[-25]="",,"|n"&R1C10&RC[-25])&IF(RC[-24]="",,"|n"&R1C11&RC[-24])&IF(RC[-23]="",,"|n"&R1C12&RC[-23])&IF(RC[-22]="",,"|n"&R1C13&RC[-22])&IF(RC[-20]&RC[-19]&RC[-18]&RC[-17]&RC[-16]&RC[-15]&RC[-14]&RC[-13]&RC[-12]&RC[-11]&RC[-10]&RC[-9]&RC[-8]="",,"|n"&R1C14)&IF(RC[-20]="",,"|n"&R1C15&RC[-20])&IF(RC[-19]="",,"|n"&R1C16&RC[-19])&IF(RC[-18]="",,"|n"&R1C17&RC[-18])&IF(RC[-17]="",,"|n"&R1C18&RC[-17])&IF(RC[-16]="",,"|n"&R1C19&RC[-16])&IF(RC[-15]="",,"|n"&R1C20&RC[-15])&IF(RC[-14]="",,"|n"&R1C21&RC[-14])&IF(RC[-13]="",,"|n"&R1C22&RC[-13])&IF(RC[-12]="",,"|n"&R1C23&RC[-12])&IF(RC[-11]="",,"|n"&R1C24&RC[-11])&IF(RC[-10]="",,"|n"&R1C25&RC[-10])&IF(RC[-9]="",,"|n"&R1C26&RC[-9])&IF(RC[-8]="",,"|n"&R1C27&RC[-8])&IF(RC[-6]&RC[-5]&RC[-4]="",,"|n"&R1C28)&IF(RC[-6]="",,"|n"&R1C29&RC[-6])&IF(RC[-5]="",,"|n"&R1C30&RC[-5])&IF(RC[-4]="",,"|n"&R1C31&RC[-4])&IF(RC[-2]="",,"|n"&RC[-2]) -> |cFFFFFF99基础属性|r|n力量:400000|n敏捷:400000|n智力:400000|n|cFFFFFF55附加属性|r(%)|n伤害减免:20|n力量增幅:5|n敏捷增幅:5|n智力增幅:5|n扭曲结晶+扭曲金属+虚空魔石 = 扭曲虚空之核
C132: A | D132: [扭曲神殿] | E132: 扭曲虚空之核 | I132: 500000 | J132: 500000 | K132: 500000 | S132: 40 | V132: 10 | W132: 30 | Y132: 10 | Z132: 10 | AA132: 10 | AG132: 拥有奇特力量的宝石,不过似乎不太稳定! | AH132: =VLOOKUP(RC[-31],Sheet2!R1C1:R7C2,2,0)&RC[-30]&RC[-29]&RC[-28]&Sheet2!R1C3&"" -> |cFF99FF66[扭曲神殿]扭曲虚空之核|r | AI132: =IF(RC[-27]&RC[-26]&RC[-25]&RC[-24]&RC[-23]&RC[-22]="",,R1C7)&IF(RC[-27]="",,"|n"&R1C8&RC[-27])&IF(RC[-26]="",,"|n"&R1C9&RC[-26])&IF(RC[-25]="",,"|n"&R1C10&RC[-25])&IF(RC[-24]="",,"|n"&R1C11&RC[-24])&IF(RC[-23]="",,"|n"&R1C12&RC[-23])&IF(RC[-22]="",,"|n"&R1C13&RC[-22])&IF(RC[-20]&RC[-19]&RC[-18]&RC[-17]&RC[-16]&RC[-15]&RC[-14]&RC[-13]&RC[-12]&RC[-11]&RC[-10]&RC[-9]&RC[-8]="",,"|n"&R1C14)&IF(RC[-20]="",,"|n"&R1C15&RC[-20])&IF(RC[-19]="",,"|n"&R1C16&RC[-19])&IF(RC[-18]="",,"|n"&R1C17&RC[-18])&IF(RC[-17]="",,"|n"&R1C18&RC[-17])&IF(RC[-16]="",,"|n"&R1C19&RC[-16])&IF(RC[-15]="",,"|n"&R1C20&RC[-15])&IF(RC[-14]="",,"|n"&R1C21&RC[-14])&IF(RC[-13]="",,"|n"&R1C22&RC[-13])&IF(RC[-12]="",,"|n"&R1C23&RC[-12])&IF(RC[-11]="",,"|n"&R1C24&RC[-11])&IF(RC[-10]="",,"|n"&R1C25&RC[-10])&IF(RC[-9]="",,"|n"&R1C26&RC[-9])&IF(RC[-8]="",,"|n"&R1C27&RC[-8])&IF(RC[-6]&RC[-5]&RC[-4]="",,"|n"&R1C28)&IF(RC[-6]="",,"|n"&R1C29&RC[-6])&IF(RC[-5]="",,"|n"&R1C30&RC[-5])&IF(RC[-4]="",,"|n"&R1C31&RC[-4])&IF(RC[-2]="",,"|n"&RC[-2]) -> |cFFFFFF99基础属性|r|n力量:500000|n敏捷:500000|n智力:500000|n|cFFFFFF55附加属性|r(%)|n伤害增幅:40|n伤害抵抗:10|n伤害减免:30|n力量增幅:10|n敏捷增幅:10|n智力增幅:10|n拥有奇特力量的宝石,不过似乎不太稳定!
C133: A | D133: [扭曲神殿] | E133: 熔火熔岩 | W133: 10 | Y133: 5 | Z133: 5 | AA133: 5 | AG133: 拥有极高温度的熔岩! | AH133: =VLOOKUP(RC[-31],Sheet2!R1C1:R7C2,2,0)&RC[-30]&RC[-29]&RC[-28]&Sheet2!R1C3&"" -> |cFF99FF66[扭曲神殿]熔火熔岩|r | AI133: =IF(RC[-27]&RC[-26]&RC[-25]&RC[-24]&RC[-23]&RC[-22]="",,R1C7)&IF(RC[-27]="",,"|n"&R1C8&RC[-27])&IF(RC[-26]="",,"|n"&R1C9&RC[-26])&IF(RC[-25]="",,"|n"&R1C10&RC[-25])&IF(RC[-24]="",,"|n"&R1C11&RC[-24])&IF(RC[-23]="",,"|n"&R1C12&RC[-23])&IF(RC[-22]="",,"|n"&R1C13&RC[-22])&IF(RC[-20]&RC[-19]&RC[-18]&RC[-17]&RC[-16]&RC[-15]&RC[-14]&RC[-13]&RC[-12]&RC[-11]&RC[-10]&RC[-9]&RC[-8]="",,"|n"&R1C14)&IF(RC[-20]="",,"|n"&R1C15&RC[-20])&IF(RC[-19]="",,"|n"&R1C16&RC[-19])&IF(RC[-18]="",,"|n"&R1C17&RC[-18])&IF(RC[-17]="",,"|n"&R1C18&RC[-17])&IF(RC[-16]="",,"|n"&R1C19&RC[-16])&IF(RC[-15]="",,"|n"&R1C20&RC[-15])&IF(RC[-14]="",,"|n"&R1C21&RC[-14])&IF(RC[-13]="",,"|n"&R1C22&RC[-13])&IF(RC[-12]="",,"|n"&R1C23&RC[-12])&IF(RC[-11]="",,"|n"&R1C24&RC[-11])&IF(RC[-10]="",,"|n"&R1C25&RC[-10])&IF(RC[-9]="",,"|n"&R1C26&RC[-9])&IF(RC[-8]="",,"|n"&R1C27&RC[-8])&IF(RC[-6]&RC[-5]&RC[-4]="",,"|n"&R1C28)&IF(RC[-6]="",,"|n"&R1C29&RC[-6])&IF(RC[-5]="",,"|n"&R1C30&RC[-5])&IF(RC[-4]="",,"|n"&R1C31&RC[-4])&IF(RC[-2]="",,"|n"&RC[-2]) -> |n|cFFFFFF55附加属性|r(%)|n伤害减免:10|n力量增幅:5|n敏捷增幅:5|n智力增幅:5|n拥有极高温度的熔岩!
C134: S | D134: [扭曲神殿] | E134: 扭曲虚空魔核 | I134: 500000 | J134: 500000 | K134: 500000 | S134: 40 | V134: 10 | W134: 50 | Y134: 15 | Z134: 15 | AA134: 15 | AG134: 拥有奇特力量的宝石,拥有着不可思议的力量! | AH134: =VLOOKUP(RC[-31],Sheet2!R1C1:R7C2,2,0)&RC[-30]&RC[-29]&RC[-28]&Sheet2!R1C3&"" -> |cFFFF9933[扭曲神殿]扭曲虚空魔核|r | AI134: =IF(RC[-27]&RC[-26]&RC[-25]&RC[-24]&RC[-23]&RC[-22]="",,R1C7)&IF(RC[-27]="",,"|n"&R1C8&RC[-27])&IF(RC[-26]="",,"|n"&R1C9&RC[-26])&IF(RC[-25]="",,"|n"&R1C10&RC[-25])&IF(RC[-24]="",,"|n"&R1C11&RC[-24])&IF(RC[-23]="",,"|n"&R1C12&RC[-23])&IF(RC[-22]="",,"|n"&R1C13&RC[-22])&IF(RC[-20]&RC[-19]&RC[-18]&RC[-17]&RC[-16]&RC[-15]&RC[-14]&RC[-13]&RC[-12]&RC[-11]&RC[-10]&RC[-9]&RC[-8]="",,"|n"&R1C14)&IF(RC[-20]="",,"|n"&R1C15&RC[-20])&IF(RC[-19]="",,"|n"&R1C16&RC[-19])&IF(RC[-18]="",,"|n"&R1C17&RC[-18])&IF(RC[-17]="",,"|n"&R1C18&RC[-17])&IF(RC[-16]="",,"|n"&R1C19&RC[-16])&IF(RC[-15]="",,"|n"&R1C20&RC[-15])&IF(RC[-14]="",,"|n"&R1C21&RC[-14])&IF(RC[-13]="",,"|n"&R1C22&RC[-13])&IF(RC[-12]="",,"|n"&R1C23&RC[-12])&IF(RC[-11]="",,"|n"&R1C24&RC[-11])&IF(RC[-10]="",,"|n"&R1C25&RC[-10])&IF(RC[-9]="",,"|n"&R1C26&RC[-9])&IF(RC[-8]="",,"|n"&R1C27&RC[-8])&IF(RC[-6]&RC[-5]&RC[-4]="",,"|n"&R1C28)&IF(RC[-6]="",,"|n"&R1C29&RC[-6])&IF(RC[-5]="",,"|n"&R1C30&RC[-5])&IF(RC[-4]="",,"|n"&R1C31&RC[-4])&IF(RC[-2]="",,"|n"&RC[-2]) -> |cFFFFFF99基础属性|r|n力量:500000|n敏捷:500000|n智力:500000|n|cFFFFFF55附加属性|r(%)|n伤害增幅:40|n伤害抵抗:10|n伤害减免:50|n力量增幅:15|n敏捷增幅:15|n智力增幅:15|n拥有奇特力量的宝石,拥有着不可思议的力量!
C135: A | D135: [上古之神-克苏恩] | E135: 死亡之钉 | H135: 2000000 | R135: 100 | AH135: =VLOOKUP(RC[-31],Sheet2!R1C1:R7C2,2,0)&RC[-30]&RC[-29]&RC[-28]&Sheet2!R1C3&"" -> |cFF99FF66[上古之神-克苏恩]死亡之钉|r | AI135: =IF(RC[-27]&RC[-26]&RC[-25]&RC[-24]&RC[-23]&RC[-22]="",,R1C7)&IF(RC[-27]="",,"|n"&R1C8&RC[-27])&IF(RC[-26]="",,"|n"&R1C9&RC[-26])&IF(RC[-25]="",,"|n"&R1C10&RC[-25])&IF(RC[-24]="",,"|n"&R1C11&RC[-24])&IF(RC[-23]="",,"|n"&R1C12&RC[-23])&IF(RC[-22]="",,"|n"&R1C13&RC[-22])&IF(RC[-20]&RC[-19]&RC[-18]&RC[-17]="",,"|n"&R1C14)&IF(RC[-20]="",,"|n"&R1C15&RC[-20])&IF(RC[-19]="",,"|n"&R1C16&RC[-19])&IF(RC[-18]="",,"|n"&R1C17&RC[-18])&IF(RC[-17]="",,"|n"&R1C18&RC[-17])&IF(RC[-16]="",,"|n"&R1C19&RC[-16])&IF(RC[-15]="",,"|n"&R1C20&RC[-15])&IF(RC[-14]="",,"|n"&R1C21&RC[-14])&IF(RC[-13]="",,"|n"&R1C22&RC[-13])&IF(RC[-11]="",,"|n"&R1C24&RC[-11])&IF(RC[-10]="",,"|n"&R1C25&RC[-10])&IF(RC[-9]="",,"|n"&R1C26&RC[-9])&IF(RC[-8]="",,"|n"&R1C27&RC[-8])&IF(RC[-7]="",,"|n"&R1C28&RC[-7])&IF(RC[-6]="",,"|n"&R1C29&RC[-6])&IF(RC[-2]="",,"|n"&RC[-2]) -> |cFFFFFF99基础属性|r|n攻击:2000000|n|cFFFFFF55附加属性|r(%)|n暴击伤害:100
C136: A | D136: [上古之神-克苏恩] | E136: 克苏恩之眼 | I136: 1000000 | Y136: 25 | AH136: =VLOOKUP(RC[-31],Sheet2!R1C1:R7C2,2,0)&RC[-30]&RC[-29]&RC[-28]&Sheet2!R1C3&"" -> |cFF99FF66[上古之神-克苏恩]克苏恩之眼|r | AI136: =IF(RC[-27]&RC[-26]&RC[-25]&RC[-24]&RC[-23]&RC[-22]="",,R1C7)&IF(RC[-27]="",,"|n"&R1C8&RC[-27])&IF(RC[-26]="",,"|n"&R1C9&RC[-26])&IF(RC[-25]="",,"|n"&R1C10&RC[-25])&IF(RC[-24]="",,"|n"&R1C11&RC[-24])&IF(RC[-23]="",,"|n"&R1C12&RC[-23])&IF(RC[-22]="",,"|n"&R1C13&RC[-22])&IF(RC[-20]&RC[-19]&RC[-18]&RC[-17]="",,"|n"&R1C14)&IF(RC[-20]="",,"|n"&R1C15&RC[-20])&IF(RC[-19]="",,"|n"&R1C16&RC[-19])&IF(RC[-18]="",,"|n"&R1C17&RC[-18])&IF(RC[-17]="",,"|n"&R1C18&RC[-17])&IF(RC[-16]="",,"|n"&R1C19&RC[-16])&IF(RC[-15]="",,"|n"&R1C20&RC[-15])&IF(RC[-14]="",,"|n"&R1C21&RC[-14])&IF(RC[-13]="",,"|n"&R1C22&RC[-13])&IF(RC[-11]="",,"|n"&R1C24&RC[-11])&IF(RC[-10]="",,"|n"&R1C25&RC[-10])&IF(RC[-9]="",,"|n"&R1C26&RC[-9])&IF(RC[-8]="",,"|n"&R1C27&RC[-8])&IF(RC[-7]="",,"|n"&R1C28&RC[-7])&IF(RC[-6]="",,"|n"&R1C29&RC[-6])&IF(RC[-2]="",,"|n"&RC[-2]) -> |cFFFFFF99基础属性|r|n力量:1000000|n力量增幅:25
C137: A | D137: [上古之神-克苏恩] | E137: 堕落神明披风 | J137: 1000000 | Z137: 25 | AH137: =VLOOKUP(RC[-31],Sheet2!R1C1:R7C2,2,0)&RC[-30]&RC[-29]&RC[-28]&Sheet2!R1C3&"" -> |cFF99FF66[上古之神-克苏恩]堕落神明披风|r | AI137: =IF(RC[-27]&RC[-26]&RC[-25]&RC[-24]&RC[-23]&RC[-22]="",,R1C7)&IF(RC[-27]="",,"|n"&R1C8&RC[-27])&IF(RC[-26]="",,"|n"&R1C9&RC[-26])&IF(RC[-25]="",,"|n"&R1C10&RC[-25])&IF(RC[-24]="",,"|n"&R1C11&RC[-24])&IF(RC[-23]="",,"|n"&R1C12&RC[-23])&IF(RC[-22]="",,"|n"&R1C13&RC[-22])&IF(RC[-20]&RC[-19]&RC[-18]&RC[-17]="",,"|n"&R1C14)&IF(RC[-20]="",,"|n"&R1C15&RC[-20])&IF(RC[-19]="",,"|n"&R1C16&RC[-19])&IF(RC[-18]="",,"|n"&R1C17&RC[-18])&IF(RC[-17]="",,"|n"&R1C18&RC[-17])&IF(RC[-16]="",,"|n"&R1C19&RC[-16])&IF(RC[-15]="",,"|n"&R1C20&RC[-15])&IF(RC[-14]="",,"|n"&R1C21&RC[-14])&IF(RC[-13]="",,"|n"&R1C22&RC[-13])&IF(RC[-11]="",,"|n"&R1C24&RC[-11])&IF(RC[-10]="",,"|n"&R1C25&RC[-10])&IF(RC[-9]="",,"|n"&R1C26&RC[-9])&IF(RC[-8]="",,"|n"&R1C27&RC[-8])&IF(RC[-7]="",,"|n"&R1C28&RC[-7])&IF(RC[-6]="",,"|n"&R1C29&RC[-6])&IF(RC[-2]="",,"|n"&RC[-2]) -> |cFFFFFF99基础属性|r|n敏捷:1000000|n敏捷增幅:25
C138: A | D138: [上古之神-克苏恩] | E138: 上古之神的拥抱 | H138: 1000000 | I138: 300000 | J138: 300000 | K138: 300000 | T138: 20 | AH138: =VLOOKUP(RC[-31],Sheet2!R1C1:R7C2,2,0)&RC[-30]&RC[-29]&RC[-28]&Sheet2!R1C3&"" -> |cFF99FF66[上古之神-克苏恩]上古之神的拥抱|r | AI138: =IF(RC[-27]&RC[-26]&RC[-25]&RC[-24]&RC[-23]&RC[-22]="",,R1C7)&IF(RC[-27]="",,"|n"&R1C8&RC[-27])&IF(RC[-26]="",,"|n"&R1C9&RC[-26])&IF(RC[-25]="",,"|n"&R1C10&RC[-25])&IF(RC[-24]="",,"|n"&R1C11&RC[-24])&IF(RC[-23]="",,"|n"&R1C12&RC[-23])&IF(RC[-22]="",,"|n"&R1C13&RC[-22])&IF(RC[-20]&RC[-19]&RC[-18]&RC[-17]="",,"|n"&R1C14)&IF(RC[-20]="",,"|n"&R1C15&RC[-20])&IF(RC[-19]="",,"|n"&R1C16&RC[-19])&IF(RC[-18]="",,"|n"&R1C17&RC[-18])&IF(RC[-17]="",,"|n"&R1C18&RC[-17])&IF(RC[-16]="",,"|n"&R1C19&RC[-16])&IF(RC[-15]="",,"|n"&R1C20&RC[-15])&IF(RC[-14]="",,"|n"&R1C21&RC[-14])&IF(RC[-13]="",,"|n"&R1C22&RC[-13])&IF(RC[-11]="",,"|n"&R1C24&RC[-11])&IF(RC[-10]="",,"|n"&R1C25&RC[-10])&IF(RC[-9]="",,"|n"&R1C26&RC[-9])&IF(RC[-8]="",,"|n"&R1C27&RC[-8])&IF(RC[-7]="",,"|n"&R1C28&RC[-7])&IF(RC[-6]="",,"|n"&R1C29&RC[-6])&IF(RC[-2]="",,"|n"&RC[-2]) -> |cFFFFFF99基础属性|r|n攻击:1000000|n力量:300000|n敏捷:300000|n智力:300000|n附加伤害:20
C139: A | D139: [上古之神-尤格萨隆] | E139: 千喉坠饰 | J139: 1000000 | Z139: 25 | AH139: =VLOOKUP(RC[-31],Sheet2!R1C1:R7C2,2,0)&RC[-30]&RC[-29]&RC[-28]&Sheet2!R1C3&"" -> |cFF99FF66[上古之神-尤格萨隆]千喉坠饰|r | AI139: =IF(RC[-27]&RC[-26]&RC[-25]&RC[-24]&RC[-23]&RC[-22]="",,R1C7)&IF(RC[-27]="",,"|n"&R1C8&RC[-27])&IF(RC[-26]="",,"|n"&R1C9&RC[-26])&IF(RC[-25]="",,"|n"&R1C10&RC[-25])&IF(RC[-24]="",,"|n"&R1C11&RC[-24])&IF(RC[-23]="",,"|n"&R1C12&RC[-23])&IF(RC[-22]="",,"|n"&R1C13&RC[-22])&IF(RC[-20]&RC[-19]&RC[-18]&RC[-17]="",,"|n"&R1C14)&IF(RC[-20]="",,"|n"&R1C15&RC[-20])&IF(RC[-19]="",,"|n"&R1C16&RC[-19])&IF(RC[-18]="",,"|n"&R1C17&RC[-18])&IF(RC[-17]="",,"|n"&R1C18&RC[-17])&IF(RC[-16]="",,"|n"&R1C19&RC[-16])&IF(RC[-15]="",,"|n"&R1C20&RC[-15])&IF(RC[-14]="",,"|n"&R1C21&RC[-14])&IF(RC[-13]="",,"|n"&R1C22&RC[-13])&IF(RC[-11]="",,"|n"&R1C24&RC[-11])&IF(RC[-10]="",,"|n"&R1C25&RC[-10])&IF(RC[-9]="",,"|n"&R1C26&RC[-9])&IF(RC[-8]="",,"|n"&R1C27&RC[-8])&IF(RC[-7]="",,"|n"&R1C28&RC[-7])&IF(RC[-6]="",,"|n"&R1C29&RC[-6])&IF(RC[-2]="",,"|n"&RC[-2]) -> |cFFFFFF99基础属性|r|n敏捷:1000000|n敏捷增幅:25
C140: A | D140: [上古之神-尤格萨隆] | E140: 贪欲者胸甲 | L140: 6500000 | AH140: =VLOOKUP(RC[-31],Sheet2!R1C1:R7C2,2,0)&RC[-30]&RC[-29]&RC[-28]&Sheet2!R1C3&"" -> |cFF99FF66[上古之神-尤格萨隆]贪欲者胸甲|r | AI140: =IF(RC[-27]&RC[-26]&RC[-25]&RC[-24]&RC[-23]&RC[-22]="",,R1C7)&IF(RC[-27]="",,"|n"&R1C8&RC[-27])&IF(RC[-26]="",,"|n"&R1C9&RC[-26])&IF(RC[-25]="",,"|n"&R1C10&RC[-25])&IF(RC[-24]="",,"|n"&R1C11&RC[-24])&IF(RC[-23]="",,"|n"&R1C12&RC[-23])&IF(RC[-22]="",,"|n"&R1C13&RC[-22])&IF(RC[-20]&RC[-19]&RC[-18]&RC[-17]="",,"|n"&R1C14)&IF(RC[-20]="",,"|n"&R1C15&RC[-20])&IF(RC[-19]="",,"|n"&R1C16&RC[-19])&IF(RC[-18]="",,"|n"&R1C17&RC[-18])&IF(RC[-17]="",,"|n"&R1C18&RC[-17])&IF(RC[-16]="",,"|n"&R1C19&RC[-16])&IF(RC[-15]="",,"|n"&R1C20&RC[-15])&IF(RC[-14]="",,"|n"&R1C21&RC[-14])&IF(RC[-13]="",,"|n"&R1C22&RC[-13])&IF(RC[-11]="",,"|n"&R1C24&RC[-11])&IF(RC[-10]="",,"|n"&R1C25&RC[-10])&IF(RC[-9]="",,"|n"&R1C26&RC[-9])&IF(RC[-8]="",,"|n"&R1C27&RC[-8])&IF(RC[-7]="",,"|n"&R1C28&RC[-7])&IF(RC[-6]="",,"|n"&R1C29&RC[-6])&IF(RC[-2]="",,"|n"&RC[-2]) -> |cFFFFFF99基础属性|r|n血量:6500000
C141: A | D141: [上古之神-尤格萨隆] | E141: 堕落神明之刃 | H141: 1500000 | Q141: 35 | AH141: =VLOOKUP(RC[-31],Sheet2!R1C1:R7C2,2,0)&RC[-30]&RC[-29]&RC[-28]&Sheet2!R1C3&"" -> |cFF99FF66[上古之神-尤格萨隆]堕落神明之刃|r | AI141: =IF(RC[-27]&RC[-26]&RC[-25]&RC[-24]&RC[-23]&RC[-22]="",,R1C7)&IF(RC[-27]="",,"|n"&R1C8&RC[-27])&IF(RC[-26]="",,"|n"&R1C9&RC[-26])&IF(RC[-25]="",,"|n"&R1C10&RC[-25])&IF(RC[-24]="",,"|n"&R1C11&RC[-24])&IF(RC[-23]="",,"|n"&R1C12&RC[-23])&IF(RC[-22]="",,"|n"&R1C13&RC[-22])&IF(RC[-20]&RC[-19]&RC[-18]&RC[-17]="",,"|n"&R1C14)&IF(RC[-20]="",,"|n"&R1C15&RC[-20])&IF(RC[-19]="",,"|n"&R1C16&RC[-19])&IF(RC[-18]="",,"|n"&R1C17&RC[-18])&IF(RC[-17]="",,"|n"&R1C18&RC[-17])&IF(RC[-16]="",,"|n"&R1C19&RC[-16])&IF(RC[-15]="",,"|n"&R1C20&RC[-15])&IF(RC[-14]="",,"|n"&R1C21&RC[-14])&IF(RC[-13]="",,"|n"&R1C22&RC[-13])&IF(RC[-11]="",,"|n"&R1C24&RC[-11])&IF(RC[-10]="",,"|n"&R1C25&RC[-10])&IF(RC[-9]="",,"|n"&R1C26&RC[-9])&IF(RC[-8]="",,"|n"&R1C27&RC[-8])&IF(RC[-7]="",,"|n"&R1C28&RC[-7])&IF(RC[-6]="",,"|n"&R1C29&RC[-6])&IF(RC[-2]="",,"|n"&RC[-2]) -> |cFFFFFF99基础属性|r|n攻击:1500000|n|cFFFFFF55附加属性|r(%)|n暴击概率:35
C142: A | D142: [上古之神-尤格萨隆] | E142: 上古之神的低语 | R142: 30 | S142: 30 | T142: 30 | AH142: =VLOOKUP(RC[-31],Sheet2!R1C1:R7C2,2,0)&RC[-30]&RC[-29]&RC[-28]&Sheet2!R1C3&"" -> |cFF99FF66[上古之神-尤格萨隆]上古之神的低语|r | AI142: =IF(RC[-27]&RC[-26]&RC[-25]&RC[-24]&RC[-23]&RC[-22]="",,R1C7)&IF(RC[-27]="",,"|n"&R1C8&RC[-27])&IF(RC[-26]="",,"|n"&R1C9&RC[-26])&IF(RC[-25]="",,"|n"&R1C10&RC[-25])&IF(RC[-24]="",,"|n"&R1C11&RC[-24])&IF(RC[-23]="",,"|n"&R1C12&RC[-23])&IF(RC[-22]="",,"|n"&R1C13&RC[-22])&IF(RC[-20]&RC[-19]&RC[-18]&RC[-17]="",,"|n"&R1C14)&IF(RC[-20]="",,"|n"&R1C15&RC[-20])&IF(RC[-19]="",,"|n"&R1C16&RC[-19])&IF(RC[-18]="",,"|n"&R1C17&RC[-18])&IF(RC[-17]="",,"|n"&R1C18&RC[-17])&IF(RC[-16]="",,"|n"&R1C19&RC[-16])&IF(RC[-15]="",,"|n"&R1C20&RC[-15])&IF(RC[-14]="",,"|n"&R1C21&RC[-14])&IF(RC[-13]="",,"|n"&R1C22&RC[-13])&IF(RC[-11]="",,"|n"&R1C24&RC[-11])&IF(RC[-10]="",,"|n"&R1C25&RC[-10])&IF(RC[-9]="",,"|n"&R1C26&RC[-9])&IF(RC[-8]="",,"|n"&R1C27&RC[-8])&IF(RC[-7]="",,"|n"&R1C28&RC[-7])&IF(RC[-6]="",,"|n"&R1C29&RC[-6])&IF(RC[-2]="",,"|n"&RC[-2]) -> |n|cFFFFFF55附加属性|r(%)|n暴击伤害:30|n伤害增幅:30|n附加伤害:30
C143: A | D143: [上古之神-亚煞极] | E143: 狂怒之刃 | H143: 3000000 | AH143: =VLOOKUP(RC[-31],Sheet2!R1C1:R7C2,2,0)&RC[-30]&RC[-29]&RC[-28]&Sheet2!R1C3&"" -> |cFF99FF66[上古之神-亚煞极]狂怒之刃|r | AI143: =IF(RC[-27]&RC[-26]&RC[-25]&RC[-24]&RC[-23]&RC[-22]="",,R1C7)&IF(RC[-27]="",,"|n"&R1C8&RC[-27])&IF(RC[-26]="",,"|n"&R1C9&RC[-26])&IF(RC[-25]="",,"|n"&R1C10&RC[-25])&IF(RC[-24]="",,"|n"&R1C11&RC[-24])&IF(RC[-23]="",,"|n"&R1C12&RC[-23])&IF(RC[-22]="",,"|n"&R1C13&RC[-22])&IF(RC[-20]&RC[-19]&RC[-18]&RC[-17]="",,"|n"&R1C14)&IF(RC[-20]="",,"|n"&R1C15&RC[-20])&IF(RC[-19]="",,"|n"&R1C16&RC[-19])&IF(RC[-18]="",,"|n"&R1C17&RC[-18])&IF(RC[-17]="",,"|n"&R1C18&RC[-17])&IF(RC[-16]="",,"|n"&R1C19&RC[-16])&IF(RC[-15]="",,"|n"&R1C20&RC[-15])&IF(RC[-14]="",,"|n"&R1C21&RC[-14])&IF(RC[-13]="",,"|n"&R1C22&RC[-13])&IF(RC[-11]="",,"|n"&R1C24&RC[-11])&IF(RC[-10]="",,"|n"&R1C25&RC[-10])&IF(RC[-9]="",,"|n"&R1C26&RC[-9])&IF(RC[-8]="",,"|n"&R1C27&RC[-8])&IF(RC[-7]="",,"|n"&R1C28&RC[-7])&IF(RC[-6]="",,"|n"&R1C29&RC[-6])&IF(RC[-2]="",,"|n"&RC[-2]) -> |cFFFFFF99基础属性|r|n攻击:3000000
C144: A | D144: [上古之神-亚煞极] | E144: 恐惧者胸甲 | M144: 65000 | W144: 20 | AH144: =VLOOKUP(RC[-31],Sheet2!R1C1:R7C2,2,0)&RC[-30]&RC[-29]&RC[-28]&Sheet2!R1C3&"" -> |cFF99FF66[上古之神-亚煞极]恐惧者胸甲 |r | AI144: =IF(RC[-27]&RC[-26]&RC[-25]&RC[-24]&RC[-23]&RC[-22]="",,R1C7)&IF(RC[-27]="",,"|n"&R1C8&RC[-27])&IF(RC[-26]="",,"|n"&R1C9&RC[-26])&IF(RC[-25]="",,"|n"&R1C10&RC[-25])&IF(RC[-24]="",,"|n"&R1C11&RC[-24])&IF(RC[-23]="",,"|n"&R1C12&RC[-23])&IF(RC[-22]="",,"|n"&R1C13&RC[-22])&IF(RC[-20]&RC[-19]&RC[-18]&RC[-17]="",,"|n"&R1C14)&IF(RC[-20]="",,"|n"&R1C15&RC[-20])&IF(RC[-19]="",,"|n"&R1C16&RC[-19])&IF(RC[-18]="",,"|n"&R1C17&RC[-18])&IF(RC[-17]="",,"|n"&R1C18&RC[-17])&IF(RC[-16]="",,"|n"&R1C19&RC[-16])&IF(RC[-15]="",,"|n"&R1C20&RC[-15])&IF(RC[-14]="",,"|n"&R1C21&RC[-14])&IF(RC[-13]="",,"|n"&R1C22&RC[-13])&IF(RC[-11]="",,"|n"&R1C24&RC[-11])&IF(RC[-10]="",,"|n"&R1C25&RC[-10])&IF(RC[-9]="",,"|n"&R1C26&RC[-9])&IF(RC[-8]="",,"|n"&R1C27&RC[-8])&IF(RC[-7]="",,"|n"&R1C28&RC[-7])&IF(RC[-6]="",,"|n"&R1C29&RC[-6])&IF(RC[-2]="",,"|n"&RC[-2]) -> |cFFFFFF99基础属性|r|n护甲:65000
C145: A | D145: [上古之神-亚煞极] | E145: 堕落神明咒符 | I145: 1000000 | Y145: 25 | AH145: =VLOOKUP(RC[-31],Sheet2!R1C1:R7C2,2,0)&RC[-30]&RC[-29]&RC[-28]&Sheet2!R1C3&"" -> |cFF99FF66[上古之神-亚煞极]堕落神明咒符|r | AI145: =IF(RC[-27]&RC[-26]&RC[-25]&RC[-24]&RC[-23]&RC[-22]="",,R1C7)&IF(RC[-27]="",,"|n"&R1C8&RC[-27])&IF(RC[-26]="",,"|n"&R1C9&RC[-26])&IF(RC[-25]="",,"|n"&R1C10&RC[-25])&IF(RC[-24]="",,"|n"&R1C11&RC[-24])&IF(RC[-23]="",,"|n"&R1C12&RC[-23])&IF(RC[-22]="",,"|n"&R1C13&RC[-22])&IF(RC[-20]&RC[-19]&RC[-18]&RC[-17]="",,"|n"&R1C14)&IF(RC[-20]="",,"|n"&R1C15&RC[-20])&IF(RC[-19]="",,"|n"&R1C16&RC[-19])&IF(RC[-18]="",,"|n"&R1C17&RC[-18])&IF(RC[-17]="",,"|n"&R1C18&RC[-17])&IF(RC[-16]="",,"|n"&R1C19&RC[-16])&IF(RC[-15]="",,"|n"&R1C20&RC[-15])&IF(RC[-14]="",,"|n"&R1C21&RC[-14])&IF(RC[-13]="",,"|n"&R1C22&RC[-13])&IF(RC[-11]="",,"|n"&R1C24&RC[-11])&IF(RC[-10]="",,"|n"&R1C25&RC[-10])&IF(RC[-9]="",,"|n"&R1C26&RC[-9])&IF(RC[-8]="",,"|n"&R1C27&RC[-8])&IF(RC[-7]="",,"|n"&R1C28&RC[-7])&IF(RC[-6]="",,"|n"&R1C29&RC[-6])&IF(RC[-2]="",,"|n"&RC[-2]) -> |cFFFFFF99基础属性|r|n力量:1000000|n力量增幅:25
C146: A | D146: [上古之神-亚煞极] | E146: 上古之神的诅咒 | I146: 600000 | J146: 600000 | K146: 600000 | Y146: 10 | Z146: 10 | AA146: 10 | AH146: =VLOOKUP(RC[-31],Sheet2!R1C1:R7C2,2,0)&RC[-30]&RC[-29]&RC[-28]&Sheet2!R1C3&"" -> |cFF99FF66[上古之神-亚煞极]上古之神的诅咒|r | AI146: =IF(RC[-27]&RC[-26]&RC[-25]&RC[-24]&RC[-23]&RC[-22]="",,R1C7)&IF(RC[-27]="",,"|n"&R1C8&RC[-27])&IF(RC[-26]="",,"|n"&R1C9&RC[-26])&IF(RC[-25]="",,"|n"&R1C10&RC[-25])&IF(RC[-24]="",,"|n"&R1C11&RC[-24])&IF(RC[-23]="",,"|n"&R1C12&RC[-23])&IF(RC[-22]="",,"|n"&R1C13&RC[-22])&IF(RC[-20]&RC[-19]&RC[-18]&RC[-17]="",,"|n"&R1C14)&IF(RC[-20]="",,"|n"&R1C15&RC[-20])&IF(RC[-19]="",,"|n"&R1C16&RC[-19])&IF(RC[-18]="",,"|n"&R1C17&RC[-18])&IF(RC[-17]="",,"|n"&R1C18&RC[-17])&IF(RC[-16]="",,"|n"&R1C19&RC[-16])&IF(RC[-15]="",,"|n"&R1C20&RC[-15])&IF(RC[-14]="",,"|n"&R1C21&RC[-14])&IF(RC[-13]="",,"|n"&R1C22&RC[-13])&IF(RC[-11]="",,"|n"&R1C24&RC[-11])&IF(RC[-10]="",,"|n"&R1C25&RC[-10])&IF(RC[-9]="",,"|n"&R1C26&RC[-9])&IF(RC[-8]="",,"|n"&R1C27&RC[-8])&IF(RC[-7]="",,"|n"&R1C28&RC[-7])&IF(RC[-6]="",,"|n"&R1C29&RC[-6])&IF(RC[-2]="",,"|n"&RC[-2]) -> |cFFFFFF99基础属性|r|n力量:600000|n敏捷:600000|n智力:600000|n力量增幅:10|n敏捷增幅:10|n智力增幅:10
C147: A | D147: [上古之神-恩佐斯] | E147: 梦魇面具 | I147: 450000 | J147: 450000 | K147: 450000 | T147: 30 | AH147: =VLOOKUP(RC[-31],Sheet2!R1C1:R7C2,2,0)&RC[-30]&RC[-29]&RC[-28]&Sheet2!R1C3&"" -> |cFF99FF66[上古之神-恩佐斯]梦魇面具|r | AI147: =IF(RC[-27]&RC[-26]&RC[-25]&RC[-24]&RC[-23]&RC[-22]="",,R1C7)&IF(RC[-27]="",,"|n"&R1C8&RC[-27])&IF(RC[-26]="",,"|n"&R1C9&RC[-26])&IF(RC[-25]="",,"|n"&R1C10&RC[-25])&IF(RC[-24]="",,"|n"&R1C11&RC[-24])&IF(RC[-23]="",,"|n"&R1C12&RC[-23])&IF(RC[-22]="",,"|n"&R1C13&RC[-22])&IF(RC[-20]&RC[-19]&RC[-18]&RC[-17]="",,"|n"&R1C14)&IF(RC[-20]="",,"|n"&R1C15&RC[-20])&IF(RC[-19]="",,"|n"&R1C16&RC[-19])&IF(RC[-18]="",,"|n"&R1C17&RC[-18])&IF(RC[-17]="",,"|n"&R1C18&RC[-17])&IF(RC[-16]="",,"|n"&R1C19&RC[-16])&IF(RC[-15]="",,"|n"&R1C20&RC[-15])&IF(RC[-14]="",,"|n"&R1C21&RC[-14])&IF(RC[-13]="",,"|n"&R1C22&RC[-13])&IF(RC[-11]="",,"|n"&R1C24&RC[-11])&IF(RC[-10]="",,"|n"&R1C25&RC[-10])&IF(RC[-9]="",,"|n"&R1C26&RC[-9])&IF(RC[-8]="",,"|n"&R1C27&RC[-8])&IF(RC[-7]="",,"|n"&R1C28&RC[-7])&IF(RC[-6]="",,"|n"&R1C29&RC[-6])&IF(RC[-2]="",,"|n"&RC[-2]) -> |cFFFFFF99基础属性|r|n力量:450000|n敏捷:450000|n智力:450000|n附加伤害:30
C148: A | D148: [上古之神-恩佐斯] | E148: 灵魂之触手 | H148: 2500000 | Q148: 15 | R148: 50 | AH148: =VLOOKUP(RC[-31],Sheet2!R1C1:R7C2,2,0)&RC[-30]&RC[-29]&RC[-28]&Sheet2!R1C3&"" -> |cFF99FF66[上古之神-恩佐斯]灵魂之触手|r | AI148: =IF(RC[-27]&RC[-26]&RC[-25]&RC[-24]&RC[-23]&RC[-22]="",,R1C7)&IF(RC[-27]="",,"|n"&R1C8&RC[-27])&IF(RC[-26]="",,"|n"&R1C9&RC[-26])&IF(RC[-25]="",,"|n"&R1C10&RC[-25])&IF(RC[-24]="",,"|n"&R1C11&RC[-24])&IF(RC[-23]="",,"|n"&R1C12&RC[-23])&IF(RC[-22]="",,"|n"&R1C13&RC[-22])&IF(RC[-20]&RC[-19]&RC[-18]&RC[-17]="",,"|n"&R1C14)&IF(RC[-20]="",,"|n"&R1C15&RC[-20])&IF(RC[-19]="",,"|n"&R1C16&RC[-19])&IF(RC[-18]="",,"|n"&R1C17&RC[-18])&IF(RC[-17]="",,"|n"&R1C18&RC[-17])&IF(RC[-16]="",,"|n"&R1C19&RC[-16])&IF(RC[-15]="",,"|n"&R1C20&RC[-15])&IF(RC[-14]="",,"|n"&R1C21&RC[-14])&IF(RC[-13]="",,"|n"&R1C22&RC[-13])&IF(RC[-11]="",,"|n"&R1C24&RC[-11])&IF(RC[-10]="",,"|n"&R1C25&RC[-10])&IF(RC[-9]="",,"|n"&R1C26&RC[-9])&IF(RC[-8]="",,"|n"&R1C27&RC[-8])&IF(RC[-7]="",,"|n"&R1C28&RC[-7])&IF(RC[-6]="",,"|n"&R1C29&RC[-6])&IF(RC[-2]="",,"|n"&RC[-2]) -> |cFFFFFF99基础属性|r|n攻击:2500000|n|cFFFFFF55附加属性|r(%)|n暴击概率:15|n暴击伤害:50
C149: A | D149: [上古之神-恩佐斯] | E149: 堕落神明之戒 | K149: 1000000 | AA149: 25 | AH149: =VLOOKUP(RC[-31],Sheet2!R1C1:R7C2,2,0)&RC[-30]&RC[-29]&RC[-28]&Sheet2!R1C3&"" -> |cFF99FF66[上古之神-恩佐斯]堕落神明之戒|r | AI149: =IF(RC[-27]&RC[-26]&RC[-25]&RC[-24]&RC[-23]&RC[-22]="",,R1C7)&IF(RC[-27]="",,"|n"&R1C8&RC[-27])&IF(RC[-26]="",,"|n"&R1C9&RC[-26])&IF(RC[-25]="",,"|n"&R1C10&RC[-25])&IF(RC[-24]="",,"|n"&R1C11&RC[-24])&IF(RC[-23]="",,"|n"&R1C12&RC[-23])&IF(RC[-22]="",,"|n"&R1C13&RC[-22])&IF(RC[-20]&RC[-19]&RC[-18]&RC[-17]="",,"|n"&R1C14)&IF(RC[-20]="",,"|n"&R1C15&RC[-20])&IF(RC[-19]="",,"|n"&R1C16&RC[-19])&IF(RC[-18]="",,"|n"&R1C17&RC[-18])&IF(RC[-17]="",,"|n"&R1C18&RC[-17])&IF(RC[-16]="",,"|n"&R1C19&RC[-16])&IF(RC[-15]="",,"|n"&R1C20&RC[-15])&IF(RC[-14]="",,"|n"&R1C21&RC[-14])&IF(RC[-13]="",,"|n"&R1C22&RC[-13])&IF(RC[-11]="",,"|n"&R1C24&RC[-11])&IF(RC[-10]="",,"|n"&R1C25&RC[-10])&IF(RC[-9]="",,"|n"&R1C26&RC[-9])&IF(RC[-8]="",,"|n"&R1C27&RC[-8])&IF(RC[-7]="",,"|n"&R1C28&RC[-7])&IF(RC[-6]="",,"|n"&R1C29&RC[-6])&IF(RC[-2]="",,"|n"&RC[-2]) -> |cFFFFFF99基础属性|r|n智力:1000000|n智力增幅:25
C150: A | D150: [上古之神-恩佐斯] | E150: 上古之神的甲壳 | L150: 8000000 | M150: 80000 | AH150: =VLOOKUP(RC[-31],Sheet2!R1C1:R7C2,2,0)&RC[-30]&RC[-29]&RC[-28]&Sheet2!R1C3&"" -> |cFF99FF66[上古之神-恩佐斯]上古之神的甲壳|r | AI150: =IF(RC[-27]&RC[-26]&RC[-25]&RC[-24]&RC[-23]&RC[-22]="",,R1C7)&IF(RC[-27]="",,"|n"&R1C8&RC[-27])&IF(RC[-26]="",,"|n"&R1C9&RC[-26])&IF(RC[-25]="",,"|n"&R1C10&RC[-25])&IF(RC[-24]="",,"|n"&R1C11&RC[-24])&IF(RC[-23]="",,"|n"&R1C12&RC[-23])&IF(RC[-22]="",,"|n"&R1C13&RC[-22])&IF(RC[-20]&RC[-19]&RC[-18]&RC[-17]="",,"|n"&R1C14)&IF(RC[-20]="",,"|n"&R1C15&RC[-20])&IF(RC[-19]="",,"|n"&R1C16&RC[-19])&IF(RC[-18]="",,"|n"&R1C17&RC[-18])&IF(RC[-17]="",,"|n"&R1C18&RC[-17])&IF(RC[-16]="",,"|n"&R1C19&RC[-16])&IF(RC[-15]="",,"|n"&R1C20&RC[-15])&IF(RC[-14]="",,"|n"&R1C21&RC[-14])&IF(RC[-13]="",,"|n"&R1C22&RC[-13])&IF(RC[-11]="",,"|n"&R1C24&RC[-11])&IF(RC[-10]="",,"|n"&R1C25&RC[-10])&IF(RC[-9]="",,"|n"&R1C26&RC[-9])&IF(RC[-8]="",,"|n"&R1C27&RC[-8])&IF(RC[-7]="",,"|n"&R1C28&RC[-7])&IF(RC[-6]="",,"|n"&R1C29&RC[-6])&IF(RC[-2]="",,"|n"&RC[-2]) -> |cFFFFFF99基础属性|r|n血量:8000000|n护甲:80000
C151: A | D151: [上古之神-萨拉塔斯] | E151: 古神之血 | K151: 1000000 | AA151: 25 | AH151: =VLOOKUP(RC[-31],Sheet2!R1C1:R7C2,2,0)&RC[-30]&RC[-29]&RC[-28]&Sheet2!R1C3&"" -> |cFF99FF66[上古之神-萨拉塔斯]古神之血|r | AI151: =IF(RC[-27]&RC[-26]&RC[-25]&RC[-24]&RC[-23]&RC[-22]="",,R1C7)&IF(RC[-27]="",,"|n"&R1C8&RC[-27])&IF(RC[-26]="",,"|n"&R1C9&RC[-26])&IF(RC[-25]="",,"|n"&R1C10&RC[-25])&IF(RC[-24]="",,"|n"&R1C11&RC[-24])&IF(RC[-23]="",,"|n"&R1C12&RC[-23])&IF(RC[-22]="",,"|n"&R1C13&RC[-22])&IF(RC[-20]&RC[-19]&RC[-18]&RC[-17]="",,"|n"&R1C14)&IF(RC[-20]="",,"|n"&R1C15&RC[-20])&IF(RC[-19]="",,"|n"&R1C16&RC[-19])&IF(RC[-18]="",,"|n"&R1C17&RC[-18])&IF(RC[-17]="",,"|n"&R1C18&RC[-17])&IF(RC[-16]="",,"|n"&R1C19&RC[-16])&IF(RC[-15]="",,"|n"&R1C20&RC[-15])&IF(RC[-14]="",,"|n"&R1C21&RC[-14])&IF(RC[-13]="",,"|n"&R1C22&RC[-13])&IF(RC[-11]="",,"|n"&R1C24&RC[-11])&IF(RC[-10]="",,"|n"&R1C25&RC[-10])&IF(RC[-9]="",,"|n"&R1C26&RC[-9])&IF(RC[-8]="",,"|n"&R1C27&RC[-8])&IF(RC[-7]="",,"|n"&R1C28&RC[-7])&IF(RC[-6]="",,"|n"&R1C29&RC[-6])&IF(RC[-2]="",,"|n"&RC[-2]) -> |cFFFFFF99基础属性|r|n智力:1000000|n智力增幅:25
C152: A | D152: [上古之神-萨拉塔斯] | E152: 背信者徽记 | I152: 450000 | J152: 450000 | K152: 450000 | R152: 20 | S152: 20 | T152: 20 | AH152: =VLOOKUP(RC[-31],Sheet2!R1C1:R7C2,2,0)&RC[-30]&RC[-29]&RC[-28]&Sheet2!R1C3&"" -> |cFF99FF66[上古之神-萨拉塔斯]背信者徽记|r | AI152: =IF(RC[-27]&RC[-26]&RC[-25]&RC[-24]&RC[-23]&RC[-22]="",,R1C7)&IF(RC[-27]="",,"|n"&R1C8&RC[-27])&IF(RC[-26]="",,"|n"&R1C9&RC[-26])&IF(RC[-25]="",,"|n"&R1C10&RC[-25])&IF(RC[-24]="",,"|n"&R1C11&RC[-24])&IF(RC[-23]="",,"|n"&R1C12&RC[-23])&IF(RC[-22]="",,"|n"&R1C13&RC[-22])&IF(RC[-20]&RC[-19]&RC[-18]&RC[-17]="",,"|n"&R1C14)&IF(RC[-20]="",,"|n"&R1C15&RC[-20])&IF(RC[-19]="",,"|n"&R1C16&RC[-19])&IF(RC[-18]="",,"|n"&R1C17&RC[-18])&IF(RC[-17]="",,"|n"&R1C18&RC[-17])&IF(RC[-16]="",,"|n"&R1C19&RC[-16])&IF(RC[-15]="",,"|n"&R1C20&RC[-15])&IF(RC[-14]="",,"|n"&R1C21&RC[-14])&IF(RC[-13]="",,"|n"&R1C22&RC[-13])&IF(RC[-11]="",,"|n"&R1C24&RC[-11])&IF(RC[-10]="",,"|n"&R1C25&RC[-10])&IF(RC[-9]="",,"|n"&R1C26&RC[-9])&IF(RC[-8]="",,"|n"&R1C27&RC[-8])&IF(RC[-7]="",,"|n"&R1C28&RC[-7])&IF(RC[-6]="",,"|n"&R1C29&RC[-6])&IF(RC[-2]="",,"|n"&RC[-2]) -> |cFFFFFF99基础属性|r|n力量:450000|n敏捷:450000|n智力:450000|n|cFFFFFF55附加属性|r(%)|n暴击伤害:20|n伤害增幅:20|n附加伤害:20
C153: A | D153: [上古之神-萨拉塔斯] | E153: 堕落神明胸甲 | L153: 500000 | M153: 50000 | V153: 10 | AH153: =VLOOKUP(RC[-31],Sheet2!R1C1:R7C2,2,0)&RC[-30]&RC[-29]&RC[-28]&Sheet2!R1C3&"" -> |cFF99FF66[上古之神-萨拉塔斯]堕落神明胸甲|r | AI153: =IF(RC[-27]&RC[-26]&RC[-25]&RC[-24]&RC[-23]&RC[-22]="",,R1C7)&IF(RC[-27]="",,"|n"&R1C8&RC[-27])&IF(RC[-26]="",,"|n"&R1C9&RC[-26])&IF(RC[-25]="",,"|n"&R1C10&RC[-25])&IF(RC[-24]="",,"|n"&R1C11&RC[-24])&IF(RC[-23]="",,"|n"&R1C12&RC[-23])&IF(RC[-22]="",,"|n"&R1C13&RC[-22])&IF(RC[-20]&RC[-19]&RC[-18]&RC[-17]="",,"|n"&R1C14)&IF(RC[-20]="",,"|n"&R1C15&RC[-20])&IF(RC[-19]="",,"|n"&R1C16&RC[-19])&IF(RC[-18]="",,"|n"&R1C17&RC[-18])&IF(RC[-17]="",,"|n"&R1C18&RC[-17])&IF(RC[-16]="",,"|n"&R1C19&RC[-16])&IF(RC[-15]="",,"|n"&R1C20&RC[-15])&IF(RC[-14]="",,"|n"&R1C21&RC[-14])&IF(RC[-13]="",,"|n"&R1C22&RC[-13])&IF(RC[-11]="",,"|n"&R1C24&RC[-11])&IF(RC[-10]="",,"|n"&R1C25&RC[-10])&IF(RC[-9]="",,"|n"&R1C26&RC[-9])&IF(RC[-8]="",,"|n"&R1C27&RC[-8])&IF(RC[-7]="",,"|n"&R1C28&RC[-7])&IF(RC[-6]="",,"|n"&R1C29&RC[-6])&IF(RC[-2]="",,"|n"&RC[-2]) -> |cFFFFFF99基础属性|r|n血量:500000|n护甲:50000|n伤害抵抗:10
C154: A | D154: [上古之神-萨拉塔斯] | E154: 上古之神的末日 | H154: 3000000 | S154: 50 | AH154: =VLOOKUP(RC[-31],Sheet2!R1C1:R7C2,2,0)&RC[-30]&RC[-29]&RC[-28]&Sheet2!R1C3&"" -> |cFF99FF66[上古之神-萨拉塔斯]上古之神的末日|r | AI154: =IF(RC[-27]&RC[-26]&RC[-25]&RC[-24]&RC[-23]&RC[-22]="",,R1C7)&IF(RC[-27]="",,"|n"&R1C8&RC[-27])&IF(RC[-26]="",,"|n"&R1C9&RC[-26])&IF(RC[-25]="",,"|n"&R1C10&RC[-25])&IF(RC[-24]="",,"|n"&R1C11&RC[-24])&IF(RC[-23]="",,"|n"&R1C12&RC[-23])&IF(RC[-22]="",,"|n"&R1C13&RC[-22])&IF(RC[-20]&RC[-19]&RC[-18]&RC[-17]="",,"|n"&R1C14)&IF(RC[-20]="",,"|n"&R1C15&RC[-20])&IF(RC[-19]="",,"|n"&R1C16&RC[-19])&IF(RC[-18]="",,"|n"&R1C17&RC[-18])&IF(RC[-17]="",,"|n"&R1C18&RC[-17])&IF(RC[-16]="",,"|n"&R1C19&RC[-16])&IF(RC[-15]="",,"|n"&R1C20&RC[-15])&IF(RC[-14]="",,"|n"&R1C21&RC[-14])&IF(RC[-13]="",,"|n"&R1C22&RC[-13])&IF(RC[-11]="",,"|n"&R1C24&RC[-11])&IF(RC[-10]="",,"|n"&R1C25&RC[-10])&IF(RC[-9]="",,"|n"&R1C26&RC[-9])&IF(RC[-8]="",,"|n"&R1C27&RC[-8])&IF(RC[-7]="",,"|n"&R1C28&RC[-7])&IF(RC[-6]="",,"|n"&R1C29&RC[-6])&IF(RC[-2]="",,"|n"&RC[-2]) -> |cFFFFFF99基础属性|r|n攻击:3000000|n伤害增幅:50
C155: A | D155: [繁花秘境] | E155: 繁花幻木 | L155: 1000000 | AH155: =VLOOKUP(RC[-31],Sheet2!R1C1:R7C2,2,0)&RC[-30]&RC[-29]&RC[-28]&Sheet2!R1C3&"" -> |cFF99FF66[繁花秘境]繁花幻木|r | AI155: =IF(RC[-27]&RC[-26]&RC[-25]&RC[-24]&RC[-23]&RC[-22]="",,R1C7)&IF(RC[-27]="",,"|n"&R1C8&RC[-27])&IF(RC[-26]="",,"|n"&R1C9&RC[-26])&IF(RC[-25]="",,"|n"&R1C10&RC[-25])&IF(RC[-24]="",,"|n"&R1C11&RC[-24])&IF(RC[-23]="",,"|n"&R1C12&RC[-23])&IF(RC[-22]="",,"|n"&R1C13&RC[-22])&IF(RC[-20]&RC[-19]&RC[-18]&RC[-17]="",,"|n"&R1C14)&IF(RC[-20]="",,"|n"&R1C15&RC[-20])&IF(RC[-19]="",,"|n"&R1C16&RC[-19])&IF(RC[-18]="",,"|n"&R1C17&RC[-18])&IF(RC[-17]="",,"|n"&R1C18&RC[-17])&IF(RC[-16]="",,"|n"&R1C19&RC[-16])&IF(RC[-15]="",,"|n"&R1C20&RC[-15])&IF(RC[-14]="",,"|n"&R1C21&RC[-14])&IF(RC[-13]="",,"|n"&R1C22&RC[-13])&IF(RC[-11]="",,"|n"&R1C24&RC[-11])&IF(RC[-10]="",,"|n"&R1C25&RC[-10])&IF(RC[-9]="",,"|n"&R1C26&RC[-9])&IF(RC[-8]="",,"|n"&R1C27&RC[-8])&IF(RC[-7]="",,"|n"&R1C28&RC[-7])&IF(RC[-6]="",,"|n"&R1C29&RC[-6])&IF(RC[-2]="",,"|n"&RC[-2]) -> |cFFFFFF99基础属性|r|n血量:1000000
C156: A | D156: [繁花秘境] | E156: 万年天木 | L156: 5000000 | AH156: =VLOOKUP(RC[-31],Sheet2!R1C1:R7C2,2,0)&RC[-30]&RC[-29]&RC[-28]&Sheet2!R1C3&"" -> |cFF99FF66[繁花秘境]万年天木|r | AI156: =IF(RC[-27]&RC[-26]&RC[-25]&RC[-24]&RC[-23]&RC[-22]="",,R1C7)&IF(RC[-27]="",,"|n"&R1C8&RC[-27])&IF(RC[-26]="",,"|n"&R1C9&RC[-26])&IF(RC[-25]="",,"|n"&R1C10&RC[-25])&IF(RC[-24]="",,"|n"&R1C11&RC[-24])&IF(RC[-23]="",,"|n"&R1C12&RC[-23])&IF(RC[-22]="",,"|n"&R1C13&RC[-22])&IF(RC[-20]&RC[-19]&RC[-18]&RC[-17]="",,"|n"&R1C14)&IF(RC[-20]="",,"|n"&R1C15&RC[-20])&IF(RC[-19]="",,"|n"&R1C16&RC[-19])&IF(RC[-18]="",,"|n"&R1C17&RC[-18])&IF(RC[-17]="",,"|n"&R1C18&RC[-17])&IF(RC[-16]="",,"|n"&R1C19&RC[-16])&IF(RC[-15]="",,"|n"&R1C20&RC[-15])&IF(RC[-14]="",,"|n"&R1C21&RC[-14])&IF(RC[-13]="",,"|n"&R1C22&RC[-13])&IF(RC[-11]="",,"|n"&R1C24&RC[-11])&IF(RC[-10]="",,"|n"&R1C25&RC[-10])&IF(RC[-9]="",,"|n"&R1C26&RC[-9])&IF(RC[-8]="",,"|n"&R1C27&RC[-8])&IF(RC[-7]="",,"|n"&R1C28&RC[-7])&IF(RC[-6]="",,"|n"&R1C29&RC[-6])&IF(RC[-2]="",,"|n"&RC[-2]) -> |cFFFFFF99基础属性|r|n血量:5000000
C157: A | D157: [繁花秘境] | E157: 虚空合金 | H157: 1000000 | P157: 2 | AH157: =VLOOKUP(RC[-31],Sheet2!R1C1:R7C2,2,0)&RC[-30]&RC[-29]&RC[-28]&Sheet2!R1C3&"" -> |cFF99FF66[繁花秘境]虚空合金|r | AI157: =IF(RC[-27]&RC[-26]&RC[-25]&RC[-24]&RC[-23]&RC[-22]="",,R1C7)&IF(RC[-27]="",,"|n"&R1C8&RC[-27])&IF(RC[-26]="",,"|n"&R1C9&RC[-26])&IF(RC[-25]="",,"|n"&R1C10&RC[-25])&IF(RC[-24]="",,"|n"&R1C11&RC[-24])&IF(RC[-23]="",,"|n"&R1C12&RC[-23])&IF(RC[-22]="",,"|n"&R1C13&RC[-22])&IF(RC[-20]&RC[-19]&RC[-18]&RC[-17]="",,"|n"&R1C14)&IF(RC[-20]="",,"|n"&R1C15&RC[-20])&IF(RC[-19]="",,"|n"&R1C16&RC[-19])&IF(RC[-18]="",,"|n"&R1C17&RC[-18])&IF(RC[-17]="",,"|n"&R1C18&RC[-17])&IF(RC[-16]="",,"|n"&R1C19&RC[-16])&IF(RC[-15]="",,"|n"&R1C20&RC[-15])&IF(RC[-14]="",,"|n"&R1C21&RC[-14])&IF(RC[-13]="",,"|n"&R1C22&RC[-13])&IF(RC[-11]="",,"|n"&R1C24&RC[-11])&IF(RC[-10]="",,"|n"&R1C25&RC[-10])&IF(RC[-9]="",,"|n"&R1C26&RC[-9])&IF(RC[-8]="",,"|n"&R1C27&RC[-8])&IF(RC[-7]="",,"|n"&R1C28&RC[-7])&IF(RC[-6]="",,"|n"&R1C29&RC[-6])&IF(RC[-2]="",,"|n"&RC[-2]) -> |cFFFFFF99基础属性|r|n攻击:1000000|n|cFFFFFF55附加属性|r(%)|n攻击吸血:2
C158: A | D158: [繁花秘境] | E158: 秘境水晶 | H158: 1000000 | P158: 2 | AH158: =VLOOKUP(RC[-31],Sheet2!R1C1:R7C2,2,0)&RC[-30]&RC[-29]&RC[-28]&Sheet2!R1C3&"" -> |cFF99FF66[繁花秘境]秘境水晶|r | AI158: =IF(RC[-27]&RC[-26]&RC[-25]&RC[-24]&RC[-23]&RC[-22]="",,R1C7)&IF(RC[-27]="",,"|n"&R1C8&RC[-27])&IF(RC[-26]="",,"|n"&R1C9&RC[-26])&IF(RC[-25]="",,"|n"&R1C10&RC[-25])&IF(RC[-24]="",,"|n"&R1C11&RC[-24])&IF(RC[-23]="",,"|n"&R1C12&RC[-23])&IF(RC[-22]="",,"|n"&R1C13&RC[-22])&IF(RC[-20]&RC[-19]&RC[-18]&RC[-17]="",,"|n"&R1C14)&IF(RC[-20]="",,"|n"&R1C15&RC[-20])&IF(RC[-19]="",,"|n"&R1C16&RC[-19])&IF(RC[-18]="",,"|n"&R1C17&RC[-18])&IF(RC[-17]="",,"|n"&R1C18&RC[-17])&IF(RC[-16]="",,"|n"&R1C19&RC[-16])&IF(RC[-15]="",,"|n"&R1C20&RC[-15])&IF(RC[-14]="",,"|n"&R1C21&RC[-14])&IF(RC[-13]="",,"|n"&R1C22&RC[-13])&IF(RC[-11]="",,"|n"&R1C24&RC[-11])&IF(RC[-10]="",,"|n"&R1C25&RC[-10])&IF(RC[-9]="",,"|n"&R1C26&RC[-9])&IF(RC[-8]="",,"|n"&R1C27&RC[-8])&IF(RC[-7]="",,"|n"&R1C28&RC[-7])&IF(RC[-6]="",,"|n"&R1C29&RC[-6])&IF(RC[-2]="",,"|n"&RC[-2]) -> |cFFFFFF99基础属性|r|n攻击:1000000|n|cFFFFFF55附加属性|r(%)|n攻击吸血:2
C159: A | D159: [繁花秘境] | E159: 灵木之刃 | H159: 2500000 | L159: 1000000 | P159: 4 | AH159: =VLOOKUP(RC[-31],Sheet2!R1C1:R7C2,2,0)&RC[-30]&RC[-29]&RC[-28]&Sheet2!R1C3&"" -> |cFF99FF66[繁花秘境]灵木之刃|r | AI159: =IF(RC[-27]&RC[-26]&RC[-25]&RC[-24]&RC[-23]&RC[-22]="",,R1C7)&IF(RC[-27]="",,"|n"&R1C8&RC[-27])&IF(RC[-26]="",,"|n"&R1C9&RC[-26])&IF(RC[-25]="",,"|n"&R1C10&RC[-25])&IF(RC[-24]="",,"|n"&R1C11&RC[-24])&IF(RC[-23]="",,"|n"&R1C12&RC[-23])&IF(RC[-22]="",,"|n"&R1C13&RC[-22])&IF(RC[-20]&RC[-19]&RC[-18]&RC[-17]="",,"|n"&R1C14)&IF(RC[-20]="",,"|n"&R1C15&RC[-20])&IF(RC[-19]="",,"|n"&R1C16&RC[-19])&IF(RC[-18]="",,"|n"&R1C17&RC[-18])&IF(RC[-17]="",,"|n"&R1C18&RC[-17])&IF(RC[-16]="",,"|n"&R1C19&RC[-16])&IF(RC[-15]="",,"|n"&R1C20&RC[-15])&IF(RC[-14]="",,"|n"&R1C21&RC[-14])&IF(RC[-13]="",,"|n"&R1C22&RC[-13])&IF(RC[-11]="",,"|n"&R1C24&RC[-11])&IF(RC[-10]="",,"|n"&R1C25&RC[-10])&IF(RC[-9]="",,"|n"&R1C26&RC[-9])&IF(RC[-8]="",,"|n"&R1C27&RC[-8])&IF(RC[-7]="",,"|n"&R1C28&RC[-7])&IF(RC[-6]="",,"|n"&R1C29&RC[-6])&IF(RC[-2]="",,"|n"&RC[-2]) -> |cFFFFFF99基础属性|r|n攻击:2500000|n血量:1000000|n|cFFFFFF55附加属性|r(%)|n攻击吸血:4
C160: A | D160: [繁花秘境] | E160: 神木之刃 | H160: 5000000 | L160: 6000000 | P160: 4 | AH160: =VLOOKUP(RC[-31],Sheet2!R1C1:R7C2,2,0)&RC[-30]&RC[-29]&RC[-28]&Sheet2!R1C3&"" -> |cFF99FF66[繁花秘境]神木之刃|r | AI160: =IF(RC[-27]&RC[-26]&RC[-25]&RC[-24]&RC[-23]&RC[-22]="",,R1C7)&IF(RC[-27]="",,"|n"&R1C8&RC[-27])&IF(RC[-26]="",,"|n"&R1C9&RC[-26])&IF(RC[-25]="",,"|n"&R1C10&RC[-25])&IF(RC[-24]="",,"|n"&R1C11&RC[-24])&IF(RC[-23]="",,"|n"&R1C12&RC[-23])&IF(RC[-22]="",,"|n"&R1C13&RC[-22])&IF(RC[-20]&RC[-19]&RC[-18]&RC[-17]="",,"|n"&R1C14)&IF(RC[-20]="",,"|n"&R1C15&RC[-20])&IF(RC[-19]="",,"|n"&R1C16&RC[-19])&IF(RC[-18]="",,"|n"&R1C17&RC[-18])&IF(RC[-17]="",,"|n"&R1C18&RC[-17])&IF(RC[-16]="",,"|n"&R1C19&RC[-16])&IF(RC[-15]="",,"|n"&R1C20&RC[-15])&IF(RC[-14]="",,"|n"&R1C21&RC[-14])&IF(RC[-13]="",,"|n"&R1C22&RC[-13])&IF(RC[-11]="",,"|n"&R1C24&RC[-11])&IF(RC[-10]="",,"|n"&R1C25&RC[-10])&IF(RC[-9]="",,"|n"&R1C26&RC[-9])&IF(RC[-8]="",,"|n"&R1C27&RC[-8])&IF(RC[-7]="",,"|n"&R1C28&RC[-7])&IF(RC[-6]="",,"|n"&R1C29&RC[-6])&IF(RC[-2]="",,"|n"&RC[-2]) -> |cFFFFFF99基础属性|r|n攻击:5000000|n血量:6000000|n|cFFFFFF55附加属性|r(%)|n攻击吸血:4
C161: A | D161: [繁花秘境] | E161: 女装-神木之刃 | H161: 8000000 | L161: 10000000 | P161: 4 | R161: 20 | AH161: =VLOOKUP(RC[-31],Sheet2!R1C1:R7C2,2,0)&RC[-30]&RC[-29]&RC[-28]&Sheet2!R1C3&"" -> |cFF99FF66[繁花秘境]女装-神木之刃|r | AI161: =IF(RC[-27]&RC[-26]&RC[-25]&RC[-24]&RC[-23]&RC[-22]="",,R1C7)&IF(RC[-27]="",,"|n"&R1C8&RC[-27])&IF(RC[-26]="",,"|n"&R1C9&RC[-26])&IF(RC[-25]="",,"|n"&R1C10&RC[-25])&IF(RC[-24]="",,"|n"&R1C11&RC[-24])&IF(RC[-23]="",,"|n"&R1C12&RC[-23])&IF(RC[-22]="",,"|n"&R1C13&RC[-22])&IF(RC[-20]&RC[-19]&RC[-18]&RC[-17]="",,"|n"&R1C14)&IF(RC[-20]="",,"|n"&R1C15&RC[-20])&IF(RC[-19]="",,"|n"&R1C16&RC[-19])&IF(RC[-18]="",,"|n"&R1C17&RC[-18])&IF(RC[-17]="",,"|n"&R1C18&RC[-17])&IF(RC[-16]="",,"|n"&R1C19&RC[-16])&IF(RC[-15]="",,"|n"&R1C20&RC[-15])&IF(RC[-14]="",,"|n"&R1C21&RC[-14])&IF(RC[-13]="",,"|n"&R1C22&RC[-13])&IF(RC[-11]="",,"|n"&R1C24&RC[-11])&IF(RC[-10]="",,"|n"&R1C25&RC[-10])&IF(RC[-9]="",,"|n"&R1C26&RC[-9])&IF(RC[-8]="",,"|n"&R1C27&RC[-8])&IF(RC[-7]="",,"|n"&R1C28&RC[-7])&IF(RC[-6]="",,"|n"&R1C29&RC[-6])&IF(RC[-2]="",,"|n"&RC[-2]) -> |cFFFFFF99基础属性|r|n攻击:8000000|n血量:10000000|n|cFFFFFF55附加属性|r(%)|n攻击吸血:4|n暴击伤害:20
AI162: =IF(RC[-27]&RC[-26]&RC[-25]&RC[-24]&RC[-23]&RC[-22]="",,R1C7)&IF(RC[-27]="",,"|n"&R1C8&RC[-27])&IF(RC[-26]="",,"|n"&R1C9&RC[-26])&IF(RC[-25]="",,"|n"&R1C10&RC[-25])&IF(RC[-24]="",,"|n"&R1C11&RC[-24])&IF(RC[-23]="",,"|n"&R1C12&RC[-23])&IF(RC[-22]="",,"|n"&R1C13&RC[-22])&IF(RC[-20]&RC[-19]&RC[-18]&RC[-17]="",,"|n"&R1C14)&IF(RC[-20]="",,"|n"&R1C15&RC[-20])&IF(RC[-19]="",,"|n"&R1C16&RC[-19])&IF(RC[-18]="",,"|n"&R1C17&RC[-18])&IF(RC[-17]="",,"|n"&R1C18&RC[-17])&IF(RC[-16]="",,"|n"&R1C19&RC[-16])&IF(RC[-15]="",,"|n"&R1C20&RC[-15])&IF(RC[-14]="",,"|n"&R1C21&RC[-14])&IF(RC[-13]="",,"|n"&R1C22&RC[-13])&IF(RC[-11]="",,"|n"&R1C24&RC[-11])&IF(RC[-10]="",,"|n"&R1C25&RC[-10])&IF(RC[-9]="",,"|n"&R1C26&RC[-9])&IF(RC[-8]="",,"|n"&R1C27&RC[-8])&IF(RC[-7]="",,"|n"&R1C28&RC[-7])&IF(RC[-6]="",,"|n"&R1C29&RC[-6])&IF(RC[-2]="",,"|n"&RC[-2]) -> 
AI163: =IF(RC[-27]&RC[-26]&RC[-25]&RC[-24]&RC[-23]&RC[-22]="",,R1C7)&IF(RC[-27]="",,"|n"&R1C8&RC[-27])&IF(RC[-26]="",,"|n"&R1C9&RC[-26])&IF(RC[-25]="",,"|n"&R1C10&RC[-25])&IF(RC[-24]="",,"|n"&R1C11&RC[-24])&IF(RC[-23]="",,"|n"&R1C12&RC[-23])&IF(RC[-22]="",,"|n"&R1C13&RC[-22])&IF(RC[-20]&RC[-19]&RC[-18]&RC[-17]="",,"|n"&R1C14)&IF(RC[-20]="",,"|n"&R1C15&RC[-20])&IF(RC[-19]="",,"|n"&R1C16&RC[-19])&IF(RC[-18]="",,"|n"&R1C17&RC[-18])&IF(RC[-17]="",,"|n"&R1C18&RC[-17])&IF(RC[-16]="",,"|n"&R1C19&RC[-16])&IF(RC[-15]="",,"|n"&R1C20&RC[-15])&IF(RC[-14]="",,"|n"&R1C21&RC[-14])&IF(RC[-13]="",,"|n"&R1C22&RC[-13])&IF(RC[-11]="",,"|n"&R1C24&RC[-11])&IF(RC[-10]="",,"|n"&R1C25&RC[-10])&IF(RC[-9]="",,"|n"&R1C26&RC[-9])&IF(RC[-8]="",,"|n"&R1C27&RC[-8])&IF(RC[-7]="",,"|n"&R1C28&RC[-7])&IF(RC[-6]="",,"|n"&R1C29&RC[-6])&IF(RC[-2]="",,"|n"&RC[-2]) -> 
AI164: =IF(RC[-27]&RC[-26]&RC[-25]&RC[-24]&RC[-23]&RC[-22]="",,R1C7)&IF(RC[-27]="",,"|n"&R1C8&RC[-27])&IF(RC[-26]="",,"|n"&R1C9&RC[-26])&IF(RC[-25]="",,"|n"&R1C10&RC[-25])&IF(RC[-24]="",,"|n"&R1C11&RC[-24])&IF(RC[-23]="",,"|n"&R1C12&RC[-23])&IF(RC[-22]="",,"|n"&R1C13&RC[-22])&IF(RC[-20]&RC[-19]&RC[-18]&RC[-17]="",,"|n"&R1C14)&IF(RC[-20]="",,"|n"&R1C15&RC[-20])&IF(RC[-19]="",,"|n"&R1C16&RC[-19])&IF(RC[-18]="",,"|n"&R1C17&RC[-18])&IF(RC[-17]="",,"|n"&R1C18&RC[-17])&IF(RC[-16]="",,"|n"&R1C19&RC[-16])&IF(RC[-15]="",,"|n"&R1C20&RC[-15])&IF(RC[-14]="",,"|n"&R1C21&RC[-14])&IF(RC[-13]="",,"|n"&R1C22&RC[-13])&IF(RC[-11]="",,"|n"&R1C24&RC[-11])&IF(RC[-10]="",,"|n"&R1C25&RC[-10])&IF(RC[-9]="",,"|n"&R1C26&RC[-9])&IF(RC[-8]="",,"|n"&R1C27&RC[-8])&IF(RC[-7]="",,"|n"&R1C28&RC[-7])&IF(RC[-6]="",,"|n"&R1C29&RC[-6])&IF(RC[-2]="",,"|n"&RC[-2]) -> 
AI165: =IF(RC[-27]&RC[-26]&RC[-25]&RC[-24]&RC[-23]&RC[-22]="",,R1C7)&IF(RC[-27]="",,"|n"&R1C8&RC[-27])&IF(RC[-26]="",,"|n"&R1C9&RC[-26])&IF(RC[-25]="",,"|n"&R1C10&RC[-25])&IF(RC[-24]="",,"|n"&R1C11&RC[-24])&IF(RC[-23]="",,"|n"&R1C12&RC[-23])&IF(RC[-22]="",,"|n"&R1C13&RC[-22])&IF(RC[-20]&RC[-19]&RC[-18]&RC[-17]="",,"|n"&R1C14)&IF(RC[-20]="",,"|n"&R1C15&RC[-20])&IF(RC[-19]="",,"|n"&R1C16&RC[-19])&IF(RC[-18]="",,"|n"&R1C17&RC[-18])&IF(RC[-17]="",,"|n"&R1C18&RC[-17])&IF(RC[-16]="",,"|n"&R1C19&RC[-16])&IF(RC[-15]="",,"|n"&R1C20&RC[-15])&IF(RC[-14]="",,"|n"&R1C21&RC[-14])&IF(RC[-13]="",,"|n"&R1C22&RC[-13])&IF(RC[-11]="",,"|n"&R1C24&RC[-11])&IF(RC[-10]="",,"|n"&R1C25&RC[-10])&IF(RC[-9]="",,"|n"&R1C26&RC[-9])&IF(RC[-8]="",,"|n"&R1C27&RC[-8])&IF(RC[-7]="",,"|n"&R1C28&RC[-7])&IF(RC[-6]="",,"|n"&R1C29&RC[-6])&IF(RC[-2]="",,"|n"&RC[-2]) -> 
AI166: =IF(RC[-27]&RC[-26]&RC[-25]&RC[-24]&RC[-23]&RC[-22]="",,R1C7)&IF(RC[-27]="",,"|n"&R1C8&RC[-27])&IF(RC[-26]="",,"|n"&R1C9&RC[-26])&IF(RC[-25]="",,"|n"&R1C10&RC[-25])&IF(RC[-24]="",,"|n"&R1C11&RC[-24])&IF(RC[-23]="",,"|n"&R1C12&RC[-23])&IF(RC[-22]="",,"|n"&R1C13&RC[-22])&IF(RC[-20]&RC[-19]&RC[-18]&RC[-17]="",,"|n"&R1C14)&IF(RC[-20]="",,"|n"&R1C15&RC[-20])&IF(RC[-19]="",,"|n"&R1C16&RC[-19])&IF(RC[-18]="",,"|n"&R1C17&RC[-18])&IF(RC[-17]="",,"|n"&R1C18&RC[-17])&IF(RC[-16]="",,"|n"&R1C19&RC[-16])&IF(RC[-15]="",,"|n"&R1C20&RC[-15])&IF(RC[-14]="",,"|n"&R1C21&RC[-14])&IF(RC[-13]="",,"|n"&R1C22&RC[-13])&IF(RC[-11]="",,"|n"&R1C24&RC[-11])&IF(RC[-10]="",,"|n"&R1C25&RC[-10])&IF(RC[-9]="",,"|n"&R1C26&RC[-9])&IF(RC[-8]="",,"|n"&R1C27&RC[-8])&IF(RC[-7]="",,"|n"&R1C28&RC[-7])&IF(RC[-6]="",,"|n"&R1C29&RC[-6])&IF(RC[-2]="",,"|n"&RC[-2]) -> 
AI167: =IF(RC[-27]&RC[-26]&RC[-25]&RC[-24]&RC[-23]&RC[-22]="",,R1C7)&IF(RC[-27]="",,"|n"&R1C8&RC[-27])&IF(RC[-26]="",,"|n"&R1C9&RC[-26])&IF(RC[-25]="",,"|n"&R1C10&RC[-25])&IF(RC[-24]="",,"|n"&R1C11&RC[-24])&IF(RC[-23]="",,"|n"&R1C12&RC[-23])&IF(RC[-22]="",,"|n"&R1C13&RC[-22])&IF(RC[-20]&RC[-19]&RC[-18]&RC[-17]="",,"|n"&R1C14)&IF(RC[-20]="",,"|n"&R1C15&RC[-20])&IF(RC[-19]="",,"|n"&R1C16&RC[-19])&IF(RC[-18]="",,"|n"&R1C17&RC[-18])&IF(RC[-17]="",,"|n"&R1C18&RC[-17])&IF(RC[-16]="",,"|n"&R1C19&RC[-16])&IF(RC[-15]="",,"|n"&R1C20&RC[-15])&IF(RC[-14]="",,"|n"&R1C21&RC[-14])&IF(RC[-13]="",,"|n"&R1C22&RC[-13])&IF(RC[-11]="",,"|n"&R1C24&RC[-11])&IF(RC[-10]="",,"|n"&R1C25&RC[-10])&IF(RC[-9]="",,"|n"&R1C26&RC[-9])&IF(RC[-8]="",,"|n"&R1C27&RC[-8])&IF(RC[-7]="",,"|n"&R1C28&RC[-7])&IF(RC[-6]="",,"|n"&R1C29&RC[-6])&IF(RC[-2]="",,"|n"&RC[-2]) -> 
AI168: =IF(RC[-27]&RC[-26]&RC[-25]&RC[-24]&RC[-23]&RC[-22]="",,R1C7)&IF(RC[-27]="",,"|n"&R1C8&RC[-27])&IF(RC[-26]="",,"|n"&R1C9&RC[-26])&IF(RC[-25]="",,"|n"&R1C10&RC[-25])&IF(RC[-24]="",,"|n"&R1C11&RC[-24])&IF(RC[-23]="",,"|n"&R1C12&RC[-23])&IF(RC[-22]="",,"|n"&R1C13&RC[-22])&IF(RC[-20]&RC[-19]&RC[-18]&RC[-17]="",,"|n"&R1C14)&IF(RC[-20]="",,"|n"&R1C15&RC[-20])&IF(RC[-19]="",,"|n"&R1C16&RC[-19])&IF(RC[-18]="",,"|n"&R1C17&RC[-18])&IF(RC[-17]="",,"|n"&R1C18&RC[-17])&IF(RC[-16]="",,"|n"&R1C19&RC[-16])&IF(RC[-15]="",,"|n"&R1C20&RC[-15])&IF(RC[-14]="",,"|n"&R1C21&RC[-14])&IF(RC[-13]="",,"|n"&R1C22&RC[-13])&IF(RC[-11]="",,"|n"&R1C24&RC[-11])&IF(RC[-10]="",,"|n"&R1C25&RC[-10])&IF(RC[-9]="",,"|n"&R1C26&RC[-9])&IF(RC[-8]="",,"|n"&R1C27&RC[-8])&IF(RC[-7]="",,"|n"&R1C28&RC[-7])&IF(RC[-6]="",,"|n"&R1C29&RC[-6])&IF(RC[-2]="",,"|n"&RC[-2]) -> 
AI169: =IF(RC[-27]&RC[-26]&RC[-25]&RC[-24]&RC[-23]&RC[-22]="",,R1C7)&IF(RC[-27]="",,"|n"&R1C8&RC[-27])&IF(RC[-26]="",,"|n"&R1C9&RC[-26])&IF(RC[-25]="",,"|n"&R1C10&RC[-25])&IF(RC[-24]="",,"|n"&R1C11&RC[-24])&IF(RC[-23]="",,"|n"&R1C12&RC[-23])&IF(RC[-22]="",,"|n"&R1C13&RC[-22])&IF(RC[-20]&RC[-19]&RC[-18]&RC[-17]="",,"|n"&R1C14)&IF(RC[-20]="",,"|n"&R1C15&RC[-20])&IF(RC[-19]="",,"|n"&R1C16&RC[-19])&IF(RC[-18]="",,"|n"&R1C17&RC[-18])&IF(RC[-17]="",,"|n"&R1C18&RC[-17])&IF(RC[-16]="",,"|n"&R1C19&RC[-16])&IF(RC[-15]="",,"|n"&R1C20&RC[-15])&IF(RC[-14]="",,"|n"&R1C21&RC[-14])&IF(RC[-13]="",,"|n"&R1C22&RC[-13])&IF(RC[-11]="",,"|n"&R1C24&RC[-11])&IF(RC[-10]="",,"|n"&R1C25&RC[-10])&IF(RC[-9]="",,"|n"&R1C26&RC[-9])&IF(RC[-8]="",,"|n"&R1C27&RC[-8])&IF(RC[-7]="",,"|n"&R1C28&RC[-7])&IF(RC[-6]="",,"|n"&R1C29&RC[-6])&IF(RC[-2]="",,"|n"&RC[-2]) -> 
AI170: =IF(RC[-27]&RC[-26]&RC[-25]&RC[-24]&RC[-23]&RC[-22]="",,R1C7)&IF(RC[-27]="",,"|n"&R1C8&RC[-27])&IF(RC[-26]="",,"|n"&R1C9&RC[-26])&IF(RC[-25]="",,"|n"&R1C10&RC[-25])&IF(RC[-24]="",,"|n"&R1C11&RC[-24])&IF(RC[-23]="",,"|n"&R1C12&RC[-23])&IF(RC[-22]="",,"|n"&R1C13&RC[-22])&IF(RC[-20]&RC[-19]&RC[-18]&RC[-17]="",,"|n"&R1C14)&IF(RC[-20]="",,"|n"&R1C15&RC[-20])&IF(RC[-19]="",,"|n"&R1C16&RC[-19])&IF(RC[-18]="",,"|n"&R1C17&RC[-18])&IF(RC[-17]="",,"|n"&R1C18&RC[-17])&IF(RC[-16]="",,"|n"&R1C19&RC[-16])&IF(RC[-15]="",,"|n"&R1C20&RC[-15])&IF(RC[-14]="",,"|n"&R1C21&RC[-14])&IF(RC[-13]="",,"|n"&R1C22&RC[-13])&IF(RC[-11]="",,"|n"&R1C24&RC[-11])&IF(RC[-10]="",,"|n"&R1C25&RC[-10])&IF(RC[-9]="",,"|n"&R1C26&RC[-9])&IF(RC[-8]="",,"|n"&R1C27&RC[-8])&IF(RC[-7]="",,"|n"&R1C28&RC[-7])&IF(RC[-6]="",,"|n"&R1C29&RC[-6])&IF(RC[-2]="",,"|n"&RC[-2]) -> 
AI171: =IF(RC[-27]&RC[-26]&RC[-25]&RC[-24]&RC[-23]&RC[-22]="",,R1C7)&IF(RC[-27]="",,"|n"&R1C8&RC[-27])&IF(RC[-26]="",,"|n"&R1C9&RC[-26])&IF(RC[-25]="",,"|n"&R1C10&RC[-25])&IF(RC[-24]="",,"|n"&R1C11&RC[-24])&IF(RC[-23]="",,"|n"&R1C12&RC[-23])&IF(RC[-22]="",,"|n"&R1C13&RC[-22])&IF(RC[-20]&RC[-19]&RC[-18]&RC[-17]="",,"|n"&R1C14)&IF(RC[-20]="",,"|n"&R1C15&RC[-20])&IF(RC[-19]="",,"|n"&R1C16&RC[-19])&IF(RC[-18]="",,"|n"&R1C17&RC[-18])&IF(RC[-17]="",,"|n"&R1C18&RC[-17])&IF(RC[-16]="",,"|n"&R1C19&RC[-16])&IF(RC[-15]="",,"|n"&R1C20&RC[-15])&IF(RC[-14]="",,"|n"&R1C21&RC[-14])&IF(RC[-13]="",,"|n"&R1C22&RC[-13])&IF(RC[-11]="",,"|n"&R1C24&RC[-11])&IF(RC[-10]="",,"|n"&R1C25&RC[-10])&IF(RC[-9]="",,"|n"&R1C26&RC[-9])&IF(RC[-8]="",,"|n"&R1C27&RC[-8])&IF(RC[-7]="",,"|n"&R1C28&RC[-7])&IF(RC[-6]="",,"|n"&R1C29&RC[-6])&IF(RC[-2]="",,"|n"&RC[-2]) -> 
AI172: =IF(RC[-27]&RC[-26]&RC[-25]&RC[-24]&RC[-23]&RC[-22]="",,R1C7)&IF(RC[-27]="",,"|n"&R1C8&RC[-27])&IF(RC[-26]="",,"|n"&R1C9&RC[-26])&IF(RC[-25]="",,"|n"&R1C10&RC[-25])&IF(RC[-24]="",,"|n"&R1C11&RC[-24])&IF(RC[-23]="",,"|n"&R1C12&RC[-23])&IF(RC[-22]="",,"|n"&R1C13&RC[-22])&IF(RC[-20]&RC[-19]&RC[-18]&RC[-17]="",,"|n"&R1C14)&IF(RC[-20]="",,"|n"&R1C15&RC[-20])&IF(RC[-19]="",,"|n"&R1C16&RC[-19])&IF(RC[-18]="",,"|n"&R1C17&RC[-18])&IF(RC[-17]="",,"|n"&R1C18&RC[-17])&IF(RC[-16]="",,"|n"&R1C19&RC[-16])&IF(RC[-15]="",,"|n"&R1C20&RC[-15])&IF(RC[-14]="",,"|n"&R1C21&RC[-14])&IF(RC[-13]="",,"|n"&R1C22&RC[-13])&IF(RC[-11]="",,"|n"&R1C24&RC[-11])&IF(RC[-10]="",,"|n"&R1C25&RC[-10])&IF(RC[-9]="",,"|n"&R1C26&RC[-9])&IF(RC[-8]="",,"|n"&R1C27&RC[-8])&IF(RC[-7]="",,"|n"&R1C28&RC[-7])&IF(RC[-6]="",,"|n"&R1C29&RC[-6])&IF(RC[-2]="",,"|n"&RC[-2]) -> 
AI173: =IF(RC[-27]&RC[-26]&RC[-25]&RC[-24]&RC[-23]&RC[-22]="",,R1C7)&IF(RC[-27]="",,"|n"&R1C8&RC[-27])&IF(RC[-26]="",,"|n"&R1C9&RC[-26])&IF(RC[-25]="",,"|n"&R1C10&RC[-25])&IF(RC[-24]="",,"|n"&R1C11&RC[-24])&IF(RC[-23]="",,"|n"&R1C12&RC[-23])&IF(RC[-22]="",,"|n"&R1C13&RC[-22])&IF(RC[-20]&RC[-19]&RC[-18]&RC[-17]="",,"|n"&R1C14)&IF(RC[-20]="",,"|n"&R1C15&RC[-20])&IF(RC[-19]="",,"|n"&R1C16&RC[-19])&IF(RC[-18]="",,"|n"&R1C17&RC[-18])&IF(RC[-17]="",,"|n"&R1C18&RC[-17])&IF(RC[-16]="",,"|n"&R1C19&RC[-16])&IF(RC[-15]="",,"|n"&R1C20&RC[-15])&IF(RC[-14]="",,"|n"&R1C21&RC[-14])&IF(RC[-13]="",,"|n"&R1C22&RC[-13])&IF(RC[-11]="",,"|n"&R1C24&RC[-11])&IF(RC[-10]="",,"|n"&R1C25&RC[-10])&IF(RC[-9]="",,"|n"&R1C26&RC[-9])&IF(RC[-8]="",,"|n"&R1C27&RC[-8])&IF(RC[-7]="",,"|n"&R1C28&RC[-7])&IF(RC[-6]="",,"|n"&R1C29&RC[-6])&IF(RC[-2]="",,"|n"&RC[-2]) -> 
AI174: =IF(RC[-27]&RC[-26]&RC[-25]&RC[-24]&RC[-23]&RC[-22]="",,R1C7)&IF(RC[-27]="",,"|n"&R1C8&RC[-27])&IF(RC[-26]="",,"|n"&R1C9&RC[-26])&IF(RC[-25]="",,"|n"&R1C10&RC[-25])&IF(RC[-24]="",,"|n"&R1C11&RC[-24])&IF(RC[-23]="",,"|n"&R1C12&RC[-23])&IF(RC[-22]="",,"|n"&R1C13&RC[-22])&IF(RC[-20]&RC[-19]&RC[-18]&RC[-17]="",,"|n"&R1C14)&IF(RC[-20]="",,"|n"&R1C15&RC[-20])&IF(RC[-19]="",,"|n"&R1C16&RC[-19])&IF(RC[-18]="",,"|n"&R1C17&RC[-18])&IF(RC[-17]="",,"|n"&R1C18&RC[-17])&IF(RC[-16]="",,"|n"&R1C19&RC[-16])&IF(RC[-15]="",,"|n"&R1C20&RC[-15])&IF(RC[-14]="",,"|n"&R1C21&RC[-14])&IF(RC[-13]="",,"|n"&R1C22&RC[-13])&IF(RC[-11]="",,"|n"&R1C24&RC[-11])&IF(RC[-10]="",,"|n"&R1C25&RC[-10])&IF(RC[-9]="",,"|n"&R1C26&RC[-9])&IF(RC[-8]="",,"|n"&R1C27&RC[-8])&IF(RC[-7]="",,"|n"&R1C28&RC[-7])&IF(RC[-6]="",,"|n"&R1C29&RC[-6])&IF(RC[-2]="",,"|n"&RC[-2]) -> 
AI175: =IF(RC[-27]&RC[-26]&RC[-25]&RC[-24]&RC[-23]&RC[-22]="",,R1C7)&IF(RC[-27]="",,"|n"&R1C8&RC[-27])&IF(RC[-26]="",,"|n"&R1C9&RC[-26])&IF(RC[-25]="",,"|n"&R1C10&RC[-25])&IF(RC[-24]="",,"|n"&R1C11&RC[-24])&IF(RC[-23]="",,"|n"&R1C12&RC[-23])&IF(RC[-22]="",,"|n"&R1C13&RC[-22])&IF(RC[-20]&RC[-19]&RC[-18]&RC[-17]="",,"|n"&R1C14)&IF(RC[-20]="",,"|n"&R1C15&RC[-20])&IF(RC[-19]="",,"|n"&R1C16&RC[-19])&IF(RC[-18]="",,"|n"&R1C17&RC[-18])&IF(RC[-17]="",,"|n"&R1C18&RC[-17])&IF(RC[-16]="",,"|n"&R1C19&RC[-16])&IF(RC[-15]="",,"|n"&R1C20&RC[-15])&IF(RC[-14]="",,"|n"&R1C21&RC[-14])&IF(RC[-13]="",,"|n"&R1C22&RC[-13])&IF(RC[-11]="",,"|n"&R1C24&RC[-11])&IF(RC[-10]="",,"|n"&R1C25&RC[-10])&IF(RC[-9]="",,"|n"&R1C26&RC[-9])&IF(RC[-8]="",,"|n"&R1C27&RC[-8])&IF(RC[-7]="",,"|n"&R1C28&RC[-7])&IF(RC[-6]="",,"|n"&R1C29&RC[-6])&IF(RC[-2]="",,"|n"&RC[-2]) -> 
AI176: =IF(RC[-27]&RC[-26]&RC[-25]&RC[-24]&RC[-23]&RC[-22]="",,R1C7)&IF(RC[-27]="",,"|n"&R1C8&RC[-27])&IF(RC[-26]="",,"|n"&R1C9&RC[-26])&IF(RC[-25]="",,"|n"&R1C10&RC[-25])&IF(RC[-24]="",,"|n"&R1C11&RC[-24])&IF(RC[-23]="",,"|n"&R1C12&RC[-23])&IF(RC[-22]="",,"|n"&R1C13&RC[-22])&IF(RC[-20]&RC[-19]&RC[-18]&RC[-17]="",,"|n"&R1C14)&IF(RC[-20]="",,"|n"&R1C15&RC[-20])&IF(RC[-19]="",,"|n"&R1C16&RC[-19])&IF(RC[-18]="",,"|n"&R1C17&RC[-18])&IF(RC[-17]="",,"|n"&R1C18&RC[-17])&IF(RC[-16]="",,"|n"&R1C19&RC[-16])&IF(RC[-15]="",,"|n"&R1C20&RC[-15])&IF(RC[-14]="",,"|n"&R1C21&RC[-14])&IF(RC[-13]="",,"|n"&R1C22&RC[-13])&IF(RC[-11]="",,"|n"&R1C24&RC[-11])&IF(RC[-10]="",,"|n"&R1C25&RC[-10])&IF(RC[-9]="",,"|n"&R1C26&RC[-9])&IF(RC[-8]="",,"|n"&R1C27&RC[-8])&IF(RC[-7]="",,"|n"&R1C28&RC[-7])&IF(RC[-6]="",,"|n"&R1C29&RC[-6])&IF(RC[-2]="",,"|n"&RC[-2]) -> 
AI177: =IF(RC[-27]&RC[-26]&RC[-25]&RC[-24]&RC[-23]&RC[-22]="",,R1C7)&IF(RC[-27]="",,"|n"&R1C8&RC[-27])&IF(RC[-26]="",,"|n"&R1C9&RC[-26])&IF(RC[-25]="",,"|n"&R1C10&RC[-25])&IF(RC[-24]="",,"|n"&R1C11&RC[-24])&IF(RC[-23]="",,"|n"&R1C12&RC[-23])&IF(RC[-22]="",,"|n"&R1C13&RC[-22])&IF(RC[-20]&RC[-19]&RC[-18]&RC[-17]="",,"|n"&R1C14)&IF(RC[-20]="",,"|n"&R1C15&RC[-20])&IF(RC[-19]="",,"|n"&R1C16&RC[-19])&IF(RC[-18]="",,"|n"&R1C17&RC[-18])&IF(RC[-17]="",,"|n"&R1C18&RC[-17])&IF(RC[-16]="",,"|n"&R1C19&RC[-16])&IF(RC[-15]="",,"|n"&R1C20&RC[-15])&IF(RC[-14]="",,"|n"&R1C21&RC[-14])&IF(RC[-13]="",,"|n"&R1C22&RC[-13])&IF(RC[-11]="",,"|n"&R1C24&RC[-11])&IF(RC[-10]="",,"|n"&R1C25&RC[-10])&IF(RC[-9]="",,"|n"&R1C26&RC[-9])&IF(RC[-8]="",,"|n"&R1C27&RC[-8])&IF(RC[-7]="",,"|n"&R1C28&RC[-7])&IF(RC[-6]="",,"|n"&R1C29&RC[-6])&IF(RC[-2]="",,"|n"&RC[-2]) -> 
AI178: =IF(RC[-27]&RC[-26]&RC[-25]&RC[-24]&RC[-23]&RC[-22]="",,R1C7)&IF(RC[-27]="",,"|n"&R1C8&RC[-27])&IF(RC[-26]="",,"|n"&R1C9&RC[-26])&IF(RC[-25]="",,"|n"&R1C10&RC[-25])&IF(RC[-24]="",,"|n"&R1C11&RC[-24])&IF(RC[-23]="",,"|n"&R1C12&RC[-23])&IF(RC[-22]="",,"|n"&R1C13&RC[-22])&IF(RC[-20]&RC[-19]&RC[-18]&RC[-17]="",,"|n"&R1C14)&IF(RC[-20]="",,"|n"&R1C15&RC[-20])&IF(RC[-19]="",,"|n"&R1C16&RC[-19])&IF(RC[-18]="",,"|n"&R1C17&RC[-18])&IF(RC[-17]="",,"|n"&R1C18&RC[-17])&IF(RC[-16]="",,"|n"&R1C19&RC[-16])&IF(RC[-15]="",,"|n"&R1C20&RC[-15])&IF(RC[-14]="",,"|n"&R1C21&RC[-14])&IF(RC[-13]="",,"|n"&R1C22&RC[-13])&IF(RC[-11]="",,"|n"&R1C24&RC[-11])&IF(RC[-10]="",,"|n"&R1C25&RC[-10])&IF(RC[-9]="",,"|n"&R1C26&RC[-9])&IF(RC[-8]="",,"|n"&R1C27&RC[-8])&IF(RC[-7]="",,"|n"&R1C28&RC[-7])&IF(RC[-6]="",,"|n"&R1C29&RC[-6])&IF(RC[-2]="",,"|n"&RC[-2]) -> 
AI179: =IF(RC[-27]&RC[-26]&RC[-25]&RC[-24]&RC[-23]&RC[-22]="",,R1C7)&IF(RC[-27]="",,"|n"&R1C8&RC[-27])&IF(RC[-26]="",,"|n"&R1C9&RC[-26])&IF(RC[-25]="",,"|n"&R1C10&RC[-25])&IF(RC[-24]="",,"|n"&R1C11&RC[-24])&IF(RC[-23]="",,"|n"&R1C12&RC[-23])&IF(RC[-22]="",,"|n"&R1C13&RC[-22])&IF(RC[-20]&RC[-19]&RC[-18]&RC[-17]="",,"|n"&R1C14)&IF(RC[-20]="",,"|n"&R1C15&RC[-20])&IF(RC[-19]="",,"|n"&R1C16&RC[-19])&IF(RC[-18]="",,"|n"&R1C17&RC[-18])&IF(RC[-17]="",,"|n"&R1C18&RC[-17])&IF(RC[-16]="",,"|n"&R1C19&RC[-16])&IF(RC[-15]="",,"|n"&R1C20&RC[-15])&IF(RC[-14]="",,"|n"&R1C21&RC[-14])&IF(RC[-13]="",,"|n"&R1C22&RC[-13])&IF(RC[-11]="",,"|n"&R1C24&RC[-11])&IF(RC[-10]="",,"|n"&R1C25&RC[-10])&IF(RC[-9]="",,"|n"&R1C26&RC[-9])&IF(RC[-8]="",,"|n"&R1C27&RC[-8])&IF(RC[-7]="",,"|n"&R1C28&RC[-7])&IF(RC[-6]="",,"|n"&R1C29&RC[-6])&IF(RC[-2]="",,"|n"&RC[-2]) -> 
AI180: =IF(RC[-27]&RC[-26]&RC[-25]&RC[-24]&RC[-23]&RC[-22]="",,R1C7)&IF(RC[-27]="",,"|n"&R1C8&RC[-27])&IF(RC[-26]="",,"|n"&R1C9&RC[-26])&IF(RC[-25]="",,"|n"&R1C10&RC[-25])&IF(RC[-24]="",,"|n"&R1C11&RC[-24])&IF(RC[-23]="",,"|n"&R1C12&RC[-23])&IF(RC[-22]="",,"|n"&R1C13&RC[-22])&IF(RC[-20]&RC[-19]&RC[-18]&RC[-17]="",,"|n"&R1C14)&IF(RC[-20]="",,"|n"&R1C15&RC[-20])&IF(RC[-19]="",,"|n"&R1C16&RC[-19])&IF(RC[-18]="",,"|n"&R1C17&RC[-18])&IF(RC[-17]="",,"|n"&R1C18&RC[-17])&IF(RC[-16]="",,"|n"&R1C19&RC[-16])&IF(RC[-15]="",,"|n"&R1C20&RC[-15])&IF(RC[-14]="",,"|n"&R1C21&RC[-14])&IF(RC[-13]="",,"|n"&R1C22&RC[-13])&IF(RC[-11]="",,"|n"&R1C24&RC[-11])&IF(RC[-10]="",,"|n"&R1C25&RC[-10])&IF(RC[-9]="",,"|n"&R1C26&RC[-9])&IF(RC[-8]="",,"|n"&R1C27&RC[-8])&IF(RC[-7]="",,"|n"&R1C28&RC[-7])&IF(RC[-6]="",,"|n"&R1C29&RC[-6])&IF(RC[-2]="",,"|n"&RC[-2]) -> 
AI181: =IF(RC[-27]&RC[-26]&RC[-25]&RC[-24]&RC[-23]&RC[-22]="",,R1C7)&IF(RC[-27]="",,"|n"&R1C8&RC[-27])&IF(RC[-26]="",,"|n"&R1C9&RC[-26])&IF(RC[-25]="",,"|n"&R1C10&RC[-25])&IF(RC[-24]="",,"|n"&R1C11&RC[-24])&IF(RC[-23]="",,"|n"&R1C12&RC[-23])&IF(RC[-22]="",,"|n"&R1C13&RC[-22])&IF(RC[-20]&RC[-19]&RC[-18]&RC[-17]="",,"|n"&R1C14)&IF(RC[-20]="",,"|n"&R1C15&RC[-20])&IF(RC[-19]="",,"|n"&R1C16&RC[-19])&IF(RC[-18]="",,"|n"&R1C17&RC[-18])&IF(RC[-17]="",,"|n"&R1C18&RC[-17])&IF(RC[-16]="",,"|n"&R1C19&RC[-16])&IF(RC[-15]="",,"|n"&R1C20&RC[-15])&IF(RC[-14]="",,"|n"&R1C21&RC[-14])&IF(RC[-13]="",,"|n"&R1C22&RC[-13])&IF(RC[-11]="",,"|n"&R1C24&RC[-11])&IF(RC[-10]="",,"|n"&R1C25&RC[-10])&IF(RC[-9]="",,"|n"&R1C26&RC[-9])&IF(RC[-8]="",,"|n"&R1C27&RC[-8])&IF(RC[-7]="",,"|n"&R1C28&RC[-7])&IF(RC[-6]="",,"|n"&R1C29&RC[-6])&IF(RC[-2]="",,"|n"&RC[-2]) -> 
AI182: =IF(RC[-27]&RC[-26]&RC[-25]&RC[-24]&RC[-23]&RC[-22]="",,R1C7)&IF(RC[-27]="",,"|n"&R1C8&RC[-27])&IF(RC[-26]="",,"|n"&R1C9&RC[-26])&IF(RC[-25]="",,"|n"&R1C10&RC[-25])&IF(RC[-24]="",,"|n"&R1C11&RC[-24])&IF(RC[-23]="",,"|n"&R1C12&RC[-23])&IF(RC[-22]="",,"|n"&R1C13&RC[-22])&IF(RC[-20]&RC[-19]&RC[-18]&RC[-17]="",,"|n"&R1C14)&IF(RC[-20]="",,"|n"&R1C15&RC[-20])&IF(RC[-19]="",,"|n"&R1C16&RC[-19])&IF(RC[-18]="",,"|n"&R1C17&RC[-18])&IF(RC[-17]="",,"|n"&R1C18&RC[-17])&IF(RC[-16]="",,"|n"&R1C19&RC[-16])&IF(RC[-15]="",,"|n"&R1C20&RC[-15])&IF(RC[-14]="",,"|n"&R1C21&RC[-14])&IF(RC[-13]="",,"|n"&R1C22&RC[-13])&IF(RC[-11]="",,"|n"&R1C24&RC[-11])&IF(RC[-10]="",,"|n"&R1C25&RC[-10])&IF(RC[-9]="",,"|n"&R1C26&RC[-9])&IF(RC[-8]="",,"|n"&R1C27&RC[-8])&IF(RC[-7]="",,"|n"&R1C28&RC[-7])&IF(RC[-6]="",,"|n"&R1C29&RC[-6])&IF(RC[-2]="",,"|n"&RC[-2]) -> 
AI183: =IF(RC[-27]&RC[-26]&RC[-25]&RC[-24]&RC[-23]&RC[-22]="",,R1C7)&IF(RC[-27]="",,"|n"&R1C8&RC[-27])&IF(RC[-26]="",,"|n"&R1C9&RC[-26])&IF(RC[-25]="",,"|n"&R1C10&RC[-25])&IF(RC[-24]="",,"|n"&R1C11&RC[-24])&IF(RC[-23]="",,"|n"&R1C12&RC[-23])&IF(RC[-22]="",,"|n"&R1C13&RC[-22])&IF(RC[-20]&RC[-19]&RC[-18]&RC[-17]="",,"|n"&R1C14)&IF(RC[-20]="",,"|n"&R1C15&RC[-20])&IF(RC[-19]="",,"|n"&R1C16&RC[-19])&IF(RC[-18]="",,"|n"&R1C17&RC[-18])&IF(RC[-17]="",,"|n"&R1C18&RC[-17])&IF(RC[-16]="",,"|n"&R1C19&RC[-16])&IF(RC[-15]="",,"|n"&R1C20&RC[-15])&IF(RC[-14]="",,"|n"&R1C21&RC[-14])&IF(RC[-13]="",,"|n"&R1C22&RC[-13])&IF(RC[-11]="",,"|n"&R1C24&RC[-11])&IF(RC[-10]="",,"|n"&R1C25&RC[-10])&IF(RC[-9]="",,"|n"&R1C26&RC[-9])&IF(RC[-8]="",,"|n"&R1C27&RC[-8])&IF(RC[-7]="",,"|n"&R1C28&RC[-7])&IF(RC[-6]="",,"|n"&R1C29&RC[-6])&IF(RC[-2]="",,"|n"&RC[-2]) -> 
AI184: =IF(RC[-27]&RC[-26]&RC[-25]&RC[-24]&RC[-23]&RC[-22]="",,R1C7)&IF(RC[-27]="",,"|n"&R1C8&RC[-27])&IF(RC[-26]="",,"|n"&R1C9&RC[-26])&IF(RC[-25]="",,"|n"&R1C10&RC[-25])&IF(RC[-24]="",,"|n"&R1C11&RC[-24])&IF(RC[-23]="",,"|n"&R1C12&RC[-23])&IF(RC[-22]="",,"|n"&R1C13&RC[-22])&IF(RC[-20]&RC[-19]&RC[-18]&RC[-17]="",,"|n"&R1C14)&IF(RC[-20]="",,"|n"&R1C15&RC[-20])&IF(RC[-19]="",,"|n"&R1C16&RC[-19])&IF(RC[-18]="",,"|n"&R1C17&RC[-18])&IF(RC[-17]="",,"|n"&R1C18&RC[-17])&IF(RC[-16]="",,"|n"&R1C19&RC[-16])&IF(RC[-15]="",,"|n"&R1C20&RC[-15])&IF(RC[-14]="",,"|n"&R1C21&RC[-14])&IF(RC[-13]="",,"|n"&R1C22&RC[-13])&IF(RC[-11]="",,"|n"&R1C24&RC[-11])&IF(RC[-10]="",,"|n"&R1C25&RC[-10])&IF(RC[-9]="",,"|n"&R1C26&RC[-9])&IF(RC[-8]="",,"|n"&R1C27&RC[-8])&IF(RC[-7]="",,"|n"&R1C28&RC[-7])&IF(RC[-6]="",,"|n"&R1C29&RC[-6])&IF(RC[-2]="",,"|n"&RC[-2]) -> 
AI185: =IF(RC[-27]&RC[-26]&RC[-25]&RC[-24]&RC[-23]&RC[-22]="",,R1C7)&IF(RC[-27]="",,"|n"&R1C8&RC[-27])&IF(RC[-26]="",,"|n"&R1C9&RC[-26])&IF(RC[-25]="",,"|n"&R1C10&RC[-25])&IF(RC[-24]="",,"|n"&R1C11&RC[-24])&IF(RC[-23]="",,"|n"&R1C12&RC[-23])&IF(RC[-22]="",,"|n"&R1C13&RC[-22])&IF(RC[-20]&RC[-19]&RC[-18]&RC[-17]="",,"|n"&R1C14)&IF(RC[-20]="",,"|n"&R1C15&RC[-20])&IF(RC[-19]="",,"|n"&R1C16&RC[-19])&IF(RC[-18]="",,"|n"&R1C17&RC[-18])&IF(RC[-17]="",,"|n"&R1C18&RC[-17])&IF(RC[-16]="",,"|n"&R1C19&RC[-16])&IF(RC[-15]="",,"|n"&R1C20&RC[-15])&IF(RC[-14]="",,"|n"&R1C21&RC[-14])&IF(RC[-13]="",,"|n"&R1C22&RC[-13])&IF(RC[-11]="",,"|n"&R1C24&RC[-11])&IF(RC[-10]="",,"|n"&R1C25&RC[-10])&IF(RC[-9]="",,"|n"&R1C26&RC[-9])&IF(RC[-8]="",,"|n"&R1C27&RC[-8])&IF(RC[-7]="",,"|n"&R1C28&RC[-7])&IF(RC[-6]="",,"|n"&R1C29&RC[-6])&IF(RC[-2]="",,"|n"&RC[-2]) -> 
AI186: =IF(RC[-27]&RC[-26]&RC[-25]&RC[-24]&RC[-23]&RC[-22]="",,R1C7)&IF(RC[-27]="",,"|n"&R1C8&RC[-27])&IF(RC[-26]="",,"|n"&R1C9&RC[-26])&IF(RC[-25]="",,"|n"&R1C10&RC[-25])&IF(RC[-24]="",,"|n"&R1C11&RC[-24])&IF(RC[-23]="",,"|n"&R1C12&RC[-23])&IF(RC[-22]="",,"|n"&R1C13&RC[-22])&IF(RC[-20]&RC[-19]&RC[-18]&RC[-17]="",,"|n"&R1C14)&IF(RC[-20]="",,"|n"&R1C15&RC[-20])&IF(RC[-19]="",,"|n"&R1C16&RC[-19])&IF(RC[-18]="",,"|n"&R1C17&RC[-18])&IF(RC[-17]="",,"|n"&R1C18&RC[-17])&IF(RC[-16]="",,"|n"&R1C19&RC[-16])&IF(RC[-15]="",,"|n"&R1C20&RC[-15])&IF(RC[-14]="",,"|n"&R1C21&RC[-14])&IF(RC[-13]="",,"|n"&R1C22&RC[-13])&IF(RC[-11]="",,"|n"&R1C24&RC[-11])&IF(RC[-10]="",,"|n"&R1C25&RC[-10])&IF(RC[-9]="",,"|n"&R1C26&RC[-9])&IF(RC[-8]="",,"|n"&R1C27&RC[-8])&IF(RC[-7]="",,"|n"&R1C28&RC[-7])&IF(RC[-6]="",,"|n"&R1C29&RC[-6])&IF(RC[-2]="",,"|n"&RC[-2]) -> 
AI187: =IF(RC[-27]&RC[-26]&RC[-25]&RC[-24]&RC[-23]&RC[-22]="",,R1C7)&IF(RC[-27]="",,"|n"&R1C8&RC[-27])&IF(RC[-26]="",,"|n"&R1C9&RC[-26])&IF(RC[-25]="",,"|n"&R1C10&RC[-25])&IF(RC[-24]="",,"|n"&R1C11&RC[-24])&IF(RC[-23]="",,"|n"&R1C12&RC[-23])&IF(RC[-22]="",,"|n"&R1C13&RC[-22])&IF(RC[-20]&RC[-19]&RC[-18]&RC[-17]="",,"|n"&R1C14)&IF(RC[-20]="",,"|n"&R1C15&RC[-20])&IF(RC[-19]="",,"|n"&R1C16&RC[-19])&IF(RC[-18]="",,"|n"&R1C17&RC[-18])&IF(RC[-17]="",,"|n"&R1C18&RC[-17])&IF(RC[-16]="",,"|n"&R1C19&RC[-16])&IF(RC[-15]="",,"|n"&R1C20&RC[-15])&IF(RC[-14]="",,"|n"&R1C21&RC[-14])&IF(RC[-13]="",,"|n"&R1C22&RC[-13])&IF(RC[-11]="",,"|n"&R1C24&RC[-11])&IF(RC[-10]="",,"|n"&R1C25&RC[-10])&IF(RC[-9]="",,"|n"&R1C26&RC[-9])&IF(RC[-8]="",,"|n"&R1C27&RC[-8])&IF(RC[-7]="",,"|n"&R1C28&RC[-7])&IF(RC[-6]="",,"|n"&R1C29&RC[-6])&IF(RC[-2]="",,"|n"&RC[-2]) -> 
AI188: =IF(RC[-27]&RC[-26]&RC[-25]&RC[-24]&RC[-23]&RC[-22]="",,R1C7)&IF(RC[-27]="",,"|n"&R1C8&RC[-27])&IF(RC[-26]="",,"|n"&R1C9&RC[-26])&IF(RC[-25]="",,"|n"&R1C10&RC[-25])&IF(RC[-24]="",,"|n"&R1C11&RC[-24])&IF(RC[-23]="",,"|n"&R1C12&RC[-23])&IF(RC[-22]="",,"|n"&R1C13&RC[-22])&IF(RC[-20]&RC[-19]&RC[-18]&RC[-17]="",,"|n"&R1C14)&IF(RC[-20]="",,"|n"&R1C15&RC[-20])&IF(RC[-19]="",,"|n"&R1C16&RC[-19])&IF(RC[-18]="",,"|n"&R1C17&RC[-18])&IF(RC[-17]="",,"|n"&R1C18&RC[-17])&IF(RC[-16]="",,"|n"&R1C19&RC[-16])&IF(RC[-15]="",,"|n"&R1C20&RC[-15])&IF(RC[-14]="",,"|n"&R1C21&RC[-14])&IF(RC[-13]="",,"|n"&R1C22&RC[-13])&IF(RC[-11]="",,"|n"&R1C24&RC[-11])&IF(RC[-10]="",,"|n"&R1C25&RC[-10])&IF(RC[-9]="",,"|n"&R1C26&RC[-9])&IF(RC[-8]="",,"|n"&R1C27&RC[-8])&IF(RC[-7]="",,"|n"&R1C28&RC[-7])&IF(RC[-6]="",,"|n"&R1C29&RC[-6])&IF(RC[-2]="",,"|n"&RC[-2]) -> 
AI189: =IF(RC[-27]&RC[-26]&RC[-25]&RC[-24]&RC[-23]&RC[-22]="",,R1C7)&IF(RC[-27]="",,"|n"&R1C8&RC[-27])&IF(RC[-26]="",,"|n"&R1C9&RC[-26])&IF(RC[-25]="",,"|n"&R1C10&RC[-25])&IF(RC[-24]="",,"|n"&R1C11&RC[-24])&IF(RC[-23]="",,"|n"&R1C12&RC[-23])&IF(RC[-22]="",,"|n"&R1C13&RC[-22])&IF(RC[-20]&RC[-19]&RC[-18]&RC[-17]="",,"|n"&R1C14)&IF(RC[-20]="",,"|n"&R1C15&RC[-20])&IF(RC[-19]="",,"|n"&R1C16&RC[-19])&IF(RC[-18]="",,"|n"&R1C17&RC[-18])&IF(RC[-17]="",,"|n"&R1C18&RC[-17])&IF(RC[-16]="",,"|n"&R1C19&RC[-16])&IF(RC[-15]="",,"|n"&R1C20&RC[-15])&IF(RC[-14]="",,"|n"&R1C21&RC[-14])&IF(RC[-13]="",,"|n"&R1C22&RC[-13])&IF(RC[-11]="",,"|n"&R1C24&RC[-11])&IF(RC[-10]="",,"|n"&R1C25&RC[-10])&IF(RC[-9]="",,"|n"&R1C26&RC[-9])&IF(RC[-8]="",,"|n"&R1C27&RC[-8])&IF(RC[-7]="",,"|n"&R1C28&RC[-7])&IF(RC[-6]="",,"|n"&R1C29&RC[-6])&IF(RC[-2]="",,"|n"&RC[-2]) -> 
AI190: =IF(RC[-27]&RC[-26]&RC[-25]&RC[-24]&RC[-23]&RC[-22]="",,R1C7)&IF(RC[-27]="",,"|n"&R1C8&RC[-27])&IF(RC[-26]="",,"|n"&R1C9&RC[-26])&IF(RC[-25]="",,"|n"&R1C10&RC[-25])&IF(RC[-24]="",,"|n"&R1C11&RC[-24])&IF(RC[-23]="",,"|n"&R1C12&RC[-23])&IF(RC[-22]="",,"|n"&R1C13&RC[-22])&IF(RC[-20]&RC[-19]&RC[-18]&RC[-17]="",,"|n"&R1C14)&IF(RC[-20]="",,"|n"&R1C15&RC[-20])&IF(RC[-19]="",,"|n"&R1C16&RC[-19])&IF(RC[-18]="",,"|n"&R1C17&RC[-18])&IF(RC[-17]="",,"|n"&R1C18&RC[-17])&IF(RC[-16]="",,"|n"&R1C19&RC[-16])&IF(RC[-15]="",,"|n"&R1C20&RC[-15])&IF(RC[-14]="",,"|n"&R1C21&RC[-14])&IF(RC[-13]="",,"|n"&R1C22&RC[-13])&IF(RC[-11]="",,"|n"&R1C24&RC[-11])&IF(RC[-10]="",,"|n"&R1C25&RC[-10])&IF(RC[-9]="",,"|n"&R1C26&RC[-9])&IF(RC[-8]="",,"|n"&R1C27&RC[-8])&IF(RC[-7]="",,"|n"&R1C28&RC[-7])&IF(RC[-6]="",,"|n"&R1C29&RC[-6])&IF(RC[-2]="",,"|n"&RC[-2]) -> 
AI191: =IF(RC[-27]&RC[-26]&RC[-25]&RC[-24]&RC[-23]&RC[-22]="",,R1C7)&IF(RC[-27]="",,"|n"&R1C8&RC[-27])&IF(RC[-26]="",,"|n"&R1C9&RC[-26])&IF(RC[-25]="",,"|n"&R1C10&RC[-25])&IF(RC[-24]="",,"|n"&R1C11&RC[-24])&IF(RC[-23]="",,"|n"&R1C12&RC[-23])&IF(RC[-22]="",,"|n"&R1C13&RC[-22])&IF(RC[-20]&RC[-19]&RC[-18]&RC[-17]="",,"|n"&R1C14)&IF(RC[-20]="",,"|n"&R1C15&RC[-20])&IF(RC[-19]="",,"|n"&R1C16&RC[-19])&IF(RC[-18]="",,"|n"&R1C17&RC[-18])&IF(RC[-17]="",,"|n"&R1C18&RC[-17])&IF(RC[-16]="",,"|n"&R1C19&RC[-16])&IF(RC[-15]="",,"|n"&R1C20&RC[-15])&IF(RC[-14]="",,"|n"&R1C21&RC[-14])&IF(RC[-13]="",,"|n"&R1C22&RC[-13])&IF(RC[-11]="",,"|n"&R1C24&RC[-11])&IF(RC[-10]="",,"|n"&R1C25&RC[-10])&IF(RC[-9]="",,"|n"&R1C26&RC[-9])&IF(RC[-8]="",,"|n"&R1C27&RC[-8])&IF(RC[-7]="",,"|n"&R1C28&RC[-7])&IF(RC[-6]="",,"|n"&R1C29&RC[-6])&IF(RC[-2]="",,"|n"&RC[-2]) -> 
AI192: =IF(RC[-27]&RC[-26]&RC[-25]&RC[-24]&RC[-23]&RC[-22]="",,R1C7)&IF(RC[-27]="",,"|n"&R1C8&RC[-27])&IF(RC[-26]="",,"|n"&R1C9&RC[-26])&IF(RC[-25]="",,"|n"&R1C10&RC[-25])&IF(RC[-24]="",,"|n"&R1C11&RC[-24])&IF(RC[-23]="",,"|n"&R1C12&RC[-23])&IF(RC[-22]="",,"|n"&R1C13&RC[-22])&IF(RC[-20]&RC[-19]&RC[-18]&RC[-17]="",,"|n"&R1C14)&IF(RC[-20]="",,"|n"&R1C15&RC[-20])&IF(RC[-19]="",,"|n"&R1C16&RC[-19])&IF(RC[-18]="",,"|n"&R1C17&RC[-18])&IF(RC[-17]="",,"|n"&R1C18&RC[-17])&IF(RC[-16]="",,"|n"&R1C19&RC[-16])&IF(RC[-15]="",,"|n"&R1C20&RC[-15])&IF(RC[-14]="",,"|n"&R1C21&RC[-14])&IF(RC[-13]="",,"|n"&R1C22&RC[-13])&IF(RC[-11]="",,"|n"&R1C24&RC[-11])&IF(RC[-10]="",,"|n"&R1C25&RC[-10])&IF(RC[-9]="",,"|n"&R1C26&RC[-9])&IF(RC[-8]="",,"|n"&R1C27&RC[-8])&IF(RC[-7]="",,"|n"&R1C28&RC[-7])&IF(RC[-6]="",,"|n"&R1C29&RC[-6])&IF(RC[-2]="",,"|n"&RC[-2]) -> 
AI193: =IF(RC[-27]&RC[-26]&RC[-25]&RC[-24]&RC[-23]&RC[-22]="",,R1C7)&IF(RC[-27]="",,"|n"&R1C8&RC[-27])&IF(RC[-26]="",,"|n"&R1C9&RC[-26])&IF(RC[-25]="",,"|n"&R1C10&RC[-25])&IF(RC[-24]="",,"|n"&R1C11&RC[-24])&IF(RC[-23]="",,"|n"&R1C12&RC[-23])&IF(RC[-22]="",,"|n"&R1C13&RC[-22])&IF(RC[-20]&RC[-19]&RC[-18]&RC[-17]="",,"|n"&R1C14)&IF(RC[-20]="",,"|n"&R1C15&RC[-20])&IF(RC[-19]="",,"|n"&R1C16&RC[-19])&IF(RC[-18]="",,"|n"&R1C17&RC[-18])&IF(RC[-17]="",,"|n"&R1C18&RC[-17])&IF(RC[-16]="",,"|n"&R1C19&RC[-16])&IF(RC[-15]="",,"|n"&R1C20&RC[-15])&IF(RC[-14]="",,"|n"&R1C21&RC[-14])&IF(RC[-13]="",,"|n"&R1C22&RC[-13])&IF(RC[-11]="",,"|n"&R1C24&RC[-11])&IF(RC[-10]="",,"|n"&R1C25&RC[-10])&IF(RC[-9]="",,"|n"&R1C26&RC[-9])&IF(RC[-8]="",,"|n"&R1C27&RC[-8])&IF(RC[-7]="",,"|n"&R1C28&RC[-7])&IF(RC[-6]="",,"|n"&R1C29&RC[-6])&IF(RC[-2]="",,"|n"&RC[-2]) -> 
AI194: =IF(RC[-27]&RC[-26]&RC[-25]&RC[-24]&RC[-23]&RC[-22]="",,R1C7)&IF(RC[-27]="",,"|n"&R1C8&RC[-27])&IF(RC[-26]="",,"|n"&R1C9&RC[-26])&IF(RC[-25]="",,"|n"&R1C10&RC[-25])&IF(RC[-24]="",,"|n"&R1C11&RC[-24])&IF(RC[-23]="",,"|n"&R1C12&RC[-23])&IF(RC[-22]="",,"|n"&R1C13&RC[-22])&IF(RC[-20]&RC[-19]&RC[-18]&RC[-17]="",,"|n"&R1C14)&IF(RC[-20]="",,"|n"&R1C15&RC[-20])&IF(RC[-19]="",,"|n"&R1C16&RC[-19])&IF(RC[-18]="",,"|n"&R1C17&RC[-18])&IF(RC[-17]="",,"|n"&R1C18&RC[-17])&IF(RC[-16]="",,"|n"&R1C19&RC[-16])&IF(RC[-15]="",,"|n"&R1C20&RC[-15])&IF(RC[-14]="",,"|n"&R1C21&RC[-14])&IF(RC[-13]="",,"|n"&R1C22&RC[-13])&IF(RC[-11]="",,"|n"&R1C24&RC[-11])&IF(RC[-10]="",,"|n"&R1C25&RC[-10])&IF(RC[-9]="",,"|n"&R1C26&RC[-9])&IF(RC[-8]="",,"|n"&R1C27&RC[-8])&IF(RC[-7]="",,"|n"&R1C28&RC[-7])&IF(RC[-6]="",,"|n"&R1C29&RC[-6])&IF(RC[-2]="",,"|n"&RC[-2]) -> 
AI195: =IF(RC[-27]&RC[-26]&RC[-25]&RC[-24]&RC[-23]&RC[-22]="",,R1C7)&IF(RC[-27]="",,"|n"&R1C8&RC[-27])&IF(RC[-26]="",,"|n"&R1C9&RC[-26])&IF(RC[-25]="",,"|n"&R1C10&RC[-25])&IF(RC[-24]="",,"|n"&R1C11&RC[-24])&IF(RC[-23]="",,"|n"&R1C12&RC[-23])&IF(RC[-22]="",,"|n"&R1C13&RC[-22])&IF(RC[-20]&RC[-19]&RC[-18]&RC[-17]="",,"|n"&R1C14)&IF(RC[-20]="",,"|n"&R1C15&RC[-20])&IF(RC[-19]="",,"|n"&R1C16&RC[-19])&IF(RC[-18]="",,"|n"&R1C17&RC[-18])&IF(RC[-17]="",,"|n"&R1C18&RC[-17])&IF(RC[-16]="",,"|n"&R1C19&RC[-16])&IF(RC[-15]="",,"|n"&R1C20&RC[-15])&IF(RC[-14]="",,"|n"&R1C21&RC[-14])&IF(RC[-13]="",,"|n"&R1C22&RC[-13])&IF(RC[-11]="",,"|n"&R1C24&RC[-11])&IF(RC[-10]="",,"|n"&R1C25&RC[-10])&IF(RC[-9]="",,"|n"&R1C26&RC[-9])&IF(RC[-8]="",,"|n"&R1C27&RC[-8])&IF(RC[-7]="",,"|n"&R1C28&RC[-7])&IF(RC[-6]="",,"|n"&R1C29&RC[-6])&IF(RC[-2]="",,"|n"&RC[-2]) -> 
AI196: =IF(RC[-27]&RC[-26]&RC[-25]&RC[-24]&RC[-23]&RC[-22]="",,R1C7)&IF(RC[-27]="",,"|n"&R1C8&RC[-27])&IF(RC[-26]="",,"|n"&R1C9&RC[-26])&IF(RC[-25]="",,"|n"&R1C10&RC[-25])&IF(RC[-24]="",,"|n"&R1C11&RC[-24])&IF(RC[-23]="",,"|n"&R1C12&RC[-23])&IF(RC[-22]="",,"|n"&R1C13&RC[-22])&IF(RC[-20]&RC[-19]&RC[-18]&RC[-17]="",,"|n"&R1C14)&IF(RC[-20]="",,"|n"&R1C15&RC[-20])&IF(RC[-19]="",,"|n"&R1C16&RC[-19])&IF(RC[-18]="",,"|n"&R1C17&RC[-18])&IF(RC[-17]="",,"|n"&R1C18&RC[-17])&IF(RC[-16]="",,"|n"&R1C19&RC[-16])&IF(RC[-15]="",,"|n"&R1C20&RC[-15])&IF(RC[-14]="",,"|n"&R1C21&RC[-14])&IF(RC[-13]="",,"|n"&R1C22&RC[-13])&IF(RC[-11]="",,"|n"&R1C24&RC[-11])&IF(RC[-10]="",,"|n"&R1C25&RC[-10])&IF(RC[-9]="",,"|n"&R1C26&RC[-9])&IF(RC[-8]="",,"|n"&R1C27&RC[-8])&IF(RC[-7]="",,"|n"&R1C28&RC[-7])&IF(RC[-6]="",,"|n"&R1C29&RC[-6])&IF(RC[-2]="",,"|n"&RC[-2]) -> 
AI197: =IF(RC[-27]&RC[-26]&RC[-25]&RC[-24]&RC[-23]&RC[-22]="",,R1C7)&IF(RC[-27]="",,"|n"&R1C8&RC[-27])&IF(RC[-26]="",,"|n"&R1C9&RC[-26])&IF(RC[-25]="",,"|n"&R1C10&RC[-25])&IF(RC[-24]="",,"|n"&R1C11&RC[-24])&IF(RC[-23]="",,"|n"&R1C12&RC[-23])&IF(RC[-22]="",,"|n"&R1C13&RC[-22])&IF(RC[-20]&RC[-19]&RC[-18]&RC[-17]="",,"|n"&R1C14)&IF(RC[-20]="",,"|n"&R1C15&RC[-20])&IF(RC[-19]="",,"|n"&R1C16&RC[-19])&IF(RC[-18]="",,"|n"&R1C17&RC[-18])&IF(RC[-17]="",,"|n"&R1C18&RC[-17])&IF(RC[-16]="",,"|n"&R1C19&RC[-16])&IF(RC[-15]="",,"|n"&R1C20&RC[-15])&IF(RC[-14]="",,"|n"&R1C21&RC[-14])&IF(RC[-13]="",,"|n"&R1C22&RC[-13])&IF(RC[-11]="",,"|n"&R1C24&RC[-11])&IF(RC[-10]="",,"|n"&R1C25&RC[-10])&IF(RC[-9]="",,"|n"&R1C26&RC[-9])&IF(RC[-8]="",,"|n"&R1C27&RC[-8])&IF(RC[-7]="",,"|n"&R1C28&RC[-7])&IF(RC[-6]="",,"|n"&R1C29&RC[-6])&IF(RC[-2]="",,"|n"&RC[-2]) -> 
AI198: =IF(RC[-27]&RC[-26]&RC[-25]&RC[-24]&RC[-23]&RC[-22]="",,R1C7)&IF(RC[-27]="",,"|n"&R1C8&RC[-27])&IF(RC[-26]="",,"|n"&R1C9&RC[-26])&IF(RC[-25]="",,"|n"&R1C10&RC[-25])&IF(RC[-24]="",,"|n"&R1C11&RC[-24])&IF(RC[-23]="",,"|n"&R1C12&RC[-23])&IF(RC[-22]="",,"|n"&R1C13&RC[-22])&IF(RC[-20]&RC[-19]&RC[-18]&RC[-17]="",,"|n"&R1C14)&IF(RC[-20]="",,"|n"&R1C15&RC[-20])&IF(RC[-19]="",,"|n"&R1C16&RC[-19])&IF(RC[-18]="",,"|n"&R1C17&RC[-18])&IF(RC[-17]="",,"|n"&R1C18&RC[-17])&IF(RC[-16]="",,"|n"&R1C19&RC[-16])&IF(RC[-15]="",,"|n"&R1C20&RC[-15])&IF(RC[-14]="",,"|n"&R1C21&RC[-14])&IF(RC[-13]="",,"|n"&R1C22&RC[-13])&IF(RC[-11]="",,"|n"&R1C24&RC[-11])&IF(RC[-10]="",,"|n"&R1C25&RC[-10])&IF(RC[-9]="",,"|n"&R1C26&RC[-9])&IF(RC[-8]="",,"|n"&R1C27&RC[-8])&IF(RC[-7]="",,"|n"&R1C28&RC[-7])&IF(RC[-6]="",,"|n"&R1C29&RC[-6])&IF(RC[-2]="",,"|n"&RC[-2]) -> 
AI199: =IF(RC[-27]&RC[-26]&RC[-25]&RC[-24]&RC[-23]&RC[-22]="",,R1C7)&IF(RC[-27]="",,"|n"&R1C8&RC[-27])&IF(RC[-26]="",,"|n"&R1C9&RC[-26])&IF(RC[-25]="",,"|n"&R1C10&RC[-25])&IF(RC[-24]="",,"|n"&R1C11&RC[-24])&IF(RC[-23]="",,"|n"&R1C12&RC[-23])&IF(RC[-22]="",,"|n"&R1C13&RC[-22])&IF(RC[-20]&RC[-19]&RC[-18]&RC[-17]="",,"|n"&R1C14)&IF(RC[-20]="",,"|n"&R1C15&RC[-20])&IF(RC[-19]="",,"|n"&R1C16&RC[-19])&IF(RC[-18]="",,"|n"&R1C17&RC[-18])&IF(RC[-17]="",,"|n"&R1C18&RC[-17])&IF(RC[-16]="",,"|n"&R1C19&RC[-16])&IF(RC[-15]="",,"|n"&R1C20&RC[-15])&IF(RC[-14]="",,"|n"&R1C21&RC[-14])&IF(RC[-13]="",,"|n"&R1C22&RC[-13])&IF(RC[-11]="",,"|n"&R1C24&RC[-11])&IF(RC[-10]="",,"|n"&R1C25&RC[-10])&IF(RC[-9]="",,"|n"&R1C26&RC[-9])&IF(RC[-8]="",,"|n"&R1C27&RC[-8])&IF(RC[-7]="",,"|n"&R1C28&RC[-7])&IF(RC[-6]="",,"|n"&R1C29&RC[-6])&IF(RC[-2]="",,"|n"&RC[-2]) -> 
AI200: =IF(RC[-27]&RC[-26]&RC[-25]&RC[-24]&RC[-23]&RC[-22]="",,R1C7)&IF(RC[-27]="",,"|n"&R1C8&RC[-27])&IF(RC[-26]="",,"|n"&R1C9&RC[-26])&IF(RC[-25]="",,"|n"&R1C10&RC[-25])&IF(RC[-24]="",,"|n"&R1C11&RC[-24])&IF(RC[-23]="",,"|n"&R1C12&RC[-23])&IF(RC[-22]="",,"|n"&R1C13&RC[-22])&IF(RC[-20]&RC[-19]&RC[-18]&RC[-17]="",,"|n"&R1C14)&IF(RC[-20]="",,"|n"&R1C15&RC[-20])&IF(RC[-19]="",,"|n"&R1C16&RC[-19])&IF(RC[-18]="",,"|n"&R1C17&RC[-18])&IF(RC[-17]="",,"|n"&R1C18&RC[-17])&IF(RC[-16]="",,"|n"&R1C19&RC[-16])&IF(RC[-15]="",,"|n"&R1C20&RC[-15])&IF(RC[-14]="",,"|n"&R1C21&RC[-14])&IF(RC[-13]="",,"|n"&R1C22&RC[-13])&IF(RC[-11]="",,"|n"&R1C24&RC[-11])&IF(RC[-10]="",,"|n"&R1C25&RC[-10])&IF(RC[-9]="",,"|n"&R1C26&RC[-9])&IF(RC[-8]="",,"|n"&R1C27&RC[-8])&IF(RC[-7]="",,"|n"&R1C28&RC[-7])&IF(RC[-6]="",,"|n"&R1C29&RC[-6])&IF(RC[-2]="",,"|n"&RC[-2]) -> 
AI201: =IF(RC[-27]&RC[-26]&RC[-25]&RC[-24]&RC[-23]&RC[-22]="",,R1C7)&IF(RC[-27]="",,"|n"&R1C8&RC[-27])&IF(RC[-26]="",,"|n"&R1C9&RC[-26])&IF(RC[-25]="",,"|n"&R1C10&RC[-25])&IF(RC[-24]="",,"|n"&R1C11&RC[-24])&IF(RC[-23]="",,"|n"&R1C12&RC[-23])&IF(RC[-22]="",,"|n"&R1C13&RC[-22])&IF(RC[-20]&RC[-19]&RC[-18]&RC[-17]="",,"|n"&R1C14)&IF(RC[-20]="",,"|n"&R1C15&RC[-20])&IF(RC[-19]="",,"|n"&R1C16&RC[-19])&IF(RC[-18]="",,"|n"&R1C17&RC[-18])&IF(RC[-17]="",,"|n"&R1C18&RC[-17])&IF(RC[-16]="",,"|n"&R1C19&RC[-16])&IF(RC[-15]="",,"|n"&R1C20&RC[-15])&IF(RC[-14]="",,"|n"&R1C21&RC[-14])&IF(RC[-13]="",,"|n"&R1C22&RC[-13])&IF(RC[-11]="",,"|n"&R1C24&RC[-11])&IF(RC[-10]="",,"|n"&R1C25&RC[-10])&IF(RC[-9]="",,"|n"&R1C26&RC[-9])&IF(RC[-8]="",,"|n"&R1C27&RC[-8])&IF(RC[-7]="",,"|n"&R1C28&RC[-7])&IF(RC[-6]="",,"|n"&R1C29&RC[-6])&IF(RC[-2]="",,"|n"&RC[-2]) -> 
AI202: =IF(RC[-27]&RC[-26]&RC[-25]&RC[-24]&RC[-23]&RC[-22]="",,R1C7)&IF(RC[-27]="",,"|n"&R1C8&RC[-27])&IF(RC[-26]="",,"|n"&R1C9&RC[-26])&IF(RC[-25]="",,"|n"&R1C10&RC[-25])&IF(RC[-24]="",,"|n"&R1C11&RC[-24])&IF(RC[-23]="",,"|n"&R1C12&RC[-23])&IF(RC[-22]="",,"|n"&R1C13&RC[-22])&IF(RC[-20]&RC[-19]&RC[-18]&RC[-17]="",,"|n"&R1C14)&IF(RC[-20]="",,"|n"&R1C15&RC[-20])&IF(RC[-19]="",,"|n"&R1C16&RC[-19])&IF(RC[-18]="",,"|n"&R1C17&RC[-18])&IF(RC[-17]="",,"|n"&R1C18&RC[-17])&IF(RC[-16]="",,"|n"&R1C19&RC[-16])&IF(RC[-15]="",,"|n"&R1C20&RC[-15])&IF(RC[-14]="",,"|n"&R1C21&RC[-14])&IF(RC[-13]="",,"|n"&R1C22&RC[-13])&IF(RC[-11]="",,"|n"&R1C24&RC[-11])&IF(RC[-10]="",,"|n"&R1C25&RC[-10])&IF(RC[-9]="",,"|n"&R1C26&RC[-9])&IF(RC[-8]="",,"|n"&R1C27&RC[-8])&IF(RC[-7]="",,"|n"&R1C28&RC[-7])&IF(RC[-6]="",,"|n"&R1C29&RC[-6])&IF(RC[-2]="",,"|n"&RC[-2]) -> 
AI203: =IF(RC[-27]&RC[-26]&RC[-25]&RC[-24]&RC[-23]&RC[-22]="",,R1C7)&IF(RC[-27]="",,"|n"&R1C8&RC[-27])&IF(RC[-26]="",,"|n"&R1C9&RC[-26])&IF(RC[-25]="",,"|n"&R1C10&RC[-25])&IF(RC[-24]="",,"|n"&R1C11&RC[-24])&IF(RC[-23]="",,"|n"&R1C12&RC[-23])&IF(RC[-22]="",,"|n"&R1C13&RC[-22])&IF(RC[-20]&RC[-19]&RC[-18]&RC[-17]="",,"|n"&R1C14)&IF(RC[-20]="",,"|n"&R1C15&RC[-20])&IF(RC[-19]="",,"|n"&R1C16&RC[-19])&IF(RC[-18]="",,"|n"&R1C17&RC[-18])&IF(RC[-17]="",,"|n"&R1C18&RC[-17])&IF(RC[-16]="",,"|n"&R1C19&RC[-16])&IF(RC[-15]="",,"|n"&R1C20&RC[-15])&IF(RC[-14]="",,"|n"&R1C21&RC[-14])&IF(RC[-13]="",,"|n"&R1C22&RC[-13])&IF(RC[-11]="",,"|n"&R1C24&RC[-11])&IF(RC[-10]="",,"|n"&R1C25&RC[-10])&IF(RC[-9]="",,"|n"&R1C26&RC[-9])&IF(RC[-8]="",,"|n"&R1C27&RC[-8])&IF(RC[-7]="",,"|n"&R1C28&RC[-7])&IF(RC[-6]="",,"|n"&R1C29&RC[-6])&IF(RC[-2]="",,"|n"&RC[-2]) -> 
AI204: =IF(RC[-27]&RC[-26]&RC[-25]&RC[-24]&RC[-23]&RC[-22]="",,R1C7)&IF(RC[-27]="",,"|n"&R1C8&RC[-27])&IF(RC[-26]="",,"|n"&R1C9&RC[-26])&IF(RC[-25]="",,"|n"&R1C10&RC[-25])&IF(RC[-24]="",,"|n"&R1C11&RC[-24])&IF(RC[-23]="",,"|n"&R1C12&RC[-23])&IF(RC[-22]="",,"|n"&R1C13&RC[-22])&IF(RC[-20]&RC[-19]&RC[-18]&RC[-17]="",,"|n"&R1C14)&IF(RC[-20]="",,"|n"&R1C15&RC[-20])&IF(RC[-19]="",,"|n"&R1C16&RC[-19])&IF(RC[-18]="",,"|n"&R1C17&RC[-18])&IF(RC[-17]="",,"|n"&R1C18&RC[-17])&IF(RC[-16]="",,"|n"&R1C19&RC[-16])&IF(RC[-15]="",,"|n"&R1C20&RC[-15])&IF(RC[-14]="",,"|n"&R1C21&RC[-14])&IF(RC[-13]="",,"|n"&R1C22&RC[-13])&IF(RC[-11]="",,"|n"&R1C24&RC[-11])&IF(RC[-10]="",,"|n"&R1C25&RC[-10])&IF(RC[-9]="",,"|n"&R1C26&RC[-9])&IF(RC[-8]="",,"|n"&R1C27&RC[-8])&IF(RC[-7]="",,"|n"&R1C28&RC[-7])&IF(RC[-6]="",,"|n"&R1C29&RC[-6])&IF(RC[-2]="",,"|n"&RC[-2]) -> 
AI205: =IF(RC[-27]&RC[-26]&RC[-25]&RC[-24]&RC[-23]&RC[-22]="",,R1C7)&IF(RC[-27]="",,"|n"&R1C8&RC[-27])&IF(RC[-26]="",,"|n"&R1C9&RC[-26])&IF(RC[-25]="",,"|n"&R1C10&RC[-25])&IF(RC[-24]="",,"|n"&R1C11&RC[-24])&IF(RC[-23]="",,"|n"&R1C12&RC[-23])&IF(RC[-22]="",,"|n"&R1C13&RC[-22])&IF(RC[-20]&RC[-19]&RC[-18]&RC[-17]="",,"|n"&R1C14)&IF(RC[-20]="",,"|n"&R1C15&RC[-20])&IF(RC[-19]="",,"|n"&R1C16&RC[-19])&IF(RC[-18]="",,"|n"&R1C17&RC[-18])&IF(RC[-17]="",,"|n"&R1C18&RC[-17])&IF(RC[-16]="",,"|n"&R1C19&RC[-16])&IF(RC[-15]="",,"|n"&R1C20&RC[-15])&IF(RC[-14]="",,"|n"&R1C21&RC[-14])&IF(RC[-13]="",,"|n"&R1C22&RC[-13])&IF(RC[-11]="",,"|n"&R1C24&RC[-11])&IF(RC[-10]="",,"|n"&R1C25&RC[-10])&IF(RC[-9]="",,"|n"&R1C26&RC[-9])&IF(RC[-8]="",,"|n"&R1C27&RC[-8])&IF(RC[-7]="",,"|n"&R1C28&RC[-7])&IF(RC[-6]="",,"|n"&R1C29&RC[-6])&IF(RC[-2]="",,"|n"&RC[-2]) -> 
AI206: =IF(RC[-27]&RC[-26]&RC[-25]&RC[-24]&RC[-23]&RC[-22]="",,R1C7)&IF(RC[-27]="",,"|n"&R1C8&RC[-27])&IF(RC[-26]="",,"|n"&R1C9&RC[-26])&IF(RC[-25]="",,"|n"&R1C10&RC[-25])&IF(RC[-24]="",,"|n"&R1C11&RC[-24])&IF(RC[-23]="",,"|n"&R1C12&RC[-23])&IF(RC[-22]="",,"|n"&R1C13&RC[-22])&IF(RC[-20]&RC[-19]&RC[-18]&RC[-17]="",,"|n"&R1C14)&IF(RC[-20]="",,"|n"&R1C15&RC[-20])&IF(RC[-19]="",,"|n"&R1C16&RC[-19])&IF(RC[-18]="",,"|n"&R1C17&RC[-18])&IF(RC[-17]="",,"|n"&R1C18&RC[-17])&IF(RC[-16]="",,"|n"&R1C19&RC[-16])&IF(RC[-15]="",,"|n"&R1C20&RC[-15])&IF(RC[-14]="",,"|n"&R1C21&RC[-14])&IF(RC[-13]="",,"|n"&R1C22&RC[-13])&IF(RC[-11]="",,"|n"&R1C24&RC[-11])&IF(RC[-10]="",,"|n"&R1C25&RC[-10])&IF(RC[-9]="",,"|n"&R1C26&RC[-9])&IF(RC[-8]="",,"|n"&R1C27&RC[-8])&IF(RC[-7]="",,"|n"&R1C28&RC[-7])&IF(RC[-6]="",,"|n"&R1C29&RC[-6])&IF(RC[-2]="",,"|n"&RC[-2]) -> 
AI207: =IF(RC[-27]&RC[-26]&RC[-25]&RC[-24]&RC[-23]&RC[-22]="",,R1C7)&IF(RC[-27]="",,"|n"&R1C8&RC[-27])&IF(RC[-26]="",,"|n"&R1C9&RC[-26])&IF(RC[-25]="",,"|n"&R1C10&RC[-25])&IF(RC[-24]="",,"|n"&R1C11&RC[-24])&IF(RC[-23]="",,"|n"&R1C12&RC[-23])&IF(RC[-22]="",,"|n"&R1C13&RC[-22])&IF(RC[-20]&RC[-19]&RC[-18]&RC[-17]="",,"|n"&R1C14)&IF(RC[-20]="",,"|n"&R1C15&RC[-20])&IF(RC[-19]="",,"|n"&R1C16&RC[-19])&IF(RC[-18]="",,"|n"&R1C17&RC[-18])&IF(RC[-17]="",,"|n"&R1C18&RC[-17])&IF(RC[-16]="",,"|n"&R1C19&RC[-16])&IF(RC[-15]="",,"|n"&R1C20&RC[-15])&IF(RC[-14]="",,"|n"&R1C21&RC[-14])&IF(RC[-13]="",,"|n"&R1C22&RC[-13])&IF(RC[-11]="",,"|n"&R1C24&RC[-11])&IF(RC[-10]="",,"|n"&R1C25&RC[-10])&IF(RC[-9]="",,"|n"&R1C26&RC[-9])&IF(RC[-8]="",,"|n"&R1C27&RC[-8])&IF(RC[-7]="",,"|n"&R1C28&RC[-7])&IF(RC[-6]="",,"|n"&R1C29&RC[-6])&IF(RC[-2]="",,"|n"&RC[-2]) -> 
AI208: =IF(RC[-27]&RC[-26]&RC[-25]&RC[-24]&RC[-23]&RC[-22]="",,R1C7)&IF(RC[-27]="",,"|n"&R1C8&RC[-27])&IF(RC[-26]="",,"|n"&R1C9&RC[-26])&IF(RC[-25]="",,"|n"&R1C10&RC[-25])&IF(RC[-24]="",,"|n"&R1C11&RC[-24])&IF(RC[-23]="",,"|n"&R1C12&RC[-23])&IF(RC[-22]="",,"|n"&R1C13&RC[-22])&IF(RC[-20]&RC[-19]&RC[-18]&RC[-17]="",,"|n"&R1C14)&IF(RC[-20]="",,"|n"&R1C15&RC[-20])&IF(RC[-19]="",,"|n"&R1C16&RC[-19])&IF(RC[-18]="",,"|n"&R1C17&RC[-18])&IF(RC[-17]="",,"|n"&R1C18&RC[-17])&IF(RC[-16]="",,"|n"&R1C19&RC[-16])&IF(RC[-15]="",,"|n"&R1C20&RC[-15])&IF(RC[-14]="",,"|n"&R1C21&RC[-14])&IF(RC[-13]="",,"|n"&R1C22&RC[-13])&IF(RC[-11]="",,"|n"&R1C24&RC[-11])&IF(RC[-10]="",,"|n"&R1C25&RC[-10])&IF(RC[-9]="",,"|n"&R1C26&RC[-9])&IF(RC[-8]="",,"|n"&R1C27&RC[-8])&IF(RC[-7]="",,"|n"&R1C28&RC[-7])&IF(RC[-6]="",,"|n"&R1C29&RC[-6])&IF(RC[-2]="",,"|n"&RC[-2]) -> 
AI209: =IF(RC[-27]&RC[-26]&RC[-25]&RC[-24]&RC[-23]&RC[-22]="",,R1C7)&IF(RC[-27]="",,"|n"&R1C8&RC[-27])&IF(RC[-26]="",,"|n"&R1C9&RC[-26])&IF(RC[-25]="",,"|n"&R1C10&RC[-25])&IF(RC[-24]="",,"|n"&R1C11&RC[-24])&IF(RC[-23]="",,"|n"&R1C12&RC[-23])&IF(RC[-22]="",,"|n"&R1C13&RC[-22])&IF(RC[-20]&RC[-19]&RC[-18]&RC[-17]="",,"|n"&R1C14)&IF(RC[-20]="",,"|n"&R1C15&RC[-20])&IF(RC[-19]="",,"|n"&R1C16&RC[-19])&IF(RC[-18]="",,"|n"&R1C17&RC[-18])&IF(RC[-17]="",,"|n"&R1C18&RC[-17])&IF(RC[-16]="",,"|n"&R1C19&RC[-16])&IF(RC[-15]="",,"|n"&R1C20&RC[-15])&IF(RC[-14]="",,"|n"&R1C21&RC[-14])&IF(RC[-13]="",,"|n"&R1C22&RC[-13])&IF(RC[-11]="",,"|n"&R1C24&RC[-11])&IF(RC[-10]="",,"|n"&R1C25&RC[-10])&IF(RC[-9]="",,"|n"&R1C26&RC[-9])&IF(RC[-8]="",,"|n"&R1C27&RC[-8])&IF(RC[-7]="",,"|n"&R1C28&RC[-7])&IF(RC[-6]="",,"|n"&R1C29&RC[-6])&IF(RC[-2]="",,"|n"&RC[-2]) -> 
AI210: =IF(RC[-27]&RC[-26]&RC[-25]&RC[-24]&RC[-23]&RC[-22]="",,R1C7)&IF(RC[-27]="",,"|n"&R1C8&RC[-27])&IF(RC[-26]="",,"|n"&R1C9&RC[-26])&IF(RC[-25]="",,"|n"&R1C10&RC[-25])&IF(RC[-24]="",,"|n"&R1C11&RC[-24])&IF(RC[-23]="",,"|n"&R1C12&RC[-23])&IF(RC[-22]="",,"|n"&R1C13&RC[-22])&IF(RC[-20]&RC[-19]&RC[-18]&RC[-17]="",,"|n"&R1C14)&IF(RC[-20]="",,"|n"&R1C15&RC[-20])&IF(RC[-19]="",,"|n"&R1C16&RC[-19])&IF(RC[-18]="",,"|n"&R1C17&RC[-18])&IF(RC[-17]="",,"|n"&R1C18&RC[-17])&IF(RC[-16]="",,"|n"&R1C19&RC[-16])&IF(RC[-15]="",,"|n"&R1C20&RC[-15])&IF(RC[-14]="",,"|n"&R1C21&RC[-14])&IF(RC[-13]="",,"|n"&R1C22&RC[-13])&IF(RC[-11]="",,"|n"&R1C24&RC[-11])&IF(RC[-10]="",,"|n"&R1C25&RC[-10])&IF(RC[-9]="",,"|n"&R1C26&RC[-9])&IF(RC[-8]="",,"|n"&R1C27&RC[-8])&IF(RC[-7]="",,"|n"&R1C28&RC[-7])&IF(RC[-6]="",,"|n"&R1C29&RC[-6])&IF(RC[-2]="",,"|n"&RC[-2]) -> 
AI211: =IF(RC[-27]&RC[-26]&RC[-25]&RC[-24]&RC[-23]&RC[-22]="",,R1C7)&IF(RC[-27]="",,"|n"&R1C8&RC[-27])&IF(RC[-26]="",,"|n"&R1C9&RC[-26])&IF(RC[-25]="",,"|n"&R1C10&RC[-25])&IF(RC[-24]="",,"|n"&R1C11&RC[-24])&IF(RC[-23]="",,"|n"&R1C12&RC[-23])&IF(RC[-22]="",,"|n"&R1C13&RC[-22])&IF(RC[-20]&RC[-19]&RC[-18]&RC[-17]="",,"|n"&R1C14)&IF(RC[-20]="",,"|n"&R1C15&RC[-20])&IF(RC[-19]="",,"|n"&R1C16&RC[-19])&IF(RC[-18]="",,"|n"&R1C17&RC[-18])&IF(RC[-17]="",,"|n"&R1C18&RC[-17])&IF(RC[-16]="",,"|n"&R1C19&RC[-16])&IF(RC[-15]="",,"|n"&R1C20&RC[-15])&IF(RC[-14]="",,"|n"&R1C21&RC[-14])&IF(RC[-13]="",,"|n"&R1C22&RC[-13])&IF(RC[-11]="",,"|n"&R1C24&RC[-11])&IF(RC[-10]="",,"|n"&R1C25&RC[-10])&IF(RC[-9]="",,"|n"&R1C26&RC[-9])&IF(RC[-8]="",,"|n"&R1C27&RC[-8])&IF(RC[-7]="",,"|n"&R1C28&RC[-7])&IF(RC[-6]="",,"|n"&R1C29&RC[-6])&IF(RC[-2]="",,"|n"&RC[-2]) -> 
AI212: =IF(RC[-27]&RC[-26]&RC[-25]&RC[-24]&RC[-23]&RC[-22]="",,R1C7)&IF(RC[-27]="",,"|n"&R1C8&RC[-27])&IF(RC[-26]="",,"|n"&R1C9&RC[-26])&IF(RC[-25]="",,"|n"&R1C10&RC[-25])&IF(RC[-24]="",,"|n"&R1C11&RC[-24])&IF(RC[-23]="",,"|n"&R1C12&RC[-23])&IF(RC[-22]="",,"|n"&R1C13&RC[-22])&IF(RC[-20]&RC[-19]&RC[-18]&RC[-17]="",,"|n"&R1C14)&IF(RC[-20]="",,"|n"&R1C15&RC[-20])&IF(RC[-19]="",,"|n"&R1C16&RC[-19])&IF(RC[-18]="",,"|n"&R1C17&RC[-18])&IF(RC[-17]="",,"|n"&R1C18&RC[-17])&IF(RC[-16]="",,"|n"&R1C19&RC[-16])&IF(RC[-15]="",,"|n"&R1C20&RC[-15])&IF(RC[-14]="",,"|n"&R1C21&RC[-14])&IF(RC[-13]="",,"|n"&R1C22&RC[-13])&IF(RC[-11]="",,"|n"&R1C24&RC[-11])&IF(RC[-10]="",,"|n"&R1C25&RC[-10])&IF(RC[-9]="",,"|n"&R1C26&RC[-9])&IF(RC[-8]="",,"|n"&R1C27&RC[-8])&IF(RC[-7]="",,"|n"&R1C28&RC[-7])&IF(RC[-6]="",,"|n"&R1C29&RC[-6])&IF(RC[-2]="",,"|n"&RC[-2]) -> 
AI213: =IF(RC[-27]&RC[-26]&RC[-25]&RC[-24]&RC[-23]&RC[-22]="",,R1C7)&IF(RC[-27]="",,"|n"&R1C8&RC[-27])&IF(RC[-26]="",,"|n"&R1C9&RC[-26])&IF(RC[-25]="",,"|n"&R1C10&RC[-25])&IF(RC[-24]="",,"|n"&R1C11&RC[-24])&IF(RC[-23]="",,"|n"&R1C12&RC[-23])&IF(RC[-22]="",,"|n"&R1C13&RC[-22])&IF(RC[-20]&RC[-19]&RC[-18]&RC[-17]="",,"|n"&R1C14)&IF(RC[-20]="",,"|n"&R1C15&RC[-20])&IF(RC[-19]="",,"|n"&R1C16&RC[-19])&IF(RC[-18]="",,"|n"&R1C17&RC[-18])&IF(RC[-17]="",,"|n"&R1C18&RC[-17])&IF(RC[-16]="",,"|n"&R1C19&RC[-16])&IF(RC[-15]="",,"|n"&R1C20&RC[-15])&IF(RC[-14]="",,"|n"&R1C21&RC[-14])&IF(RC[-13]="",,"|n"&R1C22&RC[-13])&IF(RC[-11]="",,"|n"&R1C24&RC[-11])&IF(RC[-10]="",,"|n"&R1C25&RC[-10])&IF(RC[-9]="",,"|n"&R1C26&RC[-9])&IF(RC[-8]="",,"|n"&R1C27&RC[-8])&IF(RC[-7]="",,"|n"&R1C28&RC[-7])&IF(RC[-6]="",,"|n"&R1C29&RC[-6])&IF(RC[-2]="",,"|n"&RC[-2]) -> 
AI214: =IF(RC[-27]&RC[-26]&RC[-25]&RC[-24]&RC[-23]&RC[-22]="",,R1C7)&IF(RC[-27]="",,"|n"&R1C8&RC[-27])&IF(RC[-26]="",,"|n"&R1C9&RC[-26])&IF(RC[-25]="",,"|n"&R1C10&RC[-25])&IF(RC[-24]="",,"|n"&R1C11&RC[-24])&IF(RC[-23]="",,"|n"&R1C12&RC[-23])&IF(RC[-22]="",,"|n"&R1C13&RC[-22])&IF(RC[-20]&RC[-19]&RC[-18]&RC[-17]="",,"|n"&R1C14)&IF(RC[-20]="",,"|n"&R1C15&RC[-20])&IF(RC[-19]="",,"|n"&R1C16&RC[-19])&IF(RC[-18]="",,"|n"&R1C17&RC[-18])&IF(RC[-17]="",,"|n"&R1C18&RC[-17])&IF(RC[-16]="",,"|n"&R1C19&RC[-16])&IF(RC[-15]="",,"|n"&R1C20&RC[-15])&IF(RC[-14]="",,"|n"&R1C21&RC[-14])&IF(RC[-13]="",,"|n"&R1C22&RC[-13])&IF(RC[-11]="",,"|n"&R1C24&RC[-11])&IF(RC[-10]="",,"|n"&R1C25&RC[-10])&IF(RC[-9]="",,"|n"&R1C26&RC[-9])&IF(RC[-8]="",,"|n"&R1C27&RC[-8])&IF(RC[-7]="",,"|n"&R1C28&RC[-7])&IF(RC[-6]="",,"|n"&R1C29&RC[-6])&IF(RC[-2]="",,"|n"&RC[-2]) -> 
AI215: =IF(RC[-27]&RC[-26]&RC[-25]&RC[-24]&RC[-23]&RC[-22]="",,R1C7)&IF(RC[-27]="",,"|n"&R1C8&RC[-27])&IF(RC[-26]="",,"|n"&R1C9&RC[-26])&IF(RC[-25]="",,"|n"&R1C10&RC[-25])&IF(RC[-24]="",,"|n"&R1C11&RC[-24])&IF(RC[-23]="",,"|n"&R1C12&RC[-23])&IF(RC[-22]="",,"|n"&R1C13&RC[-22])&IF(RC[-20]&RC[-19]&RC[-18]&RC[-17]="",,"|n"&R1C14)&IF(RC[-20]="",,"|n"&R1C15&RC[-20])&IF(RC[-19]="",,"|n"&R1C16&RC[-19])&IF(RC[-18]="",,"|n"&R1C17&RC[-18])&IF(RC[-17]="",,"|n"&R1C18&RC[-17])&IF(RC[-16]="",,"|n"&R1C19&RC[-16])&IF(RC[-15]="",,"|n"&R1C20&RC[-15])&IF(RC[-14]="",,"|n"&R1C21&RC[-14])&IF(RC[-13]="",,"|n"&R1C22&RC[-13])&IF(RC[-11]="",,"|n"&R1C24&RC[-11])&IF(RC[-10]="",,"|n"&R1C25&RC[-10])&IF(RC[-9]="",,"|n"&R1C26&RC[-9])&IF(RC[-8]="",,"|n"&R1C27&RC[-8])&IF(RC[-7]="",,"|n"&R1C28&RC[-7])&IF(RC[-6]="",,"|n"&R1C29&RC[-6])&IF(RC[-2]="",,"|n"&RC[-2]) -> 
AI216: =IF(RC[-27]&RC[-26]&RC[-25]&RC[-24]&RC[-23]&RC[-22]="",,R1C7)&IF(RC[-27]="",,"|n"&R1C8&RC[-27])&IF(RC[-26]="",,"|n"&R1C9&RC[-26])&IF(RC[-25]="",,"|n"&R1C10&RC[-25])&IF(RC[-24]="",,"|n"&R1C11&RC[-24])&IF(RC[-23]="",,"|n"&R1C12&RC[-23])&IF(RC[-22]="",,"|n"&R1C13&RC[-22])&IF(RC[-20]&RC[-19]&RC[-18]&RC[-17]="",,"|n"&R1C14)&IF(RC[-20]="",,"|n"&R1C15&RC[-20])&IF(RC[-19]="",,"|n"&R1C16&RC[-19])&IF(RC[-18]="",,"|n"&R1C17&RC[-18])&IF(RC[-17]="",,"|n"&R1C18&RC[-17])&IF(RC[-16]="",,"|n"&R1C19&RC[-16])&IF(RC[-15]="",,"|n"&R1C20&RC[-15])&IF(RC[-14]="",,"|n"&R1C21&RC[-14])&IF(RC[-13]="",,"|n"&R1C22&RC[-13])&IF(RC[-11]="",,"|n"&R1C24&RC[-11])&IF(RC[-10]="",,"|n"&R1C25&RC[-10])&IF(RC[-9]="",,"|n"&R1C26&RC[-9])&IF(RC[-8]="",,"|n"&R1C27&RC[-8])&IF(RC[-7]="",,"|n"&R1C28&RC[-7])&IF(RC[-6]="",,"|n"&R1C29&RC[-6])&IF(RC[-2]="",,"|n"&RC[-2]) -> 
AI217: =IF(RC[-27]&RC[-26]&RC[-25]&RC[-24]&RC[-23]&RC[-22]="",,R1C7)&IF(RC[-27]="",,"|n"&R1C8&RC[-27])&IF(RC[-26]="",,"|n"&R1C9&RC[-26])&IF(RC[-25]="",,"|n"&R1C10&RC[-25])&IF(RC[-24]="",,"|n"&R1C11&RC[-24])&IF(RC[-23]="",,"|n"&R1C12&RC[-23])&IF(RC[-22]="",,"|n"&R1C13&RC[-22])&IF(RC[-20]&RC[-19]&RC[-18]&RC[-17]="",,"|n"&R1C14)&IF(RC[-20]="",,"|n"&R1C15&RC[-20])&IF(RC[-19]="",,"|n"&R1C16&RC[-19])&IF(RC[-18]="",,"|n"&R1C17&RC[-18])&IF(RC[-17]="",,"|n"&R1C18&RC[-17])&IF(RC[-16]="",,"|n"&R1C19&RC[-16])&IF(RC[-15]="",,"|n"&R1C20&RC[-15])&IF(RC[-14]="",,"|n"&R1C21&RC[-14])&IF(RC[-13]="",,"|n"&R1C22&RC[-13])&IF(RC[-11]="",,"|n"&R1C24&RC[-11])&IF(RC[-10]="",,"|n"&R1C25&RC[-10])&IF(RC[-9]="",,"|n"&R1C26&RC[-9])&IF(RC[-8]="",,"|n"&R1C27&RC[-8])&IF(RC[-7]="",,"|n"&R1C28&RC[-7])&IF(RC[-6]="",,"|n"&R1C29&RC[-6])&IF(RC[-2]="",,"|n"&RC[-2]) -> 
AI218: =IF(RC[-27]&RC[-26]&RC[-25]&RC[-24]&RC[-23]&RC[-22]="",,R1C7)&IF(RC[-27]="",,"|n"&R1C8&RC[-27])&IF(RC[-26]="",,"|n"&R1C9&RC[-26])&IF(RC[-25]="",,"|n"&R1C10&RC[-25])&IF(RC[-24]="",,"|n"&R1C11&RC[-24])&IF(RC[-23]="",,"|n"&R1C12&RC[-23])&IF(RC[-22]="",,"|n"&R1C13&RC[-22])&IF(RC[-20]&RC[-19]&RC[-18]&RC[-17]="",,"|n"&R1C14)&IF(RC[-20]="",,"|n"&R1C15&RC[-20])&IF(RC[-19]="",,"|n"&R1C16&RC[-19])&IF(RC[-18]="",,"|n"&R1C17&RC[-18])&IF(RC[-17]="",,"|n"&R1C18&RC[-17])&IF(RC[-16]="",,"|n"&R1C19&RC[-16])&IF(RC[-15]="",,"|n"&R1C20&RC[-15])&IF(RC[-14]="",,"|n"&R1C21&RC[-14])&IF(RC[-13]="",,"|n"&R1C22&RC[-13])&IF(RC[-11]="",,"|n"&R1C24&RC[-11])&IF(RC[-10]="",,"|n"&R1C25&RC[-10])&IF(RC[-9]="",,"|n"&R1C26&RC[-9])&IF(RC[-8]="",,"|n"&R1C27&RC[-8])&IF(RC[-7]="",,"|n"&R1C28&RC[-7])&IF(RC[-6]="",,"|n"&R1C29&RC[-6])&IF(RC[-2]="",,"|n"&RC[-2]) -> 
AI219: =IF(RC[-27]&RC[-26]&RC[-25]&RC[-24]&RC[-23]&RC[-22]="",,R1C7)&IF(RC[-27]="",,"|n"&R1C8&RC[-27])&IF(RC[-26]="",,"|n"&R1C9&RC[-26])&IF(RC[-25]="",,"|n"&R1C10&RC[-25])&IF(RC[-24]="",,"|n"&R1C11&RC[-24])&IF(RC[-23]="",,"|n"&R1C12&RC[-23])&IF(RC[-22]="",,"|n"&R1C13&RC[-22])&IF(RC[-20]&RC[-19]&RC[-18]&RC[-17]="",,"|n"&R1C14)&IF(RC[-20]="",,"|n"&R1C15&RC[-20])&IF(RC[-19]="",,"|n"&R1C16&RC[-19])&IF(RC[-18]="",,"|n"&R1C17&RC[-18])&IF(RC[-17]="",,"|n"&R1C18&RC[-17])&IF(RC[-16]="",,"|n"&R1C19&RC[-16])&IF(RC[-15]="",,"|n"&R1C20&RC[-15])&IF(RC[-14]="",,"|n"&R1C21&RC[-14])&IF(RC[-13]="",,"|n"&R1C22&RC[-13])&IF(RC[-11]="",,"|n"&R1C24&RC[-11])&IF(RC[-10]="",,"|n"&R1C25&RC[-10])&IF(RC[-9]="",,"|n"&R1C26&RC[-9])&IF(RC[-8]="",,"|n"&R1C27&RC[-8])&IF(RC[-7]="",,"|n"&R1C28&RC[-7])&IF(RC[-6]="",,"|n"&R1C29&RC[-6])&IF(RC[-2]="",,"|n"&RC[-2]) -> 
AI220: =IF(RC[-27]&RC[-26]&RC[-25]&RC[-24]&RC[-23]&RC[-22]="",,R1C7)&IF(RC[-27]="",,"|n"&R1C8&RC[-27])&IF(RC[-26]="",,"|n"&R1C9&RC[-26])&IF(RC[-25]="",,"|n"&R1C10&RC[-25])&IF(RC[-24]="",,"|n"&R1C11&RC[-24])&IF(RC[-23]="",,"|n"&R1C12&RC[-23])&IF(RC[-22]="",,"|n"&R1C13&RC[-22])&IF(RC[-20]&RC[-19]&RC[-18]&RC[-17]="",,"|n"&R1C14)&IF(RC[-20]="",,"|n"&R1C15&RC[-20])&IF(RC[-19]="",,"|n"&R1C16&RC[-19])&IF(RC[-18]="",,"|n"&R1C17&RC[-18])&IF(RC[-17]="",,"|n"&R1C18&RC[-17])&IF(RC[-16]="",,"|n"&R1C19&RC[-16])&IF(RC[-15]="",,"|n"&R1C20&RC[-15])&IF(RC[-14]="",,"|n"&R1C21&RC[-14])&IF(RC[-13]="",,"|n"&R1C22&RC[-13])&IF(RC[-11]="",,"|n"&R1C24&RC[-11])&IF(RC[-10]="",,"|n"&R1C25&RC[-10])&IF(RC[-9]="",,"|n"&R1C26&RC[-9])&IF(RC[-8]="",,"|n"&R1C27&RC[-8])&IF(RC[-7]="",,"|n"&R1C28&RC[-7])&IF(RC[-6]="",,"|n"&R1C29&RC[-6])&IF(RC[-2]="",,"|n"&RC[-2]) -> 
AI221: =IF(RC[-27]&RC[-26]&RC[-25]&RC[-24]&RC[-23]&RC[-22]="",,R1C7)&IF(RC[-27]="",,"|n"&R1C8&RC[-27])&IF(RC[-26]="",,"|n"&R1C9&RC[-26])&IF(RC[-25]="",,"|n"&R1C10&RC[-25])&IF(RC[-24]="",,"|n"&R1C11&RC[-24])&IF(RC[-23]="",,"|n"&R1C12&RC[-23])&IF(RC[-22]="",,"|n"&R1C13&RC[-22])&IF(RC[-20]&RC[-19]&RC[-18]&RC[-17]="",,"|n"&R1C14)&IF(RC[-20]="",,"|n"&R1C15&RC[-20])&IF(RC[-19]="",,"|n"&R1C16&RC[-19])&IF(RC[-18]="",,"|n"&R1C17&RC[-18])&IF(RC[-17]="",,"|n"&R1C18&RC[-17])&IF(RC[-16]="",,"|n"&R1C19&RC[-16])&IF(RC[-15]="",,"|n"&R1C20&RC[-15])&IF(RC[-14]="",,"|n"&R1C21&RC[-14])&IF(RC[-13]="",,"|n"&R1C22&RC[-13])&IF(RC[-11]="",,"|n"&R1C24&RC[-11])&IF(RC[-10]="",,"|n"&R1C25&RC[-10])&IF(RC[-9]="",,"|n"&R1C26&RC[-9])&IF(RC[-8]="",,"|n"&R1C27&RC[-8])&IF(RC[-7]="",,"|n"&R1C28&RC[-7])&IF(RC[-6]="",,"|n"&R1C29&RC[-6])&IF(RC[-2]="",,"|n"&RC[-2]) -> 
AI222: =IF(RC[-27]&RC[-26]&RC[-25]&RC[-24]&RC[-23]&RC[-22]="",,R1C7)&IF(RC[-27]="",,"|n"&R1C8&RC[-27])&IF(RC[-26]="",,"|n"&R1C9&RC[-26])&IF(RC[-25]="",,"|n"&R1C10&RC[-25])&IF(RC[-24]="",,"|n"&R1C11&RC[-24])&IF(RC[-23]="",,"|n"&R1C12&RC[-23])&IF(RC[-22]="",,"|n"&R1C13&RC[-22])&IF(RC[-20]&RC[-19]&RC[-18]&RC[-17]="",,"|n"&R1C14)&IF(RC[-20]="",,"|n"&R1C15&RC[-20])&IF(RC[-19]="",,"|n"&R1C16&RC[-19])&IF(RC[-18]="",,"|n"&R1C17&RC[-18])&IF(RC[-17]="",,"|n"&R1C18&RC[-17])&IF(RC[-16]="",,"|n"&R1C19&RC[-16])&IF(RC[-15]="",,"|n"&R1C20&RC[-15])&IF(RC[-14]="",,"|n"&R1C21&RC[-14])&IF(RC[-13]="",,"|n"&R1C22&RC[-13])&IF(RC[-11]="",,"|n"&R1C24&RC[-11])&IF(RC[-10]="",,"|n"&R1C25&RC[-10])&IF(RC[-9]="",,"|n"&R1C26&RC[-9])&IF(RC[-8]="",,"|n"&R1C27&RC[-8])&IF(RC[-7]="",,"|n"&R1C28&RC[-7])&IF(RC[-6]="",,"|n"&R1C29&RC[-6])&IF(RC[-2]="",,"|n"&RC[-2]) -> 
AI223: =IF(RC[-27]&RC[-26]&RC[-25]&RC[-24]&RC[-23]&RC[-22]="",,R1C7)&IF(RC[-27]="",,"|n"&R1C8&RC[-27])&IF(RC[-26]="",,"|n"&R1C9&RC[-26])&IF(RC[-25]="",,"|n"&R1C10&RC[-25])&IF(RC[-24]="",,"|n"&R1C11&RC[-24])&IF(RC[-23]="",,"|n"&R1C12&RC[-23])&IF(RC[-22]="",,"|n"&R1C13&RC[-22])&IF(RC[-20]&RC[-19]&RC[-18]&RC[-17]="",,"|n"&R1C14)&IF(RC[-20]="",,"|n"&R1C15&RC[-20])&IF(RC[-19]="",,"|n"&R1C16&RC[-19])&IF(RC[-18]="",,"|n"&R1C17&RC[-18])&IF(RC[-17]="",,"|n"&R1C18&RC[-17])&IF(RC[-16]="",,"|n"&R1C19&RC[-16])&IF(RC[-15]="",,"|n"&R1C20&RC[-15])&IF(RC[-14]="",,"|n"&R1C21&RC[-14])&IF(RC[-13]="",,"|n"&R1C22&RC[-13])&IF(RC[-11]="",,"|n"&R1C24&RC[-11])&IF(RC[-10]="",,"|n"&R1C25&RC[-10])&IF(RC[-9]="",,"|n"&R1C26&RC[-9])&IF(RC[-8]="",,"|n"&R1C27&RC[-8])&IF(RC[-7]="",,"|n"&R1C28&RC[-7])&IF(RC[-6]="",,"|n"&R1C29&RC[-6])&IF(RC[-2]="",,"|n"&RC[-2]) -> 
AI224: =IF(RC[-27]&RC[-26]&RC[-25]&RC[-24]&RC[-23]&RC[-22]="",,R1C7)&IF(RC[-27]="",,"|n"&R1C8&RC[-27])&IF(RC[-26]="",,"|n"&R1C9&RC[-26])&IF(RC[-25]="",,"|n"&R1C10&RC[-25])&IF(RC[-24]="",,"|n"&R1C11&RC[-24])&IF(RC[-23]="",,"|n"&R1C12&RC[-23])&IF(RC[-22]="",,"|n"&R1C13&RC[-22])&IF(RC[-20]&RC[-19]&RC[-18]&RC[-17]="",,"|n"&R1C14)&IF(RC[-20]="",,"|n"&R1C15&RC[-20])&IF(RC[-19]="",,"|n"&R1C16&RC[-19])&IF(RC[-18]="",,"|n"&R1C17&RC[-18])&IF(RC[-17]="",,"|n"&R1C18&RC[-17])&IF(RC[-16]="",,"|n"&R1C19&RC[-16])&IF(RC[-15]="",,"|n"&R1C20&RC[-15])&IF(RC[-14]="",,"|n"&R1C21&RC[-14])&IF(RC[-13]="",,"|n"&R1C22&RC[-13])&IF(RC[-11]="",,"|n"&R1C24&RC[-11])&IF(RC[-10]="",,"|n"&R1C25&RC[-10])&IF(RC[-9]="",,"|n"&R1C26&RC[-9])&IF(RC[-8]="",,"|n"&R1C27&RC[-8])&IF(RC[-7]="",,"|n"&R1C28&RC[-7])&IF(RC[-6]="",,"|n"&R1C29&RC[-6])&IF(RC[-2]="",,"|n"&RC[-2]) -> 
AI225: =IF(RC[-27]&RC[-26]&RC[-25]&RC[-24]&RC[-23]&RC[-22]="",,R1C7)&IF(RC[-27]="",,"|n"&R1C8&RC[-27])&IF(RC[-26]="",,"|n"&R1C9&RC[-26])&IF(RC[-25]="",,"|n"&R1C10&RC[-25])&IF(RC[-24]="",,"|n"&R1C11&RC[-24])&IF(RC[-23]="",,"|n"&R1C12&RC[-23])&IF(RC[-22]="",,"|n"&R1C13&RC[-22])&IF(RC[-20]&RC[-19]&RC[-18]&RC[-17]="",,"|n"&R1C14)&IF(RC[-20]="",,"|n"&R1C15&RC[-20])&IF(RC[-19]="",,"|n"&R1C16&RC[-19])&IF(RC[-18]="",,"|n"&R1C17&RC[-18])&IF(RC[-17]="",,"|n"&R1C18&RC[-17])&IF(RC[-16]="",,"|n"&R1C19&RC[-16])&IF(RC[-15]="",,"|n"&R1C20&RC[-15])&IF(RC[-14]="",,"|n"&R1C21&RC[-14])&IF(RC[-13]="",,"|n"&R1C22&RC[-13])&IF(RC[-11]="",,"|n"&R1C24&RC[-11])&IF(RC[-10]="",,"|n"&R1C25&RC[-10])&IF(RC[-9]="",,"|n"&R1C26&RC[-9])&IF(RC[-8]="",,"|n"&R1C27&RC[-8])&IF(RC[-7]="",,"|n"&R1C28&RC[-7])&IF(RC[-6]="",,"|n"&R1C29&RC[-6])&IF(RC[-2]="",,"|n"&RC[-2]) -> 
AI226: =IF(RC[-27]&RC[-26]&RC[-25]&RC[-24]&RC[-23]&RC[-22]="",,R1C7)&IF(RC[-27]="",,"|n"&R1C8&RC[-27])&IF(RC[-26]="",,"|n"&R1C9&RC[-26])&IF(RC[-25]="",,"|n"&R1C10&RC[-25])&IF(RC[-24]="",,"|n"&R1C11&RC[-24])&IF(RC[-23]="",,"|n"&R1C12&RC[-23])&IF(RC[-22]="",,"|n"&R1C13&RC[-22])&IF(RC[-20]&RC[-19]&RC[-18]&RC[-17]="",,"|n"&R1C14)&IF(RC[-20]="",,"|n"&R1C15&RC[-20])&IF(RC[-19]="",,"|n"&R1C16&RC[-19])&IF(RC[-18]="",,"|n"&R1C17&RC[-18])&IF(RC[-17]="",,"|n"&R1C18&RC[-17])&IF(RC[-16]="",,"|n"&R1C19&RC[-16])&IF(RC[-15]="",,"|n"&R1C20&RC[-15])&IF(RC[-14]="",,"|n"&R1C21&RC[-14])&IF(RC[-13]="",,"|n"&R1C22&RC[-13])&IF(RC[-11]="",,"|n"&R1C24&RC[-11])&IF(RC[-10]="",,"|n"&R1C25&RC[-10])&IF(RC[-9]="",,"|n"&R1C26&RC[-9])&IF(RC[-8]="",,"|n"&R1C27&RC[-8])&IF(RC[-7]="",,"|n"&R1C28&RC[-7])&IF(RC[-6]="",,"|n"&R1C29&RC[-6])&IF(RC[-2]="",,"|n"&RC[-2]) -> 
AI227: =IF(RC[-27]&RC[-26]&RC[-25]&RC[-24]&RC[-23]&RC[-22]="",,R1C7)&IF(RC[-27]="",,"|n"&R1C8&RC[-27])&IF(RC[-26]="",,"|n"&R1C9&RC[-26])&IF(RC[-25]="",,"|n"&R1C10&RC[-25])&IF(RC[-24]="",,"|n"&R1C11&RC[-24])&IF(RC[-23]="",,"|n"&R1C12&RC[-23])&IF(RC[-22]="",,"|n"&R1C13&RC[-22])&IF(RC[-20]&RC[-19]&RC[-18]&RC[-17]="",,"|n"&R1C14)&IF(RC[-20]="",,"|n"&R1C15&RC[-20])&IF(RC[-19]="",,"|n"&R1C16&RC[-19])&IF(RC[-18]="",,"|n"&R1C17&RC[-18])&IF(RC[-17]="",,"|n"&R1C18&RC[-17])&IF(RC[-16]="",,"|n"&R1C19&RC[-16])&IF(RC[-15]="",,"|n"&R1C20&RC[-15])&IF(RC[-14]="",,"|n"&R1C21&RC[-14])&IF(RC[-13]="",,"|n"&R1C22&RC[-13])&IF(RC[-11]="",,"|n"&R1C24&RC[-11])&IF(RC[-10]="",,"|n"&R1C25&RC[-10])&IF(RC[-9]="",,"|n"&R1C26&RC[-9])&IF(RC[-8]="",,"|n"&R1C27&RC[-8])&IF(RC[-7]="",,"|n"&R1C28&RC[-7])&IF(RC[-6]="",,"|n"&R1C29&RC[-6])&IF(RC[-2]="",,"|n"&RC[-2]) -> 
AI228: =IF(RC[-27]&RC[-26]&RC[-25]&RC[-24]&RC[-23]&RC[-22]="",,R1C7)&IF(RC[-27]="",,"|n"&R1C8&RC[-27])&IF(RC[-26]="",,"|n"&R1C9&RC[-26])&IF(RC[-25]="",,"|n"&R1C10&RC[-25])&IF(RC[-24]="",,"|n"&R1C11&RC[-24])&IF(RC[-23]="",,"|n"&R1C12&RC[-23])&IF(RC[-22]="",,"|n"&R1C13&RC[-22])&IF(RC[-20]&RC[-19]&RC[-18]&RC[-17]="",,"|n"&R1C14)&IF(RC[-20]="",,"|n"&R1C15&RC[-20])&IF(RC[-19]="",,"|n"&R1C16&RC[-19])&IF(RC[-18]="",,"|n"&R1C17&RC[-18])&IF(RC[-17]="",,"|n"&R1C18&RC[-17])&IF(RC[-16]="",,"|n"&R1C19&RC[-16])&IF(RC[-15]="",,"|n"&R1C20&RC[-15])&IF(RC[-14]="",,"|n"&R1C21&RC[-14])&IF(RC[-13]="",,"|n"&R1C22&RC[-13])&IF(RC[-11]="",,"|n"&R1C24&RC[-11])&IF(RC[-10]="",,"|n"&R1C25&RC[-10])&IF(RC[-9]="",,"|n"&R1C26&RC[-9])&IF(RC[-8]="",,"|n"&R1C27&RC[-8])&IF(RC[-7]="",,"|n"&R1C28&RC[-7])&IF(RC[-6]="",,"|n"&R1C29&RC[-6])&IF(RC[-2]="",,"|n"&RC[-2]) -> 
AI229: =IF(RC[-27]&RC[-26]&RC[-25]&RC[-24]&RC[-23]&RC[-22]="",,R1C7)&IF(RC[-27]="",,"|n"&R1C8&RC[-27])&IF(RC[-26]="",,"|n"&R1C9&RC[-26])&IF(RC[-25]="",,"|n"&R1C10&RC[-25])&IF(RC[-24]="",,"|n"&R1C11&RC[-24])&IF(RC[-23]="",,"|n"&R1C12&RC[-23])&IF(RC[-22]="",,"|n"&R1C13&RC[-22])&IF(RC[-20]&RC[-19]&RC[-18]&RC[-17]="",,"|n"&R1C14)&IF(RC[-20]="",,"|n"&R1C15&RC[-20])&IF(RC[-19]="",,"|n"&R1C16&RC[-19])&IF(RC[-18]="",,"|n"&R1C17&RC[-18])&IF(RC[-17]="",,"|n"&R1C18&RC[-17])&IF(RC[-16]="",,"|n"&R1C19&RC[-16])&IF(RC[-15]="",,"|n"&R1C20&RC[-15])&IF(RC[-14]="",,"|n"&R1C21&RC[-14])&IF(RC[-13]="",,"|n"&R1C22&RC[-13])&IF(RC[-11]="",,"|n"&R1C24&RC[-11])&IF(RC[-10]="",,"|n"&R1C25&RC[-10])&IF(RC[-9]="",,"|n"&R1C26&RC[-9])&IF(RC[-8]="",,"|n"&R1C27&RC[-8])&IF(RC[-7]="",,"|n"&R1C28&RC[-7])&IF(RC[-6]="",,"|n"&R1C29&RC[-6])&IF(RC[-2]="",,"|n"&RC[-2]) -> 
AI230: =IF(RC[-27]&RC[-26]&RC[-25]&RC[-24]&RC[-23]&RC[-22]="",,R1C7)&IF(RC[-27]="",,"|n"&R1C8&RC[-27])&IF(RC[-26]="",,"|n"&R1C9&RC[-26])&IF(RC[-25]="",,"|n"&R1C10&RC[-25])&IF(RC[-24]="",,"|n"&R1C11&RC[-24])&IF(RC[-23]="",,"|n"&R1C12&RC[-23])&IF(RC[-22]="",,"|n"&R1C13&RC[-22])&IF(RC[-20]&RC[-19]&RC[-18]&RC[-17]="",,"|n"&R1C14)&IF(RC[-20]="",,"|n"&R1C15&RC[-20])&IF(RC[-19]="",,"|n"&R1C16&RC[-19])&IF(RC[-18]="",,"|n"&R1C17&RC[-18])&IF(RC[-17]="",,"|n"&R1C18&RC[-17])&IF(RC[-16]="",,"|n"&R1C19&RC[-16])&IF(RC[-15]="",,"|n"&R1C20&RC[-15])&IF(RC[-14]="",,"|n"&R1C21&RC[-14])&IF(RC[-13]="",,"|n"&R1C22&RC[-13])&IF(RC[-11]="",,"|n"&R1C24&RC[-11])&IF(RC[-10]="",,"|n"&R1C25&RC[-10])&IF(RC[-9]="",,"|n"&R1C26&RC[-9])&IF(RC[-8]="",,"|n"&R1C27&RC[-8])&IF(RC[-7]="",,"|n"&R1C28&RC[-7])&IF(RC[-6]="",,"|n"&R1C29&RC[-6])&IF(RC[-2]="",,"|n"&RC[-2]) -> 
AI231: =IF(RC[-27]&RC[-26]&RC[-25]&RC[-24]&RC[-23]&RC[-22]="",,R1C7)&IF(RC[-27]="",,"|n"&R1C8&RC[-27])&IF(RC[-26]="",,"|n"&R1C9&RC[-26])&IF(RC[-25]="",,"|n"&R1C10&RC[-25])&IF(RC[-24]="",,"|n"&R1C11&RC[-24])&IF(RC[-23]="",,"|n"&R1C12&RC[-23])&IF(RC[-22]="",,"|n"&R1C13&RC[-22])&IF(RC[-20]&RC[-19]&RC[-18]&RC[-17]="",,"|n"&R1C14)&IF(RC[-20]="",,"|n"&R1C15&RC[-20])&IF(RC[-19]="",,"|n"&R1C16&RC[-19])&IF(RC[-18]="",,"|n"&R1C17&RC[-18])&IF(RC[-17]="",,"|n"&R1C18&RC[-17])&IF(RC[-16]="",,"|n"&R1C19&RC[-16])&IF(RC[-15]="",,"|n"&R1C20&RC[-15])&IF(RC[-14]="",,"|n"&R1C21&RC[-14])&IF(RC[-13]="",,"|n"&R1C22&RC[-13])&IF(RC[-11]="",,"|n"&R1C24&RC[-11])&IF(RC[-10]="",,"|n"&R1C25&RC[-10])&IF(RC[-9]="",,"|n"&R1C26&RC[-9])&IF(RC[-8]="",,"|n"&R1C27&RC[-8])&IF(RC[-7]="",,"|n"&R1C28&RC[-7])&IF(RC[-6]="",,"|n"&R1C29&RC[-6])&IF(RC[-2]="",,"|n"&RC[-2]) -> 
AI232: =IF(RC[-27]&RC[-26]&RC[-25]&RC[-24]&RC[-23]&RC[-22]="",,R1C7)&IF(RC[-27]="",,"|n"&R1C8&RC[-27])&IF(RC[-26]="",,"|n"&R1C9&RC[-26])&IF(RC[-25]="",,"|n"&R1C10&RC[-25])&IF(RC[-24]="",,"|n"&R1C11&RC[-24])&IF(RC[-23]="",,"|n"&R1C12&RC[-23])&IF(RC[-22]="",,"|n"&R1C13&RC[-22])&IF(RC[-20]&RC[-19]&RC[-18]&RC[-17]="",,"|n"&R1C14)&IF(RC[-20]="",,"|n"&R1C15&RC[-20])&IF(RC[-19]="",,"|n"&R1C16&RC[-19])&IF(RC[-18]="",,"|n"&R1C17&RC[-18])&IF(RC[-17]="",,"|n"&R1C18&RC[-17])&IF(RC[-16]="",,"|n"&R1C19&RC[-16])&IF(RC[-15]="",,"|n"&R1C20&RC[-15])&IF(RC[-14]="",,"|n"&R1C21&RC[-14])&IF(RC[-13]="",,"|n"&R1C22&RC[-13])&IF(RC[-11]="",,"|n"&R1C24&RC[-11])&IF(RC[-10]="",,"|n"&R1C25&RC[-10])&IF(RC[-9]="",,"|n"&R1C26&RC[-9])&IF(RC[-8]="",,"|n"&R1C27&RC[-8])&IF(RC[-7]="",,"|n"&R1C28&RC[-7])&IF(RC[-6]="",,"|n"&R1C29&RC[-6])&IF(RC[-2]="",,"|n"&RC[-2]) -> 
AI233: =IF(RC[-27]&RC[-26]&RC[-25]&RC[-24]&RC[-23]&RC[-22]="",,R1C7)&IF(RC[-27]="",,"|n"&R1C8&RC[-27])&IF(RC[-26]="",,"|n"&R1C9&RC[-26])&IF(RC[-25]="",,"|n"&R1C10&RC[-25])&IF(RC[-24]="",,"|n"&R1C11&RC[-24])&IF(RC[-23]="",,"|n"&R1C12&RC[-23])&IF(RC[-22]="",,"|n"&R1C13&RC[-22])&IF(RC[-20]&RC[-19]&RC[-18]&RC[-17]="",,"|n"&R1C14)&IF(RC[-20]="",,"|n"&R1C15&RC[-20])&IF(RC[-19]="",,"|n"&R1C16&RC[-19])&IF(RC[-18]="",,"|n"&R1C17&RC[-18])&IF(RC[-17]="",,"|n"&R1C18&RC[-17])&IF(RC[-16]="",,"|n"&R1C19&RC[-16])&IF(RC[-15]="",,"|n"&R1C20&RC[-15])&IF(RC[-14]="",,"|n"&R1C21&RC[-14])&IF(RC[-13]="",,"|n"&R1C22&RC[-13])&IF(RC[-11]="",,"|n"&R1C24&RC[-11])&IF(RC[-10]="",,"|n"&R1C25&RC[-10])&IF(RC[-9]="",,"|n"&R1C26&RC[-9])&IF(RC[-8]="",,"|n"&R1C27&RC[-8])&IF(RC[-7]="",,"|n"&R1C28&RC[-7])&IF(RC[-6]="",,"|n"&R1C29&RC[-6])&IF(RC[-2]="",,"|n"&RC[-2]) -> 
AI234: =IF(RC[-27]&RC[-26]&RC[-25]&RC[-24]&RC[-23]&RC[-22]="",,R1C7)&IF(RC[-27]="",,"|n"&R1C8&RC[-27])&IF(RC[-26]="",,"|n"&R1C9&RC[-26])&IF(RC[-25]="",,"|n"&R1C10&RC[-25])&IF(RC[-24]="",,"|n"&R1C11&RC[-24])&IF(RC[-23]="",,"|n"&R1C12&RC[-23])&IF(RC[-22]="",,"|n"&R1C13&RC[-22])&IF(RC[-20]&RC[-19]&RC[-18]&RC[-17]="",,"|n"&R1C14)&IF(RC[-20]="",,"|n"&R1C15&RC[-20])&IF(RC[-19]="",,"|n"&R1C16&RC[-19])&IF(RC[-18]="",,"|n"&R1C17&RC[-18])&IF(RC[-17]="",,"|n"&R1C18&RC[-17])&IF(RC[-16]="",,"|n"&R1C19&RC[-16])&IF(RC[-15]="",,"|n"&R1C20&RC[-15])&IF(RC[-14]="",,"|n"&R1C21&RC[-14])&IF(RC[-13]="",,"|n"&R1C22&RC[-13])&IF(RC[-11]="",,"|n"&R1C24&RC[-11])&IF(RC[-10]="",,"|n"&R1C25&RC[-10])&IF(RC[-9]="",,"|n"&R1C26&RC[-9])&IF(RC[-8]="",,"|n"&R1C27&RC[-8])&IF(RC[-7]="",,"|n"&R1C28&RC[-7])&IF(RC[-6]="",,"|n"&R1C29&RC[-6])&IF(RC[-2]="",,"|n"&RC[-2]) -> 
AI235: =IF(RC[-27]&RC[-26]&RC[-25]&RC[-24]&RC[-23]&RC[-22]="",,R1C7)&IF(RC[-27]="",,"|n"&R1C8&RC[-27])&IF(RC[-26]="",,"|n"&R1C9&RC[-26])&IF(RC[-25]="",,"|n"&R1C10&RC[-25])&IF(RC[-24]="",,"|n"&R1C11&RC[-24])&IF(RC[-23]="",,"|n"&R1C12&RC[-23])&IF(RC[-22]="",,"|n"&R1C13&RC[-22])&IF(RC[-20]&RC[-19]&RC[-18]&RC[-17]="",,"|n"&R1C14)&IF(RC[-20]="",,"|n"&R1C15&RC[-20])&IF(RC[-19]="",,"|n"&R1C16&RC[-19])&IF(RC[-18]="",,"|n"&R1C17&RC[-18])&IF(RC[-17]="",,"|n"&R1C18&RC[-17])&IF(RC[-16]="",,"|n"&R1C19&RC[-16])&IF(RC[-15]="",,"|n"&R1C20&RC[-15])&IF(RC[-14]="",,"|n"&R1C21&RC[-14])&IF(RC[-13]="",,"|n"&R1C22&RC[-13])&IF(RC[-11]="",,"|n"&R1C24&RC[-11])&IF(RC[-10]="",,"|n"&R1C25&RC[-10])&IF(RC[-9]="",,"|n"&R1C26&RC[-9])&IF(RC[-8]="",,"|n"&R1C27&RC[-8])&IF(RC[-7]="",,"|n"&R1C28&RC[-7])&IF(RC[-6]="",,"|n"&R1C29&RC[-6])&IF(RC[-2]="",,"|n"&RC[-2]) -> 
AI236: =IF(RC[-27]&RC[-26]&RC[-25]&RC[-24]&RC[-23]&RC[-22]="",,R1C7)&IF(RC[-27]="",,"|n"&R1C8&RC[-27])&IF(RC[-26]="",,"|n"&R1C9&RC[-26])&IF(RC[-25]="",,"|n"&R1C10&RC[-25])&IF(RC[-24]="",,"|n"&R1C11&RC[-24])&IF(RC[-23]="",,"|n"&R1C12&RC[-23])&IF(RC[-22]="",,"|n"&R1C13&RC[-22])&IF(RC[-20]&RC[-19]&RC[-18]&RC[-17]="",,"|n"&R1C14)&IF(RC[-20]="",,"|n"&R1C15&RC[-20])&IF(RC[-19]="",,"|n"&R1C16&RC[-19])&IF(RC[-18]="",,"|n"&R1C17&RC[-18])&IF(RC[-17]="",,"|n"&R1C18&RC[-17])&IF(RC[-16]="",,"|n"&R1C19&RC[-16])&IF(RC[-15]="",,"|n"&R1C20&RC[-15])&IF(RC[-14]="",,"|n"&R1C21&RC[-14])&IF(RC[-13]="",,"|n"&R1C22&RC[-13])&IF(RC[-11]="",,"|n"&R1C24&RC[-11])&IF(RC[-10]="",,"|n"&R1C25&RC[-10])&IF(RC[-9]="",,"|n"&R1C26&RC[-9])&IF(RC[-8]="",,"|n"&R1C27&RC[-8])&IF(RC[-7]="",,"|n"&R1C28&RC[-7])&IF(RC[-6]="",,"|n"&R1C29&RC[-6])&IF(RC[-2]="",,"|n"&RC[-2]) -> 
AI237: =IF(RC[-27]&RC[-26]&RC[-25]&RC[-24]&RC[-23]&RC[-22]="",,R1C7)&IF(RC[-27]="",,"|n"&R1C8&RC[-27])&IF(RC[-26]="",,"|n"&R1C9&RC[-26])&IF(RC[-25]="",,"|n"&R1C10&RC[-25])&IF(RC[-24]="",,"|n"&R1C11&RC[-24])&IF(RC[-23]="",,"|n"&R1C12&RC[-23])&IF(RC[-22]="",,"|n"&R1C13&RC[-22])&IF(RC[-20]&RC[-19]&RC[-18]&RC[-17]="",,"|n"&R1C14)&IF(RC[-20]="",,"|n"&R1C15&RC[-20])&IF(RC[-19]="",,"|n"&R1C16&RC[-19])&IF(RC[-18]="",,"|n"&R1C17&RC[-18])&IF(RC[-17]="",,"|n"&R1C18&RC[-17])&IF(RC[-16]="",,"|n"&R1C19&RC[-16])&IF(RC[-15]="",,"|n"&R1C20&RC[-15])&IF(RC[-14]="",,"|n"&R1C21&RC[-14])&IF(RC[-13]="",,"|n"&R1C22&RC[-13])&IF(RC[-11]="",,"|n"&R1C24&RC[-11])&IF(RC[-10]="",,"|n"&R1C25&RC[-10])&IF(RC[-9]="",,"|n"&R1C26&RC[-9])&IF(RC[-8]="",,"|n"&R1C27&RC[-8])&IF(RC[-7]="",,"|n"&R1C28&RC[-7])&IF(RC[-6]="",,"|n"&R1C29&RC[-6])&IF(RC[-2]="",,"|n"&RC[-2]) -> 
AI238: =IF(RC[-27]&RC[-26]&RC[-25]&RC[-24]&RC[-23]&RC[-22]="",,R1C7)&IF(RC[-27]="",,"|n"&R1C8&RC[-27])&IF(RC[-26]="",,"|n"&R1C9&RC[-26])&IF(RC[-25]="",,"|n"&R1C10&RC[-25])&IF(RC[-24]="",,"|n"&R1C11&RC[-24])&IF(RC[-23]="",,"|n"&R1C12&RC[-23])&IF(RC[-22]="",,"|n"&R1C13&RC[-22])&IF(RC[-20]&RC[-19]&RC[-18]&RC[-17]="",,"|n"&R1C14)&IF(RC[-20]="",,"|n"&R1C15&RC[-20])&IF(RC[-19]="",,"|n"&R1C16&RC[-19])&IF(RC[-18]="",,"|n"&R1C17&RC[-18])&IF(RC[-17]="",,"|n"&R1C18&RC[-17])&IF(RC[-16]="",,"|n"&R1C19&RC[-16])&IF(RC[-15]="",,"|n"&R1C20&RC[-15])&IF(RC[-14]="",,"|n"&R1C21&RC[-14])&IF(RC[-13]="",,"|n"&R1C22&RC[-13])&IF(RC[-11]="",,"|n"&R1C24&RC[-11])&IF(RC[-10]="",,"|n"&R1C25&RC[-10])&IF(RC[-9]="",,"|n"&R1C26&RC[-9])&IF(RC[-8]="",,"|n"&R1C27&RC[-8])&IF(RC[-7]="",,"|n"&R1C28&RC[-7])&IF(RC[-6]="",,"|n"&R1C29&RC[-6])&IF(RC[-2]="",,"|n"&RC[-2]) -> 
AI239: =IF(RC[-27]&RC[-26]&RC[-25]&RC[-24]&RC[-23]&RC[-22]="",,R1C7)&IF(RC[-27]="",,"|n"&R1C8&RC[-27])&IF(RC[-26]="",,"|n"&R1C9&RC[-26])&IF(RC[-25]="",,"|n"&R1C10&RC[-25])&IF(RC[-24]="",,"|n"&R1C11&RC[-24])&IF(RC[-23]="",,"|n"&R1C12&RC[-23])&IF(RC[-22]="",,"|n"&R1C13&RC[-22])&IF(RC[-20]&RC[-19]&RC[-18]&RC[-17]="",,"|n"&R1C14)&IF(RC[-20]="",,"|n"&R1C15&RC[-20])&IF(RC[-19]="",,"|n"&R1C16&RC[-19])&IF(RC[-18]="",,"|n"&R1C17&RC[-18])&IF(RC[-17]="",,"|n"&R1C18&RC[-17])&IF(RC[-16]="",,"|n"&R1C19&RC[-16])&IF(RC[-15]="",,"|n"&R1C20&RC[-15])&IF(RC[-14]="",,"|n"&R1C21&RC[-14])&IF(RC[-13]="",,"|n"&R1C22&RC[-13])&IF(RC[-11]="",,"|n"&R1C24&RC[-11])&IF(RC[-10]="",,"|n"&R1C25&RC[-10])&IF(RC[-9]="",,"|n"&R1C26&RC[-9])&IF(RC[-8]="",,"|n"&R1C27&RC[-8])&IF(RC[-7]="",,"|n"&R1C28&RC[-7])&IF(RC[-6]="",,"|n"&R1C29&RC[-6])&IF(RC[-2]="",,"|n"&RC[-2]) -> 
AI240: =IF(RC[-27]&RC[-26]&RC[-25]&RC[-24]&RC[-23]&RC[-22]="",,R1C7)&IF(RC[-27]="",,"|n"&R1C8&RC[-27])&IF(RC[-26]="",,"|n"&R1C9&RC[-26])&IF(RC[-25]="",,"|n"&R1C10&RC[-25])&IF(RC[-24]="",,"|n"&R1C11&RC[-24])&IF(RC[-23]="",,"|n"&R1C12&RC[-23])&IF(RC[-22]="",,"|n"&R1C13&RC[-22])&IF(RC[-20]&RC[-19]&RC[-18]&RC[-17]="",,"|n"&R1C14)&IF(RC[-20]="",,"|n"&R1C15&RC[-20])&IF(RC[-19]="",,"|n"&R1C16&RC[-19])&IF(RC[-18]="",,"|n"&R1C17&RC[-18])&IF(RC[-17]="",,"|n"&R1C18&RC[-17])&IF(RC[-16]="",,"|n"&R1C19&RC[-16])&IF(RC[-15]="",,"|n"&R1C20&RC[-15])&IF(RC[-14]="",,"|n"&R1C21&RC[-14])&IF(RC[-13]="",,"|n"&R1C22&RC[-13])&IF(RC[-11]="",,"|n"&R1C24&RC[-11])&IF(RC[-10]="",,"|n"&R1C25&RC[-10])&IF(RC[-9]="",,"|n"&R1C26&RC[-9])&IF(RC[-8]="",,"|n"&R1C27&RC[-8])&IF(RC[-7]="",,"|n"&R1C28&RC[-7])&IF(RC[-6]="",,"|n"&R1C29&RC[-6])&IF(RC[-2]="",,"|n"&RC[-2]) -> 
AI241: =IF(RC[-27]&RC[-26]&RC[-25]&RC[-24]&RC[-23]&RC[-22]="",,R1C7)&IF(RC[-27]="",,"|n"&R1C8&RC[-27])&IF(RC[-26]="",,"|n"&R1C9&RC[-26])&IF(RC[-25]="",,"|n"&R1C10&RC[-25])&IF(RC[-24]="",,"|n"&R1C11&RC[-24])&IF(RC[-23]="",,"|n"&R1C12&RC[-23])&IF(RC[-22]="",,"|n"&R1C13&RC[-22])&IF(RC[-20]&RC[-19]&RC[-18]&RC[-17]="",,"|n"&R1C14)&IF(RC[-20]="",,"|n"&R1C15&RC[-20])&IF(RC[-19]="",,"|n"&R1C16&RC[-19])&IF(RC[-18]="",,"|n"&R1C17&RC[-18])&IF(RC[-17]="",,"|n"&R1C18&RC[-17])&IF(RC[-16]="",,"|n"&R1C19&RC[-16])&IF(RC[-15]="",,"|n"&R1C20&RC[-15])&IF(RC[-14]="",,"|n"&R1C21&RC[-14])&IF(RC[-13]="",,"|n"&R1C22&RC[-13])&IF(RC[-11]="",,"|n"&R1C24&RC[-11])&IF(RC[-10]="",,"|n"&R1C25&RC[-10])&IF(RC[-9]="",,"|n"&R1C26&RC[-9])&IF(RC[-8]="",,"|n"&R1C27&RC[-8])&IF(RC[-7]="",,"|n"&R1C28&RC[-7])&IF(RC[-6]="",,"|n"&R1C29&RC[-6])&IF(RC[-2]="",,"|n"&RC[-2]) -> 
AI242: =IF(RC[-27]&RC[-26]&RC[-25]&RC[-24]&RC[-23]&RC[-22]="",,R1C7)&IF(RC[-27]="",,"|n"&R1C8&RC[-27])&IF(RC[-26]="",,"|n"&R1C9&RC[-26])&IF(RC[-25]="",,"|n"&R1C10&RC[-25])&IF(RC[-24]="",,"|n"&R1C11&RC[-24])&IF(RC[-23]="",,"|n"&R1C12&RC[-23])&IF(RC[-22]="",,"|n"&R1C13&RC[-22])&IF(RC[-20]&RC[-19]&RC[-18]&RC[-17]="",,"|n"&R1C14)&IF(RC[-20]="",,"|n"&R1C15&RC[-20])&IF(RC[-19]="",,"|n"&R1C16&RC[-19])&IF(RC[-18]="",,"|n"&R1C17&RC[-18])&IF(RC[-17]="",,"|n"&R1C18&RC[-17])&IF(RC[-16]="",,"|n"&R1C19&RC[-16])&IF(RC[-15]="",,"|n"&R1C20&RC[-15])&IF(RC[-14]="",,"|n"&R1C21&RC[-14])&IF(RC[-13]="",,"|n"&R1C22&RC[-13])&IF(RC[-11]="",,"|n"&R1C24&RC[-11])&IF(RC[-10]="",,"|n"&R1C25&RC[-10])&IF(RC[-9]="",,"|n"&R1C26&RC[-9])&IF(RC[-8]="",,"|n"&R1C27&RC[-8])&IF(RC[-7]="",,"|n"&R1C28&RC[-7])&IF(RC[-6]="",,"|n"&R1C29&RC[-6])&IF(RC[-2]="",,"|n"&RC[-2]) -> 
AI243: =IF(RC[-27]&RC[-26]&RC[-25]&RC[-24]&RC[-23]&RC[-22]="",,R1C7)&IF(RC[-27]="",,"|n"&R1C8&RC[-27])&IF(RC[-26]="",,"|n"&R1C9&RC[-26])&IF(RC[-25]="",,"|n"&R1C10&RC[-25])&IF(RC[-24]="",,"|n"&R1C11&RC[-24])&IF(RC[-23]="",,"|n"&R1C12&RC[-23])&IF(RC[-22]="",,"|n"&R1C13&RC[-22])&IF(RC[-20]&RC[-19]&RC[-18]&RC[-17]="",,"|n"&R1C14)&IF(RC[-20]="",,"|n"&R1C15&RC[-20])&IF(RC[-19]="",,"|n"&R1C16&RC[-19])&IF(RC[-18]="",,"|n"&R1C17&RC[-18])&IF(RC[-17]="",,"|n"&R1C18&RC[-17])&IF(RC[-16]="",,"|n"&R1C19&RC[-16])&IF(RC[-15]="",,"|n"&R1C20&RC[-15])&IF(RC[-14]="",,"|n"&R1C21&RC[-14])&IF(RC[-13]="",,"|n"&R1C22&RC[-13])&IF(RC[-11]="",,"|n"&R1C24&RC[-11])&IF(RC[-10]="",,"|n"&R1C25&RC[-10])&IF(RC[-9]="",,"|n"&R1C26&RC[-9])&IF(RC[-8]="",,"|n"&R1C27&RC[-8])&IF(RC[-7]="",,"|n"&R1C28&RC[-7])&IF(RC[-6]="",,"|n"&R1C29&RC[-6])&IF(RC[-2]="",,"|n"&RC[-2]) -> 
AI244: =IF(RC[-27]&RC[-26]&RC[-25]&RC[-24]&RC[-23]&RC[-22]="",,R1C7)&IF(RC[-27]="",,"|n"&R1C8&RC[-27])&IF(RC[-26]="",,"|n"&R1C9&RC[-26])&IF(RC[-25]="",,"|n"&R1C10&RC[-25])&IF(RC[-24]="",,"|n"&R1C11&RC[-24])&IF(RC[-23]="",,"|n"&R1C12&RC[-23])&IF(RC[-22]="",,"|n"&R1C13&RC[-22])&IF(RC[-20]&RC[-19]&RC[-18]&RC[-17]="",,"|n"&R1C14)&IF(RC[-20]="",,"|n"&R1C15&RC[-20])&IF(RC[-19]="",,"|n"&R1C16&RC[-19])&IF(RC[-18]="",,"|n"&R1C17&RC[-18])&IF(RC[-17]="",,"|n"&R1C18&RC[-17])&IF(RC[-16]="",,"|n"&R1C19&RC[-16])&IF(RC[-15]="",,"|n"&R1C20&RC[-15])&IF(RC[-14]="",,"|n"&R1C21&RC[-14])&IF(RC[-13]="",,"|n"&R1C22&RC[-13])&IF(RC[-11]="",,"|n"&R1C24&RC[-11])&IF(RC[-10]="",,"|n"&R1C25&RC[-10])&IF(RC[-9]="",,"|n"&R1C26&RC[-9])&IF(RC[-8]="",,"|n"&R1C27&RC[-8])&IF(RC[-7]="",,"|n"&R1C28&RC[-7])&IF(RC[-6]="",,"|n"&R1C29&RC[-6])&IF(RC[-2]="",,"|n"&RC[-2]) -> 
AI245: =IF(RC[-27]&RC[-26]&RC[-25]&RC[-24]&RC[-23]&RC[-22]="",,R1C7)&IF(RC[-27]="",,"|n"&R1C8&RC[-27])&IF(RC[-26]="",,"|n"&R1C9&RC[-26])&IF(RC[-25]="",,"|n"&R1C10&RC[-25])&IF(RC[-24]="",,"|n"&R1C11&RC[-24])&IF(RC[-23]="",,"|n"&R1C12&RC[-23])&IF(RC[-22]="",,"|n"&R1C13&RC[-22])&IF(RC[-20]&RC[-19]&RC[-18]&RC[-17]="",,"|n"&R1C14)&IF(RC[-20]="",,"|n"&R1C15&RC[-20])&IF(RC[-19]="",,"|n"&R1C16&RC[-19])&IF(RC[-18]="",,"|n"&R1C17&RC[-18])&IF(RC[-17]="",,"|n"&R1C18&RC[-17])&IF(RC[-16]="",,"|n"&R1C19&RC[-16])&IF(RC[-15]="",,"|n"&R1C20&RC[-15])&IF(RC[-14]="",,"|n"&R1C21&RC[-14])&IF(RC[-13]="",,"|n"&R1C22&RC[-13])&IF(RC[-11]="",,"|n"&R1C24&RC[-11])&IF(RC[-10]="",,"|n"&R1C25&RC[-10])&IF(RC[-9]="",,"|n"&R1C26&RC[-9])&IF(RC[-8]="",,"|n"&R1C27&RC[-8])&IF(RC[-7]="",,"|n"&R1C28&RC[-7])&IF(RC[-6]="",,"|n"&R1C29&RC[-6])&IF(RC[-2]="",,"|n"&RC[-2]) -> 
AI246: =IF(RC[-27]&RC[-26]&RC[-25]&RC[-24]&RC[-23]&RC[-22]="",,R1C7)&IF(RC[-27]="",,"|n"&R1C8&RC[-27])&IF(RC[-26]="",,"|n"&R1C9&RC[-26])&IF(RC[-25]="",,"|n"&R1C10&RC[-25])&IF(RC[-24]="",,"|n"&R1C11&RC[-24])&IF(RC[-23]="",,"|n"&R1C12&RC[-23])&IF(RC[-22]="",,"|n"&R1C13&RC[-22])&IF(RC[-20]&RC[-19]&RC[-18]&RC[-17]="",,"|n"&R1C14)&IF(RC[-20]="",,"|n"&R1C15&RC[-20])&IF(RC[-19]="",,"|n"&R1C16&RC[-19])&IF(RC[-18]="",,"|n"&R1C17&RC[-18])&IF(RC[-17]="",,"|n"&R1C18&RC[-17])&IF(RC[-16]="",,"|n"&R1C19&RC[-16])&IF(RC[-15]="",,"|n"&R1C20&RC[-15])&IF(RC[-14]="",,"|n"&R1C21&RC[-14])&IF(RC[-13]="",,"|n"&R1C22&RC[-13])&IF(RC[-11]="",,"|n"&R1C24&RC[-11])&IF(RC[-10]="",,"|n"&R1C25&RC[-10])&IF(RC[-9]="",,"|n"&R1C26&RC[-9])&IF(RC[-8]="",,"|n"&R1C27&RC[-8])&IF(RC[-7]="",,"|n"&R1C28&RC[-7])&IF(RC[-6]="",,"|n"&R1C29&RC[-6])&IF(RC[-2]="",,"|n"&RC[-2]) -> 
AI247: =IF(RC[-27]&RC[-26]&RC[-25]&RC[-24]&RC[-23]&RC[-22]="",,R1C7)&IF(RC[-27]="",,"|n"&R1C8&RC[-27])&IF(RC[-26]="",,"|n"&R1C9&RC[-26])&IF(RC[-25]="",,"|n"&R1C10&RC[-25])&IF(RC[-24]="",,"|n"&R1C11&RC[-24])&IF(RC[-23]="",,"|n"&R1C12&RC[-23])&IF(RC[-22]="",,"|n"&R1C13&RC[-22])&IF(RC[-20]&RC[-19]&RC[-18]&RC[-17]="",,"|n"&R1C14)&IF(RC[-20]="",,"|n"&R1C15&RC[-20])&IF(RC[-19]="",,"|n"&R1C16&RC[-19])&IF(RC[-18]="",,"|n"&R1C17&RC[-18])&IF(RC[-17]="",,"|n"&R1C18&RC[-17])&IF(RC[-16]="",,"|n"&R1C19&RC[-16])&IF(RC[-15]="",,"|n"&R1C20&RC[-15])&IF(RC[-14]="",,"|n"&R1C21&RC[-14])&IF(RC[-13]="",,"|n"&R1C22&RC[-13])&IF(RC[-11]="",,"|n"&R1C24&RC[-11])&IF(RC[-10]="",,"|n"&R1C25&RC[-10])&IF(RC[-9]="",,"|n"&R1C26&RC[-9])&IF(RC[-8]="",,"|n"&R1C27&RC[-8])&IF(RC[-7]="",,"|n"&R1C28&RC[-7])&IF(RC[-6]="",,"|n"&R1C29&RC[-6])&IF(RC[-2]="",,"|n"&RC[-2]) -> 
AI248: =IF(RC[-27]&RC[-26]&RC[-25]&RC[-24]&RC[-23]&RC[-22]="",,R1C7)&IF(RC[-27]="",,"|n"&R1C8&RC[-27])&IF(RC[-26]="",,"|n"&R1C9&RC[-26])&IF(RC[-25]="",,"|n"&R1C10&RC[-25])&IF(RC[-24]="",,"|n"&R1C11&RC[-24])&IF(RC[-23]="",,"|n"&R1C12&RC[-23])&IF(RC[-22]="",,"|n"&R1C13&RC[-22])&IF(RC[-20]&RC[-19]&RC[-18]&RC[-17]="",,"|n"&R1C14)&IF(RC[-20]="",,"|n"&R1C15&RC[-20])&IF(RC[-19]="",,"|n"&R1C16&RC[-19])&IF(RC[-18]="",,"|n"&R1C17&RC[-18])&IF(RC[-17]="",,"|n"&R1C18&RC[-17])&IF(RC[-16]="",,"|n"&R1C19&RC[-16])&IF(RC[-15]="",,"|n"&R1C20&RC[-15])&IF(RC[-14]="",,"|n"&R1C21&RC[-14])&IF(RC[-13]="",,"|n"&R1C22&RC[-13])&IF(RC[-11]="",,"|n"&R1C24&RC[-11])&IF(RC[-10]="",,"|n"&R1C25&RC[-10])&IF(RC[-9]="",,"|n"&R1C26&RC[-9])&IF(RC[-8]="",,"|n"&R1C27&RC[-8])&IF(RC[-7]="",,"|n"&R1C28&RC[-7])&IF(RC[-6]="",,"|n"&R1C29&RC[-6])&IF(RC[-2]="",,"|n"&RC[-2]) -> 
AI249: =IF(RC[-27]&RC[-26]&RC[-25]&RC[-24]&RC[-23]&RC[-22]="",,R1C7)&IF(RC[-27]="",,"|n"&R1C8&RC[-27])&IF(RC[-26]="",,"|n"&R1C9&RC[-26])&IF(RC[-25]="",,"|n"&R1C10&RC[-25])&IF(RC[-24]="",,"|n"&R1C11&RC[-24])&IF(RC[-23]="",,"|n"&R1C12&RC[-23])&IF(RC[-22]="",,"|n"&R1C13&RC[-22])&IF(RC[-20]&RC[-19]&RC[-18]&RC[-17]="",,"|n"&R1C14)&IF(RC[-20]="",,"|n"&R1C15&RC[-20])&IF(RC[-19]="",,"|n"&R1C16&RC[-19])&IF(RC[-18]="",,"|n"&R1C17&RC[-18])&IF(RC[-17]="",,"|n"&R1C18&RC[-17])&IF(RC[-16]="",,"|n"&R1C19&RC[-16])&IF(RC[-15]="",,"|n"&R1C20&RC[-15])&IF(RC[-14]="",,"|n"&R1C21&RC[-14])&IF(RC[-13]="",,"|n"&R1C22&RC[-13])&IF(RC[-11]="",,"|n"&R1C24&RC[-11])&IF(RC[-10]="",,"|n"&R1C25&RC[-10])&IF(RC[-9]="",,"|n"&R1C26&RC[-9])&IF(RC[-8]="",,"|n"&R1C27&RC[-8])&IF(RC[-7]="",,"|n"&R1C28&RC[-7])&IF(RC[-6]="",,"|n"&R1C29&RC[-6])&IF(RC[-2]="",,"|n"&RC[-2]) -> 
AI250: =IF(RC[-27]&RC[-26]&RC[-25]&RC[-24]&RC[-23]&RC[-22]="",,R1C7)&IF(RC[-27]="",,"|n"&R1C8&RC[-27])&IF(RC[-26]="",,"|n"&R1C9&RC[-26])&IF(RC[-25]="",,"|n"&R1C10&RC[-25])&IF(RC[-24]="",,"|n"&R1C11&RC[-24])&IF(RC[-23]="",,"|n"&R1C12&RC[-23])&IF(RC[-22]="",,"|n"&R1C13&RC[-22])&IF(RC[-20]&RC[-19]&RC[-18]&RC[-17]="",,"|n"&R1C14)&IF(RC[-20]="",,"|n"&R1C15&RC[-20])&IF(RC[-19]="",,"|n"&R1C16&RC[-19])&IF(RC[-18]="",,"|n"&R1C17&RC[-18])&IF(RC[-17]="",,"|n"&R1C18&RC[-17])&IF(RC[-16]="",,"|n"&R1C19&RC[-16])&IF(RC[-15]="",,"|n"&R1C20&RC[-15])&IF(RC[-14]="",,"|n"&R1C21&RC[-14])&IF(RC[-13]="",,"|n"&R1C22&RC[-13])&IF(RC[-11]="",,"|n"&R1C24&RC[-11])&IF(RC[-10]="",,"|n"&R1C25&RC[-10])&IF(RC[-9]="",,"|n"&R1C26&RC[-9])&IF(RC[-8]="",,"|n"&R1C27&RC[-8])&IF(RC[-7]="",,"|n"&R1C28&RC[-7])&IF(RC[-6]="",,"|n"&R1C29&RC[-6])&IF(RC[-2]="",,"|n"&RC[-2]) -> 
AI251: =IF(RC[-27]&RC[-26]&RC[-25]&RC[-24]&RC[-23]&RC[-22]="",,R1C7)&IF(RC[-27]="",,"|n"&R1C8&RC[-27])&IF(RC[-26]="",,"|n"&R1C9&RC[-26])&IF(RC[-25]="",,"|n"&R1C10&RC[-25])&IF(RC[-24]="",,"|n"&R1C11&RC[-24])&IF(RC[-23]="",,"|n"&R1C12&RC[-23])&IF(RC[-22]="",,"|n"&R1C13&RC[-22])&IF(RC[-20]&RC[-19]&RC[-18]&RC[-17]="",,"|n"&R1C14)&IF(RC[-20]="",,"|n"&R1C15&RC[-20])&IF(RC[-19]="",,"|n"&R1C16&RC[-19])&IF(RC[-18]="",,"|n"&R1C17&RC[-18])&IF(RC[-17]="",,"|n"&R1C18&RC[-17])&IF(RC[-16]="",,"|n"&R1C19&RC[-16])&IF(RC[-15]="",,"|n"&R1C20&RC[-15])&IF(RC[-14]="",,"|n"&R1C21&RC[-14])&IF(RC[-13]="",,"|n"&R1C22&RC[-13])&IF(RC[-11]="",,"|n"&R1C24&RC[-11])&IF(RC[-10]="",,"|n"&R1C25&RC[-10])&IF(RC[-9]="",,"|n"&R1C26&RC[-9])&IF(RC[-8]="",,"|n"&R1C27&RC[-8])&IF(RC[-7]="",,"|n"&R1C28&RC[-7])&IF(RC[-6]="",,"|n"&R1C29&RC[-6])&IF(RC[-2]="",,"|n"&RC[-2]) -> 
AI252: =IF(RC[-27]&RC[-26]&RC[-25]&RC[-24]&RC[-23]&RC[-22]="",,R1C7)&IF(RC[-27]="",,"|n"&R1C8&RC[-27])&IF(RC[-26]="",,"|n"&R1C9&RC[-26])&IF(RC[-25]="",,"|n"&R1C10&RC[-25])&IF(RC[-24]="",,"|n"&R1C11&RC[-24])&IF(RC[-23]="",,"|n"&R1C12&RC[-23])&IF(RC[-22]="",,"|n"&R1C13&RC[-22])&IF(RC[-20]&RC[-19]&RC[-18]&RC[-17]="",,"|n"&R1C14)&IF(RC[-20]="",,"|n"&R1C15&RC[-20])&IF(RC[-19]="",,"|n"&R1C16&RC[-19])&IF(RC[-18]="",,"|n"&R1C17&RC[-18])&IF(RC[-17]="",,"|n"&R1C18&RC[-17])&IF(RC[-16]="",,"|n"&R1C19&RC[-16])&IF(RC[-15]="",,"|n"&R1C20&RC[-15])&IF(RC[-14]="",,"|n"&R1C21&RC[-14])&IF(RC[-13]="",,"|n"&R1C22&RC[-13])&IF(RC[-11]="",,"|n"&R1C24&RC[-11])&IF(RC[-10]="",,"|n"&R1C25&RC[-10])&IF(RC[-9]="",,"|n"&R1C26&RC[-9])&IF(RC[-8]="",,"|n"&R1C27&RC[-8])&IF(RC[-7]="",,"|n"&R1C28&RC[-7])&IF(RC[-6]="",,"|n"&R1C29&RC[-6])&IF(RC[-2]="",,"|n"&RC[-2]) -> 
AI253: =IF(RC[-27]&RC[-26]&RC[-25]&RC[-24]&RC[-23]&RC[-22]="",,R1C7)&IF(RC[-27]="",,"|n"&R1C8&RC[-27])&IF(RC[-26]="",,"|n"&R1C9&RC[-26])&IF(RC[-25]="",,"|n"&R1C10&RC[-25])&IF(RC[-24]="",,"|n"&R1C11&RC[-24])&IF(RC[-23]="",,"|n"&R1C12&RC[-23])&IF(RC[-22]="",,"|n"&R1C13&RC[-22])&IF(RC[-20]&RC[-19]&RC[-18]&RC[-17]="",,"|n"&R1C14)&IF(RC[-20]="",,"|n"&R1C15&RC[-20])&IF(RC[-19]="",,"|n"&R1C16&RC[-19])&IF(RC[-18]="",,"|n"&R1C17&RC[-18])&IF(RC[-17]="",,"|n"&R1C18&RC[-17])&IF(RC[-16]="",,"|n"&R1C19&RC[-16])&IF(RC[-15]="",,"|n"&R1C20&RC[-15])&IF(RC[-14]="",,"|n"&R1C21&RC[-14])&IF(RC[-13]="",,"|n"&R1C22&RC[-13])&IF(RC[-11]="",,"|n"&R1C24&RC[-11])&IF(RC[-10]="",,"|n"&R1C25&RC[-10])&IF(RC[-9]="",,"|n"&R1C26&RC[-9])&IF(RC[-8]="",,"|n"&R1C27&RC[-8])&IF(RC[-7]="",,"|n"&R1C28&RC[-7])&IF(RC[-6]="",,"|n"&R1C29&RC[-6])&IF(RC[-2]="",,"|n"&RC[-2]) -> 
AI254: =IF(RC[-27]&RC[-26]&RC[-25]&RC[-24]&RC[-23]&RC[-22]="",,R1C7)&IF(RC[-27]="",,"|n"&R1C8&RC[-27])&IF(RC[-26]="",,"|n"&R1C9&RC[-26])&IF(RC[-25]="",,"|n"&R1C10&RC[-25])&IF(RC[-24]="",,"|n"&R1C11&RC[-24])&IF(RC[-23]="",,"|n"&R1C12&RC[-23])&IF(RC[-22]="",,"|n"&R1C13&RC[-22])&IF(RC[-20]&RC[-19]&RC[-18]&RC[-17]="",,"|n"&R1C14)&IF(RC[-20]="",,"|n"&R1C15&RC[-20])&IF(RC[-19]="",,"|n"&R1C16&RC[-19])&IF(RC[-18]="",,"|n"&R1C17&RC[-18])&IF(RC[-17]="",,"|n"&R1C18&RC[-17])&IF(RC[-16]="",,"|n"&R1C19&RC[-16])&IF(RC[-15]="",,"|n"&R1C20&RC[-15])&IF(RC[-14]="",,"|n"&R1C21&RC[-14])&IF(RC[-13]="",,"|n"&R1C22&RC[-13])&IF(RC[-11]="",,"|n"&R1C24&RC[-11])&IF(RC[-10]="",,"|n"&R1C25&RC[-10])&IF(RC[-9]="",,"|n"&R1C26&RC[-9])&IF(RC[-8]="",,"|n"&R1C27&RC[-8])&IF(RC[-7]="",,"|n"&R1C28&RC[-7])&IF(RC[-6]="",,"|n"&R1C29&RC[-6])&IF(RC[-2]="",,"|n"&RC[-2]) -> 
AI255: =IF(RC[-27]&RC[-26]&RC[-25]&RC[-24]&RC[-23]&RC[-22]="",,R1C7)&IF(RC[-27]="",,"|n"&R1C8&RC[-27])&IF(RC[-26]="",,"|n"&R1C9&RC[-26])&IF(RC[-25]="",,"|n"&R1C10&RC[-25])&IF(RC[-24]="",,"|n"&R1C11&RC[-24])&IF(RC[-23]="",,"|n"&R1C12&RC[-23])&IF(RC[-22]="",,"|n"&R1C13&RC[-22])&IF(RC[-20]&RC[-19]&RC[-18]&RC[-17]="",,"|n"&R1C14)&IF(RC[-20]="",,"|n"&R1C15&RC[-20])&IF(RC[-19]="",,"|n"&R1C16&RC[-19])&IF(RC[-18]="",,"|n"&R1C17&RC[-18])&IF(RC[-17]="",,"|n"&R1C18&RC[-17])&IF(RC[-16]="",,"|n"&R1C19&RC[-16])&IF(RC[-15]="",,"|n"&R1C20&RC[-15])&IF(RC[-14]="",,"|n"&R1C21&RC[-14])&IF(RC[-13]="",,"|n"&R1C22&RC[-13])&IF(RC[-11]="",,"|n"&R1C24&RC[-11])&IF(RC[-10]="",,"|n"&R1C25&RC[-10])&IF(RC[-9]="",,"|n"&R1C26&RC[-9])&IF(RC[-8]="",,"|n"&R1C27&RC[-8])&IF(RC[-7]="",,"|n"&R1C28&RC[-7])&IF(RC[-6]="",,"|n"&R1C29&RC[-6])&IF(RC[-2]="",,"|n"&RC[-2]) -> 
AI256: =IF(RC[-27]&RC[-26]&RC[-25]&RC[-24]&RC[-23]&RC[-22]="",,R1C7)&IF(RC[-27]="",,"|n"&R1C8&RC[-27])&IF(RC[-26]="",,"|n"&R1C9&RC[-26])&IF(RC[-25]="",,"|n"&R1C10&RC[-25])&IF(RC[-24]="",,"|n"&R1C11&RC[-24])&IF(RC[-23]="",,"|n"&R1C12&RC[-23])&IF(RC[-22]="",,"|n"&R1C13&RC[-22])&IF(RC[-20]&RC[-19]&RC[-18]&RC[-17]="",,"|n"&R1C14)&IF(RC[-20]="",,"|n"&R1C15&RC[-20])&IF(RC[-19]="",,"|n"&R1C16&RC[-19])&IF(RC[-18]="",,"|n"&R1C17&RC[-18])&IF(RC[-17]="",,"|n"&R1C18&RC[-17])&IF(RC[-16]="",,"|n"&R1C19&RC[-16])&IF(RC[-15]="",,"|n"&R1C20&RC[-15])&IF(RC[-14]="",,"|n"&R1C21&RC[-14])&IF(RC[-13]="",,"|n"&R1C22&RC[-13])&IF(RC[-11]="",,"|n"&R1C24&RC[-11])&IF(RC[-10]="",,"|n"&R1C25&RC[-10])&IF(RC[-9]="",,"|n"&R1C26&RC[-9])&IF(RC[-8]="",,"|n"&R1C27&RC[-8])&IF(RC[-7]="",,"|n"&R1C28&RC[-7])&IF(RC[-6]="",,"|n"&R1C29&RC[-6])&IF(RC[-2]="",,"|n"&RC[-2]) -> 
AI257: =IF(RC[-27]&RC[-26]&RC[-25]&RC[-24]&RC[-23]&RC[-22]="",,R1C7)&IF(RC[-27]="",,"|n"&R1C8&RC[-27])&IF(RC[-26]="",,"|n"&R1C9&RC[-26])&IF(RC[-25]="",,"|n"&R1C10&RC[-25])&IF(RC[-24]="",,"|n"&R1C11&RC[-24])&IF(RC[-23]="",,"|n"&R1C12&RC[-23])&IF(RC[-22]="",,"|n"&R1C13&RC[-22])&IF(RC[-20]&RC[-19]&RC[-18]&RC[-17]="",,"|n"&R1C14)&IF(RC[-20]="",,"|n"&R1C15&RC[-20])&IF(RC[-19]="",,"|n"&R1C16&RC[-19])&IF(RC[-18]="",,"|n"&R1C17&RC[-18])&IF(RC[-17]="",,"|n"&R1C18&RC[-17])&IF(RC[-16]="",,"|n"&R1C19&RC[-16])&IF(RC[-15]="",,"|n"&R1C20&RC[-15])&IF(RC[-14]="",,"|n"&R1C21&RC[-14])&IF(RC[-13]="",,"|n"&R1C22&RC[-13])&IF(RC[-11]="",,"|n"&R1C24&RC[-11])&IF(RC[-10]="",,"|n"&R1C25&RC[-10])&IF(RC[-9]="",,"|n"&R1C26&RC[-9])&IF(RC[-8]="",,"|n"&R1C27&RC[-8])&IF(RC[-7]="",,"|n"&R1C28&RC[-7])&IF(RC[-6]="",,"|n"&R1C29&RC[-6])&IF(RC[-2]="",,"|n"&RC[-2]) -> 
AI258: =IF(RC[-27]&RC[-26]&RC[-25]&RC[-24]&RC[-23]&RC[-22]="",,R1C7)&IF(RC[-27]="",,"|n"&R1C8&RC[-27])&IF(RC[-26]="",,"|n"&R1C9&RC[-26])&IF(RC[-25]="",,"|n"&R1C10&RC[-25])&IF(RC[-24]="",,"|n"&R1C11&RC[-24])&IF(RC[-23]="",,"|n"&R1C12&RC[-23])&IF(RC[-22]="",,"|n"&R1C13&RC[-22])&IF(RC[-20]&RC[-19]&RC[-18]&RC[-17]="",,"|n"&R1C14)&IF(RC[-20]="",,"|n"&R1C15&RC[-20])&IF(RC[-19]="",,"|n"&R1C16&RC[-19])&IF(RC[-18]="",,"|n"&R1C17&RC[-18])&IF(RC[-17]="",,"|n"&R1C18&RC[-17])&IF(RC[-16]="",,"|n"&R1C19&RC[-16])&IF(RC[-15]="",,"|n"&R1C20&RC[-15])&IF(RC[-14]="",,"|n"&R1C21&RC[-14])&IF(RC[-13]="",,"|n"&R1C22&RC[-13])&IF(RC[-11]="",,"|n"&R1C24&RC[-11])&IF(RC[-10]="",,"|n"&R1C25&RC[-10])&IF(RC[-9]="",,"|n"&R1C26&RC[-9])&IF(RC[-8]="",,"|n"&R1C27&RC[-8])&IF(RC[-7]="",,"|n"&R1C28&RC[-7])&IF(RC[-6]="",,"|n"&R1C29&RC[-6])&IF(RC[-2]="",,"|n"&RC[-2]) -> 
AI259: =IF(RC[-27]&RC[-26]&RC[-25]&RC[-24]&RC[-23]&RC[-22]="",,R1C7)&IF(RC[-27]="",,"|n"&R1C8&RC[-27])&IF(RC[-26]="",,"|n"&R1C9&RC[-26])&IF(RC[-25]="",,"|n"&R1C10&RC[-25])&IF(RC[-24]="",,"|n"&R1C11&RC[-24])&IF(RC[-23]="",,"|n"&R1C12&RC[-23])&IF(RC[-22]="",,"|n"&R1C13&RC[-22])&IF(RC[-20]&RC[-19]&RC[-18]&RC[-17]="",,"|n"&R1C14)&IF(RC[-20]="",,"|n"&R1C15&RC[-20])&IF(RC[-19]="",,"|n"&R1C16&RC[-19])&IF(RC[-18]="",,"|n"&R1C17&RC[-18])&IF(RC[-17]="",,"|n"&R1C18&RC[-17])&IF(RC[-16]="",,"|n"&R1C19&RC[-16])&IF(RC[-15]="",,"|n"&R1C20&RC[-15])&IF(RC[-14]="",,"|n"&R1C21&RC[-14])&IF(RC[-13]="",,"|n"&R1C22&RC[-13])&IF(RC[-11]="",,"|n"&R1C24&RC[-11])&IF(RC[-10]="",,"|n"&R1C25&RC[-10])&IF(RC[-9]="",,"|n"&R1C26&RC[-9])&IF(RC[-8]="",,"|n"&R1C27&RC[-8])&IF(RC[-7]="",,"|n"&R1C28&RC[-7])&IF(RC[-6]="",,"|n"&R1C29&RC[-6])&IF(RC[-2]="",,"|n"&RC[-2]) -> 
AI260: =IF(RC[-27]&RC[-26]&RC[-25]&RC[-24]&RC[-23]&RC[-22]="",,R1C7)&IF(RC[-27]="",,"|n"&R1C8&RC[-27])&IF(RC[-26]="",,"|n"&R1C9&RC[-26])&IF(RC[-25]="",,"|n"&R1C10&RC[-25])&IF(RC[-24]="",,"|n"&R1C11&RC[-24])&IF(RC[-23]="",,"|n"&R1C12&RC[-23])&IF(RC[-22]="",,"|n"&R1C13&RC[-22])&IF(RC[-20]&RC[-19]&RC[-18]&RC[-17]="",,"|n"&R1C14)&IF(RC[-20]="",,"|n"&R1C15&RC[-20])&IF(RC[-19]="",,"|n"&R1C16&RC[-19])&IF(RC[-18]="",,"|n"&R1C17&RC[-18])&IF(RC[-17]="",,"|n"&R1C18&RC[-17])&IF(RC[-16]="",,"|n"&R1C19&RC[-16])&IF(RC[-15]="",,"|n"&R1C20&RC[-15])&IF(RC[-14]="",,"|n"&R1C21&RC[-14])&IF(RC[-13]="",,"|n"&R1C22&RC[-13])&IF(RC[-11]="",,"|n"&R1C24&RC[-11])&IF(RC[-10]="",,"|n"&R1C25&RC[-10])&IF(RC[-9]="",,"|n"&R1C26&RC[-9])&IF(RC[-8]="",,"|n"&R1C27&RC[-8])&IF(RC[-7]="",,"|n"&R1C28&RC[-7])&IF(RC[-6]="",,"|n"&R1C29&RC[-6])&IF(RC[-2]="",,"|n"&RC[-2]) -> 
AI261: =IF(RC[-27]&RC[-26]&RC[-25]&RC[-24]&RC[-23]&RC[-22]="",,R1C7)&IF(RC[-27]="",,"|n"&R1C8&RC[-27])&IF(RC[-26]="",,"|n"&R1C9&RC[-26])&IF(RC[-25]="",,"|n"&R1C10&RC[-25])&IF(RC[-24]="",,"|n"&R1C11&RC[-24])&IF(RC[-23]="",,"|n"&R1C12&RC[-23])&IF(RC[-22]="",,"|n"&R1C13&RC[-22])&IF(RC[-20]&RC[-19]&RC[-18]&RC[-17]="",,"|n"&R1C14)&IF(RC[-20]="",,"|n"&R1C15&RC[-20])&IF(RC[-19]="",,"|n"&R1C16&RC[-19])&IF(RC[-18]="",,"|n"&R1C17&RC[-18])&IF(RC[-17]="",,"|n"&R1C18&RC[-17])&IF(RC[-16]="",,"|n"&R1C19&RC[-16])&IF(RC[-15]="",,"|n"&R1C20&RC[-15])&IF(RC[-14]="",,"|n"&R1C21&RC[-14])&IF(RC[-13]="",,"|n"&R1C22&RC[-13])&IF(RC[-11]="",,"|n"&R1C24&RC[-11])&IF(RC[-10]="",,"|n"&R1C25&RC[-10])&IF(RC[-9]="",,"|n"&R1C26&RC[-9])&IF(RC[-8]="",,"|n"&R1C27&RC[-8])&IF(RC[-7]="",,"|n"&R1C28&RC[-7])&IF(RC[-6]="",,"|n"&R1C29&RC[-6])&IF(RC[-2]="",,"|n"&RC[-2]) -> 
AI262: =IF(RC[-27]&RC[-26]&RC[-25]&RC[-24]&RC[-23]&RC[-22]="",,R1C7)&IF(RC[-27]="",,"|n"&R1C8&RC[-27])&IF(RC[-26]="",,"|n"&R1C9&RC[-26])&IF(RC[-25]="",,"|n"&R1C10&RC[-25])&IF(RC[-24]="",,"|n"&R1C11&RC[-24])&IF(RC[-23]="",,"|n"&R1C12&RC[-23])&IF(RC[-22]="",,"|n"&R1C13&RC[-22])&IF(RC[-20]&RC[-19]&RC[-18]&RC[-17]="",,"|n"&R1C14)&IF(RC[-20]="",,"|n"&R1C15&RC[-20])&IF(RC[-19]="",,"|n"&R1C16&RC[-19])&IF(RC[-18]="",,"|n"&R1C17&RC[-18])&IF(RC[-17]="",,"|n"&R1C18&RC[-17])&IF(RC[-16]="",,"|n"&R1C19&RC[-16])&IF(RC[-15]="",,"|n"&R1C20&RC[-15])&IF(RC[-14]="",,"|n"&R1C21&RC[-14])&IF(RC[-13]="",,"|n"&R1C22&RC[-13])&IF(RC[-11]="",,"|n"&R1C24&RC[-11])&IF(RC[-10]="",,"|n"&R1C25&RC[-10])&IF(RC[-9]="",,"|n"&R1C26&RC[-9])&IF(RC[-8]="",,"|n"&R1C27&RC[-8])&IF(RC[-7]="",,"|n"&R1C28&RC[-7])&IF(RC[-6]="",,"|n"&R1C29&RC[-6])&IF(RC[-2]="",,"|n"&RC[-2]) -> 
AI263: =IF(RC[-27]&RC[-26]&RC[-25]&RC[-24]&RC[-23]&RC[-22]="",,R1C7)&IF(RC[-27]="",,"|n"&R1C8&RC[-27])&IF(RC[-26]="",,"|n"&R1C9&RC[-26])&IF(RC[-25]="",,"|n"&R1C10&RC[-25])&IF(RC[-24]="",,"|n"&R1C11&RC[-24])&IF(RC[-23]="",,"|n"&R1C12&RC[-23])&IF(RC[-22]="",,"|n"&R1C13&RC[-22])&IF(RC[-20]&RC[-19]&RC[-18]&RC[-17]="",,"|n"&R1C14)&IF(RC[-20]="",,"|n"&R1C15&RC[-20])&IF(RC[-19]="",,"|n"&R1C16&RC[-19])&IF(RC[-18]="",,"|n"&R1C17&RC[-18])&IF(RC[-17]="",,"|n"&R1C18&RC[-17])&IF(RC[-16]="",,"|n"&R1C19&RC[-16])&IF(RC[-15]="",,"|n"&R1C20&RC[-15])&IF(RC[-14]="",,"|n"&R1C21&RC[-14])&IF(RC[-13]="",,"|n"&R1C22&RC[-13])&IF(RC[-11]="",,"|n"&R1C24&RC[-11])&IF(RC[-10]="",,"|n"&R1C25&RC[-10])&IF(RC[-9]="",,"|n"&R1C26&RC[-9])&IF(RC[-8]="",,"|n"&R1C27&RC[-8])&IF(RC[-7]="",,"|n"&R1C28&RC[-7])&IF(RC[-6]="",,"|n"&R1C29&RC[-6])&IF(RC[-2]="",,"|n"&RC[-2]) -> 
AI264: =IF(RC[-27]&RC[-26]&RC[-25]&RC[-24]&RC[-23]&RC[-22]="",,R1C7)&IF(RC[-27]="",,"|n"&R1C8&RC[-27])&IF(RC[-26]="",,"|n"&R1C9&RC[-26])&IF(RC[-25]="",,"|n"&R1C10&RC[-25])&IF(RC[-24]="",,"|n"&R1C11&RC[-24])&IF(RC[-23]="",,"|n"&R1C12&RC[-23])&IF(RC[-22]="",,"|n"&R1C13&RC[-22])&IF(RC[-20]&RC[-19]&RC[-18]&RC[-17]="",,"|n"&R1C14)&IF(RC[-20]="",,"|n"&R1C15&RC[-20])&IF(RC[-19]="",,"|n"&R1C16&RC[-19])&IF(RC[-18]="",,"|n"&R1C17&RC[-18])&IF(RC[-17]="",,"|n"&R1C18&RC[-17])&IF(RC[-16]="",,"|n"&R1C19&RC[-16])&IF(RC[-15]="",,"|n"&R1C20&RC[-15])&IF(RC[-14]="",,"|n"&R1C21&RC[-14])&IF(RC[-13]="",,"|n"&R1C22&RC[-13])&IF(RC[-11]="",,"|n"&R1C24&RC[-11])&IF(RC[-10]="",,"|n"&R1C25&RC[-10])&IF(RC[-9]="",,"|n"&R1C26&RC[-9])&IF(RC[-8]="",,"|n"&R1C27&RC[-8])&IF(RC[-7]="",,"|n"&R1C28&RC[-7])&IF(RC[-6]="",,"|n"&R1C29&RC[-6])&IF(RC[-2]="",,"|n"&RC[-2]) -> 
AI265: =IF(RC[-27]&RC[-26]&RC[-25]&RC[-24]&RC[-23]&RC[-22]="",,R1C7)&IF(RC[-27]="",,"|n"&R1C8&RC[-27])&IF(RC[-26]="",,"|n"&R1C9&RC[-26])&IF(RC[-25]="",,"|n"&R1C10&RC[-25])&IF(RC[-24]="",,"|n"&R1C11&RC[-24])&IF(RC[-23]="",,"|n"&R1C12&RC[-23])&IF(RC[-22]="",,"|n"&R1C13&RC[-22])&IF(RC[-20]&RC[-19]&RC[-18]&RC[-17]="",,"|n"&R1C14)&IF(RC[-20]="",,"|n"&R1C15&RC[-20])&IF(RC[-19]="",,"|n"&R1C16&RC[-19])&IF(RC[-18]="",,"|n"&R1C17&RC[-18])&IF(RC[-17]="",,"|n"&R1C18&RC[-17])&IF(RC[-16]="",,"|n"&R1C19&RC[-16])&IF(RC[-15]="",,"|n"&R1C20&RC[-15])&IF(RC[-14]="",,"|n"&R1C21&RC[-14])&IF(RC[-13]="",,"|n"&R1C22&RC[-13])&IF(RC[-11]="",,"|n"&R1C24&RC[-11])&IF(RC[-10]="",,"|n"&R1C25&RC[-10])&IF(RC[-9]="",,"|n"&R1C26&RC[-9])&IF(RC[-8]="",,"|n"&R1C27&RC[-8])&IF(RC[-7]="",,"|n"&R1C28&RC[-7])&IF(RC[-6]="",,"|n"&R1C29&RC[-6])&IF(RC[-2]="",,"|n"&RC[-2]) -> 
AI266: =IF(RC[-27]&RC[-26]&RC[-25]&RC[-24]&RC[-23]&RC[-22]="",,R1C7)&IF(RC[-27]="",,"|n"&R1C8&RC[-27])&IF(RC[-26]="",,"|n"&R1C9&RC[-26])&IF(RC[-25]="",,"|n"&R1C10&RC[-25])&IF(RC[-24]="",,"|n"&R1C11&RC[-24])&IF(RC[-23]="",,"|n"&R1C12&RC[-23])&IF(RC[-22]="",,"|n"&R1C13&RC[-22])&IF(RC[-20]&RC[-19]&RC[-18]&RC[-17]="",,"|n"&R1C14)&IF(RC[-20]="",,"|n"&R1C15&RC[-20])&IF(RC[-19]="",,"|n"&R1C16&RC[-19])&IF(RC[-18]="",,"|n"&R1C17&RC[-18])&IF(RC[-17]="",,"|n"&R1C18&RC[-17])&IF(RC[-16]="",,"|n"&R1C19&RC[-16])&IF(RC[-15]="",,"|n"&R1C20&RC[-15])&IF(RC[-14]="",,"|n"&R1C21&RC[-14])&IF(RC[-13]="",,"|n"&R1C22&RC[-13])&IF(RC[-11]="",,"|n"&R1C24&RC[-11])&IF(RC[-10]="",,"|n"&R1C25&RC[-10])&IF(RC[-9]="",,"|n"&R1C26&RC[-9])&IF(RC[-8]="",,"|n"&R1C27&RC[-8])&IF(RC[-7]="",,"|n"&R1C28&RC[-7])&IF(RC[-6]="",,"|n"&R1C29&RC[-6])&IF(RC[-2]="",,"|n"&RC[-2]) -> 
AI267: =IF(RC[-27]&RC[-26]&RC[-25]&RC[-24]&RC[-23]&RC[-22]="",,R1C7)&IF(RC[-27]="",,"|n"&R1C8&RC[-27])&IF(RC[-26]="",,"|n"&R1C9&RC[-26])&IF(RC[-25]="",,"|n"&R1C10&RC[-25])&IF(RC[-24]="",,"|n"&R1C11&RC[-24])&IF(RC[-23]="",,"|n"&R1C12&RC[-23])&IF(RC[-22]="",,"|n"&R1C13&RC[-22])&IF(RC[-20]&RC[-19]&RC[-18]&RC[-17]="",,"|n"&R1C14)&IF(RC[-20]="",,"|n"&R1C15&RC[-20])&IF(RC[-19]="",,"|n"&R1C16&RC[-19])&IF(RC[-18]="",,"|n"&R1C17&RC[-18])&IF(RC[-17]="",,"|n"&R1C18&RC[-17])&IF(RC[-16]="",,"|n"&R1C19&RC[-16])&IF(RC[-15]="",,"|n"&R1C20&RC[-15])&IF(RC[-14]="",,"|n"&R1C21&RC[-14])&IF(RC[-13]="",,"|n"&R1C22&RC[-13])&IF(RC[-11]="",,"|n"&R1C24&RC[-11])&IF(RC[-10]="",,"|n"&R1C25&RC[-10])&IF(RC[-9]="",,"|n"&R1C26&RC[-9])&IF(RC[-8]="",,"|n"&R1C27&RC[-8])&IF(RC[-7]="",,"|n"&R1C28&RC[-7])&IF(RC[-6]="",,"|n"&R1C29&RC[-6])&IF(RC[-2]="",,"|n"&RC[-2]) -> 
AI268: =IF(RC[-27]&RC[-26]&RC[-25]&RC[-24]&RC[-23]&RC[-22]="",,R1C7)&IF(RC[-27]="",,"|n"&R1C8&RC[-27])&IF(RC[-26]="",,"|n"&R1C9&RC[-26])&IF(RC[-25]="",,"|n"&R1C10&RC[-25])&IF(RC[-24]="",,"|n"&R1C11&RC[-24])&IF(RC[-23]="",,"|n"&R1C12&RC[-23])&IF(RC[-22]="",,"|n"&R1C13&RC[-22])&IF(RC[-20]&RC[-19]&RC[-18]&RC[-17]="",,"|n"&R1C14)&IF(RC[-20]="",,"|n"&R1C15&RC[-20])&IF(RC[-19]="",,"|n"&R1C16&RC[-19])&IF(RC[-18]="",,"|n"&R1C17&RC[-18])&IF(RC[-17]="",,"|n"&R1C18&RC[-17])&IF(RC[-16]="",,"|n"&R1C19&RC[-16])&IF(RC[-15]="",,"|n"&R1C20&RC[-15])&IF(RC[-14]="",,"|n"&R1C21&RC[-14])&IF(RC[-13]="",,"|n"&R1C22&RC[-13])&IF(RC[-11]="",,"|n"&R1C24&RC[-11])&IF(RC[-10]="",,"|n"&R1C25&RC[-10])&IF(RC[-9]="",,"|n"&R1C26&RC[-9])&IF(RC[-8]="",,"|n"&R1C27&RC[-8])&IF(RC[-7]="",,"|n"&R1C28&RC[-7])&IF(RC[-6]="",,"|n"&R1C29&RC[-6])&IF(RC[-2]="",,"|n"&RC[-2]) -> 
AI269: =IF(RC[-27]&RC[-26]&RC[-25]&RC[-24]&RC[-23]&RC[-22]="",,R1C7)&IF(RC[-27]="",,"|n"&R1C8&RC[-27])&IF(RC[-26]="",,"|n"&R1C9&RC[-26])&IF(RC[-25]="",,"|n"&R1C10&RC[-25])&IF(RC[-24]="",,"|n"&R1C11&RC[-24])&IF(RC[-23]="",,"|n"&R1C12&RC[-23])&IF(RC[-22]="",,"|n"&R1C13&RC[-22])&IF(RC[-20]&RC[-19]&RC[-18]&RC[-17]="",,"|n"&R1C14)&IF(RC[-20]="",,"|n"&R1C15&RC[-20])&IF(RC[-19]="",,"|n"&R1C16&RC[-19])&IF(RC[-18]="",,"|n"&R1C17&RC[-18])&IF(RC[-17]="",,"|n"&R1C18&RC[-17])&IF(RC[-16]="",,"|n"&R1C19&RC[-16])&IF(RC[-15]="",,"|n"&R1C20&RC[-15])&IF(RC[-14]="",,"|n"&R1C21&RC[-14])&IF(RC[-13]="",,"|n"&R1C22&RC[-13])&IF(RC[-11]="",,"|n"&R1C24&RC[-11])&IF(RC[-10]="",,"|n"&R1C25&RC[-10])&IF(RC[-9]="",,"|n"&R1C26&RC[-9])&IF(RC[-8]="",,"|n"&R1C27&RC[-8])&IF(RC[-7]="",,"|n"&R1C28&RC[-7])&IF(RC[-6]="",,"|n"&R1C29&RC[-6])&IF(RC[-2]="",,"|n"&RC[-2]) -> 
AI270: =IF(RC[-27]&RC[-26]&RC[-25]&RC[-24]&RC[-23]&RC[-22]="",,R1C7)&IF(RC[-27]="",,"|n"&R1C8&RC[-27])&IF(RC[-26]="",,"|n"&R1C9&RC[-26])&IF(RC[-25]="",,"|n"&R1C10&RC[-25])&IF(RC[-24]="",,"|n"&R1C11&RC[-24])&IF(RC[-23]="",,"|n"&R1C12&RC[-23])&IF(RC[-22]="",,"|n"&R1C13&RC[-22])&IF(RC[-20]&RC[-19]&RC[-18]&RC[-17]="",,"|n"&R1C14)&IF(RC[-20]="",,"|n"&R1C15&RC[-20])&IF(RC[-19]="",,"|n"&R1C16&RC[-19])&IF(RC[-18]="",,"|n"&R1C17&RC[-18])&IF(RC[-17]="",,"|n"&R1C18&RC[-17])&IF(RC[-16]="",,"|n"&R1C19&RC[-16])&IF(RC[-15]="",,"|n"&R1C20&RC[-15])&IF(RC[-14]="",,"|n"&R1C21&RC[-14])&IF(RC[-13]="",,"|n"&R1C22&RC[-13])&IF(RC[-11]="",,"|n"&R1C24&RC[-11])&IF(RC[-10]="",,"|n"&R1C25&RC[-10])&IF(RC[-9]="",,"|n"&R1C26&RC[-9])&IF(RC[-8]="",,"|n"&R1C27&RC[-8])&IF(RC[-7]="",,"|n"&R1C28&RC[-7])&IF(RC[-6]="",,"|n"&R1C29&RC[-6])&IF(RC[-2]="",,"|n"&RC[-2]) -> 
AI271: =IF(RC[-27]&RC[-26]&RC[-25]&RC[-24]&RC[-23]&RC[-22]="",,R1C7)&IF(RC[-27]="",,"|n"&R1C8&RC[-27])&IF(RC[-26]="",,"|n"&R1C9&RC[-26])&IF(RC[-25]="",,"|n"&R1C10&RC[-25])&IF(RC[-24]="",,"|n"&R1C11&RC[-24])&IF(RC[-23]="",,"|n"&R1C12&RC[-23])&IF(RC[-22]="",,"|n"&R1C13&RC[-22])&IF(RC[-20]&RC[-19]&RC[-18]&RC[-17]="",,"|n"&R1C14)&IF(RC[-20]="",,"|n"&R1C15&RC[-20])&IF(RC[-19]="",,"|n"&R1C16&RC[-19])&IF(RC[-18]="",,"|n"&R1C17&RC[-18])&IF(RC[-17]="",,"|n"&R1C18&RC[-17])&IF(RC[-16]="",,"|n"&R1C19&RC[-16])&IF(RC[-15]="",,"|n"&R1C20&RC[-15])&IF(RC[-14]="",,"|n"&R1C21&RC[-14])&IF(RC[-13]="",,"|n"&R1C22&RC[-13])&IF(RC[-11]="",,"|n"&R1C24&RC[-11])&IF(RC[-10]="",,"|n"&R1C25&RC[-10])&IF(RC[-9]="",,"|n"&R1C26&RC[-9])&IF(RC[-8]="",,"|n"&R1C27&RC[-8])&IF(RC[-7]="",,"|n"&R1C28&RC[-7])&IF(RC[-6]="",,"|n"&R1C29&RC[-6])&IF(RC[-2]="",,"|n"&RC[-2]) -> 
AI272: =IF(RC[-27]&RC[-26]&RC[-25]&RC[-24]&RC[-23]&RC[-22]="",,R1C7)&IF(RC[-27]="",,"|n"&R1C8&RC[-27])&IF(RC[-26]="",,"|n"&R1C9&RC[-26])&IF(RC[-25]="",,"|n"&R1C10&RC[-25])&IF(RC[-24]="",,"|n"&R1C11&RC[-24])&IF(RC[-23]="",,"|n"&R1C12&RC[-23])&IF(RC[-22]="",,"|n"&R1C13&RC[-22])&IF(RC[-20]&RC[-19]&RC[-18]&RC[-17]="",,"|n"&R1C14)&IF(RC[-20]="",,"|n"&R1C15&RC[-20])&IF(RC[-19]="",,"|n"&R1C16&RC[-19])&IF(RC[-18]="",,"|n"&R1C17&RC[-18])&IF(RC[-17]="",,"|n"&R1C18&RC[-17])&IF(RC[-16]="",,"|n"&R1C19&RC[-16])&IF(RC[-15]="",,"|n"&R1C20&RC[-15])&IF(RC[-14]="",,"|n"&R1C21&RC[-14])&IF(RC[-13]="",,"|n"&R1C22&RC[-13])&IF(RC[-11]="",,"|n"&R1C24&RC[-11])&IF(RC[-10]="",,"|n"&R1C25&RC[-10])&IF(RC[-9]="",,"|n"&R1C26&RC[-9])&IF(RC[-8]="",,"|n"&R1C27&RC[-8])&IF(RC[-7]="",,"|n"&R1C28&RC[-7])&IF(RC[-6]="",,"|n"&R1C29&RC[-6])&IF(RC[-2]="",,"|n"&RC[-2]) -> 
AI273: =IF(RC[-27]&RC[-26]&RC[-25]&RC[-24]&RC[-23]&RC[-22]="",,R1C7)&IF(RC[-27]="",,"|n"&R1C8&RC[-27])&IF(RC[-26]="",,"|n"&R1C9&RC[-26])&IF(RC[-25]="",,"|n"&R1C10&RC[-25])&IF(RC[-24]="",,"|n"&R1C11&RC[-24])&IF(RC[-23]="",,"|n"&R1C12&RC[-23])&IF(RC[-22]="",,"|n"&R1C13&RC[-22])&IF(RC[-20]&RC[-19]&RC[-18]&RC[-17]="",,"|n"&R1C14)&IF(RC[-20]="",,"|n"&R1C15&RC[-20])&IF(RC[-19]="",,"|n"&R1C16&RC[-19])&IF(RC[-18]="",,"|n"&R1C17&RC[-18])&IF(RC[-17]="",,"|n"&R1C18&RC[-17])&IF(RC[-16]="",,"|n"&R1C19&RC[-16])&IF(RC[-15]="",,"|n"&R1C20&RC[-15])&IF(RC[-14]="",,"|n"&R1C21&RC[-14])&IF(RC[-13]="",,"|n"&R1C22&RC[-13])&IF(RC[-11]="",,"|n"&R1C24&RC[-11])&IF(RC[-10]="",,"|n"&R1C25&RC[-10])&IF(RC[-9]="",,"|n"&R1C26&RC[-9])&IF(RC[-8]="",,"|n"&R1C27&RC[-8])&IF(RC[-7]="",,"|n"&R1C28&RC[-7])&IF(RC[-6]="",,"|n"&R1C29&RC[-6])&IF(RC[-2]="",,"|n"&RC[-2]) -> 
AI274: =IF(RC[-27]&RC[-26]&RC[-25]&RC[-24]&RC[-23]&RC[-22]="",,R1C7)&IF(RC[-27]="",,"|n"&R1C8&RC[-27])&IF(RC[-26]="",,"|n"&R1C9&RC[-26])&IF(RC[-25]="",,"|n"&R1C10&RC[-25])&IF(RC[-24]="",,"|n"&R1C11&RC[-24])&IF(RC[-23]="",,"|n"&R1C12&RC[-23])&IF(RC[-22]="",,"|n"&R1C13&RC[-22])&IF(RC[-20]&RC[-19]&RC[-18]&RC[-17]="",,"|n"&R1C14)&IF(RC[-20]="",,"|n"&R1C15&RC[-20])&IF(RC[-19]="",,"|n"&R1C16&RC[-19])&IF(RC[-18]="",,"|n"&R1C17&RC[-18])&IF(RC[-17]="",,"|n"&R1C18&RC[-17])&IF(RC[-16]="",,"|n"&R1C19&RC[-16])&IF(RC[-15]="",,"|n"&R1C20&RC[-15])&IF(RC[-14]="",,"|n"&R1C21&RC[-14])&IF(RC[-13]="",,"|n"&R1C22&RC[-13])&IF(RC[-11]="",,"|n"&R1C24&RC[-11])&IF(RC[-10]="",,"|n"&R1C25&RC[-10])&IF(RC[-9]="",,"|n"&R1C26&RC[-9])&IF(RC[-8]="",,"|n"&R1C27&RC[-8])&IF(RC[-7]="",,"|n"&R1C28&RC[-7])&IF(RC[-6]="",,"|n"&R1C29&RC[-6])&IF(RC[-2]="",,"|n"&RC[-2]) -> 
AI275: =IF(RC[-27]&RC[-26]&RC[-25]&RC[-24]&RC[-23]&RC[-22]="",,R1C7)&IF(RC[-27]="",,"|n"&R1C8&RC[-27])&IF(RC[-26]="",,"|n"&R1C9&RC[-26])&IF(RC[-25]="",,"|n"&R1C10&RC[-25])&IF(RC[-24]="",,"|n"&R1C11&RC[-24])&IF(RC[-23]="",,"|n"&R1C12&RC[-23])&IF(RC[-22]="",,"|n"&R1C13&RC[-22])&IF(RC[-20]&RC[-19]&RC[-18]&RC[-17]="",,"|n"&R1C14)&IF(RC[-20]="",,"|n"&R1C15&RC[-20])&IF(RC[-19]="",,"|n"&R1C16&RC[-19])&IF(RC[-18]="",,"|n"&R1C17&RC[-18])&IF(RC[-17]="",,"|n"&R1C18&RC[-17])&IF(RC[-16]="",,"|n"&R1C19&RC[-16])&IF(RC[-15]="",,"|n"&R1C20&RC[-15])&IF(RC[-14]="",,"|n"&R1C21&RC[-14])&IF(RC[-13]="",,"|n"&R1C22&RC[-13])&IF(RC[-11]="",,"|n"&R1C24&RC[-11])&IF(RC[-10]="",,"|n"&R1C25&RC[-10])&IF(RC[-9]="",,"|n"&R1C26&RC[-9])&IF(RC[-8]="",,"|n"&R1C27&RC[-8])&IF(RC[-7]="",,"|n"&R1C28&RC[-7])&IF(RC[-6]="",,"|n"&R1C29&RC[-6])&IF(RC[-2]="",,"|n"&RC[-2]) -> 
AI276: =IF(RC[-27]&RC[-26]&RC[-25]&RC[-24]&RC[-23]&RC[-22]="",,R1C7)&IF(RC[-27]="",,"|n"&R1C8&RC[-27])&IF(RC[-26]="",,"|n"&R1C9&RC[-26])&IF(RC[-25]="",,"|n"&R1C10&RC[-25])&IF(RC[-24]="",,"|n"&R1C11&RC[-24])&IF(RC[-23]="",,"|n"&R1C12&RC[-23])&IF(RC[-22]="",,"|n"&R1C13&RC[-22])&IF(RC[-20]&RC[-19]&RC[-18]&RC[-17]="",,"|n"&R1C14)&IF(RC[-20]="",,"|n"&R1C15&RC[-20])&IF(RC[-19]="",,"|n"&R1C16&RC[-19])&IF(RC[-18]="",,"|n"&R1C17&RC[-18])&IF(RC[-17]="",,"|n"&R1C18&RC[-17])&IF(RC[-16]="",,"|n"&R1C19&RC[-16])&IF(RC[-15]="",,"|n"&R1C20&RC[-15])&IF(RC[-14]="",,"|n"&R1C21&RC[-14])&IF(RC[-13]="",,"|n"&R1C22&RC[-13])&IF(RC[-11]="",,"|n"&R1C24&RC[-11])&IF(RC[-10]="",,"|n"&R1C25&RC[-10])&IF(RC[-9]="",,"|n"&R1C26&RC[-9])&IF(RC[-8]="",,"|n"&R1C27&RC[-8])&IF(RC[-7]="",,"|n"&R1C28&RC[-7])&IF(RC[-6]="",,"|n"&R1C29&RC[-6])&IF(RC[-2]="",,"|n"&RC[-2]) -> 
AI277: =IF(RC[-27]&RC[-26]&RC[-25]&RC[-24]&RC[-23]&RC[-22]="",,R1C7)&IF(RC[-27]="",,"|n"&R1C8&RC[-27])&IF(RC[-26]="",,"|n"&R1C9&RC[-26])&IF(RC[-25]="",,"|n"&R1C10&RC[-25])&IF(RC[-24]="",,"|n"&R1C11&RC[-24])&IF(RC[-23]="",,"|n"&R1C12&RC[-23])&IF(RC[-22]="",,"|n"&R1C13&RC[-22])&IF(RC[-20]&RC[-19]&RC[-18]&RC[-17]="",,"|n"&R1C14)&IF(RC[-20]="",,"|n"&R1C15&RC[-20])&IF(RC[-19]="",,"|n"&R1C16&RC[-19])&IF(RC[-18]="",,"|n"&R1C17&RC[-18])&IF(RC[-17]="",,"|n"&R1C18&RC[-17])&IF(RC[-16]="",,"|n"&R1C19&RC[-16])&IF(RC[-15]="",,"|n"&R1C20&RC[-15])&IF(RC[-14]="",,"|n"&R1C21&RC[-14])&IF(RC[-13]="",,"|n"&R1C22&RC[-13])&IF(RC[-11]="",,"|n"&R1C24&RC[-11])&IF(RC[-10]="",,"|n"&R1C25&RC[-10])&IF(RC[-9]="",,"|n"&R1C26&RC[-9])&IF(RC[-8]="",,"|n"&R1C27&RC[-8])&IF(RC[-7]="",,"|n"&R1C28&RC[-7])&IF(RC[-6]="",,"|n"&R1C29&RC[-6])&IF(RC[-2]="",,"|n"&RC[-2]) -> 
AI278: =IF(RC[-27]&RC[-26]&RC[-25]&RC[-24]&RC[-23]&RC[-22]="",,R1C7)&IF(RC[-27]="",,"|n"&R1C8&RC[-27])&IF(RC[-26]="",,"|n"&R1C9&RC[-26])&IF(RC[-25]="",,"|n"&R1C10&RC[-25])&IF(RC[-24]="",,"|n"&R1C11&RC[-24])&IF(RC[-23]="",,"|n"&R1C12&RC[-23])&IF(RC[-22]="",,"|n"&R1C13&RC[-22])&IF(RC[-20]&RC[-19]&RC[-18]&RC[-17]="",,"|n"&R1C14)&IF(RC[-20]="",,"|n"&R1C15&RC[-20])&IF(RC[-19]="",,"|n"&R1C16&RC[-19])&IF(RC[-18]="",,"|n"&R1C17&RC[-18])&IF(RC[-17]="",,"|n"&R1C18&RC[-17])&IF(RC[-16]="",,"|n"&R1C19&RC[-16])&IF(RC[-15]="",,"|n"&R1C20&RC[-15])&IF(RC[-14]="",,"|n"&R1C21&RC[-14])&IF(RC[-13]="",,"|n"&R1C22&RC[-13])&IF(RC[-11]="",,"|n"&R1C24&RC[-11])&IF(RC[-10]="",,"|n"&R1C25&RC[-10])&IF(RC[-9]="",,"|n"&R1C26&RC[-9])&IF(RC[-8]="",,"|n"&R1C27&RC[-8])&IF(RC[-7]="",,"|n"&R1C28&RC[-7])&IF(RC[-6]="",,"|n"&R1C29&RC[-6])&IF(RC[-2]="",,"|n"&RC[-2]) -> 
AI279: =IF(RC[-27]&RC[-26]&RC[-25]&RC[-24]&RC[-23]&RC[-22]="",,R1C7)&IF(RC[-27]="",,"|n"&R1C8&RC[-27])&IF(RC[-26]="",,"|n"&R1C9&RC[-26])&IF(RC[-25]="",,"|n"&R1C10&RC[-25])&IF(RC[-24]="",,"|n"&R1C11&RC[-24])&IF(RC[-23]="",,"|n"&R1C12&RC[-23])&IF(RC[-22]="",,"|n"&R1C13&RC[-22])&IF(RC[-20]&RC[-19]&RC[-18]&RC[-17]="",,"|n"&R1C14)&IF(RC[-20]="",,"|n"&R1C15&RC[-20])&IF(RC[-19]="",,"|n"&R1C16&RC[-19])&IF(RC[-18]="",,"|n"&R1C17&RC[-18])&IF(RC[-17]="",,"|n"&R1C18&RC[-17])&IF(RC[-16]="",,"|n"&R1C19&RC[-16])&IF(RC[-15]="",,"|n"&R1C20&RC[-15])&IF(RC[-14]="",,"|n"&R1C21&RC[-14])&IF(RC[-13]="",,"|n"&R1C22&RC[-13])&IF(RC[-11]="",,"|n"&R1C24&RC[-11])&IF(RC[-10]="",,"|n"&R1C25&RC[-10])&IF(RC[-9]="",,"|n"&R1C26&RC[-9])&IF(RC[-8]="",,"|n"&R1C27&RC[-8])&IF(RC[-7]="",,"|n"&R1C28&RC[-7])&IF(RC[-6]="",,"|n"&R1C29&RC[-6])&IF(RC[-2]="",,"|n"&RC[-2]) -> 
AI280: =IF(RC[-27]&RC[-26]&RC[-25]&RC[-24]&RC[-23]&RC[-22]="",,R1C7)&IF(RC[-27]="",,"|n"&R1C8&RC[-27])&IF(RC[-26]="",,"|n"&R1C9&RC[-26])&IF(RC[-25]="",,"|n"&R1C10&RC[-25])&IF(RC[-24]="",,"|n"&R1C11&RC[-24])&IF(RC[-23]="",,"|n"&R1C12&RC[-23])&IF(RC[-22]="",,"|n"&R1C13&RC[-22])&IF(RC[-20]&RC[-19]&RC[-18]&RC[-17]="",,"|n"&R1C14)&IF(RC[-20]="",,"|n"&R1C15&RC[-20])&IF(RC[-19]="",,"|n"&R1C16&RC[-19])&IF(RC[-18]="",,"|n"&R1C17&RC[-18])&IF(RC[-17]="",,"|n"&R1C18&RC[-17])&IF(RC[-16]="",,"|n"&R1C19&RC[-16])&IF(RC[-15]="",,"|n"&R1C20&RC[-15])&IF(RC[-14]="",,"|n"&R1C21&RC[-14])&IF(RC[-13]="",,"|n"&R1C22&RC[-13])&IF(RC[-11]="",,"|n"&R1C24&RC[-11])&IF(RC[-10]="",,"|n"&R1C25&RC[-10])&IF(RC[-9]="",,"|n"&R1C26&RC[-9])&IF(RC[-8]="",,"|n"&R1C27&RC[-8])&IF(RC[-7]="",,"|n"&R1C28&RC[-7])&IF(RC[-6]="",,"|n"&R1C29&RC[-6])&IF(RC[-2]="",,"|n"&RC[-2]) -> 
AI281: =IF(RC[-27]&RC[-26]&RC[-25]&RC[-24]&RC[-23]&RC[-22]="",,R1C7)&IF(RC[-27]="",,"|n"&R1C8&RC[-27])&IF(RC[-26]="",,"|n"&R1C9&RC[-26])&IF(RC[-25]="",,"|n"&R1C10&RC[-25])&IF(RC[-24]="",,"|n"&R1C11&RC[-24])&IF(RC[-23]="",,"|n"&R1C12&RC[-23])&IF(RC[-22]="",,"|n"&R1C13&RC[-22])&IF(RC[-20]&RC[-19]&RC[-18]&RC[-17]="",,"|n"&R1C14)&IF(RC[-20]="",,"|n"&R1C15&RC[-20])&IF(RC[-19]="",,"|n"&R1C16&RC[-19])&IF(RC[-18]="",,"|n"&R1C17&RC[-18])&IF(RC[-17]="",,"|n"&R1C18&RC[-17])&IF(RC[-16]="",,"|n"&R1C19&RC[-16])&IF(RC[-15]="",,"|n"&R1C20&RC[-15])&IF(RC[-14]="",,"|n"&R1C21&RC[-14])&IF(RC[-13]="",,"|n"&R1C22&RC[-13])&IF(RC[-11]="",,"|n"&R1C24&RC[-11])&IF(RC[-10]="",,"|n"&R1C25&RC[-10])&IF(RC[-9]="",,"|n"&R1C26&RC[-9])&IF(RC[-8]="",,"|n"&R1C27&RC[-8])&IF(RC[-7]="",,"|n"&R1C28&RC[-7])&IF(RC[-6]="",,"|n"&R1C29&RC[-6])&IF(RC[-2]="",,"|n"&RC[-2]) -> 
AI282: =IF(RC[-27]&RC[-26]&RC[-25]&RC[-24]&RC[-23]&RC[-22]="",,R1C7)&IF(RC[-27]="",,"|n"&R1C8&RC[-27])&IF(RC[-26]="",,"|n"&R1C9&RC[-26])&IF(RC[-25]="",,"|n"&R1C10&RC[-25])&IF(RC[-24]="",,"|n"&R1C11&RC[-24])&IF(RC[-23]="",,"|n"&R1C12&RC[-23])&IF(RC[-22]="",,"|n"&R1C13&RC[-22])&IF(RC[-20]&RC[-19]&RC[-18]&RC[-17]="",,"|n"&R1C14)&IF(RC[-20]="",,"|n"&R1C15&RC[-20])&IF(RC[-19]="",,"|n"&R1C16&RC[-19])&IF(RC[-18]="",,"|n"&R1C17&RC[-18])&IF(RC[-17]="",,"|n"&R1C18&RC[-17])&IF(RC[-16]="",,"|n"&R1C19&RC[-16])&IF(RC[-15]="",,"|n"&R1C20&RC[-15])&IF(RC[-14]="",,"|n"&R1C21&RC[-14])&IF(RC[-13]="",,"|n"&R1C22&RC[-13])&IF(RC[-11]="",,"|n"&R1C24&RC[-11])&IF(RC[-10]="",,"|n"&R1C25&RC[-10])&IF(RC[-9]="",,"|n"&R1C26&RC[-9])&IF(RC[-8]="",,"|n"&R1C27&RC[-8])&IF(RC[-7]="",,"|n"&R1C28&RC[-7])&IF(RC[-6]="",,"|n"&R1C29&RC[-6])&IF(RC[-2]="",,"|n"&RC[-2]) -> 
AI283: =IF(RC[-27]&RC[-26]&RC[-25]&RC[-24]&RC[-23]&RC[-22]="",,R1C7)&IF(RC[-27]="",,"|n"&R1C8&RC[-27])&IF(RC[-26]="",,"|n"&R1C9&RC[-26])&IF(RC[-25]="",,"|n"&R1C10&RC[-25])&IF(RC[-24]="",,"|n"&R1C11&RC[-24])&IF(RC[-23]="",,"|n"&R1C12&RC[-23])&IF(RC[-22]="",,"|n"&R1C13&RC[-22])&IF(RC[-20]&RC[-19]&RC[-18]&RC[-17]="",,"|n"&R1C14)&IF(RC[-20]="",,"|n"&R1C15&RC[-20])&IF(RC[-19]="",,"|n"&R1C16&RC[-19])&IF(RC[-18]="",,"|n"&R1C17&RC[-18])&IF(RC[-17]="",,"|n"&R1C18&RC[-17])&IF(RC[-16]="",,"|n"&R1C19&RC[-16])&IF(RC[-15]="",,"|n"&R1C20&RC[-15])&IF(RC[-14]="",,"|n"&R1C21&RC[-14])&IF(RC[-13]="",,"|n"&R1C22&RC[-13])&IF(RC[-11]="",,"|n"&R1C24&RC[-11])&IF(RC[-10]="",,"|n"&R1C25&RC[-10])&IF(RC[-9]="",,"|n"&R1C26&RC[-9])&IF(RC[-8]="",,"|n"&R1C27&RC[-8])&IF(RC[-7]="",,"|n"&R1C28&RC[-7])&IF(RC[-6]="",,"|n"&R1C29&RC[-6])&IF(RC[-2]="",,"|n"&RC[-2]) -> 
AI284: =IF(RC[-27]&RC[-26]&RC[-25]&RC[-24]&RC[-23]&RC[-22]="",,R1C7)&IF(RC[-27]="",,"|n"&R1C8&RC[-27])&IF(RC[-26]="",,"|n"&R1C9&RC[-26])&IF(RC[-25]="",,"|n"&R1C10&RC[-25])&IF(RC[-24]="",,"|n"&R1C11&RC[-24])&IF(RC[-23]="",,"|n"&R1C12&RC[-23])&IF(RC[-22]="",,"|n"&R1C13&RC[-22])&IF(RC[-20]&RC[-19]&RC[-18]&RC[-17]="",,"|n"&R1C14)&IF(RC[-20]="",,"|n"&R1C15&RC[-20])&IF(RC[-19]="",,"|n"&R1C16&RC[-19])&IF(RC[-18]="",,"|n"&R1C17&RC[-18])&IF(RC[-17]="",,"|n"&R1C18&RC[-17])&IF(RC[-16]="",,"|n"&R1C19&RC[-16])&IF(RC[-15]="",,"|n"&R1C20&RC[-15])&IF(RC[-14]="",,"|n"&R1C21&RC[-14])&IF(RC[-13]="",,"|n"&R1C22&RC[-13])&IF(RC[-11]="",,"|n"&R1C24&RC[-11])&IF(RC[-10]="",,"|n"&R1C25&RC[-10])&IF(RC[-9]="",,"|n"&R1C26&RC[-9])&IF(RC[-8]="",,"|n"&R1C27&RC[-8])&IF(RC[-7]="",,"|n"&R1C28&RC[-7])&IF(RC[-6]="",,"|n"&R1C29&RC[-6])&IF(RC[-2]="",,"|n"&RC[-2]) -> 
AI285: =IF(RC[-27]&RC[-26]&RC[-25]&RC[-24]&RC[-23]&RC[-22]="",,R1C7)&IF(RC[-27]="",,"|n"&R1C8&RC[-27])&IF(RC[-26]="",,"|n"&R1C9&RC[-26])&IF(RC[-25]="",,"|n"&R1C10&RC[-25])&IF(RC[-24]="",,"|n"&R1C11&RC[-24])&IF(RC[-23]="",,"|n"&R1C12&RC[-23])&IF(RC[-22]="",,"|n"&R1C13&RC[-22])&IF(RC[-20]&RC[-19]&RC[-18]&RC[-17]="",,"|n"&R1C14)&IF(RC[-20]="",,"|n"&R1C15&RC[-20])&IF(RC[-19]="",,"|n"&R1C16&RC[-19])&IF(RC[-18]="",,"|n"&R1C17&RC[-18])&IF(RC[-17]="",,"|n"&R1C18&RC[-17])&IF(RC[-16]="",,"|n"&R1C19&RC[-16])&IF(RC[-15]="",,"|n"&R1C20&RC[-15])&IF(RC[-14]="",,"|n"&R1C21&RC[-14])&IF(RC[-13]="",,"|n"&R1C22&RC[-13])&IF(RC[-11]="",,"|n"&R1C24&RC[-11])&IF(RC[-10]="",,"|n"&R1C25&RC[-10])&IF(RC[-9]="",,"|n"&R1C26&RC[-9])&IF(RC[-8]="",,"|n"&R1C27&RC[-8])&IF(RC[-7]="",,"|n"&R1C28&RC[-7])&IF(RC[-6]="",,"|n"&R1C29&RC[-6])&IF(RC[-2]="",,"|n"&RC[-2]) -> 
AI286: =IF(RC[-27]&RC[-26]&RC[-25]&RC[-24]&RC[-23]&RC[-22]="",,R1C7)&IF(RC[-27]="",,"|n"&R1C8&RC[-27])&IF(RC[-26]="",,"|n"&R1C9&RC[-26])&IF(RC[-25]="",,"|n"&R1C10&RC[-25])&IF(RC[-24]="",,"|n"&R1C11&RC[-24])&IF(RC[-23]="",,"|n"&R1C12&RC[-23])&IF(RC[-22]="",,"|n"&R1C13&RC[-22])&IF(RC[-20]&RC[-19]&RC[-18]&RC[-17]="",,"|n"&R1C14)&IF(RC[-20]="",,"|n"&R1C15&RC[-20])&IF(RC[-19]="",,"|n"&R1C16&RC[-19])&IF(RC[-18]="",,"|n"&R1C17&RC[-18])&IF(RC[-17]="",,"|n"&R1C18&RC[-17])&IF(RC[-16]="",,"|n"&R1C19&RC[-16])&IF(RC[-15]="",,"|n"&R1C20&RC[-15])&IF(RC[-14]="",,"|n"&R1C21&RC[-14])&IF(RC[-13]="",,"|n"&R1C22&RC[-13])&IF(RC[-11]="",,"|n"&R1C24&RC[-11])&IF(RC[-10]="",,"|n"&R1C25&RC[-10])&IF(RC[-9]="",,"|n"&R1C26&RC[-9])&IF(RC[-8]="",,"|n"&R1C27&RC[-8])&IF(RC[-7]="",,"|n"&R1C28&RC[-7])&IF(RC[-6]="",,"|n"&R1C29&RC[-6])&IF(RC[-2]="",,"|n"&RC[-2]) -> 
AI287: =IF(RC[-27]&RC[-26]&RC[-25]&RC[-24]&RC[-23]&RC[-22]="",,R1C7)&IF(RC[-27]="",,"|n"&R1C8&RC[-27])&IF(RC[-26]="",,"|n"&R1C9&RC[-26])&IF(RC[-25]="",,"|n"&R1C10&RC[-25])&IF(RC[-24]="",,"|n"&R1C11&RC[-24])&IF(RC[-23]="",,"|n"&R1C12&RC[-23])&IF(RC[-22]="",,"|n"&R1C13&RC[-22])&IF(RC[-20]&RC[-19]&RC[-18]&RC[-17]="",,"|n"&R1C14)&IF(RC[-20]="",,"|n"&R1C15&RC[-20])&IF(RC[-19]="",,"|n"&R1C16&RC[-19])&IF(RC[-18]="",,"|n"&R1C17&RC[-18])&IF(RC[-17]="",,"|n"&R1C18&RC[-17])&IF(RC[-16]="",,"|n"&R1C19&RC[-16])&IF(RC[-15]="",,"|n"&R1C20&RC[-15])&IF(RC[-14]="",,"|n"&R1C21&RC[-14])&IF(RC[-13]="",,"|n"&R1C22&RC[-13])&IF(RC[-11]="",,"|n"&R1C24&RC[-11])&IF(RC[-10]="",,"|n"&R1C25&RC[-10])&IF(RC[-9]="",,"|n"&R1C26&RC[-9])&IF(RC[-8]="",,"|n"&R1C27&RC[-8])&IF(RC[-7]="",,"|n"&R1C28&RC[-7])&IF(RC[-6]="",,"|n"&R1C29&RC[-6])&IF(RC[-2]="",,"|n"&RC[-2]) -> 
AI288: =IF(RC[-27]&RC[-26]&RC[-25]&RC[-24]&RC[-23]&RC[-22]="",,R1C7)&IF(RC[-27]="",,"|n"&R1C8&RC[-27])&IF(RC[-26]="",,"|n"&R1C9&RC[-26])&IF(RC[-25]="",,"|n"&R1C10&RC[-25])&IF(RC[-24]="",,"|n"&R1C11&RC[-24])&IF(RC[-23]="",,"|n"&R1C12&RC[-23])&IF(RC[-22]="",,"|n"&R1C13&RC[-22])&IF(RC[-20]&RC[-19]&RC[-18]&RC[-17]="",,"|n"&R1C14)&IF(RC[-20]="",,"|n"&R1C15&RC[-20])&IF(RC[-19]="",,"|n"&R1C16&RC[-19])&IF(RC[-18]="",,"|n"&R1C17&RC[-18])&IF(RC[-17]="",,"|n"&R1C18&RC[-17])&IF(RC[-16]="",,"|n"&R1C19&RC[-16])&IF(RC[-15]="",,"|n"&R1C20&RC[-15])&IF(RC[-14]="",,"|n"&R1C21&RC[-14])&IF(RC[-13]="",,"|n"&R1C22&RC[-13])&IF(RC[-11]="",,"|n"&R1C24&RC[-11])&IF(RC[-10]="",,"|n"&R1C25&RC[-10])&IF(RC[-9]="",,"|n"&R1C26&RC[-9])&IF(RC[-8]="",,"|n"&R1C27&RC[-8])&IF(RC[-7]="",,"|n"&R1C28&RC[-7])&IF(RC[-6]="",,"|n"&R1C29&RC[-6])&IF(RC[-2]="",,"|n"&RC[-2]) -> 
AI289: =IF(RC[-27]&RC[-26]&RC[-25]&RC[-24]&RC[-23]&RC[-22]="",,R1C7)&IF(RC[-27]="",,"|n"&R1C8&RC[-27])&IF(RC[-26]="",,"|n"&R1C9&RC[-26])&IF(RC[-25]="",,"|n"&R1C10&RC[-25])&IF(RC[-24]="",,"|n"&R1C11&RC[-24])&IF(RC[-23]="",,"|n"&R1C12&RC[-23])&IF(RC[-22]="",,"|n"&R1C13&RC[-22])&IF(RC[-20]&RC[-19]&RC[-18]&RC[-17]="",,"|n"&R1C14)&IF(RC[-20]="",,"|n"&R1C15&RC[-20])&IF(RC[-19]="",,"|n"&R1C16&RC[-19])&IF(RC[-18]="",,"|n"&R1C17&RC[-18])&IF(RC[-17]="",,"|n"&R1C18&RC[-17])&IF(RC[-16]="",,"|n"&R1C19&RC[-16])&IF(RC[-15]="",,"|n"&R1C20&RC[-15])&IF(RC[-14]="",,"|n"&R1C21&RC[-14])&IF(RC[-13]="",,"|n"&R1C22&RC[-13])&IF(RC[-11]="",,"|n"&R1C24&RC[-11])&IF(RC[-10]="",,"|n"&R1C25&RC[-10])&IF(RC[-9]="",,"|n"&R1C26&RC[-9])&IF(RC[-8]="",,"|n"&R1C27&RC[-8])&IF(RC[-7]="",,"|n"&R1C28&RC[-7])&IF(RC[-6]="",,"|n"&R1C29&RC[-6])&IF(RC[-2]="",,"|n"&RC[-2]) -> 
AI290: =IF(RC[-27]&RC[-26]&RC[-25]&RC[-24]&RC[-23]&RC[-22]="",,R1C7)&IF(RC[-27]="",,"|n"&R1C8&RC[-27])&IF(RC[-26]="",,"|n"&R1C9&RC[-26])&IF(RC[-25]="",,"|n"&R1C10&RC[-25])&IF(RC[-24]="",,"|n"&R1C11&RC[-24])&IF(RC[-23]="",,"|n"&R1C12&RC[-23])&IF(RC[-22]="",,"|n"&R1C13&RC[-22])&IF(RC[-20]&RC[-19]&RC[-18]&RC[-17]="",,"|n"&R1C14)&IF(RC[-20]="",,"|n"&R1C15&RC[-20])&IF(RC[-19]="",,"|n"&R1C16&RC[-19])&IF(RC[-18]="",,"|n"&R1C17&RC[-18])&IF(RC[-17]="",,"|n"&R1C18&RC[-17])&IF(RC[-16]="",,"|n"&R1C19&RC[-16])&IF(RC[-15]="",,"|n"&R1C20&RC[-15])&IF(RC[-14]="",,"|n"&R1C21&RC[-14])&IF(RC[-13]="",,"|n"&R1C22&RC[-13])&IF(RC[-11]="",,"|n"&R1C24&RC[-11])&IF(RC[-10]="",,"|n"&R1C25&RC[-10])&IF(RC[-9]="",,"|n"&R1C26&RC[-9])&IF(RC[-8]="",,"|n"&R1C27&RC[-8])&IF(RC[-7]="",,"|n"&R1C28&RC[-7])&IF(RC[-6]="",,"|n"&R1C29&RC[-6])&IF(RC[-2]="",,"|n"&RC[-2]) -> 
AI291: =IF(RC[-27]&RC[-26]&RC[-25]&RC[-24]&RC[-23]&RC[-22]="",,R1C7)&IF(RC[-27]="",,"|n"&R1C8&RC[-27])&IF(RC[-26]="",,"|n"&R1C9&RC[-26])&IF(RC[-25]="",,"|n"&R1C10&RC[-25])&IF(RC[-24]="",,"|n"&R1C11&RC[-24])&IF(RC[-23]="",,"|n"&R1C12&RC[-23])&IF(RC[-22]="",,"|n"&R1C13&RC[-22])&IF(RC[-20]&RC[-19]&RC[-18]&RC[-17]="",,"|n"&R1C14)&IF(RC[-20]="",,"|n"&R1C15&RC[-20])&IF(RC[-19]="",,"|n"&R1C16&RC[-19])&IF(RC[-18]="",,"|n"&R1C17&RC[-18])&IF(RC[-17]="",,"|n"&R1C18&RC[-17])&IF(RC[-16]="",,"|n"&R1C19&RC[-16])&IF(RC[-15]="",,"|n"&R1C20&RC[-15])&IF(RC[-14]="",,"|n"&R1C21&RC[-14])&IF(RC[-13]="",,"|n"&R1C22&RC[-13])&IF(RC[-11]="",,"|n"&R1C24&RC[-11])&IF(RC[-10]="",,"|n"&R1C25&RC[-10])&IF(RC[-9]="",,"|n"&R1C26&RC[-9])&IF(RC[-8]="",,"|n"&R1C27&RC[-8])&IF(RC[-7]="",,"|n"&R1C28&RC[-7])&IF(RC[-6]="",,"|n"&R1C29&RC[-6])&IF(RC[-2]="",,"|n"&RC[-2]) -> 
AI292: =IF(RC[-27]&RC[-26]&RC[-25]&RC[-24]&RC[-23]&RC[-22]="",,R1C7)&IF(RC[-27]="",,"|n"&R1C8&RC[-27])&IF(RC[-26]="",,"|n"&R1C9&RC[-26])&IF(RC[-25]="",,"|n"&R1C10&RC[-25])&IF(RC[-24]="",,"|n"&R1C11&RC[-24])&IF(RC[-23]="",,"|n"&R1C12&RC[-23])&IF(RC[-22]="",,"|n"&R1C13&RC[-22])&IF(RC[-20]&RC[-19]&RC[-18]&RC[-17]="",,"|n"&R1C14)&IF(RC[-20]="",,"|n"&R1C15&RC[-20])&IF(RC[-19]="",,"|n"&R1C16&RC[-19])&IF(RC[-18]="",,"|n"&R1C17&RC[-18])&IF(RC[-17]="",,"|n"&R1C18&RC[-17])&IF(RC[-16]="",,"|n"&R1C19&RC[-16])&IF(RC[-15]="",,"|n"&R1C20&RC[-15])&IF(RC[-14]="",,"|n"&R1C21&RC[-14])&IF(RC[-13]="",,"|n"&R1C22&RC[-13])&IF(RC[-11]="",,"|n"&R1C24&RC[-11])&IF(RC[-10]="",,"|n"&R1C25&RC[-10])&IF(RC[-9]="",,"|n"&R1C26&RC[-9])&IF(RC[-8]="",,"|n"&R1C27&RC[-8])&IF(RC[-7]="",,"|n"&R1C28&RC[-7])&IF(RC[-6]="",,"|n"&R1C29&RC[-6])&IF(RC[-2]="",,"|n"&RC[-2]) -> 
AI293: =IF(RC[-27]&RC[-26]&RC[-25]&RC[-24]&RC[-23]&RC[-22]="",,R1C7)&IF(RC[-27]="",,"|n"&R1C8&RC[-27])&IF(RC[-26]="",,"|n"&R1C9&RC[-26])&IF(RC[-25]="",,"|n"&R1C10&RC[-25])&IF(RC[-24]="",,"|n"&R1C11&RC[-24])&IF(RC[-23]="",,"|n"&R1C12&RC[-23])&IF(RC[-22]="",,"|n"&R1C13&RC[-22])&IF(RC[-20]&RC[-19]&RC[-18]&RC[-17]="",,"|n"&R1C14)&IF(RC[-20]="",,"|n"&R1C15&RC[-20])&IF(RC[-19]="",,"|n"&R1C16&RC[-19])&IF(RC[-18]="",,"|n"&R1C17&RC[-18])&IF(RC[-17]="",,"|n"&R1C18&RC[-17])&IF(RC[-16]="",,"|n"&R1C19&RC[-16])&IF(RC[-15]="",,"|n"&R1C20&RC[-15])&IF(RC[-14]="",,"|n"&R1C21&RC[-14])&IF(RC[-13]="",,"|n"&R1C22&RC[-13])&IF(RC[-11]="",,"|n"&R1C24&RC[-11])&IF(RC[-10]="",,"|n"&R1C25&RC[-10])&IF(RC[-9]="",,"|n"&R1C26&RC[-9])&IF(RC[-8]="",,"|n"&R1C27&RC[-8])&IF(RC[-7]="",,"|n"&R1C28&RC[-7])&IF(RC[-6]="",,"|n"&R1C29&RC[-6])&IF(RC[-2]="",,"|n"&RC[-2]) -> 
AI294: =IF(RC[-27]&RC[-26]&RC[-25]&RC[-24]&RC[-23]&RC[-22]="",,R1C7)&IF(RC[-27]="",,"|n"&R1C8&RC[-27])&IF(RC[-26]="",,"|n"&R1C9&RC[-26])&IF(RC[-25]="",,"|n"&R1C10&RC[-25])&IF(RC[-24]="",,"|n"&R1C11&RC[-24])&IF(RC[-23]="",,"|n"&R1C12&RC[-23])&IF(RC[-22]="",,"|n"&R1C13&RC[-22])&IF(RC[-20]&RC[-19]&RC[-18]&RC[-17]="",,"|n"&R1C14)&IF(RC[-20]="",,"|n"&R1C15&RC[-20])&IF(RC[-19]="",,"|n"&R1C16&RC[-19])&IF(RC[-18]="",,"|n"&R1C17&RC[-18])&IF(RC[-17]="",,"|n"&R1C18&RC[-17])&IF(RC[-16]="",,"|n"&R1C19&RC[-16])&IF(RC[-15]="",,"|n"&R1C20&RC[-15])&IF(RC[-14]="",,"|n"&R1C21&RC[-14])&IF(RC[-13]="",,"|n"&R1C22&RC[-13])&IF(RC[-11]="",,"|n"&R1C24&RC[-11])&IF(RC[-10]="",,"|n"&R1C25&RC[-10])&IF(RC[-9]="",,"|n"&R1C26&RC[-9])&IF(RC[-8]="",,"|n"&R1C27&RC[-8])&IF(RC[-7]="",,"|n"&R1C28&RC[-7])&IF(RC[-6]="",,"|n"&R1C29&RC[-6])&IF(RC[-2]="",,"|n"&RC[-2]) -> 
AI295: =IF(RC[-27]&RC[-26]&RC[-25]&RC[-24]&RC[-23]&RC[-22]="",,R1C7)&IF(RC[-27]="",,"|n"&R1C8&RC[-27])&IF(RC[-26]="",,"|n"&R1C9&RC[-26])&IF(RC[-25]="",,"|n"&R1C10&RC[-25])&IF(RC[-24]="",,"|n"&R1C11&RC[-24])&IF(RC[-23]="",,"|n"&R1C12&RC[-23])&IF(RC[-22]="",,"|n"&R1C13&RC[-22])&IF(RC[-20]&RC[-19]&RC[-18]&RC[-17]="",,"|n"&R1C14)&IF(RC[-20]="",,"|n"&R1C15&RC[-20])&IF(RC[-19]="",,"|n"&R1C16&RC[-19])&IF(RC[-18]="",,"|n"&R1C17&RC[-18])&IF(RC[-17]="",,"|n"&R1C18&RC[-17])&IF(RC[-16]="",,"|n"&R1C19&RC[-16])&IF(RC[-15]="",,"|n"&R1C20&RC[-15])&IF(RC[-14]="",,"|n"&R1C21&RC[-14])&IF(RC[-13]="",,"|n"&R1C22&RC[-13])&IF(RC[-11]="",,"|n"&R1C24&RC[-11])&IF(RC[-10]="",,"|n"&R1C25&RC[-10])&IF(RC[-9]="",,"|n"&R1C26&RC[-9])&IF(RC[-8]="",,"|n"&R1C27&RC[-8])&IF(RC[-7]="",,"|n"&R1C28&RC[-7])&IF(RC[-6]="",,"|n"&R1C29&RC[-6])&IF(RC[-2]="",,"|n"&RC[-2]) -> 
AI296: =IF(RC[-27]&RC[-26]&RC[-25]&RC[-24]&RC[-23]&RC[-22]="",,R1C7)&IF(RC[-27]="",,"|n"&R1C8&RC[-27])&IF(RC[-26]="",,"|n"&R1C9&RC[-26])&IF(RC[-25]="",,"|n"&R1C10&RC[-25])&IF(RC[-24]="",,"|n"&R1C11&RC[-24])&IF(RC[-23]="",,"|n"&R1C12&RC[-23])&IF(RC[-22]="",,"|n"&R1C13&RC[-22])&IF(RC[-20]&RC[-19]&RC[-18]&RC[-17]="",,"|n"&R1C14)&IF(RC[-20]="",,"|n"&R1C15&RC[-20])&IF(RC[-19]="",,"|n"&R1C16&RC[-19])&IF(RC[-18]="",,"|n"&R1C17&RC[-18])&IF(RC[-17]="",,"|n"&R1C18&RC[-17])&IF(RC[-16]="",,"|n"&R1C19&RC[-16])&IF(RC[-15]="",,"|n"&R1C20&RC[-15])&IF(RC[-14]="",,"|n"&R1C21&RC[-14])&IF(RC[-13]="",,"|n"&R1C22&RC[-13])&IF(RC[-11]="",,"|n"&R1C24&RC[-11])&IF(RC[-10]="",,"|n"&R1C25&RC[-10])&IF(RC[-9]="",,"|n"&R1C26&RC[-9])&IF(RC[-8]="",,"|n"&R1C27&RC[-8])&IF(RC[-7]="",,"|n"&R1C28&RC[-7])&IF(RC[-6]="",,"|n"&R1C29&RC[-6])&IF(RC[-2]="",,"|n"&RC[-2]) -> 
AI297: =IF(RC[-27]&RC[-26]&RC[-25]&RC[-24]&RC[-23]&RC[-22]="",,R1C7)&IF(RC[-27]="",,"|n"&R1C8&RC[-27])&IF(RC[-26]="",,"|n"&R1C9&RC[-26])&IF(RC[-25]="",,"|n"&R1C10&RC[-25])&IF(RC[-24]="",,"|n"&R1C11&RC[-24])&IF(RC[-23]="",,"|n"&R1C12&RC[-23])&IF(RC[-22]="",,"|n"&R1C13&RC[-22])&IF(RC[-20]&RC[-19]&RC[-18]&RC[-17]="",,"|n"&R1C14)&IF(RC[-20]="",,"|n"&R1C15&RC[-20])&IF(RC[-19]="",,"|n"&R1C16&RC[-19])&IF(RC[-18]="",,"|n"&R1C17&RC[-18])&IF(RC[-17]="",,"|n"&R1C18&RC[-17])&IF(RC[-16]="",,"|n"&R1C19&RC[-16])&IF(RC[-15]="",,"|n"&R1C20&RC[-15])&IF(RC[-14]="",,"|n"&R1C21&RC[-14])&IF(RC[-13]="",,"|n"&R1C22&RC[-13])&IF(RC[-11]="",,"|n"&R1C24&RC[-11])&IF(RC[-10]="",,"|n"&R1C25&RC[-10])&IF(RC[-9]="",,"|n"&R1C26&RC[-9])&IF(RC[-8]="",,"|n"&R1C27&RC[-8])&IF(RC[-7]="",,"|n"&R1C28&RC[-7])&IF(RC[-6]="",,"|n"&R1C29&RC[-6])&IF(RC[-2]="",,"|n"&RC[-2]) -> 
AI298: =IF(RC[-27]&RC[-26]&RC[-25]&RC[-24]&RC[-23]&RC[-22]="",,R1C7)&IF(RC[-27]="",,"|n"&R1C8&RC[-27])&IF(RC[-26]="",,"|n"&R1C9&RC[-26])&IF(RC[-25]="",,"|n"&R1C10&RC[-25])&IF(RC[-24]="",,"|n"&R1C11&RC[-24])&IF(RC[-23]="",,"|n"&R1C12&RC[-23])&IF(RC[-22]="",,"|n"&R1C13&RC[-22])&IF(RC[-20]&RC[-19]&RC[-18]&RC[-17]="",,"|n"&R1C14)&IF(RC[-20]="",,"|n"&R1C15&RC[-20])&IF(RC[-19]="",,"|n"&R1C16&RC[-19])&IF(RC[-18]="",,"|n"&R1C17&RC[-18])&IF(RC[-17]="",,"|n"&R1C18&RC[-17])&IF(RC[-16]="",,"|n"&R1C19&RC[-16])&IF(RC[-15]="",,"|n"&R1C20&RC[-15])&IF(RC[-14]="",,"|n"&R1C21&RC[-14])&IF(RC[-13]="",,"|n"&R1C22&RC[-13])&IF(RC[-11]="",,"|n"&R1C24&RC[-11])&IF(RC[-10]="",,"|n"&R1C25&RC[-10])&IF(RC[-9]="",,"|n"&R1C26&RC[-9])&IF(RC[-8]="",,"|n"&R1C27&RC[-8])&IF(RC[-7]="",,"|n"&R1C28&RC[-7])&IF(RC[-6]="",,"|n"&R1C29&RC[-6])&IF(RC[-2]="",,"|n"&RC[-2]) -> 
AI299: =IF(RC[-27]&RC[-26]&RC[-25]&RC[-24]&RC[-23]&RC[-22]="",,R1C7)&IF(RC[-27]="",,"|n"&R1C8&RC[-27])&IF(RC[-26]="",,"|n"&R1C9&RC[-26])&IF(RC[-25]="",,"|n"&R1C10&RC[-25])&IF(RC[-24]="",,"|n"&R1C11&RC[-24])&IF(RC[-23]="",,"|n"&R1C12&RC[-23])&IF(RC[-22]="",,"|n"&R1C13&RC[-22])&IF(RC[-20]&RC[-19]&RC[-18]&RC[-17]="",,"|n"&R1C14)&IF(RC[-20]="",,"|n"&R1C15&RC[-20])&IF(RC[-19]="",,"|n"&R1C16&RC[-19])&IF(RC[-18]="",,"|n"&R1C17&RC[-18])&IF(RC[-17]="",,"|n"&R1C18&RC[-17])&IF(RC[-16]="",,"|n"&R1C19&RC[-16])&IF(RC[-15]="",,"|n"&R1C20&RC[-15])&IF(RC[-14]="",,"|n"&R1C21&RC[-14])&IF(RC[-13]="",,"|n"&R1C22&RC[-13])&IF(RC[-11]="",,"|n"&R1C24&RC[-11])&IF(RC[-10]="",,"|n"&R1C25&RC[-10])&IF(RC[-9]="",,"|n"&R1C26&RC[-9])&IF(RC[-8]="",,"|n"&R1C27&RC[-8])&IF(RC[-7]="",,"|n"&R1C28&RC[-7])&IF(RC[-6]="",,"|n"&R1C29&RC[-6])&IF(RC[-2]="",,"|n"&RC[-2]) -> 
AI300: =IF(RC[-27]&RC[-26]&RC[-25]&RC[-24]&RC[-23]&RC[-22]="",,R1C7)&IF(RC[-27]="",,"|n"&R1C8&RC[-27])&IF(RC[-26]="",,"|n"&R1C9&RC[-26])&IF(RC[-25]="",,"|n"&R1C10&RC[-25])&IF(RC[-24]="",,"|n"&R1C11&RC[-24])&IF(RC[-23]="",,"|n"&R1C12&RC[-23])&IF(RC[-22]="",,"|n"&R1C13&RC[-22])&IF(RC[-20]&RC[-19]&RC[-18]&RC[-17]="",,"|n"&R1C14)&IF(RC[-20]="",,"|n"&R1C15&RC[-20])&IF(RC[-19]="",,"|n"&R1C16&RC[-19])&IF(RC[-18]="",,"|n"&R1C17&RC[-18])&IF(RC[-17]="",,"|n"&R1C18&RC[-17])&IF(RC[-16]="",,"|n"&R1C19&RC[-16])&IF(RC[-15]="",,"|n"&R1C20&RC[-15])&IF(RC[-14]="",,"|n"&R1C21&RC[-14])&IF(RC[-13]="",,"|n"&R1C22&RC[-13])&IF(RC[-11]="",,"|n"&R1C24&RC[-11])&IF(RC[-10]="",,"|n"&R1C25&RC[-10])&IF(RC[-9]="",,"|n"&R1C26&RC[-9])&IF(RC[-8]="",,"|n"&R1C27&RC[-8])&IF(RC[-7]="",,"|n"&R1C28&RC[-7])&IF(RC[-6]="",,"|n"&R1C29&RC[-6])&IF(RC[-2]="",,"|n"&RC[-2]) -> 
AI301: =IF(RC[-27]&RC[-26]&RC[-25]&RC[-24]&RC[-23]&RC[-22]="",,R1C7)&IF(RC[-27]="",,"|n"&R1C8&RC[-27])&IF(RC[-26]="",,"|n"&R1C9&RC[-26])&IF(RC[-25]="",,"|n"&R1C10&RC[-25])&IF(RC[-24]="",,"|n"&R1C11&RC[-24])&IF(RC[-23]="",,"|n"&R1C12&RC[-23])&IF(RC[-22]="",,"|n"&R1C13&RC[-22])&IF(RC[-20]&RC[-19]&RC[-18]&RC[-17]="",,"|n"&R1C14)&IF(RC[-20]="",,"|n"&R1C15&RC[-20])&IF(RC[-19]="",,"|n"&R1C16&RC[-19])&IF(RC[-18]="",,"|n"&R1C17&RC[-18])&IF(RC[-17]="",,"|n"&R1C18&RC[-17])&IF(RC[-16]="",,"|n"&R1C19&RC[-16])&IF(RC[-15]="",,"|n"&R1C20&RC[-15])&IF(RC[-14]="",,"|n"&R1C21&RC[-14])&IF(RC[-13]="",,"|n"&R1C22&RC[-13])&IF(RC[-11]="",,"|n"&R1C24&RC[-11])&IF(RC[-10]="",,"|n"&R1C25&RC[-10])&IF(RC[-9]="",,"|n"&R1C26&RC[-9])&IF(RC[-8]="",,"|n"&R1C27&RC[-8])&IF(RC[-7]="",,"|n"&R1C28&RC[-7])&IF(RC[-6]="",,"|n"&R1C29&RC[-6])&IF(RC[-2]="",,"|n"&RC[-2]) -> 
AI302: =IF(RC[-27]&RC[-26]&RC[-25]&RC[-24]&RC[-23]&RC[-22]="",,R1C7)&IF(RC[-27]="",,"|n"&R1C8&RC[-27])&IF(RC[-26]="",,"|n"&R1C9&RC[-26])&IF(RC[-25]="",,"|n"&R1C10&RC[-25])&IF(RC[-24]="",,"|n"&R1C11&RC[-24])&IF(RC[-23]="",,"|n"&R1C12&RC[-23])&IF(RC[-22]="",,"|n"&R1C13&RC[-22])&IF(RC[-20]&RC[-19]&RC[-18]&RC[-17]="",,"|n"&R1C14)&IF(RC[-20]="",,"|n"&R1C15&RC[-20])&IF(RC[-19]="",,"|n"&R1C16&RC[-19])&IF(RC[-18]="",,"|n"&R1C17&RC[-18])&IF(RC[-17]="",,"|n"&R1C18&RC[-17])&IF(RC[-16]="",,"|n"&R1C19&RC[-16])&IF(RC[-15]="",,"|n"&R1C20&RC[-15])&IF(RC[-14]="",,"|n"&R1C21&RC[-14])&IF(RC[-13]="",,"|n"&R1C22&RC[-13])&IF(RC[-11]="",,"|n"&R1C24&RC[-11])&IF(RC[-10]="",,"|n"&R1C25&RC[-10])&IF(RC[-9]="",,"|n"&R1C26&RC[-9])&IF(RC[-8]="",,"|n"&R1C27&RC[-8])&IF(RC[-7]="",,"|n"&R1C28&RC[-7])&IF(RC[-6]="",,"|n"&R1C29&RC[-6])&IF(RC[-2]="",,"|n"&RC[-2]) -> 
AI303: =IF(RC[-27]&RC[-26]&RC[-25]&RC[-24]&RC[-23]&RC[-22]="",,R1C7)&IF(RC[-27]="",,"|n"&R1C8&RC[-27])&IF(RC[-26]="",,"|n"&R1C9&RC[-26])&IF(RC[-25]="",,"|n"&R1C10&RC[-25])&IF(RC[-24]="",,"|n"&R1C11&RC[-24])&IF(RC[-23]="",,"|n"&R1C12&RC[-23])&IF(RC[-22]="",,"|n"&R1C13&RC[-22])&IF(RC[-20]&RC[-19]&RC[-18]&RC[-17]="",,"|n"&R1C14)&IF(RC[-20]="",,"|n"&R1C15&RC[-20])&IF(RC[-19]="",,"|n"&R1C16&RC[-19])&IF(RC[-18]="",,"|n"&R1C17&RC[-18])&IF(RC[-17]="",,"|n"&R1C18&RC[-17])&IF(RC[-16]="",,"|n"&R1C19&RC[-16])&IF(RC[-15]="",,"|n"&R1C20&RC[-15])&IF(RC[-14]="",,"|n"&R1C21&RC[-14])&IF(RC[-13]="",,"|n"&R1C22&RC[-13])&IF(RC[-11]="",,"|n"&R1C24&RC[-11])&IF(RC[-10]="",,"|n"&R1C25&RC[-10])&IF(RC[-9]="",,"|n"&R1C26&RC[-9])&IF(RC[-8]="",,"|n"&R1C27&RC[-8])&IF(RC[-7]="",,"|n"&R1C28&RC[-7])&IF(RC[-6]="",,"|n"&R1C29&RC[-6])&IF(RC[-2]="",,"|n"&RC[-2]) -> 
AI304: =IF(RC[-27]&RC[-26]&RC[-25]&RC[-24]&RC[-23]&RC[-22]="",,R1C7)&IF(RC[-27]="",,"|n"&R1C8&RC[-27])&IF(RC[-26]="",,"|n"&R1C9&RC[-26])&IF(RC[-25]="",,"|n"&R1C10&RC[-25])&IF(RC[-24]="",,"|n"&R1C11&RC[-24])&IF(RC[-23]="",,"|n"&R1C12&RC[-23])&IF(RC[-22]="",,"|n"&R1C13&RC[-22])&IF(RC[-20]&RC[-19]&RC[-18]&RC[-17]="",,"|n"&R1C14)&IF(RC[-20]="",,"|n"&R1C15&RC[-20])&IF(RC[-19]="",,"|n"&R1C16&RC[-19])&IF(RC[-18]="",,"|n"&R1C17&RC[-18])&IF(RC[-17]="",,"|n"&R1C18&RC[-17])&IF(RC[-16]="",,"|n"&R1C19&RC[-16])&IF(RC[-15]="",,"|n"&R1C20&RC[-15])&IF(RC[-14]="",,"|n"&R1C21&RC[-14])&IF(RC[-13]="",,"|n"&R1C22&RC[-13])&IF(RC[-11]="",,"|n"&R1C24&RC[-11])&IF(RC[-10]="",,"|n"&R1C25&RC[-10])&IF(RC[-9]="",,"|n"&R1C26&RC[-9])&IF(RC[-8]="",,"|n"&R1C27&RC[-8])&IF(RC[-7]="",,"|n"&R1C28&RC[-7])&IF(RC[-6]="",,"|n"&R1C29&RC[-6])&IF(RC[-2]="",,"|n"&RC[-2]) -> 
AI305: =IF(RC[-27]&RC[-26]&RC[-25]&RC[-24]&RC[-23]&RC[-22]="",,R1C7)&IF(RC[-27]="",,"|n"&R1C8&RC[-27])&IF(RC[-26]="",,"|n"&R1C9&RC[-26])&IF(RC[-25]="",,"|n"&R1C10&RC[-25])&IF(RC[-24]="",,"|n"&R1C11&RC[-24])&IF(RC[-23]="",,"|n"&R1C12&RC[-23])&IF(RC[-22]="",,"|n"&R1C13&RC[-22])&IF(RC[-20]&RC[-19]&RC[-18]&RC[-17]="",,"|n"&R1C14)&IF(RC[-20]="",,"|n"&R1C15&RC[-20])&IF(RC[-19]="",,"|n"&R1C16&RC[-19])&IF(RC[-18]="",,"|n"&R1C17&RC[-18])&IF(RC[-17]="",,"|n"&R1C18&RC[-17])&IF(RC[-16]="",,"|n"&R1C19&RC[-16])&IF(RC[-15]="",,"|n"&R1C20&RC[-15])&IF(RC[-14]="",,"|n"&R1C21&RC[-14])&IF(RC[-13]="",,"|n"&R1C22&RC[-13])&IF(RC[-11]="",,"|n"&R1C24&RC[-11])&IF(RC[-10]="",,"|n"&R1C25&RC[-10])&IF(RC[-9]="",,"|n"&R1C26&RC[-9])&IF(RC[-8]="",,"|n"&R1C27&RC[-8])&IF(RC[-7]="",,"|n"&R1C28&RC[-7])&IF(RC[-6]="",,"|n"&R1C29&RC[-6])&IF(RC[-2]="",,"|n"&RC[-2]) -> 
AI306: =IF(RC[-27]&RC[-26]&RC[-25]&RC[-24]&RC[-23]&RC[-22]="",,R1C7)&IF(RC[-27]="",,"|n"&R1C8&RC[-27])&IF(RC[-26]="",,"|n"&R1C9&RC[-26])&IF(RC[-25]="",,"|n"&R1C10&RC[-25])&IF(RC[-24]="",,"|n"&R1C11&RC[-24])&IF(RC[-23]="",,"|n"&R1C12&RC[-23])&IF(RC[-22]="",,"|n"&R1C13&RC[-22])&IF(RC[-20]&RC[-19]&RC[-18]&RC[-17]="",,"|n"&R1C14)&IF(RC[-20]="",,"|n"&R1C15&RC[-20])&IF(RC[-19]="",,"|n"&R1C16&RC[-19])&IF(RC[-18]="",,"|n"&R1C17&RC[-18])&IF(RC[-17]="",,"|n"&R1C18&RC[-17])&IF(RC[-16]="",,"|n"&R1C19&RC[-16])&IF(RC[-15]="",,"|n"&R1C20&RC[-15])&IF(RC[-14]="",,"|n"&R1C21&RC[-14])&IF(RC[-13]="",,"|n"&R1C22&RC[-13])&IF(RC[-11]="",,"|n"&R1C24&RC[-11])&IF(RC[-10]="",,"|n"&R1C25&RC[-10])&IF(RC[-9]="",,"|n"&R1C26&RC[-9])&IF(RC[-8]="",,"|n"&R1C27&RC[-8])&IF(RC[-7]="",,"|n"&R1C28&RC[-7])&IF(RC[-6]="",,"|n"&R1C29&RC[-6])&IF(RC[-2]="",,"|n"&RC[-2]) -> 
AI307: =IF(RC[-27]&RC[-26]&RC[-25]&RC[-24]&RC[-23]&RC[-22]="",,R1C7)&IF(RC[-27]="",,"|n"&R1C8&RC[-27])&IF(RC[-26]="",,"|n"&R1C9&RC[-26])&IF(RC[-25]="",,"|n"&R1C10&RC[-25])&IF(RC[-24]="",,"|n"&R1C11&RC[-24])&IF(RC[-23]="",,"|n"&R1C12&RC[-23])&IF(RC[-22]="",,"|n"&R1C13&RC[-22])&IF(RC[-20]&RC[-19]&RC[-18]&RC[-17]="",,"|n"&R1C14)&IF(RC[-20]="",,"|n"&R1C15&RC[-20])&IF(RC[-19]="",,"|n"&R1C16&RC[-19])&IF(RC[-18]="",,"|n"&R1C17&RC[-18])&IF(RC[-17]="",,"|n"&R1C18&RC[-17])&IF(RC[-16]="",,"|n"&R1C19&RC[-16])&IF(RC[-15]="",,"|n"&R1C20&RC[-15])&IF(RC[-14]="",,"|n"&R1C21&RC[-14])&IF(RC[-13]="",,"|n"&R1C22&RC[-13])&IF(RC[-11]="",,"|n"&R1C24&RC[-11])&IF(RC[-10]="",,"|n"&R1C25&RC[-10])&IF(RC[-9]="",,"|n"&R1C26&RC[-9])&IF(RC[-8]="",,"|n"&R1C27&RC[-8])&IF(RC[-7]="",,"|n"&R1C28&RC[-7])&IF(RC[-6]="",,"|n"&R1C29&RC[-6])&IF(RC[-2]="",,"|n"&RC[-2]) -> 
AI308: =IF(RC[-27]&RC[-26]&RC[-25]&RC[-24]&RC[-23]&RC[-22]="",,R1C7)&IF(RC[-27]="",,"|n"&R1C8&RC[-27])&IF(RC[-26]="",,"|n"&R1C9&RC[-26])&IF(RC[-25]="",,"|n"&R1C10&RC[-25])&IF(RC[-24]="",,"|n"&R1C11&RC[-24])&IF(RC[-23]="",,"|n"&R1C12&RC[-23])&IF(RC[-22]="",,"|n"&R1C13&RC[-22])&IF(RC[-20]&RC[-19]&RC[-18]&RC[-17]="",,"|n"&R1C14)&IF(RC[-20]="",,"|n"&R1C15&RC[-20])&IF(RC[-19]="",,"|n"&R1C16&RC[-19])&IF(RC[-18]="",,"|n"&R1C17&RC[-18])&IF(RC[-17]="",,"|n"&R1C18&RC[-17])&IF(RC[-16]="",,"|n"&R1C19&RC[-16])&IF(RC[-15]="",,"|n"&R1C20&RC[-15])&IF(RC[-14]="",,"|n"&R1C21&RC[-14])&IF(RC[-13]="",,"|n"&R1C22&RC[-13])&IF(RC[-11]="",,"|n"&R1C24&RC[-11])&IF(RC[-10]="",,"|n"&R1C25&RC[-10])&IF(RC[-9]="",,"|n"&R1C26&RC[-9])&IF(RC[-8]="",,"|n"&R1C27&RC[-8])&IF(RC[-7]="",,"|n"&R1C28&RC[-7])&IF(RC[-6]="",,"|n"&R1C29&RC[-6])&IF(RC[-2]="",,"|n"&RC[-2]) -> 
AI309: =IF(RC[-27]&RC[-26]&RC[-25]&RC[-24]&RC[-23]&RC[-22]="",,R1C7)&IF(RC[-27]="",,"|n"&R1C8&RC[-27])&IF(RC[-26]="",,"|n"&R1C9&RC[-26])&IF(RC[-25]="",,"|n"&R1C10&RC[-25])&IF(RC[-24]="",,"|n"&R1C11&RC[-24])&IF(RC[-23]="",,"|n"&R1C12&RC[-23])&IF(RC[-22]="",,"|n"&R1C13&RC[-22])&IF(RC[-20]&RC[-19]&RC[-18]&RC[-17]="",,"|n"&R1C14)&IF(RC[-20]="",,"|n"&R1C15&RC[-20])&IF(RC[-19]="",,"|n"&R1C16&RC[-19])&IF(RC[-18]="",,"|n"&R1C17&RC[-18])&IF(RC[-17]="",,"|n"&R1C18&RC[-17])&IF(RC[-16]="",,"|n"&R1C19&RC[-16])&IF(RC[-15]="",,"|n"&R1C20&RC[-15])&IF(RC[-14]="",,"|n"&R1C21&RC[-14])&IF(RC[-13]="",,"|n"&R1C22&RC[-13])&IF(RC[-11]="",,"|n"&R1C24&RC[-11])&IF(RC[-10]="",,"|n"&R1C25&RC[-10])&IF(RC[-9]="",,"|n"&R1C26&RC[-9])&IF(RC[-8]="",,"|n"&R1C27&RC[-8])&IF(RC[-7]="",,"|n"&R1C28&RC[-7])&IF(RC[-6]="",,"|n"&R1C29&RC[-6])&IF(RC[-2]="",,"|n"&RC[-2]) -> 
AI310: =IF(RC[-27]&RC[-26]&RC[-25]&RC[-24]&RC[-23]&RC[-22]="",,R1C7)&IF(RC[-27]="",,"|n"&R1C8&RC[-27])&IF(RC[-26]="",,"|n"&R1C9&RC[-26])&IF(RC[-25]="",,"|n"&R1C10&RC[-25])&IF(RC[-24]="",,"|n"&R1C11&RC[-24])&IF(RC[-23]="",,"|n"&R1C12&RC[-23])&IF(RC[-22]="",,"|n"&R1C13&RC[-22])&IF(RC[-20]&RC[-19]&RC[-18]&RC[-17]="",,"|n"&R1C14)&IF(RC[-20]="",,"|n"&R1C15&RC[-20])&IF(RC[-19]="",,"|n"&R1C16&RC[-19])&IF(RC[-18]="",,"|n"&R1C17&RC[-18])&IF(RC[-17]="",,"|n"&R1C18&RC[-17])&IF(RC[-16]="",,"|n"&R1C19&RC[-16])&IF(RC[-15]="",,"|n"&R1C20&RC[-15])&IF(RC[-14]="",,"|n"&R1C21&RC[-14])&IF(RC[-13]="",,"|n"&R1C22&RC[-13])&IF(RC[-11]="",,"|n"&R1C24&RC[-11])&IF(RC[-10]="",,"|n"&R1C25&RC[-10])&IF(RC[-9]="",,"|n"&R1C26&RC[-9])&IF(RC[-8]="",,"|n"&R1C27&RC[-8])&IF(RC[-7]="",,"|n"&R1C28&RC[-7])&IF(RC[-6]="",,"|n"&R1C29&RC[-6])&IF(RC[-2]="",,"|n"&RC[-2]) -> 
AI311: =IF(RC[-27]&RC[-26]&RC[-25]&RC[-24]&RC[-23]&RC[-22]="",,R1C7)&IF(RC[-27]="",,"|n"&R1C8&RC[-27])&IF(RC[-26]="",,"|n"&R1C9&RC[-26])&IF(RC[-25]="",,"|n"&R1C10&RC[-25])&IF(RC[-24]="",,"|n"&R1C11&RC[-24])&IF(RC[-23]="",,"|n"&R1C12&RC[-23])&IF(RC[-22]="",,"|n"&R1C13&RC[-22])&IF(RC[-20]&RC[-19]&RC[-18]&RC[-17]="",,"|n"&R1C14)&IF(RC[-20]="",,"|n"&R1C15&RC[-20])&IF(RC[-19]="",,"|n"&R1C16&RC[-19])&IF(RC[-18]="",,"|n"&R1C17&RC[-18])&IF(RC[-17]="",,"|n"&R1C18&RC[-17])&IF(RC[-16]="",,"|n"&R1C19&RC[-16])&IF(RC[-15]="",,"|n"&R1C20&RC[-15])&IF(RC[-14]="",,"|n"&R1C21&RC[-14])&IF(RC[-13]="",,"|n"&R1C22&RC[-13])&IF(RC[-11]="",,"|n"&R1C24&RC[-11])&IF(RC[-10]="",,"|n"&R1C25&RC[-10])&IF(RC[-9]="",,"|n"&R1C26&RC[-9])&IF(RC[-8]="",,"|n"&R1C27&RC[-8])&IF(RC[-7]="",,"|n"&R1C28&RC[-7])&IF(RC[-6]="",,"|n"&R1C29&RC[-6])&IF(RC[-2]="",,"|n"&RC[-2]) -> 
AI312: =IF(RC[-27]&RC[-26]&RC[-25]&RC[-24]&RC[-23]&RC[-22]="",,R1C7)&IF(RC[-27]="",,"|n"&R1C8&RC[-27])&IF(RC[-26]="",,"|n"&R1C9&RC[-26])&IF(RC[-25]="",,"|n"&R1C10&RC[-25])&IF(RC[-24]="",,"|n"&R1C11&RC[-24])&IF(RC[-23]="",,"|n"&R1C12&RC[-23])&IF(RC[-22]="",,"|n"&R1C13&RC[-22])&IF(RC[-20]&RC[-19]&RC[-18]&RC[-17]="",,"|n"&R1C14)&IF(RC[-20]="",,"|n"&R1C15&RC[-20])&IF(RC[-19]="",,"|n"&R1C16&RC[-19])&IF(RC[-18]="",,"|n"&R1C17&RC[-18])&IF(RC[-17]="",,"|n"&R1C18&RC[-17])&IF(RC[-16]="",,"|n"&R1C19&RC[-16])&IF(RC[-15]="",,"|n"&R1C20&RC[-15])&IF(RC[-14]="",,"|n"&R1C21&RC[-14])&IF(RC[-13]="",,"|n"&R1C22&RC[-13])&IF(RC[-11]="",,"|n"&R1C24&RC[-11])&IF(RC[-10]="",,"|n"&R1C25&RC[-10])&IF(RC[-9]="",,"|n"&R1C26&RC[-9])&IF(RC[-8]="",,"|n"&R1C27&RC[-8])&IF(RC[-7]="",,"|n"&R1C28&RC[-7])&IF(RC[-6]="",,"|n"&R1C29&RC[-6])&IF(RC[-2]="",,"|n"&RC[-2]) -> 
AI313: =IF(RC[-27]&RC[-26]&RC[-25]&RC[-24]&RC[-23]&RC[-22]="",,R1C7)&IF(RC[-27]="",,"|n"&R1C8&RC[-27])&IF(RC[-26]="",,"|n"&R1C9&RC[-26])&IF(RC[-25]="",,"|n"&R1C10&RC[-25])&IF(RC[-24]="",,"|n"&R1C11&RC[-24])&IF(RC[-23]="",,"|n"&R1C12&RC[-23])&IF(RC[-22]="",,"|n"&R1C13&RC[-22])&IF(RC[-20]&RC[-19]&RC[-18]&RC[-17]="",,"|n"&R1C14)&IF(RC[-20]="",,"|n"&R1C15&RC[-20])&IF(RC[-19]="",,"|n"&R1C16&RC[-19])&IF(RC[-18]="",,"|n"&R1C17&RC[-18])&IF(RC[-17]="",,"|n"&R1C18&RC[-17])&IF(RC[-16]="",,"|n"&R1C19&RC[-16])&IF(RC[-15]="",,"|n"&R1C20&RC[-15])&IF(RC[-14]="",,"|n"&R1C21&RC[-14])&IF(RC[-13]="",,"|n"&R1C22&RC[-13])&IF(RC[-11]="",,"|n"&R1C24&RC[-11])&IF(RC[-10]="",,"|n"&R1C25&RC[-10])&IF(RC[-9]="",,"|n"&R1C26&RC[-9])&IF(RC[-8]="",,"|n"&R1C27&RC[-8])&IF(RC[-7]="",,"|n"&R1C28&RC[-7])&IF(RC[-6]="",,"|n"&R1C29&RC[-6])&IF(RC[-2]="",,"|n"&RC[-2]) -> 
AI314: =IF(RC[-27]&RC[-26]&RC[-25]&RC[-24]&RC[-23]&RC[-22]="",,R1C7)&IF(RC[-27]="",,"|n"&R1C8&RC[-27])&IF(RC[-26]="",,"|n"&R1C9&RC[-26])&IF(RC[-25]="",,"|n"&R1C10&RC[-25])&IF(RC[-24]="",,"|n"&R1C11&RC[-24])&IF(RC[-23]="",,"|n"&R1C12&RC[-23])&IF(RC[-22]="",,"|n"&R1C13&RC[-22])&IF(RC[-20]&RC[-19]&RC[-18]&RC[-17]="",,"|n"&R1C14)&IF(RC[-20]="",,"|n"&R1C15&RC[-20])&IF(RC[-19]="",,"|n"&R1C16&RC[-19])&IF(RC[-18]="",,"|n"&R1C17&RC[-18])&IF(RC[-17]="",,"|n"&R1C18&RC[-17])&IF(RC[-16]="",,"|n"&R1C19&RC[-16])&IF(RC[-15]="",,"|n"&R1C20&RC[-15])&IF(RC[-14]="",,"|n"&R1C21&RC[-14])&IF(RC[-13]="",,"|n"&R1C22&RC[-13])&IF(RC[-11]="",,"|n"&R1C24&RC[-11])&IF(RC[-10]="",,"|n"&R1C25&RC[-10])&IF(RC[-9]="",,"|n"&R1C26&RC[-9])&IF(RC[-8]="",,"|n"&R1C27&RC[-8])&IF(RC[-7]="",,"|n"&R1C28&RC[-7])&IF(RC[-6]="",,"|n"&R1C29&RC[-6])&IF(RC[-2]="",,"|n"&RC[-2]) -> 
AI315: =IF(RC[-27]&RC[-26]&RC[-25]&RC[-24]&RC[-23]&RC[-22]="",,R1C7)&IF(RC[-27]="",,"|n"&R1C8&RC[-27])&IF(RC[-26]="",,"|n"&R1C9&RC[-26])&IF(RC[-25]="",,"|n"&R1C10&RC[-25])&IF(RC[-24]="",,"|n"&R1C11&RC[-24])&IF(RC[-23]="",,"|n"&R1C12&RC[-23])&IF(RC[-22]="",,"|n"&R1C13&RC[-22])&IF(RC[-20]&RC[-19]&RC[-18]&RC[-17]="",,"|n"&R1C14)&IF(RC[-20]="",,"|n"&R1C15&RC[-20])&IF(RC[-19]="",,"|n"&R1C16&RC[-19])&IF(RC[-18]="",,"|n"&R1C17&RC[-18])&IF(RC[-17]="",,"|n"&R1C18&RC[-17])&IF(RC[-16]="",,"|n"&R1C19&RC[-16])&IF(RC[-15]="",,"|n"&R1C20&RC[-15])&IF(RC[-14]="",,"|n"&R1C21&RC[-14])&IF(RC[-13]="",,"|n"&R1C22&RC[-13])&IF(RC[-11]="",,"|n"&R1C24&RC[-11])&IF(RC[-10]="",,"|n"&R1C25&RC[-10])&IF(RC[-9]="",,"|n"&R1C26&RC[-9])&IF(RC[-8]="",,"|n"&R1C27&RC[-8])&IF(RC[-7]="",,"|n"&R1C28&RC[-7])&IF(RC[-6]="",,"|n"&R1C29&RC[-6])&IF(RC[-2]="",,"|n"&RC[-2]) -> 
AI316: =IF(RC[-27]&RC[-26]&RC[-25]&RC[-24]&RC[-23]&RC[-22]="",,R1C7)&IF(RC[-27]="",,"|n"&R1C8&RC[-27])&IF(RC[-26]="",,"|n"&R1C9&RC[-26])&IF(RC[-25]="",,"|n"&R1C10&RC[-25])&IF(RC[-24]="",,"|n"&R1C11&RC[-24])&IF(RC[-23]="",,"|n"&R1C12&RC[-23])&IF(RC[-22]="",,"|n"&R1C13&RC[-22])&IF(RC[-20]&RC[-19]&RC[-18]&RC[-17]="",,"|n"&R1C14)&IF(RC[-20]="",,"|n"&R1C15&RC[-20])&IF(RC[-19]="",,"|n"&R1C16&RC[-19])&IF(RC[-18]="",,"|n"&R1C17&RC[-18])&IF(RC[-17]="",,"|n"&R1C18&RC[-17])&IF(RC[-16]="",,"|n"&R1C19&RC[-16])&IF(RC[-15]="",,"|n"&R1C20&RC[-15])&IF(RC[-14]="",,"|n"&R1C21&RC[-14])&IF(RC[-13]="",,"|n"&R1C22&RC[-13])&IF(RC[-11]="",,"|n"&R1C24&RC[-11])&IF(RC[-10]="",,"|n"&R1C25&RC[-10])&IF(RC[-9]="",,"|n"&R1C26&RC[-9])&IF(RC[-8]="",,"|n"&R1C27&RC[-8])&IF(RC[-7]="",,"|n"&R1C28&RC[-7])&IF(RC[-6]="",,"|n"&R1C29&RC[-6])&IF(RC[-2]="",,"|n"&RC[-2]) -> 
AI317: =IF(RC[-27]&RC[-26]&RC[-25]&RC[-24]&RC[-23]&RC[-22]="",,R1C7)&IF(RC[-27]="",,"|n"&R1C8&RC[-27])&IF(RC[-26]="",,"|n"&R1C9&RC[-26])&IF(RC[-25]="",,"|n"&R1C10&RC[-25])&IF(RC[-24]="",,"|n"&R1C11&RC[-24])&IF(RC[-23]="",,"|n"&R1C12&RC[-23])&IF(RC[-22]="",,"|n"&R1C13&RC[-22])&IF(RC[-20]&RC[-19]&RC[-18]&RC[-17]="",,"|n"&R1C14)&IF(RC[-20]="",,"|n"&R1C15&RC[-20])&IF(RC[-19]="",,"|n"&R1C16&RC[-19])&IF(RC[-18]="",,"|n"&R1C17&RC[-18])&IF(RC[-17]="",,"|n"&R1C18&RC[-17])&IF(RC[-16]="",,"|n"&R1C19&RC[-16])&IF(RC[-15]="",,"|n"&R1C20&RC[-15])&IF(RC[-14]="",,"|n"&R1C21&RC[-14])&IF(RC[-13]="",,"|n"&R1C22&RC[-13])&IF(RC[-11]="",,"|n"&R1C24&RC[-11])&IF(RC[-10]="",,"|n"&R1C25&RC[-10])&IF(RC[-9]="",,"|n"&R1C26&RC[-9])&IF(RC[-8]="",,"|n"&R1C27&RC[-8])&IF(RC[-7]="",,"|n"&R1C28&RC[-7])&IF(RC[-6]="",,"|n"&R1C29&RC[-6])&IF(RC[-2]="",,"|n"&RC[-2]) -> 
AI318: =IF(RC[-27]&RC[-26]&RC[-25]&RC[-24]&RC[-23]&RC[-22]="",,R1C7)&IF(RC[-27]="",,"|n"&R1C8&RC[-27])&IF(RC[-26]="",,"|n"&R1C9&RC[-26])&IF(RC[-25]="",,"|n"&R1C10&RC[-25])&IF(RC[-24]="",,"|n"&R1C11&RC[-24])&IF(RC[-23]="",,"|n"&R1C12&RC[-23])&IF(RC[-22]="",,"|n"&R1C13&RC[-22])&IF(RC[-20]&RC[-19]&RC[-18]&RC[-17]="",,"|n"&R1C14)&IF(RC[-20]="",,"|n"&R1C15&RC[-20])&IF(RC[-19]="",,"|n"&R1C16&RC[-19])&IF(RC[-18]="",,"|n"&R1C17&RC[-18])&IF(RC[-17]="",,"|n"&R1C18&RC[-17])&IF(RC[-16]="",,"|n"&R1C19&RC[-16])&IF(RC[-15]="",,"|n"&R1C20&RC[-15])&IF(RC[-14]="",,"|n"&R1C21&RC[-14])&IF(RC[-13]="",,"|n"&R1C22&RC[-13])&IF(RC[-11]="",,"|n"&R1C24&RC[-11])&IF(RC[-10]="",,"|n"&R1C25&RC[-10])&IF(RC[-9]="",,"|n"&R1C26&RC[-9])&IF(RC[-8]="",,"|n"&R1C27&RC[-8])&IF(RC[-7]="",,"|n"&R1C28&RC[-7])&IF(RC[-6]="",,"|n"&R1C29&RC[-6])&IF(RC[-2]="",,"|n"&RC[-2]) -> 
AI319: =IF(RC[-27]&RC[-26]&RC[-25]&RC[-24]&RC[-23]&RC[-22]="",,R1C7)&IF(RC[-27]="",,"|n"&R1C8&RC[-27])&IF(RC[-26]="",,"|n"&R1C9&RC[-26])&IF(RC[-25]="",,"|n"&R1C10&RC[-25])&IF(RC[-24]="",,"|n"&R1C11&RC[-24])&IF(RC[-23]="",,"|n"&R1C12&RC[-23])&IF(RC[-22]="",,"|n"&R1C13&RC[-22])&IF(RC[-20]&RC[-19]&RC[-18]&RC[-17]="",,"|n"&R1C14)&IF(RC[-20]="",,"|n"&R1C15&RC[-20])&IF(RC[-19]="",,"|n"&R1C16&RC[-19])&IF(RC[-18]="",,"|n"&R1C17&RC[-18])&IF(RC[-17]="",,"|n"&R1C18&RC[-17])&IF(RC[-16]="",,"|n"&R1C19&RC[-16])&IF(RC[-15]="",,"|n"&R1C20&RC[-15])&IF(RC[-14]="",,"|n"&R1C21&RC[-14])&IF(RC[-13]="",,"|n"&R1C22&RC[-13])&IF(RC[-11]="",,"|n"&R1C24&RC[-11])&IF(RC[-10]="",,"|n"&R1C25&RC[-10])&IF(RC[-9]="",,"|n"&R1C26&RC[-9])&IF(RC[-8]="",,"|n"&R1C27&RC[-8])&IF(RC[-7]="",,"|n"&R1C28&RC[-7])&IF(RC[-6]="",,"|n"&R1C29&RC[-6])&IF(RC[-2]="",,"|n"&RC[-2]) -> 
AI320: =IF(RC[-27]&RC[-26]&RC[-25]&RC[-24]&RC[-23]&RC[-22]="",,R1C7)&IF(RC[-27]="",,"|n"&R1C8&RC[-27])&IF(RC[-26]="",,"|n"&R1C9&RC[-26])&IF(RC[-25]="",,"|n"&R1C10&RC[-25])&IF(RC[-24]="",,"|n"&R1C11&RC[-24])&IF(RC[-23]="",,"|n"&R1C12&RC[-23])&IF(RC[-22]="",,"|n"&R1C13&RC[-22])&IF(RC[-20]&RC[-19]&RC[-18]&RC[-17]="",,"|n"&R1C14)&IF(RC[-20]="",,"|n"&R1C15&RC[-20])&IF(RC[-19]="",,"|n"&R1C16&RC[-19])&IF(RC[-18]="",,"|n"&R1C17&RC[-18])&IF(RC[-17]="",,"|n"&R1C18&RC[-17])&IF(RC[-16]="",,"|n"&R1C19&RC[-16])&IF(RC[-15]="",,"|n"&R1C20&RC[-15])&IF(RC[-14]="",,"|n"&R1C21&RC[-14])&IF(RC[-13]="",,"|n"&R1C22&RC[-13])&IF(RC[-11]="",,"|n"&R1C24&RC[-11])&IF(RC[-10]="",,"|n"&R1C25&RC[-10])&IF(RC[-9]="",,"|n"&R1C26&RC[-9])&IF(RC[-8]="",,"|n"&R1C27&RC[-8])&IF(RC[-7]="",,"|n"&R1C28&RC[-7])&IF(RC[-6]="",,"|n"&R1C29&RC[-6])&IF(RC[-2]="",,"|n"&RC[-2]) -> 
AI321: =IF(RC[-27]&RC[-26]&RC[-25]&RC[-24]&RC[-23]&RC[-22]="",,R1C7)&IF(RC[-27]="",,"|n"&R1C8&RC[-27])&IF(RC[-26]="",,"|n"&R1C9&RC[-26])&IF(RC[-25]="",,"|n"&R1C10&RC[-25])&IF(RC[-24]="",,"|n"&R1C11&RC[-24])&IF(RC[-23]="",,"|n"&R1C12&RC[-23])&IF(RC[-22]="",,"|n"&R1C13&RC[-22])&IF(RC[-20]&RC[-19]&RC[-18]&RC[-17]="",,"|n"&R1C14)&IF(RC[-20]="",,"|n"&R1C15&RC[-20])&IF(RC[-19]="",,"|n"&R1C16&RC[-19])&IF(RC[-18]="",,"|n"&R1C17&RC[-18])&IF(RC[-17]="",,"|n"&R1C18&RC[-17])&IF(RC[-16]="",,"|n"&R1C19&RC[-16])&IF(RC[-15]="",,"|n"&R1C20&RC[-15])&IF(RC[-14]="",,"|n"&R1C21&RC[-14])&IF(RC[-13]="",,"|n"&R1C22&RC[-13])&IF(RC[-11]="",,"|n"&R1C24&RC[-11])&IF(RC[-10]="",,"|n"&R1C25&RC[-10])&IF(RC[-9]="",,"|n"&R1C26&RC[-9])&IF(RC[-8]="",,"|n"&R1C27&RC[-8])&IF(RC[-7]="",,"|n"&R1C28&RC[-7])&IF(RC[-6]="",,"|n"&R1C29&RC[-6])&IF(RC[-2]="",,"|n"&RC[-2]) -> 
AI322: =IF(RC[-27]&RC[-26]&RC[-25]&RC[-24]&RC[-23]&RC[-22]="",,R1C7)&IF(RC[-27]="",,"|n"&R1C8&RC[-27])&IF(RC[-26]="",,"|n"&R1C9&RC[-26])&IF(RC[-25]="",,"|n"&R1C10&RC[-25])&IF(RC[-24]="",,"|n"&R1C11&RC[-24])&IF(RC[-23]="",,"|n"&R1C12&RC[-23])&IF(RC[-22]="",,"|n"&R1C13&RC[-22])&IF(RC[-20]&RC[-19]&RC[-18]&RC[-17]="",,"|n"&R1C14)&IF(RC[-20]="",,"|n"&R1C15&RC[-20])&IF(RC[-19]="",,"|n"&R1C16&RC[-19])&IF(RC[-18]="",,"|n"&R1C17&RC[-18])&IF(RC[-17]="",,"|n"&R1C18&RC[-17])&IF(RC[-16]="",,"|n"&R1C19&RC[-16])&IF(RC[-15]="",,"|n"&R1C20&RC[-15])&IF(RC[-14]="",,"|n"&R1C21&RC[-14])&IF(RC[-13]="",,"|n"&R1C22&RC[-13])&IF(RC[-11]="",,"|n"&R1C24&RC[-11])&IF(RC[-10]="",,"|n"&R1C25&RC[-10])&IF(RC[-9]="",,"|n"&R1C26&RC[-9])&IF(RC[-8]="",,"|n"&R1C27&RC[-8])&IF(RC[-7]="",,"|n"&R1C28&RC[-7])&IF(RC[-6]="",,"|n"&R1C29&RC[-6])&IF(RC[-2]="",,"|n"&RC[-2]) -> 
AI323: =IF(RC[-27]&RC[-26]&RC[-25]&RC[-24]&RC[-23]&RC[-22]="",,R1C7)&IF(RC[-27]="",,"|n"&R1C8&RC[-27])&IF(RC[-26]="",,"|n"&R1C9&RC[-26])&IF(RC[-25]="",,"|n"&R1C10&RC[-25])&IF(RC[-24]="",,"|n"&R1C11&RC[-24])&IF(RC[-23]="",,"|n"&R1C12&RC[-23])&IF(RC[-22]="",,"|n"&R1C13&RC[-22])&IF(RC[-20]&RC[-19]&RC[-18]&RC[-17]="",,"|n"&R1C14)&IF(RC[-20]="",,"|n"&R1C15&RC[-20])&IF(RC[-19]="",,"|n"&R1C16&RC[-19])&IF(RC[-18]="",,"|n"&R1C17&RC[-18])&IF(RC[-17]="",,"|n"&R1C18&RC[-17])&IF(RC[-16]="",,"|n"&R1C19&RC[-16])&IF(RC[-15]="",,"|n"&R1C20&RC[-15])&IF(RC[-14]="",,"|n"&R1C21&RC[-14])&IF(RC[-13]="",,"|n"&R1C22&RC[-13])&IF(RC[-11]="",,"|n"&R1C24&RC[-11])&IF(RC[-10]="",,"|n"&R1C25&RC[-10])&IF(RC[-9]="",,"|n"&R1C26&RC[-9])&IF(RC[-8]="",,"|n"&R1C27&RC[-8])&IF(RC[-7]="",,"|n"&R1C28&RC[-7])&IF(RC[-6]="",,"|n"&R1C29&RC[-6])&IF(RC[-2]="",,"|n"&RC[-2]) -> 
AI324: =IF(RC[-27]&RC[-26]&RC[-25]&RC[-24]&RC[-23]&RC[-22]="",,R1C7)&IF(RC[-27]="",,"|n"&R1C8&RC[-27])&IF(RC[-26]="",,"|n"&R1C9&RC[-26])&IF(RC[-25]="",,"|n"&R1C10&RC[-25])&IF(RC[-24]="",,"|n"&R1C11&RC[-24])&IF(RC[-23]="",,"|n"&R1C12&RC[-23])&IF(RC[-22]="",,"|n"&R1C13&RC[-22])&IF(RC[-20]&RC[-19]&RC[-18]&RC[-17]="",,"|n"&R1C14)&IF(RC[-20]="",,"|n"&R1C15&RC[-20])&IF(RC[-19]="",,"|n"&R1C16&RC[-19])&IF(RC[-18]="",,"|n"&R1C17&RC[-18])&IF(RC[-17]="",,"|n"&R1C18&RC[-17])&IF(RC[-16]="",,"|n"&R1C19&RC[-16])&IF(RC[-15]="",,"|n"&R1C20&RC[-15])&IF(RC[-14]="",,"|n"&R1C21&RC[-14])&IF(RC[-13]="",,"|n"&R1C22&RC[-13])&IF(RC[-11]="",,"|n"&R1C24&RC[-11])&IF(RC[-10]="",,"|n"&R1C25&RC[-10])&IF(RC[-9]="",,"|n"&R1C26&RC[-9])&IF(RC[-8]="",,"|n"&R1C27&RC[-8])&IF(RC[-7]="",,"|n"&R1C28&RC[-7])&IF(RC[-6]="",,"|n"&R1C29&RC[-6])&IF(RC[-2]="",,"|n"&RC[-2]) -> 
AI325: =IF(RC[-27]&RC[-26]&RC[-25]&RC[-24]&RC[-23]&RC[-22]="",,R1C7)&IF(RC[-27]="",,"|n"&R1C8&RC[-27])&IF(RC[-26]="",,"|n"&R1C9&RC[-26])&IF(RC[-25]="",,"|n"&R1C10&RC[-25])&IF(RC[-24]="",,"|n"&R1C11&RC[-24])&IF(RC[-23]="",,"|n"&R1C12&RC[-23])&IF(RC[-22]="",,"|n"&R1C13&RC[-22])&IF(RC[-20]&RC[-19]&RC[-18]&RC[-17]="",,"|n"&R1C14)&IF(RC[-20]="",,"|n"&R1C15&RC[-20])&IF(RC[-19]="",,"|n"&R1C16&RC[-19])&IF(RC[-18]="",,"|n"&R1C17&RC[-18])&IF(RC[-17]="",,"|n"&R1C18&RC[-17])&IF(RC[-16]="",,"|n"&R1C19&RC[-16])&IF(RC[-15]="",,"|n"&R1C20&RC[-15])&IF(RC[-14]="",,"|n"&R1C21&RC[-14])&IF(RC[-13]="",,"|n"&R1C22&RC[-13])&IF(RC[-11]="",,"|n"&R1C24&RC[-11])&IF(RC[-10]="",,"|n"&R1C25&RC[-10])&IF(RC[-9]="",,"|n"&R1C26&RC[-9])&IF(RC[-8]="",,"|n"&R1C27&RC[-8])&IF(RC[-7]="",,"|n"&R1C28&RC[-7])&IF(RC[-6]="",,"|n"&R1C29&RC[-6])&IF(RC[-2]="",,"|n"&RC[-2]) -> 
AI326: =IF(RC[-27]&RC[-26]&RC[-25]&RC[-24]&RC[-23]&RC[-22]="",,R1C7)&IF(RC[-27]="",,"|n"&R1C8&RC[-27])&IF(RC[-26]="",,"|n"&R1C9&RC[-26])&IF(RC[-25]="",,"|n"&R1C10&RC[-25])&IF(RC[-24]="",,"|n"&R1C11&RC[-24])&IF(RC[-23]="",,"|n"&R1C12&RC[-23])&IF(RC[-22]="",,"|n"&R1C13&RC[-22])&IF(RC[-20]&RC[-19]&RC[-18]&RC[-17]="",,"|n"&R1C14)&IF(RC[-20]="",,"|n"&R1C15&RC[-20])&IF(RC[-19]="",,"|n"&R1C16&RC[-19])&IF(RC[-18]="",,"|n"&R1C17&RC[-18])&IF(RC[-17]="",,"|n"&R1C18&RC[-17])&IF(RC[-16]="",,"|n"&R1C19&RC[-16])&IF(RC[-15]="",,"|n"&R1C20&RC[-15])&IF(RC[-14]="",,"|n"&R1C21&RC[-14])&IF(RC[-13]="",,"|n"&R1C22&RC[-13])&IF(RC[-11]="",,"|n"&R1C24&RC[-11])&IF(RC[-10]="",,"|n"&R1C25&RC[-10])&IF(RC[-9]="",,"|n"&R1C26&RC[-9])&IF(RC[-8]="",,"|n"&R1C27&RC[-8])&IF(RC[-7]="",,"|n"&R1C28&RC[-7])&IF(RC[-6]="",,"|n"&R1C29&RC[-6])&IF(RC[-2]="",,"|n"&RC[-2]) -> 
AI327: =IF(RC[-27]&RC[-26]&RC[-25]&RC[-24]&RC[-23]&RC[-22]="",,R1C7)&IF(RC[-27]="",,"|n"&R1C8&RC[-27])&IF(RC[-26]="",,"|n"&R1C9&RC[-26])&IF(RC[-25]="",,"|n"&R1C10&RC[-25])&IF(RC[-24]="",,"|n"&R1C11&RC[-24])&IF(RC[-23]="",,"|n"&R1C12&RC[-23])&IF(RC[-22]="",,"|n"&R1C13&RC[-22])&IF(RC[-20]&RC[-19]&RC[-18]&RC[-17]="",,"|n"&R1C14)&IF(RC[-20]="",,"|n"&R1C15&RC[-20])&IF(RC[-19]="",,"|n"&R1C16&RC[-19])&IF(RC[-18]="",,"|n"&R1C17&RC[-18])&IF(RC[-17]="",,"|n"&R1C18&RC[-17])&IF(RC[-16]="",,"|n"&R1C19&RC[-16])&IF(RC[-15]="",,"|n"&R1C20&RC[-15])&IF(RC[-14]="",,"|n"&R1C21&RC[-14])&IF(RC[-13]="",,"|n"&R1C22&RC[-13])&IF(RC[-11]="",,"|n"&R1C24&RC[-11])&IF(RC[-10]="",,"|n"&R1C25&RC[-10])&IF(RC[-9]="",,"|n"&R1C26&RC[-9])&IF(RC[-8]="",,"|n"&R1C27&RC[-8])&IF(RC[-7]="",,"|n"&R1C28&RC[-7])&IF(RC[-6]="",,"|n"&R1C29&RC[-6])&IF(RC[-2]="",,"|n"&RC[-2]) -> 
AI328: =IF(RC[-27]&RC[-26]&RC[-25]&RC[-24]&RC[-23]&RC[-22]="",,R1C7)&IF(RC[-27]="",,"|n"&R1C8&RC[-27])&IF(RC[-26]="",,"|n"&R1C9&RC[-26])&IF(RC[-25]="",,"|n"&R1C10&RC[-25])&IF(RC[-24]="",,"|n"&R1C11&RC[-24])&IF(RC[-23]="",,"|n"&R1C12&RC[-23])&IF(RC[-22]="",,"|n"&R1C13&RC[-22])&IF(RC[-20]&RC[-19]&RC[-18]&RC[-17]="",,"|n"&R1C14)&IF(RC[-20]="",,"|n"&R1C15&RC[-20])&IF(RC[-19]="",,"|n"&R1C16&RC[-19])&IF(RC[-18]="",,"|n"&R1C17&RC[-18])&IF(RC[-17]="",,"|n"&R1C18&RC[-17])&IF(RC[-16]="",,"|n"&R1C19&RC[-16])&IF(RC[-15]="",,"|n"&R1C20&RC[-15])&IF(RC[-14]="",,"|n"&R1C21&RC[-14])&IF(RC[-13]="",,"|n"&R1C22&RC[-13])&IF(RC[-11]="",,"|n"&R1C24&RC[-11])&IF(RC[-10]="",,"|n"&R1C25&RC[-10])&IF(RC[-9]="",,"|n"&R1C26&RC[-9])&IF(RC[-8]="",,"|n"&R1C27&RC[-8])&IF(RC[-7]="",,"|n"&R1C28&RC[-7])&IF(RC[-6]="",,"|n"&R1C29&RC[-6])&IF(RC[-2]="",,"|n"&RC[-2]) -> 
AI329: =IF(RC[-27]&RC[-26]&RC[-25]&RC[-24]&RC[-23]&RC[-22]="",,R1C7)&IF(RC[-27]="",,"|n"&R1C8&RC[-27])&IF(RC[-26]="",,"|n"&R1C9&RC[-26])&IF(RC[-25]="",,"|n"&R1C10&RC[-25])&IF(RC[-24]="",,"|n"&R1C11&RC[-24])&IF(RC[-23]="",,"|n"&R1C12&RC[-23])&IF(RC[-22]="",,"|n"&R1C13&RC[-22])&IF(RC[-20]&RC[-19]&RC[-18]&RC[-17]="",,"|n"&R1C14)&IF(RC[-20]="",,"|n"&R1C15&RC[-20])&IF(RC[-19]="",,"|n"&R1C16&RC[-19])&IF(RC[-18]="",,"|n"&R1C17&RC[-18])&IF(RC[-17]="",,"|n"&R1C18&RC[-17])&IF(RC[-16]="",,"|n"&R1C19&RC[-16])&IF(RC[-15]="",,"|n"&R1C20&RC[-15])&IF(RC[-14]="",,"|n"&R1C21&RC[-14])&IF(RC[-13]="",,"|n"&R1C22&RC[-13])&IF(RC[-11]="",,"|n"&R1C24&RC[-11])&IF(RC[-10]="",,"|n"&R1C25&RC[-10])&IF(RC[-9]="",,"|n"&R1C26&RC[-9])&IF(RC[-8]="",,"|n"&R1C27&RC[-8])&IF(RC[-7]="",,"|n"&R1C28&RC[-7])&IF(RC[-6]="",,"|n"&R1C29&RC[-6])&IF(RC[-2]="",,"|n"&RC[-2]) -> 
AI330: =IF(RC[-27]&RC[-26]&RC[-25]&RC[-24]&RC[-23]&RC[-22]="",,R1C7)&IF(RC[-27]="",,"|n"&R1C8&RC[-27])&IF(RC[-26]="",,"|n"&R1C9&RC[-26])&IF(RC[-25]="",,"|n"&R1C10&RC[-25])&IF(RC[-24]="",,"|n"&R1C11&RC[-24])&IF(RC[-23]="",,"|n"&R1C12&RC[-23])&IF(RC[-22]="",,"|n"&R1C13&RC[-22])&IF(RC[-20]&RC[-19]&RC[-18]&RC[-17]="",,"|n"&R1C14)&IF(RC[-20]="",,"|n"&R1C15&RC[-20])&IF(RC[-19]="",,"|n"&R1C16&RC[-19])&IF(RC[-18]="",,"|n"&R1C17&RC[-18])&IF(RC[-17]="",,"|n"&R1C18&RC[-17])&IF(RC[-16]="",,"|n"&R1C19&RC[-16])&IF(RC[-15]="",,"|n"&R1C20&RC[-15])&IF(RC[-14]="",,"|n"&R1C21&RC[-14])&IF(RC[-13]="",,"|n"&R1C22&RC[-13])&IF(RC[-11]="",,"|n"&R1C24&RC[-11])&IF(RC[-10]="",,"|n"&R1C25&RC[-10])&IF(RC[-9]="",,"|n"&R1C26&RC[-9])&IF(RC[-8]="",,"|n"&R1C27&RC[-8])&IF(RC[-7]="",,"|n"&R1C28&RC[-7])&IF(RC[-6]="",,"|n"&R1C29&RC[-6])&IF(RC[-2]="",,"|n"&RC[-2]) -> 
AI331: =IF(RC[-27]&RC[-26]&RC[-25]&RC[-24]&RC[-23]&RC[-22]="",,R1C7)&IF(RC[-27]="",,"|n"&R1C8&RC[-27])&IF(RC[-26]="",,"|n"&R1C9&RC[-26])&IF(RC[-25]="",,"|n"&R1C10&RC[-25])&IF(RC[-24]="",,"|n"&R1C11&RC[-24])&IF(RC[-23]="",,"|n"&R1C12&RC[-23])&IF(RC[-22]="",,"|n"&R1C13&RC[-22])&IF(RC[-20]&RC[-19]&RC[-18]&RC[-17]="",,"|n"&R1C14)&IF(RC[-20]="",,"|n"&R1C15&RC[-20])&IF(RC[-19]="",,"|n"&R1C16&RC[-19])&IF(RC[-18]="",,"|n"&R1C17&RC[-18])&IF(RC[-17]="",,"|n"&R1C18&RC[-17])&IF(RC[-16]="",,"|n"&R1C19&RC[-16])&IF(RC[-15]="",,"|n"&R1C20&RC[-15])&IF(RC[-14]="",,"|n"&R1C21&RC[-14])&IF(RC[-13]="",,"|n"&R1C22&RC[-13])&IF(RC[-11]="",,"|n"&R1C24&RC[-11])&IF(RC[-10]="",,"|n"&R1C25&RC[-10])&IF(RC[-9]="",,"|n"&R1C26&RC[-9])&IF(RC[-8]="",,"|n"&R1C27&RC[-8])&IF(RC[-7]="",,"|n"&R1C28&RC[-7])&IF(RC[-6]="",,"|n"&R1C29&RC[-6])&IF(RC[-2]="",,"|n"&RC[-2]) -> 
AI332: =IF(RC[-27]&RC[-26]&RC[-25]&RC[-24]&RC[-23]&RC[-22]="",,R1C7)&IF(RC[-27]="",,"|n"&R1C8&RC[-27])&IF(RC[-26]="",,"|n"&R1C9&RC[-26])&IF(RC[-25]="",,"|n"&R1C10&RC[-25])&IF(RC[-24]="",,"|n"&R1C11&RC[-24])&IF(RC[-23]="",,"|n"&R1C12&RC[-23])&IF(RC[-22]="",,"|n"&R1C13&RC[-22])&IF(RC[-20]&RC[-19]&RC[-18]&RC[-17]="",,"|n"&R1C14)&IF(RC[-20]="",,"|n"&R1C15&RC[-20])&IF(RC[-19]="",,"|n"&R1C16&RC[-19])&IF(RC[-18]="",,"|n"&R1C17&RC[-18])&IF(RC[-17]="",,"|n"&R1C18&RC[-17])&IF(RC[-16]="",,"|n"&R1C19&RC[-16])&IF(RC[-15]="",,"|n"&R1C20&RC[-15])&IF(RC[-14]="",,"|n"&R1C21&RC[-14])&IF(RC[-13]="",,"|n"&R1C22&RC[-13])&IF(RC[-11]="",,"|n"&R1C24&RC[-11])&IF(RC[-10]="",,"|n"&R1C25&RC[-10])&IF(RC[-9]="",,"|n"&R1C26&RC[-9])&IF(RC[-8]="",,"|n"&R1C27&RC[-8])&IF(RC[-7]="",,"|n"&R1C28&RC[-7])&IF(RC[-6]="",,"|n"&R1C29&RC[-6])&IF(RC[-2]="",,"|n"&RC[-2]) -> 
AI333: =IF(RC[-27]&RC[-26]&RC[-25]&RC[-24]&RC[-23]&RC[-22]="",,R1C7)&IF(RC[-27]="",,"|n"&R1C8&RC[-27])&IF(RC[-26]="",,"|n"&R1C9&RC[-26])&IF(RC[-25]="",,"|n"&R1C10&RC[-25])&IF(RC[-24]="",,"|n"&R1C11&RC[-24])&IF(RC[-23]="",,"|n"&R1C12&RC[-23])&IF(RC[-22]="",,"|n"&R1C13&RC[-22])&IF(RC[-20]&RC[-19]&RC[-18]&RC[-17]="",,"|n"&R1C14)&IF(RC[-20]="",,"|n"&R1C15&RC[-20])&IF(RC[-19]="",,"|n"&R1C16&RC[-19])&IF(RC[-18]="",,"|n"&R1C17&RC[-18])&IF(RC[-17]="",,"|n"&R1C18&RC[-17])&IF(RC[-16]="",,"|n"&R1C19&RC[-16])&IF(RC[-15]="",,"|n"&R1C20&RC[-15])&IF(RC[-14]="",,"|n"&R1C21&RC[-14])&IF(RC[-13]="",,"|n"&R1C22&RC[-13])&IF(RC[-11]="",,"|n"&R1C24&RC[-11])&IF(RC[-10]="",,"|n"&R1C25&RC[-10])&IF(RC[-9]="",,"|n"&R1C26&RC[-9])&IF(RC[-8]="",,"|n"&R1C27&RC[-8])&IF(RC[-7]="",,"|n"&R1C28&RC[-7])&IF(RC[-6]="",,"|n"&R1C29&RC[-6])&IF(RC[-2]="",,"|n"&RC[-2]) -> 
AI334: =IF(RC[-27]&RC[-26]&RC[-25]&RC[-24]&RC[-23]&RC[-22]="",,R1C7)&IF(RC[-27]="",,"|n"&R1C8&RC[-27])&IF(RC[-26]="",,"|n"&R1C9&RC[-26])&IF(RC[-25]="",,"|n"&R1C10&RC[-25])&IF(RC[-24]="",,"|n"&R1C11&RC[-24])&IF(RC[-23]="",,"|n"&R1C12&RC[-23])&IF(RC[-22]="",,"|n"&R1C13&RC[-22])&IF(RC[-20]&RC[-19]&RC[-18]&RC[-17]="",,"|n"&R1C14)&IF(RC[-20]="",,"|n"&R1C15&RC[-20])&IF(RC[-19]="",,"|n"&R1C16&RC[-19])&IF(RC[-18]="",,"|n"&R1C17&RC[-18])&IF(RC[-17]="",,"|n"&R1C18&RC[-17])&IF(RC[-16]="",,"|n"&R1C19&RC[-16])&IF(RC[-15]="",,"|n"&R1C20&RC[-15])&IF(RC[-14]="",,"|n"&R1C21&RC[-14])&IF(RC[-13]="",,"|n"&R1C22&RC[-13])&IF(RC[-11]="",,"|n"&R1C24&RC[-11])&IF(RC[-10]="",,"|n"&R1C25&RC[-10])&IF(RC[-9]="",,"|n"&R1C26&RC[-9])&IF(RC[-8]="",,"|n"&R1C27&RC[-8])&IF(RC[-7]="",,"|n"&R1C28&RC[-7])&IF(RC[-6]="",,"|n"&R1C29&RC[-6])&IF(RC[-2]="",,"|n"&RC[-2]) -> 
AI335: =IF(RC[-27]&RC[-26]&RC[-25]&RC[-24]&RC[-23]&RC[-22]="",,R1C7)&IF(RC[-27]="",,"|n"&R1C8&RC[-27])&IF(RC[-26]="",,"|n"&R1C9&RC[-26])&IF(RC[-25]="",,"|n"&R1C10&RC[-25])&IF(RC[-24]="",,"|n"&R1C11&RC[-24])&IF(RC[-23]="",,"|n"&R1C12&RC[-23])&IF(RC[-22]="",,"|n"&R1C13&RC[-22])&IF(RC[-20]&RC[-19]&RC[-18]&RC[-17]="",,"|n"&R1C14)&IF(RC[-20]="",,"|n"&R1C15&RC[-20])&IF(RC[-19]="",,"|n"&R1C16&RC[-19])&IF(RC[-18]="",,"|n"&R1C17&RC[-18])&IF(RC[-17]="",,"|n"&R1C18&RC[-17])&IF(RC[-16]="",,"|n"&R1C19&RC[-16])&IF(RC[-15]="",,"|n"&R1C20&RC[-15])&IF(RC[-14]="",,"|n"&R1C21&RC[-14])&IF(RC[-13]="",,"|n"&R1C22&RC[-13])&IF(RC[-11]="",,"|n"&R1C24&RC[-11])&IF(RC[-10]="",,"|n"&R1C25&RC[-10])&IF(RC[-9]="",,"|n"&R1C26&RC[-9])&IF(RC[-8]="",,"|n"&R1C27&RC[-8])&IF(RC[-7]="",,"|n"&R1C28&RC[-7])&IF(RC[-6]="",,"|n"&R1C29&RC[-6])&IF(RC[-2]="",,"|n"&RC[-2]) -> 
AI336: =IF(RC[-27]&RC[-26]&RC[-25]&RC[-24]&RC[-23]&RC[-22]="",,R1C7)&IF(RC[-27]="",,"|n"&R1C8&RC[-27])&IF(RC[-26]="",,"|n"&R1C9&RC[-26])&IF(RC[-25]="",,"|n"&R1C10&RC[-25])&IF(RC[-24]="",,"|n"&R1C11&RC[-24])&IF(RC[-23]="",,"|n"&R1C12&RC[-23])&IF(RC[-22]="",,"|n"&R1C13&RC[-22])&IF(RC[-20]&RC[-19]&RC[-18]&RC[-17]="",,"|n"&R1C14)&IF(RC[-20]="",,"|n"&R1C15&RC[-20])&IF(RC[-19]="",,"|n"&R1C16&RC[-19])&IF(RC[-18]="",,"|n"&R1C17&RC[-18])&IF(RC[-17]="",,"|n"&R1C18&RC[-17])&IF(RC[-16]="",,"|n"&R1C19&RC[-16])&IF(RC[-15]="",,"|n"&R1C20&RC[-15])&IF(RC[-14]="",,"|n"&R1C21&RC[-14])&IF(RC[-13]="",,"|n"&R1C22&RC[-13])&IF(RC[-11]="",,"|n"&R1C24&RC[-11])&IF(RC[-10]="",,"|n"&R1C25&RC[-10])&IF(RC[-9]="",,"|n"&R1C26&RC[-9])&IF(RC[-8]="",,"|n"&R1C27&RC[-8])&IF(RC[-7]="",,"|n"&R1C28&RC[-7])&IF(RC[-6]="",,"|n"&R1C29&RC[-6])&IF(RC[-2]="",,"|n"&RC[-2]) -> 
AI337: =IF(RC[-27]&RC[-26]&RC[-25]&RC[-24]&RC[-23]&RC[-22]="",,R1C7)&IF(RC[-27]="",,"|n"&R1C8&RC[-27])&IF(RC[-26]="",,"|n"&R1C9&RC[-26])&IF(RC[-25]="",,"|n"&R1C10&RC[-25])&IF(RC[-24]="",,"|n"&R1C11&RC[-24])&IF(RC[-23]="",,"|n"&R1C12&RC[-23])&IF(RC[-22]="",,"|n"&R1C13&RC[-22])&IF(RC[-20]&RC[-19]&RC[-18]&RC[-17]="",,"|n"&R1C14)&IF(RC[-20]="",,"|n"&R1C15&RC[-20])&IF(RC[-19]="",,"|n"&R1C16&RC[-19])&IF(RC[-18]="",,"|n"&R1C17&RC[-18])&IF(RC[-17]="",,"|n"&R1C18&RC[-17])&IF(RC[-16]="",,"|n"&R1C19&RC[-16])&IF(RC[-15]="",,"|n"&R1C20&RC[-15])&IF(RC[-14]="",,"|n"&R1C21&RC[-14])&IF(RC[-13]="",,"|n"&R1C22&RC[-13])&IF(RC[-11]="",,"|n"&R1C24&RC[-11])&IF(RC[-10]="",,"|n"&R1C25&RC[-10])&IF(RC[-9]="",,"|n"&R1C26&RC[-9])&IF(RC[-8]="",,"|n"&R1C27&RC[-8])&IF(RC[-7]="",,"|n"&R1C28&RC[-7])&IF(RC[-6]="",,"|n"&R1C29&RC[-6])&IF(RC[-2]="",,"|n"&RC[-2]) -> 
AI338: =IF(RC[-27]&RC[-26]&RC[-25]&RC[-24]&RC[-23]&RC[-22]="",,R1C7)&IF(RC[-27]="",,"|n"&R1C8&RC[-27])&IF(RC[-26]="",,"|n"&R1C9&RC[-26])&IF(RC[-25]="",,"|n"&R1C10&RC[-25])&IF(RC[-24]="",,"|n"&R1C11&RC[-24])&IF(RC[-23]="",,"|n"&R1C12&RC[-23])&IF(RC[-22]="",,"|n"&R1C13&RC[-22])&IF(RC[-20]&RC[-19]&RC[-18]&RC[-17]="",,"|n"&R1C14)&IF(RC[-20]="",,"|n"&R1C15&RC[-20])&IF(RC[-19]="",,"|n"&R1C16&RC[-19])&IF(RC[-18]="",,"|n"&R1C17&RC[-18])&IF(RC[-17]="",,"|n"&R1C18&RC[-17])&IF(RC[-16]="",,"|n"&R1C19&RC[-16])&IF(RC[-15]="",,"|n"&R1C20&RC[-15])&IF(RC[-14]="",,"|n"&R1C21&RC[-14])&IF(RC[-13]="",,"|n"&R1C22&RC[-13])&IF(RC[-11]="",,"|n"&R1C24&RC[-11])&IF(RC[-10]="",,"|n"&R1C25&RC[-10])&IF(RC[-9]="",,"|n"&R1C26&RC[-9])&IF(RC[-8]="",,"|n"&R1C27&RC[-8])&IF(RC[-7]="",,"|n"&R1C28&RC[-7])&IF(RC[-6]="",,"|n"&R1C29&RC[-6])&IF(RC[-2]="",,"|n"&RC[-2]) -> 
AI339: =IF(RC[-27]&RC[-26]&RC[-25]&RC[-24]&RC[-23]&RC[-22]="",,R1C7)&IF(RC[-27]="",,"|n"&R1C8&RC[-27])&IF(RC[-26]="",,"|n"&R1C9&RC[-26])&IF(RC[-25]="",,"|n"&R1C10&RC[-25])&IF(RC[-24]="",,"|n"&R1C11&RC[-24])&IF(RC[-23]="",,"|n"&R1C12&RC[-23])&IF(RC[-22]="",,"|n"&R1C13&RC[-22])&IF(RC[-20]&RC[-19]&RC[-18]&RC[-17]="",,"|n"&R1C14)&IF(RC[-20]="",,"|n"&R1C15&RC[-20])&IF(RC[-19]="",,"|n"&R1C16&RC[-19])&IF(RC[-18]="",,"|n"&R1C17&RC[-18])&IF(RC[-17]="",,"|n"&R1C18&RC[-17])&IF(RC[-16]="",,"|n"&R1C19&RC[-16])&IF(RC[-15]="",,"|n"&R1C20&RC[-15])&IF(RC[-14]="",,"|n"&R1C21&RC[-14])&IF(RC[-13]="",,"|n"&R1C22&RC[-13])&IF(RC[-11]="",,"|n"&R1C24&RC[-11])&IF(RC[-10]="",,"|n"&R1C25&RC[-10])&IF(RC[-9]="",,"|n"&R1C26&RC[-9])&IF(RC[-8]="",,"|n"&R1C27&RC[-8])&IF(RC[-7]="",,"|n"&R1C28&RC[-7])&IF(RC[-6]="",,"|n"&R1C29&RC[-6])&IF(RC[-2]="",,"|n"&RC[-2]) -> 
AI340: =IF(RC[-27]&RC[-26]&RC[-25]&RC[-24]&RC[-23]&RC[-22]="",,R1C7)&IF(RC[-27]="",,"|n"&R1C8&RC[-27])&IF(RC[-26]="",,"|n"&R1C9&RC[-26])&IF(RC[-25]="",,"|n"&R1C10&RC[-25])&IF(RC[-24]="",,"|n"&R1C11&RC[-24])&IF(RC[-23]="",,"|n"&R1C12&RC[-23])&IF(RC[-22]="",,"|n"&R1C13&RC[-22])&IF(RC[-20]&RC[-19]&RC[-18]&RC[-17]="",,"|n"&R1C14)&IF(RC[-20]="",,"|n"&R1C15&RC[-20])&IF(RC[-19]="",,"|n"&R1C16&RC[-19])&IF(RC[-18]="",,"|n"&R1C17&RC[-18])&IF(RC[-17]="",,"|n"&R1C18&RC[-17])&IF(RC[-16]="",,"|n"&R1C19&RC[-16])&IF(RC[-15]="",,"|n"&R1C20&RC[-15])&IF(RC[-14]="",,"|n"&R1C21&RC[-14])&IF(RC[-13]="",,"|n"&R1C22&RC[-13])&IF(RC[-11]="",,"|n"&R1C24&RC[-11])&IF(RC[-10]="",,"|n"&R1C25&RC[-10])&IF(RC[-9]="",,"|n"&R1C26&RC[-9])&IF(RC[-8]="",,"|n"&R1C27&RC[-8])&IF(RC[-7]="",,"|n"&R1C28&RC[-7])&IF(RC[-6]="",,"|n"&R1C29&RC[-6])&IF(RC[-2]="",,"|n"&RC[-2]) -> 
AI341: =IF(RC[-27]&RC[-26]&RC[-25]&RC[-24]&RC[-23]&RC[-22]="",,R1C7)&IF(RC[-27]="",,"|n"&R1C8&RC[-27])&IF(RC[-26]="",,"|n"&R1C9&RC[-26])&IF(RC[-25]="",,"|n"&R1C10&RC[-25])&IF(RC[-24]="",,"|n"&R1C11&RC[-24])&IF(RC[-23]="",,"|n"&R1C12&RC[-23])&IF(RC[-22]="",,"|n"&R1C13&RC[-22])&IF(RC[-20]&RC[-19]&RC[-18]&RC[-17]="",,"|n"&R1C14)&IF(RC[-20]="",,"|n"&R1C15&RC[-20])&IF(RC[-19]="",,"|n"&R1C16&RC[-19])&IF(RC[-18]="",,"|n"&R1C17&RC[-18])&IF(RC[-17]="",,"|n"&R1C18&RC[-17])&IF(RC[-16]="",,"|n"&R1C19&RC[-16])&IF(RC[-15]="",,"|n"&R1C20&RC[-15])&IF(RC[-14]="",,"|n"&R1C21&RC[-14])&IF(RC[-13]="",,"|n"&R1C22&RC[-13])&IF(RC[-11]="",,"|n"&R1C24&RC[-11])&IF(RC[-10]="",,"|n"&R1C25&RC[-10])&IF(RC[-9]="",,"|n"&R1C26&RC[-9])&IF(RC[-8]="",,"|n"&R1C27&RC[-8])&IF(RC[-7]="",,"|n"&R1C28&RC[-7])&IF(RC[-6]="",,"|n"&R1C29&RC[-6])&IF(RC[-2]="",,"|n"&RC[-2]) -> 
AI342: =IF(RC[-27]&RC[-26]&RC[-25]&RC[-24]&RC[-23]&RC[-22]="",,R1C7)&IF(RC[-27]="",,"|n"&R1C8&RC[-27])&IF(RC[-26]="",,"|n"&R1C9&RC[-26])&IF(RC[-25]="",,"|n"&R1C10&RC[-25])&IF(RC[-24]="",,"|n"&R1C11&RC[-24])&IF(RC[-23]="",,"|n"&R1C12&RC[-23])&IF(RC[-22]="",,"|n"&R1C13&RC[-22])&IF(RC[-20]&RC[-19]&RC[-18]&RC[-17]="",,"|n"&R1C14)&IF(RC[-20]="",,"|n"&R1C15&RC[-20])&IF(RC[-19]="",,"|n"&R1C16&RC[-19])&IF(RC[-18]="",,"|n"&R1C17&RC[-18])&IF(RC[-17]="",,"|n"&R1C18&RC[-17])&IF(RC[-16]="",,"|n"&R1C19&RC[-16])&IF(RC[-15]="",,"|n"&R1C20&RC[-15])&IF(RC[-14]="",,"|n"&R1C21&RC[-14])&IF(RC[-13]="",,"|n"&R1C22&RC[-13])&IF(RC[-11]="",,"|n"&R1C24&RC[-11])&IF(RC[-10]="",,"|n"&R1C25&RC[-10])&IF(RC[-9]="",,"|n"&R1C26&RC[-9])&IF(RC[-8]="",,"|n"&R1C27&RC[-8])&IF(RC[-7]="",,"|n"&R1C28&RC[-7])&IF(RC[-6]="",,"|n"&R1C29&RC[-6])&IF(RC[-2]="",,"|n"&RC[-2]) -> 
AI343: =IF(RC[-27]&RC[-26]&RC[-25]&RC[-24]&RC[-23]&RC[-22]="",,R1C7)&IF(RC[-27]="",,"|n"&R1C8&RC[-27])&IF(RC[-26]="",,"|n"&R1C9&RC[-26])&IF(RC[-25]="",,"|n"&R1C10&RC[-25])&IF(RC[-24]="",,"|n"&R1C11&RC[-24])&IF(RC[-23]="",,"|n"&R1C12&RC[-23])&IF(RC[-22]="",,"|n"&R1C13&RC[-22])&IF(RC[-20]&RC[-19]&RC[-18]&RC[-17]="",,"|n"&R1C14)&IF(RC[-20]="",,"|n"&R1C15&RC[-20])&IF(RC[-19]="",,"|n"&R1C16&RC[-19])&IF(RC[-18]="",,"|n"&R1C17&RC[-18])&IF(RC[-17]="",,"|n"&R1C18&RC[-17])&IF(RC[-16]="",,"|n"&R1C19&RC[-16])&IF(RC[-15]="",,"|n"&R1C20&RC[-15])&IF(RC[-14]="",,"|n"&R1C21&RC[-14])&IF(RC[-13]="",,"|n"&R1C22&RC[-13])&IF(RC[-11]="",,"|n"&R1C24&RC[-11])&IF(RC[-10]="",,"|n"&R1C25&RC[-10])&IF(RC[-9]="",,"|n"&R1C26&RC[-9])&IF(RC[-8]="",,"|n"&R1C27&RC[-8])&IF(RC[-7]="",,"|n"&R1C28&RC[-7])&IF(RC[-6]="",,"|n"&R1C29&RC[-6])&IF(RC[-2]="",,"|n"&RC[-2]) -> 
AI344: =IF(RC[-27]&RC[-26]&RC[-25]&RC[-24]&RC[-23]&RC[-22]="",,R1C7)&IF(RC[-27]="",,"|n"&R1C8&RC[-27])&IF(RC[-26]="",,"|n"&R1C9&RC[-26])&IF(RC[-25]="",,"|n"&R1C10&RC[-25])&IF(RC[-24]="",,"|n"&R1C11&RC[-24])&IF(RC[-23]="",,"|n"&R1C12&RC[-23])&IF(RC[-22]="",,"|n"&R1C13&RC[-22])&IF(RC[-20]&RC[-19]&RC[-18]&RC[-17]="",,"|n"&R1C14)&IF(RC[-20]="",,"|n"&R1C15&RC[-20])&IF(RC[-19]="",,"|n"&R1C16&RC[-19])&IF(RC[-18]="",,"|n"&R1C17&RC[-18])&IF(RC[-17]="",,"|n"&R1C18&RC[-17])&IF(RC[-16]="",,"|n"&R1C19&RC[-16])&IF(RC[-15]="",,"|n"&R1C20&RC[-15])&IF(RC[-14]="",,"|n"&R1C21&RC[-14])&IF(RC[-13]="",,"|n"&R1C22&RC[-13])&IF(RC[-11]="",,"|n"&R1C24&RC[-11])&IF(RC[-10]="",,"|n"&R1C25&RC[-10])&IF(RC[-9]="",,"|n"&R1C26&RC[-9])&IF(RC[-8]="",,"|n"&R1C27&RC[-8])&IF(RC[-7]="",,"|n"&R1C28&RC[-7])&IF(RC[-6]="",,"|n"&R1C29&RC[-6])&IF(RC[-2]="",,"|n"&RC[-2]) -> 
AI345: =IF(RC[-27]&RC[-26]&RC[-25]&RC[-24]&RC[-23]&RC[-22]="",,R1C7)&IF(RC[-27]="",,"|n"&R1C8&RC[-27])&IF(RC[-26]="",,"|n"&R1C9&RC[-26])&IF(RC[-25]="",,"|n"&R1C10&RC[-25])&IF(RC[-24]="",,"|n"&R1C11&RC[-24])&IF(RC[-23]="",,"|n"&R1C12&RC[-23])&IF(RC[-22]="",,"|n"&R1C13&RC[-22])&IF(RC[-20]&RC[-19]&RC[-18]&RC[-17]="",,"|n"&R1C14)&IF(RC[-20]="",,"|n"&R1C15&RC[-20])&IF(RC[-19]="",,"|n"&R1C16&RC[-19])&IF(RC[-18]="",,"|n"&R1C17&RC[-18])&IF(RC[-17]="",,"|n"&R1C18&RC[-17])&IF(RC[-16]="",,"|n"&R1C19&RC[-16])&IF(RC[-15]="",,"|n"&R1C20&RC[-15])&IF(RC[-14]="",,"|n"&R1C21&RC[-14])&IF(RC[-13]="",,"|n"&R1C22&RC[-13])&IF(RC[-11]="",,"|n"&R1C24&RC[-11])&IF(RC[-10]="",,"|n"&R1C25&RC[-10])&IF(RC[-9]="",,"|n"&R1C26&RC[-9])&IF(RC[-8]="",,"|n"&R1C27&RC[-8])&IF(RC[-7]="",,"|n"&R1C28&RC[-7])&IF(RC[-6]="",,"|n"&R1C29&RC[-6])&IF(RC[-2]="",,"|n"&RC[-2]) -> 
AI346: =IF(RC[-27]&RC[-26]&RC[-25]&RC[-24]&RC[-23]&RC[-22]="",,R1C7)&IF(RC[-27]="",,"|n"&R1C8&RC[-27])&IF(RC[-26]="",,"|n"&R1C9&RC[-26])&IF(RC[-25]="",,"|n"&R1C10&RC[-25])&IF(RC[-24]="",,"|n"&R1C11&RC[-24])&IF(RC[-23]="",,"|n"&R1C12&RC[-23])&IF(RC[-22]="",,"|n"&R1C13&RC[-22])&IF(RC[-20]&RC[-19]&RC[-18]&RC[-17]="",,"|n"&R1C14)&IF(RC[-20]="",,"|n"&R1C15&RC[-20])&IF(RC[-19]="",,"|n"&R1C16&RC[-19])&IF(RC[-18]="",,"|n"&R1C17&RC[-18])&IF(RC[-17]="",,"|n"&R1C18&RC[-17])&IF(RC[-16]="",,"|n"&R1C19&RC[-16])&IF(RC[-15]="",,"|n"&R1C20&RC[-15])&IF(RC[-14]="",,"|n"&R1C21&RC[-14])&IF(RC[-13]="",,"|n"&R1C22&RC[-13])&IF(RC[-11]="",,"|n"&R1C24&RC[-11])&IF(RC[-10]="",,"|n"&R1C25&RC[-10])&IF(RC[-9]="",,"|n"&R1C26&RC[-9])&IF(RC[-8]="",,"|n"&R1C27&RC[-8])&IF(RC[-7]="",,"|n"&R1C28&RC[-7])&IF(RC[-6]="",,"|n"&R1C29&RC[-6])&IF(RC[-2]="",,"|n"&RC[-2]) -> 
AI347: =IF(RC[-27]&RC[-26]&RC[-25]&RC[-24]&RC[-23]&RC[-22]="",,R1C7)&IF(RC[-27]="",,"|n"&R1C8&RC[-27])&IF(RC[-26]="",,"|n"&R1C9&RC[-26])&IF(RC[-25]="",,"|n"&R1C10&RC[-25])&IF(RC[-24]="",,"|n"&R1C11&RC[-24])&IF(RC[-23]="",,"|n"&R1C12&RC[-23])&IF(RC[-22]="",,"|n"&R1C13&RC[-22])&IF(RC[-20]&RC[-19]&RC[-18]&RC[-17]="",,"|n"&R1C14)&IF(RC[-20]="",,"|n"&R1C15&RC[-20])&IF(RC[-19]="",,"|n"&R1C16&RC[-19])&IF(RC[-18]="",,"|n"&R1C17&RC[-18])&IF(RC[-17]="",,"|n"&R1C18&RC[-17])&IF(RC[-16]="",,"|n"&R1C19&RC[-16])&IF(RC[-15]="",,"|n"&R1C20&RC[-15])&IF(RC[-14]="",,"|n"&R1C21&RC[-14])&IF(RC[-13]="",,"|n"&R1C22&RC[-13])&IF(RC[-11]="",,"|n"&R1C24&RC[-11])&IF(RC[-10]="",,"|n"&R1C25&RC[-10])&IF(RC[-9]="",,"|n"&R1C26&RC[-9])&IF(RC[-8]="",,"|n"&R1C27&RC[-8])&IF(RC[-7]="",,"|n"&R1C28&RC[-7])&IF(RC[-6]="",,"|n"&R1C29&RC[-6])&IF(RC[-2]="",,"|n"&RC[-2]) -> 
AI348: =IF(RC[-27]&RC[-26]&RC[-25]&RC[-24]&RC[-23]&RC[-22]="",,R1C7)&IF(RC[-27]="",,"|n"&R1C8&RC[-27])&IF(RC[-26]="",,"|n"&R1C9&RC[-26])&IF(RC[-25]="",,"|n"&R1C10&RC[-25])&IF(RC[-24]="",,"|n"&R1C11&RC[-24])&IF(RC[-23]="",,"|n"&R1C12&RC[-23])&IF(RC[-22]="",,"|n"&R1C13&RC[-22])&IF(RC[-20]&RC[-19]&RC[-18]&RC[-17]="",,"|n"&R1C14)&IF(RC[-20]="",,"|n"&R1C15&RC[-20])&IF(RC[-19]="",,"|n"&R1C16&RC[-19])&IF(RC[-18]="",,"|n"&R1C17&RC[-18])&IF(RC[-17]="",,"|n"&R1C18&RC[-17])&IF(RC[-16]="",,"|n"&R1C19&RC[-16])&IF(RC[-15]="",,"|n"&R1C20&RC[-15])&IF(RC[-14]="",,"|n"&R1C21&RC[-14])&IF(RC[-13]="",,"|n"&R1C22&RC[-13])&IF(RC[-11]="",,"|n"&R1C24&RC[-11])&IF(RC[-10]="",,"|n"&R1C25&RC[-10])&IF(RC[-9]="",,"|n"&R1C26&RC[-9])&IF(RC[-8]="",,"|n"&R1C27&RC[-8])&IF(RC[-7]="",,"|n"&R1C28&RC[-7])&IF(RC[-6]="",,"|n"&R1C29&RC[-6])&IF(RC[-2]="",,"|n"&RC[-2]) -> 
AI349: =IF(RC[-27]&RC[-26]&RC[-25]&RC[-24]&RC[-23]&RC[-22]="",,R1C7)&IF(RC[-27]="",,"|n"&R1C8&RC[-27])&IF(RC[-26]="",,"|n"&R1C9&RC[-26])&IF(RC[-25]="",,"|n"&R1C10&RC[-25])&IF(RC[-24]="",,"|n"&R1C11&RC[-24])&IF(RC[-23]="",,"|n"&R1C12&RC[-23])&IF(RC[-22]="",,"|n"&R1C13&RC[-22])&IF(RC[-20]&RC[-19]&RC[-18]&RC[-17]="",,"|n"&R1C14)&IF(RC[-20]="",,"|n"&R1C15&RC[-20])&IF(RC[-19]="",,"|n"&R1C16&RC[-19])&IF(RC[-18]="",,"|n"&R1C17&RC[-18])&IF(RC[-17]="",,"|n"&R1C18&RC[-17])&IF(RC[-16]="",,"|n"&R1C19&RC[-16])&IF(RC[-15]="",,"|n"&R1C20&RC[-15])&IF(RC[-14]="",,"|n"&R1C21&RC[-14])&IF(RC[-13]="",,"|n"&R1C22&RC[-13])&IF(RC[-11]="",,"|n"&R1C24&RC[-11])&IF(RC[-10]="",,"|n"&R1C25&RC[-10])&IF(RC[-9]="",,"|n"&R1C26&RC[-9])&IF(RC[-8]="",,"|n"&R1C27&RC[-8])&IF(RC[-7]="",,"|n"&R1C28&RC[-7])&IF(RC[-6]="",,"|n"&R1C29&RC[-6])&IF(RC[-2]="",,"|n"&RC[-2]) -> 
AI350: =IF(RC[-27]&RC[-26]&RC[-25]&RC[-24]&RC[-23]&RC[-22]="",,R1C7)&IF(RC[-27]="",,"|n"&R1C8&RC[-27])&IF(RC[-26]="",,"|n"&R1C9&RC[-26])&IF(RC[-25]="",,"|n"&R1C10&RC[-25])&IF(RC[-24]="",,"|n"&R1C11&RC[-24])&IF(RC[-23]="",,"|n"&R1C12&RC[-23])&IF(RC[-22]="",,"|n"&R1C13&RC[-22])&IF(RC[-20]&RC[-19]&RC[-18]&RC[-17]="",,"|n"&R1C14)&IF(RC[-20]="",,"|n"&R1C15&RC[-20])&IF(RC[-19]="",,"|n"&R1C16&RC[-19])&IF(RC[-18]="",,"|n"&R1C17&RC[-18])&IF(RC[-17]="",,"|n"&R1C18&RC[-17])&IF(RC[-16]="",,"|n"&R1C19&RC[-16])&IF(RC[-15]="",,"|n"&R1C20&RC[-15])&IF(RC[-14]="",,"|n"&R1C21&RC[-14])&IF(RC[-13]="",,"|n"&R1C22&RC[-13])&IF(RC[-11]="",,"|n"&R1C24&RC[-11])&IF(RC[-10]="",,"|n"&R1C25&RC[-10])&IF(RC[-9]="",,"|n"&R1C26&RC[-9])&IF(RC[-8]="",,"|n"&R1C27&RC[-8])&IF(RC[-7]="",,"|n"&R1C28&RC[-7])&IF(RC[-6]="",,"|n"&R1C29&RC[-6])&IF(RC[-2]="",,"|n"&RC[-2]) -> 
AI351: =IF(RC[-27]&RC[-26]&RC[-25]&RC[-24]&RC[-23]&RC[-22]="",,R1C7)&IF(RC[-27]="",,"|n"&R1C8&RC[-27])&IF(RC[-26]="",,"|n"&R1C9&RC[-26])&IF(RC[-25]="",,"|n"&R1C10&RC[-25])&IF(RC[-24]="",,"|n"&R1C11&RC[-24])&IF(RC[-23]="",,"|n"&R1C12&RC[-23])&IF(RC[-22]="",,"|n"&R1C13&RC[-22])&IF(RC[-20]&RC[-19]&RC[-18]&RC[-17]="",,"|n"&R1C14)&IF(RC[-20]="",,"|n"&R1C15&RC[-20])&IF(RC[-19]="",,"|n"&R1C16&RC[-19])&IF(RC[-18]="",,"|n"&R1C17&RC[-18])&IF(RC[-17]="",,"|n"&R1C18&RC[-17])&IF(RC[-16]="",,"|n"&R1C19&RC[-16])&IF(RC[-15]="",,"|n"&R1C20&RC[-15])&IF(RC[-14]="",,"|n"&R1C21&RC[-14])&IF(RC[-13]="",,"|n"&R1C22&RC[-13])&IF(RC[-11]="",,"|n"&R1C24&RC[-11])&IF(RC[-10]="",,"|n"&R1C25&RC[-10])&IF(RC[-9]="",,"|n"&R1C26&RC[-9])&IF(RC[-8]="",,"|n"&R1C27&RC[-8])&IF(RC[-7]="",,"|n"&R1C28&RC[-7])&IF(RC[-6]="",,"|n"&R1C29&RC[-6])&IF(RC[-2]="",,"|n"&RC[-2]) -> 
AI352: =IF(RC[-27]&RC[-26]&RC[-25]&RC[-24]&RC[-23]&RC[-22]="",,R1C7)&IF(RC[-27]="",,"|n"&R1C8&RC[-27])&IF(RC[-26]="",,"|n"&R1C9&RC[-26])&IF(RC[-25]="",,"|n"&R1C10&RC[-25])&IF(RC[-24]="",,"|n"&R1C11&RC[-24])&IF(RC[-23]="",,"|n"&R1C12&RC[-23])&IF(RC[-22]="",,"|n"&R1C13&RC[-22])&IF(RC[-20]&RC[-19]&RC[-18]&RC[-17]="",,"|n"&R1C14)&IF(RC[-20]="",,"|n"&R1C15&RC[-20])&IF(RC[-19]="",,"|n"&R1C16&RC[-19])&IF(RC[-18]="",,"|n"&R1C17&RC[-18])&IF(RC[-17]="",,"|n"&R1C18&RC[-17])&IF(RC[-16]="",,"|n"&R1C19&RC[-16])&IF(RC[-15]="",,"|n"&R1C20&RC[-15])&IF(RC[-14]="",,"|n"&R1C21&RC[-14])&IF(RC[-13]="",,"|n"&R1C22&RC[-13])&IF(RC[-11]="",,"|n"&R1C24&RC[-11])&IF(RC[-10]="",,"|n"&R1C25&RC[-10])&IF(RC[-9]="",,"|n"&R1C26&RC[-9])&IF(RC[-8]="",,"|n"&R1C27&RC[-8])&IF(RC[-7]="",,"|n"&R1C28&RC[-7])&IF(RC[-6]="",,"|n"&R1C29&RC[-6])&IF(RC[-2]="",,"|n"&RC[-2]) -> 
AI353: =IF(RC[-27]&RC[-26]&RC[-25]&RC[-24]&RC[-23]&RC[-22]="",,R1C7)&IF(RC[-27]="",,"|n"&R1C8&RC[-27])&IF(RC[-26]="",,"|n"&R1C9&RC[-26])&IF(RC[-25]="",,"|n"&R1C10&RC[-25])&IF(RC[-24]="",,"|n"&R1C11&RC[-24])&IF(RC[-23]="",,"|n"&R1C12&RC[-23])&IF(RC[-22]="",,"|n"&R1C13&RC[-22])&IF(RC[-20]&RC[-19]&RC[-18]&RC[-17]="",,"|n"&R1C14)&IF(RC[-20]="",,"|n"&R1C15&RC[-20])&IF(RC[-19]="",,"|n"&R1C16&RC[-19])&IF(RC[-18]="",,"|n"&R1C17&RC[-18])&IF(RC[-17]="",,"|n"&R1C18&RC[-17])&IF(RC[-16]="",,"|n"&R1C19&RC[-16])&IF(RC[-15]="",,"|n"&R1C20&RC[-15])&IF(RC[-14]="",,"|n"&R1C21&RC[-14])&IF(RC[-13]="",,"|n"&R1C22&RC[-13])&IF(RC[-11]="",,"|n"&R1C24&RC[-11])&IF(RC[-10]="",,"|n"&R1C25&RC[-10])&IF(RC[-9]="",,"|n"&R1C26&RC[-9])&IF(RC[-8]="",,"|n"&R1C27&RC[-8])&IF(RC[-7]="",,"|n"&R1C28&RC[-7])&IF(RC[-6]="",,"|n"&R1C29&RC[-6])&IF(RC[-2]="",,"|n"&RC[-2]) -> 
AI354: =IF(RC[-27]&RC[-26]&RC[-25]&RC[-24]&RC[-23]&RC[-22]="",,R1C7)&IF(RC[-27]="",,"|n"&R1C8&RC[-27])&IF(RC[-26]="",,"|n"&R1C9&RC[-26])&IF(RC[-25]="",,"|n"&R1C10&RC[-25])&IF(RC[-24]="",,"|n"&R1C11&RC[-24])&IF(RC[-23]="",,"|n"&R1C12&RC[-23])&IF(RC[-22]="",,"|n"&R1C13&RC[-22])&IF(RC[-20]&RC[-19]&RC[-18]&RC[-17]="",,"|n"&R1C14)&IF(RC[-20]="",,"|n"&R1C15&RC[-20])&IF(RC[-19]="",,"|n"&R1C16&RC[-19])&IF(RC[-18]="",,"|n"&R1C17&RC[-18])&IF(RC[-17]="",,"|n"&R1C18&RC[-17])&IF(RC[-16]="",,"|n"&R1C19&RC[-16])&IF(RC[-15]="",,"|n"&R1C20&RC[-15])&IF(RC[-14]="",,"|n"&R1C21&RC[-14])&IF(RC[-13]="",,"|n"&R1C22&RC[-13])&IF(RC[-11]="",,"|n"&R1C24&RC[-11])&IF(RC[-10]="",,"|n"&R1C25&RC[-10])&IF(RC[-9]="",,"|n"&R1C26&RC[-9])&IF(RC[-8]="",,"|n"&R1C27&RC[-8])&IF(RC[-7]="",,"|n"&R1C28&RC[-7])&IF(RC[-6]="",,"|n"&R1C29&RC[-6])&IF(RC[-2]="",,"|n"&RC[-2]) -> 
AI355: =IF(RC[-27]&RC[-26]&RC[-25]&RC[-24]&RC[-23]&RC[-22]="",,R1C7)&IF(RC[-27]="",,"|n"&R1C8&RC[-27])&IF(RC[-26]="",,"|n"&R1C9&RC[-26])&IF(RC[-25]="",,"|n"&R1C10&RC[-25])&IF(RC[-24]="",,"|n"&R1C11&RC[-24])&IF(RC[-23]="",,"|n"&R1C12&RC[-23])&IF(RC[-22]="",,"|n"&R1C13&RC[-22])&IF(RC[-20]&RC[-19]&RC[-18]&RC[-17]="",,"|n"&R1C14)&IF(RC[-20]="",,"|n"&R1C15&RC[-20])&IF(RC[-19]="",,"|n"&R1C16&RC[-19])&IF(RC[-18]="",,"|n"&R1C17&RC[-18])&IF(RC[-17]="",,"|n"&R1C18&RC[-17])&IF(RC[-16]="",,"|n"&R1C19&RC[-16])&IF(RC[-15]="",,"|n"&R1C20&RC[-15])&IF(RC[-14]="",,"|n"&R1C21&RC[-14])&IF(RC[-13]="",,"|n"&R1C22&RC[-13])&IF(RC[-11]="",,"|n"&R1C24&RC[-11])&IF(RC[-10]="",,"|n"&R1C25&RC[-10])&IF(RC[-9]="",,"|n"&R1C26&RC[-9])&IF(RC[-8]="",,"|n"&R1C27&RC[-8])&IF(RC[-7]="",,"|n"&R1C28&RC[-7])&IF(RC[-6]="",,"|n"&R1C29&RC[-6])&IF(RC[-2]="",,"|n"&RC[-2]) -> 
AI356: =IF(RC[-27]&RC[-26]&RC[-25]&RC[-24]&RC[-23]&RC[-22]="",,R1C7)&IF(RC[-27]="",,"|n"&R1C8&RC[-27])&IF(RC[-26]="",,"|n"&R1C9&RC[-26])&IF(RC[-25]="",,"|n"&R1C10&RC[-25])&IF(RC[-24]="",,"|n"&R1C11&RC[-24])&IF(RC[-23]="",,"|n"&R1C12&RC[-23])&IF(RC[-22]="",,"|n"&R1C13&RC[-22])&IF(RC[-20]&RC[-19]&RC[-18]&RC[-17]="",,"|n"&R1C14)&IF(RC[-20]="",,"|n"&R1C15&RC[-20])&IF(RC[-19]="",,"|n"&R1C16&RC[-19])&IF(RC[-18]="",,"|n"&R1C17&RC[-18])&IF(RC[-17]="",,"|n"&R1C18&RC[-17])&IF(RC[-16]="",,"|n"&R1C19&RC[-16])&IF(RC[-15]="",,"|n"&R1C20&RC[-15])&IF(RC[-14]="",,"|n"&R1C21&RC[-14])&IF(RC[-13]="",,"|n"&R1C22&RC[-13])&IF(RC[-11]="",,"|n"&R1C24&RC[-11])&IF(RC[-10]="",,"|n"&R1C25&RC[-10])&IF(RC[-9]="",,"|n"&R1C26&RC[-9])&IF(RC[-8]="",,"|n"&R1C27&RC[-8])&IF(RC[-7]="",,"|n"&R1C28&RC[-7])&IF(RC[-6]="",,"|n"&R1C29&RC[-6])&IF(RC[-2]="",,"|n"&RC[-2]) -> 
AI357: =IF(RC[-27]&RC[-26]&RC[-25]&RC[-24]&RC[-23]&RC[-22]="",,R1C7)&IF(RC[-27]="",,"|n"&R1C8&RC[-27])&IF(RC[-26]="",,"|n"&R1C9&RC[-26])&IF(RC[-25]="",,"|n"&R1C10&RC[-25])&IF(RC[-24]="",,"|n"&R1C11&RC[-24])&IF(RC[-23]="",,"|n"&R1C12&RC[-23])&IF(RC[-22]="",,"|n"&R1C13&RC[-22])&IF(RC[-20]&RC[-19]&RC[-18]&RC[-17]="",,"|n"&R1C14)&IF(RC[-20]="",,"|n"&R1C15&RC[-20])&IF(RC[-19]="",,"|n"&R1C16&RC[-19])&IF(RC[-18]="",,"|n"&R1C17&RC[-18])&IF(RC[-17]="",,"|n"&R1C18&RC[-17])&IF(RC[-16]="",,"|n"&R1C19&RC[-16])&IF(RC[-15]="",,"|n"&R1C20&RC[-15])&IF(RC[-14]="",,"|n"&R1C21&RC[-14])&IF(RC[-13]="",,"|n"&R1C22&RC[-13])&IF(RC[-11]="",,"|n"&R1C24&RC[-11])&IF(RC[-10]="",,"|n"&R1C25&RC[-10])&IF(RC[-9]="",,"|n"&R1C26&RC[-9])&IF(RC[-8]="",,"|n"&R1C27&RC[-8])&IF(RC[-7]="",,"|n"&R1C28&RC[-7])&IF(RC[-6]="",,"|n"&R1C29&RC[-6])&IF(RC[-2]="",,"|n"&RC[-2]) -> 
AI358: =IF(RC[-27]&RC[-26]&RC[-25]&RC[-24]&RC[-23]&RC[-22]="",,R1C7)&IF(RC[-27]="",,"|n"&R1C8&RC[-27])&IF(RC[-26]="",,"|n"&R1C9&RC[-26])&IF(RC[-25]="",,"|n"&R1C10&RC[-25])&IF(RC[-24]="",,"|n"&R1C11&RC[-24])&IF(RC[-23]="",,"|n"&R1C12&RC[-23])&IF(RC[-22]="",,"|n"&R1C13&RC[-22])&IF(RC[-20]&RC[-19]&RC[-18]&RC[-17]="",,"|n"&R1C14)&IF(RC[-20]="",,"|n"&R1C15&RC[-20])&IF(RC[-19]="",,"|n"&R1C16&RC[-19])&IF(RC[-18]="",,"|n"&R1C17&RC[-18])&IF(RC[-17]="",,"|n"&R1C18&RC[-17])&IF(RC[-16]="",,"|n"&R1C19&RC[-16])&IF(RC[-15]="",,"|n"&R1C20&RC[-15])&IF(RC[-14]="",,"|n"&R1C21&RC[-14])&IF(RC[-13]="",,"|n"&R1C22&RC[-13])&IF(RC[-11]="",,"|n"&R1C24&RC[-11])&IF(RC[-10]="",,"|n"&R1C25&RC[-10])&IF(RC[-9]="",,"|n"&R1C26&RC[-9])&IF(RC[-8]="",,"|n"&R1C27&RC[-8])&IF(RC[-7]="",,"|n"&R1C28&RC[-7])&IF(RC[-6]="",,"|n"&R1C29&RC[-6])&IF(RC[-2]="",,"|n"&RC[-2]) -> 
AI359: =IF(RC[-27]&RC[-26]&RC[-25]&RC[-24]&RC[-23]&RC[-22]="",,R1C7)&IF(RC[-27]="",,"|n"&R1C8&RC[-27])&IF(RC[-26]="",,"|n"&R1C9&RC[-26])&IF(RC[-25]="",,"|n"&R1C10&RC[-25])&IF(RC[-24]="",,"|n"&R1C11&RC[-24])&IF(RC[-23]="",,"|n"&R1C12&RC[-23])&IF(RC[-22]="",,"|n"&R1C13&RC[-22])&IF(RC[-20]&RC[-19]&RC[-18]&RC[-17]="",,"|n"&R1C14)&IF(RC[-20]="",,"|n"&R1C15&RC[-20])&IF(RC[-19]="",,"|n"&R1C16&RC[-19])&IF(RC[-18]="",,"|n"&R1C17&RC[-18])&IF(RC[-17]="",,"|n"&R1C18&RC[-17])&IF(RC[-16]="",,"|n"&R1C19&RC[-16])&IF(RC[-15]="",,"|n"&R1C20&RC[-15])&IF(RC[-14]="",,"|n"&R1C21&RC[-14])&IF(RC[-13]="",,"|n"&R1C22&RC[-13])&IF(RC[-11]="",,"|n"&R1C24&RC[-11])&IF(RC[-10]="",,"|n"&R1C25&RC[-10])&IF(RC[-9]="",,"|n"&R1C26&RC[-9])&IF(RC[-8]="",,"|n"&R1C27&RC[-8])&IF(RC[-7]="",,"|n"&R1C28&RC[-7])&IF(RC[-6]="",,"|n"&R1C29&RC[-6])&IF(RC[-2]="",,"|n"&RC[-2]) -> 
AI360: =IF(RC[-27]&RC[-26]&RC[-25]&RC[-24]&RC[-23]&RC[-22]="",,R1C7)&IF(RC[-27]="",,"|n"&R1C8&RC[-27])&IF(RC[-26]="",,"|n"&R1C9&RC[-26])&IF(RC[-25]="",,"|n"&R1C10&RC[-25])&IF(RC[-24]="",,"|n"&R1C11&RC[-24])&IF(RC[-23]="",,"|n"&R1C12&RC[-23])&IF(RC[-22]="",,"|n"&R1C13&RC[-22])&IF(RC[-20]&RC[-19]&RC[-18]&RC[-17]="",,"|n"&R1C14)&IF(RC[-20]="",,"|n"&R1C15&RC[-20])&IF(RC[-19]="",,"|n"&R1C16&RC[-19])&IF(RC[-18]="",,"|n"&R1C17&RC[-18])&IF(RC[-17]="",,"|n"&R1C18&RC[-17])&IF(RC[-16]="",,"|n"&R1C19&RC[-16])&IF(RC[-15]="",,"|n"&R1C20&RC[-15])&IF(RC[-14]="",,"|n"&R1C21&RC[-14])&IF(RC[-13]="",,"|n"&R1C22&RC[-13])&IF(RC[-11]="",,"|n"&R1C24&RC[-11])&IF(RC[-10]="",,"|n"&R1C25&RC[-10])&IF(RC[-9]="",,"|n"&R1C26&RC[-9])&IF(RC[-8]="",,"|n"&R1C27&RC[-8])&IF(RC[-7]="",,"|n"&R1C28&RC[-7])&IF(RC[-6]="",,"|n"&R1C29&RC[-6])&IF(RC[-2]="",,"|n"&RC[-2]) -> 
AI361: =IF(RC[-27]&RC[-26]&RC[-25]&RC[-24]&RC[-23]&RC[-22]="",,R1C7)&IF(RC[-27]="",,"|n"&R1C8&RC[-27])&IF(RC[-26]="",,"|n"&R1C9&RC[-26])&IF(RC[-25]="",,"|n"&R1C10&RC[-25])&IF(RC[-24]="",,"|n"&R1C11&RC[-24])&IF(RC[-23]="",,"|n"&R1C12&RC[-23])&IF(RC[-22]="",,"|n"&R1C13&RC[-22])&IF(RC[-20]&RC[-19]&RC[-18]&RC[-17]="",,"|n"&R1C14)&IF(RC[-20]="",,"|n"&R1C15&RC[-20])&IF(RC[-19]="",,"|n"&R1C16&RC[-19])&IF(RC[-18]="",,"|n"&R1C17&RC[-18])&IF(RC[-17]="",,"|n"&R1C18&RC[-17])&IF(RC[-16]="",,"|n"&R1C19&RC[-16])&IF(RC[-15]="",,"|n"&R1C20&RC[-15])&IF(RC[-14]="",,"|n"&R1C21&RC[-14])&IF(RC[-13]="",,"|n"&R1C22&RC[-13])&IF(RC[-11]="",,"|n"&R1C24&RC[-11])&IF(RC[-10]="",,"|n"&R1C25&RC[-10])&IF(RC[-9]="",,"|n"&R1C26&RC[-9])&IF(RC[-8]="",,"|n"&R1C27&RC[-8])&IF(RC[-7]="",,"|n"&R1C28&RC[-7])&IF(RC[-6]="",,"|n"&R1C29&RC[-6])&IF(RC[-2]="",,"|n"&RC[-2]) -> 
AI362: =IF(RC[-27]&RC[-26]&RC[-25]&RC[-24]&RC[-23]&RC[-22]="",,R1C7)&IF(RC[-27]="",,"|n"&R1C8&RC[-27])&IF(RC[-26]="",,"|n"&R1C9&RC[-26])&IF(RC[-25]="",,"|n"&R1C10&RC[-25])&IF(RC[-24]="",,"|n"&R1C11&RC[-24])&IF(RC[-23]="",,"|n"&R1C12&RC[-23])&IF(RC[-22]="",,"|n"&R1C13&RC[-22])&IF(RC[-20]&RC[-19]&RC[-18]&RC[-17]="",,"|n"&R1C14)&IF(RC[-20]="",,"|n"&R1C15&RC[-20])&IF(RC[-19]="",,"|n"&R1C16&RC[-19])&IF(RC[-18]="",,"|n"&R1C17&RC[-18])&IF(RC[-17]="",,"|n"&R1C18&RC[-17])&IF(RC[-16]="",,"|n"&R1C19&RC[-16])&IF(RC[-15]="",,"|n"&R1C20&RC[-15])&IF(RC[-14]="",,"|n"&R1C21&RC[-14])&IF(RC[-13]="",,"|n"&R1C22&RC[-13])&IF(RC[-11]="",,"|n"&R1C24&RC[-11])&IF(RC[-10]="",,"|n"&R1C25&RC[-10])&IF(RC[-9]="",,"|n"&R1C26&RC[-9])&IF(RC[-8]="",,"|n"&R1C27&RC[-8])&IF(RC[-7]="",,"|n"&R1C28&RC[-7])&IF(RC[-6]="",,"|n"&R1C29&RC[-6])&IF(RC[-2]="",,"|n"&RC[-2]) -> 
AI363: =IF(RC[-27]&RC[-26]&RC[-25]&RC[-24]&RC[-23]&RC[-22]="",,R1C7)&IF(RC[-27]="",,"|n"&R1C8&RC[-27])&IF(RC[-26]="",,"|n"&R1C9&RC[-26])&IF(RC[-25]="",,"|n"&R1C10&RC[-25])&IF(RC[-24]="",,"|n"&R1C11&RC[-24])&IF(RC[-23]="",,"|n"&R1C12&RC[-23])&IF(RC[-22]="",,"|n"&R1C13&RC[-22])&IF(RC[-20]&RC[-19]&RC[-18]&RC[-17]="",,"|n"&R1C14)&IF(RC[-20]="",,"|n"&R1C15&RC[-20])&IF(RC[-19]="",,"|n"&R1C16&RC[-19])&IF(RC[-18]="",,"|n"&R1C17&RC[-18])&IF(RC[-17]="",,"|n"&R1C18&RC[-17])&IF(RC[-16]="",,"|n"&R1C19&RC[-16])&IF(RC[-15]="",,"|n"&R1C20&RC[-15])&IF(RC[-14]="",,"|n"&R1C21&RC[-14])&IF(RC[-13]="",,"|n"&R1C22&RC[-13])&IF(RC[-11]="",,"|n"&R1C24&RC[-11])&IF(RC[-10]="",,"|n"&R1C25&RC[-10])&IF(RC[-9]="",,"|n"&R1C26&RC[-9])&IF(RC[-8]="",,"|n"&R1C27&RC[-8])&IF(RC[-7]="",,"|n"&R1C28&RC[-7])&IF(RC[-6]="",,"|n"&R1C29&RC[-6])&IF(RC[-2]="",,"|n"&RC[-2]) -> 
AI364: =IF(RC[-27]&RC[-26]&RC[-25]&RC[-24]&RC[-23]&RC[-22]="",,R1C7)&IF(RC[-27]="",,"|n"&R1C8&RC[-27])&IF(RC[-26]="",,"|n"&R1C9&RC[-26])&IF(RC[-25]="",,"|n"&R1C10&RC[-25])&IF(RC[-24]="",,"|n"&R1C11&RC[-24])&IF(RC[-23]="",,"|n"&R1C12&RC[-23])&IF(RC[-22]="",,"|n"&R1C13&RC[-22])&IF(RC[-20]&RC[-19]&RC[-18]&RC[-17]="",,"|n"&R1C14)&IF(RC[-20]="",,"|n"&R1C15&RC[-20])&IF(RC[-19]="",,"|n"&R1C16&RC[-19])&IF(RC[-18]="",,"|n"&R1C17&RC[-18])&IF(RC[-17]="",,"|n"&R1C18&RC[-17])&IF(RC[-16]="",,"|n"&R1C19&RC[-16])&IF(RC[-15]="",,"|n"&R1C20&RC[-15])&IF(RC[-14]="",,"|n"&R1C21&RC[-14])&IF(RC[-13]="",,"|n"&R1C22&RC[-13])&IF(RC[-11]="",,"|n"&R1C24&RC[-11])&IF(RC[-10]="",,"|n"&R1C25&RC[-10])&IF(RC[-9]="",,"|n"&R1C26&RC[-9])&IF(RC[-8]="",,"|n"&R1C27&RC[-8])&IF(RC[-7]="",,"|n"&R1C28&RC[-7])&IF(RC[-6]="",,"|n"&R1C29&RC[-6])&IF(RC[-2]="",,"|n"&RC[-2]) -> 
AI365: =IF(RC[-27]&RC[-26]&RC[-25]&RC[-24]&RC[-23]&RC[-22]="",,R1C7)&IF(RC[-27]="",,"|n"&R1C8&RC[-27])&IF(RC[-26]="",,"|n"&R1C9&RC[-26])&IF(RC[-25]="",,"|n"&R1C10&RC[-25])&IF(RC[-24]="",,"|n"&R1C11&RC[-24])&IF(RC[-23]="",,"|n"&R1C12&RC[-23])&IF(RC[-22]="",,"|n"&R1C13&RC[-22])&IF(RC[-20]&RC[-19]&RC[-18]&RC[-17]="",,"|n"&R1C14)&IF(RC[-20]="",,"|n"&R1C15&RC[-20])&IF(RC[-19]="",,"|n"&R1C16&RC[-19])&IF(RC[-18]="",,"|n"&R1C17&RC[-18])&IF(RC[-17]="",,"|n"&R1C18&RC[-17])&IF(RC[-16]="",,"|n"&R1C19&RC[-16])&IF(RC[-15]="",,"|n"&R1C20&RC[-15])&IF(RC[-14]="",,"|n"&R1C21&RC[-14])&IF(RC[-13]="",,"|n"&R1C22&RC[-13])&IF(RC[-11]="",,"|n"&R1C24&RC[-11])&IF(RC[-10]="",,"|n"&R1C25&RC[-10])&IF(RC[-9]="",,"|n"&R1C26&RC[-9])&IF(RC[-8]="",,"|n"&R1C27&RC[-8])&IF(RC[-7]="",,"|n"&R1C28&RC[-7])&IF(RC[-6]="",,"|n"&R1C29&RC[-6])&IF(RC[-2]="",,"|n"&RC[-2]) -> 
AI366: =IF(RC[-27]&RC[-26]&RC[-25]&RC[-24]&RC[-23]&RC[-22]="",,R1C7)&IF(RC[-27]="",,"|n"&R1C8&RC[-27])&IF(RC[-26]="",,"|n"&R1C9&RC[-26])&IF(RC[-25]="",,"|n"&R1C10&RC[-25])&IF(RC[-24]="",,"|n"&R1C11&RC[-24])&IF(RC[-23]="",,"|n"&R1C12&RC[-23])&IF(RC[-22]="",,"|n"&R1C13&RC[-22])&IF(RC[-20]&RC[-19]&RC[-18]&RC[-17]="",,"|n"&R1C14)&IF(RC[-20]="",,"|n"&R1C15&RC[-20])&IF(RC[-19]="",,"|n"&R1C16&RC[-19])&IF(RC[-18]="",,"|n"&R1C17&RC[-18])&IF(RC[-17]="",,"|n"&R1C18&RC[-17])&IF(RC[-16]="",,"|n"&R1C19&RC[-16])&IF(RC[-15]="",,"|n"&R1C20&RC[-15])&IF(RC[-14]="",,"|n"&R1C21&RC[-14])&IF(RC[-13]="",,"|n"&R1C22&RC[-13])&IF(RC[-11]="",,"|n"&R1C24&RC[-11])&IF(RC[-10]="",,"|n"&R1C25&RC[-10])&IF(RC[-9]="",,"|n"&R1C26&RC[-9])&IF(RC[-8]="",,"|n"&R1C27&RC[-8])&IF(RC[-7]="",,"|n"&R1C28&RC[-7])&IF(RC[-6]="",,"|n"&R1C29&RC[-6])&IF(RC[-2]="",,"|n"&RC[-2]) -> 
AI367: =IF(RC[-27]&RC[-26]&RC[-25]&RC[-24]&RC[-23]&RC[-22]="",,R1C7)&IF(RC[-27]="",,"|n"&R1C8&RC[-27])&IF(RC[-26]="",,"|n"&R1C9&RC[-26])&IF(RC[-25]="",,"|n"&R1C10&RC[-25])&IF(RC[-24]="",,"|n"&R1C11&RC[-24])&IF(RC[-23]="",,"|n"&R1C12&RC[-23])&IF(RC[-22]="",,"|n"&R1C13&RC[-22])&IF(RC[-20]&RC[-19]&RC[-18]&RC[-17]="",,"|n"&R1C14)&IF(RC[-20]="",,"|n"&R1C15&RC[-20])&IF(RC[-19]="",,"|n"&R1C16&RC[-19])&IF(RC[-18]="",,"|n"&R1C17&RC[-18])&IF(RC[-17]="",,"|n"&R1C18&RC[-17])&IF(RC[-16]="",,"|n"&R1C19&RC[-16])&IF(RC[-15]="",,"|n"&R1C20&RC[-15])&IF(RC[-14]="",,"|n"&R1C21&RC[-14])&IF(RC[-13]="",,"|n"&R1C22&RC[-13])&IF(RC[-11]="",,"|n"&R1C24&RC[-11])&IF(RC[-10]="",,"|n"&R1C25&RC[-10])&IF(RC[-9]="",,"|n"&R1C26&RC[-9])&IF(RC[-8]="",,"|n"&R1C27&RC[-8])&IF(RC[-7]="",,"|n"&R1C28&RC[-7])&IF(RC[-6]="",,"|n"&R1C29&RC[-6])&IF(RC[-2]="",,"|n"&RC[-2]) -> 
AI368: =IF(RC[-27]&RC[-26]&RC[-25]&RC[-24]&RC[-23]&RC[-22]="",,R1C7)&IF(RC[-27]="",,"|n"&R1C8&RC[-27])&IF(RC[-26]="",,"|n"&R1C9&RC[-26])&IF(RC[-25]="",,"|n"&R1C10&RC[-25])&IF(RC[-24]="",,"|n"&R1C11&RC[-24])&IF(RC[-23]="",,"|n"&R1C12&RC[-23])&IF(RC[-22]="",,"|n"&R1C13&RC[-22])&IF(RC[-20]&RC[-19]&RC[-18]&RC[-17]="",,"|n"&R1C14)&IF(RC[-20]="",,"|n"&R1C15&RC[-20])&IF(RC[-19]="",,"|n"&R1C16&RC[-19])&IF(RC[-18]="",,"|n"&R1C17&RC[-18])&IF(RC[-17]="",,"|n"&R1C18&RC[-17])&IF(RC[-16]="",,"|n"&R1C19&RC[-16])&IF(RC[-15]="",,"|n"&R1C20&RC[-15])&IF(RC[-14]="",,"|n"&R1C21&RC[-14])&IF(RC[-13]="",,"|n"&R1C22&RC[-13])&IF(RC[-11]="",,"|n"&R1C24&RC[-11])&IF(RC[-10]="",,"|n"&R1C25&RC[-10])&IF(RC[-9]="",,"|n"&R1C26&RC[-9])&IF(RC[-8]="",,"|n"&R1C27&RC[-8])&IF(RC[-7]="",,"|n"&R1C28&RC[-7])&IF(RC[-6]="",,"|n"&R1C29&RC[-6])&IF(RC[-2]="",,"|n"&RC[-2]) -> 
AI369: =IF(RC[-27]&RC[-26]&RC[-25]&RC[-24]&RC[-23]&RC[-22]="",,R1C7)&IF(RC[-27]="",,"|n"&R1C8&RC[-27])&IF(RC[-26]="",,"|n"&R1C9&RC[-26])&IF(RC[-25]="",,"|n"&R1C10&RC[-25])&IF(RC[-24]="",,"|n"&R1C11&RC[-24])&IF(RC[-23]="",,"|n"&R1C12&RC[-23])&IF(RC[-22]="",,"|n"&R1C13&RC[-22])&IF(RC[-20]&RC[-19]&RC[-18]&RC[-17]="",,"|n"&R1C14)&IF(RC[-20]="",,"|n"&R1C15&RC[-20])&IF(RC[-19]="",,"|n"&R1C16&RC[-19])&IF(RC[-18]="",,"|n"&R1C17&RC[-18])&IF(RC[-17]="",,"|n"&R1C18&RC[-17])&IF(RC[-16]="",,"|n"&R1C19&RC[-16])&IF(RC[-15]="",,"|n"&R1C20&RC[-15])&IF(RC[-14]="",,"|n"&R1C21&RC[-14])&IF(RC[-13]="",,"|n"&R1C22&RC[-13])&IF(RC[-11]="",,"|n"&R1C24&RC[-11])&IF(RC[-10]="",,"|n"&R1C25&RC[-10])&IF(RC[-9]="",,"|n"&R1C26&RC[-9])&IF(RC[-8]="",,"|n"&R1C27&RC[-8])&IF(RC[-7]="",,"|n"&R1C28&RC[-7])&IF(RC[-6]="",,"|n"&R1C29&RC[-6])&IF(RC[-2]="",,"|n"&RC[-2]) -> 
AI370: =IF(RC[-27]&RC[-26]&RC[-25]&RC[-24]&RC[-23]&RC[-22]="",,R1C7)&IF(RC[-27]="",,"|n"&R1C8&RC[-27])&IF(RC[-26]="",,"|n"&R1C9&RC[-26])&IF(RC[-25]="",,"|n"&R1C10&RC[-25])&IF(RC[-24]="",,"|n"&R1C11&RC[-24])&IF(RC[-23]="",,"|n"&R1C12&RC[-23])&IF(RC[-22]="",,"|n"&R1C13&RC[-22])&IF(RC[-20]&RC[-19]&RC[-18]&RC[-17]="",,"|n"&R1C14)&IF(RC[-20]="",,"|n"&R1C15&RC[-20])&IF(RC[-19]="",,"|n"&R1C16&RC[-19])&IF(RC[-18]="",,"|n"&R1C17&RC[-18])&IF(RC[-17]="",,"|n"&R1C18&RC[-17])&IF(RC[-16]="",,"|n"&R1C19&RC[-16])&IF(RC[-15]="",,"|n"&R1C20&RC[-15])&IF(RC[-14]="",,"|n"&R1C21&RC[-14])&IF(RC[-13]="",,"|n"&R1C22&RC[-13])&IF(RC[-11]="",,"|n"&R1C24&RC[-11])&IF(RC[-10]="",,"|n"&R1C25&RC[-10])&IF(RC[-9]="",,"|n"&R1C26&RC[-9])&IF(RC[-8]="",,"|n"&R1C27&RC[-8])&IF(RC[-7]="",,"|n"&R1C28&RC[-7])&IF(RC[-6]="",,"|n"&R1C29&RC[-6])&IF(RC[-2]="",,"|n"&RC[-2]) -> 
AI371: =IF(RC[-27]&RC[-26]&RC[-25]&RC[-24]&RC[-23]&RC[-22]="",,R1C7)&IF(RC[-27]="",,"|n"&R1C8&RC[-27])&IF(RC[-26]="",,"|n"&R1C9&RC[-26])&IF(RC[-25]="",,"|n"&R1C10&RC[-25])&IF(RC[-24]="",,"|n"&R1C11&RC[-24])&IF(RC[-23]="",,"|n"&R1C12&RC[-23])&IF(RC[-22]="",,"|n"&R1C13&RC[-22])&IF(RC[-20]&RC[-19]&RC[-18]&RC[-17]="",,"|n"&R1C14)&IF(RC[-20]="",,"|n"&R1C15&RC[-20])&IF(RC[-19]="",,"|n"&R1C16&RC[-19])&IF(RC[-18]="",,"|n"&R1C17&RC[-18])&IF(RC[-17]="",,"|n"&R1C18&RC[-17])&IF(RC[-16]="",,"|n"&R1C19&RC[-16])&IF(RC[-15]="",,"|n"&R1C20&RC[-15])&IF(RC[-14]="",,"|n"&R1C21&RC[-14])&IF(RC[-13]="",,"|n"&R1C22&RC[-13])&IF(RC[-11]="",,"|n"&R1C24&RC[-11])&IF(RC[-10]="",,"|n"&R1C25&RC[-10])&IF(RC[-9]="",,"|n"&R1C26&RC[-9])&IF(RC[-8]="",,"|n"&R1C27&RC[-8])&IF(RC[-7]="",,"|n"&R1C28&RC[-7])&IF(RC[-6]="",,"|n"&R1C29&RC[-6])&IF(RC[-2]="",,"|n"&RC[-2]) -> 
AI372: =IF(RC[-27]&RC[-26]&RC[-25]&RC[-24]&RC[-23]&RC[-22]="",,R1C7)&IF(RC[-27]="",,"|n"&R1C8&RC[-27])&IF(RC[-26]="",,"|n"&R1C9&RC[-26])&IF(RC[-25]="",,"|n"&R1C10&RC[-25])&IF(RC[-24]="",,"|n"&R1C11&RC[-24])&IF(RC[-23]="",,"|n"&R1C12&RC[-23])&IF(RC[-22]="",,"|n"&R1C13&RC[-22])&IF(RC[-20]&RC[-19]&RC[-18]&RC[-17]="",,"|n"&R1C14)&IF(RC[-20]="",,"|n"&R1C15&RC[-20])&IF(RC[-19]="",,"|n"&R1C16&RC[-19])&IF(RC[-18]="",,"|n"&R1C17&RC[-18])&IF(RC[-17]="",,"|n"&R1C18&RC[-17])&IF(RC[-16]="",,"|n"&R1C19&RC[-16])&IF(RC[-15]="",,"|n"&R1C20&RC[-15])&IF(RC[-14]="",,"|n"&R1C21&RC[-14])&IF(RC[-13]="",,"|n"&R1C22&RC[-13])&IF(RC[-11]="",,"|n"&R1C24&RC[-11])&IF(RC[-10]="",,"|n"&R1C25&RC[-10])&IF(RC[-9]="",,"|n"&R1C26&RC[-9])&IF(RC[-8]="",,"|n"&R1C27&RC[-8])&IF(RC[-7]="",,"|n"&R1C28&RC[-7])&IF(RC[-6]="",,"|n"&R1C29&RC[-6])&IF(RC[-2]="",,"|n"&RC[-2]) -> 
AI373: =IF(RC[-27]&RC[-26]&RC[-25]&RC[-24]&RC[-23]&RC[-22]="",,R1C7)&IF(RC[-27]="",,"|n"&R1C8&RC[-27])&IF(RC[-26]="",,"|n"&R1C9&RC[-26])&IF(RC[-25]="",,"|n"&R1C10&RC[-25])&IF(RC[-24]="",,"|n"&R1C11&RC[-24])&IF(RC[-23]="",,"|n"&R1C12&RC[-23])&IF(RC[-22]="",,"|n"&R1C13&RC[-22])&IF(RC[-20]&RC[-19]&RC[-18]&RC[-17]="",,"|n"&R1C14)&IF(RC[-20]="",,"|n"&R1C15&RC[-20])&IF(RC[-19]="",,"|n"&R1C16&RC[-19])&IF(RC[-18]="",,"|n"&R1C17&RC[-18])&IF(RC[-17]="",,"|n"&R1C18&RC[-17])&IF(RC[-16]="",,"|n"&R1C19&RC[-16])&IF(RC[-15]="",,"|n"&R1C20&RC[-15])&IF(RC[-14]="",,"|n"&R1C21&RC[-14])&IF(RC[-13]="",,"|n"&R1C22&RC[-13])&IF(RC[-11]="",,"|n"&R1C24&RC[-11])&IF(RC[-10]="",,"|n"&R1C25&RC[-10])&IF(RC[-9]="",,"|n"&R1C26&RC[-9])&IF(RC[-8]="",,"|n"&R1C27&RC[-8])&IF(RC[-7]="",,"|n"&R1C28&RC[-7])&IF(RC[-6]="",,"|n"&R1C29&RC[-6])&IF(RC[-2]="",,"|n"&RC[-2]) -> 
AI374: =IF(RC[-27]&RC[-26]&RC[-25]&RC[-24]&RC[-23]&RC[-22]="",,R1C7)&IF(RC[-27]="",,"|n"&R1C8&RC[-27])&IF(RC[-26]="",,"|n"&R1C9&RC[-26])&IF(RC[-25]="",,"|n"&R1C10&RC[-25])&IF(RC[-24]="",,"|n"&R1C11&RC[-24])&IF(RC[-23]="",,"|n"&R1C12&RC[-23])&IF(RC[-22]="",,"|n"&R1C13&RC[-22])&IF(RC[-20]&RC[-19]&RC[-18]&RC[-17]="",,"|n"&R1C14)&IF(RC[-20]="",,"|n"&R1C15&RC[-20])&IF(RC[-19]="",,"|n"&R1C16&RC[-19])&IF(RC[-18]="",,"|n"&R1C17&RC[-18])&IF(RC[-17]="",,"|n"&R1C18&RC[-17])&IF(RC[-16]="",,"|n"&R1C19&RC[-16])&IF(RC[-15]="",,"|n"&R1C20&RC[-15])&IF(RC[-14]="",,"|n"&R1C21&RC[-14])&IF(RC[-13]="",,"|n"&R1C22&RC[-13])&IF(RC[-11]="",,"|n"&R1C24&RC[-11])&IF(RC[-10]="",,"|n"&R1C25&RC[-10])&IF(RC[-9]="",,"|n"&R1C26&RC[-9])&IF(RC[-8]="",,"|n"&R1C27&RC[-8])&IF(RC[-7]="",,"|n"&R1C28&RC[-7])&IF(RC[-6]="",,"|n"&R1C29&RC[-6])&IF(RC[-2]="",,"|n"&RC[-2]) -> 
AI375: =IF(RC[-27]&RC[-26]&RC[-25]&RC[-24]&RC[-23]&RC[-22]="",,R1C7)&IF(RC[-27]="",,"|n"&R1C8&RC[-27])&IF(RC[-26]="",,"|n"&R1C9&RC[-26])&IF(RC[-25]="",,"|n"&R1C10&RC[-25])&IF(RC[-24]="",,"|n"&R1C11&RC[-24])&IF(RC[-23]="",,"|n"&R1C12&RC[-23])&IF(RC[-22]="",,"|n"&R1C13&RC[-22])&IF(RC[-20]&RC[-19]&RC[-18]&RC[-17]="",,"|n"&R1C14)&IF(RC[-20]="",,"|n"&R1C15&RC[-20])&IF(RC[-19]="",,"|n"&R1C16&RC[-19])&IF(RC[-18]="",,"|n"&R1C17&RC[-18])&IF(RC[-17]="",,"|n"&R1C18&RC[-17])&IF(RC[-16]="",,"|n"&R1C19&RC[-16])&IF(RC[-15]="",,"|n"&R1C20&RC[-15])&IF(RC[-14]="",,"|n"&R1C21&RC[-14])&IF(RC[-13]="",,"|n"&R1C22&RC[-13])&IF(RC[-11]="",,"|n"&R1C24&RC[-11])&IF(RC[-10]="",,"|n"&R1C25&RC[-10])&IF(RC[-9]="",,"|n"&R1C26&RC[-9])&IF(RC[-8]="",,"|n"&R1C27&RC[-8])&IF(RC[-7]="",,"|n"&R1C28&RC[-7])&IF(RC[-6]="",,"|n"&R1C29&RC[-6])&IF(RC[-2]="",,"|n"&RC[-2]) -> 
AI376: =IF(RC[-27]&RC[-26]&RC[-25]&RC[-24]&RC[-23]&RC[-22]="",,R1C7)&IF(RC[-27]="",,"|n"&R1C8&RC[-27])&IF(RC[-26]="",,"|n"&R1C9&RC[-26])&IF(RC[-25]="",,"|n"&R1C10&RC[-25])&IF(RC[-24]="",,"|n"&R1C11&RC[-24])&IF(RC[-23]="",,"|n"&R1C12&RC[-23])&IF(RC[-22]="",,"|n"&R1C13&RC[-22])&IF(RC[-20]&RC[-19]&RC[-18]&RC[-17]="",,"|n"&R1C14)&IF(RC[-20]="",,"|n"&R1C15&RC[-20])&IF(RC[-19]="",,"|n"&R1C16&RC[-19])&IF(RC[-18]="",,"|n"&R1C17&RC[-18])&IF(RC[-17]="",,"|n"&R1C18&RC[-17])&IF(RC[-16]="",,"|n"&R1C19&RC[-16])&IF(RC[-15]="",,"|n"&R1C20&RC[-15])&IF(RC[-14]="",,"|n"&R1C21&RC[-14])&IF(RC[-13]="",,"|n"&R1C22&RC[-13])&IF(RC[-11]="",,"|n"&R1C24&RC[-11])&IF(RC[-10]="",,"|n"&R1C25&RC[-10])&IF(RC[-9]="",,"|n"&R1C26&RC[-9])&IF(RC[-8]="",,"|n"&R1C27&RC[-8])&IF(RC[-7]="",,"|n"&R1C28&RC[-7])&IF(RC[-6]="",,"|n"&R1C29&RC[-6])&IF(RC[-2]="",,"|n"&RC[-2]) -> 
AI377: =IF(RC[-27]&RC[-26]&RC[-25]&RC[-24]&RC[-23]&RC[-22]="",,R1C7)&IF(RC[-27]="",,"|n"&R1C8&RC[-27])&IF(RC[-26]="",,"|n"&R1C9&RC[-26])&IF(RC[-25]="",,"|n"&R1C10&RC[-25])&IF(RC[-24]="",,"|n"&R1C11&RC[-24])&IF(RC[-23]="",,"|n"&R1C12&RC[-23])&IF(RC[-22]="",,"|n"&R1C13&RC[-22])&IF(RC[-20]&RC[-19]&RC[-18]&RC[-17]="",,"|n"&R1C14)&IF(RC[-20]="",,"|n"&R1C15&RC[-20])&IF(RC[-19]="",,"|n"&R1C16&RC[-19])&IF(RC[-18]="",,"|n"&R1C17&RC[-18])&IF(RC[-17]="",,"|n"&R1C18&RC[-17])&IF(RC[-16]="",,"|n"&R1C19&RC[-16])&IF(RC[-15]="",,"|n"&R1C20&RC[-15])&IF(RC[-14]="",,"|n"&R1C21&RC[-14])&IF(RC[-13]="",,"|n"&R1C22&RC[-13])&IF(RC[-11]="",,"|n"&R1C24&RC[-11])&IF(RC[-10]="",,"|n"&R1C25&RC[-10])&IF(RC[-9]="",,"|n"&R1C26&RC[-9])&IF(RC[-8]="",,"|n"&R1C27&RC[-8])&IF(RC[-7]="",,"|n"&R1C28&RC[-7])&IF(RC[-6]="",,"|n"&R1C29&RC[-6])&IF(RC[-2]="",,"|n"&RC[-2]) -> 
AI378: =IF(RC[-27]&RC[-26]&RC[-25]&RC[-24]&RC[-23]&RC[-22]="",,R1C7)&IF(RC[-27]="",,"|n"&R1C8&RC[-27])&IF(RC[-26]="",,"|n"&R1C9&RC[-26])&IF(RC[-25]="",,"|n"&R1C10&RC[-25])&IF(RC[-24]="",,"|n"&R1C11&RC[-24])&IF(RC[-23]="",,"|n"&R1C12&RC[-23])&IF(RC[-22]="",,"|n"&R1C13&RC[-22])&IF(RC[-20]&RC[-19]&RC[-18]&RC[-17]="",,"|n"&R1C14)&IF(RC[-20]="",,"|n"&R1C15&RC[-20])&IF(RC[-19]="",,"|n"&R1C16&RC[-19])&IF(RC[-18]="",,"|n"&R1C17&RC[-18])&IF(RC[-17]="",,"|n"&R1C18&RC[-17])&IF(RC[-16]="",,"|n"&R1C19&RC[-16])&IF(RC[-15]="",,"|n"&R1C20&RC[-15])&IF(RC[-14]="",,"|n"&R1C21&RC[-14])&IF(RC[-13]="",,"|n"&R1C22&RC[-13])&IF(RC[-11]="",,"|n"&R1C24&RC[-11])&IF(RC[-10]="",,"|n"&R1C25&RC[-10])&IF(RC[-9]="",,"|n"&R1C26&RC[-9])&IF(RC[-8]="",,"|n"&R1C27&RC[-8])&IF(RC[-7]="",,"|n"&R1C28&RC[-7])&IF(RC[-6]="",,"|n"&R1C29&RC[-6])&IF(RC[-2]="",,"|n"&RC[-2]) -> 
AI379: =IF(RC[-27]&RC[-26]&RC[-25]&RC[-24]&RC[-23]&RC[-22]="",,R1C7)&IF(RC[-27]="",,"|n"&R1C8&RC[-27])&IF(RC[-26]="",,"|n"&R1C9&RC[-26])&IF(RC[-25]="",,"|n"&R1C10&RC[-25])&IF(RC[-24]="",,"|n"&R1C11&RC[-24])&IF(RC[-23]="",,"|n"&R1C12&RC[-23])&IF(RC[-22]="",,"|n"&R1C13&RC[-22])&IF(RC[-20]&RC[-19]&RC[-18]&RC[-17]="",,"|n"&R1C14)&IF(RC[-20]="",,"|n"&R1C15&RC[-20])&IF(RC[-19]="",,"|n"&R1C16&RC[-19])&IF(RC[-18]="",,"|n"&R1C17&RC[-18])&IF(RC[-17]="",,"|n"&R1C18&RC[-17])&IF(RC[-16]="",,"|n"&R1C19&RC[-16])&IF(RC[-15]="",,"|n"&R1C20&RC[-15])&IF(RC[-14]="",,"|n"&R1C21&RC[-14])&IF(RC[-13]="",,"|n"&R1C22&RC[-13])&IF(RC[-11]="",,"|n"&R1C24&RC[-11])&IF(RC[-10]="",,"|n"&R1C25&RC[-10])&IF(RC[-9]="",,"|n"&R1C26&RC[-9])&IF(RC[-8]="",,"|n"&R1C27&RC[-8])&IF(RC[-7]="",,"|n"&R1C28&RC[-7])&IF(RC[-6]="",,"|n"&R1C29&RC[-6])&IF(RC[-2]="",,"|n"&RC[-2]) -> 
AI380: =IF(RC[-27]&RC[-26]&RC[-25]&RC[-24]&RC[-23]&RC[-22]="",,R1C7)&IF(RC[-27]="",,"|n"&R1C8&RC[-27])&IF(RC[-26]="",,"|n"&R1C9&RC[-26])&IF(RC[-25]="",,"|n"&R1C10&RC[-25])&IF(RC[-24]="",,"|n"&R1C11&RC[-24])&IF(RC[-23]="",,"|n"&R1C12&RC[-23])&IF(RC[-22]="",,"|n"&R1C13&RC[-22])&IF(RC[-20]&RC[-19]&RC[-18]&RC[-17]="",,"|n"&R1C14)&IF(RC[-20]="",,"|n"&R1C15&RC[-20])&IF(RC[-19]="",,"|n"&R1C16&RC[-19])&IF(RC[-18]="",,"|n"&R1C17&RC[-18])&IF(RC[-17]="",,"|n"&R1C18&RC[-17])&IF(RC[-16]="",,"|n"&R1C19&RC[-16])&IF(RC[-15]="",,"|n"&R1C20&RC[-15])&IF(RC[-14]="",,"|n"&R1C21&RC[-14])&IF(RC[-13]="",,"|n"&R1C22&RC[-13])&IF(RC[-11]="",,"|n"&R1C24&RC[-11])&IF(RC[-10]="",,"|n"&R1C25&RC[-10])&IF(RC[-9]="",,"|n"&R1C26&RC[-9])&IF(RC[-8]="",,"|n"&R1C27&RC[-8])&IF(RC[-7]="",,"|n"&R1C28&RC[-7])&IF(RC[-6]="",,"|n"&R1C29&RC[-6])&IF(RC[-2]="",,"|n"&RC[-2]) -> 
AI381: =IF(RC[-27]&RC[-26]&RC[-25]&RC[-24]&RC[-23]&RC[-22]="",,R1C7)&IF(RC[-27]="",,"|n"&R1C8&RC[-27])&IF(RC[-26]="",,"|n"&R1C9&RC[-26])&IF(RC[-25]="",,"|n"&R1C10&RC[-25])&IF(RC[-24]="",,"|n"&R1C11&RC[-24])&IF(RC[-23]="",,"|n"&R1C12&RC[-23])&IF(RC[-22]="",,"|n"&R1C13&RC[-22])&IF(RC[-20]&RC[-19]&RC[-18]&RC[-17]="",,"|n"&R1C14)&IF(RC[-20]="",,"|n"&R1C15&RC[-20])&IF(RC[-19]="",,"|n"&R1C16&RC[-19])&IF(RC[-18]="",,"|n"&R1C17&RC[-18])&IF(RC[-17]="",,"|n"&R1C18&RC[-17])&IF(RC[-16]="",,"|n"&R1C19&RC[-16])&IF(RC[-15]="",,"|n"&R1C20&RC[-15])&IF(RC[-14]="",,"|n"&R1C21&RC[-14])&IF(RC[-13]="",,"|n"&R1C22&RC[-13])&IF(RC[-11]="",,"|n"&R1C24&RC[-11])&IF(RC[-10]="",,"|n"&R1C25&RC[-10])&IF(RC[-9]="",,"|n"&R1C26&RC[-9])&IF(RC[-8]="",,"|n"&R1C27&RC[-8])&IF(RC[-7]="",,"|n"&R1C28&RC[-7])&IF(RC[-6]="",,"|n"&R1C29&RC[-6])&IF(RC[-2]="",,"|n"&RC[-2]) -> 
AI382: =IF(RC[-27]&RC[-26]&RC[-25]&RC[-24]&RC[-23]&RC[-22]="",,R1C7)&IF(RC[-27]="",,"|n"&R1C8&RC[-27])&IF(RC[-26]="",,"|n"&R1C9&RC[-26])&IF(RC[-25]="",,"|n"&R1C10&RC[-25])&IF(RC[-24]="",,"|n"&R1C11&RC[-24])&IF(RC[-23]="",,"|n"&R1C12&RC[-23])&IF(RC[-22]="",,"|n"&R1C13&RC[-22])&IF(RC[-20]&RC[-19]&RC[-18]&RC[-17]="",,"|n"&R1C14)&IF(RC[-20]="",,"|n"&R1C15&RC[-20])&IF(RC[-19]="",,"|n"&R1C16&RC[-19])&IF(RC[-18]="",,"|n"&R1C17&RC[-18])&IF(RC[-17]="",,"|n"&R1C18&RC[-17])&IF(RC[-16]="",,"|n"&R1C19&RC[-16])&IF(RC[-15]="",,"|n"&R1C20&RC[-15])&IF(RC[-14]="",,"|n"&R1C21&RC[-14])&IF(RC[-13]="",,"|n"&R1C22&RC[-13])&IF(RC[-11]="",,"|n"&R1C24&RC[-11])&IF(RC[-10]="",,"|n"&R1C25&RC[-10])&IF(RC[-9]="",,"|n"&R1C26&RC[-9])&IF(RC[-8]="",,"|n"&R1C27&RC[-8])&IF(RC[-7]="",,"|n"&R1C28&RC[-7])&IF(RC[-6]="",,"|n"&R1C29&RC[-6])&IF(RC[-2]="",,"|n"&RC[-2]) -> 
AI383: =IF(RC[-27]&RC[-26]&RC[-25]&RC[-24]&RC[-23]&RC[-22]="",,R1C7)&IF(RC[-27]="",,"|n"&R1C8&RC[-27])&IF(RC[-26]="",,"|n"&R1C9&RC[-26])&IF(RC[-25]="",,"|n"&R1C10&RC[-25])&IF(RC[-24]="",,"|n"&R1C11&RC[-24])&IF(RC[-23]="",,"|n"&R1C12&RC[-23])&IF(RC[-22]="",,"|n"&R1C13&RC[-22])&IF(RC[-20]&RC[-19]&RC[-18]&RC[-17]="",,"|n"&R1C14)&IF(RC[-20]="",,"|n"&R1C15&RC[-20])&IF(RC[-19]="",,"|n"&R1C16&RC[-19])&IF(RC[-18]="",,"|n"&R1C17&RC[-18])&IF(RC[-17]="",,"|n"&R1C18&RC[-17])&IF(RC[-16]="",,"|n"&R1C19&RC[-16])&IF(RC[-15]="",,"|n"&R1C20&RC[-15])&IF(RC[-14]="",,"|n"&R1C21&RC[-14])&IF(RC[-13]="",,"|n"&R1C22&RC[-13])&IF(RC[-11]="",,"|n"&R1C24&RC[-11])&IF(RC[-10]="",,"|n"&R1C25&RC[-10])&IF(RC[-9]="",,"|n"&R1C26&RC[-9])&IF(RC[-8]="",,"|n"&R1C27&RC[-8])&IF(RC[-7]="",,"|n"&R1C28&RC[-7])&IF(RC[-6]="",,"|n"&R1C29&RC[-6])&IF(RC[-2]="",,"|n"&RC[-2]) -> 
AI384: =IF(RC[-27]&RC[-26]&RC[-25]&RC[-24]&RC[-23]&RC[-22]="",,R1C7)&IF(RC[-27]="",,"|n"&R1C8&RC[-27])&IF(RC[-26]="",,"|n"&R1C9&RC[-26])&IF(RC[-25]="",,"|n"&R1C10&RC[-25])&IF(RC[-24]="",,"|n"&R1C11&RC[-24])&IF(RC[-23]="",,"|n"&R1C12&RC[-23])&IF(RC[-22]="",,"|n"&R1C13&RC[-22])&IF(RC[-20]&RC[-19]&RC[-18]&RC[-17]="",,"|n"&R1C14)&IF(RC[-20]="",,"|n"&R1C15&RC[-20])&IF(RC[-19]="",,"|n"&R1C16&RC[-19])&IF(RC[-18]="",,"|n"&R1C17&RC[-18])&IF(RC[-17]="",,"|n"&R1C18&RC[-17])&IF(RC[-16]="",,"|n"&R1C19&RC[-16])&IF(RC[-15]="",,"|n"&R1C20&RC[-15])&IF(RC[-14]="",,"|n"&R1C21&RC[-14])&IF(RC[-13]="",,"|n"&R1C22&RC[-13])&IF(RC[-11]="",,"|n"&R1C24&RC[-11])&IF(RC[-10]="",,"|n"&R1C25&RC[-10])&IF(RC[-9]="",,"|n"&R1C26&RC[-9])&IF(RC[-8]="",,"|n"&R1C27&RC[-8])&IF(RC[-7]="",,"|n"&R1C28&RC[-7])&IF(RC[-6]="",,"|n"&R1C29&RC[-6])&IF(RC[-2]="",,"|n"&RC[-2]) -> 
AI385: =IF(RC[-27]&RC[-26]&RC[-25]&RC[-24]&RC[-23]&RC[-22]="",,R1C7)&IF(RC[-27]="",,"|n"&R1C8&RC[-27])&IF(RC[-26]="",,"|n"&R1C9&RC[-26])&IF(RC[-25]="",,"|n"&R1C10&RC[-25])&IF(RC[-24]="",,"|n"&R1C11&RC[-24])&IF(RC[-23]="",,"|n"&R1C12&RC[-23])&IF(RC[-22]="",,"|n"&R1C13&RC[-22])&IF(RC[-20]&RC[-19]&RC[-18]&RC[-17]="",,"|n"&R1C14)&IF(RC[-20]="",,"|n"&R1C15&RC[-20])&IF(RC[-19]="",,"|n"&R1C16&RC[-19])&IF(RC[-18]="",,"|n"&R1C17&RC[-18])&IF(RC[-17]="",,"|n"&R1C18&RC[-17])&IF(RC[-16]="",,"|n"&R1C19&RC[-16])&IF(RC[-15]="",,"|n"&R1C20&RC[-15])&IF(RC[-14]="",,"|n"&R1C21&RC[-14])&IF(RC[-13]="",,"|n"&R1C22&RC[-13])&IF(RC[-11]="",,"|n"&R1C24&RC[-11])&IF(RC[-10]="",,"|n"&R1C25&RC[-10])&IF(RC[-9]="",,"|n"&R1C26&RC[-9])&IF(RC[-8]="",,"|n"&R1C27&RC[-8])&IF(RC[-7]="",,"|n"&R1C28&RC[-7])&IF(RC[-6]="",,"|n"&R1C29&RC[-6])&IF(RC[-2]="",,"|n"&RC[-2]) -> 
AI386: =IF(RC[-27]&RC[-26]&RC[-25]&RC[-24]&RC[-23]&RC[-22]="",,R1C7)&IF(RC[-27]="",,"|n"&R1C8&RC[-27])&IF(RC[-26]="",,"|n"&R1C9&RC[-26])&IF(RC[-25]="",,"|n"&R1C10&RC[-25])&IF(RC[-24]="",,"|n"&R1C11&RC[-24])&IF(RC[-23]="",,"|n"&R1C12&RC[-23])&IF(RC[-22]="",,"|n"&R1C13&RC[-22])&IF(RC[-20]&RC[-19]&RC[-18]&RC[-17]="",,"|n"&R1C14)&IF(RC[-20]="",,"|n"&R1C15&RC[-20])&IF(RC[-19]="",,"|n"&R1C16&RC[-19])&IF(RC[-18]="",,"|n"&R1C17&RC[-18])&IF(RC[-17]="",,"|n"&R1C18&RC[-17])&IF(RC[-16]="",,"|n"&R1C19&RC[-16])&IF(RC[-15]="",,"|n"&R1C20&RC[-15])&IF(RC[-14]="",,"|n"&R1C21&RC[-14])&IF(RC[-13]="",,"|n"&R1C22&RC[-13])&IF(RC[-11]="",,"|n"&R1C24&RC[-11])&IF(RC[-10]="",,"|n"&R1C25&RC[-10])&IF(RC[-9]="",,"|n"&R1C26&RC[-9])&IF(RC[-8]="",,"|n"&R1C27&RC[-8])&IF(RC[-7]="",,"|n"&R1C28&RC[-7])&IF(RC[-6]="",,"|n"&R1C29&RC[-6])&IF(RC[-2]="",,"|n"&RC[-2]) -> 
AI387: =IF(RC[-27]&RC[-26]&RC[-25]&RC[-24]&RC[-23]&RC[-22]="",,R1C7)&IF(RC[-27]="",,"|n"&R1C8&RC[-27])&IF(RC[-26]="",,"|n"&R1C9&RC[-26])&IF(RC[-25]="",,"|n"&R1C10&RC[-25])&IF(RC[-24]="",,"|n"&R1C11&RC[-24])&IF(RC[-23]="",,"|n"&R1C12&RC[-23])&IF(RC[-22]="",,"|n"&R1C13&RC[-22])&IF(RC[-20]&RC[-19]&RC[-18]&RC[-17]="",,"|n"&R1C14)&IF(RC[-20]="",,"|n"&R1C15&RC[-20])&IF(RC[-19]="",,"|n"&R1C16&RC[-19])&IF(RC[-18]="",,"|n"&R1C17&RC[-18])&IF(RC[-17]="",,"|n"&R1C18&RC[-17])&IF(RC[-16]="",,"|n"&R1C19&RC[-16])&IF(RC[-15]="",,"|n"&R1C20&RC[-15])&IF(RC[-14]="",,"|n"&R1C21&RC[-14])&IF(RC[-13]="",,"|n"&R1C22&RC[-13])&IF(RC[-11]="",,"|n"&R1C24&RC[-11])&IF(RC[-10]="",,"|n"&R1C25&RC[-10])&IF(RC[-9]="",,"|n"&R1C26&RC[-9])&IF(RC[-8]="",,"|n"&R1C27&RC[-8])&IF(RC[-7]="",,"|n"&R1C28&RC[-7])&IF(RC[-6]="",,"|n"&R1C29&RC[-6])&IF(RC[-2]="",,"|n"&RC[-2]) -> 
AI388: =IF(RC[-27]&RC[-26]&RC[-25]&RC[-24]&RC[-23]&RC[-22]="",,R1C7)&IF(RC[-27]="",,"|n"&R1C8&RC[-27])&IF(RC[-26]="",,"|n"&R1C9&RC[-26])&IF(RC[-25]="",,"|n"&R1C10&RC[-25])&IF(RC[-24]="",,"|n"&R1C11&RC[-24])&IF(RC[-23]="",,"|n"&R1C12&RC[-23])&IF(RC[-22]="",,"|n"&R1C13&RC[-22])&IF(RC[-20]&RC[-19]&RC[-18]&RC[-17]="",,"|n"&R1C14)&IF(RC[-20]="",,"|n"&R1C15&RC[-20])&IF(RC[-19]="",,"|n"&R1C16&RC[-19])&IF(RC[-18]="",,"|n"&R1C17&RC[-18])&IF(RC[-17]="",,"|n"&R1C18&RC[-17])&IF(RC[-16]="",,"|n"&R1C19&RC[-16])&IF(RC[-15]="",,"|n"&R1C20&RC[-15])&IF(RC[-14]="",,"|n"&R1C21&RC[-14])&IF(RC[-13]="",,"|n"&R1C22&RC[-13])&IF(RC[-11]="",,"|n"&R1C24&RC[-11])&IF(RC[-10]="",,"|n"&R1C25&RC[-10])&IF(RC[-9]="",,"|n"&R1C26&RC[-9])&IF(RC[-8]="",,"|n"&R1C27&RC[-8])&IF(RC[-7]="",,"|n"&R1C28&RC[-7])&IF(RC[-6]="",,"|n"&R1C29&RC[-6])&IF(RC[-2]="",,"|n"&RC[-2]) -> 
AI389: =IF(RC[-27]&RC[-26]&RC[-25]&RC[-24]&RC[-23]&RC[-22]="",,R1C7)&IF(RC[-27]="",,"|n"&R1C8&RC[-27])&IF(RC[-26]="",,"|n"&R1C9&RC[-26])&IF(RC[-25]="",,"|n"&R1C10&RC[-25])&IF(RC[-24]="",,"|n"&R1C11&RC[-24])&IF(RC[-23]="",,"|n"&R1C12&RC[-23])&IF(RC[-22]="",,"|n"&R1C13&RC[-22])&IF(RC[-20]&RC[-19]&RC[-18]&RC[-17]="",,"|n"&R1C14)&IF(RC[-20]="",,"|n"&R1C15&RC[-20])&IF(RC[-19]="",,"|n"&R1C16&RC[-19])&IF(RC[-18]="",,"|n"&R1C17&RC[-18])&IF(RC[-17]="",,"|n"&R1C18&RC[-17])&IF(RC[-16]="",,"|n"&R1C19&RC[-16])&IF(RC[-15]="",,"|n"&R1C20&RC[-15])&IF(RC[-14]="",,"|n"&R1C21&RC[-14])&IF(RC[-13]="",,"|n"&R1C22&RC[-13])&IF(RC[-11]="",,"|n"&R1C24&RC[-11])&IF(RC[-10]="",,"|n"&R1C25&RC[-10])&IF(RC[-9]="",,"|n"&R1C26&RC[-9])&IF(RC[-8]="",,"|n"&R1C27&RC[-8])&IF(RC[-7]="",,"|n"&R1C28&RC[-7])&IF(RC[-6]="",,"|n"&R1C29&RC[-6])&IF(RC[-2]="",,"|n"&RC[-2]) -> 
AI390: =IF(RC[-27]&RC[-26]&RC[-25]&RC[-24]&RC[-23]&RC[-22]="",,R1C7)&IF(RC[-27]="",,"|n"&R1C8&RC[-27])&IF(RC[-26]="",,"|n"&R1C9&RC[-26])&IF(RC[-25]="",,"|n"&R1C10&RC[-25])&IF(RC[-24]="",,"|n"&R1C11&RC[-24])&IF(RC[-23]="",,"|n"&R1C12&RC[-23])&IF(RC[-22]="",,"|n"&R1C13&RC[-22])&IF(RC[-20]&RC[-19]&RC[-18]&RC[-17]="",,"|n"&R1C14)&IF(RC[-20]="",,"|n"&R1C15&RC[-20])&IF(RC[-19]="",,"|n"&R1C16&RC[-19])&IF(RC[-18]="",,"|n"&R1C17&RC[-18])&IF(RC[-17]="",,"|n"&R1C18&RC[-17])&IF(RC[-16]="",,"|n"&R1C19&RC[-16])&IF(RC[-15]="",,"|n"&R1C20&RC[-15])&IF(RC[-14]="",,"|n"&R1C21&RC[-14])&IF(RC[-13]="",,"|n"&R1C22&RC[-13])&IF(RC[-11]="",,"|n"&R1C24&RC[-11])&IF(RC[-10]="",,"|n"&R1C25&RC[-10])&IF(RC[-9]="",,"|n"&R1C26&RC[-9])&IF(RC[-8]="",,"|n"&R1C27&RC[-8])&IF(RC[-7]="",,"|n"&R1C28&RC[-7])&IF(RC[-6]="",,"|n"&R1C29&RC[-6])&IF(RC[-2]="",,"|n"&RC[-2]) -> 
AI391: =IF(RC[-27]&RC[-26]&RC[-25]&RC[-24]&RC[-23]&RC[-22]="",,R1C7)&IF(RC[-27]="",,"|n"&R1C8&RC[-27])&IF(RC[-26]="",,"|n"&R1C9&RC[-26])&IF(RC[-25]="",,"|n"&R1C10&RC[-25])&IF(RC[-24]="",,"|n"&R1C11&RC[-24])&IF(RC[-23]="",,"|n"&R1C12&RC[-23])&IF(RC[-22]="",,"|n"&R1C13&RC[-22])&IF(RC[-20]&RC[-19]&RC[-18]&RC[-17]="",,"|n"&R1C14)&IF(RC[-20]="",,"|n"&R1C15&RC[-20])&IF(RC[-19]="",,"|n"&R1C16&RC[-19])&IF(RC[-18]="",,"|n"&R1C17&RC[-18])&IF(RC[-17]="",,"|n"&R1C18&RC[-17])&IF(RC[-16]="",,"|n"&R1C19&RC[-16])&IF(RC[-15]="",,"|n"&R1C20&RC[-15])&IF(RC[-14]="",,"|n"&R1C21&RC[-14])&IF(RC[-13]="",,"|n"&R1C22&RC[-13])&IF(RC[-11]="",,"|n"&R1C24&RC[-11])&IF(RC[-10]="",,"|n"&R1C25&RC[-10])&IF(RC[-9]="",,"|n"&R1C26&RC[-9])&IF(RC[-8]="",,"|n"&R1C27&RC[-8])&IF(RC[-7]="",,"|n"&R1C28&RC[-7])&IF(RC[-6]="",,"|n"&R1C29&RC[-6])&IF(RC[-2]="",,"|n"&RC[-2]) -> 
AI392: =IF(RC[-27]&RC[-26]&RC[-25]&RC[-24]&RC[-23]&RC[-22]="",,R1C7)&IF(RC[-27]="",,"|n"&R1C8&RC[-27])&IF(RC[-26]="",,"|n"&R1C9&RC[-26])&IF(RC[-25]="",,"|n"&R1C10&RC[-25])&IF(RC[-24]="",,"|n"&R1C11&RC[-24])&IF(RC[-23]="",,"|n"&R1C12&RC[-23])&IF(RC[-22]="",,"|n"&R1C13&RC[-22])&IF(RC[-20]&RC[-19]&RC[-18]&RC[-17]="",,"|n"&R1C14)&IF(RC[-20]="",,"|n"&R1C15&RC[-20])&IF(RC[-19]="",,"|n"&R1C16&RC[-19])&IF(RC[-18]="",,"|n"&R1C17&RC[-18])&IF(RC[-17]="",,"|n"&R1C18&RC[-17])&IF(RC[-16]="",,"|n"&R1C19&RC[-16])&IF(RC[-15]="",,"|n"&R1C20&RC[-15])&IF(RC[-14]="",,"|n"&R1C21&RC[-14])&IF(RC[-13]="",,"|n"&R1C22&RC[-13])&IF(RC[-11]="",,"|n"&R1C24&RC[-11])&IF(RC[-10]="",,"|n"&R1C25&RC[-10])&IF(RC[-9]="",,"|n"&R1C26&RC[-9])&IF(RC[-8]="",,"|n"&R1C27&RC[-8])&IF(RC[-7]="",,"|n"&R1C28&RC[-7])&IF(RC[-6]="",,"|n"&R1C29&RC[-6])&IF(RC[-2]="",,"|n"&RC[-2]) -> 
AI393: =IF(RC[-27]&RC[-26]&RC[-25]&RC[-24]&RC[-23]&RC[-22]="",,R1C7)&IF(RC[-27]="",,"|n"&R1C8&RC[-27])&IF(RC[-26]="",,"|n"&R1C9&RC[-26])&IF(RC[-25]="",,"|n"&R1C10&RC[-25])&IF(RC[-24]="",,"|n"&R1C11&RC[-24])&IF(RC[-23]="",,"|n"&R1C12&RC[-23])&IF(RC[-22]="",,"|n"&R1C13&RC[-22])&IF(RC[-20]&RC[-19]&RC[-18]&RC[-17]="",,"|n"&R1C14)&IF(RC[-20]="",,"|n"&R1C15&RC[-20])&IF(RC[-19]="",,"|n"&R1C16&RC[-19])&IF(RC[-18]="",,"|n"&R1C17&RC[-18])&IF(RC[-17]="",,"|n"&R1C18&RC[-17])&IF(RC[-16]="",,"|n"&R1C19&RC[-16])&IF(RC[-15]="",,"|n"&R1C20&RC[-15])&IF(RC[-14]="",,"|n"&R1C21&RC[-14])&IF(RC[-13]="",,"|n"&R1C22&RC[-13])&IF(RC[-11]="",,"|n"&R1C24&RC[-11])&IF(RC[-10]="",,"|n"&R1C25&RC[-10])&IF(RC[-9]="",,"|n"&R1C26&RC[-9])&IF(RC[-8]="",,"|n"&R1C27&RC[-8])&IF(RC[-7]="",,"|n"&R1C28&RC[-7])&IF(RC[-6]="",,"|n"&R1C29&RC[-6])&IF(RC[-2]="",,"|n"&RC[-2]) -> 
AI394: =IF(RC[-27]&RC[-26]&RC[-25]&RC[-24]&RC[-23]&RC[-22]="",,R1C7)&IF(RC[-27]="",,"|n"&R1C8&RC[-27])&IF(RC[-26]="",,"|n"&R1C9&RC[-26])&IF(RC[-25]="",,"|n"&R1C10&RC[-25])&IF(RC[-24]="",,"|n"&R1C11&RC[-24])&IF(RC[-23]="",,"|n"&R1C12&RC[-23])&IF(RC[-22]="",,"|n"&R1C13&RC[-22])&IF(RC[-20]&RC[-19]&RC[-18]&RC[-17]="",,"|n"&R1C14)&IF(RC[-20]="",,"|n"&R1C15&RC[-20])&IF(RC[-19]="",,"|n"&R1C16&RC[-19])&IF(RC[-18]="",,"|n"&R1C17&RC[-18])&IF(RC[-17]="",,"|n"&R1C18&RC[-17])&IF(RC[-16]="",,"|n"&R1C19&RC[-16])&IF(RC[-15]="",,"|n"&R1C20&RC[-15])&IF(RC[-14]="",,"|n"&R1C21&RC[-14])&IF(RC[-13]="",,"|n"&R1C22&RC[-13])&IF(RC[-11]="",,"|n"&R1C24&RC[-11])&IF(RC[-10]="",,"|n"&R1C25&RC[-10])&IF(RC[-9]="",,"|n"&R1C26&RC[-9])&IF(RC[-8]="",,"|n"&R1C27&RC[-8])&IF(RC[-7]="",,"|n"&R1C28&RC[-7])&IF(RC[-6]="",,"|n"&R1C29&RC[-6])&IF(RC[-2]="",,"|n"&RC[-2]) -> 
AI395: =IF(RC[-27]&RC[-26]&RC[-25]&RC[-24]&RC[-23]&RC[-22]="",,R1C7)&IF(RC[-27]="",,"|n"&R1C8&RC[-27])&IF(RC[-26]="",,"|n"&R1C9&RC[-26])&IF(RC[-25]="",,"|n"&R1C10&RC[-25])&IF(RC[-24]="",,"|n"&R1C11&RC[-24])&IF(RC[-23]="",,"|n"&R1C12&RC[-23])&IF(RC[-22]="",,"|n"&R1C13&RC[-22])&IF(RC[-20]&RC[-19]&RC[-18]&RC[-17]="",,"|n"&R1C14)&IF(RC[-20]="",,"|n"&R1C15&RC[-20])&IF(RC[-19]="",,"|n"&R1C16&RC[-19])&IF(RC[-18]="",,"|n"&R1C17&RC[-18])&IF(RC[-17]="",,"|n"&R1C18&RC[-17])&IF(RC[-16]="",,"|n"&R1C19&RC[-16])&IF(RC[-15]="",,"|n"&R1C20&RC[-15])&IF(RC[-14]="",,"|n"&R1C21&RC[-14])&IF(RC[-13]="",,"|n"&R1C22&RC[-13])&IF(RC[-11]="",,"|n"&R1C24&RC[-11])&IF(RC[-10]="",,"|n"&R1C25&RC[-10])&IF(RC[-9]="",,"|n"&R1C26&RC[-9])&IF(RC[-8]="",,"|n"&R1C27&RC[-8])&IF(RC[-7]="",,"|n"&R1C28&RC[-7])&IF(RC[-6]="",,"|n"&R1C29&RC[-6])&IF(RC[-2]="",,"|n"&RC[-2]) -> 
AI396: =IF(RC[-27]&RC[-26]&RC[-25]&RC[-24]&RC[-23]&RC[-22]="",,R1C7)&IF(RC[-27]="",,"|n"&R1C8&RC[-27])&IF(RC[-26]="",,"|n"&R1C9&RC[-26])&IF(RC[-25]="",,"|n"&R1C10&RC[-25])&IF(RC[-24]="",,"|n"&R1C11&RC[-24])&IF(RC[-23]="",,"|n"&R1C12&RC[-23])&IF(RC[-22]="",,"|n"&R1C13&RC[-22])&IF(RC[-20]&RC[-19]&RC[-18]&RC[-17]="",,"|n"&R1C14)&IF(RC[-20]="",,"|n"&R1C15&RC[-20])&IF(RC[-19]="",,"|n"&R1C16&RC[-19])&IF(RC[-18]="",,"|n"&R1C17&RC[-18])&IF(RC[-17]="",,"|n"&R1C18&RC[-17])&IF(RC[-16]="",,"|n"&R1C19&RC[-16])&IF(RC[-15]="",,"|n"&R1C20&RC[-15])&IF(RC[-14]="",,"|n"&R1C21&RC[-14])&IF(RC[-13]="",,"|n"&R1C22&RC[-13])&IF(RC[-11]="",,"|n"&R1C24&RC[-11])&IF(RC[-10]="",,"|n"&R1C25&RC[-10])&IF(RC[-9]="",,"|n"&R1C26&RC[-9])&IF(RC[-8]="",,"|n"&R1C27&RC[-8])&IF(RC[-7]="",,"|n"&R1C28&RC[-7])&IF(RC[-6]="",,"|n"&R1C29&RC[-6])&IF(RC[-2]="",,"|n"&RC[-2]) -> 
AI397: =IF(RC[-27]&RC[-26]&RC[-25]&RC[-24]&RC[-23]&RC[-22]="",,R1C7)&IF(RC[-27]="",,"|n"&R1C8&RC[-27])&IF(RC[-26]="",,"|n"&R1C9&RC[-26])&IF(RC[-25]="",,"|n"&R1C10&RC[-25])&IF(RC[-24]="",,"|n"&R1C11&RC[-24])&IF(RC[-23]="",,"|n"&R1C12&RC[-23])&IF(RC[-22]="",,"|n"&R1C13&RC[-22])&IF(RC[-20]&RC[-19]&RC[-18]&RC[-17]="",,"|n"&R1C14)&IF(RC[-20]="",,"|n"&R1C15&RC[-20])&IF(RC[-19]="",,"|n"&R1C16&RC[-19])&IF(RC[-18]="",,"|n"&R1C17&RC[-18])&IF(RC[-17]="",,"|n"&R1C18&RC[-17])&IF(RC[-16]="",,"|n"&R1C19&RC[-16])&IF(RC[-15]="",,"|n"&R1C20&RC[-15])&IF(RC[-14]="",,"|n"&R1C21&RC[-14])&IF(RC[-13]="",,"|n"&R1C22&RC[-13])&IF(RC[-11]="",,"|n"&R1C24&RC[-11])&IF(RC[-10]="",,"|n"&R1C25&RC[-10])&IF(RC[-9]="",,"|n"&R1C26&RC[-9])&IF(RC[-8]="",,"|n"&R1C27&RC[-8])&IF(RC[-7]="",,"|n"&R1C28&RC[-7])&IF(RC[-6]="",,"|n"&R1C29&RC[-6])&IF(RC[-2]="",,"|n"&RC[-2]) -> 
AI398: =IF(RC[-27]&RC[-26]&RC[-25]&RC[-24]&RC[-23]&RC[-22]="",,R1C7)&IF(RC[-27]="",,"|n"&R1C8&RC[-27])&IF(RC[-26]="",,"|n"&R1C9&RC[-26])&IF(RC[-25]="",,"|n"&R1C10&RC[-25])&IF(RC[-24]="",,"|n"&R1C11&RC[-24])&IF(RC[-23]="",,"|n"&R1C12&RC[-23])&IF(RC[-22]="",,"|n"&R1C13&RC[-22])&IF(RC[-20]&RC[-19]&RC[-18]&RC[-17]="",,"|n"&R1C14)&IF(RC[-20]="",,"|n"&R1C15&RC[-20])&IF(RC[-19]="",,"|n"&R1C16&RC[-19])&IF(RC[-18]="",,"|n"&R1C17&RC[-18])&IF(RC[-17]="",,"|n"&R1C18&RC[-17])&IF(RC[-16]="",,"|n"&R1C19&RC[-16])&IF(RC[-15]="",,"|n"&R1C20&RC[-15])&IF(RC[-14]="",,"|n"&R1C21&RC[-14])&IF(RC[-13]="",,"|n"&R1C22&RC[-13])&IF(RC[-11]="",,"|n"&R1C24&RC[-11])&IF(RC[-10]="",,"|n"&R1C25&RC[-10])&IF(RC[-9]="",,"|n"&R1C26&RC[-9])&IF(RC[-8]="",,"|n"&R1C27&RC[-8])&IF(RC[-7]="",,"|n"&R1C28&RC[-7])&IF(RC[-6]="",,"|n"&R1C29&RC[-6])&IF(RC[-2]="",,"|n"&RC[-2]) -> 
AI399: =IF(RC[-27]&RC[-26]&RC[-25]&RC[-24]&RC[-23]&RC[-22]="",,R1C7)&IF(RC[-27]="",,"|n"&R1C8&RC[-27])&IF(RC[-26]="",,"|n"&R1C9&RC[-26])&IF(RC[-25]="",,"|n"&R1C10&RC[-25])&IF(RC[-24]="",,"|n"&R1C11&RC[-24])&IF(RC[-23]="",,"|n"&R1C12&RC[-23])&IF(RC[-22]="",,"|n"&R1C13&RC[-22])&IF(RC[-20]&RC[-19]&RC[-18]&RC[-17]="",,"|n"&R1C14)&IF(RC[-20]="",,"|n"&R1C15&RC[-20])&IF(RC[-19]="",,"|n"&R1C16&RC[-19])&IF(RC[-18]="",,"|n"&R1C17&RC[-18])&IF(RC[-17]="",,"|n"&R1C18&RC[-17])&IF(RC[-16]="",,"|n"&R1C19&RC[-16])&IF(RC[-15]="",,"|n"&R1C20&RC[-15])&IF(RC[-14]="",,"|n"&R1C21&RC[-14])&IF(RC[-13]="",,"|n"&R1C22&RC[-13])&IF(RC[-11]="",,"|n"&R1C24&RC[-11])&IF(RC[-10]="",,"|n"&R1C25&RC[-10])&IF(RC[-9]="",,"|n"&R1C26&RC[-9])&IF(RC[-8]="",,"|n"&R1C27&RC[-8])&IF(RC[-7]="",,"|n"&R1C28&RC[-7])&IF(RC[-6]="",,"|n"&R1C29&RC[-6])&IF(RC[-2]="",,"|n"&RC[-2]) -> 
AI400: =IF(RC[-27]&RC[-26]&RC[-25]&RC[-24]&RC[-23]&RC[-22]="",,R1C7)&IF(RC[-27]="",,"|n"&R1C8&RC[-27])&IF(RC[-26]="",,"|n"&R1C9&RC[-26])&IF(RC[-25]="",,"|n"&R1C10&RC[-25])&IF(RC[-24]="",,"|n"&R1C11&RC[-24])&IF(RC[-23]="",,"|n"&R1C12&RC[-23])&IF(RC[-22]="",,"|n"&R1C13&RC[-22])&IF(RC[-20]&RC[-19]&RC[-18]&RC[-17]="",,"|n"&R1C14)&IF(RC[-20]="",,"|n"&R1C15&RC[-20])&IF(RC[-19]="",,"|n"&R1C16&RC[-19])&IF(RC[-18]="",,"|n"&R1C17&RC[-18])&IF(RC[-17]="",,"|n"&R1C18&RC[-17])&IF(RC[-16]="",,"|n"&R1C19&RC[-16])&IF(RC[-15]="",,"|n"&R1C20&RC[-15])&IF(RC[-14]="",,"|n"&R1C21&RC[-14])&IF(RC[-13]="",,"|n"&R1C22&RC[-13])&IF(RC[-11]="",,"|n"&R1C24&RC[-11])&IF(RC[-10]="",,"|n"&R1C25&RC[-10])&IF(RC[-9]="",,"|n"&R1C26&RC[-9])&IF(RC[-8]="",,"|n"&R1C27&RC[-8])&IF(RC[-7]="",,"|n"&R1C28&RC[-7])&IF(RC[-6]="",,"|n"&R1C29&RC[-6])&IF(RC[-2]="",,"|n"&RC[-2]) -> 
AI401: =IF(RC[-27]&RC[-26]&RC[-25]&RC[-24]&RC[-23]&RC[-22]="",,R1C7)&IF(RC[-27]="",,"|n"&R1C8&RC[-27])&IF(RC[-26]="",,"|n"&R1C9&RC[-26])&IF(RC[-25]="",,"|n"&R1C10&RC[-25])&IF(RC[-24]="",,"|n"&R1C11&RC[-24])&IF(RC[-23]="",,"|n"&R1C12&RC[-23])&IF(RC[-22]="",,"|n"&R1C13&RC[-22])&IF(RC[-20]&RC[-19]&RC[-18]&RC[-17]="",,"|n"&R1C14)&IF(RC[-20]="",,"|n"&R1C15&RC[-20])&IF(RC[-19]="",,"|n"&R1C16&RC[-19])&IF(RC[-18]="",,"|n"&R1C17&RC[-18])&IF(RC[-17]="",,"|n"&R1C18&RC[-17])&IF(RC[-16]="",,"|n"&R1C19&RC[-16])&IF(RC[-15]="",,"|n"&R1C20&RC[-15])&IF(RC[-14]="",,"|n"&R1C21&RC[-14])&IF(RC[-13]="",,"|n"&R1C22&RC[-13])&IF(RC[-11]="",,"|n"&R1C24&RC[-11])&IF(RC[-10]="",,"|n"&R1C25&RC[-10])&IF(RC[-9]="",,"|n"&R1C26&RC[-9])&IF(RC[-8]="",,"|n"&R1C27&RC[-8])&IF(RC[-7]="",,"|n"&R1C28&RC[-7])&IF(RC[-6]="",,"|n"&R1C29&RC[-6])&IF(RC[-2]="",,"|n"&RC[-2]) -> 
AI402: =IF(RC[-27]&RC[-26]&RC[-25]&RC[-24]&RC[-23]&RC[-22]="",,R1C7)&IF(RC[-27]="",,"|n"&R1C8&RC[-27])&IF(RC[-26]="",,"|n"&R1C9&RC[-26])&IF(RC[-25]="",,"|n"&R1C10&RC[-25])&IF(RC[-24]="",,"|n"&R1C11&RC[-24])&IF(RC[-23]="",,"|n"&R1C12&RC[-23])&IF(RC[-22]="",,"|n"&R1C13&RC[-22])&IF(RC[-20]&RC[-19]&RC[-18]&RC[-17]="",,"|n"&R1C14)&IF(RC[-20]="",,"|n"&R1C15&RC[-20])&IF(RC[-19]="",,"|n"&R1C16&RC[-19])&IF(RC[-18]="",,"|n"&R1C17&RC[-18])&IF(RC[-17]="",,"|n"&R1C18&RC[-17])&IF(RC[-16]="",,"|n"&R1C19&RC[-16])&IF(RC[-15]="",,"|n"&R1C20&RC[-15])&IF(RC[-14]="",,"|n"&R1C21&RC[-14])&IF(RC[-13]="",,"|n"&R1C22&RC[-13])&IF(RC[-11]="",,"|n"&R1C24&RC[-11])&IF(RC[-10]="",,"|n"&R1C25&RC[-10])&IF(RC[-9]="",,"|n"&R1C26&RC[-9])&IF(RC[-8]="",,"|n"&R1C27&RC[-8])&IF(RC[-7]="",,"|n"&R1C28&RC[-7])&IF(RC[-6]="",,"|n"&R1C29&RC[-6])&IF(RC[-2]="",,"|n"&RC[-2]) -> 
AI403: =IF(RC[-27]&RC[-26]&RC[-25]&RC[-24]&RC[-23]&RC[-22]="",,R1C7)&IF(RC[-27]="",,"|n"&R1C8&RC[-27])&IF(RC[-26]="",,"|n"&R1C9&RC[-26])&IF(RC[-25]="",,"|n"&R1C10&RC[-25])&IF(RC[-24]="",,"|n"&R1C11&RC[-24])&IF(RC[-23]="",,"|n"&R1C12&RC[-23])&IF(RC[-22]="",,"|n"&R1C13&RC[-22])&IF(RC[-20]&RC[-19]&RC[-18]&RC[-17]="",,"|n"&R1C14)&IF(RC[-20]="",,"|n"&R1C15&RC[-20])&IF(RC[-19]="",,"|n"&R1C16&RC[-19])&IF(RC[-18]="",,"|n"&R1C17&RC[-18])&IF(RC[-17]="",,"|n"&R1C18&RC[-17])&IF(RC[-16]="",,"|n"&R1C19&RC[-16])&IF(RC[-15]="",,"|n"&R1C20&RC[-15])&IF(RC[-14]="",,"|n"&R1C21&RC[-14])&IF(RC[-13]="",,"|n"&R1C22&RC[-13])&IF(RC[-11]="",,"|n"&R1C24&RC[-11])&IF(RC[-10]="",,"|n"&R1C25&RC[-10])&IF(RC[-9]="",,"|n"&R1C26&RC[-9])&IF(RC[-8]="",,"|n"&R1C27&RC[-8])&IF(RC[-7]="",,"|n"&R1C28&RC[-7])&IF(RC[-6]="",,"|n"&R1C29&RC[-6])&IF(RC[-2]="",,"|n"&RC[-2]) -> 
AI404: =IF(RC[-27]&RC[-26]&RC[-25]&RC[-24]&RC[-23]&RC[-22]="",,R1C7)&IF(RC[-27]="",,"|n"&R1C8&RC[-27])&IF(RC[-26]="",,"|n"&R1C9&RC[-26])&IF(RC[-25]="",,"|n"&R1C10&RC[-25])&IF(RC[-24]="",,"|n"&R1C11&RC[-24])&IF(RC[-23]="",,"|n"&R1C12&RC[-23])&IF(RC[-22]="",,"|n"&R1C13&RC[-22])&IF(RC[-20]&RC[-19]&RC[-18]&RC[-17]="",,"|n"&R1C14)&IF(RC[-20]="",,"|n"&R1C15&RC[-20])&IF(RC[-19]="",,"|n"&R1C16&RC[-19])&IF(RC[-18]="",,"|n"&R1C17&RC[-18])&IF(RC[-17]="",,"|n"&R1C18&RC[-17])&IF(RC[-16]="",,"|n"&R1C19&RC[-16])&IF(RC[-15]="",,"|n"&R1C20&RC[-15])&IF(RC[-14]="",,"|n"&R1C21&RC[-14])&IF(RC[-13]="",,"|n"&R1C22&RC[-13])&IF(RC[-11]="",,"|n"&R1C24&RC[-11])&IF(RC[-10]="",,"|n"&R1C25&RC[-10])&IF(RC[-9]="",,"|n"&R1C26&RC[-9])&IF(RC[-8]="",,"|n"&R1C27&RC[-8])&IF(RC[-7]="",,"|n"&R1C28&RC[-7])&IF(RC[-6]="",,"|n"&R1C29&RC[-6])&IF(RC[-2]="",,"|n"&RC[-2]) -> 
AI405: =IF(RC[-27]&RC[-26]&RC[-25]&RC[-24]&RC[-23]&RC[-22]="",,R1C7)&IF(RC[-27]="",,"|n"&R1C8&RC[-27])&IF(RC[-26]="",,"|n"&R1C9&RC[-26])&IF(RC[-25]="",,"|n"&R1C10&RC[-25])&IF(RC[-24]="",,"|n"&R1C11&RC[-24])&IF(RC[-23]="",,"|n"&R1C12&RC[-23])&IF(RC[-22]="",,"|n"&R1C13&RC[-22])&IF(RC[-20]&RC[-19]&RC[-18]&RC[-17]="",,"|n"&R1C14)&IF(RC[-20]="",,"|n"&R1C15&RC[-20])&IF(RC[-19]="",,"|n"&R1C16&RC[-19])&IF(RC[-18]="",,"|n"&R1C17&RC[-18])&IF(RC[-17]="",,"|n"&R1C18&RC[-17])&IF(RC[-16]="",,"|n"&R1C19&RC[-16])&IF(RC[-15]="",,"|n"&R1C20&RC[-15])&IF(RC[-14]="",,"|n"&R1C21&RC[-14])&IF(RC[-13]="",,"|n"&R1C22&RC[-13])&IF(RC[-11]="",,"|n"&R1C24&RC[-11])&IF(RC[-10]="",,"|n"&R1C25&RC[-10])&IF(RC[-9]="",,"|n"&R1C26&RC[-9])&IF(RC[-8]="",,"|n"&R1C27&RC[-8])&IF(RC[-7]="",,"|n"&R1C28&RC[-7])&IF(RC[-6]="",,"|n"&R1C29&RC[-6])&IF(RC[-2]="",,"|n"&RC[-2]) -> 
AI406: =IF(RC[-27]&RC[-26]&RC[-25]&RC[-24]&RC[-23]&RC[-22]="",,R1C7)&IF(RC[-27]="",,"|n"&R1C8&RC[-27])&IF(RC[-26]="",,"|n"&R1C9&RC[-26])&IF(RC[-25]="",,"|n"&R1C10&RC[-25])&IF(RC[-24]="",,"|n"&R1C11&RC[-24])&IF(RC[-23]="",,"|n"&R1C12&RC[-23])&IF(RC[-22]="",,"|n"&R1C13&RC[-22])&IF(RC[-20]&RC[-19]&RC[-18]&RC[-17]="",,"|n"&R1C14)&IF(RC[-20]="",,"|n"&R1C15&RC[-20])&IF(RC[-19]="",,"|n"&R1C16&RC[-19])&IF(RC[-18]="",,"|n"&R1C17&RC[-18])&IF(RC[-17]="",,"|n"&R1C18&RC[-17])&IF(RC[-16]="",,"|n"&R1C19&RC[-16])&IF(RC[-15]="",,"|n"&R1C20&RC[-15])&IF(RC[-14]="",,"|n"&R1C21&RC[-14])&IF(RC[-13]="",,"|n"&R1C22&RC[-13])&IF(RC[-11]="",,"|n"&R1C24&RC[-11])&IF(RC[-10]="",,"|n"&R1C25&RC[-10])&IF(RC[-9]="",,"|n"&R1C26&RC[-9])&IF(RC[-8]="",,"|n"&R1C27&RC[-8])&IF(RC[-7]="",,"|n"&R1C28&RC[-7])&IF(RC[-6]="",,"|n"&R1C29&RC[-6])&IF(RC[-2]="",,"|n"&RC[-2]) -> 
AI407: =IF(RC[-27]&RC[-26]&RC[-25]&RC[-24]&RC[-23]&RC[-22]="",,R1C7)&IF(RC[-27]="",,"|n"&R1C8&RC[-27])&IF(RC[-26]="",,"|n"&R1C9&RC[-26])&IF(RC[-25]="",,"|n"&R1C10&RC[-25])&IF(RC[-24]="",,"|n"&R1C11&RC[-24])&IF(RC[-23]="",,"|n"&R1C12&RC[-23])&IF(RC[-22]="",,"|n"&R1C13&RC[-22])&IF(RC[-20]&RC[-19]&RC[-18]&RC[-17]="",,"|n"&R1C14)&IF(RC[-20]="",,"|n"&R1C15&RC[-20])&IF(RC[-19]="",,"|n"&R1C16&RC[-19])&IF(RC[-18]="",,"|n"&R1C17&RC[-18])&IF(RC[-17]="",,"|n"&R1C18&RC[-17])&IF(RC[-16]="",,"|n"&R1C19&RC[-16])&IF(RC[-15]="",,"|n"&R1C20&RC[-15])&IF(RC[-14]="",,"|n"&R1C21&RC[-14])&IF(RC[-13]="",,"|n"&R1C22&RC[-13])&IF(RC[-11]="",,"|n"&R1C24&RC[-11])&IF(RC[-10]="",,"|n"&R1C25&RC[-10])&IF(RC[-9]="",,"|n"&R1C26&RC[-9])&IF(RC[-8]="",,"|n"&R1C27&RC[-8])&IF(RC[-7]="",,"|n"&R1C28&RC[-7])&IF(RC[-6]="",,"|n"&R1C29&RC[-6])&IF(RC[-2]="",,"|n"&RC[-2]) -> 
AI408: =IF(RC[-27]&RC[-26]&RC[-25]&RC[-24]&RC[-23]&RC[-22]="",,R1C7)&IF(RC[-27]="",,"|n"&R1C8&RC[-27])&IF(RC[-26]="",,"|n"&R1C9&RC[-26])&IF(RC[-25]="",,"|n"&R1C10&RC[-25])&IF(RC[-24]="",,"|n"&R1C11&RC[-24])&IF(RC[-23]="",,"|n"&R1C12&RC[-23])&IF(RC[-22]="",,"|n"&R1C13&RC[-22])&IF(RC[-20]&RC[-19]&RC[-18]&RC[-17]="",,"|n"&R1C14)&IF(RC[-20]="",,"|n"&R1C15&RC[-20])&IF(RC[-19]="",,"|n"&R1C16&RC[-19])&IF(RC[-18]="",,"|n"&R1C17&RC[-18])&IF(RC[-17]="",,"|n"&R1C18&RC[-17])&IF(RC[-16]="",,"|n"&R1C19&RC[-16])&IF(RC[-15]="",,"|n"&R1C20&RC[-15])&IF(RC[-14]="",,"|n"&R1C21&RC[-14])&IF(RC[-13]="",,"|n"&R1C22&RC[-13])&IF(RC[-11]="",,"|n"&R1C24&RC[-11])&IF(RC[-10]="",,"|n"&R1C25&RC[-10])&IF(RC[-9]="",,"|n"&R1C26&RC[-9])&IF(RC[-8]="",,"|n"&R1C27&RC[-8])&IF(RC[-7]="",,"|n"&R1C28&RC[-7])&IF(RC[-6]="",,"|n"&R1C29&RC[-6])&IF(RC[-2]="",,"|n"&RC[-2]) -> 
AI409: =IF(RC[-27]&RC[-26]&RC[-25]&RC[-24]&RC[-23]&RC[-22]="",,R1C7)&IF(RC[-27]="",,"|n"&R1C8&RC[-27])&IF(RC[-26]="",,"|n"&R1C9&RC[-26])&IF(RC[-25]="",,"|n"&R1C10&RC[-25])&IF(RC[-24]="",,"|n"&R1C11&RC[-24])&IF(RC[-23]="",,"|n"&R1C12&RC[-23])&IF(RC[-22]="",,"|n"&R1C13&RC[-22])&IF(RC[-20]&RC[-19]&RC[-18]&RC[-17]="",,"|n"&R1C14)&IF(RC[-20]="",,"|n"&R1C15&RC[-20])&IF(RC[-19]="",,"|n"&R1C16&RC[-19])&IF(RC[-18]="",,"|n"&R1C17&RC[-18])&IF(RC[-17]="",,"|n"&R1C18&RC[-17])&IF(RC[-16]="",,"|n"&R1C19&RC[-16])&IF(RC[-15]="",,"|n"&R1C20&RC[-15])&IF(RC[-14]="",,"|n"&R1C21&RC[-14])&IF(RC[-13]="",,"|n"&R1C22&RC[-13])&IF(RC[-11]="",,"|n"&R1C24&RC[-11])&IF(RC[-10]="",,"|n"&R1C25&RC[-10])&IF(RC[-9]="",,"|n"&R1C26&RC[-9])&IF(RC[-8]="",,"|n"&R1C27&RC[-8])&IF(RC[-7]="",,"|n"&R1C28&RC[-7])&IF(RC[-6]="",,"|n"&R1C29&RC[-6])&IF(RC[-2]="",,"|n"&RC[-2]) -> 
AI410: =IF(RC[-27]&RC[-26]&RC[-25]&RC[-24]&RC[-23]&RC[-22]="",,R1C7)&IF(RC[-27]="",,"|n"&R1C8&RC[-27])&IF(RC[-26]="",,"|n"&R1C9&RC[-26])&IF(RC[-25]="",,"|n"&R1C10&RC[-25])&IF(RC[-24]="",,"|n"&R1C11&RC[-24])&IF(RC[-23]="",,"|n"&R1C12&RC[-23])&IF(RC[-22]="",,"|n"&R1C13&RC[-22])&IF(RC[-20]&RC[-19]&RC[-18]&RC[-17]="",,"|n"&R1C14)&IF(RC[-20]="",,"|n"&R1C15&RC[-20])&IF(RC[-19]="",,"|n"&R1C16&RC[-19])&IF(RC[-18]="",,"|n"&R1C17&RC[-18])&IF(RC[-17]="",,"|n"&R1C18&RC[-17])&IF(RC[-16]="",,"|n"&R1C19&RC[-16])&IF(RC[-15]="",,"|n"&R1C20&RC[-15])&IF(RC[-14]="",,"|n"&R1C21&RC[-14])&IF(RC[-13]="",,"|n"&R1C22&RC[-13])&IF(RC[-11]="",,"|n"&R1C24&RC[-11])&IF(RC[-10]="",,"|n"&R1C25&RC[-10])&IF(RC[-9]="",,"|n"&R1C26&RC[-9])&IF(RC[-8]="",,"|n"&R1C27&RC[-8])&IF(RC[-7]="",,"|n"&R1C28&RC[-7])&IF(RC[-6]="",,"|n"&R1C29&RC[-6])&IF(RC[-2]="",,"|n"&RC[-2]) -> 
AI411: =IF(RC[-27]&RC[-26]&RC[-25]&RC[-24]&RC[-23]&RC[-22]="",,R1C7)&IF(RC[-27]="",,"|n"&R1C8&RC[-27])&IF(RC[-26]="",,"|n"&R1C9&RC[-26])&IF(RC[-25]="",,"|n"&R1C10&RC[-25])&IF(RC[-24]="",,"|n"&R1C11&RC[-24])&IF(RC[-23]="",,"|n"&R1C12&RC[-23])&IF(RC[-22]="",,"|n"&R1C13&RC[-22])&IF(RC[-20]&RC[-19]&RC[-18]&RC[-17]="",,"|n"&R1C14)&IF(RC[-20]="",,"|n"&R1C15&RC[-20])&IF(RC[-19]="",,"|n"&R1C16&RC[-19])&IF(RC[-18]="",,"|n"&R1C17&RC[-18])&IF(RC[-17]="",,"|n"&R1C18&RC[-17])&IF(RC[-16]="",,"|n"&R1C19&RC[-16])&IF(RC[-15]="",,"|n"&R1C20&RC[-15])&IF(RC[-14]="",,"|n"&R1C21&RC[-14])&IF(RC[-13]="",,"|n"&R1C22&RC[-13])&IF(RC[-11]="",,"|n"&R1C24&RC[-11])&IF(RC[-10]="",,"|n"&R1C25&RC[-10])&IF(RC[-9]="",,"|n"&R1C26&RC[-9])&IF(RC[-8]="",,"|n"&R1C27&RC[-8])&IF(RC[-7]="",,"|n"&R1C28&RC[-7])&IF(RC[-6]="",,"|n"&R1C29&RC[-6])&IF(RC[-2]="",,"|n"&RC[-2]) -> 
AI412: =IF(RC[-27]&RC[-26]&RC[-25]&RC[-24]&RC[-23]&RC[-22]="",,R1C7)&IF(RC[-27]="",,"|n"&R1C8&RC[-27])&IF(RC[-26]="",,"|n"&R1C9&RC[-26])&IF(RC[-25]="",,"|n"&R1C10&RC[-25])&IF(RC[-24]="",,"|n"&R1C11&RC[-24])&IF(RC[-23]="",,"|n"&R1C12&RC[-23])&IF(RC[-22]="",,"|n"&R1C13&RC[-22])&IF(RC[-20]&RC[-19]&RC[-18]&RC[-17]="",,"|n"&R1C14)&IF(RC[-20]="",,"|n"&R1C15&RC[-20])&IF(RC[-19]="",,"|n"&R1C16&RC[-19])&IF(RC[-18]="",,"|n"&R1C17&RC[-18])&IF(RC[-17]="",,"|n"&R1C18&RC[-17])&IF(RC[-16]="",,"|n"&R1C19&RC[-16])&IF(RC[-15]="",,"|n"&R1C20&RC[-15])&IF(RC[-14]="",,"|n"&R1C21&RC[-14])&IF(RC[-13]="",,"|n"&R1C22&RC[-13])&IF(RC[-11]="",,"|n"&R1C24&RC[-11])&IF(RC[-10]="",,"|n"&R1C25&RC[-10])&IF(RC[-9]="",,"|n"&R1C26&RC[-9])&IF(RC[-8]="",,"|n"&R1C27&RC[-8])&IF(RC[-7]="",,"|n"&R1C28&RC[-7])&IF(RC[-6]="",,"|n"&R1C29&RC[-6])&IF(RC[-2]="",,"|n"&RC[-2]) -> 
AI413: =IF(RC[-27]&RC[-26]&RC[-25]&RC[-24]&RC[-23]&RC[-22]="",,R1C7)&IF(RC[-27]="",,"|n"&R1C8&RC[-27])&IF(RC[-26]="",,"|n"&R1C9&RC[-26])&IF(RC[-25]="",,"|n"&R1C10&RC[-25])&IF(RC[-24]="",,"|n"&R1C11&RC[-24])&IF(RC[-23]="",,"|n"&R1C12&RC[-23])&IF(RC[-22]="",,"|n"&R1C13&RC[-22])&IF(RC[-20]&RC[-19]&RC[-18]&RC[-17]="",,"|n"&R1C14)&IF(RC[-20]="",,"|n"&R1C15&RC[-20])&IF(RC[-19]="",,"|n"&R1C16&RC[-19])&IF(RC[-18]="",,"|n"&R1C17&RC[-18])&IF(RC[-17]="",,"|n"&R1C18&RC[-17])&IF(RC[-16]="",,"|n"&R1C19&RC[-16])&IF(RC[-15]="",,"|n"&R1C20&RC[-15])&IF(RC[-14]="",,"|n"&R1C21&RC[-14])&IF(RC[-13]="",,"|n"&R1C22&RC[-13])&IF(RC[-11]="",,"|n"&R1C24&RC[-11])&IF(RC[-10]="",,"|n"&R1C25&RC[-10])&IF(RC[-9]="",,"|n"&R1C26&RC[-9])&IF(RC[-8]="",,"|n"&R1C27&RC[-8])&IF(RC[-7]="",,"|n"&R1C28&RC[-7])&IF(RC[-6]="",,"|n"&R1C29&RC[-6])&IF(RC[-2]="",,"|n"&RC[-2]) -> 
AI414: =IF(RC[-27]&RC[-26]&RC[-25]&RC[-24]&RC[-23]&RC[-22]="",,R1C7)&IF(RC[-27]="",,"|n"&R1C8&RC[-27])&IF(RC[-26]="",,"|n"&R1C9&RC[-26])&IF(RC[-25]="",,"|n"&R1C10&RC[-25])&IF(RC[-24]="",,"|n"&R1C11&RC[-24])&IF(RC[-23]="",,"|n"&R1C12&RC[-23])&IF(RC[-22]="",,"|n"&R1C13&RC[-22])&IF(RC[-20]&RC[-19]&RC[-18]&RC[-17]="",,"|n"&R1C14)&IF(RC[-20]="",,"|n"&R1C15&RC[-20])&IF(RC[-19]="",,"|n"&R1C16&RC[-19])&IF(RC[-18]="",,"|n"&R1C17&RC[-18])&IF(RC[-17]="",,"|n"&R1C18&RC[-17])&IF(RC[-16]="",,"|n"&R1C19&RC[-16])&IF(RC[-15]="",,"|n"&R1C20&RC[-15])&IF(RC[-14]="",,"|n"&R1C21&RC[-14])&IF(RC[-13]="",,"|n"&R1C22&RC[-13])&IF(RC[-11]="",,"|n"&R1C24&RC[-11])&IF(RC[-10]="",,"|n"&R1C25&RC[-10])&IF(RC[-9]="",,"|n"&R1C26&RC[-9])&IF(RC[-8]="",,"|n"&R1C27&RC[-8])&IF(RC[-7]="",,"|n"&R1C28&RC[-7])&IF(RC[-6]="",,"|n"&R1C29&RC[-6])&IF(RC[-2]="",,"|n"&RC[-2]) -> 
AI415: =IF(RC[-27]&RC[-26]&RC[-25]&RC[-24]&RC[-23]&RC[-22]="",,R1C7)&IF(RC[-27]="",,"|n"&R1C8&RC[-27])&IF(RC[-26]="",,"|n"&R1C9&RC[-26])&IF(RC[-25]="",,"|n"&R1C10&RC[-25])&IF(RC[-24]="",,"|n"&R1C11&RC[-24])&IF(RC[-23]="",,"|n"&R1C12&RC[-23])&IF(RC[-22]="",,"|n"&R1C13&RC[-22])&IF(RC[-20]&RC[-19]&RC[-18]&RC[-17]="",,"|n"&R1C14)&IF(RC[-20]="",,"|n"&R1C15&RC[-20])&IF(RC[-19]="",,"|n"&R1C16&RC[-19])&IF(RC[-18]="",,"|n"&R1C17&RC[-18])&IF(RC[-17]="",,"|n"&R1C18&RC[-17])&IF(RC[-16]="",,"|n"&R1C19&RC[-16])&IF(RC[-15]="",,"|n"&R1C20&RC[-15])&IF(RC[-14]="",,"|n"&R1C21&RC[-14])&IF(RC[-13]="",,"|n"&R1C22&RC[-13])&IF(RC[-11]="",,"|n"&R1C24&RC[-11])&IF(RC[-10]="",,"|n"&R1C25&RC[-10])&IF(RC[-9]="",,"|n"&R1C26&RC[-9])&IF(RC[-8]="",,"|n"&R1C27&RC[-8])&IF(RC[-7]="",,"|n"&R1C28&RC[-7])&IF(RC[-6]="",,"|n"&R1C29&RC[-6])&IF(RC[-2]="",,"|n"&RC[-2]) -> 
AI416: =IF(RC[-27]&RC[-26]&RC[-25]&RC[-24]&RC[-23]&RC[-22]="",,R1C7)&IF(RC[-27]="",,"|n"&R1C8&RC[-27])&IF(RC[-26]="",,"|n"&R1C9&RC[-26])&IF(RC[-25]="",,"|n"&R1C10&RC[-25])&IF(RC[-24]="",,"|n"&R1C11&RC[-24])&IF(RC[-23]="",,"|n"&R1C12&RC[-23])&IF(RC[-22]="",,"|n"&R1C13&RC[-22])&IF(RC[-20]&RC[-19]&RC[-18]&RC[-17]="",,"|n"&R1C14)&IF(RC[-20]="",,"|n"&R1C15&RC[-20])&IF(RC[-19]="",,"|n"&R1C16&RC[-19])&IF(RC[-18]="",,"|n"&R1C17&RC[-18])&IF(RC[-17]="",,"|n"&R1C18&RC[-17])&IF(RC[-16]="",,"|n"&R1C19&RC[-16])&IF(RC[-15]="",,"|n"&R1C20&RC[-15])&IF(RC[-14]="",,"|n"&R1C21&RC[-14])&IF(RC[-13]="",,"|n"&R1C22&RC[-13])&IF(RC[-11]="",,"|n"&R1C24&RC[-11])&IF(RC[-10]="",,"|n"&R1C25&RC[-10])&IF(RC[-9]="",,"|n"&R1C26&RC[-9])&IF(RC[-8]="",,"|n"&R1C27&RC[-8])&IF(RC[-7]="",,"|n"&R1C28&RC[-7])&IF(RC[-6]="",,"|n"&R1C29&RC[-6])&IF(RC[-2]="",,"|n"&RC[-2]) -> 
AI417: =IF(RC[-27]&RC[-26]&RC[-25]&RC[-24]&RC[-23]&RC[-22]="",,R1C7)&IF(RC[-27]="",,"|n"&R1C8&RC[-27])&IF(RC[-26]="",,"|n"&R1C9&RC[-26])&IF(RC[-25]="",,"|n"&R1C10&RC[-25])&IF(RC[-24]="",,"|n"&R1C11&RC[-24])&IF(RC[-23]="",,"|n"&R1C12&RC[-23])&IF(RC[-22]="",,"|n"&R1C13&RC[-22])&IF(RC[-20]&RC[-19]&RC[-18]&RC[-17]="",,"|n"&R1C14)&IF(RC[-20]="",,"|n"&R1C15&RC[-20])&IF(RC[-19]="",,"|n"&R1C16&RC[-19])&IF(RC[-18]="",,"|n"&R1C17&RC[-18])&IF(RC[-17]="",,"|n"&R1C18&RC[-17])&IF(RC[-16]="",,"|n"&R1C19&RC[-16])&IF(RC[-15]="",,"|n"&R1C20&RC[-15])&IF(RC[-14]="",,"|n"&R1C21&RC[-14])&IF(RC[-13]="",,"|n"&R1C22&RC[-13])&IF(RC[-11]="",,"|n"&R1C24&RC[-11])&IF(RC[-10]="",,"|n"&R1C25&RC[-10])&IF(RC[-9]="",,"|n"&R1C26&RC[-9])&IF(RC[-8]="",,"|n"&R1C27&RC[-8])&IF(RC[-7]="",,"|n"&R1C28&RC[-7])&IF(RC[-6]="",,"|n"&R1C29&RC[-6])&IF(RC[-2]="",,"|n"&RC[-2]) -> 
AI418: =IF(RC[-27]&RC[-26]&RC[-25]&RC[-24]&RC[-23]&RC[-22]="",,R1C7)&IF(RC[-27]="",,"|n"&R1C8&RC[-27])&IF(RC[-26]="",,"|n"&R1C9&RC[-26])&IF(RC[-25]="",,"|n"&R1C10&RC[-25])&IF(RC[-24]="",,"|n"&R1C11&RC[-24])&IF(RC[-23]="",,"|n"&R1C12&RC[-23])&IF(RC[-22]="",,"|n"&R1C13&RC[-22])&IF(RC[-20]&RC[-19]&RC[-18]&RC[-17]="",,"|n"&R1C14)&IF(RC[-20]="",,"|n"&R1C15&RC[-20])&IF(RC[-19]="",,"|n"&R1C16&RC[-19])&IF(RC[-18]="",,"|n"&R1C17&RC[-18])&IF(RC[-17]="",,"|n"&R1C18&RC[-17])&IF(RC[-16]="",,"|n"&R1C19&RC[-16])&IF(RC[-15]="",,"|n"&R1C20&RC[-15])&IF(RC[-14]="",,"|n"&R1C21&RC[-14])&IF(RC[-13]="",,"|n"&R1C22&RC[-13])&IF(RC[-11]="",,"|n"&R1C24&RC[-11])&IF(RC[-10]="",,"|n"&R1C25&RC[-10])&IF(RC[-9]="",,"|n"&R1C26&RC[-9])&IF(RC[-8]="",,"|n"&R1C27&RC[-8])&IF(RC[-7]="",,"|n"&R1C28&RC[-7])&IF(RC[-6]="",,"|n"&R1C29&RC[-6])&IF(RC[-2]="",,"|n"&RC[-2]) -> 
AI419: =IF(RC[-27]&RC[-26]&RC[-25]&RC[-24]&RC[-23]&RC[-22]="",,R1C7)&IF(RC[-27]="",,"|n"&R1C8&RC[-27])&IF(RC[-26]="",,"|n"&R1C9&RC[-26])&IF(RC[-25]="",,"|n"&R1C10&RC[-25])&IF(RC[-24]="",,"|n"&R1C11&RC[-24])&IF(RC[-23]="",,"|n"&R1C12&RC[-23])&IF(RC[-22]="",,"|n"&R1C13&RC[-22])&IF(RC[-20]&RC[-19]&RC[-18]&RC[-17]="",,"|n"&R1C14)&IF(RC[-20]="",,"|n"&R1C15&RC[-20])&IF(RC[-19]="",,"|n"&R1C16&RC[-19])&IF(RC[-18]="",,"|n"&R1C17&RC[-18])&IF(RC[-17]="",,"|n"&R1C18&RC[-17])&IF(RC[-16]="",,"|n"&R1C19&RC[-16])&IF(RC[-15]="",,"|n"&R1C20&RC[-15])&IF(RC[-14]="",,"|n"&R1C21&RC[-14])&IF(RC[-13]="",,"|n"&R1C22&RC[-13])&IF(RC[-11]="",,"|n"&R1C24&RC[-11])&IF(RC[-10]="",,"|n"&R1C25&RC[-10])&IF(RC[-9]="",,"|n"&R1C26&RC[-9])&IF(RC[-8]="",,"|n"&R1C27&RC[-8])&IF(RC[-7]="",,"|n"&R1C28&RC[-7])&IF(RC[-6]="",,"|n"&R1C29&RC[-6])&IF(RC[-2]="",,"|n"&RC[-2]) -> 
AI420: =IF(RC[-27]&RC[-26]&RC[-25]&RC[-24]&RC[-23]&RC[-22]="",,R1C7)&IF(RC[-27]="",,"|n"&R1C8&RC[-27])&IF(RC[-26]="",,"|n"&R1C9&RC[-26])&IF(RC[-25]="",,"|n"&R1C10&RC[-25])&IF(RC[-24]="",,"|n"&R1C11&RC[-24])&IF(RC[-23]="",,"|n"&R1C12&RC[-23])&IF(RC[-22]="",,"|n"&R1C13&RC[-22])&IF(RC[-20]&RC[-19]&RC[-18]&RC[-17]="",,"|n"&R1C14)&IF(RC[-20]="",,"|n"&R1C15&RC[-20])&IF(RC[-19]="",,"|n"&R1C16&RC[-19])&IF(RC[-18]="",,"|n"&R1C17&RC[-18])&IF(RC[-17]="",,"|n"&R1C18&RC[-17])&IF(RC[-16]="",,"|n"&R1C19&RC[-16])&IF(RC[-15]="",,"|n"&R1C20&RC[-15])&IF(RC[-14]="",,"|n"&R1C21&RC[-14])&IF(RC[-13]="",,"|n"&R1C22&RC[-13])&IF(RC[-11]="",,"|n"&R1C24&RC[-11])&IF(RC[-10]="",,"|n"&R1C25&RC[-10])&IF(RC[-9]="",,"|n"&R1C26&RC[-9])&IF(RC[-8]="",,"|n"&R1C27&RC[-8])&IF(RC[-7]="",,"|n"&R1C28&RC[-7])&IF(RC[-6]="",,"|n"&R1C29&RC[-6])&IF(RC[-2]="",,"|n"&RC[-2]) -> 
AI421: =IF(RC[-27]&RC[-26]&RC[-25]&RC[-24]&RC[-23]&RC[-22]="",,R1C7)&IF(RC[-27]="",,"|n"&R1C8&RC[-27])&IF(RC[-26]="",,"|n"&R1C9&RC[-26])&IF(RC[-25]="",,"|n"&R1C10&RC[-25])&IF(RC[-24]="",,"|n"&R1C11&RC[-24])&IF(RC[-23]="",,"|n"&R1C12&RC[-23])&IF(RC[-22]="",,"|n"&R1C13&RC[-22])&IF(RC[-20]&RC[-19]&RC[-18]&RC[-17]="",,"|n"&R1C14)&IF(RC[-20]="",,"|n"&R1C15&RC[-20])&IF(RC[-19]="",,"|n"&R1C16&RC[-19])&IF(RC[-18]="",,"|n"&R1C17&RC[-18])&IF(RC[-17]="",,"|n"&R1C18&RC[-17])&IF(RC[-16]="",,"|n"&R1C19&RC[-16])&IF(RC[-15]="",,"|n"&R1C20&RC[-15])&IF(RC[-14]="",,"|n"&R1C21&RC[-14])&IF(RC[-13]="",,"|n"&R1C22&RC[-13])&IF(RC[-11]="",,"|n"&R1C24&RC[-11])&IF(RC[-10]="",,"|n"&R1C25&RC[-10])&IF(RC[-9]="",,"|n"&R1C26&RC[-9])&IF(RC[-8]="",,"|n"&R1C27&RC[-8])&IF(RC[-7]="",,"|n"&R1C28&RC[-7])&IF(RC[-6]="",,"|n"&R1C29&RC[-6])&IF(RC[-2]="",,"|n"&RC[-2]) -> 
AI422: =IF(RC[-27]&RC[-26]&RC[-25]&RC[-24]&RC[-23]&RC[-22]="",,R1C7)&IF(RC[-27]="",,"|n"&R1C8&RC[-27])&IF(RC[-26]="",,"|n"&R1C9&RC[-26])&IF(RC[-25]="",,"|n"&R1C10&RC[-25])&IF(RC[-24]="",,"|n"&R1C11&RC[-24])&IF(RC[-23]="",,"|n"&R1C12&RC[-23])&IF(RC[-22]="",,"|n"&R1C13&RC[-22])&IF(RC[-20]&RC[-19]&RC[-18]&RC[-17]="",,"|n"&R1C14)&IF(RC[-20]="",,"|n"&R1C15&RC[-20])&IF(RC[-19]="",,"|n"&R1C16&RC[-19])&IF(RC[-18]="",,"|n"&R1C17&RC[-18])&IF(RC[-17]="",,"|n"&R1C18&RC[-17])&IF(RC[-16]="",,"|n"&R1C19&RC[-16])&IF(RC[-15]="",,"|n"&R1C20&RC[-15])&IF(RC[-14]="",,"|n"&R1C21&RC[-14])&IF(RC[-13]="",,"|n"&R1C22&RC[-13])&IF(RC[-11]="",,"|n"&R1C24&RC[-11])&IF(RC[-10]="",,"|n"&R1C25&RC[-10])&IF(RC[-9]="",,"|n"&R1C26&RC[-9])&IF(RC[-8]="",,"|n"&R1C27&RC[-8])&IF(RC[-7]="",,"|n"&R1C28&RC[-7])&IF(RC[-6]="",,"|n"&R1C29&RC[-6])&IF(RC[-2]="",,"|n"&RC[-2]) -> 
AI423: =IF(RC[-27]&RC[-26]&RC[-25]&RC[-24]&RC[-23]&RC[-22]="",,R1C7)&IF(RC[-27]="",,"|n"&R1C8&RC[-27])&IF(RC[-26]="",,"|n"&R1C9&RC[-26])&IF(RC[-25]="",,"|n"&R1C10&RC[-25])&IF(RC[-24]="",,"|n"&R1C11&RC[-24])&IF(RC[-23]="",,"|n"&R1C12&RC[-23])&IF(RC[-22]="",,"|n"&R1C13&RC[-22])&IF(RC[-20]&RC[-19]&RC[-18]&RC[-17]="",,"|n"&R1C14)&IF(RC[-20]="",,"|n"&R1C15&RC[-20])&IF(RC[-19]="",,"|n"&R1C16&RC[-19])&IF(RC[-18]="",,"|n"&R1C17&RC[-18])&IF(RC[-17]="",,"|n"&R1C18&RC[-17])&IF(RC[-16]="",,"|n"&R1C19&RC[-16])&IF(RC[-15]="",,"|n"&R1C20&RC[-15])&IF(RC[-14]="",,"|n"&R1C21&RC[-14])&IF(RC[-13]="",,"|n"&R1C22&RC[-13])&IF(RC[-11]="",,"|n"&R1C24&RC[-11])&IF(RC[-10]="",,"|n"&R1C25&RC[-10])&IF(RC[-9]="",,"|n"&R1C26&RC[-9])&IF(RC[-8]="",,"|n"&R1C27&RC[-8])&IF(RC[-7]="",,"|n"&R1C28&RC[-7])&IF(RC[-6]="",,"|n"&R1C29&RC[-6])&IF(RC[-2]="",,"|n"&RC[-2]) -> 
AI424: =IF(RC[-27]&RC[-26]&RC[-25]&RC[-24]&RC[-23]&RC[-22]="",,R1C7)&IF(RC[-27]="",,"|n"&R1C8&RC[-27])&IF(RC[-26]="",,"|n"&R1C9&RC[-26])&IF(RC[-25]="",,"|n"&R1C10&RC[-25])&IF(RC[-24]="",,"|n"&R1C11&RC[-24])&IF(RC[-23]="",,"|n"&R1C12&RC[-23])&IF(RC[-22]="",,"|n"&R1C13&RC[-22])&IF(RC[-20]&RC[-19]&RC[-18]&RC[-17]="",,"|n"&R1C14)&IF(RC[-20]="",,"|n"&R1C15&RC[-20])&IF(RC[-19]="",,"|n"&R1C16&RC[-19])&IF(RC[-18]="",,"|n"&R1C17&RC[-18])&IF(RC[-17]="",,"|n"&R1C18&RC[-17])&IF(RC[-16]="",,"|n"&R1C19&RC[-16])&IF(RC[-15]="",,"|n"&R1C20&RC[-15])&IF(RC[-14]="",,"|n"&R1C21&RC[-14])&IF(RC[-13]="",,"|n"&R1C22&RC[-13])&IF(RC[-11]="",,"|n"&R1C24&RC[-11])&IF(RC[-10]="",,"|n"&R1C25&RC[-10])&IF(RC[-9]="",,"|n"&R1C26&RC[-9])&IF(RC[-8]="",,"|n"&R1C27&RC[-8])&IF(RC[-7]="",,"|n"&R1C28&RC[-7])&IF(RC[-6]="",,"|n"&R1C29&RC[-6])&IF(RC[-2]="",,"|n"&RC[-2]) -> 
AI425: =IF(RC[-27]&RC[-26]&RC[-25]&RC[-24]&RC[-23]&RC[-22]="",,R1C7)&IF(RC[-27]="",,"|n"&R1C8&RC[-27])&IF(RC[-26]="",,"|n"&R1C9&RC[-26])&IF(RC[-25]="",,"|n"&R1C10&RC[-25])&IF(RC[-24]="",,"|n"&R1C11&RC[-24])&IF(RC[-23]="",,"|n"&R1C12&RC[-23])&IF(RC[-22]="",,"|n"&R1C13&RC[-22])&IF(RC[-20]&RC[-19]&RC[-18]&RC[-17]="",,"|n"&R1C14)&IF(RC[-20]="",,"|n"&R1C15&RC[-20])&IF(RC[-19]="",,"|n"&R1C16&RC[-19])&IF(RC[-18]="",,"|n"&R1C17&RC[-18])&IF(RC[-17]="",,"|n"&R1C18&RC[-17])&IF(RC[-16]="",,"|n"&R1C19&RC[-16])&IF(RC[-15]="",,"|n"&R1C20&RC[-15])&IF(RC[-14]="",,"|n"&R1C21&RC[-14])&IF(RC[-13]="",,"|n"&R1C22&RC[-13])&IF(RC[-11]="",,"|n"&R1C24&RC[-11])&IF(RC[-10]="",,"|n"&R1C25&RC[-10])&IF(RC[-9]="",,"|n"&R1C26&RC[-9])&IF(RC[-8]="",,"|n"&R1C27&RC[-8])&IF(RC[-7]="",,"|n"&R1C28&RC[-7])&IF(RC[-6]="",,"|n"&R1C29&RC[-6])&IF(RC[-2]="",,"|n"&RC[-2]) -> 
AI426: =IF(RC[-27]&RC[-26]&RC[-25]&RC[-24]&RC[-23]&RC[-22]="",,R1C7)&IF(RC[-27]="",,"|n"&R1C8&RC[-27])&IF(RC[-26]="",,"|n"&R1C9&RC[-26])&IF(RC[-25]="",,"|n"&R1C10&RC[-25])&IF(RC[-24]="",,"|n"&R1C11&RC[-24])&IF(RC[-23]="",,"|n"&R1C12&RC[-23])&IF(RC[-22]="",,"|n"&R1C13&RC[-22])&IF(RC[-20]&RC[-19]&RC[-18]&RC[-17]="",,"|n"&R1C14)&IF(RC[-20]="",,"|n"&R1C15&RC[-20])&IF(RC[-19]="",,"|n"&R1C16&RC[-19])&IF(RC[-18]="",,"|n"&R1C17&RC[-18])&IF(RC[-17]="",,"|n"&R1C18&RC[-17])&IF(RC[-16]="",,"|n"&R1C19&RC[-16])&IF(RC[-15]="",,"|n"&R1C20&RC[-15])&IF(RC[-14]="",,"|n"&R1C21&RC[-14])&IF(RC[-13]="",,"|n"&R1C22&RC[-13])&IF(RC[-11]="",,"|n"&R1C24&RC[-11])&IF(RC[-10]="",,"|n"&R1C25&RC[-10])&IF(RC[-9]="",,"|n"&R1C26&RC[-9])&IF(RC[-8]="",,"|n"&R1C27&RC[-8])&IF(RC[-7]="",,"|n"&R1C28&RC[-7])&IF(RC[-6]="",,"|n"&R1C29&RC[-6])&IF(RC[-2]="",,"|n"&RC[-2]) -> 
AI427: =IF(RC[-27]&RC[-26]&RC[-25]&RC[-24]&RC[-23]&RC[-22]="",,R1C7)&IF(RC[-27]="",,"|n"&R1C8&RC[-27])&IF(RC[-26]="",,"|n"&R1C9&RC[-26])&IF(RC[-25]="",,"|n"&R1C10&RC[-25])&IF(RC[-24]="",,"|n"&R1C11&RC[-24])&IF(RC[-23]="",,"|n"&R1C12&RC[-23])&IF(RC[-22]="",,"|n"&R1C13&RC[-22])&IF(RC[-20]&RC[-19]&RC[-18]&RC[-17]="",,"|n"&R1C14)&IF(RC[-20]="",,"|n"&R1C15&RC[-20])&IF(RC[-19]="",,"|n"&R1C16&RC[-19])&IF(RC[-18]="",,"|n"&R1C17&RC[-18])&IF(RC[-17]="",,"|n"&R1C18&RC[-17])&IF(RC[-16]="",,"|n"&R1C19&RC[-16])&IF(RC[-15]="",,"|n"&R1C20&RC[-15])&IF(RC[-14]="",,"|n"&R1C21&RC[-14])&IF(RC[-13]="",,"|n"&R1C22&RC[-13])&IF(RC[-11]="",,"|n"&R1C24&RC[-11])&IF(RC[-10]="",,"|n"&R1C25&RC[-10])&IF(RC[-9]="",,"|n"&R1C26&RC[-9])&IF(RC[-8]="",,"|n"&R1C27&RC[-8])&IF(RC[-7]="",,"|n"&R1C28&RC[-7])&IF(RC[-6]="",,"|n"&R1C29&RC[-6])&IF(RC[-2]="",,"|n"&RC[-2]) -> 
AI428: =IF(RC[-27]&RC[-26]&RC[-25]&RC[-24]&RC[-23]&RC[-22]="",,R1C7)&IF(RC[-27]="",,"|n"&R1C8&RC[-27])&IF(RC[-26]="",,"|n"&R1C9&RC[-26])&IF(RC[-25]="",,"|n"&R1C10&RC[-25])&IF(RC[-24]="",,"|n"&R1C11&RC[-24])&IF(RC[-23]="",,"|n"&R1C12&RC[-23])&IF(RC[-22]="",,"|n"&R1C13&RC[-22])&IF(RC[-20]&RC[-19]&RC[-18]&RC[-17]="",,"|n"&R1C14)&IF(RC[-20]="",,"|n"&R1C15&RC[-20])&IF(RC[-19]="",,"|n"&R1C16&RC[-19])&IF(RC[-18]="",,"|n"&R1C17&RC[-18])&IF(RC[-17]="",,"|n"&R1C18&RC[-17])&IF(RC[-16]="",,"|n"&R1C19&RC[-16])&IF(RC[-15]="",,"|n"&R1C20&RC[-15])&IF(RC[-14]="",,"|n"&R1C21&RC[-14])&IF(RC[-13]="",,"|n"&R1C22&RC[-13])&IF(RC[-11]="",,"|n"&R1C24&RC[-11])&IF(RC[-10]="",,"|n"&R1C25&RC[-10])&IF(RC[-9]="",,"|n"&R1C26&RC[-9])&IF(RC[-8]="",,"|n"&R1C27&RC[-8])&IF(RC[-7]="",,"|n"&R1C28&RC[-7])&IF(RC[-6]="",,"|n"&R1C29&RC[-6])&IF(RC[-2]="",,"|n"&RC[-2]) -> 
AI429: =IF(RC[-27]&RC[-26]&RC[-25]&RC[-24]&RC[-23]&RC[-22]="",,R1C7)&IF(RC[-27]="",,"|n"&R1C8&RC[-27])&IF(RC[-26]="",,"|n"&R1C9&RC[-26])&IF(RC[-25]="",,"|n"&R1C10&RC[-25])&IF(RC[-24]="",,"|n"&R1C11&RC[-24])&IF(RC[-23]="",,"|n"&R1C12&RC[-23])&IF(RC[-22]="",,"|n"&R1C13&RC[-22])&IF(RC[-20]&RC[-19]&RC[-18]&RC[-17]="",,"|n"&R1C14)&IF(RC[-20]="",,"|n"&R1C15&RC[-20])&IF(RC[-19]="",,"|n"&R1C16&RC[-19])&IF(RC[-18]="",,"|n"&R1C17&RC[-18])&IF(RC[-17]="",,"|n"&R1C18&RC[-17])&IF(RC[-16]="",,"|n"&R1C19&RC[-16])&IF(RC[-15]="",,"|n"&R1C20&RC[-15])&IF(RC[-14]="",,"|n"&R1C21&RC[-14])&IF(RC[-13]="",,"|n"&R1C22&RC[-13])&IF(RC[-11]="",,"|n"&R1C24&RC[-11])&IF(RC[-10]="",,"|n"&R1C25&RC[-10])&IF(RC[-9]="",,"|n"&R1C26&RC[-9])&IF(RC[-8]="",,"|n"&R1C27&RC[-8])&IF(RC[-7]="",,"|n"&R1C28&RC[-7])&IF(RC[-6]="",,"|n"&R1C29&RC[-6])&IF(RC[-2]="",,"|n"&RC[-2]) -> 
AI430: =IF(RC[-27]&RC[-26]&RC[-25]&RC[-24]&RC[-23]&RC[-22]="",,R1C7)&IF(RC[-27]="",,"|n"&R1C8&RC[-27])&IF(RC[-26]="",,"|n"&R1C9&RC[-26])&IF(RC[-25]="",,"|n"&R1C10&RC[-25])&IF(RC[-24]="",,"|n"&R1C11&RC[-24])&IF(RC[-23]="",,"|n"&R1C12&RC[-23])&IF(RC[-22]="",,"|n"&R1C13&RC[-22])&IF(RC[-20]&RC[-19]&RC[-18]&RC[-17]="",,"|n"&R1C14)&IF(RC[-20]="",,"|n"&R1C15&RC[-20])&IF(RC[-19]="",,"|n"&R1C16&RC[-19])&IF(RC[-18]="",,"|n"&R1C17&RC[-18])&IF(RC[-17]="",,"|n"&R1C18&RC[-17])&IF(RC[-16]="",,"|n"&R1C19&RC[-16])&IF(RC[-15]="",,"|n"&R1C20&RC[-15])&IF(RC[-14]="",,"|n"&R1C21&RC[-14])&IF(RC[-13]="",,"|n"&R1C22&RC[-13])&IF(RC[-11]="",,"|n"&R1C24&RC[-11])&IF(RC[-10]="",,"|n"&R1C25&RC[-10])&IF(RC[-9]="",,"|n"&R1C26&RC[-9])&IF(RC[-8]="",,"|n"&R1C27&RC[-8])&IF(RC[-7]="",,"|n"&R1C28&RC[-7])&IF(RC[-6]="",,"|n"&R1C29&RC[-6])&IF(RC[-2]="",,"|n"&RC[-2]) -> 
AI431: =IF(RC[-27]&RC[-26]&RC[-25]&RC[-24]&RC[-23]&RC[-22]="",,R1C7)&IF(RC[-27]="",,"|n"&R1C8&RC[-27])&IF(RC[-26]="",,"|n"&R1C9&RC[-26])&IF(RC[-25]="",,"|n"&R1C10&RC[-25])&IF(RC[-24]="",,"|n"&R1C11&RC[-24])&IF(RC[-23]="",,"|n"&R1C12&RC[-23])&IF(RC[-22]="",,"|n"&R1C13&RC[-22])&IF(RC[-20]&RC[-19]&RC[-18]&RC[-17]="",,"|n"&R1C14)&IF(RC[-20]="",,"|n"&R1C15&RC[-20])&IF(RC[-19]="",,"|n"&R1C16&RC[-19])&IF(RC[-18]="",,"|n"&R1C17&RC[-18])&IF(RC[-17]="",,"|n"&R1C18&RC[-17])&IF(RC[-16]="",,"|n"&R1C19&RC[-16])&IF(RC[-15]="",,"|n"&R1C20&RC[-15])&IF(RC[-14]="",,"|n"&R1C21&RC[-14])&IF(RC[-13]="",,"|n"&R1C22&RC[-13])&IF(RC[-11]="",,"|n"&R1C24&RC[-11])&IF(RC[-10]="",,"|n"&R1C25&RC[-10])&IF(RC[-9]="",,"|n"&R1C26&RC[-9])&IF(RC[-8]="",,"|n"&R1C27&RC[-8])&IF(RC[-7]="",,"|n"&R1C28&RC[-7])&IF(RC[-6]="",,"|n"&R1C29&RC[-6])&IF(RC[-2]="",,"|n"&RC[-2]) -> 
AI432: =IF(RC[-27]&RC[-26]&RC[-25]&RC[-24]&RC[-23]&RC[-22]="",,R1C7)&IF(RC[-27]="",,"|n"&R1C8&RC[-27])&IF(RC[-26]="",,"|n"&R1C9&RC[-26])&IF(RC[-25]="",,"|n"&R1C10&RC[-25])&IF(RC[-24]="",,"|n"&R1C11&RC[-24])&IF(RC[-23]="",,"|n"&R1C12&RC[-23])&IF(RC[-22]="",,"|n"&R1C13&RC[-22])&IF(RC[-20]&RC[-19]&RC[-18]&RC[-17]="",,"|n"&R1C14)&IF(RC[-20]="",,"|n"&R1C15&RC[-20])&IF(RC[-19]="",,"|n"&R1C16&RC[-19])&IF(RC[-18]="",,"|n"&R1C17&RC[-18])&IF(RC[-17]="",,"|n"&R1C18&RC[-17])&IF(RC[-16]="",,"|n"&R1C19&RC[-16])&IF(RC[-15]="",,"|n"&R1C20&RC[-15])&IF(RC[-14]="",,"|n"&R1C21&RC[-14])&IF(RC[-13]="",,"|n"&R1C22&RC[-13])&IF(RC[-11]="",,"|n"&R1C24&RC[-11])&IF(RC[-10]="",,"|n"&R1C25&RC[-10])&IF(RC[-9]="",,"|n"&R1C26&RC[-9])&IF(RC[-8]="",,"|n"&R1C27&RC[-8])&IF(RC[-7]="",,"|n"&R1C28&RC[-7])&IF(RC[-6]="",,"|n"&R1C29&RC[-6])&IF(RC[-2]="",,"|n"&RC[-2]) -> 
AI433: =IF(RC[-27]&RC[-26]&RC[-25]&RC[-24]&RC[-23]&RC[-22]="",,R1C7)&IF(RC[-27]="",,"|n"&R1C8&RC[-27])&IF(RC[-26]="",,"|n"&R1C9&RC[-26])&IF(RC[-25]="",,"|n"&R1C10&RC[-25])&IF(RC[-24]="",,"|n"&R1C11&RC[-24])&IF(RC[-23]="",,"|n"&R1C12&RC[-23])&IF(RC[-22]="",,"|n"&R1C13&RC[-22])&IF(RC[-20]&RC[-19]&RC[-18]&RC[-17]="",,"|n"&R1C14)&IF(RC[-20]="",,"|n"&R1C15&RC[-20])&IF(RC[-19]="",,"|n"&R1C16&RC[-19])&IF(RC[-18]="",,"|n"&R1C17&RC[-18])&IF(RC[-17]="",,"|n"&R1C18&RC[-17])&IF(RC[-16]="",,"|n"&R1C19&RC[-16])&IF(RC[-15]="",,"|n"&R1C20&RC[-15])&IF(RC[-14]="",,"|n"&R1C21&RC[-14])&IF(RC[-13]="",,"|n"&R1C22&RC[-13])&IF(RC[-11]="",,"|n"&R1C24&RC[-11])&IF(RC[-10]="",,"|n"&R1C25&RC[-10])&IF(RC[-9]="",,"|n"&R1C26&RC[-9])&IF(RC[-8]="",,"|n"&R1C27&RC[-8])&IF(RC[-7]="",,"|n"&R1C28&RC[-7])&IF(RC[-6]="",,"|n"&R1C29&RC[-6])&IF(RC[-2]="",,"|n"&RC[-2]) -> 
AI434: =IF(RC[-27]&RC[-26]&RC[-25]&RC[-24]&RC[-23]&RC[-22]="",,R1C7)&IF(RC[-27]="",,"|n"&R1C8&RC[-27])&IF(RC[-26]="",,"|n"&R1C9&RC[-26])&IF(RC[-25]="",,"|n"&R1C10&RC[-25])&IF(RC[-24]="",,"|n"&R1C11&RC[-24])&IF(RC[-23]="",,"|n"&R1C12&RC[-23])&IF(RC[-22]="",,"|n"&R1C13&RC[-22])&IF(RC[-20]&RC[-19]&RC[-18]&RC[-17]="",,"|n"&R1C14)&IF(RC[-20]="",,"|n"&R1C15&RC[-20])&IF(RC[-19]="",,"|n"&R1C16&RC[-19])&IF(RC[-18]="",,"|n"&R1C17&RC[-18])&IF(RC[-17]="",,"|n"&R1C18&RC[-17])&IF(RC[-16]="",,"|n"&R1C19&RC[-16])&IF(RC[-15]="",,"|n"&R1C20&RC[-15])&IF(RC[-14]="",,"|n"&R1C21&RC[-14])&IF(RC[-13]="",,"|n"&R1C22&RC[-13])&IF(RC[-11]="",,"|n"&R1C24&RC[-11])&IF(RC[-10]="",,"|n"&R1C25&RC[-10])&IF(RC[-9]="",,"|n"&R1C26&RC[-9])&IF(RC[-8]="",,"|n"&R1C27&RC[-8])&IF(RC[-7]="",,"|n"&R1C28&RC[-7])&IF(RC[-6]="",,"|n"&R1C29&RC[-6])&IF(RC[-2]="",,"|n"&RC[-2]) -> 
AI435: =IF(RC[-27]&RC[-26]&RC[-25]&RC[-24]&RC[-23]&RC[-22]="",,R1C7)&IF(RC[-27]="",,"|n"&R1C8&RC[-27])&IF(RC[-26]="",,"|n"&R1C9&RC[-26])&IF(RC[-25]="",,"|n"&R1C10&RC[-25])&IF(RC[-24]="",,"|n"&R1C11&RC[-24])&IF(RC[-23]="",,"|n"&R1C12&RC[-23])&IF(RC[-22]="",,"|n"&R1C13&RC[-22])&IF(RC[-20]&RC[-19]&RC[-18]&RC[-17]="",,"|n"&R1C14)&IF(RC[-20]="",,"|n"&R1C15&RC[-20])&IF(RC[-19]="",,"|n"&R1C16&RC[-19])&IF(RC[-18]="",,"|n"&R1C17&RC[-18])&IF(RC[-17]="",,"|n"&R1C18&RC[-17])&IF(RC[-16]="",,"|n"&R1C19&RC[-16])&IF(RC[-15]="",,"|n"&R1C20&RC[-15])&IF(RC[-14]="",,"|n"&R1C21&RC[-14])&IF(RC[-13]="",,"|n"&R1C22&RC[-13])&IF(RC[-11]="",,"|n"&R1C24&RC[-11])&IF(RC[-10]="",,"|n"&R1C25&RC[-10])&IF(RC[-9]="",,"|n"&R1C26&RC[-9])&IF(RC[-8]="",,"|n"&R1C27&RC[-8])&IF(RC[-7]="",,"|n"&R1C28&RC[-7])&IF(RC[-6]="",,"|n"&R1C29&RC[-6])&IF(RC[-2]="",,"|n"&RC[-2]) -> 
AI436: =IF(RC[-27]&RC[-26]&RC[-25]&RC[-24]&RC[-23]&RC[-22]="",,R1C7)&IF(RC[-27]="",,"|n"&R1C8&RC[-27])&IF(RC[-26]="",,"|n"&R1C9&RC[-26])&IF(RC[-25]="",,"|n"&R1C10&RC[-25])&IF(RC[-24]="",,"|n"&R1C11&RC[-24])&IF(RC[-23]="",,"|n"&R1C12&RC[-23])&IF(RC[-22]="",,"|n"&R1C13&RC[-22])&IF(RC[-20]&RC[-19]&RC[-18]&RC[-17]="",,"|n"&R1C14)&IF(RC[-20]="",,"|n"&R1C15&RC[-20])&IF(RC[-19]="",,"|n"&R1C16&RC[-19])&IF(RC[-18]="",,"|n"&R1C17&RC[-18])&IF(RC[-17]="",,"|n"&R1C18&RC[-17])&IF(RC[-16]="",,"|n"&R1C19&RC[-16])&IF(RC[-15]="",,"|n"&R1C20&RC[-15])&IF(RC[-14]="",,"|n"&R1C21&RC[-14])&IF(RC[-13]="",,"|n"&R1C22&RC[-13])&IF(RC[-11]="",,"|n"&R1C24&RC[-11])&IF(RC[-10]="",,"|n"&R1C25&RC[-10])&IF(RC[-9]="",,"|n"&R1C26&RC[-9])&IF(RC[-8]="",,"|n"&R1C27&RC[-8])&IF(RC[-7]="",,"|n"&R1C28&RC[-7])&IF(RC[-6]="",,"|n"&R1C29&RC[-6])&IF(RC[-2]="",,"|n"&RC[-2]) -> 
AI437: =IF(RC[-27]&RC[-26]&RC[-25]&RC[-24]&RC[-23]&RC[-22]="",,R1C7)&IF(RC[-27]="",,"|n"&R1C8&RC[-27])&IF(RC[-26]="",,"|n"&R1C9&RC[-26])&IF(RC[-25]="",,"|n"&R1C10&RC[-25])&IF(RC[-24]="",,"|n"&R1C11&RC[-24])&IF(RC[-23]="",,"|n"&R1C12&RC[-23])&IF(RC[-22]="",,"|n"&R1C13&RC[-22])&IF(RC[-20]&RC[-19]&RC[-18]&RC[-17]="",,"|n"&R1C14)&IF(RC[-20]="",,"|n"&R1C15&RC[-20])&IF(RC[-19]="",,"|n"&R1C16&RC[-19])&IF(RC[-18]="",,"|n"&R1C17&RC[-18])&IF(RC[-17]="",,"|n"&R1C18&RC[-17])&IF(RC[-16]="",,"|n"&R1C19&RC[-16])&IF(RC[-15]="",,"|n"&R1C20&RC[-15])&IF(RC[-14]="",,"|n"&R1C21&RC[-14])&IF(RC[-13]="",,"|n"&R1C22&RC[-13])&IF(RC[-11]="",,"|n"&R1C24&RC[-11])&IF(RC[-10]="",,"|n"&R1C25&RC[-10])&IF(RC[-9]="",,"|n"&R1C26&RC[-9])&IF(RC[-8]="",,"|n"&R1C27&RC[-8])&IF(RC[-7]="",,"|n"&R1C28&RC[-7])&IF(RC[-6]="",,"|n"&R1C29&RC[-6])&IF(RC[-2]="",,"|n"&RC[-2]) -> 
AI438: =IF(RC[-27]&RC[-26]&RC[-25]&RC[-24]&RC[-23]&RC[-22]="",,R1C7)&IF(RC[-27]="",,"|n"&R1C8&RC[-27])&IF(RC[-26]="",,"|n"&R1C9&RC[-26])&IF(RC[-25]="",,"|n"&R1C10&RC[-25])&IF(RC[-24]="",,"|n"&R1C11&RC[-24])&IF(RC[-23]="",,"|n"&R1C12&RC[-23])&IF(RC[-22]="",,"|n"&R1C13&RC[-22])&IF(RC[-20]&RC[-19]&RC[-18]&RC[-17]="",,"|n"&R1C14)&IF(RC[-20]="",,"|n"&R1C15&RC[-20])&IF(RC[-19]="",,"|n"&R1C16&RC[-19])&IF(RC[-18]="",,"|n"&R1C17&RC[-18])&IF(RC[-17]="",,"|n"&R1C18&RC[-17])&IF(RC[-16]="",,"|n"&R1C19&RC[-16])&IF(RC[-15]="",,"|n"&R1C20&RC[-15])&IF(RC[-14]="",,"|n"&R1C21&RC[-14])&IF(RC[-13]="",,"|n"&R1C22&RC[-13])&IF(RC[-11]="",,"|n"&R1C24&RC[-11])&IF(RC[-10]="",,"|n"&R1C25&RC[-10])&IF(RC[-9]="",,"|n"&R1C26&RC[-9])&IF(RC[-8]="",,"|n"&R1C27&RC[-8])&IF(RC[-7]="",,"|n"&R1C28&RC[-7])&IF(RC[-6]="",,"|n"&R1C29&RC[-6])&IF(RC[-2]="",,"|n"&RC[-2]) -> 
AI439: =IF(RC[-27]&RC[-26]&RC[-25]&RC[-24]&RC[-23]&RC[-22]="",,R1C7)&IF(RC[-27]="",,"|n"&R1C8&RC[-27])&IF(RC[-26]="",,"|n"&R1C9&RC[-26])&IF(RC[-25]="",,"|n"&R1C10&RC[-25])&IF(RC[-24]="",,"|n"&R1C11&RC[-24])&IF(RC[-23]="",,"|n"&R1C12&RC[-23])&IF(RC[-22]="",,"|n"&R1C13&RC[-22])&IF(RC[-20]&RC[-19]&RC[-18]&RC[-17]="",,"|n"&R1C14)&IF(RC[-20]="",,"|n"&R1C15&RC[-20])&IF(RC[-19]="",,"|n"&R1C16&RC[-19])&IF(RC[-18]="",,"|n"&R1C17&RC[-18])&IF(RC[-17]="",,"|n"&R1C18&RC[-17])&IF(RC[-16]="",,"|n"&R1C19&RC[-16])&IF(RC[-15]="",,"|n"&R1C20&RC[-15])&IF(RC[-14]="",,"|n"&R1C21&RC[-14])&IF(RC[-13]="",,"|n"&R1C22&RC[-13])&IF(RC[-11]="",,"|n"&R1C24&RC[-11])&IF(RC[-10]="",,"|n"&R1C25&RC[-10])&IF(RC[-9]="",,"|n"&R1C26&RC[-9])&IF(RC[-8]="",,"|n"&R1C27&RC[-8])&IF(RC[-7]="",,"|n"&R1C28&RC[-7])&IF(RC[-6]="",,"|n"&R1C29&RC[-6])&IF(RC[-2]="",,"|n"&RC[-2]) -> 
AI440: =IF(RC[-27]&RC[-26]&RC[-25]&RC[-24]&RC[-23]&RC[-22]="",,R1C7)&IF(RC[-27]="",,"|n"&R1C8&RC[-27])&IF(RC[-26]="",,"|n"&R1C9&RC[-26])&IF(RC[-25]="",,"|n"&R1C10&RC[-25])&IF(RC[-24]="",,"|n"&R1C11&RC[-24])&IF(RC[-23]="",,"|n"&R1C12&RC[-23])&IF(RC[-22]="",,"|n"&R1C13&RC[-22])&IF(RC[-20]&RC[-19]&RC[-18]&RC[-17]="",,"|n"&R1C14)&IF(RC[-20]="",,"|n"&R1C15&RC[-20])&IF(RC[-19]="",,"|n"&R1C16&RC[-19])&IF(RC[-18]="",,"|n"&R1C17&RC[-18])&IF(RC[-17]="",,"|n"&R1C18&RC[-17])&IF(RC[-16]="",,"|n"&R1C19&RC[-16])&IF(RC[-15]="",,"|n"&R1C20&RC[-15])&IF(RC[-14]="",,"|n"&R1C21&RC[-14])&IF(RC[-13]="",,"|n"&R1C22&RC[-13])&IF(RC[-11]="",,"|n"&R1C24&RC[-11])&IF(RC[-10]="",,"|n"&R1C25&RC[-10])&IF(RC[-9]="",,"|n"&R1C26&RC[-9])&IF(RC[-8]="",,"|n"&R1C27&RC[-8])&IF(RC[-7]="",,"|n"&R1C28&RC[-7])&IF(RC[-6]="",,"|n"&R1C29&RC[-6])&IF(RC[-2]="",,"|n"&RC[-2]) -> 
AI441: =IF(RC[-27]&RC[-26]&RC[-25]&RC[-24]&RC[-23]&RC[-22]="",,R1C7)&IF(RC[-27]="",,"|n"&R1C8&RC[-27])&IF(RC[-26]="",,"|n"&R1C9&RC[-26])&IF(RC[-25]="",,"|n"&R1C10&RC[-25])&IF(RC[-24]="",,"|n"&R1C11&RC[-24])&IF(RC[-23]="",,"|n"&R1C12&RC[-23])&IF(RC[-22]="",,"|n"&R1C13&RC[-22])&IF(RC[-20]&RC[-19]&RC[-18]&RC[-17]="",,"|n"&R1C14)&IF(RC[-20]="",,"|n"&R1C15&RC[-20])&IF(RC[-19]="",,"|n"&R1C16&RC[-19])&IF(RC[-18]="",,"|n"&R1C17&RC[-18])&IF(RC[-17]="",,"|n"&R1C18&RC[-17])&IF(RC[-16]="",,"|n"&R1C19&RC[-16])&IF(RC[-15]="",,"|n"&R1C20&RC[-15])&IF(RC[-14]="",,"|n"&R1C21&RC[-14])&IF(RC[-13]="",,"|n"&R1C22&RC[-13])&IF(RC[-11]="",,"|n"&R1C24&RC[-11])&IF(RC[-10]="",,"|n"&R1C25&RC[-10])&IF(RC[-9]="",,"|n"&R1C26&RC[-9])&IF(RC[-8]="",,"|n"&R1C27&RC[-8])&IF(RC[-7]="",,"|n"&R1C28&RC[-7])&IF(RC[-6]="",,"|n"&R1C29&RC[-6])&IF(RC[-2]="",,"|n"&RC[-2]) -> 
AI442: =IF(RC[-27]&RC[-26]&RC[-25]&RC[-24]&RC[-23]&RC[-22]="",,R1C7)&IF(RC[-27]="",,"|n"&R1C8&RC[-27])&IF(RC[-26]="",,"|n"&R1C9&RC[-26])&IF(RC[-25]="",,"|n"&R1C10&RC[-25])&IF(RC[-24]="",,"|n"&R1C11&RC[-24])&IF(RC[-23]="",,"|n"&R1C12&RC[-23])&IF(RC[-22]="",,"|n"&R1C13&RC[-22])&IF(RC[-20]&RC[-19]&RC[-18]&RC[-17]="",,"|n"&R1C14)&IF(RC[-20]="",,"|n"&R1C15&RC[-20])&IF(RC[-19]="",,"|n"&R1C16&RC[-19])&IF(RC[-18]="",,"|n"&R1C17&RC[-18])&IF(RC[-17]="",,"|n"&R1C18&RC[-17])&IF(RC[-16]="",,"|n"&R1C19&RC[-16])&IF(RC[-15]="",,"|n"&R1C20&RC[-15])&IF(RC[-14]="",,"|n"&R1C21&RC[-14])&IF(RC[-13]="",,"|n"&R1C22&RC[-13])&IF(RC[-11]="",,"|n"&R1C24&RC[-11])&IF(RC[-10]="",,"|n"&R1C25&RC[-10])&IF(RC[-9]="",,"|n"&R1C26&RC[-9])&IF(RC[-8]="",,"|n"&R1C27&RC[-8])&IF(RC[-7]="",,"|n"&R1C28&RC[-7])&IF(RC[-6]="",,"|n"&R1C29&RC[-6])&IF(RC[-2]="",,"|n"&RC[-2]) -> 
AI443: =IF(RC[-27]&RC[-26]&RC[-25]&RC[-24]&RC[-23]&RC[-22]="",,R1C7)&IF(RC[-27]="",,"|n"&R1C8&RC[-27])&IF(RC[-26]="",,"|n"&R1C9&RC[-26])&IF(RC[-25]="",,"|n"&R1C10&RC[-25])&IF(RC[-24]="",,"|n"&R1C11&RC[-24])&IF(RC[-23]="",,"|n"&R1C12&RC[-23])&IF(RC[-22]="",,"|n"&R1C13&RC[-22])&IF(RC[-20]&RC[-19]&RC[-18]&RC[-17]="",,"|n"&R1C14)&IF(RC[-20]="",,"|n"&R1C15&RC[-20])&IF(RC[-19]="",,"|n"&R1C16&RC[-19])&IF(RC[-18]="",,"|n"&R1C17&RC[-18])&IF(RC[-17]="",,"|n"&R1C18&RC[-17])&IF(RC[-16]="",,"|n"&R1C19&RC[-16])&IF(RC[-15]="",,"|n"&R1C20&RC[-15])&IF(RC[-14]="",,"|n"&R1C21&RC[-14])&IF(RC[-13]="",,"|n"&R1C22&RC[-13])&IF(RC[-11]="",,"|n"&R1C24&RC[-11])&IF(RC[-10]="",,"|n"&R1C25&RC[-10])&IF(RC[-9]="",,"|n"&R1C26&RC[-9])&IF(RC[-8]="",,"|n"&R1C27&RC[-8])&IF(RC[-7]="",,"|n"&R1C28&RC[-7])&IF(RC[-6]="",,"|n"&R1C29&RC[-6])&IF(RC[-2]="",,"|n"&RC[-2]) -> 
AI444: =IF(RC[-27]&RC[-26]&RC[-25]&RC[-24]&RC[-23]&RC[-22]="",,R1C7)&IF(RC[-27]="",,"|n"&R1C8&RC[-27])&IF(RC[-26]="",,"|n"&R1C9&RC[-26])&IF(RC[-25]="",,"|n"&R1C10&RC[-25])&IF(RC[-24]="",,"|n"&R1C11&RC[-24])&IF(RC[-23]="",,"|n"&R1C12&RC[-23])&IF(RC[-22]="",,"|n"&R1C13&RC[-22])&IF(RC[-20]&RC[-19]&RC[-18]&RC[-17]="",,"|n"&R1C14)&IF(RC[-20]="",,"|n"&R1C15&RC[-20])&IF(RC[-19]="",,"|n"&R1C16&RC[-19])&IF(RC[-18]="",,"|n"&R1C17&RC[-18])&IF(RC[-17]="",,"|n"&R1C18&RC[-17])&IF(RC[-16]="",,"|n"&R1C19&RC[-16])&IF(RC[-15]="",,"|n"&R1C20&RC[-15])&IF(RC[-14]="",,"|n"&R1C21&RC[-14])&IF(RC[-13]="",,"|n"&R1C22&RC[-13])&IF(RC[-11]="",,"|n"&R1C24&RC[-11])&IF(RC[-10]="",,"|n"&R1C25&RC[-10])&IF(RC[-9]="",,"|n"&R1C26&RC[-9])&IF(RC[-8]="",,"|n"&R1C27&RC[-8])&IF(RC[-7]="",,"|n"&R1C28&RC[-7])&IF(RC[-6]="",,"|n"&R1C29&RC[-6])&IF(RC[-2]="",,"|n"&RC[-2]) -> 
AI445: =IF(RC[-27]&RC[-26]&RC[-25]&RC[-24]&RC[-23]&RC[-22]="",,R1C7)&IF(RC[-27]="",,"|n"&R1C8&RC[-27])&IF(RC[-26]="",,"|n"&R1C9&RC[-26])&IF(RC[-25]="",,"|n"&R1C10&RC[-25])&IF(RC[-24]="",,"|n"&R1C11&RC[-24])&IF(RC[-23]="",,"|n"&R1C12&RC[-23])&IF(RC[-22]="",,"|n"&R1C13&RC[-22])&IF(RC[-20]&RC[-19]&RC[-18]&RC[-17]="",,"|n"&R1C14)&IF(RC[-20]="",,"|n"&R1C15&RC[-20])&IF(RC[-19]="",,"|n"&R1C16&RC[-19])&IF(RC[-18]="",,"|n"&R1C17&RC[-18])&IF(RC[-17]="",,"|n"&R1C18&RC[-17])&IF(RC[-16]="",,"|n"&R1C19&RC[-16])&IF(RC[-15]="",,"|n"&R1C20&RC[-15])&IF(RC[-14]="",,"|n"&R1C21&RC[-14])&IF(RC[-13]="",,"|n"&R1C22&RC[-13])&IF(RC[-11]="",,"|n"&R1C24&RC[-11])&IF(RC[-10]="",,"|n"&R1C25&RC[-10])&IF(RC[-9]="",,"|n"&R1C26&RC[-9])&IF(RC[-8]="",,"|n"&R1C27&RC[-8])&IF(RC[-7]="",,"|n"&R1C28&RC[-7])&IF(RC[-6]="",,"|n"&R1C29&RC[-6])&IF(RC[-2]="",,"|n"&RC[-2]) -> 
AI446: =IF(RC[-27]&RC[-26]&RC[-25]&RC[-24]&RC[-23]&RC[-22]="",,R1C7)&IF(RC[-27]="",,"|n"&R1C8&RC[-27])&IF(RC[-26]="",,"|n"&R1C9&RC[-26])&IF(RC[-25]="",,"|n"&R1C10&RC[-25])&IF(RC[-24]="",,"|n"&R1C11&RC[-24])&IF(RC[-23]="",,"|n"&R1C12&RC[-23])&IF(RC[-22]="",,"|n"&R1C13&RC[-22])&IF(RC[-20]&RC[-19]&RC[-18]&RC[-17]="",,"|n"&R1C14)&IF(RC[-20]="",,"|n"&R1C15&RC[-20])&IF(RC[-19]="",,"|n"&R1C16&RC[-19])&IF(RC[-18]="",,"|n"&R1C17&RC[-18])&IF(RC[-17]="",,"|n"&R1C18&RC[-17])&IF(RC[-16]="",,"|n"&R1C19&RC[-16])&IF(RC[-15]="",,"|n"&R1C20&RC[-15])&IF(RC[-14]="",,"|n"&R1C21&RC[-14])&IF(RC[-13]="",,"|n"&R1C22&RC[-13])&IF(RC[-11]="",,"|n"&R1C24&RC[-11])&IF(RC[-10]="",,"|n"&R1C25&RC[-10])&IF(RC[-9]="",,"|n"&R1C26&RC[-9])&IF(RC[-8]="",,"|n"&R1C27&RC[-8])&IF(RC[-7]="",,"|n"&R1C28&RC[-7])&IF(RC[-6]="",,"|n"&R1C29&RC[-6])&IF(RC[-2]="",,"|n"&RC[-2]) -> 
AI447: =IF(RC[-27]&RC[-26]&RC[-25]&RC[-24]&RC[-23]&RC[-22]="",,R1C7)&IF(RC[-27]="",,"|n"&R1C8&RC[-27])&IF(RC[-26]="",,"|n"&R1C9&RC[-26])&IF(RC[-25]="",,"|n"&R1C10&RC[-25])&IF(RC[-24]="",,"|n"&R1C11&RC[-24])&IF(RC[-23]="",,"|n"&R1C12&RC[-23])&IF(RC[-22]="",,"|n"&R1C13&RC[-22])&IF(RC[-20]&RC[-19]&RC[-18]&RC[-17]="",,"|n"&R1C14)&IF(RC[-20]="",,"|n"&R1C15&RC[-20])&IF(RC[-19]="",,"|n"&R1C16&RC[-19])&IF(RC[-18]="",,"|n"&R1C17&RC[-18])&IF(RC[-17]="",,"|n"&R1C18&RC[-17])&IF(RC[-16]="",,"|n"&R1C19&RC[-16])&IF(RC[-15]="",,"|n"&R1C20&RC[-15])&IF(RC[-14]="",,"|n"&R1C21&RC[-14])&IF(RC[-13]="",,"|n"&R1C22&RC[-13])&IF(RC[-11]="",,"|n"&R1C24&RC[-11])&IF(RC[-10]="",,"|n"&R1C25&RC[-10])&IF(RC[-9]="",,"|n"&R1C26&RC[-9])&IF(RC[-8]="",,"|n"&R1C27&RC[-8])&IF(RC[-7]="",,"|n"&R1C28&RC[-7])&IF(RC[-6]="",,"|n"&R1C29&RC[-6])&IF(RC[-2]="",,"|n"&RC[-2]) -> 
AI448: =IF(RC[-27]&RC[-26]&RC[-25]&RC[-24]&RC[-23]&RC[-22]="",,R1C7)&IF(RC[-27]="",,"|n"&R1C8&RC[-27])&IF(RC[-26]="",,"|n"&R1C9&RC[-26])&IF(RC[-25]="",,"|n"&R1C10&RC[-25])&IF(RC[-24]="",,"|n"&R1C11&RC[-24])&IF(RC[-23]="",,"|n"&R1C12&RC[-23])&IF(RC[-22]="",,"|n"&R1C13&RC[-22])&IF(RC[-20]&RC[-19]&RC[-18]&RC[-17]="",,"|n"&R1C14)&IF(RC[-20]="",,"|n"&R1C15&RC[-20])&IF(RC[-19]="",,"|n"&R1C16&RC[-19])&IF(RC[-18]="",,"|n"&R1C17&RC[-18])&IF(RC[-17]="",,"|n"&R1C18&RC[-17])&IF(RC[-16]="",,"|n"&R1C19&RC[-16])&IF(RC[-15]="",,"|n"&R1C20&RC[-15])&IF(RC[-14]="",,"|n"&R1C21&RC[-14])&IF(RC[-13]="",,"|n"&R1C22&RC[-13])&IF(RC[-11]="",,"|n"&R1C24&RC[-11])&IF(RC[-10]="",,"|n"&R1C25&RC[-10])&IF(RC[-9]="",,"|n"&R1C26&RC[-9])&IF(RC[-8]="",,"|n"&R1C27&RC[-8])&IF(RC[-7]="",,"|n"&R1C28&RC[-7])&IF(RC[-6]="",,"|n"&R1C29&RC[-6])&IF(RC[-2]="",,"|n"&RC[-2]) -> 
AI449: =IF(RC[-27]&RC[-26]&RC[-25]&RC[-24]&RC[-23]&RC[-22]="",,R1C7)&IF(RC[-27]="",,"|n"&R1C8&RC[-27])&IF(RC[-26]="",,"|n"&R1C9&RC[-26])&IF(RC[-25]="",,"|n"&R1C10&RC[-25])&IF(RC[-24]="",,"|n"&R1C11&RC[-24])&IF(RC[-23]="",,"|n"&R1C12&RC[-23])&IF(RC[-22]="",,"|n"&R1C13&RC[-22])&IF(RC[-20]&RC[-19]&RC[-18]&RC[-17]="",,"|n"&R1C14)&IF(RC[-20]="",,"|n"&R1C15&RC[-20])&IF(RC[-19]="",,"|n"&R1C16&RC[-19])&IF(RC[-18]="",,"|n"&R1C17&RC[-18])&IF(RC[-17]="",,"|n"&R1C18&RC[-17])&IF(RC[-16]="",,"|n"&R1C19&RC[-16])&IF(RC[-15]="",,"|n"&R1C20&RC[-15])&IF(RC[-14]="",,"|n"&R1C21&RC[-14])&IF(RC[-13]="",,"|n"&R1C22&RC[-13])&IF(RC[-11]="",,"|n"&R1C24&RC[-11])&IF(RC[-10]="",,"|n"&R1C25&RC[-10])&IF(RC[-9]="",,"|n"&R1C26&RC[-9])&IF(RC[-8]="",,"|n"&R1C27&RC[-8])&IF(RC[-7]="",,"|n"&R1C28&RC[-7])&IF(RC[-6]="",,"|n"&R1C29&RC[-6])&IF(RC[-2]="",,"|n"&RC[-2]) -> 
AI450: =IF(RC[-27]&RC[-26]&RC[-25]&RC[-24]&RC[-23]&RC[-22]="",,R1C7)&IF(RC[-27]="",,"|n"&R1C8&RC[-27])&IF(RC[-26]="",,"|n"&R1C9&RC[-26])&IF(RC[-25]="",,"|n"&R1C10&RC[-25])&IF(RC[-24]="",,"|n"&R1C11&RC[-24])&IF(RC[-23]="",,"|n"&R1C12&RC[-23])&IF(RC[-22]="",,"|n"&R1C13&RC[-22])&IF(RC[-20]&RC[-19]&RC[-18]&RC[-17]="",,"|n"&R1C14)&IF(RC[-20]="",,"|n"&R1C15&RC[-20])&IF(RC[-19]="",,"|n"&R1C16&RC[-19])&IF(RC[-18]="",,"|n"&R1C17&RC[-18])&IF(RC[-17]="",,"|n"&R1C18&RC[-17])&IF(RC[-16]="",,"|n"&R1C19&RC[-16])&IF(RC[-15]="",,"|n"&R1C20&RC[-15])&IF(RC[-14]="",,"|n"&R1C21&RC[-14])&IF(RC[-13]="",,"|n"&R1C22&RC[-13])&IF(RC[-11]="",,"|n"&R1C24&RC[-11])&IF(RC[-10]="",,"|n"&R1C25&RC[-10])&IF(RC[-9]="",,"|n"&R1C26&RC[-9])&IF(RC[-8]="",,"|n"&R1C27&RC[-8])&IF(RC[-7]="",,"|n"&R1C28&RC[-7])&IF(RC[-6]="",,"|n"&R1C29&RC[-6])&IF(RC[-2]="",,"|n"&RC[-2]) -> 
AI451: =IF(RC[-27]&RC[-26]&RC[-25]&RC[-24]&RC[-23]&RC[-22]="",,R1C7)&IF(RC[-27]="",,"|n"&R1C8&RC[-27])&IF(RC[-26]="",,"|n"&R1C9&RC[-26])&IF(RC[-25]="",,"|n"&R1C10&RC[-25])&IF(RC[-24]="",,"|n"&R1C11&RC[-24])&IF(RC[-23]="",,"|n"&R1C12&RC[-23])&IF(RC[-22]="",,"|n"&R1C13&RC[-22])&IF(RC[-20]&RC[-19]&RC[-18]&RC[-17]="",,"|n"&R1C14)&IF(RC[-20]="",,"|n"&R1C15&RC[-20])&IF(RC[-19]="",,"|n"&R1C16&RC[-19])&IF(RC[-18]="",,"|n"&R1C17&RC[-18])&IF(RC[-17]="",,"|n"&R1C18&RC[-17])&IF(RC[-16]="",,"|n"&R1C19&RC[-16])&IF(RC[-15]="",,"|n"&R1C20&RC[-15])&IF(RC[-14]="",,"|n"&R1C21&RC[-14])&IF(RC[-13]="",,"|n"&R1C22&RC[-13])&IF(RC[-11]="",,"|n"&R1C24&RC[-11])&IF(RC[-10]="",,"|n"&R1C25&RC[-10])&IF(RC[-9]="",,"|n"&R1C26&RC[-9])&IF(RC[-8]="",,"|n"&R1C27&RC[-8])&IF(RC[-7]="",,"|n"&R1C28&RC[-7])&IF(RC[-6]="",,"|n"&R1C29&RC[-6])&IF(RC[-2]="",,"|n"&RC[-2]) -> 
AI452: =IF(RC[-27]&RC[-26]&RC[-25]&RC[-24]&RC[-23]&RC[-22]="",,R1C7)&IF(RC[-27]="",,"|n"&R1C8&RC[-27])&IF(RC[-26]="",,"|n"&R1C9&RC[-26])&IF(RC[-25]="",,"|n"&R1C10&RC[-25])&IF(RC[-24]="",,"|n"&R1C11&RC[-24])&IF(RC[-23]="",,"|n"&R1C12&RC[-23])&IF(RC[-22]="",,"|n"&R1C13&RC[-22])&IF(RC[-20]&RC[-19]&RC[-18]&RC[-17]="",,"|n"&R1C14)&IF(RC[-20]="",,"|n"&R1C15&RC[-20])&IF(RC[-19]="",,"|n"&R1C16&RC[-19])&IF(RC[-18]="",,"|n"&R1C17&RC[-18])&IF(RC[-17]="",,"|n"&R1C18&RC[-17])&IF(RC[-16]="",,"|n"&R1C19&RC[-16])&IF(RC[-15]="",,"|n"&R1C20&RC[-15])&IF(RC[-14]="",,"|n"&R1C21&RC[-14])&IF(RC[-13]="",,"|n"&R1C22&RC[-13])&IF(RC[-11]="",,"|n"&R1C24&RC[-11])&IF(RC[-10]="",,"|n"&R1C25&RC[-10])&IF(RC[-9]="",,"|n"&R1C26&RC[-9])&IF(RC[-8]="",,"|n"&R1C27&RC[-8])&IF(RC[-7]="",,"|n"&R1C28&RC[-7])&IF(RC[-6]="",,"|n"&R1C29&RC[-6])&IF(RC[-2]="",,"|n"&RC[-2]) -> 
AI453: =IF(RC[-27]&RC[-26]&RC[-25]&RC[-24]&RC[-23]&RC[-22]="",,R1C7)&IF(RC[-27]="",,"|n"&R1C8&RC[-27])&IF(RC[-26]="",,"|n"&R1C9&RC[-26])&IF(RC[-25]="",,"|n"&R1C10&RC[-25])&IF(RC[-24]="",,"|n"&R1C11&RC[-24])&IF(RC[-23]="",,"|n"&R1C12&RC[-23])&IF(RC[-22]="",,"|n"&R1C13&RC[-22])&IF(RC[-20]&RC[-19]&RC[-18]&RC[-17]="",,"|n"&R1C14)&IF(RC[-20]="",,"|n"&R1C15&RC[-20])&IF(RC[-19]="",,"|n"&R1C16&RC[-19])&IF(RC[-18]="",,"|n"&R1C17&RC[-18])&IF(RC[-17]="",,"|n"&R1C18&RC[-17])&IF(RC[-16]="",,"|n"&R1C19&RC[-16])&IF(RC[-15]="",,"|n"&R1C20&RC[-15])&IF(RC[-14]="",,"|n"&R1C21&RC[-14])&IF(RC[-13]="",,"|n"&R1C22&RC[-13])&IF(RC[-11]="",,"|n"&R1C24&RC[-11])&IF(RC[-10]="",,"|n"&R1C25&RC[-10])&IF(RC[-9]="",,"|n"&R1C26&RC[-9])&IF(RC[-8]="",,"|n"&R1C27&RC[-8])&IF(RC[-7]="",,"|n"&R1C28&RC[-7])&IF(RC[-6]="",,"|n"&R1C29&RC[-6])&IF(RC[-2]="",,"|n"&RC[-2]) -> 
AI454: =IF(RC[-27]&RC[-26]&RC[-25]&RC[-24]&RC[-23]&RC[-22]="",,R1C7)&IF(RC[-27]="",,"|n"&R1C8&RC[-27])&IF(RC[-26]="",,"|n"&R1C9&RC[-26])&IF(RC[-25]="",,"|n"&R1C10&RC[-25])&IF(RC[-24]="",,"|n"&R1C11&RC[-24])&IF(RC[-23]="",,"|n"&R1C12&RC[-23])&IF(RC[-22]="",,"|n"&R1C13&RC[-22])&IF(RC[-20]&RC[-19]&RC[-18]&RC[-17]="",,"|n"&R1C14)&IF(RC[-20]="",,"|n"&R1C15&RC[-20])&IF(RC[-19]="",,"|n"&R1C16&RC[-19])&IF(RC[-18]="",,"|n"&R1C17&RC[-18])&IF(RC[-17]="",,"|n"&R1C18&RC[-17])&IF(RC[-16]="",,"|n"&R1C19&RC[-16])&IF(RC[-15]="",,"|n"&R1C20&RC[-15])&IF(RC[-14]="",,"|n"&R1C21&RC[-14])&IF(RC[-13]="",,"|n"&R1C22&RC[-13])&IF(RC[-11]="",,"|n"&R1C24&RC[-11])&IF(RC[-10]="",,"|n"&R1C25&RC[-10])&IF(RC[-9]="",,"|n"&R1C26&RC[-9])&IF(RC[-8]="",,"|n"&R1C27&RC[-8])&IF(RC[-7]="",,"|n"&R1C28&RC[-7])&IF(RC[-6]="",,"|n"&R1C29&RC[-6])&IF(RC[-2]="",,"|n"&RC[-2]) -> 
AI455: =IF(RC[-27]&RC[-26]&RC[-25]&RC[-24]&RC[-23]&RC[-22]="",,R1C7)&IF(RC[-27]="",,"|n"&R1C8&RC[-27])&IF(RC[-26]="",,"|n"&R1C9&RC[-26])&IF(RC[-25]="",,"|n"&R1C10&RC[-25])&IF(RC[-24]="",,"|n"&R1C11&RC[-24])&IF(RC[-23]="",,"|n"&R1C12&RC[-23])&IF(RC[-22]="",,"|n"&R1C13&RC[-22])&IF(RC[-20]&RC[-19]&RC[-18]&RC[-17]="",,"|n"&R1C14)&IF(RC[-20]="",,"|n"&R1C15&RC[-20])&IF(RC[-19]="",,"|n"&R1C16&RC[-19])&IF(RC[-18]="",,"|n"&R1C17&RC[-18])&IF(RC[-17]="",,"|n"&R1C18&RC[-17])&IF(RC[-16]="",,"|n"&R1C19&RC[-16])&IF(RC[-15]="",,"|n"&R1C20&RC[-15])&IF(RC[-14]="",,"|n"&R1C21&RC[-14])&IF(RC[-13]="",,"|n"&R1C22&RC[-13])&IF(RC[-11]="",,"|n"&R1C24&RC[-11])&IF(RC[-10]="",,"|n"&R1C25&RC[-10])&IF(RC[-9]="",,"|n"&R1C26&RC[-9])&IF(RC[-8]="",,"|n"&R1C27&RC[-8])&IF(RC[-7]="",,"|n"&R1C28&RC[-7])&IF(RC[-6]="",,"|n"&R1C29&RC[-6])&IF(RC[-2]="",,"|n"&RC[-2]) -> 
AI456: =IF(RC[-27]&RC[-26]&RC[-25]&RC[-24]&RC[-23]&RC[-22]="",,R1C7)&IF(RC[-27]="",,"|n"&R1C8&RC[-27])&IF(RC[-26]="",,"|n"&R1C9&RC[-26])&IF(RC[-25]="",,"|n"&R1C10&RC[-25])&IF(RC[-24]="",,"|n"&R1C11&RC[-24])&IF(RC[-23]="",,"|n"&R1C12&RC[-23])&IF(RC[-22]="",,"|n"&R1C13&RC[-22])&IF(RC[-20]&RC[-19]&RC[-18]&RC[-17]="",,"|n"&R1C14)&IF(RC[-20]="",,"|n"&R1C15&RC[-20])&IF(RC[-19]="",,"|n"&R1C16&RC[-19])&IF(RC[-18]="",,"|n"&R1C17&RC[-18])&IF(RC[-17]="",,"|n"&R1C18&RC[-17])&IF(RC[-16]="",,"|n"&R1C19&RC[-16])&IF(RC[-15]="",,"|n"&R1C20&RC[-15])&IF(RC[-14]="",,"|n"&R1C21&RC[-14])&IF(RC[-13]="",,"|n"&R1C22&RC[-13])&IF(RC[-11]="",,"|n"&R1C24&RC[-11])&IF(RC[-10]="",,"|n"&R1C25&RC[-10])&IF(RC[-9]="",,"|n"&R1C26&RC[-9])&IF(RC[-8]="",,"|n"&R1C27&RC[-8])&IF(RC[-7]="",,"|n"&R1C28&RC[-7])&IF(RC[-6]="",,"|n"&R1C29&RC[-6])&IF(RC[-2]="",,"|n"&RC[-2]) -> 
AI457: =IF(RC[-27]&RC[-26]&RC[-25]&RC[-24]&RC[-23]&RC[-22]="",,R1C7)&IF(RC[-27]="",,"|n"&R1C8&RC[-27])&IF(RC[-26]="",,"|n"&R1C9&RC[-26])&IF(RC[-25]="",,"|n"&R1C10&RC[-25])&IF(RC[-24]="",,"|n"&R1C11&RC[-24])&IF(RC[-23]="",,"|n"&R1C12&RC[-23])&IF(RC[-22]="",,"|n"&R1C13&RC[-22])&IF(RC[-20]&RC[-19]&RC[-18]&RC[-17]="",,"|n"&R1C14)&IF(RC[-20]="",,"|n"&R1C15&RC[-20])&IF(RC[-19]="",,"|n"&R1C16&RC[-19])&IF(RC[-18]="",,"|n"&R1C17&RC[-18])&IF(RC[-17]="",,"|n"&R1C18&RC[-17])&IF(RC[-16]="",,"|n"&R1C19&RC[-16])&IF(RC[-15]="",,"|n"&R1C20&RC[-15])&IF(RC[-14]="",,"|n"&R1C21&RC[-14])&IF(RC[-13]="",,"|n"&R1C22&RC[-13])&IF(RC[-11]="",,"|n"&R1C24&RC[-11])&IF(RC[-10]="",,"|n"&R1C25&RC[-10])&IF(RC[-9]="",,"|n"&R1C26&RC[-9])&IF(RC[-8]="",,"|n"&R1C27&RC[-8])&IF(RC[-7]="",,"|n"&R1C28&RC[-7])&IF(RC[-6]="",,"|n"&R1C29&RC[-6])&IF(RC[-2]="",,"|n"&RC[-2]) -> 
AI458: =IF(RC[-27]&RC[-26]&RC[-25]&RC[-24]&RC[-23]&RC[-22]="",,R1C7)&IF(RC[-27]="",,"|n"&R1C8&RC[-27])&IF(RC[-26]="",,"|n"&R1C9&RC[-26])&IF(RC[-25]="",,"|n"&R1C10&RC[-25])&IF(RC[-24]="",,"|n"&R1C11&RC[-24])&IF(RC[-23]="",,"|n"&R1C12&RC[-23])&IF(RC[-22]="",,"|n"&R1C13&RC[-22])&IF(RC[-20]&RC[-19]&RC[-18]&RC[-17]="",,"|n"&R1C14)&IF(RC[-20]="",,"|n"&R1C15&RC[-20])&IF(RC[-19]="",,"|n"&R1C16&RC[-19])&IF(RC[-18]="",,"|n"&R1C17&RC[-18])&IF(RC[-17]="",,"|n"&R1C18&RC[-17])&IF(RC[-16]="",,"|n"&R1C19&RC[-16])&IF(RC[-15]="",,"|n"&R1C20&RC[-15])&IF(RC[-14]="",,"|n"&R1C21&RC[-14])&IF(RC[-13]="",,"|n"&R1C22&RC[-13])&IF(RC[-11]="",,"|n"&R1C24&RC[-11])&IF(RC[-10]="",,"|n"&R1C25&RC[-10])&IF(RC[-9]="",,"|n"&R1C26&RC[-9])&IF(RC[-8]="",,"|n"&R1C27&RC[-8])&IF(RC[-7]="",,"|n"&R1C28&RC[-7])&IF(RC[-6]="",,"|n"&R1C29&RC[-6])&IF(RC[-2]="",,"|n"&RC[-2]) -> 
AI459: =IF(RC[-27]&RC[-26]&RC[-25]&RC[-24]&RC[-23]&RC[-22]="",,R1C7)&IF(RC[-27]="",,"|n"&R1C8&RC[-27])&IF(RC[-26]="",,"|n"&R1C9&RC[-26])&IF(RC[-25]="",,"|n"&R1C10&RC[-25])&IF(RC[-24]="",,"|n"&R1C11&RC[-24])&IF(RC[-23]="",,"|n"&R1C12&RC[-23])&IF(RC[-22]="",,"|n"&R1C13&RC[-22])&IF(RC[-20]&RC[-19]&RC[-18]&RC[-17]="",,"|n"&R1C14)&IF(RC[-20]="",,"|n"&R1C15&RC[-20])&IF(RC[-19]="",,"|n"&R1C16&RC[-19])&IF(RC[-18]="",,"|n"&R1C17&RC[-18])&IF(RC[-17]="",,"|n"&R1C18&RC[-17])&IF(RC[-16]="",,"|n"&R1C19&RC[-16])&IF(RC[-15]="",,"|n"&R1C20&RC[-15])&IF(RC[-14]="",,"|n"&R1C21&RC[-14])&IF(RC[-13]="",,"|n"&R1C22&RC[-13])&IF(RC[-11]="",,"|n"&R1C24&RC[-11])&IF(RC[-10]="",,"|n"&R1C25&RC[-10])&IF(RC[-9]="",,"|n"&R1C26&RC[-9])&IF(RC[-8]="",,"|n"&R1C27&RC[-8])&IF(RC[-7]="",,"|n"&R1C28&RC[-7])&IF(RC[-6]="",,"|n"&R1C29&RC[-6])&IF(RC[-2]="",,"|n"&RC[-2]) -> 
AI460: =IF(RC[-27]&RC[-26]&RC[-25]&RC[-24]&RC[-23]&RC[-22]="",,R1C7)&IF(RC[-27]="",,"|n"&R1C8&RC[-27])&IF(RC[-26]="",,"|n"&R1C9&RC[-26])&IF(RC[-25]="",,"|n"&R1C10&RC[-25])&IF(RC[-24]="",,"|n"&R1C11&RC[-24])&IF(RC[-23]="",,"|n"&R1C12&RC[-23])&IF(RC[-22]="",,"|n"&R1C13&RC[-22])&IF(RC[-20]&RC[-19]&RC[-18]&RC[-17]="",,"|n"&R1C14)&IF(RC[-20]="",,"|n"&R1C15&RC[-20])&IF(RC[-19]="",,"|n"&R1C16&RC[-19])&IF(RC[-18]="",,"|n"&R1C17&RC[-18])&IF(RC[-17]="",,"|n"&R1C18&RC[-17])&IF(RC[-16]="",,"|n"&R1C19&RC[-16])&IF(RC[-15]="",,"|n"&R1C20&RC[-15])&IF(RC[-14]="",,"|n"&R1C21&RC[-14])&IF(RC[-13]="",,"|n"&R1C22&RC[-13])&IF(RC[-11]="",,"|n"&R1C24&RC[-11])&IF(RC[-10]="",,"|n"&R1C25&RC[-10])&IF(RC[-9]="",,"|n"&R1C26&RC[-9])&IF(RC[-8]="",,"|n"&R1C27&RC[-8])&IF(RC[-7]="",,"|n"&R1C28&RC[-7])&IF(RC[-6]="",,"|n"&R1C29&RC[-6])&IF(RC[-2]="",,"|n"&RC[-2]) -> 
AI461: =IF(RC[-27]&RC[-26]&RC[-25]&RC[-24]&RC[-23]&RC[-22]="",,R1C7)&IF(RC[-27]="",,"|n"&R1C8&RC[-27])&IF(RC[-26]="",,"|n"&R1C9&RC[-26])&IF(RC[-25]="",,"|n"&R1C10&RC[-25])&IF(RC[-24]="",,"|n"&R1C11&RC[-24])&IF(RC[-23]="",,"|n"&R1C12&RC[-23])&IF(RC[-22]="",,"|n"&R1C13&RC[-22])&IF(RC[-20]&RC[-19]&RC[-18]&RC[-17]="",,"|n"&R1C14)&IF(RC[-20]="",,"|n"&R1C15&RC[-20])&IF(RC[-19]="",,"|n"&R1C16&RC[-19])&IF(RC[-18]="",,"|n"&R1C17&RC[-18])&IF(RC[-17]="",,"|n"&R1C18&RC[-17])&IF(RC[-16]="",,"|n"&R1C19&RC[-16])&IF(RC[-15]="",,"|n"&R1C20&RC[-15])&IF(RC[-14]="",,"|n"&R1C21&RC[-14])&IF(RC[-13]="",,"|n"&R1C22&RC[-13])&IF(RC[-11]="",,"|n"&R1C24&RC[-11])&IF(RC[-10]="",,"|n"&R1C25&RC[-10])&IF(RC[-9]="",,"|n"&R1C26&RC[-9])&IF(RC[-8]="",,"|n"&R1C27&RC[-8])&IF(RC[-7]="",,"|n"&R1C28&RC[-7])&IF(RC[-6]="",,"|n"&R1C29&RC[-6])&IF(RC[-2]="",,"|n"&RC[-2]) -> 
AI462: =IF(RC[-27]&RC[-26]&RC[-25]&RC[-24]&RC[-23]&RC[-22]="",,R1C7)&IF(RC[-27]="",,"|n"&R1C8&RC[-27])&IF(RC[-26]="",,"|n"&R1C9&RC[-26])&IF(RC[-25]="",,"|n"&R1C10&RC[-25])&IF(RC[-24]="",,"|n"&R1C11&RC[-24])&IF(RC[-23]="",,"|n"&R1C12&RC[-23])&IF(RC[-22]="",,"|n"&R1C13&RC[-22])&IF(RC[-20]&RC[-19]&RC[-18]&RC[-17]="",,"|n"&R1C14)&IF(RC[-20]="",,"|n"&R1C15&RC[-20])&IF(RC[-19]="",,"|n"&R1C16&RC[-19])&IF(RC[-18]="",,"|n"&R1C17&RC[-18])&IF(RC[-17]="",,"|n"&R1C18&RC[-17])&IF(RC[-16]="",,"|n"&R1C19&RC[-16])&IF(RC[-15]="",,"|n"&R1C20&RC[-15])&IF(RC[-14]="",,"|n"&R1C21&RC[-14])&IF(RC[-13]="",,"|n"&R1C22&RC[-13])&IF(RC[-11]="",,"|n"&R1C24&RC[-11])&IF(RC[-10]="",,"|n"&R1C25&RC[-10])&IF(RC[-9]="",,"|n"&R1C26&RC[-9])&IF(RC[-8]="",,"|n"&R1C27&RC[-8])&IF(RC[-7]="",,"|n"&R1C28&RC[-7])&IF(RC[-6]="",,"|n"&R1C29&RC[-6])&IF(RC[-2]="",,"|n"&RC[-2]) -> 
AI463: =IF(RC[-27]&RC[-26]&RC[-25]&RC[-24]&RC[-23]&RC[-22]="",,R1C7)&IF(RC[-27]="",,"|n"&R1C8&RC[-27])&IF(RC[-26]="",,"|n"&R1C9&RC[-26])&IF(RC[-25]="",,"|n"&R1C10&RC[-25])&IF(RC[-24]="",,"|n"&R1C11&RC[-24])&IF(RC[-23]="",,"|n"&R1C12&RC[-23])&IF(RC[-22]="",,"|n"&R1C13&RC[-22])&IF(RC[-20]&RC[-19]&RC[-18]&RC[-17]="",,"|n"&R1C14)&IF(RC[-20]="",,"|n"&R1C15&RC[-20])&IF(RC[-19]="",,"|n"&R1C16&RC[-19])&IF(RC[-18]="",,"|n"&R1C17&RC[-18])&IF(RC[-17]="",,"|n"&R1C18&RC[-17])&IF(RC[-16]="",,"|n"&R1C19&RC[-16])&IF(RC[-15]="",,"|n"&R1C20&RC[-15])&IF(RC[-14]="",,"|n"&R1C21&RC[-14])&IF(RC[-13]="",,"|n"&R1C22&RC[-13])&IF(RC[-11]="",,"|n"&R1C24&RC[-11])&IF(RC[-10]="",,"|n"&R1C25&RC[-10])&IF(RC[-9]="",,"|n"&R1C26&RC[-9])&IF(RC[-8]="",,"|n"&R1C27&RC[-8])&IF(RC[-7]="",,"|n"&R1C28&RC[-7])&IF(RC[-6]="",,"|n"&R1C29&RC[-6])&IF(RC[-2]="",,"|n"&RC[-2]) -> 
AI464: =IF(RC[-27]&RC[-26]&RC[-25]&RC[-24]&RC[-23]&RC[-22]="",,R1C7)&IF(RC[-27]="",,"|n"&R1C8&RC[-27])&IF(RC[-26]="",,"|n"&R1C9&RC[-26])&IF(RC[-25]="",,"|n"&R1C10&RC[-25])&IF(RC[-24]="",,"|n"&R1C11&RC[-24])&IF(RC[-23]="",,"|n"&R1C12&RC[-23])&IF(RC[-22]="",,"|n"&R1C13&RC[-22])&IF(RC[-20]&RC[-19]&RC[-18]&RC[-17]="",,"|n"&R1C14)&IF(RC[-20]="",,"|n"&R1C15&RC[-20])&IF(RC[-19]="",,"|n"&R1C16&RC[-19])&IF(RC[-18]="",,"|n"&R1C17&RC[-18])&IF(RC[-17]="",,"|n"&R1C18&RC[-17])&IF(RC[-16]="",,"|n"&R1C19&RC[-16])&IF(RC[-15]="",,"|n"&R1C20&RC[-15])&IF(RC[-14]="",,"|n"&R1C21&RC[-14])&IF(RC[-13]="",,"|n"&R1C22&RC[-13])&IF(RC[-11]="",,"|n"&R1C24&RC[-11])&IF(RC[-10]="",,"|n"&R1C25&RC[-10])&IF(RC[-9]="",,"|n"&R1C26&RC[-9])&IF(RC[-8]="",,"|n"&R1C27&RC[-8])&IF(RC[-7]="",,"|n"&R1C28&RC[-7])&IF(RC[-6]="",,"|n"&R1C29&RC[-6])&IF(RC[-2]="",,"|n"&RC[-2]) -> 
AI465: =IF(RC[-27]&RC[-26]&RC[-25]&RC[-24]&RC[-23]&RC[-22]="",,R1C7)&IF(RC[-27]="",,"|n"&R1C8&RC[-27])&IF(RC[-26]="",,"|n"&R1C9&RC[-26])&IF(RC[-25]="",,"|n"&R1C10&RC[-25])&IF(RC[-24]="",,"|n"&R1C11&RC[-24])&IF(RC[-23]="",,"|n"&R1C12&RC[-23])&IF(RC[-22]="",,"|n"&R1C13&RC[-22])&IF(RC[-20]&RC[-19]&RC[-18]&RC[-17]="",,"|n"&R1C14)&IF(RC[-20]="",,"|n"&R1C15&RC[-20])&IF(RC[-19]="",,"|n"&R1C16&RC[-19])&IF(RC[-18]="",,"|n"&R1C17&RC[-18])&IF(RC[-17]="",,"|n"&R1C18&RC[-17])&IF(RC[-16]="",,"|n"&R1C19&RC[-16])&IF(RC[-15]="",,"|n"&R1C20&RC[-15])&IF(RC[-14]="",,"|n"&R1C21&RC[-14])&IF(RC[-13]="",,"|n"&R1C22&RC[-13])&IF(RC[-11]="",,"|n"&R1C24&RC[-11])&IF(RC[-10]="",,"|n"&R1C25&RC[-10])&IF(RC[-9]="",,"|n"&R1C26&RC[-9])&IF(RC[-8]="",,"|n"&R1C27&RC[-8])&IF(RC[-7]="",,"|n"&R1C28&RC[-7])&IF(RC[-6]="",,"|n"&R1C29&RC[-6])&IF(RC[-2]="",,"|n"&RC[-2]) -> 
AI466: =IF(RC[-27]&RC[-26]&RC[-25]&RC[-24]&RC[-23]&RC[-22]="",,R1C7)&IF(RC[-27]="",,"|n"&R1C8&RC[-27])&IF(RC[-26]="",,"|n"&R1C9&RC[-26])&IF(RC[-25]="",,"|n"&R1C10&RC[-25])&IF(RC[-24]="",,"|n"&R1C11&RC[-24])&IF(RC[-23]="",,"|n"&R1C12&RC[-23])&IF(RC[-22]="",,"|n"&R1C13&RC[-22])&IF(RC[-20]&RC[-19]&RC[-18]&RC[-17]="",,"|n"&R1C14)&IF(RC[-20]="",,"|n"&R1C15&RC[-20])&IF(RC[-19]="",,"|n"&R1C16&RC[-19])&IF(RC[-18]="",,"|n"&R1C17&RC[-18])&IF(RC[-17]="",,"|n"&R1C18&RC[-17])&IF(RC[-16]="",,"|n"&R1C19&RC[-16])&IF(RC[-15]="",,"|n"&R1C20&RC[-15])&IF(RC[-14]="",,"|n"&R1C21&RC[-14])&IF(RC[-13]="",,"|n"&R1C22&RC[-13])&IF(RC[-11]="",,"|n"&R1C24&RC[-11])&IF(RC[-10]="",,"|n"&R1C25&RC[-10])&IF(RC[-9]="",,"|n"&R1C26&RC[-9])&IF(RC[-8]="",,"|n"&R1C27&RC[-8])&IF(RC[-7]="",,"|n"&R1C28&RC[-7])&IF(RC[-6]="",,"|n"&R1C29&RC[-6])&IF(RC[-2]="",,"|n"&RC[-2]) -> 
AI467: =IF(RC[-27]&RC[-26]&RC[-25]&RC[-24]&RC[-23]&RC[-22]="",,R1C7)&IF(RC[-27]="",,"|n"&R1C8&RC[-27])&IF(RC[-26]="",,"|n"&R1C9&RC[-26])&IF(RC[-25]="",,"|n"&R1C10&RC[-25])&IF(RC[-24]="",,"|n"&R1C11&RC[-24])&IF(RC[-23]="",,"|n"&R1C12&RC[-23])&IF(RC[-22]="",,"|n"&R1C13&RC[-22])&IF(RC[-20]&RC[-19]&RC[-18]&RC[-17]="",,"|n"&R1C14)&IF(RC[-20]="",,"|n"&R1C15&RC[-20])&IF(RC[-19]="",,"|n"&R1C16&RC[-19])&IF(RC[-18]="",,"|n"&R1C17&RC[-18])&IF(RC[-17]="",,"|n"&R1C18&RC[-17])&IF(RC[-16]="",,"|n"&R1C19&RC[-16])&IF(RC[-15]="",,"|n"&R1C20&RC[-15])&IF(RC[-14]="",,"|n"&R1C21&RC[-14])&IF(RC[-13]="",,"|n"&R1C22&RC[-13])&IF(RC[-11]="",,"|n"&R1C24&RC[-11])&IF(RC[-10]="",,"|n"&R1C25&RC[-10])&IF(RC[-9]="",,"|n"&R1C26&RC[-9])&IF(RC[-8]="",,"|n"&R1C27&RC[-8])&IF(RC[-7]="",,"|n"&R1C28&RC[-7])&IF(RC[-6]="",,"|n"&R1C29&RC[-6])&IF(RC[-2]="",,"|n"&RC[-2]) -> 
AI468: =IF(RC[-27]&RC[-26]&RC[-25]&RC[-24]&RC[-23]&RC[-22]="",,R1C7)&IF(RC[-27]="",,"|n"&R1C8&RC[-27])&IF(RC[-26]="",,"|n"&R1C9&RC[-26])&IF(RC[-25]="",,"|n"&R1C10&RC[-25])&IF(RC[-24]="",,"|n"&R1C11&RC[-24])&IF(RC[-23]="",,"|n"&R1C12&RC[-23])&IF(RC[-22]="",,"|n"&R1C13&RC[-22])&IF(RC[-20]&RC[-19]&RC[-18]&RC[-17]="",,"|n"&R1C14)&IF(RC[-20]="",,"|n"&R1C15&RC[-20])&IF(RC[-19]="",,"|n"&R1C16&RC[-19])&IF(RC[-18]="",,"|n"&R1C17&RC[-18])&IF(RC[-17]="",,"|n"&R1C18&RC[-17])&IF(RC[-16]="",,"|n"&R1C19&RC[-16])&IF(RC[-15]="",,"|n"&R1C20&RC[-15])&IF(RC[-14]="",,"|n"&R1C21&RC[-14])&IF(RC[-13]="",,"|n"&R1C22&RC[-13])&IF(RC[-11]="",,"|n"&R1C24&RC[-11])&IF(RC[-10]="",,"|n"&R1C25&RC[-10])&IF(RC[-9]="",,"|n"&R1C26&RC[-9])&IF(RC[-8]="",,"|n"&R1C27&RC[-8])&IF(RC[-7]="",,"|n"&R1C28&RC[-7])&IF(RC[-6]="",,"|n"&R1C29&RC[-6])&IF(RC[-2]="",,"|n"&RC[-2]) -> 
AI469: =IF(RC[-27]&RC[-26]&RC[-25]&RC[-24]&RC[-23]&RC[-22]="",,R1C7)&IF(RC[-27]="",,"|n"&R1C8&RC[-27])&IF(RC[-26]="",,"|n"&R1C9&RC[-26])&IF(RC[-25]="",,"|n"&R1C10&RC[-25])&IF(RC[-24]="",,"|n"&R1C11&RC[-24])&IF(RC[-23]="",,"|n"&R1C12&RC[-23])&IF(RC[-22]="",,"|n"&R1C13&RC[-22])&IF(RC[-20]&RC[-19]&RC[-18]&RC[-17]="",,"|n"&R1C14)&IF(RC[-20]="",,"|n"&R1C15&RC[-20])&IF(RC[-19]="",,"|n"&R1C16&RC[-19])&IF(RC[-18]="",,"|n"&R1C17&RC[-18])&IF(RC[-17]="",,"|n"&R1C18&RC[-17])&IF(RC[-16]="",,"|n"&R1C19&RC[-16])&IF(RC[-15]="",,"|n"&R1C20&RC[-15])&IF(RC[-14]="",,"|n"&R1C21&RC[-14])&IF(RC[-13]="",,"|n"&R1C22&RC[-13])&IF(RC[-11]="",,"|n"&R1C24&RC[-11])&IF(RC[-10]="",,"|n"&R1C25&RC[-10])&IF(RC[-9]="",,"|n"&R1C26&RC[-9])&IF(RC[-8]="",,"|n"&R1C27&RC[-8])&IF(RC[-7]="",,"|n"&R1C28&RC[-7])&IF(RC[-6]="",,"|n"&R1C29&RC[-6])&IF(RC[-2]="",,"|n"&RC[-2]) -> 
AI470: =IF(RC[-27]&RC[-26]&RC[-25]&RC[-24]&RC[-23]&RC[-22]="",,R1C7)&IF(RC[-27]="",,"|n"&R1C8&RC[-27])&IF(RC[-26]="",,"|n"&R1C9&RC[-26])&IF(RC[-25]="",,"|n"&R1C10&RC[-25])&IF(RC[-24]="",,"|n"&R1C11&RC[-24])&IF(RC[-23]="",,"|n"&R1C12&RC[-23])&IF(RC[-22]="",,"|n"&R1C13&RC[-22])&IF(RC[-20]&RC[-19]&RC[-18]&RC[-17]="",,"|n"&R1C14)&IF(RC[-20]="",,"|n"&R1C15&RC[-20])&IF(RC[-19]="",,"|n"&R1C16&RC[-19])&IF(RC[-18]="",,"|n"&R1C17&RC[-18])&IF(RC[-17]="",,"|n"&R1C18&RC[-17])&IF(RC[-16]="",,"|n"&R1C19&RC[-16])&IF(RC[-15]="",,"|n"&R1C20&RC[-15])&IF(RC[-14]="",,"|n"&R1C21&RC[-14])&IF(RC[-13]="",,"|n"&R1C22&RC[-13])&IF(RC[-11]="",,"|n"&R1C24&RC[-11])&IF(RC[-10]="",,"|n"&R1C25&RC[-10])&IF(RC[-9]="",,"|n"&R1C26&RC[-9])&IF(RC[-8]="",,"|n"&R1C27&RC[-8])&IF(RC[-7]="",,"|n"&R1C28&RC[-7])&IF(RC[-6]="",,"|n"&R1C29&RC[-6])&IF(RC[-2]="",,"|n"&RC[-2]) -> 
AI471: =IF(RC[-27]&RC[-26]&RC[-25]&RC[-24]&RC[-23]&RC[-22]="",,R1C7)&IF(RC[-27]="",,"|n"&R1C8&RC[-27])&IF(RC[-26]="",,"|n"&R1C9&RC[-26])&IF(RC[-25]="",,"|n"&R1C10&RC[-25])&IF(RC[-24]="",,"|n"&R1C11&RC[-24])&IF(RC[-23]="",,"|n"&R1C12&RC[-23])&IF(RC[-22]="",,"|n"&R1C13&RC[-22])&IF(RC[-20]&RC[-19]&RC[-18]&RC[-17]="",,"|n"&R1C14)&IF(RC[-20]="",,"|n"&R1C15&RC[-20])&IF(RC[-19]="",,"|n"&R1C16&RC[-19])&IF(RC[-18]="",,"|n"&R1C17&RC[-18])&IF(RC[-17]="",,"|n"&R1C18&RC[-17])&IF(RC[-16]="",,"|n"&R1C19&RC[-16])&IF(RC[-15]="",,"|n"&R1C20&RC[-15])&IF(RC[-14]="",,"|n"&R1C21&RC[-14])&IF(RC[-13]="",,"|n"&R1C22&RC[-13])&IF(RC[-11]="",,"|n"&R1C24&RC[-11])&IF(RC[-10]="",,"|n"&R1C25&RC[-10])&IF(RC[-9]="",,"|n"&R1C26&RC[-9])&IF(RC[-8]="",,"|n"&R1C27&RC[-8])&IF(RC[-7]="",,"|n"&R1C28&RC[-7])&IF(RC[-6]="",,"|n"&R1C29&RC[-6])&IF(RC[-2]="",,"|n"&RC[-2]) -> 
AI472: =IF(RC[-27]&RC[-26]&RC[-25]&RC[-24]&RC[-23]&RC[-22]="",,R1C7)&IF(RC[-27]="",,"|n"&R1C8&RC[-27])&IF(RC[-26]="",,"|n"&R1C9&RC[-26])&IF(RC[-25]="",,"|n"&R1C10&RC[-25])&IF(RC[-24]="",,"|n"&R1C11&RC[-24])&IF(RC[-23]="",,"|n"&R1C12&RC[-23])&IF(RC[-22]="",,"|n"&R1C13&RC[-22])&IF(RC[-20]&RC[-19]&RC[-18]&RC[-17]="",,"|n"&R1C14)&IF(RC[-20]="",,"|n"&R1C15&RC[-20])&IF(RC[-19]="",,"|n"&R1C16&RC[-19])&IF(RC[-18]="",,"|n"&R1C17&RC[-18])&IF(RC[-17]="",,"|n"&R1C18&RC[-17])&IF(RC[-16]="",,"|n"&R1C19&RC[-16])&IF(RC[-15]="",,"|n"&R1C20&RC[-15])&IF(RC[-14]="",,"|n"&R1C21&RC[-14])&IF(RC[-13]="",,"|n"&R1C22&RC[-13])&IF(RC[-11]="",,"|n"&R1C24&RC[-11])&IF(RC[-10]="",,"|n"&R1C25&RC[-10])&IF(RC[-9]="",,"|n"&R1C26&RC[-9])&IF(RC[-8]="",,"|n"&R1C27&RC[-8])&IF(RC[-7]="",,"|n"&R1C28&RC[-7])&IF(RC[-6]="",,"|n"&R1C29&RC[-6])&IF(RC[-2]="",,"|n"&RC[-2]) -> 
AI473: =IF(RC[-27]&RC[-26]&RC[-25]&RC[-24]&RC[-23]&RC[-22]="",,R1C7)&IF(RC[-27]="",,"|n"&R1C8&RC[-27])&IF(RC[-26]="",,"|n"&R1C9&RC[-26])&IF(RC[-25]="",,"|n"&R1C10&RC[-25])&IF(RC[-24]="",,"|n"&R1C11&RC[-24])&IF(RC[-23]="",,"|n"&R1C12&RC[-23])&IF(RC[-22]="",,"|n"&R1C13&RC[-22])&IF(RC[-20]&RC[-19]&RC[-18]&RC[-17]="",,"|n"&R1C14)&IF(RC[-20]="",,"|n"&R1C15&RC[-20])&IF(RC[-19]="",,"|n"&R1C16&RC[-19])&IF(RC[-18]="",,"|n"&R1C17&RC[-18])&IF(RC[-17]="",,"|n"&R1C18&RC[-17])&IF(RC[-16]="",,"|n"&R1C19&RC[-16])&IF(RC[-15]="",,"|n"&R1C20&RC[-15])&IF(RC[-14]="",,"|n"&R1C21&RC[-14])&IF(RC[-13]="",,"|n"&R1C22&RC[-13])&IF(RC[-11]="",,"|n"&R1C24&RC[-11])&IF(RC[-10]="",,"|n"&R1C25&RC[-10])&IF(RC[-9]="",,"|n"&R1C26&RC[-9])&IF(RC[-8]="",,"|n"&R1C27&RC[-8])&IF(RC[-7]="",,"|n"&R1C28&RC[-7])&IF(RC[-6]="",,"|n"&R1C29&RC[-6])&IF(RC[-2]="",,"|n"&RC[-2]) -> 
AI474: =IF(RC[-27]&RC[-26]&RC[-25]&RC[-24]&RC[-23]&RC[-22]="",,R1C7)&IF(RC[-27]="",,"|n"&R1C8&RC[-27])&IF(RC[-26]="",,"|n"&R1C9&RC[-26])&IF(RC[-25]="",,"|n"&R1C10&RC[-25])&IF(RC[-24]="",,"|n"&R1C11&RC[-24])&IF(RC[-23]="",,"|n"&R1C12&RC[-23])&IF(RC[-22]="",,"|n"&R1C13&RC[-22])&IF(RC[-20]&RC[-19]&RC[-18]&RC[-17]="",,"|n"&R1C14)&IF(RC[-20]="",,"|n"&R1C15&RC[-20])&IF(RC[-19]="",,"|n"&R1C16&RC[-19])&IF(RC[-18]="",,"|n"&R1C17&RC[-18])&IF(RC[-17]="",,"|n"&R1C18&RC[-17])&IF(RC[-16]="",,"|n"&R1C19&RC[-16])&IF(RC[-15]="",,"|n"&R1C20&RC[-15])&IF(RC[-14]="",,"|n"&R1C21&RC[-14])&IF(RC[-13]="",,"|n"&R1C22&RC[-13])&IF(RC[-11]="",,"|n"&R1C24&RC[-11])&IF(RC[-10]="",,"|n"&R1C25&RC[-10])&IF(RC[-9]="",,"|n"&R1C26&RC[-9])&IF(RC[-8]="",,"|n"&R1C27&RC[-8])&IF(RC[-7]="",,"|n"&R1C28&RC[-7])&IF(RC[-6]="",,"|n"&R1C29&RC[-6])&IF(RC[-2]="",,"|n"&RC[-2]) -> 
AI475: =IF(RC[-27]&RC[-26]&RC[-25]&RC[-24]&RC[-23]&RC[-22]="",,R1C7)&IF(RC[-27]="",,"|n"&R1C8&RC[-27])&IF(RC[-26]="",,"|n"&R1C9&RC[-26])&IF(RC[-25]="",,"|n"&R1C10&RC[-25])&IF(RC[-24]="",,"|n"&R1C11&RC[-24])&IF(RC[-23]="",,"|n"&R1C12&RC[-23])&IF(RC[-22]="",,"|n"&R1C13&RC[-22])&IF(RC[-20]&RC[-19]&RC[-18]&RC[-17]="",,"|n"&R1C14)&IF(RC[-20]="",,"|n"&R1C15&RC[-20])&IF(RC[-19]="",,"|n"&R1C16&RC[-19])&IF(RC[-18]="",,"|n"&R1C17&RC[-18])&IF(RC[-17]="",,"|n"&R1C18&RC[-17])&IF(RC[-16]="",,"|n"&R1C19&RC[-16])&IF(RC[-15]="",,"|n"&R1C20&RC[-15])&IF(RC[-14]="",,"|n"&R1C21&RC[-14])&IF(RC[-13]="",,"|n"&R1C22&RC[-13])&IF(RC[-11]="",,"|n"&R1C24&RC[-11])&IF(RC[-10]="",,"|n"&R1C25&RC[-10])&IF(RC[-9]="",,"|n"&R1C26&RC[-9])&IF(RC[-8]="",,"|n"&R1C27&RC[-8])&IF(RC[-7]="",,"|n"&R1C28&RC[-7])&IF(RC[-6]="",,"|n"&R1C29&RC[-6])&IF(RC[-2]="",,"|n"&RC[-2]) -> 
AI476: =IF(RC[-27]&RC[-26]&RC[-25]&RC[-24]&RC[-23]&RC[-22]="",,R1C7)&IF(RC[-27]="",,"|n"&R1C8&RC[-27])&IF(RC[-26]="",,"|n"&R1C9&RC[-26])&IF(RC[-25]="",,"|n"&R1C10&RC[-25])&IF(RC[-24]="",,"|n"&R1C11&RC[-24])&IF(RC[-23]="",,"|n"&R1C12&RC[-23])&IF(RC[-22]="",,"|n"&R1C13&RC[-22])&IF(RC[-20]&RC[-19]&RC[-18]&RC[-17]="",,"|n"&R1C14)&IF(RC[-20]="",,"|n"&R1C15&RC[-20])&IF(RC[-19]="",,"|n"&R1C16&RC[-19])&IF(RC[-18]="",,"|n"&R1C17&RC[-18])&IF(RC[-17]="",,"|n"&R1C18&RC[-17])&IF(RC[-16]="",,"|n"&R1C19&RC[-16])&IF(RC[-15]="",,"|n"&R1C20&RC[-15])&IF(RC[-14]="",,"|n"&R1C21&RC[-14])&IF(RC[-13]="",,"|n"&R1C22&RC[-13])&IF(RC[-11]="",,"|n"&R1C24&RC[-11])&IF(RC[-10]="",,"|n"&R1C25&RC[-10])&IF(RC[-9]="",,"|n"&R1C26&RC[-9])&IF(RC[-8]="",,"|n"&R1C27&RC[-8])&IF(RC[-7]="",,"|n"&R1C28&RC[-7])&IF(RC[-6]="",,"|n"&R1C29&RC[-6])&IF(RC[-2]="",,"|n"&RC[-2]) -> 
AI477: =IF(RC[-27]&RC[-26]&RC[-25]&RC[-24]&RC[-23]&RC[-22]="",,R1C7)&IF(RC[-27]="",,"|n"&R1C8&RC[-27])&IF(RC[-26]="",,"|n"&R1C9&RC[-26])&IF(RC[-25]="",,"|n"&R1C10&RC[-25])&IF(RC[-24]="",,"|n"&R1C11&RC[-24])&IF(RC[-23]="",,"|n"&R1C12&RC[-23])&IF(RC[-22]="",,"|n"&R1C13&RC[-22])&IF(RC[-20]&RC[-19]&RC[-18]&RC[-17]="",,"|n"&R1C14)&IF(RC[-20]="",,"|n"&R1C15&RC[-20])&IF(RC[-19]="",,"|n"&R1C16&RC[-19])&IF(RC[-18]="",,"|n"&R1C17&RC[-18])&IF(RC[-17]="",,"|n"&R1C18&RC[-17])&IF(RC[-16]="",,"|n"&R1C19&RC[-16])&IF(RC[-15]="",,"|n"&R1C20&RC[-15])&IF(RC[-14]="",,"|n"&R1C21&RC[-14])&IF(RC[-13]="",,"|n"&R1C22&RC[-13])&IF(RC[-11]="",,"|n"&R1C24&RC[-11])&IF(RC[-10]="",,"|n"&R1C25&RC[-10])&IF(RC[-9]="",,"|n"&R1C26&RC[-9])&IF(RC[-8]="",,"|n"&R1C27&RC[-8])&IF(RC[-7]="",,"|n"&R1C28&RC[-7])&IF(RC[-6]="",,"|n"&R1C29&RC[-6])&IF(RC[-2]="",,"|n"&RC[-2]) -> 
AI478: =IF(RC[-27]&RC[-26]&RC[-25]&RC[-24]&RC[-23]&RC[-22]="",,R1C7)&IF(RC[-27]="",,"|n"&R1C8&RC[-27])&IF(RC[-26]="",,"|n"&R1C9&RC[-26])&IF(RC[-25]="",,"|n"&R1C10&RC[-25])&IF(RC[-24]="",,"|n"&R1C11&RC[-24])&IF(RC[-23]="",,"|n"&R1C12&RC[-23])&IF(RC[-22]="",,"|n"&R1C13&RC[-22])&IF(RC[-20]&RC[-19]&RC[-18]&RC[-17]="",,"|n"&R1C14)&IF(RC[-20]="",,"|n"&R1C15&RC[-20])&IF(RC[-19]="",,"|n"&R1C16&RC[-19])&IF(RC[-18]="",,"|n"&R1C17&RC[-18])&IF(RC[-17]="",,"|n"&R1C18&RC[-17])&IF(RC[-16]="",,"|n"&R1C19&RC[-16])&IF(RC[-15]="",,"|n"&R1C20&RC[-15])&IF(RC[-14]="",,"|n"&R1C21&RC[-14])&IF(RC[-13]="",,"|n"&R1C22&RC[-13])&IF(RC[-11]="",,"|n"&R1C24&RC[-11])&IF(RC[-10]="",,"|n"&R1C25&RC[-10])&IF(RC[-9]="",,"|n"&R1C26&RC[-9])&IF(RC[-8]="",,"|n"&R1C27&RC[-8])&IF(RC[-7]="",,"|n"&R1C28&RC[-7])&IF(RC[-6]="",,"|n"&R1C29&RC[-6])&IF(RC[-2]="",,"|n"&RC[-2]) -> 
AI479: =IF(RC[-27]&RC[-26]&RC[-25]&RC[-24]&RC[-23]&RC[-22]="",,R1C7)&IF(RC[-27]="",,"|n"&R1C8&RC[-27])&IF(RC[-26]="",,"|n"&R1C9&RC[-26])&IF(RC[-25]="",,"|n"&R1C10&RC[-25])&IF(RC[-24]="",,"|n"&R1C11&RC[-24])&IF(RC[-23]="",,"|n"&R1C12&RC[-23])&IF(RC[-22]="",,"|n"&R1C13&RC[-22])&IF(RC[-20]&RC[-19]&RC[-18]&RC[-17]="",,"|n"&R1C14)&IF(RC[-20]="",,"|n"&R1C15&RC[-20])&IF(RC[-19]="",,"|n"&R1C16&RC[-19])&IF(RC[-18]="",,"|n"&R1C17&RC[-18])&IF(RC[-17]="",,"|n"&R1C18&RC[-17])&IF(RC[-16]="",,"|n"&R1C19&RC[-16])&IF(RC[-15]="",,"|n"&R1C20&RC[-15])&IF(RC[-14]="",,"|n"&R1C21&RC[-14])&IF(RC[-13]="",,"|n"&R1C22&RC[-13])&IF(RC[-11]="",,"|n"&R1C24&RC[-11])&IF(RC[-10]="",,"|n"&R1C25&RC[-10])&IF(RC[-9]="",,"|n"&R1C26&RC[-9])&IF(RC[-8]="",,"|n"&R1C27&RC[-8])&IF(RC[-7]="",,"|n"&R1C28&RC[-7])&IF(RC[-6]="",,"|n"&R1C29&RC[-6])&IF(RC[-2]="",,"|n"&RC[-2]) -> 
AI480: =IF(RC[-27]&RC[-26]&RC[-25]&RC[-24]&RC[-23]&RC[-22]="",,R1C7)&IF(RC[-27]="",,"|n"&R1C8&RC[-27])&IF(RC[-26]="",,"|n"&R1C9&RC[-26])&IF(RC[-25]="",,"|n"&R1C10&RC[-25])&IF(RC[-24]="",,"|n"&R1C11&RC[-24])&IF(RC[-23]="",,"|n"&R1C12&RC[-23])&IF(RC[-22]="",,"|n"&R1C13&RC[-22])&IF(RC[-20]&RC[-19]&RC[-18]&RC[-17]="",,"|n"&R1C14)&IF(RC[-20]="",,"|n"&R1C15&RC[-20])&IF(RC[-19]="",,"|n"&R1C16&RC[-19])&IF(RC[-18]="",,"|n"&R1C17&RC[-18])&IF(RC[-17]="",,"|n"&R1C18&RC[-17])&IF(RC[-16]="",,"|n"&R1C19&RC[-16])&IF(RC[-15]="",,"|n"&R1C20&RC[-15])&IF(RC[-14]="",,"|n"&R1C21&RC[-14])&IF(RC[-13]="",,"|n"&R1C22&RC[-13])&IF(RC[-11]="",,"|n"&R1C24&RC[-11])&IF(RC[-10]="",,"|n"&R1C25&RC[-10])&IF(RC[-9]="",,"|n"&R1C26&RC[-9])&IF(RC[-8]="",,"|n"&R1C27&RC[-8])&IF(RC[-7]="",,"|n"&R1C28&RC[-7])&IF(RC[-6]="",,"|n"&R1C29&RC[-6])&IF(RC[-2]="",,"|n"&RC[-2]) -> 
AI481: =IF(RC[-27]&RC[-26]&RC[-25]&RC[-24]&RC[-23]&RC[-22]="",,R1C7)&IF(RC[-27]="",,"|n"&R1C8&RC[-27])&IF(RC[-26]="",,"|n"&R1C9&RC[-26])&IF(RC[-25]="",,"|n"&R1C10&RC[-25])&IF(RC[-24]="",,"|n"&R1C11&RC[-24])&IF(RC[-23]="",,"|n"&R1C12&RC[-23])&IF(RC[-22]="",,"|n"&R1C13&RC[-22])&IF(RC[-20]&RC[-19]&RC[-18]&RC[-17]="",,"|n"&R1C14)&IF(RC[-20]="",,"|n"&R1C15&RC[-20])&IF(RC[-19]="",,"|n"&R1C16&RC[-19])&IF(RC[-18]="",,"|n"&R1C17&RC[-18])&IF(RC[-17]="",,"|n"&R1C18&RC[-17])&IF(RC[-16]="",,"|n"&R1C19&RC[-16])&IF(RC[-15]="",,"|n"&R1C20&RC[-15])&IF(RC[-14]="",,"|n"&R1C21&RC[-14])&IF(RC[-13]="",,"|n"&R1C22&RC[-13])&IF(RC[-11]="",,"|n"&R1C24&RC[-11])&IF(RC[-10]="",,"|n"&R1C25&RC[-10])&IF(RC[-9]="",,"|n"&R1C26&RC[-9])&IF(RC[-8]="",,"|n"&R1C27&RC[-8])&IF(RC[-7]="",,"|n"&R1C28&RC[-7])&IF(RC[-6]="",,"|n"&R1C29&RC[-6])&IF(RC[-2]="",,"|n"&RC[-2]) -> 
AI482: =IF(RC[-27]&RC[-26]&RC[-25]&RC[-24]&RC[-23]&RC[-22]="",,R1C7)&IF(RC[-27]="",,"|n"&R1C8&RC[-27])&IF(RC[-26]="",,"|n"&R1C9&RC[-26])&IF(RC[-25]="",,"|n"&R1C10&RC[-25])&IF(RC[-24]="",,"|n"&R1C11&RC[-24])&IF(RC[-23]="",,"|n"&R1C12&RC[-23])&IF(RC[-22]="",,"|n"&R1C13&RC[-22])&IF(RC[-20]&RC[-19]&RC[-18]&RC[-17]="",,"|n"&R1C14)&IF(RC[-20]="",,"|n"&R1C15&RC[-20])&IF(RC[-19]="",,"|n"&R1C16&RC[-19])&IF(RC[-18]="",,"|n"&R1C17&RC[-18])&IF(RC[-17]="",,"|n"&R1C18&RC[-17])&IF(RC[-16]="",,"|n"&R1C19&RC[-16])&IF(RC[-15]="",,"|n"&R1C20&RC[-15])&IF(RC[-14]="",,"|n"&R1C21&RC[-14])&IF(RC[-13]="",,"|n"&R1C22&RC[-13])&IF(RC[-11]="",,"|n"&R1C24&RC[-11])&IF(RC[-10]="",,"|n"&R1C25&RC[-10])&IF(RC[-9]="",,"|n"&R1C26&RC[-9])&IF(RC[-8]="",,"|n"&R1C27&RC[-8])&IF(RC[-7]="",,"|n"&R1C28&RC[-7])&IF(RC[-6]="",,"|n"&R1C29&RC[-6])&IF(RC[-2]="",,"|n"&RC[-2]) -> 
AI483: =IF(RC[-27]&RC[-26]&RC[-25]&RC[-24]&RC[-23]&RC[-22]="",,R1C7)&IF(RC[-27]="",,"|n"&R1C8&RC[-27])&IF(RC[-26]="",,"|n"&R1C9&RC[-26])&IF(RC[-25]="",,"|n"&R1C10&RC[-25])&IF(RC[-24]="",,"|n"&R1C11&RC[-24])&IF(RC[-23]="",,"|n"&R1C12&RC[-23])&IF(RC[-22]="",,"|n"&R1C13&RC[-22])&IF(RC[-20]&RC[-19]&RC[-18]&RC[-17]="",,"|n"&R1C14)&IF(RC[-20]="",,"|n"&R1C15&RC[-20])&IF(RC[-19]="",,"|n"&R1C16&RC[-19])&IF(RC[-18]="",,"|n"&R1C17&RC[-18])&IF(RC[-17]="",,"|n"&R1C18&RC[-17])&IF(RC[-16]="",,"|n"&R1C19&RC[-16])&IF(RC[-15]="",,"|n"&R1C20&RC[-15])&IF(RC[-14]="",,"|n"&R1C21&RC[-14])&IF(RC[-13]="",,"|n"&R1C22&RC[-13])&IF(RC[-11]="",,"|n"&R1C24&RC[-11])&IF(RC[-10]="",,"|n"&R1C25&RC[-10])&IF(RC[-9]="",,"|n"&R1C26&RC[-9])&IF(RC[-8]="",,"|n"&R1C27&RC[-8])&IF(RC[-7]="",,"|n"&R1C28&RC[-7])&IF(RC[-6]="",,"|n"&R1C29&RC[-6])&IF(RC[-2]="",,"|n"&RC[-2]) -> 
AI484: =IF(RC[-27]&RC[-26]&RC[-25]&RC[-24]&RC[-23]&RC[-22]="",,R1C7)&IF(RC[-27]="",,"|n"&R1C8&RC[-27])&IF(RC[-26]="",,"|n"&R1C9&RC[-26])&IF(RC[-25]="",,"|n"&R1C10&RC[-25])&IF(RC[-24]="",,"|n"&R1C11&RC[-24])&IF(RC[-23]="",,"|n"&R1C12&RC[-23])&IF(RC[-22]="",,"|n"&R1C13&RC[-22])&IF(RC[-20]&RC[-19]&RC[-18]&RC[-17]="",,"|n"&R1C14)&IF(RC[-20]="",,"|n"&R1C15&RC[-20])&IF(RC[-19]="",,"|n"&R1C16&RC[-19])&IF(RC[-18]="",,"|n"&R1C17&RC[-18])&IF(RC[-17]="",,"|n"&R1C18&RC[-17])&IF(RC[-16]="",,"|n"&R1C19&RC[-16])&IF(RC[-15]="",,"|n"&R1C20&RC[-15])&IF(RC[-14]="",,"|n"&R1C21&RC[-14])&IF(RC[-13]="",,"|n"&R1C22&RC[-13])&IF(RC[-11]="",,"|n"&R1C24&RC[-11])&IF(RC[-10]="",,"|n"&R1C25&RC[-10])&IF(RC[-9]="",,"|n"&R1C26&RC[-9])&IF(RC[-8]="",,"|n"&R1C27&RC[-8])&IF(RC[-7]="",,"|n"&R1C28&RC[-7])&IF(RC[-6]="",,"|n"&R1C29&RC[-6])&IF(RC[-2]="",,"|n"&RC[-2]) -> 
AI485: =IF(RC[-27]&RC[-26]&RC[-25]&RC[-24]&RC[-23]&RC[-22]="",,R1C7)&IF(RC[-27]="",,"|n"&R1C8&RC[-27])&IF(RC[-26]="",,"|n"&R1C9&RC[-26])&IF(RC[-25]="",,"|n"&R1C10&RC[-25])&IF(RC[-24]="",,"|n"&R1C11&RC[-24])&IF(RC[-23]="",,"|n"&R1C12&RC[-23])&IF(RC[-22]="",,"|n"&R1C13&RC[-22])&IF(RC[-20]&RC[-19]&RC[-18]&RC[-17]="",,"|n"&R1C14)&IF(RC[-20]="",,"|n"&R1C15&RC[-20])&IF(RC[-19]="",,"|n"&R1C16&RC[-19])&IF(RC[-18]="",,"|n"&R1C17&RC[-18])&IF(RC[-17]="",,"|n"&R1C18&RC[-17])&IF(RC[-16]="",,"|n"&R1C19&RC[-16])&IF(RC[-15]="",,"|n"&R1C20&RC[-15])&IF(RC[-14]="",,"|n"&R1C21&RC[-14])&IF(RC[-13]="",,"|n"&R1C22&RC[-13])&IF(RC[-11]="",,"|n"&R1C24&RC[-11])&IF(RC[-10]="",,"|n"&R1C25&RC[-10])&IF(RC[-9]="",,"|n"&R1C26&RC[-9])&IF(RC[-8]="",,"|n"&R1C27&RC[-8])&IF(RC[-7]="",,"|n"&R1C28&RC[-7])&IF(RC[-6]="",,"|n"&R1C29&RC[-6])&IF(RC[-2]="",,"|n"&RC[-2]) -> 
AI486: =IF(RC[-27]&RC[-26]&RC[-25]&RC[-24]&RC[-23]&RC[-22]="",,R1C7)&IF(RC[-27]="",,"|n"&R1C8&RC[-27])&IF(RC[-26]="",,"|n"&R1C9&RC[-26])&IF(RC[-25]="",,"|n"&R1C10&RC[-25])&IF(RC[-24]="",,"|n"&R1C11&RC[-24])&IF(RC[-23]="",,"|n"&R1C12&RC[-23])&IF(RC[-22]="",,"|n"&R1C13&RC[-22])&IF(RC[-20]&RC[-19]&RC[-18]&RC[-17]="",,"|n"&R1C14)&IF(RC[-20]="",,"|n"&R1C15&RC[-20])&IF(RC[-19]="",,"|n"&R1C16&RC[-19])&IF(RC[-18]="",,"|n"&R1C17&RC[-18])&IF(RC[-17]="",,"|n"&R1C18&RC[-17])&IF(RC[-16]="",,"|n"&R1C19&RC[-16])&IF(RC[-15]="",,"|n"&R1C20&RC[-15])&IF(RC[-14]="",,"|n"&R1C21&RC[-14])&IF(RC[-13]="",,"|n"&R1C22&RC[-13])&IF(RC[-11]="",,"|n"&R1C24&RC[-11])&IF(RC[-10]="",,"|n"&R1C25&RC[-10])&IF(RC[-9]="",,"|n"&R1C26&RC[-9])&IF(RC[-8]="",,"|n"&R1C27&RC[-8])&IF(RC[-7]="",,"|n"&R1C28&RC[-7])&IF(RC[-6]="",,"|n"&R1C29&RC[-6])&IF(RC[-2]="",,"|n"&RC[-2]) -> 
AI487: =IF(RC[-27]&RC[-26]&RC[-25]&RC[-24]&RC[-23]&RC[-22]="",,R1C7)&IF(RC[-27]="",,"|n"&R1C8&RC[-27])&IF(RC[-26]="",,"|n"&R1C9&RC[-26])&IF(RC[-25]="",,"|n"&R1C10&RC[-25])&IF(RC[-24]="",,"|n"&R1C11&RC[-24])&IF(RC[-23]="",,"|n"&R1C12&RC[-23])&IF(RC[-22]="",,"|n"&R1C13&RC[-22])&IF(RC[-20]&RC[-19]&RC[-18]&RC[-17]="",,"|n"&R1C14)&IF(RC[-20]="",,"|n"&R1C15&RC[-20])&IF(RC[-19]="",,"|n"&R1C16&RC[-19])&IF(RC[-18]="",,"|n"&R1C17&RC[-18])&IF(RC[-17]="",,"|n"&R1C18&RC[-17])&IF(RC[-16]="",,"|n"&R1C19&RC[-16])&IF(RC[-15]="",,"|n"&R1C20&RC[-15])&IF(RC[-14]="",,"|n"&R1C21&RC[-14])&IF(RC[-13]="",,"|n"&R1C22&RC[-13])&IF(RC[-11]="",,"|n"&R1C24&RC[-11])&IF(RC[-10]="",,"|n"&R1C25&RC[-10])&IF(RC[-9]="",,"|n"&R1C26&RC[-9])&IF(RC[-8]="",,"|n"&R1C27&RC[-8])&IF(RC[-7]="",,"|n"&R1C28&RC[-7])&IF(RC[-6]="",,"|n"&R1C29&RC[-6])&IF(RC[-2]="",,"|n"&RC[-2]) -> 
AI488: =IF(RC[-27]&RC[-26]&RC[-25]&RC[-24]&RC[-23]&RC[-22]="",,R1C7)&IF(RC[-27]="",,"|n"&R1C8&RC[-27])&IF(RC[-26]="",,"|n"&R1C9&RC[-26])&IF(RC[-25]="",,"|n"&R1C10&RC[-25])&IF(RC[-24]="",,"|n"&R1C11&RC[-24])&IF(RC[-23]="",,"|n"&R1C12&RC[-23])&IF(RC[-22]="",,"|n"&R1C13&RC[-22])&IF(RC[-20]&RC[-19]&RC[-18]&RC[-17]="",,"|n"&R1C14)&IF(RC[-20]="",,"|n"&R1C15&RC[-20])&IF(RC[-19]="",,"|n"&R1C16&RC[-19])&IF(RC[-18]="",,"|n"&R1C17&RC[-18])&IF(RC[-17]="",,"|n"&R1C18&RC[-17])&IF(RC[-16]="",,"|n"&R1C19&RC[-16])&IF(RC[-15]="",,"|n"&R1C20&RC[-15])&IF(RC[-14]="",,"|n"&R1C21&RC[-14])&IF(RC[-13]="",,"|n"&R1C22&RC[-13])&IF(RC[-11]="",,"|n"&R1C24&RC[-11])&IF(RC[-10]="",,"|n"&R1C25&RC[-10])&IF(RC[-9]="",,"|n"&R1C26&RC[-9])&IF(RC[-8]="",,"|n"&R1C27&RC[-8])&IF(RC[-7]="",,"|n"&R1C28&RC[-7])&IF(RC[-6]="",,"|n"&R1C29&RC[-6])&IF(RC[-2]="",,"|n"&RC[-2]) -> 
AI489: =IF(RC[-27]&RC[-26]&RC[-25]&RC[-24]&RC[-23]&RC[-22]="",,R1C7)&IF(RC[-27]="",,"|n"&R1C8&RC[-27])&IF(RC[-26]="",,"|n"&R1C9&RC[-26])&IF(RC[-25]="",,"|n"&R1C10&RC[-25])&IF(RC[-24]="",,"|n"&R1C11&RC[-24])&IF(RC[-23]="",,"|n"&R1C12&RC[-23])&IF(RC[-22]="",,"|n"&R1C13&RC[-22])&IF(RC[-20]&RC[-19]&RC[-18]&RC[-17]="",,"|n"&R1C14)&IF(RC[-20]="",,"|n"&R1C15&RC[-20])&IF(RC[-19]="",,"|n"&R1C16&RC[-19])&IF(RC[-18]="",,"|n"&R1C17&RC[-18])&IF(RC[-17]="",,"|n"&R1C18&RC[-17])&IF(RC[-16]="",,"|n"&R1C19&RC[-16])&IF(RC[-15]="",,"|n"&R1C20&RC[-15])&IF(RC[-14]="",,"|n"&R1C21&RC[-14])&IF(RC[-13]="",,"|n"&R1C22&RC[-13])&IF(RC[-11]="",,"|n"&R1C24&RC[-11])&IF(RC[-10]="",,"|n"&R1C25&RC[-10])&IF(RC[-9]="",,"|n"&R1C26&RC[-9])&IF(RC[-8]="",,"|n"&R1C27&RC[-8])&IF(RC[-7]="",,"|n"&R1C28&RC[-7])&IF(RC[-6]="",,"|n"&R1C29&RC[-6])&IF(RC[-2]="",,"|n"&RC[-2]) -> 
AI490: =IF(RC[-27]&RC[-26]&RC[-25]&RC[-24]&RC[-23]&RC[-22]="",,R1C7)&IF(RC[-27]="",,"|n"&R1C8&RC[-27])&IF(RC[-26]="",,"|n"&R1C9&RC[-26])&IF(RC[-25]="",,"|n"&R1C10&RC[-25])&IF(RC[-24]="",,"|n"&R1C11&RC[-24])&IF(RC[-23]="",,"|n"&R1C12&RC[-23])&IF(RC[-22]="",,"|n"&R1C13&RC[-22])&IF(RC[-20]&RC[-19]&RC[-18]&RC[-17]="",,"|n"&R1C14)&IF(RC[-20]="",,"|n"&R1C15&RC[-20])&IF(RC[-19]="",,"|n"&R1C16&RC[-19])&IF(RC[-18]="",,"|n"&R1C17&RC[-18])&IF(RC[-17]="",,"|n"&R1C18&RC[-17])&IF(RC[-16]="",,"|n"&R1C19&RC[-16])&IF(RC[-15]="",,"|n"&R1C20&RC[-15])&IF(RC[-14]="",,"|n"&R1C21&RC[-14])&IF(RC[-13]="",,"|n"&R1C22&RC[-13])&IF(RC[-11]="",,"|n"&R1C24&RC[-11])&IF(RC[-10]="",,"|n"&R1C25&RC[-10])&IF(RC[-9]="",,"|n"&R1C26&RC[-9])&IF(RC[-8]="",,"|n"&R1C27&RC[-8])&IF(RC[-7]="",,"|n"&R1C28&RC[-7])&IF(RC[-6]="",,"|n"&R1C29&RC[-6])&IF(RC[-2]="",,"|n"&RC[-2]) -> 
AI491: =IF(RC[-27]&RC[-26]&RC[-25]&RC[-24]&RC[-23]&RC[-22]="",,R1C7)&IF(RC[-27]="",,"|n"&R1C8&RC[-27])&IF(RC[-26]="",,"|n"&R1C9&RC[-26])&IF(RC[-25]="",,"|n"&R1C10&RC[-25])&IF(RC[-24]="",,"|n"&R1C11&RC[-24])&IF(RC[-23]="",,"|n"&R1C12&RC[-23])&IF(RC[-22]="",,"|n"&R1C13&RC[-22])&IF(RC[-20]&RC[-19]&RC[-18]&RC[-17]="",,"|n"&R1C14)&IF(RC[-20]="",,"|n"&R1C15&RC[-20])&IF(RC[-19]="",,"|n"&R1C16&RC[-19])&IF(RC[-18]="",,"|n"&R1C17&RC[-18])&IF(RC[-17]="",,"|n"&R1C18&RC[-17])&IF(RC[-16]="",,"|n"&R1C19&RC[-16])&IF(RC[-15]="",,"|n"&R1C20&RC[-15])&IF(RC[-14]="",,"|n"&R1C21&RC[-14])&IF(RC[-13]="",,"|n"&R1C22&RC[-13])&IF(RC[-11]="",,"|n"&R1C24&RC[-11])&IF(RC[-10]="",,"|n"&R1C25&RC[-10])&IF(RC[-9]="",,"|n"&R1C26&RC[-9])&IF(RC[-8]="",,"|n"&R1C27&RC[-8])&IF(RC[-7]="",,"|n"&R1C28&RC[-7])&IF(RC[-6]="",,"|n"&R1C29&RC[-6])&IF(RC[-2]="",,"|n"&RC[-2]) -> 
AI492: =IF(RC[-27]&RC[-26]&RC[-25]&RC[-24]&RC[-23]&RC[-22]="",,R1C7)&IF(RC[-27]="",,"|n"&R1C8&RC[-27])&IF(RC[-26]="",,"|n"&R1C9&RC[-26])&IF(RC[-25]="",,"|n"&R1C10&RC[-25])&IF(RC[-24]="",,"|n"&R1C11&RC[-24])&IF(RC[-23]="",,"|n"&R1C12&RC[-23])&IF(RC[-22]="",,"|n"&R1C13&RC[-22])&IF(RC[-20]&RC[-19]&RC[-18]&RC[-17]="",,"|n"&R1C14)&IF(RC[-20]="",,"|n"&R1C15&RC[-20])&IF(RC[-19]="",,"|n"&R1C16&RC[-19])&IF(RC[-18]="",,"|n"&R1C17&RC[-18])&IF(RC[-17]="",,"|n"&R1C18&RC[-17])&IF(RC[-16]="",,"|n"&R1C19&RC[-16])&IF(RC[-15]="",,"|n"&R1C20&RC[-15])&IF(RC[-14]="",,"|n"&R1C21&RC[-14])&IF(RC[-13]="",,"|n"&R1C22&RC[-13])&IF(RC[-11]="",,"|n"&R1C24&RC[-11])&IF(RC[-10]="",,"|n"&R1C25&RC[-10])&IF(RC[-9]="",,"|n"&R1C26&RC[-9])&IF(RC[-8]="",,"|n"&R1C27&RC[-8])&IF(RC[-7]="",,"|n"&R1C28&RC[-7])&IF(RC[-6]="",,"|n"&R1C29&RC[-6])&IF(RC[-2]="",,"|n"&RC[-2]) -> 
AI493: =IF(RC[-27]&RC[-26]&RC[-25]&RC[-24]&RC[-23]&RC[-22]="",,R1C7)&IF(RC[-27]="",,"|n"&R1C8&RC[-27])&IF(RC[-26]="",,"|n"&R1C9&RC[-26])&IF(RC[-25]="",,"|n"&R1C10&RC[-25])&IF(RC[-24]="",,"|n"&R1C11&RC[-24])&IF(RC[-23]="",,"|n"&R1C12&RC[-23])&IF(RC[-22]="",,"|n"&R1C13&RC[-22])&IF(RC[-20]&RC[-19]&RC[-18]&RC[-17]="",,"|n"&R1C14)&IF(RC[-20]="",,"|n"&R1C15&RC[-20])&IF(RC[-19]="",,"|n"&R1C16&RC[-19])&IF(RC[-18]="",,"|n"&R1C17&RC[-18])&IF(RC[-17]="",,"|n"&R1C18&RC[-17])&IF(RC[-16]="",,"|n"&R1C19&RC[-16])&IF(RC[-15]="",,"|n"&R1C20&RC[-15])&IF(RC[-14]="",,"|n"&R1C21&RC[-14])&IF(RC[-13]="",,"|n"&R1C22&RC[-13])&IF(RC[-11]="",,"|n"&R1C24&RC[-11])&IF(RC[-10]="",,"|n"&R1C25&RC[-10])&IF(RC[-9]="",,"|n"&R1C26&RC[-9])&IF(RC[-8]="",,"|n"&R1C27&RC[-8])&IF(RC[-7]="",,"|n"&R1C28&RC[-7])&IF(RC[-6]="",,"|n"&R1C29&RC[-6])&IF(RC[-2]="",,"|n"&RC[-2]) -> 
AI494: =IF(RC[-27]&RC[-26]&RC[-25]&RC[-24]&RC[-23]&RC[-22]="",,R1C7)&IF(RC[-27]="",,"|n"&R1C8&RC[-27])&IF(RC[-26]="",,"|n"&R1C9&RC[-26])&IF(RC[-25]="",,"|n"&R1C10&RC[-25])&IF(RC[-24]="",,"|n"&R1C11&RC[-24])&IF(RC[-23]="",,"|n"&R1C12&RC[-23])&IF(RC[-22]="",,"|n"&R1C13&RC[-22])&IF(RC[-20]&RC[-19]&RC[-18]&RC[-17]="",,"|n"&R1C14)&IF(RC[-20]="",,"|n"&R1C15&RC[-20])&IF(RC[-19]="",,"|n"&R1C16&RC[-19])&IF(RC[-18]="",,"|n"&R1C17&RC[-18])&IF(RC[-17]="",,"|n"&R1C18&RC[-17])&IF(RC[-16]="",,"|n"&R1C19&RC[-16])&IF(RC[-15]="",,"|n"&R1C20&RC[-15])&IF(RC[-14]="",,"|n"&R1C21&RC[-14])&IF(RC[-13]="",,"|n"&R1C22&RC[-13])&IF(RC[-11]="",,"|n"&R1C24&RC[-11])&IF(RC[-10]="",,"|n"&R1C25&RC[-10])&IF(RC[-9]="",,"|n"&R1C26&RC[-9])&IF(RC[-8]="",,"|n"&R1C27&RC[-8])&IF(RC[-7]="",,"|n"&R1C28&RC[-7])&IF(RC[-6]="",,"|n"&R1C29&RC[-6])&IF(RC[-2]="",,"|n"&RC[-2]) -> 
AI495: =IF(RC[-27]&RC[-26]&RC[-25]&RC[-24]&RC[-23]&RC[-22]="",,R1C7)&IF(RC[-27]="",,"|n"&R1C8&RC[-27])&IF(RC[-26]="",,"|n"&R1C9&RC[-26])&IF(RC[-25]="",,"|n"&R1C10&RC[-25])&IF(RC[-24]="",,"|n"&R1C11&RC[-24])&IF(RC[-23]="",,"|n"&R1C12&RC[-23])&IF(RC[-22]="",,"|n"&R1C13&RC[-22])&IF(RC[-20]&RC[-19]&RC[-18]&RC[-17]="",,"|n"&R1C14)&IF(RC[-20]="",,"|n"&R1C15&RC[-20])&IF(RC[-19]="",,"|n"&R1C16&RC[-19])&IF(RC[-18]="",,"|n"&R1C17&RC[-18])&IF(RC[-17]="",,"|n"&R1C18&RC[-17])&IF(RC[-16]="",,"|n"&R1C19&RC[-16])&IF(RC[-15]="",,"|n"&R1C20&RC[-15])&IF(RC[-14]="",,"|n"&R1C21&RC[-14])&IF(RC[-13]="",,"|n"&R1C22&RC[-13])&IF(RC[-11]="",,"|n"&R1C24&RC[-11])&IF(RC[-10]="",,"|n"&R1C25&RC[-10])&IF(RC[-9]="",,"|n"&R1C26&RC[-9])&IF(RC[-8]="",,"|n"&R1C27&RC[-8])&IF(RC[-7]="",,"|n"&R1C28&RC[-7])&IF(RC[-6]="",,"|n"&R1C29&RC[-6])&IF(RC[-2]="",,"|n"&RC[-2]) -> 
AI496: =IF(RC[-27]&RC[-26]&RC[-25]&RC[-24]&RC[-23]&RC[-22]="",,R1C7)&IF(RC[-27]="",,"|n"&R1C8&RC[-27])&IF(RC[-26]="",,"|n"&R1C9&RC[-26])&IF(RC[-25]="",,"|n"&R1C10&RC[-25])&IF(RC[-24]="",,"|n"&R1C11&RC[-24])&IF(RC[-23]="",,"|n"&R1C12&RC[-23])&IF(RC[-22]="",,"|n"&R1C13&RC[-22])&IF(RC[-20]&RC[-19]&RC[-18]&RC[-17]="",,"|n"&R1C14)&IF(RC[-20]="",,"|n"&R1C15&RC[-20])&IF(RC[-19]="",,"|n"&R1C16&RC[-19])&IF(RC[-18]="",,"|n"&R1C17&RC[-18])&IF(RC[-17]="",,"|n"&R1C18&RC[-17])&IF(RC[-16]="",,"|n"&R1C19&RC[-16])&IF(RC[-15]="",,"|n"&R1C20&RC[-15])&IF(RC[-14]="",,"|n"&R1C21&RC[-14])&IF(RC[-13]="",,"|n"&R1C22&RC[-13])&IF(RC[-11]="",,"|n"&R1C24&RC[-11])&IF(RC[-10]="",,"|n"&R1C25&RC[-10])&IF(RC[-9]="",,"|n"&R1C26&RC[-9])&IF(RC[-8]="",,"|n"&R1C27&RC[-8])&IF(RC[-7]="",,"|n"&R1C28&RC[-7])&IF(RC[-6]="",,"|n"&R1C29&RC[-6])&IF(RC[-2]="",,"|n"&RC[-2]) -> 
AI497: =IF(RC[-27]&RC[-26]&RC[-25]&RC[-24]&RC[-23]&RC[-22]="",,R1C7)&IF(RC[-27]="",,"|n"&R1C8&RC[-27])&IF(RC[-26]="",,"|n"&R1C9&RC[-26])&IF(RC[-25]="",,"|n"&R1C10&RC[-25])&IF(RC[-24]="",,"|n"&R1C11&RC[-24])&IF(RC[-23]="",,"|n"&R1C12&RC[-23])&IF(RC[-22]="",,"|n"&R1C13&RC[-22])&IF(RC[-20]&RC[-19]&RC[-18]&RC[-17]="",,"|n"&R1C14)&IF(RC[-20]="",,"|n"&R1C15&RC[-20])&IF(RC[-19]="",,"|n"&R1C16&RC[-19])&IF(RC[-18]="",,"|n"&R1C17&RC[-18])&IF(RC[-17]="",,"|n"&R1C18&RC[-17])&IF(RC[-16]="",,"|n"&R1C19&RC[-16])&IF(RC[-15]="",,"|n"&R1C20&RC[-15])&IF(RC[-14]="",,"|n"&R1C21&RC[-14])&IF(RC[-13]="",,"|n"&R1C22&RC[-13])&IF(RC[-11]="",,"|n"&R1C24&RC[-11])&IF(RC[-10]="",,"|n"&R1C25&RC[-10])&IF(RC[-9]="",,"|n"&R1C26&RC[-9])&IF(RC[-8]="",,"|n"&R1C27&RC[-8])&IF(RC[-7]="",,"|n"&R1C28&RC[-7])&IF(RC[-6]="",,"|n"&R1C29&RC[-6])&IF(RC[-2]="",,"|n"&RC[-2]) -> 
AI498: =IF(RC[-27]&RC[-26]&RC[-25]&RC[-24]&RC[-23]&RC[-22]="",,R1C7)&IF(RC[-27]="",,"|n"&R1C8&RC[-27])&IF(RC[-26]="",,"|n"&R1C9&RC[-26])&IF(RC[-25]="",,"|n"&R1C10&RC[-25])&IF(RC[-24]="",,"|n"&R1C11&RC[-24])&IF(RC[-23]="",,"|n"&R1C12&RC[-23])&IF(RC[-22]="",,"|n"&R1C13&RC[-22])&IF(RC[-20]&RC[-19]&RC[-18]&RC[-17]="",,"|n"&R1C14)&IF(RC[-20]="",,"|n"&R1C15&RC[-20])&IF(RC[-19]="",,"|n"&R1C16&RC[-19])&IF(RC[-18]="",,"|n"&R1C17&RC[-18])&IF(RC[-17]="",,"|n"&R1C18&RC[-17])&IF(RC[-16]="",,"|n"&R1C19&RC[-16])&IF(RC[-15]="",,"|n"&R1C20&RC[-15])&IF(RC[-14]="",,"|n"&R1C21&RC[-14])&IF(RC[-13]="",,"|n"&R1C22&RC[-13])&IF(RC[-11]="",,"|n"&R1C24&RC[-11])&IF(RC[-10]="",,"|n"&R1C25&RC[-10])&IF(RC[-9]="",,"|n"&R1C26&RC[-9])&IF(RC[-8]="",,"|n"&R1C27&RC[-8])&IF(RC[-7]="",,"|n"&R1C28&RC[-7])&IF(RC[-6]="",,"|n"&R1C29&RC[-6])&IF(RC[-2]="",,"|n"&RC[-2]) -> 
AI499: =IF(RC[-27]&RC[-26]&RC[-25]&RC[-24]&RC[-23]&RC[-22]="",,R1C7)&IF(RC[-27]="",,"|n"&R1C8&RC[-27])&IF(RC[-26]="",,"|n"&R1C9&RC[-26])&IF(RC[-25]="",,"|n"&R1C10&RC[-25])&IF(RC[-24]="",,"|n"&R1C11&RC[-24])&IF(RC[-23]="",,"|n"&R1C12&RC[-23])&IF(RC[-22]="",,"|n"&R1C13&RC[-22])&IF(RC[-20]&RC[-19]&RC[-18]&RC[-17]="",,"|n"&R1C14)&IF(RC[-20]="",,"|n"&R1C15&RC[-20])&IF(RC[-19]="",,"|n"&R1C16&RC[-19])&IF(RC[-18]="",,"|n"&R1C17&RC[-18])&IF(RC[-17]="",,"|n"&R1C18&RC[-17])&IF(RC[-16]="",,"|n"&R1C19&RC[-16])&IF(RC[-15]="",,"|n"&R1C20&RC[-15])&IF(RC[-14]="",,"|n"&R1C21&RC[-14])&IF(RC[-13]="",,"|n"&R1C22&RC[-13])&IF(RC[-11]="",,"|n"&R1C24&RC[-11])&IF(RC[-10]="",,"|n"&R1C25&RC[-10])&IF(RC[-9]="",,"|n"&R1C26&RC[-9])&IF(RC[-8]="",,"|n"&R1C27&RC[-8])&IF(RC[-7]="",,"|n"&R1C28&RC[-7])&IF(RC[-6]="",,"|n"&R1C29&RC[-6])&IF(RC[-2]="",,"|n"&RC[-2]) -> 
AI500: =IF(RC[-27]&RC[-26]&RC[-25]&RC[-24]&RC[-23]&RC[-22]="",,R1C7)&IF(RC[-27]="",,"|n"&R1C8&RC[-27])&IF(RC[-26]="",,"|n"&R1C9&RC[-26])&IF(RC[-25]="",,"|n"&R1C10&RC[-25])&IF(RC[-24]="",,"|n"&R1C11&RC[-24])&IF(RC[-23]="",,"|n"&R1C12&RC[-23])&IF(RC[-22]="",,"|n"&R1C13&RC[-22])&IF(RC[-20]&RC[-19]&RC[-18]&RC[-17]="",,"|n"&R1C14)&IF(RC[-20]="",,"|n"&R1C15&RC[-20])&IF(RC[-19]="",,"|n"&R1C16&RC[-19])&IF(RC[-18]="",,"|n"&R1C17&RC[-18])&IF(RC[-17]="",,"|n"&R1C18&RC[-17])&IF(RC[-16]="",,"|n"&R1C19&RC[-16])&IF(RC[-15]="",,"|n"&R1C20&RC[-15])&IF(RC[-14]="",,"|n"&R1C21&RC[-14])&IF(RC[-13]="",,"|n"&R1C22&RC[-13])&IF(RC[-11]="",,"|n"&R1C24&RC[-11])&IF(RC[-10]="",,"|n"&R1C25&RC[-10])&IF(RC[-9]="",,"|n"&R1C26&RC[-9])&IF(RC[-8]="",,"|n"&R1C27&RC[-8])&IF(RC[-7]="",,"|n"&R1C28&RC[-7])&IF(RC[-6]="",,"|n"&R1C29&RC[-6])&IF(RC[-2]="",,"|n"&RC[-2]) -> 
AI501: =IF(RC[-27]&RC[-26]&RC[-25]&RC[-24]&RC[-23]&RC[-22]="",,R1C7)&IF(RC[-27]="",,"|n"&R1C8&RC[-27])&IF(RC[-26]="",,"|n"&R1C9&RC[-26])&IF(RC[-25]="",,"|n"&R1C10&RC[-25])&IF(RC[-24]="",,"|n"&R1C11&RC[-24])&IF(RC[-23]="",,"|n"&R1C12&RC[-23])&IF(RC[-22]="",,"|n"&R1C13&RC[-22])&IF(RC[-20]&RC[-19]&RC[-18]&RC[-17]="",,"|n"&R1C14)&IF(RC[-20]="",,"|n"&R1C15&RC[-20])&IF(RC[-19]="",,"|n"&R1C16&RC[-19])&IF(RC[-18]="",,"|n"&R1C17&RC[-18])&IF(RC[-17]="",,"|n"&R1C18&RC[-17])&IF(RC[-16]="",,"|n"&R1C19&RC[-16])&IF(RC[-15]="",,"|n"&R1C20&RC[-15])&IF(RC[-14]="",,"|n"&R1C21&RC[-14])&IF(RC[-13]="",,"|n"&R1C22&RC[-13])&IF(RC[-11]="",,"|n"&R1C24&RC[-11])&IF(RC[-10]="",,"|n"&R1C25&RC[-10])&IF(RC[-9]="",,"|n"&R1C26&RC[-9])&IF(RC[-8]="",,"|n"&R1C27&RC[-8])&IF(RC[-7]="",,"|n"&R1C28&RC[-7])&IF(RC[-6]="",,"|n"&R1C29&RC[-6])&IF(RC[-2]="",,"|n"&RC[-2]) -> 
AI502: =IF(RC[-27]&RC[-26]&RC[-25]&RC[-24]&RC[-23]&RC[-22]="",,R1C7)&IF(RC[-27]="",,"|n"&R1C8&RC[-27])&IF(RC[-26]="",,"|n"&R1C9&RC[-26])&IF(RC[-25]="",,"|n"&R1C10&RC[-25])&IF(RC[-24]="",,"|n"&R1C11&RC[-24])&IF(RC[-23]="",,"|n"&R1C12&RC[-23])&IF(RC[-22]="",,"|n"&R1C13&RC[-22])&IF(RC[-20]&RC[-19]&RC[-18]&RC[-17]="",,"|n"&R1C14)&IF(RC[-20]="",,"|n"&R1C15&RC[-20])&IF(RC[-19]="",,"|n"&R1C16&RC[-19])&IF(RC[-18]="",,"|n"&R1C17&RC[-18])&IF(RC[-17]="",,"|n"&R1C18&RC[-17])&IF(RC[-16]="",,"|n"&R1C19&RC[-16])&IF(RC[-15]="",,"|n"&R1C20&RC[-15])&IF(RC[-14]="",,"|n"&R1C21&RC[-14])&IF(RC[-13]="",,"|n"&R1C22&RC[-13])&IF(RC[-11]="",,"|n"&R1C24&RC[-11])&IF(RC[-10]="",,"|n"&R1C25&RC[-10])&IF(RC[-9]="",,"|n"&R1C26&RC[-9])&IF(RC[-8]="",,"|n"&R1C27&RC[-8])&IF(RC[-7]="",,"|n"&R1C28&RC[-7])&IF(RC[-6]="",,"|n"&R1C29&RC[-6])&IF(RC[-2]="",,"|n"&RC[-2]) -> 
AI503: =IF(RC[-27]&RC[-26]&RC[-25]&RC[-24]&RC[-23]&RC[-22]="",,R1C7)&IF(RC[-27]="",,"|n"&R1C8&RC[-27])&IF(RC[-26]="",,"|n"&R1C9&RC[-26])&IF(RC[-25]="",,"|n"&R1C10&RC[-25])&IF(RC[-24]="",,"|n"&R1C11&RC[-24])&IF(RC[-23]="",,"|n"&R1C12&RC[-23])&IF(RC[-22]="",,"|n"&R1C13&RC[-22])&IF(RC[-20]&RC[-19]&RC[-18]&RC[-17]="",,"|n"&R1C14)&IF(RC[-20]="",,"|n"&R1C15&RC[-20])&IF(RC[-19]="",,"|n"&R1C16&RC[-19])&IF(RC[-18]="",,"|n"&R1C17&RC[-18])&IF(RC[-17]="",,"|n"&R1C18&RC[-17])&IF(RC[-16]="",,"|n"&R1C19&RC[-16])&IF(RC[-15]="",,"|n"&R1C20&RC[-15])&IF(RC[-14]="",,"|n"&R1C21&RC[-14])&IF(RC[-13]="",,"|n"&R1C22&RC[-13])&IF(RC[-11]="",,"|n"&R1C24&RC[-11])&IF(RC[-10]="",,"|n"&R1C25&RC[-10])&IF(RC[-9]="",,"|n"&R1C26&RC[-9])&IF(RC[-8]="",,"|n"&R1C27&RC[-8])&IF(RC[-7]="",,"|n"&R1C28&RC[-7])&IF(RC[-6]="",,"|n"&R1C29&RC[-6])&IF(RC[-2]="",,"|n"&RC[-2]) -> 
AI504: =IF(RC[-27]&RC[-26]&RC[-25]&RC[-24]&RC[-23]&RC[-22]="",,R1C7)&IF(RC[-27]="",,"|n"&R1C8&RC[-27])&IF(RC[-26]="",,"|n"&R1C9&RC[-26])&IF(RC[-25]="",,"|n"&R1C10&RC[-25])&IF(RC[-24]="",,"|n"&R1C11&RC[-24])&IF(RC[-23]="",,"|n"&R1C12&RC[-23])&IF(RC[-22]="",,"|n"&R1C13&RC[-22])&IF(RC[-20]&RC[-19]&RC[-18]&RC[-17]="",,"|n"&R1C14)&IF(RC[-20]="",,"|n"&R1C15&RC[-20])&IF(RC[-19]="",,"|n"&R1C16&RC[-19])&IF(RC[-18]="",,"|n"&R1C17&RC[-18])&IF(RC[-17]="",,"|n"&R1C18&RC[-17])&IF(RC[-16]="",,"|n"&R1C19&RC[-16])&IF(RC[-15]="",,"|n"&R1C20&RC[-15])&IF(RC[-14]="",,"|n"&R1C21&RC[-14])&IF(RC[-13]="",,"|n"&R1C22&RC[-13])&IF(RC[-11]="",,"|n"&R1C24&RC[-11])&IF(RC[-10]="",,"|n"&R1C25&RC[-10])&IF(RC[-9]="",,"|n"&R1C26&RC[-9])&IF(RC[-8]="",,"|n"&R1C27&RC[-8])&IF(RC[-7]="",,"|n"&R1C28&RC[-7])&IF(RC[-6]="",,"|n"&R1C29&RC[-6])&IF(RC[-2]="",,"|n"&RC[-2]) -> 
AI505: =IF(RC[-27]&RC[-26]&RC[-25]&RC[-24]&RC[-23]&RC[-22]="",,R1C7)&IF(RC[-27]="",,"|n"&R1C8&RC[-27])&IF(RC[-26]="",,"|n"&R1C9&RC[-26])&IF(RC[-25]="",,"|n"&R1C10&RC[-25])&IF(RC[-24]="",,"|n"&R1C11&RC[-24])&IF(RC[-23]="",,"|n"&R1C12&RC[-23])&IF(RC[-22]="",,"|n"&R1C13&RC[-22])&IF(RC[-20]&RC[-19]&RC[-18]&RC[-17]="",,"|n"&R1C14)&IF(RC[-20]="",,"|n"&R1C15&RC[-20])&IF(RC[-19]="",,"|n"&R1C16&RC[-19])&IF(RC[-18]="",,"|n"&R1C17&RC[-18])&IF(RC[-17]="",,"|n"&R1C18&RC[-17])&IF(RC[-16]="",,"|n"&R1C19&RC[-16])&IF(RC[-15]="",,"|n"&R1C20&RC[-15])&IF(RC[-14]="",,"|n"&R1C21&RC[-14])&IF(RC[-13]="",,"|n"&R1C22&RC[-13])&IF(RC[-11]="",,"|n"&R1C24&RC[-11])&IF(RC[-10]="",,"|n"&R1C25&RC[-10])&IF(RC[-9]="",,"|n"&R1C26&RC[-9])&IF(RC[-8]="",,"|n"&R1C27&RC[-8])&IF(RC[-7]="",,"|n"&R1C28&RC[-7])&IF(RC[-6]="",,"|n"&R1C29&RC[-6])&IF(RC[-2]="",,"|n"&RC[-2]) -> 
AI506: =IF(RC[-27]&RC[-26]&RC[-25]&RC[-24]&RC[-23]&RC[-22]="",,R1C7)&IF(RC[-27]="",,"|n"&R1C8&RC[-27])&IF(RC[-26]="",,"|n"&R1C9&RC[-26])&IF(RC[-25]="",,"|n"&R1C10&RC[-25])&IF(RC[-24]="",,"|n"&R1C11&RC[-24])&IF(RC[-23]="",,"|n"&R1C12&RC[-23])&IF(RC[-22]="",,"|n"&R1C13&RC[-22])&IF(RC[-20]&RC[-19]&RC[-18]&RC[-17]="",,"|n"&R1C14)&IF(RC[-20]="",,"|n"&R1C15&RC[-20])&IF(RC[-19]="",,"|n"&R1C16&RC[-19])&IF(RC[-18]="",,"|n"&R1C17&RC[-18])&IF(RC[-17]="",,"|n"&R1C18&RC[-17])&IF(RC[-16]="",,"|n"&R1C19&RC[-16])&IF(RC[-15]="",,"|n"&R1C20&RC[-15])&IF(RC[-14]="",,"|n"&R1C21&RC[-14])&IF(RC[-13]="",,"|n"&R1C22&RC[-13])&IF(RC[-11]="",,"|n"&R1C24&RC[-11])&IF(RC[-10]="",,"|n"&R1C25&RC[-10])&IF(RC[-9]="",,"|n"&R1C26&RC[-9])&IF(RC[-8]="",,"|n"&R1C27&RC[-8])&IF(RC[-7]="",,"|n"&R1C28&RC[-7])&IF(RC[-6]="",,"|n"&R1C29&RC[-6])&IF(RC[-2]="",,"|n"&RC[-2]) -> 
AI507: =IF(RC[-27]&RC[-26]&RC[-25]&RC[-24]&RC[-23]&RC[-22]="",,R1C7)&IF(RC[-27]="",,"|n"&R1C8&RC[-27])&IF(RC[-26]="",,"|n"&R1C9&RC[-26])&IF(RC[-25]="",,"|n"&R1C10&RC[-25])&IF(RC[-24]="",,"|n"&R1C11&RC[-24])&IF(RC[-23]="",,"|n"&R1C12&RC[-23])&IF(RC[-22]="",,"|n"&R1C13&RC[-22])&IF(RC[-20]&RC[-19]&RC[-18]&RC[-17]="",,"|n"&R1C14)&IF(RC[-20]="",,"|n"&R1C15&RC[-20])&IF(RC[-19]="",,"|n"&R1C16&RC[-19])&IF(RC[-18]="",,"|n"&R1C17&RC[-18])&IF(RC[-17]="",,"|n"&R1C18&RC[-17])&IF(RC[-16]="",,"|n"&R1C19&RC[-16])&IF(RC[-15]="",,"|n"&R1C20&RC[-15])&IF(RC[-14]="",,"|n"&R1C21&RC[-14])&IF(RC[-13]="",,"|n"&R1C22&RC[-13])&IF(RC[-11]="",,"|n"&R1C24&RC[-11])&IF(RC[-10]="",,"|n"&R1C25&RC[-10])&IF(RC[-9]="",,"|n"&R1C26&RC[-9])&IF(RC[-8]="",,"|n"&R1C27&RC[-8])&IF(RC[-7]="",,"|n"&R1C28&RC[-7])&IF(RC[-6]="",,"|n"&R1C29&RC[-6])&IF(RC[-2]="",,"|n"&RC[-2]) -> 
AI508: =IF(RC[-27]&RC[-26]&RC[-25]&RC[-24]&RC[-23]&RC[-22]="",,R1C7)&IF(RC[-27]="",,"|n"&R1C8&RC[-27])&IF(RC[-26]="",,"|n"&R1C9&RC[-26])&IF(RC[-25]="",,"|n"&R1C10&RC[-25])&IF(RC[-24]="",,"|n"&R1C11&RC[-24])&IF(RC[-23]="",,"|n"&R1C12&RC[-23])&IF(RC[-22]="",,"|n"&R1C13&RC[-22])&IF(RC[-20]&RC[-19]&RC[-18]&RC[-17]="",,"|n"&R1C14)&IF(RC[-20]="",,"|n"&R1C15&RC[-20])&IF(RC[-19]="",,"|n"&R1C16&RC[-19])&IF(RC[-18]="",,"|n"&R1C17&RC[-18])&IF(RC[-17]="",,"|n"&R1C18&RC[-17])&IF(RC[-16]="",,"|n"&R1C19&RC[-16])&IF(RC[-15]="",,"|n"&R1C20&RC[-15])&IF(RC[-14]="",,"|n"&R1C21&RC[-14])&IF(RC[-13]="",,"|n"&R1C22&RC[-13])&IF(RC[-11]="",,"|n"&R1C24&RC[-11])&IF(RC[-10]="",,"|n"&R1C25&RC[-10])&IF(RC[-9]="",,"|n"&R1C26&RC[-9])&IF(RC[-8]="",,"|n"&R1C27&RC[-8])&IF(RC[-7]="",,"|n"&R1C28&RC[-7])&IF(RC[-6]="",,"|n"&R1C29&RC[-6])&IF(RC[-2]="",,"|n"&RC[-2]) -> 
AI509: =IF(RC[-27]&RC[-26]&RC[-25]&RC[-24]&RC[-23]&RC[-22]="",,R1C7)&IF(RC[-27]="",,"|n"&R1C8&RC[-27])&IF(RC[-26]="",,"|n"&R1C9&RC[-26])&IF(RC[-25]="",,"|n"&R1C10&RC[-25])&IF(RC[-24]="",,"|n"&R1C11&RC[-24])&IF(RC[-23]="",,"|n"&R1C12&RC[-23])&IF(RC[-22]="",,"|n"&R1C13&RC[-22])&IF(RC[-20]&RC[-19]&RC[-18]&RC[-17]="",,"|n"&R1C14)&IF(RC[-20]="",,"|n"&R1C15&RC[-20])&IF(RC[-19]="",,"|n"&R1C16&RC[-19])&IF(RC[-18]="",,"|n"&R1C17&RC[-18])&IF(RC[-17]="",,"|n"&R1C18&RC[-17])&IF(RC[-16]="",,"|n"&R1C19&RC[-16])&IF(RC[-15]="",,"|n"&R1C20&RC[-15])&IF(RC[-14]="",,"|n"&R1C21&RC[-14])&IF(RC[-13]="",,"|n"&R1C22&RC[-13])&IF(RC[-11]="",,"|n"&R1C24&RC[-11])&IF(RC[-10]="",,"|n"&R1C25&RC[-10])&IF(RC[-9]="",,"|n"&R1C26&RC[-9])&IF(RC[-8]="",,"|n"&R1C27&RC[-8])&IF(RC[-7]="",,"|n"&R1C28&RC[-7])&IF(RC[-6]="",,"|n"&R1C29&RC[-6])&IF(RC[-2]="",,"|n"&RC[-2]) -> 
AI510: =IF(RC[-27]&RC[-26]&RC[-25]&RC[-24]&RC[-23]&RC[-22]="",,R1C7)&IF(RC[-27]="",,"|n"&R1C8&RC[-27])&IF(RC[-26]="",,"|n"&R1C9&RC[-26])&IF(RC[-25]="",,"|n"&R1C10&RC[-25])&IF(RC[-24]="",,"|n"&R1C11&RC[-24])&IF(RC[-23]="",,"|n"&R1C12&RC[-23])&IF(RC[-22]="",,"|n"&R1C13&RC[-22])&IF(RC[-20]&RC[-19]&RC[-18]&RC[-17]="",,"|n"&R1C14)&IF(RC[-20]="",,"|n"&R1C15&RC[-20])&IF(RC[-19]="",,"|n"&R1C16&RC[-19])&IF(RC[-18]="",,"|n"&R1C17&RC[-18])&IF(RC[-17]="",,"|n"&R1C18&RC[-17])&IF(RC[-16]="",,"|n"&R1C19&RC[-16])&IF(RC[-15]="",,"|n"&R1C20&RC[-15])&IF(RC[-14]="",,"|n"&R1C21&RC[-14])&IF(RC[-13]="",,"|n"&R1C22&RC[-13])&IF(RC[-11]="",,"|n"&R1C24&RC[-11])&IF(RC[-10]="",,"|n"&R1C25&RC[-10])&IF(RC[-9]="",,"|n"&R1C26&RC[-9])&IF(RC[-8]="",,"|n"&R1C27&RC[-8])&IF(RC[-7]="",,"|n"&R1C28&RC[-7])&IF(RC[-6]="",,"|n"&R1C29&RC[-6])&IF(RC[-2]="",,"|n"&RC[-2]) -> 
AI511: =IF(RC[-27]&RC[-26]&RC[-25]&RC[-24]&RC[-23]&RC[-22]="",,R1C7)&IF(RC[-27]="",,"|n"&R1C8&RC[-27])&IF(RC[-26]="",,"|n"&R1C9&RC[-26])&IF(RC[-25]="",,"|n"&R1C10&RC[-25])&IF(RC[-24]="",,"|n"&R1C11&RC[-24])&IF(RC[-23]="",,"|n"&R1C12&RC[-23])&IF(RC[-22]="",,"|n"&R1C13&RC[-22])&IF(RC[-20]&RC[-19]&RC[-18]&RC[-17]="",,"|n"&R1C14)&IF(RC[-20]="",,"|n"&R1C15&RC[-20])&IF(RC[-19]="",,"|n"&R1C16&RC[-19])&IF(RC[-18]="",,"|n"&R1C17&RC[-18])&IF(RC[-17]="",,"|n"&R1C18&RC[-17])&IF(RC[-16]="",,"|n"&R1C19&RC[-16])&IF(RC[-15]="",,"|n"&R1C20&RC[-15])&IF(RC[-14]="",,"|n"&R1C21&RC[-14])&IF(RC[-13]="",,"|n"&R1C22&RC[-13])&IF(RC[-11]="",,"|n"&R1C24&RC[-11])&IF(RC[-10]="",,"|n"&R1C25&RC[-10])&IF(RC[-9]="",,"|n"&R1C26&RC[-9])&IF(RC[-8]="",,"|n"&R1C27&RC[-8])&IF(RC[-7]="",,"|n"&R1C28&RC[-7])&IF(RC[-6]="",,"|n"&R1C29&RC[-6])&IF(RC[-2]="",,"|n"&RC[-2]) -> 
AI512: =IF(RC[-27]&RC[-26]&RC[-25]&RC[-24]&RC[-23]&RC[-22]="",,R1C7)&IF(RC[-27]="",,"|n"&R1C8&RC[-27])&IF(RC[-26]="",,"|n"&R1C9&RC[-26])&IF(RC[-25]="",,"|n"&R1C10&RC[-25])&IF(RC[-24]="",,"|n"&R1C11&RC[-24])&IF(RC[-23]="",,"|n"&R1C12&RC[-23])&IF(RC[-22]="",,"|n"&R1C13&RC[-22])&IF(RC[-20]&RC[-19]&RC[-18]&RC[-17]="",,"|n"&R1C14)&IF(RC[-20]="",,"|n"&R1C15&RC[-20])&IF(RC[-19]="",,"|n"&R1C16&RC[-19])&IF(RC[-18]="",,"|n"&R1C17&RC[-18])&IF(RC[-17]="",,"|n"&R1C18&RC[-17])&IF(RC[-16]="",,"|n"&R1C19&RC[-16])&IF(RC[-15]="",,"|n"&R1C20&RC[-15])&IF(RC[-14]="",,"|n"&R1C21&RC[-14])&IF(RC[-13]="",,"|n"&R1C22&RC[-13])&IF(RC[-11]="",,"|n"&R1C24&RC[-11])&IF(RC[-10]="",,"|n"&R1C25&RC[-10])&IF(RC[-9]="",,"|n"&R1C26&RC[-9])&IF(RC[-8]="",,"|n"&R1C27&RC[-8])&IF(RC[-7]="",,"|n"&R1C28&RC[-7])&IF(RC[-6]="",,"|n"&R1C29&RC[-6])&IF(RC[-2]="",,"|n"&RC[-2]) -> 
AI513: =IF(RC[-27]&RC[-26]&RC[-25]&RC[-24]&RC[-23]&RC[-22]="",,R1C7)&IF(RC[-27]="",,"|n"&R1C8&RC[-27])&IF(RC[-26]="",,"|n"&R1C9&RC[-26])&IF(RC[-25]="",,"|n"&R1C10&RC[-25])&IF(RC[-24]="",,"|n"&R1C11&RC[-24])&IF(RC[-23]="",,"|n"&R1C12&RC[-23])&IF(RC[-22]="",,"|n"&R1C13&RC[-22])&IF(RC[-20]&RC[-19]&RC[-18]&RC[-17]="",,"|n"&R1C14)&IF(RC[-20]="",,"|n"&R1C15&RC[-20])&IF(RC[-19]="",,"|n"&R1C16&RC[-19])&IF(RC[-18]="",,"|n"&R1C17&RC[-18])&IF(RC[-17]="",,"|n"&R1C18&RC[-17])&IF(RC[-16]="",,"|n"&R1C19&RC[-16])&IF(RC[-15]="",,"|n"&R1C20&RC[-15])&IF(RC[-14]="",,"|n"&R1C21&RC[-14])&IF(RC[-13]="",,"|n"&R1C22&RC[-13])&IF(RC[-11]="",,"|n"&R1C24&RC[-11])&IF(RC[-10]="",,"|n"&R1C25&RC[-10])&IF(RC[-9]="",,"|n"&R1C26&RC[-9])&IF(RC[-8]="",,"|n"&R1C27&RC[-8])&IF(RC[-7]="",,"|n"&R1C28&RC[-7])&IF(RC[-6]="",,"|n"&R1C29&RC[-6])&IF(RC[-2]="",,"|n"&RC[-2]) -> 
AI514: =IF(RC[-27]&RC[-26]&RC[-25]&RC[-24]&RC[-23]&RC[-22]="",,R1C7)&IF(RC[-27]="",,"|n"&R1C8&RC[-27])&IF(RC[-26]="",,"|n"&R1C9&RC[-26])&IF(RC[-25]="",,"|n"&R1C10&RC[-25])&IF(RC[-24]="",,"|n"&R1C11&RC[-24])&IF(RC[-23]="",,"|n"&R1C12&RC[-23])&IF(RC[-22]="",,"|n"&R1C13&RC[-22])&IF(RC[-20]&RC[-19]&RC[-18]&RC[-17]="",,"|n"&R1C14)&IF(RC[-20]="",,"|n"&R1C15&RC[-20])&IF(RC[-19]="",,"|n"&R1C16&RC[-19])&IF(RC[-18]="",,"|n"&R1C17&RC[-18])&IF(RC[-17]="",,"|n"&R1C18&RC[-17])&IF(RC[-16]="",,"|n"&R1C19&RC[-16])&IF(RC[-15]="",,"|n"&R1C20&RC[-15])&IF(RC[-14]="",,"|n"&R1C21&RC[-14])&IF(RC[-13]="",,"|n"&R1C22&RC[-13])&IF(RC[-11]="",,"|n"&R1C24&RC[-11])&IF(RC[-10]="",,"|n"&R1C25&RC[-10])&IF(RC[-9]="",,"|n"&R1C26&RC[-9])&IF(RC[-8]="",,"|n"&R1C27&RC[-8])&IF(RC[-7]="",,"|n"&R1C28&RC[-7])&IF(RC[-6]="",,"|n"&R1C29&RC[-6])&IF(RC[-2]="",,"|n"&RC[-2]) -> 
AI515: =IF(RC[-27]&RC[-26]&RC[-25]&RC[-24]&RC[-23]&RC[-22]="",,R1C7)&IF(RC[-27]="",,"|n"&R1C8&RC[-27])&IF(RC[-26]="",,"|n"&R1C9&RC[-26])&IF(RC[-25]="",,"|n"&R1C10&RC[-25])&IF(RC[-24]="",,"|n"&R1C11&RC[-24])&IF(RC[-23]="",,"|n"&R1C12&RC[-23])&IF(RC[-22]="",,"|n"&R1C13&RC[-22])&IF(RC[-20]&RC[-19]&RC[-18]&RC[-17]="",,"|n"&R1C14)&IF(RC[-20]="",,"|n"&R1C15&RC[-20])&IF(RC[-19]="",,"|n"&R1C16&RC[-19])&IF(RC[-18]="",,"|n"&R1C17&RC[-18])&IF(RC[-17]="",,"|n"&R1C18&RC[-17])&IF(RC[-16]="",,"|n"&R1C19&RC[-16])&IF(RC[-15]="",,"|n"&R1C20&RC[-15])&IF(RC[-14]="",,"|n"&R1C21&RC[-14])&IF(RC[-13]="",,"|n"&R1C22&RC[-13])&IF(RC[-11]="",,"|n"&R1C24&RC[-11])&IF(RC[-10]="",,"|n"&R1C25&RC[-10])&IF(RC[-9]="",,"|n"&R1C26&RC[-9])&IF(RC[-8]="",,"|n"&R1C27&RC[-8])&IF(RC[-7]="",,"|n"&R1C28&RC[-7])&IF(RC[-6]="",,"|n"&R1C29&RC[-6])&IF(RC[-2]="",,"|n"&RC[-2]) -> 
AI516: =IF(RC[-27]&RC[-26]&RC[-25]&RC[-24]&RC[-23]&RC[-22]="",,R1C7)&IF(RC[-27]="",,"|n"&R1C8&RC[-27])&IF(RC[-26]="",,"|n"&R1C9&RC[-26])&IF(RC[-25]="",,"|n"&R1C10&RC[-25])&IF(RC[-24]="",,"|n"&R1C11&RC[-24])&IF(RC[-23]="",,"|n"&R1C12&RC[-23])&IF(RC[-22]="",,"|n"&R1C13&RC[-22])&IF(RC[-20]&RC[-19]&RC[-18]&RC[-17]="",,"|n"&R1C14)&IF(RC[-20]="",,"|n"&R1C15&RC[-20])&IF(RC[-19]="",,"|n"&R1C16&RC[-19])&IF(RC[-18]="",,"|n"&R1C17&RC[-18])&IF(RC[-17]="",,"|n"&R1C18&RC[-17])&IF(RC[-16]="",,"|n"&R1C19&RC[-16])&IF(RC[-15]="",,"|n"&R1C20&RC[-15])&IF(RC[-14]="",,"|n"&R1C21&RC[-14])&IF(RC[-13]="",,"|n"&R1C22&RC[-13])&IF(RC[-11]="",,"|n"&R1C24&RC[-11])&IF(RC[-10]="",,"|n"&R1C25&RC[-10])&IF(RC[-9]="",,"|n"&R1C26&RC[-9])&IF(RC[-8]="",,"|n"&R1C27&RC[-8])&IF(RC[-7]="",,"|n"&R1C28&RC[-7])&IF(RC[-6]="",,"|n"&R1C29&RC[-6])&IF(RC[-2]="",,"|n"&RC[-2]) -> 
AI517: =IF(RC[-27]&RC[-26]&RC[-25]&RC[-24]&RC[-23]&RC[-22]="",,R1C7)&IF(RC[-27]="",,"|n"&R1C8&RC[-27])&IF(RC[-26]="",,"|n"&R1C9&RC[-26])&IF(RC[-25]="",,"|n"&R1C10&RC[-25])&IF(RC[-24]="",,"|n"&R1C11&RC[-24])&IF(RC[-23]="",,"|n"&R1C12&RC[-23])&IF(RC[-22]="",,"|n"&R1C13&RC[-22])&IF(RC[-20]&RC[-19]&RC[-18]&RC[-17]="",,"|n"&R1C14)&IF(RC[-20]="",,"|n"&R1C15&RC[-20])&IF(RC[-19]="",,"|n"&R1C16&RC[-19])&IF(RC[-18]="",,"|n"&R1C17&RC[-18])&IF(RC[-17]="",,"|n"&R1C18&RC[-17])&IF(RC[-16]="",,"|n"&R1C19&RC[-16])&IF(RC[-15]="",,"|n"&R1C20&RC[-15])&IF(RC[-14]="",,"|n"&R1C21&RC[-14])&IF(RC[-13]="",,"|n"&R1C22&RC[-13])&IF(RC[-11]="",,"|n"&R1C24&RC[-11])&IF(RC[-10]="",,"|n"&R1C25&RC[-10])&IF(RC[-9]="",,"|n"&R1C26&RC[-9])&IF(RC[-8]="",,"|n"&R1C27&RC[-8])&IF(RC[-7]="",,"|n"&R1C28&RC[-7])&IF(RC[-6]="",,"|n"&R1C29&RC[-6])&IF(RC[-2]="",,"|n"&RC[-2]) -> 
AI518: =IF(RC[-27]&RC[-26]&RC[-25]&RC[-24]&RC[-23]&RC[-22]="",,R1C7)&IF(RC[-27]="",,"|n"&R1C8&RC[-27])&IF(RC[-26]="",,"|n"&R1C9&RC[-26])&IF(RC[-25]="",,"|n"&R1C10&RC[-25])&IF(RC[-24]="",,"|n"&R1C11&RC[-24])&IF(RC[-23]="",,"|n"&R1C12&RC[-23])&IF(RC[-22]="",,"|n"&R1C13&RC[-22])&IF(RC[-20]&RC[-19]&RC[-18]&RC[-17]="",,"|n"&R1C14)&IF(RC[-20]="",,"|n"&R1C15&RC[-20])&IF(RC[-19]="",,"|n"&R1C16&RC[-19])&IF(RC[-18]="",,"|n"&R1C17&RC[-18])&IF(RC[-17]="",,"|n"&R1C18&RC[-17])&IF(RC[-16]="",,"|n"&R1C19&RC[-16])&IF(RC[-15]="",,"|n"&R1C20&RC[-15])&IF(RC[-14]="",,"|n"&R1C21&RC[-14])&IF(RC[-13]="",,"|n"&R1C22&RC[-13])&IF(RC[-11]="",,"|n"&R1C24&RC[-11])&IF(RC[-10]="",,"|n"&R1C25&RC[-10])&IF(RC[-9]="",,"|n"&R1C26&RC[-9])&IF(RC[-8]="",,"|n"&R1C27&RC[-8])&IF(RC[-7]="",,"|n"&R1C28&RC[-7])&IF(RC[-6]="",,"|n"&R1C29&RC[-6])&IF(RC[-2]="",,"|n"&RC[-2]) -> 
AI519: =IF(RC[-27]&RC[-26]&RC[-25]&RC[-24]&RC[-23]&RC[-22]="",,R1C7)&IF(RC[-27]="",,"|n"&R1C8&RC[-27])&IF(RC[-26]="",,"|n"&R1C9&RC[-26])&IF(RC[-25]="",,"|n"&R1C10&RC[-25])&IF(RC[-24]="",,"|n"&R1C11&RC[-24])&IF(RC[-23]="",,"|n"&R1C12&RC[-23])&IF(RC[-22]="",,"|n"&R1C13&RC[-22])&IF(RC[-20]&RC[-19]&RC[-18]&RC[-17]="",,"|n"&R1C14)&IF(RC[-20]="",,"|n"&R1C15&RC[-20])&IF(RC[-19]="",,"|n"&R1C16&RC[-19])&IF(RC[-18]="",,"|n"&R1C17&RC[-18])&IF(RC[-17]="",,"|n"&R1C18&RC[-17])&IF(RC[-16]="",,"|n"&R1C19&RC[-16])&IF(RC[-15]="",,"|n"&R1C20&RC[-15])&IF(RC[-14]="",,"|n"&R1C21&RC[-14])&IF(RC[-13]="",,"|n"&R1C22&RC[-13])&IF(RC[-11]="",,"|n"&R1C24&RC[-11])&IF(RC[-10]="",,"|n"&R1C25&RC[-10])&IF(RC[-9]="",,"|n"&R1C26&RC[-9])&IF(RC[-8]="",,"|n"&R1C27&RC[-8])&IF(RC[-7]="",,"|n"&R1C28&RC[-7])&IF(RC[-6]="",,"|n"&R1C29&RC[-6])&IF(RC[-2]="",,"|n"&RC[-2]) -> 
AI520: =IF(RC[-27]&RC[-26]&RC[-25]&RC[-24]&RC[-23]&RC[-22]="",,R1C7)&IF(RC[-27]="",,"|n"&R1C8&RC[-27])&IF(RC[-26]="",,"|n"&R1C9&RC[-26])&IF(RC[-25]="",,"|n"&R1C10&RC[-25])&IF(RC[-24]="",,"|n"&R1C11&RC[-24])&IF(RC[-23]="",,"|n"&R1C12&RC[-23])&IF(RC[-22]="",,"|n"&R1C13&RC[-22])&IF(RC[-20]&RC[-19]&RC[-18]&RC[-17]="",,"|n"&R1C14)&IF(RC[-20]="",,"|n"&R1C15&RC[-20])&IF(RC[-19]="",,"|n"&R1C16&RC[-19])&IF(RC[-18]="",,"|n"&R1C17&RC[-18])&IF(RC[-17]="",,"|n"&R1C18&RC[-17])&IF(RC[-16]="",,"|n"&R1C19&RC[-16])&IF(RC[-15]="",,"|n"&R1C20&RC[-15])&IF(RC[-14]="",,"|n"&R1C21&RC[-14])&IF(RC[-13]="",,"|n"&R1C22&RC[-13])&IF(RC[-11]="",,"|n"&R1C24&RC[-11])&IF(RC[-10]="",,"|n"&R1C25&RC[-10])&IF(RC[-9]="",,"|n"&R1C26&RC[-9])&IF(RC[-8]="",,"|n"&R1C27&RC[-8])&IF(RC[-7]="",,"|n"&R1C28&RC[-7])&IF(RC[-6]="",,"|n"&R1C29&RC[-6])&IF(RC[-2]="",,"|n"&RC[-2]) -> 
AI521: =IF(RC[-27]&RC[-26]&RC[-25]&RC[-24]&RC[-23]&RC[-22]="",,R1C7)&IF(RC[-27]="",,"|n"&R1C8&RC[-27])&IF(RC[-26]="",,"|n"&R1C9&RC[-26])&IF(RC[-25]="",,"|n"&R1C10&RC[-25])&IF(RC[-24]="",,"|n"&R1C11&RC[-24])&IF(RC[-23]="",,"|n"&R1C12&RC[-23])&IF(RC[-22]="",,"|n"&R1C13&RC[-22])&IF(RC[-20]&RC[-19]&RC[-18]&RC[-17]="",,"|n"&R1C14)&IF(RC[-20]="",,"|n"&R1C15&RC[-20])&IF(RC[-19]="",,"|n"&R1C16&RC[-19])&IF(RC[-18]="",,"|n"&R1C17&RC[-18])&IF(RC[-17]="",,"|n"&R1C18&RC[-17])&IF(RC[-16]="",,"|n"&R1C19&RC[-16])&IF(RC[-15]="",,"|n"&R1C20&RC[-15])&IF(RC[-14]="",,"|n"&R1C21&RC[-14])&IF(RC[-13]="",,"|n"&R1C22&RC[-13])&IF(RC[-11]="",,"|n"&R1C24&RC[-11])&IF(RC[-10]="",,"|n"&R1C25&RC[-10])&IF(RC[-9]="",,"|n"&R1C26&RC[-9])&IF(RC[-8]="",,"|n"&R1C27&RC[-8])&IF(RC[-7]="",,"|n"&R1C28&RC[-7])&IF(RC[-6]="",,"|n"&R1C29&RC[-6])&IF(RC[-2]="",,"|n"&RC[-2]) -> 
AI522: =IF(RC[-27]&RC[-26]&RC[-25]&RC[-24]&RC[-23]&RC[-22]="",,R1C7)&IF(RC[-27]="",,"|n"&R1C8&RC[-27])&IF(RC[-26]="",,"|n"&R1C9&RC[-26])&IF(RC[-25]="",,"|n"&R1C10&RC[-25])&IF(RC[-24]="",,"|n"&R1C11&RC[-24])&IF(RC[-23]="",,"|n"&R1C12&RC[-23])&IF(RC[-22]="",,"|n"&R1C13&RC[-22])&IF(RC[-20]&RC[-19]&RC[-18]&RC[-17]="",,"|n"&R1C14)&IF(RC[-20]="",,"|n"&R1C15&RC[-20])&IF(RC[-19]="",,"|n"&R1C16&RC[-19])&IF(RC[-18]="",,"|n"&R1C17&RC[-18])&IF(RC[-17]="",,"|n"&R1C18&RC[-17])&IF(RC[-16]="",,"|n"&R1C19&RC[-16])&IF(RC[-15]="",,"|n"&R1C20&RC[-15])&IF(RC[-14]="",,"|n"&R1C21&RC[-14])&IF(RC[-13]="",,"|n"&R1C22&RC[-13])&IF(RC[-11]="",,"|n"&R1C24&RC[-11])&IF(RC[-10]="",,"|n"&R1C25&RC[-10])&IF(RC[-9]="",,"|n"&R1C26&RC[-9])&IF(RC[-8]="",,"|n"&R1C27&RC[-8])&IF(RC[-7]="",,"|n"&R1C28&RC[-7])&IF(RC[-6]="",,"|n"&R1C29&RC[-6])&IF(RC[-2]="",,"|n"&RC[-2]) -> 
AI523: =IF(RC[-27]&RC[-26]&RC[-25]&RC[-24]&RC[-23]&RC[-22]="",,R1C7)&IF(RC[-27]="",,"|n"&R1C8&RC[-27])&IF(RC[-26]="",,"|n"&R1C9&RC[-26])&IF(RC[-25]="",,"|n"&R1C10&RC[-25])&IF(RC[-24]="",,"|n"&R1C11&RC[-24])&IF(RC[-23]="",,"|n"&R1C12&RC[-23])&IF(RC[-22]="",,"|n"&R1C13&RC[-22])&IF(RC[-20]&RC[-19]&RC[-18]&RC[-17]="",,"|n"&R1C14)&IF(RC[-20]="",,"|n"&R1C15&RC[-20])&IF(RC[-19]="",,"|n"&R1C16&RC[-19])&IF(RC[-18]="",,"|n"&R1C17&RC[-18])&IF(RC[-17]="",,"|n"&R1C18&RC[-17])&IF(RC[-16]="",,"|n"&R1C19&RC[-16])&IF(RC[-15]="",,"|n"&R1C20&RC[-15])&IF(RC[-14]="",,"|n"&R1C21&RC[-14])&IF(RC[-13]="",,"|n"&R1C22&RC[-13])&IF(RC[-11]="",,"|n"&R1C24&RC[-11])&IF(RC[-10]="",,"|n"&R1C25&RC[-10])&IF(RC[-9]="",,"|n"&R1C26&RC[-9])&IF(RC[-8]="",,"|n"&R1C27&RC[-8])&IF(RC[-7]="",,"|n"&R1C28&RC[-7])&IF(RC[-6]="",,"|n"&R1C29&RC[-6])&IF(RC[-2]="",,"|n"&RC[-2]) -> 
AI524: =IF(RC[-27]&RC[-26]&RC[-25]&RC[-24]&RC[-23]&RC[-22]="",,R1C7)&IF(RC[-27]="",,"|n"&R1C8&RC[-27])&IF(RC[-26]="",,"|n"&R1C9&RC[-26])&IF(RC[-25]="",,"|n"&R1C10&RC[-25])&IF(RC[-24]="",,"|n"&R1C11&RC[-24])&IF(RC[-23]="",,"|n"&R1C12&RC[-23])&IF(RC[-22]="",,"|n"&R1C13&RC[-22])&IF(RC[-20]&RC[-19]&RC[-18]&RC[-17]="",,"|n"&R1C14)&IF(RC[-20]="",,"|n"&R1C15&RC[-20])&IF(RC[-19]="",,"|n"&R1C16&RC[-19])&IF(RC[-18]="",,"|n"&R1C17&RC[-18])&IF(RC[-17]="",,"|n"&R1C18&RC[-17])&IF(RC[-16]="",,"|n"&R1C19&RC[-16])&IF(RC[-15]="",,"|n"&R1C20&RC[-15])&IF(RC[-14]="",,"|n"&R1C21&RC[-14])&IF(RC[-13]="",,"|n"&R1C22&RC[-13])&IF(RC[-11]="",,"|n"&R1C24&RC[-11])&IF(RC[-10]="",,"|n"&R1C25&RC[-10])&IF(RC[-9]="",,"|n"&R1C26&RC[-9])&IF(RC[-8]="",,"|n"&R1C27&RC[-8])&IF(RC[-7]="",,"|n"&R1C28&RC[-7])&IF(RC[-6]="",,"|n"&R1C29&RC[-6])&IF(RC[-2]="",,"|n"&RC[-2]) -> 
AI525: =IF(RC[-27]&RC[-26]&RC[-25]&RC[-24]&RC[-23]&RC[-22]="",,R1C7)&IF(RC[-27]="",,"|n"&R1C8&RC[-27])&IF(RC[-26]="",,"|n"&R1C9&RC[-26])&IF(RC[-25]="",,"|n"&R1C10&RC[-25])&IF(RC[-24]="",,"|n"&R1C11&RC[-24])&IF(RC[-23]="",,"|n"&R1C12&RC[-23])&IF(RC[-22]="",,"|n"&R1C13&RC[-22])&IF(RC[-20]&RC[-19]&RC[-18]&RC[-17]="",,"|n"&R1C14)&IF(RC[-20]="",,"|n"&R1C15&RC[-20])&IF(RC[-19]="",,"|n"&R1C16&RC[-19])&IF(RC[-18]="",,"|n"&R1C17&RC[-18])&IF(RC[-17]="",,"|n"&R1C18&RC[-17])&IF(RC[-16]="",,"|n"&R1C19&RC[-16])&IF(RC[-15]="",,"|n"&R1C20&RC[-15])&IF(RC[-14]="",,"|n"&R1C21&RC[-14])&IF(RC[-13]="",,"|n"&R1C22&RC[-13])&IF(RC[-11]="",,"|n"&R1C24&RC[-11])&IF(RC[-10]="",,"|n"&R1C25&RC[-10])&IF(RC[-9]="",,"|n"&R1C26&RC[-9])&IF(RC[-8]="",,"|n"&R1C27&RC[-8])&IF(RC[-7]="",,"|n"&R1C28&RC[-7])&IF(RC[-6]="",,"|n"&R1C29&RC[-6])&IF(RC[-2]="",,"|n"&RC[-2]) -> 
AI526: =IF(RC[-27]&RC[-26]&RC[-25]&RC[-24]&RC[-23]&RC[-22]="",,R1C7)&IF(RC[-27]="",,"|n"&R1C8&RC[-27])&IF(RC[-26]="",,"|n"&R1C9&RC[-26])&IF(RC[-25]="",,"|n"&R1C10&RC[-25])&IF(RC[-24]="",,"|n"&R1C11&RC[-24])&IF(RC[-23]="",,"|n"&R1C12&RC[-23])&IF(RC[-22]="",,"|n"&R1C13&RC[-22])&IF(RC[-20]&RC[-19]&RC[-18]&RC[-17]="",,"|n"&R1C14)&IF(RC[-20]="",,"|n"&R1C15&RC[-20])&IF(RC[-19]="",,"|n"&R1C16&RC[-19])&IF(RC[-18]="",,"|n"&R1C17&RC[-18])&IF(RC[-17]="",,"|n"&R1C18&RC[-17])&IF(RC[-16]="",,"|n"&R1C19&RC[-16])&IF(RC[-15]="",,"|n"&R1C20&RC[-15])&IF(RC[-14]="",,"|n"&R1C21&RC[-14])&IF(RC[-13]="",,"|n"&R1C22&RC[-13])&IF(RC[-11]="",,"|n"&R1C24&RC[-11])&IF(RC[-10]="",,"|n"&R1C25&RC[-10])&IF(RC[-9]="",,"|n"&R1C26&RC[-9])&IF(RC[-8]="",,"|n"&R1C27&RC[-8])&IF(RC[-7]="",,"|n"&R1C28&RC[-7])&IF(RC[-6]="",,"|n"&R1C29&RC[-6])&IF(RC[-2]="",,"|n"&RC[-2]) -> 
AI527: =IF(RC[-27]&RC[-26]&RC[-25]&RC[-24]&RC[-23]&RC[-22]="",,R1C7)&IF(RC[-27]="",,"|n"&R1C8&RC[-27])&IF(RC[-26]="",,"|n"&R1C9&RC[-26])&IF(RC[-25]="",,"|n"&R1C10&RC[-25])&IF(RC[-24]="",,"|n"&R1C11&RC[-24])&IF(RC[-23]="",,"|n"&R1C12&RC[-23])&IF(RC[-22]="",,"|n"&R1C13&RC[-22])&IF(RC[-20]&RC[-19]&RC[-18]&RC[-17]="",,"|n"&R1C14)&IF(RC[-20]="",,"|n"&R1C15&RC[-20])&IF(RC[-19]="",,"|n"&R1C16&RC[-19])&IF(RC[-18]="",,"|n"&R1C17&RC[-18])&IF(RC[-17]="",,"|n"&R1C18&RC[-17])&IF(RC[-16]="",,"|n"&R1C19&RC[-16])&IF(RC[-15]="",,"|n"&R1C20&RC[-15])&IF(RC[-14]="",,"|n"&R1C21&RC[-14])&IF(RC[-13]="",,"|n"&R1C22&RC[-13])&IF(RC[-11]="",,"|n"&R1C24&RC[-11])&IF(RC[-10]="",,"|n"&R1C25&RC[-10])&IF(RC[-9]="",,"|n"&R1C26&RC[-9])&IF(RC[-8]="",,"|n"&R1C27&RC[-8])&IF(RC[-7]="",,"|n"&R1C28&RC[-7])&IF(RC[-6]="",,"|n"&R1C29&RC[-6])&IF(RC[-2]="",,"|n"&RC[-2]) -> 
AI528: =IF(RC[-27]&RC[-26]&RC[-25]&RC[-24]&RC[-23]&RC[-22]="",,R1C7)&IF(RC[-27]="",,"|n"&R1C8&RC[-27])&IF(RC[-26]="",,"|n"&R1C9&RC[-26])&IF(RC[-25]="",,"|n"&R1C10&RC[-25])&IF(RC[-24]="",,"|n"&R1C11&RC[-24])&IF(RC[-23]="",,"|n"&R1C12&RC[-23])&IF(RC[-22]="",,"|n"&R1C13&RC[-22])&IF(RC[-20]&RC[-19]&RC[-18]&RC[-17]="",,"|n"&R1C14)&IF(RC[-20]="",,"|n"&R1C15&RC[-20])&IF(RC[-19]="",,"|n"&R1C16&RC[-19])&IF(RC[-18]="",,"|n"&R1C17&RC[-18])&IF(RC[-17]="",,"|n"&R1C18&RC[-17])&IF(RC[-16]="",,"|n"&R1C19&RC[-16])&IF(RC[-15]="",,"|n"&R1C20&RC[-15])&IF(RC[-14]="",,"|n"&R1C21&RC[-14])&IF(RC[-13]="",,"|n"&R1C22&RC[-13])&IF(RC[-11]="",,"|n"&R1C24&RC[-11])&IF(RC[-10]="",,"|n"&R1C25&RC[-10])&IF(RC[-9]="",,"|n"&R1C26&RC[-9])&IF(RC[-8]="",,"|n"&R1C27&RC[-8])&IF(RC[-7]="",,"|n"&R1C28&RC[-7])&IF(RC[-6]="",,"|n"&R1C29&RC[-6])&IF(RC[-2]="",,"|n"&RC[-2]) -> 
AI529: =IF(RC[-27]&RC[-26]&RC[-25]&RC[-24]&RC[-23]&RC[-22]="",,R1C7)&IF(RC[-27]="",,"|n"&R1C8&RC[-27])&IF(RC[-26]="",,"|n"&R1C9&RC[-26])&IF(RC[-25]="",,"|n"&R1C10&RC[-25])&IF(RC[-24]="",,"|n"&R1C11&RC[-24])&IF(RC[-23]="",,"|n"&R1C12&RC[-23])&IF(RC[-22]="",,"|n"&R1C13&RC[-22])&IF(RC[-20]&RC[-19]&RC[-18]&RC[-17]="",,"|n"&R1C14)&IF(RC[-20]="",,"|n"&R1C15&RC[-20])&IF(RC[-19]="",,"|n"&R1C16&RC[-19])&IF(RC[-18]="",,"|n"&R1C17&RC[-18])&IF(RC[-17]="",,"|n"&R1C18&RC[-17])&IF(RC[-16]="",,"|n"&R1C19&RC[-16])&IF(RC[-15]="",,"|n"&R1C20&RC[-15])&IF(RC[-14]="",,"|n"&R1C21&RC[-14])&IF(RC[-13]="",,"|n"&R1C22&RC[-13])&IF(RC[-11]="",,"|n"&R1C24&RC[-11])&IF(RC[-10]="",,"|n"&R1C25&RC[-10])&IF(RC[-9]="",,"|n"&R1C26&RC[-9])&IF(RC[-8]="",,"|n"&R1C27&RC[-8])&IF(RC[-7]="",,"|n"&R1C28&RC[-7])&IF(RC[-6]="",,"|n"&R1C29&RC[-6])&IF(RC[-2]="",,"|n"&RC[-2]) -> 
AI530: =IF(RC[-27]&RC[-26]&RC[-25]&RC[-24]&RC[-23]&RC[-22]="",,R1C7)&IF(RC[-27]="",,"|n"&R1C8&RC[-27])&IF(RC[-26]="",,"|n"&R1C9&RC[-26])&IF(RC[-25]="",,"|n"&R1C10&RC[-25])&IF(RC[-24]="",,"|n"&R1C11&RC[-24])&IF(RC[-23]="",,"|n"&R1C12&RC[-23])&IF(RC[-22]="",,"|n"&R1C13&RC[-22])&IF(RC[-20]&RC[-19]&RC[-18]&RC[-17]="",,"|n"&R1C14)&IF(RC[-20]="",,"|n"&R1C15&RC[-20])&IF(RC[-19]="",,"|n"&R1C16&RC[-19])&IF(RC[-18]="",,"|n"&R1C17&RC[-18])&IF(RC[-17]="",,"|n"&R1C18&RC[-17])&IF(RC[-16]="",,"|n"&R1C19&RC[-16])&IF(RC[-15]="",,"|n"&R1C20&RC[-15])&IF(RC[-14]="",,"|n"&R1C21&RC[-14])&IF(RC[-13]="",,"|n"&R1C22&RC[-13])&IF(RC[-11]="",,"|n"&R1C24&RC[-11])&IF(RC[-10]="",,"|n"&R1C25&RC[-10])&IF(RC[-9]="",,"|n"&R1C26&RC[-9])&IF(RC[-8]="",,"|n"&R1C27&RC[-8])&IF(RC[-7]="",,"|n"&R1C28&RC[-7])&IF(RC[-6]="",,"|n"&R1C29&RC[-6])&IF(RC[-2]="",,"|n"&RC[-2]) -> 
AI531: =IF(RC[-27]&RC[-26]&RC[-25]&RC[-24]&RC[-23]&RC[-22]="",,R1C7)&IF(RC[-27]="",,"|n"&R1C8&RC[-27])&IF(RC[-26]="",,"|n"&R1C9&RC[-26])&IF(RC[-25]="",,"|n"&R1C10&RC[-25])&IF(RC[-24]="",,"|n"&R1C11&RC[-24])&IF(RC[-23]="",,"|n"&R1C12&RC[-23])&IF(RC[-22]="",,"|n"&R1C13&RC[-22])&IF(RC[-20]&RC[-19]&RC[-18]&RC[-17]="",,"|n"&R1C14)&IF(RC[-20]="",,"|n"&R1C15&RC[-20])&IF(RC[-19]="",,"|n"&R1C16&RC[-19])&IF(RC[-18]="",,"|n"&R1C17&RC[-18])&IF(RC[-17]="",,"|n"&R1C18&RC[-17])&IF(RC[-16]="",,"|n"&R1C19&RC[-16])&IF(RC[-15]="",,"|n"&R1C20&RC[-15])&IF(RC[-14]="",,"|n"&R1C21&RC[-14])&IF(RC[-13]="",,"|n"&R1C22&RC[-13])&IF(RC[-11]="",,"|n"&R1C24&RC[-11])&IF(RC[-10]="",,"|n"&R1C25&RC[-10])&IF(RC[-9]="",,"|n"&R1C26&RC[-9])&IF(RC[-8]="",,"|n"&R1C27&RC[-8])&IF(RC[-7]="",,"|n"&R1C28&RC[-7])&IF(RC[-6]="",,"|n"&R1C29&RC[-6])&IF(RC[-2]="",,"|n"&RC[-2]) -> 
AI532: =IF(RC[-27]&RC[-26]&RC[-25]&RC[-24]&RC[-23]&RC[-22]="",,R1C7)&IF(RC[-27]="",,"|n"&R1C8&RC[-27])&IF(RC[-26]="",,"|n"&R1C9&RC[-26])&IF(RC[-25]="",,"|n"&R1C10&RC[-25])&IF(RC[-24]="",,"|n"&R1C11&RC[-24])&IF(RC[-23]="",,"|n"&R1C12&RC[-23])&IF(RC[-22]="",,"|n"&R1C13&RC[-22])&IF(RC[-20]&RC[-19]&RC[-18]&RC[-17]="",,"|n"&R1C14)&IF(RC[-20]="",,"|n"&R1C15&RC[-20])&IF(RC[-19]="",,"|n"&R1C16&RC[-19])&IF(RC[-18]="",,"|n"&R1C17&RC[-18])&IF(RC[-17]="",,"|n"&R1C18&RC[-17])&IF(RC[-16]="",,"|n"&R1C19&RC[-16])&IF(RC[-15]="",,"|n"&R1C20&RC[-15])&IF(RC[-14]="",,"|n"&R1C21&RC[-14])&IF(RC[-13]="",,"|n"&R1C22&RC[-13])&IF(RC[-11]="",,"|n"&R1C24&RC[-11])&IF(RC[-10]="",,"|n"&R1C25&RC[-10])&IF(RC[-9]="",,"|n"&R1C26&RC[-9])&IF(RC[-8]="",,"|n"&R1C27&RC[-8])&IF(RC[-7]="",,"|n"&R1C28&RC[-7])&IF(RC[-6]="",,"|n"&R1C29&RC[-6])&IF(RC[-2]="",,"|n"&RC[-2]) -> 
AI533: =IF(RC[-27]&RC[-26]&RC[-25]&RC[-24]&RC[-23]&RC[-22]="",,R1C7)&IF(RC[-27]="",,"|n"&R1C8&RC[-27])&IF(RC[-26]="",,"|n"&R1C9&RC[-26])&IF(RC[-25]="",,"|n"&R1C10&RC[-25])&IF(RC[-24]="",,"|n"&R1C11&RC[-24])&IF(RC[-23]="",,"|n"&R1C12&RC[-23])&IF(RC[-22]="",,"|n"&R1C13&RC[-22])&IF(RC[-20]&RC[-19]&RC[-18]&RC[-17]="",,"|n"&R1C14)&IF(RC[-20]="",,"|n"&R1C15&RC[-20])&IF(RC[-19]="",,"|n"&R1C16&RC[-19])&IF(RC[-18]="",,"|n"&R1C17&RC[-18])&IF(RC[-17]="",,"|n"&R1C18&RC[-17])&IF(RC[-16]="",,"|n"&R1C19&RC[-16])&IF(RC[-15]="",,"|n"&R1C20&RC[-15])&IF(RC[-14]="",,"|n"&R1C21&RC[-14])&IF(RC[-13]="",,"|n"&R1C22&RC[-13])&IF(RC[-11]="",,"|n"&R1C24&RC[-11])&IF(RC[-10]="",,"|n"&R1C25&RC[-10])&IF(RC[-9]="",,"|n"&R1C26&RC[-9])&IF(RC[-8]="",,"|n"&R1C27&RC[-8])&IF(RC[-7]="",,"|n"&R1C28&RC[-7])&IF(RC[-6]="",,"|n"&R1C29&RC[-6])&IF(RC[-2]="",,"|n"&RC[-2]) -> 
AI534: =IF(RC[-27]&RC[-26]&RC[-25]&RC[-24]&RC[-23]&RC[-22]="",,R1C7)&IF(RC[-27]="",,"|n"&R1C8&RC[-27])&IF(RC[-26]="",,"|n"&R1C9&RC[-26])&IF(RC[-25]="",,"|n"&R1C10&RC[-25])&IF(RC[-24]="",,"|n"&R1C11&RC[-24])&IF(RC[-23]="",,"|n"&R1C12&RC[-23])&IF(RC[-22]="",,"|n"&R1C13&RC[-22])&IF(RC[-20]&RC[-19]&RC[-18]&RC[-17]="",,"|n"&R1C14)&IF(RC[-20]="",,"|n"&R1C15&RC[-20])&IF(RC[-19]="",,"|n"&R1C16&RC[-19])&IF(RC[-18]="",,"|n"&R1C17&RC[-18])&IF(RC[-17]="",,"|n"&R1C18&RC[-17])&IF(RC[-16]="",,"|n"&R1C19&RC[-16])&IF(RC[-15]="",,"|n"&R1C20&RC[-15])&IF(RC[-14]="",,"|n"&R1C21&RC[-14])&IF(RC[-13]="",,"|n"&R1C22&RC[-13])&IF(RC[-11]="",,"|n"&R1C24&RC[-11])&IF(RC[-10]="",,"|n"&R1C25&RC[-10])&IF(RC[-9]="",,"|n"&R1C26&RC[-9])&IF(RC[-8]="",,"|n"&R1C27&RC[-8])&IF(RC[-7]="",,"|n"&R1C28&RC[-7])&IF(RC[-6]="",,"|n"&R1C29&RC[-6])&IF(RC[-2]="",,"|n"&RC[-2]) -> 
AI535: =IF(RC[-27]&RC[-26]&RC[-25]&RC[-24]&RC[-23]&RC[-22]="",,R1C7)&IF(RC[-27]="",,"|n"&R1C8&RC[-27])&IF(RC[-26]="",,"|n"&R1C9&RC[-26])&IF(RC[-25]="",,"|n"&R1C10&RC[-25])&IF(RC[-24]="",,"|n"&R1C11&RC[-24])&IF(RC[-23]="",,"|n"&R1C12&RC[-23])&IF(RC[-22]="",,"|n"&R1C13&RC[-22])&IF(RC[-20]&RC[-19]&RC[-18]&RC[-17]="",,"|n"&R1C14)&IF(RC[-20]="",,"|n"&R1C15&RC[-20])&IF(RC[-19]="",,"|n"&R1C16&RC[-19])&IF(RC[-18]="",,"|n"&R1C17&RC[-18])&IF(RC[-17]="",,"|n"&R1C18&RC[-17])&IF(RC[-16]="",,"|n"&R1C19&RC[-16])&IF(RC[-15]="",,"|n"&R1C20&RC[-15])&IF(RC[-14]="",,"|n"&R1C21&RC[-14])&IF(RC[-13]="",,"|n"&R1C22&RC[-13])&IF(RC[-11]="",,"|n"&R1C24&RC[-11])&IF(RC[-10]="",,"|n"&R1C25&RC[-10])&IF(RC[-9]="",,"|n"&R1C26&RC[-9])&IF(RC[-8]="",,"|n"&R1C27&RC[-8])&IF(RC[-7]="",,"|n"&R1C28&RC[-7])&IF(RC[-6]="",,"|n"&R1C29&RC[-6])&IF(RC[-2]="",,"|n"&RC[-2]) -> 
AI536: =IF(RC[-27]&RC[-26]&RC[-25]&RC[-24]&RC[-23]&RC[-22]="",,R1C7)&IF(RC[-27]="",,"|n"&R1C8&RC[-27])&IF(RC[-26]="",,"|n"&R1C9&RC[-26])&IF(RC[-25]="",,"|n"&R1C10&RC[-25])&IF(RC[-24]="",,"|n"&R1C11&RC[-24])&IF(RC[-23]="",,"|n"&R1C12&RC[-23])&IF(RC[-22]="",,"|n"&R1C13&RC[-22])&IF(RC[-20]&RC[-19]&RC[-18]&RC[-17]="",,"|n"&R1C14)&IF(RC[-20]="",,"|n"&R1C15&RC[-20])&IF(RC[-19]="",,"|n"&R1C16&RC[-19])&IF(RC[-18]="",,"|n"&R1C17&RC[-18])&IF(RC[-17]="",,"|n"&R1C18&RC[-17])&IF(RC[-16]="",,"|n"&R1C19&RC[-16])&IF(RC[-15]="",,"|n"&R1C20&RC[-15])&IF(RC[-14]="",,"|n"&R1C21&RC[-14])&IF(RC[-13]="",,"|n"&R1C22&RC[-13])&IF(RC[-11]="",,"|n"&R1C24&RC[-11])&IF(RC[-10]="",,"|n"&R1C25&RC[-10])&IF(RC[-9]="",,"|n"&R1C26&RC[-9])&IF(RC[-8]="",,"|n"&R1C27&RC[-8])&IF(RC[-7]="",,"|n"&R1C28&RC[-7])&IF(RC[-6]="",,"|n"&R1C29&RC[-6])&IF(RC[-2]="",,"|n"&RC[-2]) -> 
AI537: =IF(RC[-27]&RC[-26]&RC[-25]&RC[-24]&RC[-23]&RC[-22]="",,R1C7)&IF(RC[-27]="",,"|n"&R1C8&RC[-27])&IF(RC[-26]="",,"|n"&R1C9&RC[-26])&IF(RC[-25]="",,"|n"&R1C10&RC[-25])&IF(RC[-24]="",,"|n"&R1C11&RC[-24])&IF(RC[-23]="",,"|n"&R1C12&RC[-23])&IF(RC[-22]="",,"|n"&R1C13&RC[-22])&IF(RC[-20]&RC[-19]&RC[-18]&RC[-17]="",,"|n"&R1C14)&IF(RC[-20]="",,"|n"&R1C15&RC[-20])&IF(RC[-19]="",,"|n"&R1C16&RC[-19])&IF(RC[-18]="",,"|n"&R1C17&RC[-18])&IF(RC[-17]="",,"|n"&R1C18&RC[-17])&IF(RC[-16]="",,"|n"&R1C19&RC[-16])&IF(RC[-15]="",,"|n"&R1C20&RC[-15])&IF(RC[-14]="",,"|n"&R1C21&RC[-14])&IF(RC[-13]="",,"|n"&R1C22&RC[-13])&IF(RC[-11]="",,"|n"&R1C24&RC[-11])&IF(RC[-10]="",,"|n"&R1C25&RC[-10])&IF(RC[-9]="",,"|n"&R1C26&RC[-9])&IF(RC[-8]="",,"|n"&R1C27&RC[-8])&IF(RC[-7]="",,"|n"&R1C28&RC[-7])&IF(RC[-6]="",,"|n"&R1C29&RC[-6])&IF(RC[-2]="",,"|n"&RC[-2]) -> 
AI538: =IF(RC[-27]&RC[-26]&RC[-25]&RC[-24]&RC[-23]&RC[-22]="",,R1C7)&IF(RC[-27]="",,"|n"&R1C8&RC[-27])&IF(RC[-26]="",,"|n"&R1C9&RC[-26])&IF(RC[-25]="",,"|n"&R1C10&RC[-25])&IF(RC[-24]="",,"|n"&R1C11&RC[-24])&IF(RC[-23]="",,"|n"&R1C12&RC[-23])&IF(RC[-22]="",,"|n"&R1C13&RC[-22])&IF(RC[-20]&RC[-19]&RC[-18]&RC[-17]="",,"|n"&R1C14)&IF(RC[-20]="",,"|n"&R1C15&RC[-20])&IF(RC[-19]="",,"|n"&R1C16&RC[-19])&IF(RC[-18]="",,"|n"&R1C17&RC[-18])&IF(RC[-17]="",,"|n"&R1C18&RC[-17])&IF(RC[-16]="",,"|n"&R1C19&RC[-16])&IF(RC[-15]="",,"|n"&R1C20&RC[-15])&IF(RC[-14]="",,"|n"&R1C21&RC[-14])&IF(RC[-13]="",,"|n"&R1C22&RC[-13])&IF(RC[-11]="",,"|n"&R1C24&RC[-11])&IF(RC[-10]="",,"|n"&R1C25&RC[-10])&IF(RC[-9]="",,"|n"&R1C26&RC[-9])&IF(RC[-8]="",,"|n"&R1C27&RC[-8])&IF(RC[-7]="",,"|n"&R1C28&RC[-7])&IF(RC[-6]="",,"|n"&R1C29&RC[-6])&IF(RC[-2]="",,"|n"&RC[-2]) -> 
AI539: =IF(RC[-27]&RC[-26]&RC[-25]&RC[-24]&RC[-23]&RC[-22]="",,R1C7)&IF(RC[-27]="",,"|n"&R1C8&RC[-27])&IF(RC[-26]="",,"|n"&R1C9&RC[-26])&IF(RC[-25]="",,"|n"&R1C10&RC[-25])&IF(RC[-24]="",,"|n"&R1C11&RC[-24])&IF(RC[-23]="",,"|n"&R1C12&RC[-23])&IF(RC[-22]="",,"|n"&R1C13&RC[-22])&IF(RC[-20]&RC[-19]&RC[-18]&RC[-17]="",,"|n"&R1C14)&IF(RC[-20]="",,"|n"&R1C15&RC[-20])&IF(RC[-19]="",,"|n"&R1C16&RC[-19])&IF(RC[-18]="",,"|n"&R1C17&RC[-18])&IF(RC[-17]="",,"|n"&R1C18&RC[-17])&IF(RC[-16]="",,"|n"&R1C19&RC[-16])&IF(RC[-15]="",,"|n"&R1C20&RC[-15])&IF(RC[-14]="",,"|n"&R1C21&RC[-14])&IF(RC[-13]="",,"|n"&R1C22&RC[-13])&IF(RC[-11]="",,"|n"&R1C24&RC[-11])&IF(RC[-10]="",,"|n"&R1C25&RC[-10])&IF(RC[-9]="",,"|n"&R1C26&RC[-9])&IF(RC[-8]="",,"|n"&R1C27&RC[-8])&IF(RC[-7]="",,"|n"&R1C28&RC[-7])&IF(RC[-6]="",,"|n"&R1C29&RC[-6])&IF(RC[-2]="",,"|n"&RC[-2]) -> 
AI540: =IF(RC[-27]&RC[-26]&RC[-25]&RC[-24]&RC[-23]&RC[-22]="",,R1C7)&IF(RC[-27]="",,"|n"&R1C8&RC[-27])&IF(RC[-26]="",,"|n"&R1C9&RC[-26])&IF(RC[-25]="",,"|n"&R1C10&RC[-25])&IF(RC[-24]="",,"|n"&R1C11&RC[-24])&IF(RC[-23]="",,"|n"&R1C12&RC[-23])&IF(RC[-22]="",,"|n"&R1C13&RC[-22])&IF(RC[-20]&RC[-19]&RC[-18]&RC[-17]="",,"|n"&R1C14)&IF(RC[-20]="",,"|n"&R1C15&RC[-20])&IF(RC[-19]="",,"|n"&R1C16&RC[-19])&IF(RC[-18]="",,"|n"&R1C17&RC[-18])&IF(RC[-17]="",,"|n"&R1C18&RC[-17])&IF(RC[-16]="",,"|n"&R1C19&RC[-16])&IF(RC[-15]="",,"|n"&R1C20&RC[-15])&IF(RC[-14]="",,"|n"&R1C21&RC[-14])&IF(RC[-13]="",,"|n"&R1C22&RC[-13])&IF(RC[-11]="",,"|n"&R1C24&RC[-11])&IF(RC[-10]="",,"|n"&R1C25&RC[-10])&IF(RC[-9]="",,"|n"&R1C26&RC[-9])&IF(RC[-8]="",,"|n"&R1C27&RC[-8])&IF(RC[-7]="",,"|n"&R1C28&RC[-7])&IF(RC[-6]="",,"|n"&R1C29&RC[-6])&IF(RC[-2]="",,"|n"&RC[-2]) -> 
AI541: =IF(RC[-27]&RC[-26]&RC[-25]&RC[-24]&RC[-23]&RC[-22]="",,R1C7)&IF(RC[-27]="",,"|n"&R1C8&RC[-27])&IF(RC[-26]="",,"|n"&R1C9&RC[-26])&IF(RC[-25]="",,"|n"&R1C10&RC[-25])&IF(RC[-24]="",,"|n"&R1C11&RC[-24])&IF(RC[-23]="",,"|n"&R1C12&RC[-23])&IF(RC[-22]="",,"|n"&R1C13&RC[-22])&IF(RC[-20]&RC[-19]&RC[-18]&RC[-17]="",,"|n"&R1C14)&IF(RC[-20]="",,"|n"&R1C15&RC[-20])&IF(RC[-19]="",,"|n"&R1C16&RC[-19])&IF(RC[-18]="",,"|n"&R1C17&RC[-18])&IF(RC[-17]="",,"|n"&R1C18&RC[-17])&IF(RC[-16]="",,"|n"&R1C19&RC[-16])&IF(RC[-15]="",,"|n"&R1C20&RC[-15])&IF(RC[-14]="",,"|n"&R1C21&RC[-14])&IF(RC[-13]="",,"|n"&R1C22&RC[-13])&IF(RC[-11]="",,"|n"&R1C24&RC[-11])&IF(RC[-10]="",,"|n"&R1C25&RC[-10])&IF(RC[-9]="",,"|n"&R1C26&RC[-9])&IF(RC[-8]="",,"|n"&R1C27&RC[-8])&IF(RC[-7]="",,"|n"&R1C28&RC[-7])&IF(RC[-6]="",,"|n"&R1C29&RC[-6])&IF(RC[-2]="",,"|n"&RC[-2]) -> 
AI542: =IF(RC[-27]&RC[-26]&RC[-25]&RC[-24]&RC[-23]&RC[-22]="",,R1C7)&IF(RC[-27]="",,"|n"&R1C8&RC[-27])&IF(RC[-26]="",,"|n"&R1C9&RC[-26])&IF(RC[-25]="",,"|n"&R1C10&RC[-25])&IF(RC[-24]="",,"|n"&R1C11&RC[-24])&IF(RC[-23]="",,"|n"&R1C12&RC[-23])&IF(RC[-22]="",,"|n"&R1C13&RC[-22])&IF(RC[-20]&RC[-19]&RC[-18]&RC[-17]="",,"|n"&R1C14)&IF(RC[-20]="",,"|n"&R1C15&RC[-20])&IF(RC[-19]="",,"|n"&R1C16&RC[-19])&IF(RC[-18]="",,"|n"&R1C17&RC[-18])&IF(RC[-17]="",,"|n"&R1C18&RC[-17])&IF(RC[-16]="",,"|n"&R1C19&RC[-16])&IF(RC[-15]="",,"|n"&R1C20&RC[-15])&IF(RC[-14]="",,"|n"&R1C21&RC[-14])&IF(RC[-13]="",,"|n"&R1C22&RC[-13])&IF(RC[-11]="",,"|n"&R1C24&RC[-11])&IF(RC[-10]="",,"|n"&R1C25&RC[-10])&IF(RC[-9]="",,"|n"&R1C26&RC[-9])&IF(RC[-8]="",,"|n"&R1C27&RC[-8])&IF(RC[-7]="",,"|n"&R1C28&RC[-7])&IF(RC[-6]="",,"|n"&R1C29&RC[-6])&IF(RC[-2]="",,"|n"&RC[-2]) -> 
AI543: =IF(RC[-27]&RC[-26]&RC[-25]&RC[-24]&RC[-23]&RC[-22]="",,R1C7)&IF(RC[-27]="",,"|n"&R1C8&RC[-27])&IF(RC[-26]="",,"|n"&R1C9&RC[-26])&IF(RC[-25]="",,"|n"&R1C10&RC[-25])&IF(RC[-24]="",,"|n"&R1C11&RC[-24])&IF(RC[-23]="",,"|n"&R1C12&RC[-23])&IF(RC[-22]="",,"|n"&R1C13&RC[-22])&IF(RC[-20]&RC[-19]&RC[-18]&RC[-17]="",,"|n"&R1C14)&IF(RC[-20]="",,"|n"&R1C15&RC[-20])&IF(RC[-19]="",,"|n"&R1C16&RC[-19])&IF(RC[-18]="",,"|n"&R1C17&RC[-18])&IF(RC[-17]="",,"|n"&R1C18&RC[-17])&IF(RC[-16]="",,"|n"&R1C19&RC[-16])&IF(RC[-15]="",,"|n"&R1C20&RC[-15])&IF(RC[-14]="",,"|n"&R1C21&RC[-14])&IF(RC[-13]="",,"|n"&R1C22&RC[-13])&IF(RC[-11]="",,"|n"&R1C24&RC[-11])&IF(RC[-10]="",,"|n"&R1C25&RC[-10])&IF(RC[-9]="",,"|n"&R1C26&RC[-9])&IF(RC[-8]="",,"|n"&R1C27&RC[-8])&IF(RC[-7]="",,"|n"&R1C28&RC[-7])&IF(RC[-6]="",,"|n"&R1C29&RC[-6])&IF(RC[-2]="",,"|n"&RC[-2]) -> 
AI544: =IF(RC[-27]&RC[-26]&RC[-25]&RC[-24]&RC[-23]&RC[-22]="",,R1C7)&IF(RC[-27]="",,"|n"&R1C8&RC[-27])&IF(RC[-26]="",,"|n"&R1C9&RC[-26])&IF(RC[-25]="",,"|n"&R1C10&RC[-25])&IF(RC[-24]="",,"|n"&R1C11&RC[-24])&IF(RC[-23]="",,"|n"&R1C12&RC[-23])&IF(RC[-22]="",,"|n"&R1C13&RC[-22])&IF(RC[-20]&RC[-19]&RC[-18]&RC[-17]="",,"|n"&R1C14)&IF(RC[-20]="",,"|n"&R1C15&RC[-20])&IF(RC[-19]="",,"|n"&R1C16&RC[-19])&IF(RC[-18]="",,"|n"&R1C17&RC[-18])&IF(RC[-17]="",,"|n"&R1C18&RC[-17])&IF(RC[-16]="",,"|n"&R1C19&RC[-16])&IF(RC[-15]="",,"|n"&R1C20&RC[-15])&IF(RC[-14]="",,"|n"&R1C21&RC[-14])&IF(RC[-13]="",,"|n"&R1C22&RC[-13])&IF(RC[-11]="",,"|n"&R1C24&RC[-11])&IF(RC[-10]="",,"|n"&R1C25&RC[-10])&IF(RC[-9]="",,"|n"&R1C26&RC[-9])&IF(RC[-8]="",,"|n"&R1C27&RC[-8])&IF(RC[-7]="",,"|n"&R1C28&RC[-7])&IF(RC[-6]="",,"|n"&R1C29&RC[-6])&IF(RC[-2]="",,"|n"&RC[-2]) -> 
AI545: =IF(RC[-27]&RC[-26]&RC[-25]&RC[-24]&RC[-23]&RC[-22]="",,R1C7)&IF(RC[-27]="",,"|n"&R1C8&RC[-27])&IF(RC[-26]="",,"|n"&R1C9&RC[-26])&IF(RC[-25]="",,"|n"&R1C10&RC[-25])&IF(RC[-24]="",,"|n"&R1C11&RC[-24])&IF(RC[-23]="",,"|n"&R1C12&RC[-23])&IF(RC[-22]="",,"|n"&R1C13&RC[-22])&IF(RC[-20]&RC[-19]&RC[-18]&RC[-17]="",,"|n"&R1C14)&IF(RC[-20]="",,"|n"&R1C15&RC[-20])&IF(RC[-19]="",,"|n"&R1C16&RC[-19])&IF(RC[-18]="",,"|n"&R1C17&RC[-18])&IF(RC[-17]="",,"|n"&R1C18&RC[-17])&IF(RC[-16]="",,"|n"&R1C19&RC[-16])&IF(RC[-15]="",,"|n"&R1C20&RC[-15])&IF(RC[-14]="",,"|n"&R1C21&RC[-14])&IF(RC[-13]="",,"|n"&R1C22&RC[-13])&IF(RC[-11]="",,"|n"&R1C24&RC[-11])&IF(RC[-10]="",,"|n"&R1C25&RC[-10])&IF(RC[-9]="",,"|n"&R1C26&RC[-9])&IF(RC[-8]="",,"|n"&R1C27&RC[-8])&IF(RC[-7]="",,"|n"&R1C28&RC[-7])&IF(RC[-6]="",,"|n"&R1C29&RC[-6])&IF(RC[-2]="",,"|n"&RC[-2]) -> 
AI546: =IF(RC[-27]&RC[-26]&RC[-25]&RC[-24]&RC[-23]&RC[-22]="",,R1C7)&IF(RC[-27]="",,"|n"&R1C8&RC[-27])&IF(RC[-26]="",,"|n"&R1C9&RC[-26])&IF(RC[-25]="",,"|n"&R1C10&RC[-25])&IF(RC[-24]="",,"|n"&R1C11&RC[-24])&IF(RC[-23]="",,"|n"&R1C12&RC[-23])&IF(RC[-22]="",,"|n"&R1C13&RC[-22])&IF(RC[-20]&RC[-19]&RC[-18]&RC[-17]="",,"|n"&R1C14)&IF(RC[-20]="",,"|n"&R1C15&RC[-20])&IF(RC[-19]="",,"|n"&R1C16&RC[-19])&IF(RC[-18]="",,"|n"&R1C17&RC[-18])&IF(RC[-17]="",,"|n"&R1C18&RC[-17])&IF(RC[-16]="",,"|n"&R1C19&RC[-16])&IF(RC[-15]="",,"|n"&R1C20&RC[-15])&IF(RC[-14]="",,"|n"&R1C21&RC[-14])&IF(RC[-13]="",,"|n"&R1C22&RC[-13])&IF(RC[-11]="",,"|n"&R1C24&RC[-11])&IF(RC[-10]="",,"|n"&R1C25&RC[-10])&IF(RC[-9]="",,"|n"&R1C26&RC[-9])&IF(RC[-8]="",,"|n"&R1C27&RC[-8])&IF(RC[-7]="",,"|n"&R1C28&RC[-7])&IF(RC[-6]="",,"|n"&R1C29&RC[-6])&IF(RC[-2]="",,"|n"&RC[-2]) -> 
AI547: =IF(RC[-27]&RC[-26]&RC[-25]&RC[-24]&RC[-23]&RC[-22]="",,R1C7)&IF(RC[-27]="",,"|n"&R1C8&RC[-27])&IF(RC[-26]="",,"|n"&R1C9&RC[-26])&IF(RC[-25]="",,"|n"&R1C10&RC[-25])&IF(RC[-24]="",,"|n"&R1C11&RC[-24])&IF(RC[-23]="",,"|n"&R1C12&RC[-23])&IF(RC[-22]="",,"|n"&R1C13&RC[-22])&IF(RC[-20]&RC[-19]&RC[-18]&RC[-17]="",,"|n"&R1C14)&IF(RC[-20]="",,"|n"&R1C15&RC[-20])&IF(RC[-19]="",,"|n"&R1C16&RC[-19])&IF(RC[-18]="",,"|n"&R1C17&RC[-18])&IF(RC[-17]="",,"|n"&R1C18&RC[-17])&IF(RC[-16]="",,"|n"&R1C19&RC[-16])&IF(RC[-15]="",,"|n"&R1C20&RC[-15])&IF(RC[-14]="",,"|n"&R1C21&RC[-14])&IF(RC[-13]="",,"|n"&R1C22&RC[-13])&IF(RC[-11]="",,"|n"&R1C24&RC[-11])&IF(RC[-10]="",,"|n"&R1C25&RC[-10])&IF(RC[-9]="",,"|n"&R1C26&RC[-9])&IF(RC[-8]="",,"|n"&R1C27&RC[-8])&IF(RC[-7]="",,"|n"&R1C28&RC[-7])&IF(RC[-6]="",,"|n"&R1C29&RC[-6])&IF(RC[-2]="",,"|n"&RC[-2]) -> 
AI548: =IF(RC[-27]&RC[-26]&RC[-25]&RC[-24]&RC[-23]&RC[-22]="",,R1C7)&IF(RC[-27]="",,"|n"&R1C8&RC[-27])&IF(RC[-26]="",,"|n"&R1C9&RC[-26])&IF(RC[-25]="",,"|n"&R1C10&RC[-25])&IF(RC[-24]="",,"|n"&R1C11&RC[-24])&IF(RC[-23]="",,"|n"&R1C12&RC[-23])&IF(RC[-22]="",,"|n"&R1C13&RC[-22])&IF(RC[-20]&RC[-19]&RC[-18]&RC[-17]="",,"|n"&R1C14)&IF(RC[-20]="",,"|n"&R1C15&RC[-20])&IF(RC[-19]="",,"|n"&R1C16&RC[-19])&IF(RC[-18]="",,"|n"&R1C17&RC[-18])&IF(RC[-17]="",,"|n"&R1C18&RC[-17])&IF(RC[-16]="",,"|n"&R1C19&RC[-16])&IF(RC[-15]="",,"|n"&R1C20&RC[-15])&IF(RC[-14]="",,"|n"&R1C21&RC[-14])&IF(RC[-13]="",,"|n"&R1C22&RC[-13])&IF(RC[-11]="",,"|n"&R1C24&RC[-11])&IF(RC[-10]="",,"|n"&R1C25&RC[-10])&IF(RC[-9]="",,"|n"&R1C26&RC[-9])&IF(RC[-8]="",,"|n"&R1C27&RC[-8])&IF(RC[-7]="",,"|n"&R1C28&RC[-7])&IF(RC[-6]="",,"|n"&R1C29&RC[-6])&IF(RC[-2]="",,"|n"&RC[-2]) -> 
AI549: =IF(RC[-27]&RC[-26]&RC[-25]&RC[-24]&RC[-23]&RC[-22]="",,R1C7)&IF(RC[-27]="",,"|n"&R1C8&RC[-27])&IF(RC[-26]="",,"|n"&R1C9&RC[-26])&IF(RC[-25]="",,"|n"&R1C10&RC[-25])&IF(RC[-24]="",,"|n"&R1C11&RC[-24])&IF(RC[-23]="",,"|n"&R1C12&RC[-23])&IF(RC[-22]="",,"|n"&R1C13&RC[-22])&IF(RC[-20]&RC[-19]&RC[-18]&RC[-17]="",,"|n"&R1C14)&IF(RC[-20]="",,"|n"&R1C15&RC[-20])&IF(RC[-19]="",,"|n"&R1C16&RC[-19])&IF(RC[-18]="",,"|n"&R1C17&RC[-18])&IF(RC[-17]="",,"|n"&R1C18&RC[-17])&IF(RC[-16]="",,"|n"&R1C19&RC[-16])&IF(RC[-15]="",,"|n"&R1C20&RC[-15])&IF(RC[-14]="",,"|n"&R1C21&RC[-14])&IF(RC[-13]="",,"|n"&R1C22&RC[-13])&IF(RC[-11]="",,"|n"&R1C24&RC[-11])&IF(RC[-10]="",,"|n"&R1C25&RC[-10])&IF(RC[-9]="",,"|n"&R1C26&RC[-9])&IF(RC[-8]="",,"|n"&R1C27&RC[-8])&IF(RC[-7]="",,"|n"&R1C28&RC[-7])&IF(RC[-6]="",,"|n"&R1C29&RC[-6])&IF(RC[-2]="",,"|n"&RC[-2]) -> 
AI550: =IF(RC[-27]&RC[-26]&RC[-25]&RC[-24]&RC[-23]&RC[-22]="",,R1C7)&IF(RC[-27]="",,"|n"&R1C8&RC[-27])&IF(RC[-26]="",,"|n"&R1C9&RC[-26])&IF(RC[-25]="",,"|n"&R1C10&RC[-25])&IF(RC[-24]="",,"|n"&R1C11&RC[-24])&IF(RC[-23]="",,"|n"&R1C12&RC[-23])&IF(RC[-22]="",,"|n"&R1C13&RC[-22])&IF(RC[-20]&RC[-19]&RC[-18]&RC[-17]="",,"|n"&R1C14)&IF(RC[-20]="",,"|n"&R1C15&RC[-20])&IF(RC[-19]="",,"|n"&R1C16&RC[-19])&IF(RC[-18]="",,"|n"&R1C17&RC[-18])&IF(RC[-17]="",,"|n"&R1C18&RC[-17])&IF(RC[-16]="",,"|n"&R1C19&RC[-16])&IF(RC[-15]="",,"|n"&R1C20&RC[-15])&IF(RC[-14]="",,"|n"&R1C21&RC[-14])&IF(RC[-13]="",,"|n"&R1C22&RC[-13])&IF(RC[-11]="",,"|n"&R1C24&RC[-11])&IF(RC[-10]="",,"|n"&R1C25&RC[-10])&IF(RC[-9]="",,"|n"&R1C26&RC[-9])&IF(RC[-8]="",,"|n"&R1C27&RC[-8])&IF(RC[-7]="",,"|n"&R1C28&RC[-7])&IF(RC[-6]="",,"|n"&R1C29&RC[-6])&IF(RC[-2]="",,"|n"&RC[-2]) -> 
AI551: =IF(RC[-27]&RC[-26]&RC[-25]&RC[-24]&RC[-23]&RC[-22]="",,R1C7)&IF(RC[-27]="",,"|n"&R1C8&RC[-27])&IF(RC[-26]="",,"|n"&R1C9&RC[-26])&IF(RC[-25]="",,"|n"&R1C10&RC[-25])&IF(RC[-24]="",,"|n"&R1C11&RC[-24])&IF(RC[-23]="",,"|n"&R1C12&RC[-23])&IF(RC[-22]="",,"|n"&R1C13&RC[-22])&IF(RC[-20]&RC[-19]&RC[-18]&RC[-17]="",,"|n"&R1C14)&IF(RC[-20]="",,"|n"&R1C15&RC[-20])&IF(RC[-19]="",,"|n"&R1C16&RC[-19])&IF(RC[-18]="",,"|n"&R1C17&RC[-18])&IF(RC[-17]="",,"|n"&R1C18&RC[-17])&IF(RC[-16]="",,"|n"&R1C19&RC[-16])&IF(RC[-15]="",,"|n"&R1C20&RC[-15])&IF(RC[-14]="",,"|n"&R1C21&RC[-14])&IF(RC[-13]="",,"|n"&R1C22&RC[-13])&IF(RC[-11]="",,"|n"&R1C24&RC[-11])&IF(RC[-10]="",,"|n"&R1C25&RC[-10])&IF(RC[-9]="",,"|n"&R1C26&RC[-9])&IF(RC[-8]="",,"|n"&R1C27&RC[-8])&IF(RC[-7]="",,"|n"&R1C28&RC[-7])&IF(RC[-6]="",,"|n"&R1C29&RC[-6])&IF(RC[-2]="",,"|n"&RC[-2]) -> 
AI552: =IF(RC[-27]&RC[-26]&RC[-25]&RC[-24]&RC[-23]&RC[-22]="",,R1C7)&IF(RC[-27]="",,"|n"&R1C8&RC[-27])&IF(RC[-26]="",,"|n"&R1C9&RC[-26])&IF(RC[-25]="",,"|n"&R1C10&RC[-25])&IF(RC[-24]="",,"|n"&R1C11&RC[-24])&IF(RC[-23]="",,"|n"&R1C12&RC[-23])&IF(RC[-22]="",,"|n"&R1C13&RC[-22])&IF(RC[-20]&RC[-19]&RC[-18]&RC[-17]="",,"|n"&R1C14)&IF(RC[-20]="",,"|n"&R1C15&RC[-20])&IF(RC[-19]="",,"|n"&R1C16&RC[-19])&IF(RC[-18]="",,"|n"&R1C17&RC[-18])&IF(RC[-17]="",,"|n"&R1C18&RC[-17])&IF(RC[-16]="",,"|n"&R1C19&RC[-16])&IF(RC[-15]="",,"|n"&R1C20&RC[-15])&IF(RC[-14]="",,"|n"&R1C21&RC[-14])&IF(RC[-13]="",,"|n"&R1C22&RC[-13])&IF(RC[-11]="",,"|n"&R1C24&RC[-11])&IF(RC[-10]="",,"|n"&R1C25&RC[-10])&IF(RC[-9]="",,"|n"&R1C26&RC[-9])&IF(RC[-8]="",,"|n"&R1C27&RC[-8])&IF(RC[-7]="",,"|n"&R1C28&RC[-7])&IF(RC[-6]="",,"|n"&R1C29&RC[-6])&IF(RC[-2]="",,"|n"&RC[-2]) -> 
AI553: =IF(RC[-27]&RC[-26]&RC[-25]&RC[-24]&RC[-23]&RC[-22]="",,R1C7)&IF(RC[-27]="",,"|n"&R1C8&RC[-27])&IF(RC[-26]="",,"|n"&R1C9&RC[-26])&IF(RC[-25]="",,"|n"&R1C10&RC[-25])&IF(RC[-24]="",,"|n"&R1C11&RC[-24])&IF(RC[-23]="",,"|n"&R1C12&RC[-23])&IF(RC[-22]="",,"|n"&R1C13&RC[-22])&IF(RC[-20]&RC[-19]&RC[-18]&RC[-17]="",,"|n"&R1C14)&IF(RC[-20]="",,"|n"&R1C15&RC[-20])&IF(RC[-19]="",,"|n"&R1C16&RC[-19])&IF(RC[-18]="",,"|n"&R1C17&RC[-18])&IF(RC[-17]="",,"|n"&R1C18&RC[-17])&IF(RC[-16]="",,"|n"&R1C19&RC[-16])&IF(RC[-15]="",,"|n"&R1C20&RC[-15])&IF(RC[-14]="",,"|n"&R1C21&RC[-14])&IF(RC[-13]="",,"|n"&R1C22&RC[-13])&IF(RC[-11]="",,"|n"&R1C24&RC[-11])&IF(RC[-10]="",,"|n"&R1C25&RC[-10])&IF(RC[-9]="",,"|n"&R1C26&RC[-9])&IF(RC[-8]="",,"|n"&R1C27&RC[-8])&IF(RC[-7]="",,"|n"&R1C28&RC[-7])&IF(RC[-6]="",,"|n"&R1C29&RC[-6])&IF(RC[-2]="",,"|n"&RC[-2]) -> 
AI554: =IF(RC[-27]&RC[-26]&RC[-25]&RC[-24]&RC[-23]&RC[-22]="",,R1C7)&IF(RC[-27]="",,"|n"&R1C8&RC[-27])&IF(RC[-26]="",,"|n"&R1C9&RC[-26])&IF(RC[-25]="",,"|n"&R1C10&RC[-25])&IF(RC[-24]="",,"|n"&R1C11&RC[-24])&IF(RC[-23]="",,"|n"&R1C12&RC[-23])&IF(RC[-22]="",,"|n"&R1C13&RC[-22])&IF(RC[-20]&RC[-19]&RC[-18]&RC[-17]="",,"|n"&R1C14)&IF(RC[-20]="",,"|n"&R1C15&RC[-20])&IF(RC[-19]="",,"|n"&R1C16&RC[-19])&IF(RC[-18]="",,"|n"&R1C17&RC[-18])&IF(RC[-17]="",,"|n"&R1C18&RC[-17])&IF(RC[-16]="",,"|n"&R1C19&RC[-16])&IF(RC[-15]="",,"|n"&R1C20&RC[-15])&IF(RC[-14]="",,"|n"&R1C21&RC[-14])&IF(RC[-13]="",,"|n"&R1C22&RC[-13])&IF(RC[-11]="",,"|n"&R1C24&RC[-11])&IF(RC[-10]="",,"|n"&R1C25&RC[-10])&IF(RC[-9]="",,"|n"&R1C26&RC[-9])&IF(RC[-8]="",,"|n"&R1C27&RC[-8])&IF(RC[-7]="",,"|n"&R1C28&RC[-7])&IF(RC[-6]="",,"|n"&R1C29&RC[-6])&IF(RC[-2]="",,"|n"&RC[-2]) -> 
AI555: =IF(RC[-27]&RC[-26]&RC[-25]&RC[-24]&RC[-23]&RC[-22]="",,R1C7)&IF(RC[-27]="",,"|n"&R1C8&RC[-27])&IF(RC[-26]="",,"|n"&R1C9&RC[-26])&IF(RC[-25]="",,"|n"&R1C10&RC[-25])&IF(RC[-24]="",,"|n"&R1C11&RC[-24])&IF(RC[-23]="",,"|n"&R1C12&RC[-23])&IF(RC[-22]="",,"|n"&R1C13&RC[-22])&IF(RC[-20]&RC[-19]&RC[-18]&RC[-17]="",,"|n"&R1C14)&IF(RC[-20]="",,"|n"&R1C15&RC[-20])&IF(RC[-19]="",,"|n"&R1C16&RC[-19])&IF(RC[-18]="",,"|n"&R1C17&RC[-18])&IF(RC[-17]="",,"|n"&R1C18&RC[-17])&IF(RC[-16]="",,"|n"&R1C19&RC[-16])&IF(RC[-15]="",,"|n"&R1C20&RC[-15])&IF(RC[-14]="",,"|n"&R1C21&RC[-14])&IF(RC[-13]="",,"|n"&R1C22&RC[-13])&IF(RC[-11]="",,"|n"&R1C24&RC[-11])&IF(RC[-10]="",,"|n"&R1C25&RC[-10])&IF(RC[-9]="",,"|n"&R1C26&RC[-9])&IF(RC[-8]="",,"|n"&R1C27&RC[-8])&IF(RC[-7]="",,"|n"&R1C28&RC[-7])&IF(RC[-6]="",,"|n"&R1C29&RC[-6])&IF(RC[-2]="",,"|n"&RC[-2]) -> 
AI556: =IF(RC[-27]&RC[-26]&RC[-25]&RC[-24]&RC[-23]&RC[-22]="",,R1C7)&IF(RC[-27]="",,"|n"&R1C8&RC[-27])&IF(RC[-26]="",,"|n"&R1C9&RC[-26])&IF(RC[-25]="",,"|n"&R1C10&RC[-25])&IF(RC[-24]="",,"|n"&R1C11&RC[-24])&IF(RC[-23]="",,"|n"&R1C12&RC[-23])&IF(RC[-22]="",,"|n"&R1C13&RC[-22])&IF(RC[-20]&RC[-19]&RC[-18]&RC[-17]="",,"|n"&R1C14)&IF(RC[-20]="",,"|n"&R1C15&RC[-20])&IF(RC[-19]="",,"|n"&R1C16&RC[-19])&IF(RC[-18]="",,"|n"&R1C17&RC[-18])&IF(RC[-17]="",,"|n"&R1C18&RC[-17])&IF(RC[-16]="",,"|n"&R1C19&RC[-16])&IF(RC[-15]="",,"|n"&R1C20&RC[-15])&IF(RC[-14]="",,"|n"&R1C21&RC[-14])&IF(RC[-13]="",,"|n"&R1C22&RC[-13])&IF(RC[-11]="",,"|n"&R1C24&RC[-11])&IF(RC[-10]="",,"|n"&R1C25&RC[-10])&IF(RC[-9]="",,"|n"&R1C26&RC[-9])&IF(RC[-8]="",,"|n"&R1C27&RC[-8])&IF(RC[-7]="",,"|n"&R1C28&RC[-7])&IF(RC[-6]="",,"|n"&R1C29&RC[-6])&IF(RC[-2]="",,"|n"&RC[-2]) -> 
AI557: =IF(RC[-27]&RC[-26]&RC[-25]&RC[-24]&RC[-23]&RC[-22]="",,R1C7)&IF(RC[-27]="",,"|n"&R1C8&RC[-27])&IF(RC[-26]="",,"|n"&R1C9&RC[-26])&IF(RC[-25]="",,"|n"&R1C10&RC[-25])&IF(RC[-24]="",,"|n"&R1C11&RC[-24])&IF(RC[-23]="",,"|n"&R1C12&RC[-23])&IF(RC[-22]="",,"|n"&R1C13&RC[-22])&IF(RC[-20]&RC[-19]&RC[-18]&RC[-17]="",,"|n"&R1C14)&IF(RC[-20]="",,"|n"&R1C15&RC[-20])&IF(RC[-19]="",,"|n"&R1C16&RC[-19])&IF(RC[-18]="",,"|n"&R1C17&RC[-18])&IF(RC[-17]="",,"|n"&R1C18&RC[-17])&IF(RC[-16]="",,"|n"&R1C19&RC[-16])&IF(RC[-15]="",,"|n"&R1C20&RC[-15])&IF(RC[-14]="",,"|n"&R1C21&RC[-14])&IF(RC[-13]="",,"|n"&R1C22&RC[-13])&IF(RC[-11]="",,"|n"&R1C24&RC[-11])&IF(RC[-10]="",,"|n"&R1C25&RC[-10])&IF(RC[-9]="",,"|n"&R1C26&RC[-9])&IF(RC[-8]="",,"|n"&R1C27&RC[-8])&IF(RC[-7]="",,"|n"&R1C28&RC[-7])&IF(RC[-6]="",,"|n"&R1C29&RC[-6])&IF(RC[-2]="",,"|n"&RC[-2]) -> 
AI558: =IF(RC[-27]&RC[-26]&RC[-25]&RC[-24]&RC[-23]&RC[-22]="",,R1C7)&IF(RC[-27]="",,"|n"&R1C8&RC[-27])&IF(RC[-26]="",,"|n"&R1C9&RC[-26])&IF(RC[-25]="",,"|n"&R1C10&RC[-25])&IF(RC[-24]="",,"|n"&R1C11&RC[-24])&IF(RC[-23]="",,"|n"&R1C12&RC[-23])&IF(RC[-22]="",,"|n"&R1C13&RC[-22])&IF(RC[-20]&RC[-19]&RC[-18]&RC[-17]="",,"|n"&R1C14)&IF(RC[-20]="",,"|n"&R1C15&RC[-20])&IF(RC[-19]="",,"|n"&R1C16&RC[-19])&IF(RC[-18]="",,"|n"&R1C17&RC[-18])&IF(RC[-17]="",,"|n"&R1C18&RC[-17])&IF(RC[-16]="",,"|n"&R1C19&RC[-16])&IF(RC[-15]="",,"|n"&R1C20&RC[-15])&IF(RC[-14]="",,"|n"&R1C21&RC[-14])&IF(RC[-13]="",,"|n"&R1C22&RC[-13])&IF(RC[-11]="",,"|n"&R1C24&RC[-11])&IF(RC[-10]="",,"|n"&R1C25&RC[-10])&IF(RC[-9]="",,"|n"&R1C26&RC[-9])&IF(RC[-8]="",,"|n"&R1C27&RC[-8])&IF(RC[-7]="",,"|n"&R1C28&RC[-7])&IF(RC[-6]="",,"|n"&R1C29&RC[-6])&IF(RC[-2]="",,"|n"&RC[-2]) -> 
AI559: =IF(RC[-27]&RC[-26]&RC[-25]&RC[-24]&RC[-23]&RC[-22]="",,R1C7)&IF(RC[-27]="",,"|n"&R1C8&RC[-27])&IF(RC[-26]="",,"|n"&R1C9&RC[-26])&IF(RC[-25]="",,"|n"&R1C10&RC[-25])&IF(RC[-24]="",,"|n"&R1C11&RC[-24])&IF(RC[-23]="",,"|n"&R1C12&RC[-23])&IF(RC[-22]="",,"|n"&R1C13&RC[-22])&IF(RC[-20]&RC[-19]&RC[-18]&RC[-17]="",,"|n"&R1C14)&IF(RC[-20]="",,"|n"&R1C15&RC[-20])&IF(RC[-19]="",,"|n"&R1C16&RC[-19])&IF(RC[-18]="",,"|n"&R1C17&RC[-18])&IF(RC[-17]="",,"|n"&R1C18&RC[-17])&IF(RC[-16]="",,"|n"&R1C19&RC[-16])&IF(RC[-15]="",,"|n"&R1C20&RC[-15])&IF(RC[-14]="",,"|n"&R1C21&RC[-14])&IF(RC[-13]="",,"|n"&R1C22&RC[-13])&IF(RC[-11]="",,"|n"&R1C24&RC[-11])&IF(RC[-10]="",,"|n"&R1C25&RC[-10])&IF(RC[-9]="",,"|n"&R1C26&RC[-9])&IF(RC[-8]="",,"|n"&R1C27&RC[-8])&IF(RC[-7]="",,"|n"&R1C28&RC[-7])&IF(RC[-6]="",,"|n"&R1C29&RC[-6])&IF(RC[-2]="",,"|n"&RC[-2]) -> 
AI560: =IF(RC[-27]&RC[-26]&RC[-25]&RC[-24]&RC[-23]&RC[-22]="",,R1C7)&IF(RC[-27]="",,"|n"&R1C8&RC[-27])&IF(RC[-26]="",,"|n"&R1C9&RC[-26])&IF(RC[-25]="",,"|n"&R1C10&RC[-25])&IF(RC[-24]="",,"|n"&R1C11&RC[-24])&IF(RC[-23]="",,"|n"&R1C12&RC[-23])&IF(RC[-22]="",,"|n"&R1C13&RC[-22])&IF(RC[-20]&RC[-19]&RC[-18]&RC[-17]="",,"|n"&R1C14)&IF(RC[-20]="",,"|n"&R1C15&RC[-20])&IF(RC[-19]="",,"|n"&R1C16&RC[-19])&IF(RC[-18]="",,"|n"&R1C17&RC[-18])&IF(RC[-17]="",,"|n"&R1C18&RC[-17])&IF(RC[-16]="",,"|n"&R1C19&RC[-16])&IF(RC[-15]="",,"|n"&R1C20&RC[-15])&IF(RC[-14]="",,"|n"&R1C21&RC[-14])&IF(RC[-13]="",,"|n"&R1C22&RC[-13])&IF(RC[-11]="",,"|n"&R1C24&RC[-11])&IF(RC[-10]="",,"|n"&R1C25&RC[-10])&IF(RC[-9]="",,"|n"&R1C26&RC[-9])&IF(RC[-8]="",,"|n"&R1C27&RC[-8])&IF(RC[-7]="",,"|n"&R1C28&RC[-7])&IF(RC[-6]="",,"|n"&R1C29&RC[-6])&IF(RC[-2]="",,"|n"&RC[-2]) -> 
AI561: =IF(RC[-27]&RC[-26]&RC[-25]&RC[-24]&RC[-23]&RC[-22]="",,R1C7)&IF(RC[-27]="",,"|n"&R1C8&RC[-27])&IF(RC[-26]="",,"|n"&R1C9&RC[-26])&IF(RC[-25]="",,"|n"&R1C10&RC[-25])&IF(RC[-24]="",,"|n"&R1C11&RC[-24])&IF(RC[-23]="",,"|n"&R1C12&RC[-23])&IF(RC[-22]="",,"|n"&R1C13&RC[-22])&IF(RC[-20]&RC[-19]&RC[-18]&RC[-17]="",,"|n"&R1C14)&IF(RC[-20]="",,"|n"&R1C15&RC[-20])&IF(RC[-19]="",,"|n"&R1C16&RC[-19])&IF(RC[-18]="",,"|n"&R1C17&RC[-18])&IF(RC[-17]="",,"|n"&R1C18&RC[-17])&IF(RC[-16]="",,"|n"&R1C19&RC[-16])&IF(RC[-15]="",,"|n"&R1C20&RC[-15])&IF(RC[-14]="",,"|n"&R1C21&RC[-14])&IF(RC[-13]="",,"|n"&R1C22&RC[-13])&IF(RC[-11]="",,"|n"&R1C24&RC[-11])&IF(RC[-10]="",,"|n"&R1C25&RC[-10])&IF(RC[-9]="",,"|n"&R1C26&RC[-9])&IF(RC[-8]="",,"|n"&R1C27&RC[-8])&IF(RC[-7]="",,"|n"&R1C28&RC[-7])&IF(RC[-6]="",,"|n"&R1C29&RC[-6])&IF(RC[-2]="",,"|n"&RC[-2]) -> 
AI562: =IF(RC[-27]&RC[-26]&RC[-25]&RC[-24]&RC[-23]&RC[-22]="",,R1C7)&IF(RC[-27]="",,"|n"&R1C8&RC[-27])&IF(RC[-26]="",,"|n"&R1C9&RC[-26])&IF(RC[-25]="",,"|n"&R1C10&RC[-25])&IF(RC[-24]="",,"|n"&R1C11&RC[-24])&IF(RC[-23]="",,"|n"&R1C12&RC[-23])&IF(RC[-22]="",,"|n"&R1C13&RC[-22])&IF(RC[-20]&RC[-19]&RC[-18]&RC[-17]="",,"|n"&R1C14)&IF(RC[-20]="",,"|n"&R1C15&RC[-20])&IF(RC[-19]="",,"|n"&R1C16&RC[-19])&IF(RC[-18]="",,"|n"&R1C17&RC[-18])&IF(RC[-17]="",,"|n"&R1C18&RC[-17])&IF(RC[-16]="",,"|n"&R1C19&RC[-16])&IF(RC[-15]="",,"|n"&R1C20&RC[-15])&IF(RC[-14]="",,"|n"&R1C21&RC[-14])&IF(RC[-13]="",,"|n"&R1C22&RC[-13])&IF(RC[-11]="",,"|n"&R1C24&RC[-11])&IF(RC[-10]="",,"|n"&R1C25&RC[-10])&IF(RC[-9]="",,"|n"&R1C26&RC[-9])&IF(RC[-8]="",,"|n"&R1C27&RC[-8])&IF(RC[-7]="",,"|n"&R1C28&RC[-7])&IF(RC[-6]="",,"|n"&R1C29&RC[-6])&IF(RC[-2]="",,"|n"&RC[-2]) -> 
AI563: =IF(RC[-27]&RC[-26]&RC[-25]&RC[-24]&RC[-23]&RC[-22]="",,R1C7)&IF(RC[-27]="",,"|n"&R1C8&RC[-27])&IF(RC[-26]="",,"|n"&R1C9&RC[-26])&IF(RC[-25]="",,"|n"&R1C10&RC[-25])&IF(RC[-24]="",,"|n"&R1C11&RC[-24])&IF(RC[-23]="",,"|n"&R1C12&RC[-23])&IF(RC[-22]="",,"|n"&R1C13&RC[-22])&IF(RC[-20]&RC[-19]&RC[-18]&RC[-17]="",,"|n"&R1C14)&IF(RC[-20]="",,"|n"&R1C15&RC[-20])&IF(RC[-19]="",,"|n"&R1C16&RC[-19])&IF(RC[-18]="",,"|n"&R1C17&RC[-18])&IF(RC[-17]="",,"|n"&R1C18&RC[-17])&IF(RC[-16]="",,"|n"&R1C19&RC[-16])&IF(RC[-15]="",,"|n"&R1C20&RC[-15])&IF(RC[-14]="",,"|n"&R1C21&RC[-14])&IF(RC[-13]="",,"|n"&R1C22&RC[-13])&IF(RC[-11]="",,"|n"&R1C24&RC[-11])&IF(RC[-10]="",,"|n"&R1C25&RC[-10])&IF(RC[-9]="",,"|n"&R1C26&RC[-9])&IF(RC[-8]="",,"|n"&R1C27&RC[-8])&IF(RC[-7]="",,"|n"&R1C28&RC[-7])&IF(RC[-6]="",,"|n"&R1C29&RC[-6])&IF(RC[-2]="",,"|n"&RC[-2]) -> 
AI564: =IF(RC[-27]&RC[-26]&RC[-25]&RC[-24]&RC[-23]&RC[-22]="",,R1C7)&IF(RC[-27]="",,"|n"&R1C8&RC[-27])&IF(RC[-26]="",,"|n"&R1C9&RC[-26])&IF(RC[-25]="",,"|n"&R1C10&RC[-25])&IF(RC[-24]="",,"|n"&R1C11&RC[-24])&IF(RC[-23]="",,"|n"&R1C12&RC[-23])&IF(RC[-22]="",,"|n"&R1C13&RC[-22])&IF(RC[-20]&RC[-19]&RC[-18]&RC[-17]="",,"|n"&R1C14)&IF(RC[-20]="",,"|n"&R1C15&RC[-20])&IF(RC[-19]="",,"|n"&R1C16&RC[-19])&IF(RC[-18]="",,"|n"&R1C17&RC[-18])&IF(RC[-17]="",,"|n"&R1C18&RC[-17])&IF(RC[-16]="",,"|n"&R1C19&RC[-16])&IF(RC[-15]="",,"|n"&R1C20&RC[-15])&IF(RC[-14]="",,"|n"&R1C21&RC[-14])&IF(RC[-13]="",,"|n"&R1C22&RC[-13])&IF(RC[-11]="",,"|n"&R1C24&RC[-11])&IF(RC[-10]="",,"|n"&R1C25&RC[-10])&IF(RC[-9]="",,"|n"&R1C26&RC[-9])&IF(RC[-8]="",,"|n"&R1C27&RC[-8])&IF(RC[-7]="",,"|n"&R1C28&RC[-7])&IF(RC[-6]="",,"|n"&R1C29&RC[-6])&IF(RC[-2]="",,"|n"&RC[-2]) -> 
AI565: =IF(RC[-27]&RC[-26]&RC[-25]&RC[-24]&RC[-23]&RC[-22]="",,R1C7)&IF(RC[-27]="",,"|n"&R1C8&RC[-27])&IF(RC[-26]="",,"|n"&R1C9&RC[-26])&IF(RC[-25]="",,"|n"&R1C10&RC[-25])&IF(RC[-24]="",,"|n"&R1C11&RC[-24])&IF(RC[-23]="",,"|n"&R1C12&RC[-23])&IF(RC[-22]="",,"|n"&R1C13&RC[-22])&IF(RC[-20]&RC[-19]&RC[-18]&RC[-17]="",,"|n"&R1C14)&IF(RC[-20]="",,"|n"&R1C15&RC[-20])&IF(RC[-19]="",,"|n"&R1C16&RC[-19])&IF(RC[-18]="",,"|n"&R1C17&RC[-18])&IF(RC[-17]="",,"|n"&R1C18&RC[-17])&IF(RC[-16]="",,"|n"&R1C19&RC[-16])&IF(RC[-15]="",,"|n"&R1C20&RC[-15])&IF(RC[-14]="",,"|n"&R1C21&RC[-14])&IF(RC[-13]="",,"|n"&R1C22&RC[-13])&IF(RC[-11]="",,"|n"&R1C24&RC[-11])&IF(RC[-10]="",,"|n"&R1C25&RC[-10])&IF(RC[-9]="",,"|n"&R1C26&RC[-9])&IF(RC[-8]="",,"|n"&R1C27&RC[-8])&IF(RC[-7]="",,"|n"&R1C28&RC[-7])&IF(RC[-6]="",,"|n"&R1C29&RC[-6])&IF(RC[-2]="",,"|n"&RC[-2]) -> 
AI566: =IF(RC[-27]&RC[-26]&RC[-25]&RC[-24]&RC[-23]&RC[-22]="",,R1C7)&IF(RC[-27]="",,"|n"&R1C8&RC[-27])&IF(RC[-26]="",,"|n"&R1C9&RC[-26])&IF(RC[-25]="",,"|n"&R1C10&RC[-25])&IF(RC[-24]="",,"|n"&R1C11&RC[-24])&IF(RC[-23]="",,"|n"&R1C12&RC[-23])&IF(RC[-22]="",,"|n"&R1C13&RC[-22])&IF(RC[-20]&RC[-19]&RC[-18]&RC[-17]="",,"|n"&R1C14)&IF(RC[-20]="",,"|n"&R1C15&RC[-20])&IF(RC[-19]="",,"|n"&R1C16&RC[-19])&IF(RC[-18]="",,"|n"&R1C17&RC[-18])&IF(RC[-17]="",,"|n"&R1C18&RC[-17])&IF(RC[-16]="",,"|n"&R1C19&RC[-16])&IF(RC[-15]="",,"|n"&R1C20&RC[-15])&IF(RC[-14]="",,"|n"&R1C21&RC[-14])&IF(RC[-13]="",,"|n"&R1C22&RC[-13])&IF(RC[-11]="",,"|n"&R1C24&RC[-11])&IF(RC[-10]="",,"|n"&R1C25&RC[-10])&IF(RC[-9]="",,"|n"&R1C26&RC[-9])&IF(RC[-8]="",,"|n"&R1C27&RC[-8])&IF(RC[-7]="",,"|n"&R1C28&RC[-7])&IF(RC[-6]="",,"|n"&R1C29&RC[-6])&IF(RC[-2]="",,"|n"&RC[-2]) -> 
AI567: =IF(RC[-27]&RC[-26]&RC[-25]&RC[-24]&RC[-23]&RC[-22]="",,R1C7)&IF(RC[-27]="",,"|n"&R1C8&RC[-27])&IF(RC[-26]="",,"|n"&R1C9&RC[-26])&IF(RC[-25]="",,"|n"&R1C10&RC[-25])&IF(RC[-24]="",,"|n"&R1C11&RC[-24])&IF(RC[-23]="",,"|n"&R1C12&RC[-23])&IF(RC[-22]="",,"|n"&R1C13&RC[-22])&IF(RC[-20]&RC[-19]&RC[-18]&RC[-17]="",,"|n"&R1C14)&IF(RC[-20]="",,"|n"&R1C15&RC[-20])&IF(RC[-19]="",,"|n"&R1C16&RC[-19])&IF(RC[-18]="",,"|n"&R1C17&RC[-18])&IF(RC[-17]="",,"|n"&R1C18&RC[-17])&IF(RC[-16]="",,"|n"&R1C19&RC[-16])&IF(RC[-15]="",,"|n"&R1C20&RC[-15])&IF(RC[-14]="",,"|n"&R1C21&RC[-14])&IF(RC[-13]="",,"|n"&R1C22&RC[-13])&IF(RC[-11]="",,"|n"&R1C24&RC[-11])&IF(RC[-10]="",,"|n"&R1C25&RC[-10])&IF(RC[-9]="",,"|n"&R1C26&RC[-9])&IF(RC[-8]="",,"|n"&R1C27&RC[-8])&IF(RC[-7]="",,"|n"&R1C28&RC[-7])&IF(RC[-6]="",,"|n"&R1C29&RC[-6])&IF(RC[-2]="",,"|n"&RC[-2]) -> 
AI568: =IF(RC[-27]&RC[-26]&RC[-25]&RC[-24]&RC[-23]&RC[-22]="",,R1C7)&IF(RC[-27]="",,"|n"&R1C8&RC[-27])&IF(RC[-26]="",,"|n"&R1C9&RC[-26])&IF(RC[-25]="",,"|n"&R1C10&RC[-25])&IF(RC[-24]="",,"|n"&R1C11&RC[-24])&IF(RC[-23]="",,"|n"&R1C12&RC[-23])&IF(RC[-22]="",,"|n"&R1C13&RC[-22])&IF(RC[-20]&RC[-19]&RC[-18]&RC[-17]="",,"|n"&R1C14)&IF(RC[-20]="",,"|n"&R1C15&RC[-20])&IF(RC[-19]="",,"|n"&R1C16&RC[-19])&IF(RC[-18]="",,"|n"&R1C17&RC[-18])&IF(RC[-17]="",,"|n"&R1C18&RC[-17])&IF(RC[-16]="",,"|n"&R1C19&RC[-16])&IF(RC[-15]="",,"|n"&R1C20&RC[-15])&IF(RC[-14]="",,"|n"&R1C21&RC[-14])&IF(RC[-13]="",,"|n"&R1C22&RC[-13])&IF(RC[-11]="",,"|n"&R1C24&RC[-11])&IF(RC[-10]="",,"|n"&R1C25&RC[-10])&IF(RC[-9]="",,"|n"&R1C26&RC[-9])&IF(RC[-8]="",,"|n"&R1C27&RC[-8])&IF(RC[-7]="",,"|n"&R1C28&RC[-7])&IF(RC[-6]="",,"|n"&R1C29&RC[-6])&IF(RC[-2]="",,"|n"&RC[-2]) -> 
AI569: =IF(RC[-27]&RC[-26]&RC[-25]&RC[-24]&RC[-23]&RC[-22]="",,R1C7)&IF(RC[-27]="",,"|n"&R1C8&RC[-27])&IF(RC[-26]="",,"|n"&R1C9&RC[-26])&IF(RC[-25]="",,"|n"&R1C10&RC[-25])&IF(RC[-24]="",,"|n"&R1C11&RC[-24])&IF(RC[-23]="",,"|n"&R1C12&RC[-23])&IF(RC[-22]="",,"|n"&R1C13&RC[-22])&IF(RC[-20]&RC[-19]&RC[-18]&RC[-17]="",,"|n"&R1C14)&IF(RC[-20]="",,"|n"&R1C15&RC[-20])&IF(RC[-19]="",,"|n"&R1C16&RC[-19])&IF(RC[-18]="",,"|n"&R1C17&RC[-18])&IF(RC[-17]="",,"|n"&R1C18&RC[-17])&IF(RC[-16]="",,"|n"&R1C19&RC[-16])&IF(RC[-15]="",,"|n"&R1C20&RC[-15])&IF(RC[-14]="",,"|n"&R1C21&RC[-14])&IF(RC[-13]="",,"|n"&R1C22&RC[-13])&IF(RC[-11]="",,"|n"&R1C24&RC[-11])&IF(RC[-10]="",,"|n"&R1C25&RC[-10])&IF(RC[-9]="",,"|n"&R1C26&RC[-9])&IF(RC[-8]="",,"|n"&R1C27&RC[-8])&IF(RC[-7]="",,"|n"&R1C28&RC[-7])&IF(RC[-6]="",,"|n"&R1C29&RC[-6])&IF(RC[-2]="",,"|n"&RC[-2]) -> 
AI570: =IF(RC[-27]&RC[-26]&RC[-25]&RC[-24]&RC[-23]&RC[-22]="",,R1C7)&IF(RC[-27]="",,"|n"&R1C8&RC[-27])&IF(RC[-26]="",,"|n"&R1C9&RC[-26])&IF(RC[-25]="",,"|n"&R1C10&RC[-25])&IF(RC[-24]="",,"|n"&R1C11&RC[-24])&IF(RC[-23]="",,"|n"&R1C12&RC[-23])&IF(RC[-22]="",,"|n"&R1C13&RC[-22])&IF(RC[-20]&RC[-19]&RC[-18]&RC[-17]="",,"|n"&R1C14)&IF(RC[-20]="",,"|n"&R1C15&RC[-20])&IF(RC[-19]="",,"|n"&R1C16&RC[-19])&IF(RC[-18]="",,"|n"&R1C17&RC[-18])&IF(RC[-17]="",,"|n"&R1C18&RC[-17])&IF(RC[-16]="",,"|n"&R1C19&RC[-16])&IF(RC[-15]="",,"|n"&R1C20&RC[-15])&IF(RC[-14]="",,"|n"&R1C21&RC[-14])&IF(RC[-13]="",,"|n"&R1C22&RC[-13])&IF(RC[-11]="",,"|n"&R1C24&RC[-11])&IF(RC[-10]="",,"|n"&R1C25&RC[-10])&IF(RC[-9]="",,"|n"&R1C26&RC[-9])&IF(RC[-8]="",,"|n"&R1C27&RC[-8])&IF(RC[-7]="",,"|n"&R1C28&RC[-7])&IF(RC[-6]="",,"|n"&R1C29&RC[-6])&IF(RC[-2]="",,"|n"&RC[-2]) -> 
AI571: =IF(RC[-27]&RC[-26]&RC[-25]&RC[-24]&RC[-23]&RC[-22]="",,R1C7)&IF(RC[-27]="",,"|n"&R1C8&RC[-27])&IF(RC[-26]="",,"|n"&R1C9&RC[-26])&IF(RC[-25]="",,"|n"&R1C10&RC[-25])&IF(RC[-24]="",,"|n"&R1C11&RC[-24])&IF(RC[-23]="",,"|n"&R1C12&RC[-23])&IF(RC[-22]="",,"|n"&R1C13&RC[-22])&IF(RC[-20]&RC[-19]&RC[-18]&RC[-17]="",,"|n"&R1C14)&IF(RC[-20]="",,"|n"&R1C15&RC[-20])&IF(RC[-19]="",,"|n"&R1C16&RC[-19])&IF(RC[-18]="",,"|n"&R1C17&RC[-18])&IF(RC[-17]="",,"|n"&R1C18&RC[-17])&IF(RC[-16]="",,"|n"&R1C19&RC[-16])&IF(RC[-15]="",,"|n"&R1C20&RC[-15])&IF(RC[-14]="",,"|n"&R1C21&RC[-14])&IF(RC[-13]="",,"|n"&R1C22&RC[-13])&IF(RC[-11]="",,"|n"&R1C24&RC[-11])&IF(RC[-10]="",,"|n"&R1C25&RC[-10])&IF(RC[-9]="",,"|n"&R1C26&RC[-9])&IF(RC[-8]="",,"|n"&R1C27&RC[-8])&IF(RC[-7]="",,"|n"&R1C28&RC[-7])&IF(RC[-6]="",,"|n"&R1C29&RC[-6])&IF(RC[-2]="",,"|n"&RC[-2]) -> 
AI572: =IF(RC[-27]&RC[-26]&RC[-25]&RC[-24]&RC[-23]&RC[-22]="",,R1C7)&IF(RC[-27]="",,"|n"&R1C8&RC[-27])&IF(RC[-26]="",,"|n"&R1C9&RC[-26])&IF(RC[-25]="",,"|n"&R1C10&RC[-25])&IF(RC[-24]="",,"|n"&R1C11&RC[-24])&IF(RC[-23]="",,"|n"&R1C12&RC[-23])&IF(RC[-22]="",,"|n"&R1C13&RC[-22])&IF(RC[-20]&RC[-19]&RC[-18]&RC[-17]="",,"|n"&R1C14)&IF(RC[-20]="",,"|n"&R1C15&RC[-20])&IF(RC[-19]="",,"|n"&R1C16&RC[-19])&IF(RC[-18]="",,"|n"&R1C17&RC[-18])&IF(RC[-17]="",,"|n"&R1C18&RC[-17])&IF(RC[-16]="",,"|n"&R1C19&RC[-16])&IF(RC[-15]="",,"|n"&R1C20&RC[-15])&IF(RC[-14]="",,"|n"&R1C21&RC[-14])&IF(RC[-13]="",,"|n"&R1C22&RC[-13])&IF(RC[-11]="",,"|n"&R1C24&RC[-11])&IF(RC[-10]="",,"|n"&R1C25&RC[-10])&IF(RC[-9]="",,"|n"&R1C26&RC[-9])&IF(RC[-8]="",,"|n"&R1C27&RC[-8])&IF(RC[-7]="",,"|n"&R1C28&RC[-7])&IF(RC[-6]="",,"|n"&R1C29&RC[-6])&IF(RC[-2]="",,"|n"&RC[-2]) -> 
AI573: =IF(RC[-27]&RC[-26]&RC[-25]&RC[-24]&RC[-23]&RC[-22]="",,R1C7)&IF(RC[-27]="",,"|n"&R1C8&RC[-27])&IF(RC[-26]="",,"|n"&R1C9&RC[-26])&IF(RC[-25]="",,"|n"&R1C10&RC[-25])&IF(RC[-24]="",,"|n"&R1C11&RC[-24])&IF(RC[-23]="",,"|n"&R1C12&RC[-23])&IF(RC[-22]="",,"|n"&R1C13&RC[-22])&IF(RC[-20]&RC[-19]&RC[-18]&RC[-17]="",,"|n"&R1C14)&IF(RC[-20]="",,"|n"&R1C15&RC[-20])&IF(RC[-19]="",,"|n"&R1C16&RC[-19])&IF(RC[-18]="",,"|n"&R1C17&RC[-18])&IF(RC[-17]="",,"|n"&R1C18&RC[-17])&IF(RC[-16]="",,"|n"&R1C19&RC[-16])&IF(RC[-15]="",,"|n"&R1C20&RC[-15])&IF(RC[-14]="",,"|n"&R1C21&RC[-14])&IF(RC[-13]="",,"|n"&R1C22&RC[-13])&IF(RC[-11]="",,"|n"&R1C24&RC[-11])&IF(RC[-10]="",,"|n"&R1C25&RC[-10])&IF(RC[-9]="",,"|n"&R1C26&RC[-9])&IF(RC[-8]="",,"|n"&R1C27&RC[-8])&IF(RC[-7]="",,"|n"&R1C28&RC[-7])&IF(RC[-6]="",,"|n"&R1C29&RC[-6])&IF(RC[-2]="",,"|n"&RC[-2]) -> 
AI574: =IF(RC[-27]&RC[-26]&RC[-25]&RC[-24]&RC[-23]&RC[-22]="",,R1C7)&IF(RC[-27]="",,"|n"&R1C8&RC[-27])&IF(RC[-26]="",,"|n"&R1C9&RC[-26])&IF(RC[-25]="",,"|n"&R1C10&RC[-25])&IF(RC[-24]="",,"|n"&R1C11&RC[-24])&IF(RC[-23]="",,"|n"&R1C12&RC[-23])&IF(RC[-22]="",,"|n"&R1C13&RC[-22])&IF(RC[-20]&RC[-19]&RC[-18]&RC[-17]="",,"|n"&R1C14)&IF(RC[-20]="",,"|n"&R1C15&RC[-20])&IF(RC[-19]="",,"|n"&R1C16&RC[-19])&IF(RC[-18]="",,"|n"&R1C17&RC[-18])&IF(RC[-17]="",,"|n"&R1C18&RC[-17])&IF(RC[-16]="",,"|n"&R1C19&RC[-16])&IF(RC[-15]="",,"|n"&R1C20&RC[-15])&IF(RC[-14]="",,"|n"&R1C21&RC[-14])&IF(RC[-13]="",,"|n"&R1C22&RC[-13])&IF(RC[-11]="",,"|n"&R1C24&RC[-11])&IF(RC[-10]="",,"|n"&R1C25&RC[-10])&IF(RC[-9]="",,"|n"&R1C26&RC[-9])&IF(RC[-8]="",,"|n"&R1C27&RC[-8])&IF(RC[-7]="",,"|n"&R1C28&RC[-7])&IF(RC[-6]="",,"|n"&R1C29&RC[-6])&IF(RC[-2]="",,"|n"&RC[-2]) -> 
AI575: =IF(RC[-27]&RC[-26]&RC[-25]&RC[-24]&RC[-23]&RC[-22]="",,R1C7)&IF(RC[-27]="",,"|n"&R1C8&RC[-27])&IF(RC[-26]="",,"|n"&R1C9&RC[-26])&IF(RC[-25]="",,"|n"&R1C10&RC[-25])&IF(RC[-24]="",,"|n"&R1C11&RC[-24])&IF(RC[-23]="",,"|n"&R1C12&RC[-23])&IF(RC[-22]="",,"|n"&R1C13&RC[-22])&IF(RC[-20]&RC[-19]&RC[-18]&RC[-17]="",,"|n"&R1C14)&IF(RC[-20]="",,"|n"&R1C15&RC[-20])&IF(RC[-19]="",,"|n"&R1C16&RC[-19])&IF(RC[-18]="",,"|n"&R1C17&RC[-18])&IF(RC[-17]="",,"|n"&R1C18&RC[-17])&IF(RC[-16]="",,"|n"&R1C19&RC[-16])&IF(RC[-15]="",,"|n"&R1C20&RC[-15])&IF(RC[-14]="",,"|n"&R1C21&RC[-14])&IF(RC[-13]="",,"|n"&R1C22&RC[-13])&IF(RC[-11]="",,"|n"&R1C24&RC[-11])&IF(RC[-10]="",,"|n"&R1C25&RC[-10])&IF(RC[-9]="",,"|n"&R1C26&RC[-9])&IF(RC[-8]="",,"|n"&R1C27&RC[-8])&IF(RC[-7]="",,"|n"&R1C28&RC[-7])&IF(RC[-6]="",,"|n"&R1C29&RC[-6])&IF(RC[-2]="",,"|n"&RC[-2]) -> 
AI576: =IF(RC[-27]&RC[-26]&RC[-25]&RC[-24]&RC[-23]&RC[-22]="",,R1C7)&IF(RC[-27]="",,"|n"&R1C8&RC[-27])&IF(RC[-26]="",,"|n"&R1C9&RC[-26])&IF(RC[-25]="",,"|n"&R1C10&RC[-25])&IF(RC[-24]="",,"|n"&R1C11&RC[-24])&IF(RC[-23]="",,"|n"&R1C12&RC[-23])&IF(RC[-22]="",,"|n"&R1C13&RC[-22])&IF(RC[-20]&RC[-19]&RC[-18]&RC[-17]="",,"|n"&R1C14)&IF(RC[-20]="",,"|n"&R1C15&RC[-20])&IF(RC[-19]="",,"|n"&R1C16&RC[-19])&IF(RC[-18]="",,"|n"&R1C17&RC[-18])&IF(RC[-17]="",,"|n"&R1C18&RC[-17])&IF(RC[-16]="",,"|n"&R1C19&RC[-16])&IF(RC[-15]="",,"|n"&R1C20&RC[-15])&IF(RC[-14]="",,"|n"&R1C21&RC[-14])&IF(RC[-13]="",,"|n"&R1C22&RC[-13])&IF(RC[-11]="",,"|n"&R1C24&RC[-11])&IF(RC[-10]="",,"|n"&R1C25&RC[-10])&IF(RC[-9]="",,"|n"&R1C26&RC[-9])&IF(RC[-8]="",,"|n"&R1C27&RC[-8])&IF(RC[-7]="",,"|n"&R1C28&RC[-7])&IF(RC[-6]="",,"|n"&R1C29&RC[-6])&IF(RC[-2]="",,"|n"&RC[-2]) -> 
AI577: =IF(RC[-27]&RC[-26]&RC[-25]&RC[-24]&RC[-23]&RC[-22]="",,R1C7)&IF(RC[-27]="",,"|n"&R1C8&RC[-27])&IF(RC[-26]="",,"|n"&R1C9&RC[-26])&IF(RC[-25]="",,"|n"&R1C10&RC[-25])&IF(RC[-24]="",,"|n"&R1C11&RC[-24])&IF(RC[-23]="",,"|n"&R1C12&RC[-23])&IF(RC[-22]="",,"|n"&R1C13&RC[-22])&IF(RC[-20]&RC[-19]&RC[-18]&RC[-17]="",,"|n"&R1C14)&IF(RC[-20]="",,"|n"&R1C15&RC[-20])&IF(RC[-19]="",,"|n"&R1C16&RC[-19])&IF(RC[-18]="",,"|n"&R1C17&RC[-18])&IF(RC[-17]="",,"|n"&R1C18&RC[-17])&IF(RC[-16]="",,"|n"&R1C19&RC[-16])&IF(RC[-15]="",,"|n"&R1C20&RC[-15])&IF(RC[-14]="",,"|n"&R1C21&RC[-14])&IF(RC[-13]="",,"|n"&R1C22&RC[-13])&IF(RC[-11]="",,"|n"&R1C24&RC[-11])&IF(RC[-10]="",,"|n"&R1C25&RC[-10])&IF(RC[-9]="",,"|n"&R1C26&RC[-9])&IF(RC[-8]="",,"|n"&R1C27&RC[-8])&IF(RC[-7]="",,"|n"&R1C28&RC[-7])&IF(RC[-6]="",,"|n"&R1C29&RC[-6])&IF(RC[-2]="",,"|n"&RC[-2]) -> 
AI578: =IF(RC[-27]&RC[-26]&RC[-25]&RC[-24]&RC[-23]&RC[-22]="",,R1C7)&IF(RC[-27]="",,"|n"&R1C8&RC[-27])&IF(RC[-26]="",,"|n"&R1C9&RC[-26])&IF(RC[-25]="",,"|n"&R1C10&RC[-25])&IF(RC[-24]="",,"|n"&R1C11&RC[-24])&IF(RC[-23]="",,"|n"&R1C12&RC[-23])&IF(RC[-22]="",,"|n"&R1C13&RC[-22])&IF(RC[-20]&RC[-19]&RC[-18]&RC[-17]="",,"|n"&R1C14)&IF(RC[-20]="",,"|n"&R1C15&RC[-20])&IF(RC[-19]="",,"|n"&R1C16&RC[-19])&IF(RC[-18]="",,"|n"&R1C17&RC[-18])&IF(RC[-17]="",,"|n"&R1C18&RC[-17])&IF(RC[-16]="",,"|n"&R1C19&RC[-16])&IF(RC[-15]="",,"|n"&R1C20&RC[-15])&IF(RC[-14]="",,"|n"&R1C21&RC[-14])&IF(RC[-13]="",,"|n"&R1C22&RC[-13])&IF(RC[-11]="",,"|n"&R1C24&RC[-11])&IF(RC[-10]="",,"|n"&R1C25&RC[-10])&IF(RC[-9]="",,"|n"&R1C26&RC[-9])&IF(RC[-8]="",,"|n"&R1C27&RC[-8])&IF(RC[-7]="",,"|n"&R1C28&RC[-7])&IF(RC[-6]="",,"|n"&R1C29&RC[-6])&IF(RC[-2]="",,"|n"&RC[-2]) -> 
AI579: =IF(RC[-27]&RC[-26]&RC[-25]&RC[-24]&RC[-23]&RC[-22]="",,R1C7)&IF(RC[-27]="",,"|n"&R1C8&RC[-27])&IF(RC[-26]="",,"|n"&R1C9&RC[-26])&IF(RC[-25]="",,"|n"&R1C10&RC[-25])&IF(RC[-24]="",,"|n"&R1C11&RC[-24])&IF(RC[-23]="",,"|n"&R1C12&RC[-23])&IF(RC[-22]="",,"|n"&R1C13&RC[-22])&IF(RC[-20]&RC[-19]&RC[-18]&RC[-17]="",,"|n"&R1C14)&IF(RC[-20]="",,"|n"&R1C15&RC[-20])&IF(RC[-19]="",,"|n"&R1C16&RC[-19])&IF(RC[-18]="",,"|n"&R1C17&RC[-18])&IF(RC[-17]="",,"|n"&R1C18&RC[-17])&IF(RC[-16]="",,"|n"&R1C19&RC[-16])&IF(RC[-15]="",,"|n"&R1C20&RC[-15])&IF(RC[-14]="",,"|n"&R1C21&RC[-14])&IF(RC[-13]="",,"|n"&R1C22&RC[-13])&IF(RC[-11]="",,"|n"&R1C24&RC[-11])&IF(RC[-10]="",,"|n"&R1C25&RC[-10])&IF(RC[-9]="",,"|n"&R1C26&RC[-9])&IF(RC[-8]="",,"|n"&R1C27&RC[-8])&IF(RC[-7]="",,"|n"&R1C28&RC[-7])&IF(RC[-6]="",,"|n"&R1C29&RC[-6])&IF(RC[-2]="",,"|n"&RC[-2]) -> 
AI580: =IF(RC[-27]&RC[-26]&RC[-25]&RC[-24]&RC[-23]&RC[-22]="",,R1C7)&IF(RC[-27]="",,"|n"&R1C8&RC[-27])&IF(RC[-26]="",,"|n"&R1C9&RC[-26])&IF(RC[-25]="",,"|n"&R1C10&RC[-25])&IF(RC[-24]="",,"|n"&R1C11&RC[-24])&IF(RC[-23]="",,"|n"&R1C12&RC[-23])&IF(RC[-22]="",,"|n"&R1C13&RC[-22])&IF(RC[-20]&RC[-19]&RC[-18]&RC[-17]="",,"|n"&R1C14)&IF(RC[-20]="",,"|n"&R1C15&RC[-20])&IF(RC[-19]="",,"|n"&R1C16&RC[-19])&IF(RC[-18]="",,"|n"&R1C17&RC[-18])&IF(RC[-17]="",,"|n"&R1C18&RC[-17])&IF(RC[-16]="",,"|n"&R1C19&RC[-16])&IF(RC[-15]="",,"|n"&R1C20&RC[-15])&IF(RC[-14]="",,"|n"&R1C21&RC[-14])&IF(RC[-13]="",,"|n"&R1C22&RC[-13])&IF(RC[-11]="",,"|n"&R1C24&RC[-11])&IF(RC[-10]="",,"|n"&R1C25&RC[-10])&IF(RC[-9]="",,"|n"&R1C26&RC[-9])&IF(RC[-8]="",,"|n"&R1C27&RC[-8])&IF(RC[-7]="",,"|n"&R1C28&RC[-7])&IF(RC[-6]="",,"|n"&R1C29&RC[-6])&IF(RC[-2]="",,"|n"&RC[-2]) -> 
AI581: =IF(RC[-27]&RC[-26]&RC[-25]&RC[-24]&RC[-23]&RC[-22]="",,R1C7)&IF(RC[-27]="",,"|n"&R1C8&RC[-27])&IF(RC[-26]="",,"|n"&R1C9&RC[-26])&IF(RC[-25]="",,"|n"&R1C10&RC[-25])&IF(RC[-24]="",,"|n"&R1C11&RC[-24])&IF(RC[-23]="",,"|n"&R1C12&RC[-23])&IF(RC[-22]="",,"|n"&R1C13&RC[-22])&IF(RC[-20]&RC[-19]&RC[-18]&RC[-17]="",,"|n"&R1C14)&IF(RC[-20]="",,"|n"&R1C15&RC[-20])&IF(RC[-19]="",,"|n"&R1C16&RC[-19])&IF(RC[-18]="",,"|n"&R1C17&RC[-18])&IF(RC[-17]="",,"|n"&R1C18&RC[-17])&IF(RC[-16]="",,"|n"&R1C19&RC[-16])&IF(RC[-15]="",,"|n"&R1C20&RC[-15])&IF(RC[-14]="",,"|n"&R1C21&RC[-14])&IF(RC[-13]="",,"|n"&R1C22&RC[-13])&IF(RC[-11]="",,"|n"&R1C24&RC[-11])&IF(RC[-10]="",,"|n"&R1C25&RC[-10])&IF(RC[-9]="",,"|n"&R1C26&RC[-9])&IF(RC[-8]="",,"|n"&R1C27&RC[-8])&IF(RC[-7]="",,"|n"&R1C28&RC[-7])&IF(RC[-6]="",,"|n"&R1C29&RC[-6])&IF(RC[-2]="",,"|n"&RC[-2]) -> 
AI582: =IF(RC[-27]&RC[-26]&RC[-25]&RC[-24]&RC[-23]&RC[-22]="",,R1C7)&IF(RC[-27]="",,"|n"&R1C8&RC[-27])&IF(RC[-26]="",,"|n"&R1C9&RC[-26])&IF(RC[-25]="",,"|n"&R1C10&RC[-25])&IF(RC[-24]="",,"|n"&R1C11&RC[-24])&IF(RC[-23]="",,"|n"&R1C12&RC[-23])&IF(RC[-22]="",,"|n"&R1C13&RC[-22])&IF(RC[-20]&RC[-19]&RC[-18]&RC[-17]="",,"|n"&R1C14)&IF(RC[-20]="",,"|n"&R1C15&RC[-20])&IF(RC[-19]="",,"|n"&R1C16&RC[-19])&IF(RC[-18]="",,"|n"&R1C17&RC[-18])&IF(RC[-17]="",,"|n"&R1C18&RC[-17])&IF(RC[-16]="",,"|n"&R1C19&RC[-16])&IF(RC[-15]="",,"|n"&R1C20&RC[-15])&IF(RC[-14]="",,"|n"&R1C21&RC[-14])&IF(RC[-13]="",,"|n"&R1C22&RC[-13])&IF(RC[-11]="",,"|n"&R1C24&RC[-11])&IF(RC[-10]="",,"|n"&R1C25&RC[-10])&IF(RC[-9]="",,"|n"&R1C26&RC[-9])&IF(RC[-8]="",,"|n"&R1C27&RC[-8])&IF(RC[-7]="",,"|n"&R1C28&RC[-7])&IF(RC[-6]="",,"|n"&R1C29&RC[-6])&IF(RC[-2]="",,"|n"&RC[-2]) -> 
AI583: =IF(RC[-27]&RC[-26]&RC[-25]&RC[-24]&RC[-23]&RC[-22]="",,R1C7)&IF(RC[-27]="",,"|n"&R1C8&RC[-27])&IF(RC[-26]="",,"|n"&R1C9&RC[-26])&IF(RC[-25]="",,"|n"&R1C10&RC[-25])&IF(RC[-24]="",,"|n"&R1C11&RC[-24])&IF(RC[-23]="",,"|n"&R1C12&RC[-23])&IF(RC[-22]="",,"|n"&R1C13&RC[-22])&IF(RC[-20]&RC[-19]&RC[-18]&RC[-17]="",,"|n"&R1C14)&IF(RC[-20]="",,"|n"&R1C15&RC[-20])&IF(RC[-19]="",,"|n"&R1C16&RC[-19])&IF(RC[-18]="",,"|n"&R1C17&RC[-18])&IF(RC[-17]="",,"|n"&R1C18&RC[-17])&IF(RC[-16]="",,"|n"&R1C19&RC[-16])&IF(RC[-15]="",,"|n"&R1C20&RC[-15])&IF(RC[-14]="",,"|n"&R1C21&RC[-14])&IF(RC[-13]="",,"|n"&R1C22&RC[-13])&IF(RC[-11]="",,"|n"&R1C24&RC[-11])&IF(RC[-10]="",,"|n"&R1C25&RC[-10])&IF(RC[-9]="",,"|n"&R1C26&RC[-9])&IF(RC[-8]="",,"|n"&R1C27&RC[-8])&IF(RC[-7]="",,"|n"&R1C28&RC[-7])&IF(RC[-6]="",,"|n"&R1C29&RC[-6])&IF(RC[-2]="",,"|n"&RC[-2]) -> 
AI584: =IF(RC[-27]&RC[-26]&RC[-25]&RC[-24]&RC[-23]&RC[-22]="",,R1C7)&IF(RC[-27]="",,"|n"&R1C8&RC[-27])&IF(RC[-26]="",,"|n"&R1C9&RC[-26])&IF(RC[-25]="",,"|n"&R1C10&RC[-25])&IF(RC[-24]="",,"|n"&R1C11&RC[-24])&IF(RC[-23]="",,"|n"&R1C12&RC[-23])&IF(RC[-22]="",,"|n"&R1C13&RC[-22])&IF(RC[-20]&RC[-19]&RC[-18]&RC[-17]="",,"|n"&R1C14)&IF(RC[-20]="",,"|n"&R1C15&RC[-20])&IF(RC[-19]="",,"|n"&R1C16&RC[-19])&IF(RC[-18]="",,"|n"&R1C17&RC[-18])&IF(RC[-17]="",,"|n"&R1C18&RC[-17])&IF(RC[-16]="",,"|n"&R1C19&RC[-16])&IF(RC[-15]="",,"|n"&R1C20&RC[-15])&IF(RC[-14]="",,"|n"&R1C21&RC[-14])&IF(RC[-13]="",,"|n"&R1C22&RC[-13])&IF(RC[-11]="",,"|n"&R1C24&RC[-11])&IF(RC[-10]="",,"|n"&R1C25&RC[-10])&IF(RC[-9]="",,"|n"&R1C26&RC[-9])&IF(RC[-8]="",,"|n"&R1C27&RC[-8])&IF(RC[-7]="",,"|n"&R1C28&RC[-7])&IF(RC[-6]="",,"|n"&R1C29&RC[-6])&IF(RC[-2]="",,"|n"&RC[-2]) -> 
AI585: =IF(RC[-27]&RC[-26]&RC[-25]&RC[-24]&RC[-23]&RC[-22]="",,R1C7)&IF(RC[-27]="",,"|n"&R1C8&RC[-27])&IF(RC[-26]="",,"|n"&R1C9&RC[-26])&IF(RC[-25]="",,"|n"&R1C10&RC[-25])&IF(RC[-24]="",,"|n"&R1C11&RC[-24])&IF(RC[-23]="",,"|n"&R1C12&RC[-23])&IF(RC[-22]="",,"|n"&R1C13&RC[-22])&IF(RC[-20]&RC[-19]&RC[-18]&RC[-17]="",,"|n"&R1C14)&IF(RC[-20]="",,"|n"&R1C15&RC[-20])&IF(RC[-19]="",,"|n"&R1C16&RC[-19])&IF(RC[-18]="",,"|n"&R1C17&RC[-18])&IF(RC[-17]="",,"|n"&R1C18&RC[-17])&IF(RC[-16]="",,"|n"&R1C19&RC[-16])&IF(RC[-15]="",,"|n"&R1C20&RC[-15])&IF(RC[-14]="",,"|n"&R1C21&RC[-14])&IF(RC[-13]="",,"|n"&R1C22&RC[-13])&IF(RC[-11]="",,"|n"&R1C24&RC[-11])&IF(RC[-10]="",,"|n"&R1C25&RC[-10])&IF(RC[-9]="",,"|n"&R1C26&RC[-9])&IF(RC[-8]="",,"|n"&R1C27&RC[-8])&IF(RC[-7]="",,"|n"&R1C28&RC[-7])&IF(RC[-6]="",,"|n"&R1C29&RC[-6])&IF(RC[-2]="",,"|n"&RC[-2]) -> 
AI586: =IF(RC[-27]&RC[-26]&RC[-25]&RC[-24]&RC[-23]&RC[-22]="",,R1C7)&IF(RC[-27]="",,"|n"&R1C8&RC[-27])&IF(RC[-26]="",,"|n"&R1C9&RC[-26])&IF(RC[-25]="",,"|n"&R1C10&RC[-25])&IF(RC[-24]="",,"|n"&R1C11&RC[-24])&IF(RC[-23]="",,"|n"&R1C12&RC[-23])&IF(RC[-22]="",,"|n"&R1C13&RC[-22])&IF(RC[-20]&RC[-19]&RC[-18]&RC[-17]="",,"|n"&R1C14)&IF(RC[-20]="",,"|n"&R1C15&RC[-20])&IF(RC[-19]="",,"|n"&R1C16&RC[-19])&IF(RC[-18]="",,"|n"&R1C17&RC[-18])&IF(RC[-17]="",,"|n"&R1C18&RC[-17])&IF(RC[-16]="",,"|n"&R1C19&RC[-16])&IF(RC[-15]="",,"|n"&R1C20&RC[-15])&IF(RC[-14]="",,"|n"&R1C21&RC[-14])&IF(RC[-13]="",,"|n"&R1C22&RC[-13])&IF(RC[-11]="",,"|n"&R1C24&RC[-11])&IF(RC[-10]="",,"|n"&R1C25&RC[-10])&IF(RC[-9]="",,"|n"&R1C26&RC[-9])&IF(RC[-8]="",,"|n"&R1C27&RC[-8])&IF(RC[-7]="",,"|n"&R1C28&RC[-7])&IF(RC[-6]="",,"|n"&R1C29&RC[-6])&IF(RC[-2]="",,"|n"&RC[-2]) -> 
AI587: =IF(RC[-27]&RC[-26]&RC[-25]&RC[-24]&RC[-23]&RC[-22]="",,R1C7)&IF(RC[-27]="",,"|n"&R1C8&RC[-27])&IF(RC[-26]="",,"|n"&R1C9&RC[-26])&IF(RC[-25]="",,"|n"&R1C10&RC[-25])&IF(RC[-24]="",,"|n"&R1C11&RC[-24])&IF(RC[-23]="",,"|n"&R1C12&RC[-23])&IF(RC[-22]="",,"|n"&R1C13&RC[-22])&IF(RC[-20]&RC[-19]&RC[-18]&RC[-17]="",,"|n"&R1C14)&IF(RC[-20]="",,"|n"&R1C15&RC[-20])&IF(RC[-19]="",,"|n"&R1C16&RC[-19])&IF(RC[-18]="",,"|n"&R1C17&RC[-18])&IF(RC[-17]="",,"|n"&R1C18&RC[-17])&IF(RC[-16]="",,"|n"&R1C19&RC[-16])&IF(RC[-15]="",,"|n"&R1C20&RC[-15])&IF(RC[-14]="",,"|n"&R1C21&RC[-14])&IF(RC[-13]="",,"|n"&R1C22&RC[-13])&IF(RC[-11]="",,"|n"&R1C24&RC[-11])&IF(RC[-10]="",,"|n"&R1C25&RC[-10])&IF(RC[-9]="",,"|n"&R1C26&RC[-9])&IF(RC[-8]="",,"|n"&R1C27&RC[-8])&IF(RC[-7]="",,"|n"&R1C28&RC[-7])&IF(RC[-6]="",,"|n"&R1C29&RC[-6])&IF(RC[-2]="",,"|n"&RC[-2]) -> 
AI588: =IF(RC[-27]&RC[-26]&RC[-25]&RC[-24]&RC[-23]&RC[-22]="",,R1C7)&IF(RC[-27]="",,"|n"&R1C8&RC[-27])&IF(RC[-26]="",,"|n"&R1C9&RC[-26])&IF(RC[-25]="",,"|n"&R1C10&RC[-25])&IF(RC[-24]="",,"|n"&R1C11&RC[-24])&IF(RC[-23]="",,"|n"&R1C12&RC[-23])&IF(RC[-22]="",,"|n"&R1C13&RC[-22])&IF(RC[-20]&RC[-19]&RC[-18]&RC[-17]="",,"|n"&R1C14)&IF(RC[-20]="",,"|n"&R1C15&RC[-20])&IF(RC[-19]="",,"|n"&R1C16&RC[-19])&IF(RC[-18]="",,"|n"&R1C17&RC[-18])&IF(RC[-17]="",,"|n"&R1C18&RC[-17])&IF(RC[-16]="",,"|n"&R1C19&RC[-16])&IF(RC[-15]="",,"|n"&R1C20&RC[-15])&IF(RC[-14]="",,"|n"&R1C21&RC[-14])&IF(RC[-13]="",,"|n"&R1C22&RC[-13])&IF(RC[-11]="",,"|n"&R1C24&RC[-11])&IF(RC[-10]="",,"|n"&R1C25&RC[-10])&IF(RC[-9]="",,"|n"&R1C26&RC[-9])&IF(RC[-8]="",,"|n"&R1C27&RC[-8])&IF(RC[-7]="",,"|n"&R1C28&RC[-7])&IF(RC[-6]="",,"|n"&R1C29&RC[-6])&IF(RC[-2]="",,"|n"&RC[-2]) -> 
AI589: =IF(RC[-27]&RC[-26]&RC[-25]&RC[-24]&RC[-23]&RC[-22]="",,R1C7)&IF(RC[-27]="",,"|n"&R1C8&RC[-27])&IF(RC[-26]="",,"|n"&R1C9&RC[-26])&IF(RC[-25]="",,"|n"&R1C10&RC[-25])&IF(RC[-24]="",,"|n"&R1C11&RC[-24])&IF(RC[-23]="",,"|n"&R1C12&RC[-23])&IF(RC[-22]="",,"|n"&R1C13&RC[-22])&IF(RC[-20]&RC[-19]&RC[-18]&RC[-17]="",,"|n"&R1C14)&IF(RC[-20]="",,"|n"&R1C15&RC[-20])&IF(RC[-19]="",,"|n"&R1C16&RC[-19])&IF(RC[-18]="",,"|n"&R1C17&RC[-18])&IF(RC[-17]="",,"|n"&R1C18&RC[-17])&IF(RC[-16]="",,"|n"&R1C19&RC[-16])&IF(RC[-15]="",,"|n"&R1C20&RC[-15])&IF(RC[-14]="",,"|n"&R1C21&RC[-14])&IF(RC[-13]="",,"|n"&R1C22&RC[-13])&IF(RC[-11]="",,"|n"&R1C24&RC[-11])&IF(RC[-10]="",,"|n"&R1C25&RC[-10])&IF(RC[-9]="",,"|n"&R1C26&RC[-9])&IF(RC[-8]="",,"|n"&R1C27&RC[-8])&IF(RC[-7]="",,"|n"&R1C28&RC[-7])&IF(RC[-6]="",,"|n"&R1C29&RC[-6])&IF(RC[-2]="",,"|n"&RC[-2]) -> 
AI590: =IF(RC[-27]&RC[-26]&RC[-25]&RC[-24]&RC[-23]&RC[-22]="",,R1C7)&IF(RC[-27]="",,"|n"&R1C8&RC[-27])&IF(RC[-26]="",,"|n"&R1C9&RC[-26])&IF(RC[-25]="",,"|n"&R1C10&RC[-25])&IF(RC[-24]="",,"|n"&R1C11&RC[-24])&IF(RC[-23]="",,"|n"&R1C12&RC[-23])&IF(RC[-22]="",,"|n"&R1C13&RC[-22])&IF(RC[-20]&RC[-19]&RC[-18]&RC[-17]="",,"|n"&R1C14)&IF(RC[-20]="",,"|n"&R1C15&RC[-20])&IF(RC[-19]="",,"|n"&R1C16&RC[-19])&IF(RC[-18]="",,"|n"&R1C17&RC[-18])&IF(RC[-17]="",,"|n"&R1C18&RC[-17])&IF(RC[-16]="",,"|n"&R1C19&RC[-16])&IF(RC[-15]="",,"|n"&R1C20&RC[-15])&IF(RC[-14]="",,"|n"&R1C21&RC[-14])&IF(RC[-13]="",,"|n"&R1C22&RC[-13])&IF(RC[-11]="",,"|n"&R1C24&RC[-11])&IF(RC[-10]="",,"|n"&R1C25&RC[-10])&IF(RC[-9]="",,"|n"&R1C26&RC[-9])&IF(RC[-8]="",,"|n"&R1C27&RC[-8])&IF(RC[-7]="",,"|n"&R1C28&RC[-7])&IF(RC[-6]="",,"|n"&R1C29&RC[-6])&IF(RC[-2]="",,"|n"&RC[-2]) -> 
AI591: =IF(RC[-27]&RC[-26]&RC[-25]&RC[-24]&RC[-23]&RC[-22]="",,R1C7)&IF(RC[-27]="",,"|n"&R1C8&RC[-27])&IF(RC[-26]="",,"|n"&R1C9&RC[-26])&IF(RC[-25]="",,"|n"&R1C10&RC[-25])&IF(RC[-24]="",,"|n"&R1C11&RC[-24])&IF(RC[-23]="",,"|n"&R1C12&RC[-23])&IF(RC[-22]="",,"|n"&R1C13&RC[-22])&IF(RC[-20]&RC[-19]&RC[-18]&RC[-17]="",,"|n"&R1C14)&IF(RC[-20]="",,"|n"&R1C15&RC[-20])&IF(RC[-19]="",,"|n"&R1C16&RC[-19])&IF(RC[-18]="",,"|n"&R1C17&RC[-18])&IF(RC[-17]="",,"|n"&R1C18&RC[-17])&IF(RC[-16]="",,"|n"&R1C19&RC[-16])&IF(RC[-15]="",,"|n"&R1C20&RC[-15])&IF(RC[-14]="",,"|n"&R1C21&RC[-14])&IF(RC[-13]="",,"|n"&R1C22&RC[-13])&IF(RC[-11]="",,"|n"&R1C24&RC[-11])&IF(RC[-10]="",,"|n"&R1C25&RC[-10])&IF(RC[-9]="",,"|n"&R1C26&RC[-9])&IF(RC[-8]="",,"|n"&R1C27&RC[-8])&IF(RC[-7]="",,"|n"&R1C28&RC[-7])&IF(RC[-6]="",,"|n"&R1C29&RC[-6])&IF(RC[-2]="",,"|n"&RC[-2]) -> 
AI592: =IF(RC[-27]&RC[-26]&RC[-25]&RC[-24]&RC[-23]&RC[-22]="",,R1C7)&IF(RC[-27]="",,"|n"&R1C8&RC[-27])&IF(RC[-26]="",,"|n"&R1C9&RC[-26])&IF(RC[-25]="",,"|n"&R1C10&RC[-25])&IF(RC[-24]="",,"|n"&R1C11&RC[-24])&IF(RC[-23]="",,"|n"&R1C12&RC[-23])&IF(RC[-22]="",,"|n"&R1C13&RC[-22])&IF(RC[-20]&RC[-19]&RC[-18]&RC[-17]="",,"|n"&R1C14)&IF(RC[-20]="",,"|n"&R1C15&RC[-20])&IF(RC[-19]="",,"|n"&R1C16&RC[-19])&IF(RC[-18]="",,"|n"&R1C17&RC[-18])&IF(RC[-17]="",,"|n"&R1C18&RC[-17])&IF(RC[-16]="",,"|n"&R1C19&RC[-16])&IF(RC[-15]="",,"|n"&R1C20&RC[-15])&IF(RC[-14]="",,"|n"&R1C21&RC[-14])&IF(RC[-13]="",,"|n"&R1C22&RC[-13])&IF(RC[-11]="",,"|n"&R1C24&RC[-11])&IF(RC[-10]="",,"|n"&R1C25&RC[-10])&IF(RC[-9]="",,"|n"&R1C26&RC[-9])&IF(RC[-8]="",,"|n"&R1C27&RC[-8])&IF(RC[-7]="",,"|n"&R1C28&RC[-7])&IF(RC[-6]="",,"|n"&R1C29&RC[-6])&IF(RC[-2]="",,"|n"&RC[-2]) -> 
AI593: =IF(RC[-27]&RC[-26]&RC[-25]&RC[-24]&RC[-23]&RC[-22]="",,R1C7)&IF(RC[-27]="",,"|n"&R1C8&RC[-27])&IF(RC[-26]="",,"|n"&R1C9&RC[-26])&IF(RC[-25]="",,"|n"&R1C10&RC[-25])&IF(RC[-24]="",,"|n"&R1C11&RC[-24])&IF(RC[-23]="",,"|n"&R1C12&RC[-23])&IF(RC[-22]="",,"|n"&R1C13&RC[-22])&IF(RC[-20]&RC[-19]&RC[-18]&RC[-17]="",,"|n"&R1C14)&IF(RC[-20]="",,"|n"&R1C15&RC[-20])&IF(RC[-19]="",,"|n"&R1C16&RC[-19])&IF(RC[-18]="",,"|n"&R1C17&RC[-18])&IF(RC[-17]="",,"|n"&R1C18&RC[-17])&IF(RC[-16]="",,"|n"&R1C19&RC[-16])&IF(RC[-15]="",,"|n"&R1C20&RC[-15])&IF(RC[-14]="",,"|n"&R1C21&RC[-14])&IF(RC[-13]="",,"|n"&R1C22&RC[-13])&IF(RC[-11]="",,"|n"&R1C24&RC[-11])&IF(RC[-10]="",,"|n"&R1C25&RC[-10])&IF(RC[-9]="",,"|n"&R1C26&RC[-9])&IF(RC[-8]="",,"|n"&R1C27&RC[-8])&IF(RC[-7]="",,"|n"&R1C28&RC[-7])&IF(RC[-6]="",,"|n"&R1C29&RC[-6])&IF(RC[-2]="",,"|n"&RC[-2]) -> 
AI594: =IF(RC[-27]&RC[-26]&RC[-25]&RC[-24]&RC[-23]&RC[-22]="",,R1C7)&IF(RC[-27]="",,"|n"&R1C8&RC[-27])&IF(RC[-26]="",,"|n"&R1C9&RC[-26])&IF(RC[-25]="",,"|n"&R1C10&RC[-25])&IF(RC[-24]="",,"|n"&R1C11&RC[-24])&IF(RC[-23]="",,"|n"&R1C12&RC[-23])&IF(RC[-22]="",,"|n"&R1C13&RC[-22])&IF(RC[-20]&RC[-19]&RC[-18]&RC[-17]="",,"|n"&R1C14)&IF(RC[-20]="",,"|n"&R1C15&RC[-20])&IF(RC[-19]="",,"|n"&R1C16&RC[-19])&IF(RC[-18]="",,"|n"&R1C17&RC[-18])&IF(RC[-17]="",,"|n"&R1C18&RC[-17])&IF(RC[-16]="",,"|n"&R1C19&RC[-16])&IF(RC[-15]="",,"|n"&R1C20&RC[-15])&IF(RC[-14]="",,"|n"&R1C21&RC[-14])&IF(RC[-13]="",,"|n"&R1C22&RC[-13])&IF(RC[-11]="",,"|n"&R1C24&RC[-11])&IF(RC[-10]="",,"|n"&R1C25&RC[-10])&IF(RC[-9]="",,"|n"&R1C26&RC[-9])&IF(RC[-8]="",,"|n"&R1C27&RC[-8])&IF(RC[-7]="",,"|n"&R1C28&RC[-7])&IF(RC[-6]="",,"|n"&R1C29&RC[-6])&IF(RC[-2]="",,"|n"&RC[-2]) -> 
AI595: =IF(RC[-27]&RC[-26]&RC[-25]&RC[-24]&RC[-23]&RC[-22]="",,R1C7)&IF(RC[-27]="",,"|n"&R1C8&RC[-27])&IF(RC[-26]="",,"|n"&R1C9&RC[-26])&IF(RC[-25]="",,"|n"&R1C10&RC[-25])&IF(RC[-24]="",,"|n"&R1C11&RC[-24])&IF(RC[-23]="",,"|n"&R1C12&RC[-23])&IF(RC[-22]="",,"|n"&R1C13&RC[-22])&IF(RC[-20]&RC[-19]&RC[-18]&RC[-17]="",,"|n"&R1C14)&IF(RC[-20]="",,"|n"&R1C15&RC[-20])&IF(RC[-19]="",,"|n"&R1C16&RC[-19])&IF(RC[-18]="",,"|n"&R1C17&RC[-18])&IF(RC[-17]="",,"|n"&R1C18&RC[-17])&IF(RC[-16]="",,"|n"&R1C19&RC[-16])&IF(RC[-15]="",,"|n"&R1C20&RC[-15])&IF(RC[-14]="",,"|n"&R1C21&RC[-14])&IF(RC[-13]="",,"|n"&R1C22&RC[-13])&IF(RC[-11]="",,"|n"&R1C24&RC[-11])&IF(RC[-10]="",,"|n"&R1C25&RC[-10])&IF(RC[-9]="",,"|n"&R1C26&RC[-9])&IF(RC[-8]="",,"|n"&R1C27&RC[-8])&IF(RC[-7]="",,"|n"&R1C28&RC[-7])&IF(RC[-6]="",,"|n"&R1C29&RC[-6])&IF(RC[-2]="",,"|n"&RC[-2]) -> 
AI596: =IF(RC[-27]&RC[-26]&RC[-25]&RC[-24]&RC[-23]&RC[-22]="",,R1C7)&IF(RC[-27]="",,"|n"&R1C8&RC[-27])&IF(RC[-26]="",,"|n"&R1C9&RC[-26])&IF(RC[-25]="",,"|n"&R1C10&RC[-25])&IF(RC[-24]="",,"|n"&R1C11&RC[-24])&IF(RC[-23]="",,"|n"&R1C12&RC[-23])&IF(RC[-22]="",,"|n"&R1C13&RC[-22])&IF(RC[-20]&RC[-19]&RC[-18]&RC[-17]="",,"|n"&R1C14)&IF(RC[-20]="",,"|n"&R1C15&RC[-20])&IF(RC[-19]="",,"|n"&R1C16&RC[-19])&IF(RC[-18]="",,"|n"&R1C17&RC[-18])&IF(RC[-17]="",,"|n"&R1C18&RC[-17])&IF(RC[-16]="",,"|n"&R1C19&RC[-16])&IF(RC[-15]="",,"|n"&R1C20&RC[-15])&IF(RC[-14]="",,"|n"&R1C21&RC[-14])&IF(RC[-13]="",,"|n"&R1C22&RC[-13])&IF(RC[-11]="",,"|n"&R1C24&RC[-11])&IF(RC[-10]="",,"|n"&R1C25&RC[-10])&IF(RC[-9]="",,"|n"&R1C26&RC[-9])&IF(RC[-8]="",,"|n"&R1C27&RC[-8])&IF(RC[-7]="",,"|n"&R1C28&RC[-7])&IF(RC[-6]="",,"|n"&R1C29&RC[-6])&IF(RC[-2]="",,"|n"&RC[-2]) -> 
AI597: =IF(RC[-27]&RC[-26]&RC[-25]&RC[-24]&RC[-23]&RC[-22]="",,R1C7)&IF(RC[-27]="",,"|n"&R1C8&RC[-27])&IF(RC[-26]="",,"|n"&R1C9&RC[-26])&IF(RC[-25]="",,"|n"&R1C10&RC[-25])&IF(RC[-24]="",,"|n"&R1C11&RC[-24])&IF(RC[-23]="",,"|n"&R1C12&RC[-23])&IF(RC[-22]="",,"|n"&R1C13&RC[-22])&IF(RC[-20]&RC[-19]&RC[-18]&RC[-17]="",,"|n"&R1C14)&IF(RC[-20]="",,"|n"&R1C15&RC[-20])&IF(RC[-19]="",,"|n"&R1C16&RC[-19])&IF(RC[-18]="",,"|n"&R1C17&RC[-18])&IF(RC[-17]="",,"|n"&R1C18&RC[-17])&IF(RC[-16]="",,"|n"&R1C19&RC[-16])&IF(RC[-15]="",,"|n"&R1C20&RC[-15])&IF(RC[-14]="",,"|n"&R1C21&RC[-14])&IF(RC[-13]="",,"|n"&R1C22&RC[-13])&IF(RC[-11]="",,"|n"&R1C24&RC[-11])&IF(RC[-10]="",,"|n"&R1C25&RC[-10])&IF(RC[-9]="",,"|n"&R1C26&RC[-9])&IF(RC[-8]="",,"|n"&R1C27&RC[-8])&IF(RC[-7]="",,"|n"&R1C28&RC[-7])&IF(RC[-6]="",,"|n"&R1C29&RC[-6])&IF(RC[-2]="",,"|n"&RC[-2]) -> 
AI598: =IF(RC[-27]&RC[-26]&RC[-25]&RC[-24]&RC[-23]&RC[-22]="",,R1C7)&IF(RC[-27]="",,"|n"&R1C8&RC[-27])&IF(RC[-26]="",,"|n"&R1C9&RC[-26])&IF(RC[-25]="",,"|n"&R1C10&RC[-25])&IF(RC[-24]="",,"|n"&R1C11&RC[-24])&IF(RC[-23]="",,"|n"&R1C12&RC[-23])&IF(RC[-22]="",,"|n"&R1C13&RC[-22])&IF(RC[-20]&RC[-19]&RC[-18]&RC[-17]="",,"|n"&R1C14)&IF(RC[-20]="",,"|n"&R1C15&RC[-20])&IF(RC[-19]="",,"|n"&R1C16&RC[-19])&IF(RC[-18]="",,"|n"&R1C17&RC[-18])&IF(RC[-17]="",,"|n"&R1C18&RC[-17])&IF(RC[-16]="",,"|n"&R1C19&RC[-16])&IF(RC[-15]="",,"|n"&R1C20&RC[-15])&IF(RC[-14]="",,"|n"&R1C21&RC[-14])&IF(RC[-13]="",,"|n"&R1C22&RC[-13])&IF(RC[-11]="",,"|n"&R1C24&RC[-11])&IF(RC[-10]="",,"|n"&R1C25&RC[-10])&IF(RC[-9]="",,"|n"&R1C26&RC[-9])&IF(RC[-8]="",,"|n"&R1C27&RC[-8])&IF(RC[-7]="",,"|n"&R1C28&RC[-7])&IF(RC[-6]="",,"|n"&R1C29&RC[-6])&IF(RC[-2]="",,"|n"&RC[-2]) -> 
AI599: =IF(RC[-27]&RC[-26]&RC[-25]&RC[-24]&RC[-23]&RC[-22]="",,R1C7)&IF(RC[-27]="",,"|n"&R1C8&RC[-27])&IF(RC[-26]="",,"|n"&R1C9&RC[-26])&IF(RC[-25]="",,"|n"&R1C10&RC[-25])&IF(RC[-24]="",,"|n"&R1C11&RC[-24])&IF(RC[-23]="",,"|n"&R1C12&RC[-23])&IF(RC[-22]="",,"|n"&R1C13&RC[-22])&IF(RC[-20]&RC[-19]&RC[-18]&RC[-17]="",,"|n"&R1C14)&IF(RC[-20]="",,"|n"&R1C15&RC[-20])&IF(RC[-19]="",,"|n"&R1C16&RC[-19])&IF(RC[-18]="",,"|n"&R1C17&RC[-18])&IF(RC[-17]="",,"|n"&R1C18&RC[-17])&IF(RC[-16]="",,"|n"&R1C19&RC[-16])&IF(RC[-15]="",,"|n"&R1C20&RC[-15])&IF(RC[-14]="",,"|n"&R1C21&RC[-14])&IF(RC[-13]="",,"|n"&R1C22&RC[-13])&IF(RC[-11]="",,"|n"&R1C24&RC[-11])&IF(RC[-10]="",,"|n"&R1C25&RC[-10])&IF(RC[-9]="",,"|n"&R1C26&RC[-9])&IF(RC[-8]="",,"|n"&R1C27&RC[-8])&IF(RC[-7]="",,"|n"&R1C28&RC[-7])&IF(RC[-6]="",,"|n"&R1C29&RC[-6])&IF(RC[-2]="",,"|n"&RC[-2]) -> 
AI600: =IF(RC[-27]&RC[-26]&RC[-25]&RC[-24]&RC[-23]&RC[-22]="",,R1C7)&IF(RC[-27]="",,"|n"&R1C8&RC[-27])&IF(RC[-26]="",,"|n"&R1C9&RC[-26])&IF(RC[-25]="",,"|n"&R1C10&RC[-25])&IF(RC[-24]="",,"|n"&R1C11&RC[-24])&IF(RC[-23]="",,"|n"&R1C12&RC[-23])&IF(RC[-22]="",,"|n"&R1C13&RC[-22])&IF(RC[-20]&RC[-19]&RC[-18]&RC[-17]="",,"|n"&R1C14)&IF(RC[-20]="",,"|n"&R1C15&RC[-20])&IF(RC[-19]="",,"|n"&R1C16&RC[-19])&IF(RC[-18]="",,"|n"&R1C17&RC[-18])&IF(RC[-17]="",,"|n"&R1C18&RC[-17])&IF(RC[-16]="",,"|n"&R1C19&RC[-16])&IF(RC[-15]="",,"|n"&R1C20&RC[-15])&IF(RC[-14]="",,"|n"&R1C21&RC[-14])&IF(RC[-13]="",,"|n"&R1C22&RC[-13])&IF(RC[-11]="",,"|n"&R1C24&RC[-11])&IF(RC[-10]="",,"|n"&R1C25&RC[-10])&IF(RC[-9]="",,"|n"&R1C26&RC[-9])&IF(RC[-8]="",,"|n"&R1C27&RC[-8])&IF(RC[-7]="",,"|n"&R1C28&RC[-7])&IF(RC[-6]="",,"|n"&R1C29&RC[-6])&IF(RC[-2]="",,"|n"&RC[-2]) -> 
AI601: =IF(RC[-27]&RC[-26]&RC[-25]&RC[-24]&RC[-23]&RC[-22]="",,R1C7)&IF(RC[-27]="",,"|n"&R1C8&RC[-27])&IF(RC[-26]="",,"|n"&R1C9&RC[-26])&IF(RC[-25]="",,"|n"&R1C10&RC[-25])&IF(RC[-24]="",,"|n"&R1C11&RC[-24])&IF(RC[-23]="",,"|n"&R1C12&RC[-23])&IF(RC[-22]="",,"|n"&R1C13&RC[-22])&IF(RC[-20]&RC[-19]&RC[-18]&RC[-17]="",,"|n"&R1C14)&IF(RC[-20]="",,"|n"&R1C15&RC[-20])&IF(RC[-19]="",,"|n"&R1C16&RC[-19])&IF(RC[-18]="",,"|n"&R1C17&RC[-18])&IF(RC[-17]="",,"|n"&R1C18&RC[-17])&IF(RC[-16]="",,"|n"&R1C19&RC[-16])&IF(RC[-15]="",,"|n"&R1C20&RC[-15])&IF(RC[-14]="",,"|n"&R1C21&RC[-14])&IF(RC[-13]="",,"|n"&R1C22&RC[-13])&IF(RC[-11]="",,"|n"&R1C24&RC[-11])&IF(RC[-10]="",,"|n"&R1C25&RC[-10])&IF(RC[-9]="",,"|n"&R1C26&RC[-9])&IF(RC[-8]="",,"|n"&R1C27&RC[-8])&IF(RC[-7]="",,"|n"&R1C28&RC[-7])&IF(RC[-6]="",,"|n"&R1C29&RC[-6])&IF(RC[-2]="",,"|n"&RC[-2]) -> 
AI602: =IF(RC[-27]&RC[-26]&RC[-25]&RC[-24]&RC[-23]&RC[-22]="",,R1C7)&IF(RC[-27]="",,"|n"&R1C8&RC[-27])&IF(RC[-26]="",,"|n"&R1C9&RC[-26])&IF(RC[-25]="",,"|n"&R1C10&RC[-25])&IF(RC[-24]="",,"|n"&R1C11&RC[-24])&IF(RC[-23]="",,"|n"&R1C12&RC[-23])&IF(RC[-22]="",,"|n"&R1C13&RC[-22])&IF(RC[-20]&RC[-19]&RC[-18]&RC[-17]="",,"|n"&R1C14)&IF(RC[-20]="",,"|n"&R1C15&RC[-20])&IF(RC[-19]="",,"|n"&R1C16&RC[-19])&IF(RC[-18]="",,"|n"&R1C17&RC[-18])&IF(RC[-17]="",,"|n"&R1C18&RC[-17])&IF(RC[-16]="",,"|n"&R1C19&RC[-16])&IF(RC[-15]="",,"|n"&R1C20&RC[-15])&IF(RC[-14]="",,"|n"&R1C21&RC[-14])&IF(RC[-13]="",,"|n"&R1C22&RC[-13])&IF(RC[-11]="",,"|n"&R1C24&RC[-11])&IF(RC[-10]="",,"|n"&R1C25&RC[-10])&IF(RC[-9]="",,"|n"&R1C26&RC[-9])&IF(RC[-8]="",,"|n"&R1C27&RC[-8])&IF(RC[-7]="",,"|n"&R1C28&RC[-7])&IF(RC[-6]="",,"|n"&R1C29&RC[-6])&IF(RC[-2]="",,"|n"&RC[-2]) -> 
AI603: =IF(RC[-27]&RC[-26]&RC[-25]&RC[-24]&RC[-23]&RC[-22]="",,R1C7)&IF(RC[-27]="",,"|n"&R1C8&RC[-27])&IF(RC[-26]="",,"|n"&R1C9&RC[-26])&IF(RC[-25]="",,"|n"&R1C10&RC[-25])&IF(RC[-24]="",,"|n"&R1C11&RC[-24])&IF(RC[-23]="",,"|n"&R1C12&RC[-23])&IF(RC[-22]="",,"|n"&R1C13&RC[-22])&IF(RC[-20]&RC[-19]&RC[-18]&RC[-17]="",,"|n"&R1C14)&IF(RC[-20]="",,"|n"&R1C15&RC[-20])&IF(RC[-19]="",,"|n"&R1C16&RC[-19])&IF(RC[-18]="",,"|n"&R1C17&RC[-18])&IF(RC[-17]="",,"|n"&R1C18&RC[-17])&IF(RC[-16]="",,"|n"&R1C19&RC[-16])&IF(RC[-15]="",,"|n"&R1C20&RC[-15])&IF(RC[-14]="",,"|n"&R1C21&RC[-14])&IF(RC[-13]="",,"|n"&R1C22&RC[-13])&IF(RC[-11]="",,"|n"&R1C24&RC[-11])&IF(RC[-10]="",,"|n"&R1C25&RC[-10])&IF(RC[-9]="",,"|n"&R1C26&RC[-9])&IF(RC[-8]="",,"|n"&R1C27&RC[-8])&IF(RC[-7]="",,"|n"&R1C28&RC[-7])&IF(RC[-6]="",,"|n"&R1C29&RC[-6])&IF(RC[-2]="",,"|n"&RC[-2]) -> 
AI604: =IF(RC[-27]&RC[-26]&RC[-25]&RC[-24]&RC[-23]&RC[-22]="",,R1C7)&IF(RC[-27]="",,"|n"&R1C8&RC[-27])&IF(RC[-26]="",,"|n"&R1C9&RC[-26])&IF(RC[-25]="",,"|n"&R1C10&RC[-25])&IF(RC[-24]="",,"|n"&R1C11&RC[-24])&IF(RC[-23]="",,"|n"&R1C12&RC[-23])&IF(RC[-22]="",,"|n"&R1C13&RC[-22])&IF(RC[-20]&RC[-19]&RC[-18]&RC[-17]="",,"|n"&R1C14)&IF(RC[-20]="",,"|n"&R1C15&RC[-20])&IF(RC[-19]="",,"|n"&R1C16&RC[-19])&IF(RC[-18]="",,"|n"&R1C17&RC[-18])&IF(RC[-17]="",,"|n"&R1C18&RC[-17])&IF(RC[-16]="",,"|n"&R1C19&RC[-16])&IF(RC[-15]="",,"|n"&R1C20&RC[-15])&IF(RC[-14]="",,"|n"&R1C21&RC[-14])&IF(RC[-13]="",,"|n"&R1C22&RC[-13])&IF(RC[-11]="",,"|n"&R1C24&RC[-11])&IF(RC[-10]="",,"|n"&R1C25&RC[-10])&IF(RC[-9]="",,"|n"&R1C26&RC[-9])&IF(RC[-8]="",,"|n"&R1C27&RC[-8])&IF(RC[-7]="",,"|n"&R1C28&RC[-7])&IF(RC[-6]="",,"|n"&R1C29&RC[-6])&IF(RC[-2]="",,"|n"&RC[-2]) -> 
AI605: =IF(RC[-27]&RC[-26]&RC[-25]&RC[-24]&RC[-23]&RC[-22]="",,R1C7)&IF(RC[-27]="",,"|n"&R1C8&RC[-27])&IF(RC[-26]="",,"|n"&R1C9&RC[-26])&IF(RC[-25]="",,"|n"&R1C10&RC[-25])&IF(RC[-24]="",,"|n"&R1C11&RC[-24])&IF(RC[-23]="",,"|n"&R1C12&RC[-23])&IF(RC[-22]="",,"|n"&R1C13&RC[-22])&IF(RC[-20]&RC[-19]&RC[-18]&RC[-17]="",,"|n"&R1C14)&IF(RC[-20]="",,"|n"&R1C15&RC[-20])&IF(RC[-19]="",,"|n"&R1C16&RC[-19])&IF(RC[-18]="",,"|n"&R1C17&RC[-18])&IF(RC[-17]="",,"|n"&R1C18&RC[-17])&IF(RC[-16]="",,"|n"&R1C19&RC[-16])&IF(RC[-15]="",,"|n"&R1C20&RC[-15])&IF(RC[-14]="",,"|n"&R1C21&RC[-14])&IF(RC[-13]="",,"|n"&R1C22&RC[-13])&IF(RC[-11]="",,"|n"&R1C24&RC[-11])&IF(RC[-10]="",,"|n"&R1C25&RC[-10])&IF(RC[-9]="",,"|n"&R1C26&RC[-9])&IF(RC[-8]="",,"|n"&R1C27&RC[-8])&IF(RC[-7]="",,"|n"&R1C28&RC[-7])&IF(RC[-6]="",,"|n"&R1C29&RC[-6])&IF(RC[-2]="",,"|n"&RC[-2]) -> 
AI606: =IF(RC[-27]&RC[-26]&RC[-25]&RC[-24]&RC[-23]&RC[-22]="",,R1C7)&IF(RC[-27]="",,"|n"&R1C8&RC[-27])&IF(RC[-26]="",,"|n"&R1C9&RC[-26])&IF(RC[-25]="",,"|n"&R1C10&RC[-25])&IF(RC[-24]="",,"|n"&R1C11&RC[-24])&IF(RC[-23]="",,"|n"&R1C12&RC[-23])&IF(RC[-22]="",,"|n"&R1C13&RC[-22])&IF(RC[-20]&RC[-19]&RC[-18]&RC[-17]="",,"|n"&R1C14)&IF(RC[-20]="",,"|n"&R1C15&RC[-20])&IF(RC[-19]="",,"|n"&R1C16&RC[-19])&IF(RC[-18]="",,"|n"&R1C17&RC[-18])&IF(RC[-17]="",,"|n"&R1C18&RC[-17])&IF(RC[-16]="",,"|n"&R1C19&RC[-16])&IF(RC[-15]="",,"|n"&R1C20&RC[-15])&IF(RC[-14]="",,"|n"&R1C21&RC[-14])&IF(RC[-13]="",,"|n"&R1C22&RC[-13])&IF(RC[-11]="",,"|n"&R1C24&RC[-11])&IF(RC[-10]="",,"|n"&R1C25&RC[-10])&IF(RC[-9]="",,"|n"&R1C26&RC[-9])&IF(RC[-8]="",,"|n"&R1C27&RC[-8])&IF(RC[-7]="",,"|n"&R1C28&RC[-7])&IF(RC[-6]="",,"|n"&R1C29&RC[-6])&IF(RC[-2]="",,"|n"&RC[-2]) -> 
AI607: =IF(RC[-27]&RC[-26]&RC[-25]&RC[-24]&RC[-23]&RC[-22]="",,R1C7)&IF(RC[-27]="",,"|n"&R1C8&RC[-27])&IF(RC[-26]="",,"|n"&R1C9&RC[-26])&IF(RC[-25]="",,"|n"&R1C10&RC[-25])&IF(RC[-24]="",,"|n"&R1C11&RC[-24])&IF(RC[-23]="",,"|n"&R1C12&RC[-23])&IF(RC[-22]="",,"|n"&R1C13&RC[-22])&IF(RC[-20]&RC[-19]&RC[-18]&RC[-17]="",,"|n"&R1C14)&IF(RC[-20]="",,"|n"&R1C15&RC[-20])&IF(RC[-19]="",,"|n"&R1C16&RC[-19])&IF(RC[-18]="",,"|n"&R1C17&RC[-18])&IF(RC[-17]="",,"|n"&R1C18&RC[-17])&IF(RC[-16]="",,"|n"&R1C19&RC[-16])&IF(RC[-15]="",,"|n"&R1C20&RC[-15])&IF(RC[-14]="",,"|n"&R1C21&RC[-14])&IF(RC[-13]="",,"|n"&R1C22&RC[-13])&IF(RC[-11]="",,"|n"&R1C24&RC[-11])&IF(RC[-10]="",,"|n"&R1C25&RC[-10])&IF(RC[-9]="",,"|n"&R1C26&RC[-9])&IF(RC[-8]="",,"|n"&R1C27&RC[-8])&IF(RC[-7]="",,"|n"&R1C28&RC[-7])&IF(RC[-6]="",,"|n"&R1C29&RC[-6])&IF(RC[-2]="",,"|n"&RC[-2]) -> 
AI608: =IF(RC[-27]&RC[-26]&RC[-25]&RC[-24]&RC[-23]&RC[-22]="",,R1C7)&IF(RC[-27]="",,"|n"&R1C8&RC[-27])&IF(RC[-26]="",,"|n"&R1C9&RC[-26])&IF(RC[-25]="",,"|n"&R1C10&RC[-25])&IF(RC[-24]="",,"|n"&R1C11&RC[-24])&IF(RC[-23]="",,"|n"&R1C12&RC[-23])&IF(RC[-22]="",,"|n"&R1C13&RC[-22])&IF(RC[-20]&RC[-19]&RC[-18]&RC[-17]="",,"|n"&R1C14)&IF(RC[-20]="",,"|n"&R1C15&RC[-20])&IF(RC[-19]="",,"|n"&R1C16&RC[-19])&IF(RC[-18]="",,"|n"&R1C17&RC[-18])&IF(RC[-17]="",,"|n"&R1C18&RC[-17])&IF(RC[-16]="",,"|n"&R1C19&RC[-16])&IF(RC[-15]="",,"|n"&R1C20&RC[-15])&IF(RC[-14]="",,"|n"&R1C21&RC[-14])&IF(RC[-13]="",,"|n"&R1C22&RC[-13])&IF(RC[-11]="",,"|n"&R1C24&RC[-11])&IF(RC[-10]="",,"|n"&R1C25&RC[-10])&IF(RC[-9]="",,"|n"&R1C26&RC[-9])&IF(RC[-8]="",,"|n"&R1C27&RC[-8])&IF(RC[-7]="",,"|n"&R1C28&RC[-7])&IF(RC[-6]="",,"|n"&R1C29&RC[-6])&IF(RC[-2]="",,"|n"&RC[-2]) -> 
AI609: =IF(RC[-27]&RC[-26]&RC[-25]&RC[-24]&RC[-23]&RC[-22]="",,R1C7)&IF(RC[-27]="",,"|n"&R1C8&RC[-27])&IF(RC[-26]="",,"|n"&R1C9&RC[-26])&IF(RC[-25]="",,"|n"&R1C10&RC[-25])&IF(RC[-24]="",,"|n"&R1C11&RC[-24])&IF(RC[-23]="",,"|n"&R1C12&RC[-23])&IF(RC[-22]="",,"|n"&R1C13&RC[-22])&IF(RC[-20]&RC[-19]&RC[-18]&RC[-17]="",,"|n"&R1C14)&IF(RC[-20]="",,"|n"&R1C15&RC[-20])&IF(RC[-19]="",,"|n"&R1C16&RC[-19])&IF(RC[-18]="",,"|n"&R1C17&RC[-18])&IF(RC[-17]="",,"|n"&R1C18&RC[-17])&IF(RC[-16]="",,"|n"&R1C19&RC[-16])&IF(RC[-15]="",,"|n"&R1C20&RC[-15])&IF(RC[-14]="",,"|n"&R1C21&RC[-14])&IF(RC[-13]="",,"|n"&R1C22&RC[-13])&IF(RC[-11]="",,"|n"&R1C24&RC[-11])&IF(RC[-10]="",,"|n"&R1C25&RC[-10])&IF(RC[-9]="",,"|n"&R1C26&RC[-9])&IF(RC[-8]="",,"|n"&R1C27&RC[-8])&IF(RC[-7]="",,"|n"&R1C28&RC[-7])&IF(RC[-6]="",,"|n"&R1C29&RC[-6])&IF(RC[-2]="",,"|n"&RC[-2]) -> 
AI610: =IF(RC[-27]&RC[-26]&RC[-25]&RC[-24]&RC[-23]&RC[-22]="",,R1C7)&IF(RC[-27]="",,"|n"&R1C8&RC[-27])&IF(RC[-26]="",,"|n"&R1C9&RC[-26])&IF(RC[-25]="",,"|n"&R1C10&RC[-25])&IF(RC[-24]="",,"|n"&R1C11&RC[-24])&IF(RC[-23]="",,"|n"&R1C12&RC[-23])&IF(RC[-22]="",,"|n"&R1C13&RC[-22])&IF(RC[-20]&RC[-19]&RC[-18]&RC[-17]="",,"|n"&R1C14)&IF(RC[-20]="",,"|n"&R1C15&RC[-20])&IF(RC[-19]="",,"|n"&R1C16&RC[-19])&IF(RC[-18]="",,"|n"&R1C17&RC[-18])&IF(RC[-17]="",,"|n"&R1C18&RC[-17])&IF(RC[-16]="",,"|n"&R1C19&RC[-16])&IF(RC[-15]="",,"|n"&R1C20&RC[-15])&IF(RC[-14]="",,"|n"&R1C21&RC[-14])&IF(RC[-13]="",,"|n"&R1C22&RC[-13])&IF(RC[-11]="",,"|n"&R1C24&RC[-11])&IF(RC[-10]="",,"|n"&R1C25&RC[-10])&IF(RC[-9]="",,"|n"&R1C26&RC[-9])&IF(RC[-8]="",,"|n"&R1C27&RC[-8])&IF(RC[-7]="",,"|n"&R1C28&RC[-7])&IF(RC[-6]="",,"|n"&R1C29&RC[-6])&IF(RC[-2]="",,"|n"&RC[-2]) -> 
AI611: =IF(RC[-27]&RC[-26]&RC[-25]&RC[-24]&RC[-23]&RC[-22]="",,R1C7)&IF(RC[-27]="",,"|n"&R1C8&RC[-27])&IF(RC[-26]="",,"|n"&R1C9&RC[-26])&IF(RC[-25]="",,"|n"&R1C10&RC[-25])&IF(RC[-24]="",,"|n"&R1C11&RC[-24])&IF(RC[-23]="",,"|n"&R1C12&RC[-23])&IF(RC[-22]="",,"|n"&R1C13&RC[-22])&IF(RC[-20]&RC[-19]&RC[-18]&RC[-17]="",,"|n"&R1C14)&IF(RC[-20]="",,"|n"&R1C15&RC[-20])&IF(RC[-19]="",,"|n"&R1C16&RC[-19])&IF(RC[-18]="",,"|n"&R1C17&RC[-18])&IF(RC[-17]="",,"|n"&R1C18&RC[-17])&IF(RC[-16]="",,"|n"&R1C19&RC[-16])&IF(RC[-15]="",,"|n"&R1C20&RC[-15])&IF(RC[-14]="",,"|n"&R1C21&RC[-14])&IF(RC[-13]="",,"|n"&R1C22&RC[-13])&IF(RC[-11]="",,"|n"&R1C24&RC[-11])&IF(RC[-10]="",,"|n"&R1C25&RC[-10])&IF(RC[-9]="",,"|n"&R1C26&RC[-9])&IF(RC[-8]="",,"|n"&R1C27&RC[-8])&IF(RC[-7]="",,"|n"&R1C28&RC[-7])&IF(RC[-6]="",,"|n"&R1C29&RC[-6])&IF(RC[-2]="",,"|n"&RC[-2]) -> 
AI612: =IF(RC[-27]&RC[-26]&RC[-25]&RC[-24]&RC[-23]&RC[-22]="",,R1C7)&IF(RC[-27]="",,"|n"&R1C8&RC[-27])&IF(RC[-26]="",,"|n"&R1C9&RC[-26])&IF(RC[-25]="",,"|n"&R1C10&RC[-25])&IF(RC[-24]="",,"|n"&R1C11&RC[-24])&IF(RC[-23]="",,"|n"&R1C12&RC[-23])&IF(RC[-22]="",,"|n"&R1C13&RC[-22])&IF(RC[-20]&RC[-19]&RC[-18]&RC[-17]="",,"|n"&R1C14)&IF(RC[-20]="",,"|n"&R1C15&RC[-20])&IF(RC[-19]="",,"|n"&R1C16&RC[-19])&IF(RC[-18]="",,"|n"&R1C17&RC[-18])&IF(RC[-17]="",,"|n"&R1C18&RC[-17])&IF(RC[-16]="",,"|n"&R1C19&RC[-16])&IF(RC[-15]="",,"|n"&R1C20&RC[-15])&IF(RC[-14]="",,"|n"&R1C21&RC[-14])&IF(RC[-13]="",,"|n"&R1C22&RC[-13])&IF(RC[-11]="",,"|n"&R1C24&RC[-11])&IF(RC[-10]="",,"|n"&R1C25&RC[-10])&IF(RC[-9]="",,"|n"&R1C26&RC[-9])&IF(RC[-8]="",,"|n"&R1C27&RC[-8])&IF(RC[-7]="",,"|n"&R1C28&RC[-7])&IF(RC[-6]="",,"|n"&R1C29&RC[-6])&IF(RC[-2]="",,"|n"&RC[-2]) -> 
AI613: =IF(RC[-27]&RC[-26]&RC[-25]&RC[-24]&RC[-23]&RC[-22]="",,R1C7)&IF(RC[-27]="",,"|n"&R1C8&RC[-27])&IF(RC[-26]="",,"|n"&R1C9&RC[-26])&IF(RC[-25]="",,"|n"&R1C10&RC[-25])&IF(RC[-24]="",,"|n"&R1C11&RC[-24])&IF(RC[-23]="",,"|n"&R1C12&RC[-23])&IF(RC[-22]="",,"|n"&R1C13&RC[-22])&IF(RC[-20]&RC[-19]&RC[-18]&RC[-17]="",,"|n"&R1C14)&IF(RC[-20]="",,"|n"&R1C15&RC[-20])&IF(RC[-19]="",,"|n"&R1C16&RC[-19])&IF(RC[-18]="",,"|n"&R1C17&RC[-18])&IF(RC[-17]="",,"|n"&R1C18&RC[-17])&IF(RC[-16]="",,"|n"&R1C19&RC[-16])&IF(RC[-15]="",,"|n"&R1C20&RC[-15])&IF(RC[-14]="",,"|n"&R1C21&RC[-14])&IF(RC[-13]="",,"|n"&R1C22&RC[-13])&IF(RC[-11]="",,"|n"&R1C24&RC[-11])&IF(RC[-10]="",,"|n"&R1C25&RC[-10])&IF(RC[-9]="",,"|n"&R1C26&RC[-9])&IF(RC[-8]="",,"|n"&R1C27&RC[-8])&IF(RC[-7]="",,"|n"&R1C28&RC[-7])&IF(RC[-6]="",,"|n"&R1C29&RC[-6])&IF(RC[-2]="",,"|n"&RC[-2]) -> 
AI614: =IF(RC[-27]&RC[-26]&RC[-25]&RC[-24]&RC[-23]&RC[-22]="",,R1C7)&IF(RC[-27]="",,"|n"&R1C8&RC[-27])&IF(RC[-26]="",,"|n"&R1C9&RC[-26])&IF(RC[-25]="",,"|n"&R1C10&RC[-25])&IF(RC[-24]="",,"|n"&R1C11&RC[-24])&IF(RC[-23]="",,"|n"&R1C12&RC[-23])&IF(RC[-22]="",,"|n"&R1C13&RC[-22])&IF(RC[-20]&RC[-19]&RC[-18]&RC[-17]="",,"|n"&R1C14)&IF(RC[-20]="",,"|n"&R1C15&RC[-20])&IF(RC[-19]="",,"|n"&R1C16&RC[-19])&IF(RC[-18]="",,"|n"&R1C17&RC[-18])&IF(RC[-17]="",,"|n"&R1C18&RC[-17])&IF(RC[-16]="",,"|n"&R1C19&RC[-16])&IF(RC[-15]="",,"|n"&R1C20&RC[-15])&IF(RC[-14]="",,"|n"&R1C21&RC[-14])&IF(RC[-13]="",,"|n"&R1C22&RC[-13])&IF(RC[-11]="",,"|n"&R1C24&RC[-11])&IF(RC[-10]="",,"|n"&R1C25&RC[-10])&IF(RC[-9]="",,"|n"&R1C26&RC[-9])&IF(RC[-8]="",,"|n"&R1C27&RC[-8])&IF(RC[-7]="",,"|n"&R1C28&RC[-7])&IF(RC[-6]="",,"|n"&R1C29&RC[-6])&IF(RC[-2]="",,"|n"&RC[-2]) -> 
AI615: =IF(RC[-27]&RC[-26]&RC[-25]&RC[-24]&RC[-23]&RC[-22]="",,R1C7)&IF(RC[-27]="",,"|n"&R1C8&RC[-27])&IF(RC[-26]="",,"|n"&R1C9&RC[-26])&IF(RC[-25]="",,"|n"&R1C10&RC[-25])&IF(RC[-24]="",,"|n"&R1C11&RC[-24])&IF(RC[-23]="",,"|n"&R1C12&RC[-23])&IF(RC[-22]="",,"|n"&R1C13&RC[-22])&IF(RC[-20]&RC[-19]&RC[-18]&RC[-17]="",,"|n"&R1C14)&IF(RC[-20]="",,"|n"&R1C15&RC[-20])&IF(RC[-19]="",,"|n"&R1C16&RC[-19])&IF(RC[-18]="",,"|n"&R1C17&RC[-18])&IF(RC[-17]="",,"|n"&R1C18&RC[-17])&IF(RC[-16]="",,"|n"&R1C19&RC[-16])&IF(RC[-15]="",,"|n"&R1C20&RC[-15])&IF(RC[-14]="",,"|n"&R1C21&RC[-14])&IF(RC[-13]="",,"|n"&R1C22&RC[-13])&IF(RC[-11]="",,"|n"&R1C24&RC[-11])&IF(RC[-10]="",,"|n"&R1C25&RC[-10])&IF(RC[-9]="",,"|n"&R1C26&RC[-9])&IF(RC[-8]="",,"|n"&R1C27&RC[-8])&IF(RC[-7]="",,"|n"&R1C28&RC[-7])&IF(RC[-6]="",,"|n"&R1C29&RC[-6])&IF(RC[-2]="",,"|n"&RC[-2]) -> 
AI616: =IF(RC[-27]&RC[-26]&RC[-25]&RC[-24]&RC[-23]&RC[-22]="",,R1C7)&IF(RC[-27]="",,"|n"&R1C8&RC[-27])&IF(RC[-26]="",,"|n"&R1C9&RC[-26])&IF(RC[-25]="",,"|n"&R1C10&RC[-25])&IF(RC[-24]="",,"|n"&R1C11&RC[-24])&IF(RC[-23]="",,"|n"&R1C12&RC[-23])&IF(RC[-22]="",,"|n"&R1C13&RC[-22])&IF(RC[-20]&RC[-19]&RC[-18]&RC[-17]="",,"|n"&R1C14)&IF(RC[-20]="",,"|n"&R1C15&RC[-20])&IF(RC[-19]="",,"|n"&R1C16&RC[-19])&IF(RC[-18]="",,"|n"&R1C17&RC[-18])&IF(RC[-17]="",,"|n"&R1C18&RC[-17])&IF(RC[-16]="",,"|n"&R1C19&RC[-16])&IF(RC[-15]="",,"|n"&R1C20&RC[-15])&IF(RC[-14]="",,"|n"&R1C21&RC[-14])&IF(RC[-13]="",,"|n"&R1C22&RC[-13])&IF(RC[-11]="",,"|n"&R1C24&RC[-11])&IF(RC[-10]="",,"|n"&R1C25&RC[-10])&IF(RC[-9]="",,"|n"&R1C26&RC[-9])&IF(RC[-8]="",,"|n"&R1C27&RC[-8])&IF(RC[-7]="",,"|n"&R1C28&RC[-7])&IF(RC[-6]="",,"|n"&R1C29&RC[-6])&IF(RC[-2]="",,"|n"&RC[-2]) -> 
AI617: =IF(RC[-27]&RC[-26]&RC[-25]&RC[-24]&RC[-23]&RC[-22]="",,R1C7)&IF(RC[-27]="",,"|n"&R1C8&RC[-27])&IF(RC[-26]="",,"|n"&R1C9&RC[-26])&IF(RC[-25]="",,"|n"&R1C10&RC[-25])&IF(RC[-24]="",,"|n"&R1C11&RC[-24])&IF(RC[-23]="",,"|n"&R1C12&RC[-23])&IF(RC[-22]="",,"|n"&R1C13&RC[-22])&IF(RC[-20]&RC[-19]&RC[-18]&RC[-17]="",,"|n"&R1C14)&IF(RC[-20]="",,"|n"&R1C15&RC[-20])&IF(RC[-19]="",,"|n"&R1C16&RC[-19])&IF(RC[-18]="",,"|n"&R1C17&RC[-18])&IF(RC[-17]="",,"|n"&R1C18&RC[-17])&IF(RC[-16]="",,"|n"&R1C19&RC[-16])&IF(RC[-15]="",,"|n"&R1C20&RC[-15])&IF(RC[-14]="",,"|n"&R1C21&RC[-14])&IF(RC[-13]="",,"|n"&R1C22&RC[-13])&IF(RC[-11]="",,"|n"&R1C24&RC[-11])&IF(RC[-10]="",,"|n"&R1C25&RC[-10])&IF(RC[-9]="",,"|n"&R1C26&RC[-9])&IF(RC[-8]="",,"|n"&R1C27&RC[-8])&IF(RC[-7]="",,"|n"&R1C28&RC[-7])&IF(RC[-6]="",,"|n"&R1C29&RC[-6])&IF(RC[-2]="",,"|n"&RC[-2]) -> 
AI618: =IF(RC[-27]&RC[-26]&RC[-25]&RC[-24]&RC[-23]&RC[-22]="",,R1C7)&IF(RC[-27]="",,"|n"&R1C8&RC[-27])&IF(RC[-26]="",,"|n"&R1C9&RC[-26])&IF(RC[-25]="",,"|n"&R1C10&RC[-25])&IF(RC[-24]="",,"|n"&R1C11&RC[-24])&IF(RC[-23]="",,"|n"&R1C12&RC[-23])&IF(RC[-22]="",,"|n"&R1C13&RC[-22])&IF(RC[-20]&RC[-19]&RC[-18]&RC[-17]="",,"|n"&R1C14)&IF(RC[-20]="",,"|n"&R1C15&RC[-20])&IF(RC[-19]="",,"|n"&R1C16&RC[-19])&IF(RC[-18]="",,"|n"&R1C17&RC[-18])&IF(RC[-17]="",,"|n"&R1C18&RC[-17])&IF(RC[-16]="",,"|n"&R1C19&RC[-16])&IF(RC[-15]="",,"|n"&R1C20&RC[-15])&IF(RC[-14]="",,"|n"&R1C21&RC[-14])&IF(RC[-13]="",,"|n"&R1C22&RC[-13])&IF(RC[-11]="",,"|n"&R1C24&RC[-11])&IF(RC[-10]="",,"|n"&R1C25&RC[-10])&IF(RC[-9]="",,"|n"&R1C26&RC[-9])&IF(RC[-8]="",,"|n"&R1C27&RC[-8])&IF(RC[-7]="",,"|n"&R1C28&RC[-7])&IF(RC[-6]="",,"|n"&R1C29&RC[-6])&IF(RC[-2]="",,"|n"&RC[-2]) -> 
AI619: =IF(RC[-27]&RC[-26]&RC[-25]&RC[-24]&RC[-23]&RC[-22]="",,R1C7)&IF(RC[-27]="",,"|n"&R1C8&RC[-27])&IF(RC[-26]="",,"|n"&R1C9&RC[-26])&IF(RC[-25]="",,"|n"&R1C10&RC[-25])&IF(RC[-24]="",,"|n"&R1C11&RC[-24])&IF(RC[-23]="",,"|n"&R1C12&RC[-23])&IF(RC[-22]="",,"|n"&R1C13&RC[-22])&IF(RC[-20]&RC[-19]&RC[-18]&RC[-17]="",,"|n"&R1C14)&IF(RC[-20]="",,"|n"&R1C15&RC[-20])&IF(RC[-19]="",,"|n"&R1C16&RC[-19])&IF(RC[-18]="",,"|n"&R1C17&RC[-18])&IF(RC[-17]="",,"|n"&R1C18&RC[-17])&IF(RC[-16]="",,"|n"&R1C19&RC[-16])&IF(RC[-15]="",,"|n"&R1C20&RC[-15])&IF(RC[-14]="",,"|n"&R1C21&RC[-14])&IF(RC[-13]="",,"|n"&R1C22&RC[-13])&IF(RC[-11]="",,"|n"&R1C24&RC[-11])&IF(RC[-10]="",,"|n"&R1C25&RC[-10])&IF(RC[-9]="",,"|n"&R1C26&RC[-9])&IF(RC[-8]="",,"|n"&R1C27&RC[-8])&IF(RC[-7]="",,"|n"&R1C28&RC[-7])&IF(RC[-6]="",,"|n"&R1C29&RC[-6])&IF(RC[-2]="",,"|n"&RC[-2]) -> 
AI620: =IF(RC[-27]&RC[-26]&RC[-25]&RC[-24]&RC[-23]&RC[-22]="",,R1C7)&IF(RC[-27]="",,"|n"&R1C8&RC[-27])&IF(RC[-26]="",,"|n"&R1C9&RC[-26])&IF(RC[-25]="",,"|n"&R1C10&RC[-25])&IF(RC[-24]="",,"|n"&R1C11&RC[-24])&IF(RC[-23]="",,"|n"&R1C12&RC[-23])&IF(RC[-22]="",,"|n"&R1C13&RC[-22])&IF(RC[-20]&RC[-19]&RC[-18]&RC[-17]="",,"|n"&R1C14)&IF(RC[-20]="",,"|n"&R1C15&RC[-20])&IF(RC[-19]="",,"|n"&R1C16&RC[-19])&IF(RC[-18]="",,"|n"&R1C17&RC[-18])&IF(RC[-17]="",,"|n"&R1C18&RC[-17])&IF(RC[-16]="",,"|n"&R1C19&RC[-16])&IF(RC[-15]="",,"|n"&R1C20&RC[-15])&IF(RC[-14]="",,"|n"&R1C21&RC[-14])&IF(RC[-13]="",,"|n"&R1C22&RC[-13])&IF(RC[-11]="",,"|n"&R1C24&RC[-11])&IF(RC[-10]="",,"|n"&R1C25&RC[-10])&IF(RC[-9]="",,"|n"&R1C26&RC[-9])&IF(RC[-8]="",,"|n"&R1C27&RC[-8])&IF(RC[-7]="",,"|n"&R1C28&RC[-7])&IF(RC[-6]="",,"|n"&R1C29&RC[-6])&IF(RC[-2]="",,"|n"&RC[-2]) -> 
AI621: =IF(RC[-27]&RC[-26]&RC[-25]&RC[-24]&RC[-23]&RC[-22]="",,R1C7)&IF(RC[-27]="",,"|n"&R1C8&RC[-27])&IF(RC[-26]="",,"|n"&R1C9&RC[-26])&IF(RC[-25]="",,"|n"&R1C10&RC[-25])&IF(RC[-24]="",,"|n"&R1C11&RC[-24])&IF(RC[-23]="",,"|n"&R1C12&RC[-23])&IF(RC[-22]="",,"|n"&R1C13&RC[-22])&IF(RC[-20]&RC[-19]&RC[-18]&RC[-17]="",,"|n"&R1C14)&IF(RC[-20]="",,"|n"&R1C15&RC[-20])&IF(RC[-19]="",,"|n"&R1C16&RC[-19])&IF(RC[-18]="",,"|n"&R1C17&RC[-18])&IF(RC[-17]="",,"|n"&R1C18&RC[-17])&IF(RC[-16]="",,"|n"&R1C19&RC[-16])&IF(RC[-15]="",,"|n"&R1C20&RC[-15])&IF(RC[-14]="",,"|n"&R1C21&RC[-14])&IF(RC[-13]="",,"|n"&R1C22&RC[-13])&IF(RC[-11]="",,"|n"&R1C24&RC[-11])&IF(RC[-10]="",,"|n"&R1C25&RC[-10])&IF(RC[-9]="",,"|n"&R1C26&RC[-9])&IF(RC[-8]="",,"|n"&R1C27&RC[-8])&IF(RC[-7]="",,"|n"&R1C28&RC[-7])&IF(RC[-6]="",,"|n"&R1C29&RC[-6])&IF(RC[-2]="",,"|n"&RC[-2]) -> 
AI622: =IF(RC[-27]&RC[-26]&RC[-25]&RC[-24]&RC[-23]&RC[-22]="",,R1C7)&IF(RC[-27]="",,"|n"&R1C8&RC[-27])&IF(RC[-26]="",,"|n"&R1C9&RC[-26])&IF(RC[-25]="",,"|n"&R1C10&RC[-25])&IF(RC[-24]="",,"|n"&R1C11&RC[-24])&IF(RC[-23]="",,"|n"&R1C12&RC[-23])&IF(RC[-22]="",,"|n"&R1C13&RC[-22])&IF(RC[-20]&RC[-19]&RC[-18]&RC[-17]="",,"|n"&R1C14)&IF(RC[-20]="",,"|n"&R1C15&RC[-20])&IF(RC[-19]="",,"|n"&R1C16&RC[-19])&IF(RC[-18]="",,"|n"&R1C17&RC[-18])&IF(RC[-17]="",,"|n"&R1C18&RC[-17])&IF(RC[-16]="",,"|n"&R1C19&RC[-16])&IF(RC[-15]="",,"|n"&R1C20&RC[-15])&IF(RC[-14]="",,"|n"&R1C21&RC[-14])&IF(RC[-13]="",,"|n"&R1C22&RC[-13])&IF(RC[-11]="",,"|n"&R1C24&RC[-11])&IF(RC[-10]="",,"|n"&R1C25&RC[-10])&IF(RC[-9]="",,"|n"&R1C26&RC[-9])&IF(RC[-8]="",,"|n"&R1C27&RC[-8])&IF(RC[-7]="",,"|n"&R1C28&RC[-7])&IF(RC[-6]="",,"|n"&R1C29&RC[-6])&IF(RC[-2]="",,"|n"&RC[-2]) -> 
AI623: =IF(RC[-27]&RC[-26]&RC[-25]&RC[-24]&RC[-23]&RC[-22]="",,R1C7)&IF(RC[-27]="",,"|n"&R1C8&RC[-27])&IF(RC[-26]="",,"|n"&R1C9&RC[-26])&IF(RC[-25]="",,"|n"&R1C10&RC[-25])&IF(RC[-24]="",,"|n"&R1C11&RC[-24])&IF(RC[-23]="",,"|n"&R1C12&RC[-23])&IF(RC[-22]="",,"|n"&R1C13&RC[-22])&IF(RC[-20]&RC[-19]&RC[-18]&RC[-17]="",,"|n"&R1C14)&IF(RC[-20]="",,"|n"&R1C15&RC[-20])&IF(RC[-19]="",,"|n"&R1C16&RC[-19])&IF(RC[-18]="",,"|n"&R1C17&RC[-18])&IF(RC[-17]="",,"|n"&R1C18&RC[-17])&IF(RC[-16]="",,"|n"&R1C19&RC[-16])&IF(RC[-15]="",,"|n"&R1C20&RC[-15])&IF(RC[-14]="",,"|n"&R1C21&RC[-14])&IF(RC[-13]="",,"|n"&R1C22&RC[-13])&IF(RC[-11]="",,"|n"&R1C24&RC[-11])&IF(RC[-10]="",,"|n"&R1C25&RC[-10])&IF(RC[-9]="",,"|n"&R1C26&RC[-9])&IF(RC[-8]="",,"|n"&R1C27&RC[-8])&IF(RC[-7]="",,"|n"&R1C28&RC[-7])&IF(RC[-6]="",,"|n"&R1C29&RC[-6])&IF(RC[-2]="",,"|n"&RC[-2]) -> 
AI624: =IF(RC[-27]&RC[-26]&RC[-25]&RC[-24]&RC[-23]&RC[-22]="",,R1C7)&IF(RC[-27]="",,"|n"&R1C8&RC[-27])&IF(RC[-26]="",,"|n"&R1C9&RC[-26])&IF(RC[-25]="",,"|n"&R1C10&RC[-25])&IF(RC[-24]="",,"|n"&R1C11&RC[-24])&IF(RC[-23]="",,"|n"&R1C12&RC[-23])&IF(RC[-22]="",,"|n"&R1C13&RC[-22])&IF(RC[-20]&RC[-19]&RC[-18]&RC[-17]="",,"|n"&R1C14)&IF(RC[-20]="",,"|n"&R1C15&RC[-20])&IF(RC[-19]="",,"|n"&R1C16&RC[-19])&IF(RC[-18]="",,"|n"&R1C17&RC[-18])&IF(RC[-17]="",,"|n"&R1C18&RC[-17])&IF(RC[-16]="",,"|n"&R1C19&RC[-16])&IF(RC[-15]="",,"|n"&R1C20&RC[-15])&IF(RC[-14]="",,"|n"&R1C21&RC[-14])&IF(RC[-13]="",,"|n"&R1C22&RC[-13])&IF(RC[-11]="",,"|n"&R1C24&RC[-11])&IF(RC[-10]="",,"|n"&R1C25&RC[-10])&IF(RC[-9]="",,"|n"&R1C26&RC[-9])&IF(RC[-8]="",,"|n"&R1C27&RC[-8])&IF(RC[-7]="",,"|n"&R1C28&RC[-7])&IF(RC[-6]="",,"|n"&R1C29&RC[-6])&IF(RC[-2]="",,"|n"&RC[-2]) -> 
AI625: =IF(RC[-27]&RC[-26]&RC[-25]&RC[-24]&RC[-23]&RC[-22]="",,R1C7)&IF(RC[-27]="",,"|n"&R1C8&RC[-27])&IF(RC[-26]="",,"|n"&R1C9&RC[-26])&IF(RC[-25]="",,"|n"&R1C10&RC[-25])&IF(RC[-24]="",,"|n"&R1C11&RC[-24])&IF(RC[-23]="",,"|n"&R1C12&RC[-23])&IF(RC[-22]="",,"|n"&R1C13&RC[-22])&IF(RC[-20]&RC[-19]&RC[-18]&RC[-17]="",,"|n"&R1C14)&IF(RC[-20]="",,"|n"&R1C15&RC[-20])&IF(RC[-19]="",,"|n"&R1C16&RC[-19])&IF(RC[-18]="",,"|n"&R1C17&RC[-18])&IF(RC[-17]="",,"|n"&R1C18&RC[-17])&IF(RC[-16]="",,"|n"&R1C19&RC[-16])&IF(RC[-15]="",,"|n"&R1C20&RC[-15])&IF(RC[-14]="",,"|n"&R1C21&RC[-14])&IF(RC[-13]="",,"|n"&R1C22&RC[-13])&IF(RC[-11]="",,"|n"&R1C24&RC[-11])&IF(RC[-10]="",,"|n"&R1C25&RC[-10])&IF(RC[-9]="",,"|n"&R1C26&RC[-9])&IF(RC[-8]="",,"|n"&R1C27&RC[-8])&IF(RC[-7]="",,"|n"&R1C28&RC[-7])&IF(RC[-6]="",,"|n"&R1C29&RC[-6])&IF(RC[-2]="",,"|n"&RC[-2]) -> 
AI626: =IF(RC[-27]&RC[-26]&RC[-25]&RC[-24]&RC[-23]&RC[-22]="",,R1C7)&IF(RC[-27]="",,"|n"&R1C8&RC[-27])&IF(RC[-26]="",,"|n"&R1C9&RC[-26])&IF(RC[-25]="",,"|n"&R1C10&RC[-25])&IF(RC[-24]="",,"|n"&R1C11&RC[-24])&IF(RC[-23]="",,"|n"&R1C12&RC[-23])&IF(RC[-22]="",,"|n"&R1C13&RC[-22])&IF(RC[-20]&RC[-19]&RC[-18]&RC[-17]="",,"|n"&R1C14)&IF(RC[-20]="",,"|n"&R1C15&RC[-20])&IF(RC[-19]="",,"|n"&R1C16&RC[-19])&IF(RC[-18]="",,"|n"&R1C17&RC[-18])&IF(RC[-17]="",,"|n"&R1C18&RC[-17])&IF(RC[-16]="",,"|n"&R1C19&RC[-16])&IF(RC[-15]="",,"|n"&R1C20&RC[-15])&IF(RC[-14]="",,"|n"&R1C21&RC[-14])&IF(RC[-13]="",,"|n"&R1C22&RC[-13])&IF(RC[-11]="",,"|n"&R1C24&RC[-11])&IF(RC[-10]="",,"|n"&R1C25&RC[-10])&IF(RC[-9]="",,"|n"&R1C26&RC[-9])&IF(RC[-8]="",,"|n"&R1C27&RC[-8])&IF(RC[-7]="",,"|n"&R1C28&RC[-7])&IF(RC[-6]="",,"|n"&R1C29&RC[-6])&IF(RC[-2]="",,"|n"&RC[-2]) -> 
AI627: =IF(RC[-27]&RC[-26]&RC[-25]&RC[-24]&RC[-23]&RC[-22]="",,R1C7)&IF(RC[-27]="",,"|n"&R1C8&RC[-27])&IF(RC[-26]="",,"|n"&R1C9&RC[-26])&IF(RC[-25]="",,"|n"&R1C10&RC[-25])&IF(RC[-24]="",,"|n"&R1C11&RC[-24])&IF(RC[-23]="",,"|n"&R1C12&RC[-23])&IF(RC[-22]="",,"|n"&R1C13&RC[-22])&IF(RC[-20]&RC[-19]&RC[-18]&RC[-17]="",,"|n"&R1C14)&IF(RC[-20]="",,"|n"&R1C15&RC[-20])&IF(RC[-19]="",,"|n"&R1C16&RC[-19])&IF(RC[-18]="",,"|n"&R1C17&RC[-18])&IF(RC[-17]="",,"|n"&R1C18&RC[-17])&IF(RC[-16]="",,"|n"&R1C19&RC[-16])&IF(RC[-15]="",,"|n"&R1C20&RC[-15])&IF(RC[-14]="",,"|n"&R1C21&RC[-14])&IF(RC[-13]="",,"|n"&R1C22&RC[-13])&IF(RC[-11]="",,"|n"&R1C24&RC[-11])&IF(RC[-10]="",,"|n"&R1C25&RC[-10])&IF(RC[-9]="",,"|n"&R1C26&RC[-9])&IF(RC[-8]="",,"|n"&R1C27&RC[-8])&IF(RC[-7]="",,"|n"&R1C28&RC[-7])&IF(RC[-6]="",,"|n"&R1C29&RC[-6])&IF(RC[-2]="",,"|n"&RC[-2]) -> 
AI628: =IF(RC[-27]&RC[-26]&RC[-25]&RC[-24]&RC[-23]&RC[-22]="",,R1C7)&IF(RC[-27]="",,"|n"&R1C8&RC[-27])&IF(RC[-26]="",,"|n"&R1C9&RC[-26])&IF(RC[-25]="",,"|n"&R1C10&RC[-25])&IF(RC[-24]="",,"|n"&R1C11&RC[-24])&IF(RC[-23]="",,"|n"&R1C12&RC[-23])&IF(RC[-22]="",,"|n"&R1C13&RC[-22])&IF(RC[-20]&RC[-19]&RC[-18]&RC[-17]="",,"|n"&R1C14)&IF(RC[-20]="",,"|n"&R1C15&RC[-20])&IF(RC[-19]="",,"|n"&R1C16&RC[-19])&IF(RC[-18]="",,"|n"&R1C17&RC[-18])&IF(RC[-17]="",,"|n"&R1C18&RC[-17])&IF(RC[-16]="",,"|n"&R1C19&RC[-16])&IF(RC[-15]="",,"|n"&R1C20&RC[-15])&IF(RC[-14]="",,"|n"&R1C21&RC[-14])&IF(RC[-13]="",,"|n"&R1C22&RC[-13])&IF(RC[-11]="",,"|n"&R1C24&RC[-11])&IF(RC[-10]="",,"|n"&R1C25&RC[-10])&IF(RC[-9]="",,"|n"&R1C26&RC[-9])&IF(RC[-8]="",,"|n"&R1C27&RC[-8])&IF(RC[-7]="",,"|n"&R1C28&RC[-7])&IF(RC[-6]="",,"|n"&R1C29&RC[-6])&IF(RC[-2]="",,"|n"&RC[-2]) -> 
AI629: =IF(RC[-27]&RC[-26]&RC[-25]&RC[-24]&RC[-23]&RC[-22]="",,R1C7)&IF(RC[-27]="",,"|n"&R1C8&RC[-27])&IF(RC[-26]="",,"|n"&R1C9&RC[-26])&IF(RC[-25]="",,"|n"&R1C10&RC[-25])&IF(RC[-24]="",,"|n"&R1C11&RC[-24])&IF(RC[-23]="",,"|n"&R1C12&RC[-23])&IF(RC[-22]="",,"|n"&R1C13&RC[-22])&IF(RC[-20]&RC[-19]&RC[-18]&RC[-17]="",,"|n"&R1C14)&IF(RC[-20]="",,"|n"&R1C15&RC[-20])&IF(RC[-19]="",,"|n"&R1C16&RC[-19])&IF(RC[-18]="",,"|n"&R1C17&RC[-18])&IF(RC[-17]="",,"|n"&R1C18&RC[-17])&IF(RC[-16]="",,"|n"&R1C19&RC[-16])&IF(RC[-15]="",,"|n"&R1C20&RC[-15])&IF(RC[-14]="",,"|n"&R1C21&RC[-14])&IF(RC[-13]="",,"|n"&R1C22&RC[-13])&IF(RC[-11]="",,"|n"&R1C24&RC[-11])&IF(RC[-10]="",,"|n"&R1C25&RC[-10])&IF(RC[-9]="",,"|n"&R1C26&RC[-9])&IF(RC[-8]="",,"|n"&R1C27&RC[-8])&IF(RC[-7]="",,"|n"&R1C28&RC[-7])&IF(RC[-6]="",,"|n"&R1C29&RC[-6])&IF(RC[-2]="",,"|n"&RC[-2]) -> 
AI630: =IF(RC[-27]&RC[-26]&RC[-25]&RC[-24]&RC[-23]&RC[-22]="",,R1C7)&IF(RC[-27]="",,"|n"&R1C8&RC[-27])&IF(RC[-26]="",,"|n"&R1C9&RC[-26])&IF(RC[-25]="",,"|n"&R1C10&RC[-25])&IF(RC[-24]="",,"|n"&R1C11&RC[-24])&IF(RC[-23]="",,"|n"&R1C12&RC[-23])&IF(RC[-22]="",,"|n"&R1C13&RC[-22])&IF(RC[-20]&RC[-19]&RC[-18]&RC[-17]="",,"|n"&R1C14)&IF(RC[-20]="",,"|n"&R1C15&RC[-20])&IF(RC[-19]="",,"|n"&R1C16&RC[-19])&IF(RC[-18]="",,"|n"&R1C17&RC[-18])&IF(RC[-17]="",,"|n"&R1C18&RC[-17])&IF(RC[-16]="",,"|n"&R1C19&RC[-16])&IF(RC[-15]="",,"|n"&R1C20&RC[-15])&IF(RC[-14]="",,"|n"&R1C21&RC[-14])&IF(RC[-13]="",,"|n"&R1C22&RC[-13])&IF(RC[-11]="",,"|n"&R1C24&RC[-11])&IF(RC[-10]="",,"|n"&R1C25&RC[-10])&IF(RC[-9]="",,"|n"&R1C26&RC[-9])&IF(RC[-8]="",,"|n"&R1C27&RC[-8])&IF(RC[-7]="",,"|n"&R1C28&RC[-7])&IF(RC[-6]="",,"|n"&R1C29&RC[-6])&IF(RC[-2]="",,"|n"&RC[-2]) -> 
AI631: =IF(RC[-27]&RC[-26]&RC[-25]&RC[-24]&RC[-23]&RC[-22]="",,R1C7)&IF(RC[-27]="",,"|n"&R1C8&RC[-27])&IF(RC[-26]="",,"|n"&R1C9&RC[-26])&IF(RC[-25]="",,"|n"&R1C10&RC[-25])&IF(RC[-24]="",,"|n"&R1C11&RC[-24])&IF(RC[-23]="",,"|n"&R1C12&RC[-23])&IF(RC[-22]="",,"|n"&R1C13&RC[-22])&IF(RC[-20]&RC[-19]&RC[-18]&RC[-17]="",,"|n"&R1C14)&IF(RC[-20]="",,"|n"&R1C15&RC[-20])&IF(RC[-19]="",,"|n"&R1C16&RC[-19])&IF(RC[-18]="",,"|n"&R1C17&RC[-18])&IF(RC[-17]="",,"|n"&R1C18&RC[-17])&IF(RC[-16]="",,"|n"&R1C19&RC[-16])&IF(RC[-15]="",,"|n"&R1C20&RC[-15])&IF(RC[-14]="",,"|n"&R1C21&RC[-14])&IF(RC[-13]="",,"|n"&R1C22&RC[-13])&IF(RC[-11]="",,"|n"&R1C24&RC[-11])&IF(RC[-10]="",,"|n"&R1C25&RC[-10])&IF(RC[-9]="",,"|n"&R1C26&RC[-9])&IF(RC[-8]="",,"|n"&R1C27&RC[-8])&IF(RC[-7]="",,"|n"&R1C28&RC[-7])&IF(RC[-6]="",,"|n"&R1C29&RC[-6])&IF(RC[-2]="",,"|n"&RC[-2]) -> 
AI632: =IF(RC[-27]&RC[-26]&RC[-25]&RC[-24]&RC[-23]&RC[-22]="",,R1C7)&IF(RC[-27]="",,"|n"&R1C8&RC[-27])&IF(RC[-26]="",,"|n"&R1C9&RC[-26])&IF(RC[-25]="",,"|n"&R1C10&RC[-25])&IF(RC[-24]="",,"|n"&R1C11&RC[-24])&IF(RC[-23]="",,"|n"&R1C12&RC[-23])&IF(RC[-22]="",,"|n"&R1C13&RC[-22])&IF(RC[-20]&RC[-19]&RC[-18]&RC[-17]="",,"|n"&R1C14)&IF(RC[-20]="",,"|n"&R1C15&RC[-20])&IF(RC[-19]="",,"|n"&R1C16&RC[-19])&IF(RC[-18]="",,"|n"&R1C17&RC[-18])&IF(RC[-17]="",,"|n"&R1C18&RC[-17])&IF(RC[-16]="",,"|n"&R1C19&RC[-16])&IF(RC[-15]="",,"|n"&R1C20&RC[-15])&IF(RC[-14]="",,"|n"&R1C21&RC[-14])&IF(RC[-13]="",,"|n"&R1C22&RC[-13])&IF(RC[-11]="",,"|n"&R1C24&RC[-11])&IF(RC[-10]="",,"|n"&R1C25&RC[-10])&IF(RC[-9]="",,"|n"&R1C26&RC[-9])&IF(RC[-8]="",,"|n"&R1C27&RC[-8])&IF(RC[-7]="",,"|n"&R1C28&RC[-7])&IF(RC[-6]="",,"|n"&R1C29&RC[-6])&IF(RC[-2]="",,"|n"&RC[-2]) -> 
AI633: =IF(RC[-27]&RC[-26]&RC[-25]&RC[-24]&RC[-23]&RC[-22]="",,R1C7)&IF(RC[-27]="",,"|n"&R1C8&RC[-27])&IF(RC[-26]="",,"|n"&R1C9&RC[-26])&IF(RC[-25]="",,"|n"&R1C10&RC[-25])&IF(RC[-24]="",,"|n"&R1C11&RC[-24])&IF(RC[-23]="",,"|n"&R1C12&RC[-23])&IF(RC[-22]="",,"|n"&R1C13&RC[-22])&IF(RC[-20]&RC[-19]&RC[-18]&RC[-17]="",,"|n"&R1C14)&IF(RC[-20]="",,"|n"&R1C15&RC[-20])&IF(RC[-19]="",,"|n"&R1C16&RC[-19])&IF(RC[-18]="",,"|n"&R1C17&RC[-18])&IF(RC[-17]="",,"|n"&R1C18&RC[-17])&IF(RC[-16]="",,"|n"&R1C19&RC[-16])&IF(RC[-15]="",,"|n"&R1C20&RC[-15])&IF(RC[-14]="",,"|n"&R1C21&RC[-14])&IF(RC[-13]="",,"|n"&R1C22&RC[-13])&IF(RC[-11]="",,"|n"&R1C24&RC[-11])&IF(RC[-10]="",,"|n"&R1C25&RC[-10])&IF(RC[-9]="",,"|n"&R1C26&RC[-9])&IF(RC[-8]="",,"|n"&R1C27&RC[-8])&IF(RC[-7]="",,"|n"&R1C28&RC[-7])&IF(RC[-6]="",,"|n"&R1C29&RC[-6])&IF(RC[-2]="",,"|n"&RC[-2]) -> 
AI634: =IF(RC[-27]&RC[-26]&RC[-25]&RC[-24]&RC[-23]&RC[-22]="",,R1C7)&IF(RC[-27]="",,"|n"&R1C8&RC[-27])&IF(RC[-26]="",,"|n"&R1C9&RC[-26])&IF(RC[-25]="",,"|n"&R1C10&RC[-25])&IF(RC[-24]="",,"|n"&R1C11&RC[-24])&IF(RC[-23]="",,"|n"&R1C12&RC[-23])&IF(RC[-22]="",,"|n"&R1C13&RC[-22])&IF(RC[-20]&RC[-19]&RC[-18]&RC[-17]="",,"|n"&R1C14)&IF(RC[-20]="",,"|n"&R1C15&RC[-20])&IF(RC[-19]="",,"|n"&R1C16&RC[-19])&IF(RC[-18]="",,"|n"&R1C17&RC[-18])&IF(RC[-17]="",,"|n"&R1C18&RC[-17])&IF(RC[-16]="",,"|n"&R1C19&RC[-16])&IF(RC[-15]="",,"|n"&R1C20&RC[-15])&IF(RC[-14]="",,"|n"&R1C21&RC[-14])&IF(RC[-13]="",,"|n"&R1C22&RC[-13])&IF(RC[-11]="",,"|n"&R1C24&RC[-11])&IF(RC[-10]="",,"|n"&R1C25&RC[-10])&IF(RC[-9]="",,"|n"&R1C26&RC[-9])&IF(RC[-8]="",,"|n"&R1C27&RC[-8])&IF(RC[-7]="",,"|n"&R1C28&RC[-7])&IF(RC[-6]="",,"|n"&R1C29&RC[-6])&IF(RC[-2]="",,"|n"&RC[-2]) -> 
AI635: =IF(RC[-27]&RC[-26]&RC[-25]&RC[-24]&RC[-23]&RC[-22]="",,R1C7)&IF(RC[-27]="",,"|n"&R1C8&RC[-27])&IF(RC[-26]="",,"|n"&R1C9&RC[-26])&IF(RC[-25]="",,"|n"&R1C10&RC[-25])&IF(RC[-24]="",,"|n"&R1C11&RC[-24])&IF(RC[-23]="",,"|n"&R1C12&RC[-23])&IF(RC[-22]="",,"|n"&R1C13&RC[-22])&IF(RC[-20]&RC[-19]&RC[-18]&RC[-17]="",,"|n"&R1C14)&IF(RC[-20]="",,"|n"&R1C15&RC[-20])&IF(RC[-19]="",,"|n"&R1C16&RC[-19])&IF(RC[-18]="",,"|n"&R1C17&RC[-18])&IF(RC[-17]="",,"|n"&R1C18&RC[-17])&IF(RC[-16]="",,"|n"&R1C19&RC[-16])&IF(RC[-15]="",,"|n"&R1C20&RC[-15])&IF(RC[-14]="",,"|n"&R1C21&RC[-14])&IF(RC[-13]="",,"|n"&R1C22&RC[-13])&IF(RC[-11]="",,"|n"&R1C24&RC[-11])&IF(RC[-10]="",,"|n"&R1C25&RC[-10])&IF(RC[-9]="",,"|n"&R1C26&RC[-9])&IF(RC[-8]="",,"|n"&R1C27&RC[-8])&IF(RC[-7]="",,"|n"&R1C28&RC[-7])&IF(RC[-6]="",,"|n"&R1C29&RC[-6])&IF(RC[-2]="",,"|n"&RC[-2]) -> 
AI636: =IF(RC[-27]&RC[-26]&RC[-25]&RC[-24]&RC[-23]&RC[-22]="",,R1C7)&IF(RC[-27]="",,"|n"&R1C8&RC[-27])&IF(RC[-26]="",,"|n"&R1C9&RC[-26])&IF(RC[-25]="",,"|n"&R1C10&RC[-25])&IF(RC[-24]="",,"|n"&R1C11&RC[-24])&IF(RC[-23]="",,"|n"&R1C12&RC[-23])&IF(RC[-22]="",,"|n"&R1C13&RC[-22])&IF(RC[-20]&RC[-19]&RC[-18]&RC[-17]="",,"|n"&R1C14)&IF(RC[-20]="",,"|n"&R1C15&RC[-20])&IF(RC[-19]="",,"|n"&R1C16&RC[-19])&IF(RC[-18]="",,"|n"&R1C17&RC[-18])&IF(RC[-17]="",,"|n"&R1C18&RC[-17])&IF(RC[-16]="",,"|n"&R1C19&RC[-16])&IF(RC[-15]="",,"|n"&R1C20&RC[-15])&IF(RC[-14]="",,"|n"&R1C21&RC[-14])&IF(RC[-13]="",,"|n"&R1C22&RC[-13])&IF(RC[-11]="",,"|n"&R1C24&RC[-11])&IF(RC[-10]="",,"|n"&R1C25&RC[-10])&IF(RC[-9]="",,"|n"&R1C26&RC[-9])&IF(RC[-8]="",,"|n"&R1C27&RC[-8])&IF(RC[-7]="",,"|n"&R1C28&RC[-7])&IF(RC[-6]="",,"|n"&R1C29&RC[-6])&IF(RC[-2]="",,"|n"&RC[-2]) -> 
AI637: =IF(RC[-27]&RC[-26]&RC[-25]&RC[-24]&RC[-23]&RC[-22]="",,R1C7)&IF(RC[-27]="",,"|n"&R1C8&RC[-27])&IF(RC[-26]="",,"|n"&R1C9&RC[-26])&IF(RC[-25]="",,"|n"&R1C10&RC[-25])&IF(RC[-24]="",,"|n"&R1C11&RC[-24])&IF(RC[-23]="",,"|n"&R1C12&RC[-23])&IF(RC[-22]="",,"|n"&R1C13&RC[-22])&IF(RC[-20]&RC[-19]&RC[-18]&RC[-17]="",,"|n"&R1C14)&IF(RC[-20]="",,"|n"&R1C15&RC[-20])&IF(RC[-19]="",,"|n"&R1C16&RC[-19])&IF(RC[-18]="",,"|n"&R1C17&RC[-18])&IF(RC[-17]="",,"|n"&R1C18&RC[-17])&IF(RC[-16]="",,"|n"&R1C19&RC[-16])&IF(RC[-15]="",,"|n"&R1C20&RC[-15])&IF(RC[-14]="",,"|n"&R1C21&RC[-14])&IF(RC[-13]="",,"|n"&R1C22&RC[-13])&IF(RC[-11]="",,"|n"&R1C24&RC[-11])&IF(RC[-10]="",,"|n"&R1C25&RC[-10])&IF(RC[-9]="",,"|n"&R1C26&RC[-9])&IF(RC[-8]="",,"|n"&R1C27&RC[-8])&IF(RC[-7]="",,"|n"&R1C28&RC[-7])&IF(RC[-6]="",,"|n"&R1C29&RC[-6])&IF(RC[-2]="",,"|n"&RC[-2]) -> 
AI638: =IF(RC[-27]&RC[-26]&RC[-25]&RC[-24]&RC[-23]&RC[-22]="",,R1C7)&IF(RC[-27]="",,"|n"&R1C8&RC[-27])&IF(RC[-26]="",,"|n"&R1C9&RC[-26])&IF(RC[-25]="",,"|n"&R1C10&RC[-25])&IF(RC[-24]="",,"|n"&R1C11&RC[-24])&IF(RC[-23]="",,"|n"&R1C12&RC[-23])&IF(RC[-22]="",,"|n"&R1C13&RC[-22])&IF(RC[-20]&RC[-19]&RC[-18]&RC[-17]="",,"|n"&R1C14)&IF(RC[-20]="",,"|n"&R1C15&RC[-20])&IF(RC[-19]="",,"|n"&R1C16&RC[-19])&IF(RC[-18]="",,"|n"&R1C17&RC[-18])&IF(RC[-17]="",,"|n"&R1C18&RC[-17])&IF(RC[-16]="",,"|n"&R1C19&RC[-16])&IF(RC[-15]="",,"|n"&R1C20&RC[-15])&IF(RC[-14]="",,"|n"&R1C21&RC[-14])&IF(RC[-13]="",,"|n"&R1C22&RC[-13])&IF(RC[-11]="",,"|n"&R1C24&RC[-11])&IF(RC[-10]="",,"|n"&R1C25&RC[-10])&IF(RC[-9]="",,"|n"&R1C26&RC[-9])&IF(RC[-8]="",,"|n"&R1C27&RC[-8])&IF(RC[-7]="",,"|n"&R1C28&RC[-7])&IF(RC[-6]="",,"|n"&R1C29&RC[-6])&IF(RC[-2]="",,"|n"&RC[-2]) -> 
AI639: =IF(RC[-27]&RC[-26]&RC[-25]&RC[-24]&RC[-23]&RC[-22]="",,R1C7)&IF(RC[-27]="",,"|n"&R1C8&RC[-27])&IF(RC[-26]="",,"|n"&R1C9&RC[-26])&IF(RC[-25]="",,"|n"&R1C10&RC[-25])&IF(RC[-24]="",,"|n"&R1C11&RC[-24])&IF(RC[-23]="",,"|n"&R1C12&RC[-23])&IF(RC[-22]="",,"|n"&R1C13&RC[-22])&IF(RC[-20]&RC[-19]&RC[-18]&RC[-17]="",,"|n"&R1C14)&IF(RC[-20]="",,"|n"&R1C15&RC[-20])&IF(RC[-19]="",,"|n"&R1C16&RC[-19])&IF(RC[-18]="",,"|n"&R1C17&RC[-18])&IF(RC[-17]="",,"|n"&R1C18&RC[-17])&IF(RC[-16]="",,"|n"&R1C19&RC[-16])&IF(RC[-15]="",,"|n"&R1C20&RC[-15])&IF(RC[-14]="",,"|n"&R1C21&RC[-14])&IF(RC[-13]="",,"|n"&R1C22&RC[-13])&IF(RC[-11]="",,"|n"&R1C24&RC[-11])&IF(RC[-10]="",,"|n"&R1C25&RC[-10])&IF(RC[-9]="",,"|n"&R1C26&RC[-9])&IF(RC[-8]="",,"|n"&R1C27&RC[-8])&IF(RC[-7]="",,"|n"&R1C28&RC[-7])&IF(RC[-6]="",,"|n"&R1C29&RC[-6])&IF(RC[-2]="",,"|n"&RC[-2]) -> 
AI640: =IF(RC[-27]&RC[-26]&RC[-25]&RC[-24]&RC[-23]&RC[-22]="",,R1C7)&IF(RC[-27]="",,"|n"&R1C8&RC[-27])&IF(RC[-26]="",,"|n"&R1C9&RC[-26])&IF(RC[-25]="",,"|n"&R1C10&RC[-25])&IF(RC[-24]="",,"|n"&R1C11&RC[-24])&IF(RC[-23]="",,"|n"&R1C12&RC[-23])&IF(RC[-22]="",,"|n"&R1C13&RC[-22])&IF(RC[-20]&RC[-19]&RC[-18]&RC[-17]="",,"|n"&R1C14)&IF(RC[-20]="",,"|n"&R1C15&RC[-20])&IF(RC[-19]="",,"|n"&R1C16&RC[-19])&IF(RC[-18]="",,"|n"&R1C17&RC[-18])&IF(RC[-17]="",,"|n"&R1C18&RC[-17])&IF(RC[-16]="",,"|n"&R1C19&RC[-16])&IF(RC[-15]="",,"|n"&R1C20&RC[-15])&IF(RC[-14]="",,"|n"&R1C21&RC[-14])&IF(RC[-13]="",,"|n"&R1C22&RC[-13])&IF(RC[-11]="",,"|n"&R1C24&RC[-11])&IF(RC[-10]="",,"|n"&R1C25&RC[-10])&IF(RC[-9]="",,"|n"&R1C26&RC[-9])&IF(RC[-8]="",,"|n"&R1C27&RC[-8])&IF(RC[-7]="",,"|n"&R1C28&RC[-7])&IF(RC[-6]="",,"|n"&R1C29&RC[-6])&IF(RC[-2]="",,"|n"&RC[-2]) -> 
AI641: =IF(RC[-27]&RC[-26]&RC[-25]&RC[-24]&RC[-23]&RC[-22]="",,R1C7)&IF(RC[-27]="",,"|n"&R1C8&RC[-27])&IF(RC[-26]="",,"|n"&R1C9&RC[-26])&IF(RC[-25]="",,"|n"&R1C10&RC[-25])&IF(RC[-24]="",,"|n"&R1C11&RC[-24])&IF(RC[-23]="",,"|n"&R1C12&RC[-23])&IF(RC[-22]="",,"|n"&R1C13&RC[-22])&IF(RC[-20]&RC[-19]&RC[-18]&RC[-17]="",,"|n"&R1C14)&IF(RC[-20]="",,"|n"&R1C15&RC[-20])&IF(RC[-19]="",,"|n"&R1C16&RC[-19])&IF(RC[-18]="",,"|n"&R1C17&RC[-18])&IF(RC[-17]="",,"|n"&R1C18&RC[-17])&IF(RC[-16]="",,"|n"&R1C19&RC[-16])&IF(RC[-15]="",,"|n"&R1C20&RC[-15])&IF(RC[-14]="",,"|n"&R1C21&RC[-14])&IF(RC[-13]="",,"|n"&R1C22&RC[-13])&IF(RC[-11]="",,"|n"&R1C24&RC[-11])&IF(RC[-10]="",,"|n"&R1C25&RC[-10])&IF(RC[-9]="",,"|n"&R1C26&RC[-9])&IF(RC[-8]="",,"|n"&R1C27&RC[-8])&IF(RC[-7]="",,"|n"&R1C28&RC[-7])&IF(RC[-6]="",,"|n"&R1C29&RC[-6])&IF(RC[-2]="",,"|n"&RC[-2]) -> 
AI642: =IF(RC[-27]&RC[-26]&RC[-25]&RC[-24]&RC[-23]&RC[-22]="",,R1C7)&IF(RC[-27]="",,"|n"&R1C8&RC[-27])&IF(RC[-26]="",,"|n"&R1C9&RC[-26])&IF(RC[-25]="",,"|n"&R1C10&RC[-25])&IF(RC[-24]="",,"|n"&R1C11&RC[-24])&IF(RC[-23]="",,"|n"&R1C12&RC[-23])&IF(RC[-22]="",,"|n"&R1C13&RC[-22])&IF(RC[-20]&RC[-19]&RC[-18]&RC[-17]="",,"|n"&R1C14)&IF(RC[-20]="",,"|n"&R1C15&RC[-20])&IF(RC[-19]="",,"|n"&R1C16&RC[-19])&IF(RC[-18]="",,"|n"&R1C17&RC[-18])&IF(RC[-17]="",,"|n"&R1C18&RC[-17])&IF(RC[-16]="",,"|n"&R1C19&RC[-16])&IF(RC[-15]="",,"|n"&R1C20&RC[-15])&IF(RC[-14]="",,"|n"&R1C21&RC[-14])&IF(RC[-13]="",,"|n"&R1C22&RC[-13])&IF(RC[-11]="",,"|n"&R1C24&RC[-11])&IF(RC[-10]="",,"|n"&R1C25&RC[-10])&IF(RC[-9]="",,"|n"&R1C26&RC[-9])&IF(RC[-8]="",,"|n"&R1C27&RC[-8])&IF(RC[-7]="",,"|n"&R1C28&RC[-7])&IF(RC[-6]="",,"|n"&R1C29&RC[-6])&IF(RC[-2]="",,"|n"&RC[-2]) -> 
AI643: =IF(RC[-27]&RC[-26]&RC[-25]&RC[-24]&RC[-23]&RC[-22]="",,R1C7)&IF(RC[-27]="",,"|n"&R1C8&RC[-27])&IF(RC[-26]="",,"|n"&R1C9&RC[-26])&IF(RC[-25]="",,"|n"&R1C10&RC[-25])&IF(RC[-24]="",,"|n"&R1C11&RC[-24])&IF(RC[-23]="",,"|n"&R1C12&RC[-23])&IF(RC[-22]="",,"|n"&R1C13&RC[-22])&IF(RC[-20]&RC[-19]&RC[-18]&RC[-17]="",,"|n"&R1C14)&IF(RC[-20]="",,"|n"&R1C15&RC[-20])&IF(RC[-19]="",,"|n"&R1C16&RC[-19])&IF(RC[-18]="",,"|n"&R1C17&RC[-18])&IF(RC[-17]="",,"|n"&R1C18&RC[-17])&IF(RC[-16]="",,"|n"&R1C19&RC[-16])&IF(RC[-15]="",,"|n"&R1C20&RC[-15])&IF(RC[-14]="",,"|n"&R1C21&RC[-14])&IF(RC[-13]="",,"|n"&R1C22&RC[-13])&IF(RC[-11]="",,"|n"&R1C24&RC[-11])&IF(RC[-10]="",,"|n"&R1C25&RC[-10])&IF(RC[-9]="",,"|n"&R1C26&RC[-9])&IF(RC[-8]="",,"|n"&R1C27&RC[-8])&IF(RC[-7]="",,"|n"&R1C28&RC[-7])&IF(RC[-6]="",,"|n"&R1C29&RC[-6])&IF(RC[-2]="",,"|n"&RC[-2]) -> 
AI644: =IF(RC[-27]&RC[-26]&RC[-25]&RC[-24]&RC[-23]&RC[-22]="",,R1C7)&IF(RC[-27]="",,"|n"&R1C8&RC[-27])&IF(RC[-26]="",,"|n"&R1C9&RC[-26])&IF(RC[-25]="",,"|n"&R1C10&RC[-25])&IF(RC[-24]="",,"|n"&R1C11&RC[-24])&IF(RC[-23]="",,"|n"&R1C12&RC[-23])&IF(RC[-22]="",,"|n"&R1C13&RC[-22])&IF(RC[-20]&RC[-19]&RC[-18]&RC[-17]="",,"|n"&R1C14)&IF(RC[-20]="",,"|n"&R1C15&RC[-20])&IF(RC[-19]="",,"|n"&R1C16&RC[-19])&IF(RC[-18]="",,"|n"&R1C17&RC[-18])&IF(RC[-17]="",,"|n"&R1C18&RC[-17])&IF(RC[-16]="",,"|n"&R1C19&RC[-16])&IF(RC[-15]="",,"|n"&R1C20&RC[-15])&IF(RC[-14]="",,"|n"&R1C21&RC[-14])&IF(RC[-13]="",,"|n"&R1C22&RC[-13])&IF(RC[-11]="",,"|n"&R1C24&RC[-11])&IF(RC[-10]="",,"|n"&R1C25&RC[-10])&IF(RC[-9]="",,"|n"&R1C26&RC[-9])&IF(RC[-8]="",,"|n"&R1C27&RC[-8])&IF(RC[-7]="",,"|n"&R1C28&RC[-7])&IF(RC[-6]="",,"|n"&R1C29&RC[-6])&IF(RC[-2]="",,"|n"&RC[-2]) -> 
AI645: =IF(RC[-27]&RC[-26]&RC[-25]&RC[-24]&RC[-23]&RC[-22]="",,R1C7)&IF(RC[-27]="",,"|n"&R1C8&RC[-27])&IF(RC[-26]="",,"|n"&R1C9&RC[-26])&IF(RC[-25]="",,"|n"&R1C10&RC[-25])&IF(RC[-24]="",,"|n"&R1C11&RC[-24])&IF(RC[-23]="",,"|n"&R1C12&RC[-23])&IF(RC[-22]="",,"|n"&R1C13&RC[-22])&IF(RC[-20]&RC[-19]&RC[-18]&RC[-17]="",,"|n"&R1C14)&IF(RC[-20]="",,"|n"&R1C15&RC[-20])&IF(RC[-19]="",,"|n"&R1C16&RC[-19])&IF(RC[-18]="",,"|n"&R1C17&RC[-18])&IF(RC[-17]="",,"|n"&R1C18&RC[-17])&IF(RC[-16]="",,"|n"&R1C19&RC[-16])&IF(RC[-15]="",,"|n"&R1C20&RC[-15])&IF(RC[-14]="",,"|n"&R1C21&RC[-14])&IF(RC[-13]="",,"|n"&R1C22&RC[-13])&IF(RC[-11]="",,"|n"&R1C24&RC[-11])&IF(RC[-10]="",,"|n"&R1C25&RC[-10])&IF(RC[-9]="",,"|n"&R1C26&RC[-9])&IF(RC[-8]="",,"|n"&R1C27&RC[-8])&IF(RC[-7]="",,"|n"&R1C28&RC[-7])&IF(RC[-6]="",,"|n"&R1C29&RC[-6])&IF(RC[-2]="",,"|n"&RC[-2]) -> 
AI646: =IF(RC[-27]&RC[-26]&RC[-25]&RC[-24]&RC[-23]&RC[-22]="",,R1C7)&IF(RC[-27]="",,"|n"&R1C8&RC[-27])&IF(RC[-26]="",,"|n"&R1C9&RC[-26])&IF(RC[-25]="",,"|n"&R1C10&RC[-25])&IF(RC[-24]="",,"|n"&R1C11&RC[-24])&IF(RC[-23]="",,"|n"&R1C12&RC[-23])&IF(RC[-22]="",,"|n"&R1C13&RC[-22])&IF(RC[-20]&RC[-19]&RC[-18]&RC[-17]="",,"|n"&R1C14)&IF(RC[-20]="",,"|n"&R1C15&RC[-20])&IF(RC[-19]="",,"|n"&R1C16&RC[-19])&IF(RC[-18]="",,"|n"&R1C17&RC[-18])&IF(RC[-17]="",,"|n"&R1C18&RC[-17])&IF(RC[-16]="",,"|n"&R1C19&RC[-16])&IF(RC[-15]="",,"|n"&R1C20&RC[-15])&IF(RC[-14]="",,"|n"&R1C21&RC[-14])&IF(RC[-13]="",,"|n"&R1C22&RC[-13])&IF(RC[-11]="",,"|n"&R1C24&RC[-11])&IF(RC[-10]="",,"|n"&R1C25&RC[-10])&IF(RC[-9]="",,"|n"&R1C26&RC[-9])&IF(RC[-8]="",,"|n"&R1C27&RC[-8])&IF(RC[-7]="",,"|n"&R1C28&RC[-7])&IF(RC[-6]="",,"|n"&R1C29&RC[-6])&IF(RC[-2]="",,"|n"&RC[-2]) -> 
AI647: =IF(RC[-27]&RC[-26]&RC[-25]&RC[-24]&RC[-23]&RC[-22]="",,R1C7)&IF(RC[-27]="",,"|n"&R1C8&RC[-27])&IF(RC[-26]="",,"|n"&R1C9&RC[-26])&IF(RC[-25]="",,"|n"&R1C10&RC[-25])&IF(RC[-24]="",,"|n"&R1C11&RC[-24])&IF(RC[-23]="",,"|n"&R1C12&RC[-23])&IF(RC[-22]="",,"|n"&R1C13&RC[-22])&IF(RC[-20]&RC[-19]&RC[-18]&RC[-17]="",,"|n"&R1C14)&IF(RC[-20]="",,"|n"&R1C15&RC[-20])&IF(RC[-19]="",,"|n"&R1C16&RC[-19])&IF(RC[-18]="",,"|n"&R1C17&RC[-18])&IF(RC[-17]="",,"|n"&R1C18&RC[-17])&IF(RC[-16]="",,"|n"&R1C19&RC[-16])&IF(RC[-15]="",,"|n"&R1C20&RC[-15])&IF(RC[-14]="",,"|n"&R1C21&RC[-14])&IF(RC[-13]="",,"|n"&R1C22&RC[-13])&IF(RC[-11]="",,"|n"&R1C24&RC[-11])&IF(RC[-10]="",,"|n"&R1C25&RC[-10])&IF(RC[-9]="",,"|n"&R1C26&RC[-9])&IF(RC[-8]="",,"|n"&R1C27&RC[-8])&IF(RC[-7]="",,"|n"&R1C28&RC[-7])&IF(RC[-6]="",,"|n"&R1C29&RC[-6])&IF(RC[-2]="",,"|n"&RC[-2]) -> 
AI648: =IF(RC[-27]&RC[-26]&RC[-25]&RC[-24]&RC[-23]&RC[-22]="",,R1C7)&IF(RC[-27]="",,"|n"&R1C8&RC[-27])&IF(RC[-26]="",,"|n"&R1C9&RC[-26])&IF(RC[-25]="",,"|n"&R1C10&RC[-25])&IF(RC[-24]="",,"|n"&R1C11&RC[-24])&IF(RC[-23]="",,"|n"&R1C12&RC[-23])&IF(RC[-22]="",,"|n"&R1C13&RC[-22])&IF(RC[-20]&RC[-19]&RC[-18]&RC[-17]="",,"|n"&R1C14)&IF(RC[-20]="",,"|n"&R1C15&RC[-20])&IF(RC[-19]="",,"|n"&R1C16&RC[-19])&IF(RC[-18]="",,"|n"&R1C17&RC[-18])&IF(RC[-17]="",,"|n"&R1C18&RC[-17])&IF(RC[-16]="",,"|n"&R1C19&RC[-16])&IF(RC[-15]="",,"|n"&R1C20&RC[-15])&IF(RC[-14]="",,"|n"&R1C21&RC[-14])&IF(RC[-13]="",,"|n"&R1C22&RC[-13])&IF(RC[-11]="",,"|n"&R1C24&RC[-11])&IF(RC[-10]="",,"|n"&R1C25&RC[-10])&IF(RC[-9]="",,"|n"&R1C26&RC[-9])&IF(RC[-8]="",,"|n"&R1C27&RC[-8])&IF(RC[-7]="",,"|n"&R1C28&RC[-7])&IF(RC[-6]="",,"|n"&R1C29&RC[-6])&IF(RC[-2]="",,"|n"&RC[-2]) -> 
AI649: =IF(RC[-27]&RC[-26]&RC[-25]&RC[-24]&RC[-23]&RC[-22]="",,R1C7)&IF(RC[-27]="",,"|n"&R1C8&RC[-27])&IF(RC[-26]="",,"|n"&R1C9&RC[-26])&IF(RC[-25]="",,"|n"&R1C10&RC[-25])&IF(RC[-24]="",,"|n"&R1C11&RC[-24])&IF(RC[-23]="",,"|n"&R1C12&RC[-23])&IF(RC[-22]="",,"|n"&R1C13&RC[-22])&IF(RC[-20]&RC[-19]&RC[-18]&RC[-17]="",,"|n"&R1C14)&IF(RC[-20]="",,"|n"&R1C15&RC[-20])&IF(RC[-19]="",,"|n"&R1C16&RC[-19])&IF(RC[-18]="",,"|n"&R1C17&RC[-18])&IF(RC[-17]="",,"|n"&R1C18&RC[-17])&IF(RC[-16]="",,"|n"&R1C19&RC[-16])&IF(RC[-15]="",,"|n"&R1C20&RC[-15])&IF(RC[-14]="",,"|n"&R1C21&RC[-14])&IF(RC[-13]="",,"|n"&R1C22&RC[-13])&IF(RC[-11]="",,"|n"&R1C24&RC[-11])&IF(RC[-10]="",,"|n"&R1C25&RC[-10])&IF(RC[-9]="",,"|n"&R1C26&RC[-9])&IF(RC[-8]="",,"|n"&R1C27&RC[-8])&IF(RC[-7]="",,"|n"&R1C28&RC[-7])&IF(RC[-6]="",,"|n"&R1C29&RC[-6])&IF(RC[-2]="",,"|n"&RC[-2]) -> 
AI650: =IF(RC[-27]&RC[-26]&RC[-25]&RC[-24]&RC[-23]&RC[-22]="",,R1C7)&IF(RC[-27]="",,"|n"&R1C8&RC[-27])&IF(RC[-26]="",,"|n"&R1C9&RC[-26])&IF(RC[-25]="",,"|n"&R1C10&RC[-25])&IF(RC[-24]="",,"|n"&R1C11&RC[-24])&IF(RC[-23]="",,"|n"&R1C12&RC[-23])&IF(RC[-22]="",,"|n"&R1C13&RC[-22])&IF(RC[-20]&RC[-19]&RC[-18]&RC[-17]="",,"|n"&R1C14)&IF(RC[-20]="",,"|n"&R1C15&RC[-20])&IF(RC[-19]="",,"|n"&R1C16&RC[-19])&IF(RC[-18]="",,"|n"&R1C17&RC[-18])&IF(RC[-17]="",,"|n"&R1C18&RC[-17])&IF(RC[-16]="",,"|n"&R1C19&RC[-16])&IF(RC[-15]="",,"|n"&R1C20&RC[-15])&IF(RC[-14]="",,"|n"&R1C21&RC[-14])&IF(RC[-13]="",,"|n"&R1C22&RC[-13])&IF(RC[-11]="",,"|n"&R1C24&RC[-11])&IF(RC[-10]="",,"|n"&R1C25&RC[-10])&IF(RC[-9]="",,"|n"&R1C26&RC[-9])&IF(RC[-8]="",,"|n"&R1C27&RC[-8])&IF(RC[-7]="",,"|n"&R1C28&RC[-7])&IF(RC[-6]="",,"|n"&R1C29&RC[-6])&IF(RC[-2]="",,"|n"&RC[-2]) -> 
AI651: =IF(RC[-27]&RC[-26]&RC[-25]&RC[-24]&RC[-23]&RC[-22]="",,R1C7)&IF(RC[-27]="",,"|n"&R1C8&RC[-27])&IF(RC[-26]="",,"|n"&R1C9&RC[-26])&IF(RC[-25]="",,"|n"&R1C10&RC[-25])&IF(RC[-24]="",,"|n"&R1C11&RC[-24])&IF(RC[-23]="",,"|n"&R1C12&RC[-23])&IF(RC[-22]="",,"|n"&R1C13&RC[-22])&IF(RC[-20]&RC[-19]&RC[-18]&RC[-17]="",,"|n"&R1C14)&IF(RC[-20]="",,"|n"&R1C15&RC[-20])&IF(RC[-19]="",,"|n"&R1C16&RC[-19])&IF(RC[-18]="",,"|n"&R1C17&RC[-18])&IF(RC[-17]="",,"|n"&R1C18&RC[-17])&IF(RC[-16]="",,"|n"&R1C19&RC[-16])&IF(RC[-15]="",,"|n"&R1C20&RC[-15])&IF(RC[-14]="",,"|n"&R1C21&RC[-14])&IF(RC[-13]="",,"|n"&R1C22&RC[-13])&IF(RC[-11]="",,"|n"&R1C24&RC[-11])&IF(RC[-10]="",,"|n"&R1C25&RC[-10])&IF(RC[-9]="",,"|n"&R1C26&RC[-9])&IF(RC[-8]="",,"|n"&R1C27&RC[-8])&IF(RC[-7]="",,"|n"&R1C28&RC[-7])&IF(RC[-6]="",,"|n"&R1C29&RC[-6])&IF(RC[-2]="",,"|n"&RC[-2]) -> 
AI652: =IF(RC[-27]&RC[-26]&RC[-25]&RC[-24]&RC[-23]&RC[-22]="",,R1C7)&IF(RC[-27]="",,"|n"&R1C8&RC[-27])&IF(RC[-26]="",,"|n"&R1C9&RC[-26])&IF(RC[-25]="",,"|n"&R1C10&RC[-25])&IF(RC[-24]="",,"|n"&R1C11&RC[-24])&IF(RC[-23]="",,"|n"&R1C12&RC[-23])&IF(RC[-22]="",,"|n"&R1C13&RC[-22])&IF(RC[-20]&RC[-19]&RC[-18]&RC[-17]="",,"|n"&R1C14)&IF(RC[-20]="",,"|n"&R1C15&RC[-20])&IF(RC[-19]="",,"|n"&R1C16&RC[-19])&IF(RC[-18]="",,"|n"&R1C17&RC[-18])&IF(RC[-17]="",,"|n"&R1C18&RC[-17])&IF(RC[-16]="",,"|n"&R1C19&RC[-16])&IF(RC[-15]="",,"|n"&R1C20&RC[-15])&IF(RC[-14]="",,"|n"&R1C21&RC[-14])&IF(RC[-13]="",,"|n"&R1C22&RC[-13])&IF(RC[-11]="",,"|n"&R1C24&RC[-11])&IF(RC[-10]="",,"|n"&R1C25&RC[-10])&IF(RC[-9]="",,"|n"&R1C26&RC[-9])&IF(RC[-8]="",,"|n"&R1C27&RC[-8])&IF(RC[-7]="",,"|n"&R1C28&RC[-7])&IF(RC[-6]="",,"|n"&R1C29&RC[-6])&IF(RC[-2]="",,"|n"&RC[-2]) -> 
AI653: =IF(RC[-27]&RC[-26]&RC[-25]&RC[-24]&RC[-23]&RC[-22]="",,R1C7)&IF(RC[-27]="",,"|n"&R1C8&RC[-27])&IF(RC[-26]="",,"|n"&R1C9&RC[-26])&IF(RC[-25]="",,"|n"&R1C10&RC[-25])&IF(RC[-24]="",,"|n"&R1C11&RC[-24])&IF(RC[-23]="",,"|n"&R1C12&RC[-23])&IF(RC[-22]="",,"|n"&R1C13&RC[-22])&IF(RC[-20]&RC[-19]&RC[-18]&RC[-17]="",,"|n"&R1C14)&IF(RC[-20]="",,"|n"&R1C15&RC[-20])&IF(RC[-19]="",,"|n"&R1C16&RC[-19])&IF(RC[-18]="",,"|n"&R1C17&RC[-18])&IF(RC[-17]="",,"|n"&R1C18&RC[-17])&IF(RC[-16]="",,"|n"&R1C19&RC[-16])&IF(RC[-15]="",,"|n"&R1C20&RC[-15])&IF(RC[-14]="",,"|n"&R1C21&RC[-14])&IF(RC[-13]="",,"|n"&R1C22&RC[-13])&IF(RC[-11]="",,"|n"&R1C24&RC[-11])&IF(RC[-10]="",,"|n"&R1C25&RC[-10])&IF(RC[-9]="",,"|n"&R1C26&RC[-9])&IF(RC[-8]="",,"|n"&R1C27&RC[-8])&IF(RC[-7]="",,"|n"&R1C28&RC[-7])&IF(RC[-6]="",,"|n"&R1C29&RC[-6])&IF(RC[-2]="",,"|n"&RC[-2]) -> 
AI654: =IF(RC[-27]&RC[-26]&RC[-25]&RC[-24]&RC[-23]&RC[-22]="",,R1C7)&IF(RC[-27]="",,"|n"&R1C8&RC[-27])&IF(RC[-26]="",,"|n"&R1C9&RC[-26])&IF(RC[-25]="",,"|n"&R1C10&RC[-25])&IF(RC[-24]="",,"|n"&R1C11&RC[-24])&IF(RC[-23]="",,"|n"&R1C12&RC[-23])&IF(RC[-22]="",,"|n"&R1C13&RC[-22])&IF(RC[-20]&RC[-19]&RC[-18]&RC[-17]="",,"|n"&R1C14)&IF(RC[-20]="",,"|n"&R1C15&RC[-20])&IF(RC[-19]="",,"|n"&R1C16&RC[-19])&IF(RC[-18]="",,"|n"&R1C17&RC[-18])&IF(RC[-17]="",,"|n"&R1C18&RC[-17])&IF(RC[-16]="",,"|n"&R1C19&RC[-16])&IF(RC[-15]="",,"|n"&R1C20&RC[-15])&IF(RC[-14]="",,"|n"&R1C21&RC[-14])&IF(RC[-13]="",,"|n"&R1C22&RC[-13])&IF(RC[-11]="",,"|n"&R1C24&RC[-11])&IF(RC[-10]="",,"|n"&R1C25&RC[-10])&IF(RC[-9]="",,"|n"&R1C26&RC[-9])&IF(RC[-8]="",,"|n"&R1C27&RC[-8])&IF(RC[-7]="",,"|n"&R1C28&RC[-7])&IF(RC[-6]="",,"|n"&R1C29&RC[-6])&IF(RC[-2]="",,"|n"&RC[-2]) -> 
AI655: =IF(RC[-27]&RC[-26]&RC[-25]&RC[-24]&RC[-23]&RC[-22]="",,R1C7)&IF(RC[-27]="",,"|n"&R1C8&RC[-27])&IF(RC[-26]="",,"|n"&R1C9&RC[-26])&IF(RC[-25]="",,"|n"&R1C10&RC[-25])&IF(RC[-24]="",,"|n"&R1C11&RC[-24])&IF(RC[-23]="",,"|n"&R1C12&RC[-23])&IF(RC[-22]="",,"|n"&R1C13&RC[-22])&IF(RC[-20]&RC[-19]&RC[-18]&RC[-17]="",,"|n"&R1C14)&IF(RC[-20]="",,"|n"&R1C15&RC[-20])&IF(RC[-19]="",,"|n"&R1C16&RC[-19])&IF(RC[-18]="",,"|n"&R1C17&RC[-18])&IF(RC[-17]="",,"|n"&R1C18&RC[-17])&IF(RC[-16]="",,"|n"&R1C19&RC[-16])&IF(RC[-15]="",,"|n"&R1C20&RC[-15])&IF(RC[-14]="",,"|n"&R1C21&RC[-14])&IF(RC[-13]="",,"|n"&R1C22&RC[-13])&IF(RC[-11]="",,"|n"&R1C24&RC[-11])&IF(RC[-10]="",,"|n"&R1C25&RC[-10])&IF(RC[-9]="",,"|n"&R1C26&RC[-9])&IF(RC[-8]="",,"|n"&R1C27&RC[-8])&IF(RC[-7]="",,"|n"&R1C28&RC[-7])&IF(RC[-6]="",,"|n"&R1C29&RC[-6])&IF(RC[-2]="",,"|n"&RC[-2]) -> 
AI656: =IF(RC[-27]&RC[-26]&RC[-25]&RC[-24]&RC[-23]&RC[-22]="",,R1C7)&IF(RC[-27]="",,"|n"&R1C8&RC[-27])&IF(RC[-26]="",,"|n"&R1C9&RC[-26])&IF(RC[-25]="",,"|n"&R1C10&RC[-25])&IF(RC[-24]="",,"|n"&R1C11&RC[-24])&IF(RC[-23]="",,"|n"&R1C12&RC[-23])&IF(RC[-22]="",,"|n"&R1C13&RC[-22])&IF(RC[-20]&RC[-19]&RC[-18]&RC[-17]="",,"|n"&R1C14)&IF(RC[-20]="",,"|n"&R1C15&RC[-20])&IF(RC[-19]="",,"|n"&R1C16&RC[-19])&IF(RC[-18]="",,"|n"&R1C17&RC[-18])&IF(RC[-17]="",,"|n"&R1C18&RC[-17])&IF(RC[-16]="",,"|n"&R1C19&RC[-16])&IF(RC[-15]="",,"|n"&R1C20&RC[-15])&IF(RC[-14]="",,"|n"&R1C21&RC[-14])&IF(RC[-13]="",,"|n"&R1C22&RC[-13])&IF(RC[-11]="",,"|n"&R1C24&RC[-11])&IF(RC[-10]="",,"|n"&R1C25&RC[-10])&IF(RC[-9]="",,"|n"&R1C26&RC[-9])&IF(RC[-8]="",,"|n"&R1C27&RC[-8])&IF(RC[-7]="",,"|n"&R1C28&RC[-7])&IF(RC[-6]="",,"|n"&R1C29&RC[-6])&IF(RC[-2]="",,"|n"&RC[-2]) -> 
AI657: =IF(RC[-27]&RC[-26]&RC[-25]&RC[-24]&RC[-23]&RC[-22]="",,R1C7)&IF(RC[-27]="",,"|n"&R1C8&RC[-27])&IF(RC[-26]="",,"|n"&R1C9&RC[-26])&IF(RC[-25]="",,"|n"&R1C10&RC[-25])&IF(RC[-24]="",,"|n"&R1C11&RC[-24])&IF(RC[-23]="",,"|n"&R1C12&RC[-23])&IF(RC[-22]="",,"|n"&R1C13&RC[-22])&IF(RC[-20]&RC[-19]&RC[-18]&RC[-17]="",,"|n"&R1C14)&IF(RC[-20]="",,"|n"&R1C15&RC[-20])&IF(RC[-19]="",,"|n"&R1C16&RC[-19])&IF(RC[-18]="",,"|n"&R1C17&RC[-18])&IF(RC[-17]="",,"|n"&R1C18&RC[-17])&IF(RC[-16]="",,"|n"&R1C19&RC[-16])&IF(RC[-15]="",,"|n"&R1C20&RC[-15])&IF(RC[-14]="",,"|n"&R1C21&RC[-14])&IF(RC[-13]="",,"|n"&R1C22&RC[-13])&IF(RC[-11]="",,"|n"&R1C24&RC[-11])&IF(RC[-10]="",,"|n"&R1C25&RC[-10])&IF(RC[-9]="",,"|n"&R1C26&RC[-9])&IF(RC[-8]="",,"|n"&R1C27&RC[-8])&IF(RC[-7]="",,"|n"&R1C28&RC[-7])&IF(RC[-6]="",,"|n"&R1C29&RC[-6])&IF(RC[-2]="",,"|n"&RC[-2]) -> 
AI658: =IF(RC[-27]&RC[-26]&RC[-25]&RC[-24]&RC[-23]&RC[-22]="",,R1C7)&IF(RC[-27]="",,"|n"&R1C8&RC[-27])&IF(RC[-26]="",,"|n"&R1C9&RC[-26])&IF(RC[-25]="",,"|n"&R1C10&RC[-25])&IF(RC[-24]="",,"|n"&R1C11&RC[-24])&IF(RC[-23]="",,"|n"&R1C12&RC[-23])&IF(RC[-22]="",,"|n"&R1C13&RC[-22])&IF(RC[-20]&RC[-19]&RC[-18]&RC[-17]="",,"|n"&R1C14)&IF(RC[-20]="",,"|n"&R1C15&RC[-20])&IF(RC[-19]="",,"|n"&R1C16&RC[-19])&IF(RC[-18]="",,"|n"&R1C17&RC[-18])&IF(RC[-17]="",,"|n"&R1C18&RC[-17])&IF(RC[-16]="",,"|n"&R1C19&RC[-16])&IF(RC[-15]="",,"|n"&R1C20&RC[-15])&IF(RC[-14]="",,"|n"&R1C21&RC[-14])&IF(RC[-13]="",,"|n"&R1C22&RC[-13])&IF(RC[-11]="",,"|n"&R1C24&RC[-11])&IF(RC[-10]="",,"|n"&R1C25&RC[-10])&IF(RC[-9]="",,"|n"&R1C26&RC[-9])&IF(RC[-8]="",,"|n"&R1C27&RC[-8])&IF(RC[-7]="",,"|n"&R1C28&RC[-7])&IF(RC[-6]="",,"|n"&R1C29&RC[-6])&IF(RC[-2]="",,"|n"&RC[-2]) -> 
AI659: =IF(RC[-27]&RC[-26]&RC[-25]&RC[-24]&RC[-23]&RC[-22]="",,R1C7)&IF(RC[-27]="",,"|n"&R1C8&RC[-27])&IF(RC[-26]="",,"|n"&R1C9&RC[-26])&IF(RC[-25]="",,"|n"&R1C10&RC[-25])&IF(RC[-24]="",,"|n"&R1C11&RC[-24])&IF(RC[-23]="",,"|n"&R1C12&RC[-23])&IF(RC[-22]="",,"|n"&R1C13&RC[-22])&IF(RC[-20]&RC[-19]&RC[-18]&RC[-17]="",,"|n"&R1C14)&IF(RC[-20]="",,"|n"&R1C15&RC[-20])&IF(RC[-19]="",,"|n"&R1C16&RC[-19])&IF(RC[-18]="",,"|n"&R1C17&RC[-18])&IF(RC[-17]="",,"|n"&R1C18&RC[-17])&IF(RC[-16]="",,"|n"&R1C19&RC[-16])&IF(RC[-15]="",,"|n"&R1C20&RC[-15])&IF(RC[-14]="",,"|n"&R1C21&RC[-14])&IF(RC[-13]="",,"|n"&R1C22&RC[-13])&IF(RC[-11]="",,"|n"&R1C24&RC[-11])&IF(RC[-10]="",,"|n"&R1C25&RC[-10])&IF(RC[-9]="",,"|n"&R1C26&RC[-9])&IF(RC[-8]="",,"|n"&R1C27&RC[-8])&IF(RC[-7]="",,"|n"&R1C28&RC[-7])&IF(RC[-6]="",,"|n"&R1C29&RC[-6])&IF(RC[-2]="",,"|n"&RC[-2]) -> 
AI660: =IF(RC[-27]&RC[-26]&RC[-25]&RC[-24]&RC[-23]&RC[-22]="",,R1C7)&IF(RC[-27]="",,"|n"&R1C8&RC[-27])&IF(RC[-26]="",,"|n"&R1C9&RC[-26])&IF(RC[-25]="",,"|n"&R1C10&RC[-25])&IF(RC[-24]="",,"|n"&R1C11&RC[-24])&IF(RC[-23]="",,"|n"&R1C12&RC[-23])&IF(RC[-22]="",,"|n"&R1C13&RC[-22])&IF(RC[-20]&RC[-19]&RC[-18]&RC[-17]="",,"|n"&R1C14)&IF(RC[-20]="",,"|n"&R1C15&RC[-20])&IF(RC[-19]="",,"|n"&R1C16&RC[-19])&IF(RC[-18]="",,"|n"&R1C17&RC[-18])&IF(RC[-17]="",,"|n"&R1C18&RC[-17])&IF(RC[-16]="",,"|n"&R1C19&RC[-16])&IF(RC[-15]="",,"|n"&R1C20&RC[-15])&IF(RC[-14]="",,"|n"&R1C21&RC[-14])&IF(RC[-13]="",,"|n"&R1C22&RC[-13])&IF(RC[-11]="",,"|n"&R1C24&RC[-11])&IF(RC[-10]="",,"|n"&R1C25&RC[-10])&IF(RC[-9]="",,"|n"&R1C26&RC[-9])&IF(RC[-8]="",,"|n"&R1C27&RC[-8])&IF(RC[-7]="",,"|n"&R1C28&RC[-7])&IF(RC[-6]="",,"|n"&R1C29&RC[-6])&IF(RC[-2]="",,"|n"&RC[-2]) -> 
AI661: =IF(RC[-27]&RC[-26]&RC[-25]&RC[-24]&RC[-23]&RC[-22]="",,R1C7)&IF(RC[-27]="",,"|n"&R1C8&RC[-27])&IF(RC[-26]="",,"|n"&R1C9&RC[-26])&IF(RC[-25]="",,"|n"&R1C10&RC[-25])&IF(RC[-24]="",,"|n"&R1C11&RC[-24])&IF(RC[-23]="",,"|n"&R1C12&RC[-23])&IF(RC[-22]="",,"|n"&R1C13&RC[-22])&IF(RC[-20]&RC[-19]&RC[-18]&RC[-17]="",,"|n"&R1C14)&IF(RC[-20]="",,"|n"&R1C15&RC[-20])&IF(RC[-19]="",,"|n"&R1C16&RC[-19])&IF(RC[-18]="",,"|n"&R1C17&RC[-18])&IF(RC[-17]="",,"|n"&R1C18&RC[-17])&IF(RC[-16]="",,"|n"&R1C19&RC[-16])&IF(RC[-15]="",,"|n"&R1C20&RC[-15])&IF(RC[-14]="",,"|n"&R1C21&RC[-14])&IF(RC[-13]="",,"|n"&R1C22&RC[-13])&IF(RC[-11]="",,"|n"&R1C24&RC[-11])&IF(RC[-10]="",,"|n"&R1C25&RC[-10])&IF(RC[-9]="",,"|n"&R1C26&RC[-9])&IF(RC[-8]="",,"|n"&R1C27&RC[-8])&IF(RC[-7]="",,"|n"&R1C28&RC[-7])&IF(RC[-6]="",,"|n"&R1C29&RC[-6])&IF(RC[-2]="",,"|n"&RC[-2]) -> 
AI662: =IF(RC[-27]&RC[-26]&RC[-25]&RC[-24]&RC[-23]&RC[-22]="",,R1C7)&IF(RC[-27]="",,"|n"&R1C8&RC[-27])&IF(RC[-26]="",,"|n"&R1C9&RC[-26])&IF(RC[-25]="",,"|n"&R1C10&RC[-25])&IF(RC[-24]="",,"|n"&R1C11&RC[-24])&IF(RC[-23]="",,"|n"&R1C12&RC[-23])&IF(RC[-22]="",,"|n"&R1C13&RC[-22])&IF(RC[-20]&RC[-19]&RC[-18]&RC[-17]="",,"|n"&R1C14)&IF(RC[-20]="",,"|n"&R1C15&RC[-20])&IF(RC[-19]="",,"|n"&R1C16&RC[-19])&IF(RC[-18]="",,"|n"&R1C17&RC[-18])&IF(RC[-17]="",,"|n"&R1C18&RC[-17])&IF(RC[-16]="",,"|n"&R1C19&RC[-16])&IF(RC[-15]="",,"|n"&R1C20&RC[-15])&IF(RC[-14]="",,"|n"&R1C21&RC[-14])&IF(RC[-13]="",,"|n"&R1C22&RC[-13])&IF(RC[-11]="",,"|n"&R1C24&RC[-11])&IF(RC[-10]="",,"|n"&R1C25&RC[-10])&IF(RC[-9]="",,"|n"&R1C26&RC[-9])&IF(RC[-8]="",,"|n"&R1C27&RC[-8])&IF(RC[-7]="",,"|n"&R1C28&RC[-7])&IF(RC[-6]="",,"|n"&R1C29&RC[-6])&IF(RC[-2]="",,"|n"&RC[-2]) -> 
AI663: =IF(RC[-27]&RC[-26]&RC[-25]&RC[-24]&RC[-23]&RC[-22]="",,R1C7)&IF(RC[-27]="",,"|n"&R1C8&RC[-27])&IF(RC[-26]="",,"|n"&R1C9&RC[-26])&IF(RC[-25]="",,"|n"&R1C10&RC[-25])&IF(RC[-24]="",,"|n"&R1C11&RC[-24])&IF(RC[-23]="",,"|n"&R1C12&RC[-23])&IF(RC[-22]="",,"|n"&R1C13&RC[-22])&IF(RC[-20]&RC[-19]&RC[-18]&RC[-17]="",,"|n"&R1C14)&IF(RC[-20]="",,"|n"&R1C15&RC[-20])&IF(RC[-19]="",,"|n"&R1C16&RC[-19])&IF(RC[-18]="",,"|n"&R1C17&RC[-18])&IF(RC[-17]="",,"|n"&R1C18&RC[-17])&IF(RC[-16]="",,"|n"&R1C19&RC[-16])&IF(RC[-15]="",,"|n"&R1C20&RC[-15])&IF(RC[-14]="",,"|n"&R1C21&RC[-14])&IF(RC[-13]="",,"|n"&R1C22&RC[-13])&IF(RC[-11]="",,"|n"&R1C24&RC[-11])&IF(RC[-10]="",,"|n"&R1C25&RC[-10])&IF(RC[-9]="",,"|n"&R1C26&RC[-9])&IF(RC[-8]="",,"|n"&R1C27&RC[-8])&IF(RC[-7]="",,"|n"&R1C28&RC[-7])&IF(RC[-6]="",,"|n"&R1C29&RC[-6])&IF(RC[-2]="",,"|n"&RC[-2]) -> 
AI664: =IF(RC[-27]&RC[-26]&RC[-25]&RC[-24]&RC[-23]&RC[-22]="",,R1C7)&IF(RC[-27]="",,"|n"&R1C8&RC[-27])&IF(RC[-26]="",,"|n"&R1C9&RC[-26])&IF(RC[-25]="",,"|n"&R1C10&RC[-25])&IF(RC[-24]="",,"|n"&R1C11&RC[-24])&IF(RC[-23]="",,"|n"&R1C12&RC[-23])&IF(RC[-22]="",,"|n"&R1C13&RC[-22])&IF(RC[-20]&RC[-19]&RC[-18]&RC[-17]="",,"|n"&R1C14)&IF(RC[-20]="",,"|n"&R1C15&RC[-20])&IF(RC[-19]="",,"|n"&R1C16&RC[-19])&IF(RC[-18]="",,"|n"&R1C17&RC[-18])&IF(RC[-17]="",,"|n"&R1C18&RC[-17])&IF(RC[-16]="",,"|n"&R1C19&RC[-16])&IF(RC[-15]="",,"|n"&R1C20&RC[-15])&IF(RC[-14]="",,"|n"&R1C21&RC[-14])&IF(RC[-13]="",,"|n"&R1C22&RC[-13])&IF(RC[-11]="",,"|n"&R1C24&RC[-11])&IF(RC[-10]="",,"|n"&R1C25&RC[-10])&IF(RC[-9]="",,"|n"&R1C26&RC[-9])&IF(RC[-8]="",,"|n"&R1C27&RC[-8])&IF(RC[-7]="",,"|n"&R1C28&RC[-7])&IF(RC[-6]="",,"|n"&R1C29&RC[-6])&IF(RC[-2]="",,"|n"&RC[-2]) -> 
AI665: =IF(RC[-27]&RC[-26]&RC[-25]&RC[-24]&RC[-23]&RC[-22]="",,R1C7)&IF(RC[-27]="",,"|n"&R1C8&RC[-27])&IF(RC[-26]="",,"|n"&R1C9&RC[-26])&IF(RC[-25]="",,"|n"&R1C10&RC[-25])&IF(RC[-24]="",,"|n"&R1C11&RC[-24])&IF(RC[-23]="",,"|n"&R1C12&RC[-23])&IF(RC[-22]="",,"|n"&R1C13&RC[-22])&IF(RC[-20]&RC[-19]&RC[-18]&RC[-17]="",,"|n"&R1C14)&IF(RC[-20]="",,"|n"&R1C15&RC[-20])&IF(RC[-19]="",,"|n"&R1C16&RC[-19])&IF(RC[-18]="",,"|n"&R1C17&RC[-18])&IF(RC[-17]="",,"|n"&R1C18&RC[-17])&IF(RC[-16]="",,"|n"&R1C19&RC[-16])&IF(RC[-15]="",,"|n"&R1C20&RC[-15])&IF(RC[-14]="",,"|n"&R1C21&RC[-14])&IF(RC[-13]="",,"|n"&R1C22&RC[-13])&IF(RC[-11]="",,"|n"&R1C24&RC[-11])&IF(RC[-10]="",,"|n"&R1C25&RC[-10])&IF(RC[-9]="",,"|n"&R1C26&RC[-9])&IF(RC[-8]="",,"|n"&R1C27&RC[-8])&IF(RC[-7]="",,"|n"&R1C28&RC[-7])&IF(RC[-6]="",,"|n"&R1C29&RC[-6])&IF(RC[-2]="",,"|n"&RC[-2]) -> 
AI666: =IF(RC[-27]&RC[-26]&RC[-25]&RC[-24]&RC[-23]&RC[-22]="",,R1C7)&IF(RC[-27]="",,"|n"&R1C8&RC[-27])&IF(RC[-26]="",,"|n"&R1C9&RC[-26])&IF(RC[-25]="",,"|n"&R1C10&RC[-25])&IF(RC[-24]="",,"|n"&R1C11&RC[-24])&IF(RC[-23]="",,"|n"&R1C12&RC[-23])&IF(RC[-22]="",,"|n"&R1C13&RC[-22])&IF(RC[-20]&RC[-19]&RC[-18]&RC[-17]="",,"|n"&R1C14)&IF(RC[-20]="",,"|n"&R1C15&RC[-20])&IF(RC[-19]="",,"|n"&R1C16&RC[-19])&IF(RC[-18]="",,"|n"&R1C17&RC[-18])&IF(RC[-17]="",,"|n"&R1C18&RC[-17])&IF(RC[-16]="",,"|n"&R1C19&RC[-16])&IF(RC[-15]="",,"|n"&R1C20&RC[-15])&IF(RC[-14]="",,"|n"&R1C21&RC[-14])&IF(RC[-13]="",,"|n"&R1C22&RC[-13])&IF(RC[-11]="",,"|n"&R1C24&RC[-11])&IF(RC[-10]="",,"|n"&R1C25&RC[-10])&IF(RC[-9]="",,"|n"&R1C26&RC[-9])&IF(RC[-8]="",,"|n"&R1C27&RC[-8])&IF(RC[-7]="",,"|n"&R1C28&RC[-7])&IF(RC[-6]="",,"|n"&R1C29&RC[-6])&IF(RC[-2]="",,"|n"&RC[-2]) -> 
AI667: =IF(RC[-27]&RC[-26]&RC[-25]&RC[-24]&RC[-23]&RC[-22]="",,R1C7)&IF(RC[-27]="",,"|n"&R1C8&RC[-27])&IF(RC[-26]="",,"|n"&R1C9&RC[-26])&IF(RC[-25]="",,"|n"&R1C10&RC[-25])&IF(RC[-24]="",,"|n"&R1C11&RC[-24])&IF(RC[-23]="",,"|n"&R1C12&RC[-23])&IF(RC[-22]="",,"|n"&R1C13&RC[-22])&IF(RC[-20]&RC[-19]&RC[-18]&RC[-17]="",,"|n"&R1C14)&IF(RC[-20]="",,"|n"&R1C15&RC[-20])&IF(RC[-19]="",,"|n"&R1C16&RC[-19])&IF(RC[-18]="",,"|n"&R1C17&RC[-18])&IF(RC[-17]="",,"|n"&R1C18&RC[-17])&IF(RC[-16]="",,"|n"&R1C19&RC[-16])&IF(RC[-15]="",,"|n"&R1C20&RC[-15])&IF(RC[-14]="",,"|n"&R1C21&RC[-14])&IF(RC[-13]="",,"|n"&R1C22&RC[-13])&IF(RC[-11]="",,"|n"&R1C24&RC[-11])&IF(RC[-10]="",,"|n"&R1C25&RC[-10])&IF(RC[-9]="",,"|n"&R1C26&RC[-9])&IF(RC[-8]="",,"|n"&R1C27&RC[-8])&IF(RC[-7]="",,"|n"&R1C28&RC[-7])&IF(RC[-6]="",,"|n"&R1C29&RC[-6])&IF(RC[-2]="",,"|n"&RC[-2]) -> 
AI668: =IF(RC[-27]&RC[-26]&RC[-25]&RC[-24]&RC[-23]&RC[-22]="",,R1C7)&IF(RC[-27]="",,"|n"&R1C8&RC[-27])&IF(RC[-26]="",,"|n"&R1C9&RC[-26])&IF(RC[-25]="",,"|n"&R1C10&RC[-25])&IF(RC[-24]="",,"|n"&R1C11&RC[-24])&IF(RC[-23]="",,"|n"&R1C12&RC[-23])&IF(RC[-22]="",,"|n"&R1C13&RC[-22])&IF(RC[-20]&RC[-19]&RC[-18]&RC[-17]="",,"|n"&R1C14)&IF(RC[-20]="",,"|n"&R1C15&RC[-20])&IF(RC[-19]="",,"|n"&R1C16&RC[-19])&IF(RC[-18]="",,"|n"&R1C17&RC[-18])&IF(RC[-17]="",,"|n"&R1C18&RC[-17])&IF(RC[-16]="",,"|n"&R1C19&RC[-16])&IF(RC[-15]="",,"|n"&R1C20&RC[-15])&IF(RC[-14]="",,"|n"&R1C21&RC[-14])&IF(RC[-13]="",,"|n"&R1C22&RC[-13])&IF(RC[-11]="",,"|n"&R1C24&RC[-11])&IF(RC[-10]="",,"|n"&R1C25&RC[-10])&IF(RC[-9]="",,"|n"&R1C26&RC[-9])&IF(RC[-8]="",,"|n"&R1C27&RC[-8])&IF(RC[-7]="",,"|n"&R1C28&RC[-7])&IF(RC[-6]="",,"|n"&R1C29&RC[-6])&IF(RC[-2]="",,"|n"&RC[-2]) -> 
AI669: =IF(RC[-27]&RC[-26]&RC[-25]&RC[-24]&RC[-23]&RC[-22]="",,R1C7)&IF(RC[-27]="",,"|n"&R1C8&RC[-27])&IF(RC[-26]="",,"|n"&R1C9&RC[-26])&IF(RC[-25]="",,"|n"&R1C10&RC[-25])&IF(RC[-24]="",,"|n"&R1C11&RC[-24])&IF(RC[-23]="",,"|n"&R1C12&RC[-23])&IF(RC[-22]="",,"|n"&R1C13&RC[-22])&IF(RC[-20]&RC[-19]&RC[-18]&RC[-17]="",,"|n"&R1C14)&IF(RC[-20]="",,"|n"&R1C15&RC[-20])&IF(RC[-19]="",,"|n"&R1C16&RC[-19])&IF(RC[-18]="",,"|n"&R1C17&RC[-18])&IF(RC[-17]="",,"|n"&R1C18&RC[-17])&IF(RC[-16]="",,"|n"&R1C19&RC[-16])&IF(RC[-15]="",,"|n"&R1C20&RC[-15])&IF(RC[-14]="",,"|n"&R1C21&RC[-14])&IF(RC[-13]="",,"|n"&R1C22&RC[-13])&IF(RC[-11]="",,"|n"&R1C24&RC[-11])&IF(RC[-10]="",,"|n"&R1C25&RC[-10])&IF(RC[-9]="",,"|n"&R1C26&RC[-9])&IF(RC[-8]="",,"|n"&R1C27&RC[-8])&IF(RC[-7]="",,"|n"&R1C28&RC[-7])&IF(RC[-6]="",,"|n"&R1C29&RC[-6])&IF(RC[-2]="",,"|n"&RC[-2]) -> 
AI670: =IF(RC[-27]&RC[-26]&RC[-25]&RC[-24]&RC[-23]&RC[-22]="",,R1C7)&IF(RC[-27]="",,"|n"&R1C8&RC[-27])&IF(RC[-26]="",,"|n"&R1C9&RC[-26])&IF(RC[-25]="",,"|n"&R1C10&RC[-25])&IF(RC[-24]="",,"|n"&R1C11&RC[-24])&IF(RC[-23]="",,"|n"&R1C12&RC[-23])&IF(RC[-22]="",,"|n"&R1C13&RC[-22])&IF(RC[-20]&RC[-19]&RC[-18]&RC[-17]="",,"|n"&R1C14)&IF(RC[-20]="",,"|n"&R1C15&RC[-20])&IF(RC[-19]="",,"|n"&R1C16&RC[-19])&IF(RC[-18]="",,"|n"&R1C17&RC[-18])&IF(RC[-17]="",,"|n"&R1C18&RC[-17])&IF(RC[-16]="",,"|n"&R1C19&RC[-16])&IF(RC[-15]="",,"|n"&R1C20&RC[-15])&IF(RC[-14]="",,"|n"&R1C21&RC[-14])&IF(RC[-13]="",,"|n"&R1C22&RC[-13])&IF(RC[-11]="",,"|n"&R1C24&RC[-11])&IF(RC[-10]="",,"|n"&R1C25&RC[-10])&IF(RC[-9]="",,"|n"&R1C26&RC[-9])&IF(RC[-8]="",,"|n"&R1C27&RC[-8])&IF(RC[-7]="",,"|n"&R1C28&RC[-7])&IF(RC[-6]="",,"|n"&R1C29&RC[-6])&IF(RC[-2]="",,"|n"&RC[-2]) -> 
AI671: =IF(RC[-27]&RC[-26]&RC[-25]&RC[-24]&RC[-23]&RC[-22]="",,R1C7)&IF(RC[-27]="",,"|n"&R1C8&RC[-27])&IF(RC[-26]="",,"|n"&R1C9&RC[-26])&IF(RC[-25]="",,"|n"&R1C10&RC[-25])&IF(RC[-24]="",,"|n"&R1C11&RC[-24])&IF(RC[-23]="",,"|n"&R1C12&RC[-23])&IF(RC[-22]="",,"|n"&R1C13&RC[-22])&IF(RC[-20]&RC[-19]&RC[-18]&RC[-17]="",,"|n"&R1C14)&IF(RC[-20]="",,"|n"&R1C15&RC[-20])&IF(RC[-19]="",,"|n"&R1C16&RC[-19])&IF(RC[-18]="",,"|n"&R1C17&RC[-18])&IF(RC[-17]="",,"|n"&R1C18&RC[-17])&IF(RC[-16]="",,"|n"&R1C19&RC[-16])&IF(RC[-15]="",,"|n"&R1C20&RC[-15])&IF(RC[-14]="",,"|n"&R1C21&RC[-14])&IF(RC[-13]="",,"|n"&R1C22&RC[-13])&IF(RC[-11]="",,"|n"&R1C24&RC[-11])&IF(RC[-10]="",,"|n"&R1C25&RC[-10])&IF(RC[-9]="",,"|n"&R1C26&RC[-9])&IF(RC[-8]="",,"|n"&R1C27&RC[-8])&IF(RC[-7]="",,"|n"&R1C28&RC[-7])&IF(RC[-6]="",,"|n"&R1C29&RC[-6])&IF(RC[-2]="",,"|n"&RC[-2]) -> 
AI672: =IF(RC[-27]&RC[-26]&RC[-25]&RC[-24]&RC[-23]&RC[-22]="",,R1C7)&IF(RC[-27]="",,"|n"&R1C8&RC[-27])&IF(RC[-26]="",,"|n"&R1C9&RC[-26])&IF(RC[-25]="",,"|n"&R1C10&RC[-25])&IF(RC[-24]="",,"|n"&R1C11&RC[-24])&IF(RC[-23]="",,"|n"&R1C12&RC[-23])&IF(RC[-22]="",,"|n"&R1C13&RC[-22])&IF(RC[-20]&RC[-19]&RC[-18]&RC[-17]="",,"|n"&R1C14)&IF(RC[-20]="",,"|n"&R1C15&RC[-20])&IF(RC[-19]="",,"|n"&R1C16&RC[-19])&IF(RC[-18]="",,"|n"&R1C17&RC[-18])&IF(RC[-17]="",,"|n"&R1C18&RC[-17])&IF(RC[-16]="",,"|n"&R1C19&RC[-16])&IF(RC[-15]="",,"|n"&R1C20&RC[-15])&IF(RC[-14]="",,"|n"&R1C21&RC[-14])&IF(RC[-13]="",,"|n"&R1C22&RC[-13])&IF(RC[-11]="",,"|n"&R1C24&RC[-11])&IF(RC[-10]="",,"|n"&R1C25&RC[-10])&IF(RC[-9]="",,"|n"&R1C26&RC[-9])&IF(RC[-8]="",,"|n"&R1C27&RC[-8])&IF(RC[-7]="",,"|n"&R1C28&RC[-7])&IF(RC[-6]="",,"|n"&R1C29&RC[-6])&IF(RC[-2]="",,"|n"&RC[-2]) -> 
AI673: =IF(RC[-27]&RC[-26]&RC[-25]&RC[-24]&RC[-23]&RC[-22]="",,R1C7)&IF(RC[-27]="",,"|n"&R1C8&RC[-27])&IF(RC[-26]="",,"|n"&R1C9&RC[-26])&IF(RC[-25]="",,"|n"&R1C10&RC[-25])&IF(RC[-24]="",,"|n"&R1C11&RC[-24])&IF(RC[-23]="",,"|n"&R1C12&RC[-23])&IF(RC[-22]="",,"|n"&R1C13&RC[-22])&IF(RC[-20]&RC[-19]&RC[-18]&RC[-17]="",,"|n"&R1C14)&IF(RC[-20]="",,"|n"&R1C15&RC[-20])&IF(RC[-19]="",,"|n"&R1C16&RC[-19])&IF(RC[-18]="",,"|n"&R1C17&RC[-18])&IF(RC[-17]="",,"|n"&R1C18&RC[-17])&IF(RC[-16]="",,"|n"&R1C19&RC[-16])&IF(RC[-15]="",,"|n"&R1C20&RC[-15])&IF(RC[-14]="",,"|n"&R1C21&RC[-14])&IF(RC[-13]="",,"|n"&R1C22&RC[-13])&IF(RC[-11]="",,"|n"&R1C24&RC[-11])&IF(RC[-10]="",,"|n"&R1C25&RC[-10])&IF(RC[-9]="",,"|n"&R1C26&RC[-9])&IF(RC[-8]="",,"|n"&R1C27&RC[-8])&IF(RC[-7]="",,"|n"&R1C28&RC[-7])&IF(RC[-6]="",,"|n"&R1C29&RC[-6])&IF(RC[-2]="",,"|n"&RC[-2]) -> 
AI674: =IF(RC[-27]&RC[-26]&RC[-25]&RC[-24]&RC[-23]&RC[-22]="",,R1C7)&IF(RC[-27]="",,"|n"&R1C8&RC[-27])&IF(RC[-26]="",,"|n"&R1C9&RC[-26])&IF(RC[-25]="",,"|n"&R1C10&RC[-25])&IF(RC[-24]="",,"|n"&R1C11&RC[-24])&IF(RC[-23]="",,"|n"&R1C12&RC[-23])&IF(RC[-22]="",,"|n"&R1C13&RC[-22])&IF(RC[-20]&RC[-19]&RC[-18]&RC[-17]="",,"|n"&R1C14)&IF(RC[-20]="",,"|n"&R1C15&RC[-20])&IF(RC[-19]="",,"|n"&R1C16&RC[-19])&IF(RC[-18]="",,"|n"&R1C17&RC[-18])&IF(RC[-17]="",,"|n"&R1C18&RC[-17])&IF(RC[-16]="",,"|n"&R1C19&RC[-16])&IF(RC[-15]="",,"|n"&R1C20&RC[-15])&IF(RC[-14]="",,"|n"&R1C21&RC[-14])&IF(RC[-13]="",,"|n"&R1C22&RC[-13])&IF(RC[-11]="",,"|n"&R1C24&RC[-11])&IF(RC[-10]="",,"|n"&R1C25&RC[-10])&IF(RC[-9]="",,"|n"&R1C26&RC[-9])&IF(RC[-8]="",,"|n"&R1C27&RC[-8])&IF(RC[-7]="",,"|n"&R1C28&RC[-7])&IF(RC[-6]="",,"|n"&R1C29&RC[-6])&IF(RC[-2]="",,"|n"&RC[-2]) -> 
AI675: =IF(RC[-27]&RC[-26]&RC[-25]&RC[-24]&RC[-23]&RC[-22]="",,R1C7)&IF(RC[-27]="",,"|n"&R1C8&RC[-27])&IF(RC[-26]="",,"|n"&R1C9&RC[-26])&IF(RC[-25]="",,"|n"&R1C10&RC[-25])&IF(RC[-24]="",,"|n"&R1C11&RC[-24])&IF(RC[-23]="",,"|n"&R1C12&RC[-23])&IF(RC[-22]="",,"|n"&R1C13&RC[-22])&IF(RC[-20]&RC[-19]&RC[-18]&RC[-17]="",,"|n"&R1C14)&IF(RC[-20]="",,"|n"&R1C15&RC[-20])&IF(RC[-19]="",,"|n"&R1C16&RC[-19])&IF(RC[-18]="",,"|n"&R1C17&RC[-18])&IF(RC[-17]="",,"|n"&R1C18&RC[-17])&IF(RC[-16]="",,"|n"&R1C19&RC[-16])&IF(RC[-15]="",,"|n"&R1C20&RC[-15])&IF(RC[-14]="",,"|n"&R1C21&RC[-14])&IF(RC[-13]="",,"|n"&R1C22&RC[-13])&IF(RC[-11]="",,"|n"&R1C24&RC[-11])&IF(RC[-10]="",,"|n"&R1C25&RC[-10])&IF(RC[-9]="",,"|n"&R1C26&RC[-9])&IF(RC[-8]="",,"|n"&R1C27&RC[-8])&IF(RC[-7]="",,"|n"&R1C28&RC[-7])&IF(RC[-6]="",,"|n"&R1C29&RC[-6])&IF(RC[-2]="",,"|n"&RC[-2]) -> 
AI676: =IF(RC[-27]&RC[-26]&RC[-25]&RC[-24]&RC[-23]&RC[-22]="",,R1C7)&IF(RC[-27]="",,"|n"&R1C8&RC[-27])&IF(RC[-26]="",,"|n"&R1C9&RC[-26])&IF(RC[-25]="",,"|n"&R1C10&RC[-25])&IF(RC[-24]="",,"|n"&R1C11&RC[-24])&IF(RC[-23]="",,"|n"&R1C12&RC[-23])&IF(RC[-22]="",,"|n"&R1C13&RC[-22])&IF(RC[-20]&RC[-19]&RC[-18]&RC[-17]="",,"|n"&R1C14)&IF(RC[-20]="",,"|n"&R1C15&RC[-20])&IF(RC[-19]="",,"|n"&R1C16&RC[-19])&IF(RC[-18]="",,"|n"&R1C17&RC[-18])&IF(RC[-17]="",,"|n"&R1C18&RC[-17])&IF(RC[-16]="",,"|n"&R1C19&RC[-16])&IF(RC[-15]="",,"|n"&R1C20&RC[-15])&IF(RC[-14]="",,"|n"&R1C21&RC[-14])&IF(RC[-13]="",,"|n"&R1C22&RC[-13])&IF(RC[-11]="",,"|n"&R1C24&RC[-11])&IF(RC[-10]="",,"|n"&R1C25&RC[-10])&IF(RC[-9]="",,"|n"&R1C26&RC[-9])&IF(RC[-8]="",,"|n"&R1C27&RC[-8])&IF(RC[-7]="",,"|n"&R1C28&RC[-7])&IF(RC[-6]="",,"|n"&R1C29&RC[-6])&IF(RC[-2]="",,"|n"&RC[-2]) -> 
AI677: =IF(RC[-27]&RC[-26]&RC[-25]&RC[-24]&RC[-23]&RC[-22]="",,R1C7)&IF(RC[-27]="",,"|n"&R1C8&RC[-27])&IF(RC[-26]="",,"|n"&R1C9&RC[-26])&IF(RC[-25]="",,"|n"&R1C10&RC[-25])&IF(RC[-24]="",,"|n"&R1C11&RC[-24])&IF(RC[-23]="",,"|n"&R1C12&RC[-23])&IF(RC[-22]="",,"|n"&R1C13&RC[-22])&IF(RC[-20]&RC[-19]&RC[-18]&RC[-17]="",,"|n"&R1C14)&IF(RC[-20]="",,"|n"&R1C15&RC[-20])&IF(RC[-19]="",,"|n"&R1C16&RC[-19])&IF(RC[-18]="",,"|n"&R1C17&RC[-18])&IF(RC[-17]="",,"|n"&R1C18&RC[-17])&IF(RC[-16]="",,"|n"&R1C19&RC[-16])&IF(RC[-15]="",,"|n"&R1C20&RC[-15])&IF(RC[-14]="",,"|n"&R1C21&RC[-14])&IF(RC[-13]="",,"|n"&R1C22&RC[-13])&IF(RC[-11]="",,"|n"&R1C24&RC[-11])&IF(RC[-10]="",,"|n"&R1C25&RC[-10])&IF(RC[-9]="",,"|n"&R1C26&RC[-9])&IF(RC[-8]="",,"|n"&R1C27&RC[-8])&IF(RC[-7]="",,"|n"&R1C28&RC[-7])&IF(RC[-6]="",,"|n"&R1C29&RC[-6])&IF(RC[-2]="",,"|n"&RC[-2]) -> 
AI678: =IF(RC[-27]&RC[-26]&RC[-25]&RC[-24]&RC[-23]&RC[-22]="",,R1C7)&IF(RC[-27]="",,"|n"&R1C8&RC[-27])&IF(RC[-26]="",,"|n"&R1C9&RC[-26])&IF(RC[-25]="",,"|n"&R1C10&RC[-25])&IF(RC[-24]="",,"|n"&R1C11&RC[-24])&IF(RC[-23]="",,"|n"&R1C12&RC[-23])&IF(RC[-22]="",,"|n"&R1C13&RC[-22])&IF(RC[-20]&RC[-19]&RC[-18]&RC[-17]="",,"|n"&R1C14)&IF(RC[-20]="",,"|n"&R1C15&RC[-20])&IF(RC[-19]="",,"|n"&R1C16&RC[-19])&IF(RC[-18]="",,"|n"&R1C17&RC[-18])&IF(RC[-17]="",,"|n"&R1C18&RC[-17])&IF(RC[-16]="",,"|n"&R1C19&RC[-16])&IF(RC[-15]="",,"|n"&R1C20&RC[-15])&IF(RC[-14]="",,"|n"&R1C21&RC[-14])&IF(RC[-13]="",,"|n"&R1C22&RC[-13])&IF(RC[-11]="",,"|n"&R1C24&RC[-11])&IF(RC[-10]="",,"|n"&R1C25&RC[-10])&IF(RC[-9]="",,"|n"&R1C26&RC[-9])&IF(RC[-8]="",,"|n"&R1C27&RC[-8])&IF(RC[-7]="",,"|n"&R1C28&RC[-7])&IF(RC[-6]="",,"|n"&R1C29&RC[-6])&IF(RC[-2]="",,"|n"&RC[-2]) -> 
AI679: =IF(RC[-27]&RC[-26]&RC[-25]&RC[-24]&RC[-23]&RC[-22]="",,R1C7)&IF(RC[-27]="",,"|n"&R1C8&RC[-27])&IF(RC[-26]="",,"|n"&R1C9&RC[-26])&IF(RC[-25]="",,"|n"&R1C10&RC[-25])&IF(RC[-24]="",,"|n"&R1C11&RC[-24])&IF(RC[-23]="",,"|n"&R1C12&RC[-23])&IF(RC[-22]="",,"|n"&R1C13&RC[-22])&IF(RC[-20]&RC[-19]&RC[-18]&RC[-17]="",,"|n"&R1C14)&IF(RC[-20]="",,"|n"&R1C15&RC[-20])&IF(RC[-19]="",,"|n"&R1C16&RC[-19])&IF(RC[-18]="",,"|n"&R1C17&RC[-18])&IF(RC[-17]="",,"|n"&R1C18&RC[-17])&IF(RC[-16]="",,"|n"&R1C19&RC[-16])&IF(RC[-15]="",,"|n"&R1C20&RC[-15])&IF(RC[-14]="",,"|n"&R1C21&RC[-14])&IF(RC[-13]="",,"|n"&R1C22&RC[-13])&IF(RC[-11]="",,"|n"&R1C24&RC[-11])&IF(RC[-10]="",,"|n"&R1C25&RC[-10])&IF(RC[-9]="",,"|n"&R1C26&RC[-9])&IF(RC[-8]="",,"|n"&R1C27&RC[-8])&IF(RC[-7]="",,"|n"&R1C28&RC[-7])&IF(RC[-6]="",,"|n"&R1C29&RC[-6])&IF(RC[-2]="",,"|n"&RC[-2]) -> 
AI680: =IF(RC[-27]&RC[-26]&RC[-25]&RC[-24]&RC[-23]&RC[-22]="",,R1C7)&IF(RC[-27]="",,"|n"&R1C8&RC[-27])&IF(RC[-26]="",,"|n"&R1C9&RC[-26])&IF(RC[-25]="",,"|n"&R1C10&RC[-25])&IF(RC[-24]="",,"|n"&R1C11&RC[-24])&IF(RC[-23]="",,"|n"&R1C12&RC[-23])&IF(RC[-22]="",,"|n"&R1C13&RC[-22])&IF(RC[-20]&RC[-19]&RC[-18]&RC[-17]="",,"|n"&R1C14)&IF(RC[-20]="",,"|n"&R1C15&RC[-20])&IF(RC[-19]="",,"|n"&R1C16&RC[-19])&IF(RC[-18]="",,"|n"&R1C17&RC[-18])&IF(RC[-17]="",,"|n"&R1C18&RC[-17])&IF(RC[-16]="",,"|n"&R1C19&RC[-16])&IF(RC[-15]="",,"|n"&R1C20&RC[-15])&IF(RC[-14]="",,"|n"&R1C21&RC[-14])&IF(RC[-13]="",,"|n"&R1C22&RC[-13])&IF(RC[-11]="",,"|n"&R1C24&RC[-11])&IF(RC[-10]="",,"|n"&R1C25&RC[-10])&IF(RC[-9]="",,"|n"&R1C26&RC[-9])&IF(RC[-8]="",,"|n"&R1C27&RC[-8])&IF(RC[-7]="",,"|n"&R1C28&RC[-7])&IF(RC[-6]="",,"|n"&R1C29&RC[-6])&IF(RC[-2]="",,"|n"&RC[-2]) -> 
AI681: =IF(RC[-27]&RC[-26]&RC[-25]&RC[-24]&RC[-23]&RC[-22]="",,R1C7)&IF(RC[-27]="",,"|n"&R1C8&RC[-27])&IF(RC[-26]="",,"|n"&R1C9&RC[-26])&IF(RC[-25]="",,"|n"&R1C10&RC[-25])&IF(RC[-24]="",,"|n"&R1C11&RC[-24])&IF(RC[-23]="",,"|n"&R1C12&RC[-23])&IF(RC[-22]="",,"|n"&R1C13&RC[-22])&IF(RC[-20]&RC[-19]&RC[-18]&RC[-17]="",,"|n"&R1C14)&IF(RC[-20]="",,"|n"&R1C15&RC[-20])&IF(RC[-19]="",,"|n"&R1C16&RC[-19])&IF(RC[-18]="",,"|n"&R1C17&RC[-18])&IF(RC[-17]="",,"|n"&R1C18&RC[-17])&IF(RC[-16]="",,"|n"&R1C19&RC[-16])&IF(RC[-15]="",,"|n"&R1C20&RC[-15])&IF(RC[-14]="",,"|n"&R1C21&RC[-14])&IF(RC[-13]="",,"|n"&R1C22&RC[-13])&IF(RC[-11]="",,"|n"&R1C24&RC[-11])&IF(RC[-10]="",,"|n"&R1C25&RC[-10])&IF(RC[-9]="",,"|n"&R1C26&RC[-9])&IF(RC[-8]="",,"|n"&R1C27&RC[-8])&IF(RC[-7]="",,"|n"&R1C28&RC[-7])&IF(RC[-6]="",,"|n"&R1C29&RC[-6])&IF(RC[-2]="",,"|n"&RC[-2]) -> 
AI682: =IF(RC[-27]&RC[-26]&RC[-25]&RC[-24]&RC[-23]&RC[-22]="",,R1C7)&IF(RC[-27]="",,"|n"&R1C8&RC[-27])&IF(RC[-26]="",,"|n"&R1C9&RC[-26])&IF(RC[-25]="",,"|n"&R1C10&RC[-25])&IF(RC[-24]="",,"|n"&R1C11&RC[-24])&IF(RC[-23]="",,"|n"&R1C12&RC[-23])&IF(RC[-22]="",,"|n"&R1C13&RC[-22])&IF(RC[-20]&RC[-19]&RC[-18]&RC[-17]="",,"|n"&R1C14)&IF(RC[-20]="",,"|n"&R1C15&RC[-20])&IF(RC[-19]="",,"|n"&R1C16&RC[-19])&IF(RC[-18]="",,"|n"&R1C17&RC[-18])&IF(RC[-17]="",,"|n"&R1C18&RC[-17])&IF(RC[-16]="",,"|n"&R1C19&RC[-16])&IF(RC[-15]="",,"|n"&R1C20&RC[-15])&IF(RC[-14]="",,"|n"&R1C21&RC[-14])&IF(RC[-13]="",,"|n"&R1C22&RC[-13])&IF(RC[-11]="",,"|n"&R1C24&RC[-11])&IF(RC[-10]="",,"|n"&R1C25&RC[-10])&IF(RC[-9]="",,"|n"&R1C26&RC[-9])&IF(RC[-8]="",,"|n"&R1C27&RC[-8])&IF(RC[-7]="",,"|n"&R1C28&RC[-7])&IF(RC[-6]="",,"|n"&R1C29&RC[-6])&IF(RC[-2]="",,"|n"&RC[-2]) -> 
AI683: =IF(RC[-27]&RC[-26]&RC[-25]&RC[-24]&RC[-23]&RC[-22]="",,R1C7)&IF(RC[-27]="",,"|n"&R1C8&RC[-27])&IF(RC[-26]="",,"|n"&R1C9&RC[-26])&IF(RC[-25]="",,"|n"&R1C10&RC[-25])&IF(RC[-24]="",,"|n"&R1C11&RC[-24])&IF(RC[-23]="",,"|n"&R1C12&RC[-23])&IF(RC[-22]="",,"|n"&R1C13&RC[-22])&IF(RC[-20]&RC[-19]&RC[-18]&RC[-17]="",,"|n"&R1C14)&IF(RC[-20]="",,"|n"&R1C15&RC[-20])&IF(RC[-19]="",,"|n"&R1C16&RC[-19])&IF(RC[-18]="",,"|n"&R1C17&RC[-18])&IF(RC[-17]="",,"|n"&R1C18&RC[-17])&IF(RC[-16]="",,"|n"&R1C19&RC[-16])&IF(RC[-15]="",,"|n"&R1C20&RC[-15])&IF(RC[-14]="",,"|n"&R1C21&RC[-14])&IF(RC[-13]="",,"|n"&R1C22&RC[-13])&IF(RC[-11]="",,"|n"&R1C24&RC[-11])&IF(RC[-10]="",,"|n"&R1C25&RC[-10])&IF(RC[-9]="",,"|n"&R1C26&RC[-9])&IF(RC[-8]="",,"|n"&R1C27&RC[-8])&IF(RC[-7]="",,"|n"&R1C28&RC[-7])&IF(RC[-6]="",,"|n"&R1C29&RC[-6])&IF(RC[-2]="",,"|n"&RC[-2]) -> 
AI684: =IF(RC[-27]&RC[-26]&RC[-25]&RC[-24]&RC[-23]&RC[-22]="",,R1C7)&IF(RC[-27]="",,"|n"&R1C8&RC[-27])&IF(RC[-26]="",,"|n"&R1C9&RC[-26])&IF(RC[-25]="",,"|n"&R1C10&RC[-25])&IF(RC[-24]="",,"|n"&R1C11&RC[-24])&IF(RC[-23]="",,"|n"&R1C12&RC[-23])&IF(RC[-22]="",,"|n"&R1C13&RC[-22])&IF(RC[-20]&RC[-19]&RC[-18]&RC[-17]="",,"|n"&R1C14)&IF(RC[-20]="",,"|n"&R1C15&RC[-20])&IF(RC[-19]="",,"|n"&R1C16&RC[-19])&IF(RC[-18]="",,"|n"&R1C17&RC[-18])&IF(RC[-17]="",,"|n"&R1C18&RC[-17])&IF(RC[-16]="",,"|n"&R1C19&RC[-16])&IF(RC[-15]="",,"|n"&R1C20&RC[-15])&IF(RC[-14]="",,"|n"&R1C21&RC[-14])&IF(RC[-13]="",,"|n"&R1C22&RC[-13])&IF(RC[-11]="",,"|n"&R1C24&RC[-11])&IF(RC[-10]="",,"|n"&R1C25&RC[-10])&IF(RC[-9]="",,"|n"&R1C26&RC[-9])&IF(RC[-8]="",,"|n"&R1C27&RC[-8])&IF(RC[-7]="",,"|n"&R1C28&RC[-7])&IF(RC[-6]="",,"|n"&R1C29&RC[-6])&IF(RC[-2]="",,"|n"&RC[-2]) -> 
AI685: =IF(RC[-27]&RC[-26]&RC[-25]&RC[-24]&RC[-23]&RC[-22]="",,R1C7)&IF(RC[-27]="",,"|n"&R1C8&RC[-27])&IF(RC[-26]="",,"|n"&R1C9&RC[-26])&IF(RC[-25]="",,"|n"&R1C10&RC[-25])&IF(RC[-24]="",,"|n"&R1C11&RC[-24])&IF(RC[-23]="",,"|n"&R1C12&RC[-23])&IF(RC[-22]="",,"|n"&R1C13&RC[-22])&IF(RC[-20]&RC[-19]&RC[-18]&RC[-17]="",,"|n"&R1C14)&IF(RC[-20]="",,"|n"&R1C15&RC[-20])&IF(RC[-19]="",,"|n"&R1C16&RC[-19])&IF(RC[-18]="",,"|n"&R1C17&RC[-18])&IF(RC[-17]="",,"|n"&R1C18&RC[-17])&IF(RC[-16]="",,"|n"&R1C19&RC[-16])&IF(RC[-15]="",,"|n"&R1C20&RC[-15])&IF(RC[-14]="",,"|n"&R1C21&RC[-14])&IF(RC[-13]="",,"|n"&R1C22&RC[-13])&IF(RC[-11]="",,"|n"&R1C24&RC[-11])&IF(RC[-10]="",,"|n"&R1C25&RC[-10])&IF(RC[-9]="",,"|n"&R1C26&RC[-9])&IF(RC[-8]="",,"|n"&R1C27&RC[-8])&IF(RC[-7]="",,"|n"&R1C28&RC[-7])&IF(RC[-6]="",,"|n"&R1C29&RC[-6])&IF(RC[-2]="",,"|n"&RC[-2]) -> 
AI686: =IF(RC[-27]&RC[-26]&RC[-25]&RC[-24]&RC[-23]&RC[-22]="",,R1C7)&IF(RC[-27]="",,"|n"&R1C8&RC[-27])&IF(RC[-26]="",,"|n"&R1C9&RC[-26])&IF(RC[-25]="",,"|n"&R1C10&RC[-25])&IF(RC[-24]="",,"|n"&R1C11&RC[-24])&IF(RC[-23]="",,"|n"&R1C12&RC[-23])&IF(RC[-22]="",,"|n"&R1C13&RC[-22])&IF(RC[-20]&RC[-19]&RC[-18]&RC[-17]="",,"|n"&R1C14)&IF(RC[-20]="",,"|n"&R1C15&RC[-20])&IF(RC[-19]="",,"|n"&R1C16&RC[-19])&IF(RC[-18]="",,"|n"&R1C17&RC[-18])&IF(RC[-17]="",,"|n"&R1C18&RC[-17])&IF(RC[-16]="",,"|n"&R1C19&RC[-16])&IF(RC[-15]="",,"|n"&R1C20&RC[-15])&IF(RC[-14]="",,"|n"&R1C21&RC[-14])&IF(RC[-13]="",,"|n"&R1C22&RC[-13])&IF(RC[-11]="",,"|n"&R1C24&RC[-11])&IF(RC[-10]="",,"|n"&R1C25&RC[-10])&IF(RC[-9]="",,"|n"&R1C26&RC[-9])&IF(RC[-8]="",,"|n"&R1C27&RC[-8])&IF(RC[-7]="",,"|n"&R1C28&RC[-7])&IF(RC[-6]="",,"|n"&R1C29&RC[-6])&IF(RC[-2]="",,"|n"&RC[-2]) -> 
AI687: =IF(RC[-27]&RC[-26]&RC[-25]&RC[-24]&RC[-23]&RC[-22]="",,R1C7)&IF(RC[-27]="",,"|n"&R1C8&RC[-27])&IF(RC[-26]="",,"|n"&R1C9&RC[-26])&IF(RC[-25]="",,"|n"&R1C10&RC[-25])&IF(RC[-24]="",,"|n"&R1C11&RC[-24])&IF(RC[-23]="",,"|n"&R1C12&RC[-23])&IF(RC[-22]="",,"|n"&R1C13&RC[-22])&IF(RC[-20]&RC[-19]&RC[-18]&RC[-17]="",,"|n"&R1C14)&IF(RC[-20]="",,"|n"&R1C15&RC[-20])&IF(RC[-19]="",,"|n"&R1C16&RC[-19])&IF(RC[-18]="",,"|n"&R1C17&RC[-18])&IF(RC[-17]="",,"|n"&R1C18&RC[-17])&IF(RC[-16]="",,"|n"&R1C19&RC[-16])&IF(RC[-15]="",,"|n"&R1C20&RC[-15])&IF(RC[-14]="",,"|n"&R1C21&RC[-14])&IF(RC[-13]="",,"|n"&R1C22&RC[-13])&IF(RC[-11]="",,"|n"&R1C24&RC[-11])&IF(RC[-10]="",,"|n"&R1C25&RC[-10])&IF(RC[-9]="",,"|n"&R1C26&RC[-9])&IF(RC[-8]="",,"|n"&R1C27&RC[-8])&IF(RC[-7]="",,"|n"&R1C28&RC[-7])&IF(RC[-6]="",,"|n"&R1C29&RC[-6])&IF(RC[-2]="",,"|n"&RC[-2]) -> 
AI688: =IF(RC[-27]&RC[-26]&RC[-25]&RC[-24]&RC[-23]&RC[-22]="",,R1C7)&IF(RC[-27]="",,"|n"&R1C8&RC[-27])&IF(RC[-26]="",,"|n"&R1C9&RC[-26])&IF(RC[-25]="",,"|n"&R1C10&RC[-25])&IF(RC[-24]="",,"|n"&R1C11&RC[-24])&IF(RC[-23]="",,"|n"&R1C12&RC[-23])&IF(RC[-22]="",,"|n"&R1C13&RC[-22])&IF(RC[-20]&RC[-19]&RC[-18]&RC[-17]="",,"|n"&R1C14)&IF(RC[-20]="",,"|n"&R1C15&RC[-20])&IF(RC[-19]="",,"|n"&R1C16&RC[-19])&IF(RC[-18]="",,"|n"&R1C17&RC[-18])&IF(RC[-17]="",,"|n"&R1C18&RC[-17])&IF(RC[-16]="",,"|n"&R1C19&RC[-16])&IF(RC[-15]="",,"|n"&R1C20&RC[-15])&IF(RC[-14]="",,"|n"&R1C21&RC[-14])&IF(RC[-13]="",,"|n"&R1C22&RC[-13])&IF(RC[-11]="",,"|n"&R1C24&RC[-11])&IF(RC[-10]="",,"|n"&R1C25&RC[-10])&IF(RC[-9]="",,"|n"&R1C26&RC[-9])&IF(RC[-8]="",,"|n"&R1C27&RC[-8])&IF(RC[-7]="",,"|n"&R1C28&RC[-7])&IF(RC[-6]="",,"|n"&R1C29&RC[-6])&IF(RC[-2]="",,"|n"&RC[-2]) -> 
AI689: =IF(RC[-27]&RC[-26]&RC[-25]&RC[-24]&RC[-23]&RC[-22]="",,R1C7)&IF(RC[-27]="",,"|n"&R1C8&RC[-27])&IF(RC[-26]="",,"|n"&R1C9&RC[-26])&IF(RC[-25]="",,"|n"&R1C10&RC[-25])&IF(RC[-24]="",,"|n"&R1C11&RC[-24])&IF(RC[-23]="",,"|n"&R1C12&RC[-23])&IF(RC[-22]="",,"|n"&R1C13&RC[-22])&IF(RC[-20]&RC[-19]&RC[-18]&RC[-17]="",,"|n"&R1C14)&IF(RC[-20]="",,"|n"&R1C15&RC[-20])&IF(RC[-19]="",,"|n"&R1C16&RC[-19])&IF(RC[-18]="",,"|n"&R1C17&RC[-18])&IF(RC[-17]="",,"|n"&R1C18&RC[-17])&IF(RC[-16]="",,"|n"&R1C19&RC[-16])&IF(RC[-15]="",,"|n"&R1C20&RC[-15])&IF(RC[-14]="",,"|n"&R1C21&RC[-14])&IF(RC[-13]="",,"|n"&R1C22&RC[-13])&IF(RC[-11]="",,"|n"&R1C24&RC[-11])&IF(RC[-10]="",,"|n"&R1C25&RC[-10])&IF(RC[-9]="",,"|n"&R1C26&RC[-9])&IF(RC[-8]="",,"|n"&R1C27&RC[-8])&IF(RC[-7]="",,"|n"&R1C28&RC[-7])&IF(RC[-6]="",,"|n"&R1C29&RC[-6])&IF(RC[-2]="",,"|n"&RC[-2]) -> 
AI690: =IF(RC[-27]&RC[-26]&RC[-25]&RC[-24]&RC[-23]&RC[-22]="",,R1C7)&IF(RC[-27]="",,"|n"&R1C8&RC[-27])&IF(RC[-26]="",,"|n"&R1C9&RC[-26])&IF(RC[-25]="",,"|n"&R1C10&RC[-25])&IF(RC[-24]="",,"|n"&R1C11&RC[-24])&IF(RC[-23]="",,"|n"&R1C12&RC[-23])&IF(RC[-22]="",,"|n"&R1C13&RC[-22])&IF(RC[-20]&RC[-19]&RC[-18]&RC[-17]="",,"|n"&R1C14)&IF(RC[-20]="",,"|n"&R1C15&RC[-20])&IF(RC[-19]="",,"|n"&R1C16&RC[-19])&IF(RC[-18]="",,"|n"&R1C17&RC[-18])&IF(RC[-17]="",,"|n"&R1C18&RC[-17])&IF(RC[-16]="",,"|n"&R1C19&RC[-16])&IF(RC[-15]="",,"|n"&R1C20&RC[-15])&IF(RC[-14]="",,"|n"&R1C21&RC[-14])&IF(RC[-13]="",,"|n"&R1C22&RC[-13])&IF(RC[-11]="",,"|n"&R1C24&RC[-11])&IF(RC[-10]="",,"|n"&R1C25&RC[-10])&IF(RC[-9]="",,"|n"&R1C26&RC[-9])&IF(RC[-8]="",,"|n"&R1C27&RC[-8])&IF(RC[-7]="",,"|n"&R1C28&RC[-7])&IF(RC[-6]="",,"|n"&R1C29&RC[-6])&IF(RC[-2]="",,"|n"&RC[-2]) -> 
AI691: =IF(RC[-27]&RC[-26]&RC[-25]&RC[-24]&RC[-23]&RC[-22]="",,R1C7)&IF(RC[-27]="",,"|n"&R1C8&RC[-27])&IF(RC[-26]="",,"|n"&R1C9&RC[-26])&IF(RC[-25]="",,"|n"&R1C10&RC[-25])&IF(RC[-24]="",,"|n"&R1C11&RC[-24])&IF(RC[-23]="",,"|n"&R1C12&RC[-23])&IF(RC[-22]="",,"|n"&R1C13&RC[-22])&IF(RC[-20]&RC[-19]&RC[-18]&RC[-17]="",,"|n"&R1C14)&IF(RC[-20]="",,"|n"&R1C15&RC[-20])&IF(RC[-19]="",,"|n"&R1C16&RC[-19])&IF(RC[-18]="",,"|n"&R1C17&RC[-18])&IF(RC[-17]="",,"|n"&R1C18&RC[-17])&IF(RC[-16]="",,"|n"&R1C19&RC[-16])&IF(RC[-15]="",,"|n"&R1C20&RC[-15])&IF(RC[-14]="",,"|n"&R1C21&RC[-14])&IF(RC[-13]="",,"|n"&R1C22&RC[-13])&IF(RC[-11]="",,"|n"&R1C24&RC[-11])&IF(RC[-10]="",,"|n"&R1C25&RC[-10])&IF(RC[-9]="",,"|n"&R1C26&RC[-9])&IF(RC[-8]="",,"|n"&R1C27&RC[-8])&IF(RC[-7]="",,"|n"&R1C28&RC[-7])&IF(RC[-6]="",,"|n"&R1C29&RC[-6])&IF(RC[-2]="",,"|n"&RC[-2]) -> 
AI692: =IF(RC[-27]&RC[-26]&RC[-25]&RC[-24]&RC[-23]&RC[-22]="",,R1C7)&IF(RC[-27]="",,"|n"&R1C8&RC[-27])&IF(RC[-26]="",,"|n"&R1C9&RC[-26])&IF(RC[-25]="",,"|n"&R1C10&RC[-25])&IF(RC[-24]="",,"|n"&R1C11&RC[-24])&IF(RC[-23]="",,"|n"&R1C12&RC[-23])&IF(RC[-22]="",,"|n"&R1C13&RC[-22])&IF(RC[-20]&RC[-19]&RC[-18]&RC[-17]="",,"|n"&R1C14)&IF(RC[-20]="",,"|n"&R1C15&RC[-20])&IF(RC[-19]="",,"|n"&R1C16&RC[-19])&IF(RC[-18]="",,"|n"&R1C17&RC[-18])&IF(RC[-17]="",,"|n"&R1C18&RC[-17])&IF(RC[-16]="",,"|n"&R1C19&RC[-16])&IF(RC[-15]="",,"|n"&R1C20&RC[-15])&IF(RC[-14]="",,"|n"&R1C21&RC[-14])&IF(RC[-13]="",,"|n"&R1C22&RC[-13])&IF(RC[-11]="",,"|n"&R1C24&RC[-11])&IF(RC[-10]="",,"|n"&R1C25&RC[-10])&IF(RC[-9]="",,"|n"&R1C26&RC[-9])&IF(RC[-8]="",,"|n"&R1C27&RC[-8])&IF(RC[-7]="",,"|n"&R1C28&RC[-7])&IF(RC[-6]="",,"|n"&R1C29&RC[-6])&IF(RC[-2]="",,"|n"&RC[-2]) -> 
AI693: =IF(RC[-27]&RC[-26]&RC[-25]&RC[-24]&RC[-23]&RC[-22]="",,R1C7)&IF(RC[-27]="",,"|n"&R1C8&RC[-27])&IF(RC[-26]="",,"|n"&R1C9&RC[-26])&IF(RC[-25]="",,"|n"&R1C10&RC[-25])&IF(RC[-24]="",,"|n"&R1C11&RC[-24])&IF(RC[-23]="",,"|n"&R1C12&RC[-23])&IF(RC[-22]="",,"|n"&R1C13&RC[-22])&IF(RC[-20]&RC[-19]&RC[-18]&RC[-17]="",,"|n"&R1C14)&IF(RC[-20]="",,"|n"&R1C15&RC[-20])&IF(RC[-19]="",,"|n"&R1C16&RC[-19])&IF(RC[-18]="",,"|n"&R1C17&RC[-18])&IF(RC[-17]="",,"|n"&R1C18&RC[-17])&IF(RC[-16]="",,"|n"&R1C19&RC[-16])&IF(RC[-15]="",,"|n"&R1C20&RC[-15])&IF(RC[-14]="",,"|n"&R1C21&RC[-14])&IF(RC[-13]="",,"|n"&R1C22&RC[-13])&IF(RC[-11]="",,"|n"&R1C24&RC[-11])&IF(RC[-10]="",,"|n"&R1C25&RC[-10])&IF(RC[-9]="",,"|n"&R1C26&RC[-9])&IF(RC[-8]="",,"|n"&R1C27&RC[-8])&IF(RC[-7]="",,"|n"&R1C28&RC[-7])&IF(RC[-6]="",,"|n"&R1C29&RC[-6])&IF(RC[-2]="",,"|n"&RC[-2]) -> 
AI694: =IF(RC[-27]&RC[-26]&RC[-25]&RC[-24]&RC[-23]&RC[-22]="",,R1C7)&IF(RC[-27]="",,"|n"&R1C8&RC[-27])&IF(RC[-26]="",,"|n"&R1C9&RC[-26])&IF(RC[-25]="",,"|n"&R1C10&RC[-25])&IF(RC[-24]="",,"|n"&R1C11&RC[-24])&IF(RC[-23]="",,"|n"&R1C12&RC[-23])&IF(RC[-22]="",,"|n"&R1C13&RC[-22])&IF(RC[-20]&RC[-19]&RC[-18]&RC[-17]="",,"|n"&R1C14)&IF(RC[-20]="",,"|n"&R1C15&RC[-20])&IF(RC[-19]="",,"|n"&R1C16&RC[-19])&IF(RC[-18]="",,"|n"&R1C17&RC[-18])&IF(RC[-17]="",,"|n"&R1C18&RC[-17])&IF(RC[-16]="",,"|n"&R1C19&RC[-16])&IF(RC[-15]="",,"|n"&R1C20&RC[-15])&IF(RC[-14]="",,"|n"&R1C21&RC[-14])&IF(RC[-13]="",,"|n"&R1C22&RC[-13])&IF(RC[-11]="",,"|n"&R1C24&RC[-11])&IF(RC[-10]="",,"|n"&R1C25&RC[-10])&IF(RC[-9]="",,"|n"&R1C26&RC[-9])&IF(RC[-8]="",,"|n"&R1C27&RC[-8])&IF(RC[-7]="",,"|n"&R1C28&RC[-7])&IF(RC[-6]="",,"|n"&R1C29&RC[-6])&IF(RC[-2]="",,"|n"&RC[-2]) -> 
AI695: =IF(RC[-27]&RC[-26]&RC[-25]&RC[-24]&RC[-23]&RC[-22]="",,R1C7)&IF(RC[-27]="",,"|n"&R1C8&RC[-27])&IF(RC[-26]="",,"|n"&R1C9&RC[-26])&IF(RC[-25]="",,"|n"&R1C10&RC[-25])&IF(RC[-24]="",,"|n"&R1C11&RC[-24])&IF(RC[-23]="",,"|n"&R1C12&RC[-23])&IF(RC[-22]="",,"|n"&R1C13&RC[-22])&IF(RC[-20]&RC[-19]&RC[-18]&RC[-17]="",,"|n"&R1C14)&IF(RC[-20]="",,"|n"&R1C15&RC[-20])&IF(RC[-19]="",,"|n"&R1C16&RC[-19])&IF(RC[-18]="",,"|n"&R1C17&RC[-18])&IF(RC[-17]="",,"|n"&R1C18&RC[-17])&IF(RC[-16]="",,"|n"&R1C19&RC[-16])&IF(RC[-15]="",,"|n"&R1C20&RC[-15])&IF(RC[-14]="",,"|n"&R1C21&RC[-14])&IF(RC[-13]="",,"|n"&R1C22&RC[-13])&IF(RC[-11]="",,"|n"&R1C24&RC[-11])&IF(RC[-10]="",,"|n"&R1C25&RC[-10])&IF(RC[-9]="",,"|n"&R1C26&RC[-9])&IF(RC[-8]="",,"|n"&R1C27&RC[-8])&IF(RC[-7]="",,"|n"&R1C28&RC[-7])&IF(RC[-6]="",,"|n"&R1C29&RC[-6])&IF(RC[-2]="",,"|n"&RC[-2]) -> 
AI696: =IF(RC[-27]&RC[-26]&RC[-25]&RC[-24]&RC[-23]&RC[-22]="",,R1C7)&IF(RC[-27]="",,"|n"&R1C8&RC[-27])&IF(RC[-26]="",,"|n"&R1C9&RC[-26])&IF(RC[-25]="",,"|n"&R1C10&RC[-25])&IF(RC[-24]="",,"|n"&R1C11&RC[-24])&IF(RC[-23]="",,"|n"&R1C12&RC[-23])&IF(RC[-22]="",,"|n"&R1C13&RC[-22])&IF(RC[-20]&RC[-19]&RC[-18]&RC[-17]="",,"|n"&R1C14)&IF(RC[-20]="",,"|n"&R1C15&RC[-20])&IF(RC[-19]="",,"|n"&R1C16&RC[-19])&IF(RC[-18]="",,"|n"&R1C17&RC[-18])&IF(RC[-17]="",,"|n"&R1C18&RC[-17])&IF(RC[-16]="",,"|n"&R1C19&RC[-16])&IF(RC[-15]="",,"|n"&R1C20&RC[-15])&IF(RC[-14]="",,"|n"&R1C21&RC[-14])&IF(RC[-13]="",,"|n"&R1C22&RC[-13])&IF(RC[-11]="",,"|n"&R1C24&RC[-11])&IF(RC[-10]="",,"|n"&R1C25&RC[-10])&IF(RC[-9]="",,"|n"&R1C26&RC[-9])&IF(RC[-8]="",,"|n"&R1C27&RC[-8])&IF(RC[-7]="",,"|n"&R1C28&RC[-7])&IF(RC[-6]="",,"|n"&R1C29&RC[-6])&IF(RC[-2]="",,"|n"&RC[-2]) -> 
AI697: =IF(RC[-27]&RC[-26]&RC[-25]&RC[-24]&RC[-23]&RC[-22]="",,R1C7)&IF(RC[-27]="",,"|n"&R1C8&RC[-27])&IF(RC[-26]="",,"|n"&R1C9&RC[-26])&IF(RC[-25]="",,"|n"&R1C10&RC[-25])&IF(RC[-24]="",,"|n"&R1C11&RC[-24])&IF(RC[-23]="",,"|n"&R1C12&RC[-23])&IF(RC[-22]="",,"|n"&R1C13&RC[-22])&IF(RC[-20]&RC[-19]&RC[-18]&RC[-17]="",,"|n"&R1C14)&IF(RC[-20]="",,"|n"&R1C15&RC[-20])&IF(RC[-19]="",,"|n"&R1C16&RC[-19])&IF(RC[-18]="",,"|n"&R1C17&RC[-18])&IF(RC[-17]="",,"|n"&R1C18&RC[-17])&IF(RC[-16]="",,"|n"&R1C19&RC[-16])&IF(RC[-15]="",,"|n"&R1C20&RC[-15])&IF(RC[-14]="",,"|n"&R1C21&RC[-14])&IF(RC[-13]="",,"|n"&R1C22&RC[-13])&IF(RC[-11]="",,"|n"&R1C24&RC[-11])&IF(RC[-10]="",,"|n"&R1C25&RC[-10])&IF(RC[-9]="",,"|n"&R1C26&RC[-9])&IF(RC[-8]="",,"|n"&R1C27&RC[-8])&IF(RC[-7]="",,"|n"&R1C28&RC[-7])&IF(RC[-6]="",,"|n"&R1C29&RC[-6])&IF(RC[-2]="",,"|n"&RC[-2]) -> 
AI698: =IF(RC[-27]&RC[-26]&RC[-25]&RC[-24]&RC[-23]&RC[-22]="",,R1C7)&IF(RC[-27]="",,"|n"&R1C8&RC[-27])&IF(RC[-26]="",,"|n"&R1C9&RC[-26])&IF(RC[-25]="",,"|n"&R1C10&RC[-25])&IF(RC[-24]="",,"|n"&R1C11&RC[-24])&IF(RC[-23]="",,"|n"&R1C12&RC[-23])&IF(RC[-22]="",,"|n"&R1C13&RC[-22])&IF(RC[-20]&RC[-19]&RC[-18]&RC[-17]="",,"|n"&R1C14)&IF(RC[-20]="",,"|n"&R1C15&RC[-20])&IF(RC[-19]="",,"|n"&R1C16&RC[-19])&IF(RC[-18]="",,"|n"&R1C17&RC[-18])&IF(RC[-17]="",,"|n"&R1C18&RC[-17])&IF(RC[-16]="",,"|n"&R1C19&RC[-16])&IF(RC[-15]="",,"|n"&R1C20&RC[-15])&IF(RC[-14]="",,"|n"&R1C21&RC[-14])&IF(RC[-13]="",,"|n"&R1C22&RC[-13])&IF(RC[-11]="",,"|n"&R1C24&RC[-11])&IF(RC[-10]="",,"|n"&R1C25&RC[-10])&IF(RC[-9]="",,"|n"&R1C26&RC[-9])&IF(RC[-8]="",,"|n"&R1C27&RC[-8])&IF(RC[-7]="",,"|n"&R1C28&RC[-7])&IF(RC[-6]="",,"|n"&R1C29&RC[-6])&IF(RC[-2]="",,"|n"&RC[-2]) -> 
AI699: =IF(RC[-27]&RC[-26]&RC[-25]&RC[-24]&RC[-23]&RC[-22]="",,R1C7)&IF(RC[-27]="",,"|n"&R1C8&RC[-27])&IF(RC[-26]="",,"|n"&R1C9&RC[-26])&IF(RC[-25]="",,"|n"&R1C10&RC[-25])&IF(RC[-24]="",,"|n"&R1C11&RC[-24])&IF(RC[-23]="",,"|n"&R1C12&RC[-23])&IF(RC[-22]="",,"|n"&R1C13&RC[-22])&IF(RC[-20]&RC[-19]&RC[-18]&RC[-17]="",,"|n"&R1C14)&IF(RC[-20]="",,"|n"&R1C15&RC[-20])&IF(RC[-19]="",,"|n"&R1C16&RC[-19])&IF(RC[-18]="",,"|n"&R1C17&RC[-18])&IF(RC[-17]="",,"|n"&R1C18&RC[-17])&IF(RC[-16]="",,"|n"&R1C19&RC[-16])&IF(RC[-15]="",,"|n"&R1C20&RC[-15])&IF(RC[-14]="",,"|n"&R1C21&RC[-14])&IF(RC[-13]="",,"|n"&R1C22&RC[-13])&IF(RC[-11]="",,"|n"&R1C24&RC[-11])&IF(RC[-10]="",,"|n"&R1C25&RC[-10])&IF(RC[-9]="",,"|n"&R1C26&RC[-9])&IF(RC[-8]="",,"|n"&R1C27&RC[-8])&IF(RC[-7]="",,"|n"&R1C28&RC[-7])&IF(RC[-6]="",,"|n"&R1C29&RC[-6])&IF(RC[-2]="",,"|n"&RC[-2]) -> 
AI700: =IF(RC[-27]&RC[-26]&RC[-25]&RC[-24]&RC[-23]&RC[-22]="",,R1C7)&IF(RC[-27]="",,"|n"&R1C8&RC[-27])&IF(RC[-26]="",,"|n"&R1C9&RC[-26])&IF(RC[-25]="",,"|n"&R1C10&RC[-25])&IF(RC[-24]="",,"|n"&R1C11&RC[-24])&IF(RC[-23]="",,"|n"&R1C12&RC[-23])&IF(RC[-22]="",,"|n"&R1C13&RC[-22])&IF(RC[-20]&RC[-19]&RC[-18]&RC[-17]="",,"|n"&R1C14)&IF(RC[-20]="",,"|n"&R1C15&RC[-20])&IF(RC[-19]="",,"|n"&R1C16&RC[-19])&IF(RC[-18]="",,"|n"&R1C17&RC[-18])&IF(RC[-17]="",,"|n"&R1C18&RC[-17])&IF(RC[-16]="",,"|n"&R1C19&RC[-16])&IF(RC[-15]="",,"|n"&R1C20&RC[-15])&IF(RC[-14]="",,"|n"&R1C21&RC[-14])&IF(RC[-13]="",,"|n"&R1C22&RC[-13])&IF(RC[-11]="",,"|n"&R1C24&RC[-11])&IF(RC[-10]="",,"|n"&R1C25&RC[-10])&IF(RC[-9]="",,"|n"&R1C26&RC[-9])&IF(RC[-8]="",,"|n"&R1C27&RC[-8])&IF(RC[-7]="",,"|n"&R1C28&RC[-7])&IF(RC[-6]="",,"|n"&R1C29&RC[-6])&IF(RC[-2]="",,"|n"&RC[-2]) -> 
AI701: =IF(RC[-27]&RC[-26]&RC[-25]&RC[-24]&RC[-23]&RC[-22]="",,R1C7)&IF(RC[-27]="",,"|n"&R1C8&RC[-27])&IF(RC[-26]="",,"|n"&R1C9&RC[-26])&IF(RC[-25]="",,"|n"&R1C10&RC[-25])&IF(RC[-24]="",,"|n"&R1C11&RC[-24])&IF(RC[-23]="",,"|n"&R1C12&RC[-23])&IF(RC[-22]="",,"|n"&R1C13&RC[-22])&IF(RC[-20]&RC[-19]&RC[-18]&RC[-17]="",,"|n"&R1C14)&IF(RC[-20]="",,"|n"&R1C15&RC[-20])&IF(RC[-19]="",,"|n"&R1C16&RC[-19])&IF(RC[-18]="",,"|n"&R1C17&RC[-18])&IF(RC[-17]="",,"|n"&R1C18&RC[-17])&IF(RC[-16]="",,"|n"&R1C19&RC[-16])&IF(RC[-15]="",,"|n"&R1C20&RC[-15])&IF(RC[-14]="",,"|n"&R1C21&RC[-14])&IF(RC[-13]="",,"|n"&R1C22&RC[-13])&IF(RC[-11]="",,"|n"&R1C24&RC[-11])&IF(RC[-10]="",,"|n"&R1C25&RC[-10])&IF(RC[-9]="",,"|n"&R1C26&RC[-9])&IF(RC[-8]="",,"|n"&R1C27&RC[-8])&IF(RC[-7]="",,"|n"&R1C28&RC[-7])&IF(RC[-6]="",,"|n"&R1C29&RC[-6])&IF(RC[-2]="",,"|n"&RC[-2]) -> 
AI702: =IF(RC[-27]&RC[-26]&RC[-25]&RC[-24]&RC[-23]&RC[-22]="",,R1C7)&IF(RC[-27]="",,"|n"&R1C8&RC[-27])&IF(RC[-26]="",,"|n"&R1C9&RC[-26])&IF(RC[-25]="",,"|n"&R1C10&RC[-25])&IF(RC[-24]="",,"|n"&R1C11&RC[-24])&IF(RC[-23]="",,"|n"&R1C12&RC[-23])&IF(RC[-22]="",,"|n"&R1C13&RC[-22])&IF(RC[-20]&RC[-19]&RC[-18]&RC[-17]="",,"|n"&R1C14)&IF(RC[-20]="",,"|n"&R1C15&RC[-20])&IF(RC[-19]="",,"|n"&R1C16&RC[-19])&IF(RC[-18]="",,"|n"&R1C17&RC[-18])&IF(RC[-17]="",,"|n"&R1C18&RC[-17])&IF(RC[-16]="",,"|n"&R1C19&RC[-16])&IF(RC[-15]="",,"|n"&R1C20&RC[-15])&IF(RC[-14]="",,"|n"&R1C21&RC[-14])&IF(RC[-13]="",,"|n"&R1C22&RC[-13])&IF(RC[-11]="",,"|n"&R1C24&RC[-11])&IF(RC[-10]="",,"|n"&R1C25&RC[-10])&IF(RC[-9]="",,"|n"&R1C26&RC[-9])&IF(RC[-8]="",,"|n"&R1C27&RC[-8])&IF(RC[-7]="",,"|n"&R1C28&RC[-7])&IF(RC[-6]="",,"|n"&R1C29&RC[-6])&IF(RC[-2]="",,"|n"&RC[-2]) -> 
AI703: =IF(RC[-27]&RC[-26]&RC[-25]&RC[-24]&RC[-23]&RC[-22]="",,R1C7)&IF(RC[-27]="",,"|n"&R1C8&RC[-27])&IF(RC[-26]="",,"|n"&R1C9&RC[-26])&IF(RC[-25]="",,"|n"&R1C10&RC[-25])&IF(RC[-24]="",,"|n"&R1C11&RC[-24])&IF(RC[-23]="",,"|n"&R1C12&RC[-23])&IF(RC[-22]="",,"|n"&R1C13&RC[-22])&IF(RC[-20]&RC[-19]&RC[-18]&RC[-17]="",,"|n"&R1C14)&IF(RC[-20]="",,"|n"&R1C15&RC[-20])&IF(RC[-19]="",,"|n"&R1C16&RC[-19])&IF(RC[-18]="",,"|n"&R1C17&RC[-18])&IF(RC[-17]="",,"|n"&R1C18&RC[-17])&IF(RC[-16]="",,"|n"&R1C19&RC[-16])&IF(RC[-15]="",,"|n"&R1C20&RC[-15])&IF(RC[-14]="",,"|n"&R1C21&RC[-14])&IF(RC[-13]="",,"|n"&R1C22&RC[-13])&IF(RC[-11]="",,"|n"&R1C24&RC[-11])&IF(RC[-10]="",,"|n"&R1C25&RC[-10])&IF(RC[-9]="",,"|n"&R1C26&RC[-9])&IF(RC[-8]="",,"|n"&R1C27&RC[-8])&IF(RC[-7]="",,"|n"&R1C28&RC[-7])&IF(RC[-6]="",,"|n"&R1C29&RC[-6])&IF(RC[-2]="",,"|n"&RC[-2]) -> 
AI704: =IF(RC[-27]&RC[-26]&RC[-25]&RC[-24]&RC[-23]&RC[-22]="",,R1C7)&IF(RC[-27]="",,"|n"&R1C8&RC[-27])&IF(RC[-26]="",,"|n"&R1C9&RC[-26])&IF(RC[-25]="",,"|n"&R1C10&RC[-25])&IF(RC[-24]="",,"|n"&R1C11&RC[-24])&IF(RC[-23]="",,"|n"&R1C12&RC[-23])&IF(RC[-22]="",,"|n"&R1C13&RC[-22])&IF(RC[-20]&RC[-19]&RC[-18]&RC[-17]="",,"|n"&R1C14)&IF(RC[-20]="",,"|n"&R1C15&RC[-20])&IF(RC[-19]="",,"|n"&R1C16&RC[-19])&IF(RC[-18]="",,"|n"&R1C17&RC[-18])&IF(RC[-17]="",,"|n"&R1C18&RC[-17])&IF(RC[-16]="",,"|n"&R1C19&RC[-16])&IF(RC[-15]="",,"|n"&R1C20&RC[-15])&IF(RC[-14]="",,"|n"&R1C21&RC[-14])&IF(RC[-13]="",,"|n"&R1C22&RC[-13])&IF(RC[-11]="",,"|n"&R1C24&RC[-11])&IF(RC[-10]="",,"|n"&R1C25&RC[-10])&IF(RC[-9]="",,"|n"&R1C26&RC[-9])&IF(RC[-8]="",,"|n"&R1C27&RC[-8])&IF(RC[-7]="",,"|n"&R1C28&RC[-7])&IF(RC[-6]="",,"|n"&R1C29&RC[-6])&IF(RC[-2]="",,"|n"&RC[-2]) -> 
AI705: =IF(RC[-27]&RC[-26]&RC[-25]&RC[-24]&RC[-23]&RC[-22]="",,R1C7)&IF(RC[-27]="",,"|n"&R1C8&RC[-27])&IF(RC[-26]="",,"|n"&R1C9&RC[-26])&IF(RC[-25]="",,"|n"&R1C10&RC[-25])&IF(RC[-24]="",,"|n"&R1C11&RC[-24])&IF(RC[-23]="",,"|n"&R1C12&RC[-23])&IF(RC[-22]="",,"|n"&R1C13&RC[-22])&IF(RC[-20]&RC[-19]&RC[-18]&RC[-17]="",,"|n"&R1C14)&IF(RC[-20]="",,"|n"&R1C15&RC[-20])&IF(RC[-19]="",,"|n"&R1C16&RC[-19])&IF(RC[-18]="",,"|n"&R1C17&RC[-18])&IF(RC[-17]="",,"|n"&R1C18&RC[-17])&IF(RC[-16]="",,"|n"&R1C19&RC[-16])&IF(RC[-15]="",,"|n"&R1C20&RC[-15])&IF(RC[-14]="",,"|n"&R1C21&RC[-14])&IF(RC[-13]="",,"|n"&R1C22&RC[-13])&IF(RC[-11]="",,"|n"&R1C24&RC[-11])&IF(RC[-10]="",,"|n"&R1C25&RC[-10])&IF(RC[-9]="",,"|n"&R1C26&RC[-9])&IF(RC[-8]="",,"|n"&R1C27&RC[-8])&IF(RC[-7]="",,"|n"&R1C28&RC[-7])&IF(RC[-6]="",,"|n"&R1C29&RC[-6])&IF(RC[-2]="",,"|n"&RC[-2]) -> 
AI706: =IF(RC[-27]&RC[-26]&RC[-25]&RC[-24]&RC[-23]&RC[-22]="",,R1C7)&IF(RC[-27]="",,"|n"&R1C8&RC[-27])&IF(RC[-26]="",,"|n"&R1C9&RC[-26])&IF(RC[-25]="",,"|n"&R1C10&RC[-25])&IF(RC[-24]="",,"|n"&R1C11&RC[-24])&IF(RC[-23]="",,"|n"&R1C12&RC[-23])&IF(RC[-22]="",,"|n"&R1C13&RC[-22])&IF(RC[-20]&RC[-19]&RC[-18]&RC[-17]="",,"|n"&R1C14)&IF(RC[-20]="",,"|n"&R1C15&RC[-20])&IF(RC[-19]="",,"|n"&R1C16&RC[-19])&IF(RC[-18]="",,"|n"&R1C17&RC[-18])&IF(RC[-17]="",,"|n"&R1C18&RC[-17])&IF(RC[-16]="",,"|n"&R1C19&RC[-16])&IF(RC[-15]="",,"|n"&R1C20&RC[-15])&IF(RC[-14]="",,"|n"&R1C21&RC[-14])&IF(RC[-13]="",,"|n"&R1C22&RC[-13])&IF(RC[-11]="",,"|n"&R1C24&RC[-11])&IF(RC[-10]="",,"|n"&R1C25&RC[-10])&IF(RC[-9]="",,"|n"&R1C26&RC[-9])&IF(RC[-8]="",,"|n"&R1C27&RC[-8])&IF(RC[-7]="",,"|n"&R1C28&RC[-7])&IF(RC[-6]="",,"|n"&R1C29&RC[-6])&IF(RC[-2]="",,"|n"&RC[-2]) -> 
AI707: =IF(RC[-27]&RC[-26]&RC[-25]&RC[-24]&RC[-23]&RC[-22]="",,R1C7)&IF(RC[-27]="",,"|n"&R1C8&RC[-27])&IF(RC[-26]="",,"|n"&R1C9&RC[-26])&IF(RC[-25]="",,"|n"&R1C10&RC[-25])&IF(RC[-24]="",,"|n"&R1C11&RC[-24])&IF(RC[-23]="",,"|n"&R1C12&RC[-23])&IF(RC[-22]="",,"|n"&R1C13&RC[-22])&IF(RC[-20]&RC[-19]&RC[-18]&RC[-17]="",,"|n"&R1C14)&IF(RC[-20]="",,"|n"&R1C15&RC[-20])&IF(RC[-19]="",,"|n"&R1C16&RC[-19])&IF(RC[-18]="",,"|n"&R1C17&RC[-18])&IF(RC[-17]="",,"|n"&R1C18&RC[-17])&IF(RC[-16]="",,"|n"&R1C19&RC[-16])&IF(RC[-15]="",,"|n"&R1C20&RC[-15])&IF(RC[-14]="",,"|n"&R1C21&RC[-14])&IF(RC[-13]="",,"|n"&R1C22&RC[-13])&IF(RC[-11]="",,"|n"&R1C24&RC[-11])&IF(RC[-10]="",,"|n"&R1C25&RC[-10])&IF(RC[-9]="",,"|n"&R1C26&RC[-9])&IF(RC[-8]="",,"|n"&R1C27&RC[-8])&IF(RC[-7]="",,"|n"&R1C28&RC[-7])&IF(RC[-6]="",,"|n"&R1C29&RC[-6])&IF(RC[-2]="",,"|n"&RC[-2]) -> 
AI708: =IF(RC[-27]&RC[-26]&RC[-25]&RC[-24]&RC[-23]&RC[-22]="",,R1C7)&IF(RC[-27]="",,"|n"&R1C8&RC[-27])&IF(RC[-26]="",,"|n"&R1C9&RC[-26])&IF(RC[-25]="",,"|n"&R1C10&RC[-25])&IF(RC[-24]="",,"|n"&R1C11&RC[-24])&IF(RC[-23]="",,"|n"&R1C12&RC[-23])&IF(RC[-22]="",,"|n"&R1C13&RC[-22])&IF(RC[-20]&RC[-19]&RC[-18]&RC[-17]="",,"|n"&R1C14)&IF(RC[-20]="",,"|n"&R1C15&RC[-20])&IF(RC[-19]="",,"|n"&R1C16&RC[-19])&IF(RC[-18]="",,"|n"&R1C17&RC[-18])&IF(RC[-17]="",,"|n"&R1C18&RC[-17])&IF(RC[-16]="",,"|n"&R1C19&RC[-16])&IF(RC[-15]="",,"|n"&R1C20&RC[-15])&IF(RC[-14]="",,"|n"&R1C21&RC[-14])&IF(RC[-13]="",,"|n"&R1C22&RC[-13])&IF(RC[-11]="",,"|n"&R1C24&RC[-11])&IF(RC[-10]="",,"|n"&R1C25&RC[-10])&IF(RC[-9]="",,"|n"&R1C26&RC[-9])&IF(RC[-8]="",,"|n"&R1C27&RC[-8])&IF(RC[-7]="",,"|n"&R1C28&RC[-7])&IF(RC[-6]="",,"|n"&R1C29&RC[-6])&IF(RC[-2]="",,"|n"&RC[-2]) -> 
AI709: =IF(RC[-27]&RC[-26]&RC[-25]&RC[-24]&RC[-23]&RC[-22]="",,R1C7)&IF(RC[-27]="",,"|n"&R1C8&RC[-27])&IF(RC[-26]="",,"|n"&R1C9&RC[-26])&IF(RC[-25]="",,"|n"&R1C10&RC[-25])&IF(RC[-24]="",,"|n"&R1C11&RC[-24])&IF(RC[-23]="",,"|n"&R1C12&RC[-23])&IF(RC[-22]="",,"|n"&R1C13&RC[-22])&IF(RC[-20]&RC[-19]&RC[-18]&RC[-17]="",,"|n"&R1C14)&IF(RC[-20]="",,"|n"&R1C15&RC[-20])&IF(RC[-19]="",,"|n"&R1C16&RC[-19])&IF(RC[-18]="",,"|n"&R1C17&RC[-18])&IF(RC[-17]="",,"|n"&R1C18&RC[-17])&IF(RC[-16]="",,"|n"&R1C19&RC[-16])&IF(RC[-15]="",,"|n"&R1C20&RC[-15])&IF(RC[-14]="",,"|n"&R1C21&RC[-14])&IF(RC[-13]="",,"|n"&R1C22&RC[-13])&IF(RC[-11]="",,"|n"&R1C24&RC[-11])&IF(RC[-10]="",,"|n"&R1C25&RC[-10])&IF(RC[-9]="",,"|n"&R1C26&RC[-9])&IF(RC[-8]="",,"|n"&R1C27&RC[-8])&IF(RC[-7]="",,"|n"&R1C28&RC[-7])&IF(RC[-6]="",,"|n"&R1C29&RC[-6])&IF(RC[-2]="",,"|n"&RC[-2]) -> 
AI710: =IF(RC[-27]&RC[-26]&RC[-25]&RC[-24]&RC[-23]&RC[-22]="",,R1C7)&IF(RC[-27]="",,"|n"&R1C8&RC[-27])&IF(RC[-26]="",,"|n"&R1C9&RC[-26])&IF(RC[-25]="",,"|n"&R1C10&RC[-25])&IF(RC[-24]="",,"|n"&R1C11&RC[-24])&IF(RC[-23]="",,"|n"&R1C12&RC[-23])&IF(RC[-22]="",,"|n"&R1C13&RC[-22])&IF(RC[-20]&RC[-19]&RC[-18]&RC[-17]="",,"|n"&R1C14)&IF(RC[-20]="",,"|n"&R1C15&RC[-20])&IF(RC[-19]="",,"|n"&R1C16&RC[-19])&IF(RC[-18]="",,"|n"&R1C17&RC[-18])&IF(RC[-17]="",,"|n"&R1C18&RC[-17])&IF(RC[-16]="",,"|n"&R1C19&RC[-16])&IF(RC[-15]="",,"|n"&R1C20&RC[-15])&IF(RC[-14]="",,"|n"&R1C21&RC[-14])&IF(RC[-13]="",,"|n"&R1C22&RC[-13])&IF(RC[-11]="",,"|n"&R1C24&RC[-11])&IF(RC[-10]="",,"|n"&R1C25&RC[-10])&IF(RC[-9]="",,"|n"&R1C26&RC[-9])&IF(RC[-8]="",,"|n"&R1C27&RC[-8])&IF(RC[-7]="",,"|n"&R1C28&RC[-7])&IF(RC[-6]="",,"|n"&R1C29&RC[-6])&IF(RC[-2]="",,"|n"&RC[-2]) -> 
AI711: =IF(RC[-27]&RC[-26]&RC[-25]&RC[-24]&RC[-23]&RC[-22]="",,R1C7)&IF(RC[-27]="",,"|n"&R1C8&RC[-27])&IF(RC[-26]="",,"|n"&R1C9&RC[-26])&IF(RC[-25]="",,"|n"&R1C10&RC[-25])&IF(RC[-24]="",,"|n"&R1C11&RC[-24])&IF(RC[-23]="",,"|n"&R1C12&RC[-23])&IF(RC[-22]="",,"|n"&R1C13&RC[-22])&IF(RC[-20]&RC[-19]&RC[-18]&RC[-17]="",,"|n"&R1C14)&IF(RC[-20]="",,"|n"&R1C15&RC[-20])&IF(RC[-19]="",,"|n"&R1C16&RC[-19])&IF(RC[-18]="",,"|n"&R1C17&RC[-18])&IF(RC[-17]="",,"|n"&R1C18&RC[-17])&IF(RC[-16]="",,"|n"&R1C19&RC[-16])&IF(RC[-15]="",,"|n"&R1C20&RC[-15])&IF(RC[-14]="",,"|n"&R1C21&RC[-14])&IF(RC[-13]="",,"|n"&R1C22&RC[-13])&IF(RC[-11]="",,"|n"&R1C24&RC[-11])&IF(RC[-10]="",,"|n"&R1C25&RC[-10])&IF(RC[-9]="",,"|n"&R1C26&RC[-9])&IF(RC[-8]="",,"|n"&R1C27&RC[-8])&IF(RC[-7]="",,"|n"&R1C28&RC[-7])&IF(RC[-6]="",,"|n"&R1C29&RC[-6])&IF(RC[-2]="",,"|n"&RC[-2]) -> 
AI712: =IF(RC[-27]&RC[-26]&RC[-25]&RC[-24]&RC[-23]&RC[-22]="",,R1C7)&IF(RC[-27]="",,"|n"&R1C8&RC[-27])&IF(RC[-26]="",,"|n"&R1C9&RC[-26])&IF(RC[-25]="",,"|n"&R1C10&RC[-25])&IF(RC[-24]="",,"|n"&R1C11&RC[-24])&IF(RC[-23]="",,"|n"&R1C12&RC[-23])&IF(RC[-22]="",,"|n"&R1C13&RC[-22])&IF(RC[-20]&RC[-19]&RC[-18]&RC[-17]="",,"|n"&R1C14)&IF(RC[-20]="",,"|n"&R1C15&RC[-20])&IF(RC[-19]="",,"|n"&R1C16&RC[-19])&IF(RC[-18]="",,"|n"&R1C17&RC[-18])&IF(RC[-17]="",,"|n"&R1C18&RC[-17])&IF(RC[-16]="",,"|n"&R1C19&RC[-16])&IF(RC[-15]="",,"|n"&R1C20&RC[-15])&IF(RC[-14]="",,"|n"&R1C21&RC[-14])&IF(RC[-13]="",,"|n"&R1C22&RC[-13])&IF(RC[-11]="",,"|n"&R1C24&RC[-11])&IF(RC[-10]="",,"|n"&R1C25&RC[-10])&IF(RC[-9]="",,"|n"&R1C26&RC[-9])&IF(RC[-8]="",,"|n"&R1C27&RC[-8])&IF(RC[-7]="",,"|n"&R1C28&RC[-7])&IF(RC[-6]="",,"|n"&R1C29&RC[-6])&IF(RC[-2]="",,"|n"&RC[-2]) -> 
AI713: =IF(RC[-27]&RC[-26]&RC[-25]&RC[-24]&RC[-23]&RC[-22]="",,R1C7)&IF(RC[-27]="",,"|n"&R1C8&RC[-27])&IF(RC[-26]="",,"|n"&R1C9&RC[-26])&IF(RC[-25]="",,"|n"&R1C10&RC[-25])&IF(RC[-24]="",,"|n"&R1C11&RC[-24])&IF(RC[-23]="",,"|n"&R1C12&RC[-23])&IF(RC[-22]="",,"|n"&R1C13&RC[-22])&IF(RC[-20]&RC[-19]&RC[-18]&RC[-17]="",,"|n"&R1C14)&IF(RC[-20]="",,"|n"&R1C15&RC[-20])&IF(RC[-19]="",,"|n"&R1C16&RC[-19])&IF(RC[-18]="",,"|n"&R1C17&RC[-18])&IF(RC[-17]="",,"|n"&R1C18&RC[-17])&IF(RC[-16]="",,"|n"&R1C19&RC[-16])&IF(RC[-15]="",,"|n"&R1C20&RC[-15])&IF(RC[-14]="",,"|n"&R1C21&RC[-14])&IF(RC[-13]="",,"|n"&R1C22&RC[-13])&IF(RC[-11]="",,"|n"&R1C24&RC[-11])&IF(RC[-10]="",,"|n"&R1C25&RC[-10])&IF(RC[-9]="",,"|n"&R1C26&RC[-9])&IF(RC[-8]="",,"|n"&R1C27&RC[-8])&IF(RC[-7]="",,"|n"&R1C28&RC[-7])&IF(RC[-6]="",,"|n"&R1C29&RC[-6])&IF(RC[-2]="",,"|n"&RC[-2]) -> 
AI714: =IF(RC[-27]&RC[-26]&RC[-25]&RC[-24]&RC[-23]&RC[-22]="",,R1C7)&IF(RC[-27]="",,"|n"&R1C8&RC[-27])&IF(RC[-26]="",,"|n"&R1C9&RC[-26])&IF(RC[-25]="",,"|n"&R1C10&RC[-25])&IF(RC[-24]="",,"|n"&R1C11&RC[-24])&IF(RC[-23]="",,"|n"&R1C12&RC[-23])&IF(RC[-22]="",,"|n"&R1C13&RC[-22])&IF(RC[-20]&RC[-19]&RC[-18]&RC[-17]="",,"|n"&R1C14)&IF(RC[-20]="",,"|n"&R1C15&RC[-20])&IF(RC[-19]="",,"|n"&R1C16&RC[-19])&IF(RC[-18]="",,"|n"&R1C17&RC[-18])&IF(RC[-17]="",,"|n"&R1C18&RC[-17])&IF(RC[-16]="",,"|n"&R1C19&RC[-16])&IF(RC[-15]="",,"|n"&R1C20&RC[-15])&IF(RC[-14]="",,"|n"&R1C21&RC[-14])&IF(RC[-13]="",,"|n"&R1C22&RC[-13])&IF(RC[-11]="",,"|n"&R1C24&RC[-11])&IF(RC[-10]="",,"|n"&R1C25&RC[-10])&IF(RC[-9]="",,"|n"&R1C26&RC[-9])&IF(RC[-8]="",,"|n"&R1C27&RC[-8])&IF(RC[-7]="",,"|n"&R1C28&RC[-7])&IF(RC[-6]="",,"|n"&R1C29&RC[-6])&IF(RC[-2]="",,"|n"&RC[-2]) -> 
AI715: =IF(RC[-27]&RC[-26]&RC[-25]&RC[-24]&RC[-23]&RC[-22]="",,R1C7)&IF(RC[-27]="",,"|n"&R1C8&RC[-27])&IF(RC[-26]="",,"|n"&R1C9&RC[-26])&IF(RC[-25]="",,"|n"&R1C10&RC[-25])&IF(RC[-24]="",,"|n"&R1C11&RC[-24])&IF(RC[-23]="",,"|n"&R1C12&RC[-23])&IF(RC[-22]="",,"|n"&R1C13&RC[-22])&IF(RC[-20]&RC[-19]&RC[-18]&RC[-17]="",,"|n"&R1C14)&IF(RC[-20]="",,"|n"&R1C15&RC[-20])&IF(RC[-19]="",,"|n"&R1C16&RC[-19])&IF(RC[-18]="",,"|n"&R1C17&RC[-18])&IF(RC[-17]="",,"|n"&R1C18&RC[-17])&IF(RC[-16]="",,"|n"&R1C19&RC[-16])&IF(RC[-15]="",,"|n"&R1C20&RC[-15])&IF(RC[-14]="",,"|n"&R1C21&RC[-14])&IF(RC[-13]="",,"|n"&R1C22&RC[-13])&IF(RC[-11]="",,"|n"&R1C24&RC[-11])&IF(RC[-10]="",,"|n"&R1C25&RC[-10])&IF(RC[-9]="",,"|n"&R1C26&RC[-9])&IF(RC[-8]="",,"|n"&R1C27&RC[-8])&IF(RC[-7]="",,"|n"&R1C28&RC[-7])&IF(RC[-6]="",,"|n"&R1C29&RC[-6])&IF(RC[-2]="",,"|n"&RC[-2]) -> 
AI716: =IF(RC[-27]&RC[-26]&RC[-25]&RC[-24]&RC[-23]&RC[-22]="",,R1C7)&IF(RC[-27]="",,"|n"&R1C8&RC[-27])&IF(RC[-26]="",,"|n"&R1C9&RC[-26])&IF(RC[-25]="",,"|n"&R1C10&RC[-25])&IF(RC[-24]="",,"|n"&R1C11&RC[-24])&IF(RC[-23]="",,"|n"&R1C12&RC[-23])&IF(RC[-22]="",,"|n"&R1C13&RC[-22])&IF(RC[-20]&RC[-19]&RC[-18]&RC[-17]="",,"|n"&R1C14)&IF(RC[-20]="",,"|n"&R1C15&RC[-20])&IF(RC[-19]="",,"|n"&R1C16&RC[-19])&IF(RC[-18]="",,"|n"&R1C17&RC[-18])&IF(RC[-17]="",,"|n"&R1C18&RC[-17])&IF(RC[-16]="",,"|n"&R1C19&RC[-16])&IF(RC[-15]="",,"|n"&R1C20&RC[-15])&IF(RC[-14]="",,"|n"&R1C21&RC[-14])&IF(RC[-13]="",,"|n"&R1C22&RC[-13])&IF(RC[-11]="",,"|n"&R1C24&RC[-11])&IF(RC[-10]="",,"|n"&R1C25&RC[-10])&IF(RC[-9]="",,"|n"&R1C26&RC[-9])&IF(RC[-8]="",,"|n"&R1C27&RC[-8])&IF(RC[-7]="",,"|n"&R1C28&RC[-7])&IF(RC[-6]="",,"|n"&R1C29&RC[-6])&IF(RC[-2]="",,"|n"&RC[-2]) -> 
AI717: =IF(RC[-27]&RC[-26]&RC[-25]&RC[-24]&RC[-23]&RC[-22]="",,R1C7)&IF(RC[-27]="",,"|n"&R1C8&RC[-27])&IF(RC[-26]="",,"|n"&R1C9&RC[-26])&IF(RC[-25]="",,"|n"&R1C10&RC[-25])&IF(RC[-24]="",,"|n"&R1C11&RC[-24])&IF(RC[-23]="",,"|n"&R1C12&RC[-23])&IF(RC[-22]="",,"|n"&R1C13&RC[-22])&IF(RC[-20]&RC[-19]&RC[-18]&RC[-17]="",,"|n"&R1C14)&IF(RC[-20]="",,"|n"&R1C15&RC[-20])&IF(RC[-19]="",,"|n"&R1C16&RC[-19])&IF(RC[-18]="",,"|n"&R1C17&RC[-18])&IF(RC[-17]="",,"|n"&R1C18&RC[-17])&IF(RC[-16]="",,"|n"&R1C19&RC[-16])&IF(RC[-15]="",,"|n"&R1C20&RC[-15])&IF(RC[-14]="",,"|n"&R1C21&RC[-14])&IF(RC[-13]="",,"|n"&R1C22&RC[-13])&IF(RC[-11]="",,"|n"&R1C24&RC[-11])&IF(RC[-10]="",,"|n"&R1C25&RC[-10])&IF(RC[-9]="",,"|n"&R1C26&RC[-9])&IF(RC[-8]="",,"|n"&R1C27&RC[-8])&IF(RC[-7]="",,"|n"&R1C28&RC[-7])&IF(RC[-6]="",,"|n"&R1C29&RC[-6])&IF(RC[-2]="",,"|n"&RC[-2]) -> 
AI718: =IF(RC[-27]&RC[-26]&RC[-25]&RC[-24]&RC[-23]&RC[-22]="",,R1C7)&IF(RC[-27]="",,"|n"&R1C8&RC[-27])&IF(RC[-26]="",,"|n"&R1C9&RC[-26])&IF(RC[-25]="",,"|n"&R1C10&RC[-25])&IF(RC[-24]="",,"|n"&R1C11&RC[-24])&IF(RC[-23]="",,"|n"&R1C12&RC[-23])&IF(RC[-22]="",,"|n"&R1C13&RC[-22])&IF(RC[-20]&RC[-19]&RC[-18]&RC[-17]="",,"|n"&R1C14)&IF(RC[-20]="",,"|n"&R1C15&RC[-20])&IF(RC[-19]="",,"|n"&R1C16&RC[-19])&IF(RC[-18]="",,"|n"&R1C17&RC[-18])&IF(RC[-17]="",,"|n"&R1C18&RC[-17])&IF(RC[-16]="",,"|n"&R1C19&RC[-16])&IF(RC[-15]="",,"|n"&R1C20&RC[-15])&IF(RC[-14]="",,"|n"&R1C21&RC[-14])&IF(RC[-13]="",,"|n"&R1C22&RC[-13])&IF(RC[-11]="",,"|n"&R1C24&RC[-11])&IF(RC[-10]="",,"|n"&R1C25&RC[-10])&IF(RC[-9]="",,"|n"&R1C26&RC[-9])&IF(RC[-8]="",,"|n"&R1C27&RC[-8])&IF(RC[-7]="",,"|n"&R1C28&RC[-7])&IF(RC[-6]="",,"|n"&R1C29&RC[-6])&IF(RC[-2]="",,"|n"&RC[-2]) -> 
AI719: =IF(RC[-27]&RC[-26]&RC[-25]&RC[-24]&RC[-23]&RC[-22]="",,R1C7)&IF(RC[-27]="",,"|n"&R1C8&RC[-27])&IF(RC[-26]="",,"|n"&R1C9&RC[-26])&IF(RC[-25]="",,"|n"&R1C10&RC[-25])&IF(RC[-24]="",,"|n"&R1C11&RC[-24])&IF(RC[-23]="",,"|n"&R1C12&RC[-23])&IF(RC[-22]="",,"|n"&R1C13&RC[-22])&IF(RC[-20]&RC[-19]&RC[-18]&RC[-17]="",,"|n"&R1C14)&IF(RC[-20]="",,"|n"&R1C15&RC[-20])&IF(RC[-19]="",,"|n"&R1C16&RC[-19])&IF(RC[-18]="",,"|n"&R1C17&RC[-18])&IF(RC[-17]="",,"|n"&R1C18&RC[-17])&IF(RC[-16]="",,"|n"&R1C19&RC[-16])&IF(RC[-15]="",,"|n"&R1C20&RC[-15])&IF(RC[-14]="",,"|n"&R1C21&RC[-14])&IF(RC[-13]="",,"|n"&R1C22&RC[-13])&IF(RC[-11]="",,"|n"&R1C24&RC[-11])&IF(RC[-10]="",,"|n"&R1C25&RC[-10])&IF(RC[-9]="",,"|n"&R1C26&RC[-9])&IF(RC[-8]="",,"|n"&R1C27&RC[-8])&IF(RC[-7]="",,"|n"&R1C28&RC[-7])&IF(RC[-6]="",,"|n"&R1C29&RC[-6])&IF(RC[-2]="",,"|n"&RC[-2]) -> 
AI720: =IF(RC[-27]&RC[-26]&RC[-25]&RC[-24]&RC[-23]&RC[-22]="",,R1C7)&IF(RC[-27]="",,"|n"&R1C8&RC[-27])&IF(RC[-26]="",,"|n"&R1C9&RC[-26])&IF(RC[-25]="",,"|n"&R1C10&RC[-25])&IF(RC[-24]="",,"|n"&R1C11&RC[-24])&IF(RC[-23]="",,"|n"&R1C12&RC[-23])&IF(RC[-22]="",,"|n"&R1C13&RC[-22])&IF(RC[-20]&RC[-19]&RC[-18]&RC[-17]="",,"|n"&R1C14)&IF(RC[-20]="",,"|n"&R1C15&RC[-20])&IF(RC[-19]="",,"|n"&R1C16&RC[-19])&IF(RC[-18]="",,"|n"&R1C17&RC[-18])&IF(RC[-17]="",,"|n"&R1C18&RC[-17])&IF(RC[-16]="",,"|n"&R1C19&RC[-16])&IF(RC[-15]="",,"|n"&R1C20&RC[-15])&IF(RC[-14]="",,"|n"&R1C21&RC[-14])&IF(RC[-13]="",,"|n"&R1C22&RC[-13])&IF(RC[-11]="",,"|n"&R1C24&RC[-11])&IF(RC[-10]="",,"|n"&R1C25&RC[-10])&IF(RC[-9]="",,"|n"&R1C26&RC[-9])&IF(RC[-8]="",,"|n"&R1C27&RC[-8])&IF(RC[-7]="",,"|n"&R1C28&RC[-7])&IF(RC[-6]="",,"|n"&R1C29&RC[-6])&IF(RC[-2]="",,"|n"&RC[-2]) -> 
AI721: =IF(RC[-27]&RC[-26]&RC[-25]&RC[-24]&RC[-23]&RC[-22]="",,R1C7)&IF(RC[-27]="",,"|n"&R1C8&RC[-27])&IF(RC[-26]="",,"|n"&R1C9&RC[-26])&IF(RC[-25]="",,"|n"&R1C10&RC[-25])&IF(RC[-24]="",,"|n"&R1C11&RC[-24])&IF(RC[-23]="",,"|n"&R1C12&RC[-23])&IF(RC[-22]="",,"|n"&R1C13&RC[-22])&IF(RC[-20]&RC[-19]&RC[-18]&RC[-17]="",,"|n"&R1C14)&IF(RC[-20]="",,"|n"&R1C15&RC[-20])&IF(RC[-19]="",,"|n"&R1C16&RC[-19])&IF(RC[-18]="",,"|n"&R1C17&RC[-18])&IF(RC[-17]="",,"|n"&R1C18&RC[-17])&IF(RC[-16]="",,"|n"&R1C19&RC[-16])&IF(RC[-15]="",,"|n"&R1C20&RC[-15])&IF(RC[-14]="",,"|n"&R1C21&RC[-14])&IF(RC[-13]="",,"|n"&R1C22&RC[-13])&IF(RC[-11]="",,"|n"&R1C24&RC[-11])&IF(RC[-10]="",,"|n"&R1C25&RC[-10])&IF(RC[-9]="",,"|n"&R1C26&RC[-9])&IF(RC[-8]="",,"|n"&R1C27&RC[-8])&IF(RC[-7]="",,"|n"&R1C28&RC[-7])&IF(RC[-6]="",,"|n"&R1C29&RC[-6])&IF(RC[-2]="",,"|n"&RC[-2]) -> 
AI722: =IF(RC[-27]&RC[-26]&RC[-25]&RC[-24]&RC[-23]&RC[-22]="",,R1C7)&IF(RC[-27]="",,"|n"&R1C8&RC[-27])&IF(RC[-26]="",,"|n"&R1C9&RC[-26])&IF(RC[-25]="",,"|n"&R1C10&RC[-25])&IF(RC[-24]="",,"|n"&R1C11&RC[-24])&IF(RC[-23]="",,"|n"&R1C12&RC[-23])&IF(RC[-22]="",,"|n"&R1C13&RC[-22])&IF(RC[-20]&RC[-19]&RC[-18]&RC[-17]="",,"|n"&R1C14)&IF(RC[-20]="",,"|n"&R1C15&RC[-20])&IF(RC[-19]="",,"|n"&R1C16&RC[-19])&IF(RC[-18]="",,"|n"&R1C17&RC[-18])&IF(RC[-17]="",,"|n"&R1C18&RC[-17])&IF(RC[-16]="",,"|n"&R1C19&RC[-16])&IF(RC[-15]="",,"|n"&R1C20&RC[-15])&IF(RC[-14]="",,"|n"&R1C21&RC[-14])&IF(RC[-13]="",,"|n"&R1C22&RC[-13])&IF(RC[-11]="",,"|n"&R1C24&RC[-11])&IF(RC[-10]="",,"|n"&R1C25&RC[-10])&IF(RC[-9]="",,"|n"&R1C26&RC[-9])&IF(RC[-8]="",,"|n"&R1C27&RC[-8])&IF(RC[-7]="",,"|n"&R1C28&RC[-7])&IF(RC[-6]="",,"|n"&R1C29&RC[-6])&IF(RC[-2]="",,"|n"&RC[-2]) -> 
AI723: =IF(RC[-27]&RC[-26]&RC[-25]&RC[-24]&RC[-23]&RC[-22]="",,R1C7)&IF(RC[-27]="",,"|n"&R1C8&RC[-27])&IF(RC[-26]="",,"|n"&R1C9&RC[-26])&IF(RC[-25]="",,"|n"&R1C10&RC[-25])&IF(RC[-24]="",,"|n"&R1C11&RC[-24])&IF(RC[-23]="",,"|n"&R1C12&RC[-23])&IF(RC[-22]="",,"|n"&R1C13&RC[-22])&IF(RC[-20]&RC[-19]&RC[-18]&RC[-17]="",,"|n"&R1C14)&IF(RC[-20]="",,"|n"&R1C15&RC[-20])&IF(RC[-19]="",,"|n"&R1C16&RC[-19])&IF(RC[-18]="",,"|n"&R1C17&RC[-18])&IF(RC[-17]="",,"|n"&R1C18&RC[-17])&IF(RC[-16]="",,"|n"&R1C19&RC[-16])&IF(RC[-15]="",,"|n"&R1C20&RC[-15])&IF(RC[-14]="",,"|n"&R1C21&RC[-14])&IF(RC[-13]="",,"|n"&R1C22&RC[-13])&IF(RC[-11]="",,"|n"&R1C24&RC[-11])&IF(RC[-10]="",,"|n"&R1C25&RC[-10])&IF(RC[-9]="",,"|n"&R1C26&RC[-9])&IF(RC[-8]="",,"|n"&R1C27&RC[-8])&IF(RC[-7]="",,"|n"&R1C28&RC[-7])&IF(RC[-6]="",,"|n"&R1C29&RC[-6])&IF(RC[-2]="",,"|n"&RC[-2]) -> 
AI724: =IF(RC[-27]&RC[-26]&RC[-25]&RC[-24]&RC[-23]&RC[-22]="",,R1C7)&IF(RC[-27]="",,"|n"&R1C8&RC[-27])&IF(RC[-26]="",,"|n"&R1C9&RC[-26])&IF(RC[-25]="",,"|n"&R1C10&RC[-25])&IF(RC[-24]="",,"|n"&R1C11&RC[-24])&IF(RC[-23]="",,"|n"&R1C12&RC[-23])&IF(RC[-22]="",,"|n"&R1C13&RC[-22])&IF(RC[-20]&RC[-19]&RC[-18]&RC[-17]="",,"|n"&R1C14)&IF(RC[-20]="",,"|n"&R1C15&RC[-20])&IF(RC[-19]="",,"|n"&R1C16&RC[-19])&IF(RC[-18]="",,"|n"&R1C17&RC[-18])&IF(RC[-17]="",,"|n"&R1C18&RC[-17])&IF(RC[-16]="",,"|n"&R1C19&RC[-16])&IF(RC[-15]="",,"|n"&R1C20&RC[-15])&IF(RC[-14]="",,"|n"&R1C21&RC[-14])&IF(RC[-13]="",,"|n"&R1C22&RC[-13])&IF(RC[-11]="",,"|n"&R1C24&RC[-11])&IF(RC[-10]="",,"|n"&R1C25&RC[-10])&IF(RC[-9]="",,"|n"&R1C26&RC[-9])&IF(RC[-8]="",,"|n"&R1C27&RC[-8])&IF(RC[-7]="",,"|n"&R1C28&RC[-7])&IF(RC[-6]="",,"|n"&R1C29&RC[-6])&IF(RC[-2]="",,"|n"&RC[-2]) -> 
AI725: =IF(RC[-27]&RC[-26]&RC[-25]&RC[-24]&RC[-23]&RC[-22]="",,R1C7)&IF(RC[-27]="",,"|n"&R1C8&RC[-27])&IF(RC[-26]="",,"|n"&R1C9&RC[-26])&IF(RC[-25]="",,"|n"&R1C10&RC[-25])&IF(RC[-24]="",,"|n"&R1C11&RC[-24])&IF(RC[-23]="",,"|n"&R1C12&RC[-23])&IF(RC[-22]="",,"|n"&R1C13&RC[-22])&IF(RC[-20]&RC[-19]&RC[-18]&RC[-17]="",,"|n"&R1C14)&IF(RC[-20]="",,"|n"&R1C15&RC[-20])&IF(RC[-19]="",,"|n"&R1C16&RC[-19])&IF(RC[-18]="",,"|n"&R1C17&RC[-18])&IF(RC[-17]="",,"|n"&R1C18&RC[-17])&IF(RC[-16]="",,"|n"&R1C19&RC[-16])&IF(RC[-15]="",,"|n"&R1C20&RC[-15])&IF(RC[-14]="",,"|n"&R1C21&RC[-14])&IF(RC[-13]="",,"|n"&R1C22&RC[-13])&IF(RC[-11]="",,"|n"&R1C24&RC[-11])&IF(RC[-10]="",,"|n"&R1C25&RC[-10])&IF(RC[-9]="",,"|n"&R1C26&RC[-9])&IF(RC[-8]="",,"|n"&R1C27&RC[-8])&IF(RC[-7]="",,"|n"&R1C28&RC[-7])&IF(RC[-6]="",,"|n"&R1C29&RC[-6])&IF(RC[-2]="",,"|n"&RC[-2]) -> 
AI726: =IF(RC[-27]&RC[-26]&RC[-25]&RC[-24]&RC[-23]&RC[-22]="",,R1C7)&IF(RC[-27]="",,"|n"&R1C8&RC[-27])&IF(RC[-26]="",,"|n"&R1C9&RC[-26])&IF(RC[-25]="",,"|n"&R1C10&RC[-25])&IF(RC[-24]="",,"|n"&R1C11&RC[-24])&IF(RC[-23]="",,"|n"&R1C12&RC[-23])&IF(RC[-22]="",,"|n"&R1C13&RC[-22])&IF(RC[-20]&RC[-19]&RC[-18]&RC[-17]="",,"|n"&R1C14)&IF(RC[-20]="",,"|n"&R1C15&RC[-20])&IF(RC[-19]="",,"|n"&R1C16&RC[-19])&IF(RC[-18]="",,"|n"&R1C17&RC[-18])&IF(RC[-17]="",,"|n"&R1C18&RC[-17])&IF(RC[-16]="",,"|n"&R1C19&RC[-16])&IF(RC[-15]="",,"|n"&R1C20&RC[-15])&IF(RC[-14]="",,"|n"&R1C21&RC[-14])&IF(RC[-13]="",,"|n"&R1C22&RC[-13])&IF(RC[-11]="",,"|n"&R1C24&RC[-11])&IF(RC[-10]="",,"|n"&R1C25&RC[-10])&IF(RC[-9]="",,"|n"&R1C26&RC[-9])&IF(RC[-8]="",,"|n"&R1C27&RC[-8])&IF(RC[-7]="",,"|n"&R1C28&RC[-7])&IF(RC[-6]="",,"|n"&R1C29&RC[-6])&IF(RC[-2]="",,"|n"&RC[-2]) -> 
AI727: =IF(RC[-27]&RC[-26]&RC[-25]&RC[-24]&RC[-23]&RC[-22]="",,R1C7)&IF(RC[-27]="",,"|n"&R1C8&RC[-27])&IF(RC[-26]="",,"|n"&R1C9&RC[-26])&IF(RC[-25]="",,"|n"&R1C10&RC[-25])&IF(RC[-24]="",,"|n"&R1C11&RC[-24])&IF(RC[-23]="",,"|n"&R1C12&RC[-23])&IF(RC[-22]="",,"|n"&R1C13&RC[-22])&IF(RC[-20]&RC[-19]&RC[-18]&RC[-17]="",,"|n"&R1C14)&IF(RC[-20]="",,"|n"&R1C15&RC[-20])&IF(RC[-19]="",,"|n"&R1C16&RC[-19])&IF(RC[-18]="",,"|n"&R1C17&RC[-18])&IF(RC[-17]="",,"|n"&R1C18&RC[-17])&IF(RC[-16]="",,"|n"&R1C19&RC[-16])&IF(RC[-15]="",,"|n"&R1C20&RC[-15])&IF(RC[-14]="",,"|n"&R1C21&RC[-14])&IF(RC[-13]="",,"|n"&R1C22&RC[-13])&IF(RC[-11]="",,"|n"&R1C24&RC[-11])&IF(RC[-10]="",,"|n"&R1C25&RC[-10])&IF(RC[-9]="",,"|n"&R1C26&RC[-9])&IF(RC[-8]="",,"|n"&R1C27&RC[-8])&IF(RC[-7]="",,"|n"&R1C28&RC[-7])&IF(RC[-6]="",,"|n"&R1C29&RC[-6])&IF(RC[-2]="",,"|n"&RC[-2]) -> 
AI728: =IF(RC[-27]&RC[-26]&RC[-25]&RC[-24]&RC[-23]&RC[-22]="",,R1C7)&IF(RC[-27]="",,"|n"&R1C8&RC[-27])&IF(RC[-26]="",,"|n"&R1C9&RC[-26])&IF(RC[-25]="",,"|n"&R1C10&RC[-25])&IF(RC[-24]="",,"|n"&R1C11&RC[-24])&IF(RC[-23]="",,"|n"&R1C12&RC[-23])&IF(RC[-22]="",,"|n"&R1C13&RC[-22])&IF(RC[-20]&RC[-19]&RC[-18]&RC[-17]="",,"|n"&R1C14)&IF(RC[-20]="",,"|n"&R1C15&RC[-20])&IF(RC[-19]="",,"|n"&R1C16&RC[-19])&IF(RC[-18]="",,"|n"&R1C17&RC[-18])&IF(RC[-17]="",,"|n"&R1C18&RC[-17])&IF(RC[-16]="",,"|n"&R1C19&RC[-16])&IF(RC[-15]="",,"|n"&R1C20&RC[-15])&IF(RC[-14]="",,"|n"&R1C21&RC[-14])&IF(RC[-13]="",,"|n"&R1C22&RC[-13])&IF(RC[-11]="",,"|n"&R1C24&RC[-11])&IF(RC[-10]="",,"|n"&R1C25&RC[-10])&IF(RC[-9]="",,"|n"&R1C26&RC[-9])&IF(RC[-8]="",,"|n"&R1C27&RC[-8])&IF(RC[-7]="",,"|n"&R1C28&RC[-7])&IF(RC[-6]="",,"|n"&R1C29&RC[-6])&IF(RC[-2]="",,"|n"&RC[-2]) -> 
AI729: =IF(RC[-27]&RC[-26]&RC[-25]&RC[-24]&RC[-23]&RC[-22]="",,R1C7)&IF(RC[-27]="",,"|n"&R1C8&RC[-27])&IF(RC[-26]="",,"|n"&R1C9&RC[-26])&IF(RC[-25]="",,"|n"&R1C10&RC[-25])&IF(RC[-24]="",,"|n"&R1C11&RC[-24])&IF(RC[-23]="",,"|n"&R1C12&RC[-23])&IF(RC[-22]="",,"|n"&R1C13&RC[-22])&IF(RC[-20]&RC[-19]&RC[-18]&RC[-17]="",,"|n"&R1C14)&IF(RC[-20]="",,"|n"&R1C15&RC[-20])&IF(RC[-19]="",,"|n"&R1C16&RC[-19])&IF(RC[-18]="",,"|n"&R1C17&RC[-18])&IF(RC[-17]="",,"|n"&R1C18&RC[-17])&IF(RC[-16]="",,"|n"&R1C19&RC[-16])&IF(RC[-15]="",,"|n"&R1C20&RC[-15])&IF(RC[-14]="",,"|n"&R1C21&RC[-14])&IF(RC[-13]="",,"|n"&R1C22&RC[-13])&IF(RC[-11]="",,"|n"&R1C24&RC[-11])&IF(RC[-10]="",,"|n"&R1C25&RC[-10])&IF(RC[-9]="",,"|n"&R1C26&RC[-9])&IF(RC[-8]="",,"|n"&R1C27&RC[-8])&IF(RC[-7]="",,"|n"&R1C28&RC[-7])&IF(RC[-6]="",,"|n"&R1C29&RC[-6])&IF(RC[-2]="",,"|n"&RC[-2]) -> 
AI730: =IF(RC[-27]&RC[-26]&RC[-25]&RC[-24]&RC[-23]&RC[-22]="",,R1C7)&IF(RC[-27]="",,"|n"&R1C8&RC[-27])&IF(RC[-26]="",,"|n"&R1C9&RC[-26])&IF(RC[-25]="",,"|n"&R1C10&RC[-25])&IF(RC[-24]="",,"|n"&R1C11&RC[-24])&IF(RC[-23]="",,"|n"&R1C12&RC[-23])&IF(RC[-22]="",,"|n"&R1C13&RC[-22])&IF(RC[-20]&RC[-19]&RC[-18]&RC[-17]="",,"|n"&R1C14)&IF(RC[-20]="",,"|n"&R1C15&RC[-20])&IF(RC[-19]="",,"|n"&R1C16&RC[-19])&IF(RC[-18]="",,"|n"&R1C17&RC[-18])&IF(RC[-17]="",,"|n"&R1C18&RC[-17])&IF(RC[-16]="",,"|n"&R1C19&RC[-16])&IF(RC[-15]="",,"|n"&R1C20&RC[-15])&IF(RC[-14]="",,"|n"&R1C21&RC[-14])&IF(RC[-13]="",,"|n"&R1C22&RC[-13])&IF(RC[-11]="",,"|n"&R1C24&RC[-11])&IF(RC[-10]="",,"|n"&R1C25&RC[-10])&IF(RC[-9]="",,"|n"&R1C26&RC[-9])&IF(RC[-8]="",,"|n"&R1C27&RC[-8])&IF(RC[-7]="",,"|n"&R1C28&RC[-7])&IF(RC[-6]="",,"|n"&R1C29&RC[-6])&IF(RC[-2]="",,"|n"&RC[-2]) -> 
AI731: =IF(RC[-27]&RC[-26]&RC[-25]&RC[-24]&RC[-23]&RC[-22]="",,R1C7)&IF(RC[-27]="",,"|n"&R1C8&RC[-27])&IF(RC[-26]="",,"|n"&R1C9&RC[-26])&IF(RC[-25]="",,"|n"&R1C10&RC[-25])&IF(RC[-24]="",,"|n"&R1C11&RC[-24])&IF(RC[-23]="",,"|n"&R1C12&RC[-23])&IF(RC[-22]="",,"|n"&R1C13&RC[-22])&IF(RC[-20]&RC[-19]&RC[-18]&RC[-17]="",,"|n"&R1C14)&IF(RC[-20]="",,"|n"&R1C15&RC[-20])&IF(RC[-19]="",,"|n"&R1C16&RC[-19])&IF(RC[-18]="",,"|n"&R1C17&RC[-18])&IF(RC[-17]="",,"|n"&R1C18&RC[-17])&IF(RC[-16]="",,"|n"&R1C19&RC[-16])&IF(RC[-15]="",,"|n"&R1C20&RC[-15])&IF(RC[-14]="",,"|n"&R1C21&RC[-14])&IF(RC[-13]="",,"|n"&R1C22&RC[-13])&IF(RC[-11]="",,"|n"&R1C24&RC[-11])&IF(RC[-10]="",,"|n"&R1C25&RC[-10])&IF(RC[-9]="",,"|n"&R1C26&RC[-9])&IF(RC[-8]="",,"|n"&R1C27&RC[-8])&IF(RC[-7]="",,"|n"&R1C28&RC[-7])&IF(RC[-6]="",,"|n"&R1C29&RC[-6])&IF(RC[-2]="",,"|n"&RC[-2]) -> 
AI732: =IF(RC[-27]&RC[-26]&RC[-25]&RC[-24]&RC[-23]&RC[-22]="",,R1C7)&IF(RC[-27]="",,"|n"&R1C8&RC[-27])&IF(RC[-26]="",,"|n"&R1C9&RC[-26])&IF(RC[-25]="",,"|n"&R1C10&RC[-25])&IF(RC[-24]="",,"|n"&R1C11&RC[-24])&IF(RC[-23]="",,"|n"&R1C12&RC[-23])&IF(RC[-22]="",,"|n"&R1C13&RC[-22])&IF(RC[-20]&RC[-19]&RC[-18]&RC[-17]="",,"|n"&R1C14)&IF(RC[-20]="",,"|n"&R1C15&RC[-20])&IF(RC[-19]="",,"|n"&R1C16&RC[-19])&IF(RC[-18]="",,"|n"&R1C17&RC[-18])&IF(RC[-17]="",,"|n"&R1C18&RC[-17])&IF(RC[-16]="",,"|n"&R1C19&RC[-16])&IF(RC[-15]="",,"|n"&R1C20&RC[-15])&IF(RC[-14]="",,"|n"&R1C21&RC[-14])&IF(RC[-13]="",,"|n"&R1C22&RC[-13])&IF(RC[-11]="",,"|n"&R1C24&RC[-11])&IF(RC[-10]="",,"|n"&R1C25&RC[-10])&IF(RC[-9]="",,"|n"&R1C26&RC[-9])&IF(RC[-8]="",,"|n"&R1C27&RC[-8])&IF(RC[-7]="",,"|n"&R1C28&RC[-7])&IF(RC[-6]="",,"|n"&R1C29&RC[-6])&IF(RC[-2]="",,"|n"&RC[-2]) -> 
AI733: =IF(RC[-27]&RC[-26]&RC[-25]&RC[-24]&RC[-23]&RC[-22]="",,R1C7)&IF(RC[-27]="",,"|n"&R1C8&RC[-27])&IF(RC[-26]="",,"|n"&R1C9&RC[-26])&IF(RC[-25]="",,"|n"&R1C10&RC[-25])&IF(RC[-24]="",,"|n"&R1C11&RC[-24])&IF(RC[-23]="",,"|n"&R1C12&RC[-23])&IF(RC[-22]="",,"|n"&R1C13&RC[-22])&IF(RC[-20]&RC[-19]&RC[-18]&RC[-17]="",,"|n"&R1C14)&IF(RC[-20]="",,"|n"&R1C15&RC[-20])&IF(RC[-19]="",,"|n"&R1C16&RC[-19])&IF(RC[-18]="",,"|n"&R1C17&RC[-18])&IF(RC[-17]="",,"|n"&R1C18&RC[-17])&IF(RC[-16]="",,"|n"&R1C19&RC[-16])&IF(RC[-15]="",,"|n"&R1C20&RC[-15])&IF(RC[-14]="",,"|n"&R1C21&RC[-14])&IF(RC[-13]="",,"|n"&R1C22&RC[-13])&IF(RC[-11]="",,"|n"&R1C24&RC[-11])&IF(RC[-10]="",,"|n"&R1C25&RC[-10])&IF(RC[-9]="",,"|n"&R1C26&RC[-9])&IF(RC[-8]="",,"|n"&R1C27&RC[-8])&IF(RC[-7]="",,"|n"&R1C28&RC[-7])&IF(RC[-6]="",,"|n"&R1C29&RC[-6])&IF(RC[-2]="",,"|n"&RC[-2]) -> 
AI734: =IF(RC[-27]&RC[-26]&RC[-25]&RC[-24]&RC[-23]&RC[-22]="",,R1C7)&IF(RC[-27]="",,"|n"&R1C8&RC[-27])&IF(RC[-26]="",,"|n"&R1C9&RC[-26])&IF(RC[-25]="",,"|n"&R1C10&RC[-25])&IF(RC[-24]="",,"|n"&R1C11&RC[-24])&IF(RC[-23]="",,"|n"&R1C12&RC[-23])&IF(RC[-22]="",,"|n"&R1C13&RC[-22])&IF(RC[-20]&RC[-19]&RC[-18]&RC[-17]="",,"|n"&R1C14)&IF(RC[-20]="",,"|n"&R1C15&RC[-20])&IF(RC[-19]="",,"|n"&R1C16&RC[-19])&IF(RC[-18]="",,"|n"&R1C17&RC[-18])&IF(RC[-17]="",,"|n"&R1C18&RC[-17])&IF(RC[-16]="",,"|n"&R1C19&RC[-16])&IF(RC[-15]="",,"|n"&R1C20&RC[-15])&IF(RC[-14]="",,"|n"&R1C21&RC[-14])&IF(RC[-13]="",,"|n"&R1C22&RC[-13])&IF(RC[-11]="",,"|n"&R1C24&RC[-11])&IF(RC[-10]="",,"|n"&R1C25&RC[-10])&IF(RC[-9]="",,"|n"&R1C26&RC[-9])&IF(RC[-8]="",,"|n"&R1C27&RC[-8])&IF(RC[-7]="",,"|n"&R1C28&RC[-7])&IF(RC[-6]="",,"|n"&R1C29&RC[-6])&IF(RC[-2]="",,"|n"&RC[-2]) -> 
AI735: =IF(RC[-27]&RC[-26]&RC[-25]&RC[-24]&RC[-23]&RC[-22]="",,R1C7)&IF(RC[-27]="",,"|n"&R1C8&RC[-27])&IF(RC[-26]="",,"|n"&R1C9&RC[-26])&IF(RC[-25]="",,"|n"&R1C10&RC[-25])&IF(RC[-24]="",,"|n"&R1C11&RC[-24])&IF(RC[-23]="",,"|n"&R1C12&RC[-23])&IF(RC[-22]="",,"|n"&R1C13&RC[-22])&IF(RC[-20]&RC[-19]&RC[-18]&RC[-17]="",,"|n"&R1C14)&IF(RC[-20]="",,"|n"&R1C15&RC[-20])&IF(RC[-19]="",,"|n"&R1C16&RC[-19])&IF(RC[-18]="",,"|n"&R1C17&RC[-18])&IF(RC[-17]="",,"|n"&R1C18&RC[-17])&IF(RC[-16]="",,"|n"&R1C19&RC[-16])&IF(RC[-15]="",,"|n"&R1C20&RC[-15])&IF(RC[-14]="",,"|n"&R1C21&RC[-14])&IF(RC[-13]="",,"|n"&R1C22&RC[-13])&IF(RC[-11]="",,"|n"&R1C24&RC[-11])&IF(RC[-10]="",,"|n"&R1C25&RC[-10])&IF(RC[-9]="",,"|n"&R1C26&RC[-9])&IF(RC[-8]="",,"|n"&R1C27&RC[-8])&IF(RC[-7]="",,"|n"&R1C28&RC[-7])&IF(RC[-6]="",,"|n"&R1C29&RC[-6])&IF(RC[-2]="",,"|n"&RC[-2]) -> 
AI736: =IF(RC[-27]&RC[-26]&RC[-25]&RC[-24]&RC[-23]&RC[-22]="",,R1C7)&IF(RC[-27]="",,"|n"&R1C8&RC[-27])&IF(RC[-26]="",,"|n"&R1C9&RC[-26])&IF(RC[-25]="",,"|n"&R1C10&RC[-25])&IF(RC[-24]="",,"|n"&R1C11&RC[-24])&IF(RC[-23]="",,"|n"&R1C12&RC[-23])&IF(RC[-22]="",,"|n"&R1C13&RC[-22])&IF(RC[-20]&RC[-19]&RC[-18]&RC[-17]="",,"|n"&R1C14)&IF(RC[-20]="",,"|n"&R1C15&RC[-20])&IF(RC[-19]="",,"|n"&R1C16&RC[-19])&IF(RC[-18]="",,"|n"&R1C17&RC[-18])&IF(RC[-17]="",,"|n"&R1C18&RC[-17])&IF(RC[-16]="",,"|n"&R1C19&RC[-16])&IF(RC[-15]="",,"|n"&R1C20&RC[-15])&IF(RC[-14]="",,"|n"&R1C21&RC[-14])&IF(RC[-13]="",,"|n"&R1C22&RC[-13])&IF(RC[-11]="",,"|n"&R1C24&RC[-11])&IF(RC[-10]="",,"|n"&R1C25&RC[-10])&IF(RC[-9]="",,"|n"&R1C26&RC[-9])&IF(RC[-8]="",,"|n"&R1C27&RC[-8])&IF(RC[-7]="",,"|n"&R1C28&RC[-7])&IF(RC[-6]="",,"|n"&R1C29&RC[-6])&IF(RC[-2]="",,"|n"&RC[-2]) -> 
AI737: =IF(RC[-27]&RC[-26]&RC[-25]&RC[-24]&RC[-23]&RC[-22]="",,R1C7)&IF(RC[-27]="",,"|n"&R1C8&RC[-27])&IF(RC[-26]="",,"|n"&R1C9&RC[-26])&IF(RC[-25]="",,"|n"&R1C10&RC[-25])&IF(RC[-24]="",,"|n"&R1C11&RC[-24])&IF(RC[-23]="",,"|n"&R1C12&RC[-23])&IF(RC[-22]="",,"|n"&R1C13&RC[-22])&IF(RC[-20]&RC[-19]&RC[-18]&RC[-17]="",,"|n"&R1C14)&IF(RC[-20]="",,"|n"&R1C15&RC[-20])&IF(RC[-19]="",,"|n"&R1C16&RC[-19])&IF(RC[-18]="",,"|n"&R1C17&RC[-18])&IF(RC[-17]="",,"|n"&R1C18&RC[-17])&IF(RC[-16]="",,"|n"&R1C19&RC[-16])&IF(RC[-15]="",,"|n"&R1C20&RC[-15])&IF(RC[-14]="",,"|n"&R1C21&RC[-14])&IF(RC[-13]="",,"|n"&R1C22&RC[-13])&IF(RC[-11]="",,"|n"&R1C24&RC[-11])&IF(RC[-10]="",,"|n"&R1C25&RC[-10])&IF(RC[-9]="",,"|n"&R1C26&RC[-9])&IF(RC[-8]="",,"|n"&R1C27&RC[-8])&IF(RC[-7]="",,"|n"&R1C28&RC[-7])&IF(RC[-6]="",,"|n"&R1C29&RC[-6])&IF(RC[-2]="",,"|n"&RC[-2]) -> 
AI738: =IF(RC[-27]&RC[-26]&RC[-25]&RC[-24]&RC[-23]&RC[-22]="",,R1C7)&IF(RC[-27]="",,"|n"&R1C8&RC[-27])&IF(RC[-26]="",,"|n"&R1C9&RC[-26])&IF(RC[-25]="",,"|n"&R1C10&RC[-25])&IF(RC[-24]="",,"|n"&R1C11&RC[-24])&IF(RC[-23]="",,"|n"&R1C12&RC[-23])&IF(RC[-22]="",,"|n"&R1C13&RC[-22])&IF(RC[-20]&RC[-19]&RC[-18]&RC[-17]="",,"|n"&R1C14)&IF(RC[-20]="",,"|n"&R1C15&RC[-20])&IF(RC[-19]="",,"|n"&R1C16&RC[-19])&IF(RC[-18]="",,"|n"&R1C17&RC[-18])&IF(RC[-17]="",,"|n"&R1C18&RC[-17])&IF(RC[-16]="",,"|n"&R1C19&RC[-16])&IF(RC[-15]="",,"|n"&R1C20&RC[-15])&IF(RC[-14]="",,"|n"&R1C21&RC[-14])&IF(RC[-13]="",,"|n"&R1C22&RC[-13])&IF(RC[-11]="",,"|n"&R1C24&RC[-11])&IF(RC[-10]="",,"|n"&R1C25&RC[-10])&IF(RC[-9]="",,"|n"&R1C26&RC[-9])&IF(RC[-8]="",,"|n"&R1C27&RC[-8])&IF(RC[-7]="",,"|n"&R1C28&RC[-7])&IF(RC[-6]="",,"|n"&R1C29&RC[-6])&IF(RC[-2]="",,"|n"&RC[-2]) -> 
AI739: =IF(RC[-27]&RC[-26]&RC[-25]&RC[-24]&RC[-23]&RC[-22]="",,R1C7)&IF(RC[-27]="",,"|n"&R1C8&RC[-27])&IF(RC[-26]="",,"|n"&R1C9&RC[-26])&IF(RC[-25]="",,"|n"&R1C10&RC[-25])&IF(RC[-24]="",,"|n"&R1C11&RC[-24])&IF(RC[-23]="",,"|n"&R1C12&RC[-23])&IF(RC[-22]="",,"|n"&R1C13&RC[-22])&IF(RC[-20]&RC[-19]&RC[-18]&RC[-17]="",,"|n"&R1C14)&IF(RC[-20]="",,"|n"&R1C15&RC[-20])&IF(RC[-19]="",,"|n"&R1C16&RC[-19])&IF(RC[-18]="",,"|n"&R1C17&RC[-18])&IF(RC[-17]="",,"|n"&R1C18&RC[-17])&IF(RC[-16]="",,"|n"&R1C19&RC[-16])&IF(RC[-15]="",,"|n"&R1C20&RC[-15])&IF(RC[-14]="",,"|n"&R1C21&RC[-14])&IF(RC[-13]="",,"|n"&R1C22&RC[-13])&IF(RC[-11]="",,"|n"&R1C24&RC[-11])&IF(RC[-10]="",,"|n"&R1C25&RC[-10])&IF(RC[-9]="",,"|n"&R1C26&RC[-9])&IF(RC[-8]="",,"|n"&R1C27&RC[-8])&IF(RC[-7]="",,"|n"&R1C28&RC[-7])&IF(RC[-6]="",,"|n"&R1C29&RC[-6])&IF(RC[-2]="",,"|n"&RC[-2]) -> 
AI740: =IF(RC[-27]&RC[-26]&RC[-25]&RC[-24]&RC[-23]&RC[-22]="",,R1C7)&IF(RC[-27]="",,"|n"&R1C8&RC[-27])&IF(RC[-26]="",,"|n"&R1C9&RC[-26])&IF(RC[-25]="",,"|n"&R1C10&RC[-25])&IF(RC[-24]="",,"|n"&R1C11&RC[-24])&IF(RC[-23]="",,"|n"&R1C12&RC[-23])&IF(RC[-22]="",,"|n"&R1C13&RC[-22])&IF(RC[-20]&RC[-19]&RC[-18]&RC[-17]="",,"|n"&R1C14)&IF(RC[-20]="",,"|n"&R1C15&RC[-20])&IF(RC[-19]="",,"|n"&R1C16&RC[-19])&IF(RC[-18]="",,"|n"&R1C17&RC[-18])&IF(RC[-17]="",,"|n"&R1C18&RC[-17])&IF(RC[-16]="",,"|n"&R1C19&RC[-16])&IF(RC[-15]="",,"|n"&R1C20&RC[-15])&IF(RC[-14]="",,"|n"&R1C21&RC[-14])&IF(RC[-13]="",,"|n"&R1C22&RC[-13])&IF(RC[-11]="",,"|n"&R1C24&RC[-11])&IF(RC[-10]="",,"|n"&R1C25&RC[-10])&IF(RC[-9]="",,"|n"&R1C26&RC[-9])&IF(RC[-8]="",,"|n"&R1C27&RC[-8])&IF(RC[-7]="",,"|n"&R1C28&RC[-7])&IF(RC[-6]="",,"|n"&R1C29&RC[-6])&IF(RC[-2]="",,"|n"&RC[-2]) -> 
AI741: =IF(RC[-27]&RC[-26]&RC[-25]&RC[-24]&RC[-23]&RC[-22]="",,R1C7)&IF(RC[-27]="",,"|n"&R1C8&RC[-27])&IF(RC[-26]="",,"|n"&R1C9&RC[-26])&IF(RC[-25]="",,"|n"&R1C10&RC[-25])&IF(RC[-24]="",,"|n"&R1C11&RC[-24])&IF(RC[-23]="",,"|n"&R1C12&RC[-23])&IF(RC[-22]="",,"|n"&R1C13&RC[-22])&IF(RC[-20]&RC[-19]&RC[-18]&RC[-17]="",,"|n"&R1C14)&IF(RC[-20]="",,"|n"&R1C15&RC[-20])&IF(RC[-19]="",,"|n"&R1C16&RC[-19])&IF(RC[-18]="",,"|n"&R1C17&RC[-18])&IF(RC[-17]="",,"|n"&R1C18&RC[-17])&IF(RC[-16]="",,"|n"&R1C19&RC[-16])&IF(RC[-15]="",,"|n"&R1C20&RC[-15])&IF(RC[-14]="",,"|n"&R1C21&RC[-14])&IF(RC[-13]="",,"|n"&R1C22&RC[-13])&IF(RC[-11]="",,"|n"&R1C24&RC[-11])&IF(RC[-10]="",,"|n"&R1C25&RC[-10])&IF(RC[-9]="",,"|n"&R1C26&RC[-9])&IF(RC[-8]="",,"|n"&R1C27&RC[-8])&IF(RC[-7]="",,"|n"&R1C28&RC[-7])&IF(RC[-6]="",,"|n"&R1C29&RC[-6])&IF(RC[-2]="",,"|n"&RC[-2]) -> 
AI742: =IF(RC[-27]&RC[-26]&RC[-25]&RC[-24]&RC[-23]&RC[-22]="",,R1C7)&IF(RC[-27]="",,"|n"&R1C8&RC[-27])&IF(RC[-26]="",,"|n"&R1C9&RC[-26])&IF(RC[-25]="",,"|n"&R1C10&RC[-25])&IF(RC[-24]="",,"|n"&R1C11&RC[-24])&IF(RC[-23]="",,"|n"&R1C12&RC[-23])&IF(RC[-22]="",,"|n"&R1C13&RC[-22])&IF(RC[-20]&RC[-19]&RC[-18]&RC[-17]="",,"|n"&R1C14)&IF(RC[-20]="",,"|n"&R1C15&RC[-20])&IF(RC[-19]="",,"|n"&R1C16&RC[-19])&IF(RC[-18]="",,"|n"&R1C17&RC[-18])&IF(RC[-17]="",,"|n"&R1C18&RC[-17])&IF(RC[-16]="",,"|n"&R1C19&RC[-16])&IF(RC[-15]="",,"|n"&R1C20&RC[-15])&IF(RC[-14]="",,"|n"&R1C21&RC[-14])&IF(RC[-13]="",,"|n"&R1C22&RC[-13])&IF(RC[-11]="",,"|n"&R1C24&RC[-11])&IF(RC[-10]="",,"|n"&R1C25&RC[-10])&IF(RC[-9]="",,"|n"&R1C26&RC[-9])&IF(RC[-8]="",,"|n"&R1C27&RC[-8])&IF(RC[-7]="",,"|n"&R1C28&RC[-7])&IF(RC[-6]="",,"|n"&R1C29&RC[-6])&IF(RC[-2]="",,"|n"&RC[-2]) -> 
AI743: =IF(RC[-27]&RC[-26]&RC[-25]&RC[-24]&RC[-23]&RC[-22]="",,R1C7)&IF(RC[-27]="",,"|n"&R1C8&RC[-27])&IF(RC[-26]="",,"|n"&R1C9&RC[-26])&IF(RC[-25]="",,"|n"&R1C10&RC[-25])&IF(RC[-24]="",,"|n"&R1C11&RC[-24])&IF(RC[-23]="",,"|n"&R1C12&RC[-23])&IF(RC[-22]="",,"|n"&R1C13&RC[-22])&IF(RC[-20]&RC[-19]&RC[-18]&RC[-17]="",,"|n"&R1C14)&IF(RC[-20]="",,"|n"&R1C15&RC[-20])&IF(RC[-19]="",,"|n"&R1C16&RC[-19])&IF(RC[-18]="",,"|n"&R1C17&RC[-18])&IF(RC[-17]="",,"|n"&R1C18&RC[-17])&IF(RC[-16]="",,"|n"&R1C19&RC[-16])&IF(RC[-15]="",,"|n"&R1C20&RC[-15])&IF(RC[-14]="",,"|n"&R1C21&RC[-14])&IF(RC[-13]="",,"|n"&R1C22&RC[-13])&IF(RC[-11]="",,"|n"&R1C24&RC[-11])&IF(RC[-10]="",,"|n"&R1C25&RC[-10])&IF(RC[-9]="",,"|n"&R1C26&RC[-9])&IF(RC[-8]="",,"|n"&R1C27&RC[-8])&IF(RC[-7]="",,"|n"&R1C28&RC[-7])&IF(RC[-6]="",,"|n"&R1C29&RC[-6])&IF(RC[-2]="",,"|n"&RC[-2]) -> 
AI744: =IF(RC[-27]&RC[-26]&RC[-25]&RC[-24]&RC[-23]&RC[-22]="",,R1C7)&IF(RC[-27]="",,"|n"&R1C8&RC[-27])&IF(RC[-26]="",,"|n"&R1C9&RC[-26])&IF(RC[-25]="",,"|n"&R1C10&RC[-25])&IF(RC[-24]="",,"|n"&R1C11&RC[-24])&IF(RC[-23]="",,"|n"&R1C12&RC[-23])&IF(RC[-22]="",,"|n"&R1C13&RC[-22])&IF(RC[-20]&RC[-19]&RC[-18]&RC[-17]="",,"|n"&R1C14)&IF(RC[-20]="",,"|n"&R1C15&RC[-20])&IF(RC[-19]="",,"|n"&R1C16&RC[-19])&IF(RC[-18]="",,"|n"&R1C17&RC[-18])&IF(RC[-17]="",,"|n"&R1C18&RC[-17])&IF(RC[-16]="",,"|n"&R1C19&RC[-16])&IF(RC[-15]="",,"|n"&R1C20&RC[-15])&IF(RC[-14]="",,"|n"&R1C21&RC[-14])&IF(RC[-13]="",,"|n"&R1C22&RC[-13])&IF(RC[-11]="",,"|n"&R1C24&RC[-11])&IF(RC[-10]="",,"|n"&R1C25&RC[-10])&IF(RC[-9]="",,"|n"&R1C26&RC[-9])&IF(RC[-8]="",,"|n"&R1C27&RC[-8])&IF(RC[-7]="",,"|n"&R1C28&RC[-7])&IF(RC[-6]="",,"|n"&R1C29&RC[-6])&IF(RC[-2]="",,"|n"&RC[-2]) -> 
AI745: =IF(RC[-27]&RC[-26]&RC[-25]&RC[-24]&RC[-23]&RC[-22]="",,R1C7)&IF(RC[-27]="",,"|n"&R1C8&RC[-27])&IF(RC[-26]="",,"|n"&R1C9&RC[-26])&IF(RC[-25]="",,"|n"&R1C10&RC[-25])&IF(RC[-24]="",,"|n"&R1C11&RC[-24])&IF(RC[-23]="",,"|n"&R1C12&RC[-23])&IF(RC[-22]="",,"|n"&R1C13&RC[-22])&IF(RC[-20]&RC[-19]&RC[-18]&RC[-17]="",,"|n"&R1C14)&IF(RC[-20]="",,"|n"&R1C15&RC[-20])&IF(RC[-19]="",,"|n"&R1C16&RC[-19])&IF(RC[-18]="",,"|n"&R1C17&RC[-18])&IF(RC[-17]="",,"|n"&R1C18&RC[-17])&IF(RC[-16]="",,"|n"&R1C19&RC[-16])&IF(RC[-15]="",,"|n"&R1C20&RC[-15])&IF(RC[-14]="",,"|n"&R1C21&RC[-14])&IF(RC[-13]="",,"|n"&R1C22&RC[-13])&IF(RC[-11]="",,"|n"&R1C24&RC[-11])&IF(RC[-10]="",,"|n"&R1C25&RC[-10])&IF(RC[-9]="",,"|n"&R1C26&RC[-9])&IF(RC[-8]="",,"|n"&R1C27&RC[-8])&IF(RC[-7]="",,"|n"&R1C28&RC[-7])&IF(RC[-6]="",,"|n"&R1C29&RC[-6])&IF(RC[-2]="",,"|n"&RC[-2]) -> 
AI746: =IF(RC[-27]&RC[-26]&RC[-25]&RC[-24]&RC[-23]&RC[-22]="",,R1C7)&IF(RC[-27]="",,"|n"&R1C8&RC[-27])&IF(RC[-26]="",,"|n"&R1C9&RC[-26])&IF(RC[-25]="",,"|n"&R1C10&RC[-25])&IF(RC[-24]="",,"|n"&R1C11&RC[-24])&IF(RC[-23]="",,"|n"&R1C12&RC[-23])&IF(RC[-22]="",,"|n"&R1C13&RC[-22])&IF(RC[-20]&RC[-19]&RC[-18]&RC[-17]="",,"|n"&R1C14)&IF(RC[-20]="",,"|n"&R1C15&RC[-20])&IF(RC[-19]="",,"|n"&R1C16&RC[-19])&IF(RC[-18]="",,"|n"&R1C17&RC[-18])&IF(RC[-17]="",,"|n"&R1C18&RC[-17])&IF(RC[-16]="",,"|n"&R1C19&RC[-16])&IF(RC[-15]="",,"|n"&R1C20&RC[-15])&IF(RC[-14]="",,"|n"&R1C21&RC[-14])&IF(RC[-13]="",,"|n"&R1C22&RC[-13])&IF(RC[-11]="",,"|n"&R1C24&RC[-11])&IF(RC[-10]="",,"|n"&R1C25&RC[-10])&IF(RC[-9]="",,"|n"&R1C26&RC[-9])&IF(RC[-8]="",,"|n"&R1C27&RC[-8])&IF(RC[-7]="",,"|n"&R1C28&RC[-7])&IF(RC[-6]="",,"|n"&R1C29&RC[-6])&IF(RC[-2]="",,"|n"&RC[-2]) -> 
AI747: =IF(RC[-27]&RC[-26]&RC[-25]&RC[-24]&RC[-23]&RC[-22]="",,R1C7)&IF(RC[-27]="",,"|n"&R1C8&RC[-27])&IF(RC[-26]="",,"|n"&R1C9&RC[-26])&IF(RC[-25]="",,"|n"&R1C10&RC[-25])&IF(RC[-24]="",,"|n"&R1C11&RC[-24])&IF(RC[-23]="",,"|n"&R1C12&RC[-23])&IF(RC[-22]="",,"|n"&R1C13&RC[-22])&IF(RC[-20]&RC[-19]&RC[-18]&RC[-17]="",,"|n"&R1C14)&IF(RC[-20]="",,"|n"&R1C15&RC[-20])&IF(RC[-19]="",,"|n"&R1C16&RC[-19])&IF(RC[-18]="",,"|n"&R1C17&RC[-18])&IF(RC[-17]="",,"|n"&R1C18&RC[-17])&IF(RC[-16]="",,"|n"&R1C19&RC[-16])&IF(RC[-15]="",,"|n"&R1C20&RC[-15])&IF(RC[-14]="",,"|n"&R1C21&RC[-14])&IF(RC[-13]="",,"|n"&R1C22&RC[-13])&IF(RC[-11]="",,"|n"&R1C24&RC[-11])&IF(RC[-10]="",,"|n"&R1C25&RC[-10])&IF(RC[-9]="",,"|n"&R1C26&RC[-9])&IF(RC[-8]="",,"|n"&R1C27&RC[-8])&IF(RC[-7]="",,"|n"&R1C28&RC[-7])&IF(RC[-6]="",,"|n"&R1C29&RC[-6])&IF(RC[-2]="",,"|n"&RC[-2]) -> 
AI748: =IF(RC[-27]&RC[-26]&RC[-25]&RC[-24]&RC[-23]&RC[-22]="",,R1C7)&IF(RC[-27]="",,"|n"&R1C8&RC[-27])&IF(RC[-26]="",,"|n"&R1C9&RC[-26])&IF(RC[-25]="",,"|n"&R1C10&RC[-25])&IF(RC[-24]="",,"|n"&R1C11&RC[-24])&IF(RC[-23]="",,"|n"&R1C12&RC[-23])&IF(RC[-22]="",,"|n"&R1C13&RC[-22])&IF(RC[-20]&RC[-19]&RC[-18]&RC[-17]="",,"|n"&R1C14)&IF(RC[-20]="",,"|n"&R1C15&RC[-20])&IF(RC[-19]="",,"|n"&R1C16&RC[-19])&IF(RC[-18]="",,"|n"&R1C17&RC[-18])&IF(RC[-17]="",,"|n"&R1C18&RC[-17])&IF(RC[-16]="",,"|n"&R1C19&RC[-16])&IF(RC[-15]="",,"|n"&R1C20&RC[-15])&IF(RC[-14]="",,"|n"&R1C21&RC[-14])&IF(RC[-13]="",,"|n"&R1C22&RC[-13])&IF(RC[-11]="",,"|n"&R1C24&RC[-11])&IF(RC[-10]="",,"|n"&R1C25&RC[-10])&IF(RC[-9]="",,"|n"&R1C26&RC[-9])&IF(RC[-8]="",,"|n"&R1C27&RC[-8])&IF(RC[-7]="",,"|n"&R1C28&RC[-7])&IF(RC[-6]="",,"|n"&R1C29&RC[-6])&IF(RC[-2]="",,"|n"&RC[-2]) -> 
AI749: =IF(RC[-27]&RC[-26]&RC[-25]&RC[-24]&RC[-23]&RC[-22]="",,R1C7)&IF(RC[-27]="",,"|n"&R1C8&RC[-27])&IF(RC[-26]="",,"|n"&R1C9&RC[-26])&IF(RC[-25]="",,"|n"&R1C10&RC[-25])&IF(RC[-24]="",,"|n"&R1C11&RC[-24])&IF(RC[-23]="",,"|n"&R1C12&RC[-23])&IF(RC[-22]="",,"|n"&R1C13&RC[-22])&IF(RC[-20]&RC[-19]&RC[-18]&RC[-17]="",,"|n"&R1C14)&IF(RC[-20]="",,"|n"&R1C15&RC[-20])&IF(RC[-19]="",,"|n"&R1C16&RC[-19])&IF(RC[-18]="",,"|n"&R1C17&RC[-18])&IF(RC[-17]="",,"|n"&R1C18&RC[-17])&IF(RC[-16]="",,"|n"&R1C19&RC[-16])&IF(RC[-15]="",,"|n"&R1C20&RC[-15])&IF(RC[-14]="",,"|n"&R1C21&RC[-14])&IF(RC[-13]="",,"|n"&R1C22&RC[-13])&IF(RC[-11]="",,"|n"&R1C24&RC[-11])&IF(RC[-10]="",,"|n"&R1C25&RC[-10])&IF(RC[-9]="",,"|n"&R1C26&RC[-9])&IF(RC[-8]="",,"|n"&R1C27&RC[-8])&IF(RC[-7]="",,"|n"&R1C28&RC[-7])&IF(RC[-6]="",,"|n"&R1C29&RC[-6])&IF(RC[-2]="",,"|n"&RC[-2]) -> 
AI750: =IF(RC[-27]&RC[-26]&RC[-25]&RC[-24]&RC[-23]&RC[-22]="",,R1C7)&IF(RC[-27]="",,"|n"&R1C8&RC[-27])&IF(RC[-26]="",,"|n"&R1C9&RC[-26])&IF(RC[-25]="",,"|n"&R1C10&RC[-25])&IF(RC[-24]="",,"|n"&R1C11&RC[-24])&IF(RC[-23]="",,"|n"&R1C12&RC[-23])&IF(RC[-22]="",,"|n"&R1C13&RC[-22])&IF(RC[-20]&RC[-19]&RC[-18]&RC[-17]="",,"|n"&R1C14)&IF(RC[-20]="",,"|n"&R1C15&RC[-20])&IF(RC[-19]="",,"|n"&R1C16&RC[-19])&IF(RC[-18]="",,"|n"&R1C17&RC[-18])&IF(RC[-17]="",,"|n"&R1C18&RC[-17])&IF(RC[-16]="",,"|n"&R1C19&RC[-16])&IF(RC[-15]="",,"|n"&R1C20&RC[-15])&IF(RC[-14]="",,"|n"&R1C21&RC[-14])&IF(RC[-13]="",,"|n"&R1C22&RC[-13])&IF(RC[-11]="",,"|n"&R1C24&RC[-11])&IF(RC[-10]="",,"|n"&R1C25&RC[-10])&IF(RC[-9]="",,"|n"&R1C26&RC[-9])&IF(RC[-8]="",,"|n"&R1C27&RC[-8])&IF(RC[-7]="",,"|n"&R1C28&RC[-7])&IF(RC[-6]="",,"|n"&R1C29&RC[-6])&IF(RC[-2]="",,"|n"&RC[-2]) -> 
AI751: =IF(RC[-27]&RC[-26]&RC[-25]&RC[-24]&RC[-23]&RC[-22]="",,R1C7)&IF(RC[-27]="",,"|n"&R1C8&RC[-27])&IF(RC[-26]="",,"|n"&R1C9&RC[-26])&IF(RC[-25]="",,"|n"&R1C10&RC[-25])&IF(RC[-24]="",,"|n"&R1C11&RC[-24])&IF(RC[-23]="",,"|n"&R1C12&RC[-23])&IF(RC[-22]="",,"|n"&R1C13&RC[-22])&IF(RC[-20]&RC[-19]&RC[-18]&RC[-17]="",,"|n"&R1C14)&IF(RC[-20]="",,"|n"&R1C15&RC[-20])&IF(RC[-19]="",,"|n"&R1C16&RC[-19])&IF(RC[-18]="",,"|n"&R1C17&RC[-18])&IF(RC[-17]="",,"|n"&R1C18&RC[-17])&IF(RC[-16]="",,"|n"&R1C19&RC[-16])&IF(RC[-15]="",,"|n"&R1C20&RC[-15])&IF(RC[-14]="",,"|n"&R1C21&RC[-14])&IF(RC[-13]="",,"|n"&R1C22&RC[-13])&IF(RC[-11]="",,"|n"&R1C24&RC[-11])&IF(RC[-10]="",,"|n"&R1C25&RC[-10])&IF(RC[-9]="",,"|n"&R1C26&RC[-9])&IF(RC[-8]="",,"|n"&R1C27&RC[-8])&IF(RC[-7]="",,"|n"&R1C28&RC[-7])&IF(RC[-6]="",,"|n"&R1C29&RC[-6])&IF(RC[-2]="",,"|n"&RC[-2]) -> 
AI752: =IF(RC[-27]&RC[-26]&RC[-25]&RC[-24]&RC[-23]&RC[-22]="",,R1C7)&IF(RC[-27]="",,"|n"&R1C8&RC[-27])&IF(RC[-26]="",,"|n"&R1C9&RC[-26])&IF(RC[-25]="",,"|n"&R1C10&RC[-25])&IF(RC[-24]="",,"|n"&R1C11&RC[-24])&IF(RC[-23]="",,"|n"&R1C12&RC[-23])&IF(RC[-22]="",,"|n"&R1C13&RC[-22])&IF(RC[-20]&RC[-19]&RC[-18]&RC[-17]="",,"|n"&R1C14)&IF(RC[-20]="",,"|n"&R1C15&RC[-20])&IF(RC[-19]="",,"|n"&R1C16&RC[-19])&IF(RC[-18]="",,"|n"&R1C17&RC[-18])&IF(RC[-17]="",,"|n"&R1C18&RC[-17])&IF(RC[-16]="",,"|n"&R1C19&RC[-16])&IF(RC[-15]="",,"|n"&R1C20&RC[-15])&IF(RC[-14]="",,"|n"&R1C21&RC[-14])&IF(RC[-13]="",,"|n"&R1C22&RC[-13])&IF(RC[-11]="",,"|n"&R1C24&RC[-11])&IF(RC[-10]="",,"|n"&R1C25&RC[-10])&IF(RC[-9]="",,"|n"&R1C26&RC[-9])&IF(RC[-8]="",,"|n"&R1C27&RC[-8])&IF(RC[-7]="",,"|n"&R1C28&RC[-7])&IF(RC[-6]="",,"|n"&R1C29&RC[-6])&IF(RC[-2]="",,"|n"&RC[-2]) -> 
AI753: =IF(RC[-27]&RC[-26]&RC[-25]&RC[-24]&RC[-23]&RC[-22]="",,R1C7)&IF(RC[-27]="",,"|n"&R1C8&RC[-27])&IF(RC[-26]="",,"|n"&R1C9&RC[-26])&IF(RC[-25]="",,"|n"&R1C10&RC[-25])&IF(RC[-24]="",,"|n"&R1C11&RC[-24])&IF(RC[-23]="",,"|n"&R1C12&RC[-23])&IF(RC[-22]="",,"|n"&R1C13&RC[-22])&IF(RC[-20]&RC[-19]&RC[-18]&RC[-17]="",,"|n"&R1C14)&IF(RC[-20]="",,"|n"&R1C15&RC[-20])&IF(RC[-19]="",,"|n"&R1C16&RC[-19])&IF(RC[-18]="",,"|n"&R1C17&RC[-18])&IF(RC[-17]="",,"|n"&R1C18&RC[-17])&IF(RC[-16]="",,"|n"&R1C19&RC[-16])&IF(RC[-15]="",,"|n"&R1C20&RC[-15])&IF(RC[-14]="",,"|n"&R1C21&RC[-14])&IF(RC[-13]="",,"|n"&R1C22&RC[-13])&IF(RC[-11]="",,"|n"&R1C24&RC[-11])&IF(RC[-10]="",,"|n"&R1C25&RC[-10])&IF(RC[-9]="",,"|n"&R1C26&RC[-9])&IF(RC[-8]="",,"|n"&R1C27&RC[-8])&IF(RC[-7]="",,"|n"&R1C28&RC[-7])&IF(RC[-6]="",,"|n"&R1C29&RC[-6])&IF(RC[-2]="",,"|n"&RC[-2]) -> 
AI754: =IF(RC[-27]&RC[-26]&RC[-25]&RC[-24]&RC[-23]&RC[-22]="",,R1C7)&IF(RC[-27]="",,"|n"&R1C8&RC[-27])&IF(RC[-26]="",,"|n"&R1C9&RC[-26])&IF(RC[-25]="",,"|n"&R1C10&RC[-25])&IF(RC[-24]="",,"|n"&R1C11&RC[-24])&IF(RC[-23]="",,"|n"&R1C12&RC[-23])&IF(RC[-22]="",,"|n"&R1C13&RC[-22])&IF(RC[-20]&RC[-19]&RC[-18]&RC[-17]="",,"|n"&R1C14)&IF(RC[-20]="",,"|n"&R1C15&RC[-20])&IF(RC[-19]="",,"|n"&R1C16&RC[-19])&IF(RC[-18]="",,"|n"&R1C17&RC[-18])&IF(RC[-17]="",,"|n"&R1C18&RC[-17])&IF(RC[-16]="",,"|n"&R1C19&RC[-16])&IF(RC[-15]="",,"|n"&R1C20&RC[-15])&IF(RC[-14]="",,"|n"&R1C21&RC[-14])&IF(RC[-13]="",,"|n"&R1C22&RC[-13])&IF(RC[-11]="",,"|n"&R1C24&RC[-11])&IF(RC[-10]="",,"|n"&R1C25&RC[-10])&IF(RC[-9]="",,"|n"&R1C26&RC[-9])&IF(RC[-8]="",,"|n"&R1C27&RC[-8])&IF(RC[-7]="",,"|n"&R1C28&RC[-7])&IF(RC[-6]="",,"|n"&R1C29&RC[-6])&IF(RC[-2]="",,"|n"&RC[-2]) -> 
AI755: =IF(RC[-27]&RC[-26]&RC[-25]&RC[-24]&RC[-23]&RC[-22]="",,R1C7)&IF(RC[-27]="",,"|n"&R1C8&RC[-27])&IF(RC[-26]="",,"|n"&R1C9&RC[-26])&IF(RC[-25]="",,"|n"&R1C10&RC[-25])&IF(RC[-24]="",,"|n"&R1C11&RC[-24])&IF(RC[-23]="",,"|n"&R1C12&RC[-23])&IF(RC[-22]="",,"|n"&R1C13&RC[-22])&IF(RC[-20]&RC[-19]&RC[-18]&RC[-17]="",,"|n"&R1C14)&IF(RC[-20]="",,"|n"&R1C15&RC[-20])&IF(RC[-19]="",,"|n"&R1C16&RC[-19])&IF(RC[-18]="",,"|n"&R1C17&RC[-18])&IF(RC[-17]="",,"|n"&R1C18&RC[-17])&IF(RC[-16]="",,"|n"&R1C19&RC[-16])&IF(RC[-15]="",,"|n"&R1C20&RC[-15])&IF(RC[-14]="",,"|n"&R1C21&RC[-14])&IF(RC[-13]="",,"|n"&R1C22&RC[-13])&IF(RC[-11]="",,"|n"&R1C24&RC[-11])&IF(RC[-10]="",,"|n"&R1C25&RC[-10])&IF(RC[-9]="",,"|n"&R1C26&RC[-9])&IF(RC[-8]="",,"|n"&R1C27&RC[-8])&IF(RC[-7]="",,"|n"&R1C28&RC[-7])&IF(RC[-6]="",,"|n"&R1C29&RC[-6])&IF(RC[-2]="",,"|n"&RC[-2]) -> 
AI756: =IF(RC[-27]&RC[-26]&RC[-25]&RC[-24]&RC[-23]&RC[-22]="",,R1C7)&IF(RC[-27]="",,"|n"&R1C8&RC[-27])&IF(RC[-26]="",,"|n"&R1C9&RC[-26])&IF(RC[-25]="",,"|n"&R1C10&RC[-25])&IF(RC[-24]="",,"|n"&R1C11&RC[-24])&IF(RC[-23]="",,"|n"&R1C12&RC[-23])&IF(RC[-22]="",,"|n"&R1C13&RC[-22])&IF(RC[-20]&RC[-19]&RC[-18]&RC[-17]="",,"|n"&R1C14)&IF(RC[-20]="",,"|n"&R1C15&RC[-20])&IF(RC[-19]="",,"|n"&R1C16&RC[-19])&IF(RC[-18]="",,"|n"&R1C17&RC[-18])&IF(RC[-17]="",,"|n"&R1C18&RC[-17])&IF(RC[-16]="",,"|n"&R1C19&RC[-16])&IF(RC[-15]="",,"|n"&R1C20&RC[-15])&IF(RC[-14]="",,"|n"&R1C21&RC[-14])&IF(RC[-13]="",,"|n"&R1C22&RC[-13])&IF(RC[-11]="",,"|n"&R1C24&RC[-11])&IF(RC[-10]="",,"|n"&R1C25&RC[-10])&IF(RC[-9]="",,"|n"&R1C26&RC[-9])&IF(RC[-8]="",,"|n"&R1C27&RC[-8])&IF(RC[-7]="",,"|n"&R1C28&RC[-7])&IF(RC[-6]="",,"|n"&R1C29&RC[-6])&IF(RC[-2]="",,"|n"&RC[-2]) -> 
AI757: =IF(RC[-27]&RC[-26]&RC[-25]&RC[-24]&RC[-23]&RC[-22]="",,R1C7)&IF(RC[-27]="",,"|n"&R1C8&RC[-27])&IF(RC[-26]="",,"|n"&R1C9&RC[-26])&IF(RC[-25]="",,"|n"&R1C10&RC[-25])&IF(RC[-24]="",,"|n"&R1C11&RC[-24])&IF(RC[-23]="",,"|n"&R1C12&RC[-23])&IF(RC[-22]="",,"|n"&R1C13&RC[-22])&IF(RC[-20]&RC[-19]&RC[-18]&RC[-17]="",,"|n"&R1C14)&IF(RC[-20]="",,"|n"&R1C15&RC[-20])&IF(RC[-19]="",,"|n"&R1C16&RC[-19])&IF(RC[-18]="",,"|n"&R1C17&RC[-18])&IF(RC[-17]="",,"|n"&R1C18&RC[-17])&IF(RC[-16]="",,"|n"&R1C19&RC[-16])&IF(RC[-15]="",,"|n"&R1C20&RC[-15])&IF(RC[-14]="",,"|n"&R1C21&RC[-14])&IF(RC[-13]="",,"|n"&R1C22&RC[-13])&IF(RC[-11]="",,"|n"&R1C24&RC[-11])&IF(RC[-10]="",,"|n"&R1C25&RC[-10])&IF(RC[-9]="",,"|n"&R1C26&RC[-9])&IF(RC[-8]="",,"|n"&R1C27&RC[-8])&IF(RC[-7]="",,"|n"&R1C28&RC[-7])&IF(RC[-6]="",,"|n"&R1C29&RC[-6])&IF(RC[-2]="",,"|n"&RC[-2]) -> 
AI758: =IF(RC[-27]&RC[-26]&RC[-25]&RC[-24]&RC[-23]&RC[-22]="",,R1C7)&IF(RC[-27]="",,"|n"&R1C8&RC[-27])&IF(RC[-26]="",,"|n"&R1C9&RC[-26])&IF(RC[-25]="",,"|n"&R1C10&RC[-25])&IF(RC[-24]="",,"|n"&R1C11&RC[-24])&IF(RC[-23]="",,"|n"&R1C12&RC[-23])&IF(RC[-22]="",,"|n"&R1C13&RC[-22])&IF(RC[-20]&RC[-19]&RC[-18]&RC[-17]="",,"|n"&R1C14)&IF(RC[-20]="",,"|n"&R1C15&RC[-20])&IF(RC[-19]="",,"|n"&R1C16&RC[-19])&IF(RC[-18]="",,"|n"&R1C17&RC[-18])&IF(RC[-17]="",,"|n"&R1C18&RC[-17])&IF(RC[-16]="",,"|n"&R1C19&RC[-16])&IF(RC[-15]="",,"|n"&R1C20&RC[-15])&IF(RC[-14]="",,"|n"&R1C21&RC[-14])&IF(RC[-13]="",,"|n"&R1C22&RC[-13])&IF(RC[-11]="",,"|n"&R1C24&RC[-11])&IF(RC[-10]="",,"|n"&R1C25&RC[-10])&IF(RC[-9]="",,"|n"&R1C26&RC[-9])&IF(RC[-8]="",,"|n"&R1C27&RC[-8])&IF(RC[-7]="",,"|n"&R1C28&RC[-7])&IF(RC[-6]="",,"|n"&R1C29&RC[-6])&IF(RC[-2]="",,"|n"&RC[-2]) -> 
AI759: =IF(RC[-27]&RC[-26]&RC[-25]&RC[-24]&RC[-23]&RC[-22]="",,R1C7)&IF(RC[-27]="",,"|n"&R1C8&RC[-27])&IF(RC[-26]="",,"|n"&R1C9&RC[-26])&IF(RC[-25]="",,"|n"&R1C10&RC[-25])&IF(RC[-24]="",,"|n"&R1C11&RC[-24])&IF(RC[-23]="",,"|n"&R1C12&RC[-23])&IF(RC[-22]="",,"|n"&R1C13&RC[-22])&IF(RC[-20]&RC[-19]&RC[-18]&RC[-17]="",,"|n"&R1C14)&IF(RC[-20]="",,"|n"&R1C15&RC[-20])&IF(RC[-19]="",,"|n"&R1C16&RC[-19])&IF(RC[-18]="",,"|n"&R1C17&RC[-18])&IF(RC[-17]="",,"|n"&R1C18&RC[-17])&IF(RC[-16]="",,"|n"&R1C19&RC[-16])&IF(RC[-15]="",,"|n"&R1C20&RC[-15])&IF(RC[-14]="",,"|n"&R1C21&RC[-14])&IF(RC[-13]="",,"|n"&R1C22&RC[-13])&IF(RC[-11]="",,"|n"&R1C24&RC[-11])&IF(RC[-10]="",,"|n"&R1C25&RC[-10])&IF(RC[-9]="",,"|n"&R1C26&RC[-9])&IF(RC[-8]="",,"|n"&R1C27&RC[-8])&IF(RC[-7]="",,"|n"&R1C28&RC[-7])&IF(RC[-6]="",,"|n"&R1C29&RC[-6])&IF(RC[-2]="",,"|n"&RC[-2]) -> 
AI760: =IF(RC[-27]&RC[-26]&RC[-25]&RC[-24]&RC[-23]&RC[-22]="",,R1C7)&IF(RC[-27]="",,"|n"&R1C8&RC[-27])&IF(RC[-26]="",,"|n"&R1C9&RC[-26])&IF(RC[-25]="",,"|n"&R1C10&RC[-25])&IF(RC[-24]="",,"|n"&R1C11&RC[-24])&IF(RC[-23]="",,"|n"&R1C12&RC[-23])&IF(RC[-22]="",,"|n"&R1C13&RC[-22])&IF(RC[-20]&RC[-19]&RC[-18]&RC[-17]="",,"|n"&R1C14)&IF(RC[-20]="",,"|n"&R1C15&RC[-20])&IF(RC[-19]="",,"|n"&R1C16&RC[-19])&IF(RC[-18]="",,"|n"&R1C17&RC[-18])&IF(RC[-17]="",,"|n"&R1C18&RC[-17])&IF(RC[-16]="",,"|n"&R1C19&RC[-16])&IF(RC[-15]="",,"|n"&R1C20&RC[-15])&IF(RC[-14]="",,"|n"&R1C21&RC[-14])&IF(RC[-13]="",,"|n"&R1C22&RC[-13])&IF(RC[-11]="",,"|n"&R1C24&RC[-11])&IF(RC[-10]="",,"|n"&R1C25&RC[-10])&IF(RC[-9]="",,"|n"&R1C26&RC[-9])&IF(RC[-8]="",,"|n"&R1C27&RC[-8])&IF(RC[-7]="",,"|n"&R1C28&RC[-7])&IF(RC[-6]="",,"|n"&R1C29&RC[-6])&IF(RC[-2]="",,"|n"&RC[-2]) -> 
AI761: =IF(RC[-27]&RC[-26]&RC[-25]&RC[-24]&RC[-23]&RC[-22]="",,R1C7)&IF(RC[-27]="",,"|n"&R1C8&RC[-27])&IF(RC[-26]="",,"|n"&R1C9&RC[-26])&IF(RC[-25]="",,"|n"&R1C10&RC[-25])&IF(RC[-24]="",,"|n"&R1C11&RC[-24])&IF(RC[-23]="",,"|n"&R1C12&RC[-23])&IF(RC[-22]="",,"|n"&R1C13&RC[-22])&IF(RC[-20]&RC[-19]&RC[-18]&RC[-17]="",,"|n"&R1C14)&IF(RC[-20]="",,"|n"&R1C15&RC[-20])&IF(RC[-19]="",,"|n"&R1C16&RC[-19])&IF(RC[-18]="",,"|n"&R1C17&RC[-18])&IF(RC[-17]="",,"|n"&R1C18&RC[-17])&IF(RC[-16]="",,"|n"&R1C19&RC[-16])&IF(RC[-15]="",,"|n"&R1C20&RC[-15])&IF(RC[-14]="",,"|n"&R1C21&RC[-14])&IF(RC[-13]="",,"|n"&R1C22&RC[-13])&IF(RC[-11]="",,"|n"&R1C24&RC[-11])&IF(RC[-10]="",,"|n"&R1C25&RC[-10])&IF(RC[-9]="",,"|n"&R1C26&RC[-9])&IF(RC[-8]="",,"|n"&R1C27&RC[-8])&IF(RC[-7]="",,"|n"&R1C28&RC[-7])&IF(RC[-6]="",,"|n"&R1C29&RC[-6])&IF(RC[-2]="",,"|n"&RC[-2]) -> 
AI762: =IF(RC[-27]&RC[-26]&RC[-25]&RC[-24]&RC[-23]&RC[-22]="",,R1C7)&IF(RC[-27]="",,"|n"&R1C8&RC[-27])&IF(RC[-26]="",,"|n"&R1C9&RC[-26])&IF(RC[-25]="",,"|n"&R1C10&RC[-25])&IF(RC[-24]="",,"|n"&R1C11&RC[-24])&IF(RC[-23]="",,"|n"&R1C12&RC[-23])&IF(RC[-22]="",,"|n"&R1C13&RC[-22])&IF(RC[-20]&RC[-19]&RC[-18]&RC[-17]="",,"|n"&R1C14)&IF(RC[-20]="",,"|n"&R1C15&RC[-20])&IF(RC[-19]="",,"|n"&R1C16&RC[-19])&IF(RC[-18]="",,"|n"&R1C17&RC[-18])&IF(RC[-17]="",,"|n"&R1C18&RC[-17])&IF(RC[-16]="",,"|n"&R1C19&RC[-16])&IF(RC[-15]="",,"|n"&R1C20&RC[-15])&IF(RC[-14]="",,"|n"&R1C21&RC[-14])&IF(RC[-13]="",,"|n"&R1C22&RC[-13])&IF(RC[-11]="",,"|n"&R1C24&RC[-11])&IF(RC[-10]="",,"|n"&R1C25&RC[-10])&IF(RC[-9]="",,"|n"&R1C26&RC[-9])&IF(RC[-8]="",,"|n"&R1C27&RC[-8])&IF(RC[-7]="",,"|n"&R1C28&RC[-7])&IF(RC[-6]="",,"|n"&R1C29&RC[-6])&IF(RC[-2]="",,"|n"&RC[-2]) -> 
AI763: =IF(RC[-27]&RC[-26]&RC[-25]&RC[-24]&RC[-23]&RC[-22]="",,R1C7)&IF(RC[-27]="",,"|n"&R1C8&RC[-27])&IF(RC[-26]="",,"|n"&R1C9&RC[-26])&IF(RC[-25]="",,"|n"&R1C10&RC[-25])&IF(RC[-24]="",,"|n"&R1C11&RC[-24])&IF(RC[-23]="",,"|n"&R1C12&RC[-23])&IF(RC[-22]="",,"|n"&R1C13&RC[-22])&IF(RC[-20]&RC[-19]&RC[-18]&RC[-17]="",,"|n"&R1C14)&IF(RC[-20]="",,"|n"&R1C15&RC[-20])&IF(RC[-19]="",,"|n"&R1C16&RC[-19])&IF(RC[-18]="",,"|n"&R1C17&RC[-18])&IF(RC[-17]="",,"|n"&R1C18&RC[-17])&IF(RC[-16]="",,"|n"&R1C19&RC[-16])&IF(RC[-15]="",,"|n"&R1C20&RC[-15])&IF(RC[-14]="",,"|n"&R1C21&RC[-14])&IF(RC[-13]="",,"|n"&R1C22&RC[-13])&IF(RC[-11]="",,"|n"&R1C24&RC[-11])&IF(RC[-10]="",,"|n"&R1C25&RC[-10])&IF(RC[-9]="",,"|n"&R1C26&RC[-9])&IF(RC[-8]="",,"|n"&R1C27&RC[-8])&IF(RC[-7]="",,"|n"&R1C28&RC[-7])&IF(RC[-6]="",,"|n"&R1C29&RC[-6])&IF(RC[-2]="",,"|n"&RC[-2]) -> 
AI764: =IF(RC[-27]&RC[-26]&RC[-25]&RC[-24]&RC[-23]&RC[-22]="",,R1C7)&IF(RC[-27]="",,"|n"&R1C8&RC[-27])&IF(RC[-26]="",,"|n"&R1C9&RC[-26])&IF(RC[-25]="",,"|n"&R1C10&RC[-25])&IF(RC[-24]="",,"|n"&R1C11&RC[-24])&IF(RC[-23]="",,"|n"&R1C12&RC[-23])&IF(RC[-22]="",,"|n"&R1C13&RC[-22])&IF(RC[-20]&RC[-19]&RC[-18]&RC[-17]="",,"|n"&R1C14)&IF(RC[-20]="",,"|n"&R1C15&RC[-20])&IF(RC[-19]="",,"|n"&R1C16&RC[-19])&IF(RC[-18]="",,"|n"&R1C17&RC[-18])&IF(RC[-17]="",,"|n"&R1C18&RC[-17])&IF(RC[-16]="",,"|n"&R1C19&RC[-16])&IF(RC[-15]="",,"|n"&R1C20&RC[-15])&IF(RC[-14]="",,"|n"&R1C21&RC[-14])&IF(RC[-13]="",,"|n"&R1C22&RC[-13])&IF(RC[-11]="",,"|n"&R1C24&RC[-11])&IF(RC[-10]="",,"|n"&R1C25&RC[-10])&IF(RC[-9]="",,"|n"&R1C26&RC[-9])&IF(RC[-8]="",,"|n"&R1C27&RC[-8])&IF(RC[-7]="",,"|n"&R1C28&RC[-7])&IF(RC[-6]="",,"|n"&R1C29&RC[-6])&IF(RC[-2]="",,"|n"&RC[-2]) -> 
AI765: =IF(RC[-27]&RC[-26]&RC[-25]&RC[-24]&RC[-23]&RC[-22]="",,R1C7)&IF(RC[-27]="",,"|n"&R1C8&RC[-27])&IF(RC[-26]="",,"|n"&R1C9&RC[-26])&IF(RC[-25]="",,"|n"&R1C10&RC[-25])&IF(RC[-24]="",,"|n"&R1C11&RC[-24])&IF(RC[-23]="",,"|n"&R1C12&RC[-23])&IF(RC[-22]="",,"|n"&R1C13&RC[-22])&IF(RC[-20]&RC[-19]&RC[-18]&RC[-17]="",,"|n"&R1C14)&IF(RC[-20]="",,"|n"&R1C15&RC[-20])&IF(RC[-19]="",,"|n"&R1C16&RC[-19])&IF(RC[-18]="",,"|n"&R1C17&RC[-18])&IF(RC[-17]="",,"|n"&R1C18&RC[-17])&IF(RC[-16]="",,"|n"&R1C19&RC[-16])&IF(RC[-15]="",,"|n"&R1C20&RC[-15])&IF(RC[-14]="",,"|n"&R1C21&RC[-14])&IF(RC[-13]="",,"|n"&R1C22&RC[-13])&IF(RC[-11]="",,"|n"&R1C24&RC[-11])&IF(RC[-10]="",,"|n"&R1C25&RC[-10])&IF(RC[-9]="",,"|n"&R1C26&RC[-9])&IF(RC[-8]="",,"|n"&R1C27&RC[-8])&IF(RC[-7]="",,"|n"&R1C28&RC[-7])&IF(RC[-6]="",,"|n"&R1C29&RC[-6])&IF(RC[-2]="",,"|n"&RC[-2]) -> 
AI766: =IF(RC[-27]&RC[-26]&RC[-25]&RC[-24]&RC[-23]&RC[-22]="",,R1C7)&IF(RC[-27]="",,"|n"&R1C8&RC[-27])&IF(RC[-26]="",,"|n"&R1C9&RC[-26])&IF(RC[-25]="",,"|n"&R1C10&RC[-25])&IF(RC[-24]="",,"|n"&R1C11&RC[-24])&IF(RC[-23]="",,"|n"&R1C12&RC[-23])&IF(RC[-22]="",,"|n"&R1C13&RC[-22])&IF(RC[-20]&RC[-19]&RC[-18]&RC[-17]="",,"|n"&R1C14)&IF(RC[-20]="",,"|n"&R1C15&RC[-20])&IF(RC[-19]="",,"|n"&R1C16&RC[-19])&IF(RC[-18]="",,"|n"&R1C17&RC[-18])&IF(RC[-17]="",,"|n"&R1C18&RC[-17])&IF(RC[-16]="",,"|n"&R1C19&RC[-16])&IF(RC[-15]="",,"|n"&R1C20&RC[-15])&IF(RC[-14]="",,"|n"&R1C21&RC[-14])&IF(RC[-13]="",,"|n"&R1C22&RC[-13])&IF(RC[-11]="",,"|n"&R1C24&RC[-11])&IF(RC[-10]="",,"|n"&R1C25&RC[-10])&IF(RC[-9]="",,"|n"&R1C26&RC[-9])&IF(RC[-8]="",,"|n"&R1C27&RC[-8])&IF(RC[-7]="",,"|n"&R1C28&RC[-7])&IF(RC[-6]="",,"|n"&R1C29&RC[-6])&IF(RC[-2]="",,"|n"&RC[-2]) -> 
AI767: =IF(RC[-27]&RC[-26]&RC[-25]&RC[-24]&RC[-23]&RC[-22]="",,R1C7)&IF(RC[-27]="",,"|n"&R1C8&RC[-27])&IF(RC[-26]="",,"|n"&R1C9&RC[-26])&IF(RC[-25]="",,"|n"&R1C10&RC[-25])&IF(RC[-24]="",,"|n"&R1C11&RC[-24])&IF(RC[-23]="",,"|n"&R1C12&RC[-23])&IF(RC[-22]="",,"|n"&R1C13&RC[-22])&IF(RC[-20]&RC[-19]&RC[-18]&RC[-17]="",,"|n"&R1C14)&IF(RC[-20]="",,"|n"&R1C15&RC[-20])&IF(RC[-19]="",,"|n"&R1C16&RC[-19])&IF(RC[-18]="",,"|n"&R1C17&RC[-18])&IF(RC[-17]="",,"|n"&R1C18&RC[-17])&IF(RC[-16]="",,"|n"&R1C19&RC[-16])&IF(RC[-15]="",,"|n"&R1C20&RC[-15])&IF(RC[-14]="",,"|n"&R1C21&RC[-14])&IF(RC[-13]="",,"|n"&R1C22&RC[-13])&IF(RC[-11]="",,"|n"&R1C24&RC[-11])&IF(RC[-10]="",,"|n"&R1C25&RC[-10])&IF(RC[-9]="",,"|n"&R1C26&RC[-9])&IF(RC[-8]="",,"|n"&R1C27&RC[-8])&IF(RC[-7]="",,"|n"&R1C28&RC[-7])&IF(RC[-6]="",,"|n"&R1C29&RC[-6])&IF(RC[-2]="",,"|n"&RC[-2]) -> 
AI768: =IF(RC[-27]&RC[-26]&RC[-25]&RC[-24]&RC[-23]&RC[-22]="",,R1C7)&IF(RC[-27]="",,"|n"&R1C8&RC[-27])&IF(RC[-26]="",,"|n"&R1C9&RC[-26])&IF(RC[-25]="",,"|n"&R1C10&RC[-25])&IF(RC[-24]="",,"|n"&R1C11&RC[-24])&IF(RC[-23]="",,"|n"&R1C12&RC[-23])&IF(RC[-22]="",,"|n"&R1C13&RC[-22])&IF(RC[-20]&RC[-19]&RC[-18]&RC[-17]="",,"|n"&R1C14)&IF(RC[-20]="",,"|n"&R1C15&RC[-20])&IF(RC[-19]="",,"|n"&R1C16&RC[-19])&IF(RC[-18]="",,"|n"&R1C17&RC[-18])&IF(RC[-17]="",,"|n"&R1C18&RC[-17])&IF(RC[-16]="",,"|n"&R1C19&RC[-16])&IF(RC[-15]="",,"|n"&R1C20&RC[-15])&IF(RC[-14]="",,"|n"&R1C21&RC[-14])&IF(RC[-13]="",,"|n"&R1C22&RC[-13])&IF(RC[-11]="",,"|n"&R1C24&RC[-11])&IF(RC[-10]="",,"|n"&R1C25&RC[-10])&IF(RC[-9]="",,"|n"&R1C26&RC[-9])&IF(RC[-8]="",,"|n"&R1C27&RC[-8])&IF(RC[-7]="",,"|n"&R1C28&RC[-7])&IF(RC[-6]="",,"|n"&R1C29&RC[-6])&IF(RC[-2]="",,"|n"&RC[-2]) -> 
AI769: =IF(RC[-27]&RC[-26]&RC[-25]&RC[-24]&RC[-23]&RC[-22]="",,R1C7)&IF(RC[-27]="",,"|n"&R1C8&RC[-27])&IF(RC[-26]="",,"|n"&R1C9&RC[-26])&IF(RC[-25]="",,"|n"&R1C10&RC[-25])&IF(RC[-24]="",,"|n"&R1C11&RC[-24])&IF(RC[-23]="",,"|n"&R1C12&RC[-23])&IF(RC[-22]="",,"|n"&R1C13&RC[-22])&IF(RC[-20]&RC[-19]&RC[-18]&RC[-17]="",,"|n"&R1C14)&IF(RC[-20]="",,"|n"&R1C15&RC[-20])&IF(RC[-19]="",,"|n"&R1C16&RC[-19])&IF(RC[-18]="",,"|n"&R1C17&RC[-18])&IF(RC[-17]="",,"|n"&R1C18&RC[-17])&IF(RC[-16]="",,"|n"&R1C19&RC[-16])&IF(RC[-15]="",,"|n"&R1C20&RC[-15])&IF(RC[-14]="",,"|n"&R1C21&RC[-14])&IF(RC[-13]="",,"|n"&R1C22&RC[-13])&IF(RC[-11]="",,"|n"&R1C24&RC[-11])&IF(RC[-10]="",,"|n"&R1C25&RC[-10])&IF(RC[-9]="",,"|n"&R1C26&RC[-9])&IF(RC[-8]="",,"|n"&R1C27&RC[-8])&IF(RC[-7]="",,"|n"&R1C28&RC[-7])&IF(RC[-6]="",,"|n"&R1C29&RC[-6])&IF(RC[-2]="",,"|n"&RC[-2]) -> 
AI770: =IF(RC[-27]&RC[-26]&RC[-25]&RC[-24]&RC[-23]&RC[-22]="",,R1C7)&IF(RC[-27]="",,"|n"&R1C8&RC[-27])&IF(RC[-26]="",,"|n"&R1C9&RC[-26])&IF(RC[-25]="",,"|n"&R1C10&RC[-25])&IF(RC[-24]="",,"|n"&R1C11&RC[-24])&IF(RC[-23]="",,"|n"&R1C12&RC[-23])&IF(RC[-22]="",,"|n"&R1C13&RC[-22])&IF(RC[-20]&RC[-19]&RC[-18]&RC[-17]="",,"|n"&R1C14)&IF(RC[-20]="",,"|n"&R1C15&RC[-20])&IF(RC[-19]="",,"|n"&R1C16&RC[-19])&IF(RC[-18]="",,"|n"&R1C17&RC[-18])&IF(RC[-17]="",,"|n"&R1C18&RC[-17])&IF(RC[-16]="",,"|n"&R1C19&RC[-16])&IF(RC[-15]="",,"|n"&R1C20&RC[-15])&IF(RC[-14]="",,"|n"&R1C21&RC[-14])&IF(RC[-13]="",,"|n"&R1C22&RC[-13])&IF(RC[-11]="",,"|n"&R1C24&RC[-11])&IF(RC[-10]="",,"|n"&R1C25&RC[-10])&IF(RC[-9]="",,"|n"&R1C26&RC[-9])&IF(RC[-8]="",,"|n"&R1C27&RC[-8])&IF(RC[-7]="",,"|n"&R1C28&RC[-7])&IF(RC[-6]="",,"|n"&R1C29&RC[-6])&IF(RC[-2]="",,"|n"&RC[-2]) -> 
AI771: =IF(RC[-27]&RC[-26]&RC[-25]&RC[-24]&RC[-23]&RC[-22]="",,R1C7)&IF(RC[-27]="",,"|n"&R1C8&RC[-27])&IF(RC[-26]="",,"|n"&R1C9&RC[-26])&IF(RC[-25]="",,"|n"&R1C10&RC[-25])&IF(RC[-24]="",,"|n"&R1C11&RC[-24])&IF(RC[-23]="",,"|n"&R1C12&RC[-23])&IF(RC[-22]="",,"|n"&R1C13&RC[-22])&IF(RC[-20]&RC[-19]&RC[-18]&RC[-17]="",,"|n"&R1C14)&IF(RC[-20]="",,"|n"&R1C15&RC[-20])&IF(RC[-19]="",,"|n"&R1C16&RC[-19])&IF(RC[-18]="",,"|n"&R1C17&RC[-18])&IF(RC[-17]="",,"|n"&R1C18&RC[-17])&IF(RC[-16]="",,"|n"&R1C19&RC[-16])&IF(RC[-15]="",,"|n"&R1C20&RC[-15])&IF(RC[-14]="",,"|n"&R1C21&RC[-14])&IF(RC[-13]="",,"|n"&R1C22&RC[-13])&IF(RC[-11]="",,"|n"&R1C24&RC[-11])&IF(RC[-10]="",,"|n"&R1C25&RC[-10])&IF(RC[-9]="",,"|n"&R1C26&RC[-9])&IF(RC[-8]="",,"|n"&R1C27&RC[-8])&IF(RC[-7]="",,"|n"&R1C28&RC[-7])&IF(RC[-6]="",,"|n"&R1C29&RC[-6])&IF(RC[-2]="",,"|n"&RC[-2]) -> 
AI772: =IF(RC[-27]&RC[-26]&RC[-25]&RC[-24]&RC[-23]&RC[-22]="",,R1C7)&IF(RC[-27]="",,"|n"&R1C8&RC[-27])&IF(RC[-26]="",,"|n"&R1C9&RC[-26])&IF(RC[-25]="",,"|n"&R1C10&RC[-25])&IF(RC[-24]="",,"|n"&R1C11&RC[-24])&IF(RC[-23]="",,"|n"&R1C12&RC[-23])&IF(RC[-22]="",,"|n"&R1C13&RC[-22])&IF(RC[-20]&RC[-19]&RC[-18]&RC[-17]="",,"|n"&R1C14)&IF(RC[-20]="",,"|n"&R1C15&RC[-20])&IF(RC[-19]="",,"|n"&R1C16&RC[-19])&IF(RC[-18]="",,"|n"&R1C17&RC[-18])&IF(RC[-17]="",,"|n"&R1C18&RC[-17])&IF(RC[-16]="",,"|n"&R1C19&RC[-16])&IF(RC[-15]="",,"|n"&R1C20&RC[-15])&IF(RC[-14]="",,"|n"&R1C21&RC[-14])&IF(RC[-13]="",,"|n"&R1C22&RC[-13])&IF(RC[-11]="",,"|n"&R1C24&RC[-11])&IF(RC[-10]="",,"|n"&R1C25&RC[-10])&IF(RC[-9]="",,"|n"&R1C26&RC[-9])&IF(RC[-8]="",,"|n"&R1C27&RC[-8])&IF(RC[-7]="",,"|n"&R1C28&RC[-7])&IF(RC[-6]="",,"|n"&R1C29&RC[-6])&IF(RC[-2]="",,"|n"&RC[-2]) -> 
AI773: =IF(RC[-27]&RC[-26]&RC[-25]&RC[-24]&RC[-23]&RC[-22]="",,R1C7)&IF(RC[-27]="",,"|n"&R1C8&RC[-27])&IF(RC[-26]="",,"|n"&R1C9&RC[-26])&IF(RC[-25]="",,"|n"&R1C10&RC[-25])&IF(RC[-24]="",,"|n"&R1C11&RC[-24])&IF(RC[-23]="",,"|n"&R1C12&RC[-23])&IF(RC[-22]="",,"|n"&R1C13&RC[-22])&IF(RC[-20]&RC[-19]&RC[-18]&RC[-17]="",,"|n"&R1C14)&IF(RC[-20]="",,"|n"&R1C15&RC[-20])&IF(RC[-19]="",,"|n"&R1C16&RC[-19])&IF(RC[-18]="",,"|n"&R1C17&RC[-18])&IF(RC[-17]="",,"|n"&R1C18&RC[-17])&IF(RC[-16]="",,"|n"&R1C19&RC[-16])&IF(RC[-15]="",,"|n"&R1C20&RC[-15])&IF(RC[-14]="",,"|n"&R1C21&RC[-14])&IF(RC[-13]="",,"|n"&R1C22&RC[-13])&IF(RC[-11]="",,"|n"&R1C24&RC[-11])&IF(RC[-10]="",,"|n"&R1C25&RC[-10])&IF(RC[-9]="",,"|n"&R1C26&RC[-9])&IF(RC[-8]="",,"|n"&R1C27&RC[-8])&IF(RC[-7]="",,"|n"&R1C28&RC[-7])&IF(RC[-6]="",,"|n"&R1C29&RC[-6])&IF(RC[-2]="",,"|n"&RC[-2]) -> 
AI774: =IF(RC[-27]&RC[-26]&RC[-25]&RC[-24]&RC[-23]&RC[-22]="",,R1C7)&IF(RC[-27]="",,"|n"&R1C8&RC[-27])&IF(RC[-26]="",,"|n"&R1C9&RC[-26])&IF(RC[-25]="",,"|n"&R1C10&RC[-25])&IF(RC[-24]="",,"|n"&R1C11&RC[-24])&IF(RC[-23]="",,"|n"&R1C12&RC[-23])&IF(RC[-22]="",,"|n"&R1C13&RC[-22])&IF(RC[-20]&RC[-19]&RC[-18]&RC[-17]="",,"|n"&R1C14)&IF(RC[-20]="",,"|n"&R1C15&RC[-20])&IF(RC[-19]="",,"|n"&R1C16&RC[-19])&IF(RC[-18]="",,"|n"&R1C17&RC[-18])&IF(RC[-17]="",,"|n"&R1C18&RC[-17])&IF(RC[-16]="",,"|n"&R1C19&RC[-16])&IF(RC[-15]="",,"|n"&R1C20&RC[-15])&IF(RC[-14]="",,"|n"&R1C21&RC[-14])&IF(RC[-13]="",,"|n"&R1C22&RC[-13])&IF(RC[-11]="",,"|n"&R1C24&RC[-11])&IF(RC[-10]="",,"|n"&R1C25&RC[-10])&IF(RC[-9]="",,"|n"&R1C26&RC[-9])&IF(RC[-8]="",,"|n"&R1C27&RC[-8])&IF(RC[-7]="",,"|n"&R1C28&RC[-7])&IF(RC[-6]="",,"|n"&R1C29&RC[-6])&IF(RC[-2]="",,"|n"&RC[-2]) -> 
AI775: =IF(RC[-27]&RC[-26]&RC[-25]&RC[-24]&RC[-23]&RC[-22]="",,R1C7)&IF(RC[-27]="",,"|n"&R1C8&RC[-27])&IF(RC[-26]="",,"|n"&R1C9&RC[-26])&IF(RC[-25]="",,"|n"&R1C10&RC[-25])&IF(RC[-24]="",,"|n"&R1C11&RC[-24])&IF(RC[-23]="",,"|n"&R1C12&RC[-23])&IF(RC[-22]="",,"|n"&R1C13&RC[-22])&IF(RC[-20]&RC[-19]&RC[-18]&RC[-17]="",,"|n"&R1C14)&IF(RC[-20]="",,"|n"&R1C15&RC[-20])&IF(RC[-19]="",,"|n"&R1C16&RC[-19])&IF(RC[-18]="",,"|n"&R1C17&RC[-18])&IF(RC[-17]="",,"|n"&R1C18&RC[-17])&IF(RC[-16]="",,"|n"&R1C19&RC[-16])&IF(RC[-15]="",,"|n"&R1C20&RC[-15])&IF(RC[-14]="",,"|n"&R1C21&RC[-14])&IF(RC[-13]="",,"|n"&R1C22&RC[-13])&IF(RC[-11]="",,"|n"&R1C24&RC[-11])&IF(RC[-10]="",,"|n"&R1C25&RC[-10])&IF(RC[-9]="",,"|n"&R1C26&RC[-9])&IF(RC[-8]="",,"|n"&R1C27&RC[-8])&IF(RC[-7]="",,"|n"&R1C28&RC[-7])&IF(RC[-6]="",,"|n"&R1C29&RC[-6])&IF(RC[-2]="",,"|n"&RC[-2]) -> 
AI776: =IF(RC[-27]&RC[-26]&RC[-25]&RC[-24]&RC[-23]&RC[-22]="",,R1C7)&IF(RC[-27]="",,"|n"&R1C8&RC[-27])&IF(RC[-26]="",,"|n"&R1C9&RC[-26])&IF(RC[-25]="",,"|n"&R1C10&RC[-25])&IF(RC[-24]="",,"|n"&R1C11&RC[-24])&IF(RC[-23]="",,"|n"&R1C12&RC[-23])&IF(RC[-22]="",,"|n"&R1C13&RC[-22])&IF(RC[-20]&RC[-19]&RC[-18]&RC[-17]="",,"|n"&R1C14)&IF(RC[-20]="",,"|n"&R1C15&RC[-20])&IF(RC[-19]="",,"|n"&R1C16&RC[-19])&IF(RC[-18]="",,"|n"&R1C17&RC[-18])&IF(RC[-17]="",,"|n"&R1C18&RC[-17])&IF(RC[-16]="",,"|n"&R1C19&RC[-16])&IF(RC[-15]="",,"|n"&R1C20&RC[-15])&IF(RC[-14]="",,"|n"&R1C21&RC[-14])&IF(RC[-13]="",,"|n"&R1C22&RC[-13])&IF(RC[-11]="",,"|n"&R1C24&RC[-11])&IF(RC[-10]="",,"|n"&R1C25&RC[-10])&IF(RC[-9]="",,"|n"&R1C26&RC[-9])&IF(RC[-8]="",,"|n"&R1C27&RC[-8])&IF(RC[-7]="",,"|n"&R1C28&RC[-7])&IF(RC[-6]="",,"|n"&R1C29&RC[-6])&IF(RC[-2]="",,"|n"&RC[-2]) -> 
AI777: =IF(RC[-27]&RC[-26]&RC[-25]&RC[-24]&RC[-23]&RC[-22]="",,R1C7)&IF(RC[-27]="",,"|n"&R1C8&RC[-27])&IF(RC[-26]="",,"|n"&R1C9&RC[-26])&IF(RC[-25]="",,"|n"&R1C10&RC[-25])&IF(RC[-24]="",,"|n"&R1C11&RC[-24])&IF(RC[-23]="",,"|n"&R1C12&RC[-23])&IF(RC[-22]="",,"|n"&R1C13&RC[-22])&IF(RC[-20]&RC[-19]&RC[-18]&RC[-17]="",,"|n"&R1C14)&IF(RC[-20]="",,"|n"&R1C15&RC[-20])&IF(RC[-19]="",,"|n"&R1C16&RC[-19])&IF(RC[-18]="",,"|n"&R1C17&RC[-18])&IF(RC[-17]="",,"|n"&R1C18&RC[-17])&IF(RC[-16]="",,"|n"&R1C19&RC[-16])&IF(RC[-15]="",,"|n"&R1C20&RC[-15])&IF(RC[-14]="",,"|n"&R1C21&RC[-14])&IF(RC[-13]="",,"|n"&R1C22&RC[-13])&IF(RC[-11]="",,"|n"&R1C24&RC[-11])&IF(RC[-10]="",,"|n"&R1C25&RC[-10])&IF(RC[-9]="",,"|n"&R1C26&RC[-9])&IF(RC[-8]="",,"|n"&R1C27&RC[-8])&IF(RC[-7]="",,"|n"&R1C28&RC[-7])&IF(RC[-6]="",,"|n"&R1C29&RC[-6])&IF(RC[-2]="",,"|n"&RC[-2]) -> 
AI778: =IF(RC[-27]&RC[-26]&RC[-25]&RC[-24]&RC[-23]&RC[-22]="",,R1C7)&IF(RC[-27]="",,"|n"&R1C8&RC[-27])&IF(RC[-26]="",,"|n"&R1C9&RC[-26])&IF(RC[-25]="",,"|n"&R1C10&RC[-25])&IF(RC[-24]="",,"|n"&R1C11&RC[-24])&IF(RC[-23]="",,"|n"&R1C12&RC[-23])&IF(RC[-22]="",,"|n"&R1C13&RC[-22])&IF(RC[-20]&RC[-19]&RC[-18]&RC[-17]="",,"|n"&R1C14)&IF(RC[-20]="",,"|n"&R1C15&RC[-20])&IF(RC[-19]="",,"|n"&R1C16&RC[-19])&IF(RC[-18]="",,"|n"&R1C17&RC[-18])&IF(RC[-17]="",,"|n"&R1C18&RC[-17])&IF(RC[-16]="",,"|n"&R1C19&RC[-16])&IF(RC[-15]="",,"|n"&R1C20&RC[-15])&IF(RC[-14]="",,"|n"&R1C21&RC[-14])&IF(RC[-13]="",,"|n"&R1C22&RC[-13])&IF(RC[-11]="",,"|n"&R1C24&RC[-11])&IF(RC[-10]="",,"|n"&R1C25&RC[-10])&IF(RC[-9]="",,"|n"&R1C26&RC[-9])&IF(RC[-8]="",,"|n"&R1C27&RC[-8])&IF(RC[-7]="",,"|n"&R1C28&RC[-7])&IF(RC[-6]="",,"|n"&R1C29&RC[-6])&IF(RC[-2]="",,"|n"&RC[-2]) -> 
AI779: =IF(RC[-27]&RC[-26]&RC[-25]&RC[-24]&RC[-23]&RC[-22]="",,R1C7)&IF(RC[-27]="",,"|n"&R1C8&RC[-27])&IF(RC[-26]="",,"|n"&R1C9&RC[-26])&IF(RC[-25]="",,"|n"&R1C10&RC[-25])&IF(RC[-24]="",,"|n"&R1C11&RC[-24])&IF(RC[-23]="",,"|n"&R1C12&RC[-23])&IF(RC[-22]="",,"|n"&R1C13&RC[-22])&IF(RC[-20]&RC[-19]&RC[-18]&RC[-17]="",,"|n"&R1C14)&IF(RC[-20]="",,"|n"&R1C15&RC[-20])&IF(RC[-19]="",,"|n"&R1C16&RC[-19])&IF(RC[-18]="",,"|n"&R1C17&RC[-18])&IF(RC[-17]="",,"|n"&R1C18&RC[-17])&IF(RC[-16]="",,"|n"&R1C19&RC[-16])&IF(RC[-15]="",,"|n"&R1C20&RC[-15])&IF(RC[-14]="",,"|n"&R1C21&RC[-14])&IF(RC[-13]="",,"|n"&R1C22&RC[-13])&IF(RC[-11]="",,"|n"&R1C24&RC[-11])&IF(RC[-10]="",,"|n"&R1C25&RC[-10])&IF(RC[-9]="",,"|n"&R1C26&RC[-9])&IF(RC[-8]="",,"|n"&R1C27&RC[-8])&IF(RC[-7]="",,"|n"&R1C28&RC[-7])&IF(RC[-6]="",,"|n"&R1C29&RC[-6])&IF(RC[-2]="",,"|n"&RC[-2]) -> 
AI780: =IF(RC[-27]&RC[-26]&RC[-25]&RC[-24]&RC[-23]&RC[-22]="",,R1C7)&IF(RC[-27]="",,"|n"&R1C8&RC[-27])&IF(RC[-26]="",,"|n"&R1C9&RC[-26])&IF(RC[-25]="",,"|n"&R1C10&RC[-25])&IF(RC[-24]="",,"|n"&R1C11&RC[-24])&IF(RC[-23]="",,"|n"&R1C12&RC[-23])&IF(RC[-22]="",,"|n"&R1C13&RC[-22])&IF(RC[-20]&RC[-19]&RC[-18]&RC[-17]="",,"|n"&R1C14)&IF(RC[-20]="",,"|n"&R1C15&RC[-20])&IF(RC[-19]="",,"|n"&R1C16&RC[-19])&IF(RC[-18]="",,"|n"&R1C17&RC[-18])&IF(RC[-17]="",,"|n"&R1C18&RC[-17])&IF(RC[-16]="",,"|n"&R1C19&RC[-16])&IF(RC[-15]="",,"|n"&R1C20&RC[-15])&IF(RC[-14]="",,"|n"&R1C21&RC[-14])&IF(RC[-13]="",,"|n"&R1C22&RC[-13])&IF(RC[-11]="",,"|n"&R1C24&RC[-11])&IF(RC[-10]="",,"|n"&R1C25&RC[-10])&IF(RC[-9]="",,"|n"&R1C26&RC[-9])&IF(RC[-8]="",,"|n"&R1C27&RC[-8])&IF(RC[-7]="",,"|n"&R1C28&RC[-7])&IF(RC[-6]="",,"|n"&R1C29&RC[-6])&IF(RC[-2]="",,"|n"&RC[-2]) -> 
AI781: =IF(RC[-27]&RC[-26]&RC[-25]&RC[-24]&RC[-23]&RC[-22]="",,R1C7)&IF(RC[-27]="",,"|n"&R1C8&RC[-27])&IF(RC[-26]="",,"|n"&R1C9&RC[-26])&IF(RC[-25]="",,"|n"&R1C10&RC[-25])&IF(RC[-24]="",,"|n"&R1C11&RC[-24])&IF(RC[-23]="",,"|n"&R1C12&RC[-23])&IF(RC[-22]="",,"|n"&R1C13&RC[-22])&IF(RC[-20]&RC[-19]&RC[-18]&RC[-17]="",,"|n"&R1C14)&IF(RC[-20]="",,"|n"&R1C15&RC[-20])&IF(RC[-19]="",,"|n"&R1C16&RC[-19])&IF(RC[-18]="",,"|n"&R1C17&RC[-18])&IF(RC[-17]="",,"|n"&R1C18&RC[-17])&IF(RC[-16]="",,"|n"&R1C19&RC[-16])&IF(RC[-15]="",,"|n"&R1C20&RC[-15])&IF(RC[-14]="",,"|n"&R1C21&RC[-14])&IF(RC[-13]="",,"|n"&R1C22&RC[-13])&IF(RC[-11]="",,"|n"&R1C24&RC[-11])&IF(RC[-10]="",,"|n"&R1C25&RC[-10])&IF(RC[-9]="",,"|n"&R1C26&RC[-9])&IF(RC[-8]="",,"|n"&R1C27&RC[-8])&IF(RC[-7]="",,"|n"&R1C28&RC[-7])&IF(RC[-6]="",,"|n"&R1C29&RC[-6])&IF(RC[-2]="",,"|n"&RC[-2]) -> 
AI782: =IF(RC[-27]&RC[-26]&RC[-25]&RC[-24]&RC[-23]&RC[-22]="",,R1C7)&IF(RC[-27]="",,"|n"&R1C8&RC[-27])&IF(RC[-26]="",,"|n"&R1C9&RC[-26])&IF(RC[-25]="",,"|n"&R1C10&RC[-25])&IF(RC[-24]="",,"|n"&R1C11&RC[-24])&IF(RC[-23]="",,"|n"&R1C12&RC[-23])&IF(RC[-22]="",,"|n"&R1C13&RC[-22])&IF(RC[-20]&RC[-19]&RC[-18]&RC[-17]="",,"|n"&R1C14)&IF(RC[-20]="",,"|n"&R1C15&RC[-20])&IF(RC[-19]="",,"|n"&R1C16&RC[-19])&IF(RC[-18]="",,"|n"&R1C17&RC[-18])&IF(RC[-17]="",,"|n"&R1C18&RC[-17])&IF(RC[-16]="",,"|n"&R1C19&RC[-16])&IF(RC[-15]="",,"|n"&R1C20&RC[-15])&IF(RC[-14]="",,"|n"&R1C21&RC[-14])&IF(RC[-13]="",,"|n"&R1C22&RC[-13])&IF(RC[-11]="",,"|n"&R1C24&RC[-11])&IF(RC[-10]="",,"|n"&R1C25&RC[-10])&IF(RC[-9]="",,"|n"&R1C26&RC[-9])&IF(RC[-8]="",,"|n"&R1C27&RC[-8])&IF(RC[-7]="",,"|n"&R1C28&RC[-7])&IF(RC[-6]="",,"|n"&R1C29&RC[-6])&IF(RC[-2]="",,"|n"&RC[-2]) -> 
AI783: =IF(RC[-27]&RC[-26]&RC[-25]&RC[-24]&RC[-23]&RC[-22]="",,R1C7)&IF(RC[-27]="",,"|n"&R1C8&RC[-27])&IF(RC[-26]="",,"|n"&R1C9&RC[-26])&IF(RC[-25]="",,"|n"&R1C10&RC[-25])&IF(RC[-24]="",,"|n"&R1C11&RC[-24])&IF(RC[-23]="",,"|n"&R1C12&RC[-23])&IF(RC[-22]="",,"|n"&R1C13&RC[-22])&IF(RC[-20]&RC[-19]&RC[-18]&RC[-17]="",,"|n"&R1C14)&IF(RC[-20]="",,"|n"&R1C15&RC[-20])&IF(RC[-19]="",,"|n"&R1C16&RC[-19])&IF(RC[-18]="",,"|n"&R1C17&RC[-18])&IF(RC[-17]="",,"|n"&R1C18&RC[-17])&IF(RC[-16]="",,"|n"&R1C19&RC[-16])&IF(RC[-15]="",,"|n"&R1C20&RC[-15])&IF(RC[-14]="",,"|n"&R1C21&RC[-14])&IF(RC[-13]="",,"|n"&R1C22&RC[-13])&IF(RC[-11]="",,"|n"&R1C24&RC[-11])&IF(RC[-10]="",,"|n"&R1C25&RC[-10])&IF(RC[-9]="",,"|n"&R1C26&RC[-9])&IF(RC[-8]="",,"|n"&R1C27&RC[-8])&IF(RC[-7]="",,"|n"&R1C28&RC[-7])&IF(RC[-6]="",,"|n"&R1C29&RC[-6])&IF(RC[-2]="",,"|n"&RC[-2]) -> 
AI784: =IF(RC[-27]&RC[-26]&RC[-25]&RC[-24]&RC[-23]&RC[-22]="",,R1C7)&IF(RC[-27]="",,"|n"&R1C8&RC[-27])&IF(RC[-26]="",,"|n"&R1C9&RC[-26])&IF(RC[-25]="",,"|n"&R1C10&RC[-25])&IF(RC[-24]="",,"|n"&R1C11&RC[-24])&IF(RC[-23]="",,"|n"&R1C12&RC[-23])&IF(RC[-22]="",,"|n"&R1C13&RC[-22])&IF(RC[-20]&RC[-19]&RC[-18]&RC[-17]="",,"|n"&R1C14)&IF(RC[-20]="",,"|n"&R1C15&RC[-20])&IF(RC[-19]="",,"|n"&R1C16&RC[-19])&IF(RC[-18]="",,"|n"&R1C17&RC[-18])&IF(RC[-17]="",,"|n"&R1C18&RC[-17])&IF(RC[-16]="",,"|n"&R1C19&RC[-16])&IF(RC[-15]="",,"|n"&R1C20&RC[-15])&IF(RC[-14]="",,"|n"&R1C21&RC[-14])&IF(RC[-13]="",,"|n"&R1C22&RC[-13])&IF(RC[-11]="",,"|n"&R1C24&RC[-11])&IF(RC[-10]="",,"|n"&R1C25&RC[-10])&IF(RC[-9]="",,"|n"&R1C26&RC[-9])&IF(RC[-8]="",,"|n"&R1C27&RC[-8])&IF(RC[-7]="",,"|n"&R1C28&RC[-7])&IF(RC[-6]="",,"|n"&R1C29&RC[-6])&IF(RC[-2]="",,"|n"&RC[-2]) -> 
AI785: =IF(RC[-27]&RC[-26]&RC[-25]&RC[-24]&RC[-23]&RC[-22]="",,R1C7)&IF(RC[-27]="",,"|n"&R1C8&RC[-27])&IF(RC[-26]="",,"|n"&R1C9&RC[-26])&IF(RC[-25]="",,"|n"&R1C10&RC[-25])&IF(RC[-24]="",,"|n"&R1C11&RC[-24])&IF(RC[-23]="",,"|n"&R1C12&RC[-23])&IF(RC[-22]="",,"|n"&R1C13&RC[-22])&IF(RC[-20]&RC[-19]&RC[-18]&RC[-17]="",,"|n"&R1C14)&IF(RC[-20]="",,"|n"&R1C15&RC[-20])&IF(RC[-19]="",,"|n"&R1C16&RC[-19])&IF(RC[-18]="",,"|n"&R1C17&RC[-18])&IF(RC[-17]="",,"|n"&R1C18&RC[-17])&IF(RC[-16]="",,"|n"&R1C19&RC[-16])&IF(RC[-15]="",,"|n"&R1C20&RC[-15])&IF(RC[-14]="",,"|n"&R1C21&RC[-14])&IF(RC[-13]="",,"|n"&R1C22&RC[-13])&IF(RC[-11]="",,"|n"&R1C24&RC[-11])&IF(RC[-10]="",,"|n"&R1C25&RC[-10])&IF(RC[-9]="",,"|n"&R1C26&RC[-9])&IF(RC[-8]="",,"|n"&R1C27&RC[-8])&IF(RC[-7]="",,"|n"&R1C28&RC[-7])&IF(RC[-6]="",,"|n"&R1C29&RC[-6])&IF(RC[-2]="",,"|n"&RC[-2]) -> 
AI786: =IF(RC[-27]&RC[-26]&RC[-25]&RC[-24]&RC[-23]&RC[-22]="",,R1C7)&IF(RC[-27]="",,"|n"&R1C8&RC[-27])&IF(RC[-26]="",,"|n"&R1C9&RC[-26])&IF(RC[-25]="",,"|n"&R1C10&RC[-25])&IF(RC[-24]="",,"|n"&R1C11&RC[-24])&IF(RC[-23]="",,"|n"&R1C12&RC[-23])&IF(RC[-22]="",,"|n"&R1C13&RC[-22])&IF(RC[-20]&RC[-19]&RC[-18]&RC[-17]="",,"|n"&R1C14)&IF(RC[-20]="",,"|n"&R1C15&RC[-20])&IF(RC[-19]="",,"|n"&R1C16&RC[-19])&IF(RC[-18]="",,"|n"&R1C17&RC[-18])&IF(RC[-17]="",,"|n"&R1C18&RC[-17])&IF(RC[-16]="",,"|n"&R1C19&RC[-16])&IF(RC[-15]="",,"|n"&R1C20&RC[-15])&IF(RC[-14]="",,"|n"&R1C21&RC[-14])&IF(RC[-13]="",,"|n"&R1C22&RC[-13])&IF(RC[-11]="",,"|n"&R1C24&RC[-11])&IF(RC[-10]="",,"|n"&R1C25&RC[-10])&IF(RC[-9]="",,"|n"&R1C26&RC[-9])&IF(RC[-8]="",,"|n"&R1C27&RC[-8])&IF(RC[-7]="",,"|n"&R1C28&RC[-7])&IF(RC[-6]="",,"|n"&R1C29&RC[-6])&IF(RC[-2]="",,"|n"&RC[-2]) -> 
AI787: =IF(RC[-27]&RC[-26]&RC[-25]&RC[-24]&RC[-23]&RC[-22]="",,R1C7)&IF(RC[-27]="",,"|n"&R1C8&RC[-27])&IF(RC[-26]="",,"|n"&R1C9&RC[-26])&IF(RC[-25]="",,"|n"&R1C10&RC[-25])&IF(RC[-24]="",,"|n"&R1C11&RC[-24])&IF(RC[-23]="",,"|n"&R1C12&RC[-23])&IF(RC[-22]="",,"|n"&R1C13&RC[-22])&IF(RC[-20]&RC[-19]&RC[-18]&RC[-17]="",,"|n"&R1C14)&IF(RC[-20]="",,"|n"&R1C15&RC[-20])&IF(RC[-19]="",,"|n"&R1C16&RC[-19])&IF(RC[-18]="",,"|n"&R1C17&RC[-18])&IF(RC[-17]="",,"|n"&R1C18&RC[-17])&IF(RC[-16]="",,"|n"&R1C19&RC[-16])&IF(RC[-15]="",,"|n"&R1C20&RC[-15])&IF(RC[-14]="",,"|n"&R1C21&RC[-14])&IF(RC[-13]="",,"|n"&R1C22&RC[-13])&IF(RC[-11]="",,"|n"&R1C24&RC[-11])&IF(RC[-10]="",,"|n"&R1C25&RC[-10])&IF(RC[-9]="",,"|n"&R1C26&RC[-9])&IF(RC[-8]="",,"|n"&R1C27&RC[-8])&IF(RC[-7]="",,"|n"&R1C28&RC[-7])&IF(RC[-6]="",,"|n"&R1C29&RC[-6])&IF(RC[-2]="",,"|n"&RC[-2]) -> 
AI788: =IF(RC[-27]&RC[-26]&RC[-25]&RC[-24]&RC[-23]&RC[-22]="",,R1C7)&IF(RC[-27]="",,"|n"&R1C8&RC[-27])&IF(RC[-26]="",,"|n"&R1C9&RC[-26])&IF(RC[-25]="",,"|n"&R1C10&RC[-25])&IF(RC[-24]="",,"|n"&R1C11&RC[-24])&IF(RC[-23]="",,"|n"&R1C12&RC[-23])&IF(RC[-22]="",,"|n"&R1C13&RC[-22])&IF(RC[-20]&RC[-19]&RC[-18]&RC[-17]="",,"|n"&R1C14)&IF(RC[-20]="",,"|n"&R1C15&RC[-20])&IF(RC[-19]="",,"|n"&R1C16&RC[-19])&IF(RC[-18]="",,"|n"&R1C17&RC[-18])&IF(RC[-17]="",,"|n"&R1C18&RC[-17])&IF(RC[-16]="",,"|n"&R1C19&RC[-16])&IF(RC[-15]="",,"|n"&R1C20&RC[-15])&IF(RC[-14]="",,"|n"&R1C21&RC[-14])&IF(RC[-13]="",,"|n"&R1C22&RC[-13])&IF(RC[-11]="",,"|n"&R1C24&RC[-11])&IF(RC[-10]="",,"|n"&R1C25&RC[-10])&IF(RC[-9]="",,"|n"&R1C26&RC[-9])&IF(RC[-8]="",,"|n"&R1C27&RC[-8])&IF(RC[-7]="",,"|n"&R1C28&RC[-7])&IF(RC[-6]="",,"|n"&R1C29&RC[-6])&IF(RC[-2]="",,"|n"&RC[-2]) -> 
AI789: =IF(RC[-27]&RC[-26]&RC[-25]&RC[-24]&RC[-23]&RC[-22]="",,R1C7)&IF(RC[-27]="",,"|n"&R1C8&RC[-27])&IF(RC[-26]="",,"|n"&R1C9&RC[-26])&IF(RC[-25]="",,"|n"&R1C10&RC[-25])&IF(RC[-24]="",,"|n"&R1C11&RC[-24])&IF(RC[-23]="",,"|n"&R1C12&RC[-23])&IF(RC[-22]="",,"|n"&R1C13&RC[-22])&IF(RC[-20]&RC[-19]&RC[-18]&RC[-17]="",,"|n"&R1C14)&IF(RC[-20]="",,"|n"&R1C15&RC[-20])&IF(RC[-19]="",,"|n"&R1C16&RC[-19])&IF(RC[-18]="",,"|n"&R1C17&RC[-18])&IF(RC[-17]="",,"|n"&R1C18&RC[-17])&IF(RC[-16]="",,"|n"&R1C19&RC[-16])&IF(RC[-15]="",,"|n"&R1C20&RC[-15])&IF(RC[-14]="",,"|n"&R1C21&RC[-14])&IF(RC[-13]="",,"|n"&R1C22&RC[-13])&IF(RC[-11]="",,"|n"&R1C24&RC[-11])&IF(RC[-10]="",,"|n"&R1C25&RC[-10])&IF(RC[-9]="",,"|n"&R1C26&RC[-9])&IF(RC[-8]="",,"|n"&R1C27&RC[-8])&IF(RC[-7]="",,"|n"&R1C28&RC[-7])&IF(RC[-6]="",,"|n"&R1C29&RC[-6])&IF(RC[-2]="",,"|n"&RC[-2]) -> 
AI790: =IF(RC[-27]&RC[-26]&RC[-25]&RC[-24]&RC[-23]&RC[-22]="",,R1C7)&IF(RC[-27]="",,"|n"&R1C8&RC[-27])&IF(RC[-26]="",,"|n"&R1C9&RC[-26])&IF(RC[-25]="",,"|n"&R1C10&RC[-25])&IF(RC[-24]="",,"|n"&R1C11&RC[-24])&IF(RC[-23]="",,"|n"&R1C12&RC[-23])&IF(RC[-22]="",,"|n"&R1C13&RC[-22])&IF(RC[-20]&RC[-19]&RC[-18]&RC[-17]="",,"|n"&R1C14)&IF(RC[-20]="",,"|n"&R1C15&RC[-20])&IF(RC[-19]="",,"|n"&R1C16&RC[-19])&IF(RC[-18]="",,"|n"&R1C17&RC[-18])&IF(RC[-17]="",,"|n"&R1C18&RC[-17])&IF(RC[-16]="",,"|n"&R1C19&RC[-16])&IF(RC[-15]="",,"|n"&R1C20&RC[-15])&IF(RC[-14]="",,"|n"&R1C21&RC[-14])&IF(RC[-13]="",,"|n"&R1C22&RC[-13])&IF(RC[-11]="",,"|n"&R1C24&RC[-11])&IF(RC[-10]="",,"|n"&R1C25&RC[-10])&IF(RC[-9]="",,"|n"&R1C26&RC[-9])&IF(RC[-8]="",,"|n"&R1C27&RC[-8])&IF(RC[-7]="",,"|n"&R1C28&RC[-7])&IF(RC[-6]="",,"|n"&R1C29&RC[-6])&IF(RC[-2]="",,"|n"&RC[-2]) -> 
AI791: =IF(RC[-27]&RC[-26]&RC[-25]&RC[-24]&RC[-23]&RC[-22]="",,R1C7)&IF(RC[-27]="",,"|n"&R1C8&RC[-27])&IF(RC[-26]="",,"|n"&R1C9&RC[-26])&IF(RC[-25]="",,"|n"&R1C10&RC[-25])&IF(RC[-24]="",,"|n"&R1C11&RC[-24])&IF(RC[-23]="",,"|n"&R1C12&RC[-23])&IF(RC[-22]="",,"|n"&R1C13&RC[-22])&IF(RC[-20]&RC[-19]&RC[-18]&RC[-17]="",,"|n"&R1C14)&IF(RC[-20]="",,"|n"&R1C15&RC[-20])&IF(RC[-19]="",,"|n"&R1C16&RC[-19])&IF(RC[-18]="",,"|n"&R1C17&RC[-18])&IF(RC[-17]="",,"|n"&R1C18&RC[-17])&IF(RC[-16]="",,"|n"&R1C19&RC[-16])&IF(RC[-15]="",,"|n"&R1C20&RC[-15])&IF(RC[-14]="",,"|n"&R1C21&RC[-14])&IF(RC[-13]="",,"|n"&R1C22&RC[-13])&IF(RC[-11]="",,"|n"&R1C24&RC[-11])&IF(RC[-10]="",,"|n"&R1C25&RC[-10])&IF(RC[-9]="",,"|n"&R1C26&RC[-9])&IF(RC[-8]="",,"|n"&R1C27&RC[-8])&IF(RC[-7]="",,"|n"&R1C28&RC[-7])&IF(RC[-6]="",,"|n"&R1C29&RC[-6])&IF(RC[-2]="",,"|n"&RC[-2]) -> 
AI792: =IF(RC[-27]&RC[-26]&RC[-25]&RC[-24]&RC[-23]&RC[-22]="",,R1C7)&IF(RC[-27]="",,"|n"&R1C8&RC[-27])&IF(RC[-26]="",,"|n"&R1C9&RC[-26])&IF(RC[-25]="",,"|n"&R1C10&RC[-25])&IF(RC[-24]="",,"|n"&R1C11&RC[-24])&IF(RC[-23]="",,"|n"&R1C12&RC[-23])&IF(RC[-22]="",,"|n"&R1C13&RC[-22])&IF(RC[-20]&RC[-19]&RC[-18]&RC[-17]="",,"|n"&R1C14)&IF(RC[-20]="",,"|n"&R1C15&RC[-20])&IF(RC[-19]="",,"|n"&R1C16&RC[-19])&IF(RC[-18]="",,"|n"&R1C17&RC[-18])&IF(RC[-17]="",,"|n"&R1C18&RC[-17])&IF(RC[-16]="",,"|n"&R1C19&RC[-16])&IF(RC[-15]="",,"|n"&R1C20&RC[-15])&IF(RC[-14]="",,"|n"&R1C21&RC[-14])&IF(RC[-13]="",,"|n"&R1C22&RC[-13])&IF(RC[-11]="",,"|n"&R1C24&RC[-11])&IF(RC[-10]="",,"|n"&R1C25&RC[-10])&IF(RC[-9]="",,"|n"&R1C26&RC[-9])&IF(RC[-8]="",,"|n"&R1C27&RC[-8])&IF(RC[-7]="",,"|n"&R1C28&RC[-7])&IF(RC[-6]="",,"|n"&R1C29&RC[-6])&IF(RC[-2]="",,"|n"&RC[-2]) -> 
AI793: =IF(RC[-27]&RC[-26]&RC[-25]&RC[-24]&RC[-23]&RC[-22]="",,R1C7)&IF(RC[-27]="",,"|n"&R1C8&RC[-27])&IF(RC[-26]="",,"|n"&R1C9&RC[-26])&IF(RC[-25]="",,"|n"&R1C10&RC[-25])&IF(RC[-24]="",,"|n"&R1C11&RC[-24])&IF(RC[-23]="",,"|n"&R1C12&RC[-23])&IF(RC[-22]="",,"|n"&R1C13&RC[-22])&IF(RC[-20]&RC[-19]&RC[-18]&RC[-17]="",,"|n"&R1C14)&IF(RC[-20]="",,"|n"&R1C15&RC[-20])&IF(RC[-19]="",,"|n"&R1C16&RC[-19])&IF(RC[-18]="",,"|n"&R1C17&RC[-18])&IF(RC[-17]="",,"|n"&R1C18&RC[-17])&IF(RC[-16]="",,"|n"&R1C19&RC[-16])&IF(RC[-15]="",,"|n"&R1C20&RC[-15])&IF(RC[-14]="",,"|n"&R1C21&RC[-14])&IF(RC[-13]="",,"|n"&R1C22&RC[-13])&IF(RC[-11]="",,"|n"&R1C24&RC[-11])&IF(RC[-10]="",,"|n"&R1C25&RC[-10])&IF(RC[-9]="",,"|n"&R1C26&RC[-9])&IF(RC[-8]="",,"|n"&R1C27&RC[-8])&IF(RC[-7]="",,"|n"&R1C28&RC[-7])&IF(RC[-6]="",,"|n"&R1C29&RC[-6])&IF(RC[-2]="",,"|n"&RC[-2]) -> 
AI794: =IF(RC[-27]&RC[-26]&RC[-25]&RC[-24]&RC[-23]&RC[-22]="",,R1C7)&IF(RC[-27]="",,"|n"&R1C8&RC[-27])&IF(RC[-26]="",,"|n"&R1C9&RC[-26])&IF(RC[-25]="",,"|n"&R1C10&RC[-25])&IF(RC[-24]="",,"|n"&R1C11&RC[-24])&IF(RC[-23]="",,"|n"&R1C12&RC[-23])&IF(RC[-22]="",,"|n"&R1C13&RC[-22])&IF(RC[-20]&RC[-19]&RC[-18]&RC[-17]="",,"|n"&R1C14)&IF(RC[-20]="",,"|n"&R1C15&RC[-20])&IF(RC[-19]="",,"|n"&R1C16&RC[-19])&IF(RC[-18]="",,"|n"&R1C17&RC[-18])&IF(RC[-17]="",,"|n"&R1C18&RC[-17])&IF(RC[-16]="",,"|n"&R1C19&RC[-16])&IF(RC[-15]="",,"|n"&R1C20&RC[-15])&IF(RC[-14]="",,"|n"&R1C21&RC[-14])&IF(RC[-13]="",,"|n"&R1C22&RC[-13])&IF(RC[-11]="",,"|n"&R1C24&RC[-11])&IF(RC[-10]="",,"|n"&R1C25&RC[-10])&IF(RC[-9]="",,"|n"&R1C26&RC[-9])&IF(RC[-8]="",,"|n"&R1C27&RC[-8])&IF(RC[-7]="",,"|n"&R1C28&RC[-7])&IF(RC[-6]="",,"|n"&R1C29&RC[-6])&IF(RC[-2]="",,"|n"&RC[-2]) -> 
AI795: =IF(RC[-27]&RC[-26]&RC[-25]&RC[-24]&RC[-23]&RC[-22]="",,R1C7)&IF(RC[-27]="",,"|n"&R1C8&RC[-27])&IF(RC[-26]="",,"|n"&R1C9&RC[-26])&IF(RC[-25]="",,"|n"&R1C10&RC[-25])&IF(RC[-24]="",,"|n"&R1C11&RC[-24])&IF(RC[-23]="",,"|n"&R1C12&RC[-23])&IF(RC[-22]="",,"|n"&R1C13&RC[-22])&IF(RC[-20]&RC[-19]&RC[-18]&RC[-17]="",,"|n"&R1C14)&IF(RC[-20]="",,"|n"&R1C15&RC[-20])&IF(RC[-19]="",,"|n"&R1C16&RC[-19])&IF(RC[-18]="",,"|n"&R1C17&RC[-18])&IF(RC[-17]="",,"|n"&R1C18&RC[-17])&IF(RC[-16]="",,"|n"&R1C19&RC[-16])&IF(RC[-15]="",,"|n"&R1C20&RC[-15])&IF(RC[-14]="",,"|n"&R1C21&RC[-14])&IF(RC[-13]="",,"|n"&R1C22&RC[-13])&IF(RC[-11]="",,"|n"&R1C24&RC[-11])&IF(RC[-10]="",,"|n"&R1C25&RC[-10])&IF(RC[-9]="",,"|n"&R1C26&RC[-9])&IF(RC[-8]="",,"|n"&R1C27&RC[-8])&IF(RC[-7]="",,"|n"&R1C28&RC[-7])&IF(RC[-6]="",,"|n"&R1C29&RC[-6])&IF(RC[-2]="",,"|n"&RC[-2]) -> 
AI796: =IF(RC[-27]&RC[-26]&RC[-25]&RC[-24]&RC[-23]&RC[-22]="",,R1C7)&IF(RC[-27]="",,"|n"&R1C8&RC[-27])&IF(RC[-26]="",,"|n"&R1C9&RC[-26])&IF(RC[-25]="",,"|n"&R1C10&RC[-25])&IF(RC[-24]="",,"|n"&R1C11&RC[-24])&IF(RC[-23]="",,"|n"&R1C12&RC[-23])&IF(RC[-22]="",,"|n"&R1C13&RC[-22])&IF(RC[-20]&RC[-19]&RC[-18]&RC[-17]="",,"|n"&R1C14)&IF(RC[-20]="",,"|n"&R1C15&RC[-20])&IF(RC[-19]="",,"|n"&R1C16&RC[-19])&IF(RC[-18]="",,"|n"&R1C17&RC[-18])&IF(RC[-17]="",,"|n"&R1C18&RC[-17])&IF(RC[-16]="",,"|n"&R1C19&RC[-16])&IF(RC[-15]="",,"|n"&R1C20&RC[-15])&IF(RC[-14]="",,"|n"&R1C21&RC[-14])&IF(RC[-13]="",,"|n"&R1C22&RC[-13])&IF(RC[-11]="",,"|n"&R1C24&RC[-11])&IF(RC[-10]="",,"|n"&R1C25&RC[-10])&IF(RC[-9]="",,"|n"&R1C26&RC[-9])&IF(RC[-8]="",,"|n"&R1C27&RC[-8])&IF(RC[-7]="",,"|n"&R1C28&RC[-7])&IF(RC[-6]="",,"|n"&R1C29&RC[-6])&IF(RC[-2]="",,"|n"&RC[-2]) -> 
AI797: =IF(RC[-27]&RC[-26]&RC[-25]&RC[-24]&RC[-23]&RC[-22]="",,R1C7)&IF(RC[-27]="",,"|n"&R1C8&RC[-27])&IF(RC[-26]="",,"|n"&R1C9&RC[-26])&IF(RC[-25]="",,"|n"&R1C10&RC[-25])&IF(RC[-24]="",,"|n"&R1C11&RC[-24])&IF(RC[-23]="",,"|n"&R1C12&RC[-23])&IF(RC[-22]="",,"|n"&R1C13&RC[-22])&IF(RC[-20]&RC[-19]&RC[-18]&RC[-17]="",,"|n"&R1C14)&IF(RC[-20]="",,"|n"&R1C15&RC[-20])&IF(RC[-19]="",,"|n"&R1C16&RC[-19])&IF(RC[-18]="",,"|n"&R1C17&RC[-18])&IF(RC[-17]="",,"|n"&R1C18&RC[-17])&IF(RC[-16]="",,"|n"&R1C19&RC[-16])&IF(RC[-15]="",,"|n"&R1C20&RC[-15])&IF(RC[-14]="",,"|n"&R1C21&RC[-14])&IF(RC[-13]="",,"|n"&R1C22&RC[-13])&IF(RC[-11]="",,"|n"&R1C24&RC[-11])&IF(RC[-10]="",,"|n"&R1C25&RC[-10])&IF(RC[-9]="",,"|n"&R1C26&RC[-9])&IF(RC[-8]="",,"|n"&R1C27&RC[-8])&IF(RC[-7]="",,"|n"&R1C28&RC[-7])&IF(RC[-6]="",,"|n"&R1C29&RC[-6])&IF(RC[-2]="",,"|n"&RC[-2]) -> 
AI798: =IF(RC[-27]&RC[-26]&RC[-25]&RC[-24]&RC[-23]&RC[-22]="",,R1C7)&IF(RC[-27]="",,"|n"&R1C8&RC[-27])&IF(RC[-26]="",,"|n"&R1C9&RC[-26])&IF(RC[-25]="",,"|n"&R1C10&RC[-25])&IF(RC[-24]="",,"|n"&R1C11&RC[-24])&IF(RC[-23]="",,"|n"&R1C12&RC[-23])&IF(RC[-22]="",,"|n"&R1C13&RC[-22])&IF(RC[-20]&RC[-19]&RC[-18]&RC[-17]="",,"|n"&R1C14)&IF(RC[-20]="",,"|n"&R1C15&RC[-20])&IF(RC[-19]="",,"|n"&R1C16&RC[-19])&IF(RC[-18]="",,"|n"&R1C17&RC[-18])&IF(RC[-17]="",,"|n"&R1C18&RC[-17])&IF(RC[-16]="",,"|n"&R1C19&RC[-16])&IF(RC[-15]="",,"|n"&R1C20&RC[-15])&IF(RC[-14]="",,"|n"&R1C21&RC[-14])&IF(RC[-13]="",,"|n"&R1C22&RC[-13])&IF(RC[-11]="",,"|n"&R1C24&RC[-11])&IF(RC[-10]="",,"|n"&R1C25&RC[-10])&IF(RC[-9]="",,"|n"&R1C26&RC[-9])&IF(RC[-8]="",,"|n"&R1C27&RC[-8])&IF(RC[-7]="",,"|n"&R1C28&RC[-7])&IF(RC[-6]="",,"|n"&R1C29&RC[-6])&IF(RC[-2]="",,"|n"&RC[-2]) -> 
AI799: =IF(RC[-27]&RC[-26]&RC[-25]&RC[-24]&RC[-23]&RC[-22]="",,R1C7)&IF(RC[-27]="",,"|n"&R1C8&RC[-27])&IF(RC[-26]="",,"|n"&R1C9&RC[-26])&IF(RC[-25]="",,"|n"&R1C10&RC[-25])&IF(RC[-24]="",,"|n"&R1C11&RC[-24])&IF(RC[-23]="",,"|n"&R1C12&RC[-23])&IF(RC[-22]="",,"|n"&R1C13&RC[-22])&IF(RC[-20]&RC[-19]&RC[-18]&RC[-17]="",,"|n"&R1C14)&IF(RC[-20]="",,"|n"&R1C15&RC[-20])&IF(RC[-19]="",,"|n"&R1C16&RC[-19])&IF(RC[-18]="",,"|n"&R1C17&RC[-18])&IF(RC[-17]="",,"|n"&R1C18&RC[-17])&IF(RC[-16]="",,"|n"&R1C19&RC[-16])&IF(RC[-15]="",,"|n"&R1C20&RC[-15])&IF(RC[-14]="",,"|n"&R1C21&RC[-14])&IF(RC[-13]="",,"|n"&R1C22&RC[-13])&IF(RC[-11]="",,"|n"&R1C24&RC[-11])&IF(RC[-10]="",,"|n"&R1C25&RC[-10])&IF(RC[-9]="",,"|n"&R1C26&RC[-9])&IF(RC[-8]="",,"|n"&R1C27&RC[-8])&IF(RC[-7]="",,"|n"&R1C28&RC[-7])&IF(RC[-6]="",,"|n"&R1C29&RC[-6])&IF(RC[-2]="",,"|n"&RC[-2]) -> 
AI800: =IF(RC[-27]&RC[-26]&RC[-25]&RC[-24]&RC[-23]&RC[-22]="",,R1C7)&IF(RC[-27]="",,"|n"&R1C8&RC[-27])&IF(RC[-26]="",,"|n"&R1C9&RC[-26])&IF(RC[-25]="",,"|n"&R1C10&RC[-25])&IF(RC[-24]="",,"|n"&R1C11&RC[-24])&IF(RC[-23]="",,"|n"&R1C12&RC[-23])&IF(RC[-22]="",,"|n"&R1C13&RC[-22])&IF(RC[-20]&RC[-19]&RC[-18]&RC[-17]="",,"|n"&R1C14)&IF(RC[-20]="",,"|n"&R1C15&RC[-20])&IF(RC[-19]="",,"|n"&R1C16&RC[-19])&IF(RC[-18]="",,"|n"&R1C17&RC[-18])&IF(RC[-17]="",,"|n"&R1C18&RC[-17])&IF(RC[-16]="",,"|n"&R1C19&RC[-16])&IF(RC[-15]="",,"|n"&R1C20&RC[-15])&IF(RC[-14]="",,"|n"&R1C21&RC[-14])&IF(RC[-13]="",,"|n"&R1C22&RC[-13])&IF(RC[-11]="",,"|n"&R1C24&RC[-11])&IF(RC[-10]="",,"|n"&R1C25&RC[-10])&IF(RC[-9]="",,"|n"&R1C26&RC[-9])&IF(RC[-8]="",,"|n"&R1C27&RC[-8])&IF(RC[-7]="",,"|n"&R1C28&RC[-7])&IF(RC[-6]="",,"|n"&R1C29&RC[-6])&IF(RC[-2]="",,"|n"&RC[-2]) -> 
AI801: =IF(RC[-27]&RC[-26]&RC[-25]&RC[-24]&RC[-23]&RC[-22]="",,R1C7)&IF(RC[-27]="",,"|n"&R1C8&RC[-27])&IF(RC[-26]="",,"|n"&R1C9&RC[-26])&IF(RC[-25]="",,"|n"&R1C10&RC[-25])&IF(RC[-24]="",,"|n"&R1C11&RC[-24])&IF(RC[-23]="",,"|n"&R1C12&RC[-23])&IF(RC[-22]="",,"|n"&R1C13&RC[-22])&IF(RC[-20]&RC[-19]&RC[-18]&RC[-17]="",,"|n"&R1C14)&IF(RC[-20]="",,"|n"&R1C15&RC[-20])&IF(RC[-19]="",,"|n"&R1C16&RC[-19])&IF(RC[-18]="",,"|n"&R1C17&RC[-18])&IF(RC[-17]="",,"|n"&R1C18&RC[-17])&IF(RC[-16]="",,"|n"&R1C19&RC[-16])&IF(RC[-15]="",,"|n"&R1C20&RC[-15])&IF(RC[-14]="",,"|n"&R1C21&RC[-14])&IF(RC[-13]="",,"|n"&R1C22&RC[-13])&IF(RC[-11]="",,"|n"&R1C24&RC[-11])&IF(RC[-10]="",,"|n"&R1C25&RC[-10])&IF(RC[-9]="",,"|n"&R1C26&RC[-9])&IF(RC[-8]="",,"|n"&R1C27&RC[-8])&IF(RC[-7]="",,"|n"&R1C28&RC[-7])&IF(RC[-6]="",,"|n"&R1C29&RC[-6])&IF(RC[-2]="",,"|n"&RC[-2]) -> 
AI802: =IF(RC[-27]&RC[-26]&RC[-25]&RC[-24]&RC[-23]&RC[-22]="",,R1C7)&IF(RC[-27]="",,"|n"&R1C8&RC[-27])&IF(RC[-26]="",,"|n"&R1C9&RC[-26])&IF(RC[-25]="",,"|n"&R1C10&RC[-25])&IF(RC[-24]="",,"|n"&R1C11&RC[-24])&IF(RC[-23]="",,"|n"&R1C12&RC[-23])&IF(RC[-22]="",,"|n"&R1C13&RC[-22])&IF(RC[-20]&RC[-19]&RC[-18]&RC[-17]="",,"|n"&R1C14)&IF(RC[-20]="",,"|n"&R1C15&RC[-20])&IF(RC[-19]="",,"|n"&R1C16&RC[-19])&IF(RC[-18]="",,"|n"&R1C17&RC[-18])&IF(RC[-17]="",,"|n"&R1C18&RC[-17])&IF(RC[-16]="",,"|n"&R1C19&RC[-16])&IF(RC[-15]="",,"|n"&R1C20&RC[-15])&IF(RC[-14]="",,"|n"&R1C21&RC[-14])&IF(RC[-13]="",,"|n"&R1C22&RC[-13])&IF(RC[-11]="",,"|n"&R1C24&RC[-11])&IF(RC[-10]="",,"|n"&R1C25&RC[-10])&IF(RC[-9]="",,"|n"&R1C26&RC[-9])&IF(RC[-8]="",,"|n"&R1C27&RC[-8])&IF(RC[-7]="",,"|n"&R1C28&RC[-7])&IF(RC[-6]="",,"|n"&R1C29&RC[-6])&IF(RC[-2]="",,"|n"&RC[-2]) -> 
AI803: =IF(RC[-27]&RC[-26]&RC[-25]&RC[-24]&RC[-23]&RC[-22]="",,R1C7)&IF(RC[-27]="",,"|n"&R1C8&RC[-27])&IF(RC[-26]="",,"|n"&R1C9&RC[-26])&IF(RC[-25]="",,"|n"&R1C10&RC[-25])&IF(RC[-24]="",,"|n"&R1C11&RC[-24])&IF(RC[-23]="",,"|n"&R1C12&RC[-23])&IF(RC[-22]="",,"|n"&R1C13&RC[-22])&IF(RC[-20]&RC[-19]&RC[-18]&RC[-17]="",,"|n"&R1C14)&IF(RC[-20]="",,"|n"&R1C15&RC[-20])&IF(RC[-19]="",,"|n"&R1C16&RC[-19])&IF(RC[-18]="",,"|n"&R1C17&RC[-18])&IF(RC[-17]="",,"|n"&R1C18&RC[-17])&IF(RC[-16]="",,"|n"&R1C19&RC[-16])&IF(RC[-15]="",,"|n"&R1C20&RC[-15])&IF(RC[-14]="",,"|n"&R1C21&RC[-14])&IF(RC[-13]="",,"|n"&R1C22&RC[-13])&IF(RC[-11]="",,"|n"&R1C24&RC[-11])&IF(RC[-10]="",,"|n"&R1C25&RC[-10])&IF(RC[-9]="",,"|n"&R1C26&RC[-9])&IF(RC[-8]="",,"|n"&R1C27&RC[-8])&IF(RC[-7]="",,"|n"&R1C28&RC[-7])&IF(RC[-6]="",,"|n"&R1C29&RC[-6])&IF(RC[-2]="",,"|n"&RC[-2]) -> 
AI804: =IF(RC[-27]&RC[-26]&RC[-25]&RC[-24]&RC[-23]&RC[-22]="",,R1C7)&IF(RC[-27]="",,"|n"&R1C8&RC[-27])&IF(RC[-26]="",,"|n"&R1C9&RC[-26])&IF(RC[-25]="",,"|n"&R1C10&RC[-25])&IF(RC[-24]="",,"|n"&R1C11&RC[-24])&IF(RC[-23]="",,"|n"&R1C12&RC[-23])&IF(RC[-22]="",,"|n"&R1C13&RC[-22])&IF(RC[-20]&RC[-19]&RC[-18]&RC[-17]="",,"|n"&R1C14)&IF(RC[-20]="",,"|n"&R1C15&RC[-20])&IF(RC[-19]="",,"|n"&R1C16&RC[-19])&IF(RC[-18]="",,"|n"&R1C17&RC[-18])&IF(RC[-17]="",,"|n"&R1C18&RC[-17])&IF(RC[-16]="",,"|n"&R1C19&RC[-16])&IF(RC[-15]="",,"|n"&R1C20&RC[-15])&IF(RC[-14]="",,"|n"&R1C21&RC[-14])&IF(RC[-13]="",,"|n"&R1C22&RC[-13])&IF(RC[-11]="",,"|n"&R1C24&RC[-11])&IF(RC[-10]="",,"|n"&R1C25&RC[-10])&IF(RC[-9]="",,"|n"&R1C26&RC[-9])&IF(RC[-8]="",,"|n"&R1C27&RC[-8])&IF(RC[-7]="",,"|n"&R1C28&RC[-7])&IF(RC[-6]="",,"|n"&R1C29&RC[-6])&IF(RC[-2]="",,"|n"&RC[-2]) -> 
AI805: =IF(RC[-27]&RC[-26]&RC[-25]&RC[-24]&RC[-23]&RC[-22]="",,R1C7)&IF(RC[-27]="",,"|n"&R1C8&RC[-27])&IF(RC[-26]="",,"|n"&R1C9&RC[-26])&IF(RC[-25]="",,"|n"&R1C10&RC[-25])&IF(RC[-24]="",,"|n"&R1C11&RC[-24])&IF(RC[-23]="",,"|n"&R1C12&RC[-23])&IF(RC[-22]="",,"|n"&R1C13&RC[-22])&IF(RC[-20]&RC[-19]&RC[-18]&RC[-17]="",,"|n"&R1C14)&IF(RC[-20]="",,"|n"&R1C15&RC[-20])&IF(RC[-19]="",,"|n"&R1C16&RC[-19])&IF(RC[-18]="",,"|n"&R1C17&RC[-18])&IF(RC[-17]="",,"|n"&R1C18&RC[-17])&IF(RC[-16]="",,"|n"&R1C19&RC[-16])&IF(RC[-15]="",,"|n"&R1C20&RC[-15])&IF(RC[-14]="",,"|n"&R1C21&RC[-14])&IF(RC[-13]="",,"|n"&R1C22&RC[-13])&IF(RC[-11]="",,"|n"&R1C24&RC[-11])&IF(RC[-10]="",,"|n"&R1C25&RC[-10])&IF(RC[-9]="",,"|n"&R1C26&RC[-9])&IF(RC[-8]="",,"|n"&R1C27&RC[-8])&IF(RC[-7]="",,"|n"&R1C28&RC[-7])&IF(RC[-6]="",,"|n"&R1C29&RC[-6])&IF(RC[-2]="",,"|n"&RC[-2]) -> 
AI806: =IF(RC[-27]&RC[-26]&RC[-25]&RC[-24]&RC[-23]&RC[-22]="",,R1C7)&IF(RC[-27]="",,"|n"&R1C8&RC[-27])&IF(RC[-26]="",,"|n"&R1C9&RC[-26])&IF(RC[-25]="",,"|n"&R1C10&RC[-25])&IF(RC[-24]="",,"|n"&R1C11&RC[-24])&IF(RC[-23]="",,"|n"&R1C12&RC[-23])&IF(RC[-22]="",,"|n"&R1C13&RC[-22])&IF(RC[-20]&RC[-19]&RC[-18]&RC[-17]="",,"|n"&R1C14)&IF(RC[-20]="",,"|n"&R1C15&RC[-20])&IF(RC[-19]="",,"|n"&R1C16&RC[-19])&IF(RC[-18]="",,"|n"&R1C17&RC[-18])&IF(RC[-17]="",,"|n"&R1C18&RC[-17])&IF(RC[-16]="",,"|n"&R1C19&RC[-16])&IF(RC[-15]="",,"|n"&R1C20&RC[-15])&IF(RC[-14]="",,"|n"&R1C21&RC[-14])&IF(RC[-13]="",,"|n"&R1C22&RC[-13])&IF(RC[-11]="",,"|n"&R1C24&RC[-11])&IF(RC[-10]="",,"|n"&R1C25&RC[-10])&IF(RC[-9]="",,"|n"&R1C26&RC[-9])&IF(RC[-8]="",,"|n"&R1C27&RC[-8])&IF(RC[-7]="",,"|n"&R1C28&RC[-7])&IF(RC[-6]="",,"|n"&R1C29&RC[-6])&IF(RC[-2]="",,"|n"&RC[-2]) -> 
AI807: =IF(RC[-27]&RC[-26]&RC[-25]&RC[-24]&RC[-23]&RC[-22]="",,R1C7)&IF(RC[-27]="",,"|n"&R1C8&RC[-27])&IF(RC[-26]="",,"|n"&R1C9&RC[-26])&IF(RC[-25]="",,"|n"&R1C10&RC[-25])&IF(RC[-24]="",,"|n"&R1C11&RC[-24])&IF(RC[-23]="",,"|n"&R1C12&RC[-23])&IF(RC[-22]="",,"|n"&R1C13&RC[-22])&IF(RC[-20]&RC[-19]&RC[-18]&RC[-17]="",,"|n"&R1C14)&IF(RC[-20]="",,"|n"&R1C15&RC[-20])&IF(RC[-19]="",,"|n"&R1C16&RC[-19])&IF(RC[-18]="",,"|n"&R1C17&RC[-18])&IF(RC[-17]="",,"|n"&R1C18&RC[-17])&IF(RC[-16]="",,"|n"&R1C19&RC[-16])&IF(RC[-15]="",,"|n"&R1C20&RC[-15])&IF(RC[-14]="",,"|n"&R1C21&RC[-14])&IF(RC[-13]="",,"|n"&R1C22&RC[-13])&IF(RC[-11]="",,"|n"&R1C24&RC[-11])&IF(RC[-10]="",,"|n"&R1C25&RC[-10])&IF(RC[-9]="",,"|n"&R1C26&RC[-9])&IF(RC[-8]="",,"|n"&R1C27&RC[-8])&IF(RC[-7]="",,"|n"&R1C28&RC[-7])&IF(RC[-6]="",,"|n"&R1C29&RC[-6])&IF(RC[-2]="",,"|n"&RC[-2]) -> 
AI808: =IF(RC[-27]&RC[-26]&RC[-25]&RC[-24]&RC[-23]&RC[-22]="",,R1C7)&IF(RC[-27]="",,"|n"&R1C8&RC[-27])&IF(RC[-26]="",,"|n"&R1C9&RC[-26])&IF(RC[-25]="",,"|n"&R1C10&RC[-25])&IF(RC[-24]="",,"|n"&R1C11&RC[-24])&IF(RC[-23]="",,"|n"&R1C12&RC[-23])&IF(RC[-22]="",,"|n"&R1C13&RC[-22])&IF(RC[-20]&RC[-19]&RC[-18]&RC[-17]="",,"|n"&R1C14)&IF(RC[-20]="",,"|n"&R1C15&RC[-20])&IF(RC[-19]="",,"|n"&R1C16&RC[-19])&IF(RC[-18]="",,"|n"&R1C17&RC[-18])&IF(RC[-17]="",,"|n"&R1C18&RC[-17])&IF(RC[-16]="",,"|n"&R1C19&RC[-16])&IF(RC[-15]="",,"|n"&R1C20&RC[-15])&IF(RC[-14]="",,"|n"&R1C21&RC[-14])&IF(RC[-13]="",,"|n"&R1C22&RC[-13])&IF(RC[-11]="",,"|n"&R1C24&RC[-11])&IF(RC[-10]="",,"|n"&R1C25&RC[-10])&IF(RC[-9]="",,"|n"&R1C26&RC[-9])&IF(RC[-8]="",,"|n"&R1C27&RC[-8])&IF(RC[-7]="",,"|n"&R1C28&RC[-7])&IF(RC[-6]="",,"|n"&R1C29&RC[-6])&IF(RC[-2]="",,"|n"&RC[-2]) -> 
AI809: =IF(RC[-27]&RC[-26]&RC[-25]&RC[-24]&RC[-23]&RC[-22]="",,R1C7)&IF(RC[-27]="",,"|n"&R1C8&RC[-27])&IF(RC[-26]="",,"|n"&R1C9&RC[-26])&IF(RC[-25]="",,"|n"&R1C10&RC[-25])&IF(RC[-24]="",,"|n"&R1C11&RC[-24])&IF(RC[-23]="",,"|n"&R1C12&RC[-23])&IF(RC[-22]="",,"|n"&R1C13&RC[-22])&IF(RC[-20]&RC[-19]&RC[-18]&RC[-17]="",,"|n"&R1C14)&IF(RC[-20]="",,"|n"&R1C15&RC[-20])&IF(RC[-19]="",,"|n"&R1C16&RC[-19])&IF(RC[-18]="",,"|n"&R1C17&RC[-18])&IF(RC[-17]="",,"|n"&R1C18&RC[-17])&IF(RC[-16]="",,"|n"&R1C19&RC[-16])&IF(RC[-15]="",,"|n"&R1C20&RC[-15])&IF(RC[-14]="",,"|n"&R1C21&RC[-14])&IF(RC[-13]="",,"|n"&R1C22&RC[-13])&IF(RC[-11]="",,"|n"&R1C24&RC[-11])&IF(RC[-10]="",,"|n"&R1C25&RC[-10])&IF(RC[-9]="",,"|n"&R1C26&RC[-9])&IF(RC[-8]="",,"|n"&R1C27&RC[-8])&IF(RC[-7]="",,"|n"&R1C28&RC[-7])&IF(RC[-6]="",,"|n"&R1C29&RC[-6])&IF(RC[-2]="",,"|n"&RC[-2]) -> 
AI810: =IF(RC[-27]&RC[-26]&RC[-25]&RC[-24]&RC[-23]&RC[-22]="",,R1C7)&IF(RC[-27]="",,"|n"&R1C8&RC[-27])&IF(RC[-26]="",,"|n"&R1C9&RC[-26])&IF(RC[-25]="",,"|n"&R1C10&RC[-25])&IF(RC[-24]="",,"|n"&R1C11&RC[-24])&IF(RC[-23]="",,"|n"&R1C12&RC[-23])&IF(RC[-22]="",,"|n"&R1C13&RC[-22])&IF(RC[-20]&RC[-19]&RC[-18]&RC[-17]="",,"|n"&R1C14)&IF(RC[-20]="",,"|n"&R1C15&RC[-20])&IF(RC[-19]="",,"|n"&R1C16&RC[-19])&IF(RC[-18]="",,"|n"&R1C17&RC[-18])&IF(RC[-17]="",,"|n"&R1C18&RC[-17])&IF(RC[-16]="",,"|n"&R1C19&RC[-16])&IF(RC[-15]="",,"|n"&R1C20&RC[-15])&IF(RC[-14]="",,"|n"&R1C21&RC[-14])&IF(RC[-13]="",,"|n"&R1C22&RC[-13])&IF(RC[-11]="",,"|n"&R1C24&RC[-11])&IF(RC[-10]="",,"|n"&R1C25&RC[-10])&IF(RC[-9]="",,"|n"&R1C26&RC[-9])&IF(RC[-8]="",,"|n"&R1C27&RC[-8])&IF(RC[-7]="",,"|n"&R1C28&RC[-7])&IF(RC[-6]="",,"|n"&R1C29&RC[-6])&IF(RC[-2]="",,"|n"&RC[-2]) -> 
AI811: =IF(RC[-27]&RC[-26]&RC[-25]&RC[-24]&RC[-23]&RC[-22]="",,R1C7)&IF(RC[-27]="",,"|n"&R1C8&RC[-27])&IF(RC[-26]="",,"|n"&R1C9&RC[-26])&IF(RC[-25]="",,"|n"&R1C10&RC[-25])&IF(RC[-24]="",,"|n"&R1C11&RC[-24])&IF(RC[-23]="",,"|n"&R1C12&RC[-23])&IF(RC[-22]="",,"|n"&R1C13&RC[-22])&IF(RC[-20]&RC[-19]&RC[-18]&RC[-17]="",,"|n"&R1C14)&IF(RC[-20]="",,"|n"&R1C15&RC[-20])&IF(RC[-19]="",,"|n"&R1C16&RC[-19])&IF(RC[-18]="",,"|n"&R1C17&RC[-18])&IF(RC[-17]="",,"|n"&R1C18&RC[-17])&IF(RC[-16]="",,"|n"&R1C19&RC[-16])&IF(RC[-15]="",,"|n"&R1C20&RC[-15])&IF(RC[-14]="",,"|n"&R1C21&RC[-14])&IF(RC[-13]="",,"|n"&R1C22&RC[-13])&IF(RC[-11]="",,"|n"&R1C24&RC[-11])&IF(RC[-10]="",,"|n"&R1C25&RC[-10])&IF(RC[-9]="",,"|n"&R1C26&RC[-9])&IF(RC[-8]="",,"|n"&R1C27&RC[-8])&IF(RC[-7]="",,"|n"&R1C28&RC[-7])&IF(RC[-6]="",,"|n"&R1C29&RC[-6])&IF(RC[-2]="",,"|n"&RC[-2]) -> 
AI812: =IF(RC[-27]&RC[-26]&RC[-25]&RC[-24]&RC[-23]&RC[-22]="",,R1C7)&IF(RC[-27]="",,"|n"&R1C8&RC[-27])&IF(RC[-26]="",,"|n"&R1C9&RC[-26])&IF(RC[-25]="",,"|n"&R1C10&RC[-25])&IF(RC[-24]="",,"|n"&R1C11&RC[-24])&IF(RC[-23]="",,"|n"&R1C12&RC[-23])&IF(RC[-22]="",,"|n"&R1C13&RC[-22])&IF(RC[-20]&RC[-19]&RC[-18]&RC[-17]="",,"|n"&R1C14)&IF(RC[-20]="",,"|n"&R1C15&RC[-20])&IF(RC[-19]="",,"|n"&R1C16&RC[-19])&IF(RC[-18]="",,"|n"&R1C17&RC[-18])&IF(RC[-17]="",,"|n"&R1C18&RC[-17])&IF(RC[-16]="",,"|n"&R1C19&RC[-16])&IF(RC[-15]="",,"|n"&R1C20&RC[-15])&IF(RC[-14]="",,"|n"&R1C21&RC[-14])&IF(RC[-13]="",,"|n"&R1C22&RC[-13])&IF(RC[-11]="",,"|n"&R1C24&RC[-11])&IF(RC[-10]="",,"|n"&R1C25&RC[-10])&IF(RC[-9]="",,"|n"&R1C26&RC[-9])&IF(RC[-8]="",,"|n"&R1C27&RC[-8])&IF(RC[-7]="",,"|n"&R1C28&RC[-7])&IF(RC[-6]="",,"|n"&R1C29&RC[-6])&IF(RC[-2]="",,"|n"&RC[-2]) -> 
AI813: =IF(RC[-27]&RC[-26]&RC[-25]&RC[-24]&RC[-23]&RC[-22]="",,R1C7)&IF(RC[-27]="",,"|n"&R1C8&RC[-27])&IF(RC[-26]="",,"|n"&R1C9&RC[-26])&IF(RC[-25]="",,"|n"&R1C10&RC[-25])&IF(RC[-24]="",,"|n"&R1C11&RC[-24])&IF(RC[-23]="",,"|n"&R1C12&RC[-23])&IF(RC[-22]="",,"|n"&R1C13&RC[-22])&IF(RC[-20]&RC[-19]&RC[-18]&RC[-17]="",,"|n"&R1C14)&IF(RC[-20]="",,"|n"&R1C15&RC[-20])&IF(RC[-19]="",,"|n"&R1C16&RC[-19])&IF(RC[-18]="",,"|n"&R1C17&RC[-18])&IF(RC[-17]="",,"|n"&R1C18&RC[-17])&IF(RC[-16]="",,"|n"&R1C19&RC[-16])&IF(RC[-15]="",,"|n"&R1C20&RC[-15])&IF(RC[-14]="",,"|n"&R1C21&RC[-14])&IF(RC[-13]="",,"|n"&R1C22&RC[-13])&IF(RC[-11]="",,"|n"&R1C24&RC[-11])&IF(RC[-10]="",,"|n"&R1C25&RC[-10])&IF(RC[-9]="",,"|n"&R1C26&RC[-9])&IF(RC[-8]="",,"|n"&R1C27&RC[-8])&IF(RC[-7]="",,"|n"&R1C28&RC[-7])&IF(RC[-6]="",,"|n"&R1C29&RC[-6])&IF(RC[-2]="",,"|n"&RC[-2]) -> 
AI814: =IF(RC[-27]&RC[-26]&RC[-25]&RC[-24]&RC[-23]&RC[-22]="",,R1C7)&IF(RC[-27]="",,"|n"&R1C8&RC[-27])&IF(RC[-26]="",,"|n"&R1C9&RC[-26])&IF(RC[-25]="",,"|n"&R1C10&RC[-25])&IF(RC[-24]="",,"|n"&R1C11&RC[-24])&IF(RC[-23]="",,"|n"&R1C12&RC[-23])&IF(RC[-22]="",,"|n"&R1C13&RC[-22])&IF(RC[-20]&RC[-19]&RC[-18]&RC[-17]="",,"|n"&R1C14)&IF(RC[-20]="",,"|n"&R1C15&RC[-20])&IF(RC[-19]="",,"|n"&R1C16&RC[-19])&IF(RC[-18]="",,"|n"&R1C17&RC[-18])&IF(RC[-17]="",,"|n"&R1C18&RC[-17])&IF(RC[-16]="",,"|n"&R1C19&RC[-16])&IF(RC[-15]="",,"|n"&R1C20&RC[-15])&IF(RC[-14]="",,"|n"&R1C21&RC[-14])&IF(RC[-13]="",,"|n"&R1C22&RC[-13])&IF(RC[-11]="",,"|n"&R1C24&RC[-11])&IF(RC[-10]="",,"|n"&R1C25&RC[-10])&IF(RC[-9]="",,"|n"&R1C26&RC[-9])&IF(RC[-8]="",,"|n"&R1C27&RC[-8])&IF(RC[-7]="",,"|n"&R1C28&RC[-7])&IF(RC[-6]="",,"|n"&R1C29&RC[-6])&IF(RC[-2]="",,"|n"&RC[-2]) -> 
AI815: =IF(RC[-27]&RC[-26]&RC[-25]&RC[-24]&RC[-23]&RC[-22]="",,R1C7)&IF(RC[-27]="",,"|n"&R1C8&RC[-27])&IF(RC[-26]="",,"|n"&R1C9&RC[-26])&IF(RC[-25]="",,"|n"&R1C10&RC[-25])&IF(RC[-24]="",,"|n"&R1C11&RC[-24])&IF(RC[-23]="",,"|n"&R1C12&RC[-23])&IF(RC[-22]="",,"|n"&R1C13&RC[-22])&IF(RC[-20]&RC[-19]&RC[-18]&RC[-17]="",,"|n"&R1C14)&IF(RC[-20]="",,"|n"&R1C15&RC[-20])&IF(RC[-19]="",,"|n"&R1C16&RC[-19])&IF(RC[-18]="",,"|n"&R1C17&RC[-18])&IF(RC[-17]="",,"|n"&R1C18&RC[-17])&IF(RC[-16]="",,"|n"&R1C19&RC[-16])&IF(RC[-15]="",,"|n"&R1C20&RC[-15])&IF(RC[-14]="",,"|n"&R1C21&RC[-14])&IF(RC[-13]="",,"|n"&R1C22&RC[-13])&IF(RC[-11]="",,"|n"&R1C24&RC[-11])&IF(RC[-10]="",,"|n"&R1C25&RC[-10])&IF(RC[-9]="",,"|n"&R1C26&RC[-9])&IF(RC[-8]="",,"|n"&R1C27&RC[-8])&IF(RC[-7]="",,"|n"&R1C28&RC[-7])&IF(RC[-6]="",,"|n"&R1C29&RC[-6])&IF(RC[-2]="",,"|n"&RC[-2]) -> 
AI816: =IF(RC[-27]&RC[-26]&RC[-25]&RC[-24]&RC[-23]&RC[-22]="",,R1C7)&IF(RC[-27]="",,"|n"&R1C8&RC[-27])&IF(RC[-26]="",,"|n"&R1C9&RC[-26])&IF(RC[-25]="",,"|n"&R1C10&RC[-25])&IF(RC[-24]="",,"|n"&R1C11&RC[-24])&IF(RC[-23]="",,"|n"&R1C12&RC[-23])&IF(RC[-22]="",,"|n"&R1C13&RC[-22])&IF(RC[-20]&RC[-19]&RC[-18]&RC[-17]="",,"|n"&R1C14)&IF(RC[-20]="",,"|n"&R1C15&RC[-20])&IF(RC[-19]="",,"|n"&R1C16&RC[-19])&IF(RC[-18]="",,"|n"&R1C17&RC[-18])&IF(RC[-17]="",,"|n"&R1C18&RC[-17])&IF(RC[-16]="",,"|n"&R1C19&RC[-16])&IF(RC[-15]="",,"|n"&R1C20&RC[-15])&IF(RC[-14]="",,"|n"&R1C21&RC[-14])&IF(RC[-13]="",,"|n"&R1C22&RC[-13])&IF(RC[-11]="",,"|n"&R1C24&RC[-11])&IF(RC[-10]="",,"|n"&R1C25&RC[-10])&IF(RC[-9]="",,"|n"&R1C26&RC[-9])&IF(RC[-8]="",,"|n"&R1C27&RC[-8])&IF(RC[-7]="",,"|n"&R1C28&RC[-7])&IF(RC[-6]="",,"|n"&R1C29&RC[-6])&IF(RC[-2]="",,"|n"&RC[-2]) -> 
AI817: =IF(RC[-27]&RC[-26]&RC[-25]&RC[-24]&RC[-23]&RC[-22]="",,R1C7)&IF(RC[-27]="",,"|n"&R1C8&RC[-27])&IF(RC[-26]="",,"|n"&R1C9&RC[-26])&IF(RC[-25]="",,"|n"&R1C10&RC[-25])&IF(RC[-24]="",,"|n"&R1C11&RC[-24])&IF(RC[-23]="",,"|n"&R1C12&RC[-23])&IF(RC[-22]="",,"|n"&R1C13&RC[-22])&IF(RC[-20]&RC[-19]&RC[-18]&RC[-17]="",,"|n"&R1C14)&IF(RC[-20]="",,"|n"&R1C15&RC[-20])&IF(RC[-19]="",,"|n"&R1C16&RC[-19])&IF(RC[-18]="",,"|n"&R1C17&RC[-18])&IF(RC[-17]="",,"|n"&R1C18&RC[-17])&IF(RC[-16]="",,"|n"&R1C19&RC[-16])&IF(RC[-15]="",,"|n"&R1C20&RC[-15])&IF(RC[-14]="",,"|n"&R1C21&RC[-14])&IF(RC[-13]="",,"|n"&R1C22&RC[-13])&IF(RC[-11]="",,"|n"&R1C24&RC[-11])&IF(RC[-10]="",,"|n"&R1C25&RC[-10])&IF(RC[-9]="",,"|n"&R1C26&RC[-9])&IF(RC[-8]="",,"|n"&R1C27&RC[-8])&IF(RC[-7]="",,"|n"&R1C28&RC[-7])&IF(RC[-6]="",,"|n"&R1C29&RC[-6])&IF(RC[-2]="",,"|n"&RC[-2]) -> 
AI818: =IF(RC[-27]&RC[-26]&RC[-25]&RC[-24]&RC[-23]&RC[-22]="",,R1C7)&IF(RC[-27]="",,"|n"&R1C8&RC[-27])&IF(RC[-26]="",,"|n"&R1C9&RC[-26])&IF(RC[-25]="",,"|n"&R1C10&RC[-25])&IF(RC[-24]="",,"|n"&R1C11&RC[-24])&IF(RC[-23]="",,"|n"&R1C12&RC[-23])&IF(RC[-22]="",,"|n"&R1C13&RC[-22])&IF(RC[-20]&RC[-19]&RC[-18]&RC[-17]="",,"|n"&R1C14)&IF(RC[-20]="",,"|n"&R1C15&RC[-20])&IF(RC[-19]="",,"|n"&R1C16&RC[-19])&IF(RC[-18]="",,"|n"&R1C17&RC[-18])&IF(RC[-17]="",,"|n"&R1C18&RC[-17])&IF(RC[-16]="",,"|n"&R1C19&RC[-16])&IF(RC[-15]="",,"|n"&R1C20&RC[-15])&IF(RC[-14]="",,"|n"&R1C21&RC[-14])&IF(RC[-13]="",,"|n"&R1C22&RC[-13])&IF(RC[-11]="",,"|n"&R1C24&RC[-11])&IF(RC[-10]="",,"|n"&R1C25&RC[-10])&IF(RC[-9]="",,"|n"&R1C26&RC[-9])&IF(RC[-8]="",,"|n"&R1C27&RC[-8])&IF(RC[-7]="",,"|n"&R1C28&RC[-7])&IF(RC[-6]="",,"|n"&R1C29&RC[-6])&IF(RC[-2]="",,"|n"&RC[-2]) -> 
AI819: =IF(RC[-27]&RC[-26]&RC[-25]&RC[-24]&RC[-23]&RC[-22]="",,R1C7)&IF(RC[-27]="",,"|n"&R1C8&RC[-27])&IF(RC[-26]="",,"|n"&R1C9&RC[-26])&IF(RC[-25]="",,"|n"&R1C10&RC[-25])&IF(RC[-24]="",,"|n"&R1C11&RC[-24])&IF(RC[-23]="",,"|n"&R1C12&RC[-23])&IF(RC[-22]="",,"|n"&R1C13&RC[-22])&IF(RC[-20]&RC[-19]&RC[-18]&RC[-17]="",,"|n"&R1C14)&IF(RC[-20]="",,"|n"&R1C15&RC[-20])&IF(RC[-19]="",,"|n"&R1C16&RC[-19])&IF(RC[-18]="",,"|n"&R1C17&RC[-18])&IF(RC[-17]="",,"|n"&R1C18&RC[-17])&IF(RC[-16]="",,"|n"&R1C19&RC[-16])&IF(RC[-15]="",,"|n"&R1C20&RC[-15])&IF(RC[-14]="",,"|n"&R1C21&RC[-14])&IF(RC[-13]="",,"|n"&R1C22&RC[-13])&IF(RC[-11]="",,"|n"&R1C24&RC[-11])&IF(RC[-10]="",,"|n"&R1C25&RC[-10])&IF(RC[-9]="",,"|n"&R1C26&RC[-9])&IF(RC[-8]="",,"|n"&R1C27&RC[-8])&IF(RC[-7]="",,"|n"&R1C28&RC[-7])&IF(RC[-6]="",,"|n"&R1C29&RC[-6])&IF(RC[-2]="",,"|n"&RC[-2]) -> 
AI820: =IF(RC[-27]&RC[-26]&RC[-25]&RC[-24]&RC[-23]&RC[-22]="",,R1C7)&IF(RC[-27]="",,"|n"&R1C8&RC[-27])&IF(RC[-26]="",,"|n"&R1C9&RC[-26])&IF(RC[-25]="",,"|n"&R1C10&RC[-25])&IF(RC[-24]="",,"|n"&R1C11&RC[-24])&IF(RC[-23]="",,"|n"&R1C12&RC[-23])&IF(RC[-22]="",,"|n"&R1C13&RC[-22])&IF(RC[-20]&RC[-19]&RC[-18]&RC[-17]="",,"|n"&R1C14)&IF(RC[-20]="",,"|n"&R1C15&RC[-20])&IF(RC[-19]="",,"|n"&R1C16&RC[-19])&IF(RC[-18]="",,"|n"&R1C17&RC[-18])&IF(RC[-17]="",,"|n"&R1C18&RC[-17])&IF(RC[-16]="",,"|n"&R1C19&RC[-16])&IF(RC[-15]="",,"|n"&R1C20&RC[-15])&IF(RC[-14]="",,"|n"&R1C21&RC[-14])&IF(RC[-13]="",,"|n"&R1C22&RC[-13])&IF(RC[-11]="",,"|n"&R1C24&RC[-11])&IF(RC[-10]="",,"|n"&R1C25&RC[-10])&IF(RC[-9]="",,"|n"&R1C26&RC[-9])&IF(RC[-8]="",,"|n"&R1C27&RC[-8])&IF(RC[-7]="",,"|n"&R1C28&RC[-7])&IF(RC[-6]="",,"|n"&R1C29&RC[-6])&IF(RC[-2]="",,"|n"&RC[-2]) -> 
AI821: =IF(RC[-27]&RC[-26]&RC[-25]&RC[-24]&RC[-23]&RC[-22]="",,R1C7)&IF(RC[-27]="",,"|n"&R1C8&RC[-27])&IF(RC[-26]="",,"|n"&R1C9&RC[-26])&IF(RC[-25]="",,"|n"&R1C10&RC[-25])&IF(RC[-24]="",,"|n"&R1C11&RC[-24])&IF(RC[-23]="",,"|n"&R1C12&RC[-23])&IF(RC[-22]="",,"|n"&R1C13&RC[-22])&IF(RC[-20]&RC[-19]&RC[-18]&RC[-17]="",,"|n"&R1C14)&IF(RC[-20]="",,"|n"&R1C15&RC[-20])&IF(RC[-19]="",,"|n"&R1C16&RC[-19])&IF(RC[-18]="",,"|n"&R1C17&RC[-18])&IF(RC[-17]="",,"|n"&R1C18&RC[-17])&IF(RC[-16]="",,"|n"&R1C19&RC[-16])&IF(RC[-15]="",,"|n"&R1C20&RC[-15])&IF(RC[-14]="",,"|n"&R1C21&RC[-14])&IF(RC[-13]="",,"|n"&R1C22&RC[-13])&IF(RC[-11]="",,"|n"&R1C24&RC[-11])&IF(RC[-10]="",,"|n"&R1C25&RC[-10])&IF(RC[-9]="",,"|n"&R1C26&RC[-9])&IF(RC[-8]="",,"|n"&R1C27&RC[-8])&IF(RC[-7]="",,"|n"&R1C28&RC[-7])&IF(RC[-6]="",,"|n"&R1C29&RC[-6])&IF(RC[-2]="",,"|n"&RC[-2]) -> 
AI822: =IF(RC[-27]&RC[-26]&RC[-25]&RC[-24]&RC[-23]&RC[-22]="",,R1C7)&IF(RC[-27]="",,"|n"&R1C8&RC[-27])&IF(RC[-26]="",,"|n"&R1C9&RC[-26])&IF(RC[-25]="",,"|n"&R1C10&RC[-25])&IF(RC[-24]="",,"|n"&R1C11&RC[-24])&IF(RC[-23]="",,"|n"&R1C12&RC[-23])&IF(RC[-22]="",,"|n"&R1C13&RC[-22])&IF(RC[-20]&RC[-19]&RC[-18]&RC[-17]="",,"|n"&R1C14)&IF(RC[-20]="",,"|n"&R1C15&RC[-20])&IF(RC[-19]="",,"|n"&R1C16&RC[-19])&IF(RC[-18]="",,"|n"&R1C17&RC[-18])&IF(RC[-17]="",,"|n"&R1C18&RC[-17])&IF(RC[-16]="",,"|n"&R1C19&RC[-16])&IF(RC[-15]="",,"|n"&R1C20&RC[-15])&IF(RC[-14]="",,"|n"&R1C21&RC[-14])&IF(RC[-13]="",,"|n"&R1C22&RC[-13])&IF(RC[-11]="",,"|n"&R1C24&RC[-11])&IF(RC[-10]="",,"|n"&R1C25&RC[-10])&IF(RC[-9]="",,"|n"&R1C26&RC[-9])&IF(RC[-8]="",,"|n"&R1C27&RC[-8])&IF(RC[-7]="",,"|n"&R1C28&RC[-7])&IF(RC[-6]="",,"|n"&R1C29&RC[-6])&IF(RC[-2]="",,"|n"&RC[-2]) -> 
AI823: =IF(RC[-27]&RC[-26]&RC[-25]&RC[-24]&RC[-23]&RC[-22]="",,R1C7)&IF(RC[-27]="",,"|n"&R1C8&RC[-27])&IF(RC[-26]="",,"|n"&R1C9&RC[-26])&IF(RC[-25]="",,"|n"&R1C10&RC[-25])&IF(RC[-24]="",,"|n"&R1C11&RC[-24])&IF(RC[-23]="",,"|n"&R1C12&RC[-23])&IF(RC[-22]="",,"|n"&R1C13&RC[-22])&IF(RC[-20]&RC[-19]&RC[-18]&RC[-17]="",,"|n"&R1C14)&IF(RC[-20]="",,"|n"&R1C15&RC[-20])&IF(RC[-19]="",,"|n"&R1C16&RC[-19])&IF(RC[-18]="",,"|n"&R1C17&RC[-18])&IF(RC[-17]="",,"|n"&R1C18&RC[-17])&IF(RC[-16]="",,"|n"&R1C19&RC[-16])&IF(RC[-15]="",,"|n"&R1C20&RC[-15])&IF(RC[-14]="",,"|n"&R1C21&RC[-14])&IF(RC[-13]="",,"|n"&R1C22&RC[-13])&IF(RC[-11]="",,"|n"&R1C24&RC[-11])&IF(RC[-10]="",,"|n"&R1C25&RC[-10])&IF(RC[-9]="",,"|n"&R1C26&RC[-9])&IF(RC[-8]="",,"|n"&R1C27&RC[-8])&IF(RC[-7]="",,"|n"&R1C28&RC[-7])&IF(RC[-6]="",,"|n"&R1C29&RC[-6])&IF(RC[-2]="",,"|n"&RC[-2]) -> 
AI824: =IF(RC[-27]&RC[-26]&RC[-25]&RC[-24]&RC[-23]&RC[-22]="",,R1C7)&IF(RC[-27]="",,"|n"&R1C8&RC[-27])&IF(RC[-26]="",,"|n"&R1C9&RC[-26])&IF(RC[-25]="",,"|n"&R1C10&RC[-25])&IF(RC[-24]="",,"|n"&R1C11&RC[-24])&IF(RC[-23]="",,"|n"&R1C12&RC[-23])&IF(RC[-22]="",,"|n"&R1C13&RC[-22])&IF(RC[-20]&RC[-19]&RC[-18]&RC[-17]="",,"|n"&R1C14)&IF(RC[-20]="",,"|n"&R1C15&RC[-20])&IF(RC[-19]="",,"|n"&R1C16&RC[-19])&IF(RC[-18]="",,"|n"&R1C17&RC[-18])&IF(RC[-17]="",,"|n"&R1C18&RC[-17])&IF(RC[-16]="",,"|n"&R1C19&RC[-16])&IF(RC[-15]="",,"|n"&R1C20&RC[-15])&IF(RC[-14]="",,"|n"&R1C21&RC[-14])&IF(RC[-13]="",,"|n"&R1C22&RC[-13])&IF(RC[-11]="",,"|n"&R1C24&RC[-11])&IF(RC[-10]="",,"|n"&R1C25&RC[-10])&IF(RC[-9]="",,"|n"&R1C26&RC[-9])&IF(RC[-8]="",,"|n"&R1C27&RC[-8])&IF(RC[-7]="",,"|n"&R1C28&RC[-7])&IF(RC[-6]="",,"|n"&R1C29&RC[-6])&IF(RC[-2]="",,"|n"&RC[-2]) -> 
AI825: =IF(RC[-27]&RC[-26]&RC[-25]&RC[-24]&RC[-23]&RC[-22]="",,R1C7)&IF(RC[-27]="",,"|n"&R1C8&RC[-27])&IF(RC[-26]="",,"|n"&R1C9&RC[-26])&IF(RC[-25]="",,"|n"&R1C10&RC[-25])&IF(RC[-24]="",,"|n"&R1C11&RC[-24])&IF(RC[-23]="",,"|n"&R1C12&RC[-23])&IF(RC[-22]="",,"|n"&R1C13&RC[-22])&IF(RC[-20]&RC[-19]&RC[-18]&RC[-17]="",,"|n"&R1C14)&IF(RC[-20]="",,"|n"&R1C15&RC[-20])&IF(RC[-19]="",,"|n"&R1C16&RC[-19])&IF(RC[-18]="",,"|n"&R1C17&RC[-18])&IF(RC[-17]="",,"|n"&R1C18&RC[-17])&IF(RC[-16]="",,"|n"&R1C19&RC[-16])&IF(RC[-15]="",,"|n"&R1C20&RC[-15])&IF(RC[-14]="",,"|n"&R1C21&RC[-14])&IF(RC[-13]="",,"|n"&R1C22&RC[-13])&IF(RC[-11]="",,"|n"&R1C24&RC[-11])&IF(RC[-10]="",,"|n"&R1C25&RC[-10])&IF(RC[-9]="",,"|n"&R1C26&RC[-9])&IF(RC[-8]="",,"|n"&R1C27&RC[-8])&IF(RC[-7]="",,"|n"&R1C28&RC[-7])&IF(RC[-6]="",,"|n"&R1C29&RC[-6])&IF(RC[-2]="",,"|n"&RC[-2]) -> 
AI826: =IF(RC[-27]&RC[-26]&RC[-25]&RC[-24]&RC[-23]&RC[-22]="",,R1C7)&IF(RC[-27]="",,"|n"&R1C8&RC[-27])&IF(RC[-26]="",,"|n"&R1C9&RC[-26])&IF(RC[-25]="",,"|n"&R1C10&RC[-25])&IF(RC[-24]="",,"|n"&R1C11&RC[-24])&IF(RC[-23]="",,"|n"&R1C12&RC[-23])&IF(RC[-22]="",,"|n"&R1C13&RC[-22])&IF(RC[-20]&RC[-19]&RC[-18]&RC[-17]="",,"|n"&R1C14)&IF(RC[-20]="",,"|n"&R1C15&RC[-20])&IF(RC[-19]="",,"|n"&R1C16&RC[-19])&IF(RC[-18]="",,"|n"&R1C17&RC[-18])&IF(RC[-17]="",,"|n"&R1C18&RC[-17])&IF(RC[-16]="",,"|n"&R1C19&RC[-16])&IF(RC[-15]="",,"|n"&R1C20&RC[-15])&IF(RC[-14]="",,"|n"&R1C21&RC[-14])&IF(RC[-13]="",,"|n"&R1C22&RC[-13])&IF(RC[-11]="",,"|n"&R1C24&RC[-11])&IF(RC[-10]="",,"|n"&R1C25&RC[-10])&IF(RC[-9]="",,"|n"&R1C26&RC[-9])&IF(RC[-8]="",,"|n"&R1C27&RC[-8])&IF(RC[-7]="",,"|n"&R1C28&RC[-7])&IF(RC[-6]="",,"|n"&R1C29&RC[-6])&IF(RC[-2]="",,"|n"&RC[-2]) -> 
AI827: =IF(RC[-27]&RC[-26]&RC[-25]&RC[-24]&RC[-23]&RC[-22]="",,R1C7)&IF(RC[-27]="",,"|n"&R1C8&RC[-27])&IF(RC[-26]="",,"|n"&R1C9&RC[-26])&IF(RC[-25]="",,"|n"&R1C10&RC[-25])&IF(RC[-24]="",,"|n"&R1C11&RC[-24])&IF(RC[-23]="",,"|n"&R1C12&RC[-23])&IF(RC[-22]="",,"|n"&R1C13&RC[-22])&IF(RC[-20]&RC[-19]&RC[-18]&RC[-17]="",,"|n"&R1C14)&IF(RC[-20]="",,"|n"&R1C15&RC[-20])&IF(RC[-19]="",,"|n"&R1C16&RC[-19])&IF(RC[-18]="",,"|n"&R1C17&RC[-18])&IF(RC[-17]="",,"|n"&R1C18&RC[-17])&IF(RC[-16]="",,"|n"&R1C19&RC[-16])&IF(RC[-15]="",,"|n"&R1C20&RC[-15])&IF(RC[-14]="",,"|n"&R1C21&RC[-14])&IF(RC[-13]="",,"|n"&R1C22&RC[-13])&IF(RC[-11]="",,"|n"&R1C24&RC[-11])&IF(RC[-10]="",,"|n"&R1C25&RC[-10])&IF(RC[-9]="",,"|n"&R1C26&RC[-9])&IF(RC[-8]="",,"|n"&R1C27&RC[-8])&IF(RC[-7]="",,"|n"&R1C28&RC[-7])&IF(RC[-6]="",,"|n"&R1C29&RC[-6])&IF(RC[-2]="",,"|n"&RC[-2]) -> 
AI828: =IF(RC[-27]&RC[-26]&RC[-25]&RC[-24]&RC[-23]&RC[-22]="",,R1C7)&IF(RC[-27]="",,"|n"&R1C8&RC[-27])&IF(RC[-26]="",,"|n"&R1C9&RC[-26])&IF(RC[-25]="",,"|n"&R1C10&RC[-25])&IF(RC[-24]="",,"|n"&R1C11&RC[-24])&IF(RC[-23]="",,"|n"&R1C12&RC[-23])&IF(RC[-22]="",,"|n"&R1C13&RC[-22])&IF(RC[-20]&RC[-19]&RC[-18]&RC[-17]="",,"|n"&R1C14)&IF(RC[-20]="",,"|n"&R1C15&RC[-20])&IF(RC[-19]="",,"|n"&R1C16&RC[-19])&IF(RC[-18]="",,"|n"&R1C17&RC[-18])&IF(RC[-17]="",,"|n"&R1C18&RC[-17])&IF(RC[-16]="",,"|n"&R1C19&RC[-16])&IF(RC[-15]="",,"|n"&R1C20&RC[-15])&IF(RC[-14]="",,"|n"&R1C21&RC[-14])&IF(RC[-13]="",,"|n"&R1C22&RC[-13])&IF(RC[-11]="",,"|n"&R1C24&RC[-11])&IF(RC[-10]="",,"|n"&R1C25&RC[-10])&IF(RC[-9]="",,"|n"&R1C26&RC[-9])&IF(RC[-8]="",,"|n"&R1C27&RC[-8])&IF(RC[-7]="",,"|n"&R1C28&RC[-7])&IF(RC[-6]="",,"|n"&R1C29&RC[-6])&IF(RC[-2]="",,"|n"&RC[-2]) -> 
AI829: =IF(RC[-27]&RC[-26]&RC[-25]&RC[-24]&RC[-23]&RC[-22]="",,R1C7)&IF(RC[-27]="",,"|n"&R1C8&RC[-27])&IF(RC[-26]="",,"|n"&R1C9&RC[-26])&IF(RC[-25]="",,"|n"&R1C10&RC[-25])&IF(RC[-24]="",,"|n"&R1C11&RC[-24])&IF(RC[-23]="",,"|n"&R1C12&RC[-23])&IF(RC[-22]="",,"|n"&R1C13&RC[-22])&IF(RC[-20]&RC[-19]&RC[-18]&RC[-17]="",,"|n"&R1C14)&IF(RC[-20]="",,"|n"&R1C15&RC[-20])&IF(RC[-19]="",,"|n"&R1C16&RC[-19])&IF(RC[-18]="",,"|n"&R1C17&RC[-18])&IF(RC[-17]="",,"|n"&R1C18&RC[-17])&IF(RC[-16]="",,"|n"&R1C19&RC[-16])&IF(RC[-15]="",,"|n"&R1C20&RC[-15])&IF(RC[-14]="",,"|n"&R1C21&RC[-14])&IF(RC[-13]="",,"|n"&R1C22&RC[-13])&IF(RC[-11]="",,"|n"&R1C24&RC[-11])&IF(RC[-10]="",,"|n"&R1C25&RC[-10])&IF(RC[-9]="",,"|n"&R1C26&RC[-9])&IF(RC[-8]="",,"|n"&R1C27&RC[-8])&IF(RC[-7]="",,"|n"&R1C28&RC[-7])&IF(RC[-6]="",,"|n"&R1C29&RC[-6])&IF(RC[-2]="",,"|n"&RC[-2]) -> 
AI830: =IF(RC[-27]&RC[-26]&RC[-25]&RC[-24]&RC[-23]&RC[-22]="",,R1C7)&IF(RC[-27]="",,"|n"&R1C8&RC[-27])&IF(RC[-26]="",,"|n"&R1C9&RC[-26])&IF(RC[-25]="",,"|n"&R1C10&RC[-25])&IF(RC[-24]="",,"|n"&R1C11&RC[-24])&IF(RC[-23]="",,"|n"&R1C12&RC[-23])&IF(RC[-22]="",,"|n"&R1C13&RC[-22])&IF(RC[-20]&RC[-19]&RC[-18]&RC[-17]="",,"|n"&R1C14)&IF(RC[-20]="",,"|n"&R1C15&RC[-20])&IF(RC[-19]="",,"|n"&R1C16&RC[-19])&IF(RC[-18]="",,"|n"&R1C17&RC[-18])&IF(RC[-17]="",,"|n"&R1C18&RC[-17])&IF(RC[-16]="",,"|n"&R1C19&RC[-16])&IF(RC[-15]="",,"|n"&R1C20&RC[-15])&IF(RC[-14]="",,"|n"&R1C21&RC[-14])&IF(RC[-13]="",,"|n"&R1C22&RC[-13])&IF(RC[-11]="",,"|n"&R1C24&RC[-11])&IF(RC[-10]="",,"|n"&R1C25&RC[-10])&IF(RC[-9]="",,"|n"&R1C26&RC[-9])&IF(RC[-8]="",,"|n"&R1C27&RC[-8])&IF(RC[-7]="",,"|n"&R1C28&RC[-7])&IF(RC[-6]="",,"|n"&R1C29&RC[-6])&IF(RC[-2]="",,"|n"&RC[-2]) -> 
AI831: =IF(RC[-27]&RC[-26]&RC[-25]&RC[-24]&RC[-23]&RC[-22]="",,R1C7)&IF(RC[-27]="",,"|n"&R1C8&RC[-27])&IF(RC[-26]="",,"|n"&R1C9&RC[-26])&IF(RC[-25]="",,"|n"&R1C10&RC[-25])&IF(RC[-24]="",,"|n"&R1C11&RC[-24])&IF(RC[-23]="",,"|n"&R1C12&RC[-23])&IF(RC[-22]="",,"|n"&R1C13&RC[-22])&IF(RC[-20]&RC[-19]&RC[-18]&RC[-17]="",,"|n"&R1C14)&IF(RC[-20]="",,"|n"&R1C15&RC[-20])&IF(RC[-19]="",,"|n"&R1C16&RC[-19])&IF(RC[-18]="",,"|n"&R1C17&RC[-18])&IF(RC[-17]="",,"|n"&R1C18&RC[-17])&IF(RC[-16]="",,"|n"&R1C19&RC[-16])&IF(RC[-15]="",,"|n"&R1C20&RC[-15])&IF(RC[-14]="",,"|n"&R1C21&RC[-14])&IF(RC[-13]="",,"|n"&R1C22&RC[-13])&IF(RC[-11]="",,"|n"&R1C24&RC[-11])&IF(RC[-10]="",,"|n"&R1C25&RC[-10])&IF(RC[-9]="",,"|n"&R1C26&RC[-9])&IF(RC[-8]="",,"|n"&R1C27&RC[-8])&IF(RC[-7]="",,"|n"&R1C28&RC[-7])&IF(RC[-6]="",,"|n"&R1C29&RC[-6])&IF(RC[-2]="",,"|n"&RC[-2]) -> 
AI832: =IF(RC[-27]&RC[-26]&RC[-25]&RC[-24]&RC[-23]&RC[-22]="",,R1C7)&IF(RC[-27]="",,"|n"&R1C8&RC[-27])&IF(RC[-26]="",,"|n"&R1C9&RC[-26])&IF(RC[-25]="",,"|n"&R1C10&RC[-25])&IF(RC[-24]="",,"|n"&R1C11&RC[-24])&IF(RC[-23]="",,"|n"&R1C12&RC[-23])&IF(RC[-22]="",,"|n"&R1C13&RC[-22])&IF(RC[-20]&RC[-19]&RC[-18]&RC[-17]="",,"|n"&R1C14)&IF(RC[-20]="",,"|n"&R1C15&RC[-20])&IF(RC[-19]="",,"|n"&R1C16&RC[-19])&IF(RC[-18]="",,"|n"&R1C17&RC[-18])&IF(RC[-17]="",,"|n"&R1C18&RC[-17])&IF(RC[-16]="",,"|n"&R1C19&RC[-16])&IF(RC[-15]="",,"|n"&R1C20&RC[-15])&IF(RC[-14]="",,"|n"&R1C21&RC[-14])&IF(RC[-13]="",,"|n"&R1C22&RC[-13])&IF(RC[-11]="",,"|n"&R1C24&RC[-11])&IF(RC[-10]="",,"|n"&R1C25&RC[-10])&IF(RC[-9]="",,"|n"&R1C26&RC[-9])&IF(RC[-8]="",,"|n"&R1C27&RC[-8])&IF(RC[-7]="",,"|n"&R1C28&RC[-7])&IF(RC[-6]="",,"|n"&R1C29&RC[-6])&IF(RC[-2]="",,"|n"&RC[-2]) -> 
AI833: =IF(RC[-27]&RC[-26]&RC[-25]&RC[-24]&RC[-23]&RC[-22]="",,R1C7)&IF(RC[-27]="",,"|n"&R1C8&RC[-27])&IF(RC[-26]="",,"|n"&R1C9&RC[-26])&IF(RC[-25]="",,"|n"&R1C10&RC[-25])&IF(RC[-24]="",,"|n"&R1C11&RC[-24])&IF(RC[-23]="",,"|n"&R1C12&RC[-23])&IF(RC[-22]="",,"|n"&R1C13&RC[-22])&IF(RC[-20]&RC[-19]&RC[-18]&RC[-17]="",,"|n"&R1C14)&IF(RC[-20]="",,"|n"&R1C15&RC[-20])&IF(RC[-19]="",,"|n"&R1C16&RC[-19])&IF(RC[-18]="",,"|n"&R1C17&RC[-18])&IF(RC[-17]="",,"|n"&R1C18&RC[-17])&IF(RC[-16]="",,"|n"&R1C19&RC[-16])&IF(RC[-15]="",,"|n"&R1C20&RC[-15])&IF(RC[-14]="",,"|n"&R1C21&RC[-14])&IF(RC[-13]="",,"|n"&R1C22&RC[-13])&IF(RC[-11]="",,"|n"&R1C24&RC[-11])&IF(RC[-10]="",,"|n"&R1C25&RC[-10])&IF(RC[-9]="",,"|n"&R1C26&RC[-9])&IF(RC[-8]="",,"|n"&R1C27&RC[-8])&IF(RC[-7]="",,"|n"&R1C28&RC[-7])&IF(RC[-6]="",,"|n"&R1C29&RC[-6])&IF(RC[-2]="",,"|n"&RC[-2]) -> 
AI834: =IF(RC[-27]&RC[-26]&RC[-25]&RC[-24]&RC[-23]&RC[-22]="",,R1C7)&IF(RC[-27]="",,"|n"&R1C8&RC[-27])&IF(RC[-26]="",,"|n"&R1C9&RC[-26])&IF(RC[-25]="",,"|n"&R1C10&RC[-25])&IF(RC[-24]="",,"|n"&R1C11&RC[-24])&IF(RC[-23]="",,"|n"&R1C12&RC[-23])&IF(RC[-22]="",,"|n"&R1C13&RC[-22])&IF(RC[-20]&RC[-19]&RC[-18]&RC[-17]="",,"|n"&R1C14)&IF(RC[-20]="",,"|n"&R1C15&RC[-20])&IF(RC[-19]="",,"|n"&R1C16&RC[-19])&IF(RC[-18]="",,"|n"&R1C17&RC[-18])&IF(RC[-17]="",,"|n"&R1C18&RC[-17])&IF(RC[-16]="",,"|n"&R1C19&RC[-16])&IF(RC[-15]="",,"|n"&R1C20&RC[-15])&IF(RC[-14]="",,"|n"&R1C21&RC[-14])&IF(RC[-13]="",,"|n"&R1C22&RC[-13])&IF(RC[-11]="",,"|n"&R1C24&RC[-11])&IF(RC[-10]="",,"|n"&R1C25&RC[-10])&IF(RC[-9]="",,"|n"&R1C26&RC[-9])&IF(RC[-8]="",,"|n"&R1C27&RC[-8])&IF(RC[-7]="",,"|n"&R1C28&RC[-7])&IF(RC[-6]="",,"|n"&R1C29&RC[-6])&IF(RC[-2]="",,"|n"&RC[-2]) -> 
AI835: =IF(RC[-27]&RC[-26]&RC[-25]&RC[-24]&RC[-23]&RC[-22]="",,R1C7)&IF(RC[-27]="",,"|n"&R1C8&RC[-27])&IF(RC[-26]="",,"|n"&R1C9&RC[-26])&IF(RC[-25]="",,"|n"&R1C10&RC[-25])&IF(RC[-24]="",,"|n"&R1C11&RC[-24])&IF(RC[-23]="",,"|n"&R1C12&RC[-23])&IF(RC[-22]="",,"|n"&R1C13&RC[-22])&IF(RC[-20]&RC[-19]&RC[-18]&RC[-17]="",,"|n"&R1C14)&IF(RC[-20]="",,"|n"&R1C15&RC[-20])&IF(RC[-19]="",,"|n"&R1C16&RC[-19])&IF(RC[-18]="",,"|n"&R1C17&RC[-18])&IF(RC[-17]="",,"|n"&R1C18&RC[-17])&IF(RC[-16]="",,"|n"&R1C19&RC[-16])&IF(RC[-15]="",,"|n"&R1C20&RC[-15])&IF(RC[-14]="",,"|n"&R1C21&RC[-14])&IF(RC[-13]="",,"|n"&R1C22&RC[-13])&IF(RC[-11]="",,"|n"&R1C24&RC[-11])&IF(RC[-10]="",,"|n"&R1C25&RC[-10])&IF(RC[-9]="",,"|n"&R1C26&RC[-9])&IF(RC[-8]="",,"|n"&R1C27&RC[-8])&IF(RC[-7]="",,"|n"&R1C28&RC[-7])&IF(RC[-6]="",,"|n"&R1C29&RC[-6])&IF(RC[-2]="",,"|n"&RC[-2]) -> 
AI836: =IF(RC[-27]&RC[-26]&RC[-25]&RC[-24]&RC[-23]&RC[-22]="",,R1C7)&IF(RC[-27]="",,"|n"&R1C8&RC[-27])&IF(RC[-26]="",,"|n"&R1C9&RC[-26])&IF(RC[-25]="",,"|n"&R1C10&RC[-25])&IF(RC[-24]="",,"|n"&R1C11&RC[-24])&IF(RC[-23]="",,"|n"&R1C12&RC[-23])&IF(RC[-22]="",,"|n"&R1C13&RC[-22])&IF(RC[-20]&RC[-19]&RC[-18]&RC[-17]="",,"|n"&R1C14)&IF(RC[-20]="",,"|n"&R1C15&RC[-20])&IF(RC[-19]="",,"|n"&R1C16&RC[-19])&IF(RC[-18]="",,"|n"&R1C17&RC[-18])&IF(RC[-17]="",,"|n"&R1C18&RC[-17])&IF(RC[-16]="",,"|n"&R1C19&RC[-16])&IF(RC[-15]="",,"|n"&R1C20&RC[-15])&IF(RC[-14]="",,"|n"&R1C21&RC[-14])&IF(RC[-13]="",,"|n"&R1C22&RC[-13])&IF(RC[-11]="",,"|n"&R1C24&RC[-11])&IF(RC[-10]="",,"|n"&R1C25&RC[-10])&IF(RC[-9]="",,"|n"&R1C26&RC[-9])&IF(RC[-8]="",,"|n"&R1C27&RC[-8])&IF(RC[-7]="",,"|n"&R1C28&RC[-7])&IF(RC[-6]="",,"|n"&R1C29&RC[-6])&IF(RC[-2]="",,"|n"&RC[-2]) -> 
AI837: =IF(RC[-27]&RC[-26]&RC[-25]&RC[-24]&RC[-23]&RC[-22]="",,R1C7)&IF(RC[-27]="",,"|n"&R1C8&RC[-27])&IF(RC[-26]="",,"|n"&R1C9&RC[-26])&IF(RC[-25]="",,"|n"&R1C10&RC[-25])&IF(RC[-24]="",,"|n"&R1C11&RC[-24])&IF(RC[-23]="",,"|n"&R1C12&RC[-23])&IF(RC[-22]="",,"|n"&R1C13&RC[-22])&IF(RC[-20]&RC[-19]&RC[-18]&RC[-17]="",,"|n"&R1C14)&IF(RC[-20]="",,"|n"&R1C15&RC[-20])&IF(RC[-19]="",,"|n"&R1C16&RC[-19])&IF(RC[-18]="",,"|n"&R1C17&RC[-18])&IF(RC[-17]="",,"|n"&R1C18&RC[-17])&IF(RC[-16]="",,"|n"&R1C19&RC[-16])&IF(RC[-15]="",,"|n"&R1C20&RC[-15])&IF(RC[-14]="",,"|n"&R1C21&RC[-14])&IF(RC[-13]="",,"|n"&R1C22&RC[-13])&IF(RC[-11]="",,"|n"&R1C24&RC[-11])&IF(RC[-10]="",,"|n"&R1C25&RC[-10])&IF(RC[-9]="",,"|n"&R1C26&RC[-9])&IF(RC[-8]="",,"|n"&R1C27&RC[-8])&IF(RC[-7]="",,"|n"&R1C28&RC[-7])&IF(RC[-6]="",,"|n"&R1C29&RC[-6])&IF(RC[-2]="",,"|n"&RC[-2]) -> 
AI838: =IF(RC[-27]&RC[-26]&RC[-25]&RC[-24]&RC[-23]&RC[-22]="",,R1C7)&IF(RC[-27]="",,"|n"&R1C8&RC[-27])&IF(RC[-26]="",,"|n"&R1C9&RC[-26])&IF(RC[-25]="",,"|n"&R1C10&RC[-25])&IF(RC[-24]="",,"|n"&R1C11&RC[-24])&IF(RC[-23]="",,"|n"&R1C12&RC[-23])&IF(RC[-22]="",,"|n"&R1C13&RC[-22])&IF(RC[-20]&RC[-19]&RC[-18]&RC[-17]="",,"|n"&R1C14)&IF(RC[-20]="",,"|n"&R1C15&RC[-20])&IF(RC[-19]="",,"|n"&R1C16&RC[-19])&IF(RC[-18]="",,"|n"&R1C17&RC[-18])&IF(RC[-17]="",,"|n"&R1C18&RC[-17])&IF(RC[-16]="",,"|n"&R1C19&RC[-16])&IF(RC[-15]="",,"|n"&R1C20&RC[-15])&IF(RC[-14]="",,"|n"&R1C21&RC[-14])&IF(RC[-13]="",,"|n"&R1C22&RC[-13])&IF(RC[-11]="",,"|n"&R1C24&RC[-11])&IF(RC[-10]="",,"|n"&R1C25&RC[-10])&IF(RC[-9]="",,"|n"&R1C26&RC[-9])&IF(RC[-8]="",,"|n"&R1C27&RC[-8])&IF(RC[-7]="",,"|n"&R1C28&RC[-7])&IF(RC[-6]="",,"|n"&R1C29&RC[-6])&IF(RC[-2]="",,"|n"&RC[-2]) -> 
AI839: =IF(RC[-27]&RC[-26]&RC[-25]&RC[-24]&RC[-23]&RC[-22]="",,R1C7)&IF(RC[-27]="",,"|n"&R1C8&RC[-27])&IF(RC[-26]="",,"|n"&R1C9&RC[-26])&IF(RC[-25]="",,"|n"&R1C10&RC[-25])&IF(RC[-24]="",,"|n"&R1C11&RC[-24])&IF(RC[-23]="",,"|n"&R1C12&RC[-23])&IF(RC[-22]="",,"|n"&R1C13&RC[-22])&IF(RC[-20]&RC[-19]&RC[-18]&RC[-17]="",,"|n"&R1C14)&IF(RC[-20]="",,"|n"&R1C15&RC[-20])&IF(RC[-19]="",,"|n"&R1C16&RC[-19])&IF(RC[-18]="",,"|n"&R1C17&RC[-18])&IF(RC[-17]="",,"|n"&R1C18&RC[-17])&IF(RC[-16]="",,"|n"&R1C19&RC[-16])&IF(RC[-15]="",,"|n"&R1C20&RC[-15])&IF(RC[-14]="",,"|n"&R1C21&RC[-14])&IF(RC[-13]="",,"|n"&R1C22&RC[-13])&IF(RC[-11]="",,"|n"&R1C24&RC[-11])&IF(RC[-10]="",,"|n"&R1C25&RC[-10])&IF(RC[-9]="",,"|n"&R1C26&RC[-9])&IF(RC[-8]="",,"|n"&R1C27&RC[-8])&IF(RC[-7]="",,"|n"&R1C28&RC[-7])&IF(RC[-6]="",,"|n"&R1C29&RC[-6])&IF(RC[-2]="",,"|n"&RC[-2]) -> 
AI840: =IF(RC[-27]&RC[-26]&RC[-25]&RC[-24]&RC[-23]&RC[-22]="",,R1C7)&IF(RC[-27]="",,"|n"&R1C8&RC[-27])&IF(RC[-26]="",,"|n"&R1C9&RC[-26])&IF(RC[-25]="",,"|n"&R1C10&RC[-25])&IF(RC[-24]="",,"|n"&R1C11&RC[-24])&IF(RC[-23]="",,"|n"&R1C12&RC[-23])&IF(RC[-22]="",,"|n"&R1C13&RC[-22])&IF(RC[-20]&RC[-19]&RC[-18]&RC[-17]="",,"|n"&R1C14)&IF(RC[-20]="",,"|n"&R1C15&RC[-20])&IF(RC[-19]="",,"|n"&R1C16&RC[-19])&IF(RC[-18]="",,"|n"&R1C17&RC[-18])&IF(RC[-17]="",,"|n"&R1C18&RC[-17])&IF(RC[-16]="",,"|n"&R1C19&RC[-16])&IF(RC[-15]="",,"|n"&R1C20&RC[-15])&IF(RC[-14]="",,"|n"&R1C21&RC[-14])&IF(RC[-13]="",,"|n"&R1C22&RC[-13])&IF(RC[-11]="",,"|n"&R1C24&RC[-11])&IF(RC[-10]="",,"|n"&R1C25&RC[-10])&IF(RC[-9]="",,"|n"&R1C26&RC[-9])&IF(RC[-8]="",,"|n"&R1C27&RC[-8])&IF(RC[-7]="",,"|n"&R1C28&RC[-7])&IF(RC[-6]="",,"|n"&R1C29&RC[-6])&IF(RC[-2]="",,"|n"&RC[-2]) -> 
AI841: =IF(RC[-27]&RC[-26]&RC[-25]&RC[-24]&RC[-23]&RC[-22]="",,R1C7)&IF(RC[-27]="",,"|n"&R1C8&RC[-27])&IF(RC[-26]="",,"|n"&R1C9&RC[-26])&IF(RC[-25]="",,"|n"&R1C10&RC[-25])&IF(RC[-24]="",,"|n"&R1C11&RC[-24])&IF(RC[-23]="",,"|n"&R1C12&RC[-23])&IF(RC[-22]="",,"|n"&R1C13&RC[-22])&IF(RC[-20]&RC[-19]&RC[-18]&RC[-17]="",,"|n"&R1C14)&IF(RC[-20]="",,"|n"&R1C15&RC[-20])&IF(RC[-19]="",,"|n"&R1C16&RC[-19])&IF(RC[-18]="",,"|n"&R1C17&RC[-18])&IF(RC[-17]="",,"|n"&R1C18&RC[-17])&IF(RC[-16]="",,"|n"&R1C19&RC[-16])&IF(RC[-15]="",,"|n"&R1C20&RC[-15])&IF(RC[-14]="",,"|n"&R1C21&RC[-14])&IF(RC[-13]="",,"|n"&R1C22&RC[-13])&IF(RC[-11]="",,"|n"&R1C24&RC[-11])&IF(RC[-10]="",,"|n"&R1C25&RC[-10])&IF(RC[-9]="",,"|n"&R1C26&RC[-9])&IF(RC[-8]="",,"|n"&R1C27&RC[-8])&IF(RC[-7]="",,"|n"&R1C28&RC[-7])&IF(RC[-6]="",,"|n"&R1C29&RC[-6])&IF(RC[-2]="",,"|n"&RC[-2]) -> 
AI842: =IF(RC[-27]&RC[-26]&RC[-25]&RC[-24]&RC[-23]&RC[-22]="",,R1C7)&IF(RC[-27]="",,"|n"&R1C8&RC[-27])&IF(RC[-26]="",,"|n"&R1C9&RC[-26])&IF(RC[-25]="",,"|n"&R1C10&RC[-25])&IF(RC[-24]="",,"|n"&R1C11&RC[-24])&IF(RC[-23]="",,"|n"&R1C12&RC[-23])&IF(RC[-22]="",,"|n"&R1C13&RC[-22])&IF(RC[-20]&RC[-19]&RC[-18]&RC[-17]="",,"|n"&R1C14)&IF(RC[-20]="",,"|n"&R1C15&RC[-20])&IF(RC[-19]="",,"|n"&R1C16&RC[-19])&IF(RC[-18]="",,"|n"&R1C17&RC[-18])&IF(RC[-17]="",,"|n"&R1C18&RC[-17])&IF(RC[-16]="",,"|n"&R1C19&RC[-16])&IF(RC[-15]="",,"|n"&R1C20&RC[-15])&IF(RC[-14]="",,"|n"&R1C21&RC[-14])&IF(RC[-13]="",,"|n"&R1C22&RC[-13])&IF(RC[-11]="",,"|n"&R1C24&RC[-11])&IF(RC[-10]="",,"|n"&R1C25&RC[-10])&IF(RC[-9]="",,"|n"&R1C26&RC[-9])&IF(RC[-8]="",,"|n"&R1C27&RC[-8])&IF(RC[-7]="",,"|n"&R1C28&RC[-7])&IF(RC[-6]="",,"|n"&R1C29&RC[-6])&IF(RC[-2]="",,"|n"&RC[-2]) -> 
AI843: =IF(RC[-27]&RC[-26]&RC[-25]&RC[-24]&RC[-23]&RC[-22]="",,R1C7)&IF(RC[-27]="",,"|n"&R1C8&RC[-27])&IF(RC[-26]="",,"|n"&R1C9&RC[-26])&IF(RC[-25]="",,"|n"&R1C10&RC[-25])&IF(RC[-24]="",,"|n"&R1C11&RC[-24])&IF(RC[-23]="",,"|n"&R1C12&RC[-23])&IF(RC[-22]="",,"|n"&R1C13&RC[-22])&IF(RC[-20]&RC[-19]&RC[-18]&RC[-17]="",,"|n"&R1C14)&IF(RC[-20]="",,"|n"&R1C15&RC[-20])&IF(RC[-19]="",,"|n"&R1C16&RC[-19])&IF(RC[-18]="",,"|n"&R1C17&RC[-18])&IF(RC[-17]="",,"|n"&R1C18&RC[-17])&IF(RC[-16]="",,"|n"&R1C19&RC[-16])&IF(RC[-15]="",,"|n"&R1C20&RC[-15])&IF(RC[-14]="",,"|n"&R1C21&RC[-14])&IF(RC[-13]="",,"|n"&R1C22&RC[-13])&IF(RC[-11]="",,"|n"&R1C24&RC[-11])&IF(RC[-10]="",,"|n"&R1C25&RC[-10])&IF(RC[-9]="",,"|n"&R1C26&RC[-9])&IF(RC[-8]="",,"|n"&R1C27&RC[-8])&IF(RC[-7]="",,"|n"&R1C28&RC[-7])&IF(RC[-6]="",,"|n"&R1C29&RC[-6])&IF(RC[-2]="",,"|n"&RC[-2]) -> 
AI844: =IF(RC[-27]&RC[-26]&RC[-25]&RC[-24]&RC[-23]&RC[-22]="",,R1C7)&IF(RC[-27]="",,"|n"&R1C8&RC[-27])&IF(RC[-26]="",,"|n"&R1C9&RC[-26])&IF(RC[-25]="",,"|n"&R1C10&RC[-25])&IF(RC[-24]="",,"|n"&R1C11&RC[-24])&IF(RC[-23]="",,"|n"&R1C12&RC[-23])&IF(RC[-22]="",,"|n"&R1C13&RC[-22])&IF(RC[-20]&RC[-19]&RC[-18]&RC[-17]="",,"|n"&R1C14)&IF(RC[-20]="",,"|n"&R1C15&RC[-20])&IF(RC[-19]="",,"|n"&R1C16&RC[-19])&IF(RC[-18]="",,"|n"&R1C17&RC[-18])&IF(RC[-17]="",,"|n"&R1C18&RC[-17])&IF(RC[-16]="",,"|n"&R1C19&RC[-16])&IF(RC[-15]="",,"|n"&R1C20&RC[-15])&IF(RC[-14]="",,"|n"&R1C21&RC[-14])&IF(RC[-13]="",,"|n"&R1C22&RC[-13])&IF(RC[-11]="",,"|n"&R1C24&RC[-11])&IF(RC[-10]="",,"|n"&R1C25&RC[-10])&IF(RC[-9]="",,"|n"&R1C26&RC[-9])&IF(RC[-8]="",,"|n"&R1C27&RC[-8])&IF(RC[-7]="",,"|n"&R1C28&RC[-7])&IF(RC[-6]="",,"|n"&R1C29&RC[-6])&IF(RC[-2]="",,"|n"&RC[-2]) -> 
AI845: =IF(RC[-27]&RC[-26]&RC[-25]&RC[-24]&RC[-23]&RC[-22]="",,R1C7)&IF(RC[-27]="",,"|n"&R1C8&RC[-27])&IF(RC[-26]="",,"|n"&R1C9&RC[-26])&IF(RC[-25]="",,"|n"&R1C10&RC[-25])&IF(RC[-24]="",,"|n"&R1C11&RC[-24])&IF(RC[-23]="",,"|n"&R1C12&RC[-23])&IF(RC[-22]="",,"|n"&R1C13&RC[-22])&IF(RC[-20]&RC[-19]&RC[-18]&RC[-17]="",,"|n"&R1C14)&IF(RC[-20]="",,"|n"&R1C15&RC[-20])&IF(RC[-19]="",,"|n"&R1C16&RC[-19])&IF(RC[-18]="",,"|n"&R1C17&RC[-18])&IF(RC[-17]="",,"|n"&R1C18&RC[-17])&IF(RC[-16]="",,"|n"&R1C19&RC[-16])&IF(RC[-15]="",,"|n"&R1C20&RC[-15])&IF(RC[-14]="",,"|n"&R1C21&RC[-14])&IF(RC[-13]="",,"|n"&R1C22&RC[-13])&IF(RC[-11]="",,"|n"&R1C24&RC[-11])&IF(RC[-10]="",,"|n"&R1C25&RC[-10])&IF(RC[-9]="",,"|n"&R1C26&RC[-9])&IF(RC[-8]="",,"|n"&R1C27&RC[-8])&IF(RC[-7]="",,"|n"&R1C28&RC[-7])&IF(RC[-6]="",,"|n"&R1C29&RC[-6])&IF(RC[-2]="",,"|n"&RC[-2]) -> 
AI846: =IF(RC[-27]&RC[-26]&RC[-25]&RC[-24]&RC[-23]&RC[-22]="",,R1C7)&IF(RC[-27]="",,"|n"&R1C8&RC[-27])&IF(RC[-26]="",,"|n"&R1C9&RC[-26])&IF(RC[-25]="",,"|n"&R1C10&RC[-25])&IF(RC[-24]="",,"|n"&R1C11&RC[-24])&IF(RC[-23]="",,"|n"&R1C12&RC[-23])&IF(RC[-22]="",,"|n"&R1C13&RC[-22])&IF(RC[-20]&RC[-19]&RC[-18]&RC[-17]="",,"|n"&R1C14)&IF(RC[-20]="",,"|n"&R1C15&RC[-20])&IF(RC[-19]="",,"|n"&R1C16&RC[-19])&IF(RC[-18]="",,"|n"&R1C17&RC[-18])&IF(RC[-17]="",,"|n"&R1C18&RC[-17])&IF(RC[-16]="",,"|n"&R1C19&RC[-16])&IF(RC[-15]="",,"|n"&R1C20&RC[-15])&IF(RC[-14]="",,"|n"&R1C21&RC[-14])&IF(RC[-13]="",,"|n"&R1C22&RC[-13])&IF(RC[-11]="",,"|n"&R1C24&RC[-11])&IF(RC[-10]="",,"|n"&R1C25&RC[-10])&IF(RC[-9]="",,"|n"&R1C26&RC[-9])&IF(RC[-8]="",,"|n"&R1C27&RC[-8])&IF(RC[-7]="",,"|n"&R1C28&RC[-7])&IF(RC[-6]="",,"|n"&R1C29&RC[-6])&IF(RC[-2]="",,"|n"&RC[-2]) -> 
AI847: =IF(RC[-27]&RC[-26]&RC[-25]&RC[-24]&RC[-23]&RC[-22]="",,R1C7)&IF(RC[-27]="",,"|n"&R1C8&RC[-27])&IF(RC[-26]="",,"|n"&R1C9&RC[-26])&IF(RC[-25]="",,"|n"&R1C10&RC[-25])&IF(RC[-24]="",,"|n"&R1C11&RC[-24])&IF(RC[-23]="",,"|n"&R1C12&RC[-23])&IF(RC[-22]="",,"|n"&R1C13&RC[-22])&IF(RC[-20]&RC[-19]&RC[-18]&RC[-17]="",,"|n"&R1C14)&IF(RC[-20]="",,"|n"&R1C15&RC[-20])&IF(RC[-19]="",,"|n"&R1C16&RC[-19])&IF(RC[-18]="",,"|n"&R1C17&RC[-18])&IF(RC[-17]="",,"|n"&R1C18&RC[-17])&IF(RC[-16]="",,"|n"&R1C19&RC[-16])&IF(RC[-15]="",,"|n"&R1C20&RC[-15])&IF(RC[-14]="",,"|n"&R1C21&RC[-14])&IF(RC[-13]="",,"|n"&R1C22&RC[-13])&IF(RC[-11]="",,"|n"&R1C24&RC[-11])&IF(RC[-10]="",,"|n"&R1C25&RC[-10])&IF(RC[-9]="",,"|n"&R1C26&RC[-9])&IF(RC[-8]="",,"|n"&R1C27&RC[-8])&IF(RC[-7]="",,"|n"&R1C28&RC[-7])&IF(RC[-6]="",,"|n"&R1C29&RC[-6])&IF(RC[-2]="",,"|n"&RC[-2]) -> 
AI848: =IF(RC[-27]&RC[-26]&RC[-25]&RC[-24]&RC[-23]&RC[-22]="",,R1C7)&IF(RC[-27]="",,"|n"&R1C8&RC[-27])&IF(RC[-26]="",,"|n"&R1C9&RC[-26])&IF(RC[-25]="",,"|n"&R1C10&RC[-25])&IF(RC[-24]="",,"|n"&R1C11&RC[-24])&IF(RC[-23]="",,"|n"&R1C12&RC[-23])&IF(RC[-22]="",,"|n"&R1C13&RC[-22])&IF(RC[-20]&RC[-19]&RC[-18]&RC[-17]="",,"|n"&R1C14)&IF(RC[-20]="",,"|n"&R1C15&RC[-20])&IF(RC[-19]="",,"|n"&R1C16&RC[-19])&IF(RC[-18]="",,"|n"&R1C17&RC[-18])&IF(RC[-17]="",,"|n"&R1C18&RC[-17])&IF(RC[-16]="",,"|n"&R1C19&RC[-16])&IF(RC[-15]="",,"|n"&R1C20&RC[-15])&IF(RC[-14]="",,"|n"&R1C21&RC[-14])&IF(RC[-13]="",,"|n"&R1C22&RC[-13])&IF(RC[-11]="",,"|n"&R1C24&RC[-11])&IF(RC[-10]="",,"|n"&R1C25&RC[-10])&IF(RC[-9]="",,"|n"&R1C26&RC[-9])&IF(RC[-8]="",,"|n"&R1C27&RC[-8])&IF(RC[-7]="",,"|n"&R1C28&RC[-7])&IF(RC[-6]="",,"|n"&R1C29&RC[-6])&IF(RC[-2]="",,"|n"&RC[-2]) -> 
AI849: =IF(RC[-27]&RC[-26]&RC[-25]&RC[-24]&RC[-23]&RC[-22]="",,R1C7)&IF(RC[-27]="",,"|n"&R1C8&RC[-27])&IF(RC[-26]="",,"|n"&R1C9&RC[-26])&IF(RC[-25]="",,"|n"&R1C10&RC[-25])&IF(RC[-24]="",,"|n"&R1C11&RC[-24])&IF(RC[-23]="",,"|n"&R1C12&RC[-23])&IF(RC[-22]="",,"|n"&R1C13&RC[-22])&IF(RC[-20]&RC[-19]&RC[-18]&RC[-17]="",,"|n"&R1C14)&IF(RC[-20]="",,"|n"&R1C15&RC[-20])&IF(RC[-19]="",,"|n"&R1C16&RC[-19])&IF(RC[-18]="",,"|n"&R1C17&RC[-18])&IF(RC[-17]="",,"|n"&R1C18&RC[-17])&IF(RC[-16]="",,"|n"&R1C19&RC[-16])&IF(RC[-15]="",,"|n"&R1C20&RC[-15])&IF(RC[-14]="",,"|n"&R1C21&RC[-14])&IF(RC[-13]="",,"|n"&R1C22&RC[-13])&IF(RC[-11]="",,"|n"&R1C24&RC[-11])&IF(RC[-10]="",,"|n"&R1C25&RC[-10])&IF(RC[-9]="",,"|n"&R1C26&RC[-9])&IF(RC[-8]="",,"|n"&R1C27&RC[-8])&IF(RC[-7]="",,"|n"&R1C28&RC[-7])&IF(RC[-6]="",,"|n"&R1C29&RC[-6])&IF(RC[-2]="",,"|n"&RC[-2]) -> 
AI850: =IF(RC[-27]&RC[-26]&RC[-25]&RC[-24]&RC[-23]&RC[-22]="",,R1C7)&IF(RC[-27]="",,"|n"&R1C8&RC[-27])&IF(RC[-26]="",,"|n"&R1C9&RC[-26])&IF(RC[-25]="",,"|n"&R1C10&RC[-25])&IF(RC[-24]="",,"|n"&R1C11&RC[-24])&IF(RC[-23]="",,"|n"&R1C12&RC[-23])&IF(RC[-22]="",,"|n"&R1C13&RC[-22])&IF(RC[-20]&RC[-19]&RC[-18]&RC[-17]="",,"|n"&R1C14)&IF(RC[-20]="",,"|n"&R1C15&RC[-20])&IF(RC[-19]="",,"|n"&R1C16&RC[-19])&IF(RC[-18]="",,"|n"&R1C17&RC[-18])&IF(RC[-17]="",,"|n"&R1C18&RC[-17])&IF(RC[-16]="",,"|n"&R1C19&RC[-16])&IF(RC[-15]="",,"|n"&R1C20&RC[-15])&IF(RC[-14]="",,"|n"&R1C21&RC[-14])&IF(RC[-13]="",,"|n"&R1C22&RC[-13])&IF(RC[-11]="",,"|n"&R1C24&RC[-11])&IF(RC[-10]="",,"|n"&R1C25&RC[-10])&IF(RC[-9]="",,"|n"&R1C26&RC[-9])&IF(RC[-8]="",,"|n"&R1C27&RC[-8])&IF(RC[-7]="",,"|n"&R1C28&RC[-7])&IF(RC[-6]="",,"|n"&R1C29&RC[-6])&IF(RC[-2]="",,"|n"&RC[-2]) -> 
AI851: =IF(RC[-27]&RC[-26]&RC[-25]&RC[-24]&RC[-23]&RC[-22]="",,R1C7)&IF(RC[-27]="",,"|n"&R1C8&RC[-27])&IF(RC[-26]="",,"|n"&R1C9&RC[-26])&IF(RC[-25]="",,"|n"&R1C10&RC[-25])&IF(RC[-24]="",,"|n"&R1C11&RC[-24])&IF(RC[-23]="",,"|n"&R1C12&RC[-23])&IF(RC[-22]="",,"|n"&R1C13&RC[-22])&IF(RC[-20]&RC[-19]&RC[-18]&RC[-17]="",,"|n"&R1C14)&IF(RC[-20]="",,"|n"&R1C15&RC[-20])&IF(RC[-19]="",,"|n"&R1C16&RC[-19])&IF(RC[-18]="",,"|n"&R1C17&RC[-18])&IF(RC[-17]="",,"|n"&R1C18&RC[-17])&IF(RC[-16]="",,"|n"&R1C19&RC[-16])&IF(RC[-15]="",,"|n"&R1C20&RC[-15])&IF(RC[-14]="",,"|n"&R1C21&RC[-14])&IF(RC[-13]="",,"|n"&R1C22&RC[-13])&IF(RC[-11]="",,"|n"&R1C24&RC[-11])&IF(RC[-10]="",,"|n"&R1C25&RC[-10])&IF(RC[-9]="",,"|n"&R1C26&RC[-9])&IF(RC[-8]="",,"|n"&R1C27&RC[-8])&IF(RC[-7]="",,"|n"&R1C28&RC[-7])&IF(RC[-6]="",,"|n"&R1C29&RC[-6])&IF(RC[-2]="",,"|n"&RC[-2]) -> 
AI852: =IF(RC[-27]&RC[-26]&RC[-25]&RC[-24]&RC[-23]&RC[-22]="",,R1C7)&IF(RC[-27]="",,"|n"&R1C8&RC[-27])&IF(RC[-26]="",,"|n"&R1C9&RC[-26])&IF(RC[-25]="",,"|n"&R1C10&RC[-25])&IF(RC[-24]="",,"|n"&R1C11&RC[-24])&IF(RC[-23]="",,"|n"&R1C12&RC[-23])&IF(RC[-22]="",,"|n"&R1C13&RC[-22])&IF(RC[-20]&RC[-19]&RC[-18]&RC[-17]="",,"|n"&R1C14)&IF(RC[-20]="",,"|n"&R1C15&RC[-20])&IF(RC[-19]="",,"|n"&R1C16&RC[-19])&IF(RC[-18]="",,"|n"&R1C17&RC[-18])&IF(RC[-17]="",,"|n"&R1C18&RC[-17])&IF(RC[-16]="",,"|n"&R1C19&RC[-16])&IF(RC[-15]="",,"|n"&R1C20&RC[-15])&IF(RC[-14]="",,"|n"&R1C21&RC[-14])&IF(RC[-13]="",,"|n"&R1C22&RC[-13])&IF(RC[-11]="",,"|n"&R1C24&RC[-11])&IF(RC[-10]="",,"|n"&R1C25&RC[-10])&IF(RC[-9]="",,"|n"&R1C26&RC[-9])&IF(RC[-8]="",,"|n"&R1C27&RC[-8])&IF(RC[-7]="",,"|n"&R1C28&RC[-7])&IF(RC[-6]="",,"|n"&R1C29&RC[-6])&IF(RC[-2]="",,"|n"&RC[-2]) -> 
AI853: =IF(RC[-27]&RC[-26]&RC[-25]&RC[-24]&RC[-23]&RC[-22]="",,R1C7)&IF(RC[-27]="",,"|n"&R1C8&RC[-27])&IF(RC[-26]="",,"|n"&R1C9&RC[-26])&IF(RC[-25]="",,"|n"&R1C10&RC[-25])&IF(RC[-24]="",,"|n"&R1C11&RC[-24])&IF(RC[-23]="",,"|n"&R1C12&RC[-23])&IF(RC[-22]="",,"|n"&R1C13&RC[-22])&IF(RC[-20]&RC[-19]&RC[-18]&RC[-17]="",,"|n"&R1C14)&IF(RC[-20]="",,"|n"&R1C15&RC[-20])&IF(RC[-19]="",,"|n"&R1C16&RC[-19])&IF(RC[-18]="",,"|n"&R1C17&RC[-18])&IF(RC[-17]="",,"|n"&R1C18&RC[-17])&IF(RC[-16]="",,"|n"&R1C19&RC[-16])&IF(RC[-15]="",,"|n"&R1C20&RC[-15])&IF(RC[-14]="",,"|n"&R1C21&RC[-14])&IF(RC[-13]="",,"|n"&R1C22&RC[-13])&IF(RC[-11]="",,"|n"&R1C24&RC[-11])&IF(RC[-10]="",,"|n"&R1C25&RC[-10])&IF(RC[-9]="",,"|n"&R1C26&RC[-9])&IF(RC[-8]="",,"|n"&R1C27&RC[-8])&IF(RC[-7]="",,"|n"&R1C28&RC[-7])&IF(RC[-6]="",,"|n"&R1C29&RC[-6])&IF(RC[-2]="",,"|n"&RC[-2]) -> 
AI854: =IF(RC[-27]&RC[-26]&RC[-25]&RC[-24]&RC[-23]&RC[-22]="",,R1C7)&IF(RC[-27]="",,"|n"&R1C8&RC[-27])&IF(RC[-26]="",,"|n"&R1C9&RC[-26])&IF(RC[-25]="",,"|n"&R1C10&RC[-25])&IF(RC[-24]="",,"|n"&R1C11&RC[-24])&IF(RC[-23]="",,"|n"&R1C12&RC[-23])&IF(RC[-22]="",,"|n"&R1C13&RC[-22])&IF(RC[-20]&RC[-19]&RC[-18]&RC[-17]="",,"|n"&R1C14)&IF(RC[-20]="",,"|n"&R1C15&RC[-20])&IF(RC[-19]="",,"|n"&R1C16&RC[-19])&IF(RC[-18]="",,"|n"&R1C17&RC[-18])&IF(RC[-17]="",,"|n"&R1C18&RC[-17])&IF(RC[-16]="",,"|n"&R1C19&RC[-16])&IF(RC[-15]="",,"|n"&R1C20&RC[-15])&IF(RC[-14]="",,"|n"&R1C21&RC[-14])&IF(RC[-13]="",,"|n"&R1C22&RC[-13])&IF(RC[-11]="",,"|n"&R1C24&RC[-11])&IF(RC[-10]="",,"|n"&R1C25&RC[-10])&IF(RC[-9]="",,"|n"&R1C26&RC[-9])&IF(RC[-8]="",,"|n"&R1C27&RC[-8])&IF(RC[-7]="",,"|n"&R1C28&RC[-7])&IF(RC[-6]="",,"|n"&R1C29&RC[-6])&IF(RC[-2]="",,"|n"&RC[-2]) -> 
AI855: =IF(RC[-27]&RC[-26]&RC[-25]&RC[-24]&RC[-23]&RC[-22]="",,R1C7)&IF(RC[-27]="",,"|n"&R1C8&RC[-27])&IF(RC[-26]="",,"|n"&R1C9&RC[-26])&IF(RC[-25]="",,"|n"&R1C10&RC[-25])&IF(RC[-24]="",,"|n"&R1C11&RC[-24])&IF(RC[-23]="",,"|n"&R1C12&RC[-23])&IF(RC[-22]="",,"|n"&R1C13&RC[-22])&IF(RC[-20]&RC[-19]&RC[-18]&RC[-17]="",,"|n"&R1C14)&IF(RC[-20]="",,"|n"&R1C15&RC[-20])&IF(RC[-19]="",,"|n"&R1C16&RC[-19])&IF(RC[-18]="",,"|n"&R1C17&RC[-18])&IF(RC[-17]="",,"|n"&R1C18&RC[-17])&IF(RC[-16]="",,"|n"&R1C19&RC[-16])&IF(RC[-15]="",,"|n"&R1C20&RC[-15])&IF(RC[-14]="",,"|n"&R1C21&RC[-14])&IF(RC[-13]="",,"|n"&R1C22&RC[-13])&IF(RC[-11]="",,"|n"&R1C24&RC[-11])&IF(RC[-10]="",,"|n"&R1C25&RC[-10])&IF(RC[-9]="",,"|n"&R1C26&RC[-9])&IF(RC[-8]="",,"|n"&R1C27&RC[-8])&IF(RC[-7]="",,"|n"&R1C28&RC[-7])&IF(RC[-6]="",,"|n"&R1C29&RC[-6])&IF(RC[-2]="",,"|n"&RC[-2]) -> 
AI856: =IF(RC[-27]&RC[-26]&RC[-25]&RC[-24]&RC[-23]&RC[-22]="",,R1C7)&IF(RC[-27]="",,"|n"&R1C8&RC[-27])&IF(RC[-26]="",,"|n"&R1C9&RC[-26])&IF(RC[-25]="",,"|n"&R1C10&RC[-25])&IF(RC[-24]="",,"|n"&R1C11&RC[-24])&IF(RC[-23]="",,"|n"&R1C12&RC[-23])&IF(RC[-22]="",,"|n"&R1C13&RC[-22])&IF(RC[-20]&RC[-19]&RC[-18]&RC[-17]="",,"|n"&R1C14)&IF(RC[-20]="",,"|n"&R1C15&RC[-20])&IF(RC[-19]="",,"|n"&R1C16&RC[-19])&IF(RC[-18]="",,"|n"&R1C17&RC[-18])&IF(RC[-17]="",,"|n"&R1C18&RC[-17])&IF(RC[-16]="",,"|n"&R1C19&RC[-16])&IF(RC[-15]="",,"|n"&R1C20&RC[-15])&IF(RC[-14]="",,"|n"&R1C21&RC[-14])&IF(RC[-13]="",,"|n"&R1C22&RC[-13])&IF(RC[-11]="",,"|n"&R1C24&RC[-11])&IF(RC[-10]="",,"|n"&R1C25&RC[-10])&IF(RC[-9]="",,"|n"&R1C26&RC[-9])&IF(RC[-8]="",,"|n"&R1C27&RC[-8])&IF(RC[-7]="",,"|n"&R1C28&RC[-7])&IF(RC[-6]="",,"|n"&R1C29&RC[-6])&IF(RC[-2]="",,"|n"&RC[-2]) -> 
AI857: =IF(RC[-27]&RC[-26]&RC[-25]&RC[-24]&RC[-23]&RC[-22]="",,R1C7)&IF(RC[-27]="",,"|n"&R1C8&RC[-27])&IF(RC[-26]="",,"|n"&R1C9&RC[-26])&IF(RC[-25]="",,"|n"&R1C10&RC[-25])&IF(RC[-24]="",,"|n"&R1C11&RC[-24])&IF(RC[-23]="",,"|n"&R1C12&RC[-23])&IF(RC[-22]="",,"|n"&R1C13&RC[-22])&IF(RC[-20]&RC[-19]&RC[-18]&RC[-17]="",,"|n"&R1C14)&IF(RC[-20]="",,"|n"&R1C15&RC[-20])&IF(RC[-19]="",,"|n"&R1C16&RC[-19])&IF(RC[-18]="",,"|n"&R1C17&RC[-18])&IF(RC[-17]="",,"|n"&R1C18&RC[-17])&IF(RC[-16]="",,"|n"&R1C19&RC[-16])&IF(RC[-15]="",,"|n"&R1C20&RC[-15])&IF(RC[-14]="",,"|n"&R1C21&RC[-14])&IF(RC[-13]="",,"|n"&R1C22&RC[-13])&IF(RC[-11]="",,"|n"&R1C24&RC[-11])&IF(RC[-10]="",,"|n"&R1C25&RC[-10])&IF(RC[-9]="",,"|n"&R1C26&RC[-9])&IF(RC[-8]="",,"|n"&R1C27&RC[-8])&IF(RC[-7]="",,"|n"&R1C28&RC[-7])&IF(RC[-6]="",,"|n"&R1C29&RC[-6])&IF(RC[-2]="",,"|n"&RC[-2]) -> 
AI858: =IF(RC[-27]&RC[-26]&RC[-25]&RC[-24]&RC[-23]&RC[-22]="",,R1C7)&IF(RC[-27]="",,"|n"&R1C8&RC[-27])&IF(RC[-26]="",,"|n"&R1C9&RC[-26])&IF(RC[-25]="",,"|n"&R1C10&RC[-25])&IF(RC[-24]="",,"|n"&R1C11&RC[-24])&IF(RC[-23]="",,"|n"&R1C12&RC[-23])&IF(RC[-22]="",,"|n"&R1C13&RC[-22])&IF(RC[-20]&RC[-19]&RC[-18]&RC[-17]="",,"|n"&R1C14)&IF(RC[-20]="",,"|n"&R1C15&RC[-20])&IF(RC[-19]="",,"|n"&R1C16&RC[-19])&IF(RC[-18]="",,"|n"&R1C17&RC[-18])&IF(RC[-17]="",,"|n"&R1C18&RC[-17])&IF(RC[-16]="",,"|n"&R1C19&RC[-16])&IF(RC[-15]="",,"|n"&R1C20&RC[-15])&IF(RC[-14]="",,"|n"&R1C21&RC[-14])&IF(RC[-13]="",,"|n"&R1C22&RC[-13])&IF(RC[-11]="",,"|n"&R1C24&RC[-11])&IF(RC[-10]="",,"|n"&R1C25&RC[-10])&IF(RC[-9]="",,"|n"&R1C26&RC[-9])&IF(RC[-8]="",,"|n"&R1C27&RC[-8])&IF(RC[-7]="",,"|n"&R1C28&RC[-7])&IF(RC[-6]="",,"|n"&R1C29&RC[-6])&IF(RC[-2]="",,"|n"&RC[-2]) -> 
AI859: =IF(RC[-27]&RC[-26]&RC[-25]&RC[-24]&RC[-23]&RC[-22]="",,R1C7)&IF(RC[-27]="",,"|n"&R1C8&RC[-27])&IF(RC[-26]="",,"|n"&R1C9&RC[-26])&IF(RC[-25]="",,"|n"&R1C10&RC[-25])&IF(RC[-24]="",,"|n"&R1C11&RC[-24])&IF(RC[-23]="",,"|n"&R1C12&RC[-23])&IF(RC[-22]="",,"|n"&R1C13&RC[-22])&IF(RC[-20]&RC[-19]&RC[-18]&RC[-17]="",,"|n"&R1C14)&IF(RC[-20]="",,"|n"&R1C15&RC[-20])&IF(RC[-19]="",,"|n"&R1C16&RC[-19])&IF(RC[-18]="",,"|n"&R1C17&RC[-18])&IF(RC[-17]="",,"|n"&R1C18&RC[-17])&IF(RC[-16]="",,"|n"&R1C19&RC[-16])&IF(RC[-15]="",,"|n"&R1C20&RC[-15])&IF(RC[-14]="",,"|n"&R1C21&RC[-14])&IF(RC[-13]="",,"|n"&R1C22&RC[-13])&IF(RC[-11]="",,"|n"&R1C24&RC[-11])&IF(RC[-10]="",,"|n"&R1C25&RC[-10])&IF(RC[-9]="",,"|n"&R1C26&RC[-9])&IF(RC[-8]="",,"|n"&R1C27&RC[-8])&IF(RC[-7]="",,"|n"&R1C28&RC[-7])&IF(RC[-6]="",,"|n"&R1C29&RC[-6])&IF(RC[-2]="",,"|n"&RC[-2]) -> 
AI860: =IF(RC[-27]&RC[-26]&RC[-25]&RC[-24]&RC[-23]&RC[-22]="",,R1C7)&IF(RC[-27]="",,"|n"&R1C8&RC[-27])&IF(RC[-26]="",,"|n"&R1C9&RC[-26])&IF(RC[-25]="",,"|n"&R1C10&RC[-25])&IF(RC[-24]="",,"|n"&R1C11&RC[-24])&IF(RC[-23]="",,"|n"&R1C12&RC[-23])&IF(RC[-22]="",,"|n"&R1C13&RC[-22])&IF(RC[-20]&RC[-19]&RC[-18]&RC[-17]="",,"|n"&R1C14)&IF(RC[-20]="",,"|n"&R1C15&RC[-20])&IF(RC[-19]="",,"|n"&R1C16&RC[-19])&IF(RC[-18]="",,"|n"&R1C17&RC[-18])&IF(RC[-17]="",,"|n"&R1C18&RC[-17])&IF(RC[-16]="",,"|n"&R1C19&RC[-16])&IF(RC[-15]="",,"|n"&R1C20&RC[-15])&IF(RC[-14]="",,"|n"&R1C21&RC[-14])&IF(RC[-13]="",,"|n"&R1C22&RC[-13])&IF(RC[-11]="",,"|n"&R1C24&RC[-11])&IF(RC[-10]="",,"|n"&R1C25&RC[-10])&IF(RC[-9]="",,"|n"&R1C26&RC[-9])&IF(RC[-8]="",,"|n"&R1C27&RC[-8])&IF(RC[-7]="",,"|n"&R1C28&RC[-7])&IF(RC[-6]="",,"|n"&R1C29&RC[-6])&IF(RC[-2]="",,"|n"&RC[-2]) -> 
AI861: =IF(RC[-27]&RC[-26]&RC[-25]&RC[-24]&RC[-23]&RC[-22]="",,R1C7)&IF(RC[-27]="",,"|n"&R1C8&RC[-27])&IF(RC[-26]="",,"|n"&R1C9&RC[-26])&IF(RC[-25]="",,"|n"&R1C10&RC[-25])&IF(RC[-24]="",,"|n"&R1C11&RC[-24])&IF(RC[-23]="",,"|n"&R1C12&RC[-23])&IF(RC[-22]="",,"|n"&R1C13&RC[-22])&IF(RC[-20]&RC[-19]&RC[-18]&RC[-17]="",,"|n"&R1C14)&IF(RC[-20]="",,"|n"&R1C15&RC[-20])&IF(RC[-19]="",,"|n"&R1C16&RC[-19])&IF(RC[-18]="",,"|n"&R1C17&RC[-18])&IF(RC[-17]="",,"|n"&R1C18&RC[-17])&IF(RC[-16]="",,"|n"&R1C19&RC[-16])&IF(RC[-15]="",,"|n"&R1C20&RC[-15])&IF(RC[-14]="",,"|n"&R1C21&RC[-14])&IF(RC[-13]="",,"|n"&R1C22&RC[-13])&IF(RC[-11]="",,"|n"&R1C24&RC[-11])&IF(RC[-10]="",,"|n"&R1C25&RC[-10])&IF(RC[-9]="",,"|n"&R1C26&RC[-9])&IF(RC[-8]="",,"|n"&R1C27&RC[-8])&IF(RC[-7]="",,"|n"&R1C28&RC[-7])&IF(RC[-6]="",,"|n"&R1C29&RC[-6])&IF(RC[-2]="",,"|n"&RC[-2]) -> 
AI862: =IF(RC[-27]&RC[-26]&RC[-25]&RC[-24]&RC[-23]&RC[-22]="",,R1C7)&IF(RC[-27]="",,"|n"&R1C8&RC[-27])&IF(RC[-26]="",,"|n"&R1C9&RC[-26])&IF(RC[-25]="",,"|n"&R1C10&RC[-25])&IF(RC[-24]="",,"|n"&R1C11&RC[-24])&IF(RC[-23]="",,"|n"&R1C12&RC[-23])&IF(RC[-22]="",,"|n"&R1C13&RC[-22])&IF(RC[-20]&RC[-19]&RC[-18]&RC[-17]="",,"|n"&R1C14)&IF(RC[-20]="",,"|n"&R1C15&RC[-20])&IF(RC[-19]="",,"|n"&R1C16&RC[-19])&IF(RC[-18]="",,"|n"&R1C17&RC[-18])&IF(RC[-17]="",,"|n"&R1C18&RC[-17])&IF(RC[-16]="",,"|n"&R1C19&RC[-16])&IF(RC[-15]="",,"|n"&R1C20&RC[-15])&IF(RC[-14]="",,"|n"&R1C21&RC[-14])&IF(RC[-13]="",,"|n"&R1C22&RC[-13])&IF(RC[-11]="",,"|n"&R1C24&RC[-11])&IF(RC[-10]="",,"|n"&R1C25&RC[-10])&IF(RC[-9]="",,"|n"&R1C26&RC[-9])&IF(RC[-8]="",,"|n"&R1C27&RC[-8])&IF(RC[-7]="",,"|n"&R1C28&RC[-7])&IF(RC[-6]="",,"|n"&R1C29&RC[-6])&IF(RC[-2]="",,"|n"&RC[-2]) -> 
AI863: =IF(RC[-27]&RC[-26]&RC[-25]&RC[-24]&RC[-23]&RC[-22]="",,R1C7)&IF(RC[-27]="",,"|n"&R1C8&RC[-27])&IF(RC[-26]="",,"|n"&R1C9&RC[-26])&IF(RC[-25]="",,"|n"&R1C10&RC[-25])&IF(RC[-24]="",,"|n"&R1C11&RC[-24])&IF(RC[-23]="",,"|n"&R1C12&RC[-23])&IF(RC[-22]="",,"|n"&R1C13&RC[-22])&IF(RC[-20]&RC[-19]&RC[-18]&RC[-17]="",,"|n"&R1C14)&IF(RC[-20]="",,"|n"&R1C15&RC[-20])&IF(RC[-19]="",,"|n"&R1C16&RC[-19])&IF(RC[-18]="",,"|n"&R1C17&RC[-18])&IF(RC[-17]="",,"|n"&R1C18&RC[-17])&IF(RC[-16]="",,"|n"&R1C19&RC[-16])&IF(RC[-15]="",,"|n"&R1C20&RC[-15])&IF(RC[-14]="",,"|n"&R1C21&RC[-14])&IF(RC[-13]="",,"|n"&R1C22&RC[-13])&IF(RC[-11]="",,"|n"&R1C24&RC[-11])&IF(RC[-10]="",,"|n"&R1C25&RC[-10])&IF(RC[-9]="",,"|n"&R1C26&RC[-9])&IF(RC[-8]="",,"|n"&R1C27&RC[-8])&IF(RC[-7]="",,"|n"&R1C28&RC[-7])&IF(RC[-6]="",,"|n"&R1C29&RC[-6])&IF(RC[-2]="",,"|n"&RC[-2]) -> 
AI864: =IF(RC[-27]&RC[-26]&RC[-25]&RC[-24]&RC[-23]&RC[-22]="",,R1C7)&IF(RC[-27]="",,"|n"&R1C8&RC[-27])&IF(RC[-26]="",,"|n"&R1C9&RC[-26])&IF(RC[-25]="",,"|n"&R1C10&RC[-25])&IF(RC[-24]="",,"|n"&R1C11&RC[-24])&IF(RC[-23]="",,"|n"&R1C12&RC[-23])&IF(RC[-22]="",,"|n"&R1C13&RC[-22])&IF(RC[-20]&RC[-19]&RC[-18]&RC[-17]="",,"|n"&R1C14)&IF(RC[-20]="",,"|n"&R1C15&RC[-20])&IF(RC[-19]="",,"|n"&R1C16&RC[-19])&IF(RC[-18]="",,"|n"&R1C17&RC[-18])&IF(RC[-17]="",,"|n"&R1C18&RC[-17])&IF(RC[-16]="",,"|n"&R1C19&RC[-16])&IF(RC[-15]="",,"|n"&R1C20&RC[-15])&IF(RC[-14]="",,"|n"&R1C21&RC[-14])&IF(RC[-13]="",,"|n"&R1C22&RC[-13])&IF(RC[-11]="",,"|n"&R1C24&RC[-11])&IF(RC[-10]="",,"|n"&R1C25&RC[-10])&IF(RC[-9]="",,"|n"&R1C26&RC[-9])&IF(RC[-8]="",,"|n"&R1C27&RC[-8])&IF(RC[-7]="",,"|n"&R1C28&RC[-7])&IF(RC[-6]="",,"|n"&R1C29&RC[-6])&IF(RC[-2]="",,"|n"&RC[-2]) -> 
AI865: =IF(RC[-27]&RC[-26]&RC[-25]&RC[-24]&RC[-23]&RC[-22]="",,R1C7)&IF(RC[-27]="",,"|n"&R1C8&RC[-27])&IF(RC[-26]="",,"|n"&R1C9&RC[-26])&IF(RC[-25]="",,"|n"&R1C10&RC[-25])&IF(RC[-24]="",,"|n"&R1C11&RC[-24])&IF(RC[-23]="",,"|n"&R1C12&RC[-23])&IF(RC[-22]="",,"|n"&R1C13&RC[-22])&IF(RC[-20]&RC[-19]&RC[-18]&RC[-17]="",,"|n"&R1C14)&IF(RC[-20]="",,"|n"&R1C15&RC[-20])&IF(RC[-19]="",,"|n"&R1C16&RC[-19])&IF(RC[-18]="",,"|n"&R1C17&RC[-18])&IF(RC[-17]="",,"|n"&R1C18&RC[-17])&IF(RC[-16]="",,"|n"&R1C19&RC[-16])&IF(RC[-15]="",,"|n"&R1C20&RC[-15])&IF(RC[-14]="",,"|n"&R1C21&RC[-14])&IF(RC[-13]="",,"|n"&R1C22&RC[-13])&IF(RC[-11]="",,"|n"&R1C24&RC[-11])&IF(RC[-10]="",,"|n"&R1C25&RC[-10])&IF(RC[-9]="",,"|n"&R1C26&RC[-9])&IF(RC[-8]="",,"|n"&R1C27&RC[-8])&IF(RC[-7]="",,"|n"&R1C28&RC[-7])&IF(RC[-6]="",,"|n"&R1C29&RC[-6])&IF(RC[-2]="",,"|n"&RC[-2]) -> 
AI866: =IF(RC[-27]&RC[-26]&RC[-25]&RC[-24]&RC[-23]&RC[-22]="",,R1C7)&IF(RC[-27]="",,"|n"&R1C8&RC[-27])&IF(RC[-26]="",,"|n"&R1C9&RC[-26])&IF(RC[-25]="",,"|n"&R1C10&RC[-25])&IF(RC[-24]="",,"|n"&R1C11&RC[-24])&IF(RC[-23]="",,"|n"&R1C12&RC[-23])&IF(RC[-22]="",,"|n"&R1C13&RC[-22])&IF(RC[-20]&RC[-19]&RC[-18]&RC[-17]="",,"|n"&R1C14)&IF(RC[-20]="",,"|n"&R1C15&RC[-20])&IF(RC[-19]="",,"|n"&R1C16&RC[-19])&IF(RC[-18]="",,"|n"&R1C17&RC[-18])&IF(RC[-17]="",,"|n"&R1C18&RC[-17])&IF(RC[-16]="",,"|n"&R1C19&RC[-16])&IF(RC[-15]="",,"|n"&R1C20&RC[-15])&IF(RC[-14]="",,"|n"&R1C21&RC[-14])&IF(RC[-13]="",,"|n"&R1C22&RC[-13])&IF(RC[-11]="",,"|n"&R1C24&RC[-11])&IF(RC[-10]="",,"|n"&R1C25&RC[-10])&IF(RC[-9]="",,"|n"&R1C26&RC[-9])&IF(RC[-8]="",,"|n"&R1C27&RC[-8])&IF(RC[-7]="",,"|n"&R1C28&RC[-7])&IF(RC[-6]="",,"|n"&R1C29&RC[-6])&IF(RC[-2]="",,"|n"&RC[-2]) -> 
AI867: =IF(RC[-27]&RC[-26]&RC[-25]&RC[-24]&RC[-23]&RC[-22]="",,R1C7)&IF(RC[-27]="",,"|n"&R1C8&RC[-27])&IF(RC[-26]="",,"|n"&R1C9&RC[-26])&IF(RC[-25]="",,"|n"&R1C10&RC[-25])&IF(RC[-24]="",,"|n"&R1C11&RC[-24])&IF(RC[-23]="",,"|n"&R1C12&RC[-23])&IF(RC[-22]="",,"|n"&R1C13&RC[-22])&IF(RC[-20]&RC[-19]&RC[-18]&RC[-17]="",,"|n"&R1C14)&IF(RC[-20]="",,"|n"&R1C15&RC[-20])&IF(RC[-19]="",,"|n"&R1C16&RC[-19])&IF(RC[-18]="",,"|n"&R1C17&RC[-18])&IF(RC[-17]="",,"|n"&R1C18&RC[-17])&IF(RC[-16]="",,"|n"&R1C19&RC[-16])&IF(RC[-15]="",,"|n"&R1C20&RC[-15])&IF(RC[-14]="",,"|n"&R1C21&RC[-14])&IF(RC[-13]="",,"|n"&R1C22&RC[-13])&IF(RC[-11]="",,"|n"&R1C24&RC[-11])&IF(RC[-10]="",,"|n"&R1C25&RC[-10])&IF(RC[-9]="",,"|n"&R1C26&RC[-9])&IF(RC[-8]="",,"|n"&R1C27&RC[-8])&IF(RC[-7]="",,"|n"&R1C28&RC[-7])&IF(RC[-6]="",,"|n"&R1C29&RC[-6])&IF(RC[-2]="",,"|n"&RC[-2]) -> 
AI868: =IF(RC[-27]&RC[-26]&RC[-25]&RC[-24]&RC[-23]&RC[-22]="",,R1C7)&IF(RC[-27]="",,"|n"&R1C8&RC[-27])&IF(RC[-26]="",,"|n"&R1C9&RC[-26])&IF(RC[-25]="",,"|n"&R1C10&RC[-25])&IF(RC[-24]="",,"|n"&R1C11&RC[-24])&IF(RC[-23]="",,"|n"&R1C12&RC[-23])&IF(RC[-22]="",,"|n"&R1C13&RC[-22])&IF(RC[-20]&RC[-19]&RC[-18]&RC[-17]="",,"|n"&R1C14)&IF(RC[-20]="",,"|n"&R1C15&RC[-20])&IF(RC[-19]="",,"|n"&R1C16&RC[-19])&IF(RC[-18]="",,"|n"&R1C17&RC[-18])&IF(RC[-17]="",,"|n"&R1C18&RC[-17])&IF(RC[-16]="",,"|n"&R1C19&RC[-16])&IF(RC[-15]="",,"|n"&R1C20&RC[-15])&IF(RC[-14]="",,"|n"&R1C21&RC[-14])&IF(RC[-13]="",,"|n"&R1C22&RC[-13])&IF(RC[-11]="",,"|n"&R1C24&RC[-11])&IF(RC[-10]="",,"|n"&R1C25&RC[-10])&IF(RC[-9]="",,"|n"&R1C26&RC[-9])&IF(RC[-8]="",,"|n"&R1C27&RC[-8])&IF(RC[-7]="",,"|n"&R1C28&RC[-7])&IF(RC[-6]="",,"|n"&R1C29&RC[-6])&IF(RC[-2]="",,"|n"&RC[-2]) -> 
AI869: =IF(RC[-27]&RC[-26]&RC[-25]&RC[-24]&RC[-23]&RC[-22]="",,R1C7)&IF(RC[-27]="",,"|n"&R1C8&RC[-27])&IF(RC[-26]="",,"|n"&R1C9&RC[-26])&IF(RC[-25]="",,"|n"&R1C10&RC[-25])&IF(RC[-24]="",,"|n"&R1C11&RC[-24])&IF(RC[-23]="",,"|n"&R1C12&RC[-23])&IF(RC[-22]="",,"|n"&R1C13&RC[-22])&IF(RC[-20]&RC[-19]&RC[-18]&RC[-17]="",,"|n"&R1C14)&IF(RC[-20]="",,"|n"&R1C15&RC[-20])&IF(RC[-19]="",,"|n"&R1C16&RC[-19])&IF(RC[-18]="",,"|n"&R1C17&RC[-18])&IF(RC[-17]="",,"|n"&R1C18&RC[-17])&IF(RC[-16]="",,"|n"&R1C19&RC[-16])&IF(RC[-15]="",,"|n"&R1C20&RC[-15])&IF(RC[-14]="",,"|n"&R1C21&RC[-14])&IF(RC[-13]="",,"|n"&R1C22&RC[-13])&IF(RC[-11]="",,"|n"&R1C24&RC[-11])&IF(RC[-10]="",,"|n"&R1C25&RC[-10])&IF(RC[-9]="",,"|n"&R1C26&RC[-9])&IF(RC[-8]="",,"|n"&R1C27&RC[-8])&IF(RC[-7]="",,"|n"&R1C28&RC[-7])&IF(RC[-6]="",,"|n"&R1C29&RC[-6])&IF(RC[-2]="",,"|n"&RC[-2]) -> 
AI870: =IF(RC[-27]&RC[-26]&RC[-25]&RC[-24]&RC[-23]&RC[-22]="",,R1C7)&IF(RC[-27]="",,"|n"&R1C8&RC[-27])&IF(RC[-26]="",,"|n"&R1C9&RC[-26])&IF(RC[-25]="",,"|n"&R1C10&RC[-25])&IF(RC[-24]="",,"|n"&R1C11&RC[-24])&IF(RC[-23]="",,"|n"&R1C12&RC[-23])&IF(RC[-22]="",,"|n"&R1C13&RC[-22])&IF(RC[-20]&RC[-19]&RC[-18]&RC[-17]="",,"|n"&R1C14)&IF(RC[-20]="",,"|n"&R1C15&RC[-20])&IF(RC[-19]="",,"|n"&R1C16&RC[-19])&IF(RC[-18]="",,"|n"&R1C17&RC[-18])&IF(RC[-17]="",,"|n"&R1C18&RC[-17])&IF(RC[-16]="",,"|n"&R1C19&RC[-16])&IF(RC[-15]="",,"|n"&R1C20&RC[-15])&IF(RC[-14]="",,"|n"&R1C21&RC[-14])&IF(RC[-13]="",,"|n"&R1C22&RC[-13])&IF(RC[-11]="",,"|n"&R1C24&RC[-11])&IF(RC[-10]="",,"|n"&R1C25&RC[-10])&IF(RC[-9]="",,"|n"&R1C26&RC[-9])&IF(RC[-8]="",,"|n"&R1C27&RC[-8])&IF(RC[-7]="",,"|n"&R1C28&RC[-7])&IF(RC[-6]="",,"|n"&R1C29&RC[-6])&IF(RC[-2]="",,"|n"&RC[-2]) -> 
AI871: =IF(RC[-27]&RC[-26]&RC[-25]&RC[-24]&RC[-23]&RC[-22]="",,R1C7)&IF(RC[-27]="",,"|n"&R1C8&RC[-27])&IF(RC[-26]="",,"|n"&R1C9&RC[-26])&IF(RC[-25]="",,"|n"&R1C10&RC[-25])&IF(RC[-24]="",,"|n"&R1C11&RC[-24])&IF(RC[-23]="",,"|n"&R1C12&RC[-23])&IF(RC[-22]="",,"|n"&R1C13&RC[-22])&IF(RC[-20]&RC[-19]&RC[-18]&RC[-17]="",,"|n"&R1C14)&IF(RC[-20]="",,"|n"&R1C15&RC[-20])&IF(RC[-19]="",,"|n"&R1C16&RC[-19])&IF(RC[-18]="",,"|n"&R1C17&RC[-18])&IF(RC[-17]="",,"|n"&R1C18&RC[-17])&IF(RC[-16]="",,"|n"&R1C19&RC[-16])&IF(RC[-15]="",,"|n"&R1C20&RC[-15])&IF(RC[-14]="",,"|n"&R1C21&RC[-14])&IF(RC[-13]="",,"|n"&R1C22&RC[-13])&IF(RC[-11]="",,"|n"&R1C24&RC[-11])&IF(RC[-10]="",,"|n"&R1C25&RC[-10])&IF(RC[-9]="",,"|n"&R1C26&RC[-9])&IF(RC[-8]="",,"|n"&R1C27&RC[-8])&IF(RC[-7]="",,"|n"&R1C28&RC[-7])&IF(RC[-6]="",,"|n"&R1C29&RC[-6])&IF(RC[-2]="",,"|n"&RC[-2]) -> 
AI872: =IF(RC[-27]&RC[-26]&RC[-25]&RC[-24]&RC[-23]&RC[-22]="",,R1C7)&IF(RC[-27]="",,"|n"&R1C8&RC[-27])&IF(RC[-26]="",,"|n"&R1C9&RC[-26])&IF(RC[-25]="",,"|n"&R1C10&RC[-25])&IF(RC[-24]="",,"|n"&R1C11&RC[-24])&IF(RC[-23]="",,"|n"&R1C12&RC[-23])&IF(RC[-22]="",,"|n"&R1C13&RC[-22])&IF(RC[-20]&RC[-19]&RC[-18]&RC[-17]="",,"|n"&R1C14)&IF(RC[-20]="",,"|n"&R1C15&RC[-20])&IF(RC[-19]="",,"|n"&R1C16&RC[-19])&IF(RC[-18]="",,"|n"&R1C17&RC[-18])&IF(RC[-17]="",,"|n"&R1C18&RC[-17])&IF(RC[-16]="",,"|n"&R1C19&RC[-16])&IF(RC[-15]="",,"|n"&R1C20&RC[-15])&IF(RC[-14]="",,"|n"&R1C21&RC[-14])&IF(RC[-13]="",,"|n"&R1C22&RC[-13])&IF(RC[-11]="",,"|n"&R1C24&RC[-11])&IF(RC[-10]="",,"|n"&R1C25&RC[-10])&IF(RC[-9]="",,"|n"&R1C26&RC[-9])&IF(RC[-8]="",,"|n"&R1C27&RC[-8])&IF(RC[-7]="",,"|n"&R1C28&RC[-7])&IF(RC[-6]="",,"|n"&R1C29&RC[-6])&IF(RC[-2]="",,"|n"&RC[-2]) -> 
AI873: =IF(RC[-27]&RC[-26]&RC[-25]&RC[-24]&RC[-23]&RC[-22]="",,R1C7)&IF(RC[-27]="",,"|n"&R1C8&RC[-27])&IF(RC[-26]="",,"|n"&R1C9&RC[-26])&IF(RC[-25]="",,"|n"&R1C10&RC[-25])&IF(RC[-24]="",,"|n"&R1C11&RC[-24])&IF(RC[-23]="",,"|n"&R1C12&RC[-23])&IF(RC[-22]="",,"|n"&R1C13&RC[-22])&IF(RC[-20]&RC[-19]&RC[-18]&RC[-17]="",,"|n"&R1C14)&IF(RC[-20]="",,"|n"&R1C15&RC[-20])&IF(RC[-19]="",,"|n"&R1C16&RC[-19])&IF(RC[-18]="",,"|n"&R1C17&RC[-18])&IF(RC[-17]="",,"|n"&R1C18&RC[-17])&IF(RC[-16]="",,"|n"&R1C19&RC[-16])&IF(RC[-15]="",,"|n"&R1C20&RC[-15])&IF(RC[-14]="",,"|n"&R1C21&RC[-14])&IF(RC[-13]="",,"|n"&R1C22&RC[-13])&IF(RC[-11]="",,"|n"&R1C24&RC[-11])&IF(RC[-10]="",,"|n"&R1C25&RC[-10])&IF(RC[-9]="",,"|n"&R1C26&RC[-9])&IF(RC[-8]="",,"|n"&R1C27&RC[-8])&IF(RC[-7]="",,"|n"&R1C28&RC[-7])&IF(RC[-6]="",,"|n"&R1C29&RC[-6])&IF(RC[-2]="",,"|n"&RC[-2]) -> 
AI874: =IF(RC[-27]&RC[-26]&RC[-25]&RC[-24]&RC[-23]&RC[-22]="",,R1C7)&IF(RC[-27]="",,"|n"&R1C8&RC[-27])&IF(RC[-26]="",,"|n"&R1C9&RC[-26])&IF(RC[-25]="",,"|n"&R1C10&RC[-25])&IF(RC[-24]="",,"|n"&R1C11&RC[-24])&IF(RC[-23]="",,"|n"&R1C12&RC[-23])&IF(RC[-22]="",,"|n"&R1C13&RC[-22])&IF(RC[-20]&RC[-19]&RC[-18]&RC[-17]="",,"|n"&R1C14)&IF(RC[-20]="",,"|n"&R1C15&RC[-20])&IF(RC[-19]="",,"|n"&R1C16&RC[-19])&IF(RC[-18]="",,"|n"&R1C17&RC[-18])&IF(RC[-17]="",,"|n"&R1C18&RC[-17])&IF(RC[-16]="",,"|n"&R1C19&RC[-16])&IF(RC[-15]="",,"|n"&R1C20&RC[-15])&IF(RC[-14]="",,"|n"&R1C21&RC[-14])&IF(RC[-13]="",,"|n"&R1C22&RC[-13])&IF(RC[-11]="",,"|n"&R1C24&RC[-11])&IF(RC[-10]="",,"|n"&R1C25&RC[-10])&IF(RC[-9]="",,"|n"&R1C26&RC[-9])&IF(RC[-8]="",,"|n"&R1C27&RC[-8])&IF(RC[-7]="",,"|n"&R1C28&RC[-7])&IF(RC[-6]="",,"|n"&R1C29&RC[-6])&IF(RC[-2]="",,"|n"&RC[-2]) -> 
AI875: =IF(RC[-27]&RC[-26]&RC[-25]&RC[-24]&RC[-23]&RC[-22]="",,R1C7)&IF(RC[-27]="",,"|n"&R1C8&RC[-27])&IF(RC[-26]="",,"|n"&R1C9&RC[-26])&IF(RC[-25]="",,"|n"&R1C10&RC[-25])&IF(RC[-24]="",,"|n"&R1C11&RC[-24])&IF(RC[-23]="",,"|n"&R1C12&RC[-23])&IF(RC[-22]="",,"|n"&R1C13&RC[-22])&IF(RC[-20]&RC[-19]&RC[-18]&RC[-17]="",,"|n"&R1C14)&IF(RC[-20]="",,"|n"&R1C15&RC[-20])&IF(RC[-19]="",,"|n"&R1C16&RC[-19])&IF(RC[-18]="",,"|n"&R1C17&RC[-18])&IF(RC[-17]="",,"|n"&R1C18&RC[-17])&IF(RC[-16]="",,"|n"&R1C19&RC[-16])&IF(RC[-15]="",,"|n"&R1C20&RC[-15])&IF(RC[-14]="",,"|n"&R1C21&RC[-14])&IF(RC[-13]="",,"|n"&R1C22&RC[-13])&IF(RC[-11]="",,"|n"&R1C24&RC[-11])&IF(RC[-10]="",,"|n"&R1C25&RC[-10])&IF(RC[-9]="",,"|n"&R1C26&RC[-9])&IF(RC[-8]="",,"|n"&R1C27&RC[-8])&IF(RC[-7]="",,"|n"&R1C28&RC[-7])&IF(RC[-6]="",,"|n"&R1C29&RC[-6])&IF(RC[-2]="",,"|n"&RC[-2]) -> 
AI876: =IF(RC[-27]&RC[-26]&RC[-25]&RC[-24]&RC[-23]&RC[-22]="",,R1C7)&IF(RC[-27]="",,"|n"&R1C8&RC[-27])&IF(RC[-26]="",,"|n"&R1C9&RC[-26])&IF(RC[-25]="",,"|n"&R1C10&RC[-25])&IF(RC[-24]="",,"|n"&R1C11&RC[-24])&IF(RC[-23]="",,"|n"&R1C12&RC[-23])&IF(RC[-22]="",,"|n"&R1C13&RC[-22])&IF(RC[-20]&RC[-19]&RC[-18]&RC[-17]="",,"|n"&R1C14)&IF(RC[-20]="",,"|n"&R1C15&RC[-20])&IF(RC[-19]="",,"|n"&R1C16&RC[-19])&IF(RC[-18]="",,"|n"&R1C17&RC[-18])&IF(RC[-17]="",,"|n"&R1C18&RC[-17])&IF(RC[-16]="",,"|n"&R1C19&RC[-16])&IF(RC[-15]="",,"|n"&R1C20&RC[-15])&IF(RC[-14]="",,"|n"&R1C21&RC[-14])&IF(RC[-13]="",,"|n"&R1C22&RC[-13])&IF(RC[-11]="",,"|n"&R1C24&RC[-11])&IF(RC[-10]="",,"|n"&R1C25&RC[-10])&IF(RC[-9]="",,"|n"&R1C26&RC[-9])&IF(RC[-8]="",,"|n"&R1C27&RC[-8])&IF(RC[-7]="",,"|n"&R1C28&RC[-7])&IF(RC[-6]="",,"|n"&R1C29&RC[-6])&IF(RC[-2]="",,"|n"&RC[-2]) -> 
AI877: =IF(RC[-27]&RC[-26]&RC[-25]&RC[-24]&RC[-23]&RC[-22]="",,R1C7)&IF(RC[-27]="",,"|n"&R1C8&RC[-27])&IF(RC[-26]="",,"|n"&R1C9&RC[-26])&IF(RC[-25]="",,"|n"&R1C10&RC[-25])&IF(RC[-24]="",,"|n"&R1C11&RC[-24])&IF(RC[-23]="",,"|n"&R1C12&RC[-23])&IF(RC[-22]="",,"|n"&R1C13&RC[-22])&IF(RC[-20]&RC[-19]&RC[-18]&RC[-17]="",,"|n"&R1C14)&IF(RC[-20]="",,"|n"&R1C15&RC[-20])&IF(RC[-19]="",,"|n"&R1C16&RC[-19])&IF(RC[-18]="",,"|n"&R1C17&RC[-18])&IF(RC[-17]="",,"|n"&R1C18&RC[-17])&IF(RC[-16]="",,"|n"&R1C19&RC[-16])&IF(RC[-15]="",,"|n"&R1C20&RC[-15])&IF(RC[-14]="",,"|n"&R1C21&RC[-14])&IF(RC[-13]="",,"|n"&R1C22&RC[-13])&IF(RC[-11]="",,"|n"&R1C24&RC[-11])&IF(RC[-10]="",,"|n"&R1C25&RC[-10])&IF(RC[-9]="",,"|n"&R1C26&RC[-9])&IF(RC[-8]="",,"|n"&R1C27&RC[-8])&IF(RC[-7]="",,"|n"&R1C28&RC[-7])&IF(RC[-6]="",,"|n"&R1C29&RC[-6])&IF(RC[-2]="",,"|n"&RC[-2]) -> 
AI878: =IF(RC[-27]&RC[-26]&RC[-25]&RC[-24]&RC[-23]&RC[-22]="",,R1C7)&IF(RC[-27]="",,"|n"&R1C8&RC[-27])&IF(RC[-26]="",,"|n"&R1C9&RC[-26])&IF(RC[-25]="",,"|n"&R1C10&RC[-25])&IF(RC[-24]="",,"|n"&R1C11&RC[-24])&IF(RC[-23]="",,"|n"&R1C12&RC[-23])&IF(RC[-22]="",,"|n"&R1C13&RC[-22])&IF(RC[-20]&RC[-19]&RC[-18]&RC[-17]="",,"|n"&R1C14)&IF(RC[-20]="",,"|n"&R1C15&RC[-20])&IF(RC[-19]="",,"|n"&R1C16&RC[-19])&IF(RC[-18]="",,"|n"&R1C17&RC[-18])&IF(RC[-17]="",,"|n"&R1C18&RC[-17])&IF(RC[-16]="",,"|n"&R1C19&RC[-16])&IF(RC[-15]="",,"|n"&R1C20&RC[-15])&IF(RC[-14]="",,"|n"&R1C21&RC[-14])&IF(RC[-13]="",,"|n"&R1C22&RC[-13])&IF(RC[-11]="",,"|n"&R1C24&RC[-11])&IF(RC[-10]="",,"|n"&R1C25&RC[-10])&IF(RC[-9]="",,"|n"&R1C26&RC[-9])&IF(RC[-8]="",,"|n"&R1C27&RC[-8])&IF(RC[-7]="",,"|n"&R1C28&RC[-7])&IF(RC[-6]="",,"|n"&R1C29&RC[-6])&IF(RC[-2]="",,"|n"&RC[-2]) -> 
AI879: =IF(RC[-27]&RC[-26]&RC[-25]&RC[-24]&RC[-23]&RC[-22]="",,R1C7)&IF(RC[-27]="",,"|n"&R1C8&RC[-27])&IF(RC[-26]="",,"|n"&R1C9&RC[-26])&IF(RC[-25]="",,"|n"&R1C10&RC[-25])&IF(RC[-24]="",,"|n"&R1C11&RC[-24])&IF(RC[-23]="",,"|n"&R1C12&RC[-23])&IF(RC[-22]="",,"|n"&R1C13&RC[-22])&IF(RC[-20]&RC[-19]&RC[-18]&RC[-17]="",,"|n"&R1C14)&IF(RC[-20]="",,"|n"&R1C15&RC[-20])&IF(RC[-19]="",,"|n"&R1C16&RC[-19])&IF(RC[-18]="",,"|n"&R1C17&RC[-18])&IF(RC[-17]="",,"|n"&R1C18&RC[-17])&IF(RC[-16]="",,"|n"&R1C19&RC[-16])&IF(RC[-15]="",,"|n"&R1C20&RC[-15])&IF(RC[-14]="",,"|n"&R1C21&RC[-14])&IF(RC[-13]="",,"|n"&R1C22&RC[-13])&IF(RC[-11]="",,"|n"&R1C24&RC[-11])&IF(RC[-10]="",,"|n"&R1C25&RC[-10])&IF(RC[-9]="",,"|n"&R1C26&RC[-9])&IF(RC[-8]="",,"|n"&R1C27&RC[-8])&IF(RC[-7]="",,"|n"&R1C28&RC[-7])&IF(RC[-6]="",,"|n"&R1C29&RC[-6])&IF(RC[-2]="",,"|n"&RC[-2]) -> 
AI880: =IF(RC[-27]&RC[-26]&RC[-25]&RC[-24]&RC[-23]&RC[-22]="",,R1C7)&IF(RC[-27]="",,"|n"&R1C8&RC[-27])&IF(RC[-26]="",,"|n"&R1C9&RC[-26])&IF(RC[-25]="",,"|n"&R1C10&RC[-25])&IF(RC[-24]="",,"|n"&R1C11&RC[-24])&IF(RC[-23]="",,"|n"&R1C12&RC[-23])&IF(RC[-22]="",,"|n"&R1C13&RC[-22])&IF(RC[-20]&RC[-19]&RC[-18]&RC[-17]="",,"|n"&R1C14)&IF(RC[-20]="",,"|n"&R1C15&RC[-20])&IF(RC[-19]="",,"|n"&R1C16&RC[-19])&IF(RC[-18]="",,"|n"&R1C17&RC[-18])&IF(RC[-17]="",,"|n"&R1C18&RC[-17])&IF(RC[-16]="",,"|n"&R1C19&RC[-16])&IF(RC[-15]="",,"|n"&R1C20&RC[-15])&IF(RC[-14]="",,"|n"&R1C21&RC[-14])&IF(RC[-13]="",,"|n"&R1C22&RC[-13])&IF(RC[-11]="",,"|n"&R1C24&RC[-11])&IF(RC[-10]="",,"|n"&R1C25&RC[-10])&IF(RC[-9]="",,"|n"&R1C26&RC[-9])&IF(RC[-8]="",,"|n"&R1C27&RC[-8])&IF(RC[-7]="",,"|n"&R1C28&RC[-7])&IF(RC[-6]="",,"|n"&R1C29&RC[-6])&IF(RC[-2]="",,"|n"&RC[-2]) -> 
AI881: =IF(RC[-27]&RC[-26]&RC[-25]&RC[-24]&RC[-23]&RC[-22]="",,R1C7)&IF(RC[-27]="",,"|n"&R1C8&RC[-27])&IF(RC[-26]="",,"|n"&R1C9&RC[-26])&IF(RC[-25]="",,"|n"&R1C10&RC[-25])&IF(RC[-24]="",,"|n"&R1C11&RC[-24])&IF(RC[-23]="",,"|n"&R1C12&RC[-23])&IF(RC[-22]="",,"|n"&R1C13&RC[-22])&IF(RC[-20]&RC[-19]&RC[-18]&RC[-17]="",,"|n"&R1C14)&IF(RC[-20]="",,"|n"&R1C15&RC[-20])&IF(RC[-19]="",,"|n"&R1C16&RC[-19])&IF(RC[-18]="",,"|n"&R1C17&RC[-18])&IF(RC[-17]="",,"|n"&R1C18&RC[-17])&IF(RC[-16]="",,"|n"&R1C19&RC[-16])&IF(RC[-15]="",,"|n"&R1C20&RC[-15])&IF(RC[-14]="",,"|n"&R1C21&RC[-14])&IF(RC[-13]="",,"|n"&R1C22&RC[-13])&IF(RC[-11]="",,"|n"&R1C24&RC[-11])&IF(RC[-10]="",,"|n"&R1C25&RC[-10])&IF(RC[-9]="",,"|n"&R1C26&RC[-9])&IF(RC[-8]="",,"|n"&R1C27&RC[-8])&IF(RC[-7]="",,"|n"&R1C28&RC[-7])&IF(RC[-6]="",,"|n"&R1C29&RC[-6])&IF(RC[-2]="",,"|n"&RC[-2]) -> 
AI882: =IF(RC[-27]&RC[-26]&RC[-25]&RC[-24]&RC[-23]&RC[-22]="",,R1C7)&IF(RC[-27]="",,"|n"&R1C8&RC[-27])&IF(RC[-26]="",,"|n"&R1C9&RC[-26])&IF(RC[-25]="",,"|n"&R1C10&RC[-25])&IF(RC[-24]="",,"|n"&R1C11&RC[-24])&IF(RC[-23]="",,"|n"&R1C12&RC[-23])&IF(RC[-22]="",,"|n"&R1C13&RC[-22])&IF(RC[-20]&RC[-19]&RC[-18]&RC[-17]="",,"|n"&R1C14)&IF(RC[-20]="",,"|n"&R1C15&RC[-20])&IF(RC[-19]="",,"|n"&R1C16&RC[-19])&IF(RC[-18]="",,"|n"&R1C17&RC[-18])&IF(RC[-17]="",,"|n"&R1C18&RC[-17])&IF(RC[-16]="",,"|n"&R1C19&RC[-16])&IF(RC[-15]="",,"|n"&R1C20&RC[-15])&IF(RC[-14]="",,"|n"&R1C21&RC[-14])&IF(RC[-13]="",,"|n"&R1C22&RC[-13])&IF(RC[-11]="",,"|n"&R1C24&RC[-11])&IF(RC[-10]="",,"|n"&R1C25&RC[-10])&IF(RC[-9]="",,"|n"&R1C26&RC[-9])&IF(RC[-8]="",,"|n"&R1C27&RC[-8])&IF(RC[-7]="",,"|n"&R1C28&RC[-7])&IF(RC[-6]="",,"|n"&R1C29&RC[-6])&IF(RC[-2]="",,"|n"&RC[-2]) -> 
AI883: =IF(RC[-27]&RC[-26]&RC[-25]&RC[-24]&RC[-23]&RC[-22]="",,R1C7)&IF(RC[-27]="",,"|n"&R1C8&RC[-27])&IF(RC[-26]="",,"|n"&R1C9&RC[-26])&IF(RC[-25]="",,"|n"&R1C10&RC[-25])&IF(RC[-24]="",,"|n"&R1C11&RC[-24])&IF(RC[-23]="",,"|n"&R1C12&RC[-23])&IF(RC[-22]="",,"|n"&R1C13&RC[-22])&IF(RC[-20]&RC[-19]&RC[-18]&RC[-17]="",,"|n"&R1C14)&IF(RC[-20]="",,"|n"&R1C15&RC[-20])&IF(RC[-19]="",,"|n"&R1C16&RC[-19])&IF(RC[-18]="",,"|n"&R1C17&RC[-18])&IF(RC[-17]="",,"|n"&R1C18&RC[-17])&IF(RC[-16]="",,"|n"&R1C19&RC[-16])&IF(RC[-15]="",,"|n"&R1C20&RC[-15])&IF(RC[-14]="",,"|n"&R1C21&RC[-14])&IF(RC[-13]="",,"|n"&R1C22&RC[-13])&IF(RC[-11]="",,"|n"&R1C24&RC[-11])&IF(RC[-10]="",,"|n"&R1C25&RC[-10])&IF(RC[-9]="",,"|n"&R1C26&RC[-9])&IF(RC[-8]="",,"|n"&R1C27&RC[-8])&IF(RC[-7]="",,"|n"&R1C28&RC[-7])&IF(RC[-6]="",,"|n"&R1C29&RC[-6])&IF(RC[-2]="",,"|n"&RC[-2]) -> 
AI884: =IF(RC[-27]&RC[-26]&RC[-25]&RC[-24]&RC[-23]&RC[-22]="",,R1C7)&IF(RC[-27]="",,"|n"&R1C8&RC[-27])&IF(RC[-26]="",,"|n"&R1C9&RC[-26])&IF(RC[-25]="",,"|n"&R1C10&RC[-25])&IF(RC[-24]="",,"|n"&R1C11&RC[-24])&IF(RC[-23]="",,"|n"&R1C12&RC[-23])&IF(RC[-22]="",,"|n"&R1C13&RC[-22])&IF(RC[-20]&RC[-19]&RC[-18]&RC[-17]="",,"|n"&R1C14)&IF(RC[-20]="",,"|n"&R1C15&RC[-20])&IF(RC[-19]="",,"|n"&R1C16&RC[-19])&IF(RC[-18]="",,"|n"&R1C17&RC[-18])&IF(RC[-17]="",,"|n"&R1C18&RC[-17])&IF(RC[-16]="",,"|n"&R1C19&RC[-16])&IF(RC[-15]="",,"|n"&R1C20&RC[-15])&IF(RC[-14]="",,"|n"&R1C21&RC[-14])&IF(RC[-13]="",,"|n"&R1C22&RC[-13])&IF(RC[-11]="",,"|n"&R1C24&RC[-11])&IF(RC[-10]="",,"|n"&R1C25&RC[-10])&IF(RC[-9]="",,"|n"&R1C26&RC[-9])&IF(RC[-8]="",,"|n"&R1C27&RC[-8])&IF(RC[-7]="",,"|n"&R1C28&RC[-7])&IF(RC[-6]="",,"|n"&R1C29&RC[-6])&IF(RC[-2]="",,"|n"&RC[-2]) -> 
AI885: =IF(RC[-27]&RC[-26]&RC[-25]&RC[-24]&RC[-23]&RC[-22]="",,R1C7)&IF(RC[-27]="",,"|n"&R1C8&RC[-27])&IF(RC[-26]="",,"|n"&R1C9&RC[-26])&IF(RC[-25]="",,"|n"&R1C10&RC[-25])&IF(RC[-24]="",,"|n"&R1C11&RC[-24])&IF(RC[-23]="",,"|n"&R1C12&RC[-23])&IF(RC[-22]="",,"|n"&R1C13&RC[-22])&IF(RC[-20]&RC[-19]&RC[-18]&RC[-17]="",,"|n"&R1C14)&IF(RC[-20]="",,"|n"&R1C15&RC[-20])&IF(RC[-19]="",,"|n"&R1C16&RC[-19])&IF(RC[-18]="",,"|n"&R1C17&RC[-18])&IF(RC[-17]="",,"|n"&R1C18&RC[-17])&IF(RC[-16]="",,"|n"&R1C19&RC[-16])&IF(RC[-15]="",,"|n"&R1C20&RC[-15])&IF(RC[-14]="",,"|n"&R1C21&RC[-14])&IF(RC[-13]="",,"|n"&R1C22&RC[-13])&IF(RC[-11]="",,"|n"&R1C24&RC[-11])&IF(RC[-10]="",,"|n"&R1C25&RC[-10])&IF(RC[-9]="",,"|n"&R1C26&RC[-9])&IF(RC[-8]="",,"|n"&R1C27&RC[-8])&IF(RC[-7]="",,"|n"&R1C28&RC[-7])&IF(RC[-6]="",,"|n"&R1C29&RC[-6])&IF(RC[-2]="",,"|n"&RC[-2]) -> 
AI886: =IF(RC[-27]&RC[-26]&RC[-25]&RC[-24]&RC[-23]&RC[-22]="",,R1C7)&IF(RC[-27]="",,"|n"&R1C8&RC[-27])&IF(RC[-26]="",,"|n"&R1C9&RC[-26])&IF(RC[-25]="",,"|n"&R1C10&RC[-25])&IF(RC[-24]="",,"|n"&R1C11&RC[-24])&IF(RC[-23]="",,"|n"&R1C12&RC[-23])&IF(RC[-22]="",,"|n"&R1C13&RC[-22])&IF(RC[-20]&RC[-19]&RC[-18]&RC[-17]="",,"|n"&R1C14)&IF(RC[-20]="",,"|n"&R1C15&RC[-20])&IF(RC[-19]="",,"|n"&R1C16&RC[-19])&IF(RC[-18]="",,"|n"&R1C17&RC[-18])&IF(RC[-17]="",,"|n"&R1C18&RC[-17])&IF(RC[-16]="",,"|n"&R1C19&RC[-16])&IF(RC[-15]="",,"|n"&R1C20&RC[-15])&IF(RC[-14]="",,"|n"&R1C21&RC[-14])&IF(RC[-13]="",,"|n"&R1C22&RC[-13])&IF(RC[-11]="",,"|n"&R1C24&RC[-11])&IF(RC[-10]="",,"|n"&R1C25&RC[-10])&IF(RC[-9]="",,"|n"&R1C26&RC[-9])&IF(RC[-8]="",,"|n"&R1C27&RC[-8])&IF(RC[-7]="",,"|n"&R1C28&RC[-7])&IF(RC[-6]="",,"|n"&R1C29&RC[-6])&IF(RC[-2]="",,"|n"&RC[-2]) -> 
AI887: =IF(RC[-27]&RC[-26]&RC[-25]&RC[-24]&RC[-23]&RC[-22]="",,R1C7)&IF(RC[-27]="",,"|n"&R1C8&RC[-27])&IF(RC[-26]="",,"|n"&R1C9&RC[-26])&IF(RC[-25]="",,"|n"&R1C10&RC[-25])&IF(RC[-24]="",,"|n"&R1C11&RC[-24])&IF(RC[-23]="",,"|n"&R1C12&RC[-23])&IF(RC[-22]="",,"|n"&R1C13&RC[-22])&IF(RC[-20]&RC[-19]&RC[-18]&RC[-17]="",,"|n"&R1C14)&IF(RC[-20]="",,"|n"&R1C15&RC[-20])&IF(RC[-19]="",,"|n"&R1C16&RC[-19])&IF(RC[-18]="",,"|n"&R1C17&RC[-18])&IF(RC[-17]="",,"|n"&R1C18&RC[-17])&IF(RC[-16]="",,"|n"&R1C19&RC[-16])&IF(RC[-15]="",,"|n"&R1C20&RC[-15])&IF(RC[-14]="",,"|n"&R1C21&RC[-14])&IF(RC[-13]="",,"|n"&R1C22&RC[-13])&IF(RC[-11]="",,"|n"&R1C24&RC[-11])&IF(RC[-10]="",,"|n"&R1C25&RC[-10])&IF(RC[-9]="",,"|n"&R1C26&RC[-9])&IF(RC[-8]="",,"|n"&R1C27&RC[-8])&IF(RC[-7]="",,"|n"&R1C28&RC[-7])&IF(RC[-6]="",,"|n"&R1C29&RC[-6])&IF(RC[-2]="",,"|n"&RC[-2]) -> 
AI888: =IF(RC[-27]&RC[-26]&RC[-25]&RC[-24]&RC[-23]&RC[-22]="",,R1C7)&IF(RC[-27]="",,"|n"&R1C8&RC[-27])&IF(RC[-26]="",,"|n"&R1C9&RC[-26])&IF(RC[-25]="",,"|n"&R1C10&RC[-25])&IF(RC[-24]="",,"|n"&R1C11&RC[-24])&IF(RC[-23]="",,"|n"&R1C12&RC[-23])&IF(RC[-22]="",,"|n"&R1C13&RC[-22])&IF(RC[-20]&RC[-19]&RC[-18]&RC[-17]="",,"|n"&R1C14)&IF(RC[-20]="",,"|n"&R1C15&RC[-20])&IF(RC[-19]="",,"|n"&R1C16&RC[-19])&IF(RC[-18]="",,"|n"&R1C17&RC[-18])&IF(RC[-17]="",,"|n"&R1C18&RC[-17])&IF(RC[-16]="",,"|n"&R1C19&RC[-16])&IF(RC[-15]="",,"|n"&R1C20&RC[-15])&IF(RC[-14]="",,"|n"&R1C21&RC[-14])&IF(RC[-13]="",,"|n"&R1C22&RC[-13])&IF(RC[-11]="",,"|n"&R1C24&RC[-11])&IF(RC[-10]="",,"|n"&R1C25&RC[-10])&IF(RC[-9]="",,"|n"&R1C26&RC[-9])&IF(RC[-8]="",,"|n"&R1C27&RC[-8])&IF(RC[-7]="",,"|n"&R1C28&RC[-7])&IF(RC[-6]="",,"|n"&R1C29&RC[-6])&IF(RC[-2]="",,"|n"&RC[-2]) -> 
AI889: =IF(RC[-27]&RC[-26]&RC[-25]&RC[-24]&RC[-23]&RC[-22]="",,R1C7)&IF(RC[-27]="",,"|n"&R1C8&RC[-27])&IF(RC[-26]="",,"|n"&R1C9&RC[-26])&IF(RC[-25]="",,"|n"&R1C10&RC[-25])&IF(RC[-24]="",,"|n"&R1C11&RC[-24])&IF(RC[-23]="",,"|n"&R1C12&RC[-23])&IF(RC[-22]="",,"|n"&R1C13&RC[-22])&IF(RC[-20]&RC[-19]&RC[-18]&RC[-17]="",,"|n"&R1C14)&IF(RC[-20]="",,"|n"&R1C15&RC[-20])&IF(RC[-19]="",,"|n"&R1C16&RC[-19])&IF(RC[-18]="",,"|n"&R1C17&RC[-18])&IF(RC[-17]="",,"|n"&R1C18&RC[-17])&IF(RC[-16]="",,"|n"&R1C19&RC[-16])&IF(RC[-15]="",,"|n"&R1C20&RC[-15])&IF(RC[-14]="",,"|n"&R1C21&RC[-14])&IF(RC[-13]="",,"|n"&R1C22&RC[-13])&IF(RC[-11]="",,"|n"&R1C24&RC[-11])&IF(RC[-10]="",,"|n"&R1C25&RC[-10])&IF(RC[-9]="",,"|n"&R1C26&RC[-9])&IF(RC[-8]="",,"|n"&R1C27&RC[-8])&IF(RC[-7]="",,"|n"&R1C28&RC[-7])&IF(RC[-6]="",,"|n"&R1C29&RC[-6])&IF(RC[-2]="",,"|n"&RC[-2]) -> 
AI890: =IF(RC[-27]&RC[-26]&RC[-25]&RC[-24]&RC[-23]&RC[-22]="",,R1C7)&IF(RC[-27]="",,"|n"&R1C8&RC[-27])&IF(RC[-26]="",,"|n"&R1C9&RC[-26])&IF(RC[-25]="",,"|n"&R1C10&RC[-25])&IF(RC[-24]="",,"|n"&R1C11&RC[-24])&IF(RC[-23]="",,"|n"&R1C12&RC[-23])&IF(RC[-22]="",,"|n"&R1C13&RC[-22])&IF(RC[-20]&RC[-19]&RC[-18]&RC[-17]="",,"|n"&R1C14)&IF(RC[-20]="",,"|n"&R1C15&RC[-20])&IF(RC[-19]="",,"|n"&R1C16&RC[-19])&IF(RC[-18]="",,"|n"&R1C17&RC[-18])&IF(RC[-17]="",,"|n"&R1C18&RC[-17])&IF(RC[-16]="",,"|n"&R1C19&RC[-16])&IF(RC[-15]="",,"|n"&R1C20&RC[-15])&IF(RC[-14]="",,"|n"&R1C21&RC[-14])&IF(RC[-13]="",,"|n"&R1C22&RC[-13])&IF(RC[-11]="",,"|n"&R1C24&RC[-11])&IF(RC[-10]="",,"|n"&R1C25&RC[-10])&IF(RC[-9]="",,"|n"&R1C26&RC[-9])&IF(RC[-8]="",,"|n"&R1C27&RC[-8])&IF(RC[-7]="",,"|n"&R1C28&RC[-7])&IF(RC[-6]="",,"|n"&R1C29&RC[-6])&IF(RC[-2]="",,"|n"&RC[-2]) -> 
AI891: =IF(RC[-27]&RC[-26]&RC[-25]&RC[-24]&RC[-23]&RC[-22]="",,R1C7)&IF(RC[-27]="",,"|n"&R1C8&RC[-27])&IF(RC[-26]="",,"|n"&R1C9&RC[-26])&IF(RC[-25]="",,"|n"&R1C10&RC[-25])&IF(RC[-24]="",,"|n"&R1C11&RC[-24])&IF(RC[-23]="",,"|n"&R1C12&RC[-23])&IF(RC[-22]="",,"|n"&R1C13&RC[-22])&IF(RC[-20]&RC[-19]&RC[-18]&RC[-17]="",,"|n"&R1C14)&IF(RC[-20]="",,"|n"&R1C15&RC[-20])&IF(RC[-19]="",,"|n"&R1C16&RC[-19])&IF(RC[-18]="",,"|n"&R1C17&RC[-18])&IF(RC[-17]="",,"|n"&R1C18&RC[-17])&IF(RC[-16]="",,"|n"&R1C19&RC[-16])&IF(RC[-15]="",,"|n"&R1C20&RC[-15])&IF(RC[-14]="",,"|n"&R1C21&RC[-14])&IF(RC[-13]="",,"|n"&R1C22&RC[-13])&IF(RC[-11]="",,"|n"&R1C24&RC[-11])&IF(RC[-10]="",,"|n"&R1C25&RC[-10])&IF(RC[-9]="",,"|n"&R1C26&RC[-9])&IF(RC[-8]="",,"|n"&R1C27&RC[-8])&IF(RC[-7]="",,"|n"&R1C28&RC[-7])&IF(RC[-6]="",,"|n"&R1C29&RC[-6])&IF(RC[-2]="",,"|n"&RC[-2]) -> 
AI892: =IF(RC[-27]&RC[-26]&RC[-25]&RC[-24]&RC[-23]&RC[-22]="",,R1C7)&IF(RC[-27]="",,"|n"&R1C8&RC[-27])&IF(RC[-26]="",,"|n"&R1C9&RC[-26])&IF(RC[-25]="",,"|n"&R1C10&RC[-25])&IF(RC[-24]="",,"|n"&R1C11&RC[-24])&IF(RC[-23]="",,"|n"&R1C12&RC[-23])&IF(RC[-22]="",,"|n"&R1C13&RC[-22])&IF(RC[-20]&RC[-19]&RC[-18]&RC[-17]="",,"|n"&R1C14)&IF(RC[-20]="",,"|n"&R1C15&RC[-20])&IF(RC[-19]="",,"|n"&R1C16&RC[-19])&IF(RC[-18]="",,"|n"&R1C17&RC[-18])&IF(RC[-17]="",,"|n"&R1C18&RC[-17])&IF(RC[-16]="",,"|n"&R1C19&RC[-16])&IF(RC[-15]="",,"|n"&R1C20&RC[-15])&IF(RC[-14]="",,"|n"&R1C21&RC[-14])&IF(RC[-13]="",,"|n"&R1C22&RC[-13])&IF(RC[-11]="",,"|n"&R1C24&RC[-11])&IF(RC[-10]="",,"|n"&R1C25&RC[-10])&IF(RC[-9]="",,"|n"&R1C26&RC[-9])&IF(RC[-8]="",,"|n"&R1C27&RC[-8])&IF(RC[-7]="",,"|n"&R1C28&RC[-7])&IF(RC[-6]="",,"|n"&R1C29&RC[-6])&IF(RC[-2]="",,"|n"&RC[-2]) -> 
AI893: =IF(RC[-27]&RC[-26]&RC[-25]&RC[-24]&RC[-23]&RC[-22]="",,R1C7)&IF(RC[-27]="",,"|n"&R1C8&RC[-27])&IF(RC[-26]="",,"|n"&R1C9&RC[-26])&IF(RC[-25]="",,"|n"&R1C10&RC[-25])&IF(RC[-24]="",,"|n"&R1C11&RC[-24])&IF(RC[-23]="",,"|n"&R1C12&RC[-23])&IF(RC[-22]="",,"|n"&R1C13&RC[-22])&IF(RC[-20]&RC[-19]&RC[-18]&RC[-17]="",,"|n"&R1C14)&IF(RC[-20]="",,"|n"&R1C15&RC[-20])&IF(RC[-19]="",,"|n"&R1C16&RC[-19])&IF(RC[-18]="",,"|n"&R1C17&RC[-18])&IF(RC[-17]="",,"|n"&R1C18&RC[-17])&IF(RC[-16]="",,"|n"&R1C19&RC[-16])&IF(RC[-15]="",,"|n"&R1C20&RC[-15])&IF(RC[-14]="",,"|n"&R1C21&RC[-14])&IF(RC[-13]="",,"|n"&R1C22&RC[-13])&IF(RC[-11]="",,"|n"&R1C24&RC[-11])&IF(RC[-10]="",,"|n"&R1C25&RC[-10])&IF(RC[-9]="",,"|n"&R1C26&RC[-9])&IF(RC[-8]="",,"|n"&R1C27&RC[-8])&IF(RC[-7]="",,"|n"&R1C28&RC[-7])&IF(RC[-6]="",,"|n"&R1C29&RC[-6])&IF(RC[-2]="",,"|n"&RC[-2]) -> 
AI894: =IF(RC[-27]&RC[-26]&RC[-25]&RC[-24]&RC[-23]&RC[-22]="",,R1C7)&IF(RC[-27]="",,"|n"&R1C8&RC[-27])&IF(RC[-26]="",,"|n"&R1C9&RC[-26])&IF(RC[-25]="",,"|n"&R1C10&RC[-25])&IF(RC[-24]="",,"|n"&R1C11&RC[-24])&IF(RC[-23]="",,"|n"&R1C12&RC[-23])&IF(RC[-22]="",,"|n"&R1C13&RC[-22])&IF(RC[-20]&RC[-19]&RC[-18]&RC[-17]="",,"|n"&R1C14)&IF(RC[-20]="",,"|n"&R1C15&RC[-20])&IF(RC[-19]="",,"|n"&R1C16&RC[-19])&IF(RC[-18]="",,"|n"&R1C17&RC[-18])&IF(RC[-17]="",,"|n"&R1C18&RC[-17])&IF(RC[-16]="",,"|n"&R1C19&RC[-16])&IF(RC[-15]="",,"|n"&R1C20&RC[-15])&IF(RC[-14]="",,"|n"&R1C21&RC[-14])&IF(RC[-13]="",,"|n"&R1C22&RC[-13])&IF(RC[-11]="",,"|n"&R1C24&RC[-11])&IF(RC[-10]="",,"|n"&R1C25&RC[-10])&IF(RC[-9]="",,"|n"&R1C26&RC[-9])&IF(RC[-8]="",,"|n"&R1C27&RC[-8])&IF(RC[-7]="",,"|n"&R1C28&RC[-7])&IF(RC[-6]="",,"|n"&R1C29&RC[-6])&IF(RC[-2]="",,"|n"&RC[-2]) -> 
AI895: =IF(RC[-27]&RC[-26]&RC[-25]&RC[-24]&RC[-23]&RC[-22]="",,R1C7)&IF(RC[-27]="",,"|n"&R1C8&RC[-27])&IF(RC[-26]="",,"|n"&R1C9&RC[-26])&IF(RC[-25]="",,"|n"&R1C10&RC[-25])&IF(RC[-24]="",,"|n"&R1C11&RC[-24])&IF(RC[-23]="",,"|n"&R1C12&RC[-23])&IF(RC[-22]="",,"|n"&R1C13&RC[-22])&IF(RC[-20]&RC[-19]&RC[-18]&RC[-17]="",,"|n"&R1C14)&IF(RC[-20]="",,"|n"&R1C15&RC[-20])&IF(RC[-19]="",,"|n"&R1C16&RC[-19])&IF(RC[-18]="",,"|n"&R1C17&RC[-18])&IF(RC[-17]="",,"|n"&R1C18&RC[-17])&IF(RC[-16]="",,"|n"&R1C19&RC[-16])&IF(RC[-15]="",,"|n"&R1C20&RC[-15])&IF(RC[-14]="",,"|n"&R1C21&RC[-14])&IF(RC[-13]="",,"|n"&R1C22&RC[-13])&IF(RC[-11]="",,"|n"&R1C24&RC[-11])&IF(RC[-10]="",,"|n"&R1C25&RC[-10])&IF(RC[-9]="",,"|n"&R1C26&RC[-9])&IF(RC[-8]="",,"|n"&R1C27&RC[-8])&IF(RC[-7]="",,"|n"&R1C28&RC[-7])&IF(RC[-6]="",,"|n"&R1C29&RC[-6])&IF(RC[-2]="",,"|n"&RC[-2]) -> 
AI896: =IF(RC[-27]&RC[-26]&RC[-25]&RC[-24]&RC[-23]&RC[-22]="",,R1C7)&IF(RC[-27]="",,"|n"&R1C8&RC[-27])&IF(RC[-26]="",,"|n"&R1C9&RC[-26])&IF(RC[-25]="",,"|n"&R1C10&RC[-25])&IF(RC[-24]="",,"|n"&R1C11&RC[-24])&IF(RC[-23]="",,"|n"&R1C12&RC[-23])&IF(RC[-22]="",,"|n"&R1C13&RC[-22])&IF(RC[-20]&RC[-19]&RC[-18]&RC[-17]="",,"|n"&R1C14)&IF(RC[-20]="",,"|n"&R1C15&RC[-20])&IF(RC[-19]="",,"|n"&R1C16&RC[-19])&IF(RC[-18]="",,"|n"&R1C17&RC[-18])&IF(RC[-17]="",,"|n"&R1C18&RC[-17])&IF(RC[-16]="",,"|n"&R1C19&RC[-16])&IF(RC[-15]="",,"|n"&R1C20&RC[-15])&IF(RC[-14]="",,"|n"&R1C21&RC[-14])&IF(RC[-13]="",,"|n"&R1C22&RC[-13])&IF(RC[-11]="",,"|n"&R1C24&RC[-11])&IF(RC[-10]="",,"|n"&R1C25&RC[-10])&IF(RC[-9]="",,"|n"&R1C26&RC[-9])&IF(RC[-8]="",,"|n"&R1C27&RC[-8])&IF(RC[-7]="",,"|n"&R1C28&RC[-7])&IF(RC[-6]="",,"|n"&R1C29&RC[-6])&IF(RC[-2]="",,"|n"&RC[-2]) -> 
AI897: =IF(RC[-27]&RC[-26]&RC[-25]&RC[-24]&RC[-23]&RC[-22]="",,R1C7)&IF(RC[-27]="",,"|n"&R1C8&RC[-27])&IF(RC[-26]="",,"|n"&R1C9&RC[-26])&IF(RC[-25]="",,"|n"&R1C10&RC[-25])&IF(RC[-24]="",,"|n"&R1C11&RC[-24])&IF(RC[-23]="",,"|n"&R1C12&RC[-23])&IF(RC[-22]="",,"|n"&R1C13&RC[-22])&IF(RC[-20]&RC[-19]&RC[-18]&RC[-17]="",,"|n"&R1C14)&IF(RC[-20]="",,"|n"&R1C15&RC[-20])&IF(RC[-19]="",,"|n"&R1C16&RC[-19])&IF(RC[-18]="",,"|n"&R1C17&RC[-18])&IF(RC[-17]="",,"|n"&R1C18&RC[-17])&IF(RC[-16]="",,"|n"&R1C19&RC[-16])&IF(RC[-15]="",,"|n"&R1C20&RC[-15])&IF(RC[-14]="",,"|n"&R1C21&RC[-14])&IF(RC[-13]="",,"|n"&R1C22&RC[-13])&IF(RC[-11]="",,"|n"&R1C24&RC[-11])&IF(RC[-10]="",,"|n"&R1C25&RC[-10])&IF(RC[-9]="",,"|n"&R1C26&RC[-9])&IF(RC[-8]="",,"|n"&R1C27&RC[-8])&IF(RC[-7]="",,"|n"&R1C28&RC[-7])&IF(RC[-6]="",,"|n"&R1C29&RC[-6])&IF(RC[-2]="",,"|n"&RC[-2]) -> 
AI898: =IF(RC[-27]&RC[-26]&RC[-25]&RC[-24]&RC[-23]&RC[-22]="",,R1C7)&IF(RC[-27]="",,"|n"&R1C8&RC[-27])&IF(RC[-26]="",,"|n"&R1C9&RC[-26])&IF(RC[-25]="",,"|n"&R1C10&RC[-25])&IF(RC[-24]="",,"|n"&R1C11&RC[-24])&IF(RC[-23]="",,"|n"&R1C12&RC[-23])&IF(RC[-22]="",,"|n"&R1C13&RC[-22])&IF(RC[-20]&RC[-19]&RC[-18]&RC[-17]="",,"|n"&R1C14)&IF(RC[-20]="",,"|n"&R1C15&RC[-20])&IF(RC[-19]="",,"|n"&R1C16&RC[-19])&IF(RC[-18]="",,"|n"&R1C17&RC[-18])&IF(RC[-17]="",,"|n"&R1C18&RC[-17])&IF(RC[-16]="",,"|n"&R1C19&RC[-16])&IF(RC[-15]="",,"|n"&R1C20&RC[-15])&IF(RC[-14]="",,"|n"&R1C21&RC[-14])&IF(RC[-13]="",,"|n"&R1C22&RC[-13])&IF(RC[-11]="",,"|n"&R1C24&RC[-11])&IF(RC[-10]="",,"|n"&R1C25&RC[-10])&IF(RC[-9]="",,"|n"&R1C26&RC[-9])&IF(RC[-8]="",,"|n"&R1C27&RC[-8])&IF(RC[-7]="",,"|n"&R1C28&RC[-7])&IF(RC[-6]="",,"|n"&R1C29&RC[-6])&IF(RC[-2]="",,"|n"&RC[-2]) -> 
AI899: =IF(RC[-27]&RC[-26]&RC[-25]&RC[-24]&RC[-23]&RC[-22]="",,R1C7)&IF(RC[-27]="",,"|n"&R1C8&RC[-27])&IF(RC[-26]="",,"|n"&R1C9&RC[-26])&IF(RC[-25]="",,"|n"&R1C10&RC[-25])&IF(RC[-24]="",,"|n"&R1C11&RC[-24])&IF(RC[-23]="",,"|n"&R1C12&RC[-23])&IF(RC[-22]="",,"|n"&R1C13&RC[-22])&IF(RC[-20]&RC[-19]&RC[-18]&RC[-17]="",,"|n"&R1C14)&IF(RC[-20]="",,"|n"&R1C15&RC[-20])&IF(RC[-19]="",,"|n"&R1C16&RC[-19])&IF(RC[-18]="",,"|n"&R1C17&RC[-18])&IF(RC[-17]="",,"|n"&R1C18&RC[-17])&IF(RC[-16]="",,"|n"&R1C19&RC[-16])&IF(RC[-15]="",,"|n"&R1C20&RC[-15])&IF(RC[-14]="",,"|n"&R1C21&RC[-14])&IF(RC[-13]="",,"|n"&R1C22&RC[-13])&IF(RC[-11]="",,"|n"&R1C24&RC[-11])&IF(RC[-10]="",,"|n"&R1C25&RC[-10])&IF(RC[-9]="",,"|n"&R1C26&RC[-9])&IF(RC[-8]="",,"|n"&R1C27&RC[-8])&IF(RC[-7]="",,"|n"&R1C28&RC[-7])&IF(RC[-6]="",,"|n"&R1C29&RC[-6])&IF(RC[-2]="",,"|n"&RC[-2]) -> 
AI900: =IF(RC[-27]&RC[-26]&RC[-25]&RC[-24]&RC[-23]&RC[-22]="",,R1C7)&IF(RC[-27]="",,"|n"&R1C8&RC[-27])&IF(RC[-26]="",,"|n"&R1C9&RC[-26])&IF(RC[-25]="",,"|n"&R1C10&RC[-25])&IF(RC[-24]="",,"|n"&R1C11&RC[-24])&IF(RC[-23]="",,"|n"&R1C12&RC[-23])&IF(RC[-22]="",,"|n"&R1C13&RC[-22])&IF(RC[-20]&RC[-19]&RC[-18]&RC[-17]="",,"|n"&R1C14)&IF(RC[-20]="",,"|n"&R1C15&RC[-20])&IF(RC[-19]="",,"|n"&R1C16&RC[-19])&IF(RC[-18]="",,"|n"&R1C17&RC[-18])&IF(RC[-17]="",,"|n"&R1C18&RC[-17])&IF(RC[-16]="",,"|n"&R1C19&RC[-16])&IF(RC[-15]="",,"|n"&R1C20&RC[-15])&IF(RC[-14]="",,"|n"&R1C21&RC[-14])&IF(RC[-13]="",,"|n"&R1C22&RC[-13])&IF(RC[-11]="",,"|n"&R1C24&RC[-11])&IF(RC[-10]="",,"|n"&R1C25&RC[-10])&IF(RC[-9]="",,"|n"&R1C26&RC[-9])&IF(RC[-8]="",,"|n"&R1C27&RC[-8])&IF(RC[-7]="",,"|n"&R1C28&RC[-7])&IF(RC[-6]="",,"|n"&R1C29&RC[-6])&IF(RC[-2]="",,"|n"&RC[-2]) -> 
AI901: =IF(RC[-27]&RC[-26]&RC[-25]&RC[-24]&RC[-23]&RC[-22]="",,R1C7)&IF(RC[-27]="",,"|n"&R1C8&RC[-27])&IF(RC[-26]="",,"|n"&R1C9&RC[-26])&IF(RC[-25]="",,"|n"&R1C10&RC[-25])&IF(RC[-24]="",,"|n"&R1C11&RC[-24])&IF(RC[-23]="",,"|n"&R1C12&RC[-23])&IF(RC[-22]="",,"|n"&R1C13&RC[-22])&IF(RC[-20]&RC[-19]&RC[-18]&RC[-17]="",,"|n"&R1C14)&IF(RC[-20]="",,"|n"&R1C15&RC[-20])&IF(RC[-19]="",,"|n"&R1C16&RC[-19])&IF(RC[-18]="",,"|n"&R1C17&RC[-18])&IF(RC[-17]="",,"|n"&R1C18&RC[-17])&IF(RC[-16]="",,"|n"&R1C19&RC[-16])&IF(RC[-15]="",,"|n"&R1C20&RC[-15])&IF(RC[-14]="",,"|n"&R1C21&RC[-14])&IF(RC[-13]="",,"|n"&R1C22&RC[-13])&IF(RC[-11]="",,"|n"&R1C24&RC[-11])&IF(RC[-10]="",,"|n"&R1C25&RC[-10])&IF(RC[-9]="",,"|n"&R1C26&RC[-9])&IF(RC[-8]="",,"|n"&R1C27&RC[-8])&IF(RC[-7]="",,"|n"&R1C28&RC[-7])&IF(RC[-6]="",,"|n"&R1C29&RC[-6])&IF(RC[-2]="",,"|n"&RC[-2]) -> 
AI902: =IF(RC[-27]&RC[-26]&RC[-25]&RC[-24]&RC[-23]&RC[-22]="",,R1C7)&IF(RC[-27]="",,"|n"&R1C8&RC[-27])&IF(RC[-26]="",,"|n"&R1C9&RC[-26])&IF(RC[-25]="",,"|n"&R1C10&RC[-25])&IF(RC[-24]="",,"|n"&R1C11&RC[-24])&IF(RC[-23]="",,"|n"&R1C12&RC[-23])&IF(RC[-22]="",,"|n"&R1C13&RC[-22])&IF(RC[-20]&RC[-19]&RC[-18]&RC[-17]="",,"|n"&R1C14)&IF(RC[-20]="",,"|n"&R1C15&RC[-20])&IF(RC[-19]="",,"|n"&R1C16&RC[-19])&IF(RC[-18]="",,"|n"&R1C17&RC[-18])&IF(RC[-17]="",,"|n"&R1C18&RC[-17])&IF(RC[-16]="",,"|n"&R1C19&RC[-16])&IF(RC[-15]="",,"|n"&R1C20&RC[-15])&IF(RC[-14]="",,"|n"&R1C21&RC[-14])&IF(RC[-13]="",,"|n"&R1C22&RC[-13])&IF(RC[-11]="",,"|n"&R1C24&RC[-11])&IF(RC[-10]="",,"|n"&R1C25&RC[-10])&IF(RC[-9]="",,"|n"&R1C26&RC[-9])&IF(RC[-8]="",,"|n"&R1C27&RC[-8])&IF(RC[-7]="",,"|n"&R1C28&RC[-7])&IF(RC[-6]="",,"|n"&R1C29&RC[-6])&IF(RC[-2]="",,"|n"&RC[-2]) -> 
AI903: =IF(RC[-27]&RC[-26]&RC[-25]&RC[-24]&RC[-23]&RC[-22]="",,R1C7)&IF(RC[-27]="",,"|n"&R1C8&RC[-27])&IF(RC[-26]="",,"|n"&R1C9&RC[-26])&IF(RC[-25]="",,"|n"&R1C10&RC[-25])&IF(RC[-24]="",,"|n"&R1C11&RC[-24])&IF(RC[-23]="",,"|n"&R1C12&RC[-23])&IF(RC[-22]="",,"|n"&R1C13&RC[-22])&IF(RC[-20]&RC[-19]&RC[-18]&RC[-17]="",,"|n"&R1C14)&IF(RC[-20]="",,"|n"&R1C15&RC[-20])&IF(RC[-19]="",,"|n"&R1C16&RC[-19])&IF(RC[-18]="",,"|n"&R1C17&RC[-18])&IF(RC[-17]="",,"|n"&R1C18&RC[-17])&IF(RC[-16]="",,"|n"&R1C19&RC[-16])&IF(RC[-15]="",,"|n"&R1C20&RC[-15])&IF(RC[-14]="",,"|n"&R1C21&RC[-14])&IF(RC[-13]="",,"|n"&R1C22&RC[-13])&IF(RC[-11]="",,"|n"&R1C24&RC[-11])&IF(RC[-10]="",,"|n"&R1C25&RC[-10])&IF(RC[-9]="",,"|n"&R1C26&RC[-9])&IF(RC[-8]="",,"|n"&R1C27&RC[-8])&IF(RC[-7]="",,"|n"&R1C28&RC[-7])&IF(RC[-6]="",,"|n"&R1C29&RC[-6])&IF(RC[-2]="",,"|n"&RC[-2]) -> 
AI904: =IF(RC[-27]&RC[-26]&RC[-25]&RC[-24]&RC[-23]&RC[-22]="",,R1C7)&IF(RC[-27]="",,"|n"&R1C8&RC[-27])&IF(RC[-26]="",,"|n"&R1C9&RC[-26])&IF(RC[-25]="",,"|n"&R1C10&RC[-25])&IF(RC[-24]="",,"|n"&R1C11&RC[-24])&IF(RC[-23]="",,"|n"&R1C12&RC[-23])&IF(RC[-22]="",,"|n"&R1C13&RC[-22])&IF(RC[-20]&RC[-19]&RC[-18]&RC[-17]="",,"|n"&R1C14)&IF(RC[-20]="",,"|n"&R1C15&RC[-20])&IF(RC[-19]="",,"|n"&R1C16&RC[-19])&IF(RC[-18]="",,"|n"&R1C17&RC[-18])&IF(RC[-17]="",,"|n"&R1C18&RC[-17])&IF(RC[-16]="",,"|n"&R1C19&RC[-16])&IF(RC[-15]="",,"|n"&R1C20&RC[-15])&IF(RC[-14]="",,"|n"&R1C21&RC[-14])&IF(RC[-13]="",,"|n"&R1C22&RC[-13])&IF(RC[-11]="",,"|n"&R1C24&RC[-11])&IF(RC[-10]="",,"|n"&R1C25&RC[-10])&IF(RC[-9]="",,"|n"&R1C26&RC[-9])&IF(RC[-8]="",,"|n"&R1C27&RC[-8])&IF(RC[-7]="",,"|n"&R1C28&RC[-7])&IF(RC[-6]="",,"|n"&R1C29&RC[-6])&IF(RC[-2]="",,"|n"&RC[-2]) -> 
AI905: =IF(RC[-27]&RC[-26]&RC[-25]&RC[-24]&RC[-23]&RC[-22]="",,R1C7)&IF(RC[-27]="",,"|n"&R1C8&RC[-27])&IF(RC[-26]="",,"|n"&R1C9&RC[-26])&IF(RC[-25]="",,"|n"&R1C10&RC[-25])&IF(RC[-24]="",,"|n"&R1C11&RC[-24])&IF(RC[-23]="",,"|n"&R1C12&RC[-23])&IF(RC[-22]="",,"|n"&R1C13&RC[-22])&IF(RC[-20]&RC[-19]&RC[-18]&RC[-17]="",,"|n"&R1C14)&IF(RC[-20]="",,"|n"&R1C15&RC[-20])&IF(RC[-19]="",,"|n"&R1C16&RC[-19])&IF(RC[-18]="",,"|n"&R1C17&RC[-18])&IF(RC[-17]="",,"|n"&R1C18&RC[-17])&IF(RC[-16]="",,"|n"&R1C19&RC[-16])&IF(RC[-15]="",,"|n"&R1C20&RC[-15])&IF(RC[-14]="",,"|n"&R1C21&RC[-14])&IF(RC[-13]="",,"|n"&R1C22&RC[-13])&IF(RC[-11]="",,"|n"&R1C24&RC[-11])&IF(RC[-10]="",,"|n"&R1C25&RC[-10])&IF(RC[-9]="",,"|n"&R1C26&RC[-9])&IF(RC[-8]="",,"|n"&R1C27&RC[-8])&IF(RC[-7]="",,"|n"&R1C28&RC[-7])&IF(RC[-6]="",,"|n"&R1C29&RC[-6])&IF(RC[-2]="",,"|n"&RC[-2]) -> 
AI906: =IF(RC[-27]&RC[-26]&RC[-25]&RC[-24]&RC[-23]&RC[-22]="",,R1C7)&IF(RC[-27]="",,"|n"&R1C8&RC[-27])&IF(RC[-26]="",,"|n"&R1C9&RC[-26])&IF(RC[-25]="",,"|n"&R1C10&RC[-25])&IF(RC[-24]="",,"|n"&R1C11&RC[-24])&IF(RC[-23]="",,"|n"&R1C12&RC[-23])&IF(RC[-22]="",,"|n"&R1C13&RC[-22])&IF(RC[-20]&RC[-19]&RC[-18]&RC[-17]="",,"|n"&R1C14)&IF(RC[-20]="",,"|n"&R1C15&RC[-20])&IF(RC[-19]="",,"|n"&R1C16&RC[-19])&IF(RC[-18]="",,"|n"&R1C17&RC[-18])&IF(RC[-17]="",,"|n"&R1C18&RC[-17])&IF(RC[-16]="",,"|n"&R1C19&RC[-16])&IF(RC[-15]="",,"|n"&R1C20&RC[-15])&IF(RC[-14]="",,"|n"&R1C21&RC[-14])&IF(RC[-13]="",,"|n"&R1C22&RC[-13])&IF(RC[-11]="",,"|n"&R1C24&RC[-11])&IF(RC[-10]="",,"|n"&R1C25&RC[-10])&IF(RC[-9]="",,"|n"&R1C26&RC[-9])&IF(RC[-8]="",,"|n"&R1C27&RC[-8])&IF(RC[-7]="",,"|n"&R1C28&RC[-7])&IF(RC[-6]="",,"|n"&R1C29&RC[-6])&IF(RC[-2]="",,"|n"&RC[-2]) -> 
AI907: =IF(RC[-27]&RC[-26]&RC[-25]&RC[-24]&RC[-23]&RC[-22]="",,R1C7)&IF(RC[-27]="",,"|n"&R1C8&RC[-27])&IF(RC[-26]="",,"|n"&R1C9&RC[-26])&IF(RC[-25]="",,"|n"&R1C10&RC[-25])&IF(RC[-24]="",,"|n"&R1C11&RC[-24])&IF(RC[-23]="",,"|n"&R1C12&RC[-23])&IF(RC[-22]="",,"|n"&R1C13&RC[-22])&IF(RC[-20]&RC[-19]&RC[-18]&RC[-17]="",,"|n"&R1C14)&IF(RC[-20]="",,"|n"&R1C15&RC[-20])&IF(RC[-19]="",,"|n"&R1C16&RC[-19])&IF(RC[-18]="",,"|n"&R1C17&RC[-18])&IF(RC[-17]="",,"|n"&R1C18&RC[-17])&IF(RC[-16]="",,"|n"&R1C19&RC[-16])&IF(RC[-15]="",,"|n"&R1C20&RC[-15])&IF(RC[-14]="",,"|n"&R1C21&RC[-14])&IF(RC[-13]="",,"|n"&R1C22&RC[-13])&IF(RC[-11]="",,"|n"&R1C24&RC[-11])&IF(RC[-10]="",,"|n"&R1C25&RC[-10])&IF(RC[-9]="",,"|n"&R1C26&RC[-9])&IF(RC[-8]="",,"|n"&R1C27&RC[-8])&IF(RC[-7]="",,"|n"&R1C28&RC[-7])&IF(RC[-6]="",,"|n"&R1C29&RC[-6])&IF(RC[-2]="",,"|n"&RC[-2]) -> 
AI908: =IF(RC[-27]&RC[-26]&RC[-25]&RC[-24]&RC[-23]&RC[-22]="",,R1C7)&IF(RC[-27]="",,"|n"&R1C8&RC[-27])&IF(RC[-26]="",,"|n"&R1C9&RC[-26])&IF(RC[-25]="",,"|n"&R1C10&RC[-25])&IF(RC[-24]="",,"|n"&R1C11&RC[-24])&IF(RC[-23]="",,"|n"&R1C12&RC[-23])&IF(RC[-22]="",,"|n"&R1C13&RC[-22])&IF(RC[-20]&RC[-19]&RC[-18]&RC[-17]="",,"|n"&R1C14)&IF(RC[-20]="",,"|n"&R1C15&RC[-20])&IF(RC[-19]="",,"|n"&R1C16&RC[-19])&IF(RC[-18]="",,"|n"&R1C17&RC[-18])&IF(RC[-17]="",,"|n"&R1C18&RC[-17])&IF(RC[-16]="",,"|n"&R1C19&RC[-16])&IF(RC[-15]="",,"|n"&R1C20&RC[-15])&IF(RC[-14]="",,"|n"&R1C21&RC[-14])&IF(RC[-13]="",,"|n"&R1C22&RC[-13])&IF(RC[-11]="",,"|n"&R1C24&RC[-11])&IF(RC[-10]="",,"|n"&R1C25&RC[-10])&IF(RC[-9]="",,"|n"&R1C26&RC[-9])&IF(RC[-8]="",,"|n"&R1C27&RC[-8])&IF(RC[-7]="",,"|n"&R1C28&RC[-7])&IF(RC[-6]="",,"|n"&R1C29&RC[-6])&IF(RC[-2]="",,"|n"&RC[-2]) -> 
AI909: =IF(RC[-27]&RC[-26]&RC[-25]&RC[-24]&RC[-23]&RC[-22]="",,R1C7)&IF(RC[-27]="",,"|n"&R1C8&RC[-27])&IF(RC[-26]="",,"|n"&R1C9&RC[-26])&IF(RC[-25]="",,"|n"&R1C10&RC[-25])&IF(RC[-24]="",,"|n"&R1C11&RC[-24])&IF(RC[-23]="",,"|n"&R1C12&RC[-23])&IF(RC[-22]="",,"|n"&R1C13&RC[-22])&IF(RC[-20]&RC[-19]&RC[-18]&RC[-17]="",,"|n"&R1C14)&IF(RC[-20]="",,"|n"&R1C15&RC[-20])&IF(RC[-19]="",,"|n"&R1C16&RC[-19])&IF(RC[-18]="",,"|n"&R1C17&RC[-18])&IF(RC[-17]="",,"|n"&R1C18&RC[-17])&IF(RC[-16]="",,"|n"&R1C19&RC[-16])&IF(RC[-15]="",,"|n"&R1C20&RC[-15])&IF(RC[-14]="",,"|n"&R1C21&RC[-14])&IF(RC[-13]="",,"|n"&R1C22&RC[-13])&IF(RC[-11]="",,"|n"&R1C24&RC[-11])&IF(RC[-10]="",,"|n"&R1C25&RC[-10])&IF(RC[-9]="",,"|n"&R1C26&RC[-9])&IF(RC[-8]="",,"|n"&R1C27&RC[-8])&IF(RC[-7]="",,"|n"&R1C28&RC[-7])&IF(RC[-6]="",,"|n"&R1C29&RC[-6])&IF(RC[-2]="",,"|n"&RC[-2]) -> 
AI910: =IF(RC[-27]&RC[-26]&RC[-25]&RC[-24]&RC[-23]&RC[-22]="",,R1C7)&IF(RC[-27]="",,"|n"&R1C8&RC[-27])&IF(RC[-26]="",,"|n"&R1C9&RC[-26])&IF(RC[-25]="",,"|n"&R1C10&RC[-25])&IF(RC[-24]="",,"|n"&R1C11&RC[-24])&IF(RC[-23]="",,"|n"&R1C12&RC[-23])&IF(RC[-22]="",,"|n"&R1C13&RC[-22])&IF(RC[-20]&RC[-19]&RC[-18]&RC[-17]="",,"|n"&R1C14)&IF(RC[-20]="",,"|n"&R1C15&RC[-20])&IF(RC[-19]="",,"|n"&R1C16&RC[-19])&IF(RC[-18]="",,"|n"&R1C17&RC[-18])&IF(RC[-17]="",,"|n"&R1C18&RC[-17])&IF(RC[-16]="",,"|n"&R1C19&RC[-16])&IF(RC[-15]="",,"|n"&R1C20&RC[-15])&IF(RC[-14]="",,"|n"&R1C21&RC[-14])&IF(RC[-13]="",,"|n"&R1C22&RC[-13])&IF(RC[-11]="",,"|n"&R1C24&RC[-11])&IF(RC[-10]="",,"|n"&R1C25&RC[-10])&IF(RC[-9]="",,"|n"&R1C26&RC[-9])&IF(RC[-8]="",,"|n"&R1C27&RC[-8])&IF(RC[-7]="",,"|n"&R1C28&RC[-7])&IF(RC[-6]="",,"|n"&R1C29&RC[-6])&IF(RC[-2]="",,"|n"&RC[-2]) -> 
AI911: =IF(RC[-27]&RC[-26]&RC[-25]&RC[-24]&RC[-23]&RC[-22]="",,R1C7)&IF(RC[-27]="",,"|n"&R1C8&RC[-27])&IF(RC[-26]="",,"|n"&R1C9&RC[-26])&IF(RC[-25]="",,"|n"&R1C10&RC[-25])&IF(RC[-24]="",,"|n"&R1C11&RC[-24])&IF(RC[-23]="",,"|n"&R1C12&RC[-23])&IF(RC[-22]="",,"|n"&R1C13&RC[-22])&IF(RC[-20]&RC[-19]&RC[-18]&RC[-17]="",,"|n"&R1C14)&IF(RC[-20]="",,"|n"&R1C15&RC[-20])&IF(RC[-19]="",,"|n"&R1C16&RC[-19])&IF(RC[-18]="",,"|n"&R1C17&RC[-18])&IF(RC[-17]="",,"|n"&R1C18&RC[-17])&IF(RC[-16]="",,"|n"&R1C19&RC[-16])&IF(RC[-15]="",,"|n"&R1C20&RC[-15])&IF(RC[-14]="",,"|n"&R1C21&RC[-14])&IF(RC[-13]="",,"|n"&R1C22&RC[-13])&IF(RC[-11]="",,"|n"&R1C24&RC[-11])&IF(RC[-10]="",,"|n"&R1C25&RC[-10])&IF(RC[-9]="",,"|n"&R1C26&RC[-9])&IF(RC[-8]="",,"|n"&R1C27&RC[-8])&IF(RC[-7]="",,"|n"&R1C28&RC[-7])&IF(RC[-6]="",,"|n"&R1C29&RC[-6])&IF(RC[-2]="",,"|n"&RC[-2]) -> 
AI912: =IF(RC[-27]&RC[-26]&RC[-25]&RC[-24]&RC[-23]&RC[-22]="",,R1C7)&IF(RC[-27]="",,"|n"&R1C8&RC[-27])&IF(RC[-26]="",,"|n"&R1C9&RC[-26])&IF(RC[-25]="",,"|n"&R1C10&RC[-25])&IF(RC[-24]="",,"|n"&R1C11&RC[-24])&IF(RC[-23]="",,"|n"&R1C12&RC[-23])&IF(RC[-22]="",,"|n"&R1C13&RC[-22])&IF(RC[-20]&RC[-19]&RC[-18]&RC[-17]="",,"|n"&R1C14)&IF(RC[-20]="",,"|n"&R1C15&RC[-20])&IF(RC[-19]="",,"|n"&R1C16&RC[-19])&IF(RC[-18]="",,"|n"&R1C17&RC[-18])&IF(RC[-17]="",,"|n"&R1C18&RC[-17])&IF(RC[-16]="",,"|n"&R1C19&RC[-16])&IF(RC[-15]="",,"|n"&R1C20&RC[-15])&IF(RC[-14]="",,"|n"&R1C21&RC[-14])&IF(RC[-13]="",,"|n"&R1C22&RC[-13])&IF(RC[-11]="",,"|n"&R1C24&RC[-11])&IF(RC[-10]="",,"|n"&R1C25&RC[-10])&IF(RC[-9]="",,"|n"&R1C26&RC[-9])&IF(RC[-8]="",,"|n"&R1C27&RC[-8])&IF(RC[-7]="",,"|n"&R1C28&RC[-7])&IF(RC[-6]="",,"|n"&R1C29&RC[-6])&IF(RC[-2]="",,"|n"&RC[-2]) -> 
AI913: =IF(RC[-27]&RC[-26]&RC[-25]&RC[-24]&RC[-23]&RC[-22]="",,R1C7)&IF(RC[-27]="",,"|n"&R1C8&RC[-27])&IF(RC[-26]="",,"|n"&R1C9&RC[-26])&IF(RC[-25]="",,"|n"&R1C10&RC[-25])&IF(RC[-24]="",,"|n"&R1C11&RC[-24])&IF(RC[-23]="",,"|n"&R1C12&RC[-23])&IF(RC[-22]="",,"|n"&R1C13&RC[-22])&IF(RC[-20]&RC[-19]&RC[-18]&RC[-17]="",,"|n"&R1C14)&IF(RC[-20]="",,"|n"&R1C15&RC[-20])&IF(RC[-19]="",,"|n"&R1C16&RC[-19])&IF(RC[-18]="",,"|n"&R1C17&RC[-18])&IF(RC[-17]="",,"|n"&R1C18&RC[-17])&IF(RC[-16]="",,"|n"&R1C19&RC[-16])&IF(RC[-15]="",,"|n"&R1C20&RC[-15])&IF(RC[-14]="",,"|n"&R1C21&RC[-14])&IF(RC[-13]="",,"|n"&R1C22&RC[-13])&IF(RC[-11]="",,"|n"&R1C24&RC[-11])&IF(RC[-10]="",,"|n"&R1C25&RC[-10])&IF(RC[-9]="",,"|n"&R1C26&RC[-9])&IF(RC[-8]="",,"|n"&R1C27&RC[-8])&IF(RC[-7]="",,"|n"&R1C28&RC[-7])&IF(RC[-6]="",,"|n"&R1C29&RC[-6])&IF(RC[-2]="",,"|n"&RC[-2]) -> 
AI914: =IF(RC[-27]&RC[-26]&RC[-25]&RC[-24]&RC[-23]&RC[-22]="",,R1C7)&IF(RC[-27]="",,"|n"&R1C8&RC[-27])&IF(RC[-26]="",,"|n"&R1C9&RC[-26])&IF(RC[-25]="",,"|n"&R1C10&RC[-25])&IF(RC[-24]="",,"|n"&R1C11&RC[-24])&IF(RC[-23]="",,"|n"&R1C12&RC[-23])&IF(RC[-22]="",,"|n"&R1C13&RC[-22])&IF(RC[-20]&RC[-19]&RC[-18]&RC[-17]="",,"|n"&R1C14)&IF(RC[-20]="",,"|n"&R1C15&RC[-20])&IF(RC[-19]="",,"|n"&R1C16&RC[-19])&IF(RC[-18]="",,"|n"&R1C17&RC[-18])&IF(RC[-17]="",,"|n"&R1C18&RC[-17])&IF(RC[-16]="",,"|n"&R1C19&RC[-16])&IF(RC[-15]="",,"|n"&R1C20&RC[-15])&IF(RC[-14]="",,"|n"&R1C21&RC[-14])&IF(RC[-13]="",,"|n"&R1C22&RC[-13])&IF(RC[-11]="",,"|n"&R1C24&RC[-11])&IF(RC[-10]="",,"|n"&R1C25&RC[-10])&IF(RC[-9]="",,"|n"&R1C26&RC[-9])&IF(RC[-8]="",,"|n"&R1C27&RC[-8])&IF(RC[-7]="",,"|n"&R1C28&RC[-7])&IF(RC[-6]="",,"|n"&R1C29&RC[-6])&IF(RC[-2]="",,"|n"&RC[-2]) -> 
AI915: =IF(RC[-27]&RC[-26]&RC[-25]&RC[-24]&RC[-23]&RC[-22]="",,R1C7)&IF(RC[-27]="",,"|n"&R1C8&RC[-27])&IF(RC[-26]="",,"|n"&R1C9&RC[-26])&IF(RC[-25]="",,"|n"&R1C10&RC[-25])&IF(RC[-24]="",,"|n"&R1C11&RC[-24])&IF(RC[-23]="",,"|n"&R1C12&RC[-23])&IF(RC[-22]="",,"|n"&R1C13&RC[-22])&IF(RC[-20]&RC[-19]&RC[-18]&RC[-17]="",,"|n"&R1C14)&IF(RC[-20]="",,"|n"&R1C15&RC[-20])&IF(RC[-19]="",,"|n"&R1C16&RC[-19])&IF(RC[-18]="",,"|n"&R1C17&RC[-18])&IF(RC[-17]="",,"|n"&R1C18&RC[-17])&IF(RC[-16]="",,"|n"&R1C19&RC[-16])&IF(RC[-15]="",,"|n"&R1C20&RC[-15])&IF(RC[-14]="",,"|n"&R1C21&RC[-14])&IF(RC[-13]="",,"|n"&R1C22&RC[-13])&IF(RC[-11]="",,"|n"&R1C24&RC[-11])&IF(RC[-10]="",,"|n"&R1C25&RC[-10])&IF(RC[-9]="",,"|n"&R1C26&RC[-9])&IF(RC[-8]="",,"|n"&R1C27&RC[-8])&IF(RC[-7]="",,"|n"&R1C28&RC[-7])&IF(RC[-6]="",,"|n"&R1C29&RC[-6])&IF(RC[-2]="",,"|n"&RC[-2]) -> 
AI916: =IF(RC[-27]&RC[-26]&RC[-25]&RC[-24]&RC[-23]&RC[-22]="",,R1C7)&IF(RC[-27]="",,"|n"&R1C8&RC[-27])&IF(RC[-26]="",,"|n"&R1C9&RC[-26])&IF(RC[-25]="",,"|n"&R1C10&RC[-25])&IF(RC[-24]="",,"|n"&R1C11&RC[-24])&IF(RC[-23]="",,"|n"&R1C12&RC[-23])&IF(RC[-22]="",,"|n"&R1C13&RC[-22])&IF(RC[-20]&RC[-19]&RC[-18]&RC[-17]="",,"|n"&R1C14)&IF(RC[-20]="",,"|n"&R1C15&RC[-20])&IF(RC[-19]="",,"|n"&R1C16&RC[-19])&IF(RC[-18]="",,"|n"&R1C17&RC[-18])&IF(RC[-17]="",,"|n"&R1C18&RC[-17])&IF(RC[-16]="",,"|n"&R1C19&RC[-16])&IF(RC[-15]="",,"|n"&R1C20&RC[-15])&IF(RC[-14]="",,"|n"&R1C21&RC[-14])&IF(RC[-13]="",,"|n"&R1C22&RC[-13])&IF(RC[-11]="",,"|n"&R1C24&RC[-11])&IF(RC[-10]="",,"|n"&R1C25&RC[-10])&IF(RC[-9]="",,"|n"&R1C26&RC[-9])&IF(RC[-8]="",,"|n"&R1C27&RC[-8])&IF(RC[-7]="",,"|n"&R1C28&RC[-7])&IF(RC[-6]="",,"|n"&R1C29&RC[-6])&IF(RC[-2]="",,"|n"&RC[-2]) -> 
AI917: =IF(RC[-27]&RC[-26]&RC[-25]&RC[-24]&RC[-23]&RC[-22]="",,R1C7)&IF(RC[-27]="",,"|n"&R1C8&RC[-27])&IF(RC[-26]="",,"|n"&R1C9&RC[-26])&IF(RC[-25]="",,"|n"&R1C10&RC[-25])&IF(RC[-24]="",,"|n"&R1C11&RC[-24])&IF(RC[-23]="",,"|n"&R1C12&RC[-23])&IF(RC[-22]="",,"|n"&R1C13&RC[-22])&IF(RC[-20]&RC[-19]&RC[-18]&RC[-17]="",,"|n"&R1C14)&IF(RC[-20]="",,"|n"&R1C15&RC[-20])&IF(RC[-19]="",,"|n"&R1C16&RC[-19])&IF(RC[-18]="",,"|n"&R1C17&RC[-18])&IF(RC[-17]="",,"|n"&R1C18&RC[-17])&IF(RC[-16]="",,"|n"&R1C19&RC[-16])&IF(RC[-15]="",,"|n"&R1C20&RC[-15])&IF(RC[-14]="",,"|n"&R1C21&RC[-14])&IF(RC[-13]="",,"|n"&R1C22&RC[-13])&IF(RC[-11]="",,"|n"&R1C24&RC[-11])&IF(RC[-10]="",,"|n"&R1C25&RC[-10])&IF(RC[-9]="",,"|n"&R1C26&RC[-9])&IF(RC[-8]="",,"|n"&R1C27&RC[-8])&IF(RC[-7]="",,"|n"&R1C28&RC[-7])&IF(RC[-6]="",,"|n"&R1C29&RC[-6])&IF(RC[-2]="",,"|n"&RC[-2]) -> 
AI918: =IF(RC[-27]&RC[-26]&RC[-25]&RC[-24]&RC[-23]&RC[-22]="",,R1C7)&IF(RC[-27]="",,"|n"&R1C8&RC[-27])&IF(RC[-26]="",,"|n"&R1C9&RC[-26])&IF(RC[-25]="",,"|n"&R1C10&RC[-25])&IF(RC[-24]="",,"|n"&R1C11&RC[-24])&IF(RC[-23]="",,"|n"&R1C12&RC[-23])&IF(RC[-22]="",,"|n"&R1C13&RC[-22])&IF(RC[-20]&RC[-19]&RC[-18]&RC[-17]="",,"|n"&R1C14)&IF(RC[-20]="",,"|n"&R1C15&RC[-20])&IF(RC[-19]="",,"|n"&R1C16&RC[-19])&IF(RC[-18]="",,"|n"&R1C17&RC[-18])&IF(RC[-17]="",,"|n"&R1C18&RC[-17])&IF(RC[-16]="",,"|n"&R1C19&RC[-16])&IF(RC[-15]="",,"|n"&R1C20&RC[-15])&IF(RC[-14]="",,"|n"&R1C21&RC[-14])&IF(RC[-13]="",,"|n"&R1C22&RC[-13])&IF(RC[-11]="",,"|n"&R1C24&RC[-11])&IF(RC[-10]="",,"|n"&R1C25&RC[-10])&IF(RC[-9]="",,"|n"&R1C26&RC[-9])&IF(RC[-8]="",,"|n"&R1C27&RC[-8])&IF(RC[-7]="",,"|n"&R1C28&RC[-7])&IF(RC[-6]="",,"|n"&R1C29&RC[-6])&IF(RC[-2]="",,"|n"&RC[-2]) -> 
AI919: =IF(RC[-27]&RC[-26]&RC[-25]&RC[-24]&RC[-23]&RC[-22]="",,R1C7)&IF(RC[-27]="",,"|n"&R1C8&RC[-27])&IF(RC[-26]="",,"|n"&R1C9&RC[-26])&IF(RC[-25]="",,"|n"&R1C10&RC[-25])&IF(RC[-24]="",,"|n"&R1C11&RC[-24])&IF(RC[-23]="",,"|n"&R1C12&RC[-23])&IF(RC[-22]="",,"|n"&R1C13&RC[-22])&IF(RC[-20]&RC[-19]&RC[-18]&RC[-17]="",,"|n"&R1C14)&IF(RC[-20]="",,"|n"&R1C15&RC[-20])&IF(RC[-19]="",,"|n"&R1C16&RC[-19])&IF(RC[-18]="",,"|n"&R1C17&RC[-18])&IF(RC[-17]="",,"|n"&R1C18&RC[-17])&IF(RC[-16]="",,"|n"&R1C19&RC[-16])&IF(RC[-15]="",,"|n"&R1C20&RC[-15])&IF(RC[-14]="",,"|n"&R1C21&RC[-14])&IF(RC[-13]="",,"|n"&R1C22&RC[-13])&IF(RC[-11]="",,"|n"&R1C24&RC[-11])&IF(RC[-10]="",,"|n"&R1C25&RC[-10])&IF(RC[-9]="",,"|n"&R1C26&RC[-9])&IF(RC[-8]="",,"|n"&R1C27&RC[-8])&IF(RC[-7]="",,"|n"&R1C28&RC[-7])&IF(RC[-6]="",,"|n"&R1C29&RC[-6])&IF(RC[-2]="",,"|n"&RC[-2]) -> 
AI920: =IF(RC[-27]&RC[-26]&RC[-25]&RC[-24]&RC[-23]&RC[-22]="",,R1C7)&IF(RC[-27]="",,"|n"&R1C8&RC[-27])&IF(RC[-26]="",,"|n"&R1C9&RC[-26])&IF(RC[-25]="",,"|n"&R1C10&RC[-25])&IF(RC[-24]="",,"|n"&R1C11&RC[-24])&IF(RC[-23]="",,"|n"&R1C12&RC[-23])&IF(RC[-22]="",,"|n"&R1C13&RC[-22])&IF(RC[-20]&RC[-19]&RC[-18]&RC[-17]="",,"|n"&R1C14)&IF(RC[-20]="",,"|n"&R1C15&RC[-20])&IF(RC[-19]="",,"|n"&R1C16&RC[-19])&IF(RC[-18]="",,"|n"&R1C17&RC[-18])&IF(RC[-17]="",,"|n"&R1C18&RC[-17])&IF(RC[-16]="",,"|n"&R1C19&RC[-16])&IF(RC[-15]="",,"|n"&R1C20&RC[-15])&IF(RC[-14]="",,"|n"&R1C21&RC[-14])&IF(RC[-13]="",,"|n"&R1C22&RC[-13])&IF(RC[-11]="",,"|n"&R1C24&RC[-11])&IF(RC[-10]="",,"|n"&R1C25&RC[-10])&IF(RC[-9]="",,"|n"&R1C26&RC[-9])&IF(RC[-8]="",,"|n"&R1C27&RC[-8])&IF(RC[-7]="",,"|n"&R1C28&RC[-7])&IF(RC[-6]="",,"|n"&R1C29&RC[-6])&IF(RC[-2]="",,"|n"&RC[-2]) -> 
AI921: =IF(RC[-27]&RC[-26]&RC[-25]&RC[-24]&RC[-23]&RC[-22]="",,R1C7)&IF(RC[-27]="",,"|n"&R1C8&RC[-27])&IF(RC[-26]="",,"|n"&R1C9&RC[-26])&IF(RC[-25]="",,"|n"&R1C10&RC[-25])&IF(RC[-24]="",,"|n"&R1C11&RC[-24])&IF(RC[-23]="",,"|n"&R1C12&RC[-23])&IF(RC[-22]="",,"|n"&R1C13&RC[-22])&IF(RC[-20]&RC[-19]&RC[-18]&RC[-17]="",,"|n"&R1C14)&IF(RC[-20]="",,"|n"&R1C15&RC[-20])&IF(RC[-19]="",,"|n"&R1C16&RC[-19])&IF(RC[-18]="",,"|n"&R1C17&RC[-18])&IF(RC[-17]="",,"|n"&R1C18&RC[-17])&IF(RC[-16]="",,"|n"&R1C19&RC[-16])&IF(RC[-15]="",,"|n"&R1C20&RC[-15])&IF(RC[-14]="",,"|n"&R1C21&RC[-14])&IF(RC[-13]="",,"|n"&R1C22&RC[-13])&IF(RC[-11]="",,"|n"&R1C24&RC[-11])&IF(RC[-10]="",,"|n"&R1C25&RC[-10])&IF(RC[-9]="",,"|n"&R1C26&RC[-9])&IF(RC[-8]="",,"|n"&R1C27&RC[-8])&IF(RC[-7]="",,"|n"&R1C28&RC[-7])&IF(RC[-6]="",,"|n"&R1C29&RC[-6])&IF(RC[-2]="",,"|n"&RC[-2]) -> 
AI922: =IF(RC[-27]&RC[-26]&RC[-25]&RC[-24]&RC[-23]&RC[-22]="",,R1C7)&IF(RC[-27]="",,"|n"&R1C8&RC[-27])&IF(RC[-26]="",,"|n"&R1C9&RC[-26])&IF(RC[-25]="",,"|n"&R1C10&RC[-25])&IF(RC[-24]="",,"|n"&R1C11&RC[-24])&IF(RC[-23]="",,"|n"&R1C12&RC[-23])&IF(RC[-22]="",,"|n"&R1C13&RC[-22])&IF(RC[-20]&RC[-19]&RC[-18]&RC[-17]="",,"|n"&R1C14)&IF(RC[-20]="",,"|n"&R1C15&RC[-20])&IF(RC[-19]="",,"|n"&R1C16&RC[-19])&IF(RC[-18]="",,"|n"&R1C17&RC[-18])&IF(RC[-17]="",,"|n"&R1C18&RC[-17])&IF(RC[-16]="",,"|n"&R1C19&RC[-16])&IF(RC[-15]="",,"|n"&R1C20&RC[-15])&IF(RC[-14]="",,"|n"&R1C21&RC[-14])&IF(RC[-13]="",,"|n"&R1C22&RC[-13])&IF(RC[-11]="",,"|n"&R1C24&RC[-11])&IF(RC[-10]="",,"|n"&R1C25&RC[-10])&IF(RC[-9]="",,"|n"&R1C26&RC[-9])&IF(RC[-8]="",,"|n"&R1C27&RC[-8])&IF(RC[-7]="",,"|n"&R1C28&RC[-7])&IF(RC[-6]="",,"|n"&R1C29&RC[-6])&IF(RC[-2]="",,"|n"&RC[-2]) -> 
AI923: =IF(RC[-27]&RC[-26]&RC[-25]&RC[-24]&RC[-23]&RC[-22]="",,R1C7)&IF(RC[-27]="",,"|n"&R1C8&RC[-27])&IF(RC[-26]="",,"|n"&R1C9&RC[-26])&IF(RC[-25]="",,"|n"&R1C10&RC[-25])&IF(RC[-24]="",,"|n"&R1C11&RC[-24])&IF(RC[-23]="",,"|n"&R1C12&RC[-23])&IF(RC[-22]="",,"|n"&R1C13&RC[-22])&IF(RC[-20]&RC[-19]&RC[-18]&RC[-17]="",,"|n"&R1C14)&IF(RC[-20]="",,"|n"&R1C15&RC[-20])&IF(RC[-19]="",,"|n"&R1C16&RC[-19])&IF(RC[-18]="",,"|n"&R1C17&RC[-18])&IF(RC[-17]="",,"|n"&R1C18&RC[-17])&IF(RC[-16]="",,"|n"&R1C19&RC[-16])&IF(RC[-15]="",,"|n"&R1C20&RC[-15])&IF(RC[-14]="",,"|n"&R1C21&RC[-14])&IF(RC[-13]="",,"|n"&R1C22&RC[-13])&IF(RC[-11]="",,"|n"&R1C24&RC[-11])&IF(RC[-10]="",,"|n"&R1C25&RC[-10])&IF(RC[-9]="",,"|n"&R1C26&RC[-9])&IF(RC[-8]="",,"|n"&R1C27&RC[-8])&IF(RC[-7]="",,"|n"&R1C28&RC[-7])&IF(RC[-6]="",,"|n"&R1C29&RC[-6])&IF(RC[-2]="",,"|n"&RC[-2]) -> 
AI924: =IF(RC[-27]&RC[-26]&RC[-25]&RC[-24]&RC[-23]&RC[-22]="",,R1C7)&IF(RC[-27]="",,"|n"&R1C8&RC[-27])&IF(RC[-26]="",,"|n"&R1C9&RC[-26])&IF(RC[-25]="",,"|n"&R1C10&RC[-25])&IF(RC[-24]="",,"|n"&R1C11&RC[-24])&IF(RC[-23]="",,"|n"&R1C12&RC[-23])&IF(RC[-22]="",,"|n"&R1C13&RC[-22])&IF(RC[-20]&RC[-19]&RC[-18]&RC[-17]="",,"|n"&R1C14)&IF(RC[-20]="",,"|n"&R1C15&RC[-20])&IF(RC[-19]="",,"|n"&R1C16&RC[-19])&IF(RC[-18]="",,"|n"&R1C17&RC[-18])&IF(RC[-17]="",,"|n"&R1C18&RC[-17])&IF(RC[-16]="",,"|n"&R1C19&RC[-16])&IF(RC[-15]="",,"|n"&R1C20&RC[-15])&IF(RC[-14]="",,"|n"&R1C21&RC[-14])&IF(RC[-13]="",,"|n"&R1C22&RC[-13])&IF(RC[-11]="",,"|n"&R1C24&RC[-11])&IF(RC[-10]="",,"|n"&R1C25&RC[-10])&IF(RC[-9]="",,"|n"&R1C26&RC[-9])&IF(RC[-8]="",,"|n"&R1C27&RC[-8])&IF(RC[-7]="",,"|n"&R1C28&RC[-7])&IF(RC[-6]="",,"|n"&R1C29&RC[-6])&IF(RC[-2]="",,"|n"&RC[-2]) -> 
AI925: =IF(RC[-27]&RC[-26]&RC[-25]&RC[-24]&RC[-23]&RC[-22]="",,R1C7)&IF(RC[-27]="",,"|n"&R1C8&RC[-27])&IF(RC[-26]="",,"|n"&R1C9&RC[-26])&IF(RC[-25]="",,"|n"&R1C10&RC[-25])&IF(RC[-24]="",,"|n"&R1C11&RC[-24])&IF(RC[-23]="",,"|n"&R1C12&RC[-23])&IF(RC[-22]="",,"|n"&R1C13&RC[-22])&IF(RC[-20]&RC[-19]&RC[-18]&RC[-17]="",,"|n"&R1C14)&IF(RC[-20]="",,"|n"&R1C15&RC[-20])&IF(RC[-19]="",,"|n"&R1C16&RC[-19])&IF(RC[-18]="",,"|n"&R1C17&RC[-18])&IF(RC[-17]="",,"|n"&R1C18&RC[-17])&IF(RC[-16]="",,"|n"&R1C19&RC[-16])&IF(RC[-15]="",,"|n"&R1C20&RC[-15])&IF(RC[-14]="",,"|n"&R1C21&RC[-14])&IF(RC[-13]="",,"|n"&R1C22&RC[-13])&IF(RC[-11]="",,"|n"&R1C24&RC[-11])&IF(RC[-10]="",,"|n"&R1C25&RC[-10])&IF(RC[-9]="",,"|n"&R1C26&RC[-9])&IF(RC[-8]="",,"|n"&R1C27&RC[-8])&IF(RC[-7]="",,"|n"&R1C28&RC[-7])&IF(RC[-6]="",,"|n"&R1C29&RC[-6])&IF(RC[-2]="",,"|n"&RC[-2]) -> 
AI926: =IF(RC[-27]&RC[-26]&RC[-25]&RC[-24]&RC[-23]&RC[-22]="",,R1C7)&IF(RC[-27]="",,"|n"&R1C8&RC[-27])&IF(RC[-26]="",,"|n"&R1C9&RC[-26])&IF(RC[-25]="",,"|n"&R1C10&RC[-25])&IF(RC[-24]="",,"|n"&R1C11&RC[-24])&IF(RC[-23]="",,"|n"&R1C12&RC[-23])&IF(RC[-22]="",,"|n"&R1C13&RC[-22])&IF(RC[-20]&RC[-19]&RC[-18]&RC[-17]="",,"|n"&R1C14)&IF(RC[-20]="",,"|n"&R1C15&RC[-20])&IF(RC[-19]="",,"|n"&R1C16&RC[-19])&IF(RC[-18]="",,"|n"&R1C17&RC[-18])&IF(RC[-17]="",,"|n"&R1C18&RC[-17])&IF(RC[-16]="",,"|n"&R1C19&RC[-16])&IF(RC[-15]="",,"|n"&R1C20&RC[-15])&IF(RC[-14]="",,"|n"&R1C21&RC[-14])&IF(RC[-13]="",,"|n"&R1C22&RC[-13])&IF(RC[-11]="",,"|n"&R1C24&RC[-11])&IF(RC[-10]="",,"|n"&R1C25&RC[-10])&IF(RC[-9]="",,"|n"&R1C26&RC[-9])&IF(RC[-8]="",,"|n"&R1C27&RC[-8])&IF(RC[-7]="",,"|n"&R1C28&RC[-7])&IF(RC[-6]="",,"|n"&R1C29&RC[-6])&IF(RC[-2]="",,"|n"&RC[-2]) -> 
AI927: =IF(RC[-27]&RC[-26]&RC[-25]&RC[-24]&RC[-23]&RC[-22]="",,R1C7)&IF(RC[-27]="",,"|n"&R1C8&RC[-27])&IF(RC[-26]="",,"|n"&R1C9&RC[-26])&IF(RC[-25]="",,"|n"&R1C10&RC[-25])&IF(RC[-24]="",,"|n"&R1C11&RC[-24])&IF(RC[-23]="",,"|n"&R1C12&RC[-23])&IF(RC[-22]="",,"|n"&R1C13&RC[-22])&IF(RC[-20]&RC[-19]&RC[-18]&RC[-17]="",,"|n"&R1C14)&IF(RC[-20]="",,"|n"&R1C15&RC[-20])&IF(RC[-19]="",,"|n"&R1C16&RC[-19])&IF(RC[-18]="",,"|n"&R1C17&RC[-18])&IF(RC[-17]="",,"|n"&R1C18&RC[-17])&IF(RC[-16]="",,"|n"&R1C19&RC[-16])&IF(RC[-15]="",,"|n"&R1C20&RC[-15])&IF(RC[-14]="",,"|n"&R1C21&RC[-14])&IF(RC[-13]="",,"|n"&R1C22&RC[-13])&IF(RC[-11]="",,"|n"&R1C24&RC[-11])&IF(RC[-10]="",,"|n"&R1C25&RC[-10])&IF(RC[-9]="",,"|n"&R1C26&RC[-9])&IF(RC[-8]="",,"|n"&R1C27&RC[-8])&IF(RC[-7]="",,"|n"&R1C28&RC[-7])&IF(RC[-6]="",,"|n"&R1C29&RC[-6])&IF(RC[-2]="",,"|n"&RC[-2]) -> 
AI928: =IF(RC[-27]&RC[-26]&RC[-25]&RC[-24]&RC[-23]&RC[-22]="",,R1C7)&IF(RC[-27]="",,"|n"&R1C8&RC[-27])&IF(RC[-26]="",,"|n"&R1C9&RC[-26])&IF(RC[-25]="",,"|n"&R1C10&RC[-25])&IF(RC[-24]="",,"|n"&R1C11&RC[-24])&IF(RC[-23]="",,"|n"&R1C12&RC[-23])&IF(RC[-22]="",,"|n"&R1C13&RC[-22])&IF(RC[-20]&RC[-19]&RC[-18]&RC[-17]="",,"|n"&R1C14)&IF(RC[-20]="",,"|n"&R1C15&RC[-20])&IF(RC[-19]="",,"|n"&R1C16&RC[-19])&IF(RC[-18]="",,"|n"&R1C17&RC[-18])&IF(RC[-17]="",,"|n"&R1C18&RC[-17])&IF(RC[-16]="",,"|n"&R1C19&RC[-16])&IF(RC[-15]="",,"|n"&R1C20&RC[-15])&IF(RC[-14]="",,"|n"&R1C21&RC[-14])&IF(RC[-13]="",,"|n"&R1C22&RC[-13])&IF(RC[-11]="",,"|n"&R1C24&RC[-11])&IF(RC[-10]="",,"|n"&R1C25&RC[-10])&IF(RC[-9]="",,"|n"&R1C26&RC[-9])&IF(RC[-8]="",,"|n"&R1C27&RC[-8])&IF(RC[-7]="",,"|n"&R1C28&RC[-7])&IF(RC[-6]="",,"|n"&R1C29&RC[-6])&IF(RC[-2]="",,"|n"&RC[-2]) -> 
AI929: =IF(RC[-27]&RC[-26]&RC[-25]&RC[-24]&RC[-23]&RC[-22]="",,R1C7)&IF(RC[-27]="",,"|n"&R1C8&RC[-27])&IF(RC[-26]="",,"|n"&R1C9&RC[-26])&IF(RC[-25]="",,"|n"&R1C10&RC[-25])&IF(RC[-24]="",,"|n"&R1C11&RC[-24])&IF(RC[-23]="",,"|n"&R1C12&RC[-23])&IF(RC[-22]="",,"|n"&R1C13&RC[-22])&IF(RC[-20]&RC[-19]&RC[-18]&RC[-17]="",,"|n"&R1C14)&IF(RC[-20]="",,"|n"&R1C15&RC[-20])&IF(RC[-19]="",,"|n"&R1C16&RC[-19])&IF(RC[-18]="",,"|n"&R1C17&RC[-18])&IF(RC[-17]="",,"|n"&R1C18&RC[-17])&IF(RC[-16]="",,"|n"&R1C19&RC[-16])&IF(RC[-15]="",,"|n"&R1C20&RC[-15])&IF(RC[-14]="",,"|n"&R1C21&RC[-14])&IF(RC[-13]="",,"|n"&R1C22&RC[-13])&IF(RC[-11]="",,"|n"&R1C24&RC[-11])&IF(RC[-10]="",,"|n"&R1C25&RC[-10])&IF(RC[-9]="",,"|n"&R1C26&RC[-9])&IF(RC[-8]="",,"|n"&R1C27&RC[-8])&IF(RC[-7]="",,"|n"&R1C28&RC[-7])&IF(RC[-6]="",,"|n"&R1C29&RC[-6])&IF(RC[-2]="",,"|n"&RC[-2]) -> 
AI930: =IF(RC[-27]&RC[-26]&RC[-25]&RC[-24]&RC[-23]&RC[-22]="",,R1C7)&IF(RC[-27]="",,"|n"&R1C8&RC[-27])&IF(RC[-26]="",,"|n"&R1C9&RC[-26])&IF(RC[-25]="",,"|n"&R1C10&RC[-25])&IF(RC[-24]="",,"|n"&R1C11&RC[-24])&IF(RC[-23]="",,"|n"&R1C12&RC[-23])&IF(RC[-22]="",,"|n"&R1C13&RC[-22])&IF(RC[-20]&RC[-19]&RC[-18]&RC[-17]="",,"|n"&R1C14)&IF(RC[-20]="",,"|n"&R1C15&RC[-20])&IF(RC[-19]="",,"|n"&R1C16&RC[-19])&IF(RC[-18]="",,"|n"&R1C17&RC[-18])&IF(RC[-17]="",,"|n"&R1C18&RC[-17])&IF(RC[-16]="",,"|n"&R1C19&RC[-16])&IF(RC[-15]="",,"|n"&R1C20&RC[-15])&IF(RC[-14]="",,"|n"&R1C21&RC[-14])&IF(RC[-13]="",,"|n"&R1C22&RC[-13])&IF(RC[-11]="",,"|n"&R1C24&RC[-11])&IF(RC[-10]="",,"|n"&R1C25&RC[-10])&IF(RC[-9]="",,"|n"&R1C26&RC[-9])&IF(RC[-8]="",,"|n"&R1C27&RC[-8])&IF(RC[-7]="",,"|n"&R1C28&RC[-7])&IF(RC[-6]="",,"|n"&R1C29&RC[-6])&IF(RC[-2]="",,"|n"&RC[-2]) -> 
AI931: =IF(RC[-27]&RC[-26]&RC[-25]&RC[-24]&RC[-23]&RC[-22]="",,R1C7)&IF(RC[-27]="",,"|n"&R1C8&RC[-27])&IF(RC[-26]="",,"|n"&R1C9&RC[-26])&IF(RC[-25]="",,"|n"&R1C10&RC[-25])&IF(RC[-24]="",,"|n"&R1C11&RC[-24])&IF(RC[-23]="",,"|n"&R1C12&RC[-23])&IF(RC[-22]="",,"|n"&R1C13&RC[-22])&IF(RC[-20]&RC[-19]&RC[-18]&RC[-17]="",,"|n"&R1C14)&IF(RC[-20]="",,"|n"&R1C15&RC[-20])&IF(RC[-19]="",,"|n"&R1C16&RC[-19])&IF(RC[-18]="",,"|n"&R1C17&RC[-18])&IF(RC[-17]="",,"|n"&R1C18&RC[-17])&IF(RC[-16]="",,"|n"&R1C19&RC[-16])&IF(RC[-15]="",,"|n"&R1C20&RC[-15])&IF(RC[-14]="",,"|n"&R1C21&RC[-14])&IF(RC[-13]="",,"|n"&R1C22&RC[-13])&IF(RC[-11]="",,"|n"&R1C24&RC[-11])&IF(RC[-10]="",,"|n"&R1C25&RC[-10])&IF(RC[-9]="",,"|n"&R1C26&RC[-9])&IF(RC[-8]="",,"|n"&R1C27&RC[-8])&IF(RC[-7]="",,"|n"&R1C28&RC[-7])&IF(RC[-6]="",,"|n"&R1C29&RC[-6])&IF(RC[-2]="",,"|n"&RC[-2]) -> 
AI932: =IF(RC[-27]&RC[-26]&RC[-25]&RC[-24]&RC[-23]&RC[-22]="",,R1C7)&IF(RC[-27]="",,"|n"&R1C8&RC[-27])&IF(RC[-26]="",,"|n"&R1C9&RC[-26])&IF(RC[-25]="",,"|n"&R1C10&RC[-25])&IF(RC[-24]="",,"|n"&R1C11&RC[-24])&IF(RC[-23]="",,"|n"&R1C12&RC[-23])&IF(RC[-22]="",,"|n"&R1C13&RC[-22])&IF(RC[-20]&RC[-19]&RC[-18]&RC[-17]="",,"|n"&R1C14)&IF(RC[-20]="",,"|n"&R1C15&RC[-20])&IF(RC[-19]="",,"|n"&R1C16&RC[-19])&IF(RC[-18]="",,"|n"&R1C17&RC[-18])&IF(RC[-17]="",,"|n"&R1C18&RC[-17])&IF(RC[-16]="",,"|n"&R1C19&RC[-16])&IF(RC[-15]="",,"|n"&R1C20&RC[-15])&IF(RC[-14]="",,"|n"&R1C21&RC[-14])&IF(RC[-13]="",,"|n"&R1C22&RC[-13])&IF(RC[-11]="",,"|n"&R1C24&RC[-11])&IF(RC[-10]="",,"|n"&R1C25&RC[-10])&IF(RC[-9]="",,"|n"&R1C26&RC[-9])&IF(RC[-8]="",,"|n"&R1C27&RC[-8])&IF(RC[-7]="",,"|n"&R1C28&RC[-7])&IF(RC[-6]="",,"|n"&R1C29&RC[-6])&IF(RC[-2]="",,"|n"&RC[-2]) -> 
AI933: =IF(RC[-27]&RC[-26]&RC[-25]&RC[-24]&RC[-23]&RC[-22]="",,R1C7)&IF(RC[-27]="",,"|n"&R1C8&RC[-27])&IF(RC[-26]="",,"|n"&R1C9&RC[-26])&IF(RC[-25]="",,"|n"&R1C10&RC[-25])&IF(RC[-24]="",,"|n"&R1C11&RC[-24])&IF(RC[-23]="",,"|n"&R1C12&RC[-23])&IF(RC[-22]="",,"|n"&R1C13&RC[-22])&IF(RC[-20]&RC[-19]&RC[-18]&RC[-17]="",,"|n"&R1C14)&IF(RC[-20]="",,"|n"&R1C15&RC[-20])&IF(RC[-19]="",,"|n"&R1C16&RC[-19])&IF(RC[-18]="",,"|n"&R1C17&RC[-18])&IF(RC[-17]="",,"|n"&R1C18&RC[-17])&IF(RC[-16]="",,"|n"&R1C19&RC[-16])&IF(RC[-15]="",,"|n"&R1C20&RC[-15])&IF(RC[-14]="",,"|n"&R1C21&RC[-14])&IF(RC[-13]="",,"|n"&R1C22&RC[-13])&IF(RC[-11]="",,"|n"&R1C24&RC[-11])&IF(RC[-10]="",,"|n"&R1C25&RC[-10])&IF(RC[-9]="",,"|n"&R1C26&RC[-9])&IF(RC[-8]="",,"|n"&R1C27&RC[-8])&IF(RC[-7]="",,"|n"&R1C28&RC[-7])&IF(RC[-6]="",,"|n"&R1C29&RC[-6])&IF(RC[-2]="",,"|n"&RC[-2]) -> 
AI934: =IF(RC[-27]&RC[-26]&RC[-25]&RC[-24]&RC[-23]&RC[-22]="",,R1C7)&IF(RC[-27]="",,"|n"&R1C8&RC[-27])&IF(RC[-26]="",,"|n"&R1C9&RC[-26])&IF(RC[-25]="",,"|n"&R1C10&RC[-25])&IF(RC[-24]="",,"|n"&R1C11&RC[-24])&IF(RC[-23]="",,"|n"&R1C12&RC[-23])&IF(RC[-22]="",,"|n"&R1C13&RC[-22])&IF(RC[-20]&RC[-19]&RC[-18]&RC[-17]="",,"|n"&R1C14)&IF(RC[-20]="",,"|n"&R1C15&RC[-20])&IF(RC[-19]="",,"|n"&R1C16&RC[-19])&IF(RC[-18]="",,"|n"&R1C17&RC[-18])&IF(RC[-17]="",,"|n"&R1C18&RC[-17])&IF(RC[-16]="",,"|n"&R1C19&RC[-16])&IF(RC[-15]="",,"|n"&R1C20&RC[-15])&IF(RC[-14]="",,"|n"&R1C21&RC[-14])&IF(RC[-13]="",,"|n"&R1C22&RC[-13])&IF(RC[-11]="",,"|n"&R1C24&RC[-11])&IF(RC[-10]="",,"|n"&R1C25&RC[-10])&IF(RC[-9]="",,"|n"&R1C26&RC[-9])&IF(RC[-8]="",,"|n"&R1C27&RC[-8])&IF(RC[-7]="",,"|n"&R1C28&RC[-7])&IF(RC[-6]="",,"|n"&R1C29&RC[-6])&IF(RC[-2]="",,"|n"&RC[-2]) -> 
AI935: =IF(RC[-27]&RC[-26]&RC[-25]&RC[-24]&RC[-23]&RC[-22]="",,R1C7)&IF(RC[-27]="",,"|n"&R1C8&RC[-27])&IF(RC[-26]="",,"|n"&R1C9&RC[-26])&IF(RC[-25]="",,"|n"&R1C10&RC[-25])&IF(RC[-24]="",,"|n"&R1C11&RC[-24])&IF(RC[-23]="",,"|n"&R1C12&RC[-23])&IF(RC[-22]="",,"|n"&R1C13&RC[-22])&IF(RC[-20]&RC[-19]&RC[-18]&RC[-17]="",,"|n"&R1C14)&IF(RC[-20]="",,"|n"&R1C15&RC[-20])&IF(RC[-19]="",,"|n"&R1C16&RC[-19])&IF(RC[-18]="",,"|n"&R1C17&RC[-18])&IF(RC[-17]="",,"|n"&R1C18&RC[-17])&IF(RC[-16]="",,"|n"&R1C19&RC[-16])&IF(RC[-15]="",,"|n"&R1C20&RC[-15])&IF(RC[-14]="",,"|n"&R1C21&RC[-14])&IF(RC[-13]="",,"|n"&R1C22&RC[-13])&IF(RC[-11]="",,"|n"&R1C24&RC[-11])&IF(RC[-10]="",,"|n"&R1C25&RC[-10])&IF(RC[-9]="",,"|n"&R1C26&RC[-9])&IF(RC[-8]="",,"|n"&R1C27&RC[-8])&IF(RC[-7]="",,"|n"&R1C28&RC[-7])&IF(RC[-6]="",,"|n"&R1C29&RC[-6])&IF(RC[-2]="",,"|n"&RC[-2]) -> 
AI936: =IF(RC[-27]&RC[-26]&RC[-25]&RC[-24]&RC[-23]&RC[-22]="",,R1C7)&IF(RC[-27]="",,"|n"&R1C8&RC[-27])&IF(RC[-26]="",,"|n"&R1C9&RC[-26])&IF(RC[-25]="",,"|n"&R1C10&RC[-25])&IF(RC[-24]="",,"|n"&R1C11&RC[-24])&IF(RC[-23]="",,"|n"&R1C12&RC[-23])&IF(RC[-22]="",,"|n"&R1C13&RC[-22])&IF(RC[-20]&RC[-19]&RC[-18]&RC[-17]="",,"|n"&R1C14)&IF(RC[-20]="",,"|n"&R1C15&RC[-20])&IF(RC[-19]="",,"|n"&R1C16&RC[-19])&IF(RC[-18]="",,"|n"&R1C17&RC[-18])&IF(RC[-17]="",,"|n"&R1C18&RC[-17])&IF(RC[-16]="",,"|n"&R1C19&RC[-16])&IF(RC[-15]="",,"|n"&R1C20&RC[-15])&IF(RC[-14]="",,"|n"&R1C21&RC[-14])&IF(RC[-13]="",,"|n"&R1C22&RC[-13])&IF(RC[-11]="",,"|n"&R1C24&RC[-11])&IF(RC[-10]="",,"|n"&R1C25&RC[-10])&IF(RC[-9]="",,"|n"&R1C26&RC[-9])&IF(RC[-8]="",,"|n"&R1C27&RC[-8])&IF(RC[-7]="",,"|n"&R1C28&RC[-7])&IF(RC[-6]="",,"|n"&R1C29&RC[-6])&IF(RC[-2]="",,"|n"&RC[-2]) -> 
AI937: =IF(RC[-27]&RC[-26]&RC[-25]&RC[-24]&RC[-23]&RC[-22]="",,R1C7)&IF(RC[-27]="",,"|n"&R1C8&RC[-27])&IF(RC[-26]="",,"|n"&R1C9&RC[-26])&IF(RC[-25]="",,"|n"&R1C10&RC[-25])&IF(RC[-24]="",,"|n"&R1C11&RC[-24])&IF(RC[-23]="",,"|n"&R1C12&RC[-23])&IF(RC[-22]="",,"|n"&R1C13&RC[-22])&IF(RC[-20]&RC[-19]&RC[-18]&RC[-17]="",,"|n"&R1C14)&IF(RC[-20]="",,"|n"&R1C15&RC[-20])&IF(RC[-19]="",,"|n"&R1C16&RC[-19])&IF(RC[-18]="",,"|n"&R1C17&RC[-18])&IF(RC[-17]="",,"|n"&R1C18&RC[-17])&IF(RC[-16]="",,"|n"&R1C19&RC[-16])&IF(RC[-15]="",,"|n"&R1C20&RC[-15])&IF(RC[-14]="",,"|n"&R1C21&RC[-14])&IF(RC[-13]="",,"|n"&R1C22&RC[-13])&IF(RC[-11]="",,"|n"&R1C24&RC[-11])&IF(RC[-10]="",,"|n"&R1C25&RC[-10])&IF(RC[-9]="",,"|n"&R1C26&RC[-9])&IF(RC[-8]="",,"|n"&R1C27&RC[-8])&IF(RC[-7]="",,"|n"&R1C28&RC[-7])&IF(RC[-6]="",,"|n"&R1C29&RC[-6])&IF(RC[-2]="",,"|n"&RC[-2]) -> 
AI938: =IF(RC[-27]&RC[-26]&RC[-25]&RC[-24]&RC[-23]&RC[-22]="",,R1C7)&IF(RC[-27]="",,"|n"&R1C8&RC[-27])&IF(RC[-26]="",,"|n"&R1C9&RC[-26])&IF(RC[-25]="",,"|n"&R1C10&RC[-25])&IF(RC[-24]="",,"|n"&R1C11&RC[-24])&IF(RC[-23]="",,"|n"&R1C12&RC[-23])&IF(RC[-22]="",,"|n"&R1C13&RC[-22])&IF(RC[-20]&RC[-19]&RC[-18]&RC[-17]="",,"|n"&R1C14)&IF(RC[-20]="",,"|n"&R1C15&RC[-20])&IF(RC[-19]="",,"|n"&R1C16&RC[-19])&IF(RC[-18]="",,"|n"&R1C17&RC[-18])&IF(RC[-17]="",,"|n"&R1C18&RC[-17])&IF(RC[-16]="",,"|n"&R1C19&RC[-16])&IF(RC[-15]="",,"|n"&R1C20&RC[-15])&IF(RC[-14]="",,"|n"&R1C21&RC[-14])&IF(RC[-13]="",,"|n"&R1C22&RC[-13])&IF(RC[-11]="",,"|n"&R1C24&RC[-11])&IF(RC[-10]="",,"|n"&R1C25&RC[-10])&IF(RC[-9]="",,"|n"&R1C26&RC[-9])&IF(RC[-8]="",,"|n"&R1C27&RC[-8])&IF(RC[-7]="",,"|n"&R1C28&RC[-7])&IF(RC[-6]="",,"|n"&R1C29&RC[-6])&IF(RC[-2]="",,"|n"&RC[-2]) -> 
AI939: =IF(RC[-27]&RC[-26]&RC[-25]&RC[-24]&RC[-23]&RC[-22]="",,R1C7)&IF(RC[-27]="",,"|n"&R1C8&RC[-27])&IF(RC[-26]="",,"|n"&R1C9&RC[-26])&IF(RC[-25]="",,"|n"&R1C10&RC[-25])&IF(RC[-24]="",,"|n"&R1C11&RC[-24])&IF(RC[-23]="",,"|n"&R1C12&RC[-23])&IF(RC[-22]="",,"|n"&R1C13&RC[-22])&IF(RC[-20]&RC[-19]&RC[-18]&RC[-17]="",,"|n"&R1C14)&IF(RC[-20]="",,"|n"&R1C15&RC[-20])&IF(RC[-19]="",,"|n"&R1C16&RC[-19])&IF(RC[-18]="",,"|n"&R1C17&RC[-18])&IF(RC[-17]="",,"|n"&R1C18&RC[-17])&IF(RC[-16]="",,"|n"&R1C19&RC[-16])&IF(RC[-15]="",,"|n"&R1C20&RC[-15])&IF(RC[-14]="",,"|n"&R1C21&RC[-14])&IF(RC[-13]="",,"|n"&R1C22&RC[-13])&IF(RC[-11]="",,"|n"&R1C24&RC[-11])&IF(RC[-10]="",,"|n"&R1C25&RC[-10])&IF(RC[-9]="",,"|n"&R1C26&RC[-9])&IF(RC[-8]="",,"|n"&R1C27&RC[-8])&IF(RC[-7]="",,"|n"&R1C28&RC[-7])&IF(RC[-6]="",,"|n"&R1C29&RC[-6])&IF(RC[-2]="",,"|n"&RC[-2]) -> 
AI940: =IF(RC[-27]&RC[-26]&RC[-25]&RC[-24]&RC[-23]&RC[-22]="",,R1C7)&IF(RC[-27]="",,"|n"&R1C8&RC[-27])&IF(RC[-26]="",,"|n"&R1C9&RC[-26])&IF(RC[-25]="",,"|n"&R1C10&RC[-25])&IF(RC[-24]="",,"|n"&R1C11&RC[-24])&IF(RC[-23]="",,"|n"&R1C12&RC[-23])&IF(RC[-22]="",,"|n"&R1C13&RC[-22])&IF(RC[-20]&RC[-19]&RC[-18]&RC[-17]="",,"|n"&R1C14)&IF(RC[-20]="",,"|n"&R1C15&RC[-20])&IF(RC[-19]="",,"|n"&R1C16&RC[-19])&IF(RC[-18]="",,"|n"&R1C17&RC[-18])&IF(RC[-17]="",,"|n"&R1C18&RC[-17])&IF(RC[-16]="",,"|n"&R1C19&RC[-16])&IF(RC[-15]="",,"|n"&R1C20&RC[-15])&IF(RC[-14]="",,"|n"&R1C21&RC[-14])&IF(RC[-13]="",,"|n"&R1C22&RC[-13])&IF(RC[-11]="",,"|n"&R1C24&RC[-11])&IF(RC[-10]="",,"|n"&R1C25&RC[-10])&IF(RC[-9]="",,"|n"&R1C26&RC[-9])&IF(RC[-8]="",,"|n"&R1C27&RC[-8])&IF(RC[-7]="",,"|n"&R1C28&RC[-7])&IF(RC[-6]="",,"|n"&R1C29&RC[-6])&IF(RC[-2]="",,"|n"&RC[-2]) -> 
AI941: =IF(RC[-27]&RC[-26]&RC[-25]&RC[-24]&RC[-23]&RC[-22]="",,R1C7)&IF(RC[-27]="",,"|n"&R1C8&RC[-27])&IF(RC[-26]="",,"|n"&R1C9&RC[-26])&IF(RC[-25]="",,"|n"&R1C10&RC[-25])&IF(RC[-24]="",,"|n"&R1C11&RC[-24])&IF(RC[-23]="",,"|n"&R1C12&RC[-23])&IF(RC[-22]="",,"|n"&R1C13&RC[-22])&IF(RC[-20]&RC[-19]&RC[-18]&RC[-17]="",,"|n"&R1C14)&IF(RC[-20]="",,"|n"&R1C15&RC[-20])&IF(RC[-19]="",,"|n"&R1C16&RC[-19])&IF(RC[-18]="",,"|n"&R1C17&RC[-18])&IF(RC[-17]="",,"|n"&R1C18&RC[-17])&IF(RC[-16]="",,"|n"&R1C19&RC[-16])&IF(RC[-15]="",,"|n"&R1C20&RC[-15])&IF(RC[-14]="",,"|n"&R1C21&RC[-14])&IF(RC[-13]="",,"|n"&R1C22&RC[-13])&IF(RC[-11]="",,"|n"&R1C24&RC[-11])&IF(RC[-10]="",,"|n"&R1C25&RC[-10])&IF(RC[-9]="",,"|n"&R1C26&RC[-9])&IF(RC[-8]="",,"|n"&R1C27&RC[-8])&IF(RC[-7]="",,"|n"&R1C28&RC[-7])&IF(RC[-6]="",,"|n"&R1C29&RC[-6])&IF(RC[-2]="",,"|n"&RC[-2]) -> 
AI942: =IF(RC[-27]&RC[-26]&RC[-25]&RC[-24]&RC[-23]&RC[-22]="",,R1C7)&IF(RC[-27]="",,"|n"&R1C8&RC[-27])&IF(RC[-26]="",,"|n"&R1C9&RC[-26])&IF(RC[-25]="",,"|n"&R1C10&RC[-25])&IF(RC[-24]="",,"|n"&R1C11&RC[-24])&IF(RC[-23]="",,"|n"&R1C12&RC[-23])&IF(RC[-22]="",,"|n"&R1C13&RC[-22])&IF(RC[-20]&RC[-19]&RC[-18]&RC[-17]="",,"|n"&R1C14)&IF(RC[-20]="",,"|n"&R1C15&RC[-20])&IF(RC[-19]="",,"|n"&R1C16&RC[-19])&IF(RC[-18]="",,"|n"&R1C17&RC[-18])&IF(RC[-17]="",,"|n"&R1C18&RC[-17])&IF(RC[-16]="",,"|n"&R1C19&RC[-16])&IF(RC[-15]="",,"|n"&R1C20&RC[-15])&IF(RC[-14]="",,"|n"&R1C21&RC[-14])&IF(RC[-13]="",,"|n"&R1C22&RC[-13])&IF(RC[-11]="",,"|n"&R1C24&RC[-11])&IF(RC[-10]="",,"|n"&R1C25&RC[-10])&IF(RC[-9]="",,"|n"&R1C26&RC[-9])&IF(RC[-8]="",,"|n"&R1C27&RC[-8])&IF(RC[-7]="",,"|n"&R1C28&RC[-7])&IF(RC[-6]="",,"|n"&R1C29&RC[-6])&IF(RC[-2]="",,"|n"&RC[-2]) -> 
AI943: =IF(RC[-27]&RC[-26]&RC[-25]&RC[-24]&RC[-23]&RC[-22]="",,R1C7)&IF(RC[-27]="",,"|n"&R1C8&RC[-27])&IF(RC[-26]="",,"|n"&R1C9&RC[-26])&IF(RC[-25]="",,"|n"&R1C10&RC[-25])&IF(RC[-24]="",,"|n"&R1C11&RC[-24])&IF(RC[-23]="",,"|n"&R1C12&RC[-23])&IF(RC[-22]="",,"|n"&R1C13&RC[-22])&IF(RC[-20]&RC[-19]&RC[-18]&RC[-17]="",,"|n"&R1C14)&IF(RC[-20]="",,"|n"&R1C15&RC[-20])&IF(RC[-19]="",,"|n"&R1C16&RC[-19])&IF(RC[-18]="",,"|n"&R1C17&RC[-18])&IF(RC[-17]="",,"|n"&R1C18&RC[-17])&IF(RC[-16]="",,"|n"&R1C19&RC[-16])&IF(RC[-15]="",,"|n"&R1C20&RC[-15])&IF(RC[-14]="",,"|n"&R1C21&RC[-14])&IF(RC[-13]="",,"|n"&R1C22&RC[-13])&IF(RC[-11]="",,"|n"&R1C24&RC[-11])&IF(RC[-10]="",,"|n"&R1C25&RC[-10])&IF(RC[-9]="",,"|n"&R1C26&RC[-9])&IF(RC[-8]="",,"|n"&R1C27&RC[-8])&IF(RC[-7]="",,"|n"&R1C28&RC[-7])&IF(RC[-6]="",,"|n"&R1C29&RC[-6])&IF(RC[-2]="",,"|n"&RC[-2]) -> 
AI944: =IF(RC[-27]&RC[-26]&RC[-25]&RC[-24]&RC[-23]&RC[-22]="",,R1C7)&IF(RC[-27]="",,"|n"&R1C8&RC[-27])&IF(RC[-26]="",,"|n"&R1C9&RC[-26])&IF(RC[-25]="",,"|n"&R1C10&RC[-25])&IF(RC[-24]="",,"|n"&R1C11&RC[-24])&IF(RC[-23]="",,"|n"&R1C12&RC[-23])&IF(RC[-22]="",,"|n"&R1C13&RC[-22])&IF(RC[-20]&RC[-19]&RC[-18]&RC[-17]="",,"|n"&R1C14)&IF(RC[-20]="",,"|n"&R1C15&RC[-20])&IF(RC[-19]="",,"|n"&R1C16&RC[-19])&IF(RC[-18]="",,"|n"&R1C17&RC[-18])&IF(RC[-17]="",,"|n"&R1C18&RC[-17])&IF(RC[-16]="",,"|n"&R1C19&RC[-16])&IF(RC[-15]="",,"|n"&R1C20&RC[-15])&IF(RC[-14]="",,"|n"&R1C21&RC[-14])&IF(RC[-13]="",,"|n"&R1C22&RC[-13])&IF(RC[-11]="",,"|n"&R1C24&RC[-11])&IF(RC[-10]="",,"|n"&R1C25&RC[-10])&IF(RC[-9]="",,"|n"&R1C26&RC[-9])&IF(RC[-8]="",,"|n"&R1C27&RC[-8])&IF(RC[-7]="",,"|n"&R1C28&RC[-7])&IF(RC[-6]="",,"|n"&R1C29&RC[-6])&IF(RC[-2]="",,"|n"&RC[-2]) -> 
AI945: =IF(RC[-27]&RC[-26]&RC[-25]&RC[-24]&RC[-23]&RC[-22]="",,R1C7)&IF(RC[-27]="",,"|n"&R1C8&RC[-27])&IF(RC[-26]="",,"|n"&R1C9&RC[-26])&IF(RC[-25]="",,"|n"&R1C10&RC[-25])&IF(RC[-24]="",,"|n"&R1C11&RC[-24])&IF(RC[-23]="",,"|n"&R1C12&RC[-23])&IF(RC[-22]="",,"|n"&R1C13&RC[-22])&IF(RC[-20]&RC[-19]&RC[-18]&RC[-17]="",,"|n"&R1C14)&IF(RC[-20]="",,"|n"&R1C15&RC[-20])&IF(RC[-19]="",,"|n"&R1C16&RC[-19])&IF(RC[-18]="",,"|n"&R1C17&RC[-18])&IF(RC[-17]="",,"|n"&R1C18&RC[-17])&IF(RC[-16]="",,"|n"&R1C19&RC[-16])&IF(RC[-15]="",,"|n"&R1C20&RC[-15])&IF(RC[-14]="",,"|n"&R1C21&RC[-14])&IF(RC[-13]="",,"|n"&R1C22&RC[-13])&IF(RC[-11]="",,"|n"&R1C24&RC[-11])&IF(RC[-10]="",,"|n"&R1C25&RC[-10])&IF(RC[-9]="",,"|n"&R1C26&RC[-9])&IF(RC[-8]="",,"|n"&R1C27&RC[-8])&IF(RC[-7]="",,"|n"&R1C28&RC[-7])&IF(RC[-6]="",,"|n"&R1C29&RC[-6])&IF(RC[-2]="",,"|n"&RC[-2]) -> 
AI946: =IF(RC[-27]&RC[-26]&RC[-25]&RC[-24]&RC[-23]&RC[-22]="",,R1C7)&IF(RC[-27]="",,"|n"&R1C8&RC[-27])&IF(RC[-26]="",,"|n"&R1C9&RC[-26])&IF(RC[-25]="",,"|n"&R1C10&RC[-25])&IF(RC[-24]="",,"|n"&R1C11&RC[-24])&IF(RC[-23]="",,"|n"&R1C12&RC[-23])&IF(RC[-22]="",,"|n"&R1C13&RC[-22])&IF(RC[-20]&RC[-19]&RC[-18]&RC[-17]="",,"|n"&R1C14)&IF(RC[-20]="",,"|n"&R1C15&RC[-20])&IF(RC[-19]="",,"|n"&R1C16&RC[-19])&IF(RC[-18]="",,"|n"&R1C17&RC[-18])&IF(RC[-17]="",,"|n"&R1C18&RC[-17])&IF(RC[-16]="",,"|n"&R1C19&RC[-16])&IF(RC[-15]="",,"|n"&R1C20&RC[-15])&IF(RC[-14]="",,"|n"&R1C21&RC[-14])&IF(RC[-13]="",,"|n"&R1C22&RC[-13])&IF(RC[-11]="",,"|n"&R1C24&RC[-11])&IF(RC[-10]="",,"|n"&R1C25&RC[-10])&IF(RC[-9]="",,"|n"&R1C26&RC[-9])&IF(RC[-8]="",,"|n"&R1C27&RC[-8])&IF(RC[-7]="",,"|n"&R1C28&RC[-7])&IF(RC[-6]="",,"|n"&R1C29&RC[-6])&IF(RC[-2]="",,"|n"&RC[-2]) -> 
AI947: =IF(RC[-27]&RC[-26]&RC[-25]&RC[-24]&RC[-23]&RC[-22]="",,R1C7)&IF(RC[-27]="",,"|n"&R1C8&RC[-27])&IF(RC[-26]="",,"|n"&R1C9&RC[-26])&IF(RC[-25]="",,"|n"&R1C10&RC[-25])&IF(RC[-24]="",,"|n"&R1C11&RC[-24])&IF(RC[-23]="",,"|n"&R1C12&RC[-23])&IF(RC[-22]="",,"|n"&R1C13&RC[-22])&IF(RC[-20]&RC[-19]&RC[-18]&RC[-17]="",,"|n"&R1C14)&IF(RC[-20]="",,"|n"&R1C15&RC[-20])&IF(RC[-19]="",,"|n"&R1C16&RC[-19])&IF(RC[-18]="",,"|n"&R1C17&RC[-18])&IF(RC[-17]="",,"|n"&R1C18&RC[-17])&IF(RC[-16]="",,"|n"&R1C19&RC[-16])&IF(RC[-15]="",,"|n"&R1C20&RC[-15])&IF(RC[-14]="",,"|n"&R1C21&RC[-14])&IF(RC[-13]="",,"|n"&R1C22&RC[-13])&IF(RC[-11]="",,"|n"&R1C24&RC[-11])&IF(RC[-10]="",,"|n"&R1C25&RC[-10])&IF(RC[-9]="",,"|n"&R1C26&RC[-9])&IF(RC[-8]="",,"|n"&R1C27&RC[-8])&IF(RC[-7]="",,"|n"&R1C28&RC[-7])&IF(RC[-6]="",,"|n"&R1C29&RC[-6])&IF(RC[-2]="",,"|n"&RC[-2]) -> 
AI948: =IF(RC[-27]&RC[-26]&RC[-25]&RC[-24]&RC[-23]&RC[-22]="",,R1C7)&IF(RC[-27]="",,"|n"&R1C8&RC[-27])&IF(RC[-26]="",,"|n"&R1C9&RC[-26])&IF(RC[-25]="",,"|n"&R1C10&RC[-25])&IF(RC[-24]="",,"|n"&R1C11&RC[-24])&IF(RC[-23]="",,"|n"&R1C12&RC[-23])&IF(RC[-22]="",,"|n"&R1C13&RC[-22])&IF(RC[-20]&RC[-19]&RC[-18]&RC[-17]="",,"|n"&R1C14)&IF(RC[-20]="",,"|n"&R1C15&RC[-20])&IF(RC[-19]="",,"|n"&R1C16&RC[-19])&IF(RC[-18]="",,"|n"&R1C17&RC[-18])&IF(RC[-17]="",,"|n"&R1C18&RC[-17])&IF(RC[-16]="",,"|n"&R1C19&RC[-16])&IF(RC[-15]="",,"|n"&R1C20&RC[-15])&IF(RC[-14]="",,"|n"&R1C21&RC[-14])&IF(RC[-13]="",,"|n"&R1C22&RC[-13])&IF(RC[-11]="",,"|n"&R1C24&RC[-11])&IF(RC[-10]="",,"|n"&R1C25&RC[-10])&IF(RC[-9]="",,"|n"&R1C26&RC[-9])&IF(RC[-8]="",,"|n"&R1C27&RC[-8])&IF(RC[-7]="",,"|n"&R1C28&RC[-7])&IF(RC[-6]="",,"|n"&R1C29&RC[-6])&IF(RC[-2]="",,"|n"&RC[-2]) -> 
AI949: =IF(RC[-27]&RC[-26]&RC[-25]&RC[-24]&RC[-23]&RC[-22]="",,R1C7)&IF(RC[-27]="",,"|n"&R1C8&RC[-27])&IF(RC[-26]="",,"|n"&R1C9&RC[-26])&IF(RC[-25]="",,"|n"&R1C10&RC[-25])&IF(RC[-24]="",,"|n"&R1C11&RC[-24])&IF(RC[-23]="",,"|n"&R1C12&RC[-23])&IF(RC[-22]="",,"|n"&R1C13&RC[-22])&IF(RC[-20]&RC[-19]&RC[-18]&RC[-17]="",,"|n"&R1C14)&IF(RC[-20]="",,"|n"&R1C15&RC[-20])&IF(RC[-19]="",,"|n"&R1C16&RC[-19])&IF(RC[-18]="",,"|n"&R1C17&RC[-18])&IF(RC[-17]="",,"|n"&R1C18&RC[-17])&IF(RC[-16]="",,"|n"&R1C19&RC[-16])&IF(RC[-15]="",,"|n"&R1C20&RC[-15])&IF(RC[-14]="",,"|n"&R1C21&RC[-14])&IF(RC[-13]="",,"|n"&R1C22&RC[-13])&IF(RC[-11]="",,"|n"&R1C24&RC[-11])&IF(RC[-10]="",,"|n"&R1C25&RC[-10])&IF(RC[-9]="",,"|n"&R1C26&RC[-9])&IF(RC[-8]="",,"|n"&R1C27&RC[-8])&IF(RC[-7]="",,"|n"&R1C28&RC[-7])&IF(RC[-6]="",,"|n"&R1C29&RC[-6])&IF(RC[-2]="",,"|n"&RC[-2]) -> 
AI950: =IF(RC[-27]&RC[-26]&RC[-25]&RC[-24]&RC[-23]&RC[-22]="",,R1C7)&IF(RC[-27]="",,"|n"&R1C8&RC[-27])&IF(RC[-26]="",,"|n"&R1C9&RC[-26])&IF(RC[-25]="",,"|n"&R1C10&RC[-25])&IF(RC[-24]="",,"|n"&R1C11&RC[-24])&IF(RC[-23]="",,"|n"&R1C12&RC[-23])&IF(RC[-22]="",,"|n"&R1C13&RC[-22])&IF(RC[-20]&RC[-19]&RC[-18]&RC[-17]="",,"|n"&R1C14)&IF(RC[-20]="",,"|n"&R1C15&RC[-20])&IF(RC[-19]="",,"|n"&R1C16&RC[-19])&IF(RC[-18]="",,"|n"&R1C17&RC[-18])&IF(RC[-17]="",,"|n"&R1C18&RC[-17])&IF(RC[-16]="",,"|n"&R1C19&RC[-16])&IF(RC[-15]="",,"|n"&R1C20&RC[-15])&IF(RC[-14]="",,"|n"&R1C21&RC[-14])&IF(RC[-13]="",,"|n"&R1C22&RC[-13])&IF(RC[-11]="",,"|n"&R1C24&RC[-11])&IF(RC[-10]="",,"|n"&R1C25&RC[-10])&IF(RC[-9]="",,"|n"&R1C26&RC[-9])&IF(RC[-8]="",,"|n"&R1C27&RC[-8])&IF(RC[-7]="",,"|n"&R1C28&RC[-7])&IF(RC[-6]="",,"|n"&R1C29&RC[-6])&IF(RC[-2]="",,"|n"&RC[-2]) -> 
AI951: =IF(RC[-27]&RC[-26]&RC[-25]&RC[-24]&RC[-23]&RC[-22]="",,R1C7)&IF(RC[-27]="",,"|n"&R1C8&RC[-27])&IF(RC[-26]="",,"|n"&R1C9&RC[-26])&IF(RC[-25]="",,"|n"&R1C10&RC[-25])&IF(RC[-24]="",,"|n"&R1C11&RC[-24])&IF(RC[-23]="",,"|n"&R1C12&RC[-23])&IF(RC[-22]="",,"|n"&R1C13&RC[-22])&IF(RC[-20]&RC[-19]&RC[-18]&RC[-17]="",,"|n"&R1C14)&IF(RC[-20]="",,"|n"&R1C15&RC[-20])&IF(RC[-19]="",,"|n"&R1C16&RC[-19])&IF(RC[-18]="",,"|n"&R1C17&RC[-18])&IF(RC[-17]="",,"|n"&R1C18&RC[-17])&IF(RC[-16]="",,"|n"&R1C19&RC[-16])&IF(RC[-15]="",,"|n"&R1C20&RC[-15])&IF(RC[-14]="",,"|n"&R1C21&RC[-14])&IF(RC[-13]="",,"|n"&R1C22&RC[-13])&IF(RC[-11]="",,"|n"&R1C24&RC[-11])&IF(RC[-10]="",,"|n"&R1C25&RC[-10])&IF(RC[-9]="",,"|n"&R1C26&RC[-9])&IF(RC[-8]="",,"|n"&R1C27&RC[-8])&IF(RC[-7]="",,"|n"&R1C28&RC[-7])&IF(RC[-6]="",,"|n"&R1C29&RC[-6])&IF(RC[-2]="",,"|n"&RC[-2]) -> 
AI952: =IF(RC[-27]&RC[-26]&RC[-25]&RC[-24]&RC[-23]&RC[-22]="",,R1C7)&IF(RC[-27]="",,"|n"&R1C8&RC[-27])&IF(RC[-26]="",,"|n"&R1C9&RC[-26])&IF(RC[-25]="",,"|n"&R1C10&RC[-25])&IF(RC[-24]="",,"|n"&R1C11&RC[-24])&IF(RC[-23]="",,"|n"&R1C12&RC[-23])&IF(RC[-22]="",,"|n"&R1C13&RC[-22])&IF(RC[-20]&RC[-19]&RC[-18]&RC[-17]="",,"|n"&R1C14)&IF(RC[-20]="",,"|n"&R1C15&RC[-20])&IF(RC[-19]="",,"|n"&R1C16&RC[-19])&IF(RC[-18]="",,"|n"&R1C17&RC[-18])&IF(RC[-17]="",,"|n"&R1C18&RC[-17])&IF(RC[-16]="",,"|n"&R1C19&RC[-16])&IF(RC[-15]="",,"|n"&R1C20&RC[-15])&IF(RC[-14]="",,"|n"&R1C21&RC[-14])&IF(RC[-13]="",,"|n"&R1C22&RC[-13])&IF(RC[-11]="",,"|n"&R1C24&RC[-11])&IF(RC[-10]="",,"|n"&R1C25&RC[-10])&IF(RC[-9]="",,"|n"&R1C26&RC[-9])&IF(RC[-8]="",,"|n"&R1C27&RC[-8])&IF(RC[-7]="",,"|n"&R1C28&RC[-7])&IF(RC[-6]="",,"|n"&R1C29&RC[-6])&IF(RC[-2]="",,"|n"&RC[-2]) -> 
AI953: =IF(RC[-27]&RC[-26]&RC[-25]&RC[-24]&RC[-23]&RC[-22]="",,R1C7)&IF(RC[-27]="",,"|n"&R1C8&RC[-27])&IF(RC[-26]="",,"|n"&R1C9&RC[-26])&IF(RC[-25]="",,"|n"&R1C10&RC[-25])&IF(RC[-24]="",,"|n"&R1C11&RC[-24])&IF(RC[-23]="",,"|n"&R1C12&RC[-23])&IF(RC[-22]="",,"|n"&R1C13&RC[-22])&IF(RC[-20]&RC[-19]&RC[-18]&RC[-17]="",,"|n"&R1C14)&IF(RC[-20]="",,"|n"&R1C15&RC[-20])&IF(RC[-19]="",,"|n"&R1C16&RC[-19])&IF(RC[-18]="",,"|n"&R1C17&RC[-18])&IF(RC[-17]="",,"|n"&R1C18&RC[-17])&IF(RC[-16]="",,"|n"&R1C19&RC[-16])&IF(RC[-15]="",,"|n"&R1C20&RC[-15])&IF(RC[-14]="",,"|n"&R1C21&RC[-14])&IF(RC[-13]="",,"|n"&R1C22&RC[-13])&IF(RC[-11]="",,"|n"&R1C24&RC[-11])&IF(RC[-10]="",,"|n"&R1C25&RC[-10])&IF(RC[-9]="",,"|n"&R1C26&RC[-9])&IF(RC[-8]="",,"|n"&R1C27&RC[-8])&IF(RC[-7]="",,"|n"&R1C28&RC[-7])&IF(RC[-6]="",,"|n"&R1C29&RC[-6])&IF(RC[-2]="",,"|n"&RC[-2]) -> 
AI954: =IF(RC[-27]&RC[-26]&RC[-25]&RC[-24]&RC[-23]&RC[-22]="",,R1C7)&IF(RC[-27]="",,"|n"&R1C8&RC[-27])&IF(RC[-26]="",,"|n"&R1C9&RC[-26])&IF(RC[-25]="",,"|n"&R1C10&RC[-25])&IF(RC[-24]="",,"|n"&R1C11&RC[-24])&IF(RC[-23]="",,"|n"&R1C12&RC[-23])&IF(RC[-22]="",,"|n"&R1C13&RC[-22])&IF(RC[-20]&RC[-19]&RC[-18]&RC[-17]="",,"|n"&R1C14)&IF(RC[-20]="",,"|n"&R1C15&RC[-20])&IF(RC[-19]="",,"|n"&R1C16&RC[-19])&IF(RC[-18]="",,"|n"&R1C17&RC[-18])&IF(RC[-17]="",,"|n"&R1C18&RC[-17])&IF(RC[-16]="",,"|n"&R1C19&RC[-16])&IF(RC[-15]="",,"|n"&R1C20&RC[-15])&IF(RC[-14]="",,"|n"&R1C21&RC[-14])&IF(RC[-13]="",,"|n"&R1C22&RC[-13])&IF(RC[-11]="",,"|n"&R1C24&RC[-11])&IF(RC[-10]="",,"|n"&R1C25&RC[-10])&IF(RC[-9]="",,"|n"&R1C26&RC[-9])&IF(RC[-8]="",,"|n"&R1C27&RC[-8])&IF(RC[-7]="",,"|n"&R1C28&RC[-7])&IF(RC[-6]="",,"|n"&R1C29&RC[-6])&IF(RC[-2]="",,"|n"&RC[-2]) -> 
AI955: =IF(RC[-27]&RC[-26]&RC[-25]&RC[-24]&RC[-23]&RC[-22]="",,R1C7)&IF(RC[-27]="",,"|n"&R1C8&RC[-27])&IF(RC[-26]="",,"|n"&R1C9&RC[-26])&IF(RC[-25]="",,"|n"&R1C10&RC[-25])&IF(RC[-24]="",,"|n"&R1C11&RC[-24])&IF(RC[-23]="",,"|n"&R1C12&RC[-23])&IF(RC[-22]="",,"|n"&R1C13&RC[-22])&IF(RC[-20]&RC[-19]&RC[-18]&RC[-17]="",,"|n"&R1C14)&IF(RC[-20]="",,"|n"&R1C15&RC[-20])&IF(RC[-19]="",,"|n"&R1C16&RC[-19])&IF(RC[-18]="",,"|n"&R1C17&RC[-18])&IF(RC[-17]="",,"|n"&R1C18&RC[-17])&IF(RC[-16]="",,"|n"&R1C19&RC[-16])&IF(RC[-15]="",,"|n"&R1C20&RC[-15])&IF(RC[-14]="",,"|n"&R1C21&RC[-14])&IF(RC[-13]="",,"|n"&R1C22&RC[-13])&IF(RC[-11]="",,"|n"&R1C24&RC[-11])&IF(RC[-10]="",,"|n"&R1C25&RC[-10])&IF(RC[-9]="",,"|n"&R1C26&RC[-9])&IF(RC[-8]="",,"|n"&R1C27&RC[-8])&IF(RC[-7]="",,"|n"&R1C28&RC[-7])&IF(RC[-6]="",,"|n"&R1C29&RC[-6])&IF(RC[-2]="",,"|n"&RC[-2]) -> 
AI956: =IF(RC[-27]&RC[-26]&RC[-25]&RC[-24]&RC[-23]&RC[-22]="",,R1C7)&IF(RC[-27]="",,"|n"&R1C8&RC[-27])&IF(RC[-26]="",,"|n"&R1C9&RC[-26])&IF(RC[-25]="",,"|n"&R1C10&RC[-25])&IF(RC[-24]="",,"|n"&R1C11&RC[-24])&IF(RC[-23]="",,"|n"&R1C12&RC[-23])&IF(RC[-22]="",,"|n"&R1C13&RC[-22])&IF(RC[-20]&RC[-19]&RC[-18]&RC[-17]="",,"|n"&R1C14)&IF(RC[-20]="",,"|n"&R1C15&RC[-20])&IF(RC[-19]="",,"|n"&R1C16&RC[-19])&IF(RC[-18]="",,"|n"&R1C17&RC[-18])&IF(RC[-17]="",,"|n"&R1C18&RC[-17])&IF(RC[-16]="",,"|n"&R1C19&RC[-16])&IF(RC[-15]="",,"|n"&R1C20&RC[-15])&IF(RC[-14]="",,"|n"&R1C21&RC[-14])&IF(RC[-13]="",,"|n"&R1C22&RC[-13])&IF(RC[-11]="",,"|n"&R1C24&RC[-11])&IF(RC[-10]="",,"|n"&R1C25&RC[-10])&IF(RC[-9]="",,"|n"&R1C26&RC[-9])&IF(RC[-8]="",,"|n"&R1C27&RC[-8])&IF(RC[-7]="",,"|n"&R1C28&RC[-7])&IF(RC[-6]="",,"|n"&R1C29&RC[-6])&IF(RC[-2]="",,"|n"&RC[-2]) -> 
AI957: =IF(RC[-27]&RC[-26]&RC[-25]&RC[-24]&RC[-23]&RC[-22]="",,R1C7)&IF(RC[-27]="",,"|n"&R1C8&RC[-27])&IF(RC[-26]="",,"|n"&R1C9&RC[-26])&IF(RC[-25]="",,"|n"&R1C10&RC[-25])&IF(RC[-24]="",,"|n"&R1C11&RC[-24])&IF(RC[-23]="",,"|n"&R1C12&RC[-23])&IF(RC[-22]="",,"|n"&R1C13&RC[-22])&IF(RC[-20]&RC[-19]&RC[-18]&RC[-17]="",,"|n"&R1C14)&IF(RC[-20]="",,"|n"&R1C15&RC[-20])&IF(RC[-19]="",,"|n"&R1C16&RC[-19])&IF(RC[-18]="",,"|n"&R1C17&RC[-18])&IF(RC[-17]="",,"|n"&R1C18&RC[-17])&IF(RC[-16]="",,"|n"&R1C19&RC[-16])&IF(RC[-15]="",,"|n"&R1C20&RC[-15])&IF(RC[-14]="",,"|n"&R1C21&RC[-14])&IF(RC[-13]="",,"|n"&R1C22&RC[-13])&IF(RC[-11]="",,"|n"&R1C24&RC[-11])&IF(RC[-10]="",,"|n"&R1C25&RC[-10])&IF(RC[-9]="",,"|n"&R1C26&RC[-9])&IF(RC[-8]="",,"|n"&R1C27&RC[-8])&IF(RC[-7]="",,"|n"&R1C28&RC[-7])&IF(RC[-6]="",,"|n"&R1C29&RC[-6])&IF(RC[-2]="",,"|n"&RC[-2]) -> 
AI958: =IF(RC[-27]&RC[-26]&RC[-25]&RC[-24]&RC[-23]&RC[-22]="",,R1C7)&IF(RC[-27]="",,"|n"&R1C8&RC[-27])&IF(RC[-26]="",,"|n"&R1C9&RC[-26])&IF(RC[-25]="",,"|n"&R1C10&RC[-25])&IF(RC[-24]="",,"|n"&R1C11&RC[-24])&IF(RC[-23]="",,"|n"&R1C12&RC[-23])&IF(RC[-22]="",,"|n"&R1C13&RC[-22])&IF(RC[-20]&RC[-19]&RC[-18]&RC[-17]="",,"|n"&R1C14)&IF(RC[-20]="",,"|n"&R1C15&RC[-20])&IF(RC[-19]="",,"|n"&R1C16&RC[-19])&IF(RC[-18]="",,"|n"&R1C17&RC[-18])&IF(RC[-17]="",,"|n"&R1C18&RC[-17])&IF(RC[-16]="",,"|n"&R1C19&RC[-16])&IF(RC[-15]="",,"|n"&R1C20&RC[-15])&IF(RC[-14]="",,"|n"&R1C21&RC[-14])&IF(RC[-13]="",,"|n"&R1C22&RC[-13])&IF(RC[-11]="",,"|n"&R1C24&RC[-11])&IF(RC[-10]="",,"|n"&R1C25&RC[-10])&IF(RC[-9]="",,"|n"&R1C26&RC[-9])&IF(RC[-8]="",,"|n"&R1C27&RC[-8])&IF(RC[-7]="",,"|n"&R1C28&RC[-7])&IF(RC[-6]="",,"|n"&R1C29&RC[-6])&IF(RC[-2]="",,"|n"&RC[-2]) -> 
AI959: =IF(RC[-27]&RC[-26]&RC[-25]&RC[-24]&RC[-23]&RC[-22]="",,R1C7)&IF(RC[-27]="",,"|n"&R1C8&RC[-27])&IF(RC[-26]="",,"|n"&R1C9&RC[-26])&IF(RC[-25]="",,"|n"&R1C10&RC[-25])&IF(RC[-24]="",,"|n"&R1C11&RC[-24])&IF(RC[-23]="",,"|n"&R1C12&RC[-23])&IF(RC[-22]="",,"|n"&R1C13&RC[-22])&IF(RC[-20]&RC[-19]&RC[-18]&RC[-17]="",,"|n"&R1C14)&IF(RC[-20]="",,"|n"&R1C15&RC[-20])&IF(RC[-19]="",,"|n"&R1C16&RC[-19])&IF(RC[-18]="",,"|n"&R1C17&RC[-18])&IF(RC[-17]="",,"|n"&R1C18&RC[-17])&IF(RC[-16]="",,"|n"&R1C19&RC[-16])&IF(RC[-15]="",,"|n"&R1C20&RC[-15])&IF(RC[-14]="",,"|n"&R1C21&RC[-14])&IF(RC[-13]="",,"|n"&R1C22&RC[-13])&IF(RC[-11]="",,"|n"&R1C24&RC[-11])&IF(RC[-10]="",,"|n"&R1C25&RC[-10])&IF(RC[-9]="",,"|n"&R1C26&RC[-9])&IF(RC[-8]="",,"|n"&R1C27&RC[-8])&IF(RC[-7]="",,"|n"&R1C28&RC[-7])&IF(RC[-6]="",,"|n"&R1C29&RC[-6])&IF(RC[-2]="",,"|n"&RC[-2]) -> 
AI960: =IF(RC[-27]&RC[-26]&RC[-25]&RC[-24]&RC[-23]&RC[-22]="",,R1C7)&IF(RC[-27]="",,"|n"&R1C8&RC[-27])&IF(RC[-26]="",,"|n"&R1C9&RC[-26])&IF(RC[-25]="",,"|n"&R1C10&RC[-25])&IF(RC[-24]="",,"|n"&R1C11&RC[-24])&IF(RC[-23]="",,"|n"&R1C12&RC[-23])&IF(RC[-22]="",,"|n"&R1C13&RC[-22])&IF(RC[-20]&RC[-19]&RC[-18]&RC[-17]="",,"|n"&R1C14)&IF(RC[-20]="",,"|n"&R1C15&RC[-20])&IF(RC[-19]="",,"|n"&R1C16&RC[-19])&IF(RC[-18]="",,"|n"&R1C17&RC[-18])&IF(RC[-17]="",,"|n"&R1C18&RC[-17])&IF(RC[-16]="",,"|n"&R1C19&RC[-16])&IF(RC[-15]="",,"|n"&R1C20&RC[-15])&IF(RC[-14]="",,"|n"&R1C21&RC[-14])&IF(RC[-13]="",,"|n"&R1C22&RC[-13])&IF(RC[-11]="",,"|n"&R1C24&RC[-11])&IF(RC[-10]="",,"|n"&R1C25&RC[-10])&IF(RC[-9]="",,"|n"&R1C26&RC[-9])&IF(RC[-8]="",,"|n"&R1C27&RC[-8])&IF(RC[-7]="",,"|n"&R1C28&RC[-7])&IF(RC[-6]="",,"|n"&R1C29&RC[-6])&IF(RC[-2]="",,"|n"&RC[-2]) -> 
AI961: =IF(RC[-27]&RC[-26]&RC[-25]&RC[-24]&RC[-23]&RC[-22]="",,R1C7)&IF(RC[-27]="",,"|n"&R1C8&RC[-27])&IF(RC[-26]="",,"|n"&R1C9&RC[-26])&IF(RC[-25]="",,"|n"&R1C10&RC[-25])&IF(RC[-24]="",,"|n"&R1C11&RC[-24])&IF(RC[-23]="",,"|n"&R1C12&RC[-23])&IF(RC[-22]="",,"|n"&R1C13&RC[-22])&IF(RC[-20]&RC[-19]&RC[-18]&RC[-17]="",,"|n"&R1C14)&IF(RC[-20]="",,"|n"&R1C15&RC[-20])&IF(RC[-19]="",,"|n"&R1C16&RC[-19])&IF(RC[-18]="",,"|n"&R1C17&RC[-18])&IF(RC[-17]="",,"|n"&R1C18&RC[-17])&IF(RC[-16]="",,"|n"&R1C19&RC[-16])&IF(RC[-15]="",,"|n"&R1C20&RC[-15])&IF(RC[-14]="",,"|n"&R1C21&RC[-14])&IF(RC[-13]="",,"|n"&R1C22&RC[-13])&IF(RC[-11]="",,"|n"&R1C24&RC[-11])&IF(RC[-10]="",,"|n"&R1C25&RC[-10])&IF(RC[-9]="",,"|n"&R1C26&RC[-9])&IF(RC[-8]="",,"|n"&R1C27&RC[-8])&IF(RC[-7]="",,"|n"&R1C28&RC[-7])&IF(RC[-6]="",,"|n"&R1C29&RC[-6])&IF(RC[-2]="",,"|n"&RC[-2]) -> 
AI962: =IF(RC[-27]&RC[-26]&RC[-25]&RC[-24]&RC[-23]&RC[-22]="",,R1C7)&IF(RC[-27]="",,"|n"&R1C8&RC[-27])&IF(RC[-26]="",,"|n"&R1C9&RC[-26])&IF(RC[-25]="",,"|n"&R1C10&RC[-25])&IF(RC[-24]="",,"|n"&R1C11&RC[-24])&IF(RC[-23]="",,"|n"&R1C12&RC[-23])&IF(RC[-22]="",,"|n"&R1C13&RC[-22])&IF(RC[-20]&RC[-19]&RC[-18]&RC[-17]="",,"|n"&R1C14)&IF(RC[-20]="",,"|n"&R1C15&RC[-20])&IF(RC[-19]="",,"|n"&R1C16&RC[-19])&IF(RC[-18]="",,"|n"&R1C17&RC[-18])&IF(RC[-17]="",,"|n"&R1C18&RC[-17])&IF(RC[-16]="",,"|n"&R1C19&RC[-16])&IF(RC[-15]="",,"|n"&R1C20&RC[-15])&IF(RC[-14]="",,"|n"&R1C21&RC[-14])&IF(RC[-13]="",,"|n"&R1C22&RC[-13])&IF(RC[-11]="",,"|n"&R1C24&RC[-11])&IF(RC[-10]="",,"|n"&R1C25&RC[-10])&IF(RC[-9]="",,"|n"&R1C26&RC[-9])&IF(RC[-8]="",,"|n"&R1C27&RC[-8])&IF(RC[-7]="",,"|n"&R1C28&RC[-7])&IF(RC[-6]="",,"|n"&R1C29&RC[-6])&IF(RC[-2]="",,"|n"&RC[-2]) -> 
AI963: =IF(RC[-27]&RC[-26]&RC[-25]&RC[-24]&RC[-23]&RC[-22]="",,R1C7)&IF(RC[-27]="",,"|n"&R1C8&RC[-27])&IF(RC[-26]="",,"|n"&R1C9&RC[-26])&IF(RC[-25]="",,"|n"&R1C10&RC[-25])&IF(RC[-24]="",,"|n"&R1C11&RC[-24])&IF(RC[-23]="",,"|n"&R1C12&RC[-23])&IF(RC[-22]="",,"|n"&R1C13&RC[-22])&IF(RC[-20]&RC[-19]&RC[-18]&RC[-17]="",,"|n"&R1C14)&IF(RC[-20]="",,"|n"&R1C15&RC[-20])&IF(RC[-19]="",,"|n"&R1C16&RC[-19])&IF(RC[-18]="",,"|n"&R1C17&RC[-18])&IF(RC[-17]="",,"|n"&R1C18&RC[-17])&IF(RC[-16]="",,"|n"&R1C19&RC[-16])&IF(RC[-15]="",,"|n"&R1C20&RC[-15])&IF(RC[-14]="",,"|n"&R1C21&RC[-14])&IF(RC[-13]="",,"|n"&R1C22&RC[-13])&IF(RC[-11]="",,"|n"&R1C24&RC[-11])&IF(RC[-10]="",,"|n"&R1C25&RC[-10])&IF(RC[-9]="",,"|n"&R1C26&RC[-9])&IF(RC[-8]="",,"|n"&R1C27&RC[-8])&IF(RC[-7]="",,"|n"&R1C28&RC[-7])&IF(RC[-6]="",,"|n"&R1C29&RC[-6])&IF(RC[-2]="",,"|n"&RC[-2]) -> 
AI964: =IF(RC[-27]&RC[-26]&RC[-25]&RC[-24]&RC[-23]&RC[-22]="",,R1C7)&IF(RC[-27]="",,"|n"&R1C8&RC[-27])&IF(RC[-26]="",,"|n"&R1C9&RC[-26])&IF(RC[-25]="",,"|n"&R1C10&RC[-25])&IF(RC[-24]="",,"|n"&R1C11&RC[-24])&IF(RC[-23]="",,"|n"&R1C12&RC[-23])&IF(RC[-22]="",,"|n"&R1C13&RC[-22])&IF(RC[-20]&RC[-19]&RC[-18]&RC[-17]="",,"|n"&R1C14)&IF(RC[-20]="",,"|n"&R1C15&RC[-20])&IF(RC[-19]="",,"|n"&R1C16&RC[-19])&IF(RC[-18]="",,"|n"&R1C17&RC[-18])&IF(RC[-17]="",,"|n"&R1C18&RC[-17])&IF(RC[-16]="",,"|n"&R1C19&RC[-16])&IF(RC[-15]="",,"|n"&R1C20&RC[-15])&IF(RC[-14]="",,"|n"&R1C21&RC[-14])&IF(RC[-13]="",,"|n"&R1C22&RC[-13])&IF(RC[-11]="",,"|n"&R1C24&RC[-11])&IF(RC[-10]="",,"|n"&R1C25&RC[-10])&IF(RC[-9]="",,"|n"&R1C26&RC[-9])&IF(RC[-8]="",,"|n"&R1C27&RC[-8])&IF(RC[-7]="",,"|n"&R1C28&RC[-7])&IF(RC[-6]="",,"|n"&R1C29&RC[-6])&IF(RC[-2]="",,"|n"&RC[-2]) -> 
AI965: =IF(RC[-27]&RC[-26]&RC[-25]&RC[-24]&RC[-23]&RC[-22]="",,R1C7)&IF(RC[-27]="",,"|n"&R1C8&RC[-27])&IF(RC[-26]="",,"|n"&R1C9&RC[-26])&IF(RC[-25]="",,"|n"&R1C10&RC[-25])&IF(RC[-24]="",,"|n"&R1C11&RC[-24])&IF(RC[-23]="",,"|n"&R1C12&RC[-23])&IF(RC[-22]="",,"|n"&R1C13&RC[-22])&IF(RC[-20]&RC[-19]&RC[-18]&RC[-17]="",,"|n"&R1C14)&IF(RC[-20]="",,"|n"&R1C15&RC[-20])&IF(RC[-19]="",,"|n"&R1C16&RC[-19])&IF(RC[-18]="",,"|n"&R1C17&RC[-18])&IF(RC[-17]="",,"|n"&R1C18&RC[-17])&IF(RC[-16]="",,"|n"&R1C19&RC[-16])&IF(RC[-15]="",,"|n"&R1C20&RC[-15])&IF(RC[-14]="",,"|n"&R1C21&RC[-14])&IF(RC[-13]="",,"|n"&R1C22&RC[-13])&IF(RC[-11]="",,"|n"&R1C24&RC[-11])&IF(RC[-10]="",,"|n"&R1C25&RC[-10])&IF(RC[-9]="",,"|n"&R1C26&RC[-9])&IF(RC[-8]="",,"|n"&R1C27&RC[-8])&IF(RC[-7]="",,"|n"&R1C28&RC[-7])&IF(RC[-6]="",,"|n"&R1C29&RC[-6])&IF(RC[-2]="",,"|n"&RC[-2]) -> 
AI966: =IF(RC[-27]&RC[-26]&RC[-25]&RC[-24]&RC[-23]&RC[-22]="",,R1C7)&IF(RC[-27]="",,"|n"&R1C8&RC[-27])&IF(RC[-26]="",,"|n"&R1C9&RC[-26])&IF(RC[-25]="",,"|n"&R1C10&RC[-25])&IF(RC[-24]="",,"|n"&R1C11&RC[-24])&IF(RC[-23]="",,"|n"&R1C12&RC[-23])&IF(RC[-22]="",,"|n"&R1C13&RC[-22])&IF(RC[-20]&RC[-19]&RC[-18]&RC[-17]="",,"|n"&R1C14)&IF(RC[-20]="",,"|n"&R1C15&RC[-20])&IF(RC[-19]="",,"|n"&R1C16&RC[-19])&IF(RC[-18]="",,"|n"&R1C17&RC[-18])&IF(RC[-17]="",,"|n"&R1C18&RC[-17])&IF(RC[-16]="",,"|n"&R1C19&RC[-16])&IF(RC[-15]="",,"|n"&R1C20&RC[-15])&IF(RC[-14]="",,"|n"&R1C21&RC[-14])&IF(RC[-13]="",,"|n"&R1C22&RC[-13])&IF(RC[-11]="",,"|n"&R1C24&RC[-11])&IF(RC[-10]="",,"|n"&R1C25&RC[-10])&IF(RC[-9]="",,"|n"&R1C26&RC[-9])&IF(RC[-8]="",,"|n"&R1C27&RC[-8])&IF(RC[-7]="",,"|n"&R1C28&RC[-7])&IF(RC[-6]="",,"|n"&R1C29&RC[-6])&IF(RC[-2]="",,"|n"&RC[-2]) -> 
AI967: =IF(RC[-27]&RC[-26]&RC[-25]&RC[-24]&RC[-23]&RC[-22]="",,R1C7)&IF(RC[-27]="",,"|n"&R1C8&RC[-27])&IF(RC[-26]="",,"|n"&R1C9&RC[-26])&IF(RC[-25]="",,"|n"&R1C10&RC[-25])&IF(RC[-24]="",,"|n"&R1C11&RC[-24])&IF(RC[-23]="",,"|n"&R1C12&RC[-23])&IF(RC[-22]="",,"|n"&R1C13&RC[-22])&IF(RC[-20]&RC[-19]&RC[-18]&RC[-17]="",,"|n"&R1C14)&IF(RC[-20]="",,"|n"&R1C15&RC[-20])&IF(RC[-19]="",,"|n"&R1C16&RC[-19])&IF(RC[-18]="",,"|n"&R1C17&RC[-18])&IF(RC[-17]="",,"|n"&R1C18&RC[-17])&IF(RC[-16]="",,"|n"&R1C19&RC[-16])&IF(RC[-15]="",,"|n"&R1C20&RC[-15])&IF(RC[-14]="",,"|n"&R1C21&RC[-14])&IF(RC[-13]="",,"|n"&R1C22&RC[-13])&IF(RC[-11]="",,"|n"&R1C24&RC[-11])&IF(RC[-10]="",,"|n"&R1C25&RC[-10])&IF(RC[-9]="",,"|n"&R1C26&RC[-9])&IF(RC[-8]="",,"|n"&R1C27&RC[-8])&IF(RC[-7]="",,"|n"&R1C28&RC[-7])&IF(RC[-6]="",,"|n"&R1C29&RC[-6])&IF(RC[-2]="",,"|n"&RC[-2]) -> 
AI968: =IF(RC[-27]&RC[-26]&RC[-25]&RC[-24]&RC[-23]&RC[-22]="",,R1C7)&IF(RC[-27]="",,"|n"&R1C8&RC[-27])&IF(RC[-26]="",,"|n"&R1C9&RC[-26])&IF(RC[-25]="",,"|n"&R1C10&RC[-25])&IF(RC[-24]="",,"|n"&R1C11&RC[-24])&IF(RC[-23]="",,"|n"&R1C12&RC[-23])&IF(RC[-22]="",,"|n"&R1C13&RC[-22])&IF(RC[-20]&RC[-19]&RC[-18]&RC[-17]="",,"|n"&R1C14)&IF(RC[-20]="",,"|n"&R1C15&RC[-20])&IF(RC[-19]="",,"|n"&R1C16&RC[-19])&IF(RC[-18]="",,"|n"&R1C17&RC[-18])&IF(RC[-17]="",,"|n"&R1C18&RC[-17])&IF(RC[-16]="",,"|n"&R1C19&RC[-16])&IF(RC[-15]="",,"|n"&R1C20&RC[-15])&IF(RC[-14]="",,"|n"&R1C21&RC[-14])&IF(RC[-13]="",,"|n"&R1C22&RC[-13])&IF(RC[-11]="",,"|n"&R1C24&RC[-11])&IF(RC[-10]="",,"|n"&R1C25&RC[-10])&IF(RC[-9]="",,"|n"&R1C26&RC[-9])&IF(RC[-8]="",,"|n"&R1C27&RC[-8])&IF(RC[-7]="",,"|n"&R1C28&RC[-7])&IF(RC[-6]="",,"|n"&R1C29&RC[-6])&IF(RC[-2]="",,"|n"&RC[-2]) -> 
AI969: =IF(RC[-27]&RC[-26]&RC[-25]&RC[-24]&RC[-23]&RC[-22]="",,R1C7)&IF(RC[-27]="",,"|n"&R1C8&RC[-27])&IF(RC[-26]="",,"|n"&R1C9&RC[-26])&IF(RC[-25]="",,"|n"&R1C10&RC[-25])&IF(RC[-24]="",,"|n"&R1C11&RC[-24])&IF(RC[-23]="",,"|n"&R1C12&RC[-23])&IF(RC[-22]="",,"|n"&R1C13&RC[-22])&IF(RC[-20]&RC[-19]&RC[-18]&RC[-17]="",,"|n"&R1C14)&IF(RC[-20]="",,"|n"&R1C15&RC[-20])&IF(RC[-19]="",,"|n"&R1C16&RC[-19])&IF(RC[-18]="",,"|n"&R1C17&RC[-18])&IF(RC[-17]="",,"|n"&R1C18&RC[-17])&IF(RC[-16]="",,"|n"&R1C19&RC[-16])&IF(RC[-15]="",,"|n"&R1C20&RC[-15])&IF(RC[-14]="",,"|n"&R1C21&RC[-14])&IF(RC[-13]="",,"|n"&R1C22&RC[-13])&IF(RC[-11]="",,"|n"&R1C24&RC[-11])&IF(RC[-10]="",,"|n"&R1C25&RC[-10])&IF(RC[-9]="",,"|n"&R1C26&RC[-9])&IF(RC[-8]="",,"|n"&R1C27&RC[-8])&IF(RC[-7]="",,"|n"&R1C28&RC[-7])&IF(RC[-6]="",,"|n"&R1C29&RC[-6])&IF(RC[-2]="",,"|n"&RC[-2]) -> 
AI970: =IF(RC[-27]&RC[-26]&RC[-25]&RC[-24]&RC[-23]&RC[-22]="",,R1C7)&IF(RC[-27]="",,"|n"&R1C8&RC[-27])&IF(RC[-26]="",,"|n"&R1C9&RC[-26])&IF(RC[-25]="",,"|n"&R1C10&RC[-25])&IF(RC[-24]="",,"|n"&R1C11&RC[-24])&IF(RC[-23]="",,"|n"&R1C12&RC[-23])&IF(RC[-22]="",,"|n"&R1C13&RC[-22])&IF(RC[-20]&RC[-19]&RC[-18]&RC[-17]="",,"|n"&R1C14)&IF(RC[-20]="",,"|n"&R1C15&RC[-20])&IF(RC[-19]="",,"|n"&R1C16&RC[-19])&IF(RC[-18]="",,"|n"&R1C17&RC[-18])&IF(RC[-17]="",,"|n"&R1C18&RC[-17])&IF(RC[-16]="",,"|n"&R1C19&RC[-16])&IF(RC[-15]="",,"|n"&R1C20&RC[-15])&IF(RC[-14]="",,"|n"&R1C21&RC[-14])&IF(RC[-13]="",,"|n"&R1C22&RC[-13])&IF(RC[-11]="",,"|n"&R1C24&RC[-11])&IF(RC[-10]="",,"|n"&R1C25&RC[-10])&IF(RC[-9]="",,"|n"&R1C26&RC[-9])&IF(RC[-8]="",,"|n"&R1C27&RC[-8])&IF(RC[-7]="",,"|n"&R1C28&RC[-7])&IF(RC[-6]="",,"|n"&R1C29&RC[-6])&IF(RC[-2]="",,"|n"&RC[-2]) -> 
AI971: =IF(RC[-27]&RC[-26]&RC[-25]&RC[-24]&RC[-23]&RC[-22]="",,R1C7)&IF(RC[-27]="",,"|n"&R1C8&RC[-27])&IF(RC[-26]="",,"|n"&R1C9&RC[-26])&IF(RC[-25]="",,"|n"&R1C10&RC[-25])&IF(RC[-24]="",,"|n"&R1C11&RC[-24])&IF(RC[-23]="",,"|n"&R1C12&RC[-23])&IF(RC[-22]="",,"|n"&R1C13&RC[-22])&IF(RC[-20]&RC[-19]&RC[-18]&RC[-17]="",,"|n"&R1C14)&IF(RC[-20]="",,"|n"&R1C15&RC[-20])&IF(RC[-19]="",,"|n"&R1C16&RC[-19])&IF(RC[-18]="",,"|n"&R1C17&RC[-18])&IF(RC[-17]="",,"|n"&R1C18&RC[-17])&IF(RC[-16]="",,"|n"&R1C19&RC[-16])&IF(RC[-15]="",,"|n"&R1C20&RC[-15])&IF(RC[-14]="",,"|n"&R1C21&RC[-14])&IF(RC[-13]="",,"|n"&R1C22&RC[-13])&IF(RC[-11]="",,"|n"&R1C24&RC[-11])&IF(RC[-10]="",,"|n"&R1C25&RC[-10])&IF(RC[-9]="",,"|n"&R1C26&RC[-9])&IF(RC[-8]="",,"|n"&R1C27&RC[-8])&IF(RC[-7]="",,"|n"&R1C28&RC[-7])&IF(RC[-6]="",,"|n"&R1C29&RC[-6])&IF(RC[-2]="",,"|n"&RC[-2]) -> 
AI972: =IF(RC[-27]&RC[-26]&RC[-25]&RC[-24]&RC[-23]&RC[-22]="",,R1C7)&IF(RC[-27]="",,"|n"&R1C8&RC[-27])&IF(RC[-26]="",,"|n"&R1C9&RC[-26])&IF(RC[-25]="",,"|n"&R1C10&RC[-25])&IF(RC[-24]="",,"|n"&R1C11&RC[-24])&IF(RC[-23]="",,"|n"&R1C12&RC[-23])&IF(RC[-22]="",,"|n"&R1C13&RC[-22])&IF(RC[-20]&RC[-19]&RC[-18]&RC[-17]="",,"|n"&R1C14)&IF(RC[-20]="",,"|n"&R1C15&RC[-20])&IF(RC[-19]="",,"|n"&R1C16&RC[-19])&IF(RC[-18]="",,"|n"&R1C17&RC[-18])&IF(RC[-17]="",,"|n"&R1C18&RC[-17])&IF(RC[-16]="",,"|n"&R1C19&RC[-16])&IF(RC[-15]="",,"|n"&R1C20&RC[-15])&IF(RC[-14]="",,"|n"&R1C21&RC[-14])&IF(RC[-13]="",,"|n"&R1C22&RC[-13])&IF(RC[-11]="",,"|n"&R1C24&RC[-11])&IF(RC[-10]="",,"|n"&R1C25&RC[-10])&IF(RC[-9]="",,"|n"&R1C26&RC[-9])&IF(RC[-8]="",,"|n"&R1C27&RC[-8])&IF(RC[-7]="",,"|n"&R1C28&RC[-7])&IF(RC[-6]="",,"|n"&R1C29&RC[-6])&IF(RC[-2]="",,"|n"&RC[-2]) -> 
AI973: =IF(RC[-27]&RC[-26]&RC[-25]&RC[-24]&RC[-23]&RC[-22]="",,R1C7)&IF(RC[-27]="",,"|n"&R1C8&RC[-27])&IF(RC[-26]="",,"|n"&R1C9&RC[-26])&IF(RC[-25]="",,"|n"&R1C10&RC[-25])&IF(RC[-24]="",,"|n"&R1C11&RC[-24])&IF(RC[-23]="",,"|n"&R1C12&RC[-23])&IF(RC[-22]="",,"|n"&R1C13&RC[-22])&IF(RC[-20]&RC[-19]&RC[-18]&RC[-17]="",,"|n"&R1C14)&IF(RC[-20]="",,"|n"&R1C15&RC[-20])&IF(RC[-19]="",,"|n"&R1C16&RC[-19])&IF(RC[-18]="",,"|n"&R1C17&RC[-18])&IF(RC[-17]="",,"|n"&R1C18&RC[-17])&IF(RC[-16]="",,"|n"&R1C19&RC[-16])&IF(RC[-15]="",,"|n"&R1C20&RC[-15])&IF(RC[-14]="",,"|n"&R1C21&RC[-14])&IF(RC[-13]="",,"|n"&R1C22&RC[-13])&IF(RC[-11]="",,"|n"&R1C24&RC[-11])&IF(RC[-10]="",,"|n"&R1C25&RC[-10])&IF(RC[-9]="",,"|n"&R1C26&RC[-9])&IF(RC[-8]="",,"|n"&R1C27&RC[-8])&IF(RC[-7]="",,"|n"&R1C28&RC[-7])&IF(RC[-6]="",,"|n"&R1C29&RC[-6])&IF(RC[-2]="",,"|n"&RC[-2]) -> 
AI974: =IF(RC[-27]&RC[-26]&RC[-25]&RC[-24]&RC[-23]&RC[-22]="",,R1C7)&IF(RC[-27]="",,"|n"&R1C8&RC[-27])&IF(RC[-26]="",,"|n"&R1C9&RC[-26])&IF(RC[-25]="",,"|n"&R1C10&RC[-25])&IF(RC[-24]="",,"|n"&R1C11&RC[-24])&IF(RC[-23]="",,"|n"&R1C12&RC[-23])&IF(RC[-22]="",,"|n"&R1C13&RC[-22])&IF(RC[-20]&RC[-19]&RC[-18]&RC[-17]="",,"|n"&R1C14)&IF(RC[-20]="",,"|n"&R1C15&RC[-20])&IF(RC[-19]="",,"|n"&R1C16&RC[-19])&IF(RC[-18]="",,"|n"&R1C17&RC[-18])&IF(RC[-17]="",,"|n"&R1C18&RC[-17])&IF(RC[-16]="",,"|n"&R1C19&RC[-16])&IF(RC[-15]="",,"|n"&R1C20&RC[-15])&IF(RC[-14]="",,"|n"&R1C21&RC[-14])&IF(RC[-13]="",,"|n"&R1C22&RC[-13])&IF(RC[-11]="",,"|n"&R1C24&RC[-11])&IF(RC[-10]="",,"|n"&R1C25&RC[-10])&IF(RC[-9]="",,"|n"&R1C26&RC[-9])&IF(RC[-8]="",,"|n"&R1C27&RC[-8])&IF(RC[-7]="",,"|n"&R1C28&RC[-7])&IF(RC[-6]="",,"|n"&R1C29&RC[-6])&IF(RC[-2]="",,"|n"&RC[-2]) -> 
AI975: =IF(RC[-27]&RC[-26]&RC[-25]&RC[-24]&RC[-23]&RC[-22]="",,R1C7)&IF(RC[-27]="",,"|n"&R1C8&RC[-27])&IF(RC[-26]="",,"|n"&R1C9&RC[-26])&IF(RC[-25]="",,"|n"&R1C10&RC[-25])&IF(RC[-24]="",,"|n"&R1C11&RC[-24])&IF(RC[-23]="",,"|n"&R1C12&RC[-23])&IF(RC[-22]="",,"|n"&R1C13&RC[-22])&IF(RC[-20]&RC[-19]&RC[-18]&RC[-17]="",,"|n"&R1C14)&IF(RC[-20]="",,"|n"&R1C15&RC[-20])&IF(RC[-19]="",,"|n"&R1C16&RC[-19])&IF(RC[-18]="",,"|n"&R1C17&RC[-18])&IF(RC[-17]="",,"|n"&R1C18&RC[-17])&IF(RC[-16]="",,"|n"&R1C19&RC[-16])&IF(RC[-15]="",,"|n"&R1C20&RC[-15])&IF(RC[-14]="",,"|n"&R1C21&RC[-14])&IF(RC[-13]="",,"|n"&R1C22&RC[-13])&IF(RC[-11]="",,"|n"&R1C24&RC[-11])&IF(RC[-10]="",,"|n"&R1C25&RC[-10])&IF(RC[-9]="",,"|n"&R1C26&RC[-9])&IF(RC[-8]="",,"|n"&R1C27&RC[-8])&IF(RC[-7]="",,"|n"&R1C28&RC[-7])&IF(RC[-6]="",,"|n"&R1C29&RC[-6])&IF(RC[-2]="",,"|n"&RC[-2]) -> 
AI976: =IF(RC[-27]&RC[-26]&RC[-25]&RC[-24]&RC[-23]&RC[-22]="",,R1C7)&IF(RC[-27]="",,"|n"&R1C8&RC[-27])&IF(RC[-26]="",,"|n"&R1C9&RC[-26])&IF(RC[-25]="",,"|n"&R1C10&RC[-25])&IF(RC[-24]="",,"|n"&R1C11&RC[-24])&IF(RC[-23]="",,"|n"&R1C12&RC[-23])&IF(RC[-22]="",,"|n"&R1C13&RC[-22])&IF(RC[-20]&RC[-19]&RC[-18]&RC[-17]="",,"|n"&R1C14)&IF(RC[-20]="",,"|n"&R1C15&RC[-20])&IF(RC[-19]="",,"|n"&R1C16&RC[-19])&IF(RC[-18]="",,"|n"&R1C17&RC[-18])&IF(RC[-17]="",,"|n"&R1C18&RC[-17])&IF(RC[-16]="",,"|n"&R1C19&RC[-16])&IF(RC[-15]="",,"|n"&R1C20&RC[-15])&IF(RC[-14]="",,"|n"&R1C21&RC[-14])&IF(RC[-13]="",,"|n"&R1C22&RC[-13])&IF(RC[-11]="",,"|n"&R1C24&RC[-11])&IF(RC[-10]="",,"|n"&R1C25&RC[-10])&IF(RC[-9]="",,"|n"&R1C26&RC[-9])&IF(RC[-8]="",,"|n"&R1C27&RC[-8])&IF(RC[-7]="",,"|n"&R1C28&RC[-7])&IF(RC[-6]="",,"|n"&R1C29&RC[-6])&IF(RC[-2]="",,"|n"&RC[-2]) -> 
AI977: =IF(RC[-27]&RC[-26]&RC[-25]&RC[-24]&RC[-23]&RC[-22]="",,R1C7)&IF(RC[-27]="",,"|n"&R1C8&RC[-27])&IF(RC[-26]="",,"|n"&R1C9&RC[-26])&IF(RC[-25]="",,"|n"&R1C10&RC[-25])&IF(RC[-24]="",,"|n"&R1C11&RC[-24])&IF(RC[-23]="",,"|n"&R1C12&RC[-23])&IF(RC[-22]="",,"|n"&R1C13&RC[-22])&IF(RC[-20]&RC[-19]&RC[-18]&RC[-17]="",,"|n"&R1C14)&IF(RC[-20]="",,"|n"&R1C15&RC[-20])&IF(RC[-19]="",,"|n"&R1C16&RC[-19])&IF(RC[-18]="",,"|n"&R1C17&RC[-18])&IF(RC[-17]="",,"|n"&R1C18&RC[-17])&IF(RC[-16]="",,"|n"&R1C19&RC[-16])&IF(RC[-15]="",,"|n"&R1C20&RC[-15])&IF(RC[-14]="",,"|n"&R1C21&RC[-14])&IF(RC[-13]="",,"|n"&R1C22&RC[-13])&IF(RC[-11]="",,"|n"&R1C24&RC[-11])&IF(RC[-10]="",,"|n"&R1C25&RC[-10])&IF(RC[-9]="",,"|n"&R1C26&RC[-9])&IF(RC[-8]="",,"|n"&R1C27&RC[-8])&IF(RC[-7]="",,"|n"&R1C28&RC[-7])&IF(RC[-6]="",,"|n"&R1C29&RC[-6])&IF(RC[-2]="",,"|n"&RC[-2]) -> 
AI978: =IF(RC[-27]&RC[-26]&RC[-25]&RC[-24]&RC[-23]&RC[-22]="",,R1C7)&IF(RC[-27]="",,"|n"&R1C8&RC[-27])&IF(RC[-26]="",,"|n"&R1C9&RC[-26])&IF(RC[-25]="",,"|n"&R1C10&RC[-25])&IF(RC[-24]="",,"|n"&R1C11&RC[-24])&IF(RC[-23]="",,"|n"&R1C12&RC[-23])&IF(RC[-22]="",,"|n"&R1C13&RC[-22])&IF(RC[-20]&RC[-19]&RC[-18]&RC[-17]="",,"|n"&R1C14)&IF(RC[-20]="",,"|n"&R1C15&RC[-20])&IF(RC[-19]="",,"|n"&R1C16&RC[-19])&IF(RC[-18]="",,"|n"&R1C17&RC[-18])&IF(RC[-17]="",,"|n"&R1C18&RC[-17])&IF(RC[-16]="",,"|n"&R1C19&RC[-16])&IF(RC[-15]="",,"|n"&R1C20&RC[-15])&IF(RC[-14]="",,"|n"&R1C21&RC[-14])&IF(RC[-13]="",,"|n"&R1C22&RC[-13])&IF(RC[-11]="",,"|n"&R1C24&RC[-11])&IF(RC[-10]="",,"|n"&R1C25&RC[-10])&IF(RC[-9]="",,"|n"&R1C26&RC[-9])&IF(RC[-8]="",,"|n"&R1C27&RC[-8])&IF(RC[-7]="",,"|n"&R1C28&RC[-7])&IF(RC[-6]="",,"|n"&R1C29&RC[-6])&IF(RC[-2]="",,"|n"&RC[-2]) -> 
AI979: =IF(RC[-27]&RC[-26]&RC[-25]&RC[-24]&RC[-23]&RC[-22]="",,R1C7)&IF(RC[-27]="",,"|n"&R1C8&RC[-27])&IF(RC[-26]="",,"|n"&R1C9&RC[-26])&IF(RC[-25]="",,"|n"&R1C10&RC[-25])&IF(RC[-24]="",,"|n"&R1C11&RC[-24])&IF(RC[-23]="",,"|n"&R1C12&RC[-23])&IF(RC[-22]="",,"|n"&R1C13&RC[-22])&IF(RC[-20]&RC[-19]&RC[-18]&RC[-17]="",,"|n"&R1C14)&IF(RC[-20]="",,"|n"&R1C15&RC[-20])&IF(RC[-19]="",,"|n"&R1C16&RC[-19])&IF(RC[-18]="",,"|n"&R1C17&RC[-18])&IF(RC[-17]="",,"|n"&R1C18&RC[-17])&IF(RC[-16]="",,"|n"&R1C19&RC[-16])&IF(RC[-15]="",,"|n"&R1C20&RC[-15])&IF(RC[-14]="",,"|n"&R1C21&RC[-14])&IF(RC[-13]="",,"|n"&R1C22&RC[-13])&IF(RC[-11]="",,"|n"&R1C24&RC[-11])&IF(RC[-10]="",,"|n"&R1C25&RC[-10])&IF(RC[-9]="",,"|n"&R1C26&RC[-9])&IF(RC[-8]="",,"|n"&R1C27&RC[-8])&IF(RC[-7]="",,"|n"&R1C28&RC[-7])&IF(RC[-6]="",,"|n"&R1C29&RC[-6])&IF(RC[-2]="",,"|n"&RC[-2]) -> 
AI980: =IF(RC[-27]&RC[-26]&RC[-25]&RC[-24]&RC[-23]&RC[-22]="",,R1C7)&IF(RC[-27]="",,"|n"&R1C8&RC[-27])&IF(RC[-26]="",,"|n"&R1C9&RC[-26])&IF(RC[-25]="",,"|n"&R1C10&RC[-25])&IF(RC[-24]="",,"|n"&R1C11&RC[-24])&IF(RC[-23]="",,"|n"&R1C12&RC[-23])&IF(RC[-22]="",,"|n"&R1C13&RC[-22])&IF(RC[-20]&RC[-19]&RC[-18]&RC[-17]="",,"|n"&R1C14)&IF(RC[-20]="",,"|n"&R1C15&RC[-20])&IF(RC[-19]="",,"|n"&R1C16&RC[-19])&IF(RC[-18]="",,"|n"&R1C17&RC[-18])&IF(RC[-17]="",,"|n"&R1C18&RC[-17])&IF(RC[-16]="",,"|n"&R1C19&RC[-16])&IF(RC[-15]="",,"|n"&R1C20&RC[-15])&IF(RC[-14]="",,"|n"&R1C21&RC[-14])&IF(RC[-13]="",,"|n"&R1C22&RC[-13])&IF(RC[-11]="",,"|n"&R1C24&RC[-11])&IF(RC[-10]="",,"|n"&R1C25&RC[-10])&IF(RC[-9]="",,"|n"&R1C26&RC[-9])&IF(RC[-8]="",,"|n"&R1C27&RC[-8])&IF(RC[-7]="",,"|n"&R1C28&RC[-7])&IF(RC[-6]="",,"|n"&R1C29&RC[-6])&IF(RC[-2]="",,"|n"&RC[-2]) -> 
AI981: =IF(RC[-27]&RC[-26]&RC[-25]&RC[-24]&RC[-23]&RC[-22]="",,R1C7)&IF(RC[-27]="",,"|n"&R1C8&RC[-27])&IF(RC[-26]="",,"|n"&R1C9&RC[-26])&IF(RC[-25]="",,"|n"&R1C10&RC[-25])&IF(RC[-24]="",,"|n"&R1C11&RC[-24])&IF(RC[-23]="",,"|n"&R1C12&RC[-23])&IF(RC[-22]="",,"|n"&R1C13&RC[-22])&IF(RC[-20]&RC[-19]&RC[-18]&RC[-17]="",,"|n"&R1C14)&IF(RC[-20]="",,"|n"&R1C15&RC[-20])&IF(RC[-19]="",,"|n"&R1C16&RC[-19])&IF(RC[-18]="",,"|n"&R1C17&RC[-18])&IF(RC[-17]="",,"|n"&R1C18&RC[-17])&IF(RC[-16]="",,"|n"&R1C19&RC[-16])&IF(RC[-15]="",,"|n"&R1C20&RC[-15])&IF(RC[-14]="",,"|n"&R1C21&RC[-14])&IF(RC[-13]="",,"|n"&R1C22&RC[-13])&IF(RC[-11]="",,"|n"&R1C24&RC[-11])&IF(RC[-10]="",,"|n"&R1C25&RC[-10])&IF(RC[-9]="",,"|n"&R1C26&RC[-9])&IF(RC[-8]="",,"|n"&R1C27&RC[-8])&IF(RC[-7]="",,"|n"&R1C28&RC[-7])&IF(RC[-6]="",,"|n"&R1C29&RC[-6])&IF(RC[-2]="",,"|n"&RC[-2]) -> 
AI982: =IF(RC[-27]&RC[-26]&RC[-25]&RC[-24]&RC[-23]&RC[-22]="",,R1C7)&IF(RC[-27]="",,"|n"&R1C8&RC[-27])&IF(RC[-26]="",,"|n"&R1C9&RC[-26])&IF(RC[-25]="",,"|n"&R1C10&RC[-25])&IF(RC[-24]="",,"|n"&R1C11&RC[-24])&IF(RC[-23]="",,"|n"&R1C12&RC[-23])&IF(RC[-22]="",,"|n"&R1C13&RC[-22])&IF(RC[-20]&RC[-19]&RC[-18]&RC[-17]="",,"|n"&R1C14)&IF(RC[-20]="",,"|n"&R1C15&RC[-20])&IF(RC[-19]="",,"|n"&R1C16&RC[-19])&IF(RC[-18]="",,"|n"&R1C17&RC[-18])&IF(RC[-17]="",,"|n"&R1C18&RC[-17])&IF(RC[-16]="",,"|n"&R1C19&RC[-16])&IF(RC[-15]="",,"|n"&R1C20&RC[-15])&IF(RC[-14]="",,"|n"&R1C21&RC[-14])&IF(RC[-13]="",,"|n"&R1C22&RC[-13])&IF(RC[-11]="",,"|n"&R1C24&RC[-11])&IF(RC[-10]="",,"|n"&R1C25&RC[-10])&IF(RC[-9]="",,"|n"&R1C26&RC[-9])&IF(RC[-8]="",,"|n"&R1C27&RC[-8])&IF(RC[-7]="",,"|n"&R1C28&RC[-7])&IF(RC[-6]="",,"|n"&R1C29&RC[-6])&IF(RC[-2]="",,"|n"&RC[-2]) -> 
AI983: =IF(RC[-27]&RC[-26]&RC[-25]&RC[-24]&RC[-23]&RC[-22]="",,R1C7)&IF(RC[-27]="",,"|n"&R1C8&RC[-27])&IF(RC[-26]="",,"|n"&R1C9&RC[-26])&IF(RC[-25]="",,"|n"&R1C10&RC[-25])&IF(RC[-24]="",,"|n"&R1C11&RC[-24])&IF(RC[-23]="",,"|n"&R1C12&RC[-23])&IF(RC[-22]="",,"|n"&R1C13&RC[-22])&IF(RC[-20]&RC[-19]&RC[-18]&RC[-17]="",,"|n"&R1C14)&IF(RC[-20]="",,"|n"&R1C15&RC[-20])&IF(RC[-19]="",,"|n"&R1C16&RC[-19])&IF(RC[-18]="",,"|n"&R1C17&RC[-18])&IF(RC[-17]="",,"|n"&R1C18&RC[-17])&IF(RC[-16]="",,"|n"&R1C19&RC[-16])&IF(RC[-15]="",,"|n"&R1C20&RC[-15])&IF(RC[-14]="",,"|n"&R1C21&RC[-14])&IF(RC[-13]="",,"|n"&R1C22&RC[-13])&IF(RC[-11]="",,"|n"&R1C24&RC[-11])&IF(RC[-10]="",,"|n"&R1C25&RC[-10])&IF(RC[-9]="",,"|n"&R1C26&RC[-9])&IF(RC[-8]="",,"|n"&R1C27&RC[-8])&IF(RC[-7]="",,"|n"&R1C28&RC[-7])&IF(RC[-6]="",,"|n"&R1C29&RC[-6])&IF(RC[-2]="",,"|n"&RC[-2]) -> 
AI984: =IF(RC[-27]&RC[-26]&RC[-25]&RC[-24]&RC[-23]&RC[-22]="",,R1C7)&IF(RC[-27]="",,"|n"&R1C8&RC[-27])&IF(RC[-26]="",,"|n"&R1C9&RC[-26])&IF(RC[-25]="",,"|n"&R1C10&RC[-25])&IF(RC[-24]="",,"|n"&R1C11&RC[-24])&IF(RC[-23]="",,"|n"&R1C12&RC[-23])&IF(RC[-22]="",,"|n"&R1C13&RC[-22])&IF(RC[-20]&RC[-19]&RC[-18]&RC[-17]="",,"|n"&R1C14)&IF(RC[-20]="",,"|n"&R1C15&RC[-20])&IF(RC[-19]="",,"|n"&R1C16&RC[-19])&IF(RC[-18]="",,"|n"&R1C17&RC[-18])&IF(RC[-17]="",,"|n"&R1C18&RC[-17])&IF(RC[-16]="",,"|n"&R1C19&RC[-16])&IF(RC[-15]="",,"|n"&R1C20&RC[-15])&IF(RC[-14]="",,"|n"&R1C21&RC[-14])&IF(RC[-13]="",,"|n"&R1C22&RC[-13])&IF(RC[-11]="",,"|n"&R1C24&RC[-11])&IF(RC[-10]="",,"|n"&R1C25&RC[-10])&IF(RC[-9]="",,"|n"&R1C26&RC[-9])&IF(RC[-8]="",,"|n"&R1C27&RC[-8])&IF(RC[-7]="",,"|n"&R1C28&RC[-7])&IF(RC[-6]="",,"|n"&R1C29&RC[-6])&IF(RC[-2]="",,"|n"&RC[-2]) -> 
AI985: =IF(RC[-27]&RC[-26]&RC[-25]&RC[-24]&RC[-23]&RC[-22]="",,R1C7)&IF(RC[-27]="",,"|n"&R1C8&RC[-27])&IF(RC[-26]="",,"|n"&R1C9&RC[-26])&IF(RC[-25]="",,"|n"&R1C10&RC[-25])&IF(RC[-24]="",,"|n"&R1C11&RC[-24])&IF(RC[-23]="",,"|n"&R1C12&RC[-23])&IF(RC[-22]="",,"|n"&R1C13&RC[-22])&IF(RC[-20]&RC[-19]&RC[-18]&RC[-17]="",,"|n"&R1C14)&IF(RC[-20]="",,"|n"&R1C15&RC[-20])&IF(RC[-19]="",,"|n"&R1C16&RC[-19])&IF(RC[-18]="",,"|n"&R1C17&RC[-18])&IF(RC[-17]="",,"|n"&R1C18&RC[-17])&IF(RC[-16]="",,"|n"&R1C19&RC[-16])&IF(RC[-15]="",,"|n"&R1C20&RC[-15])&IF(RC[-14]="",,"|n"&R1C21&RC[-14])&IF(RC[-13]="",,"|n"&R1C22&RC[-13])&IF(RC[-11]="",,"|n"&R1C24&RC[-11])&IF(RC[-10]="",,"|n"&R1C25&RC[-10])&IF(RC[-9]="",,"|n"&R1C26&RC[-9])&IF(RC[-8]="",,"|n"&R1C27&RC[-8])&IF(RC[-7]="",,"|n"&R1C28&RC[-7])&IF(RC[-6]="",,"|n"&R1C29&RC[-6])&IF(RC[-2]="",,"|n"&RC[-2]) -> 
AI986: =IF(RC[-27]&RC[-26]&RC[-25]&RC[-24]&RC[-23]&RC[-22]="",,R1C7)&IF(RC[-27]="",,"|n"&R1C8&RC[-27])&IF(RC[-26]="",,"|n"&R1C9&RC[-26])&IF(RC[-25]="",,"|n"&R1C10&RC[-25])&IF(RC[-24]="",,"|n"&R1C11&RC[-24])&IF(RC[-23]="",,"|n"&R1C12&RC[-23])&IF(RC[-22]="",,"|n"&R1C13&RC[-22])&IF(RC[-20]&RC[-19]&RC[-18]&RC[-17]="",,"|n"&R1C14)&IF(RC[-20]="",,"|n"&R1C15&RC[-20])&IF(RC[-19]="",,"|n"&R1C16&RC[-19])&IF(RC[-18]="",,"|n"&R1C17&RC[-18])&IF(RC[-17]="",,"|n"&R1C18&RC[-17])&IF(RC[-16]="",,"|n"&R1C19&RC[-16])&IF(RC[-15]="",,"|n"&R1C20&RC[-15])&IF(RC[-14]="",,"|n"&R1C21&RC[-14])&IF(RC[-13]="",,"|n"&R1C22&RC[-13])&IF(RC[-11]="",,"|n"&R1C24&RC[-11])&IF(RC[-10]="",,"|n"&R1C25&RC[-10])&IF(RC[-9]="",,"|n"&R1C26&RC[-9])&IF(RC[-8]="",,"|n"&R1C27&RC[-8])&IF(RC[-7]="",,"|n"&R1C28&RC[-7])&IF(RC[-6]="",,"|n"&R1C29&RC[-6])&IF(RC[-2]="",,"|n"&RC[-2]) -> 
AI987: =IF(RC[-27]&RC[-26]&RC[-25]&RC[-24]&RC[-23]&RC[-22]="",,R1C7)&IF(RC[-27]="",,"|n"&R1C8&RC[-27])&IF(RC[-26]="",,"|n"&R1C9&RC[-26])&IF(RC[-25]="",,"|n"&R1C10&RC[-25])&IF(RC[-24]="",,"|n"&R1C11&RC[-24])&IF(RC[-23]="",,"|n"&R1C12&RC[-23])&IF(RC[-22]="",,"|n"&R1C13&RC[-22])&IF(RC[-20]&RC[-19]&RC[-18]&RC[-17]="",,"|n"&R1C14)&IF(RC[-20]="",,"|n"&R1C15&RC[-20])&IF(RC[-19]="",,"|n"&R1C16&RC[-19])&IF(RC[-18]="",,"|n"&R1C17&RC[-18])&IF(RC[-17]="",,"|n"&R1C18&RC[-17])&IF(RC[-16]="",,"|n"&R1C19&RC[-16])&IF(RC[-15]="",,"|n"&R1C20&RC[-15])&IF(RC[-14]="",,"|n"&R1C21&RC[-14])&IF(RC[-13]="",,"|n"&R1C22&RC[-13])&IF(RC[-11]="",,"|n"&R1C24&RC[-11])&IF(RC[-10]="",,"|n"&R1C25&RC[-10])&IF(RC[-9]="",,"|n"&R1C26&RC[-9])&IF(RC[-8]="",,"|n"&R1C27&RC[-8])&IF(RC[-7]="",,"|n"&R1C28&RC[-7])&IF(RC[-6]="",,"|n"&R1C29&RC[-6])&IF(RC[-2]="",,"|n"&RC[-2]) -> 
AI988: =IF(RC[-27]&RC[-26]&RC[-25]&RC[-24]&RC[-23]&RC[-22]="",,R1C7)&IF(RC[-27]="",,"|n"&R1C8&RC[-27])&IF(RC[-26]="",,"|n"&R1C9&RC[-26])&IF(RC[-25]="",,"|n"&R1C10&RC[-25])&IF(RC[-24]="",,"|n"&R1C11&RC[-24])&IF(RC[-23]="",,"|n"&R1C12&RC[-23])&IF(RC[-22]="",,"|n"&R1C13&RC[-22])&IF(RC[-20]&RC[-19]&RC[-18]&RC[-17]="",,"|n"&R1C14)&IF(RC[-20]="",,"|n"&R1C15&RC[-20])&IF(RC[-19]="",,"|n"&R1C16&RC[-19])&IF(RC[-18]="",,"|n"&R1C17&RC[-18])&IF(RC[-17]="",,"|n"&R1C18&RC[-17])&IF(RC[-16]="",,"|n"&R1C19&RC[-16])&IF(RC[-15]="",,"|n"&R1C20&RC[-15])&IF(RC[-14]="",,"|n"&R1C21&RC[-14])&IF(RC[-13]="",,"|n"&R1C22&RC[-13])&IF(RC[-11]="",,"|n"&R1C24&RC[-11])&IF(RC[-10]="",,"|n"&R1C25&RC[-10])&IF(RC[-9]="",,"|n"&R1C26&RC[-9])&IF(RC[-8]="",,"|n"&R1C27&RC[-8])&IF(RC[-7]="",,"|n"&R1C28&RC[-7])&IF(RC[-6]="",,"|n"&R1C29&RC[-6])&IF(RC[-2]="",,"|n"&RC[-2]) -> 
AI989: =IF(RC[-27]&RC[-26]&RC[-25]&RC[-24]&RC[-23]&RC[-22]="",,R1C7)&IF(RC[-27]="",,"|n"&R1C8&RC[-27])&IF(RC[-26]="",,"|n"&R1C9&RC[-26])&IF(RC[-25]="",,"|n"&R1C10&RC[-25])&IF(RC[-24]="",,"|n"&R1C11&RC[-24])&IF(RC[-23]="",,"|n"&R1C12&RC[-23])&IF(RC[-22]="",,"|n"&R1C13&RC[-22])&IF(RC[-20]&RC[-19]&RC[-18]&RC[-17]="",,"|n"&R1C14)&IF(RC[-20]="",,"|n"&R1C15&RC[-20])&IF(RC[-19]="",,"|n"&R1C16&RC[-19])&IF(RC[-18]="",,"|n"&R1C17&RC[-18])&IF(RC[-17]="",,"|n"&R1C18&RC[-17])&IF(RC[-16]="",,"|n"&R1C19&RC[-16])&IF(RC[-15]="",,"|n"&R1C20&RC[-15])&IF(RC[-14]="",,"|n"&R1C21&RC[-14])&IF(RC[-13]="",,"|n"&R1C22&RC[-13])&IF(RC[-11]="",,"|n"&R1C24&RC[-11])&IF(RC[-10]="",,"|n"&R1C25&RC[-10])&IF(RC[-9]="",,"|n"&R1C26&RC[-9])&IF(RC[-8]="",,"|n"&R1C27&RC[-8])&IF(RC[-7]="",,"|n"&R1C28&RC[-7])&IF(RC[-6]="",,"|n"&R1C29&RC[-6])&IF(RC[-2]="",,"|n"&RC[-2]) -> 
AI990: =IF(RC[-27]&RC[-26]&RC[-25]&RC[-24]&RC[-23]&RC[-22]="",,R1C7)&IF(RC[-27]="",,"|n"&R1C8&RC[-27])&IF(RC[-26]="",,"|n"&R1C9&RC[-26])&IF(RC[-25]="",,"|n"&R1C10&RC[-25])&IF(RC[-24]="",,"|n"&R1C11&RC[-24])&IF(RC[-23]="",,"|n"&R1C12&RC[-23])&IF(RC[-22]="",,"|n"&R1C13&RC[-22])&IF(RC[-20]&RC[-19]&RC[-18]&RC[-17]="",,"|n"&R1C14)&IF(RC[-20]="",,"|n"&R1C15&RC[-20])&IF(RC[-19]="",,"|n"&R1C16&RC[-19])&IF(RC[-18]="",,"|n"&R1C17&RC[-18])&IF(RC[-17]="",,"|n"&R1C18&RC[-17])&IF(RC[-16]="",,"|n"&R1C19&RC[-16])&IF(RC[-15]="",,"|n"&R1C20&RC[-15])&IF(RC[-14]="",,"|n"&R1C21&RC[-14])&IF(RC[-13]="",,"|n"&R1C22&RC[-13])&IF(RC[-11]="",,"|n"&R1C24&RC[-11])&IF(RC[-10]="",,"|n"&R1C25&RC[-10])&IF(RC[-9]="",,"|n"&R1C26&RC[-9])&IF(RC[-8]="",,"|n"&R1C27&RC[-8])&IF(RC[-7]="",,"|n"&R1C28&RC[-7])&IF(RC[-6]="",,"|n"&R1C29&RC[-6])&IF(RC[-2]="",,"|n"&RC[-2]) -> 
AI991: =IF(RC[-27]&RC[-26]&RC[-25]&RC[-24]&RC[-23]&RC[-22]="",,R1C7)&IF(RC[-27]="",,"|n"&R1C8&RC[-27])&IF(RC[-26]="",,"|n"&R1C9&RC[-26])&IF(RC[-25]="",,"|n"&R1C10&RC[-25])&IF(RC[-24]="",,"|n"&R1C11&RC[-24])&IF(RC[-23]="",,"|n"&R1C12&RC[-23])&IF(RC[-22]="",,"|n"&R1C13&RC[-22])&IF(RC[-20]&RC[-19]&RC[-18]&RC[-17]="",,"|n"&R1C14)&IF(RC[-20]="",,"|n"&R1C15&RC[-20])&IF(RC[-19]="",,"|n"&R1C16&RC[-19])&IF(RC[-18]="",,"|n"&R1C17&RC[-18])&IF(RC[-17]="",,"|n"&R1C18&RC[-17])&IF(RC[-16]="",,"|n"&R1C19&RC[-16])&IF(RC[-15]="",,"|n"&R1C20&RC[-15])&IF(RC[-14]="",,"|n"&R1C21&RC[-14])&IF(RC[-13]="",,"|n"&R1C22&RC[-13])&IF(RC[-11]="",,"|n"&R1C24&RC[-11])&IF(RC[-10]="",,"|n"&R1C25&RC[-10])&IF(RC[-9]="",,"|n"&R1C26&RC[-9])&IF(RC[-8]="",,"|n"&R1C27&RC[-8])&IF(RC[-7]="",,"|n"&R1C28&RC[-7])&IF(RC[-6]="",,"|n"&R1C29&RC[-6])&IF(RC[-2]="",,"|n"&RC[-2]) -> 
AI992: =IF(RC[-27]&RC[-26]&RC[-25]&RC[-24]&RC[-23]&RC[-22]="",,R1C7)&IF(RC[-27]="",,"|n"&R1C8&RC[-27])&IF(RC[-26]="",,"|n"&R1C9&RC[-26])&IF(RC[-25]="",,"|n"&R1C10&RC[-25])&IF(RC[-24]="",,"|n"&R1C11&RC[-24])&IF(RC[-23]="",,"|n"&R1C12&RC[-23])&IF(RC[-22]="",,"|n"&R1C13&RC[-22])&IF(RC[-20]&RC[-19]&RC[-18]&RC[-17]="",,"|n"&R1C14)&IF(RC[-20]="",,"|n"&R1C15&RC[-20])&IF(RC[-19]="",,"|n"&R1C16&RC[-19])&IF(RC[-18]="",,"|n"&R1C17&RC[-18])&IF(RC[-17]="",,"|n"&R1C18&RC[-17])&IF(RC[-16]="",,"|n"&R1C19&RC[-16])&IF(RC[-15]="",,"|n"&R1C20&RC[-15])&IF(RC[-14]="",,"|n"&R1C21&RC[-14])&IF(RC[-13]="",,"|n"&R1C22&RC[-13])&IF(RC[-11]="",,"|n"&R1C24&RC[-11])&IF(RC[-10]="",,"|n"&R1C25&RC[-10])&IF(RC[-9]="",,"|n"&R1C26&RC[-9])&IF(RC[-8]="",,"|n"&R1C27&RC[-8])&IF(RC[-7]="",,"|n"&R1C28&RC[-7])&IF(RC[-6]="",,"|n"&R1C29&RC[-6])&IF(RC[-2]="",,"|n"&RC[-2]) -> 
AI993: =IF(RC[-27]&RC[-26]&RC[-25]&RC[-24]&RC[-23]&RC[-22]="",,R1C7)&IF(RC[-27]="",,"|n"&R1C8&RC[-27])&IF(RC[-26]="",,"|n"&R1C9&RC[-26])&IF(RC[-25]="",,"|n"&R1C10&RC[-25])&IF(RC[-24]="",,"|n"&R1C11&RC[-24])&IF(RC[-23]="",,"|n"&R1C12&RC[-23])&IF(RC[-22]="",,"|n"&R1C13&RC[-22])&IF(RC[-20]&RC[-19]&RC[-18]&RC[-17]="",,"|n"&R1C14)&IF(RC[-20]="",,"|n"&R1C15&RC[-20])&IF(RC[-19]="",,"|n"&R1C16&RC[-19])&IF(RC[-18]="",,"|n"&R1C17&RC[-18])&IF(RC[-17]="",,"|n"&R1C18&RC[-17])&IF(RC[-16]="",,"|n"&R1C19&RC[-16])&IF(RC[-15]="",,"|n"&R1C20&RC[-15])&IF(RC[-14]="",,"|n"&R1C21&RC[-14])&IF(RC[-13]="",,"|n"&R1C22&RC[-13])&IF(RC[-11]="",,"|n"&R1C24&RC[-11])&IF(RC[-10]="",,"|n"&R1C25&RC[-10])&IF(RC[-9]="",,"|n"&R1C26&RC[-9])&IF(RC[-8]="",,"|n"&R1C27&RC[-8])&IF(RC[-7]="",,"|n"&R1C28&RC[-7])&IF(RC[-6]="",,"|n"&R1C29&RC[-6])&IF(RC[-2]="",,"|n"&RC[-2]) -> 
AI994: =IF(RC[-27]&RC[-26]&RC[-25]&RC[-24]&RC[-23]&RC[-22]="",,R1C7)&IF(RC[-27]="",,"|n"&R1C8&RC[-27])&IF(RC[-26]="",,"|n"&R1C9&RC[-26])&IF(RC[-25]="",,"|n"&R1C10&RC[-25])&IF(RC[-24]="",,"|n"&R1C11&RC[-24])&IF(RC[-23]="",,"|n"&R1C12&RC[-23])&IF(RC[-22]="",,"|n"&R1C13&RC[-22])&IF(RC[-20]&RC[-19]&RC[-18]&RC[-17]="",,"|n"&R1C14)&IF(RC[-20]="",,"|n"&R1C15&RC[-20])&IF(RC[-19]="",,"|n"&R1C16&RC[-19])&IF(RC[-18]="",,"|n"&R1C17&RC[-18])&IF(RC[-17]="",,"|n"&R1C18&RC[-17])&IF(RC[-16]="",,"|n"&R1C19&RC[-16])&IF(RC[-15]="",,"|n"&R1C20&RC[-15])&IF(RC[-14]="",,"|n"&R1C21&RC[-14])&IF(RC[-13]="",,"|n"&R1C22&RC[-13])&IF(RC[-11]="",,"|n"&R1C24&RC[-11])&IF(RC[-10]="",,"|n"&R1C25&RC[-10])&IF(RC[-9]="",,"|n"&R1C26&RC[-9])&IF(RC[-8]="",,"|n"&R1C27&RC[-8])&IF(RC[-7]="",,"|n"&R1C28&RC[-7])&IF(RC[-6]="",,"|n"&R1C29&RC[-6])&IF(RC[-2]="",,"|n"&RC[-2]) -> 
AI995: =IF(RC[-27]&RC[-26]&RC[-25]&RC[-24]&RC[-23]&RC[-22]="",,R1C7)&IF(RC[-27]="",,"|n"&R1C8&RC[-27])&IF(RC[-26]="",,"|n"&R1C9&RC[-26])&IF(RC[-25]="",,"|n"&R1C10&RC[-25])&IF(RC[-24]="",,"|n"&R1C11&RC[-24])&IF(RC[-23]="",,"|n"&R1C12&RC[-23])&IF(RC[-22]="",,"|n"&R1C13&RC[-22])&IF(RC[-20]&RC[-19]&RC[-18]&RC[-17]="",,"|n"&R1C14)&IF(RC[-20]="",,"|n"&R1C15&RC[-20])&IF(RC[-19]="",,"|n"&R1C16&RC[-19])&IF(RC[-18]="",,"|n"&R1C17&RC[-18])&IF(RC[-17]="",,"|n"&R1C18&RC[-17])&IF(RC[-16]="",,"|n"&R1C19&RC[-16])&IF(RC[-15]="",,"|n"&R1C20&RC[-15])&IF(RC[-14]="",,"|n"&R1C21&RC[-14])&IF(RC[-13]="",,"|n"&R1C22&RC[-13])&IF(RC[-11]="",,"|n"&R1C24&RC[-11])&IF(RC[-10]="",,"|n"&R1C25&RC[-10])&IF(RC[-9]="",,"|n"&R1C26&RC[-9])&IF(RC[-8]="",,"|n"&R1C27&RC[-8])&IF(RC[-7]="",,"|n"&R1C28&RC[-7])&IF(RC[-6]="",,"|n"&R1C29&RC[-6])&IF(RC[-2]="",,"|n"&RC[-2]) -> 
AI996: =IF(RC[-27]&RC[-26]&RC[-25]&RC[-24]&RC[-23]&RC[-22]="",,R1C7)&IF(RC[-27]="",,"|n"&R1C8&RC[-27])&IF(RC[-26]="",,"|n"&R1C9&RC[-26])&IF(RC[-25]="",,"|n"&R1C10&RC[-25])&IF(RC[-24]="",,"|n"&R1C11&RC[-24])&IF(RC[-23]="",,"|n"&R1C12&RC[-23])&IF(RC[-22]="",,"|n"&R1C13&RC[-22])&IF(RC[-20]&RC[-19]&RC[-18]&RC[-17]="",,"|n"&R1C14)&IF(RC[-20]="",,"|n"&R1C15&RC[-20])&IF(RC[-19]="",,"|n"&R1C16&RC[-19])&IF(RC[-18]="",,"|n"&R1C17&RC[-18])&IF(RC[-17]="",,"|n"&R1C18&RC[-17])&IF(RC[-16]="",,"|n"&R1C19&RC[-16])&IF(RC[-15]="",,"|n"&R1C20&RC[-15])&IF(RC[-14]="",,"|n"&R1C21&RC[-14])&IF(RC[-13]="",,"|n"&R1C22&RC[-13])&IF(RC[-11]="",,"|n"&R1C24&RC[-11])&IF(RC[-10]="",,"|n"&R1C25&RC[-10])&IF(RC[-9]="",,"|n"&R1C26&RC[-9])&IF(RC[-8]="",,"|n"&R1C27&RC[-8])&IF(RC[-7]="",,"|n"&R1C28&RC[-7])&IF(RC[-6]="",,"|n"&R1C29&RC[-6])&IF(RC[-2]="",,"|n"&RC[-2]) -> 
AI997: =IF(RC[-27]&RC[-26]&RC[-25]&RC[-24]&RC[-23]&RC[-22]="",,R1C7)&IF(RC[-27]="",,"|n"&R1C8&RC[-27])&IF(RC[-26]="",,"|n"&R1C9&RC[-26])&IF(RC[-25]="",,"|n"&R1C10&RC[-25])&IF(RC[-24]="",,"|n"&R1C11&RC[-24])&IF(RC[-23]="",,"|n"&R1C12&RC[-23])&IF(RC[-22]="",,"|n"&R1C13&RC[-22])&IF(RC[-20]&RC[-19]&RC[-18]&RC[-17]="",,"|n"&R1C14)&IF(RC[-20]="",,"|n"&R1C15&RC[-20])&IF(RC[-19]="",,"|n"&R1C16&RC[-19])&IF(RC[-18]="",,"|n"&R1C17&RC[-18])&IF(RC[-17]="",,"|n"&R1C18&RC[-17])&IF(RC[-16]="",,"|n"&R1C19&RC[-16])&IF(RC[-15]="",,"|n"&R1C20&RC[-15])&IF(RC[-14]="",,"|n"&R1C21&RC[-14])&IF(RC[-13]="",,"|n"&R1C22&RC[-13])&IF(RC[-11]="",,"|n"&R1C24&RC[-11])&IF(RC[-10]="",,"|n"&R1C25&RC[-10])&IF(RC[-9]="",,"|n"&R1C26&RC[-9])&IF(RC[-8]="",,"|n"&R1C27&RC[-8])&IF(RC[-7]="",,"|n"&R1C28&RC[-7])&IF(RC[-6]="",,"|n"&R1C29&RC[-6])&IF(RC[-2]="",,"|n"&RC[-2]) -> 
AI998: =IF(RC[-27]&RC[-26]&RC[-25]&RC[-24]&RC[-23]&RC[-22]="",,R1C7)&IF(RC[-27]="",,"|n"&R1C8&RC[-27])&IF(RC[-26]="",,"|n"&R1C9&RC[-26])&IF(RC[-25]="",,"|n"&R1C10&RC[-25])&IF(RC[-24]="",,"|n"&R1C11&RC[-24])&IF(RC[-23]="",,"|n"&R1C12&RC[-23])&IF(RC[-22]="",,"|n"&R1C13&RC[-22])&IF(RC[-20]&RC[-19]&RC[-18]&RC[-17]="",,"|n"&R1C14)&IF(RC[-20]="",,"|n"&R1C15&RC[-20])&IF(RC[-19]="",,"|n"&R1C16&RC[-19])&IF(RC[-18]="",,"|n"&R1C17&RC[-18])&IF(RC[-17]="",,"|n"&R1C18&RC[-17])&IF(RC[-16]="",,"|n"&R1C19&RC[-16])&IF(RC[-15]="",,"|n"&R1C20&RC[-15])&IF(RC[-14]="",,"|n"&R1C21&RC[-14])&IF(RC[-13]="",,"|n"&R1C22&RC[-13])&IF(RC[-11]="",,"|n"&R1C24&RC[-11])&IF(RC[-10]="",,"|n"&R1C25&RC[-10])&IF(RC[-9]="",,"|n"&R1C26&RC[-9])&IF(RC[-8]="",,"|n"&R1C27&RC[-8])&IF(RC[-7]="",,"|n"&R1C28&RC[-7])&IF(RC[-6]="",,"|n"&R1C29&RC[-6])&IF(RC[-2]="",,"|n"&RC[-2]) -> 
AI999: =IF(RC[-27]&RC[-26]&RC[-25]&RC[-24]&RC[-23]&RC[-22]="",,R1C7)&IF(RC[-27]="",,"|n"&R1C8&RC[-27])&IF(RC[-26]="",,"|n"&R1C9&RC[-26])&IF(RC[-25]="",,"|n"&R1C10&RC[-25])&IF(RC[-24]="",,"|n"&R1C11&RC[-24])&IF(RC[-23]="",,"|n"&R1C12&RC[-23])&IF(RC[-22]="",,"|n"&R1C13&RC[-22])&IF(RC[-20]&RC[-19]&RC[-18]&RC[-17]="",,"|n"&R1C14)&IF(RC[-20]="",,"|n"&R1C15&RC[-20])&IF(RC[-19]="",,"|n"&R1C16&RC[-19])&IF(RC[-18]="",,"|n"&R1C17&RC[-18])&IF(RC[-17]="",,"|n"&R1C18&RC[-17])&IF(RC[-16]="",,"|n"&R1C19&RC[-16])&IF(RC[-15]="",,"|n"&R1C20&RC[-15])&IF(RC[-14]="",,"|n"&R1C21&RC[-14])&IF(RC[-13]="",,"|n"&R1C22&RC[-13])&IF(RC[-11]="",,"|n"&R1C24&RC[-11])&IF(RC[-10]="",,"|n"&R1C25&RC[-10])&IF(RC[-9]="",,"|n"&R1C26&RC[-9])&IF(RC[-8]="",,"|n"&R1C27&RC[-8])&IF(RC[-7]="",,"|n"&R1C28&RC[-7])&IF(RC[-6]="",,"|n"&R1C29&RC[-6])&IF(RC[-2]="",,"|n"&RC[-2]) -> 
AI1000: =IF(RC[-27]&RC[-26]&RC[-25]&RC[-24]&RC[-23]&RC[-22]="",,R1C7)&IF(RC[-27]="",,"|n"&R1C8&RC[-27])&IF(RC[-26]="",,"|n"&R1C9&RC[-26])&IF(RC[-25]="",,"|n"&R1C10&RC[-25])&IF(RC[-24]="",,"|n"&R1C11&RC[-24])&IF(RC[-23]="",,"|n"&R1C12&RC[-23])&IF(RC[-22]="",,"|n"&R1C13&RC[-22])&IF(RC[-20]&RC[-19]&RC[-18]&RC[-17]="",,"|n"&R1C14)&IF(RC[-20]="",,"|n"&R1C15&RC[-20])&IF(RC[-19]="",,"|n"&R1C16&RC[-19])&IF(RC[-18]="",,"|n"&R1C17&RC[-18])&IF(RC[-17]="",,"|n"&R1C18&RC[-17])&IF(RC[-16]="",,"|n"&R1C19&RC[-16])&IF(RC[-15]="",,"|n"&R1C20&RC[-15])&IF(RC[-14]="",,"|n"&R1C21&RC[-14])&IF(RC[-13]="",,"|n"&R1C22&RC[-13])&IF(RC[-11]="",,"|n"&R1C24&RC[-11])&IF(RC[-10]="",,"|n"&R1C25&RC[-10])&IF(RC[-9]="",,"|n"&R1C26&RC[-9])&IF(RC[-8]="",,"|n"&R1C27&RC[-8])&IF(RC[-7]="",,"|n"&R1C28&RC[-7])&IF(RC[-6]="",,"|n"&R1C29&RC[-6])&IF(RC[-2]="",,"|n"&RC[-2]) -> 
AI1001: =IF(RC[-27]&RC[-26]&RC[-25]&RC[-24]&RC[-23]&RC[-22]="",,R1C7)&IF(RC[-27]="",,"|n"&R1C8&RC[-27])&IF(RC[-26]="",,"|n"&R1C9&RC[-26])&IF(RC[-25]="",,"|n"&R1C10&RC[-25])&IF(RC[-24]="",,"|n"&R1C11&RC[-24])&IF(RC[-23]="",,"|n"&R1C12&RC[-23])&IF(RC[-22]="",,"|n"&R1C13&RC[-22])&IF(RC[-20]&RC[-19]&RC[-18]&RC[-17]="",,"|n"&R1C14)&IF(RC[-20]="",,"|n"&R1C15&RC[-20])&IF(RC[-19]="",,"|n"&R1C16&RC[-19])&IF(RC[-18]="",,"|n"&R1C17&RC[-18])&IF(RC[-17]="",,"|n"&R1C18&RC[-17])&IF(RC[-16]="",,"|n"&R1C19&RC[-16])&IF(RC[-15]="",,"|n"&R1C20&RC[-15])&IF(RC[-14]="",,"|n"&R1C21&RC[-14])&IF(RC[-13]="",,"|n"&R1C22&RC[-13])&IF(RC[-11]="",,"|n"&R1C24&RC[-11])&IF(RC[-10]="",,"|n"&R1C25&RC[-10])&IF(RC[-9]="",,"|n"&R1C26&RC[-9])&IF(RC[-8]="",,"|n"&R1C27&RC[-8])&IF(RC[-7]="",,"|n"&R1C28&RC[-7])&IF(RC[-6]="",,"|n"&R1C29&RC[-6])&IF(RC[-2]="",,"|n"&RC[-2]) -> 
AI1002: =IF(RC[-27]&RC[-26]&RC[-25]&RC[-24]&RC[-23]&RC[-22]="",,R1C7)&IF(RC[-27]="",,"|n"&R1C8&RC[-27])&IF(RC[-26]="",,"|n"&R1C9&RC[-26])&IF(RC[-25]="",,"|n"&R1C10&RC[-25])&IF(RC[-24]="",,"|n"&R1C11&RC[-24])&IF(RC[-23]="",,"|n"&R1C12&RC[-23])&IF(RC[-22]="",,"|n"&R1C13&RC[-22])&IF(RC[-20]&RC[-19]&RC[-18]&RC[-17]="",,"|n"&R1C14)&IF(RC[-20]="",,"|n"&R1C15&RC[-20])&IF(RC[-19]="",,"|n"&R1C16&RC[-19])&IF(RC[-18]="",,"|n"&R1C17&RC[-18])&IF(RC[-17]="",,"|n"&R1C18&RC[-17])&IF(RC[-16]="",,"|n"&R1C19&RC[-16])&IF(RC[-15]="",,"|n"&R1C20&RC[-15])&IF(RC[-14]="",,"|n"&R1C21&RC[-14])&IF(RC[-13]="",,"|n"&R1C22&RC[-13])&IF(RC[-11]="",,"|n"&R1C24&RC[-11])&IF(RC[-10]="",,"|n"&R1C25&RC[-10])&IF(RC[-9]="",,"|n"&R1C26&RC[-9])&IF(RC[-8]="",,"|n"&R1C27&RC[-8])&IF(RC[-7]="",,"|n"&R1C28&RC[-7])&IF(RC[-6]="",,"|n"&R1C29&RC[-6])&IF(RC[-2]="",,"|n"&RC[-2]) -> 
AI1003: =IF(RC[-27]&RC[-26]&RC[-25]&RC[-24]&RC[-23]&RC[-22]="",,R1C7)&IF(RC[-27]="",,"|n"&R1C8&RC[-27])&IF(RC[-26]="",,"|n"&R1C9&RC[-26])&IF(RC[-25]="",,"|n"&R1C10&RC[-25])&IF(RC[-24]="",,"|n"&R1C11&RC[-24])&IF(RC[-23]="",,"|n"&R1C12&RC[-23])&IF(RC[-22]="",,"|n"&R1C13&RC[-22])&IF(RC[-20]&RC[-19]&RC[-18]&RC[-17]="",,"|n"&R1C14)&IF(RC[-20]="",,"|n"&R1C15&RC[-20])&IF(RC[-19]="",,"|n"&R1C16&RC[-19])&IF(RC[-18]="",,"|n"&R1C17&RC[-18])&IF(RC[-17]="",,"|n"&R1C18&RC[-17])&IF(RC[-16]="",,"|n"&R1C19&RC[-16])&IF(RC[-15]="",,"|n"&R1C20&RC[-15])&IF(RC[-14]="",,"|n"&R1C21&RC[-14])&IF(RC[-13]="",,"|n"&R1C22&RC[-13])&IF(RC[-11]="",,"|n"&R1C24&RC[-11])&IF(RC[-10]="",,"|n"&R1C25&RC[-10])&IF(RC[-9]="",,"|n"&R1C26&RC[-9])&IF(RC[-8]="",,"|n"&R1C27&RC[-8])&IF(RC[-7]="",,"|n"&R1C28&RC[-7])&IF(RC[-6]="",,"|n"&R1C29&RC[-6])&IF(RC[-2]="",,"|n"&RC[-2]) -> 
AI1004: =IF(RC[-27]&RC[-26]&RC[-25]&RC[-24]&RC[-23]&RC[-22]="",,R1C7)&IF(RC[-27]="",,"|n"&R1C8&RC[-27])&IF(RC[-26]="",,"|n"&R1C9&RC[-26])&IF(RC[-25]="",,"|n"&R1C10&RC[-25])&IF(RC[-24]="",,"|n"&R1C11&RC[-24])&IF(RC[-23]="",,"|n"&R1C12&RC[-23])&IF(RC[-22]="",,"|n"&R1C13&RC[-22])&IF(RC[-20]&RC[-19]&RC[-18]&RC[-17]="",,"|n"&R1C14)&IF(RC[-20]="",,"|n"&R1C15&RC[-20])&IF(RC[-19]="",,"|n"&R1C16&RC[-19])&IF(RC[-18]="",,"|n"&R1C17&RC[-18])&IF(RC[-17]="",,"|n"&R1C18&RC[-17])&IF(RC[-16]="",,"|n"&R1C19&RC[-16])&IF(RC[-15]="",,"|n"&R1C20&RC[-15])&IF(RC[-14]="",,"|n"&R1C21&RC[-14])&IF(RC[-13]="",,"|n"&R1C22&RC[-13])&IF(RC[-11]="",,"|n"&R1C24&RC[-11])&IF(RC[-10]="",,"|n"&R1C25&RC[-10])&IF(RC[-9]="",,"|n"&R1C26&RC[-9])&IF(RC[-8]="",,"|n"&R1C27&RC[-8])&IF(RC[-7]="",,"|n"&R1C28&RC[-7])&IF(RC[-6]="",,"|n"&R1C29&RC[-6])&IF(RC[-2]="",,"|n"&RC[-2]) -> 
AI1005: =IF(RC[-27]&RC[-26]&RC[-25]&RC[-24]&RC[-23]&RC[-22]="",,R1C7)&IF(RC[-27]="",,"|n"&R1C8&RC[-27])&IF(RC[-26]="",,"|n"&R1C9&RC[-26])&IF(RC[-25]="",,"|n"&R1C10&RC[-25])&IF(RC[-24]="",,"|n"&R1C11&RC[-24])&IF(RC[-23]="",,"|n"&R1C12&RC[-23])&IF(RC[-22]="",,"|n"&R1C13&RC[-22])&IF(RC[-20]&RC[-19]&RC[-18]&RC[-17]="",,"|n"&R1C14)&IF(RC[-20]="",,"|n"&R1C15&RC[-20])&IF(RC[-19]="",,"|n"&R1C16&RC[-19])&IF(RC[-18]="",,"|n"&R1C17&RC[-18])&IF(RC[-17]="",,"|n"&R1C18&RC[-17])&IF(RC[-16]="",,"|n"&R1C19&RC[-16])&IF(RC[-15]="",,"|n"&R1C20&RC[-15])&IF(RC[-14]="",,"|n"&R1C21&RC[-14])&IF(RC[-13]="",,"|n"&R1C22&RC[-13])&IF(RC[-11]="",,"|n"&R1C24&RC[-11])&IF(RC[-10]="",,"|n"&R1C25&RC[-10])&IF(RC[-9]="",,"|n"&R1C26&RC[-9])&IF(RC[-8]="",,"|n"&R1C27&RC[-8])&IF(RC[-7]="",,"|n"&R1C28&RC[-7])&IF(RC[-6]="",,"|n"&R1C29&RC[-6])&IF(RC[-2]="",,"|n"&RC[-2]) -> 
AI1006: =IF(RC[-27]&RC[-26]&RC[-25]&RC[-24]&RC[-23]&RC[-22]="",,R1C7)&IF(RC[-27]="",,"|n"&R1C8&RC[-27])&IF(RC[-26]="",,"|n"&R1C9&RC[-26])&IF(RC[-25]="",,"|n"&R1C10&RC[-25])&IF(RC[-24]="",,"|n"&R1C11&RC[-24])&IF(RC[-23]="",,"|n"&R1C12&RC[-23])&IF(RC[-22]="",,"|n"&R1C13&RC[-22])&IF(RC[-20]&RC[-19]&RC[-18]&RC[-17]="",,"|n"&R1C14)&IF(RC[-20]="",,"|n"&R1C15&RC[-20])&IF(RC[-19]="",,"|n"&R1C16&RC[-19])&IF(RC[-18]="",,"|n"&R1C17&RC[-18])&IF(RC[-17]="",,"|n"&R1C18&RC[-17])&IF(RC[-16]="",,"|n"&R1C19&RC[-16])&IF(RC[-15]="",,"|n"&R1C20&RC[-15])&IF(RC[-14]="",,"|n"&R1C21&RC[-14])&IF(RC[-13]="",,"|n"&R1C22&RC[-13])&IF(RC[-11]="",,"|n"&R1C24&RC[-11])&IF(RC[-10]="",,"|n"&R1C25&RC[-10])&IF(RC[-9]="",,"|n"&R1C26&RC[-9])&IF(RC[-8]="",,"|n"&R1C27&RC[-8])&IF(RC[-7]="",,"|n"&R1C28&RC[-7])&IF(RC[-6]="",,"|n"&R1C29&RC[-6])&IF(RC[-2]="",,"|n"&RC[-2]) -> 
AI1007: =IF(RC[-27]&RC[-26]&RC[-25]&RC[-24]&RC[-23]&RC[-22]="",,R1C7)&IF(RC[-27]="",,"|n"&R1C8&RC[-27])&IF(RC[-26]="",,"|n"&R1C9&RC[-26])&IF(RC[-25]="",,"|n"&R1C10&RC[-25])&IF(RC[-24]="",,"|n"&R1C11&RC[-24])&IF(RC[-23]="",,"|n"&R1C12&RC[-23])&IF(RC[-22]="",,"|n"&R1C13&RC[-22])&IF(RC[-20]&RC[-19]&RC[-18]&RC[-17]="",,"|n"&R1C14)&IF(RC[-20]="",,"|n"&R1C15&RC[-20])&IF(RC[-19]="",,"|n"&R1C16&RC[-19])&IF(RC[-18]="",,"|n"&R1C17&RC[-18])&IF(RC[-17]="",,"|n"&R1C18&RC[-17])&IF(RC[-16]="",,"|n"&R1C19&RC[-16])&IF(RC[-15]="",,"|n"&R1C20&RC[-15])&IF(RC[-14]="",,"|n"&R1C21&RC[-14])&IF(RC[-13]="",,"|n"&R1C22&RC[-13])&IF(RC[-11]="",,"|n"&R1C24&RC[-11])&IF(RC[-10]="",,"|n"&R1C25&RC[-10])&IF(RC[-9]="",,"|n"&R1C26&RC[-9])&IF(RC[-8]="",,"|n"&R1C27&RC[-8])&IF(RC[-7]="",,"|n"&R1C28&RC[-7])&IF(RC[-6]="",,"|n"&R1C29&RC[-6])&IF(RC[-2]="",,"|n"&RC[-2]) -> 
AI1008: =IF(RC[-27]&RC[-26]&RC[-25]&RC[-24]&RC[-23]&RC[-22]="",,R1C7)&IF(RC[-27]="",,"|n"&R1C8&RC[-27])&IF(RC[-26]="",,"|n"&R1C9&RC[-26])&IF(RC[-25]="",,"|n"&R1C10&RC[-25])&IF(RC[-24]="",,"|n"&R1C11&RC[-24])&IF(RC[-23]="",,"|n"&R1C12&RC[-23])&IF(RC[-22]="",,"|n"&R1C13&RC[-22])&IF(RC[-20]&RC[-19]&RC[-18]&RC[-17]="",,"|n"&R1C14)&IF(RC[-20]="",,"|n"&R1C15&RC[-20])&IF(RC[-19]="",,"|n"&R1C16&RC[-19])&IF(RC[-18]="",,"|n"&R1C17&RC[-18])&IF(RC[-17]="",,"|n"&R1C18&RC[-17])&IF(RC[-16]="",,"|n"&R1C19&RC[-16])&IF(RC[-15]="",,"|n"&R1C20&RC[-15])&IF(RC[-14]="",,"|n"&R1C21&RC[-14])&IF(RC[-13]="",,"|n"&R1C22&RC[-13])&IF(RC[-11]="",,"|n"&R1C24&RC[-11])&IF(RC[-10]="",,"|n"&R1C25&RC[-10])&IF(RC[-9]="",,"|n"&R1C26&RC[-9])&IF(RC[-8]="",,"|n"&R1C27&RC[-8])&IF(RC[-7]="",,"|n"&R1C28&RC[-7])&IF(RC[-6]="",,"|n"&R1C29&RC[-6])&IF(RC[-2]="",,"|n"&RC[-2]) -> 
AI1009: =IF(RC[-27]&RC[-26]&RC[-25]&RC[-24]&RC[-23]&RC[-22]="",,R1C7)&IF(RC[-27]="",,"|n"&R1C8&RC[-27])&IF(RC[-26]="",,"|n"&R1C9&RC[-26])&IF(RC[-25]="",,"|n"&R1C10&RC[-25])&IF(RC[-24]="",,"|n"&R1C11&RC[-24])&IF(RC[-23]="",,"|n"&R1C12&RC[-23])&IF(RC[-22]="",,"|n"&R1C13&RC[-22])&IF(RC[-20]&RC[-19]&RC[-18]&RC[-17]="",,"|n"&R1C14)&IF(RC[-20]="",,"|n"&R1C15&RC[-20])&IF(RC[-19]="",,"|n"&R1C16&RC[-19])&IF(RC[-18]="",,"|n"&R1C17&RC[-18])&IF(RC[-17]="",,"|n"&R1C18&RC[-17])&IF(RC[-16]="",,"|n"&R1C19&RC[-16])&IF(RC[-15]="",,"|n"&R1C20&RC[-15])&IF(RC[-14]="",,"|n"&R1C21&RC[-14])&IF(RC[-13]="",,"|n"&R1C22&RC[-13])&IF(RC[-11]="",,"|n"&R1C24&RC[-11])&IF(RC[-10]="",,"|n"&R1C25&RC[-10])&IF(RC[-9]="",,"|n"&R1C26&RC[-9])&IF(RC[-8]="",,"|n"&R1C27&RC[-8])&IF(RC[-7]="",,"|n"&R1C28&RC[-7])&IF(RC[-6]="",,"|n"&R1C29&RC[-6])&IF(RC[-2]="",,"|n"&RC[-2]) -> 
AI1010: =IF(RC[-27]&RC[-26]&RC[-25]&RC[-24]&RC[-23]&RC[-22]="",,R1C7)&IF(RC[-27]="",,"|n"&R1C8&RC[-27])&IF(RC[-26]="",,"|n"&R1C9&RC[-26])&IF(RC[-25]="",,"|n"&R1C10&RC[-25])&IF(RC[-24]="",,"|n"&R1C11&RC[-24])&IF(RC[-23]="",,"|n"&R1C12&RC[-23])&IF(RC[-22]="",,"|n"&R1C13&RC[-22])&IF(RC[-20]&RC[-19]&RC[-18]&RC[-17]="",,"|n"&R1C14)&IF(RC[-20]="",,"|n"&R1C15&RC[-20])&IF(RC[-19]="",,"|n"&R1C16&RC[-19])&IF(RC[-18]="",,"|n"&R1C17&RC[-18])&IF(RC[-17]="",,"|n"&R1C18&RC[-17])&IF(RC[-16]="",,"|n"&R1C19&RC[-16])&IF(RC[-15]="",,"|n"&R1C20&RC[-15])&IF(RC[-14]="",,"|n"&R1C21&RC[-14])&IF(RC[-13]="",,"|n"&R1C22&RC[-13])&IF(RC[-11]="",,"|n"&R1C24&RC[-11])&IF(RC[-10]="",,"|n"&R1C25&RC[-10])&IF(RC[-9]="",,"|n"&R1C26&RC[-9])&IF(RC[-8]="",,"|n"&R1C27&RC[-8])&IF(RC[-7]="",,"|n"&R1C28&RC[-7])&IF(RC[-6]="",,"|n"&R1C29&RC[-6])&IF(RC[-2]="",,"|n"&RC[-2]) -> 
AI1011: =IF(RC[-27]&RC[-26]&RC[-25]&RC[-24]&RC[-23]&RC[-22]="",,R1C7)&IF(RC[-27]="",,"|n"&R1C8&RC[-27])&IF(RC[-26]="",,"|n"&R1C9&RC[-26])&IF(RC[-25]="",,"|n"&R1C10&RC[-25])&IF(RC[-24]="",,"|n"&R1C11&RC[-24])&IF(RC[-23]="",,"|n"&R1C12&RC[-23])&IF(RC[-22]="",,"|n"&R1C13&RC[-22])&IF(RC[-20]&RC[-19]&RC[-18]&RC[-17]="",,"|n"&R1C14)&IF(RC[-20]="",,"|n"&R1C15&RC[-20])&IF(RC[-19]="",,"|n"&R1C16&RC[-19])&IF(RC[-18]="",,"|n"&R1C17&RC[-18])&IF(RC[-17]="",,"|n"&R1C18&RC[-17])&IF(RC[-16]="",,"|n"&R1C19&RC[-16])&IF(RC[-15]="",,"|n"&R1C20&RC[-15])&IF(RC[-14]="",,"|n"&R1C21&RC[-14])&IF(RC[-13]="",,"|n"&R1C22&RC[-13])&IF(RC[-11]="",,"|n"&R1C24&RC[-11])&IF(RC[-10]="",,"|n"&R1C25&RC[-10])&IF(RC[-9]="",,"|n"&R1C26&RC[-9])&IF(RC[-8]="",,"|n"&R1C27&RC[-8])&IF(RC[-7]="",,"|n"&R1C28&RC[-7])&IF(RC[-6]="",,"|n"&R1C29&RC[-6])&IF(RC[-2]="",,"|n"&RC[-2]) -> 
AI1012: =IF(RC[-27]&RC[-26]&RC[-25]&RC[-24]&RC[-23]&RC[-22]="",,R1C7)&IF(RC[-27]="",,"|n"&R1C8&RC[-27])&IF(RC[-26]="",,"|n"&R1C9&RC[-26])&IF(RC[-25]="",,"|n"&R1C10&RC[-25])&IF(RC[-24]="",,"|n"&R1C11&RC[-24])&IF(RC[-23]="",,"|n"&R1C12&RC[-23])&IF(RC[-22]="",,"|n"&R1C13&RC[-22])&IF(RC[-20]&RC[-19]&RC[-18]&RC[-17]="",,"|n"&R1C14)&IF(RC[-20]="",,"|n"&R1C15&RC[-20])&IF(RC[-19]="",,"|n"&R1C16&RC[-19])&IF(RC[-18]="",,"|n"&R1C17&RC[-18])&IF(RC[-17]="",,"|n"&R1C18&RC[-17])&IF(RC[-16]="",,"|n"&R1C19&RC[-16])&IF(RC[-15]="",,"|n"&R1C20&RC[-15])&IF(RC[-14]="",,"|n"&R1C21&RC[-14])&IF(RC[-13]="",,"|n"&R1C22&RC[-13])&IF(RC[-11]="",,"|n"&R1C24&RC[-11])&IF(RC[-10]="",,"|n"&R1C25&RC[-10])&IF(RC[-9]="",,"|n"&R1C26&RC[-9])&IF(RC[-8]="",,"|n"&R1C27&RC[-8])&IF(RC[-7]="",,"|n"&R1C28&RC[-7])&IF(RC[-6]="",,"|n"&R1C29&RC[-6])&IF(RC[-2]="",,"|n"&RC[-2]) -> 
AI1013: =IF(RC[-27]&RC[-26]&RC[-25]&RC[-24]&RC[-23]&RC[-22]="",,R1C7)&IF(RC[-27]="",,"|n"&R1C8&RC[-27])&IF(RC[-26]="",,"|n"&R1C9&RC[-26])&IF(RC[-25]="",,"|n"&R1C10&RC[-25])&IF(RC[-24]="",,"|n"&R1C11&RC[-24])&IF(RC[-23]="",,"|n"&R1C12&RC[-23])&IF(RC[-22]="",,"|n"&R1C13&RC[-22])&IF(RC[-20]&RC[-19]&RC[-18]&RC[-17]="",,"|n"&R1C14)&IF(RC[-20]="",,"|n"&R1C15&RC[-20])&IF(RC[-19]="",,"|n"&R1C16&RC[-19])&IF(RC[-18]="",,"|n"&R1C17&RC[-18])&IF(RC[-17]="",,"|n"&R1C18&RC[-17])&IF(RC[-16]="",,"|n"&R1C19&RC[-16])&IF(RC[-15]="",,"|n"&R1C20&RC[-15])&IF(RC[-14]="",,"|n"&R1C21&RC[-14])&IF(RC[-13]="",,"|n"&R1C22&RC[-13])&IF(RC[-11]="",,"|n"&R1C24&RC[-11])&IF(RC[-10]="",,"|n"&R1C25&RC[-10])&IF(RC[-9]="",,"|n"&R1C26&RC[-9])&IF(RC[-8]="",,"|n"&R1C27&RC[-8])&IF(RC[-7]="",,"|n"&R1C28&RC[-7])&IF(RC[-6]="",,"|n"&R1C29&RC[-6])&IF(RC[-2]="",,"|n"&RC[-2]) -> 
AI1014: =IF(RC[-27]&RC[-26]&RC[-25]&RC[-24]&RC[-23]&RC[-22]="",,R1C7)&IF(RC[-27]="",,"|n"&R1C8&RC[-27])&IF(RC[-26]="",,"|n"&R1C9&RC[-26])&IF(RC[-25]="",,"|n"&R1C10&RC[-25])&IF(RC[-24]="",,"|n"&R1C11&RC[-24])&IF(RC[-23]="",,"|n"&R1C12&RC[-23])&IF(RC[-22]="",,"|n"&R1C13&RC[-22])&IF(RC[-20]&RC[-19]&RC[-18]&RC[-17]="",,"|n"&R1C14)&IF(RC[-20]="",,"|n"&R1C15&RC[-20])&IF(RC[-19]="",,"|n"&R1C16&RC[-19])&IF(RC[-18]="",,"|n"&R1C17&RC[-18])&IF(RC[-17]="",,"|n"&R1C18&RC[-17])&IF(RC[-16]="",,"|n"&R1C19&RC[-16])&IF(RC[-15]="",,"|n"&R1C20&RC[-15])&IF(RC[-14]="",,"|n"&R1C21&RC[-14])&IF(RC[-13]="",,"|n"&R1C22&RC[-13])&IF(RC[-11]="",,"|n"&R1C24&RC[-11])&IF(RC[-10]="",,"|n"&R1C25&RC[-10])&IF(RC[-9]="",,"|n"&R1C26&RC[-9])&IF(RC[-8]="",,"|n"&R1C27&RC[-8])&IF(RC[-7]="",,"|n"&R1C28&RC[-7])&IF(RC[-6]="",,"|n"&R1C29&RC[-6])&IF(RC[-2]="",,"|n"&RC[-2]) -> 
AI1015: =IF(RC[-27]&RC[-26]&RC[-25]&RC[-24]&RC[-23]&RC[-22]="",,R1C7)&IF(RC[-27]="",,"|n"&R1C8&RC[-27])&IF(RC[-26]="",,"|n"&R1C9&RC[-26])&IF(RC[-25]="",,"|n"&R1C10&RC[-25])&IF(RC[-24]="",,"|n"&R1C11&RC[-24])&IF(RC[-23]="",,"|n"&R1C12&RC[-23])&IF(RC[-22]="",,"|n"&R1C13&RC[-22])&IF(RC[-20]&RC[-19]&RC[-18]&RC[-17]="",,"|n"&R1C14)&IF(RC[-20]="",,"|n"&R1C15&RC[-20])&IF(RC[-19]="",,"|n"&R1C16&RC[-19])&IF(RC[-18]="",,"|n"&R1C17&RC[-18])&IF(RC[-17]="",,"|n"&R1C18&RC[-17])&IF(RC[-16]="",,"|n"&R1C19&RC[-16])&IF(RC[-15]="",,"|n"&R1C20&RC[-15])&IF(RC[-14]="",,"|n"&R1C21&RC[-14])&IF(RC[-13]="",,"|n"&R1C22&RC[-13])&IF(RC[-11]="",,"|n"&R1C24&RC[-11])&IF(RC[-10]="",,"|n"&R1C25&RC[-10])&IF(RC[-9]="",,"|n"&R1C26&RC[-9])&IF(RC[-8]="",,"|n"&R1C27&RC[-8])&IF(RC[-7]="",,"|n"&R1C28&RC[-7])&IF(RC[-6]="",,"|n"&R1C29&RC[-6])&IF(RC[-2]="",,"|n"&RC[-2]) -> 
AI1016: =IF(RC[-27]&RC[-26]&RC[-25]&RC[-24]&RC[-23]&RC[-22]="",,R1C7)&IF(RC[-27]="",,"|n"&R1C8&RC[-27])&IF(RC[-26]="",,"|n"&R1C9&RC[-26])&IF(RC[-25]="",,"|n"&R1C10&RC[-25])&IF(RC[-24]="",,"|n"&R1C11&RC[-24])&IF(RC[-23]="",,"|n"&R1C12&RC[-23])&IF(RC[-22]="",,"|n"&R1C13&RC[-22])&IF(RC[-20]&RC[-19]&RC[-18]&RC[-17]="",,"|n"&R1C14)&IF(RC[-20]="",,"|n"&R1C15&RC[-20])&IF(RC[-19]="",,"|n"&R1C16&RC[-19])&IF(RC[-18]="",,"|n"&R1C17&RC[-18])&IF(RC[-17]="",,"|n"&R1C18&RC[-17])&IF(RC[-16]="",,"|n"&R1C19&RC[-16])&IF(RC[-15]="",,"|n"&R1C20&RC[-15])&IF(RC[-14]="",,"|n"&R1C21&RC[-14])&IF(RC[-13]="",,"|n"&R1C22&RC[-13])&IF(RC[-11]="",,"|n"&R1C24&RC[-11])&IF(RC[-10]="",,"|n"&R1C25&RC[-10])&IF(RC[-9]="",,"|n"&R1C26&RC[-9])&IF(RC[-8]="",,"|n"&R1C27&RC[-8])&IF(RC[-7]="",,"|n"&R1C28&RC[-7])&IF(RC[-6]="",,"|n"&R1C29&RC[-6])&IF(RC[-2]="",,"|n"&RC[-2]) -> 
AI1017: =IF(RC[-27]&RC[-26]&RC[-25]&RC[-24]&RC[-23]&RC[-22]="",,R1C7)&IF(RC[-27]="",,"|n"&R1C8&RC[-27])&IF(RC[-26]="",,"|n"&R1C9&RC[-26])&IF(RC[-25]="",,"|n"&R1C10&RC[-25])&IF(RC[-24]="",,"|n"&R1C11&RC[-24])&IF(RC[-23]="",,"|n"&R1C12&RC[-23])&IF(RC[-22]="",,"|n"&R1C13&RC[-22])&IF(RC[-20]&RC[-19]&RC[-18]&RC[-17]="",,"|n"&R1C14)&IF(RC[-20]="",,"|n"&R1C15&RC[-20])&IF(RC[-19]="",,"|n"&R1C16&RC[-19])&IF(RC[-18]="",,"|n"&R1C17&RC[-18])&IF(RC[-17]="",,"|n"&R1C18&RC[-17])&IF(RC[-16]="",,"|n"&R1C19&RC[-16])&IF(RC[-15]="",,"|n"&R1C20&RC[-15])&IF(RC[-14]="",,"|n"&R1C21&RC[-14])&IF(RC[-13]="",,"|n"&R1C22&RC[-13])&IF(RC[-11]="",,"|n"&R1C24&RC[-11])&IF(RC[-10]="",,"|n"&R1C25&RC[-10])&IF(RC[-9]="",,"|n"&R1C26&RC[-9])&IF(RC[-8]="",,"|n"&R1C27&RC[-8])&IF(RC[-7]="",,"|n"&R1C28&RC[-7])&IF(RC[-6]="",,"|n"&R1C29&RC[-6])&IF(RC[-2]="",,"|n"&RC[-2]) -> 
AI1018: =IF(RC[-27]&RC[-26]&RC[-25]&RC[-24]&RC[-23]&RC[-22]="",,R1C7)&IF(RC[-27]="",,"|n"&R1C8&RC[-27])&IF(RC[-26]="",,"|n"&R1C9&RC[-26])&IF(RC[-25]="",,"|n"&R1C10&RC[-25])&IF(RC[-24]="",,"|n"&R1C11&RC[-24])&IF(RC[-23]="",,"|n"&R1C12&RC[-23])&IF(RC[-22]="",,"|n"&R1C13&RC[-22])&IF(RC[-20]&RC[-19]&RC[-18]&RC[-17]="",,"|n"&R1C14)&IF(RC[-20]="",,"|n"&R1C15&RC[-20])&IF(RC[-19]="",,"|n"&R1C16&RC[-19])&IF(RC[-18]="",,"|n"&R1C17&RC[-18])&IF(RC[-17]="",,"|n"&R1C18&RC[-17])&IF(RC[-16]="",,"|n"&R1C19&RC[-16])&IF(RC[-15]="",,"|n"&R1C20&RC[-15])&IF(RC[-14]="",,"|n"&R1C21&RC[-14])&IF(RC[-13]="",,"|n"&R1C22&RC[-13])&IF(RC[-11]="",,"|n"&R1C24&RC[-11])&IF(RC[-10]="",,"|n"&R1C25&RC[-10])&IF(RC[-9]="",,"|n"&R1C26&RC[-9])&IF(RC[-8]="",,"|n"&R1C27&RC[-8])&IF(RC[-7]="",,"|n"&R1C28&RC[-7])&IF(RC[-6]="",,"|n"&R1C29&RC[-6])&IF(RC[-2]="",,"|n"&RC[-2]) -> 
AI1019: =IF(RC[-27]&RC[-26]&RC[-25]&RC[-24]&RC[-23]&RC[-22]="",,R1C7)&IF(RC[-27]="",,"|n"&R1C8&RC[-27])&IF(RC[-26]="",,"|n"&R1C9&RC[-26])&IF(RC[-25]="",,"|n"&R1C10&RC[-25])&IF(RC[-24]="",,"|n"&R1C11&RC[-24])&IF(RC[-23]="",,"|n"&R1C12&RC[-23])&IF(RC[-22]="",,"|n"&R1C13&RC[-22])&IF(RC[-20]&RC[-19]&RC[-18]&RC[-17]="",,"|n"&R1C14)&IF(RC[-20]="",,"|n"&R1C15&RC[-20])&IF(RC[-19]="",,"|n"&R1C16&RC[-19])&IF(RC[-18]="",,"|n"&R1C17&RC[-18])&IF(RC[-17]="",,"|n"&R1C18&RC[-17])&IF(RC[-16]="",,"|n"&R1C19&RC[-16])&IF(RC[-15]="",,"|n"&R1C20&RC[-15])&IF(RC[-14]="",,"|n"&R1C21&RC[-14])&IF(RC[-13]="",,"|n"&R1C22&RC[-13])&IF(RC[-11]="",,"|n"&R1C24&RC[-11])&IF(RC[-10]="",,"|n"&R1C25&RC[-10])&IF(RC[-9]="",,"|n"&R1C26&RC[-9])&IF(RC[-8]="",,"|n"&R1C27&RC[-8])&IF(RC[-7]="",,"|n"&R1C28&RC[-7])&IF(RC[-6]="",,"|n"&R1C29&RC[-6])&IF(RC[-2]="",,"|n"&RC[-2]) -> 
AI1020: =IF(RC[-27]&RC[-26]&RC[-25]&RC[-24]&RC[-23]&RC[-22]="",,R1C7)&IF(RC[-27]="",,"|n"&R1C8&RC[-27])&IF(RC[-26]="",,"|n"&R1C9&RC[-26])&IF(RC[-25]="",,"|n"&R1C10&RC[-25])&IF(RC[-24]="",,"|n"&R1C11&RC[-24])&IF(RC[-23]="",,"|n"&R1C12&RC[-23])&IF(RC[-22]="",,"|n"&R1C13&RC[-22])&IF(RC[-20]&RC[-19]&RC[-18]&RC[-17]="",,"|n"&R1C14)&IF(RC[-20]="",,"|n"&R1C15&RC[-20])&IF(RC[-19]="",,"|n"&R1C16&RC[-19])&IF(RC[-18]="",,"|n"&R1C17&RC[-18])&IF(RC[-17]="",,"|n"&R1C18&RC[-17])&IF(RC[-16]="",,"|n"&R1C19&RC[-16])&IF(RC[-15]="",,"|n"&R1C20&RC[-15])&IF(RC[-14]="",,"|n"&R1C21&RC[-14])&IF(RC[-13]="",,"|n"&R1C22&RC[-13])&IF(RC[-11]="",,"|n"&R1C24&RC[-11])&IF(RC[-10]="",,"|n"&R1C25&RC[-10])&IF(RC[-9]="",,"|n"&R1C26&RC[-9])&IF(RC[-8]="",,"|n"&R1C27&RC[-8])&IF(RC[-7]="",,"|n"&R1C28&RC[-7])&IF(RC[-6]="",,"|n"&R1C29&RC[-6])&IF(RC[-2]="",,"|n"&RC[-2]) -> 
AI1021: =IF(RC[-27]&RC[-26]&RC[-25]&RC[-24]&RC[-23]&RC[-22]="",,R1C7)&IF(RC[-27]="",,"|n"&R1C8&RC[-27])&IF(RC[-26]="",,"|n"&R1C9&RC[-26])&IF(RC[-25]="",,"|n"&R1C10&RC[-25])&IF(RC[-24]="",,"|n"&R1C11&RC[-24])&IF(RC[-23]="",,"|n"&R1C12&RC[-23])&IF(RC[-22]="",,"|n"&R1C13&RC[-22])&IF(RC[-20]&RC[-19]&RC[-18]&RC[-17]="",,"|n"&R1C14)&IF(RC[-20]="",,"|n"&R1C15&RC[-20])&IF(RC[-19]="",,"|n"&R1C16&RC[-19])&IF(RC[-18]="",,"|n"&R1C17&RC[-18])&IF(RC[-17]="",,"|n"&R1C18&RC[-17])&IF(RC[-16]="",,"|n"&R1C19&RC[-16])&IF(RC[-15]="",,"|n"&R1C20&RC[-15])&IF(RC[-14]="",,"|n"&R1C21&RC[-14])&IF(RC[-13]="",,"|n"&R1C22&RC[-13])&IF(RC[-11]="",,"|n"&R1C24&RC[-11])&IF(RC[-10]="",,"|n"&R1C25&RC[-10])&IF(RC[-9]="",,"|n"&R1C26&RC[-9])&IF(RC[-8]="",,"|n"&R1C27&RC[-8])&IF(RC[-7]="",,"|n"&R1C28&RC[-7])&IF(RC[-6]="",,"|n"&R1C29&RC[-6])&IF(RC[-2]="",,"|n"&RC[-2]) -> 
AI1022: =IF(RC[-27]&RC[-26]&RC[-25]&RC[-24]&RC[-23]&RC[-22]="",,R1C7)&IF(RC[-27]="",,"|n"&R1C8&RC[-27])&IF(RC[-26]="",,"|n"&R1C9&RC[-26])&IF(RC[-25]="",,"|n"&R1C10&RC[-25])&IF(RC[-24]="",,"|n"&R1C11&RC[-24])&IF(RC[-23]="",,"|n"&R1C12&RC[-23])&IF(RC[-22]="",,"|n"&R1C13&RC[-22])&IF(RC[-20]&RC[-19]&RC[-18]&RC[-17]="",,"|n"&R1C14)&IF(RC[-20]="",,"|n"&R1C15&RC[-20])&IF(RC[-19]="",,"|n"&R1C16&RC[-19])&IF(RC[-18]="",,"|n"&R1C17&RC[-18])&IF(RC[-17]="",,"|n"&R1C18&RC[-17])&IF(RC[-16]="",,"|n"&R1C19&RC[-16])&IF(RC[-15]="",,"|n"&R1C20&RC[-15])&IF(RC[-14]="",,"|n"&R1C21&RC[-14])&IF(RC[-13]="",,"|n"&R1C22&RC[-13])&IF(RC[-11]="",,"|n"&R1C24&RC[-11])&IF(RC[-10]="",,"|n"&R1C25&RC[-10])&IF(RC[-9]="",,"|n"&R1C26&RC[-9])&IF(RC[-8]="",,"|n"&R1C27&RC[-8])&IF(RC[-7]="",,"|n"&R1C28&RC[-7])&IF(RC[-6]="",,"|n"&R1C29&RC[-6])&IF(RC[-2]="",,"|n"&RC[-2]) -> 
AI1023: =IF(RC[-27]&RC[-26]&RC[-25]&RC[-24]&RC[-23]&RC[-22]="",,R1C7)&IF(RC[-27]="",,"|n"&R1C8&RC[-27])&IF(RC[-26]="",,"|n"&R1C9&RC[-26])&IF(RC[-25]="",,"|n"&R1C10&RC[-25])&IF(RC[-24]="",,"|n"&R1C11&RC[-24])&IF(RC[-23]="",,"|n"&R1C12&RC[-23])&IF(RC[-22]="",,"|n"&R1C13&RC[-22])&IF(RC[-20]&RC[-19]&RC[-18]&RC[-17]="",,"|n"&R1C14)&IF(RC[-20]="",,"|n"&R1C15&RC[-20])&IF(RC[-19]="",,"|n"&R1C16&RC[-19])&IF(RC[-18]="",,"|n"&R1C17&RC[-18])&IF(RC[-17]="",,"|n"&R1C18&RC[-17])&IF(RC[-16]="",,"|n"&R1C19&RC[-16])&IF(RC[-15]="",,"|n"&R1C20&RC[-15])&IF(RC[-14]="",,"|n"&R1C21&RC[-14])&IF(RC[-13]="",,"|n"&R1C22&RC[-13])&IF(RC[-11]="",,"|n"&R1C24&RC[-11])&IF(RC[-10]="",,"|n"&R1C25&RC[-10])&IF(RC[-9]="",,"|n"&R1C26&RC[-9])&IF(RC[-8]="",,"|n"&R1C27&RC[-8])&IF(RC[-7]="",,"|n"&R1C28&RC[-7])&IF(RC[-6]="",,"|n"&R1C29&RC[-6])&IF(RC[-2]="",,"|n"&RC[-2]) -> 
AI1024: =IF(RC[-27]&RC[-26]&RC[-25]&RC[-24]&RC[-23]&RC[-22]="",,R1C7)&IF(RC[-27]="",,"|n"&R1C8&RC[-27])&IF(RC[-26]="",,"|n"&R1C9&RC[-26])&IF(RC[-25]="",,"|n"&R1C10&RC[-25])&IF(RC[-24]="",,"|n"&R1C11&RC[-24])&IF(RC[-23]="",,"|n"&R1C12&RC[-23])&IF(RC[-22]="",,"|n"&R1C13&RC[-22])&IF(RC[-20]&RC[-19]&RC[-18]&RC[-17]="",,"|n"&R1C14)&IF(RC[-20]="",,"|n"&R1C15&RC[-20])&IF(RC[-19]="",,"|n"&R1C16&RC[-19])&IF(RC[-18]="",,"|n"&R1C17&RC[-18])&IF(RC[-17]="",,"|n"&R1C18&RC[-17])&IF(RC[-16]="",,"|n"&R1C19&RC[-16])&IF(RC[-15]="",,"|n"&R1C20&RC[-15])&IF(RC[-14]="",,"|n"&R1C21&RC[-14])&IF(RC[-13]="",,"|n"&R1C22&RC[-13])&IF(RC[-11]="",,"|n"&R1C24&RC[-11])&IF(RC[-10]="",,"|n"&R1C25&RC[-10])&IF(RC[-9]="",,"|n"&R1C26&RC[-9])&IF(RC[-8]="",,"|n"&R1C27&RC[-8])&IF(RC[-7]="",,"|n"&R1C28&RC[-7])&IF(RC[-6]="",,"|n"&R1C29&RC[-6])&IF(RC[-2]="",,"|n"&RC[-2]) -> 
AI1025: =IF(RC[-27]&RC[-26]&RC[-25]&RC[-24]&RC[-23]&RC[-22]="",,R1C7)&IF(RC[-27]="",,"|n"&R1C8&RC[-27])&IF(RC[-26]="",,"|n"&R1C9&RC[-26])&IF(RC[-25]="",,"|n"&R1C10&RC[-25])&IF(RC[-24]="",,"|n"&R1C11&RC[-24])&IF(RC[-23]="",,"|n"&R1C12&RC[-23])&IF(RC[-22]="",,"|n"&R1C13&RC[-22])&IF(RC[-20]&RC[-19]&RC[-18]&RC[-17]="",,"|n"&R1C14)&IF(RC[-20]="",,"|n"&R1C15&RC[-20])&IF(RC[-19]="",,"|n"&R1C16&RC[-19])&IF(RC[-18]="",,"|n"&R1C17&RC[-18])&IF(RC[-17]="",,"|n"&R1C18&RC[-17])&IF(RC[-16]="",,"|n"&R1C19&RC[-16])&IF(RC[-15]="",,"|n"&R1C20&RC[-15])&IF(RC[-14]="",,"|n"&R1C21&RC[-14])&IF(RC[-13]="",,"|n"&R1C22&RC[-13])&IF(RC[-11]="",,"|n"&R1C24&RC[-11])&IF(RC[-10]="",,"|n"&R1C25&RC[-10])&IF(RC[-9]="",,"|n"&R1C26&RC[-9])&IF(RC[-8]="",,"|n"&R1C27&RC[-8])&IF(RC[-7]="",,"|n"&R1C28&RC[-7])&IF(RC[-6]="",,"|n"&R1C29&RC[-6])&IF(RC[-2]="",,"|n"&RC[-2]) -> 
AI1026: =IF(RC[-27]&RC[-26]&RC[-25]&RC[-24]&RC[-23]&RC[-22]="",,R1C7)&IF(RC[-27]="",,"|n"&R1C8&RC[-27])&IF(RC[-26]="",,"|n"&R1C9&RC[-26])&IF(RC[-25]="",,"|n"&R1C10&RC[-25])&IF(RC[-24]="",,"|n"&R1C11&RC[-24])&IF(RC[-23]="",,"|n"&R1C12&RC[-23])&IF(RC[-22]="",,"|n"&R1C13&RC[-22])&IF(RC[-20]&RC[-19]&RC[-18]&RC[-17]="",,"|n"&R1C14)&IF(RC[-20]="",,"|n"&R1C15&RC[-20])&IF(RC[-19]="",,"|n"&R1C16&RC[-19])&IF(RC[-18]="",,"|n"&R1C17&RC[-18])&IF(RC[-17]="",,"|n"&R1C18&RC[-17])&IF(RC[-16]="",,"|n"&R1C19&RC[-16])&IF(RC[-15]="",,"|n"&R1C20&RC[-15])&IF(RC[-14]="",,"|n"&R1C21&RC[-14])&IF(RC[-13]="",,"|n"&R1C22&RC[-13])&IF(RC[-11]="",,"|n"&R1C24&RC[-11])&IF(RC[-10]="",,"|n"&R1C25&RC[-10])&IF(RC[-9]="",,"|n"&R1C26&RC[-9])&IF(RC[-8]="",,"|n"&R1C27&RC[-8])&IF(RC[-7]="",,"|n"&R1C28&RC[-7])&IF(RC[-6]="",,"|n"&R1C29&RC[-6])&IF(RC[-2]="",,"|n"&RC[-2]) -> 
AI1027: =IF(RC[-27]&RC[-26]&RC[-25]&RC[-24]&RC[-23]&RC[-22]="",,R1C7)&IF(RC[-27]="",,"|n"&R1C8&RC[-27])&IF(RC[-26]="",,"|n"&R1C9&RC[-26])&IF(RC[-25]="",,"|n"&R1C10&RC[-25])&IF(RC[-24]="",,"|n"&R1C11&RC[-24])&IF(RC[-23]="",,"|n"&R1C12&RC[-23])&IF(RC[-22]="",,"|n"&R1C13&RC[-22])&IF(RC[-20]&RC[-19]&RC[-18]&RC[-17]="",,"|n"&R1C14)&IF(RC[-20]="",,"|n"&R1C15&RC[-20])&IF(RC[-19]="",,"|n"&R1C16&RC[-19])&IF(RC[-18]="",,"|n"&R1C17&RC[-18])&IF(RC[-17]="",,"|n"&R1C18&RC[-17])&IF(RC[-16]="",,"|n"&R1C19&RC[-16])&IF(RC[-15]="",,"|n"&R1C20&RC[-15])&IF(RC[-14]="",,"|n"&R1C21&RC[-14])&IF(RC[-13]="",,"|n"&R1C22&RC[-13])&IF(RC[-11]="",,"|n"&R1C24&RC[-11])&IF(RC[-10]="",,"|n"&R1C25&RC[-10])&IF(RC[-9]="",,"|n"&R1C26&RC[-9])&IF(RC[-8]="",,"|n"&R1C27&RC[-8])&IF(RC[-7]="",,"|n"&R1C28&RC[-7])&IF(RC[-6]="",,"|n"&R1C29&RC[-6])&IF(RC[-2]="",,"|n"&RC[-2]) -> 
AI1028: =IF(RC[-27]&RC[-26]&RC[-25]&RC[-24]&RC[-23]&RC[-22]="",,R1C7)&IF(RC[-27]="",,"|n"&R1C8&RC[-27])&IF(RC[-26]="",,"|n"&R1C9&RC[-26])&IF(RC[-25]="",,"|n"&R1C10&RC[-25])&IF(RC[-24]="",,"|n"&R1C11&RC[-24])&IF(RC[-23]="",,"|n"&R1C12&RC[-23])&IF(RC[-22]="",,"|n"&R1C13&RC[-22])&IF(RC[-20]&RC[-19]&RC[-18]&RC[-17]="",,"|n"&R1C14)&IF(RC[-20]="",,"|n"&R1C15&RC[-20])&IF(RC[-19]="",,"|n"&R1C16&RC[-19])&IF(RC[-18]="",,"|n"&R1C17&RC[-18])&IF(RC[-17]="",,"|n"&R1C18&RC[-17])&IF(RC[-16]="",,"|n"&R1C19&RC[-16])&IF(RC[-15]="",,"|n"&R1C20&RC[-15])&IF(RC[-14]="",,"|n"&R1C21&RC[-14])&IF(RC[-13]="",,"|n"&R1C22&RC[-13])&IF(RC[-11]="",,"|n"&R1C24&RC[-11])&IF(RC[-10]="",,"|n"&R1C25&RC[-10])&IF(RC[-9]="",,"|n"&R1C26&RC[-9])&IF(RC[-8]="",,"|n"&R1C27&RC[-8])&IF(RC[-7]="",,"|n"&R1C28&RC[-7])&IF(RC[-6]="",,"|n"&R1C29&RC[-6])&IF(RC[-2]="",,"|n"&RC[-2]) -> 
AI1029: =IF(RC[-27]&RC[-26]&RC[-25]&RC[-24]&RC[-23]&RC[-22]="",,R1C7)&IF(RC[-27]="",,"|n"&R1C8&RC[-27])&IF(RC[-26]="",,"|n"&R1C9&RC[-26])&IF(RC[-25]="",,"|n"&R1C10&RC[-25])&IF(RC[-24]="",,"|n"&R1C11&RC[-24])&IF(RC[-23]="",,"|n"&R1C12&RC[-23])&IF(RC[-22]="",,"|n"&R1C13&RC[-22])&IF(RC[-20]&RC[-19]&RC[-18]&RC[-17]="",,"|n"&R1C14)&IF(RC[-20]="",,"|n"&R1C15&RC[-20])&IF(RC[-19]="",,"|n"&R1C16&RC[-19])&IF(RC[-18]="",,"|n"&R1C17&RC[-18])&IF(RC[-17]="",,"|n"&R1C18&RC[-17])&IF(RC[-16]="",,"|n"&R1C19&RC[-16])&IF(RC[-15]="",,"|n"&R1C20&RC[-15])&IF(RC[-14]="",,"|n"&R1C21&RC[-14])&IF(RC[-13]="",,"|n"&R1C22&RC[-13])&IF(RC[-11]="",,"|n"&R1C24&RC[-11])&IF(RC[-10]="",,"|n"&R1C25&RC[-10])&IF(RC[-9]="",,"|n"&R1C26&RC[-9])&IF(RC[-8]="",,"|n"&R1C27&RC[-8])&IF(RC[-7]="",,"|n"&R1C28&RC[-7])&IF(RC[-6]="",,"|n"&R1C29&RC[-6])&IF(RC[-2]="",,"|n"&RC[-2]) -> 
AI1030: =IF(RC[-27]&RC[-26]&RC[-25]&RC[-24]&RC[-23]&RC[-22]="",,R1C7)&IF(RC[-27]="",,"|n"&R1C8&RC[-27])&IF(RC[-26]="",,"|n"&R1C9&RC[-26])&IF(RC[-25]="",,"|n"&R1C10&RC[-25])&IF(RC[-24]="",,"|n"&R1C11&RC[-24])&IF(RC[-23]="",,"|n"&R1C12&RC[-23])&IF(RC[-22]="",,"|n"&R1C13&RC[-22])&IF(RC[-20]&RC[-19]&RC[-18]&RC[-17]="",,"|n"&R1C14)&IF(RC[-20]="",,"|n"&R1C15&RC[-20])&IF(RC[-19]="",,"|n"&R1C16&RC[-19])&IF(RC[-18]="",,"|n"&R1C17&RC[-18])&IF(RC[-17]="",,"|n"&R1C18&RC[-17])&IF(RC[-16]="",,"|n"&R1C19&RC[-16])&IF(RC[-15]="",,"|n"&R1C20&RC[-15])&IF(RC[-14]="",,"|n"&R1C21&RC[-14])&IF(RC[-13]="",,"|n"&R1C22&RC[-13])&IF(RC[-11]="",,"|n"&R1C24&RC[-11])&IF(RC[-10]="",,"|n"&R1C25&RC[-10])&IF(RC[-9]="",,"|n"&R1C26&RC[-9])&IF(RC[-8]="",,"|n"&R1C27&RC[-8])&IF(RC[-7]="",,"|n"&R1C28&RC[-7])&IF(RC[-6]="",,"|n"&R1C29&RC[-6])&IF(RC[-2]="",,"|n"&RC[-2]) -> 
AI1031: =IF(RC[-27]&RC[-26]&RC[-25]&RC[-24]&RC[-23]&RC[-22]="",,R1C7)&IF(RC[-27]="",,"|n"&R1C8&RC[-27])&IF(RC[-26]="",,"|n"&R1C9&RC[-26])&IF(RC[-25]="",,"|n"&R1C10&RC[-25])&IF(RC[-24]="",,"|n"&R1C11&RC[-24])&IF(RC[-23]="",,"|n"&R1C12&RC[-23])&IF(RC[-22]="",,"|n"&R1C13&RC[-22])&IF(RC[-20]&RC[-19]&RC[-18]&RC[-17]="",,"|n"&R1C14)&IF(RC[-20]="",,"|n"&R1C15&RC[-20])&IF(RC[-19]="",,"|n"&R1C16&RC[-19])&IF(RC[-18]="",,"|n"&R1C17&RC[-18])&IF(RC[-17]="",,"|n"&R1C18&RC[-17])&IF(RC[-16]="",,"|n"&R1C19&RC[-16])&IF(RC[-15]="",,"|n"&R1C20&RC[-15])&IF(RC[-14]="",,"|n"&R1C21&RC[-14])&IF(RC[-13]="",,"|n"&R1C22&RC[-13])&IF(RC[-11]="",,"|n"&R1C24&RC[-11])&IF(RC[-10]="",,"|n"&R1C25&RC[-10])&IF(RC[-9]="",,"|n"&R1C26&RC[-9])&IF(RC[-8]="",,"|n"&R1C27&RC[-8])&IF(RC[-7]="",,"|n"&R1C28&RC[-7])&IF(RC[-6]="",,"|n"&R1C29&RC[-6])&IF(RC[-2]="",,"|n"&RC[-2]) -> 
AI1032: =IF(RC[-27]&RC[-26]&RC[-25]&RC[-24]&RC[-23]&RC[-22]="",,R1C7)&IF(RC[-27]="",,"|n"&R1C8&RC[-27])&IF(RC[-26]="",,"|n"&R1C9&RC[-26])&IF(RC[-25]="",,"|n"&R1C10&RC[-25])&IF(RC[-24]="",,"|n"&R1C11&RC[-24])&IF(RC[-23]="",,"|n"&R1C12&RC[-23])&IF(RC[-22]="",,"|n"&R1C13&RC[-22])&IF(RC[-20]&RC[-19]&RC[-18]&RC[-17]="",,"|n"&R1C14)&IF(RC[-20]="",,"|n"&R1C15&RC[-20])&IF(RC[-19]="",,"|n"&R1C16&RC[-19])&IF(RC[-18]="",,"|n"&R1C17&RC[-18])&IF(RC[-17]="",,"|n"&R1C18&RC[-17])&IF(RC[-16]="",,"|n"&R1C19&RC[-16])&IF(RC[-15]="",,"|n"&R1C20&RC[-15])&IF(RC[-14]="",,"|n"&R1C21&RC[-14])&IF(RC[-13]="",,"|n"&R1C22&RC[-13])&IF(RC[-11]="",,"|n"&R1C24&RC[-11])&IF(RC[-10]="",,"|n"&R1C25&RC[-10])&IF(RC[-9]="",,"|n"&R1C26&RC[-9])&IF(RC[-8]="",,"|n"&R1C27&RC[-8])&IF(RC[-7]="",,"|n"&R1C28&RC[-7])&IF(RC[-6]="",,"|n"&R1C29&RC[-6])&IF(RC[-2]="",,"|n"&RC[-2]) -> 
AI1033: =IF(RC[-27]&RC[-26]&RC[-25]&RC[-24]&RC[-23]&RC[-22]="",,R1C7)&IF(RC[-27]="",,"|n"&R1C8&RC[-27])&IF(RC[-26]="",,"|n"&R1C9&RC[-26])&IF(RC[-25]="",,"|n"&R1C10&RC[-25])&IF(RC[-24]="",,"|n"&R1C11&RC[-24])&IF(RC[-23]="",,"|n"&R1C12&RC[-23])&IF(RC[-22]="",,"|n"&R1C13&RC[-22])&IF(RC[-20]&RC[-19]&RC[-18]&RC[-17]="",,"|n"&R1C14)&IF(RC[-20]="",,"|n"&R1C15&RC[-20])&IF(RC[-19]="",,"|n"&R1C16&RC[-19])&IF(RC[-18]="",,"|n"&R1C17&RC[-18])&IF(RC[-17]="",,"|n"&R1C18&RC[-17])&IF(RC[-16]="",,"|n"&R1C19&RC[-16])&IF(RC[-15]="",,"|n"&R1C20&RC[-15])&IF(RC[-14]="",,"|n"&R1C21&RC[-14])&IF(RC[-13]="",,"|n"&R1C22&RC[-13])&IF(RC[-11]="",,"|n"&R1C24&RC[-11])&IF(RC[-10]="",,"|n"&R1C25&RC[-10])&IF(RC[-9]="",,"|n"&R1C26&RC[-9])&IF(RC[-8]="",,"|n"&R1C27&RC[-8])&IF(RC[-7]="",,"|n"&R1C28&RC[-7])&IF(RC[-6]="",,"|n"&R1C29&RC[-6])&IF(RC[-2]="",,"|n"&RC[-2]) -> 
AI1034: =IF(RC[-27]&RC[-26]&RC[-25]&RC[-24]&RC[-23]&RC[-22]="",,R1C7)&IF(RC[-27]="",,"|n"&R1C8&RC[-27])&IF(RC[-26]="",,"|n"&R1C9&RC[-26])&IF(RC[-25]="",,"|n"&R1C10&RC[-25])&IF(RC[-24]="",,"|n"&R1C11&RC[-24])&IF(RC[-23]="",,"|n"&R1C12&RC[-23])&IF(RC[-22]="",,"|n"&R1C13&RC[-22])&IF(RC[-20]&RC[-19]&RC[-18]&RC[-17]="",,"|n"&R1C14)&IF(RC[-20]="",,"|n"&R1C15&RC[-20])&IF(RC[-19]="",,"|n"&R1C16&RC[-19])&IF(RC[-18]="",,"|n"&R1C17&RC[-18])&IF(RC[-17]="",,"|n"&R1C18&RC[-17])&IF(RC[-16]="",,"|n"&R1C19&RC[-16])&IF(RC[-15]="",,"|n"&R1C20&RC[-15])&IF(RC[-14]="",,"|n"&R1C21&RC[-14])&IF(RC[-13]="",,"|n"&R1C22&RC[-13])&IF(RC[-11]="",,"|n"&R1C24&RC[-11])&IF(RC[-10]="",,"|n"&R1C25&RC[-10])&IF(RC[-9]="",,"|n"&R1C26&RC[-9])&IF(RC[-8]="",,"|n"&R1C27&RC[-8])&IF(RC[-7]="",,"|n"&R1C28&RC[-7])&IF(RC[-6]="",,"|n"&R1C29&RC[-6])&IF(RC[-2]="",,"|n"&RC[-2]) -> 
AI1035: =IF(RC[-27]&RC[-26]&RC[-25]&RC[-24]&RC[-23]&RC[-22]="",,R1C7)&IF(RC[-27]="",,"|n"&R1C8&RC[-27])&IF(RC[-26]="",,"|n"&R1C9&RC[-26])&IF(RC[-25]="",,"|n"&R1C10&RC[-25])&IF(RC[-24]="",,"|n"&R1C11&RC[-24])&IF(RC[-23]="",,"|n"&R1C12&RC[-23])&IF(RC[-22]="",,"|n"&R1C13&RC[-22])&IF(RC[-20]&RC[-19]&RC[-18]&RC[-17]="",,"|n"&R1C14)&IF(RC[-20]="",,"|n"&R1C15&RC[-20])&IF(RC[-19]="",,"|n"&R1C16&RC[-19])&IF(RC[-18]="",,"|n"&R1C17&RC[-18])&IF(RC[-17]="",,"|n"&R1C18&RC[-17])&IF(RC[-16]="",,"|n"&R1C19&RC[-16])&IF(RC[-15]="",,"|n"&R1C20&RC[-15])&IF(RC[-14]="",,"|n"&R1C21&RC[-14])&IF(RC[-13]="",,"|n"&R1C22&RC[-13])&IF(RC[-11]="",,"|n"&R1C24&RC[-11])&IF(RC[-10]="",,"|n"&R1C25&RC[-10])&IF(RC[-9]="",,"|n"&R1C26&RC[-9])&IF(RC[-8]="",,"|n"&R1C27&RC[-8])&IF(RC[-7]="",,"|n"&R1C28&RC[-7])&IF(RC[-6]="",,"|n"&R1C29&RC[-6])&IF(RC[-2]="",,"|n"&RC[-2]) -> 
AI1036: =IF(RC[-27]&RC[-26]&RC[-25]&RC[-24]&RC[-23]&RC[-22]="",,R1C7)&IF(RC[-27]="",,"|n"&R1C8&RC[-27])&IF(RC[-26]="",,"|n"&R1C9&RC[-26])&IF(RC[-25]="",,"|n"&R1C10&RC[-25])&IF(RC[-24]="",,"|n"&R1C11&RC[-24])&IF(RC[-23]="",,"|n"&R1C12&RC[-23])&IF(RC[-22]="",,"|n"&R1C13&RC[-22])&IF(RC[-20]&RC[-19]&RC[-18]&RC[-17]="",,"|n"&R1C14)&IF(RC[-20]="",,"|n"&R1C15&RC[-20])&IF(RC[-19]="",,"|n"&R1C16&RC[-19])&IF(RC[-18]="",,"|n"&R1C17&RC[-18])&IF(RC[-17]="",,"|n"&R1C18&RC[-17])&IF(RC[-16]="",,"|n"&R1C19&RC[-16])&IF(RC[-15]="",,"|n"&R1C20&RC[-15])&IF(RC[-14]="",,"|n"&R1C21&RC[-14])&IF(RC[-13]="",,"|n"&R1C22&RC[-13])&IF(RC[-11]="",,"|n"&R1C24&RC[-11])&IF(RC[-10]="",,"|n"&R1C25&RC[-10])&IF(RC[-9]="",,"|n"&R1C26&RC[-9])&IF(RC[-8]="",,"|n"&R1C27&RC[-8])&IF(RC[-7]="",,"|n"&R1C28&RC[-7])&IF(RC[-6]="",,"|n"&R1C29&RC[-6])&IF(RC[-2]="",,"|n"&RC[-2]) -> 
AI1037: =IF(RC[-27]&RC[-26]&RC[-25]&RC[-24]&RC[-23]&RC[-22]="",,R1C7)&IF(RC[-27]="",,"|n"&R1C8&RC[-27])&IF(RC[-26]="",,"|n"&R1C9&RC[-26])&IF(RC[-25]="",,"|n"&R1C10&RC[-25])&IF(RC[-24]="",,"|n"&R1C11&RC[-24])&IF(RC[-23]="",,"|n"&R1C12&RC[-23])&IF(RC[-22]="",,"|n"&R1C13&RC[-22])&IF(RC[-20]&RC[-19]&RC[-18]&RC[-17]="",,"|n"&R1C14)&IF(RC[-20]="",,"|n"&R1C15&RC[-20])&IF(RC[-19]="",,"|n"&R1C16&RC[-19])&IF(RC[-18]="",,"|n"&R1C17&RC[-18])&IF(RC[-17]="",,"|n"&R1C18&RC[-17])&IF(RC[-16]="",,"|n"&R1C19&RC[-16])&IF(RC[-15]="",,"|n"&R1C20&RC[-15])&IF(RC[-14]="",,"|n"&R1C21&RC[-14])&IF(RC[-13]="",,"|n"&R1C22&RC[-13])&IF(RC[-11]="",,"|n"&R1C24&RC[-11])&IF(RC[-10]="",,"|n"&R1C25&RC[-10])&IF(RC[-9]="",,"|n"&R1C26&RC[-9])&IF(RC[-8]="",,"|n"&R1C27&RC[-8])&IF(RC[-7]="",,"|n"&R1C28&RC[-7])&IF(RC[-6]="",,"|n"&R1C29&RC[-6])&IF(RC[-2]="",,"|n"&RC[-2]) -> 
AI1038: =IF(RC[-27]&RC[-26]&RC[-25]&RC[-24]&RC[-23]&RC[-22]="",,R1C7)&IF(RC[-27]="",,"|n"&R1C8&RC[-27])&IF(RC[-26]="",,"|n"&R1C9&RC[-26])&IF(RC[-25]="",,"|n"&R1C10&RC[-25])&IF(RC[-24]="",,"|n"&R1C11&RC[-24])&IF(RC[-23]="",,"|n"&R1C12&RC[-23])&IF(RC[-22]="",,"|n"&R1C13&RC[-22])&IF(RC[-20]&RC[-19]&RC[-18]&RC[-17]="",,"|n"&R1C14)&IF(RC[-20]="",,"|n"&R1C15&RC[-20])&IF(RC[-19]="",,"|n"&R1C16&RC[-19])&IF(RC[-18]="",,"|n"&R1C17&RC[-18])&IF(RC[-17]="",,"|n"&R1C18&RC[-17])&IF(RC[-16]="",,"|n"&R1C19&RC[-16])&IF(RC[-15]="",,"|n"&R1C20&RC[-15])&IF(RC[-14]="",,"|n"&R1C21&RC[-14])&IF(RC[-13]="",,"|n"&R1C22&RC[-13])&IF(RC[-11]="",,"|n"&R1C24&RC[-11])&IF(RC[-10]="",,"|n"&R1C25&RC[-10])&IF(RC[-9]="",,"|n"&R1C26&RC[-9])&IF(RC[-8]="",,"|n"&R1C27&RC[-8])&IF(RC[-7]="",,"|n"&R1C28&RC[-7])&IF(RC[-6]="",,"|n"&R1C29&RC[-6])&IF(RC[-2]="",,"|n"&RC[-2]) -> 
AI1039: =IF(RC[-27]&RC[-26]&RC[-25]&RC[-24]&RC[-23]&RC[-22]="",,R1C7)&IF(RC[-27]="",,"|n"&R1C8&RC[-27])&IF(RC[-26]="",,"|n"&R1C9&RC[-26])&IF(RC[-25]="",,"|n"&R1C10&RC[-25])&IF(RC[-24]="",,"|n"&R1C11&RC[-24])&IF(RC[-23]="",,"|n"&R1C12&RC[-23])&IF(RC[-22]="",,"|n"&R1C13&RC[-22])&IF(RC[-20]&RC[-19]&RC[-18]&RC[-17]="",,"|n"&R1C14)&IF(RC[-20]="",,"|n"&R1C15&RC[-20])&IF(RC[-19]="",,"|n"&R1C16&RC[-19])&IF(RC[-18]="",,"|n"&R1C17&RC[-18])&IF(RC[-17]="",,"|n"&R1C18&RC[-17])&IF(RC[-16]="",,"|n"&R1C19&RC[-16])&IF(RC[-15]="",,"|n"&R1C20&RC[-15])&IF(RC[-14]="",,"|n"&R1C21&RC[-14])&IF(RC[-13]="",,"|n"&R1C22&RC[-13])&IF(RC[-11]="",,"|n"&R1C24&RC[-11])&IF(RC[-10]="",,"|n"&R1C25&RC[-10])&IF(RC[-9]="",,"|n"&R1C26&RC[-9])&IF(RC[-8]="",,"|n"&R1C27&RC[-8])&IF(RC[-7]="",,"|n"&R1C28&RC[-7])&IF(RC[-6]="",,"|n"&R1C29&RC[-6])&IF(RC[-2]="",,"|n"&RC[-2]) -> 
AI1040: =IF(RC[-27]&RC[-26]&RC[-25]&RC[-24]&RC[-23]&RC[-22]="",,R1C7)&IF(RC[-27]="",,"|n"&R1C8&RC[-27])&IF(RC[-26]="",,"|n"&R1C9&RC[-26])&IF(RC[-25]="",,"|n"&R1C10&RC[-25])&IF(RC[-24]="",,"|n"&R1C11&RC[-24])&IF(RC[-23]="",,"|n"&R1C12&RC[-23])&IF(RC[-22]="",,"|n"&R1C13&RC[-22])&IF(RC[-20]&RC[-19]&RC[-18]&RC[-17]="",,"|n"&R1C14)&IF(RC[-20]="",,"|n"&R1C15&RC[-20])&IF(RC[-19]="",,"|n"&R1C16&RC[-19])&IF(RC[-18]="",,"|n"&R1C17&RC[-18])&IF(RC[-17]="",,"|n"&R1C18&RC[-17])&IF(RC[-16]="",,"|n"&R1C19&RC[-16])&IF(RC[-15]="",,"|n"&R1C20&RC[-15])&IF(RC[-14]="",,"|n"&R1C21&RC[-14])&IF(RC[-13]="",,"|n"&R1C22&RC[-13])&IF(RC[-11]="",,"|n"&R1C24&RC[-11])&IF(RC[-10]="",,"|n"&R1C25&RC[-10])&IF(RC[-9]="",,"|n"&R1C26&RC[-9])&IF(RC[-8]="",,"|n"&R1C27&RC[-8])&IF(RC[-7]="",,"|n"&R1C28&RC[-7])&IF(RC[-6]="",,"|n"&R1C29&RC[-6])&IF(RC[-2]="",,"|n"&RC[-2]) -> 
AI1041: =IF(RC[-27]&RC[-26]&RC[-25]&RC[-24]&RC[-23]&RC[-22]="",,R1C7)&IF(RC[-27]="",,"|n"&R1C8&RC[-27])&IF(RC[-26]="",,"|n"&R1C9&RC[-26])&IF(RC[-25]="",,"|n"&R1C10&RC[-25])&IF(RC[-24]="",,"|n"&R1C11&RC[-24])&IF(RC[-23]="",,"|n"&R1C12&RC[-23])&IF(RC[-22]="",,"|n"&R1C13&RC[-22])&IF(RC[-20]&RC[-19]&RC[-18]&RC[-17]="",,"|n"&R1C14)&IF(RC[-20]="",,"|n"&R1C15&RC[-20])&IF(RC[-19]="",,"|n"&R1C16&RC[-19])&IF(RC[-18]="",,"|n"&R1C17&RC[-18])&IF(RC[-17]="",,"|n"&R1C18&RC[-17])&IF(RC[-16]="",,"|n"&R1C19&RC[-16])&IF(RC[-15]="",,"|n"&R1C20&RC[-15])&IF(RC[-14]="",,"|n"&R1C21&RC[-14])&IF(RC[-13]="",,"|n"&R1C22&RC[-13])&IF(RC[-11]="",,"|n"&R1C24&RC[-11])&IF(RC[-10]="",,"|n"&R1C25&RC[-10])&IF(RC[-9]="",,"|n"&R1C26&RC[-9])&IF(RC[-8]="",,"|n"&R1C27&RC[-8])&IF(RC[-7]="",,"|n"&R1C28&RC[-7])&IF(RC[-6]="",,"|n"&R1C29&RC[-6])&IF(RC[-2]="",,"|n"&RC[-2]) -> 
AI1042: =IF(RC[-27]&RC[-26]&RC[-25]&RC[-24]&RC[-23]&RC[-22]="",,R1C7)&IF(RC[-27]="",,"|n"&R1C8&RC[-27])&IF(RC[-26]="",,"|n"&R1C9&RC[-26])&IF(RC[-25]="",,"|n"&R1C10&RC[-25])&IF(RC[-24]="",,"|n"&R1C11&RC[-24])&IF(RC[-23]="",,"|n"&R1C12&RC[-23])&IF(RC[-22]="",,"|n"&R1C13&RC[-22])&IF(RC[-20]&RC[-19]&RC[-18]&RC[-17]="",,"|n"&R1C14)&IF(RC[-20]="",,"|n"&R1C15&RC[-20])&IF(RC[-19]="",,"|n"&R1C16&RC[-19])&IF(RC[-18]="",,"|n"&R1C17&RC[-18])&IF(RC[-17]="",,"|n"&R1C18&RC[-17])&IF(RC[-16]="",,"|n"&R1C19&RC[-16])&IF(RC[-15]="",,"|n"&R1C20&RC[-15])&IF(RC[-14]="",,"|n"&R1C21&RC[-14])&IF(RC[-13]="",,"|n"&R1C22&RC[-13])&IF(RC[-11]="",,"|n"&R1C24&RC[-11])&IF(RC[-10]="",,"|n"&R1C25&RC[-10])&IF(RC[-9]="",,"|n"&R1C26&RC[-9])&IF(RC[-8]="",,"|n"&R1C27&RC[-8])&IF(RC[-7]="",,"|n"&R1C28&RC[-7])&IF(RC[-6]="",,"|n"&R1C29&RC[-6])&IF(RC[-2]="",,"|n"&RC[-2]) -> 
AI1043: =IF(RC[-27]&RC[-26]&RC[-25]&RC[-24]&RC[-23]&RC[-22]="",,R1C7)&IF(RC[-27]="",,"|n"&R1C8&RC[-27])&IF(RC[-26]="",,"|n"&R1C9&RC[-26])&IF(RC[-25]="",,"|n"&R1C10&RC[-25])&IF(RC[-24]="",,"|n"&R1C11&RC[-24])&IF(RC[-23]="",,"|n"&R1C12&RC[-23])&IF(RC[-22]="",,"|n"&R1C13&RC[-22])&IF(RC[-20]&RC[-19]&RC[-18]&RC[-17]="",,"|n"&R1C14)&IF(RC[-20]="",,"|n"&R1C15&RC[-20])&IF(RC[-19]="",,"|n"&R1C16&RC[-19])&IF(RC[-18]="",,"|n"&R1C17&RC[-18])&IF(RC[-17]="",,"|n"&R1C18&RC[-17])&IF(RC[-16]="",,"|n"&R1C19&RC[-16])&IF(RC[-15]="",,"|n"&R1C20&RC[-15])&IF(RC[-14]="",,"|n"&R1C21&RC[-14])&IF(RC[-13]="",,"|n"&R1C22&RC[-13])&IF(RC[-11]="",,"|n"&R1C24&RC[-11])&IF(RC[-10]="",,"|n"&R1C25&RC[-10])&IF(RC[-9]="",,"|n"&R1C26&RC[-9])&IF(RC[-8]="",,"|n"&R1C27&RC[-8])&IF(RC[-7]="",,"|n"&R1C28&RC[-7])&IF(RC[-6]="",,"|n"&R1C29&RC[-6])&IF(RC[-2]="",,"|n"&RC[-2]) -> 
AI1044: =IF(RC[-27]&RC[-26]&RC[-25]&RC[-24]&RC[-23]&RC[-22]="",,R1C7)&IF(RC[-27]="",,"|n"&R1C8&RC[-27])&IF(RC[-26]="",,"|n"&R1C9&RC[-26])&IF(RC[-25]="",,"|n"&R1C10&RC[-25])&IF(RC[-24]="",,"|n"&R1C11&RC[-24])&IF(RC[-23]="",,"|n"&R1C12&RC[-23])&IF(RC[-22]="",,"|n"&R1C13&RC[-22])&IF(RC[-20]&RC[-19]&RC[-18]&RC[-17]="",,"|n"&R1C14)&IF(RC[-20]="",,"|n"&R1C15&RC[-20])&IF(RC[-19]="",,"|n"&R1C16&RC[-19])&IF(RC[-18]="",,"|n"&R1C17&RC[-18])&IF(RC[-17]="",,"|n"&R1C18&RC[-17])&IF(RC[-16]="",,"|n"&R1C19&RC[-16])&IF(RC[-15]="",,"|n"&R1C20&RC[-15])&IF(RC[-14]="",,"|n"&R1C21&RC[-14])&IF(RC[-13]="",,"|n"&R1C22&RC[-13])&IF(RC[-11]="",,"|n"&R1C24&RC[-11])&IF(RC[-10]="",,"|n"&R1C25&RC[-10])&IF(RC[-9]="",,"|n"&R1C26&RC[-9])&IF(RC[-8]="",,"|n"&R1C27&RC[-8])&IF(RC[-7]="",,"|n"&R1C28&RC[-7])&IF(RC[-6]="",,"|n"&R1C29&RC[-6])&IF(RC[-2]="",,"|n"&RC[-2]) -> 
AI1045: =IF(RC[-27]&RC[-26]&RC[-25]&RC[-24]&RC[-23]&RC[-22]="",,R1C7)&IF(RC[-27]="",,"|n"&R1C8&RC[-27])&IF(RC[-26]="",,"|n"&R1C9&RC[-26])&IF(RC[-25]="",,"|n"&R1C10&RC[-25])&IF(RC[-24]="",,"|n"&R1C11&RC[-24])&IF(RC[-23]="",,"|n"&R1C12&RC[-23])&IF(RC[-22]="",,"|n"&R1C13&RC[-22])&IF(RC[-20]&RC[-19]&RC[-18]&RC[-17]="",,"|n"&R1C14)&IF(RC[-20]="",,"|n"&R1C15&RC[-20])&IF(RC[-19]="",,"|n"&R1C16&RC[-19])&IF(RC[-18]="",,"|n"&R1C17&RC[-18])&IF(RC[-17]="",,"|n"&R1C18&RC[-17])&IF(RC[-16]="",,"|n"&R1C19&RC[-16])&IF(RC[-15]="",,"|n"&R1C20&RC[-15])&IF(RC[-14]="",,"|n"&R1C21&RC[-14])&IF(RC[-13]="",,"|n"&R1C22&RC[-13])&IF(RC[-11]="",,"|n"&R1C24&RC[-11])&IF(RC[-10]="",,"|n"&R1C25&RC[-10])&IF(RC[-9]="",,"|n"&R1C26&RC[-9])&IF(RC[-8]="",,"|n"&R1C27&RC[-8])&IF(RC[-7]="",,"|n"&R1C28&RC[-7])&IF(RC[-6]="",,"|n"&R1C29&RC[-6])&IF(RC[-2]="",,"|n"&RC[-2]) -> 
AI1046: =IF(RC[-27]&RC[-26]&RC[-25]&RC[-24]&RC[-23]&RC[-22]="",,R1C7)&IF(RC[-27]="",,"|n"&R1C8&RC[-27])&IF(RC[-26]="",,"|n"&R1C9&RC[-26])&IF(RC[-25]="",,"|n"&R1C10&RC[-25])&IF(RC[-24]="",,"|n"&R1C11&RC[-24])&IF(RC[-23]="",,"|n"&R1C12&RC[-23])&IF(RC[-22]="",,"|n"&R1C13&RC[-22])&IF(RC[-20]&RC[-19]&RC[-18]&RC[-17]="",,"|n"&R1C14)&IF(RC[-20]="",,"|n"&R1C15&RC[-20])&IF(RC[-19]="",,"|n"&R1C16&RC[-19])&IF(RC[-18]="",,"|n"&R1C17&RC[-18])&IF(RC[-17]="",,"|n"&R1C18&RC[-17])&IF(RC[-16]="",,"|n"&R1C19&RC[-16])&IF(RC[-15]="",,"|n"&R1C20&RC[-15])&IF(RC[-14]="",,"|n"&R1C21&RC[-14])&IF(RC[-13]="",,"|n"&R1C22&RC[-13])&IF(RC[-11]="",,"|n"&R1C24&RC[-11])&IF(RC[-10]="",,"|n"&R1C25&RC[-10])&IF(RC[-9]="",,"|n"&R1C26&RC[-9])&IF(RC[-8]="",,"|n"&R1C27&RC[-8])&IF(RC[-7]="",,"|n"&R1C28&RC[-7])&IF(RC[-6]="",,"|n"&R1C29&RC[-6])&IF(RC[-2]="",,"|n"&RC[-2]) -> 
AI1047: =IF(RC[-27]&RC[-26]&RC[-25]&RC[-24]&RC[-23]&RC[-22]="",,R1C7)&IF(RC[-27]="",,"|n"&R1C8&RC[-27])&IF(RC[-26]="",,"|n"&R1C9&RC[-26])&IF(RC[-25]="",,"|n"&R1C10&RC[-25])&IF(RC[-24]="",,"|n"&R1C11&RC[-24])&IF(RC[-23]="",,"|n"&R1C12&RC[-23])&IF(RC[-22]="",,"|n"&R1C13&RC[-22])&IF(RC[-20]&RC[-19]&RC[-18]&RC[-17]="",,"|n"&R1C14)&IF(RC[-20]="",,"|n"&R1C15&RC[-20])&IF(RC[-19]="",,"|n"&R1C16&RC[-19])&IF(RC[-18]="",,"|n"&R1C17&RC[-18])&IF(RC[-17]="",,"|n"&R1C18&RC[-17])&IF(RC[-16]="",,"|n"&R1C19&RC[-16])&IF(RC[-15]="",,"|n"&R1C20&RC[-15])&IF(RC[-14]="",,"|n"&R1C21&RC[-14])&IF(RC[-13]="",,"|n"&R1C22&RC[-13])&IF(RC[-11]="",,"|n"&R1C24&RC[-11])&IF(RC[-10]="",,"|n"&R1C25&RC[-10])&IF(RC[-9]="",,"|n"&R1C26&RC[-9])&IF(RC[-8]="",,"|n"&R1C27&RC[-8])&IF(RC[-7]="",,"|n"&R1C28&RC[-7])&IF(RC[-6]="",,"|n"&R1C29&RC[-6])&IF(RC[-2]="",,"|n"&RC[-2]) -> 
AI1048: =IF(RC[-27]&RC[-26]&RC[-25]&RC[-24]&RC[-23]&RC[-22]="",,R1C7)&IF(RC[-27]="",,"|n"&R1C8&RC[-27])&IF(RC[-26]="",,"|n"&R1C9&RC[-26])&IF(RC[-25]="",,"|n"&R1C10&RC[-25])&IF(RC[-24]="",,"|n"&R1C11&RC[-24])&IF(RC[-23]="",,"|n"&R1C12&RC[-23])&IF(RC[-22]="",,"|n"&R1C13&RC[-22])&IF(RC[-20]&RC[-19]&RC[-18]&RC[-17]="",,"|n"&R1C14)&IF(RC[-20]="",,"|n"&R1C15&RC[-20])&IF(RC[-19]="",,"|n"&R1C16&RC[-19])&IF(RC[-18]="",,"|n"&R1C17&RC[-18])&IF(RC[-17]="",,"|n"&R1C18&RC[-17])&IF(RC[-16]="",,"|n"&R1C19&RC[-16])&IF(RC[-15]="",,"|n"&R1C20&RC[-15])&IF(RC[-14]="",,"|n"&R1C21&RC[-14])&IF(RC[-13]="",,"|n"&R1C22&RC[-13])&IF(RC[-11]="",,"|n"&R1C24&RC[-11])&IF(RC[-10]="",,"|n"&R1C25&RC[-10])&IF(RC[-9]="",,"|n"&R1C26&RC[-9])&IF(RC[-8]="",,"|n"&R1C27&RC[-8])&IF(RC[-7]="",,"|n"&R1C28&RC[-7])&IF(RC[-6]="",,"|n"&R1C29&RC[-6])&IF(RC[-2]="",,"|n"&RC[-2]) -> 
AI1049: =IF(RC[-27]&RC[-26]&RC[-25]&RC[-24]&RC[-23]&RC[-22]="",,R1C7)&IF(RC[-27]="",,"|n"&R1C8&RC[-27])&IF(RC[-26]="",,"|n"&R1C9&RC[-26])&IF(RC[-25]="",,"|n"&R1C10&RC[-25])&IF(RC[-24]="",,"|n"&R1C11&RC[-24])&IF(RC[-23]="",,"|n"&R1C12&RC[-23])&IF(RC[-22]="",,"|n"&R1C13&RC[-22])&IF(RC[-20]&RC[-19]&RC[-18]&RC[-17]="",,"|n"&R1C14)&IF(RC[-20]="",,"|n"&R1C15&RC[-20])&IF(RC[-19]="",,"|n"&R1C16&RC[-19])&IF(RC[-18]="",,"|n"&R1C17&RC[-18])&IF(RC[-17]="",,"|n"&R1C18&RC[-17])&IF(RC[-16]="",,"|n"&R1C19&RC[-16])&IF(RC[-15]="",,"|n"&R1C20&RC[-15])&IF(RC[-14]="",,"|n"&R1C21&RC[-14])&IF(RC[-13]="",,"|n"&R1C22&RC[-13])&IF(RC[-11]="",,"|n"&R1C24&RC[-11])&IF(RC[-10]="",,"|n"&R1C25&RC[-10])&IF(RC[-9]="",,"|n"&R1C26&RC[-9])&IF(RC[-8]="",,"|n"&R1C27&RC[-8])&IF(RC[-7]="",,"|n"&R1C28&RC[-7])&IF(RC[-6]="",,"|n"&R1C29&RC[-6])&IF(RC[-2]="",,"|n"&RC[-2]) -> 
AI1050: =IF(RC[-27]&RC[-26]&RC[-25]&RC[-24]&RC[-23]&RC[-22]="",,R1C7)&IF(RC[-27]="",,"|n"&R1C8&RC[-27])&IF(RC[-26]="",,"|n"&R1C9&RC[-26])&IF(RC[-25]="",,"|n"&R1C10&RC[-25])&IF(RC[-24]="",,"|n"&R1C11&RC[-24])&IF(RC[-23]="",,"|n"&R1C12&RC[-23])&IF(RC[-22]="",,"|n"&R1C13&RC[-22])&IF(RC[-20]&RC[-19]&RC[-18]&RC[-17]="",,"|n"&R1C14)&IF(RC[-20]="",,"|n"&R1C15&RC[-20])&IF(RC[-19]="",,"|n"&R1C16&RC[-19])&IF(RC[-18]="",,"|n"&R1C17&RC[-18])&IF(RC[-17]="",,"|n"&R1C18&RC[-17])&IF(RC[-16]="",,"|n"&R1C19&RC[-16])&IF(RC[-15]="",,"|n"&R1C20&RC[-15])&IF(RC[-14]="",,"|n"&R1C21&RC[-14])&IF(RC[-13]="",,"|n"&R1C22&RC[-13])&IF(RC[-11]="",,"|n"&R1C24&RC[-11])&IF(RC[-10]="",,"|n"&R1C25&RC[-10])&IF(RC[-9]="",,"|n"&R1C26&RC[-9])&IF(RC[-8]="",,"|n"&R1C27&RC[-8])&IF(RC[-7]="",,"|n"&R1C28&RC[-7])&IF(RC[-6]="",,"|n"&R1C29&RC[-6])&IF(RC[-2]="",,"|n"&RC[-2]) -> 
AI1051: =IF(RC[-27]&RC[-26]&RC[-25]&RC[-24]&RC[-23]&RC[-22]="",,R1C7)&IF(RC[-27]="",,"|n"&R1C8&RC[-27])&IF(RC[-26]="",,"|n"&R1C9&RC[-26])&IF(RC[-25]="",,"|n"&R1C10&RC[-25])&IF(RC[-24]="",,"|n"&R1C11&RC[-24])&IF(RC[-23]="",,"|n"&R1C12&RC[-23])&IF(RC[-22]="",,"|n"&R1C13&RC[-22])&IF(RC[-20]&RC[-19]&RC[-18]&RC[-17]="",,"|n"&R1C14)&IF(RC[-20]="",,"|n"&R1C15&RC[-20])&IF(RC[-19]="",,"|n"&R1C16&RC[-19])&IF(RC[-18]="",,"|n"&R1C17&RC[-18])&IF(RC[-17]="",,"|n"&R1C18&RC[-17])&IF(RC[-16]="",,"|n"&R1C19&RC[-16])&IF(RC[-15]="",,"|n"&R1C20&RC[-15])&IF(RC[-14]="",,"|n"&R1C21&RC[-14])&IF(RC[-13]="",,"|n"&R1C22&RC[-13])&IF(RC[-11]="",,"|n"&R1C24&RC[-11])&IF(RC[-10]="",,"|n"&R1C25&RC[-10])&IF(RC[-9]="",,"|n"&R1C26&RC[-9])&IF(RC[-8]="",,"|n"&R1C27&RC[-8])&IF(RC[-7]="",,"|n"&R1C28&RC[-7])&IF(RC[-6]="",,"|n"&R1C29&RC[-6])&IF(RC[-2]="",,"|n"&RC[-2]) -> 
AI1052: =IF(RC[-27]&RC[-26]&RC[-25]&RC[-24]&RC[-23]&RC[-22]="",,R1C7)&IF(RC[-27]="",,"|n"&R1C8&RC[-27])&IF(RC[-26]="",,"|n"&R1C9&RC[-26])&IF(RC[-25]="",,"|n"&R1C10&RC[-25])&IF(RC[-24]="",,"|n"&R1C11&RC[-24])&IF(RC[-23]="",,"|n"&R1C12&RC[-23])&IF(RC[-22]="",,"|n"&R1C13&RC[-22])&IF(RC[-20]&RC[-19]&RC[-18]&RC[-17]="",,"|n"&R1C14)&IF(RC[-20]="",,"|n"&R1C15&RC[-20])&IF(RC[-19]="",,"|n"&R1C16&RC[-19])&IF(RC[-18]="",,"|n"&R1C17&RC[-18])&IF(RC[-17]="",,"|n"&R1C18&RC[-17])&IF(RC[-16]="",,"|n"&R1C19&RC[-16])&IF(RC[-15]="",,"|n"&R1C20&RC[-15])&IF(RC[-14]="",,"|n"&R1C21&RC[-14])&IF(RC[-13]="",,"|n"&R1C22&RC[-13])&IF(RC[-11]="",,"|n"&R1C24&RC[-11])&IF(RC[-10]="",,"|n"&R1C25&RC[-10])&IF(RC[-9]="",,"|n"&R1C26&RC[-9])&IF(RC[-8]="",,"|n"&R1C27&RC[-8])&IF(RC[-7]="",,"|n"&R1C28&RC[-7])&IF(RC[-6]="",,"|n"&R1C29&RC[-6])&IF(RC[-2]="",,"|n"&RC[-2]) -> 
AI1053: =IF(RC[-27]&RC[-26]&RC[-25]&RC[-24]&RC[-23]&RC[-22]="",,R1C7)&IF(RC[-27]="",,"|n"&R1C8&RC[-27])&IF(RC[-26]="",,"|n"&R1C9&RC[-26])&IF(RC[-25]="",,"|n"&R1C10&RC[-25])&IF(RC[-24]="",,"|n"&R1C11&RC[-24])&IF(RC[-23]="",,"|n"&R1C12&RC[-23])&IF(RC[-22]="",,"|n"&R1C13&RC[-22])&IF(RC[-20]&RC[-19]&RC[-18]&RC[-17]="",,"|n"&R1C14)&IF(RC[-20]="",,"|n"&R1C15&RC[-20])&IF(RC[-19]="",,"|n"&R1C16&RC[-19])&IF(RC[-18]="",,"|n"&R1C17&RC[-18])&IF(RC[-17]="",,"|n"&R1C18&RC[-17])&IF(RC[-16]="",,"|n"&R1C19&RC[-16])&IF(RC[-15]="",,"|n"&R1C20&RC[-15])&IF(RC[-14]="",,"|n"&R1C21&RC[-14])&IF(RC[-13]="",,"|n"&R1C22&RC[-13])&IF(RC[-11]="",,"|n"&R1C24&RC[-11])&IF(RC[-10]="",,"|n"&R1C25&RC[-10])&IF(RC[-9]="",,"|n"&R1C26&RC[-9])&IF(RC[-8]="",,"|n"&R1C27&RC[-8])&IF(RC[-7]="",,"|n"&R1C28&RC[-7])&IF(RC[-6]="",,"|n"&R1C29&RC[-6])&IF(RC[-2]="",,"|n"&RC[-2]) -> 
AI1054: =IF(RC[-27]&RC[-26]&RC[-25]&RC[-24]&RC[-23]&RC[-22]="",,R1C7)&IF(RC[-27]="",,"|n"&R1C8&RC[-27])&IF(RC[-26]="",,"|n"&R1C9&RC[-26])&IF(RC[-25]="",,"|n"&R1C10&RC[-25])&IF(RC[-24]="",,"|n"&R1C11&RC[-24])&IF(RC[-23]="",,"|n"&R1C12&RC[-23])&IF(RC[-22]="",,"|n"&R1C13&RC[-22])&IF(RC[-20]&RC[-19]&RC[-18]&RC[-17]="",,"|n"&R1C14)&IF(RC[-20]="",,"|n"&R1C15&RC[-20])&IF(RC[-19]="",,"|n"&R1C16&RC[-19])&IF(RC[-18]="",,"|n"&R1C17&RC[-18])&IF(RC[-17]="",,"|n"&R1C18&RC[-17])&IF(RC[-16]="",,"|n"&R1C19&RC[-16])&IF(RC[-15]="",,"|n"&R1C20&RC[-15])&IF(RC[-14]="",,"|n"&R1C21&RC[-14])&IF(RC[-13]="",,"|n"&R1C22&RC[-13])&IF(RC[-11]="",,"|n"&R1C24&RC[-11])&IF(RC[-10]="",,"|n"&R1C25&RC[-10])&IF(RC[-9]="",,"|n"&R1C26&RC[-9])&IF(RC[-8]="",,"|n"&R1C27&RC[-8])&IF(RC[-7]="",,"|n"&R1C28&RC[-7])&IF(RC[-6]="",,"|n"&R1C29&RC[-6])&IF(RC[-2]="",,"|n"&RC[-2]) -> 
AI1055: =IF(RC[-27]&RC[-26]&RC[-25]&RC[-24]&RC[-23]&RC[-22]="",,R1C7)&IF(RC[-27]="",,"|n"&R1C8&RC[-27])&IF(RC[-26]="",,"|n"&R1C9&RC[-26])&IF(RC[-25]="",,"|n"&R1C10&RC[-25])&IF(RC[-24]="",,"|n"&R1C11&RC[-24])&IF(RC[-23]="",,"|n"&R1C12&RC[-23])&IF(RC[-22]="",,"|n"&R1C13&RC[-22])&IF(RC[-20]&RC[-19]&RC[-18]&RC[-17]="",,"|n"&R1C14)&IF(RC[-20]="",,"|n"&R1C15&RC[-20])&IF(RC[-19]="",,"|n"&R1C16&RC[-19])&IF(RC[-18]="",,"|n"&R1C17&RC[-18])&IF(RC[-17]="",,"|n"&R1C18&RC[-17])&IF(RC[-16]="",,"|n"&R1C19&RC[-16])&IF(RC[-15]="",,"|n"&R1C20&RC[-15])&IF(RC[-14]="",,"|n"&R1C21&RC[-14])&IF(RC[-13]="",,"|n"&R1C22&RC[-13])&IF(RC[-11]="",,"|n"&R1C24&RC[-11])&IF(RC[-10]="",,"|n"&R1C25&RC[-10])&IF(RC[-9]="",,"|n"&R1C26&RC[-9])&IF(RC[-8]="",,"|n"&R1C27&RC[-8])&IF(RC[-7]="",,"|n"&R1C28&RC[-7])&IF(RC[-6]="",,"|n"&R1C29&RC[-6])&IF(RC[-2]="",,"|n"&RC[-2]) -> 
AI1056: =IF(RC[-27]&RC[-26]&RC[-25]&RC[-24]&RC[-23]&RC[-22]="",,R1C7)&IF(RC[-27]="",,"|n"&R1C8&RC[-27])&IF(RC[-26]="",,"|n"&R1C9&RC[-26])&IF(RC[-25]="",,"|n"&R1C10&RC[-25])&IF(RC[-24]="",,"|n"&R1C11&RC[-24])&IF(RC[-23]="",,"|n"&R1C12&RC[-23])&IF(RC[-22]="",,"|n"&R1C13&RC[-22])&IF(RC[-20]&RC[-19]&RC[-18]&RC[-17]="",,"|n"&R1C14)&IF(RC[-20]="",,"|n"&R1C15&RC[-20])&IF(RC[-19]="",,"|n"&R1C16&RC[-19])&IF(RC[-18]="",,"|n"&R1C17&RC[-18])&IF(RC[-17]="",,"|n"&R1C18&RC[-17])&IF(RC[-16]="",,"|n"&R1C19&RC[-16])&IF(RC[-15]="",,"|n"&R1C20&RC[-15])&IF(RC[-14]="",,"|n"&R1C21&RC[-14])&IF(RC[-13]="",,"|n"&R1C22&RC[-13])&IF(RC[-11]="",,"|n"&R1C24&RC[-11])&IF(RC[-10]="",,"|n"&R1C25&RC[-10])&IF(RC[-9]="",,"|n"&R1C26&RC[-9])&IF(RC[-8]="",,"|n"&R1C27&RC[-8])&IF(RC[-7]="",,"|n"&R1C28&RC[-7])&IF(RC[-6]="",,"|n"&R1C29&RC[-6])&IF(RC[-2]="",,"|n"&RC[-2]) -> 
AI1057: =IF(RC[-27]&RC[-26]&RC[-25]&RC[-24]&RC[-23]&RC[-22]="",,R1C7)&IF(RC[-27]="",,"|n"&R1C8&RC[-27])&IF(RC[-26]="",,"|n"&R1C9&RC[-26])&IF(RC[-25]="",,"|n"&R1C10&RC[-25])&IF(RC[-24]="",,"|n"&R1C11&RC[-24])&IF(RC[-23]="",,"|n"&R1C12&RC[-23])&IF(RC[-22]="",,"|n"&R1C13&RC[-22])&IF(RC[-20]&RC[-19]&RC[-18]&RC[-17]="",,"|n"&R1C14)&IF(RC[-20]="",,"|n"&R1C15&RC[-20])&IF(RC[-19]="",,"|n"&R1C16&RC[-19])&IF(RC[-18]="",,"|n"&R1C17&RC[-18])&IF(RC[-17]="",,"|n"&R1C18&RC[-17])&IF(RC[-16]="",,"|n"&R1C19&RC[-16])&IF(RC[-15]="",,"|n"&R1C20&RC[-15])&IF(RC[-14]="",,"|n"&R1C21&RC[-14])&IF(RC[-13]="",,"|n"&R1C22&RC[-13])&IF(RC[-11]="",,"|n"&R1C24&RC[-11])&IF(RC[-10]="",,"|n"&R1C25&RC[-10])&IF(RC[-9]="",,"|n"&R1C26&RC[-9])&IF(RC[-8]="",,"|n"&R1C27&RC[-8])&IF(RC[-7]="",,"|n"&R1C28&RC[-7])&IF(RC[-6]="",,"|n"&R1C29&RC[-6])&IF(RC[-2]="",,"|n"&RC[-2]) -> 
AI1058: =IF(RC[-27]&RC[-26]&RC[-25]&RC[-24]&RC[-23]&RC[-22]="",,R1C7)&IF(RC[-27]="",,"|n"&R1C8&RC[-27])&IF(RC[-26]="",,"|n"&R1C9&RC[-26])&IF(RC[-25]="",,"|n"&R1C10&RC[-25])&IF(RC[-24]="",,"|n"&R1C11&RC[-24])&IF(RC[-23]="",,"|n"&R1C12&RC[-23])&IF(RC[-22]="",,"|n"&R1C13&RC[-22])&IF(RC[-20]&RC[-19]&RC[-18]&RC[-17]="",,"|n"&R1C14)&IF(RC[-20]="",,"|n"&R1C15&RC[-20])&IF(RC[-19]="",,"|n"&R1C16&RC[-19])&IF(RC[-18]="",,"|n"&R1C17&RC[-18])&IF(RC[-17]="",,"|n"&R1C18&RC[-17])&IF(RC[-16]="",,"|n"&R1C19&RC[-16])&IF(RC[-15]="",,"|n"&R1C20&RC[-15])&IF(RC[-14]="",,"|n"&R1C21&RC[-14])&IF(RC[-13]="",,"|n"&R1C22&RC[-13])&IF(RC[-11]="",,"|n"&R1C24&RC[-11])&IF(RC[-10]="",,"|n"&R1C25&RC[-10])&IF(RC[-9]="",,"|n"&R1C26&RC[-9])&IF(RC[-8]="",,"|n"&R1C27&RC[-8])&IF(RC[-7]="",,"|n"&R1C28&RC[-7])&IF(RC[-6]="",,"|n"&R1C29&RC[-6])&IF(RC[-2]="",,"|n"&RC[-2]) -> 
AI1059: =IF(RC[-27]&RC[-26]&RC[-25]&RC[-24]&RC[-23]&RC[-22]="",,R1C7)&IF(RC[-27]="",,"|n"&R1C8&RC[-27])&IF(RC[-26]="",,"|n"&R1C9&RC[-26])&IF(RC[-25]="",,"|n"&R1C10&RC[-25])&IF(RC[-24]="",,"|n"&R1C11&RC[-24])&IF(RC[-23]="",,"|n"&R1C12&RC[-23])&IF(RC[-22]="",,"|n"&R1C13&RC[-22])&IF(RC[-20]&RC[-19]&RC[-18]&RC[-17]="",,"|n"&R1C14)&IF(RC[-20]="",,"|n"&R1C15&RC[-20])&IF(RC[-19]="",,"|n"&R1C16&RC[-19])&IF(RC[-18]="",,"|n"&R1C17&RC[-18])&IF(RC[-17]="",,"|n"&R1C18&RC[-17])&IF(RC[-16]="",,"|n"&R1C19&RC[-16])&IF(RC[-15]="",,"|n"&R1C20&RC[-15])&IF(RC[-14]="",,"|n"&R1C21&RC[-14])&IF(RC[-13]="",,"|n"&R1C22&RC[-13])&IF(RC[-11]="",,"|n"&R1C24&RC[-11])&IF(RC[-10]="",,"|n"&R1C25&RC[-10])&IF(RC[-9]="",,"|n"&R1C26&RC[-9])&IF(RC[-8]="",,"|n"&R1C27&RC[-8])&IF(RC[-7]="",,"|n"&R1C28&RC[-7])&IF(RC[-6]="",,"|n"&R1C29&RC[-6])&IF(RC[-2]="",,"|n"&RC[-2]) -> 
AI1060: =IF(RC[-27]&RC[-26]&RC[-25]&RC[-24]&RC[-23]&RC[-22]="",,R1C7)&IF(RC[-27]="",,"|n"&R1C8&RC[-27])&IF(RC[-26]="",,"|n"&R1C9&RC[-26])&IF(RC[-25]="",,"|n"&R1C10&RC[-25])&IF(RC[-24]="",,"|n"&R1C11&RC[-24])&IF(RC[-23]="",,"|n"&R1C12&RC[-23])&IF(RC[-22]="",,"|n"&R1C13&RC[-22])&IF(RC[-20]&RC[-19]&RC[-18]&RC[-17]="",,"|n"&R1C14)&IF(RC[-20]="",,"|n"&R1C15&RC[-20])&IF(RC[-19]="",,"|n"&R1C16&RC[-19])&IF(RC[-18]="",,"|n"&R1C17&RC[-18])&IF(RC[-17]="",,"|n"&R1C18&RC[-17])&IF(RC[-16]="",,"|n"&R1C19&RC[-16])&IF(RC[-15]="",,"|n"&R1C20&RC[-15])&IF(RC[-14]="",,"|n"&R1C21&RC[-14])&IF(RC[-13]="",,"|n"&R1C22&RC[-13])&IF(RC[-11]="",,"|n"&R1C24&RC[-11])&IF(RC[-10]="",,"|n"&R1C25&RC[-10])&IF(RC[-9]="",,"|n"&R1C26&RC[-9])&IF(RC[-8]="",,"|n"&R1C27&RC[-8])&IF(RC[-7]="",,"|n"&R1C28&RC[-7])&IF(RC[-6]="",,"|n"&R1C29&RC[-6])&IF(RC[-2]="",,"|n"&RC[-2]) -> 
AI1061: =IF(RC[-27]&RC[-26]&RC[-25]&RC[-24]&RC[-23]&RC[-22]="",,R1C7)&IF(RC[-27]="",,"|n"&R1C8&RC[-27])&IF(RC[-26]="",,"|n"&R1C9&RC[-26])&IF(RC[-25]="",,"|n"&R1C10&RC[-25])&IF(RC[-24]="",,"|n"&R1C11&RC[-24])&IF(RC[-23]="",,"|n"&R1C12&RC[-23])&IF(RC[-22]="",,"|n"&R1C13&RC[-22])&IF(RC[-20]&RC[-19]&RC[-18]&RC[-17]="",,"|n"&R1C14)&IF(RC[-20]="",,"|n"&R1C15&RC[-20])&IF(RC[-19]="",,"|n"&R1C16&RC[-19])&IF(RC[-18]="",,"|n"&R1C17&RC[-18])&IF(RC[-17]="",,"|n"&R1C18&RC[-17])&IF(RC[-16]="",,"|n"&R1C19&RC[-16])&IF(RC[-15]="",,"|n"&R1C20&RC[-15])&IF(RC[-14]="",,"|n"&R1C21&RC[-14])&IF(RC[-13]="",,"|n"&R1C22&RC[-13])&IF(RC[-11]="",,"|n"&R1C24&RC[-11])&IF(RC[-10]="",,"|n"&R1C25&RC[-10])&IF(RC[-9]="",,"|n"&R1C26&RC[-9])&IF(RC[-8]="",,"|n"&R1C27&RC[-8])&IF(RC[-7]="",,"|n"&R1C28&RC[-7])&IF(RC[-6]="",,"|n"&R1C29&RC[-6])&IF(RC[-2]="",,"|n"&RC[-2]) -> 

Sheet: Sheet2
A1: F | B1: |cFF999999 | C1: |r | D1: 找 | E1: 装备升级NPC(练功房) | F1: 挑战升级 | G1: ="升级途径:|cFF1BE6B8"&RC[-3]&RC[-2]&RC[-1]&"|r" -> 升级途径:|cFF1BE6B8找 装备升级NPC(练功房) 挑战升级|r | H1: 使用 | J1: ="升级途径:|cFF1BE6B8"&RC[-2]&RC[-1]&" 升级|r" -> 升级途径:|cFF1BE6B8使用 升级|r
A2: E | B2: |CFFFFFFFF | D2: 找 | E2: 装备升级NPC(练功房) | F2: 挑战升级 | G2: ="升级途径:|cFF1BE6B8"&RC[-3]&RC[-2]&RC[-1]&"|r" -> 升级途径:|cFF1BE6B8找 装备升级NPC(练功房) 挑战升级|r | H2: 使用 | I2: |CFFB6D7A8石化水晶|r | J2: ="升级途径:|cFF1BE6B8"&RC[-2]&RC[-1]&" 升级|r" -> 升级途径:|cFF1BE6B8使用 |CFFB6D7A8石化水晶|r 升级|r
A3: D | B3: |CFFB6D7A8 | D3: 找 | E3: 装备升级NPC(练功房) | F3: 挑战升级 | G3: ="升级途径:|cFF1BE6B8"&RC[-3]&RC[-2]&RC[-1]&"|r" -> 升级途径:|cFF1BE6B8找 装备升级NPC(练功房) 挑战升级|r | H3: 使用 | I3: |cFF99FF66精炼晶石|r | J3: ="升级途径:|cFF1BE6B8"&RC[-2]&RC[-1]&" 升级|r" -> 升级途径:|cFF1BE6B8使用 |cFF99FF66精炼晶石|r 升级|r
A4: C | B4: |cFF99FF66 | D4: 找 | F4: 挑战升级 | H4: 使用 | I4: |cFF1BE6B8玄天灵髓|r | J4: ="升级途径:|cFF1BE6B8"&RC[-2]&RC[-1]&" 升级|r" -> 升级途径:|cFF1BE6B8使用 |cFF1BE6B8玄天灵髓|r 升级|r
A5: B | B5: |cFF99FF66 | D5: 找 | F5: 挑战升级 | H5: 使用 | I5: |cFF33FF00传说气息|r | J5: ="升级途径:|cFF1BE6B8"&RC[-2]&RC[-1]&" 升级|r" -> 升级途径:|cFF1BE6B8使用 |cFF33FF00传说气息|r 升级|r
A6: A | B6: |cFF99FF66 | D6: 找 | F6: 挑战升级 | H6: 使用 | J6: ="升级途径:|cFF1BE6B8"&RC[-2]&RC[-1]&" 升级|r" -> 升级途径:|cFF1BE6B8使用 升级|r
A7: S | B7: |cFFFF9933 | D7: 找 | F7: 挑战升级 | H7: 使用 | J7: ="升级途径:|cFF1BE6B8"&RC[-2]&RC[-1]&" 升级|r" -> 升级途径:|cFF1BE6B8使用 升级|r
A9: 1 | B9: 1
A10: 2 | B10: 2
A11: 3 | B11: 3(满)
A12: F | B12: 零
A13: E | B13: 一
A14: D | B14: 二
A15: C | B15: 三
A16: B | B16: 四
A17: A | B17: 五
A18: S | B18: 六
A20: 2 | B20: 击杀20只 | C20: 阿拉希盆地
A21: 3 | B21: 击杀20只 | C21: 死亡矿井
A22: 4 | B22: 击杀20只 | C22: 熔火之心
A23: 5 | B23: 击杀20只 | C23: 祖阿曼岛
A24: 6 | B24: 击杀20只 | C24: 达拉然奥术秘境
A25: 7 | B25: 找 | C25: 圣魂信仰 | E25: ="升级途径:|cFF1BE6B8"&RC[-3]&RC[-2]&RC[-1]&"NPC(后山)|r 合成升级" -> 升级途径:|cFF1BE6B8找 圣魂信仰NPC(后山)|r 合成升级
C27: 1 | D27: 2 | E27: 3 | F27: 4 | G27: 1 | H27: 2 | I27: 3 | J27: 4
B28: 阿拉希盆地 | C28: 盗贼 | D28: 鱼人 | E28: 森林狼 | F28: 豪猪 | G28: 盗贼王 | H28: 鱼人首领 | I28: 森林狼王 | J28: 豪猪王
B29: 死亡矿井 | C29: 达拉内尔信徒 | D29: 食人魔 | E29: 狗头人 | F29: 矿井蝎子 | G29: 达拉内尔主教 | H29: 食人魔酋长 | I29: 狗头人酋长 | J29: 矿井魔蝎
B30: 熔火之心 | C30: 熔岩怪物 | D30: 火焰蜥蜴 | E30: 烈焰龙龟 | F30: 幼龙 | G30: 炎魔 | H30: 巨型蜥蜴 | I30: 千年龙龟 | J30: 成年巨龙
B31: 祖阿曼岛 | C31: 冰霜巨魔 | D31: 丛林巨魔 | E31: 娜迦护卫 | F31: 黑暗巨魔 | G31: 冰霜巨魔酋长 | H31: 丛林巨魔酋长 | I31: 娜迦暴君 | J31: 黑暗巨魔酋长
B32: 达拉然奥术秘境 | C32: 火元素 | D32: 风元素 | E32: 水元素 | F32: 土元素 | G32: 火元素领主 | H32: 风元素领主 | I32: 水元素领主 | J32: 土元素领主

Sheet: Sheet3
A1: 武器 | B1: ReplaceableTextures\CommandButtons\BTNcxj.blp | C1: ReplaceableTextures\CommandButtons\BTNdxj1.blp | D1: ReplaceableTextures\CommandButtons\BTNdxj2.blp | E1: ReplaceableTextures\CommandButtons\BTNdxj3.blp | F1: ReplaceableTextures\CommandButtons\BTNdxj4.blp | G1: ReplaceableTextures\CommandButtons\BTNdxj5.blp | H1: ReplaceableTextures\CommandButtons\BTNdxj6.blp | I1: ReplaceableTextures\CommandButtons\BTNdxj7.blp | J1: ReplaceableTextures\CommandButtons\BTNdxj8.blp | K1: ReplaceableTextures\CommandButtons\BTNdxj9.blp | L1: ReplaceableTextures\CommandButtons\BTNdxj10.blp
A2: 帽子 | B2: ReplaceableTextures\CommandButtons\BTNdzg.blp | C2: ReplaceableTextures\CommandButtons\BTNdxm1.blp | D2: ReplaceableTextures\CommandButtons\BTNdxm2.blp | E2: ReplaceableTextures\CommandButtons\BTNdxm3.blp | F2: ReplaceableTextures\CommandButtons\BTNdxm4.blp | G2: ReplaceableTextures\CommandButtons\BTNdxm5.blp | H2: ReplaceableTextures\CommandButtons\BTNdxm6.blp | I2: ReplaceableTextures\CommandButtons\BTNdxm7.blp | J2: ReplaceableTextures\CommandButtons\BTNdxm8.blp | K2: ReplaceableTextures\CommandButtons\BTNdxm9.blp | L2: ReplaceableTextures\CommandButtons\BTNdxm10.blp
A3: 衣服 | B3: ReplaceableTextures\CommandButtons\BTNdzp.blp | C3: ReplaceableTextures\CommandButtons\BTNdxy1.blp | D3: ReplaceableTextures\CommandButtons\BTNdxy2.blp | E3: ReplaceableTextures\CommandButtons\BTNdxy3.blp | F3: ReplaceableTextures\CommandButtons\BTNdxy4.blp | G3: ReplaceableTextures\CommandButtons\BTNdxy5.blp | H3: ReplaceableTextures\CommandButtons\BTNdxy6.blp | I3: ReplaceableTextures\CommandButtons\BTNdxy7.blp | J3: ReplaceableTextures\CommandButtons\BTNdxy8.blp | K3: ReplaceableTextures\CommandButtons\BTNdxy9.blp | L3: ReplaceableTextures\CommandButtons\BTNdxy10.blp
A4: 鞋子 | B4: ReplaceableTextures\CommandButtons\BTNdzl.blp | C4: ReplaceableTextures\CommandButtons\BTNdxx1.blp | D4: ReplaceableTextures\CommandButtons\BTNdxx2.blp | E4: ReplaceableTextures\CommandButtons\BTNdxx3.blp | F4: ReplaceableTextures\CommandButtons\BTNdxx4.blp | G4: ReplaceableTextures\CommandButtons\BTNdxx5.blp | H4: ReplaceableTextures\CommandButtons\BTNdxx6.blp | I4: ReplaceableTextures\CommandButtons\BTNdxx7.blp | J4: ReplaceableTextures\CommandButtons\BTNdxx8.blp | K4: ReplaceableTextures\CommandButtons\BTNdxx9.blp | L4: ReplaceableTextures\CommandButtons\BTNdxx10.blp
A5: 武器 | B5: I1
A6: 帽子 | B6: I2
A7: 衣服 | B7: I3
A8: 鞋子 | B8: I4
A9: F | B9: 0
A10: E | B10: 1
A11: D | B11: 2
A12: C | B12: 3
A13: B | B13: 4
A14: A | B14: 5
A15: S | B15: 6