Sheet: ITEM
A1: TYPE | B1: _NAME | C1: id | D1: _lev | E1: oid | F1: iabi | G1: unam | H1: ides | I1: utip | J1: utub | K1: uhot | L1: iico | M1: isca | N1: ifil | O1: ubpx | P1: ubpy | Q1: issc | R1: iclr | S1: iclb | T1: iclg | U1: iarm | V1: ilvo | W1: ilev | X1: icla | Y1: igol | Z1: ihtp | AA1: isst | AB1: istr | AC1: ilum | AD1: isto | AE1: ipri | AF1: icid | AG1: iicd | AH1: imor | AI1: idrp | AJ1: ipow | AK1: isel | AL1: ipaw | AM1: idro | AN1: iprn | AO1: iuse | AP1: iper | AQ1: iusa | AR1: ureq | AS1: urqa
A2: COMMENT | C2: 物品ID | D2: 等级 | E2: 物品模板ID | F2: 技能 - 技能 | G2: 文本 - 名字 | H2: 文本 - 说明 | I2: 文本 - 提示工具 - 基础 | J2: 文本 - 提示工具 - 扩展 | K2: 文本 - 热键 | L2: 显示 - 界面图标 | M2: 显示 - 模型缩放 | N2: 显示 - 使用模型 | O2: 显示 - 按钮位置(X) | P2: 显示 - 按钮位置(Y) | Q2: 显示 - 选择圈大小(编辑器) | R2: 显示 - 颜色值(红) | S2: 显示 - 颜色值(蓝) | T2: 显示 - 颜色值(绿) | U2: 战斗 - 装甲类型 | V2: 状态 - 等级(旧版) | W2: 状态 - 等级 | X2: 状态 - 物品分类 | Y2: 状态 - 黄金消耗 | Z2: 状态 - 生命值 | AA2: 状态 - 购买开始时间 | AB2: 状态 - 购买时间间隔 | AC2: 状态 - 木材消耗 | AD2: 状态 - 最大库存量 | AE2: 状态 - 优先权 | AF2: 状态 - CD间隔组 | AG2: 状态 - 无视CD间隔 | AH2: 状态 - 有效的物品转换目标 | AI2: 状态 - 持有者死亡时掉落 | AJ2: 状态 - 捡取时自动使用 | AK2: 状态 - 可被市场出售 | AL2: 状态 - 可以被抵押 | AM2: 状态 - 可以丢弃 | AN2: 状态 - 可作为随机物品 | AO2: 状态 - 使用次数 | AP2: 状态 - 使用完会消失 | AQ2: 状态 - 主动使用 | AR2: 科技树 - 需求 | AS2: 科技树 - 需求值
A3: OBJECT | B3: =属性表!R[-1]C[3]&属性表!R[-1]C[4] -> 战士长刃 | C3: SY01 | D3: =属性表!R[-1]C[-2] -> 1 | E3: srbd | F3: 战士 | G3: =属性表!R[-1]C[26] -> |cFF999999[1级]战士长刃|r | H3: =属性表!R[-1]C[26] -> |cFFFFFF99基础属性|r|n攻击:30000 | I3: =RC[-2] -> |cFF999999[1级]战士长刃|r | J3: =RC[-2] -> |cFFFFFF99基础属性|r|n攻击:30000 | L3: =VLOOKUP(RC[-10],图标表!C[-7]:C[-6],2,0) -> blp\suitItem\01 (8) .blp | W3: 1 | X3: Purchasable | Y3: 1000 | Z3: 236 | AA3: 0 | AB3: 0 | AC3: 0 | AL3: 1 | AN3: 0
A4: OBJECT | B4: =属性表!R[-1]C[3]&属性表!R[-1]C[4] -> 战士胸甲 | C4: SY02 | D4: =属性表!R[-1]C[-2] -> 1 | E4: srbd | F4: 战士 | G4: =属性表!R[-1]C[26] -> |cFF999999[1级]战士胸甲|r | H4: =属性表!R[-1]C[26] -> |cFFFFFF99基础属性|r|n血量:100000 | I4: =RC[-2] -> |cFF999999[1级]战士胸甲|r | J4: =RC[-2] -> |cFFFFFF99基础属性|r|n血量:100000 | L4: =VLOOKUP(RC[-10],图标表!C[-7]:C[-6],2,0) -> blp\suitItem\01 (1) .blp | W4: 1 | X4: Purchasable | Y4: 1000 | Z4: 236 | AA4: 0 | AB4: 0 | AC4: 0 | AL4: 1 | AN4: 0
A5: OBJECT | B5: =属性表!R[-1]C[3]&属性表!R[-1]C[4] -> 战士护手 | C5: SY03 | D5: =属性表!R[-1]C[-2] -> 1 | E5: srbd | F5: 战士 | G5: =属性表!R[-1]C[26] -> |cFF999999[1级]战士护手|r | H5: =属性表!R[-1]C[26] -> |cFFFFFF99基础属性|r|n力量:8000|n敏捷:8000|n智力:8000 | I5: =RC[-2] -> |cFF999999[1级]战士护手|r | J5: =RC[-2] -> |cFFFFFF99基础属性|r|n力量:8000|n敏捷:8000|n智力:8000 | L5: =VLOOKUP(RC[-10],图标表!C[-7]:C[-6],2,0) -> blp\suitItem\01 (2) .blp | W5: 1 | X5: Purchasable | Y5: 1000 | Z5: 236 | AA5: 0 | AB5: 0 | AC5: 0 | AL5: 1 | AN5: 0
A6: OBJECT | B6: =属性表!R[-1]C[3]&属性表!R[-1]C[4] -> 战士护肩 | C6: SY04 | D6: =属性表!R[-1]C[-2] -> 1 | E6: srbd | F6: 战士 | G6: =属性表!R[-1]C[26] -> |cFF999999[1级]战士护肩|r | H6: =属性表!R[-1]C[26] -> |cFFFFFF99基础属性|r|n力量:16000 | I6: =RC[-2] -> |cFF999999[1级]战士护肩|r | J6: =RC[-2] -> |cFFFFFF99基础属性|r|n力量:16000 | L6: =VLOOKUP(RC[-10],图标表!C[-7]:C[-6],2,0) -> blp\suitItem\01 (3) .blp | W6: 1 | X6: Purchasable | Y6: 1000 | Z6: 236 | AA6: 0 | AB6: 0 | AC6: 0 | AL6: 1 | AN6: 0
A7: OBJECT | B7: =属性表!R[-1]C[3]&属性表!R[-1]C[4] -> 战士腿甲 | C7: SY05 | D7: =属性表!R[-1]C[-2] -> 1 | E7: srbd | F7: 战士 | G7: =属性表!R[-1]C[26] -> |cFF999999[1级]战士腿甲|r | H7: =属性表!R[-1]C[26] -> |cFFFFFF99基础属性|r|n护甲:5000 | I7: =RC[-2] -> |cFF999999[1级]战士腿甲|r | J7: =RC[-2] -> |cFFFFFF99基础属性|r|n护甲:5000 | L7: =VLOOKUP(RC[-10],图标表!C[-7]:C[-6],2,0) -> blp\suitItem\01 (4) .blp | W7: 1 | X7: Purchasable | Y7: 1000 | Z7: 236 | AA7: 0 | AB7: 0 | AC7: 0 | AL7: 1 | AN7: 0
A8: OBJECT | B8: =属性表!R[-1]C[3]&属性表!R[-1]C[4] -> 战士头饰 | C8: SY06 | D8: =属性表!R[-1]C[-2] -> 1 | E8: srbd | F8: 战士 | G8: =属性表!R[-1]C[26] -> |cFF999999[1级]战士头饰|r | H8: =属性表!R[-1]C[26] -> |cFFFFFF99基础属性|r|n智力:16000 | I8: =RC[-2] -> |cFF999999[1级]战士头饰|r | J8: =RC[-2] -> |cFFFFFF99基础属性|r|n智力:16000 | L8: =VLOOKUP(RC[-10],图标表!C[-7]:C[-6],2,0) -> blp\suitItem\01 (5) .blp | W8: 1 | X8: Purchasable | Y8: 1000 | Z8: 236 | AA8: 0 | AB8: 0 | AC8: 0 | AL8: 1 | AN8: 0
A9: OBJECT | B9: =属性表!R[-1]C[3]&属性表!R[-1]C[4] -> 战士战靴 | C9: SY07 | D9: =属性表!R[-1]C[-2] -> 1 | E9: srbd | F9: 战士 | G9: =属性表!R[-1]C[26] -> |cFF999999[1级]战士战靴|r | H9: =属性表!R[-1]C[26] -> |cFFFFFF99基础属性|r|n敏捷:16000 | I9: =RC[-2] -> |cFF999999[1级]战士战靴|r | J9: =RC[-2] -> |cFFFFFF99基础属性|r|n敏捷:16000 | L9: =VLOOKUP(RC[-10],图标表!C[-7]:C[-6],2,0) -> blp\suitItem\01 (6) .blp | W9: 1 | X9: Purchasable | Y9: 1000 | Z9: 236 | AA9: 0 | AB9: 0 | AC9: 0 | AL9: 1 | AN9: 0
A10: OBJECT | B10: =属性表!R[-1]C[3]&属性表!R[-1]C[4] -> 战士腰带 | C10: SY08 | D10: =属性表!R[-1]C[-2] -> 1 | E10: srbd | F10: 战士 | G10: =属性表!R[-1]C[26] -> |cFF999999[1级]战士腰带|r | H10: =属性表!R[-1]C[26] -> |n|cFFFFFF55附加属性|r(%)|n攻速:20 | I10: =RC[-2] -> |cFF999999[1级]战士腰带|r | J10: =RC[-2] -> |n|cFFFFFF55附加属性|r(%)|n攻速:20 | L10: =VLOOKUP(RC[-10],图标表!C[-7]:C[-6],2,0) -> blp\suitItem\01 (7) .blp | W10: 1 | X10: Purchasable | Y10: 1000 | Z10: 236 | AA10: 0 | AB10: 0 | AC10: 0 | AL10: 1 | AN10: 0
A11: OBJECT | B11: =属性表!R[-1]C[3]&属性表!R[-1]C[4] -> 卫士长刃 | C11: SY09 | D11: =属性表!R[-1]C[-2] -> 1 | E11: srbd | F11: 卫士 | G11: =属性表!R[-1]C[26] -> |cFF999999[1级]卫士长刃|r | H11: =属性表!R[-1]C[26] -> |cFFFFFF99基础属性|r|n攻击:30000 | I11: =RC[-2] -> |cFF999999[1级]卫士长刃|r | J11: =RC[-2] -> |cFFFFFF99基础属性|r|n攻击:30000 | L11: =VLOOKUP(RC[-10],图标表!C[-7]:C[-6],2,0) -> blp\suitItem\02 (8) .blp | W11: 1 | X11: Purchasable | Y11: 1000 | Z11: 236 | AA11: 0 | AB11: 0 | AC11: 0 | AL11: 1 | AN11: 0
A12: OBJECT | B12: =属性表!R[-1]C[3]&属性表!R[-1]C[4] -> 卫士胸甲 | C12: SY0A | D12: =属性表!R[-1]C[-2] -> 1 | E12: srbd | F12: 卫士 | G12: =属性表!R[-1]C[26] -> |cFF999999[1级]卫士胸甲|r | H12: =属性表!R[-1]C[26] -> |cFFFFFF99基础属性|r|n血量:100000 | I12: =RC[-2] -> |cFF999999[1级]卫士胸甲|r | J12: =RC[-2] -> |cFFFFFF99基础属性|r|n血量:100000 | L12: =VLOOKUP(RC[-10],图标表!C[-7]:C[-6],2,0) -> blp\suitItem\02 (1) .blp | W12: 1 | X12: Purchasable | Y12: 1000 | Z12: 236 | AA12: 0 | AB12: 0 | AC12: 0 | AL12: 1 | AN12: 0
A13: OBJECT | B13: =属性表!R[-1]C[3]&属性表!R[-1]C[4] -> 卫士护手 | C13: SY0B | D13: =属性表!R[-1]C[-2] -> 1 | E13: srbd | F13: 卫士 | G13: =属性表!R[-1]C[26] -> |cFF999999[1级]卫士护手|r | H13: =属性表!R[-1]C[26] -> |cFFFFFF99基础属性|r|n力量:8000|n敏捷:8000|n智力:8000 | I13: =RC[-2] -> |cFF999999[1级]卫士护手|r | J13: =RC[-2] -> |cFFFFFF99基础属性|r|n力量:8000|n敏捷:8000|n智力:8000 | L13: =VLOOKUP(RC[-10],图标表!C[-7]:C[-6],2,0) -> blp\suitItem\02 (2) .blp | W13: 1 | X13: Purchasable | Y13: 1000 | Z13: 236 | AA13: 0 | AB13: 0 | AC13: 0 | AL13: 1 | AN13: 0
A14: OBJECT | B14: =属性表!R[-1]C[3]&属性表!R[-1]C[4] -> 卫士护肩 | C14: SY0C | D14: =属性表!R[-1]C[-2] -> 1 | E14: srbd | F14: 卫士 | G14: =属性表!R[-1]C[26] -> |cFF999999[1级]卫士护肩|r | H14: =属性表!R[-1]C[26] -> |cFFFFFF99基础属性|r|n力量:16000 | I14: =RC[-2] -> |cFF999999[1级]卫士护肩|r | J14: =RC[-2] -> |cFFFFFF99基础属性|r|n力量:16000 | L14: =VLOOKUP(RC[-10],图标表!C[-7]:C[-6],2,0) -> blp\suitItem\02 (3) .blp | W14: 1 | X14: Purchasable | Y14: 1000 | Z14: 236 | AA14: 0 | AB14: 0 | AC14: 0 | AL14: 1 | AN14: 0
A15: OBJECT | B15: =属性表!R[-1]C[3]&属性表!R[-1]C[4] -> 卫士腿甲 | C15: SY0D | D15: =属性表!R[-1]C[-2] -> 1 | E15: srbd | F15: 卫士 | G15: =属性表!R[-1]C[26] -> |cFF999999[1级]卫士腿甲|r | H15: =属性表!R[-1]C[26] -> |cFFFFFF99基础属性|r|n护甲:5000 | I15: =RC[-2] -> |cFF999999[1级]卫士腿甲|r | J15: =RC[-2] -> |cFFFFFF99基础属性|r|n护甲:5000 | L15: =VLOOKUP(RC[-10],图标表!C[-7]:C[-6],2,0) -> blp\suitItem\02 (4) .blp | W15: 1 | X15: Purchasable | Y15: 1000 | Z15: 236 | AA15: 0 | AB15: 0 | AC15: 0 | AL15: 1 | AN15: 0
A16: OBJECT | B16: =属性表!R[-1]C[3]&属性表!R[-1]C[4] -> 卫士头饰 | C16: SY0E | D16: =属性表!R[-1]C[-2] -> 1 | E16: srbd | F16: 卫士 | G16: =属性表!R[-1]C[26] -> |cFF999999[1级]卫士头饰|r | H16: =属性表!R[-1]C[26] -> |cFFFFFF99基础属性|r|n智力:16000 | I16: =RC[-2] -> |cFF999999[1级]卫士头饰|r | J16: =RC[-2] -> |cFFFFFF99基础属性|r|n智力:16000 | L16: =VLOOKUP(RC[-10],图标表!C[-7]:C[-6],2,0) -> blp\suitItem\02 (5) .blp | W16: 1 | X16: Purchasable | Y16: 1000 | Z16: 236 | AA16: 0 | AB16: 0 | AC16: 0 | AL16: 1 | AN16: 0
A17: OBJECT | B17: =属性表!R[-1]C[3]&属性表!R[-1]C[4] -> 卫士战靴 | C17: SY0F | D17: =属性表!R[-1]C[-2] -> 1 | E17: srbd | F17: 卫士 | G17: =属性表!R[-1]C[26] -> |cFF999999[1级]卫士战靴|r | H17: =属性表!R[-1]C[26] -> |cFFFFFF99基础属性|r|n敏捷:16000 | I17: =RC[-2] -> |cFF999999[1级]卫士战靴|r | J17: =RC[-2] -> |cFFFFFF99基础属性|r|n敏捷:16000 | L17: =VLOOKUP(RC[-10],图标表!C[-7]:C[-6],2,0) -> blp\suitItem\02 (6) .blp | W17: 1 | X17: Purchasable | Y17: 1000 | Z17: 236 | AA17: 0 | AB17: 0 | AC17: 0 | AL17: 1 | AN17: 0
A18: OBJECT | B18: =属性表!R[-1]C[3]&属性表!R[-1]C[4] -> 卫士腰带 | C18: SY0G | D18: =属性表!R[-1]C[-2] -> 1 | E18: srbd | F18: 卫士 | G18: =属性表!R[-1]C[26] -> |cFF999999[1级]卫士腰带|r | H18: =属性表!R[-1]C[26] -> |n|cFFFFFF55附加属性|r(%)|n攻速:20 | I18: =RC[-2] -> |cFF999999[1级]卫士腰带|r | J18: =RC[-2] -> |n|cFFFFFF55附加属性|r(%)|n攻速:20 | L18: =VLOOKUP(RC[-10],图标表!C[-7]:C[-6],2,0) -> blp\suitItem\02 (7) .blp | W18: 1 | X18: Purchasable | Y18: 1000 | Z18: 236 | AA18: 0 | AB18: 0 | AC18: 0 | AL18: 1 | AN18: 0
A19: OBJECT | B19: =属性表!R[-1]C[3]&属性表!R[-1]C[4] -> 狩猎长刃 | C19: SY0H | D19: =属性表!R[-1]C[-2] -> 2 | E19: srbd | F19: 狩猎 | G19: =属性表!R[-1]C[26] -> |cFF99FF66[2级]狩猎长刃|r | H19: =属性表!R[-1]C[26] -> |cFFFFFF99基础属性|r|n攻击:96000 | I19: =RC[-2] -> |cFF99FF66[2级]狩猎长刃|r | J19: =RC[-2] -> |cFFFFFF99基础属性|r|n攻击:96000 | L19: =VLOOKUP(RC[-10],图标表!C[-7]:C[-6],2,0) -> blp\suitItem\03 (8) .blp | W19: 1 | X19: Purchasable | Y19: 5000 | Z19: 236 | AA19: 0 | AB19: 0 | AC19: 0 | AL19: 1 | AN19: 0
A20: OBJECT | B20: =属性表!R[-1]C[3]&属性表!R[-1]C[4] -> 狩猎胸甲 | C20: SY0I | D20: =属性表!R[-1]C[-2] -> 2 | E20: srbd | F20: 狩猎 | G20: =属性表!R[-1]C[26] -> |cFF99FF66[2级]狩猎胸甲|r | H20: =属性表!R[-1]C[26] -> |cFFFFFF99基础属性|r|n血量:320000 | I20: =RC[-2] -> |cFF99FF66[2级]狩猎胸甲|r | J20: =RC[-2] -> |cFFFFFF99基础属性|r|n血量:320000 | L20: =VLOOKUP(RC[-10],图标表!C[-7]:C[-6],2,0) -> blp\suitItem\03 (1) .blp | W20: 1 | X20: Purchasable | Y20: 5000 | Z20: 236 | AA20: 0 | AB20: 0 | AC20: 0 | AL20: 1 | AN20: 0
A21: OBJECT | B21: =属性表!R[-1]C[3]&属性表!R[-1]C[4] -> 狩猎护手 | C21: SY0J | D21: =属性表!R[-1]C[-2] -> 2 | E21: srbd | F21: 狩猎 | G21: =属性表!R[-1]C[26] -> |cFF99FF66[2级]狩猎护手|r | H21: =属性表!R[-1]C[26] -> |cFFFFFF99基础属性|r|n力量:25600|n敏捷:25600|n智力:25600 | I21: =RC[-2] -> |cFF99FF66[2级]狩猎护手|r | J21: =RC[-2] -> |cFFFFFF99基础属性|r|n力量:25600|n敏捷:25600|n智力:25600 | L21: =VLOOKUP(RC[-10],图标表!C[-7]:C[-6],2,0) -> blp\suitItem\03 (2) .blp | W21: 1 | X21: Purchasable | Y21: 5000 | Z21: 236 | AA21: 0 | AB21: 0 | AC21: 0 | AL21: 1 | AN21: 0
A22: OBJECT | B22: =属性表!R[-1]C[3]&属性表!R[-1]C[4] -> 狩猎护肩 | C22: SY0K | D22: =属性表!R[-1]C[-2] -> 2 | E22: srbd | F22: 狩猎 | G22: =属性表!R[-1]C[26] -> |cFF99FF66[2级]狩猎护肩|r | H22: =属性表!R[-1]C[26] -> |cFFFFFF99基础属性|r|n力量:51200 | I22: =RC[-2] -> |cFF99FF66[2级]狩猎护肩|r | J22: =RC[-2] -> |cFFFFFF99基础属性|r|n力量:51200 | L22: =VLOOKUP(RC[-10],图标表!C[-7]:C[-6],2,0) -> blp\suitItem\03 (3) .blp | W22: 1 | X22: Purchasable | Y22: 5000 | Z22: 236 | AA22: 0 | AB22: 0 | AC22: 0 | AL22: 1 | AN22: 0
A23: OBJECT | B23: =属性表!R[-1]C[3]&属性表!R[-1]C[4] -> 狩猎腿甲 | C23: SY0L | D23: =属性表!R[-1]C[-2] -> 2 | E23: srbd | F23: 狩猎 | G23: =属性表!R[-1]C[26] -> |cFF99FF66[2级]狩猎腿甲|r | H23: =属性表!R[-1]C[26] -> |cFFFFFF99基础属性|r|n护甲:6500 | I23: =RC[-2] -> |cFF99FF66[2级]狩猎腿甲|r | J23: =RC[-2] -> |cFFFFFF99基础属性|r|n护甲:6500 | L23: =VLOOKUP(RC[-10],图标表!C[-7]:C[-6],2,0) -> blp\suitItem\03 (4) .blp | W23: 1 | X23: Purchasable | Y23: 5000 | Z23: 236 | AA23: 0 | AB23: 0 | AC23: 0 | AL23: 1 | AN23: 0
A24: OBJECT | B24: =属性表!R[-1]C[3]&属性表!R[-1]C[4] -> 狩猎头饰 | C24: SY0M | D24: =属性表!R[-1]C[-2] -> 2 | E24: srbd | F24: 狩猎 | G24: =属性表!R[-1]C[26] -> |cFF99FF66[2级]狩猎头饰|r | H24: =属性表!R[-1]C[26] -> |cFFFFFF99基础属性|r|n智力:51200 | I24: =RC[-2] -> |cFF99FF66[2级]狩猎头饰|r | J24: =RC[-2] -> |cFFFFFF99基础属性|r|n智力:51200 | L24: =VLOOKUP(RC[-10],图标表!C[-7]:C[-6],2,0) -> blp\suitItem\03 (5) .blp | W24: 1 | X24: Purchasable | Y24: 5000 | Z24: 236 | AA24: 0 | AB24: 0 | AC24: 0 | AL24: 1 | AN24: 0
A25: OBJECT | B25: =属性表!R[-1]C[3]&属性表!R[-1]C[4] -> 狩猎战靴 | C25: SY0N | D25: =属性表!R[-1]C[-2] -> 2 | E25: srbd | F25: 狩猎 | G25: =属性表!R[-1]C[26] -> |cFF99FF66[2级]狩猎战靴|r | H25: =属性表!R[-1]C[26] -> |cFFFFFF99基础属性|r|n敏捷:51200 | I25: =RC[-2] -> |cFF99FF66[2级]狩猎战靴|r | J25: =RC[-2] -> |cFFFFFF99基础属性|r|n敏捷:51200 | L25: =VLOOKUP(RC[-10],图标表!C[-7]:C[-6],2,0) -> blp\suitItem\03 (6) .blp | W25: 1 | X25: Purchasable | Y25: 5000 | Z25: 236 | AA25: 0 | AB25: 0 | AC25: 0 | AL25: 1 | AN25: 0
A26: OBJECT | B26: =属性表!R[-1]C[3]&属性表!R[-1]C[4] -> 狩猎腰带 | C26: SY0O | D26: =属性表!R[-1]C[-2] -> 2 | E26: srbd | F26: 狩猎 | G26: =属性表!R[-1]C[26] -> |cFF99FF66[2级]狩猎腰带|r | H26: =属性表!R[-1]C[26] -> |n|cFFFFFF55附加属性|r(%)|n攻速:26 | I26: =RC[-2] -> |cFF99FF66[2级]狩猎腰带|r | J26: =RC[-2] -> |n|cFFFFFF55附加属性|r(%)|n攻速:26 | L26: =VLOOKUP(RC[-10],图标表!C[-7]:C[-6],2,0) -> blp\suitItem\03 (7) .blp | W26: 1 | X26: Purchasable | Y26: 5000 | Z26: 236 | AA26: 0 | AB26: 0 | AC26: 0 | AL26: 1 | AN26: 0
A27: OBJECT | B27: =属性表!R[-1]C[3]&属性表!R[-1]C[4] -> 赤血长刃 | C27: SY0P | D27: =属性表!R[-1]C[-2] -> 2 | E27: srbd | F27: 赤血 | G27: =属性表!R[-1]C[26] -> |cFF99FF66[2级]赤血长刃|r | H27: =属性表!R[-1]C[26] -> |cFFFFFF99基础属性|r|n攻击:96000 | I27: =RC[-2] -> |cFF99FF66[2级]赤血长刃|r | J27: =RC[-2] -> |cFFFFFF99基础属性|r|n攻击:96000 | L27: =VLOOKUP(RC[-10],图标表!C[-7]:C[-6],2,0) -> blp\suitItem\04 (8) .blp | W27: 1 | X27: Purchasable | Y27: 5000 | Z27: 236 | AA27: 0 | AB27: 0 | AC27: 0 | AL27: 1 | AN27: 0
A28: OBJECT | B28: =属性表!R[-1]C[3]&属性表!R[-1]C[4] -> 赤血胸甲 | C28: SY0Q | D28: =属性表!R[-1]C[-2] -> 2 | E28: srbd | F28: 赤血 | G28: =属性表!R[-1]C[26] -> |cFF99FF66[2级]赤血胸甲|r | H28: =属性表!R[-1]C[26] -> |cFFFFFF99基础属性|r|n血量:320000 | I28: =RC[-2] -> |cFF99FF66[2级]赤血胸甲|r | J28: =RC[-2] -> |cFFFFFF99基础属性|r|n血量:320000 | L28: =VLOOKUP(RC[-10],图标表!C[-7]:C[-6],2,0) -> blp\suitItem\04 (1) .blp | W28: 1 | X28: Purchasable | Y28: 5000 | Z28: 236 | AA28: 0 | AB28: 0 | AC28: 0 | AL28: 1 | AN28: 0
A29: OBJECT | B29: =属性表!R[-1]C[3]&属性表!R[-1]C[4] -> 赤血护手 | C29: SY0R | D29: =属性表!R[-1]C[-2] -> 2 | E29: srbd | F29: 赤血 | G29: =属性表!R[-1]C[26] -> |cFF99FF66[2级]赤血护手|r | H29: =属性表!R[-1]C[26] -> |cFFFFFF99基础属性|r|n力量:25600|n敏捷:25600|n智力:25600 | I29: =RC[-2] -> |cFF99FF66[2级]赤血护手|r | J29: =RC[-2] -> |cFFFFFF99基础属性|r|n力量:25600|n敏捷:25600|n智力:25600 | L29: =VLOOKUP(RC[-10],图标表!C[-7]:C[-6],2,0) -> blp\suitItem\04 (2) .blp | W29: 1 | X29: Purchasable | Y29: 5000 | Z29: 236 | AA29: 0 | AB29: 0 | AC29: 0 | AL29: 1 | AN29: 0
A30: OBJECT | B30: =属性表!R[-1]C[3]&属性表!R[-1]C[4] -> 赤血护肩 | C30: SY0S | D30: =属性表!R[-1]C[-2] -> 2 | E30: srbd | F30: 赤血 | G30: =属性表!R[-1]C[26] -> |cFF99FF66[2级]赤血护肩|r | H30: =属性表!R[-1]C[26] -> |cFFFFFF99基础属性|r|n力量:51200 | I30: =RC[-2] -> |cFF99FF66[2级]赤血护肩|r | J30: =RC[-2] -> |cFFFFFF99基础属性|r|n力量:51200 | L30: =VLOOKUP(RC[-10],图标表!C[-7]:C[-6],2,0) -> blp\suitItem\04 (3) .blp | W30: 1 | X30: Purchasable | Y30: 5000 | Z30: 236 | AA30: 0 | AB30: 0 | AC30: 0 | AL30: 1 | AN30: 0
A31: OBJECT | B31: =属性表!R[-1]C[3]&属性表!R[-1]C[4] -> 赤血腿甲 | C31: SY0T | D31: =属性表!R[-1]C[-2] -> 2 | E31: srbd | F31: 赤血 | G31: =属性表!R[-1]C[26] -> |cFF99FF66[2级]赤血腿甲|r | H31: =属性表!R[-1]C[26] -> |cFFFFFF99基础属性|r|n护甲:6500 | I31: =RC[-2] -> |cFF99FF66[2级]赤血腿甲|r | J31: =RC[-2] -> |cFFFFFF99基础属性|r|n护甲:6500 | L31: =VLOOKUP(RC[-10],图标表!C[-7]:C[-6],2,0) -> blp\suitItem\04 (4) .blp | W31: 1 | X31: Purchasable | Y31: 5000 | Z31: 236 | AA31: 0 | AB31: 0 | AC31: 0 | AL31: 1 | AN31: 0
A32: OBJECT | B32: =属性表!R[-1]C[3]&属性表!R[-1]C[4] -> 赤血头饰 | C32: SY0U | D32: =属性表!R[-1]C[-2] -> 2 | E32: srbd | F32: 赤血 | G32: =属性表!R[-1]C[26] -> |cFF99FF66[2级]赤血头饰|r | H32: =属性表!R[-1]C[26] -> |cFFFFFF99基础属性|r|n智力:51200 | I32: =RC[-2] -> |cFF99FF66[2级]赤血头饰|r | J32: =RC[-2] -> |cFFFFFF99基础属性|r|n智力:51200 | L32: =VLOOKUP(RC[-10],图标表!C[-7]:C[-6],2,0) -> blp\suitItem\04 (5) .blp | W32: 1 | X32: Purchasable | Y32: 5000 | Z32: 236 | AA32: 0 | AB32: 0 | AC32: 0 | AL32: 1 | AN32: 0
A33: OBJECT | B33: =属性表!R[-1]C[3]&属性表!R[-1]C[4] -> 赤血战靴 | C33: SY0V | D33: =属性表!R[-1]C[-2] -> 2 | E33: srbd | F33: 赤血 | G33: =属性表!R[-1]C[26] -> |cFF99FF66[2级]赤血战靴|r | H33: =属性表!R[-1]C[26] -> |cFFFFFF99基础属性|r|n敏捷:51200 | I33: =RC[-2] -> |cFF99FF66[2级]赤血战靴|r | J33: =RC[-2] -> |cFFFFFF99基础属性|r|n敏捷:51200 | L33: =VLOOKUP(RC[-10],图标表!C[-7]:C[-6],2,0) -> blp\suitItem\04 (6) .blp | W33: 1 | X33: Purchasable | Y33: 5000 | Z33: 236 | AA33: 0 | AB33: 0 | AC33: 0 | AL33: 1 | AN33: 0
A34: OBJECT | B34: =属性表!R[-1]C[3]&属性表!R[-1]C[4] -> 赤血腰带 | C34: SY0W | D34: =属性表!R[-1]C[-2] -> 2 | E34: srbd | F34: 赤血 | G34: =属性表!R[-1]C[26] -> |cFF99FF66[2级]赤血腰带|r | H34: =属性表!R[-1]C[26] -> |n|cFFFFFF55附加属性|r(%)|n攻速:26 | I34: =RC[-2] -> |cFF99FF66[2级]赤血腰带|r | J34: =RC[-2] -> |n|cFFFFFF55附加属性|r(%)|n攻速:26 | L34: =VLOOKUP(RC[-10],图标表!C[-7]:C[-6],2,0) -> blp\suitItem\04 (7) .blp | W34: 1 | X34: Purchasable | Y34: 5000 | Z34: 236 | AA34: 0 | AB34: 0 | AC34: 0 | AL34: 1 | AN34: 0
A35: OBJECT | B35: =属性表!R[-1]C[3]&属性表!R[-1]C[4] -> 骑士长刃 | C35: SY0X | D35: =属性表!R[-1]C[-2] -> 3 | E35: srbd | F35: 骑士 | G35: =属性表!R[-1]C[26] -> |cFF1BE6B8[3级]骑士长刃|r | H35: =属性表!R[-1]C[26] -> |cFFFFFF99基础属性|r|n攻击:307200 | I35: =RC[-2] -> |cFF1BE6B8[3级]骑士长刃|r | J35: =RC[-2] -> |cFFFFFF99基础属性|r|n攻击:307200 | L35: =VLOOKUP(RC[-10],图标表!C[-7]:C[-6],2,0) -> blp\suitItem\05 (8) .blp | W35: 1 | X35: Purchasable | Y35: 0 | Z35: 236 | AA35: 0 | AB35: 0 | AC35: 2 | AL35: 1 | AN35: 0
A36: OBJECT | B36: =属性表!R[-1]C[3]&属性表!R[-1]C[4] -> 骑士胸甲 | C36: SY0Y | D36: =属性表!R[-1]C[-2] -> 3 | E36: srbd | F36: 骑士 | G36: =属性表!R[-1]C[26] -> |cFF1BE6B8[3级]骑士胸甲|r | H36: =属性表!R[-1]C[26] -> |cFFFFFF99基础属性|r|n血量:1024000 | I36: =RC[-2] -> |cFF1BE6B8[3级]骑士胸甲|r | J36: =RC[-2] -> |cFFFFFF99基础属性|r|n血量:1024000 | L36: =VLOOKUP(RC[-10],图标表!C[-7]:C[-6],2,0) -> blp\suitItem\05 (1) .blp | W36: 1 | X36: Purchasable | Y36: 0 | Z36: 236 | AA36: 0 | AB36: 0 | AC36: 2 | AL36: 1 | AN36: 0
A37: OBJECT | B37: =属性表!R[-1]C[3]&属性表!R[-1]C[4] -> 骑士护手 | C37: SY0Z | D37: =属性表!R[-1]C[-2] -> 3 | E37: srbd | F37: 骑士 | G37: =属性表!R[-1]C[26] -> |cFF1BE6B8[3级]骑士护手|r | H37: =属性表!R[-1]C[26] -> |cFFFFFF99基础属性|r|n力量:81920|n敏捷:81920|n智力:81920 | I37: =RC[-2] -> |cFF1BE6B8[3级]骑士护手|r | J37: =RC[-2] -> |cFFFFFF99基础属性|r|n力量:81920|n敏捷:81920|n智力:81920 | L37: =VLOOKUP(RC[-10],图标表!C[-7]:C[-6],2,0) -> blp\suitItem\05 (2) .blp | W37: 1 | X37: Purchasable | Y37: 0 | Z37: 236 | AA37: 0 | AB37: 0 | AC37: 2 | AL37: 1 | AN37: 0
A38: OBJECT | B38: =属性表!R[-1]C[3]&属性表!R[-1]C[4] -> 骑士护肩 | C38: SY10 | D38: =属性表!R[-1]C[-2] -> 3 | E38: srbd | F38: 骑士 | G38: =属性表!R[-1]C[26] -> |cFF1BE6B8[3级]骑士护肩|r | H38: =属性表!R[-1]C[26] -> |cFFFFFF99基础属性|r|n力量:163840 | I38: =RC[-2] -> |cFF1BE6B8[3级]骑士护肩|r | J38: =RC[-2] -> |cFFFFFF99基础属性|r|n力量:163840 | L38: =VLOOKUP(RC[-10],图标表!C[-7]:C[-6],2,0) -> blp\suitItem\05 (3) .blp | W38: 1 | X38: Purchasable | Y38: 0 | Z38: 236 | AA38: 0 | AB38: 0 | AC38: 2 | AL38: 1 | AN38: 0
A39: OBJECT | B39: =属性表!R[-1]C[3]&属性表!R[-1]C[4] -> 骑士腿甲 | C39: SY11 | D39: =属性表!R[-1]C[-2] -> 3 | E39: srbd | F39: 骑士 | G39: =属性表!R[-1]C[26] -> |cFF1BE6B8[3级]骑士腿甲|r | H39: =属性表!R[-1]C[26] -> |cFFFFFF99基础属性|r|n护甲:8450 | I39: =RC[-2] -> |cFF1BE6B8[3级]骑士腿甲|r | J39: =RC[-2] -> |cFFFFFF99基础属性|r|n护甲:8450 | L39: =VLOOKUP(RC[-10],图标表!C[-7]:C[-6],2,0) -> blp\suitItem\05 (4) .blp | W39: 1 | X39: Purchasable | Y39: 0 | Z39: 236 | AA39: 0 | AB39: 0 | AC39: 2 | AL39: 1 | AN39: 0
A40: OBJECT | B40: =属性表!R[-1]C[3]&属性表!R[-1]C[4] -> 骑士头饰 | C40: SY12 | D40: =属性表!R[-1]C[-2] -> 3 | E40: srbd | F40: 骑士 | G40: =属性表!R[-1]C[26] -> |cFF1BE6B8[3级]骑士头饰|r | H40: =属性表!R[-1]C[26] -> |cFFFFFF99基础属性|r|n智力:163840 | I40: =RC[-2] -> |cFF1BE6B8[3级]骑士头饰|r | J40: =RC[-2] -> |cFFFFFF99基础属性|r|n智力:163840 | L40: =VLOOKUP(RC[-10],图标表!C[-7]:C[-6],2,0) -> blp\suitItem\05 (5) .blp | W40: 1 | X40: Purchasable | Y40: 0 | Z40: 236 | AA40: 0 | AB40: 0 | AC40: 2 | AL40: 1 | AN40: 0
A41: OBJECT | B41: =属性表!R[-1]C[3]&属性表!R[-1]C[4] -> 骑士战靴 | C41: SY13 | D41: =属性表!R[-1]C[-2] -> 3 | E41: srbd | F41: 骑士 | G41: =属性表!R[-1]C[26] -> |cFF1BE6B8[3级]骑士战靴|r | H41: =属性表!R[-1]C[26] -> |cFFFFFF99基础属性|r|n敏捷:163840 | I41: =RC[-2] -> |cFF1BE6B8[3级]骑士战靴|r | J41: =RC[-2] -> |cFFFFFF99基础属性|r|n敏捷:163840 | L41: =VLOOKUP(RC[-10],图标表!C[-7]:C[-6],2,0) -> blp\suitItem\05 (6) .blp | W41: 1 | X41: Purchasable | Y41: 0 | Z41: 236 | AA41: 0 | AB41: 0 | AC41: 2 | AL41: 1 | AN41: 0
A42: OBJECT | B42: =属性表!R[-1]C[3]&属性表!R[-1]C[4] -> 骑士腰带 | C42: SY14 | D42: =属性表!R[-1]C[-2] -> 3 | E42: srbd | F42: 骑士 | G42: =属性表!R[-1]C[26] -> |cFF1BE6B8[3级]骑士腰带|r | H42: =属性表!R[-1]C[26] -> |n|cFFFFFF55附加属性|r(%)|n攻速:33 | I42: =RC[-2] -> |cFF1BE6B8[3级]骑士腰带|r | J42: =RC[-2] -> |n|cFFFFFF55附加属性|r(%)|n攻速:33 | L42: =VLOOKUP(RC[-10],图标表!C[-7]:C[-6],2,0) -> blp\suitItem\05 (7) .blp | W42: 1 | X42: Purchasable | Y42: 0 | Z42: 236 | AA42: 0 | AB42: 0 | AC42: 2 | AL42: 1 | AN42: 0
A43: OBJECT | B43: =属性表!R[-1]C[3]&属性表!R[-1]C[4] -> 领主长刃 | C43: SY15 | D43: =属性表!R[-1]C[-2] -> 3 | E43: srbd | F43: 领主 | G43: =属性表!R[-1]C[26] -> |cFF1BE6B8[3级]领主长刃|r | H43: =属性表!R[-1]C[26] -> |cFFFFFF99基础属性|r|n攻击:307200 | I43: =RC[-2] -> |cFF1BE6B8[3级]领主长刃|r | J43: =RC[-2] -> |cFFFFFF99基础属性|r|n攻击:307200 | L43: =VLOOKUP(RC[-10],图标表!C[-7]:C[-6],2,0) -> blp\suitItem\06 (8) .blp | W43: 1 | X43: Purchasable | Y43: 0 | Z43: 236 | AA43: 0 | AB43: 0 | AC43: 2 | AL43: 1 | AN43: 0
A44: OBJECT | B44: =属性表!R[-1]C[3]&属性表!R[-1]C[4] -> 领主胸甲 | C44: SY16 | D44: =属性表!R[-1]C[-2] -> 3 | E44: srbd | F44: 领主 | G44: =属性表!R[-1]C[26] -> |cFF1BE6B8[3级]领主胸甲|r | H44: =属性表!R[-1]C[26] -> |cFFFFFF99基础属性|r|n血量:1024000 | I44: =RC[-2] -> |cFF1BE6B8[3级]领主胸甲|r | J44: =RC[-2] -> |cFFFFFF99基础属性|r|n血量:1024000 | L44: =VLOOKUP(RC[-10],图标表!C[-7]:C[-6],2,0) -> blp\suitItem\06 (1) .blp | W44: 1 | X44: Purchasable | Y44: 0 | Z44: 236 | AA44: 0 | AB44: 0 | AC44: 2 | AL44: 1 | AN44: 0
A45: OBJECT | B45: =属性表!R[-1]C[3]&属性表!R[-1]C[4] -> 领主护手 | C45: SY17 | D45: =属性表!R[-1]C[-2] -> 3 | E45: srbd | F45: 领主 | G45: =属性表!R[-1]C[26] -> |cFF1BE6B8[3级]领主护手|r | H45: =属性表!R[-1]C[26] -> |cFFFFFF99基础属性|r|n力量:81920|n敏捷:81920|n智力:81920 | I45: =RC[-2] -> |cFF1BE6B8[3级]领主护手|r | J45: =RC[-2] -> |cFFFFFF99基础属性|r|n力量:81920|n敏捷:81920|n智力:81920 | L45: =VLOOKUP(RC[-10],图标表!C[-7]:C[-6],2,0) -> blp\suitItem\06 (2) .blp | W45: 1 | X45: Purchasable | Y45: 0 | Z45: 236 | AA45: 0 | AB45: 0 | AC45: 2 | AL45: 1 | AN45: 0
A46: OBJECT | B46: =属性表!R[-1]C[3]&属性表!R[-1]C[4] -> 领主护肩 | C46: SY18 | D46: =属性表!R[-1]C[-2] -> 3 | E46: srbd | F46: 领主 | G46: =属性表!R[-1]C[26] -> |cFF1BE6B8[3级]领主护肩|r | H46: =属性表!R[-1]C[26] -> |cFFFFFF99基础属性|r|n力量:163840 | I46: =RC[-2] -> |cFF1BE6B8[3级]领主护肩|r | J46: =RC[-2] -> |cFFFFFF99基础属性|r|n力量:163840 | L46: =VLOOKUP(RC[-10],图标表!C[-7]:C[-6],2,0) -> blp\suitItem\06 (3) .blp | W46: 1 | X46: Purchasable | Y46: 0 | Z46: 236 | AA46: 0 | AB46: 0 | AC46: 2 | AL46: 1 | AN46: 0
A47: OBJECT | B47: =属性表!R[-1]C[3]&属性表!R[-1]C[4] -> 领主腿甲 | C47: SY19 | D47: =属性表!R[-1]C[-2] -> 3 | E47: srbd | F47: 领主 | G47: =属性表!R[-1]C[26] -> |cFF1BE6B8[3级]领主腿甲|r | H47: =属性表!R[-1]C[26] -> |cFFFFFF99基础属性|r|n护甲:8450 | I47: =RC[-2] -> |cFF1BE6B8[3级]领主腿甲|r | J47: =RC[-2] -> |cFFFFFF99基础属性|r|n护甲:8450 | L47: =VLOOKUP(RC[-10],图标表!C[-7]:C[-6],2,0) -> blp\suitItem\06 (4) .blp | W47: 1 | X47: Purchasable | Y47: 0 | Z47: 236 | AA47: 0 | AB47: 0 | AC47: 2 | AL47: 1 | AN47: 0
A48: OBJECT | B48: =属性表!R[-1]C[3]&属性表!R[-1]C[4] -> 领主头饰 | C48: SY1A | D48: =属性表!R[-1]C[-2] -> 3 | E48: srbd | F48: 领主 | G48: =属性表!R[-1]C[26] -> |cFF1BE6B8[3级]领主头饰|r | H48: =属性表!R[-1]C[26] -> |cFFFFFF99基础属性|r|n智力:163840 | I48: =RC[-2] -> |cFF1BE6B8[3级]领主头饰|r | J48: =RC[-2] -> |cFFFFFF99基础属性|r|n智力:163840 | L48: =VLOOKUP(RC[-10],图标表!C[-7]:C[-6],2,0) -> blp\suitItem\06 (5) .blp | W48: 1 | X48: Purchasable | Y48: 0 | Z48: 236 | AA48: 0 | AB48: 0 | AC48: 2 | AL48: 1 | AN48: 0
A49: OBJECT | B49: =属性表!R[-1]C[3]&属性表!R[-1]C[4] -> 领主战靴 | C49: SY1B | D49: =属性表!R[-1]C[-2] -> 3 | E49: srbd | F49: 领主 | G49: =属性表!R[-1]C[26] -> |cFF1BE6B8[3级]领主战靴|r | H49: =属性表!R[-1]C[26] -> |cFFFFFF99基础属性|r|n敏捷:163840 | I49: =RC[-2] -> |cFF1BE6B8[3级]领主战靴|r | J49: =RC[-2] -> |cFFFFFF99基础属性|r|n敏捷:163840 | L49: =VLOOKUP(RC[-10],图标表!C[-7]:C[-6],2,0) -> blp\suitItem\06 (6) .blp | W49: 1 | X49: Purchasable | Y49: 0 | Z49: 236 | AA49: 0 | AB49: 0 | AC49: 2 | AL49: 1 | AN49: 0
A50: OBJECT | B50: =属性表!R[-1]C[3]&属性表!R[-1]C[4] -> 领主腰带 | C50: SY1C | D50: =属性表!R[-1]C[-2] -> 3 | E50: srbd | F50: 领主 | G50: =属性表!R[-1]C[26] -> |cFF1BE6B8[3级]领主腰带|r | H50: =属性表!R[-1]C[26] -> |n|cFFFFFF55附加属性|r(%)|n攻速:33 | I50: =RC[-2] -> |cFF1BE6B8[3级]领主腰带|r | J50: =RC[-2] -> |n|cFFFFFF55附加属性|r(%)|n攻速:33 | L50: =VLOOKUP(RC[-10],图标表!C[-7]:C[-6],2,0) -> blp\suitItem\06 (7) .blp | W50: 1 | X50: Purchasable | Y50: 0 | Z50: 236 | AA50: 0 | AB50: 0 | AC50: 2 | AL50: 1 | AN50: 0
A51: OBJECT | B51: =属性表!R[-1]C[3]&属性表!R[-1]C[4] -> 战神长刃 | C51: SY1D | D51: =属性表!R[-1]C[-2] -> 4 | E51: srbd | F51: 战神 | G51: =属性表!R[-1]C[26] -> |cFF33FF00[4级]战神长刃|r | H51: =属性表!R[-1]C[26] -> |cFFFFFF99基础属性|r|n攻击:983040 | I51: =RC[-2] -> |cFF33FF00[4级]战神长刃|r | J51: =RC[-2] -> |cFFFFFF99基础属性|r|n攻击:983040 | L51: =VLOOKUP(RC[-10],图标表!C[-7]:C[-6],2,0) -> blp\suitItem\07 (8) .blp | W51: 1 | X51: Purchasable | Y51: 0 | Z51: 236 | AA51: 0 | AB51: 0 | AC51: 4 | AL51: 1 | AN51: 0
A52: OBJECT | B52: =属性表!R[-1]C[3]&属性表!R[-1]C[4] -> 战神胸甲 | C52: SY1E | D52: =属性表!R[-1]C[-2] -> 4 | E52: srbd | F52: 战神 | G52: =属性表!R[-1]C[26] -> |cFF33FF00[4级]战神胸甲|r | H52: =属性表!R[-1]C[26] -> |cFFFFFF99基础属性|r|n血量:3276800 | I52: =RC[-2] -> |cFF33FF00[4级]战神胸甲|r | J52: =RC[-2] -> |cFFFFFF99基础属性|r|n血量:3276800 | L52: =VLOOKUP(RC[-10],图标表!C[-7]:C[-6],2,0) -> blp\suitItem\07 (1) .blp | W52: 1 | X52: Purchasable | Y52: 0 | Z52: 236 | AA52: 0 | AB52: 0 | AC52: 4 | AL52: 1 | AN52: 0
A53: OBJECT | B53: =属性表!R[-1]C[3]&属性表!R[-1]C[4] -> 战神护手 | C53: SY1F | D53: =属性表!R[-1]C[-2] -> 4 | E53: srbd | F53: 战神 | G53: =属性表!R[-1]C[26] -> |cFF33FF00[4级]战神护手|r | H53: =属性表!R[-1]C[26] -> |cFFFFFF99基础属性|r|n力量:262144|n敏捷:262144|n智力:262144 | I53: =RC[-2] -> |cFF33FF00[4级]战神护手|r | J53: =RC[-2] -> |cFFFFFF99基础属性|r|n力量:262144|n敏捷:262144|n智力:262144 | L53: =VLOOKUP(RC[-10],图标表!C[-7]:C[-6],2,0) -> blp\suitItem\07 (2) .blp | W53: 1 | X53: Purchasable | Y53: 0 | Z53: 236 | AA53: 0 | AB53: 0 | AC53: 4 | AL53: 1 | AN53: 0
A54: OBJECT | B54: =属性表!R[-1]C[3]&属性表!R[-1]C[4] -> 战神护肩 | C54: SY1G | D54: =属性表!R[-1]C[-2] -> 4 | E54: srbd | F54: 战神 | G54: =属性表!R[-1]C[26] -> |cFF33FF00[4级]战神护肩|r | H54: =属性表!R[-1]C[26] -> |cFFFFFF99基础属性|r|n力量:524288 | I54: =RC[-2] -> |cFF33FF00[4级]战神护肩|r | J54: =RC[-2] -> |cFFFFFF99基础属性|r|n力量:524288 | L54: =VLOOKUP(RC[-10],图标表!C[-7]:C[-6],2,0) -> blp\suitItem\07 (3) .blp | W54: 1 | X54: Purchasable | Y54: 0 | Z54: 236 | AA54: 0 | AB54: 0 | AC54: 4 | AL54: 1 | AN54: 0
A55: OBJECT | B55: =属性表!R[-1]C[3]&属性表!R[-1]C[4] -> 战神腿甲 | C55: SY1H | D55: =属性表!R[-1]C[-2] -> 4 | E55: srbd | F55: 战神 | G55: =属性表!R[-1]C[26] -> |cFF33FF00[4级]战神腿甲|r | H55: =属性表!R[-1]C[26] -> |cFFFFFF99基础属性|r|n护甲:10985 | I55: =RC[-2] -> |cFF33FF00[4级]战神腿甲|r | J55: =RC[-2] -> |cFFFFFF99基础属性|r|n护甲:10985 | L55: =VLOOKUP(RC[-10],图标表!C[-7]:C[-6],2,0) -> blp\suitItem\07 (4) .blp | W55: 1 | X55: Purchasable | Y55: 0 | Z55: 236 | AA55: 0 | AB55: 0 | AC55: 4 | AL55: 1 | AN55: 0
A56: OBJECT | B56: =属性表!R[-1]C[3]&属性表!R[-1]C[4] -> 战神头饰 | C56: SY1I | D56: =属性表!R[-1]C[-2] -> 4 | E56: srbd | F56: 战神 | G56: =属性表!R[-1]C[26] -> |cFF33FF00[4级]战神头饰|r | H56: =属性表!R[-1]C[26] -> |cFFFFFF99基础属性|r|n智力:524288 | I56: =RC[-2] -> |cFF33FF00[4级]战神头饰|r | J56: =RC[-2] -> |cFFFFFF99基础属性|r|n智力:524288 | L56: =VLOOKUP(RC[-10],图标表!C[-7]:C[-6],2,0) -> blp\suitItem\07 (5) .blp | W56: 1 | X56: Purchasable | Y56: 0 | Z56: 236 | AA56: 0 | AB56: 0 | AC56: 4 | AL56: 1 | AN56: 0
A57: OBJECT | B57: =属性表!R[-1]C[3]&属性表!R[-1]C[4] -> 战神战靴 | C57: SY1J | D57: =属性表!R[-1]C[-2] -> 4 | E57: srbd | F57: 战神 | G57: =属性表!R[-1]C[26] -> |cFF33FF00[4级]战神战靴|r | H57: =属性表!R[-1]C[26] -> |cFFFFFF99基础属性|r|n敏捷:524288 | I57: =RC[-2] -> |cFF33FF00[4级]战神战靴|r | J57: =RC[-2] -> |cFFFFFF99基础属性|r|n敏捷:524288 | L57: =VLOOKUP(RC[-10],图标表!C[-7]:C[-6],2,0) -> blp\suitItem\07 (6) .blp | W57: 1 | X57: Purchasable | Y57: 0 | Z57: 236 | AA57: 0 | AB57: 0 | AC57: 4 | AL57: 1 | AN57: 0
A58: OBJECT | B58: =属性表!R[-1]C[3]&属性表!R[-1]C[4] -> 战神腰带 | C58: SY1K | D58: =属性表!R[-1]C[-2] -> 4 | E58: srbd | F58: 战神 | G58: =属性表!R[-1]C[26] -> |cFF33FF00[4级]战神腰带|r | H58: =属性表!R[-1]C[26] -> |n|cFFFFFF55附加属性|r(%)|n攻速:42 | I58: =RC[-2] -> |cFF33FF00[4级]战神腰带|r | J58: =RC[-2] -> |n|cFFFFFF55附加属性|r(%)|n攻速:42 | L58: =VLOOKUP(RC[-10],图标表!C[-7]:C[-6],2,0) -> blp\suitItem\07 (7) .blp | W58: 1 | X58: Purchasable | Y58: 0 | Z58: 236 | AA58: 0 | AB58: 0 | AC58: 4 | AL58: 1 | AN58: 0
A59: OBJECT | B59: =属性表!R[-1]C[3]&属性表!R[-1]C[4] -> 贤者长刃 | C59: SY1L | D59: =属性表!R[-1]C[-2] -> 4 | E59: srbd | F59: 贤者 | G59: =属性表!R[-1]C[26] -> |cFF33FF00[4级]贤者长刃|r | H59: =属性表!R[-1]C[26] -> |cFFFFFF99基础属性|r|n攻击:983040 | I59: =RC[-2] -> |cFF33FF00[4级]贤者长刃|r | J59: =RC[-2] -> |cFFFFFF99基础属性|r|n攻击:983040 | L59: =VLOOKUP(RC[-10],图标表!C[-7]:C[-6],2,0) -> blp\suitItem\08 (8) .blp | W59: 1 | X59: Purchasable | Y59: 0 | Z59: 236 | AA59: 0 | AB59: 0 | AC59: 4 | AL59: 1 | AN59: 0
A60: OBJECT | B60: =属性表!R[-1]C[3]&属性表!R[-1]C[4] -> 贤者胸甲 | C60: SY1M | D60: =属性表!R[-1]C[-2] -> 4 | E60: srbd | F60: 贤者 | G60: =属性表!R[-1]C[26] -> |cFF33FF00[4级]贤者胸甲|r | H60: =属性表!R[-1]C[26] -> |cFFFFFF99基础属性|r|n血量:3276800 | I60: =RC[-2] -> |cFF33FF00[4级]贤者胸甲|r | J60: =RC[-2] -> |cFFFFFF99基础属性|r|n血量:3276800 | L60: =VLOOKUP(RC[-10],图标表!C[-7]:C[-6],2,0) -> blp\suitItem\08 (1) .blp | W60: 1 | X60: Purchasable | Y60: 0 | Z60: 236 | AA60: 0 | AB60: 0 | AC60: 4 | AL60: 1 | AN60: 0
A61: OBJECT | B61: =属性表!R[-1]C[3]&属性表!R[-1]C[4] -> 贤者护手 | C61: SY1N | D61: =属性表!R[-1]C[-2] -> 4 | E61: srbd | F61: 贤者 | G61: =属性表!R[-1]C[26] -> |cFF33FF00[4级]贤者护手|r | H61: =属性表!R[-1]C[26] -> |cFFFFFF99基础属性|r|n力量:262144|n敏捷:262144|n智力:262144 | I61: =RC[-2] -> |cFF33FF00[4级]贤者护手|r | J61: =RC[-2] -> |cFFFFFF99基础属性|r|n力量:262144|n敏捷:262144|n智力:262144 | L61: =VLOOKUP(RC[-10],图标表!C[-7]:C[-6],2,0) -> blp\suitItem\08 (2) .blp | W61: 1 | X61: Purchasable | Y61: 0 | Z61: 236 | AA61: 0 | AB61: 0 | AC61: 4 | AL61: 1 | AN61: 0
A62: OBJECT | B62: =属性表!R[-1]C[3]&属性表!R[-1]C[4] -> 贤者护肩 | C62: SY1O | D62: =属性表!R[-1]C[-2] -> 4 | E62: srbd | F62: 贤者 | G62: =属性表!R[-1]C[26] -> |cFF33FF00[4级]贤者护肩|r | H62: =属性表!R[-1]C[26] -> |cFFFFFF99基础属性|r|n力量:524288 | I62: =RC[-2] -> |cFF33FF00[4级]贤者护肩|r | J62: =RC[-2] -> |cFFFFFF99基础属性|r|n力量:524288 | L62: =VLOOKUP(RC[-10],图标表!C[-7]:C[-6],2,0) -> blp\suitItem\08 (3) .blp | W62: 1 | X62: Purchasable | Y62: 0 | Z62: 236 | AA62: 0 | AB62: 0 | AC62: 4 | AL62: 1 | AN62: 0
A63: OBJECT | B63: =属性表!R[-1]C[3]&属性表!R[-1]C[4] -> 贤者腿甲 | C63: SY1P | D63: =属性表!R[-1]C[-2] -> 4 | E63: srbd | F63: 贤者 | G63: =属性表!R[-1]C[26] -> |cFF33FF00[4级]贤者腿甲|r | H63: =属性表!R[-1]C[26] -> |cFFFFFF99基础属性|r|n护甲:10985 | I63: =RC[-2] -> |cFF33FF00[4级]贤者腿甲|r | J63: =RC[-2] -> |cFFFFFF99基础属性|r|n护甲:10985 | L63: =VLOOKUP(RC[-10],图标表!C[-7]:C[-6],2,0) -> blp\suitItem\08 (4) .blp | W63: 1 | X63: Purchasable | Y63: 0 | Z63: 236 | AA63: 0 | AB63: 0 | AC63: 4 | AL63: 1 | AN63: 0
A64: OBJECT | B64: =属性表!R[-1]C[3]&属性表!R[-1]C[4] -> 贤者头饰 | C64: SY1Q | D64: =属性表!R[-1]C[-2] -> 4 | E64: srbd | F64: 贤者 | G64: =属性表!R[-1]C[26] -> |cFF33FF00[4级]贤者头饰|r | H64: =属性表!R[-1]C[26] -> |cFFFFFF99基础属性|r|n智力:524288 | I64: =RC[-2] -> |cFF33FF00[4级]贤者头饰|r | J64: =RC[-2] -> |cFFFFFF99基础属性|r|n智力:524288 | L64: =VLOOKUP(RC[-10],图标表!C[-7]:C[-6],2,0) -> blp\suitItem\08 (5) .blp | W64: 1 | X64: Purchasable | Y64: 0 | Z64: 236 | AA64: 0 | AB64: 0 | AC64: 4 | AL64: 1 | AN64: 0
A65: OBJECT | B65: =属性表!R[-1]C[3]&属性表!R[-1]C[4] -> 贤者战靴 | C65: SY1R | D65: =属性表!R[-1]C[-2] -> 4 | E65: srbd | F65: 贤者 | G65: =属性表!R[-1]C[26] -> |cFF33FF00[4级]贤者战靴|r | H65: =属性表!R[-1]C[26] -> |cFFFFFF99基础属性|r|n敏捷:524288 | I65: =RC[-2] -> |cFF33FF00[4级]贤者战靴|r | J65: =RC[-2] -> |cFFFFFF99基础属性|r|n敏捷:524288 | L65: =VLOOKUP(RC[-10],图标表!C[-7]:C[-6],2,0) -> blp\suitItem\08 (6) .blp | W65: 1 | X65: Purchasable | Y65: 0 | Z65: 236 | AA65: 0 | AB65: 0 | AC65: 4 | AL65: 1 | AN65: 0
A66: OBJECT | B66: =属性表!R[-1]C[3]&属性表!R[-1]C[4] -> 贤者腰带 | C66: SY1S | D66: =属性表!R[-1]C[-2] -> 4 | E66: srbd | F66: 贤者 | G66: =属性表!R[-1]C[26] -> |cFF33FF00[4级]贤者腰带|r | H66: =属性表!R[-1]C[26] -> |n|cFFFFFF55附加属性|r(%)|n攻速:42 | I66: =RC[-2] -> |cFF33FF00[4级]贤者腰带|r | J66: =RC[-2] -> |n|cFFFFFF55附加属性|r(%)|n攻速:42 | L66: =VLOOKUP(RC[-10],图标表!C[-7]:C[-6],2,0) -> blp\suitItem\08 (7) .blp | W66: 1 | X66: Purchasable | Y66: 0 | Z66: 236 | AA66: 0 | AB66: 0 | AC66: 4 | AL66: 1 | AN66: 0
A67: OBJECT | B67: =属性表!R[-1]C[3]&属性表!R[-1]C[4] -> 魔龙长刃 | C67: SY1T | D67: =属性表!R[-1]C[-2] -> 5 | E67: srbd | F67: 魔龙 | G67: =属性表!R[-1]C[26] -> |cFFFF9933[5级]魔龙长刃|r | H67: =属性表!R[-1]C[26] -> |cFFFFFF99基础属性|r|n攻击:3145728 | I67: =RC[-2] -> |cFFFF9933[5级]魔龙长刃|r | J67: =RC[-2] -> |cFFFFFF99基础属性|r|n攻击:3145728 | L67: =VLOOKUP(RC[-10],图标表!C[-7]:C[-6],2,0) -> blp\suitItem\09 (8) .blp | W67: 1 | X67: Purchasable | Y67: 0 | Z67: 236 | AA67: 0 | AB67: 0 | AC67: 8 | AL67: 1 | AN67: 0
A68: OBJECT | B68: =属性表!R[-1]C[3]&属性表!R[-1]C[4] -> 魔龙胸甲 | C68: SY1U | D68: =属性表!R[-1]C[-2] -> 5 | E68: srbd | F68: 魔龙 | G68: =属性表!R[-1]C[26] -> |cFFFF9933[5级]魔龙胸甲|r | H68: =属性表!R[-1]C[26] -> |cFFFFFF99基础属性|r|n血量:10485760 | I68: =RC[-2] -> |cFFFF9933[5级]魔龙胸甲|r | J68: =RC[-2] -> |cFFFFFF99基础属性|r|n血量:10485760 | L68: =VLOOKUP(RC[-10],图标表!C[-7]:C[-6],2,0) -> blp\suitItem\09 (1) .blp | W68: 1 | X68: Purchasable | Y68: 0 | Z68: 236 | AA68: 0 | AB68: 0 | AC68: 8 | AL68: 1 | AN68: 0
A69: OBJECT | B69: =属性表!R[-1]C[3]&属性表!R[-1]C[4] -> 魔龙护手 | C69: SY1V | D69: =属性表!R[-1]C[-2] -> 5 | E69: srbd | F69: 魔龙 | G69: =属性表!R[-1]C[26] -> |cFFFF9933[5级]魔龙护手|r | H69: =属性表!R[-1]C[26] -> |cFFFFFF99基础属性|r|n力量:838860|n敏捷:838860|n智力:838860 | I69: =RC[-2] -> |cFFFF9933[5级]魔龙护手|r | J69: =RC[-2] -> |cFFFFFF99基础属性|r|n力量:838860|n敏捷:838860|n智力:838860 | L69: =VLOOKUP(RC[-10],图标表!C[-7]:C[-6],2,0) -> blp\suitItem\09 (2) .blp | W69: 1 | X69: Purchasable | Y69: 0 | Z69: 236 | AA69: 0 | AB69: 0 | AC69: 8 | AL69: 1 | AN69: 0
A70: OBJECT | B70: =属性表!R[-1]C[3]&属性表!R[-1]C[4] -> 魔龙护肩 | C70: SY1W | D70: =属性表!R[-1]C[-2] -> 5 | E70: srbd | F70: 魔龙 | G70: =属性表!R[-1]C[26] -> |cFFFF9933[5级]魔龙护肩|r | H70: =属性表!R[-1]C[26] -> |cFFFFFF99基础属性|r|n力量:1677721 | I70: =RC[-2] -> |cFFFF9933[5级]魔龙护肩|r | J70: =RC[-2] -> |cFFFFFF99基础属性|r|n力量:1677721 | L70: =VLOOKUP(RC[-10],图标表!C[-7]:C[-6],2,0) -> blp\suitItem\09 (3) .blp | W70: 1 | X70: Purchasable | Y70: 0 | Z70: 236 | AA70: 0 | AB70: 0 | AC70: 8 | AL70: 1 | AN70: 0
A71: OBJECT | B71: =属性表!R[-1]C[3]&属性表!R[-1]C[4] -> 魔龙腿甲 | C71: SY1X | D71: =属性表!R[-1]C[-2] -> 5 | E71: srbd | F71: 魔龙 | G71: =属性表!R[-1]C[26] -> |cFFFF9933[5级]魔龙腿甲|r | H71: =属性表!R[-1]C[26] -> |cFFFFFF99基础属性|r|n护甲:14280 | I71: =RC[-2] -> |cFFFF9933[5级]魔龙腿甲|r | J71: =RC[-2] -> |cFFFFFF99基础属性|r|n护甲:14280 | L71: =VLOOKUP(RC[-10],图标表!C[-7]:C[-6],2,0) -> blp\suitItem\09 (4) .blp | W71: 1 | X71: Purchasable | Y71: 0 | Z71: 236 | AA71: 0 | AB71: 0 | AC71: 8 | AL71: 1 | AN71: 0
A72: OBJECT | B72: =属性表!R[-1]C[3]&属性表!R[-1]C[4] -> 魔龙头饰 | C72: SY1Y | D72: =属性表!R[-1]C[-2] -> 5 | E72: srbd | F72: 魔龙 | G72: =属性表!R[-1]C[26] -> |cFFFF9933[5级]魔龙头饰|r | H72: =属性表!R[-1]C[26] -> |cFFFFFF99基础属性|r|n智力:1677721 | I72: =RC[-2] -> |cFFFF9933[5级]魔龙头饰|r | J72: =RC[-2] -> |cFFFFFF99基础属性|r|n智力:1677721 | L72: =VLOOKUP(RC[-10],图标表!C[-7]:C[-6],2,0) -> blp\suitItem\09 (5) .blp | W72: 1 | X72: Purchasable | Y72: 0 | Z72: 236 | AA72: 0 | AB72: 0 | AC72: 8 | AL72: 1 | AN72: 0
A73: OBJECT | B73: =属性表!R[-1]C[3]&属性表!R[-1]C[4] -> 魔龙战靴 | C73: SY1Z | D73: =属性表!R[-1]C[-2] -> 5 | E73: srbd | F73: 魔龙 | G73: =属性表!R[-1]C[26] -> |cFFFF9933[5级]魔龙战靴|r | H73: =属性表!R[-1]C[26] -> |cFFFFFF99基础属性|r|n敏捷:1677721 | I73: =RC[-2] -> |cFFFF9933[5级]魔龙战靴|r | J73: =RC[-2] -> |cFFFFFF99基础属性|r|n敏捷:1677721 | L73: =VLOOKUP(RC[-10],图标表!C[-7]:C[-6],2,0) -> blp\suitItem\09 (6) .blp | W73: 1 | X73: Purchasable | Y73: 0 | Z73: 236 | AA73: 0 | AB73: 0 | AC73: 8 | AL73: 1 | AN73: 0
A74: OBJECT | B74: =属性表!R[-1]C[3]&属性表!R[-1]C[4] -> 魔龙腰带 | C74: SY20 | D74: =属性表!R[-1]C[-2] -> 5 | E74: srbd | F74: 魔龙 | G74: =属性表!R[-1]C[26] -> |cFFFF9933[5级]魔龙腰带|r | H74: =属性表!R[-1]C[26] -> |n|cFFFFFF55附加属性|r(%)|n攻速:54 | I74: =RC[-2] -> |cFFFF9933[5级]魔龙腰带|r | J74: =RC[-2] -> |n|cFFFFFF55附加属性|r(%)|n攻速:54 | L74: =VLOOKUP(RC[-10],图标表!C[-7]:C[-6],2,0) -> blp\suitItem\09 (7) .blp | W74: 1 | X74: Purchasable | Y74: 0 | Z74: 236 | AA74: 0 | AB74: 0 | AC74: 8 | AL74: 1 | AN74: 0
A75: OBJECT | B75: =属性表!R[-1]C[3]&属性表!R[-1]C[4] -> 修罗长刃 | C75: SY21 | D75: =属性表!R[-1]C[-2] -> 5 | E75: srbd | F75: 修罗 | G75: =属性表!R[-1]C[26] -> |cFFFF9933[5级]修罗长刃|r | H75: =属性表!R[-1]C[26] -> |cFFFFFF99基础属性|r|n攻击:3145728 | I75: =RC[-2] -> |cFFFF9933[5级]修罗长刃|r | J75: =RC[-2] -> |cFFFFFF99基础属性|r|n攻击:3145728 | L75: =VLOOKUP(RC[-10],图标表!C[-7]:C[-6],2,0) -> blp\suitItem\10 (8) .blp | W75: 1 | X75: Purchasable | Y75: 0 | Z75: 236 | AA75: 0 | AB75: 0 | AC75: 8 | AL75: 1 | AN75: 0
A76: OBJECT | B76: =属性表!R[-1]C[3]&属性表!R[-1]C[4] -> 修罗胸甲 | C76: SY22 | D76: =属性表!R[-1]C[-2] -> 5 | E76: srbd | F76: 修罗 | G76: =属性表!R[-1]C[26] -> |cFFFF9933[5级]修罗胸甲|r | H76: =属性表!R[-1]C[26] -> |cFFFFFF99基础属性|r|n血量:10485760 | I76: =RC[-2] -> |cFFFF9933[5级]修罗胸甲|r | J76: =RC[-2] -> |cFFFFFF99基础属性|r|n血量:10485760 | L76: =VLOOKUP(RC[-10],图标表!C[-7]:C[-6],2,0) -> blp\suitItem\10 (1) .blp | W76: 1 | X76: Purchasable | Y76: 0 | Z76: 236 | AA76: 0 | AB76: 0 | AC76: 8 | AL76: 1 | AN76: 0
A77: OBJECT | B77: =属性表!R[-1]C[3]&属性表!R[-1]C[4] -> 修罗护手 | C77: SY23 | D77: =属性表!R[-1]C[-2] -> 5 | E77: srbd | F77: 修罗 | G77: =属性表!R[-1]C[26] -> |cFFFF9933[5级]修罗护手|r | H77: =属性表!R[-1]C[26] -> |cFFFFFF99基础属性|r|n力量:838860|n敏捷:838860|n智力:838860 | I77: =RC[-2] -> |cFFFF9933[5级]修罗护手|r | J77: =RC[-2] -> |cFFFFFF99基础属性|r|n力量:838860|n敏捷:838860|n智力:838860 | L77: =VLOOKUP(RC[-10],图标表!C[-7]:C[-6],2,0) -> blp\suitItem\10 (2) .blp | W77: 1 | X77: Purchasable | Y77: 0 | Z77: 236 | AA77: 0 | AB77: 0 | AC77: 8 | AL77: 1 | AN77: 0
A78: OBJECT | B78: =属性表!R[-1]C[3]&属性表!R[-1]C[4] -> 修罗护肩 | C78: SY24 | D78: =属性表!R[-1]C[-2] -> 5 | E78: srbd | F78: 修罗 | G78: =属性表!R[-1]C[26] -> |cFFFF9933[5级]修罗护肩|r | H78: =属性表!R[-1]C[26] -> |cFFFFFF99基础属性|r|n力量:1677721 | I78: =RC[-2] -> |cFFFF9933[5级]修罗护肩|r | J78: =RC[-2] -> |cFFFFFF99基础属性|r|n力量:1677721 | L78: =VLOOKUP(RC[-10],图标表!C[-7]:C[-6],2,0) -> blp\suitItem\10 (3) .blp | W78: 1 | X78: Purchasable | Y78: 0 | Z78: 236 | AA78: 0 | AB78: 0 | AC78: 8 | AL78: 1 | AN78: 0
A79: OBJECT | B79: =属性表!R[-1]C[3]&属性表!R[-1]C[4] -> 修罗腿甲 | C79: SY25 | D79: =属性表!R[-1]C[-2] -> 5 | E79: srbd | F79: 修罗 | G79: =属性表!R[-1]C[26] -> |cFFFF9933[5级]修罗腿甲|r | H79: =属性表!R[-1]C[26] -> |cFFFFFF99基础属性|r|n护甲:14280 | I79: =RC[-2] -> |cFFFF9933[5级]修罗腿甲|r | J79: =RC[-2] -> |cFFFFFF99基础属性|r|n护甲:14280 | L79: =VLOOKUP(RC[-10],图标表!C[-7]:C[-6],2,0) -> blp\suitItem\10 (4) .blp | W79: 1 | X79: Purchasable | Y79: 0 | Z79: 236 | AA79: 0 | AB79: 0 | AC79: 8 | AL79: 1 | AN79: 0
A80: OBJECT | B80: =属性表!R[-1]C[3]&属性表!R[-1]C[4] -> 修罗头饰 | C80: SY26 | D80: =属性表!R[-1]C[-2] -> 5 | E80: srbd | F80: 修罗 | G80: =属性表!R[-1]C[26] -> |cFFFF9933[5级]修罗头饰|r | H80: =属性表!R[-1]C[26] -> |cFFFFFF99基础属性|r|n智力:1677721 | I80: =RC[-2] -> |cFFFF9933[5级]修罗头饰|r | J80: =RC[-2] -> |cFFFFFF99基础属性|r|n智力:1677721 | L80: =VLOOKUP(RC[-10],图标表!C[-7]:C[-6],2,0) -> blp\suitItem\10 (5) .blp | W80: 1 | X80: Purchasable | Y80: 0 | Z80: 236 | AA80: 0 | AB80: 0 | AC80: 8 | AL80: 1 | AN80: 0
A81: OBJECT | B81: =属性表!R[-1]C[3]&属性表!R[-1]C[4] -> 修罗战靴 | C81: SY27 | D81: =属性表!R[-1]C[-2] -> 5 | E81: srbd | F81: 修罗 | G81: =属性表!R[-1]C[26] -> |cFFFF9933[5级]修罗战靴|r | H81: =属性表!R[-1]C[26] -> |cFFFFFF99基础属性|r|n敏捷:1677721 | I81: =RC[-2] -> |cFFFF9933[5级]修罗战靴|r | J81: =RC[-2] -> |cFFFFFF99基础属性|r|n敏捷:1677721 | L81: =VLOOKUP(RC[-10],图标表!C[-7]:C[-6],2,0) -> blp\suitItem\10 (6) .blp | W81: 1 | X81: Purchasable | Y81: 0 | Z81: 236 | AA81: 0 | AB81: 0 | AC81: 8 | AL81: 1 | AN81: 0
A82: OBJECT | B82: =属性表!R[-1]C[3]&属性表!R[-1]C[4] -> 修罗腰带 | C82: SY28 | D82: =属性表!R[-1]C[-2] -> 5 | E82: srbd | F82: 修罗 | G82: =属性表!R[-1]C[26] -> |cFFFF9933[5级]修罗腰带|r | H82: =属性表!R[-1]C[26] -> |n|cFFFFFF55附加属性|r(%)|n攻速:54 | I82: =RC[-2] -> |cFFFF9933[5级]修罗腰带|r | J82: =RC[-2] -> |n|cFFFFFF55附加属性|r(%)|n攻速:54 | L82: =VLOOKUP(RC[-10],图标表!C[-7]:C[-6],2,0) -> blp\suitItem\10 (7) .blp | W82: 1 | X82: Purchasable | Y82: 0 | Z82: 236 | AA82: 0 | AB82: 0 | AC82: 8 | AL82: 1 | AN82: 0

Sheet: 属性表
A1: 序号 | B1: 等级 | C1: 品级 | D1: 前缀 | E1: 名字 | F1: 后缀 | G1: |cFFFFFF99基础属性|r | H1: 攻击: | I1: 力量: | J1: 敏捷: | K1: 智力: | L1: 血量: | M1: 护甲: | N1: |cFFFFFF55附加属性|r(%) | O1: 攻速: | P1: 攻击吸血: | Q1: 暴击概率: | R1: 暴击伤害: | S1: 伤害增幅: | T1: 附加伤害: | U1: 最终伤害: | V1: 伤害闪避: | W1: 伤害减免: | X1: 伤害反弹: | Y1: 全属性抗性: | Z1: 火属性抗性: | AA1: 水属性抗性: | AB1: 风属性抗性: | AC1: 土属性抗性: | AE1: = | AF1: 描述 | AG1: 名字 | AH1: 文本
A2: 1 | B2: 1 | D2: ="["&RC[-2]&"级]" -> [1级] | E2: 战士 | F2: 长刃 | H2: 30000 | AG2: =VLOOKUP(RC[-31],其他!R1C1:R7C2,2,0)&RC[-29]&RC[-28]&RC[-27]&"|r" -> |cFF999999[1级]战士长刃|r | AH2: =IF(RC[-26]&RC[-25]&RC[-24]&RC[-23]&RC[-22]&RC[-21]="",,R1C7)&IF(RC[-26]="",,"|n"&R1C8&RC[-26])&IF(RC[-25]="",,"|n"&R1C9&RC[-25])&IF(RC[-24]="",,"|n"&R1C10&RC[-24])&IF(RC[-23]="",,"|n"&R1C11&RC[-23])&IF(RC[-22]="",,"|n"&R1C12&RC[-22])&IF(RC[-21]="",,"|n"&R1C13&RC[-21])&IF(RC[-19]&RC[-18]&RC[-17]&RC[-16]="",,"|n"&R1C14)&IF(RC[-19]="",,"|n"&R1C15&RC[-19])&IF(RC[-18]="",,"|n"&R1C16&RC[-18])&IF(RC[-17]="",,"|n"&R1C17&RC[-17])&IF(RC[-16]="",,"|n"&R1C18&RC[-16])&IF(RC[-15]="",,"|n"&R1C19&RC[-15])&IF(RC[-14]="",,"|n"&R1C20&RC[-14])&IF(RC[-13]="",,"|n"&R1C21&RC[-13])&IF(RC[-12]="",,"|n"&R1C22&RC[-12])&IF(RC[-11]="",,"|n"&R1C23&RC[-11])&IF(RC[-10]="",,"|n"&R1C24&RC[-10])&IF(RC[-9]="",,"|n"&R1C25&RC[-9])&IF(RC[-8]="",,"|n"&R1C26&RC[-8])&IF(RC[-7]="",,"|n"&R1C27&RC[-7])&IF(RC[-6]="",,"|n"&R1C28&RC[-6])&IF(RC[-5]="",,"|n"&R1C29&RC[-5])&IF(RC[-2]="",,"|n|n"&RC[-2]) -> |cFFFFFF99基础属性|r|n攻击:30000
A3: 2 | B3: 1 | D3: ="["&RC[-2]&"级]" -> [1级] | E3: 战士 | F3: 胸甲 | L3: 100000 | AG3: =VLOOKUP(RC[-31],其他!R1C1:R7C2,2,0)&RC[-29]&RC[-28]&RC[-27]&"|r" -> |cFF999999[1级]战士胸甲|r | AH3: =IF(RC[-26]&RC[-25]&RC[-24]&RC[-23]&RC[-22]&RC[-21]="",,R1C7)&IF(RC[-26]="",,"|n"&R1C8&RC[-26])&IF(RC[-25]="",,"|n"&R1C9&RC[-25])&IF(RC[-24]="",,"|n"&R1C10&RC[-24])&IF(RC[-23]="",,"|n"&R1C11&RC[-23])&IF(RC[-22]="",,"|n"&R1C12&RC[-22])&IF(RC[-21]="",,"|n"&R1C13&RC[-21])&IF(RC[-19]&RC[-18]&RC[-17]&RC[-16]="",,"|n"&R1C14)&IF(RC[-19]="",,"|n"&R1C15&RC[-19])&IF(RC[-18]="",,"|n"&R1C16&RC[-18])&IF(RC[-17]="",,"|n"&R1C17&RC[-17])&IF(RC[-16]="",,"|n"&R1C18&RC[-16])&IF(RC[-15]="",,"|n"&R1C19&RC[-15])&IF(RC[-14]="",,"|n"&R1C20&RC[-14])&IF(RC[-13]="",,"|n"&R1C21&RC[-13])&IF(RC[-12]="",,"|n"&R1C22&RC[-12])&IF(RC[-11]="",,"|n"&R1C23&RC[-11])&IF(RC[-10]="",,"|n"&R1C24&RC[-10])&IF(RC[-9]="",,"|n"&R1C25&RC[-9])&IF(RC[-8]="",,"|n"&R1C26&RC[-8])&IF(RC[-7]="",,"|n"&R1C27&RC[-7])&IF(RC[-6]="",,"|n"&R1C28&RC[-6])&IF(RC[-5]="",,"|n"&R1C29&RC[-5])&IF(RC[-2]="",,"|n|n"&RC[-2]) -> |cFFFFFF99基础属性|r|n血量:100000
A4: 3 | B4: 1 | D4: ="["&RC[-2]&"级]" -> [1级] | E4: 战士 | F4: 护手 | I4: 8000 | J4: 8000 | K4: 8000 | AG4: =VLOOKUP(RC[-31],其他!R1C1:R7C2,2,0)&RC[-29]&RC[-28]&RC[-27]&"|r" -> |cFF999999[1级]战士护手|r | AH4: =IF(RC[-26]&RC[-25]&RC[-24]&RC[-23]&RC[-22]&RC[-21]="",,R1C7)&IF(RC[-26]="",,"|n"&R1C8&RC[-26])&IF(RC[-25]="",,"|n"&R1C9&RC[-25])&IF(RC[-24]="",,"|n"&R1C10&RC[-24])&IF(RC[-23]="",,"|n"&R1C11&RC[-23])&IF(RC[-22]="",,"|n"&R1C12&RC[-22])&IF(RC[-21]="",,"|n"&R1C13&RC[-21])&IF(RC[-19]&RC[-18]&RC[-17]&RC[-16]="",,"|n"&R1C14)&IF(RC[-19]="",,"|n"&R1C15&RC[-19])&IF(RC[-18]="",,"|n"&R1C16&RC[-18])&IF(RC[-17]="",,"|n"&R1C17&RC[-17])&IF(RC[-16]="",,"|n"&R1C18&RC[-16])&IF(RC[-15]="",,"|n"&R1C19&RC[-15])&IF(RC[-14]="",,"|n"&R1C20&RC[-14])&IF(RC[-13]="",,"|n"&R1C21&RC[-13])&IF(RC[-12]="",,"|n"&R1C22&RC[-12])&IF(RC[-11]="",,"|n"&R1C23&RC[-11])&IF(RC[-10]="",,"|n"&R1C24&RC[-10])&IF(RC[-9]="",,"|n"&R1C25&RC[-9])&IF(RC[-8]="",,"|n"&R1C26&RC[-8])&IF(RC[-7]="",,"|n"&R1C27&RC[-7])&IF(RC[-6]="",,"|n"&R1C28&RC[-6])&IF(RC[-5]="",,"|n"&R1C29&RC[-5])&IF(RC[-2]="",,"|n|n"&RC[-2]) -> |cFFFFFF99基础属性|r|n力量:8000|n敏捷:8000|n智力:8000
A5: 4 | B5: 1 | D5: ="["&RC[-2]&"级]" -> [1级] | E5: 战士 | F5: 护肩 | I5: 16000 | AG5: =VLOOKUP(RC[-31],其他!R1C1:R7C2,2,0)&RC[-29]&RC[-28]&RC[-27]&"|r" -> |cFF999999[1级]战士护肩|r | AH5: =IF(RC[-26]&RC[-25]&RC[-24]&RC[-23]&RC[-22]&RC[-21]="",,R1C7)&IF(RC[-26]="",,"|n"&R1C8&RC[-26])&IF(RC[-25]="",,"|n"&R1C9&RC[-25])&IF(RC[-24]="",,"|n"&R1C10&RC[-24])&IF(RC[-23]="",,"|n"&R1C11&RC[-23])&IF(RC[-22]="",,"|n"&R1C12&RC[-22])&IF(RC[-21]="",,"|n"&R1C13&RC[-21])&IF(RC[-19]&RC[-18]&RC[-17]&RC[-16]="",,"|n"&R1C14)&IF(RC[-19]="",,"|n"&R1C15&RC[-19])&IF(RC[-18]="",,"|n"&R1C16&RC[-18])&IF(RC[-17]="",,"|n"&R1C17&RC[-17])&IF(RC[-16]="",,"|n"&R1C18&RC[-16])&IF(RC[-15]="",,"|n"&R1C19&RC[-15])&IF(RC[-14]="",,"|n"&R1C20&RC[-14])&IF(RC[-13]="",,"|n"&R1C21&RC[-13])&IF(RC[-12]="",,"|n"&R1C22&RC[-12])&IF(RC[-11]="",,"|n"&R1C23&RC[-11])&IF(RC[-10]="",,"|n"&R1C24&RC[-10])&IF(RC[-9]="",,"|n"&R1C25&RC[-9])&IF(RC[-8]="",,"|n"&R1C26&RC[-8])&IF(RC[-7]="",,"|n"&R1C27&RC[-7])&IF(RC[-6]="",,"|n"&R1C28&RC[-6])&IF(RC[-5]="",,"|n"&R1C29&RC[-5])&IF(RC[-2]="",,"|n|n"&RC[-2]) -> |cFFFFFF99基础属性|r|n力量:16000
A6: 5 | B6: 1 | D6: ="["&RC[-2]&"级]" -> [1级] | E6: 战士 | F6: 腿甲 | M6: 5000 | AG6: =VLOOKUP(RC[-31],其他!R1C1:R7C2,2,0)&RC[-29]&RC[-28]&RC[-27]&"|r" -> |cFF999999[1级]战士腿甲|r | AH6: =IF(RC[-26]&RC[-25]&RC[-24]&RC[-23]&RC[-22]&RC[-21]="",,R1C7)&IF(RC[-26]="",,"|n"&R1C8&RC[-26])&IF(RC[-25]="",,"|n"&R1C9&RC[-25])&IF(RC[-24]="",,"|n"&R1C10&RC[-24])&IF(RC[-23]="",,"|n"&R1C11&RC[-23])&IF(RC[-22]="",,"|n"&R1C12&RC[-22])&IF(RC[-21]="",,"|n"&R1C13&RC[-21])&IF(RC[-19]&RC[-18]&RC[-17]&RC[-16]="",,"|n"&R1C14)&IF(RC[-19]="",,"|n"&R1C15&RC[-19])&IF(RC[-18]="",,"|n"&R1C16&RC[-18])&IF(RC[-17]="",,"|n"&R1C17&RC[-17])&IF(RC[-16]="",,"|n"&R1C18&RC[-16])&IF(RC[-15]="",,"|n"&R1C19&RC[-15])&IF(RC[-14]="",,"|n"&R1C20&RC[-14])&IF(RC[-13]="",,"|n"&R1C21&RC[-13])&IF(RC[-12]="",,"|n"&R1C22&RC[-12])&IF(RC[-11]="",,"|n"&R1C23&RC[-11])&IF(RC[-10]="",,"|n"&R1C24&RC[-10])&IF(RC[-9]="",,"|n"&R1C25&RC[-9])&IF(RC[-8]="",,"|n"&R1C26&RC[-8])&IF(RC[-7]="",,"|n"&R1C27&RC[-7])&IF(RC[-6]="",,"|n"&R1C28&RC[-6])&IF(RC[-5]="",,"|n"&R1C29&RC[-5])&IF(RC[-2]="",,"|n|n"&RC[-2]) -> |cFFFFFF99基础属性|r|n护甲:5000
A7: 6 | B7: 1 | D7: ="["&RC[-2]&"级]" -> [1级] | E7: 战士 | F7: 头饰 | K7: 16000 | AG7: =VLOOKUP(RC[-31],其他!R1C1:R7C2,2,0)&RC[-29]&RC[-28]&RC[-27]&"|r" -> |cFF999999[1级]战士头饰|r | AH7: =IF(RC[-26]&RC[-25]&RC[-24]&RC[-23]&RC[-22]&RC[-21]="",,R1C7)&IF(RC[-26]="",,"|n"&R1C8&RC[-26])&IF(RC[-25]="",,"|n"&R1C9&RC[-25])&IF(RC[-24]="",,"|n"&R1C10&RC[-24])&IF(RC[-23]="",,"|n"&R1C11&RC[-23])&IF(RC[-22]="",,"|n"&R1C12&RC[-22])&IF(RC[-21]="",,"|n"&R1C13&RC[-21])&IF(RC[-19]&RC[-18]&RC[-17]&RC[-16]="",,"|n"&R1C14)&IF(RC[-19]="",,"|n"&R1C15&RC[-19])&IF(RC[-18]="",,"|n"&R1C16&RC[-18])&IF(RC[-17]="",,"|n"&R1C17&RC[-17])&IF(RC[-16]="",,"|n"&R1C18&RC[-16])&IF(RC[-15]="",,"|n"&R1C19&RC[-15])&IF(RC[-14]="",,"|n"&R1C20&RC[-14])&IF(RC[-13]="",,"|n"&R1C21&RC[-13])&IF(RC[-12]="",,"|n"&R1C22&RC[-12])&IF(RC[-11]="",,"|n"&R1C23&RC[-11])&IF(RC[-10]="",,"|n"&R1C24&RC[-10])&IF(RC[-9]="",,"|n"&R1C25&RC[-9])&IF(RC[-8]="",,"|n"&R1C26&RC[-8])&IF(RC[-7]="",,"|n"&R1C27&RC[-7])&IF(RC[-6]="",,"|n"&R1C28&RC[-6])&IF(RC[-5]="",,"|n"&R1C29&RC[-5])&IF(RC[-2]="",,"|n|n"&RC[-2]) -> |cFFFFFF99基础属性|r|n智力:16000
A8: 7 | B8: 1 | D8: ="["&RC[-2]&"级]" -> [1级] | E8: 战士 | F8: 战靴 | J8: 16000 | AG8: =VLOOKUP(RC[-31],其他!R1C1:R7C2,2,0)&RC[-29]&RC[-28]&RC[-27]&"|r" -> |cFF999999[1级]战士战靴|r | AH8: =IF(RC[-26]&RC[-25]&RC[-24]&RC[-23]&RC[-22]&RC[-21]="",,R1C7)&IF(RC[-26]="",,"|n"&R1C8&RC[-26])&IF(RC[-25]="",,"|n"&R1C9&RC[-25])&IF(RC[-24]="",,"|n"&R1C10&RC[-24])&IF(RC[-23]="",,"|n"&R1C11&RC[-23])&IF(RC[-22]="",,"|n"&R1C12&RC[-22])&IF(RC[-21]="",,"|n"&R1C13&RC[-21])&IF(RC[-19]&RC[-18]&RC[-17]&RC[-16]="",,"|n"&R1C14)&IF(RC[-19]="",,"|n"&R1C15&RC[-19])&IF(RC[-18]="",,"|n"&R1C16&RC[-18])&IF(RC[-17]="",,"|n"&R1C17&RC[-17])&IF(RC[-16]="",,"|n"&R1C18&RC[-16])&IF(RC[-15]="",,"|n"&R1C19&RC[-15])&IF(RC[-14]="",,"|n"&R1C20&RC[-14])&IF(RC[-13]="",,"|n"&R1C21&RC[-13])&IF(RC[-12]="",,"|n"&R1C22&RC[-12])&IF(RC[-11]="",,"|n"&R1C23&RC[-11])&IF(RC[-10]="",,"|n"&R1C24&RC[-10])&IF(RC[-9]="",,"|n"&R1C25&RC[-9])&IF(RC[-8]="",,"|n"&R1C26&RC[-8])&IF(RC[-7]="",,"|n"&R1C27&RC[-7])&IF(RC[-6]="",,"|n"&R1C28&RC[-6])&IF(RC[-5]="",,"|n"&R1C29&RC[-5])&IF(RC[-2]="",,"|n|n"&RC[-2]) -> |cFFFFFF99基础属性|r|n敏捷:16000
A9: 8 | B9: 1 | D9: ="["&RC[-2]&"级]" -> [1级] | E9: 战士 | F9: 腰带 | O9: 20 | AG9: =VLOOKUP(RC[-31],其他!R1C1:R7C2,2,0)&RC[-29]&RC[-28]&RC[-27]&"|r" -> |cFF999999[1级]战士腰带|r | AH9: =IF(RC[-26]&RC[-25]&RC[-24]&RC[-23]&RC[-22]&RC[-21]="",,R1C7)&IF(RC[-26]="",,"|n"&R1C8&RC[-26])&IF(RC[-25]="",,"|n"&R1C9&RC[-25])&IF(RC[-24]="",,"|n"&R1C10&RC[-24])&IF(RC[-23]="",,"|n"&R1C11&RC[-23])&IF(RC[-22]="",,"|n"&R1C12&RC[-22])&IF(RC[-21]="",,"|n"&R1C13&RC[-21])&IF(RC[-19]&RC[-18]&RC[-17]&RC[-16]="",,"|n"&R1C14)&IF(RC[-19]="",,"|n"&R1C15&RC[-19])&IF(RC[-18]="",,"|n"&R1C16&RC[-18])&IF(RC[-17]="",,"|n"&R1C17&RC[-17])&IF(RC[-16]="",,"|n"&R1C18&RC[-16])&IF(RC[-15]="",,"|n"&R1C19&RC[-15])&IF(RC[-14]="",,"|n"&R1C20&RC[-14])&IF(RC[-13]="",,"|n"&R1C21&RC[-13])&IF(RC[-12]="",,"|n"&R1C22&RC[-12])&IF(RC[-11]="",,"|n"&R1C23&RC[-11])&IF(RC[-10]="",,"|n"&R1C24&RC[-10])&IF(RC[-9]="",,"|n"&R1C25&RC[-9])&IF(RC[-8]="",,"|n"&R1C26&RC[-8])&IF(RC[-7]="",,"|n"&R1C27&RC[-7])&IF(RC[-6]="",,"|n"&R1C28&RC[-6])&IF(RC[-5]="",,"|n"&R1C29&RC[-5])&IF(RC[-2]="",,"|n|n"&RC[-2]) -> |n|cFFFFFF55附加属性|r(%)|n攻速:20
A10: 9 | B10: 1 | D10: ="["&RC[-2]&"级]" -> [1级] | E10: 卫士 | F10: 长刃 | H10: 30000 | AG10: =VLOOKUP(RC[-31],其他!R1C1:R7C2,2,0)&RC[-29]&RC[-28]&RC[-27]&"|r" -> |cFF999999[1级]卫士长刃|r | AH10: =IF(RC[-26]&RC[-25]&RC[-24]&RC[-23]&RC[-22]&RC[-21]="",,R1C7)&IF(RC[-26]="",,"|n"&R1C8&RC[-26])&IF(RC[-25]="",,"|n"&R1C9&RC[-25])&IF(RC[-24]="",,"|n"&R1C10&RC[-24])&IF(RC[-23]="",,"|n"&R1C11&RC[-23])&IF(RC[-22]="",,"|n"&R1C12&RC[-22])&IF(RC[-21]="",,"|n"&R1C13&RC[-21])&IF(RC[-19]&RC[-18]&RC[-17]&RC[-16]="",,"|n"&R1C14)&IF(RC[-19]="",,"|n"&R1C15&RC[-19])&IF(RC[-18]="",,"|n"&R1C16&RC[-18])&IF(RC[-17]="",,"|n"&R1C17&RC[-17])&IF(RC[-16]="",,"|n"&R1C18&RC[-16])&IF(RC[-15]="",,"|n"&R1C19&RC[-15])&IF(RC[-14]="",,"|n"&R1C20&RC[-14])&IF(RC[-13]="",,"|n"&R1C21&RC[-13])&IF(RC[-12]="",,"|n"&R1C22&RC[-12])&IF(RC[-11]="",,"|n"&R1C23&RC[-11])&IF(RC[-10]="",,"|n"&R1C24&RC[-10])&IF(RC[-9]="",,"|n"&R1C25&RC[-9])&IF(RC[-8]="",,"|n"&R1C26&RC[-8])&IF(RC[-7]="",,"|n"&R1C27&RC[-7])&IF(RC[-6]="",,"|n"&R1C28&RC[-6])&IF(RC[-5]="",,"|n"&R1C29&RC[-5])&IF(RC[-2]="",,"|n|n"&RC[-2]) -> |cFFFFFF99基础属性|r|n攻击:30000
A11: 10 | B11: 1 | D11: ="["&RC[-2]&"级]" -> [1级] | E11: 卫士 | F11: 胸甲 | L11: 100000 | AG11: =VLOOKUP(RC[-31],其他!R1C1:R7C2,2,0)&RC[-29]&RC[-28]&RC[-27]&"|r" -> |cFF999999[1级]卫士胸甲|r | AH11: =IF(RC[-26]&RC[-25]&RC[-24]&RC[-23]&RC[-22]&RC[-21]="",,R1C7)&IF(RC[-26]="",,"|n"&R1C8&RC[-26])&IF(RC[-25]="",,"|n"&R1C9&RC[-25])&IF(RC[-24]="",,"|n"&R1C10&RC[-24])&IF(RC[-23]="",,"|n"&R1C11&RC[-23])&IF(RC[-22]="",,"|n"&R1C12&RC[-22])&IF(RC[-21]="",,"|n"&R1C13&RC[-21])&IF(RC[-19]&RC[-18]&RC[-17]&RC[-16]="",,"|n"&R1C14)&IF(RC[-19]="",,"|n"&R1C15&RC[-19])&IF(RC[-18]="",,"|n"&R1C16&RC[-18])&IF(RC[-17]="",,"|n"&R1C17&RC[-17])&IF(RC[-16]="",,"|n"&R1C18&RC[-16])&IF(RC[-15]="",,"|n"&R1C19&RC[-15])&IF(RC[-14]="",,"|n"&R1C20&RC[-14])&IF(RC[-13]="",,"|n"&R1C21&RC[-13])&IF(RC[-12]="",,"|n"&R1C22&RC[-12])&IF(RC[-11]="",,"|n"&R1C23&RC[-11])&IF(RC[-10]="",,"|n"&R1C24&RC[-10])&IF(RC[-9]="",,"|n"&R1C25&RC[-9])&IF(RC[-8]="",,"|n"&R1C26&RC[-8])&IF(RC[-7]="",,"|n"&R1C27&RC[-7])&IF(RC[-6]="",,"|n"&R1C28&RC[-6])&IF(RC[-5]="",,"|n"&R1C29&RC[-5])&IF(RC[-2]="",,"|n|n"&RC[-2]) -> |cFFFFFF99基础属性|r|n血量:100000
A12: 11 | B12: 1 | D12: ="["&RC[-2]&"级]" -> [1级] | E12: 卫士 | F12: 护手 | I12: 8000 | J12: 8000 | K12: 8000 | AG12: =VLOOKUP(RC[-31],其他!R1C1:R7C2,2,0)&RC[-29]&RC[-28]&RC[-27]&"|r" -> |cFF999999[1级]卫士护手|r | AH12: =IF(RC[-26]&RC[-25]&RC[-24]&RC[-23]&RC[-22]&RC[-21]="",,R1C7)&IF(RC[-26]="",,"|n"&R1C8&RC[-26])&IF(RC[-25]="",,"|n"&R1C9&RC[-25])&IF(RC[-24]="",,"|n"&R1C10&RC[-24])&IF(RC[-23]="",,"|n"&R1C11&RC[-23])&IF(RC[-22]="",,"|n"&R1C12&RC[-22])&IF(RC[-21]="",,"|n"&R1C13&RC[-21])&IF(RC[-19]&RC[-18]&RC[-17]&RC[-16]="",,"|n"&R1C14)&IF(RC[-19]="",,"|n"&R1C15&RC[-19])&IF(RC[-18]="",,"|n"&R1C16&RC[-18])&IF(RC[-17]="",,"|n"&R1C17&RC[-17])&IF(RC[-16]="",,"|n"&R1C18&RC[-16])&IF(RC[-15]="",,"|n"&R1C19&RC[-15])&IF(RC[-14]="",,"|n"&R1C20&RC[-14])&IF(RC[-13]="",,"|n"&R1C21&RC[-13])&IF(RC[-12]="",,"|n"&R1C22&RC[-12])&IF(RC[-11]="",,"|n"&R1C23&RC[-11])&IF(RC[-10]="",,"|n"&R1C24&RC[-10])&IF(RC[-9]="",,"|n"&R1C25&RC[-9])&IF(RC[-8]="",,"|n"&R1C26&RC[-8])&IF(RC[-7]="",,"|n"&R1C27&RC[-7])&IF(RC[-6]="",,"|n"&R1C28&RC[-6])&IF(RC[-5]="",,"|n"&R1C29&RC[-5])&IF(RC[-2]="",,"|n|n"&RC[-2]) -> |cFFFFFF99基础属性|r|n力量:8000|n敏捷:8000|n智力:8000
A13: 12 | B13: 1 | D13: ="["&RC[-2]&"级]" -> [1级] | E13: 卫士 | F13: 护肩 | I13: 16000 | AG13: =VLOOKUP(RC[-31],其他!R1C1:R7C2,2,0)&RC[-29]&RC[-28]&RC[-27]&"|r" -> |cFF999999[1级]卫士护肩|r | AH13: =IF(RC[-26]&RC[-25]&RC[-24]&RC[-23]&RC[-22]&RC[-21]="",,R1C7)&IF(RC[-26]="",,"|n"&R1C8&RC[-26])&IF(RC[-25]="",,"|n"&R1C9&RC[-25])&IF(RC[-24]="",,"|n"&R1C10&RC[-24])&IF(RC[-23]="",,"|n"&R1C11&RC[-23])&IF(RC[-22]="",,"|n"&R1C12&RC[-22])&IF(RC[-21]="",,"|n"&R1C13&RC[-21])&IF(RC[-19]&RC[-18]&RC[-17]&RC[-16]="",,"|n"&R1C14)&IF(RC[-19]="",,"|n"&R1C15&RC[-19])&IF(RC[-18]="",,"|n"&R1C16&RC[-18])&IF(RC[-17]="",,"|n"&R1C17&RC[-17])&IF(RC[-16]="",,"|n"&R1C18&RC[-16])&IF(RC[-15]="",,"|n"&R1C19&RC[-15])&IF(RC[-14]="",,"|n"&R1C20&RC[-14])&IF(RC[-13]="",,"|n"&R1C21&RC[-13])&IF(RC[-12]="",,"|n"&R1C22&RC[-12])&IF(RC[-11]="",,"|n"&R1C23&RC[-11])&IF(RC[-10]="",,"|n"&R1C24&RC[-10])&IF(RC[-9]="",,"|n"&R1C25&RC[-9])&IF(RC[-8]="",,"|n"&R1C26&RC[-8])&IF(RC[-7]="",,"|n"&R1C27&RC[-7])&IF(RC[-6]="",,"|n"&R1C28&RC[-6])&IF(RC[-5]="",,"|n"&R1C29&RC[-5])&IF(RC[-2]="",,"|n|n"&RC[-2]) -> |cFFFFFF99基础属性|r|n力量:16000
A14: 13 | B14: 1 | D14: ="["&RC[-2]&"级]" -> [1级] | E14: 卫士 | F14: 腿甲 | M14: 5000 | AG14: =VLOOKUP(RC[-31],其他!R1C1:R7C2,2,0)&RC[-29]&RC[-28]&RC[-27]&"|r" -> |cFF999999[1级]卫士腿甲|r | AH14: =IF(RC[-26]&RC[-25]&RC[-24]&RC[-23]&RC[-22]&RC[-21]="",,R1C7)&IF(RC[-26]="",,"|n"&R1C8&RC[-26])&IF(RC[-25]="",,"|n"&R1C9&RC[-25])&IF(RC[-24]="",,"|n"&R1C10&RC[-24])&IF(RC[-23]="",,"|n"&R1C11&RC[-23])&IF(RC[-22]="",,"|n"&R1C12&RC[-22])&IF(RC[-21]="",,"|n"&R1C13&RC[-21])&IF(RC[-19]&RC[-18]&RC[-17]&RC[-16]="",,"|n"&R1C14)&IF(RC[-19]="",,"|n"&R1C15&RC[-19])&IF(RC[-18]="",,"|n"&R1C16&RC[-18])&IF(RC[-17]="",,"|n"&R1C17&RC[-17])&IF(RC[-16]="",,"|n"&R1C18&RC[-16])&IF(RC[-15]="",,"|n"&R1C19&RC[-15])&IF(RC[-14]="",,"|n"&R1C20&RC[-14])&IF(RC[-13]="",,"|n"&R1C21&RC[-13])&IF(RC[-12]="",,"|n"&R1C22&RC[-12])&IF(RC[-11]="",,"|n"&R1C23&RC[-11])&IF(RC[-10]="",,"|n"&R1C24&RC[-10])&IF(RC[-9]="",,"|n"&R1C25&RC[-9])&IF(RC[-8]="",,"|n"&R1C26&RC[-8])&IF(RC[-7]="",,"|n"&R1C27&RC[-7])&IF(RC[-6]="",,"|n"&R1C28&RC[-6])&IF(RC[-5]="",,"|n"&R1C29&RC[-5])&IF(RC[-2]="",,"|n|n"&RC[-2]) -> |cFFFFFF99基础属性|r|n护甲:5000
A15: 14 | B15: 1 | D15: ="["&RC[-2]&"级]" -> [1级] | E15: 卫士 | F15: 头饰 | K15: 16000 | AG15: =VLOOKUP(RC[-31],其他!R1C1:R7C2,2,0)&RC[-29]&RC[-28]&RC[-27]&"|r" -> |cFF999999[1级]卫士头饰|r | AH15: =IF(RC[-26]&RC[-25]&RC[-24]&RC[-23]&RC[-22]&RC[-21]="",,R1C7)&IF(RC[-26]="",,"|n"&R1C8&RC[-26])&IF(RC[-25]="",,"|n"&R1C9&RC[-25])&IF(RC[-24]="",,"|n"&R1C10&RC[-24])&IF(RC[-23]="",,"|n"&R1C11&RC[-23])&IF(RC[-22]="",,"|n"&R1C12&RC[-22])&IF(RC[-21]="",,"|n"&R1C13&RC[-21])&IF(RC[-19]&RC[-18]&RC[-17]&RC[-16]="",,"|n"&R1C14)&IF(RC[-19]="",,"|n"&R1C15&RC[-19])&IF(RC[-18]="",,"|n"&R1C16&RC[-18])&IF(RC[-17]="",,"|n"&R1C17&RC[-17])&IF(RC[-16]="",,"|n"&R1C18&RC[-16])&IF(RC[-15]="",,"|n"&R1C19&RC[-15])&IF(RC[-14]="",,"|n"&R1C20&RC[-14])&IF(RC[-13]="",,"|n"&R1C21&RC[-13])&IF(RC[-12]="",,"|n"&R1C22&RC[-12])&IF(RC[-11]="",,"|n"&R1C23&RC[-11])&IF(RC[-10]="",,"|n"&R1C24&RC[-10])&IF(RC[-9]="",,"|n"&R1C25&RC[-9])&IF(RC[-8]="",,"|n"&R1C26&RC[-8])&IF(RC[-7]="",,"|n"&R1C27&RC[-7])&IF(RC[-6]="",,"|n"&R1C28&RC[-6])&IF(RC[-5]="",,"|n"&R1C29&RC[-5])&IF(RC[-2]="",,"|n|n"&RC[-2]) -> |cFFFFFF99基础属性|r|n智力:16000
A16: 14 | B16: 1 | D16: ="["&RC[-2]&"级]" -> [1级] | E16: 卫士 | F16: 战靴 | J16: 16000 | AG16: =VLOOKUP(RC[-31],其他!R1C1:R7C2,2,0)&RC[-29]&RC[-28]&RC[-27]&"|r" -> |cFF999999[1级]卫士战靴|r | AH16: =IF(RC[-26]&RC[-25]&RC[-24]&RC[-23]&RC[-22]&RC[-21]="",,R1C7)&IF(RC[-26]="",,"|n"&R1C8&RC[-26])&IF(RC[-25]="",,"|n"&R1C9&RC[-25])&IF(RC[-24]="",,"|n"&R1C10&RC[-24])&IF(RC[-23]="",,"|n"&R1C11&RC[-23])&IF(RC[-22]="",,"|n"&R1C12&RC[-22])&IF(RC[-21]="",,"|n"&R1C13&RC[-21])&IF(RC[-19]&RC[-18]&RC[-17]&RC[-16]="",,"|n"&R1C14)&IF(RC[-19]="",,"|n"&R1C15&RC[-19])&IF(RC[-18]="",,"|n"&R1C16&RC[-18])&IF(RC[-17]="",,"|n"&R1C17&RC[-17])&IF(RC[-16]="",,"|n"&R1C18&RC[-16])&IF(RC[-15]="",,"|n"&R1C19&RC[-15])&IF(RC[-14]="",,"|n"&R1C20&RC[-14])&IF(RC[-13]="",,"|n"&R1C21&RC[-13])&IF(RC[-12]="",,"|n"&R1C22&RC[-12])&IF(RC[-11]="",,"|n"&R1C23&RC[-11])&IF(RC[-10]="",,"|n"&R1C24&RC[-10])&IF(RC[-9]="",,"|n"&R1C25&RC[-9])&IF(RC[-8]="",,"|n"&R1C26&RC[-8])&IF(RC[-7]="",,"|n"&R1C27&RC[-7])&IF(RC[-6]="",,"|n"&R1C28&RC[-6])&IF(RC[-5]="",,"|n"&R1C29&RC[-5])&IF(RC[-2]="",,"|n|n"&RC[-2]) -> |cFFFFFF99基础属性|r|n敏捷:16000
A17: 14 | B17: 1 | D17: ="["&RC[-2]&"级]" -> [1级] | E17: 卫士 | F17: 腰带 | O17: 20 | AG17: =VLOOKUP(RC[-31],其他!R1C1:R7C2,2,0)&RC[-29]&RC[-28]&RC[-27]&"|r" -> |cFF999999[1级]卫士腰带|r | AH17: =IF(RC[-26]&RC[-25]&RC[-24]&RC[-23]&RC[-22]&RC[-21]="",,R1C7)&IF(RC[-26]="",,"|n"&R1C8&RC[-26])&IF(RC[-25]="",,"|n"&R1C9&RC[-25])&IF(RC[-24]="",,"|n"&R1C10&RC[-24])&IF(RC[-23]="",,"|n"&R1C11&RC[-23])&IF(RC[-22]="",,"|n"&R1C12&RC[-22])&IF(RC[-21]="",,"|n"&R1C13&RC[-21])&IF(RC[-19]&RC[-18]&RC[-17]&RC[-16]="",,"|n"&R1C14)&IF(RC[-19]="",,"|n"&R1C15&RC[-19])&IF(RC[-18]="",,"|n"&R1C16&RC[-18])&IF(RC[-17]="",,"|n"&R1C17&RC[-17])&IF(RC[-16]="",,"|n"&R1C18&RC[-16])&IF(RC[-15]="",,"|n"&R1C19&RC[-15])&IF(RC[-14]="",,"|n"&R1C20&RC[-14])&IF(RC[-13]="",,"|n"&R1C21&RC[-13])&IF(RC[-12]="",,"|n"&R1C22&RC[-12])&IF(RC[-11]="",,"|n"&R1C23&RC[-11])&IF(RC[-10]="",,"|n"&R1C24&RC[-10])&IF(RC[-9]="",,"|n"&R1C25&RC[-9])&IF(RC[-8]="",,"|n"&R1C26&RC[-8])&IF(RC[-7]="",,"|n"&R1C27&RC[-7])&IF(RC[-6]="",,"|n"&R1C28&RC[-6])&IF(RC[-5]="",,"|n"&R1C29&RC[-5])&IF(RC[-2]="",,"|n|n"&RC[-2]) -> |n|cFFFFFF55附加属性|r(%)|n攻速:20
A18: 15 | B18: 2 | D18: ="["&RC[-2]&"级]" -> [2级] | E18: 狩猎 | F18: 长刃 | H18: =IF(R[-16]C<>"",INT(R[-16]C*3.2),"") -> 96000 | I18: =IF(R[-16]C<>"",INT(R[-16]C*3.2),"") ->  | J18: =IF(R[-16]C<>"",INT(R[-16]C*3.2),"") ->  | K18: =IF(R[-16]C<>"",INT(R[-16]C*3.2),"") ->  | L18: =IF(R[-16]C<>"",INT(R[-16]C*3.2),"") ->  | M18: =IF(R[-16]C<>"",INT(R[-16]C*3.2),"") ->  | N18: =IF(R[-16]C<>"",INT(R[-16]C*3.2),"") ->  | O18: =IF(R[-16]C<>"",INT(R[-16]C*1.5),"") ->  | AG18: =VLOOKUP(RC[-31],其他!R1C1:R7C2,2,0)&RC[-29]&RC[-28]&RC[-27]&"|r" -> |cFF99FF66[2级]狩猎长刃|r | AH18: =IF(RC[-26]&RC[-25]&RC[-24]&RC[-23]&RC[-22]&RC[-21]="",,R1C7)&IF(RC[-26]="",,"|n"&R1C8&RC[-26])&IF(RC[-25]="",,"|n"&R1C9&RC[-25])&IF(RC[-24]="",,"|n"&R1C10&RC[-24])&IF(RC[-23]="",,"|n"&R1C11&RC[-23])&IF(RC[-22]="",,"|n"&R1C12&RC[-22])&IF(RC[-21]="",,"|n"&R1C13&RC[-21])&IF(RC[-19]&RC[-18]&RC[-17]&RC[-16]="",,"|n"&R1C14)&IF(RC[-19]="",,"|n"&R1C15&RC[-19])&IF(RC[-18]="",,"|n"&R1C16&RC[-18])&IF(RC[-17]="",,"|n"&R1C17&RC[-17])&IF(RC[-16]="",,"|n"&R1C18&RC[-16])&IF(RC[-15]="",,"|n"&R1C19&RC[-15])&IF(RC[-14]="",,"|n"&R1C20&RC[-14])&IF(RC[-13]="",,"|n"&R1C21&RC[-13])&IF(RC[-12]="",,"|n"&R1C22&RC[-12])&IF(RC[-11]="",,"|n"&R1C23&RC[-11])&IF(RC[-10]="",,"|n"&R1C24&RC[-10])&IF(RC[-9]="",,"|n"&R1C25&RC[-9])&IF(RC[-8]="",,"|n"&R1C26&RC[-8])&IF(RC[-7]="",,"|n"&R1C27&RC[-7])&IF(RC[-6]="",,"|n"&R1C28&RC[-6])&IF(RC[-5]="",,"|n"&R1C29&RC[-5])&IF(RC[-2]="",,"|n|n"&RC[-2]) -> |cFFFFFF99基础属性|r|n攻击:96000
A19: 16 | B19: 2 | D19: ="["&RC[-2]&"级]" -> [2级] | E19: 狩猎 | F19: 胸甲 | H19: =IF(R[-16]C<>"",INT(R[-16]C*3.2),"") ->  | I19: =IF(R[-16]C<>"",INT(R[-16]C*3.2),"") ->  | J19: =IF(R[-16]C<>"",INT(R[-16]C*3.2),"") ->  | K19: =IF(R[-16]C<>"",INT(R[-16]C*3.2),"") ->  | L19: =IF(R[-16]C<>"",INT(R[-16]C*3.2),"") -> 320000 | M19: =IF(R[-16]C<>"",INT(R[-16]C*3.2),"") ->  | N19: =IF(R[-16]C<>"",INT(R[-16]C*3.2),"") ->  | O19: =IF(R[-16]C<>"",INT(R[-16]C*1.5),"") ->  | AG19: =VLOOKUP(RC[-31],其他!R1C1:R7C2,2,0)&RC[-29]&RC[-28]&RC[-27]&"|r" -> |cFF99FF66[2级]狩猎胸甲|r | AH19: =IF(RC[-26]&RC[-25]&RC[-24]&RC[-23]&RC[-22]&RC[-21]="",,R1C7)&IF(RC[-26]="",,"|n"&R1C8&RC[-26])&IF(RC[-25]="",,"|n"&R1C9&RC[-25])&IF(RC[-24]="",,"|n"&R1C10&RC[-24])&IF(RC[-23]="",,"|n"&R1C11&RC[-23])&IF(RC[-22]="",,"|n"&R1C12&RC[-22])&IF(RC[-21]="",,"|n"&R1C13&RC[-21])&IF(RC[-19]&RC[-18]&RC[-17]&RC[-16]="",,"|n"&R1C14)&IF(RC[-19]="",,"|n"&R1C15&RC[-19])&IF(RC[-18]="",,"|n"&R1C16&RC[-18])&IF(RC[-17]="",,"|n"&R1C17&RC[-17])&IF(RC[-16]="",,"|n"&R1C18&RC[-16])&IF(RC[-15]="",,"|n"&R1C19&RC[-15])&IF(RC[-14]="",,"|n"&R1C20&RC[-14])&IF(RC[-13]="",,"|n"&R1C21&RC[-13])&IF(RC[-12]="",,"|n"&R1C22&RC[-12])&IF(RC[-11]="",,"|n"&R1C23&RC[-11])&IF(RC[-10]="",,"|n"&R1C24&RC[-10])&IF(RC[-9]="",,"|n"&R1C25&RC[-9])&IF(RC[-8]="",,"|n"&R1C26&RC[-8])&IF(RC[-7]="",,"|n"&R1C27&RC[-7])&IF(RC[-6]="",,"|n"&R1C28&RC[-6])&IF(RC[-5]="",,"|n"&R1C29&RC[-5])&IF(RC[-2]="",,"|n|n"&RC[-2]) -> |cFFFFFF99基础属性|r|n血量:320000
A20: 17 | B20: 2 | D20: ="["&RC[-2]&"级]" -> [2级] | E20: 狩猎 | F20: 护手 | H20: =IF(R[-16]C<>"",INT(R[-16]C*3.2),"") ->  | I20: =IF(R[-16]C<>"",INT(R[-16]C*3.2),"") -> 25600 | J20: =IF(R[-16]C<>"",INT(R[-16]C*3.2),"") -> 25600 | K20: =IF(R[-16]C<>"",INT(R[-16]C*3.2),"") -> 25600 | L20: =IF(R[-16]C<>"",INT(R[-16]C*3.2),"") ->  | M20: =IF(R[-16]C<>"",INT(R[-16]C*3.2),"") ->  | N20: =IF(R[-16]C<>"",INT(R[-16]C*3.2),"") ->  | O20: =IF(R[-16]C<>"",INT(R[-16]C*1.5),"") ->  | AG20: =VLOOKUP(RC[-31],其他!R1C1:R7C2,2,0)&RC[-29]&RC[-28]&RC[-27]&"|r" -> |cFF99FF66[2级]狩猎护手|r | AH20: =IF(RC[-26]&RC[-25]&RC[-24]&RC[-23]&RC[-22]&RC[-21]="",,R1C7)&IF(RC[-26]="",,"|n"&R1C8&RC[-26])&IF(RC[-25]="",,"|n"&R1C9&RC[-25])&IF(RC[-24]="",,"|n"&R1C10&RC[-24])&IF(RC[-23]="",,"|n"&R1C11&RC[-23])&IF(RC[-22]="",,"|n"&R1C12&RC[-22])&IF(RC[-21]="",,"|n"&R1C13&RC[-21])&IF(RC[-19]&RC[-18]&RC[-17]&RC[-16]="",,"|n"&R1C14)&IF(RC[-19]="",,"|n"&R1C15&RC[-19])&IF(RC[-18]="",,"|n"&R1C16&RC[-18])&IF(RC[-17]="",,"|n"&R1C17&RC[-17])&IF(RC[-16]="",,"|n"&R1C18&RC[-16])&IF(RC[-15]="",,"|n"&R1C19&RC[-15])&IF(RC[-14]="",,"|n"&R1C20&RC[-14])&IF(RC[-13]="",,"|n"&R1C21&RC[-13])&IF(RC[-12]="",,"|n"&R1C22&RC[-12])&IF(RC[-11]="",,"|n"&R1C23&RC[-11])&IF(RC[-10]="",,"|n"&R1C24&RC[-10])&IF(RC[-9]="",,"|n"&R1C25&RC[-9])&IF(RC[-8]="",,"|n"&R1C26&RC[-8])&IF(RC[-7]="",,"|n"&R1C27&RC[-7])&IF(RC[-6]="",,"|n"&R1C28&RC[-6])&IF(RC[-5]="",,"|n"&R1C29&RC[-5])&IF(RC[-2]="",,"|n|n"&RC[-2]) -> |cFFFFFF99基础属性|r|n力量:25600|n敏捷:25600|n智力:25600
A21: 18 | B21: 2 | D21: ="["&RC[-2]&"级]" -> [2级] | E21: 狩猎 | F21: 护肩 | H21: =IF(R[-16]C<>"",INT(R[-16]C*3.2),"") ->  | I21: =IF(R[-16]C<>"",INT(R[-16]C*3.2),"") -> 51200 | J21: =IF(R[-16]C<>"",INT(R[-16]C*3.2),"") ->  | K21: =IF(R[-16]C<>"",INT(R[-16]C*3.2),"") ->  | L21: =IF(R[-16]C<>"",INT(R[-16]C*3.2),"") ->  | M21: =IF(R[-16]C<>"",INT(R[-16]C*3.2),"") ->  | N21: =IF(R[-16]C<>"",INT(R[-16]C*3.2),"") ->  | O21: =IF(R[-16]C<>"",INT(R[-16]C*1.5),"") ->  | AG21: =VLOOKUP(RC[-31],其他!R1C1:R7C2,2,0)&RC[-29]&RC[-28]&RC[-27]&"|r" -> |cFF99FF66[2级]狩猎护肩|r | AH21: =IF(RC[-26]&RC[-25]&RC[-24]&RC[-23]&RC[-22]&RC[-21]="",,R1C7)&IF(RC[-26]="",,"|n"&R1C8&RC[-26])&IF(RC[-25]="",,"|n"&R1C9&RC[-25])&IF(RC[-24]="",,"|n"&R1C10&RC[-24])&IF(RC[-23]="",,"|n"&R1C11&RC[-23])&IF(RC[-22]="",,"|n"&R1C12&RC[-22])&IF(RC[-21]="",,"|n"&R1C13&RC[-21])&IF(RC[-19]&RC[-18]&RC[-17]&RC[-16]="",,"|n"&R1C14)&IF(RC[-19]="",,"|n"&R1C15&RC[-19])&IF(RC[-18]="",,"|n"&R1C16&RC[-18])&IF(RC[-17]="",,"|n"&R1C17&RC[-17])&IF(RC[-16]="",,"|n"&R1C18&RC[-16])&IF(RC[-15]="",,"|n"&R1C19&RC[-15])&IF(RC[-14]="",,"|n"&R1C20&RC[-14])&IF(RC[-13]="",,"|n"&R1C21&RC[-13])&IF(RC[-12]="",,"|n"&R1C22&RC[-12])&IF(RC[-11]="",,"|n"&R1C23&RC[-11])&IF(RC[-10]="",,"|n"&R1C24&RC[-10])&IF(RC[-9]="",,"|n"&R1C25&RC[-9])&IF(RC[-8]="",,"|n"&R1C26&RC[-8])&IF(RC[-7]="",,"|n"&R1C27&RC[-7])&IF(RC[-6]="",,"|n"&R1C28&RC[-6])&IF(RC[-5]="",,"|n"&R1C29&RC[-5])&IF(RC[-2]="",,"|n|n"&RC[-2]) -> |cFFFFFF99基础属性|r|n力量:51200
A22: 19 | B22: 2 | D22: ="["&RC[-2]&"级]" -> [2级] | E22: 狩猎 | F22: 腿甲 | H22: =IF(R[-16]C<>"",INT(R[-16]C*3.2),"") ->  | I22: =IF(R[-16]C<>"",INT(R[-16]C*3.2),"") ->  | J22: =IF(R[-16]C<>"",INT(R[-16]C*3.2),"") ->  | K22: =IF(R[-16]C<>"",INT(R[-16]C*3.2),"") ->  | L22: =IF(R[-16]C<>"",INT(R[-16]C*3.2),"") ->  | M22: =IF(R[-16]C<>"",INT(R[-16]C*1.3),"") -> 6500 | N22: =IF(R[-16]C<>"",INT(R[-16]C*3.2),"") ->  | O22: =IF(R[-16]C<>"",INT(R[-16]C*1.5),"") ->  | AG22: =VLOOKUP(RC[-31],其他!R1C1:R7C2,2,0)&RC[-29]&RC[-28]&RC[-27]&"|r" -> |cFF99FF66[2级]狩猎腿甲|r | AH22: =IF(RC[-26]&RC[-25]&RC[-24]&RC[-23]&RC[-22]&RC[-21]="",,R1C7)&IF(RC[-26]="",,"|n"&R1C8&RC[-26])&IF(RC[-25]="",,"|n"&R1C9&RC[-25])&IF(RC[-24]="",,"|n"&R1C10&RC[-24])&IF(RC[-23]="",,"|n"&R1C11&RC[-23])&IF(RC[-22]="",,"|n"&R1C12&RC[-22])&IF(RC[-21]="",,"|n"&R1C13&RC[-21])&IF(RC[-19]&RC[-18]&RC[-17]&RC[-16]="",,"|n"&R1C14)&IF(RC[-19]="",,"|n"&R1C15&RC[-19])&IF(RC[-18]="",,"|n"&R1C16&RC[-18])&IF(RC[-17]="",,"|n"&R1C17&RC[-17])&IF(RC[-16]="",,"|n"&R1C18&RC[-16])&IF(RC[-15]="",,"|n"&R1C19&RC[-15])&IF(RC[-14]="",,"|n"&R1C20&RC[-14])&IF(RC[-13]="",,"|n"&R1C21&RC[-13])&IF(RC[-12]="",,"|n"&R1C22&RC[-12])&IF(RC[-11]="",,"|n"&R1C23&RC[-11])&IF(RC[-10]="",,"|n"&R1C24&RC[-10])&IF(RC[-9]="",,"|n"&R1C25&RC[-9])&IF(RC[-8]="",,"|n"&R1C26&RC[-8])&IF(RC[-7]="",,"|n"&R1C27&RC[-7])&IF(RC[-6]="",,"|n"&R1C28&RC[-6])&IF(RC[-5]="",,"|n"&R1C29&RC[-5])&IF(RC[-2]="",,"|n|n"&RC[-2]) -> |cFFFFFF99基础属性|r|n护甲:6500
A23: 20 | B23: 2 | D23: ="["&RC[-2]&"级]" -> [2级] | E23: 狩猎 | F23: 头饰 | H23: =IF(R[-16]C<>"",INT(R[-16]C*3.2),"") ->  | I23: =IF(R[-16]C<>"",INT(R[-16]C*3.2),"") ->  | J23: =IF(R[-16]C<>"",INT(R[-16]C*3.2),"") ->  | K23: =IF(R[-16]C<>"",INT(R[-16]C*3.2),"") -> 51200 | L23: =IF(R[-16]C<>"",INT(R[-16]C*3.2),"") ->  | M23: =IF(R[-16]C<>"",INT(R[-16]C*3.2),"") ->  | N23: =IF(R[-16]C<>"",INT(R[-16]C*3.2),"") ->  | O23: =IF(R[-16]C<>"",INT(R[-16]C*1.5),"") ->  | AG23: =VLOOKUP(RC[-31],其他!R1C1:R7C2,2,0)&RC[-29]&RC[-28]&RC[-27]&"|r" -> |cFF99FF66[2级]狩猎头饰|r | AH23: =IF(RC[-26]&RC[-25]&RC[-24]&RC[-23]&RC[-22]&RC[-21]="",,R1C7)&IF(RC[-26]="",,"|n"&R1C8&RC[-26])&IF(RC[-25]="",,"|n"&R1C9&RC[-25])&IF(RC[-24]="",,"|n"&R1C10&RC[-24])&IF(RC[-23]="",,"|n"&R1C11&RC[-23])&IF(RC[-22]="",,"|n"&R1C12&RC[-22])&IF(RC[-21]="",,"|n"&R1C13&RC[-21])&IF(RC[-19]&RC[-18]&RC[-17]&RC[-16]="",,"|n"&R1C14)&IF(RC[-19]="",,"|n"&R1C15&RC[-19])&IF(RC[-18]="",,"|n"&R1C16&RC[-18])&IF(RC[-17]="",,"|n"&R1C17&RC[-17])&IF(RC[-16]="",,"|n"&R1C18&RC[-16])&IF(RC[-15]="",,"|n"&R1C19&RC[-15])&IF(RC[-14]="",,"|n"&R1C20&RC[-14])&IF(RC[-13]="",,"|n"&R1C21&RC[-13])&IF(RC[-12]="",,"|n"&R1C22&RC[-12])&IF(RC[-11]="",,"|n"&R1C23&RC[-11])&IF(RC[-10]="",,"|n"&R1C24&RC[-10])&IF(RC[-9]="",,"|n"&R1C25&RC[-9])&IF(RC[-8]="",,"|n"&R1C26&RC[-8])&IF(RC[-7]="",,"|n"&R1C27&RC[-7])&IF(RC[-6]="",,"|n"&R1C28&RC[-6])&IF(RC[-5]="",,"|n"&R1C29&RC[-5])&IF(RC[-2]="",,"|n|n"&RC[-2]) -> |cFFFFFF99基础属性|r|n智力:51200
A24: 21 | B24: 2 | D24: ="["&RC[-2]&"级]" -> [2级] | E24: 狩猎 | F24: 战靴 | H24: =IF(R[-16]C<>"",INT(R[-16]C*3.2),"") ->  | I24: =IF(R[-16]C<>"",INT(R[-16]C*3.2),"") ->  | J24: =IF(R[-16]C<>"",INT(R[-16]C*3.2),"") -> 51200 | K24: =IF(R[-16]C<>"",INT(R[-16]C*3.2),"") ->  | L24: =IF(R[-16]C<>"",INT(R[-16]C*3.2),"") ->  | M24: =IF(R[-16]C<>"",INT(R[-16]C*3.2),"") ->  | N24: =IF(R[-16]C<>"",INT(R[-16]C*3.2),"") ->  | O24: =IF(R[-16]C<>"",INT(R[-16]C*1.5),"") ->  | AG24: =VLOOKUP(RC[-31],其他!R1C1:R7C2,2,0)&RC[-29]&RC[-28]&RC[-27]&"|r" -> |cFF99FF66[2级]狩猎战靴|r | AH24: =IF(RC[-26]&RC[-25]&RC[-24]&RC[-23]&RC[-22]&RC[-21]="",,R1C7)&IF(RC[-26]="",,"|n"&R1C8&RC[-26])&IF(RC[-25]="",,"|n"&R1C9&RC[-25])&IF(RC[-24]="",,"|n"&R1C10&RC[-24])&IF(RC[-23]="",,"|n"&R1C11&RC[-23])&IF(RC[-22]="",,"|n"&R1C12&RC[-22])&IF(RC[-21]="",,"|n"&R1C13&RC[-21])&IF(RC[-19]&RC[-18]&RC[-17]&RC[-16]="",,"|n"&R1C14)&IF(RC[-19]="",,"|n"&R1C15&RC[-19])&IF(RC[-18]="",,"|n"&R1C16&RC[-18])&IF(RC[-17]="",,"|n"&R1C17&RC[-17])&IF(RC[-16]="",,"|n"&R1C18&RC[-16])&IF(RC[-15]="",,"|n"&R1C19&RC[-15])&IF(RC[-14]="",,"|n"&R1C20&RC[-14])&IF(RC[-13]="",,"|n"&R1C21&RC[-13])&IF(RC[-12]="",,"|n"&R1C22&RC[-12])&IF(RC[-11]="",,"|n"&R1C23&RC[-11])&IF(RC[-10]="",,"|n"&R1C24&RC[-10])&IF(RC[-9]="",,"|n"&R1C25&RC[-9])&IF(RC[-8]="",,"|n"&R1C26&RC[-8])&IF(RC[-7]="",,"|n"&R1C27&RC[-7])&IF(RC[-6]="",,"|n"&R1C28&RC[-6])&IF(RC[-5]="",,"|n"&R1C29&RC[-5])&IF(RC[-2]="",,"|n|n"&RC[-2]) -> |cFFFFFF99基础属性|r|n敏捷:51200
A25: 22 | B25: 2 | D25: ="["&RC[-2]&"级]" -> [2级] | E25: 狩猎 | F25: 腰带 | H25: =IF(R[-16]C<>"",INT(R[-16]C*3.2),"") ->  | I25: =IF(R[-16]C<>"",INT(R[-16]C*3.2),"") ->  | J25: =IF(R[-16]C<>"",INT(R[-16]C*3.2),"") ->  | K25: =IF(R[-16]C<>"",INT(R[-16]C*3.2),"") ->  | L25: =IF(R[-16]C<>"",INT(R[-16]C*3.2),"") ->  | M25: =IF(R[-16]C<>"",INT(R[-16]C*3.2),"") ->  | N25: =IF(R[-16]C<>"",INT(R[-16]C*3.2),"") ->  | O25: =IF(R[-16]C<>"",INT(R[-16]C*1.3),"") -> 26 | AG25: =VLOOKUP(RC[-31],其他!R1C1:R7C2,2,0)&RC[-29]&RC[-28]&RC[-27]&"|r" -> |cFF99FF66[2级]狩猎腰带|r | AH25: =IF(RC[-26]&RC[-25]&RC[-24]&RC[-23]&RC[-22]&RC[-21]="",,R1C7)&IF(RC[-26]="",,"|n"&R1C8&RC[-26])&IF(RC[-25]="",,"|n"&R1C9&RC[-25])&IF(RC[-24]="",,"|n"&R1C10&RC[-24])&IF(RC[-23]="",,"|n"&R1C11&RC[-23])&IF(RC[-22]="",,"|n"&R1C12&RC[-22])&IF(RC[-21]="",,"|n"&R1C13&RC[-21])&IF(RC[-19]&RC[-18]&RC[-17]&RC[-16]="",,"|n"&R1C14)&IF(RC[-19]="",,"|n"&R1C15&RC[-19])&IF(RC[-18]="",,"|n"&R1C16&RC[-18])&IF(RC[-17]="",,"|n"&R1C17&RC[-17])&IF(RC[-16]="",,"|n"&R1C18&RC[-16])&IF(RC[-15]="",,"|n"&R1C19&RC[-15])&IF(RC[-14]="",,"|n"&R1C20&RC[-14])&IF(RC[-13]="",,"|n"&R1C21&RC[-13])&IF(RC[-12]="",,"|n"&R1C22&RC[-12])&IF(RC[-11]="",,"|n"&R1C23&RC[-11])&IF(RC[-10]="",,"|n"&R1C24&RC[-10])&IF(RC[-9]="",,"|n"&R1C25&RC[-9])&IF(RC[-8]="",,"|n"&R1C26&RC[-8])&IF(RC[-7]="",,"|n"&R1C27&RC[-7])&IF(RC[-6]="",,"|n"&R1C28&RC[-6])&IF(RC[-5]="",,"|n"&R1C29&RC[-5])&IF(RC[-2]="",,"|n|n"&RC[-2]) -> |n|cFFFFFF55附加属性|r(%)|n攻速:26
A26: 23 | B26: 2 | D26: ="["&RC[-2]&"级]" -> [2级] | E26: 赤血 | F26: 长刃 | H26: =IF(R[-16]C<>"",INT(R[-16]C*3.2),"") -> 96000 | I26: =IF(R[-16]C<>"",INT(R[-16]C*3.2),"") ->  | J26: =IF(R[-16]C<>"",INT(R[-16]C*3.2),"") ->  | K26: =IF(R[-16]C<>"",INT(R[-16]C*3.2),"") ->  | L26: =IF(R[-16]C<>"",INT(R[-16]C*3.2),"") ->  | M26: =IF(R[-16]C<>"",INT(R[-16]C*3.2),"") ->  | N26: =IF(R[-16]C<>"",INT(R[-16]C*3.2),"") ->  | O26: =IF(R[-16]C<>"",INT(R[-16]C*1.5),"") ->  | AG26: =VLOOKUP(RC[-31],其他!R1C1:R7C2,2,0)&RC[-29]&RC[-28]&RC[-27]&"|r" -> |cFF99FF66[2级]赤血长刃|r | AH26: =IF(RC[-26]&RC[-25]&RC[-24]&RC[-23]&RC[-22]&RC[-21]="",,R1C7)&IF(RC[-26]="",,"|n"&R1C8&RC[-26])&IF(RC[-25]="",,"|n"&R1C9&RC[-25])&IF(RC[-24]="",,"|n"&R1C10&RC[-24])&IF(RC[-23]="",,"|n"&R1C11&RC[-23])&IF(RC[-22]="",,"|n"&R1C12&RC[-22])&IF(RC[-21]="",,"|n"&R1C13&RC[-21])&IF(RC[-19]&RC[-18]&RC[-17]&RC[-16]="",,"|n"&R1C14)&IF(RC[-19]="",,"|n"&R1C15&RC[-19])&IF(RC[-18]="",,"|n"&R1C16&RC[-18])&IF(RC[-17]="",,"|n"&R1C17&RC[-17])&IF(RC[-16]="",,"|n"&R1C18&RC[-16])&IF(RC[-15]="",,"|n"&R1C19&RC[-15])&IF(RC[-14]="",,"|n"&R1C20&RC[-14])&IF(RC[-13]="",,"|n"&R1C21&RC[-13])&IF(RC[-12]="",,"|n"&R1C22&RC[-12])&IF(RC[-11]="",,"|n"&R1C23&RC[-11])&IF(RC[-10]="",,"|n"&R1C24&RC[-10])&IF(RC[-9]="",,"|n"&R1C25&RC[-9])&IF(RC[-8]="",,"|n"&R1C26&RC[-8])&IF(RC[-7]="",,"|n"&R1C27&RC[-7])&IF(RC[-6]="",,"|n"&R1C28&RC[-6])&IF(RC[-5]="",,"|n"&R1C29&RC[-5])&IF(RC[-2]="",,"|n|n"&RC[-2]) -> |cFFFFFF99基础属性|r|n攻击:96000
A27: 24 | B27: 2 | D27: ="["&RC[-2]&"级]" -> [2级] | E27: 赤血 | F27: 胸甲 | H27: =IF(R[-16]C<>"",INT(R[-16]C*3.2),"") ->  | I27: =IF(R[-16]C<>"",INT(R[-16]C*3.2),"") ->  | J27: =IF(R[-16]C<>"",INT(R[-16]C*3.2),"") ->  | K27: =IF(R[-16]C<>"",INT(R[-16]C*3.2),"") ->  | L27: =IF(R[-16]C<>"",INT(R[-16]C*3.2),"") -> 320000 | M27: =IF(R[-16]C<>"",INT(R[-16]C*3.2),"") ->  | N27: =IF(R[-16]C<>"",INT(R[-16]C*3.2),"") ->  | O27: =IF(R[-16]C<>"",INT(R[-16]C*1.5),"") ->  | AG27: =VLOOKUP(RC[-31],其他!R1C1:R7C2,2,0)&RC[-29]&RC[-28]&RC[-27]&"|r" -> |cFF99FF66[2级]赤血胸甲|r | AH27: =IF(RC[-26]&RC[-25]&RC[-24]&RC[-23]&RC[-22]&RC[-21]="",,R1C7)&IF(RC[-26]="",,"|n"&R1C8&RC[-26])&IF(RC[-25]="",,"|n"&R1C9&RC[-25])&IF(RC[-24]="",,"|n"&R1C10&RC[-24])&IF(RC[-23]="",,"|n"&R1C11&RC[-23])&IF(RC[-22]="",,"|n"&R1C12&RC[-22])&IF(RC[-21]="",,"|n"&R1C13&RC[-21])&IF(RC[-19]&RC[-18]&RC[-17]&RC[-16]="",,"|n"&R1C14)&IF(RC[-19]="",,"|n"&R1C15&RC[-19])&IF(RC[-18]="",,"|n"&R1C16&RC[-18])&IF(RC[-17]="",,"|n"&R1C17&RC[-17])&IF(RC[-16]="",,"|n"&R1C18&RC[-16])&IF(RC[-15]="",,"|n"&R1C19&RC[-15])&IF(RC[-14]="",,"|n"&R1C20&RC[-14])&IF(RC[-13]="",,"|n"&R1C21&RC[-13])&IF(RC[-12]="",,"|n"&R1C22&RC[-12])&IF(RC[-11]="",,"|n"&R1C23&RC[-11])&IF(RC[-10]="",,"|n"&R1C24&RC[-10])&IF(RC[-9]="",,"|n"&R1C25&RC[-9])&IF(RC[-8]="",,"|n"&R1C26&RC[-8])&IF(RC[-7]="",,"|n"&R1C27&RC[-7])&IF(RC[-6]="",,"|n"&R1C28&RC[-6])&IF(RC[-5]="",,"|n"&R1C29&RC[-5])&IF(RC[-2]="",,"|n|n"&RC[-2]) -> |cFFFFFF99基础属性|r|n血量:320000
A28: 25 | B28: 2 | D28: ="["&RC[-2]&"级]" -> [2级] | E28: 赤血 | F28: 护手 | H28: =IF(R[-16]C<>"",INT(R[-16]C*3.2),"") ->  | I28: =IF(R[-16]C<>"",INT(R[-16]C*3.2),"") -> 25600 | J28: =IF(R[-16]C<>"",INT(R[-16]C*3.2),"") -> 25600 | K28: =IF(R[-16]C<>"",INT(R[-16]C*3.2),"") -> 25600 | L28: =IF(R[-16]C<>"",INT(R[-16]C*3.2),"") ->  | M28: =IF(R[-16]C<>"",INT(R[-16]C*3.2),"") ->  | N28: =IF(R[-16]C<>"",INT(R[-16]C*3.2),"") ->  | O28: =IF(R[-16]C<>"",INT(R[-16]C*1.5),"") ->  | AG28: =VLOOKUP(RC[-31],其他!R1C1:R7C2,2,0)&RC[-29]&RC[-28]&RC[-27]&"|r" -> |cFF99FF66[2级]赤血护手|r | AH28: =IF(RC[-26]&RC[-25]&RC[-24]&RC[-23]&RC[-22]&RC[-21]="",,R1C7)&IF(RC[-26]="",,"|n"&R1C8&RC[-26])&IF(RC[-25]="",,"|n"&R1C9&RC[-25])&IF(RC[-24]="",,"|n"&R1C10&RC[-24])&IF(RC[-23]="",,"|n"&R1C11&RC[-23])&IF(RC[-22]="",,"|n"&R1C12&RC[-22])&IF(RC[-21]="",,"|n"&R1C13&RC[-21])&IF(RC[-19]&RC[-18]&RC[-17]&RC[-16]="",,"|n"&R1C14)&IF(RC[-19]="",,"|n"&R1C15&RC[-19])&IF(RC[-18]="",,"|n"&R1C16&RC[-18])&IF(RC[-17]="",,"|n"&R1C17&RC[-17])&IF(RC[-16]="",,"|n"&R1C18&RC[-16])&IF(RC[-15]="",,"|n"&R1C19&RC[-15])&IF(RC[-14]="",,"|n"&R1C20&RC[-14])&IF(RC[-13]="",,"|n"&R1C21&RC[-13])&IF(RC[-12]="",,"|n"&R1C22&RC[-12])&IF(RC[-11]="",,"|n"&R1C23&RC[-11])&IF(RC[-10]="",,"|n"&R1C24&RC[-10])&IF(RC[-9]="",,"|n"&R1C25&RC[-9])&IF(RC[-8]="",,"|n"&R1C26&RC[-8])&IF(RC[-7]="",,"|n"&R1C27&RC[-7])&IF(RC[-6]="",,"|n"&R1C28&RC[-6])&IF(RC[-5]="",,"|n"&R1C29&RC[-5])&IF(RC[-2]="",,"|n|n"&RC[-2]) -> |cFFFFFF99基础属性|r|n力量:25600|n敏捷:25600|n智力:25600
A29: 26 | B29: 2 | D29: ="["&RC[-2]&"级]" -> [2级] | E29: 赤血 | F29: 护肩 | H29: =IF(R[-16]C<>"",INT(R[-16]C*3.2),"") ->  | I29: =IF(R[-16]C<>"",INT(R[-16]C*3.2),"") -> 51200 | J29: =IF(R[-16]C<>"",INT(R[-16]C*3.2),"") ->  | K29: =IF(R[-16]C<>"",INT(R[-16]C*3.2),"") ->  | L29: =IF(R[-16]C<>"",INT(R[-16]C*3.2),"") ->  | M29: =IF(R[-16]C<>"",INT(R[-16]C*3.2),"") ->  | N29: =IF(R[-16]C<>"",INT(R[-16]C*3.2),"") ->  | O29: =IF(R[-16]C<>"",INT(R[-16]C*1.5),"") ->  | AG29: =VLOOKUP(RC[-31],其他!R1C1:R7C2,2,0)&RC[-29]&RC[-28]&RC[-27]&"|r" -> |cFF99FF66[2级]赤血护肩|r | AH29: =IF(RC[-26]&RC[-25]&RC[-24]&RC[-23]&RC[-22]&RC[-21]="",,R1C7)&IF(RC[-26]="",,"|n"&R1C8&RC[-26])&IF(RC[-25]="",,"|n"&R1C9&RC[-25])&IF(RC[-24]="",,"|n"&R1C10&RC[-24])&IF(RC[-23]="",,"|n"&R1C11&RC[-23])&IF(RC[-22]="",,"|n"&R1C12&RC[-22])&IF(RC[-21]="",,"|n"&R1C13&RC[-21])&IF(RC[-19]&RC[-18]&RC[-17]&RC[-16]="",,"|n"&R1C14)&IF(RC[-19]="",,"|n"&R1C15&RC[-19])&IF(RC[-18]="",,"|n"&R1C16&RC[-18])&IF(RC[-17]="",,"|n"&R1C17&RC[-17])&IF(RC[-16]="",,"|n"&R1C18&RC[-16])&IF(RC[-15]="",,"|n"&R1C19&RC[-15])&IF(RC[-14]="",,"|n"&R1C20&RC[-14])&IF(RC[-13]="",,"|n"&R1C21&RC[-13])&IF(RC[-12]="",,"|n"&R1C22&RC[-12])&IF(RC[-11]="",,"|n"&R1C23&RC[-11])&IF(RC[-10]="",,"|n"&R1C24&RC[-10])&IF(RC[-9]="",,"|n"&R1C25&RC[-9])&IF(RC[-8]="",,"|n"&R1C26&RC[-8])&IF(RC[-7]="",,"|n"&R1C27&RC[-7])&IF(RC[-6]="",,"|n"&R1C28&RC[-6])&IF(RC[-5]="",,"|n"&R1C29&RC[-5])&IF(RC[-2]="",,"|n|n"&RC[-2]) -> |cFFFFFF99基础属性|r|n力量:51200
A30: 27 | B30: 2 | D30: ="["&RC[-2]&"级]" -> [2级] | E30: 赤血 | F30: 腿甲 | H30: =IF(R[-16]C<>"",INT(R[-16]C*3.2),"") ->  | I30: =IF(R[-16]C<>"",INT(R[-16]C*3.2),"") ->  | J30: =IF(R[-16]C<>"",INT(R[-16]C*3.2),"") ->  | K30: =IF(R[-16]C<>"",INT(R[-16]C*3.2),"") ->  | L30: =IF(R[-16]C<>"",INT(R[-16]C*3.2),"") ->  | M30: =IF(R[-16]C<>"",INT(R[-16]C*1.3),"") -> 6500 | N30: =IF(R[-16]C<>"",INT(R[-16]C*3.2),"") ->  | O30: =IF(R[-16]C<>"",INT(R[-16]C*1.5),"") ->  | AG30: =VLOOKUP(RC[-31],其他!R1C1:R7C2,2,0)&RC[-29]&RC[-28]&RC[-27]&"|r" -> |cFF99FF66[2级]赤血腿甲|r | AH30: =IF(RC[-26]&RC[-25]&RC[-24]&RC[-23]&RC[-22]&RC[-21]="",,R1C7)&IF(RC[-26]="",,"|n"&R1C8&RC[-26])&IF(RC[-25]="",,"|n"&R1C9&RC[-25])&IF(RC[-24]="",,"|n"&R1C10&RC[-24])&IF(RC[-23]="",,"|n"&R1C11&RC[-23])&IF(RC[-22]="",,"|n"&R1C12&RC[-22])&IF(RC[-21]="",,"|n"&R1C13&RC[-21])&IF(RC[-19]&RC[-18]&RC[-17]&RC[-16]="",,"|n"&R1C14)&IF(RC[-19]="",,"|n"&R1C15&RC[-19])&IF(RC[-18]="",,"|n"&R1C16&RC[-18])&IF(RC[-17]="",,"|n"&R1C17&RC[-17])&IF(RC[-16]="",,"|n"&R1C18&RC[-16])&IF(RC[-15]="",,"|n"&R1C19&RC[-15])&IF(RC[-14]="",,"|n"&R1C20&RC[-14])&IF(RC[-13]="",,"|n"&R1C21&RC[-13])&IF(RC[-12]="",,"|n"&R1C22&RC[-12])&IF(RC[-11]="",,"|n"&R1C23&RC[-11])&IF(RC[-10]="",,"|n"&R1C24&RC[-10])&IF(RC[-9]="",,"|n"&R1C25&RC[-9])&IF(RC[-8]="",,"|n"&R1C26&RC[-8])&IF(RC[-7]="",,"|n"&R1C27&RC[-7])&IF(RC[-6]="",,"|n"&R1C28&RC[-6])&IF(RC[-5]="",,"|n"&R1C29&RC[-5])&IF(RC[-2]="",,"|n|n"&RC[-2]) -> |cFFFFFF99基础属性|r|n护甲:6500
A31: 28 | B31: 2 | D31: ="["&RC[-2]&"级]" -> [2级] | E31: 赤血 | F31: 头饰 | H31: =IF(R[-16]C<>"",INT(R[-16]C*3.2),"") ->  | I31: =IF(R[-16]C<>"",INT(R[-16]C*3.2),"") ->  | J31: =IF(R[-16]C<>"",INT(R[-16]C*3.2),"") ->  | K31: =IF(R[-16]C<>"",INT(R[-16]C*3.2),"") -> 51200 | L31: =IF(R[-16]C<>"",INT(R[-16]C*3.2),"") ->  | M31: =IF(R[-16]C<>"",INT(R[-16]C*3.2),"") ->  | N31: =IF(R[-16]C<>"",INT(R[-16]C*3.2),"") ->  | O31: =IF(R[-16]C<>"",INT(R[-16]C*1.5),"") ->  | AG31: =VLOOKUP(RC[-31],其他!R1C1:R7C2,2,0)&RC[-29]&RC[-28]&RC[-27]&"|r" -> |cFF99FF66[2级]赤血头饰|r | AH31: =IF(RC[-26]&RC[-25]&RC[-24]&RC[-23]&RC[-22]&RC[-21]="",,R1C7)&IF(RC[-26]="",,"|n"&R1C8&RC[-26])&IF(RC[-25]="",,"|n"&R1C9&RC[-25])&IF(RC[-24]="",,"|n"&R1C10&RC[-24])&IF(RC[-23]="",,"|n"&R1C11&RC[-23])&IF(RC[-22]="",,"|n"&R1C12&RC[-22])&IF(RC[-21]="",,"|n"&R1C13&RC[-21])&IF(RC[-19]&RC[-18]&RC[-17]&RC[-16]="",,"|n"&R1C14)&IF(RC[-19]="",,"|n"&R1C15&RC[-19])&IF(RC[-18]="",,"|n"&R1C16&RC[-18])&IF(RC[-17]="",,"|n"&R1C17&RC[-17])&IF(RC[-16]="",,"|n"&R1C18&RC[-16])&IF(RC[-15]="",,"|n"&R1C19&RC[-15])&IF(RC[-14]="",,"|n"&R1C20&RC[-14])&IF(RC[-13]="",,"|n"&R1C21&RC[-13])&IF(RC[-12]="",,"|n"&R1C22&RC[-12])&IF(RC[-11]="",,"|n"&R1C23&RC[-11])&IF(RC[-10]="",,"|n"&R1C24&RC[-10])&IF(RC[-9]="",,"|n"&R1C25&RC[-9])&IF(RC[-8]="",,"|n"&R1C26&RC[-8])&IF(RC[-7]="",,"|n"&R1C27&RC[-7])&IF(RC[-6]="",,"|n"&R1C28&RC[-6])&IF(RC[-5]="",,"|n"&R1C29&RC[-5])&IF(RC[-2]="",,"|n|n"&RC[-2]) -> |cFFFFFF99基础属性|r|n智力:51200
A32: 27 | B32: 2 | D32: ="["&RC[-2]&"级]" -> [2级] | E32: 赤血 | F32: 战靴 | H32: =IF(R[-16]C<>"",INT(R[-16]C*3.2),"") ->  | I32: =IF(R[-16]C<>"",INT(R[-16]C*3.2),"") ->  | J32: =IF(R[-16]C<>"",INT(R[-16]C*3.2),"") -> 51200 | K32: =IF(R[-16]C<>"",INT(R[-16]C*3.2),"") ->  | L32: =IF(R[-16]C<>"",INT(R[-16]C*3.2),"") ->  | M32: =IF(R[-16]C<>"",INT(R[-16]C*3.2),"") ->  | N32: =IF(R[-16]C<>"",INT(R[-16]C*3.2),"") ->  | O32: =IF(R[-16]C<>"",INT(R[-16]C*1.5),"") ->  | AG32: =VLOOKUP(RC[-31],其他!R1C1:R7C2,2,0)&RC[-29]&RC[-28]&RC[-27]&"|r" -> |cFF99FF66[2级]赤血战靴|r | AH32: =IF(RC[-26]&RC[-25]&RC[-24]&RC[-23]&RC[-22]&RC[-21]="",,R1C7)&IF(RC[-26]="",,"|n"&R1C8&RC[-26])&IF(RC[-25]="",,"|n"&R1C9&RC[-25])&IF(RC[-24]="",,"|n"&R1C10&RC[-24])&IF(RC[-23]="",,"|n"&R1C11&RC[-23])&IF(RC[-22]="",,"|n"&R1C12&RC[-22])&IF(RC[-21]="",,"|n"&R1C13&RC[-21])&IF(RC[-19]&RC[-18]&RC[-17]&RC[-16]="",,"|n"&R1C14)&IF(RC[-19]="",,"|n"&R1C15&RC[-19])&IF(RC[-18]="",,"|n"&R1C16&RC[-18])&IF(RC[-17]="",,"|n"&R1C17&RC[-17])&IF(RC[-16]="",,"|n"&R1C18&RC[-16])&IF(RC[-15]="",,"|n"&R1C19&RC[-15])&IF(RC[-14]="",,"|n"&R1C20&RC[-14])&IF(RC[-13]="",,"|n"&R1C21&RC[-13])&IF(RC[-12]="",,"|n"&R1C22&RC[-12])&IF(RC[-11]="",,"|n"&R1C23&RC[-11])&IF(RC[-10]="",,"|n"&R1C24&RC[-10])&IF(RC[-9]="",,"|n"&R1C25&RC[-9])&IF(RC[-8]="",,"|n"&R1C26&RC[-8])&IF(RC[-7]="",,"|n"&R1C27&RC[-7])&IF(RC[-6]="",,"|n"&R1C28&RC[-6])&IF(RC[-5]="",,"|n"&R1C29&RC[-5])&IF(RC[-2]="",,"|n|n"&RC[-2]) -> |cFFFFFF99基础属性|r|n敏捷:51200
A33: 28 | B33: 2 | D33: ="["&RC[-2]&"级]" -> [2级] | E33: 赤血 | F33: 腰带 | H33: =IF(R[-16]C<>"",INT(R[-16]C*3.2),"") ->  | I33: =IF(R[-16]C<>"",INT(R[-16]C*3.2),"") ->  | J33: =IF(R[-16]C<>"",INT(R[-16]C*3.2),"") ->  | K33: =IF(R[-16]C<>"",INT(R[-16]C*3.2),"") ->  | L33: =IF(R[-16]C<>"",INT(R[-16]C*3.2),"") ->  | M33: =IF(R[-16]C<>"",INT(R[-16]C*3.2),"") ->  | N33: =IF(R[-16]C<>"",INT(R[-16]C*3.2),"") ->  | O33: =IF(R[-16]C<>"",INT(R[-16]C*1.3),"") -> 26 | AG33: =VLOOKUP(RC[-31],其他!R1C1:R7C2,2,0)&RC[-29]&RC[-28]&RC[-27]&"|r" -> |cFF99FF66[2级]赤血腰带|r | AH33: =IF(RC[-26]&RC[-25]&RC[-24]&RC[-23]&RC[-22]&RC[-21]="",,R1C7)&IF(RC[-26]="",,"|n"&R1C8&RC[-26])&IF(RC[-25]="",,"|n"&R1C9&RC[-25])&IF(RC[-24]="",,"|n"&R1C10&RC[-24])&IF(RC[-23]="",,"|n"&R1C11&RC[-23])&IF(RC[-22]="",,"|n"&R1C12&RC[-22])&IF(RC[-21]="",,"|n"&R1C13&RC[-21])&IF(RC[-19]&RC[-18]&RC[-17]&RC[-16]="",,"|n"&R1C14)&IF(RC[-19]="",,"|n"&R1C15&RC[-19])&IF(RC[-18]="",,"|n"&R1C16&RC[-18])&IF(RC[-17]="",,"|n"&R1C17&RC[-17])&IF(RC[-16]="",,"|n"&R1C18&RC[-16])&IF(RC[-15]="",,"|n"&R1C19&RC[-15])&IF(RC[-14]="",,"|n"&R1C20&RC[-14])&IF(RC[-13]="",,"|n"&R1C21&RC[-13])&IF(RC[-12]="",,"|n"&R1C22&RC[-12])&IF(RC[-11]="",,"|n"&R1C23&RC[-11])&IF(RC[-10]="",,"|n"&R1C24&RC[-10])&IF(RC[-9]="",,"|n"&R1C25&RC[-9])&IF(RC[-8]="",,"|n"&R1C26&RC[-8])&IF(RC[-7]="",,"|n"&R1C27&RC[-7])&IF(RC[-6]="",,"|n"&R1C28&RC[-6])&IF(RC[-5]="",,"|n"&R1C29&RC[-5])&IF(RC[-2]="",,"|n|n"&RC[-2]) -> |n|cFFFFFF55附加属性|r(%)|n攻速:26
A34: 29 | B34: 3 | D34: ="["&RC[-2]&"级]" -> [3级] | E34: 骑士 | F34: 长刃 | H34: =IF(R[-16]C<>"",INT(R[-16]C*3.2),"") -> 307200 | I34: =IF(R[-16]C<>"",INT(R[-16]C*3.2),"") ->  | J34: =IF(R[-16]C<>"",INT(R[-16]C*3.2),"") ->  | K34: =IF(R[-16]C<>"",INT(R[-16]C*3.2),"") ->  | L34: =IF(R[-16]C<>"",INT(R[-16]C*3.2),"") ->  | M34: =IF(R[-16]C<>"",INT(R[-16]C*3.2),"") ->  | N34: =IF(R[-16]C<>"",INT(R[-16]C*3.2),"") ->  | O34: =IF(R[-16]C<>"",INT(R[-16]C*1.5),"") ->  | AG34: =VLOOKUP(RC[-31],其他!R1C1:R7C2,2,0)&RC[-29]&RC[-28]&RC[-27]&"|r" -> |cFF1BE6B8[3级]骑士长刃|r | AH34: =IF(RC[-26]&RC[-25]&RC[-24]&RC[-23]&RC[-22]&RC[-21]="",,R1C7)&IF(RC[-26]="",,"|n"&R1C8&RC[-26])&IF(RC[-25]="",,"|n"&R1C9&RC[-25])&IF(RC[-24]="",,"|n"&R1C10&RC[-24])&IF(RC[-23]="",,"|n"&R1C11&RC[-23])&IF(RC[-22]="",,"|n"&R1C12&RC[-22])&IF(RC[-21]="",,"|n"&R1C13&RC[-21])&IF(RC[-19]&RC[-18]&RC[-17]&RC[-16]="",,"|n"&R1C14)&IF(RC[-19]="",,"|n"&R1C15&RC[-19])&IF(RC[-18]="",,"|n"&R1C16&RC[-18])&IF(RC[-17]="",,"|n"&R1C17&RC[-17])&IF(RC[-16]="",,"|n"&R1C18&RC[-16])&IF(RC[-15]="",,"|n"&R1C19&RC[-15])&IF(RC[-14]="",,"|n"&R1C20&RC[-14])&IF(RC[-13]="",,"|n"&R1C21&RC[-13])&IF(RC[-12]="",,"|n"&R1C22&RC[-12])&IF(RC[-11]="",,"|n"&R1C23&RC[-11])&IF(RC[-10]="",,"|n"&R1C24&RC[-10])&IF(RC[-9]="",,"|n"&R1C25&RC[-9])&IF(RC[-8]="",,"|n"&R1C26&RC[-8])&IF(RC[-7]="",,"|n"&R1C27&RC[-7])&IF(RC[-6]="",,"|n"&R1C28&RC[-6])&IF(RC[-5]="",,"|n"&R1C29&RC[-5])&IF(RC[-2]="",,"|n|n"&RC[-2]) -> |cFFFFFF99基础属性|r|n攻击:307200
A35: 30 | B35: 3 | D35: ="["&RC[-2]&"级]" -> [3级] | E35: 骑士 | F35: 胸甲 | H35: =IF(R[-16]C<>"",INT(R[-16]C*3.2),"") ->  | I35: =IF(R[-16]C<>"",INT(R[-16]C*3.2),"") ->  | J35: =IF(R[-16]C<>"",INT(R[-16]C*3.2),"") ->  | K35: =IF(R[-16]C<>"",INT(R[-16]C*3.2),"") ->  | L35: =IF(R[-16]C<>"",INT(R[-16]C*3.2),"") -> 1024000 | M35: =IF(R[-16]C<>"",INT(R[-16]C*3.2),"") ->  | N35: =IF(R[-16]C<>"",INT(R[-16]C*3.2),"") ->  | O35: =IF(R[-16]C<>"",INT(R[-16]C*1.5),"") ->  | AG35: =VLOOKUP(RC[-31],其他!R1C1:R7C2,2,0)&RC[-29]&RC[-28]&RC[-27]&"|r" -> |cFF1BE6B8[3级]骑士胸甲|r | AH35: =IF(RC[-26]&RC[-25]&RC[-24]&RC[-23]&RC[-22]&RC[-21]="",,R1C7)&IF(RC[-26]="",,"|n"&R1C8&RC[-26])&IF(RC[-25]="",,"|n"&R1C9&RC[-25])&IF(RC[-24]="",,"|n"&R1C10&RC[-24])&IF(RC[-23]="",,"|n"&R1C11&RC[-23])&IF(RC[-22]="",,"|n"&R1C12&RC[-22])&IF(RC[-21]="",,"|n"&R1C13&RC[-21])&IF(RC[-19]&RC[-18]&RC[-17]&RC[-16]="",,"|n"&R1C14)&IF(RC[-19]="",,"|n"&R1C15&RC[-19])&IF(RC[-18]="",,"|n"&R1C16&RC[-18])&IF(RC[-17]="",,"|n"&R1C17&RC[-17])&IF(RC[-16]="",,"|n"&R1C18&RC[-16])&IF(RC[-15]="",,"|n"&R1C19&RC[-15])&IF(RC[-14]="",,"|n"&R1C20&RC[-14])&IF(RC[-13]="",,"|n"&R1C21&RC[-13])&IF(RC[-12]="",,"|n"&R1C22&RC[-12])&IF(RC[-11]="",,"|n"&R1C23&RC[-11])&IF(RC[-10]="",,"|n"&R1C24&RC[-10])&IF(RC[-9]="",,"|n"&R1C25&RC[-9])&IF(RC[-8]="",,"|n"&R1C26&RC[-8])&IF(RC[-7]="",,"|n"&R1C27&RC[-7])&IF(RC[-6]="",,"|n"&R1C28&RC[-6])&IF(RC[-5]="",,"|n"&R1C29&RC[-5])&IF(RC[-2]="",,"|n|n"&RC[-2]) -> |cFFFFFF99基础属性|r|n血量:1024000
A36: 31 | B36: 3 | D36: ="["&RC[-2]&"级]" -> [3级] | E36: 骑士 | F36: 护手 | H36: =IF(R[-16]C<>"",INT(R[-16]C*3.2),"") ->  | I36: =IF(R[-16]C<>"",INT(R[-16]C*3.2),"") -> 81920 | J36: =IF(R[-16]C<>"",INT(R[-16]C*3.2),"") -> 81920 | K36: =IF(R[-16]C<>"",INT(R[-16]C*3.2),"") -> 81920 | L36: =IF(R[-16]C<>"",INT(R[-16]C*3.2),"") ->  | M36: =IF(R[-16]C<>"",INT(R[-16]C*3.2),"") ->  | N36: =IF(R[-16]C<>"",INT(R[-16]C*3.2),"") ->  | O36: =IF(R[-16]C<>"",INT(R[-16]C*1.5),"") ->  | AG36: =VLOOKUP(RC[-31],其他!R1C1:R7C2,2,0)&RC[-29]&RC[-28]&RC[-27]&"|r" -> |cFF1BE6B8[3级]骑士护手|r | AH36: =IF(RC[-26]&RC[-25]&RC[-24]&RC[-23]&RC[-22]&RC[-21]="",,R1C7)&IF(RC[-26]="",,"|n"&R1C8&RC[-26])&IF(RC[-25]="",,"|n"&R1C9&RC[-25])&IF(RC[-24]="",,"|n"&R1C10&RC[-24])&IF(RC[-23]="",,"|n"&R1C11&RC[-23])&IF(RC[-22]="",,"|n"&R1C12&RC[-22])&IF(RC[-21]="",,"|n"&R1C13&RC[-21])&IF(RC[-19]&RC[-18]&RC[-17]&RC[-16]="",,"|n"&R1C14)&IF(RC[-19]="",,"|n"&R1C15&RC[-19])&IF(RC[-18]="",,"|n"&R1C16&RC[-18])&IF(RC[-17]="",,"|n"&R1C17&RC[-17])&IF(RC[-16]="",,"|n"&R1C18&RC[-16])&IF(RC[-15]="",,"|n"&R1C19&RC[-15])&IF(RC[-14]="",,"|n"&R1C20&RC[-14])&IF(RC[-13]="",,"|n"&R1C21&RC[-13])&IF(RC[-12]="",,"|n"&R1C22&RC[-12])&IF(RC[-11]="",,"|n"&R1C23&RC[-11])&IF(RC[-10]="",,"|n"&R1C24&RC[-10])&IF(RC[-9]="",,"|n"&R1C25&RC[-9])&IF(RC[-8]="",,"|n"&R1C26&RC[-8])&IF(RC[-7]="",,"|n"&R1C27&RC[-7])&IF(RC[-6]="",,"|n"&R1C28&RC[-6])&IF(RC[-5]="",,"|n"&R1C29&RC[-5])&IF(RC[-2]="",,"|n|n"&RC[-2]) -> |cFFFFFF99基础属性|r|n力量:81920|n敏捷:81920|n智力:81920
A37: 32 | B37: 3 | D37: ="["&RC[-2]&"级]" -> [3级] | E37: 骑士 | F37: 护肩 | H37: =IF(R[-16]C<>"",INT(R[-16]C*3.2),"") ->  | I37: =IF(R[-16]C<>"",INT(R[-16]C*3.2),"") -> 163840 | J37: =IF(R[-16]C<>"",INT(R[-16]C*3.2),"") ->  | K37: =IF(R[-16]C<>"",INT(R[-16]C*3.2),"") ->  | L37: =IF(R[-16]C<>"",INT(R[-16]C*3.2),"") ->  | M37: =IF(R[-16]C<>"",INT(R[-16]C*3.2),"") ->  | N37: =IF(R[-16]C<>"",INT(R[-16]C*3.2),"") ->  | O37: =IF(R[-16]C<>"",INT(R[-16]C*1.5),"") ->  | AG37: =VLOOKUP(RC[-31],其他!R1C1:R7C2,2,0)&RC[-29]&RC[-28]&RC[-27]&"|r" -> |cFF1BE6B8[3级]骑士护肩|r | AH37: =IF(RC[-26]&RC[-25]&RC[-24]&RC[-23]&RC[-22]&RC[-21]="",,R1C7)&IF(RC[-26]="",,"|n"&R1C8&RC[-26])&IF(RC[-25]="",,"|n"&R1C9&RC[-25])&IF(RC[-24]="",,"|n"&R1C10&RC[-24])&IF(RC[-23]="",,"|n"&R1C11&RC[-23])&IF(RC[-22]="",,"|n"&R1C12&RC[-22])&IF(RC[-21]="",,"|n"&R1C13&RC[-21])&IF(RC[-19]&RC[-18]&RC[-17]&RC[-16]="",,"|n"&R1C14)&IF(RC[-19]="",,"|n"&R1C15&RC[-19])&IF(RC[-18]="",,"|n"&R1C16&RC[-18])&IF(RC[-17]="",,"|n"&R1C17&RC[-17])&IF(RC[-16]="",,"|n"&R1C18&RC[-16])&IF(RC[-15]="",,"|n"&R1C19&RC[-15])&IF(RC[-14]="",,"|n"&R1C20&RC[-14])&IF(RC[-13]="",,"|n"&R1C21&RC[-13])&IF(RC[-12]="",,"|n"&R1C22&RC[-12])&IF(RC[-11]="",,"|n"&R1C23&RC[-11])&IF(RC[-10]="",,"|n"&R1C24&RC[-10])&IF(RC[-9]="",,"|n"&R1C25&RC[-9])&IF(RC[-8]="",,"|n"&R1C26&RC[-8])&IF(RC[-7]="",,"|n"&R1C27&RC[-7])&IF(RC[-6]="",,"|n"&R1C28&RC[-6])&IF(RC[-5]="",,"|n"&R1C29&RC[-5])&IF(RC[-2]="",,"|n|n"&RC[-2]) -> |cFFFFFF99基础属性|r|n力量:163840
A38: 33 | B38: 3 | D38: ="["&RC[-2]&"级]" -> [3级] | E38: 骑士 | F38: 腿甲 | H38: =IF(R[-16]C<>"",INT(R[-16]C*3.2),"") ->  | I38: =IF(R[-16]C<>"",INT(R[-16]C*3.2),"") ->  | J38: =IF(R[-16]C<>"",INT(R[-16]C*3.2),"") ->  | K38: =IF(R[-16]C<>"",INT(R[-16]C*3.2),"") ->  | L38: =IF(R[-16]C<>"",INT(R[-16]C*3.2),"") ->  | M38: =IF(R[-16]C<>"",INT(R[-16]C*1.3),"") -> 8450 | N38: =IF(R[-16]C<>"",INT(R[-16]C*3.2),"") ->  | O38: =IF(R[-16]C<>"",INT(R[-16]C*1.5),"") ->  | AG38: =VLOOKUP(RC[-31],其他!R1C1:R7C2,2,0)&RC[-29]&RC[-28]&RC[-27]&"|r" -> |cFF1BE6B8[3级]骑士腿甲|r | AH38: =IF(RC[-26]&RC[-25]&RC[-24]&RC[-23]&RC[-22]&RC[-21]="",,R1C7)&IF(RC[-26]="",,"|n"&R1C8&RC[-26])&IF(RC[-25]="",,"|n"&R1C9&RC[-25])&IF(RC[-24]="",,"|n"&R1C10&RC[-24])&IF(RC[-23]="",,"|n"&R1C11&RC[-23])&IF(RC[-22]="",,"|n"&R1C12&RC[-22])&IF(RC[-21]="",,"|n"&R1C13&RC[-21])&IF(RC[-19]&RC[-18]&RC[-17]&RC[-16]="",,"|n"&R1C14)&IF(RC[-19]="",,"|n"&R1C15&RC[-19])&IF(RC[-18]="",,"|n"&R1C16&RC[-18])&IF(RC[-17]="",,"|n"&R1C17&RC[-17])&IF(RC[-16]="",,"|n"&R1C18&RC[-16])&IF(RC[-15]="",,"|n"&R1C19&RC[-15])&IF(RC[-14]="",,"|n"&R1C20&RC[-14])&IF(RC[-13]="",,"|n"&R1C21&RC[-13])&IF(RC[-12]="",,"|n"&R1C22&RC[-12])&IF(RC[-11]="",,"|n"&R1C23&RC[-11])&IF(RC[-10]="",,"|n"&R1C24&RC[-10])&IF(RC[-9]="",,"|n"&R1C25&RC[-9])&IF(RC[-8]="",,"|n"&R1C26&RC[-8])&IF(RC[-7]="",,"|n"&R1C27&RC[-7])&IF(RC[-6]="",,"|n"&R1C28&RC[-6])&IF(RC[-5]="",,"|n"&R1C29&RC[-5])&IF(RC[-2]="",,"|n|n"&RC[-2]) -> |cFFFFFF99基础属性|r|n护甲:8450
A39: 34 | B39: 3 | D39: ="["&RC[-2]&"级]" -> [3级] | E39: 骑士 | F39: 头饰 | H39: =IF(R[-16]C<>"",INT(R[-16]C*3.2),"") ->  | I39: =IF(R[-16]C<>"",INT(R[-16]C*3.2),"") ->  | J39: =IF(R[-16]C<>"",INT(R[-16]C*3.2),"") ->  | K39: =IF(R[-16]C<>"",INT(R[-16]C*3.2),"") -> 163840 | L39: =IF(R[-16]C<>"",INT(R[-16]C*3.2),"") ->  | M39: =IF(R[-16]C<>"",INT(R[-16]C*3.2),"") ->  | N39: =IF(R[-16]C<>"",INT(R[-16]C*3.2),"") ->  | O39: =IF(R[-16]C<>"",INT(R[-16]C*1.5),"") ->  | AG39: =VLOOKUP(RC[-31],其他!R1C1:R7C2,2,0)&RC[-29]&RC[-28]&RC[-27]&"|r" -> |cFF1BE6B8[3级]骑士头饰|r | AH39: =IF(RC[-26]&RC[-25]&RC[-24]&RC[-23]&RC[-22]&RC[-21]="",,R1C7)&IF(RC[-26]="",,"|n"&R1C8&RC[-26])&IF(RC[-25]="",,"|n"&R1C9&RC[-25])&IF(RC[-24]="",,"|n"&R1C10&RC[-24])&IF(RC[-23]="",,"|n"&R1C11&RC[-23])&IF(RC[-22]="",,"|n"&R1C12&RC[-22])&IF(RC[-21]="",,"|n"&R1C13&RC[-21])&IF(RC[-19]&RC[-18]&RC[-17]&RC[-16]="",,"|n"&R1C14)&IF(RC[-19]="",,"|n"&R1C15&RC[-19])&IF(RC[-18]="",,"|n"&R1C16&RC[-18])&IF(RC[-17]="",,"|n"&R1C17&RC[-17])&IF(RC[-16]="",,"|n"&R1C18&RC[-16])&IF(RC[-15]="",,"|n"&R1C19&RC[-15])&IF(RC[-14]="",,"|n"&R1C20&RC[-14])&IF(RC[-13]="",,"|n"&R1C21&RC[-13])&IF(RC[-12]="",,"|n"&R1C22&RC[-12])&IF(RC[-11]="",,"|n"&R1C23&RC[-11])&IF(RC[-10]="",,"|n"&R1C24&RC[-10])&IF(RC[-9]="",,"|n"&R1C25&RC[-9])&IF(RC[-8]="",,"|n"&R1C26&RC[-8])&IF(RC[-7]="",,"|n"&R1C27&RC[-7])&IF(RC[-6]="",,"|n"&R1C28&RC[-6])&IF(RC[-5]="",,"|n"&R1C29&RC[-5])&IF(RC[-2]="",,"|n|n"&RC[-2]) -> |cFFFFFF99基础属性|r|n智力:163840
A40: 35 | B40: 3 | D40: ="["&RC[-2]&"级]" -> [3级] | E40: 骑士 | F40: 战靴 | H40: =IF(R[-16]C<>"",INT(R[-16]C*3.2),"") ->  | I40: =IF(R[-16]C<>"",INT(R[-16]C*3.2),"") ->  | J40: =IF(R[-16]C<>"",INT(R[-16]C*3.2),"") -> 163840 | K40: =IF(R[-16]C<>"",INT(R[-16]C*3.2),"") ->  | L40: =IF(R[-16]C<>"",INT(R[-16]C*3.2),"") ->  | M40: =IF(R[-16]C<>"",INT(R[-16]C*3.2),"") ->  | N40: =IF(R[-16]C<>"",INT(R[-16]C*3.2),"") ->  | O40: =IF(R[-16]C<>"",INT(R[-16]C*1.5),"") ->  | AG40: =VLOOKUP(RC[-31],其他!R1C1:R7C2,2,0)&RC[-29]&RC[-28]&RC[-27]&"|r" -> |cFF1BE6B8[3级]骑士战靴|r | AH40: =IF(RC[-26]&RC[-25]&RC[-24]&RC[-23]&RC[-22]&RC[-21]="",,R1C7)&IF(RC[-26]="",,"|n"&R1C8&RC[-26])&IF(RC[-25]="",,"|n"&R1C9&RC[-25])&IF(RC[-24]="",,"|n"&R1C10&RC[-24])&IF(RC[-23]="",,"|n"&R1C11&RC[-23])&IF(RC[-22]="",,"|n"&R1C12&RC[-22])&IF(RC[-21]="",,"|n"&R1C13&RC[-21])&IF(RC[-19]&RC[-18]&RC[-17]&RC[-16]="",,"|n"&R1C14)&IF(RC[-19]="",,"|n"&R1C15&RC[-19])&IF(RC[-18]="",,"|n"&R1C16&RC[-18])&IF(RC[-17]="",,"|n"&R1C17&RC[-17])&IF(RC[-16]="",,"|n"&R1C18&RC[-16])&IF(RC[-15]="",,"|n"&R1C19&RC[-15])&IF(RC[-14]="",,"|n"&R1C20&RC[-14])&IF(RC[-13]="",,"|n"&R1C21&RC[-13])&IF(RC[-12]="",,"|n"&R1C22&RC[-12])&IF(RC[-11]="",,"|n"&R1C23&RC[-11])&IF(RC[-10]="",,"|n"&R1C24&RC[-10])&IF(RC[-9]="",,"|n"&R1C25&RC[-9])&IF(RC[-8]="",,"|n"&R1C26&RC[-8])&IF(RC[-7]="",,"|n"&R1C27&RC[-7])&IF(RC[-6]="",,"|n"&R1C28&RC[-6])&IF(RC[-5]="",,"|n"&R1C29&RC[-5])&IF(RC[-2]="",,"|n|n"&RC[-2]) -> |cFFFFFF99基础属性|r|n敏捷:163840
A41: 36 | B41: 3 | D41: ="["&RC[-2]&"级]" -> [3级] | E41: 骑士 | F41: 腰带 | H41: =IF(R[-16]C<>"",INT(R[-16]C*3.2),"") ->  | I41: =IF(R[-16]C<>"",INT(R[-16]C*3.2),"") ->  | J41: =IF(R[-16]C<>"",INT(R[-16]C*3.2),"") ->  | K41: =IF(R[-16]C<>"",INT(R[-16]C*3.2),"") ->  | L41: =IF(R[-16]C<>"",INT(R[-16]C*3.2),"") ->  | M41: =IF(R[-16]C<>"",INT(R[-16]C*3.2),"") ->  | N41: =IF(R[-16]C<>"",INT(R[-16]C*3.2),"") ->  | O41: =IF(R[-16]C<>"",INT(R[-16]C*1.3),"") -> 33 | AG41: =VLOOKUP(RC[-31],其他!R1C1:R7C2,2,0)&RC[-29]&RC[-28]&RC[-27]&"|r" -> |cFF1BE6B8[3级]骑士腰带|r | AH41: =IF(RC[-26]&RC[-25]&RC[-24]&RC[-23]&RC[-22]&RC[-21]="",,R1C7)&IF(RC[-26]="",,"|n"&R1C8&RC[-26])&IF(RC[-25]="",,"|n"&R1C9&RC[-25])&IF(RC[-24]="",,"|n"&R1C10&RC[-24])&IF(RC[-23]="",,"|n"&R1C11&RC[-23])&IF(RC[-22]="",,"|n"&R1C12&RC[-22])&IF(RC[-21]="",,"|n"&R1C13&RC[-21])&IF(RC[-19]&RC[-18]&RC[-17]&RC[-16]="",,"|n"&R1C14)&IF(RC[-19]="",,"|n"&R1C15&RC[-19])&IF(RC[-18]="",,"|n"&R1C16&RC[-18])&IF(RC[-17]="",,"|n"&R1C17&RC[-17])&IF(RC[-16]="",,"|n"&R1C18&RC[-16])&IF(RC[-15]="",,"|n"&R1C19&RC[-15])&IF(RC[-14]="",,"|n"&R1C20&RC[-14])&IF(RC[-13]="",,"|n"&R1C21&RC[-13])&IF(RC[-12]="",,"|n"&R1C22&RC[-12])&IF(RC[-11]="",,"|n"&R1C23&RC[-11])&IF(RC[-10]="",,"|n"&R1C24&RC[-10])&IF(RC[-9]="",,"|n"&R1C25&RC[-9])&IF(RC[-8]="",,"|n"&R1C26&RC[-8])&IF(RC[-7]="",,"|n"&R1C27&RC[-7])&IF(RC[-6]="",,"|n"&R1C28&RC[-6])&IF(RC[-5]="",,"|n"&R1C29&RC[-5])&IF(RC[-2]="",,"|n|n"&RC[-2]) -> |n|cFFFFFF55附加属性|r(%)|n攻速:33
A42: 37 | B42: 3 | D42: ="["&RC[-2]&"级]" -> [3级] | E42: 领主 | F42: 长刃 | H42: =IF(R[-16]C<>"",INT(R[-16]C*3.2),"") -> 307200 | I42: =IF(R[-16]C<>"",INT(R[-16]C*3.2),"") ->  | J42: =IF(R[-16]C<>"",INT(R[-16]C*3.2),"") ->  | K42: =IF(R[-16]C<>"",INT(R[-16]C*3.2),"") ->  | L42: =IF(R[-16]C<>"",INT(R[-16]C*3.2),"") ->  | M42: =IF(R[-16]C<>"",INT(R[-16]C*3.2),"") ->  | N42: =IF(R[-16]C<>"",INT(R[-16]C*3.2),"") ->  | O42: =IF(R[-16]C<>"",INT(R[-16]C*1.5),"") ->  | AG42: =VLOOKUP(RC[-31],其他!R1C1:R7C2,2,0)&RC[-29]&RC[-28]&RC[-27]&"|r" -> |cFF1BE6B8[3级]领主长刃|r | AH42: =IF(RC[-26]&RC[-25]&RC[-24]&RC[-23]&RC[-22]&RC[-21]="",,R1C7)&IF(RC[-26]="",,"|n"&R1C8&RC[-26])&IF(RC[-25]="",,"|n"&R1C9&RC[-25])&IF(RC[-24]="",,"|n"&R1C10&RC[-24])&IF(RC[-23]="",,"|n"&R1C11&RC[-23])&IF(RC[-22]="",,"|n"&R1C12&RC[-22])&IF(RC[-21]="",,"|n"&R1C13&RC[-21])&IF(RC[-19]&RC[-18]&RC[-17]&RC[-16]="",,"|n"&R1C14)&IF(RC[-19]="",,"|n"&R1C15&RC[-19])&IF(RC[-18]="",,"|n"&R1C16&RC[-18])&IF(RC[-17]="",,"|n"&R1C17&RC[-17])&IF(RC[-16]="",,"|n"&R1C18&RC[-16])&IF(RC[-15]="",,"|n"&R1C19&RC[-15])&IF(RC[-14]="",,"|n"&R1C20&RC[-14])&IF(RC[-13]="",,"|n"&R1C21&RC[-13])&IF(RC[-12]="",,"|n"&R1C22&RC[-12])&IF(RC[-11]="",,"|n"&R1C23&RC[-11])&IF(RC[-10]="",,"|n"&R1C24&RC[-10])&IF(RC[-9]="",,"|n"&R1C25&RC[-9])&IF(RC[-8]="",,"|n"&R1C26&RC[-8])&IF(RC[-7]="",,"|n"&R1C27&RC[-7])&IF(RC[-6]="",,"|n"&R1C28&RC[-6])&IF(RC[-5]="",,"|n"&R1C29&RC[-5])&IF(RC[-2]="",,"|n|n"&RC[-2]) -> |cFFFFFF99基础属性|r|n攻击:307200
A43: 38 | B43: 3 | D43: ="["&RC[-2]&"级]" -> [3级] | E43: 领主 | F43: 胸甲 | H43: =IF(R[-16]C<>"",INT(R[-16]C*3.2),"") ->  | I43: =IF(R[-16]C<>"",INT(R[-16]C*3.2),"") ->  | J43: =IF(R[-16]C<>"",INT(R[-16]C*3.2),"") ->  | K43: =IF(R[-16]C<>"",INT(R[-16]C*3.2),"") ->  | L43: =IF(R[-16]C<>"",INT(R[-16]C*3.2),"") -> 1024000 | M43: =IF(R[-16]C<>"",INT(R[-16]C*3.2),"") ->  | N43: =IF(R[-16]C<>"",INT(R[-16]C*3.2),"") ->  | O43: =IF(R[-16]C<>"",INT(R[-16]C*1.5),"") ->  | AG43: =VLOOKUP(RC[-31],其他!R1C1:R7C2,2,0)&RC[-29]&RC[-28]&RC[-27]&"|r" -> |cFF1BE6B8[3级]领主胸甲|r | AH43: =IF(RC[-26]&RC[-25]&RC[-24]&RC[-23]&RC[-22]&RC[-21]="",,R1C7)&IF(RC[-26]="",,"|n"&R1C8&RC[-26])&IF(RC[-25]="",,"|n"&R1C9&RC[-25])&IF(RC[-24]="",,"|n"&R1C10&RC[-24])&IF(RC[-23]="",,"|n"&R1C11&RC[-23])&IF(RC[-22]="",,"|n"&R1C12&RC[-22])&IF(RC[-21]="",,"|n"&R1C13&RC[-21])&IF(RC[-19]&RC[-18]&RC[-17]&RC[-16]="",,"|n"&R1C14)&IF(RC[-19]="",,"|n"&R1C15&RC[-19])&IF(RC[-18]="",,"|n"&R1C16&RC[-18])&IF(RC[-17]="",,"|n"&R1C17&RC[-17])&IF(RC[-16]="",,"|n"&R1C18&RC[-16])&IF(RC[-15]="",,"|n"&R1C19&RC[-15])&IF(RC[-14]="",,"|n"&R1C20&RC[-14])&IF(RC[-13]="",,"|n"&R1C21&RC[-13])&IF(RC[-12]="",,"|n"&R1C22&RC[-12])&IF(RC[-11]="",,"|n"&R1C23&RC[-11])&IF(RC[-10]="",,"|n"&R1C24&RC[-10])&IF(RC[-9]="",,"|n"&R1C25&RC[-9])&IF(RC[-8]="",,"|n"&R1C26&RC[-8])&IF(RC[-7]="",,"|n"&R1C27&RC[-7])&IF(RC[-6]="",,"|n"&R1C28&RC[-6])&IF(RC[-5]="",,"|n"&R1C29&RC[-5])&IF(RC[-2]="",,"|n|n"&RC[-2]) -> |cFFFFFF99基础属性|r|n血量:1024000
A44: 39 | B44: 3 | D44: ="["&RC[-2]&"级]" -> [3级] | E44: 领主 | F44: 护手 | H44: =IF(R[-16]C<>"",INT(R[-16]C*3.2),"") ->  | I44: =IF(R[-16]C<>"",INT(R[-16]C*3.2),"") -> 81920 | J44: =IF(R[-16]C<>"",INT(R[-16]C*3.2),"") -> 81920 | K44: =IF(R[-16]C<>"",INT(R[-16]C*3.2),"") -> 81920 | L44: =IF(R[-16]C<>"",INT(R[-16]C*3.2),"") ->  | M44: =IF(R[-16]C<>"",INT(R[-16]C*3.2),"") ->  | N44: =IF(R[-16]C<>"",INT(R[-16]C*3.2),"") ->  | O44: =IF(R[-16]C<>"",INT(R[-16]C*1.5),"") ->  | AG44: =VLOOKUP(RC[-31],其他!R1C1:R7C2,2,0)&RC[-29]&RC[-28]&RC[-27]&"|r" -> |cFF1BE6B8[3级]领主护手|r | AH44: =IF(RC[-26]&RC[-25]&RC[-24]&RC[-23]&RC[-22]&RC[-21]="",,R1C7)&IF(RC[-26]="",,"|n"&R1C8&RC[-26])&IF(RC[-25]="",,"|n"&R1C9&RC[-25])&IF(RC[-24]="",,"|n"&R1C10&RC[-24])&IF(RC[-23]="",,"|n"&R1C11&RC[-23])&IF(RC[-22]="",,"|n"&R1C12&RC[-22])&IF(RC[-21]="",,"|n"&R1C13&RC[-21])&IF(RC[-19]&RC[-18]&RC[-17]&RC[-16]="",,"|n"&R1C14)&IF(RC[-19]="",,"|n"&R1C15&RC[-19])&IF(RC[-18]="",,"|n"&R1C16&RC[-18])&IF(RC[-17]="",,"|n"&R1C17&RC[-17])&IF(RC[-16]="",,"|n"&R1C18&RC[-16])&IF(RC[-15]="",,"|n"&R1C19&RC[-15])&IF(RC[-14]="",,"|n"&R1C20&RC[-14])&IF(RC[-13]="",,"|n"&R1C21&RC[-13])&IF(RC[-12]="",,"|n"&R1C22&RC[-12])&IF(RC[-11]="",,"|n"&R1C23&RC[-11])&IF(RC[-10]="",,"|n"&R1C24&RC[-10])&IF(RC[-9]="",,"|n"&R1C25&RC[-9])&IF(RC[-8]="",,"|n"&R1C26&RC[-8])&IF(RC[-7]="",,"|n"&R1C27&RC[-7])&IF(RC[-6]="",,"|n"&R1C28&RC[-6])&IF(RC[-5]="",,"|n"&R1C29&RC[-5])&IF(RC[-2]="",,"|n|n"&RC[-2]) -> |cFFFFFF99基础属性|r|n力量:81920|n敏捷:81920|n智力:81920
A45: 40 | B45: 3 | D45: ="["&RC[-2]&"级]" -> [3级] | E45: 领主 | F45: 护肩 | H45: =IF(R[-16]C<>"",INT(R[-16]C*3.2),"") ->  | I45: =IF(R[-16]C<>"",INT(R[-16]C*3.2),"") -> 163840 | J45: =IF(R[-16]C<>"",INT(R[-16]C*3.2),"") ->  | K45: =IF(R[-16]C<>"",INT(R[-16]C*3.2),"") ->  | L45: =IF(R[-16]C<>"",INT(R[-16]C*3.2),"") ->  | M45: =IF(R[-16]C<>"",INT(R[-16]C*3.2),"") ->  | N45: =IF(R[-16]C<>"",INT(R[-16]C*3.2),"") ->  | O45: =IF(R[-16]C<>"",INT(R[-16]C*1.5),"") ->  | AG45: =VLOOKUP(RC[-31],其他!R1C1:R7C2,2,0)&RC[-29]&RC[-28]&RC[-27]&"|r" -> |cFF1BE6B8[3级]领主护肩|r | AH45: =IF(RC[-26]&RC[-25]&RC[-24]&RC[-23]&RC[-22]&RC[-21]="",,R1C7)&IF(RC[-26]="",,"|n"&R1C8&RC[-26])&IF(RC[-25]="",,"|n"&R1C9&RC[-25])&IF(RC[-24]="",,"|n"&R1C10&RC[-24])&IF(RC[-23]="",,"|n"&R1C11&RC[-23])&IF(RC[-22]="",,"|n"&R1C12&RC[-22])&IF(RC[-21]="",,"|n"&R1C13&RC[-21])&IF(RC[-19]&RC[-18]&RC[-17]&RC[-16]="",,"|n"&R1C14)&IF(RC[-19]="",,"|n"&R1C15&RC[-19])&IF(RC[-18]="",,"|n"&R1C16&RC[-18])&IF(RC[-17]="",,"|n"&R1C17&RC[-17])&IF(RC[-16]="",,"|n"&R1C18&RC[-16])&IF(RC[-15]="",,"|n"&R1C19&RC[-15])&IF(RC[-14]="",,"|n"&R1C20&RC[-14])&IF(RC[-13]="",,"|n"&R1C21&RC[-13])&IF(RC[-12]="",,"|n"&R1C22&RC[-12])&IF(RC[-11]="",,"|n"&R1C23&RC[-11])&IF(RC[-10]="",,"|n"&R1C24&RC[-10])&IF(RC[-9]="",,"|n"&R1C25&RC[-9])&IF(RC[-8]="",,"|n"&R1C26&RC[-8])&IF(RC[-7]="",,"|n"&R1C27&RC[-7])&IF(RC[-6]="",,"|n"&R1C28&RC[-6])&IF(RC[-5]="",,"|n"&R1C29&RC[-5])&IF(RC[-2]="",,"|n|n"&RC[-2]) -> |cFFFFFF99基础属性|r|n力量:163840
A46: 41 | B46: 3 | D46: ="["&RC[-2]&"级]" -> [3级] | E46: 领主 | F46: 腿甲 | H46: =IF(R[-16]C<>"",INT(R[-16]C*3.2),"") ->  | I46: =IF(R[-16]C<>"",INT(R[-16]C*3.2),"") ->  | J46: =IF(R[-16]C<>"",INT(R[-16]C*3.2),"") ->  | K46: =IF(R[-16]C<>"",INT(R[-16]C*3.2),"") ->  | L46: =IF(R[-16]C<>"",INT(R[-16]C*3.2),"") ->  | M46: =IF(R[-16]C<>"",INT(R[-16]C*1.3),"") -> 8450 | N46: =IF(R[-16]C<>"",INT(R[-16]C*3.2),"") ->  | O46: =IF(R[-16]C<>"",INT(R[-16]C*1.5),"") ->  | AG46: =VLOOKUP(RC[-31],其他!R1C1:R7C2,2,0)&RC[-29]&RC[-28]&RC[-27]&"|r" -> |cFF1BE6B8[3级]领主腿甲|r | AH46: =IF(RC[-26]&RC[-25]&RC[-24]&RC[-23]&RC[-22]&RC[-21]="",,R1C7)&IF(RC[-26]="",,"|n"&R1C8&RC[-26])&IF(RC[-25]="",,"|n"&R1C9&RC[-25])&IF(RC[-24]="",,"|n"&R1C10&RC[-24])&IF(RC[-23]="",,"|n"&R1C11&RC[-23])&IF(RC[-22]="",,"|n"&R1C12&RC[-22])&IF(RC[-21]="",,"|n"&R1C13&RC[-21])&IF(RC[-19]&RC[-18]&RC[-17]&RC[-16]="",,"|n"&R1C14)&IF(RC[-19]="",,"|n"&R1C15&RC[-19])&IF(RC[-18]="",,"|n"&R1C16&RC[-18])&IF(RC[-17]="",,"|n"&R1C17&RC[-17])&IF(RC[-16]="",,"|n"&R1C18&RC[-16])&IF(RC[-15]="",,"|n"&R1C19&RC[-15])&IF(RC[-14]="",,"|n"&R1C20&RC[-14])&IF(RC[-13]="",,"|n"&R1C21&RC[-13])&IF(RC[-12]="",,"|n"&R1C22&RC[-12])&IF(RC[-11]="",,"|n"&R1C23&RC[-11])&IF(RC[-10]="",,"|n"&R1C24&RC[-10])&IF(RC[-9]="",,"|n"&R1C25&RC[-9])&IF(RC[-8]="",,"|n"&R1C26&RC[-8])&IF(RC[-7]="",,"|n"&R1C27&RC[-7])&IF(RC[-6]="",,"|n"&R1C28&RC[-6])&IF(RC[-5]="",,"|n"&R1C29&RC[-5])&IF(RC[-2]="",,"|n|n"&RC[-2]) -> |cFFFFFF99基础属性|r|n护甲:8450
A47: 42 | B47: 3 | D47: ="["&RC[-2]&"级]" -> [3级] | E47: 领主 | F47: 头饰 | H47: =IF(R[-16]C<>"",INT(R[-16]C*3.2),"") ->  | I47: =IF(R[-16]C<>"",INT(R[-16]C*3.2),"") ->  | J47: =IF(R[-16]C<>"",INT(R[-16]C*3.2),"") ->  | K47: =IF(R[-16]C<>"",INT(R[-16]C*3.2),"") -> 163840 | L47: =IF(R[-16]C<>"",INT(R[-16]C*3.2),"") ->  | M47: =IF(R[-16]C<>"",INT(R[-16]C*3.2),"") ->  | N47: =IF(R[-16]C<>"",INT(R[-16]C*3.2),"") ->  | O47: =IF(R[-16]C<>"",INT(R[-16]C*1.5),"") ->  | AG47: =VLOOKUP(RC[-31],其他!R1C1:R7C2,2,0)&RC[-29]&RC[-28]&RC[-27]&"|r" -> |cFF1BE6B8[3级]领主头饰|r | AH47: =IF(RC[-26]&RC[-25]&RC[-24]&RC[-23]&RC[-22]&RC[-21]="",,R1C7)&IF(RC[-26]="",,"|n"&R1C8&RC[-26])&IF(RC[-25]="",,"|n"&R1C9&RC[-25])&IF(RC[-24]="",,"|n"&R1C10&RC[-24])&IF(RC[-23]="",,"|n"&R1C11&RC[-23])&IF(RC[-22]="",,"|n"&R1C12&RC[-22])&IF(RC[-21]="",,"|n"&R1C13&RC[-21])&IF(RC[-19]&RC[-18]&RC[-17]&RC[-16]="",,"|n"&R1C14)&IF(RC[-19]="",,"|n"&R1C15&RC[-19])&IF(RC[-18]="",,"|n"&R1C16&RC[-18])&IF(RC[-17]="",,"|n"&R1C17&RC[-17])&IF(RC[-16]="",,"|n"&R1C18&RC[-16])&IF(RC[-15]="",,"|n"&R1C19&RC[-15])&IF(RC[-14]="",,"|n"&R1C20&RC[-14])&IF(RC[-13]="",,"|n"&R1C21&RC[-13])&IF(RC[-12]="",,"|n"&R1C22&RC[-12])&IF(RC[-11]="",,"|n"&R1C23&RC[-11])&IF(RC[-10]="",,"|n"&R1C24&RC[-10])&IF(RC[-9]="",,"|n"&R1C25&RC[-9])&IF(RC[-8]="",,"|n"&R1C26&RC[-8])&IF(RC[-7]="",,"|n"&R1C27&RC[-7])&IF(RC[-6]="",,"|n"&R1C28&RC[-6])&IF(RC[-5]="",,"|n"&R1C29&RC[-5])&IF(RC[-2]="",,"|n|n"&RC[-2]) -> |cFFFFFF99基础属性|r|n智力:163840
A48: 41 | B48: 3 | D48: ="["&RC[-2]&"级]" -> [3级] | E48: 领主 | F48: 战靴 | H48: =IF(R[-16]C<>"",INT(R[-16]C*3.2),"") ->  | I48: =IF(R[-16]C<>"",INT(R[-16]C*3.2),"") ->  | J48: =IF(R[-16]C<>"",INT(R[-16]C*3.2),"") -> 163840 | K48: =IF(R[-16]C<>"",INT(R[-16]C*3.2),"") ->  | L48: =IF(R[-16]C<>"",INT(R[-16]C*3.2),"") ->  | M48: =IF(R[-16]C<>"",INT(R[-16]C*3.2),"") ->  | N48: =IF(R[-16]C<>"",INT(R[-16]C*3.2),"") ->  | O48: =IF(R[-16]C<>"",INT(R[-16]C*1.5),"") ->  | AG48: =VLOOKUP(RC[-31],其他!R1C1:R7C2,2,0)&RC[-29]&RC[-28]&RC[-27]&"|r" -> |cFF1BE6B8[3级]领主战靴|r | AH48: =IF(RC[-26]&RC[-25]&RC[-24]&RC[-23]&RC[-22]&RC[-21]="",,R1C7)&IF(RC[-26]="",,"|n"&R1C8&RC[-26])&IF(RC[-25]="",,"|n"&R1C9&RC[-25])&IF(RC[-24]="",,"|n"&R1C10&RC[-24])&IF(RC[-23]="",,"|n"&R1C11&RC[-23])&IF(RC[-22]="",,"|n"&R1C12&RC[-22])&IF(RC[-21]="",,"|n"&R1C13&RC[-21])&IF(RC[-19]&RC[-18]&RC[-17]&RC[-16]="",,"|n"&R1C14)&IF(RC[-19]="",,"|n"&R1C15&RC[-19])&IF(RC[-18]="",,"|n"&R1C16&RC[-18])&IF(RC[-17]="",,"|n"&R1C17&RC[-17])&IF(RC[-16]="",,"|n"&R1C18&RC[-16])&IF(RC[-15]="",,"|n"&R1C19&RC[-15])&IF(RC[-14]="",,"|n"&R1C20&RC[-14])&IF(RC[-13]="",,"|n"&R1C21&RC[-13])&IF(RC[-12]="",,"|n"&R1C22&RC[-12])&IF(RC[-11]="",,"|n"&R1C23&RC[-11])&IF(RC[-10]="",,"|n"&R1C24&RC[-10])&IF(RC[-9]="",,"|n"&R1C25&RC[-9])&IF(RC[-8]="",,"|n"&R1C26&RC[-8])&IF(RC[-7]="",,"|n"&R1C27&RC[-7])&IF(RC[-6]="",,"|n"&R1C28&RC[-6])&IF(RC[-5]="",,"|n"&R1C29&RC[-5])&IF(RC[-2]="",,"|n|n"&RC[-2]) -> |cFFFFFF99基础属性|r|n敏捷:163840
A49: 42 | B49: 3 | D49: ="["&RC[-2]&"级]" -> [3级] | E49: 领主 | F49: 腰带 | H49: =IF(R[-16]C<>"",INT(R[-16]C*3.2),"") ->  | I49: =IF(R[-16]C<>"",INT(R[-16]C*3.2),"") ->  | J49: =IF(R[-16]C<>"",INT(R[-16]C*3.2),"") ->  | K49: =IF(R[-16]C<>"",INT(R[-16]C*3.2),"") ->  | L49: =IF(R[-16]C<>"",INT(R[-16]C*3.2),"") ->  | M49: =IF(R[-16]C<>"",INT(R[-16]C*3.2),"") ->  | N49: =IF(R[-16]C<>"",INT(R[-16]C*3.2),"") ->  | O49: =IF(R[-16]C<>"",INT(R[-16]C*1.3),"") -> 33 | AG49: =VLOOKUP(RC[-31],其他!R1C1:R7C2,2,0)&RC[-29]&RC[-28]&RC[-27]&"|r" -> |cFF1BE6B8[3级]领主腰带|r | AH49: =IF(RC[-26]&RC[-25]&RC[-24]&RC[-23]&RC[-22]&RC[-21]="",,R1C7)&IF(RC[-26]="",,"|n"&R1C8&RC[-26])&IF(RC[-25]="",,"|n"&R1C9&RC[-25])&IF(RC[-24]="",,"|n"&R1C10&RC[-24])&IF(RC[-23]="",,"|n"&R1C11&RC[-23])&IF(RC[-22]="",,"|n"&R1C12&RC[-22])&IF(RC[-21]="",,"|n"&R1C13&RC[-21])&IF(RC[-19]&RC[-18]&RC[-17]&RC[-16]="",,"|n"&R1C14)&IF(RC[-19]="",,"|n"&R1C15&RC[-19])&IF(RC[-18]="",,"|n"&R1C16&RC[-18])&IF(RC[-17]="",,"|n"&R1C17&RC[-17])&IF(RC[-16]="",,"|n"&R1C18&RC[-16])&IF(RC[-15]="",,"|n"&R1C19&RC[-15])&IF(RC[-14]="",,"|n"&R1C20&RC[-14])&IF(RC[-13]="",,"|n"&R1C21&RC[-13])&IF(RC[-12]="",,"|n"&R1C22&RC[-12])&IF(RC[-11]="",,"|n"&R1C23&RC[-11])&IF(RC[-10]="",,"|n"&R1C24&RC[-10])&IF(RC[-9]="",,"|n"&R1C25&RC[-9])&IF(RC[-8]="",,"|n"&R1C26&RC[-8])&IF(RC[-7]="",,"|n"&R1C27&RC[-7])&IF(RC[-6]="",,"|n"&R1C28&RC[-6])&IF(RC[-5]="",,"|n"&R1C29&RC[-5])&IF(RC[-2]="",,"|n|n"&RC[-2]) -> |n|cFFFFFF55附加属性|r(%)|n攻速:33
A50: 43 | B50: 4 | D50: ="["&RC[-2]&"级]" -> [4级] | E50: 战神 | F50: 长刃 | H50: =IF(R[-16]C<>"",INT(R[-16]C*3.2),"") -> 983040 | I50: =IF(R[-16]C<>"",INT(R[-16]C*3.2),"") ->  | J50: =IF(R[-16]C<>"",INT(R[-16]C*3.2),"") ->  | K50: =IF(R[-16]C<>"",INT(R[-16]C*3.2),"") ->  | L50: =IF(R[-16]C<>"",INT(R[-16]C*3.2),"") ->  | M50: =IF(R[-16]C<>"",INT(R[-16]C*3.2),"") ->  | N50: =IF(R[-16]C<>"",INT(R[-16]C*3.2),"") ->  | O50: =IF(R[-16]C<>"",INT(R[-16]C*1.5),"") ->  | AG50: =VLOOKUP(RC[-31],其他!R1C1:R7C2,2,0)&RC[-29]&RC[-28]&RC[-27]&"|r" -> |cFF33FF00[4级]战神长刃|r | AH50: =IF(RC[-26]&RC[-25]&RC[-24]&RC[-23]&RC[-22]&RC[-21]="",,R1C7)&IF(RC[-26]="",,"|n"&R1C8&RC[-26])&IF(RC[-25]="",,"|n"&R1C9&RC[-25])&IF(RC[-24]="",,"|n"&R1C10&RC[-24])&IF(RC[-23]="",,"|n"&R1C11&RC[-23])&IF(RC[-22]="",,"|n"&R1C12&RC[-22])&IF(RC[-21]="",,"|n"&R1C13&RC[-21])&IF(RC[-19]&RC[-18]&RC[-17]&RC[-16]="",,"|n"&R1C14)&IF(RC[-19]="",,"|n"&R1C15&RC[-19])&IF(RC[-18]="",,"|n"&R1C16&RC[-18])&IF(RC[-17]="",,"|n"&R1C17&RC[-17])&IF(RC[-16]="",,"|n"&R1C18&RC[-16])&IF(RC[-15]="",,"|n"&R1C19&RC[-15])&IF(RC[-14]="",,"|n"&R1C20&RC[-14])&IF(RC[-13]="",,"|n"&R1C21&RC[-13])&IF(RC[-12]="",,"|n"&R1C22&RC[-12])&IF(RC[-11]="",,"|n"&R1C23&RC[-11])&IF(RC[-10]="",,"|n"&R1C24&RC[-10])&IF(RC[-9]="",,"|n"&R1C25&RC[-9])&IF(RC[-8]="",,"|n"&R1C26&RC[-8])&IF(RC[-7]="",,"|n"&R1C27&RC[-7])&IF(RC[-6]="",,"|n"&R1C28&RC[-6])&IF(RC[-5]="",,"|n"&R1C29&RC[-5])&IF(RC[-2]="",,"|n|n"&RC[-2]) -> |cFFFFFF99基础属性|r|n攻击:983040
A51: 44 | B51: 4 | D51: ="["&RC[-2]&"级]" -> [4级] | E51: 战神 | F51: 胸甲 | H51: =IF(R[-16]C<>"",INT(R[-16]C*3.2),"") ->  | I51: =IF(R[-16]C<>"",INT(R[-16]C*3.2),"") ->  | J51: =IF(R[-16]C<>"",INT(R[-16]C*3.2),"") ->  | K51: =IF(R[-16]C<>"",INT(R[-16]C*3.2),"") ->  | L51: =IF(R[-16]C<>"",INT(R[-16]C*3.2),"") -> 3276800 | M51: =IF(R[-16]C<>"",INT(R[-16]C*3.2),"") ->  | N51: =IF(R[-16]C<>"",INT(R[-16]C*3.2),"") ->  | O51: =IF(R[-16]C<>"",INT(R[-16]C*1.5),"") ->  | AG51: =VLOOKUP(RC[-31],其他!R1C1:R7C2,2,0)&RC[-29]&RC[-28]&RC[-27]&"|r" -> |cFF33FF00[4级]战神胸甲|r | AH51: =IF(RC[-26]&RC[-25]&RC[-24]&RC[-23]&RC[-22]&RC[-21]="",,R1C7)&IF(RC[-26]="",,"|n"&R1C8&RC[-26])&IF(RC[-25]="",,"|n"&R1C9&RC[-25])&IF(RC[-24]="",,"|n"&R1C10&RC[-24])&IF(RC[-23]="",,"|n"&R1C11&RC[-23])&IF(RC[-22]="",,"|n"&R1C12&RC[-22])&IF(RC[-21]="",,"|n"&R1C13&RC[-21])&IF(RC[-19]&RC[-18]&RC[-17]&RC[-16]="",,"|n"&R1C14)&IF(RC[-19]="",,"|n"&R1C15&RC[-19])&IF(RC[-18]="",,"|n"&R1C16&RC[-18])&IF(RC[-17]="",,"|n"&R1C17&RC[-17])&IF(RC[-16]="",,"|n"&R1C18&RC[-16])&IF(RC[-15]="",,"|n"&R1C19&RC[-15])&IF(RC[-14]="",,"|n"&R1C20&RC[-14])&IF(RC[-13]="",,"|n"&R1C21&RC[-13])&IF(RC[-12]="",,"|n"&R1C22&RC[-12])&IF(RC[-11]="",,"|n"&R1C23&RC[-11])&IF(RC[-10]="",,"|n"&R1C24&RC[-10])&IF(RC[-9]="",,"|n"&R1C25&RC[-9])&IF(RC[-8]="",,"|n"&R1C26&RC[-8])&IF(RC[-7]="",,"|n"&R1C27&RC[-7])&IF(RC[-6]="",,"|n"&R1C28&RC[-6])&IF(RC[-5]="",,"|n"&R1C29&RC[-5])&IF(RC[-2]="",,"|n|n"&RC[-2]) -> |cFFFFFF99基础属性|r|n血量:3276800
A52: 45 | B52: 4 | D52: ="["&RC[-2]&"级]" -> [4级] | E52: 战神 | F52: 护手 | H52: =IF(R[-16]C<>"",INT(R[-16]C*3.2),"") ->  | I52: =IF(R[-16]C<>"",INT(R[-16]C*3.2),"") -> 262144 | J52: =IF(R[-16]C<>"",INT(R[-16]C*3.2),"") -> 262144 | K52: =IF(R[-16]C<>"",INT(R[-16]C*3.2),"") -> 262144 | L52: =IF(R[-16]C<>"",INT(R[-16]C*3.2),"") ->  | M52: =IF(R[-16]C<>"",INT(R[-16]C*3.2),"") ->  | N52: =IF(R[-16]C<>"",INT(R[-16]C*3.2),"") ->  | O52: =IF(R[-16]C<>"",INT(R[-16]C*1.5),"") ->  | AG52: =VLOOKUP(RC[-31],其他!R1C1:R7C2,2,0)&RC[-29]&RC[-28]&RC[-27]&"|r" -> |cFF33FF00[4级]战神护手|r | AH52: =IF(RC[-26]&RC[-25]&RC[-24]&RC[-23]&RC[-22]&RC[-21]="",,R1C7)&IF(RC[-26]="",,"|n"&R1C8&RC[-26])&IF(RC[-25]="",,"|n"&R1C9&RC[-25])&IF(RC[-24]="",,"|n"&R1C10&RC[-24])&IF(RC[-23]="",,"|n"&R1C11&RC[-23])&IF(RC[-22]="",,"|n"&R1C12&RC[-22])&IF(RC[-21]="",,"|n"&R1C13&RC[-21])&IF(RC[-19]&RC[-18]&RC[-17]&RC[-16]="",,"|n"&R1C14)&IF(RC[-19]="",,"|n"&R1C15&RC[-19])&IF(RC[-18]="",,"|n"&R1C16&RC[-18])&IF(RC[-17]="",,"|n"&R1C17&RC[-17])&IF(RC[-16]="",,"|n"&R1C18&RC[-16])&IF(RC[-15]="",,"|n"&R1C19&RC[-15])&IF(RC[-14]="",,"|n"&R1C20&RC[-14])&IF(RC[-13]="",,"|n"&R1C21&RC[-13])&IF(RC[-12]="",,"|n"&R1C22&RC[-12])&IF(RC[-11]="",,"|n"&R1C23&RC[-11])&IF(RC[-10]="",,"|n"&R1C24&RC[-10])&IF(RC[-9]="",,"|n"&R1C25&RC[-9])&IF(RC[-8]="",,"|n"&R1C26&RC[-8])&IF(RC[-7]="",,"|n"&R1C27&RC[-7])&IF(RC[-6]="",,"|n"&R1C28&RC[-6])&IF(RC[-5]="",,"|n"&R1C29&RC[-5])&IF(RC[-2]="",,"|n|n"&RC[-2]) -> |cFFFFFF99基础属性|r|n力量:262144|n敏捷:262144|n智力:262144
A53: 46 | B53: 4 | D53: ="["&RC[-2]&"级]" -> [4级] | E53: 战神 | F53: 护肩 | H53: =IF(R[-16]C<>"",INT(R[-16]C*3.2),"") ->  | I53: =IF(R[-16]C<>"",INT(R[-16]C*3.2),"") -> 524288 | J53: =IF(R[-16]C<>"",INT(R[-16]C*3.2),"") ->  | K53: =IF(R[-16]C<>"",INT(R[-16]C*3.2),"") ->  | L53: =IF(R[-16]C<>"",INT(R[-16]C*3.2),"") ->  | M53: =IF(R[-16]C<>"",INT(R[-16]C*3.2),"") ->  | N53: =IF(R[-16]C<>"",INT(R[-16]C*3.2),"") ->  | O53: =IF(R[-16]C<>"",INT(R[-16]C*1.5),"") ->  | AG53: =VLOOKUP(RC[-31],其他!R1C1:R7C2,2,0)&RC[-29]&RC[-28]&RC[-27]&"|r" -> |cFF33FF00[4级]战神护肩|r | AH53: =IF(RC[-26]&RC[-25]&RC[-24]&RC[-23]&RC[-22]&RC[-21]="",,R1C7)&IF(RC[-26]="",,"|n"&R1C8&RC[-26])&IF(RC[-25]="",,"|n"&R1C9&RC[-25])&IF(RC[-24]="",,"|n"&R1C10&RC[-24])&IF(RC[-23]="",,"|n"&R1C11&RC[-23])&IF(RC[-22]="",,"|n"&R1C12&RC[-22])&IF(RC[-21]="",,"|n"&R1C13&RC[-21])&IF(RC[-19]&RC[-18]&RC[-17]&RC[-16]="",,"|n"&R1C14)&IF(RC[-19]="",,"|n"&R1C15&RC[-19])&IF(RC[-18]="",,"|n"&R1C16&RC[-18])&IF(RC[-17]="",,"|n"&R1C17&RC[-17])&IF(RC[-16]="",,"|n"&R1C18&RC[-16])&IF(RC[-15]="",,"|n"&R1C19&RC[-15])&IF(RC[-14]="",,"|n"&R1C20&RC[-14])&IF(RC[-13]="",,"|n"&R1C21&RC[-13])&IF(RC[-12]="",,"|n"&R1C22&RC[-12])&IF(RC[-11]="",,"|n"&R1C23&RC[-11])&IF(RC[-10]="",,"|n"&R1C24&RC[-10])&IF(RC[-9]="",,"|n"&R1C25&RC[-9])&IF(RC[-8]="",,"|n"&R1C26&RC[-8])&IF(RC[-7]="",,"|n"&R1C27&RC[-7])&IF(RC[-6]="",,"|n"&R1C28&RC[-6])&IF(RC[-5]="",,"|n"&R1C29&RC[-5])&IF(RC[-2]="",,"|n|n"&RC[-2]) -> |cFFFFFF99基础属性|r|n力量:524288
A54: 47 | B54: 4 | D54: ="["&RC[-2]&"级]" -> [4级] | E54: 战神 | F54: 腿甲 | H54: =IF(R[-16]C<>"",INT(R[-16]C*3.2),"") ->  | I54: =IF(R[-16]C<>"",INT(R[-16]C*3.2),"") ->  | J54: =IF(R[-16]C<>"",INT(R[-16]C*3.2),"") ->  | K54: =IF(R[-16]C<>"",INT(R[-16]C*3.2),"") ->  | L54: =IF(R[-16]C<>"",INT(R[-16]C*3.2),"") ->  | M54: =IF(R[-16]C<>"",INT(R[-16]C*1.3),"") -> 10985 | N54: =IF(R[-16]C<>"",INT(R[-16]C*3.2),"") ->  | O54: =IF(R[-16]C<>"",INT(R[-16]C*1.5),"") ->  | AG54: =VLOOKUP(RC[-31],其他!R1C1:R7C2,2,0)&RC[-29]&RC[-28]&RC[-27]&"|r" -> |cFF33FF00[4级]战神腿甲|r | AH54: =IF(RC[-26]&RC[-25]&RC[-24]&RC[-23]&RC[-22]&RC[-21]="",,R1C7)&IF(RC[-26]="",,"|n"&R1C8&RC[-26])&IF(RC[-25]="",,"|n"&R1C9&RC[-25])&IF(RC[-24]="",,"|n"&R1C10&RC[-24])&IF(RC[-23]="",,"|n"&R1C11&RC[-23])&IF(RC[-22]="",,"|n"&R1C12&RC[-22])&IF(RC[-21]="",,"|n"&R1C13&RC[-21])&IF(RC[-19]&RC[-18]&RC[-17]&RC[-16]="",,"|n"&R1C14)&IF(RC[-19]="",,"|n"&R1C15&RC[-19])&IF(RC[-18]="",,"|n"&R1C16&RC[-18])&IF(RC[-17]="",,"|n"&R1C17&RC[-17])&IF(RC[-16]="",,"|n"&R1C18&RC[-16])&IF(RC[-15]="",,"|n"&R1C19&RC[-15])&IF(RC[-14]="",,"|n"&R1C20&RC[-14])&IF(RC[-13]="",,"|n"&R1C21&RC[-13])&IF(RC[-12]="",,"|n"&R1C22&RC[-12])&IF(RC[-11]="",,"|n"&R1C23&RC[-11])&IF(RC[-10]="",,"|n"&R1C24&RC[-10])&IF(RC[-9]="",,"|n"&R1C25&RC[-9])&IF(RC[-8]="",,"|n"&R1C26&RC[-8])&IF(RC[-7]="",,"|n"&R1C27&RC[-7])&IF(RC[-6]="",,"|n"&R1C28&RC[-6])&IF(RC[-5]="",,"|n"&R1C29&RC[-5])&IF(RC[-2]="",,"|n|n"&RC[-2]) -> |cFFFFFF99基础属性|r|n护甲:10985
A55: 48 | B55: 4 | D55: ="["&RC[-2]&"级]" -> [4级] | E55: 战神 | F55: 头饰 | H55: =IF(R[-16]C<>"",INT(R[-16]C*3.2),"") ->  | I55: =IF(R[-16]C<>"",INT(R[-16]C*3.2),"") ->  | J55: =IF(R[-16]C<>"",INT(R[-16]C*3.2),"") ->  | K55: =IF(R[-16]C<>"",INT(R[-16]C*3.2),"") -> 524288 | L55: =IF(R[-16]C<>"",INT(R[-16]C*3.2),"") ->  | M55: =IF(R[-16]C<>"",INT(R[-16]C*3.2),"") ->  | N55: =IF(R[-16]C<>"",INT(R[-16]C*3.2),"") ->  | O55: =IF(R[-16]C<>"",INT(R[-16]C*1.5),"") ->  | AG55: =VLOOKUP(RC[-31],其他!R1C1:R7C2,2,0)&RC[-29]&RC[-28]&RC[-27]&"|r" -> |cFF33FF00[4级]战神头饰|r | AH55: =IF(RC[-26]&RC[-25]&RC[-24]&RC[-23]&RC[-22]&RC[-21]="",,R1C7)&IF(RC[-26]="",,"|n"&R1C8&RC[-26])&IF(RC[-25]="",,"|n"&R1C9&RC[-25])&IF(RC[-24]="",,"|n"&R1C10&RC[-24])&IF(RC[-23]="",,"|n"&R1C11&RC[-23])&IF(RC[-22]="",,"|n"&R1C12&RC[-22])&IF(RC[-21]="",,"|n"&R1C13&RC[-21])&IF(RC[-19]&RC[-18]&RC[-17]&RC[-16]="",,"|n"&R1C14)&IF(RC[-19]="",,"|n"&R1C15&RC[-19])&IF(RC[-18]="",,"|n"&R1C16&RC[-18])&IF(RC[-17]="",,"|n"&R1C17&RC[-17])&IF(RC[-16]="",,"|n"&R1C18&RC[-16])&IF(RC[-15]="",,"|n"&R1C19&RC[-15])&IF(RC[-14]="",,"|n"&R1C20&RC[-14])&IF(RC[-13]="",,"|n"&R1C21&RC[-13])&IF(RC[-12]="",,"|n"&R1C22&RC[-12])&IF(RC[-11]="",,"|n"&R1C23&RC[-11])&IF(RC[-10]="",,"|n"&R1C24&RC[-10])&IF(RC[-9]="",,"|n"&R1C25&RC[-9])&IF(RC[-8]="",,"|n"&R1C26&RC[-8])&IF(RC[-7]="",,"|n"&R1C27&RC[-7])&IF(RC[-6]="",,"|n"&R1C28&RC[-6])&IF(RC[-5]="",,"|n"&R1C29&RC[-5])&IF(RC[-2]="",,"|n|n"&RC[-2]) -> |cFFFFFF99基础属性|r|n智力:524288
A56: 49 | B56: 4 | D56: ="["&RC[-2]&"级]" -> [4级] | E56: 战神 | F56: 战靴 | H56: =IF(R[-16]C<>"",INT(R[-16]C*3.2),"") ->  | I56: =IF(R[-16]C<>"",INT(R[-16]C*3.2),"") ->  | J56: =IF(R[-16]C<>"",INT(R[-16]C*3.2),"") -> 524288 | K56: =IF(R[-16]C<>"",INT(R[-16]C*3.2),"") ->  | L56: =IF(R[-16]C<>"",INT(R[-16]C*3.2),"") ->  | M56: =IF(R[-16]C<>"",INT(R[-16]C*3.2),"") ->  | N56: =IF(R[-16]C<>"",INT(R[-16]C*3.2),"") ->  | O56: =IF(R[-16]C<>"",INT(R[-16]C*1.5),"") ->  | AG56: =VLOOKUP(RC[-31],其他!R1C1:R7C2,2,0)&RC[-29]&RC[-28]&RC[-27]&"|r" -> |cFF33FF00[4级]战神战靴|r | AH56: =IF(RC[-26]&RC[-25]&RC[-24]&RC[-23]&RC[-22]&RC[-21]="",,R1C7)&IF(RC[-26]="",,"|n"&R1C8&RC[-26])&IF(RC[-25]="",,"|n"&R1C9&RC[-25])&IF(RC[-24]="",,"|n"&R1C10&RC[-24])&IF(RC[-23]="",,"|n"&R1C11&RC[-23])&IF(RC[-22]="",,"|n"&R1C12&RC[-22])&IF(RC[-21]="",,"|n"&R1C13&RC[-21])&IF(RC[-19]&RC[-18]&RC[-17]&RC[-16]="",,"|n"&R1C14)&IF(RC[-19]="",,"|n"&R1C15&RC[-19])&IF(RC[-18]="",,"|n"&R1C16&RC[-18])&IF(RC[-17]="",,"|n"&R1C17&RC[-17])&IF(RC[-16]="",,"|n"&R1C18&RC[-16])&IF(RC[-15]="",,"|n"&R1C19&RC[-15])&IF(RC[-14]="",,"|n"&R1C20&RC[-14])&IF(RC[-13]="",,"|n"&R1C21&RC[-13])&IF(RC[-12]="",,"|n"&R1C22&RC[-12])&IF(RC[-11]="",,"|n"&R1C23&RC[-11])&IF(RC[-10]="",,"|n"&R1C24&RC[-10])&IF(RC[-9]="",,"|n"&R1C25&RC[-9])&IF(RC[-8]="",,"|n"&R1C26&RC[-8])&IF(RC[-7]="",,"|n"&R1C27&RC[-7])&IF(RC[-6]="",,"|n"&R1C28&RC[-6])&IF(RC[-5]="",,"|n"&R1C29&RC[-5])&IF(RC[-2]="",,"|n|n"&RC[-2]) -> |cFFFFFF99基础属性|r|n敏捷:524288
A57: 50 | B57: 4 | D57: ="["&RC[-2]&"级]" -> [4级] | E57: 战神 | F57: 腰带 | H57: =IF(R[-16]C<>"",INT(R[-16]C*3.2),"") ->  | I57: =IF(R[-16]C<>"",INT(R[-16]C*3.2),"") ->  | J57: =IF(R[-16]C<>"",INT(R[-16]C*3.2),"") ->  | K57: =IF(R[-16]C<>"",INT(R[-16]C*3.2),"") ->  | L57: =IF(R[-16]C<>"",INT(R[-16]C*3.2),"") ->  | M57: =IF(R[-16]C<>"",INT(R[-16]C*3.2),"") ->  | N57: =IF(R[-16]C<>"",INT(R[-16]C*3.2),"") ->  | O57: =IF(R[-16]C<>"",INT(R[-16]C*1.3),"") -> 42 | AG57: =VLOOKUP(RC[-31],其他!R1C1:R7C2,2,0)&RC[-29]&RC[-28]&RC[-27]&"|r" -> |cFF33FF00[4级]战神腰带|r | AH57: =IF(RC[-26]&RC[-25]&RC[-24]&RC[-23]&RC[-22]&RC[-21]="",,R1C7)&IF(RC[-26]="",,"|n"&R1C8&RC[-26])&IF(RC[-25]="",,"|n"&R1C9&RC[-25])&IF(RC[-24]="",,"|n"&R1C10&RC[-24])&IF(RC[-23]="",,"|n"&R1C11&RC[-23])&IF(RC[-22]="",,"|n"&R1C12&RC[-22])&IF(RC[-21]="",,"|n"&R1C13&RC[-21])&IF(RC[-19]&RC[-18]&RC[-17]&RC[-16]="",,"|n"&R1C14)&IF(RC[-19]="",,"|n"&R1C15&RC[-19])&IF(RC[-18]="",,"|n"&R1C16&RC[-18])&IF(RC[-17]="",,"|n"&R1C17&RC[-17])&IF(RC[-16]="",,"|n"&R1C18&RC[-16])&IF(RC[-15]="",,"|n"&R1C19&RC[-15])&IF(RC[-14]="",,"|n"&R1C20&RC[-14])&IF(RC[-13]="",,"|n"&R1C21&RC[-13])&IF(RC[-12]="",,"|n"&R1C22&RC[-12])&IF(RC[-11]="",,"|n"&R1C23&RC[-11])&IF(RC[-10]="",,"|n"&R1C24&RC[-10])&IF(RC[-9]="",,"|n"&R1C25&RC[-9])&IF(RC[-8]="",,"|n"&R1C26&RC[-8])&IF(RC[-7]="",,"|n"&R1C27&RC[-7])&IF(RC[-6]="",,"|n"&R1C28&RC[-6])&IF(RC[-5]="",,"|n"&R1C29&RC[-5])&IF(RC[-2]="",,"|n|n"&RC[-2]) -> |n|cFFFFFF55附加属性|r(%)|n攻速:42
A58: 51 | B58: 4 | D58: ="["&RC[-2]&"级]" -> [4级] | E58: 贤者 | F58: 长刃 | H58: =IF(R[-16]C<>"",INT(R[-16]C*3.2),"") -> 983040 | I58: =IF(R[-16]C<>"",INT(R[-16]C*3.2),"") ->  | J58: =IF(R[-16]C<>"",INT(R[-16]C*3.2),"") ->  | K58: =IF(R[-16]C<>"",INT(R[-16]C*3.2),"") ->  | L58: =IF(R[-16]C<>"",INT(R[-16]C*3.2),"") ->  | M58: =IF(R[-16]C<>"",INT(R[-16]C*3.2),"") ->  | N58: =IF(R[-16]C<>"",INT(R[-16]C*3.2),"") ->  | O58: =IF(R[-16]C<>"",INT(R[-16]C*1.5),"") ->  | AG58: =VLOOKUP(RC[-31],其他!R1C1:R7C2,2,0)&RC[-29]&RC[-28]&RC[-27]&"|r" -> |cFF33FF00[4级]贤者长刃|r | AH58: =IF(RC[-26]&RC[-25]&RC[-24]&RC[-23]&RC[-22]&RC[-21]="",,R1C7)&IF(RC[-26]="",,"|n"&R1C8&RC[-26])&IF(RC[-25]="",,"|n"&R1C9&RC[-25])&IF(RC[-24]="",,"|n"&R1C10&RC[-24])&IF(RC[-23]="",,"|n"&R1C11&RC[-23])&IF(RC[-22]="",,"|n"&R1C12&RC[-22])&IF(RC[-21]="",,"|n"&R1C13&RC[-21])&IF(RC[-19]&RC[-18]&RC[-17]&RC[-16]="",,"|n"&R1C14)&IF(RC[-19]="",,"|n"&R1C15&RC[-19])&IF(RC[-18]="",,"|n"&R1C16&RC[-18])&IF(RC[-17]="",,"|n"&R1C17&RC[-17])&IF(RC[-16]="",,"|n"&R1C18&RC[-16])&IF(RC[-15]="",,"|n"&R1C19&RC[-15])&IF(RC[-14]="",,"|n"&R1C20&RC[-14])&IF(RC[-13]="",,"|n"&R1C21&RC[-13])&IF(RC[-12]="",,"|n"&R1C22&RC[-12])&IF(RC[-11]="",,"|n"&R1C23&RC[-11])&IF(RC[-10]="",,"|n"&R1C24&RC[-10])&IF(RC[-9]="",,"|n"&R1C25&RC[-9])&IF(RC[-8]="",,"|n"&R1C26&RC[-8])&IF(RC[-7]="",,"|n"&R1C27&RC[-7])&IF(RC[-6]="",,"|n"&R1C28&RC[-6])&IF(RC[-5]="",,"|n"&R1C29&RC[-5])&IF(RC[-2]="",,"|n|n"&RC[-2]) -> |cFFFFFF99基础属性|r|n攻击:983040
A59: 52 | B59: 4 | D59: ="["&RC[-2]&"级]" -> [4级] | E59: 贤者 | F59: 胸甲 | H59: =IF(R[-16]C<>"",INT(R[-16]C*3.2),"") ->  | I59: =IF(R[-16]C<>"",INT(R[-16]C*3.2),"") ->  | J59: =IF(R[-16]C<>"",INT(R[-16]C*3.2),"") ->  | K59: =IF(R[-16]C<>"",INT(R[-16]C*3.2),"") ->  | L59: =IF(R[-16]C<>"",INT(R[-16]C*3.2),"") -> 3276800 | M59: =IF(R[-16]C<>"",INT(R[-16]C*3.2),"") ->  | N59: =IF(R[-16]C<>"",INT(R[-16]C*3.2),"") ->  | O59: =IF(R[-16]C<>"",INT(R[-16]C*1.5),"") ->  | AG59: =VLOOKUP(RC[-31],其他!R1C1:R7C2,2,0)&RC[-29]&RC[-28]&RC[-27]&"|r" -> |cFF33FF00[4级]贤者胸甲|r | AH59: =IF(RC[-26]&RC[-25]&RC[-24]&RC[-23]&RC[-22]&RC[-21]="",,R1C7)&IF(RC[-26]="",,"|n"&R1C8&RC[-26])&IF(RC[-25]="",,"|n"&R1C9&RC[-25])&IF(RC[-24]="",,"|n"&R1C10&RC[-24])&IF(RC[-23]="",,"|n"&R1C11&RC[-23])&IF(RC[-22]="",,"|n"&R1C12&RC[-22])&IF(RC[-21]="",,"|n"&R1C13&RC[-21])&IF(RC[-19]&RC[-18]&RC[-17]&RC[-16]="",,"|n"&R1C14)&IF(RC[-19]="",,"|n"&R1C15&RC[-19])&IF(RC[-18]="",,"|n"&R1C16&RC[-18])&IF(RC[-17]="",,"|n"&R1C17&RC[-17])&IF(RC[-16]="",,"|n"&R1C18&RC[-16])&IF(RC[-15]="",,"|n"&R1C19&RC[-15])&IF(RC[-14]="",,"|n"&R1C20&RC[-14])&IF(RC[-13]="",,"|n"&R1C21&RC[-13])&IF(RC[-12]="",,"|n"&R1C22&RC[-12])&IF(RC[-11]="",,"|n"&R1C23&RC[-11])&IF(RC[-10]="",,"|n"&R1C24&RC[-10])&IF(RC[-9]="",,"|n"&R1C25&RC[-9])&IF(RC[-8]="",,"|n"&R1C26&RC[-8])&IF(RC[-7]="",,"|n"&R1C27&RC[-7])&IF(RC[-6]="",,"|n"&R1C28&RC[-6])&IF(RC[-5]="",,"|n"&R1C29&RC[-5])&IF(RC[-2]="",,"|n|n"&RC[-2]) -> |cFFFFFF99基础属性|r|n血量:3276800
A60: 53 | B60: 4 | D60: ="["&RC[-2]&"级]" -> [4级] | E60: 贤者 | F60: 护手 | H60: =IF(R[-16]C<>"",INT(R[-16]C*3.2),"") ->  | I60: =IF(R[-16]C<>"",INT(R[-16]C*3.2),"") -> 262144 | J60: =IF(R[-16]C<>"",INT(R[-16]C*3.2),"") -> 262144 | K60: =IF(R[-16]C<>"",INT(R[-16]C*3.2),"") -> 262144 | L60: =IF(R[-16]C<>"",INT(R[-16]C*3.2),"") ->  | M60: =IF(R[-16]C<>"",INT(R[-16]C*3.2),"") ->  | N60: =IF(R[-16]C<>"",INT(R[-16]C*3.2),"") ->  | O60: =IF(R[-16]C<>"",INT(R[-16]C*1.5),"") ->  | AG60: =VLOOKUP(RC[-31],其他!R1C1:R7C2,2,0)&RC[-29]&RC[-28]&RC[-27]&"|r" -> |cFF33FF00[4级]贤者护手|r | AH60: =IF(RC[-26]&RC[-25]&RC[-24]&RC[-23]&RC[-22]&RC[-21]="",,R1C7)&IF(RC[-26]="",,"|n"&R1C8&RC[-26])&IF(RC[-25]="",,"|n"&R1C9&RC[-25])&IF(RC[-24]="",,"|n"&R1C10&RC[-24])&IF(RC[-23]="",,"|n"&R1C11&RC[-23])&IF(RC[-22]="",,"|n"&R1C12&RC[-22])&IF(RC[-21]="",,"|n"&R1C13&RC[-21])&IF(RC[-19]&RC[-18]&RC[-17]&RC[-16]="",,"|n"&R1C14)&IF(RC[-19]="",,"|n"&R1C15&RC[-19])&IF(RC[-18]="",,"|n"&R1C16&RC[-18])&IF(RC[-17]="",,"|n"&R1C17&RC[-17])&IF(RC[-16]="",,"|n"&R1C18&RC[-16])&IF(RC[-15]="",,"|n"&R1C19&RC[-15])&IF(RC[-14]="",,"|n"&R1C20&RC[-14])&IF(RC[-13]="",,"|n"&R1C21&RC[-13])&IF(RC[-12]="",,"|n"&R1C22&RC[-12])&IF(RC[-11]="",,"|n"&R1C23&RC[-11])&IF(RC[-10]="",,"|n"&R1C24&RC[-10])&IF(RC[-9]="",,"|n"&R1C25&RC[-9])&IF(RC[-8]="",,"|n"&R1C26&RC[-8])&IF(RC[-7]="",,"|n"&R1C27&RC[-7])&IF(RC[-6]="",,"|n"&R1C28&RC[-6])&IF(RC[-5]="",,"|n"&R1C29&RC[-5])&IF(RC[-2]="",,"|n|n"&RC[-2]) -> |cFFFFFF99基础属性|r|n力量:262144|n敏捷:262144|n智力:262144
A61: 54 | B61: 4 | D61: ="["&RC[-2]&"级]" -> [4级] | E61: 贤者 | F61: 护肩 | H61: =IF(R[-16]C<>"",INT(R[-16]C*3.2),"") ->  | I61: =IF(R[-16]C<>"",INT(R[-16]C*3.2),"") -> 524288 | J61: =IF(R[-16]C<>"",INT(R[-16]C*3.2),"") ->  | K61: =IF(R[-16]C<>"",INT(R[-16]C*3.2),"") ->  | L61: =IF(R[-16]C<>"",INT(R[-16]C*3.2),"") ->  | M61: =IF(R[-16]C<>"",INT(R[-16]C*3.2),"") ->  | N61: =IF(R[-16]C<>"",INT(R[-16]C*3.2),"") ->  | O61: =IF(R[-16]C<>"",INT(R[-16]C*1.5),"") ->  | AG61: =VLOOKUP(RC[-31],其他!R1C1:R7C2,2,0)&RC[-29]&RC[-28]&RC[-27]&"|r" -> |cFF33FF00[4级]贤者护肩|r | AH61: =IF(RC[-26]&RC[-25]&RC[-24]&RC[-23]&RC[-22]&RC[-21]="",,R1C7)&IF(RC[-26]="",,"|n"&R1C8&RC[-26])&IF(RC[-25]="",,"|n"&R1C9&RC[-25])&IF(RC[-24]="",,"|n"&R1C10&RC[-24])&IF(RC[-23]="",,"|n"&R1C11&RC[-23])&IF(RC[-22]="",,"|n"&R1C12&RC[-22])&IF(RC[-21]="",,"|n"&R1C13&RC[-21])&IF(RC[-19]&RC[-18]&RC[-17]&RC[-16]="",,"|n"&R1C14)&IF(RC[-19]="",,"|n"&R1C15&RC[-19])&IF(RC[-18]="",,"|n"&R1C16&RC[-18])&IF(RC[-17]="",,"|n"&R1C17&RC[-17])&IF(RC[-16]="",,"|n"&R1C18&RC[-16])&IF(RC[-15]="",,"|n"&R1C19&RC[-15])&IF(RC[-14]="",,"|n"&R1C20&RC[-14])&IF(RC[-13]="",,"|n"&R1C21&RC[-13])&IF(RC[-12]="",,"|n"&R1C22&RC[-12])&IF(RC[-11]="",,"|n"&R1C23&RC[-11])&IF(RC[-10]="",,"|n"&R1C24&RC[-10])&IF(RC[-9]="",,"|n"&R1C25&RC[-9])&IF(RC[-8]="",,"|n"&R1C26&RC[-8])&IF(RC[-7]="",,"|n"&R1C27&RC[-7])&IF(RC[-6]="",,"|n"&R1C28&RC[-6])&IF(RC[-5]="",,"|n"&R1C29&RC[-5])&IF(RC[-2]="",,"|n|n"&RC[-2]) -> |cFFFFFF99基础属性|r|n力量:524288
A62: 55 | B62: 4 | D62: ="["&RC[-2]&"级]" -> [4级] | E62: 贤者 | F62: 腿甲 | H62: =IF(R[-16]C<>"",INT(R[-16]C*3.2),"") ->  | I62: =IF(R[-16]C<>"",INT(R[-16]C*3.2),"") ->  | J62: =IF(R[-16]C<>"",INT(R[-16]C*3.2),"") ->  | K62: =IF(R[-16]C<>"",INT(R[-16]C*3.2),"") ->  | L62: =IF(R[-16]C<>"",INT(R[-16]C*3.2),"") ->  | M62: =IF(R[-16]C<>"",INT(R[-16]C*1.3),"") -> 10985 | N62: =IF(R[-16]C<>"",INT(R[-16]C*3.2),"") ->  | O62: =IF(R[-16]C<>"",INT(R[-16]C*1.5),"") ->  | AG62: =VLOOKUP(RC[-31],其他!R1C1:R7C2,2,0)&RC[-29]&RC[-28]&RC[-27]&"|r" -> |cFF33FF00[4级]贤者腿甲|r | AH62: =IF(RC[-26]&RC[-25]&RC[-24]&RC[-23]&RC[-22]&RC[-21]="",,R1C7)&IF(RC[-26]="",,"|n"&R1C8&RC[-26])&IF(RC[-25]="",,"|n"&R1C9&RC[-25])&IF(RC[-24]="",,"|n"&R1C10&RC[-24])&IF(RC[-23]="",,"|n"&R1C11&RC[-23])&IF(RC[-22]="",,"|n"&R1C12&RC[-22])&IF(RC[-21]="",,"|n"&R1C13&RC[-21])&IF(RC[-19]&RC[-18]&RC[-17]&RC[-16]="",,"|n"&R1C14)&IF(RC[-19]="",,"|n"&R1C15&RC[-19])&IF(RC[-18]="",,"|n"&R1C16&RC[-18])&IF(RC[-17]="",,"|n"&R1C17&RC[-17])&IF(RC[-16]="",,"|n"&R1C18&RC[-16])&IF(RC[-15]="",,"|n"&R1C19&RC[-15])&IF(RC[-14]="",,"|n"&R1C20&RC[-14])&IF(RC[-13]="",,"|n"&R1C21&RC[-13])&IF(RC[-12]="",,"|n"&R1C22&RC[-12])&IF(RC[-11]="",,"|n"&R1C23&RC[-11])&IF(RC[-10]="",,"|n"&R1C24&RC[-10])&IF(RC[-9]="",,"|n"&R1C25&RC[-9])&IF(RC[-8]="",,"|n"&R1C26&RC[-8])&IF(RC[-7]="",,"|n"&R1C27&RC[-7])&IF(RC[-6]="",,"|n"&R1C28&RC[-6])&IF(RC[-5]="",,"|n"&R1C29&RC[-5])&IF(RC[-2]="",,"|n|n"&RC[-2]) -> |cFFFFFF99基础属性|r|n护甲:10985
A63: 56 | B63: 4 | D63: ="["&RC[-2]&"级]" -> [4级] | E63: 贤者 | F63: 头饰 | H63: =IF(R[-16]C<>"",INT(R[-16]C*3.2),"") ->  | I63: =IF(R[-16]C<>"",INT(R[-16]C*3.2),"") ->  | J63: =IF(R[-16]C<>"",INT(R[-16]C*3.2),"") ->  | K63: =IF(R[-16]C<>"",INT(R[-16]C*3.2),"") -> 524288 | L63: =IF(R[-16]C<>"",INT(R[-16]C*3.2),"") ->  | M63: =IF(R[-16]C<>"",INT(R[-16]C*3.2),"") ->  | N63: =IF(R[-16]C<>"",INT(R[-16]C*3.2),"") ->  | O63: =IF(R[-16]C<>"",INT(R[-16]C*1.5),"") ->  | AG63: =VLOOKUP(RC[-31],其他!R1C1:R7C2,2,0)&RC[-29]&RC[-28]&RC[-27]&"|r" -> |cFF33FF00[4级]贤者头饰|r | AH63: =IF(RC[-26]&RC[-25]&RC[-24]&RC[-23]&RC[-22]&RC[-21]="",,R1C7)&IF(RC[-26]="",,"|n"&R1C8&RC[-26])&IF(RC[-25]="",,"|n"&R1C9&RC[-25])&IF(RC[-24]="",,"|n"&R1C10&RC[-24])&IF(RC[-23]="",,"|n"&R1C11&RC[-23])&IF(RC[-22]="",,"|n"&R1C12&RC[-22])&IF(RC[-21]="",,"|n"&R1C13&RC[-21])&IF(RC[-19]&RC[-18]&RC[-17]&RC[-16]="",,"|n"&R1C14)&IF(RC[-19]="",,"|n"&R1C15&RC[-19])&IF(RC[-18]="",,"|n"&R1C16&RC[-18])&IF(RC[-17]="",,"|n"&R1C17&RC[-17])&IF(RC[-16]="",,"|n"&R1C18&RC[-16])&IF(RC[-15]="",,"|n"&R1C19&RC[-15])&IF(RC[-14]="",,"|n"&R1C20&RC[-14])&IF(RC[-13]="",,"|n"&R1C21&RC[-13])&IF(RC[-12]="",,"|n"&R1C22&RC[-12])&IF(RC[-11]="",,"|n"&R1C23&RC[-11])&IF(RC[-10]="",,"|n"&R1C24&RC[-10])&IF(RC[-9]="",,"|n"&R1C25&RC[-9])&IF(RC[-8]="",,"|n"&R1C26&RC[-8])&IF(RC[-7]="",,"|n"&R1C27&RC[-7])&IF(RC[-6]="",,"|n"&R1C28&RC[-6])&IF(RC[-5]="",,"|n"&R1C29&RC[-5])&IF(RC[-2]="",,"|n|n"&RC[-2]) -> |cFFFFFF99基础属性|r|n智力:524288
A64: 55 | B64: 4 | D64: ="["&RC[-2]&"级]" -> [4级] | E64: 贤者 | F64: 战靴 | H64: =IF(R[-16]C<>"",INT(R[-16]C*3.2),"") ->  | I64: =IF(R[-16]C<>"",INT(R[-16]C*3.2),"") ->  | J64: =IF(R[-16]C<>"",INT(R[-16]C*3.2),"") -> 524288 | K64: =IF(R[-16]C<>"",INT(R[-16]C*3.2),"") ->  | L64: =IF(R[-16]C<>"",INT(R[-16]C*3.2),"") ->  | M64: =IF(R[-16]C<>"",INT(R[-16]C*3.2),"") ->  | N64: =IF(R[-16]C<>"",INT(R[-16]C*3.2),"") ->  | O64: =IF(R[-16]C<>"",INT(R[-16]C*1.5),"") ->  | AG64: =VLOOKUP(RC[-31],其他!R1C1:R7C2,2,0)&RC[-29]&RC[-28]&RC[-27]&"|r" -> |cFF33FF00[4级]贤者战靴|r | AH64: =IF(RC[-26]&RC[-25]&RC[-24]&RC[-23]&RC[-22]&RC[-21]="",,R1C7)&IF(RC[-26]="",,"|n"&R1C8&RC[-26])&IF(RC[-25]="",,"|n"&R1C9&RC[-25])&IF(RC[-24]="",,"|n"&R1C10&RC[-24])&IF(RC[-23]="",,"|n"&R1C11&RC[-23])&IF(RC[-22]="",,"|n"&R1C12&RC[-22])&IF(RC[-21]="",,"|n"&R1C13&RC[-21])&IF(RC[-19]&RC[-18]&RC[-17]&RC[-16]="",,"|n"&R1C14)&IF(RC[-19]="",,"|n"&R1C15&RC[-19])&IF(RC[-18]="",,"|n"&R1C16&RC[-18])&IF(RC[-17]="",,"|n"&R1C17&RC[-17])&IF(RC[-16]="",,"|n"&R1C18&RC[-16])&IF(RC[-15]="",,"|n"&R1C19&RC[-15])&IF(RC[-14]="",,"|n"&R1C20&RC[-14])&IF(RC[-13]="",,"|n"&R1C21&RC[-13])&IF(RC[-12]="",,"|n"&R1C22&RC[-12])&IF(RC[-11]="",,"|n"&R1C23&RC[-11])&IF(RC[-10]="",,"|n"&R1C24&RC[-10])&IF(RC[-9]="",,"|n"&R1C25&RC[-9])&IF(RC[-8]="",,"|n"&R1C26&RC[-8])&IF(RC[-7]="",,"|n"&R1C27&RC[-7])&IF(RC[-6]="",,"|n"&R1C28&RC[-6])&IF(RC[-5]="",,"|n"&R1C29&RC[-5])&IF(RC[-2]="",,"|n|n"&RC[-2]) -> |cFFFFFF99基础属性|r|n敏捷:524288
A65: 56 | B65: 4 | D65: ="["&RC[-2]&"级]" -> [4级] | E65: 贤者 | F65: 腰带 | H65: =IF(R[-16]C<>"",INT(R[-16]C*3.2),"") ->  | I65: =IF(R[-16]C<>"",INT(R[-16]C*3.2),"") ->  | J65: =IF(R[-16]C<>"",INT(R[-16]C*3.2),"") ->  | K65: =IF(R[-16]C<>"",INT(R[-16]C*3.2),"") ->  | L65: =IF(R[-16]C<>"",INT(R[-16]C*3.2),"") ->  | M65: =IF(R[-16]C<>"",INT(R[-16]C*3.2),"") ->  | N65: =IF(R[-16]C<>"",INT(R[-16]C*3.2),"") ->  | O65: =IF(R[-16]C<>"",INT(R[-16]C*1.3),"") -> 42 | AG65: =VLOOKUP(RC[-31],其他!R1C1:R7C2,2,0)&RC[-29]&RC[-28]&RC[-27]&"|r" -> |cFF33FF00[4级]贤者腰带|r | AH65: =IF(RC[-26]&RC[-25]&RC[-24]&RC[-23]&RC[-22]&RC[-21]="",,R1C7)&IF(RC[-26]="",,"|n"&R1C8&RC[-26])&IF(RC[-25]="",,"|n"&R1C9&RC[-25])&IF(RC[-24]="",,"|n"&R1C10&RC[-24])&IF(RC[-23]="",,"|n"&R1C11&RC[-23])&IF(RC[-22]="",,"|n"&R1C12&RC[-22])&IF(RC[-21]="",,"|n"&R1C13&RC[-21])&IF(RC[-19]&RC[-18]&RC[-17]&RC[-16]="",,"|n"&R1C14)&IF(RC[-19]="",,"|n"&R1C15&RC[-19])&IF(RC[-18]="",,"|n"&R1C16&RC[-18])&IF(RC[-17]="",,"|n"&R1C17&RC[-17])&IF(RC[-16]="",,"|n"&R1C18&RC[-16])&IF(RC[-15]="",,"|n"&R1C19&RC[-15])&IF(RC[-14]="",,"|n"&R1C20&RC[-14])&IF(RC[-13]="",,"|n"&R1C21&RC[-13])&IF(RC[-12]="",,"|n"&R1C22&RC[-12])&IF(RC[-11]="",,"|n"&R1C23&RC[-11])&IF(RC[-10]="",,"|n"&R1C24&RC[-10])&IF(RC[-9]="",,"|n"&R1C25&RC[-9])&IF(RC[-8]="",,"|n"&R1C26&RC[-8])&IF(RC[-7]="",,"|n"&R1C27&RC[-7])&IF(RC[-6]="",,"|n"&R1C28&RC[-6])&IF(RC[-5]="",,"|n"&R1C29&RC[-5])&IF(RC[-2]="",,"|n|n"&RC[-2]) -> |n|cFFFFFF55附加属性|r(%)|n攻速:42
A66: 57 | B66: 5 | D66: ="["&RC[-2]&"级]" -> [5级] | E66: 魔龙 | F66: 长刃 | H66: =IF(R[-16]C<>"",INT(R[-16]C*3.2),"") -> 3145728 | I66: =IF(R[-16]C<>"",INT(R[-16]C*3.2),"") ->  | J66: =IF(R[-16]C<>"",INT(R[-16]C*3.2),"") ->  | K66: =IF(R[-16]C<>"",INT(R[-16]C*3.2),"") ->  | L66: =IF(R[-16]C<>"",INT(R[-16]C*3.2),"") ->  | M66: =IF(R[-16]C<>"",INT(R[-16]C*3.2),"") ->  | N66: =IF(R[-16]C<>"",INT(R[-16]C*3.2),"") ->  | O66: =IF(R[-16]C<>"",INT(R[-16]C*1.5),"") ->  | AG66: =VLOOKUP(RC[-31],其他!R1C1:R7C2,2,0)&RC[-29]&RC[-28]&RC[-27]&"|r" -> |cFFFF9933[5级]魔龙长刃|r | AH66: =IF(RC[-26]&RC[-25]&RC[-24]&RC[-23]&RC[-22]&RC[-21]="",,R1C7)&IF(RC[-26]="",,"|n"&R1C8&RC[-26])&IF(RC[-25]="",,"|n"&R1C9&RC[-25])&IF(RC[-24]="",,"|n"&R1C10&RC[-24])&IF(RC[-23]="",,"|n"&R1C11&RC[-23])&IF(RC[-22]="",,"|n"&R1C12&RC[-22])&IF(RC[-21]="",,"|n"&R1C13&RC[-21])&IF(RC[-19]&RC[-18]&RC[-17]&RC[-16]="",,"|n"&R1C14)&IF(RC[-19]="",,"|n"&R1C15&RC[-19])&IF(RC[-18]="",,"|n"&R1C16&RC[-18])&IF(RC[-17]="",,"|n"&R1C17&RC[-17])&IF(RC[-16]="",,"|n"&R1C18&RC[-16])&IF(RC[-15]="",,"|n"&R1C19&RC[-15])&IF(RC[-14]="",,"|n"&R1C20&RC[-14])&IF(RC[-13]="",,"|n"&R1C21&RC[-13])&IF(RC[-12]="",,"|n"&R1C22&RC[-12])&IF(RC[-11]="",,"|n"&R1C23&RC[-11])&IF(RC[-10]="",,"|n"&R1C24&RC[-10])&IF(RC[-9]="",,"|n"&R1C25&RC[-9])&IF(RC[-8]="",,"|n"&R1C26&RC[-8])&IF(RC[-7]="",,"|n"&R1C27&RC[-7])&IF(RC[-6]="",,"|n"&R1C28&RC[-6])&IF(RC[-5]="",,"|n"&R1C29&RC[-5])&IF(RC[-2]="",,"|n|n"&RC[-2]) -> |cFFFFFF99基础属性|r|n攻击:3145728
A67: 58 | B67: 5 | D67: ="["&RC[-2]&"级]" -> [5级] | E67: 魔龙 | F67: 胸甲 | H67: =IF(R[-16]C<>"",INT(R[-16]C*3.2),"") ->  | I67: =IF(R[-16]C<>"",INT(R[-16]C*3.2),"") ->  | J67: =IF(R[-16]C<>"",INT(R[-16]C*3.2),"") ->  | K67: =IF(R[-16]C<>"",INT(R[-16]C*3.2),"") ->  | L67: =IF(R[-16]C<>"",INT(R[-16]C*3.2),"") -> 10485760 | M67: =IF(R[-16]C<>"",INT(R[-16]C*3.2),"") ->  | N67: =IF(R[-16]C<>"",INT(R[-16]C*3.2),"") ->  | O67: =IF(R[-16]C<>"",INT(R[-16]C*1.5),"") ->  | AG67: =VLOOKUP(RC[-31],其他!R1C1:R7C2,2,0)&RC[-29]&RC[-28]&RC[-27]&"|r" -> |cFFFF9933[5级]魔龙胸甲|r | AH67: =IF(RC[-26]&RC[-25]&RC[-24]&RC[-23]&RC[-22]&RC[-21]="",,R1C7)&IF(RC[-26]="",,"|n"&R1C8&RC[-26])&IF(RC[-25]="",,"|n"&R1C9&RC[-25])&IF(RC[-24]="",,"|n"&R1C10&RC[-24])&IF(RC[-23]="",,"|n"&R1C11&RC[-23])&IF(RC[-22]="",,"|n"&R1C12&RC[-22])&IF(RC[-21]="",,"|n"&R1C13&RC[-21])&IF(RC[-19]&RC[-18]&RC[-17]&RC[-16]="",,"|n"&R1C14)&IF(RC[-19]="",,"|n"&R1C15&RC[-19])&IF(RC[-18]="",,"|n"&R1C16&RC[-18])&IF(RC[-17]="",,"|n"&R1C17&RC[-17])&IF(RC[-16]="",,"|n"&R1C18&RC[-16])&IF(RC[-15]="",,"|n"&R1C19&RC[-15])&IF(RC[-14]="",,"|n"&R1C20&RC[-14])&IF(RC[-13]="",,"|n"&R1C21&RC[-13])&IF(RC[-12]="",,"|n"&R1C22&RC[-12])&IF(RC[-11]="",,"|n"&R1C23&RC[-11])&IF(RC[-10]="",,"|n"&R1C24&RC[-10])&IF(RC[-9]="",,"|n"&R1C25&RC[-9])&IF(RC[-8]="",,"|n"&R1C26&RC[-8])&IF(RC[-7]="",,"|n"&R1C27&RC[-7])&IF(RC[-6]="",,"|n"&R1C28&RC[-6])&IF(RC[-5]="",,"|n"&R1C29&RC[-5])&IF(RC[-2]="",,"|n|n"&RC[-2]) -> |cFFFFFF99基础属性|r|n血量:10485760
A68: 59 | B68: 5 | D68: ="["&RC[-2]&"级]" -> [5级] | E68: 魔龙 | F68: 护手 | H68: =IF(R[-16]C<>"",INT(R[-16]C*3.2),"") ->  | I68: =IF(R[-16]C<>"",INT(R[-16]C*3.2),"") -> 838860 | J68: =IF(R[-16]C<>"",INT(R[-16]C*3.2),"") -> 838860 | K68: =IF(R[-16]C<>"",INT(R[-16]C*3.2),"") -> 838860 | L68: =IF(R[-16]C<>"",INT(R[-16]C*3.2),"") ->  | M68: =IF(R[-16]C<>"",INT(R[-16]C*3.2),"") ->  | N68: =IF(R[-16]C<>"",INT(R[-16]C*3.2),"") ->  | O68: =IF(R[-16]C<>"",INT(R[-16]C*1.5),"") ->  | AG68: =VLOOKUP(RC[-31],其他!R1C1:R7C2,2,0)&RC[-29]&RC[-28]&RC[-27]&"|r" -> |cFFFF9933[5级]魔龙护手|r | AH68: =IF(RC[-26]&RC[-25]&RC[-24]&RC[-23]&RC[-22]&RC[-21]="",,R1C7)&IF(RC[-26]="",,"|n"&R1C8&RC[-26])&IF(RC[-25]="",,"|n"&R1C9&RC[-25])&IF(RC[-24]="",,"|n"&R1C10&RC[-24])&IF(RC[-23]="",,"|n"&R1C11&RC[-23])&IF(RC[-22]="",,"|n"&R1C12&RC[-22])&IF(RC[-21]="",,"|n"&R1C13&RC[-21])&IF(RC[-19]&RC[-18]&RC[-17]&RC[-16]="",,"|n"&R1C14)&IF(RC[-19]="",,"|n"&R1C15&RC[-19])&IF(RC[-18]="",,"|n"&R1C16&RC[-18])&IF(RC[-17]="",,"|n"&R1C17&RC[-17])&IF(RC[-16]="",,"|n"&R1C18&RC[-16])&IF(RC[-15]="",,"|n"&R1C19&RC[-15])&IF(RC[-14]="",,"|n"&R1C20&RC[-14])&IF(RC[-13]="",,"|n"&R1C21&RC[-13])&IF(RC[-12]="",,"|n"&R1C22&RC[-12])&IF(RC[-11]="",,"|n"&R1C23&RC[-11])&IF(RC[-10]="",,"|n"&R1C24&RC[-10])&IF(RC[-9]="",,"|n"&R1C25&RC[-9])&IF(RC[-8]="",,"|n"&R1C26&RC[-8])&IF(RC[-7]="",,"|n"&R1C27&RC[-7])&IF(RC[-6]="",,"|n"&R1C28&RC[-6])&IF(RC[-5]="",,"|n"&R1C29&RC[-5])&IF(RC[-2]="",,"|n|n"&RC[-2]) -> |cFFFFFF99基础属性|r|n力量:838860|n敏捷:838860|n智力:838860
A69: 60 | B69: 5 | D69: ="["&RC[-2]&"级]" -> [5级] | E69: 魔龙 | F69: 护肩 | H69: =IF(R[-16]C<>"",INT(R[-16]C*3.2),"") ->  | I69: =IF(R[-16]C<>"",INT(R[-16]C*3.2),"") -> 1677721 | J69: =IF(R[-16]C<>"",INT(R[-16]C*3.2),"") ->  | K69: =IF(R[-16]C<>"",INT(R[-16]C*3.2),"") ->  | L69: =IF(R[-16]C<>"",INT(R[-16]C*3.2),"") ->  | M69: =IF(R[-16]C<>"",INT(R[-16]C*3.2),"") ->  | N69: =IF(R[-16]C<>"",INT(R[-16]C*3.2),"") ->  | O69: =IF(R[-16]C<>"",INT(R[-16]C*1.5),"") ->  | AG69: =VLOOKUP(RC[-31],其他!R1C1:R7C2,2,0)&RC[-29]&RC[-28]&RC[-27]&"|r" -> |cFFFF9933[5级]魔龙护肩|r | AH69: =IF(RC[-26]&RC[-25]&RC[-24]&RC[-23]&RC[-22]&RC[-21]="",,R1C7)&IF(RC[-26]="",,"|n"&R1C8&RC[-26])&IF(RC[-25]="",,"|n"&R1C9&RC[-25])&IF(RC[-24]="",,"|n"&R1C10&RC[-24])&IF(RC[-23]="",,"|n"&R1C11&RC[-23])&IF(RC[-22]="",,"|n"&R1C12&RC[-22])&IF(RC[-21]="",,"|n"&R1C13&RC[-21])&IF(RC[-19]&RC[-18]&RC[-17]&RC[-16]="",,"|n"&R1C14)&IF(RC[-19]="",,"|n"&R1C15&RC[-19])&IF(RC[-18]="",,"|n"&R1C16&RC[-18])&IF(RC[-17]="",,"|n"&R1C17&RC[-17])&IF(RC[-16]="",,"|n"&R1C18&RC[-16])&IF(RC[-15]="",,"|n"&R1C19&RC[-15])&IF(RC[-14]="",,"|n"&R1C20&RC[-14])&IF(RC[-13]="",,"|n"&R1C21&RC[-13])&IF(RC[-12]="",,"|n"&R1C22&RC[-12])&IF(RC[-11]="",,"|n"&R1C23&RC[-11])&IF(RC[-10]="",,"|n"&R1C24&RC[-10])&IF(RC[-9]="",,"|n"&R1C25&RC[-9])&IF(RC[-8]="",,"|n"&R1C26&RC[-8])&IF(RC[-7]="",,"|n"&R1C27&RC[-7])&IF(RC[-6]="",,"|n"&R1C28&RC[-6])&IF(RC[-5]="",,"|n"&R1C29&RC[-5])&IF(RC[-2]="",,"|n|n"&RC[-2]) -> |cFFFFFF99基础属性|r|n力量:1677721
A70: 61 | B70: 5 | D70: ="["&RC[-2]&"级]" -> [5级] | E70: 魔龙 | F70: 腿甲 | H70: =IF(R[-16]C<>"",INT(R[-16]C*3.2),"") ->  | I70: =IF(R[-16]C<>"",INT(R[-16]C*3.2),"") ->  | J70: =IF(R[-16]C<>"",INT(R[-16]C*3.2),"") ->  | K70: =IF(R[-16]C<>"",INT(R[-16]C*3.2),"") ->  | L70: =IF(R[-16]C<>"",INT(R[-16]C*3.2),"") ->  | M70: =IF(R[-16]C<>"",INT(R[-16]C*1.3),"") -> 14280 | N70: =IF(R[-16]C<>"",INT(R[-16]C*3.2),"") ->  | O70: =IF(R[-16]C<>"",INT(R[-16]C*1.5),"") ->  | AG70: =VLOOKUP(RC[-31],其他!R1C1:R7C2,2,0)&RC[-29]&RC[-28]&RC[-27]&"|r" -> |cFFFF9933[5级]魔龙腿甲|r | AH70: =IF(RC[-26]&RC[-25]&RC[-24]&RC[-23]&RC[-22]&RC[-21]="",,R1C7)&IF(RC[-26]="",,"|n"&R1C8&RC[-26])&IF(RC[-25]="",,"|n"&R1C9&RC[-25])&IF(RC[-24]="",,"|n"&R1C10&RC[-24])&IF(RC[-23]="",,"|n"&R1C11&RC[-23])&IF(RC[-22]="",,"|n"&R1C12&RC[-22])&IF(RC[-21]="",,"|n"&R1C13&RC[-21])&IF(RC[-19]&RC[-18]&RC[-17]&RC[-16]="",,"|n"&R1C14)&IF(RC[-19]="",,"|n"&R1C15&RC[-19])&IF(RC[-18]="",,"|n"&R1C16&RC[-18])&IF(RC[-17]="",,"|n"&R1C17&RC[-17])&IF(RC[-16]="",,"|n"&R1C18&RC[-16])&IF(RC[-15]="",,"|n"&R1C19&RC[-15])&IF(RC[-14]="",,"|n"&R1C20&RC[-14])&IF(RC[-13]="",,"|n"&R1C21&RC[-13])&IF(RC[-12]="",,"|n"&R1C22&RC[-12])&IF(RC[-11]="",,"|n"&R1C23&RC[-11])&IF(RC[-10]="",,"|n"&R1C24&RC[-10])&IF(RC[-9]="",,"|n"&R1C25&RC[-9])&IF(RC[-8]="",,"|n"&R1C26&RC[-8])&IF(RC[-7]="",,"|n"&R1C27&RC[-7])&IF(RC[-6]="",,"|n"&R1C28&RC[-6])&IF(RC[-5]="",,"|n"&R1C29&RC[-5])&IF(RC[-2]="",,"|n|n"&RC[-2]) -> |cFFFFFF99基础属性|r|n护甲:14280
A71: 62 | B71: 5 | D71: ="["&RC[-2]&"级]" -> [5级] | E71: 魔龙 | F71: 头饰 | H71: =IF(R[-16]C<>"",INT(R[-16]C*3.2),"") ->  | I71: =IF(R[-16]C<>"",INT(R[-16]C*3.2),"") ->  | J71: =IF(R[-16]C<>"",INT(R[-16]C*3.2),"") ->  | K71: =IF(R[-16]C<>"",INT(R[-16]C*3.2),"") -> 1677721 | L71: =IF(R[-16]C<>"",INT(R[-16]C*3.2),"") ->  | M71: =IF(R[-16]C<>"",INT(R[-16]C*3.2),"") ->  | N71: =IF(R[-16]C<>"",INT(R[-16]C*3.2),"") ->  | O71: =IF(R[-16]C<>"",INT(R[-16]C*1.5),"") ->  | AG71: =VLOOKUP(RC[-31],其他!R1C1:R7C2,2,0)&RC[-29]&RC[-28]&RC[-27]&"|r" -> |cFFFF9933[5级]魔龙头饰|r | AH71: =IF(RC[-26]&RC[-25]&RC[-24]&RC[-23]&RC[-22]&RC[-21]="",,R1C7)&IF(RC[-26]="",,"|n"&R1C8&RC[-26])&IF(RC[-25]="",,"|n"&R1C9&RC[-25])&IF(RC[-24]="",,"|n"&R1C10&RC[-24])&IF(RC[-23]="",,"|n"&R1C11&RC[-23])&IF(RC[-22]="",,"|n"&R1C12&RC[-22])&IF(RC[-21]="",,"|n"&R1C13&RC[-21])&IF(RC[-19]&RC[-18]&RC[-17]&RC[-16]="",,"|n"&R1C14)&IF(RC[-19]="",,"|n"&R1C15&RC[-19])&IF(RC[-18]="",,"|n"&R1C16&RC[-18])&IF(RC[-17]="",,"|n"&R1C17&RC[-17])&IF(RC[-16]="",,"|n"&R1C18&RC[-16])&IF(RC[-15]="",,"|n"&R1C19&RC[-15])&IF(RC[-14]="",,"|n"&R1C20&RC[-14])&IF(RC[-13]="",,"|n"&R1C21&RC[-13])&IF(RC[-12]="",,"|n"&R1C22&RC[-12])&IF(RC[-11]="",,"|n"&R1C23&RC[-11])&IF(RC[-10]="",,"|n"&R1C24&RC[-10])&IF(RC[-9]="",,"|n"&R1C25&RC[-9])&IF(RC[-8]="",,"|n"&R1C26&RC[-8])&IF(RC[-7]="",,"|n"&R1C27&RC[-7])&IF(RC[-6]="",,"|n"&R1C28&RC[-6])&IF(RC[-5]="",,"|n"&R1C29&RC[-5])&IF(RC[-2]="",,"|n|n"&RC[-2]) -> |cFFFFFF99基础属性|r|n智力:1677721
A72: 63 | B72: 5 | D72: ="["&RC[-2]&"级]" -> [5级] | E72: 魔龙 | F72: 战靴 | H72: =IF(R[-16]C<>"",INT(R[-16]C*3.2),"") ->  | I72: =IF(R[-16]C<>"",INT(R[-16]C*3.2),"") ->  | J72: =IF(R[-16]C<>"",INT(R[-16]C*3.2),"") -> 1677721 | K72: =IF(R[-16]C<>"",INT(R[-16]C*3.2),"") ->  | L72: =IF(R[-16]C<>"",INT(R[-16]C*3.2),"") ->  | M72: =IF(R[-16]C<>"",INT(R[-16]C*3.2),"") ->  | N72: =IF(R[-16]C<>"",INT(R[-16]C*3.2),"") ->  | O72: =IF(R[-16]C<>"",INT(R[-16]C*1.5),"") ->  | AG72: =VLOOKUP(RC[-31],其他!R1C1:R7C2,2,0)&RC[-29]&RC[-28]&RC[-27]&"|r" -> |cFFFF9933[5级]魔龙战靴|r | AH72: =IF(RC[-26]&RC[-25]&RC[-24]&RC[-23]&RC[-22]&RC[-21]="",,R1C7)&IF(RC[-26]="",,"|n"&R1C8&RC[-26])&IF(RC[-25]="",,"|n"&R1C9&RC[-25])&IF(RC[-24]="",,"|n"&R1C10&RC[-24])&IF(RC[-23]="",,"|n"&R1C11&RC[-23])&IF(RC[-22]="",,"|n"&R1C12&RC[-22])&IF(RC[-21]="",,"|n"&R1C13&RC[-21])&IF(RC[-19]&RC[-18]&RC[-17]&RC[-16]="",,"|n"&R1C14)&IF(RC[-19]="",,"|n"&R1C15&RC[-19])&IF(RC[-18]="",,"|n"&R1C16&RC[-18])&IF(RC[-17]="",,"|n"&R1C17&RC[-17])&IF(RC[-16]="",,"|n"&R1C18&RC[-16])&IF(RC[-15]="",,"|n"&R1C19&RC[-15])&IF(RC[-14]="",,"|n"&R1C20&RC[-14])&IF(RC[-13]="",,"|n"&R1C21&RC[-13])&IF(RC[-12]="",,"|n"&R1C22&RC[-12])&IF(RC[-11]="",,"|n"&R1C23&RC[-11])&IF(RC[-10]="",,"|n"&R1C24&RC[-10])&IF(RC[-9]="",,"|n"&R1C25&RC[-9])&IF(RC[-8]="",,"|n"&R1C26&RC[-8])&IF(RC[-7]="",,"|n"&R1C27&RC[-7])&IF(RC[-6]="",,"|n"&R1C28&RC[-6])&IF(RC[-5]="",,"|n"&R1C29&RC[-5])&IF(RC[-2]="",,"|n|n"&RC[-2]) -> |cFFFFFF99基础属性|r|n敏捷:1677721
A73: 64 | B73: 5 | D73: ="["&RC[-2]&"级]" -> [5级] | E73: 魔龙 | F73: 腰带 | H73: =IF(R[-16]C<>"",INT(R[-16]C*3.2),"") ->  | I73: =IF(R[-16]C<>"",INT(R[-16]C*3.2),"") ->  | J73: =IF(R[-16]C<>"",INT(R[-16]C*3.2),"") ->  | K73: =IF(R[-16]C<>"",INT(R[-16]C*3.2),"") ->  | L73: =IF(R[-16]C<>"",INT(R[-16]C*3.2),"") ->  | M73: =IF(R[-16]C<>"",INT(R[-16]C*3.2),"") ->  | N73: =IF(R[-16]C<>"",INT(R[-16]C*3.2),"") ->  | O73: =IF(R[-16]C<>"",INT(R[-16]C*1.3),"") -> 54 | AG73: =VLOOKUP(RC[-31],其他!R1C1:R7C2,2,0)&RC[-29]&RC[-28]&RC[-27]&"|r" -> |cFFFF9933[5级]魔龙腰带|r | AH73: =IF(RC[-26]&RC[-25]&RC[-24]&RC[-23]&RC[-22]&RC[-21]="",,R1C7)&IF(RC[-26]="",,"|n"&R1C8&RC[-26])&IF(RC[-25]="",,"|n"&R1C9&RC[-25])&IF(RC[-24]="",,"|n"&R1C10&RC[-24])&IF(RC[-23]="",,"|n"&R1C11&RC[-23])&IF(RC[-22]="",,"|n"&R1C12&RC[-22])&IF(RC[-21]="",,"|n"&R1C13&RC[-21])&IF(RC[-19]&RC[-18]&RC[-17]&RC[-16]="",,"|n"&R1C14)&IF(RC[-19]="",,"|n"&R1C15&RC[-19])&IF(RC[-18]="",,"|n"&R1C16&RC[-18])&IF(RC[-17]="",,"|n"&R1C17&RC[-17])&IF(RC[-16]="",,"|n"&R1C18&RC[-16])&IF(RC[-15]="",,"|n"&R1C19&RC[-15])&IF(RC[-14]="",,"|n"&R1C20&RC[-14])&IF(RC[-13]="",,"|n"&R1C21&RC[-13])&IF(RC[-12]="",,"|n"&R1C22&RC[-12])&IF(RC[-11]="",,"|n"&R1C23&RC[-11])&IF(RC[-10]="",,"|n"&R1C24&RC[-10])&IF(RC[-9]="",,"|n"&R1C25&RC[-9])&IF(RC[-8]="",,"|n"&R1C26&RC[-8])&IF(RC[-7]="",,"|n"&R1C27&RC[-7])&IF(RC[-6]="",,"|n"&R1C28&RC[-6])&IF(RC[-5]="",,"|n"&R1C29&RC[-5])&IF(RC[-2]="",,"|n|n"&RC[-2]) -> |n|cFFFFFF55附加属性|r(%)|n攻速:54
A74: 65 | B74: 5 | D74: ="["&RC[-2]&"级]" -> [5级] | E74: 修罗 | F74: 长刃 | H74: =IF(R[-16]C<>"",INT(R[-16]C*3.2),"") -> 3145728 | I74: =IF(R[-16]C<>"",INT(R[-16]C*3.2),"") ->  | J74: =IF(R[-16]C<>"",INT(R[-16]C*3.2),"") ->  | K74: =IF(R[-16]C<>"",INT(R[-16]C*3.2),"") ->  | L74: =IF(R[-16]C<>"",INT(R[-16]C*3.2),"") ->  | M74: =IF(R[-16]C<>"",INT(R[-16]C*3.2),"") ->  | N74: =IF(R[-16]C<>"",INT(R[-16]C*3.2),"") ->  | O74: =IF(R[-16]C<>"",INT(R[-16]C*1.5),"") ->  | AG74: =VLOOKUP(RC[-31],其他!R1C1:R7C2,2,0)&RC[-29]&RC[-28]&RC[-27]&"|r" -> |cFFFF9933[5级]修罗长刃|r | AH74: =IF(RC[-26]&RC[-25]&RC[-24]&RC[-23]&RC[-22]&RC[-21]="",,R1C7)&IF(RC[-26]="",,"|n"&R1C8&RC[-26])&IF(RC[-25]="",,"|n"&R1C9&RC[-25])&IF(RC[-24]="",,"|n"&R1C10&RC[-24])&IF(RC[-23]="",,"|n"&R1C11&RC[-23])&IF(RC[-22]="",,"|n"&R1C12&RC[-22])&IF(RC[-21]="",,"|n"&R1C13&RC[-21])&IF(RC[-19]&RC[-18]&RC[-17]&RC[-16]="",,"|n"&R1C14)&IF(RC[-19]="",,"|n"&R1C15&RC[-19])&IF(RC[-18]="",,"|n"&R1C16&RC[-18])&IF(RC[-17]="",,"|n"&R1C17&RC[-17])&IF(RC[-16]="",,"|n"&R1C18&RC[-16])&IF(RC[-15]="",,"|n"&R1C19&RC[-15])&IF(RC[-14]="",,"|n"&R1C20&RC[-14])&IF(RC[-13]="",,"|n"&R1C21&RC[-13])&IF(RC[-12]="",,"|n"&R1C22&RC[-12])&IF(RC[-11]="",,"|n"&R1C23&RC[-11])&IF(RC[-10]="",,"|n"&R1C24&RC[-10])&IF(RC[-9]="",,"|n"&R1C25&RC[-9])&IF(RC[-8]="",,"|n"&R1C26&RC[-8])&IF(RC[-7]="",,"|n"&R1C27&RC[-7])&IF(RC[-6]="",,"|n"&R1C28&RC[-6])&IF(RC[-5]="",,"|n"&R1C29&RC[-5])&IF(RC[-2]="",,"|n|n"&RC[-2]) -> |cFFFFFF99基础属性|r|n攻击:3145728
A75: 66 | B75: 5 | D75: ="["&RC[-2]&"级]" -> [5级] | E75: 修罗 | F75: 胸甲 | H75: =IF(R[-16]C<>"",INT(R[-16]C*3.2),"") ->  | I75: =IF(R[-16]C<>"",INT(R[-16]C*3.2),"") ->  | J75: =IF(R[-16]C<>"",INT(R[-16]C*3.2),"") ->  | K75: =IF(R[-16]C<>"",INT(R[-16]C*3.2),"") ->  | L75: =IF(R[-16]C<>"",INT(R[-16]C*3.2),"") -> 10485760 | M75: =IF(R[-16]C<>"",INT(R[-16]C*3.2),"") ->  | N75: =IF(R[-16]C<>"",INT(R[-16]C*3.2),"") ->  | O75: =IF(R[-16]C<>"",INT(R[-16]C*1.5),"") ->  | AG75: =VLOOKUP(RC[-31],其他!R1C1:R7C2,2,0)&RC[-29]&RC[-28]&RC[-27]&"|r" -> |cFFFF9933[5级]修罗胸甲|r | AH75: =IF(RC[-26]&RC[-25]&RC[-24]&RC[-23]&RC[-22]&RC[-21]="",,R1C7)&IF(RC[-26]="",,"|n"&R1C8&RC[-26])&IF(RC[-25]="",,"|n"&R1C9&RC[-25])&IF(RC[-24]="",,"|n"&R1C10&RC[-24])&IF(RC[-23]="",,"|n"&R1C11&RC[-23])&IF(RC[-22]="",,"|n"&R1C12&RC[-22])&IF(RC[-21]="",,"|n"&R1C13&RC[-21])&IF(RC[-19]&RC[-18]&RC[-17]&RC[-16]="",,"|n"&R1C14)&IF(RC[-19]="",,"|n"&R1C15&RC[-19])&IF(RC[-18]="",,"|n"&R1C16&RC[-18])&IF(RC[-17]="",,"|n"&R1C17&RC[-17])&IF(RC[-16]="",,"|n"&R1C18&RC[-16])&IF(RC[-15]="",,"|n"&R1C19&RC[-15])&IF(RC[-14]="",,"|n"&R1C20&RC[-14])&IF(RC[-13]="",,"|n"&R1C21&RC[-13])&IF(RC[-12]="",,"|n"&R1C22&RC[-12])&IF(RC[-11]="",,"|n"&R1C23&RC[-11])&IF(RC[-10]="",,"|n"&R1C24&RC[-10])&IF(RC[-9]="",,"|n"&R1C25&RC[-9])&IF(RC[-8]="",,"|n"&R1C26&RC[-8])&IF(RC[-7]="",,"|n"&R1C27&RC[-7])&IF(RC[-6]="",,"|n"&R1C28&RC[-6])&IF(RC[-5]="",,"|n"&R1C29&RC[-5])&IF(RC[-2]="",,"|n|n"&RC[-2]) -> |cFFFFFF99基础属性|r|n血量:10485760
A76: 67 | B76: 5 | D76: ="["&RC[-2]&"级]" -> [5级] | E76: 修罗 | F76: 护手 | H76: =IF(R[-16]C<>"",INT(R[-16]C*3.2),"") ->  | I76: =IF(R[-16]C<>"",INT(R[-16]C*3.2),"") -> 838860 | J76: =IF(R[-16]C<>"",INT(R[-16]C*3.2),"") -> 838860 | K76: =IF(R[-16]C<>"",INT(R[-16]C*3.2),"") -> 838860 | L76: =IF(R[-16]C<>"",INT(R[-16]C*3.2),"") ->  | M76: =IF(R[-16]C<>"",INT(R[-16]C*3.2),"") ->  | N76: =IF(R[-16]C<>"",INT(R[-16]C*3.2),"") ->  | O76: =IF(R[-16]C<>"",INT(R[-16]C*1.5),"") ->  | AG76: =VLOOKUP(RC[-31],其他!R1C1:R7C2,2,0)&RC[-29]&RC[-28]&RC[-27]&"|r" -> |cFFFF9933[5级]修罗护手|r | AH76: =IF(RC[-26]&RC[-25]&RC[-24]&RC[-23]&RC[-22]&RC[-21]="",,R1C7)&IF(RC[-26]="",,"|n"&R1C8&RC[-26])&IF(RC[-25]="",,"|n"&R1C9&RC[-25])&IF(RC[-24]="",,"|n"&R1C10&RC[-24])&IF(RC[-23]="",,"|n"&R1C11&RC[-23])&IF(RC[-22]="",,"|n"&R1C12&RC[-22])&IF(RC[-21]="",,"|n"&R1C13&RC[-21])&IF(RC[-19]&RC[-18]&RC[-17]&RC[-16]="",,"|n"&R1C14)&IF(RC[-19]="",,"|n"&R1C15&RC[-19])&IF(RC[-18]="",,"|n"&R1C16&RC[-18])&IF(RC[-17]="",,"|n"&R1C17&RC[-17])&IF(RC[-16]="",,"|n"&R1C18&RC[-16])&IF(RC[-15]="",,"|n"&R1C19&RC[-15])&IF(RC[-14]="",,"|n"&R1C20&RC[-14])&IF(RC[-13]="",,"|n"&R1C21&RC[-13])&IF(RC[-12]="",,"|n"&R1C22&RC[-12])&IF(RC[-11]="",,"|n"&R1C23&RC[-11])&IF(RC[-10]="",,"|n"&R1C24&RC[-10])&IF(RC[-9]="",,"|n"&R1C25&RC[-9])&IF(RC[-8]="",,"|n"&R1C26&RC[-8])&IF(RC[-7]="",,"|n"&R1C27&RC[-7])&IF(RC[-6]="",,"|n"&R1C28&RC[-6])&IF(RC[-5]="",,"|n"&R1C29&RC[-5])&IF(RC[-2]="",,"|n|n"&RC[-2]) -> |cFFFFFF99基础属性|r|n力量:838860|n敏捷:838860|n智力:838860
A77: 68 | B77: 5 | D77: ="["&RC[-2]&"级]" -> [5级] | E77: 修罗 | F77: 护肩 | H77: =IF(R[-16]C<>"",INT(R[-16]C*3.2),"") ->  | I77: =IF(R[-16]C<>"",INT(R[-16]C*3.2),"") -> 1677721 | J77: =IF(R[-16]C<>"",INT(R[-16]C*3.2),"") ->  | K77: =IF(R[-16]C<>"",INT(R[-16]C*3.2),"") ->  | L77: =IF(R[-16]C<>"",INT(R[-16]C*3.2),"") ->  | M77: =IF(R[-16]C<>"",INT(R[-16]C*3.2),"") ->  | N77: =IF(R[-16]C<>"",INT(R[-16]C*3.2),"") ->  | O77: =IF(R[-16]C<>"",INT(R[-16]C*1.5),"") ->  | AG77: =VLOOKUP(RC[-31],其他!R1C1:R7C2,2,0)&RC[-29]&RC[-28]&RC[-27]&"|r" -> |cFFFF9933[5级]修罗护肩|r | AH77: =IF(RC[-26]&RC[-25]&RC[-24]&RC[-23]&RC[-22]&RC[-21]="",,R1C7)&IF(RC[-26]="",,"|n"&R1C8&RC[-26])&IF(RC[-25]="",,"|n"&R1C9&RC[-25])&IF(RC[-24]="",,"|n"&R1C10&RC[-24])&IF(RC[-23]="",,"|n"&R1C11&RC[-23])&IF(RC[-22]="",,"|n"&R1C12&RC[-22])&IF(RC[-21]="",,"|n"&R1C13&RC[-21])&IF(RC[-19]&RC[-18]&RC[-17]&RC[-16]="",,"|n"&R1C14)&IF(RC[-19]="",,"|n"&R1C15&RC[-19])&IF(RC[-18]="",,"|n"&R1C16&RC[-18])&IF(RC[-17]="",,"|n"&R1C17&RC[-17])&IF(RC[-16]="",,"|n"&R1C18&RC[-16])&IF(RC[-15]="",,"|n"&R1C19&RC[-15])&IF(RC[-14]="",,"|n"&R1C20&RC[-14])&IF(RC[-13]="",,"|n"&R1C21&RC[-13])&IF(RC[-12]="",,"|n"&R1C22&RC[-12])&IF(RC[-11]="",,"|n"&R1C23&RC[-11])&IF(RC[-10]="",,"|n"&R1C24&RC[-10])&IF(RC[-9]="",,"|n"&R1C25&RC[-9])&IF(RC[-8]="",,"|n"&R1C26&RC[-8])&IF(RC[-7]="",,"|n"&R1C27&RC[-7])&IF(RC[-6]="",,"|n"&R1C28&RC[-6])&IF(RC[-5]="",,"|n"&R1C29&RC[-5])&IF(RC[-2]="",,"|n|n"&RC[-2]) -> |cFFFFFF99基础属性|r|n力量:1677721
A78: 69 | B78: 5 | D78: ="["&RC[-2]&"级]" -> [5级] | E78: 修罗 | F78: 腿甲 | H78: =IF(R[-16]C<>"",INT(R[-16]C*3.2),"") ->  | I78: =IF(R[-16]C<>"",INT(R[-16]C*3.2),"") ->  | J78: =IF(R[-16]C<>"",INT(R[-16]C*3.2),"") ->  | K78: =IF(R[-16]C<>"",INT(R[-16]C*3.2),"") ->  | L78: =IF(R[-16]C<>"",INT(R[-16]C*3.2),"") ->  | M78: =IF(R[-16]C<>"",INT(R[-16]C*1.3),"") -> 14280 | N78: =IF(R[-16]C<>"",INT(R[-16]C*3.2),"") ->  | O78: =IF(R[-16]C<>"",INT(R[-16]C*1.5),"") ->  | AG78: =VLOOKUP(RC[-31],其他!R1C1:R7C2,2,0)&RC[-29]&RC[-28]&RC[-27]&"|r" -> |cFFFF9933[5级]修罗腿甲|r | AH78: =IF(RC[-26]&RC[-25]&RC[-24]&RC[-23]&RC[-22]&RC[-21]="",,R1C7)&IF(RC[-26]="",,"|n"&R1C8&RC[-26])&IF(RC[-25]="",,"|n"&R1C9&RC[-25])&IF(RC[-24]="",,"|n"&R1C10&RC[-24])&IF(RC[-23]="",,"|n"&R1C11&RC[-23])&IF(RC[-22]="",,"|n"&R1C12&RC[-22])&IF(RC[-21]="",,"|n"&R1C13&RC[-21])&IF(RC[-19]&RC[-18]&RC[-17]&RC[-16]="",,"|n"&R1C14)&IF(RC[-19]="",,"|n"&R1C15&RC[-19])&IF(RC[-18]="",,"|n"&R1C16&RC[-18])&IF(RC[-17]="",,"|n"&R1C17&RC[-17])&IF(RC[-16]="",,"|n"&R1C18&RC[-16])&IF(RC[-15]="",,"|n"&R1C19&RC[-15])&IF(RC[-14]="",,"|n"&R1C20&RC[-14])&IF(RC[-13]="",,"|n"&R1C21&RC[-13])&IF(RC[-12]="",,"|n"&R1C22&RC[-12])&IF(RC[-11]="",,"|n"&R1C23&RC[-11])&IF(RC[-10]="",,"|n"&R1C24&RC[-10])&IF(RC[-9]="",,"|n"&R1C25&RC[-9])&IF(RC[-8]="",,"|n"&R1C26&RC[-8])&IF(RC[-7]="",,"|n"&R1C27&RC[-7])&IF(RC[-6]="",,"|n"&R1C28&RC[-6])&IF(RC[-5]="",,"|n"&R1C29&RC[-5])&IF(RC[-2]="",,"|n|n"&RC[-2]) -> |cFFFFFF99基础属性|r|n护甲:14280
A79: 70 | B79: 5 | D79: ="["&RC[-2]&"级]" -> [5级] | E79: 修罗 | F79: 头饰 | H79: =IF(R[-16]C<>"",INT(R[-16]C*3.2),"") ->  | I79: =IF(R[-16]C<>"",INT(R[-16]C*3.2),"") ->  | J79: =IF(R[-16]C<>"",INT(R[-16]C*3.2),"") ->  | K79: =IF(R[-16]C<>"",INT(R[-16]C*3.2),"") -> 1677721 | L79: =IF(R[-16]C<>"",INT(R[-16]C*3.2),"") ->  | M79: =IF(R[-16]C<>"",INT(R[-16]C*3.2),"") ->  | N79: =IF(R[-16]C<>"",INT(R[-16]C*3.2),"") ->  | O79: =IF(R[-16]C<>"",INT(R[-16]C*1.5),"") ->  | AG79: =VLOOKUP(RC[-31],其他!R1C1:R7C2,2,0)&RC[-29]&RC[-28]&RC[-27]&"|r" -> |cFFFF9933[5级]修罗头饰|r | AH79: =IF(RC[-26]&RC[-25]&RC[-24]&RC[-23]&RC[-22]&RC[-21]="",,R1C7)&IF(RC[-26]="",,"|n"&R1C8&RC[-26])&IF(RC[-25]="",,"|n"&R1C9&RC[-25])&IF(RC[-24]="",,"|n"&R1C10&RC[-24])&IF(RC[-23]="",,"|n"&R1C11&RC[-23])&IF(RC[-22]="",,"|n"&R1C12&RC[-22])&IF(RC[-21]="",,"|n"&R1C13&RC[-21])&IF(RC[-19]&RC[-18]&RC[-17]&RC[-16]="",,"|n"&R1C14)&IF(RC[-19]="",,"|n"&R1C15&RC[-19])&IF(RC[-18]="",,"|n"&R1C16&RC[-18])&IF(RC[-17]="",,"|n"&R1C17&RC[-17])&IF(RC[-16]="",,"|n"&R1C18&RC[-16])&IF(RC[-15]="",,"|n"&R1C19&RC[-15])&IF(RC[-14]="",,"|n"&R1C20&RC[-14])&IF(RC[-13]="",,"|n"&R1C21&RC[-13])&IF(RC[-12]="",,"|n"&R1C22&RC[-12])&IF(RC[-11]="",,"|n"&R1C23&RC[-11])&IF(RC[-10]="",,"|n"&R1C24&RC[-10])&IF(RC[-9]="",,"|n"&R1C25&RC[-9])&IF(RC[-8]="",,"|n"&R1C26&RC[-8])&IF(RC[-7]="",,"|n"&R1C27&RC[-7])&IF(RC[-6]="",,"|n"&R1C28&RC[-6])&IF(RC[-5]="",,"|n"&R1C29&RC[-5])&IF(RC[-2]="",,"|n|n"&RC[-2]) -> |cFFFFFF99基础属性|r|n智力:1677721
A80: 69 | B80: 5 | D80: ="["&RC[-2]&"级]" -> [5级] | E80: 修罗 | F80: 战靴 | H80: =IF(R[-16]C<>"",INT(R[-16]C*3.2),"") ->  | I80: =IF(R[-16]C<>"",INT(R[-16]C*3.2),"") ->  | J80: =IF(R[-16]C<>"",INT(R[-16]C*3.2),"") -> 1677721 | K80: =IF(R[-16]C<>"",INT(R[-16]C*3.2),"") ->  | L80: =IF(R[-16]C<>"",INT(R[-16]C*3.2),"") ->  | M80: =IF(R[-16]C<>"",INT(R[-16]C*3.2),"") ->  | N80: =IF(R[-16]C<>"",INT(R[-16]C*3.2),"") ->  | O80: =IF(R[-16]C<>"",INT(R[-16]C*1.5),"") ->  | AG80: =VLOOKUP(RC[-31],其他!R1C1:R7C2,2,0)&RC[-29]&RC[-28]&RC[-27]&"|r" -> |cFFFF9933[5级]修罗战靴|r | AH80: =IF(RC[-26]&RC[-25]&RC[-24]&RC[-23]&RC[-22]&RC[-21]="",,R1C7)&IF(RC[-26]="",,"|n"&R1C8&RC[-26])&IF(RC[-25]="",,"|n"&R1C9&RC[-25])&IF(RC[-24]="",,"|n"&R1C10&RC[-24])&IF(RC[-23]="",,"|n"&R1C11&RC[-23])&IF(RC[-22]="",,"|n"&R1C12&RC[-22])&IF(RC[-21]="",,"|n"&R1C13&RC[-21])&IF(RC[-19]&RC[-18]&RC[-17]&RC[-16]="",,"|n"&R1C14)&IF(RC[-19]="",,"|n"&R1C15&RC[-19])&IF(RC[-18]="",,"|n"&R1C16&RC[-18])&IF(RC[-17]="",,"|n"&R1C17&RC[-17])&IF(RC[-16]="",,"|n"&R1C18&RC[-16])&IF(RC[-15]="",,"|n"&R1C19&RC[-15])&IF(RC[-14]="",,"|n"&R1C20&RC[-14])&IF(RC[-13]="",,"|n"&R1C21&RC[-13])&IF(RC[-12]="",,"|n"&R1C22&RC[-12])&IF(RC[-11]="",,"|n"&R1C23&RC[-11])&IF(RC[-10]="",,"|n"&R1C24&RC[-10])&IF(RC[-9]="",,"|n"&R1C25&RC[-9])&IF(RC[-8]="",,"|n"&R1C26&RC[-8])&IF(RC[-7]="",,"|n"&R1C27&RC[-7])&IF(RC[-6]="",,"|n"&R1C28&RC[-6])&IF(RC[-5]="",,"|n"&R1C29&RC[-5])&IF(RC[-2]="",,"|n|n"&RC[-2]) -> |cFFFFFF99基础属性|r|n敏捷:1677721
A81: 70 | B81: 5 | D81: ="["&RC[-2]&"级]" -> [5级] | E81: 修罗 | F81: 腰带 | H81: =IF(R[-16]C<>"",INT(R[-16]C*3.2),"") ->  | I81: =IF(R[-16]C<>"",INT(R[-16]C*3.2),"") ->  | J81: =IF(R[-16]C<>"",INT(R[-16]C*3.2),"") ->  | K81: =IF(R[-16]C<>"",INT(R[-16]C*3.2),"") ->  | L81: =IF(R[-16]C<>"",INT(R[-16]C*3.2),"") ->  | M81: =IF(R[-16]C<>"",INT(R[-16]C*3.2),"") ->  | N81: =IF(R[-16]C<>"",INT(R[-16]C*3.2),"") ->  | O81: =IF(R[-16]C<>"",INT(R[-16]C*1.3),"") -> 54 | AG81: =VLOOKUP(RC[-31],其他!R1C1:R7C2,2,0)&RC[-29]&RC[-28]&RC[-27]&"|r" -> |cFFFF9933[5级]修罗腰带|r | AH81: =IF(RC[-26]&RC[-25]&RC[-24]&RC[-23]&RC[-22]&RC[-21]="",,R1C7)&IF(RC[-26]="",,"|n"&R1C8&RC[-26])&IF(RC[-25]="",,"|n"&R1C9&RC[-25])&IF(RC[-24]="",,"|n"&R1C10&RC[-24])&IF(RC[-23]="",,"|n"&R1C11&RC[-23])&IF(RC[-22]="",,"|n"&R1C12&RC[-22])&IF(RC[-21]="",,"|n"&R1C13&RC[-21])&IF(RC[-19]&RC[-18]&RC[-17]&RC[-16]="",,"|n"&R1C14)&IF(RC[-19]="",,"|n"&R1C15&RC[-19])&IF(RC[-18]="",,"|n"&R1C16&RC[-18])&IF(RC[-17]="",,"|n"&R1C17&RC[-17])&IF(RC[-16]="",,"|n"&R1C18&RC[-16])&IF(RC[-15]="",,"|n"&R1C19&RC[-15])&IF(RC[-14]="",,"|n"&R1C20&RC[-14])&IF(RC[-13]="",,"|n"&R1C21&RC[-13])&IF(RC[-12]="",,"|n"&R1C22&RC[-12])&IF(RC[-11]="",,"|n"&R1C23&RC[-11])&IF(RC[-10]="",,"|n"&R1C24&RC[-10])&IF(RC[-9]="",,"|n"&R1C25&RC[-9])&IF(RC[-8]="",,"|n"&R1C26&RC[-8])&IF(RC[-7]="",,"|n"&R1C27&RC[-7])&IF(RC[-6]="",,"|n"&R1C28&RC[-6])&IF(RC[-5]="",,"|n"&R1C29&RC[-5])&IF(RC[-2]="",,"|n|n"&RC[-2]) -> |n|cFFFFFF55附加属性|r(%)|n攻速:54

Sheet: 套装属性表
A1: index | B1: lv | C1: 品级 | D1: 前缀 | E1: suitname | F1: 后缀 | G1: info | H1: name | I1: tid | J1: bid | K1: art | L1: |cFFFFFF99基础属性|r | M1: 攻击: | N1: 力量: | O1: 敏捷: | P1: 智力: | Q1: 血量: | R1: 护甲: | S1: |cFFFFFF55附加属性|r(%) | T1: 攻速: | U1: 攻击吸血: | V1: 暴击概率: | W1: 暴击伤害: | X1: 伤害增幅: | Y1: 附加伤害: | Z1: 最终伤害: | AA1: 伤害抵抗: | AB1: 伤害减免: | AC1: 伤害反弹: | AD1: 力量增幅 | AE1: 敏捷增幅 | AF1: 智力增幅 | AG1: |cFFFFFF11核心属性|r | AH1: 升级属性成长: | AI1: 杀敌属性成长: | AJ1: 每秒属性成长: | AK1: = | AL1: 描述
A2: 1 | B2: 1 | E2: 战士 | F2: 套装 | G2: =IF(RC[6]="",,"|n"&R1C13&RC[6])&IF(RC[7]="",,"|n"&R1C14&RC[7])&IF(RC[8]="",,"|n"&R1C15&RC[8])&IF(RC[9]="",,"|n"&R1C16&RC[9])&IF(RC[10]="",,"|n"&R1C17&RC[10])&IF(RC[11]="",,"|n"&R1C18&RC[11])&IF(RC[13]="",,"|n"&R1C20&RC[13])&IF(RC[14]="",,"|n"&R1C21&RC[14])&IF(RC[15]="",,"|n"&R1C22&RC[15])&IF(RC[16]="",,"|n"&R1C23&RC[16])&IF(RC[17]="",,"|n"&R1C24&RC[17])&IF(RC[18]="",,"|n"&R1C25&RC[18])&IF(RC[19]="",,"|n"&R1C26&RC[19])&IF(RC[20]="",,"|n"&R1C27&RC[20])&IF(RC[21]="",,"|n"&R1C28&RC[21])&IF(RC[22]="",,"|n"&R1C29&RC[22])&IF(RC[23]="",,"|n"&R1C30&RC[23])&IF(RC[24]="",,"|n"&R1C31&RC[24])&IF(RC[25]="",,"|n"&R1C32&RC[25])&IF(RC[27]="",,"|n"&R1C34&RC[27])&IF(RC[28]="",,"|n"&R1C35&RC[28])&IF(RC[29]="",,"|n"&R1C36&RC[29])&IF(RC[31]="",,"|n"&RC[31]) -> |n攻击:35000|n力量:15000|n敏捷:15000|n智力:15000|n血量:100000|n护甲:5000|n攻速:20 | H2: =VLOOKUP(RC[-6],其他!R1C1:R7C2,2,0)&RC[-4]&RC[-3]&RC[-2]&"|r" -> |cFF999999战士套装|r | I2: WS01 | J2: WB01 | K2: ="blp\suitItem\"&IF(RC[-10]>=10,"","0")&RC[-10]&" (1) .blp" -> blp\suitItem\01 (1) .blp | M2: 35000 | N2: 15000 | O2: 15000 | P2: 15000 | Q2: 100000 | R2: 5000 | T2: 20
A3: 2 | B3: 1 | E3: 卫士 | F3: 套装 | G3: =IF(RC[6]="",,"|n"&R1C13&RC[6])&IF(RC[7]="",,"|n"&R1C14&RC[7])&IF(RC[8]="",,"|n"&R1C15&RC[8])&IF(RC[9]="",,"|n"&R1C16&RC[9])&IF(RC[10]="",,"|n"&R1C17&RC[10])&IF(RC[11]="",,"|n"&R1C18&RC[11])&IF(RC[13]="",,"|n"&R1C20&RC[13])&IF(RC[14]="",,"|n"&R1C21&RC[14])&IF(RC[15]="",,"|n"&R1C22&RC[15])&IF(RC[16]="",,"|n"&R1C23&RC[16])&IF(RC[17]="",,"|n"&R1C24&RC[17])&IF(RC[18]="",,"|n"&R1C25&RC[18])&IF(RC[19]="",,"|n"&R1C26&RC[19])&IF(RC[20]="",,"|n"&R1C27&RC[20])&IF(RC[21]="",,"|n"&R1C28&RC[21])&IF(RC[22]="",,"|n"&R1C29&RC[22])&IF(RC[23]="",,"|n"&R1C30&RC[23])&IF(RC[24]="",,"|n"&R1C31&RC[24])&IF(RC[25]="",,"|n"&R1C32&RC[25])&IF(RC[27]="",,"|n"&R1C34&RC[27])&IF(RC[28]="",,"|n"&R1C35&RC[28])&IF(RC[29]="",,"|n"&R1C36&RC[29])&IF(RC[31]="",,"|n"&RC[31]) -> |n攻击:35000|n力量:15000|n敏捷:15000|n智力:15000|n血量:100000|n护甲:5000|n攻速:20 | H3: =VLOOKUP(RC[-6],其他!R1C1:R7C2,2,0)&RC[-4]&RC[-3]&RC[-2]&"|r" -> |cFF999999卫士套装|r | I3: WS02 | J3: WB02 | K3: ="blp\suitItem\"&IF(RC[-10]>=10,"","0")&RC[-10]&" (1) .blp" -> blp\suitItem\02 (1) .blp | M3: 35000 | N3: 15000 | O3: 15000 | P3: 15000 | Q3: 100000 | R3: 5000 | T3: 20
A4: 3 | B4: 2 | E4: 狩猎 | F4: 套装 | G4: =IF(RC[6]="",,"|n"&R1C13&RC[6])&IF(RC[7]="",,"|n"&R1C14&RC[7])&IF(RC[8]="",,"|n"&R1C15&RC[8])&IF(RC[9]="",,"|n"&R1C16&RC[9])&IF(RC[10]="",,"|n"&R1C17&RC[10])&IF(RC[11]="",,"|n"&R1C18&RC[11])&IF(RC[13]="",,"|n"&R1C20&RC[13])&IF(RC[14]="",,"|n"&R1C21&RC[14])&IF(RC[15]="",,"|n"&R1C22&RC[15])&IF(RC[16]="",,"|n"&R1C23&RC[16])&IF(RC[17]="",,"|n"&R1C24&RC[17])&IF(RC[18]="",,"|n"&R1C25&RC[18])&IF(RC[19]="",,"|n"&R1C26&RC[19])&IF(RC[20]="",,"|n"&R1C27&RC[20])&IF(RC[21]="",,"|n"&R1C28&RC[21])&IF(RC[22]="",,"|n"&R1C29&RC[22])&IF(RC[23]="",,"|n"&R1C30&RC[23])&IF(RC[24]="",,"|n"&R1C31&RC[24])&IF(RC[25]="",,"|n"&R1C32&RC[25])&IF(RC[27]="",,"|n"&R1C34&RC[27])&IF(RC[28]="",,"|n"&R1C35&RC[28])&IF(RC[29]="",,"|n"&R1C36&RC[29])&IF(RC[31]="",,"|n"&RC[31]) -> |n攻击:112000|n力量:48000|n敏捷:48000|n智力:48000|n血量:320000|n护甲:6500|n攻速:26 | H4: =VLOOKUP(RC[-6],其他!R1C1:R7C2,2,0)&RC[-4]&RC[-3]&RC[-2]&"|r" -> |cFF99FF66狩猎套装|r | I4: WS03 | J4: WB03 | K4: ="blp\suitItem\"&IF(RC[-10]>=10,"","0")&RC[-10]&" (1) .blp" -> blp\suitItem\03 (1) .blp | M4: =INT(R[-2]C*3.2) -> 112000 | N4: =INT(R[-2]C*3.2) -> 48000 | O4: =INT(R[-2]C*3.2) -> 48000 | P4: =INT(R[-2]C*3.2) -> 48000 | Q4: =INT(R[-2]C*3.2) -> 320000 | R4: =INT(R[-2]C*1.3) -> 6500 | S4: =INT(R[-2]C*1.5) -> 0 | T4: =INT(R[-2]C*1.3) -> 26
A5: 4 | B5: 2 | E5: 赤血 | F5: 套装 | G5: =IF(RC[6]="",,"|n"&R1C13&RC[6])&IF(RC[7]="",,"|n"&R1C14&RC[7])&IF(RC[8]="",,"|n"&R1C15&RC[8])&IF(RC[9]="",,"|n"&R1C16&RC[9])&IF(RC[10]="",,"|n"&R1C17&RC[10])&IF(RC[11]="",,"|n"&R1C18&RC[11])&IF(RC[13]="",,"|n"&R1C20&RC[13])&IF(RC[14]="",,"|n"&R1C21&RC[14])&IF(RC[15]="",,"|n"&R1C22&RC[15])&IF(RC[16]="",,"|n"&R1C23&RC[16])&IF(RC[17]="",,"|n"&R1C24&RC[17])&IF(RC[18]="",,"|n"&R1C25&RC[18])&IF(RC[19]="",,"|n"&R1C26&RC[19])&IF(RC[20]="",,"|n"&R1C27&RC[20])&IF(RC[21]="",,"|n"&R1C28&RC[21])&IF(RC[22]="",,"|n"&R1C29&RC[22])&IF(RC[23]="",,"|n"&R1C30&RC[23])&IF(RC[24]="",,"|n"&R1C31&RC[24])&IF(RC[25]="",,"|n"&R1C32&RC[25])&IF(RC[27]="",,"|n"&R1C34&RC[27])&IF(RC[28]="",,"|n"&R1C35&RC[28])&IF(RC[29]="",,"|n"&R1C36&RC[29])&IF(RC[31]="",,"|n"&RC[31]) -> |n攻击:112000|n力量:48000|n敏捷:48000|n智力:48000|n血量:320000|n护甲:6500|n攻速:26 | H5: =VLOOKUP(RC[-6],其他!R1C1:R7C2,2,0)&RC[-4]&RC[-3]&RC[-2]&"|r" -> |cFF99FF66赤血套装|r | I5: WS04 | J5: WB04 | K5: ="blp\suitItem\"&IF(RC[-10]>=10,"","0")&RC[-10]&" (1) .blp" -> blp\suitItem\04 (1) .blp | M5: =INT(R[-2]C*3.2) -> 112000 | N5: =INT(R[-2]C*3.2) -> 48000 | O5: =INT(R[-2]C*3.2) -> 48000 | P5: =INT(R[-2]C*3.2) -> 48000 | Q5: =INT(R[-2]C*3.2) -> 320000 | R5: =INT(R[-2]C*1.3) -> 6500 | S5: =INT(R[-2]C*1.5) -> 0 | T5: =INT(R[-2]C*1.3) -> 26
A6: 5 | B6: 3 | E6: 骑士 | F6: 套装 | G6: =IF(RC[6]="",,"|n"&R1C13&RC[6])&IF(RC[7]="",,"|n"&R1C14&RC[7])&IF(RC[8]="",,"|n"&R1C15&RC[8])&IF(RC[9]="",,"|n"&R1C16&RC[9])&IF(RC[10]="",,"|n"&R1C17&RC[10])&IF(RC[11]="",,"|n"&R1C18&RC[11])&IF(RC[13]="",,"|n"&R1C20&RC[13])&IF(RC[14]="",,"|n"&R1C21&RC[14])&IF(RC[15]="",,"|n"&R1C22&RC[15])&IF(RC[16]="",,"|n"&R1C23&RC[16])&IF(RC[17]="",,"|n"&R1C24&RC[17])&IF(RC[18]="",,"|n"&R1C25&RC[18])&IF(RC[19]="",,"|n"&R1C26&RC[19])&IF(RC[20]="",,"|n"&R1C27&RC[20])&IF(RC[21]="",,"|n"&R1C28&RC[21])&IF(RC[22]="",,"|n"&R1C29&RC[22])&IF(RC[23]="",,"|n"&R1C30&RC[23])&IF(RC[24]="",,"|n"&R1C31&RC[24])&IF(RC[25]="",,"|n"&R1C32&RC[25])&IF(RC[27]="",,"|n"&R1C34&RC[27])&IF(RC[28]="",,"|n"&R1C35&RC[28])&IF(RC[29]="",,"|n"&R1C36&RC[29])&IF(RC[31]="",,"|n"&RC[31]) -> |n攻击:358400|n力量:153600|n敏捷:153600|n智力:153600|n血量:1024000|n护甲:8450|n攻速:33 | H6: =VLOOKUP(RC[-6],其他!R1C1:R7C2,2,0)&RC[-4]&RC[-3]&RC[-2]&"|r" -> |cFF1BE6B8骑士套装|r | I6: WS05 | J6: WB05 | K6: ="blp\suitItem\"&IF(RC[-10]>=10,"","0")&RC[-10]&" (1) .blp" -> blp\suitItem\05 (1) .blp | M6: =INT(R[-2]C*3.2) -> 358400 | N6: =INT(R[-2]C*3.2) -> 153600 | O6: =INT(R[-2]C*3.2) -> 153600 | P6: =INT(R[-2]C*3.2) -> 153600 | Q6: =INT(R[-2]C*3.2) -> 1024000 | R6: =INT(R[-2]C*1.3) -> 8450 | S6: =INT(R[-2]C*1.5) -> 0 | T6: =INT(R[-2]C*1.3) -> 33
A7: 6 | B7: 3 | E7: 领主 | F7: 套装 | G7: =IF(RC[6]="",,"|n"&R1C13&RC[6])&IF(RC[7]="",,"|n"&R1C14&RC[7])&IF(RC[8]="",,"|n"&R1C15&RC[8])&IF(RC[9]="",,"|n"&R1C16&RC[9])&IF(RC[10]="",,"|n"&R1C17&RC[10])&IF(RC[11]="",,"|n"&R1C18&RC[11])&IF(RC[13]="",,"|n"&R1C20&RC[13])&IF(RC[14]="",,"|n"&R1C21&RC[14])&IF(RC[15]="",,"|n"&R1C22&RC[15])&IF(RC[16]="",,"|n"&R1C23&RC[16])&IF(RC[17]="",,"|n"&R1C24&RC[17])&IF(RC[18]="",,"|n"&R1C25&RC[18])&IF(RC[19]="",,"|n"&R1C26&RC[19])&IF(RC[20]="",,"|n"&R1C27&RC[20])&IF(RC[21]="",,"|n"&R1C28&RC[21])&IF(RC[22]="",,"|n"&R1C29&RC[22])&IF(RC[23]="",,"|n"&R1C30&RC[23])&IF(RC[24]="",,"|n"&R1C31&RC[24])&IF(RC[25]="",,"|n"&R1C32&RC[25])&IF(RC[27]="",,"|n"&R1C34&RC[27])&IF(RC[28]="",,"|n"&R1C35&RC[28])&IF(RC[29]="",,"|n"&R1C36&RC[29])&IF(RC[31]="",,"|n"&RC[31]) -> |n攻击:358400|n力量:153600|n敏捷:153600|n智力:153600|n血量:1024000|n护甲:8450|n攻速:33 | H7: =VLOOKUP(RC[-6],其他!R1C1:R7C2,2,0)&RC[-4]&RC[-3]&RC[-2]&"|r" -> |cFF1BE6B8领主套装|r | I7: WS06 | J7: WB06 | K7: ="blp\suitItem\"&IF(RC[-10]>=10,"","0")&RC[-10]&" (1) .blp" -> blp\suitItem\06 (1) .blp | M7: =INT(R[-2]C*3.2) -> 358400 | N7: =INT(R[-2]C*3.2) -> 153600 | O7: =INT(R[-2]C*3.2) -> 153600 | P7: =INT(R[-2]C*3.2) -> 153600 | Q7: =INT(R[-2]C*3.2) -> 1024000 | R7: =INT(R[-2]C*1.3) -> 8450 | S7: =INT(R[-2]C*1.5) -> 0 | T7: =INT(R[-2]C*1.3) -> 33
A8: 7 | B8: 4 | E8: 战神 | F8: 套装 | G8: =IF(RC[6]="",,"|n"&R1C13&RC[6])&IF(RC[7]="",,"|n"&R1C14&RC[7])&IF(RC[8]="",,"|n"&R1C15&RC[8])&IF(RC[9]="",,"|n"&R1C16&RC[9])&IF(RC[10]="",,"|n"&R1C17&RC[10])&IF(RC[11]="",,"|n"&R1C18&RC[11])&IF(RC[13]="",,"|n"&R1C20&RC[13])&IF(RC[14]="",,"|n"&R1C21&RC[14])&IF(RC[15]="",,"|n"&R1C22&RC[15])&IF(RC[16]="",,"|n"&R1C23&RC[16])&IF(RC[17]="",,"|n"&R1C24&RC[17])&IF(RC[18]="",,"|n"&R1C25&RC[18])&IF(RC[19]="",,"|n"&R1C26&RC[19])&IF(RC[20]="",,"|n"&R1C27&RC[20])&IF(RC[21]="",,"|n"&R1C28&RC[21])&IF(RC[22]="",,"|n"&R1C29&RC[22])&IF(RC[23]="",,"|n"&R1C30&RC[23])&IF(RC[24]="",,"|n"&R1C31&RC[24])&IF(RC[25]="",,"|n"&R1C32&RC[25])&IF(RC[27]="",,"|n"&R1C34&RC[27])&IF(RC[28]="",,"|n"&R1C35&RC[28])&IF(RC[29]="",,"|n"&R1C36&RC[29])&IF(RC[31]="",,"|n"&RC[31]) -> |n攻击:1146880|n力量:491520|n敏捷:491520|n智力:491520|n血量:3276800|n护甲:10985|n攻速:42 | H8: =VLOOKUP(RC[-6],其他!R1C1:R7C2,2,0)&RC[-4]&RC[-3]&RC[-2]&"|r" -> |cFF33FF00战神套装|r | I8: WS07 | J8: WB07 | K8: ="blp\suitItem\"&IF(RC[-10]>=10,"","0")&RC[-10]&" (1) .blp" -> blp\suitItem\07 (1) .blp | M8: =INT(R[-2]C*3.2) -> 1146880 | N8: =INT(R[-2]C*3.2) -> 491520 | O8: =INT(R[-2]C*3.2) -> 491520 | P8: =INT(R[-2]C*3.2) -> 491520 | Q8: =INT(R[-2]C*3.2) -> 3276800 | R8: =INT(R[-2]C*1.3) -> 10985 | S8: =INT(R[-2]C*1.5) -> 0 | T8: =INT(R[-2]C*1.3) -> 42
A9: 8 | B9: 4 | E9: 贤者 | F9: 套装 | G9: =IF(RC[6]="",,"|n"&R1C13&RC[6])&IF(RC[7]="",,"|n"&R1C14&RC[7])&IF(RC[8]="",,"|n"&R1C15&RC[8])&IF(RC[9]="",,"|n"&R1C16&RC[9])&IF(RC[10]="",,"|n"&R1C17&RC[10])&IF(RC[11]="",,"|n"&R1C18&RC[11])&IF(RC[13]="",,"|n"&R1C20&RC[13])&IF(RC[14]="",,"|n"&R1C21&RC[14])&IF(RC[15]="",,"|n"&R1C22&RC[15])&IF(RC[16]="",,"|n"&R1C23&RC[16])&IF(RC[17]="",,"|n"&R1C24&RC[17])&IF(RC[18]="",,"|n"&R1C25&RC[18])&IF(RC[19]="",,"|n"&R1C26&RC[19])&IF(RC[20]="",,"|n"&R1C27&RC[20])&IF(RC[21]="",,"|n"&R1C28&RC[21])&IF(RC[22]="",,"|n"&R1C29&RC[22])&IF(RC[23]="",,"|n"&R1C30&RC[23])&IF(RC[24]="",,"|n"&R1C31&RC[24])&IF(RC[25]="",,"|n"&R1C32&RC[25])&IF(RC[27]="",,"|n"&R1C34&RC[27])&IF(RC[28]="",,"|n"&R1C35&RC[28])&IF(RC[29]="",,"|n"&R1C36&RC[29])&IF(RC[31]="",,"|n"&RC[31]) -> |n攻击:1146880|n力量:491520|n敏捷:491520|n智力:491520|n血量:3276800|n护甲:10985|n攻速:42 | H9: =VLOOKUP(RC[-6],其他!R1C1:R7C2,2,0)&RC[-4]&RC[-3]&RC[-2]&"|r" -> |cFF33FF00贤者套装|r | I9: WS08 | J9: WB08 | K9: ="blp\suitItem\"&IF(RC[-10]>=10,"","0")&RC[-10]&" (1) .blp" -> blp\suitItem\08 (1) .blp | M9: =INT(R[-2]C*3.2) -> 1146880 | N9: =INT(R[-2]C*3.2) -> 491520 | O9: =INT(R[-2]C*3.2) -> 491520 | P9: =INT(R[-2]C*3.2) -> 491520 | Q9: =INT(R[-2]C*3.2) -> 3276800 | R9: =INT(R[-2]C*1.3) -> 10985 | S9: =INT(R[-2]C*1.5) -> 0 | T9: =INT(R[-2]C*1.3) -> 42
A10: 9 | B10: 5 | E10: 魔龙 | F10: 套装 | G10: =IF(RC[6]="",,"|n"&R1C13&RC[6])&IF(RC[7]="",,"|n"&R1C14&RC[7])&IF(RC[8]="",,"|n"&R1C15&RC[8])&IF(RC[9]="",,"|n"&R1C16&RC[9])&IF(RC[10]="",,"|n"&R1C17&RC[10])&IF(RC[11]="",,"|n"&R1C18&RC[11])&IF(RC[13]="",,"|n"&R1C20&RC[13])&IF(RC[14]="",,"|n"&R1C21&RC[14])&IF(RC[15]="",,"|n"&R1C22&RC[15])&IF(RC[16]="",,"|n"&R1C23&RC[16])&IF(RC[17]="",,"|n"&R1C24&RC[17])&IF(RC[18]="",,"|n"&R1C25&RC[18])&IF(RC[19]="",,"|n"&R1C26&RC[19])&IF(RC[20]="",,"|n"&R1C27&RC[20])&IF(RC[21]="",,"|n"&R1C28&RC[21])&IF(RC[22]="",,"|n"&R1C29&RC[22])&IF(RC[23]="",,"|n"&R1C30&RC[23])&IF(RC[24]="",,"|n"&R1C31&RC[24])&IF(RC[25]="",,"|n"&R1C32&RC[25])&IF(RC[27]="",,"|n"&R1C34&RC[27])&IF(RC[28]="",,"|n"&R1C35&RC[28])&IF(RC[29]="",,"|n"&R1C36&RC[29])&IF(RC[31]="",,"|n"&RC[31]) -> |n攻击:3670016|n力量:1572864|n敏捷:1572864|n智力:1572864|n血量:10485760|n护甲:14280|n攻速:54 | H10: =VLOOKUP(RC[-6],其他!R1C1:R7C2,2,0)&RC[-4]&RC[-3]&RC[-2]&"|r" -> |cFFFF9933魔龙套装|r | I10: WS09 | J10: WB09 | K10: ="blp\suitItem\"&IF(RC[-10]>=10,"","0")&RC[-10]&" (1) .blp" -> blp\suitItem\09 (1) .blp | M10: =INT(R[-2]C*3.2) -> 3670016 | N10: =INT(R[-2]C*3.2) -> 1572864 | O10: =INT(R[-2]C*3.2) -> 1572864 | P10: =INT(R[-2]C*3.2) -> 1572864 | Q10: =INT(R[-2]C*3.2) -> 10485760 | R10: =INT(R[-2]C*1.3) -> 14280 | S10: =INT(R[-2]C*1.5) -> 0 | T10: =INT(R[-2]C*1.3) -> 54
A11: 10 | B11: 5 | E11: 修罗 | F11: 套装 | G11: =IF(RC[6]="",,"|n"&R1C13&RC[6])&IF(RC[7]="",,"|n"&R1C14&RC[7])&IF(RC[8]="",,"|n"&R1C15&RC[8])&IF(RC[9]="",,"|n"&R1C16&RC[9])&IF(RC[10]="",,"|n"&R1C17&RC[10])&IF(RC[11]="",,"|n"&R1C18&RC[11])&IF(RC[13]="",,"|n"&R1C20&RC[13])&IF(RC[14]="",,"|n"&R1C21&RC[14])&IF(RC[15]="",,"|n"&R1C22&RC[15])&IF(RC[16]="",,"|n"&R1C23&RC[16])&IF(RC[17]="",,"|n"&R1C24&RC[17])&IF(RC[18]="",,"|n"&R1C25&RC[18])&IF(RC[19]="",,"|n"&R1C26&RC[19])&IF(RC[20]="",,"|n"&R1C27&RC[20])&IF(RC[21]="",,"|n"&R1C28&RC[21])&IF(RC[22]="",,"|n"&R1C29&RC[22])&IF(RC[23]="",,"|n"&R1C30&RC[23])&IF(RC[24]="",,"|n"&R1C31&RC[24])&IF(RC[25]="",,"|n"&R1C32&RC[25])&IF(RC[27]="",,"|n"&R1C34&RC[27])&IF(RC[28]="",,"|n"&R1C35&RC[28])&IF(RC[29]="",,"|n"&R1C36&RC[29])&IF(RC[31]="",,"|n"&RC[31]) -> |n攻击:3670016|n力量:1572864|n敏捷:1572864|n智力:1572864|n血量:10485760|n护甲:14280|n攻速:54 | H11: =VLOOKUP(RC[-6],其他!R1C1:R7C2,2,0)&RC[-4]&RC[-3]&RC[-2]&"|r" -> |cFFFF9933修罗套装|r | I11: WS10 | J11: WB10 | K11: ="blp\suitItem\"&IF(RC[-10]>=10,"","0")&RC[-10]&" (1) .blp" -> blp\suitItem\10 (1) .blp | M11: =INT(R[-2]C*3.2) -> 3670016 | N11: =INT(R[-2]C*3.2) -> 1572864 | O11: =INT(R[-2]C*3.2) -> 1572864 | P11: =INT(R[-2]C*3.2) -> 1572864 | Q11: =INT(R[-2]C*3.2) -> 10485760 | R11: =INT(R[-2]C*1.3) -> 14280 | S11: =INT(R[-2]C*1.5) -> 0 | T11: =INT(R[-2]C*1.3) -> 54

Sheet: 图标表
A1: 序号 | B1: 等级 | C1: 品级 | D1: 部件 | E1: 名字 | F1: 图标
A2: 1 | B2: 1 | C2: 1 | D2: 8 | E2: 战士长刃 | F2: ="blp\suitItem\"&IF(RC[-3]>=10,"","0")&RC[-3]&" ("&RC[-2]&") .blp" -> blp\suitItem\01 (8) .blp
A3: 2 | B3: 1 | C3: 1 | D3: 1 | E3: 战士胸甲 | F3: ="blp\suitItem\"&IF(RC[-3]>=10,"","0")&RC[-3]&" ("&RC[-2]&") .blp" -> blp\suitItem\01 (1) .blp
A4: 3 | B4: 1 | C4: 1 | D4: 2 | E4: 战士护手 | F4: ="blp\suitItem\"&IF(RC[-3]>=10,"","0")&RC[-3]&" ("&RC[-2]&") .blp" -> blp\suitItem\01 (2) .blp
A5: 4 | B5: 1 | C5: 1 | D5: 3 | E5: 战士护肩 | F5: ="blp\suitItem\"&IF(RC[-3]>=10,"","0")&RC[-3]&" ("&RC[-2]&") .blp" -> blp\suitItem\01 (3) .blp
A6: 5 | B6: 1 | C6: 1 | D6: 4 | E6: 战士腿甲 | F6: ="blp\suitItem\"&IF(RC[-3]>=10,"","0")&RC[-3]&" ("&RC[-2]&") .blp" -> blp\suitItem\01 (4) .blp
A7: 6 | B7: 1 | C7: 1 | D7: 5 | E7: 战士头饰 | F7: ="blp\suitItem\"&IF(RC[-3]>=10,"","0")&RC[-3]&" ("&RC[-2]&") .blp" -> blp\suitItem\01 (5) .blp
A8: 7 | B8: 1 | C8: 1 | D8: 6 | E8: 战士战靴 | F8: ="blp\suitItem\"&IF(RC[-3]>=10,"","0")&RC[-3]&" ("&RC[-2]&") .blp" -> blp\suitItem\01 (6) .blp
A9: 8 | B9: 1 | C9: 1 | D9: 7 | E9: 战士腰带 | F9: ="blp\suitItem\"&IF(RC[-3]>=10,"","0")&RC[-3]&" ("&RC[-2]&") .blp" -> blp\suitItem\01 (7) .blp
A10: 9 | B10: 1 | C10: 2 | D10: 8 | E10: 卫士长刃 | F10: ="blp\suitItem\"&IF(RC[-3]>=10,"","0")&RC[-3]&" ("&RC[-2]&") .blp" -> blp\suitItem\02 (8) .blp
A11: 10 | B11: 1 | C11: 2 | D11: 1 | E11: 卫士胸甲 | F11: ="blp\suitItem\"&IF(RC[-3]>=10,"","0")&RC[-3]&" ("&RC[-2]&") .blp" -> blp\suitItem\02 (1) .blp
A12: 11 | B12: 1 | C12: 2 | D12: 2 | E12: 卫士护手 | F12: ="blp\suitItem\"&IF(RC[-3]>=10,"","0")&RC[-3]&" ("&RC[-2]&") .blp" -> blp\suitItem\02 (2) .blp
A13: 12 | B13: 1 | C13: 2 | D13: 3 | E13: 卫士护肩 | F13: ="blp\suitItem\"&IF(RC[-3]>=10,"","0")&RC[-3]&" ("&RC[-2]&") .blp" -> blp\suitItem\02 (3) .blp
A14: 13 | B14: 1 | C14: 2 | D14: 4 | E14: 卫士腿甲 | F14: ="blp\suitItem\"&IF(RC[-3]>=10,"","0")&RC[-3]&" ("&RC[-2]&") .blp" -> blp\suitItem\02 (4) .blp
A15: 14 | B15: 1 | C15: 2 | D15: 5 | E15: 卫士头饰 | F15: ="blp\suitItem\"&IF(RC[-3]>=10,"","0")&RC[-3]&" ("&RC[-2]&") .blp" -> blp\suitItem\02 (5) .blp
A16: 14 | B16: 1 | C16: 2 | D16: 6 | E16: 卫士战靴 | F16: ="blp\suitItem\"&IF(RC[-3]>=10,"","0")&RC[-3]&" ("&RC[-2]&") .blp" -> blp\suitItem\02 (6) .blp
A17: 14 | B17: 1 | C17: 2 | D17: 7 | E17: 卫士腰带 | F17: ="blp\suitItem\"&IF(RC[-3]>=10,"","0")&RC[-3]&" ("&RC[-2]&") .blp" -> blp\suitItem\02 (7) .blp
A18: 15 | B18: 2 | C18: 3 | D18: 8 | E18: 狩猎长刃 | F18: ="blp\suitItem\"&IF(RC[-3]>=10,"","0")&RC[-3]&" ("&RC[-2]&") .blp" -> blp\suitItem\03 (8) .blp
A19: 16 | B19: 2 | C19: 3 | D19: 1 | E19: 狩猎胸甲 | F19: ="blp\suitItem\"&IF(RC[-3]>=10,"","0")&RC[-3]&" ("&RC[-2]&") .blp" -> blp\suitItem\03 (1) .blp
A20: 17 | B20: 2 | C20: 3 | D20: 2 | E20: 狩猎护手 | F20: ="blp\suitItem\"&IF(RC[-3]>=10,"","0")&RC[-3]&" ("&RC[-2]&") .blp" -> blp\suitItem\03 (2) .blp
A21: 18 | B21: 2 | C21: 3 | D21: 3 | E21: 狩猎护肩 | F21: ="blp\suitItem\"&IF(RC[-3]>=10,"","0")&RC[-3]&" ("&RC[-2]&") .blp" -> blp\suitItem\03 (3) .blp
A22: 19 | B22: 2 | C22: 3 | D22: 4 | E22: 狩猎腿甲 | F22: ="blp\suitItem\"&IF(RC[-3]>=10,"","0")&RC[-3]&" ("&RC[-2]&") .blp" -> blp\suitItem\03 (4) .blp
A23: 20 | B23: 2 | C23: 3 | D23: 5 | E23: 狩猎头饰 | F23: ="blp\suitItem\"&IF(RC[-3]>=10,"","0")&RC[-3]&" ("&RC[-2]&") .blp" -> blp\suitItem\03 (5) .blp
A24: 21 | B24: 2 | C24: 3 | D24: 6 | E24: 狩猎战靴 | F24: ="blp\suitItem\"&IF(RC[-3]>=10,"","0")&RC[-3]&" ("&RC[-2]&") .blp" -> blp\suitItem\03 (6) .blp
A25: 22 | B25: 2 | C25: 3 | D25: 7 | E25: 狩猎腰带 | F25: ="blp\suitItem\"&IF(RC[-3]>=10,"","0")&RC[-3]&" ("&RC[-2]&") .blp" -> blp\suitItem\03 (7) .blp
A26: 23 | B26: 2 | C26: 4 | D26: 8 | E26: 赤血长刃 | F26: ="blp\suitItem\"&IF(RC[-3]>=10,"","0")&RC[-3]&" ("&RC[-2]&") .blp" -> blp\suitItem\04 (8) .blp
A27: 24 | B27: 2 | C27: 4 | D27: 1 | E27: 赤血胸甲 | F27: ="blp\suitItem\"&IF(RC[-3]>=10,"","0")&RC[-3]&" ("&RC[-2]&") .blp" -> blp\suitItem\04 (1) .blp
A28: 25 | B28: 2 | C28: 4 | D28: 2 | E28: 赤血护手 | F28: ="blp\suitItem\"&IF(RC[-3]>=10,"","0")&RC[-3]&" ("&RC[-2]&") .blp" -> blp\suitItem\04 (2) .blp
A29: 26 | B29: 2 | C29: 4 | D29: 3 | E29: 赤血护肩 | F29: ="blp\suitItem\"&IF(RC[-3]>=10,"","0")&RC[-3]&" ("&RC[-2]&") .blp" -> blp\suitItem\04 (3) .blp
A30: 27 | B30: 2 | C30: 4 | D30: 4 | E30: 赤血腿甲 | F30: ="blp\suitItem\"&IF(RC[-3]>=10,"","0")&RC[-3]&" ("&RC[-2]&") .blp" -> blp\suitItem\04 (4) .blp
A31: 28 | B31: 2 | C31: 4 | D31: 5 | E31: 赤血头饰 | F31: ="blp\suitItem\"&IF(RC[-3]>=10,"","0")&RC[-3]&" ("&RC[-2]&") .blp" -> blp\suitItem\04 (5) .blp
A32: 27 | B32: 2 | C32: 4 | D32: 6 | E32: 赤血战靴 | F32: ="blp\suitItem\"&IF(RC[-3]>=10,"","0")&RC[-3]&" ("&RC[-2]&") .blp" -> blp\suitItem\04 (6) .blp
A33: 28 | B33: 2 | C33: 4 | D33: 7 | E33: 赤血腰带 | F33: ="blp\suitItem\"&IF(RC[-3]>=10,"","0")&RC[-3]&" ("&RC[-2]&") .blp" -> blp\suitItem\04 (7) .blp
A34: 29 | B34: 3 | C34: 5 | D34: 8 | E34: 骑士长刃 | F34: ="blp\suitItem\"&IF(RC[-3]>=10,"","0")&RC[-3]&" ("&RC[-2]&") .blp" -> blp\suitItem\05 (8) .blp
A35: 30 | B35: 3 | C35: 5 | D35: 1 | E35: 骑士胸甲 | F35: ="blp\suitItem\"&IF(RC[-3]>=10,"","0")&RC[-3]&" ("&RC[-2]&") .blp" -> blp\suitItem\05 (1) .blp
A36: 31 | B36: 3 | C36: 5 | D36: 2 | E36: 骑士护手 | F36: ="blp\suitItem\"&IF(RC[-3]>=10,"","0")&RC[-3]&" ("&RC[-2]&") .blp" -> blp\suitItem\05 (2) .blp
A37: 32 | B37: 3 | C37: 5 | D37: 3 | E37: 骑士护肩 | F37: ="blp\suitItem\"&IF(RC[-3]>=10,"","0")&RC[-3]&" ("&RC[-2]&") .blp" -> blp\suitItem\05 (3) .blp
A38: 33 | B38: 3 | C38: 5 | D38: 4 | E38: 骑士腿甲 | F38: ="blp\suitItem\"&IF(RC[-3]>=10,"","0")&RC[-3]&" ("&RC[-2]&") .blp" -> blp\suitItem\05 (4) .blp
A39: 34 | B39: 3 | C39: 5 | D39: 5 | E39: 骑士头饰 | F39: ="blp\suitItem\"&IF(RC[-3]>=10,"","0")&RC[-3]&" ("&RC[-2]&") .blp" -> blp\suitItem\05 (5) .blp
A40: 35 | B40: 3 | C40: 5 | D40: 6 | E40: 骑士战靴 | F40: ="blp\suitItem\"&IF(RC[-3]>=10,"","0")&RC[-3]&" ("&RC[-2]&") .blp" -> blp\suitItem\05 (6) .blp
A41: 36 | B41: 3 | C41: 5 | D41: 7 | E41: 骑士腰带 | F41: ="blp\suitItem\"&IF(RC[-3]>=10,"","0")&RC[-3]&" ("&RC[-2]&") .blp" -> blp\suitItem\05 (7) .blp
A42: 37 | B42: 3 | C42: 6 | D42: 8 | E42: 领主长刃 | F42: ="blp\suitItem\"&IF(RC[-3]>=10,"","0")&RC[-3]&" ("&RC[-2]&") .blp" -> blp\suitItem\06 (8) .blp
A43: 38 | B43: 3 | C43: 6 | D43: 1 | E43: 领主胸甲 | F43: ="blp\suitItem\"&IF(RC[-3]>=10,"","0")&RC[-3]&" ("&RC[-2]&") .blp" -> blp\suitItem\06 (1) .blp
A44: 39 | B44: 3 | C44: 6 | D44: 2 | E44: 领主护手 | F44: ="blp\suitItem\"&IF(RC[-3]>=10,"","0")&RC[-3]&" ("&RC[-2]&") .blp" -> blp\suitItem\06 (2) .blp
A45: 40 | B45: 3 | C45: 6 | D45: 3 | E45: 领主护肩 | F45: ="blp\suitItem\"&IF(RC[-3]>=10,"","0")&RC[-3]&" ("&RC[-2]&") .blp" -> blp\suitItem\06 (3) .blp
A46: 41 | B46: 3 | C46: 6 | D46: 4 | E46: 领主腿甲 | F46: ="blp\suitItem\"&IF(RC[-3]>=10,"","0")&RC[-3]&" ("&RC[-2]&") .blp" -> blp\suitItem\06 (4) .blp
A47: 42 | B47: 3 | C47: 6 | D47: 5 | E47: 领主头饰 | F47: ="blp\suitItem\"&IF(RC[-3]>=10,"","0")&RC[-3]&" ("&RC[-2]&") .blp" -> blp\suitItem\06 (5) .blp
A48: 41 | B48: 3 | C48: 6 | D48: 6 | E48: 领主战靴 | F48: ="blp\suitItem\"&IF(RC[-3]>=10,"","0")&RC[-3]&" ("&RC[-2]&") .blp" -> blp\suitItem\06 (6) .blp
A49: 42 | B49: 3 | C49: 6 | D49: 7 | E49: 领主腰带 | F49: ="blp\suitItem\"&IF(RC[-3]>=10,"","0")&RC[-3]&" ("&RC[-2]&") .blp" -> blp\suitItem\06 (7) .blp
A50: 43 | B50: 4 | C50: 7 | D50: 8 | E50: 战神长刃 | F50: ="blp\suitItem\"&IF(RC[-3]>=10,"","0")&RC[-3]&" ("&RC[-2]&") .blp" -> blp\suitItem\07 (8) .blp
A51: 44 | B51: 4 | C51: 7 | D51: 1 | E51: 战神胸甲 | F51: ="blp\suitItem\"&IF(RC[-3]>=10,"","0")&RC[-3]&" ("&RC[-2]&") .blp" -> blp\suitItem\07 (1) .blp
A52: 45 | B52: 4 | C52: 7 | D52: 2 | E52: 战神护手 | F52: ="blp\suitItem\"&IF(RC[-3]>=10,"","0")&RC[-3]&" ("&RC[-2]&") .blp" -> blp\suitItem\07 (2) .blp
A53: 46 | B53: 4 | C53: 7 | D53: 3 | E53: 战神护肩 | F53: ="blp\suitItem\"&IF(RC[-3]>=10,"","0")&RC[-3]&" ("&RC[-2]&") .blp" -> blp\suitItem\07 (3) .blp
A54: 47 | B54: 4 | C54: 7 | D54: 4 | E54: 战神腿甲 | F54: ="blp\suitItem\"&IF(RC[-3]>=10,"","0")&RC[-3]&" ("&RC[-2]&") .blp" -> blp\suitItem\07 (4) .blp
A55: 48 | B55: 4 | C55: 7 | D55: 5 | E55: 战神头饰 | F55: ="blp\suitItem\"&IF(RC[-3]>=10,"","0")&RC[-3]&" ("&RC[-2]&") .blp" -> blp\suitItem\07 (5) .blp
A56: 49 | B56: 4 | C56: 7 | D56: 6 | E56: 战神战靴 | F56: ="blp\suitItem\"&IF(RC[-3]>=10,"","0")&RC[-3]&" ("&RC[-2]&") .blp" -> blp\suitItem\07 (6) .blp
A57: 50 | B57: 4 | C57: 7 | D57: 7 | E57: 战神腰带 | F57: ="blp\suitItem\"&IF(RC[-3]>=10,"","0")&RC[-3]&" ("&RC[-2]&") .blp" -> blp\suitItem\07 (7) .blp
A58: 51 | B58: 4 | C58: 8 | D58: 8 | E58: 贤者长刃 | F58: ="blp\suitItem\"&IF(RC[-3]>=10,"","0")&RC[-3]&" ("&RC[-2]&") .blp" -> blp\suitItem\08 (8) .blp
A59: 52 | B59: 4 | C59: 8 | D59: 1 | E59: 贤者胸甲 | F59: ="blp\suitItem\"&IF(RC[-3]>=10,"","0")&RC[-3]&" ("&RC[-2]&") .blp" -> blp\suitItem\08 (1) .blp
A60: 53 | B60: 4 | C60: 8 | D60: 2 | E60: 贤者护手 | F60: ="blp\suitItem\"&IF(RC[-3]>=10,"","0")&RC[-3]&" ("&RC[-2]&") .blp" -> blp\suitItem\08 (2) .blp
A61: 54 | B61: 4 | C61: 8 | D61: 3 | E61: 贤者护肩 | F61: ="blp\suitItem\"&IF(RC[-3]>=10,"","0")&RC[-3]&" ("&RC[-2]&") .blp" -> blp\suitItem\08 (3) .blp
A62: 55 | B62: 4 | C62: 8 | D62: 4 | E62: 贤者腿甲 | F62: ="blp\suitItem\"&IF(RC[-3]>=10,"","0")&RC[-3]&" ("&RC[-2]&") .blp" -> blp\suitItem\08 (4) .blp
A63: 56 | B63: 4 | C63: 8 | D63: 5 | E63: 贤者头饰 | F63: ="blp\suitItem\"&IF(RC[-3]>=10,"","0")&RC[-3]&" ("&RC[-2]&") .blp" -> blp\suitItem\08 (5) .blp
A64: 55 | B64: 4 | C64: 8 | D64: 6 | E64: 贤者战靴 | F64: ="blp\suitItem\"&IF(RC[-3]>=10,"","0")&RC[-3]&" ("&RC[-2]&") .blp" -> blp\suitItem\08 (6) .blp
A65: 56 | B65: 4 | C65: 8 | D65: 7 | E65: 贤者腰带 | F65: ="blp\suitItem\"&IF(RC[-3]>=10,"","0")&RC[-3]&" ("&RC[-2]&") .blp" -> blp\suitItem\08 (7) .blp
A66: 57 | B66: 5 | C66: 9 | D66: 8 | E66: 魔龙长刃 | F66: ="blp\suitItem\"&IF(RC[-3]>=10,"","0")&RC[-3]&" ("&RC[-2]&") .blp" -> blp\suitItem\09 (8) .blp
A67: 58 | B67: 5 | C67: 9 | D67: 1 | E67: 魔龙胸甲 | F67: ="blp\suitItem\"&IF(RC[-3]>=10,"","0")&RC[-3]&" ("&RC[-2]&") .blp" -> blp\suitItem\09 (1) .blp
A68: 59 | B68: 5 | C68: 9 | D68: 2 | E68: 魔龙护手 | F68: ="blp\suitItem\"&IF(RC[-3]>=10,"","0")&RC[-3]&" ("&RC[-2]&") .blp" -> blp\suitItem\09 (2) .blp
A69: 60 | B69: 5 | C69: 9 | D69: 3 | E69: 魔龙护肩 | F69: ="blp\suitItem\"&IF(RC[-3]>=10,"","0")&RC[-3]&" ("&RC[-2]&") .blp" -> blp\suitItem\09 (3) .blp
A70: 61 | B70: 5 | C70: 9 | D70: 4 | E70: 魔龙腿甲 | F70: ="blp\suitItem\"&IF(RC[-3]>=10,"","0")&RC[-3]&" ("&RC[-2]&") .blp" -> blp\suitItem\09 (4) .blp
A71: 62 | B71: 5 | C71: 9 | D71: 5 | E71: 魔龙头饰 | F71: ="blp\suitItem\"&IF(RC[-3]>=10,"","0")&RC[-3]&" ("&RC[-2]&") .blp" -> blp\suitItem\09 (5) .blp
A72: 63 | B72: 5 | C72: 9 | D72: 6 | E72: 魔龙战靴 | F72: ="blp\suitItem\"&IF(RC[-3]>=10,"","0")&RC[-3]&" ("&RC[-2]&") .blp" -> blp\suitItem\09 (6) .blp
A73: 64 | B73: 5 | C73: 9 | D73: 7 | E73: 魔龙腰带 | F73: ="blp\suitItem\"&IF(RC[-3]>=10,"","0")&RC[-3]&" ("&RC[-2]&") .blp" -> blp\suitItem\09 (7) .blp
A74: 65 | B74: 5 | C74: 10 | D74: 8 | E74: 修罗长刃 | F74: ="blp\suitItem\"&IF(RC[-3]>=10,"","0")&RC[-3]&" ("&RC[-2]&") .blp" -> blp\suitItem\10 (8) .blp
A75: 66 | B75: 5 | C75: 10 | D75: 1 | E75: 修罗胸甲 | F75: ="blp\suitItem\"&IF(RC[-3]>=10,"","0")&RC[-3]&" ("&RC[-2]&") .blp" -> blp\suitItem\10 (1) .blp
A76: 67 | B76: 5 | C76: 10 | D76: 2 | E76: 修罗护手 | F76: ="blp\suitItem\"&IF(RC[-3]>=10,"","0")&RC[-3]&" ("&RC[-2]&") .blp" -> blp\suitItem\10 (2) .blp
A77: 68 | B77: 5 | C77: 10 | D77: 3 | E77: 修罗护肩 | F77: ="blp\suitItem\"&IF(RC[-3]>=10,"","0")&RC[-3]&" ("&RC[-2]&") .blp" -> blp\suitItem\10 (3) .blp
A78: 69 | B78: 5 | C78: 10 | D78: 4 | E78: 修罗腿甲 | F78: ="blp\suitItem\"&IF(RC[-3]>=10,"","0")&RC[-3]&" ("&RC[-2]&") .blp" -> blp\suitItem\10 (4) .blp
A79: 70 | B79: 5 | C79: 10 | D79: 5 | E79: 修罗头饰 | F79: ="blp\suitItem\"&IF(RC[-3]>=10,"","0")&RC[-3]&" ("&RC[-2]&") .blp" -> blp\suitItem\10 (5) .blp
A80: 69 | B80: 5 | C80: 10 | D80: 6 | E80: 修罗战靴 | F80: ="blp\suitItem\"&IF(RC[-3]>=10,"","0")&RC[-3]&" ("&RC[-2]&") .blp" -> blp\suitItem\10 (6) .blp
A81: 70 | B81: 5 | C81: 10 | D81: 7 | E81: 修罗腰带 | F81: ="blp\suitItem\"&IF(RC[-3]>=10,"","0")&RC[-3]&" ("&RC[-2]&") .blp" -> blp\suitItem\10 (7) .blp

Sheet: 连锁表
A1: index | B1: suitname | C1: _su_lv | D1: lv | E1: id1 | F1: name1 | G1: id2 | H1: name2 | I1: id3 | J1: name3 | K1: _name | L1: ex_info | M1: tid | N1: bid | O1: art | P1: _code | Q1: info | R1: name | S1: |cFFFFFF99基础属性|r | T1: 攻击: | U1: 力量: | V1: 敏捷: | W1: 智力: | X1: 血量: | Y1: 护甲: | Z1: |cFFFFFF55附加属性|r(%) | AA1: 攻速: | AB1: 攻击吸血: | AC1: 暴击概率: | AD1: 暴击伤害: | AE1: 伤害增幅: | AF1: 附加伤害: | AG1: 最终伤害: | AH1: 伤害抵抗: | AI1: 伤害减免: | AJ1: 伤害反弹: | AK1: 力量增幅 | AL1: 敏捷增幅 | AM1: 智力增幅 | AN1: |cFFFFFF11核心属性|r | AO1: 升级属性成长: | AP1: 杀敌属性成长: | AQ1: 每秒属性成长: | AR1: = | AS1: 描述
A2: 1 | B2: =VLOOKUP(RC[4],ITEM!R3C2:R82C6,5,0) -> 战士 | C2: 1 | D2: =VLOOKUP(RC[2],ITEM!R3C2:R82C4,3,0) -> 1 | E2: =VLOOKUP(RC[1],ITEM!R3C2:R82C3,2,0) -> SY01 | F2: 战士长刃 | G2: =VLOOKUP(RC[1],ITEM!R3C2:R82C3,2,0) -> SY02 | H2: 战士胸甲 | I2: =VLOOKUP(RC[1],ITEM!R3C2:R82C3,2,0) -> SY03 | J2: 战士护手 | K2: 战士套装-狂战 | L2: 普攻造成1.3倍伤害 | M2: ST01 | N2: SB01 | O2: ="blp\suitItem\"&IF(RC[-12]>=10,"","0")&RC[-12]&" (1) .blp" -> blp\suitItem\01 (1) .blp | P2: ="new AffixItemLinkEntity("&RC[-12]&",'"&RC[-11]&"',"""&RC[-10]&""",'"&RC[-9]&"',"""&RC[-8]&""&""",'"&RC[-7]&"',"""&RC[-6]&""","""&RC[-14]&""","""&RC[-5]&""",'"&RC[-2]&"'"&")" -> new AffixItemLinkEntity(1,'SY01',"战士长刃",'SY02',"战士胸甲",'SY03',"战士护手","战士","战士套装-狂战",'SB01') | Q2: =IF(RC[-5]<>"","|n"&RC[-5],"")&IF(RC[3]="",,"|n"&R1C[3]&RC[3])&IF(RC[4]="",,"|n"&R1C[4]&RC[4])&IF(RC[5]="",,"|n"&R1C[5]&RC[5])&IF(RC[6]="",,"|n"&R1C[6]&RC[6])&IF(RC[7]="",,"|n"&R1C[7]&RC[7])&IF(RC[8]="",,"|n"&R1C[8]&RC[8])&IF(RC[10]="",,"|n"&R1C[10]&RC[10])&IF(RC[11]="",,"|n"&R1C[11]&RC[11])&IF(RC[12]="",,"|n"&R1C[12]&RC[12])&IF(RC[13]="",,"|n"&R1C[13]&RC[13])&IF(RC[14]="",,"|n"&R1C[14]&RC[14])&IF(RC[15]="",,"|n"&R1C[15]&RC[15])&IF(RC[16]="",,"|n"&R1C[16]&RC[16])&IF(RC[17]="",,"|n"&R1C[17]&RC[17])&IF(RC[18]="",,"|n"&R1C[18]&RC[18])&IF(RC[19]="",,"|n"&R1C[19]&RC[19])&IF(RC[20]="",,"|n"&R1C[20]&RC[20])&IF(RC[21]="",,"|n"&R1C29&RC[21])&IF(RC[22]="",,"|n"&R1C[22]&RC[22])&IF(RC[24]="",,"|n"&R1C[24]&RC[24])&IF(RC[25]="",,"|n"&R1C[25]&RC[25])&IF(RC[26]="",,"|n"&R1C[26]&RC[26])&IF(RC[28]="",,"|n"&RC[28]) -> |n普攻造成1.3倍伤害 | R2: =VLOOKUP(RC[-14],其他!R1C1:R7C2,2,0)&RC[-7]&"|r" -> |cFF999999战士套装-狂战|r
A3: 2 | B3: =VLOOKUP(RC[4],ITEM!R3C2:R82C6,5,0) -> 战士 | C3: 1 | D3: =VLOOKUP(RC[2],ITEM!R3C2:R82C4,3,0) -> 1 | E3: =VLOOKUP(RC[1],ITEM!R3C2:R82C3,2,0) -> SY02 | F3: 战士胸甲 | G3: =VLOOKUP(RC[1],ITEM!R3C2:R82C3,2,0) -> SY03 | H3: 战士护手 | I3: =VLOOKUP(RC[1],ITEM!R3C2:R82C3,2,0) -> SY04 | J3: 战士护肩 | K3: 战士套装-怒战 | L3: 独立暴击20%3倍 | M3: ST02 | N3: SB02 | O3: ="blp\suitItem\"&IF(RC[-12]>=10,"","0")&RC[-12]&" (1) .blp" -> blp\suitItem\01 (1) .blp | P3: ="new AffixItemLinkEntity("&RC[-12]&",'"&RC[-11]&"',"""&RC[-10]&""",'"&RC[-9]&"',"""&RC[-8]&""&""",'"&RC[-7]&"',"""&RC[-6]&""","""&RC[-14]&""","""&RC[-5]&""",'"&RC[-2]&"'"&")" -> new AffixItemLinkEntity(1,'SY02',"战士胸甲",'SY03',"战士护手",'SY04',"战士护肩","战士","战士套装-怒战",'SB02') | Q3: =IF(RC[-5]<>"","|n"&RC[-5],"")&IF(RC[3]="",,"|n"&R1C[3]&RC[3])&IF(RC[4]="",,"|n"&R1C[4]&RC[4])&IF(RC[5]="",,"|n"&R1C[5]&RC[5])&IF(RC[6]="",,"|n"&R1C[6]&RC[6])&IF(RC[7]="",,"|n"&R1C[7]&RC[7])&IF(RC[8]="",,"|n"&R1C[8]&RC[8])&IF(RC[10]="",,"|n"&R1C[10]&RC[10])&IF(RC[11]="",,"|n"&R1C[11]&RC[11])&IF(RC[12]="",,"|n"&R1C[12]&RC[12])&IF(RC[13]="",,"|n"&R1C[13]&RC[13])&IF(RC[14]="",,"|n"&R1C[14]&RC[14])&IF(RC[15]="",,"|n"&R1C[15]&RC[15])&IF(RC[16]="",,"|n"&R1C[16]&RC[16])&IF(RC[17]="",,"|n"&R1C[17]&RC[17])&IF(RC[18]="",,"|n"&R1C[18]&RC[18])&IF(RC[19]="",,"|n"&R1C[19]&RC[19])&IF(RC[20]="",,"|n"&R1C[20]&RC[20])&IF(RC[21]="",,"|n"&R1C29&RC[21])&IF(RC[22]="",,"|n"&R1C[22]&RC[22])&IF(RC[24]="",,"|n"&R1C[24]&RC[24])&IF(RC[25]="",,"|n"&R1C[25]&RC[25])&IF(RC[26]="",,"|n"&R1C[26]&RC[26])&IF(RC[28]="",,"|n"&RC[28]) -> |n独立暴击20%3倍 | R3: =VLOOKUP(RC[-14],其他!R1C1:R7C2,2,0)&RC[-7]&"|r" -> |cFF999999战士套装-怒战|r
A4: 3 | B4: =VLOOKUP(RC[4],ITEM!R3C2:R82C6,5,0) -> 战士 | C4: 1 | D4: =VLOOKUP(RC[2],ITEM!R3C2:R82C4,3,0) -> 1 | E4: =VLOOKUP(RC[1],ITEM!R3C2:R82C3,2,0) -> SY03 | F4: 战士护手 | G4: =VLOOKUP(RC[1],ITEM!R3C2:R82C3,2,0) -> SY04 | H4: 战士护肩 | I4: =VLOOKUP(RC[1],ITEM!R3C2:R82C3,2,0) -> SY05 | J4: 战士腿甲 | K4: 战士套装-血战 | M4: ST03 | N4: SB03 | O4: ="blp\suitItem\"&IF(RC[-12]>=10,"","0")&RC[-12]&" (1) .blp" -> blp\suitItem\01 (1) .blp | P4: ="new AffixItemLinkEntity("&RC[-12]&",'"&RC[-11]&"',"""&RC[-10]&""",'"&RC[-9]&"',"""&RC[-8]&""&""",'"&RC[-7]&"',"""&RC[-6]&""","""&RC[-14]&""","""&RC[-5]&""",'"&RC[-2]&"'"&")" -> new AffixItemLinkEntity(1,'SY03',"战士护手",'SY04',"战士护肩",'SY05',"战士腿甲","战士","战士套装-血战",'SB03') | Q4: =IF(RC[-5]<>"","|n"&RC[-5],"")&IF(RC[3]="",,"|n"&R1C[3]&RC[3])&IF(RC[4]="",,"|n"&R1C[4]&RC[4])&IF(RC[5]="",,"|n"&R1C[5]&RC[5])&IF(RC[6]="",,"|n"&R1C[6]&RC[6])&IF(RC[7]="",,"|n"&R1C[7]&RC[7])&IF(RC[8]="",,"|n"&R1C[8]&RC[8])&IF(RC[10]="",,"|n"&R1C[10]&RC[10])&IF(RC[11]="",,"|n"&R1C[11]&RC[11])&IF(RC[12]="",,"|n"&R1C[12]&RC[12])&IF(RC[13]="",,"|n"&R1C[13]&RC[13])&IF(RC[14]="",,"|n"&R1C[14]&RC[14])&IF(RC[15]="",,"|n"&R1C[15]&RC[15])&IF(RC[16]="",,"|n"&R1C[16]&RC[16])&IF(RC[17]="",,"|n"&R1C[17]&RC[17])&IF(RC[18]="",,"|n"&R1C[18]&RC[18])&IF(RC[19]="",,"|n"&R1C[19]&RC[19])&IF(RC[20]="",,"|n"&R1C[20]&RC[20])&IF(RC[21]="",,"|n"&R1C29&RC[21])&IF(RC[22]="",,"|n"&R1C[22]&RC[22])&IF(RC[24]="",,"|n"&R1C[24]&RC[24])&IF(RC[25]="",,"|n"&R1C[25]&RC[25])&IF(RC[26]="",,"|n"&R1C[26]&RC[26])&IF(RC[28]="",,"|n"&RC[28]) -> |n攻击吸血:5 | R4: =VLOOKUP(RC[-14],其他!R1C1:R7C2,2,0)&RC[-7]&"|r" -> |cFF999999战士套装-血战|r | AB4: 5
A5: 4 | B5: =VLOOKUP(RC[4],ITEM!R3C2:R82C6,5,0) -> 战士 | C5: 1 | D5: =VLOOKUP(RC[2],ITEM!R3C2:R82C4,3,0) -> 1 | E5: =VLOOKUP(RC[1],ITEM!R3C2:R82C3,2,0) -> SY04 | F5: 战士护肩 | G5: =VLOOKUP(RC[1],ITEM!R3C2:R82C3,2,0) -> SY05 | H5: 战士腿甲 | I5: =VLOOKUP(RC[1],ITEM!R3C2:R82C3,2,0) -> SY06 | J5: 战士头饰 | K5: 战士套装-战火 | L5: 分裂20% | M5: ST04 | N5: SB04 | O5: ="blp\suitItem\"&IF(RC[-12]>=10,"","0")&RC[-12]&" (1) .blp" -> blp\suitItem\01 (1) .blp | P5: ="new AffixItemLinkEntity("&RC[-12]&",'"&RC[-11]&"',"""&RC[-10]&""",'"&RC[-9]&"',"""&RC[-8]&""&""",'"&RC[-7]&"',"""&RC[-6]&""","""&RC[-14]&""","""&RC[-5]&""",'"&RC[-2]&"'"&")" -> new AffixItemLinkEntity(1,'SY04',"战士护肩",'SY05',"战士腿甲",'SY06',"战士头饰","战士","战士套装-战火",'SB04') | Q5: =IF(RC[-5]<>"","|n"&RC[-5],"")&IF(RC[3]="",,"|n"&R1C[3]&RC[3])&IF(RC[4]="",,"|n"&R1C[4]&RC[4])&IF(RC[5]="",,"|n"&R1C[5]&RC[5])&IF(RC[6]="",,"|n"&R1C[6]&RC[6])&IF(RC[7]="",,"|n"&R1C[7]&RC[7])&IF(RC[8]="",,"|n"&R1C[8]&RC[8])&IF(RC[10]="",,"|n"&R1C[10]&RC[10])&IF(RC[11]="",,"|n"&R1C[11]&RC[11])&IF(RC[12]="",,"|n"&R1C[12]&RC[12])&IF(RC[13]="",,"|n"&R1C[13]&RC[13])&IF(RC[14]="",,"|n"&R1C[14]&RC[14])&IF(RC[15]="",,"|n"&R1C[15]&RC[15])&IF(RC[16]="",,"|n"&R1C[16]&RC[16])&IF(RC[17]="",,"|n"&R1C[17]&RC[17])&IF(RC[18]="",,"|n"&R1C[18]&RC[18])&IF(RC[19]="",,"|n"&R1C[19]&RC[19])&IF(RC[20]="",,"|n"&R1C[20]&RC[20])&IF(RC[21]="",,"|n"&R1C29&RC[21])&IF(RC[22]="",,"|n"&R1C[22]&RC[22])&IF(RC[24]="",,"|n"&R1C[24]&RC[24])&IF(RC[25]="",,"|n"&R1C[25]&RC[25])&IF(RC[26]="",,"|n"&R1C[26]&RC[26])&IF(RC[28]="",,"|n"&RC[28]) -> |n分裂20% | R5: =VLOOKUP(RC[-14],其他!R1C1:R7C2,2,0)&RC[-7]&"|r" -> |cFF999999战士套装-战火|r
A6: 5 | B6: =VLOOKUP(RC[4],ITEM!R3C2:R82C6,5,0) -> 战士 | C6: 1 | D6: =VLOOKUP(RC[2],ITEM!R3C2:R82C4,3,0) -> 1 | E6: =VLOOKUP(RC[1],ITEM!R3C2:R82C3,2,0) -> SY05 | F6: 战士腿甲 | G6: =VLOOKUP(RC[1],ITEM!R3C2:R82C3,2,0) -> SY06 | H6: 战士头饰 | I6: =VLOOKUP(RC[1],ITEM!R3C2:R82C3,2,0) -> SY07 | J6: 战士战靴 | K6: 战士套装-暴战 | L6: 独立暴击10%5倍 | M6: ST05 | N6: SB05 | O6: ="blp\suitItem\"&IF(RC[-12]>=10,"","0")&RC[-12]&" (1) .blp" -> blp\suitItem\01 (1) .blp | P6: ="new AffixItemLinkEntity("&RC[-12]&",'"&RC[-11]&"',"""&RC[-10]&""",'"&RC[-9]&"',"""&RC[-8]&""&""",'"&RC[-7]&"',"""&RC[-6]&""","""&RC[-14]&""","""&RC[-5]&""",'"&RC[-2]&"'"&")" -> new AffixItemLinkEntity(1,'SY05',"战士腿甲",'SY06',"战士头饰",'SY07',"战士战靴","战士","战士套装-暴战",'SB05') | Q6: =IF(RC[-5]<>"","|n"&RC[-5],"")&IF(RC[3]="",,"|n"&R1C[3]&RC[3])&IF(RC[4]="",,"|n"&R1C[4]&RC[4])&IF(RC[5]="",,"|n"&R1C[5]&RC[5])&IF(RC[6]="",,"|n"&R1C[6]&RC[6])&IF(RC[7]="",,"|n"&R1C[7]&RC[7])&IF(RC[8]="",,"|n"&R1C[8]&RC[8])&IF(RC[10]="",,"|n"&R1C[10]&RC[10])&IF(RC[11]="",,"|n"&R1C[11]&RC[11])&IF(RC[12]="",,"|n"&R1C[12]&RC[12])&IF(RC[13]="",,"|n"&R1C[13]&RC[13])&IF(RC[14]="",,"|n"&R1C[14]&RC[14])&IF(RC[15]="",,"|n"&R1C[15]&RC[15])&IF(RC[16]="",,"|n"&R1C[16]&RC[16])&IF(RC[17]="",,"|n"&R1C[17]&RC[17])&IF(RC[18]="",,"|n"&R1C[18]&RC[18])&IF(RC[19]="",,"|n"&R1C[19]&RC[19])&IF(RC[20]="",,"|n"&R1C[20]&RC[20])&IF(RC[21]="",,"|n"&R1C29&RC[21])&IF(RC[22]="",,"|n"&R1C[22]&RC[22])&IF(RC[24]="",,"|n"&R1C[24]&RC[24])&IF(RC[25]="",,"|n"&R1C[25]&RC[25])&IF(RC[26]="",,"|n"&R1C[26]&RC[26])&IF(RC[28]="",,"|n"&RC[28]) -> |n独立暴击10%5倍 | R6: =VLOOKUP(RC[-14],其他!R1C1:R7C2,2,0)&RC[-7]&"|r" -> |cFF999999战士套装-暴战|r
A7: 6 | B7: =VLOOKUP(RC[4],ITEM!R3C2:R82C6,5,0) -> 战士 | C7: 1 | D7: =VLOOKUP(RC[2],ITEM!R3C2:R82C4,3,0) -> 1 | E7: =VLOOKUP(RC[1],ITEM!R3C2:R82C3,2,0) -> SY06 | F7: 战士头饰 | G7: =VLOOKUP(RC[1],ITEM!R3C2:R82C3,2,0) -> SY07 | H7: 战士战靴 | I7: =VLOOKUP(RC[1],ITEM!R3C2:R82C3,2,0) -> SY08 | J7: 战士腰带 | K7: 战士套装-决战 | L7: 加攻击光环10%(队友) | M7: ST06 | N7: SB06 | O7: ="blp\suitItem\"&IF(RC[-12]>=10,"","0")&RC[-12]&" (1) .blp" -> blp\suitItem\01 (1) .blp | P7: ="new AffixItemLinkEntity("&RC[-12]&",'"&RC[-11]&"',"""&RC[-10]&""",'"&RC[-9]&"',"""&RC[-8]&""&""",'"&RC[-7]&"',"""&RC[-6]&""","""&RC[-14]&""","""&RC[-5]&""",'"&RC[-2]&"'"&")" -> new AffixItemLinkEntity(1,'SY06',"战士头饰",'SY07',"战士战靴",'SY08',"战士腰带","战士","战士套装-决战",'SB06') | Q7: =IF(RC[-5]<>"","|n"&RC[-5],"")&IF(RC[3]="",,"|n"&R1C[3]&RC[3])&IF(RC[4]="",,"|n"&R1C[4]&RC[4])&IF(RC[5]="",,"|n"&R1C[5]&RC[5])&IF(RC[6]="",,"|n"&R1C[6]&RC[6])&IF(RC[7]="",,"|n"&R1C[7]&RC[7])&IF(RC[8]="",,"|n"&R1C[8]&RC[8])&IF(RC[10]="",,"|n"&R1C[10]&RC[10])&IF(RC[11]="",,"|n"&R1C[11]&RC[11])&IF(RC[12]="",,"|n"&R1C[12]&RC[12])&IF(RC[13]="",,"|n"&R1C[13]&RC[13])&IF(RC[14]="",,"|n"&R1C[14]&RC[14])&IF(RC[15]="",,"|n"&R1C[15]&RC[15])&IF(RC[16]="",,"|n"&R1C[16]&RC[16])&IF(RC[17]="",,"|n"&R1C[17]&RC[17])&IF(RC[18]="",,"|n"&R1C[18]&RC[18])&IF(RC[19]="",,"|n"&R1C[19]&RC[19])&IF(RC[20]="",,"|n"&R1C[20]&RC[20])&IF(RC[21]="",,"|n"&R1C29&RC[21])&IF(RC[22]="",,"|n"&R1C[22]&RC[22])&IF(RC[24]="",,"|n"&R1C[24]&RC[24])&IF(RC[25]="",,"|n"&R1C[25]&RC[25])&IF(RC[26]="",,"|n"&R1C[26]&RC[26])&IF(RC[28]="",,"|n"&RC[28]) -> |n加攻击光环10%(队友) | R7: =VLOOKUP(RC[-14],其他!R1C1:R7C2,2,0)&RC[-7]&"|r" -> |cFF999999战士套装-决战|r
A8: 7 | B8: =VLOOKUP(RC[4],ITEM!R3C2:R82C6,5,0) -> 战士 | C8: 1 | D8: =VLOOKUP(RC[2],ITEM!R3C2:R82C4,3,0) -> 1 | E8: =VLOOKUP(RC[1],ITEM!R3C2:R82C3,2,0) -> SY07 | F8: 战士战靴 | G8: =VLOOKUP(RC[1],ITEM!R3C2:R82C3,2,0) -> SY08 | H8: 战士腰带 | I8: =VLOOKUP(RC[1],ITEM!R3C2:R82C3,2,0) -> SY01 | J8: 战士长刃 | K8: 战士套装-寒战 | L8: 减攻速光环10%(敌人) | M8: ST07 | N8: SB07 | O8: ="blp\suitItem\"&IF(RC[-12]>=10,"","0")&RC[-12]&" (1) .blp" -> blp\suitItem\01 (1) .blp | P8: ="new AffixItemLinkEntity("&RC[-12]&",'"&RC[-11]&"',"""&RC[-10]&""",'"&RC[-9]&"',"""&RC[-8]&""&""",'"&RC[-7]&"',"""&RC[-6]&""","""&RC[-14]&""","""&RC[-5]&""",'"&RC[-2]&"'"&")" -> new AffixItemLinkEntity(1,'SY07',"战士战靴",'SY08',"战士腰带",'SY01',"战士长刃","战士","战士套装-寒战",'SB07') | Q8: =IF(RC[-5]<>"","|n"&RC[-5],"")&IF(RC[3]="",,"|n"&R1C[3]&RC[3])&IF(RC[4]="",,"|n"&R1C[4]&RC[4])&IF(RC[5]="",,"|n"&R1C[5]&RC[5])&IF(RC[6]="",,"|n"&R1C[6]&RC[6])&IF(RC[7]="",,"|n"&R1C[7]&RC[7])&IF(RC[8]="",,"|n"&R1C[8]&RC[8])&IF(RC[10]="",,"|n"&R1C[10]&RC[10])&IF(RC[11]="",,"|n"&R1C[11]&RC[11])&IF(RC[12]="",,"|n"&R1C[12]&RC[12])&IF(RC[13]="",,"|n"&R1C[13]&RC[13])&IF(RC[14]="",,"|n"&R1C[14]&RC[14])&IF(RC[15]="",,"|n"&R1C[15]&RC[15])&IF(RC[16]="",,"|n"&R1C[16]&RC[16])&IF(RC[17]="",,"|n"&R1C[17]&RC[17])&IF(RC[18]="",,"|n"&R1C[18]&RC[18])&IF(RC[19]="",,"|n"&R1C[19]&RC[19])&IF(RC[20]="",,"|n"&R1C[20]&RC[20])&IF(RC[21]="",,"|n"&R1C29&RC[21])&IF(RC[22]="",,"|n"&R1C[22]&RC[22])&IF(RC[24]="",,"|n"&R1C[24]&RC[24])&IF(RC[25]="",,"|n"&R1C[25]&RC[25])&IF(RC[26]="",,"|n"&R1C[26]&RC[26])&IF(RC[28]="",,"|n"&RC[28]) -> |n减攻速光环10%(敌人) | R8: =VLOOKUP(RC[-14],其他!R1C1:R7C2,2,0)&RC[-7]&"|r" -> |cFF999999战士套装-寒战|r
A9: 8 | B9: =VLOOKUP(RC[4],ITEM!R3C2:R82C6,5,0) -> 战士 | C9: 1 | D9: =VLOOKUP(RC[2],ITEM!R3C2:R82C4,3,0) -> 1 | E9: =VLOOKUP(RC[1],ITEM!R3C2:R82C3,2,0) -> SY08 | F9: 战士腰带 | G9: =VLOOKUP(RC[1],ITEM!R3C2:R82C3,2,0) -> SY01 | H9: 战士长刃 | I9: =VLOOKUP(RC[1],ITEM!R3C2:R82C3,2,0) -> SY02 | J9: 战士胸甲 | K9: 战士套装-毒战 | L9: 攻击时,有概率对500内单位造成基于三维的范围伤害 | M9: ST08 | N9: SB08 | O9: ="blp\suitItem\"&IF(RC[-12]>=10,"","0")&RC[-12]&" (1) .blp" -> blp\suitItem\01 (1) .blp | P9: ="new AffixItemLinkEntity("&RC[-12]&",'"&RC[-11]&"',"""&RC[-10]&""",'"&RC[-9]&"',"""&RC[-8]&""&""",'"&RC[-7]&"',"""&RC[-6]&""","""&RC[-14]&""","""&RC[-5]&""",'"&RC[-2]&"'"&")" -> new AffixItemLinkEntity(1,'SY08',"战士腰带",'SY01',"战士长刃",'SY02',"战士胸甲","战士","战士套装-毒战",'SB08') | Q9: =IF(RC[-5]<>"","|n"&RC[-5],"")&IF(RC[3]="",,"|n"&R1C[3]&RC[3])&IF(RC[4]="",,"|n"&R1C[4]&RC[4])&IF(RC[5]="",,"|n"&R1C[5]&RC[5])&IF(RC[6]="",,"|n"&R1C[6]&RC[6])&IF(RC[7]="",,"|n"&R1C[7]&RC[7])&IF(RC[8]="",,"|n"&R1C[8]&RC[8])&IF(RC[10]="",,"|n"&R1C[10]&RC[10])&IF(RC[11]="",,"|n"&R1C[11]&RC[11])&IF(RC[12]="",,"|n"&R1C[12]&RC[12])&IF(RC[13]="",,"|n"&R1C[13]&RC[13])&IF(RC[14]="",,"|n"&R1C[14]&RC[14])&IF(RC[15]="",,"|n"&R1C[15]&RC[15])&IF(RC[16]="",,"|n"&R1C[16]&RC[16])&IF(RC[17]="",,"|n"&R1C[17]&RC[17])&IF(RC[18]="",,"|n"&R1C[18]&RC[18])&IF(RC[19]="",,"|n"&R1C[19]&RC[19])&IF(RC[20]="",,"|n"&R1C[20]&RC[20])&IF(RC[21]="",,"|n"&R1C29&RC[21])&IF(RC[22]="",,"|n"&R1C[22]&RC[22])&IF(RC[24]="",,"|n"&R1C[24]&RC[24])&IF(RC[25]="",,"|n"&R1C[25]&RC[25])&IF(RC[26]="",,"|n"&R1C[26]&RC[26])&IF(RC[28]="",,"|n"&RC[28]) -> |n攻击时,有概率对500内单位造成基于三维的范围伤害 | R9: =VLOOKUP(RC[-14],其他!R1C1:R7C2,2,0)&RC[-7]&"|r" -> |cFF999999战士套装-毒战|r
A10: 9 | B10: =VLOOKUP(RC[4],ITEM!R3C2:R82C6,5,0) -> 卫士 | C10: 2 | D10: =VLOOKUP(RC[2],ITEM!R3C2:R82C4,3,0) -> 1 | E10: =VLOOKUP(RC[1],ITEM!R3C2:R82C3,2,0) -> SY09 | F10: 卫士长刃 | G10: =VLOOKUP(RC[1],ITEM!R3C2:R82C3,2,0) -> SY0A | H10: 卫士胸甲 | I10: =VLOOKUP(RC[1],ITEM!R3C2:R82C3,2,0) -> SY0B | J10: 卫士护手 | K10: 卫士套装-坚守 | L10: 格挡20% | M10: ST09 | N10: SB09 | O10: ="blp\suitItem\"&IF(RC[-12]>=10,"","0")&RC[-12]&" (1) .blp" -> blp\suitItem\02 (1) .blp | P10: ="new AffixItemLinkEntity("&RC[-12]&",'"&RC[-11]&"',"""&RC[-10]&""",'"&RC[-9]&"',"""&RC[-8]&""&""",'"&RC[-7]&"',"""&RC[-6]&""","""&RC[-14]&""","""&RC[-5]&""",'"&RC[-2]&"'"&")" -> new AffixItemLinkEntity(1,'SY09',"卫士长刃",'SY0A',"卫士胸甲",'SY0B',"卫士护手","卫士","卫士套装-坚守",'SB09') | Q10: =IF(RC[-5]<>"","|n"&RC[-5],"")&IF(RC[3]="",,"|n"&R1C[3]&RC[3])&IF(RC[4]="",,"|n"&R1C[4]&RC[4])&IF(RC[5]="",,"|n"&R1C[5]&RC[5])&IF(RC[6]="",,"|n"&R1C[6]&RC[6])&IF(RC[7]="",,"|n"&R1C[7]&RC[7])&IF(RC[8]="",,"|n"&R1C[8]&RC[8])&IF(RC[10]="",,"|n"&R1C[10]&RC[10])&IF(RC[11]="",,"|n"&R1C[11]&RC[11])&IF(RC[12]="",,"|n"&R1C[12]&RC[12])&IF(RC[13]="",,"|n"&R1C[13]&RC[13])&IF(RC[14]="",,"|n"&R1C[14]&RC[14])&IF(RC[15]="",,"|n"&R1C[15]&RC[15])&IF(RC[16]="",,"|n"&R1C[16]&RC[16])&IF(RC[17]="",,"|n"&R1C[17]&RC[17])&IF(RC[18]="",,"|n"&R1C[18]&RC[18])&IF(RC[19]="",,"|n"&R1C[19]&RC[19])&IF(RC[20]="",,"|n"&R1C[20]&RC[20])&IF(RC[21]="",,"|n"&R1C29&RC[21])&IF(RC[22]="",,"|n"&R1C[22]&RC[22])&IF(RC[24]="",,"|n"&R1C[24]&RC[24])&IF(RC[25]="",,"|n"&R1C[25]&RC[25])&IF(RC[26]="",,"|n"&R1C[26]&RC[26])&IF(RC[28]="",,"|n"&RC[28]) -> |n格挡20% | R10: =VLOOKUP(RC[-14],其他!R1C1:R7C2,2,0)&RC[-7]&"|r" -> |cFF999999卫士套装-坚守|r
A11: 10 | B11: =VLOOKUP(RC[4],ITEM!R3C2:R82C6,5,0) -> 卫士 | C11: 2 | D11: =VLOOKUP(RC[2],ITEM!R3C2:R82C4,3,0) -> 1 | E11: =VLOOKUP(RC[1],ITEM!R3C2:R82C3,2,0) -> SY0A | F11: 卫士胸甲 | G11: =VLOOKUP(RC[1],ITEM!R3C2:R82C3,2,0) -> SY0B | H11: 卫士护手 | I11: =VLOOKUP(RC[1],ITEM!R3C2:R82C3,2,0) -> SY0C | J11: 卫士护肩 | K11: 卫士套装-死守 | L11: 减护甲光环10%(敌人) | M11: ST0A | N11: SB0A | O11: ="blp\suitItem\"&IF(RC[-12]>=10,"","0")&RC[-12]&" (1) .blp" -> blp\suitItem\02 (1) .blp | P11: ="new AffixItemLinkEntity("&RC[-12]&",'"&RC[-11]&"',"""&RC[-10]&""",'"&RC[-9]&"',"""&RC[-8]&""&""",'"&RC[-7]&"',"""&RC[-6]&""","""&RC[-14]&""","""&RC[-5]&""",'"&RC[-2]&"'"&")" -> new AffixItemLinkEntity(1,'SY0A',"卫士胸甲",'SY0B',"卫士护手",'SY0C',"卫士护肩","卫士","卫士套装-死守",'SB0A') | Q11: =IF(RC[-5]<>"","|n"&RC[-5],"")&IF(RC[3]="",,"|n"&R1C[3]&RC[3])&IF(RC[4]="",,"|n"&R1C[4]&RC[4])&IF(RC[5]="",,"|n"&R1C[5]&RC[5])&IF(RC[6]="",,"|n"&R1C[6]&RC[6])&IF(RC[7]="",,"|n"&R1C[7]&RC[7])&IF(RC[8]="",,"|n"&R1C[8]&RC[8])&IF(RC[10]="",,"|n"&R1C[10]&RC[10])&IF(RC[11]="",,"|n"&R1C[11]&RC[11])&IF(RC[12]="",,"|n"&R1C[12]&RC[12])&IF(RC[13]="",,"|n"&R1C[13]&RC[13])&IF(RC[14]="",,"|n"&R1C[14]&RC[14])&IF(RC[15]="",,"|n"&R1C[15]&RC[15])&IF(RC[16]="",,"|n"&R1C[16]&RC[16])&IF(RC[17]="",,"|n"&R1C[17]&RC[17])&IF(RC[18]="",,"|n"&R1C[18]&RC[18])&IF(RC[19]="",,"|n"&R1C[19]&RC[19])&IF(RC[20]="",,"|n"&R1C[20]&RC[20])&IF(RC[21]="",,"|n"&R1C29&RC[21])&IF(RC[22]="",,"|n"&R1C[22]&RC[22])&IF(RC[24]="",,"|n"&R1C[24]&RC[24])&IF(RC[25]="",,"|n"&R1C[25]&RC[25])&IF(RC[26]="",,"|n"&R1C[26]&RC[26])&IF(RC[28]="",,"|n"&RC[28]) -> |n减护甲光环10%(敌人) | R11: =VLOOKUP(RC[-14],其他!R1C1:R7C2,2,0)&RC[-7]&"|r" -> |cFF999999卫士套装-死守|r
A12: 11 | B12: =VLOOKUP(RC[4],ITEM!R3C2:R82C6,5,0) -> 卫士 | C12: 2 | D12: =VLOOKUP(RC[2],ITEM!R3C2:R82C4,3,0) -> 1 | E12: =VLOOKUP(RC[1],ITEM!R3C2:R82C3,2,0) -> SY0B | F12: 卫士护手 | G12: =VLOOKUP(RC[1],ITEM!R3C2:R82C3,2,0) -> SY0C | H12: 卫士护肩 | I12: =VLOOKUP(RC[1],ITEM!R3C2:R82C3,2,0) -> SY0D | J12: 卫士腿甲 | K12: 卫士套装-护卫 | L12: 恢复光环3%(队友) | M12: ST0B | N12: SB0B | O12: ="blp\suitItem\"&IF(RC[-12]>=10,"","0")&RC[-12]&" (1) .blp" -> blp\suitItem\02 (1) .blp | P12: ="new AffixItemLinkEntity("&RC[-12]&",'"&RC[-11]&"',"""&RC[-10]&""",'"&RC[-9]&"',"""&RC[-8]&""&""",'"&RC[-7]&"',"""&RC[-6]&""","""&RC[-14]&""","""&RC[-5]&""",'"&RC[-2]&"'"&")" -> new AffixItemLinkEntity(1,'SY0B',"卫士护手",'SY0C',"卫士护肩",'SY0D',"卫士腿甲","卫士","卫士套装-护卫",'SB0B') | Q12: =IF(RC[-5]<>"","|n"&RC[-5],"")&IF(RC[3]="",,"|n"&R1C[3]&RC[3])&IF(RC[4]="",,"|n"&R1C[4]&RC[4])&IF(RC[5]="",,"|n"&R1C[5]&RC[5])&IF(RC[6]="",,"|n"&R1C[6]&RC[6])&IF(RC[7]="",,"|n"&R1C[7]&RC[7])&IF(RC[8]="",,"|n"&R1C[8]&RC[8])&IF(RC[10]="",,"|n"&R1C[10]&RC[10])&IF(RC[11]="",,"|n"&R1C[11]&RC[11])&IF(RC[12]="",,"|n"&R1C[12]&RC[12])&IF(RC[13]="",,"|n"&R1C[13]&RC[13])&IF(RC[14]="",,"|n"&R1C[14]&RC[14])&IF(RC[15]="",,"|n"&R1C[15]&RC[15])&IF(RC[16]="",,"|n"&R1C[16]&RC[16])&IF(RC[17]="",,"|n"&R1C[17]&RC[17])&IF(RC[18]="",,"|n"&R1C[18]&RC[18])&IF(RC[19]="",,"|n"&R1C[19]&RC[19])&IF(RC[20]="",,"|n"&R1C[20]&RC[20])&IF(RC[21]="",,"|n"&R1C29&RC[21])&IF(RC[22]="",,"|n"&R1C[22]&RC[22])&IF(RC[24]="",,"|n"&R1C[24]&RC[24])&IF(RC[25]="",,"|n"&R1C[25]&RC[25])&IF(RC[26]="",,"|n"&R1C[26]&RC[26])&IF(RC[28]="",,"|n"&RC[28]) -> |n恢复光环3%(队友) | R12: =VLOOKUP(RC[-14],其他!R1C1:R7C2,2,0)&RC[-7]&"|r" -> |cFF999999卫士套装-护卫|r
A13: 12 | B13: =VLOOKUP(RC[4],ITEM!R3C2:R82C6,5,0) -> 卫士 | C13: 2 | D13: =VLOOKUP(RC[2],ITEM!R3C2:R82C4,3,0) -> 1 | E13: =VLOOKUP(RC[1],ITEM!R3C2:R82C3,2,0) -> SY0C | F13: 卫士护肩 | G13: =VLOOKUP(RC[1],ITEM!R3C2:R82C3,2,0) -> SY0D | H13: 卫士腿甲 | I13: =VLOOKUP(RC[1],ITEM!R3C2:R82C3,2,0) -> SY0E | J13: 卫士头饰 | K13: 卫士套装-守护 | L13: 加护甲光环10%(队友) | M13: ST0C | N13: SB0C | O13: ="blp\suitItem\"&IF(RC[-12]>=10,"","0")&RC[-12]&" (1) .blp" -> blp\suitItem\02 (1) .blp | P13: ="new AffixItemLinkEntity("&RC[-12]&",'"&RC[-11]&"',"""&RC[-10]&""",'"&RC[-9]&"',"""&RC[-8]&""&""",'"&RC[-7]&"',"""&RC[-6]&""","""&RC[-14]&""","""&RC[-5]&""",'"&RC[-2]&"'"&")" -> new AffixItemLinkEntity(1,'SY0C',"卫士护肩",'SY0D',"卫士腿甲",'SY0E',"卫士头饰","卫士","卫士套装-守护",'SB0C') | Q13: =IF(RC[-5]<>"","|n"&RC[-5],"")&IF(RC[3]="",,"|n"&R1C[3]&RC[3])&IF(RC[4]="",,"|n"&R1C[4]&RC[4])&IF(RC[5]="",,"|n"&R1C[5]&RC[5])&IF(RC[6]="",,"|n"&R1C[6]&RC[6])&IF(RC[7]="",,"|n"&R1C[7]&RC[7])&IF(RC[8]="",,"|n"&R1C[8]&RC[8])&IF(RC[10]="",,"|n"&R1C[10]&RC[10])&IF(RC[11]="",,"|n"&R1C[11]&RC[11])&IF(RC[12]="",,"|n"&R1C[12]&RC[12])&IF(RC[13]="",,"|n"&R1C[13]&RC[13])&IF(RC[14]="",,"|n"&R1C[14]&RC[14])&IF(RC[15]="",,"|n"&R1C[15]&RC[15])&IF(RC[16]="",,"|n"&R1C[16]&RC[16])&IF(RC[17]="",,"|n"&R1C[17]&RC[17])&IF(RC[18]="",,"|n"&R1C[18]&RC[18])&IF(RC[19]="",,"|n"&R1C[19]&RC[19])&IF(RC[20]="",,"|n"&R1C[20]&RC[20])&IF(RC[21]="",,"|n"&R1C29&RC[21])&IF(RC[22]="",,"|n"&R1C[22]&RC[22])&IF(RC[24]="",,"|n"&R1C[24]&RC[24])&IF(RC[25]="",,"|n"&R1C[25]&RC[25])&IF(RC[26]="",,"|n"&R1C[26]&RC[26])&IF(RC[28]="",,"|n"&RC[28]) -> |n加护甲光环10%(队友) | R13: =VLOOKUP(RC[-14],其他!R1C1:R7C2,2,0)&RC[-7]&"|r" -> |cFF999999卫士套装-守护|r
A14: 13 | B14: =VLOOKUP(RC[4],ITEM!R3C2:R82C6,5,0) -> 卫士 | C14: 2 | D14: =VLOOKUP(RC[2],ITEM!R3C2:R82C4,3,0) -> 1 | E14: =VLOOKUP(RC[1],ITEM!R3C2:R82C3,2,0) -> SY0D | F14: 卫士腿甲 | G14: =VLOOKUP(RC[1],ITEM!R3C2:R82C3,2,0) -> SY0E | H14: 卫士头饰 | I14: =VLOOKUP(RC[1],ITEM!R3C2:R82C3,2,0) -> SY0F | J14: 卫士战靴 | K14: 卫士套装-抵抗 | L14: 恢复光环5%(自己) | M14: ST0D | N14: SB0D | O14: ="blp\suitItem\"&IF(RC[-12]>=10,"","0")&RC[-12]&" (1) .blp" -> blp\suitItem\02 (1) .blp | P14: ="new AffixItemLinkEntity("&RC[-12]&",'"&RC[-11]&"',"""&RC[-10]&""",'"&RC[-9]&"',"""&RC[-8]&""&""",'"&RC[-7]&"',"""&RC[-6]&""","""&RC[-14]&""","""&RC[-5]&""",'"&RC[-2]&"'"&")" -> new AffixItemLinkEntity(1,'SY0D',"卫士腿甲",'SY0E',"卫士头饰",'SY0F',"卫士战靴","卫士","卫士套装-抵抗",'SB0D') | Q14: =IF(RC[-5]<>"","|n"&RC[-5],"")&IF(RC[3]="",,"|n"&R1C[3]&RC[3])&IF(RC[4]="",,"|n"&R1C[4]&RC[4])&IF(RC[5]="",,"|n"&R1C[5]&RC[5])&IF(RC[6]="",,"|n"&R1C[6]&RC[6])&IF(RC[7]="",,"|n"&R1C[7]&RC[7])&IF(RC[8]="",,"|n"&R1C[8]&RC[8])&IF(RC[10]="",,"|n"&R1C[10]&RC[10])&IF(RC[11]="",,"|n"&R1C[11]&RC[11])&IF(RC[12]="",,"|n"&R1C[12]&RC[12])&IF(RC[13]="",,"|n"&R1C[13]&RC[13])&IF(RC[14]="",,"|n"&R1C[14]&RC[14])&IF(RC[15]="",,"|n"&R1C[15]&RC[15])&IF(RC[16]="",,"|n"&R1C[16]&RC[16])&IF(RC[17]="",,"|n"&R1C[17]&RC[17])&IF(RC[18]="",,"|n"&R1C[18]&RC[18])&IF(RC[19]="",,"|n"&R1C[19]&RC[19])&IF(RC[20]="",,"|n"&R1C[20]&RC[20])&IF(RC[21]="",,"|n"&R1C29&RC[21])&IF(RC[22]="",,"|n"&R1C[22]&RC[22])&IF(RC[24]="",,"|n"&R1C[24]&RC[24])&IF(RC[25]="",,"|n"&R1C[25]&RC[25])&IF(RC[26]="",,"|n"&R1C[26]&RC[26])&IF(RC[28]="",,"|n"&RC[28]) -> |n恢复光环5%(自己) | R14: =VLOOKUP(RC[-14],其他!R1C1:R7C2,2,0)&RC[-7]&"|r" -> |cFF999999卫士套装-抵抗|r
A15: 14 | B15: =VLOOKUP(RC[4],ITEM!R3C2:R82C6,5,0) -> 卫士 | C15: 2 | D15: =VLOOKUP(RC[2],ITEM!R3C2:R82C4,3,0) -> 1 | E15: =VLOOKUP(RC[1],ITEM!R3C2:R82C3,2,0) -> SY0E | F15: 卫士头饰 | G15: =VLOOKUP(RC[1],ITEM!R3C2:R82C3,2,0) -> SY0F | H15: 卫士战靴 | I15: =VLOOKUP(RC[1],ITEM!R3C2:R82C3,2,0) -> SY0G | J15: 卫士腰带 | K15: 卫士套装-抵御 | L15: 加护甲光环20%(自己) | M15: ST0E | N15: SB0E | O15: ="blp\suitItem\"&IF(RC[-12]>=10,"","0")&RC[-12]&" (1) .blp" -> blp\suitItem\02 (1) .blp | P15: ="new AffixItemLinkEntity("&RC[-12]&",'"&RC[-11]&"',"""&RC[-10]&""",'"&RC[-9]&"',"""&RC[-8]&""&""",'"&RC[-7]&"',"""&RC[-6]&""","""&RC[-14]&""","""&RC[-5]&""",'"&RC[-2]&"'"&")" -> new AffixItemLinkEntity(1,'SY0E',"卫士头饰",'SY0F',"卫士战靴",'SY0G',"卫士腰带","卫士","卫士套装-抵御",'SB0E') | Q15: =IF(RC[-5]<>"","|n"&RC[-5],"")&IF(RC[3]="",,"|n"&R1C[3]&RC[3])&IF(RC[4]="",,"|n"&R1C[4]&RC[4])&IF(RC[5]="",,"|n"&R1C[5]&RC[5])&IF(RC[6]="",,"|n"&R1C[6]&RC[6])&IF(RC[7]="",,"|n"&R1C[7]&RC[7])&IF(RC[8]="",,"|n"&R1C[8]&RC[8])&IF(RC[10]="",,"|n"&R1C[10]&RC[10])&IF(RC[11]="",,"|n"&R1C[11]&RC[11])&IF(RC[12]="",,"|n"&R1C[12]&RC[12])&IF(RC[13]="",,"|n"&R1C[13]&RC[13])&IF(RC[14]="",,"|n"&R1C[14]&RC[14])&IF(RC[15]="",,"|n"&R1C[15]&RC[15])&IF(RC[16]="",,"|n"&R1C[16]&RC[16])&IF(RC[17]="",,"|n"&R1C[17]&RC[17])&IF(RC[18]="",,"|n"&R1C[18]&RC[18])&IF(RC[19]="",,"|n"&R1C[19]&RC[19])&IF(RC[20]="",,"|n"&R1C[20]&RC[20])&IF(RC[21]="",,"|n"&R1C29&RC[21])&IF(RC[22]="",,"|n"&R1C[22]&RC[22])&IF(RC[24]="",,"|n"&R1C[24]&RC[24])&IF(RC[25]="",,"|n"&R1C[25]&RC[25])&IF(RC[26]="",,"|n"&R1C[26]&RC[26])&IF(RC[28]="",,"|n"&RC[28]) -> |n加护甲光环20%(自己) | R15: =VLOOKUP(RC[-14],其他!R1C1:R7C2,2,0)&RC[-7]&"|r" -> |cFF999999卫士套装-抵御|r
A16: 15 | B16: =VLOOKUP(RC[4],ITEM!R3C2:R82C6,5,0) -> 卫士 | C16: 2 | D16: =VLOOKUP(RC[2],ITEM!R3C2:R82C4,3,0) -> 1 | E16: =VLOOKUP(RC[1],ITEM!R3C2:R82C3,2,0) -> SY0F | F16: 卫士战靴 | G16: =VLOOKUP(RC[1],ITEM!R3C2:R82C3,2,0) -> SY0G | H16: 卫士腰带 | I16: =VLOOKUP(RC[1],ITEM!R3C2:R82C3,2,0) -> SY09 | J16: 卫士长刃 | K16: 卫士套装-防备 | L16: 30%抵抗20000点伤害 | M16: ST0F | N16: SB0F | O16: ="blp\suitItem\"&IF(RC[-12]>=10,"","0")&RC[-12]&" (1) .blp" -> blp\suitItem\02 (1) .blp | P16: ="new AffixItemLinkEntity("&RC[-12]&",'"&RC[-11]&"',"""&RC[-10]&""",'"&RC[-9]&"',"""&RC[-8]&""&""",'"&RC[-7]&"',"""&RC[-6]&""","""&RC[-14]&""","""&RC[-5]&""",'"&RC[-2]&"'"&")" -> new AffixItemLinkEntity(1,'SY0F',"卫士战靴",'SY0G',"卫士腰带",'SY09',"卫士长刃","卫士","卫士套装-防备",'SB0F') | Q16: =IF(RC[-5]<>"","|n"&RC[-5],"")&IF(RC[3]="",,"|n"&R1C[3]&RC[3])&IF(RC[4]="",,"|n"&R1C[4]&RC[4])&IF(RC[5]="",,"|n"&R1C[5]&RC[5])&IF(RC[6]="",,"|n"&R1C[6]&RC[6])&IF(RC[7]="",,"|n"&R1C[7]&RC[7])&IF(RC[8]="",,"|n"&R1C[8]&RC[8])&IF(RC[10]="",,"|n"&R1C[10]&RC[10])&IF(RC[11]="",,"|n"&R1C[11]&RC[11])&IF(RC[12]="",,"|n"&R1C[12]&RC[12])&IF(RC[13]="",,"|n"&R1C[13]&RC[13])&IF(RC[14]="",,"|n"&R1C[14]&RC[14])&IF(RC[15]="",,"|n"&R1C[15]&RC[15])&IF(RC[16]="",,"|n"&R1C[16]&RC[16])&IF(RC[17]="",,"|n"&R1C[17]&RC[17])&IF(RC[18]="",,"|n"&R1C[18]&RC[18])&IF(RC[19]="",,"|n"&R1C[19]&RC[19])&IF(RC[20]="",,"|n"&R1C[20]&RC[20])&IF(RC[21]="",,"|n"&R1C29&RC[21])&IF(RC[22]="",,"|n"&R1C[22]&RC[22])&IF(RC[24]="",,"|n"&R1C[24]&RC[24])&IF(RC[25]="",,"|n"&R1C[25]&RC[25])&IF(RC[26]="",,"|n"&R1C[26]&RC[26])&IF(RC[28]="",,"|n"&RC[28]) -> |n30%抵抗20000点伤害 | R16: =VLOOKUP(RC[-14],其他!R1C1:R7C2,2,0)&RC[-7]&"|r" -> |cFF999999卫士套装-防备|r
A17: 16 | B17: =VLOOKUP(RC[4],ITEM!R3C2:R82C6,5,0) -> 卫士 | C17: 2 | D17: =VLOOKUP(RC[2],ITEM!R3C2:R82C4,3,0) -> 1 | E17: =VLOOKUP(RC[1],ITEM!R3C2:R82C3,2,0) -> SY0G | F17: 卫士腰带 | G17: =VLOOKUP(RC[1],ITEM!R3C2:R82C3,2,0) -> SY09 | H17: 卫士长刃 | I17: =VLOOKUP(RC[1],ITEM!R3C2:R82C3,2,0) -> SY0A | J17: 卫士胸甲 | K17: 卫士套装-防范 | L17: 15%闪避 | M17: ST0G | N17: SB0G | O17: ="blp\suitItem\"&IF(RC[-12]>=10,"","0")&RC[-12]&" (1) .blp" -> blp\suitItem\02 (1) .blp | P17: ="new AffixItemLinkEntity("&RC[-12]&",'"&RC[-11]&"',"""&RC[-10]&""",'"&RC[-9]&"',"""&RC[-8]&""&""",'"&RC[-7]&"',"""&RC[-6]&""","""&RC[-14]&""","""&RC[-5]&""",'"&RC[-2]&"'"&")" -> new AffixItemLinkEntity(1,'SY0G',"卫士腰带",'SY09',"卫士长刃",'SY0A',"卫士胸甲","卫士","卫士套装-防范",'SB0G') | Q17: =IF(RC[-5]<>"","|n"&RC[-5],"")&IF(RC[3]="",,"|n"&R1C[3]&RC[3])&IF(RC[4]="",,"|n"&R1C[4]&RC[4])&IF(RC[5]="",,"|n"&R1C[5]&RC[5])&IF(RC[6]="",,"|n"&R1C[6]&RC[6])&IF(RC[7]="",,"|n"&R1C[7]&RC[7])&IF(RC[8]="",,"|n"&R1C[8]&RC[8])&IF(RC[10]="",,"|n"&R1C[10]&RC[10])&IF(RC[11]="",,"|n"&R1C[11]&RC[11])&IF(RC[12]="",,"|n"&R1C[12]&RC[12])&IF(RC[13]="",,"|n"&R1C[13]&RC[13])&IF(RC[14]="",,"|n"&R1C[14]&RC[14])&IF(RC[15]="",,"|n"&R1C[15]&RC[15])&IF(RC[16]="",,"|n"&R1C[16]&RC[16])&IF(RC[17]="",,"|n"&R1C[17]&RC[17])&IF(RC[18]="",,"|n"&R1C[18]&RC[18])&IF(RC[19]="",,"|n"&R1C[19]&RC[19])&IF(RC[20]="",,"|n"&R1C[20]&RC[20])&IF(RC[21]="",,"|n"&R1C29&RC[21])&IF(RC[22]="",,"|n"&R1C[22]&RC[22])&IF(RC[24]="",,"|n"&R1C[24]&RC[24])&IF(RC[25]="",,"|n"&R1C[25]&RC[25])&IF(RC[26]="",,"|n"&R1C[26]&RC[26])&IF(RC[28]="",,"|n"&RC[28]) -> |n15%闪避 | R17: =VLOOKUP(RC[-14],其他!R1C1:R7C2,2,0)&RC[-7]&"|r" -> |cFF999999卫士套装-防范|r
A18: 17 | B18: =VLOOKUP(RC[4],ITEM!R3C2:R82C6,5,0) -> 狩猎 | C18: 3 | D18: =VLOOKUP(RC[2],ITEM!R3C2:R82C4,3,0) -> 2 | E18: =VLOOKUP(RC[1],ITEM!R3C2:R82C3,2,0) -> SY0H | F18: 狩猎长刃 | G18: =VLOOKUP(RC[1],ITEM!R3C2:R82C3,2,0) -> SY0I | H18: 狩猎胸甲 | I18: =VLOOKUP(RC[1],ITEM!R3C2:R82C3,2,0) -> SY0J | J18: 狩猎护手 | K18: 狩猎套装-黎明 | L18: 攻击时2%施加 眩晕 1秒 | M18: ST0H | N18: SB0H | O18: ="blp\suitItem\"&IF(RC[-12]>=10,"","0")&RC[-12]&" (1) .blp" -> blp\suitItem\03 (1) .blp | P18: ="new AffixItemLinkEntity("&RC[-12]&",'"&RC[-11]&"',"""&RC[-10]&""",'"&RC[-9]&"',"""&RC[-8]&""&""",'"&RC[-7]&"',"""&RC[-6]&""","""&RC[-14]&""","""&RC[-5]&""",'"&RC[-2]&"'"&")" -> new AffixItemLinkEntity(2,'SY0H',"狩猎长刃",'SY0I',"狩猎胸甲",'SY0J',"狩猎护手","狩猎","狩猎套装-黎明",'SB0H') | Q18: =IF(RC[-5]<>"","|n"&RC[-5],"")&IF(RC[3]="",,"|n"&R1C[3]&RC[3])&IF(RC[4]="",,"|n"&R1C[4]&RC[4])&IF(RC[5]="",,"|n"&R1C[5]&RC[5])&IF(RC[6]="",,"|n"&R1C[6]&RC[6])&IF(RC[7]="",,"|n"&R1C[7]&RC[7])&IF(RC[8]="",,"|n"&R1C[8]&RC[8])&IF(RC[10]="",,"|n"&R1C[10]&RC[10])&IF(RC[11]="",,"|n"&R1C[11]&RC[11])&IF(RC[12]="",,"|n"&R1C[12]&RC[12])&IF(RC[13]="",,"|n"&R1C[13]&RC[13])&IF(RC[14]="",,"|n"&R1C[14]&RC[14])&IF(RC[15]="",,"|n"&R1C[15]&RC[15])&IF(RC[16]="",,"|n"&R1C[16]&RC[16])&IF(RC[17]="",,"|n"&R1C[17]&RC[17])&IF(RC[18]="",,"|n"&R1C[18]&RC[18])&IF(RC[19]="",,"|n"&R1C[19]&RC[19])&IF(RC[20]="",,"|n"&R1C[20]&RC[20])&IF(RC[21]="",,"|n"&R1C29&RC[21])&IF(RC[22]="",,"|n"&R1C[22]&RC[22])&IF(RC[24]="",,"|n"&R1C[24]&RC[24])&IF(RC[25]="",,"|n"&R1C[25]&RC[25])&IF(RC[26]="",,"|n"&R1C[26]&RC[26])&IF(RC[28]="",,"|n"&RC[28]) -> |n攻击时2%施加 眩晕 1秒 | R18: =VLOOKUP(RC[-14],其他!R1C1:R7C2,2,0)&RC[-7]&"|r" -> |cFF99FF66狩猎套装-黎明|r
A19: 18 | B19: =VLOOKUP(RC[4],ITEM!R3C2:R82C6,5,0) -> 狩猎 | C19: 3 | D19: =VLOOKUP(RC[2],ITEM!R3C2:R82C4,3,0) -> 2 | E19: =VLOOKUP(RC[1],ITEM!R3C2:R82C3,2,0) -> SY0I | F19: 狩猎胸甲 | G19: =VLOOKUP(RC[1],ITEM!R3C2:R82C3,2,0) -> SY0J | H19: 狩猎护手 | I19: =VLOOKUP(RC[1],ITEM!R3C2:R82C3,2,0) -> SY0K | J19: 狩猎护肩 | K19: 狩猎套装-曙光 | L19: 攻击时2%施加 缴械 1秒 | M19: ST0I | N19: SB0I | O19: ="blp\suitItem\"&IF(RC[-12]>=10,"","0")&RC[-12]&" (1) .blp" -> blp\suitItem\03 (1) .blp | P19: ="new AffixItemLinkEntity("&RC[-12]&",'"&RC[-11]&"',"""&RC[-10]&""",'"&RC[-9]&"',"""&RC[-8]&""&""",'"&RC[-7]&"',"""&RC[-6]&""","""&RC[-14]&""","""&RC[-5]&""",'"&RC[-2]&"'"&")" -> new AffixItemLinkEntity(2,'SY0I',"狩猎胸甲",'SY0J',"狩猎护手",'SY0K',"狩猎护肩","狩猎","狩猎套装-曙光",'SB0I') | Q19: =IF(RC[-5]<>"","|n"&RC[-5],"")&IF(RC[3]="",,"|n"&R1C[3]&RC[3])&IF(RC[4]="",,"|n"&R1C[4]&RC[4])&IF(RC[5]="",,"|n"&R1C[5]&RC[5])&IF(RC[6]="",,"|n"&R1C[6]&RC[6])&IF(RC[7]="",,"|n"&R1C[7]&RC[7])&IF(RC[8]="",,"|n"&R1C[8]&RC[8])&IF(RC[10]="",,"|n"&R1C[10]&RC[10])&IF(RC[11]="",,"|n"&R1C[11]&RC[11])&IF(RC[12]="",,"|n"&R1C[12]&RC[12])&IF(RC[13]="",,"|n"&R1C[13]&RC[13])&IF(RC[14]="",,"|n"&R1C[14]&RC[14])&IF(RC[15]="",,"|n"&R1C[15]&RC[15])&IF(RC[16]="",,"|n"&R1C[16]&RC[16])&IF(RC[17]="",,"|n"&R1C[17]&RC[17])&IF(RC[18]="",,"|n"&R1C[18]&RC[18])&IF(RC[19]="",,"|n"&R1C[19]&RC[19])&IF(RC[20]="",,"|n"&R1C[20]&RC[20])&IF(RC[21]="",,"|n"&R1C29&RC[21])&IF(RC[22]="",,"|n"&R1C[22]&RC[22])&IF(RC[24]="",,"|n"&R1C[24]&RC[24])&IF(RC[25]="",,"|n"&R1C[25]&RC[25])&IF(RC[26]="",,"|n"&R1C[26]&RC[26])&IF(RC[28]="",,"|n"&RC[28]) -> |n攻击时2%施加 缴械 1秒 | R19: =VLOOKUP(RC[-14],其他!R1C1:R7C2,2,0)&RC[-7]&"|r" -> |cFF99FF66狩猎套装-曙光|r
A20: 19 | B20: =VLOOKUP(RC[4],ITEM!R3C2:R82C6,5,0) -> 狩猎 | C20: 3 | D20: =VLOOKUP(RC[2],ITEM!R3C2:R82C4,3,0) -> 2 | E20: =VLOOKUP(RC[1],ITEM!R3C2:R82C3,2,0) -> SY0J | F20: 狩猎护手 | G20: =VLOOKUP(RC[1],ITEM!R3C2:R82C3,2,0) -> SY0K | H20: 狩猎护肩 | I20: =VLOOKUP(RC[1],ITEM!R3C2:R82C3,2,0) -> SY0L | J20: 狩猎腿甲 | K20: 狩猎套装-破晓 | L20: 攻击时2%施加 1级致盲 3秒 | M20: ST0J | N20: SB0J | O20: ="blp\suitItem\"&IF(RC[-12]>=10,"","0")&RC[-12]&" (1) .blp" -> blp\suitItem\03 (1) .blp | P20: ="new AffixItemLinkEntity("&RC[-12]&",'"&RC[-11]&"',"""&RC[-10]&""",'"&RC[-9]&"',"""&RC[-8]&""&""",'"&RC[-7]&"',"""&RC[-6]&""","""&RC[-14]&""","""&RC[-5]&""",'"&RC[-2]&"'"&")" -> new AffixItemLinkEntity(2,'SY0J',"狩猎护手",'SY0K',"狩猎护肩",'SY0L',"狩猎腿甲","狩猎","狩猎套装-破晓",'SB0J') | Q20: =IF(RC[-5]<>"","|n"&RC[-5],"")&IF(RC[3]="",,"|n"&R1C[3]&RC[3])&IF(RC[4]="",,"|n"&R1C[4]&RC[4])&IF(RC[5]="",,"|n"&R1C[5]&RC[5])&IF(RC[6]="",,"|n"&R1C[6]&RC[6])&IF(RC[7]="",,"|n"&R1C[7]&RC[7])&IF(RC[8]="",,"|n"&R1C[8]&RC[8])&IF(RC[10]="",,"|n"&R1C[10]&RC[10])&IF(RC[11]="",,"|n"&R1C[11]&RC[11])&IF(RC[12]="",,"|n"&R1C[12]&RC[12])&IF(RC[13]="",,"|n"&R1C[13]&RC[13])&IF(RC[14]="",,"|n"&R1C[14]&RC[14])&IF(RC[15]="",,"|n"&R1C[15]&RC[15])&IF(RC[16]="",,"|n"&R1C[16]&RC[16])&IF(RC[17]="",,"|n"&R1C[17]&RC[17])&IF(RC[18]="",,"|n"&R1C[18]&RC[18])&IF(RC[19]="",,"|n"&R1C[19]&RC[19])&IF(RC[20]="",,"|n"&R1C[20]&RC[20])&IF(RC[21]="",,"|n"&R1C29&RC[21])&IF(RC[22]="",,"|n"&R1C[22]&RC[22])&IF(RC[24]="",,"|n"&R1C[24]&RC[24])&IF(RC[25]="",,"|n"&R1C[25]&RC[25])&IF(RC[26]="",,"|n"&R1C[26]&RC[26])&IF(RC[28]="",,"|n"&RC[28]) -> |n攻击时2%施加 1级致盲 3秒 | R20: =VLOOKUP(RC[-14],其他!R1C1:R7C2,2,0)&RC[-7]&"|r" -> |cFF99FF66狩猎套装-破晓|r
A21: 20 | B21: =VLOOKUP(RC[4],ITEM!R3C2:R82C6,5,0) -> 狩猎 | C21: 3 | D21: =VLOOKUP(RC[2],ITEM!R3C2:R82C4,3,0) -> 2 | E21: =VLOOKUP(RC[1],ITEM!R3C2:R82C3,2,0) -> SY0K | F21: 狩猎护肩 | G21: =VLOOKUP(RC[1],ITEM!R3C2:R82C3,2,0) -> SY0L | H21: 狩猎腿甲 | I21: =VLOOKUP(RC[1],ITEM!R3C2:R82C3,2,0) -> SY0M | J21: 狩猎头饰 | K21: 狩猎套装-希望 | L21: 攻击时2%施加 1级虚弱 3秒 | M21: ST0K | N21: SB0K | O21: ="blp\suitItem\"&IF(RC[-12]>=10,"","0")&RC[-12]&" (1) .blp" -> blp\suitItem\03 (1) .blp | P21: ="new AffixItemLinkEntity("&RC[-12]&",'"&RC[-11]&"',"""&RC[-10]&""",'"&RC[-9]&"',"""&RC[-8]&""&""",'"&RC[-7]&"',"""&RC[-6]&""","""&RC[-14]&""","""&RC[-5]&""",'"&RC[-2]&"'"&")" -> new AffixItemLinkEntity(2,'SY0K',"狩猎护肩",'SY0L',"狩猎腿甲",'SY0M',"狩猎头饰","狩猎","狩猎套装-希望",'SB0K') | Q21: =IF(RC[-5]<>"","|n"&RC[-5],"")&IF(RC[3]="",,"|n"&R1C[3]&RC[3])&IF(RC[4]="",,"|n"&R1C[4]&RC[4])&IF(RC[5]="",,"|n"&R1C[5]&RC[5])&IF(RC[6]="",,"|n"&R1C[6]&RC[6])&IF(RC[7]="",,"|n"&R1C[7]&RC[7])&IF(RC[8]="",,"|n"&R1C[8]&RC[8])&IF(RC[10]="",,"|n"&R1C[10]&RC[10])&IF(RC[11]="",,"|n"&R1C[11]&RC[11])&IF(RC[12]="",,"|n"&R1C[12]&RC[12])&IF(RC[13]="",,"|n"&R1C[13]&RC[13])&IF(RC[14]="",,"|n"&R1C[14]&RC[14])&IF(RC[15]="",,"|n"&R1C[15]&RC[15])&IF(RC[16]="",,"|n"&R1C[16]&RC[16])&IF(RC[17]="",,"|n"&R1C[17]&RC[17])&IF(RC[18]="",,"|n"&R1C[18]&RC[18])&IF(RC[19]="",,"|n"&R1C[19]&RC[19])&IF(RC[20]="",,"|n"&R1C[20]&RC[20])&IF(RC[21]="",,"|n"&R1C29&RC[21])&IF(RC[22]="",,"|n"&R1C[22]&RC[22])&IF(RC[24]="",,"|n"&R1C[24]&RC[24])&IF(RC[25]="",,"|n"&R1C[25]&RC[25])&IF(RC[26]="",,"|n"&R1C[26]&RC[26])&IF(RC[28]="",,"|n"&RC[28]) -> |n攻击时2%施加 1级虚弱 3秒 | R21: =VLOOKUP(RC[-14],其他!R1C1:R7C2,2,0)&RC[-7]&"|r" -> |cFF99FF66狩猎套装-希望|r
A22: 21 | B22: =VLOOKUP(RC[4],ITEM!R3C2:R82C6,5,0) -> 狩猎 | C22: 3 | D22: =VLOOKUP(RC[2],ITEM!R3C2:R82C4,3,0) -> 2 | E22: =VLOOKUP(RC[1],ITEM!R3C2:R82C3,2,0) -> SY0L | F22: 狩猎腿甲 | G22: =VLOOKUP(RC[1],ITEM!R3C2:R82C3,2,0) -> SY0M | H22: 狩猎头饰 | I22: =VLOOKUP(RC[1],ITEM!R3C2:R82C3,2,0) -> SY0N | J22: 狩猎战靴 | K22: 狩猎套装-未来 | L22: 攻击时2%施加 1级破绽 3秒 | M22: ST0L | N22: SB0L | O22: ="blp\suitItem\"&IF(RC[-12]>=10,"","0")&RC[-12]&" (1) .blp" -> blp\suitItem\03 (1) .blp | P22: ="new AffixItemLinkEntity("&RC[-12]&",'"&RC[-11]&"',"""&RC[-10]&""",'"&RC[-9]&"',"""&RC[-8]&""&""",'"&RC[-7]&"',"""&RC[-6]&""","""&RC[-14]&""","""&RC[-5]&""",'"&RC[-2]&"'"&")" -> new AffixItemLinkEntity(2,'SY0L',"狩猎腿甲",'SY0M',"狩猎头饰",'SY0N',"狩猎战靴","狩猎","狩猎套装-未来",'SB0L') | Q22: =IF(RC[-5]<>"","|n"&RC[-5],"")&IF(RC[3]="",,"|n"&R1C[3]&RC[3])&IF(RC[4]="",,"|n"&R1C[4]&RC[4])&IF(RC[5]="",,"|n"&R1C[5]&RC[5])&IF(RC[6]="",,"|n"&R1C[6]&RC[6])&IF(RC[7]="",,"|n"&R1C[7]&RC[7])&IF(RC[8]="",,"|n"&R1C[8]&RC[8])&IF(RC[10]="",,"|n"&R1C[10]&RC[10])&IF(RC[11]="",,"|n"&R1C[11]&RC[11])&IF(RC[12]="",,"|n"&R1C[12]&RC[12])&IF(RC[13]="",,"|n"&R1C[13]&RC[13])&IF(RC[14]="",,"|n"&R1C[14]&RC[14])&IF(RC[15]="",,"|n"&R1C[15]&RC[15])&IF(RC[16]="",,"|n"&R1C[16]&RC[16])&IF(RC[17]="",,"|n"&R1C[17]&RC[17])&IF(RC[18]="",,"|n"&R1C[18]&RC[18])&IF(RC[19]="",,"|n"&R1C[19]&RC[19])&IF(RC[20]="",,"|n"&R1C[20]&RC[20])&IF(RC[21]="",,"|n"&R1C29&RC[21])&IF(RC[22]="",,"|n"&R1C[22]&RC[22])&IF(RC[24]="",,"|n"&R1C[24]&RC[24])&IF(RC[25]="",,"|n"&R1C[25]&RC[25])&IF(RC[26]="",,"|n"&R1C[26]&RC[26])&IF(RC[28]="",,"|n"&RC[28]) -> |n攻击时2%施加 1级破绽 3秒 | R22: =VLOOKUP(RC[-14],其他!R1C1:R7C2,2,0)&RC[-7]&"|r" -> |cFF99FF66狩猎套装-未来|r
A23: 22 | B23: =VLOOKUP(RC[4],ITEM!R3C2:R82C6,5,0) -> 狩猎 | C23: 3 | D23: =VLOOKUP(RC[2],ITEM!R3C2:R82C4,3,0) -> 2 | E23: =VLOOKUP(RC[1],ITEM!R3C2:R82C3,2,0) -> SY0M | F23: 狩猎头饰 | G23: =VLOOKUP(RC[1],ITEM!R3C2:R82C3,2,0) -> SY0N | H23: 狩猎战靴 | I23: =VLOOKUP(RC[1],ITEM!R3C2:R82C3,2,0) -> SY0O | J23: 狩猎腰带 | K23: 狩猎套装-夕阳 | L23: 攻击时1%施加 2级致盲 3秒 | M23: ST0M | N23: SB0M | O23: ="blp\suitItem\"&IF(RC[-12]>=10,"","0")&RC[-12]&" (1) .blp" -> blp\suitItem\03 (1) .blp | P23: ="new AffixItemLinkEntity("&RC[-12]&",'"&RC[-11]&"',"""&RC[-10]&""",'"&RC[-9]&"',"""&RC[-8]&""&""",'"&RC[-7]&"',"""&RC[-6]&""","""&RC[-14]&""","""&RC[-5]&""",'"&RC[-2]&"'"&")" -> new AffixItemLinkEntity(2,'SY0M',"狩猎头饰",'SY0N',"狩猎战靴",'SY0O',"狩猎腰带","狩猎","狩猎套装-夕阳",'SB0M') | Q23: =IF(RC[-5]<>"","|n"&RC[-5],"")&IF(RC[3]="",,"|n"&R1C[3]&RC[3])&IF(RC[4]="",,"|n"&R1C[4]&RC[4])&IF(RC[5]="",,"|n"&R1C[5]&RC[5])&IF(RC[6]="",,"|n"&R1C[6]&RC[6])&IF(RC[7]="",,"|n"&R1C[7]&RC[7])&IF(RC[8]="",,"|n"&R1C[8]&RC[8])&IF(RC[10]="",,"|n"&R1C[10]&RC[10])&IF(RC[11]="",,"|n"&R1C[11]&RC[11])&IF(RC[12]="",,"|n"&R1C[12]&RC[12])&IF(RC[13]="",,"|n"&R1C[13]&RC[13])&IF(RC[14]="",,"|n"&R1C[14]&RC[14])&IF(RC[15]="",,"|n"&R1C[15]&RC[15])&IF(RC[16]="",,"|n"&R1C[16]&RC[16])&IF(RC[17]="",,"|n"&R1C[17]&RC[17])&IF(RC[18]="",,"|n"&R1C[18]&RC[18])&IF(RC[19]="",,"|n"&R1C[19]&RC[19])&IF(RC[20]="",,"|n"&R1C[20]&RC[20])&IF(RC[21]="",,"|n"&R1C29&RC[21])&IF(RC[22]="",,"|n"&R1C[22]&RC[22])&IF(RC[24]="",,"|n"&R1C[24]&RC[24])&IF(RC[25]="",,"|n"&R1C[25]&RC[25])&IF(RC[26]="",,"|n"&R1C[26]&RC[26])&IF(RC[28]="",,"|n"&RC[28]) -> |n攻击时1%施加 2级致盲 3秒 | R23: =VLOOKUP(RC[-14],其他!R1C1:R7C2,2,0)&RC[-7]&"|r" -> |cFF99FF66狩猎套装-夕阳|r
A24: 23 | B24: =VLOOKUP(RC[4],ITEM!R3C2:R82C6,5,0) -> 狩猎 | C24: 3 | D24: =VLOOKUP(RC[2],ITEM!R3C2:R82C4,3,0) -> 2 | E24: =VLOOKUP(RC[1],ITEM!R3C2:R82C3,2,0) -> SY0N | F24: 狩猎战靴 | G24: =VLOOKUP(RC[1],ITEM!R3C2:R82C3,2,0) -> SY0O | H24: 狩猎腰带 | I24: =VLOOKUP(RC[1],ITEM!R3C2:R82C3,2,0) -> SY0H | J24: 狩猎长刃 | K24: 狩猎套装-朝阳 | L24: 攻击时1%施加 2级虚弱 3秒 | M24: ST0N | N24: SB0N | O24: ="blp\suitItem\"&IF(RC[-12]>=10,"","0")&RC[-12]&" (1) .blp" -> blp\suitItem\03 (1) .blp | P24: ="new AffixItemLinkEntity("&RC[-12]&",'"&RC[-11]&"',"""&RC[-10]&""",'"&RC[-9]&"',"""&RC[-8]&""&""",'"&RC[-7]&"',"""&RC[-6]&""","""&RC[-14]&""","""&RC[-5]&""",'"&RC[-2]&"'"&")" -> new AffixItemLinkEntity(2,'SY0N',"狩猎战靴",'SY0O',"狩猎腰带",'SY0H',"狩猎长刃","狩猎","狩猎套装-朝阳",'SB0N') | Q24: =IF(RC[-5]<>"","|n"&RC[-5],"")&IF(RC[3]="",,"|n"&R1C[3]&RC[3])&IF(RC[4]="",,"|n"&R1C[4]&RC[4])&IF(RC[5]="",,"|n"&R1C[5]&RC[5])&IF(RC[6]="",,"|n"&R1C[6]&RC[6])&IF(RC[7]="",,"|n"&R1C[7]&RC[7])&IF(RC[8]="",,"|n"&R1C[8]&RC[8])&IF(RC[10]="",,"|n"&R1C[10]&RC[10])&IF(RC[11]="",,"|n"&R1C[11]&RC[11])&IF(RC[12]="",,"|n"&R1C[12]&RC[12])&IF(RC[13]="",,"|n"&R1C[13]&RC[13])&IF(RC[14]="",,"|n"&R1C[14]&RC[14])&IF(RC[15]="",,"|n"&R1C[15]&RC[15])&IF(RC[16]="",,"|n"&R1C[16]&RC[16])&IF(RC[17]="",,"|n"&R1C[17]&RC[17])&IF(RC[18]="",,"|n"&R1C[18]&RC[18])&IF(RC[19]="",,"|n"&R1C[19]&RC[19])&IF(RC[20]="",,"|n"&R1C[20]&RC[20])&IF(RC[21]="",,"|n"&R1C29&RC[21])&IF(RC[22]="",,"|n"&R1C[22]&RC[22])&IF(RC[24]="",,"|n"&R1C[24]&RC[24])&IF(RC[25]="",,"|n"&R1C[25]&RC[25])&IF(RC[26]="",,"|n"&R1C[26]&RC[26])&IF(RC[28]="",,"|n"&RC[28]) -> |n攻击时1%施加 2级虚弱 3秒 | R24: =VLOOKUP(RC[-14],其他!R1C1:R7C2,2,0)&RC[-7]&"|r" -> |cFF99FF66狩猎套装-朝阳|r
A25: 24 | B25: =VLOOKUP(RC[4],ITEM!R3C2:R82C6,5,0) -> 狩猎 | C25: 3 | D25: =VLOOKUP(RC[2],ITEM!R3C2:R82C4,3,0) -> 2 | E25: =VLOOKUP(RC[1],ITEM!R3C2:R82C3,2,0) -> SY0O | F25: 狩猎腰带 | G25: =VLOOKUP(RC[1],ITEM!R3C2:R82C3,2,0) -> SY0H | H25: 狩猎长刃 | I25: =VLOOKUP(RC[1],ITEM!R3C2:R82C3,2,0) -> SY0I | J25: 狩猎胸甲 | K25: 狩猎套装-晚霞 | L25: 攻击时1%施加 2级破绽 3秒 | M25: ST0O | N25: SB0O | O25: ="blp\suitItem\"&IF(RC[-12]>=10,"","0")&RC[-12]&" (1) .blp" -> blp\suitItem\03 (1) .blp | P25: ="new AffixItemLinkEntity("&RC[-12]&",'"&RC[-11]&"',"""&RC[-10]&""",'"&RC[-9]&"',"""&RC[-8]&""&""",'"&RC[-7]&"',"""&RC[-6]&""","""&RC[-14]&""","""&RC[-5]&""",'"&RC[-2]&"'"&")" -> new AffixItemLinkEntity(2,'SY0O',"狩猎腰带",'SY0H',"狩猎长刃",'SY0I',"狩猎胸甲","狩猎","狩猎套装-晚霞",'SB0O') | Q25: =IF(RC[-5]<>"","|n"&RC[-5],"")&IF(RC[3]="",,"|n"&R1C[3]&RC[3])&IF(RC[4]="",,"|n"&R1C[4]&RC[4])&IF(RC[5]="",,"|n"&R1C[5]&RC[5])&IF(RC[6]="",,"|n"&R1C[6]&RC[6])&IF(RC[7]="",,"|n"&R1C[7]&RC[7])&IF(RC[8]="",,"|n"&R1C[8]&RC[8])&IF(RC[10]="",,"|n"&R1C[10]&RC[10])&IF(RC[11]="",,"|n"&R1C[11]&RC[11])&IF(RC[12]="",,"|n"&R1C[12]&RC[12])&IF(RC[13]="",,"|n"&R1C[13]&RC[13])&IF(RC[14]="",,"|n"&R1C[14]&RC[14])&IF(RC[15]="",,"|n"&R1C[15]&RC[15])&IF(RC[16]="",,"|n"&R1C[16]&RC[16])&IF(RC[17]="",,"|n"&R1C[17]&RC[17])&IF(RC[18]="",,"|n"&R1C[18]&RC[18])&IF(RC[19]="",,"|n"&R1C[19]&RC[19])&IF(RC[20]="",,"|n"&R1C[20]&RC[20])&IF(RC[21]="",,"|n"&R1C29&RC[21])&IF(RC[22]="",,"|n"&R1C[22]&RC[22])&IF(RC[24]="",,"|n"&R1C[24]&RC[24])&IF(RC[25]="",,"|n"&R1C[25]&RC[25])&IF(RC[26]="",,"|n"&R1C[26]&RC[26])&IF(RC[28]="",,"|n"&RC[28]) -> |n攻击时1%施加 2级破绽 3秒 | R25: =VLOOKUP(RC[-14],其他!R1C1:R7C2,2,0)&RC[-7]&"|r" -> |cFF99FF66狩猎套装-晚霞|r
A26: 25 | B26: =VLOOKUP(RC[4],ITEM!R3C2:R82C6,5,0) -> 赤血 | C26: 4 | D26: =VLOOKUP(RC[2],ITEM!R3C2:R82C4,3,0) -> 2 | E26: =VLOOKUP(RC[1],ITEM!R3C2:R82C3,2,0) -> SY0P | F26: 赤血长刃 | G26: =VLOOKUP(RC[1],ITEM!R3C2:R82C3,2,0) -> SY0Q | H26: 赤血胸甲 | I26: =VLOOKUP(RC[1],ITEM!R3C2:R82C3,2,0) -> SY0R | J26: 赤血护手 | K26: 赤血套装-征程 | L26: 攻击时2%获得 无敌 1秒 | M26: ST0P | N26: SB0P | O26: ="blp\suitItem\"&IF(RC[-12]>=10,"","0")&RC[-12]&" (1) .blp" -> blp\suitItem\04 (1) .blp | P26: ="new AffixItemLinkEntity("&RC[-12]&",'"&RC[-11]&"',"""&RC[-10]&""",'"&RC[-9]&"',"""&RC[-8]&""&""",'"&RC[-7]&"',"""&RC[-6]&""","""&RC[-14]&""","""&RC[-5]&""",'"&RC[-2]&"'"&")" -> new AffixItemLinkEntity(2,'SY0P',"赤血长刃",'SY0Q',"赤血胸甲",'SY0R',"赤血护手","赤血","赤血套装-征程",'SB0P') | Q26: =IF(RC[-5]<>"","|n"&RC[-5],"")&IF(RC[3]="",,"|n"&R1C[3]&RC[3])&IF(RC[4]="",,"|n"&R1C[4]&RC[4])&IF(RC[5]="",,"|n"&R1C[5]&RC[5])&IF(RC[6]="",,"|n"&R1C[6]&RC[6])&IF(RC[7]="",,"|n"&R1C[7]&RC[7])&IF(RC[8]="",,"|n"&R1C[8]&RC[8])&IF(RC[10]="",,"|n"&R1C[10]&RC[10])&IF(RC[11]="",,"|n"&R1C[11]&RC[11])&IF(RC[12]="",,"|n"&R1C[12]&RC[12])&IF(RC[13]="",,"|n"&R1C[13]&RC[13])&IF(RC[14]="",,"|n"&R1C[14]&RC[14])&IF(RC[15]="",,"|n"&R1C[15]&RC[15])&IF(RC[16]="",,"|n"&R1C[16]&RC[16])&IF(RC[17]="",,"|n"&R1C[17]&RC[17])&IF(RC[18]="",,"|n"&R1C[18]&RC[18])&IF(RC[19]="",,"|n"&R1C[19]&RC[19])&IF(RC[20]="",,"|n"&R1C[20]&RC[20])&IF(RC[21]="",,"|n"&R1C29&RC[21])&IF(RC[22]="",,"|n"&R1C[22]&RC[22])&IF(RC[24]="",,"|n"&R1C[24]&RC[24])&IF(RC[25]="",,"|n"&R1C[25]&RC[25])&IF(RC[26]="",,"|n"&R1C[26]&RC[26])&IF(RC[28]="",,"|n"&RC[28]) -> |n攻击时2%获得 无敌 1秒 | R26: =VLOOKUP(RC[-14],其他!R1C1:R7C2,2,0)&RC[-7]&"|r" -> |cFF99FF66赤血套装-征程|r
A27: 26 | B27: =VLOOKUP(RC[4],ITEM!R3C2:R82C6,5,0) -> 赤血 | C27: 4 | D27: =VLOOKUP(RC[2],ITEM!R3C2:R82C4,3,0) -> 2 | E27: =VLOOKUP(RC[1],ITEM!R3C2:R82C3,2,0) -> SY0Q | F27: 赤血胸甲 | G27: =VLOOKUP(RC[1],ITEM!R3C2:R82C3,2,0) -> SY0R | H27: 赤血护手 | I27: =VLOOKUP(RC[1],ITEM!R3C2:R82C3,2,0) -> SY0S | J27: 赤血护肩 | K27: 赤血套装-杀戮 | L27: 攻击时2%获得 精准 2秒 | M27: ST0Q | N27: SB0Q | O27: ="blp\suitItem\"&IF(RC[-12]>=10,"","0")&RC[-12]&" (1) .blp" -> blp\suitItem\04 (1) .blp | P27: ="new AffixItemLinkEntity("&RC[-12]&",'"&RC[-11]&"',"""&RC[-10]&""",'"&RC[-9]&"',"""&RC[-8]&""&""",'"&RC[-7]&"',"""&RC[-6]&""","""&RC[-14]&""","""&RC[-5]&""",'"&RC[-2]&"'"&")" -> new AffixItemLinkEntity(2,'SY0Q',"赤血胸甲",'SY0R',"赤血护手",'SY0S',"赤血护肩","赤血","赤血套装-杀戮",'SB0Q') | Q27: =IF(RC[-5]<>"","|n"&RC[-5],"")&IF(RC[3]="",,"|n"&R1C[3]&RC[3])&IF(RC[4]="",,"|n"&R1C[4]&RC[4])&IF(RC[5]="",,"|n"&R1C[5]&RC[5])&IF(RC[6]="",,"|n"&R1C[6]&RC[6])&IF(RC[7]="",,"|n"&R1C[7]&RC[7])&IF(RC[8]="",,"|n"&R1C[8]&RC[8])&IF(RC[10]="",,"|n"&R1C[10]&RC[10])&IF(RC[11]="",,"|n"&R1C[11]&RC[11])&IF(RC[12]="",,"|n"&R1C[12]&RC[12])&IF(RC[13]="",,"|n"&R1C[13]&RC[13])&IF(RC[14]="",,"|n"&R1C[14]&RC[14])&IF(RC[15]="",,"|n"&R1C[15]&RC[15])&IF(RC[16]="",,"|n"&R1C[16]&RC[16])&IF(RC[17]="",,"|n"&R1C[17]&RC[17])&IF(RC[18]="",,"|n"&R1C[18]&RC[18])&IF(RC[19]="",,"|n"&R1C[19]&RC[19])&IF(RC[20]="",,"|n"&R1C[20]&RC[20])&IF(RC[21]="",,"|n"&R1C29&RC[21])&IF(RC[22]="",,"|n"&R1C[22]&RC[22])&IF(RC[24]="",,"|n"&R1C[24]&RC[24])&IF(RC[25]="",,"|n"&R1C[25]&RC[25])&IF(RC[26]="",,"|n"&R1C[26]&RC[26])&IF(RC[28]="",,"|n"&RC[28]) -> |n攻击时2%获得 精准 2秒 | R27: =VLOOKUP(RC[-14],其他!R1C1:R7C2,2,0)&RC[-7]&"|r" -> |cFF99FF66赤血套装-杀戮|r
A28: 27 | B28: =VLOOKUP(RC[4],ITEM!R3C2:R82C6,5,0) -> 赤血 | C28: 4 | D28: =VLOOKUP(RC[2],ITEM!R3C2:R82C4,3,0) -> 2 | E28: =VLOOKUP(RC[1],ITEM!R3C2:R82C3,2,0) -> SY0R | F28: 赤血护手 | G28: =VLOOKUP(RC[1],ITEM!R3C2:R82C3,2,0) -> SY0S | H28: 赤血护肩 | I28: =VLOOKUP(RC[1],ITEM!R3C2:R82C3,2,0) -> SY0T | J28: 赤血腿甲 | K28: 赤血套装-杀伐 | L28: 攻击时2%获得 风行 2秒 | M28: ST0R | N28: SB0R | O28: ="blp\suitItem\"&IF(RC[-12]>=10,"","0")&RC[-12]&" (1) .blp" -> blp\suitItem\04 (1) .blp | P28: ="new AffixItemLinkEntity("&RC[-12]&",'"&RC[-11]&"',"""&RC[-10]&""",'"&RC[-9]&"',"""&RC[-8]&""&""",'"&RC[-7]&"',"""&RC[-6]&""","""&RC[-14]&""","""&RC[-5]&""",'"&RC[-2]&"'"&")" -> new AffixItemLinkEntity(2,'SY0R',"赤血护手",'SY0S',"赤血护肩",'SY0T',"赤血腿甲","赤血","赤血套装-杀伐",'SB0R') | Q28: =IF(RC[-5]<>"","|n"&RC[-5],"")&IF(RC[3]="",,"|n"&R1C[3]&RC[3])&IF(RC[4]="",,"|n"&R1C[4]&RC[4])&IF(RC[5]="",,"|n"&R1C[5]&RC[5])&IF(RC[6]="",,"|n"&R1C[6]&RC[6])&IF(RC[7]="",,"|n"&R1C[7]&RC[7])&IF(RC[8]="",,"|n"&R1C[8]&RC[8])&IF(RC[10]="",,"|n"&R1C[10]&RC[10])&IF(RC[11]="",,"|n"&R1C[11]&RC[11])&IF(RC[12]="",,"|n"&R1C[12]&RC[12])&IF(RC[13]="",,"|n"&R1C[13]&RC[13])&IF(RC[14]="",,"|n"&R1C[14]&RC[14])&IF(RC[15]="",,"|n"&R1C[15]&RC[15])&IF(RC[16]="",,"|n"&R1C[16]&RC[16])&IF(RC[17]="",,"|n"&R1C[17]&RC[17])&IF(RC[18]="",,"|n"&R1C[18]&RC[18])&IF(RC[19]="",,"|n"&R1C[19]&RC[19])&IF(RC[20]="",,"|n"&R1C[20]&RC[20])&IF(RC[21]="",,"|n"&R1C29&RC[21])&IF(RC[22]="",,"|n"&R1C[22]&RC[22])&IF(RC[24]="",,"|n"&R1C[24]&RC[24])&IF(RC[25]="",,"|n"&R1C[25]&RC[25])&IF(RC[26]="",,"|n"&R1C[26]&RC[26])&IF(RC[28]="",,"|n"&RC[28]) -> |n攻击时2%获得 风行 2秒 | R28: =VLOOKUP(RC[-14],其他!R1C1:R7C2,2,0)&RC[-7]&"|r" -> |cFF99FF66赤血套装-杀伐|r
A29: 28 | B29: =VLOOKUP(RC[4],ITEM!R3C2:R82C6,5,0) -> 赤血 | C29: 4 | D29: =VLOOKUP(RC[2],ITEM!R3C2:R82C4,3,0) -> 2 | E29: =VLOOKUP(RC[1],ITEM!R3C2:R82C3,2,0) -> SY0S | F29: 赤血护肩 | G29: =VLOOKUP(RC[1],ITEM!R3C2:R82C3,2,0) -> SY0T | H29: 赤血腿甲 | I29: =VLOOKUP(RC[1],ITEM!R3C2:R82C3,2,0) -> SY0U | J29: 赤血头饰 | K29: 赤血套装-冲锋 | L29: 攻击时2%获得 暴怒 1秒 | M29: ST0S | N29: SB0S | O29: ="blp\suitItem\"&IF(RC[-12]>=10,"","0")&RC[-12]&" (1) .blp" -> blp\suitItem\04 (1) .blp | P29: ="new AffixItemLinkEntity("&RC[-12]&",'"&RC[-11]&"',"""&RC[-10]&""",'"&RC[-9]&"',"""&RC[-8]&""&""",'"&RC[-7]&"',"""&RC[-6]&""","""&RC[-14]&""","""&RC[-5]&""",'"&RC[-2]&"'"&")" -> new AffixItemLinkEntity(2,'SY0S',"赤血护肩",'SY0T',"赤血腿甲",'SY0U',"赤血头饰","赤血","赤血套装-冲锋",'SB0S') | Q29: =IF(RC[-5]<>"","|n"&RC[-5],"")&IF(RC[3]="",,"|n"&R1C[3]&RC[3])&IF(RC[4]="",,"|n"&R1C[4]&RC[4])&IF(RC[5]="",,"|n"&R1C[5]&RC[5])&IF(RC[6]="",,"|n"&R1C[6]&RC[6])&IF(RC[7]="",,"|n"&R1C[7]&RC[7])&IF(RC[8]="",,"|n"&R1C[8]&RC[8])&IF(RC[10]="",,"|n"&R1C[10]&RC[10])&IF(RC[11]="",,"|n"&R1C[11]&RC[11])&IF(RC[12]="",,"|n"&R1C[12]&RC[12])&IF(RC[13]="",,"|n"&R1C[13]&RC[13])&IF(RC[14]="",,"|n"&R1C[14]&RC[14])&IF(RC[15]="",,"|n"&R1C[15]&RC[15])&IF(RC[16]="",,"|n"&R1C[16]&RC[16])&IF(RC[17]="",,"|n"&R1C[17]&RC[17])&IF(RC[18]="",,"|n"&R1C[18]&RC[18])&IF(RC[19]="",,"|n"&R1C[19]&RC[19])&IF(RC[20]="",,"|n"&R1C[20]&RC[20])&IF(RC[21]="",,"|n"&R1C29&RC[21])&IF(RC[22]="",,"|n"&R1C[22]&RC[22])&IF(RC[24]="",,"|n"&R1C[24]&RC[24])&IF(RC[25]="",,"|n"&R1C[25]&RC[25])&IF(RC[26]="",,"|n"&R1C[26]&RC[26])&IF(RC[28]="",,"|n"&RC[28]) -> |n攻击时2%获得 暴怒 1秒 | R29: =VLOOKUP(RC[-14],其他!R1C1:R7C2,2,0)&RC[-7]&"|r" -> |cFF99FF66赤血套装-冲锋|r
A30: 29 | B30: =VLOOKUP(RC[4],ITEM!R3C2:R82C6,5,0) -> 赤血 | C30: 4 | D30: =VLOOKUP(RC[2],ITEM!R3C2:R82C4,3,0) -> 2 | E30: =VLOOKUP(RC[1],ITEM!R3C2:R82C3,2,0) -> SY0T | F30: 赤血腿甲 | G30: =VLOOKUP(RC[1],ITEM!R3C2:R82C3,2,0) -> SY0U | H30: 赤血头饰 | I30: =VLOOKUP(RC[1],ITEM!R3C2:R82C3,2,0) -> SY0V | J30: 赤血战靴 | K30: 赤血套装-勇武 | L30: 攻击时2%获得 1级强化 3秒 | M30: ST0T | N30: SB0T | O30: ="blp\suitItem\"&IF(RC[-12]>=10,"","0")&RC[-12]&" (1) .blp" -> blp\suitItem\04 (1) .blp | P30: ="new AffixItemLinkEntity("&RC[-12]&",'"&RC[-11]&"',"""&RC[-10]&""",'"&RC[-9]&"',"""&RC[-8]&""&""",'"&RC[-7]&"',"""&RC[-6]&""","""&RC[-14]&""","""&RC[-5]&""",'"&RC[-2]&"'"&")" -> new AffixItemLinkEntity(2,'SY0T',"赤血腿甲",'SY0U',"赤血头饰",'SY0V',"赤血战靴","赤血","赤血套装-勇武",'SB0T') | Q30: =IF(RC[-5]<>"","|n"&RC[-5],"")&IF(RC[3]="",,"|n"&R1C[3]&RC[3])&IF(RC[4]="",,"|n"&R1C[4]&RC[4])&IF(RC[5]="",,"|n"&R1C[5]&RC[5])&IF(RC[6]="",,"|n"&R1C[6]&RC[6])&IF(RC[7]="",,"|n"&R1C[7]&RC[7])&IF(RC[8]="",,"|n"&R1C[8]&RC[8])&IF(RC[10]="",,"|n"&R1C[10]&RC[10])&IF(RC[11]="",,"|n"&R1C[11]&RC[11])&IF(RC[12]="",,"|n"&R1C[12]&RC[12])&IF(RC[13]="",,"|n"&R1C[13]&RC[13])&IF(RC[14]="",,"|n"&R1C[14]&RC[14])&IF(RC[15]="",,"|n"&R1C[15]&RC[15])&IF(RC[16]="",,"|n"&R1C[16]&RC[16])&IF(RC[17]="",,"|n"&R1C[17]&RC[17])&IF(RC[18]="",,"|n"&R1C[18]&RC[18])&IF(RC[19]="",,"|n"&R1C[19]&RC[19])&IF(RC[20]="",,"|n"&R1C[20]&RC[20])&IF(RC[21]="",,"|n"&R1C29&RC[21])&IF(RC[22]="",,"|n"&R1C[22]&RC[22])&IF(RC[24]="",,"|n"&R1C[24]&RC[24])&IF(RC[25]="",,"|n"&R1C[25]&RC[25])&IF(RC[26]="",,"|n"&R1C[26]&RC[26])&IF(RC[28]="",,"|n"&RC[28]) -> |n攻击时2%获得 1级强化 3秒 | R30: =VLOOKUP(RC[-14],其他!R1C1:R7C2,2,0)&RC[-7]&"|r" -> |cFF99FF66赤血套装-勇武|r
A31: 30 | B31: =VLOOKUP(RC[4],ITEM!R3C2:R82C6,5,0) -> 赤血 | C31: 4 | D31: =VLOOKUP(RC[2],ITEM!R3C2:R82C4,3,0) -> 2 | E31: =VLOOKUP(RC[1],ITEM!R3C2:R82C3,2,0) -> SY0U | F31: 赤血头饰 | G31: =VLOOKUP(RC[1],ITEM!R3C2:R82C3,2,0) -> SY0V | H31: 赤血战靴 | I31: =VLOOKUP(RC[1],ITEM!R3C2:R82C3,2,0) -> SY0W | J31: 赤血腰带 | K31: 赤血套装-奋战 | L31: 攻击时2%获得 1级护体 3秒 | M31: ST0U | N31: SB0U | O31: ="blp\suitItem\"&IF(RC[-12]>=10,"","0")&RC[-12]&" (1) .blp" -> blp\suitItem\04 (1) .blp | P31: ="new AffixItemLinkEntity("&RC[-12]&",'"&RC[-11]&"',"""&RC[-10]&""",'"&RC[-9]&"',"""&RC[-8]&""&""",'"&RC[-7]&"',"""&RC[-6]&""","""&RC[-14]&""","""&RC[-5]&""",'"&RC[-2]&"'"&")" -> new AffixItemLinkEntity(2,'SY0U',"赤血头饰",'SY0V',"赤血战靴",'SY0W',"赤血腰带","赤血","赤血套装-奋战",'SB0U') | Q31: =IF(RC[-5]<>"","|n"&RC[-5],"")&IF(RC[3]="",,"|n"&R1C[3]&RC[3])&IF(RC[4]="",,"|n"&R1C[4]&RC[4])&IF(RC[5]="",,"|n"&R1C[5]&RC[5])&IF(RC[6]="",,"|n"&R1C[6]&RC[6])&IF(RC[7]="",,"|n"&R1C[7]&RC[7])&IF(RC[8]="",,"|n"&R1C[8]&RC[8])&IF(RC[10]="",,"|n"&R1C[10]&RC[10])&IF(RC[11]="",,"|n"&R1C[11]&RC[11])&IF(RC[12]="",,"|n"&R1C[12]&RC[12])&IF(RC[13]="",,"|n"&R1C[13]&RC[13])&IF(RC[14]="",,"|n"&R1C[14]&RC[14])&IF(RC[15]="",,"|n"&R1C[15]&RC[15])&IF(RC[16]="",,"|n"&R1C[16]&RC[16])&IF(RC[17]="",,"|n"&R1C[17]&RC[17])&IF(RC[18]="",,"|n"&R1C[18]&RC[18])&IF(RC[19]="",,"|n"&R1C[19]&RC[19])&IF(RC[20]="",,"|n"&R1C[20]&RC[20])&IF(RC[21]="",,"|n"&R1C29&RC[21])&IF(RC[22]="",,"|n"&R1C[22]&RC[22])&IF(RC[24]="",,"|n"&R1C[24]&RC[24])&IF(RC[25]="",,"|n"&R1C[25]&RC[25])&IF(RC[26]="",,"|n"&R1C[26]&RC[26])&IF(RC[28]="",,"|n"&RC[28]) -> |n攻击时2%获得 1级护体 3秒 | R31: =VLOOKUP(RC[-14],其他!R1C1:R7C2,2,0)&RC[-7]&"|r" -> |cFF99FF66赤血套装-奋战|r
A32: 31 | B32: =VLOOKUP(RC[4],ITEM!R3C2:R82C6,5,0) -> 赤血 | C32: 4 | D32: =VLOOKUP(RC[2],ITEM!R3C2:R82C4,3,0) -> 2 | E32: =VLOOKUP(RC[1],ITEM!R3C2:R82C3,2,0) -> SY0V | F32: 赤血战靴 | G32: =VLOOKUP(RC[1],ITEM!R3C2:R82C3,2,0) -> SY0W | H32: 赤血腰带 | I32: =VLOOKUP(RC[1],ITEM!R3C2:R82C3,2,0) -> SY0P | J32: 赤血长刃 | K32: 赤血套装-凯歌 | L32: 攻击时1%获得 2级强化 3秒 | M32: ST0V | N32: SB0V | O32: ="blp\suitItem\"&IF(RC[-12]>=10,"","0")&RC[-12]&" (1) .blp" -> blp\suitItem\04 (1) .blp | P32: ="new AffixItemLinkEntity("&RC[-12]&",'"&RC[-11]&"',"""&RC[-10]&""",'"&RC[-9]&"',"""&RC[-8]&""&""",'"&RC[-7]&"',"""&RC[-6]&""","""&RC[-14]&""","""&RC[-5]&""",'"&RC[-2]&"'"&")" -> new AffixItemLinkEntity(2,'SY0V',"赤血战靴",'SY0W',"赤血腰带",'SY0P',"赤血长刃","赤血","赤血套装-凯歌",'SB0V') | Q32: =IF(RC[-5]<>"","|n"&RC[-5],"")&IF(RC[3]="",,"|n"&R1C[3]&RC[3])&IF(RC[4]="",,"|n"&R1C[4]&RC[4])&IF(RC[5]="",,"|n"&R1C[5]&RC[5])&IF(RC[6]="",,"|n"&R1C[6]&RC[6])&IF(RC[7]="",,"|n"&R1C[7]&RC[7])&IF(RC[8]="",,"|n"&R1C[8]&RC[8])&IF(RC[10]="",,"|n"&R1C[10]&RC[10])&IF(RC[11]="",,"|n"&R1C[11]&RC[11])&IF(RC[12]="",,"|n"&R1C[12]&RC[12])&IF(RC[13]="",,"|n"&R1C[13]&RC[13])&IF(RC[14]="",,"|n"&R1C[14]&RC[14])&IF(RC[15]="",,"|n"&R1C[15]&RC[15])&IF(RC[16]="",,"|n"&R1C[16]&RC[16])&IF(RC[17]="",,"|n"&R1C[17]&RC[17])&IF(RC[18]="",,"|n"&R1C[18]&RC[18])&IF(RC[19]="",,"|n"&R1C[19]&RC[19])&IF(RC[20]="",,"|n"&R1C[20]&RC[20])&IF(RC[21]="",,"|n"&R1C29&RC[21])&IF(RC[22]="",,"|n"&R1C[22]&RC[22])&IF(RC[24]="",,"|n"&R1C[24]&RC[24])&IF(RC[25]="",,"|n"&R1C[25]&RC[25])&IF(RC[26]="",,"|n"&R1C[26]&RC[26])&IF(RC[28]="",,"|n"&RC[28]) -> |n攻击时1%获得 2级强化 3秒 | R32: =VLOOKUP(RC[-14],其他!R1C1:R7C2,2,0)&RC[-7]&"|r" -> |cFF99FF66赤血套装-凯歌|r
A33: 32 | B33: =VLOOKUP(RC[4],ITEM!R3C2:R82C6,5,0) -> 赤血 | C33: 4 | D33: =VLOOKUP(RC[2],ITEM!R3C2:R82C4,3,0) -> 2 | E33: =VLOOKUP(RC[1],ITEM!R3C2:R82C3,2,0) -> SY0W | F33: 赤血腰带 | G33: =VLOOKUP(RC[1],ITEM!R3C2:R82C3,2,0) -> SY0P | H33: 赤血长刃 | I33: =VLOOKUP(RC[1],ITEM!R3C2:R82C3,2,0) -> SY0Q | J33: 赤血胸甲 | K33: 赤血套装-决断 | L33: 攻击时1%获得 2级护体 3秒 | M33: ST0W | N33: SB0W | O33: ="blp\suitItem\"&IF(RC[-12]>=10,"","0")&RC[-12]&" (1) .blp" -> blp\suitItem\04 (1) .blp | P33: ="new AffixItemLinkEntity("&RC[-12]&",'"&RC[-11]&"',"""&RC[-10]&""",'"&RC[-9]&"',"""&RC[-8]&""&""",'"&RC[-7]&"',"""&RC[-6]&""","""&RC[-14]&""","""&RC[-5]&""",'"&RC[-2]&"'"&")" -> new AffixItemLinkEntity(2,'SY0W',"赤血腰带",'SY0P',"赤血长刃",'SY0Q',"赤血胸甲","赤血","赤血套装-决断",'SB0W') | Q33: =IF(RC[-5]<>"","|n"&RC[-5],"")&IF(RC[3]="",,"|n"&R1C[3]&RC[3])&IF(RC[4]="",,"|n"&R1C[4]&RC[4])&IF(RC[5]="",,"|n"&R1C[5]&RC[5])&IF(RC[6]="",,"|n"&R1C[6]&RC[6])&IF(RC[7]="",,"|n"&R1C[7]&RC[7])&IF(RC[8]="",,"|n"&R1C[8]&RC[8])&IF(RC[10]="",,"|n"&R1C[10]&RC[10])&IF(RC[11]="",,"|n"&R1C[11]&RC[11])&IF(RC[12]="",,"|n"&R1C[12]&RC[12])&IF(RC[13]="",,"|n"&R1C[13]&RC[13])&IF(RC[14]="",,"|n"&R1C[14]&RC[14])&IF(RC[15]="",,"|n"&R1C[15]&RC[15])&IF(RC[16]="",,"|n"&R1C[16]&RC[16])&IF(RC[17]="",,"|n"&R1C[17]&RC[17])&IF(RC[18]="",,"|n"&R1C[18]&RC[18])&IF(RC[19]="",,"|n"&R1C[19]&RC[19])&IF(RC[20]="",,"|n"&R1C[20]&RC[20])&IF(RC[21]="",,"|n"&R1C29&RC[21])&IF(RC[22]="",,"|n"&R1C[22]&RC[22])&IF(RC[24]="",,"|n"&R1C[24]&RC[24])&IF(RC[25]="",,"|n"&R1C[25]&RC[25])&IF(RC[26]="",,"|n"&R1C[26]&RC[26])&IF(RC[28]="",,"|n"&RC[28]) -> |n攻击时1%获得 2级护体 3秒 | R33: =VLOOKUP(RC[-14],其他!R1C1:R7C2,2,0)&RC[-7]&"|r" -> |cFF99FF66赤血套装-决断|r
A34: 33 | B34: =VLOOKUP(RC[4],ITEM!R3C2:R82C6,5,0) -> 骑士 | C34: 5 | D34: =VLOOKUP(RC[2],ITEM!R3C2:R82C4,3,0) -> 3 | E34: =VLOOKUP(RC[1],ITEM!R3C2:R82C3,2,0) -> SY0X | F34: 骑士长刃 | G34: =VLOOKUP(RC[1],ITEM!R3C2:R82C3,2,0) -> SY0Y | H34: 骑士胸甲 | I34: =VLOOKUP(RC[1],ITEM!R3C2:R82C3,2,0) -> SY0Z | J34: 骑士护手 | K34: 骑士套装-名誉 | M34: ST0X | N34: SB0X | O34: ="blp\suitItem\"&IF(RC[-12]>=10,"","0")&RC[-12]&" (1) .blp" -> blp\suitItem\05 (1) .blp | P34: ="new AffixItemLinkEntity("&RC[-12]&",'"&RC[-11]&"',"""&RC[-10]&""",'"&RC[-9]&"',"""&RC[-8]&""&""",'"&RC[-7]&"',"""&RC[-6]&""","""&RC[-14]&""","""&RC[-5]&""",'"&RC[-2]&"'"&")" -> new AffixItemLinkEntity(3,'SY0X',"骑士长刃",'SY0Y',"骑士胸甲",'SY0Z',"骑士护手","骑士","骑士套装-名誉",'SB0X') | Q34: =IF(RC[-5]<>"","|n"&RC[-5],"")&IF(RC[3]="",,"|n"&R1C[3]&RC[3])&IF(RC[4]="",,"|n"&R1C[4]&RC[4])&IF(RC[5]="",,"|n"&R1C[5]&RC[5])&IF(RC[6]="",,"|n"&R1C[6]&RC[6])&IF(RC[7]="",,"|n"&R1C[7]&RC[7])&IF(RC[8]="",,"|n"&R1C[8]&RC[8])&IF(RC[10]="",,"|n"&R1C[10]&RC[10])&IF(RC[11]="",,"|n"&R1C[11]&RC[11])&IF(RC[12]="",,"|n"&R1C[12]&RC[12])&IF(RC[13]="",,"|n"&R1C[13]&RC[13])&IF(RC[14]="",,"|n"&R1C[14]&RC[14])&IF(RC[15]="",,"|n"&R1C[15]&RC[15])&IF(RC[16]="",,"|n"&R1C[16]&RC[16])&IF(RC[17]="",,"|n"&R1C[17]&RC[17])&IF(RC[18]="",,"|n"&R1C[18]&RC[18])&IF(RC[19]="",,"|n"&R1C[19]&RC[19])&IF(RC[20]="",,"|n"&R1C[20]&RC[20])&IF(RC[21]="",,"|n"&R1C29&RC[21])&IF(RC[22]="",,"|n"&R1C[22]&RC[22])&IF(RC[24]="",,"|n"&R1C[24]&RC[24])&IF(RC[25]="",,"|n"&R1C[25]&RC[25])&IF(RC[26]="",,"|n"&R1C[26]&RC[26])&IF(RC[28]="",,"|n"&RC[28]) -> |n血量:2000000 | R34: =VLOOKUP(RC[-14],其他!R1C1:R7C2,2,0)&RC[-7]&"|r" -> |cFF1BE6B8骑士套装-名誉|r | X34: 2000000
A35: 34 | B35: =VLOOKUP(RC[4],ITEM!R3C2:R82C6,5,0) -> 骑士 | C35: 5 | D35: =VLOOKUP(RC[2],ITEM!R3C2:R82C4,3,0) -> 3 | E35: =VLOOKUP(RC[1],ITEM!R3C2:R82C3,2,0) -> SY0Y | F35: 骑士胸甲 | G35: =VLOOKUP(RC[1],ITEM!R3C2:R82C3,2,0) -> SY0Z | H35: 骑士护手 | I35: =VLOOKUP(RC[1],ITEM!R3C2:R82C3,2,0) -> SY10 | J35: 骑士护肩 | K35: 骑士套装-荣耀 | M35: ST0Y | N35: SB0Y | O35: ="blp\suitItem\"&IF(RC[-12]>=10,"","0")&RC[-12]&" (1) .blp" -> blp\suitItem\05 (1) .blp | P35: ="new AffixItemLinkEntity("&RC[-12]&",'"&RC[-11]&"',"""&RC[-10]&""",'"&RC[-9]&"',"""&RC[-8]&""&""",'"&RC[-7]&"',"""&RC[-6]&""","""&RC[-14]&""","""&RC[-5]&""",'"&RC[-2]&"'"&")" -> new AffixItemLinkEntity(3,'SY0Y',"骑士胸甲",'SY0Z',"骑士护手",'SY10',"骑士护肩","骑士","骑士套装-荣耀",'SB0Y') | Q35: =IF(RC[-5]<>"","|n"&RC[-5],"")&IF(RC[3]="",,"|n"&R1C[3]&RC[3])&IF(RC[4]="",,"|n"&R1C[4]&RC[4])&IF(RC[5]="",,"|n"&R1C[5]&RC[5])&IF(RC[6]="",,"|n"&R1C[6]&RC[6])&IF(RC[7]="",,"|n"&R1C[7]&RC[7])&IF(RC[8]="",,"|n"&R1C[8]&RC[8])&IF(RC[10]="",,"|n"&R1C[10]&RC[10])&IF(RC[11]="",,"|n"&R1C[11]&RC[11])&IF(RC[12]="",,"|n"&R1C[12]&RC[12])&IF(RC[13]="",,"|n"&R1C[13]&RC[13])&IF(RC[14]="",,"|n"&R1C[14]&RC[14])&IF(RC[15]="",,"|n"&R1C[15]&RC[15])&IF(RC[16]="",,"|n"&R1C[16]&RC[16])&IF(RC[17]="",,"|n"&R1C[17]&RC[17])&IF(RC[18]="",,"|n"&R1C[18]&RC[18])&IF(RC[19]="",,"|n"&R1C[19]&RC[19])&IF(RC[20]="",,"|n"&R1C[20]&RC[20])&IF(RC[21]="",,"|n"&R1C29&RC[21])&IF(RC[22]="",,"|n"&R1C[22]&RC[22])&IF(RC[24]="",,"|n"&R1C[24]&RC[24])&IF(RC[25]="",,"|n"&R1C[25]&RC[25])&IF(RC[26]="",,"|n"&R1C[26]&RC[26])&IF(RC[28]="",,"|n"&RC[28]) -> |n攻击:600000 | R35: =VLOOKUP(RC[-14],其他!R1C1:R7C2,2,0)&RC[-7]&"|r" -> |cFF1BE6B8骑士套装-荣耀|r | T35: 600000
A36: 35 | B36: =VLOOKUP(RC[4],ITEM!R3C2:R82C6,5,0) -> 骑士 | C36: 5 | D36: =VLOOKUP(RC[2],ITEM!R3C2:R82C4,3,0) -> 3 | E36: =VLOOKUP(RC[1],ITEM!R3C2:R82C3,2,0) -> SY0Z | F36: 骑士护手 | G36: =VLOOKUP(RC[1],ITEM!R3C2:R82C3,2,0) -> SY10 | H36: 骑士护肩 | I36: =VLOOKUP(RC[1],ITEM!R3C2:R82C3,2,0) -> SY11 | J36: 骑士腿甲 | K36: 骑士套装-谦卑 | M36: ST0Z | N36: SB0Z | O36: ="blp\suitItem\"&IF(RC[-12]>=10,"","0")&RC[-12]&" (1) .blp" -> blp\suitItem\05 (1) .blp | P36: ="new AffixItemLinkEntity("&RC[-12]&",'"&RC[-11]&"',"""&RC[-10]&""",'"&RC[-9]&"',"""&RC[-8]&""&""",'"&RC[-7]&"',"""&RC[-6]&""","""&RC[-14]&""","""&RC[-5]&""",'"&RC[-2]&"'"&")" -> new AffixItemLinkEntity(3,'SY0Z',"骑士护手",'SY10',"骑士护肩",'SY11',"骑士腿甲","骑士","骑士套装-谦卑",'SB0Z') | Q36: =IF(RC[-5]<>"","|n"&RC[-5],"")&IF(RC[3]="",,"|n"&R1C[3]&RC[3])&IF(RC[4]="",,"|n"&R1C[4]&RC[4])&IF(RC[5]="",,"|n"&R1C[5]&RC[5])&IF(RC[6]="",,"|n"&R1C[6]&RC[6])&IF(RC[7]="",,"|n"&R1C[7]&RC[7])&IF(RC[8]="",,"|n"&R1C[8]&RC[8])&IF(RC[10]="",,"|n"&R1C[10]&RC[10])&IF(RC[11]="",,"|n"&R1C[11]&RC[11])&IF(RC[12]="",,"|n"&R1C[12]&RC[12])&IF(RC[13]="",,"|n"&R1C[13]&RC[13])&IF(RC[14]="",,"|n"&R1C[14]&RC[14])&IF(RC[15]="",,"|n"&R1C[15]&RC[15])&IF(RC[16]="",,"|n"&R1C[16]&RC[16])&IF(RC[17]="",,"|n"&R1C[17]&RC[17])&IF(RC[18]="",,"|n"&R1C[18]&RC[18])&IF(RC[19]="",,"|n"&R1C[19]&RC[19])&IF(RC[20]="",,"|n"&R1C[20]&RC[20])&IF(RC[21]="",,"|n"&R1C29&RC[21])&IF(RC[22]="",,"|n"&R1C[22]&RC[22])&IF(RC[24]="",,"|n"&R1C[24]&RC[24])&IF(RC[25]="",,"|n"&R1C[25]&RC[25])&IF(RC[26]="",,"|n"&R1C[26]&RC[26])&IF(RC[28]="",,"|n"&RC[28]) -> |n力量:200000 | R36: =VLOOKUP(RC[-14],其他!R1C1:R7C2,2,0)&RC[-7]&"|r" -> |cFF1BE6B8骑士套装-谦卑|r | U36: 200000
A37: 36 | B37: =VLOOKUP(RC[4],ITEM!R3C2:R82C6,5,0) -> 骑士 | C37: 5 | D37: =VLOOKUP(RC[2],ITEM!R3C2:R82C4,3,0) -> 3 | E37: =VLOOKUP(RC[1],ITEM!R3C2:R82C3,2,0) -> SY10 | F37: 骑士护肩 | G37: =VLOOKUP(RC[1],ITEM!R3C2:R82C3,2,0) -> SY11 | H37: 骑士腿甲 | I37: =VLOOKUP(RC[1],ITEM!R3C2:R82C3,2,0) -> SY12 | J37: 骑士头饰 | K37: 骑士套装-坚毅 | M37: ST10 | N37: SB10 | O37: ="blp\suitItem\"&IF(RC[-12]>=10,"","0")&RC[-12]&" (1) .blp" -> blp\suitItem\05 (1) .blp | P37: ="new AffixItemLinkEntity("&RC[-12]&",'"&RC[-11]&"',"""&RC[-10]&""",'"&RC[-9]&"',"""&RC[-8]&""&""",'"&RC[-7]&"',"""&RC[-6]&""","""&RC[-14]&""","""&RC[-5]&""",'"&RC[-2]&"'"&")" -> new AffixItemLinkEntity(3,'SY10',"骑士护肩",'SY11',"骑士腿甲",'SY12',"骑士头饰","骑士","骑士套装-坚毅",'SB10') | Q37: =IF(RC[-5]<>"","|n"&RC[-5],"")&IF(RC[3]="",,"|n"&R1C[3]&RC[3])&IF(RC[4]="",,"|n"&R1C[4]&RC[4])&IF(RC[5]="",,"|n"&R1C[5]&RC[5])&IF(RC[6]="",,"|n"&R1C[6]&RC[6])&IF(RC[7]="",,"|n"&R1C[7]&RC[7])&IF(RC[8]="",,"|n"&R1C[8]&RC[8])&IF(RC[10]="",,"|n"&R1C[10]&RC[10])&IF(RC[11]="",,"|n"&R1C[11]&RC[11])&IF(RC[12]="",,"|n"&R1C[12]&RC[12])&IF(RC[13]="",,"|n"&R1C[13]&RC[13])&IF(RC[14]="",,"|n"&R1C[14]&RC[14])&IF(RC[15]="",,"|n"&R1C[15]&RC[15])&IF(RC[16]="",,"|n"&R1C[16]&RC[16])&IF(RC[17]="",,"|n"&R1C[17]&RC[17])&IF(RC[18]="",,"|n"&R1C[18]&RC[18])&IF(RC[19]="",,"|n"&R1C[19]&RC[19])&IF(RC[20]="",,"|n"&R1C[20]&RC[20])&IF(RC[21]="",,"|n"&R1C29&RC[21])&IF(RC[22]="",,"|n"&R1C[22]&RC[22])&IF(RC[24]="",,"|n"&R1C[24]&RC[24])&IF(RC[25]="",,"|n"&R1C[25]&RC[25])&IF(RC[26]="",,"|n"&R1C[26]&RC[26])&IF(RC[28]="",,"|n"&RC[28]) -> |n敏捷:200000 | R37: =VLOOKUP(RC[-14],其他!R1C1:R7C2,2,0)&RC[-7]&"|r" -> |cFF1BE6B8骑士套装-坚毅|r | V37: 200000
A38: 37 | B38: =VLOOKUP(RC[4],ITEM!R3C2:R82C6,5,0) -> 骑士 | C38: 5 | D38: =VLOOKUP(RC[2],ITEM!R3C2:R82C4,3,0) -> 3 | E38: =VLOOKUP(RC[1],ITEM!R3C2:R82C3,2,0) -> SY11 | F38: 骑士腿甲 | G38: =VLOOKUP(RC[1],ITEM!R3C2:R82C3,2,0) -> SY12 | H38: 骑士头饰 | I38: =VLOOKUP(RC[1],ITEM!R3C2:R82C3,2,0) -> SY13 | J38: 骑士战靴 | K38: 骑士套装-忠诚 | M38: ST11 | N38: SB11 | O38: ="blp\suitItem\"&IF(RC[-12]>=10,"","0")&RC[-12]&" (1) .blp" -> blp\suitItem\05 (1) .blp | P38: ="new AffixItemLinkEntity("&RC[-12]&",'"&RC[-11]&"',"""&RC[-10]&""",'"&RC[-9]&"',"""&RC[-8]&""&""",'"&RC[-7]&"',"""&RC[-6]&""","""&RC[-14]&""","""&RC[-5]&""",'"&RC[-2]&"'"&")" -> new AffixItemLinkEntity(3,'SY11',"骑士腿甲",'SY12',"骑士头饰",'SY13',"骑士战靴","骑士","骑士套装-忠诚",'SB11') | Q38: =IF(RC[-5]<>"","|n"&RC[-5],"")&IF(RC[3]="",,"|n"&R1C[3]&RC[3])&IF(RC[4]="",,"|n"&R1C[4]&RC[4])&IF(RC[5]="",,"|n"&R1C[5]&RC[5])&IF(RC[6]="",,"|n"&R1C[6]&RC[6])&IF(RC[7]="",,"|n"&R1C[7]&RC[7])&IF(RC[8]="",,"|n"&R1C[8]&RC[8])&IF(RC[10]="",,"|n"&R1C[10]&RC[10])&IF(RC[11]="",,"|n"&R1C[11]&RC[11])&IF(RC[12]="",,"|n"&R1C[12]&RC[12])&IF(RC[13]="",,"|n"&R1C[13]&RC[13])&IF(RC[14]="",,"|n"&R1C[14]&RC[14])&IF(RC[15]="",,"|n"&R1C[15]&RC[15])&IF(RC[16]="",,"|n"&R1C[16]&RC[16])&IF(RC[17]="",,"|n"&R1C[17]&RC[17])&IF(RC[18]="",,"|n"&R1C[18]&RC[18])&IF(RC[19]="",,"|n"&R1C[19]&RC[19])&IF(RC[20]="",,"|n"&R1C[20]&RC[20])&IF(RC[21]="",,"|n"&R1C29&RC[21])&IF(RC[22]="",,"|n"&R1C[22]&RC[22])&IF(RC[24]="",,"|n"&R1C[24]&RC[24])&IF(RC[25]="",,"|n"&R1C[25]&RC[25])&IF(RC[26]="",,"|n"&R1C[26]&RC[26])&IF(RC[28]="",,"|n"&RC[28]) -> |n智力:200000 | R38: =VLOOKUP(RC[-14],其他!R1C1:R7C2,2,0)&RC[-7]&"|r" -> |cFF1BE6B8骑士套装-忠诚|r | W38: 200000
A39: 38 | B39: =VLOOKUP(RC[4],ITEM!R3C2:R82C6,5,0) -> 骑士 | C39: 5 | D39: =VLOOKUP(RC[2],ITEM!R3C2:R82C4,3,0) -> 3 | E39: =VLOOKUP(RC[1],ITEM!R3C2:R82C3,2,0) -> SY12 | F39: 骑士头饰 | G39: =VLOOKUP(RC[1],ITEM!R3C2:R82C3,2,0) -> SY13 | H39: 骑士战靴 | I39: =VLOOKUP(RC[1],ITEM!R3C2:R82C3,2,0) -> SY14 | J39: 骑士腰带 | K39: 骑士套装-虔诚 | M39: ST12 | N39: SB12 | O39: ="blp\suitItem\"&IF(RC[-12]>=10,"","0")&RC[-12]&" (1) .blp" -> blp\suitItem\05 (1) .blp | P39: ="new AffixItemLinkEntity("&RC[-12]&",'"&RC[-11]&"',"""&RC[-10]&""",'"&RC[-9]&"',"""&RC[-8]&""&""",'"&RC[-7]&"',"""&RC[-6]&""","""&RC[-14]&""","""&RC[-5]&""",'"&RC[-2]&"'"&")" -> new AffixItemLinkEntity(3,'SY12',"骑士头饰",'SY13',"骑士战靴",'SY14',"骑士腰带","骑士","骑士套装-虔诚",'SB12') | Q39: =IF(RC[-5]<>"","|n"&RC[-5],"")&IF(RC[3]="",,"|n"&R1C[3]&RC[3])&IF(RC[4]="",,"|n"&R1C[4]&RC[4])&IF(RC[5]="",,"|n"&R1C[5]&RC[5])&IF(RC[6]="",,"|n"&R1C[6]&RC[6])&IF(RC[7]="",,"|n"&R1C[7]&RC[7])&IF(RC[8]="",,"|n"&R1C[8]&RC[8])&IF(RC[10]="",,"|n"&R1C[10]&RC[10])&IF(RC[11]="",,"|n"&R1C[11]&RC[11])&IF(RC[12]="",,"|n"&R1C[12]&RC[12])&IF(RC[13]="",,"|n"&R1C[13]&RC[13])&IF(RC[14]="",,"|n"&R1C[14]&RC[14])&IF(RC[15]="",,"|n"&R1C[15]&RC[15])&IF(RC[16]="",,"|n"&R1C[16]&RC[16])&IF(RC[17]="",,"|n"&R1C[17]&RC[17])&IF(RC[18]="",,"|n"&R1C[18]&RC[18])&IF(RC[19]="",,"|n"&R1C[19]&RC[19])&IF(RC[20]="",,"|n"&R1C[20]&RC[20])&IF(RC[21]="",,"|n"&R1C29&RC[21])&IF(RC[22]="",,"|n"&R1C[22]&RC[22])&IF(RC[24]="",,"|n"&R1C[24]&RC[24])&IF(RC[25]="",,"|n"&R1C[25]&RC[25])&IF(RC[26]="",,"|n"&R1C[26]&RC[26])&IF(RC[28]="",,"|n"&RC[28]) -> |n力量:120000|n敏捷:120000|n智力:120000 | R39: =VLOOKUP(RC[-14],其他!R1C1:R7C2,2,0)&RC[-7]&"|r" -> |cFF1BE6B8骑士套装-虔诚|r | U39: 120000 | V39: 120000 | W39: 120000
A40: 39 | B40: =VLOOKUP(RC[4],ITEM!R3C2:R82C6,5,0) -> 骑士 | C40: 5 | D40: =VLOOKUP(RC[2],ITEM!R3C2:R82C4,3,0) -> 3 | E40: =VLOOKUP(RC[1],ITEM!R3C2:R82C3,2,0) -> SY13 | F40: 骑士战靴 | G40: =VLOOKUP(RC[1],ITEM!R3C2:R82C3,2,0) -> SY14 | H40: 骑士腰带 | I40: =VLOOKUP(RC[1],ITEM!R3C2:R82C3,2,0) -> SY0X | J40: 骑士长刃 | K40: 骑士套装-信仰 | M40: ST13 | N40: SB13 | O40: ="blp\suitItem\"&IF(RC[-12]>=10,"","0")&RC[-12]&" (1) .blp" -> blp\suitItem\05 (1) .blp | P40: ="new AffixItemLinkEntity("&RC[-12]&",'"&RC[-11]&"',"""&RC[-10]&""",'"&RC[-9]&"',"""&RC[-8]&""&""",'"&RC[-7]&"',"""&RC[-6]&""","""&RC[-14]&""","""&RC[-5]&""",'"&RC[-2]&"'"&")" -> new AffixItemLinkEntity(3,'SY13',"骑士战靴",'SY14',"骑士腰带",'SY0X',"骑士长刃","骑士","骑士套装-信仰",'SB13') | Q40: =IF(RC[-5]<>"","|n"&RC[-5],"")&IF(RC[3]="",,"|n"&R1C[3]&RC[3])&IF(RC[4]="",,"|n"&R1C[4]&RC[4])&IF(RC[5]="",,"|n"&R1C[5]&RC[5])&IF(RC[6]="",,"|n"&R1C[6]&RC[6])&IF(RC[7]="",,"|n"&R1C[7]&RC[7])&IF(RC[8]="",,"|n"&R1C[8]&RC[8])&IF(RC[10]="",,"|n"&R1C[10]&RC[10])&IF(RC[11]="",,"|n"&R1C[11]&RC[11])&IF(RC[12]="",,"|n"&R1C[12]&RC[12])&IF(RC[13]="",,"|n"&R1C[13]&RC[13])&IF(RC[14]="",,"|n"&R1C[14]&RC[14])&IF(RC[15]="",,"|n"&R1C[15]&RC[15])&IF(RC[16]="",,"|n"&R1C[16]&RC[16])&IF(RC[17]="",,"|n"&R1C[17]&RC[17])&IF(RC[18]="",,"|n"&R1C[18]&RC[18])&IF(RC[19]="",,"|n"&R1C[19]&RC[19])&IF(RC[20]="",,"|n"&R1C[20]&RC[20])&IF(RC[21]="",,"|n"&R1C29&RC[21])&IF(RC[22]="",,"|n"&R1C[22]&RC[22])&IF(RC[24]="",,"|n"&R1C[24]&RC[24])&IF(RC[25]="",,"|n"&R1C[25]&RC[25])&IF(RC[26]="",,"|n"&R1C[26]&RC[26])&IF(RC[28]="",,"|n"&RC[28]) -> |n护甲:100000 | R40: =VLOOKUP(RC[-14],其他!R1C1:R7C2,2,0)&RC[-7]&"|r" -> |cFF1BE6B8骑士套装-信仰|r | Y40: 100000
A41: 40 | B41: =VLOOKUP(RC[4],ITEM!R3C2:R82C6,5,0) -> 骑士 | C41: 5 | D41: =VLOOKUP(RC[2],ITEM!R3C2:R82C4,3,0) -> 3 | E41: =VLOOKUP(RC[1],ITEM!R3C2:R82C3,2,0) -> SY14 | F41: 骑士腰带 | G41: =VLOOKUP(RC[1],ITEM!R3C2:R82C3,2,0) -> SY0X | H41: 骑士长刃 | I41: =VLOOKUP(RC[1],ITEM!R3C2:R82C3,2,0) -> SY0Y | J41: 骑士胸甲 | K41: 骑士套装-灵魂 | M41: ST14 | N41: SB14 | O41: ="blp\suitItem\"&IF(RC[-12]>=10,"","0")&RC[-12]&" (1) .blp" -> blp\suitItem\05 (1) .blp | P41: ="new AffixItemLinkEntity("&RC[-12]&",'"&RC[-11]&"',"""&RC[-10]&""",'"&RC[-9]&"',"""&RC[-8]&""&""",'"&RC[-7]&"',"""&RC[-6]&""","""&RC[-14]&""","""&RC[-5]&""",'"&RC[-2]&"'"&")" -> new AffixItemLinkEntity(3,'SY14',"骑士腰带",'SY0X',"骑士长刃",'SY0Y',"骑士胸甲","骑士","骑士套装-灵魂",'SB14') | Q41: =IF(RC[-5]<>"","|n"&RC[-5],"")&IF(RC[3]="",,"|n"&R1C[3]&RC[3])&IF(RC[4]="",,"|n"&R1C[4]&RC[4])&IF(RC[5]="",,"|n"&R1C[5]&RC[5])&IF(RC[6]="",,"|n"&R1C[6]&RC[6])&IF(RC[7]="",,"|n"&R1C[7]&RC[7])&IF(RC[8]="",,"|n"&R1C[8]&RC[8])&IF(RC[10]="",,"|n"&R1C[10]&RC[10])&IF(RC[11]="",,"|n"&R1C[11]&RC[11])&IF(RC[12]="",,"|n"&R1C[12]&RC[12])&IF(RC[13]="",,"|n"&R1C[13]&RC[13])&IF(RC[14]="",,"|n"&R1C[14]&RC[14])&IF(RC[15]="",,"|n"&R1C[15]&RC[15])&IF(RC[16]="",,"|n"&R1C[16]&RC[16])&IF(RC[17]="",,"|n"&R1C[17]&RC[17])&IF(RC[18]="",,"|n"&R1C[18]&RC[18])&IF(RC[19]="",,"|n"&R1C[19]&RC[19])&IF(RC[20]="",,"|n"&R1C[20]&RC[20])&IF(RC[21]="",,"|n"&R1C29&RC[21])&IF(RC[22]="",,"|n"&R1C[22]&RC[22])&IF(RC[24]="",,"|n"&R1C[24]&RC[24])&IF(RC[25]="",,"|n"&R1C[25]&RC[25])&IF(RC[26]="",,"|n"&R1C[26]&RC[26])&IF(RC[28]="",,"|n"&RC[28]) -> |n攻速:50 | R41: =VLOOKUP(RC[-14],其他!R1C1:R7C2,2,0)&RC[-7]&"|r" -> |cFF1BE6B8骑士套装-灵魂|r | AA41: 50
A42: 41 | B42: =VLOOKUP(RC[4],ITEM!R3C2:R82C6,5,0) -> 领主 | C42: 6 | D42: =VLOOKUP(RC[2],ITEM!R3C2:R82C4,3,0) -> 3 | E42: =VLOOKUP(RC[1],ITEM!R3C2:R82C3,2,0) -> SY15 | F42: 领主长刃 | G42: =VLOOKUP(RC[1],ITEM!R3C2:R82C3,2,0) -> SY16 | H42: 领主胸甲 | I42: =VLOOKUP(RC[1],ITEM!R3C2:R82C3,2,0) -> SY17 | J42: 领主护手 | K42: 领主套装-独断 | L42: 1 | M42: ST15 | N42: SB15 | O42: ="blp\suitItem\"&IF(RC[-12]>=10,"","0")&RC[-12]&" (1) .blp" -> blp\suitItem\06 (1) .blp | P42: ="new AffixItemLinkEntity("&RC[-12]&",'"&RC[-11]&"',"""&RC[-10]&""",'"&RC[-9]&"',"""&RC[-8]&""&""",'"&RC[-7]&"',"""&RC[-6]&""","""&RC[-14]&""","""&RC[-5]&""",'"&RC[-2]&"'"&")" -> new AffixItemLinkEntity(3,'SY15',"领主长刃",'SY16',"领主胸甲",'SY17',"领主护手","领主","领主套装-独断",'SB15') | Q42: =IF(RC[-5]<>"","|n"&RC[-5],"")&IF(RC[3]="",,"|n"&R1C[3]&RC[3])&IF(RC[4]="",,"|n"&R1C[4]&RC[4])&IF(RC[5]="",,"|n"&R1C[5]&RC[5])&IF(RC[6]="",,"|n"&R1C[6]&RC[6])&IF(RC[7]="",,"|n"&R1C[7]&RC[7])&IF(RC[8]="",,"|n"&R1C[8]&RC[8])&IF(RC[10]="",,"|n"&R1C[10]&RC[10])&IF(RC[11]="",,"|n"&R1C[11]&RC[11])&IF(RC[12]="",,"|n"&R1C[12]&RC[12])&IF(RC[13]="",,"|n"&R1C[13]&RC[13])&IF(RC[14]="",,"|n"&R1C[14]&RC[14])&IF(RC[15]="",,"|n"&R1C[15]&RC[15])&IF(RC[16]="",,"|n"&R1C[16]&RC[16])&IF(RC[17]="",,"|n"&R1C[17]&RC[17])&IF(RC[18]="",,"|n"&R1C[18]&RC[18])&IF(RC[19]="",,"|n"&R1C[19]&RC[19])&IF(RC[20]="",,"|n"&R1C[20]&RC[20])&IF(RC[21]="",,"|n"&R1C29&RC[21])&IF(RC[22]="",,"|n"&R1C[22]&RC[22])&IF(RC[24]="",,"|n"&R1C[24]&RC[24])&IF(RC[25]="",,"|n"&R1C[25]&RC[25])&IF(RC[26]="",,"|n"&R1C[26]&RC[26])&IF(RC[28]="",,"|n"&RC[28]) -> |n1 | R42: =VLOOKUP(RC[-14],其他!R1C1:R7C2,2,0)&RC[-7]&"|r" -> |cFF1BE6B8领主套装-独断|r
A43: 42 | B43: =VLOOKUP(RC[4],ITEM!R3C2:R82C6,5,0) -> 领主 | C43: 6 | D43: =VLOOKUP(RC[2],ITEM!R3C2:R82C4,3,0) -> 3 | E43: =VLOOKUP(RC[1],ITEM!R3C2:R82C3,2,0) -> SY16 | F43: 领主胸甲 | G43: =VLOOKUP(RC[1],ITEM!R3C2:R82C3,2,0) -> SY17 | H43: 领主护手 | I43: =VLOOKUP(RC[1],ITEM!R3C2:R82C3,2,0) -> SY18 | J43: 领主护肩 | K43: 领主套装-堕落 | L43: 1 | M43: ST16 | N43: SB16 | O43: ="blp\suitItem\"&IF(RC[-12]>=10,"","0")&RC[-12]&" (1) .blp" -> blp\suitItem\06 (1) .blp | P43: ="new AffixItemLinkEntity("&RC[-12]&",'"&RC[-11]&"',"""&RC[-10]&""",'"&RC[-9]&"',"""&RC[-8]&""&""",'"&RC[-7]&"',"""&RC[-6]&""","""&RC[-14]&""","""&RC[-5]&""",'"&RC[-2]&"'"&")" -> new AffixItemLinkEntity(3,'SY16',"领主胸甲",'SY17',"领主护手",'SY18',"领主护肩","领主","领主套装-堕落",'SB16') | Q43: =IF(RC[-5]<>"","|n"&RC[-5],"")&IF(RC[3]="",,"|n"&R1C[3]&RC[3])&IF(RC[4]="",,"|n"&R1C[4]&RC[4])&IF(RC[5]="",,"|n"&R1C[5]&RC[5])&IF(RC[6]="",,"|n"&R1C[6]&RC[6])&IF(RC[7]="",,"|n"&R1C[7]&RC[7])&IF(RC[8]="",,"|n"&R1C[8]&RC[8])&IF(RC[10]="",,"|n"&R1C[10]&RC[10])&IF(RC[11]="",,"|n"&R1C[11]&RC[11])&IF(RC[12]="",,"|n"&R1C[12]&RC[12])&IF(RC[13]="",,"|n"&R1C[13]&RC[13])&IF(RC[14]="",,"|n"&R1C[14]&RC[14])&IF(RC[15]="",,"|n"&R1C[15]&RC[15])&IF(RC[16]="",,"|n"&R1C[16]&RC[16])&IF(RC[17]="",,"|n"&R1C[17]&RC[17])&IF(RC[18]="",,"|n"&R1C[18]&RC[18])&IF(RC[19]="",,"|n"&R1C[19]&RC[19])&IF(RC[20]="",,"|n"&R1C[20]&RC[20])&IF(RC[21]="",,"|n"&R1C29&RC[21])&IF(RC[22]="",,"|n"&R1C[22]&RC[22])&IF(RC[24]="",,"|n"&R1C[24]&RC[24])&IF(RC[25]="",,"|n"&R1C[25]&RC[25])&IF(RC[26]="",,"|n"&R1C[26]&RC[26])&IF(RC[28]="",,"|n"&RC[28]) -> |n1 | R43: =VLOOKUP(RC[-14],其他!R1C1:R7C2,2,0)&RC[-7]&"|r" -> |cFF1BE6B8领主套装-堕落|r
A44: 43 | B44: =VLOOKUP(RC[4],ITEM!R3C2:R82C6,5,0) -> 领主 | C44: 6 | D44: =VLOOKUP(RC[2],ITEM!R3C2:R82C4,3,0) -> 3 | E44: =VLOOKUP(RC[1],ITEM!R3C2:R82C3,2,0) -> SY17 | F44: 领主护手 | G44: =VLOOKUP(RC[1],ITEM!R3C2:R82C3,2,0) -> SY18 | H44: 领主护肩 | I44: =VLOOKUP(RC[1],ITEM!R3C2:R82C3,2,0) -> SY19 | J44: 领主腿甲 | K44: 领主套装-野心 | L44: 1 | M44: ST17 | N44: SB17 | O44: ="blp\suitItem\"&IF(RC[-12]>=10,"","0")&RC[-12]&" (1) .blp" -> blp\suitItem\06 (1) .blp | P44: ="new AffixItemLinkEntity("&RC[-12]&",'"&RC[-11]&"',"""&RC[-10]&""",'"&RC[-9]&"',"""&RC[-8]&""&""",'"&RC[-7]&"',"""&RC[-6]&""","""&RC[-14]&""","""&RC[-5]&""",'"&RC[-2]&"'"&")" -> new AffixItemLinkEntity(3,'SY17',"领主护手",'SY18',"领主护肩",'SY19',"领主腿甲","领主","领主套装-野心",'SB17') | Q44: =IF(RC[-5]<>"","|n"&RC[-5],"")&IF(RC[3]="",,"|n"&R1C[3]&RC[3])&IF(RC[4]="",,"|n"&R1C[4]&RC[4])&IF(RC[5]="",,"|n"&R1C[5]&RC[5])&IF(RC[6]="",,"|n"&R1C[6]&RC[6])&IF(RC[7]="",,"|n"&R1C[7]&RC[7])&IF(RC[8]="",,"|n"&R1C[8]&RC[8])&IF(RC[10]="",,"|n"&R1C[10]&RC[10])&IF(RC[11]="",,"|n"&R1C[11]&RC[11])&IF(RC[12]="",,"|n"&R1C[12]&RC[12])&IF(RC[13]="",,"|n"&R1C[13]&RC[13])&IF(RC[14]="",,"|n"&R1C[14]&RC[14])&IF(RC[15]="",,"|n"&R1C[15]&RC[15])&IF(RC[16]="",,"|n"&R1C[16]&RC[16])&IF(RC[17]="",,"|n"&R1C[17]&RC[17])&IF(RC[18]="",,"|n"&R1C[18]&RC[18])&IF(RC[19]="",,"|n"&R1C[19]&RC[19])&IF(RC[20]="",,"|n"&R1C[20]&RC[20])&IF(RC[21]="",,"|n"&R1C29&RC[21])&IF(RC[22]="",,"|n"&R1C[22]&RC[22])&IF(RC[24]="",,"|n"&R1C[24]&RC[24])&IF(RC[25]="",,"|n"&R1C[25]&RC[25])&IF(RC[26]="",,"|n"&R1C[26]&RC[26])&IF(RC[28]="",,"|n"&RC[28]) -> |n1 | R44: =VLOOKUP(RC[-14],其他!R1C1:R7C2,2,0)&RC[-7]&"|r" -> |cFF1BE6B8领主套装-野心|r
A45: 44 | B45: =VLOOKUP(RC[4],ITEM!R3C2:R82C6,5,0) -> 领主 | C45: 6 | D45: =VLOOKUP(RC[2],ITEM!R3C2:R82C4,3,0) -> 3 | E45: =VLOOKUP(RC[1],ITEM!R3C2:R82C3,2,0) -> SY18 | F45: 领主护肩 | G45: =VLOOKUP(RC[1],ITEM!R3C2:R82C3,2,0) -> SY19 | H45: 领主腿甲 | I45: =VLOOKUP(RC[1],ITEM!R3C2:R82C3,2,0) -> SY1A | J45: 领主头饰 | K45: 领主套装-无耻 | L45: 1 | M45: ST18 | N45: SB18 | O45: ="blp\suitItem\"&IF(RC[-12]>=10,"","0")&RC[-12]&" (1) .blp" -> blp\suitItem\06 (1) .blp | P45: ="new AffixItemLinkEntity("&RC[-12]&",'"&RC[-11]&"',"""&RC[-10]&""",'"&RC[-9]&"',"""&RC[-8]&""&""",'"&RC[-7]&"',"""&RC[-6]&""","""&RC[-14]&""","""&RC[-5]&""",'"&RC[-2]&"'"&")" -> new AffixItemLinkEntity(3,'SY18',"领主护肩",'SY19',"领主腿甲",'SY1A',"领主头饰","领主","领主套装-无耻",'SB18') | Q45: =IF(RC[-5]<>"","|n"&RC[-5],"")&IF(RC[3]="",,"|n"&R1C[3]&RC[3])&IF(RC[4]="",,"|n"&R1C[4]&RC[4])&IF(RC[5]="",,"|n"&R1C[5]&RC[5])&IF(RC[6]="",,"|n"&R1C[6]&RC[6])&IF(RC[7]="",,"|n"&R1C[7]&RC[7])&IF(RC[8]="",,"|n"&R1C[8]&RC[8])&IF(RC[10]="",,"|n"&R1C[10]&RC[10])&IF(RC[11]="",,"|n"&R1C[11]&RC[11])&IF(RC[12]="",,"|n"&R1C[12]&RC[12])&IF(RC[13]="",,"|n"&R1C[13]&RC[13])&IF(RC[14]="",,"|n"&R1C[14]&RC[14])&IF(RC[15]="",,"|n"&R1C[15]&RC[15])&IF(RC[16]="",,"|n"&R1C[16]&RC[16])&IF(RC[17]="",,"|n"&R1C[17]&RC[17])&IF(RC[18]="",,"|n"&R1C[18]&RC[18])&IF(RC[19]="",,"|n"&R1C[19]&RC[19])&IF(RC[20]="",,"|n"&R1C[20]&RC[20])&IF(RC[21]="",,"|n"&R1C29&RC[21])&IF(RC[22]="",,"|n"&R1C[22]&RC[22])&IF(RC[24]="",,"|n"&R1C[24]&RC[24])&IF(RC[25]="",,"|n"&R1C[25]&RC[25])&IF(RC[26]="",,"|n"&R1C[26]&RC[26])&IF(RC[28]="",,"|n"&RC[28]) -> |n1 | R45: =VLOOKUP(RC[-14],其他!R1C1:R7C2,2,0)&RC[-7]&"|r" -> |cFF1BE6B8领主套装-无耻|r
A46: 45 | B46: =VLOOKUP(RC[4],ITEM!R3C2:R82C6,5,0) -> 领主 | C46: 6 | D46: =VLOOKUP(RC[2],ITEM!R3C2:R82C4,3,0) -> 3 | E46: =VLOOKUP(RC[1],ITEM!R3C2:R82C3,2,0) -> SY19 | F46: 领主腿甲 | G46: =VLOOKUP(RC[1],ITEM!R3C2:R82C3,2,0) -> SY1A | H46: 领主头饰 | I46: =VLOOKUP(RC[1],ITEM!R3C2:R82C3,2,0) -> SY1B | J46: 领主战靴 | K46: 领主套装-昏庸 | L46: 无视独立闪避 | M46: ST19 | N46: SB19 | O46: ="blp\suitItem\"&IF(RC[-12]>=10,"","0")&RC[-12]&" (1) .blp" -> blp\suitItem\06 (1) .blp | P46: ="new AffixItemLinkEntity("&RC[-12]&",'"&RC[-11]&"',"""&RC[-10]&""",'"&RC[-9]&"',"""&RC[-8]&""&""",'"&RC[-7]&"',"""&RC[-6]&""","""&RC[-14]&""","""&RC[-5]&""",'"&RC[-2]&"'"&")" -> new AffixItemLinkEntity(3,'SY19',"领主腿甲",'SY1A',"领主头饰",'SY1B',"领主战靴","领主","领主套装-昏庸",'SB19') | Q46: =IF(RC[-5]<>"","|n"&RC[-5],"")&IF(RC[3]="",,"|n"&R1C[3]&RC[3])&IF(RC[4]="",,"|n"&R1C[4]&RC[4])&IF(RC[5]="",,"|n"&R1C[5]&RC[5])&IF(RC[6]="",,"|n"&R1C[6]&RC[6])&IF(RC[7]="",,"|n"&R1C[7]&RC[7])&IF(RC[8]="",,"|n"&R1C[8]&RC[8])&IF(RC[10]="",,"|n"&R1C[10]&RC[10])&IF(RC[11]="",,"|n"&R1C[11]&RC[11])&IF(RC[12]="",,"|n"&R1C[12]&RC[12])&IF(RC[13]="",,"|n"&R1C[13]&RC[13])&IF(RC[14]="",,"|n"&R1C[14]&RC[14])&IF(RC[15]="",,"|n"&R1C[15]&RC[15])&IF(RC[16]="",,"|n"&R1C[16]&RC[16])&IF(RC[17]="",,"|n"&R1C[17]&RC[17])&IF(RC[18]="",,"|n"&R1C[18]&RC[18])&IF(RC[19]="",,"|n"&R1C[19]&RC[19])&IF(RC[20]="",,"|n"&R1C[20]&RC[20])&IF(RC[21]="",,"|n"&R1C29&RC[21])&IF(RC[22]="",,"|n"&R1C[22]&RC[22])&IF(RC[24]="",,"|n"&R1C[24]&RC[24])&IF(RC[25]="",,"|n"&R1C[25]&RC[25])&IF(RC[26]="",,"|n"&R1C[26]&RC[26])&IF(RC[28]="",,"|n"&RC[28]) -> |n无视独立闪避 | R46: =VLOOKUP(RC[-14],其他!R1C1:R7C2,2,0)&RC[-7]&"|r" -> |cFF1BE6B8领主套装-昏庸|r
A47: 46 | B47: =VLOOKUP(RC[4],ITEM!R3C2:R82C6,5,0) -> 领主 | C47: 6 | D47: =VLOOKUP(RC[2],ITEM!R3C2:R82C4,3,0) -> 3 | E47: =VLOOKUP(RC[1],ITEM!R3C2:R82C3,2,0) -> SY1A | F47: 领主头饰 | G47: =VLOOKUP(RC[1],ITEM!R3C2:R82C3,2,0) -> SY1B | H47: 领主战靴 | I47: =VLOOKUP(RC[1],ITEM!R3C2:R82C3,2,0) -> SY1C | J47: 领主腰带 | K47: 领主套装-虚荣 | L47: 攻击时1%重置技能CD | M47: ST1A | N47: SB1A | O47: ="blp\suitItem\"&IF(RC[-12]>=10,"","0")&RC[-12]&" (1) .blp" -> blp\suitItem\06 (1) .blp | P47: ="new AffixItemLinkEntity("&RC[-12]&",'"&RC[-11]&"',"""&RC[-10]&""",'"&RC[-9]&"',"""&RC[-8]&""&""",'"&RC[-7]&"',"""&RC[-6]&""","""&RC[-14]&""","""&RC[-5]&""",'"&RC[-2]&"'"&")" -> new AffixItemLinkEntity(3,'SY1A',"领主头饰",'SY1B',"领主战靴",'SY1C',"领主腰带","领主","领主套装-虚荣",'SB1A') | Q47: =IF(RC[-5]<>"","|n"&RC[-5],"")&IF(RC[3]="",,"|n"&R1C[3]&RC[3])&IF(RC[4]="",,"|n"&R1C[4]&RC[4])&IF(RC[5]="",,"|n"&R1C[5]&RC[5])&IF(RC[6]="",,"|n"&R1C[6]&RC[6])&IF(RC[7]="",,"|n"&R1C[7]&RC[7])&IF(RC[8]="",,"|n"&R1C[8]&RC[8])&IF(RC[10]="",,"|n"&R1C[10]&RC[10])&IF(RC[11]="",,"|n"&R1C[11]&RC[11])&IF(RC[12]="",,"|n"&R1C[12]&RC[12])&IF(RC[13]="",,"|n"&R1C[13]&RC[13])&IF(RC[14]="",,"|n"&R1C[14]&RC[14])&IF(RC[15]="",,"|n"&R1C[15]&RC[15])&IF(RC[16]="",,"|n"&R1C[16]&RC[16])&IF(RC[17]="",,"|n"&R1C[17]&RC[17])&IF(RC[18]="",,"|n"&R1C[18]&RC[18])&IF(RC[19]="",,"|n"&R1C[19]&RC[19])&IF(RC[20]="",,"|n"&R1C[20]&RC[20])&IF(RC[21]="",,"|n"&R1C29&RC[21])&IF(RC[22]="",,"|n"&R1C[22]&RC[22])&IF(RC[24]="",,"|n"&R1C[24]&RC[24])&IF(RC[25]="",,"|n"&R1C[25]&RC[25])&IF(RC[26]="",,"|n"&R1C[26]&RC[26])&IF(RC[28]="",,"|n"&RC[28]) -> |n攻击时1%重置技能CD | R47: =VLOOKUP(RC[-14],其他!R1C1:R7C2,2,0)&RC[-7]&"|r" -> |cFF1BE6B8领主套装-虚荣|r
A48: 47 | B48: =VLOOKUP(RC[4],ITEM!R3C2:R82C6,5,0) -> 领主 | C48: 6 | D48: =VLOOKUP(RC[2],ITEM!R3C2:R82C4,3,0) -> 3 | E48: =VLOOKUP(RC[1],ITEM!R3C2:R82C3,2,0) -> SY1B | F48: 领主战靴 | G48: =VLOOKUP(RC[1],ITEM!R3C2:R82C3,2,0) -> SY1C | H48: 领主腰带 | I48: =VLOOKUP(RC[1],ITEM!R3C2:R82C3,2,0) -> SY15 | J48: 领主长刃 | K48: 领主套装-伪善 | L48: 被攻击时5%恢复5%生命值 | M48: ST1B | N48: SB1B | O48: ="blp\suitItem\"&IF(RC[-12]>=10,"","0")&RC[-12]&" (1) .blp" -> blp\suitItem\06 (1) .blp | P48: ="new AffixItemLinkEntity("&RC[-12]&",'"&RC[-11]&"',"""&RC[-10]&""",'"&RC[-9]&"',"""&RC[-8]&""&""",'"&RC[-7]&"',"""&RC[-6]&""","""&RC[-14]&""","""&RC[-5]&""",'"&RC[-2]&"'"&")" -> new AffixItemLinkEntity(3,'SY1B',"领主战靴",'SY1C',"领主腰带",'SY15',"领主长刃","领主","领主套装-伪善",'SB1B') | Q48: =IF(RC[-5]<>"","|n"&RC[-5],"")&IF(RC[3]="",,"|n"&R1C[3]&RC[3])&IF(RC[4]="",,"|n"&R1C[4]&RC[4])&IF(RC[5]="",,"|n"&R1C[5]&RC[5])&IF(RC[6]="",,"|n"&R1C[6]&RC[6])&IF(RC[7]="",,"|n"&R1C[7]&RC[7])&IF(RC[8]="",,"|n"&R1C[8]&RC[8])&IF(RC[10]="",,"|n"&R1C[10]&RC[10])&IF(RC[11]="",,"|n"&R1C[11]&RC[11])&IF(RC[12]="",,"|n"&R1C[12]&RC[12])&IF(RC[13]="",,"|n"&R1C[13]&RC[13])&IF(RC[14]="",,"|n"&R1C[14]&RC[14])&IF(RC[15]="",,"|n"&R1C[15]&RC[15])&IF(RC[16]="",,"|n"&R1C[16]&RC[16])&IF(RC[17]="",,"|n"&R1C[17]&RC[17])&IF(RC[18]="",,"|n"&R1C[18]&RC[18])&IF(RC[19]="",,"|n"&R1C[19]&RC[19])&IF(RC[20]="",,"|n"&R1C[20]&RC[20])&IF(RC[21]="",,"|n"&R1C29&RC[21])&IF(RC[22]="",,"|n"&R1C[22]&RC[22])&IF(RC[24]="",,"|n"&R1C[24]&RC[24])&IF(RC[25]="",,"|n"&R1C[25]&RC[25])&IF(RC[26]="",,"|n"&R1C[26]&RC[26])&IF(RC[28]="",,"|n"&RC[28]) -> |n被攻击时5%恢复5%生命值 | R48: =VLOOKUP(RC[-14],其他!R1C1:R7C2,2,0)&RC[-7]&"|r" -> |cFF1BE6B8领主套装-伪善|r
A49: 48 | B49: =VLOOKUP(RC[4],ITEM!R3C2:R82C6,5,0) -> 领主 | C49: 6 | D49: =VLOOKUP(RC[2],ITEM!R3C2:R82C4,3,0) -> 3 | E49: =VLOOKUP(RC[1],ITEM!R3C2:R82C3,2,0) -> SY1C | F49: 领主腰带 | G49: =VLOOKUP(RC[1],ITEM!R3C2:R82C3,2,0) -> SY15 | H49: 领主长刃 | I49: =VLOOKUP(RC[1],ITEM!R3C2:R82C3,2,0) -> SY16 | J49: 领主胸甲 | K49: 领主套装-阴险 | L49: 被攻击时3%重置CD | M49: ST1C | N49: SB1C | O49: ="blp\suitItem\"&IF(RC[-12]>=10,"","0")&RC[-12]&" (1) .blp" -> blp\suitItem\06 (1) .blp | P49: ="new AffixItemLinkEntity("&RC[-12]&",'"&RC[-11]&"',"""&RC[-10]&""",'"&RC[-9]&"',"""&RC[-8]&""&""",'"&RC[-7]&"',"""&RC[-6]&""","""&RC[-14]&""","""&RC[-5]&""",'"&RC[-2]&"'"&")" -> new AffixItemLinkEntity(3,'SY1C',"领主腰带",'SY15',"领主长刃",'SY16',"领主胸甲","领主","领主套装-阴险",'SB1C') | Q49: =IF(RC[-5]<>"","|n"&RC[-5],"")&IF(RC[3]="",,"|n"&R1C[3]&RC[3])&IF(RC[4]="",,"|n"&R1C[4]&RC[4])&IF(RC[5]="",,"|n"&R1C[5]&RC[5])&IF(RC[6]="",,"|n"&R1C[6]&RC[6])&IF(RC[7]="",,"|n"&R1C[7]&RC[7])&IF(RC[8]="",,"|n"&R1C[8]&RC[8])&IF(RC[10]="",,"|n"&R1C[10]&RC[10])&IF(RC[11]="",,"|n"&R1C[11]&RC[11])&IF(RC[12]="",,"|n"&R1C[12]&RC[12])&IF(RC[13]="",,"|n"&R1C[13]&RC[13])&IF(RC[14]="",,"|n"&R1C[14]&RC[14])&IF(RC[15]="",,"|n"&R1C[15]&RC[15])&IF(RC[16]="",,"|n"&R1C[16]&RC[16])&IF(RC[17]="",,"|n"&R1C[17]&RC[17])&IF(RC[18]="",,"|n"&R1C[18]&RC[18])&IF(RC[19]="",,"|n"&R1C[19]&RC[19])&IF(RC[20]="",,"|n"&R1C[20]&RC[20])&IF(RC[21]="",,"|n"&R1C29&RC[21])&IF(RC[22]="",,"|n"&R1C[22]&RC[22])&IF(RC[24]="",,"|n"&R1C[24]&RC[24])&IF(RC[25]="",,"|n"&R1C[25]&RC[25])&IF(RC[26]="",,"|n"&R1C[26]&RC[26])&IF(RC[28]="",,"|n"&RC[28]) -> |n被攻击时3%重置CD | R49: =VLOOKUP(RC[-14],其他!R1C1:R7C2,2,0)&RC[-7]&"|r" -> |cFF1BE6B8领主套装-阴险|r
A50: 49 | B50: =VLOOKUP(RC[4],ITEM!R3C2:R82C6,5,0) -> 战神 | C50: 7 | D50: =VLOOKUP(RC[2],ITEM!R3C2:R82C4,3,0) -> 4 | E50: =VLOOKUP(RC[1],ITEM!R3C2:R82C3,2,0) -> SY1D | F50: 战神长刃 | G50: =VLOOKUP(RC[1],ITEM!R3C2:R82C3,2,0) -> SY1E | H50: 战神胸甲 | I50: =VLOOKUP(RC[1],ITEM!R3C2:R82C3,2,0) -> SY1F | J50: 战神护手 | K50: 战神套装-赐福 | L50: 攻击时概率增加5%力量持续3秒 | M50: ST1D | N50: SB1D | O50: ="blp\suitItem\"&IF(RC[-12]>=10,"","0")&RC[-12]&" (1) .blp" -> blp\suitItem\07 (1) .blp | P50: ="new AffixItemLinkEntity("&RC[-12]&",'"&RC[-11]&"',"""&RC[-10]&""",'"&RC[-9]&"',"""&RC[-8]&""&""",'"&RC[-7]&"',"""&RC[-6]&""","""&RC[-14]&""","""&RC[-5]&""",'"&RC[-2]&"'"&")" -> new AffixItemLinkEntity(4,'SY1D',"战神长刃",'SY1E',"战神胸甲",'SY1F',"战神护手","战神","战神套装-赐福",'SB1D') | Q50: =IF(RC[-5]<>"","|n"&RC[-5],"")&IF(RC[3]="",,"|n"&R1C[3]&RC[3])&IF(RC[4]="",,"|n"&R1C[4]&RC[4])&IF(RC[5]="",,"|n"&R1C[5]&RC[5])&IF(RC[6]="",,"|n"&R1C[6]&RC[6])&IF(RC[7]="",,"|n"&R1C[7]&RC[7])&IF(RC[8]="",,"|n"&R1C[8]&RC[8])&IF(RC[10]="",,"|n"&R1C[10]&RC[10])&IF(RC[11]="",,"|n"&R1C[11]&RC[11])&IF(RC[12]="",,"|n"&R1C[12]&RC[12])&IF(RC[13]="",,"|n"&R1C[13]&RC[13])&IF(RC[14]="",,"|n"&R1C[14]&RC[14])&IF(RC[15]="",,"|n"&R1C[15]&RC[15])&IF(RC[16]="",,"|n"&R1C[16]&RC[16])&IF(RC[17]="",,"|n"&R1C[17]&RC[17])&IF(RC[18]="",,"|n"&R1C[18]&RC[18])&IF(RC[19]="",,"|n"&R1C[19]&RC[19])&IF(RC[20]="",,"|n"&R1C[20]&RC[20])&IF(RC[21]="",,"|n"&R1C29&RC[21])&IF(RC[22]="",,"|n"&R1C[22]&RC[22])&IF(RC[24]="",,"|n"&R1C[24]&RC[24])&IF(RC[25]="",,"|n"&R1C[25]&RC[25])&IF(RC[26]="",,"|n"&R1C[26]&RC[26])&IF(RC[28]="",,"|n"&RC[28]) -> |n攻击时概率增加5%力量持续3秒 | R50: =VLOOKUP(RC[-14],其他!R1C1:R7C2,2,0)&RC[-7]&"|r" -> |cFF33FF00战神套装-赐福|r
A51: 50 | B51: =VLOOKUP(RC[4],ITEM!R3C2:R82C6,5,0) -> 战神 | C51: 7 | D51: =VLOOKUP(RC[2],ITEM!R3C2:R82C4,3,0) -> 4 | E51: =VLOOKUP(RC[1],ITEM!R3C2:R82C3,2,0) -> SY1E | F51: 战神胸甲 | G51: =VLOOKUP(RC[1],ITEM!R3C2:R82C3,2,0) -> SY1F | H51: 战神护手 | I51: =VLOOKUP(RC[1],ITEM!R3C2:R82C3,2,0) -> SY1G | J51: 战神护肩 | K51: 战神套装-乐章 | L51: 攻击时概率增加5%智力持续3秒 | M51: ST1E | N51: SB1E | O51: ="blp\suitItem\"&IF(RC[-12]>=10,"","0")&RC[-12]&" (1) .blp" -> blp\suitItem\07 (1) .blp | P51: ="new AffixItemLinkEntity("&RC[-12]&",'"&RC[-11]&"',"""&RC[-10]&""",'"&RC[-9]&"',"""&RC[-8]&""&""",'"&RC[-7]&"',"""&RC[-6]&""","""&RC[-14]&""","""&RC[-5]&""",'"&RC[-2]&"'"&")" -> new AffixItemLinkEntity(4,'SY1E',"战神胸甲",'SY1F',"战神护手",'SY1G',"战神护肩","战神","战神套装-乐章",'SB1E') | Q51: =IF(RC[-5]<>"","|n"&RC[-5],"")&IF(RC[3]="",,"|n"&R1C[3]&RC[3])&IF(RC[4]="",,"|n"&R1C[4]&RC[4])&IF(RC[5]="",,"|n"&R1C[5]&RC[5])&IF(RC[6]="",,"|n"&R1C[6]&RC[6])&IF(RC[7]="",,"|n"&R1C[7]&RC[7])&IF(RC[8]="",,"|n"&R1C[8]&RC[8])&IF(RC[10]="",,"|n"&R1C[10]&RC[10])&IF(RC[11]="",,"|n"&R1C[11]&RC[11])&IF(RC[12]="",,"|n"&R1C[12]&RC[12])&IF(RC[13]="",,"|n"&R1C[13]&RC[13])&IF(RC[14]="",,"|n"&R1C[14]&RC[14])&IF(RC[15]="",,"|n"&R1C[15]&RC[15])&IF(RC[16]="",,"|n"&R1C[16]&RC[16])&IF(RC[17]="",,"|n"&R1C[17]&RC[17])&IF(RC[18]="",,"|n"&R1C[18]&RC[18])&IF(RC[19]="",,"|n"&R1C[19]&RC[19])&IF(RC[20]="",,"|n"&R1C[20]&RC[20])&IF(RC[21]="",,"|n"&R1C29&RC[21])&IF(RC[22]="",,"|n"&R1C[22]&RC[22])&IF(RC[24]="",,"|n"&R1C[24]&RC[24])&IF(RC[25]="",,"|n"&R1C[25]&RC[25])&IF(RC[26]="",,"|n"&R1C[26]&RC[26])&IF(RC[28]="",,"|n"&RC[28]) -> |n攻击时概率增加5%智力持续3秒 | R51: =VLOOKUP(RC[-14],其他!R1C1:R7C2,2,0)&RC[-7]&"|r" -> |cFF33FF00战神套装-乐章|r
A52: 51 | B52: =VLOOKUP(RC[4],ITEM!R3C2:R82C6,5,0) -> 战神 | C52: 7 | D52: =VLOOKUP(RC[2],ITEM!R3C2:R82C4,3,0) -> 4 | E52: =VLOOKUP(RC[1],ITEM!R3C2:R82C3,2,0) -> SY1F | F52: 战神护手 | G52: =VLOOKUP(RC[1],ITEM!R3C2:R82C3,2,0) -> SY1G | H52: 战神护肩 | I52: =VLOOKUP(RC[1],ITEM!R3C2:R82C3,2,0) -> SY1H | J52: 战神腿甲 | K52: 战神套装-祈福 | L52: 攻击时概率增加5%敏捷持续3秒 | M52: ST1F | N52: SB1F | O52: ="blp\suitItem\"&IF(RC[-12]>=10,"","0")&RC[-12]&" (1) .blp" -> blp\suitItem\07 (1) .blp | P52: ="new AffixItemLinkEntity("&RC[-12]&",'"&RC[-11]&"',"""&RC[-10]&""",'"&RC[-9]&"',"""&RC[-8]&""&""",'"&RC[-7]&"',"""&RC[-6]&""","""&RC[-14]&""","""&RC[-5]&""",'"&RC[-2]&"'"&")" -> new AffixItemLinkEntity(4,'SY1F',"战神护手",'SY1G',"战神护肩",'SY1H',"战神腿甲","战神","战神套装-祈福",'SB1F') | Q52: =IF(RC[-5]<>"","|n"&RC[-5],"")&IF(RC[3]="",,"|n"&R1C[3]&RC[3])&IF(RC[4]="",,"|n"&R1C[4]&RC[4])&IF(RC[5]="",,"|n"&R1C[5]&RC[5])&IF(RC[6]="",,"|n"&R1C[6]&RC[6])&IF(RC[7]="",,"|n"&R1C[7]&RC[7])&IF(RC[8]="",,"|n"&R1C[8]&RC[8])&IF(RC[10]="",,"|n"&R1C[10]&RC[10])&IF(RC[11]="",,"|n"&R1C[11]&RC[11])&IF(RC[12]="",,"|n"&R1C[12]&RC[12])&IF(RC[13]="",,"|n"&R1C[13]&RC[13])&IF(RC[14]="",,"|n"&R1C[14]&RC[14])&IF(RC[15]="",,"|n"&R1C[15]&RC[15])&IF(RC[16]="",,"|n"&R1C[16]&RC[16])&IF(RC[17]="",,"|n"&R1C[17]&RC[17])&IF(RC[18]="",,"|n"&R1C[18]&RC[18])&IF(RC[19]="",,"|n"&R1C[19]&RC[19])&IF(RC[20]="",,"|n"&R1C[20]&RC[20])&IF(RC[21]="",,"|n"&R1C29&RC[21])&IF(RC[22]="",,"|n"&R1C[22]&RC[22])&IF(RC[24]="",,"|n"&R1C[24]&RC[24])&IF(RC[25]="",,"|n"&R1C[25]&RC[25])&IF(RC[26]="",,"|n"&R1C[26]&RC[26])&IF(RC[28]="",,"|n"&RC[28]) -> |n攻击时概率增加5%敏捷持续3秒 | R52: =VLOOKUP(RC[-14],其他!R1C1:R7C2,2,0)&RC[-7]&"|r" -> |cFF33FF00战神套装-祈福|r
A53: 52 | B53: =VLOOKUP(RC[4],ITEM!R3C2:R82C6,5,0) -> 战神 | C53: 7 | D53: =VLOOKUP(RC[2],ITEM!R3C2:R82C4,3,0) -> 4 | E53: =VLOOKUP(RC[1],ITEM!R3C2:R82C3,2,0) -> SY1G | F53: 战神护肩 | G53: =VLOOKUP(RC[1],ITEM!R3C2:R82C3,2,0) -> SY1H | H53: 战神腿甲 | I53: =VLOOKUP(RC[1],ITEM!R3C2:R82C3,2,0) -> SY1I | J53: 战神头饰 | K53: 战神套装-壁垒 | L53: 攻击时概率增加5%攻击持续3秒 | M53: ST1G | N53: SB1G | O53: ="blp\suitItem\"&IF(RC[-12]>=10,"","0")&RC[-12]&" (1) .blp" -> blp\suitItem\07 (1) .blp | P53: ="new AffixItemLinkEntity("&RC[-12]&",'"&RC[-11]&"',"""&RC[-10]&""",'"&RC[-9]&"',"""&RC[-8]&""&""",'"&RC[-7]&"',"""&RC[-6]&""","""&RC[-14]&""","""&RC[-5]&""",'"&RC[-2]&"'"&")" -> new AffixItemLinkEntity(4,'SY1G',"战神护肩",'SY1H',"战神腿甲",'SY1I',"战神头饰","战神","战神套装-壁垒",'SB1G') | Q53: =IF(RC[-5]<>"","|n"&RC[-5],"")&IF(RC[3]="",,"|n"&R1C[3]&RC[3])&IF(RC[4]="",,"|n"&R1C[4]&RC[4])&IF(RC[5]="",,"|n"&R1C[5]&RC[5])&IF(RC[6]="",,"|n"&R1C[6]&RC[6])&IF(RC[7]="",,"|n"&R1C[7]&RC[7])&IF(RC[8]="",,"|n"&R1C[8]&RC[8])&IF(RC[10]="",,"|n"&R1C[10]&RC[10])&IF(RC[11]="",,"|n"&R1C[11]&RC[11])&IF(RC[12]="",,"|n"&R1C[12]&RC[12])&IF(RC[13]="",,"|n"&R1C[13]&RC[13])&IF(RC[14]="",,"|n"&R1C[14]&RC[14])&IF(RC[15]="",,"|n"&R1C[15]&RC[15])&IF(RC[16]="",,"|n"&R1C[16]&RC[16])&IF(RC[17]="",,"|n"&R1C[17]&RC[17])&IF(RC[18]="",,"|n"&R1C[18]&RC[18])&IF(RC[19]="",,"|n"&R1C[19]&RC[19])&IF(RC[20]="",,"|n"&R1C[20]&RC[20])&IF(RC[21]="",,"|n"&R1C29&RC[21])&IF(RC[22]="",,"|n"&R1C[22]&RC[22])&IF(RC[24]="",,"|n"&R1C[24]&RC[24])&IF(RC[25]="",,"|n"&R1C[25]&RC[25])&IF(RC[26]="",,"|n"&R1C[26]&RC[26])&IF(RC[28]="",,"|n"&RC[28]) -> |n攻击时概率增加5%攻击持续3秒 | R53: =VLOOKUP(RC[-14],其他!R1C1:R7C2,2,0)&RC[-7]&"|r" -> |cFF33FF00战神套装-壁垒|r
A54: 53 | B54: =VLOOKUP(RC[4],ITEM!R3C2:R82C6,5,0) -> 战神 | C54: 7 | D54: =VLOOKUP(RC[2],ITEM!R3C2:R82C4,3,0) -> 4 | E54: =VLOOKUP(RC[1],ITEM!R3C2:R82C3,2,0) -> SY1H | F54: 战神腿甲 | G54: =VLOOKUP(RC[1],ITEM!R3C2:R82C3,2,0) -> SY1I | H54: 战神头饰 | I54: =VLOOKUP(RC[1],ITEM!R3C2:R82C3,2,0) -> SY1J | J54: 战神战靴 | K54: 战神套装-神域 | L54: 攻击时概率增加5%防御持续3秒 | M54: ST1H | N54: SB1H | O54: ="blp\suitItem\"&IF(RC[-12]>=10,"","0")&RC[-12]&" (1) .blp" -> blp\suitItem\07 (1) .blp | P54: ="new AffixItemLinkEntity("&RC[-12]&",'"&RC[-11]&"',"""&RC[-10]&""",'"&RC[-9]&"',"""&RC[-8]&""&""",'"&RC[-7]&"',"""&RC[-6]&""","""&RC[-14]&""","""&RC[-5]&""",'"&RC[-2]&"'"&")" -> new AffixItemLinkEntity(4,'SY1H',"战神腿甲",'SY1I',"战神头饰",'SY1J',"战神战靴","战神","战神套装-神域",'SB1H') | Q54: =IF(RC[-5]<>"","|n"&RC[-5],"")&IF(RC[3]="",,"|n"&R1C[3]&RC[3])&IF(RC[4]="",,"|n"&R1C[4]&RC[4])&IF(RC[5]="",,"|n"&R1C[5]&RC[5])&IF(RC[6]="",,"|n"&R1C[6]&RC[6])&IF(RC[7]="",,"|n"&R1C[7]&RC[7])&IF(RC[8]="",,"|n"&R1C[8]&RC[8])&IF(RC[10]="",,"|n"&R1C[10]&RC[10])&IF(RC[11]="",,"|n"&R1C[11]&RC[11])&IF(RC[12]="",,"|n"&R1C[12]&RC[12])&IF(RC[13]="",,"|n"&R1C[13]&RC[13])&IF(RC[14]="",,"|n"&R1C[14]&RC[14])&IF(RC[15]="",,"|n"&R1C[15]&RC[15])&IF(RC[16]="",,"|n"&R1C[16]&RC[16])&IF(RC[17]="",,"|n"&R1C[17]&RC[17])&IF(RC[18]="",,"|n"&R1C[18]&RC[18])&IF(RC[19]="",,"|n"&R1C[19]&RC[19])&IF(RC[20]="",,"|n"&R1C[20]&RC[20])&IF(RC[21]="",,"|n"&R1C29&RC[21])&IF(RC[22]="",,"|n"&R1C[22]&RC[22])&IF(RC[24]="",,"|n"&R1C[24]&RC[24])&IF(RC[25]="",,"|n"&R1C[25]&RC[25])&IF(RC[26]="",,"|n"&R1C[26]&RC[26])&IF(RC[28]="",,"|n"&RC[28]) -> |n攻击时概率增加5%防御持续3秒 | R54: =VLOOKUP(RC[-14],其他!R1C1:R7C2,2,0)&RC[-7]&"|r" -> |cFF33FF00战神套装-神域|r
A55: 54 | B55: =VLOOKUP(RC[4],ITEM!R3C2:R82C6,5,0) -> 战神 | C55: 7 | D55: =VLOOKUP(RC[2],ITEM!R3C2:R82C4,3,0) -> 4 | E55: =VLOOKUP(RC[1],ITEM!R3C2:R82C3,2,0) -> SY1I | F55: 战神头饰 | G55: =VLOOKUP(RC[1],ITEM!R3C2:R82C3,2,0) -> SY1J | H55: 战神战靴 | I55: =VLOOKUP(RC[1],ITEM!R3C2:R82C3,2,0) -> SY1K | J55: 战神腰带 | K55: 战神套装-恩赐 | L55: 攻击时概率增加5%攻速持续3秒 | M55: ST1I | N55: SB1I | O55: ="blp\suitItem\"&IF(RC[-12]>=10,"","0")&RC[-12]&" (1) .blp" -> blp\suitItem\07 (1) .blp | P55: ="new AffixItemLinkEntity("&RC[-12]&",'"&RC[-11]&"',"""&RC[-10]&""",'"&RC[-9]&"',"""&RC[-8]&""&""",'"&RC[-7]&"',"""&RC[-6]&""","""&RC[-14]&""","""&RC[-5]&""",'"&RC[-2]&"'"&")" -> new AffixItemLinkEntity(4,'SY1I',"战神头饰",'SY1J',"战神战靴",'SY1K',"战神腰带","战神","战神套装-恩赐",'SB1I') | Q55: =IF(RC[-5]<>"","|n"&RC[-5],"")&IF(RC[3]="",,"|n"&R1C[3]&RC[3])&IF(RC[4]="",,"|n"&R1C[4]&RC[4])&IF(RC[5]="",,"|n"&R1C[5]&RC[5])&IF(RC[6]="",,"|n"&R1C[6]&RC[6])&IF(RC[7]="",,"|n"&R1C[7]&RC[7])&IF(RC[8]="",,"|n"&R1C[8]&RC[8])&IF(RC[10]="",,"|n"&R1C[10]&RC[10])&IF(RC[11]="",,"|n"&R1C[11]&RC[11])&IF(RC[12]="",,"|n"&R1C[12]&RC[12])&IF(RC[13]="",,"|n"&R1C[13]&RC[13])&IF(RC[14]="",,"|n"&R1C[14]&RC[14])&IF(RC[15]="",,"|n"&R1C[15]&RC[15])&IF(RC[16]="",,"|n"&R1C[16]&RC[16])&IF(RC[17]="",,"|n"&R1C[17]&RC[17])&IF(RC[18]="",,"|n"&R1C[18]&RC[18])&IF(RC[19]="",,"|n"&R1C[19]&RC[19])&IF(RC[20]="",,"|n"&R1C[20]&RC[20])&IF(RC[21]="",,"|n"&R1C29&RC[21])&IF(RC[22]="",,"|n"&R1C[22]&RC[22])&IF(RC[24]="",,"|n"&R1C[24]&RC[24])&IF(RC[25]="",,"|n"&R1C[25]&RC[25])&IF(RC[26]="",,"|n"&R1C[26]&RC[26])&IF(RC[28]="",,"|n"&RC[28]) -> |n攻击时概率增加5%攻速持续3秒 | R55: =VLOOKUP(RC[-14],其他!R1C1:R7C2,2,0)&RC[-7]&"|r" -> |cFF33FF00战神套装-恩赐|r
A56: 55 | B56: =VLOOKUP(RC[4],ITEM!R3C2:R82C6,5,0) -> 战神 | C56: 7 | D56: =VLOOKUP(RC[2],ITEM!R3C2:R82C4,3,0) -> 4 | E56: =VLOOKUP(RC[1],ITEM!R3C2:R82C3,2,0) -> SY1J | F56: 战神战靴 | G56: =VLOOKUP(RC[1],ITEM!R3C2:R82C3,2,0) -> SY1K | H56: 战神腰带 | I56: =VLOOKUP(RC[1],ITEM!R3C2:R82C3,2,0) -> SY1D | J56: 战神长刃 | K56: 战神套装-鼓舞 | L56: 攻击时概率增加3%全属性持续3秒 | M56: ST1J | N56: SB1J | O56: ="blp\suitItem\"&IF(RC[-12]>=10,"","0")&RC[-12]&" (1) .blp" -> blp\suitItem\07 (1) .blp | P56: ="new AffixItemLinkEntity("&RC[-12]&",'"&RC[-11]&"',"""&RC[-10]&""",'"&RC[-9]&"',"""&RC[-8]&""&""",'"&RC[-7]&"',"""&RC[-6]&""","""&RC[-14]&""","""&RC[-5]&""",'"&RC[-2]&"'"&")" -> new AffixItemLinkEntity(4,'SY1J',"战神战靴",'SY1K',"战神腰带",'SY1D',"战神长刃","战神","战神套装-鼓舞",'SB1J') | Q56: =IF(RC[-5]<>"","|n"&RC[-5],"")&IF(RC[3]="",,"|n"&R1C[3]&RC[3])&IF(RC[4]="",,"|n"&R1C[4]&RC[4])&IF(RC[5]="",,"|n"&R1C[5]&RC[5])&IF(RC[6]="",,"|n"&R1C[6]&RC[6])&IF(RC[7]="",,"|n"&R1C[7]&RC[7])&IF(RC[8]="",,"|n"&R1C[8]&RC[8])&IF(RC[10]="",,"|n"&R1C[10]&RC[10])&IF(RC[11]="",,"|n"&R1C[11]&RC[11])&IF(RC[12]="",,"|n"&R1C[12]&RC[12])&IF(RC[13]="",,"|n"&R1C[13]&RC[13])&IF(RC[14]="",,"|n"&R1C[14]&RC[14])&IF(RC[15]="",,"|n"&R1C[15]&RC[15])&IF(RC[16]="",,"|n"&R1C[16]&RC[16])&IF(RC[17]="",,"|n"&R1C[17]&RC[17])&IF(RC[18]="",,"|n"&R1C[18]&RC[18])&IF(RC[19]="",,"|n"&R1C[19]&RC[19])&IF(RC[20]="",,"|n"&R1C[20]&RC[20])&IF(RC[21]="",,"|n"&R1C29&RC[21])&IF(RC[22]="",,"|n"&R1C[22]&RC[22])&IF(RC[24]="",,"|n"&R1C[24]&RC[24])&IF(RC[25]="",,"|n"&R1C[25]&RC[25])&IF(RC[26]="",,"|n"&R1C[26]&RC[26])&IF(RC[28]="",,"|n"&RC[28]) -> |n攻击时概率增加3%全属性持续3秒 | R56: =VLOOKUP(RC[-14],其他!R1C1:R7C2,2,0)&RC[-7]&"|r" -> |cFF33FF00战神套装-鼓舞|r
A57: 56 | B57: =VLOOKUP(RC[4],ITEM!R3C2:R82C6,5,0) -> 战神 | C57: 7 | D57: =VLOOKUP(RC[2],ITEM!R3C2:R82C4,3,0) -> 4 | E57: =VLOOKUP(RC[1],ITEM!R3C2:R82C3,2,0) -> SY1K | F57: 战神腰带 | G57: =VLOOKUP(RC[1],ITEM!R3C2:R82C3,2,0) -> SY1D | H57: 战神长刃 | I57: =VLOOKUP(RC[1],ITEM!R3C2:R82C3,2,0) -> SY1E | J57: 战神胸甲 | K57: 战神套装-冲锋 | L57: 攻击时5%恢复3%生命值 | M57: ST1K | N57: SB1K | O57: ="blp\suitItem\"&IF(RC[-12]>=10,"","0")&RC[-12]&" (1) .blp" -> blp\suitItem\07 (1) .blp | P57: ="new AffixItemLinkEntity("&RC[-12]&",'"&RC[-11]&"',"""&RC[-10]&""",'"&RC[-9]&"',"""&RC[-8]&""&""",'"&RC[-7]&"',"""&RC[-6]&""","""&RC[-14]&""","""&RC[-5]&""",'"&RC[-2]&"'"&")" -> new AffixItemLinkEntity(4,'SY1K',"战神腰带",'SY1D',"战神长刃",'SY1E',"战神胸甲","战神","战神套装-冲锋",'SB1K') | Q57: =IF(RC[-5]<>"","|n"&RC[-5],"")&IF(RC[3]="",,"|n"&R1C[3]&RC[3])&IF(RC[4]="",,"|n"&R1C[4]&RC[4])&IF(RC[5]="",,"|n"&R1C[5]&RC[5])&IF(RC[6]="",,"|n"&R1C[6]&RC[6])&IF(RC[7]="",,"|n"&R1C[7]&RC[7])&IF(RC[8]="",,"|n"&R1C[8]&RC[8])&IF(RC[10]="",,"|n"&R1C[10]&RC[10])&IF(RC[11]="",,"|n"&R1C[11]&RC[11])&IF(RC[12]="",,"|n"&R1C[12]&RC[12])&IF(RC[13]="",,"|n"&R1C[13]&RC[13])&IF(RC[14]="",,"|n"&R1C[14]&RC[14])&IF(RC[15]="",,"|n"&R1C[15]&RC[15])&IF(RC[16]="",,"|n"&R1C[16]&RC[16])&IF(RC[17]="",,"|n"&R1C[17]&RC[17])&IF(RC[18]="",,"|n"&R1C[18]&RC[18])&IF(RC[19]="",,"|n"&R1C[19]&RC[19])&IF(RC[20]="",,"|n"&R1C[20]&RC[20])&IF(RC[21]="",,"|n"&R1C29&RC[21])&IF(RC[22]="",,"|n"&R1C[22]&RC[22])&IF(RC[24]="",,"|n"&R1C[24]&RC[24])&IF(RC[25]="",,"|n"&R1C[25]&RC[25])&IF(RC[26]="",,"|n"&R1C[26]&RC[26])&IF(RC[28]="",,"|n"&RC[28]) -> |n攻击时5%恢复3%生命值 | R57: =VLOOKUP(RC[-14],其他!R1C1:R7C2,2,0)&RC[-7]&"|r" -> |cFF33FF00战神套装-冲锋|r
A58: 57 | B58: =VLOOKUP(RC[4],ITEM!R3C2:R82C6,5,0) -> 贤者 | C58: 8 | D58: =VLOOKUP(RC[2],ITEM!R3C2:R82C4,3,0) -> 4 | E58: =VLOOKUP(RC[1],ITEM!R3C2:R82C3,2,0) -> SY1L | F58: 贤者长刃 | G58: =VLOOKUP(RC[1],ITEM!R3C2:R82C3,2,0) -> SY1M | H58: 贤者胸甲 | I58: =VLOOKUP(RC[1],ITEM!R3C2:R82C3,2,0) -> SY1N | J58: 贤者护手 | K58: 贤者套装-枷锁 | L58: 1 | M58: ST1L | N58: SB1L | O58: ="blp\suitItem\"&IF(RC[-12]>=10,"","0")&RC[-12]&" (1) .blp" -> blp\suitItem\08 (1) .blp | P58: ="new AffixItemLinkEntity("&RC[-12]&",'"&RC[-11]&"',"""&RC[-10]&""",'"&RC[-9]&"',"""&RC[-8]&""&""",'"&RC[-7]&"',"""&RC[-6]&""","""&RC[-14]&""","""&RC[-5]&""",'"&RC[-2]&"'"&")" -> new AffixItemLinkEntity(4,'SY1L',"贤者长刃",'SY1M',"贤者胸甲",'SY1N',"贤者护手","贤者","贤者套装-枷锁",'SB1L') | Q58: =IF(RC[-5]<>"","|n"&RC[-5],"")&IF(RC[3]="",,"|n"&R1C[3]&RC[3])&IF(RC[4]="",,"|n"&R1C[4]&RC[4])&IF(RC[5]="",,"|n"&R1C[5]&RC[5])&IF(RC[6]="",,"|n"&R1C[6]&RC[6])&IF(RC[7]="",,"|n"&R1C[7]&RC[7])&IF(RC[8]="",,"|n"&R1C[8]&RC[8])&IF(RC[10]="",,"|n"&R1C[10]&RC[10])&IF(RC[11]="",,"|n"&R1C[11]&RC[11])&IF(RC[12]="",,"|n"&R1C[12]&RC[12])&IF(RC[13]="",,"|n"&R1C[13]&RC[13])&IF(RC[14]="",,"|n"&R1C[14]&RC[14])&IF(RC[15]="",,"|n"&R1C[15]&RC[15])&IF(RC[16]="",,"|n"&R1C[16]&RC[16])&IF(RC[17]="",,"|n"&R1C[17]&RC[17])&IF(RC[18]="",,"|n"&R1C[18]&RC[18])&IF(RC[19]="",,"|n"&R1C[19]&RC[19])&IF(RC[20]="",,"|n"&R1C[20]&RC[20])&IF(RC[21]="",,"|n"&R1C29&RC[21])&IF(RC[22]="",,"|n"&R1C[22]&RC[22])&IF(RC[24]="",,"|n"&R1C[24]&RC[24])&IF(RC[25]="",,"|n"&R1C[25]&RC[25])&IF(RC[26]="",,"|n"&R1C[26]&RC[26])&IF(RC[28]="",,"|n"&RC[28]) -> |n1 | R58: =VLOOKUP(RC[-14],其他!R1C1:R7C2,2,0)&RC[-7]&"|r" -> |cFF33FF00贤者套装-枷锁|r
A59: 58 | B59: =VLOOKUP(RC[4],ITEM!R3C2:R82C6,5,0) -> 贤者 | C59: 8 | D59: =VLOOKUP(RC[2],ITEM!R3C2:R82C4,3,0) -> 4 | E59: =VLOOKUP(RC[1],ITEM!R3C2:R82C3,2,0) -> SY1M | F59: 贤者胸甲 | G59: =VLOOKUP(RC[1],ITEM!R3C2:R82C3,2,0) -> SY1N | H59: 贤者护手 | I59: =VLOOKUP(RC[1],ITEM!R3C2:R82C3,2,0) -> SY1O | J59: 贤者护肩 | K59: 贤者套装-领域 | L59: 1 | M59: ST1M | N59: SB1M | O59: ="blp\suitItem\"&IF(RC[-12]>=10,"","0")&RC[-12]&" (1) .blp" -> blp\suitItem\08 (1) .blp | P59: ="new AffixItemLinkEntity("&RC[-12]&",'"&RC[-11]&"',"""&RC[-10]&""",'"&RC[-9]&"',"""&RC[-8]&""&""",'"&RC[-7]&"',"""&RC[-6]&""","""&RC[-14]&""","""&RC[-5]&""",'"&RC[-2]&"'"&")" -> new AffixItemLinkEntity(4,'SY1M',"贤者胸甲",'SY1N',"贤者护手",'SY1O',"贤者护肩","贤者","贤者套装-领域",'SB1M') | Q59: =IF(RC[-5]<>"","|n"&RC[-5],"")&IF(RC[3]="",,"|n"&R1C[3]&RC[3])&IF(RC[4]="",,"|n"&R1C[4]&RC[4])&IF(RC[5]="",,"|n"&R1C[5]&RC[5])&IF(RC[6]="",,"|n"&R1C[6]&RC[6])&IF(RC[7]="",,"|n"&R1C[7]&RC[7])&IF(RC[8]="",,"|n"&R1C[8]&RC[8])&IF(RC[10]="",,"|n"&R1C[10]&RC[10])&IF(RC[11]="",,"|n"&R1C[11]&RC[11])&IF(RC[12]="",,"|n"&R1C[12]&RC[12])&IF(RC[13]="",,"|n"&R1C[13]&RC[13])&IF(RC[14]="",,"|n"&R1C[14]&RC[14])&IF(RC[15]="",,"|n"&R1C[15]&RC[15])&IF(RC[16]="",,"|n"&R1C[16]&RC[16])&IF(RC[17]="",,"|n"&R1C[17]&RC[17])&IF(RC[18]="",,"|n"&R1C[18]&RC[18])&IF(RC[19]="",,"|n"&R1C[19]&RC[19])&IF(RC[20]="",,"|n"&R1C[20]&RC[20])&IF(RC[21]="",,"|n"&R1C29&RC[21])&IF(RC[22]="",,"|n"&R1C[22]&RC[22])&IF(RC[24]="",,"|n"&R1C[24]&RC[24])&IF(RC[25]="",,"|n"&R1C[25]&RC[25])&IF(RC[26]="",,"|n"&R1C[26]&RC[26])&IF(RC[28]="",,"|n"&RC[28]) -> |n1 | R59: =VLOOKUP(RC[-14],其他!R1C1:R7C2,2,0)&RC[-7]&"|r" -> |cFF33FF00贤者套装-领域|r
A60: 59 | B60: =VLOOKUP(RC[4],ITEM!R3C2:R82C6,5,0) -> 贤者 | C60: 8 | D60: =VLOOKUP(RC[2],ITEM!R3C2:R82C4,3,0) -> 4 | E60: =VLOOKUP(RC[1],ITEM!R3C2:R82C3,2,0) -> SY1N | F60: 贤者护手 | G60: =VLOOKUP(RC[1],ITEM!R3C2:R82C3,2,0) -> SY1O | H60: 贤者护肩 | I60: =VLOOKUP(RC[1],ITEM!R3C2:R82C3,2,0) -> SY1P | J60: 贤者腿甲 | K60: 贤者套装-吟唱 | M60: ST1N | N60: SB1N | O60: ="blp\suitItem\"&IF(RC[-12]>=10,"","0")&RC[-12]&" (1) .blp" -> blp\suitItem\08 (1) .blp | P60: ="new AffixItemLinkEntity("&RC[-12]&",'"&RC[-11]&"',"""&RC[-10]&""",'"&RC[-9]&"',"""&RC[-8]&""&""",'"&RC[-7]&"',"""&RC[-6]&""","""&RC[-14]&""","""&RC[-5]&""",'"&RC[-2]&"'"&")" -> new AffixItemLinkEntity(4,'SY1N',"贤者护手",'SY1O',"贤者护肩",'SY1P',"贤者腿甲","贤者","贤者套装-吟唱",'SB1N') | Q60: =IF(RC[-5]<>"","|n"&RC[-5],"")&IF(RC[3]="",,"|n"&R1C[3]&RC[3])&IF(RC[4]="",,"|n"&R1C[4]&RC[4])&IF(RC[5]="",,"|n"&R1C[5]&RC[5])&IF(RC[6]="",,"|n"&R1C[6]&RC[6])&IF(RC[7]="",,"|n"&R1C[7]&RC[7])&IF(RC[8]="",,"|n"&R1C[8]&RC[8])&IF(RC[10]="",,"|n"&R1C[10]&RC[10])&IF(RC[11]="",,"|n"&R1C[11]&RC[11])&IF(RC[12]="",,"|n"&R1C[12]&RC[12])&IF(RC[13]="",,"|n"&R1C[13]&RC[13])&IF(RC[14]="",,"|n"&R1C[14]&RC[14])&IF(RC[15]="",,"|n"&R1C[15]&RC[15])&IF(RC[16]="",,"|n"&R1C[16]&RC[16])&IF(RC[17]="",,"|n"&R1C[17]&RC[17])&IF(RC[18]="",,"|n"&R1C[18]&RC[18])&IF(RC[19]="",,"|n"&R1C[19]&RC[19])&IF(RC[20]="",,"|n"&R1C[20]&RC[20])&IF(RC[21]="",,"|n"&R1C29&RC[21])&IF(RC[22]="",,"|n"&R1C[22]&RC[22])&IF(RC[24]="",,"|n"&R1C[24]&RC[24])&IF(RC[25]="",,"|n"&R1C[25]&RC[25])&IF(RC[26]="",,"|n"&R1C[26]&RC[26])&IF(RC[28]="",,"|n"&RC[28]) -> |n暴击概率:10|n附加伤害:30 | R60: =VLOOKUP(RC[-14],其他!R1C1:R7C2,2,0)&RC[-7]&"|r" -> |cFF33FF00贤者套装-吟唱|r | AC60: 10 | AF60: 30
A61: 60 | B61: =VLOOKUP(RC[4],ITEM!R3C2:R82C6,5,0) -> 贤者 | C61: 8 | D61: =VLOOKUP(RC[2],ITEM!R3C2:R82C4,3,0) -> 4 | E61: =VLOOKUP(RC[1],ITEM!R3C2:R82C3,2,0) -> SY1O | F61: 贤者护肩 | G61: =VLOOKUP(RC[1],ITEM!R3C2:R82C3,2,0) -> SY1P | H61: 贤者腿甲 | I61: =VLOOKUP(RC[1],ITEM!R3C2:R82C3,2,0) -> SY1Q | J61: 贤者头饰 | K61: 贤者套装-屏障 | M61: ST1O | N61: SB1O | O61: ="blp\suitItem\"&IF(RC[-12]>=10,"","0")&RC[-12]&" (1) .blp" -> blp\suitItem\08 (1) .blp | P61: ="new AffixItemLinkEntity("&RC[-12]&",'"&RC[-11]&"',"""&RC[-10]&""",'"&RC[-9]&"',"""&RC[-8]&""&""",'"&RC[-7]&"',"""&RC[-6]&""","""&RC[-14]&""","""&RC[-5]&""",'"&RC[-2]&"'"&")" -> new AffixItemLinkEntity(4,'SY1O',"贤者护肩",'SY1P',"贤者腿甲",'SY1Q',"贤者头饰","贤者","贤者套装-屏障",'SB1O') | Q61: =IF(RC[-5]<>"","|n"&RC[-5],"")&IF(RC[3]="",,"|n"&R1C[3]&RC[3])&IF(RC[4]="",,"|n"&R1C[4]&RC[4])&IF(RC[5]="",,"|n"&R1C[5]&RC[5])&IF(RC[6]="",,"|n"&R1C[6]&RC[6])&IF(RC[7]="",,"|n"&R1C[7]&RC[7])&IF(RC[8]="",,"|n"&R1C[8]&RC[8])&IF(RC[10]="",,"|n"&R1C[10]&RC[10])&IF(RC[11]="",,"|n"&R1C[11]&RC[11])&IF(RC[12]="",,"|n"&R1C[12]&RC[12])&IF(RC[13]="",,"|n"&R1C[13]&RC[13])&IF(RC[14]="",,"|n"&R1C[14]&RC[14])&IF(RC[15]="",,"|n"&R1C[15]&RC[15])&IF(RC[16]="",,"|n"&R1C[16]&RC[16])&IF(RC[17]="",,"|n"&R1C[17]&RC[17])&IF(RC[18]="",,"|n"&R1C[18]&RC[18])&IF(RC[19]="",,"|n"&R1C[19]&RC[19])&IF(RC[20]="",,"|n"&R1C[20]&RC[20])&IF(RC[21]="",,"|n"&R1C29&RC[21])&IF(RC[22]="",,"|n"&R1C[22]&RC[22])&IF(RC[24]="",,"|n"&R1C[24]&RC[24])&IF(RC[25]="",,"|n"&R1C[25]&RC[25])&IF(RC[26]="",,"|n"&R1C[26]&RC[26])&IF(RC[28]="",,"|n"&RC[28]) -> |n暴击概率:10|n伤害抵抗:10 | R61: =VLOOKUP(RC[-14],其他!R1C1:R7C2,2,0)&RC[-7]&"|r" -> |cFF33FF00贤者套装-屏障|r | AC61: 10 | AH61: 10
A62: 61 | B62: =VLOOKUP(RC[4],ITEM!R3C2:R82C6,5,0) -> 贤者 | C62: 8 | D62: =VLOOKUP(RC[2],ITEM!R3C2:R82C4,3,0) -> 4 | E62: =VLOOKUP(RC[1],ITEM!R3C2:R82C3,2,0) -> SY1P | F62: 贤者腿甲 | G62: =VLOOKUP(RC[1],ITEM!R3C2:R82C3,2,0) -> SY1Q | H62: 贤者头饰 | I62: =VLOOKUP(RC[1],ITEM!R3C2:R82C3,2,0) -> SY1R | J62: 贤者战靴 | K62: 贤者套装-奏响 | M62: ST1P | N62: SB1P | O62: ="blp\suitItem\"&IF(RC[-12]>=10,"","0")&RC[-12]&" (1) .blp" -> blp\suitItem\08 (1) .blp | P62: ="new AffixItemLinkEntity("&RC[-12]&",'"&RC[-11]&"',"""&RC[-10]&""",'"&RC[-9]&"',"""&RC[-8]&""&""",'"&RC[-7]&"',"""&RC[-6]&""","""&RC[-14]&""","""&RC[-5]&""",'"&RC[-2]&"'"&")" -> new AffixItemLinkEntity(4,'SY1P',"贤者腿甲",'SY1Q',"贤者头饰",'SY1R',"贤者战靴","贤者","贤者套装-奏响",'SB1P') | Q62: =IF(RC[-5]<>"","|n"&RC[-5],"")&IF(RC[3]="",,"|n"&R1C[3]&RC[3])&IF(RC[4]="",,"|n"&R1C[4]&RC[4])&IF(RC[5]="",,"|n"&R1C[5]&RC[5])&IF(RC[6]="",,"|n"&R1C[6]&RC[6])&IF(RC[7]="",,"|n"&R1C[7]&RC[7])&IF(RC[8]="",,"|n"&R1C[8]&RC[8])&IF(RC[10]="",,"|n"&R1C[10]&RC[10])&IF(RC[11]="",,"|n"&R1C[11]&RC[11])&IF(RC[12]="",,"|n"&R1C[12]&RC[12])&IF(RC[13]="",,"|n"&R1C[13]&RC[13])&IF(RC[14]="",,"|n"&R1C[14]&RC[14])&IF(RC[15]="",,"|n"&R1C[15]&RC[15])&IF(RC[16]="",,"|n"&R1C[16]&RC[16])&IF(RC[17]="",,"|n"&R1C[17]&RC[17])&IF(RC[18]="",,"|n"&R1C[18]&RC[18])&IF(RC[19]="",,"|n"&R1C[19]&RC[19])&IF(RC[20]="",,"|n"&R1C[20]&RC[20])&IF(RC[21]="",,"|n"&R1C29&RC[21])&IF(RC[22]="",,"|n"&R1C[22]&RC[22])&IF(RC[24]="",,"|n"&R1C[24]&RC[24])&IF(RC[25]="",,"|n"&R1C[25]&RC[25])&IF(RC[26]="",,"|n"&R1C[26]&RC[26])&IF(RC[28]="",,"|n"&RC[28]) -> |n暴击概率:10|n伤害减免:20 | R62: =VLOOKUP(RC[-14],其他!R1C1:R7C2,2,0)&RC[-7]&"|r" -> |cFF33FF00贤者套装-奏响|r | AC62: 10 | AI62: 20
A63: 62 | B63: =VLOOKUP(RC[4],ITEM!R3C2:R82C6,5,0) -> 贤者 | C63: 8 | D63: =VLOOKUP(RC[2],ITEM!R3C2:R82C4,3,0) -> 4 | E63: =VLOOKUP(RC[1],ITEM!R3C2:R82C3,2,0) -> SY1Q | F63: 贤者头饰 | G63: =VLOOKUP(RC[1],ITEM!R3C2:R82C3,2,0) -> SY1R | H63: 贤者战靴 | I63: =VLOOKUP(RC[1],ITEM!R3C2:R82C3,2,0) -> SY1S | J63: 贤者腰带 | K63: 贤者套装-仪式 | M63: ST1Q | N63: SB1Q | O63: ="blp\suitItem\"&IF(RC[-12]>=10,"","0")&RC[-12]&" (1) .blp" -> blp\suitItem\08 (1) .blp | P63: ="new AffixItemLinkEntity("&RC[-12]&",'"&RC[-11]&"',"""&RC[-10]&""",'"&RC[-9]&"',"""&RC[-8]&""&""",'"&RC[-7]&"',"""&RC[-6]&""","""&RC[-14]&""","""&RC[-5]&""",'"&RC[-2]&"'"&")" -> new AffixItemLinkEntity(4,'SY1Q',"贤者头饰",'SY1R',"贤者战靴",'SY1S',"贤者腰带","贤者","贤者套装-仪式",'SB1Q') | Q63: =IF(RC[-5]<>"","|n"&RC[-5],"")&IF(RC[3]="",,"|n"&R1C[3]&RC[3])&IF(RC[4]="",,"|n"&R1C[4]&RC[4])&IF(RC[5]="",,"|n"&R1C[5]&RC[5])&IF(RC[6]="",,"|n"&R1C[6]&RC[6])&IF(RC[7]="",,"|n"&R1C[7]&RC[7])&IF(RC[8]="",,"|n"&R1C[8]&RC[8])&IF(RC[10]="",,"|n"&R1C[10]&RC[10])&IF(RC[11]="",,"|n"&R1C[11]&RC[11])&IF(RC[12]="",,"|n"&R1C[12]&RC[12])&IF(RC[13]="",,"|n"&R1C[13]&RC[13])&IF(RC[14]="",,"|n"&R1C[14]&RC[14])&IF(RC[15]="",,"|n"&R1C[15]&RC[15])&IF(RC[16]="",,"|n"&R1C[16]&RC[16])&IF(RC[17]="",,"|n"&R1C[17]&RC[17])&IF(RC[18]="",,"|n"&R1C[18]&RC[18])&IF(RC[19]="",,"|n"&R1C[19]&RC[19])&IF(RC[20]="",,"|n"&R1C[20]&RC[20])&IF(RC[21]="",,"|n"&R1C29&RC[21])&IF(RC[22]="",,"|n"&R1C[22]&RC[22])&IF(RC[24]="",,"|n"&R1C[24]&RC[24])&IF(RC[25]="",,"|n"&R1C[25]&RC[25])&IF(RC[26]="",,"|n"&R1C[26]&RC[26])&IF(RC[28]="",,"|n"&RC[28]) -> |n暴击概率:10|n暴击伤害:30 | R63: =VLOOKUP(RC[-14],其他!R1C1:R7C2,2,0)&RC[-7]&"|r" -> |cFF33FF00贤者套装-仪式|r | AC63: 10 | AD63: 30
A64: 63 | B64: =VLOOKUP(RC[4],ITEM!R3C2:R82C6,5,0) -> 贤者 | C64: 8 | D64: =VLOOKUP(RC[2],ITEM!R3C2:R82C4,3,0) -> 4 | E64: =VLOOKUP(RC[1],ITEM!R3C2:R82C3,2,0) -> SY1R | F64: 贤者战靴 | G64: =VLOOKUP(RC[1],ITEM!R3C2:R82C3,2,0) -> SY1S | H64: 贤者腰带 | I64: =VLOOKUP(RC[1],ITEM!R3C2:R82C3,2,0) -> SY1L | J64: 贤者长刃 | K64: 贤者套装-智慧 | M64: ST1R | N64: SB1R | O64: ="blp\suitItem\"&IF(RC[-12]>=10,"","0")&RC[-12]&" (1) .blp" -> blp\suitItem\08 (1) .blp | P64: ="new AffixItemLinkEntity("&RC[-12]&",'"&RC[-11]&"',"""&RC[-10]&""",'"&RC[-9]&"',"""&RC[-8]&""&""",'"&RC[-7]&"',"""&RC[-6]&""","""&RC[-14]&""","""&RC[-5]&""",'"&RC[-2]&"'"&")" -> new AffixItemLinkEntity(4,'SY1R',"贤者战靴",'SY1S',"贤者腰带",'SY1L',"贤者长刃","贤者","贤者套装-智慧",'SB1R') | Q64: =IF(RC[-5]<>"","|n"&RC[-5],"")&IF(RC[3]="",,"|n"&R1C[3]&RC[3])&IF(RC[4]="",,"|n"&R1C[4]&RC[4])&IF(RC[5]="",,"|n"&R1C[5]&RC[5])&IF(RC[6]="",,"|n"&R1C[6]&RC[6])&IF(RC[7]="",,"|n"&R1C[7]&RC[7])&IF(RC[8]="",,"|n"&R1C[8]&RC[8])&IF(RC[10]="",,"|n"&R1C[10]&RC[10])&IF(RC[11]="",,"|n"&R1C[11]&RC[11])&IF(RC[12]="",,"|n"&R1C[12]&RC[12])&IF(RC[13]="",,"|n"&R1C[13]&RC[13])&IF(RC[14]="",,"|n"&R1C[14]&RC[14])&IF(RC[15]="",,"|n"&R1C[15]&RC[15])&IF(RC[16]="",,"|n"&R1C[16]&RC[16])&IF(RC[17]="",,"|n"&R1C[17]&RC[17])&IF(RC[18]="",,"|n"&R1C[18]&RC[18])&IF(RC[19]="",,"|n"&R1C[19]&RC[19])&IF(RC[20]="",,"|n"&R1C[20]&RC[20])&IF(RC[21]="",,"|n"&R1C29&RC[21])&IF(RC[22]="",,"|n"&R1C[22]&RC[22])&IF(RC[24]="",,"|n"&R1C[24]&RC[24])&IF(RC[25]="",,"|n"&R1C[25]&RC[25])&IF(RC[26]="",,"|n"&R1C[26]&RC[26])&IF(RC[28]="",,"|n"&RC[28]) -> |n暴击概率:10|n伤害增幅:30 | R64: =VLOOKUP(RC[-14],其他!R1C1:R7C2,2,0)&RC[-7]&"|r" -> |cFF33FF00贤者套装-智慧|r | AC64: 10 | AE64: 30
A65: 64 | B65: =VLOOKUP(RC[4],ITEM!R3C2:R82C6,5,0) -> 贤者 | C65: 8 | D65: =VLOOKUP(RC[2],ITEM!R3C2:R82C4,3,0) -> 4 | E65: =VLOOKUP(RC[1],ITEM!R3C2:R82C3,2,0) -> SY1S | F65: 贤者腰带 | G65: =VLOOKUP(RC[1],ITEM!R3C2:R82C3,2,0) -> SY1L | H65: 贤者长刃 | I65: =VLOOKUP(RC[1],ITEM!R3C2:R82C3,2,0) -> SY1M | J65: 贤者胸甲 | K65: 贤者套装-冲击 | M65: ST1S | N65: SB1S | O65: ="blp\suitItem\"&IF(RC[-12]>=10,"","0")&RC[-12]&" (1) .blp" -> blp\suitItem\08 (1) .blp | P65: ="new AffixItemLinkEntity("&RC[-12]&",'"&RC[-11]&"',"""&RC[-10]&""",'"&RC[-9]&"',"""&RC[-8]&""&""",'"&RC[-7]&"',"""&RC[-6]&""","""&RC[-14]&""","""&RC[-5]&""",'"&RC[-2]&"'"&")" -> new AffixItemLinkEntity(4,'SY1S',"贤者腰带",'SY1L',"贤者长刃",'SY1M',"贤者胸甲","贤者","贤者套装-冲击",'SB1S') | Q65: =IF(RC[-5]<>"","|n"&RC[-5],"")&IF(RC[3]="",,"|n"&R1C[3]&RC[3])&IF(RC[4]="",,"|n"&R1C[4]&RC[4])&IF(RC[5]="",,"|n"&R1C[5]&RC[5])&IF(RC[6]="",,"|n"&R1C[6]&RC[6])&IF(RC[7]="",,"|n"&R1C[7]&RC[7])&IF(RC[8]="",,"|n"&R1C[8]&RC[8])&IF(RC[10]="",,"|n"&R1C[10]&RC[10])&IF(RC[11]="",,"|n"&R1C[11]&RC[11])&IF(RC[12]="",,"|n"&R1C[12]&RC[12])&IF(RC[13]="",,"|n"&R1C[13]&RC[13])&IF(RC[14]="",,"|n"&R1C[14]&RC[14])&IF(RC[15]="",,"|n"&R1C[15]&RC[15])&IF(RC[16]="",,"|n"&R1C[16]&RC[16])&IF(RC[17]="",,"|n"&R1C[17]&RC[17])&IF(RC[18]="",,"|n"&R1C[18]&RC[18])&IF(RC[19]="",,"|n"&R1C[19]&RC[19])&IF(RC[20]="",,"|n"&R1C[20]&RC[20])&IF(RC[21]="",,"|n"&R1C29&RC[21])&IF(RC[22]="",,"|n"&R1C[22]&RC[22])&IF(RC[24]="",,"|n"&R1C[24]&RC[24])&IF(RC[25]="",,"|n"&R1C[25]&RC[25])&IF(RC[26]="",,"|n"&R1C[26]&RC[26])&IF(RC[28]="",,"|n"&RC[28]) -> |n暴击概率:10|n最终伤害:20 | R65: =VLOOKUP(RC[-14],其他!R1C1:R7C2,2,0)&RC[-7]&"|r" -> |cFF33FF00贤者套装-冲击|r | AC65: 10 | AG65: 20
A66: 65 | B66: =VLOOKUP(RC[4],ITEM!R3C2:R82C6,5,0) -> 魔龙 | C66: 9 | D66: =VLOOKUP(RC[2],ITEM!R3C2:R82C4,3,0) -> 5 | E66: =VLOOKUP(RC[1],ITEM!R3C2:R82C3,2,0) -> SY1T | F66: 魔龙长刃 | G66: =VLOOKUP(RC[1],ITEM!R3C2:R82C3,2,0) -> SY1U | H66: 魔龙胸甲 | I66: =VLOOKUP(RC[1],ITEM!R3C2:R82C3,2,0) -> SY1V | J66: 魔龙护手 | K66: 魔龙套装-暴食 | L66: 攻击时有概率+5暴击概率持续2秒 | M66: ST1T | N66: SB1T | O66: ="blp\suitItem\"&IF(RC[-12]>=10,"","0")&RC[-12]&" (1) .blp" -> blp\suitItem\09 (1) .blp | P66: ="new AffixItemLinkEntity("&RC[-12]&",'"&RC[-11]&"',"""&RC[-10]&""",'"&RC[-9]&"',"""&RC[-8]&""&""",'"&RC[-7]&"',"""&RC[-6]&""","""&RC[-14]&""","""&RC[-5]&""",'"&RC[-2]&"'"&")" -> new AffixItemLinkEntity(5,'SY1T',"魔龙长刃",'SY1U',"魔龙胸甲",'SY1V',"魔龙护手","魔龙","魔龙套装-暴食",'SB1T') | Q66: =IF(RC[-5]<>"","|n"&RC[-5],"")&IF(RC[3]="",,"|n"&R1C[3]&RC[3])&IF(RC[4]="",,"|n"&R1C[4]&RC[4])&IF(RC[5]="",,"|n"&R1C[5]&RC[5])&IF(RC[6]="",,"|n"&R1C[6]&RC[6])&IF(RC[7]="",,"|n"&R1C[7]&RC[7])&IF(RC[8]="",,"|n"&R1C[8]&RC[8])&IF(RC[10]="",,"|n"&R1C[10]&RC[10])&IF(RC[11]="",,"|n"&R1C[11]&RC[11])&IF(RC[12]="",,"|n"&R1C[12]&RC[12])&IF(RC[13]="",,"|n"&R1C[13]&RC[13])&IF(RC[14]="",,"|n"&R1C[14]&RC[14])&IF(RC[15]="",,"|n"&R1C[15]&RC[15])&IF(RC[16]="",,"|n"&R1C[16]&RC[16])&IF(RC[17]="",,"|n"&R1C[17]&RC[17])&IF(RC[18]="",,"|n"&R1C[18]&RC[18])&IF(RC[19]="",,"|n"&R1C[19]&RC[19])&IF(RC[20]="",,"|n"&R1C[20]&RC[20])&IF(RC[21]="",,"|n"&R1C29&RC[21])&IF(RC[22]="",,"|n"&R1C[22]&RC[22])&IF(RC[24]="",,"|n"&R1C[24]&RC[24])&IF(RC[25]="",,"|n"&R1C[25]&RC[25])&IF(RC[26]="",,"|n"&R1C[26]&RC[26])&IF(RC[28]="",,"|n"&RC[28]) -> |n攻击时有概率+5暴击概率持续2秒 | R66: =VLOOKUP(RC[-14],其他!R1C1:R7C2,2,0)&RC[-7]&"|r" -> |cFFFF9933魔龙套装-暴食|r
A67: 66 | B67: =VLOOKUP(RC[4],ITEM!R3C2:R82C6,5,0) -> 魔龙 | C67: 9 | D67: =VLOOKUP(RC[2],ITEM!R3C2:R82C4,3,0) -> 5 | E67: =VLOOKUP(RC[1],ITEM!R3C2:R82C3,2,0) -> SY1U | F67: 魔龙胸甲 | G67: =VLOOKUP(RC[1],ITEM!R3C2:R82C3,2,0) -> SY1V | H67: 魔龙护手 | I67: =VLOOKUP(RC[1],ITEM!R3C2:R82C3,2,0) -> SY1W | J67: 魔龙护肩 | K67: 魔龙套装-贪婪 | L67: 攻击时有概率+10附加伤害持续2秒|n攻击力+30% | M67: ST1U | N67: SB1U | O67: ="blp\suitItem\"&IF(RC[-12]>=10,"","0")&RC[-12]&" (1) .blp" -> blp\suitItem\09 (1) .blp | P67: ="new AffixItemLinkEntity("&RC[-12]&",'"&RC[-11]&"',"""&RC[-10]&""",'"&RC[-9]&"',"""&RC[-8]&""&""",'"&RC[-7]&"',"""&RC[-6]&""","""&RC[-14]&""","""&RC[-5]&""",'"&RC[-2]&"'"&")" -> new AffixItemLinkEntity(5,'SY1U',"魔龙胸甲",'SY1V',"魔龙护手",'SY1W',"魔龙护肩","魔龙","魔龙套装-贪婪",'SB1U') | Q67: =IF(RC[-5]<>"","|n"&RC[-5],"")&IF(RC[3]="",,"|n"&R1C[3]&RC[3])&IF(RC[4]="",,"|n"&R1C[4]&RC[4])&IF(RC[5]="",,"|n"&R1C[5]&RC[5])&IF(RC[6]="",,"|n"&R1C[6]&RC[6])&IF(RC[7]="",,"|n"&R1C[7]&RC[7])&IF(RC[8]="",,"|n"&R1C[8]&RC[8])&IF(RC[10]="",,"|n"&R1C[10]&RC[10])&IF(RC[11]="",,"|n"&R1C[11]&RC[11])&IF(RC[12]="",,"|n"&R1C[12]&RC[12])&IF(RC[13]="",,"|n"&R1C[13]&RC[13])&IF(RC[14]="",,"|n"&R1C[14]&RC[14])&IF(RC[15]="",,"|n"&R1C[15]&RC[15])&IF(RC[16]="",,"|n"&R1C[16]&RC[16])&IF(RC[17]="",,"|n"&R1C[17]&RC[17])&IF(RC[18]="",,"|n"&R1C[18]&RC[18])&IF(RC[19]="",,"|n"&R1C[19]&RC[19])&IF(RC[20]="",,"|n"&R1C[20]&RC[20])&IF(RC[21]="",,"|n"&R1C29&RC[21])&IF(RC[22]="",,"|n"&R1C[22]&RC[22])&IF(RC[24]="",,"|n"&R1C[24]&RC[24])&IF(RC[25]="",,"|n"&R1C[25]&RC[25])&IF(RC[26]="",,"|n"&R1C[26]&RC[26])&IF(RC[28]="",,"|n"&RC[28]) -> |n攻击时有概率+10附加伤害持续2秒|n攻击力+30% | R67: =VLOOKUP(RC[-14],其他!R1C1:R7C2,2,0)&RC[-7]&"|r" -> |cFFFF9933魔龙套装-贪婪|r
A68: 67 | B68: =VLOOKUP(RC[4],ITEM!R3C2:R82C6,5,0) -> 魔龙 | C68: 9 | D68: =VLOOKUP(RC[2],ITEM!R3C2:R82C4,3,0) -> 5 | E68: =VLOOKUP(RC[1],ITEM!R3C2:R82C3,2,0) -> SY1V | F68: 魔龙护手 | G68: =VLOOKUP(RC[1],ITEM!R3C2:R82C3,2,0) -> SY1W | H68: 魔龙护肩 | I68: =VLOOKUP(RC[1],ITEM!R3C2:R82C3,2,0) -> SY1X | J68: 魔龙腿甲 | K68: 魔龙套装-懒惰 | L68: 杀敌时+10全属性|n普攻造成2倍伤害 | M68: ST1V | N68: SB1V | O68: ="blp\suitItem\"&IF(RC[-12]>=10,"","0")&RC[-12]&" (1) .blp" -> blp\suitItem\09 (1) .blp | P68: ="new AffixItemLinkEntity("&RC[-12]&",'"&RC[-11]&"',"""&RC[-10]&""",'"&RC[-9]&"',"""&RC[-8]&""&""",'"&RC[-7]&"',"""&RC[-6]&""","""&RC[-14]&""","""&RC[-5]&""",'"&RC[-2]&"'"&")" -> new AffixItemLinkEntity(5,'SY1V',"魔龙护手",'SY1W',"魔龙护肩",'SY1X',"魔龙腿甲","魔龙","魔龙套装-懒惰",'SB1V') | Q68: =IF(RC[-5]<>"","|n"&RC[-5],"")&IF(RC[3]="",,"|n"&R1C[3]&RC[3])&IF(RC[4]="",,"|n"&R1C[4]&RC[4])&IF(RC[5]="",,"|n"&R1C[5]&RC[5])&IF(RC[6]="",,"|n"&R1C[6]&RC[6])&IF(RC[7]="",,"|n"&R1C[7]&RC[7])&IF(RC[8]="",,"|n"&R1C[8]&RC[8])&IF(RC[10]="",,"|n"&R1C[10]&RC[10])&IF(RC[11]="",,"|n"&R1C[11]&RC[11])&IF(RC[12]="",,"|n"&R1C[12]&RC[12])&IF(RC[13]="",,"|n"&R1C[13]&RC[13])&IF(RC[14]="",,"|n"&R1C[14]&RC[14])&IF(RC[15]="",,"|n"&R1C[15]&RC[15])&IF(RC[16]="",,"|n"&R1C[16]&RC[16])&IF(RC[17]="",,"|n"&R1C[17]&RC[17])&IF(RC[18]="",,"|n"&R1C[18]&RC[18])&IF(RC[19]="",,"|n"&R1C[19]&RC[19])&IF(RC[20]="",,"|n"&R1C[20]&RC[20])&IF(RC[21]="",,"|n"&R1C29&RC[21])&IF(RC[22]="",,"|n"&R1C[22]&RC[22])&IF(RC[24]="",,"|n"&R1C[24]&RC[24])&IF(RC[25]="",,"|n"&R1C[25]&RC[25])&IF(RC[26]="",,"|n"&R1C[26]&RC[26])&IF(RC[28]="",,"|n"&RC[28]) -> |n杀敌时+10全属性|n普攻造成2倍伤害 | R68: =VLOOKUP(RC[-14],其他!R1C1:R7C2,2,0)&RC[-7]&"|r" -> |cFFFF9933魔龙套装-懒惰|r
A69: 68 | B69: =VLOOKUP(RC[4],ITEM!R3C2:R82C6,5,0) -> 魔龙 | C69: 9 | D69: =VLOOKUP(RC[2],ITEM!R3C2:R82C4,3,0) -> 5 | E69: =VLOOKUP(RC[1],ITEM!R3C2:R82C3,2,0) -> SY1W | F69: 魔龙护肩 | G69: =VLOOKUP(RC[1],ITEM!R3C2:R82C3,2,0) -> SY1X | H69: 魔龙腿甲 | I69: =VLOOKUP(RC[1],ITEM!R3C2:R82C3,2,0) -> SY1Y | J69: 魔龙头饰 | K69: 魔龙套装-嫉妒 | L69: 独立暴击20%10倍|n攻击时有概率风行 | M69: ST1W | N69: SB1W | O69: ="blp\suitItem\"&IF(RC[-12]>=10,"","0")&RC[-12]&" (1) .blp" -> blp\suitItem\09 (1) .blp | P69: ="new AffixItemLinkEntity("&RC[-12]&",'"&RC[-11]&"',"""&RC[-10]&""",'"&RC[-9]&"',"""&RC[-8]&""&""",'"&RC[-7]&"',"""&RC[-6]&""","""&RC[-14]&""","""&RC[-5]&""",'"&RC[-2]&"'"&")" -> new AffixItemLinkEntity(5,'SY1W',"魔龙护肩",'SY1X',"魔龙腿甲",'SY1Y',"魔龙头饰","魔龙","魔龙套装-嫉妒",'SB1W') | Q69: =IF(RC[-5]<>"","|n"&RC[-5],"")&IF(RC[3]="",,"|n"&R1C[3]&RC[3])&IF(RC[4]="",,"|n"&R1C[4]&RC[4])&IF(RC[5]="",,"|n"&R1C[5]&RC[5])&IF(RC[6]="",,"|n"&R1C[6]&RC[6])&IF(RC[7]="",,"|n"&R1C[7]&RC[7])&IF(RC[8]="",,"|n"&R1C[8]&RC[8])&IF(RC[10]="",,"|n"&R1C[10]&RC[10])&IF(RC[11]="",,"|n"&R1C[11]&RC[11])&IF(RC[12]="",,"|n"&R1C[12]&RC[12])&IF(RC[13]="",,"|n"&R1C[13]&RC[13])&IF(RC[14]="",,"|n"&R1C[14]&RC[14])&IF(RC[15]="",,"|n"&R1C[15]&RC[15])&IF(RC[16]="",,"|n"&R1C[16]&RC[16])&IF(RC[17]="",,"|n"&R1C[17]&RC[17])&IF(RC[18]="",,"|n"&R1C[18]&RC[18])&IF(RC[19]="",,"|n"&R1C[19]&RC[19])&IF(RC[20]="",,"|n"&R1C[20]&RC[20])&IF(RC[21]="",,"|n"&R1C29&RC[21])&IF(RC[22]="",,"|n"&R1C[22]&RC[22])&IF(RC[24]="",,"|n"&R1C[24]&RC[24])&IF(RC[25]="",,"|n"&R1C[25]&RC[25])&IF(RC[26]="",,"|n"&R1C[26]&RC[26])&IF(RC[28]="",,"|n"&RC[28]) -> |n独立暴击20%10倍|n攻击时有概率风行 | R69: =VLOOKUP(RC[-14],其他!R1C1:R7C2,2,0)&RC[-7]&"|r" -> |cFFFF9933魔龙套装-嫉妒|r
A70: 69 | B70: =VLOOKUP(RC[4],ITEM!R3C2:R82C6,5,0) -> 魔龙 | C70: 9 | D70: =VLOOKUP(RC[2],ITEM!R3C2:R82C4,3,0) -> 5 | E70: =VLOOKUP(RC[1],ITEM!R3C2:R82C3,2,0) -> SY1X | F70: 魔龙腿甲 | G70: =VLOOKUP(RC[1],ITEM!R3C2:R82C3,2,0) -> SY1Y | H70: 魔龙头饰 | I70: =VLOOKUP(RC[1],ITEM!R3C2:R82C3,2,0) -> SY1Z | J70: 魔龙战靴 | K70: 魔龙套装-骄傲 | L70: 攻击时有概率+10%智力持续2秒|n减少周围敌人20%攻击力 | M70: ST1X | N70: SB1X | O70: ="blp\suitItem\"&IF(RC[-12]>=10,"","0")&RC[-12]&" (1) .blp" -> blp\suitItem\09 (1) .blp | P70: ="new AffixItemLinkEntity("&RC[-12]&",'"&RC[-11]&"',"""&RC[-10]&""",'"&RC[-9]&"',"""&RC[-8]&""&""",'"&RC[-7]&"',"""&RC[-6]&""","""&RC[-14]&""","""&RC[-5]&""",'"&RC[-2]&"'"&")" -> new AffixItemLinkEntity(5,'SY1X',"魔龙腿甲",'SY1Y',"魔龙头饰",'SY1Z',"魔龙战靴","魔龙","魔龙套装-骄傲",'SB1X') | Q70: =IF(RC[-5]<>"","|n"&RC[-5],"")&IF(RC[3]="",,"|n"&R1C[3]&RC[3])&IF(RC[4]="",,"|n"&R1C[4]&RC[4])&IF(RC[5]="",,"|n"&R1C[5]&RC[5])&IF(RC[6]="",,"|n"&R1C[6]&RC[6])&IF(RC[7]="",,"|n"&R1C[7]&RC[7])&IF(RC[8]="",,"|n"&R1C[8]&RC[8])&IF(RC[10]="",,"|n"&R1C[10]&RC[10])&IF(RC[11]="",,"|n"&R1C[11]&RC[11])&IF(RC[12]="",,"|n"&R1C[12]&RC[12])&IF(RC[13]="",,"|n"&R1C[13]&RC[13])&IF(RC[14]="",,"|n"&R1C[14]&RC[14])&IF(RC[15]="",,"|n"&R1C[15]&RC[15])&IF(RC[16]="",,"|n"&R1C[16]&RC[16])&IF(RC[17]="",,"|n"&R1C[17]&RC[17])&IF(RC[18]="",,"|n"&R1C[18]&RC[18])&IF(RC[19]="",,"|n"&R1C[19]&RC[19])&IF(RC[20]="",,"|n"&R1C[20]&RC[20])&IF(RC[21]="",,"|n"&R1C29&RC[21])&IF(RC[22]="",,"|n"&R1C[22]&RC[22])&IF(RC[24]="",,"|n"&R1C[24]&RC[24])&IF(RC[25]="",,"|n"&R1C[25]&RC[25])&IF(RC[26]="",,"|n"&R1C[26]&RC[26])&IF(RC[28]="",,"|n"&RC[28]) -> |n攻击时有概率+10%智力持续2秒|n减少周围敌人20%攻击力 | R70: =VLOOKUP(RC[-14],其他!R1C1:R7C2,2,0)&RC[-7]&"|r" -> |cFFFF9933魔龙套装-骄傲|r
A71: 70 | B71: =VLOOKUP(RC[4],ITEM!R3C2:R82C6,5,0) -> 魔龙 | C71: 9 | D71: =VLOOKUP(RC[2],ITEM!R3C2:R82C4,3,0) -> 5 | E71: =VLOOKUP(RC[1],ITEM!R3C2:R82C3,2,0) -> SY1Y | F71: 魔龙头饰 | G71: =VLOOKUP(RC[1],ITEM!R3C2:R82C3,2,0) -> SY1Z | H71: 魔龙战靴 | I71: =VLOOKUP(RC[1],ITEM!R3C2:R82C3,2,0) -> SY20 | J71: 魔龙腰带 | K71: 魔龙套装-淫欲 | L71: 攻击时概率获得lv3护体|n生命恢复光环5%(自己) | M71: ST1Y | N71: SB1Y | O71: ="blp\suitItem\"&IF(RC[-12]>=10,"","0")&RC[-12]&" (1) .blp" -> blp\suitItem\09 (1) .blp | P71: ="new AffixItemLinkEntity("&RC[-12]&",'"&RC[-11]&"',"""&RC[-10]&""",'"&RC[-9]&"',"""&RC[-8]&""&""",'"&RC[-7]&"',"""&RC[-6]&""","""&RC[-14]&""","""&RC[-5]&""",'"&RC[-2]&"'"&")" -> new AffixItemLinkEntity(5,'SY1Y',"魔龙头饰",'SY1Z',"魔龙战靴",'SY20',"魔龙腰带","魔龙","魔龙套装-淫欲",'SB1Y') | Q71: =IF(RC[-5]<>"","|n"&RC[-5],"")&IF(RC[3]="",,"|n"&R1C[3]&RC[3])&IF(RC[4]="",,"|n"&R1C[4]&RC[4])&IF(RC[5]="",,"|n"&R1C[5]&RC[5])&IF(RC[6]="",,"|n"&R1C[6]&RC[6])&IF(RC[7]="",,"|n"&R1C[7]&RC[7])&IF(RC[8]="",,"|n"&R1C[8]&RC[8])&IF(RC[10]="",,"|n"&R1C[10]&RC[10])&IF(RC[11]="",,"|n"&R1C[11]&RC[11])&IF(RC[12]="",,"|n"&R1C[12]&RC[12])&IF(RC[13]="",,"|n"&R1C[13]&RC[13])&IF(RC[14]="",,"|n"&R1C[14]&RC[14])&IF(RC[15]="",,"|n"&R1C[15]&RC[15])&IF(RC[16]="",,"|n"&R1C[16]&RC[16])&IF(RC[17]="",,"|n"&R1C[17]&RC[17])&IF(RC[18]="",,"|n"&R1C[18]&RC[18])&IF(RC[19]="",,"|n"&R1C[19]&RC[19])&IF(RC[20]="",,"|n"&R1C[20]&RC[20])&IF(RC[21]="",,"|n"&R1C29&RC[21])&IF(RC[22]="",,"|n"&R1C[22]&RC[22])&IF(RC[24]="",,"|n"&R1C[24]&RC[24])&IF(RC[25]="",,"|n"&R1C[25]&RC[25])&IF(RC[26]="",,"|n"&R1C[26]&RC[26])&IF(RC[28]="",,"|n"&RC[28]) -> |n攻击时概率获得lv3护体|n生命恢复光环5%(自己) | R71: =VLOOKUP(RC[-14],其他!R1C1:R7C2,2,0)&RC[-7]&"|r" -> |cFFFF9933魔龙套装-淫欲|r
A72: 71 | B72: =VLOOKUP(RC[4],ITEM!R3C2:R82C6,5,0) -> 魔龙 | C72: 9 | D72: =VLOOKUP(RC[2],ITEM!R3C2:R82C4,3,0) -> 5 | E72: =VLOOKUP(RC[1],ITEM!R3C2:R82C3,2,0) -> SY1Z | F72: 魔龙战靴 | G72: =VLOOKUP(RC[1],ITEM!R3C2:R82C3,2,0) -> SY20 | H72: 魔龙腰带 | I72: =VLOOKUP(RC[1],ITEM!R3C2:R82C3,2,0) -> SY1T | J72: 魔龙长刃 | K72: 魔龙套装-愤怒 | L72: 攻击时3%对施加暴怒 | M72: ST1Z | N72: SB1Z | O72: ="blp\suitItem\"&IF(RC[-12]>=10,"","0")&RC[-12]&" (1) .blp" -> blp\suitItem\09 (1) .blp | P72: ="new AffixItemLinkEntity("&RC[-12]&",'"&RC[-11]&"',"""&RC[-10]&""",'"&RC[-9]&"',"""&RC[-8]&""&""",'"&RC[-7]&"',"""&RC[-6]&""","""&RC[-14]&""","""&RC[-5]&""",'"&RC[-2]&"'"&")" -> new AffixItemLinkEntity(5,'SY1Z',"魔龙战靴",'SY20',"魔龙腰带",'SY1T',"魔龙长刃","魔龙","魔龙套装-愤怒",'SB1Z') | Q72: =IF(RC[-5]<>"","|n"&RC[-5],"")&IF(RC[3]="",,"|n"&R1C[3]&RC[3])&IF(RC[4]="",,"|n"&R1C[4]&RC[4])&IF(RC[5]="",,"|n"&R1C[5]&RC[5])&IF(RC[6]="",,"|n"&R1C[6]&RC[6])&IF(RC[7]="",,"|n"&R1C[7]&RC[7])&IF(RC[8]="",,"|n"&R1C[8]&RC[8])&IF(RC[10]="",,"|n"&R1C[10]&RC[10])&IF(RC[11]="",,"|n"&R1C[11]&RC[11])&IF(RC[12]="",,"|n"&R1C[12]&RC[12])&IF(RC[13]="",,"|n"&R1C[13]&RC[13])&IF(RC[14]="",,"|n"&R1C[14]&RC[14])&IF(RC[15]="",,"|n"&R1C[15]&RC[15])&IF(RC[16]="",,"|n"&R1C[16]&RC[16])&IF(RC[17]="",,"|n"&R1C[17]&RC[17])&IF(RC[18]="",,"|n"&R1C[18]&RC[18])&IF(RC[19]="",,"|n"&R1C[19]&RC[19])&IF(RC[20]="",,"|n"&R1C[20]&RC[20])&IF(RC[21]="",,"|n"&R1C29&RC[21])&IF(RC[22]="",,"|n"&R1C[22]&RC[22])&IF(RC[24]="",,"|n"&R1C[24]&RC[24])&IF(RC[25]="",,"|n"&R1C[25]&RC[25])&IF(RC[26]="",,"|n"&R1C[26]&RC[26])&IF(RC[28]="",,"|n"&RC[28]) -> |n攻击时3%对施加暴怒 | R72: =VLOOKUP(RC[-14],其他!R1C1:R7C2,2,0)&RC[-7]&"|r" -> |cFFFF9933魔龙套装-愤怒|r
A73: 72 | B73: =VLOOKUP(RC[4],ITEM!R3C2:R82C6,5,0) -> 魔龙 | C73: 9 | D73: =VLOOKUP(RC[2],ITEM!R3C2:R82C4,3,0) -> 5 | E73: =VLOOKUP(RC[1],ITEM!R3C2:R82C3,2,0) -> SY20 | F73: 魔龙腰带 | G73: =VLOOKUP(RC[1],ITEM!R3C2:R82C3,2,0) -> SY1T | H73: 魔龙长刃 | I73: =VLOOKUP(RC[1],ITEM!R3C2:R82C3,2,0) -> SY1U | J73: 魔龙胸甲 | K73: 魔龙套装-虚伪 | M73: ST20 | N73: SB20 | O73: ="blp\suitItem\"&IF(RC[-12]>=10,"","0")&RC[-12]&" (1) .blp" -> blp\suitItem\09 (1) .blp | P73: ="new AffixItemLinkEntity("&RC[-12]&",'"&RC[-11]&"',"""&RC[-10]&""",'"&RC[-9]&"',"""&RC[-8]&""&""",'"&RC[-7]&"',"""&RC[-6]&""","""&RC[-14]&""","""&RC[-5]&""",'"&RC[-2]&"'"&")" -> new AffixItemLinkEntity(5,'SY20',"魔龙腰带",'SY1T',"魔龙长刃",'SY1U',"魔龙胸甲","魔龙","魔龙套装-虚伪",'SB20') | Q73: =IF(RC[-5]<>"","|n"&RC[-5],"")&IF(RC[3]="",,"|n"&R1C[3]&RC[3])&IF(RC[4]="",,"|n"&R1C[4]&RC[4])&IF(RC[5]="",,"|n"&R1C[5]&RC[5])&IF(RC[6]="",,"|n"&R1C[6]&RC[6])&IF(RC[7]="",,"|n"&R1C[7]&RC[7])&IF(RC[8]="",,"|n"&R1C[8]&RC[8])&IF(RC[10]="",,"|n"&R1C[10]&RC[10])&IF(RC[11]="",,"|n"&R1C[11]&RC[11])&IF(RC[12]="",,"|n"&R1C[12]&RC[12])&IF(RC[13]="",,"|n"&R1C[13]&RC[13])&IF(RC[14]="",,"|n"&R1C[14]&RC[14])&IF(RC[15]="",,"|n"&R1C[15]&RC[15])&IF(RC[16]="",,"|n"&R1C[16]&RC[16])&IF(RC[17]="",,"|n"&R1C[17]&RC[17])&IF(RC[18]="",,"|n"&R1C[18]&RC[18])&IF(RC[19]="",,"|n"&R1C[19]&RC[19])&IF(RC[20]="",,"|n"&R1C[20]&RC[20])&IF(RC[21]="",,"|n"&R1C29&RC[21])&IF(RC[22]="",,"|n"&R1C[22]&RC[22])&IF(RC[24]="",,"|n"&R1C[24]&RC[24])&IF(RC[25]="",,"|n"&R1C[25]&RC[25])&IF(RC[26]="",,"|n"&R1C[26]&RC[26])&IF(RC[28]="",,"|n"&RC[28]) -> |n力量:1200000|n敏捷:1200000|n智力:1200000 | R73: =VLOOKUP(RC[-14],其他!R1C1:R7C2,2,0)&RC[-7]&"|r" -> |cFFFF9933魔龙套装-虚伪|r | U73: 1200000 | V73: 1200000 | W73: 1200000
A74: 73 | B74: =VLOOKUP(RC[4],ITEM!R3C2:R82C6,5,0) -> 修罗 | C74: 10 | D74: =VLOOKUP(RC[2],ITEM!R3C2:R82C4,3,0) -> 5 | E74: =VLOOKUP(RC[1],ITEM!R3C2:R82C3,2,0) -> SY21 | F74: 修罗长刃 | G74: =VLOOKUP(RC[1],ITEM!R3C2:R82C3,2,0) -> SY22 | H74: 修罗胸甲 | I74: =VLOOKUP(RC[1],ITEM!R3C2:R82C3,2,0) -> SY23 | J74: 修罗护手 | K74: 修罗套装-嗜血 | M74: ST21 | N74: SB21 | O74: ="blp\suitItem\"&IF(RC[-12]>=10,"","0")&RC[-12]&" (1) .blp" -> blp\suitItem\10 (1) .blp | P74: ="new AffixItemLinkEntity("&RC[-12]&",'"&RC[-11]&"',"""&RC[-10]&""",'"&RC[-9]&"',"""&RC[-8]&""&""",'"&RC[-7]&"',"""&RC[-6]&""","""&RC[-14]&""","""&RC[-5]&""",'"&RC[-2]&"'"&")" -> new AffixItemLinkEntity(5,'SY21',"修罗长刃",'SY22',"修罗胸甲",'SY23',"修罗护手","修罗","修罗套装-嗜血",'SB21') | Q74: =IF(RC[-5]<>"","|n"&RC[-5],"")&IF(RC[3]="",,"|n"&R1C[3]&RC[3])&IF(RC[4]="",,"|n"&R1C[4]&RC[4])&IF(RC[5]="",,"|n"&R1C[5]&RC[5])&IF(RC[6]="",,"|n"&R1C[6]&RC[6])&IF(RC[7]="",,"|n"&R1C[7]&RC[7])&IF(RC[8]="",,"|n"&R1C[8]&RC[8])&IF(RC[10]="",,"|n"&R1C[10]&RC[10])&IF(RC[11]="",,"|n"&R1C[11]&RC[11])&IF(RC[12]="",,"|n"&R1C[12]&RC[12])&IF(RC[13]="",,"|n"&R1C[13]&RC[13])&IF(RC[14]="",,"|n"&R1C[14]&RC[14])&IF(RC[15]="",,"|n"&R1C[15]&RC[15])&IF(RC[16]="",,"|n"&R1C[16]&RC[16])&IF(RC[17]="",,"|n"&R1C[17]&RC[17])&IF(RC[18]="",,"|n"&R1C[18]&RC[18])&IF(RC[19]="",,"|n"&R1C[19]&RC[19])&IF(RC[20]="",,"|n"&R1C[20]&RC[20])&IF(RC[21]="",,"|n"&R1C29&RC[21])&IF(RC[22]="",,"|n"&R1C[22]&RC[22])&IF(RC[24]="",,"|n"&R1C[24]&RC[24])&IF(RC[25]="",,"|n"&R1C[25]&RC[25])&IF(RC[26]="",,"|n"&R1C[26]&RC[26])&IF(RC[28]="",,"|n"&RC[28]) -> |n攻击吸血:10|n暴击伤害:20|n伤害增幅:20|n附加伤害:20 | R74: =VLOOKUP(RC[-14],其他!R1C1:R7C2,2,0)&RC[-7]&"|r" -> |cFFFF9933修罗套装-嗜血|r | AB74: 10 | AD74: 20 | AE74: 20 | AF74: 20
A75: 74 | B75: =VLOOKUP(RC[4],ITEM!R3C2:R82C6,5,0) -> 修罗 | C75: 10 | D75: =VLOOKUP(RC[2],ITEM!R3C2:R82C4,3,0) -> 5 | E75: =VLOOKUP(RC[1],ITEM!R3C2:R82C3,2,0) -> SY22 | F75: 修罗胸甲 | G75: =VLOOKUP(RC[1],ITEM!R3C2:R82C3,2,0) -> SY23 | H75: 修罗护手 | I75: =VLOOKUP(RC[1],ITEM!R3C2:R82C3,2,0) -> SY24 | J75: 修罗护肩 | K75: 修罗套装-暴虐 | L75: 无视独立闪避|n减少周围敌人20%移动速度 | M75: ST22 | N75: SB22 | O75: ="blp\suitItem\"&IF(RC[-12]>=10,"","0")&RC[-12]&" (1) .blp" -> blp\suitItem\10 (1) .blp | P75: ="new AffixItemLinkEntity("&RC[-12]&",'"&RC[-11]&"',"""&RC[-10]&""",'"&RC[-9]&"',"""&RC[-8]&""&""",'"&RC[-7]&"',"""&RC[-6]&""","""&RC[-14]&""","""&RC[-5]&""",'"&RC[-2]&"'"&")" -> new AffixItemLinkEntity(5,'SY22',"修罗胸甲",'SY23',"修罗护手",'SY24',"修罗护肩","修罗","修罗套装-暴虐",'SB22') | Q75: =IF(RC[-5]<>"","|n"&RC[-5],"")&IF(RC[3]="",,"|n"&R1C[3]&RC[3])&IF(RC[4]="",,"|n"&R1C[4]&RC[4])&IF(RC[5]="",,"|n"&R1C[5]&RC[5])&IF(RC[6]="",,"|n"&R1C[6]&RC[6])&IF(RC[7]="",,"|n"&R1C[7]&RC[7])&IF(RC[8]="",,"|n"&R1C[8]&RC[8])&IF(RC[10]="",,"|n"&R1C[10]&RC[10])&IF(RC[11]="",,"|n"&R1C[11]&RC[11])&IF(RC[12]="",,"|n"&R1C[12]&RC[12])&IF(RC[13]="",,"|n"&R1C[13]&RC[13])&IF(RC[14]="",,"|n"&R1C[14]&RC[14])&IF(RC[15]="",,"|n"&R1C[15]&RC[15])&IF(RC[16]="",,"|n"&R1C[16]&RC[16])&IF(RC[17]="",,"|n"&R1C[17]&RC[17])&IF(RC[18]="",,"|n"&R1C[18]&RC[18])&IF(RC[19]="",,"|n"&R1C[19]&RC[19])&IF(RC[20]="",,"|n"&R1C[20]&RC[20])&IF(RC[21]="",,"|n"&R1C29&RC[21])&IF(RC[22]="",,"|n"&R1C[22]&RC[22])&IF(RC[24]="",,"|n"&R1C[24]&RC[24])&IF(RC[25]="",,"|n"&R1C[25]&RC[25])&IF(RC[26]="",,"|n"&R1C[26]&RC[26])&IF(RC[28]="",,"|n"&RC[28]) -> |n无视独立闪避|n减少周围敌人20%移动速度 | R75: =VLOOKUP(RC[-14],其他!R1C1:R7C2,2,0)&RC[-7]&"|r" -> |cFFFF9933修罗套装-暴虐|r
A76: 75 | B76: =VLOOKUP(RC[4],ITEM!R3C2:R82C6,5,0) -> 修罗 | C76: 10 | D76: =VLOOKUP(RC[2],ITEM!R3C2:R82C4,3,0) -> 5 | E76: =VLOOKUP(RC[1],ITEM!R3C2:R82C3,2,0) -> SY23 | F76: 修罗护手 | G76: =VLOOKUP(RC[1],ITEM!R3C2:R82C3,2,0) -> SY24 | H76: 修罗护肩 | I76: =VLOOKUP(RC[1],ITEM!R3C2:R82C3,2,0) -> SY25 | J76: 修罗腿甲 | K76: 修罗套装-残暴 | L76: 攻击有概率重置CD|n被攻击时有概率解除控制 | M76: ST23 | N76: SB23 | O76: ="blp\suitItem\"&IF(RC[-12]>=10,"","0")&RC[-12]&" (1) .blp" -> blp\suitItem\10 (1) .blp | P76: ="new AffixItemLinkEntity("&RC[-12]&",'"&RC[-11]&"',"""&RC[-10]&""",'"&RC[-9]&"',"""&RC[-8]&""&""",'"&RC[-7]&"',"""&RC[-6]&""","""&RC[-14]&""","""&RC[-5]&""",'"&RC[-2]&"'"&")" -> new AffixItemLinkEntity(5,'SY23',"修罗护手",'SY24',"修罗护肩",'SY25',"修罗腿甲","修罗","修罗套装-残暴",'SB23') | Q76: =IF(RC[-5]<>"","|n"&RC[-5],"")&IF(RC[3]="",,"|n"&R1C[3]&RC[3])&IF(RC[4]="",,"|n"&R1C[4]&RC[4])&IF(RC[5]="",,"|n"&R1C[5]&RC[5])&IF(RC[6]="",,"|n"&R1C[6]&RC[6])&IF(RC[7]="",,"|n"&R1C[7]&RC[7])&IF(RC[8]="",,"|n"&R1C[8]&RC[8])&IF(RC[10]="",,"|n"&R1C[10]&RC[10])&IF(RC[11]="",,"|n"&R1C[11]&RC[11])&IF(RC[12]="",,"|n"&R1C[12]&RC[12])&IF(RC[13]="",,"|n"&R1C[13]&RC[13])&IF(RC[14]="",,"|n"&R1C[14]&RC[14])&IF(RC[15]="",,"|n"&R1C[15]&RC[15])&IF(RC[16]="",,"|n"&R1C[16]&RC[16])&IF(RC[17]="",,"|n"&R1C[17]&RC[17])&IF(RC[18]="",,"|n"&R1C[18]&RC[18])&IF(RC[19]="",,"|n"&R1C[19]&RC[19])&IF(RC[20]="",,"|n"&R1C[20]&RC[20])&IF(RC[21]="",,"|n"&R1C29&RC[21])&IF(RC[22]="",,"|n"&R1C[22]&RC[22])&IF(RC[24]="",,"|n"&R1C[24]&RC[24])&IF(RC[25]="",,"|n"&R1C[25]&RC[25])&IF(RC[26]="",,"|n"&R1C[26]&RC[26])&IF(RC[28]="",,"|n"&RC[28]) -> |n攻击有概率重置CD|n被攻击时有概率解除控制 | R76: =VLOOKUP(RC[-14],其他!R1C1:R7C2,2,0)&RC[-7]&"|r" -> |cFFFF9933修罗套装-残暴|r
A77: 76 | B77: =VLOOKUP(RC[4],ITEM!R3C2:R82C6,5,0) -> 修罗 | C77: 10 | D77: =VLOOKUP(RC[2],ITEM!R3C2:R82C4,3,0) -> 5 | E77: =VLOOKUP(RC[1],ITEM!R3C2:R82C3,2,0) -> SY24 | F77: 修罗护肩 | G77: =VLOOKUP(RC[1],ITEM!R3C2:R82C3,2,0) -> SY25 | H77: 修罗腿甲 | I77: =VLOOKUP(RC[1],ITEM!R3C2:R82C3,2,0) -> SY26 | J77: 修罗头饰 | K77: 修罗套装-弑杀 | L77: 攻击时有概率+10%攻击持续3秒|n | M77: ST24 | N77: SB24 | O77: ="blp\suitItem\"&IF(RC[-12]>=10,"","0")&RC[-12]&" (1) .blp" -> blp\suitItem\10 (1) .blp | P77: ="new AffixItemLinkEntity("&RC[-12]&",'"&RC[-11]&"',"""&RC[-10]&""",'"&RC[-9]&"',"""&RC[-8]&""&""",'"&RC[-7]&"',"""&RC[-6]&""","""&RC[-14]&""","""&RC[-5]&""",'"&RC[-2]&"'"&")" -> new AffixItemLinkEntity(5,'SY24',"修罗护肩",'SY25',"修罗腿甲",'SY26',"修罗头饰","修罗","修罗套装-弑杀",'SB24') | Q77: =IF(RC[-5]<>"","|n"&RC[-5],"")&IF(RC[3]="",,"|n"&R1C[3]&RC[3])&IF(RC[4]="",,"|n"&R1C[4]&RC[4])&IF(RC[5]="",,"|n"&R1C[5]&RC[5])&IF(RC[6]="",,"|n"&R1C[6]&RC[6])&IF(RC[7]="",,"|n"&R1C[7]&RC[7])&IF(RC[8]="",,"|n"&R1C[8]&RC[8])&IF(RC[10]="",,"|n"&R1C[10]&RC[10])&IF(RC[11]="",,"|n"&R1C[11]&RC[11])&IF(RC[12]="",,"|n"&R1C[12]&RC[12])&IF(RC[13]="",,"|n"&R1C[13]&RC[13])&IF(RC[14]="",,"|n"&R1C[14]&RC[14])&IF(RC[15]="",,"|n"&R1C[15]&RC[15])&IF(RC[16]="",,"|n"&R1C[16]&RC[16])&IF(RC[17]="",,"|n"&R1C[17]&RC[17])&IF(RC[18]="",,"|n"&R1C[18]&RC[18])&IF(RC[19]="",,"|n"&R1C[19]&RC[19])&IF(RC[20]="",,"|n"&R1C[20]&RC[20])&IF(RC[21]="",,"|n"&R1C29&RC[21])&IF(RC[22]="",,"|n"&R1C[22]&RC[22])&IF(RC[24]="",,"|n"&R1C[24]&RC[24])&IF(RC[25]="",,"|n"&R1C[25]&RC[25])&IF(RC[26]="",,"|n"&R1C[26]&RC[26])&IF(RC[28]="",,"|n"&RC[28]) -> |n攻击时有概率+10%攻击持续3秒|n|n暴击概率:20 | R77: =VLOOKUP(RC[-14],其他!R1C1:R7C2,2,0)&RC[-7]&"|r" -> |cFFFF9933修罗套装-弑杀|r | AC77: 20
A78: 77 | B78: =VLOOKUP(RC[4],ITEM!R3C2:R82C6,5,0) -> 修罗 | C78: 10 | D78: =VLOOKUP(RC[2],ITEM!R3C2:R82C4,3,0) -> 5 | E78: =VLOOKUP(RC[1],ITEM!R3C2:R82C3,2,0) -> SY25 | F78: 修罗腿甲 | G78: =VLOOKUP(RC[1],ITEM!R3C2:R82C3,2,0) -> SY26 | H78: 修罗头饰 | I78: =VLOOKUP(RC[1],ITEM!R3C2:R82C3,2,0) -> SY27 | J78: 修罗战靴 | K78: 修罗套装-喋血 | L78: 攻击时概率附加lv4破绽|n | M78: ST25 | N78: SB25 | O78: ="blp\suitItem\"&IF(RC[-12]>=10,"","0")&RC[-12]&" (1) .blp" -> blp\suitItem\10 (1) .blp | P78: ="new AffixItemLinkEntity("&RC[-12]&",'"&RC[-11]&"',"""&RC[-10]&""",'"&RC[-9]&"',"""&RC[-8]&""&""",'"&RC[-7]&"',"""&RC[-6]&""","""&RC[-14]&""","""&RC[-5]&""",'"&RC[-2]&"'"&")" -> new AffixItemLinkEntity(5,'SY25',"修罗腿甲",'SY26',"修罗头饰",'SY27',"修罗战靴","修罗","修罗套装-喋血",'SB25') | Q78: =IF(RC[-5]<>"","|n"&RC[-5],"")&IF(RC[3]="",,"|n"&R1C[3]&RC[3])&IF(RC[4]="",,"|n"&R1C[4]&RC[4])&IF(RC[5]="",,"|n"&R1C[5]&RC[5])&IF(RC[6]="",,"|n"&R1C[6]&RC[6])&IF(RC[7]="",,"|n"&R1C[7]&RC[7])&IF(RC[8]="",,"|n"&R1C[8]&RC[8])&IF(RC[10]="",,"|n"&R1C[10]&RC[10])&IF(RC[11]="",,"|n"&R1C[11]&RC[11])&IF(RC[12]="",,"|n"&R1C[12]&RC[12])&IF(RC[13]="",,"|n"&R1C[13]&RC[13])&IF(RC[14]="",,"|n"&R1C[14]&RC[14])&IF(RC[15]="",,"|n"&R1C[15]&RC[15])&IF(RC[16]="",,"|n"&R1C[16]&RC[16])&IF(RC[17]="",,"|n"&R1C[17]&RC[17])&IF(RC[18]="",,"|n"&R1C[18]&RC[18])&IF(RC[19]="",,"|n"&R1C[19]&RC[19])&IF(RC[20]="",,"|n"&R1C[20]&RC[20])&IF(RC[21]="",,"|n"&R1C29&RC[21])&IF(RC[22]="",,"|n"&R1C[22]&RC[22])&IF(RC[24]="",,"|n"&R1C[24]&RC[24])&IF(RC[25]="",,"|n"&R1C[25]&RC[25])&IF(RC[26]="",,"|n"&R1C[26]&RC[26])&IF(RC[28]="",,"|n"&RC[28]) -> |n攻击时概率附加lv4破绽|n | R78: =VLOOKUP(RC[-14],其他!R1C1:R7C2,2,0)&RC[-7]&"|r" -> |cFFFF9933修罗套装-喋血|r
A79: 78 | B79: =VLOOKUP(RC[4],ITEM!R3C2:R82C6,5,0) -> 修罗 | C79: 10 | D79: =VLOOKUP(RC[2],ITEM!R3C2:R82C4,3,0) -> 5 | E79: =VLOOKUP(RC[1],ITEM!R3C2:R82C3,2,0) -> SY26 | F79: 修罗头饰 | G79: =VLOOKUP(RC[1],ITEM!R3C2:R82C3,2,0) -> SY27 | H79: 修罗战靴 | I79: =VLOOKUP(RC[1],ITEM!R3C2:R82C3,2,0) -> SY28 | J79: 修罗腰带 | K79: 修罗套装-湮灭 | L79: 独立暴击10%10倍 | M79: ST26 | N79: SB26 | O79: ="blp\suitItem\"&IF(RC[-12]>=10,"","0")&RC[-12]&" (1) .blp" -> blp\suitItem\10 (1) .blp | P79: ="new AffixItemLinkEntity("&RC[-12]&",'"&RC[-11]&"',"""&RC[-10]&""",'"&RC[-9]&"',"""&RC[-8]&""&""",'"&RC[-7]&"',"""&RC[-6]&""","""&RC[-14]&""","""&RC[-5]&""",'"&RC[-2]&"'"&")" -> new AffixItemLinkEntity(5,'SY26',"修罗头饰",'SY27',"修罗战靴",'SY28',"修罗腰带","修罗","修罗套装-湮灭",'SB26') | Q79: =IF(RC[-5]<>"","|n"&RC[-5],"")&IF(RC[3]="",,"|n"&R1C[3]&RC[3])&IF(RC[4]="",,"|n"&R1C[4]&RC[4])&IF(RC[5]="",,"|n"&R1C[5]&RC[5])&IF(RC[6]="",,"|n"&R1C[6]&RC[6])&IF(RC[7]="",,"|n"&R1C[7]&RC[7])&IF(RC[8]="",,"|n"&R1C[8]&RC[8])&IF(RC[10]="",,"|n"&R1C[10]&RC[10])&IF(RC[11]="",,"|n"&R1C[11]&RC[11])&IF(RC[12]="",,"|n"&R1C[12]&RC[12])&IF(RC[13]="",,"|n"&R1C[13]&RC[13])&IF(RC[14]="",,"|n"&R1C[14]&RC[14])&IF(RC[15]="",,"|n"&R1C[15]&RC[15])&IF(RC[16]="",,"|n"&R1C[16]&RC[16])&IF(RC[17]="",,"|n"&R1C[17]&RC[17])&IF(RC[18]="",,"|n"&R1C[18]&RC[18])&IF(RC[19]="",,"|n"&R1C[19]&RC[19])&IF(RC[20]="",,"|n"&R1C[20]&RC[20])&IF(RC[21]="",,"|n"&R1C29&RC[21])&IF(RC[22]="",,"|n"&R1C[22]&RC[22])&IF(RC[24]="",,"|n"&R1C[24]&RC[24])&IF(RC[25]="",,"|n"&R1C[25]&RC[25])&IF(RC[26]="",,"|n"&R1C[26]&RC[26])&IF(RC[28]="",,"|n"&RC[28]) -> |n独立暴击10%10倍|n攻击吸血:5|n暴击伤害:20 | R79: =VLOOKUP(RC[-14],其他!R1C1:R7C2,2,0)&RC[-7]&"|r" -> |cFFFF9933修罗套装-湮灭|r | AB79: 5 | AD79: 20
A80: 79 | B80: =VLOOKUP(RC[4],ITEM!R3C2:R82C6,5,0) -> 修罗 | C80: 10 | D80: =VLOOKUP(RC[2],ITEM!R3C2:R82C4,3,0) -> 5 | E80: =VLOOKUP(RC[1],ITEM!R3C2:R82C3,2,0) -> SY27 | F80: 修罗战靴 | G80: =VLOOKUP(RC[1],ITEM!R3C2:R82C3,2,0) -> SY28 | H80: 修罗腰带 | I80: =VLOOKUP(RC[1],ITEM!R3C2:R82C3,2,0) -> SY21 | J80: 修罗长刃 | K80: 修罗套装-毁灭 | L80: 攻击时概率获得lv4强化|n | M80: ST27 | N80: SB27 | O80: ="blp\suitItem\"&IF(RC[-12]>=10,"","0")&RC[-12]&" (1) .blp" -> blp\suitItem\10 (1) .blp | P80: ="new AffixItemLinkEntity("&RC[-12]&",'"&RC[-11]&"',"""&RC[-10]&""",'"&RC[-9]&"',"""&RC[-8]&""&""",'"&RC[-7]&"',"""&RC[-6]&""","""&RC[-14]&""","""&RC[-5]&""",'"&RC[-2]&"'"&")" -> new AffixItemLinkEntity(5,'SY27',"修罗战靴",'SY28',"修罗腰带",'SY21',"修罗长刃","修罗","修罗套装-毁灭",'SB27') | Q80: =IF(RC[-5]<>"","|n"&RC[-5],"")&IF(RC[3]="",,"|n"&R1C[3]&RC[3])&IF(RC[4]="",,"|n"&R1C[4]&RC[4])&IF(RC[5]="",,"|n"&R1C[5]&RC[5])&IF(RC[6]="",,"|n"&R1C[6]&RC[6])&IF(RC[7]="",,"|n"&R1C[7]&RC[7])&IF(RC[8]="",,"|n"&R1C[8]&RC[8])&IF(RC[10]="",,"|n"&R1C[10]&RC[10])&IF(RC[11]="",,"|n"&R1C[11]&RC[11])&IF(RC[12]="",,"|n"&R1C[12]&RC[12])&IF(RC[13]="",,"|n"&R1C[13]&RC[13])&IF(RC[14]="",,"|n"&R1C[14]&RC[14])&IF(RC[15]="",,"|n"&R1C[15]&RC[15])&IF(RC[16]="",,"|n"&R1C[16]&RC[16])&IF(RC[17]="",,"|n"&R1C[17]&RC[17])&IF(RC[18]="",,"|n"&R1C[18]&RC[18])&IF(RC[19]="",,"|n"&R1C[19]&RC[19])&IF(RC[20]="",,"|n"&R1C[20]&RC[20])&IF(RC[21]="",,"|n"&R1C29&RC[21])&IF(RC[22]="",,"|n"&R1C[22]&RC[22])&IF(RC[24]="",,"|n"&R1C[24]&RC[24])&IF(RC[25]="",,"|n"&R1C[25]&RC[25])&IF(RC[26]="",,"|n"&R1C[26]&RC[26])&IF(RC[28]="",,"|n"&RC[28]) -> |n攻击时概率获得lv4强化|n | R80: =VLOOKUP(RC[-14],其他!R1C1:R7C2,2,0)&RC[-7]&"|r" -> |cFFFF9933修罗套装-毁灭|r
A81: 80 | B81: =VLOOKUP(RC[4],ITEM!R3C2:R82C6,5,0) -> 修罗 | C81: 10 | D81: =VLOOKUP(RC[2],ITEM!R3C2:R82C4,3,0) -> 5 | E81: =VLOOKUP(RC[1],ITEM!R3C2:R82C3,2,0) -> SY28 | F81: 修罗腰带 | G81: =VLOOKUP(RC[1],ITEM!R3C2:R82C3,2,0) -> SY21 | H81: 修罗长刃 | I81: =VLOOKUP(RC[1],ITEM!R3C2:R82C3,2,0) -> SY22 | J81: 修罗胸甲 | K81: 修罗套装-冷血 | L81: 攻击时概率获得lv4护体|n生命恢复光环3%(队友) | M81: ST28 | N81: SB28 | O81: ="blp\suitItem\"&IF(RC[-12]>=10,"","0")&RC[-12]&" (1) .blp" -> blp\suitItem\10 (1) .blp | P81: ="new AffixItemLinkEntity("&RC[-12]&",'"&RC[-11]&"',"""&RC[-10]&""",'"&RC[-9]&"',"""&RC[-8]&""&""",'"&RC[-7]&"',"""&RC[-6]&""","""&RC[-14]&""","""&RC[-5]&""",'"&RC[-2]&"'"&")" -> new AffixItemLinkEntity(5,'SY28',"修罗腰带",'SY21',"修罗长刃",'SY22',"修罗胸甲","修罗","修罗套装-冷血",'SB28') | Q81: =IF(RC[-5]<>"","|n"&RC[-5],"")&IF(RC[3]="",,"|n"&R1C[3]&RC[3])&IF(RC[4]="",,"|n"&R1C[4]&RC[4])&IF(RC[5]="",,"|n"&R1C[5]&RC[5])&IF(RC[6]="",,"|n"&R1C[6]&RC[6])&IF(RC[7]="",,"|n"&R1C[7]&RC[7])&IF(RC[8]="",,"|n"&R1C[8]&RC[8])&IF(RC[10]="",,"|n"&R1C[10]&RC[10])&IF(RC[11]="",,"|n"&R1C[11]&RC[11])&IF(RC[12]="",,"|n"&R1C[12]&RC[12])&IF(RC[13]="",,"|n"&R1C[13]&RC[13])&IF(RC[14]="",,"|n"&R1C[14]&RC[14])&IF(RC[15]="",,"|n"&R1C[15]&RC[15])&IF(RC[16]="",,"|n"&R1C[16]&RC[16])&IF(RC[17]="",,"|n"&R1C[17]&RC[17])&IF(RC[18]="",,"|n"&R1C[18]&RC[18])&IF(RC[19]="",,"|n"&R1C[19]&RC[19])&IF(RC[20]="",,"|n"&R1C[20]&RC[20])&IF(RC[21]="",,"|n"&R1C29&RC[21])&IF(RC[22]="",,"|n"&R1C[22]&RC[22])&IF(RC[24]="",,"|n"&R1C[24]&RC[24])&IF(RC[25]="",,"|n"&R1C[25]&RC[25])&IF(RC[26]="",,"|n"&R1C[26]&RC[26])&IF(RC[28]="",,"|n"&RC[28]) -> |n攻击时概率获得lv4护体|n生命恢复光环3%(队友) | R81: =VLOOKUP(RC[-14],其他!R1C1:R7C2,2,0)&RC[-7]&"|r" -> |cFFFF9933修罗套装-冷血|r

Sheet: 其他
A1: 1 | B1: |cFF999999
A2: 2 | B2: |cFF99FF66
A3: 3 | B3: |cFF1BE6B8
A4: 4 | B4: |cFF33FF00
A5: 5 | B5: |cFFFF9933
A6: 6 | B6: |Cffff0000
A7: 7 | B7: |Cffff1111