Sheet: ABIL
A1: INDEX | B1: NAME | C1: ACTIVE | D1: CLASS | E1: PROP | F1: ACT | G1: POWER | I1: ATTR | J1: TIP | K1: ART | L1: _CODE
A2: 0 | B2: 未解锁 | C2: 被动 | D2: 基础 | E2: 等待解锁 | G2: 等待解锁 | I2: =VLOOKUP(RC[-8],属性!C1:C3,3,0) ->  | J2: 等待解锁 | K2: ReplaceableTextures\CommandButtons\BTNCancel.blp
A3: 1 | B3: 未学习 | C3: 被动 | D3: 基础 | E3: 等待学习 | G3: 等待学习 | I3: =VLOOKUP(RC[-8],属性!C1:C3,3,0) ->  | J3: 等待学习 | K3: ReplaceableTextures\CommandButtons\BTNSelectHeroOn.blp
A4: 2 | B4: 无情 | C4: 被动 | D4: 普通 | E4: ALL | F4: 扇形 | G4: 1.3 | I4: =VLOOKUP(RC[-8],属性!C1:C3,3,0) -> |n附加伤害:15 | J4: =IFERROR(VLOOKUP(RC[-9],扇形!C1:C4,4,0),"")&IFERROR(VLOOKUP(RC[-9],线性延迟!C1:C4,4,0),"")&IFERROR(VLOOKUP(RC[-9],线性!C1:C4,4,0),"")&IFERROR(VLOOKUP(RC[-9],圆形!C1:C4,4,0),"") -> 攻击时有10%概率|n对扇形区域发射3枚弹幕造成伤害! | K4: blp\heroRandomSpell\jNblp02.blp | L4: =IFERROR(VLOOKUP(RC[-11],扇形!C1:C5,5,0),"")&IFERROR(VLOOKUP(RC[-11],线性延迟!C1:C5,5,0),"")&IFERROR(VLOOKUP(RC[-11],线性!C1:C5,5,0),"")&IFERROR(VLOOKUP(RC[-11],圆形!C1:C5,5,0),"") -> _rs2.setData("war3mapImported\\AZ_Aiushtha_T.mdl",Prop.ALL,1.3,10,3,0,1,900,0.6,3,30,30)
A5: 3 | B5: 如意 | C5: 被动 | D5: 普通 | E5: STR | F5: 扇形 | G5: 3.9000000000000004 | I5: =VLOOKUP(RC[-8],属性!C1:C3,3,0) -> |n附加伤害:6|n力量增幅:5 | J5: =IFERROR(VLOOKUP(RC[-9],扇形!C1:C4,4,0),"")&IFERROR(VLOOKUP(RC[-9],线性延迟!C1:C4,4,0),"")&IFERROR(VLOOKUP(RC[-9],线性!C1:C4,4,0),"")&IFERROR(VLOOKUP(RC[-9],圆形!C1:C4,4,0),"") -> 攻击时有10%概率|n对扇形区域发射3枚弹幕造成伤害! | K5: blp\heroRandomSpell\jNblp03.blp | L5: =IFERROR(VLOOKUP(RC[-11],扇形!C1:C5,5,0),"")&IFERROR(VLOOKUP(RC[-11],线性延迟!C1:C5,5,0),"")&IFERROR(VLOOKUP(RC[-11],线性!C1:C5,5,0),"")&IFERROR(VLOOKUP(RC[-11],圆形!C1:C5,5,0),"") -> _rs3.setData("war3mapImported\\AZ_Dragonus_C.mdl",Prop.STR,3.9,10,3,0,1,900,0.6,3,30,30)
A6: 4 | B6: 无名 | C6: 被动 | D6: 普通 | E6: AGI | F6: 扇形 | G6: 3.9 | I6: =VLOOKUP(RC[-8],属性!C1:C3,3,0) -> |n附加伤害:6|n敏捷增幅:5 | J6: =IFERROR(VLOOKUP(RC[-9],扇形!C1:C4,4,0),"")&IFERROR(VLOOKUP(RC[-9],线性延迟!C1:C4,4,0),"")&IFERROR(VLOOKUP(RC[-9],线性!C1:C4,4,0),"")&IFERROR(VLOOKUP(RC[-9],圆形!C1:C4,4,0),"") -> 攻击时有10%概率|n对扇形区域发射3枚弹幕造成伤害! | K6: blp\heroRandomSpell\jNblp04.blp | L6: =IFERROR(VLOOKUP(RC[-11],扇形!C1:C5,5,0),"")&IFERROR(VLOOKUP(RC[-11],线性延迟!C1:C5,5,0),"")&IFERROR(VLOOKUP(RC[-11],线性!C1:C5,5,0),"")&IFERROR(VLOOKUP(RC[-11],圆形!C1:C5,5,0),"") -> _rs4.setData("war3mapImported\\AZ_Sniper(2)_T_Misslie.mdl",Prop.AGI,3.9,10,3,0,1,900,0.6,3,30,30)
A7: 5 | B7: 千里 | C7: 被动 | D7: 普通 | E7: INT | F7: 扇形 | G7: 3.9000000000000004 | I7: =VLOOKUP(RC[-8],属性!C1:C3,3,0) -> |n附加伤害:6|n智力增幅:5 | J7: =IFERROR(VLOOKUP(RC[-9],扇形!C1:C4,4,0),"")&IFERROR(VLOOKUP(RC[-9],线性延迟!C1:C4,4,0),"")&IFERROR(VLOOKUP(RC[-9],线性!C1:C4,4,0),"")&IFERROR(VLOOKUP(RC[-9],圆形!C1:C4,4,0),"") -> 攻击时有10%概率|n对扇形区域发射3枚弹幕造成伤害! | K7: blp\heroRandomSpell\jNblp05.blp | L7: =IFERROR(VLOOKUP(RC[-11],扇形!C1:C5,5,0),"")&IFERROR(VLOOKUP(RC[-11],线性延迟!C1:C5,5,0),"")&IFERROR(VLOOKUP(RC[-11],线性!C1:C5,5,0),"")&IFERROR(VLOOKUP(RC[-11],圆形!C1:C5,5,0),"") -> _rs5.setData("war3mapImported\\AZ_Alleria_R1.mdl",Prop.INT,3.9,10,3,0,1,900,0.6,3,30,30)
A8: 6 | B8: 落枫 | C8: 被动 | D8: 普通 | E8: ATK | F8: 扇形 | G8: 1.3 | I8: =VLOOKUP(RC[-8],属性!C1:C3,3,0) -> |n攻速:15 | J8: =IFERROR(VLOOKUP(RC[-9],扇形!C1:C4,4,0),"")&IFERROR(VLOOKUP(RC[-9],线性延迟!C1:C4,4,0),"")&IFERROR(VLOOKUP(RC[-9],线性!C1:C4,4,0),"")&IFERROR(VLOOKUP(RC[-9],圆形!C1:C4,4,0),"") -> 攻击时有10%概率|n对扇形区域发射3枚弹幕造成伤害! | K8: blp\heroRandomSpell\jNblp06.blp | L8: =IFERROR(VLOOKUP(RC[-11],扇形!C1:C5,5,0),"")&IFERROR(VLOOKUP(RC[-11],线性延迟!C1:C5,5,0),"")&IFERROR(VLOOKUP(RC[-11],线性!C1:C5,5,0),"")&IFERROR(VLOOKUP(RC[-11],圆形!C1:C5,5,0),"") -> _rs6.setData("war3mapImported\\AZ_PotM(1)_R2.mdl",Prop.ATK,1.3,10,3,0,1,900,0.6,3,30,30)
A9: 7 | B9: 枯禅 | C9: 被动 | D9: 普通 | E9: ALL_MAIN | F9: 扇形 | G9: 0.98 | I9: =VLOOKUP(RC[-8],属性!C1:C3,3,0) -> |n力量增幅:3|n敏捷增幅:3|n智力增幅:3 | J9: =IFERROR(VLOOKUP(RC[-9],扇形!C1:C4,4,0),"")&IFERROR(VLOOKUP(RC[-9],线性延迟!C1:C4,4,0),"")&IFERROR(VLOOKUP(RC[-9],线性!C1:C4,4,0),"")&IFERROR(VLOOKUP(RC[-9],圆形!C1:C4,4,0),"") -> 攻击时有10%概率|n对扇形区域发射3枚弹幕造成伤害! | K9: blp\heroRandomSpell\jNblp07.blp | L9: =IFERROR(VLOOKUP(RC[-11],扇形!C1:C5,5,0),"")&IFERROR(VLOOKUP(RC[-11],线性延迟!C1:C5,5,0),"")&IFERROR(VLOOKUP(RC[-11],线性!C1:C5,5,0),"")&IFERROR(VLOOKUP(RC[-11],圆形!C1:C5,5,0),"") -> _rs7.setData("war3mapImported\\AZ_Lanaya_D_Ballistic.mdl",Prop.ALL_MAIN,0.98,10,3,0,1,900,0.6,3,30,30)
A10: 8 | B10: 无念 | C10: 被动 | D10: 普通 | E10: ALL | F10: 扇形 | G10: 1.3 | I10: =VLOOKUP(RC[-8],属性!C1:C3,3,0) -> |n附加伤害:15 | J10: =IFERROR(VLOOKUP(RC[-9],扇形!C1:C4,4,0),"")&IFERROR(VLOOKUP(RC[-9],线性延迟!C1:C4,4,0),"")&IFERROR(VLOOKUP(RC[-9],线性!C1:C4,4,0),"")&IFERROR(VLOOKUP(RC[-9],圆形!C1:C4,4,0),"") -> 攻击时有10%概率|n对扇形区域发射3枚弹幕造成伤害! | K10: blp\heroRandomSpell\jNblp08.blp | L10: =IFERROR(VLOOKUP(RC[-11],扇形!C1:C5,5,0),"")&IFERROR(VLOOKUP(RC[-11],线性延迟!C1:C5,5,0),"")&IFERROR(VLOOKUP(RC[-11],线性!C1:C5,5,0),"")&IFERROR(VLOOKUP(RC[-11],圆形!C1:C5,5,0),"") -> _rs8.setData("war3mapImported\\AZ_Alleria_E1.mdl",Prop.ALL,1.3,10,3,0,1,900,0.6,3,30,30)
A11: 9 | B11: 无踪 | C11: 被动 | D11: 普通 | E11: MAIN | F11: 扇形 | G11: 3.9000000000000004 | I11: =VLOOKUP(RC[-8],属性!C1:C3,3,0) -> |n附加伤害:15 | J11: =IFERROR(VLOOKUP(RC[-9],扇形!C1:C4,4,0),"")&IFERROR(VLOOKUP(RC[-9],线性延迟!C1:C4,4,0),"")&IFERROR(VLOOKUP(RC[-9],线性!C1:C4,4,0),"")&IFERROR(VLOOKUP(RC[-9],圆形!C1:C4,4,0),"") -> 攻击时有10%概率|n对扇形区域发射3枚弹幕造成伤害! | K11: blp\heroRandomSpell\jNblp09.blp | L11: =IFERROR(VLOOKUP(RC[-11],扇形!C1:C5,5,0),"")&IFERROR(VLOOKUP(RC[-11],线性延迟!C1:C5,5,0),"")&IFERROR(VLOOKUP(RC[-11],线性!C1:C5,5,0),"")&IFERROR(VLOOKUP(RC[-11],圆形!C1:C5,5,0),"") -> _rs9.setData("war3mapImported\\AZ_Storm_V1.mdl",Prop.MAIN,3.9,10,3,0,1,900,0.6,3,30,30)
A12: 10 | B12: 虎霸 | C12: 被动 | D12: 普通 | E12: ALL | F12: 圆形 | G12: 0.91 | I12: =VLOOKUP(RC[-8],属性!C1:C3,3,0) -> |n附加伤害:15 | J12: =IFERROR(VLOOKUP(RC[-9],扇形!C1:C4,4,0),"")&IFERROR(VLOOKUP(RC[-9],线性延迟!C1:C4,4,0),"")&IFERROR(VLOOKUP(RC[-9],线性!C1:C4,4,0),"")&IFERROR(VLOOKUP(RC[-9],圆形!C1:C4,4,0),"") -> 攻击时有10%概率|n对500范围内的敌人造成伤害! | K12: blp\heroRandomSpell\jNblp10.blp | L12: =IFERROR(VLOOKUP(RC[-11],扇形!C1:C5,5,0),"")&IFERROR(VLOOKUP(RC[-11],线性延迟!C1:C5,5,0),"")&IFERROR(VLOOKUP(RC[-11],线性!C1:C5,5,0),"")&IFERROR(VLOOKUP(RC[-11],圆形!C1:C5,5,0),"") -> _rs10.setData(FALSE,10,Prop.ALL,0.91,500,3,0,1,"war3mapImported\\Sven_R1.mdl","")
A13: 11 | B13: 般若 | C13: 被动 | D13: 普通 | E13: STR | F13: 圆形 | G13: 2.73 | I13: =VLOOKUP(RC[-8],属性!C1:C3,3,0) -> |n附加伤害:6|n力量增幅:5 | J13: =IFERROR(VLOOKUP(RC[-9],扇形!C1:C4,4,0),"")&IFERROR(VLOOKUP(RC[-9],线性延迟!C1:C4,4,0),"")&IFERROR(VLOOKUP(RC[-9],线性!C1:C4,4,0),"")&IFERROR(VLOOKUP(RC[-9],圆形!C1:C4,4,0),"") -> 攻击时有10%概率|n对500范围内的敌人造成伤害! | K13: blp\heroRandomSpell\jNblp11.blp | L13: =IFERROR(VLOOKUP(RC[-11],扇形!C1:C5,5,0),"")&IFERROR(VLOOKUP(RC[-11],线性延迟!C1:C5,5,0),"")&IFERROR(VLOOKUP(RC[-11],线性!C1:C5,5,0),"")&IFERROR(VLOOKUP(RC[-11],圆形!C1:C5,5,0),"") -> _rs11.setData(FALSE,10,Prop.STR,2.73,500,3,0,1,"war3mapImported\\AZ_Nevermore_X(1).mdl","")
A14: 12 | B14: 迎风 | C14: 被动 | D14: 普通 | E14: AGI | F14: 圆形 | G14: 2.73 | I14: =VLOOKUP(RC[-8],属性!C1:C3,3,0) -> |n附加伤害:6|n敏捷增幅:5 | J14: =IFERROR(VLOOKUP(RC[-9],扇形!C1:C4,4,0),"")&IFERROR(VLOOKUP(RC[-9],线性延迟!C1:C4,4,0),"")&IFERROR(VLOOKUP(RC[-9],线性!C1:C4,4,0),"")&IFERROR(VLOOKUP(RC[-9],圆形!C1:C4,4,0),"") -> 攻击时有10%概率|n对500范围内的敌人造成伤害! | K14: blp\heroRandomSpell\jNblp12.blp | L14: =IFERROR(VLOOKUP(RC[-11],扇形!C1:C5,5,0),"")&IFERROR(VLOOKUP(RC[-11],线性延迟!C1:C5,5,0),"")&IFERROR(VLOOKUP(RC[-11],线性!C1:C5,5,0),"")&IFERROR(VLOOKUP(RC[-11],圆形!C1:C5,5,0),"") -> _rs12.setData(FALSE,10,Prop.AGI,2.73,500,3,0,1,"war3mapImported\\AZ_Lina(2)_T1_MagicMatrix.mdl","")
A15: 13 | B15: 迷魂 | C15: 被动 | D15: 普通 | E15: INT | F15: 圆形 | G15: 2.73 | I15: =VLOOKUP(RC[-8],属性!C1:C3,3,0) -> |n附加伤害:6|n智力增幅:5 | J15: =IFERROR(VLOOKUP(RC[-9],扇形!C1:C4,4,0),"")&IFERROR(VLOOKUP(RC[-9],线性延迟!C1:C4,4,0),"")&IFERROR(VLOOKUP(RC[-9],线性!C1:C4,4,0),"")&IFERROR(VLOOKUP(RC[-9],圆形!C1:C4,4,0),"") -> 攻击时有10%概率|n对500范围内的敌人造成伤害! | K15: blp\heroRandomSpell\jNblp13.blp | L15: =IFERROR(VLOOKUP(RC[-11],扇形!C1:C5,5,0),"")&IFERROR(VLOOKUP(RC[-11],线性延迟!C1:C5,5,0),"")&IFERROR(VLOOKUP(RC[-11],线性!C1:C5,5,0),"")&IFERROR(VLOOKUP(RC[-11],圆形!C1:C5,5,0),"") -> _rs13.setData(FALSE,10,Prop.INT,2.73,500,3,0,1,"war3mapImported\\[Sepll]LinaSun _T1_MagicMatrix.mdl","")
A16: 14 | B16: 破山 | C16: 被动 | D16: 普通 | E16: ATK | F16: 圆形 | G16: 0.91 | I16: =VLOOKUP(RC[-8],属性!C1:C3,3,0) -> |n攻速:15 | J16: =IFERROR(VLOOKUP(RC[-9],扇形!C1:C4,4,0),"")&IFERROR(VLOOKUP(RC[-9],线性延迟!C1:C4,4,0),"")&IFERROR(VLOOKUP(RC[-9],线性!C1:C4,4,0),"")&IFERROR(VLOOKUP(RC[-9],圆形!C1:C4,4,0),"") -> 攻击时有10%概率|n对500范围内的敌人造成伤害! | K16: blp\heroRandomSpell\jNblp14.blp | L16: =IFERROR(VLOOKUP(RC[-11],扇形!C1:C5,5,0),"")&IFERROR(VLOOKUP(RC[-11],线性延迟!C1:C5,5,0),"")&IFERROR(VLOOKUP(RC[-11],线性!C1:C5,5,0),"")&IFERROR(VLOOKUP(RC[-11],圆形!C1:C5,5,0),"") -> _rs14.setData(FALSE,10,Prop.ATK,0.91,500,3,0,1,"war3mapImported\\27.HY1.mdl","")
A17: 15 | B17: 四凶 | C17: 被动 | D17: 普通 | E17: ALL_MAIN | F17: 圆形 | G17: 0.7 | I17: =VLOOKUP(RC[-8],属性!C1:C3,3,0) -> |n力量增幅:5|n敏捷增幅:5|n智力增幅:5 | J17: =IFERROR(VLOOKUP(RC[-9],扇形!C1:C4,4,0),"")&IFERROR(VLOOKUP(RC[-9],线性延迟!C1:C4,4,0),"")&IFERROR(VLOOKUP(RC[-9],线性!C1:C4,4,0),"")&IFERROR(VLOOKUP(RC[-9],圆形!C1:C4,4,0),"") -> 攻击时有10%概率|n对500范围内的敌人造成伤害! | K17: blp\heroRandomSpell\jNblp15.blp | L17: =IFERROR(VLOOKUP(RC[-11],扇形!C1:C5,5,0),"")&IFERROR(VLOOKUP(RC[-11],线性延迟!C1:C5,5,0),"")&IFERROR(VLOOKUP(RC[-11],线性!C1:C5,5,0),"")&IFERROR(VLOOKUP(RC[-11],圆形!C1:C5,5,0),"") -> _rs15.setData(FALSE,10,Prop.ALL_MAIN,0.7,500,3,0,1,"war3mapImported\\AZ_Kaer_T1.mdl","")
A18: 16 | B18: 残风 | C18: 被动 | D18: 普通 | E18: ALL | F18: 圆形 | G18: 0.91 | I18: =VLOOKUP(RC[-8],属性!C1:C3,3,0) -> |n附加伤害:15 | J18: =IFERROR(VLOOKUP(RC[-9],扇形!C1:C4,4,0),"")&IFERROR(VLOOKUP(RC[-9],线性延迟!C1:C4,4,0),"")&IFERROR(VLOOKUP(RC[-9],线性!C1:C4,4,0),"")&IFERROR(VLOOKUP(RC[-9],圆形!C1:C4,4,0),"") -> 攻击时有10%概率|n对500范围内的敌人造成伤害! | K18: blp\heroRandomSpell\jNblp16.blp | L18: =IFERROR(VLOOKUP(RC[-11],扇形!C1:C5,5,0),"")&IFERROR(VLOOKUP(RC[-11],线性延迟!C1:C5,5,0),"")&IFERROR(VLOOKUP(RC[-11],线性!C1:C5,5,0),"")&IFERROR(VLOOKUP(RC[-11],圆形!C1:C5,5,0),"") -> _rs16.setData(FALSE,10,Prop.ALL,0.91,500,3,0,1,"war3mapImported\\AZ_JuLi01.mdl","")
A19: 17 | B19: 无常 | C19: 被动 | D19: 普通 | E19: MAIN | F19: 圆形 | G19: 2.73 | I19: =VLOOKUP(RC[-8],属性!C1:C3,3,0) -> |n附加伤害:15 | J19: =IFERROR(VLOOKUP(RC[-9],扇形!C1:C4,4,0),"")&IFERROR(VLOOKUP(RC[-9],线性延迟!C1:C4,4,0),"")&IFERROR(VLOOKUP(RC[-9],线性!C1:C4,4,0),"")&IFERROR(VLOOKUP(RC[-9],圆形!C1:C4,4,0),"") -> 攻击时有10%概率|n对500范围内的敌人造成伤害! | K19: blp\heroRandomSpell\jNblp17.blp | L19: =IFERROR(VLOOKUP(RC[-11],扇形!C1:C5,5,0),"")&IFERROR(VLOOKUP(RC[-11],线性延迟!C1:C5,5,0),"")&IFERROR(VLOOKUP(RC[-11],线性!C1:C5,5,0),"")&IFERROR(VLOOKUP(RC[-11],圆形!C1:C5,5,0),"") -> _rs17.setData(FALSE,10,Prop.MAIN,2.73,500,3,0,1,"war3mapImported\\AZ_Goods_Lvlup(3).mdl","")
A20: 18 | B20: 问心 | C20: 被动 | D20: 普通 | E20: ALL | F20: 线性延迟 | G20: 1.1700000000000002 | I20: =VLOOKUP(RC[-8],属性!C1:C3,3,0) -> |n附加伤害:15 | J20: =IFERROR(VLOOKUP(RC[-9],扇形!C1:C4,4,0),"")&IFERROR(VLOOKUP(RC[-9],线性延迟!C1:C4,4,0),"")&IFERROR(VLOOKUP(RC[-9],线性!C1:C4,4,0),"")&IFERROR(VLOOKUP(RC[-9],圆形!C1:C4,4,0),"") -> 攻击时有10%概率|n对3条直线上的敌人造成伤害! | K20: blp\heroRandomSpell\jNblp18.blp | L20: =IFERROR(VLOOKUP(RC[-11],扇形!C1:C5,5,0),"")&IFERROR(VLOOKUP(RC[-11],线性延迟!C1:C5,5,0),"")&IFERROR(VLOOKUP(RC[-11],线性!C1:C5,5,0),"")&IFERROR(VLOOKUP(RC[-11],圆形!C1:C5,5,0),"") -> _rs18.setData("war3mapImported\\AZ_Alleria_W2.mdl",1,1.17,Prop.ALL,1.17,10,3,0,1,TRUE,3,50,50,0.3,3,150)
A21: 19 | B21: 太虚 | C21: 被动 | D21: 普通 | E21: STR | F21: 线性延迟 | G21: 3.5100000000000002 | I21: =VLOOKUP(RC[-8],属性!C1:C3,3,0) -> |n附加伤害:6|n力量增幅:5 | J21: =IFERROR(VLOOKUP(RC[-9],扇形!C1:C4,4,0),"")&IFERROR(VLOOKUP(RC[-9],线性延迟!C1:C4,4,0),"")&IFERROR(VLOOKUP(RC[-9],线性!C1:C4,4,0),"")&IFERROR(VLOOKUP(RC[-9],圆形!C1:C4,4,0),"") -> 攻击时有10%概率|n对3条直线上的敌人造成伤害! | K21: blp\heroRandomSpell\jNblp19.blp | L21: =IFERROR(VLOOKUP(RC[-11],扇形!C1:C5,5,0),"")&IFERROR(VLOOKUP(RC[-11],线性延迟!C1:C5,5,0),"")&IFERROR(VLOOKUP(RC[-11],线性!C1:C5,5,0),"")&IFERROR(VLOOKUP(RC[-11],圆形!C1:C5,5,0),"") -> _rs19.setData("war3mapImported\\AZ_Akasha(2)_B.mdl",1,3.51,Prop.STR,3.51,10,3,0,1,TRUE,3,50,50,0.3,3,150)
A22: 20 | B22: 菩提 | C22: 被动 | D22: 普通 | E22: AGI | F22: 线性延迟 | G22: 3.5100000000000002 | I22: =VLOOKUP(RC[-8],属性!C1:C3,3,0) -> |n附加伤害:6|n敏捷增幅:5 | J22: =IFERROR(VLOOKUP(RC[-9],扇形!C1:C4,4,0),"")&IFERROR(VLOOKUP(RC[-9],线性延迟!C1:C4,4,0),"")&IFERROR(VLOOKUP(RC[-9],线性!C1:C4,4,0),"")&IFERROR(VLOOKUP(RC[-9],圆形!C1:C4,4,0),"") -> 攻击时有10%概率|n对3条直线上的敌人造成伤害! | K22: blp\heroRandomSpell\jNblp20.blp | L22: =IFERROR(VLOOKUP(RC[-11],扇形!C1:C5,5,0),"")&IFERROR(VLOOKUP(RC[-11],线性延迟!C1:C5,5,0),"")&IFERROR(VLOOKUP(RC[-11],线性!C1:C5,5,0),"")&IFERROR(VLOOKUP(RC[-11],圆形!C1:C5,5,0),"") -> _rs20.setData("war3mapImported\\AZ_CocoChristmas_D_Impact.mdl",1,3.51,Prop.AGI,3.51,10,3,0,1,TRUE,3,50,50,0.3,3,150)
A23: 21 | B23: 无音 | C23: 被动 | D23: 普通 | E23: INT | F23: 线性延迟 | G23: 3.5100000000000002 | I23: =VLOOKUP(RC[-8],属性!C1:C3,3,0) -> |n附加伤害:6|n智力增幅:5 | J23: =IFERROR(VLOOKUP(RC[-9],扇形!C1:C4,4,0),"")&IFERROR(VLOOKUP(RC[-9],线性延迟!C1:C4,4,0),"")&IFERROR(VLOOKUP(RC[-9],线性!C1:C4,4,0),"")&IFERROR(VLOOKUP(RC[-9],圆形!C1:C4,4,0),"") -> 攻击时有10%概率|n对3条直线上的敌人造成伤害! | K23: blp\heroRandomSpell\jNblp21.blp | L23: =IFERROR(VLOOKUP(RC[-11],扇形!C1:C5,5,0),"")&IFERROR(VLOOKUP(RC[-11],线性延迟!C1:C5,5,0),"")&IFERROR(VLOOKUP(RC[-11],线性!C1:C5,5,0),"")&IFERROR(VLOOKUP(RC[-11],圆形!C1:C5,5,0),"") -> _rs21.setData("war3mapImported\\AZ_Goods_Blink(3).mdl",1,3.51,Prop.INT,3.51,10,3,0,1,TRUE,3,50,50,0.3,3,150)
A24: 22 | B24: 悲问 | C24: 被动 | D24: 普通 | E24: ATK | F24: 线性延迟 | G24: 1.17 | I24: =VLOOKUP(RC[-8],属性!C1:C3,3,0) -> |n攻速:15 | J24: =IFERROR(VLOOKUP(RC[-9],扇形!C1:C4,4,0),"")&IFERROR(VLOOKUP(RC[-9],线性延迟!C1:C4,4,0),"")&IFERROR(VLOOKUP(RC[-9],线性!C1:C4,4,0),"")&IFERROR(VLOOKUP(RC[-9],圆形!C1:C4,4,0),"") -> 攻击时有10%概率|n对3条直线上的敌人造成伤害! | K24: blp\heroRandomSpell\jNblp22.blp | L24: =IFERROR(VLOOKUP(RC[-11],扇形!C1:C5,5,0),"")&IFERROR(VLOOKUP(RC[-11],线性延迟!C1:C5,5,0),"")&IFERROR(VLOOKUP(RC[-11],线性!C1:C5,5,0),"")&IFERROR(VLOOKUP(RC[-11],圆形!C1:C5,5,0),"") -> _rs22.setData("war3mapImported\\AZ_Akasha(2)_B2.mdl",1,1.17,Prop.ATK,1.17,10,3,0,1,TRUE,3,50,50,0.3,3,150)
A25: 23 | B25: 空蝉 | C25: 被动 | D25: 普通 | E25: ALL_MAIN | F25: 线性延迟 | G25: 0.91 | I25: =VLOOKUP(RC[-8],属性!C1:C3,3,0) -> |n力量增幅:3|n敏捷增幅:3|n智力增幅:3 | J25: =IFERROR(VLOOKUP(RC[-9],扇形!C1:C4,4,0),"")&IFERROR(VLOOKUP(RC[-9],线性延迟!C1:C4,4,0),"")&IFERROR(VLOOKUP(RC[-9],线性!C1:C4,4,0),"")&IFERROR(VLOOKUP(RC[-9],圆形!C1:C4,4,0),"") -> 攻击时有10%概率|n对3条直线上的敌人造成伤害! | K25: blp\heroRandomSpell\jNblp23.blp | L25: =IFERROR(VLOOKUP(RC[-11],扇形!C1:C5,5,0),"")&IFERROR(VLOOKUP(RC[-11],线性延迟!C1:C5,5,0),"")&IFERROR(VLOOKUP(RC[-11],线性!C1:C5,5,0),"")&IFERROR(VLOOKUP(RC[-11],圆形!C1:C5,5,0),"") -> _rs23.setData("war3mapImported\\AZ_Doomdragon_V2_Small.mdl",1,0.91,Prop.ALL_MAIN,0.91,10,3,0,1,TRUE,3,50,50,0.3,3,150)
A26: 24 | B26: 无涯 | C26: 被动 | D26: 普通 | E26: ALL | F26: 线性延迟 | G26: 1.17 | I26: =VLOOKUP(RC[-8],属性!C1:C3,3,0) -> |n附加伤害:15 | J26: =IFERROR(VLOOKUP(RC[-9],扇形!C1:C4,4,0),"")&IFERROR(VLOOKUP(RC[-9],线性延迟!C1:C4,4,0),"")&IFERROR(VLOOKUP(RC[-9],线性!C1:C4,4,0),"")&IFERROR(VLOOKUP(RC[-9],圆形!C1:C4,4,0),"") -> 攻击时有10%概率|n对3条直线上的敌人造成伤害! | K26: blp\heroRandomSpell\jNblp24.blp | L26: =IFERROR(VLOOKUP(RC[-11],扇形!C1:C5,5,0),"")&IFERROR(VLOOKUP(RC[-11],线性延迟!C1:C5,5,0),"")&IFERROR(VLOOKUP(RC[-11],线性!C1:C5,5,0),"")&IFERROR(VLOOKUP(RC[-11],圆形!C1:C5,5,0),"") -> _rs24.setData("war3mapImported\\AZ_Goods_TP_Caster_effect(3).mdl",1,1.17,Prop.ALL,1.17,10,3,0,1,TRUE,3,50,50,0.3,3,150)
A27: 25 | B27: 无极 | C27: 被动 | D27: 普通 | E27: MAIN | F27: 线性延迟 | G27: 3.51 | I27: =VLOOKUP(RC[-8],属性!C1:C3,3,0) -> |n附加伤害:15 | J27: =IFERROR(VLOOKUP(RC[-9],扇形!C1:C4,4,0),"")&IFERROR(VLOOKUP(RC[-9],线性延迟!C1:C4,4,0),"")&IFERROR(VLOOKUP(RC[-9],线性!C1:C4,4,0),"")&IFERROR(VLOOKUP(RC[-9],圆形!C1:C4,4,0),"") -> 攻击时有10%概率|n对3条直线上的敌人造成伤害! | K27: blp\heroRandomSpell\jNblp25.blp | L27: =IFERROR(VLOOKUP(RC[-11],扇形!C1:C5,5,0),"")&IFERROR(VLOOKUP(RC[-11],线性延迟!C1:C5,5,0),"")&IFERROR(VLOOKUP(RC[-11],线性!C1:C5,5,0),"")&IFERROR(VLOOKUP(RC[-11],圆形!C1:C5,5,0),"") -> _rs25.setData("war3mapImported\\AZ_Lina(2)_G2_Target.mdl",1,3.51,Prop.MAIN,3.51,10,3,0,1,TRUE,3,50,50,0.3,3,150)
A28: 26 | B28: 索命 | C28: 主动 | D28: 普通 | E28: ALL | F28: 扇形 | G28: 1.95 | I28: =VLOOKUP(RC[-8],属性!C1:C3,3,0) -> |n附加伤害:15 | J28: =IFERROR(VLOOKUP(RC[-9],扇形!C1:C4,4,0),"")&IFERROR(VLOOKUP(RC[-9],线性延迟!C1:C4,4,0),"")&IFERROR(VLOOKUP(RC[-9],线性!C1:C4,4,0),"")&IFERROR(VLOOKUP(RC[-9],圆形!C1:C4,4,0),"") -> 对扇形区域发射5枚弹幕造成伤害! | K28: blp\heroRandomSpell\jNblp26.blp | L28: =IFERROR(VLOOKUP(RC[-11],扇形!C1:C5,5,0),"")&IFERROR(VLOOKUP(RC[-11],线性延迟!C1:C5,5,0),"")&IFERROR(VLOOKUP(RC[-11],线性!C1:C5,5,0),"")&IFERROR(VLOOKUP(RC[-11],圆形!C1:C5,5,0),"") -> _rs26.setData("war3mapImported\\[Sepll]LinaSun _D2_Misslie.mdl",Prop.ALL,1.95,10,0,1,900,0.6,5,60,30)
A29: 27 | B29: 大千 | C29: 主动 | D29: 普通 | E29: STR | F29: 扇形 | G29: 5.85 | I29: =VLOOKUP(RC[-8],属性!C1:C3,3,0) -> |n附加伤害:6|n力量增幅:5 | J29: =IFERROR(VLOOKUP(RC[-9],扇形!C1:C4,4,0),"")&IFERROR(VLOOKUP(RC[-9],线性延迟!C1:C4,4,0),"")&IFERROR(VLOOKUP(RC[-9],线性!C1:C4,4,0),"")&IFERROR(VLOOKUP(RC[-9],圆形!C1:C4,4,0),"") -> 对扇形区域发射5枚弹幕造成伤害! | K29: blp\heroRandomSpell\jNblp27.blp | L29: =IFERROR(VLOOKUP(RC[-11],扇形!C1:C5,5,0),"")&IFERROR(VLOOKUP(RC[-11],线性延迟!C1:C5,5,0),"")&IFERROR(VLOOKUP(RC[-11],线性!C1:C5,5,0),"")&IFERROR(VLOOKUP(RC[-11],圆形!C1:C5,5,0),"") -> _rs27.setData("war3mapImported\\shoc.mdl",Prop.STR,5.85,10,0,1,900,0.6,5,60,30)
A30: 28 | B30: 灭神 | C30: 主动 | D30: 普通 | E30: AGI | F30: 扇形 | G30: 1.95 | I30: =VLOOKUP(RC[-8],属性!C1:C3,3,0) -> |n附加伤害:6|n敏捷增幅:5 | J30: =IFERROR(VLOOKUP(RC[-9],扇形!C1:C4,4,0),"")&IFERROR(VLOOKUP(RC[-9],线性延迟!C1:C4,4,0),"")&IFERROR(VLOOKUP(RC[-9],线性!C1:C4,4,0),"")&IFERROR(VLOOKUP(RC[-9],圆形!C1:C4,4,0),"") -> 在0.9秒内3次对扇形区域发射5枚弹幕造成伤害! | K30: blp\heroRandomSpell\jNblp28.blp | L30: =IFERROR(VLOOKUP(RC[-11],扇形!C1:C5,5,0),"")&IFERROR(VLOOKUP(RC[-11],线性延迟!C1:C5,5,0),"")&IFERROR(VLOOKUP(RC[-11],线性!C1:C5,5,0),"")&IFERROR(VLOOKUP(RC[-11],圆形!C1:C5,5,0),"") -> _rs28.setData("war3mapImported\\YYTC.mdl",Prop.AGI,1.95,10,0.3,3,900,0.6,5,60,30)
A31: 29 | B31: 夺心 | C31: 主动 | D31: 普通 | E31: INT | F31: 扇形 | G31: 5.85 | I31: =VLOOKUP(RC[-8],属性!C1:C3,3,0) -> |n附加伤害:6|n智力增幅:5 | J31: =IFERROR(VLOOKUP(RC[-9],扇形!C1:C4,4,0),"")&IFERROR(VLOOKUP(RC[-9],线性延迟!C1:C4,4,0),"")&IFERROR(VLOOKUP(RC[-9],线性!C1:C4,4,0),"")&IFERROR(VLOOKUP(RC[-9],圆形!C1:C4,4,0),"") -> 对扇形区域发射5枚弹幕造成伤害! | K31: blp\heroRandomSpell\jNblp29.blp | L31: =IFERROR(VLOOKUP(RC[-11],扇形!C1:C5,5,0),"")&IFERROR(VLOOKUP(RC[-11],线性延迟!C1:C5,5,0),"")&IFERROR(VLOOKUP(RC[-11],线性!C1:C5,5,0),"")&IFERROR(VLOOKUP(RC[-11],圆形!C1:C5,5,0),"") -> _rs29.setData("war3mapImported\\AZ_HeroSBFire_C.mdl",Prop.INT,5.85,10,0,1,900,0.6,5,60,30)
A32: 30 | B32: 震天 | C32: 主动 | D32: 普通 | E32: ATK | F32: 扇形 | G32: 1.95 | I32: =VLOOKUP(RC[-8],属性!C1:C3,3,0) -> |n攻速:15 | J32: =IFERROR(VLOOKUP(RC[-9],扇形!C1:C4,4,0),"")&IFERROR(VLOOKUP(RC[-9],线性延迟!C1:C4,4,0),"")&IFERROR(VLOOKUP(RC[-9],线性!C1:C4,4,0),"")&IFERROR(VLOOKUP(RC[-9],圆形!C1:C4,4,0),"") -> 对扇形区域发射5枚弹幕造成伤害! | K32: blp\heroRandomSpell\jNblp30.blp | L32: =IFERROR(VLOOKUP(RC[-11],扇形!C1:C5,5,0),"")&IFERROR(VLOOKUP(RC[-11],线性延迟!C1:C5,5,0),"")&IFERROR(VLOOKUP(RC[-11],线性!C1:C5,5,0),"")&IFERROR(VLOOKUP(RC[-11],圆形!C1:C5,5,0),"") -> _rs30.setData("war3mapImported\\AZ_LCguanyu_T1.mdl",Prop.ATK,1.95,10,0,1,900,0.6,5,60,30)
A33: 31 | B33: 天问 | C33: 主动 | D33: 普通 | E33: ALL_MAIN | F33: 扇形 | G33: 0.73 | I33: =VLOOKUP(RC[-8],属性!C1:C3,3,0) -> |n力量增幅:3|n敏捷增幅:3|n智力增幅:3 | J33: =IFERROR(VLOOKUP(RC[-9],扇形!C1:C4,4,0),"")&IFERROR(VLOOKUP(RC[-9],线性延迟!C1:C4,4,0),"")&IFERROR(VLOOKUP(RC[-9],线性!C1:C4,4,0),"")&IFERROR(VLOOKUP(RC[-9],圆形!C1:C4,4,0),"") -> 在1秒内2次对扇形区域发射5枚弹幕造成伤害! | K33: blp\heroRandomSpell\jNblp31.blp | L33: =IFERROR(VLOOKUP(RC[-11],扇形!C1:C5,5,0),"")&IFERROR(VLOOKUP(RC[-11],线性延迟!C1:C5,5,0),"")&IFERROR(VLOOKUP(RC[-11],线性!C1:C5,5,0),"")&IFERROR(VLOOKUP(RC[-11],圆形!C1:C5,5,0),"") -> _rs31.setData("war3mapImported\\AZ_Kaer_D2.mdl",Prop.ALL_MAIN,0.73,10,0.5,2,900,0.6,5,60,30)
A34: 32 | B34: 碧空 | C34: 主动 | D34: 稀有 | E34: ALL | F34: 扇形 | G34: 0.98 | I34: =VLOOKUP(RC[-8],属性!C1:C3,3,0) -> |n附加伤害:15 | J34: =IFERROR(VLOOKUP(RC[-9],扇形!C1:C4,4,0),"")&IFERROR(VLOOKUP(RC[-9],线性延迟!C1:C4,4,0),"")&IFERROR(VLOOKUP(RC[-9],线性!C1:C4,4,0),"")&IFERROR(VLOOKUP(RC[-9],圆形!C1:C4,4,0),"") -> 在1秒内2次对扇形区域发射5枚弹幕造成伤害! | K34: blp\heroRandomSpell\jNblp32.blp | L34: =IFERROR(VLOOKUP(RC[-11],扇形!C1:C5,5,0),"")&IFERROR(VLOOKUP(RC[-11],线性延迟!C1:C5,5,0),"")&IFERROR(VLOOKUP(RC[-11],线性!C1:C5,5,0),"")&IFERROR(VLOOKUP(RC[-11],圆形!C1:C5,5,0),"") -> _rs32.setData("war3mapImported\\AZ_Goods_springwater_Target(3).mdl",Prop.ALL,0.98,10,0.5,2,900,0.6,5,60,30)
A35: 33 | B35: 明月 | C35: 主动 | D35: 稀有 | E35: MAIN | F35: 扇形 | G35: 5.85 | I35: =VLOOKUP(RC[-8],属性!C1:C3,3,0) -> |n附加伤害:15 | J35: =IFERROR(VLOOKUP(RC[-9],扇形!C1:C4,4,0),"")&IFERROR(VLOOKUP(RC[-9],线性延迟!C1:C4,4,0),"")&IFERROR(VLOOKUP(RC[-9],线性!C1:C4,4,0),"")&IFERROR(VLOOKUP(RC[-9],圆形!C1:C4,4,0),"") -> 对扇形区域发射5枚弹幕造成伤害! | K35: blp\heroRandomSpell\jNblp33.blp | L35: =IFERROR(VLOOKUP(RC[-11],扇形!C1:C5,5,0),"")&IFERROR(VLOOKUP(RC[-11],线性延迟!C1:C5,5,0),"")&IFERROR(VLOOKUP(RC[-11],线性!C1:C5,5,0),"")&IFERROR(VLOOKUP(RC[-11],圆形!C1:C5,5,0),"") -> _rs33.setData("war3mapImported\\AZ_AurelVlaicu_E3.mdl",Prop.MAIN,5.85,10,0,1,900,0.6,5,60,30)
A36: 34 | B36: 幻梦穿 | C36: 被动 | D36: 稀有 | E36: ALL | F36: 线性延迟 | G36: 3.51 | I36: =VLOOKUP(RC[-8],属性!C1:C3,3,0) -> |n附加伤害:25 | J36: =IFERROR(VLOOKUP(RC[-9],扇形!C1:C4,4,0),"")&IFERROR(VLOOKUP(RC[-9],线性延迟!C1:C4,4,0),"")&IFERROR(VLOOKUP(RC[-9],线性!C1:C4,4,0),"")&IFERROR(VLOOKUP(RC[-9],圆形!C1:C4,4,0),"") -> 攻击时有10%概率|n对5条直线上的敌人造成伤害! | K36: blp\heroRandomSpell\jNblp34.blp | L36: =IFERROR(VLOOKUP(RC[-11],扇形!C1:C5,5,0),"")&IFERROR(VLOOKUP(RC[-11],线性延迟!C1:C5,5,0),"")&IFERROR(VLOOKUP(RC[-11],线性!C1:C5,5,0),"")&IFERROR(VLOOKUP(RC[-11],圆形!C1:C5,5,0),"") -> _rs34.setData("war3mapImported\\AZ_Doomdragon_V1_big.mdl",1,3.51,Prop.ALL,3.51,10,4,0,1,TRUE,5,0,72,0.3,4,150)
A37: 35 | B37: 绕指柔 | C37: 被动 | D37: 稀有 | E37: STR | F37: 线性延迟 | G37: 10.53 | I37: =VLOOKUP(RC[-8],属性!C1:C3,3,0) -> |n附加伤害:13|n力量增幅:10 | J37: =IFERROR(VLOOKUP(RC[-9],扇形!C1:C4,4,0),"")&IFERROR(VLOOKUP(RC[-9],线性延迟!C1:C4,4,0),"")&IFERROR(VLOOKUP(RC[-9],线性!C1:C4,4,0),"")&IFERROR(VLOOKUP(RC[-9],圆形!C1:C4,4,0),"") -> 攻击时有10%概率|n对5条直线上的敌人造成伤害! | K37: blp\heroRandomSpell\jNblp35.blp | L37: =IFERROR(VLOOKUP(RC[-11],扇形!C1:C5,5,0),"")&IFERROR(VLOOKUP(RC[-11],线性延迟!C1:C5,5,0),"")&IFERROR(VLOOKUP(RC[-11],线性!C1:C5,5,0),"")&IFERROR(VLOOKUP(RC[-11],圆形!C1:C5,5,0),"") -> _rs35.setData("war3mapImported\\AZ_EarthShaker_F.mdl",1,10.53,Prop.STR,10.53,10,4,0,1,TRUE,5,0,72,0.3,4,150)
A38: 36 | B38: 郁浮欢 | C38: 被动 | D38: 稀有 | E38: AGI | F38: 线性延迟 | G38: 10.53 | I38: =VLOOKUP(RC[-8],属性!C1:C3,3,0) -> |n附加伤害:13|n敏捷增幅:10 | J38: =IFERROR(VLOOKUP(RC[-9],扇形!C1:C4,4,0),"")&IFERROR(VLOOKUP(RC[-9],线性延迟!C1:C4,4,0),"")&IFERROR(VLOOKUP(RC[-9],线性!C1:C4,4,0),"")&IFERROR(VLOOKUP(RC[-9],圆形!C1:C4,4,0),"") -> 攻击时有10%概率|n对5条直线上的敌人造成伤害! | K38: blp\heroRandomSpell\jNblp36.blp | L38: =IFERROR(VLOOKUP(RC[-11],扇形!C1:C5,5,0),"")&IFERROR(VLOOKUP(RC[-11],线性延迟!C1:C5,5,0),"")&IFERROR(VLOOKUP(RC[-11],线性!C1:C5,5,0),"")&IFERROR(VLOOKUP(RC[-11],圆形!C1:C5,5,0),"") -> _rs36.setData("war3mapImported\\AZ_PotM(1)_T1_Impact.mdl",1,10.53,Prop.AGI,10.53,10,4,0,1,TRUE,5,0,72,0.3,4,150)
A39: 37 | B39: 夜寒凉 | C39: 被动 | D39: 稀有 | E39: INT | F39: 线性延迟 | G39: 10.53 | I39: =VLOOKUP(RC[-8],属性!C1:C3,3,0) -> |n附加伤害:13|n智力增幅:10 | J39: =IFERROR(VLOOKUP(RC[-9],扇形!C1:C4,4,0),"")&IFERROR(VLOOKUP(RC[-9],线性延迟!C1:C4,4,0),"")&IFERROR(VLOOKUP(RC[-9],线性!C1:C4,4,0),"")&IFERROR(VLOOKUP(RC[-9],圆形!C1:C4,4,0),"") -> 攻击时有10%概率|n对5条直线上的敌人造成伤害! | K39: blp\heroRandomSpell\jNblp37.blp | L39: =IFERROR(VLOOKUP(RC[-11],扇形!C1:C5,5,0),"")&IFERROR(VLOOKUP(RC[-11],线性延迟!C1:C5,5,0),"")&IFERROR(VLOOKUP(RC[-11],线性!C1:C5,5,0),"")&IFERROR(VLOOKUP(RC[-11],圆形!C1:C5,5,0),"") -> _rs37.setData("war3mapImported\\AZ_TormentedSoul_G1.mdl",1,10.53,Prop.INT,10.53,10,4,0,1,TRUE,5,0,72,0.3,4,150)
A40: 38 | B40: 醉人间 | C40: 被动 | D40: 稀有 | E40: ATK | F40: 线性延迟 | G40: 3.51 | I40: =VLOOKUP(RC[-8],属性!C1:C3,3,0) -> |n攻速:25 | J40: =IFERROR(VLOOKUP(RC[-9],扇形!C1:C4,4,0),"")&IFERROR(VLOOKUP(RC[-9],线性延迟!C1:C4,4,0),"")&IFERROR(VLOOKUP(RC[-9],线性!C1:C4,4,0),"")&IFERROR(VLOOKUP(RC[-9],圆形!C1:C4,4,0),"") -> 攻击时有10%概率|n对5条直线上的敌人造成伤害! | K40: blp\heroRandomSpell\jNblp38.blp | L40: =IFERROR(VLOOKUP(RC[-11],扇形!C1:C5,5,0),"")&IFERROR(VLOOKUP(RC[-11],线性延迟!C1:C5,5,0),"")&IFERROR(VLOOKUP(RC[-11],线性!C1:C5,5,0),"")&IFERROR(VLOOKUP(RC[-11],圆形!C1:C5,5,0),"") -> _rs38.setData("war3mapImported\\AZ_Goods_TP_Caster(3).mdl",1,3.51,Prop.ATK,3.51,10,4,0,1,TRUE,5,0,72,0.3,4,150)
A41: 39 | B41: 万里穹 | C41: 被动 | D41: 稀有 | E41: ALL_MAIN | F41: 线性延迟 | G41: 2.73 | I41: =VLOOKUP(RC[-8],属性!C1:C3,3,0) -> |n力量增幅:6|n敏捷增幅:6|n智力增幅:6 | J41: =IFERROR(VLOOKUP(RC[-9],扇形!C1:C4,4,0),"")&IFERROR(VLOOKUP(RC[-9],线性延迟!C1:C4,4,0),"")&IFERROR(VLOOKUP(RC[-9],线性!C1:C4,4,0),"")&IFERROR(VLOOKUP(RC[-9],圆形!C1:C4,4,0),"") -> 攻击时有10%概率|n对5条直线上的敌人造成伤害! | K41: blp\heroRandomSpell\jNblp39.blp | L41: =IFERROR(VLOOKUP(RC[-11],扇形!C1:C5,5,0),"")&IFERROR(VLOOKUP(RC[-11],线性延迟!C1:C5,5,0),"")&IFERROR(VLOOKUP(RC[-11],线性!C1:C5,5,0),"")&IFERROR(VLOOKUP(RC[-11],圆形!C1:C5,5,0),"") -> _rs39.setData("war3mapImported\\AZ_Dragonus_E1.mdl",1,2.73,Prop.ALL_MAIN,2.73,10,4,0,1,TRUE,5,0,72,0.3,4,150)
A42: 40 | B42: 青玉案 | C42: 被动 | D42: 稀有 | E42: ALL | F42: 圆形 | G42: 2.73 | I42: =VLOOKUP(RC[-8],属性!C1:C3,3,0) -> |n附加伤害:25 | J42: =IFERROR(VLOOKUP(RC[-9],扇形!C1:C4,4,0),"")&IFERROR(VLOOKUP(RC[-9],线性延迟!C1:C4,4,0),"")&IFERROR(VLOOKUP(RC[-9],线性!C1:C4,4,0),"")&IFERROR(VLOOKUP(RC[-9],圆形!C1:C4,4,0),"") -> 攻击时有10%概率|n对500范围内的敌人造成伤害! | K42: blp\heroRandomSpell\jNblp40.blp | L42: =IFERROR(VLOOKUP(RC[-11],扇形!C1:C5,5,0),"")&IFERROR(VLOOKUP(RC[-11],线性延迟!C1:C5,5,0),"")&IFERROR(VLOOKUP(RC[-11],线性!C1:C5,5,0),"")&IFERROR(VLOOKUP(RC[-11],圆形!C1:C5,5,0),"") -> _rs40.setData(FALSE,10,Prop.ALL,2.73,500,3,0,1,"war3mapImported\\AZ_CWDullahan_F2.mdl","")
A43: 41 | B43: 阳关调 | C43: 被动 | D43: 稀有 | E43: MAIN | F43: 线性 | G43: 10.53 | I43: =VLOOKUP(RC[-8],属性!C1:C3,3,0) -> |n附加伤害:25 | J43: =IFERROR(VLOOKUP(RC[-9],扇形!C1:C4,4,0),"")&IFERROR(VLOOKUP(RC[-9],线性延迟!C1:C4,4,0),"")&IFERROR(VLOOKUP(RC[-9],线性!C1:C4,4,0),"")&IFERROR(VLOOKUP(RC[-9],圆形!C1:C4,4,0),"") -> 攻击时有10%概率|n对3条直线上的敌人造成伤害! | K43: blp\heroRandomSpell\jNblp41.blp | L43: =IFERROR(VLOOKUP(RC[-11],扇形!C1:C5,5,0),"")&IFERROR(VLOOKUP(RC[-11],线性延迟!C1:C5,5,0),"")&IFERROR(VLOOKUP(RC[-11],线性!C1:C5,5,0),"")&IFERROR(VLOOKUP(RC[-11],圆形!C1:C5,5,0),"") -> _rs41.setData("war3mapImported\\AZ_LuanZhan.mdl",1,10,Prop.MAIN,10.53,4,0,1,200,3,200)
A44: 42 | B44: 醉赤壁 | C44: 被动 | D44: 稀有 | E44: ALL | F44: 圆形 | G44: 2.73 | I44: =VLOOKUP(RC[-8],属性!C1:C3,3,0) -> |n附加伤害:25 | J44: =IFERROR(VLOOKUP(RC[-9],扇形!C1:C4,4,0),"")&IFERROR(VLOOKUP(RC[-9],线性延迟!C1:C4,4,0),"")&IFERROR(VLOOKUP(RC[-9],线性!C1:C4,4,0),"")&IFERROR(VLOOKUP(RC[-9],圆形!C1:C4,4,0),"") -> 攻击时有10%概率|n对500范围内的敌人造成伤害! | K44: blp\heroRandomSpell\jNblp42.blp | L44: =IFERROR(VLOOKUP(RC[-11],扇形!C1:C5,5,0),"")&IFERROR(VLOOKUP(RC[-11],线性延迟!C1:C5,5,0),"")&IFERROR(VLOOKUP(RC[-11],线性!C1:C5,5,0),"")&IFERROR(VLOOKUP(RC[-11],圆形!C1:C5,5,0),"") -> _rs42.setData(FALSE,10,Prop.ALL,2.73,500,3,0,1,"war3mapImported\\Lina_T.mdl","")
A45: 43 | B45: 凡世忘 | C45: 主动 | D45: 稀有 | E45: STR | F45: 线性 | G45: 7.9 | I45: =VLOOKUP(RC[-8],属性!C1:C3,3,0) -> |n附加伤害:13|n力量增幅:10 | J45: =IFERROR(VLOOKUP(RC[-9],扇形!C1:C4,4,0),"")&IFERROR(VLOOKUP(RC[-9],线性延迟!C1:C4,4,0),"")&IFERROR(VLOOKUP(RC[-9],线性!C1:C4,4,0),"")&IFERROR(VLOOKUP(RC[-9],圆形!C1:C4,4,0),"") -> 在1秒内2次对3条直线上的敌人造成伤害! | K45: blp\heroRandomSpell\jNblp43.blp | L45: =IFERROR(VLOOKUP(RC[-11],扇形!C1:C5,5,0),"")&IFERROR(VLOOKUP(RC[-11],线性延迟!C1:C5,5,0),"")&IFERROR(VLOOKUP(RC[-11],线性!C1:C5,5,0),"")&IFERROR(VLOOKUP(RC[-11],圆形!C1:C5,5,0),"") -> _rs43.setData("war3mapImported\\AZ_Goods_TP_Target_effect(3).mdl",1,Prop.STR,7.9,10,0.5,2,200,3,200)
A46: 44 | B46: 问苍天 | C46: 主动 | D46: 稀有 | E46: AGI | F46: 线性 | G46: 7.9 | I46: =VLOOKUP(RC[-8],属性!C1:C3,3,0) -> |n附加伤害:13|n敏捷增幅:10 | J46: =IFERROR(VLOOKUP(RC[-9],扇形!C1:C4,4,0),"")&IFERROR(VLOOKUP(RC[-9],线性延迟!C1:C4,4,0),"")&IFERROR(VLOOKUP(RC[-9],线性!C1:C4,4,0),"")&IFERROR(VLOOKUP(RC[-9],圆形!C1:C4,4,0),"") -> 在1秒内2次对3条直线上的敌人造成伤害! | K46: blp\heroRandomSpell\jNblp44.blp | L46: =IFERROR(VLOOKUP(RC[-11],扇形!C1:C5,5,0),"")&IFERROR(VLOOKUP(RC[-11],线性延迟!C1:C5,5,0),"")&IFERROR(VLOOKUP(RC[-11],线性!C1:C5,5,0),"")&IFERROR(VLOOKUP(RC[-11],圆形!C1:C5,5,0),"") -> _rs44.setData("war3mapImported\\AZ_Coco_E2.mdl",1,Prop.AGI,7.9,10,0.5,2,200,3,200)
A47: 45 | B47: 空断肠 | C47: 主动 | D47: 稀有 | E47: INT | F47: 线性 | G47: 7.9 | I47: =VLOOKUP(RC[-8],属性!C1:C3,3,0) -> |n附加伤害:13|n智力增幅:10 | J47: =IFERROR(VLOOKUP(RC[-9],扇形!C1:C4,4,0),"")&IFERROR(VLOOKUP(RC[-9],线性延迟!C1:C4,4,0),"")&IFERROR(VLOOKUP(RC[-9],线性!C1:C4,4,0),"")&IFERROR(VLOOKUP(RC[-9],圆形!C1:C4,4,0),"") -> 在1秒内2次对3条直线上的敌人造成伤害! | K47: blp\heroRandomSpell\jNblp45.blp | L47: =IFERROR(VLOOKUP(RC[-11],扇形!C1:C5,5,0),"")&IFERROR(VLOOKUP(RC[-11],线性延迟!C1:C5,5,0),"")&IFERROR(VLOOKUP(RC[-11],线性!C1:C5,5,0),"")&IFERROR(VLOOKUP(RC[-11],圆形!C1:C5,5,0),"") -> _rs45.setData("war3mapImported\\AZ_Goods_Lvlup.mdl",1,Prop.INT,7.9,10,0.5,2,200,3,200)
A48: 46 | B48: 明月孤 | C48: 主动 | D48: 稀有 | E48: ATK | F48: 线性 | G48: 5.27 | I48: =VLOOKUP(RC[-8],属性!C1:C3,3,0) -> |n攻速:25 | J48: =IFERROR(VLOOKUP(RC[-9],扇形!C1:C4,4,0),"")&IFERROR(VLOOKUP(RC[-9],线性延迟!C1:C4,4,0),"")&IFERROR(VLOOKUP(RC[-9],线性!C1:C4,4,0),"")&IFERROR(VLOOKUP(RC[-9],圆形!C1:C4,4,0),"") -> 对3条直线上的敌人造成伤害! | K48: blp\heroRandomSpell\jNblp46.blp | L48: =IFERROR(VLOOKUP(RC[-11],扇形!C1:C5,5,0),"")&IFERROR(VLOOKUP(RC[-11],线性延迟!C1:C5,5,0),"")&IFERROR(VLOOKUP(RC[-11],线性!C1:C5,5,0),"")&IFERROR(VLOOKUP(RC[-11],圆形!C1:C5,5,0),"") -> _rs46.setData("war3mapImported\\AZ_LuanZhan.mdl",1,Prop.ATK,5.27,10,0,1,200,3,200)
A49: 47 | B49: 云天渺 | C49: 被动 | D49: 稀有 | E49: ALL_MAIN | F49: 圆形 | G49: 2.0499999999999998 | I49: =VLOOKUP(RC[-8],属性!C1:C3,3,0) -> |n力量增幅:6|n敏捷增幅:6|n智力增幅:6 | J49: =IFERROR(VLOOKUP(RC[-9],扇形!C1:C4,4,0),"")&IFERROR(VLOOKUP(RC[-9],线性延迟!C1:C4,4,0),"")&IFERROR(VLOOKUP(RC[-9],线性!C1:C4,4,0),"")&IFERROR(VLOOKUP(RC[-9],圆形!C1:C4,4,0),"") -> 攻击时有10%概率|n对500范围内的敌人造成伤害! | K49: blp\heroRandomSpell\jNblp47.blp | L49: =IFERROR(VLOOKUP(RC[-11],扇形!C1:C5,5,0),"")&IFERROR(VLOOKUP(RC[-11],线性延迟!C1:C5,5,0),"")&IFERROR(VLOOKUP(RC[-11],线性!C1:C5,5,0),"")&IFERROR(VLOOKUP(RC[-11],圆形!C1:C5,5,0),"") -> _rs47.setData(FALSE,10,Prop.ALL_MAIN,2.05,500,3,0,1,"war3mapImported\\AZ_Nevermoreice_X.mdl","")
A50: 48 | B50: 醉红颜 | C50: 被动 | D50: 稀有 | E50: ALL | F50: 圆形 | G50: 2.73 | I50: =VLOOKUP(RC[-8],属性!C1:C3,3,0) -> |n附加伤害:25 | J50: =IFERROR(VLOOKUP(RC[-9],扇形!C1:C4,4,0),"")&IFERROR(VLOOKUP(RC[-9],线性延迟!C1:C4,4,0),"")&IFERROR(VLOOKUP(RC[-9],线性!C1:C4,4,0),"")&IFERROR(VLOOKUP(RC[-9],圆形!C1:C4,4,0),"") -> 攻击时有10%概率|n对500范围内的敌人造成伤害! | K50: blp\heroRandomSpell\jNblp48.blp | L50: =IFERROR(VLOOKUP(RC[-11],扇形!C1:C5,5,0),"")&IFERROR(VLOOKUP(RC[-11],线性延迟!C1:C5,5,0),"")&IFERROR(VLOOKUP(RC[-11],线性!C1:C5,5,0),"")&IFERROR(VLOOKUP(RC[-11],圆形!C1:C5,5,0),"") -> _rs48.setData(FALSE,10,Prop.ALL,2.73,500,3,0,1,"war3mapImported\\AZ_Nevermore_X.mdl","")
A51: 49 | B51: 尘世游 | C51: 被动 | D51: 稀有 | E51: MAIN | F51: 圆形 | G51: 8.19 | I51: =VLOOKUP(RC[-8],属性!C1:C3,3,0) -> |n附加伤害:25 | J51: =IFERROR(VLOOKUP(RC[-9],扇形!C1:C4,4,0),"")&IFERROR(VLOOKUP(RC[-9],线性延迟!C1:C4,4,0),"")&IFERROR(VLOOKUP(RC[-9],线性!C1:C4,4,0),"")&IFERROR(VLOOKUP(RC[-9],圆形!C1:C4,4,0),"") -> 攻击时有10%概率|n对500范围内的敌人造成伤害! | K51: blp\heroRandomSpell\jNblp49.blp | L51: =IFERROR(VLOOKUP(RC[-11],扇形!C1:C5,5,0),"")&IFERROR(VLOOKUP(RC[-11],线性延迟!C1:C5,5,0),"")&IFERROR(VLOOKUP(RC[-11],线性!C1:C5,5,0),"")&IFERROR(VLOOKUP(RC[-11],圆形!C1:C5,5,0),"") -> _rs49.setData(FALSE,10,Prop.MAIN,8.19,500,3,0,1,"war3mapImported\\AZ_SG2.mdl","")
A52: 50 | B52: 人生几何 | C52: 被动 | D52: 史诗 | E52: ALL | F52: 圆形 | G52: 7.28 | I52: =VLOOKUP(RC[-8],属性!C1:C3,3,0) -> |n附加伤害:35 | J52: =IFERROR(VLOOKUP(RC[-9],扇形!C1:C4,4,0),"")&IFERROR(VLOOKUP(RC[-9],线性延迟!C1:C4,4,0),"")&IFERROR(VLOOKUP(RC[-9],线性!C1:C4,4,0),"")&IFERROR(VLOOKUP(RC[-9],圆形!C1:C4,4,0),"") -> 攻击时有10%概率|n对500范围内的敌人造成伤害! | K52: blp\heroRandomSpell\jNblp50.blp | L52: =IFERROR(VLOOKUP(RC[-11],扇形!C1:C5,5,0),"")&IFERROR(VLOOKUP(RC[-11],线性延迟!C1:C5,5,0),"")&IFERROR(VLOOKUP(RC[-11],线性!C1:C5,5,0),"")&IFERROR(VLOOKUP(RC[-11],圆形!C1:C5,5,0),"") -> _rs50.setData(FALSE,10,Prop.ALL,7.28,500,6,0,1,"war3mapImported\\AZ_Coco_E1.mdl","war3mapImported\\[Sepll]LinaSun _D1_MagicMatrix.mdl")
A53: 51 | B53: 志在千里 | C53: 被动 | D53: 史诗 | E53: STR | F53: 圆形 | G53: 21.84 | I53: =VLOOKUP(RC[-8],属性!C1:C3,3,0) -> |n附加伤害:20|n力量增幅:15 | J53: =IFERROR(VLOOKUP(RC[-9],扇形!C1:C4,4,0),"")&IFERROR(VLOOKUP(RC[-9],线性延迟!C1:C4,4,0),"")&IFERROR(VLOOKUP(RC[-9],线性!C1:C4,4,0),"")&IFERROR(VLOOKUP(RC[-9],圆形!C1:C4,4,0),"") -> 攻击时有10%概率|n对500范围内的敌人造成伤害! | K53: blp\heroRandomSpell\jNblp51.blp | L53: =IFERROR(VLOOKUP(RC[-11],扇形!C1:C5,5,0),"")&IFERROR(VLOOKUP(RC[-11],线性延迟!C1:C5,5,0),"")&IFERROR(VLOOKUP(RC[-11],线性!C1:C5,5,0),"")&IFERROR(VLOOKUP(RC[-11],圆形!C1:C5,5,0),"") -> _rs51.setData(FALSE,10,Prop.STR,21.84,500,6,0,1,"war3mapImported\\heianluqiya111_V1.mdl","war3mapImported\\AZ_Akasha(2)_B.mdl")
A54: 52 | B54: 云海尘清 | C54: 被动 | D54: 史诗 | E54: AGI | F54: 圆形 | G54: 21.84 | I54: =VLOOKUP(RC[-8],属性!C1:C3,3,0) -> |n附加伤害:20|n敏捷增幅:15 | J54: =IFERROR(VLOOKUP(RC[-9],扇形!C1:C4,4,0),"")&IFERROR(VLOOKUP(RC[-9],线性延迟!C1:C4,4,0),"")&IFERROR(VLOOKUP(RC[-9],线性!C1:C4,4,0),"")&IFERROR(VLOOKUP(RC[-9],圆形!C1:C4,4,0),"") -> 攻击时有10%概率|n对500范围内的敌人造成伤害! | K54: blp\heroRandomSpell\jNblp52.blp | L54: =IFERROR(VLOOKUP(RC[-11],扇形!C1:C5,5,0),"")&IFERROR(VLOOKUP(RC[-11],线性延迟!C1:C5,5,0),"")&IFERROR(VLOOKUP(RC[-11],线性!C1:C5,5,0),"")&IFERROR(VLOOKUP(RC[-11],圆形!C1:C5,5,0),"") -> _rs52.setData(FALSE,10,Prop.AGI,21.84,500,6,0,1,"war3mapImported\\AZ_CoCoGuanyu_E1.mdl","war3mapImported\\AZ_JUGGgreen_E2_Impact.mdl")
A55: 53 | B55: 天涯海角 | C55: 被动 | D55: 史诗 | E55: INT | F55: 圆形 | G55: 21.84 | I55: =VLOOKUP(RC[-8],属性!C1:C3,3,0) -> |n附加伤害:20|n智力增幅:15 | J55: =IFERROR(VLOOKUP(RC[-9],扇形!C1:C4,4,0),"")&IFERROR(VLOOKUP(RC[-9],线性延迟!C1:C4,4,0),"")&IFERROR(VLOOKUP(RC[-9],线性!C1:C4,4,0),"")&IFERROR(VLOOKUP(RC[-9],圆形!C1:C4,4,0),"") -> 攻击时有10%概率|n对500范围内的敌人造成伤害! | K55: blp\heroRandomSpell\jNblp53.blp | L55: =IFERROR(VLOOKUP(RC[-11],扇形!C1:C5,5,0),"")&IFERROR(VLOOKUP(RC[-11],线性延迟!C1:C5,5,0),"")&IFERROR(VLOOKUP(RC[-11],线性!C1:C5,5,0),"")&IFERROR(VLOOKUP(RC[-11],圆形!C1:C5,5,0),"") -> _rs53.setData(FALSE,10,Prop.INT,21.84,500,6,0,1,"war3mapImported\\AZ_Dragonus_E2.mdl","war3mapImported\\AZ_JUGG_E3.mdl")
A56: 54 | B56: 横扫千军 | C56: 被动 | D56: 史诗 | E56: ATK | F56: 圆形 | G56: 7.28 | I56: =VLOOKUP(RC[-8],属性!C1:C3,3,0) -> |n攻速:35 | J56: =IFERROR(VLOOKUP(RC[-9],扇形!C1:C4,4,0),"")&IFERROR(VLOOKUP(RC[-9],线性延迟!C1:C4,4,0),"")&IFERROR(VLOOKUP(RC[-9],线性!C1:C4,4,0),"")&IFERROR(VLOOKUP(RC[-9],圆形!C1:C4,4,0),"") -> 攻击时有10%概率|n对500范围内的敌人造成伤害! | K56: blp\heroRandomSpell\jNblp54.blp | L56: =IFERROR(VLOOKUP(RC[-11],扇形!C1:C5,5,0),"")&IFERROR(VLOOKUP(RC[-11],线性延迟!C1:C5,5,0),"")&IFERROR(VLOOKUP(RC[-11],线性!C1:C5,5,0),"")&IFERROR(VLOOKUP(RC[-11],圆形!C1:C5,5,0),"") -> _rs54.setData(FALSE,10,Prop.ATK,7.28,500,6,0,1,"war3mapImported\\AZ_Kaer_T2.mdl","war3mapImported\\AZ_JUGG_E2.mdl")
A57: 55 | B57: 叶随雨落 | C57: 被动 | D57: 史诗 | E57: ALL_MAIN | F57: 圆形 | G57: 5.46 | I57: =VLOOKUP(RC[-8],属性!C1:C3,3,0) -> |n力量增幅:9|n敏捷增幅:9|n智力增幅:9 | J57: =IFERROR(VLOOKUP(RC[-9],扇形!C1:C4,4,0),"")&IFERROR(VLOOKUP(RC[-9],线性延迟!C1:C4,4,0),"")&IFERROR(VLOOKUP(RC[-9],线性!C1:C4,4,0),"")&IFERROR(VLOOKUP(RC[-9],圆形!C1:C4,4,0),"") -> 攻击时有10%概率|n对500范围内的敌人造成伤害! | K57: blp\heroRandomSpell\jNblp55.blp | L57: =IFERROR(VLOOKUP(RC[-11],扇形!C1:C5,5,0),"")&IFERROR(VLOOKUP(RC[-11],线性延迟!C1:C5,5,0),"")&IFERROR(VLOOKUP(RC[-11],线性!C1:C5,5,0),"")&IFERROR(VLOOKUP(RC[-11],圆形!C1:C5,5,0),"") -> _rs55.setData(FALSE,10,Prop.ALL_MAIN,5.46,500,6,0,1,"war3mapImported\\AZ_Doomdragon_D.mdl","war3mapImported\\AZ_KingLeoric(SDWZ)_E.mdl")
A58: 56 | B58: 傲世九天 | C58: 被动 | D58: 史诗 | E58: ALL | F58: 圆形 | G58: 7.28 | I58: =VLOOKUP(RC[-8],属性!C1:C3,3,0) -> |n附加伤害:35 | J58: =IFERROR(VLOOKUP(RC[-9],扇形!C1:C4,4,0),"")&IFERROR(VLOOKUP(RC[-9],线性延迟!C1:C4,4,0),"")&IFERROR(VLOOKUP(RC[-9],线性!C1:C4,4,0),"")&IFERROR(VLOOKUP(RC[-9],圆形!C1:C4,4,0),"") -> 攻击时有10%概率|n对500范围内的敌人造成伤害! | K58: blp\heroRandomSpell\jNblp56.blp | L58: =IFERROR(VLOOKUP(RC[-11],扇形!C1:C5,5,0),"")&IFERROR(VLOOKUP(RC[-11],线性延迟!C1:C5,5,0),"")&IFERROR(VLOOKUP(RC[-11],线性!C1:C5,5,0),"")&IFERROR(VLOOKUP(RC[-11],圆形!C1:C5,5,0),"") -> _rs56.setData(FALSE,10,Prop.ALL,7.28,500,6,0,1,"war3mapImported\\AZ_TormentedSoul_T2.mdl","")
A59: 57 | B59: 浮云过影 | C59: 被动 | D59: 史诗 | E59: MAIN | F59: 线性 | G59: 28.08 | I59: =VLOOKUP(RC[-8],属性!C1:C3,3,0) -> |n附加伤害:35 | J59: =IFERROR(VLOOKUP(RC[-9],扇形!C1:C4,4,0),"")&IFERROR(VLOOKUP(RC[-9],线性延迟!C1:C4,4,0),"")&IFERROR(VLOOKUP(RC[-9],线性!C1:C4,4,0),"")&IFERROR(VLOOKUP(RC[-9],圆形!C1:C4,4,0),"") -> 攻击时有10%概率|n对3条直线上的敌人造成伤害! | K59: blp\heroRandomSpell\jNblp57.blp | L59: =IFERROR(VLOOKUP(RC[-11],扇形!C1:C5,5,0),"")&IFERROR(VLOOKUP(RC[-11],线性延迟!C1:C5,5,0),"")&IFERROR(VLOOKUP(RC[-11],线性!C1:C5,5,0),"")&IFERROR(VLOOKUP(RC[-11],圆形!C1:C5,5,0),"") -> _rs57.setData("war3mapImported\\AZ_CoCoGuanyu_E2.mdl",1,10,Prop.MAIN,28.08,5,0,1,200,3,200)
A60: 58 | B60: 断编残简 | C60: 主动 | D60: 史诗 | E60: ALL | F60: 圆形 | G60: 3.64 | I60: =VLOOKUP(RC[-8],属性!C1:C3,3,0) -> |n附加伤害:35 | J60: =IFERROR(VLOOKUP(RC[-9],扇形!C1:C4,4,0),"")&IFERROR(VLOOKUP(RC[-9],线性延迟!C1:C4,4,0),"")&IFERROR(VLOOKUP(RC[-9],线性!C1:C4,4,0),"")&IFERROR(VLOOKUP(RC[-9],圆形!C1:C4,4,0),"") -> 在1.5秒内3次对500范围内的敌人造成伤害! | K60: blp\heroRandomSpell\jNblp58.blp | L60: =IFERROR(VLOOKUP(RC[-11],扇形!C1:C5,5,0),"")&IFERROR(VLOOKUP(RC[-11],线性延迟!C1:C5,5,0),"")&IFERROR(VLOOKUP(RC[-11],线性!C1:C5,5,0),"")&IFERROR(VLOOKUP(RC[-11],圆形!C1:C5,5,0),"") -> _rs58.setData(0,Prop.ALL,3.64,500,15,0.5,3,"war3mapImported\\AZ_CWLava_T.mdl","")
A61: 59 | B61: 落花无声 | C61: 主动 | D61: 史诗 | E61: STR | F61: 圆形 | G61: 10.92 | I61: =VLOOKUP(RC[-8],属性!C1:C3,3,0) -> |n附加伤害:20|n力量增幅:15 | J61: =IFERROR(VLOOKUP(RC[-9],扇形!C1:C4,4,0),"")&IFERROR(VLOOKUP(RC[-9],线性延迟!C1:C4,4,0),"")&IFERROR(VLOOKUP(RC[-9],线性!C1:C4,4,0),"")&IFERROR(VLOOKUP(RC[-9],圆形!C1:C4,4,0),"") -> 在1.5秒内3次对500范围内的敌人造成伤害! | K61: blp\heroRandomSpell\jNblp59.blp | L61: =IFERROR(VLOOKUP(RC[-11],扇形!C1:C5,5,0),"")&IFERROR(VLOOKUP(RC[-11],线性延迟!C1:C5,5,0),"")&IFERROR(VLOOKUP(RC[-11],线性!C1:C5,5,0),"")&IFERROR(VLOOKUP(RC[-11],圆形!C1:C5,5,0),"") -> _rs59.setData(0,Prop.STR,10.92,500,15,0.5,3,"war3mapImported\\AZ_CWDullahan_F1.mdl","")
A62: 60 | B62: 浮世繁华 | C62: 主动 | D62: 史诗 | E62: AGI | F62: 圆形 | G62: 10.92 | I62: =VLOOKUP(RC[-8],属性!C1:C3,3,0) -> |n附加伤害:20|n敏捷增幅:15 | J62: =IFERROR(VLOOKUP(RC[-9],扇形!C1:C4,4,0),"")&IFERROR(VLOOKUP(RC[-9],线性延迟!C1:C4,4,0),"")&IFERROR(VLOOKUP(RC[-9],线性!C1:C4,4,0),"")&IFERROR(VLOOKUP(RC[-9],圆形!C1:C4,4,0),"") -> 在1.5秒内3次对500范围内的敌人造成伤害! | K62: blp\heroRandomSpell\jNblp60.blp | L62: =IFERROR(VLOOKUP(RC[-11],扇形!C1:C5,5,0),"")&IFERROR(VLOOKUP(RC[-11],线性延迟!C1:C5,5,0),"")&IFERROR(VLOOKUP(RC[-11],线性!C1:C5,5,0),"")&IFERROR(VLOOKUP(RC[-11],圆形!C1:C5,5,0),"") -> _rs60.setData(0,Prop.AGI,10.92,500,15,0.5,3,"war3mapImported\\AZ_TormentedSoul_T1.mdl","")
A63: 61 | B63: 执念成殇 | C63: 主动 | D63: 史诗 | E63: INT | F63: 圆形 | G63: 10.92 | I63: =VLOOKUP(RC[-8],属性!C1:C3,3,0) -> |n附加伤害:20|n智力增幅:15 | J63: =IFERROR(VLOOKUP(RC[-9],扇形!C1:C4,4,0),"")&IFERROR(VLOOKUP(RC[-9],线性延迟!C1:C4,4,0),"")&IFERROR(VLOOKUP(RC[-9],线性!C1:C4,4,0),"")&IFERROR(VLOOKUP(RC[-9],圆形!C1:C4,4,0),"") -> 在1.5秒内3次对500范围内的敌人造成伤害! | K63: blp\heroRandomSpell\jNblp61.blp | L63: =IFERROR(VLOOKUP(RC[-11],扇形!C1:C5,5,0),"")&IFERROR(VLOOKUP(RC[-11],线性延迟!C1:C5,5,0),"")&IFERROR(VLOOKUP(RC[-11],线性!C1:C5,5,0),"")&IFERROR(VLOOKUP(RC[-11],圆形!C1:C5,5,0),"") -> _rs61.setData(0,Prop.INT,10.92,500,15,0.5,3,"war3mapImported\\[Sepll]LinaSun _T2_Blast.mdl","")
A64: 62 | B64: 月下独酌 | C64: 主动 | D64: 史诗 | E64: ATK | F64: 圆形 | G64: 3.64 | I64: =VLOOKUP(RC[-8],属性!C1:C3,3,0) -> |n攻速:35 | J64: =IFERROR(VLOOKUP(RC[-9],扇形!C1:C4,4,0),"")&IFERROR(VLOOKUP(RC[-9],线性延迟!C1:C4,4,0),"")&IFERROR(VLOOKUP(RC[-9],线性!C1:C4,4,0),"")&IFERROR(VLOOKUP(RC[-9],圆形!C1:C4,4,0),"") -> 在1.5秒内3次对500范围内的敌人造成伤害! | K64: blp\heroRandomSpell\jNblp62.blp | L64: =IFERROR(VLOOKUP(RC[-11],扇形!C1:C5,5,0),"")&IFERROR(VLOOKUP(RC[-11],线性延迟!C1:C5,5,0),"")&IFERROR(VLOOKUP(RC[-11],线性!C1:C5,5,0),"")&IFERROR(VLOOKUP(RC[-11],圆形!C1:C5,5,0),"") -> _rs62.setData(0,Prop.ATK,3.64,500,15,0.5,3,"war3mapImported\\AZ_EarthShaker_C.mdl","")
A65: 63 | B65: 诗羽呢喃 | C65: 主动 | D65: 史诗 | E65: ALL_MAIN | F65: 圆形 | G65: 2.73 | I65: =VLOOKUP(RC[-8],属性!C1:C3,3,0) -> |n力量增幅:9|n敏捷增幅:9|n智力增幅:9 | J65: =IFERROR(VLOOKUP(RC[-9],扇形!C1:C4,4,0),"")&IFERROR(VLOOKUP(RC[-9],线性延迟!C1:C4,4,0),"")&IFERROR(VLOOKUP(RC[-9],线性!C1:C4,4,0),"")&IFERROR(VLOOKUP(RC[-9],圆形!C1:C4,4,0),"") -> 在1.5秒内3次对500范围内的敌人造成伤害! | K65: blp\heroRandomSpell\jNblp63.blp | L65: =IFERROR(VLOOKUP(RC[-11],扇形!C1:C5,5,0),"")&IFERROR(VLOOKUP(RC[-11],线性延迟!C1:C5,5,0),"")&IFERROR(VLOOKUP(RC[-11],线性!C1:C5,5,0),"")&IFERROR(VLOOKUP(RC[-11],圆形!C1:C5,5,0),"") -> _rs63.setData(0,Prop.ALL_MAIN,2.73,500,15,0.5,3,"war3mapImported\\AZ_Lina(2)_T2_Blast.mdl","")
A66: 64 | B66: 人生如烟 | C66: 被动 | D66: 史诗 | E66: ALL | F66: 扇形 | G66: 11.7 | I66: =VLOOKUP(RC[-8],属性!C1:C3,3,0) -> |n附加伤害:35 | J66: =IFERROR(VLOOKUP(RC[-9],扇形!C1:C4,4,0),"")&IFERROR(VLOOKUP(RC[-9],线性延迟!C1:C4,4,0),"")&IFERROR(VLOOKUP(RC[-9],线性!C1:C4,4,0),"")&IFERROR(VLOOKUP(RC[-9],圆形!C1:C4,4,0),"") -> 攻击时有10%概率|n对扇形区域发射7枚弹幕造成伤害! | K66: blp\heroRandomSpell\jNblp64.blp | L66: =IFERROR(VLOOKUP(RC[-11],扇形!C1:C5,5,0),"")&IFERROR(VLOOKUP(RC[-11],线性延迟!C1:C5,5,0),"")&IFERROR(VLOOKUP(RC[-11],线性!C1:C5,5,0),"")&IFERROR(VLOOKUP(RC[-11],圆形!C1:C5,5,0),"") -> _rs64.setData("war3mapImported\\AZ_Lina_F.mdl",Prop.ALL,11.7,10,5,0,1,900,0.6,7,60,20)
A67: 65 | B67: 肆无忌惮 | C67: 被动 | D67: 史诗 | E67: MAIN | F67: 线性延迟 | G67: 28.08 | I67: =VLOOKUP(RC[-8],属性!C1:C3,3,0) -> |n附加伤害:35 | J67: =IFERROR(VLOOKUP(RC[-9],扇形!C1:C4,4,0),"")&IFERROR(VLOOKUP(RC[-9],线性延迟!C1:C4,4,0),"")&IFERROR(VLOOKUP(RC[-9],线性!C1:C4,4,0),"")&IFERROR(VLOOKUP(RC[-9],圆形!C1:C4,4,0),"") -> 攻击时有10%概率|n对5条直线上的敌人造成伤害! | K67: blp\heroRandomSpell\jNblp65.blp | L67: =IFERROR(VLOOKUP(RC[-11],扇形!C1:C5,5,0),"")&IFERROR(VLOOKUP(RC[-11],线性延迟!C1:C5,5,0),"")&IFERROR(VLOOKUP(RC[-11],线性!C1:C5,5,0),"")&IFERROR(VLOOKUP(RC[-11],圆形!C1:C5,5,0),"") -> _rs65.setData("war3mapImported\\AZ_LeiJi01-Chen.mdl",1,28.08,Prop.MAIN,28.08,10,5,0,1,TRUE,5,0,72,0.3,5,150)

Sheet: 属性
A1: 序号 | B1: 名字 | C1: 文本 | D1: 属性 | E1: 攻击: | F1: 力量: | G1: 敏捷: | H1: 智力: | I1: 血量: | J1: 护甲: | K1: 攻速: | L1: 攻击吸血: | M1: 暴击概率: | N1: 暴击伤害: | O1: 伤害增幅: | P1: 附加伤害: | Q1: 最终伤害: | R1: 伤害抵抗: | S1: 伤害减免: | T1: 伤害反弹: | U1: 力量增幅: | V1: 敏捷增幅: | W1: 智力增幅: | X1: 升级属性: | Y1: 杀敌属性: | Z1: 每秒属性: | AA1: 描述
A2: 0 | B2: =VLOOKUP(RC[-1],ABIL!C1:C2,2,0) -> 未解锁 | C2: =IF(RC[2]="",,"|n"&R1C5&RC[2])&IF(RC[3]="",,"|n"&R1C6&RC[3])&IF(RC[4]="",,"|n"&R1C7&RC[4])&IF(RC[5]="",,"|n"&R1C8&RC[5])&IF(RC[6]="",,"|n"&R1C9&RC[6])&IF(RC[7]="",,"|n"&R1C10&RC[7])&IF(RC[8]="",,"|n"&R1C11&RC[8])&IF(RC[9]="",,"|n"&R1C12&RC[9])&IF(RC[10]="",,"|n"&R1C13&RC[10])&IF(RC[11]="",,"|n"&R1C14&RC[11])&IF(RC[12]="",,"|n"&R1C15&RC[12])&IF(RC[13]="",,"|n"&R1C16&RC[13])&IF(RC[14]="",,"|n"&R1C17&RC[14])&IF(RC[15]="",,"|n"&R1C18&RC[15])&IF(RC[16]="",,"|n"&R1C19&RC[16])&IF(RC[17]="",,"|n"&R1C20&RC[17])&IF(RC[18]="",,"|n"&R1C21&RC[18])&IF(RC[19]="",,"|n"&R1C22&RC[19])&IF(RC[20]="",,"|n"&R1C23&RC[20])&IF(RC[21]="",,"|n"&R1C24&RC[21])&IF(RC[22]="",,"|n"&R1C25&RC[22])&IF(RC[23]="",,"|n"&R1C26&RC[23])&IF(RC[24]="",,"|n"&RC[24]) ->  | D2: =VLOOKUP(RC[-3],ABIL!C1:C5,5,0) -> 等待解锁
A3: 1 | B3: =VLOOKUP(RC[-1],ABIL!C1:C2,2,0) -> 未学习 | C3: =IF(RC[2]="",,"|n"&R1C5&RC[2])&IF(RC[3]="",,"|n"&R1C6&RC[3])&IF(RC[4]="",,"|n"&R1C7&RC[4])&IF(RC[5]="",,"|n"&R1C8&RC[5])&IF(RC[6]="",,"|n"&R1C9&RC[6])&IF(RC[7]="",,"|n"&R1C10&RC[7])&IF(RC[8]="",,"|n"&R1C11&RC[8])&IF(RC[9]="",,"|n"&R1C12&RC[9])&IF(RC[10]="",,"|n"&R1C13&RC[10])&IF(RC[11]="",,"|n"&R1C14&RC[11])&IF(RC[12]="",,"|n"&R1C15&RC[12])&IF(RC[13]="",,"|n"&R1C16&RC[13])&IF(RC[14]="",,"|n"&R1C17&RC[14])&IF(RC[15]="",,"|n"&R1C18&RC[15])&IF(RC[16]="",,"|n"&R1C19&RC[16])&IF(RC[17]="",,"|n"&R1C20&RC[17])&IF(RC[18]="",,"|n"&R1C21&RC[18])&IF(RC[19]="",,"|n"&R1C22&RC[19])&IF(RC[20]="",,"|n"&R1C23&RC[20])&IF(RC[21]="",,"|n"&R1C24&RC[21])&IF(RC[22]="",,"|n"&R1C25&RC[22])&IF(RC[23]="",,"|n"&R1C26&RC[23])&IF(RC[24]="",,"|n"&RC[24]) ->  | D3: =VLOOKUP(RC[-3],ABIL!C1:C5,5,0) -> 等待学习
A4: 2 | B4: =VLOOKUP(RC[-1],ABIL!C1:C2,2,0) -> 无情 | C4: =IF(RC[2]="",,"|n"&R1C5&RC[2])&IF(RC[3]="",,"|n"&R1C6&RC[3])&IF(RC[4]="",,"|n"&R1C7&RC[4])&IF(RC[5]="",,"|n"&R1C8&RC[5])&IF(RC[6]="",,"|n"&R1C9&RC[6])&IF(RC[7]="",,"|n"&R1C10&RC[7])&IF(RC[8]="",,"|n"&R1C11&RC[8])&IF(RC[9]="",,"|n"&R1C12&RC[9])&IF(RC[10]="",,"|n"&R1C13&RC[10])&IF(RC[11]="",,"|n"&R1C14&RC[11])&IF(RC[12]="",,"|n"&R1C15&RC[12])&IF(RC[13]="",,"|n"&R1C16&RC[13])&IF(RC[14]="",,"|n"&R1C17&RC[14])&IF(RC[15]="",,"|n"&R1C18&RC[15])&IF(RC[16]="",,"|n"&R1C19&RC[16])&IF(RC[17]="",,"|n"&R1C20&RC[17])&IF(RC[18]="",,"|n"&R1C21&RC[18])&IF(RC[19]="",,"|n"&R1C22&RC[19])&IF(RC[20]="",,"|n"&R1C23&RC[20])&IF(RC[21]="",,"|n"&R1C24&RC[21])&IF(RC[22]="",,"|n"&R1C25&RC[22])&IF(RC[23]="",,"|n"&R1C26&RC[23])&IF(RC[24]="",,"|n"&RC[24]) -> |n附加伤害:15 | D4: =VLOOKUP(RC[-3],ABIL!C1:C5,5,0) -> ALL | P4: 15
A5: 3 | B5: =VLOOKUP(RC[-1],ABIL!C1:C2,2,0) -> 如意 | C5: =IF(RC[2]="",,"|n"&R1C5&RC[2])&IF(RC[3]="",,"|n"&R1C6&RC[3])&IF(RC[4]="",,"|n"&R1C7&RC[4])&IF(RC[5]="",,"|n"&R1C8&RC[5])&IF(RC[6]="",,"|n"&R1C9&RC[6])&IF(RC[7]="",,"|n"&R1C10&RC[7])&IF(RC[8]="",,"|n"&R1C11&RC[8])&IF(RC[9]="",,"|n"&R1C12&RC[9])&IF(RC[10]="",,"|n"&R1C13&RC[10])&IF(RC[11]="",,"|n"&R1C14&RC[11])&IF(RC[12]="",,"|n"&R1C15&RC[12])&IF(RC[13]="",,"|n"&R1C16&RC[13])&IF(RC[14]="",,"|n"&R1C17&RC[14])&IF(RC[15]="",,"|n"&R1C18&RC[15])&IF(RC[16]="",,"|n"&R1C19&RC[16])&IF(RC[17]="",,"|n"&R1C20&RC[17])&IF(RC[18]="",,"|n"&R1C21&RC[18])&IF(RC[19]="",,"|n"&R1C22&RC[19])&IF(RC[20]="",,"|n"&R1C23&RC[20])&IF(RC[21]="",,"|n"&R1C24&RC[21])&IF(RC[22]="",,"|n"&R1C25&RC[22])&IF(RC[23]="",,"|n"&R1C26&RC[23])&IF(RC[24]="",,"|n"&RC[24]) -> |n附加伤害:6|n力量增幅:5 | D5: =VLOOKUP(RC[-3],ABIL!C1:C5,5,0) -> STR | P5: 6 | U5: 5
A6: 4 | B6: =VLOOKUP(RC[-1],ABIL!C1:C2,2,0) -> 无名 | C6: =IF(RC[2]="",,"|n"&R1C5&RC[2])&IF(RC[3]="",,"|n"&R1C6&RC[3])&IF(RC[4]="",,"|n"&R1C7&RC[4])&IF(RC[5]="",,"|n"&R1C8&RC[5])&IF(RC[6]="",,"|n"&R1C9&RC[6])&IF(RC[7]="",,"|n"&R1C10&RC[7])&IF(RC[8]="",,"|n"&R1C11&RC[8])&IF(RC[9]="",,"|n"&R1C12&RC[9])&IF(RC[10]="",,"|n"&R1C13&RC[10])&IF(RC[11]="",,"|n"&R1C14&RC[11])&IF(RC[12]="",,"|n"&R1C15&RC[12])&IF(RC[13]="",,"|n"&R1C16&RC[13])&IF(RC[14]="",,"|n"&R1C17&RC[14])&IF(RC[15]="",,"|n"&R1C18&RC[15])&IF(RC[16]="",,"|n"&R1C19&RC[16])&IF(RC[17]="",,"|n"&R1C20&RC[17])&IF(RC[18]="",,"|n"&R1C21&RC[18])&IF(RC[19]="",,"|n"&R1C22&RC[19])&IF(RC[20]="",,"|n"&R1C23&RC[20])&IF(RC[21]="",,"|n"&R1C24&RC[21])&IF(RC[22]="",,"|n"&R1C25&RC[22])&IF(RC[23]="",,"|n"&R1C26&RC[23])&IF(RC[24]="",,"|n"&RC[24]) -> |n附加伤害:6|n敏捷增幅:5 | D6: =VLOOKUP(RC[-3],ABIL!C1:C5,5,0) -> AGI | P6: 6 | V6: 5
A7: 5 | B7: =VLOOKUP(RC[-1],ABIL!C1:C2,2,0) -> 千里 | C7: =IF(RC[2]="",,"|n"&R1C5&RC[2])&IF(RC[3]="",,"|n"&R1C6&RC[3])&IF(RC[4]="",,"|n"&R1C7&RC[4])&IF(RC[5]="",,"|n"&R1C8&RC[5])&IF(RC[6]="",,"|n"&R1C9&RC[6])&IF(RC[7]="",,"|n"&R1C10&RC[7])&IF(RC[8]="",,"|n"&R1C11&RC[8])&IF(RC[9]="",,"|n"&R1C12&RC[9])&IF(RC[10]="",,"|n"&R1C13&RC[10])&IF(RC[11]="",,"|n"&R1C14&RC[11])&IF(RC[12]="",,"|n"&R1C15&RC[12])&IF(RC[13]="",,"|n"&R1C16&RC[13])&IF(RC[14]="",,"|n"&R1C17&RC[14])&IF(RC[15]="",,"|n"&R1C18&RC[15])&IF(RC[16]="",,"|n"&R1C19&RC[16])&IF(RC[17]="",,"|n"&R1C20&RC[17])&IF(RC[18]="",,"|n"&R1C21&RC[18])&IF(RC[19]="",,"|n"&R1C22&RC[19])&IF(RC[20]="",,"|n"&R1C23&RC[20])&IF(RC[21]="",,"|n"&R1C24&RC[21])&IF(RC[22]="",,"|n"&R1C25&RC[22])&IF(RC[23]="",,"|n"&R1C26&RC[23])&IF(RC[24]="",,"|n"&RC[24]) -> |n附加伤害:6|n智力增幅:5 | D7: =VLOOKUP(RC[-3],ABIL!C1:C5,5,0) -> INT | P7: 6 | W7: 5
A8: 6 | B8: =VLOOKUP(RC[-1],ABIL!C1:C2,2,0) -> 落枫 | C8: =IF(RC[2]="",,"|n"&R1C5&RC[2])&IF(RC[3]="",,"|n"&R1C6&RC[3])&IF(RC[4]="",,"|n"&R1C7&RC[4])&IF(RC[5]="",,"|n"&R1C8&RC[5])&IF(RC[6]="",,"|n"&R1C9&RC[6])&IF(RC[7]="",,"|n"&R1C10&RC[7])&IF(RC[8]="",,"|n"&R1C11&RC[8])&IF(RC[9]="",,"|n"&R1C12&RC[9])&IF(RC[10]="",,"|n"&R1C13&RC[10])&IF(RC[11]="",,"|n"&R1C14&RC[11])&IF(RC[12]="",,"|n"&R1C15&RC[12])&IF(RC[13]="",,"|n"&R1C16&RC[13])&IF(RC[14]="",,"|n"&R1C17&RC[14])&IF(RC[15]="",,"|n"&R1C18&RC[15])&IF(RC[16]="",,"|n"&R1C19&RC[16])&IF(RC[17]="",,"|n"&R1C20&RC[17])&IF(RC[18]="",,"|n"&R1C21&RC[18])&IF(RC[19]="",,"|n"&R1C22&RC[19])&IF(RC[20]="",,"|n"&R1C23&RC[20])&IF(RC[21]="",,"|n"&R1C24&RC[21])&IF(RC[22]="",,"|n"&R1C25&RC[22])&IF(RC[23]="",,"|n"&R1C26&RC[23])&IF(RC[24]="",,"|n"&RC[24]) -> |n攻速:15 | D8: =VLOOKUP(RC[-3],ABIL!C1:C5,5,0) -> ATK | K8: 15
A9: 7 | B9: =VLOOKUP(RC[-1],ABIL!C1:C2,2,0) -> 枯禅 | C9: =IF(RC[2]="",,"|n"&R1C5&RC[2])&IF(RC[3]="",,"|n"&R1C6&RC[3])&IF(RC[4]="",,"|n"&R1C7&RC[4])&IF(RC[5]="",,"|n"&R1C8&RC[5])&IF(RC[6]="",,"|n"&R1C9&RC[6])&IF(RC[7]="",,"|n"&R1C10&RC[7])&IF(RC[8]="",,"|n"&R1C11&RC[8])&IF(RC[9]="",,"|n"&R1C12&RC[9])&IF(RC[10]="",,"|n"&R1C13&RC[10])&IF(RC[11]="",,"|n"&R1C14&RC[11])&IF(RC[12]="",,"|n"&R1C15&RC[12])&IF(RC[13]="",,"|n"&R1C16&RC[13])&IF(RC[14]="",,"|n"&R1C17&RC[14])&IF(RC[15]="",,"|n"&R1C18&RC[15])&IF(RC[16]="",,"|n"&R1C19&RC[16])&IF(RC[17]="",,"|n"&R1C20&RC[17])&IF(RC[18]="",,"|n"&R1C21&RC[18])&IF(RC[19]="",,"|n"&R1C22&RC[19])&IF(RC[20]="",,"|n"&R1C23&RC[20])&IF(RC[21]="",,"|n"&R1C24&RC[21])&IF(RC[22]="",,"|n"&R1C25&RC[22])&IF(RC[23]="",,"|n"&R1C26&RC[23])&IF(RC[24]="",,"|n"&RC[24]) -> |n力量增幅:3|n敏捷增幅:3|n智力增幅:3 | D9: =VLOOKUP(RC[-3],ABIL!C1:C5,5,0) -> ALL_MAIN | U9: 3 | V9: 3 | W9: 3
A10: 8 | B10: =VLOOKUP(RC[-1],ABIL!C1:C2,2,0) -> 无念 | C10: =IF(RC[2]="",,"|n"&R1C5&RC[2])&IF(RC[3]="",,"|n"&R1C6&RC[3])&IF(RC[4]="",,"|n"&R1C7&RC[4])&IF(RC[5]="",,"|n"&R1C8&RC[5])&IF(RC[6]="",,"|n"&R1C9&RC[6])&IF(RC[7]="",,"|n"&R1C10&RC[7])&IF(RC[8]="",,"|n"&R1C11&RC[8])&IF(RC[9]="",,"|n"&R1C12&RC[9])&IF(RC[10]="",,"|n"&R1C13&RC[10])&IF(RC[11]="",,"|n"&R1C14&RC[11])&IF(RC[12]="",,"|n"&R1C15&RC[12])&IF(RC[13]="",,"|n"&R1C16&RC[13])&IF(RC[14]="",,"|n"&R1C17&RC[14])&IF(RC[15]="",,"|n"&R1C18&RC[15])&IF(RC[16]="",,"|n"&R1C19&RC[16])&IF(RC[17]="",,"|n"&R1C20&RC[17])&IF(RC[18]="",,"|n"&R1C21&RC[18])&IF(RC[19]="",,"|n"&R1C22&RC[19])&IF(RC[20]="",,"|n"&R1C23&RC[20])&IF(RC[21]="",,"|n"&R1C24&RC[21])&IF(RC[22]="",,"|n"&R1C25&RC[22])&IF(RC[23]="",,"|n"&R1C26&RC[23])&IF(RC[24]="",,"|n"&RC[24]) -> |n附加伤害:15 | D10: =VLOOKUP(RC[-3],ABIL!C1:C5,5,0) -> ALL | P10: 15
A11: 9 | B11: =VLOOKUP(RC[-1],ABIL!C1:C2,2,0) -> 无踪 | C11: =IF(RC[2]="",,"|n"&R1C5&RC[2])&IF(RC[3]="",,"|n"&R1C6&RC[3])&IF(RC[4]="",,"|n"&R1C7&RC[4])&IF(RC[5]="",,"|n"&R1C8&RC[5])&IF(RC[6]="",,"|n"&R1C9&RC[6])&IF(RC[7]="",,"|n"&R1C10&RC[7])&IF(RC[8]="",,"|n"&R1C11&RC[8])&IF(RC[9]="",,"|n"&R1C12&RC[9])&IF(RC[10]="",,"|n"&R1C13&RC[10])&IF(RC[11]="",,"|n"&R1C14&RC[11])&IF(RC[12]="",,"|n"&R1C15&RC[12])&IF(RC[13]="",,"|n"&R1C16&RC[13])&IF(RC[14]="",,"|n"&R1C17&RC[14])&IF(RC[15]="",,"|n"&R1C18&RC[15])&IF(RC[16]="",,"|n"&R1C19&RC[16])&IF(RC[17]="",,"|n"&R1C20&RC[17])&IF(RC[18]="",,"|n"&R1C21&RC[18])&IF(RC[19]="",,"|n"&R1C22&RC[19])&IF(RC[20]="",,"|n"&R1C23&RC[20])&IF(RC[21]="",,"|n"&R1C24&RC[21])&IF(RC[22]="",,"|n"&R1C25&RC[22])&IF(RC[23]="",,"|n"&R1C26&RC[23])&IF(RC[24]="",,"|n"&RC[24]) -> |n附加伤害:15 | D11: =VLOOKUP(RC[-3],ABIL!C1:C5,5,0) -> MAIN | P11: 15
A12: 10 | B12: =VLOOKUP(RC[-1],ABIL!C1:C2,2,0) -> 虎霸 | C12: =IF(RC[2]="",,"|n"&R1C5&RC[2])&IF(RC[3]="",,"|n"&R1C6&RC[3])&IF(RC[4]="",,"|n"&R1C7&RC[4])&IF(RC[5]="",,"|n"&R1C8&RC[5])&IF(RC[6]="",,"|n"&R1C9&RC[6])&IF(RC[7]="",,"|n"&R1C10&RC[7])&IF(RC[8]="",,"|n"&R1C11&RC[8])&IF(RC[9]="",,"|n"&R1C12&RC[9])&IF(RC[10]="",,"|n"&R1C13&RC[10])&IF(RC[11]="",,"|n"&R1C14&RC[11])&IF(RC[12]="",,"|n"&R1C15&RC[12])&IF(RC[13]="",,"|n"&R1C16&RC[13])&IF(RC[14]="",,"|n"&R1C17&RC[14])&IF(RC[15]="",,"|n"&R1C18&RC[15])&IF(RC[16]="",,"|n"&R1C19&RC[16])&IF(RC[17]="",,"|n"&R1C20&RC[17])&IF(RC[18]="",,"|n"&R1C21&RC[18])&IF(RC[19]="",,"|n"&R1C22&RC[19])&IF(RC[20]="",,"|n"&R1C23&RC[20])&IF(RC[21]="",,"|n"&R1C24&RC[21])&IF(RC[22]="",,"|n"&R1C25&RC[22])&IF(RC[23]="",,"|n"&R1C26&RC[23])&IF(RC[24]="",,"|n"&RC[24]) -> |n附加伤害:15 | D12: =VLOOKUP(RC[-3],ABIL!C1:C5,5,0) -> ALL | P12: 15
A13: 11 | B13: =VLOOKUP(RC[-1],ABIL!C1:C2,2,0) -> 般若 | C13: =IF(RC[2]="",,"|n"&R1C5&RC[2])&IF(RC[3]="",,"|n"&R1C6&RC[3])&IF(RC[4]="",,"|n"&R1C7&RC[4])&IF(RC[5]="",,"|n"&R1C8&RC[5])&IF(RC[6]="",,"|n"&R1C9&RC[6])&IF(RC[7]="",,"|n"&R1C10&RC[7])&IF(RC[8]="",,"|n"&R1C11&RC[8])&IF(RC[9]="",,"|n"&R1C12&RC[9])&IF(RC[10]="",,"|n"&R1C13&RC[10])&IF(RC[11]="",,"|n"&R1C14&RC[11])&IF(RC[12]="",,"|n"&R1C15&RC[12])&IF(RC[13]="",,"|n"&R1C16&RC[13])&IF(RC[14]="",,"|n"&R1C17&RC[14])&IF(RC[15]="",,"|n"&R1C18&RC[15])&IF(RC[16]="",,"|n"&R1C19&RC[16])&IF(RC[17]="",,"|n"&R1C20&RC[17])&IF(RC[18]="",,"|n"&R1C21&RC[18])&IF(RC[19]="",,"|n"&R1C22&RC[19])&IF(RC[20]="",,"|n"&R1C23&RC[20])&IF(RC[21]="",,"|n"&R1C24&RC[21])&IF(RC[22]="",,"|n"&R1C25&RC[22])&IF(RC[23]="",,"|n"&R1C26&RC[23])&IF(RC[24]="",,"|n"&RC[24]) -> |n附加伤害:6|n力量增幅:5 | D13: =VLOOKUP(RC[-3],ABIL!C1:C5,5,0) -> STR | P13: 6 | U13: 5
A14: 12 | B14: =VLOOKUP(RC[-1],ABIL!C1:C2,2,0) -> 迎风 | C14: =IF(RC[2]="",,"|n"&R1C5&RC[2])&IF(RC[3]="",,"|n"&R1C6&RC[3])&IF(RC[4]="",,"|n"&R1C7&RC[4])&IF(RC[5]="",,"|n"&R1C8&RC[5])&IF(RC[6]="",,"|n"&R1C9&RC[6])&IF(RC[7]="",,"|n"&R1C10&RC[7])&IF(RC[8]="",,"|n"&R1C11&RC[8])&IF(RC[9]="",,"|n"&R1C12&RC[9])&IF(RC[10]="",,"|n"&R1C13&RC[10])&IF(RC[11]="",,"|n"&R1C14&RC[11])&IF(RC[12]="",,"|n"&R1C15&RC[12])&IF(RC[13]="",,"|n"&R1C16&RC[13])&IF(RC[14]="",,"|n"&R1C17&RC[14])&IF(RC[15]="",,"|n"&R1C18&RC[15])&IF(RC[16]="",,"|n"&R1C19&RC[16])&IF(RC[17]="",,"|n"&R1C20&RC[17])&IF(RC[18]="",,"|n"&R1C21&RC[18])&IF(RC[19]="",,"|n"&R1C22&RC[19])&IF(RC[20]="",,"|n"&R1C23&RC[20])&IF(RC[21]="",,"|n"&R1C24&RC[21])&IF(RC[22]="",,"|n"&R1C25&RC[22])&IF(RC[23]="",,"|n"&R1C26&RC[23])&IF(RC[24]="",,"|n"&RC[24]) -> |n附加伤害:6|n敏捷增幅:5 | D14: =VLOOKUP(RC[-3],ABIL!C1:C5,5,0) -> AGI | P14: 6 | V14: 5
A15: 13 | B15: =VLOOKUP(RC[-1],ABIL!C1:C2,2,0) -> 迷魂 | C15: =IF(RC[2]="",,"|n"&R1C5&RC[2])&IF(RC[3]="",,"|n"&R1C6&RC[3])&IF(RC[4]="",,"|n"&R1C7&RC[4])&IF(RC[5]="",,"|n"&R1C8&RC[5])&IF(RC[6]="",,"|n"&R1C9&RC[6])&IF(RC[7]="",,"|n"&R1C10&RC[7])&IF(RC[8]="",,"|n"&R1C11&RC[8])&IF(RC[9]="",,"|n"&R1C12&RC[9])&IF(RC[10]="",,"|n"&R1C13&RC[10])&IF(RC[11]="",,"|n"&R1C14&RC[11])&IF(RC[12]="",,"|n"&R1C15&RC[12])&IF(RC[13]="",,"|n"&R1C16&RC[13])&IF(RC[14]="",,"|n"&R1C17&RC[14])&IF(RC[15]="",,"|n"&R1C18&RC[15])&IF(RC[16]="",,"|n"&R1C19&RC[16])&IF(RC[17]="",,"|n"&R1C20&RC[17])&IF(RC[18]="",,"|n"&R1C21&RC[18])&IF(RC[19]="",,"|n"&R1C22&RC[19])&IF(RC[20]="",,"|n"&R1C23&RC[20])&IF(RC[21]="",,"|n"&R1C24&RC[21])&IF(RC[22]="",,"|n"&R1C25&RC[22])&IF(RC[23]="",,"|n"&R1C26&RC[23])&IF(RC[24]="",,"|n"&RC[24]) -> |n附加伤害:6|n智力增幅:5 | D15: =VLOOKUP(RC[-3],ABIL!C1:C5,5,0) -> INT | P15: 6 | W15: 5
A16: 14 | B16: =VLOOKUP(RC[-1],ABIL!C1:C2,2,0) -> 破山 | C16: =IF(RC[2]="",,"|n"&R1C5&RC[2])&IF(RC[3]="",,"|n"&R1C6&RC[3])&IF(RC[4]="",,"|n"&R1C7&RC[4])&IF(RC[5]="",,"|n"&R1C8&RC[5])&IF(RC[6]="",,"|n"&R1C9&RC[6])&IF(RC[7]="",,"|n"&R1C10&RC[7])&IF(RC[8]="",,"|n"&R1C11&RC[8])&IF(RC[9]="",,"|n"&R1C12&RC[9])&IF(RC[10]="",,"|n"&R1C13&RC[10])&IF(RC[11]="",,"|n"&R1C14&RC[11])&IF(RC[12]="",,"|n"&R1C15&RC[12])&IF(RC[13]="",,"|n"&R1C16&RC[13])&IF(RC[14]="",,"|n"&R1C17&RC[14])&IF(RC[15]="",,"|n"&R1C18&RC[15])&IF(RC[16]="",,"|n"&R1C19&RC[16])&IF(RC[17]="",,"|n"&R1C20&RC[17])&IF(RC[18]="",,"|n"&R1C21&RC[18])&IF(RC[19]="",,"|n"&R1C22&RC[19])&IF(RC[20]="",,"|n"&R1C23&RC[20])&IF(RC[21]="",,"|n"&R1C24&RC[21])&IF(RC[22]="",,"|n"&R1C25&RC[22])&IF(RC[23]="",,"|n"&R1C26&RC[23])&IF(RC[24]="",,"|n"&RC[24]) -> |n攻速:15 | D16: =VLOOKUP(RC[-3],ABIL!C1:C5,5,0) -> ATK | K16: 15
A17: 15 | B17: =VLOOKUP(RC[-1],ABIL!C1:C2,2,0) -> 四凶 | C17: =IF(RC[2]="",,"|n"&R1C5&RC[2])&IF(RC[3]="",,"|n"&R1C6&RC[3])&IF(RC[4]="",,"|n"&R1C7&RC[4])&IF(RC[5]="",,"|n"&R1C8&RC[5])&IF(RC[6]="",,"|n"&R1C9&RC[6])&IF(RC[7]="",,"|n"&R1C10&RC[7])&IF(RC[8]="",,"|n"&R1C11&RC[8])&IF(RC[9]="",,"|n"&R1C12&RC[9])&IF(RC[10]="",,"|n"&R1C13&RC[10])&IF(RC[11]="",,"|n"&R1C14&RC[11])&IF(RC[12]="",,"|n"&R1C15&RC[12])&IF(RC[13]="",,"|n"&R1C16&RC[13])&IF(RC[14]="",,"|n"&R1C17&RC[14])&IF(RC[15]="",,"|n"&R1C18&RC[15])&IF(RC[16]="",,"|n"&R1C19&RC[16])&IF(RC[17]="",,"|n"&R1C20&RC[17])&IF(RC[18]="",,"|n"&R1C21&RC[18])&IF(RC[19]="",,"|n"&R1C22&RC[19])&IF(RC[20]="",,"|n"&R1C23&RC[20])&IF(RC[21]="",,"|n"&R1C24&RC[21])&IF(RC[22]="",,"|n"&R1C25&RC[22])&IF(RC[23]="",,"|n"&R1C26&RC[23])&IF(RC[24]="",,"|n"&RC[24]) -> |n力量增幅:5|n敏捷增幅:5|n智力增幅:5 | D17: =VLOOKUP(RC[-3],ABIL!C1:C5,5,0) -> ALL_MAIN | U17: 5 | V17: 5 | W17: 5
A18: 16 | B18: =VLOOKUP(RC[-1],ABIL!C1:C2,2,0) -> 残风 | C18: =IF(RC[2]="",,"|n"&R1C5&RC[2])&IF(RC[3]="",,"|n"&R1C6&RC[3])&IF(RC[4]="",,"|n"&R1C7&RC[4])&IF(RC[5]="",,"|n"&R1C8&RC[5])&IF(RC[6]="",,"|n"&R1C9&RC[6])&IF(RC[7]="",,"|n"&R1C10&RC[7])&IF(RC[8]="",,"|n"&R1C11&RC[8])&IF(RC[9]="",,"|n"&R1C12&RC[9])&IF(RC[10]="",,"|n"&R1C13&RC[10])&IF(RC[11]="",,"|n"&R1C14&RC[11])&IF(RC[12]="",,"|n"&R1C15&RC[12])&IF(RC[13]="",,"|n"&R1C16&RC[13])&IF(RC[14]="",,"|n"&R1C17&RC[14])&IF(RC[15]="",,"|n"&R1C18&RC[15])&IF(RC[16]="",,"|n"&R1C19&RC[16])&IF(RC[17]="",,"|n"&R1C20&RC[17])&IF(RC[18]="",,"|n"&R1C21&RC[18])&IF(RC[19]="",,"|n"&R1C22&RC[19])&IF(RC[20]="",,"|n"&R1C23&RC[20])&IF(RC[21]="",,"|n"&R1C24&RC[21])&IF(RC[22]="",,"|n"&R1C25&RC[22])&IF(RC[23]="",,"|n"&R1C26&RC[23])&IF(RC[24]="",,"|n"&RC[24]) -> |n附加伤害:15 | D18: =VLOOKUP(RC[-3],ABIL!C1:C5,5,0) -> ALL | P18: 15
A19: 17 | B19: =VLOOKUP(RC[-1],ABIL!C1:C2,2,0) -> 无常 | C19: =IF(RC[2]="",,"|n"&R1C5&RC[2])&IF(RC[3]="",,"|n"&R1C6&RC[3])&IF(RC[4]="",,"|n"&R1C7&RC[4])&IF(RC[5]="",,"|n"&R1C8&RC[5])&IF(RC[6]="",,"|n"&R1C9&RC[6])&IF(RC[7]="",,"|n"&R1C10&RC[7])&IF(RC[8]="",,"|n"&R1C11&RC[8])&IF(RC[9]="",,"|n"&R1C12&RC[9])&IF(RC[10]="",,"|n"&R1C13&RC[10])&IF(RC[11]="",,"|n"&R1C14&RC[11])&IF(RC[12]="",,"|n"&R1C15&RC[12])&IF(RC[13]="",,"|n"&R1C16&RC[13])&IF(RC[14]="",,"|n"&R1C17&RC[14])&IF(RC[15]="",,"|n"&R1C18&RC[15])&IF(RC[16]="",,"|n"&R1C19&RC[16])&IF(RC[17]="",,"|n"&R1C20&RC[17])&IF(RC[18]="",,"|n"&R1C21&RC[18])&IF(RC[19]="",,"|n"&R1C22&RC[19])&IF(RC[20]="",,"|n"&R1C23&RC[20])&IF(RC[21]="",,"|n"&R1C24&RC[21])&IF(RC[22]="",,"|n"&R1C25&RC[22])&IF(RC[23]="",,"|n"&R1C26&RC[23])&IF(RC[24]="",,"|n"&RC[24]) -> |n附加伤害:15 | D19: =VLOOKUP(RC[-3],ABIL!C1:C5,5,0) -> MAIN | P19: 15
A20: 18 | B20: =VLOOKUP(RC[-1],ABIL!C1:C2,2,0) -> 问心 | C20: =IF(RC[2]="",,"|n"&R1C5&RC[2])&IF(RC[3]="",,"|n"&R1C6&RC[3])&IF(RC[4]="",,"|n"&R1C7&RC[4])&IF(RC[5]="",,"|n"&R1C8&RC[5])&IF(RC[6]="",,"|n"&R1C9&RC[6])&IF(RC[7]="",,"|n"&R1C10&RC[7])&IF(RC[8]="",,"|n"&R1C11&RC[8])&IF(RC[9]="",,"|n"&R1C12&RC[9])&IF(RC[10]="",,"|n"&R1C13&RC[10])&IF(RC[11]="",,"|n"&R1C14&RC[11])&IF(RC[12]="",,"|n"&R1C15&RC[12])&IF(RC[13]="",,"|n"&R1C16&RC[13])&IF(RC[14]="",,"|n"&R1C17&RC[14])&IF(RC[15]="",,"|n"&R1C18&RC[15])&IF(RC[16]="",,"|n"&R1C19&RC[16])&IF(RC[17]="",,"|n"&R1C20&RC[17])&IF(RC[18]="",,"|n"&R1C21&RC[18])&IF(RC[19]="",,"|n"&R1C22&RC[19])&IF(RC[20]="",,"|n"&R1C23&RC[20])&IF(RC[21]="",,"|n"&R1C24&RC[21])&IF(RC[22]="",,"|n"&R1C25&RC[22])&IF(RC[23]="",,"|n"&R1C26&RC[23])&IF(RC[24]="",,"|n"&RC[24]) -> |n附加伤害:15 | D20: =VLOOKUP(RC[-3],ABIL!C1:C5,5,0) -> ALL | P20: 15
A21: 19 | B21: =VLOOKUP(RC[-1],ABIL!C1:C2,2,0) -> 太虚 | C21: =IF(RC[2]="",,"|n"&R1C5&RC[2])&IF(RC[3]="",,"|n"&R1C6&RC[3])&IF(RC[4]="",,"|n"&R1C7&RC[4])&IF(RC[5]="",,"|n"&R1C8&RC[5])&IF(RC[6]="",,"|n"&R1C9&RC[6])&IF(RC[7]="",,"|n"&R1C10&RC[7])&IF(RC[8]="",,"|n"&R1C11&RC[8])&IF(RC[9]="",,"|n"&R1C12&RC[9])&IF(RC[10]="",,"|n"&R1C13&RC[10])&IF(RC[11]="",,"|n"&R1C14&RC[11])&IF(RC[12]="",,"|n"&R1C15&RC[12])&IF(RC[13]="",,"|n"&R1C16&RC[13])&IF(RC[14]="",,"|n"&R1C17&RC[14])&IF(RC[15]="",,"|n"&R1C18&RC[15])&IF(RC[16]="",,"|n"&R1C19&RC[16])&IF(RC[17]="",,"|n"&R1C20&RC[17])&IF(RC[18]="",,"|n"&R1C21&RC[18])&IF(RC[19]="",,"|n"&R1C22&RC[19])&IF(RC[20]="",,"|n"&R1C23&RC[20])&IF(RC[21]="",,"|n"&R1C24&RC[21])&IF(RC[22]="",,"|n"&R1C25&RC[22])&IF(RC[23]="",,"|n"&R1C26&RC[23])&IF(RC[24]="",,"|n"&RC[24]) -> |n附加伤害:6|n力量增幅:5 | D21: =VLOOKUP(RC[-3],ABIL!C1:C5,5,0) -> STR | P21: 6 | U21: 5
A22: 20 | B22: =VLOOKUP(RC[-1],ABIL!C1:C2,2,0) -> 菩提 | C22: =IF(RC[2]="",,"|n"&R1C5&RC[2])&IF(RC[3]="",,"|n"&R1C6&RC[3])&IF(RC[4]="",,"|n"&R1C7&RC[4])&IF(RC[5]="",,"|n"&R1C8&RC[5])&IF(RC[6]="",,"|n"&R1C9&RC[6])&IF(RC[7]="",,"|n"&R1C10&RC[7])&IF(RC[8]="",,"|n"&R1C11&RC[8])&IF(RC[9]="",,"|n"&R1C12&RC[9])&IF(RC[10]="",,"|n"&R1C13&RC[10])&IF(RC[11]="",,"|n"&R1C14&RC[11])&IF(RC[12]="",,"|n"&R1C15&RC[12])&IF(RC[13]="",,"|n"&R1C16&RC[13])&IF(RC[14]="",,"|n"&R1C17&RC[14])&IF(RC[15]="",,"|n"&R1C18&RC[15])&IF(RC[16]="",,"|n"&R1C19&RC[16])&IF(RC[17]="",,"|n"&R1C20&RC[17])&IF(RC[18]="",,"|n"&R1C21&RC[18])&IF(RC[19]="",,"|n"&R1C22&RC[19])&IF(RC[20]="",,"|n"&R1C23&RC[20])&IF(RC[21]="",,"|n"&R1C24&RC[21])&IF(RC[22]="",,"|n"&R1C25&RC[22])&IF(RC[23]="",,"|n"&R1C26&RC[23])&IF(RC[24]="",,"|n"&RC[24]) -> |n附加伤害:6|n敏捷增幅:5 | D22: =VLOOKUP(RC[-3],ABIL!C1:C5,5,0) -> AGI | P22: 6 | V22: 5
A23: 21 | B23: =VLOOKUP(RC[-1],ABIL!C1:C2,2,0) -> 无音 | C23: =IF(RC[2]="",,"|n"&R1C5&RC[2])&IF(RC[3]="",,"|n"&R1C6&RC[3])&IF(RC[4]="",,"|n"&R1C7&RC[4])&IF(RC[5]="",,"|n"&R1C8&RC[5])&IF(RC[6]="",,"|n"&R1C9&RC[6])&IF(RC[7]="",,"|n"&R1C10&RC[7])&IF(RC[8]="",,"|n"&R1C11&RC[8])&IF(RC[9]="",,"|n"&R1C12&RC[9])&IF(RC[10]="",,"|n"&R1C13&RC[10])&IF(RC[11]="",,"|n"&R1C14&RC[11])&IF(RC[12]="",,"|n"&R1C15&RC[12])&IF(RC[13]="",,"|n"&R1C16&RC[13])&IF(RC[14]="",,"|n"&R1C17&RC[14])&IF(RC[15]="",,"|n"&R1C18&RC[15])&IF(RC[16]="",,"|n"&R1C19&RC[16])&IF(RC[17]="",,"|n"&R1C20&RC[17])&IF(RC[18]="",,"|n"&R1C21&RC[18])&IF(RC[19]="",,"|n"&R1C22&RC[19])&IF(RC[20]="",,"|n"&R1C23&RC[20])&IF(RC[21]="",,"|n"&R1C24&RC[21])&IF(RC[22]="",,"|n"&R1C25&RC[22])&IF(RC[23]="",,"|n"&R1C26&RC[23])&IF(RC[24]="",,"|n"&RC[24]) -> |n附加伤害:6|n智力增幅:5 | D23: =VLOOKUP(RC[-3],ABIL!C1:C5,5,0) -> INT | P23: 6 | W23: 5
A24: 22 | B24: =VLOOKUP(RC[-1],ABIL!C1:C2,2,0) -> 悲问 | C24: =IF(RC[2]="",,"|n"&R1C5&RC[2])&IF(RC[3]="",,"|n"&R1C6&RC[3])&IF(RC[4]="",,"|n"&R1C7&RC[4])&IF(RC[5]="",,"|n"&R1C8&RC[5])&IF(RC[6]="",,"|n"&R1C9&RC[6])&IF(RC[7]="",,"|n"&R1C10&RC[7])&IF(RC[8]="",,"|n"&R1C11&RC[8])&IF(RC[9]="",,"|n"&R1C12&RC[9])&IF(RC[10]="",,"|n"&R1C13&RC[10])&IF(RC[11]="",,"|n"&R1C14&RC[11])&IF(RC[12]="",,"|n"&R1C15&RC[12])&IF(RC[13]="",,"|n"&R1C16&RC[13])&IF(RC[14]="",,"|n"&R1C17&RC[14])&IF(RC[15]="",,"|n"&R1C18&RC[15])&IF(RC[16]="",,"|n"&R1C19&RC[16])&IF(RC[17]="",,"|n"&R1C20&RC[17])&IF(RC[18]="",,"|n"&R1C21&RC[18])&IF(RC[19]="",,"|n"&R1C22&RC[19])&IF(RC[20]="",,"|n"&R1C23&RC[20])&IF(RC[21]="",,"|n"&R1C24&RC[21])&IF(RC[22]="",,"|n"&R1C25&RC[22])&IF(RC[23]="",,"|n"&R1C26&RC[23])&IF(RC[24]="",,"|n"&RC[24]) -> |n攻速:15 | D24: =VLOOKUP(RC[-3],ABIL!C1:C5,5,0) -> ATK | K24: 15
A25: 23 | B25: =VLOOKUP(RC[-1],ABIL!C1:C2,2,0) -> 空蝉 | C25: =IF(RC[2]="",,"|n"&R1C5&RC[2])&IF(RC[3]="",,"|n"&R1C6&RC[3])&IF(RC[4]="",,"|n"&R1C7&RC[4])&IF(RC[5]="",,"|n"&R1C8&RC[5])&IF(RC[6]="",,"|n"&R1C9&RC[6])&IF(RC[7]="",,"|n"&R1C10&RC[7])&IF(RC[8]="",,"|n"&R1C11&RC[8])&IF(RC[9]="",,"|n"&R1C12&RC[9])&IF(RC[10]="",,"|n"&R1C13&RC[10])&IF(RC[11]="",,"|n"&R1C14&RC[11])&IF(RC[12]="",,"|n"&R1C15&RC[12])&IF(RC[13]="",,"|n"&R1C16&RC[13])&IF(RC[14]="",,"|n"&R1C17&RC[14])&IF(RC[15]="",,"|n"&R1C18&RC[15])&IF(RC[16]="",,"|n"&R1C19&RC[16])&IF(RC[17]="",,"|n"&R1C20&RC[17])&IF(RC[18]="",,"|n"&R1C21&RC[18])&IF(RC[19]="",,"|n"&R1C22&RC[19])&IF(RC[20]="",,"|n"&R1C23&RC[20])&IF(RC[21]="",,"|n"&R1C24&RC[21])&IF(RC[22]="",,"|n"&R1C25&RC[22])&IF(RC[23]="",,"|n"&R1C26&RC[23])&IF(RC[24]="",,"|n"&RC[24]) -> |n力量增幅:3|n敏捷增幅:3|n智力增幅:3 | D25: =VLOOKUP(RC[-3],ABIL!C1:C5,5,0) -> ALL_MAIN | U25: 3 | V25: 3 | W25: 3
A26: 24 | B26: =VLOOKUP(RC[-1],ABIL!C1:C2,2,0) -> 无涯 | C26: =IF(RC[2]="",,"|n"&R1C5&RC[2])&IF(RC[3]="",,"|n"&R1C6&RC[3])&IF(RC[4]="",,"|n"&R1C7&RC[4])&IF(RC[5]="",,"|n"&R1C8&RC[5])&IF(RC[6]="",,"|n"&R1C9&RC[6])&IF(RC[7]="",,"|n"&R1C10&RC[7])&IF(RC[8]="",,"|n"&R1C11&RC[8])&IF(RC[9]="",,"|n"&R1C12&RC[9])&IF(RC[10]="",,"|n"&R1C13&RC[10])&IF(RC[11]="",,"|n"&R1C14&RC[11])&IF(RC[12]="",,"|n"&R1C15&RC[12])&IF(RC[13]="",,"|n"&R1C16&RC[13])&IF(RC[14]="",,"|n"&R1C17&RC[14])&IF(RC[15]="",,"|n"&R1C18&RC[15])&IF(RC[16]="",,"|n"&R1C19&RC[16])&IF(RC[17]="",,"|n"&R1C20&RC[17])&IF(RC[18]="",,"|n"&R1C21&RC[18])&IF(RC[19]="",,"|n"&R1C22&RC[19])&IF(RC[20]="",,"|n"&R1C23&RC[20])&IF(RC[21]="",,"|n"&R1C24&RC[21])&IF(RC[22]="",,"|n"&R1C25&RC[22])&IF(RC[23]="",,"|n"&R1C26&RC[23])&IF(RC[24]="",,"|n"&RC[24]) -> |n附加伤害:15 | D26: =VLOOKUP(RC[-3],ABIL!C1:C5,5,0) -> ALL | P26: 15
A27: 25 | B27: =VLOOKUP(RC[-1],ABIL!C1:C2,2,0) -> 无极 | C27: =IF(RC[2]="",,"|n"&R1C5&RC[2])&IF(RC[3]="",,"|n"&R1C6&RC[3])&IF(RC[4]="",,"|n"&R1C7&RC[4])&IF(RC[5]="",,"|n"&R1C8&RC[5])&IF(RC[6]="",,"|n"&R1C9&RC[6])&IF(RC[7]="",,"|n"&R1C10&RC[7])&IF(RC[8]="",,"|n"&R1C11&RC[8])&IF(RC[9]="",,"|n"&R1C12&RC[9])&IF(RC[10]="",,"|n"&R1C13&RC[10])&IF(RC[11]="",,"|n"&R1C14&RC[11])&IF(RC[12]="",,"|n"&R1C15&RC[12])&IF(RC[13]="",,"|n"&R1C16&RC[13])&IF(RC[14]="",,"|n"&R1C17&RC[14])&IF(RC[15]="",,"|n"&R1C18&RC[15])&IF(RC[16]="",,"|n"&R1C19&RC[16])&IF(RC[17]="",,"|n"&R1C20&RC[17])&IF(RC[18]="",,"|n"&R1C21&RC[18])&IF(RC[19]="",,"|n"&R1C22&RC[19])&IF(RC[20]="",,"|n"&R1C23&RC[20])&IF(RC[21]="",,"|n"&R1C24&RC[21])&IF(RC[22]="",,"|n"&R1C25&RC[22])&IF(RC[23]="",,"|n"&R1C26&RC[23])&IF(RC[24]="",,"|n"&RC[24]) -> |n附加伤害:15 | D27: =VLOOKUP(RC[-3],ABIL!C1:C5,5,0) -> MAIN | P27: 15
A28: 26 | B28: =VLOOKUP(RC[-1],ABIL!C1:C2,2,0) -> 索命 | C28: =IF(RC[2]="",,"|n"&R1C5&RC[2])&IF(RC[3]="",,"|n"&R1C6&RC[3])&IF(RC[4]="",,"|n"&R1C7&RC[4])&IF(RC[5]="",,"|n"&R1C8&RC[5])&IF(RC[6]="",,"|n"&R1C9&RC[6])&IF(RC[7]="",,"|n"&R1C10&RC[7])&IF(RC[8]="",,"|n"&R1C11&RC[8])&IF(RC[9]="",,"|n"&R1C12&RC[9])&IF(RC[10]="",,"|n"&R1C13&RC[10])&IF(RC[11]="",,"|n"&R1C14&RC[11])&IF(RC[12]="",,"|n"&R1C15&RC[12])&IF(RC[13]="",,"|n"&R1C16&RC[13])&IF(RC[14]="",,"|n"&R1C17&RC[14])&IF(RC[15]="",,"|n"&R1C18&RC[15])&IF(RC[16]="",,"|n"&R1C19&RC[16])&IF(RC[17]="",,"|n"&R1C20&RC[17])&IF(RC[18]="",,"|n"&R1C21&RC[18])&IF(RC[19]="",,"|n"&R1C22&RC[19])&IF(RC[20]="",,"|n"&R1C23&RC[20])&IF(RC[21]="",,"|n"&R1C24&RC[21])&IF(RC[22]="",,"|n"&R1C25&RC[22])&IF(RC[23]="",,"|n"&R1C26&RC[23])&IF(RC[24]="",,"|n"&RC[24]) -> |n附加伤害:15 | D28: =VLOOKUP(RC[-3],ABIL!C1:C5,5,0) -> ALL | P28: 15
A29: 27 | B29: =VLOOKUP(RC[-1],ABIL!C1:C2,2,0) -> 大千 | C29: =IF(RC[2]="",,"|n"&R1C5&RC[2])&IF(RC[3]="",,"|n"&R1C6&RC[3])&IF(RC[4]="",,"|n"&R1C7&RC[4])&IF(RC[5]="",,"|n"&R1C8&RC[5])&IF(RC[6]="",,"|n"&R1C9&RC[6])&IF(RC[7]="",,"|n"&R1C10&RC[7])&IF(RC[8]="",,"|n"&R1C11&RC[8])&IF(RC[9]="",,"|n"&R1C12&RC[9])&IF(RC[10]="",,"|n"&R1C13&RC[10])&IF(RC[11]="",,"|n"&R1C14&RC[11])&IF(RC[12]="",,"|n"&R1C15&RC[12])&IF(RC[13]="",,"|n"&R1C16&RC[13])&IF(RC[14]="",,"|n"&R1C17&RC[14])&IF(RC[15]="",,"|n"&R1C18&RC[15])&IF(RC[16]="",,"|n"&R1C19&RC[16])&IF(RC[17]="",,"|n"&R1C20&RC[17])&IF(RC[18]="",,"|n"&R1C21&RC[18])&IF(RC[19]="",,"|n"&R1C22&RC[19])&IF(RC[20]="",,"|n"&R1C23&RC[20])&IF(RC[21]="",,"|n"&R1C24&RC[21])&IF(RC[22]="",,"|n"&R1C25&RC[22])&IF(RC[23]="",,"|n"&R1C26&RC[23])&IF(RC[24]="",,"|n"&RC[24]) -> |n附加伤害:6|n力量增幅:5 | D29: =VLOOKUP(RC[-3],ABIL!C1:C5,5,0) -> STR | P29: 6 | U29: 5
A30: 28 | B30: =VLOOKUP(RC[-1],ABIL!C1:C2,2,0) -> 灭神 | C30: =IF(RC[2]="",,"|n"&R1C5&RC[2])&IF(RC[3]="",,"|n"&R1C6&RC[3])&IF(RC[4]="",,"|n"&R1C7&RC[4])&IF(RC[5]="",,"|n"&R1C8&RC[5])&IF(RC[6]="",,"|n"&R1C9&RC[6])&IF(RC[7]="",,"|n"&R1C10&RC[7])&IF(RC[8]="",,"|n"&R1C11&RC[8])&IF(RC[9]="",,"|n"&R1C12&RC[9])&IF(RC[10]="",,"|n"&R1C13&RC[10])&IF(RC[11]="",,"|n"&R1C14&RC[11])&IF(RC[12]="",,"|n"&R1C15&RC[12])&IF(RC[13]="",,"|n"&R1C16&RC[13])&IF(RC[14]="",,"|n"&R1C17&RC[14])&IF(RC[15]="",,"|n"&R1C18&RC[15])&IF(RC[16]="",,"|n"&R1C19&RC[16])&IF(RC[17]="",,"|n"&R1C20&RC[17])&IF(RC[18]="",,"|n"&R1C21&RC[18])&IF(RC[19]="",,"|n"&R1C22&RC[19])&IF(RC[20]="",,"|n"&R1C23&RC[20])&IF(RC[21]="",,"|n"&R1C24&RC[21])&IF(RC[22]="",,"|n"&R1C25&RC[22])&IF(RC[23]="",,"|n"&R1C26&RC[23])&IF(RC[24]="",,"|n"&RC[24]) -> |n附加伤害:6|n敏捷增幅:5 | D30: =VLOOKUP(RC[-3],ABIL!C1:C5,5,0) -> AGI | P30: 6 | V30: 5
A31: 29 | B31: =VLOOKUP(RC[-1],ABIL!C1:C2,2,0) -> 夺心 | C31: =IF(RC[2]="",,"|n"&R1C5&RC[2])&IF(RC[3]="",,"|n"&R1C6&RC[3])&IF(RC[4]="",,"|n"&R1C7&RC[4])&IF(RC[5]="",,"|n"&R1C8&RC[5])&IF(RC[6]="",,"|n"&R1C9&RC[6])&IF(RC[7]="",,"|n"&R1C10&RC[7])&IF(RC[8]="",,"|n"&R1C11&RC[8])&IF(RC[9]="",,"|n"&R1C12&RC[9])&IF(RC[10]="",,"|n"&R1C13&RC[10])&IF(RC[11]="",,"|n"&R1C14&RC[11])&IF(RC[12]="",,"|n"&R1C15&RC[12])&IF(RC[13]="",,"|n"&R1C16&RC[13])&IF(RC[14]="",,"|n"&R1C17&RC[14])&IF(RC[15]="",,"|n"&R1C18&RC[15])&IF(RC[16]="",,"|n"&R1C19&RC[16])&IF(RC[17]="",,"|n"&R1C20&RC[17])&IF(RC[18]="",,"|n"&R1C21&RC[18])&IF(RC[19]="",,"|n"&R1C22&RC[19])&IF(RC[20]="",,"|n"&R1C23&RC[20])&IF(RC[21]="",,"|n"&R1C24&RC[21])&IF(RC[22]="",,"|n"&R1C25&RC[22])&IF(RC[23]="",,"|n"&R1C26&RC[23])&IF(RC[24]="",,"|n"&RC[24]) -> |n附加伤害:6|n智力增幅:5 | D31: =VLOOKUP(RC[-3],ABIL!C1:C5,5,0) -> INT | P31: 6 | W31: 5
A32: 30 | B32: =VLOOKUP(RC[-1],ABIL!C1:C2,2,0) -> 震天 | C32: =IF(RC[2]="",,"|n"&R1C5&RC[2])&IF(RC[3]="",,"|n"&R1C6&RC[3])&IF(RC[4]="",,"|n"&R1C7&RC[4])&IF(RC[5]="",,"|n"&R1C8&RC[5])&IF(RC[6]="",,"|n"&R1C9&RC[6])&IF(RC[7]="",,"|n"&R1C10&RC[7])&IF(RC[8]="",,"|n"&R1C11&RC[8])&IF(RC[9]="",,"|n"&R1C12&RC[9])&IF(RC[10]="",,"|n"&R1C13&RC[10])&IF(RC[11]="",,"|n"&R1C14&RC[11])&IF(RC[12]="",,"|n"&R1C15&RC[12])&IF(RC[13]="",,"|n"&R1C16&RC[13])&IF(RC[14]="",,"|n"&R1C17&RC[14])&IF(RC[15]="",,"|n"&R1C18&RC[15])&IF(RC[16]="",,"|n"&R1C19&RC[16])&IF(RC[17]="",,"|n"&R1C20&RC[17])&IF(RC[18]="",,"|n"&R1C21&RC[18])&IF(RC[19]="",,"|n"&R1C22&RC[19])&IF(RC[20]="",,"|n"&R1C23&RC[20])&IF(RC[21]="",,"|n"&R1C24&RC[21])&IF(RC[22]="",,"|n"&R1C25&RC[22])&IF(RC[23]="",,"|n"&R1C26&RC[23])&IF(RC[24]="",,"|n"&RC[24]) -> |n攻速:15 | D32: =VLOOKUP(RC[-3],ABIL!C1:C5,5,0) -> ATK | K32: 15
A33: 31 | B33: =VLOOKUP(RC[-1],ABIL!C1:C2,2,0) -> 天问 | C33: =IF(RC[2]="",,"|n"&R1C5&RC[2])&IF(RC[3]="",,"|n"&R1C6&RC[3])&IF(RC[4]="",,"|n"&R1C7&RC[4])&IF(RC[5]="",,"|n"&R1C8&RC[5])&IF(RC[6]="",,"|n"&R1C9&RC[6])&IF(RC[7]="",,"|n"&R1C10&RC[7])&IF(RC[8]="",,"|n"&R1C11&RC[8])&IF(RC[9]="",,"|n"&R1C12&RC[9])&IF(RC[10]="",,"|n"&R1C13&RC[10])&IF(RC[11]="",,"|n"&R1C14&RC[11])&IF(RC[12]="",,"|n"&R1C15&RC[12])&IF(RC[13]="",,"|n"&R1C16&RC[13])&IF(RC[14]="",,"|n"&R1C17&RC[14])&IF(RC[15]="",,"|n"&R1C18&RC[15])&IF(RC[16]="",,"|n"&R1C19&RC[16])&IF(RC[17]="",,"|n"&R1C20&RC[17])&IF(RC[18]="",,"|n"&R1C21&RC[18])&IF(RC[19]="",,"|n"&R1C22&RC[19])&IF(RC[20]="",,"|n"&R1C23&RC[20])&IF(RC[21]="",,"|n"&R1C24&RC[21])&IF(RC[22]="",,"|n"&R1C25&RC[22])&IF(RC[23]="",,"|n"&R1C26&RC[23])&IF(RC[24]="",,"|n"&RC[24]) -> |n力量增幅:3|n敏捷增幅:3|n智力增幅:3 | D33: =VLOOKUP(RC[-3],ABIL!C1:C5,5,0) -> ALL_MAIN | U33: 3 | V33: 3 | W33: 3
A34: 32 | B34: =VLOOKUP(RC[-1],ABIL!C1:C2,2,0) -> 碧空 | C34: =IF(RC[2]="",,"|n"&R1C5&RC[2])&IF(RC[3]="",,"|n"&R1C6&RC[3])&IF(RC[4]="",,"|n"&R1C7&RC[4])&IF(RC[5]="",,"|n"&R1C8&RC[5])&IF(RC[6]="",,"|n"&R1C9&RC[6])&IF(RC[7]="",,"|n"&R1C10&RC[7])&IF(RC[8]="",,"|n"&R1C11&RC[8])&IF(RC[9]="",,"|n"&R1C12&RC[9])&IF(RC[10]="",,"|n"&R1C13&RC[10])&IF(RC[11]="",,"|n"&R1C14&RC[11])&IF(RC[12]="",,"|n"&R1C15&RC[12])&IF(RC[13]="",,"|n"&R1C16&RC[13])&IF(RC[14]="",,"|n"&R1C17&RC[14])&IF(RC[15]="",,"|n"&R1C18&RC[15])&IF(RC[16]="",,"|n"&R1C19&RC[16])&IF(RC[17]="",,"|n"&R1C20&RC[17])&IF(RC[18]="",,"|n"&R1C21&RC[18])&IF(RC[19]="",,"|n"&R1C22&RC[19])&IF(RC[20]="",,"|n"&R1C23&RC[20])&IF(RC[21]="",,"|n"&R1C24&RC[21])&IF(RC[22]="",,"|n"&R1C25&RC[22])&IF(RC[23]="",,"|n"&R1C26&RC[23])&IF(RC[24]="",,"|n"&RC[24]) -> |n附加伤害:15 | D34: =VLOOKUP(RC[-3],ABIL!C1:C5,5,0) -> ALL | P34: 15
A35: 33 | B35: =VLOOKUP(RC[-1],ABIL!C1:C2,2,0) -> 明月 | C35: =IF(RC[2]="",,"|n"&R1C5&RC[2])&IF(RC[3]="",,"|n"&R1C6&RC[3])&IF(RC[4]="",,"|n"&R1C7&RC[4])&IF(RC[5]="",,"|n"&R1C8&RC[5])&IF(RC[6]="",,"|n"&R1C9&RC[6])&IF(RC[7]="",,"|n"&R1C10&RC[7])&IF(RC[8]="",,"|n"&R1C11&RC[8])&IF(RC[9]="",,"|n"&R1C12&RC[9])&IF(RC[10]="",,"|n"&R1C13&RC[10])&IF(RC[11]="",,"|n"&R1C14&RC[11])&IF(RC[12]="",,"|n"&R1C15&RC[12])&IF(RC[13]="",,"|n"&R1C16&RC[13])&IF(RC[14]="",,"|n"&R1C17&RC[14])&IF(RC[15]="",,"|n"&R1C18&RC[15])&IF(RC[16]="",,"|n"&R1C19&RC[16])&IF(RC[17]="",,"|n"&R1C20&RC[17])&IF(RC[18]="",,"|n"&R1C21&RC[18])&IF(RC[19]="",,"|n"&R1C22&RC[19])&IF(RC[20]="",,"|n"&R1C23&RC[20])&IF(RC[21]="",,"|n"&R1C24&RC[21])&IF(RC[22]="",,"|n"&R1C25&RC[22])&IF(RC[23]="",,"|n"&R1C26&RC[23])&IF(RC[24]="",,"|n"&RC[24]) -> |n附加伤害:15 | D35: =VLOOKUP(RC[-3],ABIL!C1:C5,5,0) -> MAIN | P35: 15
A36: 34 | B36: =VLOOKUP(RC[-1],ABIL!C1:C2,2,0) -> 幻梦穿 | C36: =IF(RC[2]="",,"|n"&R1C5&RC[2])&IF(RC[3]="",,"|n"&R1C6&RC[3])&IF(RC[4]="",,"|n"&R1C7&RC[4])&IF(RC[5]="",,"|n"&R1C8&RC[5])&IF(RC[6]="",,"|n"&R1C9&RC[6])&IF(RC[7]="",,"|n"&R1C10&RC[7])&IF(RC[8]="",,"|n"&R1C11&RC[8])&IF(RC[9]="",,"|n"&R1C12&RC[9])&IF(RC[10]="",,"|n"&R1C13&RC[10])&IF(RC[11]="",,"|n"&R1C14&RC[11])&IF(RC[12]="",,"|n"&R1C15&RC[12])&IF(RC[13]="",,"|n"&R1C16&RC[13])&IF(RC[14]="",,"|n"&R1C17&RC[14])&IF(RC[15]="",,"|n"&R1C18&RC[15])&IF(RC[16]="",,"|n"&R1C19&RC[16])&IF(RC[17]="",,"|n"&R1C20&RC[17])&IF(RC[18]="",,"|n"&R1C21&RC[18])&IF(RC[19]="",,"|n"&R1C22&RC[19])&IF(RC[20]="",,"|n"&R1C23&RC[20])&IF(RC[21]="",,"|n"&R1C24&RC[21])&IF(RC[22]="",,"|n"&R1C25&RC[22])&IF(RC[23]="",,"|n"&R1C26&RC[23])&IF(RC[24]="",,"|n"&RC[24]) -> |n附加伤害:25 | D36: =VLOOKUP(RC[-3],ABIL!C1:C5,5,0) -> ALL | P36: 25
A37: 35 | B37: =VLOOKUP(RC[-1],ABIL!C1:C2,2,0) -> 绕指柔 | C37: =IF(RC[2]="",,"|n"&R1C5&RC[2])&IF(RC[3]="",,"|n"&R1C6&RC[3])&IF(RC[4]="",,"|n"&R1C7&RC[4])&IF(RC[5]="",,"|n"&R1C8&RC[5])&IF(RC[6]="",,"|n"&R1C9&RC[6])&IF(RC[7]="",,"|n"&R1C10&RC[7])&IF(RC[8]="",,"|n"&R1C11&RC[8])&IF(RC[9]="",,"|n"&R1C12&RC[9])&IF(RC[10]="",,"|n"&R1C13&RC[10])&IF(RC[11]="",,"|n"&R1C14&RC[11])&IF(RC[12]="",,"|n"&R1C15&RC[12])&IF(RC[13]="",,"|n"&R1C16&RC[13])&IF(RC[14]="",,"|n"&R1C17&RC[14])&IF(RC[15]="",,"|n"&R1C18&RC[15])&IF(RC[16]="",,"|n"&R1C19&RC[16])&IF(RC[17]="",,"|n"&R1C20&RC[17])&IF(RC[18]="",,"|n"&R1C21&RC[18])&IF(RC[19]="",,"|n"&R1C22&RC[19])&IF(RC[20]="",,"|n"&R1C23&RC[20])&IF(RC[21]="",,"|n"&R1C24&RC[21])&IF(RC[22]="",,"|n"&R1C25&RC[22])&IF(RC[23]="",,"|n"&R1C26&RC[23])&IF(RC[24]="",,"|n"&RC[24]) -> |n附加伤害:13|n力量增幅:10 | D37: =VLOOKUP(RC[-3],ABIL!C1:C5,5,0) -> STR | P37: 13 | U37: 10
A38: 36 | B38: =VLOOKUP(RC[-1],ABIL!C1:C2,2,0) -> 郁浮欢 | C38: =IF(RC[2]="",,"|n"&R1C5&RC[2])&IF(RC[3]="",,"|n"&R1C6&RC[3])&IF(RC[4]="",,"|n"&R1C7&RC[4])&IF(RC[5]="",,"|n"&R1C8&RC[5])&IF(RC[6]="",,"|n"&R1C9&RC[6])&IF(RC[7]="",,"|n"&R1C10&RC[7])&IF(RC[8]="",,"|n"&R1C11&RC[8])&IF(RC[9]="",,"|n"&R1C12&RC[9])&IF(RC[10]="",,"|n"&R1C13&RC[10])&IF(RC[11]="",,"|n"&R1C14&RC[11])&IF(RC[12]="",,"|n"&R1C15&RC[12])&IF(RC[13]="",,"|n"&R1C16&RC[13])&IF(RC[14]="",,"|n"&R1C17&RC[14])&IF(RC[15]="",,"|n"&R1C18&RC[15])&IF(RC[16]="",,"|n"&R1C19&RC[16])&IF(RC[17]="",,"|n"&R1C20&RC[17])&IF(RC[18]="",,"|n"&R1C21&RC[18])&IF(RC[19]="",,"|n"&R1C22&RC[19])&IF(RC[20]="",,"|n"&R1C23&RC[20])&IF(RC[21]="",,"|n"&R1C24&RC[21])&IF(RC[22]="",,"|n"&R1C25&RC[22])&IF(RC[23]="",,"|n"&R1C26&RC[23])&IF(RC[24]="",,"|n"&RC[24]) -> |n附加伤害:13|n敏捷增幅:10 | D38: =VLOOKUP(RC[-3],ABIL!C1:C5,5,0) -> AGI | P38: 13 | V38: 10
A39: 37 | B39: =VLOOKUP(RC[-1],ABIL!C1:C2,2,0) -> 夜寒凉 | C39: =IF(RC[2]="",,"|n"&R1C5&RC[2])&IF(RC[3]="",,"|n"&R1C6&RC[3])&IF(RC[4]="",,"|n"&R1C7&RC[4])&IF(RC[5]="",,"|n"&R1C8&RC[5])&IF(RC[6]="",,"|n"&R1C9&RC[6])&IF(RC[7]="",,"|n"&R1C10&RC[7])&IF(RC[8]="",,"|n"&R1C11&RC[8])&IF(RC[9]="",,"|n"&R1C12&RC[9])&IF(RC[10]="",,"|n"&R1C13&RC[10])&IF(RC[11]="",,"|n"&R1C14&RC[11])&IF(RC[12]="",,"|n"&R1C15&RC[12])&IF(RC[13]="",,"|n"&R1C16&RC[13])&IF(RC[14]="",,"|n"&R1C17&RC[14])&IF(RC[15]="",,"|n"&R1C18&RC[15])&IF(RC[16]="",,"|n"&R1C19&RC[16])&IF(RC[17]="",,"|n"&R1C20&RC[17])&IF(RC[18]="",,"|n"&R1C21&RC[18])&IF(RC[19]="",,"|n"&R1C22&RC[19])&IF(RC[20]="",,"|n"&R1C23&RC[20])&IF(RC[21]="",,"|n"&R1C24&RC[21])&IF(RC[22]="",,"|n"&R1C25&RC[22])&IF(RC[23]="",,"|n"&R1C26&RC[23])&IF(RC[24]="",,"|n"&RC[24]) -> |n附加伤害:13|n智力增幅:10 | D39: =VLOOKUP(RC[-3],ABIL!C1:C5,5,0) -> INT | P39: 13 | W39: 10
A40: 38 | B40: =VLOOKUP(RC[-1],ABIL!C1:C2,2,0) -> 醉人间 | C40: =IF(RC[2]="",,"|n"&R1C5&RC[2])&IF(RC[3]="",,"|n"&R1C6&RC[3])&IF(RC[4]="",,"|n"&R1C7&RC[4])&IF(RC[5]="",,"|n"&R1C8&RC[5])&IF(RC[6]="",,"|n"&R1C9&RC[6])&IF(RC[7]="",,"|n"&R1C10&RC[7])&IF(RC[8]="",,"|n"&R1C11&RC[8])&IF(RC[9]="",,"|n"&R1C12&RC[9])&IF(RC[10]="",,"|n"&R1C13&RC[10])&IF(RC[11]="",,"|n"&R1C14&RC[11])&IF(RC[12]="",,"|n"&R1C15&RC[12])&IF(RC[13]="",,"|n"&R1C16&RC[13])&IF(RC[14]="",,"|n"&R1C17&RC[14])&IF(RC[15]="",,"|n"&R1C18&RC[15])&IF(RC[16]="",,"|n"&R1C19&RC[16])&IF(RC[17]="",,"|n"&R1C20&RC[17])&IF(RC[18]="",,"|n"&R1C21&RC[18])&IF(RC[19]="",,"|n"&R1C22&RC[19])&IF(RC[20]="",,"|n"&R1C23&RC[20])&IF(RC[21]="",,"|n"&R1C24&RC[21])&IF(RC[22]="",,"|n"&R1C25&RC[22])&IF(RC[23]="",,"|n"&R1C26&RC[23])&IF(RC[24]="",,"|n"&RC[24]) -> |n攻速:25 | D40: =VLOOKUP(RC[-3],ABIL!C1:C5,5,0) -> ATK | K40: 25
A41: 39 | B41: =VLOOKUP(RC[-1],ABIL!C1:C2,2,0) -> 万里穹 | C41: =IF(RC[2]="",,"|n"&R1C5&RC[2])&IF(RC[3]="",,"|n"&R1C6&RC[3])&IF(RC[4]="",,"|n"&R1C7&RC[4])&IF(RC[5]="",,"|n"&R1C8&RC[5])&IF(RC[6]="",,"|n"&R1C9&RC[6])&IF(RC[7]="",,"|n"&R1C10&RC[7])&IF(RC[8]="",,"|n"&R1C11&RC[8])&IF(RC[9]="",,"|n"&R1C12&RC[9])&IF(RC[10]="",,"|n"&R1C13&RC[10])&IF(RC[11]="",,"|n"&R1C14&RC[11])&IF(RC[12]="",,"|n"&R1C15&RC[12])&IF(RC[13]="",,"|n"&R1C16&RC[13])&IF(RC[14]="",,"|n"&R1C17&RC[14])&IF(RC[15]="",,"|n"&R1C18&RC[15])&IF(RC[16]="",,"|n"&R1C19&RC[16])&IF(RC[17]="",,"|n"&R1C20&RC[17])&IF(RC[18]="",,"|n"&R1C21&RC[18])&IF(RC[19]="",,"|n"&R1C22&RC[19])&IF(RC[20]="",,"|n"&R1C23&RC[20])&IF(RC[21]="",,"|n"&R1C24&RC[21])&IF(RC[22]="",,"|n"&R1C25&RC[22])&IF(RC[23]="",,"|n"&R1C26&RC[23])&IF(RC[24]="",,"|n"&RC[24]) -> |n力量增幅:6|n敏捷增幅:6|n智力增幅:6 | D41: =VLOOKUP(RC[-3],ABIL!C1:C5,5,0) -> ALL_MAIN | U41: 6 | V41: 6 | W41: 6
A42: 40 | B42: =VLOOKUP(RC[-1],ABIL!C1:C2,2,0) -> 青玉案 | C42: =IF(RC[2]="",,"|n"&R1C5&RC[2])&IF(RC[3]="",,"|n"&R1C6&RC[3])&IF(RC[4]="",,"|n"&R1C7&RC[4])&IF(RC[5]="",,"|n"&R1C8&RC[5])&IF(RC[6]="",,"|n"&R1C9&RC[6])&IF(RC[7]="",,"|n"&R1C10&RC[7])&IF(RC[8]="",,"|n"&R1C11&RC[8])&IF(RC[9]="",,"|n"&R1C12&RC[9])&IF(RC[10]="",,"|n"&R1C13&RC[10])&IF(RC[11]="",,"|n"&R1C14&RC[11])&IF(RC[12]="",,"|n"&R1C15&RC[12])&IF(RC[13]="",,"|n"&R1C16&RC[13])&IF(RC[14]="",,"|n"&R1C17&RC[14])&IF(RC[15]="",,"|n"&R1C18&RC[15])&IF(RC[16]="",,"|n"&R1C19&RC[16])&IF(RC[17]="",,"|n"&R1C20&RC[17])&IF(RC[18]="",,"|n"&R1C21&RC[18])&IF(RC[19]="",,"|n"&R1C22&RC[19])&IF(RC[20]="",,"|n"&R1C23&RC[20])&IF(RC[21]="",,"|n"&R1C24&RC[21])&IF(RC[22]="",,"|n"&R1C25&RC[22])&IF(RC[23]="",,"|n"&R1C26&RC[23])&IF(RC[24]="",,"|n"&RC[24]) -> |n附加伤害:25 | D42: =VLOOKUP(RC[-3],ABIL!C1:C5,5,0) -> ALL | P42: 25
A43: 41 | B43: =VLOOKUP(RC[-1],ABIL!C1:C2,2,0) -> 阳关调 | C43: =IF(RC[2]="",,"|n"&R1C5&RC[2])&IF(RC[3]="",,"|n"&R1C6&RC[3])&IF(RC[4]="",,"|n"&R1C7&RC[4])&IF(RC[5]="",,"|n"&R1C8&RC[5])&IF(RC[6]="",,"|n"&R1C9&RC[6])&IF(RC[7]="",,"|n"&R1C10&RC[7])&IF(RC[8]="",,"|n"&R1C11&RC[8])&IF(RC[9]="",,"|n"&R1C12&RC[9])&IF(RC[10]="",,"|n"&R1C13&RC[10])&IF(RC[11]="",,"|n"&R1C14&RC[11])&IF(RC[12]="",,"|n"&R1C15&RC[12])&IF(RC[13]="",,"|n"&R1C16&RC[13])&IF(RC[14]="",,"|n"&R1C17&RC[14])&IF(RC[15]="",,"|n"&R1C18&RC[15])&IF(RC[16]="",,"|n"&R1C19&RC[16])&IF(RC[17]="",,"|n"&R1C20&RC[17])&IF(RC[18]="",,"|n"&R1C21&RC[18])&IF(RC[19]="",,"|n"&R1C22&RC[19])&IF(RC[20]="",,"|n"&R1C23&RC[20])&IF(RC[21]="",,"|n"&R1C24&RC[21])&IF(RC[22]="",,"|n"&R1C25&RC[22])&IF(RC[23]="",,"|n"&R1C26&RC[23])&IF(RC[24]="",,"|n"&RC[24]) -> |n附加伤害:25 | D43: =VLOOKUP(RC[-3],ABIL!C1:C5,5,0) -> MAIN | P43: 25
A44: 42 | B44: =VLOOKUP(RC[-1],ABIL!C1:C2,2,0) -> 醉赤壁 | C44: =IF(RC[2]="",,"|n"&R1C5&RC[2])&IF(RC[3]="",,"|n"&R1C6&RC[3])&IF(RC[4]="",,"|n"&R1C7&RC[4])&IF(RC[5]="",,"|n"&R1C8&RC[5])&IF(RC[6]="",,"|n"&R1C9&RC[6])&IF(RC[7]="",,"|n"&R1C10&RC[7])&IF(RC[8]="",,"|n"&R1C11&RC[8])&IF(RC[9]="",,"|n"&R1C12&RC[9])&IF(RC[10]="",,"|n"&R1C13&RC[10])&IF(RC[11]="",,"|n"&R1C14&RC[11])&IF(RC[12]="",,"|n"&R1C15&RC[12])&IF(RC[13]="",,"|n"&R1C16&RC[13])&IF(RC[14]="",,"|n"&R1C17&RC[14])&IF(RC[15]="",,"|n"&R1C18&RC[15])&IF(RC[16]="",,"|n"&R1C19&RC[16])&IF(RC[17]="",,"|n"&R1C20&RC[17])&IF(RC[18]="",,"|n"&R1C21&RC[18])&IF(RC[19]="",,"|n"&R1C22&RC[19])&IF(RC[20]="",,"|n"&R1C23&RC[20])&IF(RC[21]="",,"|n"&R1C24&RC[21])&IF(RC[22]="",,"|n"&R1C25&RC[22])&IF(RC[23]="",,"|n"&R1C26&RC[23])&IF(RC[24]="",,"|n"&RC[24]) -> |n附加伤害:25 | D44: =VLOOKUP(RC[-3],ABIL!C1:C5,5,0) -> ALL | P44: 25
A45: 43 | B45: =VLOOKUP(RC[-1],ABIL!C1:C2,2,0) -> 凡世忘 | C45: =IF(RC[2]="",,"|n"&R1C5&RC[2])&IF(RC[3]="",,"|n"&R1C6&RC[3])&IF(RC[4]="",,"|n"&R1C7&RC[4])&IF(RC[5]="",,"|n"&R1C8&RC[5])&IF(RC[6]="",,"|n"&R1C9&RC[6])&IF(RC[7]="",,"|n"&R1C10&RC[7])&IF(RC[8]="",,"|n"&R1C11&RC[8])&IF(RC[9]="",,"|n"&R1C12&RC[9])&IF(RC[10]="",,"|n"&R1C13&RC[10])&IF(RC[11]="",,"|n"&R1C14&RC[11])&IF(RC[12]="",,"|n"&R1C15&RC[12])&IF(RC[13]="",,"|n"&R1C16&RC[13])&IF(RC[14]="",,"|n"&R1C17&RC[14])&IF(RC[15]="",,"|n"&R1C18&RC[15])&IF(RC[16]="",,"|n"&R1C19&RC[16])&IF(RC[17]="",,"|n"&R1C20&RC[17])&IF(RC[18]="",,"|n"&R1C21&RC[18])&IF(RC[19]="",,"|n"&R1C22&RC[19])&IF(RC[20]="",,"|n"&R1C23&RC[20])&IF(RC[21]="",,"|n"&R1C24&RC[21])&IF(RC[22]="",,"|n"&R1C25&RC[22])&IF(RC[23]="",,"|n"&R1C26&RC[23])&IF(RC[24]="",,"|n"&RC[24]) -> |n附加伤害:13|n力量增幅:10 | D45: =VLOOKUP(RC[-3],ABIL!C1:C5,5,0) -> STR | P45: 13 | U45: 10
A46: 44 | B46: =VLOOKUP(RC[-1],ABIL!C1:C2,2,0) -> 问苍天 | C46: =IF(RC[2]="",,"|n"&R1C5&RC[2])&IF(RC[3]="",,"|n"&R1C6&RC[3])&IF(RC[4]="",,"|n"&R1C7&RC[4])&IF(RC[5]="",,"|n"&R1C8&RC[5])&IF(RC[6]="",,"|n"&R1C9&RC[6])&IF(RC[7]="",,"|n"&R1C10&RC[7])&IF(RC[8]="",,"|n"&R1C11&RC[8])&IF(RC[9]="",,"|n"&R1C12&RC[9])&IF(RC[10]="",,"|n"&R1C13&RC[10])&IF(RC[11]="",,"|n"&R1C14&RC[11])&IF(RC[12]="",,"|n"&R1C15&RC[12])&IF(RC[13]="",,"|n"&R1C16&RC[13])&IF(RC[14]="",,"|n"&R1C17&RC[14])&IF(RC[15]="",,"|n"&R1C18&RC[15])&IF(RC[16]="",,"|n"&R1C19&RC[16])&IF(RC[17]="",,"|n"&R1C20&RC[17])&IF(RC[18]="",,"|n"&R1C21&RC[18])&IF(RC[19]="",,"|n"&R1C22&RC[19])&IF(RC[20]="",,"|n"&R1C23&RC[20])&IF(RC[21]="",,"|n"&R1C24&RC[21])&IF(RC[22]="",,"|n"&R1C25&RC[22])&IF(RC[23]="",,"|n"&R1C26&RC[23])&IF(RC[24]="",,"|n"&RC[24]) -> |n附加伤害:13|n敏捷增幅:10 | D46: =VLOOKUP(RC[-3],ABIL!C1:C5,5,0) -> AGI | P46: 13 | V46: 10
A47: 45 | B47: =VLOOKUP(RC[-1],ABIL!C1:C2,2,0) -> 空断肠 | C47: =IF(RC[2]="",,"|n"&R1C5&RC[2])&IF(RC[3]="",,"|n"&R1C6&RC[3])&IF(RC[4]="",,"|n"&R1C7&RC[4])&IF(RC[5]="",,"|n"&R1C8&RC[5])&IF(RC[6]="",,"|n"&R1C9&RC[6])&IF(RC[7]="",,"|n"&R1C10&RC[7])&IF(RC[8]="",,"|n"&R1C11&RC[8])&IF(RC[9]="",,"|n"&R1C12&RC[9])&IF(RC[10]="",,"|n"&R1C13&RC[10])&IF(RC[11]="",,"|n"&R1C14&RC[11])&IF(RC[12]="",,"|n"&R1C15&RC[12])&IF(RC[13]="",,"|n"&R1C16&RC[13])&IF(RC[14]="",,"|n"&R1C17&RC[14])&IF(RC[15]="",,"|n"&R1C18&RC[15])&IF(RC[16]="",,"|n"&R1C19&RC[16])&IF(RC[17]="",,"|n"&R1C20&RC[17])&IF(RC[18]="",,"|n"&R1C21&RC[18])&IF(RC[19]="",,"|n"&R1C22&RC[19])&IF(RC[20]="",,"|n"&R1C23&RC[20])&IF(RC[21]="",,"|n"&R1C24&RC[21])&IF(RC[22]="",,"|n"&R1C25&RC[22])&IF(RC[23]="",,"|n"&R1C26&RC[23])&IF(RC[24]="",,"|n"&RC[24]) -> |n附加伤害:13|n智力增幅:10 | D47: =VLOOKUP(RC[-3],ABIL!C1:C5,5,0) -> INT | P47: 13 | W47: 10
A48: 46 | B48: =VLOOKUP(RC[-1],ABIL!C1:C2,2,0) -> 明月孤 | C48: =IF(RC[2]="",,"|n"&R1C5&RC[2])&IF(RC[3]="",,"|n"&R1C6&RC[3])&IF(RC[4]="",,"|n"&R1C7&RC[4])&IF(RC[5]="",,"|n"&R1C8&RC[5])&IF(RC[6]="",,"|n"&R1C9&RC[6])&IF(RC[7]="",,"|n"&R1C10&RC[7])&IF(RC[8]="",,"|n"&R1C11&RC[8])&IF(RC[9]="",,"|n"&R1C12&RC[9])&IF(RC[10]="",,"|n"&R1C13&RC[10])&IF(RC[11]="",,"|n"&R1C14&RC[11])&IF(RC[12]="",,"|n"&R1C15&RC[12])&IF(RC[13]="",,"|n"&R1C16&RC[13])&IF(RC[14]="",,"|n"&R1C17&RC[14])&IF(RC[15]="",,"|n"&R1C18&RC[15])&IF(RC[16]="",,"|n"&R1C19&RC[16])&IF(RC[17]="",,"|n"&R1C20&RC[17])&IF(RC[18]="",,"|n"&R1C21&RC[18])&IF(RC[19]="",,"|n"&R1C22&RC[19])&IF(RC[20]="",,"|n"&R1C23&RC[20])&IF(RC[21]="",,"|n"&R1C24&RC[21])&IF(RC[22]="",,"|n"&R1C25&RC[22])&IF(RC[23]="",,"|n"&R1C26&RC[23])&IF(RC[24]="",,"|n"&RC[24]) -> |n攻速:25 | D48: =VLOOKUP(RC[-3],ABIL!C1:C5,5,0) -> ATK | K48: 25
A49: 47 | B49: =VLOOKUP(RC[-1],ABIL!C1:C2,2,0) -> 云天渺 | C49: =IF(RC[2]="",,"|n"&R1C5&RC[2])&IF(RC[3]="",,"|n"&R1C6&RC[3])&IF(RC[4]="",,"|n"&R1C7&RC[4])&IF(RC[5]="",,"|n"&R1C8&RC[5])&IF(RC[6]="",,"|n"&R1C9&RC[6])&IF(RC[7]="",,"|n"&R1C10&RC[7])&IF(RC[8]="",,"|n"&R1C11&RC[8])&IF(RC[9]="",,"|n"&R1C12&RC[9])&IF(RC[10]="",,"|n"&R1C13&RC[10])&IF(RC[11]="",,"|n"&R1C14&RC[11])&IF(RC[12]="",,"|n"&R1C15&RC[12])&IF(RC[13]="",,"|n"&R1C16&RC[13])&IF(RC[14]="",,"|n"&R1C17&RC[14])&IF(RC[15]="",,"|n"&R1C18&RC[15])&IF(RC[16]="",,"|n"&R1C19&RC[16])&IF(RC[17]="",,"|n"&R1C20&RC[17])&IF(RC[18]="",,"|n"&R1C21&RC[18])&IF(RC[19]="",,"|n"&R1C22&RC[19])&IF(RC[20]="",,"|n"&R1C23&RC[20])&IF(RC[21]="",,"|n"&R1C24&RC[21])&IF(RC[22]="",,"|n"&R1C25&RC[22])&IF(RC[23]="",,"|n"&R1C26&RC[23])&IF(RC[24]="",,"|n"&RC[24]) -> |n力量增幅:6|n敏捷增幅:6|n智力增幅:6 | D49: =VLOOKUP(RC[-3],ABIL!C1:C5,5,0) -> ALL_MAIN | U49: 6 | V49: 6 | W49: 6
A50: 48 | B50: =VLOOKUP(RC[-1],ABIL!C1:C2,2,0) -> 醉红颜 | C50: =IF(RC[2]="",,"|n"&R1C5&RC[2])&IF(RC[3]="",,"|n"&R1C6&RC[3])&IF(RC[4]="",,"|n"&R1C7&RC[4])&IF(RC[5]="",,"|n"&R1C8&RC[5])&IF(RC[6]="",,"|n"&R1C9&RC[6])&IF(RC[7]="",,"|n"&R1C10&RC[7])&IF(RC[8]="",,"|n"&R1C11&RC[8])&IF(RC[9]="",,"|n"&R1C12&RC[9])&IF(RC[10]="",,"|n"&R1C13&RC[10])&IF(RC[11]="",,"|n"&R1C14&RC[11])&IF(RC[12]="",,"|n"&R1C15&RC[12])&IF(RC[13]="",,"|n"&R1C16&RC[13])&IF(RC[14]="",,"|n"&R1C17&RC[14])&IF(RC[15]="",,"|n"&R1C18&RC[15])&IF(RC[16]="",,"|n"&R1C19&RC[16])&IF(RC[17]="",,"|n"&R1C20&RC[17])&IF(RC[18]="",,"|n"&R1C21&RC[18])&IF(RC[19]="",,"|n"&R1C22&RC[19])&IF(RC[20]="",,"|n"&R1C23&RC[20])&IF(RC[21]="",,"|n"&R1C24&RC[21])&IF(RC[22]="",,"|n"&R1C25&RC[22])&IF(RC[23]="",,"|n"&R1C26&RC[23])&IF(RC[24]="",,"|n"&RC[24]) -> |n附加伤害:25 | D50: =VLOOKUP(RC[-3],ABIL!C1:C5,5,0) -> ALL | P50: 25
A51: 49 | B51: =VLOOKUP(RC[-1],ABIL!C1:C2,2,0) -> 尘世游 | C51: =IF(RC[2]="",,"|n"&R1C5&RC[2])&IF(RC[3]="",,"|n"&R1C6&RC[3])&IF(RC[4]="",,"|n"&R1C7&RC[4])&IF(RC[5]="",,"|n"&R1C8&RC[5])&IF(RC[6]="",,"|n"&R1C9&RC[6])&IF(RC[7]="",,"|n"&R1C10&RC[7])&IF(RC[8]="",,"|n"&R1C11&RC[8])&IF(RC[9]="",,"|n"&R1C12&RC[9])&IF(RC[10]="",,"|n"&R1C13&RC[10])&IF(RC[11]="",,"|n"&R1C14&RC[11])&IF(RC[12]="",,"|n"&R1C15&RC[12])&IF(RC[13]="",,"|n"&R1C16&RC[13])&IF(RC[14]="",,"|n"&R1C17&RC[14])&IF(RC[15]="",,"|n"&R1C18&RC[15])&IF(RC[16]="",,"|n"&R1C19&RC[16])&IF(RC[17]="",,"|n"&R1C20&RC[17])&IF(RC[18]="",,"|n"&R1C21&RC[18])&IF(RC[19]="",,"|n"&R1C22&RC[19])&IF(RC[20]="",,"|n"&R1C23&RC[20])&IF(RC[21]="",,"|n"&R1C24&RC[21])&IF(RC[22]="",,"|n"&R1C25&RC[22])&IF(RC[23]="",,"|n"&R1C26&RC[23])&IF(RC[24]="",,"|n"&RC[24]) -> |n附加伤害:25 | D51: =VLOOKUP(RC[-3],ABIL!C1:C5,5,0) -> MAIN | P51: 25
A52: 50 | B52: =VLOOKUP(RC[-1],ABIL!C1:C2,2,0) -> 人生几何 | C52: =IF(RC[2]="",,"|n"&R1C5&RC[2])&IF(RC[3]="",,"|n"&R1C6&RC[3])&IF(RC[4]="",,"|n"&R1C7&RC[4])&IF(RC[5]="",,"|n"&R1C8&RC[5])&IF(RC[6]="",,"|n"&R1C9&RC[6])&IF(RC[7]="",,"|n"&R1C10&RC[7])&IF(RC[8]="",,"|n"&R1C11&RC[8])&IF(RC[9]="",,"|n"&R1C12&RC[9])&IF(RC[10]="",,"|n"&R1C13&RC[10])&IF(RC[11]="",,"|n"&R1C14&RC[11])&IF(RC[12]="",,"|n"&R1C15&RC[12])&IF(RC[13]="",,"|n"&R1C16&RC[13])&IF(RC[14]="",,"|n"&R1C17&RC[14])&IF(RC[15]="",,"|n"&R1C18&RC[15])&IF(RC[16]="",,"|n"&R1C19&RC[16])&IF(RC[17]="",,"|n"&R1C20&RC[17])&IF(RC[18]="",,"|n"&R1C21&RC[18])&IF(RC[19]="",,"|n"&R1C22&RC[19])&IF(RC[20]="",,"|n"&R1C23&RC[20])&IF(RC[21]="",,"|n"&R1C24&RC[21])&IF(RC[22]="",,"|n"&R1C25&RC[22])&IF(RC[23]="",,"|n"&R1C26&RC[23])&IF(RC[24]="",,"|n"&RC[24]) -> |n附加伤害:35 | D52: =VLOOKUP(RC[-3],ABIL!C1:C5,5,0) -> ALL | P52: 35
A53: 51 | B53: =VLOOKUP(RC[-1],ABIL!C1:C2,2,0) -> 志在千里 | C53: =IF(RC[2]="",,"|n"&R1C5&RC[2])&IF(RC[3]="",,"|n"&R1C6&RC[3])&IF(RC[4]="",,"|n"&R1C7&RC[4])&IF(RC[5]="",,"|n"&R1C8&RC[5])&IF(RC[6]="",,"|n"&R1C9&RC[6])&IF(RC[7]="",,"|n"&R1C10&RC[7])&IF(RC[8]="",,"|n"&R1C11&RC[8])&IF(RC[9]="",,"|n"&R1C12&RC[9])&IF(RC[10]="",,"|n"&R1C13&RC[10])&IF(RC[11]="",,"|n"&R1C14&RC[11])&IF(RC[12]="",,"|n"&R1C15&RC[12])&IF(RC[13]="",,"|n"&R1C16&RC[13])&IF(RC[14]="",,"|n"&R1C17&RC[14])&IF(RC[15]="",,"|n"&R1C18&RC[15])&IF(RC[16]="",,"|n"&R1C19&RC[16])&IF(RC[17]="",,"|n"&R1C20&RC[17])&IF(RC[18]="",,"|n"&R1C21&RC[18])&IF(RC[19]="",,"|n"&R1C22&RC[19])&IF(RC[20]="",,"|n"&R1C23&RC[20])&IF(RC[21]="",,"|n"&R1C24&RC[21])&IF(RC[22]="",,"|n"&R1C25&RC[22])&IF(RC[23]="",,"|n"&R1C26&RC[23])&IF(RC[24]="",,"|n"&RC[24]) -> |n附加伤害:20|n力量增幅:15 | D53: =VLOOKUP(RC[-3],ABIL!C1:C5,5,0) -> STR | P53: 20 | U53: 15
A54: 52 | B54: =VLOOKUP(RC[-1],ABIL!C1:C2,2,0) -> 云海尘清 | C54: =IF(RC[2]="",,"|n"&R1C5&RC[2])&IF(RC[3]="",,"|n"&R1C6&RC[3])&IF(RC[4]="",,"|n"&R1C7&RC[4])&IF(RC[5]="",,"|n"&R1C8&RC[5])&IF(RC[6]="",,"|n"&R1C9&RC[6])&IF(RC[7]="",,"|n"&R1C10&RC[7])&IF(RC[8]="",,"|n"&R1C11&RC[8])&IF(RC[9]="",,"|n"&R1C12&RC[9])&IF(RC[10]="",,"|n"&R1C13&RC[10])&IF(RC[11]="",,"|n"&R1C14&RC[11])&IF(RC[12]="",,"|n"&R1C15&RC[12])&IF(RC[13]="",,"|n"&R1C16&RC[13])&IF(RC[14]="",,"|n"&R1C17&RC[14])&IF(RC[15]="",,"|n"&R1C18&RC[15])&IF(RC[16]="",,"|n"&R1C19&RC[16])&IF(RC[17]="",,"|n"&R1C20&RC[17])&IF(RC[18]="",,"|n"&R1C21&RC[18])&IF(RC[19]="",,"|n"&R1C22&RC[19])&IF(RC[20]="",,"|n"&R1C23&RC[20])&IF(RC[21]="",,"|n"&R1C24&RC[21])&IF(RC[22]="",,"|n"&R1C25&RC[22])&IF(RC[23]="",,"|n"&R1C26&RC[23])&IF(RC[24]="",,"|n"&RC[24]) -> |n附加伤害:20|n敏捷增幅:15 | D54: =VLOOKUP(RC[-3],ABIL!C1:C5,5,0) -> AGI | P54: 20 | V54: 15
A55: 53 | B55: =VLOOKUP(RC[-1],ABIL!C1:C2,2,0) -> 天涯海角 | C55: =IF(RC[2]="",,"|n"&R1C5&RC[2])&IF(RC[3]="",,"|n"&R1C6&RC[3])&IF(RC[4]="",,"|n"&R1C7&RC[4])&IF(RC[5]="",,"|n"&R1C8&RC[5])&IF(RC[6]="",,"|n"&R1C9&RC[6])&IF(RC[7]="",,"|n"&R1C10&RC[7])&IF(RC[8]="",,"|n"&R1C11&RC[8])&IF(RC[9]="",,"|n"&R1C12&RC[9])&IF(RC[10]="",,"|n"&R1C13&RC[10])&IF(RC[11]="",,"|n"&R1C14&RC[11])&IF(RC[12]="",,"|n"&R1C15&RC[12])&IF(RC[13]="",,"|n"&R1C16&RC[13])&IF(RC[14]="",,"|n"&R1C17&RC[14])&IF(RC[15]="",,"|n"&R1C18&RC[15])&IF(RC[16]="",,"|n"&R1C19&RC[16])&IF(RC[17]="",,"|n"&R1C20&RC[17])&IF(RC[18]="",,"|n"&R1C21&RC[18])&IF(RC[19]="",,"|n"&R1C22&RC[19])&IF(RC[20]="",,"|n"&R1C23&RC[20])&IF(RC[21]="",,"|n"&R1C24&RC[21])&IF(RC[22]="",,"|n"&R1C25&RC[22])&IF(RC[23]="",,"|n"&R1C26&RC[23])&IF(RC[24]="",,"|n"&RC[24]) -> |n附加伤害:20|n智力增幅:15 | D55: =VLOOKUP(RC[-3],ABIL!C1:C5,5,0) -> INT | P55: 20 | W55: 15
A56: 54 | B56: =VLOOKUP(RC[-1],ABIL!C1:C2,2,0) -> 横扫千军 | C56: =IF(RC[2]="",,"|n"&R1C5&RC[2])&IF(RC[3]="",,"|n"&R1C6&RC[3])&IF(RC[4]="",,"|n"&R1C7&RC[4])&IF(RC[5]="",,"|n"&R1C8&RC[5])&IF(RC[6]="",,"|n"&R1C9&RC[6])&IF(RC[7]="",,"|n"&R1C10&RC[7])&IF(RC[8]="",,"|n"&R1C11&RC[8])&IF(RC[9]="",,"|n"&R1C12&RC[9])&IF(RC[10]="",,"|n"&R1C13&RC[10])&IF(RC[11]="",,"|n"&R1C14&RC[11])&IF(RC[12]="",,"|n"&R1C15&RC[12])&IF(RC[13]="",,"|n"&R1C16&RC[13])&IF(RC[14]="",,"|n"&R1C17&RC[14])&IF(RC[15]="",,"|n"&R1C18&RC[15])&IF(RC[16]="",,"|n"&R1C19&RC[16])&IF(RC[17]="",,"|n"&R1C20&RC[17])&IF(RC[18]="",,"|n"&R1C21&RC[18])&IF(RC[19]="",,"|n"&R1C22&RC[19])&IF(RC[20]="",,"|n"&R1C23&RC[20])&IF(RC[21]="",,"|n"&R1C24&RC[21])&IF(RC[22]="",,"|n"&R1C25&RC[22])&IF(RC[23]="",,"|n"&R1C26&RC[23])&IF(RC[24]="",,"|n"&RC[24]) -> |n攻速:35 | D56: =VLOOKUP(RC[-3],ABIL!C1:C5,5,0) -> ATK | K56: 35
A57: 55 | B57: =VLOOKUP(RC[-1],ABIL!C1:C2,2,0) -> 叶随雨落 | C57: =IF(RC[2]="",,"|n"&R1C5&RC[2])&IF(RC[3]="",,"|n"&R1C6&RC[3])&IF(RC[4]="",,"|n"&R1C7&RC[4])&IF(RC[5]="",,"|n"&R1C8&RC[5])&IF(RC[6]="",,"|n"&R1C9&RC[6])&IF(RC[7]="",,"|n"&R1C10&RC[7])&IF(RC[8]="",,"|n"&R1C11&RC[8])&IF(RC[9]="",,"|n"&R1C12&RC[9])&IF(RC[10]="",,"|n"&R1C13&RC[10])&IF(RC[11]="",,"|n"&R1C14&RC[11])&IF(RC[12]="",,"|n"&R1C15&RC[12])&IF(RC[13]="",,"|n"&R1C16&RC[13])&IF(RC[14]="",,"|n"&R1C17&RC[14])&IF(RC[15]="",,"|n"&R1C18&RC[15])&IF(RC[16]="",,"|n"&R1C19&RC[16])&IF(RC[17]="",,"|n"&R1C20&RC[17])&IF(RC[18]="",,"|n"&R1C21&RC[18])&IF(RC[19]="",,"|n"&R1C22&RC[19])&IF(RC[20]="",,"|n"&R1C23&RC[20])&IF(RC[21]="",,"|n"&R1C24&RC[21])&IF(RC[22]="",,"|n"&R1C25&RC[22])&IF(RC[23]="",,"|n"&R1C26&RC[23])&IF(RC[24]="",,"|n"&RC[24]) -> |n力量增幅:9|n敏捷增幅:9|n智力增幅:9 | D57: =VLOOKUP(RC[-3],ABIL!C1:C5,5,0) -> ALL_MAIN | U57: 9 | V57: 9 | W57: 9
A58: 56 | B58: =VLOOKUP(RC[-1],ABIL!C1:C2,2,0) -> 傲世九天 | C58: =IF(RC[2]="",,"|n"&R1C5&RC[2])&IF(RC[3]="",,"|n"&R1C6&RC[3])&IF(RC[4]="",,"|n"&R1C7&RC[4])&IF(RC[5]="",,"|n"&R1C8&RC[5])&IF(RC[6]="",,"|n"&R1C9&RC[6])&IF(RC[7]="",,"|n"&R1C10&RC[7])&IF(RC[8]="",,"|n"&R1C11&RC[8])&IF(RC[9]="",,"|n"&R1C12&RC[9])&IF(RC[10]="",,"|n"&R1C13&RC[10])&IF(RC[11]="",,"|n"&R1C14&RC[11])&IF(RC[12]="",,"|n"&R1C15&RC[12])&IF(RC[13]="",,"|n"&R1C16&RC[13])&IF(RC[14]="",,"|n"&R1C17&RC[14])&IF(RC[15]="",,"|n"&R1C18&RC[15])&IF(RC[16]="",,"|n"&R1C19&RC[16])&IF(RC[17]="",,"|n"&R1C20&RC[17])&IF(RC[18]="",,"|n"&R1C21&RC[18])&IF(RC[19]="",,"|n"&R1C22&RC[19])&IF(RC[20]="",,"|n"&R1C23&RC[20])&IF(RC[21]="",,"|n"&R1C24&RC[21])&IF(RC[22]="",,"|n"&R1C25&RC[22])&IF(RC[23]="",,"|n"&R1C26&RC[23])&IF(RC[24]="",,"|n"&RC[24]) -> |n附加伤害:35 | D58: =VLOOKUP(RC[-3],ABIL!C1:C5,5,0) -> ALL | P58: 35
A59: 57 | B59: =VLOOKUP(RC[-1],ABIL!C1:C2,2,0) -> 浮云过影 | C59: =IF(RC[2]="",,"|n"&R1C5&RC[2])&IF(RC[3]="",,"|n"&R1C6&RC[3])&IF(RC[4]="",,"|n"&R1C7&RC[4])&IF(RC[5]="",,"|n"&R1C8&RC[5])&IF(RC[6]="",,"|n"&R1C9&RC[6])&IF(RC[7]="",,"|n"&R1C10&RC[7])&IF(RC[8]="",,"|n"&R1C11&RC[8])&IF(RC[9]="",,"|n"&R1C12&RC[9])&IF(RC[10]="",,"|n"&R1C13&RC[10])&IF(RC[11]="",,"|n"&R1C14&RC[11])&IF(RC[12]="",,"|n"&R1C15&RC[12])&IF(RC[13]="",,"|n"&R1C16&RC[13])&IF(RC[14]="",,"|n"&R1C17&RC[14])&IF(RC[15]="",,"|n"&R1C18&RC[15])&IF(RC[16]="",,"|n"&R1C19&RC[16])&IF(RC[17]="",,"|n"&R1C20&RC[17])&IF(RC[18]="",,"|n"&R1C21&RC[18])&IF(RC[19]="",,"|n"&R1C22&RC[19])&IF(RC[20]="",,"|n"&R1C23&RC[20])&IF(RC[21]="",,"|n"&R1C24&RC[21])&IF(RC[22]="",,"|n"&R1C25&RC[22])&IF(RC[23]="",,"|n"&R1C26&RC[23])&IF(RC[24]="",,"|n"&RC[24]) -> |n附加伤害:35 | D59: =VLOOKUP(RC[-3],ABIL!C1:C5,5,0) -> MAIN | P59: 35
A60: 58 | B60: =VLOOKUP(RC[-1],ABIL!C1:C2,2,0) -> 断编残简 | C60: =IF(RC[2]="",,"|n"&R1C5&RC[2])&IF(RC[3]="",,"|n"&R1C6&RC[3])&IF(RC[4]="",,"|n"&R1C7&RC[4])&IF(RC[5]="",,"|n"&R1C8&RC[5])&IF(RC[6]="",,"|n"&R1C9&RC[6])&IF(RC[7]="",,"|n"&R1C10&RC[7])&IF(RC[8]="",,"|n"&R1C11&RC[8])&IF(RC[9]="",,"|n"&R1C12&RC[9])&IF(RC[10]="",,"|n"&R1C13&RC[10])&IF(RC[11]="",,"|n"&R1C14&RC[11])&IF(RC[12]="",,"|n"&R1C15&RC[12])&IF(RC[13]="",,"|n"&R1C16&RC[13])&IF(RC[14]="",,"|n"&R1C17&RC[14])&IF(RC[15]="",,"|n"&R1C18&RC[15])&IF(RC[16]="",,"|n"&R1C19&RC[16])&IF(RC[17]="",,"|n"&R1C20&RC[17])&IF(RC[18]="",,"|n"&R1C21&RC[18])&IF(RC[19]="",,"|n"&R1C22&RC[19])&IF(RC[20]="",,"|n"&R1C23&RC[20])&IF(RC[21]="",,"|n"&R1C24&RC[21])&IF(RC[22]="",,"|n"&R1C25&RC[22])&IF(RC[23]="",,"|n"&R1C26&RC[23])&IF(RC[24]="",,"|n"&RC[24]) -> |n附加伤害:35 | D60: =VLOOKUP(RC[-3],ABIL!C1:C5,5,0) -> ALL | P60: 35
A61: 59 | B61: =VLOOKUP(RC[-1],ABIL!C1:C2,2,0) -> 落花无声 | C61: =IF(RC[2]="",,"|n"&R1C5&RC[2])&IF(RC[3]="",,"|n"&R1C6&RC[3])&IF(RC[4]="",,"|n"&R1C7&RC[4])&IF(RC[5]="",,"|n"&R1C8&RC[5])&IF(RC[6]="",,"|n"&R1C9&RC[6])&IF(RC[7]="",,"|n"&R1C10&RC[7])&IF(RC[8]="",,"|n"&R1C11&RC[8])&IF(RC[9]="",,"|n"&R1C12&RC[9])&IF(RC[10]="",,"|n"&R1C13&RC[10])&IF(RC[11]="",,"|n"&R1C14&RC[11])&IF(RC[12]="",,"|n"&R1C15&RC[12])&IF(RC[13]="",,"|n"&R1C16&RC[13])&IF(RC[14]="",,"|n"&R1C17&RC[14])&IF(RC[15]="",,"|n"&R1C18&RC[15])&IF(RC[16]="",,"|n"&R1C19&RC[16])&IF(RC[17]="",,"|n"&R1C20&RC[17])&IF(RC[18]="",,"|n"&R1C21&RC[18])&IF(RC[19]="",,"|n"&R1C22&RC[19])&IF(RC[20]="",,"|n"&R1C23&RC[20])&IF(RC[21]="",,"|n"&R1C24&RC[21])&IF(RC[22]="",,"|n"&R1C25&RC[22])&IF(RC[23]="",,"|n"&R1C26&RC[23])&IF(RC[24]="",,"|n"&RC[24]) -> |n附加伤害:20|n力量增幅:15 | D61: =VLOOKUP(RC[-3],ABIL!C1:C5,5,0) -> STR | P61: 20 | U61: 15
A62: 60 | B62: =VLOOKUP(RC[-1],ABIL!C1:C2,2,0) -> 浮世繁华 | C62: =IF(RC[2]="",,"|n"&R1C5&RC[2])&IF(RC[3]="",,"|n"&R1C6&RC[3])&IF(RC[4]="",,"|n"&R1C7&RC[4])&IF(RC[5]="",,"|n"&R1C8&RC[5])&IF(RC[6]="",,"|n"&R1C9&RC[6])&IF(RC[7]="",,"|n"&R1C10&RC[7])&IF(RC[8]="",,"|n"&R1C11&RC[8])&IF(RC[9]="",,"|n"&R1C12&RC[9])&IF(RC[10]="",,"|n"&R1C13&RC[10])&IF(RC[11]="",,"|n"&R1C14&RC[11])&IF(RC[12]="",,"|n"&R1C15&RC[12])&IF(RC[13]="",,"|n"&R1C16&RC[13])&IF(RC[14]="",,"|n"&R1C17&RC[14])&IF(RC[15]="",,"|n"&R1C18&RC[15])&IF(RC[16]="",,"|n"&R1C19&RC[16])&IF(RC[17]="",,"|n"&R1C20&RC[17])&IF(RC[18]="",,"|n"&R1C21&RC[18])&IF(RC[19]="",,"|n"&R1C22&RC[19])&IF(RC[20]="",,"|n"&R1C23&RC[20])&IF(RC[21]="",,"|n"&R1C24&RC[21])&IF(RC[22]="",,"|n"&R1C25&RC[22])&IF(RC[23]="",,"|n"&R1C26&RC[23])&IF(RC[24]="",,"|n"&RC[24]) -> |n附加伤害:20|n敏捷增幅:15 | D62: =VLOOKUP(RC[-3],ABIL!C1:C5,5,0) -> AGI | P62: 20 | V62: 15
A63: 61 | B63: =VLOOKUP(RC[-1],ABIL!C1:C2,2,0) -> 执念成殇 | C63: =IF(RC[2]="",,"|n"&R1C5&RC[2])&IF(RC[3]="",,"|n"&R1C6&RC[3])&IF(RC[4]="",,"|n"&R1C7&RC[4])&IF(RC[5]="",,"|n"&R1C8&RC[5])&IF(RC[6]="",,"|n"&R1C9&RC[6])&IF(RC[7]="",,"|n"&R1C10&RC[7])&IF(RC[8]="",,"|n"&R1C11&RC[8])&IF(RC[9]="",,"|n"&R1C12&RC[9])&IF(RC[10]="",,"|n"&R1C13&RC[10])&IF(RC[11]="",,"|n"&R1C14&RC[11])&IF(RC[12]="",,"|n"&R1C15&RC[12])&IF(RC[13]="",,"|n"&R1C16&RC[13])&IF(RC[14]="",,"|n"&R1C17&RC[14])&IF(RC[15]="",,"|n"&R1C18&RC[15])&IF(RC[16]="",,"|n"&R1C19&RC[16])&IF(RC[17]="",,"|n"&R1C20&RC[17])&IF(RC[18]="",,"|n"&R1C21&RC[18])&IF(RC[19]="",,"|n"&R1C22&RC[19])&IF(RC[20]="",,"|n"&R1C23&RC[20])&IF(RC[21]="",,"|n"&R1C24&RC[21])&IF(RC[22]="",,"|n"&R1C25&RC[22])&IF(RC[23]="",,"|n"&R1C26&RC[23])&IF(RC[24]="",,"|n"&RC[24]) -> |n附加伤害:20|n智力增幅:15 | D63: =VLOOKUP(RC[-3],ABIL!C1:C5,5,0) -> INT | P63: 20 | W63: 15
A64: 62 | B64: =VLOOKUP(RC[-1],ABIL!C1:C2,2,0) -> 月下独酌 | C64: =IF(RC[2]="",,"|n"&R1C5&RC[2])&IF(RC[3]="",,"|n"&R1C6&RC[3])&IF(RC[4]="",,"|n"&R1C7&RC[4])&IF(RC[5]="",,"|n"&R1C8&RC[5])&IF(RC[6]="",,"|n"&R1C9&RC[6])&IF(RC[7]="",,"|n"&R1C10&RC[7])&IF(RC[8]="",,"|n"&R1C11&RC[8])&IF(RC[9]="",,"|n"&R1C12&RC[9])&IF(RC[10]="",,"|n"&R1C13&RC[10])&IF(RC[11]="",,"|n"&R1C14&RC[11])&IF(RC[12]="",,"|n"&R1C15&RC[12])&IF(RC[13]="",,"|n"&R1C16&RC[13])&IF(RC[14]="",,"|n"&R1C17&RC[14])&IF(RC[15]="",,"|n"&R1C18&RC[15])&IF(RC[16]="",,"|n"&R1C19&RC[16])&IF(RC[17]="",,"|n"&R1C20&RC[17])&IF(RC[18]="",,"|n"&R1C21&RC[18])&IF(RC[19]="",,"|n"&R1C22&RC[19])&IF(RC[20]="",,"|n"&R1C23&RC[20])&IF(RC[21]="",,"|n"&R1C24&RC[21])&IF(RC[22]="",,"|n"&R1C25&RC[22])&IF(RC[23]="",,"|n"&R1C26&RC[23])&IF(RC[24]="",,"|n"&RC[24]) -> |n攻速:35 | D64: =VLOOKUP(RC[-3],ABIL!C1:C5,5,0) -> ATK | K64: 35
A65: 63 | B65: =VLOOKUP(RC[-1],ABIL!C1:C2,2,0) -> 诗羽呢喃 | C65: =IF(RC[2]="",,"|n"&R1C5&RC[2])&IF(RC[3]="",,"|n"&R1C6&RC[3])&IF(RC[4]="",,"|n"&R1C7&RC[4])&IF(RC[5]="",,"|n"&R1C8&RC[5])&IF(RC[6]="",,"|n"&R1C9&RC[6])&IF(RC[7]="",,"|n"&R1C10&RC[7])&IF(RC[8]="",,"|n"&R1C11&RC[8])&IF(RC[9]="",,"|n"&R1C12&RC[9])&IF(RC[10]="",,"|n"&R1C13&RC[10])&IF(RC[11]="",,"|n"&R1C14&RC[11])&IF(RC[12]="",,"|n"&R1C15&RC[12])&IF(RC[13]="",,"|n"&R1C16&RC[13])&IF(RC[14]="",,"|n"&R1C17&RC[14])&IF(RC[15]="",,"|n"&R1C18&RC[15])&IF(RC[16]="",,"|n"&R1C19&RC[16])&IF(RC[17]="",,"|n"&R1C20&RC[17])&IF(RC[18]="",,"|n"&R1C21&RC[18])&IF(RC[19]="",,"|n"&R1C22&RC[19])&IF(RC[20]="",,"|n"&R1C23&RC[20])&IF(RC[21]="",,"|n"&R1C24&RC[21])&IF(RC[22]="",,"|n"&R1C25&RC[22])&IF(RC[23]="",,"|n"&R1C26&RC[23])&IF(RC[24]="",,"|n"&RC[24]) -> |n力量增幅:9|n敏捷增幅:9|n智力增幅:9 | D65: =VLOOKUP(RC[-3],ABIL!C1:C5,5,0) -> ALL_MAIN | U65: 9 | V65: 9 | W65: 9
A66: 64 | B66: =VLOOKUP(RC[-1],ABIL!C1:C2,2,0) -> 人生如烟 | C66: =IF(RC[2]="",,"|n"&R1C5&RC[2])&IF(RC[3]="",,"|n"&R1C6&RC[3])&IF(RC[4]="",,"|n"&R1C7&RC[4])&IF(RC[5]="",,"|n"&R1C8&RC[5])&IF(RC[6]="",,"|n"&R1C9&RC[6])&IF(RC[7]="",,"|n"&R1C10&RC[7])&IF(RC[8]="",,"|n"&R1C11&RC[8])&IF(RC[9]="",,"|n"&R1C12&RC[9])&IF(RC[10]="",,"|n"&R1C13&RC[10])&IF(RC[11]="",,"|n"&R1C14&RC[11])&IF(RC[12]="",,"|n"&R1C15&RC[12])&IF(RC[13]="",,"|n"&R1C16&RC[13])&IF(RC[14]="",,"|n"&R1C17&RC[14])&IF(RC[15]="",,"|n"&R1C18&RC[15])&IF(RC[16]="",,"|n"&R1C19&RC[16])&IF(RC[17]="",,"|n"&R1C20&RC[17])&IF(RC[18]="",,"|n"&R1C21&RC[18])&IF(RC[19]="",,"|n"&R1C22&RC[19])&IF(RC[20]="",,"|n"&R1C23&RC[20])&IF(RC[21]="",,"|n"&R1C24&RC[21])&IF(RC[22]="",,"|n"&R1C25&RC[22])&IF(RC[23]="",,"|n"&R1C26&RC[23])&IF(RC[24]="",,"|n"&RC[24]) -> |n附加伤害:35 | D66: =VLOOKUP(RC[-3],ABIL!C1:C5,5,0) -> ALL | P66: 35
A67: 65 | B67: =VLOOKUP(RC[-1],ABIL!C1:C2,2,0) -> 肆无忌惮 | C67: =IF(RC[2]="",,"|n"&R1C5&RC[2])&IF(RC[3]="",,"|n"&R1C6&RC[3])&IF(RC[4]="",,"|n"&R1C7&RC[4])&IF(RC[5]="",,"|n"&R1C8&RC[5])&IF(RC[6]="",,"|n"&R1C9&RC[6])&IF(RC[7]="",,"|n"&R1C10&RC[7])&IF(RC[8]="",,"|n"&R1C11&RC[8])&IF(RC[9]="",,"|n"&R1C12&RC[9])&IF(RC[10]="",,"|n"&R1C13&RC[10])&IF(RC[11]="",,"|n"&R1C14&RC[11])&IF(RC[12]="",,"|n"&R1C15&RC[12])&IF(RC[13]="",,"|n"&R1C16&RC[13])&IF(RC[14]="",,"|n"&R1C17&RC[14])&IF(RC[15]="",,"|n"&R1C18&RC[15])&IF(RC[16]="",,"|n"&R1C19&RC[16])&IF(RC[17]="",,"|n"&R1C20&RC[17])&IF(RC[18]="",,"|n"&R1C21&RC[18])&IF(RC[19]="",,"|n"&R1C22&RC[19])&IF(RC[20]="",,"|n"&R1C23&RC[20])&IF(RC[21]="",,"|n"&R1C24&RC[21])&IF(RC[22]="",,"|n"&R1C25&RC[22])&IF(RC[23]="",,"|n"&R1C26&RC[23])&IF(RC[24]="",,"|n"&RC[24]) -> |n附加伤害:35 | D67: =VLOOKUP(RC[-3],ABIL!C1:C5,5,0) -> MAIN | P67: 35

Sheet: 形态
A1: 序号 | B1: 名字 | C1: 主动被动 | D1: 形态 | E1: 类 | F1: CODE | G1: 数据
A2: 2 | B2: =VLOOKUP(RC[-1],ABIL!C1:C2,2,0) -> 无情 | C2: =VLOOKUP(RC[-2],ABIL!C1:C6,3,0) -> 被动 | D2: =VLOOKUP(RC[-3],ABIL!C1:C6,6,0) -> 扇形 | E2: =VLOOKUP(RC[-1]&RC[-2],CONFIG!R21C7:R28C8,2,0) -> GeneralSectorBulletPassiveRandomSpellEntity | F2: ="let _rs"&RC[-5]&" = new "&RC[-1]&"()..setMeta()..setTypeMeta()" -> let _rs2 = new GeneralSectorBulletPassiveRandomSpellEntity()..setMeta()..setTypeMeta()
A3: 3 | B3: =VLOOKUP(RC[-1],ABIL!C1:C2,2,0) -> 如意 | C3: =VLOOKUP(RC[-2],ABIL!C1:C6,3,0) -> 被动 | D3: =VLOOKUP(RC[-3],ABIL!C1:C6,6,0) -> 扇形 | E3: =VLOOKUP(RC[-1]&RC[-2],CONFIG!R21C7:R28C8,2,0) -> GeneralSectorBulletPassiveRandomSpellEntity | F3: ="let _rs"&RC[-5]&" = new "&RC[-1]&"()..setMeta()..setTypeMeta()" -> let _rs3 = new GeneralSectorBulletPassiveRandomSpellEntity()..setMeta()..setTypeMeta()
A4: 4 | B4: =VLOOKUP(RC[-1],ABIL!C1:C2,2,0) -> 无名 | C4: =VLOOKUP(RC[-2],ABIL!C1:C6,3,0) -> 被动 | D4: =VLOOKUP(RC[-3],ABIL!C1:C6,6,0) -> 扇形 | E4: =VLOOKUP(RC[-1]&RC[-2],CONFIG!R21C7:R28C8,2,0) -> GeneralSectorBulletPassiveRandomSpellEntity | F4: ="let _rs"&RC[-5]&" = new "&RC[-1]&"()..setMeta()..setTypeMeta()" -> let _rs4 = new GeneralSectorBulletPassiveRandomSpellEntity()..setMeta()..setTypeMeta()
A5: 5 | B5: =VLOOKUP(RC[-1],ABIL!C1:C2,2,0) -> 千里 | C5: =VLOOKUP(RC[-2],ABIL!C1:C6,3,0) -> 被动 | D5: =VLOOKUP(RC[-3],ABIL!C1:C6,6,0) -> 扇形 | E5: =VLOOKUP(RC[-1]&RC[-2],CONFIG!R21C7:R28C8,2,0) -> GeneralSectorBulletPassiveRandomSpellEntity | F5: ="let _rs"&RC[-5]&" = new "&RC[-1]&"()..setMeta()..setTypeMeta()" -> let _rs5 = new GeneralSectorBulletPassiveRandomSpellEntity()..setMeta()..setTypeMeta()
A6: 6 | B6: =VLOOKUP(RC[-1],ABIL!C1:C2,2,0) -> 落枫 | C6: =VLOOKUP(RC[-2],ABIL!C1:C6,3,0) -> 被动 | D6: =VLOOKUP(RC[-3],ABIL!C1:C6,6,0) -> 扇形 | E6: =VLOOKUP(RC[-1]&RC[-2],CONFIG!R21C7:R28C8,2,0) -> GeneralSectorBulletPassiveRandomSpellEntity | F6: ="let _rs"&RC[-5]&" = new "&RC[-1]&"()..setMeta()..setTypeMeta()" -> let _rs6 = new GeneralSectorBulletPassiveRandomSpellEntity()..setMeta()..setTypeMeta()
A7: 7 | B7: =VLOOKUP(RC[-1],ABIL!C1:C2,2,0) -> 枯禅 | C7: =VLOOKUP(RC[-2],ABIL!C1:C6,3,0) -> 被动 | D7: =VLOOKUP(RC[-3],ABIL!C1:C6,6,0) -> 扇形 | E7: =VLOOKUP(RC[-1]&RC[-2],CONFIG!R21C7:R28C8,2,0) -> GeneralSectorBulletPassiveRandomSpellEntity | F7: ="let _rs"&RC[-5]&" = new "&RC[-1]&"()..setMeta()..setTypeMeta()" -> let _rs7 = new GeneralSectorBulletPassiveRandomSpellEntity()..setMeta()..setTypeMeta()
A8: 8 | B8: =VLOOKUP(RC[-1],ABIL!C1:C2,2,0) -> 无念 | C8: =VLOOKUP(RC[-2],ABIL!C1:C6,3,0) -> 被动 | D8: =VLOOKUP(RC[-3],ABIL!C1:C6,6,0) -> 扇形 | E8: =VLOOKUP(RC[-1]&RC[-2],CONFIG!R21C7:R28C8,2,0) -> GeneralSectorBulletPassiveRandomSpellEntity | F8: ="let _rs"&RC[-5]&" = new "&RC[-1]&"()..setMeta()..setTypeMeta()" -> let _rs8 = new GeneralSectorBulletPassiveRandomSpellEntity()..setMeta()..setTypeMeta()
A9: 9 | B9: =VLOOKUP(RC[-1],ABIL!C1:C2,2,0) -> 无踪 | C9: =VLOOKUP(RC[-2],ABIL!C1:C6,3,0) -> 被动 | D9: =VLOOKUP(RC[-3],ABIL!C1:C6,6,0) -> 扇形 | E9: =VLOOKUP(RC[-1]&RC[-2],CONFIG!R21C7:R28C8,2,0) -> GeneralSectorBulletPassiveRandomSpellEntity | F9: ="let _rs"&RC[-5]&" = new "&RC[-1]&"()..setMeta()..setTypeMeta()" -> let _rs9 = new GeneralSectorBulletPassiveRandomSpellEntity()..setMeta()..setTypeMeta()
A10: 10 | B10: =VLOOKUP(RC[-1],ABIL!C1:C2,2,0) -> 虎霸 | C10: =VLOOKUP(RC[-2],ABIL!C1:C6,3,0) -> 被动 | D10: =VLOOKUP(RC[-3],ABIL!C1:C6,6,0) -> 圆形 | E10: =VLOOKUP(RC[-1]&RC[-2],CONFIG!R21C7:R28C8,2,0) -> GeneralRangeEffectPassiveRandomSpellEntity | F10: ="let _rs"&RC[-5]&" = new "&RC[-1]&"()..setMeta()..setTypeMeta()" -> let _rs10 = new GeneralRangeEffectPassiveRandomSpellEntity()..setMeta()..setTypeMeta()
A11: 11 | B11: =VLOOKUP(RC[-1],ABIL!C1:C2,2,0) -> 般若 | C11: =VLOOKUP(RC[-2],ABIL!C1:C6,3,0) -> 被动 | D11: =VLOOKUP(RC[-3],ABIL!C1:C6,6,0) -> 圆形 | E11: =VLOOKUP(RC[-1]&RC[-2],CONFIG!R21C7:R28C8,2,0) -> GeneralRangeEffectPassiveRandomSpellEntity | F11: ="let _rs"&RC[-5]&" = new "&RC[-1]&"()..setMeta()..setTypeMeta()" -> let _rs11 = new GeneralRangeEffectPassiveRandomSpellEntity()..setMeta()..setTypeMeta()
A12: 12 | B12: =VLOOKUP(RC[-1],ABIL!C1:C2,2,0) -> 迎风 | C12: =VLOOKUP(RC[-2],ABIL!C1:C6,3,0) -> 被动 | D12: =VLOOKUP(RC[-3],ABIL!C1:C6,6,0) -> 圆形 | E12: =VLOOKUP(RC[-1]&RC[-2],CONFIG!R21C7:R28C8,2,0) -> GeneralRangeEffectPassiveRandomSpellEntity | F12: ="let _rs"&RC[-5]&" = new "&RC[-1]&"()..setMeta()..setTypeMeta()" -> let _rs12 = new GeneralRangeEffectPassiveRandomSpellEntity()..setMeta()..setTypeMeta()
A13: 13 | B13: =VLOOKUP(RC[-1],ABIL!C1:C2,2,0) -> 迷魂 | C13: =VLOOKUP(RC[-2],ABIL!C1:C6,3,0) -> 被动 | D13: =VLOOKUP(RC[-3],ABIL!C1:C6,6,0) -> 圆形 | E13: =VLOOKUP(RC[-1]&RC[-2],CONFIG!R21C7:R28C8,2,0) -> GeneralRangeEffectPassiveRandomSpellEntity | F13: ="let _rs"&RC[-5]&" = new "&RC[-1]&"()..setMeta()..setTypeMeta()" -> let _rs13 = new GeneralRangeEffectPassiveRandomSpellEntity()..setMeta()..setTypeMeta()
A14: 14 | B14: =VLOOKUP(RC[-1],ABIL!C1:C2,2,0) -> 破山 | C14: =VLOOKUP(RC[-2],ABIL!C1:C6,3,0) -> 被动 | D14: =VLOOKUP(RC[-3],ABIL!C1:C6,6,0) -> 圆形 | E14: =VLOOKUP(RC[-1]&RC[-2],CONFIG!R21C7:R28C8,2,0) -> GeneralRangeEffectPassiveRandomSpellEntity | F14: ="let _rs"&RC[-5]&" = new "&RC[-1]&"()..setMeta()..setTypeMeta()" -> let _rs14 = new GeneralRangeEffectPassiveRandomSpellEntity()..setMeta()..setTypeMeta()
A15: 15 | B15: =VLOOKUP(RC[-1],ABIL!C1:C2,2,0) -> 四凶 | C15: =VLOOKUP(RC[-2],ABIL!C1:C6,3,0) -> 被动 | D15: =VLOOKUP(RC[-3],ABIL!C1:C6,6,0) -> 圆形 | E15: =VLOOKUP(RC[-1]&RC[-2],CONFIG!R21C7:R28C8,2,0) -> GeneralRangeEffectPassiveRandomSpellEntity | F15: ="let _rs"&RC[-5]&" = new "&RC[-1]&"()..setMeta()..setTypeMeta()" -> let _rs15 = new GeneralRangeEffectPassiveRandomSpellEntity()..setMeta()..setTypeMeta()
A16: 16 | B16: =VLOOKUP(RC[-1],ABIL!C1:C2,2,0) -> 残风 | C16: =VLOOKUP(RC[-2],ABIL!C1:C6,3,0) -> 被动 | D16: =VLOOKUP(RC[-3],ABIL!C1:C6,6,0) -> 圆形 | E16: =VLOOKUP(RC[-1]&RC[-2],CONFIG!R21C7:R28C8,2,0) -> GeneralRangeEffectPassiveRandomSpellEntity | F16: ="let _rs"&RC[-5]&" = new "&RC[-1]&"()..setMeta()..setTypeMeta()" -> let _rs16 = new GeneralRangeEffectPassiveRandomSpellEntity()..setMeta()..setTypeMeta()
A17: 17 | B17: =VLOOKUP(RC[-1],ABIL!C1:C2,2,0) -> 无常 | C17: =VLOOKUP(RC[-2],ABIL!C1:C6,3,0) -> 被动 | D17: =VLOOKUP(RC[-3],ABIL!C1:C6,6,0) -> 圆形 | E17: =VLOOKUP(RC[-1]&RC[-2],CONFIG!R21C7:R28C8,2,0) -> GeneralRangeEffectPassiveRandomSpellEntity | F17: ="let _rs"&RC[-5]&" = new "&RC[-1]&"()..setMeta()..setTypeMeta()" -> let _rs17 = new GeneralRangeEffectPassiveRandomSpellEntity()..setMeta()..setTypeMeta()
A18: 18 | B18: =VLOOKUP(RC[-1],ABIL!C1:C2,2,0) -> 问心 | C18: =VLOOKUP(RC[-2],ABIL!C1:C6,3,0) -> 被动 | D18: =VLOOKUP(RC[-3],ABIL!C1:C6,6,0) -> 线性延迟 | E18: =VLOOKUP(RC[-1]&RC[-2],CONFIG!R21C7:R28C8,2,0) -> GeneralDelayedLinearEffectPassiveRandomSpellEntity | F18: ="let _rs"&RC[-5]&" = new "&RC[-1]&"()..setMeta()..setTypeMeta()" -> let _rs18 = new GeneralDelayedLinearEffectPassiveRandomSpellEntity()..setMeta()..setTypeMeta()
A19: 19 | B19: =VLOOKUP(RC[-1],ABIL!C1:C2,2,0) -> 太虚 | C19: =VLOOKUP(RC[-2],ABIL!C1:C6,3,0) -> 被动 | D19: =VLOOKUP(RC[-3],ABIL!C1:C6,6,0) -> 线性延迟 | E19: =VLOOKUP(RC[-1]&RC[-2],CONFIG!R21C7:R28C8,2,0) -> GeneralDelayedLinearEffectPassiveRandomSpellEntity | F19: ="let _rs"&RC[-5]&" = new "&RC[-1]&"()..setMeta()..setTypeMeta()" -> let _rs19 = new GeneralDelayedLinearEffectPassiveRandomSpellEntity()..setMeta()..setTypeMeta()
A20: 20 | B20: =VLOOKUP(RC[-1],ABIL!C1:C2,2,0) -> 菩提 | C20: =VLOOKUP(RC[-2],ABIL!C1:C6,3,0) -> 被动 | D20: =VLOOKUP(RC[-3],ABIL!C1:C6,6,0) -> 线性延迟 | E20: =VLOOKUP(RC[-1]&RC[-2],CONFIG!R21C7:R28C8,2,0) -> GeneralDelayedLinearEffectPassiveRandomSpellEntity | F20: ="let _rs"&RC[-5]&" = new "&RC[-1]&"()..setMeta()..setTypeMeta()" -> let _rs20 = new GeneralDelayedLinearEffectPassiveRandomSpellEntity()..setMeta()..setTypeMeta()
A21: 21 | B21: =VLOOKUP(RC[-1],ABIL!C1:C2,2,0) -> 无音 | C21: =VLOOKUP(RC[-2],ABIL!C1:C6,3,0) -> 被动 | D21: =VLOOKUP(RC[-3],ABIL!C1:C6,6,0) -> 线性延迟 | E21: =VLOOKUP(RC[-1]&RC[-2],CONFIG!R21C7:R28C8,2,0) -> GeneralDelayedLinearEffectPassiveRandomSpellEntity | F21: ="let _rs"&RC[-5]&" = new "&RC[-1]&"()..setMeta()..setTypeMeta()" -> let _rs21 = new GeneralDelayedLinearEffectPassiveRandomSpellEntity()..setMeta()..setTypeMeta()
A22: 22 | B22: =VLOOKUP(RC[-1],ABIL!C1:C2,2,0) -> 悲问 | C22: =VLOOKUP(RC[-2],ABIL!C1:C6,3,0) -> 被动 | D22: =VLOOKUP(RC[-3],ABIL!C1:C6,6,0) -> 线性延迟 | E22: =VLOOKUP(RC[-1]&RC[-2],CONFIG!R21C7:R28C8,2,0) -> GeneralDelayedLinearEffectPassiveRandomSpellEntity | F22: ="let _rs"&RC[-5]&" = new "&RC[-1]&"()..setMeta()..setTypeMeta()" -> let _rs22 = new GeneralDelayedLinearEffectPassiveRandomSpellEntity()..setMeta()..setTypeMeta()
A23: 23 | B23: =VLOOKUP(RC[-1],ABIL!C1:C2,2,0) -> 空蝉 | C23: =VLOOKUP(RC[-2],ABIL!C1:C6,3,0) -> 被动 | D23: =VLOOKUP(RC[-3],ABIL!C1:C6,6,0) -> 线性延迟 | E23: =VLOOKUP(RC[-1]&RC[-2],CONFIG!R21C7:R28C8,2,0) -> GeneralDelayedLinearEffectPassiveRandomSpellEntity | F23: ="let _rs"&RC[-5]&" = new "&RC[-1]&"()..setMeta()..setTypeMeta()" -> let _rs23 = new GeneralDelayedLinearEffectPassiveRandomSpellEntity()..setMeta()..setTypeMeta()
A24: 24 | B24: =VLOOKUP(RC[-1],ABIL!C1:C2,2,0) -> 无涯 | C24: =VLOOKUP(RC[-2],ABIL!C1:C6,3,0) -> 被动 | D24: =VLOOKUP(RC[-3],ABIL!C1:C6,6,0) -> 线性延迟 | E24: =VLOOKUP(RC[-1]&RC[-2],CONFIG!R21C7:R28C8,2,0) -> GeneralDelayedLinearEffectPassiveRandomSpellEntity | F24: ="let _rs"&RC[-5]&" = new "&RC[-1]&"()..setMeta()..setTypeMeta()" -> let _rs24 = new GeneralDelayedLinearEffectPassiveRandomSpellEntity()..setMeta()..setTypeMeta()
A25: 25 | B25: =VLOOKUP(RC[-1],ABIL!C1:C2,2,0) -> 无极 | C25: =VLOOKUP(RC[-2],ABIL!C1:C6,3,0) -> 被动 | D25: =VLOOKUP(RC[-3],ABIL!C1:C6,6,0) -> 线性延迟 | E25: =VLOOKUP(RC[-1]&RC[-2],CONFIG!R21C7:R28C8,2,0) -> GeneralDelayedLinearEffectPassiveRandomSpellEntity | F25: ="let _rs"&RC[-5]&" = new "&RC[-1]&"()..setMeta()..setTypeMeta()" -> let _rs25 = new GeneralDelayedLinearEffectPassiveRandomSpellEntity()..setMeta()..setTypeMeta()
A26: 26 | B26: =VLOOKUP(RC[-1],ABIL!C1:C2,2,0) -> 索命 | C26: =VLOOKUP(RC[-2],ABIL!C1:C6,3,0) -> 主动 | D26: =VLOOKUP(RC[-3],ABIL!C1:C6,6,0) -> 扇形 | E26: =VLOOKUP(RC[-1]&RC[-2],CONFIG!R21C7:R28C8,2,0) -> GeneralSectorBulletActiveRandomSpellEntity | F26: ="let _rs"&RC[-5]&" = new "&RC[-1]&"()..setMeta()..setTypeMeta()" -> let _rs26 = new GeneralSectorBulletActiveRandomSpellEntity()..setMeta()..setTypeMeta()
A27: 27 | B27: =VLOOKUP(RC[-1],ABIL!C1:C2,2,0) -> 大千 | C27: =VLOOKUP(RC[-2],ABIL!C1:C6,3,0) -> 主动 | D27: =VLOOKUP(RC[-3],ABIL!C1:C6,6,0) -> 扇形 | E27: =VLOOKUP(RC[-1]&RC[-2],CONFIG!R21C7:R28C8,2,0) -> GeneralSectorBulletActiveRandomSpellEntity | F27: ="let _rs"&RC[-5]&" = new "&RC[-1]&"()..setMeta()..setTypeMeta()" -> let _rs27 = new GeneralSectorBulletActiveRandomSpellEntity()..setMeta()..setTypeMeta()
A28: 28 | B28: =VLOOKUP(RC[-1],ABIL!C1:C2,2,0) -> 灭神 | C28: =VLOOKUP(RC[-2],ABIL!C1:C6,3,0) -> 主动 | D28: =VLOOKUP(RC[-3],ABIL!C1:C6,6,0) -> 扇形 | E28: =VLOOKUP(RC[-1]&RC[-2],CONFIG!R21C7:R28C8,2,0) -> GeneralSectorBulletActiveRandomSpellEntity | F28: ="let _rs"&RC[-5]&" = new "&RC[-1]&"()..setMeta()..setTypeMeta()" -> let _rs28 = new GeneralSectorBulletActiveRandomSpellEntity()..setMeta()..setTypeMeta()
A29: 29 | B29: =VLOOKUP(RC[-1],ABIL!C1:C2,2,0) -> 夺心 | C29: =VLOOKUP(RC[-2],ABIL!C1:C6,3,0) -> 主动 | D29: =VLOOKUP(RC[-3],ABIL!C1:C6,6,0) -> 扇形 | E29: =VLOOKUP(RC[-1]&RC[-2],CONFIG!R21C7:R28C8,2,0) -> GeneralSectorBulletActiveRandomSpellEntity | F29: ="let _rs"&RC[-5]&" = new "&RC[-1]&"()..setMeta()..setTypeMeta()" -> let _rs29 = new GeneralSectorBulletActiveRandomSpellEntity()..setMeta()..setTypeMeta()
A30: 30 | B30: =VLOOKUP(RC[-1],ABIL!C1:C2,2,0) -> 震天 | C30: =VLOOKUP(RC[-2],ABIL!C1:C6,3,0) -> 主动 | D30: =VLOOKUP(RC[-3],ABIL!C1:C6,6,0) -> 扇形 | E30: =VLOOKUP(RC[-1]&RC[-2],CONFIG!R21C7:R28C8,2,0) -> GeneralSectorBulletActiveRandomSpellEntity | F30: ="let _rs"&RC[-5]&" = new "&RC[-1]&"()..setMeta()..setTypeMeta()" -> let _rs30 = new GeneralSectorBulletActiveRandomSpellEntity()..setMeta()..setTypeMeta()
A31: 31 | B31: =VLOOKUP(RC[-1],ABIL!C1:C2,2,0) -> 天问 | C31: =VLOOKUP(RC[-2],ABIL!C1:C6,3,0) -> 主动 | D31: =VLOOKUP(RC[-3],ABIL!C1:C6,6,0) -> 扇形 | E31: =VLOOKUP(RC[-1]&RC[-2],CONFIG!R21C7:R28C8,2,0) -> GeneralSectorBulletActiveRandomSpellEntity | F31: ="let _rs"&RC[-5]&" = new "&RC[-1]&"()..setMeta()..setTypeMeta()" -> let _rs31 = new GeneralSectorBulletActiveRandomSpellEntity()..setMeta()..setTypeMeta()
A32: 32 | B32: =VLOOKUP(RC[-1],ABIL!C1:C2,2,0) -> 碧空 | C32: =VLOOKUP(RC[-2],ABIL!C1:C6,3,0) -> 主动 | D32: =VLOOKUP(RC[-3],ABIL!C1:C6,6,0) -> 扇形 | E32: =VLOOKUP(RC[-1]&RC[-2],CONFIG!R21C7:R28C8,2,0) -> GeneralSectorBulletActiveRandomSpellEntity | F32: ="let _rs"&RC[-5]&" = new "&RC[-1]&"()..setMeta()..setTypeMeta()" -> let _rs32 = new GeneralSectorBulletActiveRandomSpellEntity()..setMeta()..setTypeMeta()
A33: 33 | B33: =VLOOKUP(RC[-1],ABIL!C1:C2,2,0) -> 明月 | C33: =VLOOKUP(RC[-2],ABIL!C1:C6,3,0) -> 主动 | D33: =VLOOKUP(RC[-3],ABIL!C1:C6,6,0) -> 扇形 | E33: =VLOOKUP(RC[-1]&RC[-2],CONFIG!R21C7:R28C8,2,0) -> GeneralSectorBulletActiveRandomSpellEntity | F33: ="let _rs"&RC[-5]&" = new "&RC[-1]&"()..setMeta()..setTypeMeta()" -> let _rs33 = new GeneralSectorBulletActiveRandomSpellEntity()..setMeta()..setTypeMeta()
A34: 34 | B34: =VLOOKUP(RC[-1],ABIL!C1:C2,2,0) -> 幻梦穿 | C34: =VLOOKUP(RC[-2],ABIL!C1:C6,3,0) -> 被动 | D34: =VLOOKUP(RC[-3],ABIL!C1:C6,6,0) -> 线性延迟 | E34: =VLOOKUP(RC[-1]&RC[-2],CONFIG!R21C7:R28C8,2,0) -> GeneralDelayedLinearEffectPassiveRandomSpellEntity | F34: ="let _rs"&RC[-5]&" = new "&RC[-1]&"()..setMeta()..setTypeMeta()" -> let _rs34 = new GeneralDelayedLinearEffectPassiveRandomSpellEntity()..setMeta()..setTypeMeta()
A35: 35 | B35: =VLOOKUP(RC[-1],ABIL!C1:C2,2,0) -> 绕指柔 | C35: =VLOOKUP(RC[-2],ABIL!C1:C6,3,0) -> 被动 | D35: =VLOOKUP(RC[-3],ABIL!C1:C6,6,0) -> 线性延迟 | E35: =VLOOKUP(RC[-1]&RC[-2],CONFIG!R21C7:R28C8,2,0) -> GeneralDelayedLinearEffectPassiveRandomSpellEntity | F35: ="let _rs"&RC[-5]&" = new "&RC[-1]&"()..setMeta()..setTypeMeta()" -> let _rs35 = new GeneralDelayedLinearEffectPassiveRandomSpellEntity()..setMeta()..setTypeMeta()
A36: 36 | B36: =VLOOKUP(RC[-1],ABIL!C1:C2,2,0) -> 郁浮欢 | C36: =VLOOKUP(RC[-2],ABIL!C1:C6,3,0) -> 被动 | D36: =VLOOKUP(RC[-3],ABIL!C1:C6,6,0) -> 线性延迟 | E36: =VLOOKUP(RC[-1]&RC[-2],CONFIG!R21C7:R28C8,2,0) -> GeneralDelayedLinearEffectPassiveRandomSpellEntity | F36: ="let _rs"&RC[-5]&" = new "&RC[-1]&"()..setMeta()..setTypeMeta()" -> let _rs36 = new GeneralDelayedLinearEffectPassiveRandomSpellEntity()..setMeta()..setTypeMeta()
A37: 37 | B37: =VLOOKUP(RC[-1],ABIL!C1:C2,2,0) -> 夜寒凉 | C37: =VLOOKUP(RC[-2],ABIL!C1:C6,3,0) -> 被动 | D37: =VLOOKUP(RC[-3],ABIL!C1:C6,6,0) -> 线性延迟 | E37: =VLOOKUP(RC[-1]&RC[-2],CONFIG!R21C7:R28C8,2,0) -> GeneralDelayedLinearEffectPassiveRandomSpellEntity | F37: ="let _rs"&RC[-5]&" = new "&RC[-1]&"()..setMeta()..setTypeMeta()" -> let _rs37 = new GeneralDelayedLinearEffectPassiveRandomSpellEntity()..setMeta()..setTypeMeta()
A38: 38 | B38: =VLOOKUP(RC[-1],ABIL!C1:C2,2,0) -> 醉人间 | C38: =VLOOKUP(RC[-2],ABIL!C1:C6,3,0) -> 被动 | D38: =VLOOKUP(RC[-3],ABIL!C1:C6,6,0) -> 线性延迟 | E38: =VLOOKUP(RC[-1]&RC[-2],CONFIG!R21C7:R28C8,2,0) -> GeneralDelayedLinearEffectPassiveRandomSpellEntity | F38: ="let _rs"&RC[-5]&" = new "&RC[-1]&"()..setMeta()..setTypeMeta()" -> let _rs38 = new GeneralDelayedLinearEffectPassiveRandomSpellEntity()..setMeta()..setTypeMeta()
A39: 39 | B39: =VLOOKUP(RC[-1],ABIL!C1:C2,2,0) -> 万里穹 | C39: =VLOOKUP(RC[-2],ABIL!C1:C6,3,0) -> 被动 | D39: =VLOOKUP(RC[-3],ABIL!C1:C6,6,0) -> 线性延迟 | E39: =VLOOKUP(RC[-1]&RC[-2],CONFIG!R21C7:R28C8,2,0) -> GeneralDelayedLinearEffectPassiveRandomSpellEntity | F39: ="let _rs"&RC[-5]&" = new "&RC[-1]&"()..setMeta()..setTypeMeta()" -> let _rs39 = new GeneralDelayedLinearEffectPassiveRandomSpellEntity()..setMeta()..setTypeMeta()
A40: 40 | B40: =VLOOKUP(RC[-1],ABIL!C1:C2,2,0) -> 青玉案 | C40: =VLOOKUP(RC[-2],ABIL!C1:C6,3,0) -> 被动 | D40: =VLOOKUP(RC[-3],ABIL!C1:C6,6,0) -> 圆形 | E40: =VLOOKUP(RC[-1]&RC[-2],CONFIG!R21C7:R28C8,2,0) -> GeneralRangeEffectPassiveRandomSpellEntity | F40: ="let _rs"&RC[-5]&" = new "&RC[-1]&"()..setMeta()..setTypeMeta()" -> let _rs40 = new GeneralRangeEffectPassiveRandomSpellEntity()..setMeta()..setTypeMeta()
A41: 41 | B41: =VLOOKUP(RC[-1],ABIL!C1:C2,2,0) -> 阳关调 | C41: =VLOOKUP(RC[-2],ABIL!C1:C6,3,0) -> 被动 | D41: =VLOOKUP(RC[-3],ABIL!C1:C6,6,0) -> 线性 | E41: =VLOOKUP(RC[-1]&RC[-2],CONFIG!R21C7:R28C8,2,0) -> GeneralLinearEffectPassiveRandomSpellEntity | F41: ="let _rs"&RC[-5]&" = new "&RC[-1]&"()..setMeta()..setTypeMeta()" -> let _rs41 = new GeneralLinearEffectPassiveRandomSpellEntity()..setMeta()..setTypeMeta()
A42: 42 | B42: =VLOOKUP(RC[-1],ABIL!C1:C2,2,0) -> 醉赤壁 | C42: =VLOOKUP(RC[-2],ABIL!C1:C6,3,0) -> 被动 | D42: =VLOOKUP(RC[-3],ABIL!C1:C6,6,0) -> 圆形 | E42: =VLOOKUP(RC[-1]&RC[-2],CONFIG!R21C7:R28C8,2,0) -> GeneralRangeEffectPassiveRandomSpellEntity | F42: ="let _rs"&RC[-5]&" = new "&RC[-1]&"()..setMeta()..setTypeMeta()" -> let _rs42 = new GeneralRangeEffectPassiveRandomSpellEntity()..setMeta()..setTypeMeta()
A43: 43 | B43: =VLOOKUP(RC[-1],ABIL!C1:C2,2,0) -> 凡世忘 | C43: =VLOOKUP(RC[-2],ABIL!C1:C6,3,0) -> 主动 | D43: =VLOOKUP(RC[-3],ABIL!C1:C6,6,0) -> 线性 | E43: =VLOOKUP(RC[-1]&RC[-2],CONFIG!R21C7:R28C8,2,0) -> GeneralLinearEffectActiveRandomSpellEntity | F43: ="let _rs"&RC[-5]&" = new "&RC[-1]&"()..setMeta()..setTypeMeta()" -> let _rs43 = new GeneralLinearEffectActiveRandomSpellEntity()..setMeta()..setTypeMeta()
A44: 44 | B44: =VLOOKUP(RC[-1],ABIL!C1:C2,2,0) -> 问苍天 | C44: =VLOOKUP(RC[-2],ABIL!C1:C6,3,0) -> 主动 | D44: =VLOOKUP(RC[-3],ABIL!C1:C6,6,0) -> 线性 | E44: =VLOOKUP(RC[-1]&RC[-2],CONFIG!R21C7:R28C8,2,0) -> GeneralLinearEffectActiveRandomSpellEntity | F44: ="let _rs"&RC[-5]&" = new "&RC[-1]&"()..setMeta()..setTypeMeta()" -> let _rs44 = new GeneralLinearEffectActiveRandomSpellEntity()..setMeta()..setTypeMeta()
A45: 45 | B45: =VLOOKUP(RC[-1],ABIL!C1:C2,2,0) -> 空断肠 | C45: =VLOOKUP(RC[-2],ABIL!C1:C6,3,0) -> 主动 | D45: =VLOOKUP(RC[-3],ABIL!C1:C6,6,0) -> 线性 | E45: =VLOOKUP(RC[-1]&RC[-2],CONFIG!R21C7:R28C8,2,0) -> GeneralLinearEffectActiveRandomSpellEntity | F45: ="let _rs"&RC[-5]&" = new "&RC[-1]&"()..setMeta()..setTypeMeta()" -> let _rs45 = new GeneralLinearEffectActiveRandomSpellEntity()..setMeta()..setTypeMeta()
A46: 46 | B46: =VLOOKUP(RC[-1],ABIL!C1:C2,2,0) -> 明月孤 | C46: =VLOOKUP(RC[-2],ABIL!C1:C6,3,0) -> 主动 | D46: =VLOOKUP(RC[-3],ABIL!C1:C6,6,0) -> 线性 | E46: =VLOOKUP(RC[-1]&RC[-2],CONFIG!R21C7:R28C8,2,0) -> GeneralLinearEffectActiveRandomSpellEntity | F46: ="let _rs"&RC[-5]&" = new "&RC[-1]&"()..setMeta()..setTypeMeta()" -> let _rs46 = new GeneralLinearEffectActiveRandomSpellEntity()..setMeta()..setTypeMeta()
A47: 47 | B47: =VLOOKUP(RC[-1],ABIL!C1:C2,2,0) -> 云天渺 | C47: =VLOOKUP(RC[-2],ABIL!C1:C6,3,0) -> 被动 | D47: =VLOOKUP(RC[-3],ABIL!C1:C6,6,0) -> 圆形 | E47: =VLOOKUP(RC[-1]&RC[-2],CONFIG!R21C7:R28C8,2,0) -> GeneralRangeEffectPassiveRandomSpellEntity | F47: ="let _rs"&RC[-5]&" = new "&RC[-1]&"()..setMeta()..setTypeMeta()" -> let _rs47 = new GeneralRangeEffectPassiveRandomSpellEntity()..setMeta()..setTypeMeta()
A48: 48 | B48: =VLOOKUP(RC[-1],ABIL!C1:C2,2,0) -> 醉红颜 | C48: =VLOOKUP(RC[-2],ABIL!C1:C6,3,0) -> 被动 | D48: =VLOOKUP(RC[-3],ABIL!C1:C6,6,0) -> 圆形 | E48: =VLOOKUP(RC[-1]&RC[-2],CONFIG!R21C7:R28C8,2,0) -> GeneralRangeEffectPassiveRandomSpellEntity | F48: ="let _rs"&RC[-5]&" = new "&RC[-1]&"()..setMeta()..setTypeMeta()" -> let _rs48 = new GeneralRangeEffectPassiveRandomSpellEntity()..setMeta()..setTypeMeta()
A49: 49 | B49: =VLOOKUP(RC[-1],ABIL!C1:C2,2,0) -> 尘世游 | C49: =VLOOKUP(RC[-2],ABIL!C1:C6,3,0) -> 被动 | D49: =VLOOKUP(RC[-3],ABIL!C1:C6,6,0) -> 圆形 | E49: =VLOOKUP(RC[-1]&RC[-2],CONFIG!R21C7:R28C8,2,0) -> GeneralRangeEffectPassiveRandomSpellEntity | F49: ="let _rs"&RC[-5]&" = new "&RC[-1]&"()..setMeta()..setTypeMeta()" -> let _rs49 = new GeneralRangeEffectPassiveRandomSpellEntity()..setMeta()..setTypeMeta()
A50: 50 | B50: =VLOOKUP(RC[-1],ABIL!C1:C2,2,0) -> 人生几何 | C50: =VLOOKUP(RC[-2],ABIL!C1:C6,3,0) -> 被动 | D50: =VLOOKUP(RC[-3],ABIL!C1:C6,6,0) -> 圆形 | E50: =VLOOKUP(RC[-1]&RC[-2],CONFIG!R21C7:R28C8,2,0) -> GeneralRangeEffectPassiveRandomSpellEntity | F50: ="let _rs"&RC[-5]&" = new "&RC[-1]&"()..setMeta()..setTypeMeta()" -> let _rs50 = new GeneralRangeEffectPassiveRandomSpellEntity()..setMeta()..setTypeMeta()
A51: 51 | B51: =VLOOKUP(RC[-1],ABIL!C1:C2,2,0) -> 志在千里 | C51: =VLOOKUP(RC[-2],ABIL!C1:C6,3,0) -> 被动 | D51: =VLOOKUP(RC[-3],ABIL!C1:C6,6,0) -> 圆形 | E51: =VLOOKUP(RC[-1]&RC[-2],CONFIG!R21C7:R28C8,2,0) -> GeneralRangeEffectPassiveRandomSpellEntity | F51: ="let _rs"&RC[-5]&" = new "&RC[-1]&"()..setMeta()..setTypeMeta()" -> let _rs51 = new GeneralRangeEffectPassiveRandomSpellEntity()..setMeta()..setTypeMeta()
A52: 52 | B52: =VLOOKUP(RC[-1],ABIL!C1:C2,2,0) -> 云海尘清 | C52: =VLOOKUP(RC[-2],ABIL!C1:C6,3,0) -> 被动 | D52: =VLOOKUP(RC[-3],ABIL!C1:C6,6,0) -> 圆形 | E52: =VLOOKUP(RC[-1]&RC[-2],CONFIG!R21C7:R28C8,2,0) -> GeneralRangeEffectPassiveRandomSpellEntity | F52: ="let _rs"&RC[-5]&" = new "&RC[-1]&"()..setMeta()..setTypeMeta()" -> let _rs52 = new GeneralRangeEffectPassiveRandomSpellEntity()..setMeta()..setTypeMeta()
A53: 53 | B53: =VLOOKUP(RC[-1],ABIL!C1:C2,2,0) -> 天涯海角 | C53: =VLOOKUP(RC[-2],ABIL!C1:C6,3,0) -> 被动 | D53: =VLOOKUP(RC[-3],ABIL!C1:C6,6,0) -> 圆形 | E53: =VLOOKUP(RC[-1]&RC[-2],CONFIG!R21C7:R28C8,2,0) -> GeneralRangeEffectPassiveRandomSpellEntity | F53: ="let _rs"&RC[-5]&" = new "&RC[-1]&"()..setMeta()..setTypeMeta()" -> let _rs53 = new GeneralRangeEffectPassiveRandomSpellEntity()..setMeta()..setTypeMeta()
A54: 54 | B54: =VLOOKUP(RC[-1],ABIL!C1:C2,2,0) -> 横扫千军 | C54: =VLOOKUP(RC[-2],ABIL!C1:C6,3,0) -> 被动 | D54: =VLOOKUP(RC[-3],ABIL!C1:C6,6,0) -> 圆形 | E54: =VLOOKUP(RC[-1]&RC[-2],CONFIG!R21C7:R28C8,2,0) -> GeneralRangeEffectPassiveRandomSpellEntity | F54: ="let _rs"&RC[-5]&" = new "&RC[-1]&"()..setMeta()..setTypeMeta()" -> let _rs54 = new GeneralRangeEffectPassiveRandomSpellEntity()..setMeta()..setTypeMeta()
A55: 55 | B55: =VLOOKUP(RC[-1],ABIL!C1:C2,2,0) -> 叶随雨落 | C55: =VLOOKUP(RC[-2],ABIL!C1:C6,3,0) -> 被动 | D55: =VLOOKUP(RC[-3],ABIL!C1:C6,6,0) -> 圆形 | E55: =VLOOKUP(RC[-1]&RC[-2],CONFIG!R21C7:R28C8,2,0) -> GeneralRangeEffectPassiveRandomSpellEntity | F55: ="let _rs"&RC[-5]&" = new "&RC[-1]&"()..setMeta()..setTypeMeta()" -> let _rs55 = new GeneralRangeEffectPassiveRandomSpellEntity()..setMeta()..setTypeMeta()
A56: 56 | B56: =VLOOKUP(RC[-1],ABIL!C1:C2,2,0) -> 傲世九天 | C56: =VLOOKUP(RC[-2],ABIL!C1:C6,3,0) -> 被动 | D56: =VLOOKUP(RC[-3],ABIL!C1:C6,6,0) -> 圆形 | E56: =VLOOKUP(RC[-1]&RC[-2],CONFIG!R21C7:R28C8,2,0) -> GeneralRangeEffectPassiveRandomSpellEntity | F56: ="let _rs"&RC[-5]&" = new "&RC[-1]&"()..setMeta()..setTypeMeta()" -> let _rs56 = new GeneralRangeEffectPassiveRandomSpellEntity()..setMeta()..setTypeMeta()
A57: 57 | B57: =VLOOKUP(RC[-1],ABIL!C1:C2,2,0) -> 浮云过影 | C57: =VLOOKUP(RC[-2],ABIL!C1:C6,3,0) -> 被动 | D57: =VLOOKUP(RC[-3],ABIL!C1:C6,6,0) -> 线性 | E57: =VLOOKUP(RC[-1]&RC[-2],CONFIG!R21C7:R28C8,2,0) -> GeneralLinearEffectPassiveRandomSpellEntity | F57: ="let _rs"&RC[-5]&" = new "&RC[-1]&"()..setMeta()..setTypeMeta()" -> let _rs57 = new GeneralLinearEffectPassiveRandomSpellEntity()..setMeta()..setTypeMeta()
A58: 58 | B58: =VLOOKUP(RC[-1],ABIL!C1:C2,2,0) -> 断编残简 | C58: =VLOOKUP(RC[-2],ABIL!C1:C6,3,0) -> 主动 | D58: =VLOOKUP(RC[-3],ABIL!C1:C6,6,0) -> 圆形 | E58: =VLOOKUP(RC[-1]&RC[-2],CONFIG!R21C7:R28C8,2,0) -> GeneralRangeEffectActiveRandomSpellEntity | F58: ="let _rs"&RC[-5]&" = new "&RC[-1]&"()..setMeta()..setTypeMeta()" -> let _rs58 = new GeneralRangeEffectActiveRandomSpellEntity()..setMeta()..setTypeMeta()
A59: 59 | B59: =VLOOKUP(RC[-1],ABIL!C1:C2,2,0) -> 落花无声 | C59: =VLOOKUP(RC[-2],ABIL!C1:C6,3,0) -> 主动 | D59: =VLOOKUP(RC[-3],ABIL!C1:C6,6,0) -> 圆形 | E59: =VLOOKUP(RC[-1]&RC[-2],CONFIG!R21C7:R28C8,2,0) -> GeneralRangeEffectActiveRandomSpellEntity | F59: ="let _rs"&RC[-5]&" = new "&RC[-1]&"()..setMeta()..setTypeMeta()" -> let _rs59 = new GeneralRangeEffectActiveRandomSpellEntity()..setMeta()..setTypeMeta()
A60: 60 | B60: =VLOOKUP(RC[-1],ABIL!C1:C2,2,0) -> 浮世繁华 | C60: =VLOOKUP(RC[-2],ABIL!C1:C6,3,0) -> 主动 | D60: =VLOOKUP(RC[-3],ABIL!C1:C6,6,0) -> 圆形 | E60: =VLOOKUP(RC[-1]&RC[-2],CONFIG!R21C7:R28C8,2,0) -> GeneralRangeEffectActiveRandomSpellEntity | F60: ="let _rs"&RC[-5]&" = new "&RC[-1]&"()..setMeta()..setTypeMeta()" -> let _rs60 = new GeneralRangeEffectActiveRandomSpellEntity()..setMeta()..setTypeMeta()
A61: 61 | B61: =VLOOKUP(RC[-1],ABIL!C1:C2,2,0) -> 执念成殇 | C61: =VLOOKUP(RC[-2],ABIL!C1:C6,3,0) -> 主动 | D61: =VLOOKUP(RC[-3],ABIL!C1:C6,6,0) -> 圆形 | E61: =VLOOKUP(RC[-1]&RC[-2],CONFIG!R21C7:R28C8,2,0) -> GeneralRangeEffectActiveRandomSpellEntity | F61: ="let _rs"&RC[-5]&" = new "&RC[-1]&"()..setMeta()..setTypeMeta()" -> let _rs61 = new GeneralRangeEffectActiveRandomSpellEntity()..setMeta()..setTypeMeta()
A62: 62 | B62: =VLOOKUP(RC[-1],ABIL!C1:C2,2,0) -> 月下独酌 | C62: =VLOOKUP(RC[-2],ABIL!C1:C6,3,0) -> 主动 | D62: =VLOOKUP(RC[-3],ABIL!C1:C6,6,0) -> 圆形 | E62: =VLOOKUP(RC[-1]&RC[-2],CONFIG!R21C7:R28C8,2,0) -> GeneralRangeEffectActiveRandomSpellEntity | F62: ="let _rs"&RC[-5]&" = new "&RC[-1]&"()..setMeta()..setTypeMeta()" -> let _rs62 = new GeneralRangeEffectActiveRandomSpellEntity()..setMeta()..setTypeMeta()
A63: 63 | B63: =VLOOKUP(RC[-1],ABIL!C1:C2,2,0) -> 诗羽呢喃 | C63: =VLOOKUP(RC[-2],ABIL!C1:C6,3,0) -> 主动 | D63: =VLOOKUP(RC[-3],ABIL!C1:C6,6,0) -> 圆形 | E63: =VLOOKUP(RC[-1]&RC[-2],CONFIG!R21C7:R28C8,2,0) -> GeneralRangeEffectActiveRandomSpellEntity | F63: ="let _rs"&RC[-5]&" = new "&RC[-1]&"()..setMeta()..setTypeMeta()" -> let _rs63 = new GeneralRangeEffectActiveRandomSpellEntity()..setMeta()..setTypeMeta()
A64: 64 | B64: =VLOOKUP(RC[-1],ABIL!C1:C2,2,0) -> 人生如烟 | C64: =VLOOKUP(RC[-2],ABIL!C1:C6,3,0) -> 被动 | D64: =VLOOKUP(RC[-3],ABIL!C1:C6,6,0) -> 扇形 | E64: =VLOOKUP(RC[-1]&RC[-2],CONFIG!R21C7:R28C8,2,0) -> GeneralSectorBulletPassiveRandomSpellEntity | F64: ="let _rs"&RC[-5]&" = new "&RC[-1]&"()..setMeta()..setTypeMeta()" -> let _rs64 = new GeneralSectorBulletPassiveRandomSpellEntity()..setMeta()..setTypeMeta()
A65: 65 | B65: =VLOOKUP(RC[-1],ABIL!C1:C2,2,0) -> 肆无忌惮 | C65: =VLOOKUP(RC[-2],ABIL!C1:C6,3,0) -> 被动 | D65: =VLOOKUP(RC[-3],ABIL!C1:C6,6,0) -> 线性延迟 | E65: =VLOOKUP(RC[-1]&RC[-2],CONFIG!R21C7:R28C8,2,0) -> GeneralDelayedLinearEffectPassiveRandomSpellEntity | F65: ="let _rs"&RC[-5]&" = new "&RC[-1]&"()..setMeta()..setTypeMeta()" -> let _rs65 = new GeneralDelayedLinearEffectPassiveRandomSpellEntity()..setMeta()..setTypeMeta()

Sheet: MIX
A1: INDEX | B1: ID1 | C1: NAME1 | D1: ID2 | E1: NAME2 | F1: ID3 | G1: NAME3 | H1: MIX | I1: CODE
A2: 1 | B2: 2 | C2: =VLOOKUP(RC[-1],ABIL!C1:C2,2,0) -> 无情 | D2: 10 | E2: =VLOOKUP(RC[-1],ABIL!C1:C2,2,0) -> 虎霸 | F2: 34 | G2: =VLOOKUP(RC[-1],ABIL!C1:C2,2,0) -> 幻梦穿 | H2: =IF(AND(RC[-5]<>"未解锁",RC[-3]<>"未解锁",RC[-1]<>"未解锁"),RC[-5]&" + "&RC[-3]&" = "&RC[-1],"") -> 无情 + 虎霸 = 幻梦穿 | I2: = "IdManager.setMixture("&RC[-7]&","&RC[-5]&","&RC[-3]&")" -> IdManager.setMixture(2,10,34)
A3: 2 | B3: 18 | C3: =VLOOKUP(RC[-1],ABIL!C1:C2,2,0) -> 问心 | D3: 26 | E3: =VLOOKUP(RC[-1],ABIL!C1:C2,2,0) -> 索命 | F3: 42 | G3: =VLOOKUP(RC[-1],ABIL!C1:C2,2,0) -> 醉赤壁 | H3: =IF(AND(RC[-5]<>"未解锁",RC[-3]<>"未解锁",RC[-1]<>"未解锁"),RC[-5]&" + "&RC[-3]&" = "&RC[-1],"") -> 问心 + 索命 = 醉赤壁 | I3: = "IdManager.setMixture("&RC[-7]&","&RC[-5]&","&RC[-3]&")" -> IdManager.setMixture(18,26,42)
A4: 3 | B4: 3 | C4: =VLOOKUP(RC[-1],ABIL!C1:C2,2,0) -> 如意 | D4: 11 | E4: =VLOOKUP(RC[-1],ABIL!C1:C2,2,0) -> 般若 | F4: 35 | G4: =VLOOKUP(RC[-1],ABIL!C1:C2,2,0) -> 绕指柔 | H4: =IF(AND(RC[-5]<>"未解锁",RC[-3]<>"未解锁",RC[-1]<>"未解锁"),RC[-5]&" + "&RC[-3]&" = "&RC[-1],"") -> 如意 + 般若 = 绕指柔 | I4: = "IdManager.setMixture("&RC[-7]&","&RC[-5]&","&RC[-3]&")" -> IdManager.setMixture(3,11,35)
A5: 4 | B5: 19 | C5: =VLOOKUP(RC[-1],ABIL!C1:C2,2,0) -> 太虚 | D5: 27 | E5: =VLOOKUP(RC[-1],ABIL!C1:C2,2,0) -> 大千 | F5: 43 | G5: =VLOOKUP(RC[-1],ABIL!C1:C2,2,0) -> 凡世忘 | H5: =IF(AND(RC[-5]<>"未解锁",RC[-3]<>"未解锁",RC[-1]<>"未解锁"),RC[-5]&" + "&RC[-3]&" = "&RC[-1],"") -> 太虚 + 大千 = 凡世忘 | I5: = "IdManager.setMixture("&RC[-7]&","&RC[-5]&","&RC[-3]&")" -> IdManager.setMixture(19,27,43)
A6: 5 | B6: 4 | C6: =VLOOKUP(RC[-1],ABIL!C1:C2,2,0) -> 无名 | D6: 12 | E6: =VLOOKUP(RC[-1],ABIL!C1:C2,2,0) -> 迎风 | F6: 36 | G6: =VLOOKUP(RC[-1],ABIL!C1:C2,2,0) -> 郁浮欢 | H6: =IF(AND(RC[-5]<>"未解锁",RC[-3]<>"未解锁",RC[-1]<>"未解锁"),RC[-5]&" + "&RC[-3]&" = "&RC[-1],"") -> 无名 + 迎风 = 郁浮欢 | I6: = "IdManager.setMixture("&RC[-7]&","&RC[-5]&","&RC[-3]&")" -> IdManager.setMixture(4,12,36)
A7: 6 | B7: 20 | C7: =VLOOKUP(RC[-1],ABIL!C1:C2,2,0) -> 菩提 | D7: 28 | E7: =VLOOKUP(RC[-1],ABIL!C1:C2,2,0) -> 灭神 | F7: 44 | G7: =VLOOKUP(RC[-1],ABIL!C1:C2,2,0) -> 问苍天 | H7: =IF(AND(RC[-5]<>"未解锁",RC[-3]<>"未解锁",RC[-1]<>"未解锁"),RC[-5]&" + "&RC[-3]&" = "&RC[-1],"") -> 菩提 + 灭神 = 问苍天 | I7: = "IdManager.setMixture("&RC[-7]&","&RC[-5]&","&RC[-3]&")" -> IdManager.setMixture(20,28,44)
A8: 7 | B8: 5 | C8: =VLOOKUP(RC[-1],ABIL!C1:C2,2,0) -> 千里 | D8: 13 | E8: =VLOOKUP(RC[-1],ABIL!C1:C2,2,0) -> 迷魂 | F8: 37 | G8: =VLOOKUP(RC[-1],ABIL!C1:C2,2,0) -> 夜寒凉 | H8: =IF(AND(RC[-5]<>"未解锁",RC[-3]<>"未解锁",RC[-1]<>"未解锁"),RC[-5]&" + "&RC[-3]&" = "&RC[-1],"") -> 千里 + 迷魂 = 夜寒凉 | I8: = "IdManager.setMixture("&RC[-7]&","&RC[-5]&","&RC[-3]&")" -> IdManager.setMixture(5,13,37)
A9: 8 | B9: 21 | C9: =VLOOKUP(RC[-1],ABIL!C1:C2,2,0) -> 无音 | D9: 29 | E9: =VLOOKUP(RC[-1],ABIL!C1:C2,2,0) -> 夺心 | F9: 45 | G9: =VLOOKUP(RC[-1],ABIL!C1:C2,2,0) -> 空断肠 | H9: =IF(AND(RC[-5]<>"未解锁",RC[-3]<>"未解锁",RC[-1]<>"未解锁"),RC[-5]&" + "&RC[-3]&" = "&RC[-1],"") -> 无音 + 夺心 = 空断肠 | I9: = "IdManager.setMixture("&RC[-7]&","&RC[-5]&","&RC[-3]&")" -> IdManager.setMixture(21,29,45)
A10: 9 | B10: 6 | C10: =VLOOKUP(RC[-1],ABIL!C1:C2,2,0) -> 落枫 | D10: 14 | E10: =VLOOKUP(RC[-1],ABIL!C1:C2,2,0) -> 破山 | F10: 38 | G10: =VLOOKUP(RC[-1],ABIL!C1:C2,2,0) -> 醉人间 | H10: =IF(AND(RC[-5]<>"未解锁",RC[-3]<>"未解锁",RC[-1]<>"未解锁"),RC[-5]&" + "&RC[-3]&" = "&RC[-1],"") -> 落枫 + 破山 = 醉人间 | I10: = "IdManager.setMixture("&RC[-7]&","&RC[-5]&","&RC[-3]&")" -> IdManager.setMixture(6,14,38)
A11: 10 | B11: 22 | C11: =VLOOKUP(RC[-1],ABIL!C1:C2,2,0) -> 悲问 | D11: 30 | E11: =VLOOKUP(RC[-1],ABIL!C1:C2,2,0) -> 震天 | F11: 46 | G11: =VLOOKUP(RC[-1],ABIL!C1:C2,2,0) -> 明月孤 | H11: =IF(AND(RC[-5]<>"未解锁",RC[-3]<>"未解锁",RC[-1]<>"未解锁"),RC[-5]&" + "&RC[-3]&" = "&RC[-1],"") -> 悲问 + 震天 = 明月孤 | I11: = "IdManager.setMixture("&RC[-7]&","&RC[-5]&","&RC[-3]&")" -> IdManager.setMixture(22,30,46)
A12: 11 | B12: 7 | C12: =VLOOKUP(RC[-1],ABIL!C1:C2,2,0) -> 枯禅 | D12: 15 | E12: =VLOOKUP(RC[-1],ABIL!C1:C2,2,0) -> 四凶 | F12: 39 | G12: =VLOOKUP(RC[-1],ABIL!C1:C2,2,0) -> 万里穹 | H12: =IF(AND(RC[-5]<>"未解锁",RC[-3]<>"未解锁",RC[-1]<>"未解锁"),RC[-5]&" + "&RC[-3]&" = "&RC[-1],"") -> 枯禅 + 四凶 = 万里穹 | I12: = "IdManager.setMixture("&RC[-7]&","&RC[-5]&","&RC[-3]&")" -> IdManager.setMixture(7,15,39)
A13: 12 | B13: 23 | C13: =VLOOKUP(RC[-1],ABIL!C1:C2,2,0) -> 空蝉 | D13: 31 | E13: =VLOOKUP(RC[-1],ABIL!C1:C2,2,0) -> 天问 | F13: 47 | G13: =VLOOKUP(RC[-1],ABIL!C1:C2,2,0) -> 云天渺 | H13: =IF(AND(RC[-5]<>"未解锁",RC[-3]<>"未解锁",RC[-1]<>"未解锁"),RC[-5]&" + "&RC[-3]&" = "&RC[-1],"") -> 空蝉 + 天问 = 云天渺 | I13: = "IdManager.setMixture("&RC[-7]&","&RC[-5]&","&RC[-3]&")" -> IdManager.setMixture(23,31,47)
A14: 13 | B14: 8 | C14: =VLOOKUP(RC[-1],ABIL!C1:C2,2,0) -> 无念 | D14: 16 | E14: =VLOOKUP(RC[-1],ABIL!C1:C2,2,0) -> 残风 | F14: 40 | G14: =VLOOKUP(RC[-1],ABIL!C1:C2,2,0) -> 青玉案 | H14: =IF(AND(RC[-5]<>"未解锁",RC[-3]<>"未解锁",RC[-1]<>"未解锁"),RC[-5]&" + "&RC[-3]&" = "&RC[-1],"") -> 无念 + 残风 = 青玉案 | I14: = "IdManager.setMixture("&RC[-7]&","&RC[-5]&","&RC[-3]&")" -> IdManager.setMixture(8,16,40)
A15: 14 | B15: 24 | C15: =VLOOKUP(RC[-1],ABIL!C1:C2,2,0) -> 无涯 | D15: 32 | E15: =VLOOKUP(RC[-1],ABIL!C1:C2,2,0) -> 碧空 | F15: 48 | G15: =VLOOKUP(RC[-1],ABIL!C1:C2,2,0) -> 醉红颜 | H15: =IF(AND(RC[-5]<>"未解锁",RC[-3]<>"未解锁",RC[-1]<>"未解锁"),RC[-5]&" + "&RC[-3]&" = "&RC[-1],"") -> 无涯 + 碧空 = 醉红颜 | I15: = "IdManager.setMixture("&RC[-7]&","&RC[-5]&","&RC[-3]&")" -> IdManager.setMixture(24,32,48)
A16: 15 | B16: 9 | C16: =VLOOKUP(RC[-1],ABIL!C1:C2,2,0) -> 无踪 | D16: 17 | E16: =VLOOKUP(RC[-1],ABIL!C1:C2,2,0) -> 无常 | F16: 41 | G16: =VLOOKUP(RC[-1],ABIL!C1:C2,2,0) -> 阳关调 | H16: =IF(AND(RC[-5]<>"未解锁",RC[-3]<>"未解锁",RC[-1]<>"未解锁"),RC[-5]&" + "&RC[-3]&" = "&RC[-1],"") -> 无踪 + 无常 = 阳关调 | I16: = "IdManager.setMixture("&RC[-7]&","&RC[-5]&","&RC[-3]&")" -> IdManager.setMixture(9,17,41)
A17: 16 | B17: 25 | C17: =VLOOKUP(RC[-1],ABIL!C1:C2,2,0) -> 无极 | D17: 33 | E17: =VLOOKUP(RC[-1],ABIL!C1:C2,2,0) -> 明月 | F17: 49 | G17: =VLOOKUP(RC[-1],ABIL!C1:C2,2,0) -> 尘世游 | H17: =IF(AND(RC[-5]<>"未解锁",RC[-3]<>"未解锁",RC[-1]<>"未解锁"),RC[-5]&" + "&RC[-3]&" = "&RC[-1],"") -> 无极 + 明月 = 尘世游 | I17: = "IdManager.setMixture("&RC[-7]&","&RC[-5]&","&RC[-3]&")" -> IdManager.setMixture(25,33,49)
A18: 17 | B18: 2 | C18: =VLOOKUP(RC[-1],ABIL!C1:C2,2,0) -> 无情 | D18: 18 | E18: =VLOOKUP(RC[-1],ABIL!C1:C2,2,0) -> 问心 | F18: 34 | G18: =VLOOKUP(RC[-1],ABIL!C1:C2,2,0) -> 幻梦穿 | H18: =IF(AND(RC[-5]<>"未解锁",RC[-3]<>"未解锁",RC[-1]<>"未解锁"),RC[-5]&" + "&RC[-3]&" = "&RC[-1],"") -> 无情 + 问心 = 幻梦穿 | I18: = "IdManager.setMixture("&RC[-7]&","&RC[-5]&","&RC[-3]&")" -> IdManager.setMixture(2,18,34)
A19: 18 | B19: 10 | C19: =VLOOKUP(RC[-1],ABIL!C1:C2,2,0) -> 虎霸 | D19: 26 | E19: =VLOOKUP(RC[-1],ABIL!C1:C2,2,0) -> 索命 | F19: 42 | G19: =VLOOKUP(RC[-1],ABIL!C1:C2,2,0) -> 醉赤壁 | H19: =IF(AND(RC[-5]<>"未解锁",RC[-3]<>"未解锁",RC[-1]<>"未解锁"),RC[-5]&" + "&RC[-3]&" = "&RC[-1],"") -> 虎霸 + 索命 = 醉赤壁 | I19: = "IdManager.setMixture("&RC[-7]&","&RC[-5]&","&RC[-3]&")" -> IdManager.setMixture(10,26,42)
A20: 19 | B20: 3 | C20: =VLOOKUP(RC[-1],ABIL!C1:C2,2,0) -> 如意 | D20: 19 | E20: =VLOOKUP(RC[-1],ABIL!C1:C2,2,0) -> 太虚 | F20: 35 | G20: =VLOOKUP(RC[-1],ABIL!C1:C2,2,0) -> 绕指柔 | H20: =IF(AND(RC[-5]<>"未解锁",RC[-3]<>"未解锁",RC[-1]<>"未解锁"),RC[-5]&" + "&RC[-3]&" = "&RC[-1],"") -> 如意 + 太虚 = 绕指柔 | I20: = "IdManager.setMixture("&RC[-7]&","&RC[-5]&","&RC[-3]&")" -> IdManager.setMixture(3,19,35)
A21: 20 | B21: 11 | C21: =VLOOKUP(RC[-1],ABIL!C1:C2,2,0) -> 般若 | D21: 27 | E21: =VLOOKUP(RC[-1],ABIL!C1:C2,2,0) -> 大千 | F21: 43 | G21: =VLOOKUP(RC[-1],ABIL!C1:C2,2,0) -> 凡世忘 | H21: =IF(AND(RC[-5]<>"未解锁",RC[-3]<>"未解锁",RC[-1]<>"未解锁"),RC[-5]&" + "&RC[-3]&" = "&RC[-1],"") -> 般若 + 大千 = 凡世忘 | I21: = "IdManager.setMixture("&RC[-7]&","&RC[-5]&","&RC[-3]&")" -> IdManager.setMixture(11,27,43)
A22: 21 | B22: 4 | C22: =VLOOKUP(RC[-1],ABIL!C1:C2,2,0) -> 无名 | D22: 20 | E22: =VLOOKUP(RC[-1],ABIL!C1:C2,2,0) -> 菩提 | F22: 36 | G22: =VLOOKUP(RC[-1],ABIL!C1:C2,2,0) -> 郁浮欢 | H22: =IF(AND(RC[-5]<>"未解锁",RC[-3]<>"未解锁",RC[-1]<>"未解锁"),RC[-5]&" + "&RC[-3]&" = "&RC[-1],"") -> 无名 + 菩提 = 郁浮欢 | I22: = "IdManager.setMixture("&RC[-7]&","&RC[-5]&","&RC[-3]&")" -> IdManager.setMixture(4,20,36)
A23: 22 | B23: 12 | C23: =VLOOKUP(RC[-1],ABIL!C1:C2,2,0) -> 迎风 | D23: 28 | E23: =VLOOKUP(RC[-1],ABIL!C1:C2,2,0) -> 灭神 | F23: 44 | G23: =VLOOKUP(RC[-1],ABIL!C1:C2,2,0) -> 问苍天 | H23: =IF(AND(RC[-5]<>"未解锁",RC[-3]<>"未解锁",RC[-1]<>"未解锁"),RC[-5]&" + "&RC[-3]&" = "&RC[-1],"") -> 迎风 + 灭神 = 问苍天 | I23: = "IdManager.setMixture("&RC[-7]&","&RC[-5]&","&RC[-3]&")" -> IdManager.setMixture(12,28,44)
A24: 23 | B24: 5 | C24: =VLOOKUP(RC[-1],ABIL!C1:C2,2,0) -> 千里 | D24: 21 | E24: =VLOOKUP(RC[-1],ABIL!C1:C2,2,0) -> 无音 | F24: 37 | G24: =VLOOKUP(RC[-1],ABIL!C1:C2,2,0) -> 夜寒凉 | H24: =IF(AND(RC[-5]<>"未解锁",RC[-3]<>"未解锁",RC[-1]<>"未解锁"),RC[-5]&" + "&RC[-3]&" = "&RC[-1],"") -> 千里 + 无音 = 夜寒凉 | I24: = "IdManager.setMixture("&RC[-7]&","&RC[-5]&","&RC[-3]&")" -> IdManager.setMixture(5,21,37)
A25: 24 | B25: 13 | C25: =VLOOKUP(RC[-1],ABIL!C1:C2,2,0) -> 迷魂 | D25: 29 | E25: =VLOOKUP(RC[-1],ABIL!C1:C2,2,0) -> 夺心 | F25: 45 | G25: =VLOOKUP(RC[-1],ABIL!C1:C2,2,0) -> 空断肠 | H25: =IF(AND(RC[-5]<>"未解锁",RC[-3]<>"未解锁",RC[-1]<>"未解锁"),RC[-5]&" + "&RC[-3]&" = "&RC[-1],"") -> 迷魂 + 夺心 = 空断肠 | I25: = "IdManager.setMixture("&RC[-7]&","&RC[-5]&","&RC[-3]&")" -> IdManager.setMixture(13,29,45)
A26: 25 | B26: 6 | C26: =VLOOKUP(RC[-1],ABIL!C1:C2,2,0) -> 落枫 | D26: 22 | E26: =VLOOKUP(RC[-1],ABIL!C1:C2,2,0) -> 悲问 | F26: 38 | G26: =VLOOKUP(RC[-1],ABIL!C1:C2,2,0) -> 醉人间 | H26: =IF(AND(RC[-5]<>"未解锁",RC[-3]<>"未解锁",RC[-1]<>"未解锁"),RC[-5]&" + "&RC[-3]&" = "&RC[-1],"") -> 落枫 + 悲问 = 醉人间 | I26: = "IdManager.setMixture("&RC[-7]&","&RC[-5]&","&RC[-3]&")" -> IdManager.setMixture(6,22,38)
A27: 26 | B27: 14 | C27: =VLOOKUP(RC[-1],ABIL!C1:C2,2,0) -> 破山 | D27: 30 | E27: =VLOOKUP(RC[-1],ABIL!C1:C2,2,0) -> 震天 | F27: 46 | G27: =VLOOKUP(RC[-1],ABIL!C1:C2,2,0) -> 明月孤 | H27: =IF(AND(RC[-5]<>"未解锁",RC[-3]<>"未解锁",RC[-1]<>"未解锁"),RC[-5]&" + "&RC[-3]&" = "&RC[-1],"") -> 破山 + 震天 = 明月孤 | I27: = "IdManager.setMixture("&RC[-7]&","&RC[-5]&","&RC[-3]&")" -> IdManager.setMixture(14,30,46)
A28: 27 | B28: 7 | C28: =VLOOKUP(RC[-1],ABIL!C1:C2,2,0) -> 枯禅 | D28: 23 | E28: =VLOOKUP(RC[-1],ABIL!C1:C2,2,0) -> 空蝉 | F28: 39 | G28: =VLOOKUP(RC[-1],ABIL!C1:C2,2,0) -> 万里穹 | H28: =IF(AND(RC[-5]<>"未解锁",RC[-3]<>"未解锁",RC[-1]<>"未解锁"),RC[-5]&" + "&RC[-3]&" = "&RC[-1],"") -> 枯禅 + 空蝉 = 万里穹 | I28: = "IdManager.setMixture("&RC[-7]&","&RC[-5]&","&RC[-3]&")" -> IdManager.setMixture(7,23,39)
A29: 28 | B29: 15 | C29: =VLOOKUP(RC[-1],ABIL!C1:C2,2,0) -> 四凶 | D29: 31 | E29: =VLOOKUP(RC[-1],ABIL!C1:C2,2,0) -> 天问 | F29: 47 | G29: =VLOOKUP(RC[-1],ABIL!C1:C2,2,0) -> 云天渺 | H29: =IF(AND(RC[-5]<>"未解锁",RC[-3]<>"未解锁",RC[-1]<>"未解锁"),RC[-5]&" + "&RC[-3]&" = "&RC[-1],"") -> 四凶 + 天问 = 云天渺 | I29: = "IdManager.setMixture("&RC[-7]&","&RC[-5]&","&RC[-3]&")" -> IdManager.setMixture(15,31,47)
A30: 29 | B30: 8 | C30: =VLOOKUP(RC[-1],ABIL!C1:C2,2,0) -> 无念 | D30: 24 | E30: =VLOOKUP(RC[-1],ABIL!C1:C2,2,0) -> 无涯 | F30: 40 | G30: =VLOOKUP(RC[-1],ABIL!C1:C2,2,0) -> 青玉案 | H30: =IF(AND(RC[-5]<>"未解锁",RC[-3]<>"未解锁",RC[-1]<>"未解锁"),RC[-5]&" + "&RC[-3]&" = "&RC[-1],"") -> 无念 + 无涯 = 青玉案 | I30: = "IdManager.setMixture("&RC[-7]&","&RC[-5]&","&RC[-3]&")" -> IdManager.setMixture(8,24,40)
A31: 30 | B31: 16 | C31: =VLOOKUP(RC[-1],ABIL!C1:C2,2,0) -> 残风 | D31: 32 | E31: =VLOOKUP(RC[-1],ABIL!C1:C2,2,0) -> 碧空 | F31: 48 | G31: =VLOOKUP(RC[-1],ABIL!C1:C2,2,0) -> 醉红颜 | H31: =IF(AND(RC[-5]<>"未解锁",RC[-3]<>"未解锁",RC[-1]<>"未解锁"),RC[-5]&" + "&RC[-3]&" = "&RC[-1],"") -> 残风 + 碧空 = 醉红颜 | I31: = "IdManager.setMixture("&RC[-7]&","&RC[-5]&","&RC[-3]&")" -> IdManager.setMixture(16,32,48)
A32: 31 | B32: 9 | C32: =VLOOKUP(RC[-1],ABIL!C1:C2,2,0) -> 无踪 | D32: 25 | E32: =VLOOKUP(RC[-1],ABIL!C1:C2,2,0) -> 无极 | F32: 41 | G32: =VLOOKUP(RC[-1],ABIL!C1:C2,2,0) -> 阳关调 | H32: =IF(AND(RC[-5]<>"未解锁",RC[-3]<>"未解锁",RC[-1]<>"未解锁"),RC[-5]&" + "&RC[-3]&" = "&RC[-1],"") -> 无踪 + 无极 = 阳关调 | I32: = "IdManager.setMixture("&RC[-7]&","&RC[-5]&","&RC[-3]&")" -> IdManager.setMixture(9,25,41)
A33: 32 | B33: 17 | C33: =VLOOKUP(RC[-1],ABIL!C1:C2,2,0) -> 无常 | D33: 33 | E33: =VLOOKUP(RC[-1],ABIL!C1:C2,2,0) -> 明月 | F33: 49 | G33: =VLOOKUP(RC[-1],ABIL!C1:C2,2,0) -> 尘世游 | H33: =IF(AND(RC[-5]<>"未解锁",RC[-3]<>"未解锁",RC[-1]<>"未解锁"),RC[-5]&" + "&RC[-3]&" = "&RC[-1],"") -> 无常 + 明月 = 尘世游 | I33: = "IdManager.setMixture("&RC[-7]&","&RC[-5]&","&RC[-3]&")" -> IdManager.setMixture(17,33,49)
A34: 33 | B34: 2 | C34: =VLOOKUP(RC[-1],ABIL!C1:C2,2,0) -> 无情 | D34: 26 | E34: =VLOOKUP(RC[-1],ABIL!C1:C2,2,0) -> 索命 | F34: 34 | G34: =VLOOKUP(RC[-1],ABIL!C1:C2,2,0) -> 幻梦穿 | H34: =IF(AND(RC[-5]<>"未解锁",RC[-3]<>"未解锁",RC[-1]<>"未解锁"),RC[-5]&" + "&RC[-3]&" = "&RC[-1],"") -> 无情 + 索命 = 幻梦穿 | I34: = "IdManager.setMixture("&RC[-7]&","&RC[-5]&","&RC[-3]&")" -> IdManager.setMixture(2,26,34)
A35: 34 | B35: 3 | C35: =VLOOKUP(RC[-1],ABIL!C1:C2,2,0) -> 如意 | D35: 27 | E35: =VLOOKUP(RC[-1],ABIL!C1:C2,2,0) -> 大千 | F35: 35 | G35: =VLOOKUP(RC[-1],ABIL!C1:C2,2,0) -> 绕指柔 | H35: =IF(AND(RC[-5]<>"未解锁",RC[-3]<>"未解锁",RC[-1]<>"未解锁"),RC[-5]&" + "&RC[-3]&" = "&RC[-1],"") -> 如意 + 大千 = 绕指柔 | I35: = "IdManager.setMixture("&RC[-7]&","&RC[-5]&","&RC[-3]&")" -> IdManager.setMixture(3,27,35)
A36: 35 | B36: 4 | C36: =VLOOKUP(RC[-1],ABIL!C1:C2,2,0) -> 无名 | D36: 28 | E36: =VLOOKUP(RC[-1],ABIL!C1:C2,2,0) -> 灭神 | F36: 36 | G36: =VLOOKUP(RC[-1],ABIL!C1:C2,2,0) -> 郁浮欢 | H36: =IF(AND(RC[-5]<>"未解锁",RC[-3]<>"未解锁",RC[-1]<>"未解锁"),RC[-5]&" + "&RC[-3]&" = "&RC[-1],"") -> 无名 + 灭神 = 郁浮欢 | I36: = "IdManager.setMixture("&RC[-7]&","&RC[-5]&","&RC[-3]&")" -> IdManager.setMixture(4,28,36)
A37: 36 | B37: 5 | C37: =VLOOKUP(RC[-1],ABIL!C1:C2,2,0) -> 千里 | D37: 29 | E37: =VLOOKUP(RC[-1],ABIL!C1:C2,2,0) -> 夺心 | F37: 37 | G37: =VLOOKUP(RC[-1],ABIL!C1:C2,2,0) -> 夜寒凉 | H37: =IF(AND(RC[-5]<>"未解锁",RC[-3]<>"未解锁",RC[-1]<>"未解锁"),RC[-5]&" + "&RC[-3]&" = "&RC[-1],"") -> 千里 + 夺心 = 夜寒凉 | I37: = "IdManager.setMixture("&RC[-7]&","&RC[-5]&","&RC[-3]&")" -> IdManager.setMixture(5,29,37)
A38: 37 | B38: 6 | C38: =VLOOKUP(RC[-1],ABIL!C1:C2,2,0) -> 落枫 | D38: 30 | E38: =VLOOKUP(RC[-1],ABIL!C1:C2,2,0) -> 震天 | F38: 38 | G38: =VLOOKUP(RC[-1],ABIL!C1:C2,2,0) -> 醉人间 | H38: =IF(AND(RC[-5]<>"未解锁",RC[-3]<>"未解锁",RC[-1]<>"未解锁"),RC[-5]&" + "&RC[-3]&" = "&RC[-1],"") -> 落枫 + 震天 = 醉人间 | I38: = "IdManager.setMixture("&RC[-7]&","&RC[-5]&","&RC[-3]&")" -> IdManager.setMixture(6,30,38)
A39: 38 | B39: 7 | C39: =VLOOKUP(RC[-1],ABIL!C1:C2,2,0) -> 枯禅 | D39: 31 | E39: =VLOOKUP(RC[-1],ABIL!C1:C2,2,0) -> 天问 | F39: 39 | G39: =VLOOKUP(RC[-1],ABIL!C1:C2,2,0) -> 万里穹 | H39: =IF(AND(RC[-5]<>"未解锁",RC[-3]<>"未解锁",RC[-1]<>"未解锁"),RC[-5]&" + "&RC[-3]&" = "&RC[-1],"") -> 枯禅 + 天问 = 万里穹 | I39: = "IdManager.setMixture("&RC[-7]&","&RC[-5]&","&RC[-3]&")" -> IdManager.setMixture(7,31,39)
A40: 39 | B40: 8 | C40: =VLOOKUP(RC[-1],ABIL!C1:C2,2,0) -> 无念 | D40: 32 | E40: =VLOOKUP(RC[-1],ABIL!C1:C2,2,0) -> 碧空 | F40: 40 | G40: =VLOOKUP(RC[-1],ABIL!C1:C2,2,0) -> 青玉案 | H40: =IF(AND(RC[-5]<>"未解锁",RC[-3]<>"未解锁",RC[-1]<>"未解锁"),RC[-5]&" + "&RC[-3]&" = "&RC[-1],"") -> 无念 + 碧空 = 青玉案 | I40: = "IdManager.setMixture("&RC[-7]&","&RC[-5]&","&RC[-3]&")" -> IdManager.setMixture(8,32,40)
A41: 40 | B41: 9 | C41: =VLOOKUP(RC[-1],ABIL!C1:C2,2,0) -> 无踪 | D41: 33 | E41: =VLOOKUP(RC[-1],ABIL!C1:C2,2,0) -> 明月 | F41: 41 | G41: =VLOOKUP(RC[-1],ABIL!C1:C2,2,0) -> 阳关调 | H41: =IF(AND(RC[-5]<>"未解锁",RC[-3]<>"未解锁",RC[-1]<>"未解锁"),RC[-5]&" + "&RC[-3]&" = "&RC[-1],"") -> 无踪 + 明月 = 阳关调 | I41: = "IdManager.setMixture("&RC[-7]&","&RC[-5]&","&RC[-3]&")" -> IdManager.setMixture(9,33,41)
A42: 41 | B42: 34 | C42: =VLOOKUP(RC[-1],ABIL!C1:C2,2,0) -> 幻梦穿 | D42: 42 | E42: =VLOOKUP(RC[-1],ABIL!C1:C2,2,0) -> 醉赤壁 | F42: 58 | G42: =VLOOKUP(RC[-1],ABIL!C1:C2,2,0) -> 断编残简 | H42: =IF(AND(RC[-5]<>"未解锁",RC[-3]<>"未解锁",RC[-1]<>"未解锁"),RC[-5]&" + "&RC[-3]&" = "&RC[-1],"") -> 幻梦穿 + 醉赤壁 = 断编残简 | I42: = "IdManager.setMixture("&RC[-7]&","&RC[-5]&","&RC[-3]&")" -> IdManager.setMixture(34,42,58)
A43: 42 | B43: 35 | C43: =VLOOKUP(RC[-1],ABIL!C1:C2,2,0) -> 绕指柔 | D43: 43 | E43: =VLOOKUP(RC[-1],ABIL!C1:C2,2,0) -> 凡世忘 | F43: 59 | G43: =VLOOKUP(RC[-1],ABIL!C1:C2,2,0) -> 落花无声 | H43: =IF(AND(RC[-5]<>"未解锁",RC[-3]<>"未解锁",RC[-1]<>"未解锁"),RC[-5]&" + "&RC[-3]&" = "&RC[-1],"") -> 绕指柔 + 凡世忘 = 落花无声 | I43: = "IdManager.setMixture("&RC[-7]&","&RC[-5]&","&RC[-3]&")" -> IdManager.setMixture(35,43,59)
A44: 43 | B44: 36 | C44: =VLOOKUP(RC[-1],ABIL!C1:C2,2,0) -> 郁浮欢 | D44: 44 | E44: =VLOOKUP(RC[-1],ABIL!C1:C2,2,0) -> 问苍天 | F44: 60 | G44: =VLOOKUP(RC[-1],ABIL!C1:C2,2,0) -> 浮世繁华 | H44: =IF(AND(RC[-5]<>"未解锁",RC[-3]<>"未解锁",RC[-1]<>"未解锁"),RC[-5]&" + "&RC[-3]&" = "&RC[-1],"") -> 郁浮欢 + 问苍天 = 浮世繁华 | I44: = "IdManager.setMixture("&RC[-7]&","&RC[-5]&","&RC[-3]&")" -> IdManager.setMixture(36,44,60)
A45: 44 | B45: 37 | C45: =VLOOKUP(RC[-1],ABIL!C1:C2,2,0) -> 夜寒凉 | D45: 45 | E45: =VLOOKUP(RC[-1],ABIL!C1:C2,2,0) -> 空断肠 | F45: 61 | G45: =VLOOKUP(RC[-1],ABIL!C1:C2,2,0) -> 执念成殇 | H45: =IF(AND(RC[-5]<>"未解锁",RC[-3]<>"未解锁",RC[-1]<>"未解锁"),RC[-5]&" + "&RC[-3]&" = "&RC[-1],"") -> 夜寒凉 + 空断肠 = 执念成殇 | I45: = "IdManager.setMixture("&RC[-7]&","&RC[-5]&","&RC[-3]&")" -> IdManager.setMixture(37,45,61)
A46: 45 | B46: 38 | C46: =VLOOKUP(RC[-1],ABIL!C1:C2,2,0) -> 醉人间 | D46: 46 | E46: =VLOOKUP(RC[-1],ABIL!C1:C2,2,0) -> 明月孤 | F46: 62 | G46: =VLOOKUP(RC[-1],ABIL!C1:C2,2,0) -> 月下独酌 | H46: =IF(AND(RC[-5]<>"未解锁",RC[-3]<>"未解锁",RC[-1]<>"未解锁"),RC[-5]&" + "&RC[-3]&" = "&RC[-1],"") -> 醉人间 + 明月孤 = 月下独酌 | I46: = "IdManager.setMixture("&RC[-7]&","&RC[-5]&","&RC[-3]&")" -> IdManager.setMixture(38,46,62)
A47: 46 | B47: 39 | C47: =VLOOKUP(RC[-1],ABIL!C1:C2,2,0) -> 万里穹 | D47: 47 | E47: =VLOOKUP(RC[-1],ABIL!C1:C2,2,0) -> 云天渺 | F47: 63 | G47: =VLOOKUP(RC[-1],ABIL!C1:C2,2,0) -> 诗羽呢喃 | H47: =IF(AND(RC[-5]<>"未解锁",RC[-3]<>"未解锁",RC[-1]<>"未解锁"),RC[-5]&" + "&RC[-3]&" = "&RC[-1],"") -> 万里穹 + 云天渺 = 诗羽呢喃 | I47: = "IdManager.setMixture("&RC[-7]&","&RC[-5]&","&RC[-3]&")" -> IdManager.setMixture(39,47,63)
A48: 47 | B48: 40 | C48: =VLOOKUP(RC[-1],ABIL!C1:C2,2,0) -> 青玉案 | D48: 48 | E48: =VLOOKUP(RC[-1],ABIL!C1:C2,2,0) -> 醉红颜 | F48: 64 | G48: =VLOOKUP(RC[-1],ABIL!C1:C2,2,0) -> 人生如烟 | H48: =IF(AND(RC[-5]<>"未解锁",RC[-3]<>"未解锁",RC[-1]<>"未解锁"),RC[-5]&" + "&RC[-3]&" = "&RC[-1],"") -> 青玉案 + 醉红颜 = 人生如烟 | I48: = "IdManager.setMixture("&RC[-7]&","&RC[-5]&","&RC[-3]&")" -> IdManager.setMixture(40,48,64)
A49: 48 | B49: 41 | C49: =VLOOKUP(RC[-1],ABIL!C1:C2,2,0) -> 阳关调 | D49: 49 | E49: =VLOOKUP(RC[-1],ABIL!C1:C2,2,0) -> 尘世游 | F49: 65 | G49: =VLOOKUP(RC[-1],ABIL!C1:C2,2,0) -> 肆无忌惮 | H49: =IF(AND(RC[-5]<>"未解锁",RC[-3]<>"未解锁",RC[-1]<>"未解锁"),RC[-5]&" + "&RC[-3]&" = "&RC[-1],"") -> 阳关调 + 尘世游 = 肆无忌惮 | I49: = "IdManager.setMixture("&RC[-7]&","&RC[-5]&","&RC[-3]&")" -> IdManager.setMixture(41,49,65)
A50: 49 | B50: 34 | C50: =VLOOKUP(RC[-1],ABIL!C1:C2,2,0) -> 幻梦穿 | D50: 43 | E50: =VLOOKUP(RC[-1],ABIL!C1:C2,2,0) -> 凡世忘 | F50: 51 | G50: =VLOOKUP(RC[-1],ABIL!C1:C2,2,0) -> 志在千里 | H50: =IF(AND(RC[-5]<>"未解锁",RC[-3]<>"未解锁",RC[-1]<>"未解锁"),RC[-5]&" + "&RC[-3]&" = "&RC[-1],"") -> 幻梦穿 + 凡世忘 = 志在千里 | I50: = "IdManager.setMixture("&RC[-7]&","&RC[-5]&","&RC[-3]&")" -> IdManager.setMixture(34,43,51)
A51: 50 | B51: 40 | C51: =VLOOKUP(RC[-1],ABIL!C1:C2,2,0) -> 青玉案 | D51: 44 | E51: =VLOOKUP(RC[-1],ABIL!C1:C2,2,0) -> 问苍天 | F51: 52 | G51: =VLOOKUP(RC[-1],ABIL!C1:C2,2,0) -> 云海尘清 | H51: =IF(AND(RC[-5]<>"未解锁",RC[-3]<>"未解锁",RC[-1]<>"未解锁"),RC[-5]&" + "&RC[-3]&" = "&RC[-1],"") -> 青玉案 + 问苍天 = 云海尘清 | I51: = "IdManager.setMixture("&RC[-7]&","&RC[-5]&","&RC[-3]&")" -> IdManager.setMixture(40,44,52)
A52: 51 | B52: 42 | C52: =VLOOKUP(RC[-1],ABIL!C1:C2,2,0) -> 醉赤壁 | D52: 45 | E52: =VLOOKUP(RC[-1],ABIL!C1:C2,2,0) -> 空断肠 | F52: 53 | G52: =VLOOKUP(RC[-1],ABIL!C1:C2,2,0) -> 天涯海角 | H52: =IF(AND(RC[-5]<>"未解锁",RC[-3]<>"未解锁",RC[-1]<>"未解锁"),RC[-5]&" + "&RC[-3]&" = "&RC[-1],"") -> 醉赤壁 + 空断肠 = 天涯海角 | I52: = "IdManager.setMixture("&RC[-7]&","&RC[-5]&","&RC[-3]&")" -> IdManager.setMixture(42,45,53)
A53: 52 | B53: 48 | C53: =VLOOKUP(RC[-1],ABIL!C1:C2,2,0) -> 醉红颜 | D53: 46 | E53: =VLOOKUP(RC[-1],ABIL!C1:C2,2,0) -> 明月孤 | F53: 54 | G53: =VLOOKUP(RC[-1],ABIL!C1:C2,2,0) -> 横扫千军 | H53: =IF(AND(RC[-5]<>"未解锁",RC[-3]<>"未解锁",RC[-1]<>"未解锁"),RC[-5]&" + "&RC[-3]&" = "&RC[-1],"") -> 醉红颜 + 明月孤 = 横扫千军 | I53: = "IdManager.setMixture("&RC[-7]&","&RC[-5]&","&RC[-3]&")" -> IdManager.setMixture(48,46,54)
A54: 53 | B54: 35 | C54: =VLOOKUP(RC[-1],ABIL!C1:C2,2,0) -> 绕指柔 | D54: 39 | E54: =VLOOKUP(RC[-1],ABIL!C1:C2,2,0) -> 万里穹 | F54: 50 | G54: =VLOOKUP(RC[-1],ABIL!C1:C2,2,0) -> 人生几何 | H54: =IF(AND(RC[-5]<>"未解锁",RC[-3]<>"未解锁",RC[-1]<>"未解锁"),RC[-5]&" + "&RC[-3]&" = "&RC[-1],"") -> 绕指柔 + 万里穹 = 人生几何 | I54: = "IdManager.setMixture("&RC[-7]&","&RC[-5]&","&RC[-3]&")" -> IdManager.setMixture(35,39,50)
A55: 54 | B55: 36 | C55: =VLOOKUP(RC[-1],ABIL!C1:C2,2,0) -> 郁浮欢 | D55: 41 | E55: =VLOOKUP(RC[-1],ABIL!C1:C2,2,0) -> 阳关调 | F55: 55 | G55: =VLOOKUP(RC[-1],ABIL!C1:C2,2,0) -> 叶随雨落 | H55: =IF(AND(RC[-5]<>"未解锁",RC[-3]<>"未解锁",RC[-1]<>"未解锁"),RC[-5]&" + "&RC[-3]&" = "&RC[-1],"") -> 郁浮欢 + 阳关调 = 叶随雨落 | I55: = "IdManager.setMixture("&RC[-7]&","&RC[-5]&","&RC[-3]&")" -> IdManager.setMixture(36,41,55)
A56: 55 | B56: 37 | C56: =VLOOKUP(RC[-1],ABIL!C1:C2,2,0) -> 夜寒凉 | D56: 47 | E56: =VLOOKUP(RC[-1],ABIL!C1:C2,2,0) -> 云天渺 | F56: 56 | G56: =VLOOKUP(RC[-1],ABIL!C1:C2,2,0) -> 傲世九天 | H56: =IF(AND(RC[-5]<>"未解锁",RC[-3]<>"未解锁",RC[-1]<>"未解锁"),RC[-5]&" + "&RC[-3]&" = "&RC[-1],"") -> 夜寒凉 + 云天渺 = 傲世九天 | I56: = "IdManager.setMixture("&RC[-7]&","&RC[-5]&","&RC[-3]&")" -> IdManager.setMixture(37,47,56)
A57: 56 | B57: 38 | C57: =VLOOKUP(RC[-1],ABIL!C1:C2,2,0) -> 醉人间 | D57: 49 | E57: =VLOOKUP(RC[-1],ABIL!C1:C2,2,0) -> 尘世游 | F57: 57 | G57: =VLOOKUP(RC[-1],ABIL!C1:C2,2,0) -> 浮云过影 | H57: =IF(AND(RC[-5]<>"未解锁",RC[-3]<>"未解锁",RC[-1]<>"未解锁"),RC[-5]&" + "&RC[-3]&" = "&RC[-1],"") -> 醉人间 + 尘世游 = 浮云过影 | I57: = "IdManager.setMixture("&RC[-7]&","&RC[-5]&","&RC[-3]&")" -> IdManager.setMixture(38,49,57)

Sheet: CONFIG
A1: 扇形主动 | C1: 扇形被动 | E1: 线性延迟主动 | G1: 线性延迟被动 | I1: 线性主动 | K1: 线性被动 | M1: 圆形主动 | O1: 圆形被动
A2: missilePath | B2: 弹幕特效 | C2: missilePath | D2: 弹幕特效 | E2: linearEffectPath | F2: 弹幕特效 | G2: linearEffectPath | H2: 弹幕特效 | I2: linearEffectPath | J2: 弹幕特效 | K2: linearEffectPath | L2: 弹幕特效 | O2: isSelfPoint | P2: 是否自身点
A3: prop | B3: 属性关联 | C3: prop | D3: 属性关联 | E3: linearEffectScale | F3: 特效缩放 | G3: linearEffectScale | H3: 特效缩放 | I3: linearEffectScale | J3: 特效缩放 | K3: linearEffectScale | L3: 特效缩放 | M3: targetsType | N3: 目标类型123 | O3: castProb | P3: 释放概率
A4: dmgFactor | B4: 伤害系数 | C4: dmgFactor | D4: 伤害系数 | E4: linearEffectRange | F4: 伤害范围 | G4: linearEffectRange | H4: 伤害范围 | K4: castProb | L4: 释放概率 | M4: prop | N4: 属性关联 | O4: prop | P4: 属性关联
C5: castProb | D5: 释放概率 | E5: prop | F5: 属性关联 | G5: prop | H5: 属性关联 | I5: prop | J5: 属性关联 | K5: prop | L5: 属性关联 | M5: dmgFactor | N5: 伤害系数 | O5: dmgFactor | P5: 伤害系数
A6: cool | B6: CD | C6: cool | D6: CD | E6: dmgFactor | F6: 伤害系数 | G6: dmgFactor | H6: 伤害系数 | I6: dmgFactor | J6: 伤害系数 | K6: dmgFactor | L6: 伤害系数 | M6: dmgRange | N6: 伤害范围 | O6: dmgRange | P6: 伤害范围
A7: emissionDelay | B7: 释放延迟 | C7: emissionDelay | D7: 释放延迟 | G7: castProb | H7: 释放概率 | I7: cool | J7: CD | K7: cool | L7: CD | M7: cool | N7: CD | O7: cool | P7: CD
A8: emissionCount | B8: 释放次数 | C8: emissionCount | D8: 释放次数 | E8: cool | F8: CD | G8: cool | H8: CD | I8: emissionDelay | J8: 释放延迟 | K8: emissionDelay | L8: 释放延迟 | M8: emissionDelay | N8: 释放延迟 | O8: emissionDelay | P8: 释放延迟
A9: missileRange | B9: 弹幕范围 | C9: missileRange | D9: 弹幕范围 | E9: emissionDelay | F9: 释放延迟 | G9: emissionDelay | H9: 释放延迟 | I9: emissionCount | J9: 释放次数 | K9: emissionCount | L9: 释放次数 | M9: emissionCount | N9: 释放次数 | O9: emissionCount | P9: 释放次数
A10: missileTime | B10: 弹幕时间 | C10: missileTime | D10: 弹幕时间 | E10: emissionCount | F10: 释放次数 | G10: emissionCount | H10: 释放次数 | I10: linearEffectRange | J10: 伤害范围 | K10: linearEffectRange | L10: 伤害范围 | M10: rangeEffectPath | N10: 范围特效 | O10: rangeEffectPath | P10: 范围特效
A11: missileCount | B11: 弹幕数 | C11: missileCount | D11: 弹幕数 | E11: oneDamage | F11: 是否受到1次伤害 | G11: oneDamage | H11: 是否受到1次伤害 | I11: linearEffectPointCount | J11: 线上条数 | K11: linearEffectPointCount | L11: 线上条数 | M11: pointEffectPath | N11: 点特效 | O11: pointEffectPath | P11: 点特效
A12: missileRight | B12: 发射偏移 | C12: missileRight | D12: 发射偏移 | E12: linearEffectStripCount | F12: 线条数 | G12: linearEffectStripCount | H12: 线条数 | I12: linearEffectPointInterval | J12: 线上间隔 | K12: linearEffectPointInterval | L12: 线上间隔
A13: missileInterval | B13: 递增角度 | C13: missileInterval | D13: 递增角度 | E13: linearEffectStripRight | F13: 发射偏移 | G13: linearEffectStripRight | H13: 发射偏移
E14: linearEffectStripInterval | F14: 递增角度 | G14: linearEffectStripInterval | H14: 递增角度
E15: linearEffectDelay | F15: 延迟 | G15: linearEffectDelay | H15: 延迟
E16: linearEffectPointCount | F16: 线上条数 | G16: linearEffectPointCount | H16: 线上条数
A17: ALL | B17: 全属性 | E17: linearEffectPointInterval | F17: 线上间隔 | G17: linearEffectPointInterval | H17: 线上间隔
A18: STR | B18: 力量
A19: AGI | B19: 敏捷
A20: INT | B20: 智力
A21: STR_AGI | B21: 力量(主)+敏捷(副) | E21: 扇形 | F21: 主动 | G21: =RC[-2]&RC[-1] -> 扇形主动 | H21: GeneralSectorBulletActiveRandomSpellEntity
A22: STR_INT | B22: 力量(主)+智力(副) | E22: 线性延迟 | F22: 主动 | G22: =RC[-2]&RC[-1] -> 线性延迟主动 | H22: GeneralDelayedLinearEffectActiveRandomSpellEntity
A23: AGI_STR | B23: 敏捷(主)+力量(副) | E23: 线性 | F23: 主动 | G23: =RC[-2]&RC[-1] -> 线性主动 | H23: GeneralLinearEffectActiveRandomSpellEntity
A24: AGI_INT | B24: 敏捷(主)+智力(副) | E24: 圆形 | F24: 主动 | G24: =RC[-2]&RC[-1] -> 圆形主动 | H24: GeneralRangeEffectActiveRandomSpellEntity
A25: INT_STR | B25: 智力(主)+力量(副) | E25: 扇形 | F25: 被动 | G25: =RC[-2]&RC[-1] -> 扇形被动 | H25: GeneralSectorBulletPassiveRandomSpellEntity
A26: INT_AGI | B26: 智力(主)+敏捷(副) | E26: 线性延迟 | F26: 被动 | G26: =RC[-2]&RC[-1] -> 线性延迟被动 | H26: GeneralDelayedLinearEffectPassiveRandomSpellEntity
A27: ALL_MAIN | B27: 全属性+主属性 | E27: 线性 | F27: 被动 | G27: =RC[-2]&RC[-1] -> 线性被动 | H27: GeneralLinearEffectPassiveRandomSpellEntity
A28: MAIN | B28: 主属性 | E28: 圆形 | F28: 被动 | G28: =RC[-2]&RC[-1] -> 圆形被动 | H28: GeneralRangeEffectPassiveRandomSpellEntity
A29: ATK | B29: 攻击力

Sheet: 扇形
A1: INDEX | B1: NAME | C1: ACTIVE | D1: TIP | E1: CODE | F1: 弹幕特效 | G1: 属性关联 | H1: 伤害系数 | I1: 释放概率 | J1: CD | K1: 释放延迟 | L1: 释放次数 | M1: 弹幕范围 | N1: 弹幕时间 | O1: 弹幕数 | P1: 发射偏移 | Q1: 递增角度
A2: 2 | B2: =VLOOKUP(RC[-1],ABIL!C1:C2,2,0) -> 无情 | C2: =VLOOKUP(RC[-2],ABIL!C1:C3,3,0) -> 被动 | D2: =IF(RC[5]<>"","攻击时有"&RC[5]&"%概率|n","")&IF(RC[8]>1,"在"&(RC[7]*RC[8])&"秒内"&RC[8]&"次","")&"对扇形区域"&"发射"&RC[11]&"枚弹幕"&"造成伤害!" -> 攻击时有10%概率|n对扇形区域发射3枚弹幕造成伤害! | E2: ="_rs"&RC[-4]&".setData("&IF(RC[1]<>"",RC[1]&",","")&IF(RC[2]<>"","Prop."&RC[2]&",","")&IF(RC[3]<>"",RC[3]&",","")&IF(RC[4]<>"",RC[4]&",","")&IF(RC[5]<>"",RC[5]&",","")&IF(RC[6]<>"",RC[6]&",","")&IF(RC[7]<>"",RC[7]&",","")&IF(RC[8]<>"",RC[8]&",","")&IF(RC[9]<>"",RC[9]&",","")&IF(RC[10]<>"",RC[10]&",","")&IF(RC[11]<>"",RC[11]&",","")&IF(RC[12]<>"",RC[12],"")&")" -> _rs2.setData("war3mapImported\\AZ_Aiushtha_T.mdl",Prop.ALL,1.3,10,3,0,1,900,0.6,3,30,30) | F2: "war3mapImported\\AZ_Aiushtha_T.mdl" | G2: =VLOOKUP(RC[-6],ABIL!C1:C5,5,0) -> ALL | H2: =VLOOKUP(RC[-7],ABIL!C1:C7,7,0) -> 1.3 | I2: 10 | J2: 3 | K2: 0 | L2: 1 | M2: 900 | N2: 0.6 | O2: 3 | P2: 30 | Q2: =2*RC[-1]/(RC[-2]-1) -> 30
A3: 3 | B3: =VLOOKUP(RC[-1],ABIL!C1:C2,2,0) -> 如意 | C3: =VLOOKUP(RC[-2],ABIL!C1:C3,3,0) -> 被动 | D3: =IF(RC[5]<>"","攻击时有"&RC[5]&"%概率|n","")&IF(RC[8]>1,"在"&(RC[7]*RC[8])&"秒内"&RC[8]&"次","")&"对扇形区域"&"发射"&RC[11]&"枚弹幕"&"造成伤害!" -> 攻击时有10%概率|n对扇形区域发射3枚弹幕造成伤害! | E3: ="_rs"&RC[-4]&".setData("&IF(RC[1]<>"",RC[1]&",","")&IF(RC[2]<>"","Prop."&RC[2]&",","")&IF(RC[3]<>"",RC[3]&",","")&IF(RC[4]<>"",RC[4]&",","")&IF(RC[5]<>"",RC[5]&",","")&IF(RC[6]<>"",RC[6]&",","")&IF(RC[7]<>"",RC[7]&",","")&IF(RC[8]<>"",RC[8]&",","")&IF(RC[9]<>"",RC[9]&",","")&IF(RC[10]<>"",RC[10]&",","")&IF(RC[11]<>"",RC[11]&",","")&IF(RC[12]<>"",RC[12],"")&")" -> _rs3.setData("war3mapImported\\AZ_Dragonus_C.mdl",Prop.STR,3.9,10,3,0,1,900,0.6,3,30,30) | F3: "war3mapImported\\AZ_Dragonus_C.mdl" | G3: =VLOOKUP(RC[-6],ABIL!C1:C5,5,0) -> STR | H3: =VLOOKUP(RC[-7],ABIL!C1:C7,7,0) -> 3.9000000000000004 | I3: 10 | J3: 3 | K3: 0 | L3: 1 | M3: 900 | N3: 0.6 | O3: 3 | P3: 30 | Q3: =2*RC[-1]/(RC[-2]-1) -> 30
A4: 4 | B4: =VLOOKUP(RC[-1],ABIL!C1:C2,2,0) -> 无名 | C4: =VLOOKUP(RC[-2],ABIL!C1:C3,3,0) -> 被动 | D4: =IF(RC[5]<>"","攻击时有"&RC[5]&"%概率|n","")&IF(RC[8]>1,"在"&(RC[7]*RC[8])&"秒内"&RC[8]&"次","")&"对扇形区域"&"发射"&RC[11]&"枚弹幕"&"造成伤害!" -> 攻击时有10%概率|n对扇形区域发射3枚弹幕造成伤害! | E4: ="_rs"&RC[-4]&".setData("&IF(RC[1]<>"",RC[1]&",","")&IF(RC[2]<>"","Prop."&RC[2]&",","")&IF(RC[3]<>"",RC[3]&",","")&IF(RC[4]<>"",RC[4]&",","")&IF(RC[5]<>"",RC[5]&",","")&IF(RC[6]<>"",RC[6]&",","")&IF(RC[7]<>"",RC[7]&",","")&IF(RC[8]<>"",RC[8]&",","")&IF(RC[9]<>"",RC[9]&",","")&IF(RC[10]<>"",RC[10]&",","")&IF(RC[11]<>"",RC[11]&",","")&IF(RC[12]<>"",RC[12],"")&")" -> _rs4.setData("war3mapImported\\AZ_Sniper(2)_T_Misslie.mdl",Prop.AGI,3.9,10,3,0,1,900,0.6,3,30,30) | F4: "war3mapImported\\AZ_Sniper(2)_T_Misslie.mdl" | G4: =VLOOKUP(RC[-6],ABIL!C1:C5,5,0) -> AGI | H4: =VLOOKUP(RC[-7],ABIL!C1:C7,7,0) -> 3.9 | I4: 10 | J4: 3 | K4: 0 | L4: 1 | M4: 900 | N4: 0.6 | O4: 3 | P4: 30 | Q4: =2*RC[-1]/(RC[-2]-1) -> 30
A5: 5 | B5: =VLOOKUP(RC[-1],ABIL!C1:C2,2,0) -> 千里 | C5: =VLOOKUP(RC[-2],ABIL!C1:C3,3,0) -> 被动 | D5: =IF(RC[5]<>"","攻击时有"&RC[5]&"%概率|n","")&IF(RC[8]>1,"在"&(RC[7]*RC[8])&"秒内"&RC[8]&"次","")&"对扇形区域"&"发射"&RC[11]&"枚弹幕"&"造成伤害!" -> 攻击时有10%概率|n对扇形区域发射3枚弹幕造成伤害! | E5: ="_rs"&RC[-4]&".setData("&IF(RC[1]<>"",RC[1]&",","")&IF(RC[2]<>"","Prop."&RC[2]&",","")&IF(RC[3]<>"",RC[3]&",","")&IF(RC[4]<>"",RC[4]&",","")&IF(RC[5]<>"",RC[5]&",","")&IF(RC[6]<>"",RC[6]&",","")&IF(RC[7]<>"",RC[7]&",","")&IF(RC[8]<>"",RC[8]&",","")&IF(RC[9]<>"",RC[9]&",","")&IF(RC[10]<>"",RC[10]&",","")&IF(RC[11]<>"",RC[11]&",","")&IF(RC[12]<>"",RC[12],"")&")" -> _rs5.setData("war3mapImported\\AZ_Alleria_R1.mdl",Prop.INT,3.9,10,3,0,1,900,0.6,3,30,30) | F5: "war3mapImported\\AZ_Alleria_R1.mdl" | G5: =VLOOKUP(RC[-6],ABIL!C1:C5,5,0) -> INT | H5: =VLOOKUP(RC[-7],ABIL!C1:C7,7,0) -> 3.9000000000000004 | I5: 10 | J5: 3 | K5: 0 | L5: 1 | M5: 900 | N5: 0.6 | O5: 3 | P5: 30 | Q5: =2*RC[-1]/(RC[-2]-1) -> 30
A6: 6 | B6: =VLOOKUP(RC[-1],ABIL!C1:C2,2,0) -> 落枫 | C6: =VLOOKUP(RC[-2],ABIL!C1:C3,3,0) -> 被动 | D6: =IF(RC[5]<>"","攻击时有"&RC[5]&"%概率|n","")&IF(RC[8]>1,"在"&(RC[7]*RC[8])&"秒内"&RC[8]&"次","")&"对扇形区域"&"发射"&RC[11]&"枚弹幕"&"造成伤害!" -> 攻击时有10%概率|n对扇形区域发射3枚弹幕造成伤害! | E6: ="_rs"&RC[-4]&".setData("&IF(RC[1]<>"",RC[1]&",","")&IF(RC[2]<>"","Prop."&RC[2]&",","")&IF(RC[3]<>"",RC[3]&",","")&IF(RC[4]<>"",RC[4]&",","")&IF(RC[5]<>"",RC[5]&",","")&IF(RC[6]<>"",RC[6]&",","")&IF(RC[7]<>"",RC[7]&",","")&IF(RC[8]<>"",RC[8]&",","")&IF(RC[9]<>"",RC[9]&",","")&IF(RC[10]<>"",RC[10]&",","")&IF(RC[11]<>"",RC[11]&",","")&IF(RC[12]<>"",RC[12],"")&")" -> _rs6.setData("war3mapImported\\AZ_PotM(1)_R2.mdl",Prop.ATK,1.3,10,3,0,1,900,0.6,3,30,30) | F6: "war3mapImported\\AZ_PotM(1)_R2.mdl" | G6: =VLOOKUP(RC[-6],ABIL!C1:C5,5,0) -> ATK | H6: =VLOOKUP(RC[-7],ABIL!C1:C7,7,0) -> 1.3 | I6: 10 | J6: 3 | K6: 0 | L6: 1 | M6: 900 | N6: 0.6 | O6: 3 | P6: 30 | Q6: =2*RC[-1]/(RC[-2]-1) -> 30
A7: 7 | B7: =VLOOKUP(RC[-1],ABIL!C1:C2,2,0) -> 枯禅 | C7: =VLOOKUP(RC[-2],ABIL!C1:C3,3,0) -> 被动 | D7: =IF(RC[5]<>"","攻击时有"&RC[5]&"%概率|n","")&IF(RC[8]>1,"在"&(RC[7]*RC[8])&"秒内"&RC[8]&"次","")&"对扇形区域"&"发射"&RC[11]&"枚弹幕"&"造成伤害!" -> 攻击时有10%概率|n对扇形区域发射3枚弹幕造成伤害! | E7: ="_rs"&RC[-4]&".setData("&IF(RC[1]<>"",RC[1]&",","")&IF(RC[2]<>"","Prop."&RC[2]&",","")&IF(RC[3]<>"",RC[3]&",","")&IF(RC[4]<>"",RC[4]&",","")&IF(RC[5]<>"",RC[5]&",","")&IF(RC[6]<>"",RC[6]&",","")&IF(RC[7]<>"",RC[7]&",","")&IF(RC[8]<>"",RC[8]&",","")&IF(RC[9]<>"",RC[9]&",","")&IF(RC[10]<>"",RC[10]&",","")&IF(RC[11]<>"",RC[11]&",","")&IF(RC[12]<>"",RC[12],"")&")" -> _rs7.setData("war3mapImported\\AZ_Lanaya_D_Ballistic.mdl",Prop.ALL_MAIN,0.98,10,3,0,1,900,0.6,3,30,30) | F7: "war3mapImported\\AZ_Lanaya_D_Ballistic.mdl" | G7: =VLOOKUP(RC[-6],ABIL!C1:C5,5,0) -> ALL_MAIN | H7: =VLOOKUP(RC[-7],ABIL!C1:C7,7,0) -> 0.98 | I7: 10 | J7: 3 | K7: 0 | L7: 1 | M7: 900 | N7: 0.6 | O7: 3 | P7: 30 | Q7: =2*RC[-1]/(RC[-2]-1) -> 30
A8: 8 | B8: =VLOOKUP(RC[-1],ABIL!C1:C2,2,0) -> 无念 | C8: =VLOOKUP(RC[-2],ABIL!C1:C3,3,0) -> 被动 | D8: =IF(RC[5]<>"","攻击时有"&RC[5]&"%概率|n","")&IF(RC[8]>1,"在"&(RC[7]*RC[8])&"秒内"&RC[8]&"次","")&"对扇形区域"&"发射"&RC[11]&"枚弹幕"&"造成伤害!" -> 攻击时有10%概率|n对扇形区域发射3枚弹幕造成伤害! | E8: ="_rs"&RC[-4]&".setData("&IF(RC[1]<>"",RC[1]&",","")&IF(RC[2]<>"","Prop."&RC[2]&",","")&IF(RC[3]<>"",RC[3]&",","")&IF(RC[4]<>"",RC[4]&",","")&IF(RC[5]<>"",RC[5]&",","")&IF(RC[6]<>"",RC[6]&",","")&IF(RC[7]<>"",RC[7]&",","")&IF(RC[8]<>"",RC[8]&",","")&IF(RC[9]<>"",RC[9]&",","")&IF(RC[10]<>"",RC[10]&",","")&IF(RC[11]<>"",RC[11]&",","")&IF(RC[12]<>"",RC[12],"")&")" -> _rs8.setData("war3mapImported\\AZ_Alleria_E1.mdl",Prop.ALL,1.3,10,3,0,1,900,0.6,3,30,30) | F8: "war3mapImported\\AZ_Alleria_E1.mdl" | G8: =VLOOKUP(RC[-6],ABIL!C1:C5,5,0) -> ALL | H8: =VLOOKUP(RC[-7],ABIL!C1:C7,7,0) -> 1.3 | I8: 10 | J8: 3 | K8: 0 | L8: 1 | M8: 900 | N8: 0.6 | O8: 3 | P8: 30 | Q8: =2*RC[-1]/(RC[-2]-1) -> 30
A9: 9 | B9: =VLOOKUP(RC[-1],ABIL!C1:C2,2,0) -> 无踪 | C9: =VLOOKUP(RC[-2],ABIL!C1:C3,3,0) -> 被动 | D9: =IF(RC[5]<>"","攻击时有"&RC[5]&"%概率|n","")&IF(RC[8]>1,"在"&(RC[7]*RC[8])&"秒内"&RC[8]&"次","")&"对扇形区域"&"发射"&RC[11]&"枚弹幕"&"造成伤害!" -> 攻击时有10%概率|n对扇形区域发射3枚弹幕造成伤害! | E9: ="_rs"&RC[-4]&".setData("&IF(RC[1]<>"",RC[1]&",","")&IF(RC[2]<>"","Prop."&RC[2]&",","")&IF(RC[3]<>"",RC[3]&",","")&IF(RC[4]<>"",RC[4]&",","")&IF(RC[5]<>"",RC[5]&",","")&IF(RC[6]<>"",RC[6]&",","")&IF(RC[7]<>"",RC[7]&",","")&IF(RC[8]<>"",RC[8]&",","")&IF(RC[9]<>"",RC[9]&",","")&IF(RC[10]<>"",RC[10]&",","")&IF(RC[11]<>"",RC[11]&",","")&IF(RC[12]<>"",RC[12],"")&")" -> _rs9.setData("war3mapImported\\AZ_Storm_V1.mdl",Prop.MAIN,3.9,10,3,0,1,900,0.6,3,30,30) | F9: "war3mapImported\\AZ_Storm_V1.mdl" | G9: =VLOOKUP(RC[-6],ABIL!C1:C5,5,0) -> MAIN | H9: =VLOOKUP(RC[-7],ABIL!C1:C7,7,0) -> 3.9000000000000004 | I9: 10 | J9: 3 | K9: 0 | L9: 1 | M9: 900 | N9: 0.6 | O9: 3 | P9: 30 | Q9: =2*RC[-1]/(RC[-2]-1) -> 30
A10: 26 | B10: =VLOOKUP(RC[-1],ABIL!C1:C2,2,0) -> 索命 | C10: =VLOOKUP(RC[-2],ABIL!C1:C3,3,0) -> 主动 | D10: =IF(RC[5]<>"","攻击时有"&RC[5]&"%概率|n","")&IF(RC[8]>1,"在"&(RC[7]*RC[8])&"秒内"&RC[8]&"次","")&"对扇形区域"&"发射"&RC[11]&"枚弹幕"&"造成伤害!" -> 对扇形区域发射5枚弹幕造成伤害! | E10: ="_rs"&RC[-4]&".setData("&IF(RC[1]<>"",RC[1]&",","")&IF(RC[2]<>"","Prop."&RC[2]&",","")&IF(RC[3]<>"",RC[3]&",","")&IF(RC[4]<>"",RC[4]&",","")&IF(RC[5]<>"",RC[5]&",","")&IF(RC[6]<>"",RC[6]&",","")&IF(RC[7]<>"",RC[7]&",","")&IF(RC[8]<>"",RC[8]&",","")&IF(RC[9]<>"",RC[9]&",","")&IF(RC[10]<>"",RC[10]&",","")&IF(RC[11]<>"",RC[11]&",","")&IF(RC[12]<>"",RC[12],"")&")" -> _rs26.setData("war3mapImported\\[Sepll]LinaSun _D2_Misslie.mdl",Prop.ALL,1.95,10,0,1,900,0.6,5,60,30) | F10: "war3mapImported\\[Sepll]LinaSun _D2_Misslie.mdl" | G10: =VLOOKUP(RC[-6],ABIL!C1:C5,5,0) -> ALL | H10: =VLOOKUP(RC[-7],ABIL!C1:C7,7,0) -> 1.95 | J10: 10 | K10: 0 | L10: 1 | M10: 900 | N10: 0.6 | O10: 5 | P10: 60 | Q10: =2*RC[-1]/(RC[-2]-1) -> 30
A11: 27 | B11: =VLOOKUP(RC[-1],ABIL!C1:C2,2,0) -> 大千 | C11: =VLOOKUP(RC[-2],ABIL!C1:C3,3,0) -> 主动 | D11: =IF(RC[5]<>"","攻击时有"&RC[5]&"%概率|n","")&IF(RC[8]>1,"在"&(RC[7]*RC[8])&"秒内"&RC[8]&"次","")&"对扇形区域"&"发射"&RC[11]&"枚弹幕"&"造成伤害!" -> 对扇形区域发射5枚弹幕造成伤害! | E11: ="_rs"&RC[-4]&".setData("&IF(RC[1]<>"",RC[1]&",","")&IF(RC[2]<>"","Prop."&RC[2]&",","")&IF(RC[3]<>"",RC[3]&",","")&IF(RC[4]<>"",RC[4]&",","")&IF(RC[5]<>"",RC[5]&",","")&IF(RC[6]<>"",RC[6]&",","")&IF(RC[7]<>"",RC[7]&",","")&IF(RC[8]<>"",RC[8]&",","")&IF(RC[9]<>"",RC[9]&",","")&IF(RC[10]<>"",RC[10]&",","")&IF(RC[11]<>"",RC[11]&",","")&IF(RC[12]<>"",RC[12],"")&")" -> _rs27.setData("war3mapImported\\shoc.mdl",Prop.STR,5.85,10,0,1,900,0.6,5,60,30) | F11: "war3mapImported\\shoc.mdl" | G11: =VLOOKUP(RC[-6],ABIL!C1:C5,5,0) -> STR | H11: =VLOOKUP(RC[-7],ABIL!C1:C7,7,0) -> 5.85 | J11: 10 | K11: 0 | L11: 1 | M11: 900 | N11: 0.6 | O11: 5 | P11: 60 | Q11: =2*RC[-1]/(RC[-2]-1) -> 30
A12: 28 | B12: =VLOOKUP(RC[-1],ABIL!C1:C2,2,0) -> 灭神 | C12: =VLOOKUP(RC[-2],ABIL!C1:C3,3,0) -> 主动 | D12: =IF(RC[5]<>"","攻击时有"&RC[5]&"%概率|n","")&IF(RC[8]>1,"在"&(RC[7]*RC[8])&"秒内"&RC[8]&"次","")&"对扇形区域"&"发射"&RC[11]&"枚弹幕"&"造成伤害!" -> 在0.9秒内3次对扇形区域发射5枚弹幕造成伤害! | E12: ="_rs"&RC[-4]&".setData("&IF(RC[1]<>"",RC[1]&",","")&IF(RC[2]<>"","Prop."&RC[2]&",","")&IF(RC[3]<>"",RC[3]&",","")&IF(RC[4]<>"",RC[4]&",","")&IF(RC[5]<>"",RC[5]&",","")&IF(RC[6]<>"",RC[6]&",","")&IF(RC[7]<>"",RC[7]&",","")&IF(RC[8]<>"",RC[8]&",","")&IF(RC[9]<>"",RC[9]&",","")&IF(RC[10]<>"",RC[10]&",","")&IF(RC[11]<>"",RC[11]&",","")&IF(RC[12]<>"",RC[12],"")&")" -> _rs28.setData("war3mapImported\\YYTC.mdl",Prop.AGI,1.95,10,0.3,3,900,0.6,5,60,30) | F12: "war3mapImported\\YYTC.mdl" | G12: =VLOOKUP(RC[-6],ABIL!C1:C5,5,0) -> AGI | H12: =VLOOKUP(RC[-7],ABIL!C1:C7,7,0) -> 1.95 | J12: 10 | K12: 0.3 | L12: 3 | M12: 900 | N12: 0.6 | O12: 5 | P12: 60 | Q12: =2*RC[-1]/(RC[-2]-1) -> 30
A13: 29 | B13: =VLOOKUP(RC[-1],ABIL!C1:C2,2,0) -> 夺心 | C13: =VLOOKUP(RC[-2],ABIL!C1:C3,3,0) -> 主动 | D13: =IF(RC[5]<>"","攻击时有"&RC[5]&"%概率|n","")&IF(RC[8]>1,"在"&(RC[7]*RC[8])&"秒内"&RC[8]&"次","")&"对扇形区域"&"发射"&RC[11]&"枚弹幕"&"造成伤害!" -> 对扇形区域发射5枚弹幕造成伤害! | E13: ="_rs"&RC[-4]&".setData("&IF(RC[1]<>"",RC[1]&",","")&IF(RC[2]<>"","Prop."&RC[2]&",","")&IF(RC[3]<>"",RC[3]&",","")&IF(RC[4]<>"",RC[4]&",","")&IF(RC[5]<>"",RC[5]&",","")&IF(RC[6]<>"",RC[6]&",","")&IF(RC[7]<>"",RC[7]&",","")&IF(RC[8]<>"",RC[8]&",","")&IF(RC[9]<>"",RC[9]&",","")&IF(RC[10]<>"",RC[10]&",","")&IF(RC[11]<>"",RC[11]&",","")&IF(RC[12]<>"",RC[12],"")&")" -> _rs29.setData("war3mapImported\\AZ_HeroSBFire_C.mdl",Prop.INT,5.85,10,0,1,900,0.6,5,60,30) | F13: "war3mapImported\\AZ_HeroSBFire_C.mdl" | G13: =VLOOKUP(RC[-6],ABIL!C1:C5,5,0) -> INT | H13: =VLOOKUP(RC[-7],ABIL!C1:C7,7,0) -> 5.85 | J13: 10 | K13: 0 | L13: 1 | M13: 900 | N13: 0.6 | O13: 5 | P13: 60 | Q13: =2*RC[-1]/(RC[-2]-1) -> 30
A14: 30 | B14: =VLOOKUP(RC[-1],ABIL!C1:C2,2,0) -> 震天 | C14: =VLOOKUP(RC[-2],ABIL!C1:C3,3,0) -> 主动 | D14: =IF(RC[5]<>"","攻击时有"&RC[5]&"%概率|n","")&IF(RC[8]>1,"在"&(RC[7]*RC[8])&"秒内"&RC[8]&"次","")&"对扇形区域"&"发射"&RC[11]&"枚弹幕"&"造成伤害!" -> 对扇形区域发射5枚弹幕造成伤害! | E14: ="_rs"&RC[-4]&".setData("&IF(RC[1]<>"",RC[1]&",","")&IF(RC[2]<>"","Prop."&RC[2]&",","")&IF(RC[3]<>"",RC[3]&",","")&IF(RC[4]<>"",RC[4]&",","")&IF(RC[5]<>"",RC[5]&",","")&IF(RC[6]<>"",RC[6]&",","")&IF(RC[7]<>"",RC[7]&",","")&IF(RC[8]<>"",RC[8]&",","")&IF(RC[9]<>"",RC[9]&",","")&IF(RC[10]<>"",RC[10]&",","")&IF(RC[11]<>"",RC[11]&",","")&IF(RC[12]<>"",RC[12],"")&")" -> _rs30.setData("war3mapImported\\AZ_LCguanyu_T1.mdl",Prop.ATK,1.95,10,0,1,900,0.6,5,60,30) | F14: "war3mapImported\\AZ_LCguanyu_T1.mdl" | G14: =VLOOKUP(RC[-6],ABIL!C1:C5,5,0) -> ATK | H14: =VLOOKUP(RC[-7],ABIL!C1:C7,7,0) -> 1.95 | J14: 10 | K14: 0 | L14: 1 | M14: 900 | N14: 0.6 | O14: 5 | P14: 60 | Q14: =2*RC[-1]/(RC[-2]-1) -> 30
A15: 31 | B15: =VLOOKUP(RC[-1],ABIL!C1:C2,2,0) -> 天问 | C15: =VLOOKUP(RC[-2],ABIL!C1:C3,3,0) -> 主动 | D15: =IF(RC[5]<>"","攻击时有"&RC[5]&"%概率|n","")&IF(RC[8]>1,"在"&(RC[7]*RC[8])&"秒内"&RC[8]&"次","")&"对扇形区域"&"发射"&RC[11]&"枚弹幕"&"造成伤害!" -> 在1秒内2次对扇形区域发射5枚弹幕造成伤害! | E15: ="_rs"&RC[-4]&".setData("&IF(RC[1]<>"",RC[1]&",","")&IF(RC[2]<>"","Prop."&RC[2]&",","")&IF(RC[3]<>"",RC[3]&",","")&IF(RC[4]<>"",RC[4]&",","")&IF(RC[5]<>"",RC[5]&",","")&IF(RC[6]<>"",RC[6]&",","")&IF(RC[7]<>"",RC[7]&",","")&IF(RC[8]<>"",RC[8]&",","")&IF(RC[9]<>"",RC[9]&",","")&IF(RC[10]<>"",RC[10]&",","")&IF(RC[11]<>"",RC[11]&",","")&IF(RC[12]<>"",RC[12],"")&")" -> _rs31.setData("war3mapImported\\AZ_Kaer_D2.mdl",Prop.ALL_MAIN,0.73,10,0.5,2,900,0.6,5,60,30) | F15: "war3mapImported\\AZ_Kaer_D2.mdl" | G15: =VLOOKUP(RC[-6],ABIL!C1:C5,5,0) -> ALL_MAIN | H15: =VLOOKUP(RC[-7],ABIL!C1:C7,7,0) -> 0.73 | J15: 10 | K15: 0.5 | L15: 2 | M15: 900 | N15: 0.6 | O15: 5 | P15: 60 | Q15: =2*RC[-1]/(RC[-2]-1) -> 30
A16: 32 | B16: =VLOOKUP(RC[-1],ABIL!C1:C2,2,0) -> 碧空 | C16: =VLOOKUP(RC[-2],ABIL!C1:C3,3,0) -> 主动 | D16: =IF(RC[5]<>"","攻击时有"&RC[5]&"%概率|n","")&IF(RC[8]>1,"在"&(RC[7]*RC[8])&"秒内"&RC[8]&"次","")&"对扇形区域"&"发射"&RC[11]&"枚弹幕"&"造成伤害!" -> 在1秒内2次对扇形区域发射5枚弹幕造成伤害! | E16: ="_rs"&RC[-4]&".setData("&IF(RC[1]<>"",RC[1]&",","")&IF(RC[2]<>"","Prop."&RC[2]&",","")&IF(RC[3]<>"",RC[3]&",","")&IF(RC[4]<>"",RC[4]&",","")&IF(RC[5]<>"",RC[5]&",","")&IF(RC[6]<>"",RC[6]&",","")&IF(RC[7]<>"",RC[7]&",","")&IF(RC[8]<>"",RC[8]&",","")&IF(RC[9]<>"",RC[9]&",","")&IF(RC[10]<>"",RC[10]&",","")&IF(RC[11]<>"",RC[11]&",","")&IF(RC[12]<>"",RC[12],"")&")" -> _rs32.setData("war3mapImported\\AZ_Goods_springwater_Target(3).mdl",Prop.ALL,0.98,10,0.5,2,900,0.6,5,60,30) | F16: "war3mapImported\\AZ_Goods_springwater_Target(3).mdl" | G16: =VLOOKUP(RC[-6],ABIL!C1:C5,5,0) -> ALL | H16: =VLOOKUP(RC[-7],ABIL!C1:C7,7,0) -> 0.98 | J16: 10 | K16: 0.5 | L16: 2 | M16: 900 | N16: 0.6 | O16: 5 | P16: 60 | Q16: =2*RC[-1]/(RC[-2]-1) -> 30
A17: 33 | B17: =VLOOKUP(RC[-1],ABIL!C1:C2,2,0) -> 明月 | C17: =VLOOKUP(RC[-2],ABIL!C1:C3,3,0) -> 主动 | D17: =IF(RC[5]<>"","攻击时有"&RC[5]&"%概率|n","")&IF(RC[8]>1,"在"&(RC[7]*RC[8])&"秒内"&RC[8]&"次","")&"对扇形区域"&"发射"&RC[11]&"枚弹幕"&"造成伤害!" -> 对扇形区域发射5枚弹幕造成伤害! | E17: ="_rs"&RC[-4]&".setData("&IF(RC[1]<>"",RC[1]&",","")&IF(RC[2]<>"","Prop."&RC[2]&",","")&IF(RC[3]<>"",RC[3]&",","")&IF(RC[4]<>"",RC[4]&",","")&IF(RC[5]<>"",RC[5]&",","")&IF(RC[6]<>"",RC[6]&",","")&IF(RC[7]<>"",RC[7]&",","")&IF(RC[8]<>"",RC[8]&",","")&IF(RC[9]<>"",RC[9]&",","")&IF(RC[10]<>"",RC[10]&",","")&IF(RC[11]<>"",RC[11]&",","")&IF(RC[12]<>"",RC[12],"")&")" -> _rs33.setData("war3mapImported\\AZ_AurelVlaicu_E3.mdl",Prop.MAIN,5.85,10,0,1,900,0.6,5,60,30) | F17: "war3mapImported\\AZ_AurelVlaicu_E3.mdl" | G17: =VLOOKUP(RC[-6],ABIL!C1:C5,5,0) -> MAIN | H17: =VLOOKUP(RC[-7],ABIL!C1:C7,7,0) -> 5.85 | J17: 10 | K17: 0 | L17: 1 | M17: 900 | N17: 0.6 | O17: 5 | P17: 60 | Q17: =2*RC[-1]/(RC[-2]-1) -> 30
A18: 64 | B18: =VLOOKUP(RC[-1],ABIL!C1:C2,2,0) -> 人生如烟 | C18: =VLOOKUP(RC[-2],ABIL!C1:C3,3,0) -> 被动 | D18: =IF(RC[5]<>"","攻击时有"&RC[5]&"%概率|n","")&IF(RC[8]>1,"在"&(RC[7]*RC[8])&"秒内"&RC[8]&"次","")&"对扇形区域"&"发射"&RC[11]&"枚弹幕"&"造成伤害!" -> 攻击时有10%概率|n对扇形区域发射7枚弹幕造成伤害! | E18: ="_rs"&RC[-4]&".setData("&IF(RC[1]<>"",RC[1]&",","")&IF(RC[2]<>"","Prop."&RC[2]&",","")&IF(RC[3]<>"",RC[3]&",","")&IF(RC[4]<>"",RC[4]&",","")&IF(RC[5]<>"",RC[5]&",","")&IF(RC[6]<>"",RC[6]&",","")&IF(RC[7]<>"",RC[7]&",","")&IF(RC[8]<>"",RC[8]&",","")&IF(RC[9]<>"",RC[9]&",","")&IF(RC[10]<>"",RC[10]&",","")&IF(RC[11]<>"",RC[11]&",","")&IF(RC[12]<>"",RC[12],"")&")" -> _rs64.setData("war3mapImported\\AZ_Lina_F.mdl",Prop.ALL,11.7,10,5,0,1,900,0.6,7,60,20) | F18: "war3mapImported\\AZ_Lina_F.mdl" | G18: =VLOOKUP(RC[-6],ABIL!C1:C5,5,0) -> ALL | H18: =VLOOKUP(RC[-7],ABIL!C1:C7,7,0) -> 11.7 | I18: 10 | J18: 5 | K18: 0 | L18: 1 | M18: 900 | N18: 0.6 | O18: 7 | P18: 60 | Q18: =2*RC[-1]/(RC[-2]-1) -> 20

Sheet: 线性延迟
A1: INDEX | B1: NAME | C1: ACTIVE | D1: TIP | E1: CODE | F1: 特效 | G1: 特效缩放 | H1: 伤害范围 | I1: 属性关联 | J1: 伤害系数 | K1: 释放概率 | L1: CD | M1: 释放延迟 | N1: 释放次数 | O1: 是否受到1次伤害 | P1: 线条数 | Q1: 发射偏移 | R1: 递增角度 | S1: 延迟 | T1: 线上条数 | U1: 线上间隔
A2: 18 | B2: =VLOOKUP(RC[-1],ABIL!C1:C2,2,0) -> 问心 | C2: =VLOOKUP(RC[-2],ABIL!C1:C3,3,0) -> 被动 | D2: =IF(RC[7]<>"","攻击时有"&RC[7]&"%概率|n","")&IF(RC[10]>1,"在"&(RC[9]*RC[10])&"秒内"&RC[10]&"次","")&"对"&RC[12]&"条直线上的敌人造成伤害!" -> 攻击时有10%概率|n对3条直线上的敌人造成伤害! | E2: ="_rs"&RC[-4]&".setData("&IF(RC[1]<>"",RC[1]&",","")&IF(RC[2]<>"",RC[2]&",","")&IF(RC[3]<>"",RC[5]&",","")&IF(RC[4]<>"","Prop."&RC[4]&",","")&IF(RC[5]<>"",RC[5]&",","")&IF(RC[6]<>"",RC[6]&",","")&IF(RC[7]<>"",RC[7]&",","")&IF(RC[8]<>"",RC[8]&",","")&IF(RC[9]<>"",RC[9]&",","")&IF(RC[10]<>"",RC[10]&",","")&IF(RC[11]<>"",RC[11]&",","")&IF(RC[12]<>"",RC[12]&",","")&IF(RC[13]<>"",RC[13]&",","")&IF(RC[14]<>"",RC[14]&",","")&IF(RC[15]<>"",RC[15]&",","")&IF(RC[16]<>"",RC[16],"")&")" -> _rs18.setData("war3mapImported\\AZ_Alleria_W2.mdl",1,1.17,Prop.ALL,1.17,10,3,0,1,TRUE,3,50,50,0.3,3,150) | F2: "war3mapImported\\AZ_Alleria_W2.mdl" | G2: 1 | H2: 300 | I2: =VLOOKUP(RC1,ABIL!C1:C5,5,0) -> ALL | J2: =VLOOKUP(RC[-9],ABIL!C1:C7,7,0) -> 1.1700000000000002 | K2: 10 | L2: 3 | M2: 0 | N2: 1 | O2: 1 | P2: 3 | Q2: 50 | R2: =2*RC[-1]/(RC[-2]-1) -> 50 | S2: 0.3 | T2: 3 | U2: 150
A3: 19 | B3: =VLOOKUP(RC[-1],ABIL!C1:C2,2,0) -> 太虚 | C3: =VLOOKUP(RC[-2],ABIL!C1:C3,3,0) -> 被动 | D3: =IF(RC[7]<>"","攻击时有"&RC[7]&"%概率|n","")&IF(RC[10]>1,"在"&(RC[9]*RC[10])&"秒内"&RC[10]&"次","")&"对"&RC[12]&"条直线上的敌人造成伤害!" -> 攻击时有10%概率|n对3条直线上的敌人造成伤害! | E3: ="_rs"&RC[-4]&".setData("&IF(RC[1]<>"",RC[1]&",","")&IF(RC[2]<>"",RC[2]&",","")&IF(RC[3]<>"",RC[5]&",","")&IF(RC[4]<>"","Prop."&RC[4]&",","")&IF(RC[5]<>"",RC[5]&",","")&IF(RC[6]<>"",RC[6]&",","")&IF(RC[7]<>"",RC[7]&",","")&IF(RC[8]<>"",RC[8]&",","")&IF(RC[9]<>"",RC[9]&",","")&IF(RC[10]<>"",RC[10]&",","")&IF(RC[11]<>"",RC[11]&",","")&IF(RC[12]<>"",RC[12]&",","")&IF(RC[13]<>"",RC[13]&",","")&IF(RC[14]<>"",RC[14]&",","")&IF(RC[15]<>"",RC[15]&",","")&IF(RC[16]<>"",RC[16],"")&")" -> _rs19.setData("war3mapImported\\AZ_Akasha(2)_B.mdl",1,3.51,Prop.STR,3.51,10,3,0,1,TRUE,3,50,50,0.3,3,150) | F3: "war3mapImported\\AZ_Akasha(2)_B.mdl" | G3: 1 | H3: 300 | I3: =VLOOKUP(RC[-8],ABIL!C1:C5,5,0) -> STR | J3: =VLOOKUP(RC[-9],ABIL!C1:C7,7,0) -> 3.5100000000000002 | K3: 10 | L3: 3 | M3: 0 | N3: 1 | O3: 1 | P3: 3 | Q3: 50 | R3: =2*RC[-1]/(RC[-2]-1) -> 50 | S3: 0.3 | T3: 3 | U3: 150
A4: 20 | B4: =VLOOKUP(RC[-1],ABIL!C1:C2,2,0) -> 菩提 | C4: =VLOOKUP(RC[-2],ABIL!C1:C3,3,0) -> 被动 | D4: =IF(RC[7]<>"","攻击时有"&RC[7]&"%概率|n","")&IF(RC[10]>1,"在"&(RC[9]*RC[10])&"秒内"&RC[10]&"次","")&"对"&RC[12]&"条直线上的敌人造成伤害!" -> 攻击时有10%概率|n对3条直线上的敌人造成伤害! | E4: ="_rs"&RC[-4]&".setData("&IF(RC[1]<>"",RC[1]&",","")&IF(RC[2]<>"",RC[2]&",","")&IF(RC[3]<>"",RC[5]&",","")&IF(RC[4]<>"","Prop."&RC[4]&",","")&IF(RC[5]<>"",RC[5]&",","")&IF(RC[6]<>"",RC[6]&",","")&IF(RC[7]<>"",RC[7]&",","")&IF(RC[8]<>"",RC[8]&",","")&IF(RC[9]<>"",RC[9]&",","")&IF(RC[10]<>"",RC[10]&",","")&IF(RC[11]<>"",RC[11]&",","")&IF(RC[12]<>"",RC[12]&",","")&IF(RC[13]<>"",RC[13]&",","")&IF(RC[14]<>"",RC[14]&",","")&IF(RC[15]<>"",RC[15]&",","")&IF(RC[16]<>"",RC[16],"")&")" -> _rs20.setData("war3mapImported\\AZ_CocoChristmas_D_Impact.mdl",1,3.51,Prop.AGI,3.51,10,3,0,1,TRUE,3,50,50,0.3,3,150) | F4: "war3mapImported\\AZ_CocoChristmas_D_Impact.mdl" | G4: 1 | H4: 300 | I4: =VLOOKUP(RC[-8],ABIL!C1:C5,5,0) -> AGI | J4: =VLOOKUP(RC[-9],ABIL!C1:C7,7,0) -> 3.5100000000000002 | K4: 10 | L4: 3 | M4: 0 | N4: 1 | O4: 1 | P4: 3 | Q4: 50 | R4: =2*RC[-1]/(RC[-2]-1) -> 50 | S4: 0.3 | T4: 3 | U4: 150
A5: 21 | B5: =VLOOKUP(RC[-1],ABIL!C1:C2,2,0) -> 无音 | C5: =VLOOKUP(RC[-2],ABIL!C1:C3,3,0) -> 被动 | D5: =IF(RC[7]<>"","攻击时有"&RC[7]&"%概率|n","")&IF(RC[10]>1,"在"&(RC[9]*RC[10])&"秒内"&RC[10]&"次","")&"对"&RC[12]&"条直线上的敌人造成伤害!" -> 攻击时有10%概率|n对3条直线上的敌人造成伤害! | E5: ="_rs"&RC[-4]&".setData("&IF(RC[1]<>"",RC[1]&",","")&IF(RC[2]<>"",RC[2]&",","")&IF(RC[3]<>"",RC[5]&",","")&IF(RC[4]<>"","Prop."&RC[4]&",","")&IF(RC[5]<>"",RC[5]&",","")&IF(RC[6]<>"",RC[6]&",","")&IF(RC[7]<>"",RC[7]&",","")&IF(RC[8]<>"",RC[8]&",","")&IF(RC[9]<>"",RC[9]&",","")&IF(RC[10]<>"",RC[10]&",","")&IF(RC[11]<>"",RC[11]&",","")&IF(RC[12]<>"",RC[12]&",","")&IF(RC[13]<>"",RC[13]&",","")&IF(RC[14]<>"",RC[14]&",","")&IF(RC[15]<>"",RC[15]&",","")&IF(RC[16]<>"",RC[16],"")&")" -> _rs21.setData("war3mapImported\\AZ_Goods_Blink(3).mdl",1,3.51,Prop.INT,3.51,10,3,0,1,TRUE,3,50,50,0.3,3,150) | F5: "war3mapImported\\AZ_Goods_Blink(3).mdl" | G5: 1 | H5: 300 | I5: =VLOOKUP(RC[-8],ABIL!C1:C5,5,0) -> INT | J5: =VLOOKUP(RC[-9],ABIL!C1:C7,7,0) -> 3.5100000000000002 | K5: 10 | L5: 3 | M5: 0 | N5: 1 | O5: 1 | P5: 3 | Q5: 50 | R5: =2*RC[-1]/(RC[-2]-1) -> 50 | S5: 0.3 | T5: 3 | U5: 150
A6: 22 | B6: =VLOOKUP(RC[-1],ABIL!C1:C2,2,0) -> 悲问 | C6: =VLOOKUP(RC[-2],ABIL!C1:C3,3,0) -> 被动 | D6: =IF(RC[7]<>"","攻击时有"&RC[7]&"%概率|n","")&IF(RC[10]>1,"在"&(RC[9]*RC[10])&"秒内"&RC[10]&"次","")&"对"&RC[12]&"条直线上的敌人造成伤害!" -> 攻击时有10%概率|n对3条直线上的敌人造成伤害! | E6: ="_rs"&RC[-4]&".setData("&IF(RC[1]<>"",RC[1]&",","")&IF(RC[2]<>"",RC[2]&",","")&IF(RC[3]<>"",RC[5]&",","")&IF(RC[4]<>"","Prop."&RC[4]&",","")&IF(RC[5]<>"",RC[5]&",","")&IF(RC[6]<>"",RC[6]&",","")&IF(RC[7]<>"",RC[7]&",","")&IF(RC[8]<>"",RC[8]&",","")&IF(RC[9]<>"",RC[9]&",","")&IF(RC[10]<>"",RC[10]&",","")&IF(RC[11]<>"",RC[11]&",","")&IF(RC[12]<>"",RC[12]&",","")&IF(RC[13]<>"",RC[13]&",","")&IF(RC[14]<>"",RC[14]&",","")&IF(RC[15]<>"",RC[15]&",","")&IF(RC[16]<>"",RC[16],"")&")" -> _rs22.setData("war3mapImported\\AZ_Akasha(2)_B2.mdl",1,1.17,Prop.ATK,1.17,10,3,0,1,TRUE,3,50,50,0.3,3,150) | F6: "war3mapImported\\AZ_Akasha(2)_B2.mdl" | G6: 1 | H6: 300 | I6: =VLOOKUP(RC[-8],ABIL!C1:C5,5,0) -> ATK | J6: =VLOOKUP(RC[-9],ABIL!C1:C7,7,0) -> 1.17 | K6: 10 | L6: 3 | M6: 0 | N6: 1 | O6: 1 | P6: 3 | Q6: 50 | R6: =2*RC[-1]/(RC[-2]-1) -> 50 | S6: 0.3 | T6: 3 | U6: 150
A7: 23 | B7: =VLOOKUP(RC[-1],ABIL!C1:C2,2,0) -> 空蝉 | C7: =VLOOKUP(RC[-2],ABIL!C1:C3,3,0) -> 被动 | D7: =IF(RC[7]<>"","攻击时有"&RC[7]&"%概率|n","")&IF(RC[10]>1,"在"&(RC[9]*RC[10])&"秒内"&RC[10]&"次","")&"对"&RC[12]&"条直线上的敌人造成伤害!" -> 攻击时有10%概率|n对3条直线上的敌人造成伤害! | E7: ="_rs"&RC[-4]&".setData("&IF(RC[1]<>"",RC[1]&",","")&IF(RC[2]<>"",RC[2]&",","")&IF(RC[3]<>"",RC[5]&",","")&IF(RC[4]<>"","Prop."&RC[4]&",","")&IF(RC[5]<>"",RC[5]&",","")&IF(RC[6]<>"",RC[6]&",","")&IF(RC[7]<>"",RC[7]&",","")&IF(RC[8]<>"",RC[8]&",","")&IF(RC[9]<>"",RC[9]&",","")&IF(RC[10]<>"",RC[10]&",","")&IF(RC[11]<>"",RC[11]&",","")&IF(RC[12]<>"",RC[12]&",","")&IF(RC[13]<>"",RC[13]&",","")&IF(RC[14]<>"",RC[14]&",","")&IF(RC[15]<>"",RC[15]&",","")&IF(RC[16]<>"",RC[16],"")&")" -> _rs23.setData("war3mapImported\\AZ_Doomdragon_V2_Small.mdl",1,0.91,Prop.ALL_MAIN,0.91,10,3,0,1,TRUE,3,50,50,0.3,3,150) | F7: "war3mapImported\\AZ_Doomdragon_V2_Small.mdl" | G7: 1 | H7: 300 | I7: =VLOOKUP(RC[-8],ABIL!C1:C5,5,0) -> ALL_MAIN | J7: =VLOOKUP(RC[-9],ABIL!C1:C7,7,0) -> 0.91 | K7: 10 | L7: 3 | M7: 0 | N7: 1 | O7: 1 | P7: 3 | Q7: 50 | R7: =2*RC[-1]/(RC[-2]-1) -> 50 | S7: 0.3 | T7: 3 | U7: 150
A8: 24 | B8: =VLOOKUP(RC[-1],ABIL!C1:C2,2,0) -> 无涯 | C8: =VLOOKUP(RC[-2],ABIL!C1:C3,3,0) -> 被动 | D8: =IF(RC[7]<>"","攻击时有"&RC[7]&"%概率|n","")&IF(RC[10]>1,"在"&(RC[9]*RC[10])&"秒内"&RC[10]&"次","")&"对"&RC[12]&"条直线上的敌人造成伤害!" -> 攻击时有10%概率|n对3条直线上的敌人造成伤害! | E8: ="_rs"&RC[-4]&".setData("&IF(RC[1]<>"",RC[1]&",","")&IF(RC[2]<>"",RC[2]&",","")&IF(RC[3]<>"",RC[5]&",","")&IF(RC[4]<>"","Prop."&RC[4]&",","")&IF(RC[5]<>"",RC[5]&",","")&IF(RC[6]<>"",RC[6]&",","")&IF(RC[7]<>"",RC[7]&",","")&IF(RC[8]<>"",RC[8]&",","")&IF(RC[9]<>"",RC[9]&",","")&IF(RC[10]<>"",RC[10]&",","")&IF(RC[11]<>"",RC[11]&",","")&IF(RC[12]<>"",RC[12]&",","")&IF(RC[13]<>"",RC[13]&",","")&IF(RC[14]<>"",RC[14]&",","")&IF(RC[15]<>"",RC[15]&",","")&IF(RC[16]<>"",RC[16],"")&")" -> _rs24.setData("war3mapImported\\AZ_Goods_TP_Caster_effect(3).mdl",1,1.17,Prop.ALL,1.17,10,3,0,1,TRUE,3,50,50,0.3,3,150) | F8: "war3mapImported\\AZ_Goods_TP_Caster_effect(3).mdl" | G8: 1 | H8: 300 | I8: =VLOOKUP(RC[-8],ABIL!C1:C5,5,0) -> ALL | J8: =VLOOKUP(RC[-9],ABIL!C1:C7,7,0) -> 1.17 | K8: 10 | L8: 3 | M8: 0 | N8: 1 | O8: 1 | P8: 3 | Q8: 50 | R8: =2*RC[-1]/(RC[-2]-1) -> 50 | S8: 0.3 | T8: 3 | U8: 150
A9: 25 | B9: =VLOOKUP(RC[-1],ABIL!C1:C2,2,0) -> 无极 | C9: =VLOOKUP(RC[-2],ABIL!C1:C3,3,0) -> 被动 | D9: =IF(RC[7]<>"","攻击时有"&RC[7]&"%概率|n","")&IF(RC[10]>1,"在"&(RC[9]*RC[10])&"秒内"&RC[10]&"次","")&"对"&RC[12]&"条直线上的敌人造成伤害!" -> 攻击时有10%概率|n对3条直线上的敌人造成伤害! | E9: ="_rs"&RC[-4]&".setData("&IF(RC[1]<>"",RC[1]&",","")&IF(RC[2]<>"",RC[2]&",","")&IF(RC[3]<>"",RC[5]&",","")&IF(RC[4]<>"","Prop."&RC[4]&",","")&IF(RC[5]<>"",RC[5]&",","")&IF(RC[6]<>"",RC[6]&",","")&IF(RC[7]<>"",RC[7]&",","")&IF(RC[8]<>"",RC[8]&",","")&IF(RC[9]<>"",RC[9]&",","")&IF(RC[10]<>"",RC[10]&",","")&IF(RC[11]<>"",RC[11]&",","")&IF(RC[12]<>"",RC[12]&",","")&IF(RC[13]<>"",RC[13]&",","")&IF(RC[14]<>"",RC[14]&",","")&IF(RC[15]<>"",RC[15]&",","")&IF(RC[16]<>"",RC[16],"")&")" -> _rs25.setData("war3mapImported\\AZ_Lina(2)_G2_Target.mdl",1,3.51,Prop.MAIN,3.51,10,3,0,1,TRUE,3,50,50,0.3,3,150) | F9: "war3mapImported\\AZ_Lina(2)_G2_Target.mdl" | G9: 1 | H9: 300 | I9: =VLOOKUP(RC[-8],ABIL!C1:C5,5,0) -> MAIN | J9: =VLOOKUP(RC[-9],ABIL!C1:C7,7,0) -> 3.51 | K9: 10 | L9: 3 | M9: 0 | N9: 1 | O9: 1 | P9: 3 | Q9: 50 | R9: =2*RC[-1]/(RC[-2]-1) -> 50 | S9: 0.3 | T9: 3 | U9: 150
A10: 34 | B10: =VLOOKUP(RC[-1],ABIL!C1:C2,2,0) -> 幻梦穿 | C10: =VLOOKUP(RC[-2],ABIL!C1:C3,3,0) -> 被动 | D10: =IF(RC[7]<>"","攻击时有"&RC[7]&"%概率|n","")&IF(RC[10]>1,"在"&(RC[9]*RC[10])&"秒内"&RC[10]&"次","")&"对"&RC[12]&"条直线上的敌人造成伤害!" -> 攻击时有10%概率|n对5条直线上的敌人造成伤害! | E10: ="_rs"&RC[-4]&".setData("&IF(RC[1]<>"",RC[1]&",","")&IF(RC[2]<>"",RC[2]&",","")&IF(RC[3]<>"",RC[5]&",","")&IF(RC[4]<>"","Prop."&RC[4]&",","")&IF(RC[5]<>"",RC[5]&",","")&IF(RC[6]<>"",RC[6]&",","")&IF(RC[7]<>"",RC[7]&",","")&IF(RC[8]<>"",RC[8]&",","")&IF(RC[9]<>"",RC[9]&",","")&IF(RC[10]<>"",RC[10]&",","")&IF(RC[11]<>"",RC[11]&",","")&IF(RC[12]<>"",RC[12]&",","")&IF(RC[13]<>"",RC[13]&",","")&IF(RC[14]<>"",RC[14]&",","")&IF(RC[15]<>"",RC[15]&",","")&IF(RC[16]<>"",RC[16],"")&")" -> _rs34.setData("war3mapImported\\AZ_Doomdragon_V1_big.mdl",1,3.51,Prop.ALL,3.51,10,4,0,1,TRUE,5,0,72,0.3,4,150) | F10: "war3mapImported\\AZ_Doomdragon_V1_big.mdl" | G10: 1 | H10: 300 | I10: =VLOOKUP(RC[-8],ABIL!C1:C5,5,0) -> ALL | J10: =VLOOKUP(RC[-9],ABIL!C1:C7,7,0) -> 3.51 | K10: 10 | L10: 4 | M10: 0 | N10: 1 | O10: 1 | P10: 5 | Q10: 0 | R10: =360/RC[-2] -> 72 | S10: 0.3 | T10: 4 | U10: 150
A11: 35 | B11: =VLOOKUP(RC[-1],ABIL!C1:C2,2,0) -> 绕指柔 | C11: =VLOOKUP(RC[-2],ABIL!C1:C3,3,0) -> 被动 | D11: =IF(RC[7]<>"","攻击时有"&RC[7]&"%概率|n","")&IF(RC[10]>1,"在"&(RC[9]*RC[10])&"秒内"&RC[10]&"次","")&"对"&RC[12]&"条直线上的敌人造成伤害!" -> 攻击时有10%概率|n对5条直线上的敌人造成伤害! | E11: ="_rs"&RC[-4]&".setData("&IF(RC[1]<>"",RC[1]&",","")&IF(RC[2]<>"",RC[2]&",","")&IF(RC[3]<>"",RC[5]&",","")&IF(RC[4]<>"","Prop."&RC[4]&",","")&IF(RC[5]<>"",RC[5]&",","")&IF(RC[6]<>"",RC[6]&",","")&IF(RC[7]<>"",RC[7]&",","")&IF(RC[8]<>"",RC[8]&",","")&IF(RC[9]<>"",RC[9]&",","")&IF(RC[10]<>"",RC[10]&",","")&IF(RC[11]<>"",RC[11]&",","")&IF(RC[12]<>"",RC[12]&",","")&IF(RC[13]<>"",RC[13]&",","")&IF(RC[14]<>"",RC[14]&",","")&IF(RC[15]<>"",RC[15]&",","")&IF(RC[16]<>"",RC[16],"")&")" -> _rs35.setData("war3mapImported\\AZ_EarthShaker_F.mdl",1,10.53,Prop.STR,10.53,10,4,0,1,TRUE,5,0,72,0.3,4,150) | F11: "war3mapImported\\AZ_EarthShaker_F.mdl" | G11: 1 | H11: 300 | I11: =VLOOKUP(RC[-8],ABIL!C1:C5,5,0) -> STR | J11: =VLOOKUP(RC[-9],ABIL!C1:C7,7,0) -> 10.53 | K11: 10 | L11: 4 | M11: 0 | N11: 1 | O11: 1 | P11: 5 | Q11: 0 | R11: =360/RC[-2] -> 72 | S11: 0.3 | T11: 4 | U11: 150
A12: 36 | B12: =VLOOKUP(RC[-1],ABIL!C1:C2,2,0) -> 郁浮欢 | C12: =VLOOKUP(RC[-2],ABIL!C1:C3,3,0) -> 被动 | D12: =IF(RC[7]<>"","攻击时有"&RC[7]&"%概率|n","")&IF(RC[10]>1,"在"&(RC[9]*RC[10])&"秒内"&RC[10]&"次","")&"对"&RC[12]&"条直线上的敌人造成伤害!" -> 攻击时有10%概率|n对5条直线上的敌人造成伤害! | E12: ="_rs"&RC[-4]&".setData("&IF(RC[1]<>"",RC[1]&",","")&IF(RC[2]<>"",RC[2]&",","")&IF(RC[3]<>"",RC[5]&",","")&IF(RC[4]<>"","Prop."&RC[4]&",","")&IF(RC[5]<>"",RC[5]&",","")&IF(RC[6]<>"",RC[6]&",","")&IF(RC[7]<>"",RC[7]&",","")&IF(RC[8]<>"",RC[8]&",","")&IF(RC[9]<>"",RC[9]&",","")&IF(RC[10]<>"",RC[10]&",","")&IF(RC[11]<>"",RC[11]&",","")&IF(RC[12]<>"",RC[12]&",","")&IF(RC[13]<>"",RC[13]&",","")&IF(RC[14]<>"",RC[14]&",","")&IF(RC[15]<>"",RC[15]&",","")&IF(RC[16]<>"",RC[16],"")&")" -> _rs36.setData("war3mapImported\\AZ_PotM(1)_T1_Impact.mdl",1,10.53,Prop.AGI,10.53,10,4,0,1,TRUE,5,0,72,0.3,4,150) | F12: "war3mapImported\\AZ_PotM(1)_T1_Impact.mdl" | G12: 1 | H12: 300 | I12: =VLOOKUP(RC[-8],ABIL!C1:C5,5,0) -> AGI | J12: =VLOOKUP(RC[-9],ABIL!C1:C7,7,0) -> 10.53 | K12: 10 | L12: 4 | M12: 0 | N12: 1 | O12: 1 | P12: 5 | Q12: 0 | R12: =360/RC[-2] -> 72 | S12: 0.3 | T12: 4 | U12: 150
A13: 37 | B13: =VLOOKUP(RC[-1],ABIL!C1:C2,2,0) -> 夜寒凉 | C13: =VLOOKUP(RC[-2],ABIL!C1:C3,3,0) -> 被动 | D13: =IF(RC[7]<>"","攻击时有"&RC[7]&"%概率|n","")&IF(RC[10]>1,"在"&(RC[9]*RC[10])&"秒内"&RC[10]&"次","")&"对"&RC[12]&"条直线上的敌人造成伤害!" -> 攻击时有10%概率|n对5条直线上的敌人造成伤害! | E13: ="_rs"&RC[-4]&".setData("&IF(RC[1]<>"",RC[1]&",","")&IF(RC[2]<>"",RC[2]&",","")&IF(RC[3]<>"",RC[5]&",","")&IF(RC[4]<>"","Prop."&RC[4]&",","")&IF(RC[5]<>"",RC[5]&",","")&IF(RC[6]<>"",RC[6]&",","")&IF(RC[7]<>"",RC[7]&",","")&IF(RC[8]<>"",RC[8]&",","")&IF(RC[9]<>"",RC[9]&",","")&IF(RC[10]<>"",RC[10]&",","")&IF(RC[11]<>"",RC[11]&",","")&IF(RC[12]<>"",RC[12]&",","")&IF(RC[13]<>"",RC[13]&",","")&IF(RC[14]<>"",RC[14]&",","")&IF(RC[15]<>"",RC[15]&",","")&IF(RC[16]<>"",RC[16],"")&")" -> _rs37.setData("war3mapImported\\AZ_TormentedSoul_G1.mdl",1,10.53,Prop.INT,10.53,10,4,0,1,TRUE,5,0,72,0.3,4,150) | F13: "war3mapImported\\AZ_TormentedSoul_G1.mdl" | G13: 1 | H13: 300 | I13: =VLOOKUP(RC[-8],ABIL!C1:C5,5,0) -> INT | J13: =VLOOKUP(RC[-9],ABIL!C1:C7,7,0) -> 10.53 | K13: 10 | L13: 4 | M13: 0 | N13: 1 | O13: 1 | P13: 5 | Q13: 0 | R13: =360/RC[-2] -> 72 | S13: 0.3 | T13: 4 | U13: 150
A14: 38 | B14: =VLOOKUP(RC[-1],ABIL!C1:C2,2,0) -> 醉人间 | C14: =VLOOKUP(RC[-2],ABIL!C1:C3,3,0) -> 被动 | D14: =IF(RC[7]<>"","攻击时有"&RC[7]&"%概率|n","")&IF(RC[10]>1,"在"&(RC[9]*RC[10])&"秒内"&RC[10]&"次","")&"对"&RC[12]&"条直线上的敌人造成伤害!" -> 攻击时有10%概率|n对5条直线上的敌人造成伤害! | E14: ="_rs"&RC[-4]&".setData("&IF(RC[1]<>"",RC[1]&",","")&IF(RC[2]<>"",RC[2]&",","")&IF(RC[3]<>"",RC[5]&",","")&IF(RC[4]<>"","Prop."&RC[4]&",","")&IF(RC[5]<>"",RC[5]&",","")&IF(RC[6]<>"",RC[6]&",","")&IF(RC[7]<>"",RC[7]&",","")&IF(RC[8]<>"",RC[8]&",","")&IF(RC[9]<>"",RC[9]&",","")&IF(RC[10]<>"",RC[10]&",","")&IF(RC[11]<>"",RC[11]&",","")&IF(RC[12]<>"",RC[12]&",","")&IF(RC[13]<>"",RC[13]&",","")&IF(RC[14]<>"",RC[14]&",","")&IF(RC[15]<>"",RC[15]&",","")&IF(RC[16]<>"",RC[16],"")&")" -> _rs38.setData("war3mapImported\\AZ_Goods_TP_Caster(3).mdl",1,3.51,Prop.ATK,3.51,10,4,0,1,TRUE,5,0,72,0.3,4,150) | F14: "war3mapImported\\AZ_Goods_TP_Caster(3).mdl" | G14: 1 | H14: 300 | I14: =VLOOKUP(RC[-8],ABIL!C1:C5,5,0) -> ATK | J14: =VLOOKUP(RC[-9],ABIL!C1:C7,7,0) -> 3.51 | K14: 10 | L14: 4 | M14: 0 | N14: 1 | O14: 1 | P14: 5 | Q14: 0 | R14: =360/RC[-2] -> 72 | S14: 0.3 | T14: 4 | U14: 150
A15: 39 | B15: =VLOOKUP(RC[-1],ABIL!C1:C2,2,0) -> 万里穹 | C15: =VLOOKUP(RC[-2],ABIL!C1:C3,3,0) -> 被动 | D15: =IF(RC[7]<>"","攻击时有"&RC[7]&"%概率|n","")&IF(RC[10]>1,"在"&(RC[9]*RC[10])&"秒内"&RC[10]&"次","")&"对"&RC[12]&"条直线上的敌人造成伤害!" -> 攻击时有10%概率|n对5条直线上的敌人造成伤害! | E15: ="_rs"&RC[-4]&".setData("&IF(RC[1]<>"",RC[1]&",","")&IF(RC[2]<>"",RC[2]&",","")&IF(RC[3]<>"",RC[5]&",","")&IF(RC[4]<>"","Prop."&RC[4]&",","")&IF(RC[5]<>"",RC[5]&",","")&IF(RC[6]<>"",RC[6]&",","")&IF(RC[7]<>"",RC[7]&",","")&IF(RC[8]<>"",RC[8]&",","")&IF(RC[9]<>"",RC[9]&",","")&IF(RC[10]<>"",RC[10]&",","")&IF(RC[11]<>"",RC[11]&",","")&IF(RC[12]<>"",RC[12]&",","")&IF(RC[13]<>"",RC[13]&",","")&IF(RC[14]<>"",RC[14]&",","")&IF(RC[15]<>"",RC[15]&",","")&IF(RC[16]<>"",RC[16],"")&")" -> _rs39.setData("war3mapImported\\AZ_Dragonus_E1.mdl",1,2.73,Prop.ALL_MAIN,2.73,10,4,0,1,TRUE,5,0,72,0.3,4,150) | F15: "war3mapImported\\AZ_Dragonus_E1.mdl" | G15: 1 | H15: 300 | I15: =VLOOKUP(RC[-8],ABIL!C1:C5,5,0) -> ALL_MAIN | J15: =VLOOKUP(RC[-9],ABIL!C1:C7,7,0) -> 2.73 | K15: 10 | L15: 4 | M15: 0 | N15: 1 | O15: 1 | P15: 5 | Q15: 0 | R15: =360/RC[-2] -> 72 | S15: 0.3 | T15: 4 | U15: 150
A16: 65 | B16: =VLOOKUP(RC[-1],ABIL!C1:C2,2,0) -> 肆无忌惮 | C16: =VLOOKUP(RC[-2],ABIL!C1:C3,3,0) -> 被动 | D16: =IF(RC[7]<>"","攻击时有"&RC[7]&"%概率|n","")&IF(RC[10]>1,"在"&(RC[9]*RC[10])&"秒内"&RC[10]&"次","")&"对"&RC[12]&"条直线上的敌人造成伤害!" -> 攻击时有10%概率|n对5条直线上的敌人造成伤害! | E16: ="_rs"&RC[-4]&".setData("&IF(RC[1]<>"",RC[1]&",","")&IF(RC[2]<>"",RC[2]&",","")&IF(RC[3]<>"",RC[5]&",","")&IF(RC[4]<>"","Prop."&RC[4]&",","")&IF(RC[5]<>"",RC[5]&",","")&IF(RC[6]<>"",RC[6]&",","")&IF(RC[7]<>"",RC[7]&",","")&IF(RC[8]<>"",RC[8]&",","")&IF(RC[9]<>"",RC[9]&",","")&IF(RC[10]<>"",RC[10]&",","")&IF(RC[11]<>"",RC[11]&",","")&IF(RC[12]<>"",RC[12]&",","")&IF(RC[13]<>"",RC[13]&",","")&IF(RC[14]<>"",RC[14]&",","")&IF(RC[15]<>"",RC[15]&",","")&IF(RC[16]<>"",RC[16],"")&")" -> _rs65.setData("war3mapImported\\AZ_LeiJi01-Chen.mdl",1,28.08,Prop.MAIN,28.08,10,5,0,1,TRUE,5,0,72,0.3,5,150) | F16: "war3mapImported\\AZ_LeiJi01-Chen.mdl" | G16: 1 | H16: 300 | I16: =VLOOKUP(RC[-8],ABIL!C1:C5,5,0) -> MAIN | J16: =VLOOKUP(RC[-9],ABIL!C1:C7,7,0) -> 28.08 | K16: 10 | L16: 5 | M16: 0 | N16: 1 | O16: 1 | P16: 5 | Q16: 0 | R16: =360/RC[-2] -> 72 | S16: 0.3 | T16: 5 | U16: 150

Sheet: 线性
A1: INDEX | B1: NAME | C1: ACTIVE | D1: TIP | E1: CODE | F1: 特效 | G1: 特效缩放 | H1: 释放概率 | I1: 属性关联 | J1: 伤害系数 | K1: CD | L1: 释放延迟 | M1: 释放次数 | N1: 伤害范围 | O1: 线上条数 | P1: 线上间隔
A2: 41 | B2: =VLOOKUP(RC[-1],ABIL!C1:C2,2,0) -> 阳关调 | C2: =VLOOKUP(RC[-2],ABIL!C1:C3,3,0) -> 被动 | D2: =IF(RC[4]<>"","攻击时有"&RC[4]&"%概率|n","")&IF(RC[9]>1,"在"&(RC[9]*RC[8])&"秒内"&RC[9]&"次","")&"对"&RC[11]&"条直线上的敌人造成伤害!" -> 攻击时有10%概率|n对3条直线上的敌人造成伤害! | E2: ="_rs"&RC[-4]&".setData("&IF(RC[1]<>"",RC[1]&",","")&IF(RC[2]<>"",RC[2]&",","")&IF(RC[3]<>"",RC[3]&",","")&IF(RC[4]<>"","Prop."&RC[4]&",","")&IF(RC[5]<>"",RC[5]&",","")&IF(RC[6]<>"",RC[6]&",","")&IF(RC[7]<>"",RC[7]&",","")&IF(RC[8]<>"",RC[8]&",","")&IF(RC[9]<>"",RC[9]&",","")&IF(RC[10]<>"",RC[10]&",","")&IF(RC[11]<>"",RC[11],"")&")" -> _rs41.setData("war3mapImported\\AZ_LuanZhan.mdl",1,10,Prop.MAIN,10.53,4,0,1,200,3,200) | F2: "war3mapImported\\AZ_LuanZhan.mdl" | G2: 1 | H2: 10 | I2: =VLOOKUP(RC1,ABIL!C1:C5,5,0) -> MAIN | J2: =VLOOKUP(RC[-9],ABIL!C1:C7,7,0) -> 10.53 | K2: 4 | L2: 0 | M2: 1 | N2: 200 | O2: 3 | P2: 200
A3: 43 | B3: =VLOOKUP(RC[-1],ABIL!C1:C2,2,0) -> 凡世忘 | C3: =VLOOKUP(RC[-2],ABIL!C1:C3,3,0) -> 主动 | D3: =IF(RC[4]<>"","攻击时有"&RC[4]&"%概率|n","")&IF(RC[9]>1,"在"&(RC[9]*RC[8])&"秒内"&RC[9]&"次","")&"对"&RC[11]&"条直线上的敌人造成伤害!" -> 在1秒内2次对3条直线上的敌人造成伤害! | E3: ="_rs"&RC[-4]&".setData("&IF(RC[1]<>"",RC[1]&",","")&IF(RC[2]<>"",RC[2]&",","")&IF(RC[3]<>"",RC[3]&",","")&IF(RC[4]<>"","Prop."&RC[4]&",","")&IF(RC[5]<>"",RC[5]&",","")&IF(RC[6]<>"",RC[6]&",","")&IF(RC[7]<>"",RC[7]&",","")&IF(RC[8]<>"",RC[8]&",","")&IF(RC[9]<>"",RC[9]&",","")&IF(RC[10]<>"",RC[10]&",","")&IF(RC[11]<>"",RC[11],"")&")" -> _rs43.setData("war3mapImported\\AZ_Goods_TP_Target_effect(3).mdl",1,Prop.STR,7.9,10,0.5,2,200,3,200) | F3: "war3mapImported\\AZ_Goods_TP_Target_effect(3).mdl" | G3: 1 | I3: =VLOOKUP(RC1,ABIL!C1:C5,5,0) -> STR | J3: =VLOOKUP(RC[-9],ABIL!C1:C7,7,0) -> 7.9 | K3: 10 | L3: 0.5 | M3: 2 | N3: 200 | O3: 3 | P3: 200
A4: 44 | B4: =VLOOKUP(RC[-1],ABIL!C1:C2,2,0) -> 问苍天 | C4: =VLOOKUP(RC[-2],ABIL!C1:C3,3,0) -> 主动 | D4: =IF(RC[4]<>"","攻击时有"&RC[4]&"%概率|n","")&IF(RC[9]>1,"在"&(RC[9]*RC[8])&"秒内"&RC[9]&"次","")&"对"&RC[11]&"条直线上的敌人造成伤害!" -> 在1秒内2次对3条直线上的敌人造成伤害! | E4: ="_rs"&RC[-4]&".setData("&IF(RC[1]<>"",RC[1]&",","")&IF(RC[2]<>"",RC[2]&",","")&IF(RC[3]<>"",RC[3]&",","")&IF(RC[4]<>"","Prop."&RC[4]&",","")&IF(RC[5]<>"",RC[5]&",","")&IF(RC[6]<>"",RC[6]&",","")&IF(RC[7]<>"",RC[7]&",","")&IF(RC[8]<>"",RC[8]&",","")&IF(RC[9]<>"",RC[9]&",","")&IF(RC[10]<>"",RC[10]&",","")&IF(RC[11]<>"",RC[11],"")&")" -> _rs44.setData("war3mapImported\\AZ_Coco_E2.mdl",1,Prop.AGI,7.9,10,0.5,2,200,3,200) | F4: "war3mapImported\\AZ_Coco_E2.mdl" | G4: 1 | I4: =VLOOKUP(RC1,ABIL!C1:C5,5,0) -> AGI | J4: =VLOOKUP(RC[-9],ABIL!C1:C7,7,0) -> 7.9 | K4: 10 | L4: 0.5 | M4: 2 | N4: 200 | O4: 3 | P4: 200
A5: 45 | B5: =VLOOKUP(RC[-1],ABIL!C1:C2,2,0) -> 空断肠 | C5: =VLOOKUP(RC[-2],ABIL!C1:C3,3,0) -> 主动 | D5: =IF(RC[4]<>"","攻击时有"&RC[4]&"%概率|n","")&IF(RC[9]>1,"在"&(RC[9]*RC[8])&"秒内"&RC[9]&"次","")&"对"&RC[11]&"条直线上的敌人造成伤害!" -> 在1秒内2次对3条直线上的敌人造成伤害! | E5: ="_rs"&RC[-4]&".setData("&IF(RC[1]<>"",RC[1]&",","")&IF(RC[2]<>"",RC[2]&",","")&IF(RC[3]<>"",RC[3]&",","")&IF(RC[4]<>"","Prop."&RC[4]&",","")&IF(RC[5]<>"",RC[5]&",","")&IF(RC[6]<>"",RC[6]&",","")&IF(RC[7]<>"",RC[7]&",","")&IF(RC[8]<>"",RC[8]&",","")&IF(RC[9]<>"",RC[9]&",","")&IF(RC[10]<>"",RC[10]&",","")&IF(RC[11]<>"",RC[11],"")&")" -> _rs45.setData("war3mapImported\\AZ_Goods_Lvlup.mdl",1,Prop.INT,7.9,10,0.5,2,200,3,200) | F5: "war3mapImported\\AZ_Goods_Lvlup.mdl" | G5: 1 | I5: =VLOOKUP(RC1,ABIL!C1:C5,5,0) -> INT | J5: =VLOOKUP(RC[-9],ABIL!C1:C7,7,0) -> 7.9 | K5: 10 | L5: 0.5 | M5: 2 | N5: 200 | O5: 3 | P5: 200
A6: 46 | B6: =VLOOKUP(RC[-1],ABIL!C1:C2,2,0) -> 明月孤 | C6: =VLOOKUP(RC[-2],ABIL!C1:C3,3,0) -> 主动 | D6: =IF(RC[4]<>"","攻击时有"&RC[4]&"%概率|n","")&IF(RC[9]>1,"在"&(RC[9]*RC[8])&"秒内"&RC[9]&"次","")&"对"&RC[11]&"条直线上的敌人造成伤害!" -> 对3条直线上的敌人造成伤害! | E6: ="_rs"&RC[-4]&".setData("&IF(RC[1]<>"",RC[1]&",","")&IF(RC[2]<>"",RC[2]&",","")&IF(RC[3]<>"",RC[3]&",","")&IF(RC[4]<>"","Prop."&RC[4]&",","")&IF(RC[5]<>"",RC[5]&",","")&IF(RC[6]<>"",RC[6]&",","")&IF(RC[7]<>"",RC[7]&",","")&IF(RC[8]<>"",RC[8]&",","")&IF(RC[9]<>"",RC[9]&",","")&IF(RC[10]<>"",RC[10]&",","")&IF(RC[11]<>"",RC[11],"")&")" -> _rs46.setData("war3mapImported\\AZ_LuanZhan.mdl",1,Prop.ATK,5.27,10,0,1,200,3,200) | F6: "war3mapImported\\AZ_LuanZhan.mdl" | G6: 1 | I6: =VLOOKUP(RC1,ABIL!C1:C5,5,0) -> ATK | J6: =VLOOKUP(RC[-9],ABIL!C1:C7,7,0) -> 5.27 | K6: 10 | L6: 0 | M6: 1 | N6: 200 | O6: 3 | P6: 200
A7: 57 | B7: =VLOOKUP(RC[-1],ABIL!C1:C2,2,0) -> 浮云过影 | C7: =VLOOKUP(RC[-2],ABIL!C1:C3,3,0) -> 被动 | D7: =IF(RC[4]<>"","攻击时有"&RC[4]&"%概率|n","")&IF(RC[9]>1,"在"&(RC[9]*RC[8])&"秒内"&RC[9]&"次","")&"对"&RC[11]&"条直线上的敌人造成伤害!" -> 攻击时有10%概率|n对3条直线上的敌人造成伤害! | E7: ="_rs"&RC[-4]&".setData("&IF(RC[1]<>"",RC[1]&",","")&IF(RC[2]<>"",RC[2]&",","")&IF(RC[3]<>"",RC[3]&",","")&IF(RC[4]<>"","Prop."&RC[4]&",","")&IF(RC[5]<>"",RC[5]&",","")&IF(RC[6]<>"",RC[6]&",","")&IF(RC[7]<>"",RC[7]&",","")&IF(RC[8]<>"",RC[8]&",","")&IF(RC[9]<>"",RC[9]&",","")&IF(RC[10]<>"",RC[10]&",","")&IF(RC[11]<>"",RC[11],"")&")" -> _rs57.setData("war3mapImported\\AZ_CoCoGuanyu_E2.mdl",1,10,Prop.MAIN,28.08,5,0,1,200,3,200) | F7: "war3mapImported\\AZ_CoCoGuanyu_E2.mdl" | G7: 1 | H7: 10 | I7: =VLOOKUP(RC1,ABIL!C1:C5,5,0) -> MAIN | J7: =VLOOKUP(RC[-9],ABIL!C1:C7,7,0) -> 28.08 | K7: 5 | L7: 0 | M7: 1 | N7: 200 | O7: 3 | P7: 200

Sheet: 圆形
A1: INDEX | B1: NAME | C1: ACTIVE | D1: TIP | E1: CODE | F1: 是否自身点 | G1: 释放概率 | H1: 属性关联 | I1: 伤害系数 | J1: 伤害范围 | K1: CD | L1: 释放延迟 | M1: 释放次数 | N1: 范围特效 | O1: 点特效
A2: 10 | B2: =VLOOKUP(RC[-1],ABIL!C1:C2,2,0) -> 虎霸 | C2: =VLOOKUP(RC[-2],ABIL!C1:C3,3,0) -> 被动 | D2: =IF(RC[3]<>"","攻击时有"&RC[3]&"%概率|n","")&IF(RC[9]>1,"在"&(RC[9]*RC[8])&"秒内"&RC[9]&"次","")&"对"&RC[6]&"范围内的敌人造成伤害!" -> 攻击时有10%概率|n对500范围内的敌人造成伤害! | E2: ="_rs"&RC[-4]&".setData("&IF(RC[1]<>"",RC[1]&",","")&IF(RC[2]<>"",RC[2]&",","")&IF(RC[3]<>"","Prop."&RC[3]&",","")&IF(RC[4]<>"",RC[4]&",","")&IF(RC[5]<>"",RC[5]&",","")&IF(RC[6]<>"",RC[6]&",","")&IF(RC[7]<>"",RC[7]&",","")&IF(RC[8]<>"",RC[8]&",","")&IF(RC[9]<>"",RC[9]&",","")&IF(RC[10]<>"",RC[10],"")&")" -> _rs10.setData(FALSE,10,Prop.ALL,0.91,500,3,0,1,"war3mapImported\\Sven_R1.mdl","") | F2: 0 | G2: 10 | H2: =VLOOKUP(RC1,ABIL!C1:C5,5,0) -> ALL | I2: =VLOOKUP(RC[-8],ABIL!C1:C7,7,0) -> 0.91 | J2: 500 | K2: 3 | L2: 0 | M2: 1 | N2: "war3mapImported\\Sven_R1.mdl" | O2: ""
A3: 11 | B3: =VLOOKUP(RC[-1],ABIL!C1:C2,2,0) -> 般若 | C3: =VLOOKUP(RC[-2],ABIL!C1:C3,3,0) -> 被动 | D3: =IF(RC[3]<>"","攻击时有"&RC[3]&"%概率|n","")&IF(RC[9]>1,"在"&(RC[9]*RC[8])&"秒内"&RC[9]&"次","")&"对"&RC[6]&"范围内的敌人造成伤害!" -> 攻击时有10%概率|n对500范围内的敌人造成伤害! | E3: ="_rs"&RC[-4]&".setData("&IF(RC[1]<>"",RC[1]&",","")&IF(RC[2]<>"",RC[2]&",","")&IF(RC[3]<>"","Prop."&RC[3]&",","")&IF(RC[4]<>"",RC[4]&",","")&IF(RC[5]<>"",RC[5]&",","")&IF(RC[6]<>"",RC[6]&",","")&IF(RC[7]<>"",RC[7]&",","")&IF(RC[8]<>"",RC[8]&",","")&IF(RC[9]<>"",RC[9]&",","")&IF(RC[10]<>"",RC[10],"")&")" -> _rs11.setData(FALSE,10,Prop.STR,2.73,500,3,0,1,"war3mapImported\\AZ_Nevermore_X(1).mdl","") | F3: 0 | G3: 10 | H3: =VLOOKUP(RC1,ABIL!C1:C5,5,0) -> STR | I3: =VLOOKUP(RC[-8],ABIL!C1:C7,7,0) -> 2.73 | J3: 500 | K3: 3 | L3: 0 | M3: 1 | N3: "war3mapImported\\AZ_Nevermore_X(1).mdl" | O3: ""
A4: 12 | B4: =VLOOKUP(RC[-1],ABIL!C1:C2,2,0) -> 迎风 | C4: =VLOOKUP(RC[-2],ABIL!C1:C3,3,0) -> 被动 | D4: =IF(RC[3]<>"","攻击时有"&RC[3]&"%概率|n","")&IF(RC[9]>1,"在"&(RC[9]*RC[8])&"秒内"&RC[9]&"次","")&"对"&RC[6]&"范围内的敌人造成伤害!" -> 攻击时有10%概率|n对500范围内的敌人造成伤害! | E4: ="_rs"&RC[-4]&".setData("&IF(RC[1]<>"",RC[1]&",","")&IF(RC[2]<>"",RC[2]&",","")&IF(RC[3]<>"","Prop."&RC[3]&",","")&IF(RC[4]<>"",RC[4]&",","")&IF(RC[5]<>"",RC[5]&",","")&IF(RC[6]<>"",RC[6]&",","")&IF(RC[7]<>"",RC[7]&",","")&IF(RC[8]<>"",RC[8]&",","")&IF(RC[9]<>"",RC[9]&",","")&IF(RC[10]<>"",RC[10],"")&")" -> _rs12.setData(FALSE,10,Prop.AGI,2.73,500,3,0,1,"war3mapImported\\AZ_Lina(2)_T1_MagicMatrix.mdl","") | F4: 0 | G4: 10 | H4: =VLOOKUP(RC1,ABIL!C1:C5,5,0) -> AGI | I4: =VLOOKUP(RC[-8],ABIL!C1:C7,7,0) -> 2.73 | J4: 500 | K4: 3 | L4: 0 | M4: 1 | N4: "war3mapImported\\AZ_Lina(2)_T1_MagicMatrix.mdl" | O4: ""
A5: 13 | B5: =VLOOKUP(RC[-1],ABIL!C1:C2,2,0) -> 迷魂 | C5: =VLOOKUP(RC[-2],ABIL!C1:C3,3,0) -> 被动 | D5: =IF(RC[3]<>"","攻击时有"&RC[3]&"%概率|n","")&IF(RC[9]>1,"在"&(RC[9]*RC[8])&"秒内"&RC[9]&"次","")&"对"&RC[6]&"范围内的敌人造成伤害!" -> 攻击时有10%概率|n对500范围内的敌人造成伤害! | E5: ="_rs"&RC[-4]&".setData("&IF(RC[1]<>"",RC[1]&",","")&IF(RC[2]<>"",RC[2]&",","")&IF(RC[3]<>"","Prop."&RC[3]&",","")&IF(RC[4]<>"",RC[4]&",","")&IF(RC[5]<>"",RC[5]&",","")&IF(RC[6]<>"",RC[6]&",","")&IF(RC[7]<>"",RC[7]&",","")&IF(RC[8]<>"",RC[8]&",","")&IF(RC[9]<>"",RC[9]&",","")&IF(RC[10]<>"",RC[10],"")&")" -> _rs13.setData(FALSE,10,Prop.INT,2.73,500,3,0,1,"war3mapImported\\[Sepll]LinaSun _T1_MagicMatrix.mdl","") | F5: 0 | G5: 10 | H5: =VLOOKUP(RC1,ABIL!C1:C5,5,0) -> INT | I5: =VLOOKUP(RC[-8],ABIL!C1:C7,7,0) -> 2.73 | J5: 500 | K5: 3 | L5: 0 | M5: 1 | N5: "war3mapImported\\[Sepll]LinaSun _T1_MagicMatrix.mdl" | O5: ""
A6: 14 | B6: =VLOOKUP(RC[-1],ABIL!C1:C2,2,0) -> 破山 | C6: =VLOOKUP(RC[-2],ABIL!C1:C3,3,0) -> 被动 | D6: =IF(RC[3]<>"","攻击时有"&RC[3]&"%概率|n","")&IF(RC[9]>1,"在"&(RC[9]*RC[8])&"秒内"&RC[9]&"次","")&"对"&RC[6]&"范围内的敌人造成伤害!" -> 攻击时有10%概率|n对500范围内的敌人造成伤害! | E6: ="_rs"&RC[-4]&".setData("&IF(RC[1]<>"",RC[1]&",","")&IF(RC[2]<>"",RC[2]&",","")&IF(RC[3]<>"","Prop."&RC[3]&",","")&IF(RC[4]<>"",RC[4]&",","")&IF(RC[5]<>"",RC[5]&",","")&IF(RC[6]<>"",RC[6]&",","")&IF(RC[7]<>"",RC[7]&",","")&IF(RC[8]<>"",RC[8]&",","")&IF(RC[9]<>"",RC[9]&",","")&IF(RC[10]<>"",RC[10],"")&")" -> _rs14.setData(FALSE,10,Prop.ATK,0.91,500,3,0,1,"war3mapImported\\27.HY1.mdl","") | F6: 0 | G6: 10 | H6: =VLOOKUP(RC1,ABIL!C1:C5,5,0) -> ATK | I6: =VLOOKUP(RC[-8],ABIL!C1:C7,7,0) -> 0.91 | J6: 500 | K6: 3 | L6: 0 | M6: 1 | N6: "war3mapImported\\27.HY1.mdl" | O6: ""
A7: 15 | B7: =VLOOKUP(RC[-1],ABIL!C1:C2,2,0) -> 四凶 | C7: =VLOOKUP(RC[-2],ABIL!C1:C3,3,0) -> 被动 | D7: =IF(RC[3]<>"","攻击时有"&RC[3]&"%概率|n","")&IF(RC[9]>1,"在"&(RC[9]*RC[8])&"秒内"&RC[9]&"次","")&"对"&RC[6]&"范围内的敌人造成伤害!" -> 攻击时有10%概率|n对500范围内的敌人造成伤害! | E7: ="_rs"&RC[-4]&".setData("&IF(RC[1]<>"",RC[1]&",","")&IF(RC[2]<>"",RC[2]&",","")&IF(RC[3]<>"","Prop."&RC[3]&",","")&IF(RC[4]<>"",RC[4]&",","")&IF(RC[5]<>"",RC[5]&",","")&IF(RC[6]<>"",RC[6]&",","")&IF(RC[7]<>"",RC[7]&",","")&IF(RC[8]<>"",RC[8]&",","")&IF(RC[9]<>"",RC[9]&",","")&IF(RC[10]<>"",RC[10],"")&")" -> _rs15.setData(FALSE,10,Prop.ALL_MAIN,0.7,500,3,0,1,"war3mapImported\\AZ_Kaer_T1.mdl","") | F7: 0 | G7: 10 | H7: =VLOOKUP(RC1,ABIL!C1:C5,5,0) -> ALL_MAIN | I7: =VLOOKUP(RC[-8],ABIL!C1:C7,7,0) -> 0.7 | J7: 500 | K7: 3 | L7: 0 | M7: 1 | N7: "war3mapImported\\AZ_Kaer_T1.mdl" | O7: ""
A8: 16 | B8: =VLOOKUP(RC[-1],ABIL!C1:C2,2,0) -> 残风 | C8: =VLOOKUP(RC[-2],ABIL!C1:C3,3,0) -> 被动 | D8: =IF(RC[3]<>"","攻击时有"&RC[3]&"%概率|n","")&IF(RC[9]>1,"在"&(RC[9]*RC[8])&"秒内"&RC[9]&"次","")&"对"&RC[6]&"范围内的敌人造成伤害!" -> 攻击时有10%概率|n对500范围内的敌人造成伤害! | E8: ="_rs"&RC[-4]&".setData("&IF(RC[1]<>"",RC[1]&",","")&IF(RC[2]<>"",RC[2]&",","")&IF(RC[3]<>"","Prop."&RC[3]&",","")&IF(RC[4]<>"",RC[4]&",","")&IF(RC[5]<>"",RC[5]&",","")&IF(RC[6]<>"",RC[6]&",","")&IF(RC[7]<>"",RC[7]&",","")&IF(RC[8]<>"",RC[8]&",","")&IF(RC[9]<>"",RC[9]&",","")&IF(RC[10]<>"",RC[10],"")&")" -> _rs16.setData(FALSE,10,Prop.ALL,0.91,500,3,0,1,"war3mapImported\\AZ_JuLi01.mdl","") | F8: 0 | G8: 10 | H8: =VLOOKUP(RC1,ABIL!C1:C5,5,0) -> ALL | I8: =VLOOKUP(RC[-8],ABIL!C1:C7,7,0) -> 0.91 | J8: 500 | K8: 3 | L8: 0 | M8: 1 | N8: "war3mapImported\\AZ_JuLi01.mdl" | O8: ""
A9: 17 | B9: =VLOOKUP(RC[-1],ABIL!C1:C2,2,0) -> 无常 | C9: =VLOOKUP(RC[-2],ABIL!C1:C3,3,0) -> 被动 | D9: =IF(RC[3]<>"","攻击时有"&RC[3]&"%概率|n","")&IF(RC[9]>1,"在"&(RC[9]*RC[8])&"秒内"&RC[9]&"次","")&"对"&RC[6]&"范围内的敌人造成伤害!" -> 攻击时有10%概率|n对500范围内的敌人造成伤害! | E9: ="_rs"&RC[-4]&".setData("&IF(RC[1]<>"",RC[1]&",","")&IF(RC[2]<>"",RC[2]&",","")&IF(RC[3]<>"","Prop."&RC[3]&",","")&IF(RC[4]<>"",RC[4]&",","")&IF(RC[5]<>"",RC[5]&",","")&IF(RC[6]<>"",RC[6]&",","")&IF(RC[7]<>"",RC[7]&",","")&IF(RC[8]<>"",RC[8]&",","")&IF(RC[9]<>"",RC[9]&",","")&IF(RC[10]<>"",RC[10],"")&")" -> _rs17.setData(FALSE,10,Prop.MAIN,2.73,500,3,0,1,"war3mapImported\\AZ_Goods_Lvlup(3).mdl","") | F9: 0 | G9: 10 | H9: =VLOOKUP(RC1,ABIL!C1:C5,5,0) -> MAIN | I9: =VLOOKUP(RC[-8],ABIL!C1:C7,7,0) -> 2.73 | J9: 500 | K9: 3 | L9: 0 | M9: 1 | N9: "war3mapImported\\AZ_Goods_Lvlup(3).mdl" | O9: ""
A10: 40 | B10: =VLOOKUP(RC[-1],ABIL!C1:C2,2,0) -> 青玉案 | C10: =VLOOKUP(RC[-2],ABIL!C1:C3,3,0) -> 被动 | D10: =IF(RC[3]<>"","攻击时有"&RC[3]&"%概率|n","")&IF(RC[9]>1,"在"&(RC[9]*RC[8])&"秒内"&RC[9]&"次","")&"对"&RC[6]&"范围内的敌人造成伤害!" -> 攻击时有10%概率|n对500范围内的敌人造成伤害! | E10: ="_rs"&RC[-4]&".setData("&IF(RC[1]<>"",RC[1]&",","")&IF(RC[2]<>"",RC[2]&",","")&IF(RC[3]<>"","Prop."&RC[3]&",","")&IF(RC[4]<>"",RC[4]&",","")&IF(RC[5]<>"",RC[5]&",","")&IF(RC[6]<>"",RC[6]&",","")&IF(RC[7]<>"",RC[7]&",","")&IF(RC[8]<>"",RC[8]&",","")&IF(RC[9]<>"",RC[9]&",","")&IF(RC[10]<>"",RC[10],"")&")" -> _rs40.setData(FALSE,10,Prop.ALL,2.73,500,3,0,1,"war3mapImported\\AZ_CWDullahan_F2.mdl","") | F10: 0 | G10: 10 | H10: =VLOOKUP(RC1,ABIL!C1:C5,5,0) -> ALL | I10: =VLOOKUP(RC[-8],ABIL!C1:C7,7,0) -> 2.73 | J10: 500 | K10: 3 | L10: 0 | M10: 1 | N10: "war3mapImported\\AZ_CWDullahan_F2.mdl" | O10: ""
A11: 42 | B11: =VLOOKUP(RC[-1],ABIL!C1:C2,2,0) -> 醉赤壁 | C11: =VLOOKUP(RC[-2],ABIL!C1:C3,3,0) -> 被动 | D11: =IF(RC[3]<>"","攻击时有"&RC[3]&"%概率|n","")&IF(RC[9]>1,"在"&(RC[9]*RC[8])&"秒内"&RC[9]&"次","")&"对"&RC[6]&"范围内的敌人造成伤害!" -> 攻击时有10%概率|n对500范围内的敌人造成伤害! | E11: ="_rs"&RC[-4]&".setData("&IF(RC[1]<>"",RC[1]&",","")&IF(RC[2]<>"",RC[2]&",","")&IF(RC[3]<>"","Prop."&RC[3]&",","")&IF(RC[4]<>"",RC[4]&",","")&IF(RC[5]<>"",RC[5]&",","")&IF(RC[6]<>"",RC[6]&",","")&IF(RC[7]<>"",RC[7]&",","")&IF(RC[8]<>"",RC[8]&",","")&IF(RC[9]<>"",RC[9]&",","")&IF(RC[10]<>"",RC[10],"")&")" -> _rs42.setData(FALSE,10,Prop.ALL,2.73,500,3,0,1,"war3mapImported\\Lina_T.mdl","") | F11: 0 | G11: 10 | H11: =VLOOKUP(RC1,ABIL!C1:C5,5,0) -> ALL | I11: =VLOOKUP(RC[-8],ABIL!C1:C7,7,0) -> 2.73 | J11: 500 | K11: 3 | L11: 0 | M11: 1 | N11: "war3mapImported\\Lina_T.mdl" | O11: ""
A12: 47 | B12: =VLOOKUP(RC[-1],ABIL!C1:C2,2,0) -> 云天渺 | C12: =VLOOKUP(RC[-2],ABIL!C1:C3,3,0) -> 被动 | D12: =IF(RC[3]<>"","攻击时有"&RC[3]&"%概率|n","")&IF(RC[9]>1,"在"&(RC[9]*RC[8])&"秒内"&RC[9]&"次","")&"对"&RC[6]&"范围内的敌人造成伤害!" -> 攻击时有10%概率|n对500范围内的敌人造成伤害! | E12: ="_rs"&RC[-4]&".setData("&IF(RC[1]<>"",RC[1]&",","")&IF(RC[2]<>"",RC[2]&",","")&IF(RC[3]<>"","Prop."&RC[3]&",","")&IF(RC[4]<>"",RC[4]&",","")&IF(RC[5]<>"",RC[5]&",","")&IF(RC[6]<>"",RC[6]&",","")&IF(RC[7]<>"",RC[7]&",","")&IF(RC[8]<>"",RC[8]&",","")&IF(RC[9]<>"",RC[9]&",","")&IF(RC[10]<>"",RC[10],"")&")" -> _rs47.setData(FALSE,10,Prop.ALL_MAIN,2.05,500,3,0,1,"war3mapImported\\AZ_Nevermoreice_X.mdl","") | F12: 0 | G12: 10 | H12: =VLOOKUP(RC1,ABIL!C1:C5,5,0) -> ALL_MAIN | I12: =VLOOKUP(RC[-8],ABIL!C1:C7,7,0) -> 2.0499999999999998 | J12: 500 | K12: 3 | L12: 0 | M12: 1 | N12: "war3mapImported\\AZ_Nevermoreice_X.mdl" | O12: ""
A13: 48 | B13: =VLOOKUP(RC[-1],ABIL!C1:C2,2,0) -> 醉红颜 | C13: =VLOOKUP(RC[-2],ABIL!C1:C3,3,0) -> 被动 | D13: =IF(RC[3]<>"","攻击时有"&RC[3]&"%概率|n","")&IF(RC[9]>1,"在"&(RC[9]*RC[8])&"秒内"&RC[9]&"次","")&"对"&RC[6]&"范围内的敌人造成伤害!" -> 攻击时有10%概率|n对500范围内的敌人造成伤害! | E13: ="_rs"&RC[-4]&".setData("&IF(RC[1]<>"",RC[1]&",","")&IF(RC[2]<>"",RC[2]&",","")&IF(RC[3]<>"","Prop."&RC[3]&",","")&IF(RC[4]<>"",RC[4]&",","")&IF(RC[5]<>"",RC[5]&",","")&IF(RC[6]<>"",RC[6]&",","")&IF(RC[7]<>"",RC[7]&",","")&IF(RC[8]<>"",RC[8]&",","")&IF(RC[9]<>"",RC[9]&",","")&IF(RC[10]<>"",RC[10],"")&")" -> _rs48.setData(FALSE,10,Prop.ALL,2.73,500,3,0,1,"war3mapImported\\AZ_Nevermore_X.mdl","") | F13: 0 | G13: 10 | H13: =VLOOKUP(RC1,ABIL!C1:C5,5,0) -> ALL | I13: =VLOOKUP(RC[-8],ABIL!C1:C7,7,0) -> 2.73 | J13: 500 | K13: 3 | L13: 0 | M13: 1 | N13: "war3mapImported\\AZ_Nevermore_X.mdl" | O13: ""
A14: 49 | B14: =VLOOKUP(RC[-1],ABIL!C1:C2,2,0) -> 尘世游 | C14: =VLOOKUP(RC[-2],ABIL!C1:C3,3,0) -> 被动 | D14: =IF(RC[3]<>"","攻击时有"&RC[3]&"%概率|n","")&IF(RC[9]>1,"在"&(RC[9]*RC[8])&"秒内"&RC[9]&"次","")&"对"&RC[6]&"范围内的敌人造成伤害!" -> 攻击时有10%概率|n对500范围内的敌人造成伤害! | E14: ="_rs"&RC[-4]&".setData("&IF(RC[1]<>"",RC[1]&",","")&IF(RC[2]<>"",RC[2]&",","")&IF(RC[3]<>"","Prop."&RC[3]&",","")&IF(RC[4]<>"",RC[4]&",","")&IF(RC[5]<>"",RC[5]&",","")&IF(RC[6]<>"",RC[6]&",","")&IF(RC[7]<>"",RC[7]&",","")&IF(RC[8]<>"",RC[8]&",","")&IF(RC[9]<>"",RC[9]&",","")&IF(RC[10]<>"",RC[10],"")&")" -> _rs49.setData(FALSE,10,Prop.MAIN,8.19,500,3,0,1,"war3mapImported\\AZ_SG2.mdl","") | F14: 0 | G14: 10 | H14: =VLOOKUP(RC1,ABIL!C1:C5,5,0) -> MAIN | I14: =VLOOKUP(RC[-8],ABIL!C1:C7,7,0) -> 8.19 | J14: 500 | K14: 3 | L14: 0 | M14: 1 | N14: "war3mapImported\\AZ_SG2.mdl" | O14: ""
A15: 50 | B15: =VLOOKUP(RC[-1],ABIL!C1:C2,2,0) -> 人生几何 | C15: =VLOOKUP(RC[-2],ABIL!C1:C3,3,0) -> 被动 | D15: =IF(RC[3]<>"","攻击时有"&RC[3]&"%概率|n","")&IF(RC[9]>1,"在"&(RC[9]*RC[8])&"秒内"&RC[9]&"次","")&"对"&RC[6]&"范围内的敌人造成伤害!" -> 攻击时有10%概率|n对500范围内的敌人造成伤害! | E15: ="_rs"&RC[-4]&".setData("&IF(RC[1]<>"",RC[1]&",","")&IF(RC[2]<>"",RC[2]&",","")&IF(RC[3]<>"","Prop."&RC[3]&",","")&IF(RC[4]<>"",RC[4]&",","")&IF(RC[5]<>"",RC[5]&",","")&IF(RC[6]<>"",RC[6]&",","")&IF(RC[7]<>"",RC[7]&",","")&IF(RC[8]<>"",RC[8]&",","")&IF(RC[9]<>"",RC[9]&",","")&IF(RC[10]<>"",RC[10],"")&")" -> _rs50.setData(FALSE,10,Prop.ALL,7.28,500,6,0,1,"war3mapImported\\AZ_Coco_E1.mdl","war3mapImported\\[Sepll]LinaSun _D1_MagicMatrix.mdl") | F15: 0 | G15: 10 | H15: =VLOOKUP(RC1,ABIL!C1:C5,5,0) -> ALL | I15: =VLOOKUP(RC[-8],ABIL!C1:C7,7,0) -> 7.28 | J15: 500 | K15: 6 | L15: 0 | M15: 1 | N15: "war3mapImported\\AZ_Coco_E1.mdl" | O15: "war3mapImported\\[Sepll]LinaSun _D1_MagicMatrix.mdl"
A16: 51 | B16: =VLOOKUP(RC[-1],ABIL!C1:C2,2,0) -> 志在千里 | C16: =VLOOKUP(RC[-2],ABIL!C1:C3,3,0) -> 被动 | D16: =IF(RC[3]<>"","攻击时有"&RC[3]&"%概率|n","")&IF(RC[9]>1,"在"&(RC[9]*RC[8])&"秒内"&RC[9]&"次","")&"对"&RC[6]&"范围内的敌人造成伤害!" -> 攻击时有10%概率|n对500范围内的敌人造成伤害! | E16: ="_rs"&RC[-4]&".setData("&IF(RC[1]<>"",RC[1]&",","")&IF(RC[2]<>"",RC[2]&",","")&IF(RC[3]<>"","Prop."&RC[3]&",","")&IF(RC[4]<>"",RC[4]&",","")&IF(RC[5]<>"",RC[5]&",","")&IF(RC[6]<>"",RC[6]&",","")&IF(RC[7]<>"",RC[7]&",","")&IF(RC[8]<>"",RC[8]&",","")&IF(RC[9]<>"",RC[9]&",","")&IF(RC[10]<>"",RC[10],"")&")" -> _rs51.setData(FALSE,10,Prop.STR,21.84,500,6,0,1,"war3mapImported\\heianluqiya111_V1.mdl","war3mapImported\\AZ_Akasha(2)_B.mdl") | F16: 0 | G16: 10 | H16: =VLOOKUP(RC1,ABIL!C1:C5,5,0) -> STR | I16: =VLOOKUP(RC[-8],ABIL!C1:C7,7,0) -> 21.84 | J16: 500 | K16: 6 | L16: 0 | M16: 1 | N16: "war3mapImported\\heianluqiya111_V1.mdl" | O16: "war3mapImported\\AZ_Akasha(2)_B.mdl"
A17: 52 | B17: =VLOOKUP(RC[-1],ABIL!C1:C2,2,0) -> 云海尘清 | C17: =VLOOKUP(RC[-2],ABIL!C1:C3,3,0) -> 被动 | D17: =IF(RC[3]<>"","攻击时有"&RC[3]&"%概率|n","")&IF(RC[9]>1,"在"&(RC[9]*RC[8])&"秒内"&RC[9]&"次","")&"对"&RC[6]&"范围内的敌人造成伤害!" -> 攻击时有10%概率|n对500范围内的敌人造成伤害! | E17: ="_rs"&RC[-4]&".setData("&IF(RC[1]<>"",RC[1]&",","")&IF(RC[2]<>"",RC[2]&",","")&IF(RC[3]<>"","Prop."&RC[3]&",","")&IF(RC[4]<>"",RC[4]&",","")&IF(RC[5]<>"",RC[5]&",","")&IF(RC[6]<>"",RC[6]&",","")&IF(RC[7]<>"",RC[7]&",","")&IF(RC[8]<>"",RC[8]&",","")&IF(RC[9]<>"",RC[9]&",","")&IF(RC[10]<>"",RC[10],"")&")" -> _rs52.setData(FALSE,10,Prop.AGI,21.84,500,6,0,1,"war3mapImported\\AZ_CoCoGuanyu_E1.mdl","war3mapImported\\AZ_JUGGgreen_E2_Impact.mdl") | F17: 0 | G17: 10 | H17: =VLOOKUP(RC1,ABIL!C1:C5,5,0) -> AGI | I17: =VLOOKUP(RC[-8],ABIL!C1:C7,7,0) -> 21.84 | J17: 500 | K17: 6 | L17: 0 | M17: 1 | N17: "war3mapImported\\AZ_CoCoGuanyu_E1.mdl" | O17: "war3mapImported\\AZ_JUGGgreen_E2_Impact.mdl"
A18: 53 | B18: =VLOOKUP(RC[-1],ABIL!C1:C2,2,0) -> 天涯海角 | C18: =VLOOKUP(RC[-2],ABIL!C1:C3,3,0) -> 被动 | D18: =IF(RC[3]<>"","攻击时有"&RC[3]&"%概率|n","")&IF(RC[9]>1,"在"&(RC[9]*RC[8])&"秒内"&RC[9]&"次","")&"对"&RC[6]&"范围内的敌人造成伤害!" -> 攻击时有10%概率|n对500范围内的敌人造成伤害! | E18: ="_rs"&RC[-4]&".setData("&IF(RC[1]<>"",RC[1]&",","")&IF(RC[2]<>"",RC[2]&",","")&IF(RC[3]<>"","Prop."&RC[3]&",","")&IF(RC[4]<>"",RC[4]&",","")&IF(RC[5]<>"",RC[5]&",","")&IF(RC[6]<>"",RC[6]&",","")&IF(RC[7]<>"",RC[7]&",","")&IF(RC[8]<>"",RC[8]&",","")&IF(RC[9]<>"",RC[9]&",","")&IF(RC[10]<>"",RC[10],"")&")" -> _rs53.setData(FALSE,10,Prop.INT,21.84,500,6,0,1,"war3mapImported\\AZ_Dragonus_E2.mdl","war3mapImported\\AZ_JUGG_E3.mdl") | F18: 0 | G18: 10 | H18: =VLOOKUP(RC1,ABIL!C1:C5,5,0) -> INT | I18: =VLOOKUP(RC[-8],ABIL!C1:C7,7,0) -> 21.84 | J18: 500 | K18: 6 | L18: 0 | M18: 1 | N18: "war3mapImported\\AZ_Dragonus_E2.mdl" | O18: "war3mapImported\\AZ_JUGG_E3.mdl"
A19: 54 | B19: =VLOOKUP(RC[-1],ABIL!C1:C2,2,0) -> 横扫千军 | C19: =VLOOKUP(RC[-2],ABIL!C1:C3,3,0) -> 被动 | D19: =IF(RC[3]<>"","攻击时有"&RC[3]&"%概率|n","")&IF(RC[9]>1,"在"&(RC[9]*RC[8])&"秒内"&RC[9]&"次","")&"对"&RC[6]&"范围内的敌人造成伤害!" -> 攻击时有10%概率|n对500范围内的敌人造成伤害! | E19: ="_rs"&RC[-4]&".setData("&IF(RC[1]<>"",RC[1]&",","")&IF(RC[2]<>"",RC[2]&",","")&IF(RC[3]<>"","Prop."&RC[3]&",","")&IF(RC[4]<>"",RC[4]&",","")&IF(RC[5]<>"",RC[5]&",","")&IF(RC[6]<>"",RC[6]&",","")&IF(RC[7]<>"",RC[7]&",","")&IF(RC[8]<>"",RC[8]&",","")&IF(RC[9]<>"",RC[9]&",","")&IF(RC[10]<>"",RC[10],"")&")" -> _rs54.setData(FALSE,10,Prop.ATK,7.28,500,6,0,1,"war3mapImported\\AZ_Kaer_T2.mdl","war3mapImported\\AZ_JUGG_E2.mdl") | F19: 0 | G19: 10 | H19: =VLOOKUP(RC1,ABIL!C1:C5,5,0) -> ATK | I19: =VLOOKUP(RC[-8],ABIL!C1:C7,7,0) -> 7.28 | J19: 500 | K19: 6 | L19: 0 | M19: 1 | N19: "war3mapImported\\AZ_Kaer_T2.mdl" | O19: "war3mapImported\\AZ_JUGG_E2.mdl"
A20: 55 | B20: =VLOOKUP(RC[-1],ABIL!C1:C2,2,0) -> 叶随雨落 | C20: =VLOOKUP(RC[-2],ABIL!C1:C3,3,0) -> 被动 | D20: =IF(RC[3]<>"","攻击时有"&RC[3]&"%概率|n","")&IF(RC[9]>1,"在"&(RC[9]*RC[8])&"秒内"&RC[9]&"次","")&"对"&RC[6]&"范围内的敌人造成伤害!" -> 攻击时有10%概率|n对500范围内的敌人造成伤害! | E20: ="_rs"&RC[-4]&".setData("&IF(RC[1]<>"",RC[1]&",","")&IF(RC[2]<>"",RC[2]&",","")&IF(RC[3]<>"","Prop."&RC[3]&",","")&IF(RC[4]<>"",RC[4]&",","")&IF(RC[5]<>"",RC[5]&",","")&IF(RC[6]<>"",RC[6]&",","")&IF(RC[7]<>"",RC[7]&",","")&IF(RC[8]<>"",RC[8]&",","")&IF(RC[9]<>"",RC[9]&",","")&IF(RC[10]<>"",RC[10],"")&")" -> _rs55.setData(FALSE,10,Prop.ALL_MAIN,5.46,500,6,0,1,"war3mapImported\\AZ_Doomdragon_D.mdl","war3mapImported\\AZ_KingLeoric(SDWZ)_E.mdl") | F20: 0 | G20: 10 | H20: =VLOOKUP(RC1,ABIL!C1:C5,5,0) -> ALL_MAIN | I20: =VLOOKUP(RC[-8],ABIL!C1:C7,7,0) -> 5.46 | J20: 500 | K20: 6 | L20: 0 | M20: 1 | N20: "war3mapImported\\AZ_Doomdragon_D.mdl" | O20: "war3mapImported\\AZ_KingLeoric(SDWZ)_E.mdl"
A21: 56 | B21: =VLOOKUP(RC[-1],ABIL!C1:C2,2,0) -> 傲世九天 | C21: =VLOOKUP(RC[-2],ABIL!C1:C3,3,0) -> 被动 | D21: =IF(RC[3]<>"","攻击时有"&RC[3]&"%概率|n","")&IF(RC[9]>1,"在"&(RC[9]*RC[8])&"秒内"&RC[9]&"次","")&"对"&RC[6]&"范围内的敌人造成伤害!" -> 攻击时有10%概率|n对500范围内的敌人造成伤害! | E21: ="_rs"&RC[-4]&".setData("&IF(RC[1]<>"",RC[1]&",","")&IF(RC[2]<>"",RC[2]&",","")&IF(RC[3]<>"","Prop."&RC[3]&",","")&IF(RC[4]<>"",RC[4]&",","")&IF(RC[5]<>"",RC[5]&",","")&IF(RC[6]<>"",RC[6]&",","")&IF(RC[7]<>"",RC[7]&",","")&IF(RC[8]<>"",RC[8]&",","")&IF(RC[9]<>"",RC[9]&",","")&IF(RC[10]<>"",RC[10],"")&")" -> _rs56.setData(FALSE,10,Prop.ALL,7.28,500,6,0,1,"war3mapImported\\AZ_TormentedSoul_T2.mdl","") | F21: 0 | G21: 10 | H21: =VLOOKUP(RC1,ABIL!C1:C5,5,0) -> ALL | I21: =VLOOKUP(RC[-8],ABIL!C1:C7,7,0) -> 7.28 | J21: 500 | K21: 6 | L21: 0 | M21: 1 | N21: "war3mapImported\\AZ_TormentedSoul_T2.mdl" | O21: ""
A22: 58 | B22: =VLOOKUP(RC[-1],ABIL!C1:C2,2,0) -> 断编残简 | C22: =VLOOKUP(RC[-2],ABIL!C1:C3,3,0) -> 主动 | D22: =IF(RC[3]<>0,"攻击时有"&RC[3]&"%概率|n","")&IF(RC[9]>1,"在"&(RC[9]*RC[8])&"秒内"&RC[9]&"次","")&"对"&RC[6]&"范围内的敌人造成伤害!" -> 在1.5秒内3次对500范围内的敌人造成伤害! | E22: ="_rs"&RC[-4]&".setData("&IF(RC[1]<>"",RC[1]&",","")&IF(RC[2]<>"",RC[2]&",","")&IF(RC[3]<>"","Prop."&RC[3]&",","")&IF(RC[4]<>"",RC[4]&",","")&IF(RC[5]<>"",RC[5]&",","")&IF(RC[6]<>"",RC[6]&",","")&IF(RC[7]<>"",RC[7]&",","")&IF(RC[8]<>"",RC[8]&",","")&IF(RC[9]<>"",RC[9]&",","")&IF(RC[10]<>"",RC[10],"")&")" -> _rs58.setData(0,Prop.ALL,3.64,500,15,0.5,3,"war3mapImported\\AZ_CWLava_T.mdl","") | G22: 0 | H22: =VLOOKUP(RC1,ABIL!C1:C5,5,0) -> ALL | I22: =VLOOKUP(RC[-8],ABIL!C1:C7,7,0) -> 3.64 | J22: 500 | K22: 15 | L22: 0.5 | M22: 3 | N22: "war3mapImported\\AZ_CWLava_T.mdl" | O22: ""
A23: 59 | B23: =VLOOKUP(RC[-1],ABIL!C1:C2,2,0) -> 落花无声 | C23: =VLOOKUP(RC[-2],ABIL!C1:C3,3,0) -> 主动 | D23: =IF(RC[3]<>0,"攻击时有"&RC[3]&"%概率|n","")&IF(RC[9]>1,"在"&(RC[9]*RC[8])&"秒内"&RC[9]&"次","")&"对"&RC[6]&"范围内的敌人造成伤害!" -> 在1.5秒内3次对500范围内的敌人造成伤害! | E23: ="_rs"&RC[-4]&".setData("&IF(RC[1]<>"",RC[1]&",","")&IF(RC[2]<>"",RC[2]&",","")&IF(RC[3]<>"","Prop."&RC[3]&",","")&IF(RC[4]<>"",RC[4]&",","")&IF(RC[5]<>"",RC[5]&",","")&IF(RC[6]<>"",RC[6]&",","")&IF(RC[7]<>"",RC[7]&",","")&IF(RC[8]<>"",RC[8]&",","")&IF(RC[9]<>"",RC[9]&",","")&IF(RC[10]<>"",RC[10],"")&")" -> _rs59.setData(0,Prop.STR,10.92,500,15,0.5,3,"war3mapImported\\AZ_CWDullahan_F1.mdl","") | G23: 0 | H23: =VLOOKUP(RC1,ABIL!C1:C5,5,0) -> STR | I23: =VLOOKUP(RC[-8],ABIL!C1:C7,7,0) -> 10.92 | J23: 500 | K23: 15 | L23: 0.5 | M23: 3 | N23: "war3mapImported\\AZ_CWDullahan_F1.mdl" | O23: ""
A24: 60 | B24: =VLOOKUP(RC[-1],ABIL!C1:C2,2,0) -> 浮世繁华 | C24: =VLOOKUP(RC[-2],ABIL!C1:C3,3,0) -> 主动 | D24: =IF(RC[3]<>0,"攻击时有"&RC[3]&"%概率|n","")&IF(RC[9]>1,"在"&(RC[9]*RC[8])&"秒内"&RC[9]&"次","")&"对"&RC[6]&"范围内的敌人造成伤害!" -> 在1.5秒内3次对500范围内的敌人造成伤害! | E24: ="_rs"&RC[-4]&".setData("&IF(RC[1]<>"",RC[1]&",","")&IF(RC[2]<>"",RC[2]&",","")&IF(RC[3]<>"","Prop."&RC[3]&",","")&IF(RC[4]<>"",RC[4]&",","")&IF(RC[5]<>"",RC[5]&",","")&IF(RC[6]<>"",RC[6]&",","")&IF(RC[7]<>"",RC[7]&",","")&IF(RC[8]<>"",RC[8]&",","")&IF(RC[9]<>"",RC[9]&",","")&IF(RC[10]<>"",RC[10],"")&")" -> _rs60.setData(0,Prop.AGI,10.92,500,15,0.5,3,"war3mapImported\\AZ_TormentedSoul_T1.mdl","") | G24: 0 | H24: =VLOOKUP(RC1,ABIL!C1:C5,5,0) -> AGI | I24: =VLOOKUP(RC[-8],ABIL!C1:C7,7,0) -> 10.92 | J24: 500 | K24: 15 | L24: 0.5 | M24: 3 | N24: "war3mapImported\\AZ_TormentedSoul_T1.mdl" | O24: ""
A25: 61 | B25: =VLOOKUP(RC[-1],ABIL!C1:C2,2,0) -> 执念成殇 | C25: =VLOOKUP(RC[-2],ABIL!C1:C3,3,0) -> 主动 | D25: =IF(RC[3]<>0,"攻击时有"&RC[3]&"%概率|n","")&IF(RC[9]>1,"在"&(RC[9]*RC[8])&"秒内"&RC[9]&"次","")&"对"&RC[6]&"范围内的敌人造成伤害!" -> 在1.5秒内3次对500范围内的敌人造成伤害! | E25: ="_rs"&RC[-4]&".setData("&IF(RC[1]<>"",RC[1]&",","")&IF(RC[2]<>"",RC[2]&",","")&IF(RC[3]<>"","Prop."&RC[3]&",","")&IF(RC[4]<>"",RC[4]&",","")&IF(RC[5]<>"",RC[5]&",","")&IF(RC[6]<>"",RC[6]&",","")&IF(RC[7]<>"",RC[7]&",","")&IF(RC[8]<>"",RC[8]&",","")&IF(RC[9]<>"",RC[9]&",","")&IF(RC[10]<>"",RC[10],"")&")" -> _rs61.setData(0,Prop.INT,10.92,500,15,0.5,3,"war3mapImported\\[Sepll]LinaSun _T2_Blast.mdl","") | G25: 0 | H25: =VLOOKUP(RC1,ABIL!C1:C5,5,0) -> INT | I25: =VLOOKUP(RC[-8],ABIL!C1:C7,7,0) -> 10.92 | J25: 500 | K25: 15 | L25: 0.5 | M25: 3 | N25: "war3mapImported\\[Sepll]LinaSun _T2_Blast.mdl" | O25: ""
A26: 62 | B26: =VLOOKUP(RC[-1],ABIL!C1:C2,2,0) -> 月下独酌 | C26: =VLOOKUP(RC[-2],ABIL!C1:C3,3,0) -> 主动 | D26: =IF(RC[3]<>0,"攻击时有"&RC[3]&"%概率|n","")&IF(RC[9]>1,"在"&(RC[9]*RC[8])&"秒内"&RC[9]&"次","")&"对"&RC[6]&"范围内的敌人造成伤害!" -> 在1.5秒内3次对500范围内的敌人造成伤害! | E26: ="_rs"&RC[-4]&".setData("&IF(RC[1]<>"",RC[1]&",","")&IF(RC[2]<>"",RC[2]&",","")&IF(RC[3]<>"","Prop."&RC[3]&",","")&IF(RC[4]<>"",RC[4]&",","")&IF(RC[5]<>"",RC[5]&",","")&IF(RC[6]<>"",RC[6]&",","")&IF(RC[7]<>"",RC[7]&",","")&IF(RC[8]<>"",RC[8]&",","")&IF(RC[9]<>"",RC[9]&",","")&IF(RC[10]<>"",RC[10],"")&")" -> _rs62.setData(0,Prop.ATK,3.64,500,15,0.5,3,"war3mapImported\\AZ_EarthShaker_C.mdl","") | G26: 0 | H26: =VLOOKUP(RC1,ABIL!C1:C5,5,0) -> ATK | I26: =VLOOKUP(RC[-8],ABIL!C1:C7,7,0) -> 3.64 | J26: 500 | K26: 15 | L26: 0.5 | M26: 3 | N26: "war3mapImported\\AZ_EarthShaker_C.mdl" | O26: ""
A27: 63 | B27: =VLOOKUP(RC[-1],ABIL!C1:C2,2,0) -> 诗羽呢喃 | C27: =VLOOKUP(RC[-2],ABIL!C1:C3,3,0) -> 主动 | D27: =IF(RC[3]<>0,"攻击时有"&RC[3]&"%概率|n","")&IF(RC[9]>1,"在"&(RC[9]*RC[8])&"秒内"&RC[9]&"次","")&"对"&RC[6]&"范围内的敌人造成伤害!" -> 在1.5秒内3次对500范围内的敌人造成伤害! | E27: ="_rs"&RC[-4]&".setData("&IF(RC[1]<>"",RC[1]&",","")&IF(RC[2]<>"",RC[2]&",","")&IF(RC[3]<>"","Prop."&RC[3]&",","")&IF(RC[4]<>"",RC[4]&",","")&IF(RC[5]<>"",RC[5]&",","")&IF(RC[6]<>"",RC[6]&",","")&IF(RC[7]<>"",RC[7]&",","")&IF(RC[8]<>"",RC[8]&",","")&IF(RC[9]<>"",RC[9]&",","")&IF(RC[10]<>"",RC[10],"")&")" -> _rs63.setData(0,Prop.ALL_MAIN,2.73,500,15,0.5,3,"war3mapImported\\AZ_Lina(2)_T2_Blast.mdl","") | G27: 0 | H27: =VLOOKUP(RC1,ABIL!C1:C5,5,0) -> ALL_MAIN | I27: =VLOOKUP(RC[-8],ABIL!C1:C7,7,0) -> 2.73 | J27: 500 | K27: 15 | L27: 0.5 | M27: 3 | N27: "war3mapImported\\AZ_Lina(2)_T2_Blast.mdl" | O27: ""