Sheet: Sheet1
A1: TYPE | B1: id | C1: oid | D1: u_index | E1: unam | F1: upro | G1: ua1c | H1: udef | I1: ua1b | J1: ubba | K1: ulba | L1: uhpm | M1: ustr | N1: uagi | O1: uint | P1: ugor | Q1: ulur | R1: uico | S1: umdl | T1: u_code | U1: usca | V1: uclr | W1: uclb | X1: uclg | Y1: ugol | Z1: ulum | AA1: ustp | AB1: uagp | AC1: uinp | AD1: uabi | AE1: ua1s | AF1: ua1d | AG1: util | AH1: uspe | AI1: ucam | AJ1: uine | AK1: udro | AL1: uhos | AM1: uuch | AN1: utss | AO1: udaa | AP1: uhab | AQ1: urqc | AR1: urq1 | AS1: urq2 | AT1: urq3 | AU1: urq4 | AV1: urq5 | AW1: urq6 | AX1: urq7 | AY1: urq8 | AZ1: ureq | BA1: urqa | BB1: udep | BC1: urva | BD1: urev | BE1: ures | BF1: upgr | BG1: usei | BH1: useu | BI1: utra | BJ1: umki | BK1: uupt | BL1: ubui | BM1: upar | BN1: upap | BO1: upaw | BP1: uabr | BQ1: uabt | BR1: upat | BS1: ucol | BT1: usnd | BU1: ubsl | BV1: ursl | BW1: umsl | BX1: ulfo | BY1: ulfi | BZ1: upru | CA1: unsf | CB1: ides | CC1: uawt | CD1: utpr | CE1: utip | CF1: utub | CG1: ucun | CH1: ucut | CI1: uhot | CJ1: uver | CK1: uscb | CL1: ussc | CM1: uslz | CN1: usew | CO1: uocc | CP1: umxp | CQ1: umxr | CR1: uisz | CS1: uimz | CT1: ulpx | CU1: ulpy | CV1: ulsz | CW1: ulpz | CX1: ushu | CY1: ushb | CZ1: ushh | DA1: ushw | DB1: ushx | DC1: ushy | DD1: ushr | DE1: uubs | DF1: ubpx | DG1: ubpy | DH1: ucua | DI1: ussi | DJ1: utaa | DK1: udtm | DL1: uspa | DM1: uaap | DN1: uani | DO1: ualp | DP1: ubpr | DQ1: ucpt | DR1: ucbs | DS1: uwal | DT1: uble | DU1: urun | DV1: uprw | DW1: uori | DX1: utcc | DY1: utco | DZ1: uept | EA1: uerd | EB1: ufrd | EC1: ulos | ED1: umvt | EE1: umvh | EF1: umvs | EG1: umvr | EH1: umas | EI1: umis | EJ1: umvf | EK1: urpr | EL1: urpp | EM1: urpo | EN1: urpg | EO1: udty | EP1: uacq | EQ1: uamn | ER1: udup | ES1: udea | ET1: uarm | EU1: utar | EV1: ua1m | EW1: ua1z | EX1: ua1t | EY1: uma1 | EZ1: umh1 | FA1: ua1w | FB1: ua1g | FC1: ucs1 | FD1: usr1 | FE1: usd1 | FF1: udl1 | FG1: uwu1 | FH1: ubs1 | FI1: udp1 | FJ1: ua1r | FK1: urb1 | FL1: udu1 | FM1: ua1p | FN1: ua1f | FO1: utc1 | FP1: uqd1 | FQ1: ua1q | FR1: uhd1 | FS1: ua1h | FT1: ua2m | FU1: ua2z | FV1: ua2t | FW1: uma2 | FX1: umh2 | FY1: ua2w | FZ1: ua2g | GA1: ucs2 | GB1: usr2 | GC1: usd2 | GD1: udl2 | GE1: uwu2 | GF1: ubs2 | GG1: udp2 | GH1: ua2r | GI1: urb2 | GJ1: ua2b | GK1: ua2s | GL1: ua2d | GM1: udu2 | GN1: ua2p | GO1: ua2c | GP1: ua2f | GQ1: utc2 | GR1: uqd2 | GS1: ua2q | GT1: uhd2 | GU1: ua2h | GV1: uaen | GW1: ulev | GX1: urac | GY1: utyp | GZ1: ubdg | HA1: ubld | HB1: ubsi | HC1: ubdi | HD1: urtm | HE1: ulbs | HF1: ulbd | HG1: umpm | HH1: umpr | HI1: umpi | HJ1: uhpr | HK1: uhrt | HL1: ufma | HM1: ufoo | HN1: usst | HO1: usrg | HP1: usid | HQ1: usin | HR1: ucar | HS1: usma | HT1: uhom | HU1: uhhm | HV1: uhhb | HW1: uhhd | HX1: upra | HY1: unbr | HZ1: unbm | IA1: upoi | IB1: upri | IC1: ufor | ID1: ufle | IE1: ucbo | IF1: uibo | IG1: usle
A2: COMMENT | B2: 单位ID | C2: 单位模板ID | D2: index | E2: 文本 - 名字 | F2: 文本 - 称谓 | G2: 战斗 - 攻击 1 - 攻击间隔 | H2: 战斗 - 基础护甲 | I2: 战斗 - 攻击 1 - 基础伤害 | J2: 状态 - 黄金奖励 - 基础值 | K2: 状态 - 木材奖励 - 基础值 | L2: 状态 - 生命最大值 | M2: 状态 - 英雄 - 初始力量 | N2: 状态 - 英雄 - 初始敏捷 | O2: 状态 - 英雄 - 初始智力 | P2: 状态 - 修理黄金消耗 | Q2: 状态 - 修理木材消耗 | R2: 显示 - 图标 - 游戏界面 | S2: 显示 - 模型文件 | T2: code | U2: 显示 - 模型缩放 | V2: 显示 - 颜色值(红) | W2: 显示 - 颜色值(蓝) | X2: 显示 - 颜色值(绿) | Y2: 状态 - 黄金消耗 | Z2: 状态 - 木材消耗 | AA2: 状态 - 英雄 - 每等级提升力量 | AB2: 状态 - 英雄 - 每等级提升敏捷 | AC2: 状态 - 英雄 - 每等级提升智力 | AD2: 技能 - 普通 | AE2: 战斗 - 攻击 1 - 伤害骰子面数 | AF2: 战斗 - 攻击 1 - 伤害骰子数量 | AG2: 编辑器 - 地形设置 | AH2: 编辑器 - 分类 - 特殊 | AI2: 编辑器 - 分类 - 战役 | AJ2: 编辑器 - 可在编辑器中放置 | AK2: 编辑器 - 可设置死亡掉落物品 | AL2: 编辑器 - 可作为中立敌对显示 | AM2: 编辑器 - 使用点击帮助 | AN2: 编辑器 - 有地形指定数据 | AO2: 技能 - 默认主动技能 | AP2: 技能 - 英雄 | AQ2: 科技树 - 需求 - 使用等级数 | AR2: 科技树 - 需求 - 等级 2 | AS2: 科技树 - 需求 - 等级 3 | AT2: 科技树 - 需求 - 等级 4 | AU2: 科技树 - 需求 - 等级 5 | AV2: 科技树 - 需求 - 等级 6 | AW2: 科技树 - 需求 - 等级 7 | AX2: 科技树 - 需求 - 等级 8 | AY2: 科技树 - 需求 - 等级 9 | AZ2: 科技树 - 需求 | BA2: 科技树 - 需求值 | BB2: 科技树 - 从属等价物 | BC2: 科技树 - 指定复活点 | BD2: 科技树 - 可重生阵亡英雄 | BE2: 科技树 - 可研究项目 | BF2: 科技树 - 使用科技 | BG2: 科技树 - 售出物品 | BH2: 科技树 - 售出单位 | BI2: 科技树 - 训练单位 | BJ2: 科技树 - 制造物品 | BK2: 科技树 - 建筑升级 | BL2: 科技树 - 可建造建筑 | BM2: 路径 - 放置不允许 | BN2: 路径 - 放置要求 | BO2: 路径 - 放置要求距离水的范围 | BP2: 路径 - AI放置范围 | BQ2: 路径 - AI放置类型 | BR2: 路径 - 路径纹理 | BS2: 路径 - 碰撞体积 | BT2: 声音 - 单位声音设置 | BU2: 声音 - 建筑 | BV2: 声音 - 随机 | BW2: 声音 - 移动 | BX2: 声音 - 循环淡出率 | BY2: 声音 - 循环淡入率 | BZ2: 文本 - 称谓数量 | CA2: 文本 - 名字 - 编辑器后缀 | CB2: 文本 - 说明 | CC2: 文本 - 提示工具 - 唤醒 | CD2: 文本 - 提示工具 - 重生 | CE2: 文本 - 提示工具 - 基础 | CF2: 文本 - 提示工具 - 扩展 | CG2: 文本 - 魔法升级名字 | CH2: 文本 - 魔法升级说明 | CI2: 文本 - 热键 | CJ2: 显示 - 模型文件 - 版本 | CK2: 显示 - 缩放投射物 | CL2: 显示 - 选择缩放 | CM2: 显示 - 选择圈高度 | CN2: 显示 - 选择圈在水面上 | CO2: 显示 - 闭塞高度 | CP2: 显示 - X轴最大旋转角度(弧度) | CQ2: 显示 - Y轴最大旋转角度(弧度) | CR2: 显示 - 弹射碰撞偏移 - Z (深水) | CS2: 显示 - 弹射碰撞偏移 - Z | CT2: 显示 - 弹射偏移 - X | CU2: 显示 - 弹射偏移 - Y | CV2: 显示 - 弹射偏移 - Z (深水) | CW2: 显示 - 弹射偏移 - Z | CX2: 显示 - 阴影图像(单位) | CY2: 显示 - 阴影图像(建筑) | CZ2: 显示 - 阴影图像 - 高度 | DA2: 显示 - 阴影图像 - 宽度 | DB2: 显示 - 阴影图像 - X轴偏移 | DC2: 显示 - 阴影图像 - Y轴偏移 | DD2: 显示 - 深水区有阴影 | DE2: 显示 - 建筑地面纹理 | DF2: 显示 - 按钮位置(X) | DG2: 显示 - 按钮位置(Y) | DH2: 显示 - 魔法升级图标 | DI2: 显示 - 图标 - 计分屏 | DJ2: 显示 - 目标效果 | DK2: 显示 - 死亡时间(秒) | DL2: 显示 - 特殊效果 | DM2: 显示 - 要求动画名 - 附加动画 | DN2: 显示 - 要求动画名 | DO2: 显示 - 要求附加动画链接名 | DP2: 显示 - 要求骨骼名 | DQ2: 显示 - 动画 - 魔法施放点 | DR2: 显示 - 动画 - 魔法施放回复 | DS2: 显示 - 动画 - 行走速度 | DT2: 显示 - 动画 - 混合时间(秒) | DU2: 显示 - 动画 - 跑步速度 | DV2: 显示 - 动画 - 转向角度 | DW2: 显示 - 动画 - 转向补正 | DX2: 显示 - 队伍颜色 - 允许自定义 | DY2: 显示 - 队伍颜色 | DZ2: 显示 - 高度变化 - 采样点数量 | EA2: 显示 - 高度变化 - 采样范围 | EB2: 显示 - 战争迷雾 - 采样范围 | EC2: 显示 - 不可见区域显示单位 | ED2: 移动 - 类型 | EE2: 移动 - 高度 | EF2: 移动 - 基础速度 | EG2: 移动 - 转身速度 | EH2: 移动 - 最大速度 | EI2: 移动 - 最小速度 | EJ2: 移动 - 最小高度 | EK2: 移动 - 组群分离 - 优先权 | EL2: 移动 - 组群分离 - 参数 | EM2: 移动 - 组群分离 - 允许 | EN2: 移动 - 组群分离 - 组号 | EO2: 战斗 - 护甲类型 | EP2: 战斗 - 主动攻击范围 | EQ2: 战斗 - 最小攻击范围 | ER2: 战斗 - 防御升级奖励 | ES2: 战斗 - 死亡类型 | ET2: 战斗 - 装甲类型 | EU2: 战斗 - 作为目标类型 | EV2: 战斗 - 攻击 1 - 投射物图像 | EW2: 战斗 - 攻击 1 - 弹射速率 | EX2: 战斗 - 攻击 1 - 攻击类型 | EY2: 战斗 - 攻击 1 - 射弹弧度 | EZ2: 战斗 - 攻击 1 - 射弹自导允许 | FA2: 战斗 - 攻击 1 - 武器类型 | FB2: 战斗 - 攻击 1 - 目标允许 | FC2: 战斗 - 攻击 1 - 武器声音 | FD2: 战斗 - 攻击 1 - 穿透伤害范围 | FE2: 战斗 - 攻击 1 - 穿透伤害距离 | FF2: 战斗 - 攻击 1 - 伤害衰减参数 | FG2: 战斗 - 攻击 1 - 显示UI | FH2: 战斗 - 攻击 1 - 动画回复点 | FI2: 战斗 - 攻击 1 - 动画伤害点 | FJ2: 战斗 - 攻击 1 - 攻击范围 | FK2: 战斗 - 攻击 1 - 攻击范围缓冲 | FL2: 战斗 - 攻击 1 - 伤害升级奖励 | FM2: 战斗 - 攻击 1 - 范围影响目标 | FN2: 战斗 - 攻击 1 - 全伤害范围 | FO2: 战斗 - 攻击 1 - 最大目标数 | FP2: 战斗 - 攻击 1 - 小伤害参数 | FQ2: 战斗 - 攻击 1 - 小伤害范围 | FR2: 战斗 - 攻击 1 - 中伤害参数 | FS2: 战斗 - 攻击 1 - 中伤害范围 | FT2: 战斗 - 攻击 2 - 投射物图像 | FU2: 战斗 - 攻击 2 - 弹射速率 | FV2: 战斗 - 攻击 2 - 攻击类型 | FW2: 战斗 - 攻击 2 - 射弹弧度 | FX2: 战斗 - 攻击 2 - 射弹自导允许 | FY2: 战斗 - 攻击 2 - 武器类型 | FZ2: 战斗 - 攻击 2 - 目标允许 | GA2: 战斗 - 攻击 2 - 武器声音 | GB2: 战斗 - 攻击 2 - 穿透伤害范围 | GC2: 战斗 - 攻击 2 - 穿透伤害距离 | GD2: 战斗 - 攻击 2 - 伤害衰减参数 | GE2: 战斗 - 攻击 2 - 显示UI | GF2: 战斗 - 攻击 2 - 动画回复点 | GG2: 战斗 - 攻击 2 - 动画伤害点 | GH2: 战斗 - 攻击 2 - 攻击范围 | GI2: 战斗 - 攻击 2 - 攻击范围缓冲 | GJ2: 战斗 - 攻击 2 - 基础伤害 | GK2: 战斗 - 攻击 2 - 伤害骰子面数 | GL2: 战斗 - 攻击 2 - 伤害骰子数量 | GM2: 战斗 - 攻击 2 - 伤害升级奖励 | GN2: 战斗 - 攻击 2 - 范围影响目标 | GO2: 战斗 - 攻击 2 - 攻击间隔 | GP2: 战斗 - 攻击 2 - 全伤害范围 | GQ2: 战斗 - 攻击 2 - 最大目标数 | GR2: 战斗 - 攻击 2 - 小伤害参数 | GS2: 战斗 - 攻击 2 - 小伤害范围 | GT2: 战斗 - 攻击 2 - 中伤害参数 | GU2: 战斗 - 攻击 2 - 中伤害范围 | GV2: 战斗 - 允许攻击模式 | GW2: 状态 - 等级 | GX2: 状态 - 种族 | GY2: 状态 - 单位类别 | GZ2: 状态 - 是一个建筑 | HA2: 状态 - 建造时间 | HB2: 状态 - 黄金奖励 - 骰子面数 | HC2: 状态 - 黄金奖励 - 骰子数量 | HD2: 状态 - 修理时间 | HE2: 状态 - 木材奖励 - 骰子面数 | HF2: 状态 - 木材奖励 - 骰子数量 | HG2: 状态 - 魔法最大值 | HH2: 状态 - 魔法回复 | HI2: 状态 - 魔法初始数量 | HJ2: 状态 - 生命回复 | HK2: 状态 - 生命回复类型 | HL2: 状态 - 提供人口 | HM2: 状态 - 占用人口 | HN2: 状态 - 雇佣开始时间 | HO2: 状态 - 雇佣时间间隔 | HP2: 状态 - 视野范围(白天) | HQ2: 状态 - 视野范围(夜晚) | HR2: 状态 - 运输尺寸 | HS2: 状态 - 最大库存量 | HT2: 状态 - 隐藏小地图显示 | HU2: 状态 - 英雄 - 隐藏小地图英雄显示 | HV2: 状态 - 英雄 - 隐藏英雄栏图标 | HW2: 状态 - 英雄 - 隐藏英雄死亡信息 | HX2: 状态 - 英雄 - 主要属性 | HY2: 状态 - 中立建筑 - 可作为随机建筑 | HZ2: 状态 - 中立建筑 - 显示小地图标记 | IA2: 状态 - 单位附加值 | IB2: 状态 - 编队优先权 | IC2: 状态 - 队形排列 | ID2: 状态 - 可以逃跑 | IE2: 状态 - 能被其他建筑建造 | IF2: 状态 - 能建造在其他建筑上 | IG2: 状态 - 允许睡眠
A3: OBJECT | B3: h300 | C3: hfoo | D3: 0 | E3: 低级金币怪 | G3: 0.5 | H3: =INT(RC[4]/10) -> 100 | I3: 100 | J3: 50 | K3: 0 | L3: 1000 | P3: 0 | Q3: 0 | R3: ReplaceableTextures\CommandButtons\BTNChestOfGold.blp | S3: units\human\Footman\Footman | T3: ="let _hx"&RC[-16]&" = new Challenge('L30"&RC[-16]&"','h30"&RC[-16]&"',20)" -> let _hx0 = new Challenge('L300','h300',20) | Y3: 1 | Z3: 0 | BS3: 32 | BT3: Rifleman | CI3: null | CL3: 1 | DF3: 0 | DG3: 0 | DK3: 1 | DT3: 0.1 | DV3: 1 | DW3: 1 | EF3: 390 | EG3: 2.8 | EO3: normal | EP3: 500 | FB3: ground,air | FC3: null | FH3: 0.2 | FI3: 0.1 | FJ3: 600 | FL3: 0 | GX3: orc | HA3: 0 | HB3: 0 | HC3: 0 | HD3: 0 | HH3: 0 | HJ3: 0 | HK3: null | HM3: 0 | HN3: 0 | HO3: 0 | HQ3: 1800 | HR3: 0 | HS3: 0 | ID3: 0
A4: OBJECT | B4: h301 | C4: hfoo | D4: 1 | E4: 中级金币怪 | G4: 0.5 | H4: =INT(RC[4]/10) -> 400 | I4: 1000 | J4: 200 | K4: 0 | L4: 4000 | P4: 0 | Q4: 0 | R4: ReplaceableTextures\CommandButtons\BTNChestOfGold.blp | S4: units\human\TheCaptain\TheCaptain | T4: ="let _hx"&RC[-16]&" = new Challenge('L30"&RC[-16]&"','h30"&RC[-16]&"',20)" -> let _hx1 = new Challenge('L301','h301',20) | Y4: 3 | Z4: 0 | BS4: 32 | BT4: Rifleman | CI4: null | CL4: 1 | DF4: 0 | DG4: 0 | DK4: 1 | DT4: 0.1 | DV4: 1 | DW4: 1 | EF4: 390 | EG4: 2.8 | EO4: normal | EP4: 500 | FB4: ground,air | FC4: null | FH4: 0.2 | FI4: 0.1 | FJ4: 600 | FL4: 0 | GX4: orc | HA4: 0 | HB4: 0 | HC4: 0 | HD4: 0 | HH4: 0 | HJ4: 0 | HK4: null | HM4: 0 | HN4: 0 | HO4: 0 | HQ4: 1800 | HR4: 0 | HS4: 0 | ID4: 0
A5: OBJECT | B5: h302 | C5: hfoo | D5: 2 | E5: 高级金币怪 | G5: 0.5 | H5: =INT(RC[4]/10) -> 200 | I5: 10000 | J5: 800 | K5: 0 | L5: 2000 | P5: 0 | Q5: 0 | R5: ReplaceableTextures\CommandButtons\BTNChestOfGold.blp | S5: units\creeps\Bandit\Bandit | T5: ="let _hx"&RC[-16]&" = new Challenge('L30"&RC[-16]&"','h30"&RC[-16]&"',20)" -> let _hx2 = new Challenge('L302','h302',20) | Y5: 5 | Z5: 0 | BS5: 32 | BT5: Rifleman | CI5: null | CL5: 1 | DF5: 0 | DG5: 0 | DK5: 1 | DT5: 0.1 | DV5: 1 | DW5: 1 | EF5: 390 | EG5: 2.8 | EO5: normal | EP5: 500 | FB5: ground,air | FC5: null | FH5: 0.2 | FI5: 0.1 | FJ5: 600 | FL5: 0 | GX5: orc | HA5: 0 | HB5: 0 | HC5: 0 | HD5: 0 | HH5: 0 | HJ5: 0 | HK5: null | HM5: 0 | HN5: 0 | HO5: 0 | HQ5: 1800 | HR5: 0 | HS5: 0 | ID5: 0
A6: OBJECT | B6: h303 | C6: hfoo | D6: 3 | E6: 超级金币怪 | G6: 0.5 | H6: =INT(RC[4]/10) -> 2000 | I6: 100000 | J6: 2000 | K6: 0 | L6: 20000 | P6: 0 | Q6: 0 | R6: ReplaceableTextures\CommandButtons\BTNChestOfGold.blp | S6: units\creeps\BanditSpearThrower\BanditSpearThrower | T6: ="let _hx"&RC[-16]&" = new Challenge('L30"&RC[-16]&"','h30"&RC[-16]&"',20)" -> let _hx3 = new Challenge('L303','h303',20) | Y6: 7 | Z6: 0 | BS6: 32 | BT6: Rifleman | CI6: null | CL6: 1 | DF6: 0 | DG6: 0 | DK6: 1 | DT6: 0.1 | DV6: 1 | DW6: 1 | EF6: 390 | EG6: 2.8 | EO6: normal | EP6: 500 | FB6: ground,air | FC6: null | FH6: 0.2 | FI6: 0.1 | FJ6: 600 | FL6: 0 | GX6: orc | HA6: 0 | HB6: 0 | HC6: 0 | HD6: 0 | HH6: 0 | HJ6: 0 | HK6: null | HM6: 0 | HN6: 0 | HO6: 0 | HQ6: 1800 | HR6: 0 | HS6: 0 | ID6: 0
A7: OBJECT | B7: h304 | C7: hfoo | D7: 4 | E7: 低级木头怪 | G7: 0.5 | H7: =INT(RC[4]/10) -> 500000 | I7: 1000000 | J7: 0 | K7: 1 | L7: 5000000 | P7: 0 | Q7: 0 | R7: ReplaceableTextures\CommandButtons\BTNBundleOfLumber.blp | S7: units\nightelf\Wisp\Wisp | T7: ="let _hx"&RC[-16]&" = new Challenge('L30"&RC[-16]&"','h30"&RC[-16]&"',20)" -> let _hx4 = new Challenge('L304','h304',20) | Y7: 10 | Z7: 0 | BS7: 32 | BT7: Rifleman | CI7: null | CL7: 1 | DF7: 0 | DG7: 0 | DK7: 1 | DT7: 0.1 | DV7: 1 | DW7: 1 | EF7: 390 | EG7: 2.8 | EO7: normal | EP7: 500 | FB7: ground,air | FC7: null | FH7: 0.2 | FI7: 0.1 | FJ7: 600 | FL7: 0 | GX7: orc | HA7: 0 | HB7: 0 | HC7: 0 | HD7: 0 | HH7: 0 | HJ7: 0 | HK7: null | HM7: 0 | HN7: 0 | HO7: 0 | HQ7: 1800 | HR7: 0 | HS7: 0 | ID7: 0
A8: OBJECT | B8: h305 | C8: hfoo | D8: 5 | E8: 中级木头怪 | G8: 0.5 | H8: =INT(RC[4]/10) -> 2500000 | I8: 10000000 | J8: 0 | K8: 3 | L8: 25000000 | P8: 0 | Q8: 0 | R8: ReplaceableTextures\CommandButtons\BTNBundleOfLumber.blp | S8: units\nightelf\Ent\Ent | T8: ="let _hx"&RC[-16]&" = new Challenge('L30"&RC[-16]&"','h30"&RC[-16]&"',20)" -> let _hx5 = new Challenge('L305','h305',20) | Y8: 12 | Z8: 0 | BS8: 32 | BT8: Rifleman | CI8: null | CL8: 1 | DF8: 0 | DG8: 0 | DK8: 1 | DT8: 0.1 | DV8: 1 | DW8: 1 | EF8: 390 | EG8: 2.8 | EO8: normal | EP8: 500 | FB8: ground,air | FC8: null | FH8: 0.2 | FI8: 0.1 | FJ8: 600 | FL8: 0 | GX8: orc | HA8: 0 | HB8: 0 | HC8: 0 | HD8: 0 | HH8: 0 | HJ8: 0 | HK8: null | HM8: 0 | HN8: 0 | HO8: 0 | HQ8: 1800 | HR8: 0 | HS8: 0 | ID8: 0
A9: OBJECT | B9: h306 | C9: hfoo | D9: 6 | E9: 高级木头怪 | G9: 0.5 | H9: =INT(RC[4]/10) -> 10000000 | I9: 30000000 | J9: 0 | K9: 8 | L9: 100000000 | P9: 0 | Q9: 0 | R9: ReplaceableTextures\CommandButtons\BTNBundleOfLumber.blp | S9: units\nightelf\Dryad\Dryad | T9: ="let _hx"&RC[-16]&" = new Challenge('L30"&RC[-16]&"','h30"&RC[-16]&"',20)" -> let _hx6 = new Challenge('L306','h306',20) | Y9: 15 | Z9: 0 | BS9: 32 | BT9: Rifleman | CI9: null | CL9: 1 | DF9: 0 | DG9: 0 | DK9: 1 | DT9: 0.1 | DV9: 1 | DW9: 1 | EF9: 390 | EG9: 2.8 | EO9: normal | EP9: 500 | FB9: ground,air | FC9: null | FH9: 0.2 | FI9: 0.1 | FJ9: 600 | FL9: 0 | GX9: orc | HA9: 0 | HB9: 0 | HC9: 0 | HD9: 0 | HH9: 0 | HJ9: 0 | HK9: null | HM9: 0 | HN9: 0 | HO9: 0 | HQ9: 1800 | HR9: 0 | HS9: 0 | ID9: 0
A10: OBJECT | B10: h307 | C10: hfoo | D10: 7 | E10: 超级木头怪 | G10: 0.5 | H10: =INT(RC[4]/10) -> 40000000 | I10: 1000000000 | J10: 0 | K10: 16 | L10: 400000000 | P10: 0 | Q10: 0 | R10: ReplaceableTextures\CommandButtons\BTNBundleOfLumber.blp | S10: units\nightelf\MountainGiant\MountainGiant | T10: ="let _hx"&RC[-16]&" = new Challenge('L30"&RC[-16]&"','h30"&RC[-16]&"',20)" -> let _hx7 = new Challenge('L307','h307',20) | Y10: 20 | Z10: 0 | BS10: 32 | BT10: Rifleman | CI10: null | CL10: 1 | DF10: 0 | DG10: 0 | DK10: 1 | DT10: 0.1 | DV10: 1 | DW10: 1 | EF10: 390 | EG10: 2.8 | EO10: normal | EP10: 500 | FB10: ground,air | FC10: null | FH10: 0.2 | FI10: 0.1 | FJ10: 600 | FL10: 0 | GX10: orc | HA10: 0 | HB10: 0 | HC10: 0 | HD10: 0 | HH10: 0 | HJ10: 0 | HK10: null | HM10: 0 | HN10: 0 | HO10: 0 | HQ10: 1800 | HR10: 0 | HS10: 0 | ID10: 0
A11: OBJECT | B11: h400 | C11: hfoo | D11: |cFF33FF00定魂精髓|r | E11: 天地灵气 | F11: ="[任务]奖励"&RC[-2] -> [任务]奖励|cFF33FF00定魂精髓|r | G11: 0.35 | H11: =INT(RC[4]/50) -> 1200000 | I11: 6000000 | J11: 0 | K11: 0 | L11: 60000000 | P11: 0 | Q11: 0 | R11: ReplaceableTextures\CommandButtons\BTNBundleOfLumber.blp | S11: units\nightelf\Wisp\Wisp | T11: ="let _hx"&RC[-16]&" = new Challenge('L30"&RC[-16]&"','h30"&RC[-16]&"',20)" -> let _hx|cFF33FF00定魂精髓|r = new Challenge('L30|cFF33FF00定魂精髓|r','h30|cFF33FF00定魂精髓|r',20) | Y11: 20 | Z11: 0 | BS11: 32 | BT11: Rifleman | CI11: null | CL11: 1 | DF11: 0 | DG11: 0 | DK11: 1 | DT11: 0.1 | DV11: 1 | DW11: 1 | EF11: 390 | EG11: 2.8 | EO11: normal | EP11: 500 | FB11: ground,air | FC11: null | FH11: 0.2 | FI11: 0.1 | FJ11: 600 | FL11: 0 | GX11: orc | HA11: 0 | HB11: 0 | HC11: 0 | HD11: 0 | HH11: 0 | HJ11: 0 | HK11: null | HM11: 0 | HN11: 0 | HO11: 0 | HQ11: 1800 | HR11: 0 | HS11: 0 | ID11: 0
A12: OBJECT | B12: H500 | C12: Obla | D12: 1 | E12: ="[炼体]炼体 - "&RC[-1]&"阶" -> [炼体]炼体 - 1阶 | F12: ="打死完成炼体"&RC[-2]&"阶" -> 打死完成炼体1阶 | G12: 0.25 | H12: =INT(RC[4]/20) -> 703 | I12: =INT(2000*RC[-5]*POWER(10,0.37*RC[-5])) -> 4688 | J12: 0 | K12: 0 | L12: =RC[-3]*3 -> 14064 | M12: =INT(RC[-4]/5) -> 937 | N12: =RC[-1] -> 937 | O12: =RC[-1] -> 937 | P12: 1000 | Q12: 0 | R12: blp\book\3.blp | S12: Units\Creeps\GiantSeaTurtle\GiantSeaTurtle | T12: ="let _lt"&RC[-16]&" = new Challenge('L50"&MOD(RC[-16]-1,10)&"','"&RC[-18]&"',1,1)" -> let _lt1 = new Challenge('L500','H500',1,1) | U12: 1 | Y12: 1 | Z12: 0 | AP12: null | AR12: null | AS12: null | BF12: null | BS12: 32 | BT12: Rifleman | CC12: null | CD12: null | CE12: null | CF12: null | CI12: null | CL12: 1 | DF12: 0 | DG12: 0 | DK12: 1 | DT12: 0.1 | DV12: 1 | DW12: 1 | EF12: 390 | EG12: 2.8 | EO12: normal | EP12: 500 | FB12: ground,air | FC12: null | FH12: 0.2 | FI12: 0.1 | FJ12: 600 | FL12: 0 | GX12: orc | HA12: 0 | HB12: 0 | HC12: 0 | HD12: 0 | HH12: 0 | HJ12: 0 | HK12: null | HM12: 0 | HN12: 0 | HO12: 0 | HQ12: 1800 | HR12: 0 | HS12: 0 | ID12: 0
A13: OBJECT | B13: H501 | C13: Obla | D13: 2 | E13: ="[炼体]炼体 - "&RC[-1]&"阶" -> [炼体]炼体 - 2阶 | F13: ="打死完成炼体"&RC[-2]&"阶" -> 打死完成炼体2阶 | G13: 0.25 | H13: =INT(RC[4]/20) -> 3297 | I13: =INT(2000*RC[-5]*POWER(10,0.37*RC[-5])) -> 21981 | J13: 0 | K13: 0 | L13: =RC[-3]*3 -> 65943 | M13: =INT(RC[-4]/5) -> 4396 | N13: =RC[-1] -> 4396 | O13: =RC[-1] -> 4396 | P13: 2000 | Q13: 0 | R13: blp\book\3.blp | S13: Units\Creeps\GiantSeaTurtle\GiantSeaTurtle | T13: ="let _lt"&RC[-16]&" = new Challenge('L50"&MOD(RC[-16]-1,10)&"','"&RC[-18]&"',1,1)" -> let _lt2 = new Challenge('L501','H501',1,1) | U13: 1.05 | Y13: 2 | Z13: 0 | AP13: null | AR13: null | AS13: null | BF13: null | BS13: 32 | BT13: Rifleman | CC13: null | CD13: null | CE13: null | CF13: null | CI13: null | CL13: 1 | DF13: 0 | DG13: 0 | DK13: 1 | DT13: 0.1 | DV13: 1 | DW13: 1 | EF13: 390 | EG13: 2.8 | EO13: normal | EP13: 500 | FB13: ground,air | FC13: null | FH13: 0.2 | FI13: 0.1 | FJ13: 600 | FL13: 0 | GX13: orc | HA13: 0 | HB13: 0 | HC13: 0 | HD13: 0 | HH13: 0 | HJ13: 0 | HK13: null | HM13: 0 | HN13: 0 | HO13: 0 | HQ13: 1800 | HR13: 0 | HS13: 0 | ID13: 0
A14: OBJECT | B14: H502 | C14: Obla | D14: 3 | E14: ="[炼体]炼体 - "&RC[-1]&"阶" -> [炼体]炼体 - 3阶 | F14: ="打死完成炼体"&RC[-2]&"阶" -> 打死完成炼体3阶 | G14: 0.25 | H14: =INT(RC[4]/20) -> 11594 | I14: =INT(2000*RC[-5]*POWER(10,0.37*RC[-5])) -> 77294 | J14: 0 | K14: 0 | L14: =RC[-3]*3 -> 231882 | M14: =INT(RC[-4]/5) -> 15458 | N14: =RC[-1] -> 15458 | O14: =RC[-1] -> 15458 | P14: 4000 | Q14: 0 | R14: blp\book\3.blp | S14: Units\Creeps\GiantSeaTurtle\GiantSeaTurtle | T14: ="let _lt"&RC[-16]&" = new Challenge('L50"&MOD(RC[-16]-1,10)&"','"&RC[-18]&"',1,1)" -> let _lt3 = new Challenge('L502','H502',1,1) | U14: 1.1000000000000001 | Y14: 3 | Z14: 0 | AP14: null | AR14: null | AS14: null | BF14: null | BS14: 32 | BT14: Rifleman | CC14: null | CD14: null | CE14: null | CF14: null | CI14: null | CL14: 1 | DF14: 0 | DG14: 0 | DK14: 1 | DT14: 0.1 | DV14: 1 | DW14: 1 | EF14: 390 | EG14: 2.8 | EO14: normal | EP14: 500 | FB14: ground,air | FC14: null | FH14: 0.2 | FI14: 0.1 | FJ14: 600 | FL14: 0 | GX14: orc | HA14: 0 | HB14: 0 | HC14: 0 | HD14: 0 | HH14: 0 | HJ14: 0 | HK14: null | HM14: 0 | HN14: 0 | HO14: 0 | HQ14: 1800 | HR14: 0 | HS14: 0 | ID14: 0
A15: OBJECT | B15: H503 | C15: Obla | D15: 4 | E15: ="[炼体]炼体 - "&RC[-1]&"阶" -> [炼体]炼体 - 4阶 | F15: ="打死完成炼体"&RC[-2]&"阶" -> 打死完成炼体4阶 | G15: 0.25 | H15: =INT(RC[4]/20) -> 36239 | I15: =INT(2000*RC[-5]*POWER(10,0.37*RC[-5])) -> 241596 | J15: 0 | K15: 0 | L15: =RC[-3]*3 -> 724788 | M15: =INT(RC[-4]/5) -> 48319 | N15: =RC[-1] -> 48319 | O15: =RC[-1] -> 48319 | P15: 8000 | Q15: 0 | R15: blp\book\3.blp | S15: Units\Creeps\GiantSeaTurtle\GiantSeaTurtle | T15: ="let _lt"&RC[-16]&" = new Challenge('L50"&MOD(RC[-16]-1,10)&"','"&RC[-18]&"',1,1)" -> let _lt4 = new Challenge('L503','H503',1,1) | U15: 1 | Y15: 1 | Z15: 0 | AP15: null | AR15: null | AS15: null | BF15: null | BS15: 32 | BT15: Rifleman | CC15: null | CD15: null | CE15: null | CF15: null | CI15: null | CL15: 1 | DF15: 0 | DG15: 0 | DK15: 1 | DT15: 0.1 | DV15: 1 | DW15: 1 | EF15: 390 | EG15: 2.8 | EO15: normal | EP15: 500 | FB15: ground,air | FC15: null | FH15: 0.2 | FI15: 0.1 | FJ15: 600 | FL15: 0 | GX15: orc | HA15: 0 | HB15: 0 | HC15: 0 | HD15: 0 | HH15: 0 | HJ15: 0 | HK15: null | HM15: 0 | HN15: 0 | HO15: 0 | HQ15: 1800 | HR15: 0 | HS15: 0 | ID15: 0
A16: OBJECT | B16: H504 | C16: Obla | D16: 5 | E16: ="[炼体]炼体 - "&RC[-1]&"阶" -> [炼体]炼体 - 5阶 | F16: ="打死完成炼体"&RC[-2]&"阶" -> 打死完成炼体5阶 | G16: 0.25 | H16: =INT(RC[4]/20) -> 106191 | I16: =INT(2000*RC[-5]*POWER(10,0.37*RC[-5])) -> 707945 | J16: 0 | K16: 0 | L16: =RC[-3]*3 -> 2123835 | M16: =INT(RC[-4]/5) -> 141589 | N16: =RC[-1] -> 141589 | O16: =RC[-1] -> 141589 | P16: 16000 | Q16: 0 | R16: blp\book\3.blp | S16: Units\Creeps\GiantSeaTurtle\GiantSeaTurtle | T16: ="let _lt"&RC[-16]&" = new Challenge('L50"&MOD(RC[-16]-1,10)&"','"&RC[-18]&"',1,1)" -> let _lt5 = new Challenge('L504','H504',1,1) | U16: 1.05 | Y16: 2 | Z16: 0 | AP16: null | AR16: null | AS16: null | BF16: null | BS16: 32 | BT16: Rifleman | CC16: null | CD16: null | CE16: null | CF16: null | CI16: null | CL16: 1 | DF16: 0 | DG16: 0 | DK16: 1 | DT16: 0.1 | DV16: 1 | DW16: 1 | EF16: 390 | EG16: 2.8 | EO16: normal | EP16: 500 | FB16: ground,air | FC16: null | FH16: 0.2 | FI16: 0.1 | FJ16: 600 | FL16: 0 | GX16: orc | HA16: 0 | HB16: 0 | HC16: 0 | HD16: 0 | HH16: 0 | HJ16: 0 | HK16: null | HM16: 0 | HN16: 0 | HO16: 0 | HQ16: 1800 | HR16: 0 | HS16: 0 | ID16: 0
A17: OBJECT | B17: H505 | C17: Obla | D17: 6 | E17: ="[炼体]炼体 - "&RC[-1]&"阶" -> [炼体]炼体 - 6阶 | F17: ="打死完成炼体"&RC[-2]&"阶" -> 打死完成炼体6阶 | G17: 0.25 | H17: =INT(RC[4]/20) -> 298725 | I17: =INT(2000*RC[-5]*POWER(10,0.37*RC[-5])) -> 1991504 | J17: 0 | K17: 0 | L17: =RC[-3]*3 -> 5974512 | M17: =INT(RC[-4]/5) -> 398300 | N17: =RC[-1] -> 398300 | O17: =RC[-1] -> 398300 | P17: 0 | Q17: 3 | R17: blp\book\3.blp | S17: Units\Creeps\GiantSeaTurtle\GiantSeaTurtle | T17: ="let _lt"&RC[-16]&" = new Challenge('L50"&MOD(RC[-16]-1,10)&"','"&RC[-18]&"',1,1)" -> let _lt6 = new Challenge('L505','H505',1,1) | U17: 1.1000000000000001 | Y17: 3 | Z17: 0 | AP17: null | AR17: null | AS17: null | BF17: null | BS17: 32 | BT17: Rifleman | CC17: null | CD17: null | CE17: null | CF17: null | CI17: null | CL17: 1 | DF17: 0 | DG17: 0 | DK17: 1 | DT17: 0.1 | DV17: 1 | DW17: 1 | EF17: 390 | EG17: 2.8 | EO17: normal | EP17: 500 | FB17: ground,air | FC17: null | FH17: 0.2 | FI17: 0.1 | FJ17: 600 | FL17: 0 | GX17: orc | HA17: 0 | HB17: 0 | HC17: 0 | HD17: 0 | HH17: 0 | HJ17: 0 | HK17: null | HM17: 0 | HN17: 0 | HO17: 0 | HQ17: 1800 | HR17: 0 | HS17: 0 | ID17: 0
A18: OBJECT | B18: H506 | C18: Obla | D18: 7 | E18: ="[炼体]炼体 - "&RC[-1]&"阶" -> [炼体]炼体 - 7阶 | F18: ="打死完成炼体"&RC[-2]&"阶" -> 打死完成炼体7阶 | G18: 0.25 | H18: =INT(RC[4]/20) -> 816994 | I18: =INT(2000*RC[-5]*POWER(10,0.37*RC[-5])) -> 5446632 | J18: 0 | K18: 0 | L18: =RC[-3]*3 -> 16339896 | M18: =INT(RC[-4]/5) -> 1089326 | N18: =RC[-1] -> 1089326 | O18: =RC[-1] -> 1089326 | P18: 0 | Q18: 6 | R18: blp\book\3.blp | S18: Units\Creeps\GiantSeaTurtle\GiantSeaTurtle | T18: ="let _lt"&RC[-16]&" = new Challenge('L50"&MOD(RC[-16]-1,10)&"','"&RC[-18]&"',1,1)" -> let _lt7 = new Challenge('L506','H506',1,1) | U18: 1 | Y18: 1 | Z18: 0 | AP18: null | AR18: null | AS18: null | BF18: null | BS18: 32 | BT18: Rifleman | CC18: null | CD18: null | CE18: null | CF18: null | CI18: null | CL18: 1 | DF18: 0 | DG18: 0 | DK18: 1 | DT18: 0.1 | DV18: 1 | DW18: 1 | EF18: 390 | EG18: 2.8 | EO18: normal | EP18: 500 | FB18: ground,air | FC18: null | FH18: 0.2 | FI18: 0.1 | FJ18: 600 | FL18: 0 | GX18: orc | HA18: 0 | HB18: 0 | HC18: 0 | HD18: 0 | HH18: 0 | HJ18: 0 | HK18: null | HM18: 0 | HN18: 0 | HO18: 0 | HQ18: 1800 | HR18: 0 | HS18: 0 | ID18: 0
A19: OBJECT | B19: H507 | C19: Obla | D19: 8 | E19: ="[炼体]炼体 - "&RC[-1]&"阶" -> [炼体]炼体 - 8阶 | F19: ="打死完成炼体"&RC[-2]&"阶" -> 打死完成炼体8阶 | G19: 0.25 | H19: =INT(RC[4]/20) -> 2188825 | I19: =INT(2000*RC[-5]*POWER(10,0.37*RC[-5])) -> 14592173 | J19: 0 | K19: 0 | L19: =RC[-3]*3 -> 43776519 | M19: =INT(RC[-4]/5) -> 2918434 | N19: =RC[-1] -> 2918434 | O19: =RC[-1] -> 2918434 | P19: 0 | Q19: 12 | R19: blp\book\3.blp | S19: Units\Creeps\GiantSeaTurtle\GiantSeaTurtle | T19: ="let _lt"&RC[-16]&" = new Challenge('L50"&MOD(RC[-16]-1,10)&"','"&RC[-18]&"',1,1)" -> let _lt8 = new Challenge('L507','H507',1,1) | U19: 1.05 | Y19: 2 | Z19: 0 | AP19: null | AR19: null | AS19: null | BF19: null | BS19: 32 | BT19: Rifleman | CC19: null | CD19: null | CE19: null | CF19: null | CI19: null | CL19: 1 | DF19: 0 | DG19: 0 | DK19: 1 | DT19: 0.1 | DV19: 1 | DW19: 1 | EF19: 390 | EG19: 2.8 | EO19: normal | EP19: 500 | FB19: ground,air | FC19: null | FH19: 0.2 | FI19: 0.1 | FJ19: 600 | FL19: 0 | GX19: orc | HA19: 0 | HB19: 0 | HC19: 0 | HD19: 0 | HH19: 0 | HJ19: 0 | HK19: null | HM19: 0 | HN19: 0 | HO19: 0 | HQ19: 1800 | HR19: 0 | HS19: 0 | ID19: 0
A20: OBJECT | B20: H508 | C20: Obla | D20: 9 | E20: ="[炼体]炼体 - "&RC[-1]&"阶" -> [炼体]炼体 - 9阶 | F20: ="打死完成炼体"&RC[-2]&"阶" -> 打死完成炼体9阶 | G20: 0.25 | H20: =INT(RC[4]/20) -> 5772497 | I20: =INT(2000*RC[-5]*POWER(10,0.37*RC[-5])) -> 38483317 | J20: 0 | K20: 0 | L20: =RC[-3]*3 -> 115449951 | M20: =INT(RC[-4]/5) -> 7696663 | N20: =RC[-1] -> 7696663 | O20: =RC[-1] -> 7696663 | P20: 0 | Q20: 24 | R20: blp\book\3.blp | S20: Units\Creeps\GiantSeaTurtle\GiantSeaTurtle | T20: ="let _lt"&RC[-16]&" = new Challenge('L50"&MOD(RC[-16]-1,10)&"','"&RC[-18]&"',1,1)" -> let _lt9 = new Challenge('L508','H508',1,1) | U20: 1.1000000000000001 | Y20: 3 | Z20: 0 | AP20: null | AR20: null | AS20: null | BF20: null | BS20: 32 | BT20: Rifleman | CC20: null | CD20: null | CE20: null | CF20: null | CI20: null | CL20: 1 | DF20: 0 | DG20: 0 | DK20: 1 | DT20: 0.1 | DV20: 1 | DW20: 1 | EF20: 390 | EG20: 2.8 | EO20: normal | EP20: 500 | FB20: ground,air | FC20: null | FH20: 0.2 | FI20: 0.1 | FJ20: 600 | FL20: 0 | GX20: orc | HA20: 0 | HB20: 0 | HC20: 0 | HD20: 0 | HH20: 0 | HJ20: 0 | HK20: null | HM20: 0 | HN20: 0 | HO20: 0 | HQ20: 1800 | HR20: 0 | HS20: 0 | ID20: 0
A21: OBJECT | B21: H509 | C21: Obla | D21: 10 | E21: ="[炼体]炼体 - "&RC[-1]&"阶" -> [炼体]炼体 - 10阶 | F21: ="打死完成炼体"&RC[-2]&"阶" -> 打死完成炼体10阶 | G21: 0.25 | H21: =INT(RC[4]/20) -> 15035616 | I21: =INT(2000*RC[-5]*POWER(10,0.37*RC[-5])) -> 100237446 | J21: 0 | K21: 0 | L21: =RC[-3]*3 -> 300712338 | M21: =INT(RC[-4]/5) -> 20047489 | N21: =RC[-1] -> 20047489 | O21: =RC[-1] -> 20047489 | P21: 0 | Q21: 48 | R21: blp\book\3.blp | S21: Units\Creeps\GiantSeaTurtle\GiantSeaTurtle | T21: ="let _lt"&RC[-16]&" = new Challenge('L50"&MOD(RC[-16]-1,10)&"','"&RC[-18]&"',1,1)" -> let _lt10 = new Challenge('L509','H509',1,1) | U21: 1.1000000000000001 | Y21: 3 | Z21: 0 | AP21: null | AR21: null | AS21: null | BF21: null | BS21: 32 | BT21: Rifleman | CC21: null | CD21: null | CE21: null | CF21: null | CI21: null | CL21: 1 | DF21: 0 | DG21: 0 | DK21: 1 | DT21: 0.1 | DV21: 1 | DW21: 1 | EF21: 390 | EG21: 2.8 | EO21: normal | EP21: 500 | FB21: ground,air | FC21: null | FH21: 0.2 | FI21: 0.1 | FJ21: 600 | FL21: 0 | GX21: orc | HA21: 0 | HB21: 0 | HC21: 0 | HD21: 0 | HH21: 0 | HJ21: 0 | HK21: null | HM21: 0 | HN21: 0 | HO21: 0 | HQ21: 1800 | HR21: 0 | HS21: 0 | ID21: 0
A22: OBJECT | B22: JA01 | C22: Obla | D22: 1 | E22: ="[技能]挑战技能"&RC[-1] -> [技能]挑战技能1 | F22: 打死学习技能 | G22: 0.25 | H22: =INT(RC[4]/10) -> 3054 | I22: =INT(20000*0.13*RC[-5]*POWER(10,0.07*RC[-5])) -> 3054 | J22: 0 | K22: 0 | L22: =RC[-3]*10 -> 30540 | M22: 100 | N22: 100 | O22: 100 | P22: 10000 | Q22: 0 | R22: ReplaceableTextures\CommandButtons\BTNSkillz.blp | S22: units\undead\KelThuzadGhost\KelThuzadGhost | T22: ="let _jn"&RC[-16]&" = new Challenge('LA0"&MOD(RC[-16],10)&"','"&RC[-18]&"',1,1)" -> let _jn1 = new Challenge('LA01','JA01',1,1) | U22: 1.1499999999999999 | Y22: 4 | Z22: 0 | AP22: null | AR22: null | AS22: null | BF22: null | BS22: 32 | BT22: Rifleman | CC22: null | CD22: null | CE22: null | CF22: null | CI22: null | CL22: 1 | DF22: 0 | DG22: 0 | DK22: 1 | DT22: 0.1 | DV22: 1 | DW22: 1 | EF22: 390 | EG22: 2.8 | EO22: normal | EP22: 500 | FB22: ground,air | FC22: null | FH22: 0.2 | FI22: 0.1 | FJ22: 600 | FL22: 0 | GX22: orc | HA22: 0 | HB22: 0 | HC22: 0 | HD22: 0 | HH22: 0 | HJ22: 0 | HK22: null | HM22: 0 | HN22: 0 | HO22: 0 | HQ22: 1800 | HR22: 0 | HS22: 0 | ID22: 0
A23: OBJECT | B23: JA02 | C23: Obla | D23: 2 | E23: ="[技能]挑战技能"&RC[-1] -> [技能]挑战技能2 | F23: 打死学习技能 | G23: 0.25 | H23: =INT(RC[4]/10) -> 7177 | I23: =INT(20000*0.13*RC[-5]*POWER(10,0.07*RC[-5])) -> 7177 | J23: 0 | K23: 0 | L23: =RC[-3]*10 -> 71770 | M23: 100 | N23: 100 | O23: 100 | P23: 0 | Q23: 4 | R23: ReplaceableTextures\CommandButtons\BTNSkillz.blp | S23: units\undead\KelThuzadGhost\KelThuzadGhost | T23: ="let _jn"&RC[-16]&" = new Challenge('LA0"&MOD(RC[-16],10)&"','"&RC[-18]&"',1,1)" -> let _jn2 = new Challenge('LA02','JA02',1,1) | U23: 1.2 | Y23: 5 | Z23: 0 | AP23: null | AR23: null | AS23: null | BF23: null | BS23: 32 | BT23: Rifleman | CC23: null | CD23: null | CE23: null | CF23: null | CI23: null | CL23: 1 | DF23: 0 | DG23: 0 | DK23: 1 | DT23: 0.1 | DV23: 1 | DW23: 1 | EF23: 390 | EG23: 2.8 | EO23: normal | EP23: 500 | FB23: ground,air | FC23: null | FH23: 0.2 | FI23: 0.1 | FJ23: 600 | FL23: 0 | GX23: orc | HA23: 0 | HB23: 0 | HC23: 0 | HD23: 0 | HH23: 0 | HJ23: 0 | HK23: null | HM23: 0 | HN23: 0 | HO23: 0 | HQ23: 1800 | HR23: 0 | HS23: 0 | ID23: 0
A24: OBJECT | B24: JA03 | C24: Obla | D24: 3 | E24: ="[技能]挑战技能"&RC[-1] -> [技能]挑战技能3 | F24: 打死学习技能 | G24: 0.25 | H24: =INT(RC[4]/10) -> 12650 | I24: =INT(20000*0.13*RC[-5]*POWER(10,0.07*RC[-5])) -> 12650 | J24: 0 | K24: 0 | L24: =RC[-3]*10 -> 126500 | M24: 100 | N24: 100 | O24: 100 | P24: 0 | Q24: 16 | R24: ReplaceableTextures\CommandButtons\BTNSkillz.blp | S24: units\undead\KelThuzadGhost\KelThuzadGhost | T24: ="let _jn"&RC[-16]&" = new Challenge('LA0"&MOD(RC[-16],10)&"','"&RC[-18]&"',1,1)" -> let _jn3 = new Challenge('LA03','JA03',1,1) | U24: 1.25 | Y24: 6 | Z24: 0 | AP24: null | AR24: null | AS24: null | BF24: null | BS24: 32 | BT24: Rifleman | CC24: null | CD24: null | CE24: null | CF24: null | CI24: null | CL24: 1 | DF24: 0 | DG24: 0 | DK24: 1 | DT24: 0.1 | DV24: 1 | DW24: 1 | EF24: 390 | EG24: 2.8 | EO24: normal | EP24: 500 | FB24: ground,air | FC24: null | FH24: 0.2 | FI24: 0.1 | FJ24: 600 | FL24: 0 | GX24: orc | HA24: 0 | HB24: 0 | HC24: 0 | HD24: 0 | HH24: 0 | HJ24: 0 | HK24: null | HM24: 0 | HN24: 0 | HO24: 0 | HQ24: 1800 | HR24: 0 | HS24: 0 | ID24: 0
A25: OBJECT | B25: JA04 | C25: Obla | D25: 4 | E25: ="[技能]挑战技能"&RC[-1] -> [技能]挑战技能4 | F25: 打死学习技能 | G25: 0.25 | H25: =INT(RC[4]/10) -> 19816 | I25: =INT(20000*0.13*RC[-5]*POWER(10,0.07*RC[-5])) -> 19816 | J25: 0 | K25: 0 | L25: =RC[-3]*10 -> 198160 | M25: 100 | N25: 100 | O25: 100 | P25: 0 | Q25: 64 | R25: ReplaceableTextures\CommandButtons\BTNSkillz.blp | S25: units\undead\KelThuzadGhost\KelThuzadGhost | T25: ="let _jn"&RC[-16]&" = new Challenge('LA0"&MOD(RC[-16],10)&"','"&RC[-18]&"',1,1)" -> let _jn4 = new Challenge('LA04','JA04',1,1) | U25: 1.3 | Y25: 7 | Z25: 0 | AP25: null | AR25: null | AS25: null | BF25: null | BS25: 32 | BT25: Rifleman | CC25: null | CD25: null | CE25: null | CF25: null | CI25: null | CL25: 1 | DF25: 0 | DG25: 0 | DK25: 1 | DT25: 0.1 | DV25: 1 | DW25: 1 | EF25: 390 | EG25: 2.8 | EO25: normal | EP25: 500 | FB25: ground,air | FC25: null | FH25: 0.2 | FI25: 0.1 | FJ25: 600 | FL25: 0 | GX25: orc | HA25: 0 | HB25: 0 | HC25: 0 | HD25: 0 | HH25: 0 | HJ25: 0 | HK25: null | HM25: 0 | HN25: 0 | HO25: 0 | HQ25: 1800 | HR25: 0 | HS25: 0 | ID25: 0
A26: OBJECT | B26: H30A | C26: Obla | D26: 2 | E26: ="升级装备 Lv"&RC[-1]-1&" -> Lv"&RC[-1] -> 升级装备 Lv1 -> Lv2 | F26: 打死升级武器或者防具 | G26: 1 | H26: =INT(RC[1]/2) -> 252 | I26: =INT(80*RC[-5]*POWER(10,0.25*RC[-5])) -> 505 | J26: 0 | K26: 0 | L26: =RC[-3]*12 -> 6060 | M26: =INT(RC[-4]/5) -> 101 | N26: =RC[-1] -> 101 | O26: =RC[-1] -> 101 | P26: 2000 | Q26: 0 | R26: blp\baseItem\chall\SJBS01.blp | S26: units\creeps\Wendigo\Wendigo | T26: ="let _jb"&RC[-16]&" = new Challenge('L"&MID(RC[-18],FIND("H",RC[-18])+1,3)&"','"&RC[-18]&"',1,1)" -> let _jb2 = new Challenge('L30A','H30A',1,1) | U26: 0.75 | Y26: 2 | Z26: 0 | AP26: null | AR26: null | AS26: null | BF26: null | BS26: 32 | BT26: Rifleman | CC26: null | CD26: null | CE26: null | CF26: null | CI26: null | CL26: 1 | DF26: 0 | DG26: 0 | DK26: 1 | DT26: 0.1 | DV26: 1 | DW26: 1 | EF26: 390 | EG26: 2.8 | EO26: normal | EP26: 500 | FB26: ground,air | FC26: null | FH26: 0.2 | FI26: 0.1 | FJ26: 600 | FL26: 0 | GX26: orc | HA26: 0 | HB26: 0 | HC26: 0 | HD26: 0 | HH26: 0 | HJ26: 0 | HK26: null | HM26: 0 | HN26: 0 | HO26: 0 | HQ26: 1800 | HR26: 0 | HS26: 0 | ID26: 0
A27: OBJECT | B27: H30B | C27: Obla | D27: 3 | E27: ="升级装备 Lv"&RC[-1]-1&" -> Lv"&RC[-1] -> 升级装备 Lv2 -> Lv3 | F27: 打死升级武器或者防具 | G27: 1 | H27: =INT(RC[1]/2) -> 674 | I27: =INT(80*RC[-5]*POWER(10,0.25*RC[-5])) -> 1349 | J27: 0 | K27: 0 | L27: =RC[-3]*12 -> 16188 | M27: =INT(RC[-4]/5) -> 269 | N27: =RC[-1] -> 269 | O27: =RC[-1] -> 269 | P27: 4000 | Q27: 0 | R27: blp\baseItem\chall\SJBS02.blp | S27: units\creeps\Wendigo\Wendigo | T27: ="let _jb"&RC[-16]&" = new Challenge('L"&MID(RC[-18],FIND("H",RC[-18])+1,3)&"','"&RC[-18]&"',1,1)" -> let _jb3 = new Challenge('L30B','H30B',1,1) | U27: 0.8 | Y27: 4 | Z27: 0 | AP27: null | AR27: null | AS27: null | BF27: null | BS27: 32 | BT27: Rifleman | CC27: null | CD27: null | CE27: null | CF27: null | CI27: null | CL27: 1 | DF27: 0 | DG27: 0 | DK27: 1 | DT27: 0.1 | DV27: 1 | DW27: 1 | EF27: 390 | EG27: 2.8 | EO27: normal | EP27: 500 | FB27: ground,air | FC27: null | FH27: 0.2 | FI27: 0.1 | FJ27: 600 | FL27: 0 | GX27: orc | HA27: 0 | HB27: 0 | HC27: 0 | HD27: 0 | HH27: 0 | HJ27: 0 | HK27: null | HM27: 0 | HN27: 0 | HO27: 0 | HQ27: 1800 | HR27: 0 | HS27: 0 | ID27: 0
A28: OBJECT | B28: H30C | C28: Obla | D28: 4 | E28: ="升级装备 Lv"&RC[-1]-1&" -> Lv"&RC[-1] -> 升级装备 Lv3 -> Lv4 | F28: 打死升级武器或者防具 | G28: 1 | H28: =INT(RC[1]/2) -> 1600 | I28: =INT(80*RC[-5]*POWER(10,0.25*RC[-5])) -> 3200 | J28: 0 | K28: 0 | L28: =RC[-3]*12 -> 38400 | M28: =INT(RC[-4]/5) -> 640 | N28: =RC[-1] -> 640 | O28: =RC[-1] -> 640 | P28: 8000 | Q28: 0 | R28: blp\baseItem\chall\SJBS03.blp | S28: units\creeps\Wendigo\Wendigo | T28: ="let _jb"&RC[-16]&" = new Challenge('L"&MID(RC[-18],FIND("H",RC[-18])+1,3)&"','"&RC[-18]&"',1,1)" -> let _jb4 = new Challenge('L30C','H30C',1,1) | U28: 0.85 | Y28: 6 | Z28: 0 | AP28: null | AR28: null | AS28: null | BF28: null | BS28: 32 | BT28: Rifleman | CC28: null | CD28: null | CE28: null | CF28: null | CI28: null | CL28: 1 | DF28: 0 | DG28: 0 | DK28: 1 | DT28: 0.1 | DV28: 1 | DW28: 1 | EF28: 390 | EG28: 2.8 | EO28: normal | EP28: 500 | FB28: ground,air | FC28: null | FH28: 0.2 | FI28: 0.1 | FJ28: 600 | FL28: 0 | GX28: orc | HA28: 0 | HB28: 0 | HC28: 0 | HD28: 0 | HH28: 0 | HJ28: 0 | HK28: null | HM28: 0 | HN28: 0 | HO28: 0 | HQ28: 1800 | HR28: 0 | HS28: 0 | ID28: 0
A29: OBJECT | B29: H30D | C29: Obla | D29: 5 | E29: ="升级装备 Lv"&RC[-1]-1&" -> Lv"&RC[-1] -> 升级装备 Lv4 -> Lv5 | F29: 打死升级武器或者防具 | G29: 1 | H29: =INT(RC[1]/2) -> 3556 | I29: =INT(80*RC[-5]*POWER(10,0.25*RC[-5])) -> 7113 | J29: 0 | K29: 0 | L29: =RC[-3]*12 -> 85356 | M29: =INT(RC[-4]/5) -> 1422 | N29: =RC[-1] -> 1422 | O29: =RC[-1] -> 1422 | P29: 16000 | Q29: 0 | R29: blp\baseItem\chall\SJBS04.blp | S29: units\creeps\Wendigo\Wendigo | T29: ="let _jb"&RC[-16]&" = new Challenge('L"&MID(RC[-18],FIND("H",RC[-18])+1,3)&"','"&RC[-18]&"',1,1)" -> let _jb5 = new Challenge('L30D','H30D',1,1) | U29: 0.9 | Y29: 8 | Z29: 0 | AP29: null | AR29: null | AS29: null | BF29: null | BS29: 32 | BT29: Rifleman | CC29: null | CD29: null | CE29: null | CF29: null | CI29: null | CL29: 1 | DF29: 0 | DG29: 0 | DK29: 1 | DT29: 0.1 | DV29: 1 | DW29: 1 | EF29: 390 | EG29: 2.8 | EO29: normal | EP29: 500 | FB29: ground,air | FC29: null | FH29: 0.2 | FI29: 0.1 | FJ29: 600 | FL29: 0 | GX29: orc | HA29: 0 | HB29: 0 | HC29: 0 | HD29: 0 | HH29: 0 | HJ29: 0 | HK29: null | HM29: 0 | HN29: 0 | HO29: 0 | HQ29: 1800 | HR29: 0 | HS29: 0 | ID29: 0
A30: OBJECT | B30: H441 | C30: Obla | D30: 淡蓝之索拉 | E30: =RC[-1]&"魂体" -> 淡蓝之索拉魂体 | F30: 打死掉落圣魂结晶 | G30: 0.5 | H30: =INT(RC[4]/10) -> 0 | I30: 1 | J30: 0 | K30: 0 | L30: 1 | M30: 1 | N30: 1 | O30: 1 | P30: 0 | Q30: 0 | R30: ReplaceableTextures\CommandButtons\BTNOrbOfFrost.blp | S30: Units\Creeps\StormPandarenBrewmaster\StormPandarenBrewmaster | T30: ="let _hb"&RC[-14]&" = new Challenge('L40"&RC[-14]&"','H40"&RC[-14]&"',1)" -> let _hb打死掉落圣魂结晶 = new Challenge('L40打死掉落圣魂结晶','H40打死掉落圣魂结晶',1) | Y30: 24 | Z30: 0 | AP30: null | AR30: null | AS30: null | BF30: null | BS30: 32 | BT30: Rifleman | CC30: null | CD30: null | CE30: null | CF30: null | CI30: null | CL30: 1 | DF30: 0 | DG30: 0 | DK30: 1 | DT30: 0.1 | DV30: 1 | DW30: 1 | EF30: 390 | EG30: 2.8 | EO30: normal | EP30: 500 | FB30: ground,air | FC30: null | FH30: 0.2 | FI30: 0.1 | FJ30: 600 | FL30: 0 | GX30: orc | HA30: 0 | HB30: 0 | HC30: 0 | HD30: 0 | HH30: 0 | HJ30: 0 | HK30: null | HM30: 0 | HN30: 0 | HO30: 0 | HQ30: 1800 | HR30: 0 | HS30: 0 | ID30: 0
A31: OBJECT | B31: H442 | C31: Obla | D31: 赤炎之菲尼克斯 | E31: =RC[-1]&"魂体" -> 赤炎之菲尼克斯魂体 | F31: 打死掉落圣魂结晶 | G31: 0.5 | H31: =INT(RC[4]/10) -> 0 | I31: 1 | J31: 0 | K31: 0 | L31: 1 | M31: 1 | N31: 1 | O31: 1 | P31: 0 | Q31: 0 | R31: ReplaceableTextures\CommandButtons\BTNOrbOfFire.blp | S31: Units\Creeps\FirePandarenBrewmaster\FirePandarenBrewmaster | T31: ="let _hb"&RC[-14]&" = new Challenge('L40"&RC[-14]&"','H40"&RC[-14]&"',1)" -> let _hb打死掉落圣魂结晶 = new Challenge('L40打死掉落圣魂结晶','H40打死掉落圣魂结晶',1) | Y31: 24 | Z31: 0 | AP31: null | AR31: null | AS31: null | BF31: null | BS31: 32 | BT31: Rifleman | CC31: null | CD31: null | CE31: null | CF31: null | CI31: null | CL31: 1 | DF31: 0 | DG31: 0 | DK31: 1 | DT31: 0.1 | DV31: 1 | DW31: 1 | EF31: 390 | EG31: 2.8 | EO31: normal | EP31: 500 | FB31: ground,air | FC31: null | FH31: 0.2 | FI31: 0.1 | FJ31: 600 | FL31: 0 | GX31: orc | HA31: 0 | HB31: 0 | HC31: 0 | HD31: 0 | HH31: 0 | HJ31: 0 | HK31: null | HM31: 0 | HN31: 0 | HO31: 0 | HQ31: 1800 | HR31: 0 | HS31: 0 | ID31: 0
A32: OBJECT | B32: H443 | C32: Obla | D32: 圣光之米歇尔 | E32: =RC[-1]&"魂体" -> 圣光之米歇尔魂体 | F32: 打死掉落圣魂结晶 | G32: 0.5 | H32: =INT(RC[4]/10) -> 0 | I32: 1 | J32: 0 | K32: 0 | L32: 1 | M32: 1 | N32: 1 | O32: 1 | P32: 0 | Q32: 0 | R32: ReplaceableTextures\CommandButtons\BTNHolyBolt.blp | S32: Units\Creeps\EarthPandarenBrewmaster\EarthPandarenBrewmaster | T32: ="let _hb"&RC[-14]&" = new Challenge('L40"&RC[-14]&"','H40"&RC[-14]&"',1)" -> let _hb打死掉落圣魂结晶 = new Challenge('L40打死掉落圣魂结晶','H40打死掉落圣魂结晶',1) | Y32: 24 | Z32: 0 | AP32: null | AR32: null | AS32: null | BF32: null | BS32: 32 | BT32: Rifleman | CC32: null | CD32: null | CE32: null | CF32: null | CI32: null | CL32: 1 | DF32: 0 | DG32: 0 | DK32: 1 | DT32: 0.1 | DV32: 1 | DW32: 1 | EF32: 390 | EG32: 2.8 | EO32: normal | EP32: 500 | FB32: ground,air | FC32: null | FH32: 0.2 | FI32: 0.1 | FJ32: 600 | FL32: 0 | GX32: orc | HA32: 0 | HB32: 0 | HC32: 0 | HD32: 0 | HH32: 0 | HJ32: 0 | HK32: null | HM32: 0 | HN32: 0 | HO32: 0 | HQ32: 1800 | HR32: 0 | HS32: 0 | ID32: 0
A33: OBJECT | B33: H444 | C33: Obla | D33: 暗黑之撒旦 | E33: =RC[-1]&"魂体" -> 暗黑之撒旦魂体 | F33: 打死掉落圣魂结晶 | G33: 0.5 | H33: =INT(RC[4]/10) -> 0 | I33: 1 | J33: 0 | K33: 0 | L33: 1 | M33: 1 | N33: 1 | O33: 1 | P33: 0 | Q33: 0 | R33: ReplaceableTextures\CommandButtons\BTNOrbOfDarkness.blp | S33: Units\Creeps\EarthPandarenBrewmaster\EarthPandarenBrewmaster | T33: ="let _hb"&RC[-14]&" = new Challenge('L40"&RC[-14]&"','H40"&RC[-14]&"',1)" -> let _hb打死掉落圣魂结晶 = new Challenge('L40打死掉落圣魂结晶','H40打死掉落圣魂结晶',1) | V33: 0 | W33: 0 | X33: 0 | Y33: 24 | Z33: 0 | AP33: null | AR33: null | AS33: null | BF33: null | BS33: 32 | BT33: Rifleman | CC33: null | CD33: null | CE33: null | CF33: null | CI33: null | CL33: 1 | DF33: 0 | DG33: 0 | DK33: 1 | DT33: 0.1 | DV33: 1 | DW33: 1 | EF33: 390 | EG33: 2.8 | EO33: normal | EP33: 500 | FB33: ground,air | FC33: null | FH33: 0.2 | FI33: 0.1 | FJ33: 600 | FL33: 0 | GX33: orc | HA33: 0 | HB33: 0 | HC33: 0 | HD33: 0 | HH33: 0 | HJ33: 0 | HK33: null | HM33: 0 | HN33: 0 | HO33: 0 | HQ33: 1800 | HR33: 0 | HS33: 0 | ID33: 0
A34: OBJECT | B34: H445 | C34: Obla | D34: 纯白之雪 | E34: =RC[-1]&"魂体" -> 纯白之雪魂体 | F34: 打死掉落圣魂结晶 | G34: 0.5 | H34: =INT(RC[4]/10) -> 0 | I34: 1 | J34: 0 | K34: 0 | L34: 1 | M34: 1 | N34: 1 | O34: 1 | P34: 0 | Q34: 0 | R34: ReplaceableTextures\CommandButtons\BTNOrbOfLightning.blp | S34: Units\Creeps\FirePandarenBrewmaster\FirePandarenBrewmaster | T34: ="let _hb"&RC[-14]&" = new Challenge('L40"&RC[-14]&"','H40"&RC[-14]&"',1)" -> let _hb打死掉落圣魂结晶 = new Challenge('L40打死掉落圣魂结晶','H40打死掉落圣魂结晶',1) | V34: 0 | Y34: 24 | Z34: 0 | AP34: null | AR34: null | AS34: null | BF34: null | BS34: 32 | BT34: Rifleman | CC34: null | CD34: null | CE34: null | CF34: null | CI34: null | CL34: 1 | DF34: 0 | DG34: 0 | DK34: 1 | DT34: 0.1 | DV34: 1 | DW34: 1 | EF34: 390 | EG34: 2.8 | EO34: normal | EP34: 500 | FB34: ground,air | FC34: null | FH34: 0.2 | FI34: 0.1 | FJ34: 600 | FL34: 0 | GX34: orc | HA34: 0 | HB34: 0 | HC34: 0 | HD34: 0 | HH34: 0 | HJ34: 0 | HK34: null | HM34: 0 | HN34: 0 | HO34: 0 | HQ34: 1800 | HR34: 0 | HS34: 0 | ID34: 0
A35: OBJECT | B35: H401 | C35: Obla | D35: |CFFB6D7A8石化水晶|r | E35: 水晶石人[掉落:|CFFB6D7A8石化水晶|r] | F35: ="掉落"&RC[-2]&"|n用于升级宝珠" -> 掉落|CFFB6D7A8石化水晶|r|n用于升级宝珠 | G35: 0.35 | H35: =INT(RC[4]/50) -> 100000 | I35: =INT(RC[3]/10) -> 500000 | J35: 0 | K35: 0 | L35: 5000000 | M35: 500 | N35: =RC[-1] -> 500 | O35: =RC[-2] -> 500 | P35: 0 | Q35: 0 | R35: ReplaceableTextures\CommandButtons\BTNEnchantedGemstone.blp | S35: Units\Creeps\EarthPandarenBrewmaster\EarthPandarenBrewmaster | T35: ="let _hb"&RC[-16]&" = new Challenge('L40"&RC[-16]&"','H40"&RC[-16]&"',1)" -> let _hb|CFFB6D7A8石化水晶|r = new Challenge('L40|CFFB6D7A8石化水晶|r','H40|CFFB6D7A8石化水晶|r',1) | Y35: 8 | Z35: 0 | AP35: null | AR35: null | AS35: null | BF35: null | BS35: 32 | BT35: Rifleman | CC35: null | CD35: null | CE35: null | CF35: null | CI35: null | CL35: 1 | DF35: 0 | DG35: 0 | DK35: 1 | DT35: 0.1 | DV35: 1 | DW35: 1 | EF35: 390 | EG35: 2.8 | EO35: normal | EP35: 500 | FB35: ground,air | FC35: null | FH35: 0.2 | FI35: 0.1 | FJ35: 600 | FL35: 0 | GX35: orc | HA35: 0 | HB35: 0 | HC35: 0 | HD35: 0 | HH35: 0 | HJ35: 0 | HK35: null | HM35: 0 | HN35: 0 | HO35: 0 | HQ35: 1800 | HR35: 0 | HS35: 0 | ID35: 0
A36: OBJECT | B36: H402 | C36: Obla | D36: |cFF99FF66精炼晶石|r | E36: 精炼石人[掉落:|cFF99FF66精炼晶石|r] | F36: ="掉落"&RC[-2]&"|n用于升级宝珠" -> 掉落|cFF99FF66精炼晶石|r|n用于升级宝珠 | G36: 0.35 | H36: =INT(RC[4]/50) -> 500000 | I36: =INT(RC[3]/10) -> 2500000 | J36: 0 | K36: 0 | L36: 25000000 | M36: 1000 | N36: =RC[-1] -> 1000 | O36: =RC[-2] -> 1000 | P36: 0 | Q36: 0 | R36: ReplaceableTextures\CommandButtons\BTNStaffOfNegation.blp | S36: units\nightelf\HeroDemonHunter\HeroDemonHunter | T36: ="let _hb"&RC[-16]&" = new Challenge('L40"&RC[-16]&"','H40"&RC[-16]&"',1)" -> let _hb|cFF99FF66精炼晶石|r = new Challenge('L40|cFF99FF66精炼晶石|r','H40|cFF99FF66精炼晶石|r',1) | Y36: 12 | Z36: 0 | AP36: null | AR36: null | AS36: null | BF36: null | BS36: 32 | BT36: Rifleman | CC36: null | CD36: null | CE36: null | CF36: null | CI36: null | CL36: 1 | DF36: 0 | DG36: 0 | DK36: 1 | DT36: 0.1 | DV36: 1 | DW36: 1 | EF36: 390 | EG36: 2.8 | EO36: normal | EP36: 500 | FB36: ground,air | FC36: null | FH36: 0.2 | FI36: 0.1 | FJ36: 600 | FL36: 0 | GX36: orc | HA36: 0 | HB36: 0 | HC36: 0 | HD36: 0 | HH36: 0 | HJ36: 0 | HK36: null | HM36: 0 | HN36: 0 | HO36: 0 | HQ36: 1800 | HR36: 0 | HS36: 0 | ID36: 0
A37: OBJECT | B37: H403 | C37: Obla | D37: |cFF1BE6B8玄天灵髓|r | E37: 玄天石人[掉落:|cFF1BE6B8玄天灵髓|r] | F37: ="掉落"&RC[-2]&"|n用于升级宝珠" -> 掉落|cFF1BE6B8玄天灵髓|r|n用于升级宝珠 | G37: 0.35 | H37: =INT(RC[4]/50) -> 2500000 | I37: =INT(RC[3]/10) -> 12500000 | J37: 0 | K37: 0 | L37: 125000000 | M37: 5000 | N37: =RC[-1] -> 5000 | O37: =RC[-2] -> 5000 | P37: 0 | Q37: 0 | R37: ReplaceableTextures\CommandButtons\BTNHeartOfSearinox.blp | S37: units\nightelf\Furion\Furion | T37: ="let _hb"&RC[-16]&" = new Challenge('L40"&RC[-16]&"','H40"&RC[-16]&"',1)" -> let _hb|cFF1BE6B8玄天灵髓|r = new Challenge('L40|cFF1BE6B8玄天灵髓|r','H40|cFF1BE6B8玄天灵髓|r',1) | Y37: 16 | Z37: 0 | AP37: null | AR37: null | AS37: null | BF37: null | BS37: 32 | BT37: Rifleman | CC37: null | CD37: null | CE37: null | CF37: null | CI37: null | CL37: 1 | DF37: 0 | DG37: 0 | DK37: 1 | DT37: 0.1 | DV37: 1 | DW37: 1 | EF37: 390 | EG37: 2.8 | EO37: normal | EP37: 500 | FB37: ground,air | FC37: null | FH37: 0.2 | FI37: 0.1 | FJ37: 600 | FL37: 0 | GX37: orc | HA37: 0 | HB37: 0 | HC37: 0 | HD37: 0 | HH37: 0 | HJ37: 0 | HK37: null | HM37: 0 | HN37: 0 | HO37: 0 | HQ37: 1800 | HR37: 0 | HS37: 0 | ID37: 0
A38: OBJECT | B38: H404 | C38: Obla | D38: |cFF33FF00传说气息|r | E38: 上古石人[掉落:|cFF33FF00传说气息|r] | F38: ="掉落"&RC[-2]&"|n用于升级宝珠" -> 掉落|cFF33FF00传说气息|r|n用于升级宝珠 | G38: 0.35 | H38: =INT(RC[4]/50) -> 12500000 | I38: =INT(RC[3]/10) -> 62500000 | J38: 0 | K38: 0 | L38: 625000000 | M38: 10000 | N38: =RC[-1] -> 10000 | O38: =RC[-2] -> 10000 | P38: 0 | Q38: 0 | R38: ReplaceableTextures\CommandButtons\BTNStaffOfSanctuary.blp | S38: units\undead\Tichondrius\Tichondrius | T38: ="let _hb"&RC[-16]&" = new Challenge('L40"&RC[-16]&"','H40"&RC[-16]&"',1)" -> let _hb|cFF33FF00传说气息|r = new Challenge('L40|cFF33FF00传说气息|r','H40|cFF33FF00传说气息|r',1) | Y38: 20 | Z38: 0 | AP38: null | AR38: null | AS38: null | BF38: null | BS38: 32 | BT38: Rifleman | CC38: null | CD38: null | CE38: null | CF38: null | CI38: null | CL38: 1 | DF38: 0 | DG38: 0 | DK38: 1 | DT38: 0.1 | DV38: 1 | DW38: 1 | EF38: 390 | EG38: 2.8 | EO38: normal | EP38: 500 | FB38: ground,air | FC38: null | FH38: 0.2 | FI38: 0.1 | FJ38: 600 | FL38: 0 | GX38: orc | HA38: 0 | HB38: 0 | HC38: 0 | HD38: 0 | HH38: 0 | HJ38: 0 | HK38: null | HM38: 0 | HN38: 0 | HO38: 0 | HQ38: 1800 | HR38: 0 | HS38: 0 | ID38: 0
A39: OBJECT | B39: H700 | C39: Obla | D39: 雪山-雪狐皮毛 | E39: |cFF33FF00雪狐|r | F39: ="掉落|cFF33FF00"&RC[-2]&"|r" -> 掉落|cFF33FF00雪山-雪狐皮毛|r | G39: 0.25 | H39: =INT(RC[4]/50) -> 2000000 | I39: =INT(RC[3]/10) -> 10000000 | J39: 0 | K39: 0 | L39: 100000000 | M39: 10000 | N39: =RC[-1] -> 10000 | O39: =RC[-2] -> 10000 | P39: 0 | Q39: 0 | S39: units\creeps\TimberWolf\TimberWolf | T39: ="let _hb"&RC[-16]&" = new Challenge('L70"&RC[-16]&"','H70"&RC[-16]&"',1)" -> let _hb雪山-雪狐皮毛 = new Challenge('L70雪山-雪狐皮毛','H70雪山-雪狐皮毛',1) | U39: 1.2 | Y39: 4 | Z39: 0 | AP39: null | AR39: null | AS39: null | BF39: null | BS39: 32 | BT39: Rifleman | CC39: null | CD39: null | CE39: null | CF39: null | CI39: null | CL39: 1 | DF39: 0 | DG39: 0 | DK39: 1 | DT39: 0.1 | DV39: 1 | DW39: 1 | EF39: 390 | EG39: 2.8 | EO39: normal | EP39: 500 | FB39: ground,air | FC39: null | FH39: 0.2 | FI39: 0.1 | FJ39: 600 | FL39: 0 | GX39: orc | HA39: 0 | HB39: 0 | HC39: 0 | HD39: 0 | HH39: 0 | HJ39: 0 | HK39: null | HM39: 0 | HN39: 0 | HO39: 0 | HQ39: 1800 | HR39: 0 | HS39: 0 | ID39: 0
A40: OBJECT | B40: H701 | C40: Obla | D40: 雪山-雪熊利爪 | E40: |cFF33FF00雪熊|r | F40: ="掉落|cFF33FF00"&RC[-2]&"|r" -> 掉落|cFF33FF00雪山-雪熊利爪|r | G40: 0.25 | H40: =INT(RC[4]/50) -> 2000000 | I40: =INT(RC[3]/10) -> 10000000 | J40: 0 | K40: 0 | L40: 100000000 | M40: 10000 | N40: =RC[-1] -> 10000 | O40: =RC[-2] -> 10000 | P40: 0 | Q40: 0 | S40: units\creeps\PolarBear\PolarBear | T40: ="let _hb"&RC[-16]&" = new Challenge('L70"&RC[-16]&"','H70"&RC[-16]&"',1)" -> let _hb雪山-雪熊利爪 = new Challenge('L70雪山-雪熊利爪','H70雪山-雪熊利爪',1) | U40: 1 | Y40: 4 | Z40: 0 | AP40: null | AR40: null | AS40: null | BF40: null | BS40: 32 | BT40: Rifleman | CC40: null | CD40: null | CE40: null | CF40: null | CI40: null | CL40: 1 | DF40: 0 | DG40: 0 | DK40: 1 | DT40: 0.1 | DV40: 1 | DW40: 1 | EF40: 390 | EG40: 2.8 | EO40: normal | EP40: 500 | FB40: ground,air | FC40: null | FH40: 0.2 | FI40: 0.1 | FJ40: 600 | FL40: 0 | GX40: orc | HA40: 0 | HB40: 0 | HC40: 0 | HD40: 0 | HH40: 0 | HJ40: 0 | HK40: null | HM40: 0 | HN40: 0 | HO40: 0 | HQ40: 1800 | HR40: 0 | HS40: 0 | ID40: 0
A41: OBJECT | B41: H702 | C41: Obla | D41: 雪山-雪鸟羽毛 | E41: |cFF33FF00雪鸟|r | F41: ="掉落|cFF33FF00"&RC[-2]&"|r" -> 掉落|cFF33FF00雪山-雪鸟羽毛|r | G41: 0.25 | H41: =INT(RC[4]/50) -> 2000000 | I41: =INT(RC[3]/10) -> 10000000 | J41: 0 | K41: 0 | L41: 100000000 | M41: 10000 | N41: =RC[-1] -> 10000 | O41: =RC[-2] -> 10000 | P41: 0 | Q41: 0 | S41: units\creeps\BansheeGhost\BansheeGhost | T41: ="let _hb"&RC[-16]&" = new Challenge('L70"&RC[-16]&"','H70"&RC[-16]&"',1)" -> let _hb雪山-雪鸟羽毛 = new Challenge('L70雪山-雪鸟羽毛','H70雪山-雪鸟羽毛',1) | U41: 1.6 | Y41: 4 | Z41: 0 | AP41: null | AR41: null | AS41: null | BF41: null | BS41: 32 | BT41: Rifleman | CC41: null | CD41: null | CE41: null | CF41: null | CI41: null | CL41: 1 | DF41: 0 | DG41: 0 | DK41: 1 | DT41: 0.1 | DV41: 1 | DW41: 1 | EF41: 390 | EG41: 2.8 | EO41: normal | EP41: 500 | FB41: ground,air | FC41: null | FH41: 0.2 | FI41: 0.1 | FJ41: 600 | FL41: 0 | GX41: orc | HA41: 0 | HB41: 0 | HC41: 0 | HD41: 0 | HH41: 0 | HJ41: 0 | HK41: null | HM41: 0 | HN41: 0 | HO41: 0 | HQ41: 1800 | HR41: 0 | HS41: 0 | ID41: 0
A42: OBJECT | B42: H703 | C42: Obla | D42: 万年玄冰碎片-寒 | E42: |cFF33FF00万年玄冰巨人-寒|r | F42: ="掉落|cFF33FF00"&RC[-2]&"|r" -> 掉落|cFF33FF00万年玄冰碎片-寒|r | G42: 0.25 | H42: =INT(RC[4]/50) -> 4500000 | I42: =INT(RC[3]/10) -> 22500000 | J42: 0 | K42: 0 | L42: 225000000 | M42: 10000 | N42: =RC[-1] -> 10000 | O42: =RC[-2] -> 10000 | P42: 0 | Q42: 0 | S42: units\demon\FelgaurdBlue\FelgaurdBlue | T42: ="let _hb"&RC[-16]&" = new Challenge('L70"&RC[-16]&"','H70"&RC[-16]&"',1)" -> let _hb万年玄冰碎片-寒 = new Challenge('L70万年玄冰碎片-寒','H70万年玄冰碎片-寒',1) | U42: 2 | V42: 0 | Y42: 4 | Z42: 0 | AP42: null | AR42: null | AS42: null | BF42: null | BS42: 32 | BT42: Rifleman | CC42: null | CD42: null | CE42: null | CF42: null | CI42: null | CL42: 1 | DF42: 0 | DG42: 0 | DK42: 1 | DT42: 0.1 | DV42: 1 | DW42: 1 | EF42: 390 | EG42: 2.8 | EO42: normal | EP42: 500 | FB42: ground,air | FC42: null | FH42: 0.2 | FI42: 0.1 | FJ42: 600 | FL42: 0 | GX42: orc | HA42: 0 | HB42: 0 | HC42: 0 | HD42: 0 | HH42: 0 | HJ42: 0 | HK42: null | HM42: 0 | HN42: 0 | HO42: 0 | HQ42: 1800 | HR42: 0 | HS42: 0 | ID42: 0
A43: OBJECT | B43: H704 | C43: Obla | D43: 万年玄冰碎片-霜 | E43: |cFF33FF00万年玄冰巨人-霜|r | F43: ="掉落|cFF33FF00"&RC[-2]&"|r" -> 掉落|cFF33FF00万年玄冰碎片-霜|r | G43: 0.25 | H43: =INT(RC[4]/50) -> 4500000 | I43: =INT(RC[3]/10) -> 22500000 | J43: 0 | K43: 0 | L43: 225000000 | M43: 10000 | N43: =RC[-1] -> 10000 | O43: =RC[-2] -> 10000 | P43: 0 | Q43: 0 | S43: units\demon\FelgaurdBlue\FelgaurdBlue | T43: ="let _hb"&RC[-16]&" = new Challenge('L70"&RC[-16]&"','H70"&RC[-16]&"',1)" -> let _hb万年玄冰碎片-霜 = new Challenge('L70万年玄冰碎片-霜','H70万年玄冰碎片-霜',1) | U43: 2 | X43: 0 | Y43: 4 | Z43: 0 | AP43: null | AR43: null | AS43: null | BF43: null | BS43: 32 | BT43: Rifleman | CC43: null | CD43: null | CE43: null | CF43: null | CI43: null | CL43: 1 | DF43: 0 | DG43: 0 | DK43: 1 | DT43: 0.1 | DV43: 1 | DW43: 1 | EF43: 390 | EG43: 2.8 | EO43: normal | EP43: 500 | FB43: ground,air | FC43: null | FH43: 0.2 | FI43: 0.1 | FJ43: 600 | FL43: 0 | GX43: orc | HA43: 0 | HB43: 0 | HC43: 0 | HD43: 0 | HH43: 0 | HJ43: 0 | HK43: null | HM43: 0 | HN43: 0 | HO43: 0 | HQ43: 1800 | HR43: 0 | HS43: 0 | ID43: 0
A44: OBJECT | B44: H705 | C44: Obla | D44: 万年玄冰碎片-冰 | E44: |cFF33FF00万年玄冰巨人-冰|r | F44: ="掉落|cFF33FF00"&RC[-2]&"|r" -> 掉落|cFF33FF00万年玄冰碎片-冰|r | G44: 0.25 | H44: =INT(RC[4]/50) -> 4500000 | I44: =INT(RC[3]/10) -> 22500000 | J44: 0 | K44: 0 | L44: 225000000 | M44: 10000 | N44: =RC[-1] -> 10000 | O44: =RC[-2] -> 10000 | P44: 0 | Q44: 0 | S44: units\demon\FelgaurdBlue\FelgaurdBlue | T44: ="let _hb"&RC[-16]&" = new Challenge('L70"&RC[-16]&"','H70"&RC[-16]&"',1)" -> let _hb万年玄冰碎片-冰 = new Challenge('L70万年玄冰碎片-冰','H70万年玄冰碎片-冰',1) | U44: 2 | V44: 50 | X44: 50 | Y44: 4 | Z44: 0 | AP44: null | AR44: null | AS44: null | BF44: null | BS44: 32 | BT44: Rifleman | CC44: null | CD44: null | CE44: null | CF44: null | CI44: null | CL44: 1 | DF44: 0 | DG44: 0 | DK44: 1 | DT44: 0.1 | DV44: 1 | DW44: 1 | EF44: 390 | EG44: 2.8 | EO44: normal | EP44: 500 | FB44: ground,air | FC44: null | FH44: 0.2 | FI44: 0.1 | FJ44: 600 | FL44: 0 | GX44: orc | HA44: 0 | HB44: 0 | HC44: 0 | HD44: 0 | HH44: 0 | HJ44: 0 | HK44: null | HM44: 0 | HN44: 0 | HO44: 0 | HQ44: 1800 | HR44: 0 | HS44: 0 | ID44: 0
A45: OBJECT | B45: H706 | C45: Obla | D45: 万年玄冰碎片-雪 | E45: |cFF33FF00万年玄冰巨人-雪|r | F45: ="掉落|cFF33FF00"&RC[-2]&"|r" -> 掉落|cFF33FF00万年玄冰碎片-雪|r | G45: 0.25 | H45: =INT(RC[4]/50) -> 4500000 | I45: =INT(RC[3]/10) -> 22500000 | J45: 0 | K45: 0 | L45: 225000000 | M45: 10000 | N45: =RC[-1] -> 10000 | O45: =RC[-2] -> 10000 | P45: 0 | Q45: 0 | S45: units\demon\FelgaurdBlue\FelgaurdBlue | T45: ="let _hb"&RC[-16]&" = new Challenge('L70"&RC[-16]&"','H70"&RC[-16]&"',1)" -> let _hb万年玄冰碎片-雪 = new Challenge('L70万年玄冰碎片-雪','H70万年玄冰碎片-雪',1) | U45: 2 | V45: 100 | X45: 100 | Y45: 4 | Z45: 0 | AP45: null | AR45: null | AS45: null | BF45: null | BS45: 32 | BT45: Rifleman | CC45: null | CD45: null | CE45: null | CF45: null | CI45: null | CL45: 1 | DF45: 0 | DG45: 0 | DK45: 1 | DT45: 0.1 | DV45: 1 | DW45: 1 | EF45: 390 | EG45: 2.8 | EO45: normal | EP45: 500 | FB45: ground,air | FC45: null | FH45: 0.2 | FI45: 0.1 | FJ45: 600 | FL45: 0 | GX45: orc | HA45: 0 | HB45: 0 | HC45: 0 | HD45: 0 | HH45: 0 | HJ45: 0 | HK45: null | HM45: 0 | HN45: 0 | HO45: 0 | HQ45: 1800 | HR45: 0 | HS45: 0 | ID45: 0
A46: OBJECT | B46: H707 | C46: Obla | D46: 雪山罡风 | E46: |cFF33FF00雪山罡风|r | F46: ="掉落|cFF33FF00"&RC[-2]&"|r" -> 掉落|cFF33FF00雪山罡风|r | G46: 0.25 | H46: =INT(RC[4]/50) -> 7600000 | I46: =INT(RC[3]/10) -> 38000000 | J46: 0 | K46: 0 | L46: 380000000 | M46: 10000 | N46: =RC[-1] -> 10000 | O46: =RC[-2] -> 10000 | P46: 0 | Q46: 0 | S46: units\creeps\RevenantOfTheWaves\RevenantOfTheWaves | T46: ="let _hb"&RC[-16]&" = new Challenge('L70"&RC[-16]&"','H70"&RC[-16]&"',1)" -> let _hb雪山罡风 = new Challenge('L70雪山罡风','H70雪山罡风',1) | U46: 1.5 | W46: 0 | Y46: 4 | Z46: 0 | AP46: null | AR46: null | AS46: null | BF46: null | BS46: 32 | BT46: Rifleman | CC46: null | CD46: null | CE46: null | CF46: null | CI46: null | CL46: 1 | DF46: 0 | DG46: 0 | DK46: 1 | DT46: 0.1 | DV46: 1 | DW46: 1 | EF46: 390 | EG46: 2.8 | EO46: normal | EP46: 500 | FB46: ground,air | FC46: null | FH46: 0.2 | FI46: 0.1 | FJ46: 600 | FL46: 0 | GX46: orc | HA46: 0 | HB46: 0 | HC46: 0 | HD46: 0 | HH46: 0 | HJ46: 0 | HK46: null | HM46: 0 | HN46: 0 | HO46: 0 | HQ46: 1800 | HR46: 0 | HS46: 0 | ID46: 0
A47: OBJECT | B47: H708 | C47: Obla | D47: 雪山古剑 | E47: |cFF33FF00雪山古剑|r | F47: ="掉落|cFF33FF00"&RC[-2]&"|r" -> 掉落|cFF33FF00雪山古剑|r | G47: 0.25 | H47: =INT(RC[4]/50) -> 7600000 | I47: =INT(RC[3]/10) -> 38000000 | J47: 0 | K47: 0 | L47: 380000000 | M47: 10000 | N47: =RC[-1] -> 10000 | O47: =RC[-2] -> 10000 | P47: 0 | Q47: 0 | S47: units\creeps\Revenant\Revenant | T47: ="let _hb"&RC[-16]&" = new Challenge('L70"&RC[-16]&"','H70"&RC[-16]&"',1)" -> let _hb雪山古剑 = new Challenge('L70雪山古剑','H70雪山古剑',1) | U47: 1.5 | X47: 0 | Y47: 4 | Z47: 0 | AP47: null | AR47: null | AS47: null | BF47: null | BS47: 32 | BT47: Rifleman | CC47: null | CD47: null | CE47: null | CF47: null | CI47: null | CL47: 1 | DF47: 0 | DG47: 0 | DK47: 1 | DT47: 0.1 | DV47: 1 | DW47: 1 | EF47: 390 | EG47: 2.8 | EO47: normal | EP47: 500 | FB47: ground,air | FC47: null | FH47: 0.2 | FI47: 0.1 | FJ47: 600 | FL47: 0 | GX47: orc | HA47: 0 | HB47: 0 | HC47: 0 | HD47: 0 | HH47: 0 | HJ47: 0 | HK47: null | HM47: 0 | HN47: 0 | HO47: 0 | HQ47: 1800 | HR47: 0 | HS47: 0 | ID47: 0
A48: OBJECT | B48: H709 | C48: Obla | D48: 公主之心 | E48: |cFF33FF00前朝公主|r | F48: ="掉落|cFF33FF00"&RC[-2]&"|r" -> 掉落|cFF33FF00公主之心|r | G48: 0.25 | H48: =INT(RC[4]/50) -> 13400000 | I48: =INT(RC[3]/10) -> 67000000 | J48: 0 | K48: 0 | L48: 670000000 | M48: 10000 | N48: =RC[-1] -> 10000 | O48: =RC[-2] -> 10000 | P48: 0 | Q48: 0 | S48: units\human\Sorceress\Sorceress | T48: ="let _hb"&RC[-16]&" = new Challenge('L40"&RC[-16]&"','H40"&RC[-16]&"',1)" -> let _hb公主之心 = new Challenge('L40公主之心','H40公主之心',1) | U48: 2 | Y48: 20 | Z48: 0 | AP48: null | AR48: null | AS48: null | BF48: null | BS48: 32 | BT48: Rifleman | CC48: null | CD48: null | CE48: null | CF48: null | CI48: null | CL48: 1 | DF48: 0 | DG48: 0 | DK48: 1 | DT48: 0.1 | DV48: 1 | DW48: 1 | EF48: 390 | EG48: 2.8 | EO48: normal | EP48: 500 | FB48: ground,air | FC48: null | FH48: 0.2 | FI48: 0.1 | FJ48: 600 | FL48: 0 | GX48: orc | HA48: 0 | HB48: 0 | HC48: 0 | HD48: 0 | HH48: 0 | HJ48: 0 | HK48: null | HM48: 0 | HN48: 0 | HO48: 0 | HQ48: 1800 | HR48: 0 | HS48: 0 | ID48: 0
A49: OBJECT | B49: H710 | C49: Obla | D49: 神秘的少女裙子 | E49: |cFF33FF00前朝护卫-红|r | F49: ="掉落|cFF33FF00"&RC[-2]&"|r" -> 掉落|cFF33FF00神秘的少女裙子|r | G49: 0.25 | H49: =INT(RC[4]/50) -> 4400000 | I49: =INT(RC[3]/10) -> 22000000 | J49: 0 | K49: 0 | L49: 220000000 | M49: 10000 | N49: =RC[-1] -> 10000 | O49: =RC[-2] -> 10000 | P49: 0 | Q49: 0 | S49: units\demon\Felgaurd\Felgaurd | T49: ="let _hb"&RC[-16]&" = new Challenge('L70"&RC[-16]&"','H70"&RC[-16]&"',1)" -> let _hb神秘的少女裙子 = new Challenge('L70神秘的少女裙子','H70神秘的少女裙子',1) | Y49: 4 | Z49: 0 | AP49: null | AR49: null | AS49: null | BF49: null | BS49: 32 | BT49: Rifleman | CC49: null | CD49: null | CE49: null | CF49: null | CI49: null | CL49: 1 | DF49: 0 | DG49: 0 | DK49: 1 | DT49: 0.1 | DV49: 1 | DW49: 1 | EF49: 390 | EG49: 2.8 | EO49: normal | EP49: 500 | FB49: ground,air | FC49: null | FH49: 0.2 | FI49: 0.1 | FJ49: 600 | FL49: 0 | GX49: orc | HA49: 0 | HB49: 0 | HC49: 0 | HD49: 0 | HH49: 0 | HJ49: 0 | HK49: null | HM49: 0 | HN49: 0 | HO49: 0 | HQ49: 1800 | HR49: 0 | HS49: 0 | ID49: 0
A50: OBJECT | B50: H711 | C50: Obla | D50: 神秘的少女鞋子 | E50: |cFF33FF00前朝护卫-蓝|r | F50: ="掉落|cFF33FF00"&RC[-2]&"|r" -> 掉落|cFF33FF00神秘的少女鞋子|r | G50: 0.25 | H50: =INT(RC[4]/50) -> 4400000 | I50: =INT(RC[3]/10) -> 22000000 | J50: 0 | K50: 0 | L50: 220000000 | M50: 10000 | N50: =RC[-1] -> 10000 | O50: =RC[-2] -> 10000 | P50: 0 | Q50: 0 | S50: units\demon\FelgaurdBlue\FelgaurdBlue | T50: ="let _hb"&RC[-16]&" = new Challenge('L70"&RC[-16]&"','H70"&RC[-16]&"',1)" -> let _hb神秘的少女鞋子 = new Challenge('L70神秘的少女鞋子','H70神秘的少女鞋子',1) | Y50: 4 | Z50: 0 | AP50: null | AR50: null | AS50: null | BF50: null | BS50: 32 | BT50: Rifleman | CC50: null | CD50: null | CE50: null | CF50: null | CI50: null | CL50: 1 | DF50: 0 | DG50: 0 | DK50: 1 | DT50: 0.1 | DV50: 1 | DW50: 1 | EF50: 390 | EG50: 2.8 | EO50: normal | EP50: 500 | FB50: ground,air | FC50: null | FH50: 0.2 | FI50: 0.1 | FJ50: 600 | FL50: 0 | GX50: orc | HA50: 0 | HB50: 0 | HC50: 0 | HD50: 0 | HH50: 0 | HJ50: 0 | HK50: null | HM50: 0 | HN50: 0 | HO50: 0 | HQ50: 1800 | HR50: 0 | HS50: 0 | ID50: 0
A51: OBJECT | B51: H712 | C51: Obla | D51: 神秘的少女衣服 | E51: |cFF33FF00前朝护卫-绿|r | F51: ="掉落|cFF33FF00"&RC[-2]&"|r" -> 掉落|cFF33FF00神秘的少女衣服|r | G51: 0.25 | H51: =INT(RC[4]/50) -> 4400000 | I51: =INT(RC[3]/10) -> 22000000 | J51: 0 | K51: 0 | L51: 220000000 | M51: 10000 | N51: =RC[-1] -> 10000 | O51: =RC[-2] -> 10000 | P51: 0 | Q51: 0 | S51: units\demon\FelgaurdBlue\FelgaurdBlue | T51: ="let _hb"&RC[-16]&" = new Challenge('L70"&RC[-16]&"','H70"&RC[-16]&"',1)" -> let _hb神秘的少女衣服 = new Challenge('L70神秘的少女衣服','H70神秘的少女衣服',1) | V51: 0 | W51: 0 | Y51: 4 | Z51: 0 | AP51: null | AR51: null | AS51: null | BF51: null | BS51: 32 | BT51: Rifleman | CC51: null | CD51: null | CE51: null | CF51: null | CI51: null | CL51: 1 | DF51: 0 | DG51: 0 | DK51: 1 | DT51: 0.1 | DV51: 1 | DW51: 1 | EF51: 390 | EG51: 2.8 | EO51: normal | EP51: 500 | FB51: ground,air | FC51: null | FH51: 0.2 | FI51: 0.1 | FJ51: 600 | FL51: 0 | GX51: orc | HA51: 0 | HB51: 0 | HC51: 0 | HD51: 0 | HH51: 0 | HJ51: 0 | HK51: null | HM51: 0 | HN51: 0 | HO51: 0 | HQ51: 1800 | HR51: 0 | HS51: 0 | ID51: 0
A52: OBJECT | B52: H713 | C52: Obla | D52: 扭曲魔石 | E52: |cFF33FF00扭曲魔物|r | F52: ="掉落|cFF33FF00"&RC[-2]&"|r" -> 掉落|cFF33FF00扭曲魔石|r | G52: 0.25 | H52: =INT(RC[4]/50) -> 2000000 | I52: =INT(RC[3]/10) -> 10000000 | J52: 0 | K52: 0 | L52: 100000000 | M52: 10000 | N52: =RC[-1] -> 10000 | O52: =RC[-2] -> 10000 | P52: 0 | Q52: 0 | S52: units\creeps\VoidWalker\VoidWalker | T52: ="let _hb"&RC[-16]&" = new Challenge('L70"&RC[-16]&"','H70"&RC[-16]&"',1)" -> let _hb扭曲魔石 = new Challenge('L70扭曲魔石','H70扭曲魔石',1) | U52: 1.5 | V52: 0 | Y52: 4 | Z52: 0 | AP52: null | AR52: null | AS52: null | BF52: null | BS52: 32 | BT52: Rifleman | CC52: null | CD52: null | CE52: null | CF52: null | CI52: null | CL52: 1 | DF52: 0 | DG52: 0 | DK52: 1 | DT52: 0.1 | DV52: 1 | DW52: 1 | EF52: 390 | EG52: 2.8 | EO52: normal | EP52: 500 | FB52: ground,air | FC52: null | FH52: 0.2 | FI52: 0.1 | FJ52: 600 | FL52: 0 | GX52: orc | HA52: 0 | HB52: 0 | HC52: 0 | HD52: 0 | HH52: 0 | HJ52: 0 | HK52: null | HM52: 0 | HN52: 0 | HO52: 0 | HQ52: 1800 | HR52: 0 | HS52: 0 | ID52: 0
A53: OBJECT | B53: H714 | C53: Obla | D53: 扭曲妖石 | E53: |cFF33FF00扭曲妖物|r | F53: ="掉落|cFF33FF00"&RC[-2]&"|r" -> 掉落|cFF33FF00扭曲妖石|r | G53: 0.25 | H53: =INT(RC[4]/50) -> 2000000 | I53: =INT(RC[3]/10) -> 10000000 | J53: 0 | K53: 0 | L53: 100000000 | M53: 10000 | N53: =RC[-1] -> 10000 | O53: =RC[-2] -> 10000 | P53: 0 | Q53: 0 | S53: units\creeps\VoidWalker\VoidWalker | T53: ="let _hb"&RC[-16]&" = new Challenge('L70"&RC[-16]&"','H70"&RC[-16]&"',1)" -> let _hb扭曲妖石 = new Challenge('L70扭曲妖石','H70扭曲妖石',1) | U53: 1.5 | X53: 0 | Y53: 4 | Z53: 0 | AP53: null | AR53: null | AS53: null | BF53: null | BS53: 32 | BT53: Rifleman | CC53: null | CD53: null | CE53: null | CF53: null | CI53: null | CL53: 1 | DF53: 0 | DG53: 0 | DK53: 1 | DT53: 0.1 | DV53: 1 | DW53: 1 | EF53: 390 | EG53: 2.8 | EO53: normal | EP53: 500 | FB53: ground,air | FC53: null | FH53: 0.2 | FI53: 0.1 | FJ53: 600 | FL53: 0 | GX53: orc | HA53: 0 | HB53: 0 | HC53: 0 | HD53: 0 | HH53: 0 | HJ53: 0 | HK53: null | HM53: 0 | HN53: 0 | HO53: 0 | HQ53: 1800 | HR53: 0 | HS53: 0 | ID53: 0
A54: OBJECT | B54: H715 | C54: Obla | D54: 扭曲邪石 | E54: |cFF33FF00扭曲邪物|r | F54: ="掉落|cFF33FF00"&RC[-2]&"|r" -> 掉落|cFF33FF00扭曲邪石|r | G54: 0.25 | H54: =INT(RC[4]/50) -> 2000000 | I54: =INT(RC[3]/10) -> 10000000 | J54: 0 | K54: 0 | L54: 100000000 | M54: 10000 | N54: =RC[-1] -> 10000 | O54: =RC[-2] -> 10000 | P54: 0 | Q54: 0 | S54: units\creeps\VoidWalker\VoidWalker | T54: ="let _hb"&RC[-16]&" = new Challenge('L70"&RC[-16]&"','H70"&RC[-16]&"',1)" -> let _hb扭曲邪石 = new Challenge('L70扭曲邪石','H70扭曲邪石',1) | U54: 1.5 | V54: 50 | X54: 50 | Y54: 4 | Z54: 0 | AP54: null | AR54: null | AS54: null | BF54: null | BS54: 32 | BT54: Rifleman | CC54: null | CD54: null | CE54: null | CF54: null | CI54: null | CL54: 1 | DF54: 0 | DG54: 0 | DK54: 1 | DT54: 0.1 | DV54: 1 | DW54: 1 | EF54: 390 | EG54: 2.8 | EO54: normal | EP54: 500 | FB54: ground,air | FC54: null | FH54: 0.2 | FI54: 0.1 | FJ54: 600 | FL54: 0 | GX54: orc | HA54: 0 | HB54: 0 | HC54: 0 | HD54: 0 | HH54: 0 | HJ54: 0 | HK54: null | HM54: 0 | HN54: 0 | HO54: 0 | HQ54: 1800 | HR54: 0 | HS54: 0 | ID54: 0
A55: OBJECT | B55: H716 | C55: Obla | D55: 扭曲怪石 | E55: |cFF33FF00扭曲怪物|r | F55: ="掉落|cFF33FF00"&RC[-2]&"|r" -> 掉落|cFF33FF00扭曲怪石|r | G55: 0.25 | H55: =INT(RC[4]/50) -> 2000000 | I55: =INT(RC[3]/10) -> 10000000 | J55: 0 | K55: 0 | L55: 100000000 | M55: 10000 | N55: =RC[-1] -> 10000 | O55: =RC[-2] -> 10000 | P55: 0 | Q55: 0 | S55: units\creeps\VoidWalker\VoidWalker | T55: ="let _hb"&RC[-16]&" = new Challenge('L70"&RC[-16]&"','H70"&RC[-16]&"',1)" -> let _hb扭曲怪石 = new Challenge('L70扭曲怪石','H70扭曲怪石',1) | U55: 1.5 | V55: 100 | X55: 100 | Y55: 4 | Z55: 0 | AP55: null | AR55: null | AS55: null | BF55: null | BS55: 32 | BT55: Rifleman | CC55: null | CD55: null | CE55: null | CF55: null | CI55: null | CL55: 1 | DF55: 0 | DG55: 0 | DK55: 1 | DT55: 0.1 | DV55: 1 | DW55: 1 | EF55: 390 | EG55: 2.8 | EO55: normal | EP55: 500 | FB55: ground,air | FC55: null | FH55: 0.2 | FI55: 0.1 | FJ55: 600 | FL55: 0 | GX55: orc | HA55: 0 | HB55: 0 | HC55: 0 | HD55: 0 | HH55: 0 | HJ55: 0 | HK55: null | HM55: 0 | HN55: 0 | HO55: 0 | HQ55: 1800 | HR55: 0 | HS55: 0 | ID55: 0
A56: OBJECT | B56: H717 | C56: Obla | D56: 扭曲的书 | E56: |cFF33FF00扭曲魔法使|r | F56: ="掉落|cFF33FF00"&RC[-2]&"|r" -> 掉落|cFF33FF00扭曲的书|r | G56: 0.25 | H56: =INT(RC[4]/50) -> 4400000 | I56: =INT(RC[3]/10) -> 22000000 | J56: 0 | K56: 0 | L56: 220000000 | M56: 10000 | N56: =RC[-1] -> 10000 | O56: =RC[-2] -> 10000 | P56: 0 | Q56: 0 | S56: Units\Creeps\Unbroken\Unbroken | T56: ="let _hb"&RC[-16]&" = new Challenge('L70"&RC[-16]&"','H70"&RC[-16]&"',1)" -> let _hb扭曲的书 = new Challenge('L70扭曲的书','H70扭曲的书',1) | U56: 1.5 | V56: 0 | Y56: 4 | Z56: 0 | AP56: null | AR56: null | AS56: null | BF56: null | BS56: 32 | BT56: Rifleman | CC56: null | CD56: null | CE56: null | CF56: null | CI56: null | CL56: 1 | DF56: 0 | DG56: 0 | DK56: 1 | DT56: 0.1 | DV56: 1 | DW56: 1 | EF56: 390 | EG56: 2.8 | EO56: normal | EP56: 500 | FB56: ground,air | FC56: null | FH56: 0.2 | FI56: 0.1 | FJ56: 600 | FL56: 0 | GX56: orc | HA56: 0 | HB56: 0 | HC56: 0 | HD56: 0 | HH56: 0 | HJ56: 0 | HK56: null | HM56: 0 | HN56: 0 | HO56: 0 | HQ56: 1800 | HR56: 0 | HS56: 0 | ID56: 0
A57: OBJECT | B57: H718 | C57: Obla | D57: 扭曲的枪 | E57: |cFF33FF00扭曲重骑士|r | F57: ="掉落|cFF33FF00"&RC[-2]&"|r" -> 掉落|cFF33FF00扭曲的枪|r | G57: 0.25 | H57: =INT(RC[4]/50) -> 4400000 | I57: =INT(RC[3]/10) -> 22000000 | J57: 0 | K57: 0 | L57: 220000000 | M57: 10000 | N57: =RC[-1] -> 10000 | O57: =RC[-2] -> 10000 | P57: 0 | Q57: 0 | S57: units\demon\ChaosWarlord\ChaosWarlord | T57: ="let _hb"&RC[-16]&" = new Challenge('L70"&RC[-16]&"','H70"&RC[-16]&"',1)" -> let _hb扭曲的枪 = new Challenge('L70扭曲的枪','H70扭曲的枪',1) | U57: 1.5 | X57: 0 | Y57: 4 | Z57: 0 | AP57: null | AR57: null | AS57: null | BF57: null | BS57: 32 | BT57: Rifleman | CC57: null | CD57: null | CE57: null | CF57: null | CI57: null | CL57: 1 | DF57: 0 | DG57: 0 | DK57: 1 | DT57: 0.1 | DV57: 1 | DW57: 1 | EF57: 390 | EG57: 2.8 | EO57: normal | EP57: 500 | FB57: ground,air | FC57: null | FH57: 0.2 | FI57: 0.1 | FJ57: 600 | FL57: 0 | GX57: orc | HA57: 0 | HB57: 0 | HC57: 0 | HD57: 0 | HH57: 0 | HJ57: 0 | HK57: null | HM57: 0 | HN57: 0 | HO57: 0 | HQ57: 1800 | HR57: 0 | HS57: 0 | ID57: 0
A58: OBJECT | B58: H719 | C58: Obla | D58: 扭曲的棒 | E58: |cFF33FF00扭曲半兽人|r | F58: ="掉落|cFF33FF00"&RC[-2]&"|r" -> 掉落|cFF33FF00扭曲的棒|r | G58: 0.25 | H58: =INT(RC[4]/50) -> 4400000 | I58: =INT(RC[3]/10) -> 22000000 | J58: 0 | K58: 0 | L58: 220000000 | M58: 10000 | N58: =RC[-1] -> 10000 | O58: =RC[-2] -> 10000 | P58: 0 | Q58: 0 | S58: Units\Creeps\tuskarLord\tuskarLord | T58: ="let _hb"&RC[-16]&" = new Challenge('L70"&RC[-16]&"','H70"&RC[-16]&"',1)" -> let _hb扭曲的棒 = new Challenge('L70扭曲的棒','H70扭曲的棒',1) | U58: 1.5 | V58: 50 | X58: 50 | Y58: 4 | Z58: 0 | AP58: null | AR58: null | AS58: null | BF58: null | BS58: 32 | BT58: Rifleman | CC58: null | CD58: null | CE58: null | CF58: null | CI58: null | CL58: 1 | DF58: 0 | DG58: 0 | DK58: 1 | DT58: 0.1 | DV58: 1 | DW58: 1 | EF58: 390 | EG58: 2.8 | EO58: normal | EP58: 500 | FB58: ground,air | FC58: null | FH58: 0.2 | FI58: 0.1 | FJ58: 600 | FL58: 0 | GX58: orc | HA58: 0 | HB58: 0 | HC58: 0 | HD58: 0 | HH58: 0 | HJ58: 0 | HK58: null | HM58: 0 | HN58: 0 | HO58: 0 | HQ58: 1800 | HR58: 0 | HS58: 0 | ID58: 0
A59: OBJECT | B59: H720 | C59: Obla | D59: 扭曲的杖 | E59: |cFF33FF00扭曲血精灵|r | F59: ="掉落|cFF33FF00"&RC[-2]&"|r" -> 掉落|cFF33FF00扭曲的杖|r | G59: 0.25 | H59: =INT(RC[4]/50) -> 4400000 | I59: =INT(RC[3]/10) -> 22000000 | J59: 0 | K59: 0 | L59: 220000000 | M59: 10000 | N59: =RC[-1] -> 10000 | O59: =RC[-2] -> 10000 | P59: 0 | Q59: 0 | S59: units\demon\Demoness\Demoness | T59: ="let _hb"&RC[-16]&" = new Challenge('L70"&RC[-16]&"','H70"&RC[-16]&"',1)" -> let _hb扭曲的杖 = new Challenge('L70扭曲的杖','H70扭曲的杖',1) | U59: 1.5 | W59: 0 | X59: 0 | Y59: 4 | Z59: 0 | AP59: null | AR59: null | AS59: null | BF59: null | BS59: 32 | BT59: Rifleman | CC59: null | CD59: null | CE59: null | CF59: null | CI59: null | CL59: 1 | DF59: 0 | DG59: 0 | DK59: 1 | DT59: 0.1 | DV59: 1 | DW59: 1 | EF59: 390 | EG59: 2.8 | EO59: normal | EP59: 500 | FB59: ground,air | FC59: null | FH59: 0.2 | FI59: 0.1 | FJ59: 600 | FL59: 0 | GX59: orc | HA59: 0 | HB59: 0 | HC59: 0 | HD59: 0 | HH59: 0 | HJ59: 0 | HK59: null | HM59: 0 | HN59: 0 | HO59: 0 | HQ59: 1800 | HR59: 0 | HS59: 0 | ID59: 0
A60: OBJECT | B60: H721 | C60: Obla | D60: 虚空水晶 | E60: |cFF33FF00虚空魔使|r | F60: ="掉落|cFF33FF00"&RC[-2]&"|r" -> 掉落|cFF33FF00虚空水晶|r | G60: 0.25 | H60: =INT(RC[4]/50) -> 6800000 | I60: =INT(RC[3]/10) -> 34000000 | J60: 0 | K60: 0 | L60: 340000000 | M60: 10000 | N60: =RC[-1] -> 10000 | O60: =RC[-2] -> 10000 | P60: 0 | Q60: 0 | S60: units\creeps\OrcWarlock\OrcWarlock | T60: ="let _hb"&RC[-16]&" = new Challenge('L70"&RC[-16]&"','H70"&RC[-16]&"',1)" -> let _hb虚空水晶 = new Challenge('L70虚空水晶','H70虚空水晶',1) | U60: 2 | Y60: 4 | Z60: 0 | AP60: null | AR60: null | AS60: null | BF60: null | BS60: 32 | BT60: Rifleman | CC60: null | CD60: null | CE60: null | CF60: null | CI60: null | CL60: 1 | DF60: 0 | DG60: 0 | DK60: 1 | DT60: 0.1 | DV60: 1 | DW60: 1 | EF60: 390 | EG60: 2.8 | EO60: normal | EP60: 500 | FB60: ground,air | FC60: null | FH60: 0.2 | FI60: 0.1 | FJ60: 600 | FL60: 0 | GX60: orc | HA60: 0 | HB60: 0 | HC60: 0 | HD60: 0 | HH60: 0 | HJ60: 0 | HK60: null | HM60: 0 | HN60: 0 | HO60: 0 | HQ60: 1800 | HR60: 0 | HS60: 0 | ID60: 0
A61: OBJECT | B61: H722 | C61: Obla | D61: 虚空触角 | E61: |cFF33FF00虚空触手|r | F61: ="掉落|cFF33FF00"&RC[-2]&"|r" -> 掉落|cFF33FF00虚空触角|r | G61: 0.25 | H61: =INT(RC[4]/50) -> 6800000 | I61: =INT(RC[3]/10) -> 34000000 | J61: 0 | K61: 0 | L61: 340000000 | M61: 10000 | N61: =RC[-1] -> 10000 | O61: =RC[-2] -> 10000 | P61: 0 | Q61: 0 | S61: units\creeps\SludgeMonster\SludgeMonster | T61: ="let _hb"&RC[-16]&" = new Challenge('L70"&RC[-16]&"','H70"&RC[-16]&"',1)" -> let _hb虚空触角 = new Challenge('L70虚空触角','H70虚空触角',1) | U61: 2 | Y61: 4 | Z61: 0 | AP61: null | AR61: null | AS61: null | BF61: null | BS61: 32 | BT61: Rifleman | CC61: null | CD61: null | CE61: null | CF61: null | CI61: null | CL61: 1 | DF61: 0 | DG61: 0 | DK61: 1 | DT61: 0.1 | DV61: 1 | DW61: 1 | EF61: 390 | EG61: 2.8 | EO61: normal | EP61: 500 | FB61: ground,air | FC61: null | FH61: 0.2 | FI61: 0.1 | FJ61: 600 | FL61: 0 | GX61: orc | HA61: 0 | HB61: 0 | HC61: 0 | HD61: 0 | HH61: 0 | HJ61: 0 | HK61: null | HM61: 0 | HN61: 0 | HO61: 0 | HQ61: 1800 | HR61: 0 | HS61: 0 | ID61: 0
A62: OBJECT | B62: H723 | C62: Obla | D62: 熔火熔岩 | E62: |cFF33FF00熔火熔岩魔兽|r | F62: ="掉落|cFF33FF00"&RC[-2]&"|r" -> 掉落|cFF33FF00熔火熔岩|r | G62: 0.25 | H62: =INT(RC[4]/50) -> 10000000 | I62: =INT(RC[3]/10) -> 50000000 | J62: 0 | K62: 0 | L62: 500000000 | M62: 10000 | N62: =RC[-1] -> 10000 | O62: =RC[-2] -> 10000 | P62: 0 | Q62: 0 | S62: units\demon\DoomGuard\DoomGuard | T62: ="let _hb"&RC[-16]&" = new Challenge('L70"&RC[-16]&"','H70"&RC[-16]&"',1)" -> let _hb熔火熔岩 = new Challenge('L70熔火熔岩','H70熔火熔岩',1) | U62: 3 | W62: 0 | X62: 0 | Y62: 4 | Z62: 0 | AP62: null | AR62: null | AS62: null | BF62: null | BS62: 32 | BT62: Rifleman | CC62: null | CD62: null | CE62: null | CF62: null | CI62: null | CL62: 1 | DF62: 0 | DG62: 0 | DK62: 1 | DT62: 0.1 | DV62: 1 | DW62: 1 | EF62: 390 | EG62: 2.8 | EO62: normal | EP62: 500 | FB62: ground,air | FC62: null | FH62: 0.2 | FI62: 0.1 | FJ62: 600 | FL62: 0 | GX62: orc | HA62: 0 | HB62: 0 | HC62: 0 | HD62: 0 | HH62: 0 | HJ62: 0 | HK62: null | HM62: 0 | HN62: 0 | HO62: 0 | HQ62: 1800 | HR62: 0 | HS62: 0 | ID62: 0
A63: OBJECT | B63: H724 | C63: Obla | D63: 虚空合金 | E63: |cFF33FF00虚空爪牙|r | F63: ="掉落|cFF33FF00"&RC[-2]&"|r" -> 掉落|cFF33FF00虚空合金|r | G63: 0.25 | H63: =INT(RC[4]/50) -> 5000000 | I63: =INT(RC[3]/10) -> 25000000 | J63: 0 | K63: 0 | L63: 250000000 | M63: 10000 | N63: =RC[-1] -> 10000 | O63: =RC[-2] -> 10000 | P63: 0 | Q63: 0 | S63: units\undead\Ghoul\Ghoul | T63: ="let _hb"&RC[-16]&" = new Challenge('L70"&RC[-16]&"','H70"&RC[-16]&"',1)" -> let _hb虚空合金 = new Challenge('L70虚空合金','H70虚空合金',1) | U63: 3 | W63: 0 | X63: 0 | Y63: 4 | Z63: 0 | AP63: null | AR63: null | AS63: null | BF63: null | BS63: 32 | BT63: Rifleman | CC63: null | CD63: null | CE63: null | CF63: null | CI63: null | CL63: 1 | DF63: 0 | DG63: 0 | DK63: 1 | DT63: 0.1 | DV63: 1 | DW63: 1 | EF63: 390 | EG63: 2.8 | EO63: normal | EP63: 500 | FB63: ground,air | FC63: null | FH63: 0.2 | FI63: 0.1 | FJ63: 600 | FL63: 0 | GX63: orc | HA63: 0 | HB63: 0 | HC63: 0 | HD63: 0 | HH63: 0 | HJ63: 0 | HK63: null | HM63: 0 | HN63: 0 | HO63: 0 | HQ63: 1800 | HR63: 0 | HS63: 0 | ID63: 0
A64: OBJECT | B64: H725 | C64: Obla | D64: 秘境水晶 | E64: |cFF33FF00被腐化的秘境守卫|r | F64: ="掉落|cFF33FF00"&RC[-2]&"|r" -> 掉落|cFF33FF00秘境水晶|r | G64: 0.25 | H64: =INT(RC[4]/50) -> 11000000 | I64: =INT(RC[3]/10) -> 55000000 | J64: 0 | K64: 0 | L64: 550000000 | M64: 10000 | N64: =RC[-1] -> 10000 | O64: =RC[-2] -> 10000 | P64: 0 | Q64: 0 | S64: units\nightelf\Dryad\Dryad | T64: ="let _hb"&RC[-16]&" = new Challenge('L70"&RC[-16]&"','H70"&RC[-16]&"',1)" -> let _hb秘境水晶 = new Challenge('L70秘境水晶','H70秘境水晶',1) | U64: 3 | W64: 0 | X64: 0 | Y64: 4 | Z64: 0 | AP64: null | AR64: null | AS64: null | BF64: null | BS64: 32 | BT64: Rifleman | CC64: null | CD64: null | CE64: null | CF64: null | CI64: null | CL64: 1 | DF64: 0 | DG64: 0 | DK64: 1 | DT64: 0.1 | DV64: 1 | DW64: 1 | EF64: 390 | EG64: 2.8 | EO64: normal | EP64: 500 | FB64: ground,air | FC64: null | FH64: 0.2 | FI64: 0.1 | FJ64: 600 | FL64: 0 | GX64: orc | HA64: 0 | HB64: 0 | HC64: 0 | HD64: 0 | HH64: 0 | HJ64: 0 | HK64: null | HM64: 0 | HN64: 0 | HO64: 0 | HQ64: 1800 | HR64: 0 | HS64: 0 | ID64: 0
A65: OBJECT | B65: H726 | C65: Obla | D65: 大地符文 | E65: |cFF33FF00大地巨熊|r | F65: ="掉落|cFF33FF00"&RC[-2]&"|r" -> 掉落|cFF33FF00大地符文|r | G65: 0.25 | H65: =INT(RC[4]/50) -> 8000000 | I65: =INT(RC[3]/10) -> 40000000 | J65: 0 | K65: 0 | L65: 400000000 | M65: 10000 | N65: =RC[-1] -> 10000 | O65: =RC[-2] -> 10000 | P65: 0 | Q65: 0 | S65: units\creeps\FurbolgElder\FurbolgElder | T65: ="let _hb"&RC[-16]&" = new Challenge('L70"&RC[-16]&"','H70"&RC[-16]&"',1)" -> let _hb大地符文 = new Challenge('L70大地符文','H70大地符文',1) | U65: 2.2999999999999998 | X65: 0 | Y65: 4 | Z65: 0 | AP65: null | AR65: null | AS65: null | BF65: null | BS65: 32 | BT65: Rifleman | CC65: null | CD65: null | CE65: null | CF65: null | CI65: null | CL65: 1 | DF65: 0 | DG65: 0 | DK65: 1 | DT65: 0.1 | DV65: 1 | DW65: 1 | EF65: 390 | EG65: 2.8 | EO65: normal | EP65: 500 | FB65: ground,air | FC65: null | FH65: 0.2 | FI65: 0.1 | FJ65: 600 | FL65: 0 | GX65: orc | HA65: 0 | HB65: 0 | HC65: 0 | HD65: 0 | HH65: 0 | HJ65: 0 | HK65: null | HM65: 0 | HN65: 0 | HO65: 0 | HQ65: 1800 | HR65: 0 | HS65: 0 | ID65: 0
A66: OBJECT | B66: H727 | C66: Obla | D66: 大地龙鳞 | E66: |cFF33FF00大地龙人|r | F66: ="掉落|cFF33FF00"&RC[-2]&"|r" -> 掉落|cFF33FF00大地龙鳞|r | G66: 0.25 | H66: =INT(RC[4]/50) -> 9000000 | I66: =INT(RC[3]/10) -> 45000000 | J66: 0 | K66: 0 | L66: 450000000 | M66: 10000 | N66: =RC[-1] -> 10000 | O66: =RC[-2] -> 10000 | P66: 0 | Q66: 0 | S66: Units\Creeps\DragonSpawnBlue\DragonSpawnBlue | T66: ="let _hb"&RC[-16]&" = new Challenge('L70"&RC[-16]&"','H70"&RC[-16]&"',1)" -> let _hb大地龙鳞 = new Challenge('L70大地龙鳞','H70大地龙鳞',1) | U66: 2.7 | X66: 0 | Y66: 4 | Z66: 0 | AP66: null | AR66: null | AS66: null | BF66: null | BS66: 32 | BT66: Rifleman | CC66: null | CD66: null | CE66: null | CF66: null | CI66: null | CL66: 1 | DF66: 0 | DG66: 0 | DK66: 1 | DT66: 0.1 | DV66: 1 | DW66: 1 | EF66: 390 | EG66: 2.8 | EO66: normal | EP66: 500 | FB66: ground,air | FC66: null | FH66: 0.2 | FI66: 0.1 | FJ66: 600 | FL66: 0 | GX66: orc | HA66: 0 | HB66: 0 | HC66: 0 | HD66: 0 | HH66: 0 | HJ66: 0 | HK66: null | HM66: 0 | HN66: 0 | HO66: 0 | HQ66: 1800 | HR66: 0 | HS66: 0 | ID66: 0
A67: OBJECT | B67: H728 | C67: Obla | D67: 大地元素之心 | E67: |cFF33FF00大地元素|r | F67: ="掉落|cFF33FF00"&RC[-2]&"|r" -> 掉落|cFF33FF00大地元素之心|r | G67: 0.25 | H67: =INT(RC[4]/50) -> 10000000 | I67: =INT(RC[3]/10) -> 50000000 | J67: 0 | K67: 0 | L67: 500000000 | M67: 10000 | N67: =RC[-1] -> 10000 | O67: =RC[-2] -> 10000 | P67: 0 | Q67: 0 | S67: units\creeps\RockGolem\RockGolem | T67: ="let _hb"&RC[-16]&" = new Challenge('L70"&RC[-16]&"','H70"&RC[-16]&"',1)" -> let _hb大地元素之心 = new Challenge('L70大地元素之心','H70大地元素之心',1) | U67: 3 | X67: 0 | Y67: 4 | Z67: 0 | AP67: null | AR67: null | AS67: null | BF67: null | BS67: 32 | BT67: Rifleman | CC67: null | CD67: null | CE67: null | CF67: null | CI67: null | CL67: 1 | DF67: 0 | DG67: 0 | DK67: 1 | DT67: 0.1 | DV67: 1 | DW67: 1 | EF67: 390 | EG67: 2.8 | EO67: normal | EP67: 500 | FB67: ground,air | FC67: null | FH67: 0.2 | FI67: 0.1 | FJ67: 600 | FL67: 0 | GX67: orc | HA67: 0 | HB67: 0 | HC67: 0 | HD67: 0 | HH67: 0 | HJ67: 0 | HK67: null | HM67: 0 | HN67: 0 | HO67: 0 | HQ67: 1800 | HR67: 0 | HS67: 0 | ID67: 0
A68: OBJECT | B68: h601 | C68: hfoo | D68: |cFF33FF00雪花|r | E68: 狼 | F68: ="[任务]奖励"&RC[-2] -> [任务]奖励|cFF33FF00雪花|r | G68: 0.25 | H68: =INT(RC[4]/50) -> 500000 | I68: =INT(RC[3]/10) -> 2500000 | J68: 0 | K68: 0 | L68: 25000000 | P68: 0 | Q68: 0 | R68: ReplaceableTextures\CommandButtons\BTNBundleOfLumber.blp | S68: units\creeps\TimberWolf\TimberWolf | T68: ="let _hx"&RC[-16]&" = new Challenge('L30"&RC[-16]&"','h30"&RC[-16]&"',20)" -> let _hx|cFF33FF00雪花|r = new Challenge('L30|cFF33FF00雪花|r','h30|cFF33FF00雪花|r',20) | Y68: 1 | Z68: 0 | BS68: 32 | BT68: Rifleman | CI68: null | CL68: 1 | DF68: 0 | DG68: 0 | DK68: 1 | DT68: 0.1 | DV68: 1 | DW68: 1 | EF68: 390 | EG68: 2.8 | EO68: normal | EP68: 500 | FB68: ground,air | FC68: null | FH68: 0.2 | FI68: 0.1 | FJ68: 600 | FL68: 0 | GX68: orc | HA68: 0 | HB68: 0 | HC68: 0 | HD68: 0 | HH68: 0 | HJ68: 0 | HK68: null | HM68: 0 | HN68: 0 | HO68: 0 | HQ68: 1800 | HR68: 0 | HS68: 0 | ID68: 0
A69: OBJECT | B69: h602 | C69: hfoo | D69: |cFF33FF00冰块|r | E69: 蝎子 | F69: ="[任务]奖励"&RC[-2] -> [任务]奖励|cFF33FF00冰块|r | G69: 0.25 | H69: =INT(RC[4]/50) -> 500000 | I69: =INT(RC[3]/10) -> 2500000 | J69: 0 | K69: 0 | L69: 25000000 | P69: 0 | Q69: 0 | R69: ReplaceableTextures\CommandButtons\BTNBundleOfLumber.blp | S69: Units\Creeps\Archnathid\Archnathid | T69: ="let _hx"&RC[-16]&" = new Challenge('L30"&RC[-16]&"','h30"&RC[-16]&"',20)" -> let _hx|cFF33FF00冰块|r = new Challenge('L30|cFF33FF00冰块|r','h30|cFF33FF00冰块|r',20) | Y69: 1 | Z69: 0 | BS69: 32 | BT69: Rifleman | CI69: null | CL69: 1 | DF69: 0 | DG69: 0 | DK69: 1 | DT69: 0.1 | DV69: 1 | DW69: 1 | EF69: 390 | EG69: 2.8 | EO69: normal | EP69: 500 | FB69: ground,air | FC69: null | FH69: 0.2 | FI69: 0.1 | FJ69: 600 | FL69: 0 | GX69: orc | HA69: 0 | HB69: 0 | HC69: 0 | HD69: 0 | HH69: 0 | HJ69: 0 | HK69: null | HM69: 0 | HN69: 0 | HO69: 0 | HQ69: 1800 | HR69: 0 | HS69: 0 | ID69: 0
A70: OBJECT | B70: h603 | C70: hfoo | D70: |cFF33FF00千年玄冰|r | E70: 冰晶元素 | F70: ="[任务]奖励"&RC[-2] -> [任务]奖励|cFF33FF00千年玄冰|r | G70: 0.25 | H70: =INT(RC[4]/50) -> 1200000 | I70: =INT(RC[3]/10) -> 6000000 | J70: 0 | K70: 0 | L70: 60000000 | P70: 0 | Q70: 0 | R70: ReplaceableTextures\CommandButtons\BTNBundleOfLumber.blp | S70: units\human\WaterElemental\WaterElemental | T70: ="let _hx"&RC[-16]&" = new Challenge('L30"&RC[-16]&"','h30"&RC[-16]&"',20)" -> let _hx|cFF33FF00千年玄冰|r = new Challenge('L30|cFF33FF00千年玄冰|r','h30|cFF33FF00千年玄冰|r',20) | Y70: 1 | Z70: 0 | BS70: 32 | BT70: Rifleman | CI70: null | CL70: 1 | DF70: 0 | DG70: 0 | DK70: 1 | DT70: 0.1 | DV70: 1 | DW70: 1 | EF70: 390 | EG70: 2.8 | EO70: normal | EP70: 500 | FB70: ground,air | FC70: null | FH70: 0.2 | FI70: 0.1 | FJ70: 600 | FL70: 0 | GX70: orc | HA70: 0 | HB70: 0 | HC70: 0 | HD70: 0 | HH70: 0 | HJ70: 0 | HK70: null | HM70: 0 | HN70: 0 | HO70: 0 | HQ70: 1800 | HR70: 0 | HS70: 0 | ID70: 0
A71: OBJECT | B71: h604 | C71: hfoo | D71: |cFF33FF00繁花幻木|r | E71: 被腐化的树精 | F71: ="[任务]奖励"&RC[-2] -> [任务]奖励|cFF33FF00繁花幻木|r | G71: 0.25 | H71: =INT(RC[4]/50) -> 800000 | I71: =INT(RC[3]/10) -> 4000000 | J71: 0 | K71: 0 | L71: 40000000 | P71: 0 | Q71: 0 | R71: ReplaceableTextures\CommandButtons\BTNBundleOfLumber.blp | S71: units\nightelf\Ent\Ent | T71: ="let _hx"&RC[-16]&" = new Challenge('L30"&RC[-16]&"','h30"&RC[-16]&"',20)" -> let _hx|cFF33FF00繁花幻木|r = new Challenge('L30|cFF33FF00繁花幻木|r','h30|cFF33FF00繁花幻木|r',20) | Y71: 1 | Z71: 0 | BS71: 32 | BT71: Rifleman | CI71: null | CL71: 1 | DF71: 0 | DG71: 0 | DK71: 1 | DT71: 0.1 | DV71: 1 | DW71: 1 | EF71: 390 | EG71: 2.8 | EO71: normal | EP71: 500 | FB71: ground,air | FC71: null | FH71: 0.2 | FI71: 0.1 | FJ71: 600 | FL71: 0 | GX71: orc | HA71: 0 | HB71: 0 | HC71: 0 | HD71: 0 | HH71: 0 | HJ71: 0 | HK71: null | HM71: 0 | HN71: 0 | HO71: 0 | HQ71: 1800 | HR71: 0 | HS71: 0 | ID71: 0