Sheet: Sheet1
A1: TYPE | B1: p_index | C1: id | D1: oid | E1: unam | F1: ua1c | G1: udef | H1: ua1b | I1: ubba | J1: uhpm | K1: upro | L1: usca | M1: umdl | N1: p_code | O1: p_code2 | P1: ustr | Q1: uagi | R1: uint | S1: ugol | T1: ulum | U1: ustp | V1: uagp | W1: uinp | X1: uabi | Y1: util | Z1: uspe | AA1: ucam | AB1: uine | AC1: udro | AD1: uhos | AE1: uuch | AF1: utss | AG1: ua1s | AH1: ua1d | AI1: udaa | AJ1: uhab | AK1: urqc | AL1: urq1 | AM1: urq2 | AN1: urq3 | AO1: urq4 | AP1: urq5 | AQ1: urq6 | AR1: urq7 | AS1: urq8 | AT1: ureq | AU1: urqa | AV1: udep | AW1: urva | AX1: urev | AY1: ures | AZ1: upgr | BA1: usei | BB1: useu | BC1: utra | BD1: umki | BE1: uupt | BF1: ubui | BG1: upar | BH1: upap | BI1: upaw | BJ1: uabr | BK1: uabt | BL1: upat | BM1: ucol | BN1: usnd | BO1: ubsl | BP1: ursl | BQ1: umsl | BR1: ulfo | BS1: ulfi | BT1: upru | BU1: unsf | BV1: ides | BW1: uawt | BX1: utpr | BY1: utip | BZ1: utub | CA1: ucun | CB1: ucut | CC1: uhot | CD1: uver | CE1: uscb | CF1: ussc | CG1: uslz | CH1: usew | CI1: uclr | CJ1: uclb | CK1: uclg | CL1: uocc | CM1: umxp | CN1: umxr | CO1: uisz | CP1: uimz | CQ1: ulpx | CR1: ulpy | CS1: ulsz | CT1: ulpz | CU1: ushu | CV1: ushb | CW1: ushh | CX1: ushw | CY1: ushx | CZ1: ushy | DA1: ushr | DB1: uubs | DC1: ubpx | DD1: ubpy | DE1: ucua | DF1: ussi | DG1: uico | DH1: utaa | DI1: udtm | DJ1: uspa | DK1: uaap | DL1: uani | DM1: ualp | DN1: ubpr | DO1: ucpt | DP1: ucbs | DQ1: uwal | DR1: uble | DS1: urun | DT1: uprw | DU1: uori | DV1: utcc | DW1: utco | DX1: uept | DY1: uerd | DZ1: ufrd | EA1: ulos | EB1: umvt | EC1: umvh | ED1: umvs | EE1: umvr | EF1: umas | EG1: umis | EH1: umvf | EI1: urpr | EJ1: urpp | EK1: urpo | EL1: urpg | EM1: udty | EN1: uacq | EO1: uamn | EP1: udup | EQ1: udea | ER1: uarm | ES1: utar | ET1: ua1m | EU1: ua1z | EV1: ua1t | EW1: uma1 | EX1: umh1 | EY1: ua1w | EZ1: ua1g | FA1: ucs1 | FB1: usr1 | FC1: usd1 | FD1: udl1 | FE1: uwu1 | FF1: ubs1 | FG1: udp1 | FH1: ua1r | FI1: urb1 | FJ1: udu1 | FK1: ua1p | FL1: ua1f | FM1: utc1 | FN1: uqd1 | FO1: ua1q | FP1: uhd1 | FQ1: ua1h | FR1: ua2m | FS1: ua2z | FT1: ua2t | FU1: uma2 | FV1: umh2 | FW1: ua2w | FX1: ua2g | FY1: ucs2 | FZ1: usr2 | GA1: usd2 | GB1: udl2 | GC1: uwu2 | GD1: ubs2 | GE1: udp2 | GF1: ua2r | GG1: urb2 | GH1: ua2b | GI1: ua2s | GJ1: ua2d | GK1: udu2 | GL1: ua2p | GM1: ua2c | GN1: ua2f | GO1: utc2 | GP1: uqd2 | GQ1: ua2q | GR1: uhd2 | GS1: ua2h | GT1: uaen | GU1: ulev | GV1: urac | GW1: utyp | GX1: ubdg | GY1: ubld | GZ1: ubsi | HA1: ubdi | HB1: ugor | HC1: ulur | HD1: urtm | HE1: ulba | HF1: ulbs | HG1: ulbd | HH1: umpm | HI1: umpr | HJ1: umpi | HK1: uhpr | HL1: uhrt | HM1: ufma | HN1: ufoo | HO1: usst | HP1: usrg | HQ1: usid | HR1: usin | HS1: ucar | HT1: usma | HU1: uhom | HV1: uhhm | HW1: uhhb | HX1: uhhd | HY1: upra | HZ1: unbr | IA1: unbm | IB1: upoi | IC1: upri | ID1: ufor | IE1: ufle | IF1: ucbo | IG1: uibo | IH1: usle
A2: COMMENT | B2: index | C2: 单位ID | D2: 单位模板ID | E2: 文本 - 名字 | F2: 战斗 - 攻击 1 - 攻击间隔 | G2: 战斗 - 基础护甲 | H2: 战斗 - 攻击 1 - 基础伤害 | I2: 状态 - 黄金奖励 - 基础值 | J2: 状态 - 生命最大值 | K2: 文本 - 称谓 | L2: 显示 - 模型缩放 | M2: 显示 - 模型文件 | N2: code | O2: code2 | P2: 状态 - 英雄 - 初始力量 | Q2: 状态 - 英雄 - 初始敏捷 | R2: 状态 - 英雄 - 初始智力 | S2: 状态 - 黄金消耗 | T2: 状态 - 木材消耗 | U2: 状态 - 英雄 - 每等级提升力量 | V2: 状态 - 英雄 - 每等级提升敏捷 | W2: 状态 - 英雄 - 每等级提升智力 | X2: 技能 - 普通 | Y2: 编辑器 - 地形设置 | Z2: 编辑器 - 分类 - 特殊 | AA2: 编辑器 - 分类 - 战役 | AB2: 编辑器 - 可在编辑器中放置 | AC2: 编辑器 - 可设置死亡掉落物品 | AD2: 编辑器 - 可作为中立敌对显示 | AE2: 编辑器 - 使用点击帮助 | AF2: 编辑器 - 有地形指定数据 | AG2: 战斗 - 攻击 1 - 伤害骰子面数 | AH2: 战斗 - 攻击 1 - 伤害骰子数量 | AI2: 技能 - 默认主动技能 | AJ2: 技能 - 英雄 | AK2: 科技树 - 需求 - 使用等级数 | AL2: 科技树 - 需求 - 等级 2 | AM2: 科技树 - 需求 - 等级 3 | AN2: 科技树 - 需求 - 等级 4 | AO2: 科技树 - 需求 - 等级 5 | AP2: 科技树 - 需求 - 等级 6 | AQ2: 科技树 - 需求 - 等级 7 | AR2: 科技树 - 需求 - 等级 8 | AS2: 科技树 - 需求 - 等级 9 | AT2: 科技树 - 需求 | AU2: 科技树 - 需求值 | AV2: 科技树 - 从属等价物 | AW2: 科技树 - 指定复活点 | AX2: 科技树 - 可重生阵亡英雄 | AY2: 科技树 - 可研究项目 | AZ2: 科技树 - 使用科技 | BA2: 科技树 - 售出物品 | BB2: 科技树 - 售出单位 | BC2: 科技树 - 训练单位 | BD2: 科技树 - 制造物品 | BE2: 科技树 - 建筑升级 | BF2: 科技树 - 可建造建筑 | BG2: 路径 - 放置不允许 | BH2: 路径 - 放置要求 | BI2: 路径 - 放置要求距离水的范围 | BJ2: 路径 - AI放置范围 | BK2: 路径 - AI放置类型 | BL2: 路径 - 路径纹理 | BM2: 路径 - 碰撞体积 | BN2: 声音 - 单位声音设置 | BO2: 声音 - 建筑 | BP2: 声音 - 随机 | BQ2: 声音 - 移动 | BR2: 声音 - 循环淡出率 | BS2: 声音 - 循环淡入率 | BT2: 文本 - 称谓数量 | BU2: 文本 - 名字 - 编辑器后缀 | BV2: 文本 - 说明 | BW2: 文本 - 提示工具 - 唤醒 | BX2: 文本 - 提示工具 - 重生 | BY2: 文本 - 提示工具 - 基础 | BZ2: 文本 - 提示工具 - 扩展 | CA2: 文本 - 魔法升级名字 | CB2: 文本 - 魔法升级说明 | CC2: 文本 - 热键 | CD2: 显示 - 模型文件 - 版本 | CE2: 显示 - 缩放投射物 | CF2: 显示 - 选择缩放 | CG2: 显示 - 选择圈高度 | CH2: 显示 - 选择圈在水面上 | CI2: 显示 - 颜色值(红) | CJ2: 显示 - 颜色值(蓝) | CK2: 显示 - 颜色值(绿) | CL2: 显示 - 闭塞高度 | CM2: 显示 - X轴最大旋转角度(弧度) | CN2: 显示 - Y轴最大旋转角度(弧度) | CO2: 显示 - 弹射碰撞偏移 - Z (深水) | CP2: 显示 - 弹射碰撞偏移 - Z | CQ2: 显示 - 弹射偏移 - X | CR2: 显示 - 弹射偏移 - Y | CS2: 显示 - 弹射偏移 - Z (深水) | CT2: 显示 - 弹射偏移 - Z | CU2: 显示 - 阴影图像(单位) | CV2: 显示 - 阴影图像(建筑) | CW2: 显示 - 阴影图像 - 高度 | CX2: 显示 - 阴影图像 - 宽度 | CY2: 显示 - 阴影图像 - X轴偏移 | CZ2: 显示 - 阴影图像 - Y轴偏移 | DA2: 显示 - 深水区有阴影 | DB2: 显示 - 建筑地面纹理 | DC2: 显示 - 按钮位置(X) | DD2: 显示 - 按钮位置(Y) | DE2: 显示 - 魔法升级图标 | DF2: 显示 - 图标 - 计分屏 | DG2: 显示 - 图标 - 游戏界面 | DH2: 显示 - 目标效果 | DI2: 显示 - 死亡时间(秒) | DJ2: 显示 - 特殊效果 | DK2: 显示 - 要求动画名 - 附加动画 | DL2: 显示 - 要求动画名 | DM2: 显示 - 要求附加动画链接名 | DN2: 显示 - 要求骨骼名 | DO2: 显示 - 动画 - 魔法施放点 | DP2: 显示 - 动画 - 魔法施放回复 | DQ2: 显示 - 动画 - 行走速度 | DR2: 显示 - 动画 - 混合时间(秒) | DS2: 显示 - 动画 - 跑步速度 | DT2: 显示 - 动画 - 转向角度 | DU2: 显示 - 动画 - 转向补正 | DV2: 显示 - 队伍颜色 - 允许自定义 | DW2: 显示 - 队伍颜色 | DX2: 显示 - 高度变化 - 采样点数量 | DY2: 显示 - 高度变化 - 采样范围 | DZ2: 显示 - 战争迷雾 - 采样范围 | EA2: 显示 - 不可见区域显示单位 | EB2: 移动 - 类型 | EC2: 移动 - 高度 | ED2: 移动 - 基础速度 | EE2: 移动 - 转身速度 | EF2: 移动 - 最大速度 | EG2: 移动 - 最小速度 | EH2: 移动 - 最小高度 | EI2: 移动 - 组群分离 - 优先权 | EJ2: 移动 - 组群分离 - 参数 | EK2: 移动 - 组群分离 - 允许 | EL2: 移动 - 组群分离 - 组号 | EM2: 战斗 - 护甲类型 | EN2: 战斗 - 主动攻击范围 | EO2: 战斗 - 最小攻击范围 | EP2: 战斗 - 防御升级奖励 | EQ2: 战斗 - 死亡类型 | ER2: 战斗 - 装甲类型 | ES2: 战斗 - 作为目标类型 | ET2: 战斗 - 攻击 1 - 投射物图像 | EU2: 战斗 - 攻击 1 - 弹射速率 | EV2: 战斗 - 攻击 1 - 攻击类型 | EW2: 战斗 - 攻击 1 - 射弹弧度 | EX2: 战斗 - 攻击 1 - 射弹自导允许 | EY2: 战斗 - 攻击 1 - 武器类型 | EZ2: 战斗 - 攻击 1 - 目标允许 | FA2: 战斗 - 攻击 1 - 武器声音 | FB2: 战斗 - 攻击 1 - 穿透伤害范围 | FC2: 战斗 - 攻击 1 - 穿透伤害距离 | FD2: 战斗 - 攻击 1 - 伤害衰减参数 | FE2: 战斗 - 攻击 1 - 显示UI | FF2: 战斗 - 攻击 1 - 动画回复点 | FG2: 战斗 - 攻击 1 - 动画伤害点 | FH2: 战斗 - 攻击 1 - 攻击范围 | FI2: 战斗 - 攻击 1 - 攻击范围缓冲 | FJ2: 战斗 - 攻击 1 - 伤害升级奖励 | FK2: 战斗 - 攻击 1 - 范围影响目标 | FL2: 战斗 - 攻击 1 - 全伤害范围 | FM2: 战斗 - 攻击 1 - 最大目标数 | FN2: 战斗 - 攻击 1 - 小伤害参数 | FO2: 战斗 - 攻击 1 - 小伤害范围 | FP2: 战斗 - 攻击 1 - 中伤害参数 | FQ2: 战斗 - 攻击 1 - 中伤害范围 | FR2: 战斗 - 攻击 2 - 投射物图像 | FS2: 战斗 - 攻击 2 - 弹射速率 | FT2: 战斗 - 攻击 2 - 攻击类型 | FU2: 战斗 - 攻击 2 - 射弹弧度 | FV2: 战斗 - 攻击 2 - 射弹自导允许 | FW2: 战斗 - 攻击 2 - 武器类型 | FX2: 战斗 - 攻击 2 - 目标允许 | FY2: 战斗 - 攻击 2 - 武器声音 | FZ2: 战斗 - 攻击 2 - 穿透伤害范围 | GA2: 战斗 - 攻击 2 - 穿透伤害距离 | GB2: 战斗 - 攻击 2 - 伤害衰减参数 | GC2: 战斗 - 攻击 2 - 显示UI | GD2: 战斗 - 攻击 2 - 动画回复点 | GE2: 战斗 - 攻击 2 - 动画伤害点 | GF2: 战斗 - 攻击 2 - 攻击范围 | GG2: 战斗 - 攻击 2 - 攻击范围缓冲 | GH2: 战斗 - 攻击 2 - 基础伤害 | GI2: 战斗 - 攻击 2 - 伤害骰子面数 | GJ2: 战斗 - 攻击 2 - 伤害骰子数量 | GK2: 战斗 - 攻击 2 - 伤害升级奖励 | GL2: 战斗 - 攻击 2 - 范围影响目标 | GM2: 战斗 - 攻击 2 - 攻击间隔 | GN2: 战斗 - 攻击 2 - 全伤害范围 | GO2: 战斗 - 攻击 2 - 最大目标数 | GP2: 战斗 - 攻击 2 - 小伤害参数 | GQ2: 战斗 - 攻击 2 - 小伤害范围 | GR2: 战斗 - 攻击 2 - 中伤害参数 | GS2: 战斗 - 攻击 2 - 中伤害范围 | GT2: 战斗 - 允许攻击模式 | GU2: 状态 - 等级 | GV2: 状态 - 种族 | GW2: 状态 - 单位类别 | GX2: 状态 - 是一个建筑 | GY2: 状态 - 建造时间 | GZ2: 状态 - 黄金奖励 - 骰子面数 | HA2: 状态 - 黄金奖励 - 骰子数量 | HB2: 状态 - 修理黄金消耗 | HC2: 状态 - 修理木材消耗 | HD2: 状态 - 修理时间 | HE2: 状态 - 木材奖励 - 基础值 | HF2: 状态 - 木材奖励 - 骰子面数 | HG2: 状态 - 木材奖励 - 骰子数量 | HH2: 状态 - 魔法最大值 | HI2: 状态 - 魔法回复 | HJ2: 状态 - 魔法初始数量 | HK2: 状态 - 生命回复 | HL2: 状态 - 生命回复类型 | HM2: 状态 - 提供人口 | HN2: 状态 - 占用人口 | HO2: 状态 - 雇佣开始时间 | HP2: 状态 - 雇佣时间间隔 | HQ2: 状态 - 视野范围(白天) | HR2: 状态 - 视野范围(夜晚) | HS2: 状态 - 运输尺寸 | HT2: 状态 - 最大库存量 | HU2: 状态 - 隐藏小地图显示 | HV2: 状态 - 英雄 - 隐藏小地图英雄显示 | HW2: 状态 - 英雄 - 隐藏英雄栏图标 | HX2: 状态 - 英雄 - 隐藏英雄死亡信息 | HY2: 状态 - 英雄 - 主要属性 | HZ2: 状态 - 中立建筑 - 可作为随机建筑 | IA2: 状态 - 中立建筑 - 显示小地图标记 | IB2: 状态 - 单位附加值 | IC2: 状态 - 编队优先权 | ID2: 状态 - 队形排列 | IE2: 状态 - 可以逃跑 | IF2: 状态 - 能被其他建筑建造 | IG2: 状态 - 能建造在其他建筑上 | IH2: 状态 - 允许睡眠
A3: OBJECT | B3: 1 | C3: h000 | D3: hfoo | E3: 虚空军团Lv1 | F3: 0.5 | G3: =INT(RC[3]/20) -> 246 | H3: =INT(RC[2]/10) -> 492 | I3: 50 | J3: = INT(4000*RC[-8]*POWER(10,0.09*RC[-8])) -> 4921 | L3: 0.8 | M3: units\creeps\Satyr\Satyr | N3: ="let _u"&RC[-12]&" = new UnitAttackers('"&RC[-11]&"')" -> let _u1 = new UnitAttackers('h000') | O3: =IF(MOD(RC[-13],3)<>0,"let _e"&RC[-13]&" = new EnemyAttackers("&RC[-13]&",_u"&RC[-13]&")","let _e"&RC[-13]&" = new EnemyAttackers("&RC[-13]&",_bu"&INT(RC[-13]/3)&")") -> let _e1 = new EnemyAttackers(1,_u1) | S3: 1 | T3: 1 | AZ3: R000,R001 | BN3: Rifleman | BY3: null | BZ3: null | CF3: 1 | CI3: 0 | DC3: 0 | DD3: 0 | DI3: 1 | DR3: 0.1 | DT3: 1 | DU3: 1 | ED3: 390 | EE3: 2.8 | EM3: normal | FF3: 0.2 | FG3: 0.1 | FH3: 300 | FJ3: 0 | GU3: 1 | GV3: human | GY3: 0 | GZ3: 0 | HA3: 0 | HB3: 0 | HC3: 0 | HD3: 0 | HI3: 0 | HK3: 0 | HL3: null | HN3: 0 | HO3: 0 | HP3: 0 | HR3: 1800 | HS3: 0 | HT3: 0 | IE3: 0
A4: OBJECT | B4: 2 | C4: h001 | D4: hfoo | E4: 虚空军团Lv2 | F4: 0.49 | G4: =INT(RC[3]/20) -> 605 | H4: =INT(RC[2]/10) -> 1210 | I4: 100 | J4: = INT(4000*RC[-8]*POWER(10,0.09*RC[-8])) -> 12108 | L4: 0.9 | M4: units\creeps\Satyr\Satyr | N4: ="let _u"&RC[-12]&" = new UnitAttackers('"&RC[-11]&"')" -> let _u2 = new UnitAttackers('h001') | O4: =IF(MOD(RC[-13],3)<>0,"let _e"&RC[-13]&" = new EnemyAttackers("&RC[-13]&",_u"&RC[-13]&")","let _e"&RC[-13]&" = new EnemyAttackers("&RC[-13]&",_bu"&INT(RC[-13]/3)&")") -> let _e2 = new EnemyAttackers(2,_u2) | S4: 2 | T4: 2 | AZ4: R000,R001 | BN4: Rifleman | BY4: null | BZ4: null | CF4: 1 | CJ4: 0 | DC4: 0 | DD4: 0 | DI4: 1 | DR4: 0.1 | DT4: 1 | DU4: 1 | ED4: 390 | EE4: 2.8 | EM4: normal | FF4: 0.2 | FG4: 0.1 | FH4: 300 | FJ4: 0 | GU4: 1 | GV4: human | GY4: 0 | GZ4: 0 | HA4: 0 | HB4: 0 | HC4: 0 | HD4: 0 | HI4: 0 | HK4: 0 | HL4: null | HN4: 0 | HO4: 0 | HP4: 0 | HR4: 1800 | HS4: 0 | HT4: 0 | IE4: 0
A5: OBJECT | B5: 3 | C5: h002 | D5: hfoo | E5: 虚空军团Lv3 | F5: 0.48 | G5: =INT(RC[3]/20) -> 1117 | H5: =INT(RC[2]/10) -> 2234 | I5: 150 | J5: = INT(4000*RC[-8]*POWER(10,0.09*RC[-8])) -> 22345 | L5: 1 | M5: units\creeps\Satyr\Satyr | N5: ="let _u"&RC[-12]&" = new UnitAttackers('"&RC[-11]&"')" -> let _u3 = new UnitAttackers('h002') | O5: =IF(MOD(RC[-13],3)<>0,"let _e"&RC[-13]&" = new EnemyAttackers("&RC[-13]&",_u"&RC[-13]&")","let _e"&RC[-13]&" = new EnemyAttackers("&RC[-13]&",_bu"&INT(RC[-13]/3)&")") -> let _e3 = new EnemyAttackers(3,_bu1) | S5: 3 | T5: 3 | AZ5: R000,R001 | BN5: Rifleman | BY5: null | BZ5: null | CF5: 1 | CK5: 0 | DC5: 0 | DD5: 0 | DI5: 1 | DR5: 0.1 | DT5: 1 | DU5: 1 | ED5: 390 | EE5: 2.8 | EM5: normal | FF5: 0.2 | FG5: 0.1 | FH5: 300 | FJ5: 0 | GU5: 1 | GV5: human | GY5: 0 | GZ5: 0 | HA5: 0 | HB5: 0 | HC5: 0 | HD5: 0 | HI5: 0 | HK5: 0 | HL5: null | HN5: 0 | HO5: 0 | HP5: 0 | HR5: 1800 | HS5: 0 | HT5: 0 | IE5: 0
A6: OBJECT | B6: 4 | C6: h003 | D6: hfoo | E6: 虚空军团Lv4 | F6: 0.47 | G6: =INT(RC[3]/20) -> 1832 | H6: =INT(RC[2]/10) -> 3665 | I6: 200 | J6: = INT(4000*RC[-8]*POWER(10,0.09*RC[-8])) -> 36653 | L6: 1.1000000000000001 | M6: units\creeps\Satyr\Satyr | N6: ="let _u"&RC[-12]&" = new UnitAttackers('"&RC[-11]&"')" -> let _u4 = new UnitAttackers('h003') | O6: =IF(MOD(RC[-13],3)<>0,"let _e"&RC[-13]&" = new EnemyAttackers("&RC[-13]&",_u"&RC[-13]&")","let _e"&RC[-13]&" = new EnemyAttackers("&RC[-13]&",_bu"&INT(RC[-13]/3)&")") -> let _e4 = new EnemyAttackers(4,_u4) | S6: 4 | T6: 4 | AZ6: R000,R001 | BN6: Rifleman | BY6: null | BZ6: null | CF6: 1 | CI6: 0 | CJ6: 0 | DC6: 0 | DD6: 0 | DI6: 1 | DR6: 0.1 | DT6: 1 | DU6: 1 | ED6: 390 | EE6: 2.8 | EM6: normal | FF6: 0.2 | FG6: 0.1 | FH6: 300 | FJ6: 0 | GU6: 1 | GV6: human | GY6: 0 | GZ6: 0 | HA6: 0 | HB6: 0 | HC6: 0 | HD6: 0 | HI6: 0 | HK6: 0 | HL6: null | HN6: 0 | HO6: 0 | HP6: 0 | HR6: 1800 | HS6: 0 | HT6: 0 | IE6: 0
A7: OBJECT | B7: 5 | C7: h004 | D7: hfoo | E7: 虚空军团Lv5 | F7: 0.46 | G7: =INT(RC[3]/20) -> 2818 | H7: =INT(RC[2]/10) -> 5636 | I7: 250 | J7: = INT(4000*RC[-8]*POWER(10,0.09*RC[-8])) -> 56367 | L7: 1.2 | M7: units\creeps\Satyr\Satyr | N7: ="let _u"&RC[-12]&" = new UnitAttackers('"&RC[-11]&"')" -> let _u5 = new UnitAttackers('h004') | O7: =IF(MOD(RC[-13],3)<>0,"let _e"&RC[-13]&" = new EnemyAttackers("&RC[-13]&",_u"&RC[-13]&")","let _e"&RC[-13]&" = new EnemyAttackers("&RC[-13]&",_bu"&INT(RC[-13]/3)&")") -> let _e5 = new EnemyAttackers(5,_u5) | S7: 5 | T7: 5 | AZ7: R000,R001 | BN7: Rifleman | BY7: null | BZ7: null | CF7: 1 | CJ7: 0 | CK7: 0 | DC7: 0 | DD7: 0 | DI7: 1 | DR7: 0.1 | DT7: 1 | DU7: 1 | ED7: 390 | EE7: 2.8 | EM7: normal | FF7: 0.2 | FG7: 0.1 | FH7: 300 | FJ7: 0 | GU7: 1 | GV7: human | GY7: 0 | GZ7: 0 | HA7: 0 | HB7: 0 | HC7: 0 | HD7: 0 | HI7: 0 | HK7: 0 | HL7: null | HN7: 0 | HO7: 0 | HP7: 0 | HR7: 1800 | HS7: 0 | HT7: 0 | IE7: 0
A8: OBJECT | B8: 6 | C8: h005 | D8: hfoo | E8: 虚空军团Lv6 | F8: 0.45 | G8: =INT(RC[3]/20) -> 4160 | H8: =INT(RC[2]/10) -> 8321 | I8: 300 | J8: = INT(4000*RC[-8]*POWER(10,0.09*RC[-8])) -> 83216 | L8: 0.8 | M8: units\creeps\SatyrTrickster\SatyrTrickster | N8: ="let _u"&RC[-12]&" = new UnitAttackers('"&RC[-11]&"')" -> let _u6 = new UnitAttackers('h005') | O8: =IF(MOD(RC[-13],3)<>0,"let _e"&RC[-13]&" = new EnemyAttackers("&RC[-13]&",_u"&RC[-13]&")","let _e"&RC[-13]&" = new EnemyAttackers("&RC[-13]&",_bu"&INT(RC[-13]/3)&")") -> let _e6 = new EnemyAttackers(6,_bu2) | S8: 6 | T8: 6 | AZ8: R000,R001 | BN8: Rifleman | BY8: null | BZ8: null | CF8: 1 | CI8: 0 | DC8: 0 | DD8: 0 | DI8: 1 | DR8: 0.1 | DT8: 1 | DU8: 1 | ED8: 390 | EE8: 2.8 | EM8: normal | FF8: 0.2 | FG8: 0.1 | FH8: 300 | FJ8: 0 | GU8: 1 | GV8: human | GY8: 0 | GZ8: 0 | HA8: 0 | HB8: 0 | HC8: 0 | HD8: 0 | HI8: 0 | HK8: 0 | HL8: null | HN8: 0 | HO8: 0 | HP8: 0 | HR8: 1800 | HS8: 0 | HT8: 0 | IE8: 0
A9: OBJECT | B9: 7 | C9: h006 | D9: hfoo | E9: 虚空军团Lv7 | F9: 0.44 | G9: =INT(RC[3]/20) -> 5972 | H9: =INT(RC[2]/10) -> 11944 | I9: 350 | J9: = INT(4000*RC[-8]*POWER(10,0.09*RC[-8])) -> 119442 | L9: 0.9 | M9: units\creeps\SatyrTrickster\SatyrTrickster | N9: ="let _u"&RC[-12]&" = new UnitAttackers('"&RC[-11]&"')" -> let _u7 = new UnitAttackers('h006') | O9: =IF(MOD(RC[-13],3)<>0,"let _e"&RC[-13]&" = new EnemyAttackers("&RC[-13]&",_u"&RC[-13]&")","let _e"&RC[-13]&" = new EnemyAttackers("&RC[-13]&",_bu"&INT(RC[-13]/3)&")") -> let _e7 = new EnemyAttackers(7,_u7) | S9: 7 | T9: 7 | AZ9: R000,R001 | BN9: Rifleman | BY9: null | BZ9: null | CF9: 1 | CJ9: 0 | DC9: 0 | DD9: 0 | DI9: 1 | DR9: 0.1 | DT9: 1 | DU9: 1 | ED9: 390 | EE9: 2.8 | EM9: normal | FF9: 0.2 | FG9: 0.1 | FH9: 300 | FJ9: 0 | GU9: 1 | GV9: human | GY9: 0 | GZ9: 0 | HA9: 0 | HB9: 0 | HC9: 0 | HD9: 0 | HI9: 0 | HK9: 0 | HL9: null | HN9: 0 | HO9: 0 | HP9: 0 | HR9: 1800 | HS9: 0 | HT9: 0 | IE9: 0
A10: OBJECT | B10: 8 | C10: h007 | D10: hfoo | E10: 虚空军团Lv8 | F10: 0.43 | G10: =INT(RC[3]/20) -> 8396 | H10: =INT(RC[2]/10) -> 16793 | I10: 400 | J10: = INT(4000*RC[-8]*POWER(10,0.09*RC[-8])) -> 167938 | L10: 1 | M10: units\creeps\SatyrTrickster\SatyrTrickster | N10: ="let _u"&RC[-12]&" = new UnitAttackers('"&RC[-11]&"')" -> let _u8 = new UnitAttackers('h007') | O10: =IF(MOD(RC[-13],3)<>0,"let _e"&RC[-13]&" = new EnemyAttackers("&RC[-13]&",_u"&RC[-13]&")","let _e"&RC[-13]&" = new EnemyAttackers("&RC[-13]&",_bu"&INT(RC[-13]/3)&")") -> let _e8 = new EnemyAttackers(8,_u8) | S10: 8 | T10: 8 | AZ10: R000,R001 | BN10: Rifleman | BY10: null | BZ10: null | CF10: 1 | CK10: 0 | DC10: 0 | DD10: 0 | DI10: 1 | DR10: 0.1 | DT10: 1 | DU10: 1 | ED10: 390 | EE10: 2.8 | EM10: normal | FF10: 0.2 | FG10: 0.1 | FH10: 300 | FJ10: 0 | GU10: 1 | GV10: human | GY10: 0 | GZ10: 0 | HA10: 0 | HB10: 0 | HC10: 0 | HD10: 0 | HI10: 0 | HK10: 0 | HL10: null | HN10: 0 | HO10: 0 | HP10: 0 | HR10: 1800 | HS10: 0 | HT10: 0 | IE10: 0
A11: OBJECT | B11: 9 | C11: h008 | D11: hfoo | E11: 虚空军团Lv9 | F11: 0.42 | G11: =INT(RC[3]/20) -> 11621 | H11: =INT(RC[2]/10) -> 23243 | I11: 450 | J11: = INT(4000*RC[-8]*POWER(10,0.09*RC[-8])) -> 232435 | L11: 1.1000000000000001 | M11: units\creeps\SatyrTrickster\SatyrTrickster | N11: ="let _u"&RC[-12]&" = new UnitAttackers('"&RC[-11]&"')" -> let _u9 = new UnitAttackers('h008') | O11: =IF(MOD(RC[-13],3)<>0,"let _e"&RC[-13]&" = new EnemyAttackers("&RC[-13]&",_u"&RC[-13]&")","let _e"&RC[-13]&" = new EnemyAttackers("&RC[-13]&",_bu"&INT(RC[-13]/3)&")") -> let _e9 = new EnemyAttackers(9,_bu3) | S11: 9 | T11: 9 | AZ11: R000,R001 | BN11: Rifleman | BY11: null | BZ11: null | CF11: 1 | CI11: 0 | CJ11: 0 | DC11: 0 | DD11: 0 | DI11: 1 | DR11: 0.1 | DT11: 1 | DU11: 1 | ED11: 390 | EE11: 2.8 | EM11: normal | FF11: 0.2 | FG11: 0.1 | FH11: 300 | FJ11: 0 | GU11: 1 | GV11: human | GY11: 0 | GZ11: 0 | HA11: 0 | HB11: 0 | HC11: 0 | HD11: 0 | HI11: 0 | HK11: 0 | HL11: null | HN11: 0 | HO11: 0 | HP11: 0 | HR11: 1800 | HS11: 0 | HT11: 0 | IE11: 0
A12: OBJECT | B12: 10 | C12: h009 | D12: hfoo | E12: 虚空军团Lv10 | F12: 0.41 | G12: =INT(RC[3]/20) -> 15886 | H12: =INT(RC[2]/10) -> 31773 | I12: 500 | J12: = INT(4000*RC[-8]*POWER(10,0.09*RC[-8])) -> 317731 | L12: 1.2 | M12: units\creeps\SatyrTrickster\SatyrTrickster | N12: ="let _u"&RC[-12]&" = new UnitAttackers('"&RC[-11]&"')" -> let _u10 = new UnitAttackers('h009') | O12: =IF(MOD(RC[-13],3)<>0,"let _e"&RC[-13]&" = new EnemyAttackers("&RC[-13]&",_u"&RC[-13]&")","let _e"&RC[-13]&" = new EnemyAttackers("&RC[-13]&",_bu"&INT(RC[-13]/3)&")") -> let _e10 = new EnemyAttackers(10,_u10) | S12: 10 | T12: 10 | AZ12: R000,R001 | BN12: Rifleman | BY12: null | BZ12: null | CF12: 1 | CJ12: 0 | CK12: 0 | DC12: 0 | DD12: 0 | DI12: 1 | DR12: 0.1 | DT12: 1 | DU12: 1 | ED12: 390 | EE12: 2.8 | EM12: normal | FF12: 0.2 | FG12: 0.1 | FH12: 300 | FJ12: 0 | GU12: 1 | GV12: human | GY12: 0 | GZ12: 0 | HA12: 0 | HB12: 0 | HC12: 0 | HD12: 0 | HI12: 0 | HK12: 0 | HL12: null | HN12: 0 | HO12: 0 | HP12: 0 | HR12: 1800 | HS12: 0 | HT12: 0 | IE12: 0
A13: OBJECT | B13: 11 | C13: h00A | D13: hfoo | E13: 虚空军团Lv11 | F13: 0.4 | G13: =INT(RC[3]/20) -> 21499 | H13: =INT(RC[2]/10) -> 42998 | I13: 550 | J13: = INT(4000*RC[-8]*POWER(10,0.09*RC[-8])) -> 429984 | L13: 0.8 | M13: units\creeps\Ogre\Ogre | N13: ="let _u"&RC[-12]&" = new UnitAttackers('"&RC[-11]&"')" -> let _u11 = new UnitAttackers('h00A') | O13: =IF(MOD(RC[-13],3)<>0,"let _e"&RC[-13]&" = new EnemyAttackers("&RC[-13]&",_u"&RC[-13]&")","let _e"&RC[-13]&" = new EnemyAttackers("&RC[-13]&",_bu"&INT(RC[-13]/3)&")") -> let _e11 = new EnemyAttackers(11,_u11) | S13: 11 | T13: 11 | AZ13: R000,R001 | BN13: Rifleman | BY13: null | BZ13: null | CF13: 1 | CI13: 0 | DC13: 0 | DD13: 0 | DI13: 1 | DR13: 0.1 | DT13: 1 | DU13: 1 | ED13: 390 | EE13: 2.8 | EM13: normal | FF13: 0.2 | FG13: 0.1 | FH13: 300 | FJ13: 0 | GU13: 1 | GV13: human | GY13: 0 | GZ13: 0 | HA13: 0 | HB13: 0 | HC13: 0 | HD13: 0 | HI13: 0 | HK13: 0 | HL13: null | HN13: 0 | HO13: 0 | HP13: 0 | HR13: 1800 | HS13: 0 | HT13: 0 | IE13: 0
A14: OBJECT | B14: 12 | C14: h00B | D14: hfoo | E14: 虚空军团Lv12 | F14: 0.39 | G14: =INT(RC[3]/20) -> 28854 | H14: =INT(RC[2]/10) -> 57708 | I14: 600 | J14: = INT(4000*RC[-8]*POWER(10,0.09*RC[-8])) -> 577086 | L14: 0.9 | M14: units\creeps\Ogre\Ogre | N14: ="let _u"&RC[-12]&" = new UnitAttackers('"&RC[-11]&"')" -> let _u12 = new UnitAttackers('h00B') | O14: =IF(MOD(RC[-13],3)<>0,"let _e"&RC[-13]&" = new EnemyAttackers("&RC[-13]&",_u"&RC[-13]&")","let _e"&RC[-13]&" = new EnemyAttackers("&RC[-13]&",_bu"&INT(RC[-13]/3)&")") -> let _e12 = new EnemyAttackers(12,_bu4) | S14: 12 | T14: 12 | AZ14: R000,R001 | BN14: Rifleman | BY14: null | BZ14: null | CF14: 1 | CJ14: 0 | DC14: 0 | DD14: 0 | DI14: 1 | DR14: 0.1 | DT14: 1 | DU14: 1 | ED14: 390 | EE14: 2.8 | EM14: normal | FF14: 0.2 | FG14: 0.1 | FH14: 300 | FJ14: 0 | GU14: 1 | GV14: human | GY14: 0 | GZ14: 0 | HA14: 0 | HB14: 0 | HC14: 0 | HD14: 0 | HI14: 0 | HK14: 0 | HL14: null | HN14: 0 | HO14: 0 | HP14: 0 | HR14: 1800 | HS14: 0 | HT14: 0 | IE14: 0
A15: OBJECT | B15: 13 | C15: h00C | D15: hfoo | E15: 虚空军团Lv13 | F15: 0.38 | G15: =INT(RC[3]/20) -> 38456 | H15: =INT(RC[2]/10) -> 76913 | I15: 650 | J15: = INT(4000*RC[-8]*POWER(10,0.09*RC[-8])) -> 769136 | L15: 1 | M15: units\creeps\Ogre\Ogre | N15: ="let _u"&RC[-12]&" = new UnitAttackers('"&RC[-11]&"')" -> let _u13 = new UnitAttackers('h00C') | O15: =IF(MOD(RC[-13],3)<>0,"let _e"&RC[-13]&" = new EnemyAttackers("&RC[-13]&",_u"&RC[-13]&")","let _e"&RC[-13]&" = new EnemyAttackers("&RC[-13]&",_bu"&INT(RC[-13]/3)&")") -> let _e13 = new EnemyAttackers(13,_u13) | S15: 13 | T15: 13 | AZ15: R000,R001 | BN15: Rifleman | BY15: null | BZ15: null | CF15: 1 | CK15: 0 | DC15: 0 | DD15: 0 | DI15: 1 | DR15: 0.1 | DT15: 1 | DU15: 1 | ED15: 390 | EE15: 2.8 | EM15: normal | FF15: 0.2 | FG15: 0.1 | FH15: 300 | FJ15: 0 | GU15: 1 | GV15: human | GY15: 0 | GZ15: 0 | HA15: 0 | HB15: 0 | HC15: 0 | HD15: 0 | HI15: 0 | HK15: 0 | HL15: null | HN15: 0 | HO15: 0 | HP15: 0 | HR15: 1800 | HS15: 0 | HT15: 0 | IE15: 0
A16: OBJECT | B16: 14 | C16: h00D | D16: hfoo | E16: 虚空军团Lv14 | F16: 0.37 | G16: =INT(RC[3]/20) -> 50951 | H16: =INT(RC[2]/10) -> 101903 | I16: 700 | J16: = INT(4000*RC[-8]*POWER(10,0.09*RC[-8])) -> 1019032 | L16: 1.1000000000000001 | M16: units\creeps\Ogre\Ogre | N16: ="let _u"&RC[-12]&" = new UnitAttackers('"&RC[-11]&"')" -> let _u14 = new UnitAttackers('h00D') | O16: =IF(MOD(RC[-13],3)<>0,"let _e"&RC[-13]&" = new EnemyAttackers("&RC[-13]&",_u"&RC[-13]&")","let _e"&RC[-13]&" = new EnemyAttackers("&RC[-13]&",_bu"&INT(RC[-13]/3)&")") -> let _e14 = new EnemyAttackers(14,_u14) | S16: 14 | T16: 14 | AZ16: R000,R001 | BN16: Rifleman | BY16: null | BZ16: null | CF16: 1 | CI16: 0 | CJ16: 0 | DC16: 0 | DD16: 0 | DI16: 1 | DR16: 0.1 | DT16: 1 | DU16: 1 | ED16: 390 | EE16: 2.8 | EM16: normal | FF16: 0.2 | FG16: 0.1 | FH16: 300 | FJ16: 0 | GU16: 1 | GV16: human | GY16: 0 | GZ16: 0 | HA16: 0 | HB16: 0 | HC16: 0 | HD16: 0 | HI16: 0 | HK16: 0 | HL16: null | HN16: 0 | HO16: 0 | HP16: 0 | HR16: 1800 | HS16: 0 | HT16: 0 | IE16: 0
A17: OBJECT | B17: 15 | C17: h00E | D17: hfoo | E17: 虚空军团Lv15 | F17: 0.36 | G17: =INT(RC[3]/20) -> 67161 | H17: =INT(RC[2]/10) -> 134323 | I17: 750 | J17: = INT(4000*RC[-8]*POWER(10,0.09*RC[-8])) -> 1343232 | L17: 1.2 | M17: units\creeps\Ogre\Ogre | N17: ="let _u"&RC[-12]&" = new UnitAttackers('"&RC[-11]&"')" -> let _u15 = new UnitAttackers('h00E') | O17: =IF(MOD(RC[-13],3)<>0,"let _e"&RC[-13]&" = new EnemyAttackers("&RC[-13]&",_u"&RC[-13]&")","let _e"&RC[-13]&" = new EnemyAttackers("&RC[-13]&",_bu"&INT(RC[-13]/3)&")") -> let _e15 = new EnemyAttackers(15,_bu5) | S17: 15 | T17: 15 | AZ17: R000,R001 | BN17: Rifleman | BY17: null | BZ17: null | CF17: 1 | CJ17: 0 | CK17: 0 | DC17: 0 | DD17: 0 | DI17: 1 | DR17: 0.1 | DT17: 1 | DU17: 1 | ED17: 390 | EE17: 2.8 | EM17: normal | FF17: 0.2 | FG17: 0.1 | FH17: 300 | FJ17: 0 | GU17: 1 | GV17: human | GY17: 0 | GZ17: 0 | HA17: 0 | HB17: 0 | HC17: 0 | HD17: 0 | HI17: 0 | HK17: 0 | HL17: null | HN17: 0 | HO17: 0 | HP17: 0 | HR17: 1800 | HS17: 0 | HT17: 0 | IE17: 0
A18: OBJECT | B18: 16 | C18: h00F | D18: hfoo | E18: 虚空军团Lv16 | F18: 0.35 | G18: =INT(RC[3]/20) -> 88135 | H18: =INT(RC[2]/10) -> 176270 | I18: 800 | J18: = INT(4000*RC[-8]*POWER(10,0.09*RC[-8])) -> 1762706 | L18: 0.8 | M18: Units\Creeps\tuskarRanged\tuskarRanged | N18: ="let _u"&RC[-12]&" = new UnitAttackers('"&RC[-11]&"')" -> let _u16 = new UnitAttackers('h00F') | O18: =IF(MOD(RC[-13],3)<>0,"let _e"&RC[-13]&" = new EnemyAttackers("&RC[-13]&",_u"&RC[-13]&")","let _e"&RC[-13]&" = new EnemyAttackers("&RC[-13]&",_bu"&INT(RC[-13]/3)&")") -> let _e16 = new EnemyAttackers(16,_u16) | S18: 16 | T18: 16 | AZ18: R000,R001 | BN18: Rifleman | BY18: null | BZ18: null | CF18: 1 | CI18: 0 | DC18: 0 | DD18: 0 | DI18: 1 | DR18: 0.1 | DT18: 1 | DU18: 1 | ED18: 390 | EE18: 2.8 | EM18: normal | FF18: 0.2 | FG18: 0.1 | FH18: 300 | FJ18: 0 | GU18: 1 | GV18: human | GY18: 0 | GZ18: 0 | HA18: 0 | HB18: 0 | HC18: 0 | HD18: 0 | HI18: 0 | HK18: 0 | HL18: null | HN18: 0 | HO18: 0 | HP18: 0 | HR18: 1800 | HS18: 0 | HT18: 0 | IE18: 0
A19: OBJECT | B19: 17 | C19: h00G | D19: hfoo | E19: 虚空军团Lv17 | F19: 0.34 | G19: =INT(RC[3]/20) -> 115207 | H19: =INT(RC[2]/10) -> 230414 | I19: 850 | J19: = INT(4000*RC[-8]*POWER(10,0.09*RC[-8])) -> 2304140 | L19: 0.9 | M19: Units\Creeps\tuskarRanged\tuskarRanged | N19: ="let _u"&RC[-12]&" = new UnitAttackers('"&RC[-11]&"')" -> let _u17 = new UnitAttackers('h00G') | O19: =IF(MOD(RC[-13],3)<>0,"let _e"&RC[-13]&" = new EnemyAttackers("&RC[-13]&",_u"&RC[-13]&")","let _e"&RC[-13]&" = new EnemyAttackers("&RC[-13]&",_bu"&INT(RC[-13]/3)&")") -> let _e17 = new EnemyAttackers(17,_u17) | S19: 17 | T19: 17 | AZ19: R000,R001 | BN19: Rifleman | BY19: null | BZ19: null | CF19: 1 | CJ19: 0 | DC19: 0 | DD19: 0 | DI19: 1 | DR19: 0.1 | DT19: 1 | DU19: 1 | ED19: 390 | EE19: 2.8 | EM19: normal | FF19: 0.2 | FG19: 0.1 | FH19: 300 | FJ19: 0 | GU19: 1 | GV19: human | GY19: 0 | GZ19: 0 | HA19: 0 | HB19: 0 | HC19: 0 | HD19: 0 | HI19: 0 | HK19: 0 | HL19: null | HN19: 0 | HO19: 0 | HP19: 0 | HR19: 1800 | HS19: 0 | HT19: 0 | IE19: 0
A20: OBJECT | B20: 18 | C20: h00H | D20: hfoo | E20: 虚空军团Lv18 | F20: 0.33 | G20: =INT(RC[3]/20) -> 150072 | H20: =INT(RC[2]/10) -> 300145 | I20: 900 | J20: = INT(4000*RC[-8]*POWER(10,0.09*RC[-8])) -> 3001459 | L20: 1 | M20: Units\Creeps\tuskarRanged\tuskarRanged | N20: ="let _u"&RC[-12]&" = new UnitAttackers('"&RC[-11]&"')" -> let _u18 = new UnitAttackers('h00H') | O20: =IF(MOD(RC[-13],3)<>0,"let _e"&RC[-13]&" = new EnemyAttackers("&RC[-13]&",_u"&RC[-13]&")","let _e"&RC[-13]&" = new EnemyAttackers("&RC[-13]&",_bu"&INT(RC[-13]/3)&")") -> let _e18 = new EnemyAttackers(18,_bu6) | S20: 18 | T20: 18 | AZ20: R000,R001 | BN20: Rifleman | BY20: null | BZ20: null | CF20: 1 | CK20: 0 | DC20: 0 | DD20: 0 | DI20: 1 | DR20: 0.1 | DT20: 1 | DU20: 1 | ED20: 390 | EE20: 2.8 | EM20: normal | FF20: 0.2 | FG20: 0.1 | FH20: 300 | FJ20: 0 | GU20: 1 | GV20: human | GY20: 0 | GZ20: 0 | HA20: 0 | HB20: 0 | HC20: 0 | HD20: 0 | HI20: 0 | HK20: 0 | HL20: null | HN20: 0 | HO20: 0 | HP20: 0 | HR20: 1800 | HS20: 0 | HT20: 0 | IE20: 0
A21: OBJECT | B21: 19 | C21: h00I | D21: hfoo | E21: 虚空军团Lv19 | F21: 0.32 | G21: =INT(RC[3]/20) -> 194887 | H21: =INT(RC[2]/10) -> 389774 | I21: 950 | J21: = INT(4000*RC[-8]*POWER(10,0.09*RC[-8])) -> 3897746 | L21: 1.1000000000000001 | M21: Units\Creeps\tuskarRanged\tuskarRanged | N21: ="let _u"&RC[-12]&" = new UnitAttackers('"&RC[-11]&"')" -> let _u19 = new UnitAttackers('h00I') | O21: =IF(MOD(RC[-13],3)<>0,"let _e"&RC[-13]&" = new EnemyAttackers("&RC[-13]&",_u"&RC[-13]&")","let _e"&RC[-13]&" = new EnemyAttackers("&RC[-13]&",_bu"&INT(RC[-13]/3)&")") -> let _e19 = new EnemyAttackers(19,_u19) | S21: 19 | T21: 19 | AZ21: R000,R001 | BN21: Rifleman | BY21: null | BZ21: null | CF21: 1 | CI21: 0 | CJ21: 0 | DC21: 0 | DD21: 0 | DI21: 1 | DR21: 0.1 | DT21: 1 | DU21: 1 | ED21: 390 | EE21: 2.8 | EM21: normal | FF21: 0.2 | FG21: 0.1 | FH21: 300 | FJ21: 0 | GU21: 1 | GV21: human | GY21: 0 | GZ21: 0 | HA21: 0 | HB21: 0 | HC21: 0 | HD21: 0 | HI21: 0 | HK21: 0 | HL21: null | HN21: 0 | HO21: 0 | HP21: 0 | HR21: 1800 | HS21: 0 | HT21: 0 | IE21: 0
A22: OBJECT | B22: 20 | C22: h00J | D22: hfoo | E22: 虚空军团Lv20 | F22: 0.31 | G22: =INT(RC[3]/20) -> 252382 | H22: =INT(RC[2]/10) -> 504765 | I22: 1000 | J22: = INT(4000*RC[-8]*POWER(10,0.09*RC[-8])) -> 5047658 | L22: 1.2 | M22: Units\Creeps\tuskarRanged\tuskarRanged | N22: ="let _u"&RC[-12]&" = new UnitAttackers('"&RC[-11]&"')" -> let _u20 = new UnitAttackers('h00J') | O22: =IF(MOD(RC[-13],3)<>0,"let _e"&RC[-13]&" = new EnemyAttackers("&RC[-13]&",_u"&RC[-13]&")","let _e"&RC[-13]&" = new EnemyAttackers("&RC[-13]&",_bu"&INT(RC[-13]/3)&")") -> let _e20 = new EnemyAttackers(20,_u20) | S22: 20 | T22: 20 | AZ22: R000,R001 | BN22: Rifleman | BY22: null | BZ22: null | CF22: 1 | CJ22: 0 | CK22: 0 | DC22: 0 | DD22: 0 | DI22: 1 | DR22: 0.1 | DT22: 1 | DU22: 1 | ED22: 390 | EE22: 2.8 | EM22: normal | FF22: 0.2 | FG22: 0.1 | FH22: 300 | FJ22: 0 | GU22: 1 | GV22: human | GY22: 0 | GZ22: 0 | HA22: 0 | HB22: 0 | HC22: 0 | HD22: 0 | HI22: 0 | HK22: 0 | HL22: null | HN22: 0 | HO22: 0 | HP22: 0 | HR22: 1800 | HS22: 0 | HT22: 0 | IE22: 0
A23: OBJECT | B23: 21 | C23: h00K | D23: hfoo | E23: 虚空军团Lv21 | F23: 0.3 | G23: =INT(RC[3]/20) -> 326023 | H23: =INT(RC[2]/10) -> 652047 | I23: 1050 | J23: = INT(4000*RC[-8]*POWER(10,0.09*RC[-8])) -> 6520475 | L23: 0.8 | M23: units\creeps\VoidWalker\VoidWalker | N23: ="let _u"&RC[-12]&" = new UnitAttackers('"&RC[-11]&"')" -> let _u21 = new UnitAttackers('h00K') | O23: =IF(MOD(RC[-13],3)<>0,"let _e"&RC[-13]&" = new EnemyAttackers("&RC[-13]&",_u"&RC[-13]&")","let _e"&RC[-13]&" = new EnemyAttackers("&RC[-13]&",_bu"&INT(RC[-13]/3)&")") -> let _e21 = new EnemyAttackers(21,_bu7) | S23: 21 | T23: 21 | AZ23: R000,R001 | BN23: Rifleman | BY23: null | BZ23: null | CF23: 1 | CI23: 0 | DC23: 0 | DD23: 0 | DI23: 1 | DR23: 0.1 | DT23: 1 | DU23: 1 | ED23: 390 | EE23: 2.8 | EM23: normal | FF23: 0.2 | FG23: 0.1 | FH23: 300 | FJ23: 0 | GU23: 1 | GV23: human | GY23: 0 | GZ23: 0 | HA23: 0 | HB23: 0 | HC23: 0 | HD23: 0 | HI23: 0 | HK23: 0 | HL23: null | HN23: 0 | HO23: 0 | HP23: 0 | HR23: 1800 | HS23: 0 | HT23: 0 | IE23: 0
A24: OBJECT | B24: 22 | C24: h00L | D24: hfoo | E24: 虚空军团Lv22 | F24: 0.28999999999999998 | G24: =INT(RC[3]/20) -> 420196 | H24: =INT(RC[2]/10) -> 840393 | I24: 1100 | J24: = INT(4000*RC[-8]*POWER(10,0.09*RC[-8])) -> 8403934 | L24: 0.9 | M24: units\creeps\VoidWalker\VoidWalker | N24: ="let _u"&RC[-12]&" = new UnitAttackers('"&RC[-11]&"')" -> let _u22 = new UnitAttackers('h00L') | O24: =IF(MOD(RC[-13],3)<>0,"let _e"&RC[-13]&" = new EnemyAttackers("&RC[-13]&",_u"&RC[-13]&")","let _e"&RC[-13]&" = new EnemyAttackers("&RC[-13]&",_bu"&INT(RC[-13]/3)&")") -> let _e22 = new EnemyAttackers(22,_u22) | S24: 22 | T24: 22 | AZ24: R000,R001 | BN24: Rifleman | BY24: null | BZ24: null | CF24: 1 | CJ24: 0 | DC24: 0 | DD24: 0 | DI24: 1 | DR24: 0.1 | DT24: 1 | DU24: 1 | ED24: 390 | EE24: 2.8 | EM24: normal | FF24: 0.2 | FG24: 0.1 | FH24: 300 | FJ24: 0 | GU24: 1 | GV24: human | GY24: 0 | GZ24: 0 | HA24: 0 | HB24: 0 | HC24: 0 | HD24: 0 | HI24: 0 | HK24: 0 | HL24: null | HN24: 0 | HO24: 0 | HP24: 0 | HR24: 1800 | HS24: 0 | HT24: 0 | IE24: 0
A25: OBJECT | B25: 23 | C25: h00M | D25: hfoo | E25: 虚空军团Lv23 | F25: 0.28000000000000003 | G25: =INT(RC[3]/20) -> 540452 | H25: =INT(RC[2]/10) -> 1080905 | I25: 1150 | J25: = INT(4000*RC[-8]*POWER(10,0.09*RC[-8])) -> 10809057 | L25: 1 | M25: units\creeps\VoidWalker\VoidWalker | N25: ="let _u"&RC[-12]&" = new UnitAttackers('"&RC[-11]&"')" -> let _u23 = new UnitAttackers('h00M') | O25: =IF(MOD(RC[-13],3)<>0,"let _e"&RC[-13]&" = new EnemyAttackers("&RC[-13]&",_u"&RC[-13]&")","let _e"&RC[-13]&" = new EnemyAttackers("&RC[-13]&",_bu"&INT(RC[-13]/3)&")") -> let _e23 = new EnemyAttackers(23,_u23) | S25: 23 | T25: 23 | AZ25: R000,R001 | BN25: Rifleman | BY25: null | BZ25: null | CF25: 1 | CK25: 0 | DC25: 0 | DD25: 0 | DI25: 1 | DR25: 0.1 | DT25: 1 | DU25: 1 | ED25: 390 | EE25: 2.8 | EM25: normal | FF25: 0.2 | FG25: 0.1 | FH25: 300 | FJ25: 0 | GU25: 1 | GV25: human | GY25: 0 | GZ25: 0 | HA25: 0 | HB25: 0 | HC25: 0 | HD25: 0 | HI25: 0 | HK25: 0 | HL25: null | HN25: 0 | HO25: 0 | HP25: 0 | HR25: 1800 | HS25: 0 | HT25: 0 | IE25: 0
A26: OBJECT | B26: 24 | C26: h00N | D26: hfoo | E26: 虚空军团Lv24 | F26: 0.27 | G26: =INT(RC[3]/20) -> 693811 | H26: =INT(RC[2]/10) -> 1387622 | I26: 1200 | J26: = INT(4000*RC[-8]*POWER(10,0.09*RC[-8])) -> 13876221 | L26: 1.1000000000000001 | M26: units\creeps\VoidWalker\VoidWalker | N26: ="let _u"&RC[-12]&" = new UnitAttackers('"&RC[-11]&"')" -> let _u24 = new UnitAttackers('h00N') | O26: =IF(MOD(RC[-13],3)<>0,"let _e"&RC[-13]&" = new EnemyAttackers("&RC[-13]&",_u"&RC[-13]&")","let _e"&RC[-13]&" = new EnemyAttackers("&RC[-13]&",_bu"&INT(RC[-13]/3)&")") -> let _e24 = new EnemyAttackers(24,_bu8) | S26: 24 | T26: 24 | AZ26: R000,R001 | BN26: Rifleman | BY26: null | BZ26: null | CF26: 1 | CI26: 0 | CJ26: 0 | DC26: 0 | DD26: 0 | DI26: 1 | DR26: 0.1 | DT26: 1 | DU26: 1 | ED26: 390 | EE26: 2.8 | EM26: normal | FF26: 0.2 | FG26: 0.1 | FH26: 300 | FJ26: 0 | GU26: 1 | GV26: human | GY26: 0 | GZ26: 0 | HA26: 0 | HB26: 0 | HC26: 0 | HD26: 0 | HI26: 0 | HK26: 0 | HL26: null | HN26: 0 | HO26: 0 | HP26: 0 | HR26: 1800 | HS26: 0 | HT26: 0 | IE26: 0
A27: OBJECT | B27: 25 | C27: h00O | D27: hfoo | E27: 虚空军团Lv25 | F27: 0.26 | G27: =INT(RC[3]/20) -> 889139 | H27: =INT(RC[2]/10) -> 1778279 | I27: 1250 | J27: = INT(4000*RC[-8]*POWER(10,0.09*RC[-8])) -> 17782794 | L27: 1.2 | M27: units\creeps\VoidWalker\VoidWalker | N27: ="let _u"&RC[-12]&" = new UnitAttackers('"&RC[-11]&"')" -> let _u25 = new UnitAttackers('h00O') | O27: =IF(MOD(RC[-13],3)<>0,"let _e"&RC[-13]&" = new EnemyAttackers("&RC[-13]&",_u"&RC[-13]&")","let _e"&RC[-13]&" = new EnemyAttackers("&RC[-13]&",_bu"&INT(RC[-13]/3)&")") -> let _e25 = new EnemyAttackers(25,_u25) | S27: 25 | T27: 25 | AZ27: R000,R001 | BN27: Rifleman | BY27: null | BZ27: null | CF27: 1 | CJ27: 0 | CK27: 0 | DC27: 0 | DD27: 0 | DI27: 1 | DR27: 0.1 | DT27: 1 | DU27: 1 | ED27: 390 | EE27: 2.8 | EM27: normal | FF27: 0.2 | FG27: 0.1 | FH27: 300 | FJ27: 0 | GU27: 1 | GV27: human | GY27: 0 | GZ27: 0 | HA27: 0 | HB27: 0 | HC27: 0 | HD27: 0 | HI27: 0 | HK27: 0 | HL27: null | HN27: 0 | HO27: 0 | HP27: 0 | HR27: 1800 | HS27: 0 | HT27: 0 | IE27: 0
A28: OBJECT | B28: 26 | C28: h00P | D28: hfoo | E28: 虚空军团Lv26 | F28: 0.25 | G28: =INT(RC[3]/20) -> 1137636 | H28: =INT(RC[2]/10) -> 2275272 | I28: 1300 | J28: = INT(4000*RC[-8]*POWER(10,0.09*RC[-8])) -> 22752720 | L28: 1.3 | M28: units\creeps\RevenantOfTheWaves\RevenantOfTheWaves | N28: ="let _u"&RC[-12]&" = new UnitAttackers('"&RC[-11]&"')" -> let _u26 = new UnitAttackers('h00P') | O28: =IF(MOD(RC[-13],3)<>0,"let _e"&RC[-13]&" = new EnemyAttackers("&RC[-13]&",_u"&RC[-13]&")","let _e"&RC[-13]&" = new EnemyAttackers("&RC[-13]&",_bu"&INT(RC[-13]/3)&")") -> let _e26 = new EnemyAttackers(26,_u26) | S28: 26 | T28: 26 | AZ28: R000,R001 | BN28: Rifleman | BY28: null | BZ28: null | CF28: 1 | CI28: 0 | DC28: 0 | DD28: 0 | DI28: 1 | DR28: 0.1 | DT28: 1 | DU28: 1 | ED28: 390 | EE28: 2.8 | EM28: normal | FF28: 0.2 | FG28: 0.1 | FH28: 300 | FJ28: 0 | GU28: 1 | GV28: human | GY28: 0 | GZ28: 0 | HA28: 0 | HB28: 0 | HC28: 0 | HD28: 0 | HI28: 0 | HK28: 0 | HL28: null | HN28: 0 | HO28: 0 | HP28: 0 | HR28: 1800 | HS28: 0 | HT28: 0 | IE28: 0
A29: OBJECT | B29: 27 | C29: h00Q | D29: hfoo | E29: 虚空军团Lv27 | F29: 0.24 | G29: =INT(RC[3]/20) -> 1453428 | H29: =INT(RC[2]/10) -> 2906857 | I29: 1350 | J29: = INT(4000*RC[-8]*POWER(10,0.09*RC[-8])) -> 29068575 | L29: 1.4 | M29: units\creeps\RevenantOfTheWaves\RevenantOfTheWaves | N29: ="let _u"&RC[-12]&" = new UnitAttackers('"&RC[-11]&"')" -> let _u27 = new UnitAttackers('h00Q') | O29: =IF(MOD(RC[-13],3)<>0,"let _e"&RC[-13]&" = new EnemyAttackers("&RC[-13]&",_u"&RC[-13]&")","let _e"&RC[-13]&" = new EnemyAttackers("&RC[-13]&",_bu"&INT(RC[-13]/3)&")") -> let _e27 = new EnemyAttackers(27,_bu9) | S29: 27 | T29: 27 | AZ29: R000,R001 | BN29: Rifleman | BY29: null | BZ29: null | CF29: 1 | CJ29: 0 | DC29: 0 | DD29: 0 | DI29: 1 | DR29: 0.1 | DT29: 1 | DU29: 1 | ED29: 390 | EE29: 2.8 | EM29: normal | FF29: 0.2 | FG29: 0.1 | FH29: 300 | FJ29: 0 | GU29: 1 | GV29: human | GY29: 0 | GZ29: 0 | HA29: 0 | HB29: 0 | HC29: 0 | HD29: 0 | HI29: 0 | HK29: 0 | HL29: null | HN29: 0 | HO29: 0 | HP29: 0 | HR29: 1800 | HS29: 0 | HT29: 0 | IE29: 0
A30: OBJECT | B30: 28 | C30: h00R | D30: hfoo | E30: 虚空军团Lv28 | F30: 0.23 | G30: =INT(RC[3]/20) -> 1854334 | H30: =INT(RC[2]/10) -> 3708668 | I30: 1400 | J30: = INT(4000*RC[-8]*POWER(10,0.09*RC[-8])) -> 37086685 | L30: 1.5 | M30: units\creeps\RevenantOfTheWaves\RevenantOfTheWaves | N30: ="let _u"&RC[-12]&" = new UnitAttackers('"&RC[-11]&"')" -> let _u28 = new UnitAttackers('h00R') | O30: =IF(MOD(RC[-13],3)<>0,"let _e"&RC[-13]&" = new EnemyAttackers("&RC[-13]&",_u"&RC[-13]&")","let _e"&RC[-13]&" = new EnemyAttackers("&RC[-13]&",_bu"&INT(RC[-13]/3)&")") -> let _e28 = new EnemyAttackers(28,_u28) | S30: 28 | T30: 28 | AZ30: R000,R001 | BN30: Rifleman | BY30: null | BZ30: null | CF30: 1 | CK30: 0 | DC30: 0 | DD30: 0 | DI30: 1 | DR30: 0.1 | DT30: 1 | DU30: 1 | ED30: 390 | EE30: 2.8 | EM30: normal | FF30: 0.2 | FG30: 0.1 | FH30: 300 | FJ30: 0 | GU30: 1 | GV30: human | GY30: 0 | GZ30: 0 | HA30: 0 | HB30: 0 | HC30: 0 | HD30: 0 | HI30: 0 | HK30: 0 | HL30: null | HN30: 0 | HO30: 0 | HP30: 0 | HR30: 1800 | HS30: 0 | HT30: 0 | IE30: 0
A31: OBJECT | B31: 29 | C31: h00S | D31: hfoo | E31: 虚空军团Lv29 | F31: 0.22 | G31: =INT(RC[3]/20) -> 2362805 | H31: =INT(RC[2]/10) -> 4725611 | I31: 1450 | J31: = INT(4000*RC[-8]*POWER(10,0.09*RC[-8])) -> 47256112 | L31: 1.6 | M31: units\creeps\RevenantOfTheWaves\RevenantOfTheWaves | N31: ="let _u"&RC[-12]&" = new UnitAttackers('"&RC[-11]&"')" -> let _u29 = new UnitAttackers('h00S') | O31: =IF(MOD(RC[-13],3)<>0,"let _e"&RC[-13]&" = new EnemyAttackers("&RC[-13]&",_u"&RC[-13]&")","let _e"&RC[-13]&" = new EnemyAttackers("&RC[-13]&",_bu"&INT(RC[-13]/3)&")") -> let _e29 = new EnemyAttackers(29,_u29) | S31: 29 | T31: 29 | AZ31: R000,R001 | BN31: Rifleman | BY31: null | BZ31: null | CF31: 1 | CI31: 0 | CJ31: 0 | DC31: 0 | DD31: 0 | DI31: 1 | DR31: 0.1 | DT31: 1 | DU31: 1 | ED31: 390 | EE31: 2.8 | EM31: normal | FF31: 0.2 | FG31: 0.1 | FH31: 300 | FJ31: 0 | GU31: 1 | GV31: human | GY31: 0 | GZ31: 0 | HA31: 0 | HB31: 0 | HC31: 0 | HD31: 0 | HI31: 0 | HK31: 0 | HL31: null | HN31: 0 | HO31: 0 | HP31: 0 | HR31: 1800 | HS31: 0 | HT31: 0 | IE31: 0
A32: OBJECT | B32: 30 | C32: h00T | D32: hfoo | E32: 虚空军团Lv30 | F32: 0.21 | G32: =INT(RC[3]/20) -> 3007123 | H32: =INT(RC[2]/10) -> 6014246 | I32: 1500 | J32: = INT(4000*RC[-8]*POWER(10,0.09*RC[-8])) -> 60142468 | L32: 1.7 | M32: units\creeps\RevenantOfTheWaves\RevenantOfTheWaves | N32: ="let _u"&RC[-12]&" = new UnitAttackers('"&RC[-11]&"')" -> let _u30 = new UnitAttackers('h00T') | O32: =IF(MOD(RC[-13],3)<>0,"let _e"&RC[-13]&" = new EnemyAttackers("&RC[-13]&",_u"&RC[-13]&")","let _e"&RC[-13]&" = new EnemyAttackers("&RC[-13]&",_bu"&INT(RC[-13]/3)&")") -> let _e30 = new EnemyAttackers(30,_bu10) | S32: 30 | T32: 30 | AZ32: R000,R001 | BN32: Rifleman | BY32: null | BZ32: null | CF32: 1 | CJ32: 0 | CK32: 0 | DC32: 0 | DD32: 0 | DI32: 1 | DR32: 0.1 | DT32: 1 | DU32: 1 | ED32: 390 | EE32: 2.8 | EM32: normal | FF32: 0.2 | FG32: 0.1 | FH32: 300 | FJ32: 0 | GU32: 1 | GV32: human | GY32: 0 | GZ32: 0 | HA32: 0 | HB32: 0 | HC32: 0 | HD32: 0 | HI32: 0 | HK32: 0 | HL32: null | HN32: 0 | HO32: 0 | HP32: 0 | HR32: 1800 | HS32: 0 | HT32: 0 | IE32: 0
A33: COMMENT | C33: boss | AZ33: R000,R001 | BN33: Rifleman | BY33: null | BZ33: null | CF33: 1 | DC33: 0 | DD33: 0 | DI33: 1 | DR33: 0.1 | DT33: 1 | DU33: 1 | ED33: 390 | EE33: 2.8 | EM33: normal | FF33: 0.2 | FG33: 0.1 | FH33: 350 | FJ33: 0 | GU33: 1 | GV33: human | GY33: 0 | GZ33: 0 | HA33: 0 | HB33: 0 | HC33: 0 | HD33: 0 | HI33: 0 | HK33: 0 | HL33: null | HN33: 0 | HO33: 0 | HP33: 0 | HR33: 1800 | HS33: 0 | HT33: 0 | IE33: 0
A34: OBJECT | B34: 1 | C34: H100 | D34: Obla | E34: 虚空领主Lv1 | F34: 0.5 | G34: =INT(RC[3]/20) -> 5334 | H34: =INT(RC[2]/10) -> 10669 | I34: 5000 | J34: = INT(60000*RC[-8]*POWER(10,0.25*RC[-8])) -> 106696 | K34: 领主 | L34: 2.5 | M34: units\creeps\SpiderBlue\SpiderBlue | N34: ="let _bu"&R[-31]C[-12]&" = new BossAttackers('"&INDIRECT("C"&(RC[-12]*3+2))&"')" -> let _bu1 = new BossAttackers('h002') | O34: ="let _b"&RC[-13]&" = new UnitAttackers('"&RC[-12]&"')" -> let _b1 = new UnitAttackers('H100') | P34: =INT(RC[-6]/100) -> 1066 | Q34: =RC[-1] -> 1066 | R34: =RC[-1] -> 1066 | S34: 30 | T34: 30 | AZ34: R000,R001 | BN34: Rifleman | BY34: null | BZ34: null | CF34: 1 | DC34: 0 | DD34: 0 | DI34: 1 | DR34: 0.1 | DT34: 1 | DU34: 1 | ED34: 390 | EE34: 2.8 | EM34: normal | FF34: 0.2 | FG34: 0.1 | FH34: 350 | FJ34: 0 | GU34: 1 | GV34: human | GY34: 0 | GZ34: 0 | HA34: 0 | HB34: 0 | HC34: 0 | HD34: 0 | HI34: 0 | HK34: 0 | HL34: null | HN34: 0 | HO34: 0 | HP34: 0 | HR34: 1800 | HS34: 0 | HT34: 0 | IE34: 0
A35: OBJECT | B35: 2 | C35: H101 | D35: Obla | E35: 虚空领主Lv2 | F35: 0.47 | G35: =INT(RC[3]/20) -> 18973 | H35: =INT(RC[2]/10) -> 37947 | I35: 10000 | J35: = INT(60000*RC[-8]*POWER(10,0.25*RC[-8])) -> 379473 | K35: 领主 | L35: 2.5 | M35: Units\Creeps\Hydra\Hydra | N35: ="let _bu"&R[-31]C[-12]&" = new BossAttackers('"&INDIRECT("C"&(RC[-12]*3+2))&"')" -> let _bu2 = new BossAttackers('h005') | O35: ="let _b"&RC[-13]&" = new UnitAttackers('"&RC[-12]&"')" -> let _b2 = new UnitAttackers('H101') | P35: =INT(RC[-6]/100) -> 3794 | Q35: =RC[-1] -> 3794 | R35: =RC[-1] -> 3794 | S35: 60 | T35: 60 | AZ35: R000,R001 | BN35: Rifleman | BY35: null | BZ35: null | CF35: 1 | DC35: 0 | DD35: 0 | DI35: 1 | DR35: 0.1 | DT35: 1 | DU35: 1 | ED35: 390 | EE35: 2.8 | EM35: normal | FF35: 0.2 | FG35: 0.1 | FH35: 350 | FJ35: 0 | GU35: 1 | GV35: human | GY35: 0 | GZ35: 0 | HA35: 0 | HB35: 0 | HC35: 0 | HD35: 0 | HI35: 0 | HK35: 0 | HL35: null | HN35: 0 | HO35: 0 | HP35: 0 | HR35: 1800 | HS35: 0 | HT35: 0 | IE35: 0
A36: OBJECT | B36: 3 | C36: H102 | D36: Obla | E36: 虚空领主Lv3 | F36: 0.44 | G36: =INT(RC[3]/20) -> 50610 | H36: =INT(RC[2]/10) -> 101221 | I36: 15000 | J36: = INT(60000*RC[-8]*POWER(10,0.25*RC[-8])) -> 1012214 | K36: 领主 | L36: 2.5 | M36: units\creeps\NerubianQueen\NerubianQueen | N36: ="let _bu"&R[-31]C[-12]&" = new BossAttackers('"&INDIRECT("C"&(RC[-12]*3+2))&"')" -> let _bu3 = new BossAttackers('h008') | O36: ="let _b"&RC[-13]&" = new UnitAttackers('"&RC[-12]&"')" -> let _b3 = new UnitAttackers('H102') | P36: =INT(RC[-6]/100) -> 10122 | Q36: =RC[-1] -> 10122 | R36: =RC[-1] -> 10122 | S36: 90 | T36: 90 | AZ36: R000,R001 | BN36: Rifleman | BY36: null | BZ36: null | CF36: 1 | DC36: 0 | DD36: 0 | DI36: 1 | DR36: 0.1 | DT36: 1 | DU36: 1 | ED36: 390 | EE36: 2.8 | EM36: normal | FF36: 0.2 | FG36: 0.1 | FH36: 350 | FJ36: 0 | GU36: 1 | GV36: human | GY36: 0 | GZ36: 0 | HA36: 0 | HB36: 0 | HC36: 0 | HD36: 0 | HI36: 0 | HK36: 0 | HL36: null | HN36: 0 | HO36: 0 | HP36: 0 | HR36: 1800 | HS36: 0 | HT36: 0 | IE36: 0
A37: OBJECT | B37: 4 | C37: H103 | D37: Obla | E37: 虚空领主Lv4 | F37: 0.41 | G37: =INT(RC[3]/20) -> 120000 | H37: =INT(RC[2]/10) -> 240000 | I37: 20000 | J37: = INT(60000*RC[-8]*POWER(10,0.25*RC[-8])) -> 2400000 | K37: 领主 | L37: 2.5 | M37: units\creeps\VoidWalker\VoidWalker | N37: ="let _bu"&R[-31]C[-12]&" = new BossAttackers('"&INDIRECT("C"&(RC[-12]*3+2))&"')" -> let _bu4 = new BossAttackers('h00B') | O37: ="let _b"&RC[-13]&" = new UnitAttackers('"&RC[-12]&"')" -> let _b4 = new UnitAttackers('H103') | P37: =INT(RC[-6]/100) -> 24000 | Q37: =RC[-1] -> 24000 | R37: =RC[-1] -> 24000 | S37: 120 | T37: 120 | AZ37: R000,R001 | BN37: Rifleman | BY37: null | BZ37: null | CF37: 1 | DC37: 0 | DD37: 0 | DI37: 1 | DR37: 0.1 | DT37: 1 | DU37: 1 | ED37: 390 | EE37: 2.8 | EM37: normal | FF37: 0.2 | FG37: 0.1 | FH37: 350 | FJ37: 0 | GU37: 1 | GV37: human | GY37: 0 | GZ37: 0 | HA37: 0 | HB37: 0 | HC37: 0 | HD37: 0 | HI37: 0 | HK37: 0 | HL37: null | HN37: 0 | HO37: 0 | HP37: 0 | HR37: 1800 | HS37: 0 | HT37: 0 | IE37: 0
A38: OBJECT | B38: 5 | C38: H104 | D38: Obla | E38: 虚空领主Lv5 | F38: 0.38 | G38: =INT(RC[3]/20) -> 266741 | H38: =INT(RC[2]/10) -> 533483 | I38: 25000 | J38: = INT(60000*RC[-8]*POWER(10,0.25*RC[-8])) -> 5334838 | K38: 领主 | L38: 2.5 | M38: Units\Creeps\FacelessOne\FacelessOne | N38: ="let _bu"&R[-31]C[-12]&" = new BossAttackers('"&INDIRECT("C"&(RC[-12]*3+2))&"')" -> let _bu5 = new BossAttackers('h00E') | O38: ="let _b"&RC[-13]&" = new UnitAttackers('"&RC[-12]&"')" -> let _b5 = new UnitAttackers('H104') | P38: =INT(RC[-6]/100) -> 53348 | Q38: =RC[-1] -> 53348 | R38: =RC[-1] -> 53348 | S38: 150 | T38: 150 | AZ38: R000,R001 | BN38: Rifleman | BY38: null | BZ38: null | CF38: 1 | DC38: 0 | DD38: 0 | DI38: 1 | DR38: 0.1 | DT38: 1 | DU38: 1 | ED38: 390 | EE38: 2.8 | EM38: normal | FF38: 0.2 | FG38: 0.1 | FH38: 350 | FJ38: 0 | GU38: 1 | GV38: human | GY38: 0 | GZ38: 0 | HA38: 0 | HB38: 0 | HC38: 0 | HD38: 0 | HI38: 0 | HK38: 0 | HL38: null | HN38: 0 | HO38: 0 | HP38: 0 | HR38: 1800 | HS38: 0 | HT38: 0 | IE38: 0
A39: OBJECT | B39: 6 | C39: H105 | D39: Obla | E39: 虚空领主Lv6 | F39: 0.35 | G39: =INT(RC[3]/20) -> 569209 | H39: =INT(RC[2]/10) -> 1138419 | I39: 30000 | J39: = INT(60000*RC[-8]*POWER(10,0.25*RC[-8])) -> 11384199 | K39: 领主 | L39: 2.5 | M39: units\undead\EvilArthas\UndeadArthas | N39: ="let _bu"&R[-31]C[-12]&" = new BossAttackers('"&INDIRECT("C"&(RC[-12]*3+2))&"')" -> let _bu6 = new BossAttackers('h00H') | O39: ="let _b"&RC[-13]&" = new UnitAttackers('"&RC[-12]&"')" -> let _b6 = new UnitAttackers('H105') | P39: =INT(RC[-6]/100) -> 113841 | Q39: =RC[-1] -> 113841 | R39: =RC[-1] -> 113841 | S39: 180 | T39: 180 | AZ39: R000,R001 | BN39: Rifleman | BY39: null | BZ39: null | CF39: 1 | DC39: 0 | DD39: 0 | DI39: 1 | DR39: 0.1 | DT39: 1 | DU39: 1 | ED39: 390 | EE39: 2.8 | EM39: normal | FF39: 0.2 | FG39: 0.1 | FH39: 350 | FJ39: 0 | GU39: 1 | GV39: human | GY39: 0 | GZ39: 0 | HA39: 0 | HB39: 0 | HC39: 0 | HD39: 0 | HI39: 0 | HK39: 0 | HL39: null | HN39: 0 | HO39: 0 | HP39: 0 | HR39: 1800 | HS39: 0 | HT39: 0 | IE39: 0
A40: OBJECT | B40: 7 | C40: H106 | D40: Obla | E40: 虚空领主Lv7 | F40: 0.32 | G40: =INT(RC[3]/20) -> 1180916 | H40: =INT(RC[2]/10) -> 2361833 | I40: 35000 | J40: = INT(60000*RC[-8]*POWER(10,0.25*RC[-8])) -> 23618335 | K40: 领主 | L40: 2.5 | M40: units\demon\PitLord\PitLord | N40: ="let _bu"&R[-31]C[-12]&" = new BossAttackers('"&INDIRECT("C"&(RC[-12]*3+2))&"')" -> let _bu7 = new BossAttackers('h00K') | O40: ="let _b"&RC[-13]&" = new UnitAttackers('"&RC[-12]&"')" -> let _b7 = new UnitAttackers('H106') | P40: =INT(RC[-6]/100) -> 236183 | Q40: =RC[-1] -> 236183 | R40: =RC[-1] -> 236183 | S40: 210 | T40: 210 | AZ40: R000,R001 | BN40: Rifleman | BY40: null | BZ40: null | CF40: 1 | DC40: 0 | DD40: 0 | DI40: 1 | DR40: 0.1 | DT40: 1 | DU40: 1 | ED40: 390 | EE40: 2.8 | EM40: normal | FF40: 0.2 | FG40: 0.1 | FH40: 350 | FJ40: 0 | GU40: 1 | GV40: human | GY40: 0 | GZ40: 0 | HA40: 0 | HB40: 0 | HC40: 0 | HD40: 0 | HI40: 0 | HK40: 0 | HL40: null | HN40: 0 | HO40: 0 | HP40: 0 | HR40: 1800 | HS40: 0 | HT40: 0 | IE40: 0
A41: OBJECT | B41: 8 | C41: H107 | D41: Obla | E41: 虚空领主Lv8 | F41: 0.28999999999999998 | G41: =INT(RC[3]/20) -> 2400000 | H41: =INT(RC[2]/10) -> 4800000 | I41: 40000 | J41: = INT(60000*RC[-8]*POWER(10,0.25*RC[-8])) -> 48000000 | K41: 领主 | L41: 2.5 | M41: units\demon\Warlock\Warlock | N41: ="let _bu"&R[-31]C[-12]&" = new BossAttackers('"&INDIRECT("C"&(RC[-12]*3+2))&"')" -> let _bu8 = new BossAttackers('h00N') | O41: ="let _b"&RC[-13]&" = new UnitAttackers('"&RC[-12]&"')" -> let _b8 = new UnitAttackers('H107') | P41: =INT(RC[-6]/100) -> 480000 | Q41: =RC[-1] -> 480000 | R41: =RC[-1] -> 480000 | S41: 240 | T41: 240 | AZ41: R000,R001 | BN41: Rifleman | BY41: null | BZ41: null | CF41: 1 | DC41: 0 | DD41: 0 | DI41: 1 | DR41: 0.1 | DT41: 1 | DU41: 1 | ED41: 390 | EE41: 2.8 | EM41: normal | FF41: 0.2 | FG41: 0.1 | FH41: 350 | FJ41: 0 | GU41: 1 | GV41: human | GY41: 0 | GZ41: 0 | HA41: 0 | HB41: 0 | HC41: 0 | HD41: 0 | HI41: 0 | HK41: 0 | HL41: null | HN41: 0 | HO41: 0 | HP41: 0 | HR41: 1800 | HS41: 0 | HT41: 0 | IE41: 0
A42: OBJECT | B42: 9 | C42: H108 | D42: Obla | E42: 虚空领主Lv9 | F42: 0.26 | G42: =INT(RC[3]/20) -> 4801354 | H42: =INT(RC[2]/10) -> 9602708 | I42: 45000 | J42: = INT(60000*RC[-8]*POWER(10,0.25*RC[-8])) -> 96027088 | K42: 领主 | L42: 2.5 | M42: units\undead\Anubarak\Anubarak | N42: ="let _bu"&R[-31]C[-12]&" = new BossAttackers('"&INDIRECT("C"&(RC[-12]*3+2))&"')" -> let _bu9 = new BossAttackers('h00Q') | O42: ="let _b"&RC[-13]&" = new UnitAttackers('"&RC[-12]&"')" -> let _b9 = new UnitAttackers('H108') | P42: =INT(RC[-6]/100) -> 960270 | Q42: =RC[-1] -> 960270 | R42: =RC[-1] -> 960270 | S42: 270 | T42: 270 | AZ42: R000,R001 | BN42: Rifleman | BY42: null | BZ42: null | CF42: 1 | DC42: 0 | DD42: 0 | DI42: 1 | DR42: 0.1 | DT42: 1 | DU42: 1 | ED42: 390 | EE42: 2.8 | EM42: normal | FF42: 0.2 | FG42: 0.1 | FH42: 350 | FJ42: 0 | GU42: 1 | GV42: human | GY42: 0 | GZ42: 0 | HA42: 0 | HB42: 0 | HC42: 0 | HD42: 0 | HI42: 0 | HK42: 0 | HL42: null | HN42: 0 | HO42: 0 | HP42: 0 | HR42: 1800 | HS42: 0 | HT42: 0 | IE42: 0
A43: OBJECT | B43: 10 | C43: H109 | D43: Obla | E43: 虚空领主Lv10 | F43: 0.23 | G43: =INT(RC[3]/20) -> 9486832 | H43: =INT(RC[2]/20) -> 9486832 | I43: 50000 | J43: = INT(60000*RC[-8]*POWER(10,0.25*RC[-8])) -> 189736659 | K43: 领主 | L43: 2.5 | M43: units\undead\Tichondrius\Tichondrius | N43: ="let _bu"&R[-31]C[-12]&" = new BossAttackers('"&INDIRECT("C"&(RC[-12]*3+2))&"')" -> let _bu10 = new BossAttackers('h00T') | O43: ="let _b"&RC[-13]&" = new UnitAttackers('"&RC[-12]&"')" -> let _b10 = new UnitAttackers('H109') | P43: =INT(RC[-6]/100) -> 1897366 | Q43: =RC[-1] -> 1897366 | R43: =RC[-1] -> 1897366 | S43: 300 | T43: 300 | AZ43: R000,R001 | BN43: Rifleman | BY43: null | BZ43: null | CF43: 1 | DC43: 0 | DD43: 0 | DI43: 1 | DR43: 0.1 | DT43: 1 | DU43: 1 | ED43: 390 | EE43: 2.8 | EM43: normal | FF43: 0.2 | FG43: 0.1 | FH43: 350 | FJ43: 0 | GU43: 1 | GV43: human | GY43: 0 | GZ43: 0 | HA43: 0 | HB43: 0 | HC43: 0 | HD43: 0 | HI43: 0 | HK43: 0 | HL43: null | HN43: 0 | HO43: 0 | HP43: 0 | HR43: 1800 | HS43: 0 | HT43: 0 | IE43: 0
A44: OBJECT | B44: 1 | C44: H10A | D44: Obla | E44: 上古之神-克苏恩 | F44: 0.1 | G44: =INT(RC[3]/40) -> 10500000 | H44: 19000000 | I44: 100000 | J44: 420000000 | K44: 古神 | L44: 3 | M44: units\other\DalaranReject\DalaranReject | N44: ="let _fb"&RC[-12]&" = new UnitAttackers('"&RC[-11]&"')" -> let _fb1 = new UnitAttackers('H10A') | O44: ="let _b"&RC[-13]&" = new UnitAttackers('"&RC[-12]&"')" -> let _b1 = new UnitAttackers('H10A') | P44: =INT(RC[-6]/100) -> 4200000 | Q44: =RC[-1] -> 4200000 | R44: =RC[-1] -> 4200000 | S44: 0 | T44: 0 | AZ44: R000,R001 | BN44: Rifleman | BY44: null | BZ44: null | CF44: 1 | CI44: 0 | CJ44: 0 | CK44: 0 | DC44: 0 | DD44: 0 | DI44: 1 | DR44: 0.1 | DT44: 1 | DU44: 1 | ED44: 390 | EE44: 2.8 | EM44: normal | FF44: 0.2 | FG44: 0.1 | FH44: 350 | FJ44: 0 | GU44: 1 | GV44: human | GY44: 0 | GZ44: 0 | HA44: 0 | HB44: 0 | HC44: 0 | HD44: 0 | HI44: 0 | HK44: 0 | HL44: null | HN44: 0 | HO44: 0 | HP44: 0 | HR44: 1800 | HS44: 0 | HT44: 0 | IE44: 0
A45: OBJECT | B45: 2 | C45: H10B | D45: Obla | E45: 上古之神-尤格-萨隆 | F45: 0.1 | G45: =INT(RC[3]/40) -> 11750000 | H45: 18500000 | I45: 100000 | J45: 470000000 | K45: 古神 | L45: 3 | M45: Units\Creeps\ForgottenOne\ForgottenOne | N45: ="let _fb"&RC[-12]&" = new UnitAttackers('"&RC[-11]&"')" -> let _fb2 = new UnitAttackers('H10B') | P45: =INT(RC[-6]/100) -> 4700000 | Q45: =RC[-1] -> 4700000 | R45: =RC[-1] -> 4700000 | S45: 0 | T45: 0 | AZ45: R000,R001 | BN45: Rifleman | BY45: null | BZ45: null | CF45: 1 | CI45: 0 | CJ45: 0 | CK45: 0 | DC45: 0 | DD45: 0 | DI45: 1 | DR45: 0.1 | DT45: 1 | DU45: 1 | ED45: 390 | EE45: 2.8 | EM45: normal | FF45: 0.2 | FG45: 0.1 | FH45: 350 | FJ45: 0 | GU45: 1 | GV45: human | GY45: 0 | GZ45: 0 | HA45: 0 | HB45: 0 | HC45: 0 | HD45: 0 | HI45: 0 | HK45: 0 | HL45: null | HN45: 0 | HO45: 0 | HP45: 0 | HR45: 1800 | HS45: 0 | HT45: 0 | IE45: 0
A46: OBJECT | B46: 3 | C46: H10C | D46: Obla | E46: 上古之神-亚煞极 | F46: 0.1 | G46: =INT(RC[3]/40) -> 12000000 | H46: 18000000 | I46: 100000 | J46: 480000000 | K46: 古神 | L46: 3 | M46: Units\Creeps\HeroFlameLord\HeroFlameLord | N46: ="let _fb"&RC[-12]&" = new UnitAttackers('"&RC[-11]&"')" -> let _fb3 = new UnitAttackers('H10C') | P46: =INT(RC[-6]/100) -> 4800000 | Q46: =RC[-1] -> 4800000 | R46: =RC[-1] -> 4800000 | S46: 0 | T46: 0 | AZ46: R000,R001 | BN46: Rifleman | BY46: null | BZ46: null | CF46: 1 | CI46: 0 | CJ46: 0 | CK46: 0 | DC46: 0 | DD46: 0 | DI46: 1 | DR46: 0.1 | DT46: 1 | DU46: 1 | ED46: 390 | EE46: 2.8 | EM46: normal | FF46: 0.2 | FG46: 0.1 | FH46: 350 | FJ46: 0 | GU46: 1 | GV46: human | GY46: 0 | GZ46: 0 | HA46: 0 | HB46: 0 | HC46: 0 | HD46: 0 | HI46: 0 | HK46: 0 | HL46: null | HN46: 0 | HO46: 0 | HP46: 0 | HR46: 1800 | HS46: 0 | HT46: 0 | IE46: 0
A47: OBJECT | B47: 4 | C47: H10D | D47: Obla | E47: 上古之神-恩佐斯 | F47: 0.1 | G47: =INT(RC[3]/40) -> 12250000 | H47: 17000000 | I47: 100000 | J47: 490000000 | K47: 古神 | L47: 3 | M47: Units\Creeps\LavaSpawn\LavaSpawn | N47: ="let _fb"&RC[-12]&" = new UnitAttackers('"&RC[-11]&"')" -> let _fb4 = new UnitAttackers('H10D') | P47: =INT(RC[-6]/100) -> 4900000 | Q47: =RC[-1] -> 4900000 | R47: =RC[-1] -> 4900000 | S47: 0 | T47: 0 | AZ47: R000,R001 | BN47: Rifleman | BY47: null | BZ47: null | CF47: 1 | CI47: 0 | CJ47: 0 | CK47: 0 | DC47: 0 | DD47: 0 | DI47: 1 | DR47: 0.1 | DT47: 1 | DU47: 1 | ED47: 390 | EE47: 2.8 | EM47: normal | FF47: 0.2 | FG47: 0.1 | FH47: 350 | FJ47: 0 | GU47: 1 | GV47: human | GY47: 0 | GZ47: 0 | HA47: 0 | HB47: 0 | HC47: 0 | HD47: 0 | HI47: 0 | HK47: 0 | HL47: null | HN47: 0 | HO47: 0 | HP47: 0 | HR47: 1800 | HS47: 0 | HT47: 0 | IE47: 0
A48: OBJECT | B48: 5 | C48: H10E | D48: Obla | E48: 上古之神-萨拉塔斯 | F48: 0.1 | G48: =INT(RC[3]/40) -> 12250000 | H48: 17000000 | I48: 100000 | J48: 490000000 | K48: 古神 | L48: 3 | M48: units\creeps\Sasquatch\Sasquatch | N48: ="let _fb"&RC[-12]&" = new UnitAttackers('"&RC[-11]&"')" -> let _fb5 = new UnitAttackers('H10E') | P48: =INT(RC[-6]/100) -> 4900000 | Q48: =RC[-1] -> 4900000 | R48: =RC[-1] -> 4900000 | S48: 0 | T48: 0 | AZ48: R000,R001 | BN48: Rifleman | BY48: null | BZ48: null | CF48: 1 | CI48: 0 | CJ48: 0 | CK48: 0 | DC48: 0 | DD48: 0 | DI48: 1 | DR48: 0.1 | DT48: 1 | DU48: 1 | ED48: 390 | EE48: 2.8 | EM48: normal | FF48: 0.2 | FG48: 0.1 | FH48: 350 | FJ48: 0 | GU48: 1 | GV48: human | GY48: 0 | GZ48: 0 | HA48: 0 | HB48: 0 | HC48: 0 | HD48: 0 | HI48: 0 | HK48: 0 | HL48: null | HN48: 0 | HO48: 0 | HP48: 0 | HR48: 1800 | HS48: 0 | HT48: 0 | IE48: 0
A49: OBJECT | B49: 6 | C49: H10G | D49: Obla | E49: 虚空大君 | F49: 0.1 | G49: =INT(RC[3]/60) -> 13333333 | H49: 20000000 | I49: 500000 | J49: 800000000 | K49: 虚空 | L49: 3.5 | M49: model\boss\VoidEmperor.mdx | N49: ="let _fb"&RC[-12]&" = new UnitAttackers('"&RC[-11]&"')" -> let _fb6 = new UnitAttackers('H10G') | P49: =INT(RC[-6]/100) -> 8000000 | Q49: =RC[-1] -> 8000000 | R49: =RC[-1] -> 8000000 | S49: 0 | T49: 0 | AZ49: R000,R001 | BN49: Rifleman | BY49: null | BZ49: null | CF49: 1 | CI49: 0 | CJ49: 0 | CK49: 0 | DC49: 0 | DD49: 0 | DI49: 1 | DR49: 0.1 | DT49: 1 | DU49: 1 | ED49: 390 | EE49: 2.8 | EM49: normal | FF49: 0.2 | FG49: 0.1 | FH49: 350 | FJ49: 0 | GU49: 1 | GV49: human | GY49: 0 | GZ49: 0 | HA49: 0 | HB49: 0 | HC49: 0 | HD49: 0 | HI49: 0 | HK49: 0 | HL49: null | HN49: 0 | HO49: 0 | HP49: 0 | HR49: 1800 | HS49: 0 | HT49: 0 | IE49: 0

Sheet: Sheet2
A1: 波次 | B1: 血量公式 | C1: 防御公式 | D1: 攻击公式
A2: 1 | B2: 200 | C2: 1000
A3: 18 | B3: 25000 | C3: 5000
A4: 36 | B4: 3000000 | C4: 10000